Sheet: 配置
A1: 服务端文件名 | B1: 服务端对应工作表号 | C1: 客户端文件名 | D1: 客户端对应工作表号 | E1: erl头部 | F1: erl内容格式 | G1: erl尾部 | H1: 客户端特殊处理
A2: config_achievement.txt | B2: 1 | C2: config_achievement.cnf|Achievement | D2: 1 | F2: get(id) -> #$ | H2: 1=>id,level|level_list

Sheet: 成就配置
A1: id|id | B1: icon_id| | C1: level|level | D1: need_role_level|need_role_level | E1: value|value | F1: award_item_id|award_item_id | G1: award_item_num|award_item_num | H1: desc| | I1: systemid|
A2: 不可空 | B2: 不可空 | C2: 不可空 | D2: 不可空 | E2: 不可空 | F2: 不可空 | G2: 不可空 | H2: 不可空 | I2: 不可空
A3: 数字 | B3: 字符串 | C3: 数字 | D3: 数字 | E3: 数字 | F3: 数字 | G3: 数字 | H3: 字符串 | I3: 数字
A6: 成就ID | B6: 成就图标ID | C6: 成就等级 | D6: 需要的角色等级 | E6: 需要的上下文值 | F6: 奖励的物品ID | G6: 奖励的物品数量 | H6: 成就描述 | I6: 前往的系统Id
A7: 1 | B7: btn_shop | C7: 1 | D7: 1 | E7: 1 | F7: 19005 | G7: 50 | H7: =VLOOKUP(RC[-7],Sheet1!R2C1:R28C4,2,FALSE)&VLOOKUP(RC[-7],Sheet1!R2C1:R28C4,3,FALSE)&IF(VLOOKUP(RC[-7],Sheet1!R2C1:R28C4,4,FALSE)="品",VLOOKUP(RC[-3],Sheet1!R2C8:R6C9,2,FALSE),RC[-3])&VLOOKUP(RC[-7],Sheet1!R2C1:R28C4,4,FALSE) -> VIP等级达到1级 | I7: 50 | J7: =VLOOKUP(RC[-9],Sheet1!R2C1:R28C6,6,FALSE) -> 钻石
A8: 1 | B8: btn_shop | C8: 2 | D8: 1 | E8: 2 | F8: 19005 | G8: 100 | H8: =VLOOKUP(RC[-7],Sheet1!R2C1:R28C4,2,FALSE)&VLOOKUP(RC[-7],Sheet1!R2C1:R28C4,3,FALSE)&IF(VLOOKUP(RC[-7],Sheet1!R2C1:R28C4,4,FALSE)="品",VLOOKUP(RC[-3],Sheet1!R2C8:R6C9,2,FALSE),RC[-3])&VLOOKUP(RC[-7],Sheet1!R2C1:R28C4,4,FALSE) -> VIP等级达到2级 | I8: 50 | J8: =VLOOKUP(RC[-9],Sheet1!R2C1:R28C6,6,FALSE) -> 钻石
A9: 1 | B9: btn_shop | C9: 3 | D9: 1 | E9: 3 | F9: 19005 | G9: 150 | H9: =VLOOKUP(RC[-7],Sheet1!R2C1:R28C4,2,FALSE)&VLOOKUP(RC[-7],Sheet1!R2C1:R28C4,3,FALSE)&IF(VLOOKUP(RC[-7],Sheet1!R2C1:R28C4,4,FALSE)="品",VLOOKUP(RC[-3],Sheet1!R2C8:R6C9,2,FALSE),RC[-3])&VLOOKUP(RC[-7],Sheet1!R2C1:R28C4,4,FALSE) -> VIP等级达到3级 | I9: 50 | J9: =VLOOKUP(RC[-9],Sheet1!R2C1:R28C6,6,FALSE) -> 钻石
A10: 1 | B10: btn_shop | C10: 4 | D10: 1 | E10: 4 | F10: 19005 | G10: 200 | H10: =VLOOKUP(RC[-7],Sheet1!R2C1:R28C4,2,FALSE)&VLOOKUP(RC[-7],Sheet1!R2C1:R28C4,3,FALSE)&IF(VLOOKUP(RC[-7],Sheet1!R2C1:R28C4,4,FALSE)="品",VLOOKUP(RC[-3],Sheet1!R2C8:R6C9,2,FALSE),RC[-3])&VLOOKUP(RC[-7],Sheet1!R2C1:R28C4,4,FALSE) -> VIP等级达到4级 | I10: 50 | J10: =VLOOKUP(RC[-9],Sheet1!R2C1:R28C6,6,FALSE) -> 钻石
A11: 1 | B11: btn_shop | C11: 5 | D11: 1 | E11: 5 | F11: 19005 | G11: 250 | H11: =VLOOKUP(RC[-7],Sheet1!R2C1:R28C4,2,FALSE)&VLOOKUP(RC[-7],Sheet1!R2C1:R28C4,3,FALSE)&IF(VLOOKUP(RC[-7],Sheet1!R2C1:R28C4,4,FALSE)="品",VLOOKUP(RC[-3],Sheet1!R2C8:R6C9,2,FALSE),RC[-3])&VLOOKUP(RC[-7],Sheet1!R2C1:R28C4,4,FALSE) -> VIP等级达到5级 | I11: 50 | J11: =VLOOKUP(RC[-9],Sheet1!R2C1:R28C6,6,FALSE) -> 钻石
A12: 1 | B12: btn_shop | C12: 6 | D12: 1 | E12: 6 | F12: 19005 | G12: 300 | H12: =VLOOKUP(RC[-7],Sheet1!R2C1:R28C4,2,FALSE)&VLOOKUP(RC[-7],Sheet1!R2C1:R28C4,3,FALSE)&IF(VLOOKUP(RC[-7],Sheet1!R2C1:R28C4,4,FALSE)="品",VLOOKUP(RC[-3],Sheet1!R2C8:R6C9,2,FALSE),RC[-3])&VLOOKUP(RC[-7],Sheet1!R2C1:R28C4,4,FALSE) -> VIP等级达到6级 | I12: 50 | J12: =VLOOKUP(RC[-9],Sheet1!R2C1:R28C6,6,FALSE) -> 钻石
A13: 1 | B13: btn_shop | C13: 7 | D13: 1 | E13: 7 | F13: 19005 | G13: 350 | H13: =VLOOKUP(RC[-7],Sheet1!R2C1:R28C4,2,FALSE)&VLOOKUP(RC[-7],Sheet1!R2C1:R28C4,3,FALSE)&IF(VLOOKUP(RC[-7],Sheet1!R2C1:R28C4,4,FALSE)="品",VLOOKUP(RC[-3],Sheet1!R2C8:R6C9,2,FALSE),RC[-3])&VLOOKUP(RC[-7],Sheet1!R2C1:R28C4,4,FALSE) -> VIP等级达到7级 | I13: 50 | J13: =VLOOKUP(RC[-9],Sheet1!R2C1:R28C6,6,FALSE) -> 钻石
A14: 1 | B14: btn_shop | C14: 8 | D14: 1 | E14: 8 | F14: 19005 | G14: 400 | H14: =VLOOKUP(RC[-7],Sheet1!R2C1:R28C4,2,FALSE)&VLOOKUP(RC[-7],Sheet1!R2C1:R28C4,3,FALSE)&IF(VLOOKUP(RC[-7],Sheet1!R2C1:R28C4,4,FALSE)="品",VLOOKUP(RC[-3],Sheet1!R2C8:R6C9,2,FALSE),RC[-3])&VLOOKUP(RC[-7],Sheet1!R2C1:R28C4,4,FALSE) -> VIP等级达到8级 | I14: 50 | J14: =VLOOKUP(RC[-9],Sheet1!R2C1:R28C6,6,FALSE) -> 钻石
A15: 1 | B15: btn_shop | C15: 9 | D15: 1 | E15: 9 | F15: 19005 | G15: 450 | H15: =VLOOKUP(RC[-7],Sheet1!R2C1:R28C4,2,FALSE)&VLOOKUP(RC[-7],Sheet1!R2C1:R28C4,3,FALSE)&IF(VLOOKUP(RC[-7],Sheet1!R2C1:R28C4,4,FALSE)="品",VLOOKUP(RC[-3],Sheet1!R2C8:R6C9,2,FALSE),RC[-3])&VLOOKUP(RC[-7],Sheet1!R2C1:R28C4,4,FALSE) -> VIP等级达到9级 | I15: 50 | J15: =VLOOKUP(RC[-9],Sheet1!R2C1:R28C6,6,FALSE) -> 钻石
A16: 1 | B16: btn_shop | C16: 10 | D16: 1 | E16: 10 | F16: 19005 | G16: 500 | H16: =VLOOKUP(RC[-7],Sheet1!R2C1:R28C4,2,FALSE)&VLOOKUP(RC[-7],Sheet1!R2C1:R28C4,3,FALSE)&IF(VLOOKUP(RC[-7],Sheet1!R2C1:R28C4,4,FALSE)="品",VLOOKUP(RC[-3],Sheet1!R2C8:R6C9,2,FALSE),RC[-3])&VLOOKUP(RC[-7],Sheet1!R2C1:R28C4,4,FALSE) -> VIP等级达到10级 | I16: 50 | J16: =VLOOKUP(RC[-9],Sheet1!R2C1:R28C6,6,FALSE) -> 钻石
A17: 1 | B17: btn_shop | C17: 11 | D17: 1 | E17: 11 | F17: 19005 | G17: 600 | H17: =VLOOKUP(RC[-7],Sheet1!R2C1:R28C4,2,FALSE)&VLOOKUP(RC[-7],Sheet1!R2C1:R28C4,3,FALSE)&IF(VLOOKUP(RC[-7],Sheet1!R2C1:R28C4,4,FALSE)="品",VLOOKUP(RC[-3],Sheet1!R2C8:R6C9,2,FALSE),RC[-3])&VLOOKUP(RC[-7],Sheet1!R2C1:R28C4,4,FALSE) -> VIP等级达到11级 | I17: 50 | J17: =VLOOKUP(RC[-9],Sheet1!R2C1:R28C6,6,FALSE) -> 钻石
A18: 1 | B18: btn_shop | C18: 12 | D18: 1 | E18: 12 | F18: 19005 | G18: 700 | H18: =VLOOKUP(RC[-7],Sheet1!R2C1:R28C4,2,FALSE)&VLOOKUP(RC[-7],Sheet1!R2C1:R28C4,3,FALSE)&IF(VLOOKUP(RC[-7],Sheet1!R2C1:R28C4,4,FALSE)="品",VLOOKUP(RC[-3],Sheet1!R2C8:R6C9,2,FALSE),RC[-3])&VLOOKUP(RC[-7],Sheet1!R2C1:R28C4,4,FALSE) -> VIP等级达到12级 | I18: 50 | J18: =VLOOKUP(RC[-9],Sheet1!R2C1:R28C6,6,FALSE) -> 钻石
A19: 1 | B19: btn_shop | C19: 13 | D19: 1 | E19: 13 | F19: 19005 | G19: 800 | H19: =VLOOKUP(RC[-7],Sheet1!R2C1:R28C4,2,FALSE)&VLOOKUP(RC[-7],Sheet1!R2C1:R28C4,3,FALSE)&IF(VLOOKUP(RC[-7],Sheet1!R2C1:R28C4,4,FALSE)="品",VLOOKUP(RC[-3],Sheet1!R2C8:R6C9,2,FALSE),RC[-3])&VLOOKUP(RC[-7],Sheet1!R2C1:R28C4,4,FALSE) -> VIP等级达到13级 | I19: 50 | J19: =VLOOKUP(RC[-9],Sheet1!R2C1:R28C6,6,FALSE) -> 钻石
A20: 1 | B20: btn_shop | C20: 14 | D20: 1 | E20: 14 | F20: 19005 | G20: 900 | H20: =VLOOKUP(RC[-7],Sheet1!R2C1:R28C4,2,FALSE)&VLOOKUP(RC[-7],Sheet1!R2C1:R28C4,3,FALSE)&IF(VLOOKUP(RC[-7],Sheet1!R2C1:R28C4,4,FALSE)="品",VLOOKUP(RC[-3],Sheet1!R2C8:R6C9,2,FALSE),RC[-3])&VLOOKUP(RC[-7],Sheet1!R2C1:R28C4,4,FALSE) -> VIP等级达到14级 | I20: 50 | J20: =VLOOKUP(RC[-9],Sheet1!R2C1:R28C6,6,FALSE) -> 钻石
A21: 1 | B21: btn_shop | C21: 15 | D21: 1 | E21: 15 | F21: 19005 | G21: 1000 | H21: =VLOOKUP(RC[-7],Sheet1!R2C1:R28C4,2,FALSE)&VLOOKUP(RC[-7],Sheet1!R2C1:R28C4,3,FALSE)&IF(VLOOKUP(RC[-7],Sheet1!R2C1:R28C4,4,FALSE)="品",VLOOKUP(RC[-3],Sheet1!R2C8:R6C9,2,FALSE),RC[-3])&VLOOKUP(RC[-7],Sheet1!R2C1:R28C4,4,FALSE) -> VIP等级达到15级 | I21: 50 | J21: =VLOOKUP(RC[-9],Sheet1!R2C1:R28C6,6,FALSE) -> 钻石
A22: 1 | B22: btn_shop | C22: 16 | D22: 1 | E22: 16 | F22: 19005 | G22: 1250 | H22: =VLOOKUP(RC[-7],Sheet1!R2C1:R28C4,2,FALSE)&VLOOKUP(RC[-7],Sheet1!R2C1:R28C4,3,FALSE)&IF(VLOOKUP(RC[-7],Sheet1!R2C1:R28C4,4,FALSE)="品",VLOOKUP(RC[-3],Sheet1!R2C8:R6C9,2,FALSE),RC[-3])&VLOOKUP(RC[-7],Sheet1!R2C1:R28C4,4,FALSE) -> VIP等级达到16级 | I22: 50 | J22: =VLOOKUP(RC[-9],Sheet1!R2C1:R28C6,6,FALSE) -> 钻石
A23: 2 | B23: btn_hero | C23: 1 | D23: 1 | E23: 15 | F23: 33100 | G23: 5 | H23: =VLOOKUP(RC[-7],Sheet1!R2C1:R28C4,2,FALSE)&VLOOKUP(RC[-7],Sheet1!R2C1:R28C4,3,FALSE)&IF(VLOOKUP(RC[-7],Sheet1!R2C1:R28C4,4,FALSE)="品",VLOOKUP(RC[-3],Sheet1!R2C8:R6C9,2,FALSE),RC[-3])&VLOOKUP(RC[-7],Sheet1!R2C1:R28C4,4,FALSE) -> 战队等级达到15级 | I23: 26 | J23: =VLOOKUP(RC[-9],Sheet1!R2C1:R28C6,6,FALSE) -> 传承核心 | K23: =VLOOKUP(INT(MOD(RC[-5],1000)/100),R23C12:R26C13,2,FALSE)*RC[-4] -> 5000 | L23: 1 | M23: 1000
A24: 2 | B24: btn_hero | C24: 2 | D24: 1 | E24: 20 | F24: 33100 | G24: 5 | H24: =VLOOKUP(RC[-7],Sheet1!R2C1:R28C4,2,FALSE)&VLOOKUP(RC[-7],Sheet1!R2C1:R28C4,3,FALSE)&IF(VLOOKUP(RC[-7],Sheet1!R2C1:R28C4,4,FALSE)="品",VLOOKUP(RC[-3],Sheet1!R2C8:R6C9,2,FALSE),RC[-3])&VLOOKUP(RC[-7],Sheet1!R2C1:R28C4,4,FALSE) -> 战队等级达到20级 | I24: 26 | J24: =VLOOKUP(RC[-9],Sheet1!R2C1:R28C6,6,FALSE) -> 传承核心 | K24: =VLOOKUP(INT(MOD(RC[-5],1000)/100),R23C12:R26C13,2,FALSE)*RC[-4] -> 5000 | L24: 2 | M24: 5000
A25: 2 | B25: btn_hero | C25: 3 | D25: 1 | E25: 25 | F25: 33100 | G25: 10 | H25: =VLOOKUP(RC[-7],Sheet1!R2C1:R28C4,2,FALSE)&VLOOKUP(RC[-7],Sheet1!R2C1:R28C4,3,FALSE)&IF(VLOOKUP(RC[-7],Sheet1!R2C1:R28C4,4,FALSE)="品",VLOOKUP(RC[-3],Sheet1!R2C8:R6C9,2,FALSE),RC[-3])&VLOOKUP(RC[-7],Sheet1!R2C1:R28C4,4,FALSE) -> 战队等级达到25级 | I25: 26 | J25: =VLOOKUP(RC[-9],Sheet1!R2C1:R28C6,6,FALSE) -> 传承核心 | K25: =VLOOKUP(INT(MOD(RC[-5],1000)/100),R23C12:R26C13,2,FALSE)*RC[-4] -> 10000 | L25: 3 | M25: 10000
A26: 2 | B26: btn_hero | C26: 4 | D26: 1 | E26: 30 | F26: 33100 | G26: 10 | H26: =VLOOKUP(RC[-7],Sheet1!R2C1:R28C4,2,FALSE)&VLOOKUP(RC[-7],Sheet1!R2C1:R28C4,3,FALSE)&IF(VLOOKUP(RC[-7],Sheet1!R2C1:R28C4,4,FALSE)="品",VLOOKUP(RC[-3],Sheet1!R2C8:R6C9,2,FALSE),RC[-3])&VLOOKUP(RC[-7],Sheet1!R2C1:R28C4,4,FALSE) -> 战队等级达到30级 | I26: 26 | J26: =VLOOKUP(RC[-9],Sheet1!R2C1:R28C6,6,FALSE) -> 传承核心 | K26: =VLOOKUP(INT(MOD(RC[-5],1000)/100),R23C12:R26C13,2,FALSE)*RC[-4] -> 10000 | L26: 4 | M26: 20000
A27: 2 | B27: btn_hero | C27: 5 | D27: 1 | E27: 35 | F27: 33200 | G27: 5 | H27: =VLOOKUP(RC[-7],Sheet1!R2C1:R28C4,2,FALSE)&VLOOKUP(RC[-7],Sheet1!R2C1:R28C4,3,FALSE)&IF(VLOOKUP(RC[-7],Sheet1!R2C1:R28C4,4,FALSE)="品",VLOOKUP(RC[-3],Sheet1!R2C8:R6C9,2,FALSE),RC[-3])&VLOOKUP(RC[-7],Sheet1!R2C1:R28C4,4,FALSE) -> 战队等级达到35级 | I27: 26 | J27: =VLOOKUP(RC[-9],Sheet1!R2C1:R28C6,6,FALSE) -> 传承核心 | K27: =VLOOKUP(INT(MOD(RC[-5],1000)/100),R23C12:R26C13,2,FALSE)*RC[-4] -> 25000
A28: 2 | B28: btn_hero | C28: 6 | D28: 1 | E28: 40 | F28: 33200 | G28: 5 | H28: =VLOOKUP(RC[-7],Sheet1!R2C1:R28C4,2,FALSE)&VLOOKUP(RC[-7],Sheet1!R2C1:R28C4,3,FALSE)&IF(VLOOKUP(RC[-7],Sheet1!R2C1:R28C4,4,FALSE)="品",VLOOKUP(RC[-3],Sheet1!R2C8:R6C9,2,FALSE),RC[-3])&VLOOKUP(RC[-7],Sheet1!R2C1:R28C4,4,FALSE) -> 战队等级达到40级 | I28: 26 | J28: =VLOOKUP(RC[-9],Sheet1!R2C1:R28C6,6,FALSE) -> 传承核心 | K28: =VLOOKUP(INT(MOD(RC[-5],1000)/100),R23C12:R26C13,2,FALSE)*RC[-4] -> 25000
A29: 2 | B29: btn_hero | C29: 7 | D29: 1 | E29: 45 | F29: 33200 | G29: 10 | H29: =VLOOKUP(RC[-7],Sheet1!R2C1:R28C4,2,FALSE)&VLOOKUP(RC[-7],Sheet1!R2C1:R28C4,3,FALSE)&IF(VLOOKUP(RC[-7],Sheet1!R2C1:R28C4,4,FALSE)="品",VLOOKUP(RC[-3],Sheet1!R2C8:R6C9,2,FALSE),RC[-3])&VLOOKUP(RC[-7],Sheet1!R2C1:R28C4,4,FALSE) -> 战队等级达到45级 | I29: 26 | J29: =VLOOKUP(RC[-9],Sheet1!R2C1:R28C6,6,FALSE) -> 传承核心 | K29: =VLOOKUP(INT(MOD(RC[-5],1000)/100),R23C12:R26C13,2,FALSE)*RC[-4] -> 50000
A30: 2 | B30: btn_hero | C30: 8 | D30: 1 | E30: 50 | F30: 33200 | G30: 10 | H30: =VLOOKUP(RC[-7],Sheet1!R2C1:R28C4,2,FALSE)&VLOOKUP(RC[-7],Sheet1!R2C1:R28C4,3,FALSE)&IF(VLOOKUP(RC[-7],Sheet1!R2C1:R28C4,4,FALSE)="品",VLOOKUP(RC[-3],Sheet1!R2C8:R6C9,2,FALSE),RC[-3])&VLOOKUP(RC[-7],Sheet1!R2C1:R28C4,4,FALSE) -> 战队等级达到50级 | I30: 26 | J30: =VLOOKUP(RC[-9],Sheet1!R2C1:R28C6,6,FALSE) -> 传承核心 | K30: =VLOOKUP(INT(MOD(RC[-5],1000)/100),R23C12:R26C13,2,FALSE)*RC[-4] -> 50000
A31: 2 | B31: btn_hero | C31: 9 | D31: 1 | E31: 55 | F31: 33300 | G31: 5 | H31: =VLOOKUP(RC[-7],Sheet1!R2C1:R28C4,2,FALSE)&VLOOKUP(RC[-7],Sheet1!R2C1:R28C4,3,FALSE)&IF(VLOOKUP(RC[-7],Sheet1!R2C1:R28C4,4,FALSE)="品",VLOOKUP(RC[-3],Sheet1!R2C8:R6C9,2,FALSE),RC[-3])&VLOOKUP(RC[-7],Sheet1!R2C1:R28C4,4,FALSE) -> 战队等级达到55级 | I31: 26 | J31: =VLOOKUP(RC[-9],Sheet1!R2C1:R28C6,6,FALSE) -> 传承核心 | K31: =VLOOKUP(INT(MOD(RC[-5],1000)/100),R23C12:R26C13,2,FALSE)*RC[-4] -> 50000
A32: 2 | B32: btn_hero | C32: 10 | D32: 1 | E32: 60 | F32: 33300 | G32: 5 | H32: =VLOOKUP(RC[-7],Sheet1!R2C1:R28C4,2,FALSE)&VLOOKUP(RC[-7],Sheet1!R2C1:R28C4,3,FALSE)&IF(VLOOKUP(RC[-7],Sheet1!R2C1:R28C4,4,FALSE)="品",VLOOKUP(RC[-3],Sheet1!R2C8:R6C9,2,FALSE),RC[-3])&VLOOKUP(RC[-7],Sheet1!R2C1:R28C4,4,FALSE) -> 战队等级达到60级 | I32: 26 | J32: =VLOOKUP(RC[-9],Sheet1!R2C1:R28C6,6,FALSE) -> 传承核心 | K32: =VLOOKUP(INT(MOD(RC[-5],1000)/100),R23C12:R26C13,2,FALSE)*RC[-4] -> 50000
A33: 2 | B33: btn_hero | C33: 11 | D33: 1 | E33: 65 | F33: 33300 | G33: 10 | H33: =VLOOKUP(RC[-7],Sheet1!R2C1:R28C4,2,FALSE)&VLOOKUP(RC[-7],Sheet1!R2C1:R28C4,3,FALSE)&IF(VLOOKUP(RC[-7],Sheet1!R2C1:R28C4,4,FALSE)="品",VLOOKUP(RC[-3],Sheet1!R2C8:R6C9,2,FALSE),RC[-3])&VLOOKUP(RC[-7],Sheet1!R2C1:R28C4,4,FALSE) -> 战队等级达到65级 | I33: 26 | J33: =VLOOKUP(RC[-9],Sheet1!R2C1:R28C6,6,FALSE) -> 传承核心 | K33: =VLOOKUP(INT(MOD(RC[-5],1000)/100),R23C12:R26C13,2,FALSE)*RC[-4] -> 100000
A34: 2 | B34: btn_hero | C34: 12 | D34: 1 | E34: 70 | F34: 33300 | G34: 10 | H34: =VLOOKUP(RC[-7],Sheet1!R2C1:R28C4,2,FALSE)&VLOOKUP(RC[-7],Sheet1!R2C1:R28C4,3,FALSE)&IF(VLOOKUP(RC[-7],Sheet1!R2C1:R28C4,4,FALSE)="品",VLOOKUP(RC[-3],Sheet1!R2C8:R6C9,2,FALSE),RC[-3])&VLOOKUP(RC[-7],Sheet1!R2C1:R28C4,4,FALSE) -> 战队等级达到70级 | I34: 26 | J34: =VLOOKUP(RC[-9],Sheet1!R2C1:R28C6,6,FALSE) -> 传承核心 | K34: =VLOOKUP(INT(MOD(RC[-5],1000)/100),R23C12:R26C13,2,FALSE)*RC[-4] -> 100000
A35: 2 | B35: btn_hero | C35: 13 | D35: 1 | E35: 75 | F35: 33400 | G35: 5 | H35: =VLOOKUP(RC[-7],Sheet1!R2C1:R28C4,2,FALSE)&VLOOKUP(RC[-7],Sheet1!R2C1:R28C4,3,FALSE)&IF(VLOOKUP(RC[-7],Sheet1!R2C1:R28C4,4,FALSE)="品",VLOOKUP(RC[-3],Sheet1!R2C8:R6C9,2,FALSE),RC[-3])&VLOOKUP(RC[-7],Sheet1!R2C1:R28C4,4,FALSE) -> 战队等级达到75级 | I35: 26 | J35: =VLOOKUP(RC[-9],Sheet1!R2C1:R28C6,6,FALSE) -> 传承核心 | K35: =VLOOKUP(INT(MOD(RC[-5],1000)/100),R23C12:R26C13,2,FALSE)*RC[-4] -> 100000
A36: 2 | B36: btn_hero | C36: 14 | D36: 1 | E36: 80 | F36: 33400 | G36: 5 | H36: =VLOOKUP(RC[-7],Sheet1!R2C1:R28C4,2,FALSE)&VLOOKUP(RC[-7],Sheet1!R2C1:R28C4,3,FALSE)&IF(VLOOKUP(RC[-7],Sheet1!R2C1:R28C4,4,FALSE)="品",VLOOKUP(RC[-3],Sheet1!R2C8:R6C9,2,FALSE),RC[-3])&VLOOKUP(RC[-7],Sheet1!R2C1:R28C4,4,FALSE) -> 战队等级达到80级 | I36: 26 | J36: =VLOOKUP(RC[-9],Sheet1!R2C1:R28C6,6,FALSE) -> 传承核心 | K36: =VLOOKUP(INT(MOD(RC[-5],1000)/100),R23C12:R26C13,2,FALSE)*RC[-4] -> 100000
A37: 2 | B37: btn_hero | C37: 15 | D37: 1 | E37: 85 | F37: 33400 | G37: 10 | H37: =VLOOKUP(RC[-7],Sheet1!R2C1:R28C4,2,FALSE)&VLOOKUP(RC[-7],Sheet1!R2C1:R28C4,3,FALSE)&IF(VLOOKUP(RC[-7],Sheet1!R2C1:R28C4,4,FALSE)="品",VLOOKUP(RC[-3],Sheet1!R2C8:R6C9,2,FALSE),RC[-3])&VLOOKUP(RC[-7],Sheet1!R2C1:R28C4,4,FALSE) -> 战队等级达到85级 | I37: 26 | J37: =VLOOKUP(RC[-9],Sheet1!R2C1:R28C6,6,FALSE) -> 传承核心 | K37: =VLOOKUP(INT(MOD(RC[-5],1000)/100),R23C12:R26C13,2,FALSE)*RC[-4] -> 200000
A38: 2 | B38: btn_hero | C38: 16 | D38: 1 | E38: 90 | F38: 33400 | G38: 10 | H38: =VLOOKUP(RC[-7],Sheet1!R2C1:R28C4,2,FALSE)&VLOOKUP(RC[-7],Sheet1!R2C1:R28C4,3,FALSE)&IF(VLOOKUP(RC[-7],Sheet1!R2C1:R28C4,4,FALSE)="品",VLOOKUP(RC[-3],Sheet1!R2C8:R6C9,2,FALSE),RC[-3])&VLOOKUP(RC[-7],Sheet1!R2C1:R28C4,4,FALSE) -> 战队等级达到90级 | I38: 26 | J38: =VLOOKUP(RC[-9],Sheet1!R2C1:R28C6,6,FALSE) -> 传承核心 | K38: =VLOOKUP(INT(MOD(RC[-5],1000)/100),R23C12:R26C13,2,FALSE)*RC[-4] -> 200000
A39: 2 | B39: btn_hero | C39: 17 | D39: 1 | E39: 95 | F39: 33400 | G39: 15 | H39: =VLOOKUP(RC[-7],Sheet1!R2C1:R28C4,2,FALSE)&VLOOKUP(RC[-7],Sheet1!R2C1:R28C4,3,FALSE)&IF(VLOOKUP(RC[-7],Sheet1!R2C1:R28C4,4,FALSE)="品",VLOOKUP(RC[-3],Sheet1!R2C8:R6C9,2,FALSE),RC[-3])&VLOOKUP(RC[-7],Sheet1!R2C1:R28C4,4,FALSE) -> 战队等级达到95级 | I39: 26 | J39: =VLOOKUP(RC[-9],Sheet1!R2C1:R28C6,6,FALSE) -> 传承核心 | K39: =VLOOKUP(INT(MOD(RC[-5],1000)/100),R23C12:R26C13,2,FALSE)*RC[-4] -> 300000
A40: 2 | B40: btn_hero | C40: 18 | D40: 1 | E40: 100 | F40: 33400 | G40: 15 | H40: =VLOOKUP(RC[-7],Sheet1!R2C1:R28C4,2,FALSE)&VLOOKUP(RC[-7],Sheet1!R2C1:R28C4,3,FALSE)&IF(VLOOKUP(RC[-7],Sheet1!R2C1:R28C4,4,FALSE)="品",VLOOKUP(RC[-3],Sheet1!R2C8:R6C9,2,FALSE),RC[-3])&VLOOKUP(RC[-7],Sheet1!R2C1:R28C4,4,FALSE) -> 战队等级达到100级 | I40: 26 | J40: =VLOOKUP(RC[-9],Sheet1!R2C1:R28C6,6,FALSE) -> 传承核心 | K40: =VLOOKUP(INT(MOD(RC[-5],1000)/100),R23C12:R26C13,2,FALSE)*RC[-4] -> 300000
A41: 2 | B41: btn_hero | C41: 19 | D41: 1 | E41: 105 | F41: 33400 | G41: 20 | H41: =VLOOKUP(RC[-7],Sheet1!R2C1:R28C4,2,FALSE)&VLOOKUP(RC[-7],Sheet1!R2C1:R28C4,3,FALSE)&IF(VLOOKUP(RC[-7],Sheet1!R2C1:R28C4,4,FALSE)="品",VLOOKUP(RC[-3],Sheet1!R2C8:R6C9,2,FALSE),RC[-3])&VLOOKUP(RC[-7],Sheet1!R2C1:R28C4,4,FALSE) -> 战队等级达到105级 | I41: 26 | J41: =VLOOKUP(RC[-9],Sheet1!R2C1:R28C6,6,FALSE) -> 传承核心 | K41: =VLOOKUP(INT(MOD(RC[-5],1000)/100),R23C12:R26C13,2,FALSE)*RC[-4] -> 400000
A42: 2 | B42: btn_hero | C42: 20 | D42: 1 | E42: 110 | F42: 33400 | G42: 20 | H42: =VLOOKUP(RC[-7],Sheet1!R2C1:R28C4,2,FALSE)&VLOOKUP(RC[-7],Sheet1!R2C1:R28C4,3,FALSE)&IF(VLOOKUP(RC[-7],Sheet1!R2C1:R28C4,4,FALSE)="品",VLOOKUP(RC[-3],Sheet1!R2C8:R6C9,2,FALSE),RC[-3])&VLOOKUP(RC[-7],Sheet1!R2C1:R28C4,4,FALSE) -> 战队等级达到110级 | I42: 26 | J42: =VLOOKUP(RC[-9],Sheet1!R2C1:R28C6,6,FALSE) -> 传承核心 | K42: =VLOOKUP(INT(MOD(RC[-5],1000)/100),R23C12:R26C13,2,FALSE)*RC[-4] -> 400000
A43: 2 | B43: btn_hero | C43: 21 | D43: 1 | E43: 115 | F43: 33400 | G43: 20 | H43: =VLOOKUP(RC[-7],Sheet1!R2C1:R28C4,2,FALSE)&VLOOKUP(RC[-7],Sheet1!R2C1:R28C4,3,FALSE)&IF(VLOOKUP(RC[-7],Sheet1!R2C1:R28C4,4,FALSE)="品",VLOOKUP(RC[-3],Sheet1!R2C8:R6C9,2,FALSE),RC[-3])&VLOOKUP(RC[-7],Sheet1!R2C1:R28C4,4,FALSE) -> 战队等级达到115级 | I43: 26 | J43: =VLOOKUP(RC[-9],Sheet1!R2C1:R28C6,6,FALSE) -> 传承核心 | K43: =VLOOKUP(INT(MOD(RC[-5],1000)/100),R23C12:R26C13,2,FALSE)*RC[-4] -> 400000
A44: 2 | B44: btn_hero | C44: 22 | D44: 1 | E44: 120 | F44: 33400 | G44: 20 | H44: =VLOOKUP(RC[-7],Sheet1!R2C1:R28C4,2,FALSE)&VLOOKUP(RC[-7],Sheet1!R2C1:R28C4,3,FALSE)&IF(VLOOKUP(RC[-7],Sheet1!R2C1:R28C4,4,FALSE)="品",VLOOKUP(RC[-3],Sheet1!R2C8:R6C9,2,FALSE),RC[-3])&VLOOKUP(RC[-7],Sheet1!R2C1:R28C4,4,FALSE) -> 战队等级达到120级 | I44: 26 | J44: =VLOOKUP(RC[-9],Sheet1!R2C1:R28C6,6,FALSE) -> 传承核心 | K44: =VLOOKUP(INT(MOD(RC[-5],1000)/100),R23C12:R26C13,2,FALSE)*RC[-4] -> 400000
A45: 2 | B45: btn_hero | C45: 23 | D45: 1 | E45: 125 | F45: 33400 | G45: 20 | H45: =VLOOKUP(RC[-7],Sheet1!R2C1:R28C4,2,FALSE)&VLOOKUP(RC[-7],Sheet1!R2C1:R28C4,3,FALSE)&IF(VLOOKUP(RC[-7],Sheet1!R2C1:R28C4,4,FALSE)="品",VLOOKUP(RC[-3],Sheet1!R2C8:R6C9,2,FALSE),RC[-3])&VLOOKUP(RC[-7],Sheet1!R2C1:R28C4,4,FALSE) -> 战队等级达到125级 | I45: 26 | J45: =VLOOKUP(RC[-9],Sheet1!R2C1:R28C6,6,FALSE) -> 传承核心 | K45: =VLOOKUP(INT(MOD(RC[-5],1000)/100),R23C12:R26C13,2,FALSE)*RC[-4] -> 400000
A46: 2 | B46: btn_hero | C46: 24 | D46: 1 | E46: 130 | F46: 33400 | G46: 20 | H46: =VLOOKUP(RC[-7],Sheet1!R2C1:R28C4,2,FALSE)&VLOOKUP(RC[-7],Sheet1!R2C1:R28C4,3,FALSE)&IF(VLOOKUP(RC[-7],Sheet1!R2C1:R28C4,4,FALSE)="品",VLOOKUP(RC[-3],Sheet1!R2C8:R6C9,2,FALSE),RC[-3])&VLOOKUP(RC[-7],Sheet1!R2C1:R28C4,4,FALSE) -> 战队等级达到130级 | I46: 26 | J46: =VLOOKUP(RC[-9],Sheet1!R2C1:R28C6,6,FALSE) -> 传承核心 | K46: =VLOOKUP(INT(MOD(RC[-5],1000)/100),R23C12:R26C13,2,FALSE)*RC[-4] -> 400000
A47: 2 | B47: btn_hero | C47: 25 | D47: 1 | E47: 135 | F47: 33400 | G47: 20 | H47: =VLOOKUP(RC[-7],Sheet1!R2C1:R28C4,2,FALSE)&VLOOKUP(RC[-7],Sheet1!R2C1:R28C4,3,FALSE)&IF(VLOOKUP(RC[-7],Sheet1!R2C1:R28C4,4,FALSE)="品",VLOOKUP(RC[-3],Sheet1!R2C8:R6C9,2,FALSE),RC[-3])&VLOOKUP(RC[-7],Sheet1!R2C1:R28C4,4,FALSE) -> 战队等级达到135级 | I47: 26 | J47: =VLOOKUP(RC[-9],Sheet1!R2C1:R28C6,6,FALSE) -> 传承核心 | K47: =VLOOKUP(INT(MOD(RC[-5],1000)/100),R23C12:R26C13,2,FALSE)*RC[-4] -> 400000
A48: 2 | B48: btn_hero | C48: 26 | D48: 1 | E48: 140 | F48: 33400 | G48: 20 | H48: =VLOOKUP(RC[-7],Sheet1!R2C1:R28C4,2,FALSE)&VLOOKUP(RC[-7],Sheet1!R2C1:R28C4,3,FALSE)&IF(VLOOKUP(RC[-7],Sheet1!R2C1:R28C4,4,FALSE)="品",VLOOKUP(RC[-3],Sheet1!R2C8:R6C9,2,FALSE),RC[-3])&VLOOKUP(RC[-7],Sheet1!R2C1:R28C4,4,FALSE) -> 战队等级达到140级 | I48: 26 | J48: =VLOOKUP(RC[-9],Sheet1!R2C1:R28C6,6,FALSE) -> 传承核心 | K48: =VLOOKUP(INT(MOD(RC[-5],1000)/100),R23C12:R26C13,2,FALSE)*RC[-4] -> 400000
A49: 2 | B49: btn_hero | C49: 27 | D49: 1 | E49: 145 | F49: 33400 | G49: 20 | H49: =VLOOKUP(RC[-7],Sheet1!R2C1:R28C4,2,FALSE)&VLOOKUP(RC[-7],Sheet1!R2C1:R28C4,3,FALSE)&IF(VLOOKUP(RC[-7],Sheet1!R2C1:R28C4,4,FALSE)="品",VLOOKUP(RC[-3],Sheet1!R2C8:R6C9,2,FALSE),RC[-3])&VLOOKUP(RC[-7],Sheet1!R2C1:R28C4,4,FALSE) -> 战队等级达到145级 | I49: 26 | J49: =VLOOKUP(RC[-9],Sheet1!R2C1:R28C6,6,FALSE) -> 传承核心 | K49: =VLOOKUP(INT(MOD(RC[-5],1000)/100),R23C12:R26C13,2,FALSE)*RC[-4] -> 400000
A50: 2 | B50: btn_hero | C50: 28 | D50: 1 | E50: 150 | F50: 33400 | G50: 20 | H50: =VLOOKUP(RC[-7],Sheet1!R2C1:R28C4,2,FALSE)&VLOOKUP(RC[-7],Sheet1!R2C1:R28C4,3,FALSE)&IF(VLOOKUP(RC[-7],Sheet1!R2C1:R28C4,4,FALSE)="品",VLOOKUP(RC[-3],Sheet1!R2C8:R6C9,2,FALSE),RC[-3])&VLOOKUP(RC[-7],Sheet1!R2C1:R28C4,4,FALSE) -> 战队等级达到150级 | I50: 26 | J50: =VLOOKUP(RC[-9],Sheet1!R2C1:R28C6,6,FALSE) -> 传承核心 | K50: =VLOOKUP(INT(MOD(RC[-5],1000)/100),R23C12:R26C13,2,FALSE)*RC[-4] -> 400000
A51: 3 | B51: btn_dungeon | C51: 1 | D51: 1 | E51: 30 | F51: 19003 | G51: 10000 | H51: =VLOOKUP(RC[-7],Sheet1!R2C1:R28C4,2,FALSE)&VLOOKUP(RC[-7],Sheet1!R2C1:R28C4,3,FALSE)&IF(VLOOKUP(RC[-7],Sheet1!R2C1:R28C4,4,FALSE)="品",VLOOKUP(RC[-3],Sheet1!R2C8:R6C9,2,FALSE),RC[-3])&VLOOKUP(RC[-7],Sheet1!R2C1:R28C4,4,FALSE) -> 主线副本总星级达到30星 | I51: 26 | J51: =VLOOKUP(RC[-9],Sheet1!R2C1:R28C6,6,FALSE) -> 培养石
A52: 3 | B52: btn_dungeon | C52: 2 | D52: 1 | E52: 60 | F52: 19003 | G52: 20000 | H52: =VLOOKUP(RC[-7],Sheet1!R2C1:R28C4,2,FALSE)&VLOOKUP(RC[-7],Sheet1!R2C1:R28C4,3,FALSE)&IF(VLOOKUP(RC[-7],Sheet1!R2C1:R28C4,4,FALSE)="品",VLOOKUP(RC[-3],Sheet1!R2C8:R6C9,2,FALSE),RC[-3])&VLOOKUP(RC[-7],Sheet1!R2C1:R28C4,4,FALSE) -> 主线副本总星级达到60星 | I52: 26 | J52: =VLOOKUP(RC[-9],Sheet1!R2C1:R28C6,6,FALSE) -> 培养石
A53: 3 | B53: btn_dungeon | C53: 3 | D53: 1 | E53: 90 | F53: 19003 | G53: 30000 | H53: =VLOOKUP(RC[-7],Sheet1!R2C1:R28C4,2,FALSE)&VLOOKUP(RC[-7],Sheet1!R2C1:R28C4,3,FALSE)&IF(VLOOKUP(RC[-7],Sheet1!R2C1:R28C4,4,FALSE)="品",VLOOKUP(RC[-3],Sheet1!R2C8:R6C9,2,FALSE),RC[-3])&VLOOKUP(RC[-7],Sheet1!R2C1:R28C4,4,FALSE) -> 主线副本总星级达到90星 | I53: 26 | J53: =VLOOKUP(RC[-9],Sheet1!R2C1:R28C6,6,FALSE) -> 培养石
A54: 3 | B54: btn_dungeon | C54: 4 | D54: 1 | E54: 120 | F54: 19003 | G54: 40000 | H54: =VLOOKUP(RC[-7],Sheet1!R2C1:R28C4,2,FALSE)&VLOOKUP(RC[-7],Sheet1!R2C1:R28C4,3,FALSE)&IF(VLOOKUP(RC[-7],Sheet1!R2C1:R28C4,4,FALSE)="品",VLOOKUP(RC[-3],Sheet1!R2C8:R6C9,2,FALSE),RC[-3])&VLOOKUP(RC[-7],Sheet1!R2C1:R28C4,4,FALSE) -> 主线副本总星级达到120星 | I54: 26 | J54: =VLOOKUP(RC[-9],Sheet1!R2C1:R28C6,6,FALSE) -> 培养石
A55: 3 | B55: btn_dungeon | C55: 5 | D55: 1 | E55: 150 | F55: 19003 | G55: 50000 | H55: =VLOOKUP(RC[-7],Sheet1!R2C1:R28C4,2,FALSE)&VLOOKUP(RC[-7],Sheet1!R2C1:R28C4,3,FALSE)&IF(VLOOKUP(RC[-7],Sheet1!R2C1:R28C4,4,FALSE)="品",VLOOKUP(RC[-3],Sheet1!R2C8:R6C9,2,FALSE),RC[-3])&VLOOKUP(RC[-7],Sheet1!R2C1:R28C4,4,FALSE) -> 主线副本总星级达到150星 | I55: 26 | J55: =VLOOKUP(RC[-9],Sheet1!R2C1:R28C6,6,FALSE) -> 培养石
A56: 3 | B56: btn_dungeon | C56: 6 | D56: 1 | E56: 180 | F56: 19003 | G56: 60000 | H56: =VLOOKUP(RC[-7],Sheet1!R2C1:R28C4,2,FALSE)&VLOOKUP(RC[-7],Sheet1!R2C1:R28C4,3,FALSE)&IF(VLOOKUP(RC[-7],Sheet1!R2C1:R28C4,4,FALSE)="品",VLOOKUP(RC[-3],Sheet1!R2C8:R6C9,2,FALSE),RC[-3])&VLOOKUP(RC[-7],Sheet1!R2C1:R28C4,4,FALSE) -> 主线副本总星级达到180星 | I56: 26 | J56: =VLOOKUP(RC[-9],Sheet1!R2C1:R28C6,6,FALSE) -> 培养石
A57: 3 | B57: btn_dungeon | C57: 7 | D57: 1 | E57: 210 | F57: 19003 | G57: 70000 | H57: =VLOOKUP(RC[-7],Sheet1!R2C1:R28C4,2,FALSE)&VLOOKUP(RC[-7],Sheet1!R2C1:R28C4,3,FALSE)&IF(VLOOKUP(RC[-7],Sheet1!R2C1:R28C4,4,FALSE)="品",VLOOKUP(RC[-3],Sheet1!R2C8:R6C9,2,FALSE),RC[-3])&VLOOKUP(RC[-7],Sheet1!R2C1:R28C4,4,FALSE) -> 主线副本总星级达到210星 | I57: 26 | J57: =VLOOKUP(RC[-9],Sheet1!R2C1:R28C6,6,FALSE) -> 培养石
A58: 3 | B58: btn_dungeon | C58: 8 | D58: 1 | E58: 240 | F58: 19003 | G58: 80000 | H58: =VLOOKUP(RC[-7],Sheet1!R2C1:R28C4,2,FALSE)&VLOOKUP(RC[-7],Sheet1!R2C1:R28C4,3,FALSE)&IF(VLOOKUP(RC[-7],Sheet1!R2C1:R28C4,4,FALSE)="品",VLOOKUP(RC[-3],Sheet1!R2C8:R6C9,2,FALSE),RC[-3])&VLOOKUP(RC[-7],Sheet1!R2C1:R28C4,4,FALSE) -> 主线副本总星级达到240星 | I58: 26 | J58: =VLOOKUP(RC[-9],Sheet1!R2C1:R28C6,6,FALSE) -> 培养石
A59: 3 | B59: btn_dungeon | C59: 9 | D59: 1 | E59: 270 | F59: 19003 | G59: 90000 | H59: =VLOOKUP(RC[-7],Sheet1!R2C1:R28C4,2,FALSE)&VLOOKUP(RC[-7],Sheet1!R2C1:R28C4,3,FALSE)&IF(VLOOKUP(RC[-7],Sheet1!R2C1:R28C4,4,FALSE)="品",VLOOKUP(RC[-3],Sheet1!R2C8:R6C9,2,FALSE),RC[-3])&VLOOKUP(RC[-7],Sheet1!R2C1:R28C4,4,FALSE) -> 主线副本总星级达到270星 | I59: 26 | J59: =VLOOKUP(RC[-9],Sheet1!R2C1:R28C6,6,FALSE) -> 培养石
A60: 3 | B60: btn_dungeon | C60: 10 | D60: 1 | E60: 300 | F60: 19003 | G60: 100000 | H60: =VLOOKUP(RC[-7],Sheet1!R2C1:R28C4,2,FALSE)&VLOOKUP(RC[-7],Sheet1!R2C1:R28C4,3,FALSE)&IF(VLOOKUP(RC[-7],Sheet1!R2C1:R28C4,4,FALSE)="品",VLOOKUP(RC[-3],Sheet1!R2C8:R6C9,2,FALSE),RC[-3])&VLOOKUP(RC[-7],Sheet1!R2C1:R28C4,4,FALSE) -> 主线副本总星级达到300星 | I60: 26 | J60: =VLOOKUP(RC[-9],Sheet1!R2C1:R28C6,6,FALSE) -> 培养石
A61: 3 | B61: btn_dungeon | C61: 11 | D61: 1 | E61: 330 | F61: 19003 | G61: 110000 | H61: =VLOOKUP(RC[-7],Sheet1!R2C1:R28C4,2,FALSE)&VLOOKUP(RC[-7],Sheet1!R2C1:R28C4,3,FALSE)&IF(VLOOKUP(RC[-7],Sheet1!R2C1:R28C4,4,FALSE)="品",VLOOKUP(RC[-3],Sheet1!R2C8:R6C9,2,FALSE),RC[-3])&VLOOKUP(RC[-7],Sheet1!R2C1:R28C4,4,FALSE) -> 主线副本总星级达到330星 | I61: 26 | J61: =VLOOKUP(RC[-9],Sheet1!R2C1:R28C6,6,FALSE) -> 培养石
A62: 3 | B62: btn_dungeon | C62: 12 | D62: 1 | E62: 360 | F62: 19003 | G62: 120000 | H62: =VLOOKUP(RC[-7],Sheet1!R2C1:R28C4,2,FALSE)&VLOOKUP(RC[-7],Sheet1!R2C1:R28C4,3,FALSE)&IF(VLOOKUP(RC[-7],Sheet1!R2C1:R28C4,4,FALSE)="品",VLOOKUP(RC[-3],Sheet1!R2C8:R6C9,2,FALSE),RC[-3])&VLOOKUP(RC[-7],Sheet1!R2C1:R28C4,4,FALSE) -> 主线副本总星级达到360星 | I62: 26 | J62: =VLOOKUP(RC[-9],Sheet1!R2C1:R28C6,6,FALSE) -> 培养石
A63: 3 | B63: btn_dungeon | C63: 13 | D63: 1 | E63: 390 | F63: 19003 | G63: 130000 | H63: =VLOOKUP(RC[-7],Sheet1!R2C1:R28C4,2,FALSE)&VLOOKUP(RC[-7],Sheet1!R2C1:R28C4,3,FALSE)&IF(VLOOKUP(RC[-7],Sheet1!R2C1:R28C4,4,FALSE)="品",VLOOKUP(RC[-3],Sheet1!R2C8:R6C9,2,FALSE),RC[-3])&VLOOKUP(RC[-7],Sheet1!R2C1:R28C4,4,FALSE) -> 主线副本总星级达到390星 | I63: 26 | J63: =VLOOKUP(RC[-9],Sheet1!R2C1:R28C6,6,FALSE) -> 培养石
A64: 3 | B64: btn_dungeon | C64: 14 | D64: 1 | E64: 420 | F64: 19003 | G64: 140000 | H64: =VLOOKUP(RC[-7],Sheet1!R2C1:R28C4,2,FALSE)&VLOOKUP(RC[-7],Sheet1!R2C1:R28C4,3,FALSE)&IF(VLOOKUP(RC[-7],Sheet1!R2C1:R28C4,4,FALSE)="品",VLOOKUP(RC[-3],Sheet1!R2C8:R6C9,2,FALSE),RC[-3])&VLOOKUP(RC[-7],Sheet1!R2C1:R28C4,4,FALSE) -> 主线副本总星级达到420星 | I64: 26 | J64: =VLOOKUP(RC[-9],Sheet1!R2C1:R28C6,6,FALSE) -> 培养石
A65: 3 | B65: btn_dungeon | C65: 15 | D65: 1 | E65: 450 | F65: 19003 | G65: 150000 | H65: =VLOOKUP(RC[-7],Sheet1!R2C1:R28C4,2,FALSE)&VLOOKUP(RC[-7],Sheet1!R2C1:R28C4,3,FALSE)&IF(VLOOKUP(RC[-7],Sheet1!R2C1:R28C4,4,FALSE)="品",VLOOKUP(RC[-3],Sheet1!R2C8:R6C9,2,FALSE),RC[-3])&VLOOKUP(RC[-7],Sheet1!R2C1:R28C4,4,FALSE) -> 主线副本总星级达到450星 | I65: 26 | J65: =VLOOKUP(RC[-9],Sheet1!R2C1:R28C6,6,FALSE) -> 培养石
A66: 3 | B66: btn_dungeon | C66: 16 | D66: 1 | E66: 480 | F66: 19003 | G66: 160000 | H66: =VLOOKUP(RC[-7],Sheet1!R2C1:R28C4,2,FALSE)&VLOOKUP(RC[-7],Sheet1!R2C1:R28C4,3,FALSE)&IF(VLOOKUP(RC[-7],Sheet1!R2C1:R28C4,4,FALSE)="品",VLOOKUP(RC[-3],Sheet1!R2C8:R6C9,2,FALSE),RC[-3])&VLOOKUP(RC[-7],Sheet1!R2C1:R28C4,4,FALSE) -> 主线副本总星级达到480星 | I66: 26 | J66: =VLOOKUP(RC[-9],Sheet1!R2C1:R28C6,6,FALSE) -> 培养石
A67: 3 | B67: btn_dungeon | C67: 17 | D67: 1 | E67: 510 | F67: 19003 | G67: 170000 | H67: =VLOOKUP(RC[-7],Sheet1!R2C1:R28C4,2,FALSE)&VLOOKUP(RC[-7],Sheet1!R2C1:R28C4,3,FALSE)&IF(VLOOKUP(RC[-7],Sheet1!R2C1:R28C4,4,FALSE)="品",VLOOKUP(RC[-3],Sheet1!R2C8:R6C9,2,FALSE),RC[-3])&VLOOKUP(RC[-7],Sheet1!R2C1:R28C4,4,FALSE) -> 主线副本总星级达到510星 | I67: 26 | J67: =VLOOKUP(RC[-9],Sheet1!R2C1:R28C6,6,FALSE) -> 培养石
A68: 3 | B68: btn_dungeon | C68: 18 | D68: 1 | E68: 540 | F68: 19003 | G68: 180000 | H68: =VLOOKUP(RC[-7],Sheet1!R2C1:R28C4,2,FALSE)&VLOOKUP(RC[-7],Sheet1!R2C1:R28C4,3,FALSE)&IF(VLOOKUP(RC[-7],Sheet1!R2C1:R28C4,4,FALSE)="品",VLOOKUP(RC[-3],Sheet1!R2C8:R6C9,2,FALSE),RC[-3])&VLOOKUP(RC[-7],Sheet1!R2C1:R28C4,4,FALSE) -> 主线副本总星级达到540星 | I68: 26 | J68: =VLOOKUP(RC[-9],Sheet1!R2C1:R28C6,6,FALSE) -> 培养石
A69: 3 | B69: btn_dungeon | C69: 19 | D69: 1 | E69: 570 | F69: 19003 | G69: 190000 | H69: =VLOOKUP(RC[-7],Sheet1!R2C1:R28C4,2,FALSE)&VLOOKUP(RC[-7],Sheet1!R2C1:R28C4,3,FALSE)&IF(VLOOKUP(RC[-7],Sheet1!R2C1:R28C4,4,FALSE)="品",VLOOKUP(RC[-3],Sheet1!R2C8:R6C9,2,FALSE),RC[-3])&VLOOKUP(RC[-7],Sheet1!R2C1:R28C4,4,FALSE) -> 主线副本总星级达到570星 | I69: 26 | J69: =VLOOKUP(RC[-9],Sheet1!R2C1:R28C6,6,FALSE) -> 培养石
A70: 3 | B70: btn_dungeon | C70: 20 | D70: 1 | E70: 600 | F70: 19003 | G70: 200000 | H70: =VLOOKUP(RC[-7],Sheet1!R2C1:R28C4,2,FALSE)&VLOOKUP(RC[-7],Sheet1!R2C1:R28C4,3,FALSE)&IF(VLOOKUP(RC[-7],Sheet1!R2C1:R28C4,4,FALSE)="品",VLOOKUP(RC[-3],Sheet1!R2C8:R6C9,2,FALSE),RC[-3])&VLOOKUP(RC[-7],Sheet1!R2C1:R28C4,4,FALSE) -> 主线副本总星级达到600星 | I70: 26 | J70: =VLOOKUP(RC[-9],Sheet1!R2C1:R28C6,6,FALSE) -> 培养石
A71: 3 | B71: btn_dungeon | C71: 21 | D71: 1 | E71: 630 | F71: 19003 | G71: 210000 | H71: =VLOOKUP(RC[-7],Sheet1!R2C1:R28C4,2,FALSE)&VLOOKUP(RC[-7],Sheet1!R2C1:R28C4,3,FALSE)&IF(VLOOKUP(RC[-7],Sheet1!R2C1:R28C4,4,FALSE)="品",VLOOKUP(RC[-3],Sheet1!R2C8:R6C9,2,FALSE),RC[-3])&VLOOKUP(RC[-7],Sheet1!R2C1:R28C4,4,FALSE) -> 主线副本总星级达到630星 | I71: 26 | J71: =VLOOKUP(RC[-9],Sheet1!R2C1:R28C6,6,FALSE) -> 培养石
A72: 3 | B72: btn_dungeon | C72: 22 | D72: 1 | E72: 660 | F72: 19003 | G72: 220000 | H72: =VLOOKUP(RC[-7],Sheet1!R2C1:R28C4,2,FALSE)&VLOOKUP(RC[-7],Sheet1!R2C1:R28C4,3,FALSE)&IF(VLOOKUP(RC[-7],Sheet1!R2C1:R28C4,4,FALSE)="品",VLOOKUP(RC[-3],Sheet1!R2C8:R6C9,2,FALSE),RC[-3])&VLOOKUP(RC[-7],Sheet1!R2C1:R28C4,4,FALSE) -> 主线副本总星级达到660星 | I72: 26 | J72: =VLOOKUP(RC[-9],Sheet1!R2C1:R28C6,6,FALSE) -> 培养石
A73: 3 | B73: btn_dungeon | C73: 23 | D73: 1 | E73: 690 | F73: 19003 | G73: 230000 | H73: =VLOOKUP(RC[-7],Sheet1!R2C1:R28C4,2,FALSE)&VLOOKUP(RC[-7],Sheet1!R2C1:R28C4,3,FALSE)&IF(VLOOKUP(RC[-7],Sheet1!R2C1:R28C4,4,FALSE)="品",VLOOKUP(RC[-3],Sheet1!R2C8:R6C9,2,FALSE),RC[-3])&VLOOKUP(RC[-7],Sheet1!R2C1:R28C4,4,FALSE) -> 主线副本总星级达到690星 | I73: 26 | J73: =VLOOKUP(RC[-9],Sheet1!R2C1:R28C6,6,FALSE) -> 培养石
A74: 3 | B74: btn_dungeon | C74: 24 | D74: 1 | E74: 720 | F74: 19003 | G74: 240000 | H74: =VLOOKUP(RC[-7],Sheet1!R2C1:R28C4,2,FALSE)&VLOOKUP(RC[-7],Sheet1!R2C1:R28C4,3,FALSE)&IF(VLOOKUP(RC[-7],Sheet1!R2C1:R28C4,4,FALSE)="品",VLOOKUP(RC[-3],Sheet1!R2C8:R6C9,2,FALSE),RC[-3])&VLOOKUP(RC[-7],Sheet1!R2C1:R28C4,4,FALSE) -> 主线副本总星级达到720星 | I74: 26 | J74: =VLOOKUP(RC[-9],Sheet1!R2C1:R28C6,6,FALSE) -> 培养石
A75: 3 | B75: btn_dungeon | C75: 25 | D75: 1 | E75: 750 | F75: 19003 | G75: 250000 | H75: =VLOOKUP(RC[-7],Sheet1!R2C1:R28C4,2,FALSE)&VLOOKUP(RC[-7],Sheet1!R2C1:R28C4,3,FALSE)&IF(VLOOKUP(RC[-7],Sheet1!R2C1:R28C4,4,FALSE)="品",VLOOKUP(RC[-3],Sheet1!R2C8:R6C9,2,FALSE),RC[-3])&VLOOKUP(RC[-7],Sheet1!R2C1:R28C4,4,FALSE) -> 主线副本总星级达到750星 | I75: 26 | J75: =VLOOKUP(RC[-9],Sheet1!R2C1:R28C6,6,FALSE) -> 培养石
A76: 3 | B76: btn_dungeon | C76: 26 | D76: 1 | E76: 780 | F76: 19003 | G76: 260000 | H76: =VLOOKUP(RC[-7],Sheet1!R2C1:R28C4,2,FALSE)&VLOOKUP(RC[-7],Sheet1!R2C1:R28C4,3,FALSE)&IF(VLOOKUP(RC[-7],Sheet1!R2C1:R28C4,4,FALSE)="品",VLOOKUP(RC[-3],Sheet1!R2C8:R6C9,2,FALSE),RC[-3])&VLOOKUP(RC[-7],Sheet1!R2C1:R28C4,4,FALSE) -> 主线副本总星级达到780星 | I76: 26 | J76: =VLOOKUP(RC[-9],Sheet1!R2C1:R28C6,6,FALSE) -> 培养石
A77: 3 | B77: btn_dungeon | C77: 27 | D77: 1 | E77: 810 | F77: 19003 | G77: 270000 | H77: =VLOOKUP(RC[-7],Sheet1!R2C1:R28C4,2,FALSE)&VLOOKUP(RC[-7],Sheet1!R2C1:R28C4,3,FALSE)&IF(VLOOKUP(RC[-7],Sheet1!R2C1:R28C4,4,FALSE)="品",VLOOKUP(RC[-3],Sheet1!R2C8:R6C9,2,FALSE),RC[-3])&VLOOKUP(RC[-7],Sheet1!R2C1:R28C4,4,FALSE) -> 主线副本总星级达到810星 | I77: 26 | J77: =VLOOKUP(RC[-9],Sheet1!R2C1:R28C6,6,FALSE) -> 培养石
A78: 3 | B78: btn_dungeon | C78: 28 | D78: 1 | E78: 840 | F78: 19003 | G78: 280000 | H78: =VLOOKUP(RC[-7],Sheet1!R2C1:R28C4,2,FALSE)&VLOOKUP(RC[-7],Sheet1!R2C1:R28C4,3,FALSE)&IF(VLOOKUP(RC[-7],Sheet1!R2C1:R28C4,4,FALSE)="品",VLOOKUP(RC[-3],Sheet1!R2C8:R6C9,2,FALSE),RC[-3])&VLOOKUP(RC[-7],Sheet1!R2C1:R28C4,4,FALSE) -> 主线副本总星级达到840星 | I78: 26 | J78: =VLOOKUP(RC[-9],Sheet1!R2C1:R28C6,6,FALSE) -> 培养石
A79: 3 | B79: btn_dungeon | C79: 29 | D79: 1 | E79: 870 | F79: 19003 | G79: 290000 | H79: =VLOOKUP(RC[-7],Sheet1!R2C1:R28C4,2,FALSE)&VLOOKUP(RC[-7],Sheet1!R2C1:R28C4,3,FALSE)&IF(VLOOKUP(RC[-7],Sheet1!R2C1:R28C4,4,FALSE)="品",VLOOKUP(RC[-3],Sheet1!R2C8:R6C9,2,FALSE),RC[-3])&VLOOKUP(RC[-7],Sheet1!R2C1:R28C4,4,FALSE) -> 主线副本总星级达到870星 | I79: 26 | J79: =VLOOKUP(RC[-9],Sheet1!R2C1:R28C6,6,FALSE) -> 培养石
A80: 3 | B80: btn_dungeon | C80: 30 | D80: 1 | E80: 900 | F80: 19003 | G80: 300000 | H80: =VLOOKUP(RC[-7],Sheet1!R2C1:R28C4,2,FALSE)&VLOOKUP(RC[-7],Sheet1!R2C1:R28C4,3,FALSE)&IF(VLOOKUP(RC[-7],Sheet1!R2C1:R28C4,4,FALSE)="品",VLOOKUP(RC[-3],Sheet1!R2C8:R6C9,2,FALSE),RC[-3])&VLOOKUP(RC[-7],Sheet1!R2C1:R28C4,4,FALSE) -> 主线副本总星级达到900星 | I80: 26 | J80: =VLOOKUP(RC[-9],Sheet1!R2C1:R28C6,6,FALSE) -> 培养石
A81: 3 | B81: btn_dungeon | C81: 31 | D81: 1 | E81: 930 | F81: 19003 | G81: 310000 | H81: =VLOOKUP(RC[-7],Sheet1!R2C1:R28C4,2,FALSE)&VLOOKUP(RC[-7],Sheet1!R2C1:R28C4,3,FALSE)&IF(VLOOKUP(RC[-7],Sheet1!R2C1:R28C4,4,FALSE)="品",VLOOKUP(RC[-3],Sheet1!R2C8:R6C9,2,FALSE),RC[-3])&VLOOKUP(RC[-7],Sheet1!R2C1:R28C4,4,FALSE) -> 主线副本总星级达到930星 | I81: 26 | J81: =VLOOKUP(RC[-9],Sheet1!R2C1:R28C6,6,FALSE) -> 培养石
A82: 3 | B82: btn_dungeon | C82: 32 | D82: 1 | E82: 960 | F82: 19003 | G82: 320000 | H82: =VLOOKUP(RC[-7],Sheet1!R2C1:R28C4,2,FALSE)&VLOOKUP(RC[-7],Sheet1!R2C1:R28C4,3,FALSE)&IF(VLOOKUP(RC[-7],Sheet1!R2C1:R28C4,4,FALSE)="品",VLOOKUP(RC[-3],Sheet1!R2C8:R6C9,2,FALSE),RC[-3])&VLOOKUP(RC[-7],Sheet1!R2C1:R28C4,4,FALSE) -> 主线副本总星级达到960星 | I82: 26 | J82: =VLOOKUP(RC[-9],Sheet1!R2C1:R28C6,6,FALSE) -> 培养石
A83: 3 | B83: btn_dungeon | C83: 33 | D83: 1 | E83: 990 | F83: 19003 | G83: 330000 | H83: =VLOOKUP(RC[-7],Sheet1!R2C1:R28C4,2,FALSE)&VLOOKUP(RC[-7],Sheet1!R2C1:R28C4,3,FALSE)&IF(VLOOKUP(RC[-7],Sheet1!R2C1:R28C4,4,FALSE)="品",VLOOKUP(RC[-3],Sheet1!R2C8:R6C9,2,FALSE),RC[-3])&VLOOKUP(RC[-7],Sheet1!R2C1:R28C4,4,FALSE) -> 主线副本总星级达到990星 | I83: 26 | J83: =VLOOKUP(RC[-9],Sheet1!R2C1:R28C6,6,FALSE) -> 培养石
A84: 3 | B84: btn_dungeon | C84: 34 | D84: 1 | E84: 1020 | F84: 19003 | G84: 340000 | H84: =VLOOKUP(RC[-7],Sheet1!R2C1:R28C4,2,FALSE)&VLOOKUP(RC[-7],Sheet1!R2C1:R28C4,3,FALSE)&IF(VLOOKUP(RC[-7],Sheet1!R2C1:R28C4,4,FALSE)="品",VLOOKUP(RC[-3],Sheet1!R2C8:R6C9,2,FALSE),RC[-3])&VLOOKUP(RC[-7],Sheet1!R2C1:R28C4,4,FALSE) -> 主线副本总星级达到1020星 | I84: 26 | J84: =VLOOKUP(RC[-9],Sheet1!R2C1:R28C6,6,FALSE) -> 培养石
A85: 3 | B85: btn_dungeon | C85: 35 | D85: 1 | E85: 1050 | F85: 19003 | G85: 350000 | H85: =VLOOKUP(RC[-7],Sheet1!R2C1:R28C4,2,FALSE)&VLOOKUP(RC[-7],Sheet1!R2C1:R28C4,3,FALSE)&IF(VLOOKUP(RC[-7],Sheet1!R2C1:R28C4,4,FALSE)="品",VLOOKUP(RC[-3],Sheet1!R2C8:R6C9,2,FALSE),RC[-3])&VLOOKUP(RC[-7],Sheet1!R2C1:R28C4,4,FALSE) -> 主线副本总星级达到1050星 | I85: 26 | J85: =VLOOKUP(RC[-9],Sheet1!R2C1:R28C6,6,FALSE) -> 培养石
A86: 3 | B86: btn_dungeon | C86: 36 | D86: 1 | E86: 1080 | F86: 19003 | G86: 360000 | H86: =VLOOKUP(RC[-7],Sheet1!R2C1:R28C4,2,FALSE)&VLOOKUP(RC[-7],Sheet1!R2C1:R28C4,3,FALSE)&IF(VLOOKUP(RC[-7],Sheet1!R2C1:R28C4,4,FALSE)="品",VLOOKUP(RC[-3],Sheet1!R2C8:R6C9,2,FALSE),RC[-3])&VLOOKUP(RC[-7],Sheet1!R2C1:R28C4,4,FALSE) -> 主线副本总星级达到1080星 | I86: 26 | J86: =VLOOKUP(RC[-9],Sheet1!R2C1:R28C6,6,FALSE) -> 培养石
A87: 3 | B87: btn_dungeon | C87: 37 | D87: 1 | E87: 1110 | F87: 19003 | G87: 370000 | H87: =VLOOKUP(RC[-7],Sheet1!R2C1:R28C4,2,FALSE)&VLOOKUP(RC[-7],Sheet1!R2C1:R28C4,3,FALSE)&IF(VLOOKUP(RC[-7],Sheet1!R2C1:R28C4,4,FALSE)="品",VLOOKUP(RC[-3],Sheet1!R2C8:R6C9,2,FALSE),RC[-3])&VLOOKUP(RC[-7],Sheet1!R2C1:R28C4,4,FALSE) -> 主线副本总星级达到1110星 | I87: 26 | J87: =VLOOKUP(RC[-9],Sheet1!R2C1:R28C6,6,FALSE) -> 培养石
A88: 3 | B88: btn_dungeon | C88: 38 | D88: 1 | E88: 1140 | F88: 19003 | G88: 380000 | H88: =VLOOKUP(RC[-7],Sheet1!R2C1:R28C4,2,FALSE)&VLOOKUP(RC[-7],Sheet1!R2C1:R28C4,3,FALSE)&IF(VLOOKUP(RC[-7],Sheet1!R2C1:R28C4,4,FALSE)="品",VLOOKUP(RC[-3],Sheet1!R2C8:R6C9,2,FALSE),RC[-3])&VLOOKUP(RC[-7],Sheet1!R2C1:R28C4,4,FALSE) -> 主线副本总星级达到1140星 | I88: 26 | J88: =VLOOKUP(RC[-9],Sheet1!R2C1:R28C6,6,FALSE) -> 培养石
A89: 3 | B89: btn_dungeon | C89: 39 | D89: 1 | E89: 1170 | F89: 19003 | G89: 390000 | H89: =VLOOKUP(RC[-7],Sheet1!R2C1:R28C4,2,FALSE)&VLOOKUP(RC[-7],Sheet1!R2C1:R28C4,3,FALSE)&IF(VLOOKUP(RC[-7],Sheet1!R2C1:R28C4,4,FALSE)="品",VLOOKUP(RC[-3],Sheet1!R2C8:R6C9,2,FALSE),RC[-3])&VLOOKUP(RC[-7],Sheet1!R2C1:R28C4,4,FALSE) -> 主线副本总星级达到1170星 | I89: 26 | J89: =VLOOKUP(RC[-9],Sheet1!R2C1:R28C6,6,FALSE) -> 培养石
A90: 3 | B90: btn_dungeon | C90: 40 | D90: 1 | E90: 1200 | F90: 19003 | G90: 400000 | H90: =VLOOKUP(RC[-7],Sheet1!R2C1:R28C4,2,FALSE)&VLOOKUP(RC[-7],Sheet1!R2C1:R28C4,3,FALSE)&IF(VLOOKUP(RC[-7],Sheet1!R2C1:R28C4,4,FALSE)="品",VLOOKUP(RC[-3],Sheet1!R2C8:R6C9,2,FALSE),RC[-3])&VLOOKUP(RC[-7],Sheet1!R2C1:R28C4,4,FALSE) -> 主线副本总星级达到1200星 | I90: 26 | J90: =VLOOKUP(RC[-9],Sheet1!R2C1:R28C6,6,FALSE) -> 培养石
A91: 3 | B91: btn_dungeon | C91: 41 | D91: 1 | E91: 1230 | F91: 19003 | G91: 410000 | H91: =VLOOKUP(RC[-7],Sheet1!R2C1:R28C4,2,FALSE)&VLOOKUP(RC[-7],Sheet1!R2C1:R28C4,3,FALSE)&IF(VLOOKUP(RC[-7],Sheet1!R2C1:R28C4,4,FALSE)="品",VLOOKUP(RC[-3],Sheet1!R2C8:R6C9,2,FALSE),RC[-3])&VLOOKUP(RC[-7],Sheet1!R2C1:R28C4,4,FALSE) -> 主线副本总星级达到1230星 | I91: 26 | J91: =VLOOKUP(RC[-9],Sheet1!R2C1:R28C6,6,FALSE) -> 培养石
A92: 3 | B92: btn_dungeon | C92: 42 | D92: 1 | E92: 1260 | F92: 19003 | G92: 420000 | H92: =VLOOKUP(RC[-7],Sheet1!R2C1:R28C4,2,FALSE)&VLOOKUP(RC[-7],Sheet1!R2C1:R28C4,3,FALSE)&IF(VLOOKUP(RC[-7],Sheet1!R2C1:R28C4,4,FALSE)="品",VLOOKUP(RC[-3],Sheet1!R2C8:R6C9,2,FALSE),RC[-3])&VLOOKUP(RC[-7],Sheet1!R2C1:R28C4,4,FALSE) -> 主线副本总星级达到1260星 | I92: 26 | J92: =VLOOKUP(RC[-9],Sheet1!R2C1:R28C6,6,FALSE) -> 培养石
A93: 3 | B93: btn_dungeon | C93: 43 | D93: 1 | E93: 1290 | F93: 19003 | G93: 430000 | H93: =VLOOKUP(RC[-7],Sheet1!R2C1:R28C4,2,FALSE)&VLOOKUP(RC[-7],Sheet1!R2C1:R28C4,3,FALSE)&IF(VLOOKUP(RC[-7],Sheet1!R2C1:R28C4,4,FALSE)="品",VLOOKUP(RC[-3],Sheet1!R2C8:R6C9,2,FALSE),RC[-3])&VLOOKUP(RC[-7],Sheet1!R2C1:R28C4,4,FALSE) -> 主线副本总星级达到1290星 | I93: 26 | J93: =VLOOKUP(RC[-9],Sheet1!R2C1:R28C6,6,FALSE) -> 培养石
A94: 3 | B94: btn_dungeon | C94: 44 | D94: 1 | E94: 1320 | F94: 19003 | G94: 440000 | H94: =VLOOKUP(RC[-7],Sheet1!R2C1:R28C4,2,FALSE)&VLOOKUP(RC[-7],Sheet1!R2C1:R28C4,3,FALSE)&IF(VLOOKUP(RC[-7],Sheet1!R2C1:R28C4,4,FALSE)="品",VLOOKUP(RC[-3],Sheet1!R2C8:R6C9,2,FALSE),RC[-3])&VLOOKUP(RC[-7],Sheet1!R2C1:R28C4,4,FALSE) -> 主线副本总星级达到1320星 | I94: 26 | J94: =VLOOKUP(RC[-9],Sheet1!R2C1:R28C6,6,FALSE) -> 培养石
A95: 3 | B95: btn_dungeon | C95: 45 | D95: 1 | E95: 1350 | F95: 19003 | G95: 450000 | H95: =VLOOKUP(RC[-7],Sheet1!R2C1:R28C4,2,FALSE)&VLOOKUP(RC[-7],Sheet1!R2C1:R28C4,3,FALSE)&IF(VLOOKUP(RC[-7],Sheet1!R2C1:R28C4,4,FALSE)="品",VLOOKUP(RC[-3],Sheet1!R2C8:R6C9,2,FALSE),RC[-3])&VLOOKUP(RC[-7],Sheet1!R2C1:R28C4,4,FALSE) -> 主线副本总星级达到1350星 | I95: 26 | J95: =VLOOKUP(RC[-9],Sheet1!R2C1:R28C6,6,FALSE) -> 培养石
A96: 3 | B96: btn_dungeon | C96: 46 | D96: 1 | E96: 1380 | F96: 19003 | G96: 460000 | H96: =VLOOKUP(RC[-7],Sheet1!R2C1:R28C4,2,FALSE)&VLOOKUP(RC[-7],Sheet1!R2C1:R28C4,3,FALSE)&IF(VLOOKUP(RC[-7],Sheet1!R2C1:R28C4,4,FALSE)="品",VLOOKUP(RC[-3],Sheet1!R2C8:R6C9,2,FALSE),RC[-3])&VLOOKUP(RC[-7],Sheet1!R2C1:R28C4,4,FALSE) -> 主线副本总星级达到1380星 | I96: 26 | J96: =VLOOKUP(RC[-9],Sheet1!R2C1:R28C6,6,FALSE) -> 培养石
A97: 3 | B97: btn_dungeon | C97: 47 | D97: 1 | E97: 1410 | F97: 19003 | G97: 470000 | H97: =VLOOKUP(RC[-7],Sheet1!R2C1:R28C4,2,FALSE)&VLOOKUP(RC[-7],Sheet1!R2C1:R28C4,3,FALSE)&IF(VLOOKUP(RC[-7],Sheet1!R2C1:R28C4,4,FALSE)="品",VLOOKUP(RC[-3],Sheet1!R2C8:R6C9,2,FALSE),RC[-3])&VLOOKUP(RC[-7],Sheet1!R2C1:R28C4,4,FALSE) -> 主线副本总星级达到1410星 | I97: 26 | J97: =VLOOKUP(RC[-9],Sheet1!R2C1:R28C6,6,FALSE) -> 培养石
A98: 3 | B98: btn_dungeon | C98: 48 | D98: 1 | E98: 1440 | F98: 19003 | G98: 480000 | H98: =VLOOKUP(RC[-7],Sheet1!R2C1:R28C4,2,FALSE)&VLOOKUP(RC[-7],Sheet1!R2C1:R28C4,3,FALSE)&IF(VLOOKUP(RC[-7],Sheet1!R2C1:R28C4,4,FALSE)="品",VLOOKUP(RC[-3],Sheet1!R2C8:R6C9,2,FALSE),RC[-3])&VLOOKUP(RC[-7],Sheet1!R2C1:R28C4,4,FALSE) -> 主线副本总星级达到1440星 | I98: 26 | J98: =VLOOKUP(RC[-9],Sheet1!R2C1:R28C6,6,FALSE) -> 培养石
A99: 3 | B99: btn_dungeon | C99: 49 | D99: 1 | E99: 1470 | F99: 19003 | G99: 490000 | H99: =VLOOKUP(RC[-7],Sheet1!R2C1:R28C4,2,FALSE)&VLOOKUP(RC[-7],Sheet1!R2C1:R28C4,3,FALSE)&IF(VLOOKUP(RC[-7],Sheet1!R2C1:R28C4,4,FALSE)="品",VLOOKUP(RC[-3],Sheet1!R2C8:R6C9,2,FALSE),RC[-3])&VLOOKUP(RC[-7],Sheet1!R2C1:R28C4,4,FALSE) -> 主线副本总星级达到1470星 | I99: 26 | J99: =VLOOKUP(RC[-9],Sheet1!R2C1:R28C6,6,FALSE) -> 培养石
A100: 3 | B100: btn_dungeon | C100: 50 | D100: 1 | E100: 1500 | F100: 19003 | G100: 500000 | H100: =VLOOKUP(RC[-7],Sheet1!R2C1:R28C4,2,FALSE)&VLOOKUP(RC[-7],Sheet1!R2C1:R28C4,3,FALSE)&IF(VLOOKUP(RC[-7],Sheet1!R2C1:R28C4,4,FALSE)="品",VLOOKUP(RC[-3],Sheet1!R2C8:R6C9,2,FALSE),RC[-3])&VLOOKUP(RC[-7],Sheet1!R2C1:R28C4,4,FALSE) -> 主线副本总星级达到1500星 | I100: 26 | J100: =VLOOKUP(RC[-9],Sheet1!R2C1:R28C6,6,FALSE) -> 培养石
A101: 3 | B101: btn_dungeon | C101: 51 | D101: 1 | E101: 1530 | F101: 19003 | G101: 500000 | H101: =VLOOKUP(RC[-7],Sheet1!R2C1:R28C4,2,FALSE)&VLOOKUP(RC[-7],Sheet1!R2C1:R28C4,3,FALSE)&IF(VLOOKUP(RC[-7],Sheet1!R2C1:R28C4,4,FALSE)="品",VLOOKUP(RC[-3],Sheet1!R2C8:R6C9,2,FALSE),RC[-3])&VLOOKUP(RC[-7],Sheet1!R2C1:R28C4,4,FALSE) -> 主线副本总星级达到1530星 | I101: 26 | J101: =VLOOKUP(RC[-9],Sheet1!R2C1:R28C6,6,FALSE) -> 培养石
A102: 3 | B102: btn_dungeon | C102: 52 | D102: 1 | E102: 1560 | F102: 19003 | G102: 500000 | H102: =VLOOKUP(RC[-7],Sheet1!R2C1:R28C4,2,FALSE)&VLOOKUP(RC[-7],Sheet1!R2C1:R28C4,3,FALSE)&IF(VLOOKUP(RC[-7],Sheet1!R2C1:R28C4,4,FALSE)="品",VLOOKUP(RC[-3],Sheet1!R2C8:R6C9,2,FALSE),RC[-3])&VLOOKUP(RC[-7],Sheet1!R2C1:R28C4,4,FALSE) -> 主线副本总星级达到1560星 | I102: 26 | J102: =VLOOKUP(RC[-9],Sheet1!R2C1:R28C6,6,FALSE) -> 培养石
A103: 3 | B103: btn_dungeon | C103: 53 | D103: 1 | E103: 1590 | F103: 19003 | G103: 500000 | H103: =VLOOKUP(RC[-7],Sheet1!R2C1:R28C4,2,FALSE)&VLOOKUP(RC[-7],Sheet1!R2C1:R28C4,3,FALSE)&IF(VLOOKUP(RC[-7],Sheet1!R2C1:R28C4,4,FALSE)="品",VLOOKUP(RC[-3],Sheet1!R2C8:R6C9,2,FALSE),RC[-3])&VLOOKUP(RC[-7],Sheet1!R2C1:R28C4,4,FALSE) -> 主线副本总星级达到1590星 | I103: 26 | J103: =VLOOKUP(RC[-9],Sheet1!R2C1:R28C6,6,FALSE) -> 培养石
A104: 3 | B104: btn_dungeon | C104: 54 | D104: 1 | E104: 1620 | F104: 19003 | G104: 500000 | H104: =VLOOKUP(RC[-7],Sheet1!R2C1:R28C4,2,FALSE)&VLOOKUP(RC[-7],Sheet1!R2C1:R28C4,3,FALSE)&IF(VLOOKUP(RC[-7],Sheet1!R2C1:R28C4,4,FALSE)="品",VLOOKUP(RC[-3],Sheet1!R2C8:R6C9,2,FALSE),RC[-3])&VLOOKUP(RC[-7],Sheet1!R2C1:R28C4,4,FALSE) -> 主线副本总星级达到1620星 | I104: 26 | J104: =VLOOKUP(RC[-9],Sheet1!R2C1:R28C6,6,FALSE) -> 培养石
A105: 3 | B105: btn_dungeon | C105: 55 | D105: 1 | E105: 1650 | F105: 19003 | G105: 500000 | H105: =VLOOKUP(RC[-7],Sheet1!R2C1:R28C4,2,FALSE)&VLOOKUP(RC[-7],Sheet1!R2C1:R28C4,3,FALSE)&IF(VLOOKUP(RC[-7],Sheet1!R2C1:R28C4,4,FALSE)="品",VLOOKUP(RC[-3],Sheet1!R2C8:R6C9,2,FALSE),RC[-3])&VLOOKUP(RC[-7],Sheet1!R2C1:R28C4,4,FALSE) -> 主线副本总星级达到1650星 | I105: 26 | J105: =VLOOKUP(RC[-9],Sheet1!R2C1:R28C6,6,FALSE) -> 培养石
A106: 3 | B106: btn_dungeon | C106: 56 | D106: 1 | E106: 1680 | F106: 19003 | G106: 500000 | H106: =VLOOKUP(RC[-7],Sheet1!R2C1:R28C4,2,FALSE)&VLOOKUP(RC[-7],Sheet1!R2C1:R28C4,3,FALSE)&IF(VLOOKUP(RC[-7],Sheet1!R2C1:R28C4,4,FALSE)="品",VLOOKUP(RC[-3],Sheet1!R2C8:R6C9,2,FALSE),RC[-3])&VLOOKUP(RC[-7],Sheet1!R2C1:R28C4,4,FALSE) -> 主线副本总星级达到1680星 | I106: 26 | J106: =VLOOKUP(RC[-9],Sheet1!R2C1:R28C6,6,FALSE) -> 培养石
A107: 3 | B107: btn_dungeon | C107: 57 | D107: 1 | E107: 1710 | F107: 19003 | G107: 500000 | H107: =VLOOKUP(RC[-7],Sheet1!R2C1:R28C4,2,FALSE)&VLOOKUP(RC[-7],Sheet1!R2C1:R28C4,3,FALSE)&IF(VLOOKUP(RC[-7],Sheet1!R2C1:R28C4,4,FALSE)="品",VLOOKUP(RC[-3],Sheet1!R2C8:R6C9,2,FALSE),RC[-3])&VLOOKUP(RC[-7],Sheet1!R2C1:R28C4,4,FALSE) -> 主线副本总星级达到1710星 | I107: 26 | J107: =VLOOKUP(RC[-9],Sheet1!R2C1:R28C6,6,FALSE) -> 培养石
A108: 3 | B108: btn_dungeon | C108: 58 | D108: 1 | E108: 1740 | F108: 19003 | G108: 500000 | H108: =VLOOKUP(RC[-7],Sheet1!R2C1:R28C4,2,FALSE)&VLOOKUP(RC[-7],Sheet1!R2C1:R28C4,3,FALSE)&IF(VLOOKUP(RC[-7],Sheet1!R2C1:R28C4,4,FALSE)="品",VLOOKUP(RC[-3],Sheet1!R2C8:R6C9,2,FALSE),RC[-3])&VLOOKUP(RC[-7],Sheet1!R2C1:R28C4,4,FALSE) -> 主线副本总星级达到1740星 | I108: 26 | J108: =VLOOKUP(RC[-9],Sheet1!R2C1:R28C6,6,FALSE) -> 培养石
A109: 3 | B109: btn_dungeon | C109: 59 | D109: 1 | E109: 1770 | F109: 19003 | G109: 500000 | H109: =VLOOKUP(RC[-7],Sheet1!R2C1:R28C4,2,FALSE)&VLOOKUP(RC[-7],Sheet1!R2C1:R28C4,3,FALSE)&IF(VLOOKUP(RC[-7],Sheet1!R2C1:R28C4,4,FALSE)="品",VLOOKUP(RC[-3],Sheet1!R2C8:R6C9,2,FALSE),RC[-3])&VLOOKUP(RC[-7],Sheet1!R2C1:R28C4,4,FALSE) -> 主线副本总星级达到1770星 | I109: 26 | J109: =VLOOKUP(RC[-9],Sheet1!R2C1:R28C6,6,FALSE) -> 培养石
A110: 3 | B110: btn_dungeon | C110: 60 | D110: 1 | E110: 1800 | F110: 19003 | G110: 500000 | H110: =VLOOKUP(RC[-7],Sheet1!R2C1:R28C4,2,FALSE)&VLOOKUP(RC[-7],Sheet1!R2C1:R28C4,3,FALSE)&IF(VLOOKUP(RC[-7],Sheet1!R2C1:R28C4,4,FALSE)="品",VLOOKUP(RC[-3],Sheet1!R2C8:R6C9,2,FALSE),RC[-3])&VLOOKUP(RC[-7],Sheet1!R2C1:R28C4,4,FALSE) -> 主线副本总星级达到1800星 | I110: 26 | J110: =VLOOKUP(RC[-9],Sheet1!R2C1:R28C6,6,FALSE) -> 培养石
A111: 3 | B111: btn_dungeon | C111: 61 | D111: 1 | E111: 1830 | F111: 19003 | G111: 500000 | H111: =VLOOKUP(RC[-7],Sheet1!R2C1:R28C4,2,FALSE)&VLOOKUP(RC[-7],Sheet1!R2C1:R28C4,3,FALSE)&IF(VLOOKUP(RC[-7],Sheet1!R2C1:R28C4,4,FALSE)="品",VLOOKUP(RC[-3],Sheet1!R2C8:R6C9,2,FALSE),RC[-3])&VLOOKUP(RC[-7],Sheet1!R2C1:R28C4,4,FALSE) -> 主线副本总星级达到1830星 | I111: 26 | J111: =VLOOKUP(RC[-9],Sheet1!R2C1:R28C6,6,FALSE) -> 培养石
A112: 3 | B112: btn_dungeon | C112: 62 | D112: 1 | E112: 1860 | F112: 19003 | G112: 500000 | H112: =VLOOKUP(RC[-7],Sheet1!R2C1:R28C4,2,FALSE)&VLOOKUP(RC[-7],Sheet1!R2C1:R28C4,3,FALSE)&IF(VLOOKUP(RC[-7],Sheet1!R2C1:R28C4,4,FALSE)="品",VLOOKUP(RC[-3],Sheet1!R2C8:R6C9,2,FALSE),RC[-3])&VLOOKUP(RC[-7],Sheet1!R2C1:R28C4,4,FALSE) -> 主线副本总星级达到1860星 | I112: 26 | J112: =VLOOKUP(RC[-9],Sheet1!R2C1:R28C6,6,FALSE) -> 培养石
A113: 3 | B113: btn_dungeon | C113: 63 | D113: 1 | E113: 1890 | F113: 19003 | G113: 500000 | H113: =VLOOKUP(RC[-7],Sheet1!R2C1:R28C4,2,FALSE)&VLOOKUP(RC[-7],Sheet1!R2C1:R28C4,3,FALSE)&IF(VLOOKUP(RC[-7],Sheet1!R2C1:R28C4,4,FALSE)="品",VLOOKUP(RC[-3],Sheet1!R2C8:R6C9,2,FALSE),RC[-3])&VLOOKUP(RC[-7],Sheet1!R2C1:R28C4,4,FALSE) -> 主线副本总星级达到1890星 | I113: 26 | J113: =VLOOKUP(RC[-9],Sheet1!R2C1:R28C6,6,FALSE) -> 培养石
A114: 3 | B114: btn_dungeon | C114: 64 | D114: 1 | E114: 1920 | F114: 19003 | G114: 500000 | H114: =VLOOKUP(RC[-7],Sheet1!R2C1:R28C4,2,FALSE)&VLOOKUP(RC[-7],Sheet1!R2C1:R28C4,3,FALSE)&IF(VLOOKUP(RC[-7],Sheet1!R2C1:R28C4,4,FALSE)="品",VLOOKUP(RC[-3],Sheet1!R2C8:R6C9,2,FALSE),RC[-3])&VLOOKUP(RC[-7],Sheet1!R2C1:R28C4,4,FALSE) -> 主线副本总星级达到1920星 | I114: 26 | J114: =VLOOKUP(RC[-9],Sheet1!R2C1:R28C6,6,FALSE) -> 培养石
A115: 3 | B115: btn_dungeon | C115: 65 | D115: 1 | E115: 1950 | F115: 19003 | G115: 500000 | H115: =VLOOKUP(RC[-7],Sheet1!R2C1:R28C4,2,FALSE)&VLOOKUP(RC[-7],Sheet1!R2C1:R28C4,3,FALSE)&IF(VLOOKUP(RC[-7],Sheet1!R2C1:R28C4,4,FALSE)="品",VLOOKUP(RC[-3],Sheet1!R2C8:R6C9,2,FALSE),RC[-3])&VLOOKUP(RC[-7],Sheet1!R2C1:R28C4,4,FALSE) -> 主线副本总星级达到1950星 | I115: 26 | J115: =VLOOKUP(RC[-9],Sheet1!R2C1:R28C6,6,FALSE) -> 培养石
A116: 3 | B116: btn_dungeon | C116: 66 | D116: 1 | E116: 1980 | F116: 19003 | G116: 500000 | H116: =VLOOKUP(RC[-7],Sheet1!R2C1:R28C4,2,FALSE)&VLOOKUP(RC[-7],Sheet1!R2C1:R28C4,3,FALSE)&IF(VLOOKUP(RC[-7],Sheet1!R2C1:R28C4,4,FALSE)="品",VLOOKUP(RC[-3],Sheet1!R2C8:R6C9,2,FALSE),RC[-3])&VLOOKUP(RC[-7],Sheet1!R2C1:R28C4,4,FALSE) -> 主线副本总星级达到1980星 | I116: 26 | J116: =VLOOKUP(RC[-9],Sheet1!R2C1:R28C6,6,FALSE) -> 培养石
A117: 3 | B117: btn_dungeon | C117: 67 | D117: 1 | E117: 2010 | F117: 19003 | G117: 500000 | H117: =VLOOKUP(RC[-7],Sheet1!R2C1:R28C4,2,FALSE)&VLOOKUP(RC[-7],Sheet1!R2C1:R28C4,3,FALSE)&IF(VLOOKUP(RC[-7],Sheet1!R2C1:R28C4,4,FALSE)="品",VLOOKUP(RC[-3],Sheet1!R2C8:R6C9,2,FALSE),RC[-3])&VLOOKUP(RC[-7],Sheet1!R2C1:R28C4,4,FALSE) -> 主线副本总星级达到2010星 | I117: 26 | J117: =VLOOKUP(RC[-9],Sheet1!R2C1:R28C6,6,FALSE) -> 培养石
A118: 3 | B118: btn_dungeon | C118: 68 | D118: 1 | E118: 2040 | F118: 19003 | G118: 500000 | H118: =VLOOKUP(RC[-7],Sheet1!R2C1:R28C4,2,FALSE)&VLOOKUP(RC[-7],Sheet1!R2C1:R28C4,3,FALSE)&IF(VLOOKUP(RC[-7],Sheet1!R2C1:R28C4,4,FALSE)="品",VLOOKUP(RC[-3],Sheet1!R2C8:R6C9,2,FALSE),RC[-3])&VLOOKUP(RC[-7],Sheet1!R2C1:R28C4,4,FALSE) -> 主线副本总星级达到2040星 | I118: 26 | J118: =VLOOKUP(RC[-9],Sheet1!R2C1:R28C6,6,FALSE) -> 培养石
A119: 3 | B119: btn_dungeon | C119: 69 | D119: 1 | E119: 2070 | F119: 19003 | G119: 500000 | H119: =VLOOKUP(RC[-7],Sheet1!R2C1:R28C4,2,FALSE)&VLOOKUP(RC[-7],Sheet1!R2C1:R28C4,3,FALSE)&IF(VLOOKUP(RC[-7],Sheet1!R2C1:R28C4,4,FALSE)="品",VLOOKUP(RC[-3],Sheet1!R2C8:R6C9,2,FALSE),RC[-3])&VLOOKUP(RC[-7],Sheet1!R2C1:R28C4,4,FALSE) -> 主线副本总星级达到2070星 | I119: 26 | J119: =VLOOKUP(RC[-9],Sheet1!R2C1:R28C6,6,FALSE) -> 培养石
A120: 3 | B120: btn_dungeon | C120: 70 | D120: 1 | E120: 2100 | F120: 19003 | G120: 500000 | H120: =VLOOKUP(RC[-7],Sheet1!R2C1:R28C4,2,FALSE)&VLOOKUP(RC[-7],Sheet1!R2C1:R28C4,3,FALSE)&IF(VLOOKUP(RC[-7],Sheet1!R2C1:R28C4,4,FALSE)="品",VLOOKUP(RC[-3],Sheet1!R2C8:R6C9,2,FALSE),RC[-3])&VLOOKUP(RC[-7],Sheet1!R2C1:R28C4,4,FALSE) -> 主线副本总星级达到2100星 | I120: 26 | J120: =VLOOKUP(RC[-9],Sheet1!R2C1:R28C6,6,FALSE) -> 培养石
A121: 3 | B121: btn_dungeon | C121: 71 | D121: 1 | E121: 2130 | F121: 19003 | G121: 500000 | H121: =VLOOKUP(RC[-7],Sheet1!R2C1:R28C4,2,FALSE)&VLOOKUP(RC[-7],Sheet1!R2C1:R28C4,3,FALSE)&IF(VLOOKUP(RC[-7],Sheet1!R2C1:R28C4,4,FALSE)="品",VLOOKUP(RC[-3],Sheet1!R2C8:R6C9,2,FALSE),RC[-3])&VLOOKUP(RC[-7],Sheet1!R2C1:R28C4,4,FALSE) -> 主线副本总星级达到2130星 | I121: 26 | J121: =VLOOKUP(RC[-9],Sheet1!R2C1:R28C6,6,FALSE) -> 培养石
A122: 3 | B122: btn_dungeon | C122: 72 | D122: 1 | E122: 2160 | F122: 19003 | G122: 500000 | H122: =VLOOKUP(RC[-7],Sheet1!R2C1:R28C4,2,FALSE)&VLOOKUP(RC[-7],Sheet1!R2C1:R28C4,3,FALSE)&IF(VLOOKUP(RC[-7],Sheet1!R2C1:R28C4,4,FALSE)="品",VLOOKUP(RC[-3],Sheet1!R2C8:R6C9,2,FALSE),RC[-3])&VLOOKUP(RC[-7],Sheet1!R2C1:R28C4,4,FALSE) -> 主线副本总星级达到2160星 | I122: 26 | J122: =VLOOKUP(RC[-9],Sheet1!R2C1:R28C6,6,FALSE) -> 培养石
A123: 3 | B123: btn_dungeon | C123: 73 | D123: 1 | E123: 2190 | F123: 19003 | G123: 500000 | H123: =VLOOKUP(RC[-7],Sheet1!R2C1:R28C4,2,FALSE)&VLOOKUP(RC[-7],Sheet1!R2C1:R28C4,3,FALSE)&IF(VLOOKUP(RC[-7],Sheet1!R2C1:R28C4,4,FALSE)="品",VLOOKUP(RC[-3],Sheet1!R2C8:R6C9,2,FALSE),RC[-3])&VLOOKUP(RC[-7],Sheet1!R2C1:R28C4,4,FALSE) -> 主线副本总星级达到2190星 | I123: 26 | J123: =VLOOKUP(RC[-9],Sheet1!R2C1:R28C6,6,FALSE) -> 培养石
A124: 3 | B124: btn_dungeon | C124: 74 | D124: 1 | E124: 2220 | F124: 19003 | G124: 500000 | H124: =VLOOKUP(RC[-7],Sheet1!R2C1:R28C4,2,FALSE)&VLOOKUP(RC[-7],Sheet1!R2C1:R28C4,3,FALSE)&IF(VLOOKUP(RC[-7],Sheet1!R2C1:R28C4,4,FALSE)="品",VLOOKUP(RC[-3],Sheet1!R2C8:R6C9,2,FALSE),RC[-3])&VLOOKUP(RC[-7],Sheet1!R2C1:R28C4,4,FALSE) -> 主线副本总星级达到2220星 | I124: 26 | J124: =VLOOKUP(RC[-9],Sheet1!R2C1:R28C6,6,FALSE) -> 培养石
A125: 3 | B125: btn_dungeon | C125: 75 | D125: 1 | E125: 2250 | F125: 19003 | G125: 500000 | H125: =VLOOKUP(RC[-7],Sheet1!R2C1:R28C4,2,FALSE)&VLOOKUP(RC[-7],Sheet1!R2C1:R28C4,3,FALSE)&IF(VLOOKUP(RC[-7],Sheet1!R2C1:R28C4,4,FALSE)="品",VLOOKUP(RC[-3],Sheet1!R2C8:R6C9,2,FALSE),RC[-3])&VLOOKUP(RC[-7],Sheet1!R2C1:R28C4,4,FALSE) -> 主线副本总星级达到2250星 | I125: 26 | J125: =VLOOKUP(RC[-9],Sheet1!R2C1:R28C6,6,FALSE) -> 培养石
A126: 3 | B126: btn_dungeon | C126: 76 | D126: 1 | E126: 2280 | F126: 19003 | G126: 500000 | H126: =VLOOKUP(RC[-7],Sheet1!R2C1:R28C4,2,FALSE)&VLOOKUP(RC[-7],Sheet1!R2C1:R28C4,3,FALSE)&IF(VLOOKUP(RC[-7],Sheet1!R2C1:R28C4,4,FALSE)="品",VLOOKUP(RC[-3],Sheet1!R2C8:R6C9,2,FALSE),RC[-3])&VLOOKUP(RC[-7],Sheet1!R2C1:R28C4,4,FALSE) -> 主线副本总星级达到2280星 | I126: 26 | J126: =VLOOKUP(RC[-9],Sheet1!R2C1:R28C6,6,FALSE) -> 培养石
A127: 3 | B127: btn_dungeon | C127: 77 | D127: 1 | E127: 2310 | F127: 19003 | G127: 500000 | H127: =VLOOKUP(RC[-7],Sheet1!R2C1:R28C4,2,FALSE)&VLOOKUP(RC[-7],Sheet1!R2C1:R28C4,3,FALSE)&IF(VLOOKUP(RC[-7],Sheet1!R2C1:R28C4,4,FALSE)="品",VLOOKUP(RC[-3],Sheet1!R2C8:R6C9,2,FALSE),RC[-3])&VLOOKUP(RC[-7],Sheet1!R2C1:R28C4,4,FALSE) -> 主线副本总星级达到2310星 | I127: 26 | J127: =VLOOKUP(RC[-9],Sheet1!R2C1:R28C6,6,FALSE) -> 培养石
A128: 3 | B128: btn_dungeon | C128: 78 | D128: 1 | E128: 2340 | F128: 19003 | G128: 500000 | H128: =VLOOKUP(RC[-7],Sheet1!R2C1:R28C4,2,FALSE)&VLOOKUP(RC[-7],Sheet1!R2C1:R28C4,3,FALSE)&IF(VLOOKUP(RC[-7],Sheet1!R2C1:R28C4,4,FALSE)="品",VLOOKUP(RC[-3],Sheet1!R2C8:R6C9,2,FALSE),RC[-3])&VLOOKUP(RC[-7],Sheet1!R2C1:R28C4,4,FALSE) -> 主线副本总星级达到2340星 | I128: 26 | J128: =VLOOKUP(RC[-9],Sheet1!R2C1:R28C6,6,FALSE) -> 培养石
A129: 3 | B129: btn_dungeon | C129: 79 | D129: 1 | E129: 2370 | F129: 19003 | G129: 500000 | H129: =VLOOKUP(RC[-7],Sheet1!R2C1:R28C4,2,FALSE)&VLOOKUP(RC[-7],Sheet1!R2C1:R28C4,3,FALSE)&IF(VLOOKUP(RC[-7],Sheet1!R2C1:R28C4,4,FALSE)="品",VLOOKUP(RC[-3],Sheet1!R2C8:R6C9,2,FALSE),RC[-3])&VLOOKUP(RC[-7],Sheet1!R2C1:R28C4,4,FALSE) -> 主线副本总星级达到2370星 | I129: 26 | J129: =VLOOKUP(RC[-9],Sheet1!R2C1:R28C6,6,FALSE) -> 培养石
A130: 3 | B130: btn_dungeon | C130: 80 | D130: 1 | E130: 2400 | F130: 19003 | G130: 500000 | H130: =VLOOKUP(RC[-7],Sheet1!R2C1:R28C4,2,FALSE)&VLOOKUP(RC[-7],Sheet1!R2C1:R28C4,3,FALSE)&IF(VLOOKUP(RC[-7],Sheet1!R2C1:R28C4,4,FALSE)="品",VLOOKUP(RC[-3],Sheet1!R2C8:R6C9,2,FALSE),RC[-3])&VLOOKUP(RC[-7],Sheet1!R2C1:R28C4,4,FALSE) -> 主线副本总星级达到2400星 | I130: 26 | J130: =VLOOKUP(RC[-9],Sheet1!R2C1:R28C6,6,FALSE) -> 培养石
A131: 3 | B131: btn_dungeon | C131: 81 | D131: 1 | E131: 2430 | F131: 19003 | G131: 500000 | H131: =VLOOKUP(RC[-7],Sheet1!R2C1:R28C4,2,FALSE)&VLOOKUP(RC[-7],Sheet1!R2C1:R28C4,3,FALSE)&IF(VLOOKUP(RC[-7],Sheet1!R2C1:R28C4,4,FALSE)="品",VLOOKUP(RC[-3],Sheet1!R2C8:R6C9,2,FALSE),RC[-3])&VLOOKUP(RC[-7],Sheet1!R2C1:R28C4,4,FALSE) -> 主线副本总星级达到2430星 | I131: 26 | J131: =VLOOKUP(RC[-9],Sheet1!R2C1:R28C6,6,FALSE) -> 培养石
A132: 3 | B132: btn_dungeon | C132: 82 | D132: 1 | E132: 2460 | F132: 19003 | G132: 500000 | H132: =VLOOKUP(RC[-7],Sheet1!R2C1:R28C4,2,FALSE)&VLOOKUP(RC[-7],Sheet1!R2C1:R28C4,3,FALSE)&IF(VLOOKUP(RC[-7],Sheet1!R2C1:R28C4,4,FALSE)="品",VLOOKUP(RC[-3],Sheet1!R2C8:R6C9,2,FALSE),RC[-3])&VLOOKUP(RC[-7],Sheet1!R2C1:R28C4,4,FALSE) -> 主线副本总星级达到2460星 | I132: 26 | J132: =VLOOKUP(RC[-9],Sheet1!R2C1:R28C6,6,FALSE) -> 培养石
A133: 3 | B133: btn_dungeon | C133: 83 | D133: 1 | E133: 2490 | F133: 19003 | G133: 500000 | H133: =VLOOKUP(RC[-7],Sheet1!R2C1:R28C4,2,FALSE)&VLOOKUP(RC[-7],Sheet1!R2C1:R28C4,3,FALSE)&IF(VLOOKUP(RC[-7],Sheet1!R2C1:R28C4,4,FALSE)="品",VLOOKUP(RC[-3],Sheet1!R2C8:R6C9,2,FALSE),RC[-3])&VLOOKUP(RC[-7],Sheet1!R2C1:R28C4,4,FALSE) -> 主线副本总星级达到2490星 | I133: 26 | J133: =VLOOKUP(RC[-9],Sheet1!R2C1:R28C6,6,FALSE) -> 培养石
A134: 3 | B134: btn_dungeon | C134: 84 | D134: 1 | E134: 2520 | F134: 19003 | G134: 500000 | H134: =VLOOKUP(RC[-7],Sheet1!R2C1:R28C4,2,FALSE)&VLOOKUP(RC[-7],Sheet1!R2C1:R28C4,3,FALSE)&IF(VLOOKUP(RC[-7],Sheet1!R2C1:R28C4,4,FALSE)="品",VLOOKUP(RC[-3],Sheet1!R2C8:R6C9,2,FALSE),RC[-3])&VLOOKUP(RC[-7],Sheet1!R2C1:R28C4,4,FALSE) -> 主线副本总星级达到2520星 | I134: 26 | J134: =VLOOKUP(RC[-9],Sheet1!R2C1:R28C6,6,FALSE) -> 培养石
A135: 3 | B135: btn_dungeon | C135: 85 | D135: 1 | E135: 2550 | F135: 19003 | G135: 500000 | H135: =VLOOKUP(RC[-7],Sheet1!R2C1:R28C4,2,FALSE)&VLOOKUP(RC[-7],Sheet1!R2C1:R28C4,3,FALSE)&IF(VLOOKUP(RC[-7],Sheet1!R2C1:R28C4,4,FALSE)="品",VLOOKUP(RC[-3],Sheet1!R2C8:R6C9,2,FALSE),RC[-3])&VLOOKUP(RC[-7],Sheet1!R2C1:R28C4,4,FALSE) -> 主线副本总星级达到2550星 | I135: 26 | J135: =VLOOKUP(RC[-9],Sheet1!R2C1:R28C6,6,FALSE) -> 培养石
A136: 3 | B136: btn_dungeon | C136: 86 | D136: 1 | E136: 2580 | F136: 19003 | G136: 500000 | H136: =VLOOKUP(RC[-7],Sheet1!R2C1:R28C4,2,FALSE)&VLOOKUP(RC[-7],Sheet1!R2C1:R28C4,3,FALSE)&IF(VLOOKUP(RC[-7],Sheet1!R2C1:R28C4,4,FALSE)="品",VLOOKUP(RC[-3],Sheet1!R2C8:R6C9,2,FALSE),RC[-3])&VLOOKUP(RC[-7],Sheet1!R2C1:R28C4,4,FALSE) -> 主线副本总星级达到2580星 | I136: 26 | J136: =VLOOKUP(RC[-9],Sheet1!R2C1:R28C6,6,FALSE) -> 培养石
A137: 3 | B137: btn_dungeon | C137: 87 | D137: 1 | E137: 2610 | F137: 19003 | G137: 500000 | H137: =VLOOKUP(RC[-7],Sheet1!R2C1:R28C4,2,FALSE)&VLOOKUP(RC[-7],Sheet1!R2C1:R28C4,3,FALSE)&IF(VLOOKUP(RC[-7],Sheet1!R2C1:R28C4,4,FALSE)="品",VLOOKUP(RC[-3],Sheet1!R2C8:R6C9,2,FALSE),RC[-3])&VLOOKUP(RC[-7],Sheet1!R2C1:R28C4,4,FALSE) -> 主线副本总星级达到2610星 | I137: 26 | J137: =VLOOKUP(RC[-9],Sheet1!R2C1:R28C6,6,FALSE) -> 培养石
A138: 3 | B138: btn_dungeon | C138: 88 | D138: 1 | E138: 2640 | F138: 19003 | G138: 500000 | H138: =VLOOKUP(RC[-7],Sheet1!R2C1:R28C4,2,FALSE)&VLOOKUP(RC[-7],Sheet1!R2C1:R28C4,3,FALSE)&IF(VLOOKUP(RC[-7],Sheet1!R2C1:R28C4,4,FALSE)="品",VLOOKUP(RC[-3],Sheet1!R2C8:R6C9,2,FALSE),RC[-3])&VLOOKUP(RC[-7],Sheet1!R2C1:R28C4,4,FALSE) -> 主线副本总星级达到2640星 | I138: 26 | J138: =VLOOKUP(RC[-9],Sheet1!R2C1:R28C6,6,FALSE) -> 培养石
A139: 3 | B139: btn_dungeon | C139: 89 | D139: 1 | E139: 2670 | F139: 19003 | G139: 500000 | H139: =VLOOKUP(RC[-7],Sheet1!R2C1:R28C4,2,FALSE)&VLOOKUP(RC[-7],Sheet1!R2C1:R28C4,3,FALSE)&IF(VLOOKUP(RC[-7],Sheet1!R2C1:R28C4,4,FALSE)="品",VLOOKUP(RC[-3],Sheet1!R2C8:R6C9,2,FALSE),RC[-3])&VLOOKUP(RC[-7],Sheet1!R2C1:R28C4,4,FALSE) -> 主线副本总星级达到2670星 | I139: 26 | J139: =VLOOKUP(RC[-9],Sheet1!R2C1:R28C6,6,FALSE) -> 培养石
A140: 3 | B140: btn_dungeon | C140: 90 | D140: 1 | E140: 2700 | F140: 19003 | G140: 500000 | H140: =VLOOKUP(RC[-7],Sheet1!R2C1:R28C4,2,FALSE)&VLOOKUP(RC[-7],Sheet1!R2C1:R28C4,3,FALSE)&IF(VLOOKUP(RC[-7],Sheet1!R2C1:R28C4,4,FALSE)="品",VLOOKUP(RC[-3],Sheet1!R2C8:R6C9,2,FALSE),RC[-3])&VLOOKUP(RC[-7],Sheet1!R2C1:R28C4,4,FALSE) -> 主线副本总星级达到2700星 | I140: 26 | J140: =VLOOKUP(RC[-9],Sheet1!R2C1:R28C6,6,FALSE) -> 培养石
A141: 3 | B141: btn_dungeon | C141: 91 | D141: 1 | E141: 2730 | F141: 19003 | G141: 500000 | H141: =VLOOKUP(RC[-7],Sheet1!R2C1:R28C4,2,FALSE)&VLOOKUP(RC[-7],Sheet1!R2C1:R28C4,3,FALSE)&IF(VLOOKUP(RC[-7],Sheet1!R2C1:R28C4,4,FALSE)="品",VLOOKUP(RC[-3],Sheet1!R2C8:R6C9,2,FALSE),RC[-3])&VLOOKUP(RC[-7],Sheet1!R2C1:R28C4,4,FALSE) -> 主线副本总星级达到2730星 | I141: 26 | J141: =VLOOKUP(RC[-9],Sheet1!R2C1:R28C6,6,FALSE) -> 培养石
A142: 3 | B142: btn_dungeon | C142: 92 | D142: 1 | E142: 2760 | F142: 19003 | G142: 500000 | H142: =VLOOKUP(RC[-7],Sheet1!R2C1:R28C4,2,FALSE)&VLOOKUP(RC[-7],Sheet1!R2C1:R28C4,3,FALSE)&IF(VLOOKUP(RC[-7],Sheet1!R2C1:R28C4,4,FALSE)="品",VLOOKUP(RC[-3],Sheet1!R2C8:R6C9,2,FALSE),RC[-3])&VLOOKUP(RC[-7],Sheet1!R2C1:R28C4,4,FALSE) -> 主线副本总星级达到2760星 | I142: 26 | J142: =VLOOKUP(RC[-9],Sheet1!R2C1:R28C6,6,FALSE) -> 培养石
A143: 3 | B143: btn_dungeon | C143: 93 | D143: 1 | E143: 2790 | F143: 19003 | G143: 500000 | H143: =VLOOKUP(RC[-7],Sheet1!R2C1:R28C4,2,FALSE)&VLOOKUP(RC[-7],Sheet1!R2C1:R28C4,3,FALSE)&IF(VLOOKUP(RC[-7],Sheet1!R2C1:R28C4,4,FALSE)="品",VLOOKUP(RC[-3],Sheet1!R2C8:R6C9,2,FALSE),RC[-3])&VLOOKUP(RC[-7],Sheet1!R2C1:R28C4,4,FALSE) -> 主线副本总星级达到2790星 | I143: 26 | J143: =VLOOKUP(RC[-9],Sheet1!R2C1:R28C6,6,FALSE) -> 培养石
A144: 3 | B144: btn_dungeon | C144: 94 | D144: 1 | E144: 2820 | F144: 19003 | G144: 500000 | H144: =VLOOKUP(RC[-7],Sheet1!R2C1:R28C4,2,FALSE)&VLOOKUP(RC[-7],Sheet1!R2C1:R28C4,3,FALSE)&IF(VLOOKUP(RC[-7],Sheet1!R2C1:R28C4,4,FALSE)="品",VLOOKUP(RC[-3],Sheet1!R2C8:R6C9,2,FALSE),RC[-3])&VLOOKUP(RC[-7],Sheet1!R2C1:R28C4,4,FALSE) -> 主线副本总星级达到2820星 | I144: 26 | J144: =VLOOKUP(RC[-9],Sheet1!R2C1:R28C6,6,FALSE) -> 培养石
A145: 3 | B145: btn_dungeon | C145: 95 | D145: 1 | E145: 2850 | F145: 19003 | G145: 500000 | H145: =VLOOKUP(RC[-7],Sheet1!R2C1:R28C4,2,FALSE)&VLOOKUP(RC[-7],Sheet1!R2C1:R28C4,3,FALSE)&IF(VLOOKUP(RC[-7],Sheet1!R2C1:R28C4,4,FALSE)="品",VLOOKUP(RC[-3],Sheet1!R2C8:R6C9,2,FALSE),RC[-3])&VLOOKUP(RC[-7],Sheet1!R2C1:R28C4,4,FALSE) -> 主线副本总星级达到2850星 | I145: 26 | J145: =VLOOKUP(RC[-9],Sheet1!R2C1:R28C6,6,FALSE) -> 培养石
A146: 3 | B146: btn_dungeon | C146: 96 | D146: 1 | E146: 2880 | F146: 19003 | G146: 500000 | H146: =VLOOKUP(RC[-7],Sheet1!R2C1:R28C4,2,FALSE)&VLOOKUP(RC[-7],Sheet1!R2C1:R28C4,3,FALSE)&IF(VLOOKUP(RC[-7],Sheet1!R2C1:R28C4,4,FALSE)="品",VLOOKUP(RC[-3],Sheet1!R2C8:R6C9,2,FALSE),RC[-3])&VLOOKUP(RC[-7],Sheet1!R2C1:R28C4,4,FALSE) -> 主线副本总星级达到2880星 | I146: 26 | J146: =VLOOKUP(RC[-9],Sheet1!R2C1:R28C6,6,FALSE) -> 培养石
A147: 3 | B147: btn_dungeon | C147: 97 | D147: 1 | E147: 2910 | F147: 19003 | G147: 500000 | H147: =VLOOKUP(RC[-7],Sheet1!R2C1:R28C4,2,FALSE)&VLOOKUP(RC[-7],Sheet1!R2C1:R28C4,3,FALSE)&IF(VLOOKUP(RC[-7],Sheet1!R2C1:R28C4,4,FALSE)="品",VLOOKUP(RC[-3],Sheet1!R2C8:R6C9,2,FALSE),RC[-3])&VLOOKUP(RC[-7],Sheet1!R2C1:R28C4,4,FALSE) -> 主线副本总星级达到2910星 | I147: 26 | J147: =VLOOKUP(RC[-9],Sheet1!R2C1:R28C6,6,FALSE) -> 培养石
A148: 3 | B148: btn_dungeon | C148: 98 | D148: 1 | E148: 2940 | F148: 19003 | G148: 500000 | H148: =VLOOKUP(RC[-7],Sheet1!R2C1:R28C4,2,FALSE)&VLOOKUP(RC[-7],Sheet1!R2C1:R28C4,3,FALSE)&IF(VLOOKUP(RC[-7],Sheet1!R2C1:R28C4,4,FALSE)="品",VLOOKUP(RC[-3],Sheet1!R2C8:R6C9,2,FALSE),RC[-3])&VLOOKUP(RC[-7],Sheet1!R2C1:R28C4,4,FALSE) -> 主线副本总星级达到2940星 | I148: 26 | J148: =VLOOKUP(RC[-9],Sheet1!R2C1:R28C6,6,FALSE) -> 培养石
A149: 3 | B149: btn_dungeon | C149: 99 | D149: 1 | E149: 2970 | F149: 19003 | G149: 500000 | H149: =VLOOKUP(RC[-7],Sheet1!R2C1:R28C4,2,FALSE)&VLOOKUP(RC[-7],Sheet1!R2C1:R28C4,3,FALSE)&IF(VLOOKUP(RC[-7],Sheet1!R2C1:R28C4,4,FALSE)="品",VLOOKUP(RC[-3],Sheet1!R2C8:R6C9,2,FALSE),RC[-3])&VLOOKUP(RC[-7],Sheet1!R2C1:R28C4,4,FALSE) -> 主线副本总星级达到2970星 | I149: 26 | J149: =VLOOKUP(RC[-9],Sheet1!R2C1:R28C6,6,FALSE) -> 培养石
A150: 3 | B150: btn_dungeon | C150: 100 | D150: 1 | E150: 3000 | F150: 19003 | G150: 500000 | H150: =VLOOKUP(RC[-7],Sheet1!R2C1:R28C4,2,FALSE)&VLOOKUP(RC[-7],Sheet1!R2C1:R28C4,3,FALSE)&IF(VLOOKUP(RC[-7],Sheet1!R2C1:R28C4,4,FALSE)="品",VLOOKUP(RC[-3],Sheet1!R2C8:R6C9,2,FALSE),RC[-3])&VLOOKUP(RC[-7],Sheet1!R2C1:R28C4,4,FALSE) -> 主线副本总星级达到3000星 | I150: 26 | J150: =VLOOKUP(RC[-9],Sheet1!R2C1:R28C6,6,FALSE) -> 培养石
A151: 4 | B151: btn_dungeon | C151: 1 | D151: 1 | E151: 1 | F151: 19003 | G151: 10000 | H151: =VLOOKUP(RC[-7],Sheet1!R2C1:R28C4,2,FALSE)&VLOOKUP(RC[-7],Sheet1!R2C1:R28C4,3,FALSE)&IF(VLOOKUP(RC[-7],Sheet1!R2C1:R28C4,4,FALSE)="品",VLOOKUP(RC[-3],Sheet1!R2C8:R6C9,2,FALSE),RC[-3])&VLOOKUP(RC[-7],Sheet1!R2C1:R28C4,4,FALSE) -> 通关主线副本第1章 | I151: 26 | J151: =VLOOKUP(RC[-9],Sheet1!R2C1:R28C6,6,FALSE) -> 金币
A152: 4 | B152: btn_dungeon | C152: 2 | D152: 1 | E152: 2 | F152: 19003 | G152: 10000 | H152: =VLOOKUP(RC[-7],Sheet1!R2C1:R28C4,2,FALSE)&VLOOKUP(RC[-7],Sheet1!R2C1:R28C4,3,FALSE)&IF(VLOOKUP(RC[-7],Sheet1!R2C1:R28C4,4,FALSE)="品",VLOOKUP(RC[-3],Sheet1!R2C8:R6C9,2,FALSE),RC[-3])&VLOOKUP(RC[-7],Sheet1!R2C1:R28C4,4,FALSE) -> 通关主线副本第2章 | I152: 26 | J152: =VLOOKUP(RC[-9],Sheet1!R2C1:R28C6,6,FALSE) -> 金币
A153: 4 | B153: btn_dungeon | C153: 3 | D153: 1 | E153: 3 | F153: 19003 | G153: 10000 | H153: =VLOOKUP(RC[-7],Sheet1!R2C1:R28C4,2,FALSE)&VLOOKUP(RC[-7],Sheet1!R2C1:R28C4,3,FALSE)&IF(VLOOKUP(RC[-7],Sheet1!R2C1:R28C4,4,FALSE)="品",VLOOKUP(RC[-3],Sheet1!R2C8:R6C9,2,FALSE),RC[-3])&VLOOKUP(RC[-7],Sheet1!R2C1:R28C4,4,FALSE) -> 通关主线副本第3章 | I153: 26 | J153: =VLOOKUP(RC[-9],Sheet1!R2C1:R28C6,6,FALSE) -> 金币
A154: 4 | B154: btn_dungeon | C154: 4 | D154: 1 | E154: 4 | F154: 19003 | G154: 10000 | H154: =VLOOKUP(RC[-7],Sheet1!R2C1:R28C4,2,FALSE)&VLOOKUP(RC[-7],Sheet1!R2C1:R28C4,3,FALSE)&IF(VLOOKUP(RC[-7],Sheet1!R2C1:R28C4,4,FALSE)="品",VLOOKUP(RC[-3],Sheet1!R2C8:R6C9,2,FALSE),RC[-3])&VLOOKUP(RC[-7],Sheet1!R2C1:R28C4,4,FALSE) -> 通关主线副本第4章 | I154: 26 | J154: =VLOOKUP(RC[-9],Sheet1!R2C1:R28C6,6,FALSE) -> 金币
A155: 4 | B155: btn_dungeon | C155: 5 | D155: 1 | E155: 5 | F155: 19003 | G155: 10000 | H155: =VLOOKUP(RC[-7],Sheet1!R2C1:R28C4,2,FALSE)&VLOOKUP(RC[-7],Sheet1!R2C1:R28C4,3,FALSE)&IF(VLOOKUP(RC[-7],Sheet1!R2C1:R28C4,4,FALSE)="品",VLOOKUP(RC[-3],Sheet1!R2C8:R6C9,2,FALSE),RC[-3])&VLOOKUP(RC[-7],Sheet1!R2C1:R28C4,4,FALSE) -> 通关主线副本第5章 | I155: 26 | J155: =VLOOKUP(RC[-9],Sheet1!R2C1:R28C6,6,FALSE) -> 金币
A156: 4 | B156: btn_dungeon | C156: 6 | D156: 1 | E156: 6 | F156: 19003 | G156: 20000 | H156: =VLOOKUP(RC[-7],Sheet1!R2C1:R28C4,2,FALSE)&VLOOKUP(RC[-7],Sheet1!R2C1:R28C4,3,FALSE)&IF(VLOOKUP(RC[-7],Sheet1!R2C1:R28C4,4,FALSE)="品",VLOOKUP(RC[-3],Sheet1!R2C8:R6C9,2,FALSE),RC[-3])&VLOOKUP(RC[-7],Sheet1!R2C1:R28C4,4,FALSE) -> 通关主线副本第6章 | I156: 26 | J156: =VLOOKUP(RC[-9],Sheet1!R2C1:R28C6,6,FALSE) -> 金币
A157: 4 | B157: btn_dungeon | C157: 7 | D157: 1 | E157: 7 | F157: 19003 | G157: 20000 | H157: =VLOOKUP(RC[-7],Sheet1!R2C1:R28C4,2,FALSE)&VLOOKUP(RC[-7],Sheet1!R2C1:R28C4,3,FALSE)&IF(VLOOKUP(RC[-7],Sheet1!R2C1:R28C4,4,FALSE)="品",VLOOKUP(RC[-3],Sheet1!R2C8:R6C9,2,FALSE),RC[-3])&VLOOKUP(RC[-7],Sheet1!R2C1:R28C4,4,FALSE) -> 通关主线副本第7章 | I157: 26 | J157: =VLOOKUP(RC[-9],Sheet1!R2C1:R28C6,6,FALSE) -> 金币
A158: 4 | B158: btn_dungeon | C158: 8 | D158: 1 | E158: 8 | F158: 19003 | G158: 20000 | H158: =VLOOKUP(RC[-7],Sheet1!R2C1:R28C4,2,FALSE)&VLOOKUP(RC[-7],Sheet1!R2C1:R28C4,3,FALSE)&IF(VLOOKUP(RC[-7],Sheet1!R2C1:R28C4,4,FALSE)="品",VLOOKUP(RC[-3],Sheet1!R2C8:R6C9,2,FALSE),RC[-3])&VLOOKUP(RC[-7],Sheet1!R2C1:R28C4,4,FALSE) -> 通关主线副本第8章 | I158: 26 | J158: =VLOOKUP(RC[-9],Sheet1!R2C1:R28C6,6,FALSE) -> 金币
A159: 4 | B159: btn_dungeon | C159: 9 | D159: 1 | E159: 9 | F159: 19003 | G159: 20000 | H159: =VLOOKUP(RC[-7],Sheet1!R2C1:R28C4,2,FALSE)&VLOOKUP(RC[-7],Sheet1!R2C1:R28C4,3,FALSE)&IF(VLOOKUP(RC[-7],Sheet1!R2C1:R28C4,4,FALSE)="品",VLOOKUP(RC[-3],Sheet1!R2C8:R6C9,2,FALSE),RC[-3])&VLOOKUP(RC[-7],Sheet1!R2C1:R28C4,4,FALSE) -> 通关主线副本第9章 | I159: 26 | J159: =VLOOKUP(RC[-9],Sheet1!R2C1:R28C6,6,FALSE) -> 金币
A160: 4 | B160: btn_dungeon | C160: 10 | D160: 1 | E160: 10 | F160: 19003 | G160: 20000 | H160: =VLOOKUP(RC[-7],Sheet1!R2C1:R28C4,2,FALSE)&VLOOKUP(RC[-7],Sheet1!R2C1:R28C4,3,FALSE)&IF(VLOOKUP(RC[-7],Sheet1!R2C1:R28C4,4,FALSE)="品",VLOOKUP(RC[-3],Sheet1!R2C8:R6C9,2,FALSE),RC[-3])&VLOOKUP(RC[-7],Sheet1!R2C1:R28C4,4,FALSE) -> 通关主线副本第10章 | I160: 26 | J160: =VLOOKUP(RC[-9],Sheet1!R2C1:R28C6,6,FALSE) -> 金币
A161: 4 | B161: btn_dungeon | C161: 11 | D161: 1 | E161: 11 | F161: 19003 | G161: 50000 | H161: =VLOOKUP(RC[-7],Sheet1!R2C1:R28C4,2,FALSE)&VLOOKUP(RC[-7],Sheet1!R2C1:R28C4,3,FALSE)&IF(VLOOKUP(RC[-7],Sheet1!R2C1:R28C4,4,FALSE)="品",VLOOKUP(RC[-3],Sheet1!R2C8:R6C9,2,FALSE),RC[-3])&VLOOKUP(RC[-7],Sheet1!R2C1:R28C4,4,FALSE) -> 通关主线副本第11章 | I161: 26 | J161: =VLOOKUP(RC[-9],Sheet1!R2C1:R28C6,6,FALSE) -> 金币
A162: 4 | B162: btn_dungeon | C162: 12 | D162: 1 | E162: 12 | F162: 19003 | G162: 50000 | H162: =VLOOKUP(RC[-7],Sheet1!R2C1:R28C4,2,FALSE)&VLOOKUP(RC[-7],Sheet1!R2C1:R28C4,3,FALSE)&IF(VLOOKUP(RC[-7],Sheet1!R2C1:R28C4,4,FALSE)="品",VLOOKUP(RC[-3],Sheet1!R2C8:R6C9,2,FALSE),RC[-3])&VLOOKUP(RC[-7],Sheet1!R2C1:R28C4,4,FALSE) -> 通关主线副本第12章 | I162: 26 | J162: =VLOOKUP(RC[-9],Sheet1!R2C1:R28C6,6,FALSE) -> 金币
A163: 4 | B163: btn_dungeon | C163: 13 | D163: 1 | E163: 13 | F163: 19003 | G163: 50000 | H163: =VLOOKUP(RC[-7],Sheet1!R2C1:R28C4,2,FALSE)&VLOOKUP(RC[-7],Sheet1!R2C1:R28C4,3,FALSE)&IF(VLOOKUP(RC[-7],Sheet1!R2C1:R28C4,4,FALSE)="品",VLOOKUP(RC[-3],Sheet1!R2C8:R6C9,2,FALSE),RC[-3])&VLOOKUP(RC[-7],Sheet1!R2C1:R28C4,4,FALSE) -> 通关主线副本第13章 | I163: 26 | J163: =VLOOKUP(RC[-9],Sheet1!R2C1:R28C6,6,FALSE) -> 金币
A164: 4 | B164: btn_dungeon | C164: 14 | D164: 1 | E164: 14 | F164: 19003 | G164: 50000 | H164: =VLOOKUP(RC[-7],Sheet1!R2C1:R28C4,2,FALSE)&VLOOKUP(RC[-7],Sheet1!R2C1:R28C4,3,FALSE)&IF(VLOOKUP(RC[-7],Sheet1!R2C1:R28C4,4,FALSE)="品",VLOOKUP(RC[-3],Sheet1!R2C8:R6C9,2,FALSE),RC[-3])&VLOOKUP(RC[-7],Sheet1!R2C1:R28C4,4,FALSE) -> 通关主线副本第14章 | I164: 26 | J164: =VLOOKUP(RC[-9],Sheet1!R2C1:R28C6,6,FALSE) -> 金币
A165: 4 | B165: btn_dungeon | C165: 15 | D165: 1 | E165: 15 | F165: 19003 | G165: 50000 | H165: =VLOOKUP(RC[-7],Sheet1!R2C1:R28C4,2,FALSE)&VLOOKUP(RC[-7],Sheet1!R2C1:R28C4,3,FALSE)&IF(VLOOKUP(RC[-7],Sheet1!R2C1:R28C4,4,FALSE)="品",VLOOKUP(RC[-3],Sheet1!R2C8:R6C9,2,FALSE),RC[-3])&VLOOKUP(RC[-7],Sheet1!R2C1:R28C4,4,FALSE) -> 通关主线副本第15章 | I165: 26 | J165: =VLOOKUP(RC[-9],Sheet1!R2C1:R28C6,6,FALSE) -> 金币
A166: 4 | B166: btn_dungeon | C166: 16 | D166: 1 | E166: 16 | F166: 19003 | G166: 100000 | H166: =VLOOKUP(RC[-7],Sheet1!R2C1:R28C4,2,FALSE)&VLOOKUP(RC[-7],Sheet1!R2C1:R28C4,3,FALSE)&IF(VLOOKUP(RC[-7],Sheet1!R2C1:R28C4,4,FALSE)="品",VLOOKUP(RC[-3],Sheet1!R2C8:R6C9,2,FALSE),RC[-3])&VLOOKUP(RC[-7],Sheet1!R2C1:R28C4,4,FALSE) -> 通关主线副本第16章 | I166: 26 | J166: =VLOOKUP(RC[-9],Sheet1!R2C1:R28C6,6,FALSE) -> 金币
A167: 4 | B167: btn_dungeon | C167: 17 | D167: 1 | E167: 17 | F167: 19003 | G167: 100000 | H167: =VLOOKUP(RC[-7],Sheet1!R2C1:R28C4,2,FALSE)&VLOOKUP(RC[-7],Sheet1!R2C1:R28C4,3,FALSE)&IF(VLOOKUP(RC[-7],Sheet1!R2C1:R28C4,4,FALSE)="品",VLOOKUP(RC[-3],Sheet1!R2C8:R6C9,2,FALSE),RC[-3])&VLOOKUP(RC[-7],Sheet1!R2C1:R28C4,4,FALSE) -> 通关主线副本第17章 | I167: 26 | J167: =VLOOKUP(RC[-9],Sheet1!R2C1:R28C6,6,FALSE) -> 金币
A168: 4 | B168: btn_dungeon | C168: 18 | D168: 1 | E168: 18 | F168: 19003 | G168: 100000 | H168: =VLOOKUP(RC[-7],Sheet1!R2C1:R28C4,2,FALSE)&VLOOKUP(RC[-7],Sheet1!R2C1:R28C4,3,FALSE)&IF(VLOOKUP(RC[-7],Sheet1!R2C1:R28C4,4,FALSE)="品",VLOOKUP(RC[-3],Sheet1!R2C8:R6C9,2,FALSE),RC[-3])&VLOOKUP(RC[-7],Sheet1!R2C1:R28C4,4,FALSE) -> 通关主线副本第18章 | I168: 26 | J168: =VLOOKUP(RC[-9],Sheet1!R2C1:R28C6,6,FALSE) -> 金币
A169: 4 | B169: btn_dungeon | C169: 19 | D169: 1 | E169: 19 | F169: 19003 | G169: 100000 | H169: =VLOOKUP(RC[-7],Sheet1!R2C1:R28C4,2,FALSE)&VLOOKUP(RC[-7],Sheet1!R2C1:R28C4,3,FALSE)&IF(VLOOKUP(RC[-7],Sheet1!R2C1:R28C4,4,FALSE)="品",VLOOKUP(RC[-3],Sheet1!R2C8:R6C9,2,FALSE),RC[-3])&VLOOKUP(RC[-7],Sheet1!R2C1:R28C4,4,FALSE) -> 通关主线副本第19章 | I169: 26 | J169: =VLOOKUP(RC[-9],Sheet1!R2C1:R28C6,6,FALSE) -> 金币
A170: 4 | B170: btn_dungeon | C170: 20 | D170: 1 | E170: 20 | F170: 19003 | G170: 100000 | H170: =VLOOKUP(RC[-7],Sheet1!R2C1:R28C4,2,FALSE)&VLOOKUP(RC[-7],Sheet1!R2C1:R28C4,3,FALSE)&IF(VLOOKUP(RC[-7],Sheet1!R2C1:R28C4,4,FALSE)="品",VLOOKUP(RC[-3],Sheet1!R2C8:R6C9,2,FALSE),RC[-3])&VLOOKUP(RC[-7],Sheet1!R2C1:R28C4,4,FALSE) -> 通关主线副本第20章 | I170: 26 | J170: =VLOOKUP(RC[-9],Sheet1!R2C1:R28C6,6,FALSE) -> 金币
A171: 4 | B171: btn_dungeon | C171: 21 | D171: 1 | E171: 21 | F171: 19003 | G171: 150000 | H171: =VLOOKUP(RC[-7],Sheet1!R2C1:R28C4,2,FALSE)&VLOOKUP(RC[-7],Sheet1!R2C1:R28C4,3,FALSE)&IF(VLOOKUP(RC[-7],Sheet1!R2C1:R28C4,4,FALSE)="品",VLOOKUP(RC[-3],Sheet1!R2C8:R6C9,2,FALSE),RC[-3])&VLOOKUP(RC[-7],Sheet1!R2C1:R28C4,4,FALSE) -> 通关主线副本第21章 | I171: 26 | J171: =VLOOKUP(RC[-9],Sheet1!R2C1:R28C6,6,FALSE) -> 金币
A172: 4 | B172: btn_dungeon | C172: 22 | D172: 1 | E172: 22 | F172: 19003 | G172: 150000 | H172: =VLOOKUP(RC[-7],Sheet1!R2C1:R28C4,2,FALSE)&VLOOKUP(RC[-7],Sheet1!R2C1:R28C4,3,FALSE)&IF(VLOOKUP(RC[-7],Sheet1!R2C1:R28C4,4,FALSE)="品",VLOOKUP(RC[-3],Sheet1!R2C8:R6C9,2,FALSE),RC[-3])&VLOOKUP(RC[-7],Sheet1!R2C1:R28C4,4,FALSE) -> 通关主线副本第22章 | I172: 26 | J172: =VLOOKUP(RC[-9],Sheet1!R2C1:R28C6,6,FALSE) -> 金币
A173: 4 | B173: btn_dungeon | C173: 23 | D173: 1 | E173: 23 | F173: 19003 | G173: 150000 | H173: =VLOOKUP(RC[-7],Sheet1!R2C1:R28C4,2,FALSE)&VLOOKUP(RC[-7],Sheet1!R2C1:R28C4,3,FALSE)&IF(VLOOKUP(RC[-7],Sheet1!R2C1:R28C4,4,FALSE)="品",VLOOKUP(RC[-3],Sheet1!R2C8:R6C9,2,FALSE),RC[-3])&VLOOKUP(RC[-7],Sheet1!R2C1:R28C4,4,FALSE) -> 通关主线副本第23章 | I173: 26 | J173: =VLOOKUP(RC[-9],Sheet1!R2C1:R28C6,6,FALSE) -> 金币
A174: 4 | B174: btn_dungeon | C174: 24 | D174: 1 | E174: 24 | F174: 19003 | G174: 150000 | H174: =VLOOKUP(RC[-7],Sheet1!R2C1:R28C4,2,FALSE)&VLOOKUP(RC[-7],Sheet1!R2C1:R28C4,3,FALSE)&IF(VLOOKUP(RC[-7],Sheet1!R2C1:R28C4,4,FALSE)="品",VLOOKUP(RC[-3],Sheet1!R2C8:R6C9,2,FALSE),RC[-3])&VLOOKUP(RC[-7],Sheet1!R2C1:R28C4,4,FALSE) -> 通关主线副本第24章 | I174: 26 | J174: =VLOOKUP(RC[-9],Sheet1!R2C1:R28C6,6,FALSE) -> 金币
A175: 4 | B175: btn_dungeon | C175: 25 | D175: 1 | E175: 25 | F175: 19003 | G175: 150000 | H175: =VLOOKUP(RC[-7],Sheet1!R2C1:R28C4,2,FALSE)&VLOOKUP(RC[-7],Sheet1!R2C1:R28C4,3,FALSE)&IF(VLOOKUP(RC[-7],Sheet1!R2C1:R28C4,4,FALSE)="品",VLOOKUP(RC[-3],Sheet1!R2C8:R6C9,2,FALSE),RC[-3])&VLOOKUP(RC[-7],Sheet1!R2C1:R28C4,4,FALSE) -> 通关主线副本第25章 | I175: 26 | J175: =VLOOKUP(RC[-9],Sheet1!R2C1:R28C6,6,FALSE) -> 金币
A176: 4 | B176: btn_dungeon | C176: 26 | D176: 1 | E176: 26 | F176: 19003 | G176: 200000 | H176: =VLOOKUP(RC[-7],Sheet1!R2C1:R28C4,2,FALSE)&VLOOKUP(RC[-7],Sheet1!R2C1:R28C4,3,FALSE)&IF(VLOOKUP(RC[-7],Sheet1!R2C1:R28C4,4,FALSE)="品",VLOOKUP(RC[-3],Sheet1!R2C8:R6C9,2,FALSE),RC[-3])&VLOOKUP(RC[-7],Sheet1!R2C1:R28C4,4,FALSE) -> 通关主线副本第26章 | I176: 26 | J176: =VLOOKUP(RC[-9],Sheet1!R2C1:R28C6,6,FALSE) -> 金币
A177: 4 | B177: btn_dungeon | C177: 27 | D177: 1 | E177: 27 | F177: 19003 | G177: 200000 | H177: =VLOOKUP(RC[-7],Sheet1!R2C1:R28C4,2,FALSE)&VLOOKUP(RC[-7],Sheet1!R2C1:R28C4,3,FALSE)&IF(VLOOKUP(RC[-7],Sheet1!R2C1:R28C4,4,FALSE)="品",VLOOKUP(RC[-3],Sheet1!R2C8:R6C9,2,FALSE),RC[-3])&VLOOKUP(RC[-7],Sheet1!R2C1:R28C4,4,FALSE) -> 通关主线副本第27章 | I177: 26 | J177: =VLOOKUP(RC[-9],Sheet1!R2C1:R28C6,6,FALSE) -> 金币
A178: 4 | B178: btn_dungeon | C178: 28 | D178: 1 | E178: 28 | F178: 19003 | G178: 200000 | H178: =VLOOKUP(RC[-7],Sheet1!R2C1:R28C4,2,FALSE)&VLOOKUP(RC[-7],Sheet1!R2C1:R28C4,3,FALSE)&IF(VLOOKUP(RC[-7],Sheet1!R2C1:R28C4,4,FALSE)="品",VLOOKUP(RC[-3],Sheet1!R2C8:R6C9,2,FALSE),RC[-3])&VLOOKUP(RC[-7],Sheet1!R2C1:R28C4,4,FALSE) -> 通关主线副本第28章 | I178: 26 | J178: =VLOOKUP(RC[-9],Sheet1!R2C1:R28C6,6,FALSE) -> 金币
A179: 4 | B179: btn_dungeon | C179: 29 | D179: 1 | E179: 29 | F179: 19003 | G179: 200000 | H179: =VLOOKUP(RC[-7],Sheet1!R2C1:R28C4,2,FALSE)&VLOOKUP(RC[-7],Sheet1!R2C1:R28C4,3,FALSE)&IF(VLOOKUP(RC[-7],Sheet1!R2C1:R28C4,4,FALSE)="品",VLOOKUP(RC[-3],Sheet1!R2C8:R6C9,2,FALSE),RC[-3])&VLOOKUP(RC[-7],Sheet1!R2C1:R28C4,4,FALSE) -> 通关主线副本第29章 | I179: 26 | J179: =VLOOKUP(RC[-9],Sheet1!R2C1:R28C6,6,FALSE) -> 金币
A180: 4 | B180: btn_dungeon | C180: 30 | D180: 1 | E180: 30 | F180: 19003 | G180: 200000 | H180: =VLOOKUP(RC[-7],Sheet1!R2C1:R28C4,2,FALSE)&VLOOKUP(RC[-7],Sheet1!R2C1:R28C4,3,FALSE)&IF(VLOOKUP(RC[-7],Sheet1!R2C1:R28C4,4,FALSE)="品",VLOOKUP(RC[-3],Sheet1!R2C8:R6C9,2,FALSE),RC[-3])&VLOOKUP(RC[-7],Sheet1!R2C1:R28C4,4,FALSE) -> 通关主线副本第30章 | I180: 26 | J180: =VLOOKUP(RC[-9],Sheet1!R2C1:R28C6,6,FALSE) -> 金币
A181: 4 | B181: btn_dungeon | C181: 31 | D181: 1 | E181: 31 | F181: 19003 | G181: 250000 | H181: =VLOOKUP(RC[-7],Sheet1!R2C1:R28C4,2,FALSE)&VLOOKUP(RC[-7],Sheet1!R2C1:R28C4,3,FALSE)&IF(VLOOKUP(RC[-7],Sheet1!R2C1:R28C4,4,FALSE)="品",VLOOKUP(RC[-3],Sheet1!R2C8:R6C9,2,FALSE),RC[-3])&VLOOKUP(RC[-7],Sheet1!R2C1:R28C4,4,FALSE) -> 通关主线副本第31章 | I181: 26 | J181: =VLOOKUP(RC[-9],Sheet1!R2C1:R28C6,6,FALSE) -> 金币
A182: 4 | B182: btn_dungeon | C182: 32 | D182: 1 | E182: 32 | F182: 19003 | G182: 250000 | H182: =VLOOKUP(RC[-7],Sheet1!R2C1:R28C4,2,FALSE)&VLOOKUP(RC[-7],Sheet1!R2C1:R28C4,3,FALSE)&IF(VLOOKUP(RC[-7],Sheet1!R2C1:R28C4,4,FALSE)="品",VLOOKUP(RC[-3],Sheet1!R2C8:R6C9,2,FALSE),RC[-3])&VLOOKUP(RC[-7],Sheet1!R2C1:R28C4,4,FALSE) -> 通关主线副本第32章 | I182: 26 | J182: =VLOOKUP(RC[-9],Sheet1!R2C1:R28C6,6,FALSE) -> 金币
A183: 4 | B183: btn_dungeon | C183: 33 | D183: 1 | E183: 33 | F183: 19003 | G183: 250000 | H183: =VLOOKUP(RC[-7],Sheet1!R2C1:R28C4,2,FALSE)&VLOOKUP(RC[-7],Sheet1!R2C1:R28C4,3,FALSE)&IF(VLOOKUP(RC[-7],Sheet1!R2C1:R28C4,4,FALSE)="品",VLOOKUP(RC[-3],Sheet1!R2C8:R6C9,2,FALSE),RC[-3])&VLOOKUP(RC[-7],Sheet1!R2C1:R28C4,4,FALSE) -> 通关主线副本第33章 | I183: 26 | J183: =VLOOKUP(RC[-9],Sheet1!R2C1:R28C6,6,FALSE) -> 金币
A184: 4 | B184: btn_dungeon | C184: 34 | D184: 1 | E184: 34 | F184: 19003 | G184: 250000 | H184: =VLOOKUP(RC[-7],Sheet1!R2C1:R28C4,2,FALSE)&VLOOKUP(RC[-7],Sheet1!R2C1:R28C4,3,FALSE)&IF(VLOOKUP(RC[-7],Sheet1!R2C1:R28C4,4,FALSE)="品",VLOOKUP(RC[-3],Sheet1!R2C8:R6C9,2,FALSE),RC[-3])&VLOOKUP(RC[-7],Sheet1!R2C1:R28C4,4,FALSE) -> 通关主线副本第34章 | I184: 26 | J184: =VLOOKUP(RC[-9],Sheet1!R2C1:R28C6,6,FALSE) -> 金币
A185: 4 | B185: btn_dungeon | C185: 35 | D185: 1 | E185: 35 | F185: 19003 | G185: 250000 | H185: =VLOOKUP(RC[-7],Sheet1!R2C1:R28C4,2,FALSE)&VLOOKUP(RC[-7],Sheet1!R2C1:R28C4,3,FALSE)&IF(VLOOKUP(RC[-7],Sheet1!R2C1:R28C4,4,FALSE)="品",VLOOKUP(RC[-3],Sheet1!R2C8:R6C9,2,FALSE),RC[-3])&VLOOKUP(RC[-7],Sheet1!R2C1:R28C4,4,FALSE) -> 通关主线副本第35章 | I185: 26 | J185: =VLOOKUP(RC[-9],Sheet1!R2C1:R28C6,6,FALSE) -> 金币
A186: 4 | B186: btn_dungeon | C186: 36 | D186: 1 | E186: 36 | F186: 19003 | G186: 300000 | H186: =VLOOKUP(RC[-7],Sheet1!R2C1:R28C4,2,FALSE)&VLOOKUP(RC[-7],Sheet1!R2C1:R28C4,3,FALSE)&IF(VLOOKUP(RC[-7],Sheet1!R2C1:R28C4,4,FALSE)="品",VLOOKUP(RC[-3],Sheet1!R2C8:R6C9,2,FALSE),RC[-3])&VLOOKUP(RC[-7],Sheet1!R2C1:R28C4,4,FALSE) -> 通关主线副本第36章 | I186: 26 | J186: =VLOOKUP(RC[-9],Sheet1!R2C1:R28C6,6,FALSE) -> 金币
A187: 4 | B187: btn_dungeon | C187: 37 | D187: 1 | E187: 37 | F187: 19003 | G187: 300000 | H187: =VLOOKUP(RC[-7],Sheet1!R2C1:R28C4,2,FALSE)&VLOOKUP(RC[-7],Sheet1!R2C1:R28C4,3,FALSE)&IF(VLOOKUP(RC[-7],Sheet1!R2C1:R28C4,4,FALSE)="品",VLOOKUP(RC[-3],Sheet1!R2C8:R6C9,2,FALSE),RC[-3])&VLOOKUP(RC[-7],Sheet1!R2C1:R28C4,4,FALSE) -> 通关主线副本第37章 | I187: 26 | J187: =VLOOKUP(RC[-9],Sheet1!R2C1:R28C6,6,FALSE) -> 金币
A188: 4 | B188: btn_dungeon | C188: 38 | D188: 1 | E188: 38 | F188: 19003 | G188: 300000 | H188: =VLOOKUP(RC[-7],Sheet1!R2C1:R28C4,2,FALSE)&VLOOKUP(RC[-7],Sheet1!R2C1:R28C4,3,FALSE)&IF(VLOOKUP(RC[-7],Sheet1!R2C1:R28C4,4,FALSE)="品",VLOOKUP(RC[-3],Sheet1!R2C8:R6C9,2,FALSE),RC[-3])&VLOOKUP(RC[-7],Sheet1!R2C1:R28C4,4,FALSE) -> 通关主线副本第38章 | I188: 26 | J188: =VLOOKUP(RC[-9],Sheet1!R2C1:R28C6,6,FALSE) -> 金币
A189: 4 | B189: btn_dungeon | C189: 39 | D189: 1 | E189: 39 | F189: 19003 | G189: 300000 | H189: =VLOOKUP(RC[-7],Sheet1!R2C1:R28C4,2,FALSE)&VLOOKUP(RC[-7],Sheet1!R2C1:R28C4,3,FALSE)&IF(VLOOKUP(RC[-7],Sheet1!R2C1:R28C4,4,FALSE)="品",VLOOKUP(RC[-3],Sheet1!R2C8:R6C9,2,FALSE),RC[-3])&VLOOKUP(RC[-7],Sheet1!R2C1:R28C4,4,FALSE) -> 通关主线副本第39章 | I189: 26 | J189: =VLOOKUP(RC[-9],Sheet1!R2C1:R28C6,6,FALSE) -> 金币
A190: 4 | B190: btn_dungeon | C190: 40 | D190: 1 | E190: 40 | F190: 19003 | G190: 300000 | H190: =VLOOKUP(RC[-7],Sheet1!R2C1:R28C4,2,FALSE)&VLOOKUP(RC[-7],Sheet1!R2C1:R28C4,3,FALSE)&IF(VLOOKUP(RC[-7],Sheet1!R2C1:R28C4,4,FALSE)="品",VLOOKUP(RC[-3],Sheet1!R2C8:R6C9,2,FALSE),RC[-3])&VLOOKUP(RC[-7],Sheet1!R2C1:R28C4,4,FALSE) -> 通关主线副本第40章 | I190: 26 | J190: =VLOOKUP(RC[-9],Sheet1!R2C1:R28C6,6,FALSE) -> 金币
A191: 4 | B191: btn_dungeon | C191: 41 | D191: 1 | E191: 41 | F191: 19003 | G191: 350000 | H191: =VLOOKUP(RC[-7],Sheet1!R2C1:R28C4,2,FALSE)&VLOOKUP(RC[-7],Sheet1!R2C1:R28C4,3,FALSE)&IF(VLOOKUP(RC[-7],Sheet1!R2C1:R28C4,4,FALSE)="品",VLOOKUP(RC[-3],Sheet1!R2C8:R6C9,2,FALSE),RC[-3])&VLOOKUP(RC[-7],Sheet1!R2C1:R28C4,4,FALSE) -> 通关主线副本第41章 | I191: 26 | J191: =VLOOKUP(RC[-9],Sheet1!R2C1:R28C6,6,FALSE) -> 金币
A192: 4 | B192: btn_dungeon | C192: 42 | D192: 1 | E192: 42 | F192: 19003 | G192: 350000 | H192: =VLOOKUP(RC[-7],Sheet1!R2C1:R28C4,2,FALSE)&VLOOKUP(RC[-7],Sheet1!R2C1:R28C4,3,FALSE)&IF(VLOOKUP(RC[-7],Sheet1!R2C1:R28C4,4,FALSE)="品",VLOOKUP(RC[-3],Sheet1!R2C8:R6C9,2,FALSE),RC[-3])&VLOOKUP(RC[-7],Sheet1!R2C1:R28C4,4,FALSE) -> 通关主线副本第42章 | I192: 26 | J192: =VLOOKUP(RC[-9],Sheet1!R2C1:R28C6,6,FALSE) -> 金币
A193: 4 | B193: btn_dungeon | C193: 43 | D193: 1 | E193: 43 | F193: 19003 | G193: 350000 | H193: =VLOOKUP(RC[-7],Sheet1!R2C1:R28C4,2,FALSE)&VLOOKUP(RC[-7],Sheet1!R2C1:R28C4,3,FALSE)&IF(VLOOKUP(RC[-7],Sheet1!R2C1:R28C4,4,FALSE)="品",VLOOKUP(RC[-3],Sheet1!R2C8:R6C9,2,FALSE),RC[-3])&VLOOKUP(RC[-7],Sheet1!R2C1:R28C4,4,FALSE) -> 通关主线副本第43章 | I193: 26 | J193: =VLOOKUP(RC[-9],Sheet1!R2C1:R28C6,6,FALSE) -> 金币
A194: 4 | B194: btn_dungeon | C194: 44 | D194: 1 | E194: 44 | F194: 19003 | G194: 350000 | H194: =VLOOKUP(RC[-7],Sheet1!R2C1:R28C4,2,FALSE)&VLOOKUP(RC[-7],Sheet1!R2C1:R28C4,3,FALSE)&IF(VLOOKUP(RC[-7],Sheet1!R2C1:R28C4,4,FALSE)="品",VLOOKUP(RC[-3],Sheet1!R2C8:R6C9,2,FALSE),RC[-3])&VLOOKUP(RC[-7],Sheet1!R2C1:R28C4,4,FALSE) -> 通关主线副本第44章 | I194: 26 | J194: =VLOOKUP(RC[-9],Sheet1!R2C1:R28C6,6,FALSE) -> 金币
A195: 4 | B195: btn_dungeon | C195: 45 | D195: 1 | E195: 45 | F195: 19003 | G195: 350000 | H195: =VLOOKUP(RC[-7],Sheet1!R2C1:R28C4,2,FALSE)&VLOOKUP(RC[-7],Sheet1!R2C1:R28C4,3,FALSE)&IF(VLOOKUP(RC[-7],Sheet1!R2C1:R28C4,4,FALSE)="品",VLOOKUP(RC[-3],Sheet1!R2C8:R6C9,2,FALSE),RC[-3])&VLOOKUP(RC[-7],Sheet1!R2C1:R28C4,4,FALSE) -> 通关主线副本第45章 | I195: 26 | J195: =VLOOKUP(RC[-9],Sheet1!R2C1:R28C6,6,FALSE) -> 金币
A196: 4 | B196: btn_dungeon | C196: 46 | D196: 1 | E196: 46 | F196: 19003 | G196: 400000 | H196: =VLOOKUP(RC[-7],Sheet1!R2C1:R28C4,2,FALSE)&VLOOKUP(RC[-7],Sheet1!R2C1:R28C4,3,FALSE)&IF(VLOOKUP(RC[-7],Sheet1!R2C1:R28C4,4,FALSE)="品",VLOOKUP(RC[-3],Sheet1!R2C8:R6C9,2,FALSE),RC[-3])&VLOOKUP(RC[-7],Sheet1!R2C1:R28C4,4,FALSE) -> 通关主线副本第46章 | I196: 26 | J196: =VLOOKUP(RC[-9],Sheet1!R2C1:R28C6,6,FALSE) -> 金币
A197: 4 | B197: btn_dungeon | C197: 47 | D197: 1 | E197: 47 | F197: 19003 | G197: 400000 | H197: =VLOOKUP(RC[-7],Sheet1!R2C1:R28C4,2,FALSE)&VLOOKUP(RC[-7],Sheet1!R2C1:R28C4,3,FALSE)&IF(VLOOKUP(RC[-7],Sheet1!R2C1:R28C4,4,FALSE)="品",VLOOKUP(RC[-3],Sheet1!R2C8:R6C9,2,FALSE),RC[-3])&VLOOKUP(RC[-7],Sheet1!R2C1:R28C4,4,FALSE) -> 通关主线副本第47章 | I197: 26 | J197: =VLOOKUP(RC[-9],Sheet1!R2C1:R28C6,6,FALSE) -> 金币
A198: 4 | B198: btn_dungeon | C198: 48 | D198: 1 | E198: 48 | F198: 19003 | G198: 400000 | H198: =VLOOKUP(RC[-7],Sheet1!R2C1:R28C4,2,FALSE)&VLOOKUP(RC[-7],Sheet1!R2C1:R28C4,3,FALSE)&IF(VLOOKUP(RC[-7],Sheet1!R2C1:R28C4,4,FALSE)="品",VLOOKUP(RC[-3],Sheet1!R2C8:R6C9,2,FALSE),RC[-3])&VLOOKUP(RC[-7],Sheet1!R2C1:R28C4,4,FALSE) -> 通关主线副本第48章 | I198: 26 | J198: =VLOOKUP(RC[-9],Sheet1!R2C1:R28C6,6,FALSE) -> 金币
A199: 4 | B199: btn_dungeon | C199: 49 | D199: 1 | E199: 49 | F199: 19003 | G199: 400000 | H199: =VLOOKUP(RC[-7],Sheet1!R2C1:R28C4,2,FALSE)&VLOOKUP(RC[-7],Sheet1!R2C1:R28C4,3,FALSE)&IF(VLOOKUP(RC[-7],Sheet1!R2C1:R28C4,4,FALSE)="品",VLOOKUP(RC[-3],Sheet1!R2C8:R6C9,2,FALSE),RC[-3])&VLOOKUP(RC[-7],Sheet1!R2C1:R28C4,4,FALSE) -> 通关主线副本第49章 | I199: 26 | J199: =VLOOKUP(RC[-9],Sheet1!R2C1:R28C6,6,FALSE) -> 金币
A200: 4 | B200: btn_dungeon | C200: 50 | D200: 1 | E200: 50 | F200: 19003 | G200: 400000 | H200: =VLOOKUP(RC[-7],Sheet1!R2C1:R28C4,2,FALSE)&VLOOKUP(RC[-7],Sheet1!R2C1:R28C4,3,FALSE)&IF(VLOOKUP(RC[-7],Sheet1!R2C1:R28C4,4,FALSE)="品",VLOOKUP(RC[-3],Sheet1!R2C8:R6C9,2,FALSE),RC[-3])&VLOOKUP(RC[-7],Sheet1!R2C1:R28C4,4,FALSE) -> 通关主线副本第50章 | I200: 26 | J200: =VLOOKUP(RC[-9],Sheet1!R2C1:R28C6,6,FALSE) -> 金币
A201: 4 | B201: btn_dungeon | C201: 51 | D201: 1 | E201: 51 | F201: 19003 | G201: 450000 | H201: =VLOOKUP(RC[-7],Sheet1!R2C1:R28C4,2,FALSE)&VLOOKUP(RC[-7],Sheet1!R2C1:R28C4,3,FALSE)&IF(VLOOKUP(RC[-7],Sheet1!R2C1:R28C4,4,FALSE)="品",VLOOKUP(RC[-3],Sheet1!R2C8:R6C9,2,FALSE),RC[-3])&VLOOKUP(RC[-7],Sheet1!R2C1:R28C4,4,FALSE) -> 通关主线副本第51章 | I201: 26 | J201: =VLOOKUP(RC[-9],Sheet1!R2C1:R28C6,6,FALSE) -> 金币
A202: 4 | B202: btn_dungeon | C202: 52 | D202: 1 | E202: 52 | F202: 19003 | G202: 450000 | H202: =VLOOKUP(RC[-7],Sheet1!R2C1:R28C4,2,FALSE)&VLOOKUP(RC[-7],Sheet1!R2C1:R28C4,3,FALSE)&IF(VLOOKUP(RC[-7],Sheet1!R2C1:R28C4,4,FALSE)="品",VLOOKUP(RC[-3],Sheet1!R2C8:R6C9,2,FALSE),RC[-3])&VLOOKUP(RC[-7],Sheet1!R2C1:R28C4,4,FALSE) -> 通关主线副本第52章 | I202: 26 | J202: =VLOOKUP(RC[-9],Sheet1!R2C1:R28C6,6,FALSE) -> 金币
A203: 4 | B203: btn_dungeon | C203: 53 | D203: 1 | E203: 53 | F203: 19003 | G203: 450000 | H203: =VLOOKUP(RC[-7],Sheet1!R2C1:R28C4,2,FALSE)&VLOOKUP(RC[-7],Sheet1!R2C1:R28C4,3,FALSE)&IF(VLOOKUP(RC[-7],Sheet1!R2C1:R28C4,4,FALSE)="品",VLOOKUP(RC[-3],Sheet1!R2C8:R6C9,2,FALSE),RC[-3])&VLOOKUP(RC[-7],Sheet1!R2C1:R28C4,4,FALSE) -> 通关主线副本第53章 | I203: 26 | J203: =VLOOKUP(RC[-9],Sheet1!R2C1:R28C6,6,FALSE) -> 金币
A204: 4 | B204: btn_dungeon | C204: 54 | D204: 1 | E204: 54 | F204: 19003 | G204: 450000 | H204: =VLOOKUP(RC[-7],Sheet1!R2C1:R28C4,2,FALSE)&VLOOKUP(RC[-7],Sheet1!R2C1:R28C4,3,FALSE)&IF(VLOOKUP(RC[-7],Sheet1!R2C1:R28C4,4,FALSE)="品",VLOOKUP(RC[-3],Sheet1!R2C8:R6C9,2,FALSE),RC[-3])&VLOOKUP(RC[-7],Sheet1!R2C1:R28C4,4,FALSE) -> 通关主线副本第54章 | I204: 26 | J204: =VLOOKUP(RC[-9],Sheet1!R2C1:R28C6,6,FALSE) -> 金币
A205: 4 | B205: btn_dungeon | C205: 55 | D205: 1 | E205: 55 | F205: 19003 | G205: 450000 | H205: =VLOOKUP(RC[-7],Sheet1!R2C1:R28C4,2,FALSE)&VLOOKUP(RC[-7],Sheet1!R2C1:R28C4,3,FALSE)&IF(VLOOKUP(RC[-7],Sheet1!R2C1:R28C4,4,FALSE)="品",VLOOKUP(RC[-3],Sheet1!R2C8:R6C9,2,FALSE),RC[-3])&VLOOKUP(RC[-7],Sheet1!R2C1:R28C4,4,FALSE) -> 通关主线副本第55章 | I205: 26 | J205: =VLOOKUP(RC[-9],Sheet1!R2C1:R28C6,6,FALSE) -> 金币
A206: 4 | B206: btn_dungeon | C206: 56 | D206: 1 | E206: 56 | F206: 19003 | G206: 500000 | H206: =VLOOKUP(RC[-7],Sheet1!R2C1:R28C4,2,FALSE)&VLOOKUP(RC[-7],Sheet1!R2C1:R28C4,3,FALSE)&IF(VLOOKUP(RC[-7],Sheet1!R2C1:R28C4,4,FALSE)="品",VLOOKUP(RC[-3],Sheet1!R2C8:R6C9,2,FALSE),RC[-3])&VLOOKUP(RC[-7],Sheet1!R2C1:R28C4,4,FALSE) -> 通关主线副本第56章 | I206: 26 | J206: =VLOOKUP(RC[-9],Sheet1!R2C1:R28C6,6,FALSE) -> 金币
A207: 4 | B207: btn_dungeon | C207: 57 | D207: 1 | E207: 57 | F207: 19003 | G207: 500000 | H207: =VLOOKUP(RC[-7],Sheet1!R2C1:R28C4,2,FALSE)&VLOOKUP(RC[-7],Sheet1!R2C1:R28C4,3,FALSE)&IF(VLOOKUP(RC[-7],Sheet1!R2C1:R28C4,4,FALSE)="品",VLOOKUP(RC[-3],Sheet1!R2C8:R6C9,2,FALSE),RC[-3])&VLOOKUP(RC[-7],Sheet1!R2C1:R28C4,4,FALSE) -> 通关主线副本第57章 | I207: 26 | J207: =VLOOKUP(RC[-9],Sheet1!R2C1:R28C6,6,FALSE) -> 金币
A208: 4 | B208: btn_dungeon | C208: 58 | D208: 1 | E208: 58 | F208: 19003 | G208: 500000 | H208: =VLOOKUP(RC[-7],Sheet1!R2C1:R28C4,2,FALSE)&VLOOKUP(RC[-7],Sheet1!R2C1:R28C4,3,FALSE)&IF(VLOOKUP(RC[-7],Sheet1!R2C1:R28C4,4,FALSE)="品",VLOOKUP(RC[-3],Sheet1!R2C8:R6C9,2,FALSE),RC[-3])&VLOOKUP(RC[-7],Sheet1!R2C1:R28C4,4,FALSE) -> 通关主线副本第58章 | I208: 26 | J208: =VLOOKUP(RC[-9],Sheet1!R2C1:R28C6,6,FALSE) -> 金币
A209: 4 | B209: btn_dungeon | C209: 59 | D209: 1 | E209: 59 | F209: 19003 | G209: 500000 | H209: =VLOOKUP(RC[-7],Sheet1!R2C1:R28C4,2,FALSE)&VLOOKUP(RC[-7],Sheet1!R2C1:R28C4,3,FALSE)&IF(VLOOKUP(RC[-7],Sheet1!R2C1:R28C4,4,FALSE)="品",VLOOKUP(RC[-3],Sheet1!R2C8:R6C9,2,FALSE),RC[-3])&VLOOKUP(RC[-7],Sheet1!R2C1:R28C4,4,FALSE) -> 通关主线副本第59章 | I209: 26 | J209: =VLOOKUP(RC[-9],Sheet1!R2C1:R28C6,6,FALSE) -> 金币
A210: 4 | B210: btn_dungeon | C210: 60 | D210: 1 | E210: 60 | F210: 19003 | G210: 500000 | H210: =VLOOKUP(RC[-7],Sheet1!R2C1:R28C4,2,FALSE)&VLOOKUP(RC[-7],Sheet1!R2C1:R28C4,3,FALSE)&IF(VLOOKUP(RC[-7],Sheet1!R2C1:R28C4,4,FALSE)="品",VLOOKUP(RC[-3],Sheet1!R2C8:R6C9,2,FALSE),RC[-3])&VLOOKUP(RC[-7],Sheet1!R2C1:R28C4,4,FALSE) -> 通关主线副本第60章 | I210: 26 | J210: =VLOOKUP(RC[-9],Sheet1!R2C1:R28C6,6,FALSE) -> 金币
A211: 4 | B211: btn_dungeon | C211: 61 | D211: 1 | E211: 61 | F211: 19003 | G211: 600000 | H211: =VLOOKUP(RC[-7],Sheet1!R2C1:R28C4,2,FALSE)&VLOOKUP(RC[-7],Sheet1!R2C1:R28C4,3,FALSE)&IF(VLOOKUP(RC[-7],Sheet1!R2C1:R28C4,4,FALSE)="品",VLOOKUP(RC[-3],Sheet1!R2C8:R6C9,2,FALSE),RC[-3])&VLOOKUP(RC[-7],Sheet1!R2C1:R28C4,4,FALSE) -> 通关主线副本第61章 | I211: 26 | J211: =VLOOKUP(RC[-9],Sheet1!R2C1:R28C6,6,FALSE) -> 金币
A212: 4 | B212: btn_dungeon | C212: 62 | D212: 1 | E212: 62 | F212: 19003 | G212: 600000 | H212: =VLOOKUP(RC[-7],Sheet1!R2C1:R28C4,2,FALSE)&VLOOKUP(RC[-7],Sheet1!R2C1:R28C4,3,FALSE)&IF(VLOOKUP(RC[-7],Sheet1!R2C1:R28C4,4,FALSE)="品",VLOOKUP(RC[-3],Sheet1!R2C8:R6C9,2,FALSE),RC[-3])&VLOOKUP(RC[-7],Sheet1!R2C1:R28C4,4,FALSE) -> 通关主线副本第62章 | I212: 26 | J212: =VLOOKUP(RC[-9],Sheet1!R2C1:R28C6,6,FALSE) -> 金币
A213: 4 | B213: btn_dungeon | C213: 63 | D213: 1 | E213: 63 | F213: 19003 | G213: 600000 | H213: =VLOOKUP(RC[-7],Sheet1!R2C1:R28C4,2,FALSE)&VLOOKUP(RC[-7],Sheet1!R2C1:R28C4,3,FALSE)&IF(VLOOKUP(RC[-7],Sheet1!R2C1:R28C4,4,FALSE)="品",VLOOKUP(RC[-3],Sheet1!R2C8:R6C9,2,FALSE),RC[-3])&VLOOKUP(RC[-7],Sheet1!R2C1:R28C4,4,FALSE) -> 通关主线副本第63章 | I213: 26 | J213: =VLOOKUP(RC[-9],Sheet1!R2C1:R28C6,6,FALSE) -> 金币
A214: 4 | B214: btn_dungeon | C214: 64 | D214: 1 | E214: 64 | F214: 19003 | G214: 600000 | H214: =VLOOKUP(RC[-7],Sheet1!R2C1:R28C4,2,FALSE)&VLOOKUP(RC[-7],Sheet1!R2C1:R28C4,3,FALSE)&IF(VLOOKUP(RC[-7],Sheet1!R2C1:R28C4,4,FALSE)="品",VLOOKUP(RC[-3],Sheet1!R2C8:R6C9,2,FALSE),RC[-3])&VLOOKUP(RC[-7],Sheet1!R2C1:R28C4,4,FALSE) -> 通关主线副本第64章 | I214: 26 | J214: =VLOOKUP(RC[-9],Sheet1!R2C1:R28C6,6,FALSE) -> 金币
A215: 4 | B215: btn_dungeon | C215: 65 | D215: 1 | E215: 65 | F215: 19003 | G215: 600000 | H215: =VLOOKUP(RC[-7],Sheet1!R2C1:R28C4,2,FALSE)&VLOOKUP(RC[-7],Sheet1!R2C1:R28C4,3,FALSE)&IF(VLOOKUP(RC[-7],Sheet1!R2C1:R28C4,4,FALSE)="品",VLOOKUP(RC[-3],Sheet1!R2C8:R6C9,2,FALSE),RC[-3])&VLOOKUP(RC[-7],Sheet1!R2C1:R28C4,4,FALSE) -> 通关主线副本第65章 | I215: 26 | J215: =VLOOKUP(RC[-9],Sheet1!R2C1:R28C6,6,FALSE) -> 金币
A216: 4 | B216: btn_dungeon | C216: 66 | D216: 1 | E216: 66 | F216: 19003 | G216: 700000 | H216: =VLOOKUP(RC[-7],Sheet1!R2C1:R28C4,2,FALSE)&VLOOKUP(RC[-7],Sheet1!R2C1:R28C4,3,FALSE)&IF(VLOOKUP(RC[-7],Sheet1!R2C1:R28C4,4,FALSE)="品",VLOOKUP(RC[-3],Sheet1!R2C8:R6C9,2,FALSE),RC[-3])&VLOOKUP(RC[-7],Sheet1!R2C1:R28C4,4,FALSE) -> 通关主线副本第66章 | I216: 26 | J216: =VLOOKUP(RC[-9],Sheet1!R2C1:R28C6,6,FALSE) -> 金币
A217: 4 | B217: btn_dungeon | C217: 67 | D217: 1 | E217: 67 | F217: 19003 | G217: 700000 | H217: =VLOOKUP(RC[-7],Sheet1!R2C1:R28C4,2,FALSE)&VLOOKUP(RC[-7],Sheet1!R2C1:R28C4,3,FALSE)&IF(VLOOKUP(RC[-7],Sheet1!R2C1:R28C4,4,FALSE)="品",VLOOKUP(RC[-3],Sheet1!R2C8:R6C9,2,FALSE),RC[-3])&VLOOKUP(RC[-7],Sheet1!R2C1:R28C4,4,FALSE) -> 通关主线副本第67章 | I217: 26 | J217: =VLOOKUP(RC[-9],Sheet1!R2C1:R28C6,6,FALSE) -> 金币
A218: 4 | B218: btn_dungeon | C218: 68 | D218: 1 | E218: 68 | F218: 19003 | G218: 700000 | H218: =VLOOKUP(RC[-7],Sheet1!R2C1:R28C4,2,FALSE)&VLOOKUP(RC[-7],Sheet1!R2C1:R28C4,3,FALSE)&IF(VLOOKUP(RC[-7],Sheet1!R2C1:R28C4,4,FALSE)="品",VLOOKUP(RC[-3],Sheet1!R2C8:R6C9,2,FALSE),RC[-3])&VLOOKUP(RC[-7],Sheet1!R2C1:R28C4,4,FALSE) -> 通关主线副本第68章 | I218: 26 | J218: =VLOOKUP(RC[-9],Sheet1!R2C1:R28C6,6,FALSE) -> 金币
A219: 4 | B219: btn_dungeon | C219: 69 | D219: 1 | E219: 69 | F219: 19003 | G219: 700000 | H219: =VLOOKUP(RC[-7],Sheet1!R2C1:R28C4,2,FALSE)&VLOOKUP(RC[-7],Sheet1!R2C1:R28C4,3,FALSE)&IF(VLOOKUP(RC[-7],Sheet1!R2C1:R28C4,4,FALSE)="品",VLOOKUP(RC[-3],Sheet1!R2C8:R6C9,2,FALSE),RC[-3])&VLOOKUP(RC[-7],Sheet1!R2C1:R28C4,4,FALSE) -> 通关主线副本第69章 | I219: 26 | J219: =VLOOKUP(RC[-9],Sheet1!R2C1:R28C6,6,FALSE) -> 金币
A220: 4 | B220: btn_dungeon | C220: 70 | D220: 1 | E220: 70 | F220: 19003 | G220: 700000 | H220: =VLOOKUP(RC[-7],Sheet1!R2C1:R28C4,2,FALSE)&VLOOKUP(RC[-7],Sheet1!R2C1:R28C4,3,FALSE)&IF(VLOOKUP(RC[-7],Sheet1!R2C1:R28C4,4,FALSE)="品",VLOOKUP(RC[-3],Sheet1!R2C8:R6C9,2,FALSE),RC[-3])&VLOOKUP(RC[-7],Sheet1!R2C1:R28C4,4,FALSE) -> 通关主线副本第70章 | I220: 26 | J220: =VLOOKUP(RC[-9],Sheet1!R2C1:R28C6,6,FALSE) -> 金币
A221: 4 | B221: btn_dungeon | C221: 71 | D221: 1 | E221: 71 | F221: 19003 | G221: 800000 | H221: =VLOOKUP(RC[-7],Sheet1!R2C1:R28C4,2,FALSE)&VLOOKUP(RC[-7],Sheet1!R2C1:R28C4,3,FALSE)&IF(VLOOKUP(RC[-7],Sheet1!R2C1:R28C4,4,FALSE)="品",VLOOKUP(RC[-3],Sheet1!R2C8:R6C9,2,FALSE),RC[-3])&VLOOKUP(RC[-7],Sheet1!R2C1:R28C4,4,FALSE) -> 通关主线副本第71章 | I221: 26 | J221: =VLOOKUP(RC[-9],Sheet1!R2C1:R28C6,6,FALSE) -> 金币
A222: 4 | B222: btn_dungeon | C222: 72 | D222: 1 | E222: 72 | F222: 19003 | G222: 800000 | H222: =VLOOKUP(RC[-7],Sheet1!R2C1:R28C4,2,FALSE)&VLOOKUP(RC[-7],Sheet1!R2C1:R28C4,3,FALSE)&IF(VLOOKUP(RC[-7],Sheet1!R2C1:R28C4,4,FALSE)="品",VLOOKUP(RC[-3],Sheet1!R2C8:R6C9,2,FALSE),RC[-3])&VLOOKUP(RC[-7],Sheet1!R2C1:R28C4,4,FALSE) -> 通关主线副本第72章 | I222: 26 | J222: =VLOOKUP(RC[-9],Sheet1!R2C1:R28C6,6,FALSE) -> 金币
A223: 4 | B223: btn_dungeon | C223: 73 | D223: 1 | E223: 73 | F223: 19003 | G223: 800000 | H223: =VLOOKUP(RC[-7],Sheet1!R2C1:R28C4,2,FALSE)&VLOOKUP(RC[-7],Sheet1!R2C1:R28C4,3,FALSE)&IF(VLOOKUP(RC[-7],Sheet1!R2C1:R28C4,4,FALSE)="品",VLOOKUP(RC[-3],Sheet1!R2C8:R6C9,2,FALSE),RC[-3])&VLOOKUP(RC[-7],Sheet1!R2C1:R28C4,4,FALSE) -> 通关主线副本第73章 | I223: 26 | J223: =VLOOKUP(RC[-9],Sheet1!R2C1:R28C6,6,FALSE) -> 金币
A224: 4 | B224: btn_dungeon | C224: 74 | D224: 1 | E224: 74 | F224: 19003 | G224: 800000 | H224: =VLOOKUP(RC[-7],Sheet1!R2C1:R28C4,2,FALSE)&VLOOKUP(RC[-7],Sheet1!R2C1:R28C4,3,FALSE)&IF(VLOOKUP(RC[-7],Sheet1!R2C1:R28C4,4,FALSE)="品",VLOOKUP(RC[-3],Sheet1!R2C8:R6C9,2,FALSE),RC[-3])&VLOOKUP(RC[-7],Sheet1!R2C1:R28C4,4,FALSE) -> 通关主线副本第74章 | I224: 26 | J224: =VLOOKUP(RC[-9],Sheet1!R2C1:R28C6,6,FALSE) -> 金币
A225: 4 | B225: btn_dungeon | C225: 75 | D225: 1 | E225: 75 | F225: 19003 | G225: 800000 | H225: =VLOOKUP(RC[-7],Sheet1!R2C1:R28C4,2,FALSE)&VLOOKUP(RC[-7],Sheet1!R2C1:R28C4,3,FALSE)&IF(VLOOKUP(RC[-7],Sheet1!R2C1:R28C4,4,FALSE)="品",VLOOKUP(RC[-3],Sheet1!R2C8:R6C9,2,FALSE),RC[-3])&VLOOKUP(RC[-7],Sheet1!R2C1:R28C4,4,FALSE) -> 通关主线副本第75章 | I225: 26 | J225: =VLOOKUP(RC[-9],Sheet1!R2C1:R28C6,6,FALSE) -> 金币
A226: 4 | B226: btn_dungeon | C226: 76 | D226: 1 | E226: 76 | F226: 19003 | G226: 900000 | H226: =VLOOKUP(RC[-7],Sheet1!R2C1:R28C4,2,FALSE)&VLOOKUP(RC[-7],Sheet1!R2C1:R28C4,3,FALSE)&IF(VLOOKUP(RC[-7],Sheet1!R2C1:R28C4,4,FALSE)="品",VLOOKUP(RC[-3],Sheet1!R2C8:R6C9,2,FALSE),RC[-3])&VLOOKUP(RC[-7],Sheet1!R2C1:R28C4,4,FALSE) -> 通关主线副本第76章 | I226: 26 | J226: =VLOOKUP(RC[-9],Sheet1!R2C1:R28C6,6,FALSE) -> 金币
A227: 4 | B227: btn_dungeon | C227: 77 | D227: 1 | E227: 77 | F227: 19003 | G227: 900000 | H227: =VLOOKUP(RC[-7],Sheet1!R2C1:R28C4,2,FALSE)&VLOOKUP(RC[-7],Sheet1!R2C1:R28C4,3,FALSE)&IF(VLOOKUP(RC[-7],Sheet1!R2C1:R28C4,4,FALSE)="品",VLOOKUP(RC[-3],Sheet1!R2C8:R6C9,2,FALSE),RC[-3])&VLOOKUP(RC[-7],Sheet1!R2C1:R28C4,4,FALSE) -> 通关主线副本第77章 | I227: 26 | J227: =VLOOKUP(RC[-9],Sheet1!R2C1:R28C6,6,FALSE) -> 金币
A228: 4 | B228: btn_dungeon | C228: 78 | D228: 1 | E228: 78 | F228: 19003 | G228: 900000 | H228: =VLOOKUP(RC[-7],Sheet1!R2C1:R28C4,2,FALSE)&VLOOKUP(RC[-7],Sheet1!R2C1:R28C4,3,FALSE)&IF(VLOOKUP(RC[-7],Sheet1!R2C1:R28C4,4,FALSE)="品",VLOOKUP(RC[-3],Sheet1!R2C8:R6C9,2,FALSE),RC[-3])&VLOOKUP(RC[-7],Sheet1!R2C1:R28C4,4,FALSE) -> 通关主线副本第78章 | I228: 26 | J228: =VLOOKUP(RC[-9],Sheet1!R2C1:R28C6,6,FALSE) -> 金币
A229: 4 | B229: btn_dungeon | C229: 79 | D229: 1 | E229: 79 | F229: 19003 | G229: 900000 | H229: =VLOOKUP(RC[-7],Sheet1!R2C1:R28C4,2,FALSE)&VLOOKUP(RC[-7],Sheet1!R2C1:R28C4,3,FALSE)&IF(VLOOKUP(RC[-7],Sheet1!R2C1:R28C4,4,FALSE)="品",VLOOKUP(RC[-3],Sheet1!R2C8:R6C9,2,FALSE),RC[-3])&VLOOKUP(RC[-7],Sheet1!R2C1:R28C4,4,FALSE) -> 通关主线副本第79章 | I229: 26 | J229: =VLOOKUP(RC[-9],Sheet1!R2C1:R28C6,6,FALSE) -> 金币
A230: 4 | B230: btn_dungeon | C230: 80 | D230: 1 | E230: 80 | F230: 19003 | G230: 900000 | H230: =VLOOKUP(RC[-7],Sheet1!R2C1:R28C4,2,FALSE)&VLOOKUP(RC[-7],Sheet1!R2C1:R28C4,3,FALSE)&IF(VLOOKUP(RC[-7],Sheet1!R2C1:R28C4,4,FALSE)="品",VLOOKUP(RC[-3],Sheet1!R2C8:R6C9,2,FALSE),RC[-3])&VLOOKUP(RC[-7],Sheet1!R2C1:R28C4,4,FALSE) -> 通关主线副本第80章 | I230: 26 | J230: =VLOOKUP(RC[-9],Sheet1!R2C1:R28C6,6,FALSE) -> 金币
A231: 4 | B231: btn_dungeon | C231: 81 | D231: 1 | E231: 81 | F231: 19003 | G231: 1000000 | H231: =VLOOKUP(RC[-7],Sheet1!R2C1:R28C4,2,FALSE)&VLOOKUP(RC[-7],Sheet1!R2C1:R28C4,3,FALSE)&IF(VLOOKUP(RC[-7],Sheet1!R2C1:R28C4,4,FALSE)="品",VLOOKUP(RC[-3],Sheet1!R2C8:R6C9,2,FALSE),RC[-3])&VLOOKUP(RC[-7],Sheet1!R2C1:R28C4,4,FALSE) -> 通关主线副本第81章 | I231: 26 | J231: =VLOOKUP(RC[-9],Sheet1!R2C1:R28C6,6,FALSE) -> 金币
A232: 4 | B232: btn_dungeon | C232: 82 | D232: 1 | E232: 82 | F232: 19003 | G232: 1000000 | H232: =VLOOKUP(RC[-7],Sheet1!R2C1:R28C4,2,FALSE)&VLOOKUP(RC[-7],Sheet1!R2C1:R28C4,3,FALSE)&IF(VLOOKUP(RC[-7],Sheet1!R2C1:R28C4,4,FALSE)="品",VLOOKUP(RC[-3],Sheet1!R2C8:R6C9,2,FALSE),RC[-3])&VLOOKUP(RC[-7],Sheet1!R2C1:R28C4,4,FALSE) -> 通关主线副本第82章 | I232: 26 | J232: =VLOOKUP(RC[-9],Sheet1!R2C1:R28C6,6,FALSE) -> 金币
A233: 4 | B233: btn_dungeon | C233: 83 | D233: 1 | E233: 83 | F233: 19003 | G233: 1000000 | H233: =VLOOKUP(RC[-7],Sheet1!R2C1:R28C4,2,FALSE)&VLOOKUP(RC[-7],Sheet1!R2C1:R28C4,3,FALSE)&IF(VLOOKUP(RC[-7],Sheet1!R2C1:R28C4,4,FALSE)="品",VLOOKUP(RC[-3],Sheet1!R2C8:R6C9,2,FALSE),RC[-3])&VLOOKUP(RC[-7],Sheet1!R2C1:R28C4,4,FALSE) -> 通关主线副本第83章 | I233: 26 | J233: =VLOOKUP(RC[-9],Sheet1!R2C1:R28C6,6,FALSE) -> 金币
A234: 4 | B234: btn_dungeon | C234: 84 | D234: 1 | E234: 84 | F234: 19003 | G234: 1000000 | H234: =VLOOKUP(RC[-7],Sheet1!R2C1:R28C4,2,FALSE)&VLOOKUP(RC[-7],Sheet1!R2C1:R28C4,3,FALSE)&IF(VLOOKUP(RC[-7],Sheet1!R2C1:R28C4,4,FALSE)="品",VLOOKUP(RC[-3],Sheet1!R2C8:R6C9,2,FALSE),RC[-3])&VLOOKUP(RC[-7],Sheet1!R2C1:R28C4,4,FALSE) -> 通关主线副本第84章 | I234: 26 | J234: =VLOOKUP(RC[-9],Sheet1!R2C1:R28C6,6,FALSE) -> 金币
A235: 4 | B235: btn_dungeon | C235: 85 | D235: 1 | E235: 85 | F235: 19003 | G235: 1000000 | H235: =VLOOKUP(RC[-7],Sheet1!R2C1:R28C4,2,FALSE)&VLOOKUP(RC[-7],Sheet1!R2C1:R28C4,3,FALSE)&IF(VLOOKUP(RC[-7],Sheet1!R2C1:R28C4,4,FALSE)="品",VLOOKUP(RC[-3],Sheet1!R2C8:R6C9,2,FALSE),RC[-3])&VLOOKUP(RC[-7],Sheet1!R2C1:R28C4,4,FALSE) -> 通关主线副本第85章 | I235: 26 | J235: =VLOOKUP(RC[-9],Sheet1!R2C1:R28C6,6,FALSE) -> 金币
A236: 4 | B236: btn_dungeon | C236: 86 | D236: 1 | E236: 86 | F236: 19003 | G236: 1000000 | H236: =VLOOKUP(RC[-7],Sheet1!R2C1:R28C4,2,FALSE)&VLOOKUP(RC[-7],Sheet1!R2C1:R28C4,3,FALSE)&IF(VLOOKUP(RC[-7],Sheet1!R2C1:R28C4,4,FALSE)="品",VLOOKUP(RC[-3],Sheet1!R2C8:R6C9,2,FALSE),RC[-3])&VLOOKUP(RC[-7],Sheet1!R2C1:R28C4,4,FALSE) -> 通关主线副本第86章 | I236: 26 | J236: =VLOOKUP(RC[-9],Sheet1!R2C1:R28C6,6,FALSE) -> 金币
A237: 4 | B237: btn_dungeon | C237: 87 | D237: 1 | E237: 87 | F237: 19003 | G237: 1000000 | H237: =VLOOKUP(RC[-7],Sheet1!R2C1:R28C4,2,FALSE)&VLOOKUP(RC[-7],Sheet1!R2C1:R28C4,3,FALSE)&IF(VLOOKUP(RC[-7],Sheet1!R2C1:R28C4,4,FALSE)="品",VLOOKUP(RC[-3],Sheet1!R2C8:R6C9,2,FALSE),RC[-3])&VLOOKUP(RC[-7],Sheet1!R2C1:R28C4,4,FALSE) -> 通关主线副本第87章 | I237: 26 | J237: =VLOOKUP(RC[-9],Sheet1!R2C1:R28C6,6,FALSE) -> 金币
A238: 4 | B238: btn_dungeon | C238: 88 | D238: 1 | E238: 88 | F238: 19003 | G238: 1000000 | H238: =VLOOKUP(RC[-7],Sheet1!R2C1:R28C4,2,FALSE)&VLOOKUP(RC[-7],Sheet1!R2C1:R28C4,3,FALSE)&IF(VLOOKUP(RC[-7],Sheet1!R2C1:R28C4,4,FALSE)="品",VLOOKUP(RC[-3],Sheet1!R2C8:R6C9,2,FALSE),RC[-3])&VLOOKUP(RC[-7],Sheet1!R2C1:R28C4,4,FALSE) -> 通关主线副本第88章 | I238: 26 | J238: =VLOOKUP(RC[-9],Sheet1!R2C1:R28C6,6,FALSE) -> 金币
A239: 4 | B239: btn_dungeon | C239: 89 | D239: 1 | E239: 89 | F239: 19003 | G239: 1000000 | H239: =VLOOKUP(RC[-7],Sheet1!R2C1:R28C4,2,FALSE)&VLOOKUP(RC[-7],Sheet1!R2C1:R28C4,3,FALSE)&IF(VLOOKUP(RC[-7],Sheet1!R2C1:R28C4,4,FALSE)="品",VLOOKUP(RC[-3],Sheet1!R2C8:R6C9,2,FALSE),RC[-3])&VLOOKUP(RC[-7],Sheet1!R2C1:R28C4,4,FALSE) -> 通关主线副本第89章 | I239: 26 | J239: =VLOOKUP(RC[-9],Sheet1!R2C1:R28C6,6,FALSE) -> 金币
A240: 4 | B240: btn_dungeon | C240: 90 | D240: 1 | E240: 90 | F240: 19003 | G240: 1000000 | H240: =VLOOKUP(RC[-7],Sheet1!R2C1:R28C4,2,FALSE)&VLOOKUP(RC[-7],Sheet1!R2C1:R28C4,3,FALSE)&IF(VLOOKUP(RC[-7],Sheet1!R2C1:R28C4,4,FALSE)="品",VLOOKUP(RC[-3],Sheet1!R2C8:R6C9,2,FALSE),RC[-3])&VLOOKUP(RC[-7],Sheet1!R2C1:R28C4,4,FALSE) -> 通关主线副本第90章 | I240: 26 | J240: =VLOOKUP(RC[-9],Sheet1!R2C1:R28C6,6,FALSE) -> 金币
A241: 4 | B241: btn_dungeon | C241: 91 | D241: 1 | E241: 91 | F241: 19003 | G241: 1000000 | H241: =VLOOKUP(RC[-7],Sheet1!R2C1:R28C4,2,FALSE)&VLOOKUP(RC[-7],Sheet1!R2C1:R28C4,3,FALSE)&IF(VLOOKUP(RC[-7],Sheet1!R2C1:R28C4,4,FALSE)="品",VLOOKUP(RC[-3],Sheet1!R2C8:R6C9,2,FALSE),RC[-3])&VLOOKUP(RC[-7],Sheet1!R2C1:R28C4,4,FALSE) -> 通关主线副本第91章 | I241: 26 | J241: =VLOOKUP(RC[-9],Sheet1!R2C1:R28C6,6,FALSE) -> 金币
A242: 4 | B242: btn_dungeon | C242: 92 | D242: 1 | E242: 92 | F242: 19003 | G242: 1000000 | H242: =VLOOKUP(RC[-7],Sheet1!R2C1:R28C4,2,FALSE)&VLOOKUP(RC[-7],Sheet1!R2C1:R28C4,3,FALSE)&IF(VLOOKUP(RC[-7],Sheet1!R2C1:R28C4,4,FALSE)="品",VLOOKUP(RC[-3],Sheet1!R2C8:R6C9,2,FALSE),RC[-3])&VLOOKUP(RC[-7],Sheet1!R2C1:R28C4,4,FALSE) -> 通关主线副本第92章 | I242: 26 | J242: =VLOOKUP(RC[-9],Sheet1!R2C1:R28C6,6,FALSE) -> 金币
A243: 4 | B243: btn_dungeon | C243: 93 | D243: 1 | E243: 93 | F243: 19003 | G243: 1000000 | H243: =VLOOKUP(RC[-7],Sheet1!R2C1:R28C4,2,FALSE)&VLOOKUP(RC[-7],Sheet1!R2C1:R28C4,3,FALSE)&IF(VLOOKUP(RC[-7],Sheet1!R2C1:R28C4,4,FALSE)="品",VLOOKUP(RC[-3],Sheet1!R2C8:R6C9,2,FALSE),RC[-3])&VLOOKUP(RC[-7],Sheet1!R2C1:R28C4,4,FALSE) -> 通关主线副本第93章 | I243: 26 | J243: =VLOOKUP(RC[-9],Sheet1!R2C1:R28C6,6,FALSE) -> 金币
A244: 4 | B244: btn_dungeon | C244: 94 | D244: 1 | E244: 94 | F244: 19003 | G244: 1000000 | H244: =VLOOKUP(RC[-7],Sheet1!R2C1:R28C4,2,FALSE)&VLOOKUP(RC[-7],Sheet1!R2C1:R28C4,3,FALSE)&IF(VLOOKUP(RC[-7],Sheet1!R2C1:R28C4,4,FALSE)="品",VLOOKUP(RC[-3],Sheet1!R2C8:R6C9,2,FALSE),RC[-3])&VLOOKUP(RC[-7],Sheet1!R2C1:R28C4,4,FALSE) -> 通关主线副本第94章 | I244: 26 | J244: =VLOOKUP(RC[-9],Sheet1!R2C1:R28C6,6,FALSE) -> 金币
A245: 4 | B245: btn_dungeon | C245: 95 | D245: 1 | E245: 95 | F245: 19003 | G245: 1000000 | H245: =VLOOKUP(RC[-7],Sheet1!R2C1:R28C4,2,FALSE)&VLOOKUP(RC[-7],Sheet1!R2C1:R28C4,3,FALSE)&IF(VLOOKUP(RC[-7],Sheet1!R2C1:R28C4,4,FALSE)="品",VLOOKUP(RC[-3],Sheet1!R2C8:R6C9,2,FALSE),RC[-3])&VLOOKUP(RC[-7],Sheet1!R2C1:R28C4,4,FALSE) -> 通关主线副本第95章 | I245: 26 | J245: =VLOOKUP(RC[-9],Sheet1!R2C1:R28C6,6,FALSE) -> 金币
A246: 4 | B246: btn_dungeon | C246: 96 | D246: 1 | E246: 96 | F246: 19003 | G246: 1000000 | H246: =VLOOKUP(RC[-7],Sheet1!R2C1:R28C4,2,FALSE)&VLOOKUP(RC[-7],Sheet1!R2C1:R28C4,3,FALSE)&IF(VLOOKUP(RC[-7],Sheet1!R2C1:R28C4,4,FALSE)="品",VLOOKUP(RC[-3],Sheet1!R2C8:R6C9,2,FALSE),RC[-3])&VLOOKUP(RC[-7],Sheet1!R2C1:R28C4,4,FALSE) -> 通关主线副本第96章 | I246: 26 | J246: =VLOOKUP(RC[-9],Sheet1!R2C1:R28C6,6,FALSE) -> 金币
A247: 4 | B247: btn_dungeon | C247: 97 | D247: 1 | E247: 97 | F247: 19003 | G247: 1000000 | H247: =VLOOKUP(RC[-7],Sheet1!R2C1:R28C4,2,FALSE)&VLOOKUP(RC[-7],Sheet1!R2C1:R28C4,3,FALSE)&IF(VLOOKUP(RC[-7],Sheet1!R2C1:R28C4,4,FALSE)="品",VLOOKUP(RC[-3],Sheet1!R2C8:R6C9,2,FALSE),RC[-3])&VLOOKUP(RC[-7],Sheet1!R2C1:R28C4,4,FALSE) -> 通关主线副本第97章 | I247: 26 | J247: =VLOOKUP(RC[-9],Sheet1!R2C1:R28C6,6,FALSE) -> 金币
A248: 4 | B248: btn_dungeon | C248: 98 | D248: 1 | E248: 98 | F248: 19003 | G248: 1000000 | H248: =VLOOKUP(RC[-7],Sheet1!R2C1:R28C4,2,FALSE)&VLOOKUP(RC[-7],Sheet1!R2C1:R28C4,3,FALSE)&IF(VLOOKUP(RC[-7],Sheet1!R2C1:R28C4,4,FALSE)="品",VLOOKUP(RC[-3],Sheet1!R2C8:R6C9,2,FALSE),RC[-3])&VLOOKUP(RC[-7],Sheet1!R2C1:R28C4,4,FALSE) -> 通关主线副本第98章 | I248: 26 | J248: =VLOOKUP(RC[-9],Sheet1!R2C1:R28C6,6,FALSE) -> 金币
A249: 4 | B249: btn_dungeon | C249: 99 | D249: 1 | E249: 99 | F249: 19003 | G249: 1000000 | H249: =VLOOKUP(RC[-7],Sheet1!R2C1:R28C4,2,FALSE)&VLOOKUP(RC[-7],Sheet1!R2C1:R28C4,3,FALSE)&IF(VLOOKUP(RC[-7],Sheet1!R2C1:R28C4,4,FALSE)="品",VLOOKUP(RC[-3],Sheet1!R2C8:R6C9,2,FALSE),RC[-3])&VLOOKUP(RC[-7],Sheet1!R2C1:R28C4,4,FALSE) -> 通关主线副本第99章 | I249: 26 | J249: =VLOOKUP(RC[-9],Sheet1!R2C1:R28C6,6,FALSE) -> 金币
A250: 4 | B250: btn_dungeon | C250: 100 | D250: 1 | E250: 100 | F250: 19003 | G250: 1000000 | H250: =VLOOKUP(RC[-7],Sheet1!R2C1:R28C4,2,FALSE)&VLOOKUP(RC[-7],Sheet1!R2C1:R28C4,3,FALSE)&IF(VLOOKUP(RC[-7],Sheet1!R2C1:R28C4,4,FALSE)="品",VLOOKUP(RC[-3],Sheet1!R2C8:R6C9,2,FALSE),RC[-3])&VLOOKUP(RC[-7],Sheet1!R2C1:R28C4,4,FALSE) -> 通关主线副本第100章 | I250: 26 | J250: =VLOOKUP(RC[-9],Sheet1!R2C1:R28C6,6,FALSE) -> 金币
A251: 5 | B251: btn_dungeon | C251: 1 | D251: 1 | E251: 12 | F251: 10000 | G251: 1 | H251: =VLOOKUP(RC[-7],Sheet1!R2C1:R28C4,2,FALSE)&VLOOKUP(RC[-7],Sheet1!R2C1:R28C4,3,FALSE)&IF(VLOOKUP(RC[-7],Sheet1!R2C1:R28C4,4,FALSE)="品",VLOOKUP(RC[-3],Sheet1!R2C8:R6C9,2,FALSE),RC[-3])&VLOOKUP(RC[-7],Sheet1!R2C1:R28C4,4,FALSE) -> 精英副本总星级达到12星 | I251: 28 | J251: =VLOOKUP(RC[-9],Sheet1!R2C1:R28C6,6,FALSE) -> 觉醒水晶
A252: 5 | B252: btn_dungeon | C252: 2 | D252: 1 | E252: 24 | F252: 10000 | G252: 1 | H252: =VLOOKUP(RC[-7],Sheet1!R2C1:R28C4,2,FALSE)&VLOOKUP(RC[-7],Sheet1!R2C1:R28C4,3,FALSE)&IF(VLOOKUP(RC[-7],Sheet1!R2C1:R28C4,4,FALSE)="品",VLOOKUP(RC[-3],Sheet1!R2C8:R6C9,2,FALSE),RC[-3])&VLOOKUP(RC[-7],Sheet1!R2C1:R28C4,4,FALSE) -> 精英副本总星级达到24星 | I252: 28 | J252: =VLOOKUP(RC[-9],Sheet1!R2C1:R28C6,6,FALSE) -> 觉醒水晶
A253: 5 | B253: btn_dungeon | C253: 3 | D253: 1 | E253: 36 | F253: 10000 | G253: 1 | H253: =VLOOKUP(RC[-7],Sheet1!R2C1:R28C4,2,FALSE)&VLOOKUP(RC[-7],Sheet1!R2C1:R28C4,3,FALSE)&IF(VLOOKUP(RC[-7],Sheet1!R2C1:R28C4,4,FALSE)="品",VLOOKUP(RC[-3],Sheet1!R2C8:R6C9,2,FALSE),RC[-3])&VLOOKUP(RC[-7],Sheet1!R2C1:R28C4,4,FALSE) -> 精英副本总星级达到36星 | I253: 28 | J253: =VLOOKUP(RC[-9],Sheet1!R2C1:R28C6,6,FALSE) -> 觉醒水晶
A254: 5 | B254: btn_dungeon | C254: 4 | D254: 1 | E254: 48 | F254: 10000 | G254: 1 | H254: =VLOOKUP(RC[-7],Sheet1!R2C1:R28C4,2,FALSE)&VLOOKUP(RC[-7],Sheet1!R2C1:R28C4,3,FALSE)&IF(VLOOKUP(RC[-7],Sheet1!R2C1:R28C4,4,FALSE)="品",VLOOKUP(RC[-3],Sheet1!R2C8:R6C9,2,FALSE),RC[-3])&VLOOKUP(RC[-7],Sheet1!R2C1:R28C4,4,FALSE) -> 精英副本总星级达到48星 | I254: 28 | J254: =VLOOKUP(RC[-9],Sheet1!R2C1:R28C6,6,FALSE) -> 觉醒水晶
A255: 5 | B255: btn_dungeon | C255: 5 | D255: 1 | E255: 60 | F255: 10000 | G255: 1 | H255: =VLOOKUP(RC[-7],Sheet1!R2C1:R28C4,2,FALSE)&VLOOKUP(RC[-7],Sheet1!R2C1:R28C4,3,FALSE)&IF(VLOOKUP(RC[-7],Sheet1!R2C1:R28C4,4,FALSE)="品",VLOOKUP(RC[-3],Sheet1!R2C8:R6C9,2,FALSE),RC[-3])&VLOOKUP(RC[-7],Sheet1!R2C1:R28C4,4,FALSE) -> 精英副本总星级达到60星 | I255: 28 | J255: =VLOOKUP(RC[-9],Sheet1!R2C1:R28C6,6,FALSE) -> 觉醒水晶
A256: 5 | B256: btn_dungeon | C256: 6 | D256: 1 | E256: 72 | F256: 10000 | G256: 1 | H256: =VLOOKUP(RC[-7],Sheet1!R2C1:R28C4,2,FALSE)&VLOOKUP(RC[-7],Sheet1!R2C1:R28C4,3,FALSE)&IF(VLOOKUP(RC[-7],Sheet1!R2C1:R28C4,4,FALSE)="品",VLOOKUP(RC[-3],Sheet1!R2C8:R6C9,2,FALSE),RC[-3])&VLOOKUP(RC[-7],Sheet1!R2C1:R28C4,4,FALSE) -> 精英副本总星级达到72星 | I256: 28 | J256: =VLOOKUP(RC[-9],Sheet1!R2C1:R28C6,6,FALSE) -> 觉醒水晶
A257: 5 | B257: btn_dungeon | C257: 7 | D257: 1 | E257: 84 | F257: 10000 | G257: 1 | H257: =VLOOKUP(RC[-7],Sheet1!R2C1:R28C4,2,FALSE)&VLOOKUP(RC[-7],Sheet1!R2C1:R28C4,3,FALSE)&IF(VLOOKUP(RC[-7],Sheet1!R2C1:R28C4,4,FALSE)="品",VLOOKUP(RC[-3],Sheet1!R2C8:R6C9,2,FALSE),RC[-3])&VLOOKUP(RC[-7],Sheet1!R2C1:R28C4,4,FALSE) -> 精英副本总星级达到84星 | I257: 28 | J257: =VLOOKUP(RC[-9],Sheet1!R2C1:R28C6,6,FALSE) -> 觉醒水晶
A258: 5 | B258: btn_dungeon | C258: 8 | D258: 1 | E258: 96 | F258: 10000 | G258: 1 | H258: =VLOOKUP(RC[-7],Sheet1!R2C1:R28C4,2,FALSE)&VLOOKUP(RC[-7],Sheet1!R2C1:R28C4,3,FALSE)&IF(VLOOKUP(RC[-7],Sheet1!R2C1:R28C4,4,FALSE)="品",VLOOKUP(RC[-3],Sheet1!R2C8:R6C9,2,FALSE),RC[-3])&VLOOKUP(RC[-7],Sheet1!R2C1:R28C4,4,FALSE) -> 精英副本总星级达到96星 | I258: 28 | J258: =VLOOKUP(RC[-9],Sheet1!R2C1:R28C6,6,FALSE) -> 觉醒水晶
A259: 5 | B259: btn_dungeon | C259: 9 | D259: 1 | E259: 108 | F259: 10000 | G259: 1 | H259: =VLOOKUP(RC[-7],Sheet1!R2C1:R28C4,2,FALSE)&VLOOKUP(RC[-7],Sheet1!R2C1:R28C4,3,FALSE)&IF(VLOOKUP(RC[-7],Sheet1!R2C1:R28C4,4,FALSE)="品",VLOOKUP(RC[-3],Sheet1!R2C8:R6C9,2,FALSE),RC[-3])&VLOOKUP(RC[-7],Sheet1!R2C1:R28C4,4,FALSE) -> 精英副本总星级达到108星 | I259: 28 | J259: =VLOOKUP(RC[-9],Sheet1!R2C1:R28C6,6,FALSE) -> 觉醒水晶
A260: 5 | B260: btn_dungeon | C260: 10 | D260: 1 | E260: 120 | F260: 10000 | G260: 1 | H260: =VLOOKUP(RC[-7],Sheet1!R2C1:R28C4,2,FALSE)&VLOOKUP(RC[-7],Sheet1!R2C1:R28C4,3,FALSE)&IF(VLOOKUP(RC[-7],Sheet1!R2C1:R28C4,4,FALSE)="品",VLOOKUP(RC[-3],Sheet1!R2C8:R6C9,2,FALSE),RC[-3])&VLOOKUP(RC[-7],Sheet1!R2C1:R28C4,4,FALSE) -> 精英副本总星级达到120星 | I260: 28 | J260: =VLOOKUP(RC[-9],Sheet1!R2C1:R28C6,6,FALSE) -> 觉醒水晶
A261: 5 | B261: btn_dungeon | C261: 11 | D261: 1 | E261: 132 | F261: 10000 | G261: 2 | H261: =VLOOKUP(RC[-7],Sheet1!R2C1:R28C4,2,FALSE)&VLOOKUP(RC[-7],Sheet1!R2C1:R28C4,3,FALSE)&IF(VLOOKUP(RC[-7],Sheet1!R2C1:R28C4,4,FALSE)="品",VLOOKUP(RC[-3],Sheet1!R2C8:R6C9,2,FALSE),RC[-3])&VLOOKUP(RC[-7],Sheet1!R2C1:R28C4,4,FALSE) -> 精英副本总星级达到132星 | I261: 28 | J261: =VLOOKUP(RC[-9],Sheet1!R2C1:R28C6,6,FALSE) -> 觉醒水晶
A262: 5 | B262: btn_dungeon | C262: 12 | D262: 1 | E262: 144 | F262: 10000 | G262: 2 | H262: =VLOOKUP(RC[-7],Sheet1!R2C1:R28C4,2,FALSE)&VLOOKUP(RC[-7],Sheet1!R2C1:R28C4,3,FALSE)&IF(VLOOKUP(RC[-7],Sheet1!R2C1:R28C4,4,FALSE)="品",VLOOKUP(RC[-3],Sheet1!R2C8:R6C9,2,FALSE),RC[-3])&VLOOKUP(RC[-7],Sheet1!R2C1:R28C4,4,FALSE) -> 精英副本总星级达到144星 | I262: 28 | J262: =VLOOKUP(RC[-9],Sheet1!R2C1:R28C6,6,FALSE) -> 觉醒水晶
A263: 5 | B263: btn_dungeon | C263: 13 | D263: 1 | E263: 156 | F263: 10000 | G263: 2 | H263: =VLOOKUP(RC[-7],Sheet1!R2C1:R28C4,2,FALSE)&VLOOKUP(RC[-7],Sheet1!R2C1:R28C4,3,FALSE)&IF(VLOOKUP(RC[-7],Sheet1!R2C1:R28C4,4,FALSE)="品",VLOOKUP(RC[-3],Sheet1!R2C8:R6C9,2,FALSE),RC[-3])&VLOOKUP(RC[-7],Sheet1!R2C1:R28C4,4,FALSE) -> 精英副本总星级达到156星 | I263: 28 | J263: =VLOOKUP(RC[-9],Sheet1!R2C1:R28C6,6,FALSE) -> 觉醒水晶
A264: 5 | B264: btn_dungeon | C264: 14 | D264: 1 | E264: 168 | F264: 10000 | G264: 2 | H264: =VLOOKUP(RC[-7],Sheet1!R2C1:R28C4,2,FALSE)&VLOOKUP(RC[-7],Sheet1!R2C1:R28C4,3,FALSE)&IF(VLOOKUP(RC[-7],Sheet1!R2C1:R28C4,4,FALSE)="品",VLOOKUP(RC[-3],Sheet1!R2C8:R6C9,2,FALSE),RC[-3])&VLOOKUP(RC[-7],Sheet1!R2C1:R28C4,4,FALSE) -> 精英副本总星级达到168星 | I264: 28 | J264: =VLOOKUP(RC[-9],Sheet1!R2C1:R28C6,6,FALSE) -> 觉醒水晶
A265: 5 | B265: btn_dungeon | C265: 15 | D265: 1 | E265: 180 | F265: 10000 | G265: 2 | H265: =VLOOKUP(RC[-7],Sheet1!R2C1:R28C4,2,FALSE)&VLOOKUP(RC[-7],Sheet1!R2C1:R28C4,3,FALSE)&IF(VLOOKUP(RC[-7],Sheet1!R2C1:R28C4,4,FALSE)="品",VLOOKUP(RC[-3],Sheet1!R2C8:R6C9,2,FALSE),RC[-3])&VLOOKUP(RC[-7],Sheet1!R2C1:R28C4,4,FALSE) -> 精英副本总星级达到180星 | I265: 28 | J265: =VLOOKUP(RC[-9],Sheet1!R2C1:R28C6,6,FALSE) -> 觉醒水晶
A266: 5 | B266: btn_dungeon | C266: 16 | D266: 1 | E266: 192 | F266: 10000 | G266: 2 | H266: =VLOOKUP(RC[-7],Sheet1!R2C1:R28C4,2,FALSE)&VLOOKUP(RC[-7],Sheet1!R2C1:R28C4,3,FALSE)&IF(VLOOKUP(RC[-7],Sheet1!R2C1:R28C4,4,FALSE)="品",VLOOKUP(RC[-3],Sheet1!R2C8:R6C9,2,FALSE),RC[-3])&VLOOKUP(RC[-7],Sheet1!R2C1:R28C4,4,FALSE) -> 精英副本总星级达到192星 | I266: 28 | J266: =VLOOKUP(RC[-9],Sheet1!R2C1:R28C6,6,FALSE) -> 觉醒水晶
A267: 5 | B267: btn_dungeon | C267: 17 | D267: 1 | E267: 204 | F267: 10000 | G267: 2 | H267: =VLOOKUP(RC[-7],Sheet1!R2C1:R28C4,2,FALSE)&VLOOKUP(RC[-7],Sheet1!R2C1:R28C4,3,FALSE)&IF(VLOOKUP(RC[-7],Sheet1!R2C1:R28C4,4,FALSE)="品",VLOOKUP(RC[-3],Sheet1!R2C8:R6C9,2,FALSE),RC[-3])&VLOOKUP(RC[-7],Sheet1!R2C1:R28C4,4,FALSE) -> 精英副本总星级达到204星 | I267: 28 | J267: =VLOOKUP(RC[-9],Sheet1!R2C1:R28C6,6,FALSE) -> 觉醒水晶
A268: 5 | B268: btn_dungeon | C268: 18 | D268: 1 | E268: 216 | F268: 10000 | G268: 2 | H268: =VLOOKUP(RC[-7],Sheet1!R2C1:R28C4,2,FALSE)&VLOOKUP(RC[-7],Sheet1!R2C1:R28C4,3,FALSE)&IF(VLOOKUP(RC[-7],Sheet1!R2C1:R28C4,4,FALSE)="品",VLOOKUP(RC[-3],Sheet1!R2C8:R6C9,2,FALSE),RC[-3])&VLOOKUP(RC[-7],Sheet1!R2C1:R28C4,4,FALSE) -> 精英副本总星级达到216星 | I268: 28 | J268: =VLOOKUP(RC[-9],Sheet1!R2C1:R28C6,6,FALSE) -> 觉醒水晶
A269: 5 | B269: btn_dungeon | C269: 19 | D269: 1 | E269: 228 | F269: 10000 | G269: 2 | H269: =VLOOKUP(RC[-7],Sheet1!R2C1:R28C4,2,FALSE)&VLOOKUP(RC[-7],Sheet1!R2C1:R28C4,3,FALSE)&IF(VLOOKUP(RC[-7],Sheet1!R2C1:R28C4,4,FALSE)="品",VLOOKUP(RC[-3],Sheet1!R2C8:R6C9,2,FALSE),RC[-3])&VLOOKUP(RC[-7],Sheet1!R2C1:R28C4,4,FALSE) -> 精英副本总星级达到228星 | I269: 28 | J269: =VLOOKUP(RC[-9],Sheet1!R2C1:R28C6,6,FALSE) -> 觉醒水晶
A270: 5 | B270: btn_dungeon | C270: 20 | D270: 1 | E270: 240 | F270: 10000 | G270: 2 | H270: =VLOOKUP(RC[-7],Sheet1!R2C1:R28C4,2,FALSE)&VLOOKUP(RC[-7],Sheet1!R2C1:R28C4,3,FALSE)&IF(VLOOKUP(RC[-7],Sheet1!R2C1:R28C4,4,FALSE)="品",VLOOKUP(RC[-3],Sheet1!R2C8:R6C9,2,FALSE),RC[-3])&VLOOKUP(RC[-7],Sheet1!R2C1:R28C4,4,FALSE) -> 精英副本总星级达到240星 | I270: 28 | J270: =VLOOKUP(RC[-9],Sheet1!R2C1:R28C6,6,FALSE) -> 觉醒水晶
A271: 5 | B271: btn_dungeon | C271: 21 | D271: 1 | E271: 252 | F271: 10000 | G271: 3 | H271: =VLOOKUP(RC[-7],Sheet1!R2C1:R28C4,2,FALSE)&VLOOKUP(RC[-7],Sheet1!R2C1:R28C4,3,FALSE)&IF(VLOOKUP(RC[-7],Sheet1!R2C1:R28C4,4,FALSE)="品",VLOOKUP(RC[-3],Sheet1!R2C8:R6C9,2,FALSE),RC[-3])&VLOOKUP(RC[-7],Sheet1!R2C1:R28C4,4,FALSE) -> 精英副本总星级达到252星 | I271: 28 | J271: =VLOOKUP(RC[-9],Sheet1!R2C1:R28C6,6,FALSE) -> 觉醒水晶
A272: 5 | B272: btn_dungeon | C272: 22 | D272: 1 | E272: 264 | F272: 10000 | G272: 3 | H272: =VLOOKUP(RC[-7],Sheet1!R2C1:R28C4,2,FALSE)&VLOOKUP(RC[-7],Sheet1!R2C1:R28C4,3,FALSE)&IF(VLOOKUP(RC[-7],Sheet1!R2C1:R28C4,4,FALSE)="品",VLOOKUP(RC[-3],Sheet1!R2C8:R6C9,2,FALSE),RC[-3])&VLOOKUP(RC[-7],Sheet1!R2C1:R28C4,4,FALSE) -> 精英副本总星级达到264星 | I272: 28 | J272: =VLOOKUP(RC[-9],Sheet1!R2C1:R28C6,6,FALSE) -> 觉醒水晶
A273: 5 | B273: btn_dungeon | C273: 23 | D273: 1 | E273: 276 | F273: 10000 | G273: 3 | H273: =VLOOKUP(RC[-7],Sheet1!R2C1:R28C4,2,FALSE)&VLOOKUP(RC[-7],Sheet1!R2C1:R28C4,3,FALSE)&IF(VLOOKUP(RC[-7],Sheet1!R2C1:R28C4,4,FALSE)="品",VLOOKUP(RC[-3],Sheet1!R2C8:R6C9,2,FALSE),RC[-3])&VLOOKUP(RC[-7],Sheet1!R2C1:R28C4,4,FALSE) -> 精英副本总星级达到276星 | I273: 28 | J273: =VLOOKUP(RC[-9],Sheet1!R2C1:R28C6,6,FALSE) -> 觉醒水晶
A274: 5 | B274: btn_dungeon | C274: 24 | D274: 1 | E274: 288 | F274: 10000 | G274: 3 | H274: =VLOOKUP(RC[-7],Sheet1!R2C1:R28C4,2,FALSE)&VLOOKUP(RC[-7],Sheet1!R2C1:R28C4,3,FALSE)&IF(VLOOKUP(RC[-7],Sheet1!R2C1:R28C4,4,FALSE)="品",VLOOKUP(RC[-3],Sheet1!R2C8:R6C9,2,FALSE),RC[-3])&VLOOKUP(RC[-7],Sheet1!R2C1:R28C4,4,FALSE) -> 精英副本总星级达到288星 | I274: 28 | J274: =VLOOKUP(RC[-9],Sheet1!R2C1:R28C6,6,FALSE) -> 觉醒水晶
A275: 5 | B275: btn_dungeon | C275: 25 | D275: 1 | E275: 300 | F275: 10000 | G275: 3 | H275: =VLOOKUP(RC[-7],Sheet1!R2C1:R28C4,2,FALSE)&VLOOKUP(RC[-7],Sheet1!R2C1:R28C4,3,FALSE)&IF(VLOOKUP(RC[-7],Sheet1!R2C1:R28C4,4,FALSE)="品",VLOOKUP(RC[-3],Sheet1!R2C8:R6C9,2,FALSE),RC[-3])&VLOOKUP(RC[-7],Sheet1!R2C1:R28C4,4,FALSE) -> 精英副本总星级达到300星 | I275: 28 | J275: =VLOOKUP(RC[-9],Sheet1!R2C1:R28C6,6,FALSE) -> 觉醒水晶
A276: 5 | B276: btn_dungeon | C276: 26 | D276: 1 | E276: 312 | F276: 10000 | G276: 3 | H276: =VLOOKUP(RC[-7],Sheet1!R2C1:R28C4,2,FALSE)&VLOOKUP(RC[-7],Sheet1!R2C1:R28C4,3,FALSE)&IF(VLOOKUP(RC[-7],Sheet1!R2C1:R28C4,4,FALSE)="品",VLOOKUP(RC[-3],Sheet1!R2C8:R6C9,2,FALSE),RC[-3])&VLOOKUP(RC[-7],Sheet1!R2C1:R28C4,4,FALSE) -> 精英副本总星级达到312星 | I276: 28 | J276: =VLOOKUP(RC[-9],Sheet1!R2C1:R28C6,6,FALSE) -> 觉醒水晶
A277: 5 | B277: btn_dungeon | C277: 27 | D277: 1 | E277: 324 | F277: 10000 | G277: 3 | H277: =VLOOKUP(RC[-7],Sheet1!R2C1:R28C4,2,FALSE)&VLOOKUP(RC[-7],Sheet1!R2C1:R28C4,3,FALSE)&IF(VLOOKUP(RC[-7],Sheet1!R2C1:R28C4,4,FALSE)="品",VLOOKUP(RC[-3],Sheet1!R2C8:R6C9,2,FALSE),RC[-3])&VLOOKUP(RC[-7],Sheet1!R2C1:R28C4,4,FALSE) -> 精英副本总星级达到324星 | I277: 28 | J277: =VLOOKUP(RC[-9],Sheet1!R2C1:R28C6,6,FALSE) -> 觉醒水晶
A278: 5 | B278: btn_dungeon | C278: 28 | D278: 1 | E278: 336 | F278: 10000 | G278: 3 | H278: =VLOOKUP(RC[-7],Sheet1!R2C1:R28C4,2,FALSE)&VLOOKUP(RC[-7],Sheet1!R2C1:R28C4,3,FALSE)&IF(VLOOKUP(RC[-7],Sheet1!R2C1:R28C4,4,FALSE)="品",VLOOKUP(RC[-3],Sheet1!R2C8:R6C9,2,FALSE),RC[-3])&VLOOKUP(RC[-7],Sheet1!R2C1:R28C4,4,FALSE) -> 精英副本总星级达到336星 | I278: 28 | J278: =VLOOKUP(RC[-9],Sheet1!R2C1:R28C6,6,FALSE) -> 觉醒水晶
A279: 5 | B279: btn_dungeon | C279: 29 | D279: 1 | E279: 348 | F279: 10000 | G279: 3 | H279: =VLOOKUP(RC[-7],Sheet1!R2C1:R28C4,2,FALSE)&VLOOKUP(RC[-7],Sheet1!R2C1:R28C4,3,FALSE)&IF(VLOOKUP(RC[-7],Sheet1!R2C1:R28C4,4,FALSE)="品",VLOOKUP(RC[-3],Sheet1!R2C8:R6C9,2,FALSE),RC[-3])&VLOOKUP(RC[-7],Sheet1!R2C1:R28C4,4,FALSE) -> 精英副本总星级达到348星 | I279: 28 | J279: =VLOOKUP(RC[-9],Sheet1!R2C1:R28C6,6,FALSE) -> 觉醒水晶
A280: 5 | B280: btn_dungeon | C280: 30 | D280: 1 | E280: 360 | F280: 10000 | G280: 3 | H280: =VLOOKUP(RC[-7],Sheet1!R2C1:R28C4,2,FALSE)&VLOOKUP(RC[-7],Sheet1!R2C1:R28C4,3,FALSE)&IF(VLOOKUP(RC[-7],Sheet1!R2C1:R28C4,4,FALSE)="品",VLOOKUP(RC[-3],Sheet1!R2C8:R6C9,2,FALSE),RC[-3])&VLOOKUP(RC[-7],Sheet1!R2C1:R28C4,4,FALSE) -> 精英副本总星级达到360星 | I280: 28 | J280: =VLOOKUP(RC[-9],Sheet1!R2C1:R28C6,6,FALSE) -> 觉醒水晶
A281: 5 | B281: btn_dungeon | C281: 31 | D281: 1 | E281: 372 | F281: 10000 | G281: 4 | H281: =VLOOKUP(RC[-7],Sheet1!R2C1:R28C4,2,FALSE)&VLOOKUP(RC[-7],Sheet1!R2C1:R28C4,3,FALSE)&IF(VLOOKUP(RC[-7],Sheet1!R2C1:R28C4,4,FALSE)="品",VLOOKUP(RC[-3],Sheet1!R2C8:R6C9,2,FALSE),RC[-3])&VLOOKUP(RC[-7],Sheet1!R2C1:R28C4,4,FALSE) -> 精英副本总星级达到372星 | I281: 28 | J281: =VLOOKUP(RC[-9],Sheet1!R2C1:R28C6,6,FALSE) -> 觉醒水晶
A282: 5 | B282: btn_dungeon | C282: 32 | D282: 1 | E282: 384 | F282: 10000 | G282: 4 | H282: =VLOOKUP(RC[-7],Sheet1!R2C1:R28C4,2,FALSE)&VLOOKUP(RC[-7],Sheet1!R2C1:R28C4,3,FALSE)&IF(VLOOKUP(RC[-7],Sheet1!R2C1:R28C4,4,FALSE)="品",VLOOKUP(RC[-3],Sheet1!R2C8:R6C9,2,FALSE),RC[-3])&VLOOKUP(RC[-7],Sheet1!R2C1:R28C4,4,FALSE) -> 精英副本总星级达到384星 | I282: 28 | J282: =VLOOKUP(RC[-9],Sheet1!R2C1:R28C6,6,FALSE) -> 觉醒水晶
A283: 5 | B283: btn_dungeon | C283: 33 | D283: 1 | E283: 396 | F283: 10000 | G283: 4 | H283: =VLOOKUP(RC[-7],Sheet1!R2C1:R28C4,2,FALSE)&VLOOKUP(RC[-7],Sheet1!R2C1:R28C4,3,FALSE)&IF(VLOOKUP(RC[-7],Sheet1!R2C1:R28C4,4,FALSE)="品",VLOOKUP(RC[-3],Sheet1!R2C8:R6C9,2,FALSE),RC[-3])&VLOOKUP(RC[-7],Sheet1!R2C1:R28C4,4,FALSE) -> 精英副本总星级达到396星 | I283: 28 | J283: =VLOOKUP(RC[-9],Sheet1!R2C1:R28C6,6,FALSE) -> 觉醒水晶
A284: 5 | B284: btn_dungeon | C284: 34 | D284: 1 | E284: 408 | F284: 10000 | G284: 4 | H284: =VLOOKUP(RC[-7],Sheet1!R2C1:R28C4,2,FALSE)&VLOOKUP(RC[-7],Sheet1!R2C1:R28C4,3,FALSE)&IF(VLOOKUP(RC[-7],Sheet1!R2C1:R28C4,4,FALSE)="品",VLOOKUP(RC[-3],Sheet1!R2C8:R6C9,2,FALSE),RC[-3])&VLOOKUP(RC[-7],Sheet1!R2C1:R28C4,4,FALSE) -> 精英副本总星级达到408星 | I284: 28 | J284: =VLOOKUP(RC[-9],Sheet1!R2C1:R28C6,6,FALSE) -> 觉醒水晶
A285: 5 | B285: btn_dungeon | C285: 35 | D285: 1 | E285: 420 | F285: 10000 | G285: 4 | H285: =VLOOKUP(RC[-7],Sheet1!R2C1:R28C4,2,FALSE)&VLOOKUP(RC[-7],Sheet1!R2C1:R28C4,3,FALSE)&IF(VLOOKUP(RC[-7],Sheet1!R2C1:R28C4,4,FALSE)="品",VLOOKUP(RC[-3],Sheet1!R2C8:R6C9,2,FALSE),RC[-3])&VLOOKUP(RC[-7],Sheet1!R2C1:R28C4,4,FALSE) -> 精英副本总星级达到420星 | I285: 28 | J285: =VLOOKUP(RC[-9],Sheet1!R2C1:R28C6,6,FALSE) -> 觉醒水晶
A286: 5 | B286: btn_dungeon | C286: 36 | D286: 1 | E286: 432 | F286: 10000 | G286: 4 | H286: =VLOOKUP(RC[-7],Sheet1!R2C1:R28C4,2,FALSE)&VLOOKUP(RC[-7],Sheet1!R2C1:R28C4,3,FALSE)&IF(VLOOKUP(RC[-7],Sheet1!R2C1:R28C4,4,FALSE)="品",VLOOKUP(RC[-3],Sheet1!R2C8:R6C9,2,FALSE),RC[-3])&VLOOKUP(RC[-7],Sheet1!R2C1:R28C4,4,FALSE) -> 精英副本总星级达到432星 | I286: 28 | J286: =VLOOKUP(RC[-9],Sheet1!R2C1:R28C6,6,FALSE) -> 觉醒水晶
A287: 5 | B287: btn_dungeon | C287: 37 | D287: 1 | E287: 444 | F287: 10000 | G287: 4 | H287: =VLOOKUP(RC[-7],Sheet1!R2C1:R28C4,2,FALSE)&VLOOKUP(RC[-7],Sheet1!R2C1:R28C4,3,FALSE)&IF(VLOOKUP(RC[-7],Sheet1!R2C1:R28C4,4,FALSE)="品",VLOOKUP(RC[-3],Sheet1!R2C8:R6C9,2,FALSE),RC[-3])&VLOOKUP(RC[-7],Sheet1!R2C1:R28C4,4,FALSE) -> 精英副本总星级达到444星 | I287: 28 | J287: =VLOOKUP(RC[-9],Sheet1!R2C1:R28C6,6,FALSE) -> 觉醒水晶
A288: 5 | B288: btn_dungeon | C288: 38 | D288: 1 | E288: 456 | F288: 10000 | G288: 4 | H288: =VLOOKUP(RC[-7],Sheet1!R2C1:R28C4,2,FALSE)&VLOOKUP(RC[-7],Sheet1!R2C1:R28C4,3,FALSE)&IF(VLOOKUP(RC[-7],Sheet1!R2C1:R28C4,4,FALSE)="品",VLOOKUP(RC[-3],Sheet1!R2C8:R6C9,2,FALSE),RC[-3])&VLOOKUP(RC[-7],Sheet1!R2C1:R28C4,4,FALSE) -> 精英副本总星级达到456星 | I288: 28 | J288: =VLOOKUP(RC[-9],Sheet1!R2C1:R28C6,6,FALSE) -> 觉醒水晶
A289: 5 | B289: btn_dungeon | C289: 39 | D289: 1 | E289: 468 | F289: 10000 | G289: 4 | H289: =VLOOKUP(RC[-7],Sheet1!R2C1:R28C4,2,FALSE)&VLOOKUP(RC[-7],Sheet1!R2C1:R28C4,3,FALSE)&IF(VLOOKUP(RC[-7],Sheet1!R2C1:R28C4,4,FALSE)="品",VLOOKUP(RC[-3],Sheet1!R2C8:R6C9,2,FALSE),RC[-3])&VLOOKUP(RC[-7],Sheet1!R2C1:R28C4,4,FALSE) -> 精英副本总星级达到468星 | I289: 28 | J289: =VLOOKUP(RC[-9],Sheet1!R2C1:R28C6,6,FALSE) -> 觉醒水晶
A290: 5 | B290: btn_dungeon | C290: 40 | D290: 1 | E290: 480 | F290: 10000 | G290: 4 | H290: =VLOOKUP(RC[-7],Sheet1!R2C1:R28C4,2,FALSE)&VLOOKUP(RC[-7],Sheet1!R2C1:R28C4,3,FALSE)&IF(VLOOKUP(RC[-7],Sheet1!R2C1:R28C4,4,FALSE)="品",VLOOKUP(RC[-3],Sheet1!R2C8:R6C9,2,FALSE),RC[-3])&VLOOKUP(RC[-7],Sheet1!R2C1:R28C4,4,FALSE) -> 精英副本总星级达到480星 | I290: 28 | J290: =VLOOKUP(RC[-9],Sheet1!R2C1:R28C6,6,FALSE) -> 觉醒水晶
A291: 5 | B291: btn_dungeon | C291: 41 | D291: 1 | E291: 492 | F291: 10000 | G291: 5 | H291: =VLOOKUP(RC[-7],Sheet1!R2C1:R28C4,2,FALSE)&VLOOKUP(RC[-7],Sheet1!R2C1:R28C4,3,FALSE)&IF(VLOOKUP(RC[-7],Sheet1!R2C1:R28C4,4,FALSE)="品",VLOOKUP(RC[-3],Sheet1!R2C8:R6C9,2,FALSE),RC[-3])&VLOOKUP(RC[-7],Sheet1!R2C1:R28C4,4,FALSE) -> 精英副本总星级达到492星 | I291: 28 | J291: =VLOOKUP(RC[-9],Sheet1!R2C1:R28C6,6,FALSE) -> 觉醒水晶
A292: 5 | B292: btn_dungeon | C292: 42 | D292: 1 | E292: 504 | F292: 10000 | G292: 5 | H292: =VLOOKUP(RC[-7],Sheet1!R2C1:R28C4,2,FALSE)&VLOOKUP(RC[-7],Sheet1!R2C1:R28C4,3,FALSE)&IF(VLOOKUP(RC[-7],Sheet1!R2C1:R28C4,4,FALSE)="品",VLOOKUP(RC[-3],Sheet1!R2C8:R6C9,2,FALSE),RC[-3])&VLOOKUP(RC[-7],Sheet1!R2C1:R28C4,4,FALSE) -> 精英副本总星级达到504星 | I292: 28 | J292: =VLOOKUP(RC[-9],Sheet1!R2C1:R28C6,6,FALSE) -> 觉醒水晶
A293: 5 | B293: btn_dungeon | C293: 43 | D293: 1 | E293: 516 | F293: 10000 | G293: 5 | H293: =VLOOKUP(RC[-7],Sheet1!R2C1:R28C4,2,FALSE)&VLOOKUP(RC[-7],Sheet1!R2C1:R28C4,3,FALSE)&IF(VLOOKUP(RC[-7],Sheet1!R2C1:R28C4,4,FALSE)="品",VLOOKUP(RC[-3],Sheet1!R2C8:R6C9,2,FALSE),RC[-3])&VLOOKUP(RC[-7],Sheet1!R2C1:R28C4,4,FALSE) -> 精英副本总星级达到516星 | I293: 28 | J293: =VLOOKUP(RC[-9],Sheet1!R2C1:R28C6,6,FALSE) -> 觉醒水晶
A294: 5 | B294: btn_dungeon | C294: 44 | D294: 1 | E294: 528 | F294: 10000 | G294: 5 | H294: =VLOOKUP(RC[-7],Sheet1!R2C1:R28C4,2,FALSE)&VLOOKUP(RC[-7],Sheet1!R2C1:R28C4,3,FALSE)&IF(VLOOKUP(RC[-7],Sheet1!R2C1:R28C4,4,FALSE)="品",VLOOKUP(RC[-3],Sheet1!R2C8:R6C9,2,FALSE),RC[-3])&VLOOKUP(RC[-7],Sheet1!R2C1:R28C4,4,FALSE) -> 精英副本总星级达到528星 | I294: 28 | J294: =VLOOKUP(RC[-9],Sheet1!R2C1:R28C6,6,FALSE) -> 觉醒水晶
A295: 5 | B295: btn_dungeon | C295: 45 | D295: 1 | E295: 540 | F295: 10000 | G295: 5 | H295: =VLOOKUP(RC[-7],Sheet1!R2C1:R28C4,2,FALSE)&VLOOKUP(RC[-7],Sheet1!R2C1:R28C4,3,FALSE)&IF(VLOOKUP(RC[-7],Sheet1!R2C1:R28C4,4,FALSE)="品",VLOOKUP(RC[-3],Sheet1!R2C8:R6C9,2,FALSE),RC[-3])&VLOOKUP(RC[-7],Sheet1!R2C1:R28C4,4,FALSE) -> 精英副本总星级达到540星 | I295: 28 | J295: =VLOOKUP(RC[-9],Sheet1!R2C1:R28C6,6,FALSE) -> 觉醒水晶
A296: 5 | B296: btn_dungeon | C296: 46 | D296: 1 | E296: 552 | F296: 10000 | G296: 5 | H296: =VLOOKUP(RC[-7],Sheet1!R2C1:R28C4,2,FALSE)&VLOOKUP(RC[-7],Sheet1!R2C1:R28C4,3,FALSE)&IF(VLOOKUP(RC[-7],Sheet1!R2C1:R28C4,4,FALSE)="品",VLOOKUP(RC[-3],Sheet1!R2C8:R6C9,2,FALSE),RC[-3])&VLOOKUP(RC[-7],Sheet1!R2C1:R28C4,4,FALSE) -> 精英副本总星级达到552星 | I296: 28 | J296: =VLOOKUP(RC[-9],Sheet1!R2C1:R28C6,6,FALSE) -> 觉醒水晶
A297: 5 | B297: btn_dungeon | C297: 47 | D297: 1 | E297: 564 | F297: 10000 | G297: 5 | H297: =VLOOKUP(RC[-7],Sheet1!R2C1:R28C4,2,FALSE)&VLOOKUP(RC[-7],Sheet1!R2C1:R28C4,3,FALSE)&IF(VLOOKUP(RC[-7],Sheet1!R2C1:R28C4,4,FALSE)="品",VLOOKUP(RC[-3],Sheet1!R2C8:R6C9,2,FALSE),RC[-3])&VLOOKUP(RC[-7],Sheet1!R2C1:R28C4,4,FALSE) -> 精英副本总星级达到564星 | I297: 28 | J297: =VLOOKUP(RC[-9],Sheet1!R2C1:R28C6,6,FALSE) -> 觉醒水晶
A298: 5 | B298: btn_dungeon | C298: 48 | D298: 1 | E298: 576 | F298: 10000 | G298: 5 | H298: =VLOOKUP(RC[-7],Sheet1!R2C1:R28C4,2,FALSE)&VLOOKUP(RC[-7],Sheet1!R2C1:R28C4,3,FALSE)&IF(VLOOKUP(RC[-7],Sheet1!R2C1:R28C4,4,FALSE)="品",VLOOKUP(RC[-3],Sheet1!R2C8:R6C9,2,FALSE),RC[-3])&VLOOKUP(RC[-7],Sheet1!R2C1:R28C4,4,FALSE) -> 精英副本总星级达到576星 | I298: 28 | J298: =VLOOKUP(RC[-9],Sheet1!R2C1:R28C6,6,FALSE) -> 觉醒水晶
A299: 5 | B299: btn_dungeon | C299: 49 | D299: 1 | E299: 588 | F299: 10000 | G299: 5 | H299: =VLOOKUP(RC[-7],Sheet1!R2C1:R28C4,2,FALSE)&VLOOKUP(RC[-7],Sheet1!R2C1:R28C4,3,FALSE)&IF(VLOOKUP(RC[-7],Sheet1!R2C1:R28C4,4,FALSE)="品",VLOOKUP(RC[-3],Sheet1!R2C8:R6C9,2,FALSE),RC[-3])&VLOOKUP(RC[-7],Sheet1!R2C1:R28C4,4,FALSE) -> 精英副本总星级达到588星 | I299: 28 | J299: =VLOOKUP(RC[-9],Sheet1!R2C1:R28C6,6,FALSE) -> 觉醒水晶
A300: 5 | B300: btn_dungeon | C300: 50 | D300: 1 | E300: 600 | F300: 10000 | G300: 5 | H300: =VLOOKUP(RC[-7],Sheet1!R2C1:R28C4,2,FALSE)&VLOOKUP(RC[-7],Sheet1!R2C1:R28C4,3,FALSE)&IF(VLOOKUP(RC[-7],Sheet1!R2C1:R28C4,4,FALSE)="品",VLOOKUP(RC[-3],Sheet1!R2C8:R6C9,2,FALSE),RC[-3])&VLOOKUP(RC[-7],Sheet1!R2C1:R28C4,4,FALSE) -> 精英副本总星级达到600星 | I300: 28 | J300: =VLOOKUP(RC[-9],Sheet1!R2C1:R28C6,6,FALSE) -> 觉醒水晶
A301: 6 | B301: btn_dungeon | C301: 1 | D301: 1 | E301: 1 | F301: 19017 | G301: 50 | H301: =VLOOKUP(RC[-7],Sheet1!R2C1:R28C4,2,FALSE)&VLOOKUP(RC[-7],Sheet1!R2C1:R28C4,3,FALSE)&IF(VLOOKUP(RC[-7],Sheet1!R2C1:R28C4,4,FALSE)="品",VLOOKUP(RC[-3],Sheet1!R2C8:R6C9,2,FALSE),RC[-3])&VLOOKUP(RC[-7],Sheet1!R2C1:R28C4,4,FALSE) -> 通关精英副本第1章 | I301: 28 | J301: =VLOOKUP(RC[-9],Sheet1!R2C1:R28C6,6,FALSE) -> 神魂
A302: 6 | B302: btn_dungeon | C302: 2 | D302: 1 | E302: 2 | F302: 19017 | G302: 50 | H302: =VLOOKUP(RC[-7],Sheet1!R2C1:R28C4,2,FALSE)&VLOOKUP(RC[-7],Sheet1!R2C1:R28C4,3,FALSE)&IF(VLOOKUP(RC[-7],Sheet1!R2C1:R28C4,4,FALSE)="品",VLOOKUP(RC[-3],Sheet1!R2C8:R6C9,2,FALSE),RC[-3])&VLOOKUP(RC[-7],Sheet1!R2C1:R28C4,4,FALSE) -> 通关精英副本第2章 | I302: 28 | J302: =VLOOKUP(RC[-9],Sheet1!R2C1:R28C6,6,FALSE) -> 神魂
A303: 6 | B303: btn_dungeon | C303: 3 | D303: 1 | E303: 3 | F303: 19017 | G303: 50 | H303: =VLOOKUP(RC[-7],Sheet1!R2C1:R28C4,2,FALSE)&VLOOKUP(RC[-7],Sheet1!R2C1:R28C4,3,FALSE)&IF(VLOOKUP(RC[-7],Sheet1!R2C1:R28C4,4,FALSE)="品",VLOOKUP(RC[-3],Sheet1!R2C8:R6C9,2,FALSE),RC[-3])&VLOOKUP(RC[-7],Sheet1!R2C1:R28C4,4,FALSE) -> 通关精英副本第3章 | I303: 28 | J303: =VLOOKUP(RC[-9],Sheet1!R2C1:R28C6,6,FALSE) -> 神魂
A304: 6 | B304: btn_dungeon | C304: 4 | D304: 1 | E304: 4 | F304: 19017 | G304: 50 | H304: =VLOOKUP(RC[-7],Sheet1!R2C1:R28C4,2,FALSE)&VLOOKUP(RC[-7],Sheet1!R2C1:R28C4,3,FALSE)&IF(VLOOKUP(RC[-7],Sheet1!R2C1:R28C4,4,FALSE)="品",VLOOKUP(RC[-3],Sheet1!R2C8:R6C9,2,FALSE),RC[-3])&VLOOKUP(RC[-7],Sheet1!R2C1:R28C4,4,FALSE) -> 通关精英副本第4章 | I304: 28 | J304: =VLOOKUP(RC[-9],Sheet1!R2C1:R28C6,6,FALSE) -> 神魂
A305: 6 | B305: btn_dungeon | C305: 5 | D305: 1 | E305: 5 | F305: 19017 | G305: 50 | H305: =VLOOKUP(RC[-7],Sheet1!R2C1:R28C4,2,FALSE)&VLOOKUP(RC[-7],Sheet1!R2C1:R28C4,3,FALSE)&IF(VLOOKUP(RC[-7],Sheet1!R2C1:R28C4,4,FALSE)="品",VLOOKUP(RC[-3],Sheet1!R2C8:R6C9,2,FALSE),RC[-3])&VLOOKUP(RC[-7],Sheet1!R2C1:R28C4,4,FALSE) -> 通关精英副本第5章 | I305: 28 | J305: =VLOOKUP(RC[-9],Sheet1!R2C1:R28C6,6,FALSE) -> 神魂
A306: 6 | B306: btn_dungeon | C306: 6 | D306: 1 | E306: 6 | F306: 19017 | G306: 100 | H306: =VLOOKUP(RC[-7],Sheet1!R2C1:R28C4,2,FALSE)&VLOOKUP(RC[-7],Sheet1!R2C1:R28C4,3,FALSE)&IF(VLOOKUP(RC[-7],Sheet1!R2C1:R28C4,4,FALSE)="品",VLOOKUP(RC[-3],Sheet1!R2C8:R6C9,2,FALSE),RC[-3])&VLOOKUP(RC[-7],Sheet1!R2C1:R28C4,4,FALSE) -> 通关精英副本第6章 | I306: 28 | J306: =VLOOKUP(RC[-9],Sheet1!R2C1:R28C6,6,FALSE) -> 神魂
A307: 6 | B307: btn_dungeon | C307: 7 | D307: 1 | E307: 7 | F307: 19017 | G307: 100 | H307: =VLOOKUP(RC[-7],Sheet1!R2C1:R28C4,2,FALSE)&VLOOKUP(RC[-7],Sheet1!R2C1:R28C4,3,FALSE)&IF(VLOOKUP(RC[-7],Sheet1!R2C1:R28C4,4,FALSE)="品",VLOOKUP(RC[-3],Sheet1!R2C8:R6C9,2,FALSE),RC[-3])&VLOOKUP(RC[-7],Sheet1!R2C1:R28C4,4,FALSE) -> 通关精英副本第7章 | I307: 28 | J307: =VLOOKUP(RC[-9],Sheet1!R2C1:R28C6,6,FALSE) -> 神魂
A308: 6 | B308: btn_dungeon | C308: 8 | D308: 1 | E308: 8 | F308: 19017 | G308: 100 | H308: =VLOOKUP(RC[-7],Sheet1!R2C1:R28C4,2,FALSE)&VLOOKUP(RC[-7],Sheet1!R2C1:R28C4,3,FALSE)&IF(VLOOKUP(RC[-7],Sheet1!R2C1:R28C4,4,FALSE)="品",VLOOKUP(RC[-3],Sheet1!R2C8:R6C9,2,FALSE),RC[-3])&VLOOKUP(RC[-7],Sheet1!R2C1:R28C4,4,FALSE) -> 通关精英副本第8章 | I308: 28 | J308: =VLOOKUP(RC[-9],Sheet1!R2C1:R28C6,6,FALSE) -> 神魂
A309: 6 | B309: btn_dungeon | C309: 9 | D309: 1 | E309: 9 | F309: 19017 | G309: 100 | H309: =VLOOKUP(RC[-7],Sheet1!R2C1:R28C4,2,FALSE)&VLOOKUP(RC[-7],Sheet1!R2C1:R28C4,3,FALSE)&IF(VLOOKUP(RC[-7],Sheet1!R2C1:R28C4,4,FALSE)="品",VLOOKUP(RC[-3],Sheet1!R2C8:R6C9,2,FALSE),RC[-3])&VLOOKUP(RC[-7],Sheet1!R2C1:R28C4,4,FALSE) -> 通关精英副本第9章 | I309: 28 | J309: =VLOOKUP(RC[-9],Sheet1!R2C1:R28C6,6,FALSE) -> 神魂
A310: 6 | B310: btn_dungeon | C310: 10 | D310: 1 | E310: 10 | F310: 19017 | G310: 100 | H310: =VLOOKUP(RC[-7],Sheet1!R2C1:R28C4,2,FALSE)&VLOOKUP(RC[-7],Sheet1!R2C1:R28C4,3,FALSE)&IF(VLOOKUP(RC[-7],Sheet1!R2C1:R28C4,4,FALSE)="品",VLOOKUP(RC[-3],Sheet1!R2C8:R6C9,2,FALSE),RC[-3])&VLOOKUP(RC[-7],Sheet1!R2C1:R28C4,4,FALSE) -> 通关精英副本第10章 | I310: 28 | J310: =VLOOKUP(RC[-9],Sheet1!R2C1:R28C6,6,FALSE) -> 神魂
A311: 6 | B311: btn_dungeon | C311: 11 | D311: 1 | E311: 11 | F311: 19017 | G311: 150 | H311: =VLOOKUP(RC[-7],Sheet1!R2C1:R28C4,2,FALSE)&VLOOKUP(RC[-7],Sheet1!R2C1:R28C4,3,FALSE)&IF(VLOOKUP(RC[-7],Sheet1!R2C1:R28C4,4,FALSE)="品",VLOOKUP(RC[-3],Sheet1!R2C8:R6C9,2,FALSE),RC[-3])&VLOOKUP(RC[-7],Sheet1!R2C1:R28C4,4,FALSE) -> 通关精英副本第11章 | I311: 28 | J311: =VLOOKUP(RC[-9],Sheet1!R2C1:R28C6,6,FALSE) -> 神魂
A312: 6 | B312: btn_dungeon | C312: 12 | D312: 1 | E312: 12 | F312: 19017 | G312: 150 | H312: =VLOOKUP(RC[-7],Sheet1!R2C1:R28C4,2,FALSE)&VLOOKUP(RC[-7],Sheet1!R2C1:R28C4,3,FALSE)&IF(VLOOKUP(RC[-7],Sheet1!R2C1:R28C4,4,FALSE)="品",VLOOKUP(RC[-3],Sheet1!R2C8:R6C9,2,FALSE),RC[-3])&VLOOKUP(RC[-7],Sheet1!R2C1:R28C4,4,FALSE) -> 通关精英副本第12章 | I312: 28 | J312: =VLOOKUP(RC[-9],Sheet1!R2C1:R28C6,6,FALSE) -> 神魂
A313: 6 | B313: btn_dungeon | C313: 13 | D313: 1 | E313: 13 | F313: 19017 | G313: 150 | H313: =VLOOKUP(RC[-7],Sheet1!R2C1:R28C4,2,FALSE)&VLOOKUP(RC[-7],Sheet1!R2C1:R28C4,3,FALSE)&IF(VLOOKUP(RC[-7],Sheet1!R2C1:R28C4,4,FALSE)="品",VLOOKUP(RC[-3],Sheet1!R2C8:R6C9,2,FALSE),RC[-3])&VLOOKUP(RC[-7],Sheet1!R2C1:R28C4,4,FALSE) -> 通关精英副本第13章 | I313: 28 | J313: =VLOOKUP(RC[-9],Sheet1!R2C1:R28C6,6,FALSE) -> 神魂
A314: 6 | B314: btn_dungeon | C314: 14 | D314: 1 | E314: 14 | F314: 19017 | G314: 150 | H314: =VLOOKUP(RC[-7],Sheet1!R2C1:R28C4,2,FALSE)&VLOOKUP(RC[-7],Sheet1!R2C1:R28C4,3,FALSE)&IF(VLOOKUP(RC[-7],Sheet1!R2C1:R28C4,4,FALSE)="品",VLOOKUP(RC[-3],Sheet1!R2C8:R6C9,2,FALSE),RC[-3])&VLOOKUP(RC[-7],Sheet1!R2C1:R28C4,4,FALSE) -> 通关精英副本第14章 | I314: 28 | J314: =VLOOKUP(RC[-9],Sheet1!R2C1:R28C6,6,FALSE) -> 神魂
A315: 6 | B315: btn_dungeon | C315: 15 | D315: 1 | E315: 15 | F315: 19017 | G315: 150 | H315: =VLOOKUP(RC[-7],Sheet1!R2C1:R28C4,2,FALSE)&VLOOKUP(RC[-7],Sheet1!R2C1:R28C4,3,FALSE)&IF(VLOOKUP(RC[-7],Sheet1!R2C1:R28C4,4,FALSE)="品",VLOOKUP(RC[-3],Sheet1!R2C8:R6C9,2,FALSE),RC[-3])&VLOOKUP(RC[-7],Sheet1!R2C1:R28C4,4,FALSE) -> 通关精英副本第15章 | I315: 28 | J315: =VLOOKUP(RC[-9],Sheet1!R2C1:R28C6,6,FALSE) -> 神魂
A316: 6 | B316: btn_dungeon | C316: 16 | D316: 1 | E316: 16 | F316: 19017 | G316: 200 | H316: =VLOOKUP(RC[-7],Sheet1!R2C1:R28C4,2,FALSE)&VLOOKUP(RC[-7],Sheet1!R2C1:R28C4,3,FALSE)&IF(VLOOKUP(RC[-7],Sheet1!R2C1:R28C4,4,FALSE)="品",VLOOKUP(RC[-3],Sheet1!R2C8:R6C9,2,FALSE),RC[-3])&VLOOKUP(RC[-7],Sheet1!R2C1:R28C4,4,FALSE) -> 通关精英副本第16章 | I316: 28 | J316: =VLOOKUP(RC[-9],Sheet1!R2C1:R28C6,6,FALSE) -> 神魂
A317: 6 | B317: btn_dungeon | C317: 17 | D317: 1 | E317: 17 | F317: 19017 | G317: 200 | H317: =VLOOKUP(RC[-7],Sheet1!R2C1:R28C4,2,FALSE)&VLOOKUP(RC[-7],Sheet1!R2C1:R28C4,3,FALSE)&IF(VLOOKUP(RC[-7],Sheet1!R2C1:R28C4,4,FALSE)="品",VLOOKUP(RC[-3],Sheet1!R2C8:R6C9,2,FALSE),RC[-3])&VLOOKUP(RC[-7],Sheet1!R2C1:R28C4,4,FALSE) -> 通关精英副本第17章 | I317: 28 | J317: =VLOOKUP(RC[-9],Sheet1!R2C1:R28C6,6,FALSE) -> 神魂
A318: 6 | B318: btn_dungeon | C318: 18 | D318: 1 | E318: 18 | F318: 19017 | G318: 200 | H318: =VLOOKUP(RC[-7],Sheet1!R2C1:R28C4,2,FALSE)&VLOOKUP(RC[-7],Sheet1!R2C1:R28C4,3,FALSE)&IF(VLOOKUP(RC[-7],Sheet1!R2C1:R28C4,4,FALSE)="品",VLOOKUP(RC[-3],Sheet1!R2C8:R6C9,2,FALSE),RC[-3])&VLOOKUP(RC[-7],Sheet1!R2C1:R28C4,4,FALSE) -> 通关精英副本第18章 | I318: 28 | J318: =VLOOKUP(RC[-9],Sheet1!R2C1:R28C6,6,FALSE) -> 神魂
A319: 6 | B319: btn_dungeon | C319: 19 | D319: 1 | E319: 19 | F319: 19017 | G319: 200 | H319: =VLOOKUP(RC[-7],Sheet1!R2C1:R28C4,2,FALSE)&VLOOKUP(RC[-7],Sheet1!R2C1:R28C4,3,FALSE)&IF(VLOOKUP(RC[-7],Sheet1!R2C1:R28C4,4,FALSE)="品",VLOOKUP(RC[-3],Sheet1!R2C8:R6C9,2,FALSE),RC[-3])&VLOOKUP(RC[-7],Sheet1!R2C1:R28C4,4,FALSE) -> 通关精英副本第19章 | I319: 28 | J319: =VLOOKUP(RC[-9],Sheet1!R2C1:R28C6,6,FALSE) -> 神魂
A320: 6 | B320: btn_dungeon | C320: 20 | D320: 1 | E320: 20 | F320: 19017 | G320: 200 | H320: =VLOOKUP(RC[-7],Sheet1!R2C1:R28C4,2,FALSE)&VLOOKUP(RC[-7],Sheet1!R2C1:R28C4,3,FALSE)&IF(VLOOKUP(RC[-7],Sheet1!R2C1:R28C4,4,FALSE)="品",VLOOKUP(RC[-3],Sheet1!R2C8:R6C9,2,FALSE),RC[-3])&VLOOKUP(RC[-7],Sheet1!R2C1:R28C4,4,FALSE) -> 通关精英副本第20章 | I320: 28 | J320: =VLOOKUP(RC[-9],Sheet1!R2C1:R28C6,6,FALSE) -> 神魂
A321: 6 | B321: btn_dungeon | C321: 21 | D321: 1 | E321: 21 | F321: 19017 | G321: 250 | H321: =VLOOKUP(RC[-7],Sheet1!R2C1:R28C4,2,FALSE)&VLOOKUP(RC[-7],Sheet1!R2C1:R28C4,3,FALSE)&IF(VLOOKUP(RC[-7],Sheet1!R2C1:R28C4,4,FALSE)="品",VLOOKUP(RC[-3],Sheet1!R2C8:R6C9,2,FALSE),RC[-3])&VLOOKUP(RC[-7],Sheet1!R2C1:R28C4,4,FALSE) -> 通关精英副本第21章 | I321: 28 | J321: =VLOOKUP(RC[-9],Sheet1!R2C1:R28C6,6,FALSE) -> 神魂
A322: 6 | B322: btn_dungeon | C322: 22 | D322: 1 | E322: 22 | F322: 19017 | G322: 250 | H322: =VLOOKUP(RC[-7],Sheet1!R2C1:R28C4,2,FALSE)&VLOOKUP(RC[-7],Sheet1!R2C1:R28C4,3,FALSE)&IF(VLOOKUP(RC[-7],Sheet1!R2C1:R28C4,4,FALSE)="品",VLOOKUP(RC[-3],Sheet1!R2C8:R6C9,2,FALSE),RC[-3])&VLOOKUP(RC[-7],Sheet1!R2C1:R28C4,4,FALSE) -> 通关精英副本第22章 | I322: 28 | J322: =VLOOKUP(RC[-9],Sheet1!R2C1:R28C6,6,FALSE) -> 神魂
A323: 6 | B323: btn_dungeon | C323: 23 | D323: 1 | E323: 23 | F323: 19017 | G323: 250 | H323: =VLOOKUP(RC[-7],Sheet1!R2C1:R28C4,2,FALSE)&VLOOKUP(RC[-7],Sheet1!R2C1:R28C4,3,FALSE)&IF(VLOOKUP(RC[-7],Sheet1!R2C1:R28C4,4,FALSE)="品",VLOOKUP(RC[-3],Sheet1!R2C8:R6C9,2,FALSE),RC[-3])&VLOOKUP(RC[-7],Sheet1!R2C1:R28C4,4,FALSE) -> 通关精英副本第23章 | I323: 28 | J323: =VLOOKUP(RC[-9],Sheet1!R2C1:R28C6,6,FALSE) -> 神魂
A324: 6 | B324: btn_dungeon | C324: 24 | D324: 1 | E324: 24 | F324: 19017 | G324: 250 | H324: =VLOOKUP(RC[-7],Sheet1!R2C1:R28C4,2,FALSE)&VLOOKUP(RC[-7],Sheet1!R2C1:R28C4,3,FALSE)&IF(VLOOKUP(RC[-7],Sheet1!R2C1:R28C4,4,FALSE)="品",VLOOKUP(RC[-3],Sheet1!R2C8:R6C9,2,FALSE),RC[-3])&VLOOKUP(RC[-7],Sheet1!R2C1:R28C4,4,FALSE) -> 通关精英副本第24章 | I324: 28 | J324: =VLOOKUP(RC[-9],Sheet1!R2C1:R28C6,6,FALSE) -> 神魂
A325: 6 | B325: btn_dungeon | C325: 25 | D325: 1 | E325: 25 | F325: 19017 | G325: 250 | H325: =VLOOKUP(RC[-7],Sheet1!R2C1:R28C4,2,FALSE)&VLOOKUP(RC[-7],Sheet1!R2C1:R28C4,3,FALSE)&IF(VLOOKUP(RC[-7],Sheet1!R2C1:R28C4,4,FALSE)="品",VLOOKUP(RC[-3],Sheet1!R2C8:R6C9,2,FALSE),RC[-3])&VLOOKUP(RC[-7],Sheet1!R2C1:R28C4,4,FALSE) -> 通关精英副本第25章 | I325: 28 | J325: =VLOOKUP(RC[-9],Sheet1!R2C1:R28C6,6,FALSE) -> 神魂
A326: 6 | B326: btn_dungeon | C326: 26 | D326: 1 | E326: 26 | F326: 19017 | G326: 300 | H326: =VLOOKUP(RC[-7],Sheet1!R2C1:R28C4,2,FALSE)&VLOOKUP(RC[-7],Sheet1!R2C1:R28C4,3,FALSE)&IF(VLOOKUP(RC[-7],Sheet1!R2C1:R28C4,4,FALSE)="品",VLOOKUP(RC[-3],Sheet1!R2C8:R6C9,2,FALSE),RC[-3])&VLOOKUP(RC[-7],Sheet1!R2C1:R28C4,4,FALSE) -> 通关精英副本第26章 | I326: 28 | J326: =VLOOKUP(RC[-9],Sheet1!R2C1:R28C6,6,FALSE) -> 神魂
A327: 6 | B327: btn_dungeon | C327: 27 | D327: 1 | E327: 27 | F327: 19017 | G327: 300 | H327: =VLOOKUP(RC[-7],Sheet1!R2C1:R28C4,2,FALSE)&VLOOKUP(RC[-7],Sheet1!R2C1:R28C4,3,FALSE)&IF(VLOOKUP(RC[-7],Sheet1!R2C1:R28C4,4,FALSE)="品",VLOOKUP(RC[-3],Sheet1!R2C8:R6C9,2,FALSE),RC[-3])&VLOOKUP(RC[-7],Sheet1!R2C1:R28C4,4,FALSE) -> 通关精英副本第27章 | I327: 28 | J327: =VLOOKUP(RC[-9],Sheet1!R2C1:R28C6,6,FALSE) -> 神魂
A328: 6 | B328: btn_dungeon | C328: 28 | D328: 1 | E328: 28 | F328: 19017 | G328: 300 | H328: =VLOOKUP(RC[-7],Sheet1!R2C1:R28C4,2,FALSE)&VLOOKUP(RC[-7],Sheet1!R2C1:R28C4,3,FALSE)&IF(VLOOKUP(RC[-7],Sheet1!R2C1:R28C4,4,FALSE)="品",VLOOKUP(RC[-3],Sheet1!R2C8:R6C9,2,FALSE),RC[-3])&VLOOKUP(RC[-7],Sheet1!R2C1:R28C4,4,FALSE) -> 通关精英副本第28章 | I328: 28 | J328: =VLOOKUP(RC[-9],Sheet1!R2C1:R28C6,6,FALSE) -> 神魂
A329: 6 | B329: btn_dungeon | C329: 29 | D329: 1 | E329: 29 | F329: 19017 | G329: 300 | H329: =VLOOKUP(RC[-7],Sheet1!R2C1:R28C4,2,FALSE)&VLOOKUP(RC[-7],Sheet1!R2C1:R28C4,3,FALSE)&IF(VLOOKUP(RC[-7],Sheet1!R2C1:R28C4,4,FALSE)="品",VLOOKUP(RC[-3],Sheet1!R2C8:R6C9,2,FALSE),RC[-3])&VLOOKUP(RC[-7],Sheet1!R2C1:R28C4,4,FALSE) -> 通关精英副本第29章 | I329: 28 | J329: =VLOOKUP(RC[-9],Sheet1!R2C1:R28C6,6,FALSE) -> 神魂
A330: 6 | B330: btn_dungeon | C330: 30 | D330: 1 | E330: 30 | F330: 19017 | G330: 300 | H330: =VLOOKUP(RC[-7],Sheet1!R2C1:R28C4,2,FALSE)&VLOOKUP(RC[-7],Sheet1!R2C1:R28C4,3,FALSE)&IF(VLOOKUP(RC[-7],Sheet1!R2C1:R28C4,4,FALSE)="品",VLOOKUP(RC[-3],Sheet1!R2C8:R6C9,2,FALSE),RC[-3])&VLOOKUP(RC[-7],Sheet1!R2C1:R28C4,4,FALSE) -> 通关精英副本第30章 | I330: 28 | J330: =VLOOKUP(RC[-9],Sheet1!R2C1:R28C6,6,FALSE) -> 神魂
A331: 6 | B331: btn_dungeon | C331: 31 | D331: 1 | E331: 31 | F331: 19017 | G331: 350 | H331: =VLOOKUP(RC[-7],Sheet1!R2C1:R28C4,2,FALSE)&VLOOKUP(RC[-7],Sheet1!R2C1:R28C4,3,FALSE)&IF(VLOOKUP(RC[-7],Sheet1!R2C1:R28C4,4,FALSE)="品",VLOOKUP(RC[-3],Sheet1!R2C8:R6C9,2,FALSE),RC[-3])&VLOOKUP(RC[-7],Sheet1!R2C1:R28C4,4,FALSE) -> 通关精英副本第31章 | I331: 28 | J331: =VLOOKUP(RC[-9],Sheet1!R2C1:R28C6,6,FALSE) -> 神魂
A332: 6 | B332: btn_dungeon | C332: 32 | D332: 1 | E332: 32 | F332: 19017 | G332: 350 | H332: =VLOOKUP(RC[-7],Sheet1!R2C1:R28C4,2,FALSE)&VLOOKUP(RC[-7],Sheet1!R2C1:R28C4,3,FALSE)&IF(VLOOKUP(RC[-7],Sheet1!R2C1:R28C4,4,FALSE)="品",VLOOKUP(RC[-3],Sheet1!R2C8:R6C9,2,FALSE),RC[-3])&VLOOKUP(RC[-7],Sheet1!R2C1:R28C4,4,FALSE) -> 通关精英副本第32章 | I332: 28 | J332: =VLOOKUP(RC[-9],Sheet1!R2C1:R28C6,6,FALSE) -> 神魂
A333: 6 | B333: btn_dungeon | C333: 33 | D333: 1 | E333: 33 | F333: 19017 | G333: 350 | H333: =VLOOKUP(RC[-7],Sheet1!R2C1:R28C4,2,FALSE)&VLOOKUP(RC[-7],Sheet1!R2C1:R28C4,3,FALSE)&IF(VLOOKUP(RC[-7],Sheet1!R2C1:R28C4,4,FALSE)="品",VLOOKUP(RC[-3],Sheet1!R2C8:R6C9,2,FALSE),RC[-3])&VLOOKUP(RC[-7],Sheet1!R2C1:R28C4,4,FALSE) -> 通关精英副本第33章 | I333: 28 | J333: =VLOOKUP(RC[-9],Sheet1!R2C1:R28C6,6,FALSE) -> 神魂
A334: 6 | B334: btn_dungeon | C334: 34 | D334: 1 | E334: 34 | F334: 19017 | G334: 350 | H334: =VLOOKUP(RC[-7],Sheet1!R2C1:R28C4,2,FALSE)&VLOOKUP(RC[-7],Sheet1!R2C1:R28C4,3,FALSE)&IF(VLOOKUP(RC[-7],Sheet1!R2C1:R28C4,4,FALSE)="品",VLOOKUP(RC[-3],Sheet1!R2C8:R6C9,2,FALSE),RC[-3])&VLOOKUP(RC[-7],Sheet1!R2C1:R28C4,4,FALSE) -> 通关精英副本第34章 | I334: 28 | J334: =VLOOKUP(RC[-9],Sheet1!R2C1:R28C6,6,FALSE) -> 神魂
A335: 6 | B335: btn_dungeon | C335: 35 | D335: 1 | E335: 35 | F335: 19017 | G335: 350 | H335: =VLOOKUP(RC[-7],Sheet1!R2C1:R28C4,2,FALSE)&VLOOKUP(RC[-7],Sheet1!R2C1:R28C4,3,FALSE)&IF(VLOOKUP(RC[-7],Sheet1!R2C1:R28C4,4,FALSE)="品",VLOOKUP(RC[-3],Sheet1!R2C8:R6C9,2,FALSE),RC[-3])&VLOOKUP(RC[-7],Sheet1!R2C1:R28C4,4,FALSE) -> 通关精英副本第35章 | I335: 28 | J335: =VLOOKUP(RC[-9],Sheet1!R2C1:R28C6,6,FALSE) -> 神魂
A336: 6 | B336: btn_dungeon | C336: 36 | D336: 1 | E336: 36 | F336: 19017 | G336: 400 | H336: =VLOOKUP(RC[-7],Sheet1!R2C1:R28C4,2,FALSE)&VLOOKUP(RC[-7],Sheet1!R2C1:R28C4,3,FALSE)&IF(VLOOKUP(RC[-7],Sheet1!R2C1:R28C4,4,FALSE)="品",VLOOKUP(RC[-3],Sheet1!R2C8:R6C9,2,FALSE),RC[-3])&VLOOKUP(RC[-7],Sheet1!R2C1:R28C4,4,FALSE) -> 通关精英副本第36章 | I336: 28 | J336: =VLOOKUP(RC[-9],Sheet1!R2C1:R28C6,6,FALSE) -> 神魂
A337: 6 | B337: btn_dungeon | C337: 37 | D337: 1 | E337: 37 | F337: 19017 | G337: 400 | H337: =VLOOKUP(RC[-7],Sheet1!R2C1:R28C4,2,FALSE)&VLOOKUP(RC[-7],Sheet1!R2C1:R28C4,3,FALSE)&IF(VLOOKUP(RC[-7],Sheet1!R2C1:R28C4,4,FALSE)="品",VLOOKUP(RC[-3],Sheet1!R2C8:R6C9,2,FALSE),RC[-3])&VLOOKUP(RC[-7],Sheet1!R2C1:R28C4,4,FALSE) -> 通关精英副本第37章 | I337: 28 | J337: =VLOOKUP(RC[-9],Sheet1!R2C1:R28C6,6,FALSE) -> 神魂
A338: 6 | B338: btn_dungeon | C338: 38 | D338: 1 | E338: 38 | F338: 19017 | G338: 400 | H338: =VLOOKUP(RC[-7],Sheet1!R2C1:R28C4,2,FALSE)&VLOOKUP(RC[-7],Sheet1!R2C1:R28C4,3,FALSE)&IF(VLOOKUP(RC[-7],Sheet1!R2C1:R28C4,4,FALSE)="品",VLOOKUP(RC[-3],Sheet1!R2C8:R6C9,2,FALSE),RC[-3])&VLOOKUP(RC[-7],Sheet1!R2C1:R28C4,4,FALSE) -> 通关精英副本第38章 | I338: 28 | J338: =VLOOKUP(RC[-9],Sheet1!R2C1:R28C6,6,FALSE) -> 神魂
A339: 6 | B339: btn_dungeon | C339: 39 | D339: 1 | E339: 39 | F339: 19017 | G339: 400 | H339: =VLOOKUP(RC[-7],Sheet1!R2C1:R28C4,2,FALSE)&VLOOKUP(RC[-7],Sheet1!R2C1:R28C4,3,FALSE)&IF(VLOOKUP(RC[-7],Sheet1!R2C1:R28C4,4,FALSE)="品",VLOOKUP(RC[-3],Sheet1!R2C8:R6C9,2,FALSE),RC[-3])&VLOOKUP(RC[-7],Sheet1!R2C1:R28C4,4,FALSE) -> 通关精英副本第39章 | I339: 28 | J339: =VLOOKUP(RC[-9],Sheet1!R2C1:R28C6,6,FALSE) -> 神魂
A340: 6 | B340: btn_dungeon | C340: 40 | D340: 1 | E340: 40 | F340: 19017 | G340: 400 | H340: =VLOOKUP(RC[-7],Sheet1!R2C1:R28C4,2,FALSE)&VLOOKUP(RC[-7],Sheet1!R2C1:R28C4,3,FALSE)&IF(VLOOKUP(RC[-7],Sheet1!R2C1:R28C4,4,FALSE)="品",VLOOKUP(RC[-3],Sheet1!R2C8:R6C9,2,FALSE),RC[-3])&VLOOKUP(RC[-7],Sheet1!R2C1:R28C4,4,FALSE) -> 通关精英副本第40章 | I340: 28 | J340: =VLOOKUP(RC[-9],Sheet1!R2C1:R28C6,6,FALSE) -> 神魂
A341: 6 | B341: btn_dungeon | C341: 41 | D341: 1 | E341: 41 | F341: 19017 | G341: 450 | H341: =VLOOKUP(RC[-7],Sheet1!R2C1:R28C4,2,FALSE)&VLOOKUP(RC[-7],Sheet1!R2C1:R28C4,3,FALSE)&IF(VLOOKUP(RC[-7],Sheet1!R2C1:R28C4,4,FALSE)="品",VLOOKUP(RC[-3],Sheet1!R2C8:R6C9,2,FALSE),RC[-3])&VLOOKUP(RC[-7],Sheet1!R2C1:R28C4,4,FALSE) -> 通关精英副本第41章 | I341: 28 | J341: =VLOOKUP(RC[-9],Sheet1!R2C1:R28C6,6,FALSE) -> 神魂
A342: 6 | B342: btn_dungeon | C342: 42 | D342: 1 | E342: 42 | F342: 19017 | G342: 450 | H342: =VLOOKUP(RC[-7],Sheet1!R2C1:R28C4,2,FALSE)&VLOOKUP(RC[-7],Sheet1!R2C1:R28C4,3,FALSE)&IF(VLOOKUP(RC[-7],Sheet1!R2C1:R28C4,4,FALSE)="品",VLOOKUP(RC[-3],Sheet1!R2C8:R6C9,2,FALSE),RC[-3])&VLOOKUP(RC[-7],Sheet1!R2C1:R28C4,4,FALSE) -> 通关精英副本第42章 | I342: 28 | J342: =VLOOKUP(RC[-9],Sheet1!R2C1:R28C6,6,FALSE) -> 神魂
A343: 6 | B343: btn_dungeon | C343: 43 | D343: 1 | E343: 43 | F343: 19017 | G343: 450 | H343: =VLOOKUP(RC[-7],Sheet1!R2C1:R28C4,2,FALSE)&VLOOKUP(RC[-7],Sheet1!R2C1:R28C4,3,FALSE)&IF(VLOOKUP(RC[-7],Sheet1!R2C1:R28C4,4,FALSE)="品",VLOOKUP(RC[-3],Sheet1!R2C8:R6C9,2,FALSE),RC[-3])&VLOOKUP(RC[-7],Sheet1!R2C1:R28C4,4,FALSE) -> 通关精英副本第43章 | I343: 28 | J343: =VLOOKUP(RC[-9],Sheet1!R2C1:R28C6,6,FALSE) -> 神魂
A344: 6 | B344: btn_dungeon | C344: 44 | D344: 1 | E344: 44 | F344: 19017 | G344: 450 | H344: =VLOOKUP(RC[-7],Sheet1!R2C1:R28C4,2,FALSE)&VLOOKUP(RC[-7],Sheet1!R2C1:R28C4,3,FALSE)&IF(VLOOKUP(RC[-7],Sheet1!R2C1:R28C4,4,FALSE)="品",VLOOKUP(RC[-3],Sheet1!R2C8:R6C9,2,FALSE),RC[-3])&VLOOKUP(RC[-7],Sheet1!R2C1:R28C4,4,FALSE) -> 通关精英副本第44章 | I344: 28 | J344: =VLOOKUP(RC[-9],Sheet1!R2C1:R28C6,6,FALSE) -> 神魂
A345: 6 | B345: btn_dungeon | C345: 45 | D345: 1 | E345: 45 | F345: 19017 | G345: 450 | H345: =VLOOKUP(RC[-7],Sheet1!R2C1:R28C4,2,FALSE)&VLOOKUP(RC[-7],Sheet1!R2C1:R28C4,3,FALSE)&IF(VLOOKUP(RC[-7],Sheet1!R2C1:R28C4,4,FALSE)="品",VLOOKUP(RC[-3],Sheet1!R2C8:R6C9,2,FALSE),RC[-3])&VLOOKUP(RC[-7],Sheet1!R2C1:R28C4,4,FALSE) -> 通关精英副本第45章 | I345: 28 | J345: =VLOOKUP(RC[-9],Sheet1!R2C1:R28C6,6,FALSE) -> 神魂
A346: 6 | B346: btn_dungeon | C346: 46 | D346: 1 | E346: 46 | F346: 19017 | G346: 500 | H346: =VLOOKUP(RC[-7],Sheet1!R2C1:R28C4,2,FALSE)&VLOOKUP(RC[-7],Sheet1!R2C1:R28C4,3,FALSE)&IF(VLOOKUP(RC[-7],Sheet1!R2C1:R28C4,4,FALSE)="品",VLOOKUP(RC[-3],Sheet1!R2C8:R6C9,2,FALSE),RC[-3])&VLOOKUP(RC[-7],Sheet1!R2C1:R28C4,4,FALSE) -> 通关精英副本第46章 | I346: 28 | J346: =VLOOKUP(RC[-9],Sheet1!R2C1:R28C6,6,FALSE) -> 神魂
A347: 6 | B347: btn_dungeon | C347: 47 | D347: 1 | E347: 47 | F347: 19017 | G347: 500 | H347: =VLOOKUP(RC[-7],Sheet1!R2C1:R28C4,2,FALSE)&VLOOKUP(RC[-7],Sheet1!R2C1:R28C4,3,FALSE)&IF(VLOOKUP(RC[-7],Sheet1!R2C1:R28C4,4,FALSE)="品",VLOOKUP(RC[-3],Sheet1!R2C8:R6C9,2,FALSE),RC[-3])&VLOOKUP(RC[-7],Sheet1!R2C1:R28C4,4,FALSE) -> 通关精英副本第47章 | I347: 28 | J347: =VLOOKUP(RC[-9],Sheet1!R2C1:R28C6,6,FALSE) -> 神魂
A348: 6 | B348: btn_dungeon | C348: 48 | D348: 1 | E348: 48 | F348: 19017 | G348: 500 | H348: =VLOOKUP(RC[-7],Sheet1!R2C1:R28C4,2,FALSE)&VLOOKUP(RC[-7],Sheet1!R2C1:R28C4,3,FALSE)&IF(VLOOKUP(RC[-7],Sheet1!R2C1:R28C4,4,FALSE)="品",VLOOKUP(RC[-3],Sheet1!R2C8:R6C9,2,FALSE),RC[-3])&VLOOKUP(RC[-7],Sheet1!R2C1:R28C4,4,FALSE) -> 通关精英副本第48章 | I348: 28 | J348: =VLOOKUP(RC[-9],Sheet1!R2C1:R28C6,6,FALSE) -> 神魂
A349: 6 | B349: btn_dungeon | C349: 49 | D349: 1 | E349: 49 | F349: 19017 | G349: 500 | H349: =VLOOKUP(RC[-7],Sheet1!R2C1:R28C4,2,FALSE)&VLOOKUP(RC[-7],Sheet1!R2C1:R28C4,3,FALSE)&IF(VLOOKUP(RC[-7],Sheet1!R2C1:R28C4,4,FALSE)="品",VLOOKUP(RC[-3],Sheet1!R2C8:R6C9,2,FALSE),RC[-3])&VLOOKUP(RC[-7],Sheet1!R2C1:R28C4,4,FALSE) -> 通关精英副本第49章 | I349: 28 | J349: =VLOOKUP(RC[-9],Sheet1!R2C1:R28C6,6,FALSE) -> 神魂
A350: 6 | B350: btn_dungeon | C350: 50 | D350: 1 | E350: 50 | F350: 19017 | G350: 500 | H350: =VLOOKUP(RC[-7],Sheet1!R2C1:R28C4,2,FALSE)&VLOOKUP(RC[-7],Sheet1!R2C1:R28C4,3,FALSE)&IF(VLOOKUP(RC[-7],Sheet1!R2C1:R28C4,4,FALSE)="品",VLOOKUP(RC[-3],Sheet1!R2C8:R6C9,2,FALSE),RC[-3])&VLOOKUP(RC[-7],Sheet1!R2C1:R28C4,4,FALSE) -> 通关精英副本第50章 | I350: 28 | J350: =VLOOKUP(RC[-9],Sheet1!R2C1:R28C6,6,FALSE) -> 神魂
A351: 7 | B351: btn_battle | C351: 1 | D351: 1 | E351: 9 | F351: 19012 | G351: 100 | H351: =VLOOKUP(RC[-7],Sheet1!R2C1:R28C4,2,FALSE)&VLOOKUP(RC[-7],Sheet1!R2C1:R28C4,3,FALSE)&IF(VLOOKUP(RC[-7],Sheet1!R2C1:R28C4,4,FALSE)="品",VLOOKUP(RC[-3],Sheet1!R2C8:R6C9,2,FALSE),RC[-3])&VLOOKUP(RC[-7],Sheet1!R2C1:R28C4,4,FALSE) -> 勇者试炼最高星数达到9星 | I351: 17 | J351: =VLOOKUP(RC[-9],Sheet1!R2C1:R28C6,6,FALSE) -> 威名
A352: 7 | B352: btn_battle | C352: 2 | D352: 1 | E352: 18 | F352: 19012 | G352: 100 | H352: =VLOOKUP(RC[-7],Sheet1!R2C1:R28C4,2,FALSE)&VLOOKUP(RC[-7],Sheet1!R2C1:R28C4,3,FALSE)&IF(VLOOKUP(RC[-7],Sheet1!R2C1:R28C4,4,FALSE)="品",VLOOKUP(RC[-3],Sheet1!R2C8:R6C9,2,FALSE),RC[-3])&VLOOKUP(RC[-7],Sheet1!R2C1:R28C4,4,FALSE) -> 勇者试炼最高星数达到18星 | I352: 17 | J352: =VLOOKUP(RC[-9],Sheet1!R2C1:R28C6,6,FALSE) -> 威名
A353: 7 | B353: btn_battle | C353: 3 | D353: 1 | E353: 27 | F353: 19012 | G353: 100 | H353: =VLOOKUP(RC[-7],Sheet1!R2C1:R28C4,2,FALSE)&VLOOKUP(RC[-7],Sheet1!R2C1:R28C4,3,FALSE)&IF(VLOOKUP(RC[-7],Sheet1!R2C1:R28C4,4,FALSE)="品",VLOOKUP(RC[-3],Sheet1!R2C8:R6C9,2,FALSE),RC[-3])&VLOOKUP(RC[-7],Sheet1!R2C1:R28C4,4,FALSE) -> 勇者试炼最高星数达到27星 | I353: 17 | J353: =VLOOKUP(RC[-9],Sheet1!R2C1:R28C6,6,FALSE) -> 威名
A354: 7 | B354: btn_battle | C354: 4 | D354: 1 | E354: 36 | F354: 19012 | G354: 100 | H354: =VLOOKUP(RC[-7],Sheet1!R2C1:R28C4,2,FALSE)&VLOOKUP(RC[-7],Sheet1!R2C1:R28C4,3,FALSE)&IF(VLOOKUP(RC[-7],Sheet1!R2C1:R28C4,4,FALSE)="品",VLOOKUP(RC[-3],Sheet1!R2C8:R6C9,2,FALSE),RC[-3])&VLOOKUP(RC[-7],Sheet1!R2C1:R28C4,4,FALSE) -> 勇者试炼最高星数达到36星 | I354: 17 | J354: =VLOOKUP(RC[-9],Sheet1!R2C1:R28C6,6,FALSE) -> 威名
A355: 7 | B355: btn_battle | C355: 5 | D355: 1 | E355: 45 | F355: 19012 | G355: 100 | H355: =VLOOKUP(RC[-7],Sheet1!R2C1:R28C4,2,FALSE)&VLOOKUP(RC[-7],Sheet1!R2C1:R28C4,3,FALSE)&IF(VLOOKUP(RC[-7],Sheet1!R2C1:R28C4,4,FALSE)="品",VLOOKUP(RC[-3],Sheet1!R2C8:R6C9,2,FALSE),RC[-3])&VLOOKUP(RC[-7],Sheet1!R2C1:R28C4,4,FALSE) -> 勇者试炼最高星数达到45星 | I355: 17 | J355: =VLOOKUP(RC[-9],Sheet1!R2C1:R28C6,6,FALSE) -> 威名
A356: 7 | B356: btn_battle | C356: 6 | D356: 1 | E356: 54 | F356: 19012 | G356: 200 | H356: =VLOOKUP(RC[-7],Sheet1!R2C1:R28C4,2,FALSE)&VLOOKUP(RC[-7],Sheet1!R2C1:R28C4,3,FALSE)&IF(VLOOKUP(RC[-7],Sheet1!R2C1:R28C4,4,FALSE)="品",VLOOKUP(RC[-3],Sheet1!R2C8:R6C9,2,FALSE),RC[-3])&VLOOKUP(RC[-7],Sheet1!R2C1:R28C4,4,FALSE) -> 勇者试炼最高星数达到54星 | I356: 17 | J356: =VLOOKUP(RC[-9],Sheet1!R2C1:R28C6,6,FALSE) -> 威名
A357: 7 | B357: btn_battle | C357: 7 | D357: 1 | E357: 63 | F357: 19012 | G357: 200 | H357: =VLOOKUP(RC[-7],Sheet1!R2C1:R28C4,2,FALSE)&VLOOKUP(RC[-7],Sheet1!R2C1:R28C4,3,FALSE)&IF(VLOOKUP(RC[-7],Sheet1!R2C1:R28C4,4,FALSE)="品",VLOOKUP(RC[-3],Sheet1!R2C8:R6C9,2,FALSE),RC[-3])&VLOOKUP(RC[-7],Sheet1!R2C1:R28C4,4,FALSE) -> 勇者试炼最高星数达到63星 | I357: 17 | J357: =VLOOKUP(RC[-9],Sheet1!R2C1:R28C6,6,FALSE) -> 威名
A358: 7 | B358: btn_battle | C358: 8 | D358: 1 | E358: 72 | F358: 19012 | G358: 200 | H358: =VLOOKUP(RC[-7],Sheet1!R2C1:R28C4,2,FALSE)&VLOOKUP(RC[-7],Sheet1!R2C1:R28C4,3,FALSE)&IF(VLOOKUP(RC[-7],Sheet1!R2C1:R28C4,4,FALSE)="品",VLOOKUP(RC[-3],Sheet1!R2C8:R6C9,2,FALSE),RC[-3])&VLOOKUP(RC[-7],Sheet1!R2C1:R28C4,4,FALSE) -> 勇者试炼最高星数达到72星 | I358: 17 | J358: =VLOOKUP(RC[-9],Sheet1!R2C1:R28C6,6,FALSE) -> 威名
A359: 7 | B359: btn_battle | C359: 9 | D359: 1 | E359: 81 | F359: 19012 | G359: 200 | H359: =VLOOKUP(RC[-7],Sheet1!R2C1:R28C4,2,FALSE)&VLOOKUP(RC[-7],Sheet1!R2C1:R28C4,3,FALSE)&IF(VLOOKUP(RC[-7],Sheet1!R2C1:R28C4,4,FALSE)="品",VLOOKUP(RC[-3],Sheet1!R2C8:R6C9,2,FALSE),RC[-3])&VLOOKUP(RC[-7],Sheet1!R2C1:R28C4,4,FALSE) -> 勇者试炼最高星数达到81星 | I359: 17 | J359: =VLOOKUP(RC[-9],Sheet1!R2C1:R28C6,6,FALSE) -> 威名
A360: 7 | B360: btn_battle | C360: 10 | D360: 1 | E360: 90 | F360: 19012 | G360: 200 | H360: =VLOOKUP(RC[-7],Sheet1!R2C1:R28C4,2,FALSE)&VLOOKUP(RC[-7],Sheet1!R2C1:R28C4,3,FALSE)&IF(VLOOKUP(RC[-7],Sheet1!R2C1:R28C4,4,FALSE)="品",VLOOKUP(RC[-3],Sheet1!R2C8:R6C9,2,FALSE),RC[-3])&VLOOKUP(RC[-7],Sheet1!R2C1:R28C4,4,FALSE) -> 勇者试炼最高星数达到90星 | I360: 17 | J360: =VLOOKUP(RC[-9],Sheet1!R2C1:R28C6,6,FALSE) -> 威名
A361: 7 | B361: btn_battle | C361: 11 | D361: 1 | E361: 99 | F361: 19012 | G361: 300 | H361: =VLOOKUP(RC[-7],Sheet1!R2C1:R28C4,2,FALSE)&VLOOKUP(RC[-7],Sheet1!R2C1:R28C4,3,FALSE)&IF(VLOOKUP(RC[-7],Sheet1!R2C1:R28C4,4,FALSE)="品",VLOOKUP(RC[-3],Sheet1!R2C8:R6C9,2,FALSE),RC[-3])&VLOOKUP(RC[-7],Sheet1!R2C1:R28C4,4,FALSE) -> 勇者试炼最高星数达到99星 | I361: 17 | J361: =VLOOKUP(RC[-9],Sheet1!R2C1:R28C6,6,FALSE) -> 威名
A362: 7 | B362: btn_battle | C362: 12 | D362: 1 | E362: 108 | F362: 19012 | G362: 300 | H362: =VLOOKUP(RC[-7],Sheet1!R2C1:R28C4,2,FALSE)&VLOOKUP(RC[-7],Sheet1!R2C1:R28C4,3,FALSE)&IF(VLOOKUP(RC[-7],Sheet1!R2C1:R28C4,4,FALSE)="品",VLOOKUP(RC[-3],Sheet1!R2C8:R6C9,2,FALSE),RC[-3])&VLOOKUP(RC[-7],Sheet1!R2C1:R28C4,4,FALSE) -> 勇者试炼最高星数达到108星 | I362: 17 | J362: =VLOOKUP(RC[-9],Sheet1!R2C1:R28C6,6,FALSE) -> 威名
A363: 7 | B363: btn_battle | C363: 13 | D363: 1 | E363: 117 | F363: 19012 | G363: 300 | H363: =VLOOKUP(RC[-7],Sheet1!R2C1:R28C4,2,FALSE)&VLOOKUP(RC[-7],Sheet1!R2C1:R28C4,3,FALSE)&IF(VLOOKUP(RC[-7],Sheet1!R2C1:R28C4,4,FALSE)="品",VLOOKUP(RC[-3],Sheet1!R2C8:R6C9,2,FALSE),RC[-3])&VLOOKUP(RC[-7],Sheet1!R2C1:R28C4,4,FALSE) -> 勇者试炼最高星数达到117星 | I363: 17 | J363: =VLOOKUP(RC[-9],Sheet1!R2C1:R28C6,6,FALSE) -> 威名
A364: 7 | B364: btn_battle | C364: 14 | D364: 1 | E364: 126 | F364: 19012 | G364: 300 | H364: =VLOOKUP(RC[-7],Sheet1!R2C1:R28C4,2,FALSE)&VLOOKUP(RC[-7],Sheet1!R2C1:R28C4,3,FALSE)&IF(VLOOKUP(RC[-7],Sheet1!R2C1:R28C4,4,FALSE)="品",VLOOKUP(RC[-3],Sheet1!R2C8:R6C9,2,FALSE),RC[-3])&VLOOKUP(RC[-7],Sheet1!R2C1:R28C4,4,FALSE) -> 勇者试炼最高星数达到126星 | I364: 17 | J364: =VLOOKUP(RC[-9],Sheet1!R2C1:R28C6,6,FALSE) -> 威名
A365: 7 | B365: btn_battle | C365: 15 | D365: 1 | E365: 135 | F365: 19012 | G365: 300 | H365: =VLOOKUP(RC[-7],Sheet1!R2C1:R28C4,2,FALSE)&VLOOKUP(RC[-7],Sheet1!R2C1:R28C4,3,FALSE)&IF(VLOOKUP(RC[-7],Sheet1!R2C1:R28C4,4,FALSE)="品",VLOOKUP(RC[-3],Sheet1!R2C8:R6C9,2,FALSE),RC[-3])&VLOOKUP(RC[-7],Sheet1!R2C1:R28C4,4,FALSE) -> 勇者试炼最高星数达到135星 | I365: 17 | J365: =VLOOKUP(RC[-9],Sheet1!R2C1:R28C6,6,FALSE) -> 威名
A366: 7 | B366: btn_battle | C366: 16 | D366: 1 | E366: 144 | F366: 19012 | G366: 400 | H366: =VLOOKUP(RC[-7],Sheet1!R2C1:R28C4,2,FALSE)&VLOOKUP(RC[-7],Sheet1!R2C1:R28C4,3,FALSE)&IF(VLOOKUP(RC[-7],Sheet1!R2C1:R28C4,4,FALSE)="品",VLOOKUP(RC[-3],Sheet1!R2C8:R6C9,2,FALSE),RC[-3])&VLOOKUP(RC[-7],Sheet1!R2C1:R28C4,4,FALSE) -> 勇者试炼最高星数达到144星 | I366: 17 | J366: =VLOOKUP(RC[-9],Sheet1!R2C1:R28C6,6,FALSE) -> 威名
A367: 7 | B367: btn_battle | C367: 17 | D367: 1 | E367: 153 | F367: 19012 | G367: 400 | H367: =VLOOKUP(RC[-7],Sheet1!R2C1:R28C4,2,FALSE)&VLOOKUP(RC[-7],Sheet1!R2C1:R28C4,3,FALSE)&IF(VLOOKUP(RC[-7],Sheet1!R2C1:R28C4,4,FALSE)="品",VLOOKUP(RC[-3],Sheet1!R2C8:R6C9,2,FALSE),RC[-3])&VLOOKUP(RC[-7],Sheet1!R2C1:R28C4,4,FALSE) -> 勇者试炼最高星数达到153星 | I367: 17 | J367: =VLOOKUP(RC[-9],Sheet1!R2C1:R28C6,6,FALSE) -> 威名
A368: 7 | B368: btn_battle | C368: 18 | D368: 1 | E368: 162 | F368: 19012 | G368: 400 | H368: =VLOOKUP(RC[-7],Sheet1!R2C1:R28C4,2,FALSE)&VLOOKUP(RC[-7],Sheet1!R2C1:R28C4,3,FALSE)&IF(VLOOKUP(RC[-7],Sheet1!R2C1:R28C4,4,FALSE)="品",VLOOKUP(RC[-3],Sheet1!R2C8:R6C9,2,FALSE),RC[-3])&VLOOKUP(RC[-7],Sheet1!R2C1:R28C4,4,FALSE) -> 勇者试炼最高星数达到162星 | I368: 17 | J368: =VLOOKUP(RC[-9],Sheet1!R2C1:R28C6,6,FALSE) -> 威名
A369: 7 | B369: btn_battle | C369: 19 | D369: 1 | E369: 171 | F369: 19012 | G369: 400 | H369: =VLOOKUP(RC[-7],Sheet1!R2C1:R28C4,2,FALSE)&VLOOKUP(RC[-7],Sheet1!R2C1:R28C4,3,FALSE)&IF(VLOOKUP(RC[-7],Sheet1!R2C1:R28C4,4,FALSE)="品",VLOOKUP(RC[-3],Sheet1!R2C8:R6C9,2,FALSE),RC[-3])&VLOOKUP(RC[-7],Sheet1!R2C1:R28C4,4,FALSE) -> 勇者试炼最高星数达到171星 | I369: 17 | J369: =VLOOKUP(RC[-9],Sheet1!R2C1:R28C6,6,FALSE) -> 威名
A370: 7 | B370: btn_battle | C370: 20 | D370: 1 | E370: 180 | F370: 19012 | G370: 400 | H370: =VLOOKUP(RC[-7],Sheet1!R2C1:R28C4,2,FALSE)&VLOOKUP(RC[-7],Sheet1!R2C1:R28C4,3,FALSE)&IF(VLOOKUP(RC[-7],Sheet1!R2C1:R28C4,4,FALSE)="品",VLOOKUP(RC[-3],Sheet1!R2C8:R6C9,2,FALSE),RC[-3])&VLOOKUP(RC[-7],Sheet1!R2C1:R28C4,4,FALSE) -> 勇者试炼最高星数达到180星 | I370: 17 | J370: =VLOOKUP(RC[-9],Sheet1!R2C1:R28C6,6,FALSE) -> 威名
A371: 7 | B371: btn_battle | C371: 21 | D371: 1 | E371: 189 | F371: 19012 | G371: 500 | H371: =VLOOKUP(RC[-7],Sheet1!R2C1:R28C4,2,FALSE)&VLOOKUP(RC[-7],Sheet1!R2C1:R28C4,3,FALSE)&IF(VLOOKUP(RC[-7],Sheet1!R2C1:R28C4,4,FALSE)="品",VLOOKUP(RC[-3],Sheet1!R2C8:R6C9,2,FALSE),RC[-3])&VLOOKUP(RC[-7],Sheet1!R2C1:R28C4,4,FALSE) -> 勇者试炼最高星数达到189星 | I371: 17 | J371: =VLOOKUP(RC[-9],Sheet1!R2C1:R28C6,6,FALSE) -> 威名
A372: 7 | B372: btn_battle | C372: 22 | D372: 1 | E372: 198 | F372: 19012 | G372: 500 | H372: =VLOOKUP(RC[-7],Sheet1!R2C1:R28C4,2,FALSE)&VLOOKUP(RC[-7],Sheet1!R2C1:R28C4,3,FALSE)&IF(VLOOKUP(RC[-7],Sheet1!R2C1:R28C4,4,FALSE)="品",VLOOKUP(RC[-3],Sheet1!R2C8:R6C9,2,FALSE),RC[-3])&VLOOKUP(RC[-7],Sheet1!R2C1:R28C4,4,FALSE) -> 勇者试炼最高星数达到198星 | I372: 17 | J372: =VLOOKUP(RC[-9],Sheet1!R2C1:R28C6,6,FALSE) -> 威名
A373: 7 | B373: btn_battle | C373: 23 | D373: 1 | E373: 207 | F373: 19012 | G373: 500 | H373: =VLOOKUP(RC[-7],Sheet1!R2C1:R28C4,2,FALSE)&VLOOKUP(RC[-7],Sheet1!R2C1:R28C4,3,FALSE)&IF(VLOOKUP(RC[-7],Sheet1!R2C1:R28C4,4,FALSE)="品",VLOOKUP(RC[-3],Sheet1!R2C8:R6C9,2,FALSE),RC[-3])&VLOOKUP(RC[-7],Sheet1!R2C1:R28C4,4,FALSE) -> 勇者试炼最高星数达到207星 | I373: 17 | J373: =VLOOKUP(RC[-9],Sheet1!R2C1:R28C6,6,FALSE) -> 威名
A374: 7 | B374: btn_battle | C374: 24 | D374: 1 | E374: 216 | F374: 19012 | G374: 500 | H374: =VLOOKUP(RC[-7],Sheet1!R2C1:R28C4,2,FALSE)&VLOOKUP(RC[-7],Sheet1!R2C1:R28C4,3,FALSE)&IF(VLOOKUP(RC[-7],Sheet1!R2C1:R28C4,4,FALSE)="品",VLOOKUP(RC[-3],Sheet1!R2C8:R6C9,2,FALSE),RC[-3])&VLOOKUP(RC[-7],Sheet1!R2C1:R28C4,4,FALSE) -> 勇者试炼最高星数达到216星 | I374: 17 | J374: =VLOOKUP(RC[-9],Sheet1!R2C1:R28C6,6,FALSE) -> 威名
A375: 7 | B375: btn_battle | C375: 25 | D375: 1 | E375: 225 | F375: 19012 | G375: 500 | H375: =VLOOKUP(RC[-7],Sheet1!R2C1:R28C4,2,FALSE)&VLOOKUP(RC[-7],Sheet1!R2C1:R28C4,3,FALSE)&IF(VLOOKUP(RC[-7],Sheet1!R2C1:R28C4,4,FALSE)="品",VLOOKUP(RC[-3],Sheet1!R2C8:R6C9,2,FALSE),RC[-3])&VLOOKUP(RC[-7],Sheet1!R2C1:R28C4,4,FALSE) -> 勇者试炼最高星数达到225星 | I375: 17 | J375: =VLOOKUP(RC[-9],Sheet1!R2C1:R28C6,6,FALSE) -> 威名
A376: 7 | B376: btn_battle | C376: 26 | D376: 1 | E376: 234 | F376: 19012 | G376: 600 | H376: =VLOOKUP(RC[-7],Sheet1!R2C1:R28C4,2,FALSE)&VLOOKUP(RC[-7],Sheet1!R2C1:R28C4,3,FALSE)&IF(VLOOKUP(RC[-7],Sheet1!R2C1:R28C4,4,FALSE)="品",VLOOKUP(RC[-3],Sheet1!R2C8:R6C9,2,FALSE),RC[-3])&VLOOKUP(RC[-7],Sheet1!R2C1:R28C4,4,FALSE) -> 勇者试炼最高星数达到234星 | I376: 17 | J376: =VLOOKUP(RC[-9],Sheet1!R2C1:R28C6,6,FALSE) -> 威名
A377: 7 | B377: btn_battle | C377: 27 | D377: 1 | E377: 243 | F377: 19012 | G377: 600 | H377: =VLOOKUP(RC[-7],Sheet1!R2C1:R28C4,2,FALSE)&VLOOKUP(RC[-7],Sheet1!R2C1:R28C4,3,FALSE)&IF(VLOOKUP(RC[-7],Sheet1!R2C1:R28C4,4,FALSE)="品",VLOOKUP(RC[-3],Sheet1!R2C8:R6C9,2,FALSE),RC[-3])&VLOOKUP(RC[-7],Sheet1!R2C1:R28C4,4,FALSE) -> 勇者试炼最高星数达到243星 | I377: 17 | J377: =VLOOKUP(RC[-9],Sheet1!R2C1:R28C6,6,FALSE) -> 威名
A378: 7 | B378: btn_battle | C378: 28 | D378: 1 | E378: 252 | F378: 19012 | G378: 600 | H378: =VLOOKUP(RC[-7],Sheet1!R2C1:R28C4,2,FALSE)&VLOOKUP(RC[-7],Sheet1!R2C1:R28C4,3,FALSE)&IF(VLOOKUP(RC[-7],Sheet1!R2C1:R28C4,4,FALSE)="品",VLOOKUP(RC[-3],Sheet1!R2C8:R6C9,2,FALSE),RC[-3])&VLOOKUP(RC[-7],Sheet1!R2C1:R28C4,4,FALSE) -> 勇者试炼最高星数达到252星 | I378: 17 | J378: =VLOOKUP(RC[-9],Sheet1!R2C1:R28C6,6,FALSE) -> 威名
A379: 7 | B379: btn_battle | C379: 29 | D379: 1 | E379: 261 | F379: 19012 | G379: 600 | H379: =VLOOKUP(RC[-7],Sheet1!R2C1:R28C4,2,FALSE)&VLOOKUP(RC[-7],Sheet1!R2C1:R28C4,3,FALSE)&IF(VLOOKUP(RC[-7],Sheet1!R2C1:R28C4,4,FALSE)="品",VLOOKUP(RC[-3],Sheet1!R2C8:R6C9,2,FALSE),RC[-3])&VLOOKUP(RC[-7],Sheet1!R2C1:R28C4,4,FALSE) -> 勇者试炼最高星数达到261星 | I379: 17 | J379: =VLOOKUP(RC[-9],Sheet1!R2C1:R28C6,6,FALSE) -> 威名
A380: 7 | B380: btn_battle | C380: 30 | D380: 1 | E380: 270 | F380: 19012 | G380: 600 | H380: =VLOOKUP(RC[-7],Sheet1!R2C1:R28C4,2,FALSE)&VLOOKUP(RC[-7],Sheet1!R2C1:R28C4,3,FALSE)&IF(VLOOKUP(RC[-7],Sheet1!R2C1:R28C4,4,FALSE)="品",VLOOKUP(RC[-3],Sheet1!R2C8:R6C9,2,FALSE),RC[-3])&VLOOKUP(RC[-7],Sheet1!R2C1:R28C4,4,FALSE) -> 勇者试炼最高星数达到270星 | I380: 17 | J380: =VLOOKUP(RC[-9],Sheet1!R2C1:R28C6,6,FALSE) -> 威名
A381: 7 | B381: btn_battle | C381: 31 | D381: 1 | E381: 279 | F381: 19012 | G381: 700 | H381: =VLOOKUP(RC[-7],Sheet1!R2C1:R28C4,2,FALSE)&VLOOKUP(RC[-7],Sheet1!R2C1:R28C4,3,FALSE)&IF(VLOOKUP(RC[-7],Sheet1!R2C1:R28C4,4,FALSE)="品",VLOOKUP(RC[-3],Sheet1!R2C8:R6C9,2,FALSE),RC[-3])&VLOOKUP(RC[-7],Sheet1!R2C1:R28C4,4,FALSE) -> 勇者试炼最高星数达到279星 | I381: 17 | J381: =VLOOKUP(RC[-9],Sheet1!R2C1:R28C6,6,FALSE) -> 威名
A382: 7 | B382: btn_battle | C382: 32 | D382: 1 | E382: 288 | F382: 19012 | G382: 700 | H382: =VLOOKUP(RC[-7],Sheet1!R2C1:R28C4,2,FALSE)&VLOOKUP(RC[-7],Sheet1!R2C1:R28C4,3,FALSE)&IF(VLOOKUP(RC[-7],Sheet1!R2C1:R28C4,4,FALSE)="品",VLOOKUP(RC[-3],Sheet1!R2C8:R6C9,2,FALSE),RC[-3])&VLOOKUP(RC[-7],Sheet1!R2C1:R28C4,4,FALSE) -> 勇者试炼最高星数达到288星 | I382: 17 | J382: =VLOOKUP(RC[-9],Sheet1!R2C1:R28C6,6,FALSE) -> 威名
A383: 7 | B383: btn_battle | C383: 33 | D383: 1 | E383: 297 | F383: 19012 | G383: 700 | H383: =VLOOKUP(RC[-7],Sheet1!R2C1:R28C4,2,FALSE)&VLOOKUP(RC[-7],Sheet1!R2C1:R28C4,3,FALSE)&IF(VLOOKUP(RC[-7],Sheet1!R2C1:R28C4,4,FALSE)="品",VLOOKUP(RC[-3],Sheet1!R2C8:R6C9,2,FALSE),RC[-3])&VLOOKUP(RC[-7],Sheet1!R2C1:R28C4,4,FALSE) -> 勇者试炼最高星数达到297星 | I383: 17 | J383: =VLOOKUP(RC[-9],Sheet1!R2C1:R28C6,6,FALSE) -> 威名
A384: 7 | B384: btn_battle | C384: 34 | D384: 1 | E384: 306 | F384: 19012 | G384: 700 | H384: =VLOOKUP(RC[-7],Sheet1!R2C1:R28C4,2,FALSE)&VLOOKUP(RC[-7],Sheet1!R2C1:R28C4,3,FALSE)&IF(VLOOKUP(RC[-7],Sheet1!R2C1:R28C4,4,FALSE)="品",VLOOKUP(RC[-3],Sheet1!R2C8:R6C9,2,FALSE),RC[-3])&VLOOKUP(RC[-7],Sheet1!R2C1:R28C4,4,FALSE) -> 勇者试炼最高星数达到306星 | I384: 17 | J384: =VLOOKUP(RC[-9],Sheet1!R2C1:R28C6,6,FALSE) -> 威名
A385: 7 | B385: btn_battle | C385: 35 | D385: 1 | E385: 315 | F385: 19012 | G385: 700 | H385: =VLOOKUP(RC[-7],Sheet1!R2C1:R28C4,2,FALSE)&VLOOKUP(RC[-7],Sheet1!R2C1:R28C4,3,FALSE)&IF(VLOOKUP(RC[-7],Sheet1!R2C1:R28C4,4,FALSE)="品",VLOOKUP(RC[-3],Sheet1!R2C8:R6C9,2,FALSE),RC[-3])&VLOOKUP(RC[-7],Sheet1!R2C1:R28C4,4,FALSE) -> 勇者试炼最高星数达到315星 | I385: 17 | J385: =VLOOKUP(RC[-9],Sheet1!R2C1:R28C6,6,FALSE) -> 威名
A386: 7 | B386: btn_battle | C386: 36 | D386: 1 | E386: 324 | F386: 19012 | G386: 800 | H386: =VLOOKUP(RC[-7],Sheet1!R2C1:R28C4,2,FALSE)&VLOOKUP(RC[-7],Sheet1!R2C1:R28C4,3,FALSE)&IF(VLOOKUP(RC[-7],Sheet1!R2C1:R28C4,4,FALSE)="品",VLOOKUP(RC[-3],Sheet1!R2C8:R6C9,2,FALSE),RC[-3])&VLOOKUP(RC[-7],Sheet1!R2C1:R28C4,4,FALSE) -> 勇者试炼最高星数达到324星 | I386: 17 | J386: =VLOOKUP(RC[-9],Sheet1!R2C1:R28C6,6,FALSE) -> 威名
A387: 7 | B387: btn_battle | C387: 37 | D387: 1 | E387: 333 | F387: 19012 | G387: 800 | H387: =VLOOKUP(RC[-7],Sheet1!R2C1:R28C4,2,FALSE)&VLOOKUP(RC[-7],Sheet1!R2C1:R28C4,3,FALSE)&IF(VLOOKUP(RC[-7],Sheet1!R2C1:R28C4,4,FALSE)="品",VLOOKUP(RC[-3],Sheet1!R2C8:R6C9,2,FALSE),RC[-3])&VLOOKUP(RC[-7],Sheet1!R2C1:R28C4,4,FALSE) -> 勇者试炼最高星数达到333星 | I387: 17 | J387: =VLOOKUP(RC[-9],Sheet1!R2C1:R28C6,6,FALSE) -> 威名
A388: 7 | B388: btn_battle | C388: 38 | D388: 1 | E388: 342 | F388: 19012 | G388: 800 | H388: =VLOOKUP(RC[-7],Sheet1!R2C1:R28C4,2,FALSE)&VLOOKUP(RC[-7],Sheet1!R2C1:R28C4,3,FALSE)&IF(VLOOKUP(RC[-7],Sheet1!R2C1:R28C4,4,FALSE)="品",VLOOKUP(RC[-3],Sheet1!R2C8:R6C9,2,FALSE),RC[-3])&VLOOKUP(RC[-7],Sheet1!R2C1:R28C4,4,FALSE) -> 勇者试炼最高星数达到342星 | I388: 17 | J388: =VLOOKUP(RC[-9],Sheet1!R2C1:R28C6,6,FALSE) -> 威名
A389: 7 | B389: btn_battle | C389: 39 | D389: 1 | E389: 351 | F389: 19012 | G389: 800 | H389: =VLOOKUP(RC[-7],Sheet1!R2C1:R28C4,2,FALSE)&VLOOKUP(RC[-7],Sheet1!R2C1:R28C4,3,FALSE)&IF(VLOOKUP(RC[-7],Sheet1!R2C1:R28C4,4,FALSE)="品",VLOOKUP(RC[-3],Sheet1!R2C8:R6C9,2,FALSE),RC[-3])&VLOOKUP(RC[-7],Sheet1!R2C1:R28C4,4,FALSE) -> 勇者试炼最高星数达到351星 | I389: 17 | J389: =VLOOKUP(RC[-9],Sheet1!R2C1:R28C6,6,FALSE) -> 威名
A390: 7 | B390: btn_battle | C390: 40 | D390: 1 | E390: 360 | F390: 19012 | G390: 800 | H390: =VLOOKUP(RC[-7],Sheet1!R2C1:R28C4,2,FALSE)&VLOOKUP(RC[-7],Sheet1!R2C1:R28C4,3,FALSE)&IF(VLOOKUP(RC[-7],Sheet1!R2C1:R28C4,4,FALSE)="品",VLOOKUP(RC[-3],Sheet1!R2C8:R6C9,2,FALSE),RC[-3])&VLOOKUP(RC[-7],Sheet1!R2C1:R28C4,4,FALSE) -> 勇者试炼最高星数达到360星 | I390: 17 | J390: =VLOOKUP(RC[-9],Sheet1!R2C1:R28C6,6,FALSE) -> 威名
A391: 7 | B391: btn_battle | C391: 41 | D391: 1 | E391: 369 | F391: 19012 | G391: 900 | H391: =VLOOKUP(RC[-7],Sheet1!R2C1:R28C4,2,FALSE)&VLOOKUP(RC[-7],Sheet1!R2C1:R28C4,3,FALSE)&IF(VLOOKUP(RC[-7],Sheet1!R2C1:R28C4,4,FALSE)="品",VLOOKUP(RC[-3],Sheet1!R2C8:R6C9,2,FALSE),RC[-3])&VLOOKUP(RC[-7],Sheet1!R2C1:R28C4,4,FALSE) -> 勇者试炼最高星数达到369星 | I391: 17 | J391: =VLOOKUP(RC[-9],Sheet1!R2C1:R28C6,6,FALSE) -> 威名
A392: 7 | B392: btn_battle | C392: 42 | D392: 1 | E392: 378 | F392: 19012 | G392: 900 | H392: =VLOOKUP(RC[-7],Sheet1!R2C1:R28C4,2,FALSE)&VLOOKUP(RC[-7],Sheet1!R2C1:R28C4,3,FALSE)&IF(VLOOKUP(RC[-7],Sheet1!R2C1:R28C4,4,FALSE)="品",VLOOKUP(RC[-3],Sheet1!R2C8:R6C9,2,FALSE),RC[-3])&VLOOKUP(RC[-7],Sheet1!R2C1:R28C4,4,FALSE) -> 勇者试炼最高星数达到378星 | I392: 17 | J392: =VLOOKUP(RC[-9],Sheet1!R2C1:R28C6,6,FALSE) -> 威名
A393: 7 | B393: btn_battle | C393: 43 | D393: 1 | E393: 387 | F393: 19012 | G393: 900 | H393: =VLOOKUP(RC[-7],Sheet1!R2C1:R28C4,2,FALSE)&VLOOKUP(RC[-7],Sheet1!R2C1:R28C4,3,FALSE)&IF(VLOOKUP(RC[-7],Sheet1!R2C1:R28C4,4,FALSE)="品",VLOOKUP(RC[-3],Sheet1!R2C8:R6C9,2,FALSE),RC[-3])&VLOOKUP(RC[-7],Sheet1!R2C1:R28C4,4,FALSE) -> 勇者试炼最高星数达到387星 | I393: 17 | J393: =VLOOKUP(RC[-9],Sheet1!R2C1:R28C6,6,FALSE) -> 威名
A394: 7 | B394: btn_battle | C394: 44 | D394: 1 | E394: 396 | F394: 19012 | G394: 900 | H394: =VLOOKUP(RC[-7],Sheet1!R2C1:R28C4,2,FALSE)&VLOOKUP(RC[-7],Sheet1!R2C1:R28C4,3,FALSE)&IF(VLOOKUP(RC[-7],Sheet1!R2C1:R28C4,4,FALSE)="品",VLOOKUP(RC[-3],Sheet1!R2C8:R6C9,2,FALSE),RC[-3])&VLOOKUP(RC[-7],Sheet1!R2C1:R28C4,4,FALSE) -> 勇者试炼最高星数达到396星 | I394: 17 | J394: =VLOOKUP(RC[-9],Sheet1!R2C1:R28C6,6,FALSE) -> 威名
A395: 7 | B395: btn_battle | C395: 45 | D395: 1 | E395: 405 | F395: 19012 | G395: 900 | H395: =VLOOKUP(RC[-7],Sheet1!R2C1:R28C4,2,FALSE)&VLOOKUP(RC[-7],Sheet1!R2C1:R28C4,3,FALSE)&IF(VLOOKUP(RC[-7],Sheet1!R2C1:R28C4,4,FALSE)="品",VLOOKUP(RC[-3],Sheet1!R2C8:R6C9,2,FALSE),RC[-3])&VLOOKUP(RC[-7],Sheet1!R2C1:R28C4,4,FALSE) -> 勇者试炼最高星数达到405星 | I395: 17 | J395: =VLOOKUP(RC[-9],Sheet1!R2C1:R28C6,6,FALSE) -> 威名
A396: 7 | B396: btn_battle | C396: 46 | D396: 1 | E396: 414 | F396: 19012 | G396: 1000 | H396: =VLOOKUP(RC[-7],Sheet1!R2C1:R28C4,2,FALSE)&VLOOKUP(RC[-7],Sheet1!R2C1:R28C4,3,FALSE)&IF(VLOOKUP(RC[-7],Sheet1!R2C1:R28C4,4,FALSE)="品",VLOOKUP(RC[-3],Sheet1!R2C8:R6C9,2,FALSE),RC[-3])&VLOOKUP(RC[-7],Sheet1!R2C1:R28C4,4,FALSE) -> 勇者试炼最高星数达到414星 | I396: 17 | J396: =VLOOKUP(RC[-9],Sheet1!R2C1:R28C6,6,FALSE) -> 威名
A397: 7 | B397: btn_battle | C397: 47 | D397: 1 | E397: 423 | F397: 19012 | G397: 1000 | H397: =VLOOKUP(RC[-7],Sheet1!R2C1:R28C4,2,FALSE)&VLOOKUP(RC[-7],Sheet1!R2C1:R28C4,3,FALSE)&IF(VLOOKUP(RC[-7],Sheet1!R2C1:R28C4,4,FALSE)="品",VLOOKUP(RC[-3],Sheet1!R2C8:R6C9,2,FALSE),RC[-3])&VLOOKUP(RC[-7],Sheet1!R2C1:R28C4,4,FALSE) -> 勇者试炼最高星数达到423星 | I397: 17 | J397: =VLOOKUP(RC[-9],Sheet1!R2C1:R28C6,6,FALSE) -> 威名
A398: 7 | B398: btn_battle | C398: 48 | D398: 1 | E398: 432 | F398: 19012 | G398: 1000 | H398: =VLOOKUP(RC[-7],Sheet1!R2C1:R28C4,2,FALSE)&VLOOKUP(RC[-7],Sheet1!R2C1:R28C4,3,FALSE)&IF(VLOOKUP(RC[-7],Sheet1!R2C1:R28C4,4,FALSE)="品",VLOOKUP(RC[-3],Sheet1!R2C8:R6C9,2,FALSE),RC[-3])&VLOOKUP(RC[-7],Sheet1!R2C1:R28C4,4,FALSE) -> 勇者试炼最高星数达到432星 | I398: 17 | J398: =VLOOKUP(RC[-9],Sheet1!R2C1:R28C6,6,FALSE) -> 威名
A399: 7 | B399: btn_battle | C399: 49 | D399: 1 | E399: 441 | F399: 19012 | G399: 1000 | H399: =VLOOKUP(RC[-7],Sheet1!R2C1:R28C4,2,FALSE)&VLOOKUP(RC[-7],Sheet1!R2C1:R28C4,3,FALSE)&IF(VLOOKUP(RC[-7],Sheet1!R2C1:R28C4,4,FALSE)="品",VLOOKUP(RC[-3],Sheet1!R2C8:R6C9,2,FALSE),RC[-3])&VLOOKUP(RC[-7],Sheet1!R2C1:R28C4,4,FALSE) -> 勇者试炼最高星数达到441星 | I399: 17 | J399: =VLOOKUP(RC[-9],Sheet1!R2C1:R28C6,6,FALSE) -> 威名
A400: 7 | B400: btn_battle | C400: 50 | D400: 1 | E400: 450 | F400: 19012 | G400: 1000 | H400: =VLOOKUP(RC[-7],Sheet1!R2C1:R28C4,2,FALSE)&VLOOKUP(RC[-7],Sheet1!R2C1:R28C4,3,FALSE)&IF(VLOOKUP(RC[-7],Sheet1!R2C1:R28C4,4,FALSE)="品",VLOOKUP(RC[-3],Sheet1!R2C8:R6C9,2,FALSE),RC[-3])&VLOOKUP(RC[-7],Sheet1!R2C1:R28C4,4,FALSE) -> 勇者试炼最高星数达到450星 | I400: 17 | J400: =VLOOKUP(RC[-9],Sheet1!R2C1:R28C6,6,FALSE) -> 威名
A401: 7 | B401: btn_battle | C401: 51 | D401: 1 | E401: 459 | F401: 19012 | G401: 1200 | H401: =VLOOKUP(RC[-7],Sheet1!R2C1:R28C4,2,FALSE)&VLOOKUP(RC[-7],Sheet1!R2C1:R28C4,3,FALSE)&IF(VLOOKUP(RC[-7],Sheet1!R2C1:R28C4,4,FALSE)="品",VLOOKUP(RC[-3],Sheet1!R2C8:R6C9,2,FALSE),RC[-3])&VLOOKUP(RC[-7],Sheet1!R2C1:R28C4,4,FALSE) -> 勇者试炼最高星数达到459星 | I401: 17 | J401: =VLOOKUP(RC[-9],Sheet1!R2C1:R28C6,6,FALSE) -> 威名
A402: 7 | B402: btn_battle | C402: 52 | D402: 1 | E402: 468 | F402: 19012 | G402: 1200 | H402: =VLOOKUP(RC[-7],Sheet1!R2C1:R28C4,2,FALSE)&VLOOKUP(RC[-7],Sheet1!R2C1:R28C4,3,FALSE)&IF(VLOOKUP(RC[-7],Sheet1!R2C1:R28C4,4,FALSE)="品",VLOOKUP(RC[-3],Sheet1!R2C8:R6C9,2,FALSE),RC[-3])&VLOOKUP(RC[-7],Sheet1!R2C1:R28C4,4,FALSE) -> 勇者试炼最高星数达到468星 | I402: 17 | J402: =VLOOKUP(RC[-9],Sheet1!R2C1:R28C6,6,FALSE) -> 威名
A403: 7 | B403: btn_battle | C403: 53 | D403: 1 | E403: 477 | F403: 19012 | G403: 1200 | H403: =VLOOKUP(RC[-7],Sheet1!R2C1:R28C4,2,FALSE)&VLOOKUP(RC[-7],Sheet1!R2C1:R28C4,3,FALSE)&IF(VLOOKUP(RC[-7],Sheet1!R2C1:R28C4,4,FALSE)="品",VLOOKUP(RC[-3],Sheet1!R2C8:R6C9,2,FALSE),RC[-3])&VLOOKUP(RC[-7],Sheet1!R2C1:R28C4,4,FALSE) -> 勇者试炼最高星数达到477星 | I403: 17 | J403: =VLOOKUP(RC[-9],Sheet1!R2C1:R28C6,6,FALSE) -> 威名
A404: 7 | B404: btn_battle | C404: 54 | D404: 1 | E404: 486 | F404: 19012 | G404: 1200 | H404: =VLOOKUP(RC[-7],Sheet1!R2C1:R28C4,2,FALSE)&VLOOKUP(RC[-7],Sheet1!R2C1:R28C4,3,FALSE)&IF(VLOOKUP(RC[-7],Sheet1!R2C1:R28C4,4,FALSE)="品",VLOOKUP(RC[-3],Sheet1!R2C8:R6C9,2,FALSE),RC[-3])&VLOOKUP(RC[-7],Sheet1!R2C1:R28C4,4,FALSE) -> 勇者试炼最高星数达到486星 | I404: 17 | J404: =VLOOKUP(RC[-9],Sheet1!R2C1:R28C6,6,FALSE) -> 威名
A405: 7 | B405: btn_battle | C405: 55 | D405: 1 | E405: 495 | F405: 19012 | G405: 1200 | H405: =VLOOKUP(RC[-7],Sheet1!R2C1:R28C4,2,FALSE)&VLOOKUP(RC[-7],Sheet1!R2C1:R28C4,3,FALSE)&IF(VLOOKUP(RC[-7],Sheet1!R2C1:R28C4,4,FALSE)="品",VLOOKUP(RC[-3],Sheet1!R2C8:R6C9,2,FALSE),RC[-3])&VLOOKUP(RC[-7],Sheet1!R2C1:R28C4,4,FALSE) -> 勇者试炼最高星数达到495星 | I405: 17 | J405: =VLOOKUP(RC[-9],Sheet1!R2C1:R28C6,6,FALSE) -> 威名
A406: 7 | B406: btn_battle | C406: 56 | D406: 1 | E406: 504 | F406: 19012 | G406: 1400 | H406: =VLOOKUP(RC[-7],Sheet1!R2C1:R28C4,2,FALSE)&VLOOKUP(RC[-7],Sheet1!R2C1:R28C4,3,FALSE)&IF(VLOOKUP(RC[-7],Sheet1!R2C1:R28C4,4,FALSE)="品",VLOOKUP(RC[-3],Sheet1!R2C8:R6C9,2,FALSE),RC[-3])&VLOOKUP(RC[-7],Sheet1!R2C1:R28C4,4,FALSE) -> 勇者试炼最高星数达到504星 | I406: 17 | J406: =VLOOKUP(RC[-9],Sheet1!R2C1:R28C6,6,FALSE) -> 威名
A407: 7 | B407: btn_battle | C407: 57 | D407: 1 | E407: 513 | F407: 19012 | G407: 1400 | H407: =VLOOKUP(RC[-7],Sheet1!R2C1:R28C4,2,FALSE)&VLOOKUP(RC[-7],Sheet1!R2C1:R28C4,3,FALSE)&IF(VLOOKUP(RC[-7],Sheet1!R2C1:R28C4,4,FALSE)="品",VLOOKUP(RC[-3],Sheet1!R2C8:R6C9,2,FALSE),RC[-3])&VLOOKUP(RC[-7],Sheet1!R2C1:R28C4,4,FALSE) -> 勇者试炼最高星数达到513星 | I407: 17 | J407: =VLOOKUP(RC[-9],Sheet1!R2C1:R28C6,6,FALSE) -> 威名
A408: 7 | B408: btn_battle | C408: 58 | D408: 1 | E408: 522 | F408: 19012 | G408: 1400 | H408: =VLOOKUP(RC[-7],Sheet1!R2C1:R28C4,2,FALSE)&VLOOKUP(RC[-7],Sheet1!R2C1:R28C4,3,FALSE)&IF(VLOOKUP(RC[-7],Sheet1!R2C1:R28C4,4,FALSE)="品",VLOOKUP(RC[-3],Sheet1!R2C8:R6C9,2,FALSE),RC[-3])&VLOOKUP(RC[-7],Sheet1!R2C1:R28C4,4,FALSE) -> 勇者试炼最高星数达到522星 | I408: 17 | J408: =VLOOKUP(RC[-9],Sheet1!R2C1:R28C6,6,FALSE) -> 威名
A409: 7 | B409: btn_battle | C409: 59 | D409: 1 | E409: 531 | F409: 19012 | G409: 1400 | H409: =VLOOKUP(RC[-7],Sheet1!R2C1:R28C4,2,FALSE)&VLOOKUP(RC[-7],Sheet1!R2C1:R28C4,3,FALSE)&IF(VLOOKUP(RC[-7],Sheet1!R2C1:R28C4,4,FALSE)="品",VLOOKUP(RC[-3],Sheet1!R2C8:R6C9,2,FALSE),RC[-3])&VLOOKUP(RC[-7],Sheet1!R2C1:R28C4,4,FALSE) -> 勇者试炼最高星数达到531星 | I409: 17 | J409: =VLOOKUP(RC[-9],Sheet1!R2C1:R28C6,6,FALSE) -> 威名
A410: 7 | B410: btn_battle | C410: 60 | D410: 1 | E410: 540 | F410: 19012 | G410: 1400 | H410: =VLOOKUP(RC[-7],Sheet1!R2C1:R28C4,2,FALSE)&VLOOKUP(RC[-7],Sheet1!R2C1:R28C4,3,FALSE)&IF(VLOOKUP(RC[-7],Sheet1!R2C1:R28C4,4,FALSE)="品",VLOOKUP(RC[-3],Sheet1!R2C8:R6C9,2,FALSE),RC[-3])&VLOOKUP(RC[-7],Sheet1!R2C1:R28C4,4,FALSE) -> 勇者试炼最高星数达到540星 | I410: 17 | J410: =VLOOKUP(RC[-9],Sheet1!R2C1:R28C6,6,FALSE) -> 威名
A411: 7 | B411: btn_battle | C411: 61 | D411: 1 | E411: 549 | F411: 19012 | G411: 1600 | H411: =VLOOKUP(RC[-7],Sheet1!R2C1:R28C4,2,FALSE)&VLOOKUP(RC[-7],Sheet1!R2C1:R28C4,3,FALSE)&IF(VLOOKUP(RC[-7],Sheet1!R2C1:R28C4,4,FALSE)="品",VLOOKUP(RC[-3],Sheet1!R2C8:R6C9,2,FALSE),RC[-3])&VLOOKUP(RC[-7],Sheet1!R2C1:R28C4,4,FALSE) -> 勇者试炼最高星数达到549星 | I411: 17 | J411: =VLOOKUP(RC[-9],Sheet1!R2C1:R28C6,6,FALSE) -> 威名
A412: 7 | B412: btn_battle | C412: 62 | D412: 1 | E412: 558 | F412: 19012 | G412: 1600 | H412: =VLOOKUP(RC[-7],Sheet1!R2C1:R28C4,2,FALSE)&VLOOKUP(RC[-7],Sheet1!R2C1:R28C4,3,FALSE)&IF(VLOOKUP(RC[-7],Sheet1!R2C1:R28C4,4,FALSE)="品",VLOOKUP(RC[-3],Sheet1!R2C8:R6C9,2,FALSE),RC[-3])&VLOOKUP(RC[-7],Sheet1!R2C1:R28C4,4,FALSE) -> 勇者试炼最高星数达到558星 | I412: 17 | J412: =VLOOKUP(RC[-9],Sheet1!R2C1:R28C6,6,FALSE) -> 威名
A413: 7 | B413: btn_battle | C413: 63 | D413: 1 | E413: 567 | F413: 19012 | G413: 1600 | H413: =VLOOKUP(RC[-7],Sheet1!R2C1:R28C4,2,FALSE)&VLOOKUP(RC[-7],Sheet1!R2C1:R28C4,3,FALSE)&IF(VLOOKUP(RC[-7],Sheet1!R2C1:R28C4,4,FALSE)="品",VLOOKUP(RC[-3],Sheet1!R2C8:R6C9,2,FALSE),RC[-3])&VLOOKUP(RC[-7],Sheet1!R2C1:R28C4,4,FALSE) -> 勇者试炼最高星数达到567星 | I413: 17 | J413: =VLOOKUP(RC[-9],Sheet1!R2C1:R28C6,6,FALSE) -> 威名
A414: 7 | B414: btn_battle | C414: 64 | D414: 1 | E414: 576 | F414: 19012 | G414: 1600 | H414: =VLOOKUP(RC[-7],Sheet1!R2C1:R28C4,2,FALSE)&VLOOKUP(RC[-7],Sheet1!R2C1:R28C4,3,FALSE)&IF(VLOOKUP(RC[-7],Sheet1!R2C1:R28C4,4,FALSE)="品",VLOOKUP(RC[-3],Sheet1!R2C8:R6C9,2,FALSE),RC[-3])&VLOOKUP(RC[-7],Sheet1!R2C1:R28C4,4,FALSE) -> 勇者试炼最高星数达到576星 | I414: 17 | J414: =VLOOKUP(RC[-9],Sheet1!R2C1:R28C6,6,FALSE) -> 威名
A415: 7 | B415: btn_battle | C415: 65 | D415: 1 | E415: 585 | F415: 19012 | G415: 1600 | H415: =VLOOKUP(RC[-7],Sheet1!R2C1:R28C4,2,FALSE)&VLOOKUP(RC[-7],Sheet1!R2C1:R28C4,3,FALSE)&IF(VLOOKUP(RC[-7],Sheet1!R2C1:R28C4,4,FALSE)="品",VLOOKUP(RC[-3],Sheet1!R2C8:R6C9,2,FALSE),RC[-3])&VLOOKUP(RC[-7],Sheet1!R2C1:R28C4,4,FALSE) -> 勇者试炼最高星数达到585星 | I415: 17 | J415: =VLOOKUP(RC[-9],Sheet1!R2C1:R28C6,6,FALSE) -> 威名
A416: 7 | B416: btn_battle | C416: 66 | D416: 1 | E416: 594 | F416: 19012 | G416: 1800 | H416: =VLOOKUP(RC[-7],Sheet1!R2C1:R28C4,2,FALSE)&VLOOKUP(RC[-7],Sheet1!R2C1:R28C4,3,FALSE)&IF(VLOOKUP(RC[-7],Sheet1!R2C1:R28C4,4,FALSE)="品",VLOOKUP(RC[-3],Sheet1!R2C8:R6C9,2,FALSE),RC[-3])&VLOOKUP(RC[-7],Sheet1!R2C1:R28C4,4,FALSE) -> 勇者试炼最高星数达到594星 | I416: 17 | J416: =VLOOKUP(RC[-9],Sheet1!R2C1:R28C6,6,FALSE) -> 威名
A417: 7 | B417: btn_battle | C417: 67 | D417: 1 | E417: 603 | F417: 19012 | G417: 1800 | H417: =VLOOKUP(RC[-7],Sheet1!R2C1:R28C4,2,FALSE)&VLOOKUP(RC[-7],Sheet1!R2C1:R28C4,3,FALSE)&IF(VLOOKUP(RC[-7],Sheet1!R2C1:R28C4,4,FALSE)="品",VLOOKUP(RC[-3],Sheet1!R2C8:R6C9,2,FALSE),RC[-3])&VLOOKUP(RC[-7],Sheet1!R2C1:R28C4,4,FALSE) -> 勇者试炼最高星数达到603星 | I417: 17 | J417: =VLOOKUP(RC[-9],Sheet1!R2C1:R28C6,6,FALSE) -> 威名
A418: 7 | B418: btn_battle | C418: 68 | D418: 1 | E418: 612 | F418: 19012 | G418: 1800 | H418: =VLOOKUP(RC[-7],Sheet1!R2C1:R28C4,2,FALSE)&VLOOKUP(RC[-7],Sheet1!R2C1:R28C4,3,FALSE)&IF(VLOOKUP(RC[-7],Sheet1!R2C1:R28C4,4,FALSE)="品",VLOOKUP(RC[-3],Sheet1!R2C8:R6C9,2,FALSE),RC[-3])&VLOOKUP(RC[-7],Sheet1!R2C1:R28C4,4,FALSE) -> 勇者试炼最高星数达到612星 | I418: 17 | J418: =VLOOKUP(RC[-9],Sheet1!R2C1:R28C6,6,FALSE) -> 威名
A419: 7 | B419: btn_battle | C419: 69 | D419: 1 | E419: 621 | F419: 19012 | G419: 1800 | H419: =VLOOKUP(RC[-7],Sheet1!R2C1:R28C4,2,FALSE)&VLOOKUP(RC[-7],Sheet1!R2C1:R28C4,3,FALSE)&IF(VLOOKUP(RC[-7],Sheet1!R2C1:R28C4,4,FALSE)="品",VLOOKUP(RC[-3],Sheet1!R2C8:R6C9,2,FALSE),RC[-3])&VLOOKUP(RC[-7],Sheet1!R2C1:R28C4,4,FALSE) -> 勇者试炼最高星数达到621星 | I419: 17 | J419: =VLOOKUP(RC[-9],Sheet1!R2C1:R28C6,6,FALSE) -> 威名
A420: 7 | B420: btn_battle | C420: 70 | D420: 1 | E420: 630 | F420: 19012 | G420: 1800 | H420: =VLOOKUP(RC[-7],Sheet1!R2C1:R28C4,2,FALSE)&VLOOKUP(RC[-7],Sheet1!R2C1:R28C4,3,FALSE)&IF(VLOOKUP(RC[-7],Sheet1!R2C1:R28C4,4,FALSE)="品",VLOOKUP(RC[-3],Sheet1!R2C8:R6C9,2,FALSE),RC[-3])&VLOOKUP(RC[-7],Sheet1!R2C1:R28C4,4,FALSE) -> 勇者试炼最高星数达到630星 | I420: 17 | J420: =VLOOKUP(RC[-9],Sheet1!R2C1:R28C6,6,FALSE) -> 威名
A421: 7 | B421: btn_battle | C421: 71 | D421: 1 | E421: 639 | F421: 19012 | G421: 2000 | H421: =VLOOKUP(RC[-7],Sheet1!R2C1:R28C4,2,FALSE)&VLOOKUP(RC[-7],Sheet1!R2C1:R28C4,3,FALSE)&IF(VLOOKUP(RC[-7],Sheet1!R2C1:R28C4,4,FALSE)="品",VLOOKUP(RC[-3],Sheet1!R2C8:R6C9,2,FALSE),RC[-3])&VLOOKUP(RC[-7],Sheet1!R2C1:R28C4,4,FALSE) -> 勇者试炼最高星数达到639星 | I421: 17 | J421: =VLOOKUP(RC[-9],Sheet1!R2C1:R28C6,6,FALSE) -> 威名
A422: 7 | B422: btn_battle | C422: 72 | D422: 1 | E422: 648 | F422: 19012 | G422: 2000 | H422: =VLOOKUP(RC[-7],Sheet1!R2C1:R28C4,2,FALSE)&VLOOKUP(RC[-7],Sheet1!R2C1:R28C4,3,FALSE)&IF(VLOOKUP(RC[-7],Sheet1!R2C1:R28C4,4,FALSE)="品",VLOOKUP(RC[-3],Sheet1!R2C8:R6C9,2,FALSE),RC[-3])&VLOOKUP(RC[-7],Sheet1!R2C1:R28C4,4,FALSE) -> 勇者试炼最高星数达到648星 | I422: 17 | J422: =VLOOKUP(RC[-9],Sheet1!R2C1:R28C6,6,FALSE) -> 威名
A423: 7 | B423: btn_battle | C423: 73 | D423: 1 | E423: 657 | F423: 19012 | G423: 2000 | H423: =VLOOKUP(RC[-7],Sheet1!R2C1:R28C4,2,FALSE)&VLOOKUP(RC[-7],Sheet1!R2C1:R28C4,3,FALSE)&IF(VLOOKUP(RC[-7],Sheet1!R2C1:R28C4,4,FALSE)="品",VLOOKUP(RC[-3],Sheet1!R2C8:R6C9,2,FALSE),RC[-3])&VLOOKUP(RC[-7],Sheet1!R2C1:R28C4,4,FALSE) -> 勇者试炼最高星数达到657星 | I423: 17 | J423: =VLOOKUP(RC[-9],Sheet1!R2C1:R28C6,6,FALSE) -> 威名
A424: 7 | B424: btn_battle | C424: 74 | D424: 1 | E424: 666 | F424: 19012 | G424: 2000 | H424: =VLOOKUP(RC[-7],Sheet1!R2C1:R28C4,2,FALSE)&VLOOKUP(RC[-7],Sheet1!R2C1:R28C4,3,FALSE)&IF(VLOOKUP(RC[-7],Sheet1!R2C1:R28C4,4,FALSE)="品",VLOOKUP(RC[-3],Sheet1!R2C8:R6C9,2,FALSE),RC[-3])&VLOOKUP(RC[-7],Sheet1!R2C1:R28C4,4,FALSE) -> 勇者试炼最高星数达到666星 | I424: 17 | J424: =VLOOKUP(RC[-9],Sheet1!R2C1:R28C6,6,FALSE) -> 威名
A425: 7 | B425: btn_battle | C425: 75 | D425: 1 | E425: 675 | F425: 19012 | G425: 2000 | H425: =VLOOKUP(RC[-7],Sheet1!R2C1:R28C4,2,FALSE)&VLOOKUP(RC[-7],Sheet1!R2C1:R28C4,3,FALSE)&IF(VLOOKUP(RC[-7],Sheet1!R2C1:R28C4,4,FALSE)="品",VLOOKUP(RC[-3],Sheet1!R2C8:R6C9,2,FALSE),RC[-3])&VLOOKUP(RC[-7],Sheet1!R2C1:R28C4,4,FALSE) -> 勇者试炼最高星数达到675星 | I425: 17 | J425: =VLOOKUP(RC[-9],Sheet1!R2C1:R28C6,6,FALSE) -> 威名
A426: 7 | B426: btn_battle | C426: 76 | D426: 1 | E426: 684 | F426: 19012 | G426: 2500 | H426: =VLOOKUP(RC[-7],Sheet1!R2C1:R28C4,2,FALSE)&VLOOKUP(RC[-7],Sheet1!R2C1:R28C4,3,FALSE)&IF(VLOOKUP(RC[-7],Sheet1!R2C1:R28C4,4,FALSE)="品",VLOOKUP(RC[-3],Sheet1!R2C8:R6C9,2,FALSE),RC[-3])&VLOOKUP(RC[-7],Sheet1!R2C1:R28C4,4,FALSE) -> 勇者试炼最高星数达到684星 | I426: 17 | J426: =VLOOKUP(RC[-9],Sheet1!R2C1:R28C6,6,FALSE) -> 威名
A427: 7 | B427: btn_battle | C427: 77 | D427: 1 | E427: 693 | F427: 19012 | G427: 2500 | H427: =VLOOKUP(RC[-7],Sheet1!R2C1:R28C4,2,FALSE)&VLOOKUP(RC[-7],Sheet1!R2C1:R28C4,3,FALSE)&IF(VLOOKUP(RC[-7],Sheet1!R2C1:R28C4,4,FALSE)="品",VLOOKUP(RC[-3],Sheet1!R2C8:R6C9,2,FALSE),RC[-3])&VLOOKUP(RC[-7],Sheet1!R2C1:R28C4,4,FALSE) -> 勇者试炼最高星数达到693星 | I427: 17 | J427: =VLOOKUP(RC[-9],Sheet1!R2C1:R28C6,6,FALSE) -> 威名
A428: 7 | B428: btn_battle | C428: 78 | D428: 1 | E428: 702 | F428: 19012 | G428: 2500 | H428: =VLOOKUP(RC[-7],Sheet1!R2C1:R28C4,2,FALSE)&VLOOKUP(RC[-7],Sheet1!R2C1:R28C4,3,FALSE)&IF(VLOOKUP(RC[-7],Sheet1!R2C1:R28C4,4,FALSE)="品",VLOOKUP(RC[-3],Sheet1!R2C8:R6C9,2,FALSE),RC[-3])&VLOOKUP(RC[-7],Sheet1!R2C1:R28C4,4,FALSE) -> 勇者试炼最高星数达到702星 | I428: 17 | J428: =VLOOKUP(RC[-9],Sheet1!R2C1:R28C6,6,FALSE) -> 威名
A429: 7 | B429: btn_battle | C429: 79 | D429: 1 | E429: 711 | F429: 19012 | G429: 2500 | H429: =VLOOKUP(RC[-7],Sheet1!R2C1:R28C4,2,FALSE)&VLOOKUP(RC[-7],Sheet1!R2C1:R28C4,3,FALSE)&IF(VLOOKUP(RC[-7],Sheet1!R2C1:R28C4,4,FALSE)="品",VLOOKUP(RC[-3],Sheet1!R2C8:R6C9,2,FALSE),RC[-3])&VLOOKUP(RC[-7],Sheet1!R2C1:R28C4,4,FALSE) -> 勇者试炼最高星数达到711星 | I429: 17 | J429: =VLOOKUP(RC[-9],Sheet1!R2C1:R28C6,6,FALSE) -> 威名
A430: 7 | B430: btn_battle | C430: 80 | D430: 1 | E430: 720 | F430: 19012 | G430: 2500 | H430: =VLOOKUP(RC[-7],Sheet1!R2C1:R28C4,2,FALSE)&VLOOKUP(RC[-7],Sheet1!R2C1:R28C4,3,FALSE)&IF(VLOOKUP(RC[-7],Sheet1!R2C1:R28C4,4,FALSE)="品",VLOOKUP(RC[-3],Sheet1!R2C8:R6C9,2,FALSE),RC[-3])&VLOOKUP(RC[-7],Sheet1!R2C1:R28C4,4,FALSE) -> 勇者试炼最高星数达到720星 | I430: 17 | J430: =VLOOKUP(RC[-9],Sheet1!R2C1:R28C6,6,FALSE) -> 威名
A431: 7 | B431: btn_battle | C431: 81 | D431: 1 | E431: 729 | F431: 19012 | G431: 3000 | H431: =VLOOKUP(RC[-7],Sheet1!R2C1:R28C4,2,FALSE)&VLOOKUP(RC[-7],Sheet1!R2C1:R28C4,3,FALSE)&IF(VLOOKUP(RC[-7],Sheet1!R2C1:R28C4,4,FALSE)="品",VLOOKUP(RC[-3],Sheet1!R2C8:R6C9,2,FALSE),RC[-3])&VLOOKUP(RC[-7],Sheet1!R2C1:R28C4,4,FALSE) -> 勇者试炼最高星数达到729星 | I431: 17 | J431: =VLOOKUP(RC[-9],Sheet1!R2C1:R28C6,6,FALSE) -> 威名
A432: 7 | B432: btn_battle | C432: 82 | D432: 1 | E432: 738 | F432: 19012 | G432: 3000 | H432: =VLOOKUP(RC[-7],Sheet1!R2C1:R28C4,2,FALSE)&VLOOKUP(RC[-7],Sheet1!R2C1:R28C4,3,FALSE)&IF(VLOOKUP(RC[-7],Sheet1!R2C1:R28C4,4,FALSE)="品",VLOOKUP(RC[-3],Sheet1!R2C8:R6C9,2,FALSE),RC[-3])&VLOOKUP(RC[-7],Sheet1!R2C1:R28C4,4,FALSE) -> 勇者试炼最高星数达到738星 | I432: 17 | J432: =VLOOKUP(RC[-9],Sheet1!R2C1:R28C6,6,FALSE) -> 威名
A433: 7 | B433: btn_battle | C433: 83 | D433: 1 | E433: 747 | F433: 19012 | G433: 3000 | H433: =VLOOKUP(RC[-7],Sheet1!R2C1:R28C4,2,FALSE)&VLOOKUP(RC[-7],Sheet1!R2C1:R28C4,3,FALSE)&IF(VLOOKUP(RC[-7],Sheet1!R2C1:R28C4,4,FALSE)="品",VLOOKUP(RC[-3],Sheet1!R2C8:R6C9,2,FALSE),RC[-3])&VLOOKUP(RC[-7],Sheet1!R2C1:R28C4,4,FALSE) -> 勇者试炼最高星数达到747星 | I433: 17 | J433: =VLOOKUP(RC[-9],Sheet1!R2C1:R28C6,6,FALSE) -> 威名
A434: 7 | B434: btn_battle | C434: 84 | D434: 1 | E434: 756 | F434: 19012 | G434: 3000 | H434: =VLOOKUP(RC[-7],Sheet1!R2C1:R28C4,2,FALSE)&VLOOKUP(RC[-7],Sheet1!R2C1:R28C4,3,FALSE)&IF(VLOOKUP(RC[-7],Sheet1!R2C1:R28C4,4,FALSE)="品",VLOOKUP(RC[-3],Sheet1!R2C8:R6C9,2,FALSE),RC[-3])&VLOOKUP(RC[-7],Sheet1!R2C1:R28C4,4,FALSE) -> 勇者试炼最高星数达到756星 | I434: 17 | J434: =VLOOKUP(RC[-9],Sheet1!R2C1:R28C6,6,FALSE) -> 威名
A435: 7 | B435: btn_battle | C435: 85 | D435: 1 | E435: 765 | F435: 19012 | G435: 3000 | H435: =VLOOKUP(RC[-7],Sheet1!R2C1:R28C4,2,FALSE)&VLOOKUP(RC[-7],Sheet1!R2C1:R28C4,3,FALSE)&IF(VLOOKUP(RC[-7],Sheet1!R2C1:R28C4,4,FALSE)="品",VLOOKUP(RC[-3],Sheet1!R2C8:R6C9,2,FALSE),RC[-3])&VLOOKUP(RC[-7],Sheet1!R2C1:R28C4,4,FALSE) -> 勇者试炼最高星数达到765星 | I435: 17 | J435: =VLOOKUP(RC[-9],Sheet1!R2C1:R28C6,6,FALSE) -> 威名
A436: 7 | B436: btn_battle | C436: 86 | D436: 1 | E436: 774 | F436: 19012 | G436: 3500 | H436: =VLOOKUP(RC[-7],Sheet1!R2C1:R28C4,2,FALSE)&VLOOKUP(RC[-7],Sheet1!R2C1:R28C4,3,FALSE)&IF(VLOOKUP(RC[-7],Sheet1!R2C1:R28C4,4,FALSE)="品",VLOOKUP(RC[-3],Sheet1!R2C8:R6C9,2,FALSE),RC[-3])&VLOOKUP(RC[-7],Sheet1!R2C1:R28C4,4,FALSE) -> 勇者试炼最高星数达到774星 | I436: 17 | J436: =VLOOKUP(RC[-9],Sheet1!R2C1:R28C6,6,FALSE) -> 威名
A437: 7 | B437: btn_battle | C437: 87 | D437: 1 | E437: 783 | F437: 19012 | G437: 3500 | H437: =VLOOKUP(RC[-7],Sheet1!R2C1:R28C4,2,FALSE)&VLOOKUP(RC[-7],Sheet1!R2C1:R28C4,3,FALSE)&IF(VLOOKUP(RC[-7],Sheet1!R2C1:R28C4,4,FALSE)="品",VLOOKUP(RC[-3],Sheet1!R2C8:R6C9,2,FALSE),RC[-3])&VLOOKUP(RC[-7],Sheet1!R2C1:R28C4,4,FALSE) -> 勇者试炼最高星数达到783星 | I437: 17 | J437: =VLOOKUP(RC[-9],Sheet1!R2C1:R28C6,6,FALSE) -> 威名
A438: 7 | B438: btn_battle | C438: 88 | D438: 1 | E438: 792 | F438: 19012 | G438: 3500 | H438: =VLOOKUP(RC[-7],Sheet1!R2C1:R28C4,2,FALSE)&VLOOKUP(RC[-7],Sheet1!R2C1:R28C4,3,FALSE)&IF(VLOOKUP(RC[-7],Sheet1!R2C1:R28C4,4,FALSE)="品",VLOOKUP(RC[-3],Sheet1!R2C8:R6C9,2,FALSE),RC[-3])&VLOOKUP(RC[-7],Sheet1!R2C1:R28C4,4,FALSE) -> 勇者试炼最高星数达到792星 | I438: 17 | J438: =VLOOKUP(RC[-9],Sheet1!R2C1:R28C6,6,FALSE) -> 威名
A439: 7 | B439: btn_battle | C439: 89 | D439: 1 | E439: 801 | F439: 19012 | G439: 3500 | H439: =VLOOKUP(RC[-7],Sheet1!R2C1:R28C4,2,FALSE)&VLOOKUP(RC[-7],Sheet1!R2C1:R28C4,3,FALSE)&IF(VLOOKUP(RC[-7],Sheet1!R2C1:R28C4,4,FALSE)="品",VLOOKUP(RC[-3],Sheet1!R2C8:R6C9,2,FALSE),RC[-3])&VLOOKUP(RC[-7],Sheet1!R2C1:R28C4,4,FALSE) -> 勇者试炼最高星数达到801星 | I439: 17 | J439: =VLOOKUP(RC[-9],Sheet1!R2C1:R28C6,6,FALSE) -> 威名
A440: 7 | B440: btn_battle | C440: 90 | D440: 1 | E440: 810 | F440: 19012 | G440: 3500 | H440: =VLOOKUP(RC[-7],Sheet1!R2C1:R28C4,2,FALSE)&VLOOKUP(RC[-7],Sheet1!R2C1:R28C4,3,FALSE)&IF(VLOOKUP(RC[-7],Sheet1!R2C1:R28C4,4,FALSE)="品",VLOOKUP(RC[-3],Sheet1!R2C8:R6C9,2,FALSE),RC[-3])&VLOOKUP(RC[-7],Sheet1!R2C1:R28C4,4,FALSE) -> 勇者试炼最高星数达到810星 | I440: 17 | J440: =VLOOKUP(RC[-9],Sheet1!R2C1:R28C6,6,FALSE) -> 威名
A441: 7 | B441: btn_battle | C441: 91 | D441: 1 | E441: 819 | F441: 19012 | G441: 4000 | H441: =VLOOKUP(RC[-7],Sheet1!R2C1:R28C4,2,FALSE)&VLOOKUP(RC[-7],Sheet1!R2C1:R28C4,3,FALSE)&IF(VLOOKUP(RC[-7],Sheet1!R2C1:R28C4,4,FALSE)="品",VLOOKUP(RC[-3],Sheet1!R2C8:R6C9,2,FALSE),RC[-3])&VLOOKUP(RC[-7],Sheet1!R2C1:R28C4,4,FALSE) -> 勇者试炼最高星数达到819星 | I441: 17 | J441: =VLOOKUP(RC[-9],Sheet1!R2C1:R28C6,6,FALSE) -> 威名
A442: 7 | B442: btn_battle | C442: 92 | D442: 1 | E442: 828 | F442: 19012 | G442: 4000 | H442: =VLOOKUP(RC[-7],Sheet1!R2C1:R28C4,2,FALSE)&VLOOKUP(RC[-7],Sheet1!R2C1:R28C4,3,FALSE)&IF(VLOOKUP(RC[-7],Sheet1!R2C1:R28C4,4,FALSE)="品",VLOOKUP(RC[-3],Sheet1!R2C8:R6C9,2,FALSE),RC[-3])&VLOOKUP(RC[-7],Sheet1!R2C1:R28C4,4,FALSE) -> 勇者试炼最高星数达到828星 | I442: 17 | J442: =VLOOKUP(RC[-9],Sheet1!R2C1:R28C6,6,FALSE) -> 威名
A443: 7 | B443: btn_battle | C443: 93 | D443: 1 | E443: 837 | F443: 19012 | G443: 4000 | H443: =VLOOKUP(RC[-7],Sheet1!R2C1:R28C4,2,FALSE)&VLOOKUP(RC[-7],Sheet1!R2C1:R28C4,3,FALSE)&IF(VLOOKUP(RC[-7],Sheet1!R2C1:R28C4,4,FALSE)="品",VLOOKUP(RC[-3],Sheet1!R2C8:R6C9,2,FALSE),RC[-3])&VLOOKUP(RC[-7],Sheet1!R2C1:R28C4,4,FALSE) -> 勇者试炼最高星数达到837星 | I443: 17 | J443: =VLOOKUP(RC[-9],Sheet1!R2C1:R28C6,6,FALSE) -> 威名
A444: 7 | B444: btn_battle | C444: 94 | D444: 1 | E444: 846 | F444: 19012 | G444: 4000 | H444: =VLOOKUP(RC[-7],Sheet1!R2C1:R28C4,2,FALSE)&VLOOKUP(RC[-7],Sheet1!R2C1:R28C4,3,FALSE)&IF(VLOOKUP(RC[-7],Sheet1!R2C1:R28C4,4,FALSE)="品",VLOOKUP(RC[-3],Sheet1!R2C8:R6C9,2,FALSE),RC[-3])&VLOOKUP(RC[-7],Sheet1!R2C1:R28C4,4,FALSE) -> 勇者试炼最高星数达到846星 | I444: 17 | J444: =VLOOKUP(RC[-9],Sheet1!R2C1:R28C6,6,FALSE) -> 威名
A445: 7 | B445: btn_battle | C445: 95 | D445: 1 | E445: 855 | F445: 19012 | G445: 4000 | H445: =VLOOKUP(RC[-7],Sheet1!R2C1:R28C4,2,FALSE)&VLOOKUP(RC[-7],Sheet1!R2C1:R28C4,3,FALSE)&IF(VLOOKUP(RC[-7],Sheet1!R2C1:R28C4,4,FALSE)="品",VLOOKUP(RC[-3],Sheet1!R2C8:R6C9,2,FALSE),RC[-3])&VLOOKUP(RC[-7],Sheet1!R2C1:R28C4,4,FALSE) -> 勇者试炼最高星数达到855星 | I445: 17 | J445: =VLOOKUP(RC[-9],Sheet1!R2C1:R28C6,6,FALSE) -> 威名
A446: 7 | B446: btn_battle | C446: 96 | D446: 1 | E446: 864 | F446: 19012 | G446: 5000 | H446: =VLOOKUP(RC[-7],Sheet1!R2C1:R28C4,2,FALSE)&VLOOKUP(RC[-7],Sheet1!R2C1:R28C4,3,FALSE)&IF(VLOOKUP(RC[-7],Sheet1!R2C1:R28C4,4,FALSE)="品",VLOOKUP(RC[-3],Sheet1!R2C8:R6C9,2,FALSE),RC[-3])&VLOOKUP(RC[-7],Sheet1!R2C1:R28C4,4,FALSE) -> 勇者试炼最高星数达到864星 | I446: 17 | J446: =VLOOKUP(RC[-9],Sheet1!R2C1:R28C6,6,FALSE) -> 威名
A447: 7 | B447: btn_battle | C447: 97 | D447: 1 | E447: 873 | F447: 19012 | G447: 5000 | H447: =VLOOKUP(RC[-7],Sheet1!R2C1:R28C4,2,FALSE)&VLOOKUP(RC[-7],Sheet1!R2C1:R28C4,3,FALSE)&IF(VLOOKUP(RC[-7],Sheet1!R2C1:R28C4,4,FALSE)="品",VLOOKUP(RC[-3],Sheet1!R2C8:R6C9,2,FALSE),RC[-3])&VLOOKUP(RC[-7],Sheet1!R2C1:R28C4,4,FALSE) -> 勇者试炼最高星数达到873星 | I447: 17 | J447: =VLOOKUP(RC[-9],Sheet1!R2C1:R28C6,6,FALSE) -> 威名
A448: 7 | B448: btn_battle | C448: 98 | D448: 1 | E448: 882 | F448: 19012 | G448: 5000 | H448: =VLOOKUP(RC[-7],Sheet1!R2C1:R28C4,2,FALSE)&VLOOKUP(RC[-7],Sheet1!R2C1:R28C4,3,FALSE)&IF(VLOOKUP(RC[-7],Sheet1!R2C1:R28C4,4,FALSE)="品",VLOOKUP(RC[-3],Sheet1!R2C8:R6C9,2,FALSE),RC[-3])&VLOOKUP(RC[-7],Sheet1!R2C1:R28C4,4,FALSE) -> 勇者试炼最高星数达到882星 | I448: 17 | J448: =VLOOKUP(RC[-9],Sheet1!R2C1:R28C6,6,FALSE) -> 威名
A449: 7 | B449: btn_battle | C449: 99 | D449: 1 | E449: 891 | F449: 19012 | G449: 5000 | H449: =VLOOKUP(RC[-7],Sheet1!R2C1:R28C4,2,FALSE)&VLOOKUP(RC[-7],Sheet1!R2C1:R28C4,3,FALSE)&IF(VLOOKUP(RC[-7],Sheet1!R2C1:R28C4,4,FALSE)="品",VLOOKUP(RC[-3],Sheet1!R2C8:R6C9,2,FALSE),RC[-3])&VLOOKUP(RC[-7],Sheet1!R2C1:R28C4,4,FALSE) -> 勇者试炼最高星数达到891星 | I449: 17 | J449: =VLOOKUP(RC[-9],Sheet1!R2C1:R28C6,6,FALSE) -> 威名
A450: 7 | B450: btn_battle | C450: 100 | D450: 1 | E450: 900 | F450: 19012 | G450: 5000 | H450: =VLOOKUP(RC[-7],Sheet1!R2C1:R28C4,2,FALSE)&VLOOKUP(RC[-7],Sheet1!R2C1:R28C4,3,FALSE)&IF(VLOOKUP(RC[-7],Sheet1!R2C1:R28C4,4,FALSE)="品",VLOOKUP(RC[-3],Sheet1!R2C8:R6C9,2,FALSE),RC[-3])&VLOOKUP(RC[-7],Sheet1!R2C1:R28C4,4,FALSE) -> 勇者试炼最高星数达到900星 | I450: 17 | J450: =VLOOKUP(RC[-9],Sheet1!R2C1:R28C6,6,FALSE) -> 威名
A451: 8 | B451: btn_hero | C451: 1 | D451: 1 | E451: 10000 | F451: 19003 | G451: 10000 | H451: =VLOOKUP(RC[-7],Sheet1!R2C1:R28C4,2,FALSE)&VLOOKUP(RC[-7],Sheet1!R2C1:R28C4,3,FALSE)&IF(VLOOKUP(RC[-7],Sheet1!R2C1:R28C4,4,FALSE)="品",VLOOKUP(RC[-3],Sheet1!R2C8:R6C9,2,FALSE),RC[-3])&VLOOKUP(RC[-7],Sheet1!R2C1:R28C4,4,FALSE) -> 战队战斗力达到10000 | I451: 7 | J451: =VLOOKUP(RC[-9],Sheet1!R2C1:R28C6,6,FALSE) -> 金币
A452: 8 | B452: btn_hero | C452: 2 | D452: 1 | E452: 20000 | F452: 19003 | G452: 20000 | H452: =VLOOKUP(RC[-7],Sheet1!R2C1:R28C4,2,FALSE)&VLOOKUP(RC[-7],Sheet1!R2C1:R28C4,3,FALSE)&IF(VLOOKUP(RC[-7],Sheet1!R2C1:R28C4,4,FALSE)="品",VLOOKUP(RC[-3],Sheet1!R2C8:R6C9,2,FALSE),RC[-3])&VLOOKUP(RC[-7],Sheet1!R2C1:R28C4,4,FALSE) -> 战队战斗力达到20000 | I452: 7 | J452: =VLOOKUP(RC[-9],Sheet1!R2C1:R28C6,6,FALSE) -> 金币
A453: 8 | B453: btn_hero | C453: 3 | D453: 1 | E453: 30000 | F453: 19003 | G453: 30000 | H453: =VLOOKUP(RC[-7],Sheet1!R2C1:R28C4,2,FALSE)&VLOOKUP(RC[-7],Sheet1!R2C1:R28C4,3,FALSE)&IF(VLOOKUP(RC[-7],Sheet1!R2C1:R28C4,4,FALSE)="品",VLOOKUP(RC[-3],Sheet1!R2C8:R6C9,2,FALSE),RC[-3])&VLOOKUP(RC[-7],Sheet1!R2C1:R28C4,4,FALSE) -> 战队战斗力达到30000 | I453: 7 | J453: =VLOOKUP(RC[-9],Sheet1!R2C1:R28C6,6,FALSE) -> 金币
A454: 8 | B454: btn_hero | C454: 4 | D454: 1 | E454: 40000 | F454: 19003 | G454: 40000 | H454: =VLOOKUP(RC[-7],Sheet1!R2C1:R28C4,2,FALSE)&VLOOKUP(RC[-7],Sheet1!R2C1:R28C4,3,FALSE)&IF(VLOOKUP(RC[-7],Sheet1!R2C1:R28C4,4,FALSE)="品",VLOOKUP(RC[-3],Sheet1!R2C8:R6C9,2,FALSE),RC[-3])&VLOOKUP(RC[-7],Sheet1!R2C1:R28C4,4,FALSE) -> 战队战斗力达到40000 | I454: 7 | J454: =VLOOKUP(RC[-9],Sheet1!R2C1:R28C6,6,FALSE) -> 金币
A455: 8 | B455: btn_hero | C455: 5 | D455: 1 | E455: 50000 | F455: 19003 | G455: 50000 | H455: =VLOOKUP(RC[-7],Sheet1!R2C1:R28C4,2,FALSE)&VLOOKUP(RC[-7],Sheet1!R2C1:R28C4,3,FALSE)&IF(VLOOKUP(RC[-7],Sheet1!R2C1:R28C4,4,FALSE)="品",VLOOKUP(RC[-3],Sheet1!R2C8:R6C9,2,FALSE),RC[-3])&VLOOKUP(RC[-7],Sheet1!R2C1:R28C4,4,FALSE) -> 战队战斗力达到50000 | I455: 7 | J455: =VLOOKUP(RC[-9],Sheet1!R2C1:R28C6,6,FALSE) -> 金币
A456: 8 | B456: btn_hero | C456: 6 | D456: 1 | E456: 100000 | F456: 19003 | G456: 100000 | H456: =VLOOKUP(RC[-7],Sheet1!R2C1:R28C4,2,FALSE)&VLOOKUP(RC[-7],Sheet1!R2C1:R28C4,3,FALSE)&IF(VLOOKUP(RC[-7],Sheet1!R2C1:R28C4,4,FALSE)="品",VLOOKUP(RC[-3],Sheet1!R2C8:R6C9,2,FALSE),RC[-3])&VLOOKUP(RC[-7],Sheet1!R2C1:R28C4,4,FALSE) -> 战队战斗力达到100000 | I456: 7 | J456: =VLOOKUP(RC[-9],Sheet1!R2C1:R28C6,6,FALSE) -> 金币
A457: 8 | B457: btn_hero | C457: 7 | D457: 1 | E457: 150000 | F457: 19003 | G457: 100000 | H457: =VLOOKUP(RC[-7],Sheet1!R2C1:R28C4,2,FALSE)&VLOOKUP(RC[-7],Sheet1!R2C1:R28C4,3,FALSE)&IF(VLOOKUP(RC[-7],Sheet1!R2C1:R28C4,4,FALSE)="品",VLOOKUP(RC[-3],Sheet1!R2C8:R6C9,2,FALSE),RC[-3])&VLOOKUP(RC[-7],Sheet1!R2C1:R28C4,4,FALSE) -> 战队战斗力达到150000 | I457: 7 | J457: =VLOOKUP(RC[-9],Sheet1!R2C1:R28C6,6,FALSE) -> 金币
A458: 8 | B458: btn_hero | C458: 8 | D458: 1 | E458: 200000 | F458: 19003 | G458: 100000 | H458: =VLOOKUP(RC[-7],Sheet1!R2C1:R28C4,2,FALSE)&VLOOKUP(RC[-7],Sheet1!R2C1:R28C4,3,FALSE)&IF(VLOOKUP(RC[-7],Sheet1!R2C1:R28C4,4,FALSE)="品",VLOOKUP(RC[-3],Sheet1!R2C8:R6C9,2,FALSE),RC[-3])&VLOOKUP(RC[-7],Sheet1!R2C1:R28C4,4,FALSE) -> 战队战斗力达到200000 | I458: 7 | J458: =VLOOKUP(RC[-9],Sheet1!R2C1:R28C6,6,FALSE) -> 金币
A459: 8 | B459: btn_hero | C459: 9 | D459: 1 | E459: 300000 | F459: 19003 | G459: 100000 | H459: =VLOOKUP(RC[-7],Sheet1!R2C1:R28C4,2,FALSE)&VLOOKUP(RC[-7],Sheet1!R2C1:R28C4,3,FALSE)&IF(VLOOKUP(RC[-7],Sheet1!R2C1:R28C4,4,FALSE)="品",VLOOKUP(RC[-3],Sheet1!R2C8:R6C9,2,FALSE),RC[-3])&VLOOKUP(RC[-7],Sheet1!R2C1:R28C4,4,FALSE) -> 战队战斗力达到300000 | I459: 7 | J459: =VLOOKUP(RC[-9],Sheet1!R2C1:R28C6,6,FALSE) -> 金币
A460: 8 | B460: btn_hero | C460: 10 | D460: 1 | E460: 400000 | F460: 19003 | G460: 100000 | H460: =VLOOKUP(RC[-7],Sheet1!R2C1:R28C4,2,FALSE)&VLOOKUP(RC[-7],Sheet1!R2C1:R28C4,3,FALSE)&IF(VLOOKUP(RC[-7],Sheet1!R2C1:R28C4,4,FALSE)="品",VLOOKUP(RC[-3],Sheet1!R2C8:R6C9,2,FALSE),RC[-3])&VLOOKUP(RC[-7],Sheet1!R2C1:R28C4,4,FALSE) -> 战队战斗力达到400000 | I460: 7 | J460: =VLOOKUP(RC[-9],Sheet1!R2C1:R28C6,6,FALSE) -> 金币
A461: 8 | B461: btn_hero | C461: 11 | D461: 1 | E461: 500000 | F461: 19003 | G461: 200000 | H461: =VLOOKUP(RC[-7],Sheet1!R2C1:R28C4,2,FALSE)&VLOOKUP(RC[-7],Sheet1!R2C1:R28C4,3,FALSE)&IF(VLOOKUP(RC[-7],Sheet1!R2C1:R28C4,4,FALSE)="品",VLOOKUP(RC[-3],Sheet1!R2C8:R6C9,2,FALSE),RC[-3])&VLOOKUP(RC[-7],Sheet1!R2C1:R28C4,4,FALSE) -> 战队战斗力达到500000 | I461: 7 | J461: =VLOOKUP(RC[-9],Sheet1!R2C1:R28C6,6,FALSE) -> 金币
A462: 8 | B462: btn_hero | C462: 12 | D462: 1 | E462: 750000 | F462: 19003 | G462: 200000 | H462: =VLOOKUP(RC[-7],Sheet1!R2C1:R28C4,2,FALSE)&VLOOKUP(RC[-7],Sheet1!R2C1:R28C4,3,FALSE)&IF(VLOOKUP(RC[-7],Sheet1!R2C1:R28C4,4,FALSE)="品",VLOOKUP(RC[-3],Sheet1!R2C8:R6C9,2,FALSE),RC[-3])&VLOOKUP(RC[-7],Sheet1!R2C1:R28C4,4,FALSE) -> 战队战斗力达到750000 | I462: 7 | J462: =VLOOKUP(RC[-9],Sheet1!R2C1:R28C6,6,FALSE) -> 金币
A463: 8 | B463: btn_hero | C463: 13 | D463: 1 | E463: 1000000 | F463: 19003 | G463: 200000 | H463: =VLOOKUP(RC[-7],Sheet1!R2C1:R28C4,2,FALSE)&VLOOKUP(RC[-7],Sheet1!R2C1:R28C4,3,FALSE)&IF(VLOOKUP(RC[-7],Sheet1!R2C1:R28C4,4,FALSE)="品",VLOOKUP(RC[-3],Sheet1!R2C8:R6C9,2,FALSE),RC[-3])&VLOOKUP(RC[-7],Sheet1!R2C1:R28C4,4,FALSE) -> 战队战斗力达到1000000 | I463: 7 | J463: =VLOOKUP(RC[-9],Sheet1!R2C1:R28C6,6,FALSE) -> 金币
A464: 8 | B464: btn_hero | C464: 14 | D464: 1 | E464: 1500000 | F464: 19003 | G464: 200000 | H464: =VLOOKUP(RC[-7],Sheet1!R2C1:R28C4,2,FALSE)&VLOOKUP(RC[-7],Sheet1!R2C1:R28C4,3,FALSE)&IF(VLOOKUP(RC[-7],Sheet1!R2C1:R28C4,4,FALSE)="品",VLOOKUP(RC[-3],Sheet1!R2C8:R6C9,2,FALSE),RC[-3])&VLOOKUP(RC[-7],Sheet1!R2C1:R28C4,4,FALSE) -> 战队战斗力达到1500000 | I464: 7 | J464: =VLOOKUP(RC[-9],Sheet1!R2C1:R28C6,6,FALSE) -> 金币
A465: 8 | B465: btn_hero | C465: 15 | D465: 1 | E465: 2000000 | F465: 19003 | G465: 200000 | H465: =VLOOKUP(RC[-7],Sheet1!R2C1:R28C4,2,FALSE)&VLOOKUP(RC[-7],Sheet1!R2C1:R28C4,3,FALSE)&IF(VLOOKUP(RC[-7],Sheet1!R2C1:R28C4,4,FALSE)="品",VLOOKUP(RC[-3],Sheet1!R2C8:R6C9,2,FALSE),RC[-3])&VLOOKUP(RC[-7],Sheet1!R2C1:R28C4,4,FALSE) -> 战队战斗力达到2000000 | I465: 7 | J465: =VLOOKUP(RC[-9],Sheet1!R2C1:R28C6,6,FALSE) -> 金币
A466: 8 | B466: btn_hero | C466: 16 | D466: 1 | E466: 3000000 | F466: 19003 | G466: 500000 | H466: =VLOOKUP(RC[-7],Sheet1!R2C1:R28C4,2,FALSE)&VLOOKUP(RC[-7],Sheet1!R2C1:R28C4,3,FALSE)&IF(VLOOKUP(RC[-7],Sheet1!R2C1:R28C4,4,FALSE)="品",VLOOKUP(RC[-3],Sheet1!R2C8:R6C9,2,FALSE),RC[-3])&VLOOKUP(RC[-7],Sheet1!R2C1:R28C4,4,FALSE) -> 战队战斗力达到3000000 | I466: 7 | J466: =VLOOKUP(RC[-9],Sheet1!R2C1:R28C6,6,FALSE) -> 金币
A467: 8 | B467: btn_hero | C467: 17 | D467: 1 | E467: 4000000 | F467: 19003 | G467: 500000 | H467: =VLOOKUP(RC[-7],Sheet1!R2C1:R28C4,2,FALSE)&VLOOKUP(RC[-7],Sheet1!R2C1:R28C4,3,FALSE)&IF(VLOOKUP(RC[-7],Sheet1!R2C1:R28C4,4,FALSE)="品",VLOOKUP(RC[-3],Sheet1!R2C8:R6C9,2,FALSE),RC[-3])&VLOOKUP(RC[-7],Sheet1!R2C1:R28C4,4,FALSE) -> 战队战斗力达到4000000 | I467: 7 | J467: =VLOOKUP(RC[-9],Sheet1!R2C1:R28C6,6,FALSE) -> 金币
A468: 8 | B468: btn_hero | C468: 18 | D468: 1 | E468: 5000000 | F468: 19003 | G468: 500000 | H468: =VLOOKUP(RC[-7],Sheet1!R2C1:R28C4,2,FALSE)&VLOOKUP(RC[-7],Sheet1!R2C1:R28C4,3,FALSE)&IF(VLOOKUP(RC[-7],Sheet1!R2C1:R28C4,4,FALSE)="品",VLOOKUP(RC[-3],Sheet1!R2C8:R6C9,2,FALSE),RC[-3])&VLOOKUP(RC[-7],Sheet1!R2C1:R28C4,4,FALSE) -> 战队战斗力达到5000000 | I468: 7 | J468: =VLOOKUP(RC[-9],Sheet1!R2C1:R28C6,6,FALSE) -> 金币
A469: 8 | B469: btn_hero | C469: 19 | D469: 1 | E469: 6000000 | F469: 19003 | G469: 500000 | H469: =VLOOKUP(RC[-7],Sheet1!R2C1:R28C4,2,FALSE)&VLOOKUP(RC[-7],Sheet1!R2C1:R28C4,3,FALSE)&IF(VLOOKUP(RC[-7],Sheet1!R2C1:R28C4,4,FALSE)="品",VLOOKUP(RC[-3],Sheet1!R2C8:R6C9,2,FALSE),RC[-3])&VLOOKUP(RC[-7],Sheet1!R2C1:R28C4,4,FALSE) -> 战队战斗力达到6000000 | I469: 7 | J469: =VLOOKUP(RC[-9],Sheet1!R2C1:R28C6,6,FALSE) -> 金币
A470: 8 | B470: btn_hero | C470: 20 | D470: 1 | E470: 7000000 | F470: 19003 | G470: 500000 | H470: =VLOOKUP(RC[-7],Sheet1!R2C1:R28C4,2,FALSE)&VLOOKUP(RC[-7],Sheet1!R2C1:R28C4,3,FALSE)&IF(VLOOKUP(RC[-7],Sheet1!R2C1:R28C4,4,FALSE)="品",VLOOKUP(RC[-3],Sheet1!R2C8:R6C9,2,FALSE),RC[-3])&VLOOKUP(RC[-7],Sheet1!R2C1:R28C4,4,FALSE) -> 战队战斗力达到7000000 | I470: 7 | J470: =VLOOKUP(RC[-9],Sheet1!R2C1:R28C6,6,FALSE) -> 金币
A471: 8 | B471: btn_hero | C471: 21 | D471: 1 | E471: 8000000 | F471: 19003 | G471: 1000000 | H471: =VLOOKUP(RC[-7],Sheet1!R2C1:R28C4,2,FALSE)&VLOOKUP(RC[-7],Sheet1!R2C1:R28C4,3,FALSE)&IF(VLOOKUP(RC[-7],Sheet1!R2C1:R28C4,4,FALSE)="品",VLOOKUP(RC[-3],Sheet1!R2C8:R6C9,2,FALSE),RC[-3])&VLOOKUP(RC[-7],Sheet1!R2C1:R28C4,4,FALSE) -> 战队战斗力达到8000000 | I471: 7 | J471: =VLOOKUP(RC[-9],Sheet1!R2C1:R28C6,6,FALSE) -> 金币
A472: 8 | B472: btn_hero | C472: 22 | D472: 1 | E472: 9000000 | F472: 19003 | G472: 1000000 | H472: =VLOOKUP(RC[-7],Sheet1!R2C1:R28C4,2,FALSE)&VLOOKUP(RC[-7],Sheet1!R2C1:R28C4,3,FALSE)&IF(VLOOKUP(RC[-7],Sheet1!R2C1:R28C4,4,FALSE)="品",VLOOKUP(RC[-3],Sheet1!R2C8:R6C9,2,FALSE),RC[-3])&VLOOKUP(RC[-7],Sheet1!R2C1:R28C4,4,FALSE) -> 战队战斗力达到9000000 | I472: 7 | J472: =VLOOKUP(RC[-9],Sheet1!R2C1:R28C6,6,FALSE) -> 金币
A473: 8 | B473: btn_hero | C473: 23 | D473: 1 | E473: 10000000 | F473: 19003 | G473: 1000000 | H473: =VLOOKUP(RC[-7],Sheet1!R2C1:R28C4,2,FALSE)&VLOOKUP(RC[-7],Sheet1!R2C1:R28C4,3,FALSE)&IF(VLOOKUP(RC[-7],Sheet1!R2C1:R28C4,4,FALSE)="品",VLOOKUP(RC[-3],Sheet1!R2C8:R6C9,2,FALSE),RC[-3])&VLOOKUP(RC[-7],Sheet1!R2C1:R28C4,4,FALSE) -> 战队战斗力达到10000000 | I473: 7 | J473: =VLOOKUP(RC[-9],Sheet1!R2C1:R28C6,6,FALSE) -> 金币
A474: 8 | B474: btn_hero | C474: 24 | D474: 1 | E474: 15000000 | F474: 19003 | G474: 1000000 | H474: =VLOOKUP(RC[-7],Sheet1!R2C1:R28C4,2,FALSE)&VLOOKUP(RC[-7],Sheet1!R2C1:R28C4,3,FALSE)&IF(VLOOKUP(RC[-7],Sheet1!R2C1:R28C4,4,FALSE)="品",VLOOKUP(RC[-3],Sheet1!R2C8:R6C9,2,FALSE),RC[-3])&VLOOKUP(RC[-7],Sheet1!R2C1:R28C4,4,FALSE) -> 战队战斗力达到15000000 | I474: 7 | J474: =VLOOKUP(RC[-9],Sheet1!R2C1:R28C6,6,FALSE) -> 金币
A475: 8 | B475: btn_hero | C475: 25 | D475: 1 | E475: 20000000 | F475: 19003 | G475: 1000000 | H475: =VLOOKUP(RC[-7],Sheet1!R2C1:R28C4,2,FALSE)&VLOOKUP(RC[-7],Sheet1!R2C1:R28C4,3,FALSE)&IF(VLOOKUP(RC[-7],Sheet1!R2C1:R28C4,4,FALSE)="品",VLOOKUP(RC[-3],Sheet1!R2C8:R6C9,2,FALSE),RC[-3])&VLOOKUP(RC[-7],Sheet1!R2C1:R28C4,4,FALSE) -> 战队战斗力达到20000000 | I475: 7 | J475: =VLOOKUP(RC[-9],Sheet1!R2C1:R28C6,6,FALSE) -> 金币
A476: 8 | B476: btn_hero | C476: 26 | D476: 1 | E476: 30000000 | F476: 19003 | G476: 1000000 | H476: =VLOOKUP(RC[-7],Sheet1!R2C1:R28C4,2,FALSE)&VLOOKUP(RC[-7],Sheet1!R2C1:R28C4,3,FALSE)&IF(VLOOKUP(RC[-7],Sheet1!R2C1:R28C4,4,FALSE)="品",VLOOKUP(RC[-3],Sheet1!R2C8:R6C9,2,FALSE),RC[-3])&VLOOKUP(RC[-7],Sheet1!R2C1:R28C4,4,FALSE) -> 战队战斗力达到30000000 | I476: 7 | J476: =VLOOKUP(RC[-9],Sheet1!R2C1:R28C6,6,FALSE) -> 金币
A477: 8 | B477: btn_hero | C477: 27 | D477: 1 | E477: 40000000 | F477: 19003 | G477: 1000000 | H477: =VLOOKUP(RC[-7],Sheet1!R2C1:R28C4,2,FALSE)&VLOOKUP(RC[-7],Sheet1!R2C1:R28C4,3,FALSE)&IF(VLOOKUP(RC[-7],Sheet1!R2C1:R28C4,4,FALSE)="品",VLOOKUP(RC[-3],Sheet1!R2C8:R6C9,2,FALSE),RC[-3])&VLOOKUP(RC[-7],Sheet1!R2C1:R28C4,4,FALSE) -> 战队战斗力达到40000000 | I477: 7 | J477: =VLOOKUP(RC[-9],Sheet1!R2C1:R28C6,6,FALSE) -> 金币
A478: 8 | B478: btn_hero | C478: 28 | D478: 1 | E478: 50000000 | F478: 19003 | G478: 1000000 | H478: =VLOOKUP(RC[-7],Sheet1!R2C1:R28C4,2,FALSE)&VLOOKUP(RC[-7],Sheet1!R2C1:R28C4,3,FALSE)&IF(VLOOKUP(RC[-7],Sheet1!R2C1:R28C4,4,FALSE)="品",VLOOKUP(RC[-3],Sheet1!R2C8:R6C9,2,FALSE),RC[-3])&VLOOKUP(RC[-7],Sheet1!R2C1:R28C4,4,FALSE) -> 战队战斗力达到50000000 | I478: 7 | J478: =VLOOKUP(RC[-9],Sheet1!R2C1:R28C6,6,FALSE) -> 金币
A479: 8 | B479: btn_hero | C479: 29 | D479: 1 | E479: 60000000 | F479: 19003 | G479: 1000000 | H479: =VLOOKUP(RC[-7],Sheet1!R2C1:R28C4,2,FALSE)&VLOOKUP(RC[-7],Sheet1!R2C1:R28C4,3,FALSE)&IF(VLOOKUP(RC[-7],Sheet1!R2C1:R28C4,4,FALSE)="品",VLOOKUP(RC[-3],Sheet1!R2C8:R6C9,2,FALSE),RC[-3])&VLOOKUP(RC[-7],Sheet1!R2C1:R28C4,4,FALSE) -> 战队战斗力达到60000000 | I479: 7 | J479: =VLOOKUP(RC[-9],Sheet1!R2C1:R28C6,6,FALSE) -> 金币
A480: 8 | B480: btn_hero | C480: 30 | D480: 1 | E480: 70000000 | F480: 19003 | G480: 1000000 | H480: =VLOOKUP(RC[-7],Sheet1!R2C1:R28C4,2,FALSE)&VLOOKUP(RC[-7],Sheet1!R2C1:R28C4,3,FALSE)&IF(VLOOKUP(RC[-7],Sheet1!R2C1:R28C4,4,FALSE)="品",VLOOKUP(RC[-3],Sheet1!R2C8:R6C9,2,FALSE),RC[-3])&VLOOKUP(RC[-7],Sheet1!R2C1:R28C4,4,FALSE) -> 战队战斗力达到70000000 | I480: 7 | J480: =VLOOKUP(RC[-9],Sheet1!R2C1:R28C6,6,FALSE) -> 金币
A481: 8 | B481: btn_hero | C481: 31 | D481: 1 | E481: 80000000 | F481: 19003 | G481: 1000000 | H481: =VLOOKUP(RC[-7],Sheet1!R2C1:R28C4,2,FALSE)&VLOOKUP(RC[-7],Sheet1!R2C1:R28C4,3,FALSE)&IF(VLOOKUP(RC[-7],Sheet1!R2C1:R28C4,4,FALSE)="品",VLOOKUP(RC[-3],Sheet1!R2C8:R6C9,2,FALSE),RC[-3])&VLOOKUP(RC[-7],Sheet1!R2C1:R28C4,4,FALSE) -> 战队战斗力达到80000000 | I481: 7 | J481: =VLOOKUP(RC[-9],Sheet1!R2C1:R28C6,6,FALSE) -> 金币
A482: 8 | B482: btn_hero | C482: 32 | D482: 1 | E482: 90000000 | F482: 19003 | G482: 1000000 | H482: =VLOOKUP(RC[-7],Sheet1!R2C1:R28C4,2,FALSE)&VLOOKUP(RC[-7],Sheet1!R2C1:R28C4,3,FALSE)&IF(VLOOKUP(RC[-7],Sheet1!R2C1:R28C4,4,FALSE)="品",VLOOKUP(RC[-3],Sheet1!R2C8:R6C9,2,FALSE),RC[-3])&VLOOKUP(RC[-7],Sheet1!R2C1:R28C4,4,FALSE) -> 战队战斗力达到90000000 | I482: 7 | J482: =VLOOKUP(RC[-9],Sheet1!R2C1:R28C6,6,FALSE) -> 金币
A483: 8 | B483: btn_hero | C483: 33 | D483: 1 | E483: 100000000 | F483: 19003 | G483: 1000000 | H483: =VLOOKUP(RC[-7],Sheet1!R2C1:R28C4,2,FALSE)&VLOOKUP(RC[-7],Sheet1!R2C1:R28C4,3,FALSE)&IF(VLOOKUP(RC[-7],Sheet1!R2C1:R28C4,4,FALSE)="品",VLOOKUP(RC[-3],Sheet1!R2C8:R6C9,2,FALSE),RC[-3])&VLOOKUP(RC[-7],Sheet1!R2C1:R28C4,4,FALSE) -> 战队战斗力达到100000000 | I483: 7 | J483: =VLOOKUP(RC[-9],Sheet1!R2C1:R28C6,6,FALSE) -> 金币
A484: 9 | B484: btn_hero | C484: 1 | D484: 1 | E484: 10 | F484: 19003 | G484: 100000 | H484: =VLOOKUP(RC[-7],Sheet1!R2C1:R28C4,2,FALSE)&VLOOKUP(RC[-7],Sheet1!R2C1:R28C4,3,FALSE)&IF(VLOOKUP(RC[-7],Sheet1!R2C1:R28C4,4,FALSE)="品",VLOOKUP(RC[-3],Sheet1!R2C8:R6C9,2,FALSE),RC[-3])&VLOOKUP(RC[-7],Sheet1!R2C1:R28C4,4,FALSE) -> 战队中全体英雄等级达到10级 | I484: 7 | J484: =VLOOKUP(RC[-9],Sheet1!R2C1:R28C6,6,FALSE) -> 金币
A485: 9 | B485: btn_hero | C485: 2 | D485: 1 | E485: 20 | F485: 19003 | G485: 200000 | H485: =VLOOKUP(RC[-7],Sheet1!R2C1:R28C4,2,FALSE)&VLOOKUP(RC[-7],Sheet1!R2C1:R28C4,3,FALSE)&IF(VLOOKUP(RC[-7],Sheet1!R2C1:R28C4,4,FALSE)="品",VLOOKUP(RC[-3],Sheet1!R2C8:R6C9,2,FALSE),RC[-3])&VLOOKUP(RC[-7],Sheet1!R2C1:R28C4,4,FALSE) -> 战队中全体英雄等级达到20级 | I485: 7 | J485: =VLOOKUP(RC[-9],Sheet1!R2C1:R28C6,6,FALSE) -> 金币
A486: 9 | B486: btn_hero | C486: 3 | D486: 1 | E486: 30 | F486: 19003 | G486: 300000 | H486: =VLOOKUP(RC[-7],Sheet1!R2C1:R28C4,2,FALSE)&VLOOKUP(RC[-7],Sheet1!R2C1:R28C4,3,FALSE)&IF(VLOOKUP(RC[-7],Sheet1!R2C1:R28C4,4,FALSE)="品",VLOOKUP(RC[-3],Sheet1!R2C8:R6C9,2,FALSE),RC[-3])&VLOOKUP(RC[-7],Sheet1!R2C1:R28C4,4,FALSE) -> 战队中全体英雄等级达到30级 | I486: 7 | J486: =VLOOKUP(RC[-9],Sheet1!R2C1:R28C6,6,FALSE) -> 金币
A487: 9 | B487: btn_hero | C487: 4 | D487: 1 | E487: 40 | F487: 19003 | G487: 400000 | H487: =VLOOKUP(RC[-7],Sheet1!R2C1:R28C4,2,FALSE)&VLOOKUP(RC[-7],Sheet1!R2C1:R28C4,3,FALSE)&IF(VLOOKUP(RC[-7],Sheet1!R2C1:R28C4,4,FALSE)="品",VLOOKUP(RC[-3],Sheet1!R2C8:R6C9,2,FALSE),RC[-3])&VLOOKUP(RC[-7],Sheet1!R2C1:R28C4,4,FALSE) -> 战队中全体英雄等级达到40级 | I487: 7 | J487: =VLOOKUP(RC[-9],Sheet1!R2C1:R28C6,6,FALSE) -> 金币
A488: 9 | B488: btn_hero | C488: 5 | D488: 1 | E488: 50 | F488: 19003 | G488: 500000 | H488: =VLOOKUP(RC[-7],Sheet1!R2C1:R28C4,2,FALSE)&VLOOKUP(RC[-7],Sheet1!R2C1:R28C4,3,FALSE)&IF(VLOOKUP(RC[-7],Sheet1!R2C1:R28C4,4,FALSE)="品",VLOOKUP(RC[-3],Sheet1!R2C8:R6C9,2,FALSE),RC[-3])&VLOOKUP(RC[-7],Sheet1!R2C1:R28C4,4,FALSE) -> 战队中全体英雄等级达到50级 | I488: 7 | J488: =VLOOKUP(RC[-9],Sheet1!R2C1:R28C6,6,FALSE) -> 金币
A489: 9 | B489: btn_hero | C489: 6 | D489: 1 | E489: 60 | F489: 19003 | G489: 600000 | H489: =VLOOKUP(RC[-7],Sheet1!R2C1:R28C4,2,FALSE)&VLOOKUP(RC[-7],Sheet1!R2C1:R28C4,3,FALSE)&IF(VLOOKUP(RC[-7],Sheet1!R2C1:R28C4,4,FALSE)="品",VLOOKUP(RC[-3],Sheet1!R2C8:R6C9,2,FALSE),RC[-3])&VLOOKUP(RC[-7],Sheet1!R2C1:R28C4,4,FALSE) -> 战队中全体英雄等级达到60级 | I489: 7 | J489: =VLOOKUP(RC[-9],Sheet1!R2C1:R28C6,6,FALSE) -> 金币
A490: 9 | B490: btn_hero | C490: 7 | D490: 1 | E490: 70 | F490: 19003 | G490: 700000 | H490: =VLOOKUP(RC[-7],Sheet1!R2C1:R28C4,2,FALSE)&VLOOKUP(RC[-7],Sheet1!R2C1:R28C4,3,FALSE)&IF(VLOOKUP(RC[-7],Sheet1!R2C1:R28C4,4,FALSE)="品",VLOOKUP(RC[-3],Sheet1!R2C8:R6C9,2,FALSE),RC[-3])&VLOOKUP(RC[-7],Sheet1!R2C1:R28C4,4,FALSE) -> 战队中全体英雄等级达到70级 | I490: 7 | J490: =VLOOKUP(RC[-9],Sheet1!R2C1:R28C6,6,FALSE) -> 金币
A491: 9 | B491: btn_hero | C491: 8 | D491: 1 | E491: 80 | F491: 19003 | G491: 800000 | H491: =VLOOKUP(RC[-7],Sheet1!R2C1:R28C4,2,FALSE)&VLOOKUP(RC[-7],Sheet1!R2C1:R28C4,3,FALSE)&IF(VLOOKUP(RC[-7],Sheet1!R2C1:R28C4,4,FALSE)="品",VLOOKUP(RC[-3],Sheet1!R2C8:R6C9,2,FALSE),RC[-3])&VLOOKUP(RC[-7],Sheet1!R2C1:R28C4,4,FALSE) -> 战队中全体英雄等级达到80级 | I491: 7 | J491: =VLOOKUP(RC[-9],Sheet1!R2C1:R28C6,6,FALSE) -> 金币
A492: 9 | B492: btn_hero | C492: 9 | D492: 1 | E492: 90 | F492: 19003 | G492: 900000 | H492: =VLOOKUP(RC[-7],Sheet1!R2C1:R28C4,2,FALSE)&VLOOKUP(RC[-7],Sheet1!R2C1:R28C4,3,FALSE)&IF(VLOOKUP(RC[-7],Sheet1!R2C1:R28C4,4,FALSE)="品",VLOOKUP(RC[-3],Sheet1!R2C8:R6C9,2,FALSE),RC[-3])&VLOOKUP(RC[-7],Sheet1!R2C1:R28C4,4,FALSE) -> 战队中全体英雄等级达到90级 | I492: 7 | J492: =VLOOKUP(RC[-9],Sheet1!R2C1:R28C6,6,FALSE) -> 金币
A493: 9 | B493: btn_hero | C493: 10 | D493: 1 | E493: 100 | F493: 19003 | G493: 1000000 | H493: =VLOOKUP(RC[-7],Sheet1!R2C1:R28C4,2,FALSE)&VLOOKUP(RC[-7],Sheet1!R2C1:R28C4,3,FALSE)&IF(VLOOKUP(RC[-7],Sheet1!R2C1:R28C4,4,FALSE)="品",VLOOKUP(RC[-3],Sheet1!R2C8:R6C9,2,FALSE),RC[-3])&VLOOKUP(RC[-7],Sheet1!R2C1:R28C4,4,FALSE) -> 战队中全体英雄等级达到100级 | I493: 7 | J493: =VLOOKUP(RC[-9],Sheet1!R2C1:R28C6,6,FALSE) -> 金币
A494: 9 | B494: btn_hero | C494: 11 | D494: 1 | E494: 110 | F494: 19003 | G494: 1100000 | H494: =VLOOKUP(RC[-7],Sheet1!R2C1:R28C4,2,FALSE)&VLOOKUP(RC[-7],Sheet1!R2C1:R28C4,3,FALSE)&IF(VLOOKUP(RC[-7],Sheet1!R2C1:R28C4,4,FALSE)="品",VLOOKUP(RC[-3],Sheet1!R2C8:R6C9,2,FALSE),RC[-3])&VLOOKUP(RC[-7],Sheet1!R2C1:R28C4,4,FALSE) -> 战队中全体英雄等级达到110级 | I494: 7 | J494: =VLOOKUP(RC[-9],Sheet1!R2C1:R28C6,6,FALSE) -> 金币
A495: 9 | B495: btn_hero | C495: 12 | D495: 1 | E495: 120 | F495: 19003 | G495: 1200000 | H495: =VLOOKUP(RC[-7],Sheet1!R2C1:R28C4,2,FALSE)&VLOOKUP(RC[-7],Sheet1!R2C1:R28C4,3,FALSE)&IF(VLOOKUP(RC[-7],Sheet1!R2C1:R28C4,4,FALSE)="品",VLOOKUP(RC[-3],Sheet1!R2C8:R6C9,2,FALSE),RC[-3])&VLOOKUP(RC[-7],Sheet1!R2C1:R28C4,4,FALSE) -> 战队中全体英雄等级达到120级 | I495: 7 | J495: =VLOOKUP(RC[-9],Sheet1!R2C1:R28C6,6,FALSE) -> 金币
A496: 9 | B496: btn_hero | C496: 13 | D496: 1 | E496: 130 | F496: 19003 | G496: 1300000 | H496: =VLOOKUP(RC[-7],Sheet1!R2C1:R28C4,2,FALSE)&VLOOKUP(RC[-7],Sheet1!R2C1:R28C4,3,FALSE)&IF(VLOOKUP(RC[-7],Sheet1!R2C1:R28C4,4,FALSE)="品",VLOOKUP(RC[-3],Sheet1!R2C8:R6C9,2,FALSE),RC[-3])&VLOOKUP(RC[-7],Sheet1!R2C1:R28C4,4,FALSE) -> 战队中全体英雄等级达到130级 | I496: 7 | J496: =VLOOKUP(RC[-9],Sheet1!R2C1:R28C6,6,FALSE) -> 金币
A497: 9 | B497: btn_hero | C497: 14 | D497: 1 | E497: 140 | F497: 19003 | G497: 1400000 | H497: =VLOOKUP(RC[-7],Sheet1!R2C1:R28C4,2,FALSE)&VLOOKUP(RC[-7],Sheet1!R2C1:R28C4,3,FALSE)&IF(VLOOKUP(RC[-7],Sheet1!R2C1:R28C4,4,FALSE)="品",VLOOKUP(RC[-3],Sheet1!R2C8:R6C9,2,FALSE),RC[-3])&VLOOKUP(RC[-7],Sheet1!R2C1:R28C4,4,FALSE) -> 战队中全体英雄等级达到140级 | I497: 7 | J497: =VLOOKUP(RC[-9],Sheet1!R2C1:R28C6,6,FALSE) -> 金币
A498: 9 | B498: btn_hero | C498: 15 | D498: 1 | E498: 150 | F498: 19003 | G498: 1500000 | H498: =VLOOKUP(RC[-7],Sheet1!R2C1:R28C4,2,FALSE)&VLOOKUP(RC[-7],Sheet1!R2C1:R28C4,3,FALSE)&IF(VLOOKUP(RC[-7],Sheet1!R2C1:R28C4,4,FALSE)="品",VLOOKUP(RC[-3],Sheet1!R2C8:R6C9,2,FALSE),RC[-3])&VLOOKUP(RC[-7],Sheet1!R2C1:R28C4,4,FALSE) -> 战队中全体英雄等级达到150级 | I498: 7 | J498: =VLOOKUP(RC[-9],Sheet1!R2C1:R28C6,6,FALSE) -> 金币
A499: 10 | B499: btn_hero | C499: 1 | D499: 1 | E499: 1 | F499: 19003 | G499: 50000 | H499: =VLOOKUP(RC[-7],Sheet1!R2C1:R28C4,2,FALSE)&VLOOKUP(RC[-7],Sheet1!R2C1:R28C4,3,FALSE)&IF(VLOOKUP(RC[-7],Sheet1!R2C1:R28C4,4,FALSE)="品",VLOOKUP(RC[-3],Sheet1!R2C8:R6C9,2,FALSE),RC[-3])&VLOOKUP(RC[-7],Sheet1!R2C1:R28C4,4,FALSE) -> 战队中全体英雄进阶等级达到1级 | I499: 7 | J499: =VLOOKUP(RC[-9],Sheet1!R2C1:R28C6,6,FALSE) -> 金币
A500: 10 | B500: btn_hero | C500: 2 | D500: 1 | E500: 2 | F500: 19003 | G500: 50000 | H500: =VLOOKUP(RC[-7],Sheet1!R2C1:R28C4,2,FALSE)&VLOOKUP(RC[-7],Sheet1!R2C1:R28C4,3,FALSE)&IF(VLOOKUP(RC[-7],Sheet1!R2C1:R28C4,4,FALSE)="品",VLOOKUP(RC[-3],Sheet1!R2C8:R6C9,2,FALSE),RC[-3])&VLOOKUP(RC[-7],Sheet1!R2C1:R28C4,4,FALSE) -> 战队中全体英雄进阶等级达到2级 | I500: 7 | J500: =VLOOKUP(RC[-9],Sheet1!R2C1:R28C6,6,FALSE) -> 金币
A501: 10 | B501: btn_hero | C501: 3 | D501: 1 | E501: 3 | F501: 19003 | G501: 100000 | H501: =VLOOKUP(RC[-7],Sheet1!R2C1:R28C4,2,FALSE)&VLOOKUP(RC[-7],Sheet1!R2C1:R28C4,3,FALSE)&IF(VLOOKUP(RC[-7],Sheet1!R2C1:R28C4,4,FALSE)="品",VLOOKUP(RC[-3],Sheet1!R2C8:R6C9,2,FALSE),RC[-3])&VLOOKUP(RC[-7],Sheet1!R2C1:R28C4,4,FALSE) -> 战队中全体英雄进阶等级达到3级 | I501: 7 | J501: =VLOOKUP(RC[-9],Sheet1!R2C1:R28C6,6,FALSE) -> 金币
A502: 10 | B502: btn_hero | C502: 4 | D502: 1 | E502: 4 | F502: 19003 | G502: 100000 | H502: =VLOOKUP(RC[-7],Sheet1!R2C1:R28C4,2,FALSE)&VLOOKUP(RC[-7],Sheet1!R2C1:R28C4,3,FALSE)&IF(VLOOKUP(RC[-7],Sheet1!R2C1:R28C4,4,FALSE)="品",VLOOKUP(RC[-3],Sheet1!R2C8:R6C9,2,FALSE),RC[-3])&VLOOKUP(RC[-7],Sheet1!R2C1:R28C4,4,FALSE) -> 战队中全体英雄进阶等级达到4级 | I502: 7 | J502: =VLOOKUP(RC[-9],Sheet1!R2C1:R28C6,6,FALSE) -> 金币
A503: 10 | B503: btn_hero | C503: 5 | D503: 1 | E503: 5 | F503: 19003 | G503: 200000 | H503: =VLOOKUP(RC[-7],Sheet1!R2C1:R28C4,2,FALSE)&VLOOKUP(RC[-7],Sheet1!R2C1:R28C4,3,FALSE)&IF(VLOOKUP(RC[-7],Sheet1!R2C1:R28C4,4,FALSE)="品",VLOOKUP(RC[-3],Sheet1!R2C8:R6C9,2,FALSE),RC[-3])&VLOOKUP(RC[-7],Sheet1!R2C1:R28C4,4,FALSE) -> 战队中全体英雄进阶等级达到5级 | I503: 7 | J503: =VLOOKUP(RC[-9],Sheet1!R2C1:R28C6,6,FALSE) -> 金币
A504: 10 | B504: btn_hero | C504: 6 | D504: 1 | E504: 6 | F504: 19003 | G504: 200000 | H504: =VLOOKUP(RC[-7],Sheet1!R2C1:R28C4,2,FALSE)&VLOOKUP(RC[-7],Sheet1!R2C1:R28C4,3,FALSE)&IF(VLOOKUP(RC[-7],Sheet1!R2C1:R28C4,4,FALSE)="品",VLOOKUP(RC[-3],Sheet1!R2C8:R6C9,2,FALSE),RC[-3])&VLOOKUP(RC[-7],Sheet1!R2C1:R28C4,4,FALSE) -> 战队中全体英雄进阶等级达到6级 | I504: 7 | J504: =VLOOKUP(RC[-9],Sheet1!R2C1:R28C6,6,FALSE) -> 金币
A505: 10 | B505: btn_hero | C505: 7 | D505: 1 | E505: 7 | F505: 19003 | G505: 300000 | H505: =VLOOKUP(RC[-7],Sheet1!R2C1:R28C4,2,FALSE)&VLOOKUP(RC[-7],Sheet1!R2C1:R28C4,3,FALSE)&IF(VLOOKUP(RC[-7],Sheet1!R2C1:R28C4,4,FALSE)="品",VLOOKUP(RC[-3],Sheet1!R2C8:R6C9,2,FALSE),RC[-3])&VLOOKUP(RC[-7],Sheet1!R2C1:R28C4,4,FALSE) -> 战队中全体英雄进阶等级达到7级 | I505: 7 | J505: =VLOOKUP(RC[-9],Sheet1!R2C1:R28C6,6,FALSE) -> 金币
A506: 10 | B506: btn_hero | C506: 8 | D506: 1 | E506: 8 | F506: 19003 | G506: 300000 | H506: =VLOOKUP(RC[-7],Sheet1!R2C1:R28C4,2,FALSE)&VLOOKUP(RC[-7],Sheet1!R2C1:R28C4,3,FALSE)&IF(VLOOKUP(RC[-7],Sheet1!R2C1:R28C4,4,FALSE)="品",VLOOKUP(RC[-3],Sheet1!R2C8:R6C9,2,FALSE),RC[-3])&VLOOKUP(RC[-7],Sheet1!R2C1:R28C4,4,FALSE) -> 战队中全体英雄进阶等级达到8级 | I506: 7 | J506: =VLOOKUP(RC[-9],Sheet1!R2C1:R28C6,6,FALSE) -> 金币
A507: 10 | B507: btn_hero | C507: 9 | D507: 1 | E507: 9 | F507: 19003 | G507: 400000 | H507: =VLOOKUP(RC[-7],Sheet1!R2C1:R28C4,2,FALSE)&VLOOKUP(RC[-7],Sheet1!R2C1:R28C4,3,FALSE)&IF(VLOOKUP(RC[-7],Sheet1!R2C1:R28C4,4,FALSE)="品",VLOOKUP(RC[-3],Sheet1!R2C8:R6C9,2,FALSE),RC[-3])&VLOOKUP(RC[-7],Sheet1!R2C1:R28C4,4,FALSE) -> 战队中全体英雄进阶等级达到9级 | I507: 7 | J507: =VLOOKUP(RC[-9],Sheet1!R2C1:R28C6,6,FALSE) -> 金币
A508: 10 | B508: btn_hero | C508: 10 | D508: 1 | E508: 10 | F508: 19003 | G508: 400000 | H508: =VLOOKUP(RC[-7],Sheet1!R2C1:R28C4,2,FALSE)&VLOOKUP(RC[-7],Sheet1!R2C1:R28C4,3,FALSE)&IF(VLOOKUP(RC[-7],Sheet1!R2C1:R28C4,4,FALSE)="品",VLOOKUP(RC[-3],Sheet1!R2C8:R6C9,2,FALSE),RC[-3])&VLOOKUP(RC[-7],Sheet1!R2C1:R28C4,4,FALSE) -> 战队中全体英雄进阶等级达到10级 | I508: 7 | J508: =VLOOKUP(RC[-9],Sheet1!R2C1:R28C6,6,FALSE) -> 金币
A509: 10 | B509: btn_hero | C509: 11 | D509: 1 | E509: 11 | F509: 19003 | G509: 500000 | H509: =VLOOKUP(RC[-7],Sheet1!R2C1:R28C4,2,FALSE)&VLOOKUP(RC[-7],Sheet1!R2C1:R28C4,3,FALSE)&IF(VLOOKUP(RC[-7],Sheet1!R2C1:R28C4,4,FALSE)="品",VLOOKUP(RC[-3],Sheet1!R2C8:R6C9,2,FALSE),RC[-3])&VLOOKUP(RC[-7],Sheet1!R2C1:R28C4,4,FALSE) -> 战队中全体英雄进阶等级达到11级 | I509: 7 | J509: =VLOOKUP(RC[-9],Sheet1!R2C1:R28C6,6,FALSE) -> 金币
A510: 10 | B510: btn_hero | C510: 12 | D510: 1 | E510: 12 | F510: 19003 | G510: 600000 | H510: =VLOOKUP(RC[-7],Sheet1!R2C1:R28C4,2,FALSE)&VLOOKUP(RC[-7],Sheet1!R2C1:R28C4,3,FALSE)&IF(VLOOKUP(RC[-7],Sheet1!R2C1:R28C4,4,FALSE)="品",VLOOKUP(RC[-3],Sheet1!R2C8:R6C9,2,FALSE),RC[-3])&VLOOKUP(RC[-7],Sheet1!R2C1:R28C4,4,FALSE) -> 战队中全体英雄进阶等级达到12级 | I510: 7 | J510: =VLOOKUP(RC[-9],Sheet1!R2C1:R28C6,6,FALSE) -> 金币
A511: 10 | B511: btn_hero | C511: 13 | D511: 1 | E511: 13 | F511: 19003 | G511: 700000 | H511: =VLOOKUP(RC[-7],Sheet1!R2C1:R28C4,2,FALSE)&VLOOKUP(RC[-7],Sheet1!R2C1:R28C4,3,FALSE)&IF(VLOOKUP(RC[-7],Sheet1!R2C1:R28C4,4,FALSE)="品",VLOOKUP(RC[-3],Sheet1!R2C8:R6C9,2,FALSE),RC[-3])&VLOOKUP(RC[-7],Sheet1!R2C1:R28C4,4,FALSE) -> 战队中全体英雄进阶等级达到13级 | I511: 7 | J511: =VLOOKUP(RC[-9],Sheet1!R2C1:R28C6,6,FALSE) -> 金币
A512: 10 | B512: btn_hero | C512: 14 | D512: 1 | E512: 14 | F512: 19003 | G512: 800000 | H512: =VLOOKUP(RC[-7],Sheet1!R2C1:R28C4,2,FALSE)&VLOOKUP(RC[-7],Sheet1!R2C1:R28C4,3,FALSE)&IF(VLOOKUP(RC[-7],Sheet1!R2C1:R28C4,4,FALSE)="品",VLOOKUP(RC[-3],Sheet1!R2C8:R6C9,2,FALSE),RC[-3])&VLOOKUP(RC[-7],Sheet1!R2C1:R28C4,4,FALSE) -> 战队中全体英雄进阶等级达到14级 | I512: 7 | J512: =VLOOKUP(RC[-9],Sheet1!R2C1:R28C6,6,FALSE) -> 金币
A513: 10 | B513: btn_hero | C513: 15 | D513: 1 | E513: 15 | F513: 19003 | G513: 1000000 | H513: =VLOOKUP(RC[-7],Sheet1!R2C1:R28C4,2,FALSE)&VLOOKUP(RC[-7],Sheet1!R2C1:R28C4,3,FALSE)&IF(VLOOKUP(RC[-7],Sheet1!R2C1:R28C4,4,FALSE)="品",VLOOKUP(RC[-3],Sheet1!R2C8:R6C9,2,FALSE),RC[-3])&VLOOKUP(RC[-7],Sheet1!R2C1:R28C4,4,FALSE) -> 战队中全体英雄进阶等级达到15级 | I513: 7 | J513: =VLOOKUP(RC[-9],Sheet1!R2C1:R28C6,6,FALSE) -> 金币
A514: 11 | B514: btn_hero | C514: 1 | D514: 1 | E514: 1 | F514: 19003 | G514: 20000 | H514: =VLOOKUP(RC[-7],Sheet1!R2C1:R28C4,2,FALSE)&VLOOKUP(RC[-7],Sheet1!R2C1:R28C4,3,FALSE)&IF(VLOOKUP(RC[-7],Sheet1!R2C1:R28C4,4,FALSE)="品",VLOOKUP(RC[-3],Sheet1!R2C8:R6C9,2,FALSE),RC[-3])&VLOOKUP(RC[-7],Sheet1!R2C1:R28C4,4,FALSE) -> 战队中全体英雄培养等级达到1级 | I514: 7 | J514: =VLOOKUP(RC[-9],Sheet1!R2C1:R28C6,6,FALSE) -> 培养石
A515: 11 | B515: btn_hero | C515: 2 | D515: 1 | E515: 2 | F515: 19003 | G515: 50000 | H515: =VLOOKUP(RC[-7],Sheet1!R2C1:R28C4,2,FALSE)&VLOOKUP(RC[-7],Sheet1!R2C1:R28C4,3,FALSE)&IF(VLOOKUP(RC[-7],Sheet1!R2C1:R28C4,4,FALSE)="品",VLOOKUP(RC[-3],Sheet1!R2C8:R6C9,2,FALSE),RC[-3])&VLOOKUP(RC[-7],Sheet1!R2C1:R28C4,4,FALSE) -> 战队中全体英雄培养等级达到2级 | I515: 7 | J515: =VLOOKUP(RC[-9],Sheet1!R2C1:R28C6,6,FALSE) -> 培养石
A516: 11 | B516: btn_hero | C516: 3 | D516: 1 | E516: 3 | F516: 19003 | G516: 100000 | H516: =VLOOKUP(RC[-7],Sheet1!R2C1:R28C4,2,FALSE)&VLOOKUP(RC[-7],Sheet1!R2C1:R28C4,3,FALSE)&IF(VLOOKUP(RC[-7],Sheet1!R2C1:R28C4,4,FALSE)="品",VLOOKUP(RC[-3],Sheet1!R2C8:R6C9,2,FALSE),RC[-3])&VLOOKUP(RC[-7],Sheet1!R2C1:R28C4,4,FALSE) -> 战队中全体英雄培养等级达到3级 | I516: 7 | J516: =VLOOKUP(RC[-9],Sheet1!R2C1:R28C6,6,FALSE) -> 培养石
A517: 11 | B517: btn_hero | C517: 4 | D517: 1 | E517: 4 | F517: 19003 | G517: 150000 | H517: =VLOOKUP(RC[-7],Sheet1!R2C1:R28C4,2,FALSE)&VLOOKUP(RC[-7],Sheet1!R2C1:R28C4,3,FALSE)&IF(VLOOKUP(RC[-7],Sheet1!R2C1:R28C4,4,FALSE)="品",VLOOKUP(RC[-3],Sheet1!R2C8:R6C9,2,FALSE),RC[-3])&VLOOKUP(RC[-7],Sheet1!R2C1:R28C4,4,FALSE) -> 战队中全体英雄培养等级达到4级 | I517: 7 | J517: =VLOOKUP(RC[-9],Sheet1!R2C1:R28C6,6,FALSE) -> 培养石
A518: 11 | B518: btn_hero | C518: 5 | D518: 1 | E518: 5 | F518: 19003 | G518: 200000 | H518: =VLOOKUP(RC[-7],Sheet1!R2C1:R28C4,2,FALSE)&VLOOKUP(RC[-7],Sheet1!R2C1:R28C4,3,FALSE)&IF(VLOOKUP(RC[-7],Sheet1!R2C1:R28C4,4,FALSE)="品",VLOOKUP(RC[-3],Sheet1!R2C8:R6C9,2,FALSE),RC[-3])&VLOOKUP(RC[-7],Sheet1!R2C1:R28C4,4,FALSE) -> 战队中全体英雄培养等级达到5级 | I518: 7 | J518: =VLOOKUP(RC[-9],Sheet1!R2C1:R28C6,6,FALSE) -> 培养石
A519: 11 | B519: btn_hero | C519: 6 | D519: 1 | E519: 6 | F519: 19003 | G519: 250000 | H519: =VLOOKUP(RC[-7],Sheet1!R2C1:R28C4,2,FALSE)&VLOOKUP(RC[-7],Sheet1!R2C1:R28C4,3,FALSE)&IF(VLOOKUP(RC[-7],Sheet1!R2C1:R28C4,4,FALSE)="品",VLOOKUP(RC[-3],Sheet1!R2C8:R6C9,2,FALSE),RC[-3])&VLOOKUP(RC[-7],Sheet1!R2C1:R28C4,4,FALSE) -> 战队中全体英雄培养等级达到6级 | I519: 7 | J519: =VLOOKUP(RC[-9],Sheet1!R2C1:R28C6,6,FALSE) -> 培养石
A520: 11 | B520: btn_hero | C520: 7 | D520: 1 | E520: 7 | F520: 19003 | G520: 300000 | H520: =VLOOKUP(RC[-7],Sheet1!R2C1:R28C4,2,FALSE)&VLOOKUP(RC[-7],Sheet1!R2C1:R28C4,3,FALSE)&IF(VLOOKUP(RC[-7],Sheet1!R2C1:R28C4,4,FALSE)="品",VLOOKUP(RC[-3],Sheet1!R2C8:R6C9,2,FALSE),RC[-3])&VLOOKUP(RC[-7],Sheet1!R2C1:R28C4,4,FALSE) -> 战队中全体英雄培养等级达到7级 | I520: 7 | J520: =VLOOKUP(RC[-9],Sheet1!R2C1:R28C6,6,FALSE) -> 培养石
A521: 11 | B521: btn_hero | C521: 8 | D521: 1 | E521: 8 | F521: 19003 | G521: 350000 | H521: =VLOOKUP(RC[-7],Sheet1!R2C1:R28C4,2,FALSE)&VLOOKUP(RC[-7],Sheet1!R2C1:R28C4,3,FALSE)&IF(VLOOKUP(RC[-7],Sheet1!R2C1:R28C4,4,FALSE)="品",VLOOKUP(RC[-3],Sheet1!R2C8:R6C9,2,FALSE),RC[-3])&VLOOKUP(RC[-7],Sheet1!R2C1:R28C4,4,FALSE) -> 战队中全体英雄培养等级达到8级 | I521: 7 | J521: =VLOOKUP(RC[-9],Sheet1!R2C1:R28C6,6,FALSE) -> 培养石
A522: 11 | B522: btn_hero | C522: 9 | D522: 1 | E522: 9 | F522: 19003 | G522: 400000 | H522: =VLOOKUP(RC[-7],Sheet1!R2C1:R28C4,2,FALSE)&VLOOKUP(RC[-7],Sheet1!R2C1:R28C4,3,FALSE)&IF(VLOOKUP(RC[-7],Sheet1!R2C1:R28C4,4,FALSE)="品",VLOOKUP(RC[-3],Sheet1!R2C8:R6C9,2,FALSE),RC[-3])&VLOOKUP(RC[-7],Sheet1!R2C1:R28C4,4,FALSE) -> 战队中全体英雄培养等级达到9级 | I522: 7 | J522: =VLOOKUP(RC[-9],Sheet1!R2C1:R28C6,6,FALSE) -> 培养石
A523: 11 | B523: btn_hero | C523: 10 | D523: 1 | E523: 10 | F523: 19003 | G523: 450000 | H523: =VLOOKUP(RC[-7],Sheet1!R2C1:R28C4,2,FALSE)&VLOOKUP(RC[-7],Sheet1!R2C1:R28C4,3,FALSE)&IF(VLOOKUP(RC[-7],Sheet1!R2C1:R28C4,4,FALSE)="品",VLOOKUP(RC[-3],Sheet1!R2C8:R6C9,2,FALSE),RC[-3])&VLOOKUP(RC[-7],Sheet1!R2C1:R28C4,4,FALSE) -> 战队中全体英雄培养等级达到10级 | I523: 7 | J523: =VLOOKUP(RC[-9],Sheet1!R2C1:R28C6,6,FALSE) -> 培养石
A524: 11 | B524: btn_hero | C524: 11 | D524: 1 | E524: 11 | F524: 19003 | G524: 500000 | H524: =VLOOKUP(RC[-7],Sheet1!R2C1:R28C4,2,FALSE)&VLOOKUP(RC[-7],Sheet1!R2C1:R28C4,3,FALSE)&IF(VLOOKUP(RC[-7],Sheet1!R2C1:R28C4,4,FALSE)="品",VLOOKUP(RC[-3],Sheet1!R2C8:R6C9,2,FALSE),RC[-3])&VLOOKUP(RC[-7],Sheet1!R2C1:R28C4,4,FALSE) -> 战队中全体英雄培养等级达到11级 | I524: 7 | J524: =VLOOKUP(RC[-9],Sheet1!R2C1:R28C6,6,FALSE) -> 培养石
A525: 11 | B525: btn_hero | C525: 12 | D525: 1 | E525: 12 | F525: 19003 | G525: 550000 | H525: =VLOOKUP(RC[-7],Sheet1!R2C1:R28C4,2,FALSE)&VLOOKUP(RC[-7],Sheet1!R2C1:R28C4,3,FALSE)&IF(VLOOKUP(RC[-7],Sheet1!R2C1:R28C4,4,FALSE)="品",VLOOKUP(RC[-3],Sheet1!R2C8:R6C9,2,FALSE),RC[-3])&VLOOKUP(RC[-7],Sheet1!R2C1:R28C4,4,FALSE) -> 战队中全体英雄培养等级达到12级 | I525: 7 | J525: =VLOOKUP(RC[-9],Sheet1!R2C1:R28C6,6,FALSE) -> 培养石
A526: 11 | B526: btn_hero | C526: 13 | D526: 1 | E526: 13 | F526: 19003 | G526: 600000 | H526: =VLOOKUP(RC[-7],Sheet1!R2C1:R28C4,2,FALSE)&VLOOKUP(RC[-7],Sheet1!R2C1:R28C4,3,FALSE)&IF(VLOOKUP(RC[-7],Sheet1!R2C1:R28C4,4,FALSE)="品",VLOOKUP(RC[-3],Sheet1!R2C8:R6C9,2,FALSE),RC[-3])&VLOOKUP(RC[-7],Sheet1!R2C1:R28C4,4,FALSE) -> 战队中全体英雄培养等级达到13级 | I526: 7 | J526: =VLOOKUP(RC[-9],Sheet1!R2C1:R28C6,6,FALSE) -> 培养石
A527: 11 | B527: btn_hero | C527: 14 | D527: 1 | E527: 14 | F527: 19003 | G527: 650000 | H527: =VLOOKUP(RC[-7],Sheet1!R2C1:R28C4,2,FALSE)&VLOOKUP(RC[-7],Sheet1!R2C1:R28C4,3,FALSE)&IF(VLOOKUP(RC[-7],Sheet1!R2C1:R28C4,4,FALSE)="品",VLOOKUP(RC[-3],Sheet1!R2C8:R6C9,2,FALSE),RC[-3])&VLOOKUP(RC[-7],Sheet1!R2C1:R28C4,4,FALSE) -> 战队中全体英雄培养等级达到14级 | I527: 7 | J527: =VLOOKUP(RC[-9],Sheet1!R2C1:R28C6,6,FALSE) -> 培养石
A528: 11 | B528: btn_hero | C528: 15 | D528: 1 | E528: 15 | F528: 19003 | G528: 700000 | H528: =VLOOKUP(RC[-7],Sheet1!R2C1:R28C4,2,FALSE)&VLOOKUP(RC[-7],Sheet1!R2C1:R28C4,3,FALSE)&IF(VLOOKUP(RC[-7],Sheet1!R2C1:R28C4,4,FALSE)="品",VLOOKUP(RC[-3],Sheet1!R2C8:R6C9,2,FALSE),RC[-3])&VLOOKUP(RC[-7],Sheet1!R2C1:R28C4,4,FALSE) -> 战队中全体英雄培养等级达到15级 | I528: 7 | J528: =VLOOKUP(RC[-9],Sheet1!R2C1:R28C6,6,FALSE) -> 培养石
A529: 11 | B529: btn_hero | C529: 16 | D529: 1 | E529: 16 | F529: 19003 | G529: 750000 | H529: =VLOOKUP(RC[-7],Sheet1!R2C1:R28C4,2,FALSE)&VLOOKUP(RC[-7],Sheet1!R2C1:R28C4,3,FALSE)&IF(VLOOKUP(RC[-7],Sheet1!R2C1:R28C4,4,FALSE)="品",VLOOKUP(RC[-3],Sheet1!R2C8:R6C9,2,FALSE),RC[-3])&VLOOKUP(RC[-7],Sheet1!R2C1:R28C4,4,FALSE) -> 战队中全体英雄培养等级达到16级 | I529: 7 | J529: =VLOOKUP(RC[-9],Sheet1!R2C1:R28C6,6,FALSE) -> 培养石
A530: 11 | B530: btn_hero | C530: 17 | D530: 1 | E530: 17 | F530: 19003 | G530: 800000 | H530: =VLOOKUP(RC[-7],Sheet1!R2C1:R28C4,2,FALSE)&VLOOKUP(RC[-7],Sheet1!R2C1:R28C4,3,FALSE)&IF(VLOOKUP(RC[-7],Sheet1!R2C1:R28C4,4,FALSE)="品",VLOOKUP(RC[-3],Sheet1!R2C8:R6C9,2,FALSE),RC[-3])&VLOOKUP(RC[-7],Sheet1!R2C1:R28C4,4,FALSE) -> 战队中全体英雄培养等级达到17级 | I530: 7 | J530: =VLOOKUP(RC[-9],Sheet1!R2C1:R28C6,6,FALSE) -> 培养石
A531: 11 | B531: btn_hero | C531: 18 | D531: 1 | E531: 18 | F531: 19003 | G531: 850000 | H531: =VLOOKUP(RC[-7],Sheet1!R2C1:R28C4,2,FALSE)&VLOOKUP(RC[-7],Sheet1!R2C1:R28C4,3,FALSE)&IF(VLOOKUP(RC[-7],Sheet1!R2C1:R28C4,4,FALSE)="品",VLOOKUP(RC[-3],Sheet1!R2C8:R6C9,2,FALSE),RC[-3])&VLOOKUP(RC[-7],Sheet1!R2C1:R28C4,4,FALSE) -> 战队中全体英雄培养等级达到18级 | I531: 7 | J531: =VLOOKUP(RC[-9],Sheet1!R2C1:R28C6,6,FALSE) -> 培养石
A532: 11 | B532: btn_hero | C532: 19 | D532: 1 | E532: 19 | F532: 19003 | G532: 900000 | H532: =VLOOKUP(RC[-7],Sheet1!R2C1:R28C4,2,FALSE)&VLOOKUP(RC[-7],Sheet1!R2C1:R28C4,3,FALSE)&IF(VLOOKUP(RC[-7],Sheet1!R2C1:R28C4,4,FALSE)="品",VLOOKUP(RC[-3],Sheet1!R2C8:R6C9,2,FALSE),RC[-3])&VLOOKUP(RC[-7],Sheet1!R2C1:R28C4,4,FALSE) -> 战队中全体英雄培养等级达到19级 | I532: 7 | J532: =VLOOKUP(RC[-9],Sheet1!R2C1:R28C6,6,FALSE) -> 培养石
A533: 11 | B533: btn_hero | C533: 20 | D533: 1 | E533: 20 | F533: 19003 | G533: 950000 | H533: =VLOOKUP(RC[-7],Sheet1!R2C1:R28C4,2,FALSE)&VLOOKUP(RC[-7],Sheet1!R2C1:R28C4,3,FALSE)&IF(VLOOKUP(RC[-7],Sheet1!R2C1:R28C4,4,FALSE)="品",VLOOKUP(RC[-3],Sheet1!R2C8:R6C9,2,FALSE),RC[-3])&VLOOKUP(RC[-7],Sheet1!R2C1:R28C4,4,FALSE) -> 战队中全体英雄培养等级达到20级 | I533: 7 | J533: =VLOOKUP(RC[-9],Sheet1!R2C1:R28C6,6,FALSE) -> 培养石
A534: 11 | B534: btn_hero | C534: 21 | D534: 1 | E534: 21 | F534: 19003 | G534: 1000000 | H534: =VLOOKUP(RC[-7],Sheet1!R2C1:R28C4,2,FALSE)&VLOOKUP(RC[-7],Sheet1!R2C1:R28C4,3,FALSE)&IF(VLOOKUP(RC[-7],Sheet1!R2C1:R28C4,4,FALSE)="品",VLOOKUP(RC[-3],Sheet1!R2C8:R6C9,2,FALSE),RC[-3])&VLOOKUP(RC[-7],Sheet1!R2C1:R28C4,4,FALSE) -> 战队中全体英雄培养等级达到21级 | I534: 7 | J534: =VLOOKUP(RC[-9],Sheet1!R2C1:R28C6,6,FALSE) -> 培养石
A535: 11 | B535: btn_hero | C535: 22 | D535: 1 | E535: 22 | F535: 19003 | G535: 1050000 | H535: =VLOOKUP(RC[-7],Sheet1!R2C1:R28C4,2,FALSE)&VLOOKUP(RC[-7],Sheet1!R2C1:R28C4,3,FALSE)&IF(VLOOKUP(RC[-7],Sheet1!R2C1:R28C4,4,FALSE)="品",VLOOKUP(RC[-3],Sheet1!R2C8:R6C9,2,FALSE),RC[-3])&VLOOKUP(RC[-7],Sheet1!R2C1:R28C4,4,FALSE) -> 战队中全体英雄培养等级达到22级 | I535: 7 | J535: =VLOOKUP(RC[-9],Sheet1!R2C1:R28C6,6,FALSE) -> 培养石
A536: 11 | B536: btn_hero | C536: 23 | D536: 1 | E536: 23 | F536: 19003 | G536: 1100000 | H536: =VLOOKUP(RC[-7],Sheet1!R2C1:R28C4,2,FALSE)&VLOOKUP(RC[-7],Sheet1!R2C1:R28C4,3,FALSE)&IF(VLOOKUP(RC[-7],Sheet1!R2C1:R28C4,4,FALSE)="品",VLOOKUP(RC[-3],Sheet1!R2C8:R6C9,2,FALSE),RC[-3])&VLOOKUP(RC[-7],Sheet1!R2C1:R28C4,4,FALSE) -> 战队中全体英雄培养等级达到23级 | I536: 7 | J536: =VLOOKUP(RC[-9],Sheet1!R2C1:R28C6,6,FALSE) -> 培养石
A537: 11 | B537: btn_hero | C537: 24 | D537: 1 | E537: 24 | F537: 19003 | G537: 1150000 | H537: =VLOOKUP(RC[-7],Sheet1!R2C1:R28C4,2,FALSE)&VLOOKUP(RC[-7],Sheet1!R2C1:R28C4,3,FALSE)&IF(VLOOKUP(RC[-7],Sheet1!R2C1:R28C4,4,FALSE)="品",VLOOKUP(RC[-3],Sheet1!R2C8:R6C9,2,FALSE),RC[-3])&VLOOKUP(RC[-7],Sheet1!R2C1:R28C4,4,FALSE) -> 战队中全体英雄培养等级达到24级 | I537: 7 | J537: =VLOOKUP(RC[-9],Sheet1!R2C1:R28C6,6,FALSE) -> 培养石
A538: 11 | B538: btn_hero | C538: 25 | D538: 1 | E538: 25 | F538: 19003 | G538: 1200000 | H538: =VLOOKUP(RC[-7],Sheet1!R2C1:R28C4,2,FALSE)&VLOOKUP(RC[-7],Sheet1!R2C1:R28C4,3,FALSE)&IF(VLOOKUP(RC[-7],Sheet1!R2C1:R28C4,4,FALSE)="品",VLOOKUP(RC[-3],Sheet1!R2C8:R6C9,2,FALSE),RC[-3])&VLOOKUP(RC[-7],Sheet1!R2C1:R28C4,4,FALSE) -> 战队中全体英雄培养等级达到25级 | I538: 7 | J538: =VLOOKUP(RC[-9],Sheet1!R2C1:R28C6,6,FALSE) -> 培养石
A539: 11 | B539: btn_hero | C539: 26 | D539: 1 | E539: 26 | F539: 19003 | G539: 1250000 | H539: =VLOOKUP(RC[-7],Sheet1!R2C1:R28C4,2,FALSE)&VLOOKUP(RC[-7],Sheet1!R2C1:R28C4,3,FALSE)&IF(VLOOKUP(RC[-7],Sheet1!R2C1:R28C4,4,FALSE)="品",VLOOKUP(RC[-3],Sheet1!R2C8:R6C9,2,FALSE),RC[-3])&VLOOKUP(RC[-7],Sheet1!R2C1:R28C4,4,FALSE) -> 战队中全体英雄培养等级达到26级 | I539: 7 | J539: =VLOOKUP(RC[-9],Sheet1!R2C1:R28C6,6,FALSE) -> 培养石
A540: 11 | B540: btn_hero | C540: 27 | D540: 1 | E540: 27 | F540: 19003 | G540: 1300000 | H540: =VLOOKUP(RC[-7],Sheet1!R2C1:R28C4,2,FALSE)&VLOOKUP(RC[-7],Sheet1!R2C1:R28C4,3,FALSE)&IF(VLOOKUP(RC[-7],Sheet1!R2C1:R28C4,4,FALSE)="品",VLOOKUP(RC[-3],Sheet1!R2C8:R6C9,2,FALSE),RC[-3])&VLOOKUP(RC[-7],Sheet1!R2C1:R28C4,4,FALSE) -> 战队中全体英雄培养等级达到27级 | I540: 7 | J540: =VLOOKUP(RC[-9],Sheet1!R2C1:R28C6,6,FALSE) -> 培养石
A541: 11 | B541: btn_hero | C541: 28 | D541: 1 | E541: 28 | F541: 19003 | G541: 1350000 | H541: =VLOOKUP(RC[-7],Sheet1!R2C1:R28C4,2,FALSE)&VLOOKUP(RC[-7],Sheet1!R2C1:R28C4,3,FALSE)&IF(VLOOKUP(RC[-7],Sheet1!R2C1:R28C4,4,FALSE)="品",VLOOKUP(RC[-3],Sheet1!R2C8:R6C9,2,FALSE),RC[-3])&VLOOKUP(RC[-7],Sheet1!R2C1:R28C4,4,FALSE) -> 战队中全体英雄培养等级达到28级 | I541: 7 | J541: =VLOOKUP(RC[-9],Sheet1!R2C1:R28C6,6,FALSE) -> 培养石
A542: 11 | B542: btn_hero | C542: 29 | D542: 1 | E542: 29 | F542: 19003 | G542: 1400000 | H542: =VLOOKUP(RC[-7],Sheet1!R2C1:R28C4,2,FALSE)&VLOOKUP(RC[-7],Sheet1!R2C1:R28C4,3,FALSE)&IF(VLOOKUP(RC[-7],Sheet1!R2C1:R28C4,4,FALSE)="品",VLOOKUP(RC[-3],Sheet1!R2C8:R6C9,2,FALSE),RC[-3])&VLOOKUP(RC[-7],Sheet1!R2C1:R28C4,4,FALSE) -> 战队中全体英雄培养等级达到29级 | I542: 7 | J542: =VLOOKUP(RC[-9],Sheet1!R2C1:R28C6,6,FALSE) -> 培养石
A543: 12 | B543: btn_hero | C543: 1 | D543: 1 | E543: 1 | F543: 10015 | G543: 2 | H543: =VLOOKUP(RC[-7],Sheet1!R2C1:R28C4,2,FALSE)&VLOOKUP(RC[-7],Sheet1!R2C1:R28C4,3,FALSE)&IF(VLOOKUP(RC[-7],Sheet1!R2C1:R28C4,4,FALSE)="品",VLOOKUP(RC[-3],Sheet1!R2C8:R6C9,2,FALSE),RC[-3])&VLOOKUP(RC[-7],Sheet1!R2C1:R28C4,4,FALSE) -> 战队中全体英雄潜能等级达到1级 | I543: 7 | J543: =VLOOKUP(RC[-9],Sheet1!R2C1:R28C6,6,FALSE) -> 潜能合剂
A544: 12 | B544: btn_hero | C544: 2 | D544: 1 | E544: 2 | F544: 10015 | G544: 5 | H544: =VLOOKUP(RC[-7],Sheet1!R2C1:R28C4,2,FALSE)&VLOOKUP(RC[-7],Sheet1!R2C1:R28C4,3,FALSE)&IF(VLOOKUP(RC[-7],Sheet1!R2C1:R28C4,4,FALSE)="品",VLOOKUP(RC[-3],Sheet1!R2C8:R6C9,2,FALSE),RC[-3])&VLOOKUP(RC[-7],Sheet1!R2C1:R28C4,4,FALSE) -> 战队中全体英雄潜能等级达到2级 | I544: 7 | J544: =VLOOKUP(RC[-9],Sheet1!R2C1:R28C6,6,FALSE) -> 潜能合剂
A545: 12 | B545: btn_hero | C545: 3 | D545: 1 | E545: 3 | F545: 10015 | G545: 5 | H545: =VLOOKUP(RC[-7],Sheet1!R2C1:R28C4,2,FALSE)&VLOOKUP(RC[-7],Sheet1!R2C1:R28C4,3,FALSE)&IF(VLOOKUP(RC[-7],Sheet1!R2C1:R28C4,4,FALSE)="品",VLOOKUP(RC[-3],Sheet1!R2C8:R6C9,2,FALSE),RC[-3])&VLOOKUP(RC[-7],Sheet1!R2C1:R28C4,4,FALSE) -> 战队中全体英雄潜能等级达到3级 | I545: 7 | J545: =VLOOKUP(RC[-9],Sheet1!R2C1:R28C6,6,FALSE) -> 潜能合剂
A546: 12 | B546: btn_hero | C546: 4 | D546: 1 | E546: 4 | F546: 10015 | G546: 10 | H546: =VLOOKUP(RC[-7],Sheet1!R2C1:R28C4,2,FALSE)&VLOOKUP(RC[-7],Sheet1!R2C1:R28C4,3,FALSE)&IF(VLOOKUP(RC[-7],Sheet1!R2C1:R28C4,4,FALSE)="品",VLOOKUP(RC[-3],Sheet1!R2C8:R6C9,2,FALSE),RC[-3])&VLOOKUP(RC[-7],Sheet1!R2C1:R28C4,4,FALSE) -> 战队中全体英雄潜能等级达到4级 | I546: 7 | J546: =VLOOKUP(RC[-9],Sheet1!R2C1:R28C6,6,FALSE) -> 潜能合剂
A547: 12 | B547: btn_hero | C547: 5 | D547: 1 | E547: 5 | F547: 10015 | G547: 10 | H547: =VLOOKUP(RC[-7],Sheet1!R2C1:R28C4,2,FALSE)&VLOOKUP(RC[-7],Sheet1!R2C1:R28C4,3,FALSE)&IF(VLOOKUP(RC[-7],Sheet1!R2C1:R28C4,4,FALSE)="品",VLOOKUP(RC[-3],Sheet1!R2C8:R6C9,2,FALSE),RC[-3])&VLOOKUP(RC[-7],Sheet1!R2C1:R28C4,4,FALSE) -> 战队中全体英雄潜能等级达到5级 | I547: 7 | J547: =VLOOKUP(RC[-9],Sheet1!R2C1:R28C6,6,FALSE) -> 潜能合剂
A548: 12 | B548: btn_hero | C548: 6 | D548: 1 | E548: 6 | F548: 10015 | G548: 15 | H548: =VLOOKUP(RC[-7],Sheet1!R2C1:R28C4,2,FALSE)&VLOOKUP(RC[-7],Sheet1!R2C1:R28C4,3,FALSE)&IF(VLOOKUP(RC[-7],Sheet1!R2C1:R28C4,4,FALSE)="品",VLOOKUP(RC[-3],Sheet1!R2C8:R6C9,2,FALSE),RC[-3])&VLOOKUP(RC[-7],Sheet1!R2C1:R28C4,4,FALSE) -> 战队中全体英雄潜能等级达到6级 | I548: 7 | J548: =VLOOKUP(RC[-9],Sheet1!R2C1:R28C6,6,FALSE) -> 潜能合剂
A549: 12 | B549: btn_hero | C549: 7 | D549: 1 | E549: 7 | F549: 10015 | G549: 15 | H549: =VLOOKUP(RC[-7],Sheet1!R2C1:R28C4,2,FALSE)&VLOOKUP(RC[-7],Sheet1!R2C1:R28C4,3,FALSE)&IF(VLOOKUP(RC[-7],Sheet1!R2C1:R28C4,4,FALSE)="品",VLOOKUP(RC[-3],Sheet1!R2C8:R6C9,2,FALSE),RC[-3])&VLOOKUP(RC[-7],Sheet1!R2C1:R28C4,4,FALSE) -> 战队中全体英雄潜能等级达到7级 | I549: 7 | J549: =VLOOKUP(RC[-9],Sheet1!R2C1:R28C6,6,FALSE) -> 潜能合剂
A550: 12 | B550: btn_hero | C550: 8 | D550: 1 | E550: 8 | F550: 10015 | G550: 20 | H550: =VLOOKUP(RC[-7],Sheet1!R2C1:R28C4,2,FALSE)&VLOOKUP(RC[-7],Sheet1!R2C1:R28C4,3,FALSE)&IF(VLOOKUP(RC[-7],Sheet1!R2C1:R28C4,4,FALSE)="品",VLOOKUP(RC[-3],Sheet1!R2C8:R6C9,2,FALSE),RC[-3])&VLOOKUP(RC[-7],Sheet1!R2C1:R28C4,4,FALSE) -> 战队中全体英雄潜能等级达到8级 | I550: 7 | J550: =VLOOKUP(RC[-9],Sheet1!R2C1:R28C6,6,FALSE) -> 潜能合剂
A551: 12 | B551: btn_hero | C551: 9 | D551: 1 | E551: 9 | F551: 10015 | G551: 20 | H551: =VLOOKUP(RC[-7],Sheet1!R2C1:R28C4,2,FALSE)&VLOOKUP(RC[-7],Sheet1!R2C1:R28C4,3,FALSE)&IF(VLOOKUP(RC[-7],Sheet1!R2C1:R28C4,4,FALSE)="品",VLOOKUP(RC[-3],Sheet1!R2C8:R6C9,2,FALSE),RC[-3])&VLOOKUP(RC[-7],Sheet1!R2C1:R28C4,4,FALSE) -> 战队中全体英雄潜能等级达到9级 | I551: 7 | J551: =VLOOKUP(RC[-9],Sheet1!R2C1:R28C6,6,FALSE) -> 潜能合剂
A552: 12 | B552: btn_hero | C552: 10 | D552: 1 | E552: 10 | F552: 10015 | G552: 20 | H552: =VLOOKUP(RC[-7],Sheet1!R2C1:R28C4,2,FALSE)&VLOOKUP(RC[-7],Sheet1!R2C1:R28C4,3,FALSE)&IF(VLOOKUP(RC[-7],Sheet1!R2C1:R28C4,4,FALSE)="品",VLOOKUP(RC[-3],Sheet1!R2C8:R6C9,2,FALSE),RC[-3])&VLOOKUP(RC[-7],Sheet1!R2C1:R28C4,4,FALSE) -> 战队中全体英雄潜能等级达到10级 | I552: 7 | J552: =VLOOKUP(RC[-9],Sheet1!R2C1:R28C6,6,FALSE) -> 潜能合剂
A553: 12 | B553: btn_hero | C553: 11 | D553: 1 | E553: 11 | F553: 10015 | G553: 20 | H553: =VLOOKUP(RC[-7],Sheet1!R2C1:R28C4,2,FALSE)&VLOOKUP(RC[-7],Sheet1!R2C1:R28C4,3,FALSE)&IF(VLOOKUP(RC[-7],Sheet1!R2C1:R28C4,4,FALSE)="品",VLOOKUP(RC[-3],Sheet1!R2C8:R6C9,2,FALSE),RC[-3])&VLOOKUP(RC[-7],Sheet1!R2C1:R28C4,4,FALSE) -> 战队中全体英雄潜能等级达到11级 | I553: 7 | J553: =VLOOKUP(RC[-9],Sheet1!R2C1:R28C6,6,FALSE) -> 潜能合剂
A554: 12 | B554: btn_hero | C554: 12 | D554: 1 | E554: 12 | F554: 10015 | G554: 20 | H554: =VLOOKUP(RC[-7],Sheet1!R2C1:R28C4,2,FALSE)&VLOOKUP(RC[-7],Sheet1!R2C1:R28C4,3,FALSE)&IF(VLOOKUP(RC[-7],Sheet1!R2C1:R28C4,4,FALSE)="品",VLOOKUP(RC[-3],Sheet1!R2C8:R6C9,2,FALSE),RC[-3])&VLOOKUP(RC[-7],Sheet1!R2C1:R28C4,4,FALSE) -> 战队中全体英雄潜能等级达到12级 | I554: 7 | J554: =VLOOKUP(RC[-9],Sheet1!R2C1:R28C6,6,FALSE) -> 潜能合剂
A555: 12 | B555: btn_hero | C555: 13 | D555: 1 | E555: 13 | F555: 10015 | G555: 20 | H555: =VLOOKUP(RC[-7],Sheet1!R2C1:R28C4,2,FALSE)&VLOOKUP(RC[-7],Sheet1!R2C1:R28C4,3,FALSE)&IF(VLOOKUP(RC[-7],Sheet1!R2C1:R28C4,4,FALSE)="品",VLOOKUP(RC[-3],Sheet1!R2C8:R6C9,2,FALSE),RC[-3])&VLOOKUP(RC[-7],Sheet1!R2C1:R28C4,4,FALSE) -> 战队中全体英雄潜能等级达到13级 | I555: 7 | J555: =VLOOKUP(RC[-9],Sheet1!R2C1:R28C6,6,FALSE) -> 潜能合剂
A556: 12 | B556: btn_hero | C556: 14 | D556: 1 | E556: 14 | F556: 10015 | G556: 20 | H556: =VLOOKUP(RC[-7],Sheet1!R2C1:R28C4,2,FALSE)&VLOOKUP(RC[-7],Sheet1!R2C1:R28C4,3,FALSE)&IF(VLOOKUP(RC[-7],Sheet1!R2C1:R28C4,4,FALSE)="品",VLOOKUP(RC[-3],Sheet1!R2C8:R6C9,2,FALSE),RC[-3])&VLOOKUP(RC[-7],Sheet1!R2C1:R28C4,4,FALSE) -> 战队中全体英雄潜能等级达到14级 | I556: 7 | J556: =VLOOKUP(RC[-9],Sheet1!R2C1:R28C6,6,FALSE) -> 潜能合剂
A557: 12 | B557: btn_hero | C557: 15 | D557: 1 | E557: 15 | F557: 10015 | G557: 20 | H557: =VLOOKUP(RC[-7],Sheet1!R2C1:R28C4,2,FALSE)&VLOOKUP(RC[-7],Sheet1!R2C1:R28C4,3,FALSE)&IF(VLOOKUP(RC[-7],Sheet1!R2C1:R28C4,4,FALSE)="品",VLOOKUP(RC[-3],Sheet1!R2C8:R6C9,2,FALSE),RC[-3])&VLOOKUP(RC[-7],Sheet1!R2C1:R28C4,4,FALSE) -> 战队中全体英雄潜能等级达到15级 | I557: 7 | J557: =VLOOKUP(RC[-9],Sheet1!R2C1:R28C6,6,FALSE) -> 潜能合剂
A558: 13 | B558: btn_store | C558: 1 | D558: 1 | E558: 50 | F558: 19006 | G558: 50 | H558: =VLOOKUP(RC[-7],Sheet1!R2C1:R28C4,2,FALSE)&VLOOKUP(RC[-7],Sheet1!R2C1:R28C4,3,FALSE)&IF(VLOOKUP(RC[-7],Sheet1!R2C1:R28C4,4,FALSE)="品",VLOOKUP(RC[-3],Sheet1!R2C8:R6C9,2,FALSE),RC[-3])&VLOOKUP(RC[-7],Sheet1!R2C1:R28C4,4,FALSE) -> 累计刷新魂晶商店达到50次 | I558: 11 | J558: =VLOOKUP(RC[-9],Sheet1!R2C1:R28C6,6,FALSE) -> 魂晶
A559: 13 | B559: btn_store | C559: 2 | D559: 1 | E559: 100 | F559: 19006 | G559: 50 | H559: =VLOOKUP(RC[-7],Sheet1!R2C1:R28C4,2,FALSE)&VLOOKUP(RC[-7],Sheet1!R2C1:R28C4,3,FALSE)&IF(VLOOKUP(RC[-7],Sheet1!R2C1:R28C4,4,FALSE)="品",VLOOKUP(RC[-3],Sheet1!R2C8:R6C9,2,FALSE),RC[-3])&VLOOKUP(RC[-7],Sheet1!R2C1:R28C4,4,FALSE) -> 累计刷新魂晶商店达到100次 | I559: 11 | J559: =VLOOKUP(RC[-9],Sheet1!R2C1:R28C6,6,FALSE) -> 魂晶
A560: 13 | B560: btn_store | C560: 3 | D560: 1 | E560: 150 | F560: 19006 | G560: 100 | H560: =VLOOKUP(RC[-7],Sheet1!R2C1:R28C4,2,FALSE)&VLOOKUP(RC[-7],Sheet1!R2C1:R28C4,3,FALSE)&IF(VLOOKUP(RC[-7],Sheet1!R2C1:R28C4,4,FALSE)="品",VLOOKUP(RC[-3],Sheet1!R2C8:R6C9,2,FALSE),RC[-3])&VLOOKUP(RC[-7],Sheet1!R2C1:R28C4,4,FALSE) -> 累计刷新魂晶商店达到150次 | I560: 11 | J560: =VLOOKUP(RC[-9],Sheet1!R2C1:R28C6,6,FALSE) -> 魂晶
A561: 13 | B561: btn_store | C561: 4 | D561: 1 | E561: 200 | F561: 19006 | G561: 100 | H561: =VLOOKUP(RC[-7],Sheet1!R2C1:R28C4,2,FALSE)&VLOOKUP(RC[-7],Sheet1!R2C1:R28C4,3,FALSE)&IF(VLOOKUP(RC[-7],Sheet1!R2C1:R28C4,4,FALSE)="品",VLOOKUP(RC[-3],Sheet1!R2C8:R6C9,2,FALSE),RC[-3])&VLOOKUP(RC[-7],Sheet1!R2C1:R28C4,4,FALSE) -> 累计刷新魂晶商店达到200次 | I561: 11 | J561: =VLOOKUP(RC[-9],Sheet1!R2C1:R28C6,6,FALSE) -> 魂晶
A562: 13 | B562: btn_store | C562: 5 | D562: 1 | E562: 250 | F562: 19006 | G562: 150 | H562: =VLOOKUP(RC[-7],Sheet1!R2C1:R28C4,2,FALSE)&VLOOKUP(RC[-7],Sheet1!R2C1:R28C4,3,FALSE)&IF(VLOOKUP(RC[-7],Sheet1!R2C1:R28C4,4,FALSE)="品",VLOOKUP(RC[-3],Sheet1!R2C8:R6C9,2,FALSE),RC[-3])&VLOOKUP(RC[-7],Sheet1!R2C1:R28C4,4,FALSE) -> 累计刷新魂晶商店达到250次 | I562: 11 | J562: =VLOOKUP(RC[-9],Sheet1!R2C1:R28C6,6,FALSE) -> 魂晶
A563: 13 | B563: btn_store | C563: 6 | D563: 1 | E563: 300 | F563: 19006 | G563: 150 | H563: =VLOOKUP(RC[-7],Sheet1!R2C1:R28C4,2,FALSE)&VLOOKUP(RC[-7],Sheet1!R2C1:R28C4,3,FALSE)&IF(VLOOKUP(RC[-7],Sheet1!R2C1:R28C4,4,FALSE)="品",VLOOKUP(RC[-3],Sheet1!R2C8:R6C9,2,FALSE),RC[-3])&VLOOKUP(RC[-7],Sheet1!R2C1:R28C4,4,FALSE) -> 累计刷新魂晶商店达到300次 | I563: 11 | J563: =VLOOKUP(RC[-9],Sheet1!R2C1:R28C6,6,FALSE) -> 魂晶
A564: 13 | B564: btn_store | C564: 7 | D564: 1 | E564: 350 | F564: 19006 | G564: 200 | H564: =VLOOKUP(RC[-7],Sheet1!R2C1:R28C4,2,FALSE)&VLOOKUP(RC[-7],Sheet1!R2C1:R28C4,3,FALSE)&IF(VLOOKUP(RC[-7],Sheet1!R2C1:R28C4,4,FALSE)="品",VLOOKUP(RC[-3],Sheet1!R2C8:R6C9,2,FALSE),RC[-3])&VLOOKUP(RC[-7],Sheet1!R2C1:R28C4,4,FALSE) -> 累计刷新魂晶商店达到350次 | I564: 11 | J564: =VLOOKUP(RC[-9],Sheet1!R2C1:R28C6,6,FALSE) -> 魂晶
A565: 13 | B565: btn_store | C565: 8 | D565: 1 | E565: 400 | F565: 19006 | G565: 200 | H565: =VLOOKUP(RC[-7],Sheet1!R2C1:R28C4,2,FALSE)&VLOOKUP(RC[-7],Sheet1!R2C1:R28C4,3,FALSE)&IF(VLOOKUP(RC[-7],Sheet1!R2C1:R28C4,4,FALSE)="品",VLOOKUP(RC[-3],Sheet1!R2C8:R6C9,2,FALSE),RC[-3])&VLOOKUP(RC[-7],Sheet1!R2C1:R28C4,4,FALSE) -> 累计刷新魂晶商店达到400次 | I565: 11 | J565: =VLOOKUP(RC[-9],Sheet1!R2C1:R28C6,6,FALSE) -> 魂晶
A566: 13 | B566: btn_store | C566: 9 | D566: 1 | E566: 450 | F566: 19006 | G566: 250 | H566: =VLOOKUP(RC[-7],Sheet1!R2C1:R28C4,2,FALSE)&VLOOKUP(RC[-7],Sheet1!R2C1:R28C4,3,FALSE)&IF(VLOOKUP(RC[-7],Sheet1!R2C1:R28C4,4,FALSE)="品",VLOOKUP(RC[-3],Sheet1!R2C8:R6C9,2,FALSE),RC[-3])&VLOOKUP(RC[-7],Sheet1!R2C1:R28C4,4,FALSE) -> 累计刷新魂晶商店达到450次 | I566: 11 | J566: =VLOOKUP(RC[-9],Sheet1!R2C1:R28C6,6,FALSE) -> 魂晶
A567: 13 | B567: btn_store | C567: 10 | D567: 1 | E567: 500 | F567: 19006 | G567: 250 | H567: =VLOOKUP(RC[-7],Sheet1!R2C1:R28C4,2,FALSE)&VLOOKUP(RC[-7],Sheet1!R2C1:R28C4,3,FALSE)&IF(VLOOKUP(RC[-7],Sheet1!R2C1:R28C4,4,FALSE)="品",VLOOKUP(RC[-3],Sheet1!R2C8:R6C9,2,FALSE),RC[-3])&VLOOKUP(RC[-7],Sheet1!R2C1:R28C4,4,FALSE) -> 累计刷新魂晶商店达到500次 | I567: 11 | J567: =VLOOKUP(RC[-9],Sheet1!R2C1:R28C6,6,FALSE) -> 魂晶
A568: 13 | B568: btn_store | C568: 11 | D568: 1 | E568: 600 | F568: 19006 | G568: 300 | H568: =VLOOKUP(RC[-7],Sheet1!R2C1:R28C4,2,FALSE)&VLOOKUP(RC[-7],Sheet1!R2C1:R28C4,3,FALSE)&IF(VLOOKUP(RC[-7],Sheet1!R2C1:R28C4,4,FALSE)="品",VLOOKUP(RC[-3],Sheet1!R2C8:R6C9,2,FALSE),RC[-3])&VLOOKUP(RC[-7],Sheet1!R2C1:R28C4,4,FALSE) -> 累计刷新魂晶商店达到600次 | I568: 11 | J568: =VLOOKUP(RC[-9],Sheet1!R2C1:R28C6,6,FALSE) -> 魂晶
A569: 13 | B569: btn_store | C569: 12 | D569: 1 | E569: 700 | F569: 19006 | G569: 300 | H569: =VLOOKUP(RC[-7],Sheet1!R2C1:R28C4,2,FALSE)&VLOOKUP(RC[-7],Sheet1!R2C1:R28C4,3,FALSE)&IF(VLOOKUP(RC[-7],Sheet1!R2C1:R28C4,4,FALSE)="品",VLOOKUP(RC[-3],Sheet1!R2C8:R6C9,2,FALSE),RC[-3])&VLOOKUP(RC[-7],Sheet1!R2C1:R28C4,4,FALSE) -> 累计刷新魂晶商店达到700次 | I569: 11 | J569: =VLOOKUP(RC[-9],Sheet1!R2C1:R28C6,6,FALSE) -> 魂晶
A570: 13 | B570: btn_store | C570: 13 | D570: 1 | E570: 800 | F570: 19006 | G570: 350 | H570: =VLOOKUP(RC[-7],Sheet1!R2C1:R28C4,2,FALSE)&VLOOKUP(RC[-7],Sheet1!R2C1:R28C4,3,FALSE)&IF(VLOOKUP(RC[-7],Sheet1!R2C1:R28C4,4,FALSE)="品",VLOOKUP(RC[-3],Sheet1!R2C8:R6C9,2,FALSE),RC[-3])&VLOOKUP(RC[-7],Sheet1!R2C1:R28C4,4,FALSE) -> 累计刷新魂晶商店达到800次 | I570: 11 | J570: =VLOOKUP(RC[-9],Sheet1!R2C1:R28C6,6,FALSE) -> 魂晶
A571: 13 | B571: btn_store | C571: 14 | D571: 1 | E571: 900 | F571: 19006 | G571: 350 | H571: =VLOOKUP(RC[-7],Sheet1!R2C1:R28C4,2,FALSE)&VLOOKUP(RC[-7],Sheet1!R2C1:R28C4,3,FALSE)&IF(VLOOKUP(RC[-7],Sheet1!R2C1:R28C4,4,FALSE)="品",VLOOKUP(RC[-3],Sheet1!R2C8:R6C9,2,FALSE),RC[-3])&VLOOKUP(RC[-7],Sheet1!R2C1:R28C4,4,FALSE) -> 累计刷新魂晶商店达到900次 | I571: 11 | J571: =VLOOKUP(RC[-9],Sheet1!R2C1:R28C6,6,FALSE) -> 魂晶
A572: 13 | B572: btn_store | C572: 15 | D572: 1 | E572: 1000 | F572: 19006 | G572: 400 | H572: =VLOOKUP(RC[-7],Sheet1!R2C1:R28C4,2,FALSE)&VLOOKUP(RC[-7],Sheet1!R2C1:R28C4,3,FALSE)&IF(VLOOKUP(RC[-7],Sheet1!R2C1:R28C4,4,FALSE)="品",VLOOKUP(RC[-3],Sheet1!R2C8:R6C9,2,FALSE),RC[-3])&VLOOKUP(RC[-7],Sheet1!R2C1:R28C4,4,FALSE) -> 累计刷新魂晶商店达到1000次 | I572: 11 | J572: =VLOOKUP(RC[-9],Sheet1!R2C1:R28C6,6,FALSE) -> 魂晶
A573: 13 | B573: btn_store | C573: 16 | D573: 1 | E573: 1100 | F573: 19006 | G573: 400 | H573: =VLOOKUP(RC[-7],Sheet1!R2C1:R28C4,2,FALSE)&VLOOKUP(RC[-7],Sheet1!R2C1:R28C4,3,FALSE)&IF(VLOOKUP(RC[-7],Sheet1!R2C1:R28C4,4,FALSE)="品",VLOOKUP(RC[-3],Sheet1!R2C8:R6C9,2,FALSE),RC[-3])&VLOOKUP(RC[-7],Sheet1!R2C1:R28C4,4,FALSE) -> 累计刷新魂晶商店达到1100次 | I573: 11 | J573: =VLOOKUP(RC[-9],Sheet1!R2C1:R28C6,6,FALSE) -> 魂晶
A574: 13 | B574: btn_store | C574: 17 | D574: 1 | E574: 1200 | F574: 19006 | G574: 450 | H574: =VLOOKUP(RC[-7],Sheet1!R2C1:R28C4,2,FALSE)&VLOOKUP(RC[-7],Sheet1!R2C1:R28C4,3,FALSE)&IF(VLOOKUP(RC[-7],Sheet1!R2C1:R28C4,4,FALSE)="品",VLOOKUP(RC[-3],Sheet1!R2C8:R6C9,2,FALSE),RC[-3])&VLOOKUP(RC[-7],Sheet1!R2C1:R28C4,4,FALSE) -> 累计刷新魂晶商店达到1200次 | I574: 11 | J574: =VLOOKUP(RC[-9],Sheet1!R2C1:R28C6,6,FALSE) -> 魂晶
A575: 13 | B575: btn_store | C575: 18 | D575: 1 | E575: 1300 | F575: 19006 | G575: 450 | H575: =VLOOKUP(RC[-7],Sheet1!R2C1:R28C4,2,FALSE)&VLOOKUP(RC[-7],Sheet1!R2C1:R28C4,3,FALSE)&IF(VLOOKUP(RC[-7],Sheet1!R2C1:R28C4,4,FALSE)="品",VLOOKUP(RC[-3],Sheet1!R2C8:R6C9,2,FALSE),RC[-3])&VLOOKUP(RC[-7],Sheet1!R2C1:R28C4,4,FALSE) -> 累计刷新魂晶商店达到1300次 | I575: 11 | J575: =VLOOKUP(RC[-9],Sheet1!R2C1:R28C6,6,FALSE) -> 魂晶
A576: 13 | B576: btn_store | C576: 19 | D576: 1 | E576: 1400 | F576: 19006 | G576: 500 | H576: =VLOOKUP(RC[-7],Sheet1!R2C1:R28C4,2,FALSE)&VLOOKUP(RC[-7],Sheet1!R2C1:R28C4,3,FALSE)&IF(VLOOKUP(RC[-7],Sheet1!R2C1:R28C4,4,FALSE)="品",VLOOKUP(RC[-3],Sheet1!R2C8:R6C9,2,FALSE),RC[-3])&VLOOKUP(RC[-7],Sheet1!R2C1:R28C4,4,FALSE) -> 累计刷新魂晶商店达到1400次 | I576: 11 | J576: =VLOOKUP(RC[-9],Sheet1!R2C1:R28C6,6,FALSE) -> 魂晶
A577: 13 | B577: btn_store | C577: 20 | D577: 1 | E577: 1500 | F577: 19006 | G577: 500 | H577: =VLOOKUP(RC[-7],Sheet1!R2C1:R28C4,2,FALSE)&VLOOKUP(RC[-7],Sheet1!R2C1:R28C4,3,FALSE)&IF(VLOOKUP(RC[-7],Sheet1!R2C1:R28C4,4,FALSE)="品",VLOOKUP(RC[-3],Sheet1!R2C8:R6C9,2,FALSE),RC[-3])&VLOOKUP(RC[-7],Sheet1!R2C1:R28C4,4,FALSE) -> 累计刷新魂晶商店达到1500次 | I577: 11 | J577: =VLOOKUP(RC[-9],Sheet1!R2C1:R28C6,6,FALSE) -> 魂晶
A578: 13 | B578: btn_store | C578: 21 | D578: 1 | E578: 1600 | F578: 19006 | G578: 600 | H578: =VLOOKUP(RC[-7],Sheet1!R2C1:R28C4,2,FALSE)&VLOOKUP(RC[-7],Sheet1!R2C1:R28C4,3,FALSE)&IF(VLOOKUP(RC[-7],Sheet1!R2C1:R28C4,4,FALSE)="品",VLOOKUP(RC[-3],Sheet1!R2C8:R6C9,2,FALSE),RC[-3])&VLOOKUP(RC[-7],Sheet1!R2C1:R28C4,4,FALSE) -> 累计刷新魂晶商店达到1600次 | I578: 11 | J578: =VLOOKUP(RC[-9],Sheet1!R2C1:R28C6,6,FALSE) -> 魂晶
A579: 13 | B579: btn_store | C579: 22 | D579: 1 | E579: 1700 | F579: 19006 | G579: 600 | H579: =VLOOKUP(RC[-7],Sheet1!R2C1:R28C4,2,FALSE)&VLOOKUP(RC[-7],Sheet1!R2C1:R28C4,3,FALSE)&IF(VLOOKUP(RC[-7],Sheet1!R2C1:R28C4,4,FALSE)="品",VLOOKUP(RC[-3],Sheet1!R2C8:R6C9,2,FALSE),RC[-3])&VLOOKUP(RC[-7],Sheet1!R2C1:R28C4,4,FALSE) -> 累计刷新魂晶商店达到1700次 | I579: 11 | J579: =VLOOKUP(RC[-9],Sheet1!R2C1:R28C6,6,FALSE) -> 魂晶
A580: 13 | B580: btn_store | C580: 23 | D580: 1 | E580: 1800 | F580: 19006 | G580: 700 | H580: =VLOOKUP(RC[-7],Sheet1!R2C1:R28C4,2,FALSE)&VLOOKUP(RC[-7],Sheet1!R2C1:R28C4,3,FALSE)&IF(VLOOKUP(RC[-7],Sheet1!R2C1:R28C4,4,FALSE)="品",VLOOKUP(RC[-3],Sheet1!R2C8:R6C9,2,FALSE),RC[-3])&VLOOKUP(RC[-7],Sheet1!R2C1:R28C4,4,FALSE) -> 累计刷新魂晶商店达到1800次 | I580: 11 | J580: =VLOOKUP(RC[-9],Sheet1!R2C1:R28C6,6,FALSE) -> 魂晶
A581: 13 | B581: btn_store | C581: 24 | D581: 1 | E581: 1900 | F581: 19006 | G581: 700 | H581: =VLOOKUP(RC[-7],Sheet1!R2C1:R28C4,2,FALSE)&VLOOKUP(RC[-7],Sheet1!R2C1:R28C4,3,FALSE)&IF(VLOOKUP(RC[-7],Sheet1!R2C1:R28C4,4,FALSE)="品",VLOOKUP(RC[-3],Sheet1!R2C8:R6C9,2,FALSE),RC[-3])&VLOOKUP(RC[-7],Sheet1!R2C1:R28C4,4,FALSE) -> 累计刷新魂晶商店达到1900次 | I581: 11 | J581: =VLOOKUP(RC[-9],Sheet1!R2C1:R28C6,6,FALSE) -> 魂晶
A582: 13 | B582: btn_store | C582: 25 | D582: 1 | E582: 2000 | F582: 19006 | G582: 800 | H582: =VLOOKUP(RC[-7],Sheet1!R2C1:R28C4,2,FALSE)&VLOOKUP(RC[-7],Sheet1!R2C1:R28C4,3,FALSE)&IF(VLOOKUP(RC[-7],Sheet1!R2C1:R28C4,4,FALSE)="品",VLOOKUP(RC[-3],Sheet1!R2C8:R6C9,2,FALSE),RC[-3])&VLOOKUP(RC[-7],Sheet1!R2C1:R28C4,4,FALSE) -> 累计刷新魂晶商店达到2000次 | I582: 11 | J582: =VLOOKUP(RC[-9],Sheet1!R2C1:R28C6,6,FALSE) -> 魂晶
A583: 13 | B583: btn_store | C583: 26 | D583: 1 | E583: 2100 | F583: 19006 | G583: 800 | H583: =VLOOKUP(RC[-7],Sheet1!R2C1:R28C4,2,FALSE)&VLOOKUP(RC[-7],Sheet1!R2C1:R28C4,3,FALSE)&IF(VLOOKUP(RC[-7],Sheet1!R2C1:R28C4,4,FALSE)="品",VLOOKUP(RC[-3],Sheet1!R2C8:R6C9,2,FALSE),RC[-3])&VLOOKUP(RC[-7],Sheet1!R2C1:R28C4,4,FALSE) -> 累计刷新魂晶商店达到2100次 | I583: 11 | J583: =VLOOKUP(RC[-9],Sheet1!R2C1:R28C6,6,FALSE) -> 魂晶
A584: 13 | B584: btn_store | C584: 27 | D584: 1 | E584: 2200 | F584: 19006 | G584: 900 | H584: =VLOOKUP(RC[-7],Sheet1!R2C1:R28C4,2,FALSE)&VLOOKUP(RC[-7],Sheet1!R2C1:R28C4,3,FALSE)&IF(VLOOKUP(RC[-7],Sheet1!R2C1:R28C4,4,FALSE)="品",VLOOKUP(RC[-3],Sheet1!R2C8:R6C9,2,FALSE),RC[-3])&VLOOKUP(RC[-7],Sheet1!R2C1:R28C4,4,FALSE) -> 累计刷新魂晶商店达到2200次 | I584: 11 | J584: =VLOOKUP(RC[-9],Sheet1!R2C1:R28C6,6,FALSE) -> 魂晶
A585: 13 | B585: btn_store | C585: 28 | D585: 1 | E585: 2300 | F585: 19006 | G585: 900 | H585: =VLOOKUP(RC[-7],Sheet1!R2C1:R28C4,2,FALSE)&VLOOKUP(RC[-7],Sheet1!R2C1:R28C4,3,FALSE)&IF(VLOOKUP(RC[-7],Sheet1!R2C1:R28C4,4,FALSE)="品",VLOOKUP(RC[-3],Sheet1!R2C8:R6C9,2,FALSE),RC[-3])&VLOOKUP(RC[-7],Sheet1!R2C1:R28C4,4,FALSE) -> 累计刷新魂晶商店达到2300次 | I585: 11 | J585: =VLOOKUP(RC[-9],Sheet1!R2C1:R28C6,6,FALSE) -> 魂晶
A586: 13 | B586: btn_store | C586: 29 | D586: 1 | E586: 2400 | F586: 19006 | G586: 1000 | H586: =VLOOKUP(RC[-7],Sheet1!R2C1:R28C4,2,FALSE)&VLOOKUP(RC[-7],Sheet1!R2C1:R28C4,3,FALSE)&IF(VLOOKUP(RC[-7],Sheet1!R2C1:R28C4,4,FALSE)="品",VLOOKUP(RC[-3],Sheet1!R2C8:R6C9,2,FALSE),RC[-3])&VLOOKUP(RC[-7],Sheet1!R2C1:R28C4,4,FALSE) -> 累计刷新魂晶商店达到2400次 | I586: 11 | J586: =VLOOKUP(RC[-9],Sheet1!R2C1:R28C6,6,FALSE) -> 魂晶
A587: 13 | B587: btn_store | C587: 30 | D587: 1 | E587: 2500 | F587: 19006 | G587: 1000 | H587: =VLOOKUP(RC[-7],Sheet1!R2C1:R28C4,2,FALSE)&VLOOKUP(RC[-7],Sheet1!R2C1:R28C4,3,FALSE)&IF(VLOOKUP(RC[-7],Sheet1!R2C1:R28C4,4,FALSE)="品",VLOOKUP(RC[-3],Sheet1!R2C8:R6C9,2,FALSE),RC[-3])&VLOOKUP(RC[-7],Sheet1!R2C1:R28C4,4,FALSE) -> 累计刷新魂晶商店达到2500次 | I587: 11 | J587: =VLOOKUP(RC[-9],Sheet1!R2C1:R28C6,6,FALSE) -> 魂晶
A588: 13 | B588: btn_store | C588: 31 | D588: 1 | E588: 2600 | F588: 19006 | G588: 1000 | H588: =VLOOKUP(RC[-7],Sheet1!R2C1:R28C4,2,FALSE)&VLOOKUP(RC[-7],Sheet1!R2C1:R28C4,3,FALSE)&IF(VLOOKUP(RC[-7],Sheet1!R2C1:R28C4,4,FALSE)="品",VLOOKUP(RC[-3],Sheet1!R2C8:R6C9,2,FALSE),RC[-3])&VLOOKUP(RC[-7],Sheet1!R2C1:R28C4,4,FALSE) -> 累计刷新魂晶商店达到2600次 | I588: 11 | J588: =VLOOKUP(RC[-9],Sheet1!R2C1:R28C6,6,FALSE) -> 魂晶
A589: 13 | B589: btn_store | C589: 32 | D589: 1 | E589: 2700 | F589: 19006 | G589: 1000 | H589: =VLOOKUP(RC[-7],Sheet1!R2C1:R28C4,2,FALSE)&VLOOKUP(RC[-7],Sheet1!R2C1:R28C4,3,FALSE)&IF(VLOOKUP(RC[-7],Sheet1!R2C1:R28C4,4,FALSE)="品",VLOOKUP(RC[-3],Sheet1!R2C8:R6C9,2,FALSE),RC[-3])&VLOOKUP(RC[-7],Sheet1!R2C1:R28C4,4,FALSE) -> 累计刷新魂晶商店达到2700次 | I589: 11 | J589: =VLOOKUP(RC[-9],Sheet1!R2C1:R28C6,6,FALSE) -> 魂晶
A590: 13 | B590: btn_store | C590: 33 | D590: 1 | E590: 2800 | F590: 19006 | G590: 1000 | H590: =VLOOKUP(RC[-7],Sheet1!R2C1:R28C4,2,FALSE)&VLOOKUP(RC[-7],Sheet1!R2C1:R28C4,3,FALSE)&IF(VLOOKUP(RC[-7],Sheet1!R2C1:R28C4,4,FALSE)="品",VLOOKUP(RC[-3],Sheet1!R2C8:R6C9,2,FALSE),RC[-3])&VLOOKUP(RC[-7],Sheet1!R2C1:R28C4,4,FALSE) -> 累计刷新魂晶商店达到2800次 | I590: 11 | J590: =VLOOKUP(RC[-9],Sheet1!R2C1:R28C6,6,FALSE) -> 魂晶
A591: 13 | B591: btn_store | C591: 34 | D591: 1 | E591: 2900 | F591: 19006 | G591: 1000 | H591: =VLOOKUP(RC[-7],Sheet1!R2C1:R28C4,2,FALSE)&VLOOKUP(RC[-7],Sheet1!R2C1:R28C4,3,FALSE)&IF(VLOOKUP(RC[-7],Sheet1!R2C1:R28C4,4,FALSE)="品",VLOOKUP(RC[-3],Sheet1!R2C8:R6C9,2,FALSE),RC[-3])&VLOOKUP(RC[-7],Sheet1!R2C1:R28C4,4,FALSE) -> 累计刷新魂晶商店达到2900次 | I591: 11 | J591: =VLOOKUP(RC[-9],Sheet1!R2C1:R28C6,6,FALSE) -> 魂晶
A592: 13 | B592: btn_store | C592: 35 | D592: 1 | E592: 3000 | F592: 19006 | G592: 1000 | H592: =VLOOKUP(RC[-7],Sheet1!R2C1:R28C4,2,FALSE)&VLOOKUP(RC[-7],Sheet1!R2C1:R28C4,3,FALSE)&IF(VLOOKUP(RC[-7],Sheet1!R2C1:R28C4,4,FALSE)="品",VLOOKUP(RC[-3],Sheet1!R2C8:R6C9,2,FALSE),RC[-3])&VLOOKUP(RC[-7],Sheet1!R2C1:R28C4,4,FALSE) -> 累计刷新魂晶商店达到3000次 | I592: 11 | J592: =VLOOKUP(RC[-9],Sheet1!R2C1:R28C6,6,FALSE) -> 魂晶
A593: 14 | B593: btn_recruit | C593: 1 | D593: 1 | E593: 48 | F593: 19003 | G593: 10000 | H593: =VLOOKUP(RC[-7],Sheet1!R2C1:R28C4,2,FALSE)&VLOOKUP(RC[-7],Sheet1!R2C1:R28C4,3,FALSE)&IF(VLOOKUP(RC[-7],Sheet1!R2C1:R28C4,4,FALSE)="品",VLOOKUP(RC[-3],Sheet1!R2C8:R6C9,2,FALSE),RC[-3])&VLOOKUP(RC[-7],Sheet1!R2C1:R28C4,4,FALSE) -> 寻访遗迹累计时间达到48小时 | I593: 20 | J593: =VLOOKUP(RC[-9],Sheet1!R2C1:R28C6,6,FALSE) -> 金币
A594: 14 | B594: btn_recruit | C594: 2 | D594: 1 | E594: 96 | F594: 19003 | G594: 20000 | H594: =VLOOKUP(RC[-7],Sheet1!R2C1:R28C4,2,FALSE)&VLOOKUP(RC[-7],Sheet1!R2C1:R28C4,3,FALSE)&IF(VLOOKUP(RC[-7],Sheet1!R2C1:R28C4,4,FALSE)="品",VLOOKUP(RC[-3],Sheet1!R2C8:R6C9,2,FALSE),RC[-3])&VLOOKUP(RC[-7],Sheet1!R2C1:R28C4,4,FALSE) -> 寻访遗迹累计时间达到96小时 | I594: 20 | J594: =VLOOKUP(RC[-9],Sheet1!R2C1:R28C6,6,FALSE) -> 金币
A595: 14 | B595: btn_recruit | C595: 3 | D595: 1 | E595: 144 | F595: 19003 | G595: 30000 | H595: =VLOOKUP(RC[-7],Sheet1!R2C1:R28C4,2,FALSE)&VLOOKUP(RC[-7],Sheet1!R2C1:R28C4,3,FALSE)&IF(VLOOKUP(RC[-7],Sheet1!R2C1:R28C4,4,FALSE)="品",VLOOKUP(RC[-3],Sheet1!R2C8:R6C9,2,FALSE),RC[-3])&VLOOKUP(RC[-7],Sheet1!R2C1:R28C4,4,FALSE) -> 寻访遗迹累计时间达到144小时 | I595: 20 | J595: =VLOOKUP(RC[-9],Sheet1!R2C1:R28C6,6,FALSE) -> 金币
A596: 14 | B596: btn_recruit | C596: 4 | D596: 1 | E596: 192 | F596: 19003 | G596: 40000 | H596: =VLOOKUP(RC[-7],Sheet1!R2C1:R28C4,2,FALSE)&VLOOKUP(RC[-7],Sheet1!R2C1:R28C4,3,FALSE)&IF(VLOOKUP(RC[-7],Sheet1!R2C1:R28C4,4,FALSE)="品",VLOOKUP(RC[-3],Sheet1!R2C8:R6C9,2,FALSE),RC[-3])&VLOOKUP(RC[-7],Sheet1!R2C1:R28C4,4,FALSE) -> 寻访遗迹累计时间达到192小时 | I596: 20 | J596: =VLOOKUP(RC[-9],Sheet1!R2C1:R28C6,6,FALSE) -> 金币
A597: 14 | B597: btn_recruit | C597: 5 | D597: 1 | E597: 240 | F597: 19003 | G597: 50000 | H597: =VLOOKUP(RC[-7],Sheet1!R2C1:R28C4,2,FALSE)&VLOOKUP(RC[-7],Sheet1!R2C1:R28C4,3,FALSE)&IF(VLOOKUP(RC[-7],Sheet1!R2C1:R28C4,4,FALSE)="品",VLOOKUP(RC[-3],Sheet1!R2C8:R6C9,2,FALSE),RC[-3])&VLOOKUP(RC[-7],Sheet1!R2C1:R28C4,4,FALSE) -> 寻访遗迹累计时间达到240小时 | I597: 20 | J597: =VLOOKUP(RC[-9],Sheet1!R2C1:R28C6,6,FALSE) -> 金币
A598: 14 | B598: btn_recruit | C598: 6 | D598: 1 | E598: 360 | F598: 19003 | G598: 60000 | H598: =VLOOKUP(RC[-7],Sheet1!R2C1:R28C4,2,FALSE)&VLOOKUP(RC[-7],Sheet1!R2C1:R28C4,3,FALSE)&IF(VLOOKUP(RC[-7],Sheet1!R2C1:R28C4,4,FALSE)="品",VLOOKUP(RC[-3],Sheet1!R2C8:R6C9,2,FALSE),RC[-3])&VLOOKUP(RC[-7],Sheet1!R2C1:R28C4,4,FALSE) -> 寻访遗迹累计时间达到360小时 | I598: 20 | J598: =VLOOKUP(RC[-9],Sheet1!R2C1:R28C6,6,FALSE) -> 金币
A599: 14 | B599: btn_recruit | C599: 7 | D599: 1 | E599: 480 | F599: 19003 | G599: 70000 | H599: =VLOOKUP(RC[-7],Sheet1!R2C1:R28C4,2,FALSE)&VLOOKUP(RC[-7],Sheet1!R2C1:R28C4,3,FALSE)&IF(VLOOKUP(RC[-7],Sheet1!R2C1:R28C4,4,FALSE)="品",VLOOKUP(RC[-3],Sheet1!R2C8:R6C9,2,FALSE),RC[-3])&VLOOKUP(RC[-7],Sheet1!R2C1:R28C4,4,FALSE) -> 寻访遗迹累计时间达到480小时 | I599: 20 | J599: =VLOOKUP(RC[-9],Sheet1!R2C1:R28C6,6,FALSE) -> 金币
A600: 14 | B600: btn_recruit | C600: 8 | D600: 1 | E600: 600 | F600: 19003 | G600: 80000 | H600: =VLOOKUP(RC[-7],Sheet1!R2C1:R28C4,2,FALSE)&VLOOKUP(RC[-7],Sheet1!R2C1:R28C4,3,FALSE)&IF(VLOOKUP(RC[-7],Sheet1!R2C1:R28C4,4,FALSE)="品",VLOOKUP(RC[-3],Sheet1!R2C8:R6C9,2,FALSE),RC[-3])&VLOOKUP(RC[-7],Sheet1!R2C1:R28C4,4,FALSE) -> 寻访遗迹累计时间达到600小时 | I600: 20 | J600: =VLOOKUP(RC[-9],Sheet1!R2C1:R28C6,6,FALSE) -> 金币
A601: 14 | B601: btn_recruit | C601: 9 | D601: 1 | E601: 720 | F601: 19003 | G601: 90000 | H601: =VLOOKUP(RC[-7],Sheet1!R2C1:R28C4,2,FALSE)&VLOOKUP(RC[-7],Sheet1!R2C1:R28C4,3,FALSE)&IF(VLOOKUP(RC[-7],Sheet1!R2C1:R28C4,4,FALSE)="品",VLOOKUP(RC[-3],Sheet1!R2C8:R6C9,2,FALSE),RC[-3])&VLOOKUP(RC[-7],Sheet1!R2C1:R28C4,4,FALSE) -> 寻访遗迹累计时间达到720小时 | I601: 20 | J601: =VLOOKUP(RC[-9],Sheet1!R2C1:R28C6,6,FALSE) -> 金币
A602: 14 | B602: btn_recruit | C602: 10 | D602: 1 | E602: 840 | F602: 19003 | G602: 100000 | H602: =VLOOKUP(RC[-7],Sheet1!R2C1:R28C4,2,FALSE)&VLOOKUP(RC[-7],Sheet1!R2C1:R28C4,3,FALSE)&IF(VLOOKUP(RC[-7],Sheet1!R2C1:R28C4,4,FALSE)="品",VLOOKUP(RC[-3],Sheet1!R2C8:R6C9,2,FALSE),RC[-3])&VLOOKUP(RC[-7],Sheet1!R2C1:R28C4,4,FALSE) -> 寻访遗迹累计时间达到840小时 | I602: 20 | J602: =VLOOKUP(RC[-9],Sheet1!R2C1:R28C6,6,FALSE) -> 金币
A603: 14 | B603: btn_recruit | C603: 11 | D603: 1 | E603: 960 | F603: 19003 | G603: 120000 | H603: =VLOOKUP(RC[-7],Sheet1!R2C1:R28C4,2,FALSE)&VLOOKUP(RC[-7],Sheet1!R2C1:R28C4,3,FALSE)&IF(VLOOKUP(RC[-7],Sheet1!R2C1:R28C4,4,FALSE)="品",VLOOKUP(RC[-3],Sheet1!R2C8:R6C9,2,FALSE),RC[-3])&VLOOKUP(RC[-7],Sheet1!R2C1:R28C4,4,FALSE) -> 寻访遗迹累计时间达到960小时 | I603: 20 | J603: =VLOOKUP(RC[-9],Sheet1!R2C1:R28C6,6,FALSE) -> 金币
A604: 14 | B604: btn_recruit | C604: 12 | D604: 1 | E604: 1080 | F604: 19003 | G604: 140000 | H604: =VLOOKUP(RC[-7],Sheet1!R2C1:R28C4,2,FALSE)&VLOOKUP(RC[-7],Sheet1!R2C1:R28C4,3,FALSE)&IF(VLOOKUP(RC[-7],Sheet1!R2C1:R28C4,4,FALSE)="品",VLOOKUP(RC[-3],Sheet1!R2C8:R6C9,2,FALSE),RC[-3])&VLOOKUP(RC[-7],Sheet1!R2C1:R28C4,4,FALSE) -> 寻访遗迹累计时间达到1080小时 | I604: 20 | J604: =VLOOKUP(RC[-9],Sheet1!R2C1:R28C6,6,FALSE) -> 金币
A605: 14 | B605: btn_recruit | C605: 13 | D605: 1 | E605: 1200 | F605: 19003 | G605: 160000 | H605: =VLOOKUP(RC[-7],Sheet1!R2C1:R28C4,2,FALSE)&VLOOKUP(RC[-7],Sheet1!R2C1:R28C4,3,FALSE)&IF(VLOOKUP(RC[-7],Sheet1!R2C1:R28C4,4,FALSE)="品",VLOOKUP(RC[-3],Sheet1!R2C8:R6C9,2,FALSE),RC[-3])&VLOOKUP(RC[-7],Sheet1!R2C1:R28C4,4,FALSE) -> 寻访遗迹累计时间达到1200小时 | I605: 20 | J605: =VLOOKUP(RC[-9],Sheet1!R2C1:R28C6,6,FALSE) -> 金币
A606: 14 | B606: btn_recruit | C606: 14 | D606: 1 | E606: 1440 | F606: 19003 | G606: 180000 | H606: =VLOOKUP(RC[-7],Sheet1!R2C1:R28C4,2,FALSE)&VLOOKUP(RC[-7],Sheet1!R2C1:R28C4,3,FALSE)&IF(VLOOKUP(RC[-7],Sheet1!R2C1:R28C4,4,FALSE)="品",VLOOKUP(RC[-3],Sheet1!R2C8:R6C9,2,FALSE),RC[-3])&VLOOKUP(RC[-7],Sheet1!R2C1:R28C4,4,FALSE) -> 寻访遗迹累计时间达到1440小时 | I606: 20 | J606: =VLOOKUP(RC[-9],Sheet1!R2C1:R28C6,6,FALSE) -> 金币
A607: 14 | B607: btn_recruit | C607: 15 | D607: 1 | E607: 1680 | F607: 19003 | G607: 200000 | H607: =VLOOKUP(RC[-7],Sheet1!R2C1:R28C4,2,FALSE)&VLOOKUP(RC[-7],Sheet1!R2C1:R28C4,3,FALSE)&IF(VLOOKUP(RC[-7],Sheet1!R2C1:R28C4,4,FALSE)="品",VLOOKUP(RC[-3],Sheet1!R2C8:R6C9,2,FALSE),RC[-3])&VLOOKUP(RC[-7],Sheet1!R2C1:R28C4,4,FALSE) -> 寻访遗迹累计时间达到1680小时 | I607: 20 | J607: =VLOOKUP(RC[-9],Sheet1!R2C1:R28C6,6,FALSE) -> 金币
A608: 14 | B608: btn_recruit | C608: 16 | D608: 1 | E608: 1920 | F608: 19003 | G608: 220000 | H608: =VLOOKUP(RC[-7],Sheet1!R2C1:R28C4,2,FALSE)&VLOOKUP(RC[-7],Sheet1!R2C1:R28C4,3,FALSE)&IF(VLOOKUP(RC[-7],Sheet1!R2C1:R28C4,4,FALSE)="品",VLOOKUP(RC[-3],Sheet1!R2C8:R6C9,2,FALSE),RC[-3])&VLOOKUP(RC[-7],Sheet1!R2C1:R28C4,4,FALSE) -> 寻访遗迹累计时间达到1920小时 | I608: 20 | J608: =VLOOKUP(RC[-9],Sheet1!R2C1:R28C6,6,FALSE) -> 金币
A609: 14 | B609: btn_recruit | C609: 17 | D609: 1 | E609: 2160 | F609: 19003 | G609: 240000 | H609: =VLOOKUP(RC[-7],Sheet1!R2C1:R28C4,2,FALSE)&VLOOKUP(RC[-7],Sheet1!R2C1:R28C4,3,FALSE)&IF(VLOOKUP(RC[-7],Sheet1!R2C1:R28C4,4,FALSE)="品",VLOOKUP(RC[-3],Sheet1!R2C8:R6C9,2,FALSE),RC[-3])&VLOOKUP(RC[-7],Sheet1!R2C1:R28C4,4,FALSE) -> 寻访遗迹累计时间达到2160小时 | I609: 20 | J609: =VLOOKUP(RC[-9],Sheet1!R2C1:R28C6,6,FALSE) -> 金币
A610: 14 | B610: btn_recruit | C610: 18 | D610: 1 | E610: 2400 | F610: 19003 | G610: 260000 | H610: =VLOOKUP(RC[-7],Sheet1!R2C1:R28C4,2,FALSE)&VLOOKUP(RC[-7],Sheet1!R2C1:R28C4,3,FALSE)&IF(VLOOKUP(RC[-7],Sheet1!R2C1:R28C4,4,FALSE)="品",VLOOKUP(RC[-3],Sheet1!R2C8:R6C9,2,FALSE),RC[-3])&VLOOKUP(RC[-7],Sheet1!R2C1:R28C4,4,FALSE) -> 寻访遗迹累计时间达到2400小时 | I610: 20 | J610: =VLOOKUP(RC[-9],Sheet1!R2C1:R28C6,6,FALSE) -> 金币
A611: 14 | B611: btn_recruit | C611: 19 | D611: 1 | E611: 2640 | F611: 19003 | G611: 280000 | H611: =VLOOKUP(RC[-7],Sheet1!R2C1:R28C4,2,FALSE)&VLOOKUP(RC[-7],Sheet1!R2C1:R28C4,3,FALSE)&IF(VLOOKUP(RC[-7],Sheet1!R2C1:R28C4,4,FALSE)="品",VLOOKUP(RC[-3],Sheet1!R2C8:R6C9,2,FALSE),RC[-3])&VLOOKUP(RC[-7],Sheet1!R2C1:R28C4,4,FALSE) -> 寻访遗迹累计时间达到2640小时 | I611: 20 | J611: =VLOOKUP(RC[-9],Sheet1!R2C1:R28C6,6,FALSE) -> 金币
A612: 14 | B612: btn_recruit | C612: 20 | D612: 1 | E612: 2880 | F612: 19003 | G612: 300000 | H612: =VLOOKUP(RC[-7],Sheet1!R2C1:R28C4,2,FALSE)&VLOOKUP(RC[-7],Sheet1!R2C1:R28C4,3,FALSE)&IF(VLOOKUP(RC[-7],Sheet1!R2C1:R28C4,4,FALSE)="品",VLOOKUP(RC[-3],Sheet1!R2C8:R6C9,2,FALSE),RC[-3])&VLOOKUP(RC[-7],Sheet1!R2C1:R28C4,4,FALSE) -> 寻访遗迹累计时间达到2880小时 | I612: 20 | J612: =VLOOKUP(RC[-9],Sheet1!R2C1:R28C6,6,FALSE) -> 金币
A613: 14 | B613: btn_recruit | C613: 21 | D613: 1 | E613: 3120 | F613: 19003 | G613: 340000 | H613: =VLOOKUP(RC[-7],Sheet1!R2C1:R28C4,2,FALSE)&VLOOKUP(RC[-7],Sheet1!R2C1:R28C4,3,FALSE)&IF(VLOOKUP(RC[-7],Sheet1!R2C1:R28C4,4,FALSE)="品",VLOOKUP(RC[-3],Sheet1!R2C8:R6C9,2,FALSE),RC[-3])&VLOOKUP(RC[-7],Sheet1!R2C1:R28C4,4,FALSE) -> 寻访遗迹累计时间达到3120小时 | I613: 20 | J613: =VLOOKUP(RC[-9],Sheet1!R2C1:R28C6,6,FALSE) -> 金币
A614: 14 | B614: btn_recruit | C614: 22 | D614: 1 | E614: 3360 | F614: 19003 | G614: 380000 | H614: =VLOOKUP(RC[-7],Sheet1!R2C1:R28C4,2,FALSE)&VLOOKUP(RC[-7],Sheet1!R2C1:R28C4,3,FALSE)&IF(VLOOKUP(RC[-7],Sheet1!R2C1:R28C4,4,FALSE)="品",VLOOKUP(RC[-3],Sheet1!R2C8:R6C9,2,FALSE),RC[-3])&VLOOKUP(RC[-7],Sheet1!R2C1:R28C4,4,FALSE) -> 寻访遗迹累计时间达到3360小时 | I614: 20 | J614: =VLOOKUP(RC[-9],Sheet1!R2C1:R28C6,6,FALSE) -> 金币
A615: 14 | B615: btn_recruit | C615: 23 | D615: 1 | E615: 3600 | F615: 19003 | G615: 420000 | H615: =VLOOKUP(RC[-7],Sheet1!R2C1:R28C4,2,FALSE)&VLOOKUP(RC[-7],Sheet1!R2C1:R28C4,3,FALSE)&IF(VLOOKUP(RC[-7],Sheet1!R2C1:R28C4,4,FALSE)="品",VLOOKUP(RC[-3],Sheet1!R2C8:R6C9,2,FALSE),RC[-3])&VLOOKUP(RC[-7],Sheet1!R2C1:R28C4,4,FALSE) -> 寻访遗迹累计时间达到3600小时 | I615: 20 | J615: =VLOOKUP(RC[-9],Sheet1!R2C1:R28C6,6,FALSE) -> 金币
A616: 14 | B616: btn_recruit | C616: 24 | D616: 1 | E616: 4200 | F616: 19003 | G616: 460000 | H616: =VLOOKUP(RC[-7],Sheet1!R2C1:R28C4,2,FALSE)&VLOOKUP(RC[-7],Sheet1!R2C1:R28C4,3,FALSE)&IF(VLOOKUP(RC[-7],Sheet1!R2C1:R28C4,4,FALSE)="品",VLOOKUP(RC[-3],Sheet1!R2C8:R6C9,2,FALSE),RC[-3])&VLOOKUP(RC[-7],Sheet1!R2C1:R28C4,4,FALSE) -> 寻访遗迹累计时间达到4200小时 | I616: 20 | J616: =VLOOKUP(RC[-9],Sheet1!R2C1:R28C6,6,FALSE) -> 金币
A617: 14 | B617: btn_recruit | C617: 25 | D617: 1 | E617: 4800 | F617: 19003 | G617: 500000 | H617: =VLOOKUP(RC[-7],Sheet1!R2C1:R28C4,2,FALSE)&VLOOKUP(RC[-7],Sheet1!R2C1:R28C4,3,FALSE)&IF(VLOOKUP(RC[-7],Sheet1!R2C1:R28C4,4,FALSE)="品",VLOOKUP(RC[-3],Sheet1!R2C8:R6C9,2,FALSE),RC[-3])&VLOOKUP(RC[-7],Sheet1!R2C1:R28C4,4,FALSE) -> 寻访遗迹累计时间达到4800小时 | I617: 20 | J617: =VLOOKUP(RC[-9],Sheet1!R2C1:R28C6,6,FALSE) -> 金币
A618: 14 | B618: btn_recruit | C618: 26 | D618: 1 | E618: 5400 | F618: 19003 | G618: 500000 | H618: =VLOOKUP(RC[-7],Sheet1!R2C1:R28C4,2,FALSE)&VLOOKUP(RC[-7],Sheet1!R2C1:R28C4,3,FALSE)&IF(VLOOKUP(RC[-7],Sheet1!R2C1:R28C4,4,FALSE)="品",VLOOKUP(RC[-3],Sheet1!R2C8:R6C9,2,FALSE),RC[-3])&VLOOKUP(RC[-7],Sheet1!R2C1:R28C4,4,FALSE) -> 寻访遗迹累计时间达到5400小时 | I618: 20 | J618: =VLOOKUP(RC[-9],Sheet1!R2C1:R28C6,6,FALSE) -> 金币
A619: 14 | B619: btn_recruit | C619: 27 | D619: 1 | E619: 6000 | F619: 19003 | G619: 500000 | H619: =VLOOKUP(RC[-7],Sheet1!R2C1:R28C4,2,FALSE)&VLOOKUP(RC[-7],Sheet1!R2C1:R28C4,3,FALSE)&IF(VLOOKUP(RC[-7],Sheet1!R2C1:R28C4,4,FALSE)="品",VLOOKUP(RC[-3],Sheet1!R2C8:R6C9,2,FALSE),RC[-3])&VLOOKUP(RC[-7],Sheet1!R2C1:R28C4,4,FALSE) -> 寻访遗迹累计时间达到6000小时 | I619: 20 | J619: =VLOOKUP(RC[-9],Sheet1!R2C1:R28C6,6,FALSE) -> 金币
A620: 14 | B620: btn_recruit | C620: 28 | D620: 1 | E620: 6600 | F620: 19003 | G620: 500000 | H620: =VLOOKUP(RC[-7],Sheet1!R2C1:R28C4,2,FALSE)&VLOOKUP(RC[-7],Sheet1!R2C1:R28C4,3,FALSE)&IF(VLOOKUP(RC[-7],Sheet1!R2C1:R28C4,4,FALSE)="品",VLOOKUP(RC[-3],Sheet1!R2C8:R6C9,2,FALSE),RC[-3])&VLOOKUP(RC[-7],Sheet1!R2C1:R28C4,4,FALSE) -> 寻访遗迹累计时间达到6600小时 | I620: 20 | J620: =VLOOKUP(RC[-9],Sheet1!R2C1:R28C6,6,FALSE) -> 金币
A621: 14 | B621: btn_recruit | C621: 29 | D621: 1 | E621: 7200 | F621: 19003 | G621: 500000 | H621: =VLOOKUP(RC[-7],Sheet1!R2C1:R28C4,2,FALSE)&VLOOKUP(RC[-7],Sheet1!R2C1:R28C4,3,FALSE)&IF(VLOOKUP(RC[-7],Sheet1!R2C1:R28C4,4,FALSE)="品",VLOOKUP(RC[-3],Sheet1!R2C8:R6C9,2,FALSE),RC[-3])&VLOOKUP(RC[-7],Sheet1!R2C1:R28C4,4,FALSE) -> 寻访遗迹累计时间达到7200小时 | I621: 20 | J621: =VLOOKUP(RC[-9],Sheet1!R2C1:R28C6,6,FALSE) -> 金币
A622: 14 | B622: btn_recruit | C622: 30 | D622: 1 | E622: 7800 | F622: 19003 | G622: 500000 | H622: =VLOOKUP(RC[-7],Sheet1!R2C1:R28C4,2,FALSE)&VLOOKUP(RC[-7],Sheet1!R2C1:R28C4,3,FALSE)&IF(VLOOKUP(RC[-7],Sheet1!R2C1:R28C4,4,FALSE)="品",VLOOKUP(RC[-3],Sheet1!R2C8:R6C9,2,FALSE),RC[-3])&VLOOKUP(RC[-7],Sheet1!R2C1:R28C4,4,FALSE) -> 寻访遗迹累计时间达到7800小时 | I622: 20 | J622: =VLOOKUP(RC[-9],Sheet1!R2C1:R28C6,6,FALSE) -> 金币
A623: 14 | B623: btn_recruit | C623: 31 | D623: 1 | E623: 8400 | F623: 19003 | G623: 500000 | H623: =VLOOKUP(RC[-7],Sheet1!R2C1:R28C4,2,FALSE)&VLOOKUP(RC[-7],Sheet1!R2C1:R28C4,3,FALSE)&IF(VLOOKUP(RC[-7],Sheet1!R2C1:R28C4,4,FALSE)="品",VLOOKUP(RC[-3],Sheet1!R2C8:R6C9,2,FALSE),RC[-3])&VLOOKUP(RC[-7],Sheet1!R2C1:R28C4,4,FALSE) -> 寻访遗迹累计时间达到8400小时 | I623: 20 | J623: =VLOOKUP(RC[-9],Sheet1!R2C1:R28C6,6,FALSE) -> 金币
A624: 14 | B624: btn_recruit | C624: 32 | D624: 1 | E624: 9000 | F624: 19003 | G624: 500000 | H624: =VLOOKUP(RC[-7],Sheet1!R2C1:R28C4,2,FALSE)&VLOOKUP(RC[-7],Sheet1!R2C1:R28C4,3,FALSE)&IF(VLOOKUP(RC[-7],Sheet1!R2C1:R28C4,4,FALSE)="品",VLOOKUP(RC[-3],Sheet1!R2C8:R6C9,2,FALSE),RC[-3])&VLOOKUP(RC[-7],Sheet1!R2C1:R28C4,4,FALSE) -> 寻访遗迹累计时间达到9000小时 | I624: 20 | J624: =VLOOKUP(RC[-9],Sheet1!R2C1:R28C6,6,FALSE) -> 金币
A625: 14 | B625: btn_recruit | C625: 33 | D625: 1 | E625: 9900 | F625: 19003 | G625: 500000 | H625: =VLOOKUP(RC[-7],Sheet1!R2C1:R28C4,2,FALSE)&VLOOKUP(RC[-7],Sheet1!R2C1:R28C4,3,FALSE)&IF(VLOOKUP(RC[-7],Sheet1!R2C1:R28C4,4,FALSE)="品",VLOOKUP(RC[-3],Sheet1!R2C8:R6C9,2,FALSE),RC[-3])&VLOOKUP(RC[-7],Sheet1!R2C1:R28C4,4,FALSE) -> 寻访遗迹累计时间达到9900小时 | I625: 20 | J625: =VLOOKUP(RC[-9],Sheet1!R2C1:R28C6,6,FALSE) -> 金币
A626: 14 | B626: btn_recruit | C626: 34 | D626: 1 | E626: 10800 | F626: 19003 | G626: 500000 | H626: =VLOOKUP(RC[-7],Sheet1!R2C1:R28C4,2,FALSE)&VLOOKUP(RC[-7],Sheet1!R2C1:R28C4,3,FALSE)&IF(VLOOKUP(RC[-7],Sheet1!R2C1:R28C4,4,FALSE)="品",VLOOKUP(RC[-3],Sheet1!R2C8:R6C9,2,FALSE),RC[-3])&VLOOKUP(RC[-7],Sheet1!R2C1:R28C4,4,FALSE) -> 寻访遗迹累计时间达到10800小时 | I626: 20 | J626: =VLOOKUP(RC[-9],Sheet1!R2C1:R28C6,6,FALSE) -> 金币
A627: 14 | B627: btn_recruit | C627: 35 | D627: 1 | E627: 11700 | F627: 19003 | G627: 500000 | H627: =VLOOKUP(RC[-7],Sheet1!R2C1:R28C4,2,FALSE)&VLOOKUP(RC[-7],Sheet1!R2C1:R28C4,3,FALSE)&IF(VLOOKUP(RC[-7],Sheet1!R2C1:R28C4,4,FALSE)="品",VLOOKUP(RC[-3],Sheet1!R2C8:R6C9,2,FALSE),RC[-3])&VLOOKUP(RC[-7],Sheet1!R2C1:R28C4,4,FALSE) -> 寻访遗迹累计时间达到11700小时 | I627: 20 | J627: =VLOOKUP(RC[-9],Sheet1!R2C1:R28C6,6,FALSE) -> 金币
A628: 14 | B628: btn_recruit | C628: 36 | D628: 1 | E628: 12600 | F628: 19003 | G628: 500000 | H628: =VLOOKUP(RC[-7],Sheet1!R2C1:R28C4,2,FALSE)&VLOOKUP(RC[-7],Sheet1!R2C1:R28C4,3,FALSE)&IF(VLOOKUP(RC[-7],Sheet1!R2C1:R28C4,4,FALSE)="品",VLOOKUP(RC[-3],Sheet1!R2C8:R6C9,2,FALSE),RC[-3])&VLOOKUP(RC[-7],Sheet1!R2C1:R28C4,4,FALSE) -> 寻访遗迹累计时间达到12600小时 | I628: 20 | J628: =VLOOKUP(RC[-9],Sheet1!R2C1:R28C6,6,FALSE) -> 金币
A629: 14 | B629: btn_recruit | C629: 37 | D629: 1 | E629: 13500 | F629: 19003 | G629: 500000 | H629: =VLOOKUP(RC[-7],Sheet1!R2C1:R28C4,2,FALSE)&VLOOKUP(RC[-7],Sheet1!R2C1:R28C4,3,FALSE)&IF(VLOOKUP(RC[-7],Sheet1!R2C1:R28C4,4,FALSE)="品",VLOOKUP(RC[-3],Sheet1!R2C8:R6C9,2,FALSE),RC[-3])&VLOOKUP(RC[-7],Sheet1!R2C1:R28C4,4,FALSE) -> 寻访遗迹累计时间达到13500小时 | I629: 20 | J629: =VLOOKUP(RC[-9],Sheet1!R2C1:R28C6,6,FALSE) -> 金币
A630: 14 | B630: btn_recruit | C630: 38 | D630: 1 | E630: 14400 | F630: 19003 | G630: 500000 | H630: =VLOOKUP(RC[-7],Sheet1!R2C1:R28C4,2,FALSE)&VLOOKUP(RC[-7],Sheet1!R2C1:R28C4,3,FALSE)&IF(VLOOKUP(RC[-7],Sheet1!R2C1:R28C4,4,FALSE)="品",VLOOKUP(RC[-3],Sheet1!R2C8:R6C9,2,FALSE),RC[-3])&VLOOKUP(RC[-7],Sheet1!R2C1:R28C4,4,FALSE) -> 寻访遗迹累计时间达到14400小时 | I630: 20 | J630: =VLOOKUP(RC[-9],Sheet1!R2C1:R28C6,6,FALSE) -> 金币
A631: 14 | B631: btn_recruit | C631: 39 | D631: 1 | E631: 15300 | F631: 19003 | G631: 500000 | H631: =VLOOKUP(RC[-7],Sheet1!R2C1:R28C4,2,FALSE)&VLOOKUP(RC[-7],Sheet1!R2C1:R28C4,3,FALSE)&IF(VLOOKUP(RC[-7],Sheet1!R2C1:R28C4,4,FALSE)="品",VLOOKUP(RC[-3],Sheet1!R2C8:R6C9,2,FALSE),RC[-3])&VLOOKUP(RC[-7],Sheet1!R2C1:R28C4,4,FALSE) -> 寻访遗迹累计时间达到15300小时 | I631: 20 | J631: =VLOOKUP(RC[-9],Sheet1!R2C1:R28C6,6,FALSE) -> 金币
A632: 14 | B632: btn_recruit | C632: 40 | D632: 1 | E632: 16200 | F632: 19003 | G632: 500000 | H632: =VLOOKUP(RC[-7],Sheet1!R2C1:R28C4,2,FALSE)&VLOOKUP(RC[-7],Sheet1!R2C1:R28C4,3,FALSE)&IF(VLOOKUP(RC[-7],Sheet1!R2C1:R28C4,4,FALSE)="品",VLOOKUP(RC[-3],Sheet1!R2C8:R6C9,2,FALSE),RC[-3])&VLOOKUP(RC[-7],Sheet1!R2C1:R28C4,4,FALSE) -> 寻访遗迹累计时间达到16200小时 | I632: 20 | J632: =VLOOKUP(RC[-9],Sheet1!R2C1:R28C6,6,FALSE) -> 金币
A633: 15 | B633: btn_friend | C633: 1 | D633: 1 | E633: 60 | F633: 19005 | G633: 50 | H633: =VLOOKUP(RC[-7],Sheet1!R2C1:R28C4,2,FALSE)&VLOOKUP(RC[-7],Sheet1!R2C1:R28C4,3,FALSE)&IF(VLOOKUP(RC[-7],Sheet1!R2C1:R28C4,4,FALSE)="品",VLOOKUP(RC[-3],Sheet1!R2C8:R6C9,2,FALSE),RC[-3])&VLOOKUP(RC[-7],Sheet1!R2C1:R28C4,4,FALSE) -> 累计镇压好友遗迹暴动60次 | I633: 20 | J633: =VLOOKUP(RC[-9],Sheet1!R2C1:R28C6,6,FALSE) -> 钻石
A634: 15 | B634: btn_friend | C634: 2 | D634: 1 | E634: 120 | F634: 19005 | G634: 100 | H634: =VLOOKUP(RC[-7],Sheet1!R2C1:R28C4,2,FALSE)&VLOOKUP(RC[-7],Sheet1!R2C1:R28C4,3,FALSE)&IF(VLOOKUP(RC[-7],Sheet1!R2C1:R28C4,4,FALSE)="品",VLOOKUP(RC[-3],Sheet1!R2C8:R6C9,2,FALSE),RC[-3])&VLOOKUP(RC[-7],Sheet1!R2C1:R28C4,4,FALSE) -> 累计镇压好友遗迹暴动120次 | I634: 20 | J634: =VLOOKUP(RC[-9],Sheet1!R2C1:R28C6,6,FALSE) -> 钻石
A635: 15 | B635: btn_friend | C635: 3 | D635: 1 | E635: 180 | F635: 19005 | G635: 150 | H635: =VLOOKUP(RC[-7],Sheet1!R2C1:R28C4,2,FALSE)&VLOOKUP(RC[-7],Sheet1!R2C1:R28C4,3,FALSE)&IF(VLOOKUP(RC[-7],Sheet1!R2C1:R28C4,4,FALSE)="品",VLOOKUP(RC[-3],Sheet1!R2C8:R6C9,2,FALSE),RC[-3])&VLOOKUP(RC[-7],Sheet1!R2C1:R28C4,4,FALSE) -> 累计镇压好友遗迹暴动180次 | I635: 20 | J635: =VLOOKUP(RC[-9],Sheet1!R2C1:R28C6,6,FALSE) -> 钻石
A636: 15 | B636: btn_friend | C636: 4 | D636: 1 | E636: 240 | F636: 19005 | G636: 200 | H636: =VLOOKUP(RC[-7],Sheet1!R2C1:R28C4,2,FALSE)&VLOOKUP(RC[-7],Sheet1!R2C1:R28C4,3,FALSE)&IF(VLOOKUP(RC[-7],Sheet1!R2C1:R28C4,4,FALSE)="品",VLOOKUP(RC[-3],Sheet1!R2C8:R6C9,2,FALSE),RC[-3])&VLOOKUP(RC[-7],Sheet1!R2C1:R28C4,4,FALSE) -> 累计镇压好友遗迹暴动240次 | I636: 20 | J636: =VLOOKUP(RC[-9],Sheet1!R2C1:R28C6,6,FALSE) -> 钻石
A637: 15 | B637: btn_friend | C637: 5 | D637: 1 | E637: 300 | F637: 19005 | G637: 250 | H637: =VLOOKUP(RC[-7],Sheet1!R2C1:R28C4,2,FALSE)&VLOOKUP(RC[-7],Sheet1!R2C1:R28C4,3,FALSE)&IF(VLOOKUP(RC[-7],Sheet1!R2C1:R28C4,4,FALSE)="品",VLOOKUP(RC[-3],Sheet1!R2C8:R6C9,2,FALSE),RC[-3])&VLOOKUP(RC[-7],Sheet1!R2C1:R28C4,4,FALSE) -> 累计镇压好友遗迹暴动300次 | I637: 20 | J637: =VLOOKUP(RC[-9],Sheet1!R2C1:R28C6,6,FALSE) -> 钻石
A638: 15 | B638: btn_friend | C638: 6 | D638: 1 | E638: 360 | F638: 19005 | G638: 300 | H638: =VLOOKUP(RC[-7],Sheet1!R2C1:R28C4,2,FALSE)&VLOOKUP(RC[-7],Sheet1!R2C1:R28C4,3,FALSE)&IF(VLOOKUP(RC[-7],Sheet1!R2C1:R28C4,4,FALSE)="品",VLOOKUP(RC[-3],Sheet1!R2C8:R6C9,2,FALSE),RC[-3])&VLOOKUP(RC[-7],Sheet1!R2C1:R28C4,4,FALSE) -> 累计镇压好友遗迹暴动360次 | I638: 20 | J638: =VLOOKUP(RC[-9],Sheet1!R2C1:R28C6,6,FALSE) -> 钻石
A639: 15 | B639: btn_friend | C639: 7 | D639: 1 | E639: 420 | F639: 19005 | G639: 350 | H639: =VLOOKUP(RC[-7],Sheet1!R2C1:R28C4,2,FALSE)&VLOOKUP(RC[-7],Sheet1!R2C1:R28C4,3,FALSE)&IF(VLOOKUP(RC[-7],Sheet1!R2C1:R28C4,4,FALSE)="品",VLOOKUP(RC[-3],Sheet1!R2C8:R6C9,2,FALSE),RC[-3])&VLOOKUP(RC[-7],Sheet1!R2C1:R28C4,4,FALSE) -> 累计镇压好友遗迹暴动420次 | I639: 20 | J639: =VLOOKUP(RC[-9],Sheet1!R2C1:R28C6,6,FALSE) -> 钻石
A640: 15 | B640: btn_friend | C640: 8 | D640: 1 | E640: 480 | F640: 19005 | G640: 400 | H640: =VLOOKUP(RC[-7],Sheet1!R2C1:R28C4,2,FALSE)&VLOOKUP(RC[-7],Sheet1!R2C1:R28C4,3,FALSE)&IF(VLOOKUP(RC[-7],Sheet1!R2C1:R28C4,4,FALSE)="品",VLOOKUP(RC[-3],Sheet1!R2C8:R6C9,2,FALSE),RC[-3])&VLOOKUP(RC[-7],Sheet1!R2C1:R28C4,4,FALSE) -> 累计镇压好友遗迹暴动480次 | I640: 20 | J640: =VLOOKUP(RC[-9],Sheet1!R2C1:R28C6,6,FALSE) -> 钻石
A641: 15 | B641: btn_friend | C641: 9 | D641: 1 | E641: 540 | F641: 19005 | G641: 450 | H641: =VLOOKUP(RC[-7],Sheet1!R2C1:R28C4,2,FALSE)&VLOOKUP(RC[-7],Sheet1!R2C1:R28C4,3,FALSE)&IF(VLOOKUP(RC[-7],Sheet1!R2C1:R28C4,4,FALSE)="品",VLOOKUP(RC[-3],Sheet1!R2C8:R6C9,2,FALSE),RC[-3])&VLOOKUP(RC[-7],Sheet1!R2C1:R28C4,4,FALSE) -> 累计镇压好友遗迹暴动540次 | I641: 20 | J641: =VLOOKUP(RC[-9],Sheet1!R2C1:R28C6,6,FALSE) -> 钻石
A642: 15 | B642: btn_friend | C642: 10 | D642: 1 | E642: 600 | F642: 19005 | G642: 500 | H642: =VLOOKUP(RC[-7],Sheet1!R2C1:R28C4,2,FALSE)&VLOOKUP(RC[-7],Sheet1!R2C1:R28C4,3,FALSE)&IF(VLOOKUP(RC[-7],Sheet1!R2C1:R28C4,4,FALSE)="品",VLOOKUP(RC[-3],Sheet1!R2C8:R6C9,2,FALSE),RC[-3])&VLOOKUP(RC[-7],Sheet1!R2C1:R28C4,4,FALSE) -> 累计镇压好友遗迹暴动600次 | I642: 20 | J642: =VLOOKUP(RC[-9],Sheet1!R2C1:R28C6,6,FALSE) -> 钻石
A643: 15 | B643: btn_friend | C643: 11 | D643: 1 | E643: 660 | F643: 19005 | G643: 550 | H643: =VLOOKUP(RC[-7],Sheet1!R2C1:R28C4,2,FALSE)&VLOOKUP(RC[-7],Sheet1!R2C1:R28C4,3,FALSE)&IF(VLOOKUP(RC[-7],Sheet1!R2C1:R28C4,4,FALSE)="品",VLOOKUP(RC[-3],Sheet1!R2C8:R6C9,2,FALSE),RC[-3])&VLOOKUP(RC[-7],Sheet1!R2C1:R28C4,4,FALSE) -> 累计镇压好友遗迹暴动660次 | I643: 20 | J643: =VLOOKUP(RC[-9],Sheet1!R2C1:R28C6,6,FALSE) -> 钻石
A644: 15 | B644: btn_friend | C644: 12 | D644: 1 | E644: 720 | F644: 19005 | G644: 600 | H644: =VLOOKUP(RC[-7],Sheet1!R2C1:R28C4,2,FALSE)&VLOOKUP(RC[-7],Sheet1!R2C1:R28C4,3,FALSE)&IF(VLOOKUP(RC[-7],Sheet1!R2C1:R28C4,4,FALSE)="品",VLOOKUP(RC[-3],Sheet1!R2C8:R6C9,2,FALSE),RC[-3])&VLOOKUP(RC[-7],Sheet1!R2C1:R28C4,4,FALSE) -> 累计镇压好友遗迹暴动720次 | I644: 20 | J644: =VLOOKUP(RC[-9],Sheet1!R2C1:R28C6,6,FALSE) -> 钻石
A645: 15 | B645: btn_friend | C645: 13 | D645: 1 | E645: 780 | F645: 19005 | G645: 650 | H645: =VLOOKUP(RC[-7],Sheet1!R2C1:R28C4,2,FALSE)&VLOOKUP(RC[-7],Sheet1!R2C1:R28C4,3,FALSE)&IF(VLOOKUP(RC[-7],Sheet1!R2C1:R28C4,4,FALSE)="品",VLOOKUP(RC[-3],Sheet1!R2C8:R6C9,2,FALSE),RC[-3])&VLOOKUP(RC[-7],Sheet1!R2C1:R28C4,4,FALSE) -> 累计镇压好友遗迹暴动780次 | I645: 20 | J645: =VLOOKUP(RC[-9],Sheet1!R2C1:R28C6,6,FALSE) -> 钻石
A646: 15 | B646: btn_friend | C646: 14 | D646: 1 | E646: 840 | F646: 19005 | G646: 700 | H646: =VLOOKUP(RC[-7],Sheet1!R2C1:R28C4,2,FALSE)&VLOOKUP(RC[-7],Sheet1!R2C1:R28C4,3,FALSE)&IF(VLOOKUP(RC[-7],Sheet1!R2C1:R28C4,4,FALSE)="品",VLOOKUP(RC[-3],Sheet1!R2C8:R6C9,2,FALSE),RC[-3])&VLOOKUP(RC[-7],Sheet1!R2C1:R28C4,4,FALSE) -> 累计镇压好友遗迹暴动840次 | I646: 20 | J646: =VLOOKUP(RC[-9],Sheet1!R2C1:R28C6,6,FALSE) -> 钻石
A647: 15 | B647: btn_friend | C647: 15 | D647: 1 | E647: 900 | F647: 19005 | G647: 750 | H647: =VLOOKUP(RC[-7],Sheet1!R2C1:R28C4,2,FALSE)&VLOOKUP(RC[-7],Sheet1!R2C1:R28C4,3,FALSE)&IF(VLOOKUP(RC[-7],Sheet1!R2C1:R28C4,4,FALSE)="品",VLOOKUP(RC[-3],Sheet1!R2C8:R6C9,2,FALSE),RC[-3])&VLOOKUP(RC[-7],Sheet1!R2C1:R28C4,4,FALSE) -> 累计镇压好友遗迹暴动900次 | I647: 20 | J647: =VLOOKUP(RC[-9],Sheet1!R2C1:R28C6,6,FALSE) -> 钻石
A648: 15 | B648: btn_friend | C648: 16 | D648: 1 | E648: 960 | F648: 19005 | G648: 800 | H648: =VLOOKUP(RC[-7],Sheet1!R2C1:R28C4,2,FALSE)&VLOOKUP(RC[-7],Sheet1!R2C1:R28C4,3,FALSE)&IF(VLOOKUP(RC[-7],Sheet1!R2C1:R28C4,4,FALSE)="品",VLOOKUP(RC[-3],Sheet1!R2C8:R6C9,2,FALSE),RC[-3])&VLOOKUP(RC[-7],Sheet1!R2C1:R28C4,4,FALSE) -> 累计镇压好友遗迹暴动960次 | I648: 20 | J648: =VLOOKUP(RC[-9],Sheet1!R2C1:R28C6,6,FALSE) -> 钻石
A649: 15 | B649: btn_friend | C649: 17 | D649: 1 | E649: 1020 | F649: 19005 | G649: 850 | H649: =VLOOKUP(RC[-7],Sheet1!R2C1:R28C4,2,FALSE)&VLOOKUP(RC[-7],Sheet1!R2C1:R28C4,3,FALSE)&IF(VLOOKUP(RC[-7],Sheet1!R2C1:R28C4,4,FALSE)="品",VLOOKUP(RC[-3],Sheet1!R2C8:R6C9,2,FALSE),RC[-3])&VLOOKUP(RC[-7],Sheet1!R2C1:R28C4,4,FALSE) -> 累计镇压好友遗迹暴动1020次 | I649: 20 | J649: =VLOOKUP(RC[-9],Sheet1!R2C1:R28C6,6,FALSE) -> 钻石
A650: 15 | B650: btn_friend | C650: 18 | D650: 1 | E650: 1080 | F650: 19005 | G650: 900 | H650: =VLOOKUP(RC[-7],Sheet1!R2C1:R28C4,2,FALSE)&VLOOKUP(RC[-7],Sheet1!R2C1:R28C4,3,FALSE)&IF(VLOOKUP(RC[-7],Sheet1!R2C1:R28C4,4,FALSE)="品",VLOOKUP(RC[-3],Sheet1!R2C8:R6C9,2,FALSE),RC[-3])&VLOOKUP(RC[-7],Sheet1!R2C1:R28C4,4,FALSE) -> 累计镇压好友遗迹暴动1080次 | I650: 20 | J650: =VLOOKUP(RC[-9],Sheet1!R2C1:R28C6,6,FALSE) -> 钻石
A651: 15 | B651: btn_friend | C651: 19 | D651: 1 | E651: 1140 | F651: 19005 | G651: 950 | H651: =VLOOKUP(RC[-7],Sheet1!R2C1:R28C4,2,FALSE)&VLOOKUP(RC[-7],Sheet1!R2C1:R28C4,3,FALSE)&IF(VLOOKUP(RC[-7],Sheet1!R2C1:R28C4,4,FALSE)="品",VLOOKUP(RC[-3],Sheet1!R2C8:R6C9,2,FALSE),RC[-3])&VLOOKUP(RC[-7],Sheet1!R2C1:R28C4,4,FALSE) -> 累计镇压好友遗迹暴动1140次 | I651: 20 | J651: =VLOOKUP(RC[-9],Sheet1!R2C1:R28C6,6,FALSE) -> 钻石
A652: 15 | B652: btn_friend | C652: 20 | D652: 1 | E652: 1200 | F652: 19005 | G652: 1000 | H652: =VLOOKUP(RC[-7],Sheet1!R2C1:R28C4,2,FALSE)&VLOOKUP(RC[-7],Sheet1!R2C1:R28C4,3,FALSE)&IF(VLOOKUP(RC[-7],Sheet1!R2C1:R28C4,4,FALSE)="品",VLOOKUP(RC[-3],Sheet1!R2C8:R6C9,2,FALSE),RC[-3])&VLOOKUP(RC[-7],Sheet1!R2C1:R28C4,4,FALSE) -> 累计镇压好友遗迹暴动1200次 | I652: 20 | J652: =VLOOKUP(RC[-9],Sheet1!R2C1:R28C6,6,FALSE) -> 钻石
A653: 16 | B653: btn_guild | C653: 1 | D653: 1 | E653: 10 | F653: 19014 | G653: 1000 | H653: =VLOOKUP(RC[-7],Sheet1!R2C1:R28C4,2,FALSE)&VLOOKUP(RC[-7],Sheet1!R2C1:R28C4,3,FALSE)&IF(VLOOKUP(RC[-7],Sheet1!R2C1:R28C4,4,FALSE)="品",VLOOKUP(RC[-3],Sheet1!R2C8:R6C9,2,FALSE),RC[-3])&VLOOKUP(RC[-7],Sheet1!R2C1:R28C4,4,FALSE) -> 累计与异族入侵怪物战斗10次 | I653: 16 | J653: =VLOOKUP(RC[-9],Sheet1!R2C1:R28C6,6,FALSE) -> 战功
A654: 16 | B654: btn_guild | C654: 2 | D654: 1 | E654: 20 | F654: 19014 | G654: 1000 | H654: =VLOOKUP(RC[-7],Sheet1!R2C1:R28C4,2,FALSE)&VLOOKUP(RC[-7],Sheet1!R2C1:R28C4,3,FALSE)&IF(VLOOKUP(RC[-7],Sheet1!R2C1:R28C4,4,FALSE)="品",VLOOKUP(RC[-3],Sheet1!R2C8:R6C9,2,FALSE),RC[-3])&VLOOKUP(RC[-7],Sheet1!R2C1:R28C4,4,FALSE) -> 累计与异族入侵怪物战斗20次 | I654: 16 | J654: =VLOOKUP(RC[-9],Sheet1!R2C1:R28C6,6,FALSE) -> 战功
A655: 16 | B655: btn_guild | C655: 3 | D655: 1 | E655: 50 | F655: 19014 | G655: 1000 | H655: =VLOOKUP(RC[-7],Sheet1!R2C1:R28C4,2,FALSE)&VLOOKUP(RC[-7],Sheet1!R2C1:R28C4,3,FALSE)&IF(VLOOKUP(RC[-7],Sheet1!R2C1:R28C4,4,FALSE)="品",VLOOKUP(RC[-3],Sheet1!R2C8:R6C9,2,FALSE),RC[-3])&VLOOKUP(RC[-7],Sheet1!R2C1:R28C4,4,FALSE) -> 累计与异族入侵怪物战斗50次 | I655: 16 | J655: =VLOOKUP(RC[-9],Sheet1!R2C1:R28C6,6,FALSE) -> 战功
A656: 16 | B656: btn_guild | C656: 4 | D656: 1 | E656: 100 | F656: 19014 | G656: 1000 | H656: =VLOOKUP(RC[-7],Sheet1!R2C1:R28C4,2,FALSE)&VLOOKUP(RC[-7],Sheet1!R2C1:R28C4,3,FALSE)&IF(VLOOKUP(RC[-7],Sheet1!R2C1:R28C4,4,FALSE)="品",VLOOKUP(RC[-3],Sheet1!R2C8:R6C9,2,FALSE),RC[-3])&VLOOKUP(RC[-7],Sheet1!R2C1:R28C4,4,FALSE) -> 累计与异族入侵怪物战斗100次 | I656: 16 | J656: =VLOOKUP(RC[-9],Sheet1!R2C1:R28C6,6,FALSE) -> 战功
A657: 16 | B657: btn_guild | C657: 5 | D657: 1 | E657: 200 | F657: 19014 | G657: 1000 | H657: =VLOOKUP(RC[-7],Sheet1!R2C1:R28C4,2,FALSE)&VLOOKUP(RC[-7],Sheet1!R2C1:R28C4,3,FALSE)&IF(VLOOKUP(RC[-7],Sheet1!R2C1:R28C4,4,FALSE)="品",VLOOKUP(RC[-3],Sheet1!R2C8:R6C9,2,FALSE),RC[-3])&VLOOKUP(RC[-7],Sheet1!R2C1:R28C4,4,FALSE) -> 累计与异族入侵怪物战斗200次 | I657: 16 | J657: =VLOOKUP(RC[-9],Sheet1!R2C1:R28C6,6,FALSE) -> 战功
A658: 16 | B658: btn_guild | C658: 6 | D658: 1 | E658: 300 | F658: 19014 | G658: 1000 | H658: =VLOOKUP(RC[-7],Sheet1!R2C1:R28C4,2,FALSE)&VLOOKUP(RC[-7],Sheet1!R2C1:R28C4,3,FALSE)&IF(VLOOKUP(RC[-7],Sheet1!R2C1:R28C4,4,FALSE)="品",VLOOKUP(RC[-3],Sheet1!R2C8:R6C9,2,FALSE),RC[-3])&VLOOKUP(RC[-7],Sheet1!R2C1:R28C4,4,FALSE) -> 累计与异族入侵怪物战斗300次 | I658: 16 | J658: =VLOOKUP(RC[-9],Sheet1!R2C1:R28C6,6,FALSE) -> 战功
A659: 16 | B659: btn_guild | C659: 7 | D659: 1 | E659: 400 | F659: 19014 | G659: 1000 | H659: =VLOOKUP(RC[-7],Sheet1!R2C1:R28C4,2,FALSE)&VLOOKUP(RC[-7],Sheet1!R2C1:R28C4,3,FALSE)&IF(VLOOKUP(RC[-7],Sheet1!R2C1:R28C4,4,FALSE)="品",VLOOKUP(RC[-3],Sheet1!R2C8:R6C9,2,FALSE),RC[-3])&VLOOKUP(RC[-7],Sheet1!R2C1:R28C4,4,FALSE) -> 累计与异族入侵怪物战斗400次 | I659: 16 | J659: =VLOOKUP(RC[-9],Sheet1!R2C1:R28C6,6,FALSE) -> 战功
A660: 16 | B660: btn_guild | C660: 8 | D660: 1 | E660: 500 | F660: 19014 | G660: 1000 | H660: =VLOOKUP(RC[-7],Sheet1!R2C1:R28C4,2,FALSE)&VLOOKUP(RC[-7],Sheet1!R2C1:R28C4,3,FALSE)&IF(VLOOKUP(RC[-7],Sheet1!R2C1:R28C4,4,FALSE)="品",VLOOKUP(RC[-3],Sheet1!R2C8:R6C9,2,FALSE),RC[-3])&VLOOKUP(RC[-7],Sheet1!R2C1:R28C4,4,FALSE) -> 累计与异族入侵怪物战斗500次 | I660: 16 | J660: =VLOOKUP(RC[-9],Sheet1!R2C1:R28C6,6,FALSE) -> 战功
A661: 16 | B661: btn_guild | C661: 9 | D661: 1 | E661: 600 | F661: 19014 | G661: 1000 | H661: =VLOOKUP(RC[-7],Sheet1!R2C1:R28C4,2,FALSE)&VLOOKUP(RC[-7],Sheet1!R2C1:R28C4,3,FALSE)&IF(VLOOKUP(RC[-7],Sheet1!R2C1:R28C4,4,FALSE)="品",VLOOKUP(RC[-3],Sheet1!R2C8:R6C9,2,FALSE),RC[-3])&VLOOKUP(RC[-7],Sheet1!R2C1:R28C4,4,FALSE) -> 累计与异族入侵怪物战斗600次 | I661: 16 | J661: =VLOOKUP(RC[-9],Sheet1!R2C1:R28C6,6,FALSE) -> 战功
A662: 16 | B662: btn_guild | C662: 10 | D662: 1 | E662: 700 | F662: 19014 | G662: 1000 | H662: =VLOOKUP(RC[-7],Sheet1!R2C1:R28C4,2,FALSE)&VLOOKUP(RC[-7],Sheet1!R2C1:R28C4,3,FALSE)&IF(VLOOKUP(RC[-7],Sheet1!R2C1:R28C4,4,FALSE)="品",VLOOKUP(RC[-3],Sheet1!R2C8:R6C9,2,FALSE),RC[-3])&VLOOKUP(RC[-7],Sheet1!R2C1:R28C4,4,FALSE) -> 累计与异族入侵怪物战斗700次 | I662: 16 | J662: =VLOOKUP(RC[-9],Sheet1!R2C1:R28C6,6,FALSE) -> 战功
A663: 16 | B663: btn_guild | C663: 11 | D663: 1 | E663: 800 | F663: 19014 | G663: 2000 | H663: =VLOOKUP(RC[-7],Sheet1!R2C1:R28C4,2,FALSE)&VLOOKUP(RC[-7],Sheet1!R2C1:R28C4,3,FALSE)&IF(VLOOKUP(RC[-7],Sheet1!R2C1:R28C4,4,FALSE)="品",VLOOKUP(RC[-3],Sheet1!R2C8:R6C9,2,FALSE),RC[-3])&VLOOKUP(RC[-7],Sheet1!R2C1:R28C4,4,FALSE) -> 累计与异族入侵怪物战斗800次 | I663: 16 | J663: =VLOOKUP(RC[-9],Sheet1!R2C1:R28C6,6,FALSE) -> 战功
A664: 16 | B664: btn_guild | C664: 12 | D664: 1 | E664: 900 | F664: 19014 | G664: 2000 | H664: =VLOOKUP(RC[-7],Sheet1!R2C1:R28C4,2,FALSE)&VLOOKUP(RC[-7],Sheet1!R2C1:R28C4,3,FALSE)&IF(VLOOKUP(RC[-7],Sheet1!R2C1:R28C4,4,FALSE)="品",VLOOKUP(RC[-3],Sheet1!R2C8:R6C9,2,FALSE),RC[-3])&VLOOKUP(RC[-7],Sheet1!R2C1:R28C4,4,FALSE) -> 累计与异族入侵怪物战斗900次 | I664: 16 | J664: =VLOOKUP(RC[-9],Sheet1!R2C1:R28C6,6,FALSE) -> 战功
A665: 16 | B665: btn_guild | C665: 13 | D665: 1 | E665: 1000 | F665: 19014 | G665: 2000 | H665: =VLOOKUP(RC[-7],Sheet1!R2C1:R28C4,2,FALSE)&VLOOKUP(RC[-7],Sheet1!R2C1:R28C4,3,FALSE)&IF(VLOOKUP(RC[-7],Sheet1!R2C1:R28C4,4,FALSE)="品",VLOOKUP(RC[-3],Sheet1!R2C8:R6C9,2,FALSE),RC[-3])&VLOOKUP(RC[-7],Sheet1!R2C1:R28C4,4,FALSE) -> 累计与异族入侵怪物战斗1000次 | I665: 16 | J665: =VLOOKUP(RC[-9],Sheet1!R2C1:R28C6,6,FALSE) -> 战功
A666: 16 | B666: btn_guild | C666: 14 | D666: 1 | E666: 1100 | F666: 19014 | G666: 2000 | H666: =VLOOKUP(RC[-7],Sheet1!R2C1:R28C4,2,FALSE)&VLOOKUP(RC[-7],Sheet1!R2C1:R28C4,3,FALSE)&IF(VLOOKUP(RC[-7],Sheet1!R2C1:R28C4,4,FALSE)="品",VLOOKUP(RC[-3],Sheet1!R2C8:R6C9,2,FALSE),RC[-3])&VLOOKUP(RC[-7],Sheet1!R2C1:R28C4,4,FALSE) -> 累计与异族入侵怪物战斗1100次 | I666: 16 | J666: =VLOOKUP(RC[-9],Sheet1!R2C1:R28C6,6,FALSE) -> 战功
A667: 16 | B667: btn_guild | C667: 15 | D667: 1 | E667: 1200 | F667: 19014 | G667: 2000 | H667: =VLOOKUP(RC[-7],Sheet1!R2C1:R28C4,2,FALSE)&VLOOKUP(RC[-7],Sheet1!R2C1:R28C4,3,FALSE)&IF(VLOOKUP(RC[-7],Sheet1!R2C1:R28C4,4,FALSE)="品",VLOOKUP(RC[-3],Sheet1!R2C8:R6C9,2,FALSE),RC[-3])&VLOOKUP(RC[-7],Sheet1!R2C1:R28C4,4,FALSE) -> 累计与异族入侵怪物战斗1200次 | I667: 16 | J667: =VLOOKUP(RC[-9],Sheet1!R2C1:R28C6,6,FALSE) -> 战功
A668: 16 | B668: btn_guild | C668: 16 | D668: 1 | E668: 1300 | F668: 19014 | G668: 2000 | H668: =VLOOKUP(RC[-7],Sheet1!R2C1:R28C4,2,FALSE)&VLOOKUP(RC[-7],Sheet1!R2C1:R28C4,3,FALSE)&IF(VLOOKUP(RC[-7],Sheet1!R2C1:R28C4,4,FALSE)="品",VLOOKUP(RC[-3],Sheet1!R2C8:R6C9,2,FALSE),RC[-3])&VLOOKUP(RC[-7],Sheet1!R2C1:R28C4,4,FALSE) -> 累计与异族入侵怪物战斗1300次 | I668: 16 | J668: =VLOOKUP(RC[-9],Sheet1!R2C1:R28C6,6,FALSE) -> 战功
A669: 16 | B669: btn_guild | C669: 17 | D669: 1 | E669: 1400 | F669: 19014 | G669: 2000 | H669: =VLOOKUP(RC[-7],Sheet1!R2C1:R28C4,2,FALSE)&VLOOKUP(RC[-7],Sheet1!R2C1:R28C4,3,FALSE)&IF(VLOOKUP(RC[-7],Sheet1!R2C1:R28C4,4,FALSE)="品",VLOOKUP(RC[-3],Sheet1!R2C8:R6C9,2,FALSE),RC[-3])&VLOOKUP(RC[-7],Sheet1!R2C1:R28C4,4,FALSE) -> 累计与异族入侵怪物战斗1400次 | I669: 16 | J669: =VLOOKUP(RC[-9],Sheet1!R2C1:R28C6,6,FALSE) -> 战功
A670: 16 | B670: btn_guild | C670: 18 | D670: 1 | E670: 1500 | F670: 19014 | G670: 2000 | H670: =VLOOKUP(RC[-7],Sheet1!R2C1:R28C4,2,FALSE)&VLOOKUP(RC[-7],Sheet1!R2C1:R28C4,3,FALSE)&IF(VLOOKUP(RC[-7],Sheet1!R2C1:R28C4,4,FALSE)="品",VLOOKUP(RC[-3],Sheet1!R2C8:R6C9,2,FALSE),RC[-3])&VLOOKUP(RC[-7],Sheet1!R2C1:R28C4,4,FALSE) -> 累计与异族入侵怪物战斗1500次 | I670: 16 | J670: =VLOOKUP(RC[-9],Sheet1!R2C1:R28C6,6,FALSE) -> 战功
A671: 16 | B671: btn_guild | C671: 19 | D671: 1 | E671: 1600 | F671: 19014 | G671: 2000 | H671: =VLOOKUP(RC[-7],Sheet1!R2C1:R28C4,2,FALSE)&VLOOKUP(RC[-7],Sheet1!R2C1:R28C4,3,FALSE)&IF(VLOOKUP(RC[-7],Sheet1!R2C1:R28C4,4,FALSE)="品",VLOOKUP(RC[-3],Sheet1!R2C8:R6C9,2,FALSE),RC[-3])&VLOOKUP(RC[-7],Sheet1!R2C1:R28C4,4,FALSE) -> 累计与异族入侵怪物战斗1600次 | I671: 16 | J671: =VLOOKUP(RC[-9],Sheet1!R2C1:R28C6,6,FALSE) -> 战功
A672: 16 | B672: btn_guild | C672: 20 | D672: 1 | E672: 1700 | F672: 19014 | G672: 2000 | H672: =VLOOKUP(RC[-7],Sheet1!R2C1:R28C4,2,FALSE)&VLOOKUP(RC[-7],Sheet1!R2C1:R28C4,3,FALSE)&IF(VLOOKUP(RC[-7],Sheet1!R2C1:R28C4,4,FALSE)="品",VLOOKUP(RC[-3],Sheet1!R2C8:R6C9,2,FALSE),RC[-3])&VLOOKUP(RC[-7],Sheet1!R2C1:R28C4,4,FALSE) -> 累计与异族入侵怪物战斗1700次 | I672: 16 | J672: =VLOOKUP(RC[-9],Sheet1!R2C1:R28C6,6,FALSE) -> 战功
A673: 16 | B673: btn_guild | C673: 21 | D673: 1 | E673: 1800 | F673: 19014 | G673: 3000 | H673: =VLOOKUP(RC[-7],Sheet1!R2C1:R28C4,2,FALSE)&VLOOKUP(RC[-7],Sheet1!R2C1:R28C4,3,FALSE)&IF(VLOOKUP(RC[-7],Sheet1!R2C1:R28C4,4,FALSE)="品",VLOOKUP(RC[-3],Sheet1!R2C8:R6C9,2,FALSE),RC[-3])&VLOOKUP(RC[-7],Sheet1!R2C1:R28C4,4,FALSE) -> 累计与异族入侵怪物战斗1800次 | I673: 16 | J673: =VLOOKUP(RC[-9],Sheet1!R2C1:R28C6,6,FALSE) -> 战功
A674: 16 | B674: btn_guild | C674: 22 | D674: 1 | E674: 1900 | F674: 19014 | G674: 3000 | H674: =VLOOKUP(RC[-7],Sheet1!R2C1:R28C4,2,FALSE)&VLOOKUP(RC[-7],Sheet1!R2C1:R28C4,3,FALSE)&IF(VLOOKUP(RC[-7],Sheet1!R2C1:R28C4,4,FALSE)="品",VLOOKUP(RC[-3],Sheet1!R2C8:R6C9,2,FALSE),RC[-3])&VLOOKUP(RC[-7],Sheet1!R2C1:R28C4,4,FALSE) -> 累计与异族入侵怪物战斗1900次 | I674: 16 | J674: =VLOOKUP(RC[-9],Sheet1!R2C1:R28C6,6,FALSE) -> 战功
A675: 16 | B675: btn_guild | C675: 23 | D675: 1 | E675: 2000 | F675: 19014 | G675: 3000 | H675: =VLOOKUP(RC[-7],Sheet1!R2C1:R28C4,2,FALSE)&VLOOKUP(RC[-7],Sheet1!R2C1:R28C4,3,FALSE)&IF(VLOOKUP(RC[-7],Sheet1!R2C1:R28C4,4,FALSE)="品",VLOOKUP(RC[-3],Sheet1!R2C8:R6C9,2,FALSE),RC[-3])&VLOOKUP(RC[-7],Sheet1!R2C1:R28C4,4,FALSE) -> 累计与异族入侵怪物战斗2000次 | I675: 16 | J675: =VLOOKUP(RC[-9],Sheet1!R2C1:R28C6,6,FALSE) -> 战功
A676: 16 | B676: btn_guild | C676: 24 | D676: 1 | E676: 2100 | F676: 19014 | G676: 3000 | H676: =VLOOKUP(RC[-7],Sheet1!R2C1:R28C4,2,FALSE)&VLOOKUP(RC[-7],Sheet1!R2C1:R28C4,3,FALSE)&IF(VLOOKUP(RC[-7],Sheet1!R2C1:R28C4,4,FALSE)="品",VLOOKUP(RC[-3],Sheet1!R2C8:R6C9,2,FALSE),RC[-3])&VLOOKUP(RC[-7],Sheet1!R2C1:R28C4,4,FALSE) -> 累计与异族入侵怪物战斗2100次 | I676: 16 | J676: =VLOOKUP(RC[-9],Sheet1!R2C1:R28C6,6,FALSE) -> 战功
A677: 16 | B677: btn_guild | C677: 25 | D677: 1 | E677: 2200 | F677: 19014 | G677: 3000 | H677: =VLOOKUP(RC[-7],Sheet1!R2C1:R28C4,2,FALSE)&VLOOKUP(RC[-7],Sheet1!R2C1:R28C4,3,FALSE)&IF(VLOOKUP(RC[-7],Sheet1!R2C1:R28C4,4,FALSE)="品",VLOOKUP(RC[-3],Sheet1!R2C8:R6C9,2,FALSE),RC[-3])&VLOOKUP(RC[-7],Sheet1!R2C1:R28C4,4,FALSE) -> 累计与异族入侵怪物战斗2200次 | I677: 16 | J677: =VLOOKUP(RC[-9],Sheet1!R2C1:R28C6,6,FALSE) -> 战功
A678: 16 | B678: btn_guild | C678: 26 | D678: 1 | E678: 2300 | F678: 19014 | G678: 3000 | H678: =VLOOKUP(RC[-7],Sheet1!R2C1:R28C4,2,FALSE)&VLOOKUP(RC[-7],Sheet1!R2C1:R28C4,3,FALSE)&IF(VLOOKUP(RC[-7],Sheet1!R2C1:R28C4,4,FALSE)="品",VLOOKUP(RC[-3],Sheet1!R2C8:R6C9,2,FALSE),RC[-3])&VLOOKUP(RC[-7],Sheet1!R2C1:R28C4,4,FALSE) -> 累计与异族入侵怪物战斗2300次 | I678: 16 | J678: =VLOOKUP(RC[-9],Sheet1!R2C1:R28C6,6,FALSE) -> 战功
A679: 16 | B679: btn_guild | C679: 27 | D679: 1 | E679: 2400 | F679: 19014 | G679: 3000 | H679: =VLOOKUP(RC[-7],Sheet1!R2C1:R28C4,2,FALSE)&VLOOKUP(RC[-7],Sheet1!R2C1:R28C4,3,FALSE)&IF(VLOOKUP(RC[-7],Sheet1!R2C1:R28C4,4,FALSE)="品",VLOOKUP(RC[-3],Sheet1!R2C8:R6C9,2,FALSE),RC[-3])&VLOOKUP(RC[-7],Sheet1!R2C1:R28C4,4,FALSE) -> 累计与异族入侵怪物战斗2400次 | I679: 16 | J679: =VLOOKUP(RC[-9],Sheet1!R2C1:R28C6,6,FALSE) -> 战功
A680: 16 | B680: btn_guild | C680: 28 | D680: 1 | E680: 2500 | F680: 19014 | G680: 3000 | H680: =VLOOKUP(RC[-7],Sheet1!R2C1:R28C4,2,FALSE)&VLOOKUP(RC[-7],Sheet1!R2C1:R28C4,3,FALSE)&IF(VLOOKUP(RC[-7],Sheet1!R2C1:R28C4,4,FALSE)="品",VLOOKUP(RC[-3],Sheet1!R2C8:R6C9,2,FALSE),RC[-3])&VLOOKUP(RC[-7],Sheet1!R2C1:R28C4,4,FALSE) -> 累计与异族入侵怪物战斗2500次 | I680: 16 | J680: =VLOOKUP(RC[-9],Sheet1!R2C1:R28C6,6,FALSE) -> 战功
A681: 16 | B681: btn_guild | C681: 29 | D681: 1 | E681: 2600 | F681: 19014 | G681: 3000 | H681: =VLOOKUP(RC[-7],Sheet1!R2C1:R28C4,2,FALSE)&VLOOKUP(RC[-7],Sheet1!R2C1:R28C4,3,FALSE)&IF(VLOOKUP(RC[-7],Sheet1!R2C1:R28C4,4,FALSE)="品",VLOOKUP(RC[-3],Sheet1!R2C8:R6C9,2,FALSE),RC[-3])&VLOOKUP(RC[-7],Sheet1!R2C1:R28C4,4,FALSE) -> 累计与异族入侵怪物战斗2600次 | I681: 16 | J681: =VLOOKUP(RC[-9],Sheet1!R2C1:R28C6,6,FALSE) -> 战功
A682: 16 | B682: btn_guild | C682: 30 | D682: 1 | E682: 2700 | F682: 19014 | G682: 3000 | H682: =VLOOKUP(RC[-7],Sheet1!R2C1:R28C4,2,FALSE)&VLOOKUP(RC[-7],Sheet1!R2C1:R28C4,3,FALSE)&IF(VLOOKUP(RC[-7],Sheet1!R2C1:R28C4,4,FALSE)="品",VLOOKUP(RC[-3],Sheet1!R2C8:R6C9,2,FALSE),RC[-3])&VLOOKUP(RC[-7],Sheet1!R2C1:R28C4,4,FALSE) -> 累计与异族入侵怪物战斗2700次 | I682: 16 | J682: =VLOOKUP(RC[-9],Sheet1!R2C1:R28C6,6,FALSE) -> 战功
A683: 16 | B683: btn_guild | C683: 31 | D683: 1 | E683: 2800 | F683: 19014 | G683: 4000 | H683: =VLOOKUP(RC[-7],Sheet1!R2C1:R28C4,2,FALSE)&VLOOKUP(RC[-7],Sheet1!R2C1:R28C4,3,FALSE)&IF(VLOOKUP(RC[-7],Sheet1!R2C1:R28C4,4,FALSE)="品",VLOOKUP(RC[-3],Sheet1!R2C8:R6C9,2,FALSE),RC[-3])&VLOOKUP(RC[-7],Sheet1!R2C1:R28C4,4,FALSE) -> 累计与异族入侵怪物战斗2800次 | I683: 16 | J683: =VLOOKUP(RC[-9],Sheet1!R2C1:R28C6,6,FALSE) -> 战功
A684: 16 | B684: btn_guild | C684: 32 | D684: 1 | E684: 2900 | F684: 19014 | G684: 4000 | H684: =VLOOKUP(RC[-7],Sheet1!R2C1:R28C4,2,FALSE)&VLOOKUP(RC[-7],Sheet1!R2C1:R28C4,3,FALSE)&IF(VLOOKUP(RC[-7],Sheet1!R2C1:R28C4,4,FALSE)="品",VLOOKUP(RC[-3],Sheet1!R2C8:R6C9,2,FALSE),RC[-3])&VLOOKUP(RC[-7],Sheet1!R2C1:R28C4,4,FALSE) -> 累计与异族入侵怪物战斗2900次 | I684: 16 | J684: =VLOOKUP(RC[-9],Sheet1!R2C1:R28C6,6,FALSE) -> 战功
A685: 16 | B685: btn_guild | C685: 33 | D685: 1 | E685: 3000 | F685: 19014 | G685: 4000 | H685: =VLOOKUP(RC[-7],Sheet1!R2C1:R28C4,2,FALSE)&VLOOKUP(RC[-7],Sheet1!R2C1:R28C4,3,FALSE)&IF(VLOOKUP(RC[-7],Sheet1!R2C1:R28C4,4,FALSE)="品",VLOOKUP(RC[-3],Sheet1!R2C8:R6C9,2,FALSE),RC[-3])&VLOOKUP(RC[-7],Sheet1!R2C1:R28C4,4,FALSE) -> 累计与异族入侵怪物战斗3000次 | I685: 16 | J685: =VLOOKUP(RC[-9],Sheet1!R2C1:R28C6,6,FALSE) -> 战功
A686: 16 | B686: btn_guild | C686: 34 | D686: 1 | E686: 3100 | F686: 19014 | G686: 4000 | H686: =VLOOKUP(RC[-7],Sheet1!R2C1:R28C4,2,FALSE)&VLOOKUP(RC[-7],Sheet1!R2C1:R28C4,3,FALSE)&IF(VLOOKUP(RC[-7],Sheet1!R2C1:R28C4,4,FALSE)="品",VLOOKUP(RC[-3],Sheet1!R2C8:R6C9,2,FALSE),RC[-3])&VLOOKUP(RC[-7],Sheet1!R2C1:R28C4,4,FALSE) -> 累计与异族入侵怪物战斗3100次 | I686: 16 | J686: =VLOOKUP(RC[-9],Sheet1!R2C1:R28C6,6,FALSE) -> 战功
A687: 16 | B687: btn_guild | C687: 35 | D687: 1 | E687: 3200 | F687: 19014 | G687: 4000 | H687: =VLOOKUP(RC[-7],Sheet1!R2C1:R28C4,2,FALSE)&VLOOKUP(RC[-7],Sheet1!R2C1:R28C4,3,FALSE)&IF(VLOOKUP(RC[-7],Sheet1!R2C1:R28C4,4,FALSE)="品",VLOOKUP(RC[-3],Sheet1!R2C8:R6C9,2,FALSE),RC[-3])&VLOOKUP(RC[-7],Sheet1!R2C1:R28C4,4,FALSE) -> 累计与异族入侵怪物战斗3200次 | I687: 16 | J687: =VLOOKUP(RC[-9],Sheet1!R2C1:R28C6,6,FALSE) -> 战功
A688: 16 | B688: btn_guild | C688: 36 | D688: 1 | E688: 3300 | F688: 19014 | G688: 4000 | H688: =VLOOKUP(RC[-7],Sheet1!R2C1:R28C4,2,FALSE)&VLOOKUP(RC[-7],Sheet1!R2C1:R28C4,3,FALSE)&IF(VLOOKUP(RC[-7],Sheet1!R2C1:R28C4,4,FALSE)="品",VLOOKUP(RC[-3],Sheet1!R2C8:R6C9,2,FALSE),RC[-3])&VLOOKUP(RC[-7],Sheet1!R2C1:R28C4,4,FALSE) -> 累计与异族入侵怪物战斗3300次 | I688: 16 | J688: =VLOOKUP(RC[-9],Sheet1!R2C1:R28C6,6,FALSE) -> 战功
A689: 16 | B689: btn_guild | C689: 37 | D689: 1 | E689: 3400 | F689: 19014 | G689: 4000 | H689: =VLOOKUP(RC[-7],Sheet1!R2C1:R28C4,2,FALSE)&VLOOKUP(RC[-7],Sheet1!R2C1:R28C4,3,FALSE)&IF(VLOOKUP(RC[-7],Sheet1!R2C1:R28C4,4,FALSE)="品",VLOOKUP(RC[-3],Sheet1!R2C8:R6C9,2,FALSE),RC[-3])&VLOOKUP(RC[-7],Sheet1!R2C1:R28C4,4,FALSE) -> 累计与异族入侵怪物战斗3400次 | I689: 16 | J689: =VLOOKUP(RC[-9],Sheet1!R2C1:R28C6,6,FALSE) -> 战功
A690: 16 | B690: btn_guild | C690: 38 | D690: 1 | E690: 3500 | F690: 19014 | G690: 4000 | H690: =VLOOKUP(RC[-7],Sheet1!R2C1:R28C4,2,FALSE)&VLOOKUP(RC[-7],Sheet1!R2C1:R28C4,3,FALSE)&IF(VLOOKUP(RC[-7],Sheet1!R2C1:R28C4,4,FALSE)="品",VLOOKUP(RC[-3],Sheet1!R2C8:R6C9,2,FALSE),RC[-3])&VLOOKUP(RC[-7],Sheet1!R2C1:R28C4,4,FALSE) -> 累计与异族入侵怪物战斗3500次 | I690: 16 | J690: =VLOOKUP(RC[-9],Sheet1!R2C1:R28C6,6,FALSE) -> 战功
A691: 16 | B691: btn_guild | C691: 39 | D691: 1 | E691: 3600 | F691: 19014 | G691: 4000 | H691: =VLOOKUP(RC[-7],Sheet1!R2C1:R28C4,2,FALSE)&VLOOKUP(RC[-7],Sheet1!R2C1:R28C4,3,FALSE)&IF(VLOOKUP(RC[-7],Sheet1!R2C1:R28C4,4,FALSE)="品",VLOOKUP(RC[-3],Sheet1!R2C8:R6C9,2,FALSE),RC[-3])&VLOOKUP(RC[-7],Sheet1!R2C1:R28C4,4,FALSE) -> 累计与异族入侵怪物战斗3600次 | I691: 16 | J691: =VLOOKUP(RC[-9],Sheet1!R2C1:R28C6,6,FALSE) -> 战功
A692: 16 | B692: btn_guild | C692: 40 | D692: 1 | E692: 3700 | F692: 19014 | G692: 4000 | H692: =VLOOKUP(RC[-7],Sheet1!R2C1:R28C4,2,FALSE)&VLOOKUP(RC[-7],Sheet1!R2C1:R28C4,3,FALSE)&IF(VLOOKUP(RC[-7],Sheet1!R2C1:R28C4,4,FALSE)="品",VLOOKUP(RC[-3],Sheet1!R2C8:R6C9,2,FALSE),RC[-3])&VLOOKUP(RC[-7],Sheet1!R2C1:R28C4,4,FALSE) -> 累计与异族入侵怪物战斗3700次 | I692: 16 | J692: =VLOOKUP(RC[-9],Sheet1!R2C1:R28C6,6,FALSE) -> 战功
A693: 16 | B693: btn_guild | C693: 41 | D693: 1 | E693: 3800 | F693: 19014 | G693: 5000 | H693: =VLOOKUP(RC[-7],Sheet1!R2C1:R28C4,2,FALSE)&VLOOKUP(RC[-7],Sheet1!R2C1:R28C4,3,FALSE)&IF(VLOOKUP(RC[-7],Sheet1!R2C1:R28C4,4,FALSE)="品",VLOOKUP(RC[-3],Sheet1!R2C8:R6C9,2,FALSE),RC[-3])&VLOOKUP(RC[-7],Sheet1!R2C1:R28C4,4,FALSE) -> 累计与异族入侵怪物战斗3800次 | I693: 16 | J693: =VLOOKUP(RC[-9],Sheet1!R2C1:R28C6,6,FALSE) -> 战功
A694: 16 | B694: btn_guild | C694: 42 | D694: 1 | E694: 3900 | F694: 19014 | G694: 5000 | H694: =VLOOKUP(RC[-7],Sheet1!R2C1:R28C4,2,FALSE)&VLOOKUP(RC[-7],Sheet1!R2C1:R28C4,3,FALSE)&IF(VLOOKUP(RC[-7],Sheet1!R2C1:R28C4,4,FALSE)="品",VLOOKUP(RC[-3],Sheet1!R2C8:R6C9,2,FALSE),RC[-3])&VLOOKUP(RC[-7],Sheet1!R2C1:R28C4,4,FALSE) -> 累计与异族入侵怪物战斗3900次 | I694: 16 | J694: =VLOOKUP(RC[-9],Sheet1!R2C1:R28C6,6,FALSE) -> 战功
A695: 16 | B695: btn_guild | C695: 43 | D695: 1 | E695: 4000 | F695: 19014 | G695: 5000 | H695: =VLOOKUP(RC[-7],Sheet1!R2C1:R28C4,2,FALSE)&VLOOKUP(RC[-7],Sheet1!R2C1:R28C4,3,FALSE)&IF(VLOOKUP(RC[-7],Sheet1!R2C1:R28C4,4,FALSE)="品",VLOOKUP(RC[-3],Sheet1!R2C8:R6C9,2,FALSE),RC[-3])&VLOOKUP(RC[-7],Sheet1!R2C1:R28C4,4,FALSE) -> 累计与异族入侵怪物战斗4000次 | I695: 16 | J695: =VLOOKUP(RC[-9],Sheet1!R2C1:R28C6,6,FALSE) -> 战功
A696: 16 | B696: btn_guild | C696: 44 | D696: 1 | E696: 4100 | F696: 19014 | G696: 5000 | H696: =VLOOKUP(RC[-7],Sheet1!R2C1:R28C4,2,FALSE)&VLOOKUP(RC[-7],Sheet1!R2C1:R28C4,3,FALSE)&IF(VLOOKUP(RC[-7],Sheet1!R2C1:R28C4,4,FALSE)="品",VLOOKUP(RC[-3],Sheet1!R2C8:R6C9,2,FALSE),RC[-3])&VLOOKUP(RC[-7],Sheet1!R2C1:R28C4,4,FALSE) -> 累计与异族入侵怪物战斗4100次 | I696: 16 | J696: =VLOOKUP(RC[-9],Sheet1!R2C1:R28C6,6,FALSE) -> 战功
A697: 16 | B697: btn_guild | C697: 45 | D697: 1 | E697: 4200 | F697: 19014 | G697: 5000 | H697: =VLOOKUP(RC[-7],Sheet1!R2C1:R28C4,2,FALSE)&VLOOKUP(RC[-7],Sheet1!R2C1:R28C4,3,FALSE)&IF(VLOOKUP(RC[-7],Sheet1!R2C1:R28C4,4,FALSE)="品",VLOOKUP(RC[-3],Sheet1!R2C8:R6C9,2,FALSE),RC[-3])&VLOOKUP(RC[-7],Sheet1!R2C1:R28C4,4,FALSE) -> 累计与异族入侵怪物战斗4200次 | I697: 16 | J697: =VLOOKUP(RC[-9],Sheet1!R2C1:R28C6,6,FALSE) -> 战功
A698: 16 | B698: btn_guild | C698: 46 | D698: 1 | E698: 4300 | F698: 19014 | G698: 5000 | H698: =VLOOKUP(RC[-7],Sheet1!R2C1:R28C4,2,FALSE)&VLOOKUP(RC[-7],Sheet1!R2C1:R28C4,3,FALSE)&IF(VLOOKUP(RC[-7],Sheet1!R2C1:R28C4,4,FALSE)="品",VLOOKUP(RC[-3],Sheet1!R2C8:R6C9,2,FALSE),RC[-3])&VLOOKUP(RC[-7],Sheet1!R2C1:R28C4,4,FALSE) -> 累计与异族入侵怪物战斗4300次 | I698: 16 | J698: =VLOOKUP(RC[-9],Sheet1!R2C1:R28C6,6,FALSE) -> 战功
A699: 16 | B699: btn_guild | C699: 47 | D699: 1 | E699: 4400 | F699: 19014 | G699: 5000 | H699: =VLOOKUP(RC[-7],Sheet1!R2C1:R28C4,2,FALSE)&VLOOKUP(RC[-7],Sheet1!R2C1:R28C4,3,FALSE)&IF(VLOOKUP(RC[-7],Sheet1!R2C1:R28C4,4,FALSE)="品",VLOOKUP(RC[-3],Sheet1!R2C8:R6C9,2,FALSE),RC[-3])&VLOOKUP(RC[-7],Sheet1!R2C1:R28C4,4,FALSE) -> 累计与异族入侵怪物战斗4400次 | I699: 16 | J699: =VLOOKUP(RC[-9],Sheet1!R2C1:R28C6,6,FALSE) -> 战功
A700: 16 | B700: btn_guild | C700: 48 | D700: 1 | E700: 4500 | F700: 19014 | G700: 5000 | H700: =VLOOKUP(RC[-7],Sheet1!R2C1:R28C4,2,FALSE)&VLOOKUP(RC[-7],Sheet1!R2C1:R28C4,3,FALSE)&IF(VLOOKUP(RC[-7],Sheet1!R2C1:R28C4,4,FALSE)="品",VLOOKUP(RC[-3],Sheet1!R2C8:R6C9,2,FALSE),RC[-3])&VLOOKUP(RC[-7],Sheet1!R2C1:R28C4,4,FALSE) -> 累计与异族入侵怪物战斗4500次 | I700: 16 | J700: =VLOOKUP(RC[-9],Sheet1!R2C1:R28C6,6,FALSE) -> 战功
A701: 16 | B701: btn_guild | C701: 49 | D701: 1 | E701: 4600 | F701: 19014 | G701: 5000 | H701: =VLOOKUP(RC[-7],Sheet1!R2C1:R28C4,2,FALSE)&VLOOKUP(RC[-7],Sheet1!R2C1:R28C4,3,FALSE)&IF(VLOOKUP(RC[-7],Sheet1!R2C1:R28C4,4,FALSE)="品",VLOOKUP(RC[-3],Sheet1!R2C8:R6C9,2,FALSE),RC[-3])&VLOOKUP(RC[-7],Sheet1!R2C1:R28C4,4,FALSE) -> 累计与异族入侵怪物战斗4600次 | I701: 16 | J701: =VLOOKUP(RC[-9],Sheet1!R2C1:R28C6,6,FALSE) -> 战功
A702: 16 | B702: btn_guild | C702: 50 | D702: 1 | E702: 4700 | F702: 19014 | G702: 5000 | H702: =VLOOKUP(RC[-7],Sheet1!R2C1:R28C4,2,FALSE)&VLOOKUP(RC[-7],Sheet1!R2C1:R28C4,3,FALSE)&IF(VLOOKUP(RC[-7],Sheet1!R2C1:R28C4,4,FALSE)="品",VLOOKUP(RC[-3],Sheet1!R2C8:R6C9,2,FALSE),RC[-3])&VLOOKUP(RC[-7],Sheet1!R2C1:R28C4,4,FALSE) -> 累计与异族入侵怪物战斗4700次 | I702: 16 | J702: =VLOOKUP(RC[-9],Sheet1!R2C1:R28C6,6,FALSE) -> 战功
A703: 16 | B703: btn_guild | C703: 51 | D703: 1 | E703: 4800 | F703: 19014 | G703: 5000 | H703: =VLOOKUP(RC[-7],Sheet1!R2C1:R28C4,2,FALSE)&VLOOKUP(RC[-7],Sheet1!R2C1:R28C4,3,FALSE)&IF(VLOOKUP(RC[-7],Sheet1!R2C1:R28C4,4,FALSE)="品",VLOOKUP(RC[-3],Sheet1!R2C8:R6C9,2,FALSE),RC[-3])&VLOOKUP(RC[-7],Sheet1!R2C1:R28C4,4,FALSE) -> 累计与异族入侵怪物战斗4800次 | I703: 16 | J703: =VLOOKUP(RC[-9],Sheet1!R2C1:R28C6,6,FALSE) -> 战功
A704: 16 | B704: btn_guild | C704: 52 | D704: 1 | E704: 4900 | F704: 19014 | G704: 5000 | H704: =VLOOKUP(RC[-7],Sheet1!R2C1:R28C4,2,FALSE)&VLOOKUP(RC[-7],Sheet1!R2C1:R28C4,3,FALSE)&IF(VLOOKUP(RC[-7],Sheet1!R2C1:R28C4,4,FALSE)="品",VLOOKUP(RC[-3],Sheet1!R2C8:R6C9,2,FALSE),RC[-3])&VLOOKUP(RC[-7],Sheet1!R2C1:R28C4,4,FALSE) -> 累计与异族入侵怪物战斗4900次 | I704: 16 | J704: =VLOOKUP(RC[-9],Sheet1!R2C1:R28C6,6,FALSE) -> 战功
A705: 16 | B705: btn_guild | C705: 53 | D705: 1 | E705: 5000 | F705: 19014 | G705: 5000 | H705: =VLOOKUP(RC[-7],Sheet1!R2C1:R28C4,2,FALSE)&VLOOKUP(RC[-7],Sheet1!R2C1:R28C4,3,FALSE)&IF(VLOOKUP(RC[-7],Sheet1!R2C1:R28C4,4,FALSE)="品",VLOOKUP(RC[-3],Sheet1!R2C8:R6C9,2,FALSE),RC[-3])&VLOOKUP(RC[-7],Sheet1!R2C1:R28C4,4,FALSE) -> 累计与异族入侵怪物战斗5000次 | I705: 16 | J705: =VLOOKUP(RC[-9],Sheet1!R2C1:R28C6,6,FALSE) -> 战功
A706: 17 | B706: btn_equip | C706: 1 | D706: 1 | E706: 10 | F706: 19003 | G706: 50000 | H706: =VLOOKUP(RC[-7],Sheet1!R2C1:R28C4,2,FALSE)&VLOOKUP(RC[-7],Sheet1!R2C1:R28C4,3,FALSE)&IF(VLOOKUP(RC[-7],Sheet1!R2C1:R28C4,4,FALSE)="品",VLOOKUP(RC[-3],Sheet1!R2C8:R6C9,2,FALSE),RC[-3])&VLOOKUP(RC[-7],Sheet1!R2C1:R28C4,4,FALSE) -> 战队中全体英雄装备强化到10级 | I706: 7 | J706: =VLOOKUP(RC[-9],Sheet1!R2C1:R28C6,6,FALSE) -> 金币
A707: 17 | B707: btn_equip | C707: 2 | D707: 1 | E707: 20 | F707: 19003 | G707: 50000 | H707: =VLOOKUP(RC[-7],Sheet1!R2C1:R28C4,2,FALSE)&VLOOKUP(RC[-7],Sheet1!R2C1:R28C4,3,FALSE)&IF(VLOOKUP(RC[-7],Sheet1!R2C1:R28C4,4,FALSE)="品",VLOOKUP(RC[-3],Sheet1!R2C8:R6C9,2,FALSE),RC[-3])&VLOOKUP(RC[-7],Sheet1!R2C1:R28C4,4,FALSE) -> 战队中全体英雄装备强化到20级 | I707: 7 | J707: =VLOOKUP(RC[-9],Sheet1!R2C1:R28C6,6,FALSE) -> 金币
A708: 17 | B708: btn_equip | C708: 3 | D708: 1 | E708: 30 | F708: 19003 | G708: 100000 | H708: =VLOOKUP(RC[-7],Sheet1!R2C1:R28C4,2,FALSE)&VLOOKUP(RC[-7],Sheet1!R2C1:R28C4,3,FALSE)&IF(VLOOKUP(RC[-7],Sheet1!R2C1:R28C4,4,FALSE)="品",VLOOKUP(RC[-3],Sheet1!R2C8:R6C9,2,FALSE),RC[-3])&VLOOKUP(RC[-7],Sheet1!R2C1:R28C4,4,FALSE) -> 战队中全体英雄装备强化到30级 | I708: 7 | J708: =VLOOKUP(RC[-9],Sheet1!R2C1:R28C6,6,FALSE) -> 金币
A709: 17 | B709: btn_equip | C709: 4 | D709: 1 | E709: 40 | F709: 19003 | G709: 100000 | H709: =VLOOKUP(RC[-7],Sheet1!R2C1:R28C4,2,FALSE)&VLOOKUP(RC[-7],Sheet1!R2C1:R28C4,3,FALSE)&IF(VLOOKUP(RC[-7],Sheet1!R2C1:R28C4,4,FALSE)="品",VLOOKUP(RC[-3],Sheet1!R2C8:R6C9,2,FALSE),RC[-3])&VLOOKUP(RC[-7],Sheet1!R2C1:R28C4,4,FALSE) -> 战队中全体英雄装备强化到40级 | I709: 7 | J709: =VLOOKUP(RC[-9],Sheet1!R2C1:R28C6,6,FALSE) -> 金币
A710: 17 | B710: btn_equip | C710: 5 | D710: 1 | E710: 50 | F710: 19003 | G710: 200000 | H710: =VLOOKUP(RC[-7],Sheet1!R2C1:R28C4,2,FALSE)&VLOOKUP(RC[-7],Sheet1!R2C1:R28C4,3,FALSE)&IF(VLOOKUP(RC[-7],Sheet1!R2C1:R28C4,4,FALSE)="品",VLOOKUP(RC[-3],Sheet1!R2C8:R6C9,2,FALSE),RC[-3])&VLOOKUP(RC[-7],Sheet1!R2C1:R28C4,4,FALSE) -> 战队中全体英雄装备强化到50级 | I710: 7 | J710: =VLOOKUP(RC[-9],Sheet1!R2C1:R28C6,6,FALSE) -> 金币
A711: 17 | B711: btn_equip | C711: 6 | D711: 1 | E711: 60 | F711: 19003 | G711: 200000 | H711: =VLOOKUP(RC[-7],Sheet1!R2C1:R28C4,2,FALSE)&VLOOKUP(RC[-7],Sheet1!R2C1:R28C4,3,FALSE)&IF(VLOOKUP(RC[-7],Sheet1!R2C1:R28C4,4,FALSE)="品",VLOOKUP(RC[-3],Sheet1!R2C8:R6C9,2,FALSE),RC[-3])&VLOOKUP(RC[-7],Sheet1!R2C1:R28C4,4,FALSE) -> 战队中全体英雄装备强化到60级 | I711: 7 | J711: =VLOOKUP(RC[-9],Sheet1!R2C1:R28C6,6,FALSE) -> 金币
A712: 17 | B712: btn_equip | C712: 7 | D712: 1 | E712: 70 | F712: 19003 | G712: 300000 | H712: =VLOOKUP(RC[-7],Sheet1!R2C1:R28C4,2,FALSE)&VLOOKUP(RC[-7],Sheet1!R2C1:R28C4,3,FALSE)&IF(VLOOKUP(RC[-7],Sheet1!R2C1:R28C4,4,FALSE)="品",VLOOKUP(RC[-3],Sheet1!R2C8:R6C9,2,FALSE),RC[-3])&VLOOKUP(RC[-7],Sheet1!R2C1:R28C4,4,FALSE) -> 战队中全体英雄装备强化到70级 | I712: 7 | J712: =VLOOKUP(RC[-9],Sheet1!R2C1:R28C6,6,FALSE) -> 金币
A713: 17 | B713: btn_equip | C713: 8 | D713: 1 | E713: 80 | F713: 19003 | G713: 300000 | H713: =VLOOKUP(RC[-7],Sheet1!R2C1:R28C4,2,FALSE)&VLOOKUP(RC[-7],Sheet1!R2C1:R28C4,3,FALSE)&IF(VLOOKUP(RC[-7],Sheet1!R2C1:R28C4,4,FALSE)="品",VLOOKUP(RC[-3],Sheet1!R2C8:R6C9,2,FALSE),RC[-3])&VLOOKUP(RC[-7],Sheet1!R2C1:R28C4,4,FALSE) -> 战队中全体英雄装备强化到80级 | I713: 7 | J713: =VLOOKUP(RC[-9],Sheet1!R2C1:R28C6,6,FALSE) -> 金币
A714: 17 | B714: btn_equip | C714: 9 | D714: 1 | E714: 90 | F714: 19003 | G714: 500000 | H714: =VLOOKUP(RC[-7],Sheet1!R2C1:R28C4,2,FALSE)&VLOOKUP(RC[-7],Sheet1!R2C1:R28C4,3,FALSE)&IF(VLOOKUP(RC[-7],Sheet1!R2C1:R28C4,4,FALSE)="品",VLOOKUP(RC[-3],Sheet1!R2C8:R6C9,2,FALSE),RC[-3])&VLOOKUP(RC[-7],Sheet1!R2C1:R28C4,4,FALSE) -> 战队中全体英雄装备强化到90级 | I714: 7 | J714: =VLOOKUP(RC[-9],Sheet1!R2C1:R28C6,6,FALSE) -> 金币
A715: 17 | B715: btn_equip | C715: 10 | D715: 1 | E715: 100 | F715: 19003 | G715: 500000 | H715: =VLOOKUP(RC[-7],Sheet1!R2C1:R28C4,2,FALSE)&VLOOKUP(RC[-7],Sheet1!R2C1:R28C4,3,FALSE)&IF(VLOOKUP(RC[-7],Sheet1!R2C1:R28C4,4,FALSE)="品",VLOOKUP(RC[-3],Sheet1!R2C8:R6C9,2,FALSE),RC[-3])&VLOOKUP(RC[-7],Sheet1!R2C1:R28C4,4,FALSE) -> 战队中全体英雄装备强化到100级 | I715: 7 | J715: =VLOOKUP(RC[-9],Sheet1!R2C1:R28C6,6,FALSE) -> 金币
A716: 17 | B716: btn_equip | C716: 11 | D716: 1 | E716: 110 | F716: 19003 | G716: 750000 | H716: =VLOOKUP(RC[-7],Sheet1!R2C1:R28C4,2,FALSE)&VLOOKUP(RC[-7],Sheet1!R2C1:R28C4,3,FALSE)&IF(VLOOKUP(RC[-7],Sheet1!R2C1:R28C4,4,FALSE)="品",VLOOKUP(RC[-3],Sheet1!R2C8:R6C9,2,FALSE),RC[-3])&VLOOKUP(RC[-7],Sheet1!R2C1:R28C4,4,FALSE) -> 战队中全体英雄装备强化到110级 | I716: 7 | J716: =VLOOKUP(RC[-9],Sheet1!R2C1:R28C6,6,FALSE) -> 金币
A717: 17 | B717: btn_equip | C717: 12 | D717: 1 | E717: 120 | F717: 19003 | G717: 750000 | H717: =VLOOKUP(RC[-7],Sheet1!R2C1:R28C4,2,FALSE)&VLOOKUP(RC[-7],Sheet1!R2C1:R28C4,3,FALSE)&IF(VLOOKUP(RC[-7],Sheet1!R2C1:R28C4,4,FALSE)="品",VLOOKUP(RC[-3],Sheet1!R2C8:R6C9,2,FALSE),RC[-3])&VLOOKUP(RC[-7],Sheet1!R2C1:R28C4,4,FALSE) -> 战队中全体英雄装备强化到120级 | I717: 7 | J717: =VLOOKUP(RC[-9],Sheet1!R2C1:R28C6,6,FALSE) -> 金币
A718: 17 | B718: btn_equip | C718: 13 | D718: 1 | E718: 130 | F718: 19003 | G718: 750000 | H718: =VLOOKUP(RC[-7],Sheet1!R2C1:R28C4,2,FALSE)&VLOOKUP(RC[-7],Sheet1!R2C1:R28C4,3,FALSE)&IF(VLOOKUP(RC[-7],Sheet1!R2C1:R28C4,4,FALSE)="品",VLOOKUP(RC[-3],Sheet1!R2C8:R6C9,2,FALSE),RC[-3])&VLOOKUP(RC[-7],Sheet1!R2C1:R28C4,4,FALSE) -> 战队中全体英雄装备强化到130级 | I718: 7 | J718: =VLOOKUP(RC[-9],Sheet1!R2C1:R28C6,6,FALSE) -> 金币
A719: 17 | B719: btn_equip | C719: 14 | D719: 1 | E719: 140 | F719: 19003 | G719: 750000 | H719: =VLOOKUP(RC[-7],Sheet1!R2C1:R28C4,2,FALSE)&VLOOKUP(RC[-7],Sheet1!R2C1:R28C4,3,FALSE)&IF(VLOOKUP(RC[-7],Sheet1!R2C1:R28C4,4,FALSE)="品",VLOOKUP(RC[-3],Sheet1!R2C8:R6C9,2,FALSE),RC[-3])&VLOOKUP(RC[-7],Sheet1!R2C1:R28C4,4,FALSE) -> 战队中全体英雄装备强化到140级 | I719: 7 | J719: =VLOOKUP(RC[-9],Sheet1!R2C1:R28C6,6,FALSE) -> 金币
A720: 17 | B720: btn_equip | C720: 15 | D720: 1 | E720: 150 | F720: 19003 | G720: 750000 | H720: =VLOOKUP(RC[-7],Sheet1!R2C1:R28C4,2,FALSE)&VLOOKUP(RC[-7],Sheet1!R2C1:R28C4,3,FALSE)&IF(VLOOKUP(RC[-7],Sheet1!R2C1:R28C4,4,FALSE)="品",VLOOKUP(RC[-3],Sheet1!R2C8:R6C9,2,FALSE),RC[-3])&VLOOKUP(RC[-7],Sheet1!R2C1:R28C4,4,FALSE) -> 战队中全体英雄装备强化到150级 | I720: 7 | J720: =VLOOKUP(RC[-9],Sheet1!R2C1:R28C6,6,FALSE) -> 金币
A721: 17 | B721: btn_equip | C721: 16 | D721: 1 | E721: 160 | F721: 19003 | G721: 1000000 | H721: =VLOOKUP(RC[-7],Sheet1!R2C1:R28C4,2,FALSE)&VLOOKUP(RC[-7],Sheet1!R2C1:R28C4,3,FALSE)&IF(VLOOKUP(RC[-7],Sheet1!R2C1:R28C4,4,FALSE)="品",VLOOKUP(RC[-3],Sheet1!R2C8:R6C9,2,FALSE),RC[-3])&VLOOKUP(RC[-7],Sheet1!R2C1:R28C4,4,FALSE) -> 战队中全体英雄装备强化到160级 | I721: 7 | J721: =VLOOKUP(RC[-9],Sheet1!R2C1:R28C6,6,FALSE) -> 金币
A722: 17 | B722: btn_equip | C722: 17 | D722: 1 | E722: 170 | F722: 19003 | G722: 1000000 | H722: =VLOOKUP(RC[-7],Sheet1!R2C1:R28C4,2,FALSE)&VLOOKUP(RC[-7],Sheet1!R2C1:R28C4,3,FALSE)&IF(VLOOKUP(RC[-7],Sheet1!R2C1:R28C4,4,FALSE)="品",VLOOKUP(RC[-3],Sheet1!R2C8:R6C9,2,FALSE),RC[-3])&VLOOKUP(RC[-7],Sheet1!R2C1:R28C4,4,FALSE) -> 战队中全体英雄装备强化到170级 | I722: 7 | J722: =VLOOKUP(RC[-9],Sheet1!R2C1:R28C6,6,FALSE) -> 金币
A723: 17 | B723: btn_equip | C723: 18 | D723: 1 | E723: 180 | F723: 19003 | G723: 1000000 | H723: =VLOOKUP(RC[-7],Sheet1!R2C1:R28C4,2,FALSE)&VLOOKUP(RC[-7],Sheet1!R2C1:R28C4,3,FALSE)&IF(VLOOKUP(RC[-7],Sheet1!R2C1:R28C4,4,FALSE)="品",VLOOKUP(RC[-3],Sheet1!R2C8:R6C9,2,FALSE),RC[-3])&VLOOKUP(RC[-7],Sheet1!R2C1:R28C4,4,FALSE) -> 战队中全体英雄装备强化到180级 | I723: 7 | J723: =VLOOKUP(RC[-9],Sheet1!R2C1:R28C6,6,FALSE) -> 金币
A724: 17 | B724: btn_equip | C724: 19 | D724: 1 | E724: 190 | F724: 19003 | G724: 1000000 | H724: =VLOOKUP(RC[-7],Sheet1!R2C1:R28C4,2,FALSE)&VLOOKUP(RC[-7],Sheet1!R2C1:R28C4,3,FALSE)&IF(VLOOKUP(RC[-7],Sheet1!R2C1:R28C4,4,FALSE)="品",VLOOKUP(RC[-3],Sheet1!R2C8:R6C9,2,FALSE),RC[-3])&VLOOKUP(RC[-7],Sheet1!R2C1:R28C4,4,FALSE) -> 战队中全体英雄装备强化到190级 | I724: 7 | J724: =VLOOKUP(RC[-9],Sheet1!R2C1:R28C6,6,FALSE) -> 金币
A725: 17 | B725: btn_equip | C725: 20 | D725: 1 | E725: 200 | F725: 19003 | G725: 1000000 | H725: =VLOOKUP(RC[-7],Sheet1!R2C1:R28C4,2,FALSE)&VLOOKUP(RC[-7],Sheet1!R2C1:R28C4,3,FALSE)&IF(VLOOKUP(RC[-7],Sheet1!R2C1:R28C4,4,FALSE)="品",VLOOKUP(RC[-3],Sheet1!R2C8:R6C9,2,FALSE),RC[-3])&VLOOKUP(RC[-7],Sheet1!R2C1:R28C4,4,FALSE) -> 战队中全体英雄装备强化到200级 | I725: 7 | J725: =VLOOKUP(RC[-9],Sheet1!R2C1:R28C6,6,FALSE) -> 金币
A726: 17 | B726: btn_equip | C726: 21 | D726: 1 | E726: 210 | F726: 19003 | G726: 1500000 | H726: =VLOOKUP(RC[-7],Sheet1!R2C1:R28C4,2,FALSE)&VLOOKUP(RC[-7],Sheet1!R2C1:R28C4,3,FALSE)&IF(VLOOKUP(RC[-7],Sheet1!R2C1:R28C4,4,FALSE)="品",VLOOKUP(RC[-3],Sheet1!R2C8:R6C9,2,FALSE),RC[-3])&VLOOKUP(RC[-7],Sheet1!R2C1:R28C4,4,FALSE) -> 战队中全体英雄装备强化到210级 | I726: 7 | J726: =VLOOKUP(RC[-9],Sheet1!R2C1:R28C6,6,FALSE) -> 金币
A727: 17 | B727: btn_equip | C727: 22 | D727: 1 | E727: 220 | F727: 19003 | G727: 1500000 | H727: =VLOOKUP(RC[-7],Sheet1!R2C1:R28C4,2,FALSE)&VLOOKUP(RC[-7],Sheet1!R2C1:R28C4,3,FALSE)&IF(VLOOKUP(RC[-7],Sheet1!R2C1:R28C4,4,FALSE)="品",VLOOKUP(RC[-3],Sheet1!R2C8:R6C9,2,FALSE),RC[-3])&VLOOKUP(RC[-7],Sheet1!R2C1:R28C4,4,FALSE) -> 战队中全体英雄装备强化到220级 | I727: 7 | J727: =VLOOKUP(RC[-9],Sheet1!R2C1:R28C6,6,FALSE) -> 金币
A728: 17 | B728: btn_equip | C728: 23 | D728: 1 | E728: 230 | F728: 19003 | G728: 1500000 | H728: =VLOOKUP(RC[-7],Sheet1!R2C1:R28C4,2,FALSE)&VLOOKUP(RC[-7],Sheet1!R2C1:R28C4,3,FALSE)&IF(VLOOKUP(RC[-7],Sheet1!R2C1:R28C4,4,FALSE)="品",VLOOKUP(RC[-3],Sheet1!R2C8:R6C9,2,FALSE),RC[-3])&VLOOKUP(RC[-7],Sheet1!R2C1:R28C4,4,FALSE) -> 战队中全体英雄装备强化到230级 | I728: 7 | J728: =VLOOKUP(RC[-9],Sheet1!R2C1:R28C6,6,FALSE) -> 金币
A729: 17 | B729: btn_equip | C729: 24 | D729: 1 | E729: 240 | F729: 19003 | G729: 1500000 | H729: =VLOOKUP(RC[-7],Sheet1!R2C1:R28C4,2,FALSE)&VLOOKUP(RC[-7],Sheet1!R2C1:R28C4,3,FALSE)&IF(VLOOKUP(RC[-7],Sheet1!R2C1:R28C4,4,FALSE)="品",VLOOKUP(RC[-3],Sheet1!R2C8:R6C9,2,FALSE),RC[-3])&VLOOKUP(RC[-7],Sheet1!R2C1:R28C4,4,FALSE) -> 战队中全体英雄装备强化到240级 | I729: 7 | J729: =VLOOKUP(RC[-9],Sheet1!R2C1:R28C6,6,FALSE) -> 金币
A730: 17 | B730: btn_equip | C730: 25 | D730: 1 | E730: 250 | F730: 19003 | G730: 1500000 | H730: =VLOOKUP(RC[-7],Sheet1!R2C1:R28C4,2,FALSE)&VLOOKUP(RC[-7],Sheet1!R2C1:R28C4,3,FALSE)&IF(VLOOKUP(RC[-7],Sheet1!R2C1:R28C4,4,FALSE)="品",VLOOKUP(RC[-3],Sheet1!R2C8:R6C9,2,FALSE),RC[-3])&VLOOKUP(RC[-7],Sheet1!R2C1:R28C4,4,FALSE) -> 战队中全体英雄装备强化到250级 | I730: 7 | J730: =VLOOKUP(RC[-9],Sheet1!R2C1:R28C6,6,FALSE) -> 金币
A731: 17 | B731: btn_equip | C731: 26 | D731: 1 | E731: 260 | F731: 19003 | G731: 2000000 | H731: =VLOOKUP(RC[-7],Sheet1!R2C1:R28C4,2,FALSE)&VLOOKUP(RC[-7],Sheet1!R2C1:R28C4,3,FALSE)&IF(VLOOKUP(RC[-7],Sheet1!R2C1:R28C4,4,FALSE)="品",VLOOKUP(RC[-3],Sheet1!R2C8:R6C9,2,FALSE),RC[-3])&VLOOKUP(RC[-7],Sheet1!R2C1:R28C4,4,FALSE) -> 战队中全体英雄装备强化到260级 | I731: 7 | J731: =VLOOKUP(RC[-9],Sheet1!R2C1:R28C6,6,FALSE) -> 金币
A732: 17 | B732: btn_equip | C732: 27 | D732: 1 | E732: 270 | F732: 19003 | G732: 2000000 | H732: =VLOOKUP(RC[-7],Sheet1!R2C1:R28C4,2,FALSE)&VLOOKUP(RC[-7],Sheet1!R2C1:R28C4,3,FALSE)&IF(VLOOKUP(RC[-7],Sheet1!R2C1:R28C4,4,FALSE)="品",VLOOKUP(RC[-3],Sheet1!R2C8:R6C9,2,FALSE),RC[-3])&VLOOKUP(RC[-7],Sheet1!R2C1:R28C4,4,FALSE) -> 战队中全体英雄装备强化到270级 | I732: 7 | J732: =VLOOKUP(RC[-9],Sheet1!R2C1:R28C6,6,FALSE) -> 金币
A733: 17 | B733: btn_equip | C733: 28 | D733: 1 | E733: 280 | F733: 19003 | G733: 2000000 | H733: =VLOOKUP(RC[-7],Sheet1!R2C1:R28C4,2,FALSE)&VLOOKUP(RC[-7],Sheet1!R2C1:R28C4,3,FALSE)&IF(VLOOKUP(RC[-7],Sheet1!R2C1:R28C4,4,FALSE)="品",VLOOKUP(RC[-3],Sheet1!R2C8:R6C9,2,FALSE),RC[-3])&VLOOKUP(RC[-7],Sheet1!R2C1:R28C4,4,FALSE) -> 战队中全体英雄装备强化到280级 | I733: 7 | J733: =VLOOKUP(RC[-9],Sheet1!R2C1:R28C6,6,FALSE) -> 金币
A734: 17 | B734: btn_equip | C734: 29 | D734: 1 | E734: 290 | F734: 19003 | G734: 2000000 | H734: =VLOOKUP(RC[-7],Sheet1!R2C1:R28C4,2,FALSE)&VLOOKUP(RC[-7],Sheet1!R2C1:R28C4,3,FALSE)&IF(VLOOKUP(RC[-7],Sheet1!R2C1:R28C4,4,FALSE)="品",VLOOKUP(RC[-3],Sheet1!R2C8:R6C9,2,FALSE),RC[-3])&VLOOKUP(RC[-7],Sheet1!R2C1:R28C4,4,FALSE) -> 战队中全体英雄装备强化到290级 | I734: 7 | J734: =VLOOKUP(RC[-9],Sheet1!R2C1:R28C6,6,FALSE) -> 金币
A735: 17 | B735: btn_equip | C735: 30 | D735: 1 | E735: 300 | F735: 19003 | G735: 2000000 | H735: =VLOOKUP(RC[-7],Sheet1!R2C1:R28C4,2,FALSE)&VLOOKUP(RC[-7],Sheet1!R2C1:R28C4,3,FALSE)&IF(VLOOKUP(RC[-7],Sheet1!R2C1:R28C4,4,FALSE)="品",VLOOKUP(RC[-3],Sheet1!R2C8:R6C9,2,FALSE),RC[-3])&VLOOKUP(RC[-7],Sheet1!R2C1:R28C4,4,FALSE) -> 战队中全体英雄装备强化到300级 | I735: 7 | J735: =VLOOKUP(RC[-9],Sheet1!R2C1:R28C6,6,FALSE) -> 金币
A736: 18 | B736: btn_equip | C736: 1 | D736: 1 | E736: 1 | F736: 19003 | G736: 50000 | H736: =VLOOKUP(RC[-7],Sheet1!R2C1:R28C4,2,FALSE)&VLOOKUP(RC[-7],Sheet1!R2C1:R28C4,3,FALSE)&IF(VLOOKUP(RC[-7],Sheet1!R2C1:R28C4,4,FALSE)="品",VLOOKUP(RC[-3],Sheet1!R2C8:R6C9,2,FALSE),RC[-3])&VLOOKUP(RC[-7],Sheet1!R2C1:R28C4,4,FALSE) -> 战队中全体英雄装备品质达到绿品 | I736: 7 | J736: =VLOOKUP(RC[-9],Sheet1!R2C1:R28C6,6,FALSE) -> 精炼石 | K736: =VLOOKUP(INT(MOD(RC[-5],10)/1),R736C12:R739C13,2,FALSE)*RC[-4] -> 1250000 | L736: 1 | M736: 5
A737: 18 | B737: btn_equip | C737: 2 | D737: 1 | E737: 2 | F737: 19003 | G737: 100000 | H737: =VLOOKUP(RC[-7],Sheet1!R2C1:R28C4,2,FALSE)&VLOOKUP(RC[-7],Sheet1!R2C1:R28C4,3,FALSE)&IF(VLOOKUP(RC[-7],Sheet1!R2C1:R28C4,4,FALSE)="品",VLOOKUP(RC[-3],Sheet1!R2C8:R6C9,2,FALSE),RC[-3])&VLOOKUP(RC[-7],Sheet1!R2C1:R28C4,4,FALSE) -> 战队中全体英雄装备品质达到蓝品 | I737: 7 | J737: =VLOOKUP(RC[-9],Sheet1!R2C1:R28C6,6,FALSE) -> 精炼石 | K737: =VLOOKUP(INT(MOD(RC[-5],10)/1),R736C12:R739C13,2,FALSE)*RC[-4] -> 2500000 | L737: 2 | M737: 10
A738: 18 | B738: btn_equip | C738: 3 | D738: 1 | E738: 3 | F738: 19003 | G738: 200000 | H738: =VLOOKUP(RC[-7],Sheet1!R2C1:R28C4,2,FALSE)&VLOOKUP(RC[-7],Sheet1!R2C1:R28C4,3,FALSE)&IF(VLOOKUP(RC[-7],Sheet1!R2C1:R28C4,4,FALSE)="品",VLOOKUP(RC[-3],Sheet1!R2C8:R6C9,2,FALSE),RC[-3])&VLOOKUP(RC[-7],Sheet1!R2C1:R28C4,4,FALSE) -> 战队中全体英雄装备品质达到紫品 | I738: 7 | J738: =VLOOKUP(RC[-9],Sheet1!R2C1:R28C6,6,FALSE) -> 精炼石 | K738: =VLOOKUP(INT(MOD(RC[-5],10)/1),R736C12:R739C13,2,FALSE)*RC[-4] -> 5000000 | L738: 3 | M738: 25
A739: 18 | B739: btn_equip | C739: 4 | D739: 1 | E739: 4 | F739: 19003 | G739: 500000 | H739: =VLOOKUP(RC[-7],Sheet1!R2C1:R28C4,2,FALSE)&VLOOKUP(RC[-7],Sheet1!R2C1:R28C4,3,FALSE)&IF(VLOOKUP(RC[-7],Sheet1!R2C1:R28C4,4,FALSE)="品",VLOOKUP(RC[-3],Sheet1!R2C8:R6C9,2,FALSE),RC[-3])&VLOOKUP(RC[-7],Sheet1!R2C1:R28C4,4,FALSE) -> 战队中全体英雄装备品质达到橙品 | I739: 7 | J739: =VLOOKUP(RC[-9],Sheet1!R2C1:R28C6,6,FALSE) -> 精炼石 | K739: =VLOOKUP(INT(MOD(RC[-5],10)/1),R736C12:R739C13,2,FALSE)*RC[-4] -> 12500000 | L739: 4 | M739: 50
A740: 18 | B740: btn_equip | C740: 5 | D740: 1 | E740: 5 | F740: 19003 | G740: 1000000 | H740: =VLOOKUP(RC[-7],Sheet1!R2C1:R28C4,2,FALSE)&VLOOKUP(RC[-7],Sheet1!R2C1:R28C4,3,FALSE)&IF(VLOOKUP(RC[-7],Sheet1!R2C1:R28C4,4,FALSE)="品",VLOOKUP(RC[-3],Sheet1!R2C8:R6C9,2,FALSE),RC[-3])&VLOOKUP(RC[-7],Sheet1!R2C1:R28C4,4,FALSE) -> 战队中全体英雄装备品质达到红品 | I740: 7 | J740: =VLOOKUP(RC[-9],Sheet1!R2C1:R28C6,6,FALSE) -> 精炼石 | K740: =VLOOKUP(INT(MOD(RC[-5],10)/1),R736C12:R739C13,2,FALSE)*RC[-4] -> 25000000
A741: 19 | B741: btn_treasure | C741: 1 | D741: 1 | E741: 5 | F741: 42201 | G741: 5 | H741: =VLOOKUP(RC[-7],Sheet1!R2C1:R28C4,2,FALSE)&VLOOKUP(RC[-7],Sheet1!R2C1:R28C4,3,FALSE)&IF(VLOOKUP(RC[-7],Sheet1!R2C1:R28C4,4,FALSE)="品",VLOOKUP(RC[-3],Sheet1!R2C8:R6C9,2,FALSE),RC[-3])&VLOOKUP(RC[-7],Sheet1!R2C1:R28C4,4,FALSE) -> 战队中全体英雄圣器升级到5级 | I741: 7 | J741: =VLOOKUP(RC[-9],Sheet1!R2C1:R28C6,6,FALSE) -> 水晶 | K741: =VLOOKUP(INT(MOD(RC[-5],1000)/100),R741C12:R742C13,2,FALSE)*RC[-4] -> 12500 | L741: 2 | M741: 2500
A742: 19 | B742: btn_treasure | C742: 2 | D742: 1 | E742: 10 | F742: 42201 | G742: 5 | H742: =VLOOKUP(RC[-7],Sheet1!R2C1:R28C4,2,FALSE)&VLOOKUP(RC[-7],Sheet1!R2C1:R28C4,3,FALSE)&IF(VLOOKUP(RC[-7],Sheet1!R2C1:R28C4,4,FALSE)="品",VLOOKUP(RC[-3],Sheet1!R2C8:R6C9,2,FALSE),RC[-3])&VLOOKUP(RC[-7],Sheet1!R2C1:R28C4,4,FALSE) -> 战队中全体英雄圣器升级到10级 | I742: 7 | J742: =VLOOKUP(RC[-9],Sheet1!R2C1:R28C6,6,FALSE) -> 水晶 | K742: =VLOOKUP(INT(MOD(RC[-5],1000)/100),R741C12:R742C13,2,FALSE)*RC[-4] -> 12500 | L742: 3 | M742: 15000
A743: 19 | B743: btn_treasure | C743: 3 | D743: 1 | E743: 15 | F743: 42201 | G743: 10 | H743: =VLOOKUP(RC[-7],Sheet1!R2C1:R28C4,2,FALSE)&VLOOKUP(RC[-7],Sheet1!R2C1:R28C4,3,FALSE)&IF(VLOOKUP(RC[-7],Sheet1!R2C1:R28C4,4,FALSE)="品",VLOOKUP(RC[-3],Sheet1!R2C8:R6C9,2,FALSE),RC[-3])&VLOOKUP(RC[-7],Sheet1!R2C1:R28C4,4,FALSE) -> 战队中全体英雄圣器升级到15级 | I743: 7 | J743: =VLOOKUP(RC[-9],Sheet1!R2C1:R28C6,6,FALSE) -> 水晶 | K743: =VLOOKUP(INT(MOD(RC[-5],1000)/100),R741C12:R742C13,2,FALSE)*RC[-4] -> 25000
A744: 19 | B744: btn_treasure | C744: 4 | D744: 1 | E744: 20 | F744: 42201 | G744: 10 | H744: =VLOOKUP(RC[-7],Sheet1!R2C1:R28C4,2,FALSE)&VLOOKUP(RC[-7],Sheet1!R2C1:R28C4,3,FALSE)&IF(VLOOKUP(RC[-7],Sheet1!R2C1:R28C4,4,FALSE)="品",VLOOKUP(RC[-3],Sheet1!R2C8:R6C9,2,FALSE),RC[-3])&VLOOKUP(RC[-7],Sheet1!R2C1:R28C4,4,FALSE) -> 战队中全体英雄圣器升级到20级 | I744: 7 | J744: =VLOOKUP(RC[-9],Sheet1!R2C1:R28C6,6,FALSE) -> 水晶 | K744: =VLOOKUP(INT(MOD(RC[-5],1000)/100),R741C12:R742C13,2,FALSE)*RC[-4] -> 25000
A745: 19 | B745: btn_treasure | C745: 5 | D745: 1 | E745: 25 | F745: 42201 | G745: 15 | H745: =VLOOKUP(RC[-7],Sheet1!R2C1:R28C4,2,FALSE)&VLOOKUP(RC[-7],Sheet1!R2C1:R28C4,3,FALSE)&IF(VLOOKUP(RC[-7],Sheet1!R2C1:R28C4,4,FALSE)="品",VLOOKUP(RC[-3],Sheet1!R2C8:R6C9,2,FALSE),RC[-3])&VLOOKUP(RC[-7],Sheet1!R2C1:R28C4,4,FALSE) -> 战队中全体英雄圣器升级到25级 | I745: 7 | J745: =VLOOKUP(RC[-9],Sheet1!R2C1:R28C6,6,FALSE) -> 水晶 | K745: =VLOOKUP(INT(MOD(RC[-5],1000)/100),R741C12:R742C13,2,FALSE)*RC[-4] -> 37500
A746: 19 | B746: btn_treasure | C746: 6 | D746: 1 | E746: 30 | F746: 42201 | G746: 15 | H746: =VLOOKUP(RC[-7],Sheet1!R2C1:R28C4,2,FALSE)&VLOOKUP(RC[-7],Sheet1!R2C1:R28C4,3,FALSE)&IF(VLOOKUP(RC[-7],Sheet1!R2C1:R28C4,4,FALSE)="品",VLOOKUP(RC[-3],Sheet1!R2C8:R6C9,2,FALSE),RC[-3])&VLOOKUP(RC[-7],Sheet1!R2C1:R28C4,4,FALSE) -> 战队中全体英雄圣器升级到30级 | I746: 7 | J746: =VLOOKUP(RC[-9],Sheet1!R2C1:R28C6,6,FALSE) -> 水晶 | K746: =VLOOKUP(INT(MOD(RC[-5],1000)/100),R741C12:R742C13,2,FALSE)*RC[-4] -> 37500
A747: 19 | B747: btn_treasure | C747: 7 | D747: 1 | E747: 35 | F747: 42201 | G747: 20 | H747: =VLOOKUP(RC[-7],Sheet1!R2C1:R28C4,2,FALSE)&VLOOKUP(RC[-7],Sheet1!R2C1:R28C4,3,FALSE)&IF(VLOOKUP(RC[-7],Sheet1!R2C1:R28C4,4,FALSE)="品",VLOOKUP(RC[-3],Sheet1!R2C8:R6C9,2,FALSE),RC[-3])&VLOOKUP(RC[-7],Sheet1!R2C1:R28C4,4,FALSE) -> 战队中全体英雄圣器升级到35级 | I747: 7 | J747: =VLOOKUP(RC[-9],Sheet1!R2C1:R28C6,6,FALSE) -> 水晶 | K747: =VLOOKUP(INT(MOD(RC[-5],1000)/100),R741C12:R742C13,2,FALSE)*RC[-4] -> 50000
A748: 19 | B748: btn_treasure | C748: 8 | D748: 1 | E748: 40 | F748: 42201 | G748: 20 | H748: =VLOOKUP(RC[-7],Sheet1!R2C1:R28C4,2,FALSE)&VLOOKUP(RC[-7],Sheet1!R2C1:R28C4,3,FALSE)&IF(VLOOKUP(RC[-7],Sheet1!R2C1:R28C4,4,FALSE)="品",VLOOKUP(RC[-3],Sheet1!R2C8:R6C9,2,FALSE),RC[-3])&VLOOKUP(RC[-7],Sheet1!R2C1:R28C4,4,FALSE) -> 战队中全体英雄圣器升级到40级 | I748: 7 | J748: =VLOOKUP(RC[-9],Sheet1!R2C1:R28C6,6,FALSE) -> 水晶 | K748: =VLOOKUP(INT(MOD(RC[-5],1000)/100),R741C12:R742C13,2,FALSE)*RC[-4] -> 50000
A749: 19 | B749: btn_treasure | C749: 9 | D749: 1 | E749: 45 | F749: 42301 | G749: 5 | H749: =VLOOKUP(RC[-7],Sheet1!R2C1:R28C4,2,FALSE)&VLOOKUP(RC[-7],Sheet1!R2C1:R28C4,3,FALSE)&IF(VLOOKUP(RC[-7],Sheet1!R2C1:R28C4,4,FALSE)="品",VLOOKUP(RC[-3],Sheet1!R2C8:R6C9,2,FALSE),RC[-3])&VLOOKUP(RC[-7],Sheet1!R2C1:R28C4,4,FALSE) -> 战队中全体英雄圣器升级到45级 | I749: 7 | J749: =VLOOKUP(RC[-9],Sheet1!R2C1:R28C6,6,FALSE) -> 水晶 | K749: =VLOOKUP(INT(MOD(RC[-5],1000)/100),R741C12:R742C13,2,FALSE)*RC[-4] -> 75000
A750: 19 | B750: btn_treasure | C750: 10 | D750: 1 | E750: 50 | F750: 42301 | G750: 5 | H750: =VLOOKUP(RC[-7],Sheet1!R2C1:R28C4,2,FALSE)&VLOOKUP(RC[-7],Sheet1!R2C1:R28C4,3,FALSE)&IF(VLOOKUP(RC[-7],Sheet1!R2C1:R28C4,4,FALSE)="品",VLOOKUP(RC[-3],Sheet1!R2C8:R6C9,2,FALSE),RC[-3])&VLOOKUP(RC[-7],Sheet1!R2C1:R28C4,4,FALSE) -> 战队中全体英雄圣器升级到50级 | I750: 7 | J750: =VLOOKUP(RC[-9],Sheet1!R2C1:R28C6,6,FALSE) -> 水晶 | K750: =VLOOKUP(INT(MOD(RC[-5],1000)/100),R741C12:R742C13,2,FALSE)*RC[-4] -> 75000
A751: 19 | B751: btn_treasure | C751: 11 | D751: 1 | E751: 55 | F751: 42301 | G751: 10 | H751: =VLOOKUP(RC[-7],Sheet1!R2C1:R28C4,2,FALSE)&VLOOKUP(RC[-7],Sheet1!R2C1:R28C4,3,FALSE)&IF(VLOOKUP(RC[-7],Sheet1!R2C1:R28C4,4,FALSE)="品",VLOOKUP(RC[-3],Sheet1!R2C8:R6C9,2,FALSE),RC[-3])&VLOOKUP(RC[-7],Sheet1!R2C1:R28C4,4,FALSE) -> 战队中全体英雄圣器升级到55级 | I751: 7 | J751: =VLOOKUP(RC[-9],Sheet1!R2C1:R28C6,6,FALSE) -> 水晶 | K751: =VLOOKUP(INT(MOD(RC[-5],1000)/100),R741C12:R742C13,2,FALSE)*RC[-4] -> 150000
A752: 19 | B752: btn_treasure | C752: 12 | D752: 1 | E752: 60 | F752: 42301 | G752: 10 | H752: =VLOOKUP(RC[-7],Sheet1!R2C1:R28C4,2,FALSE)&VLOOKUP(RC[-7],Sheet1!R2C1:R28C4,3,FALSE)&IF(VLOOKUP(RC[-7],Sheet1!R2C1:R28C4,4,FALSE)="品",VLOOKUP(RC[-3],Sheet1!R2C8:R6C9,2,FALSE),RC[-3])&VLOOKUP(RC[-7],Sheet1!R2C1:R28C4,4,FALSE) -> 战队中全体英雄圣器升级到60级 | I752: 7 | J752: =VLOOKUP(RC[-9],Sheet1!R2C1:R28C6,6,FALSE) -> 水晶 | K752: =VLOOKUP(INT(MOD(RC[-5],1000)/100),R741C12:R742C13,2,FALSE)*RC[-4] -> 150000
A753: 19 | B753: btn_treasure | C753: 13 | D753: 1 | E753: 65 | F753: 42301 | G753: 15 | H753: =VLOOKUP(RC[-7],Sheet1!R2C1:R28C4,2,FALSE)&VLOOKUP(RC[-7],Sheet1!R2C1:R28C4,3,FALSE)&IF(VLOOKUP(RC[-7],Sheet1!R2C1:R28C4,4,FALSE)="品",VLOOKUP(RC[-3],Sheet1!R2C8:R6C9,2,FALSE),RC[-3])&VLOOKUP(RC[-7],Sheet1!R2C1:R28C4,4,FALSE) -> 战队中全体英雄圣器升级到65级 | I753: 7 | J753: =VLOOKUP(RC[-9],Sheet1!R2C1:R28C6,6,FALSE) -> 水晶 | K753: =VLOOKUP(INT(MOD(RC[-5],1000)/100),R741C12:R742C13,2,FALSE)*RC[-4] -> 225000
A754: 19 | B754: btn_treasure | C754: 14 | D754: 1 | E754: 70 | F754: 42301 | G754: 15 | H754: =VLOOKUP(RC[-7],Sheet1!R2C1:R28C4,2,FALSE)&VLOOKUP(RC[-7],Sheet1!R2C1:R28C4,3,FALSE)&IF(VLOOKUP(RC[-7],Sheet1!R2C1:R28C4,4,FALSE)="品",VLOOKUP(RC[-3],Sheet1!R2C8:R6C9,2,FALSE),RC[-3])&VLOOKUP(RC[-7],Sheet1!R2C1:R28C4,4,FALSE) -> 战队中全体英雄圣器升级到70级 | I754: 7 | J754: =VLOOKUP(RC[-9],Sheet1!R2C1:R28C6,6,FALSE) -> 水晶 | K754: =VLOOKUP(INT(MOD(RC[-5],1000)/100),R741C12:R742C13,2,FALSE)*RC[-4] -> 225000
A755: 19 | B755: btn_treasure | C755: 15 | D755: 1 | E755: 75 | F755: 42301 | G755: 20 | H755: =VLOOKUP(RC[-7],Sheet1!R2C1:R28C4,2,FALSE)&VLOOKUP(RC[-7],Sheet1!R2C1:R28C4,3,FALSE)&IF(VLOOKUP(RC[-7],Sheet1!R2C1:R28C4,4,FALSE)="品",VLOOKUP(RC[-3],Sheet1!R2C8:R6C9,2,FALSE),RC[-3])&VLOOKUP(RC[-7],Sheet1!R2C1:R28C4,4,FALSE) -> 战队中全体英雄圣器升级到75级 | I755: 7 | J755: =VLOOKUP(RC[-9],Sheet1!R2C1:R28C6,6,FALSE) -> 水晶 | K755: =VLOOKUP(INT(MOD(RC[-5],1000)/100),R741C12:R742C13,2,FALSE)*RC[-4] -> 300000
A756: 19 | B756: btn_treasure | C756: 16 | D756: 1 | E756: 80 | F756: 42301 | G756: 20 | H756: =VLOOKUP(RC[-7],Sheet1!R2C1:R28C4,2,FALSE)&VLOOKUP(RC[-7],Sheet1!R2C1:R28C4,3,FALSE)&IF(VLOOKUP(RC[-7],Sheet1!R2C1:R28C4,4,FALSE)="品",VLOOKUP(RC[-3],Sheet1!R2C8:R6C9,2,FALSE),RC[-3])&VLOOKUP(RC[-7],Sheet1!R2C1:R28C4,4,FALSE) -> 战队中全体英雄圣器升级到80级 | I756: 7 | J756: =VLOOKUP(RC[-9],Sheet1!R2C1:R28C6,6,FALSE) -> 水晶 | K756: =VLOOKUP(INT(MOD(RC[-5],1000)/100),R741C12:R742C13,2,FALSE)*RC[-4] -> 300000
A757: 20 | B757: btn_treasure | C757: 1 | D757: 1 | E757: 2 | F757: 10010 | G757: 100 | H757: =VLOOKUP(RC[-7],Sheet1!R2C1:R28C4,2,FALSE)&VLOOKUP(RC[-7],Sheet1!R2C1:R28C4,3,FALSE)&IF(VLOOKUP(RC[-7],Sheet1!R2C1:R28C4,4,FALSE)="品",VLOOKUP(RC[-3],Sheet1!R2C8:R6C9,2,FALSE),RC[-3])&VLOOKUP(RC[-7],Sheet1!R2C1:R28C4,4,FALSE) -> 战队中全体英雄圣器品质达到蓝品 | I757: 7 | J757: =VLOOKUP(RC[-9],Sheet1!R2C1:R28C6,6,FALSE) -> 圣器精炼石
A758: 20 | B758: btn_treasure | C758: 2 | D758: 1 | E758: 3 | F758: 10010 | G758: 200 | H758: =VLOOKUP(RC[-7],Sheet1!R2C1:R28C4,2,FALSE)&VLOOKUP(RC[-7],Sheet1!R2C1:R28C4,3,FALSE)&IF(VLOOKUP(RC[-7],Sheet1!R2C1:R28C4,4,FALSE)="品",VLOOKUP(RC[-3],Sheet1!R2C8:R6C9,2,FALSE),RC[-3])&VLOOKUP(RC[-7],Sheet1!R2C1:R28C4,4,FALSE) -> 战队中全体英雄圣器品质达到紫品 | I758: 7 | J758: =VLOOKUP(RC[-9],Sheet1!R2C1:R28C6,6,FALSE) -> 圣器精炼石
A759: 20 | B759: btn_treasure | C759: 3 | D759: 1 | E759: 4 | F759: 10010 | G759: 400 | H759: =VLOOKUP(RC[-7],Sheet1!R2C1:R28C4,2,FALSE)&VLOOKUP(RC[-7],Sheet1!R2C1:R28C4,3,FALSE)&IF(VLOOKUP(RC[-7],Sheet1!R2C1:R28C4,4,FALSE)="品",VLOOKUP(RC[-3],Sheet1!R2C8:R6C9,2,FALSE),RC[-3])&VLOOKUP(RC[-7],Sheet1!R2C1:R28C4,4,FALSE) -> 战队中全体英雄圣器品质达到橙品 | I759: 7 | J759: =VLOOKUP(RC[-9],Sheet1!R2C1:R28C6,6,FALSE) -> 圣器精炼石
A760: 20 | B760: btn_treasure | C760: 4 | D760: 1 | E760: 5 | F760: 10010 | G760: 800 | H760: =VLOOKUP(RC[-7],Sheet1!R2C1:R28C4,2,FALSE)&VLOOKUP(RC[-7],Sheet1!R2C1:R28C4,3,FALSE)&IF(VLOOKUP(RC[-7],Sheet1!R2C1:R28C4,4,FALSE)="品",VLOOKUP(RC[-3],Sheet1!R2C8:R6C9,2,FALSE),RC[-3])&VLOOKUP(RC[-7],Sheet1!R2C1:R28C4,4,FALSE) -> 战队中全体英雄圣器品质达到红品 | I760: 7 | J760: =VLOOKUP(RC[-9],Sheet1!R2C1:R28C6,6,FALSE) -> 圣器精炼石
A761: 21 | B761: btn_hero | C761: 1 | D761: 1 | E761: 3 | F761: 19003 | G761: 50000 | H761: =VLOOKUP(RC[-7],Sheet1!R2C1:R28C4,2,FALSE)&VLOOKUP(RC[-7],Sheet1!R2C1:R28C4,3,FALSE)&IF(VLOOKUP(RC[-7],Sheet1!R2C1:R28C4,4,FALSE)="品",VLOOKUP(RC[-3],Sheet1!R2C8:R6C9,2,FALSE),RC[-3])&VLOOKUP(RC[-7],Sheet1!R2C1:R28C4,4,FALSE) -> 上阵英雄数量达到3个 | I761: 8 | J761: =VLOOKUP(RC[-9],Sheet1!R2C1:R28C6,6,FALSE) -> 金币
A762: 21 | B762: btn_hero | C762: 2 | D762: 1 | E762: 4 | F762: 19003 | G762: 100000 | H762: =VLOOKUP(RC[-7],Sheet1!R2C1:R28C4,2,FALSE)&VLOOKUP(RC[-7],Sheet1!R2C1:R28C4,3,FALSE)&IF(VLOOKUP(RC[-7],Sheet1!R2C1:R28C4,4,FALSE)="品",VLOOKUP(RC[-3],Sheet1!R2C8:R6C9,2,FALSE),RC[-3])&VLOOKUP(RC[-7],Sheet1!R2C1:R28C4,4,FALSE) -> 上阵英雄数量达到4个 | I762: 8 | J762: =VLOOKUP(RC[-9],Sheet1!R2C1:R28C6,6,FALSE) -> 金币
A763: 21 | B763: btn_hero | C763: 3 | D763: 1 | E763: 5 | F763: 19003 | G763: 500000 | H763: =VLOOKUP(RC[-7],Sheet1!R2C1:R28C4,2,FALSE)&VLOOKUP(RC[-7],Sheet1!R2C1:R28C4,3,FALSE)&IF(VLOOKUP(RC[-7],Sheet1!R2C1:R28C4,4,FALSE)="品",VLOOKUP(RC[-3],Sheet1!R2C8:R6C9,2,FALSE),RC[-3])&VLOOKUP(RC[-7],Sheet1!R2C1:R28C4,4,FALSE) -> 上阵英雄数量达到5个 | I763: 8 | J763: =VLOOKUP(RC[-9],Sheet1!R2C1:R28C6,6,FALSE) -> 金币
A764: 22 | B764: btn_dungeon | C764: 1 | D764: 1 | E764: 10 | F764: 10000 | G764: 1 | H764: =VLOOKUP(RC[-7],Sheet1!R2C1:R28C4,2,FALSE)&VLOOKUP(RC[-7],Sheet1!R2C1:R28C4,3,FALSE)&IF(VLOOKUP(RC[-7],Sheet1!R2C1:R28C4,4,FALSE)="品",VLOOKUP(RC[-3],Sheet1!R2C8:R6C9,2,FALSE),RC[-3])&VLOOKUP(RC[-7],Sheet1!R2C1:R28C4,4,FALSE) -> 累计击杀精英副本外敌10个 | I764: 28 | J764: =VLOOKUP(RC[-9],Sheet1!R2C1:R28C6,6,FALSE) -> 觉醒丹
A765: 22 | B765: btn_dungeon | C765: 2 | D765: 1 | E765: 20 | F765: 10000 | G765: 1 | H765: =VLOOKUP(RC[-7],Sheet1!R2C1:R28C4,2,FALSE)&VLOOKUP(RC[-7],Sheet1!R2C1:R28C4,3,FALSE)&IF(VLOOKUP(RC[-7],Sheet1!R2C1:R28C4,4,FALSE)="品",VLOOKUP(RC[-3],Sheet1!R2C8:R6C9,2,FALSE),RC[-3])&VLOOKUP(RC[-7],Sheet1!R2C1:R28C4,4,FALSE) -> 累计击杀精英副本外敌20个 | I765: 28 | J765: =VLOOKUP(RC[-9],Sheet1!R2C1:R28C6,6,FALSE) -> 觉醒丹
A766: 22 | B766: btn_dungeon | C766: 3 | D766: 1 | E766: 50 | F766: 10000 | G766: 2 | H766: =VLOOKUP(RC[-7],Sheet1!R2C1:R28C4,2,FALSE)&VLOOKUP(RC[-7],Sheet1!R2C1:R28C4,3,FALSE)&IF(VLOOKUP(RC[-7],Sheet1!R2C1:R28C4,4,FALSE)="品",VLOOKUP(RC[-3],Sheet1!R2C8:R6C9,2,FALSE),RC[-3])&VLOOKUP(RC[-7],Sheet1!R2C1:R28C4,4,FALSE) -> 累计击杀精英副本外敌50个 | I766: 28 | J766: =VLOOKUP(RC[-9],Sheet1!R2C1:R28C6,6,FALSE) -> 觉醒丹
A767: 22 | B767: btn_dungeon | C767: 4 | D767: 1 | E767: 100 | F767: 10000 | G767: 2 | H767: =VLOOKUP(RC[-7],Sheet1!R2C1:R28C4,2,FALSE)&VLOOKUP(RC[-7],Sheet1!R2C1:R28C4,3,FALSE)&IF(VLOOKUP(RC[-7],Sheet1!R2C1:R28C4,4,FALSE)="品",VLOOKUP(RC[-3],Sheet1!R2C8:R6C9,2,FALSE),RC[-3])&VLOOKUP(RC[-7],Sheet1!R2C1:R28C4,4,FALSE) -> 累计击杀精英副本外敌100个 | I767: 28 | J767: =VLOOKUP(RC[-9],Sheet1!R2C1:R28C6,6,FALSE) -> 觉醒丹
A768: 22 | B768: btn_dungeon | C768: 5 | D768: 1 | E768: 150 | F768: 10000 | G768: 3 | H768: =VLOOKUP(RC[-7],Sheet1!R2C1:R28C4,2,FALSE)&VLOOKUP(RC[-7],Sheet1!R2C1:R28C4,3,FALSE)&IF(VLOOKUP(RC[-7],Sheet1!R2C1:R28C4,4,FALSE)="品",VLOOKUP(RC[-3],Sheet1!R2C8:R6C9,2,FALSE),RC[-3])&VLOOKUP(RC[-7],Sheet1!R2C1:R28C4,4,FALSE) -> 累计击杀精英副本外敌150个 | I768: 28 | J768: =VLOOKUP(RC[-9],Sheet1!R2C1:R28C6,6,FALSE) -> 觉醒丹
A769: 22 | B769: btn_dungeon | C769: 6 | D769: 1 | E769: 200 | F769: 10000 | G769: 3 | H769: =VLOOKUP(RC[-7],Sheet1!R2C1:R28C4,2,FALSE)&VLOOKUP(RC[-7],Sheet1!R2C1:R28C4,3,FALSE)&IF(VLOOKUP(RC[-7],Sheet1!R2C1:R28C4,4,FALSE)="品",VLOOKUP(RC[-3],Sheet1!R2C8:R6C9,2,FALSE),RC[-3])&VLOOKUP(RC[-7],Sheet1!R2C1:R28C4,4,FALSE) -> 累计击杀精英副本外敌200个 | I769: 28 | J769: =VLOOKUP(RC[-9],Sheet1!R2C1:R28C6,6,FALSE) -> 觉醒丹
A770: 22 | B770: btn_dungeon | C770: 7 | D770: 1 | E770: 250 | F770: 10000 | G770: 4 | H770: =VLOOKUP(RC[-7],Sheet1!R2C1:R28C4,2,FALSE)&VLOOKUP(RC[-7],Sheet1!R2C1:R28C4,3,FALSE)&IF(VLOOKUP(RC[-7],Sheet1!R2C1:R28C4,4,FALSE)="品",VLOOKUP(RC[-3],Sheet1!R2C8:R6C9,2,FALSE),RC[-3])&VLOOKUP(RC[-7],Sheet1!R2C1:R28C4,4,FALSE) -> 累计击杀精英副本外敌250个 | I770: 28 | J770: =VLOOKUP(RC[-9],Sheet1!R2C1:R28C6,6,FALSE) -> 觉醒丹
A771: 22 | B771: btn_dungeon | C771: 8 | D771: 1 | E771: 300 | F771: 10000 | G771: 4 | H771: =VLOOKUP(RC[-7],Sheet1!R2C1:R28C4,2,FALSE)&VLOOKUP(RC[-7],Sheet1!R2C1:R28C4,3,FALSE)&IF(VLOOKUP(RC[-7],Sheet1!R2C1:R28C4,4,FALSE)="品",VLOOKUP(RC[-3],Sheet1!R2C8:R6C9,2,FALSE),RC[-3])&VLOOKUP(RC[-7],Sheet1!R2C1:R28C4,4,FALSE) -> 累计击杀精英副本外敌300个 | I771: 28 | J771: =VLOOKUP(RC[-9],Sheet1!R2C1:R28C6,6,FALSE) -> 觉醒丹
A772: 22 | B772: btn_dungeon | C772: 9 | D772: 1 | E772: 350 | F772: 10000 | G772: 5 | H772: =VLOOKUP(RC[-7],Sheet1!R2C1:R28C4,2,FALSE)&VLOOKUP(RC[-7],Sheet1!R2C1:R28C4,3,FALSE)&IF(VLOOKUP(RC[-7],Sheet1!R2C1:R28C4,4,FALSE)="品",VLOOKUP(RC[-3],Sheet1!R2C8:R6C9,2,FALSE),RC[-3])&VLOOKUP(RC[-7],Sheet1!R2C1:R28C4,4,FALSE) -> 累计击杀精英副本外敌350个 | I772: 28 | J772: =VLOOKUP(RC[-9],Sheet1!R2C1:R28C6,6,FALSE) -> 觉醒丹
A773: 22 | B773: btn_dungeon | C773: 10 | D773: 1 | E773: 400 | F773: 10000 | G773: 5 | H773: =VLOOKUP(RC[-7],Sheet1!R2C1:R28C4,2,FALSE)&VLOOKUP(RC[-7],Sheet1!R2C1:R28C4,3,FALSE)&IF(VLOOKUP(RC[-7],Sheet1!R2C1:R28C4,4,FALSE)="品",VLOOKUP(RC[-3],Sheet1!R2C8:R6C9,2,FALSE),RC[-3])&VLOOKUP(RC[-7],Sheet1!R2C1:R28C4,4,FALSE) -> 累计击杀精英副本外敌400个 | I773: 28 | J773: =VLOOKUP(RC[-9],Sheet1!R2C1:R28C6,6,FALSE) -> 觉醒丹
A774: 22 | B774: btn_dungeon | C774: 11 | D774: 1 | E774: 450 | F774: 10000 | G774: 5 | H774: =VLOOKUP(RC[-7],Sheet1!R2C1:R28C4,2,FALSE)&VLOOKUP(RC[-7],Sheet1!R2C1:R28C4,3,FALSE)&IF(VLOOKUP(RC[-7],Sheet1!R2C1:R28C4,4,FALSE)="品",VLOOKUP(RC[-3],Sheet1!R2C8:R6C9,2,FALSE),RC[-3])&VLOOKUP(RC[-7],Sheet1!R2C1:R28C4,4,FALSE) -> 累计击杀精英副本外敌450个 | I774: 28 | J774: =VLOOKUP(RC[-9],Sheet1!R2C1:R28C6,6,FALSE) -> 觉醒丹
A775: 22 | B775: btn_dungeon | C775: 12 | D775: 1 | E775: 500 | F775: 10000 | G775: 5 | H775: =VLOOKUP(RC[-7],Sheet1!R2C1:R28C4,2,FALSE)&VLOOKUP(RC[-7],Sheet1!R2C1:R28C4,3,FALSE)&IF(VLOOKUP(RC[-7],Sheet1!R2C1:R28C4,4,FALSE)="品",VLOOKUP(RC[-3],Sheet1!R2C8:R6C9,2,FALSE),RC[-3])&VLOOKUP(RC[-7],Sheet1!R2C1:R28C4,4,FALSE) -> 累计击杀精英副本外敌500个 | I775: 28 | J775: =VLOOKUP(RC[-9],Sheet1!R2C1:R28C6,6,FALSE) -> 觉醒丹
A776: 22 | B776: btn_dungeon | C776: 13 | D776: 1 | E776: 550 | F776: 10000 | G776: 5 | H776: =VLOOKUP(RC[-7],Sheet1!R2C1:R28C4,2,FALSE)&VLOOKUP(RC[-7],Sheet1!R2C1:R28C4,3,FALSE)&IF(VLOOKUP(RC[-7],Sheet1!R2C1:R28C4,4,FALSE)="品",VLOOKUP(RC[-3],Sheet1!R2C8:R6C9,2,FALSE),RC[-3])&VLOOKUP(RC[-7],Sheet1!R2C1:R28C4,4,FALSE) -> 累计击杀精英副本外敌550个 | I776: 28 | J776: =VLOOKUP(RC[-9],Sheet1!R2C1:R28C6,6,FALSE) -> 觉醒丹
A777: 22 | B777: btn_dungeon | C777: 14 | D777: 1 | E777: 600 | F777: 10000 | G777: 5 | H777: =VLOOKUP(RC[-7],Sheet1!R2C1:R28C4,2,FALSE)&VLOOKUP(RC[-7],Sheet1!R2C1:R28C4,3,FALSE)&IF(VLOOKUP(RC[-7],Sheet1!R2C1:R28C4,4,FALSE)="品",VLOOKUP(RC[-3],Sheet1!R2C8:R6C9,2,FALSE),RC[-3])&VLOOKUP(RC[-7],Sheet1!R2C1:R28C4,4,FALSE) -> 累计击杀精英副本外敌600个 | I777: 28 | J777: =VLOOKUP(RC[-9],Sheet1!R2C1:R28C6,6,FALSE) -> 觉醒丹
A778: 22 | B778: btn_dungeon | C778: 15 | D778: 1 | E778: 650 | F778: 10000 | G778: 5 | H778: =VLOOKUP(RC[-7],Sheet1!R2C1:R28C4,2,FALSE)&VLOOKUP(RC[-7],Sheet1!R2C1:R28C4,3,FALSE)&IF(VLOOKUP(RC[-7],Sheet1!R2C1:R28C4,4,FALSE)="品",VLOOKUP(RC[-3],Sheet1!R2C8:R6C9,2,FALSE),RC[-3])&VLOOKUP(RC[-7],Sheet1!R2C1:R28C4,4,FALSE) -> 累计击杀精英副本外敌650个 | I778: 28 | J778: =VLOOKUP(RC[-9],Sheet1!R2C1:R28C6,6,FALSE) -> 觉醒丹
A779: 22 | B779: btn_dungeon | C779: 16 | D779: 1 | E779: 700 | F779: 10000 | G779: 5 | H779: =VLOOKUP(RC[-7],Sheet1!R2C1:R28C4,2,FALSE)&VLOOKUP(RC[-7],Sheet1!R2C1:R28C4,3,FALSE)&IF(VLOOKUP(RC[-7],Sheet1!R2C1:R28C4,4,FALSE)="品",VLOOKUP(RC[-3],Sheet1!R2C8:R6C9,2,FALSE),RC[-3])&VLOOKUP(RC[-7],Sheet1!R2C1:R28C4,4,FALSE) -> 累计击杀精英副本外敌700个 | I779: 28 | J779: =VLOOKUP(RC[-9],Sheet1!R2C1:R28C6,6,FALSE) -> 觉醒丹
A780: 22 | B780: btn_dungeon | C780: 17 | D780: 1 | E780: 750 | F780: 10000 | G780: 5 | H780: =VLOOKUP(RC[-7],Sheet1!R2C1:R28C4,2,FALSE)&VLOOKUP(RC[-7],Sheet1!R2C1:R28C4,3,FALSE)&IF(VLOOKUP(RC[-7],Sheet1!R2C1:R28C4,4,FALSE)="品",VLOOKUP(RC[-3],Sheet1!R2C8:R6C9,2,FALSE),RC[-3])&VLOOKUP(RC[-7],Sheet1!R2C1:R28C4,4,FALSE) -> 累计击杀精英副本外敌750个 | I780: 28 | J780: =VLOOKUP(RC[-9],Sheet1!R2C1:R28C6,6,FALSE) -> 觉醒丹
A781: 22 | B781: btn_dungeon | C781: 18 | D781: 1 | E781: 800 | F781: 10000 | G781: 5 | H781: =VLOOKUP(RC[-7],Sheet1!R2C1:R28C4,2,FALSE)&VLOOKUP(RC[-7],Sheet1!R2C1:R28C4,3,FALSE)&IF(VLOOKUP(RC[-7],Sheet1!R2C1:R28C4,4,FALSE)="品",VLOOKUP(RC[-3],Sheet1!R2C8:R6C9,2,FALSE),RC[-3])&VLOOKUP(RC[-7],Sheet1!R2C1:R28C4,4,FALSE) -> 累计击杀精英副本外敌800个 | I781: 28 | J781: =VLOOKUP(RC[-9],Sheet1!R2C1:R28C6,6,FALSE) -> 觉醒丹
A782: 22 | B782: btn_dungeon | C782: 19 | D782: 1 | E782: 850 | F782: 10000 | G782: 5 | H782: =VLOOKUP(RC[-7],Sheet1!R2C1:R28C4,2,FALSE)&VLOOKUP(RC[-7],Sheet1!R2C1:R28C4,3,FALSE)&IF(VLOOKUP(RC[-7],Sheet1!R2C1:R28C4,4,FALSE)="品",VLOOKUP(RC[-3],Sheet1!R2C8:R6C9,2,FALSE),RC[-3])&VLOOKUP(RC[-7],Sheet1!R2C1:R28C4,4,FALSE) -> 累计击杀精英副本外敌850个 | I782: 28 | J782: =VLOOKUP(RC[-9],Sheet1!R2C1:R28C6,6,FALSE) -> 觉醒丹
A783: 22 | B783: btn_dungeon | C783: 20 | D783: 1 | E783: 900 | F783: 10000 | G783: 5 | H783: =VLOOKUP(RC[-7],Sheet1!R2C1:R28C4,2,FALSE)&VLOOKUP(RC[-7],Sheet1!R2C1:R28C4,3,FALSE)&IF(VLOOKUP(RC[-7],Sheet1!R2C1:R28C4,4,FALSE)="品",VLOOKUP(RC[-3],Sheet1!R2C8:R6C9,2,FALSE),RC[-3])&VLOOKUP(RC[-7],Sheet1!R2C1:R28C4,4,FALSE) -> 累计击杀精英副本外敌900个 | I783: 28 | J783: =VLOOKUP(RC[-9],Sheet1!R2C1:R28C6,6,FALSE) -> 觉醒丹
A784: 22 | B784: btn_dungeon | C784: 21 | D784: 1 | E784: 950 | F784: 10000 | G784: 5 | H784: =VLOOKUP(RC[-7],Sheet1!R2C1:R28C4,2,FALSE)&VLOOKUP(RC[-7],Sheet1!R2C1:R28C4,3,FALSE)&IF(VLOOKUP(RC[-7],Sheet1!R2C1:R28C4,4,FALSE)="品",VLOOKUP(RC[-3],Sheet1!R2C8:R6C9,2,FALSE),RC[-3])&VLOOKUP(RC[-7],Sheet1!R2C1:R28C4,4,FALSE) -> 累计击杀精英副本外敌950个 | I784: 28 | J784: =VLOOKUP(RC[-9],Sheet1!R2C1:R28C6,6,FALSE) -> 觉醒丹
A785: 22 | B785: btn_dungeon | C785: 22 | D785: 1 | E785: 1000 | F785: 10000 | G785: 5 | H785: =VLOOKUP(RC[-7],Sheet1!R2C1:R28C4,2,FALSE)&VLOOKUP(RC[-7],Sheet1!R2C1:R28C4,3,FALSE)&IF(VLOOKUP(RC[-7],Sheet1!R2C1:R28C4,4,FALSE)="品",VLOOKUP(RC[-3],Sheet1!R2C8:R6C9,2,FALSE),RC[-3])&VLOOKUP(RC[-7],Sheet1!R2C1:R28C4,4,FALSE) -> 累计击杀精英副本外敌1000个 | I785: 28 | J785: =VLOOKUP(RC[-9],Sheet1!R2C1:R28C6,6,FALSE) -> 觉醒丹
A786: 23 | B786: btn_hero | C786: 1 | D786: 1 | E786: 1 | F786: 19017 | G786: 200 | H786: =VLOOKUP(RC[-7],Sheet1!R2C1:R28C4,2,FALSE)&VLOOKUP(RC[-7],Sheet1!R2C1:R28C4,3,FALSE)&IF(VLOOKUP(RC[-7],Sheet1!R2C1:R28C4,4,FALSE)="品",VLOOKUP(RC[-3],Sheet1!R2C8:R6C9,2,FALSE),RC[-3])&VLOOKUP(RC[-7],Sheet1!R2C1:R28C4,4,FALSE) -> 战队中全体英雄觉醒达到1星 | I786: 7 | J786: =VLOOKUP(RC[-9],Sheet1!R2C1:R28C6,6,FALSE) -> 觉醒材料箱
A787: 23 | B787: btn_hero | C787: 2 | D787: 1 | E787: 2 | F787: 19017 | G787: 500 | H787: =VLOOKUP(RC[-7],Sheet1!R2C1:R28C4,2,FALSE)&VLOOKUP(RC[-7],Sheet1!R2C1:R28C4,3,FALSE)&IF(VLOOKUP(RC[-7],Sheet1!R2C1:R28C4,4,FALSE)="品",VLOOKUP(RC[-3],Sheet1!R2C8:R6C9,2,FALSE),RC[-3])&VLOOKUP(RC[-7],Sheet1!R2C1:R28C4,4,FALSE) -> 战队中全体英雄觉醒达到2星 | I787: 7 | J787: =VLOOKUP(RC[-9],Sheet1!R2C1:R28C6,6,FALSE) -> 觉醒材料箱
A788: 23 | B788: btn_hero | C788: 3 | D788: 1 | E788: 3 | F788: 19017 | G788: 1000 | H788: =VLOOKUP(RC[-7],Sheet1!R2C1:R28C4,2,FALSE)&VLOOKUP(RC[-7],Sheet1!R2C1:R28C4,3,FALSE)&IF(VLOOKUP(RC[-7],Sheet1!R2C1:R28C4,4,FALSE)="品",VLOOKUP(RC[-3],Sheet1!R2C8:R6C9,2,FALSE),RC[-3])&VLOOKUP(RC[-7],Sheet1!R2C1:R28C4,4,FALSE) -> 战队中全体英雄觉醒达到3星 | I788: 7 | J788: =VLOOKUP(RC[-9],Sheet1!R2C1:R28C6,6,FALSE) -> 觉醒材料箱
A789: 23 | B789: btn_hero | C789: 4 | D789: 1 | E789: 4 | F789: 19017 | G789: 2000 | H789: =VLOOKUP(RC[-7],Sheet1!R2C1:R28C4,2,FALSE)&VLOOKUP(RC[-7],Sheet1!R2C1:R28C4,3,FALSE)&IF(VLOOKUP(RC[-7],Sheet1!R2C1:R28C4,4,FALSE)="品",VLOOKUP(RC[-3],Sheet1!R2C8:R6C9,2,FALSE),RC[-3])&VLOOKUP(RC[-7],Sheet1!R2C1:R28C4,4,FALSE) -> 战队中全体英雄觉醒达到4星 | I789: 7 | J789: =VLOOKUP(RC[-9],Sheet1!R2C1:R28C6,6,FALSE) -> 觉醒材料箱
A790: 23 | B790: btn_hero | C790: 5 | D790: 1 | E790: 5 | F790: 19017 | G790: 3000 | H790: =VLOOKUP(RC[-7],Sheet1!R2C1:R28C4,2,FALSE)&VLOOKUP(RC[-7],Sheet1!R2C1:R28C4,3,FALSE)&IF(VLOOKUP(RC[-7],Sheet1!R2C1:R28C4,4,FALSE)="品",VLOOKUP(RC[-3],Sheet1!R2C8:R6C9,2,FALSE),RC[-3])&VLOOKUP(RC[-7],Sheet1!R2C1:R28C4,4,FALSE) -> 战队中全体英雄觉醒达到5星 | I790: 7 | J790: =VLOOKUP(RC[-9],Sheet1!R2C1:R28C6,6,FALSE) -> 觉醒材料箱
A791: 23 | B791: btn_hero | C791: 6 | D791: 1 | E791: 6 | F791: 19017 | G791: 5000 | H791: =VLOOKUP(RC[-7],Sheet1!R2C1:R28C4,2,FALSE)&VLOOKUP(RC[-7],Sheet1!R2C1:R28C4,3,FALSE)&IF(VLOOKUP(RC[-7],Sheet1!R2C1:R28C4,4,FALSE)="品",VLOOKUP(RC[-3],Sheet1!R2C8:R6C9,2,FALSE),RC[-3])&VLOOKUP(RC[-7],Sheet1!R2C1:R28C4,4,FALSE) -> 战队中全体英雄觉醒达到6星 | I791: 7 | J791: =VLOOKUP(RC[-9],Sheet1!R2C1:R28C6,6,FALSE) -> 觉醒材料箱
A792: 24 | B792: btn_pvp | C792: 1 | D792: 1 | E792: 1 | F792: 10022 | G792: 5 | H792: =VLOOKUP(RC[-7],Sheet1!R2C1:R28C4,2,FALSE)&VLOOKUP(RC[-7],Sheet1!R2C1:R28C4,3,FALSE)&IF(VLOOKUP(RC[-7],Sheet1!R2C1:R28C4,4,FALSE)="品",VLOOKUP(RC[-3],Sheet1!R2C8:R6C9,2,FALSE),RC[-3])&VLOOKUP(RC[-7],Sheet1!R2C1:R28C4,4,FALSE) -> 英雄对决累计战斗1场 | I792: 72 | J792: =VLOOKUP(RC[-9],Sheet1!R2C1:R28C6,6,FALSE) -> 灵性精粹
A793: 24 | B793: btn_pvp | C793: 2 | D793: 1 | E793: 10 | F793: 10022 | G793: 5 | H793: =VLOOKUP(RC[-7],Sheet1!R2C1:R28C4,2,FALSE)&VLOOKUP(RC[-7],Sheet1!R2C1:R28C4,3,FALSE)&IF(VLOOKUP(RC[-7],Sheet1!R2C1:R28C4,4,FALSE)="品",VLOOKUP(RC[-3],Sheet1!R2C8:R6C9,2,FALSE),RC[-3])&VLOOKUP(RC[-7],Sheet1!R2C1:R28C4,4,FALSE) -> 英雄对决累计战斗10场 | I793: 72 | J793: =VLOOKUP(RC[-9],Sheet1!R2C1:R28C6,6,FALSE) -> 灵性精粹
A794: 24 | B794: btn_pvp | C794: 3 | D794: 1 | E794: 20 | F794: 10022 | G794: 5 | H794: =VLOOKUP(RC[-7],Sheet1!R2C1:R28C4,2,FALSE)&VLOOKUP(RC[-7],Sheet1!R2C1:R28C4,3,FALSE)&IF(VLOOKUP(RC[-7],Sheet1!R2C1:R28C4,4,FALSE)="品",VLOOKUP(RC[-3],Sheet1!R2C8:R6C9,2,FALSE),RC[-3])&VLOOKUP(RC[-7],Sheet1!R2C1:R28C4,4,FALSE) -> 英雄对决累计战斗20场 | I794: 72 | J794: =VLOOKUP(RC[-9],Sheet1!R2C1:R28C6,6,FALSE) -> 灵性精粹
A795: 24 | B795: btn_pvp | C795: 4 | D795: 1 | E795: 50 | F795: 10022 | G795: 5 | H795: =VLOOKUP(RC[-7],Sheet1!R2C1:R28C4,2,FALSE)&VLOOKUP(RC[-7],Sheet1!R2C1:R28C4,3,FALSE)&IF(VLOOKUP(RC[-7],Sheet1!R2C1:R28C4,4,FALSE)="品",VLOOKUP(RC[-3],Sheet1!R2C8:R6C9,2,FALSE),RC[-3])&VLOOKUP(RC[-7],Sheet1!R2C1:R28C4,4,FALSE) -> 英雄对决累计战斗50场 | I795: 72 | J795: =VLOOKUP(RC[-9],Sheet1!R2C1:R28C6,6,FALSE) -> 灵性精粹
A796: 24 | B796: btn_pvp | C796: 5 | D796: 1 | E796: 100 | F796: 10022 | G796: 10 | H796: =VLOOKUP(RC[-7],Sheet1!R2C1:R28C4,2,FALSE)&VLOOKUP(RC[-7],Sheet1!R2C1:R28C4,3,FALSE)&IF(VLOOKUP(RC[-7],Sheet1!R2C1:R28C4,4,FALSE)="品",VLOOKUP(RC[-3],Sheet1!R2C8:R6C9,2,FALSE),RC[-3])&VLOOKUP(RC[-7],Sheet1!R2C1:R28C4,4,FALSE) -> 英雄对决累计战斗100场 | I796: 72 | J796: =VLOOKUP(RC[-9],Sheet1!R2C1:R28C6,6,FALSE) -> 灵性精粹
A797: 24 | B797: btn_pvp | C797: 6 | D797: 1 | E797: 150 | F797: 10022 | G797: 10 | H797: =VLOOKUP(RC[-7],Sheet1!R2C1:R28C4,2,FALSE)&VLOOKUP(RC[-7],Sheet1!R2C1:R28C4,3,FALSE)&IF(VLOOKUP(RC[-7],Sheet1!R2C1:R28C4,4,FALSE)="品",VLOOKUP(RC[-3],Sheet1!R2C8:R6C9,2,FALSE),RC[-3])&VLOOKUP(RC[-7],Sheet1!R2C1:R28C4,4,FALSE) -> 英雄对决累计战斗150场 | I797: 72 | J797: =VLOOKUP(RC[-9],Sheet1!R2C1:R28C6,6,FALSE) -> 灵性精粹
A798: 24 | B798: btn_pvp | C798: 7 | D798: 1 | E798: 200 | F798: 10022 | G798: 10 | H798: =VLOOKUP(RC[-7],Sheet1!R2C1:R28C4,2,FALSE)&VLOOKUP(RC[-7],Sheet1!R2C1:R28C4,3,FALSE)&IF(VLOOKUP(RC[-7],Sheet1!R2C1:R28C4,4,FALSE)="品",VLOOKUP(RC[-3],Sheet1!R2C8:R6C9,2,FALSE),RC[-3])&VLOOKUP(RC[-7],Sheet1!R2C1:R28C4,4,FALSE) -> 英雄对决累计战斗200场 | I798: 72 | J798: =VLOOKUP(RC[-9],Sheet1!R2C1:R28C6,6,FALSE) -> 灵性精粹
A799: 24 | B799: btn_pvp | C799: 8 | D799: 1 | E799: 250 | F799: 10022 | G799: 10 | H799: =VLOOKUP(RC[-7],Sheet1!R2C1:R28C4,2,FALSE)&VLOOKUP(RC[-7],Sheet1!R2C1:R28C4,3,FALSE)&IF(VLOOKUP(RC[-7],Sheet1!R2C1:R28C4,4,FALSE)="品",VLOOKUP(RC[-3],Sheet1!R2C8:R6C9,2,FALSE),RC[-3])&VLOOKUP(RC[-7],Sheet1!R2C1:R28C4,4,FALSE) -> 英雄对决累计战斗250场 | I799: 72 | J799: =VLOOKUP(RC[-9],Sheet1!R2C1:R28C6,6,FALSE) -> 灵性精粹
A800: 24 | B800: btn_pvp | C800: 9 | D800: 1 | E800: 300 | F800: 10022 | G800: 10 | H800: =VLOOKUP(RC[-7],Sheet1!R2C1:R28C4,2,FALSE)&VLOOKUP(RC[-7],Sheet1!R2C1:R28C4,3,FALSE)&IF(VLOOKUP(RC[-7],Sheet1!R2C1:R28C4,4,FALSE)="品",VLOOKUP(RC[-3],Sheet1!R2C8:R6C9,2,FALSE),RC[-3])&VLOOKUP(RC[-7],Sheet1!R2C1:R28C4,4,FALSE) -> 英雄对决累计战斗300场 | I800: 72 | J800: =VLOOKUP(RC[-9],Sheet1!R2C1:R28C6,6,FALSE) -> 灵性精粹
A801: 24 | B801: btn_pvp | C801: 10 | D801: 1 | E801: 350 | F801: 10022 | G801: 10 | H801: =VLOOKUP(RC[-7],Sheet1!R2C1:R28C4,2,FALSE)&VLOOKUP(RC[-7],Sheet1!R2C1:R28C4,3,FALSE)&IF(VLOOKUP(RC[-7],Sheet1!R2C1:R28C4,4,FALSE)="品",VLOOKUP(RC[-3],Sheet1!R2C8:R6C9,2,FALSE),RC[-3])&VLOOKUP(RC[-7],Sheet1!R2C1:R28C4,4,FALSE) -> 英雄对决累计战斗350场 | I801: 72 | J801: =VLOOKUP(RC[-9],Sheet1!R2C1:R28C6,6,FALSE) -> 灵性精粹
A802: 24 | B802: btn_pvp | C802: 11 | D802: 1 | E802: 400 | F802: 10022 | G802: 10 | H802: =VLOOKUP(RC[-7],Sheet1!R2C1:R28C4,2,FALSE)&VLOOKUP(RC[-7],Sheet1!R2C1:R28C4,3,FALSE)&IF(VLOOKUP(RC[-7],Sheet1!R2C1:R28C4,4,FALSE)="品",VLOOKUP(RC[-3],Sheet1!R2C8:R6C9,2,FALSE),RC[-3])&VLOOKUP(RC[-7],Sheet1!R2C1:R28C4,4,FALSE) -> 英雄对决累计战斗400场 | I802: 72 | J802: =VLOOKUP(RC[-9],Sheet1!R2C1:R28C6,6,FALSE) -> 灵性精粹
A803: 24 | B803: btn_pvp | C803: 12 | D803: 1 | E803: 450 | F803: 10022 | G803: 10 | H803: =VLOOKUP(RC[-7],Sheet1!R2C1:R28C4,2,FALSE)&VLOOKUP(RC[-7],Sheet1!R2C1:R28C4,3,FALSE)&IF(VLOOKUP(RC[-7],Sheet1!R2C1:R28C4,4,FALSE)="品",VLOOKUP(RC[-3],Sheet1!R2C8:R6C9,2,FALSE),RC[-3])&VLOOKUP(RC[-7],Sheet1!R2C1:R28C4,4,FALSE) -> 英雄对决累计战斗450场 | I803: 72 | J803: =VLOOKUP(RC[-9],Sheet1!R2C1:R28C6,6,FALSE) -> 灵性精粹
A804: 24 | B804: btn_pvp | C804: 13 | D804: 1 | E804: 500 | F804: 10022 | G804: 10 | H804: =VLOOKUP(RC[-7],Sheet1!R2C1:R28C4,2,FALSE)&VLOOKUP(RC[-7],Sheet1!R2C1:R28C4,3,FALSE)&IF(VLOOKUP(RC[-7],Sheet1!R2C1:R28C4,4,FALSE)="品",VLOOKUP(RC[-3],Sheet1!R2C8:R6C9,2,FALSE),RC[-3])&VLOOKUP(RC[-7],Sheet1!R2C1:R28C4,4,FALSE) -> 英雄对决累计战斗500场 | I804: 72 | J804: =VLOOKUP(RC[-9],Sheet1!R2C1:R28C6,6,FALSE) -> 灵性精粹
A805: 24 | B805: btn_pvp | C805: 14 | D805: 1 | E805: 600 | F805: 10022 | G805: 15 | H805: =VLOOKUP(RC[-7],Sheet1!R2C1:R28C4,2,FALSE)&VLOOKUP(RC[-7],Sheet1!R2C1:R28C4,3,FALSE)&IF(VLOOKUP(RC[-7],Sheet1!R2C1:R28C4,4,FALSE)="品",VLOOKUP(RC[-3],Sheet1!R2C8:R6C9,2,FALSE),RC[-3])&VLOOKUP(RC[-7],Sheet1!R2C1:R28C4,4,FALSE) -> 英雄对决累计战斗600场 | I805: 72 | J805: =VLOOKUP(RC[-9],Sheet1!R2C1:R28C6,6,FALSE) -> 灵性精粹
A806: 24 | B806: btn_pvp | C806: 15 | D806: 1 | E806: 700 | F806: 10022 | G806: 15 | H806: =VLOOKUP(RC[-7],Sheet1!R2C1:R28C4,2,FALSE)&VLOOKUP(RC[-7],Sheet1!R2C1:R28C4,3,FALSE)&IF(VLOOKUP(RC[-7],Sheet1!R2C1:R28C4,4,FALSE)="品",VLOOKUP(RC[-3],Sheet1!R2C8:R6C9,2,FALSE),RC[-3])&VLOOKUP(RC[-7],Sheet1!R2C1:R28C4,4,FALSE) -> 英雄对决累计战斗700场 | I806: 72 | J806: =VLOOKUP(RC[-9],Sheet1!R2C1:R28C6,6,FALSE) -> 灵性精粹
A807: 24 | B807: btn_pvp | C807: 16 | D807: 1 | E807: 800 | F807: 10022 | G807: 15 | H807: =VLOOKUP(RC[-7],Sheet1!R2C1:R28C4,2,FALSE)&VLOOKUP(RC[-7],Sheet1!R2C1:R28C4,3,FALSE)&IF(VLOOKUP(RC[-7],Sheet1!R2C1:R28C4,4,FALSE)="品",VLOOKUP(RC[-3],Sheet1!R2C8:R6C9,2,FALSE),RC[-3])&VLOOKUP(RC[-7],Sheet1!R2C1:R28C4,4,FALSE) -> 英雄对决累计战斗800场 | I807: 72 | J807: =VLOOKUP(RC[-9],Sheet1!R2C1:R28C6,6,FALSE) -> 灵性精粹
A808: 24 | B808: btn_pvp | C808: 17 | D808: 1 | E808: 900 | F808: 10022 | G808: 15 | H808: =VLOOKUP(RC[-7],Sheet1!R2C1:R28C4,2,FALSE)&VLOOKUP(RC[-7],Sheet1!R2C1:R28C4,3,FALSE)&IF(VLOOKUP(RC[-7],Sheet1!R2C1:R28C4,4,FALSE)="品",VLOOKUP(RC[-3],Sheet1!R2C8:R6C9,2,FALSE),RC[-3])&VLOOKUP(RC[-7],Sheet1!R2C1:R28C4,4,FALSE) -> 英雄对决累计战斗900场 | I808: 72 | J808: =VLOOKUP(RC[-9],Sheet1!R2C1:R28C6,6,FALSE) -> 灵性精粹
A809: 24 | B809: btn_pvp | C809: 18 | D809: 1 | E809: 1000 | F809: 10022 | G809: 15 | H809: =VLOOKUP(RC[-7],Sheet1!R2C1:R28C4,2,FALSE)&VLOOKUP(RC[-7],Sheet1!R2C1:R28C4,3,FALSE)&IF(VLOOKUP(RC[-7],Sheet1!R2C1:R28C4,4,FALSE)="品",VLOOKUP(RC[-3],Sheet1!R2C8:R6C9,2,FALSE),RC[-3])&VLOOKUP(RC[-7],Sheet1!R2C1:R28C4,4,FALSE) -> 英雄对决累计战斗1000场 | I809: 72 | J809: =VLOOKUP(RC[-9],Sheet1!R2C1:R28C6,6,FALSE) -> 灵性精粹
A810: 24 | B810: btn_pvp | C810: 19 | D810: 1 | E810: 1100 | F810: 10022 | G810: 15 | H810: =VLOOKUP(RC[-7],Sheet1!R2C1:R28C4,2,FALSE)&VLOOKUP(RC[-7],Sheet1!R2C1:R28C4,3,FALSE)&IF(VLOOKUP(RC[-7],Sheet1!R2C1:R28C4,4,FALSE)="品",VLOOKUP(RC[-3],Sheet1!R2C8:R6C9,2,FALSE),RC[-3])&VLOOKUP(RC[-7],Sheet1!R2C1:R28C4,4,FALSE) -> 英雄对决累计战斗1100场 | I810: 72 | J810: =VLOOKUP(RC[-9],Sheet1!R2C1:R28C6,6,FALSE) -> 灵性精粹
A811: 24 | B811: btn_pvp | C811: 20 | D811: 1 | E811: 1200 | F811: 10022 | G811: 15 | H811: =VLOOKUP(RC[-7],Sheet1!R2C1:R28C4,2,FALSE)&VLOOKUP(RC[-7],Sheet1!R2C1:R28C4,3,FALSE)&IF(VLOOKUP(RC[-7],Sheet1!R2C1:R28C4,4,FALSE)="品",VLOOKUP(RC[-3],Sheet1!R2C8:R6C9,2,FALSE),RC[-3])&VLOOKUP(RC[-7],Sheet1!R2C1:R28C4,4,FALSE) -> 英雄对决累计战斗1200场 | I811: 72 | J811: =VLOOKUP(RC[-9],Sheet1!R2C1:R28C6,6,FALSE) -> 灵性精粹
A812: 24 | B812: btn_pvp | C812: 21 | D812: 1 | E812: 1300 | F812: 10022 | G812: 15 | H812: =VLOOKUP(RC[-7],Sheet1!R2C1:R28C4,2,FALSE)&VLOOKUP(RC[-7],Sheet1!R2C1:R28C4,3,FALSE)&IF(VLOOKUP(RC[-7],Sheet1!R2C1:R28C4,4,FALSE)="品",VLOOKUP(RC[-3],Sheet1!R2C8:R6C9,2,FALSE),RC[-3])&VLOOKUP(RC[-7],Sheet1!R2C1:R28C4,4,FALSE) -> 英雄对决累计战斗1300场 | I812: 72 | J812: =VLOOKUP(RC[-9],Sheet1!R2C1:R28C6,6,FALSE) -> 灵性精粹
A813: 24 | B813: btn_pvp | C813: 22 | D813: 1 | E813: 1400 | F813: 10022 | G813: 15 | H813: =VLOOKUP(RC[-7],Sheet1!R2C1:R28C4,2,FALSE)&VLOOKUP(RC[-7],Sheet1!R2C1:R28C4,3,FALSE)&IF(VLOOKUP(RC[-7],Sheet1!R2C1:R28C4,4,FALSE)="品",VLOOKUP(RC[-3],Sheet1!R2C8:R6C9,2,FALSE),RC[-3])&VLOOKUP(RC[-7],Sheet1!R2C1:R28C4,4,FALSE) -> 英雄对决累计战斗1400场 | I813: 72 | J813: =VLOOKUP(RC[-9],Sheet1!R2C1:R28C6,6,FALSE) -> 灵性精粹
A814: 24 | B814: btn_pvp | C814: 23 | D814: 1 | E814: 1500 | F814: 10022 | G814: 15 | H814: =VLOOKUP(RC[-7],Sheet1!R2C1:R28C4,2,FALSE)&VLOOKUP(RC[-7],Sheet1!R2C1:R28C4,3,FALSE)&IF(VLOOKUP(RC[-7],Sheet1!R2C1:R28C4,4,FALSE)="品",VLOOKUP(RC[-3],Sheet1!R2C8:R6C9,2,FALSE),RC[-3])&VLOOKUP(RC[-7],Sheet1!R2C1:R28C4,4,FALSE) -> 英雄对决累计战斗1500场 | I814: 72 | J814: =VLOOKUP(RC[-9],Sheet1!R2C1:R28C6,6,FALSE) -> 灵性精粹
A815: 24 | B815: btn_pvp | C815: 24 | D815: 1 | E815: 1600 | F815: 10022 | G815: 15 | H815: =VLOOKUP(RC[-7],Sheet1!R2C1:R28C4,2,FALSE)&VLOOKUP(RC[-7],Sheet1!R2C1:R28C4,3,FALSE)&IF(VLOOKUP(RC[-7],Sheet1!R2C1:R28C4,4,FALSE)="品",VLOOKUP(RC[-3],Sheet1!R2C8:R6C9,2,FALSE),RC[-3])&VLOOKUP(RC[-7],Sheet1!R2C1:R28C4,4,FALSE) -> 英雄对决累计战斗1600场 | I815: 72 | J815: =VLOOKUP(RC[-9],Sheet1!R2C1:R28C6,6,FALSE) -> 灵性精粹
A816: 24 | B816: btn_pvp | C816: 25 | D816: 1 | E816: 1700 | F816: 10022 | G816: 15 | H816: =VLOOKUP(RC[-7],Sheet1!R2C1:R28C4,2,FALSE)&VLOOKUP(RC[-7],Sheet1!R2C1:R28C4,3,FALSE)&IF(VLOOKUP(RC[-7],Sheet1!R2C1:R28C4,4,FALSE)="品",VLOOKUP(RC[-3],Sheet1!R2C8:R6C9,2,FALSE),RC[-3])&VLOOKUP(RC[-7],Sheet1!R2C1:R28C4,4,FALSE) -> 英雄对决累计战斗1700场 | I816: 72 | J816: =VLOOKUP(RC[-9],Sheet1!R2C1:R28C6,6,FALSE) -> 灵性精粹
A817: 24 | B817: btn_pvp | C817: 26 | D817: 1 | E817: 1800 | F817: 10022 | G817: 15 | H817: =VLOOKUP(RC[-7],Sheet1!R2C1:R28C4,2,FALSE)&VLOOKUP(RC[-7],Sheet1!R2C1:R28C4,3,FALSE)&IF(VLOOKUP(RC[-7],Sheet1!R2C1:R28C4,4,FALSE)="品",VLOOKUP(RC[-3],Sheet1!R2C8:R6C9,2,FALSE),RC[-3])&VLOOKUP(RC[-7],Sheet1!R2C1:R28C4,4,FALSE) -> 英雄对决累计战斗1800场 | I817: 72 | J817: =VLOOKUP(RC[-9],Sheet1!R2C1:R28C6,6,FALSE) -> 灵性精粹
A818: 24 | B818: btn_pvp | C818: 27 | D818: 1 | E818: 1900 | F818: 10022 | G818: 15 | H818: =VLOOKUP(RC[-7],Sheet1!R2C1:R28C4,2,FALSE)&VLOOKUP(RC[-7],Sheet1!R2C1:R28C4,3,FALSE)&IF(VLOOKUP(RC[-7],Sheet1!R2C1:R28C4,4,FALSE)="品",VLOOKUP(RC[-3],Sheet1!R2C8:R6C9,2,FALSE),RC[-3])&VLOOKUP(RC[-7],Sheet1!R2C1:R28C4,4,FALSE) -> 英雄对决累计战斗1900场 | I818: 72 | J818: =VLOOKUP(RC[-9],Sheet1!R2C1:R28C6,6,FALSE) -> 灵性精粹
A819: 24 | B819: btn_pvp | C819: 28 | D819: 1 | E819: 2000 | F819: 10022 | G819: 15 | H819: =VLOOKUP(RC[-7],Sheet1!R2C1:R28C4,2,FALSE)&VLOOKUP(RC[-7],Sheet1!R2C1:R28C4,3,FALSE)&IF(VLOOKUP(RC[-7],Sheet1!R2C1:R28C4,4,FALSE)="品",VLOOKUP(RC[-3],Sheet1!R2C8:R6C9,2,FALSE),RC[-3])&VLOOKUP(RC[-7],Sheet1!R2C1:R28C4,4,FALSE) -> 英雄对决累计战斗2000场 | I819: 72 | J819: =VLOOKUP(RC[-9],Sheet1!R2C1:R28C6,6,FALSE) -> 灵性精粹
A820: 24 | B820: btn_pvp | C820: 29 | D820: 1 | E820: 2100 | F820: 10022 | G820: 15 | H820: =VLOOKUP(RC[-7],Sheet1!R2C1:R28C4,2,FALSE)&VLOOKUP(RC[-7],Sheet1!R2C1:R28C4,3,FALSE)&IF(VLOOKUP(RC[-7],Sheet1!R2C1:R28C4,4,FALSE)="品",VLOOKUP(RC[-3],Sheet1!R2C8:R6C9,2,FALSE),RC[-3])&VLOOKUP(RC[-7],Sheet1!R2C1:R28C4,4,FALSE) -> 英雄对决累计战斗2100场 | I820: 72 | J820: =VLOOKUP(RC[-9],Sheet1!R2C1:R28C6,6,FALSE) -> 灵性精粹
A821: 24 | B821: btn_pvp | C821: 30 | D821: 1 | E821: 2200 | F821: 10022 | G821: 15 | H821: =VLOOKUP(RC[-7],Sheet1!R2C1:R28C4,2,FALSE)&VLOOKUP(RC[-7],Sheet1!R2C1:R28C4,3,FALSE)&IF(VLOOKUP(RC[-7],Sheet1!R2C1:R28C4,4,FALSE)="品",VLOOKUP(RC[-3],Sheet1!R2C8:R6C9,2,FALSE),RC[-3])&VLOOKUP(RC[-7],Sheet1!R2C1:R28C4,4,FALSE) -> 英雄对决累计战斗2200场 | I821: 72 | J821: =VLOOKUP(RC[-9],Sheet1!R2C1:R28C6,6,FALSE) -> 灵性精粹
A822: 24 | B822: btn_pvp | C822: 31 | D822: 1 | E822: 2300 | F822: 10022 | G822: 15 | H822: =VLOOKUP(RC[-7],Sheet1!R2C1:R28C4,2,FALSE)&VLOOKUP(RC[-7],Sheet1!R2C1:R28C4,3,FALSE)&IF(VLOOKUP(RC[-7],Sheet1!R2C1:R28C4,4,FALSE)="品",VLOOKUP(RC[-3],Sheet1!R2C8:R6C9,2,FALSE),RC[-3])&VLOOKUP(RC[-7],Sheet1!R2C1:R28C4,4,FALSE) -> 英雄对决累计战斗2300场 | I822: 72 | J822: =VLOOKUP(RC[-9],Sheet1!R2C1:R28C6,6,FALSE) -> 灵性精粹
A823: 24 | B823: btn_pvp | C823: 32 | D823: 1 | E823: 2400 | F823: 10022 | G823: 15 | H823: =VLOOKUP(RC[-7],Sheet1!R2C1:R28C4,2,FALSE)&VLOOKUP(RC[-7],Sheet1!R2C1:R28C4,3,FALSE)&IF(VLOOKUP(RC[-7],Sheet1!R2C1:R28C4,4,FALSE)="品",VLOOKUP(RC[-3],Sheet1!R2C8:R6C9,2,FALSE),RC[-3])&VLOOKUP(RC[-7],Sheet1!R2C1:R28C4,4,FALSE) -> 英雄对决累计战斗2400场 | I823: 72 | J823: =VLOOKUP(RC[-9],Sheet1!R2C1:R28C6,6,FALSE) -> 灵性精粹
A824: 24 | B824: btn_pvp | C824: 33 | D824: 1 | E824: 2500 | F824: 10022 | G824: 15 | H824: =VLOOKUP(RC[-7],Sheet1!R2C1:R28C4,2,FALSE)&VLOOKUP(RC[-7],Sheet1!R2C1:R28C4,3,FALSE)&IF(VLOOKUP(RC[-7],Sheet1!R2C1:R28C4,4,FALSE)="品",VLOOKUP(RC[-3],Sheet1!R2C8:R6C9,2,FALSE),RC[-3])&VLOOKUP(RC[-7],Sheet1!R2C1:R28C4,4,FALSE) -> 英雄对决累计战斗2500场 | I824: 72 | J824: =VLOOKUP(RC[-9],Sheet1!R2C1:R28C6,6,FALSE) -> 灵性精粹
A825: 24 | B825: btn_pvp | C825: 34 | D825: 1 | E825: 2600 | F825: 10022 | G825: 15 | H825: =VLOOKUP(RC[-7],Sheet1!R2C1:R28C4,2,FALSE)&VLOOKUP(RC[-7],Sheet1!R2C1:R28C4,3,FALSE)&IF(VLOOKUP(RC[-7],Sheet1!R2C1:R28C4,4,FALSE)="品",VLOOKUP(RC[-3],Sheet1!R2C8:R6C9,2,FALSE),RC[-3])&VLOOKUP(RC[-7],Sheet1!R2C1:R28C4,4,FALSE) -> 英雄对决累计战斗2600场 | I825: 72 | J825: =VLOOKUP(RC[-9],Sheet1!R2C1:R28C6,6,FALSE) -> 灵性精粹
A826: 24 | B826: btn_pvp | C826: 35 | D826: 1 | E826: 2700 | F826: 10022 | G826: 15 | H826: =VLOOKUP(RC[-7],Sheet1!R2C1:R28C4,2,FALSE)&VLOOKUP(RC[-7],Sheet1!R2C1:R28C4,3,FALSE)&IF(VLOOKUP(RC[-7],Sheet1!R2C1:R28C4,4,FALSE)="品",VLOOKUP(RC[-3],Sheet1!R2C8:R6C9,2,FALSE),RC[-3])&VLOOKUP(RC[-7],Sheet1!R2C1:R28C4,4,FALSE) -> 英雄对决累计战斗2700场 | I826: 72 | J826: =VLOOKUP(RC[-9],Sheet1!R2C1:R28C6,6,FALSE) -> 灵性精粹
A827: 24 | B827: btn_pvp | C827: 36 | D827: 1 | E827: 2800 | F827: 10022 | G827: 15 | H827: =VLOOKUP(RC[-7],Sheet1!R2C1:R28C4,2,FALSE)&VLOOKUP(RC[-7],Sheet1!R2C1:R28C4,3,FALSE)&IF(VLOOKUP(RC[-7],Sheet1!R2C1:R28C4,4,FALSE)="品",VLOOKUP(RC[-3],Sheet1!R2C8:R6C9,2,FALSE),RC[-3])&VLOOKUP(RC[-7],Sheet1!R2C1:R28C4,4,FALSE) -> 英雄对决累计战斗2800场 | I827: 72 | J827: =VLOOKUP(RC[-9],Sheet1!R2C1:R28C6,6,FALSE) -> 灵性精粹
A828: 24 | B828: btn_pvp | C828: 37 | D828: 1 | E828: 2900 | F828: 10022 | G828: 15 | H828: =VLOOKUP(RC[-7],Sheet1!R2C1:R28C4,2,FALSE)&VLOOKUP(RC[-7],Sheet1!R2C1:R28C4,3,FALSE)&IF(VLOOKUP(RC[-7],Sheet1!R2C1:R28C4,4,FALSE)="品",VLOOKUP(RC[-3],Sheet1!R2C8:R6C9,2,FALSE),RC[-3])&VLOOKUP(RC[-7],Sheet1!R2C1:R28C4,4,FALSE) -> 英雄对决累计战斗2900场 | I828: 72 | J828: =VLOOKUP(RC[-9],Sheet1!R2C1:R28C6,6,FALSE) -> 灵性精粹
A829: 24 | B829: btn_pvp | C829: 38 | D829: 1 | E829: 3000 | F829: 10022 | G829: 15 | H829: =VLOOKUP(RC[-7],Sheet1!R2C1:R28C4,2,FALSE)&VLOOKUP(RC[-7],Sheet1!R2C1:R28C4,3,FALSE)&IF(VLOOKUP(RC[-7],Sheet1!R2C1:R28C4,4,FALSE)="品",VLOOKUP(RC[-3],Sheet1!R2C8:R6C9,2,FALSE),RC[-3])&VLOOKUP(RC[-7],Sheet1!R2C1:R28C4,4,FALSE) -> 英雄对决累计战斗3000场 | I829: 72 | J829: =VLOOKUP(RC[-9],Sheet1!R2C1:R28C6,6,FALSE) -> 灵性精粹
A830: 24 | B830: btn_pvp | C830: 39 | D830: 1 | E830: 3100 | F830: 10022 | G830: 15 | H830: =VLOOKUP(RC[-7],Sheet1!R2C1:R28C4,2,FALSE)&VLOOKUP(RC[-7],Sheet1!R2C1:R28C4,3,FALSE)&IF(VLOOKUP(RC[-7],Sheet1!R2C1:R28C4,4,FALSE)="品",VLOOKUP(RC[-3],Sheet1!R2C8:R6C9,2,FALSE),RC[-3])&VLOOKUP(RC[-7],Sheet1!R2C1:R28C4,4,FALSE) -> 英雄对决累计战斗3100场 | I830: 72 | J830: =VLOOKUP(RC[-9],Sheet1!R2C1:R28C6,6,FALSE) -> 灵性精粹
A831: 24 | B831: btn_pvp | C831: 40 | D831: 1 | E831: 3200 | F831: 10022 | G831: 15 | H831: =VLOOKUP(RC[-7],Sheet1!R2C1:R28C4,2,FALSE)&VLOOKUP(RC[-7],Sheet1!R2C1:R28C4,3,FALSE)&IF(VLOOKUP(RC[-7],Sheet1!R2C1:R28C4,4,FALSE)="品",VLOOKUP(RC[-3],Sheet1!R2C8:R6C9,2,FALSE),RC[-3])&VLOOKUP(RC[-7],Sheet1!R2C1:R28C4,4,FALSE) -> 英雄对决累计战斗3200场 | I831: 72 | J831: =VLOOKUP(RC[-9],Sheet1!R2C1:R28C6,6,FALSE) -> 灵性精粹
A832: 24 | B832: btn_pvp | C832: 41 | D832: 1 | E832: 3300 | F832: 10022 | G832: 15 | H832: =VLOOKUP(RC[-7],Sheet1!R2C1:R28C4,2,FALSE)&VLOOKUP(RC[-7],Sheet1!R2C1:R28C4,3,FALSE)&IF(VLOOKUP(RC[-7],Sheet1!R2C1:R28C4,4,FALSE)="品",VLOOKUP(RC[-3],Sheet1!R2C8:R6C9,2,FALSE),RC[-3])&VLOOKUP(RC[-7],Sheet1!R2C1:R28C4,4,FALSE) -> 英雄对决累计战斗3300场 | I832: 72 | J832: =VLOOKUP(RC[-9],Sheet1!R2C1:R28C6,6,FALSE) -> 灵性精粹
A833: 24 | B833: btn_pvp | C833: 42 | D833: 1 | E833: 3400 | F833: 10022 | G833: 15 | H833: =VLOOKUP(RC[-7],Sheet1!R2C1:R28C4,2,FALSE)&VLOOKUP(RC[-7],Sheet1!R2C1:R28C4,3,FALSE)&IF(VLOOKUP(RC[-7],Sheet1!R2C1:R28C4,4,FALSE)="品",VLOOKUP(RC[-3],Sheet1!R2C8:R6C9,2,FALSE),RC[-3])&VLOOKUP(RC[-7],Sheet1!R2C1:R28C4,4,FALSE) -> 英雄对决累计战斗3400场 | I833: 72 | J833: =VLOOKUP(RC[-9],Sheet1!R2C1:R28C6,6,FALSE) -> 灵性精粹
A834: 24 | B834: btn_pvp | C834: 43 | D834: 1 | E834: 3500 | F834: 10022 | G834: 15 | H834: =VLOOKUP(RC[-7],Sheet1!R2C1:R28C4,2,FALSE)&VLOOKUP(RC[-7],Sheet1!R2C1:R28C4,3,FALSE)&IF(VLOOKUP(RC[-7],Sheet1!R2C1:R28C4,4,FALSE)="品",VLOOKUP(RC[-3],Sheet1!R2C8:R6C9,2,FALSE),RC[-3])&VLOOKUP(RC[-7],Sheet1!R2C1:R28C4,4,FALSE) -> 英雄对决累计战斗3500场 | I834: 72 | J834: =VLOOKUP(RC[-9],Sheet1!R2C1:R28C6,6,FALSE) -> 灵性精粹
A835: 24 | B835: btn_pvp | C835: 44 | D835: 1 | E835: 3600 | F835: 10022 | G835: 15 | H835: =VLOOKUP(RC[-7],Sheet1!R2C1:R28C4,2,FALSE)&VLOOKUP(RC[-7],Sheet1!R2C1:R28C4,3,FALSE)&IF(VLOOKUP(RC[-7],Sheet1!R2C1:R28C4,4,FALSE)="品",VLOOKUP(RC[-3],Sheet1!R2C8:R6C9,2,FALSE),RC[-3])&VLOOKUP(RC[-7],Sheet1!R2C1:R28C4,4,FALSE) -> 英雄对决累计战斗3600场 | I835: 72 | J835: =VLOOKUP(RC[-9],Sheet1!R2C1:R28C6,6,FALSE) -> 灵性精粹
A836: 24 | B836: btn_pvp | C836: 45 | D836: 1 | E836: 3700 | F836: 10022 | G836: 15 | H836: =VLOOKUP(RC[-7],Sheet1!R2C1:R28C4,2,FALSE)&VLOOKUP(RC[-7],Sheet1!R2C1:R28C4,3,FALSE)&IF(VLOOKUP(RC[-7],Sheet1!R2C1:R28C4,4,FALSE)="品",VLOOKUP(RC[-3],Sheet1!R2C8:R6C9,2,FALSE),RC[-3])&VLOOKUP(RC[-7],Sheet1!R2C1:R28C4,4,FALSE) -> 英雄对决累计战斗3700场 | I836: 72 | J836: =VLOOKUP(RC[-9],Sheet1!R2C1:R28C6,6,FALSE) -> 灵性精粹
A837: 24 | B837: btn_pvp | C837: 46 | D837: 1 | E837: 3800 | F837: 10022 | G837: 15 | H837: =VLOOKUP(RC[-7],Sheet1!R2C1:R28C4,2,FALSE)&VLOOKUP(RC[-7],Sheet1!R2C1:R28C4,3,FALSE)&IF(VLOOKUP(RC[-7],Sheet1!R2C1:R28C4,4,FALSE)="品",VLOOKUP(RC[-3],Sheet1!R2C8:R6C9,2,FALSE),RC[-3])&VLOOKUP(RC[-7],Sheet1!R2C1:R28C4,4,FALSE) -> 英雄对决累计战斗3800场 | I837: 72 | J837: =VLOOKUP(RC[-9],Sheet1!R2C1:R28C6,6,FALSE) -> 灵性精粹
A838: 24 | B838: btn_pvp | C838: 47 | D838: 1 | E838: 3900 | F838: 10022 | G838: 15 | H838: =VLOOKUP(RC[-7],Sheet1!R2C1:R28C4,2,FALSE)&VLOOKUP(RC[-7],Sheet1!R2C1:R28C4,3,FALSE)&IF(VLOOKUP(RC[-7],Sheet1!R2C1:R28C4,4,FALSE)="品",VLOOKUP(RC[-3],Sheet1!R2C8:R6C9,2,FALSE),RC[-3])&VLOOKUP(RC[-7],Sheet1!R2C1:R28C4,4,FALSE) -> 英雄对决累计战斗3900场 | I838: 72 | J838: =VLOOKUP(RC[-9],Sheet1!R2C1:R28C6,6,FALSE) -> 灵性精粹
A839: 24 | B839: btn_pvp | C839: 48 | D839: 1 | E839: 4000 | F839: 10022 | G839: 15 | H839: =VLOOKUP(RC[-7],Sheet1!R2C1:R28C4,2,FALSE)&VLOOKUP(RC[-7],Sheet1!R2C1:R28C4,3,FALSE)&IF(VLOOKUP(RC[-7],Sheet1!R2C1:R28C4,4,FALSE)="品",VLOOKUP(RC[-3],Sheet1!R2C8:R6C9,2,FALSE),RC[-3])&VLOOKUP(RC[-7],Sheet1!R2C1:R28C4,4,FALSE) -> 英雄对决累计战斗4000场 | I839: 72 | J839: =VLOOKUP(RC[-9],Sheet1!R2C1:R28C6,6,FALSE) -> 灵性精粹
A840: 24 | B840: btn_pvp | C840: 49 | D840: 1 | E840: 4100 | F840: 10022 | G840: 15 | H840: =VLOOKUP(RC[-7],Sheet1!R2C1:R28C4,2,FALSE)&VLOOKUP(RC[-7],Sheet1!R2C1:R28C4,3,FALSE)&IF(VLOOKUP(RC[-7],Sheet1!R2C1:R28C4,4,FALSE)="品",VLOOKUP(RC[-3],Sheet1!R2C8:R6C9,2,FALSE),RC[-3])&VLOOKUP(RC[-7],Sheet1!R2C1:R28C4,4,FALSE) -> 英雄对决累计战斗4100场 | I840: 72 | J840: =VLOOKUP(RC[-9],Sheet1!R2C1:R28C6,6,FALSE) -> 灵性精粹
A841: 24 | B841: btn_pvp | C841: 50 | D841: 1 | E841: 4200 | F841: 10022 | G841: 15 | H841: =VLOOKUP(RC[-7],Sheet1!R2C1:R28C4,2,FALSE)&VLOOKUP(RC[-7],Sheet1!R2C1:R28C4,3,FALSE)&IF(VLOOKUP(RC[-7],Sheet1!R2C1:R28C4,4,FALSE)="品",VLOOKUP(RC[-3],Sheet1!R2C8:R6C9,2,FALSE),RC[-3])&VLOOKUP(RC[-7],Sheet1!R2C1:R28C4,4,FALSE) -> 英雄对决累计战斗4200场 | I841: 72 | J841: =VLOOKUP(RC[-9],Sheet1!R2C1:R28C6,6,FALSE) -> 灵性精粹
A842: 24 | B842: btn_pvp | C842: 51 | D842: 1 | E842: 4300 | F842: 10022 | G842: 15 | H842: =VLOOKUP(RC[-7],Sheet1!R2C1:R28C4,2,FALSE)&VLOOKUP(RC[-7],Sheet1!R2C1:R28C4,3,FALSE)&IF(VLOOKUP(RC[-7],Sheet1!R2C1:R28C4,4,FALSE)="品",VLOOKUP(RC[-3],Sheet1!R2C8:R6C9,2,FALSE),RC[-3])&VLOOKUP(RC[-7],Sheet1!R2C1:R28C4,4,FALSE) -> 英雄对决累计战斗4300场 | I842: 72 | J842: =VLOOKUP(RC[-9],Sheet1!R2C1:R28C6,6,FALSE) -> 灵性精粹
A843: 24 | B843: btn_pvp | C843: 52 | D843: 1 | E843: 4400 | F843: 10022 | G843: 15 | H843: =VLOOKUP(RC[-7],Sheet1!R2C1:R28C4,2,FALSE)&VLOOKUP(RC[-7],Sheet1!R2C1:R28C4,3,FALSE)&IF(VLOOKUP(RC[-7],Sheet1!R2C1:R28C4,4,FALSE)="品",VLOOKUP(RC[-3],Sheet1!R2C8:R6C9,2,FALSE),RC[-3])&VLOOKUP(RC[-7],Sheet1!R2C1:R28C4,4,FALSE) -> 英雄对决累计战斗4400场 | I843: 72 | J843: =VLOOKUP(RC[-9],Sheet1!R2C1:R28C6,6,FALSE) -> 灵性精粹
A844: 24 | B844: btn_pvp | C844: 53 | D844: 1 | E844: 4500 | F844: 10022 | G844: 15 | H844: =VLOOKUP(RC[-7],Sheet1!R2C1:R28C4,2,FALSE)&VLOOKUP(RC[-7],Sheet1!R2C1:R28C4,3,FALSE)&IF(VLOOKUP(RC[-7],Sheet1!R2C1:R28C4,4,FALSE)="品",VLOOKUP(RC[-3],Sheet1!R2C8:R6C9,2,FALSE),RC[-3])&VLOOKUP(RC[-7],Sheet1!R2C1:R28C4,4,FALSE) -> 英雄对决累计战斗4500场 | I844: 72 | J844: =VLOOKUP(RC[-9],Sheet1!R2C1:R28C6,6,FALSE) -> 灵性精粹
A845: 24 | B845: btn_pvp | C845: 54 | D845: 1 | E845: 4600 | F845: 10022 | G845: 15 | H845: =VLOOKUP(RC[-7],Sheet1!R2C1:R28C4,2,FALSE)&VLOOKUP(RC[-7],Sheet1!R2C1:R28C4,3,FALSE)&IF(VLOOKUP(RC[-7],Sheet1!R2C1:R28C4,4,FALSE)="品",VLOOKUP(RC[-3],Sheet1!R2C8:R6C9,2,FALSE),RC[-3])&VLOOKUP(RC[-7],Sheet1!R2C1:R28C4,4,FALSE) -> 英雄对决累计战斗4600场 | I845: 72 | J845: =VLOOKUP(RC[-9],Sheet1!R2C1:R28C6,6,FALSE) -> 灵性精粹
A846: 24 | B846: btn_pvp | C846: 55 | D846: 1 | E846: 4700 | F846: 10022 | G846: 15 | H846: =VLOOKUP(RC[-7],Sheet1!R2C1:R28C4,2,FALSE)&VLOOKUP(RC[-7],Sheet1!R2C1:R28C4,3,FALSE)&IF(VLOOKUP(RC[-7],Sheet1!R2C1:R28C4,4,FALSE)="品",VLOOKUP(RC[-3],Sheet1!R2C8:R6C9,2,FALSE),RC[-3])&VLOOKUP(RC[-7],Sheet1!R2C1:R28C4,4,FALSE) -> 英雄对决累计战斗4700场 | I846: 72 | J846: =VLOOKUP(RC[-9],Sheet1!R2C1:R28C6,6,FALSE) -> 灵性精粹
A847: 24 | B847: btn_pvp | C847: 56 | D847: 1 | E847: 4800 | F847: 10022 | G847: 15 | H847: =VLOOKUP(RC[-7],Sheet1!R2C1:R28C4,2,FALSE)&VLOOKUP(RC[-7],Sheet1!R2C1:R28C4,3,FALSE)&IF(VLOOKUP(RC[-7],Sheet1!R2C1:R28C4,4,FALSE)="品",VLOOKUP(RC[-3],Sheet1!R2C8:R6C9,2,FALSE),RC[-3])&VLOOKUP(RC[-7],Sheet1!R2C1:R28C4,4,FALSE) -> 英雄对决累计战斗4800场 | I847: 72 | J847: =VLOOKUP(RC[-9],Sheet1!R2C1:R28C6,6,FALSE) -> 灵性精粹
A848: 24 | B848: btn_pvp | C848: 57 | D848: 1 | E848: 4900 | F848: 10022 | G848: 15 | H848: =VLOOKUP(RC[-7],Sheet1!R2C1:R28C4,2,FALSE)&VLOOKUP(RC[-7],Sheet1!R2C1:R28C4,3,FALSE)&IF(VLOOKUP(RC[-7],Sheet1!R2C1:R28C4,4,FALSE)="品",VLOOKUP(RC[-3],Sheet1!R2C8:R6C9,2,FALSE),RC[-3])&VLOOKUP(RC[-7],Sheet1!R2C1:R28C4,4,FALSE) -> 英雄对决累计战斗4900场 | I848: 72 | J848: =VLOOKUP(RC[-9],Sheet1!R2C1:R28C6,6,FALSE) -> 灵性精粹
A849: 24 | B849: btn_pvp | C849: 58 | D849: 1 | E849: 5000 | F849: 10022 | G849: 15 | H849: =VLOOKUP(RC[-7],Sheet1!R2C1:R28C4,2,FALSE)&VLOOKUP(RC[-7],Sheet1!R2C1:R28C4,3,FALSE)&IF(VLOOKUP(RC[-7],Sheet1!R2C1:R28C4,4,FALSE)="品",VLOOKUP(RC[-3],Sheet1!R2C8:R6C9,2,FALSE),RC[-3])&VLOOKUP(RC[-7],Sheet1!R2C1:R28C4,4,FALSE) -> 英雄对决累计战斗5000场 | I849: 72 | J849: =VLOOKUP(RC[-9],Sheet1!R2C1:R28C6,6,FALSE) -> 灵性精粹
A850: 25 | B850: btn_battle | C850: 1 | D850: 1 | E850: 1 | F850: 19005 | G850: 20 | H850: =VLOOKUP(RC[-7],Sheet1!R2C1:R28C4,2,FALSE)&VLOOKUP(RC[-7],Sheet1!R2C1:R28C4,3,FALSE)&IF(VLOOKUP(RC[-7],Sheet1!R2C1:R28C4,4,FALSE)="品",VLOOKUP(RC[-3],Sheet1!R2C8:R6C9,2,FALSE),RC[-3])&VLOOKUP(RC[-7],Sheet1!R2C1:R28C4,4,FALSE) -> 无尽深渊战胜第1波怪物 | I850: 88 | J850: =VLOOKUP(RC[-9],Sheet1!R2C1:R28C6,6,FALSE) -> 钻石
A851: 25 | B851: btn_battle | C851: 2 | D851: 1 | E851: 5 | F851: 19005 | G851: 20 | H851: =VLOOKUP(RC[-7],Sheet1!R2C1:R28C4,2,FALSE)&VLOOKUP(RC[-7],Sheet1!R2C1:R28C4,3,FALSE)&IF(VLOOKUP(RC[-7],Sheet1!R2C1:R28C4,4,FALSE)="品",VLOOKUP(RC[-3],Sheet1!R2C8:R6C9,2,FALSE),RC[-3])&VLOOKUP(RC[-7],Sheet1!R2C1:R28C4,4,FALSE) -> 无尽深渊战胜第5波怪物 | I851: 88 | J851: =VLOOKUP(RC[-9],Sheet1!R2C1:R28C6,6,FALSE) -> 钻石
A852: 25 | B852: btn_battle | C852: 3 | D852: 1 | E852: 10 | F852: 19005 | G852: 50 | H852: =VLOOKUP(RC[-7],Sheet1!R2C1:R28C4,2,FALSE)&VLOOKUP(RC[-7],Sheet1!R2C1:R28C4,3,FALSE)&IF(VLOOKUP(RC[-7],Sheet1!R2C1:R28C4,4,FALSE)="品",VLOOKUP(RC[-3],Sheet1!R2C8:R6C9,2,FALSE),RC[-3])&VLOOKUP(RC[-7],Sheet1!R2C1:R28C4,4,FALSE) -> 无尽深渊战胜第10波怪物 | I852: 88 | J852: =VLOOKUP(RC[-9],Sheet1!R2C1:R28C6,6,FALSE) -> 钻石
A853: 25 | B853: btn_battle | C853: 4 | D853: 1 | E853: 15 | F853: 19005 | G853: 50 | H853: =VLOOKUP(RC[-7],Sheet1!R2C1:R28C4,2,FALSE)&VLOOKUP(RC[-7],Sheet1!R2C1:R28C4,3,FALSE)&IF(VLOOKUP(RC[-7],Sheet1!R2C1:R28C4,4,FALSE)="品",VLOOKUP(RC[-3],Sheet1!R2C8:R6C9,2,FALSE),RC[-3])&VLOOKUP(RC[-7],Sheet1!R2C1:R28C4,4,FALSE) -> 无尽深渊战胜第15波怪物 | I853: 88 | J853: =VLOOKUP(RC[-9],Sheet1!R2C1:R28C6,6,FALSE) -> 钻石
A854: 25 | B854: btn_battle | C854: 5 | D854: 1 | E854: 20 | F854: 19005 | G854: 100 | H854: =VLOOKUP(RC[-7],Sheet1!R2C1:R28C4,2,FALSE)&VLOOKUP(RC[-7],Sheet1!R2C1:R28C4,3,FALSE)&IF(VLOOKUP(RC[-7],Sheet1!R2C1:R28C4,4,FALSE)="品",VLOOKUP(RC[-3],Sheet1!R2C8:R6C9,2,FALSE),RC[-3])&VLOOKUP(RC[-7],Sheet1!R2C1:R28C4,4,FALSE) -> 无尽深渊战胜第20波怪物 | I854: 88 | J854: =VLOOKUP(RC[-9],Sheet1!R2C1:R28C6,6,FALSE) -> 钻石
A855: 25 | B855: btn_battle | C855: 6 | D855: 1 | E855: 25 | F855: 19005 | G855: 100 | H855: =VLOOKUP(RC[-7],Sheet1!R2C1:R28C4,2,FALSE)&VLOOKUP(RC[-7],Sheet1!R2C1:R28C4,3,FALSE)&IF(VLOOKUP(RC[-7],Sheet1!R2C1:R28C4,4,FALSE)="品",VLOOKUP(RC[-3],Sheet1!R2C8:R6C9,2,FALSE),RC[-3])&VLOOKUP(RC[-7],Sheet1!R2C1:R28C4,4,FALSE) -> 无尽深渊战胜第25波怪物 | I855: 88 | J855: =VLOOKUP(RC[-9],Sheet1!R2C1:R28C6,6,FALSE) -> 钻石
A856: 25 | B856: btn_battle | C856: 7 | D856: 1 | E856: 30 | F856: 19005 | G856: 150 | H856: =VLOOKUP(RC[-7],Sheet1!R2C1:R28C4,2,FALSE)&VLOOKUP(RC[-7],Sheet1!R2C1:R28C4,3,FALSE)&IF(VLOOKUP(RC[-7],Sheet1!R2C1:R28C4,4,FALSE)="品",VLOOKUP(RC[-3],Sheet1!R2C8:R6C9,2,FALSE),RC[-3])&VLOOKUP(RC[-7],Sheet1!R2C1:R28C4,4,FALSE) -> 无尽深渊战胜第30波怪物 | I856: 88 | J856: =VLOOKUP(RC[-9],Sheet1!R2C1:R28C6,6,FALSE) -> 钻石
A857: 25 | B857: btn_battle | C857: 8 | D857: 1 | E857: 35 | F857: 19005 | G857: 150 | H857: =VLOOKUP(RC[-7],Sheet1!R2C1:R28C4,2,FALSE)&VLOOKUP(RC[-7],Sheet1!R2C1:R28C4,3,FALSE)&IF(VLOOKUP(RC[-7],Sheet1!R2C1:R28C4,4,FALSE)="品",VLOOKUP(RC[-3],Sheet1!R2C8:R6C9,2,FALSE),RC[-3])&VLOOKUP(RC[-7],Sheet1!R2C1:R28C4,4,FALSE) -> 无尽深渊战胜第35波怪物 | I857: 88 | J857: =VLOOKUP(RC[-9],Sheet1!R2C1:R28C6,6,FALSE) -> 钻石
A858: 25 | B858: btn_battle | C858: 9 | D858: 1 | E858: 40 | F858: 19005 | G858: 200 | H858: =VLOOKUP(RC[-7],Sheet1!R2C1:R28C4,2,FALSE)&VLOOKUP(RC[-7],Sheet1!R2C1:R28C4,3,FALSE)&IF(VLOOKUP(RC[-7],Sheet1!R2C1:R28C4,4,FALSE)="品",VLOOKUP(RC[-3],Sheet1!R2C8:R6C9,2,FALSE),RC[-3])&VLOOKUP(RC[-7],Sheet1!R2C1:R28C4,4,FALSE) -> 无尽深渊战胜第40波怪物 | I858: 88 | J858: =VLOOKUP(RC[-9],Sheet1!R2C1:R28C6,6,FALSE) -> 钻石
A859: 25 | B859: btn_battle | C859: 10 | D859: 1 | E859: 45 | F859: 19005 | G859: 200 | H859: =VLOOKUP(RC[-7],Sheet1!R2C1:R28C4,2,FALSE)&VLOOKUP(RC[-7],Sheet1!R2C1:R28C4,3,FALSE)&IF(VLOOKUP(RC[-7],Sheet1!R2C1:R28C4,4,FALSE)="品",VLOOKUP(RC[-3],Sheet1!R2C8:R6C9,2,FALSE),RC[-3])&VLOOKUP(RC[-7],Sheet1!R2C1:R28C4,4,FALSE) -> 无尽深渊战胜第45波怪物 | I859: 88 | J859: =VLOOKUP(RC[-9],Sheet1!R2C1:R28C6,6,FALSE) -> 钻石
A860: 25 | B860: btn_battle | C860: 11 | D860: 1 | E860: 50 | F860: 19005 | G860: 250 | H860: =VLOOKUP(RC[-7],Sheet1!R2C1:R28C4,2,FALSE)&VLOOKUP(RC[-7],Sheet1!R2C1:R28C4,3,FALSE)&IF(VLOOKUP(RC[-7],Sheet1!R2C1:R28C4,4,FALSE)="品",VLOOKUP(RC[-3],Sheet1!R2C8:R6C9,2,FALSE),RC[-3])&VLOOKUP(RC[-7],Sheet1!R2C1:R28C4,4,FALSE) -> 无尽深渊战胜第50波怪物 | I860: 88 | J860: =VLOOKUP(RC[-9],Sheet1!R2C1:R28C6,6,FALSE) -> 钻石
A861: 25 | B861: btn_battle | C861: 12 | D861: 1 | E861: 55 | F861: 19005 | G861: 250 | H861: =VLOOKUP(RC[-7],Sheet1!R2C1:R28C4,2,FALSE)&VLOOKUP(RC[-7],Sheet1!R2C1:R28C4,3,FALSE)&IF(VLOOKUP(RC[-7],Sheet1!R2C1:R28C4,4,FALSE)="品",VLOOKUP(RC[-3],Sheet1!R2C8:R6C9,2,FALSE),RC[-3])&VLOOKUP(RC[-7],Sheet1!R2C1:R28C4,4,FALSE) -> 无尽深渊战胜第55波怪物 | I861: 88 | J861: =VLOOKUP(RC[-9],Sheet1!R2C1:R28C6,6,FALSE) -> 钻石
A862: 25 | B862: btn_battle | C862: 13 | D862: 1 | E862: 60 | F862: 19005 | G862: 300 | H862: =VLOOKUP(RC[-7],Sheet1!R2C1:R28C4,2,FALSE)&VLOOKUP(RC[-7],Sheet1!R2C1:R28C4,3,FALSE)&IF(VLOOKUP(RC[-7],Sheet1!R2C1:R28C4,4,FALSE)="品",VLOOKUP(RC[-3],Sheet1!R2C8:R6C9,2,FALSE),RC[-3])&VLOOKUP(RC[-7],Sheet1!R2C1:R28C4,4,FALSE) -> 无尽深渊战胜第60波怪物 | I862: 88 | J862: =VLOOKUP(RC[-9],Sheet1!R2C1:R28C6,6,FALSE) -> 钻石
A863: 25 | B863: btn_battle | C863: 14 | D863: 1 | E863: 65 | F863: 19005 | G863: 300 | H863: =VLOOKUP(RC[-7],Sheet1!R2C1:R28C4,2,FALSE)&VLOOKUP(RC[-7],Sheet1!R2C1:R28C4,3,FALSE)&IF(VLOOKUP(RC[-7],Sheet1!R2C1:R28C4,4,FALSE)="品",VLOOKUP(RC[-3],Sheet1!R2C8:R6C9,2,FALSE),RC[-3])&VLOOKUP(RC[-7],Sheet1!R2C1:R28C4,4,FALSE) -> 无尽深渊战胜第65波怪物 | I863: 88 | J863: =VLOOKUP(RC[-9],Sheet1!R2C1:R28C6,6,FALSE) -> 钻石
A864: 25 | B864: btn_battle | C864: 15 | D864: 1 | E864: 70 | F864: 19005 | G864: 300 | H864: =VLOOKUP(RC[-7],Sheet1!R2C1:R28C4,2,FALSE)&VLOOKUP(RC[-7],Sheet1!R2C1:R28C4,3,FALSE)&IF(VLOOKUP(RC[-7],Sheet1!R2C1:R28C4,4,FALSE)="品",VLOOKUP(RC[-3],Sheet1!R2C8:R6C9,2,FALSE),RC[-3])&VLOOKUP(RC[-7],Sheet1!R2C1:R28C4,4,FALSE) -> 无尽深渊战胜第70波怪物 | I864: 88 | J864: =VLOOKUP(RC[-9],Sheet1!R2C1:R28C6,6,FALSE) -> 钻石
A865: 25 | B865: btn_battle | C865: 16 | D865: 1 | E865: 75 | F865: 19005 | G865: 300 | H865: =VLOOKUP(RC[-7],Sheet1!R2C1:R28C4,2,FALSE)&VLOOKUP(RC[-7],Sheet1!R2C1:R28C4,3,FALSE)&IF(VLOOKUP(RC[-7],Sheet1!R2C1:R28C4,4,FALSE)="品",VLOOKUP(RC[-3],Sheet1!R2C8:R6C9,2,FALSE),RC[-3])&VLOOKUP(RC[-7],Sheet1!R2C1:R28C4,4,FALSE) -> 无尽深渊战胜第75波怪物 | I865: 88 | J865: =VLOOKUP(RC[-9],Sheet1!R2C1:R28C6,6,FALSE) -> 钻石
A866: 25 | B866: btn_battle | C866: 17 | D866: 1 | E866: 80 | F866: 19005 | G866: 300 | H866: =VLOOKUP(RC[-7],Sheet1!R2C1:R28C4,2,FALSE)&VLOOKUP(RC[-7],Sheet1!R2C1:R28C4,3,FALSE)&IF(VLOOKUP(RC[-7],Sheet1!R2C1:R28C4,4,FALSE)="品",VLOOKUP(RC[-3],Sheet1!R2C8:R6C9,2,FALSE),RC[-3])&VLOOKUP(RC[-7],Sheet1!R2C1:R28C4,4,FALSE) -> 无尽深渊战胜第80波怪物 | I866: 88 | J866: =VLOOKUP(RC[-9],Sheet1!R2C1:R28C6,6,FALSE) -> 钻石
A867: 25 | B867: btn_battle | C867: 18 | D867: 1 | E867: 85 | F867: 19005 | G867: 300 | H867: =VLOOKUP(RC[-7],Sheet1!R2C1:R28C4,2,FALSE)&VLOOKUP(RC[-7],Sheet1!R2C1:R28C4,3,FALSE)&IF(VLOOKUP(RC[-7],Sheet1!R2C1:R28C4,4,FALSE)="品",VLOOKUP(RC[-3],Sheet1!R2C8:R6C9,2,FALSE),RC[-3])&VLOOKUP(RC[-7],Sheet1!R2C1:R28C4,4,FALSE) -> 无尽深渊战胜第85波怪物 | I867: 88 | J867: =VLOOKUP(RC[-9],Sheet1!R2C1:R28C6,6,FALSE) -> 钻石
A868: 25 | B868: btn_battle | C868: 19 | D868: 1 | E868: 90 | F868: 19005 | G868: 300 | H868: =VLOOKUP(RC[-7],Sheet1!R2C1:R28C4,2,FALSE)&VLOOKUP(RC[-7],Sheet1!R2C1:R28C4,3,FALSE)&IF(VLOOKUP(RC[-7],Sheet1!R2C1:R28C4,4,FALSE)="品",VLOOKUP(RC[-3],Sheet1!R2C8:R6C9,2,FALSE),RC[-3])&VLOOKUP(RC[-7],Sheet1!R2C1:R28C4,4,FALSE) -> 无尽深渊战胜第90波怪物 | I868: 88 | J868: =VLOOKUP(RC[-9],Sheet1!R2C1:R28C6,6,FALSE) -> 钻石
A869: 25 | B869: btn_battle | C869: 20 | D869: 1 | E869: 95 | F869: 19005 | G869: 300 | H869: =VLOOKUP(RC[-7],Sheet1!R2C1:R28C4,2,FALSE)&VLOOKUP(RC[-7],Sheet1!R2C1:R28C4,3,FALSE)&IF(VLOOKUP(RC[-7],Sheet1!R2C1:R28C4,4,FALSE)="品",VLOOKUP(RC[-3],Sheet1!R2C8:R6C9,2,FALSE),RC[-3])&VLOOKUP(RC[-7],Sheet1!R2C1:R28C4,4,FALSE) -> 无尽深渊战胜第95波怪物 | I869: 88 | J869: =VLOOKUP(RC[-9],Sheet1!R2C1:R28C6,6,FALSE) -> 钻石
A870: 25 | B870: btn_battle | C870: 21 | D870: 1 | E870: 100 | F870: 19005 | G870: 300 | H870: =VLOOKUP(RC[-7],Sheet1!R2C1:R28C4,2,FALSE)&VLOOKUP(RC[-7],Sheet1!R2C1:R28C4,3,FALSE)&IF(VLOOKUP(RC[-7],Sheet1!R2C1:R28C4,4,FALSE)="品",VLOOKUP(RC[-3],Sheet1!R2C8:R6C9,2,FALSE),RC[-3])&VLOOKUP(RC[-7],Sheet1!R2C1:R28C4,4,FALSE) -> 无尽深渊战胜第100波怪物 | I870: 88 | J870: =VLOOKUP(RC[-9],Sheet1!R2C1:R28C6,6,FALSE) -> 钻石
A871: 25 | B871: btn_battle | C871: 22 | D871: 1 | E871: 105 | F871: 19005 | G871: 300 | H871: =VLOOKUP(RC[-7],Sheet1!R2C1:R28C4,2,FALSE)&VLOOKUP(RC[-7],Sheet1!R2C1:R28C4,3,FALSE)&IF(VLOOKUP(RC[-7],Sheet1!R2C1:R28C4,4,FALSE)="品",VLOOKUP(RC[-3],Sheet1!R2C8:R6C9,2,FALSE),RC[-3])&VLOOKUP(RC[-7],Sheet1!R2C1:R28C4,4,FALSE) -> 无尽深渊战胜第105波怪物 | I871: 88 | J871: =VLOOKUP(RC[-9],Sheet1!R2C1:R28C6,6,FALSE) -> 钻石
A872: 25 | B872: btn_battle | C872: 23 | D872: 1 | E872: 110 | F872: 19005 | G872: 300 | H872: =VLOOKUP(RC[-7],Sheet1!R2C1:R28C4,2,FALSE)&VLOOKUP(RC[-7],Sheet1!R2C1:R28C4,3,FALSE)&IF(VLOOKUP(RC[-7],Sheet1!R2C1:R28C4,4,FALSE)="品",VLOOKUP(RC[-3],Sheet1!R2C8:R6C9,2,FALSE),RC[-3])&VLOOKUP(RC[-7],Sheet1!R2C1:R28C4,4,FALSE) -> 无尽深渊战胜第110波怪物 | I872: 88 | J872: =VLOOKUP(RC[-9],Sheet1!R2C1:R28C6,6,FALSE) -> 钻石
A873: 25 | B873: btn_battle | C873: 24 | D873: 1 | E873: 115 | F873: 19005 | G873: 300 | H873: =VLOOKUP(RC[-7],Sheet1!R2C1:R28C4,2,FALSE)&VLOOKUP(RC[-7],Sheet1!R2C1:R28C4,3,FALSE)&IF(VLOOKUP(RC[-7],Sheet1!R2C1:R28C4,4,FALSE)="品",VLOOKUP(RC[-3],Sheet1!R2C8:R6C9,2,FALSE),RC[-3])&VLOOKUP(RC[-7],Sheet1!R2C1:R28C4,4,FALSE) -> 无尽深渊战胜第115波怪物 | I873: 88 | J873: =VLOOKUP(RC[-9],Sheet1!R2C1:R28C6,6,FALSE) -> 钻石
A874: 25 | B874: btn_battle | C874: 25 | D874: 1 | E874: 120 | F874: 19005 | G874: 300 | H874: =VLOOKUP(RC[-7],Sheet1!R2C1:R28C4,2,FALSE)&VLOOKUP(RC[-7],Sheet1!R2C1:R28C4,3,FALSE)&IF(VLOOKUP(RC[-7],Sheet1!R2C1:R28C4,4,FALSE)="品",VLOOKUP(RC[-3],Sheet1!R2C8:R6C9,2,FALSE),RC[-3])&VLOOKUP(RC[-7],Sheet1!R2C1:R28C4,4,FALSE) -> 无尽深渊战胜第120波怪物 | I874: 88 | J874: =VLOOKUP(RC[-9],Sheet1!R2C1:R28C6,6,FALSE) -> 钻石
A875: 25 | B875: btn_battle | C875: 26 | D875: 1 | E875: 125 | F875: 19005 | G875: 300 | H875: =VLOOKUP(RC[-7],Sheet1!R2C1:R28C4,2,FALSE)&VLOOKUP(RC[-7],Sheet1!R2C1:R28C4,3,FALSE)&IF(VLOOKUP(RC[-7],Sheet1!R2C1:R28C4,4,FALSE)="品",VLOOKUP(RC[-3],Sheet1!R2C8:R6C9,2,FALSE),RC[-3])&VLOOKUP(RC[-7],Sheet1!R2C1:R28C4,4,FALSE) -> 无尽深渊战胜第125波怪物 | I875: 88 | J875: =VLOOKUP(RC[-9],Sheet1!R2C1:R28C6,6,FALSE) -> 钻石
A876: 25 | B876: btn_battle | C876: 27 | D876: 1 | E876: 130 | F876: 19005 | G876: 300 | H876: =VLOOKUP(RC[-7],Sheet1!R2C1:R28C4,2,FALSE)&VLOOKUP(RC[-7],Sheet1!R2C1:R28C4,3,FALSE)&IF(VLOOKUP(RC[-7],Sheet1!R2C1:R28C4,4,FALSE)="品",VLOOKUP(RC[-3],Sheet1!R2C8:R6C9,2,FALSE),RC[-3])&VLOOKUP(RC[-7],Sheet1!R2C1:R28C4,4,FALSE) -> 无尽深渊战胜第130波怪物 | I876: 88 | J876: =VLOOKUP(RC[-9],Sheet1!R2C1:R28C6,6,FALSE) -> 钻石
A877: 25 | B877: btn_battle | C877: 28 | D877: 1 | E877: 135 | F877: 19005 | G877: 300 | H877: =VLOOKUP(RC[-7],Sheet1!R2C1:R28C4,2,FALSE)&VLOOKUP(RC[-7],Sheet1!R2C1:R28C4,3,FALSE)&IF(VLOOKUP(RC[-7],Sheet1!R2C1:R28C4,4,FALSE)="品",VLOOKUP(RC[-3],Sheet1!R2C8:R6C9,2,FALSE),RC[-3])&VLOOKUP(RC[-7],Sheet1!R2C1:R28C4,4,FALSE) -> 无尽深渊战胜第135波怪物 | I877: 88 | J877: =VLOOKUP(RC[-9],Sheet1!R2C1:R28C6,6,FALSE) -> 钻石
A878: 25 | B878: btn_battle | C878: 29 | D878: 1 | E878: 140 | F878: 19005 | G878: 300 | H878: =VLOOKUP(RC[-7],Sheet1!R2C1:R28C4,2,FALSE)&VLOOKUP(RC[-7],Sheet1!R2C1:R28C4,3,FALSE)&IF(VLOOKUP(RC[-7],Sheet1!R2C1:R28C4,4,FALSE)="品",VLOOKUP(RC[-3],Sheet1!R2C8:R6C9,2,FALSE),RC[-3])&VLOOKUP(RC[-7],Sheet1!R2C1:R28C4,4,FALSE) -> 无尽深渊战胜第140波怪物 | I878: 88 | J878: =VLOOKUP(RC[-9],Sheet1!R2C1:R28C6,6,FALSE) -> 钻石
A879: 25 | B879: btn_battle | C879: 30 | D879: 1 | E879: 145 | F879: 19005 | G879: 300 | H879: =VLOOKUP(RC[-7],Sheet1!R2C1:R28C4,2,FALSE)&VLOOKUP(RC[-7],Sheet1!R2C1:R28C4,3,FALSE)&IF(VLOOKUP(RC[-7],Sheet1!R2C1:R28C4,4,FALSE)="品",VLOOKUP(RC[-3],Sheet1!R2C8:R6C9,2,FALSE),RC[-3])&VLOOKUP(RC[-7],Sheet1!R2C1:R28C4,4,FALSE) -> 无尽深渊战胜第145波怪物 | I879: 88 | J879: =VLOOKUP(RC[-9],Sheet1!R2C1:R28C6,6,FALSE) -> 钻石
A880: 25 | B880: btn_battle | C880: 31 | D880: 1 | E880: 150 | F880: 19005 | G880: 300 | H880: =VLOOKUP(RC[-7],Sheet1!R2C1:R28C4,2,FALSE)&VLOOKUP(RC[-7],Sheet1!R2C1:R28C4,3,FALSE)&IF(VLOOKUP(RC[-7],Sheet1!R2C1:R28C4,4,FALSE)="品",VLOOKUP(RC[-3],Sheet1!R2C8:R6C9,2,FALSE),RC[-3])&VLOOKUP(RC[-7],Sheet1!R2C1:R28C4,4,FALSE) -> 无尽深渊战胜第150波怪物 | I880: 88 | J880: =VLOOKUP(RC[-9],Sheet1!R2C1:R28C6,6,FALSE) -> 钻石
A881: 25 | B881: btn_battle | C881: 32 | D881: 1 | E881: 155 | F881: 19005 | G881: 300 | H881: =VLOOKUP(RC[-7],Sheet1!R2C1:R28C4,2,FALSE)&VLOOKUP(RC[-7],Sheet1!R2C1:R28C4,3,FALSE)&IF(VLOOKUP(RC[-7],Sheet1!R2C1:R28C4,4,FALSE)="品",VLOOKUP(RC[-3],Sheet1!R2C8:R6C9,2,FALSE),RC[-3])&VLOOKUP(RC[-7],Sheet1!R2C1:R28C4,4,FALSE) -> 无尽深渊战胜第155波怪物 | I881: 88 | J881: =VLOOKUP(RC[-9],Sheet1!R2C1:R28C6,6,FALSE) -> 钻石
A882: 25 | B882: btn_battle | C882: 33 | D882: 1 | E882: 160 | F882: 19005 | G882: 300 | H882: =VLOOKUP(RC[-7],Sheet1!R2C1:R28C4,2,FALSE)&VLOOKUP(RC[-7],Sheet1!R2C1:R28C4,3,FALSE)&IF(VLOOKUP(RC[-7],Sheet1!R2C1:R28C4,4,FALSE)="品",VLOOKUP(RC[-3],Sheet1!R2C8:R6C9,2,FALSE),RC[-3])&VLOOKUP(RC[-7],Sheet1!R2C1:R28C4,4,FALSE) -> 无尽深渊战胜第160波怪物 | I882: 88 | J882: =VLOOKUP(RC[-9],Sheet1!R2C1:R28C6,6,FALSE) -> 钻石
A883: 25 | B883: btn_battle | C883: 34 | D883: 1 | E883: 165 | F883: 19005 | G883: 300 | H883: =VLOOKUP(RC[-7],Sheet1!R2C1:R28C4,2,FALSE)&VLOOKUP(RC[-7],Sheet1!R2C1:R28C4,3,FALSE)&IF(VLOOKUP(RC[-7],Sheet1!R2C1:R28C4,4,FALSE)="品",VLOOKUP(RC[-3],Sheet1!R2C8:R6C9,2,FALSE),RC[-3])&VLOOKUP(RC[-7],Sheet1!R2C1:R28C4,4,FALSE) -> 无尽深渊战胜第165波怪物 | I883: 88 | J883: =VLOOKUP(RC[-9],Sheet1!R2C1:R28C6,6,FALSE) -> 钻石
A884: 25 | B884: btn_battle | C884: 35 | D884: 1 | E884: 170 | F884: 19005 | G884: 300 | H884: =VLOOKUP(RC[-7],Sheet1!R2C1:R28C4,2,FALSE)&VLOOKUP(RC[-7],Sheet1!R2C1:R28C4,3,FALSE)&IF(VLOOKUP(RC[-7],Sheet1!R2C1:R28C4,4,FALSE)="品",VLOOKUP(RC[-3],Sheet1!R2C8:R6C9,2,FALSE),RC[-3])&VLOOKUP(RC[-7],Sheet1!R2C1:R28C4,4,FALSE) -> 无尽深渊战胜第170波怪物 | I884: 88 | J884: =VLOOKUP(RC[-9],Sheet1!R2C1:R28C6,6,FALSE) -> 钻石
A885: 25 | B885: btn_battle | C885: 36 | D885: 1 | E885: 175 | F885: 19005 | G885: 300 | H885: =VLOOKUP(RC[-7],Sheet1!R2C1:R28C4,2,FALSE)&VLOOKUP(RC[-7],Sheet1!R2C1:R28C4,3,FALSE)&IF(VLOOKUP(RC[-7],Sheet1!R2C1:R28C4,4,FALSE)="品",VLOOKUP(RC[-3],Sheet1!R2C8:R6C9,2,FALSE),RC[-3])&VLOOKUP(RC[-7],Sheet1!R2C1:R28C4,4,FALSE) -> 无尽深渊战胜第175波怪物 | I885: 88 | J885: =VLOOKUP(RC[-9],Sheet1!R2C1:R28C6,6,FALSE) -> 钻石
A886: 25 | B886: btn_battle | C886: 37 | D886: 1 | E886: 180 | F886: 19005 | G886: 300 | H886: =VLOOKUP(RC[-7],Sheet1!R2C1:R28C4,2,FALSE)&VLOOKUP(RC[-7],Sheet1!R2C1:R28C4,3,FALSE)&IF(VLOOKUP(RC[-7],Sheet1!R2C1:R28C4,4,FALSE)="品",VLOOKUP(RC[-3],Sheet1!R2C8:R6C9,2,FALSE),RC[-3])&VLOOKUP(RC[-7],Sheet1!R2C1:R28C4,4,FALSE) -> 无尽深渊战胜第180波怪物 | I886: 88 | J886: =VLOOKUP(RC[-9],Sheet1!R2C1:R28C6,6,FALSE) -> 钻石
A887: 25 | B887: btn_battle | C887: 38 | D887: 1 | E887: 185 | F887: 19005 | G887: 300 | H887: =VLOOKUP(RC[-7],Sheet1!R2C1:R28C4,2,FALSE)&VLOOKUP(RC[-7],Sheet1!R2C1:R28C4,3,FALSE)&IF(VLOOKUP(RC[-7],Sheet1!R2C1:R28C4,4,FALSE)="品",VLOOKUP(RC[-3],Sheet1!R2C8:R6C9,2,FALSE),RC[-3])&VLOOKUP(RC[-7],Sheet1!R2C1:R28C4,4,FALSE) -> 无尽深渊战胜第185波怪物 | I887: 88 | J887: =VLOOKUP(RC[-9],Sheet1!R2C1:R28C6,6,FALSE) -> 钻石
A888: 25 | B888: btn_battle | C888: 39 | D888: 1 | E888: 190 | F888: 19005 | G888: 300 | H888: =VLOOKUP(RC[-7],Sheet1!R2C1:R28C4,2,FALSE)&VLOOKUP(RC[-7],Sheet1!R2C1:R28C4,3,FALSE)&IF(VLOOKUP(RC[-7],Sheet1!R2C1:R28C4,4,FALSE)="品",VLOOKUP(RC[-3],Sheet1!R2C8:R6C9,2,FALSE),RC[-3])&VLOOKUP(RC[-7],Sheet1!R2C1:R28C4,4,FALSE) -> 无尽深渊战胜第190波怪物 | I888: 88 | J888: =VLOOKUP(RC[-9],Sheet1!R2C1:R28C6,6,FALSE) -> 钻石
A889: 25 | B889: btn_battle | C889: 40 | D889: 1 | E889: 195 | F889: 19005 | G889: 300 | H889: =VLOOKUP(RC[-7],Sheet1!R2C1:R28C4,2,FALSE)&VLOOKUP(RC[-7],Sheet1!R2C1:R28C4,3,FALSE)&IF(VLOOKUP(RC[-7],Sheet1!R2C1:R28C4,4,FALSE)="品",VLOOKUP(RC[-3],Sheet1!R2C8:R6C9,2,FALSE),RC[-3])&VLOOKUP(RC[-7],Sheet1!R2C1:R28C4,4,FALSE) -> 无尽深渊战胜第195波怪物 | I889: 88 | J889: =VLOOKUP(RC[-9],Sheet1!R2C1:R28C6,6,FALSE) -> 钻石
A890: 25 | B890: btn_battle | C890: 41 | D890: 1 | E890: 200 | F890: 19005 | G890: 300 | H890: =VLOOKUP(RC[-7],Sheet1!R2C1:R28C4,2,FALSE)&VLOOKUP(RC[-7],Sheet1!R2C1:R28C4,3,FALSE)&IF(VLOOKUP(RC[-7],Sheet1!R2C1:R28C4,4,FALSE)="品",VLOOKUP(RC[-3],Sheet1!R2C8:R6C9,2,FALSE),RC[-3])&VLOOKUP(RC[-7],Sheet1!R2C1:R28C4,4,FALSE) -> 无尽深渊战胜第200波怪物 | I890: 88 | J890: =VLOOKUP(RC[-9],Sheet1!R2C1:R28C6,6,FALSE) -> 钻石
A891: 26 | B891: btn_elf | C891: 1 | D891: 1 | E891: 5 | F891: 13646 | G891: 1 | H891: =VLOOKUP(RC[-7],Sheet1!R2C1:R28C4,2,FALSE)&VLOOKUP(RC[-7],Sheet1!R2C1:R28C4,3,FALSE)&IF(VLOOKUP(RC[-7],Sheet1!R2C1:R28C4,4,FALSE)="品",VLOOKUP(RC[-3],Sheet1!R2C8:R6C9,2,FALSE),RC[-3])&VLOOKUP(RC[-7],Sheet1!R2C1:R28C4,4,FALSE) -> 精灵强化达到5级 | I891: 64 | J891: =VLOOKUP(RC[-9],Sheet1!R2C1:R28C6,6,FALSE) -> 培养材料
A892: 26 | B892: btn_elf | C892: 2 | D892: 1 | E892: 10 | F892: 13646 | G892: 2 | H892: =VLOOKUP(RC[-7],Sheet1!R2C1:R28C4,2,FALSE)&VLOOKUP(RC[-7],Sheet1!R2C1:R28C4,3,FALSE)&IF(VLOOKUP(RC[-7],Sheet1!R2C1:R28C4,4,FALSE)="品",VLOOKUP(RC[-3],Sheet1!R2C8:R6C9,2,FALSE),RC[-3])&VLOOKUP(RC[-7],Sheet1!R2C1:R28C4,4,FALSE) -> 精灵强化达到10级 | I892: 64 | J892: =VLOOKUP(RC[-9],Sheet1!R2C1:R28C6,6,FALSE) -> 培养材料
A893: 26 | B893: btn_elf | C893: 3 | D893: 1 | E893: 15 | F893: 13646 | G893: 3 | H893: =VLOOKUP(RC[-7],Sheet1!R2C1:R28C4,2,FALSE)&VLOOKUP(RC[-7],Sheet1!R2C1:R28C4,3,FALSE)&IF(VLOOKUP(RC[-7],Sheet1!R2C1:R28C4,4,FALSE)="品",VLOOKUP(RC[-3],Sheet1!R2C8:R6C9,2,FALSE),RC[-3])&VLOOKUP(RC[-7],Sheet1!R2C1:R28C4,4,FALSE) -> 精灵强化达到15级 | I893: 64 | J893: =VLOOKUP(RC[-9],Sheet1!R2C1:R28C6,6,FALSE) -> 培养材料
A894: 26 | B894: btn_elf | C894: 4 | D894: 1 | E894: 20 | F894: 13646 | G894: 4 | H894: =VLOOKUP(RC[-7],Sheet1!R2C1:R28C4,2,FALSE)&VLOOKUP(RC[-7],Sheet1!R2C1:R28C4,3,FALSE)&IF(VLOOKUP(RC[-7],Sheet1!R2C1:R28C4,4,FALSE)="品",VLOOKUP(RC[-3],Sheet1!R2C8:R6C9,2,FALSE),RC[-3])&VLOOKUP(RC[-7],Sheet1!R2C1:R28C4,4,FALSE) -> 精灵强化达到20级 | I894: 64 | J894: =VLOOKUP(RC[-9],Sheet1!R2C1:R28C6,6,FALSE) -> 培养材料
A895: 26 | B895: btn_elf | C895: 5 | D895: 1 | E895: 25 | F895: 13646 | G895: 5 | H895: =VLOOKUP(RC[-7],Sheet1!R2C1:R28C4,2,FALSE)&VLOOKUP(RC[-7],Sheet1!R2C1:R28C4,3,FALSE)&IF(VLOOKUP(RC[-7],Sheet1!R2C1:R28C4,4,FALSE)="品",VLOOKUP(RC[-3],Sheet1!R2C8:R6C9,2,FALSE),RC[-3])&VLOOKUP(RC[-7],Sheet1!R2C1:R28C4,4,FALSE) -> 精灵强化达到25级 | I895: 64 | J895: =VLOOKUP(RC[-9],Sheet1!R2C1:R28C6,6,FALSE) -> 培养材料
A896: 26 | B896: btn_elf | C896: 6 | D896: 1 | E896: 30 | F896: 13646 | G896: 5 | H896: =VLOOKUP(RC[-7],Sheet1!R2C1:R28C4,2,FALSE)&VLOOKUP(RC[-7],Sheet1!R2C1:R28C4,3,FALSE)&IF(VLOOKUP(RC[-7],Sheet1!R2C1:R28C4,4,FALSE)="品",VLOOKUP(RC[-3],Sheet1!R2C8:R6C9,2,FALSE),RC[-3])&VLOOKUP(RC[-7],Sheet1!R2C1:R28C4,4,FALSE) -> 精灵强化达到30级 | I896: 64 | J896: =VLOOKUP(RC[-9],Sheet1!R2C1:R28C6,6,FALSE) -> 培养材料
A897: 26 | B897: btn_elf | C897: 7 | D897: 1 | E897: 35 | F897: 13646 | G897: 5 | H897: =VLOOKUP(RC[-7],Sheet1!R2C1:R28C4,2,FALSE)&VLOOKUP(RC[-7],Sheet1!R2C1:R28C4,3,FALSE)&IF(VLOOKUP(RC[-7],Sheet1!R2C1:R28C4,4,FALSE)="品",VLOOKUP(RC[-3],Sheet1!R2C8:R6C9,2,FALSE),RC[-3])&VLOOKUP(RC[-7],Sheet1!R2C1:R28C4,4,FALSE) -> 精灵强化达到35级 | I897: 64 | J897: =VLOOKUP(RC[-9],Sheet1!R2C1:R28C6,6,FALSE) -> 培养材料
A898: 26 | B898: btn_elf | C898: 8 | D898: 1 | E898: 40 | F898: 13646 | G898: 5 | H898: =VLOOKUP(RC[-7],Sheet1!R2C1:R28C4,2,FALSE)&VLOOKUP(RC[-7],Sheet1!R2C1:R28C4,3,FALSE)&IF(VLOOKUP(RC[-7],Sheet1!R2C1:R28C4,4,FALSE)="品",VLOOKUP(RC[-3],Sheet1!R2C8:R6C9,2,FALSE),RC[-3])&VLOOKUP(RC[-7],Sheet1!R2C1:R28C4,4,FALSE) -> 精灵强化达到40级 | I898: 64 | J898: =VLOOKUP(RC[-9],Sheet1!R2C1:R28C6,6,FALSE) -> 培养材料
A899: 26 | B899: btn_elf | C899: 9 | D899: 1 | E899: 45 | F899: 13646 | G899: 5 | H899: =VLOOKUP(RC[-7],Sheet1!R2C1:R28C4,2,FALSE)&VLOOKUP(RC[-7],Sheet1!R2C1:R28C4,3,FALSE)&IF(VLOOKUP(RC[-7],Sheet1!R2C1:R28C4,4,FALSE)="品",VLOOKUP(RC[-3],Sheet1!R2C8:R6C9,2,FALSE),RC[-3])&VLOOKUP(RC[-7],Sheet1!R2C1:R28C4,4,FALSE) -> 精灵强化达到45级 | I899: 64 | J899: =VLOOKUP(RC[-9],Sheet1!R2C1:R28C6,6,FALSE) -> 培养材料
A900: 26 | B900: btn_elf | C900: 10 | D900: 1 | E900: 50 | F900: 13646 | G900: 5 | H900: =VLOOKUP(RC[-7],Sheet1!R2C1:R28C4,2,FALSE)&VLOOKUP(RC[-7],Sheet1!R2C1:R28C4,3,FALSE)&IF(VLOOKUP(RC[-7],Sheet1!R2C1:R28C4,4,FALSE)="品",VLOOKUP(RC[-3],Sheet1!R2C8:R6C9,2,FALSE),RC[-3])&VLOOKUP(RC[-7],Sheet1!R2C1:R28C4,4,FALSE) -> 精灵强化达到50级 | I900: 64 | J900: =VLOOKUP(RC[-9],Sheet1!R2C1:R28C6,6,FALSE) -> 培养材料
A901: 26 | B901: btn_elf | C901: 11 | D901: 1 | E901: 55 | F901: 13646 | G901: 5 | H901: =VLOOKUP(RC[-7],Sheet1!R2C1:R28C4,2,FALSE)&VLOOKUP(RC[-7],Sheet1!R2C1:R28C4,3,FALSE)&IF(VLOOKUP(RC[-7],Sheet1!R2C1:R28C4,4,FALSE)="品",VLOOKUP(RC[-3],Sheet1!R2C8:R6C9,2,FALSE),RC[-3])&VLOOKUP(RC[-7],Sheet1!R2C1:R28C4,4,FALSE) -> 精灵强化达到55级 | I901: 64 | J901: =VLOOKUP(RC[-9],Sheet1!R2C1:R28C6,6,FALSE) -> 培养材料
A902: 26 | B902: btn_elf | C902: 12 | D902: 1 | E902: 60 | F902: 13646 | G902: 5 | H902: =VLOOKUP(RC[-7],Sheet1!R2C1:R28C4,2,FALSE)&VLOOKUP(RC[-7],Sheet1!R2C1:R28C4,3,FALSE)&IF(VLOOKUP(RC[-7],Sheet1!R2C1:R28C4,4,FALSE)="品",VLOOKUP(RC[-3],Sheet1!R2C8:R6C9,2,FALSE),RC[-3])&VLOOKUP(RC[-7],Sheet1!R2C1:R28C4,4,FALSE) -> 精灵强化达到60级 | I902: 64 | J902: =VLOOKUP(RC[-9],Sheet1!R2C1:R28C6,6,FALSE) -> 培养材料
A903: 26 | B903: btn_elf | C903: 13 | D903: 1 | E903: 65 | F903: 13646 | G903: 5 | H903: =VLOOKUP(RC[-7],Sheet1!R2C1:R28C4,2,FALSE)&VLOOKUP(RC[-7],Sheet1!R2C1:R28C4,3,FALSE)&IF(VLOOKUP(RC[-7],Sheet1!R2C1:R28C4,4,FALSE)="品",VLOOKUP(RC[-3],Sheet1!R2C8:R6C9,2,FALSE),RC[-3])&VLOOKUP(RC[-7],Sheet1!R2C1:R28C4,4,FALSE) -> 精灵强化达到65级 | I903: 64 | J903: =VLOOKUP(RC[-9],Sheet1!R2C1:R28C6,6,FALSE) -> 培养材料
A904: 26 | B904: btn_elf | C904: 14 | D904: 1 | E904: 70 | F904: 13646 | G904: 5 | H904: =VLOOKUP(RC[-7],Sheet1!R2C1:R28C4,2,FALSE)&VLOOKUP(RC[-7],Sheet1!R2C1:R28C4,3,FALSE)&IF(VLOOKUP(RC[-7],Sheet1!R2C1:R28C4,4,FALSE)="品",VLOOKUP(RC[-3],Sheet1!R2C8:R6C9,2,FALSE),RC[-3])&VLOOKUP(RC[-7],Sheet1!R2C1:R28C4,4,FALSE) -> 精灵强化达到70级 | I904: 64 | J904: =VLOOKUP(RC[-9],Sheet1!R2C1:R28C6,6,FALSE) -> 培养材料
A905: 26 | B905: btn_elf | C905: 15 | D905: 1 | E905: 75 | F905: 13646 | G905: 5 | H905: =VLOOKUP(RC[-7],Sheet1!R2C1:R28C4,2,FALSE)&VLOOKUP(RC[-7],Sheet1!R2C1:R28C4,3,FALSE)&IF(VLOOKUP(RC[-7],Sheet1!R2C1:R28C4,4,FALSE)="品",VLOOKUP(RC[-3],Sheet1!R2C8:R6C9,2,FALSE),RC[-3])&VLOOKUP(RC[-7],Sheet1!R2C1:R28C4,4,FALSE) -> 精灵强化达到75级 | I905: 64 | J905: =VLOOKUP(RC[-9],Sheet1!R2C1:R28C6,6,FALSE) -> 培养材料
A906: 26 | B906: btn_elf | C906: 16 | D906: 1 | E906: 80 | F906: 13646 | G906: 5 | H906: =VLOOKUP(RC[-7],Sheet1!R2C1:R28C4,2,FALSE)&VLOOKUP(RC[-7],Sheet1!R2C1:R28C4,3,FALSE)&IF(VLOOKUP(RC[-7],Sheet1!R2C1:R28C4,4,FALSE)="品",VLOOKUP(RC[-3],Sheet1!R2C8:R6C9,2,FALSE),RC[-3])&VLOOKUP(RC[-7],Sheet1!R2C1:R28C4,4,FALSE) -> 精灵强化达到80级 | I906: 64 | J906: =VLOOKUP(RC[-9],Sheet1!R2C1:R28C6,6,FALSE) -> 培养材料
A907: 26 | B907: btn_elf | C907: 17 | D907: 1 | E907: 85 | F907: 13646 | G907: 5 | H907: =VLOOKUP(RC[-7],Sheet1!R2C1:R28C4,2,FALSE)&VLOOKUP(RC[-7],Sheet1!R2C1:R28C4,3,FALSE)&IF(VLOOKUP(RC[-7],Sheet1!R2C1:R28C4,4,FALSE)="品",VLOOKUP(RC[-3],Sheet1!R2C8:R6C9,2,FALSE),RC[-3])&VLOOKUP(RC[-7],Sheet1!R2C1:R28C4,4,FALSE) -> 精灵强化达到85级 | I907: 64 | J907: =VLOOKUP(RC[-9],Sheet1!R2C1:R28C6,6,FALSE) -> 培养材料
A908: 26 | B908: btn_elf | C908: 18 | D908: 1 | E908: 90 | F908: 13646 | G908: 5 | H908: =VLOOKUP(RC[-7],Sheet1!R2C1:R28C4,2,FALSE)&VLOOKUP(RC[-7],Sheet1!R2C1:R28C4,3,FALSE)&IF(VLOOKUP(RC[-7],Sheet1!R2C1:R28C4,4,FALSE)="品",VLOOKUP(RC[-3],Sheet1!R2C8:R6C9,2,FALSE),RC[-3])&VLOOKUP(RC[-7],Sheet1!R2C1:R28C4,4,FALSE) -> 精灵强化达到90级 | I908: 64 | J908: =VLOOKUP(RC[-9],Sheet1!R2C1:R28C6,6,FALSE) -> 培养材料
A909: 26 | B909: btn_elf | C909: 19 | D909: 1 | E909: 95 | F909: 13646 | G909: 5 | H909: =VLOOKUP(RC[-7],Sheet1!R2C1:R28C4,2,FALSE)&VLOOKUP(RC[-7],Sheet1!R2C1:R28C4,3,FALSE)&IF(VLOOKUP(RC[-7],Sheet1!R2C1:R28C4,4,FALSE)="品",VLOOKUP(RC[-3],Sheet1!R2C8:R6C9,2,FALSE),RC[-3])&VLOOKUP(RC[-7],Sheet1!R2C1:R28C4,4,FALSE) -> 精灵强化达到95级 | I909: 64 | J909: =VLOOKUP(RC[-9],Sheet1!R2C1:R28C6,6,FALSE) -> 培养材料
A910: 26 | B910: btn_elf | C910: 20 | D910: 1 | E910: 100 | F910: 13646 | G910: 5 | H910: =VLOOKUP(RC[-7],Sheet1!R2C1:R28C4,2,FALSE)&VLOOKUP(RC[-7],Sheet1!R2C1:R28C4,3,FALSE)&IF(VLOOKUP(RC[-7],Sheet1!R2C1:R28C4,4,FALSE)="品",VLOOKUP(RC[-3],Sheet1!R2C8:R6C9,2,FALSE),RC[-3])&VLOOKUP(RC[-7],Sheet1!R2C1:R28C4,4,FALSE) -> 精灵强化达到100级 | I910: 64 | J910: =VLOOKUP(RC[-9],Sheet1!R2C1:R28C6,6,FALSE) -> 培养材料
A911: 27 | B911: btn_elf | C911: 1 | D911: 1 | E911: 1 | F911: 10022 | G911: 10 | H911: =VLOOKUP(RC[-7],Sheet1!R2C1:R28C4,2,FALSE)&VLOOKUP(RC[-7],Sheet1!R2C1:R28C4,3,FALSE)&IF(VLOOKUP(RC[-7],Sheet1!R2C1:R28C4,4,FALSE)="品",VLOOKUP(RC[-3],Sheet1!R2C8:R6C9,2,FALSE),RC[-3])&VLOOKUP(RC[-7],Sheet1!R2C1:R28C4,4,FALSE) -> 精灵升华达到1阶 | I911: 87 | J911: =VLOOKUP(RC[-9],Sheet1!R2C1:R28C6,6,FALSE) -> 灵性精粹
A912: 27 | B912: btn_elf | C912: 2 | D912: 1 | E912: 2 | F912: 10022 | G912: 10 | H912: =VLOOKUP(RC[-7],Sheet1!R2C1:R28C4,2,FALSE)&VLOOKUP(RC[-7],Sheet1!R2C1:R28C4,3,FALSE)&IF(VLOOKUP(RC[-7],Sheet1!R2C1:R28C4,4,FALSE)="品",VLOOKUP(RC[-3],Sheet1!R2C8:R6C9,2,FALSE),RC[-3])&VLOOKUP(RC[-7],Sheet1!R2C1:R28C4,4,FALSE) -> 精灵升华达到2阶 | I912: 87 | J912: =VLOOKUP(RC[-9],Sheet1!R2C1:R28C6,6,FALSE) -> 灵性精粹
A913: 27 | B913: btn_elf | C913: 3 | D913: 1 | E913: 3 | F913: 10022 | G913: 20 | H913: =VLOOKUP(RC[-7],Sheet1!R2C1:R28C4,2,FALSE)&VLOOKUP(RC[-7],Sheet1!R2C1:R28C4,3,FALSE)&IF(VLOOKUP(RC[-7],Sheet1!R2C1:R28C4,4,FALSE)="品",VLOOKUP(RC[-3],Sheet1!R2C8:R6C9,2,FALSE),RC[-3])&VLOOKUP(RC[-7],Sheet1!R2C1:R28C4,4,FALSE) -> 精灵升华达到3阶 | I913: 87 | J913: =VLOOKUP(RC[-9],Sheet1!R2C1:R28C6,6,FALSE) -> 灵性精粹
A914: 27 | B914: btn_elf | C914: 4 | D914: 1 | E914: 4 | F914: 10022 | G914: 20 | H914: =VLOOKUP(RC[-7],Sheet1!R2C1:R28C4,2,FALSE)&VLOOKUP(RC[-7],Sheet1!R2C1:R28C4,3,FALSE)&IF(VLOOKUP(RC[-7],Sheet1!R2C1:R28C4,4,FALSE)="品",VLOOKUP(RC[-3],Sheet1!R2C8:R6C9,2,FALSE),RC[-3])&VLOOKUP(RC[-7],Sheet1!R2C1:R28C4,4,FALSE) -> 精灵升华达到4阶 | I914: 87 | J914: =VLOOKUP(RC[-9],Sheet1!R2C1:R28C6,6,FALSE) -> 灵性精粹
A915: 27 | B915: btn_elf | C915: 5 | D915: 1 | E915: 5 | F915: 10022 | G915: 30 | H915: =VLOOKUP(RC[-7],Sheet1!R2C1:R28C4,2,FALSE)&VLOOKUP(RC[-7],Sheet1!R2C1:R28C4,3,FALSE)&IF(VLOOKUP(RC[-7],Sheet1!R2C1:R28C4,4,FALSE)="品",VLOOKUP(RC[-3],Sheet1!R2C8:R6C9,2,FALSE),RC[-3])&VLOOKUP(RC[-7],Sheet1!R2C1:R28C4,4,FALSE) -> 精灵升华达到5阶 | I915: 87 | J915: =VLOOKUP(RC[-9],Sheet1!R2C1:R28C6,6,FALSE) -> 灵性精粹
A916: 27 | B916: btn_elf | C916: 6 | D916: 1 | E916: 6 | F916: 10022 | G916: 30 | H916: =VLOOKUP(RC[-7],Sheet1!R2C1:R28C4,2,FALSE)&VLOOKUP(RC[-7],Sheet1!R2C1:R28C4,3,FALSE)&IF(VLOOKUP(RC[-7],Sheet1!R2C1:R28C4,4,FALSE)="品",VLOOKUP(RC[-3],Sheet1!R2C8:R6C9,2,FALSE),RC[-3])&VLOOKUP(RC[-7],Sheet1!R2C1:R28C4,4,FALSE) -> 精灵升华达到6阶 | I916: 87 | J916: =VLOOKUP(RC[-9],Sheet1!R2C1:R28C6,6,FALSE) -> 灵性精粹
A917: 27 | B917: btn_elf | C917: 7 | D917: 1 | E917: 7 | F917: 10022 | G917: 40 | H917: =VLOOKUP(RC[-7],Sheet1!R2C1:R28C4,2,FALSE)&VLOOKUP(RC[-7],Sheet1!R2C1:R28C4,3,FALSE)&IF(VLOOKUP(RC[-7],Sheet1!R2C1:R28C4,4,FALSE)="品",VLOOKUP(RC[-3],Sheet1!R2C8:R6C9,2,FALSE),RC[-3])&VLOOKUP(RC[-7],Sheet1!R2C1:R28C4,4,FALSE) -> 精灵升华达到7阶 | I917: 87 | J917: =VLOOKUP(RC[-9],Sheet1!R2C1:R28C6,6,FALSE) -> 灵性精粹
A918: 27 | B918: btn_elf | C918: 8 | D918: 1 | E918: 8 | F918: 10022 | G918: 40 | H918: =VLOOKUP(RC[-7],Sheet1!R2C1:R28C4,2,FALSE)&VLOOKUP(RC[-7],Sheet1!R2C1:R28C4,3,FALSE)&IF(VLOOKUP(RC[-7],Sheet1!R2C1:R28C4,4,FALSE)="品",VLOOKUP(RC[-3],Sheet1!R2C8:R6C9,2,FALSE),RC[-3])&VLOOKUP(RC[-7],Sheet1!R2C1:R28C4,4,FALSE) -> 精灵升华达到8阶 | I918: 87 | J918: =VLOOKUP(RC[-9],Sheet1!R2C1:R28C6,6,FALSE) -> 灵性精粹
A919: 27 | B919: btn_elf | C919: 9 | D919: 1 | E919: 9 | F919: 10022 | G919: 50 | H919: =VLOOKUP(RC[-7],Sheet1!R2C1:R28C4,2,FALSE)&VLOOKUP(RC[-7],Sheet1!R2C1:R28C4,3,FALSE)&IF(VLOOKUP(RC[-7],Sheet1!R2C1:R28C4,4,FALSE)="品",VLOOKUP(RC[-3],Sheet1!R2C8:R6C9,2,FALSE),RC[-3])&VLOOKUP(RC[-7],Sheet1!R2C1:R28C4,4,FALSE) -> 精灵升华达到9阶 | I919: 87 | J919: =VLOOKUP(RC[-9],Sheet1!R2C1:R28C6,6,FALSE) -> 灵性精粹
A920: 27 | B920: btn_elf | C920: 10 | D920: 1 | E920: 10 | F920: 10022 | G920: 50 | H920: =VLOOKUP(RC[-7],Sheet1!R2C1:R28C4,2,FALSE)&VLOOKUP(RC[-7],Sheet1!R2C1:R28C4,3,FALSE)&IF(VLOOKUP(RC[-7],Sheet1!R2C1:R28C4,4,FALSE)="品",VLOOKUP(RC[-3],Sheet1!R2C8:R6C9,2,FALSE),RC[-3])&VLOOKUP(RC[-7],Sheet1!R2C1:R28C4,4,FALSE) -> 精灵升华达到10阶 | I920: 87 | J920: =VLOOKUP(RC[-9],Sheet1!R2C1:R28C6,6,FALSE) -> 灵性精粹
A921: 27 | B921: btn_elf | C921: 11 | D921: 1 | E921: 11 | F921: 10022 | G921: 50 | H921: =VLOOKUP(RC[-7],Sheet1!R2C1:R28C4,2,FALSE)&VLOOKUP(RC[-7],Sheet1!R2C1:R28C4,3,FALSE)&IF(VLOOKUP(RC[-7],Sheet1!R2C1:R28C4,4,FALSE)="品",VLOOKUP(RC[-3],Sheet1!R2C8:R6C9,2,FALSE),RC[-3])&VLOOKUP(RC[-7],Sheet1!R2C1:R28C4,4,FALSE) -> 精灵升华达到11阶 | I921: 87 | J921: =VLOOKUP(RC[-9],Sheet1!R2C1:R28C6,6,FALSE) -> 灵性精粹
A922: 27 | B922: btn_elf | C922: 12 | D922: 1 | E922: 12 | F922: 10022 | G922: 50 | H922: =VLOOKUP(RC[-7],Sheet1!R2C1:R28C4,2,FALSE)&VLOOKUP(RC[-7],Sheet1!R2C1:R28C4,3,FALSE)&IF(VLOOKUP(RC[-7],Sheet1!R2C1:R28C4,4,FALSE)="品",VLOOKUP(RC[-3],Sheet1!R2C8:R6C9,2,FALSE),RC[-3])&VLOOKUP(RC[-7],Sheet1!R2C1:R28C4,4,FALSE) -> 精灵升华达到12阶 | I922: 87 | J922: =VLOOKUP(RC[-9],Sheet1!R2C1:R28C6,6,FALSE) -> 灵性精粹
A923: 27 | B923: btn_elf | C923: 13 | D923: 1 | E923: 13 | F923: 10022 | G923: 50 | H923: =VLOOKUP(RC[-7],Sheet1!R2C1:R28C4,2,FALSE)&VLOOKUP(RC[-7],Sheet1!R2C1:R28C4,3,FALSE)&IF(VLOOKUP(RC[-7],Sheet1!R2C1:R28C4,4,FALSE)="品",VLOOKUP(RC[-3],Sheet1!R2C8:R6C9,2,FALSE),RC[-3])&VLOOKUP(RC[-7],Sheet1!R2C1:R28C4,4,FALSE) -> 精灵升华达到13阶 | I923: 87 | J923: =VLOOKUP(RC[-9],Sheet1!R2C1:R28C6,6,FALSE) -> 灵性精粹
A924: 27 | B924: btn_elf | C924: 14 | D924: 1 | E924: 14 | F924: 10022 | G924: 50 | H924: =VLOOKUP(RC[-7],Sheet1!R2C1:R28C4,2,FALSE)&VLOOKUP(RC[-7],Sheet1!R2C1:R28C4,3,FALSE)&IF(VLOOKUP(RC[-7],Sheet1!R2C1:R28C4,4,FALSE)="品",VLOOKUP(RC[-3],Sheet1!R2C8:R6C9,2,FALSE),RC[-3])&VLOOKUP(RC[-7],Sheet1!R2C1:R28C4,4,FALSE) -> 精灵升华达到14阶 | I924: 87 | J924: =VLOOKUP(RC[-9],Sheet1!R2C1:R28C6,6,FALSE) -> 灵性精粹
A925: 27 | B925: btn_elf | C925: 15 | D925: 1 | E925: 15 | F925: 10022 | G925: 50 | H925: =VLOOKUP(RC[-7],Sheet1!R2C1:R28C4,2,FALSE)&VLOOKUP(RC[-7],Sheet1!R2C1:R28C4,3,FALSE)&IF(VLOOKUP(RC[-7],Sheet1!R2C1:R28C4,4,FALSE)="品",VLOOKUP(RC[-3],Sheet1!R2C8:R6C9,2,FALSE),RC[-3])&VLOOKUP(RC[-7],Sheet1!R2C1:R28C4,4,FALSE) -> 精灵升华达到15阶 | I925: 87 | J925: =VLOOKUP(RC[-9],Sheet1!R2C1:R28C6,6,FALSE) -> 灵性精粹

Sheet: Sheet1
A2: 1 | B2: VIP等级 | C2: 达到 | D2: 级 | E2: 已处理 | F2: 钻石 | H2: 1 | I2: 绿
A3: 2 | B3: 战队等级 | C3: 达到 | D3: 级 | E3: 已处理 | F3: 传承核心 | H3: 2 | I3: 蓝
A4: 3 | B4: 主线副本总星级 | C4: 达到 | D4: 星 | E4: 已处理 | F4: 培养石 | H4: 3 | I4: 紫
A5: 4 | B5: 通关主线副本 | C5: 第 | D5: 章 | E5: 已处理 | F5: 金币 | H5: 4 | I5: 橙
A6: 5 | B6: 精英副本总星级 | C6: 达到 | D6: 星 | E6: 已处理 | F6: 觉醒水晶 | H6: 5 | I6: 红
A7: 6 | B7: 通关精英副本 | C7: 第 | D7: 章 | E7: 已处理 | F7: 神魂
A8: 7 | B8: 勇者试炼最高星数 | C8: 达到 | D8: 星 | E8: 已处理 | F8: 威名
A9: 8 | B9: 战队战斗力 | C9: 达到 | E9: 已处理 | F9: 金币
A10: 9 | B10: 战队中全体英雄等级 | C10: 达到 | D10: 级 | E10: 已处理 | F10: 金币
A11: 10 | B11: 战队中全体英雄进阶等级 | C11: 达到 | D11: 级 | E11: 已处理 | F11: 金币
A12: 11 | B12: 战队中全体英雄培养等级 | C12: 达到 | D12: 级 | E12: 已处理 | F12: 培养石
A13: 12 | B13: 战队中全体英雄潜能等级 | C13: 达到 | D13: 级 | E13: 已处理 | F13: 潜能合剂
A14: 13 | B14: 累计刷新魂晶商店 | C14: 达到 | D14: 次 | E14: 已处理 | F14: 魂晶
A15: 14 | B15: 寻访遗迹累计时间 | C15: 达到 | D15: 小时 | E15: 已处理 | F15: 金币
A16: 15 | B16: 累计镇压好友遗迹暴动 | D16: 次 | E16: 已处理 | F16: 钻石
A17: 16 | B17: 累计与异族入侵怪物战斗 | D17: 次 | E17: 已处理 | F17: 战功
A18: 17 | B18: 战队中全体英雄装备强化 | C18: 到 | D18: 级 | E18: 已处理 | F18: 金币
A19: 18 | B19: 战队中全体英雄装备品质 | C19: 达到 | D19: 品 | E19: 已处理 | F19: 精炼石
A20: 19 | B20: 战队中全体英雄圣器升级 | C20: 到 | D20: 级 | E20: 已处理 | F20: 水晶
A21: 20 | B21: 战队中全体英雄圣器品质 | C21: 达到 | D21: 品 | E21: 已处理 | F21: 圣器精炼石
A22: 21 | B22: 上阵英雄数量 | C22: 达到 | D22: 个 | E22: 已处理 | F22: 金币
A23: 22 | B23: 累计击杀精英副本外敌 | D23: 个 | E23: 已处理 | F23: 觉醒丹
A24: 23 | B24: 战队中全体英雄觉醒 | C24: 达到 | D24: 星 | E24: 已处理 | F24: 觉醒材料箱
A25: 24 | B25: 英雄对决 | C25: 累计战斗 | D25: 场 | F25: 灵性精粹
A26: 25 | B26: 无尽深渊 | C26: 战胜第 | D26: 波怪物 | F26: 钻石
A27: 26 | B27: 精灵强化 | C27: 达到 | D27: 级 | F27: 培养材料
A28: 27 | B28: 精灵升华 | C28: 达到 | D28: 阶 | F28: 灵性精粹