Sheet: 配置
A1: 服务端文件名 | B1: 服务端对应工作表号 | C1: 客户端文件名 | D1: 客户端对应工作表号 | E1: erl头部 | F1: erl内容格式 | G1: erl尾部 | H1: 客户端特殊处理
A2: config_main_fuben.txt | B2: 1 | C2: config_main_fuben.cnf|MainFuben | D2: 1 | F2: get(id) -> #$ | H2: 2=>id
A3: config_daily_chapter.txt | B3: 2 | C3: config_daily_chapter.cnf|DailyChapter | D3: 2 | F3: get(id) -> #$ | H3: 2=>id
A4: config_hero_fb_chapter.txt | B4: 3 | C4: config_hero_fb_chapter.cnf|HeroFBChapter | D4: 3 | F4: get(id) -> #$ | H4: 2=>id
A5: config_elite_fb_chapter.txt | B5: 4 | C5: config_elite_fb_chapter.cnf|EliteFBChapter | D5: 4 | F5: get(id) -> #$ | H5: 2=>id
C6: config_lead_fb.cnf|LeadFB | D6: 5 | H6: 2=>id
A7: config_main_fb_chapter_reward.txt | B7: 6 | C7: config_main_fb_chapter_reward.cnf|MainFBChapterReward | D7: 6 | F7: get(id) -> #$ | H7: 2=>id
C8: config_elite_fb_getstar.cnf|ElitenFBGetStar | D8: 7 | F8: get(id) -> #$ | H8: 2=>id

Sheet: 主线副本
A1: id|id | B1: name| | C1: chapter_bg_id| | D1: chapter_icon_id| | E1: gamelevel_list|map_list | F1: gamelevel_pos_list| | G1: star_list|star_list | H1: box_1_id_list|box_1_id_list | I1: box_1_num_list|box_1_num_list | J1: box_2_id_list|box_2_id_list | K1: box_2_num_list|box_2_num_list | L1: box_3_id_list|box_3_id_list | M1: box_3_num_list|box_3_num_list | N1: pre_chapter_id| | O1: need_role_level|need_role_level | P1: show_world_star| | Q1: gamelevel_line_id| | R1: gamelevel_line_offset_pos| | S1: gamelevel_offset_pos|
A2: 不可空 | B2: 不可空 | C2: 可空#不需字段 | D2: 不可空 | E2: 不可空 | F2: 不可空 | G2: 不可空 | H2: 不可空 | I2: 不可空 | J2: 不可空 | K2: 不可空 | L2: 不可空 | M2: 不可空 | N2: 可空#不需字段 | O2: 可空#不需字段 | P2: 不可空 | Q2: 不可空 | R2: 不可空 | S2: 不可空
A3: 数字 | B3: 字符串 | C3: 数字 | D3: 数字 | E3: 一维数组 | F3: 二维数组 | G3: 一维数组 | H3: 一维数组 | I3: 一维数组 | J3: 一维数组 | K3: 一维数组 | L3: 一维数组 | M3: 一维数组 | N3: 数字 | O3: 数字 | P3: 数字 | Q3: 数字 | R3: 一维数组 | S3: 一维数组
E4: 不定长 | F4: 不定长 | G4: 不定长 | H4: 不定长 | I4: 不定长 | J4: 不定长 | K4: 不定长 | L4: 不定长 | M4: 不定长 | R4: 不定长 | S4: 不定长
A6: 章节 | B6: 名称 | C6: 章节背景ID | D6: 章节图标ID | E6: 关卡列表 | F6: 关卡位置列表(x|y#x|y) | G6: 星数列表 | H6: 宝箱1ID列表 | I6: 宝箱1数量列表 | J6: 宝箱2ID列表 | K6: 宝箱2数量列表 | L6: 宝箱3ID列表 | M6: 宝箱3数量列表 | N6: 前置章节ID | O6: 需要的角色等级 | P6: 显示世界之心 | Q6: 关卡路线ID | R6: 关卡路线偏移坐标 | S6: 关卡偏移坐标
A7: 1 | B7: 第1章 铁蹄追杀 | C7: 2 | D7: 2 | E7: 10101|10102 | F7: 504|310#981|365 | G7: 4|5|6 | H7: 19005|19003|10002|33100 | I7: 20|5000|50|1 | J7: 19005|19003|10002|10018 | K7: 30|7500|50|1 | L7: 19005|19003|10001|10019 | M7: 50|10000|1|1 | O7: 0 | P7: 1 | Q7: 2001 | R7: =VLOOKUP(RC[-1],R7C20:R15C21,2,FALSE) -> 322|122 | S7: 180|0 | T7: 1001 | U7: 360|147 | V7: 401|524#475|466#560|416#390|321#507|254#695|288#865|258#1010|296#1070|436#870|504 | W7: 190|131 | X7: =MID(RC[-3],1,FIND("|",RC[-3],1)-1)-MID(RC[-1],1,FIND("|",RC[-1],1)-1) -> 170 | Y7: =MID(RC[-4],FIND("|",RC[-4],1)+1,999)-MID(RC[-2],FIND("|",RC[-2],1)+1,999) -> 16
A8: 2 | B8: 第2章 暴食之恶 | C8: 1 | D8: 1 | E8: 10201|10202|10203|10204 | F8: 430|506#681|287#1070|396#865|506 | G8: 4|8|12 | H8: 19005|19003|10002|10018 | I8: 20|5000|100|2 | J8: 19005|19003|21102|10018 | K8: 30|7500|1|3 | L8: 19005|19003|22102|10001 | M8: 50|10000|1|1 | N8: 1 | O8: 0 | P8: 1 | Q8: 1001 | R8: =VLOOKUP(RC[-1],R7C20:R15C21,2,FALSE) -> 360|147 | S8: 180|0 | T8: 1002 | U8: 370|184 | V8: 395|456#537|536#841|531#773|411#637|408#510|370#416|261#690|289#874|273#1090|346 | W8: 200|168 | X8: =MID(RC[-3],1,FIND("|",RC[-3],1)-1)-MID(RC[-1],1,FIND("|",RC[-1],1)-1) -> 170 | Y8: =MID(RC[-4],FIND("|",RC[-4],1)+1,999)-MID(RC[-2],FIND("|",RC[-2],1)+1,999) -> 16
A9: 3 | B9: 第3章 错误之义 | C9: 3 | D9: 3 | E9: 10301|10302|10303|10304|10305|10306 | F9: 323|173#368|368#578|438#776|303#785|483#978|503 | G9: 6|12|18 | H9: 19005|19003|10002|23102 | I9: 20|5000|10|1 | J9: 19005|19003|20102|10018 | K9: 30|10000|1|3 | L9: 19005|19003|10002|20201 | M9: 50|10000|20|1 | N9: 2 | O9: 0 | P9: 1 | Q9: 3001 | R9: =VLOOKUP(RC[-1],R7C20:R15C21,2,FALSE) -> 286|95 | S9: 120|0 | T9: 2001 | U9: 322|122 | V9: 336|448#466|485#664|468#559|323#492|225#626|200#716|265#846|275#968|317#912|501 | W9: 188|117 | X9: =MID(RC[-3],1,FIND("|",RC[-3],1)-1)-MID(RC[-1],1,FIND("|",RC[-1],1)-1) -> 134 | Y9: =MID(RC[-4],FIND("|",RC[-4],1)+1,999)-MID(RC[-2],FIND("|",RC[-2],1)+1,999) -> 5
A10: 4 | B10: 第4章 神圣征途 | C10: 2 | D10: 2 | E10: 10401|10402|10403|10404|10405|10406|10407|10408 | F10: 364|495#522|465#424|345#584|305#764|285#934|175#1016|315#994|503 | G10: 8|16|24 | H10: 19005|19003|10002|10003 | I10: =MIN(100,INT((RC[-8]+4)/5)*10+10)&"|"&INT((RC[-8]+4)/5)*2500+2500&"|10|"&INT((RC[-8]+9)/5)*2+6 -> 20|5000|10|10 | J10: 19005|19003|10002|10018 | K10: =MIN(120,INT((RC[-10]+4)/5)*10+20)&"|"&INT((RC[-10]+9)/5)*5000&"|15|3" -> 30|10000|15|3 | L10: 19005|19003|10002|40301 | M10: 50|10000|20|1 | N10: 3 | O10: 0 | P10: 1 | Q10: 2002 | R10: =VLOOKUP(RC[-1],R7C20:R15C21,2,FALSE) -> 343|192 | S10: 120|0 | T10: 2002 | U10: 343|192 | V10: 364|495#524|460#424|345#544|290#674|281#814|285#934|175#1024|275#899|415#994|503 | W10: 209|187 | X10: =MID(RC[-3],1,FIND("|",RC[-3],1)-1)-MID(RC[-1],1,FIND("|",RC[-1],1)-1) -> 134 | Y10: =MID(RC[-4],FIND("|",RC[-4],1)+1,999)-MID(RC[-2],FIND("|",RC[-2],1)+1,999) -> 5
A11: 5 | B11: 第5章 如血之颅 | C11: 4 | D11: 4 | E11: 10501|10502|10503|10504|10505|10506|10507|10508|10509|10510 | F11: =VLOOKUP(RC[11],R7C20:R15C22,3,FALSE) -> 306|193#391|273#216|375#316|398#459|403#589|380#774|328#1023|316#901|433#708|493 | G11: 10|20|30 | H11: 19005|19003|10002|10003 | I11: =MIN(100,INT((RC[-8]+4)/5)*10+10)&"|"&INT((RC[-8]+4)/5)*2500+2500&"|10|"&INT((RC[-8]+9)/5)*2+6 -> 20|5000|10|10 | J11: 19005|19003|10002|10018 | K11: =MIN(120,INT((RC[-10]+4)/5)*10+20)&"|"&INT((RC[-10]+9)/5)*5000&"|15|3" -> 30|10000|15|3 | L11: ="19005|19003|10002|"&IF(AND(RC[-11]>15,MOD(RC[-11],3)=0),13314,10001) -> 19005|19003|10002|10001 | M11: =MIN(150,INT((RC[-12]+4)/5)*10+40)&"|"&INT((RC[-12]+9)/5)*5000&"|20|"&IF(AND(RC[-12]>15,MOD(RC[-12],3)=0),10,2) -> 50|10000|20|2 | N11: 4 | O11: 0 | P11: 1 | Q11: 4001 | R11: =VLOOKUP(RC[-1],R7C20:R15C21,2,FALSE) -> 200|125 | S11: 100|0 | T11: 3001 | U11: 286|95 | V11: 313|168#421|209#388|402#493|438#597|426#690|300#793|338#733|448#848|484#973|502 | W11: 143|92 | X11: =MID(RC[-3],1,FIND("|",RC[-3],1)-1)-MID(RC[-1],1,FIND("|",RC[-1],1)-1) -> 143 | Y11: =MID(RC[-4],FIND("|",RC[-4],1)+1,999)-MID(RC[-2],FIND("|",RC[-2],1)+1,999) -> 3
A12: 6 | B12: 第6章 认知自我 | C12: 3 | D12: 3 | E12: 10601|10602|10603|10604|10605|10606|10607|10608|10609|10610 | F12: =VLOOKUP(RC[11],R7C20:R15C22,3,FALSE) -> 993|198#768|271#623|258#475|273#371|348#470|437#595|425#693|376#861|356#943|493 | G12: 10|20|30 | H12: 19005|19003|10002|10003 | I12: =MIN(100,INT((RC[-8]+4)/5)*10+10)&"|"&INT((RC[-8]+4)/5)*2500+2500&"|10|"&INT((RC[-8]+9)/5)*2+6 -> 30|7500|10|12 | J12: 19005|19003|10002|10018 | K12: =MIN(120,INT((RC[-10]+4)/5)*10+20)&"|"&INT((RC[-10]+9)/5)*5000&"|15|3" -> 40|15000|15|3 | L12: ="19005|19003|10002|"&IF(AND(RC[-11]>15,MOD(RC[-11],3)=0),13314,10001) -> 19005|19003|10002|10001 | M12: =MIN(150,INT((RC[-12]+4)/5)*10+40)&"|"&INT((RC[-12]+9)/5)*5000&"|20|"&IF(AND(RC[-12]>15,MOD(RC[-12],3)=0),10,2) -> 60|15000|20|2 | N12: 5 | O12: 0 | P12: 1 | Q12: 3002 | R12: =VLOOKUP(RC[-1],R7C20:R15C21,2,FALSE) -> 355|126 | S12: 120|0 | T12: 3002 | U12: 355|126 | V12: 993|198#768|271#623|258#475|273#371|348#470|437#595|425#693|376#861|356#943|493 | W12: 212|123 | X12: =MID(RC[-3],1,FIND("|",RC[-3],1)-1)-MID(RC[-1],1,FIND("|",RC[-1],1)-1) -> 143 | Y12: =MID(RC[-4],FIND("|",RC[-4],1)+1,999)-MID(RC[-2],FIND("|",RC[-2],1)+1,999) -> 3
A13: 7 | B13: 第7章 旗帜之下 | C13: 1 | D13: 1 | E13: 10701|10702|10703|10704|10705|10706|10707|10708|10709|10710 | F13: =VLOOKUP(RC[11],R7C20:R15C22,3,FALSE) -> 395|456#537|536#841|531#773|411#637|408#510|370#416|261#690|289#874|273#1090|346 | G13: 10|20|30 | H13: 19005|19003|10002|10003 | I13: =MIN(100,INT((RC[-8]+4)/5)*10+10)&"|"&INT((RC[-8]+4)/5)*2500+2500&"|10|"&INT((RC[-8]+9)/5)*2+6 -> 30|7500|10|12 | J13: 19005|19003|10002|10018 | K13: =MIN(120,INT((RC[-10]+4)/5)*10+20)&"|"&INT((RC[-10]+9)/5)*5000&"|15|3" -> 40|15000|15|3 | L13: ="19005|19003|10002|"&IF(AND(RC[-11]>15,MOD(RC[-11],3)=0),13314,10001) -> 19005|19003|10002|10001 | M13: =MIN(150,INT((RC[-12]+4)/5)*10+40)&"|"&INT((RC[-12]+9)/5)*5000&"|20|"&IF(AND(RC[-12]>15,MOD(RC[-12],3)=0),10,2) -> 60|15000|20|2 | N13: 6 | O13: 0 | P13: 1 | Q13: 1002 | R13: =VLOOKUP(RC[-1],R7C20:R15C21,2,FALSE) -> 370|184 | S13: 120|0 | T13: 4001 | U13: 200|125 | V13: 306|193#391|273#216|375#316|398#459|403#589|380#774|328#1023|316#901|433#708|493 | W13: 69|125 | X13: =MID(RC[-3],1,FIND("|",RC[-3],1)-1)-MID(RC[-1],1,FIND("|",RC[-1],1)-1) -> 131 | Y13: =MID(RC[-4],FIND("|",RC[-4],1)+1,999)-MID(RC[-2],FIND("|",RC[-2],1)+1,999) -> 0
A14: 8 | B14: 第8章 深入地底 | C14: 4 | D14: 4 | E14: =10001+RC[-4]*100&"|"&10002+RC[-4]*100&"|"&10003+RC[-4]*100&"|"&10004+RC[-4]*100&"|"&10005+RC[-4]*100&"|"&10006+RC[-4]*100&"|"&10007+RC[-4]*100&"|"&10008+RC[-4]*100&"|"&10009+RC[-4]*100&"|"&10010+RC[-4]*100 -> 10801|10802|10803|10804|10805|10806|10807|10808|10809|10810 | F14: =VLOOKUP(RC[11],R7C20:R15C22,3,FALSE) -> 641|210#531|291#364|298#241|390#452|402#650|388#793|328#912|290#1021|310#991|499 | G14: 10|20|30 | H14: 19005|19003|10002|10003 | I14: =MIN(100,INT((RC[-8]+4)/5)*10+10)&"|"&INT((RC[-8]+4)/5)*2500+2500&"|10|"&INT((RC[-8]+9)/5)*2+6 -> 30|7500|10|12 | J14: 19005|19003|10002|10018 | K14: =MIN(120,INT((RC[-10]+4)/5)*10+20)&"|"&INT((RC[-10]+9)/5)*5000&"|15|3" -> 40|15000|15|3 | L14: ="19005|19003|10002|"&IF(AND(RC[-11]>15,MOD(RC[-11],3)=0),13314,10001) -> 19005|19003|10002|10001 | M14: =MIN(150,INT((RC[-12]+4)/5)*10+40)&"|"&INT((RC[-12]+9)/5)*5000&"|20|"&IF(AND(RC[-12]>15,MOD(RC[-12],3)=0),10,2) -> 60|15000|20|2 | N14: 7 | O14: 0 | P14: 1 | Q14: 4002 | R14: =VLOOKUP(RC[-1],R7C20:R15C21,2,FALSE) -> 187|136 | S14: 120|0 | T14: 4002 | U14: 187|136 | V14: 641|210#531|291#364|298#241|390#452|402#650|388#793|328#912|290#1021|310#991|499 | W14: 56|136 | X14: =MID(RC[-3],1,FIND("|",RC[-3],1)-1)-MID(RC[-1],1,FIND("|",RC[-1],1)-1) -> 131 | Y14: =MID(RC[-4],FIND("|",RC[-4],1)+1,999)-MID(RC[-2],FIND("|",RC[-2],1)+1,999) -> 0
A15: 9 | B15: 第9章 燃烧之心 | C15: 1 | D15: 1 | E15: =10001+RC[-4]*100&"|"&10002+RC[-4]*100&"|"&10003+RC[-4]*100&"|"&10004+RC[-4]*100&"|"&10005+RC[-4]*100&"|"&10006+RC[-4]*100&"|"&10007+RC[-4]*100&"|"&10008+RC[-4]*100&"|"&10009+RC[-4]*100&"|"&10010+RC[-4]*100 -> 10901|10902|10903|10904|10905|10906|10907|10908|10909|10910 | F15: =VLOOKUP(RC[11],R7C20:R15C22,3,FALSE) -> 401|524#475|466#560|416#390|321#507|254#695|288#865|258#1010|296#1070|436#870|504 | G15: 10|20|30 | H15: 19005|19003|10002|10003 | I15: =MIN(100,INT((RC[-8]+4)/5)*10+10)&"|"&INT((RC[-8]+4)/5)*2500+2500&"|10|"&INT((RC[-8]+9)/5)*2+6 -> 30|7500|10|12 | J15: 19005|19003|10002|10018 | K15: =MIN(120,INT((RC[-10]+4)/5)*10+20)&"|"&INT((RC[-10]+9)/5)*5000&"|15|3" -> 40|15000|15|3 | L15: ="19005|19003|10002|"&IF(AND(RC[-11]>15,MOD(RC[-11],3)=0),13314,10001) -> 19005|19003|10002|10001 | M15: =MIN(150,INT((RC[-12]+4)/5)*10+40)&"|"&INT((RC[-12]+9)/5)*5000&"|20|"&IF(AND(RC[-12]>15,MOD(RC[-12],3)=0),10,2) -> 60|15000|20|2 | N15: 8 | O15: 0 | P15: 1 | Q15: 1001 | R15: =VLOOKUP(RC[-1],R7C20:R15C21,2,FALSE) -> 360|147 | S15: 100|0 | T15: 5001 | U15: 360|143 | V15: 494|210#404|260#404|430#524|420#634|465#724|430#624|270#804|240#964|330#1094|490 | W15: 186|143 | X15: =MID(RC[-3],1,FIND("|",RC[-3],1)-1)-MID(RC[-1],1,FIND("|",RC[-1],1)-1) -> 174 | Y15: =MID(RC[-4],FIND("|",RC[-4],1)+1,999)-MID(RC[-2],FIND("|",RC[-2],1)+1,999) -> 0
A16: 10 | B16: 第10章 沙漠绿洲 | C16: 2 | D16: 2 | E16: =10001+RC[-4]*100&"|"&10002+RC[-4]*100&"|"&10003+RC[-4]*100&"|"&10004+RC[-4]*100&"|"&10005+RC[-4]*100&"|"&10006+RC[-4]*100&"|"&10007+RC[-4]*100&"|"&10008+RC[-4]*100&"|"&10009+RC[-4]*100&"|"&10010+RC[-4]*100 -> 11001|11002|11003|11004|11005|11006|11007|11008|11009|11010 | F16: =VLOOKUP(RC[11],R7C20:R15C22,3,FALSE) -> 336|448#466|485#664|468#559|323#492|225#626|200#716|265#846|275#968|317#912|501 | G16: 10|20|30 | H16: 19005|19003|10002|10003 | I16: =MIN(100,INT((RC[-8]+4)/5)*10+10)&"|"&INT((RC[-8]+4)/5)*2500+2500&"|10|"&INT((RC[-8]+9)/5)*2+6 -> 30|7500|10|12 | J16: 19005|19003|10002|10018 | K16: =MIN(120,INT((RC[-10]+4)/5)*10+20)&"|"&INT((RC[-10]+9)/5)*5000&"|15|3" -> 40|15000|15|3 | L16: ="19005|19003|10002|"&IF(AND(RC[-11]>15,MOD(RC[-11],3)=0),13314,10001) -> 19005|19003|10002|10001 | M16: =MIN(150,INT((RC[-12]+4)/5)*10+40)&"|"&INT((RC[-12]+9)/5)*5000&"|20|"&IF(AND(RC[-12]>15,MOD(RC[-12],3)=0),10,2) -> 60|15000|20|2 | N16: 9 | O16: 30 | P16: 1 | Q16: 2001 | R16: =VLOOKUP(RC[-1],R7C20:R15C21,2,FALSE) -> 322|122 | S16: 120|0
A17: 11 | B17: 第11章 熔火之地 | C17: 5 | D17: 1 | E17: =10001+RC[-4]*100&"|"&10002+RC[-4]*100&"|"&10003+RC[-4]*100&"|"&10004+RC[-4]*100&"|"&10005+RC[-4]*100&"|"&10006+RC[-4]*100&"|"&10007+RC[-4]*100&"|"&10008+RC[-4]*100&"|"&10009+RC[-4]*100&"|"&10010+RC[-4]*100 -> 11101|11102|11103|11104|11105|11106|11107|11108|11109|11110 | F17: =VLOOKUP(RC[11],R7C20:R15C22,3,FALSE) -> 494|210#404|260#404|430#524|420#634|465#724|430#624|270#804|240#964|330#1094|490 | G17: 10|20|30 | H17: 19005|19003|10002|10003 | I17: =MIN(100,INT((RC[-8]+4)/5)*10+10)&"|"&INT((RC[-8]+4)/5)*2500+2500&"|10|"&INT((RC[-8]+9)/5)*2+6 -> 40|10000|10|14 | J17: 19005|19003|10002|10018 | K17: =MIN(120,INT((RC[-10]+4)/5)*10+20)&"|"&INT((RC[-10]+9)/5)*5000&"|15|3" -> 50|20000|15|3 | L17: ="19005|19003|10002|"&IF(AND(RC[-11]>15,MOD(RC[-11],3)=0),13314,10001) -> 19005|19003|10002|10001 | M17: =MIN(150,INT((RC[-12]+4)/5)*10+40)&"|"&INT((RC[-12]+9)/5)*5000&"|20|"&IF(AND(RC[-12]>15,MOD(RC[-12],3)=0),10,2) -> 70|20000|20|2 | N17: 10 | O17: 30 | P17: 1 | Q17: 5001 | R17: =VLOOKUP(RC[-1],R7C20:R15C21,2,FALSE) -> 360|143 | S17: 180|0
A18: 12 | B18: 第12章 野蛮巨人 | C18: 1 | D18: 1 | E18: =10001+RC[-4]*100&"|"&10002+RC[-4]*100&"|"&10003+RC[-4]*100&"|"&10004+RC[-4]*100&"|"&10005+RC[-4]*100&"|"&10006+RC[-4]*100&"|"&10007+RC[-4]*100&"|"&10008+RC[-4]*100&"|"&10009+RC[-4]*100&"|"&10010+RC[-4]*100 -> 11201|11202|11203|11204|11205|11206|11207|11208|11209|11210 | F18: =VLOOKUP(RC[11],R7C20:R15C22,3,FALSE) -> 401|524#475|466#560|416#390|321#507|254#695|288#865|258#1010|296#1070|436#870|504 | G18: 10|20|30 | H18: 19005|19003|10002|10003 | I18: =MIN(100,INT((RC[-8]+4)/5)*10+10)&"|"&INT((RC[-8]+4)/5)*2500+2500&"|10|"&INT((RC[-8]+9)/5)*2+6 -> 40|10000|10|14 | J18: 19005|19003|10002|10018 | K18: =MIN(120,INT((RC[-10]+4)/5)*10+20)&"|"&INT((RC[-10]+9)/5)*5000&"|15|3" -> 50|20000|15|3 | L18: ="19005|19003|10002|"&IF(AND(RC[-11]>15,MOD(RC[-11],3)=0),13314,10001) -> 19005|19003|10002|10001 | M18: =MIN(150,INT((RC[-12]+4)/5)*10+40)&"|"&INT((RC[-12]+9)/5)*5000&"|20|"&IF(AND(RC[-12]>15,MOD(RC[-12],3)=0),10,2) -> 70|20000|20|2 | N18: 11 | O18: 34 | P18: 1 | Q18: 1001 | R18: =VLOOKUP(RC[-1],R7C20:R15C21,2,FALSE) -> 360|147 | S18: 180|0
A19: 13 | B19: 第13章 心与躯体 | C19: 2 | D19: 2 | E19: =10001+RC[-4]*100&"|"&10002+RC[-4]*100&"|"&10003+RC[-4]*100&"|"&10004+RC[-4]*100&"|"&10005+RC[-4]*100&"|"&10006+RC[-4]*100&"|"&10007+RC[-4]*100&"|"&10008+RC[-4]*100&"|"&10009+RC[-4]*100&"|"&10010+RC[-4]*100 -> 11301|11302|11303|11304|11305|11306|11307|11308|11309|11310 | F19: =VLOOKUP(RC[11],R7C20:R15C22,3,FALSE) -> 364|495#524|460#424|345#544|290#674|281#814|285#934|175#1024|275#899|415#994|503 | G19: 10|20|30 | H19: 19005|19003|10002|10003 | I19: =MIN(100,INT((RC[-8]+4)/5)*10+10)&"|"&INT((RC[-8]+4)/5)*2500+2500&"|10|"&INT((RC[-8]+9)/5)*2+6 -> 40|10000|10|14 | J19: 19005|19003|10002|10018 | K19: =MIN(120,INT((RC[-10]+4)/5)*10+20)&"|"&INT((RC[-10]+9)/5)*5000&"|15|3" -> 50|20000|15|3 | L19: ="19005|19003|10002|"&IF(AND(RC[-11]>15,MOD(RC[-11],3)=0),13314,10001) -> 19005|19003|10002|10001 | M19: =MIN(150,INT((RC[-12]+4)/5)*10+40)&"|"&INT((RC[-12]+9)/5)*5000&"|20|"&IF(AND(RC[-12]>15,MOD(RC[-12],3)=0),10,2) -> 70|20000|20|2 | N19: 12 | O19: 34 | P19: 1 | Q19: 2002 | R19: =VLOOKUP(RC[-1],R7C20:R15C21,2,FALSE) -> 343|192 | S19: 120|0
A20: 14 | B20: 第14章 暴动雷霆 | C20: 3 | D20: 3 | E20: =10001+RC[-4]*100&"|"&10002+RC[-4]*100&"|"&10003+RC[-4]*100&"|"&10004+RC[-4]*100&"|"&10005+RC[-4]*100&"|"&10006+RC[-4]*100&"|"&10007+RC[-4]*100&"|"&10008+RC[-4]*100&"|"&10009+RC[-4]*100&"|"&10010+RC[-4]*100 -> 11401|11402|11403|11404|11405|11406|11407|11408|11409|11410 | F20: =VLOOKUP(RC[11],R7C20:R15C22,3,FALSE) -> 313|168#421|209#388|402#493|438#597|426#690|300#793|338#733|448#848|484#973|502 | G20: 10|20|30 | H20: 19005|19003|10002|10003 | I20: =MIN(100,INT((RC[-8]+4)/5)*10+10)&"|"&INT((RC[-8]+4)/5)*2500+2500&"|10|"&INT((RC[-8]+9)/5)*2+6 -> 40|10000|10|14 | J20: 19005|19003|10002|10018 | K20: =MIN(120,INT((RC[-10]+4)/5)*10+20)&"|"&INT((RC[-10]+9)/5)*5000&"|15|3" -> 50|20000|15|3 | L20: ="19005|19003|10002|"&IF(AND(RC[-11]>15,MOD(RC[-11],3)=0),13314,10001) -> 19005|19003|10002|10001 | M20: =MIN(150,INT((RC[-12]+4)/5)*10+40)&"|"&INT((RC[-12]+9)/5)*5000&"|20|"&IF(AND(RC[-12]>15,MOD(RC[-12],3)=0),10,2) -> 70|20000|20|2 | N20: 13 | O20: 36 | P20: 1 | Q20: 3001 | R20: =VLOOKUP(RC[-1],R7C20:R15C21,2,FALSE) -> 286|95 | S20: 120|0
A21: 15 | B21: 第15章 战争主宰 | C21: 4 | D21: 4 | E21: =10001+RC[-4]*100&"|"&10002+RC[-4]*100&"|"&10003+RC[-4]*100&"|"&10004+RC[-4]*100&"|"&10005+RC[-4]*100&"|"&10006+RC[-4]*100&"|"&10007+RC[-4]*100&"|"&10008+RC[-4]*100&"|"&10009+RC[-4]*100&"|"&10010+RC[-4]*100 -> 11501|11502|11503|11504|11505|11506|11507|11508|11509|11510 | F21: =VLOOKUP(RC[11],R7C20:R15C22,3,FALSE) -> 306|193#391|273#216|375#316|398#459|403#589|380#774|328#1023|316#901|433#708|493 | G21: 10|20|30 | H21: 19005|19003|10002|10003 | I21: =MIN(100,INT((RC[-8]+4)/5)*10+10)&"|"&INT((RC[-8]+4)/5)*2500+2500&"|10|"&INT((RC[-8]+9)/5)*2+6 -> 40|10000|10|14 | J21: 19005|19003|10002|10018 | K21: =MIN(120,INT((RC[-10]+4)/5)*10+20)&"|"&INT((RC[-10]+9)/5)*5000&"|15|3" -> 50|20000|15|3 | L21: ="19005|19003|10002|"&IF(AND(RC[-11]>15,MOD(RC[-11],3)=0),13314,10001) -> 19005|19003|10002|10001 | M21: =MIN(150,INT((RC[-12]+4)/5)*10+40)&"|"&INT((RC[-12]+9)/5)*5000&"|20|"&IF(AND(RC[-12]>15,MOD(RC[-12],3)=0),10,2) -> 70|20000|20|2 | N21: 14 | O21: 36 | P21: 1 | Q21: 4001 | R21: =VLOOKUP(RC[-1],R7C20:R15C21,2,FALSE) -> 200|125 | S21: 100|0
A22: 16 | B22: 第16章 血色光辉 | C22: 1 | D22: 1 | E22: =10001+RC[-4]*100&"|"&10002+RC[-4]*100&"|"&10003+RC[-4]*100&"|"&10004+RC[-4]*100&"|"&10005+RC[-4]*100&"|"&10006+RC[-4]*100&"|"&10007+RC[-4]*100&"|"&10008+RC[-4]*100&"|"&10009+RC[-4]*100&"|"&10010+RC[-4]*100 -> 11601|11602|11603|11604|11605|11606|11607|11608|11609|11610 | F22: =VLOOKUP(RC[11],R7C20:R15C22,3,FALSE) -> 395|456#537|536#841|531#773|411#637|408#510|370#416|261#690|289#874|273#1090|346 | G22: 10|20|30 | H22: 19005|19003|10002|10003 | I22: =MIN(100,INT((RC[-8]+4)/5)*10+10)&"|"&INT((RC[-8]+4)/5)*2500+2500&"|10|"&INT((RC[-8]+9)/5)*2+6 -> 50|12500|10|16 | J22: 19005|19003|10002|10018 | K22: =MIN(120,INT((RC[-10]+4)/5)*10+20)&"|"&INT((RC[-10]+9)/5)*5000&"|15|3" -> 60|25000|15|3 | L22: ="19005|19003|10002|"&IF(AND(RC[-11]>15,MOD(RC[-11],3)=0),13314,10001) -> 19005|19003|10002|10001 | M22: =MIN(150,INT((RC[-12]+4)/5)*10+40)&"|"&INT((RC[-12]+9)/5)*5000&"|20|"&IF(AND(RC[-12]>15,MOD(RC[-12],3)=0),10,2) -> 80|25000|20|2 | N22: 15 | O22: 38 | P22: 1 | Q22: 1002 | R22: =VLOOKUP(RC[-1],R7C20:R15C21,2,FALSE) -> 370|184 | S22: 120|0
A23: 17 | B23: 第17章 寒冰极地 | C23: 4 | D23: 4 | E23: =10001+RC[-4]*100&"|"&10002+RC[-4]*100&"|"&10003+RC[-4]*100&"|"&10004+RC[-4]*100&"|"&10005+RC[-4]*100&"|"&10006+RC[-4]*100&"|"&10007+RC[-4]*100&"|"&10008+RC[-4]*100&"|"&10009+RC[-4]*100&"|"&10010+RC[-4]*100 -> 11701|11702|11703|11704|11705|11706|11707|11708|11709|11710 | F23: =VLOOKUP(RC[11],R7C20:R15C22,3,FALSE) -> 641|210#531|291#364|298#241|390#452|402#650|388#793|328#912|290#1021|310#991|499 | G23: 10|20|30 | H23: 19005|19003|10002|10003 | I23: =MIN(100,INT((RC[-8]+4)/5)*10+10)&"|"&INT((RC[-8]+4)/5)*2500+2500&"|10|"&INT((RC[-8]+9)/5)*2+6 -> 50|12500|10|16 | J23: 19005|19003|10002|10018 | K23: =MIN(120,INT((RC[-10]+4)/5)*10+20)&"|"&INT((RC[-10]+9)/5)*5000&"|15|3" -> 60|25000|15|3 | L23: ="19005|19003|10002|"&IF(AND(RC[-11]>15,MOD(RC[-11],3)=0),13314,10001) -> 19005|19003|10002|10001 | M23: =MIN(150,INT((RC[-12]+4)/5)*10+40)&"|"&INT((RC[-12]+9)/5)*5000&"|20|"&IF(AND(RC[-12]>15,MOD(RC[-12],3)=0),10,2) -> 80|25000|20|2 | N23: 16 | O23: 38 | P23: 1 | Q23: 4002 | R23: =VLOOKUP(RC[-1],R7C20:R15C21,2,FALSE) -> 187|136 | S23: 120|0
A24: 18 | B24: 第18章 战争践踏 | C24: 1 | D24: 1 | E24: =10001+RC[-4]*100&"|"&10002+RC[-4]*100&"|"&10003+RC[-4]*100&"|"&10004+RC[-4]*100&"|"&10005+RC[-4]*100&"|"&10006+RC[-4]*100&"|"&10007+RC[-4]*100&"|"&10008+RC[-4]*100&"|"&10009+RC[-4]*100&"|"&10010+RC[-4]*100 -> 11801|11802|11803|11804|11805|11806|11807|11808|11809|11810 | F24: =VLOOKUP(RC[11],R7C20:R15C22,3,FALSE) -> 401|524#475|466#560|416#390|321#507|254#695|288#865|258#1010|296#1070|436#870|504 | G24: 10|20|30 | H24: 19005|19003|10002|10003 | I24: =MIN(100,INT((RC[-8]+4)/5)*10+10)&"|"&INT((RC[-8]+4)/5)*2500+2500&"|10|"&INT((RC[-8]+9)/5)*2+6 -> 50|12500|10|16 | J24: 19005|19003|10002|10018 | K24: =MIN(120,INT((RC[-10]+4)/5)*10+20)&"|"&INT((RC[-10]+9)/5)*5000&"|15|3" -> 60|25000|15|3 | L24: ="19005|19003|10002|"&IF(AND(RC[-11]>15,MOD(RC[-11],3)=0),13314,10001) -> 19005|19003|10002|13314 | M24: =MIN(150,INT((RC[-12]+4)/5)*10+40)&"|"&INT((RC[-12]+9)/5)*5000&"|20|"&IF(AND(RC[-12]>15,MOD(RC[-12],3)=0),10,2) -> 80|25000|20|10 | N24: 17 | O24: 40 | P24: 1 | Q24: 1001 | R24: =VLOOKUP(RC[-1],R7C20:R15C21,2,FALSE) -> 360|147 | S24: 120|0
A25: 19 | B25: 第19章 缝合怪物 | C25: 4 | D25: 4 | E25: =10001+RC[-4]*100&"|"&10002+RC[-4]*100&"|"&10003+RC[-4]*100&"|"&10004+RC[-4]*100&"|"&10005+RC[-4]*100&"|"&10006+RC[-4]*100&"|"&10007+RC[-4]*100&"|"&10008+RC[-4]*100&"|"&10009+RC[-4]*100&"|"&10010+RC[-4]*100 -> 11901|11902|11903|11904|11905|11906|11907|11908|11909|11910 | F25: =VLOOKUP(RC[11],R7C20:R15C22,3,FALSE) -> 306|193#391|273#216|375#316|398#459|403#589|380#774|328#1023|316#901|433#708|493 | G25: 10|20|30 | H25: 19005|19003|10002|10003 | I25: =MIN(100,INT((RC[-8]+4)/5)*10+10)&"|"&INT((RC[-8]+4)/5)*2500+2500&"|10|"&INT((RC[-8]+9)/5)*2+6 -> 50|12500|10|16 | J25: 19005|19003|10002|10018 | K25: =MIN(120,INT((RC[-10]+4)/5)*10+20)&"|"&INT((RC[-10]+9)/5)*5000&"|15|3" -> 60|25000|15|3 | L25: ="19005|19003|10002|"&IF(AND(RC[-11]>15,MOD(RC[-11],3)=0),13314,10001) -> 19005|19003|10002|10001 | M25: =MIN(150,INT((RC[-12]+4)/5)*10+40)&"|"&INT((RC[-12]+9)/5)*5000&"|20|"&IF(AND(RC[-12]>15,MOD(RC[-12],3)=0),10,2) -> 80|25000|20|2 | N25: 18 | O25: 40 | P25: 1 | Q25: 4001 | R25: =VLOOKUP(RC[-1],R7C20:R15C21,2,FALSE) -> 200|125 | S25: 100|0
A26: 20 | B26: 第20章 钢铁之心 | C26: 3 | D26: 3 | E26: =10001+RC[-4]*100&"|"&10002+RC[-4]*100&"|"&10003+RC[-4]*100&"|"&10004+RC[-4]*100&"|"&10005+RC[-4]*100&"|"&10006+RC[-4]*100&"|"&10007+RC[-4]*100&"|"&10008+RC[-4]*100&"|"&10009+RC[-4]*100&"|"&10010+RC[-4]*100 -> 12001|12002|12003|12004|12005|12006|12007|12008|12009|12010 | F26: =VLOOKUP(RC[11],R7C20:R15C22,3,FALSE) -> 993|198#768|271#623|258#475|273#371|348#470|437#595|425#693|376#861|356#943|493 | G26: 10|20|30 | H26: 19005|19003|10002|10003 | I26: =MIN(100,INT((RC[-8]+4)/5)*10+10)&"|"&INT((RC[-8]+4)/5)*2500+2500&"|10|"&INT((RC[-8]+9)/5)*2+6 -> 50|12500|10|16 | J26: 19005|19003|10002|10018 | K26: =MIN(120,INT((RC[-10]+4)/5)*10+20)&"|"&INT((RC[-10]+9)/5)*5000&"|15|3" -> 60|25000|15|3 | L26: ="19005|19003|10002|"&IF(AND(RC[-11]>15,MOD(RC[-11],3)=0),13314,10001) -> 19005|19003|10002|10001 | M26: =MIN(150,INT((RC[-12]+4)/5)*10+40)&"|"&INT((RC[-12]+9)/5)*5000&"|20|"&IF(AND(RC[-12]>15,MOD(RC[-12],3)=0),10,2) -> 80|25000|20|2 | N26: 19 | O26: 41 | P26: 1 | Q26: 3002 | R26: =VLOOKUP(RC[-1],R7C20:R15C21,2,FALSE) -> 355|126 | S26: 120|0
A27: 21 | B27: 第21章 王者之剑 | C27: 1 | D27: 1 | E27: =10001+RC[-4]*100&"|"&10002+RC[-4]*100&"|"&10003+RC[-4]*100&"|"&10004+RC[-4]*100&"|"&10005+RC[-4]*100&"|"&10006+RC[-4]*100&"|"&10007+RC[-4]*100&"|"&10008+RC[-4]*100&"|"&10009+RC[-4]*100&"|"&10010+RC[-4]*100 -> 12101|12102|12103|12104|12105|12106|12107|12108|12109|12110 | F27: =VLOOKUP(RC[11],R7C20:R15C22,3,FALSE) -> 395|456#537|536#841|531#773|411#637|408#510|370#416|261#690|289#874|273#1090|346 | G27: 10|20|30 | H27: 19005|19003|10002|10003 | I27: =MIN(100,INT((RC[-8]+4)/5)*10+10)&"|"&INT((RC[-8]+4)/5)*2500+2500&"|10|"&INT((RC[-8]+9)/5)*2+6 -> 60|15000|10|18 | J27: 19005|19003|10002|10018 | K27: =MIN(120,INT((RC[-10]+4)/5)*10+20)&"|"&INT((RC[-10]+9)/5)*5000&"|15|3" -> 70|30000|15|3 | L27: ="19005|19003|10002|"&IF(AND(RC[-11]>15,MOD(RC[-11],3)=0),13314,10001) -> 19005|19003|10002|13314 | M27: =MIN(150,INT((RC[-12]+4)/5)*10+40)&"|"&INT((RC[-12]+9)/5)*5000&"|20|"&IF(AND(RC[-12]>15,MOD(RC[-12],3)=0),10,2) -> 90|30000|20|10 | N27: 20 | O27: 41 | P27: 1 | Q27: 1002 | R27: =VLOOKUP(RC[-1],R7C20:R15C21,2,FALSE) -> 370|184 | S27: 120|0
A28: 22 | B28: 第22章 灾厄源泉 | C28: 2 | D28: 2 | E28: =10001+RC[-4]*100&"|"&10002+RC[-4]*100&"|"&10003+RC[-4]*100&"|"&10004+RC[-4]*100&"|"&10005+RC[-4]*100&"|"&10006+RC[-4]*100&"|"&10007+RC[-4]*100&"|"&10008+RC[-4]*100&"|"&10009+RC[-4]*100&"|"&10010+RC[-4]*100 -> 12201|12202|12203|12204|12205|12206|12207|12208|12209|12210 | F28: =VLOOKUP(RC[11],R7C20:R15C22,3,FALSE) -> 336|448#466|485#664|468#559|323#492|225#626|200#716|265#846|275#968|317#912|501 | G28: 10|20|30 | H28: 19005|19003|10002|10003 | I28: =MIN(100,INT((RC[-8]+4)/5)*10+10)&"|"&INT((RC[-8]+4)/5)*2500+2500&"|10|"&INT((RC[-8]+9)/5)*2+6 -> 60|15000|10|18 | J28: 19005|19003|10002|10018 | K28: =MIN(120,INT((RC[-10]+4)/5)*10+20)&"|"&INT((RC[-10]+9)/5)*5000&"|15|3" -> 70|30000|15|3 | L28: ="19005|19003|10002|"&IF(AND(RC[-11]>15,MOD(RC[-11],3)=0),13314,10001) -> 19005|19003|10002|10001 | M28: =MIN(150,INT((RC[-12]+4)/5)*10+40)&"|"&INT((RC[-12]+9)/5)*5000&"|20|"&IF(AND(RC[-12]>15,MOD(RC[-12],3)=0),10,2) -> 90|30000|20|2 | N28: 21 | O28: 42 | P28: 1 | Q28: 2001 | R28: =VLOOKUP(RC[-1],R7C20:R15C21,2,FALSE) -> 322|122 | S28: 120|0
A29: 23 | B29: 第23章 占领据点 | C29: 3 | D29: 3 | E29: =10001+RC[-4]*100&"|"&10002+RC[-4]*100&"|"&10003+RC[-4]*100&"|"&10004+RC[-4]*100&"|"&10005+RC[-4]*100&"|"&10006+RC[-4]*100&"|"&10007+RC[-4]*100&"|"&10008+RC[-4]*100&"|"&10009+RC[-4]*100&"|"&10010+RC[-4]*100 -> 12301|12302|12303|12304|12305|12306|12307|12308|12309|12310 | F29: =VLOOKUP(RC[11],R7C20:R15C22,3,FALSE) -> 313|168#421|209#388|402#493|438#597|426#690|300#793|338#733|448#848|484#973|502 | G29: 10|20|30 | H29: 19005|19003|10002|10003 | I29: =MIN(100,INT((RC[-8]+4)/5)*10+10)&"|"&INT((RC[-8]+4)/5)*2500+2500&"|10|"&INT((RC[-8]+9)/5)*2+6 -> 60|15000|10|18 | J29: 19005|19003|10002|10018 | K29: =MIN(120,INT((RC[-10]+4)/5)*10+20)&"|"&INT((RC[-10]+9)/5)*5000&"|15|3" -> 70|30000|15|3 | L29: ="19005|19003|10002|"&IF(AND(RC[-11]>15,MOD(RC[-11],3)=0),13314,10001) -> 19005|19003|10002|10001 | M29: =MIN(150,INT((RC[-12]+4)/5)*10+40)&"|"&INT((RC[-12]+9)/5)*5000&"|20|"&IF(AND(RC[-12]>15,MOD(RC[-12],3)=0),10,2) -> 90|30000|20|2 | N29: 22 | O29: 42 | P29: 1 | Q29: 3001 | R29: =VLOOKUP(RC[-1],R7C20:R15C21,2,FALSE) -> 286|95 | S29: 120|0
A30: 24 | B30: 第24章 智慧眷属 | C30: 1 | D30: 1 | E30: =10001+RC[-4]*100&"|"&10002+RC[-4]*100&"|"&10003+RC[-4]*100&"|"&10004+RC[-4]*100&"|"&10005+RC[-4]*100&"|"&10006+RC[-4]*100&"|"&10007+RC[-4]*100&"|"&10008+RC[-4]*100&"|"&10009+RC[-4]*100&"|"&10010+RC[-4]*100 -> 12401|12402|12403|12404|12405|12406|12407|12408|12409|12410 | F30: =VLOOKUP(RC[11],R7C20:R15C22,3,FALSE) -> 401|524#475|466#560|416#390|321#507|254#695|288#865|258#1010|296#1070|436#870|504 | G30: 10|20|30 | H30: 19005|19003|10002|10003 | I30: =MIN(100,INT((RC[-8]+4)/5)*10+10)&"|"&INT((RC[-8]+4)/5)*2500+2500&"|10|"&INT((RC[-8]+9)/5)*2+6 -> 60|15000|10|18 | J30: 19005|19003|10002|10018 | K30: =MIN(120,INT((RC[-10]+4)/5)*10+20)&"|"&INT((RC[-10]+9)/5)*5000&"|15|3" -> 70|30000|15|3 | L30: ="19005|19003|10002|"&IF(AND(RC[-11]>15,MOD(RC[-11],3)=0),13314,10001) -> 19005|19003|10002|13314 | M30: =MIN(150,INT((RC[-12]+4)/5)*10+40)&"|"&INT((RC[-12]+9)/5)*5000&"|20|"&IF(AND(RC[-12]>15,MOD(RC[-12],3)=0),10,2) -> 90|30000|20|10 | N30: 23 | O30: 43 | P30: 1 | Q30: 1001 | R30: =VLOOKUP(RC[-1],R7C20:R15C21,2,FALSE) -> 360|147 | S30: 120|0
A31: 25 | B31: 第25章 大型战争 | C31: 4 | D31: 4 | E31: =10001+RC[-4]*100&"|"&10002+RC[-4]*100&"|"&10003+RC[-4]*100&"|"&10004+RC[-4]*100&"|"&10005+RC[-4]*100&"|"&10006+RC[-4]*100&"|"&10007+RC[-4]*100&"|"&10008+RC[-4]*100&"|"&10009+RC[-4]*100&"|"&10010+RC[-4]*100 -> 12501|12502|12503|12504|12505|12506|12507|12508|12509|12510 | F31: =VLOOKUP(RC[11],R7C20:R15C22,3,FALSE) -> 641|210#531|291#364|298#241|390#452|402#650|388#793|328#912|290#1021|310#991|499 | G31: 10|20|30 | H31: 19005|19003|10002|10003 | I31: =MIN(100,INT((RC[-8]+4)/5)*10+10)&"|"&INT((RC[-8]+4)/5)*2500+2500&"|10|"&INT((RC[-8]+9)/5)*2+6 -> 60|15000|10|18 | J31: 19005|19003|10002|10018 | K31: =MIN(120,INT((RC[-10]+4)/5)*10+20)&"|"&INT((RC[-10]+9)/5)*5000&"|15|3" -> 70|30000|15|3 | L31: ="19005|19003|10002|"&IF(AND(RC[-11]>15,MOD(RC[-11],3)=0),13314,10001) -> 19005|19003|10002|10001 | M31: =MIN(150,INT((RC[-12]+4)/5)*10+40)&"|"&INT((RC[-12]+9)/5)*5000&"|20|"&IF(AND(RC[-12]>15,MOD(RC[-12],3)=0),10,2) -> 90|30000|20|2 | N31: 24 | O31: 43 | P31: 1 | Q31: 4002 | R31: =VLOOKUP(RC[-1],R7C20:R15C21,2,FALSE) -> 187|136 | S31: 120|0
A32: 26 | B32: 第26章 拉开帷幕 | C32: 3 | D32: 3 | E32: =10001+RC[-4]*100&"|"&10002+RC[-4]*100&"|"&10003+RC[-4]*100&"|"&10004+RC[-4]*100&"|"&10005+RC[-4]*100&"|"&10006+RC[-4]*100&"|"&10007+RC[-4]*100&"|"&10008+RC[-4]*100&"|"&10009+RC[-4]*100&"|"&10010+RC[-4]*100 -> 12601|12602|12603|12604|12605|12606|12607|12608|12609|12610 | F32: =VLOOKUP(RC[11],R7C20:R15C22,3,FALSE) -> 993|198#768|271#623|258#475|273#371|348#470|437#595|425#693|376#861|356#943|493 | G32: 10|20|30 | H32: 19005|19003|10002|10003 | I32: =MIN(100,INT((RC[-8]+4)/5)*10+10)&"|"&INT((RC[-8]+4)/5)*2500+2500&"|10|"&INT((RC[-8]+9)/5)*2+6 -> 70|17500|10|20 | J32: 19005|19003|10002|10018 | K32: =MIN(120,INT((RC[-10]+4)/5)*10+20)&"|"&INT((RC[-10]+9)/5)*5000&"|15|3" -> 80|35000|15|3 | L32: ="19005|19003|10002|"&IF(AND(RC[-11]>15,MOD(RC[-11],3)=0),13314,10001) -> 19005|19003|10002|10001 | M32: =MIN(150,INT((RC[-12]+4)/5)*10+40)&"|"&INT((RC[-12]+9)/5)*5000&"|20|"&IF(AND(RC[-12]>15,MOD(RC[-12],3)=0),10,2) -> 100|35000|20|2 | N32: 25 | O32: 44 | P32: 1 | Q32: 3002 | R32: =VLOOKUP(RC[-1],R7C20:R15C21,2,FALSE) -> 355|126 | S32: 120|0
A33: 27 | B33: 第27章 堕落森林 | C33: 2 | D33: 2 | E33: =10001+RC[-4]*100&"|"&10002+RC[-4]*100&"|"&10003+RC[-4]*100&"|"&10004+RC[-4]*100&"|"&10005+RC[-4]*100&"|"&10006+RC[-4]*100&"|"&10007+RC[-4]*100&"|"&10008+RC[-4]*100&"|"&10009+RC[-4]*100&"|"&10010+RC[-4]*100 -> 12701|12702|12703|12704|12705|12706|12707|12708|12709|12710 | F33: =VLOOKUP(RC[11],R7C20:R15C22,3,FALSE) -> 364|495#524|460#424|345#544|290#674|281#814|285#934|175#1024|275#899|415#994|503 | G33: 10|20|30 | H33: 19005|19003|10002|10003 | I33: =MIN(100,INT((RC[-8]+4)/5)*10+10)&"|"&INT((RC[-8]+4)/5)*2500+2500&"|10|"&INT((RC[-8]+9)/5)*2+6 -> 70|17500|10|20 | J33: 19005|19003|10002|10018 | K33: =MIN(120,INT((RC[-10]+4)/5)*10+20)&"|"&INT((RC[-10]+9)/5)*5000&"|15|3" -> 80|35000|15|3 | L33: ="19005|19003|10002|"&IF(AND(RC[-11]>15,MOD(RC[-11],3)=0),13314,10001) -> 19005|19003|10002|13314 | M33: =MIN(150,INT((RC[-12]+4)/5)*10+40)&"|"&INT((RC[-12]+9)/5)*5000&"|20|"&IF(AND(RC[-12]>15,MOD(RC[-12],3)=0),10,2) -> 100|35000|20|10 | N33: 26 | O33: 44 | P33: 1 | Q33: 2002 | R33: =VLOOKUP(RC[-1],R7C20:R15C21,2,FALSE) -> 343|192 | S33: 120|0
A34: 28 | B34: 第28章 黑暗殿堂 | C34: 4 | D34: 4 | E34: =10001+RC[-4]*100&"|"&10002+RC[-4]*100&"|"&10003+RC[-4]*100&"|"&10004+RC[-4]*100&"|"&10005+RC[-4]*100&"|"&10006+RC[-4]*100&"|"&10007+RC[-4]*100&"|"&10008+RC[-4]*100&"|"&10009+RC[-4]*100&"|"&10010+RC[-4]*100 -> 12801|12802|12803|12804|12805|12806|12807|12808|12809|12810 | F34: =VLOOKUP(RC[11],R7C20:R15C22,3,FALSE) -> 306|193#391|273#216|375#316|398#459|403#589|380#774|328#1023|316#901|433#708|493 | G34: 10|20|30 | H34: 19005|19003|10002|10003 | I34: =MIN(100,INT((RC[-8]+4)/5)*10+10)&"|"&INT((RC[-8]+4)/5)*2500+2500&"|10|"&INT((RC[-8]+9)/5)*2+6 -> 70|17500|10|20 | J34: 19005|19003|10002|10018 | K34: =MIN(120,INT((RC[-10]+4)/5)*10+20)&"|"&INT((RC[-10]+9)/5)*5000&"|15|3" -> 80|35000|15|3 | L34: ="19005|19003|10002|"&IF(AND(RC[-11]>15,MOD(RC[-11],3)=0),13314,10001) -> 19005|19003|10002|10001 | M34: =MIN(150,INT((RC[-12]+4)/5)*10+40)&"|"&INT((RC[-12]+9)/5)*5000&"|20|"&IF(AND(RC[-12]>15,MOD(RC[-12],3)=0),10,2) -> 100|35000|20|2 | N34: 27 | O34: 45 | P34: 1 | Q34: 4001 | R34: =VLOOKUP(RC[-1],R7C20:R15C21,2,FALSE) -> 200|125 | S34: 100|0
A35: 29 | B35: 第29章 阴影之城 | C35: 3 | D35: 3 | E35: =10001+RC[-4]*100&"|"&10002+RC[-4]*100&"|"&10003+RC[-4]*100&"|"&10004+RC[-4]*100&"|"&10005+RC[-4]*100&"|"&10006+RC[-4]*100&"|"&10007+RC[-4]*100&"|"&10008+RC[-4]*100&"|"&10009+RC[-4]*100&"|"&10010+RC[-4]*100 -> 12901|12902|12903|12904|12905|12906|12907|12908|12909|12910 | F35: =VLOOKUP(RC[11],R7C20:R15C22,3,FALSE) -> 313|168#421|209#388|402#493|438#597|426#690|300#793|338#733|448#848|484#973|502 | G35: 10|20|30 | H35: 19005|19003|10002|10003 | I35: =MIN(100,INT((RC[-8]+4)/5)*10+10)&"|"&INT((RC[-8]+4)/5)*2500+2500&"|10|"&INT((RC[-8]+9)/5)*2+6 -> 70|17500|10|20 | J35: 19005|19003|10002|10018 | K35: =MIN(120,INT((RC[-10]+4)/5)*10+20)&"|"&INT((RC[-10]+9)/5)*5000&"|15|3" -> 80|35000|15|3 | L35: ="19005|19003|10002|"&IF(AND(RC[-11]>15,MOD(RC[-11],3)=0),13314,10001) -> 19005|19003|10002|10001 | M35: =MIN(150,INT((RC[-12]+4)/5)*10+40)&"|"&INT((RC[-12]+9)/5)*5000&"|20|"&IF(AND(RC[-12]>15,MOD(RC[-12],3)=0),10,2) -> 100|35000|20|2 | N35: 28 | O35: 45 | P35: 1 | Q35: 3001 | R35: =VLOOKUP(RC[-1],R7C20:R15C21,2,FALSE) -> 286|95 | S35: 120|0
A36: 30 | B36: 第30章 科技之争 | C36: 5 | D36: 1 | E36: =10001+RC[-4]*100&"|"&10002+RC[-4]*100&"|"&10003+RC[-4]*100&"|"&10004+RC[-4]*100&"|"&10005+RC[-4]*100&"|"&10006+RC[-4]*100&"|"&10007+RC[-4]*100&"|"&10008+RC[-4]*100&"|"&10009+RC[-4]*100&"|"&10010+RC[-4]*100 -> 13001|13002|13003|13004|13005|13006|13007|13008|13009|13010 | F36: =VLOOKUP(RC[11],R7C20:R15C22,3,FALSE) -> 494|210#404|260#404|430#524|420#634|465#724|430#624|270#804|240#964|330#1094|490 | G36: 10|20|30 | H36: 19005|19003|10002|10003 | I36: =MIN(100,INT((RC[-8]+4)/5)*10+10)&"|"&INT((RC[-8]+4)/5)*2500+2500&"|10|"&INT((RC[-8]+9)/5)*2+6 -> 70|17500|10|20 | J36: 19005|19003|10002|10018 | K36: =MIN(120,INT((RC[-10]+4)/5)*10+20)&"|"&INT((RC[-10]+9)/5)*5000&"|15|3" -> 80|35000|15|3 | L36: ="19005|19003|10002|"&IF(AND(RC[-11]>15,MOD(RC[-11],3)=0),13314,10001) -> 19005|19003|10002|13314 | M36: =MIN(150,INT((RC[-12]+4)/5)*10+40)&"|"&INT((RC[-12]+9)/5)*5000&"|20|"&IF(AND(RC[-12]>15,MOD(RC[-12],3)=0),10,2) -> 100|35000|20|10 | N36: 29 | O36: 46 | P36: 1 | Q36: 5001 | R36: =VLOOKUP(RC[-1],R7C20:R15C21,2,FALSE) -> 360|143 | S36: 180|0
A37: 31 | B37: 第31章 战争支援 | C37: 2 | D37: 2 | E37: =10001+RC[-4]*100&"|"&10002+RC[-4]*100&"|"&10003+RC[-4]*100&"|"&10004+RC[-4]*100&"|"&10005+RC[-4]*100&"|"&10006+RC[-4]*100&"|"&10007+RC[-4]*100&"|"&10008+RC[-4]*100&"|"&10009+RC[-4]*100&"|"&10010+RC[-4]*100 -> 13101|13102|13103|13104|13105|13106|13107|13108|13109|13110 | F37: =VLOOKUP(RC[11],R7C20:R15C22,3,FALSE) -> 336|448#466|485#664|468#559|323#492|225#626|200#716|265#846|275#968|317#912|501 | G37: 10|20|30 | H37: 19005|19003|10002|10003 | I37: =MIN(100,INT((RC[-8]+4)/5)*10+10)&"|"&INT((RC[-8]+4)/5)*2500+2500&"|10|"&INT((RC[-8]+9)/5)*2+6 -> 80|20000|10|22 | J37: 19005|19003|10002|10018 | K37: =MIN(120,INT((RC[-10]+4)/5)*10+20)&"|"&INT((RC[-10]+9)/5)*5000&"|15|3" -> 90|40000|15|3 | L37: ="19005|19003|10002|"&IF(AND(RC[-11]>15,MOD(RC[-11],3)=0),13314,10001) -> 19005|19003|10002|10001 | M37: =MIN(150,INT((RC[-12]+4)/5)*10+40)&"|"&INT((RC[-12]+9)/5)*5000&"|20|"&IF(AND(RC[-12]>15,MOD(RC[-12],3)=0),10,2) -> 110|40000|20|2 | N37: 30 | O37: 46 | P37: 1 | Q37: 2001 | R37: =VLOOKUP(RC[-1],R7C20:R15C21,2,FALSE) -> 322|122 | S37: 120|0
A38: 32 | B38: 第32章 兵临城下 | C38: 4 | D38: 4 | E38: =10001+RC[-4]*100&"|"&10002+RC[-4]*100&"|"&10003+RC[-4]*100&"|"&10004+RC[-4]*100&"|"&10005+RC[-4]*100&"|"&10006+RC[-4]*100&"|"&10007+RC[-4]*100&"|"&10008+RC[-4]*100&"|"&10009+RC[-4]*100&"|"&10010+RC[-4]*100 -> 13201|13202|13203|13204|13205|13206|13207|13208|13209|13210 | F38: =VLOOKUP(RC[11],R7C20:R15C22,3,FALSE) -> 641|210#531|291#364|298#241|390#452|402#650|388#793|328#912|290#1021|310#991|499 | G38: 10|20|30 | H38: 19005|19003|10002|10003 | I38: =MIN(100,INT((RC[-8]+4)/5)*10+10)&"|"&INT((RC[-8]+4)/5)*2500+2500&"|10|"&INT((RC[-8]+9)/5)*2+6 -> 80|20000|10|22 | J38: 19005|19003|10002|10018 | K38: =MIN(120,INT((RC[-10]+4)/5)*10+20)&"|"&INT((RC[-10]+9)/5)*5000&"|15|3" -> 90|40000|15|3 | L38: ="19005|19003|10002|"&IF(AND(RC[-11]>15,MOD(RC[-11],3)=0),13314,10001) -> 19005|19003|10002|10001 | M38: =MIN(150,INT((RC[-12]+4)/5)*10+40)&"|"&INT((RC[-12]+9)/5)*5000&"|20|"&IF(AND(RC[-12]>15,MOD(RC[-12],3)=0),10,2) -> 110|40000|20|2 | N38: 31 | O38: 47 | P38: 1 | Q38: 4002 | R38: =VLOOKUP(RC[-1],R7C20:R15C21,2,FALSE) -> 187|136 | S38: 120|0
A39: 33 | B39: 第33章 正式打响 | C39: 1 | D39: 1 | E39: =10001+RC[-4]*100&"|"&10002+RC[-4]*100&"|"&10003+RC[-4]*100&"|"&10004+RC[-4]*100&"|"&10005+RC[-4]*100&"|"&10006+RC[-4]*100&"|"&10007+RC[-4]*100&"|"&10008+RC[-4]*100&"|"&10009+RC[-4]*100&"|"&10010+RC[-4]*100 -> 13301|13302|13303|13304|13305|13306|13307|13308|13309|13310 | F39: =VLOOKUP(RC[11],R7C20:R15C22,3,FALSE) -> 401|524#475|466#560|416#390|321#507|254#695|288#865|258#1010|296#1070|436#870|504 | G39: 10|20|30 | H39: 19005|19003|10002|10003 | I39: =MIN(100,INT((RC[-8]+4)/5)*10+10)&"|"&INT((RC[-8]+4)/5)*2500+2500&"|10|"&INT((RC[-8]+9)/5)*2+6 -> 80|20000|10|22 | J39: 19005|19003|10002|10018 | K39: =MIN(120,INT((RC[-10]+4)/5)*10+20)&"|"&INT((RC[-10]+9)/5)*5000&"|15|3" -> 90|40000|15|3 | L39: ="19005|19003|10002|"&IF(AND(RC[-11]>15,MOD(RC[-11],3)=0),13314,10001) -> 19005|19003|10002|13314 | M39: =MIN(150,INT((RC[-12]+4)/5)*10+40)&"|"&INT((RC[-12]+9)/5)*5000&"|20|"&IF(AND(RC[-12]>15,MOD(RC[-12],3)=0),10,2) -> 110|40000|20|10 | N39: 32 | O39: 47 | P39: 1 | Q39: 1001 | R39: =VLOOKUP(RC[-1],R7C20:R15C21,2,FALSE) -> 360|147 | S39: 120|0
A40: 34 | B40: 第34章 战争核心 | C40: 3 | D40: 3 | E40: =10001+RC[-4]*100&"|"&10002+RC[-4]*100&"|"&10003+RC[-4]*100&"|"&10004+RC[-4]*100&"|"&10005+RC[-4]*100&"|"&10006+RC[-4]*100&"|"&10007+RC[-4]*100&"|"&10008+RC[-4]*100&"|"&10009+RC[-4]*100&"|"&10010+RC[-4]*100 -> 13401|13402|13403|13404|13405|13406|13407|13408|13409|13410 | F40: =VLOOKUP(RC[11],R7C20:R15C22,3,FALSE) -> 993|198#768|271#623|258#475|273#371|348#470|437#595|425#693|376#861|356#943|493 | G40: 10|20|30 | H40: 19005|19003|10002|10003 | I40: =MIN(100,INT((RC[-8]+4)/5)*10+10)&"|"&INT((RC[-8]+4)/5)*2500+2500&"|10|"&INT((RC[-8]+9)/5)*2+6 -> 80|20000|10|22 | J40: 19005|19003|10002|10018 | K40: =MIN(120,INT((RC[-10]+4)/5)*10+20)&"|"&INT((RC[-10]+9)/5)*5000&"|15|3" -> 90|40000|15|3 | L40: ="19005|19003|10002|"&IF(AND(RC[-11]>15,MOD(RC[-11],3)=0),13314,10001) -> 19005|19003|10002|10001 | M40: =MIN(150,INT((RC[-12]+4)/5)*10+40)&"|"&INT((RC[-12]+9)/5)*5000&"|20|"&IF(AND(RC[-12]>15,MOD(RC[-12],3)=0),10,2) -> 110|40000|20|2 | N40: 33 | O40: 48 | P40: 1 | Q40: 3002 | R40: =VLOOKUP(RC[-1],R7C20:R15C21,2,FALSE) -> 355|126 | S40: 120|0
A41: 35 | B41: 第35章 意料之外 | C41: 4 | D41: 4 | E41: =10001+RC[-4]*100&"|"&10002+RC[-4]*100&"|"&10003+RC[-4]*100&"|"&10004+RC[-4]*100&"|"&10005+RC[-4]*100&"|"&10006+RC[-4]*100&"|"&10007+RC[-4]*100&"|"&10008+RC[-4]*100&"|"&10009+RC[-4]*100&"|"&10010+RC[-4]*100 -> 13501|13502|13503|13504|13505|13506|13507|13508|13509|13510 | F41: =VLOOKUP(RC[11],R7C20:R15C22,3,FALSE) -> 306|193#391|273#216|375#316|398#459|403#589|380#774|328#1023|316#901|433#708|493 | G41: 10|20|30 | H41: 19005|19003|10002|10003 | I41: =MIN(100,INT((RC[-8]+4)/5)*10+10)&"|"&INT((RC[-8]+4)/5)*2500+2500&"|10|"&INT((RC[-8]+9)/5)*2+6 -> 80|20000|10|22 | J41: 19005|19003|10002|10018 | K41: =MIN(120,INT((RC[-10]+4)/5)*10+20)&"|"&INT((RC[-10]+9)/5)*5000&"|15|3" -> 90|40000|15|3 | L41: ="19005|19003|10002|"&IF(AND(RC[-11]>15,MOD(RC[-11],3)=0),13314,10001) -> 19005|19003|10002|10001 | M41: =MIN(150,INT((RC[-12]+4)/5)*10+40)&"|"&INT((RC[-12]+9)/5)*5000&"|20|"&IF(AND(RC[-12]>15,MOD(RC[-12],3)=0),10,2) -> 110|40000|20|2 | N41: 34 | O41: 48 | P41: 1 | Q41: 4001 | R41: =VLOOKUP(RC[-1],R7C20:R15C21,2,FALSE) -> 200|125 | S41: 100|0
A42: 36 | B42: 第36章 硝烟渐没 | C42: 1 | D42: 1 | E42: =10001+RC[-4]*100&"|"&10002+RC[-4]*100&"|"&10003+RC[-4]*100&"|"&10004+RC[-4]*100&"|"&10005+RC[-4]*100&"|"&10006+RC[-4]*100&"|"&10007+RC[-4]*100&"|"&10008+RC[-4]*100&"|"&10009+RC[-4]*100&"|"&10010+RC[-4]*100 -> 13601|13602|13603|13604|13605|13606|13607|13608|13609|13610 | F42: =VLOOKUP(RC[11],R7C20:R15C22,3,FALSE) -> 395|456#537|536#841|531#773|411#637|408#510|370#416|261#690|289#874|273#1090|346 | G42: 10|20|30 | H42: 19005|19003|10002|10003 | I42: =MIN(100,INT((RC[-8]+4)/5)*10+10)&"|"&INT((RC[-8]+4)/5)*2500+2500&"|10|"&INT((RC[-8]+9)/5)*2+6 -> 90|22500|10|24 | J42: 19005|19003|10002|10018 | K42: =MIN(120,INT((RC[-10]+4)/5)*10+20)&"|"&INT((RC[-10]+9)/5)*5000&"|15|3" -> 100|45000|15|3 | L42: ="19005|19003|10002|"&IF(AND(RC[-11]>15,MOD(RC[-11],3)=0),13314,10001) -> 19005|19003|10002|13314 | M42: =MIN(150,INT((RC[-12]+4)/5)*10+40)&"|"&INT((RC[-12]+9)/5)*5000&"|20|"&IF(AND(RC[-12]>15,MOD(RC[-12],3)=0),10,2) -> 120|45000|20|10 | N42: 35 | O42: 49 | P42: 1 | Q42: 1002 | R42: =VLOOKUP(RC[-1],R7C20:R15C21,2,FALSE) -> 370|184 | S42: 120|0
A43: 37 | B43: 第37章 光暗交汇 | C43: 2 | D43: 2 | E43: =10001+RC[-4]*100&"|"&10002+RC[-4]*100&"|"&10003+RC[-4]*100&"|"&10004+RC[-4]*100&"|"&10005+RC[-4]*100&"|"&10006+RC[-4]*100&"|"&10007+RC[-4]*100&"|"&10008+RC[-4]*100&"|"&10009+RC[-4]*100&"|"&10010+RC[-4]*100 -> 13701|13702|13703|13704|13705|13706|13707|13708|13709|13710 | F43: =VLOOKUP(RC[11],R7C20:R15C22,3,FALSE) -> 364|495#524|460#424|345#544|290#674|281#814|285#934|175#1024|275#899|415#994|503 | G43: 10|20|30 | H43: 19005|19003|10002|10003 | I43: =MIN(100,INT((RC[-8]+4)/5)*10+10)&"|"&INT((RC[-8]+4)/5)*2500+2500&"|10|"&INT((RC[-8]+9)/5)*2+6 -> 90|22500|10|24 | J43: 19005|19003|10002|10018 | K43: =MIN(120,INT((RC[-10]+4)/5)*10+20)&"|"&INT((RC[-10]+9)/5)*5000&"|15|3" -> 100|45000|15|3 | L43: ="19005|19003|10002|"&IF(AND(RC[-11]>15,MOD(RC[-11],3)=0),13314,10001) -> 19005|19003|10002|10001 | M43: =MIN(150,INT((RC[-12]+4)/5)*10+40)&"|"&INT((RC[-12]+9)/5)*5000&"|20|"&IF(AND(RC[-12]>15,MOD(RC[-12],3)=0),10,2) -> 120|45000|20|2 | N43: 36 | O43: 49 | P43: 1 | Q43: 2002 | R43: =VLOOKUP(RC[-1],R7C20:R15C21,2,FALSE) -> 343|192 | S43: 120|0
A44: 38 | B44: 第38章 联盟之行 | C44: 4 | D44: 4 | E44: =10001+RC[-4]*100&"|"&10002+RC[-4]*100&"|"&10003+RC[-4]*100&"|"&10004+RC[-4]*100&"|"&10005+RC[-4]*100&"|"&10006+RC[-4]*100&"|"&10007+RC[-4]*100&"|"&10008+RC[-4]*100&"|"&10009+RC[-4]*100&"|"&10010+RC[-4]*100 -> 13801|13802|13803|13804|13805|13806|13807|13808|13809|13810 | F44: =VLOOKUP(RC[11],R7C20:R15C22,3,FALSE) -> 641|210#531|291#364|298#241|390#452|402#650|388#793|328#912|290#1021|310#991|499 | G44: 10|20|30 | H44: 19005|19003|10002|10003 | I44: =MIN(100,INT((RC[-8]+4)/5)*10+10)&"|"&INT((RC[-8]+4)/5)*2500+2500&"|10|"&INT((RC[-8]+9)/5)*2+6 -> 90|22500|10|24 | J44: 19005|19003|10002|10018 | K44: =MIN(120,INT((RC[-10]+4)/5)*10+20)&"|"&INT((RC[-10]+9)/5)*5000&"|15|3" -> 100|45000|15|3 | L44: ="19005|19003|10002|"&IF(AND(RC[-11]>15,MOD(RC[-11],3)=0),13314,10001) -> 19005|19003|10002|10001 | M44: =MIN(150,INT((RC[-12]+4)/5)*10+40)&"|"&INT((RC[-12]+9)/5)*5000&"|20|"&IF(AND(RC[-12]>15,MOD(RC[-12],3)=0),10,2) -> 120|45000|20|2 | N44: 37 | O44: 50 | P44: 1 | Q44: 4002 | R44: =VLOOKUP(RC[-1],R7C20:R15C21,2,FALSE) -> 187|136 | S44: 120|0
A45: 39 | B45: 第39章 自由王国 | C45: 3 | D45: 3 | E45: =10001+RC[-4]*100&"|"&10002+RC[-4]*100&"|"&10003+RC[-4]*100&"|"&10004+RC[-4]*100&"|"&10005+RC[-4]*100&"|"&10006+RC[-4]*100&"|"&10007+RC[-4]*100&"|"&10008+RC[-4]*100&"|"&10009+RC[-4]*100&"|"&10010+RC[-4]*100 -> 13901|13902|13903|13904|13905|13906|13907|13908|13909|13910 | F45: =VLOOKUP(RC[11],R7C20:R15C22,3,FALSE) -> 313|168#421|209#388|402#493|438#597|426#690|300#793|338#733|448#848|484#973|502 | G45: 10|20|30 | H45: 19005|19003|10002|10003 | I45: =MIN(100,INT((RC[-8]+4)/5)*10+10)&"|"&INT((RC[-8]+4)/5)*2500+2500&"|10|"&INT((RC[-8]+9)/5)*2+6 -> 90|22500|10|24 | J45: 19005|19003|10002|10018 | K45: =MIN(120,INT((RC[-10]+4)/5)*10+20)&"|"&INT((RC[-10]+9)/5)*5000&"|15|3" -> 100|45000|15|3 | L45: ="19005|19003|10002|"&IF(AND(RC[-11]>15,MOD(RC[-11],3)=0),13314,10001) -> 19005|19003|10002|13314 | M45: =MIN(150,INT((RC[-12]+4)/5)*10+40)&"|"&INT((RC[-12]+9)/5)*5000&"|20|"&IF(AND(RC[-12]>15,MOD(RC[-12],3)=0),10,2) -> 120|45000|20|10 | N45: 38 | O45: 50 | P45: 1 | Q45: 3001 | R45: =VLOOKUP(RC[-1],R7C20:R15C21,2,FALSE) -> 286|95 | S45: 120|0
A46: 40 | B46: 第40章 大地泰坦 | C46: 5 | D46: 1 | E46: =10001+RC[-4]*100&"|"&10002+RC[-4]*100&"|"&10003+RC[-4]*100&"|"&10004+RC[-4]*100&"|"&10005+RC[-4]*100&"|"&10006+RC[-4]*100&"|"&10007+RC[-4]*100&"|"&10008+RC[-4]*100&"|"&10009+RC[-4]*100&"|"&10010+RC[-4]*100 -> 14001|14002|14003|14004|14005|14006|14007|14008|14009|14010 | F46: =VLOOKUP(RC[11],R7C20:R15C22,3,FALSE) -> 494|210#404|260#404|430#524|420#634|465#724|430#624|270#804|240#964|330#1094|490 | G46: 10|20|30 | H46: 19005|19003|10002|10003 | I46: =MIN(100,INT((RC[-8]+4)/5)*10+10)&"|"&INT((RC[-8]+4)/5)*2500+2500&"|10|"&INT((RC[-8]+9)/5)*2+6 -> 90|22500|10|24 | J46: 19005|19003|10002|10018 | K46: =MIN(120,INT((RC[-10]+4)/5)*10+20)&"|"&INT((RC[-10]+9)/5)*5000&"|15|3" -> 100|45000|15|3 | L46: ="19005|19003|10002|"&IF(AND(RC[-11]>15,MOD(RC[-11],3)=0),13314,10001) -> 19005|19003|10002|10001 | M46: =MIN(150,INT((RC[-12]+4)/5)*10+40)&"|"&INT((RC[-12]+9)/5)*5000&"|20|"&IF(AND(RC[-12]>15,MOD(RC[-12],3)=0),10,2) -> 120|45000|20|2 | N46: 39 | O46: 51 | P46: 1 | Q46: 5001 | R46: =VLOOKUP(RC[-1],R7C20:R15C21,2,FALSE) -> 360|143 | S46: 180|0
A47: 41 | B47: 第41章 科技残骸 | C47: 3 | D47: 3 | E47: =10001+RC[-4]*100&"|"&10002+RC[-4]*100&"|"&10003+RC[-4]*100&"|"&10004+RC[-4]*100&"|"&10005+RC[-4]*100&"|"&10006+RC[-4]*100&"|"&10007+RC[-4]*100&"|"&10008+RC[-4]*100&"|"&10009+RC[-4]*100&"|"&10010+RC[-4]*100 -> 14101|14102|14103|14104|14105|14106|14107|14108|14109|14110 | F47: =VLOOKUP(RC[11],R7C20:R15C22,3,FALSE) -> 993|198#768|271#623|258#475|273#371|348#470|437#595|425#693|376#861|356#943|493 | G47: 10|20|30 | H47: 19005|19003|10002|10003 | I47: =MIN(100,INT((RC[-8]+4)/5)*10+10)&"|"&INT((RC[-8]+4)/5)*2500+2500&"|10|"&INT((RC[-8]+9)/5)*2+6 -> 100|25000|10|26 | J47: 19005|19003|10002|10018 | K47: =MIN(120,INT((RC[-10]+4)/5)*10+20)&"|"&INT((RC[-10]+9)/5)*5000&"|15|3" -> 110|50000|15|3 | L47: ="19005|19003|10002|"&IF(AND(RC[-11]>15,MOD(RC[-11],3)=0),13314,10001) -> 19005|19003|10002|10001 | M47: =MIN(150,INT((RC[-12]+4)/5)*10+40)&"|"&INT((RC[-12]+9)/5)*5000&"|20|"&IF(AND(RC[-12]>15,MOD(RC[-12],3)=0),10,2) -> 130|50000|20|2 | N47: 40 | O47: 51 | P47: 1 | Q47: 3002 | R47: =VLOOKUP(RC[-1],R7C20:R15C21,2,FALSE) -> 355|126 | S47: 120|0
A48: 42 | B48: 第42章 地下基地 | C48: 4 | D48: 4 | E48: =10001+RC[-4]*100&"|"&10002+RC[-4]*100&"|"&10003+RC[-4]*100&"|"&10004+RC[-4]*100&"|"&10005+RC[-4]*100&"|"&10006+RC[-4]*100&"|"&10007+RC[-4]*100&"|"&10008+RC[-4]*100&"|"&10009+RC[-4]*100&"|"&10010+RC[-4]*100 -> 14201|14202|14203|14204|14205|14206|14207|14208|14209|14210 | F48: =VLOOKUP(RC[11],R7C20:R15C22,3,FALSE) -> 306|193#391|273#216|375#316|398#459|403#589|380#774|328#1023|316#901|433#708|493 | G48: 10|20|30 | H48: 19005|19003|10002|10003 | I48: =MIN(100,INT((RC[-8]+4)/5)*10+10)&"|"&INT((RC[-8]+4)/5)*2500+2500&"|10|"&INT((RC[-8]+9)/5)*2+6 -> 100|25000|10|26 | J48: 19005|19003|10002|10018 | K48: =MIN(120,INT((RC[-10]+4)/5)*10+20)&"|"&INT((RC[-10]+9)/5)*5000&"|15|3" -> 110|50000|15|3 | L48: ="19005|19003|10002|"&IF(AND(RC[-11]>15,MOD(RC[-11],3)=0),13314,10001) -> 19005|19003|10002|13314 | M48: =MIN(150,INT((RC[-12]+4)/5)*10+40)&"|"&INT((RC[-12]+9)/5)*5000&"|20|"&IF(AND(RC[-12]>15,MOD(RC[-12],3)=0),10,2) -> 130|50000|20|10 | N48: 41 | O48: 52 | P48: 1 | Q48: 4001 | R48: =VLOOKUP(RC[-1],R7C20:R15C21,2,FALSE) -> 200|125 | S48: 100|0
A49: 43 | B49: 第43章 幻想前哨 | C49: 2 | D49: 2 | E49: =10001+RC[-4]*100&"|"&10002+RC[-4]*100&"|"&10003+RC[-4]*100&"|"&10004+RC[-4]*100&"|"&10005+RC[-4]*100&"|"&10006+RC[-4]*100&"|"&10007+RC[-4]*100&"|"&10008+RC[-4]*100&"|"&10009+RC[-4]*100&"|"&10010+RC[-4]*100 -> 14301|14302|14303|14304|14305|14306|14307|14308|14309|14310 | F49: =VLOOKUP(RC[11],R7C20:R15C22,3,FALSE) -> 336|448#466|485#664|468#559|323#492|225#626|200#716|265#846|275#968|317#912|501 | G49: 10|20|30 | H49: 19005|19003|10002|10003 | I49: =MIN(100,INT((RC[-8]+4)/5)*10+10)&"|"&INT((RC[-8]+4)/5)*2500+2500&"|10|"&INT((RC[-8]+9)/5)*2+6 -> 100|25000|10|26 | J49: 19005|19003|10002|10018 | K49: =MIN(120,INT((RC[-10]+4)/5)*10+20)&"|"&INT((RC[-10]+9)/5)*5000&"|15|3" -> 110|50000|15|3 | L49: ="19005|19003|10002|"&IF(AND(RC[-11]>15,MOD(RC[-11],3)=0),13314,10001) -> 19005|19003|10002|10001 | M49: =MIN(150,INT((RC[-12]+4)/5)*10+40)&"|"&INT((RC[-12]+9)/5)*5000&"|20|"&IF(AND(RC[-12]>15,MOD(RC[-12],3)=0),10,2) -> 130|50000|20|2 | N49: 42 | O49: 52 | P49: 1 | Q49: 2001 | R49: =VLOOKUP(RC[-1],R7C20:R15C21,2,FALSE) -> 322|122 | S49: 120|0
A50: 44 | B50: 第44章 前往极地 | C50: 1 | D50: 1 | E50: =10001+RC[-4]*100&"|"&10002+RC[-4]*100&"|"&10003+RC[-4]*100&"|"&10004+RC[-4]*100&"|"&10005+RC[-4]*100&"|"&10006+RC[-4]*100&"|"&10007+RC[-4]*100&"|"&10008+RC[-4]*100&"|"&10009+RC[-4]*100&"|"&10010+RC[-4]*100 -> 14401|14402|14403|14404|14405|14406|14407|14408|14409|14410 | F50: =VLOOKUP(RC[11],R7C20:R15C22,3,FALSE) -> 395|456#537|536#841|531#773|411#637|408#510|370#416|261#690|289#874|273#1090|346 | G50: 10|20|30 | H50: 19005|19003|10002|10003 | I50: =MIN(100,INT((RC[-8]+4)/5)*10+10)&"|"&INT((RC[-8]+4)/5)*2500+2500&"|10|"&INT((RC[-8]+9)/5)*2+6 -> 100|25000|10|26 | J50: 19005|19003|10002|10018 | K50: =MIN(120,INT((RC[-10]+4)/5)*10+20)&"|"&INT((RC[-10]+9)/5)*5000&"|15|3" -> 110|50000|15|3 | L50: ="19005|19003|10002|"&IF(AND(RC[-11]>15,MOD(RC[-11],3)=0),13314,10001) -> 19005|19003|10002|10001 | M50: =MIN(150,INT((RC[-12]+4)/5)*10+40)&"|"&INT((RC[-12]+9)/5)*5000&"|20|"&IF(AND(RC[-12]>15,MOD(RC[-12],3)=0),10,2) -> 130|50000|20|2 | N50: 43 | O50: 53 | P50: 1 | Q50: 1002 | R50: =VLOOKUP(RC[-1],R7C20:R15C21,2,FALSE) -> 370|184 | S50: 120|0
A51: 45 | B51: 第45章 万里冰封 | C51: 4 | D51: 4 | E51: =10001+RC[-4]*100&"|"&10002+RC[-4]*100&"|"&10003+RC[-4]*100&"|"&10004+RC[-4]*100&"|"&10005+RC[-4]*100&"|"&10006+RC[-4]*100&"|"&10007+RC[-4]*100&"|"&10008+RC[-4]*100&"|"&10009+RC[-4]*100&"|"&10010+RC[-4]*100 -> 14501|14502|14503|14504|14505|14506|14507|14508|14509|14510 | F51: =VLOOKUP(RC[11],R7C20:R15C22,3,FALSE) -> 641|210#531|291#364|298#241|390#452|402#650|388#793|328#912|290#1021|310#991|499 | G51: 10|20|30 | H51: 19005|19003|10002|10003 | I51: =MIN(100,INT((RC[-8]+4)/5)*10+10)&"|"&INT((RC[-8]+4)/5)*2500+2500&"|10|"&INT((RC[-8]+9)/5)*2+6 -> 100|25000|10|26 | J51: 19005|19003|10002|10018 | K51: =MIN(120,INT((RC[-10]+4)/5)*10+20)&"|"&INT((RC[-10]+9)/5)*5000&"|15|3" -> 110|50000|15|3 | L51: ="19005|19003|10002|"&IF(AND(RC[-11]>15,MOD(RC[-11],3)=0),13314,10001) -> 19005|19003|10002|13314 | M51: =MIN(150,INT((RC[-12]+4)/5)*10+40)&"|"&INT((RC[-12]+9)/5)*5000&"|20|"&IF(AND(RC[-12]>15,MOD(RC[-12],3)=0),10,2) -> 130|50000|20|10 | N51: 44 | O51: 54 | P51: 1 | Q51: 4002 | R51: =VLOOKUP(RC[-1],R7C20:R15C21,2,FALSE) -> 187|136 | S51: 120|0
A52: 46 | B52: 第46章 鲜血之城 | C52: 3 | D52: 3 | E52: =10001+RC[-4]*100&"|"&10002+RC[-4]*100&"|"&10003+RC[-4]*100&"|"&10004+RC[-4]*100&"|"&10005+RC[-4]*100&"|"&10006+RC[-4]*100&"|"&10007+RC[-4]*100&"|"&10008+RC[-4]*100&"|"&10009+RC[-4]*100&"|"&10010+RC[-4]*100 -> 14601|14602|14603|14604|14605|14606|14607|14608|14609|14610 | F52: =VLOOKUP(RC[11],R7C20:R15C22,3,FALSE) -> 313|168#421|209#388|402#493|438#597|426#690|300#793|338#733|448#848|484#973|502 | G52: 10|20|30 | H52: 19005|19003|10002|10003 | I52: =MIN(100,INT((RC[-8]+4)/5)*10+10)&"|"&INT((RC[-8]+4)/5)*2500+2500&"|10|"&INT((RC[-8]+9)/5)*2+6 -> 100|27500|10|28 | J52: 19005|19003|10002|10018 | K52: =MIN(120,INT((RC[-10]+4)/5)*10+20)&"|"&INT((RC[-10]+9)/5)*5000&"|15|3" -> 120|55000|15|3 | L52: ="19005|19003|10002|"&IF(AND(RC[-11]>15,MOD(RC[-11],3)=0),13314,10001) -> 19005|19003|10002|10001 | M52: =MIN(150,INT((RC[-12]+4)/5)*10+40)&"|"&INT((RC[-12]+9)/5)*5000&"|20|"&IF(AND(RC[-12]>15,MOD(RC[-12],3)=0),10,2) -> 140|55000|20|2 | N52: 45 | O52: 55 | P52: 1 | Q52: 3001 | R52: =VLOOKUP(RC[-1],R7C20:R15C21,2,FALSE) -> 286|95 | S52: 120|0
A53: 47 | B53: 第47章 黄昏沙漠 | C53: 1 | D53: 1 | E53: =10001+RC[-4]*100&"|"&10002+RC[-4]*100&"|"&10003+RC[-4]*100&"|"&10004+RC[-4]*100&"|"&10005+RC[-4]*100&"|"&10006+RC[-4]*100&"|"&10007+RC[-4]*100&"|"&10008+RC[-4]*100&"|"&10009+RC[-4]*100&"|"&10010+RC[-4]*100 -> 14701|14702|14703|14704|14705|14706|14707|14708|14709|14710 | F53: =VLOOKUP(RC[11],R7C20:R15C22,3,FALSE) -> 401|524#475|466#560|416#390|321#507|254#695|288#865|258#1010|296#1070|436#870|504 | G53: 10|20|30 | H53: 19005|19003|10002|10003 | I53: =MIN(100,INT((RC[-8]+4)/5)*10+10)&"|"&INT((RC[-8]+4)/5)*2500+2500&"|10|"&INT((RC[-8]+9)/5)*2+6 -> 100|27500|10|28 | J53: 19005|19003|10002|10018 | K53: =MIN(120,INT((RC[-10]+4)/5)*10+20)&"|"&INT((RC[-10]+9)/5)*5000&"|15|3" -> 120|55000|15|3 | L53: ="19005|19003|10002|"&IF(AND(RC[-11]>15,MOD(RC[-11],3)=0),13314,10001) -> 19005|19003|10002|10001 | M53: =MIN(150,INT((RC[-12]+4)/5)*10+40)&"|"&INT((RC[-12]+9)/5)*5000&"|20|"&IF(AND(RC[-12]>15,MOD(RC[-12],3)=0),10,2) -> 140|55000|20|2 | N53: 46 | O53: 56 | P53: 1 | Q53: 1001 | R53: =VLOOKUP(RC[-1],R7C20:R15C21,2,FALSE) -> 360|147 | S53: 120|0
A54: 48 | B54: 第48章 暗影洞窟 | C54: 4 | D54: 4 | E54: =10001+RC[-4]*100&"|"&10002+RC[-4]*100&"|"&10003+RC[-4]*100&"|"&10004+RC[-4]*100&"|"&10005+RC[-4]*100&"|"&10006+RC[-4]*100&"|"&10007+RC[-4]*100&"|"&10008+RC[-4]*100&"|"&10009+RC[-4]*100&"|"&10010+RC[-4]*100 -> 14801|14802|14803|14804|14805|14806|14807|14808|14809|14810 | F54: =VLOOKUP(RC[11],R7C20:R15C22,3,FALSE) -> 641|210#531|291#364|298#241|390#452|402#650|388#793|328#912|290#1021|310#991|499 | G54: 10|20|30 | H54: 19005|19003|10002|10003 | I54: =MIN(100,INT((RC[-8]+4)/5)*10+10)&"|"&INT((RC[-8]+4)/5)*2500+2500&"|10|"&INT((RC[-8]+9)/5)*2+6 -> 100|27500|10|28 | J54: 19005|19003|10002|10018 | K54: =MIN(120,INT((RC[-10]+4)/5)*10+20)&"|"&INT((RC[-10]+9)/5)*5000&"|15|3" -> 120|55000|15|3 | L54: ="19005|19003|10002|"&IF(AND(RC[-11]>15,MOD(RC[-11],3)=0),13314,10001) -> 19005|19003|10002|13314 | M54: =MIN(150,INT((RC[-12]+4)/5)*10+40)&"|"&INT((RC[-12]+9)/5)*5000&"|20|"&IF(AND(RC[-12]>15,MOD(RC[-12],3)=0),10,2) -> 140|55000|20|10 | N54: 47 | O54: 57 | P54: 1 | Q54: 4002 | R54: =VLOOKUP(RC[-1],R7C20:R15C21,2,FALSE) -> 187|136 | S54: 120|0
A55: 49 | B55: 第49章 阴影之刺 | C55: 3 | D55: 3 | E55: =10001+RC[-4]*100&"|"&10002+RC[-4]*100&"|"&10003+RC[-4]*100&"|"&10004+RC[-4]*100&"|"&10005+RC[-4]*100&"|"&10006+RC[-4]*100&"|"&10007+RC[-4]*100&"|"&10008+RC[-4]*100&"|"&10009+RC[-4]*100&"|"&10010+RC[-4]*100 -> 14901|14902|14903|14904|14905|14906|14907|14908|14909|14910 | F55: =VLOOKUP(RC[11],R7C20:R15C22,3,FALSE) -> 993|198#768|271#623|258#475|273#371|348#470|437#595|425#693|376#861|356#943|493 | G55: 10|20|30 | H55: 19005|19003|10002|10003 | I55: =MIN(100,INT((RC[-8]+4)/5)*10+10)&"|"&INT((RC[-8]+4)/5)*2500+2500&"|10|"&INT((RC[-8]+9)/5)*2+6 -> 100|27500|10|28 | J55: 19005|19003|10002|10018 | K55: =MIN(120,INT((RC[-10]+4)/5)*10+20)&"|"&INT((RC[-10]+9)/5)*5000&"|15|3" -> 120|55000|15|3 | L55: ="19005|19003|10002|"&IF(AND(RC[-11]>15,MOD(RC[-11],3)=0),13314,10001) -> 19005|19003|10002|10001 | M55: =MIN(150,INT((RC[-12]+4)/5)*10+40)&"|"&INT((RC[-12]+9)/5)*5000&"|20|"&IF(AND(RC[-12]>15,MOD(RC[-12],3)=0),10,2) -> 140|55000|20|2 | N55: 48 | O55: 58 | P55: 1 | Q55: 3002 | R55: =VLOOKUP(RC[-1],R7C20:R15C21,2,FALSE) -> 355|126 | S55: 120|0
A56: 50 | B56: 第50章 寂静森林 | C56: 2 | D56: 2 | E56: =10001+RC[-4]*100&"|"&10002+RC[-4]*100&"|"&10003+RC[-4]*100&"|"&10004+RC[-4]*100&"|"&10005+RC[-4]*100&"|"&10006+RC[-4]*100&"|"&10007+RC[-4]*100&"|"&10008+RC[-4]*100&"|"&10009+RC[-4]*100&"|"&10010+RC[-4]*100 -> 15001|15002|15003|15004|15005|15006|15007|15008|15009|15010 | F56: =VLOOKUP(RC[11],R7C20:R15C22,3,FALSE) -> 364|495#524|460#424|345#544|290#674|281#814|285#934|175#1024|275#899|415#994|503 | G56: 10|20|30 | H56: 19005|19003|10002|10003 | I56: =MIN(100,INT((RC[-8]+4)/5)*10+10)&"|"&INT((RC[-8]+4)/5)*2500+2500&"|10|"&INT((RC[-8]+9)/5)*2+6 -> 100|27500|10|28 | J56: 19005|19003|10002|10018 | K56: =MIN(120,INT((RC[-10]+4)/5)*10+20)&"|"&INT((RC[-10]+9)/5)*5000&"|15|3" -> 120|55000|15|3 | L56: ="19005|19003|10002|"&IF(AND(RC[-11]>15,MOD(RC[-11],3)=0),13314,10001) -> 19005|19003|10002|10001 | M56: =MIN(150,INT((RC[-12]+4)/5)*10+40)&"|"&INT((RC[-12]+9)/5)*5000&"|20|"&IF(AND(RC[-12]>15,MOD(RC[-12],3)=0),10,2) -> 140|55000|20|2 | N56: 49 | O56: 59 | P56: 1 | Q56: 2002 | R56: =VLOOKUP(RC[-1],R7C20:R15C21,2,FALSE) -> 343|192 | S56: 120|0
A57: 51 | B57: 第51章 狂怒海啸 | C57: 1 | D57: 1 | E57: =10001+RC[-4]*100&"|"&10002+RC[-4]*100&"|"&10003+RC[-4]*100&"|"&10004+RC[-4]*100&"|"&10005+RC[-4]*100&"|"&10006+RC[-4]*100&"|"&10007+RC[-4]*100&"|"&10008+RC[-4]*100&"|"&10009+RC[-4]*100&"|"&10010+RC[-4]*100 -> 15101|15102|15103|15104|15105|15106|15107|15108|15109|15110 | F57: =VLOOKUP(RC[11],R7C20:R15C22,3,FALSE) -> 395|456#537|536#841|531#773|411#637|408#510|370#416|261#690|289#874|273#1090|346 | G57: 10|20|30 | H57: 19005|19003|10002|10003 | I57: =MIN(100,INT((RC[-8]+4)/5)*10+10)&"|"&INT((RC[-8]+4)/5)*2500+2500&"|10|"&INT((RC[-8]+9)/5)*2+6 -> 100|30000|10|30 | J57: 19005|19003|10002|10018 | K57: =MIN(120,INT((RC[-10]+4)/5)*10+20)&"|"&INT((RC[-10]+9)/5)*5000&"|15|3" -> 120|60000|15|3 | L57: ="19005|19003|10002|"&IF(AND(RC[-11]>15,MOD(RC[-11],3)=0),13314,10001) -> 19005|19003|10002|13314 | M57: =MIN(150,INT((RC[-12]+4)/5)*10+40)&"|"&INT((RC[-12]+9)/5)*5000&"|20|"&IF(AND(RC[-12]>15,MOD(RC[-12],3)=0),10,2) -> 150|60000|20|10 | N57: 50 | O57: 60 | P57: 1 | Q57: 1002 | R57: =VLOOKUP(RC[-1],R7C20:R15C21,2,FALSE) -> 370|184 | S57: 120|0
A58: 52 | B58: 第52章 异度入侵 | C58: 4 | D58: 4 | E58: =10001+RC[-4]*100&"|"&10002+RC[-4]*100&"|"&10003+RC[-4]*100&"|"&10004+RC[-4]*100&"|"&10005+RC[-4]*100&"|"&10006+RC[-4]*100&"|"&10007+RC[-4]*100&"|"&10008+RC[-4]*100&"|"&10009+RC[-4]*100&"|"&10010+RC[-4]*100 -> 15201|15202|15203|15204|15205|15206|15207|15208|15209|15210 | F58: =VLOOKUP(RC[11],R7C20:R15C22,3,FALSE) -> 306|193#391|273#216|375#316|398#459|403#589|380#774|328#1023|316#901|433#708|493 | G58: 10|20|30 | H58: 19005|19003|10002|10003 | I58: =MIN(100,INT((RC[-8]+4)/5)*10+10)&"|"&INT((RC[-8]+4)/5)*2500+2500&"|10|"&INT((RC[-8]+9)/5)*2+6 -> 100|30000|10|30 | J58: 19005|19003|10002|10018 | K58: =MIN(120,INT((RC[-10]+4)/5)*10+20)&"|"&INT((RC[-10]+9)/5)*5000&"|15|3" -> 120|60000|15|3 | L58: ="19005|19003|10002|"&IF(AND(RC[-11]>15,MOD(RC[-11],3)=0),13314,10001) -> 19005|19003|10002|10001 | M58: =MIN(150,INT((RC[-12]+4)/5)*10+40)&"|"&INT((RC[-12]+9)/5)*5000&"|20|"&IF(AND(RC[-12]>15,MOD(RC[-12],3)=0),10,2) -> 150|60000|20|2 | N58: 51 | O58: 61 | P58: 1 | Q58: 4001 | R58: =VLOOKUP(RC[-1],R7C20:R15C21,2,FALSE) -> 200|125 | S58: 100|0
A59: 53 | B59: 第53章 奔腾掠夺 | C59: 3 | D59: 3 | E59: =10001+RC[-4]*100&"|"&10002+RC[-4]*100&"|"&10003+RC[-4]*100&"|"&10004+RC[-4]*100&"|"&10005+RC[-4]*100&"|"&10006+RC[-4]*100&"|"&10007+RC[-4]*100&"|"&10008+RC[-4]*100&"|"&10009+RC[-4]*100&"|"&10010+RC[-4]*100 -> 15301|15302|15303|15304|15305|15306|15307|15308|15309|15310 | F59: =VLOOKUP(RC[11],R7C20:R15C22,3,FALSE) -> 313|168#421|209#388|402#493|438#597|426#690|300#793|338#733|448#848|484#973|502 | G59: 10|20|30 | H59: 19005|19003|10002|10003 | I59: =MIN(100,INT((RC[-8]+4)/5)*10+10)&"|"&INT((RC[-8]+4)/5)*2500+2500&"|10|"&INT((RC[-8]+9)/5)*2+6 -> 100|30000|10|30 | J59: 19005|19003|10002|10018 | K59: =MIN(120,INT((RC[-10]+4)/5)*10+20)&"|"&INT((RC[-10]+9)/5)*5000&"|15|3" -> 120|60000|15|3 | L59: ="19005|19003|10002|"&IF(AND(RC[-11]>15,MOD(RC[-11],3)=0),13314,10001) -> 19005|19003|10002|10001 | M59: =MIN(150,INT((RC[-12]+4)/5)*10+40)&"|"&INT((RC[-12]+9)/5)*5000&"|20|"&IF(AND(RC[-12]>15,MOD(RC[-12],3)=0),10,2) -> 150|60000|20|2 | N59: 52 | O59: 62 | P59: 1 | Q59: 3001 | R59: =VLOOKUP(RC[-1],R7C20:R15C21,2,FALSE) -> 286|95 | S59: 120|0
A60: 54 | B60: 第54章 无义之武 | C60: 1 | D60: 1 | E60: =10001+RC[-4]*100&"|"&10002+RC[-4]*100&"|"&10003+RC[-4]*100&"|"&10004+RC[-4]*100&"|"&10005+RC[-4]*100&"|"&10006+RC[-4]*100&"|"&10007+RC[-4]*100&"|"&10008+RC[-4]*100&"|"&10009+RC[-4]*100&"|"&10010+RC[-4]*100 -> 15401|15402|15403|15404|15405|15406|15407|15408|15409|15410 | F60: =VLOOKUP(RC[11],R7C20:R15C22,3,FALSE) -> 401|524#475|466#560|416#390|321#507|254#695|288#865|258#1010|296#1070|436#870|504 | G60: 10|20|30 | H60: 19005|19003|10002|10003 | I60: =MIN(100,INT((RC[-8]+4)/5)*10+10)&"|"&INT((RC[-8]+4)/5)*2500+2500&"|10|"&INT((RC[-8]+9)/5)*2+6 -> 100|30000|10|30 | J60: 19005|19003|10002|10018 | K60: =MIN(120,INT((RC[-10]+4)/5)*10+20)&"|"&INT((RC[-10]+9)/5)*5000&"|15|3" -> 120|60000|15|3 | L60: ="19005|19003|10002|"&IF(AND(RC[-11]>15,MOD(RC[-11],3)=0),13314,10001) -> 19005|19003|10002|13314 | M60: =MIN(150,INT((RC[-12]+4)/5)*10+40)&"|"&INT((RC[-12]+9)/5)*5000&"|20|"&IF(AND(RC[-12]>15,MOD(RC[-12],3)=0),10,2) -> 150|60000|20|10 | N60: 53 | O60: 63 | P60: 1 | Q60: 1001 | R60: =VLOOKUP(RC[-1],R7C20:R15C21,2,FALSE) -> 360|147 | S60: 120|0
A61: 55 | B61: 第55章 城下战争 | C61: 4 | D61: 4 | E61: =10001+RC[-4]*100&"|"&10002+RC[-4]*100&"|"&10003+RC[-4]*100&"|"&10004+RC[-4]*100&"|"&10005+RC[-4]*100&"|"&10006+RC[-4]*100&"|"&10007+RC[-4]*100&"|"&10008+RC[-4]*100&"|"&10009+RC[-4]*100&"|"&10010+RC[-4]*100 -> 15501|15502|15503|15504|15505|15506|15507|15508|15509|15510 | F61: =VLOOKUP(RC[11],R7C20:R15C22,3,FALSE) -> 641|210#531|291#364|298#241|390#452|402#650|388#793|328#912|290#1021|310#991|499 | G61: 10|20|30 | H61: 19005|19003|10002|10003 | I61: =MIN(100,INT((RC[-8]+4)/5)*10+10)&"|"&INT((RC[-8]+4)/5)*2500+2500&"|10|"&INT((RC[-8]+9)/5)*2+6 -> 100|30000|10|30 | J61: 19005|19003|10002|10018 | K61: =MIN(120,INT((RC[-10]+4)/5)*10+20)&"|"&INT((RC[-10]+9)/5)*5000&"|15|3" -> 120|60000|15|3 | L61: ="19005|19003|10002|"&IF(AND(RC[-11]>15,MOD(RC[-11],3)=0),13314,10001) -> 19005|19003|10002|10001 | M61: =MIN(150,INT((RC[-12]+4)/5)*10+40)&"|"&INT((RC[-12]+9)/5)*5000&"|20|"&IF(AND(RC[-12]>15,MOD(RC[-12],3)=0),10,2) -> 150|60000|20|2 | N61: 54 | O61: 64 | P61: 1 | Q61: 4002 | R61: =VLOOKUP(RC[-1],R7C20:R15C21,2,FALSE) -> 187|136 | S61: 120|0
A62: 56 | B62: 第56章 暗影议会 | C62: 4 | D62: 1 | E62: =10001+RC[-4]*100&"|"&10002+RC[-4]*100&"|"&10003+RC[-4]*100&"|"&10004+RC[-4]*100&"|"&10005+RC[-4]*100&"|"&10006+RC[-4]*100&"|"&10007+RC[-4]*100&"|"&10008+RC[-4]*100&"|"&10009+RC[-4]*100&"|"&10010+RC[-4]*100 -> 15601|15602|15603|15604|15605|15606|15607|15608|15609|15610 | F62: =VLOOKUP(RC[11],R7C20:R15C22,3,FALSE) -> 306|193#391|273#216|375#316|398#459|403#589|380#774|328#1023|316#901|433#708|493 | G62: 10|20|30 | H62: 19005|19003|10002|10003 | I62: =MIN(100,INT((RC[-8]+4)/5)*10+10)&"|"&INT((RC[-8]+4)/5)*2500+2500&"|10|"&INT((RC[-8]+9)/5)*2+6 -> 100|32500|10|32 | J62: 19005|19003|10002|10018 | K62: =MIN(120,INT((RC[-10]+4)/5)*10+20)&"|"&INT((RC[-10]+9)/5)*5000&"|15|3" -> 120|65000|15|3 | L62: ="19005|19003|10002|"&IF(AND(RC[-11]>15,MOD(RC[-11],3)=0),13314,10001) -> 19005|19003|10002|10001 | M62: =MIN(150,INT((RC[-12]+4)/5)*10+40)&"|"&INT((RC[-12]+9)/5)*5000&"|20|"&IF(AND(RC[-12]>15,MOD(RC[-12],3)=0),10,2) -> 150|65000|20|2 | N62: 55 | O62: 65 | P62: 1 | Q62: 4001 | R62: =VLOOKUP(RC[-1],R7C20:R15C21,2,FALSE) -> 200|125 | S62: 100|0
A63: 57 | B63: 第57章 塔纳利斯 | C63: 1 | D63: 3 | E63: =10001+RC[-4]*100&"|"&10002+RC[-4]*100&"|"&10003+RC[-4]*100&"|"&10004+RC[-4]*100&"|"&10005+RC[-4]*100&"|"&10006+RC[-4]*100&"|"&10007+RC[-4]*100&"|"&10008+RC[-4]*100&"|"&10009+RC[-4]*100&"|"&10010+RC[-4]*100 -> 15701|15702|15703|15704|15705|15706|15707|15708|15709|15710 | F63: =VLOOKUP(RC[11],R7C20:R15C22,3,FALSE) -> 395|456#537|536#841|531#773|411#637|408#510|370#416|261#690|289#874|273#1090|346 | G63: 10|20|30 | H63: 19005|19003|10002|10003 | I63: =MIN(100,INT((RC[-8]+4)/5)*10+10)&"|"&INT((RC[-8]+4)/5)*2500+2500&"|10|"&INT((RC[-8]+9)/5)*2+6 -> 100|32500|10|32 | J63: 19005|19003|10002|10018 | K63: =MIN(120,INT((RC[-10]+4)/5)*10+20)&"|"&INT((RC[-10]+9)/5)*5000&"|15|3" -> 120|65000|15|3 | L63: ="19005|19003|10002|"&IF(AND(RC[-11]>15,MOD(RC[-11],3)=0),13314,10001) -> 19005|19003|10002|13314 | M63: =MIN(150,INT((RC[-12]+4)/5)*10+40)&"|"&INT((RC[-12]+9)/5)*5000&"|20|"&IF(AND(RC[-12]>15,MOD(RC[-12],3)=0),10,2) -> 150|65000|20|10 | N63: 56 | O63: 66 | P63: 1 | Q63: 1002 | R63: =VLOOKUP(RC[-1],R7C20:R15C21,2,FALSE) -> 370|184 | S63: 120|0
A64: 58 | B64: 第58章 风暴之巅 | C64: 3 | D64: 1 | E64: =10001+RC[-4]*100&"|"&10002+RC[-4]*100&"|"&10003+RC[-4]*100&"|"&10004+RC[-4]*100&"|"&10005+RC[-4]*100&"|"&10006+RC[-4]*100&"|"&10007+RC[-4]*100&"|"&10008+RC[-4]*100&"|"&10009+RC[-4]*100&"|"&10010+RC[-4]*100 -> 15801|15802|15803|15804|15805|15806|15807|15808|15809|15810 | F64: =VLOOKUP(RC[11],R7C20:R15C22,3,FALSE) -> 313|168#421|209#388|402#493|438#597|426#690|300#793|338#733|448#848|484#973|502 | G64: 10|20|30 | H64: 19005|19003|10002|10003 | I64: =MIN(100,INT((RC[-8]+4)/5)*10+10)&"|"&INT((RC[-8]+4)/5)*2500+2500&"|10|"&INT((RC[-8]+9)/5)*2+6 -> 100|32500|10|32 | J64: 19005|19003|10002|10018 | K64: =MIN(120,INT((RC[-10]+4)/5)*10+20)&"|"&INT((RC[-10]+9)/5)*5000&"|15|3" -> 120|65000|15|3 | L64: ="19005|19003|10002|"&IF(AND(RC[-11]>15,MOD(RC[-11],3)=0),13314,10001) -> 19005|19003|10002|10001 | M64: =MIN(150,INT((RC[-12]+4)/5)*10+40)&"|"&INT((RC[-12]+9)/5)*5000&"|20|"&IF(AND(RC[-12]>15,MOD(RC[-12],3)=0),10,2) -> 150|65000|20|2 | N64: 57 | O64: 67 | P64: 1 | Q64: 3001 | R64: =VLOOKUP(RC[-1],R7C20:R15C21,2,FALSE) -> 286|95 | S64: 120|0
A65: 59 | B65: 第59章 黑暗谷 | C65: 4 | D65: 2 | E65: =10001+RC[-4]*100&"|"&10002+RC[-4]*100&"|"&10003+RC[-4]*100&"|"&10004+RC[-4]*100&"|"&10005+RC[-4]*100&"|"&10006+RC[-4]*100&"|"&10007+RC[-4]*100&"|"&10008+RC[-4]*100&"|"&10009+RC[-4]*100&"|"&10010+RC[-4]*100 -> 15901|15902|15903|15904|15905|15906|15907|15908|15909|15910 | F65: =VLOOKUP(RC[11],R7C20:R15C22,3,FALSE) -> 306|193#391|273#216|375#316|398#459|403#589|380#774|328#1023|316#901|433#708|493 | G65: 10|20|30 | H65: 19005|19003|10002|10003 | I65: =MIN(100,INT((RC[-8]+4)/5)*10+10)&"|"&INT((RC[-8]+4)/5)*2500+2500&"|10|"&INT((RC[-8]+9)/5)*2+6 -> 100|32500|10|32 | J65: 19005|19003|10002|10018 | K65: =MIN(120,INT((RC[-10]+4)/5)*10+20)&"|"&INT((RC[-10]+9)/5)*5000&"|15|3" -> 120|65000|15|3 | L65: ="19005|19003|10002|"&IF(AND(RC[-11]>15,MOD(RC[-11],3)=0),13314,10001) -> 19005|19003|10002|10001 | M65: =MIN(150,INT((RC[-12]+4)/5)*10+40)&"|"&INT((RC[-12]+9)/5)*5000&"|20|"&IF(AND(RC[-12]>15,MOD(RC[-12],3)=0),10,2) -> 150|65000|20|2 | N65: 58 | O65: 68 | P65: 1 | Q65: 4001 | R65: =VLOOKUP(RC[-1],R7C20:R15C21,2,FALSE) -> 200|125 | S65: 100|0
A66: 60 | B66: 第60章 沼泽之地 | C66: 2 | D66: 4 | E66: =10001+RC[-4]*100&"|"&10002+RC[-4]*100&"|"&10003+RC[-4]*100&"|"&10004+RC[-4]*100&"|"&10005+RC[-4]*100&"|"&10006+RC[-4]*100&"|"&10007+RC[-4]*100&"|"&10008+RC[-4]*100&"|"&10009+RC[-4]*100&"|"&10010+RC[-4]*100 -> 16001|16002|16003|16004|16005|16006|16007|16008|16009|16010 | F66: =VLOOKUP(RC[11],R7C20:R15C22,3,FALSE) -> 336|448#466|485#664|468#559|323#492|225#626|200#716|265#846|275#968|317#912|501 | G66: 10|20|30 | H66: 19005|19003|10002|10003 | I66: =MIN(100,INT((RC[-8]+4)/5)*10+10)&"|"&INT((RC[-8]+4)/5)*2500+2500&"|10|"&INT((RC[-8]+9)/5)*2+6 -> 100|32500|10|32 | J66: 19005|19003|10002|10018 | K66: =MIN(120,INT((RC[-10]+4)/5)*10+20)&"|"&INT((RC[-10]+9)/5)*5000&"|15|3" -> 120|65000|15|3 | L66: ="19005|19003|10002|"&IF(AND(RC[-11]>15,MOD(RC[-11],3)=0),13314,10001) -> 19005|19003|10002|13314 | M66: =MIN(150,INT((RC[-12]+4)/5)*10+40)&"|"&INT((RC[-12]+9)/5)*5000&"|20|"&IF(AND(RC[-12]>15,MOD(RC[-12],3)=0),10,2) -> 150|65000|20|10 | N66: 59 | O66: 69 | P66: 1 | Q66: 2001 | R66: =VLOOKUP(RC[-1],R7C20:R15C21,2,FALSE) -> 322|122 | S66: 120|0
A67: 61 | B67: 第61章 天界农场 | C67: 1 | D67: 1 | E67: =10001+RC[-4]*100&"|"&10002+RC[-4]*100&"|"&10003+RC[-4]*100&"|"&10004+RC[-4]*100&"|"&10005+RC[-4]*100&"|"&10006+RC[-4]*100&"|"&10007+RC[-4]*100&"|"&10008+RC[-4]*100&"|"&10009+RC[-4]*100&"|"&10010+RC[-4]*100 -> 16101|16102|16103|16104|16105|16106|16107|16108|16109|16110 | F67: =VLOOKUP(RC[11],R7C20:R15C22,3,FALSE) -> 395|456#537|536#841|531#773|411#637|408#510|370#416|261#690|289#874|273#1090|346 | G67: 10|20|30 | H67: 19005|19003|10002|10003 | I67: =MIN(100,INT((RC[-8]+4)/5)*10+10)&"|"&INT((RC[-8]+4)/5)*2500+2500&"|10|"&INT((RC[-8]+9)/5)*2+6 -> 100|35000|10|34 | J67: 19005|19003|10002|10018 | K67: =MIN(120,INT((RC[-10]+4)/5)*10+20)&"|"&INT((RC[-10]+9)/5)*5000&"|15|3" -> 120|70000|15|3 | L67: ="19005|19003|10002|"&IF(AND(RC[-11]>15,MOD(RC[-11],3)=0),13314,10001) -> 19005|19003|10002|10001 | M67: =MIN(150,INT((RC[-12]+4)/5)*10+40)&"|"&INT((RC[-12]+9)/5)*5000&"|20|"&IF(AND(RC[-12]>15,MOD(RC[-12],3)=0),10,2) -> 150|70000|20|2 | N67: 60 | O67: 70 | P67: 1 | Q67: 1002 | R67: =VLOOKUP(RC[-1],R7C20:R15C21,2,FALSE) -> 370|184 | S67: 120|0
A68: 62 | B68: 第62章 了望之城 | C68: 3 | D68: 3 | E68: =10001+RC[-4]*100&"|"&10002+RC[-4]*100&"|"&10003+RC[-4]*100&"|"&10004+RC[-4]*100&"|"&10005+RC[-4]*100&"|"&10006+RC[-4]*100&"|"&10007+RC[-4]*100&"|"&10008+RC[-4]*100&"|"&10009+RC[-4]*100&"|"&10010+RC[-4]*100 -> 16201|16202|16203|16204|16205|16206|16207|16208|16209|16210 | F68: =VLOOKUP(RC[11],R7C20:R15C22,3,FALSE) -> 993|198#768|271#623|258#475|273#371|348#470|437#595|425#693|376#861|356#943|493 | G68: 10|20|30 | H68: 19005|19003|10002|10003 | I68: =MIN(100,INT((RC[-8]+4)/5)*10+10)&"|"&INT((RC[-8]+4)/5)*2500+2500&"|10|"&INT((RC[-8]+9)/5)*2+6 -> 100|35000|10|34 | J68: 19005|19003|10002|10018 | K68: =MIN(120,INT((RC[-10]+4)/5)*10+20)&"|"&INT((RC[-10]+9)/5)*5000&"|15|3" -> 120|70000|15|3 | L68: ="19005|19003|10002|"&IF(AND(RC[-11]>15,MOD(RC[-11],3)=0),13314,10001) -> 19005|19003|10002|10001 | M68: =MIN(150,INT((RC[-12]+4)/5)*10+40)&"|"&INT((RC[-12]+9)/5)*5000&"|20|"&IF(AND(RC[-12]>15,MOD(RC[-12],3)=0),10,2) -> 150|70000|20|2 | N68: 61 | O68: 71 | P68: 1 | Q68: 3002 | R68: =VLOOKUP(RC[-1],R7C20:R15C21,2,FALSE) -> 355|126 | S68: 120|0
A69: 63 | B69: 第63章 约顿海姆 | C69: 2 | D69: 4 | E69: =10001+RC[-4]*100&"|"&10002+RC[-4]*100&"|"&10003+RC[-4]*100&"|"&10004+RC[-4]*100&"|"&10005+RC[-4]*100&"|"&10006+RC[-4]*100&"|"&10007+RC[-4]*100&"|"&10008+RC[-4]*100&"|"&10009+RC[-4]*100&"|"&10010+RC[-4]*100 -> 16301|16302|16303|16304|16305|16306|16307|16308|16309|16310 | F69: =VLOOKUP(RC[11],R7C20:R15C22,3,FALSE) -> 364|495#524|460#424|345#544|290#674|281#814|285#934|175#1024|275#899|415#994|503 | G69: 10|20|30 | H69: 19005|19003|10002|10003 | I69: =MIN(100,INT((RC[-8]+4)/5)*10+10)&"|"&INT((RC[-8]+4)/5)*2500+2500&"|10|"&INT((RC[-8]+9)/5)*2+6 -> 100|35000|10|34 | J69: 19005|19003|10002|10018 | K69: =MIN(120,INT((RC[-10]+4)/5)*10+20)&"|"&INT((RC[-10]+9)/5)*5000&"|15|3" -> 120|70000|15|3 | L69: ="19005|19003|10002|"&IF(AND(RC[-11]>15,MOD(RC[-11],3)=0),13314,10001) -> 19005|19003|10002|13314 | M69: =MIN(150,INT((RC[-12]+4)/5)*10+40)&"|"&INT((RC[-12]+9)/5)*5000&"|20|"&IF(AND(RC[-12]>15,MOD(RC[-12],3)=0),10,2) -> 150|70000|20|10 | N69: 62 | O69: 72 | P69: 1 | Q69: 2002 | R69: =VLOOKUP(RC[-1],R7C20:R15C21,2,FALSE) -> 343|192 | S69: 120|0
A70: 64 | B70: 第64章 残阳关 | C70: 3 | D70: 1 | E70: =10001+RC[-4]*100&"|"&10002+RC[-4]*100&"|"&10003+RC[-4]*100&"|"&10004+RC[-4]*100&"|"&10005+RC[-4]*100&"|"&10006+RC[-4]*100&"|"&10007+RC[-4]*100&"|"&10008+RC[-4]*100&"|"&10009+RC[-4]*100&"|"&10010+RC[-4]*100 -> 16401|16402|16403|16404|16405|16406|16407|16408|16409|16410 | F70: =VLOOKUP(RC[11],R7C20:R15C22,3,FALSE) -> 313|168#421|209#388|402#493|438#597|426#690|300#793|338#733|448#848|484#973|502 | G70: 10|20|30 | H70: 19005|19003|10002|10003 | I70: =MIN(100,INT((RC[-8]+4)/5)*10+10)&"|"&INT((RC[-8]+4)/5)*2500+2500&"|10|"&INT((RC[-8]+9)/5)*2+6 -> 100|35000|10|34 | J70: 19005|19003|10002|10018 | K70: =MIN(120,INT((RC[-10]+4)/5)*10+20)&"|"&INT((RC[-10]+9)/5)*5000&"|15|3" -> 120|70000|15|3 | L70: ="19005|19003|10002|"&IF(AND(RC[-11]>15,MOD(RC[-11],3)=0),13314,10001) -> 19005|19003|10002|10001 | M70: =MIN(150,INT((RC[-12]+4)/5)*10+40)&"|"&INT((RC[-12]+9)/5)*5000&"|20|"&IF(AND(RC[-12]>15,MOD(RC[-12],3)=0),10,2) -> 150|70000|20|2 | N70: 63 | O70: 73 | P70: 1 | Q70: 3001 | R70: =VLOOKUP(RC[-1],R7C20:R15C21,2,FALSE) -> 286|95 | S70: 120|0
A71: 65 | B71: 第65章 秋之原 | C71: 1 | D71: 2 | E71: =10001+RC[-4]*100&"|"&10002+RC[-4]*100&"|"&10003+RC[-4]*100&"|"&10004+RC[-4]*100&"|"&10005+RC[-4]*100&"|"&10006+RC[-4]*100&"|"&10007+RC[-4]*100&"|"&10008+RC[-4]*100&"|"&10009+RC[-4]*100&"|"&10010+RC[-4]*100 -> 16501|16502|16503|16504|16505|16506|16507|16508|16509|16510 | F71: =VLOOKUP(RC[11],R7C20:R15C22,3,FALSE) -> 401|524#475|466#560|416#390|321#507|254#695|288#865|258#1010|296#1070|436#870|504 | G71: 10|20|30 | H71: 19005|19003|10002|10003 | I71: =MIN(100,INT((RC[-8]+4)/5)*10+10)&"|"&INT((RC[-8]+4)/5)*2500+2500&"|10|"&INT((RC[-8]+9)/5)*2+6 -> 100|35000|10|34 | J71: 19005|19003|10002|10018 | K71: =MIN(120,INT((RC[-10]+4)/5)*10+20)&"|"&INT((RC[-10]+9)/5)*5000&"|15|3" -> 120|70000|15|3 | L71: ="19005|19003|10002|"&IF(AND(RC[-11]>15,MOD(RC[-11],3)=0),13314,10001) -> 19005|19003|10002|10001 | M71: =MIN(150,INT((RC[-12]+4)/5)*10+40)&"|"&INT((RC[-12]+9)/5)*5000&"|20|"&IF(AND(RC[-12]>15,MOD(RC[-12],3)=0),10,2) -> 150|70000|20|2 | N71: 64 | O71: 74 | P71: 1 | Q71: 1001 | R71: =VLOOKUP(RC[-1],R7C20:R15C21,2,FALSE) -> 360|147 | S71: 120|0
A72: 66 | B72: 第66章 奥妮克希 | C72: 1 | D72: 1 | E72: =10001+RC[-4]*100&"|"&10002+RC[-4]*100&"|"&10003+RC[-4]*100&"|"&10004+RC[-4]*100&"|"&10005+RC[-4]*100&"|"&10006+RC[-4]*100&"|"&10007+RC[-4]*100&"|"&10008+RC[-4]*100&"|"&10009+RC[-4]*100&"|"&10010+RC[-4]*100 -> 16601|16602|16603|16604|16605|16606|16607|16608|16609|16610 | F72: =VLOOKUP(RC[11],R7C20:R15C22,3,FALSE) -> 641|210#531|291#364|298#241|390#452|402#650|388#793|328#912|290#1021|310#991|499 | G72: 10|20|30 | H72: 19005|19003|10002|10003 | I72: =MIN(100,INT((RC[-8]+4)/5)*10+10)&"|"&INT((RC[-8]+4)/5)*2500+2500&"|10|"&INT((RC[-8]+9)/5)*2+6 -> 100|37500|10|36 | J72: 19005|19003|10002|10018 | K72: =MIN(120,INT((RC[-10]+4)/5)*10+20)&"|"&INT((RC[-10]+9)/5)*5000&"|15|3" -> 120|75000|15|3 | L72: ="19005|19003|10002|"&IF(AND(RC[-11]>15,MOD(RC[-11],3)=0),13314,10001) -> 19005|19003|10002|13314 | M72: =MIN(150,INT((RC[-12]+4)/5)*10+40)&"|"&INT((RC[-12]+9)/5)*5000&"|20|"&IF(AND(RC[-12]>15,MOD(RC[-12],3)=0),10,2) -> 150|75000|20|10 | N72: 65 | O72: 75 | P72: 1 | Q72: 4002 | R72: =VLOOKUP(RC[-1],R7C20:R15C21,2,FALSE) -> 187|136 | S72: 120|0
A73: 67 | B73: 第67章 格鲁尔 | C73: 4 | D73: 4 | E73: =10001+RC[-4]*100&"|"&10002+RC[-4]*100&"|"&10003+RC[-4]*100&"|"&10004+RC[-4]*100&"|"&10005+RC[-4]*100&"|"&10006+RC[-4]*100&"|"&10007+RC[-4]*100&"|"&10008+RC[-4]*100&"|"&10009+RC[-4]*100&"|"&10010+RC[-4]*100 -> 16701|16702|16703|16704|16705|16706|16707|16708|16709|16710 | F73: =VLOOKUP(RC[11],R7C20:R15C22,3,FALSE) -> 401|524#475|466#560|416#390|321#507|254#695|288#865|258#1010|296#1070|436#870|504 | G73: 10|20|30 | H73: 19005|19003|10002|10003 | I73: =MIN(100,INT((RC[-8]+4)/5)*10+10)&"|"&INT((RC[-8]+4)/5)*2500+2500&"|10|"&INT((RC[-8]+9)/5)*2+6 -> 100|37500|10|36 | J73: 19005|19003|10002|10018 | K73: =MIN(120,INT((RC[-10]+4)/5)*10+20)&"|"&INT((RC[-10]+9)/5)*5000&"|15|3" -> 120|75000|15|3 | L73: ="19005|19003|10002|"&IF(AND(RC[-11]>15,MOD(RC[-11],3)=0),13314,10001) -> 19005|19003|10002|10001 | M73: =MIN(150,INT((RC[-12]+4)/5)*10+40)&"|"&INT((RC[-12]+9)/5)*5000&"|20|"&IF(AND(RC[-12]>15,MOD(RC[-12],3)=0),10,2) -> 150|75000|20|2 | N73: 66 | O73: 76 | P73: 1 | Q73: 1001 | R73: =VLOOKUP(RC[-1],R7C20:R15C21,2,FALSE) -> 360|147 | S73: 120|0
A74: 68 | B74: 第68章 玛瑟里顿 | C74: 1 | D74: 1 | E74: =10001+RC[-4]*100&"|"&10002+RC[-4]*100&"|"&10003+RC[-4]*100&"|"&10004+RC[-4]*100&"|"&10005+RC[-4]*100&"|"&10006+RC[-4]*100&"|"&10007+RC[-4]*100&"|"&10008+RC[-4]*100&"|"&10009+RC[-4]*100&"|"&10010+RC[-4]*100 -> 16801|16802|16803|16804|16805|16806|16807|16808|16809|16810 | F74: =VLOOKUP(RC[11],R7C20:R15C22,3,FALSE) -> 306|193#391|273#216|375#316|398#459|403#589|380#774|328#1023|316#901|433#708|493 | G74: 10|20|30 | H74: 19005|19003|10002|10003 | I74: =MIN(100,INT((RC[-8]+4)/5)*10+10)&"|"&INT((RC[-8]+4)/5)*2500+2500&"|10|"&INT((RC[-8]+9)/5)*2+6 -> 100|37500|10|36 | J74: 19005|19003|10002|10018 | K74: =MIN(120,INT((RC[-10]+4)/5)*10+20)&"|"&INT((RC[-10]+9)/5)*5000&"|15|3" -> 120|75000|15|3 | L74: ="19005|19003|10002|"&IF(AND(RC[-11]>15,MOD(RC[-11],3)=0),13314,10001) -> 19005|19003|10002|10001 | M74: =MIN(150,INT((RC[-12]+4)/5)*10+40)&"|"&INT((RC[-12]+9)/5)*5000&"|20|"&IF(AND(RC[-12]>15,MOD(RC[-12],3)=0),10,2) -> 150|75000|20|2 | N74: 67 | O74: 77 | P74: 1 | Q74: 4001 | R74: =VLOOKUP(RC[-1],R7C20:R15C21,2,FALSE) -> 200|125 | S74: 100|0
A75: 69 | B75: 第69章 祖阿曼 | C75: 4 | D75: 4 | E75: =10001+RC[-4]*100&"|"&10002+RC[-4]*100&"|"&10003+RC[-4]*100&"|"&10004+RC[-4]*100&"|"&10005+RC[-4]*100&"|"&10006+RC[-4]*100&"|"&10007+RC[-4]*100&"|"&10008+RC[-4]*100&"|"&10009+RC[-4]*100&"|"&10010+RC[-4]*100 -> 16901|16902|16903|16904|16905|16906|16907|16908|16909|16910 | F75: =VLOOKUP(RC[11],R7C20:R15C22,3,FALSE) -> 993|198#768|271#623|258#475|273#371|348#470|437#595|425#693|376#861|356#943|493 | G75: 10|20|30 | H75: 19005|19003|10002|10003 | I75: =MIN(100,INT((RC[-8]+4)/5)*10+10)&"|"&INT((RC[-8]+4)/5)*2500+2500&"|10|"&INT((RC[-8]+9)/5)*2+6 -> 100|37500|10|36 | J75: 19005|19003|10002|10018 | K75: =MIN(120,INT((RC[-10]+4)/5)*10+20)&"|"&INT((RC[-10]+9)/5)*5000&"|15|3" -> 120|75000|15|3 | L75: ="19005|19003|10002|"&IF(AND(RC[-11]>15,MOD(RC[-11],3)=0),13314,10001) -> 19005|19003|10002|13314 | M75: =MIN(150,INT((RC[-12]+4)/5)*10+40)&"|"&INT((RC[-12]+9)/5)*5000&"|20|"&IF(AND(RC[-12]>15,MOD(RC[-12],3)=0),10,2) -> 150|75000|20|10 | N75: 68 | O75: 78 | P75: 1 | Q75: 3002 | R75: =VLOOKUP(RC[-1],R7C20:R15C21,2,FALSE) -> 355|126 | S75: 120|0
A76: 70 | B76: 第70章 厄运之槌 | C76: 3 | D76: 3 | E76: =10001+RC[-4]*100&"|"&10002+RC[-4]*100&"|"&10003+RC[-4]*100&"|"&10004+RC[-4]*100&"|"&10005+RC[-4]*100&"|"&10006+RC[-4]*100&"|"&10007+RC[-4]*100&"|"&10008+RC[-4]*100&"|"&10009+RC[-4]*100&"|"&10010+RC[-4]*100 -> 17001|17002|17003|17004|17005|17006|17007|17008|17009|17010 | F76: =VLOOKUP(RC[11],R7C20:R15C22,3,FALSE) -> 395|456#537|536#841|531#773|411#637|408#510|370#416|261#690|289#874|273#1090|346 | G76: 10|20|30 | H76: 19005|19003|10002|10003 | I76: =MIN(100,INT((RC[-8]+4)/5)*10+10)&"|"&INT((RC[-8]+4)/5)*2500+2500&"|10|"&INT((RC[-8]+9)/5)*2+6 -> 100|37500|10|36 | J76: 19005|19003|10002|10018 | K76: =MIN(120,INT((RC[-10]+4)/5)*10+20)&"|"&INT((RC[-10]+9)/5)*5000&"|15|3" -> 120|75000|15|3 | L76: ="19005|19003|10002|"&IF(AND(RC[-11]>15,MOD(RC[-11],3)=0),13314,10001) -> 19005|19003|10002|10001 | M76: =MIN(150,INT((RC[-12]+4)/5)*10+40)&"|"&INT((RC[-12]+9)/5)*5000&"|20|"&IF(AND(RC[-12]>15,MOD(RC[-12],3)=0),10,2) -> 150|75000|20|2 | N76: 69 | O76: 79 | P76: 1 | Q76: 1002 | R76: =VLOOKUP(RC[-1],R7C20:R15C21,2,FALSE) -> 370|184 | S76: 120|0
A77: 71 | B77: 第71章 奥金尼 | C77: 1 | D77: 1 | E77: =10001+RC[-4]*100&"|"&10002+RC[-4]*100&"|"&10003+RC[-4]*100&"|"&10004+RC[-4]*100&"|"&10005+RC[-4]*100&"|"&10006+RC[-4]*100&"|"&10007+RC[-4]*100&"|"&10008+RC[-4]*100&"|"&10009+RC[-4]*100&"|"&10010+RC[-4]*100 -> 17101|17102|17103|17104|17105|17106|17107|17108|17109|17110 | F77: =VLOOKUP(RC[11],R7C20:R15C22,3,FALSE) -> 336|448#466|485#664|468#559|323#492|225#626|200#716|265#846|275#968|317#912|501 | G77: 10|20|30 | H77: 19005|19003|10002|10003 | I77: =MIN(100,INT((RC[-8]+4)/5)*10+10)&"|"&INT((RC[-8]+4)/5)*2500+2500&"|10|"&INT((RC[-8]+9)/5)*2+6 -> 100|40000|10|38 | J77: 19005|19003|10002|10018 | K77: =MIN(120,INT((RC[-10]+4)/5)*10+20)&"|"&INT((RC[-10]+9)/5)*5000&"|15|3" -> 120|80000|15|3 | L77: ="19005|19003|10002|"&IF(AND(RC[-11]>15,MOD(RC[-11],3)=0),13314,10001) -> 19005|19003|10002|10001 | M77: =MIN(150,INT((RC[-12]+4)/5)*10+40)&"|"&INT((RC[-12]+9)/5)*5000&"|20|"&IF(AND(RC[-12]>15,MOD(RC[-12],3)=0),10,2) -> 150|80000|20|2 | N77: 70 | O77: 80 | P77: 1 | Q77: 2001 | R77: =VLOOKUP(RC[-1],R7C20:R15C21,2,FALSE) -> 322|122 | S77: 120|0
A78: 72 | B78: 第72章 敦霍尔德 | C78: 2 | D78: 2 | E78: =10001+RC[-4]*100&"|"&10002+RC[-4]*100&"|"&10003+RC[-4]*100&"|"&10004+RC[-4]*100&"|"&10005+RC[-4]*100&"|"&10006+RC[-4]*100&"|"&10007+RC[-4]*100&"|"&10008+RC[-4]*100&"|"&10009+RC[-4]*100&"|"&10010+RC[-4]*100 -> 17201|17202|17203|17204|17205|17206|17207|17208|17209|17210 | F78: =VLOOKUP(RC[11],R7C20:R15C22,3,FALSE) -> 313|168#421|209#388|402#493|438#597|426#690|300#793|338#733|448#848|484#973|502 | G78: 10|20|30 | H78: 19005|19003|10002|10003 | I78: =MIN(100,INT((RC[-8]+4)/5)*10+10)&"|"&INT((RC[-8]+4)/5)*2500+2500&"|10|"&INT((RC[-8]+9)/5)*2+6 -> 100|40000|10|38 | J78: 19005|19003|10002|10018 | K78: =MIN(120,INT((RC[-10]+4)/5)*10+20)&"|"&INT((RC[-10]+9)/5)*5000&"|15|3" -> 120|80000|15|3 | L78: ="19005|19003|10002|"&IF(AND(RC[-11]>15,MOD(RC[-11],3)=0),13314,10001) -> 19005|19003|10002|13314 | M78: =MIN(150,INT((RC[-12]+4)/5)*10+40)&"|"&INT((RC[-12]+9)/5)*5000&"|20|"&IF(AND(RC[-12]>15,MOD(RC[-12],3)=0),10,2) -> 150|80000|20|10 | N78: 71 | O78: 81 | P78: 1 | Q78: 3001 | R78: =VLOOKUP(RC[-1],R7C20:R15C21,2,FALSE) -> 286|95 | S78: 120|0
A79: 73 | B79: 第73章 泰罗卡 | C79: 3 | D79: 3 | E79: =10001+RC[-4]*100&"|"&10002+RC[-4]*100&"|"&10003+RC[-4]*100&"|"&10004+RC[-4]*100&"|"&10005+RC[-4]*100&"|"&10006+RC[-4]*100&"|"&10007+RC[-4]*100&"|"&10008+RC[-4]*100&"|"&10009+RC[-4]*100&"|"&10010+RC[-4]*100 -> 17301|17302|17303|17304|17305|17306|17307|17308|17309|17310 | F79: =VLOOKUP(RC[11],R7C20:R15C22,3,FALSE) -> 401|524#475|466#560|416#390|321#507|254#695|288#865|258#1010|296#1070|436#870|504 | G79: 10|20|30 | H79: 19005|19003|10002|10003 | I79: =MIN(100,INT((RC[-8]+4)/5)*10+10)&"|"&INT((RC[-8]+4)/5)*2500+2500&"|10|"&INT((RC[-8]+9)/5)*2+6 -> 100|40000|10|38 | J79: 19005|19003|10002|10018 | K79: =MIN(120,INT((RC[-10]+4)/5)*10+20)&"|"&INT((RC[-10]+9)/5)*5000&"|15|3" -> 120|80000|15|3 | L79: ="19005|19003|10002|"&IF(AND(RC[-11]>15,MOD(RC[-11],3)=0),13314,10001) -> 19005|19003|10002|10001 | M79: =MIN(150,INT((RC[-12]+4)/5)*10+40)&"|"&INT((RC[-12]+9)/5)*5000&"|20|"&IF(AND(RC[-12]>15,MOD(RC[-12],3)=0),10,2) -> 150|80000|20|2 | N79: 72 | O79: 82 | P79: 1 | Q79: 1001 | R79: =VLOOKUP(RC[-1],R7C20:R15C21,2,FALSE) -> 360|147 | S79: 120|0
A80: 74 | B80: 第74章 希利苏斯 | C80: 1 | D80: 1 | E80: =10001+RC[-4]*100&"|"&10002+RC[-4]*100&"|"&10003+RC[-4]*100&"|"&10004+RC[-4]*100&"|"&10005+RC[-4]*100&"|"&10006+RC[-4]*100&"|"&10007+RC[-4]*100&"|"&10008+RC[-4]*100&"|"&10009+RC[-4]*100&"|"&10010+RC[-4]*100 -> 17401|17402|17403|17404|17405|17406|17407|17408|17409|17410 | F80: =VLOOKUP(RC[11],R7C20:R15C22,3,FALSE) -> 641|210#531|291#364|298#241|390#452|402#650|388#793|328#912|290#1021|310#991|499 | G80: 10|20|30 | H80: 19005|19003|10002|10003 | I80: =MIN(100,INT((RC[-8]+4)/5)*10+10)&"|"&INT((RC[-8]+4)/5)*2500+2500&"|10|"&INT((RC[-8]+9)/5)*2+6 -> 100|40000|10|38 | J80: 19005|19003|10002|10018 | K80: =MIN(120,INT((RC[-10]+4)/5)*10+20)&"|"&INT((RC[-10]+9)/5)*5000&"|15|3" -> 120|80000|15|3 | L80: ="19005|19003|10002|"&IF(AND(RC[-11]>15,MOD(RC[-11],3)=0),13314,10001) -> 19005|19003|10002|10001 | M80: =MIN(150,INT((RC[-12]+4)/5)*10+40)&"|"&INT((RC[-12]+9)/5)*5000&"|20|"&IF(AND(RC[-12]>15,MOD(RC[-12],3)=0),10,2) -> 150|80000|20|2 | N80: 73 | O80: 83 | P80: 1 | Q80: 4002 | R80: =VLOOKUP(RC[-1],R7C20:R15C21,2,FALSE) -> 187|136 | S80: 120|0
A81: 75 | B81: 第75章 海加尔 | C81: 4 | D81: 4 | E81: =10001+RC[-4]*100&"|"&10002+RC[-4]*100&"|"&10003+RC[-4]*100&"|"&10004+RC[-4]*100&"|"&10005+RC[-4]*100&"|"&10006+RC[-4]*100&"|"&10007+RC[-4]*100&"|"&10008+RC[-4]*100&"|"&10009+RC[-4]*100&"|"&10010+RC[-4]*100 -> 17501|17502|17503|17504|17505|17506|17507|17508|17509|17510 | F81: =VLOOKUP(RC[11],R7C20:R15C22,3,FALSE) -> 993|198#768|271#623|258#475|273#371|348#470|437#595|425#693|376#861|356#943|493 | G81: 10|20|30 | H81: 19005|19003|10002|10003 | I81: =MIN(100,INT((RC[-8]+4)/5)*10+10)&"|"&INT((RC[-8]+4)/5)*2500+2500&"|10|"&INT((RC[-8]+9)/5)*2+6 -> 100|40000|10|38 | J81: 19005|19003|10002|10018 | K81: =MIN(120,INT((RC[-10]+4)/5)*10+20)&"|"&INT((RC[-10]+9)/5)*5000&"|15|3" -> 120|80000|15|3 | L81: ="19005|19003|10002|"&IF(AND(RC[-11]>15,MOD(RC[-11],3)=0),13314,10001) -> 19005|19003|10002|13314 | M81: =MIN(150,INT((RC[-12]+4)/5)*10+40)&"|"&INT((RC[-12]+9)/5)*5000&"|20|"&IF(AND(RC[-12]>15,MOD(RC[-12],3)=0),10,2) -> 150|80000|20|10 | N81: 74 | O81: 84 | P81: 1 | Q81: 3002 | R81: =VLOOKUP(RC[-1],R7C20:R15C21,2,FALSE) -> 355|126 | S81: 120|0

Sheet: 日常副本
A1: id|id | B1: name| | C1: week_day_list|week_day_list | D1: daily_battle_times|daily_battle_times | E1: gamelevel_list|map_list | F1: gamelevel_limit_list|map_level_limit_list | G1: bigpic_bg| | H1: difficultypic_bg| | I1: is_lose_also_have_reward|is_lose_also_have_reward | J1: win_condition| | K1: icon_id| | L1: reward_item_id| | M1: reward_item_num| | N1: chat| | O1: model_size|
A2: 不可空 | B2: 不可空 | C2: 不可空 | D2: 不可空 | E2: 不可空 | F2: 不可空 | G2: 不可空 | H2: 不可空 | I2: 不可空 | J2: 可空#不需字段 | K2: 不可空 | L2: 可空#不需字段 | M2: 可空#不需字段 | N2: 不可空 | O2: 不可空
A3: 数字 | B3: 字符串 | C3: 一维数组 | D3: 数字 | E3: 一维数组 | F3: 一维数组 | G3: 数字 | H3: 一维数组 | I3: 数字 | J3: 一维数组 | K3: 数字 | L3: 二维数组 | M3: 二维数组 | N3: 字符串 | O3: 数字
C4: 不定长 | E4: 不定长 | F4: 不定长 | H4: 不定长 | J4: 不定长 | L4: 不定长 | M4: 不定长
A6: 章节(副本类型) | B6: 名称 | C6: 开放星期 | D6: 每日挑战次数 | E6: 关卡列表 | F6: 关卡等级限制列表 | G6: 关卡大背景图片编号 | H6: 难度背景图片编号 | I6: 是否失败也有奖励 | J6: 胜利条件 | K6: 列表图标 | L6: 奖励预览ID列表 | M6: 奖励预览数量列表 | N6: 怪物聊天泡泡 | O6: 怪物模型缩放比例
A7: 1 | B7: 传承核心 | C7: 0|1|2|3|4|5|6 | D7: 2 | E7: 101|102|103|104|105|106|107|108|109|110|111|112 | F7: 24|24|30|36|42|48|54|60|66|72|78|84 | G7: 2000 | H7: 1000|1001|1002|1003|1004|1005|1006 | I7: 1 | J7: 4 | K7: 33400 | L7: 33200|33100#33200|33100#33300|33100#33300|33100#33400|33200#33400|33200#33400|33200#33400|33200#33400|33300#33400|33300#33400|33300#33400|33300 | M7: 5|10#8|20#6|20#8|30#5|10#7|10#8|20#10|20#12|10#15|10#19|20#23|20 | N7: 晶柱损坏程度越高，掉落的传承核心越多 | O7: 0.8
A8: 2 | B8: 金币 | C8: 0|1|2|3|4|5|6 | D8: 2 | E8: 201|202|203|204|205|206|207|208|209|210|211|212 | F8: 26|26|31|37|43|49|55|61|67|73|79|85 | G8: 2001 | H8: 1000|1001|1002|1003|1004|1005|1006 | I8: 1 | J8: 4 | K8: 19003 | L8: 19003#19003#19003#19003#19003#19003#19003#19003#19003#19003#19003#19003 | M8: 141000#238500#354000#487500#639000#808500#996000#1201500#1425000#1818000#2247000#2712000 | N8: 贪婪哥布林伤势越重，掉落的财宝越多 | O8: 1
A9: 3 | B9: 装备精炼石 | C9: 0|1|3|5 | D9: 2 | E9: 301|302|303|304|305|306|307|308|309|310|311|312 | F9: 29|29|32|38|44|50|56|62|68|74|80|86 | G9: 2002 | H9: 1000|1001|1002|1003|1004|1005|1006 | I9: 0 | J9: 3|20 | K9: 10014 | L9: 10012|10011#10012|10011#10012|10011#10013|10012#10013|10012#10013|10012#10014|10013#10014|10013#10014|10013#10014|10013#10014|10013#10014|10013 | M9: 60|10#102|20#150|30#83|20#108|30#137|40#84|20#101|20#120|30#153|30#189|40#228|40 | N9: 20秒内击败我才可以通关！ | O9: 1.2
A10: 4 | B10: 进阶石 | C10: 0|2|4|6 | D10: 2 | E10: 401|402|403|404|405|406|407|408|409|410|411|412 | F10: 31|31|33|39|45|51|57|63|69|75|81|87 | G10: 2003 | H10: 1000|1001|1002|1003|1004|1005|1006 | I10: 0 | J10: 5 | K10: 10002 | L10: 10002#10002#10002#10002#10002#10002#10002#10002#10002#10002#10002#10002 | M10: 75#110#155#205#260#320#385#455#585#725#875#1035 | N10: 击败我，你就可以获得所有奖励 | O10: 0.8
A11: 5 | B11: 圣器水晶 | C11: 0|1|3|5 | D11: 2 | E11: 501|502|503|504|505|506|507|508|509|510|511|512 | F11: 34|34|34|40|46|52|58|64|70|76|82|88 | G11: 2004 | H11: 1000|1001|1002|1003|1004|1005|1006 | I11: 0 | J11: 1|80 | K11: 42301 | L11: 42201#42201#42301|42201#42301|42201#42301|42201#42301|42201#42301|42201#42301|42201#42301|42201#42301|42201#42301|42201#42301|42201 | M11: 9#11#1|5#2|5#3|5#4|10#5|10#6|10#8|10#10|10#12|10#14|10 | N11: 生命值高于80%获胜才能赢得所有奖励 | O11: 1
A12: 6 | B12: 圣器精炼石 | C12: 0|2|4|6 | D12: 2 | E12: 601|602|603|604|605|606|607|608|609|610|611|612 | F12: 39|39|39|41|47|53|59|65|71|77|83|89 | G12: 2005 | H12: 1000|1001|1002|1003|1004|1005|1006 | I12: 0 | J12: 5 | K12: 10010 | L12: 10010#10010#10010#10010#10010#10010#10010#10010#10010#10010#10010#10010 | M12: 20#29#40#52#66#81#98#117#137#158#181#205 | N12: 想要通过这一关，必须击败我们所有人！ | O12: 1.2

Sheet: 英雄副本
A1: id|id | B1: name| | C1: gamelevel_list|map_list | D1: extra_map_id|extra_map_id | E1: gamelevel_pos_list| | F1: pre_chapter_id| | G1: chapter_icon_id| | H1: chapter_bg_id| | I1: gamelevel_line_id| | J1: gamelevel_line_offset_pos|
A2: 不可空 | B2: 不可空 | C2: 不可空 | D2: 不可空 | E2: 不可空 | F2: 可空#不需字段 | G2: 不可空 | H2: 可空#不需字段 | I2: 不可空 | J2: 不可空
A3: 数字 | B3: 字符串 | C3: 一维数组 | D3: 数字 | E3: 二维数组 | F3: 数字 | G3: 数字 | H3: 数字 | I3: 数字 | J3: 一维数组
C4: 不定长 | E4: 不定长 | J4: 不定长
A6: 章节 | B6: 名称 | C6: 关卡列表 | D6: 额外关卡(0表示木有) | E6: 关卡位置列表(x|y#x|y) | F6: 主线前置章节ID | G6: 章节图标ID | H6: 章节背景ID | I6: 关卡路线ID | J6: 关卡路线偏移坐标
A7: 1 | B7: 花神巨像 | C7: =RC[8]&"|"&RC[9]&"|"&RC[10]&"|"&RC[11] -> 60011|60012|60013|60014 | D7: =IF(RC[11]="",0,RC[11]) -> 0 | E7: =VLOOKUP(RC[4],R7C16:R15C17,2,FALSE) -> 414|495#544|290#994|225#934|457 | F7: 1 | G7: 2 | H7: 2 | I7: =IF(RC[-1]=5,5001,RC[-1]*1000+MOD(RC[-8],2)+1) -> 2002 | J7: =VLOOKUP(RC[-1],主线副本!R7C20:R15C21,2,FALSE) -> 343|192 | K7: 60011 | L7: =RC[-1]+1 -> 60012 | M7: =RC[-1]+1 -> 60013 | N7: =RC[-1]+1 -> 60014 | O7: =IF(MOD(RC[-14],3)=0,RC[-1]+1,"") ->  | P7: 1001 | Q7: 520|458#680|296#1020|316#910|480 | R7: 350|442#510|280#850|300#740|464
A8: 2 | B8: 冲锋号角 | C8: =RC[8]&"|"&RC[9]&"|"&RC[10]&"|"&RC[11] -> 60021|60022|60023|60024 | D8: =IF(RC[11]="",0,RC[11]) -> 0 | E8: =VLOOKUP(RC[4],R7C16:R15C17,2,FALSE) -> 311|208#446|418#1024|328#708|473 | F8: 2 | G8: 4 | H8: 4 | I8: =IF(RC[-1]=5,5001,RC[-1]*1000+MOD(RC[-8],2)+1) -> 4001 | J8: =VLOOKUP(RC[-1],主线副本!R7C20:R15C21,2,FALSE) -> 200|125 | K8: =R[-1]C+10 -> 60021 | L8: =RC[-1]+1 -> 60022 | M8: =RC[-1]+1 -> 60023 | N8: =RC[-1]+1 -> 60024 | O8: =IF(MOD(RC[-14],3)=0,RC[-1]+1,"") ->  | P8: 1002 | Q8: 465|499#920|496#663|306#1095|336 | R8: 295|483#750|480#493|290#925|320
A9: 3 | B9: 丛林狩猎 | C9: =RC[8]&"|"&RC[9]&"|"&RC[10]&"|"&RC[11] -> 60031|60032|60033|60034 | D9: =IF(RC[11]="",0,RC[11]) -> 60035 | E9: =VLOOKUP(RC[4],R7C16:R15C17,2,FALSE) -> 414|495#544|290#994|225#934|457 | F9: 3 | G9: 2 | H9: 2 | I9: =IF(RC[-1]=5,5001,RC[-1]*1000+MOD(RC[-8],2)+1) -> 2002 | J9: =VLOOKUP(RC[-1],主线副本!R7C20:R15C21,2,FALSE) -> 343|192 | K9: =R[-1]C+10 -> 60031 | L9: =RC[-1]+1 -> 60032 | M9: =RC[-1]+1 -> 60033 | N9: =RC[-1]+1 -> 60034 | O9: =IF(MOD(RC[-14],3)=0,RC[-1]+1,"") -> 60035 | P9: 2001 | Q9: 491|495#504|245#864|295#909|495 | R9: 357|490#370|240#730|290#775|490
A10: 4 | B10: 温泉关之战 | C10: =RC[8]&"|"&RC[9]&"|"&RC[10]&"|"&RC[11] -> 60041|60042|60043|60044 | D10: =IF(RC[11]="",0,RC[11]) -> 0 | E10: =VLOOKUP(RC[4],R7C16:R15C17,2,FALSE) -> 353|203#528|458#793|338#973|493 | F10: 4 | G10: 3 | H10: 3 | I10: =IF(RC[-1]=5,5001,RC[-1]*1000+MOD(RC[-8],2)+1) -> 3001 | J10: =VLOOKUP(RC[-1],主线副本!R7C20:R15C21,2,FALSE) -> 286|95 | K10: =R[-1]C+10 -> 60041 | L10: =RC[-1]+1 -> 60042 | M10: =RC[-1]+1 -> 60043 | N10: =RC[-1]+1 -> 60044 | O10: =IF(MOD(RC[-14],3)=0,RC[-1]+1,"") ->  | P10: 2002 | Q10: 414|495#544|290#994|225#934|457 | R10: 280|490#410|285#860|220#800|452
A11: 5 | B11: 隼鹰之眼 | C11: =RC[8]&"|"&RC[9]&"|"&RC[10]&"|"&RC[11] -> 60051|60052|60053|60054 | D11: =IF(RC[11]="",0,RC[11]) -> 0 | E11: =VLOOKUP(RC[4],R7C16:R15C17,2,FALSE) -> 531|312#281|411#793|338#991|470 | F11: 5 | G11: 4 | H11: 4 | I11: =IF(RC[-1]=5,5001,RC[-1]*1000+MOD(RC[-8],2)+1) -> 4002 | J11: =VLOOKUP(RC[-1],主线副本!R7C20:R15C21,2,FALSE) -> 187|136 | K11: =R[-1]C+10 -> 60051 | L11: =RC[-1]+1 -> 60052 | M11: =RC[-1]+1 -> 60053 | N11: =RC[-1]+1 -> 60054 | O11: =IF(MOD(RC[-14],3)=0,RC[-1]+1,"") ->  | P11: 3001 | Q11: 353|203#528|458#793|338#973|493 | R11: 210|200#385|455#650|335#830|490
A12: 6 | B12: 正义审判 | C12: =RC[8]&"|"&RC[9]&"|"&RC[10]&"|"&RC[11] -> 60061|60062|60063|60064 | D12: =IF(RC[11]="",0,RC[11]) -> 60065 | E12: =VLOOKUP(RC[4],R7C16:R15C17,2,FALSE) -> 491|495#504|245#864|295#909|495 | F12: 6 | G12: 2 | H12: 2 | I12: =IF(RC[-1]=5,5001,RC[-1]*1000+MOD(RC[-8],2)+1) -> 2001 | J12: =VLOOKUP(RC[-1],主线副本!R7C20:R15C21,2,FALSE) -> 322|122 | K12: =R[-1]C+10 -> 60061 | L12: =RC[-1]+1 -> 60062 | M12: =RC[-1]+1 -> 60063 | N12: =RC[-1]+1 -> 60064 | O12: =IF(MOD(RC[-14],3)=0,RC[-1]+1,"") -> 60065 | P12: 3002 | Q12: 963|223#548|255#529|461#943|483 | R12: 820|220#405|252#386|458#800|480
A13: 7 | B13: 智慧曙光 | C13: =RC[8]&"|"&RC[9]&"|"&RC[10]&"|"&RC[11] -> 60071|60072|60073|60074 | D13: =IF(RC[11]="",0,RC[11]) -> 0 | E13: =VLOOKUP(RC[4],R7C16:R15C17,2,FALSE) -> 963|223#548|255#529|461#943|483 | F13: 7 | G13: 3 | H13: 3 | I13: =IF(RC[-1]=5,5001,RC[-1]*1000+MOD(RC[-8],2)+1) -> 3002 | J13: =VLOOKUP(RC[-1],主线副本!R7C20:R15C21,2,FALSE) -> 355|126 | K13: =R[-1]C+10 -> 60071 | L13: =RC[-1]+1 -> 60072 | M13: =RC[-1]+1 -> 60073 | N13: =RC[-1]+1 -> 60074 | O13: =IF(MOD(RC[-14],3)=0,RC[-1]+1,"") ->  | P13: 4001 | Q13: 311|208#446|418#1024|328#708|473 | R13: 180|208#315|418#893|328#577|473
A14: 8 | B14: 战争之蹄 | C14: =RC[8]&"|"&RC[9]&"|"&RC[10]&"|"&RC[11] -> 60081|60082|60083|60084 | D14: =IF(RC[11]="",0,RC[11]) -> 0 | E14: =VLOOKUP(RC[4],R7C16:R15C17,2,FALSE) -> 520|458#680|296#1020|316#910|480 | F14: 8 | G14: 1 | H14: 1 | I14: =IF(RC[-1]=5,5001,RC[-1]*1000+MOD(RC[-8],2)+1) -> 1001 | J14: =VLOOKUP(RC[-1],主线副本!R7C20:R15C21,2,FALSE) -> 360|147 | K14: =R[-1]C+10 -> 60081 | L14: =RC[-1]+1 -> 60082 | M14: =RC[-1]+1 -> 60083 | N14: =RC[-1]+1 -> 60084 | O14: =IF(MOD(RC[-14],3)=0,RC[-1]+1,"") ->  | P14: 4002 | Q14: 531|312#281|411#793|338#991|470 | R14: 400|312#150|411#662|338#860|470
A15: 9 | B15: 科技结晶 | C15: =RC[8]&"|"&RC[9]&"|"&RC[10]&"|"&RC[11] -> 60091|60092|60093|60094 | D15: =IF(RC[11]="",0,RC[11]) -> 60095 | E15: =VLOOKUP(RC[4],R7C16:R15C17,2,FALSE) -> 531|312#281|411#793|338#991|470 | F15: 9 | G15: 4 | H15: 4 | I15: =IF(RC[-1]=5,5001,RC[-1]*1000+MOD(RC[-8],2)+1) -> 4002 | J15: =VLOOKUP(RC[-1],主线副本!R7C20:R15C21,2,FALSE) -> 187|136 | K15: =R[-1]C+10 -> 60091 | L15: =RC[-1]+1 -> 60092 | M15: =RC[-1]+1 -> 60093 | N15: =RC[-1]+1 -> 60094 | O15: =IF(MOD(RC[-14],3)=0,RC[-1]+1,"") -> 60095 | P15: 5001 | Q15: 394|300#654|480#764|250#1059|400 | R15: 220|300#480|480#590|250#885|400
A16: 10 | B16: 地狱痕迹 | C16: =RC[8]&"|"&RC[9]&"|"&RC[10]&"|"&RC[11] -> 60101|60102|60103|60104 | D16: =IF(RC[11]="",0,RC[11]) -> 0 | E16: =VLOOKUP(RC[4],R7C16:R15C17,2,FALSE) -> 353|203#528|458#793|338#973|493 | F16: 10 | G16: 3 | H16: 3 | I16: =IF(RC[-1]=5,5001,RC[-1]*1000+MOD(RC[-8],2)+1) -> 3001 | J16: =VLOOKUP(RC[-1],主线副本!R7C20:R15C21,2,FALSE) -> 286|95 | K16: =R[-1]C+10 -> 60101 | L16: =RC[-1]+1 -> 60102 | M16: =RC[-1]+1 -> 60103 | N16: =RC[-1]+1 -> 60104 | O16: =IF(MOD(RC[-14],3)=0,RC[-1]+1,"") -> 
A17: 11 | B17: 暗影潜行 | C17: =RC[8]&"|"&RC[9]&"|"&RC[10]&"|"&RC[11] -> 60111|60112|60113|60114 | D17: =IF(RC[11]="",0,RC[11]) -> 0 | E17: =VLOOKUP(RC[4],R7C16:R15C17,2,FALSE) -> 531|312#281|411#793|338#991|470 | F17: 11 | G17: 4 | H17: 4 | I17: =IF(RC[-1]=5,5001,RC[-1]*1000+MOD(RC[-8],2)+1) -> 4002 | J17: =VLOOKUP(RC[-1],主线副本!R7C20:R15C21,2,FALSE) -> 187|136 | K17: =R[-1]C+10 -> 60111 | L17: =RC[-1]+1 -> 60112 | M17: =RC[-1]+1 -> 60113 | N17: =RC[-1]+1 -> 60114 | O17: =IF(MOD(RC[-14],3)=0,RC[-1]+1,"") -> 
A18: 12 | B18: 英雄职责 | C18: =RC[8]&"|"&RC[9]&"|"&RC[10]&"|"&RC[11] -> 60121|60122|60123|60124 | D18: =IF(RC[11]="",0,RC[11]) -> 60125 | E18: =VLOOKUP(RC[4],R7C16:R15C17,2,FALSE) -> 491|495#504|245#864|295#909|495 | F18: 12 | G18: 2 | H18: 2 | I18: =IF(RC[-1]=5,5001,RC[-1]*1000+MOD(RC[-8],2)+1) -> 2001 | J18: =VLOOKUP(RC[-1],主线副本!R7C20:R15C21,2,FALSE) -> 322|122 | K18: =R[-1]C+10 -> 60121 | L18: =RC[-1]+1 -> 60122 | M18: =RC[-1]+1 -> 60123 | N18: =RC[-1]+1 -> 60124 | O18: =IF(MOD(RC[-14],3)=0,RC[-1]+1,"") -> 60125
A19: 13 | B19: 烈焰奥妙 | C19: =RC[8]&"|"&RC[9]&"|"&RC[10]&"|"&RC[11] -> 60131|60132|60133|60134 | D19: =IF(RC[11]="",0,RC[11]) -> 0 | E19: =VLOOKUP(RC[4],R7C16:R15C17,2,FALSE) -> 394|300#654|480#764|250#1059|400 | F19: 13 | G19: 3 | H19: 5 | I19: =IF(RC[-1]=5,5001,RC[-1]*1000+MOD(RC[-8],2)+1) -> 5001 | J19: =VLOOKUP(RC[-1],主线副本!R7C20:R15C21,2,FALSE) -> 360|143 | K19: =R[-1]C+10 -> 60131 | L19: =RC[-1]+1 -> 60132 | M19: =RC[-1]+1 -> 60133 | N19: =RC[-1]+1 -> 60134 | O19: =IF(MOD(RC[-14],3)=0,RC[-1]+1,"") -> 
A20: 14 | B20: 美艳剧毒 | C20: =RC[8]&"|"&RC[9]&"|"&RC[10]&"|"&RC[11] -> 60141|60142|60143|60144 | D20: =IF(RC[11]="",0,RC[11]) -> 0 | E20: =VLOOKUP(RC[4],R7C16:R15C17,2,FALSE) -> 311|208#446|418#1024|328#708|473 | F20: 14 | G20: 4 | H20: 4 | I20: =IF(RC[-1]=5,5001,RC[-1]*1000+MOD(RC[-8],2)+1) -> 4001 | J20: =VLOOKUP(RC[-1],主线副本!R7C20:R15C21,2,FALSE) -> 200|125 | K20: =R[-1]C+10 -> 60141 | L20: =RC[-1]+1 -> 60142 | M20: =RC[-1]+1 -> 60143 | N20: =RC[-1]+1 -> 60144 | O20: =IF(MOD(RC[-14],3)=0,RC[-1]+1,"") -> 
A21: 15 | B21: 无畏之盾 | C21: =RC[8]&"|"&RC[9]&"|"&RC[10]&"|"&RC[11] -> 60151|60152|60153|60154 | D21: =IF(RC[11]="",0,RC[11]) -> 60155 | E21: =VLOOKUP(RC[4],R7C16:R15C17,2,FALSE) -> 414|495#544|290#994|225#934|457 | F21: 15 | G21: 2 | H21: 2 | I21: =IF(RC[-1]=5,5001,RC[-1]*1000+MOD(RC[-8],2)+1) -> 2002 | J21: =VLOOKUP(RC[-1],主线副本!R7C20:R15C21,2,FALSE) -> 343|192 | K21: =R[-1]C+10 -> 60151 | L21: =RC[-1]+1 -> 60152 | M21: =RC[-1]+1 -> 60153 | N21: =RC[-1]+1 -> 60154 | O21: =IF(MOD(RC[-14],3)=0,RC[-1]+1,"") -> 60155
A22: 16 | B22: 王者荣光 | C22: =RC[8]&"|"&RC[9]&"|"&RC[10]&"|"&RC[11] -> 60161|60162|60163|60164 | D22: =IF(RC[11]="",0,RC[11]) -> 0 | E22: =VLOOKUP(RC[4],R7C16:R15C17,2,FALSE) -> 520|458#680|296#1020|316#910|480 | F22: 16 | G22: 1 | H22: 1 | I22: =IF(RC[-1]=5,5001,RC[-1]*1000+MOD(RC[-8],2)+1) -> 1001 | J22: =VLOOKUP(RC[-1],主线副本!R7C20:R15C21,2,FALSE) -> 360|147 | K22: =R[-1]C+10 -> 60161 | L22: =RC[-1]+1 -> 60162 | M22: =RC[-1]+1 -> 60163 | N22: =RC[-1]+1 -> 60164 | O22: =IF(MOD(RC[-14],3)=0,RC[-1]+1,"") -> 
A23: 17 | B23: 侍于死亡 | C23: =RC[8]&"|"&RC[9]&"|"&RC[10]&"|"&RC[11] -> 60171|60172|60173|60174 | D23: =IF(RC[11]="",0,RC[11]) -> 0 | E23: =VLOOKUP(RC[4],R7C16:R15C17,2,FALSE) -> 531|312#281|411#793|338#991|470 | F23: 17 | G23: 4 | H23: 4 | I23: =IF(RC[-1]=5,5001,RC[-1]*1000+MOD(RC[-8],2)+1) -> 4002 | J23: =VLOOKUP(RC[-1],主线副本!R7C20:R15C21,2,FALSE) -> 187|136 | K23: =R[-1]C+10 -> 60171 | L23: =RC[-1]+1 -> 60172 | M23: =RC[-1]+1 -> 60173 | N23: =RC[-1]+1 -> 60174 | O23: =IF(MOD(RC[-14],3)=0,RC[-1]+1,"") -> 
A24: 18 | B24: 神明光辉 | C24: =RC[8]&"|"&RC[9]&"|"&RC[10]&"|"&RC[11] -> 60181|60182|60183|60184 | D24: =IF(RC[11]="",0,RC[11]) -> 60185 | E24: =VLOOKUP(RC[4],R7C16:R15C17,2,FALSE) -> 353|203#528|458#793|338#973|493 | F24: 18 | G24: 3 | H24: 3 | I24: =IF(RC[-1]=5,5001,RC[-1]*1000+MOD(RC[-8],2)+1) -> 3001 | J24: =VLOOKUP(RC[-1],主线副本!R7C20:R15C21,2,FALSE) -> 286|95 | K24: =R[-1]C+10 -> 60181 | L24: =RC[-1]+1 -> 60182 | M24: =RC[-1]+1 -> 60183 | N24: =RC[-1]+1 -> 60184 | O24: =IF(MOD(RC[-14],3)=0,RC[-1]+1,"") -> 60185
A25: 19 | B25: 一醉方休 | C25: =RC[8]&"|"&RC[9]&"|"&RC[10]&"|"&RC[11] -> 60191|60192|60193|60194 | D25: =IF(RC[11]="",0,RC[11]) -> 0 | E25: =VLOOKUP(RC[4],R7C16:R15C17,2,FALSE) -> 465|499#920|496#663|306#1095|336 | F25: 19 | G25: 1 | H25: 1 | I25: =IF(RC[-1]=5,5001,RC[-1]*1000+MOD(RC[-8],2)+1) -> 1002 | J25: =VLOOKUP(RC[-1],主线副本!R7C20:R15C21,2,FALSE) -> 370|184 | K25: =R[-1]C+10 -> 60191 | L25: =RC[-1]+1 -> 60192 | M25: =RC[-1]+1 -> 60193 | N25: =RC[-1]+1 -> 60194 | O25: =IF(MOD(RC[-14],3)=0,RC[-1]+1,"") -> 
A26: 20 | B26: 亡者墓地 | C26: =RC[8]&"|"&RC[9]&"|"&RC[10]&"|"&RC[11] -> 60201|60202|60203|60204 | D26: =IF(RC[11]="",0,RC[11]) -> 0 | E26: =VLOOKUP(RC[4],R7C16:R15C17,2,FALSE) -> 311|208#446|418#1024|328#708|473 | F26: 20 | G26: 4 | H26: 4 | I26: =IF(RC[-1]=5,5001,RC[-1]*1000+MOD(RC[-8],2)+1) -> 4001 | J26: =VLOOKUP(RC[-1],主线副本!R7C20:R15C21,2,FALSE) -> 200|125 | K26: =R[-1]C+10 -> 60201 | L26: =RC[-1]+1 -> 60202 | M26: =RC[-1]+1 -> 60203 | N26: =RC[-1]+1 -> 60204 | O26: =IF(MOD(RC[-14],3)=0,RC[-1]+1,"") -> 
A27: 21 | B27: 绝对力量 | C27: =RC[8]&"|"&RC[9]&"|"&RC[10]&"|"&RC[11] -> 60211|60212|60213|60214 | D27: =IF(RC[11]="",0,RC[11]) -> 60215 | E27: =VLOOKUP(RC[4],R7C16:R15C17,2,FALSE) -> 414|495#544|290#994|225#934|457 | F27: 21 | G27: 2 | H27: 2 | I27: =IF(RC[-1]=5,5001,RC[-1]*1000+MOD(RC[-8],2)+1) -> 2002 | J27: =VLOOKUP(RC[-1],主线副本!R7C20:R15C21,2,FALSE) -> 343|192 | K27: =R[-1]C+10 -> 60211 | L27: =RC[-1]+1 -> 60212 | M27: =RC[-1]+1 -> 60213 | N27: =RC[-1]+1 -> 60214 | O27: =IF(MOD(RC[-14],3)=0,RC[-1]+1,"") -> 60215
A28: 22 | B28: 剑拔弩张 | C28: =RC[8]&"|"&RC[9]&"|"&RC[10]&"|"&RC[11] -> 60221|60222|60223|60224 | D28: =IF(RC[11]="",0,RC[11]) -> 0 | E28: =VLOOKUP(RC[4],R7C16:R15C17,2,FALSE) -> 353|203#528|458#793|338#973|493 | F28: 22 | G28: 3 | H28: 3 | I28: =IF(RC[-1]=5,5001,RC[-1]*1000+MOD(RC[-8],2)+1) -> 3001 | J28: =VLOOKUP(RC[-1],主线副本!R7C20:R15C21,2,FALSE) -> 286|95 | K28: =R[-1]C+10 -> 60221 | L28: =RC[-1]+1 -> 60222 | M28: =RC[-1]+1 -> 60223 | N28: =RC[-1]+1 -> 60224 | O28: =IF(MOD(RC[-14],3)=0,RC[-1]+1,"") -> 
A29: 23 | B29: 针锋相对 | C29: =RC[8]&"|"&RC[9]&"|"&RC[10]&"|"&RC[11] -> 60231|60232|60233|60234 | D29: =IF(RC[11]="",0,RC[11]) -> 0 | E29: =VLOOKUP(RC[4],R7C16:R15C17,2,FALSE) -> 465|499#920|496#663|306#1095|336 | F29: 23 | G29: 1 | H29: 1 | I29: =IF(RC[-1]=5,5001,RC[-1]*1000+MOD(RC[-8],2)+1) -> 1002 | J29: =VLOOKUP(RC[-1],主线副本!R7C20:R15C21,2,FALSE) -> 370|184 | K29: =R[-1]C+10 -> 60231 | L29: =RC[-1]+1 -> 60232 | M29: =RC[-1]+1 -> 60233 | N29: =RC[-1]+1 -> 60234 | O29: =IF(MOD(RC[-14],3)=0,RC[-1]+1,"") -> 
A30: 24 | B30: 审判之日 | C30: =RC[8]&"|"&RC[9]&"|"&RC[10]&"|"&RC[11] -> 60241|60242|60243|60244 | D30: =IF(RC[11]="",0,RC[11]) -> 60245 | E30: =VLOOKUP(RC[4],R7C16:R15C17,2,FALSE) -> 394|300#654|480#764|250#1059|400 | F30: 24 | G30: 4 | H30: 5 | I30: =IF(RC[-1]=5,5001,RC[-1]*1000+MOD(RC[-8],2)+1) -> 5001 | J30: =VLOOKUP(RC[-1],主线副本!R7C20:R15C21,2,FALSE) -> 360|143 | K30: =R[-1]C+10 -> 60241 | L30: =RC[-1]+1 -> 60242 | M30: =RC[-1]+1 -> 60243 | N30: =RC[-1]+1 -> 60244 | O30: =IF(MOD(RC[-14],3)=0,RC[-1]+1,"") -> 60245
A31: 25 | B31: 辉煌王座 | C31: =RC[8]&"|"&RC[9]&"|"&RC[10]&"|"&RC[11] -> 60251|60252|60253|60254 | D31: =IF(RC[11]="",0,RC[11]) -> 0 | E31: =VLOOKUP(RC[4],R7C16:R15C17,2,FALSE) -> 963|223#548|255#529|461#943|483 | F31: 25 | G31: 3 | H31: 3 | I31: =IF(RC[-1]=5,5001,RC[-1]*1000+MOD(RC[-8],2)+1) -> 3002 | J31: =VLOOKUP(RC[-1],主线副本!R7C20:R15C21,2,FALSE) -> 355|126 | K31: =R[-1]C+10 -> 60251 | L31: =RC[-1]+1 -> 60252 | M31: =RC[-1]+1 -> 60253 | N31: =RC[-1]+1 -> 60254 | O31: =IF(MOD(RC[-14],3)=0,RC[-1]+1,"") -> 
A32: 26 | B32: 殷红血地 | C32: =RC[8]&"|"&RC[9]&"|"&RC[10]&"|"&RC[11] -> 60261|60262|60263|60264 | D32: =IF(RC[11]="",0,RC[11]) -> 0 | E32: =VLOOKUP(RC[4],R7C16:R15C17,2,FALSE) -> 520|458#680|296#1020|316#910|480 | F32: 26 | G32: 1 | H32: 1 | I32: =IF(RC[-1]=5,5001,RC[-1]*1000+MOD(RC[-8],2)+1) -> 1001 | J32: =VLOOKUP(RC[-1],主线副本!R7C20:R15C21,2,FALSE) -> 360|147 | K32: =R[-1]C+10 -> 60261 | L32: =RC[-1]+1 -> 60262 | M32: =RC[-1]+1 -> 60263 | N32: =RC[-1]+1 -> 60264 | O32: =IF(MOD(RC[-14],3)=0,RC[-1]+1,"") -> 
A33: 27 | B33: 亡灵屠杀 | C33: =RC[8]&"|"&RC[9]&"|"&RC[10]&"|"&RC[11] -> 60271|60272|60273|60274 | D33: =IF(RC[11]="",0,RC[11]) -> 60275 | E33: =VLOOKUP(RC[4],R7C16:R15C17,2,FALSE) -> 531|312#281|411#793|338#991|470 | F33: 27 | G33: 4 | H33: 4 | I33: =IF(RC[-1]=5,5001,RC[-1]*1000+MOD(RC[-8],2)+1) -> 4002 | J33: =VLOOKUP(RC[-1],主线副本!R7C20:R15C21,2,FALSE) -> 187|136 | K33: =R[-1]C+10 -> 60271 | L33: =RC[-1]+1 -> 60272 | M33: =RC[-1]+1 -> 60273 | N33: =RC[-1]+1 -> 60274 | O33: =IF(MOD(RC[-14],3)=0,RC[-1]+1,"") -> 60275
A34: 28 | B34: 巨兽战争 | C34: =RC[8]&"|"&RC[9]&"|"&RC[10]&"|"&RC[11] -> 60281|60282|60283|60284 | D34: =IF(RC[11]="",0,RC[11]) -> 0 | E34: =VLOOKUP(RC[4],R7C16:R15C17,2,FALSE) -> 491|495#504|245#864|295#909|495 | F34: 28 | G34: 2 | H34: 2 | I34: =IF(RC[-1]=5,5001,RC[-1]*1000+MOD(RC[-8],2)+1) -> 2001 | J34: =VLOOKUP(RC[-1],主线副本!R7C20:R15C21,2,FALSE) -> 322|122 | K34: =R[-1]C+10 -> 60281 | L34: =RC[-1]+1 -> 60282 | M34: =RC[-1]+1 -> 60283 | N34: =RC[-1]+1 -> 60284 | O34: =IF(MOD(RC[-14],3)=0,RC[-1]+1,"") -> 
A35: 29 | B35: 坚守之地 | C35: =RC[8]&"|"&RC[9]&"|"&RC[10]&"|"&RC[11] -> 60291|60292|60293|60294 | D35: =IF(RC[11]="",0,RC[11]) -> 0 | E35: =VLOOKUP(RC[4],R7C16:R15C17,2,FALSE) -> 963|223#548|255#529|461#943|483 | F35: 29 | G35: 3 | H35: 3 | I35: =IF(RC[-1]=5,5001,RC[-1]*1000+MOD(RC[-8],2)+1) -> 3002 | J35: =VLOOKUP(RC[-1],主线副本!R7C20:R15C21,2,FALSE) -> 355|126 | K35: =R[-1]C+10 -> 60291 | L35: =RC[-1]+1 -> 60292 | M35: =RC[-1]+1 -> 60293 | N35: =RC[-1]+1 -> 60294 | O35: =IF(MOD(RC[-14],3)=0,RC[-1]+1,"") -> 
A36: 30 | B36: 怒火滔天 | C36: =RC[8]&"|"&RC[9]&"|"&RC[10]&"|"&RC[11] -> 60301|60302|60303|60304 | D36: =IF(RC[11]="",0,RC[11]) -> 60305 | E36: =VLOOKUP(RC[4],R7C16:R15C17,2,FALSE) -> 394|300#654|480#764|250#1059|400 | F36: 30 | G36: 1 | H36: 5 | I36: =IF(RC[-1]=5,5001,RC[-1]*1000+MOD(RC[-8],2)+1) -> 5001 | J36: =VLOOKUP(RC[-1],主线副本!R7C20:R15C21,2,FALSE) -> 360|143 | K36: =R[-1]C+10 -> 60301 | L36: =RC[-1]+1 -> 60302 | M36: =RC[-1]+1 -> 60303 | N36: =RC[-1]+1 -> 60304 | O36: =IF(MOD(RC[-14],3)=0,RC[-1]+1,"") -> 60305
A37: 31 | B37: 钢铁之臂 | C37: =RC[8]&"|"&RC[9]&"|"&RC[10]&"|"&RC[11] -> 60311|60312|60313|60314 | D37: =IF(RC[11]="",0,RC[11]) -> 0 | E37: =VLOOKUP(RC[4],R7C16:R15C17,2,FALSE) -> 963|223#548|255#529|461#943|483 | F37: 31 | G37: 3 | H37: 3 | I37: =IF(RC[-1]=5,5001,RC[-1]*1000+MOD(RC[-8],2)+1) -> 3002 | J37: =VLOOKUP(RC[-1],主线副本!R7C20:R15C21,2,FALSE) -> 355|126 | K37: =R[-1]C+10 -> 60311 | L37: =RC[-1]+1 -> 60312 | M37: =RC[-1]+1 -> 60313 | N37: =RC[-1]+1 -> 60314 | O37: =IF(MOD(RC[-14],3)=0,RC[-1]+1,"") -> 
A38: 32 | B38: 自然气息 | C38: =RC[8]&"|"&RC[9]&"|"&RC[10]&"|"&RC[11] -> 60321|60322|60323|60324 | D38: =IF(RC[11]="",0,RC[11]) -> 0 | E38: =VLOOKUP(RC[4],R7C16:R15C17,2,FALSE) -> 491|495#504|245#864|295#909|495 | F38: 32 | G38: 2 | H38: 2 | I38: =IF(RC[-1]=5,5001,RC[-1]*1000+MOD(RC[-8],2)+1) -> 2001 | J38: =VLOOKUP(RC[-1],主线副本!R7C20:R15C21,2,FALSE) -> 322|122 | K38: =R[-1]C+10 -> 60321 | L38: =RC[-1]+1 -> 60322 | M38: =RC[-1]+1 -> 60323 | N38: =RC[-1]+1 -> 60324 | O38: =IF(MOD(RC[-14],3)=0,RC[-1]+1,"") -> 
A39: 33 | B39: 划破黑夜 | C39: =RC[8]&"|"&RC[9]&"|"&RC[10]&"|"&RC[11] -> 60331|60332|60333|60334 | D39: =IF(RC[11]="",0,RC[11]) -> 60335 | E39: =VLOOKUP(RC[4],R7C16:R15C17,2,FALSE) -> 531|312#281|411#793|338#991|470 | F39: 33 | G39: 4 | H39: 4 | I39: =IF(RC[-1]=5,5001,RC[-1]*1000+MOD(RC[-8],2)+1) -> 4002 | J39: =VLOOKUP(RC[-1],主线副本!R7C20:R15C21,2,FALSE) -> 187|136 | K39: =R[-1]C+10 -> 60331 | L39: =RC[-1]+1 -> 60332 | M39: =RC[-1]+1 -> 60333 | N39: =RC[-1]+1 -> 60334 | O39: =IF(MOD(RC[-14],3)=0,RC[-1]+1,"") -> 60335

Sheet: 精英副本
A1: id|id | B1: name| | C1: gamelevel_list|map_list | D1: gamelevel_pos_list| | E1: star_list|star_list | F1: box_1_id_list|box_1_id_list | G1: box_1_num_list|box_1_num_list | H1: box_2_id_list|box_2_id_list | I1: box_2_num_list|box_2_num_list | J1: box_3_id_list|box_3_id_list | K1: box_3_num_list|box_3_num_list | L1: pre_chapter_id| | M1: chapter_bg_id| | N1: chapter_icon_id| | O1: enemy_map_list|enemy_map_list | P1: |enemy_map_rate_list | Q1: |enemy_rand_num_min | R1: |enemy_rand_num_max | S1: |enemy_rand_chapter_list | T1: gamelevel_line_id| | U1: gamelevel_line_offset_pos|
A2: 不可空 | B2: 不可空 | C2: 不可空 | D2: 不可空 | E2: 不可空 | F2: 不可空 | G2: 不可空 | H2: 不可空 | I2: 不可空 | J2: 不可空 | K2: 不可空 | L2: 可空#不需字段 | M2: 可空#不需字段 | N2: 不可空 | O2: 不可空 | P2: 不可空 | Q2: 不可空 | R2: 不可空 | S2: 不可空 | T2: 不可空 | U2: 不可空
A3: 数字 | B3: 字符串 | C3: 一维数组 | D3: 二维数组 | E3: 一维数组 | F3: 一维数组 | G3: 一维数组 | H3: 一维数组 | I3: 一维数组 | J3: 一维数组 | K3: 一维数组 | L3: 数字 | M3: 数字 | N3: 数字 | O3: 一维数组 | P3: 一维数组 | Q3: 数字 | R3: 数字 | S3: 一维数组 | T3: 数字 | U3: 一维数组
C4: 不定长 | D4: 不定长 | E4: 不定长 | F4: 不定长 | G4: 不定长 | H4: 不定长 | I4: 不定长 | J4: 不定长 | K4: 不定长 | O4: 不定长 | P4: 不定长 | S4: 不定长 | U4: 不定长
A6: 章节 | B6: 名称 | C6: 关卡列表 | D6: 关卡位置列表(x|y#x|y) | E6: 星数列表 | F6: 宝箱1ID列表 | G6: 宝箱1数量列表 | H6: 宝箱2ID列表 | I6: 宝箱2数量列表 | J6: 宝箱3ID列表 | K6: 宝箱3数量列表 | L6: 前置章节ID | M6: 章节背景ID | N6: 章节图标ID | O6: 外敌军关卡列表 | P6: 外敌军关卡几率列表 | Q6: 外敌随机数量下限 | R6: 外敌随机数量上限 | S6: 外敌随机章节列表 | T6: 关卡路线ID | U6: 关卡路线偏移坐标
A7: 1 | B7: 第1章 铁蹄追杀 | C7: 50101|50102|50103|50104 | D7: =VLOOKUP(RC[16],R7C23:R15C24,2,FALSE) -> 414|495#544|290#994|225#934|457 | E7: 4|8|12 | F7: 10008|19005|19003 | G7: 100|50|50000 | H7: 10008|19005|19003 | I7: 200|100|100000 | J7: 10008|19005|19003 | K7: 300|150|150000 | M7: 2 | N7: 2 | O7: =50000+RC[-14]*100+5&"|"&50000+RC[-14]*100+6&"|"&50000+RC[-14]*100+7&"|"&50000+RC[-14]*100+8 -> 50105|50106|50107|50108 | P7: 2500|2500|2500|2500 | Q7: 0 | R7: 1 | S7: =IF(RC[-18]>10,ROUNDUP((RC[-18]-10)/2+1,0),1)&"|"&RC[-18] -> 1|1 | T7: =IF(RC[-7]=5,5001,RC[-7]*1000+MOD(RC[-19],2)+1) -> 2002 | U7: =VLOOKUP(RC[-1],主线副本!R7C20:R15C21,2,FALSE) -> 343|192 | W7: 1001 | X7: 520|458#680|296#1020|316#910|480 | Y7: 350|442#510|280#850|300#740|464
A8: 2 | B8: 第2章 暴食之恶 | C8: 50201|50202|50203|50204 | D8: =VLOOKUP(RC[16],R7C23:R15C24,2,FALSE) -> 520|458#680|296#1020|316#910|480 | E8: 4|8|12 | F8: 10008|19005|19003 | G8: 100|50|50000 | H8: 10008|19005|19003 | I8: 200|100|100000 | J8: 10008|19005|19003 | K8: 300|150|150000 | L8: 1 | M8: 1 | N8: 1 | O8: =50000+RC[-14]*100+5&"|"&50000+RC[-14]*100+6&"|"&50000+RC[-14]*100+7&"|"&50000+RC[-14]*100+8 -> 50205|50206|50207|50208 | P8: 2500|2500|2500|2500 | Q8: 0 | R8: 1 | S8: =IF(RC[-18]>10,ROUNDUP((RC[-18]-10)/2+1,0),1)&"|"&RC[-18] -> 1|2 | T8: =IF(RC[-7]=5,5001,RC[-7]*1000+MOD(RC[-19],2)+1) -> 1001 | U8: =VLOOKUP(RC[-1],主线副本!R7C20:R15C21,2,FALSE) -> 360|147 | W8: 1002 | X8: 465|499#920|496#663|306#1095|336 | Y8: 295|483#750|480#493|290#925|320
A9: 3 | B9: 第3章 错误之义 | C9: 50301|50302|50303|50304 | D9: =VLOOKUP(RC[16],R7C23:R15C24,2,FALSE) -> 963|223#548|255#529|461#943|483 | E9: 4|8|12 | F9: 10008|19005|19003 | G9: 100|50|50000 | H9: 10008|19005|19003 | I9: 200|100|100000 | J9: 10008|19005|19003 | K9: 300|150|150000 | L9: 2 | M9: 3 | N9: 3 | O9: =50000+RC[-14]*100+5&"|"&50000+RC[-14]*100+6&"|"&50000+RC[-14]*100+7&"|"&50000+RC[-14]*100+8 -> 50305|50306|50307|50308 | P9: 2500|2500|2500|2500 | Q9: 1 | R9: 1 | S9: =IF(RC[-18]>10,ROUNDUP((RC[-18]-10)/2+1,0),1)&"|"&RC[-18] -> 1|3 | T9: =IF(RC[-7]=5,5001,RC[-7]*1000+MOD(RC[-19],2)+1) -> 3002 | U9: =VLOOKUP(RC[-1],主线副本!R7C20:R15C21,2,FALSE) -> 355|126 | W9: 2001 | X9: 491|495#504|245#864|295#909|495 | Y9: 357|490#370|240#730|290#775|490
A10: 4 | B10: 第4章 神圣征途 | C10: 50401|50402|50403|50404 | D10: =VLOOKUP(RC[16],R7C23:R15C24,2,FALSE) -> 491|495#504|245#864|295#909|495 | E10: 4|8|12 | F10: 10008|19005|19003 | G10: 100|50|50000 | H10: 10008|19005|19003 | I10: 200|100|100000 | J10: 10008|19005|19003 | K10: 300|150|150000 | L10: 3 | M10: 2 | N10: 2 | O10: =50000+RC[-14]*100+5&"|"&50000+RC[-14]*100+6&"|"&50000+RC[-14]*100+7&"|"&50000+RC[-14]*100+8 -> 50405|50406|50407|50408 | P10: 2500|2500|2500|2500 | Q10: 1 | R10: 1 | S10: =IF(RC[-18]>10,ROUNDUP((RC[-18]-10)/2+1,0),1)&"|"&RC[-18] -> 1|4 | T10: =IF(RC[-7]=5,5001,RC[-7]*1000+MOD(RC[-19],2)+1) -> 2001 | U10: =VLOOKUP(RC[-1],主线副本!R7C20:R15C21,2,FALSE) -> 322|122 | W10: 2002 | X10: 414|495#544|290#994|225#934|457 | Y10: 280|490#410|285#860|220#800|452
A11: 5 | B11: 第5章 如血之颅 | C11: 50501|50502|50503|50504 | D11: =VLOOKUP(RC[16],R7C23:R15C24,2,FALSE) -> 531|312#281|411#793|338#991|470 | E11: 4|8|12 | F11: 10008|19005|19003 | G11: 150|50|50000 | H11: 10008|19005|19003 | I11: 300|100|100000 | J11: 10008|19005|19003 | K11: 450|150|150000 | L11: 4 | M11: 4 | N11: 4 | O11: =50000+RC[-14]*100+5&"|"&50000+RC[-14]*100+6&"|"&50000+RC[-14]*100+7&"|"&50000+RC[-14]*100+8 -> 50505|50506|50507|50508 | P11: 2500|2500|2500|2500 | Q11: 1 | R11: 1 | S11: =IF(RC[-18]>10,ROUNDUP((RC[-18]-10)/2+1,0),1)&"|"&RC[-18] -> 1|5 | T11: =IF(RC[-7]=5,5001,RC[-7]*1000+MOD(RC[-19],2)+1) -> 4002 | U11: =VLOOKUP(RC[-1],主线副本!R7C20:R15C21,2,FALSE) -> 187|136 | W11: 3001 | X11: 353|203#528|458#793|338#973|493 | Y11: 210|200#385|455#650|335#830|490
A12: 6 | B12: 第6章 认知自我 | C12: 50601|50602|50603|50604 | D12: =VLOOKUP(RC[16],R7C23:R15C24,2,FALSE) -> 353|203#528|458#793|338#973|493 | E12: 4|8|12 | F12: 10008|19005|19003 | G12: 150|50|50000 | H12: 10008|19005|19003 | I12: 300|100|100000 | J12: 10008|19005|19003 | K12: 450|150|150000 | L12: 5 | M12: 3 | N12: 3 | O12: =50000+RC[-14]*100+5&"|"&50000+RC[-14]*100+6&"|"&50000+RC[-14]*100+7&"|"&50000+RC[-14]*100+8 -> 50605|50606|50607|50608 | P12: 2500|2500|2500|2500 | Q12: 1 | R12: 2 | S12: =IF(RC[-18]>10,ROUNDUP((RC[-18]-10)/2+1,0),1)&"|"&RC[-18] -> 1|6 | T12: =IF(RC[-7]=5,5001,RC[-7]*1000+MOD(RC[-19],2)+1) -> 3001 | U12: =VLOOKUP(RC[-1],主线副本!R7C20:R15C21,2,FALSE) -> 286|95 | W12: 3002 | X12: 963|223#548|255#529|461#943|483 | Y12: 820|220#405|252#386|458#800|480
A13: 7 | B13: 第7章 旗帜之下 | C13: 50701|50702|50703|50704 | D13: =VLOOKUP(RC[16],R7C23:R15C24,2,FALSE) -> 465|499#920|496#663|306#1095|336 | E13: 4|8|12 | F13: 10008|19005|19003 | G13: 150|50|50000 | H13: 10008|19005|19003 | I13: 300|100|100000 | J13: 10008|19005|19003 | K13: 450|150|150000 | L13: 6 | M13: 1 | N13: 1 | O13: =50000+RC[-14]*100+5&"|"&50000+RC[-14]*100+6&"|"&50000+RC[-14]*100+7&"|"&50000+RC[-14]*100+8 -> 50705|50706|50707|50708 | P13: 2500|2500|2500|2500 | Q13: 1 | R13: 2 | S13: =IF(RC[-18]>10,ROUNDUP((RC[-18]-10)/2+1,0),1)&"|"&RC[-18] -> 1|7 | T13: =IF(RC[-7]=5,5001,RC[-7]*1000+MOD(RC[-19],2)+1) -> 1002 | U13: =VLOOKUP(RC[-1],主线副本!R7C20:R15C21,2,FALSE) -> 370|184 | W13: 4001 | X13: 311|208#446|418#1024|328#708|473 | Y13: 180|208#315|418#893|328#577|473
A14: 8 | B14: 第8章 深入地底 | C14: 50801|50802|50803|50804 | D14: =VLOOKUP(RC[16],R7C23:R15C24,2,FALSE) -> 311|208#446|418#1024|328#708|473 | E14: 4|8|12 | F14: 10008|19005|19003 | G14: 150|50|50000 | H14: 10008|19005|19003 | I14: 300|100|100000 | J14: 10008|19005|19003 | K14: 450|150|150000 | L14: 7 | M14: 4 | N14: 4 | O14: =50000+RC[-14]*100+5&"|"&50000+RC[-14]*100+6&"|"&50000+RC[-14]*100+7&"|"&50000+RC[-14]*100+8 -> 50805|50806|50807|50808 | P14: 2500|2500|2500|2500 | Q14: 1 | R14: 2 | S14: =IF(RC[-18]>10,ROUNDUP((RC[-18]-10)/2+1,0),1)&"|"&RC[-18] -> 1|8 | T14: =IF(RC[-7]=5,5001,RC[-7]*1000+MOD(RC[-19],2)+1) -> 4001 | U14: =VLOOKUP(RC[-1],主线副本!R7C20:R15C21,2,FALSE) -> 200|125 | W14: 4002 | X14: 531|312#281|411#793|338#991|470 | Y14: 400|312#150|411#662|338#860|470
A15: 9 | B15: 第9章 燃烧之心 | C15: 50901|50902|50903|50904 | D15: =VLOOKUP(RC[16],R7C23:R15C24,2,FALSE) -> 465|499#920|496#663|306#1095|336 | E15: 4|8|12 | F15: 10008|19005|19003 | G15: 200|80|80000 | H15: 10008|19005|19003 | I15: 400|160|160000 | J15: 10008|19005|19003 | K15: 600|240|240000 | L15: 8 | M15: 1 | N15: 1 | O15: =50000+RC[-14]*100+5&"|"&50000+RC[-14]*100+6&"|"&50000+RC[-14]*100+7&"|"&50000+RC[-14]*100+8 -> 50905|50906|50907|50908 | P15: 2500|2500|2500|2500 | Q15: 1 | R15: 2 | S15: =IF(RC[-18]>10,ROUNDUP((RC[-18]-10)/2+1,0),1)&"|"&RC[-18] -> 1|9 | T15: =IF(RC[-7]=5,5001,RC[-7]*1000+MOD(RC[-19],2)+1) -> 1002 | U15: =VLOOKUP(RC[-1],主线副本!R7C20:R15C21,2,FALSE) -> 370|184 | W15: 5001 | X15: 394|300#654|480#764|250#1059|400 | Y15: 220|300#480|480#590|250#885|400
A16: 10 | B16: 第10章 沙漠绿洲 | C16: 51001|51002|51003|51004 | D16: =VLOOKUP(RC[16],R7C23:R15C24,2,FALSE) -> 491|495#504|245#864|295#909|495 | E16: 4|8|12 | F16: 10008|19005|19003 | G16: 200|80|80000 | H16: 10008|19005|19003 | I16: 400|160|160000 | J16: 10008|19005|19003 | K16: 600|240|240000 | L16: 9 | M16: =主线副本!RC[-10] -> 2 | N16: 2 | O16: =50000+RC[-14]*100+5&"|"&50000+RC[-14]*100+6&"|"&50000+RC[-14]*100+7&"|"&50000+RC[-14]*100+8 -> 51005|51006|51007|51008 | P16: 2500|2500|2500|2500 | Q16: 1 | R16: 2 | S16: =IF(RC[-18]>10,ROUNDUP((RC[-18]-10)/2+1,0),1)&"|"&RC[-18] -> 1|10 | T16: =IF(RC[-7]=5,5001,RC[-7]*1000+MOD(RC[-19],2)+1) -> 2001 | U16: =VLOOKUP(RC[-1],主线副本!R7C20:R15C21,2,FALSE) -> 322|122
A17: 11 | B17: 第11章 熔火之地 | C17: 51101|51102|51103|51104 | D17: =VLOOKUP(RC[16],R7C23:R15C24,2,FALSE) -> 394|300#654|480#764|250#1059|400 | E17: 4|8|12 | F17: 10008|19005|19003 | G17: 200|80|80000 | H17: 10008|19005|19003 | I17: 400|160|160000 | J17: 10008|19005|19003 | K17: 600|240|240000 | L17: 10 | M17: =主线副本!RC[-10] -> 5 | N17: 1 | O17: =50000+RC[-14]*100+5&"|"&50000+RC[-14]*100+6&"|"&50000+RC[-14]*100+7&"|"&50000+RC[-14]*100+8 -> 51105|51106|51107|51108 | P17: 2500|2500|2500|2500 | Q17: 1 | R17: 3 | S17: =IF(RC[-18]>10,ROUNDUP((RC[-18]-10)/2+1,0),1)&"|"&RC[-18] -> 2|11 | T17: =IF(RC[-7]=5,5001,RC[-7]*1000+MOD(RC[-19],2)+1) -> 5001 | U17: =VLOOKUP(RC[-1],主线副本!R7C20:R15C21,2,FALSE) -> 360|143
A18: 12 | B18: 第12章 野蛮巨人 | C18: 51201|51202|51203|51204 | D18: =VLOOKUP(RC[16],R7C23:R15C24,2,FALSE) -> 520|458#680|296#1020|316#910|480 | E18: 4|8|12 | F18: 10008|19005|19003 | G18: 200|80|80000 | H18: 10008|19005|19003 | I18: 400|160|160000 | J18: 10008|19005|19003 | K18: 600|240|240000 | L18: 11 | M18: =主线副本!RC[-10] -> 1 | N18: 1 | O18: =50000+RC[-14]*100+5&"|"&50000+RC[-14]*100+6&"|"&50000+RC[-14]*100+7&"|"&50000+RC[-14]*100+8 -> 51205|51206|51207|51208 | P18: 2500|2500|2500|2500 | Q18: 1 | R18: 3 | S18: =IF(RC[-18]>10,ROUNDUP((RC[-18]-10)/2+1,0),1)&"|"&RC[-18] -> 2|12 | T18: =IF(RC[-7]=5,5001,RC[-7]*1000+MOD(RC[-19],2)+1) -> 1001 | U18: =VLOOKUP(RC[-1],主线副本!R7C20:R15C21,2,FALSE) -> 360|147
A19: 13 | B19: 第13章 心与躯体 | C19: 51301|51302|51303|51304 | D19: =VLOOKUP(RC[16],R7C23:R15C24,2,FALSE) -> 414|495#544|290#994|225#934|457 | E19: 4|8|12 | F19: 10008|19005|19003 | G19: 250|80|80000 | H19: 10008|19005|19003 | I19: 500|160|160000 | J19: 10008|19005|19003 | K19: 750|240|240000 | L19: 12 | M19: =主线副本!RC[-10] -> 2 | N19: 2 | O19: =50000+RC[-14]*100+5&"|"&50000+RC[-14]*100+6&"|"&50000+RC[-14]*100+7&"|"&50000+RC[-14]*100+8 -> 51305|51306|51307|51308 | P19: 2500|2500|2500|2500 | Q19: 1 | R19: 3 | S19: =IF(RC[-18]>10,ROUNDUP((RC[-18]-10)/2+1,0),1)&"|"&RC[-18] -> 3|13 | T19: =IF(RC[-7]=5,5001,RC[-7]*1000+MOD(RC[-19],2)+1) -> 2002 | U19: =VLOOKUP(RC[-1],主线副本!R7C20:R15C21,2,FALSE) -> 343|192
A20: 14 | B20: 第14章 暴动雷霆 | C20: 51401|51402|51403|51404 | D20: =VLOOKUP(RC[16],R7C23:R15C24,2,FALSE) -> 353|203#528|458#793|338#973|493 | E20: 4|8|12 | F20: 10008|19005|19003 | G20: 250|80|80000 | H20: 10008|19005|19003 | I20: 500|160|160000 | J20: 10008|19005|19003 | K20: 750|240|240000 | L20: 13 | M20: =主线副本!RC[-10] -> 3 | N20: 3 | O20: =50000+RC[-14]*100+5&"|"&50000+RC[-14]*100+6&"|"&50000+RC[-14]*100+7&"|"&50000+RC[-14]*100+8 -> 51405|51406|51407|51408 | P20: 2500|2500|2500|2500 | Q20: 1 | R20: 3 | S20: =IF(RC[-18]>10,ROUNDUP((RC[-18]-10)/2+1,0),1)&"|"&RC[-18] -> 3|14 | T20: =IF(RC[-7]=5,5001,RC[-7]*1000+MOD(RC[-19],2)+1) -> 3001 | U20: =VLOOKUP(RC[-1],主线副本!R7C20:R15C21,2,FALSE) -> 286|95
A21: 15 | B21: 第15章 战争主宰 | C21: 51501|51502|51503|51504 | D21: =VLOOKUP(RC[16],R7C23:R15C24,2,FALSE) -> 531|312#281|411#793|338#991|470 | E21: 4|8|12 | F21: 10008|19005|19003 | G21: 250|80|80000 | H21: 10008|19005|19003 | I21: 500|160|160000 | J21: 10008|19005|19003 | K21: 750|240|240000 | L21: 14 | M21: =主线副本!RC[-10] -> 4 | N21: 4 | O21: =50000+RC[-14]*100+5&"|"&50000+RC[-14]*100+6&"|"&50000+RC[-14]*100+7&"|"&50000+RC[-14]*100+8 -> 51505|51506|51507|51508 | P21: 2500|2500|2500|2500 | Q21: 1 | R21: 3 | S21: =IF(RC[-18]>10,ROUNDUP((RC[-18]-10)/2+1,0),1)&"|"&RC[-18] -> 4|15 | T21: =IF(RC[-7]=5,5001,RC[-7]*1000+MOD(RC[-19],2)+1) -> 4002 | U21: =VLOOKUP(RC[-1],主线副本!R7C20:R15C21,2,FALSE) -> 187|136
A22: 16 | B22: 第16章 血色光辉 | C22: 51601|51602|51603|51604 | D22: =VLOOKUP(RC[16],R7C23:R15C24,2,FALSE) -> 520|458#680|296#1020|316#910|480 | E22: 4|8|12 | F22: 10008|19005|19003 | G22: 250|80|80000 | H22: 10008|19005|19003 | I22: 500|160|160000 | J22: 10008|19005|19003 | K22: 750|240|240000 | L22: 15 | M22: =主线副本!RC[-10] -> 1 | N22: 1 | O22: =50000+RC[-14]*100+5&"|"&50000+RC[-14]*100+6&"|"&50000+RC[-14]*100+7&"|"&50000+RC[-14]*100+8 -> 51605|51606|51607|51608 | P22: 2500|2500|2500|2500 | Q22: 1 | R22: 3 | S22: =IF(RC[-18]>10,ROUNDUP((RC[-18]-10)/2+1,0),1)&"|"&RC[-18] -> 4|16 | T22: =IF(RC[-7]=5,5001,RC[-7]*1000+MOD(RC[-19],2)+1) -> 1001 | U22: =VLOOKUP(RC[-1],主线副本!R7C20:R15C21,2,FALSE) -> 360|147
A23: 17 | B23: 第17章 寒冰极地 | C23: 51701|51702|51703|51704 | D23: =VLOOKUP(RC[16],R7C23:R15C24,2,FALSE) -> 531|312#281|411#793|338#991|470 | E23: 4|8|12 | F23: 10008|19005|19003 | G23: 300|120|120000 | H23: 10008|19005|19003 | I23: 600|240|240000 | J23: 10008|19005|19003 | K23: 900|360|360000 | L23: 16 | M23: =主线副本!RC[-10] -> 4 | N23: 4 | O23: =50000+RC[-14]*100+5&"|"&50000+RC[-14]*100+6&"|"&50000+RC[-14]*100+7&"|"&50000+RC[-14]*100+8 -> 51705|51706|51707|51708 | P23: 2500|2500|2500|2500 | Q23: 1 | R23: 3 | S23: =IF(RC[-18]>10,ROUNDUP((RC[-18]-10)/2+1,0),1)&"|"&RC[-18] -> 5|17 | T23: =IF(RC[-7]=5,5001,RC[-7]*1000+MOD(RC[-19],2)+1) -> 4002 | U23: =VLOOKUP(RC[-1],主线副本!R7C20:R15C21,2,FALSE) -> 187|136
A24: 18 | B24: 第18章 战争践踏 | C24: 51801|51802|51803|51804 | D24: =VLOOKUP(RC[16],R7C23:R15C24,2,FALSE) -> 520|458#680|296#1020|316#910|480 | E24: 4|8|12 | F24: 10008|19005|19003 | G24: 300|120|120000 | H24: 10008|19005|19003 | I24: 600|240|240000 | J24: 10008|19005|19003 | K24: 900|360|360000 | L24: 17 | M24: =主线副本!RC[-10] -> 1 | N24: 1 | O24: =50000+RC[-14]*100+5&"|"&50000+RC[-14]*100+6&"|"&50000+RC[-14]*100+7&"|"&50000+RC[-14]*100+8 -> 51805|51806|51807|51808 | P24: 2500|2500|2500|2500 | Q24: 1 | R24: 3 | S24: =IF(RC[-18]>10,ROUNDUP((RC[-18]-10)/2+1,0),1)&"|"&RC[-18] -> 5|18 | T24: =IF(RC[-7]=5,5001,RC[-7]*1000+MOD(RC[-19],2)+1) -> 1001 | U24: =VLOOKUP(RC[-1],主线副本!R7C20:R15C21,2,FALSE) -> 360|147
A25: 19 | B25: 第19章 缝合怪物 | C25: 51901|51902|51903|51904 | D25: =VLOOKUP(RC[16],R7C23:R15C24,2,FALSE) -> 531|312#281|411#793|338#991|470 | E25: 4|8|12 | F25: 10008|19005|19003 | G25: 300|120|120000 | H25: 10008|19005|19003 | I25: 600|240|240000 | J25: 10008|19005|19003 | K25: 900|360|360000 | L25: 18 | M25: =主线副本!RC[-10] -> 4 | N25: 4 | O25: =50000+RC[-14]*100+5&"|"&50000+RC[-14]*100+6&"|"&50000+RC[-14]*100+7&"|"&50000+RC[-14]*100+8 -> 51905|51906|51907|51908 | P25: 2500|2500|2500|2500 | Q25: 1 | R25: 3 | S25: =IF(RC[-18]>10,ROUNDUP((RC[-18]-10)/2+1,0),1)&"|"&RC[-18] -> 6|19 | T25: =IF(RC[-7]=5,5001,RC[-7]*1000+MOD(RC[-19],2)+1) -> 4002 | U25: =VLOOKUP(RC[-1],主线副本!R7C20:R15C21,2,FALSE) -> 187|136
A26: 20 | B26: 第20章 钢铁之心 | C26: 52001|52002|52003|52004 | D26: =VLOOKUP(RC[16],R7C23:R15C24,2,FALSE) -> 353|203#528|458#793|338#973|493 | E26: 4|8|12 | F26: 10008|19005|19003 | G26: 300|120|120000 | H26: 10008|19005|19003 | I26: 600|240|240000 | J26: 10008|19005|19003 | K26: 900|360|360000 | L26: 19 | M26: =主线副本!RC[-10] -> 3 | N26: 3 | O26: =50000+RC[-14]*100+5&"|"&50000+RC[-14]*100+6&"|"&50000+RC[-14]*100+7&"|"&50000+RC[-14]*100+8 -> 52005|52006|52007|52008 | P26: 2500|2500|2500|2500 | Q26: 1 | R26: 3 | S26: =IF(RC[-18]>10,ROUNDUP((RC[-18]-10)/2+1,0),1)&"|"&RC[-18] -> 6|20 | T26: =IF(RC[-7]=5,5001,RC[-7]*1000+MOD(RC[-19],2)+1) -> 3001 | U26: =VLOOKUP(RC[-1],主线副本!R7C20:R15C21,2,FALSE) -> 286|95
A27: 21 | B27: 第21章 王者之剑 | C27: 52101|52102|52103|52104 | D27: =VLOOKUP(RC[16],R7C23:R15C24,2,FALSE) -> 465|499#920|496#663|306#1095|336 | E27: 4|8|12 | F27: 10008|19005|19003 | G27: 350|120|120000 | H27: 10008|19005|19003 | I27: 700|240|240000 | J27: 10008|19005|19003 | K27: 1000|360|360000 | L27: 20 | M27: =主线副本!RC[-10] -> 1 | N27: 1 | O27: =50000+RC[-14]*100+5&"|"&50000+RC[-14]*100+6&"|"&50000+RC[-14]*100+7&"|"&50000+RC[-14]*100+8 -> 52105|52106|52107|52108 | P27: 2500|2500|2500|2500 | Q27: 1 | R27: 3 | S27: =IF(RC[-18]>10,ROUNDUP((RC[-18]-10)/2+1,0),1)&"|"&RC[-18] -> 7|21 | T27: =IF(RC[-7]=5,5001,RC[-7]*1000+MOD(RC[-19],2)+1) -> 1002 | U27: =VLOOKUP(RC[-1],主线副本!R7C20:R15C21,2,FALSE) -> 370|184
A28: 22 | B28: 第22章 灾厄源泉 | C28: 52201|52202|52203|52204 | D28: =VLOOKUP(RC[16],R7C23:R15C24,2,FALSE) -> 491|495#504|245#864|295#909|495 | E28: 4|8|12 | F28: 10008|19005|19003 | G28: 350|120|120000 | H28: 10008|19005|19003 | I28: 700|240|240000 | J28: 10008|19005|19003 | K28: 1000|360|360000 | L28: 21 | M28: =主线副本!RC[-10] -> 2 | N28: 2 | O28: =50000+RC[-14]*100+5&"|"&50000+RC[-14]*100+6&"|"&50000+RC[-14]*100+7&"|"&50000+RC[-14]*100+8 -> 52205|52206|52207|52208 | P28: 2500|2500|2500|2500 | Q28: 1 | R28: 3 | S28: =IF(RC[-18]>10,ROUNDUP((RC[-18]-10)/2+1,0),1)&"|"&RC[-18] -> 7|22 | T28: =IF(RC[-7]=5,5001,RC[-7]*1000+MOD(RC[-19],2)+1) -> 2001 | U28: =VLOOKUP(RC[-1],主线副本!R7C20:R15C21,2,FALSE) -> 322|122
A29: 23 | B29: 第23章 占领据点 | C29: 52301|52302|52303|52304 | D29: =VLOOKUP(RC[16],R7C23:R15C24,2,FALSE) -> 963|223#548|255#529|461#943|483 | E29: 4|8|12 | F29: 10008|19005|19003 | G29: 350|120|120000 | H29: 10008|19005|19003 | I29: 700|240|240000 | J29: 10008|19005|19003 | K29: 1000|360|360000 | L29: 22 | M29: =主线副本!RC[-10] -> 3 | N29: 3 | O29: =50000+RC[-14]*100+5&"|"&50000+RC[-14]*100+6&"|"&50000+RC[-14]*100+7&"|"&50000+RC[-14]*100+8 -> 52305|52306|52307|52308 | P29: 2500|2500|2500|2500 | Q29: 1 | R29: 3 | S29: =IF(RC[-18]>10,ROUNDUP((RC[-18]-10)/2+1,0),1)&"|"&RC[-18] -> 8|23 | T29: =IF(RC[-7]=5,5001,RC[-7]*1000+MOD(RC[-19],2)+1) -> 3002 | U29: =VLOOKUP(RC[-1],主线副本!R7C20:R15C21,2,FALSE) -> 355|126
A30: 24 | B30: 第24章 智慧眷属 | C30: 52401|52402|52403|52404 | D30: =VLOOKUP(RC[16],R7C23:R15C24,2,FALSE) -> 520|458#680|296#1020|316#910|480 | E30: 4|8|12 | F30: 10008|19005|19003 | G30: 350|120|120000 | H30: 10008|19005|19003 | I30: 700|240|240000 | J30: 10008|19005|19003 | K30: 1000|360|360000 | L30: 23 | M30: =主线副本!RC[-10] -> 1 | N30: 1 | O30: =50000+RC[-14]*100+5&"|"&50000+RC[-14]*100+6&"|"&50000+RC[-14]*100+7&"|"&50000+RC[-14]*100+8 -> 52405|52406|52407|52408 | P30: 2500|2500|2500|2500 | Q30: 1 | R30: 3 | S30: =IF(RC[-18]>10,ROUNDUP((RC[-18]-10)/2+1,0),1)&"|"&RC[-18] -> 8|24 | T30: =IF(RC[-7]=5,5001,RC[-7]*1000+MOD(RC[-19],2)+1) -> 1001 | U30: =VLOOKUP(RC[-1],主线副本!R7C20:R15C21,2,FALSE) -> 360|147
A31: 25 | B31: 第25章 大型战争 | C31: 52501|52502|52503|52504 | D31: =VLOOKUP(RC[16],R7C23:R15C24,2,FALSE) -> 531|312#281|411#793|338#991|470 | E31: 4|8|12 | F31: 10008|19005|19003 | G31: 500|150|150000 | H31: 10008|19005|19003 | I31: 1000|300|300000 | J31: 10008|19005|19003 | K31: 1500|450|450000 | L31: 24 | M31: =主线副本!RC[-10] -> 4 | N31: 4 | O31: =50000+RC[-14]*100+5&"|"&50000+RC[-14]*100+6&"|"&50000+RC[-14]*100+7&"|"&50000+RC[-14]*100+8 -> 52505|52506|52507|52508 | P31: 2500|2500|2500|2500 | Q31: 1 | R31: 3 | S31: =IF(RC[-18]>10,ROUNDUP((RC[-18]-10)/2+1,0),1)&"|"&RC[-18] -> 9|25 | T31: =IF(RC[-7]=5,5001,RC[-7]*1000+MOD(RC[-19],2)+1) -> 4002 | U31: =VLOOKUP(RC[-1],主线副本!R7C20:R15C21,2,FALSE) -> 187|136
A32: =R[-1]C+1 -> 26 | B32: =主线副本!RC -> 第26章 拉开帷幕 | C32: =50001+RC[-2]*100&"|"&50002+RC[-2]*100&"|"&50003+RC[-2]*100&"|"&50004+RC[-2]*100 -> 52601|52602|52603|52604 | D32: =VLOOKUP(RC[16],R7C23:R15C24,2,FALSE) -> 353|203#528|458#793|338#973|493 | E32: 4|8|12 | F32: 10008|19005|19003 | G32: 500|150|150000 | H32: 10008|19005|19003 | I32: 1000|300|300000 | J32: 10008|19005|19003 | K32: 1500|450|450000 | L32: 25 | M32: =主线副本!RC[-10] -> 3 | N32: =主线副本!RC[-10] -> 3 | O32: =50000+RC[-14]*100+5&"|"&50000+RC[-14]*100+6&"|"&50000+RC[-14]*100+7&"|"&50000+RC[-14]*100+8 -> 52605|52606|52607|52608 | P32: 2500|2500|2500|2500 | Q32: 1 | R32: 3 | S32: =IF(RC[-18]>10,ROUNDUP((RC[-18]-10)/2+1,0),1)&"|"&RC[-18] -> 9|26 | T32: =IF(RC[-7]=5,5001,RC[-7]*1000+MOD(RC[-19],2)+1) -> 3001 | U32: =VLOOKUP(RC[-1],主线副本!R7C20:R15C21,2,FALSE) -> 286|95
A33: =R[-1]C+1 -> 27 | B33: =主线副本!RC -> 第27章 堕落森林 | C33: =50001+RC[-2]*100&"|"&50002+RC[-2]*100&"|"&50003+RC[-2]*100&"|"&50004+RC[-2]*100 -> 52701|52702|52703|52704 | D33: =VLOOKUP(RC[16],R7C23:R15C24,2,FALSE) -> 414|495#544|290#994|225#934|457 | E33: 4|8|12 | F33: 10008|19005|19003 | G33: 500|150|150000 | H33: 10008|19005|19003 | I33: 1000|300|300000 | J33: 10008|19005|19003 | K33: 1500|450|450000 | L33: 26 | M33: =主线副本!RC[-10] -> 2 | N33: =主线副本!RC[-10] -> 2 | O33: =50000+RC[-14]*100+5&"|"&50000+RC[-14]*100+6&"|"&50000+RC[-14]*100+7&"|"&50000+RC[-14]*100+8 -> 52705|52706|52707|52708 | P33: 2500|2500|2500|2500 | Q33: 1 | R33: 3 | S33: =IF(RC[-18]>10,ROUNDUP((RC[-18]-10)/2+1,0),1)&"|"&RC[-18] -> 10|27 | T33: =IF(RC[-7]=5,5001,RC[-7]*1000+MOD(RC[-19],2)+1) -> 2002 | U33: =VLOOKUP(RC[-1],主线副本!R7C20:R15C21,2,FALSE) -> 343|192
A34: =R[-1]C+1 -> 28 | B34: =主线副本!RC -> 第28章 黑暗殿堂 | C34: =50001+RC[-2]*100&"|"&50002+RC[-2]*100&"|"&50003+RC[-2]*100&"|"&50004+RC[-2]*100 -> 52801|52802|52803|52804 | D34: =VLOOKUP(RC[16],R7C23:R15C24,2,FALSE) -> 311|208#446|418#1024|328#708|473 | E34: 4|8|12 | F34: 10008|19005|19003 | G34: 500|150|150000 | H34: 10008|19005|19003 | I34: 1000|300|300000 | J34: 10008|19005|19003 | K34: 1500|450|450000 | L34: 27 | M34: =主线副本!RC[-10] -> 4 | N34: =主线副本!RC[-10] -> 4 | O34: =50000+RC[-14]*100+5&"|"&50000+RC[-14]*100+6&"|"&50000+RC[-14]*100+7&"|"&50000+RC[-14]*100+8 -> 52805|52806|52807|52808 | P34: 2500|2500|2500|2500 | Q34: 1 | R34: 3 | S34: =IF(RC[-18]>10,ROUNDUP((RC[-18]-10)/2+1,0),1)&"|"&RC[-18] -> 10|28 | T34: =IF(RC[-7]=5,5001,RC[-7]*1000+MOD(RC[-19],2)+1) -> 4001 | U34: =VLOOKUP(RC[-1],主线副本!R7C20:R15C21,2,FALSE) -> 200|125
A35: =R[-1]C+1 -> 29 | B35: =主线副本!RC -> 第29章 阴影之城 | C35: =50001+RC[-2]*100&"|"&50002+RC[-2]*100&"|"&50003+RC[-2]*100&"|"&50004+RC[-2]*100 -> 52901|52902|52903|52904 | D35: =VLOOKUP(RC[16],R7C23:R15C24,2,FALSE) -> 963|223#548|255#529|461#943|483 | E35: 4|8|12 | F35: 10008|19005|19003 | G35: 500|150|150000 | H35: 10008|19005|19003 | I35: 1000|300|300000 | J35: 10008|19005|19003 | K35: 1500|450|450000 | L35: 28 | M35: =主线副本!RC[-10] -> 3 | N35: =主线副本!RC[-10] -> 3 | O35: =50000+RC[-14]*100+5&"|"&50000+RC[-14]*100+6&"|"&50000+RC[-14]*100+7&"|"&50000+RC[-14]*100+8 -> 52905|52906|52907|52908 | P35: 2500|2500|2500|2500 | Q35: 1 | R35: 3 | S35: =IF(RC[-18]>10,ROUNDUP((RC[-18]-10)/2+1,0),1)&"|"&RC[-18] -> 11|29 | T35: =IF(RC[-7]=5,5001,RC[-7]*1000+MOD(RC[-19],2)+1) -> 3002 | U35: =VLOOKUP(RC[-1],主线副本!R7C20:R15C21,2,FALSE) -> 355|126
A36: =R[-1]C+1 -> 30 | B36: =主线副本!RC -> 第30章 科技之争 | C36: =50001+RC[-2]*100&"|"&50002+RC[-2]*100&"|"&50003+RC[-2]*100&"|"&50004+RC[-2]*100 -> 53001|53002|53003|53004 | D36: =VLOOKUP(RC[16],R7C23:R15C24,2,FALSE) -> 394|300#654|480#764|250#1059|400 | E36: 4|8|12 | F36: 10008|19005|19003 | G36: 500|150|150000 | H36: 10008|19005|19003 | I36: 1000|300|300000 | J36: 10008|19005|19003 | K36: 1500|450|450000 | L36: 29 | M36: =主线副本!RC[-10] -> 5 | N36: =主线副本!RC[-10] -> 1 | O36: =50000+RC[-14]*100+5&"|"&50000+RC[-14]*100+6&"|"&50000+RC[-14]*100+7&"|"&50000+RC[-14]*100+8 -> 53005|53006|53007|53008 | P36: 2500|2500|2500|2500 | Q36: 1 | R36: 3 | S36: =IF(RC[-18]>10,ROUNDUP((RC[-18]-10)/2+1,0),1)&"|"&RC[-18] -> 11|30 | T36: =IF(RC[-7]=5,5001,RC[-7]*1000+MOD(RC[-19],2)+1) -> 5001 | U36: =VLOOKUP(RC[-1],主线副本!R7C20:R15C21,2,FALSE) -> 360|143
A37: =R[-1]C+1 -> 31 | B37: =主线副本!RC -> 第31章 战争支援 | C37: =50001+RC[-2]*100&"|"&50002+RC[-2]*100&"|"&50003+RC[-2]*100&"|"&50004+RC[-2]*100 -> 53101|53102|53103|53104 | D37: =VLOOKUP(RC[16],R7C23:R15C24,2,FALSE) -> 414|495#544|290#994|225#934|457 | E37: 4|8|12 | F37: 10008|19005|19003 | G37: 500|150|150000 | H37: 10008|19005|19003 | I37: 1000|300|300000 | J37: 10008|19005|19003 | K37: 1500|450|450000 | L37: 30 | M37: =主线副本!RC[-10] -> 2 | N37: =主线副本!RC[-10] -> 2 | O37: =50000+RC[-14]*100+5&"|"&50000+RC[-14]*100+6&"|"&50000+RC[-14]*100+7&"|"&50000+RC[-14]*100+8 -> 53105|53106|53107|53108 | P37: 2500|2500|2500|2500 | Q37: 1 | R37: 3 | S37: =IF(RC[-18]>10,ROUNDUP((RC[-18]-10)/2+1,0),1)&"|"&RC[-18] -> 12|31 | T37: =IF(RC[-7]=5,5001,RC[-7]*1000+MOD(RC[-19],2)+1) -> 2002 | U37: =VLOOKUP(RC[-1],主线副本!R7C20:R15C21,2,FALSE) -> 343|192
A38: =R[-1]C+1 -> 32 | B38: =主线副本!RC -> 第32章 兵临城下 | C38: =50001+RC[-2]*100&"|"&50002+RC[-2]*100&"|"&50003+RC[-2]*100&"|"&50004+RC[-2]*100 -> 53201|53202|53203|53204 | D38: =VLOOKUP(RC[16],R7C23:R15C24,2,FALSE) -> 311|208#446|418#1024|328#708|473 | E38: 4|8|12 | F38: 10008|19005|19003 | G38: 500|150|150000 | H38: 10008|19005|19003 | I38: 1000|300|300000 | J38: 10008|19005|19003 | K38: 1500|450|450000 | L38: 31 | M38: =主线副本!RC[-10] -> 4 | N38: =主线副本!RC[-10] -> 4 | O38: =50000+RC[-14]*100+5&"|"&50000+RC[-14]*100+6&"|"&50000+RC[-14]*100+7&"|"&50000+RC[-14]*100+8 -> 53205|53206|53207|53208 | P38: 2500|2500|2500|2500 | Q38: 1 | R38: 3 | S38: =IF(RC[-18]>10,ROUNDUP((RC[-18]-10)/2+1,0),1)&"|"&RC[-18] -> 12|32 | T38: =IF(RC[-7]=5,5001,RC[-7]*1000+MOD(RC[-19],2)+1) -> 4001 | U38: =VLOOKUP(RC[-1],主线副本!R7C20:R15C21,2,FALSE) -> 200|125
A39: =R[-1]C+1 -> 33 | B39: =主线副本!RC -> 第33章 正式打响 | C39: =50001+RC[-2]*100&"|"&50002+RC[-2]*100&"|"&50003+RC[-2]*100&"|"&50004+RC[-2]*100 -> 53301|53302|53303|53304 | D39: =VLOOKUP(RC[16],R7C23:R15C24,2,FALSE) -> 465|499#920|496#663|306#1095|336 | E39: 4|8|12 | F39: 10008|19005|19003 | G39: 500|150|150000 | H39: 10008|19005|19003 | I39: 1000|300|300000 | J39: 10008|19005|19003 | K39: 1500|450|450000 | L39: 32 | M39: =主线副本!RC[-10] -> 1 | N39: =主线副本!RC[-10] -> 1 | O39: =50000+RC[-14]*100+5&"|"&50000+RC[-14]*100+6&"|"&50000+RC[-14]*100+7&"|"&50000+RC[-14]*100+8 -> 53305|53306|53307|53308 | P39: 2500|2500|2500|2500 | Q39: 1 | R39: 3 | S39: =IF(RC[-18]>10,ROUNDUP((RC[-18]-10)/2+1,0),1)&"|"&RC[-18] -> 13|33 | T39: =IF(RC[-7]=5,5001,RC[-7]*1000+MOD(RC[-19],2)+1) -> 1002 | U39: =VLOOKUP(RC[-1],主线副本!R7C20:R15C21,2,FALSE) -> 370|184
A40: =R[-1]C+1 -> 34 | B40: =主线副本!RC -> 第34章 战争核心 | C40: =50001+RC[-2]*100&"|"&50002+RC[-2]*100&"|"&50003+RC[-2]*100&"|"&50004+RC[-2]*100 -> 53401|53402|53403|53404 | D40: =VLOOKUP(RC[16],R7C23:R15C24,2,FALSE) -> 353|203#528|458#793|338#973|493 | E40: 4|8|12 | F40: 10008|19005|19003 | G40: 500|150|150000 | H40: 10008|19005|19003 | I40: 1000|300|300000 | J40: 10008|19005|19003 | K40: 1500|450|450000 | L40: 33 | M40: =主线副本!RC[-10] -> 3 | N40: =主线副本!RC[-10] -> 3 | O40: =50000+RC[-14]*100+5&"|"&50000+RC[-14]*100+6&"|"&50000+RC[-14]*100+7&"|"&50000+RC[-14]*100+8 -> 53405|53406|53407|53408 | P40: 2500|2500|2500|2500 | Q40: 1 | R40: 3 | S40: =IF(RC[-18]>10,ROUNDUP((RC[-18]-10)/2+1,0),1)&"|"&RC[-18] -> 13|34 | T40: =IF(RC[-7]=5,5001,RC[-7]*1000+MOD(RC[-19],2)+1) -> 3001 | U40: =VLOOKUP(RC[-1],主线副本!R7C20:R15C21,2,FALSE) -> 286|95
A41: =R[-1]C+1 -> 35 | B41: =主线副本!RC -> 第35章 意料之外 | C41: =50001+RC[-2]*100&"|"&50002+RC[-2]*100&"|"&50003+RC[-2]*100&"|"&50004+RC[-2]*100 -> 53501|53502|53503|53504 | D41: =VLOOKUP(RC[16],R7C23:R15C24,2,FALSE) -> 531|312#281|411#793|338#991|470 | E41: 4|8|12 | F41: 10008|19005|19003 | G41: 500|150|150000 | H41: 10008|19005|19003 | I41: 1000|300|300000 | J41: 10008|19005|19003 | K41: 1500|450|450000 | L41: 34 | M41: =主线副本!RC[-10] -> 4 | N41: =主线副本!RC[-10] -> 4 | O41: =50000+RC[-14]*100+5&"|"&50000+RC[-14]*100+6&"|"&50000+RC[-14]*100+7&"|"&50000+RC[-14]*100+8 -> 53505|53506|53507|53508 | P41: 2500|2500|2500|2500 | Q41: 1 | R41: 3 | S41: =IF(RC[-18]>10,ROUNDUP((RC[-18]-10)/2+1,0),1)&"|"&RC[-18] -> 14|35 | T41: =IF(RC[-7]=5,5001,RC[-7]*1000+MOD(RC[-19],2)+1) -> 4002 | U41: =VLOOKUP(RC[-1],主线副本!R7C20:R15C21,2,FALSE) -> 187|136
A42: =R[-1]C+1 -> 36 | B42: =主线副本!RC -> 第36章 硝烟渐没 | C42: =50001+RC[-2]*100&"|"&50002+RC[-2]*100&"|"&50003+RC[-2]*100&"|"&50004+RC[-2]*100 -> 53601|53602|53603|53604 | D42: =VLOOKUP(RC[16],R7C23:R15C24,2,FALSE) -> 520|458#680|296#1020|316#910|480 | E42: 4|8|12 | F42: 10008|19005|19003 | G42: 500|150|150000 | H42: 10008|19005|19003 | I42: 1000|300|300000 | J42: 10008|19005|19003 | K42: 1500|450|450000 | L42: 35 | M42: =主线副本!RC[-10] -> 1 | N42: =主线副本!RC[-10] -> 1 | O42: =50000+RC[-14]*100+5&"|"&50000+RC[-14]*100+6&"|"&50000+RC[-14]*100+7&"|"&50000+RC[-14]*100+8 -> 53605|53606|53607|53608 | P42: 2500|2500|2500|2500 | Q42: 1 | R42: 3 | S42: =IF(RC[-18]>10,ROUNDUP((RC[-18]-10)/2+1,0),1)&"|"&RC[-18] -> 14|36 | T42: =IF(RC[-7]=5,5001,RC[-7]*1000+MOD(RC[-19],2)+1) -> 1001 | U42: =VLOOKUP(RC[-1],主线副本!R7C20:R15C21,2,FALSE) -> 360|147
A43: =R[-1]C+1 -> 37 | B43: =主线副本!RC -> 第37章 光暗交汇 | C43: =50001+RC[-2]*100&"|"&50002+RC[-2]*100&"|"&50003+RC[-2]*100&"|"&50004+RC[-2]*100 -> 53701|53702|53703|53704 | D43: =VLOOKUP(RC[16],R7C23:R15C24,2,FALSE) -> 414|495#544|290#994|225#934|457 | E43: 4|8|12 | F43: 10008|19005|19003 | G43: 500|150|150000 | H43: 10008|19005|19003 | I43: 1000|300|300000 | J43: 10008|19005|19003 | K43: 1500|450|450000 | L43: 36 | M43: =主线副本!RC[-10] -> 2 | N43: =主线副本!RC[-10] -> 2 | O43: =50000+RC[-14]*100+5&"|"&50000+RC[-14]*100+6&"|"&50000+RC[-14]*100+7&"|"&50000+RC[-14]*100+8 -> 53705|53706|53707|53708 | P43: 2500|2500|2500|2500 | Q43: 1 | R43: 3 | S43: =IF(RC[-18]>10,ROUNDUP((RC[-18]-10)/2+1,0),1)&"|"&RC[-18] -> 15|37 | T43: =IF(RC[-7]=5,5001,RC[-7]*1000+MOD(RC[-19],2)+1) -> 2002 | U43: =VLOOKUP(RC[-1],主线副本!R7C20:R15C21,2,FALSE) -> 343|192
A44: =R[-1]C+1 -> 38 | B44: =主线副本!RC -> 第38章 联盟之行 | C44: =50001+RC[-2]*100&"|"&50002+RC[-2]*100&"|"&50003+RC[-2]*100&"|"&50004+RC[-2]*100 -> 53801|53802|53803|53804 | D44: =VLOOKUP(RC[16],R7C23:R15C24,2,FALSE) -> 311|208#446|418#1024|328#708|473 | E44: 4|8|12 | F44: 10008|19005|19003 | G44: 500|150|150000 | H44: 10008|19005|19003 | I44: 1000|300|300000 | J44: 10008|19005|19003 | K44: 1500|450|450000 | L44: 37 | M44: =主线副本!RC[-10] -> 4 | N44: =主线副本!RC[-10] -> 4 | O44: =50000+RC[-14]*100+5&"|"&50000+RC[-14]*100+6&"|"&50000+RC[-14]*100+7&"|"&50000+RC[-14]*100+8 -> 53805|53806|53807|53808 | P44: 2500|2500|2500|2500 | Q44: 1 | R44: 3 | S44: =IF(RC[-18]>10,ROUNDUP((RC[-18]-10)/2+1,0),1)&"|"&RC[-18] -> 15|38 | T44: =IF(RC[-7]=5,5001,RC[-7]*1000+MOD(RC[-19],2)+1) -> 4001 | U44: =VLOOKUP(RC[-1],主线副本!R7C20:R15C21,2,FALSE) -> 200|125
A45: =R[-1]C+1 -> 39 | B45: =主线副本!RC -> 第39章 自由王国 | C45: =50001+RC[-2]*100&"|"&50002+RC[-2]*100&"|"&50003+RC[-2]*100&"|"&50004+RC[-2]*100 -> 53901|53902|53903|53904 | D45: =VLOOKUP(RC[16],R7C23:R15C24,2,FALSE) -> 963|223#548|255#529|461#943|483 | E45: 4|8|12 | F45: 10008|19005|19003 | G45: 500|150|150000 | H45: 10008|19005|19003 | I45: 1000|300|300000 | J45: 10008|19005|19003 | K45: 1500|450|450000 | L45: 38 | M45: =主线副本!RC[-10] -> 3 | N45: =主线副本!RC[-10] -> 3 | O45: =50000+RC[-14]*100+5&"|"&50000+RC[-14]*100+6&"|"&50000+RC[-14]*100+7&"|"&50000+RC[-14]*100+8 -> 53905|53906|53907|53908 | P45: 2500|2500|2500|2500 | Q45: 1 | R45: 3 | S45: =IF(RC[-18]>10,ROUNDUP((RC[-18]-10)/2+1,0),1)&"|"&RC[-18] -> 16|39 | T45: =IF(RC[-7]=5,5001,RC[-7]*1000+MOD(RC[-19],2)+1) -> 3002 | U45: =VLOOKUP(RC[-1],主线副本!R7C20:R15C21,2,FALSE) -> 355|126
A46: =R[-1]C+1 -> 40 | B46: =主线副本!RC -> 第40章 大地泰坦 | C46: =50001+RC[-2]*100&"|"&50002+RC[-2]*100&"|"&50003+RC[-2]*100&"|"&50004+RC[-2]*100 -> 54001|54002|54003|54004 | D46: =VLOOKUP(RC[16],R7C23:R15C24,2,FALSE) -> 394|300#654|480#764|250#1059|400 | E46: 4|8|12 | F46: 10008|19005|19003 | G46: 500|150|150000 | H46: 10008|19005|19003 | I46: 1000|300|300000 | J46: 10008|19005|19003 | K46: 1500|450|450000 | L46: 39 | M46: =主线副本!RC[-10] -> 5 | N46: =主线副本!RC[-10] -> 1 | O46: =50000+RC[-14]*100+5&"|"&50000+RC[-14]*100+6&"|"&50000+RC[-14]*100+7&"|"&50000+RC[-14]*100+8 -> 54005|54006|54007|54008 | P46: 2500|2500|2500|2500 | Q46: 1 | R46: 3 | S46: =IF(RC[-18]>10,ROUNDUP((RC[-18]-10)/2+1,0),1)&"|"&RC[-18] -> 16|40 | T46: =IF(RC[-7]=5,5001,RC[-7]*1000+MOD(RC[-19],2)+1) -> 5001 | U46: =VLOOKUP(RC[-1],主线副本!R7C20:R15C21,2,FALSE) -> 360|143
A47: =R[-1]C+1 -> 41 | B47: =主线副本!RC -> 第41章 科技残骸 | C47: =50001+RC[-2]*100&"|"&50002+RC[-2]*100&"|"&50003+RC[-2]*100&"|"&50004+RC[-2]*100 -> 54101|54102|54103|54104 | D47: =VLOOKUP(RC[16],R7C23:R15C24,2,FALSE) -> 963|223#548|255#529|461#943|483 | E47: 4|8|12 | F47: 10008|19005|19003 | G47: 500|150|150000 | H47: 10008|19005|19003 | I47: 1000|300|300000 | J47: 10008|19005|19003 | K47: 1500|450|450000 | L47: 40 | M47: =主线副本!RC[-10] -> 3 | N47: =主线副本!RC[-10] -> 3 | O47: =50000+RC[-14]*100+5&"|"&50000+RC[-14]*100+6&"|"&50000+RC[-14]*100+7&"|"&50000+RC[-14]*100+8 -> 54105|54106|54107|54108 | P47: 2500|2500|2500|2500 | Q47: 1 | R47: 3 | S47: =IF(RC[-18]>10,ROUNDUP((RC[-18]-10)/2+1,0),1)&"|"&RC[-18] -> 17|41 | T47: =IF(RC[-7]=5,5001,RC[-7]*1000+MOD(RC[-19],2)+1) -> 3002 | U47: =VLOOKUP(RC[-1],主线副本!R7C20:R15C21,2,FALSE) -> 355|126
A48: =R[-1]C+1 -> 42 | B48: =主线副本!RC -> 第42章 地下基地 | C48: =50001+RC[-2]*100&"|"&50002+RC[-2]*100&"|"&50003+RC[-2]*100&"|"&50004+RC[-2]*100 -> 54201|54202|54203|54204 | D48: =VLOOKUP(RC[16],R7C23:R15C24,2,FALSE) -> 311|208#446|418#1024|328#708|473 | E48: 4|8|12 | F48: 10008|19005|19003 | G48: 500|150|150000 | H48: 10008|19005|19003 | I48: 1000|300|300000 | J48: 10008|19005|19003 | K48: 1500|450|450000 | L48: 41 | M48: =主线副本!RC[-10] -> 4 | N48: =主线副本!RC[-10] -> 4 | O48: =50000+RC[-14]*100+5&"|"&50000+RC[-14]*100+6&"|"&50000+RC[-14]*100+7&"|"&50000+RC[-14]*100+8 -> 54205|54206|54207|54208 | P48: 2500|2500|2500|2500 | Q48: 1 | R48: 3 | S48: =IF(RC[-18]>10,ROUNDUP((RC[-18]-10)/2+1,0),1)&"|"&RC[-18] -> 17|42 | T48: =IF(RC[-7]=5,5001,RC[-7]*1000+MOD(RC[-19],2)+1) -> 4001 | U48: =VLOOKUP(RC[-1],主线副本!R7C20:R15C21,2,FALSE) -> 200|125
A49: =R[-1]C+1 -> 43 | B49: =主线副本!RC -> 第43章 幻想前哨 | C49: =50001+RC[-2]*100&"|"&50002+RC[-2]*100&"|"&50003+RC[-2]*100&"|"&50004+RC[-2]*100 -> 54301|54302|54303|54304 | D49: =VLOOKUP(RC[16],R7C23:R15C24,2,FALSE) -> 414|495#544|290#994|225#934|457 | E49: 4|8|12 | F49: 10008|19005|19003 | G49: 500|150|150000 | H49: 10008|19005|19003 | I49: 1000|300|300000 | J49: 10008|19005|19003 | K49: 1500|450|450000 | L49: 42 | M49: =主线副本!RC[-10] -> 2 | N49: =主线副本!RC[-10] -> 2 | O49: =50000+RC[-14]*100+5&"|"&50000+RC[-14]*100+6&"|"&50000+RC[-14]*100+7&"|"&50000+RC[-14]*100+8 -> 54305|54306|54307|54308 | P49: 2500|2500|2500|2500 | Q49: 1 | R49: 3 | S49: =IF(RC[-18]>10,ROUNDUP((RC[-18]-10)/2+1,0),1)&"|"&RC[-18] -> 18|43 | T49: =IF(RC[-7]=5,5001,RC[-7]*1000+MOD(RC[-19],2)+1) -> 2002 | U49: =VLOOKUP(RC[-1],主线副本!R7C20:R15C21,2,FALSE) -> 343|192
A50: =R[-1]C+1 -> 44 | B50: =主线副本!RC -> 第44章 前往极地 | C50: =50001+RC[-2]*100&"|"&50002+RC[-2]*100&"|"&50003+RC[-2]*100&"|"&50004+RC[-2]*100 -> 54401|54402|54403|54404 | D50: =VLOOKUP(RC[16],R7C23:R15C24,2,FALSE) -> 520|458#680|296#1020|316#910|480 | E50: 4|8|12 | F50: 10008|19005|19003 | G50: 500|150|150000 | H50: 10008|19005|19003 | I50: 1000|300|300000 | J50: 10008|19005|19003 | K50: 1500|450|450000 | L50: 43 | M50: =主线副本!RC[-10] -> 1 | N50: =主线副本!RC[-10] -> 1 | O50: =50000+RC[-14]*100+5&"|"&50000+RC[-14]*100+6&"|"&50000+RC[-14]*100+7&"|"&50000+RC[-14]*100+8 -> 54405|54406|54407|54408 | P50: 2500|2500|2500|2500 | Q50: 1 | R50: 3 | S50: =IF(RC[-18]>10,ROUNDUP((RC[-18]-10)/2+1,0),1)&"|"&RC[-18] -> 18|44 | T50: =IF(RC[-7]=5,5001,RC[-7]*1000+MOD(RC[-19],2)+1) -> 1001 | U50: =VLOOKUP(RC[-1],主线副本!R7C20:R15C21,2,FALSE) -> 360|147
A51: =R[-1]C+1 -> 45 | B51: =主线副本!RC -> 第45章 万里冰封 | C51: =50001+RC[-2]*100&"|"&50002+RC[-2]*100&"|"&50003+RC[-2]*100&"|"&50004+RC[-2]*100 -> 54501|54502|54503|54504 | D51: =VLOOKUP(RC[16],R7C23:R15C24,2,FALSE) -> 531|312#281|411#793|338#991|470 | E51: 4|8|12 | F51: 10008|19005|19003 | G51: 500|150|150000 | H51: 10008|19005|19003 | I51: 1000|300|300000 | J51: 10008|19005|19003 | K51: 1500|450|450000 | L51: 44 | M51: =主线副本!RC[-10] -> 4 | N51: =主线副本!RC[-10] -> 4 | O51: =50000+RC[-14]*100+5&"|"&50000+RC[-14]*100+6&"|"&50000+RC[-14]*100+7&"|"&50000+RC[-14]*100+8 -> 54505|54506|54507|54508 | P51: 2500|2500|2500|2500 | Q51: 1 | R51: 3 | S51: =IF(RC[-18]>10,ROUNDUP((RC[-18]-10)/2+1,0),1)&"|"&RC[-18] -> 19|45 | T51: =IF(RC[-7]=5,5001,RC[-7]*1000+MOD(RC[-19],2)+1) -> 4002 | U51: =VLOOKUP(RC[-1],主线副本!R7C20:R15C21,2,FALSE) -> 187|136
A52: =R[-1]C+1 -> 46 | B52: =主线副本!RC -> 第46章 鲜血之城 | C52: =50001+RC[-2]*100&"|"&50002+RC[-2]*100&"|"&50003+RC[-2]*100&"|"&50004+RC[-2]*100 -> 54601|54602|54603|54604 | D52: =VLOOKUP(RC[16],R7C23:R15C24,2,FALSE) -> 353|203#528|458#793|338#973|493 | E52: 4|8|12 | F52: 10008|19005|19003 | G52: 500|150|150000 | H52: 10008|19005|19003 | I52: 1000|300|300000 | J52: 10008|19005|19003 | K52: 1500|450|450000 | L52: 45 | M52: =主线副本!RC[-10] -> 3 | N52: =主线副本!RC[-10] -> 3 | O52: =50000+RC[-14]*100+5&"|"&50000+RC[-14]*100+6&"|"&50000+RC[-14]*100+7&"|"&50000+RC[-14]*100+8 -> 54605|54606|54607|54608 | P52: 2500|2500|2500|2500 | Q52: 1 | R52: 3 | S52: =IF(RC[-18]>10,ROUNDUP((RC[-18]-10)/2+1,0),1)&"|"&RC[-18] -> 19|46 | T52: =IF(RC[-7]=5,5001,RC[-7]*1000+MOD(RC[-19],2)+1) -> 3001 | U52: =VLOOKUP(RC[-1],主线副本!R7C20:R15C21,2,FALSE) -> 286|95
A53: =R[-1]C+1 -> 47 | B53: =主线副本!RC -> 第47章 黄昏沙漠 | C53: =50001+RC[-2]*100&"|"&50002+RC[-2]*100&"|"&50003+RC[-2]*100&"|"&50004+RC[-2]*100 -> 54701|54702|54703|54704 | D53: =VLOOKUP(RC[16],R7C23:R15C24,2,FALSE) -> 465|499#920|496#663|306#1095|336 | E53: 4|8|12 | F53: 10008|19005|19003 | G53: 500|150|150000 | H53: 10008|19005|19003 | I53: 1000|300|300000 | J53: 10008|19005|19003 | K53: 1500|450|450000 | L53: 46 | M53: =主线副本!RC[-10] -> 1 | N53: =主线副本!RC[-10] -> 1 | O53: =50000+RC[-14]*100+5&"|"&50000+RC[-14]*100+6&"|"&50000+RC[-14]*100+7&"|"&50000+RC[-14]*100+8 -> 54705|54706|54707|54708 | P53: 2500|2500|2500|2500 | Q53: 1 | R53: 3 | S53: =IF(RC[-18]>10,ROUNDUP((RC[-18]-10)/2+1,0),1)&"|"&RC[-18] -> 20|47 | T53: =IF(RC[-7]=5,5001,RC[-7]*1000+MOD(RC[-19],2)+1) -> 1002 | U53: =VLOOKUP(RC[-1],主线副本!R7C20:R15C21,2,FALSE) -> 370|184
A54: =R[-1]C+1 -> 48 | B54: =主线副本!RC -> 第48章 暗影洞窟 | C54: =50001+RC[-2]*100&"|"&50002+RC[-2]*100&"|"&50003+RC[-2]*100&"|"&50004+RC[-2]*100 -> 54801|54802|54803|54804 | D54: =VLOOKUP(RC[16],R7C23:R15C24,2,FALSE) -> 311|208#446|418#1024|328#708|473 | E54: 4|8|12 | F54: 10008|19005|19003 | G54: 500|150|150000 | H54: 10008|19005|19003 | I54: 1000|300|300000 | J54: 10008|19005|19003 | K54: 1500|450|450000 | L54: 47 | M54: =主线副本!RC[-10] -> 4 | N54: =主线副本!RC[-10] -> 4 | O54: =50000+RC[-14]*100+5&"|"&50000+RC[-14]*100+6&"|"&50000+RC[-14]*100+7&"|"&50000+RC[-14]*100+8 -> 54805|54806|54807|54808 | P54: 2500|2500|2500|2500 | Q54: 1 | R54: 3 | S54: =IF(RC[-18]>10,ROUNDUP((RC[-18]-10)/2+1,0),1)&"|"&RC[-18] -> 20|48 | T54: =IF(RC[-7]=5,5001,RC[-7]*1000+MOD(RC[-19],2)+1) -> 4001 | U54: =VLOOKUP(RC[-1],主线副本!R7C20:R15C21,2,FALSE) -> 200|125
A55: =R[-1]C+1 -> 49 | B55: =主线副本!RC -> 第49章 阴影之刺 | C55: =50001+RC[-2]*100&"|"&50002+RC[-2]*100&"|"&50003+RC[-2]*100&"|"&50004+RC[-2]*100 -> 54901|54902|54903|54904 | D55: =VLOOKUP(RC[16],R7C23:R15C24,2,FALSE) -> 963|223#548|255#529|461#943|483 | E55: 4|8|12 | F55: 10008|19005|19003 | G55: 500|150|150000 | H55: 10008|19005|19003 | I55: 1000|300|300000 | J55: 10008|19005|19003 | K55: 1500|450|450000 | L55: 48 | M55: =主线副本!RC[-10] -> 3 | N55: =主线副本!RC[-10] -> 3 | O55: =50000+RC[-14]*100+5&"|"&50000+RC[-14]*100+6&"|"&50000+RC[-14]*100+7&"|"&50000+RC[-14]*100+8 -> 54905|54906|54907|54908 | P55: 2500|2500|2500|2500 | Q55: 1 | R55: 3 | S55: =IF(RC[-18]>10,ROUNDUP((RC[-18]-10)/2+1,0),1)&"|"&RC[-18] -> 21|49 | T55: =IF(RC[-7]=5,5001,RC[-7]*1000+MOD(RC[-19],2)+1) -> 3002 | U55: =VLOOKUP(RC[-1],主线副本!R7C20:R15C21,2,FALSE) -> 355|126
A56: =R[-1]C+1 -> 50 | B56: =主线副本!RC -> 第50章 寂静森林 | C56: =50001+RC[-2]*100&"|"&50002+RC[-2]*100&"|"&50003+RC[-2]*100&"|"&50004+RC[-2]*100 -> 55001|55002|55003|55004 | D56: =VLOOKUP(RC[16],R7C23:R15C24,2,FALSE) -> 491|495#504|245#864|295#909|495 | E56: 4|8|12 | F56: 10008|19005|19003 | G56: 500|150|150000 | H56: 10008|19005|19003 | I56: 1000|300|300000 | J56: 10008|19005|19003 | K56: 1500|450|450000 | L56: 49 | M56: =主线副本!RC[-10] -> 2 | N56: =主线副本!RC[-10] -> 2 | O56: =50000+RC[-14]*100+5&"|"&50000+RC[-14]*100+6&"|"&50000+RC[-14]*100+7&"|"&50000+RC[-14]*100+8 -> 55005|55006|55007|55008 | P56: 2500|2500|2500|2500 | Q56: 1 | R56: 3 | S56: =IF(RC[-18]>10,ROUNDUP((RC[-18]-10)/2+1,0),1)&"|"&RC[-18] -> 21|50 | T56: =IF(RC[-7]=5,5001,RC[-7]*1000+MOD(RC[-19],2)+1) -> 2001 | U56: =VLOOKUP(RC[-1],主线副本!R7C20:R15C21,2,FALSE) -> 322|122

Sheet: 新手副本
A1: id| | B1: gamelevel_id| | C1: associated_gamelevel_id| | D1: hero_list| | E1: hero1_prop_list| | F1: hero2_prop_list| | G1: hero3_prop_list| | H1: hero4_prop_list| | I1: hero5_prop_list| | J1: my_name| | K1: enemy_name|
A2: 不可空 | B2: 不可空 | C2: 不可空 | D2: 不可空 | E2: 可空#不需字段 | F2: 可空#不需字段 | G2: 可空#不需字段 | H2: 可空#不需字段 | I2: 可空#不需字段 | J2: 不可空 | K2: 不可空
A3: 数字 | B3: 数字 | C3: 数字 | D3: 一维数组 | E3: 二维数组 | F3: 二维数组 | G3: 二维数组 | H3: 二维数组 | I3: 二维数组 | J3: 字符串 | K3: 字符串
D4: 不定长 | E4: 不定长 | F4: 不定长 | G4: 不定长 | H4: 不定长 | I4: 不定长
A6: 章节 | B6: 关卡ID | C6: 关联的关卡ID | D6: 英雄列表 | E6: 英雄1属性加成 | F6: 英雄2属性加成 | G6: 英雄3属性加成 | H6: 英雄4属性加成 | I6: 英雄5属性加成 | J6: 我方名字 | K6: 敌方名字
A7: 1 | B7: 99999 | C7: 10101 | D7: 30431|30301|30302|30403 | E7: 1|5000#4|100000#13|5000 | F7: 1|5000#4|100000#13|5000 | G7: 1|5000#4|100000#13|5000 | H7: 1|5000#4|100000#13|5000 | J7: 超能阵营 | K7: 敌人

Sheet: 主线副本章节奖励
A1: level|level | B1: need_chapter|need_chapter | C1: item_id|item_id | D1: is_equip|
A2: 不可空 | B2: 可空#不需字段 | C2: 可空#不需字段 | D2: 不可空
A3: 数字 | B3: 数字 | C3: 数字 | D3: 数字
A6: 等级 | B6: 需要通关章节 | C6: 奖励的物品ID | D6: 是否装备
A7: 1 | B7: 5 | C7: 13299 | D7: 0
A8: 2 | B8: 10 | C8: 13301 | D8: 0
A9: 3 | B9: 15 | C9: 13025 | D9: 1

Sheet: 精英副本结算星数
A1: time| | B1: star|
A2: 不可空 | B2: 可空#不需字段
A3: 数字 | B3: 数字
A6: 时间 | B6: 星数
A7: 40 | B7: 3
A8: 60 | B8: 2
A9: 120 | B9: 1

Sheet: Sheet1
B5: 230|490 | C5: 388|460 | D5: 290|340 | E5: 450|300 | F5: 630|280 | G5: 800|170 | H5: 882|310 | I5: 860|498 | M5: 134 | N5: 5
B6: =MID(R[-1]C,1,FIND("|",R[-1]C,1)-1)+R5C13&"|"&MID(R[-1]C,FIND("|",R[-1]C,1)+1,999)+R5C14 -> 364|495 | C6: =MID(R[-1]C,1,FIND("|",R[-1]C,1)-1)+R5C13&"|"&MID(R[-1]C,FIND("|",R[-1]C,1)+1,999)+R5C14 -> 522|465 | D6: =MID(R[-1]C,1,FIND("|",R[-1]C,1)-1)+R5C13&"|"&MID(R[-1]C,FIND("|",R[-1]C,1)+1,999)+R5C14 -> 424|345 | E6: =MID(R[-1]C,1,FIND("|",R[-1]C,1)-1)+R5C13&"|"&MID(R[-1]C,FIND("|",R[-1]C,1)+1,999)+R5C14 -> 584|305 | F6: =MID(R[-1]C,1,FIND("|",R[-1]C,1)-1)+R5C13&"|"&MID(R[-1]C,FIND("|",R[-1]C,1)+1,999)+R5C14 -> 764|285 | G6: =MID(R[-1]C,1,FIND("|",R[-1]C,1)-1)+R5C13&"|"&MID(R[-1]C,FIND("|",R[-1]C,1)+1,999)+R5C14 -> 934|175 | H6: =MID(R[-1]C,1,FIND("|",R[-1]C,1)-1)+R5C13&"|"&MID(R[-1]C,FIND("|",R[-1]C,1)+1,999)+R5C14 -> 1016|315 | I6: =MID(R[-1]C,1,FIND("|",R[-1]C,1)-1)+R5C13&"|"&MID(R[-1]C,FIND("|",R[-1]C,1)+1,999)+R5C14 -> 994|503 | J6: =MID(R[-1]C,1,FIND("|",R[-1]C,1)-1)+R5C13&"|"&MID(R[-1]C,FIND("|",R[-1]C,1)+1,999)+R5C14 -> #VALUE! | K6: =MID(R[-1]C,1,FIND("|",R[-1]C,1)-1)+R5C13&"|"&MID(R[-1]C,FIND("|",R[-1]C,1)+1,999)+R5C14 -> #VALUE!
B7: =R[-1]C -> 364|495 | C7: =RC[-1]&"#"&R[-1]C -> 364|495#522|465 | D7: =RC[-1]&"#"&R[-1]C -> 364|495#522|465#424|345 | E7: =RC[-1]&"#"&R[-1]C -> 364|495#522|465#424|345#584|305 | F7: =RC[-1]&"#"&R[-1]C -> 364|495#522|465#424|345#584|305#764|285 | G7: =RC[-1]&"#"&R[-1]C -> 364|495#522|465#424|345#584|305#764|285#934|175 | H7: =RC[-1]&"#"&R[-1]C -> 364|495#522|465#424|345#584|305#764|285#934|175#1016|315 | I7: =RC[-1]&"#"&R[-1]C -> 364|495#522|465#424|345#584|305#764|285#934|175#1016|315#994|503 | J7: =RC[-1]&"#"&R[-1]C -> #VALUE! | K7: =RC[-1]&"#"&R[-1]C -> #VALUE!