Sheet: 配置
A1: 服务端文件名 | B1: 服务端对应工作表号 | C1: 客户端文件名 | D1: 客户端对应工作表号 | E1: erl头部 | F1: erl内容格式 | G1: erl尾部 | H1: 客户端特殊处理
C2: config_monster_ai.cnf|MonsterAI | D2: 1

Sheet: AI
A1: id|id | B1: | | C1: trigger_limit_times| | D1: condition| | E1: condition_params| | F1: action| | G1: action_params|
A2: 不可空 | B2: 可空#不需字段 | C2: 可空#不需字段 | D2: 不可空 | E2: 可空#不需字段 | F2: 不可空 | G2: 可空#不需字段
A3: 数字 | B3: 字符串 | C3: 数字 | D3: 数字 | E3: 一维数组 | F3: 一维数组 | G3: 二维数组
E4: 不定长 | F4: 不定长 | G4: 不定长
A6: ID | B6: 描述 | C6: 触发限制次数 | D6: 触发条件 | E6: 条件参数 | F6: 动作类型 | G6: 动作参数
A7: 1 | B7: 无尽怪物登场 | D7: 9 | F7: 4|1 | G7: 2#400000|2
A8: 998 | B8: 陷阱测试 | D8: 2 | E8: 5 | F8: 2|2 | G8: 100911|998|2#100911|999|2
A9: 99999401 | B9: 喊话 | D9: 2 | E9: 4 | F9: 3 | G9: "有我死亡武士在这，你们有什么阴谋都不管用！"|2|3
A10: 99999402 | B10: 恶魔猎手释放怒气技能 | D10: 2 | E10: 6 | F10: 3|1 | G10: "愚蠢，无比的愚蠢呐——"|2#1324094|1
A11: 99999902 | B11: 大地泰坦登场 | D11: 2 | E11: 6 | F11: 5|1|4|2|4|2|4|3|4|3|4|6 | G11: 999999#400029|2#1#999999|400032|2#0.3#999999|400030|2#2#"破坏大地，干扰我的沉睡……愚蠢的凡人……这是死罪！"|2#2#"这里竟然还沉睡着这么一个大家伙……"|2|2#2#999992
A12: 99999903 | B12: 大地泰坦的大地之怒 | D12: 2 | E12: 17 | F12: 3|4|3|1 | G12: "愚蠢的蝼蚁们，你们在给我挠痒痒吗？"|2#2#"现在，你们将重归于大地——"|3#400031|1
A13: 11001 | B13: 无尽-超级队长 | D13: 1 | E13: =MID(RC[-4],1,3)&"|70" -> 110|70 | F13: 3|1 | G13: "没有尽头，没有胜利，也没有希望……"|3#1303014|1 | H13: =IFERROR(MID(RC[-6],SEARCH("-10",RC[-6])+3,10),IFERROR(MID(RC[-6],SEARCH("-9",RC[-6])+2,10),IFERROR(MID(RC[-6],SEARCH("-8",RC[-6])+2,10),IFERROR(MID(RC[-6],SEARCH("-7",RC[-6])+2,10),IFERROR(MID(RC[-6],SEARCH("-6",RC[-6])+2,10),IFERROR(MID(RC[-6],SEARCH("-5",RC[-6])+2,10),IFERROR(MID(RC[-6],SEARCH("-4",RC[-6])+2,10),IFERROR(MID(RC[-6],SEARCH("-3",RC[-6])+2,10),IFERROR(MID(RC[-6],SEARCH("-2",RC[-6])+2,10),IFERROR(MID(RC[-6],SEARCH("-1",RC[-6])+2,10),IFERROR(MID(RC[-6],SEARCH("-",RC[-6])+1,10),))))))))))) -> 超级队长 | I13: ="1"&VLOOKUP(RC[-1],Sheet1!R2C2:R127C3,2,FALSE) -> 130301 | J13: 130301 | K13: =IFERROR(FIND(13,RC[-4],1),"") -> 23 | L13: =IF(RC[-1]="","",MID(RC[-5],RC[-1],6)) -> 130301 | M13: =SUBSTITUTE(RC[-6],RC[-1],RC[-3],1) -> "没有尽头，没有胜利，也没有希望……"|3#1303014|1
A14: 11101 | B14: 无尽-死亡武士 | D14: 1 | E14: =MID(RC[-4],1,3)&"|70" -> 111|70 | F14: 3|1 | G14: "奔赴死亡的深渊吧"|3#1303024|1 | H14: =IFERROR(MID(RC[-6],SEARCH("-10",RC[-6])+3,10),IFERROR(MID(RC[-6],SEARCH("-9",RC[-6])+2,10),IFERROR(MID(RC[-6],SEARCH("-8",RC[-6])+2,10),IFERROR(MID(RC[-6],SEARCH("-7",RC[-6])+2,10),IFERROR(MID(RC[-6],SEARCH("-6",RC[-6])+2,10),IFERROR(MID(RC[-6],SEARCH("-5",RC[-6])+2,10),IFERROR(MID(RC[-6],SEARCH("-4",RC[-6])+2,10),IFERROR(MID(RC[-6],SEARCH("-3",RC[-6])+2,10),IFERROR(MID(RC[-6],SEARCH("-2",RC[-6])+2,10),IFERROR(MID(RC[-6],SEARCH("-1",RC[-6])+2,10),IFERROR(MID(RC[-6],SEARCH("-",RC[-6])+1,10),))))))))))) -> 死亡武士 | I14: ="1"&VLOOKUP(RC[-1],Sheet1!R2C2:R127C3,2,FALSE) -> 130302 | J14: 130302 | K14: =IFERROR(FIND(13,RC[-4],1),"") -> 14 | L14: =IF(RC[-1]="","",MID(RC[-5],RC[-1],6)) -> 130302 | M14: =SUBSTITUTE(RC[-6],RC[-1],RC[-3],1) -> "奔赴死亡的深渊吧"|3#1303024|1
A15: 11201 | B15: 无尽-红头魔 | D15: 1 | E15: =MID(RC[-4],1,3)&"|70" -> 112|70 | F15: 3|1 | G15: "随我到深渊里去吧！——"|3#1304304|1 | H15: =IFERROR(MID(RC[-6],SEARCH("-10",RC[-6])+3,10),IFERROR(MID(RC[-6],SEARCH("-9",RC[-6])+2,10),IFERROR(MID(RC[-6],SEARCH("-8",RC[-6])+2,10),IFERROR(MID(RC[-6],SEARCH("-7",RC[-6])+2,10),IFERROR(MID(RC[-6],SEARCH("-6",RC[-6])+2,10),IFERROR(MID(RC[-6],SEARCH("-5",RC[-6])+2,10),IFERROR(MID(RC[-6],SEARCH("-4",RC[-6])+2,10),IFERROR(MID(RC[-6],SEARCH("-3",RC[-6])+2,10),IFERROR(MID(RC[-6],SEARCH("-2",RC[-6])+2,10),IFERROR(MID(RC[-6],SEARCH("-1",RC[-6])+2,10),IFERROR(MID(RC[-6],SEARCH("-",RC[-6])+1,10),))))))))))) -> 红头魔 | I15: ="1"&VLOOKUP(RC[-1],Sheet1!R2C2:R127C3,2,FALSE) -> 130430 | J15: 130430 | K15: =IFERROR(FIND(13,RC[-4],1),"") -> 17 | L15: =IF(RC[-1]="","",MID(RC[-5],RC[-1],6)) -> 130430 | M15: =SUBSTITUTE(RC[-6],RC[-1],RC[-3],1) -> "随我到深渊里去吧！——"|3#1304304|1
A16: 11301 | B16: 无尽-终极队长 | D16: 1 | E16: =MID(RC[-4],1,3)&"|70" -> 113|70 | F16: 3|1 | G16: "没有希望……"|3#1304004|1 | H16: =IFERROR(MID(RC[-6],SEARCH("-10",RC[-6])+3,10),IFERROR(MID(RC[-6],SEARCH("-9",RC[-6])+2,10),IFERROR(MID(RC[-6],SEARCH("-8",RC[-6])+2,10),IFERROR(MID(RC[-6],SEARCH("-7",RC[-6])+2,10),IFERROR(MID(RC[-6],SEARCH("-6",RC[-6])+2,10),IFERROR(MID(RC[-6],SEARCH("-5",RC[-6])+2,10),IFERROR(MID(RC[-6],SEARCH("-4",RC[-6])+2,10),IFERROR(MID(RC[-6],SEARCH("-3",RC[-6])+2,10),IFERROR(MID(RC[-6],SEARCH("-2",RC[-6])+2,10),IFERROR(MID(RC[-6],SEARCH("-1",RC[-6])+2,10),IFERROR(MID(RC[-6],SEARCH("-",RC[-6])+1,10),))))))))))) -> 终极队长 | I16: ="1"&VLOOKUP(RC[-1],Sheet1!R2C2:R127C3,2,FALSE) -> 130400 | J16: 130400 | K16: =IFERROR(FIND(13,RC[-4],1),"") -> 12 | L16: =IF(RC[-1]="","",MID(RC[-5],RC[-1],6)) -> 130400 | M16: =SUBSTITUTE(RC[-6],RC[-1],RC[-3],1) -> "没有希望……"|3#1304004|1
A17: 11401 | B17: 无尽-雷神 | D17: 1 | E17: =MID(RC[-4],1,3)&"|70" -> 114|70 | F17: 3|1 | G17: "雷霆啊，驱散它们！"|3#1304314|1 | H17: =IFERROR(MID(RC[-6],SEARCH("-10",RC[-6])+3,10),IFERROR(MID(RC[-6],SEARCH("-9",RC[-6])+2,10),IFERROR(MID(RC[-6],SEARCH("-8",RC[-6])+2,10),IFERROR(MID(RC[-6],SEARCH("-7",RC[-6])+2,10),IFERROR(MID(RC[-6],SEARCH("-6",RC[-6])+2,10),IFERROR(MID(RC[-6],SEARCH("-5",RC[-6])+2,10),IFERROR(MID(RC[-6],SEARCH("-4",RC[-6])+2,10),IFERROR(MID(RC[-6],SEARCH("-3",RC[-6])+2,10),IFERROR(MID(RC[-6],SEARCH("-2",RC[-6])+2,10),IFERROR(MID(RC[-6],SEARCH("-1",RC[-6])+2,10),IFERROR(MID(RC[-6],SEARCH("-",RC[-6])+1,10),))))))))))) -> 雷神 | I17: ="1"&VLOOKUP(RC[-1],Sheet1!R2C2:R127C3,2,FALSE) -> 130431 | J17: 130431 | K17: =IFERROR(FIND(13,RC[-4],1),"") -> 15 | L17: =IF(RC[-1]="","",MID(RC[-5],RC[-1],6)) -> 130431 | M17: =SUBSTITUTE(RC[-6],RC[-1],RC[-3],1) -> "雷霆啊，驱散它们！"|3#1304314|1
A18: 11501 | B18: 无尽-野蛮巨人 | D18: 1 | E18: =MID(RC[-4],1,3)&"|70" -> 115|70 | F18: 3|1 | G18: "通通粉碎掉吧！"|3#1304104|1 | H18: =IFERROR(MID(RC[-6],SEARCH("-10",RC[-6])+3,10),IFERROR(MID(RC[-6],SEARCH("-9",RC[-6])+2,10),IFERROR(MID(RC[-6],SEARCH("-8",RC[-6])+2,10),IFERROR(MID(RC[-6],SEARCH("-7",RC[-6])+2,10),IFERROR(MID(RC[-6],SEARCH("-6",RC[-6])+2,10),IFERROR(MID(RC[-6],SEARCH("-5",RC[-6])+2,10),IFERROR(MID(RC[-6],SEARCH("-4",RC[-6])+2,10),IFERROR(MID(RC[-6],SEARCH("-3",RC[-6])+2,10),IFERROR(MID(RC[-6],SEARCH("-2",RC[-6])+2,10),IFERROR(MID(RC[-6],SEARCH("-1",RC[-6])+2,10),IFERROR(MID(RC[-6],SEARCH("-",RC[-6])+1,10),))))))))))) -> 野蛮巨人 | I18: ="1"&VLOOKUP(RC[-1],Sheet1!R2C2:R127C3,2,FALSE) -> 130410 | J18: 130410 | K18: =IFERROR(FIND(13,RC[-4],1),"") -> 13 | L18: =IF(RC[-1]="","",MID(RC[-5],RC[-1],6)) -> 130410 | M18: =SUBSTITUTE(RC[-6],RC[-1],RC[-3],1) -> "通通粉碎掉吧！"|3#1304104|1
A19: 11601 | B19: 无尽-致命特工 | D19: 1 | E19: =MID(RC[-4],1,3)&"|70" -> 116|70 | F19: 3|1 | G19: "无穷无尽……"|3#1304014|1 | H19: =IFERROR(MID(RC[-6],SEARCH("-10",RC[-6])+3,10),IFERROR(MID(RC[-6],SEARCH("-9",RC[-6])+2,10),IFERROR(MID(RC[-6],SEARCH("-8",RC[-6])+2,10),IFERROR(MID(RC[-6],SEARCH("-7",RC[-6])+2,10),IFERROR(MID(RC[-6],SEARCH("-6",RC[-6])+2,10),IFERROR(MID(RC[-6],SEARCH("-5",RC[-6])+2,10),IFERROR(MID(RC[-6],SEARCH("-4",RC[-6])+2,10),IFERROR(MID(RC[-6],SEARCH("-3",RC[-6])+2,10),IFERROR(MID(RC[-6],SEARCH("-2",RC[-6])+2,10),IFERROR(MID(RC[-6],SEARCH("-1",RC[-6])+2,10),IFERROR(MID(RC[-6],SEARCH("-",RC[-6])+1,10),))))))))))) -> 致命特工 | I19: ="1"&VLOOKUP(RC[-1],Sheet1!R2C2:R127C3,2,FALSE) -> 130401 | J19: 130401 | K19: =IFERROR(FIND(13,RC[-4],1),"") -> 12 | L19: =IF(RC[-1]="","",MID(RC[-5],RC[-1],6)) -> 130401 | M19: =SUBSTITUTE(RC[-6],RC[-1],RC[-3],1) -> "无穷无尽……"|3#1304014|1
A20: 11701 | B20: 无尽-鹰眸 | D20: 1 | E20: =MID(RC[-4],1,3)&"|70" -> 117|70 | F20: 3|1 | G20: "这是来自目不可及之处的箭矢！"|3#1304204|1 | H20: =IFERROR(MID(RC[-6],SEARCH("-10",RC[-6])+3,10),IFERROR(MID(RC[-6],SEARCH("-9",RC[-6])+2,10),IFERROR(MID(RC[-6],SEARCH("-8",RC[-6])+2,10),IFERROR(MID(RC[-6],SEARCH("-7",RC[-6])+2,10),IFERROR(MID(RC[-6],SEARCH("-6",RC[-6])+2,10),IFERROR(MID(RC[-6],SEARCH("-5",RC[-6])+2,10),IFERROR(MID(RC[-6],SEARCH("-4",RC[-6])+2,10),IFERROR(MID(RC[-6],SEARCH("-3",RC[-6])+2,10),IFERROR(MID(RC[-6],SEARCH("-2",RC[-6])+2,10),IFERROR(MID(RC[-6],SEARCH("-1",RC[-6])+2,10),IFERROR(MID(RC[-6],SEARCH("-",RC[-6])+1,10),))))))))))) -> 鹰眸 | I20: ="1"&VLOOKUP(RC[-1],Sheet1!R2C2:R127C3,2,FALSE) -> 130420 | J20: 130420 | K20: =IFERROR(FIND(13,RC[-4],1),"") -> 20 | L20: =IF(RC[-1]="","",MID(RC[-5],RC[-1],6)) -> 130420 | M20: =SUBSTITUTE(RC[-6],RC[-1],RC[-3],1) -> "这是来自目不可及之处的箭矢！"|3#1304204|1
A21: 11801 | B21: 无尽-刀锋猎人 | D21: 1 | E21: =MID(RC[-4],1,3)&"|70" -> 118|70 | F21: 3|1 | G21: "杀之不尽"|3#1304024|1 | H21: =IFERROR(MID(RC[-6],SEARCH("-10",RC[-6])+3,10),IFERROR(MID(RC[-6],SEARCH("-9",RC[-6])+2,10),IFERROR(MID(RC[-6],SEARCH("-8",RC[-6])+2,10),IFERROR(MID(RC[-6],SEARCH("-7",RC[-6])+2,10),IFERROR(MID(RC[-6],SEARCH("-6",RC[-6])+2,10),IFERROR(MID(RC[-6],SEARCH("-5",RC[-6])+2,10),IFERROR(MID(RC[-6],SEARCH("-4",RC[-6])+2,10),IFERROR(MID(RC[-6],SEARCH("-3",RC[-6])+2,10),IFERROR(MID(RC[-6],SEARCH("-2",RC[-6])+2,10),IFERROR(MID(RC[-6],SEARCH("-1",RC[-6])+2,10),IFERROR(MID(RC[-6],SEARCH("-",RC[-6])+1,10),))))))))))) -> 刀锋猎人 | I21: ="1"&VLOOKUP(RC[-1],Sheet1!R2C2:R127C3,2,FALSE) -> 130402 | J21: 130402 | K21: =IFERROR(FIND(13,RC[-4],1),"") -> 10 | L21: =IF(RC[-1]="","",MID(RC[-5],RC[-1],6)) -> 130402 | M21: =SUBSTITUTE(RC[-6],RC[-1],RC[-3],1) -> "杀之不尽"|3#1304024|1
A22: 11901 | B22: 无尽-地狱骑士 | D22: 1 | E22: =MID(RC[-4],1,3)&"|70" -> 119|70 | F22: 3|1 | G22: "这才是真正的地狱！"|3#1304034|1 | H22: =IFERROR(MID(RC[-6],SEARCH("-10",RC[-6])+3,10),IFERROR(MID(RC[-6],SEARCH("-9",RC[-6])+2,10),IFERROR(MID(RC[-6],SEARCH("-8",RC[-6])+2,10),IFERROR(MID(RC[-6],SEARCH("-7",RC[-6])+2,10),IFERROR(MID(RC[-6],SEARCH("-6",RC[-6])+2,10),IFERROR(MID(RC[-6],SEARCH("-5",RC[-6])+2,10),IFERROR(MID(RC[-6],SEARCH("-4",RC[-6])+2,10),IFERROR(MID(RC[-6],SEARCH("-3",RC[-6])+2,10),IFERROR(MID(RC[-6],SEARCH("-2",RC[-6])+2,10),IFERROR(MID(RC[-6],SEARCH("-1",RC[-6])+2,10),IFERROR(MID(RC[-6],SEARCH("-",RC[-6])+1,10),))))))))))) -> 地狱骑士 | I22: ="1"&VLOOKUP(RC[-1],Sheet1!R2C2:R127C3,2,FALSE) -> 130403 | J22: 130403 | K22: =IFERROR(FIND(13,RC[-4],1),"") -> 15 | L22: =IF(RC[-1]="","",MID(RC[-5],RC[-1],6)) -> 130403 | M22: =SUBSTITUTE(RC[-6],RC[-1],RC[-3],1) -> "这才是真正的地狱！"|3#1304034|1
A23: 12001 | B23: 无尽-铁人 | D23: 1 | E23: =MID(RC[-4],1,3)&"|70" -> 120|70 | F23: 3|1 | G23: "在这里，真理的轨迹异常明确……"|3#1304284|1 | H23: =IFERROR(MID(RC[-6],SEARCH("-10",RC[-6])+3,10),IFERROR(MID(RC[-6],SEARCH("-9",RC[-6])+2,10),IFERROR(MID(RC[-6],SEARCH("-8",RC[-6])+2,10),IFERROR(MID(RC[-6],SEARCH("-7",RC[-6])+2,10),IFERROR(MID(RC[-6],SEARCH("-6",RC[-6])+2,10),IFERROR(MID(RC[-6],SEARCH("-5",RC[-6])+2,10),IFERROR(MID(RC[-6],SEARCH("-4",RC[-6])+2,10),IFERROR(MID(RC[-6],SEARCH("-3",RC[-6])+2,10),IFERROR(MID(RC[-6],SEARCH("-2",RC[-6])+2,10),IFERROR(MID(RC[-6],SEARCH("-1",RC[-6])+2,10),IFERROR(MID(RC[-6],SEARCH("-",RC[-6])+1,10),))))))))))) -> 铁人 | I23: ="1"&VLOOKUP(RC[-1],Sheet1!R2C2:R127C3,2,FALSE) -> 130428 | J23: 130428 | K23: =IFERROR(FIND(13,RC[-4],1),"") -> 21 | L23: =IF(RC[-1]="","",MID(RC[-5],RC[-1],6)) -> 130428 | M23: =SUBSTITUTE(RC[-6],RC[-1],RC[-3],1) -> "在这里，真理的轨迹异常明确……"|3#1304284|1
A24: 12101 | B24: 无尽-树人 | D24: 1 | E24: =MID(RC[-4],1,3)&"|70" -> 121|70 | F24: 3|1 | G24: "吼——"|3#1304114|1 | H24: =IFERROR(MID(RC[-6],SEARCH("-10",RC[-6])+3,10),IFERROR(MID(RC[-6],SEARCH("-9",RC[-6])+2,10),IFERROR(MID(RC[-6],SEARCH("-8",RC[-6])+2,10),IFERROR(MID(RC[-6],SEARCH("-7",RC[-6])+2,10),IFERROR(MID(RC[-6],SEARCH("-6",RC[-6])+2,10),IFERROR(MID(RC[-6],SEARCH("-5",RC[-6])+2,10),IFERROR(MID(RC[-6],SEARCH("-4",RC[-6])+2,10),IFERROR(MID(RC[-6],SEARCH("-3",RC[-6])+2,10),IFERROR(MID(RC[-6],SEARCH("-2",RC[-6])+2,10),IFERROR(MID(RC[-6],SEARCH("-1",RC[-6])+2,10),IFERROR(MID(RC[-6],SEARCH("-",RC[-6])+1,10),))))))))))) -> 树人 | I24: ="1"&VLOOKUP(RC[-1],Sheet1!R2C2:R127C3,2,FALSE) -> 130411 | J24: 130411 | K24: =IFERROR(FIND(13,RC[-4],1),"") -> 9 | L24: =IF(RC[-1]="","",MID(RC[-5],RC[-1],6)) -> 130411 | M24: =SUBSTITUTE(RC[-6],RC[-1],RC[-3],1) -> "吼——"|3#1304114|1
A25: 12201 | B25: 无尽-超凡博士 | D25: 1 | E25: =MID(RC[-4],1,3)&"|70" -> 122|70 | F25: 3|1 | G25: "深渊的魔法……"|3#1304384|1 | H25: =IFERROR(MID(RC[-6],SEARCH("-10",RC[-6])+3,10),IFERROR(MID(RC[-6],SEARCH("-9",RC[-6])+2,10),IFERROR(MID(RC[-6],SEARCH("-8",RC[-6])+2,10),IFERROR(MID(RC[-6],SEARCH("-7",RC[-6])+2,10),IFERROR(MID(RC[-6],SEARCH("-6",RC[-6])+2,10),IFERROR(MID(RC[-6],SEARCH("-5",RC[-6])+2,10),IFERROR(MID(RC[-6],SEARCH("-4",RC[-6])+2,10),IFERROR(MID(RC[-6],SEARCH("-3",RC[-6])+2,10),IFERROR(MID(RC[-6],SEARCH("-2",RC[-6])+2,10),IFERROR(MID(RC[-6],SEARCH("-1",RC[-6])+2,10),IFERROR(MID(RC[-6],SEARCH("-",RC[-6])+1,10),))))))))))) -> 超凡博士 | I25: ="1"&VLOOKUP(RC[-1],Sheet1!R2C2:R127C3,2,FALSE) -> 130438 | J25: 130438 | K25: =IFERROR(FIND(13,RC[-4],1),"") -> 13 | L25: =IF(RC[-1]="","",MID(RC[-5],RC[-1],6)) -> 130438 | M25: =SUBSTITUTE(RC[-6],RC[-1],RC[-3],1) -> "深渊的魔法……"|3#1304384|1
A26: 12301 | B26: 无尽-白凤凰 | D26: 1 | E26: =MID(RC[-4],1,3)&"|70" -> 123|70 | F26: 3|1 | G26: "我感受到了无尽的苦痛"|3#1304404|1 | H26: =IFERROR(MID(RC[-6],SEARCH("-10",RC[-6])+3,10),IFERROR(MID(RC[-6],SEARCH("-9",RC[-6])+2,10),IFERROR(MID(RC[-6],SEARCH("-8",RC[-6])+2,10),IFERROR(MID(RC[-6],SEARCH("-7",RC[-6])+2,10),IFERROR(MID(RC[-6],SEARCH("-6",RC[-6])+2,10),IFERROR(MID(RC[-6],SEARCH("-5",RC[-6])+2,10),IFERROR(MID(RC[-6],SEARCH("-4",RC[-6])+2,10),IFERROR(MID(RC[-6],SEARCH("-3",RC[-6])+2,10),IFERROR(MID(RC[-6],SEARCH("-2",RC[-6])+2,10),IFERROR(MID(RC[-6],SEARCH("-1",RC[-6])+2,10),IFERROR(MID(RC[-6],SEARCH("-",RC[-6])+1,10),))))))))))) -> 白凤凰 | I26: ="1"&VLOOKUP(RC[-1],Sheet1!R2C2:R127C3,2,FALSE) -> 130440 | J26: 130440 | K26: =IFERROR(FIND(13,RC[-4],1),"") -> 16 | L26: =IF(RC[-1]="","",MID(RC[-5],RC[-1],6)) -> 130440 | M26: =SUBSTITUTE(RC[-6],RC[-1],RC[-3],1) -> "我感受到了无尽的苦痛"|3#1304404|1
A27: 12401 | B27: 无尽-地狱铁拳 | D27: 1 | E27: =MID(RC[-4],1,3)&"|70" -> 124|70 | F27: 3|1 | G27: "你们打开了地狱之门——"|3#1304294|1 | H27: =IFERROR(MID(RC[-6],SEARCH("-10",RC[-6])+3,10),IFERROR(MID(RC[-6],SEARCH("-9",RC[-6])+2,10),IFERROR(MID(RC[-6],SEARCH("-8",RC[-6])+2,10),IFERROR(MID(RC[-6],SEARCH("-7",RC[-6])+2,10),IFERROR(MID(RC[-6],SEARCH("-6",RC[-6])+2,10),IFERROR(MID(RC[-6],SEARCH("-5",RC[-6])+2,10),IFERROR(MID(RC[-6],SEARCH("-4",RC[-6])+2,10),IFERROR(MID(RC[-6],SEARCH("-3",RC[-6])+2,10),IFERROR(MID(RC[-6],SEARCH("-2",RC[-6])+2,10),IFERROR(MID(RC[-6],SEARCH("-1",RC[-6])+2,10),IFERROR(MID(RC[-6],SEARCH("-",RC[-6])+1,10),))))))))))) -> 地狱铁拳 | I27: ="1"&VLOOKUP(RC[-1],Sheet1!R2C2:R127C3,2,FALSE) -> 130429 | J27: 130429 | K27: =IFERROR(FIND(13,RC[-4],1),"") -> 17 | L27: =IF(RC[-1]="","",MID(RC[-5],RC[-1],6)) -> 130429 | M27: =SUBSTITUTE(RC[-6],RC[-1],RC[-3],1) -> "你们打开了地狱之门——"|3#1304294|1
A28: 12501 | B28: 无尽-混沌女巫 | D28: 1 | E28: =MID(RC[-4],1,3)&"|70" -> 125|70 | F28: 3|1 | G28: "堕落也是混沌的一部分"|3#1304494|1 | H28: =IFERROR(MID(RC[-6],SEARCH("-10",RC[-6])+3,10),IFERROR(MID(RC[-6],SEARCH("-9",RC[-6])+2,10),IFERROR(MID(RC[-6],SEARCH("-8",RC[-6])+2,10),IFERROR(MID(RC[-6],SEARCH("-7",RC[-6])+2,10),IFERROR(MID(RC[-6],SEARCH("-6",RC[-6])+2,10),IFERROR(MID(RC[-6],SEARCH("-5",RC[-6])+2,10),IFERROR(MID(RC[-6],SEARCH("-4",RC[-6])+2,10),IFERROR(MID(RC[-6],SEARCH("-3",RC[-6])+2,10),IFERROR(MID(RC[-6],SEARCH("-2",RC[-6])+2,10),IFERROR(MID(RC[-6],SEARCH("-1",RC[-6])+2,10),IFERROR(MID(RC[-6],SEARCH("-",RC[-6])+1,10),))))))))))) -> 混沌女巫 | I28: ="1"&VLOOKUP(RC[-1],Sheet1!R2C2:R127C3,2,FALSE) -> 130449 | J28: 130449 | K28: =IFERROR(FIND(13,RC[-4],1),"") -> 16 | L28: =IF(RC[-1]="","",MID(RC[-5],RC[-1],6)) -> 130449 | M28: =SUBSTITUTE(RC[-6],RC[-1],RC[-3],1) -> "堕落也是混沌的一部分"|3#1304494|1
A29: 14001 | B29: 无尽-杰克船长 | D29: 1 | E29: =MID(RC[-4],1,3)&"|70" -> 140|70 | F29: 3|1 | G29: "无尽的炮火与厮杀！"|3#1313014|1 | H29: =IFERROR(MID(RC[-6],SEARCH("-10",RC[-6])+3,10),IFERROR(MID(RC[-6],SEARCH("-9",RC[-6])+2,10),IFERROR(MID(RC[-6],SEARCH("-8",RC[-6])+2,10),IFERROR(MID(RC[-6],SEARCH("-7",RC[-6])+2,10),IFERROR(MID(RC[-6],SEARCH("-6",RC[-6])+2,10),IFERROR(MID(RC[-6],SEARCH("-5",RC[-6])+2,10),IFERROR(MID(RC[-6],SEARCH("-4",RC[-6])+2,10),IFERROR(MID(RC[-6],SEARCH("-3",RC[-6])+2,10),IFERROR(MID(RC[-6],SEARCH("-2",RC[-6])+2,10),IFERROR(MID(RC[-6],SEARCH("-1",RC[-6])+2,10),IFERROR(MID(RC[-6],SEARCH("-",RC[-6])+1,10),))))))))))) -> 杰克船长 | I29: ="1"&VLOOKUP(RC[-1],Sheet1!R2C2:R127C3,2,FALSE) -> 131301 | J29: 131301 | K29: =IFERROR(FIND(13,RC[-4],1),"") -> 15 | L29: =IF(RC[-1]="","",MID(RC[-5],RC[-1],6)) -> 131301 | M29: =SUBSTITUTE(RC[-6],RC[-1],RC[-3],1) -> "无尽的炮火与厮杀！"|3#1313014|1
A30: 14101 | B30: 无尽-天使长 | D30: 1 | E30: =MID(RC[-4],1,3)&"|70" -> 141|70 | F30: 3|1 | G30: "光辉源于黑暗"|3#1313414|1 | H30: =IFERROR(MID(RC[-6],SEARCH("-10",RC[-6])+3,10),IFERROR(MID(RC[-6],SEARCH("-9",RC[-6])+2,10),IFERROR(MID(RC[-6],SEARCH("-8",RC[-6])+2,10),IFERROR(MID(RC[-6],SEARCH("-7",RC[-6])+2,10),IFERROR(MID(RC[-6],SEARCH("-6",RC[-6])+2,10),IFERROR(MID(RC[-6],SEARCH("-5",RC[-6])+2,10),IFERROR(MID(RC[-6],SEARCH("-4",RC[-6])+2,10),IFERROR(MID(RC[-6],SEARCH("-3",RC[-6])+2,10),IFERROR(MID(RC[-6],SEARCH("-2",RC[-6])+2,10),IFERROR(MID(RC[-6],SEARCH("-1",RC[-6])+2,10),IFERROR(MID(RC[-6],SEARCH("-",RC[-6])+1,10),))))))))))) -> 天使长 | I30: ="1"&VLOOKUP(RC[-1],Sheet1!R2C2:R127C3,2,FALSE) -> 131341 | J30: 131341 | K30: =IFERROR(FIND(13,RC[-4],1),"") -> 12 | L30: =IF(RC[-1]="","",MID(RC[-5],RC[-1],6)) -> 131341 | M30: =SUBSTITUTE(RC[-6],RC[-1],RC[-3],1) -> "光辉源于黑暗"|3#1313414|1
A31: 14201 | B31: 无尽-独眼野蛮人 | D31: 1 | E31: =MID(RC[-4],1,3)&"|70" -> 142|70 | F31: 3|1 | G31: "你们也尝尝这滋味！"|3#1314004|1 | H31: =IFERROR(MID(RC[-6],SEARCH("-10",RC[-6])+3,10),IFERROR(MID(RC[-6],SEARCH("-9",RC[-6])+2,10),IFERROR(MID(RC[-6],SEARCH("-8",RC[-6])+2,10),IFERROR(MID(RC[-6],SEARCH("-7",RC[-6])+2,10),IFERROR(MID(RC[-6],SEARCH("-6",RC[-6])+2,10),IFERROR(MID(RC[-6],SEARCH("-5",RC[-6])+2,10),IFERROR(MID(RC[-6],SEARCH("-4",RC[-6])+2,10),IFERROR(MID(RC[-6],SEARCH("-3",RC[-6])+2,10),IFERROR(MID(RC[-6],SEARCH("-2",RC[-6])+2,10),IFERROR(MID(RC[-6],SEARCH("-1",RC[-6])+2,10),IFERROR(MID(RC[-6],SEARCH("-",RC[-6])+1,10),))))))))))) -> 独眼野蛮人 | I31: ="1"&VLOOKUP(RC[-1],Sheet1!R2C2:R127C3,2,FALSE) -> 131400 | J31: 131400 | K31: =IFERROR(FIND(13,RC[-4],1),"") -> 15 | L31: =IF(RC[-1]="","",MID(RC[-5],RC[-1],6)) -> 131400 | M31: =SUBSTITUTE(RC[-6],RC[-1],RC[-3],1) -> "你们也尝尝这滋味！"|3#1314004|1
A32: 14301 | B32: 无尽-圣女贞德 | D32: 1 | E32: =MID(RC[-4],1,3)&"|70" -> 143|70 | F32: 3|1 | G32: "信仰堕落吧"|3#1314404|1 | H32: =IFERROR(MID(RC[-6],SEARCH("-10",RC[-6])+3,10),IFERROR(MID(RC[-6],SEARCH("-9",RC[-6])+2,10),IFERROR(MID(RC[-6],SEARCH("-8",RC[-6])+2,10),IFERROR(MID(RC[-6],SEARCH("-7",RC[-6])+2,10),IFERROR(MID(RC[-6],SEARCH("-6",RC[-6])+2,10),IFERROR(MID(RC[-6],SEARCH("-5",RC[-6])+2,10),IFERROR(MID(RC[-6],SEARCH("-4",RC[-6])+2,10),IFERROR(MID(RC[-6],SEARCH("-3",RC[-6])+2,10),IFERROR(MID(RC[-6],SEARCH("-2",RC[-6])+2,10),IFERROR(MID(RC[-6],SEARCH("-1",RC[-6])+2,10),IFERROR(MID(RC[-6],SEARCH("-",RC[-6])+1,10),))))))))))) -> 圣女贞德 | I32: ="1"&VLOOKUP(RC[-1],Sheet1!R2C2:R127C3,2,FALSE) -> 131440 | J32: 131440 | K32: =IFERROR(FIND(13,RC[-4],1),"") -> 11 | L32: =IF(RC[-1]="","",MID(RC[-5],RC[-1],6)) -> 131440 | M32: =SUBSTITUTE(RC[-6],RC[-1],RC[-3],1) -> "信仰堕落吧"|3#1314404|1
A33: 14401 | B33: 无尽-美杜莎 | D33: 1 | E33: =MID(RC[-4],1,3)&"|70" -> 144|70 | F33: 3|1 | G33: "沉眠于深渊……"|3#1314304|1 | H33: =IFERROR(MID(RC[-6],SEARCH("-10",RC[-6])+3,10),IFERROR(MID(RC[-6],SEARCH("-9",RC[-6])+2,10),IFERROR(MID(RC[-6],SEARCH("-8",RC[-6])+2,10),IFERROR(MID(RC[-6],SEARCH("-7",RC[-6])+2,10),IFERROR(MID(RC[-6],SEARCH("-6",RC[-6])+2,10),IFERROR(MID(RC[-6],SEARCH("-5",RC[-6])+2,10),IFERROR(MID(RC[-6],SEARCH("-4",RC[-6])+2,10),IFERROR(MID(RC[-6],SEARCH("-3",RC[-6])+2,10),IFERROR(MID(RC[-6],SEARCH("-2",RC[-6])+2,10),IFERROR(MID(RC[-6],SEARCH("-1",RC[-6])+2,10),IFERROR(MID(RC[-6],SEARCH("-",RC[-6])+1,10),))))))))))) -> 美杜莎 | I33: ="1"&VLOOKUP(RC[-1],Sheet1!R2C2:R127C3,2,FALSE) -> 131430 | J33: 131430 | K33: =IFERROR(FIND(13,RC[-4],1),"") -> 13 | L33: =IF(RC[-1]="","",MID(RC[-5],RC[-1],6)) -> 131430 | M33: =SUBSTITUTE(RC[-6],RC[-1],RC[-3],1) -> "沉眠于深渊……"|3#1314304|1
A34: 14501 | B34: 无尽-德古拉伯爵 | D34: 1 | E34: =MID(RC[-4],1,3)&"|70" -> 145|70 | F34: 3|1 | G34: "鲜血如此诱人……"|3#1314014|1 | H34: =IFERROR(MID(RC[-6],SEARCH("-10",RC[-6])+3,10),IFERROR(MID(RC[-6],SEARCH("-9",RC[-6])+2,10),IFERROR(MID(RC[-6],SEARCH("-8",RC[-6])+2,10),IFERROR(MID(RC[-6],SEARCH("-7",RC[-6])+2,10),IFERROR(MID(RC[-6],SEARCH("-6",RC[-6])+2,10),IFERROR(MID(RC[-6],SEARCH("-5",RC[-6])+2,10),IFERROR(MID(RC[-6],SEARCH("-4",RC[-6])+2,10),IFERROR(MID(RC[-6],SEARCH("-3",RC[-6])+2,10),IFERROR(MID(RC[-6],SEARCH("-2",RC[-6])+2,10),IFERROR(MID(RC[-6],SEARCH("-1",RC[-6])+2,10),IFERROR(MID(RC[-6],SEARCH("-",RC[-6])+1,10),))))))))))) -> 德古拉伯爵 | I34: ="1"&VLOOKUP(RC[-1],Sheet1!R2C2:R127C3,2,FALSE) -> 131401 | J34: 131401 | K34: =IFERROR(FIND(13,RC[-4],1),"") -> 14 | L34: =IF(RC[-1]="","",MID(RC[-5],RC[-1],6)) -> 131401 | M34: =SUBSTITUTE(RC[-6],RC[-1],RC[-3],1) -> "鲜血如此诱人……"|3#1314014|1
A35: 14601 | B35: 无尽-狩猎女神 | D35: 1 | E35: =MID(RC[-4],1,3)&"|70" -> 146|70 | F35: 3|1 | G35: "快逃吧，不然你就要死了"|3#1314314|1 | H35: =IFERROR(MID(RC[-6],SEARCH("-10",RC[-6])+3,10),IFERROR(MID(RC[-6],SEARCH("-9",RC[-6])+2,10),IFERROR(MID(RC[-6],SEARCH("-8",RC[-6])+2,10),IFERROR(MID(RC[-6],SEARCH("-7",RC[-6])+2,10),IFERROR(MID(RC[-6],SEARCH("-6",RC[-6])+2,10),IFERROR(MID(RC[-6],SEARCH("-5",RC[-6])+2,10),IFERROR(MID(RC[-6],SEARCH("-4",RC[-6])+2,10),IFERROR(MID(RC[-6],SEARCH("-3",RC[-6])+2,10),IFERROR(MID(RC[-6],SEARCH("-2",RC[-6])+2,10),IFERROR(MID(RC[-6],SEARCH("-1",RC[-6])+2,10),IFERROR(MID(RC[-6],SEARCH("-",RC[-6])+1,10),))))))))))) -> 狩猎女神 | I35: ="1"&VLOOKUP(RC[-1],Sheet1!R2C2:R127C3,2,FALSE) -> 131431 | J35: 131431 | K35: =IFERROR(FIND(13,RC[-4],1),"") -> 17 | L35: =IF(RC[-1]="","",MID(RC[-5],RC[-1],6)) -> 131431 | M35: =SUBSTITUTE(RC[-6],RC[-1],RC[-3],1) -> "快逃吧，不然你就要死了"|3#1314314|1
A36: 14701 | B36: 无尽-查理大帝 | D36: 1 | E36: =MID(RC[-4],1,3)&"|70" -> 147|70 | F36: 3|1 | G36: "我将征服这一切！"|3#1314024|1 | H36: =IFERROR(MID(RC[-6],SEARCH("-10",RC[-6])+3,10),IFERROR(MID(RC[-6],SEARCH("-9",RC[-6])+2,10),IFERROR(MID(RC[-6],SEARCH("-8",RC[-6])+2,10),IFERROR(MID(RC[-6],SEARCH("-7",RC[-6])+2,10),IFERROR(MID(RC[-6],SEARCH("-6",RC[-6])+2,10),IFERROR(MID(RC[-6],SEARCH("-5",RC[-6])+2,10),IFERROR(MID(RC[-6],SEARCH("-4",RC[-6])+2,10),IFERROR(MID(RC[-6],SEARCH("-3",RC[-6])+2,10),IFERROR(MID(RC[-6],SEARCH("-2",RC[-6])+2,10),IFERROR(MID(RC[-6],SEARCH("-1",RC[-6])+2,10),IFERROR(MID(RC[-6],SEARCH("-",RC[-6])+1,10),))))))))))) -> 查理大帝 | I36: ="1"&VLOOKUP(RC[-1],Sheet1!R2C2:R127C3,2,FALSE) -> 131402 | J36: 131402 | K36: =IFERROR(FIND(13,RC[-4],1),"") -> 14 | L36: =IF(RC[-1]="","",MID(RC[-5],RC[-1],6)) -> 131402 | M36: =SUBSTITUTE(RC[-6],RC[-1],RC[-3],1) -> "我将征服这一切！"|3#1314024|1
A37: 14801 | B37: 无尽-佐罗 | D37: 1 | E37: =MID(RC[-4],1,3)&"|70" -> 148|70 | F37: 3|1 | G37: "来自黑暗，一击必杀！"|3#1314034|1 | H37: =IFERROR(MID(RC[-6],SEARCH("-10",RC[-6])+3,10),IFERROR(MID(RC[-6],SEARCH("-9",RC[-6])+2,10),IFERROR(MID(RC[-6],SEARCH("-8",RC[-6])+2,10),IFERROR(MID(RC[-6],SEARCH("-7",RC[-6])+2,10),IFERROR(MID(RC[-6],SEARCH("-6",RC[-6])+2,10),IFERROR(MID(RC[-6],SEARCH("-5",RC[-6])+2,10),IFERROR(MID(RC[-6],SEARCH("-4",RC[-6])+2,10),IFERROR(MID(RC[-6],SEARCH("-3",RC[-6])+2,10),IFERROR(MID(RC[-6],SEARCH("-2",RC[-6])+2,10),IFERROR(MID(RC[-6],SEARCH("-1",RC[-6])+2,10),IFERROR(MID(RC[-6],SEARCH("-",RC[-6])+1,10),))))))))))) -> 佐罗 | I37: ="1"&VLOOKUP(RC[-1],Sheet1!R2C2:R127C3,2,FALSE) -> 131403 | J37: 131403 | K37: =IFERROR(FIND(13,RC[-4],1),"") -> 16 | L37: =IF(RC[-1]="","",MID(RC[-5],RC[-1],6)) -> 131403 | M37: =SUBSTITUTE(RC[-6],RC[-1],RC[-3],1) -> "来自黑暗，一击必杀！"|3#1314034|1
A38: 14901 | B38: 无尽-亚马逊女王 | D38: 1 | E38: =MID(RC[-4],1,3)&"|70" -> 149|70 | F38: 3|1 | G38: "黑暗弥漫之处，便是狩猎之时"|3#1314204|1 | H38: =IFERROR(MID(RC[-6],SEARCH("-10",RC[-6])+3,10),IFERROR(MID(RC[-6],SEARCH("-9",RC[-6])+2,10),IFERROR(MID(RC[-6],SEARCH("-8",RC[-6])+2,10),IFERROR(MID(RC[-6],SEARCH("-7",RC[-6])+2,10),IFERROR(MID(RC[-6],SEARCH("-6",RC[-6])+2,10),IFERROR(MID(RC[-6],SEARCH("-5",RC[-6])+2,10),IFERROR(MID(RC[-6],SEARCH("-4",RC[-6])+2,10),IFERROR(MID(RC[-6],SEARCH("-3",RC[-6])+2,10),IFERROR(MID(RC[-6],SEARCH("-2",RC[-6])+2,10),IFERROR(MID(RC[-6],SEARCH("-1",RC[-6])+2,10),IFERROR(MID(RC[-6],SEARCH("-",RC[-6])+1,10),))))))))))) -> 亚马逊女王 | I38: ="1"&VLOOKUP(RC[-1],Sheet1!R2C2:R127C3,2,FALSE) -> 131420 | J38: 131420 | K38: =IFERROR(FIND(13,RC[-4],1),"") -> 19 | L38: =IF(RC[-1]="","",MID(RC[-5],RC[-1],6)) -> 131420 | M38: =SUBSTITUTE(RC[-6],RC[-1],RC[-3],1) -> "黑暗弥漫之处，便是狩猎之时"|3#1314204|1
A39: 15001 | B39: 无尽-宙斯 | D39: 1 | E39: =MID(RC[-4],1,3)&"|70" -> 150|70 | F39: 3|1 | G39: "欢迎来到最终的结局！"|3#1314384|1 | H39: =IFERROR(MID(RC[-6],SEARCH("-10",RC[-6])+3,10),IFERROR(MID(RC[-6],SEARCH("-9",RC[-6])+2,10),IFERROR(MID(RC[-6],SEARCH("-8",RC[-6])+2,10),IFERROR(MID(RC[-6],SEARCH("-7",RC[-6])+2,10),IFERROR(MID(RC[-6],SEARCH("-6",RC[-6])+2,10),IFERROR(MID(RC[-6],SEARCH("-5",RC[-6])+2,10),IFERROR(MID(RC[-6],SEARCH("-4",RC[-6])+2,10),IFERROR(MID(RC[-6],SEARCH("-3",RC[-6])+2,10),IFERROR(MID(RC[-6],SEARCH("-2",RC[-6])+2,10),IFERROR(MID(RC[-6],SEARCH("-1",RC[-6])+2,10),IFERROR(MID(RC[-6],SEARCH("-",RC[-6])+1,10),))))))))))) -> 宙斯 | I39: ="1"&VLOOKUP(RC[-1],Sheet1!R2C2:R127C3,2,FALSE) -> 131438 | J39: 131438 | K39: =IFERROR(FIND(13,RC[-4],1),"") -> 16 | L39: =IF(RC[-1]="","",MID(RC[-5],RC[-1],6)) -> 131438 | M39: =SUBSTITUTE(RC[-6],RC[-1],RC[-3],1) -> "欢迎来到最终的结局！"|3#1314384|1
A40: 15101 | B40: 无尽-斯巴达 | D40: 1 | E40: =MID(RC[-4],1,3)&"|70" -> 151|70 | F40: 3|1 | G40: "来吧，投身于深渊——"|3#1314104|1 | H40: =IFERROR(MID(RC[-6],SEARCH("-10",RC[-6])+3,10),IFERROR(MID(RC[-6],SEARCH("-9",RC[-6])+2,10),IFERROR(MID(RC[-6],SEARCH("-8",RC[-6])+2,10),IFERROR(MID(RC[-6],SEARCH("-7",RC[-6])+2,10),IFERROR(MID(RC[-6],SEARCH("-6",RC[-6])+2,10),IFERROR(MID(RC[-6],SEARCH("-5",RC[-6])+2,10),IFERROR(MID(RC[-6],SEARCH("-4",RC[-6])+2,10),IFERROR(MID(RC[-6],SEARCH("-3",RC[-6])+2,10),IFERROR(MID(RC[-6],SEARCH("-2",RC[-6])+2,10),IFERROR(MID(RC[-6],SEARCH("-1",RC[-6])+2,10),IFERROR(MID(RC[-6],SEARCH("-",RC[-6])+1,10),))))))))))) -> 斯巴达 | I40: ="1"&VLOOKUP(RC[-1],Sheet1!R2C2:R127C3,2,FALSE) -> 131410 | J40: 131410 | K40: =IFERROR(FIND(13,RC[-4],1),"") -> 16 | L40: =IF(RC[-1]="","",MID(RC[-5],RC[-1],6)) -> 131410 | M40: =SUBSTITUTE(RC[-6],RC[-1],RC[-3],1) -> "来吧，投身于深渊——"|3#1314104|1
A41: 15201 | B41: 无尽-阿努比斯 | D41: 1 | E41: =MID(RC[-4],1,3)&"|70" -> 152|70 | F41: 3|1 | G41: "这是亡者的归属"|3#1314084|1 | H41: =IFERROR(MID(RC[-6],SEARCH("-10",RC[-6])+3,10),IFERROR(MID(RC[-6],SEARCH("-9",RC[-6])+2,10),IFERROR(MID(RC[-6],SEARCH("-8",RC[-6])+2,10),IFERROR(MID(RC[-6],SEARCH("-7",RC[-6])+2,10),IFERROR(MID(RC[-6],SEARCH("-6",RC[-6])+2,10),IFERROR(MID(RC[-6],SEARCH("-5",RC[-6])+2,10),IFERROR(MID(RC[-6],SEARCH("-4",RC[-6])+2,10),IFERROR(MID(RC[-6],SEARCH("-3",RC[-6])+2,10),IFERROR(MID(RC[-6],SEARCH("-2",RC[-6])+2,10),IFERROR(MID(RC[-6],SEARCH("-1",RC[-6])+2,10),IFERROR(MID(RC[-6],SEARCH("-",RC[-6])+1,10),))))))))))) -> 阿努比斯 | I41: ="1"&VLOOKUP(RC[-1],Sheet1!R2C2:R127C3,2,FALSE) -> 131408 | J41: 131408 | K41: =IFERROR(FIND(13,RC[-4],1),"") -> 13 | L41: =IF(RC[-1]="","",MID(RC[-5],RC[-1],6)) -> 131408 | M41: =SUBSTITUTE(RC[-6],RC[-1],RC[-3],1) -> "这是亡者的归属"|3#1314084|1
A42: 15301 | B42: 无尽-雅典娜 | D42: 1 | E42: =MID(RC[-4],1,3)&"|70" -> 153|70 | F42: 3|1 | G42: "当你凝视深渊，深渊也在凝视着你"|3#1314414|1 | H42: =IFERROR(MID(RC[-6],SEARCH("-10",RC[-6])+3,10),IFERROR(MID(RC[-6],SEARCH("-9",RC[-6])+2,10),IFERROR(MID(RC[-6],SEARCH("-8",RC[-6])+2,10),IFERROR(MID(RC[-6],SEARCH("-7",RC[-6])+2,10),IFERROR(MID(RC[-6],SEARCH("-6",RC[-6])+2,10),IFERROR(MID(RC[-6],SEARCH("-5",RC[-6])+2,10),IFERROR(MID(RC[-6],SEARCH("-4",RC[-6])+2,10),IFERROR(MID(RC[-6],SEARCH("-3",RC[-6])+2,10),IFERROR(MID(RC[-6],SEARCH("-2",RC[-6])+2,10),IFERROR(MID(RC[-6],SEARCH("-1",RC[-6])+2,10),IFERROR(MID(RC[-6],SEARCH("-",RC[-6])+1,10),))))))))))) -> 雅典娜 | I42: ="1"&VLOOKUP(RC[-1],Sheet1!R2C2:R127C3,2,FALSE) -> 131441 | J42: 131441 | K42: =IFERROR(FIND(13,RC[-4],1),"") -> 21 | L42: =IF(RC[-1]="","",MID(RC[-5],RC[-1],6)) -> 131441 | M42: =SUBSTITUTE(RC[-6],RC[-1],RC[-3],1) -> "当你凝视深渊，深渊也在凝视着你"|3#1314414|1
A43: 15401 | B43: 无尽-大力神 | D43: 1 | E43: =MID(RC[-4],1,3)&"|70" -> 154|70 | F43: 3|1 | G43: "砸碎你们！"|3#1314194|1 | H43: =IFERROR(MID(RC[-6],SEARCH("-10",RC[-6])+3,10),IFERROR(MID(RC[-6],SEARCH("-9",RC[-6])+2,10),IFERROR(MID(RC[-6],SEARCH("-8",RC[-6])+2,10),IFERROR(MID(RC[-6],SEARCH("-7",RC[-6])+2,10),IFERROR(MID(RC[-6],SEARCH("-6",RC[-6])+2,10),IFERROR(MID(RC[-6],SEARCH("-5",RC[-6])+2,10),IFERROR(MID(RC[-6],SEARCH("-4",RC[-6])+2,10),IFERROR(MID(RC[-6],SEARCH("-3",RC[-6])+2,10),IFERROR(MID(RC[-6],SEARCH("-2",RC[-6])+2,10),IFERROR(MID(RC[-6],SEARCH("-1",RC[-6])+2,10),IFERROR(MID(RC[-6],SEARCH("-",RC[-6])+1,10),))))))))))) -> 大力神 | I43: ="1"&VLOOKUP(RC[-1],Sheet1!R2C2:R127C3,2,FALSE) -> 131419 | J43: 131419 | K43: =IFERROR(FIND(13,RC[-4],1),"") -> 11 | L43: =IF(RC[-1]="","",MID(RC[-5],RC[-1],6)) -> 131419 | M43: =SUBSTITUTE(RC[-6],RC[-1],RC[-3],1) -> "砸碎你们！"|3#1314194|1
A44: 15501 | B44: 无尽-冥王哈迪斯 | D44: 1 | E44: =MID(RC[-4],1,3)&"|70" -> 155|70 | F44: 3|1 | G44: "你们无法逃离黑暗"|3#1314394|1 | H44: =IFERROR(MID(RC[-6],SEARCH("-10",RC[-6])+3,10),IFERROR(MID(RC[-6],SEARCH("-9",RC[-6])+2,10),IFERROR(MID(RC[-6],SEARCH("-8",RC[-6])+2,10),IFERROR(MID(RC[-6],SEARCH("-7",RC[-6])+2,10),IFERROR(MID(RC[-6],SEARCH("-6",RC[-6])+2,10),IFERROR(MID(RC[-6],SEARCH("-5",RC[-6])+2,10),IFERROR(MID(RC[-6],SEARCH("-4",RC[-6])+2,10),IFERROR(MID(RC[-6],SEARCH("-3",RC[-6])+2,10),IFERROR(MID(RC[-6],SEARCH("-2",RC[-6])+2,10),IFERROR(MID(RC[-6],SEARCH("-1",RC[-6])+2,10),IFERROR(MID(RC[-6],SEARCH("-",RC[-6])+1,10),))))))))))) -> 冥王哈迪斯 | I44: ="1"&VLOOKUP(RC[-1],Sheet1!R2C2:R127C3,2,FALSE) -> 131439 | J44: 131439 | K44: =IFERROR(FIND(13,RC[-4],1),"") -> 14 | L44: =IF(RC[-1]="","",MID(RC[-5],RC[-1],6)) -> 131439 | M44: =SUBSTITUTE(RC[-6],RC[-1],RC[-3],1) -> "你们无法逃离黑暗"|3#1314394|1
A45: 17001 | B45: 无尽-石头人 | D45: 1 | E45: =MID(RC[-4],1,3)&"|70" -> 170|70 | F45: 3|1 | G45: "山崩地裂——"|3#1323114|1 | H45: =IFERROR(MID(RC[-6],SEARCH("-10",RC[-6])+3,10),IFERROR(MID(RC[-6],SEARCH("-9",RC[-6])+2,10),IFERROR(MID(RC[-6],SEARCH("-8",RC[-6])+2,10),IFERROR(MID(RC[-6],SEARCH("-7",RC[-6])+2,10),IFERROR(MID(RC[-6],SEARCH("-6",RC[-6])+2,10),IFERROR(MID(RC[-6],SEARCH("-5",RC[-6])+2,10),IFERROR(MID(RC[-6],SEARCH("-4",RC[-6])+2,10),IFERROR(MID(RC[-6],SEARCH("-3",RC[-6])+2,10),IFERROR(MID(RC[-6],SEARCH("-2",RC[-6])+2,10),IFERROR(MID(RC[-6],SEARCH("-1",RC[-6])+2,10),IFERROR(MID(RC[-6],SEARCH("-",RC[-6])+1,10),))))))))))) -> 石头人 | I45: ="1"&VLOOKUP(RC[-1],Sheet1!R2C2:R127C3,2,FALSE) -> 132311 | J45: 132311 | K45: =IFERROR(FIND(13,RC[-4],1),"") -> 12 | L45: =IF(RC[-1]="","",MID(RC[-5],RC[-1],6)) -> 132311 | M45: =SUBSTITUTE(RC[-6],RC[-1],RC[-3],1) -> "山崩地裂——"|3#1323114|1
A46: 17101 | B46: 无尽-血源牧师 | D46: 1 | E46: =MID(RC[-4],1,3)&"|70" -> 171|70 | F46: 3|1 | G46: "一切归于深渊"|3#1323414|1 | H46: =IFERROR(MID(RC[-6],SEARCH("-10",RC[-6])+3,10),IFERROR(MID(RC[-6],SEARCH("-9",RC[-6])+2,10),IFERROR(MID(RC[-6],SEARCH("-8",RC[-6])+2,10),IFERROR(MID(RC[-6],SEARCH("-7",RC[-6])+2,10),IFERROR(MID(RC[-6],SEARCH("-6",RC[-6])+2,10),IFERROR(MID(RC[-6],SEARCH("-5",RC[-6])+2,10),IFERROR(MID(RC[-6],SEARCH("-4",RC[-6])+2,10),IFERROR(MID(RC[-6],SEARCH("-3",RC[-6])+2,10),IFERROR(MID(RC[-6],SEARCH("-2",RC[-6])+2,10),IFERROR(MID(RC[-6],SEARCH("-1",RC[-6])+2,10),IFERROR(MID(RC[-6],SEARCH("-",RC[-6])+1,10),))))))))))) -> 血源牧师 | I46: ="1"&VLOOKUP(RC[-1],Sheet1!R2C2:R127C3,2,FALSE) -> 132341 | J46: 132341 | K46: =IFERROR(FIND(13,RC[-4],1),"") -> 12 | L46: =IF(RC[-1]="","",MID(RC[-5],RC[-1],6)) -> 132341 | M46: =SUBSTITUTE(RC[-6],RC[-1],RC[-3],1) -> "一切归于深渊"|3#1323414|1
A47: 17201 | B47: 无尽-屠夫 | D47: 1 | E47: =MID(RC[-4],1,3)&"|70" -> 172|70 | F47: 3|1 | G47: "美妙的血肉——"|3#1324104|1 | H47: =IFERROR(MID(RC[-6],SEARCH("-10",RC[-6])+3,10),IFERROR(MID(RC[-6],SEARCH("-9",RC[-6])+2,10),IFERROR(MID(RC[-6],SEARCH("-8",RC[-6])+2,10),IFERROR(MID(RC[-6],SEARCH("-7",RC[-6])+2,10),IFERROR(MID(RC[-6],SEARCH("-6",RC[-6])+2,10),IFERROR(MID(RC[-6],SEARCH("-5",RC[-6])+2,10),IFERROR(MID(RC[-6],SEARCH("-4",RC[-6])+2,10),IFERROR(MID(RC[-6],SEARCH("-3",RC[-6])+2,10),IFERROR(MID(RC[-6],SEARCH("-2",RC[-6])+2,10),IFERROR(MID(RC[-6],SEARCH("-1",RC[-6])+2,10),IFERROR(MID(RC[-6],SEARCH("-",RC[-6])+1,10),))))))))))) -> 屠夫 | I47: ="1"&VLOOKUP(RC[-1],Sheet1!R2C2:R127C3,2,FALSE) -> 132410 | J47: 132410 | K47: =IFERROR(FIND(13,RC[-4],1),"") -> 13 | L47: =IF(RC[-1]="","",MID(RC[-5],RC[-1],6)) -> 132410 | M47: =SUBSTITUTE(RC[-6],RC[-1],RC[-3],1) -> "美妙的血肉——"|3#1324104|1
A48: 17301 | B48: 无尽-树精 | D48: 1 | E48: =MID(RC[-4],1,3)&"|70" -> 173|70 | F48: 3|1 | G48: "你将迎来终结。"|3#1324114|1 | H48: =IFERROR(MID(RC[-6],SEARCH("-10",RC[-6])+3,10),IFERROR(MID(RC[-6],SEARCH("-9",RC[-6])+2,10),IFERROR(MID(RC[-6],SEARCH("-8",RC[-6])+2,10),IFERROR(MID(RC[-6],SEARCH("-7",RC[-6])+2,10),IFERROR(MID(RC[-6],SEARCH("-6",RC[-6])+2,10),IFERROR(MID(RC[-6],SEARCH("-5",RC[-6])+2,10),IFERROR(MID(RC[-6],SEARCH("-4",RC[-6])+2,10),IFERROR(MID(RC[-6],SEARCH("-3",RC[-6])+2,10),IFERROR(MID(RC[-6],SEARCH("-2",RC[-6])+2,10),IFERROR(MID(RC[-6],SEARCH("-1",RC[-6])+2,10),IFERROR(MID(RC[-6],SEARCH("-",RC[-6])+1,10),))))))))))) -> 树精 | I48: ="1"&VLOOKUP(RC[-1],Sheet1!R2C2:R127C3,2,FALSE) -> 132411 | J48: 132411 | K48: =IFERROR(FIND(13,RC[-4],1),"") -> 13 | L48: =IF(RC[-1]="","",MID(RC[-5],RC[-1],6)) -> 132411 | M48: =SUBSTITUTE(RC[-6],RC[-1],RC[-3],1) -> "你将迎来终结。"|3#1324114|1
A49: 17401 | B49: 无尽-牛头人 | D49: 1 | E49: =MID(RC[-4],1,3)&"|70" -> 174|70 | F49: 3|1 | G49: "你们无法阻挡我！"|3#1324004|1 | H49: =IFERROR(MID(RC[-6],SEARCH("-10",RC[-6])+3,10),IFERROR(MID(RC[-6],SEARCH("-9",RC[-6])+2,10),IFERROR(MID(RC[-6],SEARCH("-8",RC[-6])+2,10),IFERROR(MID(RC[-6],SEARCH("-7",RC[-6])+2,10),IFERROR(MID(RC[-6],SEARCH("-6",RC[-6])+2,10),IFERROR(MID(RC[-6],SEARCH("-5",RC[-6])+2,10),IFERROR(MID(RC[-6],SEARCH("-4",RC[-6])+2,10),IFERROR(MID(RC[-6],SEARCH("-3",RC[-6])+2,10),IFERROR(MID(RC[-6],SEARCH("-2",RC[-6])+2,10),IFERROR(MID(RC[-6],SEARCH("-1",RC[-6])+2,10),IFERROR(MID(RC[-6],SEARCH("-",RC[-6])+1,10),))))))))))) -> 牛头人 | I49: ="1"&VLOOKUP(RC[-1],Sheet1!R2C2:R127C3,2,FALSE) -> 132400 | J49: 132400 | K49: =IFERROR(FIND(13,RC[-4],1),"") -> 14 | L49: =IF(RC[-1]="","",MID(RC[-5],RC[-1],6)) -> 132400 | M49: =SUBSTITUTE(RC[-6],RC[-1],RC[-3],1) -> "你们无法阻挡我！"|3#1324004|1
A50: 17501 | B50: 无尽-火女 | D50: 1 | E50: =MID(RC[-4],1,3)&"|70" -> 175|70 | F50: 3|1 | G50: "黑火将焚毁世界"|3#1324304|1 | H50: =IFERROR(MID(RC[-6],SEARCH("-10",RC[-6])+3,10),IFERROR(MID(RC[-6],SEARCH("-9",RC[-6])+2,10),IFERROR(MID(RC[-6],SEARCH("-8",RC[-6])+2,10),IFERROR(MID(RC[-6],SEARCH("-7",RC[-6])+2,10),IFERROR(MID(RC[-6],SEARCH("-6",RC[-6])+2,10),IFERROR(MID(RC[-6],SEARCH("-5",RC[-6])+2,10),IFERROR(MID(RC[-6],SEARCH("-4",RC[-6])+2,10),IFERROR(MID(RC[-6],SEARCH("-3",RC[-6])+2,10),IFERROR(MID(RC[-6],SEARCH("-2",RC[-6])+2,10),IFERROR(MID(RC[-6],SEARCH("-1",RC[-6])+2,10),IFERROR(MID(RC[-6],SEARCH("-",RC[-6])+1,10),))))))))))) -> 火女 | I50: ="1"&VLOOKUP(RC[-1],Sheet1!R2C2:R127C3,2,FALSE) -> 132430 | J50: 132430 | K50: =IFERROR(FIND(13,RC[-4],1),"") -> 13 | L50: =IF(RC[-1]="","",MID(RC[-5],RC[-1],6)) -> 132430 | M50: =SUBSTITUTE(RC[-6],RC[-1],RC[-3],1) -> "黑火将焚毁世界"|3#1324304|1
A51: 17601 | B51: 无尽-半人马 | D51: 1 | E51: =MID(RC[-4],1,3)&"|70" -> 176|70 | F51: 3|1 | G51: "深渊的号角已经吹响！"|3#1324014|1 | H51: =IFERROR(MID(RC[-6],SEARCH("-10",RC[-6])+3,10),IFERROR(MID(RC[-6],SEARCH("-9",RC[-6])+2,10),IFERROR(MID(RC[-6],SEARCH("-8",RC[-6])+2,10),IFERROR(MID(RC[-6],SEARCH("-7",RC[-6])+2,10),IFERROR(MID(RC[-6],SEARCH("-6",RC[-6])+2,10),IFERROR(MID(RC[-6],SEARCH("-5",RC[-6])+2,10),IFERROR(MID(RC[-6],SEARCH("-4",RC[-6])+2,10),IFERROR(MID(RC[-6],SEARCH("-3",RC[-6])+2,10),IFERROR(MID(RC[-6],SEARCH("-2",RC[-6])+2,10),IFERROR(MID(RC[-6],SEARCH("-1",RC[-6])+2,10),IFERROR(MID(RC[-6],SEARCH("-",RC[-6])+1,10),))))))))))) -> 半人马 | I51: ="1"&VLOOKUP(RC[-1],Sheet1!R2C2:R127C3,2,FALSE) -> 132401 | J51: 132401 | K51: =IFERROR(FIND(13,RC[-4],1),"") -> 16 | L51: =IF(RC[-1]="","",MID(RC[-5],RC[-1],6)) -> 132401 | M51: =SUBSTITUTE(RC[-6],RC[-1],RC[-3],1) -> "深渊的号角已经吹响！"|3#1324014|1
A52: 17701 | B52: 无尽-食人魔 | D52: 1 | E52: =MID(RC[-4],1,3)&"|70" -> 177|70 | F52: 3|1 | G52: "我会吃掉你们——"|3#1324314|1 | H52: =IFERROR(MID(RC[-6],SEARCH("-10",RC[-6])+3,10),IFERROR(MID(RC[-6],SEARCH("-9",RC[-6])+2,10),IFERROR(MID(RC[-6],SEARCH("-8",RC[-6])+2,10),IFERROR(MID(RC[-6],SEARCH("-7",RC[-6])+2,10),IFERROR(MID(RC[-6],SEARCH("-6",RC[-6])+2,10),IFERROR(MID(RC[-6],SEARCH("-5",RC[-6])+2,10),IFERROR(MID(RC[-6],SEARCH("-4",RC[-6])+2,10),IFERROR(MID(RC[-6],SEARCH("-3",RC[-6])+2,10),IFERROR(MID(RC[-6],SEARCH("-2",RC[-6])+2,10),IFERROR(MID(RC[-6],SEARCH("-1",RC[-6])+2,10),IFERROR(MID(RC[-6],SEARCH("-",RC[-6])+1,10),))))))))))) -> 食人魔 | I52: ="1"&VLOOKUP(RC[-1],Sheet1!R2C2:R127C3,2,FALSE) -> 132431 | J52: 132431 | K52: =IFERROR(FIND(13,RC[-4],1),"") -> 14 | L52: =IF(RC[-1]="","",MID(RC[-5],RC[-1],6)) -> 132431 | M52: =SUBSTITUTE(RC[-6],RC[-1],RC[-3],1) -> "我会吃掉你们——"|3#1324314|1
A53: 17801 | B53: 无尽-基伦 | D53: 1 | E53: =MID(RC[-4],1,3)&"|70" -> 178|70 | F53: 3|1 | G53: "你们必将失败！"|3#1324024|1 | H53: =IFERROR(MID(RC[-6],SEARCH("-10",RC[-6])+3,10),IFERROR(MID(RC[-6],SEARCH("-9",RC[-6])+2,10),IFERROR(MID(RC[-6],SEARCH("-8",RC[-6])+2,10),IFERROR(MID(RC[-6],SEARCH("-7",RC[-6])+2,10),IFERROR(MID(RC[-6],SEARCH("-6",RC[-6])+2,10),IFERROR(MID(RC[-6],SEARCH("-5",RC[-6])+2,10),IFERROR(MID(RC[-6],SEARCH("-4",RC[-6])+2,10),IFERROR(MID(RC[-6],SEARCH("-3",RC[-6])+2,10),IFERROR(MID(RC[-6],SEARCH("-2",RC[-6])+2,10),IFERROR(MID(RC[-6],SEARCH("-1",RC[-6])+2,10),IFERROR(MID(RC[-6],SEARCH("-",RC[-6])+1,10),))))))))))) -> 基伦 | I53: ="1"&VLOOKUP(RC[-1],Sheet1!R2C2:R127C3,2,FALSE) -> 132402 | J53: 132402 | K53: =IFERROR(FIND(13,RC[-4],1),"") -> 13 | L53: =IF(RC[-1]="","",MID(RC[-5],RC[-1],6)) -> 132402 | M53: =SUBSTITUTE(RC[-6],RC[-1],RC[-3],1) -> "你们必将失败！"|3#1324024|1
A54: 17901 | B54: 无尽-女警 | D54: 1 | E54: =MID(RC[-4],1,3)&"|70" -> 179|70 | F54: 3|1 | G54: "怎么？你们在妄想些什么？"|3#1324204|1 | H54: =IFERROR(MID(RC[-6],SEARCH("-10",RC[-6])+3,10),IFERROR(MID(RC[-6],SEARCH("-9",RC[-6])+2,10),IFERROR(MID(RC[-6],SEARCH("-8",RC[-6])+2,10),IFERROR(MID(RC[-6],SEARCH("-7",RC[-6])+2,10),IFERROR(MID(RC[-6],SEARCH("-6",RC[-6])+2,10),IFERROR(MID(RC[-6],SEARCH("-5",RC[-6])+2,10),IFERROR(MID(RC[-6],SEARCH("-4",RC[-6])+2,10),IFERROR(MID(RC[-6],SEARCH("-3",RC[-6])+2,10),IFERROR(MID(RC[-6],SEARCH("-2",RC[-6])+2,10),IFERROR(MID(RC[-6],SEARCH("-1",RC[-6])+2,10),IFERROR(MID(RC[-6],SEARCH("-",RC[-6])+1,10),))))))))))) -> 女警 | I54: ="1"&VLOOKUP(RC[-1],Sheet1!R2C2:R127C3,2,FALSE) -> 132420 | J54: 132420 | K54: =IFERROR(FIND(13,RC[-4],1),"") -> 18 | L54: =IF(RC[-1]="","",MID(RC[-5],RC[-1],6)) -> 132420 | M54: =SUBSTITUTE(RC[-6],RC[-1],RC[-3],1) -> "怎么？你们在妄想些什么？"|3#1324204|1
A55: 18001 | B55: 无尽-小黑 | D55: 1 | E55: =MID(RC[-4],1,3)&"|70" -> 180|70 | F55: 3|1 | G55: "黑暗之弓，深渊之矢"|3#1324284|1 | H55: =IFERROR(MID(RC[-6],SEARCH("-10",RC[-6])+3,10),IFERROR(MID(RC[-6],SEARCH("-9",RC[-6])+2,10),IFERROR(MID(RC[-6],SEARCH("-8",RC[-6])+2,10),IFERROR(MID(RC[-6],SEARCH("-7",RC[-6])+2,10),IFERROR(MID(RC[-6],SEARCH("-6",RC[-6])+2,10),IFERROR(MID(RC[-6],SEARCH("-5",RC[-6])+2,10),IFERROR(MID(RC[-6],SEARCH("-4",RC[-6])+2,10),IFERROR(MID(RC[-6],SEARCH("-3",RC[-6])+2,10),IFERROR(MID(RC[-6],SEARCH("-2",RC[-6])+2,10),IFERROR(MID(RC[-6],SEARCH("-1",RC[-6])+2,10),IFERROR(MID(RC[-6],SEARCH("-",RC[-6])+1,10),))))))))))) -> 小黑 | I55: ="1"&VLOOKUP(RC[-1],Sheet1!R2C2:R127C3,2,FALSE) -> 132428 | J55: 132428 | K55: =IFERROR(FIND(13,RC[-4],1),"") -> 15 | L55: =IF(RC[-1]="","",MID(RC[-5],RC[-1],6)) -> 132428 | M55: =SUBSTITUTE(RC[-6],RC[-1],RC[-3],1) -> "黑暗之弓，深渊之矢"|3#1324284|1
A56: 18101 | B56: 无尽-熊阿宝 | D56: 1 | E56: =MID(RC[-4],1,3)&"|70" -> 181|70 | F56: 3|1 | G56: "醉生梦死最是省事"|3#1324124|1 | H56: =IFERROR(MID(RC[-6],SEARCH("-10",RC[-6])+3,10),IFERROR(MID(RC[-6],SEARCH("-9",RC[-6])+2,10),IFERROR(MID(RC[-6],SEARCH("-8",RC[-6])+2,10),IFERROR(MID(RC[-6],SEARCH("-7",RC[-6])+2,10),IFERROR(MID(RC[-6],SEARCH("-6",RC[-6])+2,10),IFERROR(MID(RC[-6],SEARCH("-5",RC[-6])+2,10),IFERROR(MID(RC[-6],SEARCH("-4",RC[-6])+2,10),IFERROR(MID(RC[-6],SEARCH("-3",RC[-6])+2,10),IFERROR(MID(RC[-6],SEARCH("-2",RC[-6])+2,10),IFERROR(MID(RC[-6],SEARCH("-1",RC[-6])+2,10),IFERROR(MID(RC[-6],SEARCH("-",RC[-6])+1,10),))))))))))) -> 熊阿宝 | I56: ="1"&VLOOKUP(RC[-1],Sheet1!R2C2:R127C3,2,FALSE) -> 132412 | J56: 132412 | K56: =IFERROR(FIND(13,RC[-4],1),"") -> 14 | L56: =IF(RC[-1]="","",MID(RC[-5],RC[-1],6)) -> 132412 | M56: =SUBSTITUTE(RC[-6],RC[-1],RC[-3],1) -> "醉生梦死最是省事"|3#1324124|1
A57: 18201 | B57: 无尽-血色指挥官 | D57: 1 | E57: =MID(RC[-4],1,3)&"|70" -> 182|70 | F57: 3|1 | G57: "所有光芒都将死亡"|3#1324084|1 | H57: =IFERROR(MID(RC[-6],SEARCH("-10",RC[-6])+3,10),IFERROR(MID(RC[-6],SEARCH("-9",RC[-6])+2,10),IFERROR(MID(RC[-6],SEARCH("-8",RC[-6])+2,10),IFERROR(MID(RC[-6],SEARCH("-7",RC[-6])+2,10),IFERROR(MID(RC[-6],SEARCH("-6",RC[-6])+2,10),IFERROR(MID(RC[-6],SEARCH("-5",RC[-6])+2,10),IFERROR(MID(RC[-6],SEARCH("-4",RC[-6])+2,10),IFERROR(MID(RC[-6],SEARCH("-3",RC[-6])+2,10),IFERROR(MID(RC[-6],SEARCH("-2",RC[-6])+2,10),IFERROR(MID(RC[-6],SEARCH("-1",RC[-6])+2,10),IFERROR(MID(RC[-6],SEARCH("-",RC[-6])+1,10),))))))))))) -> 血色指挥官 | I57: ="1"&VLOOKUP(RC[-1],Sheet1!R2C2:R127C3,2,FALSE) -> 132408 | J57: 132408 | K57: =IFERROR(FIND(13,RC[-4],1),"") -> 14 | L57: =IF(RC[-1]="","",MID(RC[-5],RC[-1],6)) -> 132408 | M57: =SUBSTITUTE(RC[-6],RC[-1],RC[-3],1) -> "所有光芒都将死亡"|3#1324084|1
A58: 18301 | B58: 无尽-大检察官 | D58: 1 | E58: =MID(RC[-4],1,3)&"|70" -> 183|70 | F58: 3|1 | G58: "深渊之光！"|3#1324404|1 | H58: =IFERROR(MID(RC[-6],SEARCH("-10",RC[-6])+3,10),IFERROR(MID(RC[-6],SEARCH("-9",RC[-6])+2,10),IFERROR(MID(RC[-6],SEARCH("-8",RC[-6])+2,10),IFERROR(MID(RC[-6],SEARCH("-7",RC[-6])+2,10),IFERROR(MID(RC[-6],SEARCH("-6",RC[-6])+2,10),IFERROR(MID(RC[-6],SEARCH("-5",RC[-6])+2,10),IFERROR(MID(RC[-6],SEARCH("-4",RC[-6])+2,10),IFERROR(MID(RC[-6],SEARCH("-3",RC[-6])+2,10),IFERROR(MID(RC[-6],SEARCH("-2",RC[-6])+2,10),IFERROR(MID(RC[-6],SEARCH("-1",RC[-6])+2,10),IFERROR(MID(RC[-6],SEARCH("-",RC[-6])+1,10),))))))))))) -> 大检察官 | I58: ="1"&VLOOKUP(RC[-1],Sheet1!R2C2:R127C3,2,FALSE) -> 132440 | J58: 132440 | K58: =IFERROR(FIND(13,RC[-4],1),"") -> 11 | L58: =IF(RC[-1]="","",MID(RC[-5],RC[-1],6)) -> 132440 | M58: =SUBSTITUTE(RC[-6],RC[-1],RC[-3],1) -> "深渊之光！"|3#1324404|1
A59: 18401 | B59: 无尽-恶魔猎手 | D59: 1 | E59: =MID(RC[-4],1,3)&"|70" -> 184|70 | F59: 3|1 | G59: "深渊的迷雾将吞噬你们"|3#1324094|1 | H59: =IFERROR(MID(RC[-6],SEARCH("-10",RC[-6])+3,10),IFERROR(MID(RC[-6],SEARCH("-9",RC[-6])+2,10),IFERROR(MID(RC[-6],SEARCH("-8",RC[-6])+2,10),IFERROR(MID(RC[-6],SEARCH("-7",RC[-6])+2,10),IFERROR(MID(RC[-6],SEARCH("-6",RC[-6])+2,10),IFERROR(MID(RC[-6],SEARCH("-5",RC[-6])+2,10),IFERROR(MID(RC[-6],SEARCH("-4",RC[-6])+2,10),IFERROR(MID(RC[-6],SEARCH("-3",RC[-6])+2,10),IFERROR(MID(RC[-6],SEARCH("-2",RC[-6])+2,10),IFERROR(MID(RC[-6],SEARCH("-1",RC[-6])+2,10),IFERROR(MID(RC[-6],SEARCH("-",RC[-6])+1,10),))))))))))) -> 恶魔猎手 | I59: ="1"&VLOOKUP(RC[-1],Sheet1!R2C2:R127C3,2,FALSE) -> 132409 | J59: 132409 | K59: =IFERROR(FIND(13,RC[-4],1),"") -> 16 | L59: =IF(RC[-1]="","",MID(RC[-5],RC[-1],6)) -> 132409 | M59: =SUBSTITUTE(RC[-6],RC[-1],RC[-3],1) -> "深渊的迷雾将吞噬你们"|3#1324094|1
A60: 18501 | B60: 无尽-神圣牧师 | D60: 1 | E60: =MID(RC[-4],1,3)&"|70" -> 185|70 | F60: 3|1 | G60: "这才是无穷无尽的——"|3#1324494|1 | H60: =IFERROR(MID(RC[-6],SEARCH("-10",RC[-6])+3,10),IFERROR(MID(RC[-6],SEARCH("-9",RC[-6])+2,10),IFERROR(MID(RC[-6],SEARCH("-8",RC[-6])+2,10),IFERROR(MID(RC[-6],SEARCH("-7",RC[-6])+2,10),IFERROR(MID(RC[-6],SEARCH("-6",RC[-6])+2,10),IFERROR(MID(RC[-6],SEARCH("-5",RC[-6])+2,10),IFERROR(MID(RC[-6],SEARCH("-4",RC[-6])+2,10),IFERROR(MID(RC[-6],SEARCH("-3",RC[-6])+2,10),IFERROR(MID(RC[-6],SEARCH("-2",RC[-6])+2,10),IFERROR(MID(RC[-6],SEARCH("-1",RC[-6])+2,10),IFERROR(MID(RC[-6],SEARCH("-",RC[-6])+1,10),))))))))))) -> 神圣牧师 | I60: ="1"&VLOOKUP(RC[-1],Sheet1!R2C2:R127C3,2,FALSE) -> 132449 | J60: 132449 | K60: =IFERROR(FIND(13,RC[-4],1),"") -> 16 | L60: =IF(RC[-1]="","",MID(RC[-5],RC[-1],6)) -> 132449 | M60: =SUBSTITUTE(RC[-6],RC[-1],RC[-3],1) -> "这才是无穷无尽的——"|3#1324494|1
A61: 19001 | B61: 无尽-四爪博士 | D61: 1 | E61: =MID(RC[-4],1,3)&"|70" -> 190|70 | F61: 3|1 | G61: "追寻的真理于此将止！"|3#1309994|1 | H61: =IFERROR(MID(RC[-6],SEARCH("-10",RC[-6])+3,10),IFERROR(MID(RC[-6],SEARCH("-9",RC[-6])+2,10),IFERROR(MID(RC[-6],SEARCH("-8",RC[-6])+2,10),IFERROR(MID(RC[-6],SEARCH("-7",RC[-6])+2,10),IFERROR(MID(RC[-6],SEARCH("-6",RC[-6])+2,10),IFERROR(MID(RC[-6],SEARCH("-5",RC[-6])+2,10),IFERROR(MID(RC[-6],SEARCH("-4",RC[-6])+2,10),IFERROR(MID(RC[-6],SEARCH("-3",RC[-6])+2,10),IFERROR(MID(RC[-6],SEARCH("-2",RC[-6])+2,10),IFERROR(MID(RC[-6],SEARCH("-1",RC[-6])+2,10),IFERROR(MID(RC[-6],SEARCH("-",RC[-6])+1,10),))))))))))) -> 四爪博士 | I61: ="1"&VLOOKUP(RC[-1],Sheet1!R2C2:R127C3,2,FALSE) -> 130999 | J61: 130999 | K61: =IFERROR(FIND(13,RC[-4],1),"") -> 16 | L61: =IF(RC[-1]="","",MID(RC[-5],RC[-1],6)) -> 130999 | M61: =SUBSTITUTE(RC[-6],RC[-1],RC[-3],1) -> "追寻的真理于此将止！"|3#1309994|1
A62: 19101 | B62: 无尽-红颅鬼 | D62: 1 | E62: =MID(RC[-4],1,3)&"|70" -> 191|70 | F62: 3|1 | G62: "随我到深渊里去吧！——"|3#1309984|1 | H62: =IFERROR(MID(RC[-6],SEARCH("-10",RC[-6])+3,10),IFERROR(MID(RC[-6],SEARCH("-9",RC[-6])+2,10),IFERROR(MID(RC[-6],SEARCH("-8",RC[-6])+2,10),IFERROR(MID(RC[-6],SEARCH("-7",RC[-6])+2,10),IFERROR(MID(RC[-6],SEARCH("-6",RC[-6])+2,10),IFERROR(MID(RC[-6],SEARCH("-5",RC[-6])+2,10),IFERROR(MID(RC[-6],SEARCH("-4",RC[-6])+2,10),IFERROR(MID(RC[-6],SEARCH("-3",RC[-6])+2,10),IFERROR(MID(RC[-6],SEARCH("-2",RC[-6])+2,10),IFERROR(MID(RC[-6],SEARCH("-1",RC[-6])+2,10),IFERROR(MID(RC[-6],SEARCH("-",RC[-6])+1,10),))))))))))) -> 红颅鬼 | I62: ="1"&VLOOKUP(RC[-1],Sheet1!R2C2:R127C3,2,FALSE) -> 130998 | J62: 130998 | K62: =IFERROR(FIND(13,RC[-4],1),"") -> 17 | L62: =IF(RC[-1]="","",MID(RC[-5],RC[-1],6)) -> 130998 | M62: =SUBSTITUTE(RC[-6],RC[-1],RC[-3],1) -> "随我到深渊里去吧！——"|3#1309984|1
A63: 19201 | B63: 无尽-独眼巨人 | D63: 1 | E63: =MID(RC[-4],1,3)&"|70" -> 192|70 | F63: 3|1 | G63: "你们也尝尝这滋味！"|3#1319994|1 | H63: =IFERROR(MID(RC[-6],SEARCH("-10",RC[-6])+3,10),IFERROR(MID(RC[-6],SEARCH("-9",RC[-6])+2,10),IFERROR(MID(RC[-6],SEARCH("-8",RC[-6])+2,10),IFERROR(MID(RC[-6],SEARCH("-7",RC[-6])+2,10),IFERROR(MID(RC[-6],SEARCH("-6",RC[-6])+2,10),IFERROR(MID(RC[-6],SEARCH("-5",RC[-6])+2,10),IFERROR(MID(RC[-6],SEARCH("-4",RC[-6])+2,10),IFERROR(MID(RC[-6],SEARCH("-3",RC[-6])+2,10),IFERROR(MID(RC[-6],SEARCH("-2",RC[-6])+2,10),IFERROR(MID(RC[-6],SEARCH("-1",RC[-6])+2,10),IFERROR(MID(RC[-6],SEARCH("-",RC[-6])+1,10),))))))))))) -> 独眼巨人 | I63: ="1"&VLOOKUP(RC[-1],Sheet1!R2C2:R127C3,2,FALSE) -> 131999 | J63: 131999 | K63: =IFERROR(FIND(13,RC[-4],1),"") -> 15 | L63: =IF(RC[-1]="","",MID(RC[-5],RC[-1],6)) -> 131999 | M63: =SUBSTITUTE(RC[-6],RC[-1],RC[-3],1) -> "你们也尝尝这滋味！"|3#1319994|1
A64: 19301 | B64: 无尽-憎恶 | D64: 1 | E64: =MID(RC[-4],1,3)&"|70" -> 193|70 | F64: 3|1 | G64: "美妙的血肉——"|3#1329994|1 | H64: =IFERROR(MID(RC[-6],SEARCH("-10",RC[-6])+3,10),IFERROR(MID(RC[-6],SEARCH("-9",RC[-6])+2,10),IFERROR(MID(RC[-6],SEARCH("-8",RC[-6])+2,10),IFERROR(MID(RC[-6],SEARCH("-7",RC[-6])+2,10),IFERROR(MID(RC[-6],SEARCH("-6",RC[-6])+2,10),IFERROR(MID(RC[-6],SEARCH("-5",RC[-6])+2,10),IFERROR(MID(RC[-6],SEARCH("-4",RC[-6])+2,10),IFERROR(MID(RC[-6],SEARCH("-3",RC[-6])+2,10),IFERROR(MID(RC[-6],SEARCH("-2",RC[-6])+2,10),IFERROR(MID(RC[-6],SEARCH("-1",RC[-6])+2,10),IFERROR(MID(RC[-6],SEARCH("-",RC[-6])+1,10),))))))))))) -> 憎恶 | I64: ="1"&VLOOKUP(RC[-1],Sheet1!R2C2:R127C3,2,FALSE) -> 132999 | J64: 132999 | K64: =IFERROR(FIND(13,RC[-4],1),"") -> 13 | L64: =IF(RC[-1]="","",MID(RC[-5],RC[-1],6)) -> 132999 | M64: =SUBSTITUTE(RC[-6],RC[-1],RC[-3],1) -> "美妙的血肉——"|3#1329994|1
A65: 19401 | B65: 无尽-大地泰坦 | D65: 1 | E65: =MID(RC[-4],1,3)&"|70" -> 194|70 | F65: 3|1 | G65: "随大地一起崩塌吧！"|3#1339994|1 | H65: =IFERROR(MID(RC[-6],SEARCH("-10",RC[-6])+3,10),IFERROR(MID(RC[-6],SEARCH("-9",RC[-6])+2,10),IFERROR(MID(RC[-6],SEARCH("-8",RC[-6])+2,10),IFERROR(MID(RC[-6],SEARCH("-7",RC[-6])+2,10),IFERROR(MID(RC[-6],SEARCH("-6",RC[-6])+2,10),IFERROR(MID(RC[-6],SEARCH("-5",RC[-6])+2,10),IFERROR(MID(RC[-6],SEARCH("-4",RC[-6])+2,10),IFERROR(MID(RC[-6],SEARCH("-3",RC[-6])+2,10),IFERROR(MID(RC[-6],SEARCH("-2",RC[-6])+2,10),IFERROR(MID(RC[-6],SEARCH("-1",RC[-6])+2,10),IFERROR(MID(RC[-6],SEARCH("-",RC[-6])+1,10),))))))))))) -> 大地泰坦 | I65: ="1"&VLOOKUP(RC[-1],Sheet1!R2C2:R127C3,2,FALSE) -> 133999 | J65: 133999 | K65: =IFERROR(FIND(13,RC[-4],1),"") -> 15 | L65: =IF(RC[-1]="","",MID(RC[-5],RC[-1],6)) -> 133999 | M65: =SUBSTITUTE(RC[-6],RC[-1],RC[-3],1) -> "随大地一起崩塌吧！"|3#1339994|1
A66: 19501 | B66: 无尽-战争主宰 | D66: 1 | E66: =MID(RC[-4],1,3)&"|70" -> 195|70 | F66: 3|1 | G66: "你们的失败已经注定——"|3#1339984|1 | H66: =IFERROR(MID(RC[-6],SEARCH("-10",RC[-6])+3,10),IFERROR(MID(RC[-6],SEARCH("-9",RC[-6])+2,10),IFERROR(MID(RC[-6],SEARCH("-8",RC[-6])+2,10),IFERROR(MID(RC[-6],SEARCH("-7",RC[-6])+2,10),IFERROR(MID(RC[-6],SEARCH("-6",RC[-6])+2,10),IFERROR(MID(RC[-6],SEARCH("-5",RC[-6])+2,10),IFERROR(MID(RC[-6],SEARCH("-4",RC[-6])+2,10),IFERROR(MID(RC[-6],SEARCH("-3",RC[-6])+2,10),IFERROR(MID(RC[-6],SEARCH("-2",RC[-6])+2,10),IFERROR(MID(RC[-6],SEARCH("-1",RC[-6])+2,10),IFERROR(MID(RC[-6],SEARCH("-",RC[-6])+1,10),))))))))))) -> 战争主宰 | I66: ="1"&VLOOKUP(RC[-1],Sheet1!R2C2:R127C3,2,FALSE) -> 133998 | J66: 133998 | K66: =IFERROR(FIND(13,RC[-4],1),"") -> 17 | L66: =IF(RC[-1]="","",MID(RC[-5],RC[-1],6)) -> 133998 | M66: =SUBSTITUTE(RC[-6],RC[-1],RC[-3],1) -> "你们的失败已经注定——"|3#1339984|1
A67: 11002 | B67: 无尽-超级队长 | D67: 1 | E67: =MID(RC[-4],1,3)&"|30" -> 110|30 | F67: 3|1 | G67: "没有尽头，没有胜利，也没有希望……"|3#1303014|1 | H67: =IFERROR(MID(RC[-6],SEARCH("-10",RC[-6])+3,10),IFERROR(MID(RC[-6],SEARCH("-9",RC[-6])+2,10),IFERROR(MID(RC[-6],SEARCH("-8",RC[-6])+2,10),IFERROR(MID(RC[-6],SEARCH("-7",RC[-6])+2,10),IFERROR(MID(RC[-6],SEARCH("-6",RC[-6])+2,10),IFERROR(MID(RC[-6],SEARCH("-5",RC[-6])+2,10),IFERROR(MID(RC[-6],SEARCH("-4",RC[-6])+2,10),IFERROR(MID(RC[-6],SEARCH("-3",RC[-6])+2,10),IFERROR(MID(RC[-6],SEARCH("-2",RC[-6])+2,10),IFERROR(MID(RC[-6],SEARCH("-1",RC[-6])+2,10),IFERROR(MID(RC[-6],SEARCH("-",RC[-6])+1,10),))))))))))) -> 超级队长 | I67: ="1"&VLOOKUP(RC[-1],Sheet1!R2C2:R127C3,2,FALSE) -> 130301 | J67: 130301 | K67: =IFERROR(FIND(13,RC[-4],1),"") -> 23 | L67: =IF(RC[-1]="","",MID(RC[-5],RC[-1],6)) -> 130301 | M67: =SUBSTITUTE(RC[-6],RC[-1],RC[-3],1) -> "没有尽头，没有胜利，也没有希望……"|3#1303014|1
A68: 11102 | B68: 无尽-死亡武士 | D68: 1 | E68: =MID(RC[-4],1,3)&"|30" -> 111|30 | F68: 3|1 | G68: "奔赴死亡的深渊吧"|3#1303024|1 | H68: =IFERROR(MID(RC[-6],SEARCH("-10",RC[-6])+3,10),IFERROR(MID(RC[-6],SEARCH("-9",RC[-6])+2,10),IFERROR(MID(RC[-6],SEARCH("-8",RC[-6])+2,10),IFERROR(MID(RC[-6],SEARCH("-7",RC[-6])+2,10),IFERROR(MID(RC[-6],SEARCH("-6",RC[-6])+2,10),IFERROR(MID(RC[-6],SEARCH("-5",RC[-6])+2,10),IFERROR(MID(RC[-6],SEARCH("-4",RC[-6])+2,10),IFERROR(MID(RC[-6],SEARCH("-3",RC[-6])+2,10),IFERROR(MID(RC[-6],SEARCH("-2",RC[-6])+2,10),IFERROR(MID(RC[-6],SEARCH("-1",RC[-6])+2,10),IFERROR(MID(RC[-6],SEARCH("-",RC[-6])+1,10),))))))))))) -> 死亡武士 | I68: ="1"&VLOOKUP(RC[-1],Sheet1!R2C2:R127C3,2,FALSE) -> 130302 | J68: 130302 | K68: =IFERROR(FIND(13,RC[-4],1),"") -> 14 | L68: =IF(RC[-1]="","",MID(RC[-5],RC[-1],6)) -> 130302 | M68: =SUBSTITUTE(RC[-6],RC[-1],RC[-3],1) -> "奔赴死亡的深渊吧"|3#1303024|1
A69: 11202 | B69: 无尽-红头魔 | D69: 1 | E69: =MID(RC[-4],1,3)&"|30" -> 112|30 | F69: 3|1 | G69: "随我到深渊里去吧！——"|3#1304304|1 | H69: =IFERROR(MID(RC[-6],SEARCH("-10",RC[-6])+3,10),IFERROR(MID(RC[-6],SEARCH("-9",RC[-6])+2,10),IFERROR(MID(RC[-6],SEARCH("-8",RC[-6])+2,10),IFERROR(MID(RC[-6],SEARCH("-7",RC[-6])+2,10),IFERROR(MID(RC[-6],SEARCH("-6",RC[-6])+2,10),IFERROR(MID(RC[-6],SEARCH("-5",RC[-6])+2,10),IFERROR(MID(RC[-6],SEARCH("-4",RC[-6])+2,10),IFERROR(MID(RC[-6],SEARCH("-3",RC[-6])+2,10),IFERROR(MID(RC[-6],SEARCH("-2",RC[-6])+2,10),IFERROR(MID(RC[-6],SEARCH("-1",RC[-6])+2,10),IFERROR(MID(RC[-6],SEARCH("-",RC[-6])+1,10),))))))))))) -> 红头魔 | I69: ="1"&VLOOKUP(RC[-1],Sheet1!R2C2:R127C3,2,FALSE) -> 130430 | J69: 130430 | K69: =IFERROR(FIND(13,RC[-4],1),"") -> 17 | L69: =IF(RC[-1]="","",MID(RC[-5],RC[-1],6)) -> 130430 | M69: =SUBSTITUTE(RC[-6],RC[-1],RC[-3],1) -> "随我到深渊里去吧！——"|3#1304304|1
A70: 11302 | B70: 无尽-终极队长 | D70: 1 | E70: =MID(RC[-4],1,3)&"|30" -> 113|30 | F70: 3|1 | G70: "没有希望……"|3#1304004|1 | H70: =IFERROR(MID(RC[-6],SEARCH("-10",RC[-6])+3,10),IFERROR(MID(RC[-6],SEARCH("-9",RC[-6])+2,10),IFERROR(MID(RC[-6],SEARCH("-8",RC[-6])+2,10),IFERROR(MID(RC[-6],SEARCH("-7",RC[-6])+2,10),IFERROR(MID(RC[-6],SEARCH("-6",RC[-6])+2,10),IFERROR(MID(RC[-6],SEARCH("-5",RC[-6])+2,10),IFERROR(MID(RC[-6],SEARCH("-4",RC[-6])+2,10),IFERROR(MID(RC[-6],SEARCH("-3",RC[-6])+2,10),IFERROR(MID(RC[-6],SEARCH("-2",RC[-6])+2,10),IFERROR(MID(RC[-6],SEARCH("-1",RC[-6])+2,10),IFERROR(MID(RC[-6],SEARCH("-",RC[-6])+1,10),))))))))))) -> 终极队长 | I70: ="1"&VLOOKUP(RC[-1],Sheet1!R2C2:R127C3,2,FALSE) -> 130400 | J70: 130400 | K70: =IFERROR(FIND(13,RC[-4],1),"") -> 12 | L70: =IF(RC[-1]="","",MID(RC[-5],RC[-1],6)) -> 130400 | M70: =SUBSTITUTE(RC[-6],RC[-1],RC[-3],1) -> "没有希望……"|3#1304004|1
A71: 11402 | B71: 无尽-雷神 | D71: 1 | E71: =MID(RC[-4],1,3)&"|30" -> 114|30 | F71: 3|1 | G71: "雷霆啊，驱散它们！"|3#1304314|1 | H71: =IFERROR(MID(RC[-6],SEARCH("-10",RC[-6])+3,10),IFERROR(MID(RC[-6],SEARCH("-9",RC[-6])+2,10),IFERROR(MID(RC[-6],SEARCH("-8",RC[-6])+2,10),IFERROR(MID(RC[-6],SEARCH("-7",RC[-6])+2,10),IFERROR(MID(RC[-6],SEARCH("-6",RC[-6])+2,10),IFERROR(MID(RC[-6],SEARCH("-5",RC[-6])+2,10),IFERROR(MID(RC[-6],SEARCH("-4",RC[-6])+2,10),IFERROR(MID(RC[-6],SEARCH("-3",RC[-6])+2,10),IFERROR(MID(RC[-6],SEARCH("-2",RC[-6])+2,10),IFERROR(MID(RC[-6],SEARCH("-1",RC[-6])+2,10),IFERROR(MID(RC[-6],SEARCH("-",RC[-6])+1,10),))))))))))) -> 雷神 | I71: ="1"&VLOOKUP(RC[-1],Sheet1!R2C2:R127C3,2,FALSE) -> 130431 | J71: 130431 | K71: =IFERROR(FIND(13,RC[-4],1),"") -> 15 | L71: =IF(RC[-1]="","",MID(RC[-5],RC[-1],6)) -> 130431 | M71: =SUBSTITUTE(RC[-6],RC[-1],RC[-3],1) -> "雷霆啊，驱散它们！"|3#1304314|1
A72: 11502 | B72: 无尽-野蛮巨人 | D72: 1 | E72: =MID(RC[-4],1,3)&"|30" -> 115|30 | F72: 3|1 | G72: "通通粉碎掉吧！"|3#1304104|1 | H72: =IFERROR(MID(RC[-6],SEARCH("-10",RC[-6])+3,10),IFERROR(MID(RC[-6],SEARCH("-9",RC[-6])+2,10),IFERROR(MID(RC[-6],SEARCH("-8",RC[-6])+2,10),IFERROR(MID(RC[-6],SEARCH("-7",RC[-6])+2,10),IFERROR(MID(RC[-6],SEARCH("-6",RC[-6])+2,10),IFERROR(MID(RC[-6],SEARCH("-5",RC[-6])+2,10),IFERROR(MID(RC[-6],SEARCH("-4",RC[-6])+2,10),IFERROR(MID(RC[-6],SEARCH("-3",RC[-6])+2,10),IFERROR(MID(RC[-6],SEARCH("-2",RC[-6])+2,10),IFERROR(MID(RC[-6],SEARCH("-1",RC[-6])+2,10),IFERROR(MID(RC[-6],SEARCH("-",RC[-6])+1,10),))))))))))) -> 野蛮巨人 | I72: ="1"&VLOOKUP(RC[-1],Sheet1!R2C2:R127C3,2,FALSE) -> 130410 | J72: 130410 | K72: =IFERROR(FIND(13,RC[-4],1),"") -> 13 | L72: =IF(RC[-1]="","",MID(RC[-5],RC[-1],6)) -> 130410 | M72: =SUBSTITUTE(RC[-6],RC[-1],RC[-3],1) -> "通通粉碎掉吧！"|3#1304104|1
A73: 11602 | B73: 无尽-致命特工 | D73: 1 | E73: =MID(RC[-4],1,3)&"|30" -> 116|30 | F73: 3|1 | G73: "无穷无尽……"|3#1304014|1 | H73: =IFERROR(MID(RC[-6],SEARCH("-10",RC[-6])+3,10),IFERROR(MID(RC[-6],SEARCH("-9",RC[-6])+2,10),IFERROR(MID(RC[-6],SEARCH("-8",RC[-6])+2,10),IFERROR(MID(RC[-6],SEARCH("-7",RC[-6])+2,10),IFERROR(MID(RC[-6],SEARCH("-6",RC[-6])+2,10),IFERROR(MID(RC[-6],SEARCH("-5",RC[-6])+2,10),IFERROR(MID(RC[-6],SEARCH("-4",RC[-6])+2,10),IFERROR(MID(RC[-6],SEARCH("-3",RC[-6])+2,10),IFERROR(MID(RC[-6],SEARCH("-2",RC[-6])+2,10),IFERROR(MID(RC[-6],SEARCH("-1",RC[-6])+2,10),IFERROR(MID(RC[-6],SEARCH("-",RC[-6])+1,10),))))))))))) -> 致命特工 | I73: ="1"&VLOOKUP(RC[-1],Sheet1!R2C2:R127C3,2,FALSE) -> 130401 | J73: 130401 | K73: =IFERROR(FIND(13,RC[-4],1),"") -> 12 | L73: =IF(RC[-1]="","",MID(RC[-5],RC[-1],6)) -> 130401 | M73: =SUBSTITUTE(RC[-6],RC[-1],RC[-3],1) -> "无穷无尽……"|3#1304014|1
A74: 11702 | B74: 无尽-鹰眸 | D74: 1 | E74: =MID(RC[-4],1,3)&"|30" -> 117|30 | F74: 3|1 | G74: "这是来自目不可及之处的箭矢！"|3#1304204|1 | H74: =IFERROR(MID(RC[-6],SEARCH("-10",RC[-6])+3,10),IFERROR(MID(RC[-6],SEARCH("-9",RC[-6])+2,10),IFERROR(MID(RC[-6],SEARCH("-8",RC[-6])+2,10),IFERROR(MID(RC[-6],SEARCH("-7",RC[-6])+2,10),IFERROR(MID(RC[-6],SEARCH("-6",RC[-6])+2,10),IFERROR(MID(RC[-6],SEARCH("-5",RC[-6])+2,10),IFERROR(MID(RC[-6],SEARCH("-4",RC[-6])+2,10),IFERROR(MID(RC[-6],SEARCH("-3",RC[-6])+2,10),IFERROR(MID(RC[-6],SEARCH("-2",RC[-6])+2,10),IFERROR(MID(RC[-6],SEARCH("-1",RC[-6])+2,10),IFERROR(MID(RC[-6],SEARCH("-",RC[-6])+1,10),))))))))))) -> 鹰眸 | I74: ="1"&VLOOKUP(RC[-1],Sheet1!R2C2:R127C3,2,FALSE) -> 130420 | J74: 130420 | K74: =IFERROR(FIND(13,RC[-4],1),"") -> 20 | L74: =IF(RC[-1]="","",MID(RC[-5],RC[-1],6)) -> 130420 | M74: =SUBSTITUTE(RC[-6],RC[-1],RC[-3],1) -> "这是来自目不可及之处的箭矢！"|3#1304204|1
A75: 11802 | B75: 无尽-刀锋猎人 | D75: 1 | E75: =MID(RC[-4],1,3)&"|30" -> 118|30 | F75: 3|1 | G75: "杀之不尽"|3#1304024|1 | H75: =IFERROR(MID(RC[-6],SEARCH("-10",RC[-6])+3,10),IFERROR(MID(RC[-6],SEARCH("-9",RC[-6])+2,10),IFERROR(MID(RC[-6],SEARCH("-8",RC[-6])+2,10),IFERROR(MID(RC[-6],SEARCH("-7",RC[-6])+2,10),IFERROR(MID(RC[-6],SEARCH("-6",RC[-6])+2,10),IFERROR(MID(RC[-6],SEARCH("-5",RC[-6])+2,10),IFERROR(MID(RC[-6],SEARCH("-4",RC[-6])+2,10),IFERROR(MID(RC[-6],SEARCH("-3",RC[-6])+2,10),IFERROR(MID(RC[-6],SEARCH("-2",RC[-6])+2,10),IFERROR(MID(RC[-6],SEARCH("-1",RC[-6])+2,10),IFERROR(MID(RC[-6],SEARCH("-",RC[-6])+1,10),))))))))))) -> 刀锋猎人 | I75: ="1"&VLOOKUP(RC[-1],Sheet1!R2C2:R127C3,2,FALSE) -> 130402 | J75: 130402 | K75: =IFERROR(FIND(13,RC[-4],1),"") -> 10 | L75: =IF(RC[-1]="","",MID(RC[-5],RC[-1],6)) -> 130402 | M75: =SUBSTITUTE(RC[-6],RC[-1],RC[-3],1) -> "杀之不尽"|3#1304024|1
A76: 11902 | B76: 无尽-地狱骑士 | D76: 1 | E76: =MID(RC[-4],1,3)&"|30" -> 119|30 | F76: 3|1 | G76: "这才是真正的地狱！"|3#1304034|1 | H76: =IFERROR(MID(RC[-6],SEARCH("-10",RC[-6])+3,10),IFERROR(MID(RC[-6],SEARCH("-9",RC[-6])+2,10),IFERROR(MID(RC[-6],SEARCH("-8",RC[-6])+2,10),IFERROR(MID(RC[-6],SEARCH("-7",RC[-6])+2,10),IFERROR(MID(RC[-6],SEARCH("-6",RC[-6])+2,10),IFERROR(MID(RC[-6],SEARCH("-5",RC[-6])+2,10),IFERROR(MID(RC[-6],SEARCH("-4",RC[-6])+2,10),IFERROR(MID(RC[-6],SEARCH("-3",RC[-6])+2,10),IFERROR(MID(RC[-6],SEARCH("-2",RC[-6])+2,10),IFERROR(MID(RC[-6],SEARCH("-1",RC[-6])+2,10),IFERROR(MID(RC[-6],SEARCH("-",RC[-6])+1,10),))))))))))) -> 地狱骑士 | I76: ="1"&VLOOKUP(RC[-1],Sheet1!R2C2:R127C3,2,FALSE) -> 130403 | J76: 130403 | K76: =IFERROR(FIND(13,RC[-4],1),"") -> 15 | L76: =IF(RC[-1]="","",MID(RC[-5],RC[-1],6)) -> 130403 | M76: =SUBSTITUTE(RC[-6],RC[-1],RC[-3],1) -> "这才是真正的地狱！"|3#1304034|1
A77: 12002 | B77: 无尽-铁人 | D77: 1 | E77: =MID(RC[-4],1,3)&"|30" -> 120|30 | F77: 3|1 | G77: "在这里，真理的轨迹异常明确……"|3#1304284|1 | H77: =IFERROR(MID(RC[-6],SEARCH("-10",RC[-6])+3,10),IFERROR(MID(RC[-6],SEARCH("-9",RC[-6])+2,10),IFERROR(MID(RC[-6],SEARCH("-8",RC[-6])+2,10),IFERROR(MID(RC[-6],SEARCH("-7",RC[-6])+2,10),IFERROR(MID(RC[-6],SEARCH("-6",RC[-6])+2,10),IFERROR(MID(RC[-6],SEARCH("-5",RC[-6])+2,10),IFERROR(MID(RC[-6],SEARCH("-4",RC[-6])+2,10),IFERROR(MID(RC[-6],SEARCH("-3",RC[-6])+2,10),IFERROR(MID(RC[-6],SEARCH("-2",RC[-6])+2,10),IFERROR(MID(RC[-6],SEARCH("-1",RC[-6])+2,10),IFERROR(MID(RC[-6],SEARCH("-",RC[-6])+1,10),))))))))))) -> 铁人 | I77: ="1"&VLOOKUP(RC[-1],Sheet1!R2C2:R127C3,2,FALSE) -> 130428 | J77: 130428 | K77: =IFERROR(FIND(13,RC[-4],1),"") -> 21 | L77: =IF(RC[-1]="","",MID(RC[-5],RC[-1],6)) -> 130428 | M77: =SUBSTITUTE(RC[-6],RC[-1],RC[-3],1) -> "在这里，真理的轨迹异常明确……"|3#1304284|1
A78: 12102 | B78: 无尽-树人 | D78: 1 | E78: =MID(RC[-4],1,3)&"|30" -> 121|30 | F78: 3|1 | G78: "吼——"|3#1304114|1 | H78: =IFERROR(MID(RC[-6],SEARCH("-10",RC[-6])+3,10),IFERROR(MID(RC[-6],SEARCH("-9",RC[-6])+2,10),IFERROR(MID(RC[-6],SEARCH("-8",RC[-6])+2,10),IFERROR(MID(RC[-6],SEARCH("-7",RC[-6])+2,10),IFERROR(MID(RC[-6],SEARCH("-6",RC[-6])+2,10),IFERROR(MID(RC[-6],SEARCH("-5",RC[-6])+2,10),IFERROR(MID(RC[-6],SEARCH("-4",RC[-6])+2,10),IFERROR(MID(RC[-6],SEARCH("-3",RC[-6])+2,10),IFERROR(MID(RC[-6],SEARCH("-2",RC[-6])+2,10),IFERROR(MID(RC[-6],SEARCH("-1",RC[-6])+2,10),IFERROR(MID(RC[-6],SEARCH("-",RC[-6])+1,10),))))))))))) -> 树人 | I78: ="1"&VLOOKUP(RC[-1],Sheet1!R2C2:R127C3,2,FALSE) -> 130411 | J78: 130411 | K78: =IFERROR(FIND(13,RC[-4],1),"") -> 9 | L78: =IF(RC[-1]="","",MID(RC[-5],RC[-1],6)) -> 130411 | M78: =SUBSTITUTE(RC[-6],RC[-1],RC[-3],1) -> "吼——"|3#1304114|1
A79: 12202 | B79: 无尽-超凡博士 | D79: 1 | E79: =MID(RC[-4],1,3)&"|30" -> 122|30 | F79: 3|1 | G79: "深渊的魔法……"|3#1304384|1 | H79: =IFERROR(MID(RC[-6],SEARCH("-10",RC[-6])+3,10),IFERROR(MID(RC[-6],SEARCH("-9",RC[-6])+2,10),IFERROR(MID(RC[-6],SEARCH("-8",RC[-6])+2,10),IFERROR(MID(RC[-6],SEARCH("-7",RC[-6])+2,10),IFERROR(MID(RC[-6],SEARCH("-6",RC[-6])+2,10),IFERROR(MID(RC[-6],SEARCH("-5",RC[-6])+2,10),IFERROR(MID(RC[-6],SEARCH("-4",RC[-6])+2,10),IFERROR(MID(RC[-6],SEARCH("-3",RC[-6])+2,10),IFERROR(MID(RC[-6],SEARCH("-2",RC[-6])+2,10),IFERROR(MID(RC[-6],SEARCH("-1",RC[-6])+2,10),IFERROR(MID(RC[-6],SEARCH("-",RC[-6])+1,10),))))))))))) -> 超凡博士 | I79: ="1"&VLOOKUP(RC[-1],Sheet1!R2C2:R127C3,2,FALSE) -> 130438 | J79: 130438 | K79: =IFERROR(FIND(13,RC[-4],1),"") -> 13 | L79: =IF(RC[-1]="","",MID(RC[-5],RC[-1],6)) -> 130438 | M79: =SUBSTITUTE(RC[-6],RC[-1],RC[-3],1) -> "深渊的魔法……"|3#1304384|1
A80: 12302 | B80: 无尽-白凤凰 | D80: 1 | E80: =MID(RC[-4],1,3)&"|30" -> 123|30 | F80: 3|1 | G80: "我感受到了无尽的苦痛"|3#1304404|1 | H80: =IFERROR(MID(RC[-6],SEARCH("-10",RC[-6])+3,10),IFERROR(MID(RC[-6],SEARCH("-9",RC[-6])+2,10),IFERROR(MID(RC[-6],SEARCH("-8",RC[-6])+2,10),IFERROR(MID(RC[-6],SEARCH("-7",RC[-6])+2,10),IFERROR(MID(RC[-6],SEARCH("-6",RC[-6])+2,10),IFERROR(MID(RC[-6],SEARCH("-5",RC[-6])+2,10),IFERROR(MID(RC[-6],SEARCH("-4",RC[-6])+2,10),IFERROR(MID(RC[-6],SEARCH("-3",RC[-6])+2,10),IFERROR(MID(RC[-6],SEARCH("-2",RC[-6])+2,10),IFERROR(MID(RC[-6],SEARCH("-1",RC[-6])+2,10),IFERROR(MID(RC[-6],SEARCH("-",RC[-6])+1,10),))))))))))) -> 白凤凰 | I80: ="1"&VLOOKUP(RC[-1],Sheet1!R2C2:R127C3,2,FALSE) -> 130440 | J80: 130440 | K80: =IFERROR(FIND(13,RC[-4],1),"") -> 16 | L80: =IF(RC[-1]="","",MID(RC[-5],RC[-1],6)) -> 130440 | M80: =SUBSTITUTE(RC[-6],RC[-1],RC[-3],1) -> "我感受到了无尽的苦痛"|3#1304404|1
A81: 12402 | B81: 无尽-地狱铁拳 | D81: 1 | E81: =MID(RC[-4],1,3)&"|30" -> 124|30 | F81: 3|1 | G81: "你们打开了地狱之门——"|3#1304294|1 | H81: =IFERROR(MID(RC[-6],SEARCH("-10",RC[-6])+3,10),IFERROR(MID(RC[-6],SEARCH("-9",RC[-6])+2,10),IFERROR(MID(RC[-6],SEARCH("-8",RC[-6])+2,10),IFERROR(MID(RC[-6],SEARCH("-7",RC[-6])+2,10),IFERROR(MID(RC[-6],SEARCH("-6",RC[-6])+2,10),IFERROR(MID(RC[-6],SEARCH("-5",RC[-6])+2,10),IFERROR(MID(RC[-6],SEARCH("-4",RC[-6])+2,10),IFERROR(MID(RC[-6],SEARCH("-3",RC[-6])+2,10),IFERROR(MID(RC[-6],SEARCH("-2",RC[-6])+2,10),IFERROR(MID(RC[-6],SEARCH("-1",RC[-6])+2,10),IFERROR(MID(RC[-6],SEARCH("-",RC[-6])+1,10),))))))))))) -> 地狱铁拳 | I81: ="1"&VLOOKUP(RC[-1],Sheet1!R2C2:R127C3,2,FALSE) -> 130429 | J81: 130429 | K81: =IFERROR(FIND(13,RC[-4],1),"") -> 17 | L81: =IF(RC[-1]="","",MID(RC[-5],RC[-1],6)) -> 130429 | M81: =SUBSTITUTE(RC[-6],RC[-1],RC[-3],1) -> "你们打开了地狱之门——"|3#1304294|1
A82: 12502 | B82: 无尽-混沌女巫 | D82: 1 | E82: =MID(RC[-4],1,3)&"|30" -> 125|30 | F82: 3|1 | G82: "堕落也是混沌的一部分"|3#1304494|1 | H82: =IFERROR(MID(RC[-6],SEARCH("-10",RC[-6])+3,10),IFERROR(MID(RC[-6],SEARCH("-9",RC[-6])+2,10),IFERROR(MID(RC[-6],SEARCH("-8",RC[-6])+2,10),IFERROR(MID(RC[-6],SEARCH("-7",RC[-6])+2,10),IFERROR(MID(RC[-6],SEARCH("-6",RC[-6])+2,10),IFERROR(MID(RC[-6],SEARCH("-5",RC[-6])+2,10),IFERROR(MID(RC[-6],SEARCH("-4",RC[-6])+2,10),IFERROR(MID(RC[-6],SEARCH("-3",RC[-6])+2,10),IFERROR(MID(RC[-6],SEARCH("-2",RC[-6])+2,10),IFERROR(MID(RC[-6],SEARCH("-1",RC[-6])+2,10),IFERROR(MID(RC[-6],SEARCH("-",RC[-6])+1,10),))))))))))) -> 混沌女巫 | I82: ="1"&VLOOKUP(RC[-1],Sheet1!R2C2:R127C3,2,FALSE) -> 130449 | J82: 130449 | K82: =IFERROR(FIND(13,RC[-4],1),"") -> 16 | L82: =IF(RC[-1]="","",MID(RC[-5],RC[-1],6)) -> 130449 | M82: =SUBSTITUTE(RC[-6],RC[-1],RC[-3],1) -> "堕落也是混沌的一部分"|3#1304494|1
A83: 14002 | B83: 无尽-杰克船长 | D83: 1 | E83: =MID(RC[-4],1,3)&"|30" -> 140|30 | F83: 3|1 | G83: "无尽的炮火与厮杀！"|3#1313014|1 | H83: =IFERROR(MID(RC[-6],SEARCH("-10",RC[-6])+3,10),IFERROR(MID(RC[-6],SEARCH("-9",RC[-6])+2,10),IFERROR(MID(RC[-6],SEARCH("-8",RC[-6])+2,10),IFERROR(MID(RC[-6],SEARCH("-7",RC[-6])+2,10),IFERROR(MID(RC[-6],SEARCH("-6",RC[-6])+2,10),IFERROR(MID(RC[-6],SEARCH("-5",RC[-6])+2,10),IFERROR(MID(RC[-6],SEARCH("-4",RC[-6])+2,10),IFERROR(MID(RC[-6],SEARCH("-3",RC[-6])+2,10),IFERROR(MID(RC[-6],SEARCH("-2",RC[-6])+2,10),IFERROR(MID(RC[-6],SEARCH("-1",RC[-6])+2,10),IFERROR(MID(RC[-6],SEARCH("-",RC[-6])+1,10),))))))))))) -> 杰克船长 | I83: ="1"&VLOOKUP(RC[-1],Sheet1!R2C2:R127C3,2,FALSE) -> 131301 | J83: 131301 | K83: =IFERROR(FIND(13,RC[-4],1),"") -> 15 | L83: =IF(RC[-1]="","",MID(RC[-5],RC[-1],6)) -> 131301 | M83: =SUBSTITUTE(RC[-6],RC[-1],RC[-3],1) -> "无尽的炮火与厮杀！"|3#1313014|1
A84: 14102 | B84: 无尽-天使长 | D84: 1 | E84: =MID(RC[-4],1,3)&"|30" -> 141|30 | F84: 3|1 | G84: "光辉源于黑暗"|3#1313414|1 | H84: =IFERROR(MID(RC[-6],SEARCH("-10",RC[-6])+3,10),IFERROR(MID(RC[-6],SEARCH("-9",RC[-6])+2,10),IFERROR(MID(RC[-6],SEARCH("-8",RC[-6])+2,10),IFERROR(MID(RC[-6],SEARCH("-7",RC[-6])+2,10),IFERROR(MID(RC[-6],SEARCH("-6",RC[-6])+2,10),IFERROR(MID(RC[-6],SEARCH("-5",RC[-6])+2,10),IFERROR(MID(RC[-6],SEARCH("-4",RC[-6])+2,10),IFERROR(MID(RC[-6],SEARCH("-3",RC[-6])+2,10),IFERROR(MID(RC[-6],SEARCH("-2",RC[-6])+2,10),IFERROR(MID(RC[-6],SEARCH("-1",RC[-6])+2,10),IFERROR(MID(RC[-6],SEARCH("-",RC[-6])+1,10),))))))))))) -> 天使长 | I84: ="1"&VLOOKUP(RC[-1],Sheet1!R2C2:R127C3,2,FALSE) -> 131341 | J84: 131341 | K84: =IFERROR(FIND(13,RC[-4],1),"") -> 12 | L84: =IF(RC[-1]="","",MID(RC[-5],RC[-1],6)) -> 131341 | M84: =SUBSTITUTE(RC[-6],RC[-1],RC[-3],1) -> "光辉源于黑暗"|3#1313414|1
A85: 14202 | B85: 无尽-独眼野蛮人 | D85: 1 | E85: =MID(RC[-4],1,3)&"|30" -> 142|30 | F85: 3|1 | G85: "你们也尝尝这滋味！"|3#1314004|1 | H85: =IFERROR(MID(RC[-6],SEARCH("-10",RC[-6])+3,10),IFERROR(MID(RC[-6],SEARCH("-9",RC[-6])+2,10),IFERROR(MID(RC[-6],SEARCH("-8",RC[-6])+2,10),IFERROR(MID(RC[-6],SEARCH("-7",RC[-6])+2,10),IFERROR(MID(RC[-6],SEARCH("-6",RC[-6])+2,10),IFERROR(MID(RC[-6],SEARCH("-5",RC[-6])+2,10),IFERROR(MID(RC[-6],SEARCH("-4",RC[-6])+2,10),IFERROR(MID(RC[-6],SEARCH("-3",RC[-6])+2,10),IFERROR(MID(RC[-6],SEARCH("-2",RC[-6])+2,10),IFERROR(MID(RC[-6],SEARCH("-1",RC[-6])+2,10),IFERROR(MID(RC[-6],SEARCH("-",RC[-6])+1,10),))))))))))) -> 独眼野蛮人 | I85: ="1"&VLOOKUP(RC[-1],Sheet1!R2C2:R127C3,2,FALSE) -> 131400 | J85: 131400 | K85: =IFERROR(FIND(13,RC[-4],1),"") -> 15 | L85: =IF(RC[-1]="","",MID(RC[-5],RC[-1],6)) -> 131400 | M85: =SUBSTITUTE(RC[-6],RC[-1],RC[-3],1) -> "你们也尝尝这滋味！"|3#1314004|1
A86: 14302 | B86: 无尽-圣女贞德 | D86: 1 | E86: =MID(RC[-4],1,3)&"|30" -> 143|30 | F86: 3|1 | G86: "信仰堕落吧"|3#1314404|1 | H86: =IFERROR(MID(RC[-6],SEARCH("-10",RC[-6])+3,10),IFERROR(MID(RC[-6],SEARCH("-9",RC[-6])+2,10),IFERROR(MID(RC[-6],SEARCH("-8",RC[-6])+2,10),IFERROR(MID(RC[-6],SEARCH("-7",RC[-6])+2,10),IFERROR(MID(RC[-6],SEARCH("-6",RC[-6])+2,10),IFERROR(MID(RC[-6],SEARCH("-5",RC[-6])+2,10),IFERROR(MID(RC[-6],SEARCH("-4",RC[-6])+2,10),IFERROR(MID(RC[-6],SEARCH("-3",RC[-6])+2,10),IFERROR(MID(RC[-6],SEARCH("-2",RC[-6])+2,10),IFERROR(MID(RC[-6],SEARCH("-1",RC[-6])+2,10),IFERROR(MID(RC[-6],SEARCH("-",RC[-6])+1,10),))))))))))) -> 圣女贞德 | I86: ="1"&VLOOKUP(RC[-1],Sheet1!R2C2:R127C3,2,FALSE) -> 131440 | J86: 131440 | K86: =IFERROR(FIND(13,RC[-4],1),"") -> 11 | L86: =IF(RC[-1]="","",MID(RC[-5],RC[-1],6)) -> 131440 | M86: =SUBSTITUTE(RC[-6],RC[-1],RC[-3],1) -> "信仰堕落吧"|3#1314404|1
A87: 14402 | B87: 无尽-美杜莎 | D87: 1 | E87: =MID(RC[-4],1,3)&"|30" -> 144|30 | F87: 3|1 | G87: "沉眠于深渊……"|3#1314304|1 | H87: =IFERROR(MID(RC[-6],SEARCH("-10",RC[-6])+3,10),IFERROR(MID(RC[-6],SEARCH("-9",RC[-6])+2,10),IFERROR(MID(RC[-6],SEARCH("-8",RC[-6])+2,10),IFERROR(MID(RC[-6],SEARCH("-7",RC[-6])+2,10),IFERROR(MID(RC[-6],SEARCH("-6",RC[-6])+2,10),IFERROR(MID(RC[-6],SEARCH("-5",RC[-6])+2,10),IFERROR(MID(RC[-6],SEARCH("-4",RC[-6])+2,10),IFERROR(MID(RC[-6],SEARCH("-3",RC[-6])+2,10),IFERROR(MID(RC[-6],SEARCH("-2",RC[-6])+2,10),IFERROR(MID(RC[-6],SEARCH("-1",RC[-6])+2,10),IFERROR(MID(RC[-6],SEARCH("-",RC[-6])+1,10),))))))))))) -> 美杜莎 | I87: ="1"&VLOOKUP(RC[-1],Sheet1!R2C2:R127C3,2,FALSE) -> 131430 | J87: 131430 | K87: =IFERROR(FIND(13,RC[-4],1),"") -> 13 | L87: =IF(RC[-1]="","",MID(RC[-5],RC[-1],6)) -> 131430 | M87: =SUBSTITUTE(RC[-6],RC[-1],RC[-3],1) -> "沉眠于深渊……"|3#1314304|1
A88: 14502 | B88: 无尽-德古拉伯爵 | D88: 1 | E88: =MID(RC[-4],1,3)&"|30" -> 145|30 | F88: 3|1 | G88: "鲜血如此诱人……"|3#1314014|1 | H88: =IFERROR(MID(RC[-6],SEARCH("-10",RC[-6])+3,10),IFERROR(MID(RC[-6],SEARCH("-9",RC[-6])+2,10),IFERROR(MID(RC[-6],SEARCH("-8",RC[-6])+2,10),IFERROR(MID(RC[-6],SEARCH("-7",RC[-6])+2,10),IFERROR(MID(RC[-6],SEARCH("-6",RC[-6])+2,10),IFERROR(MID(RC[-6],SEARCH("-5",RC[-6])+2,10),IFERROR(MID(RC[-6],SEARCH("-4",RC[-6])+2,10),IFERROR(MID(RC[-6],SEARCH("-3",RC[-6])+2,10),IFERROR(MID(RC[-6],SEARCH("-2",RC[-6])+2,10),IFERROR(MID(RC[-6],SEARCH("-1",RC[-6])+2,10),IFERROR(MID(RC[-6],SEARCH("-",RC[-6])+1,10),))))))))))) -> 德古拉伯爵 | I88: ="1"&VLOOKUP(RC[-1],Sheet1!R2C2:R127C3,2,FALSE) -> 131401 | J88: 131401 | K88: =IFERROR(FIND(13,RC[-4],1),"") -> 14 | L88: =IF(RC[-1]="","",MID(RC[-5],RC[-1],6)) -> 131401 | M88: =SUBSTITUTE(RC[-6],RC[-1],RC[-3],1) -> "鲜血如此诱人……"|3#1314014|1
A89: 14602 | B89: 无尽-狩猎女神 | D89: 1 | E89: =MID(RC[-4],1,3)&"|30" -> 146|30 | F89: 3|1 | G89: "快逃吧，不然你就要死了"|3#1314314|1 | H89: =IFERROR(MID(RC[-6],SEARCH("-10",RC[-6])+3,10),IFERROR(MID(RC[-6],SEARCH("-9",RC[-6])+2,10),IFERROR(MID(RC[-6],SEARCH("-8",RC[-6])+2,10),IFERROR(MID(RC[-6],SEARCH("-7",RC[-6])+2,10),IFERROR(MID(RC[-6],SEARCH("-6",RC[-6])+2,10),IFERROR(MID(RC[-6],SEARCH("-5",RC[-6])+2,10),IFERROR(MID(RC[-6],SEARCH("-4",RC[-6])+2,10),IFERROR(MID(RC[-6],SEARCH("-3",RC[-6])+2,10),IFERROR(MID(RC[-6],SEARCH("-2",RC[-6])+2,10),IFERROR(MID(RC[-6],SEARCH("-1",RC[-6])+2,10),IFERROR(MID(RC[-6],SEARCH("-",RC[-6])+1,10),))))))))))) -> 狩猎女神 | I89: ="1"&VLOOKUP(RC[-1],Sheet1!R2C2:R127C3,2,FALSE) -> 131431 | J89: 131431 | K89: =IFERROR(FIND(13,RC[-4],1),"") -> 17 | L89: =IF(RC[-1]="","",MID(RC[-5],RC[-1],6)) -> 131431 | M89: =SUBSTITUTE(RC[-6],RC[-1],RC[-3],1) -> "快逃吧，不然你就要死了"|3#1314314|1
A90: 14702 | B90: 无尽-查理大帝 | D90: 1 | E90: =MID(RC[-4],1,3)&"|30" -> 147|30 | F90: 3|1 | G90: "我将征服这一切！"|3#1314024|1 | H90: =IFERROR(MID(RC[-6],SEARCH("-10",RC[-6])+3,10),IFERROR(MID(RC[-6],SEARCH("-9",RC[-6])+2,10),IFERROR(MID(RC[-6],SEARCH("-8",RC[-6])+2,10),IFERROR(MID(RC[-6],SEARCH("-7",RC[-6])+2,10),IFERROR(MID(RC[-6],SEARCH("-6",RC[-6])+2,10),IFERROR(MID(RC[-6],SEARCH("-5",RC[-6])+2,10),IFERROR(MID(RC[-6],SEARCH("-4",RC[-6])+2,10),IFERROR(MID(RC[-6],SEARCH("-3",RC[-6])+2,10),IFERROR(MID(RC[-6],SEARCH("-2",RC[-6])+2,10),IFERROR(MID(RC[-6],SEARCH("-1",RC[-6])+2,10),IFERROR(MID(RC[-6],SEARCH("-",RC[-6])+1,10),))))))))))) -> 查理大帝 | I90: ="1"&VLOOKUP(RC[-1],Sheet1!R2C2:R127C3,2,FALSE) -> 131402 | J90: 131402 | K90: =IFERROR(FIND(13,RC[-4],1),"") -> 14 | L90: =IF(RC[-1]="","",MID(RC[-5],RC[-1],6)) -> 131402 | M90: =SUBSTITUTE(RC[-6],RC[-1],RC[-3],1) -> "我将征服这一切！"|3#1314024|1
A91: 14802 | B91: 无尽-佐罗 | D91: 1 | E91: =MID(RC[-4],1,3)&"|30" -> 148|30 | F91: 3|1 | G91: "来自黑暗，一击必杀！"|3#1314034|1 | H91: =IFERROR(MID(RC[-6],SEARCH("-10",RC[-6])+3,10),IFERROR(MID(RC[-6],SEARCH("-9",RC[-6])+2,10),IFERROR(MID(RC[-6],SEARCH("-8",RC[-6])+2,10),IFERROR(MID(RC[-6],SEARCH("-7",RC[-6])+2,10),IFERROR(MID(RC[-6],SEARCH("-6",RC[-6])+2,10),IFERROR(MID(RC[-6],SEARCH("-5",RC[-6])+2,10),IFERROR(MID(RC[-6],SEARCH("-4",RC[-6])+2,10),IFERROR(MID(RC[-6],SEARCH("-3",RC[-6])+2,10),IFERROR(MID(RC[-6],SEARCH("-2",RC[-6])+2,10),IFERROR(MID(RC[-6],SEARCH("-1",RC[-6])+2,10),IFERROR(MID(RC[-6],SEARCH("-",RC[-6])+1,10),))))))))))) -> 佐罗 | I91: ="1"&VLOOKUP(RC[-1],Sheet1!R2C2:R127C3,2,FALSE) -> 131403 | J91: 131403 | K91: =IFERROR(FIND(13,RC[-4],1),"") -> 16 | L91: =IF(RC[-1]="","",MID(RC[-5],RC[-1],6)) -> 131403 | M91: =SUBSTITUTE(RC[-6],RC[-1],RC[-3],1) -> "来自黑暗，一击必杀！"|3#1314034|1
A92: 14902 | B92: 无尽-亚马逊女王 | D92: 1 | E92: =MID(RC[-4],1,3)&"|30" -> 149|30 | F92: 3|1 | G92: "黑暗弥漫之处，便是狩猎之时"|3#1314204|1 | H92: =IFERROR(MID(RC[-6],SEARCH("-10",RC[-6])+3,10),IFERROR(MID(RC[-6],SEARCH("-9",RC[-6])+2,10),IFERROR(MID(RC[-6],SEARCH("-8",RC[-6])+2,10),IFERROR(MID(RC[-6],SEARCH("-7",RC[-6])+2,10),IFERROR(MID(RC[-6],SEARCH("-6",RC[-6])+2,10),IFERROR(MID(RC[-6],SEARCH("-5",RC[-6])+2,10),IFERROR(MID(RC[-6],SEARCH("-4",RC[-6])+2,10),IFERROR(MID(RC[-6],SEARCH("-3",RC[-6])+2,10),IFERROR(MID(RC[-6],SEARCH("-2",RC[-6])+2,10),IFERROR(MID(RC[-6],SEARCH("-1",RC[-6])+2,10),IFERROR(MID(RC[-6],SEARCH("-",RC[-6])+1,10),))))))))))) -> 亚马逊女王 | I92: ="1"&VLOOKUP(RC[-1],Sheet1!R2C2:R127C3,2,FALSE) -> 131420 | J92: 131420 | K92: =IFERROR(FIND(13,RC[-4],1),"") -> 19 | L92: =IF(RC[-1]="","",MID(RC[-5],RC[-1],6)) -> 131420 | M92: =SUBSTITUTE(RC[-6],RC[-1],RC[-3],1) -> "黑暗弥漫之处，便是狩猎之时"|3#1314204|1
A93: 15002 | B93: 无尽-宙斯 | D93: 1 | E93: =MID(RC[-4],1,3)&"|30" -> 150|30 | F93: 3|1 | G93: "欢迎来到最终的结局！"|3#1314384|1 | H93: =IFERROR(MID(RC[-6],SEARCH("-10",RC[-6])+3,10),IFERROR(MID(RC[-6],SEARCH("-9",RC[-6])+2,10),IFERROR(MID(RC[-6],SEARCH("-8",RC[-6])+2,10),IFERROR(MID(RC[-6],SEARCH("-7",RC[-6])+2,10),IFERROR(MID(RC[-6],SEARCH("-6",RC[-6])+2,10),IFERROR(MID(RC[-6],SEARCH("-5",RC[-6])+2,10),IFERROR(MID(RC[-6],SEARCH("-4",RC[-6])+2,10),IFERROR(MID(RC[-6],SEARCH("-3",RC[-6])+2,10),IFERROR(MID(RC[-6],SEARCH("-2",RC[-6])+2,10),IFERROR(MID(RC[-6],SEARCH("-1",RC[-6])+2,10),IFERROR(MID(RC[-6],SEARCH("-",RC[-6])+1,10),))))))))))) -> 宙斯 | I93: ="1"&VLOOKUP(RC[-1],Sheet1!R2C2:R127C3,2,FALSE) -> 131438 | J93: 131438 | K93: =IFERROR(FIND(13,RC[-4],1),"") -> 16 | L93: =IF(RC[-1]="","",MID(RC[-5],RC[-1],6)) -> 131438 | M93: =SUBSTITUTE(RC[-6],RC[-1],RC[-3],1) -> "欢迎来到最终的结局！"|3#1314384|1
A94: 15102 | B94: 无尽-斯巴达 | D94: 1 | E94: =MID(RC[-4],1,3)&"|30" -> 151|30 | F94: 3|1 | G94: "来吧，投身于深渊——"|3#1314104|1 | H94: =IFERROR(MID(RC[-6],SEARCH("-10",RC[-6])+3,10),IFERROR(MID(RC[-6],SEARCH("-9",RC[-6])+2,10),IFERROR(MID(RC[-6],SEARCH("-8",RC[-6])+2,10),IFERROR(MID(RC[-6],SEARCH("-7",RC[-6])+2,10),IFERROR(MID(RC[-6],SEARCH("-6",RC[-6])+2,10),IFERROR(MID(RC[-6],SEARCH("-5",RC[-6])+2,10),IFERROR(MID(RC[-6],SEARCH("-4",RC[-6])+2,10),IFERROR(MID(RC[-6],SEARCH("-3",RC[-6])+2,10),IFERROR(MID(RC[-6],SEARCH("-2",RC[-6])+2,10),IFERROR(MID(RC[-6],SEARCH("-1",RC[-6])+2,10),IFERROR(MID(RC[-6],SEARCH("-",RC[-6])+1,10),))))))))))) -> 斯巴达 | I94: ="1"&VLOOKUP(RC[-1],Sheet1!R2C2:R127C3,2,FALSE) -> 131410 | J94: 131410 | K94: =IFERROR(FIND(13,RC[-4],1),"") -> 16 | L94: =IF(RC[-1]="","",MID(RC[-5],RC[-1],6)) -> 131410 | M94: =SUBSTITUTE(RC[-6],RC[-1],RC[-3],1) -> "来吧，投身于深渊——"|3#1314104|1
A95: 15202 | B95: 无尽-阿努比斯 | D95: 1 | E95: =MID(RC[-4],1,3)&"|30" -> 152|30 | F95: 3|1 | G95: "这是亡者的归属"|3#1314084|1 | H95: =IFERROR(MID(RC[-6],SEARCH("-10",RC[-6])+3,10),IFERROR(MID(RC[-6],SEARCH("-9",RC[-6])+2,10),IFERROR(MID(RC[-6],SEARCH("-8",RC[-6])+2,10),IFERROR(MID(RC[-6],SEARCH("-7",RC[-6])+2,10),IFERROR(MID(RC[-6],SEARCH("-6",RC[-6])+2,10),IFERROR(MID(RC[-6],SEARCH("-5",RC[-6])+2,10),IFERROR(MID(RC[-6],SEARCH("-4",RC[-6])+2,10),IFERROR(MID(RC[-6],SEARCH("-3",RC[-6])+2,10),IFERROR(MID(RC[-6],SEARCH("-2",RC[-6])+2,10),IFERROR(MID(RC[-6],SEARCH("-1",RC[-6])+2,10),IFERROR(MID(RC[-6],SEARCH("-",RC[-6])+1,10),))))))))))) -> 阿努比斯 | I95: ="1"&VLOOKUP(RC[-1],Sheet1!R2C2:R127C3,2,FALSE) -> 131408 | J95: 131408 | K95: =IFERROR(FIND(13,RC[-4],1),"") -> 13 | L95: =IF(RC[-1]="","",MID(RC[-5],RC[-1],6)) -> 131408 | M95: =SUBSTITUTE(RC[-6],RC[-1],RC[-3],1) -> "这是亡者的归属"|3#1314084|1
A96: 15302 | B96: 无尽-雅典娜 | D96: 1 | E96: =MID(RC[-4],1,3)&"|30" -> 153|30 | F96: 3|1 | G96: "当你凝视深渊，深渊也在凝视着你"|3#1314414|1 | H96: =IFERROR(MID(RC[-6],SEARCH("-10",RC[-6])+3,10),IFERROR(MID(RC[-6],SEARCH("-9",RC[-6])+2,10),IFERROR(MID(RC[-6],SEARCH("-8",RC[-6])+2,10),IFERROR(MID(RC[-6],SEARCH("-7",RC[-6])+2,10),IFERROR(MID(RC[-6],SEARCH("-6",RC[-6])+2,10),IFERROR(MID(RC[-6],SEARCH("-5",RC[-6])+2,10),IFERROR(MID(RC[-6],SEARCH("-4",RC[-6])+2,10),IFERROR(MID(RC[-6],SEARCH("-3",RC[-6])+2,10),IFERROR(MID(RC[-6],SEARCH("-2",RC[-6])+2,10),IFERROR(MID(RC[-6],SEARCH("-1",RC[-6])+2,10),IFERROR(MID(RC[-6],SEARCH("-",RC[-6])+1,10),))))))))))) -> 雅典娜 | I96: ="1"&VLOOKUP(RC[-1],Sheet1!R2C2:R127C3,2,FALSE) -> 131441 | J96: 131441 | K96: =IFERROR(FIND(13,RC[-4],1),"") -> 21 | L96: =IF(RC[-1]="","",MID(RC[-5],RC[-1],6)) -> 131441 | M96: =SUBSTITUTE(RC[-6],RC[-1],RC[-3],1) -> "当你凝视深渊，深渊也在凝视着你"|3#1314414|1
A97: 15402 | B97: 无尽-大力神 | D97: 1 | E97: =MID(RC[-4],1,3)&"|30" -> 154|30 | F97: 3|1 | G97: "砸碎你们！"|3#1314194|1 | H97: =IFERROR(MID(RC[-6],SEARCH("-10",RC[-6])+3,10),IFERROR(MID(RC[-6],SEARCH("-9",RC[-6])+2,10),IFERROR(MID(RC[-6],SEARCH("-8",RC[-6])+2,10),IFERROR(MID(RC[-6],SEARCH("-7",RC[-6])+2,10),IFERROR(MID(RC[-6],SEARCH("-6",RC[-6])+2,10),IFERROR(MID(RC[-6],SEARCH("-5",RC[-6])+2,10),IFERROR(MID(RC[-6],SEARCH("-4",RC[-6])+2,10),IFERROR(MID(RC[-6],SEARCH("-3",RC[-6])+2,10),IFERROR(MID(RC[-6],SEARCH("-2",RC[-6])+2,10),IFERROR(MID(RC[-6],SEARCH("-1",RC[-6])+2,10),IFERROR(MID(RC[-6],SEARCH("-",RC[-6])+1,10),))))))))))) -> 大力神 | I97: ="1"&VLOOKUP(RC[-1],Sheet1!R2C2:R127C3,2,FALSE) -> 131419 | J97: 131419 | K97: =IFERROR(FIND(13,RC[-4],1),"") -> 11 | L97: =IF(RC[-1]="","",MID(RC[-5],RC[-1],6)) -> 131419 | M97: =SUBSTITUTE(RC[-6],RC[-1],RC[-3],1) -> "砸碎你们！"|3#1314194|1
A98: 15502 | B98: 无尽-冥王哈迪斯 | D98: 1 | E98: =MID(RC[-4],1,3)&"|30" -> 155|30 | F98: 3|1 | G98: "你们无法逃离黑暗"|3#1314394|1 | H98: =IFERROR(MID(RC[-6],SEARCH("-10",RC[-6])+3,10),IFERROR(MID(RC[-6],SEARCH("-9",RC[-6])+2,10),IFERROR(MID(RC[-6],SEARCH("-8",RC[-6])+2,10),IFERROR(MID(RC[-6],SEARCH("-7",RC[-6])+2,10),IFERROR(MID(RC[-6],SEARCH("-6",RC[-6])+2,10),IFERROR(MID(RC[-6],SEARCH("-5",RC[-6])+2,10),IFERROR(MID(RC[-6],SEARCH("-4",RC[-6])+2,10),IFERROR(MID(RC[-6],SEARCH("-3",RC[-6])+2,10),IFERROR(MID(RC[-6],SEARCH("-2",RC[-6])+2,10),IFERROR(MID(RC[-6],SEARCH("-1",RC[-6])+2,10),IFERROR(MID(RC[-6],SEARCH("-",RC[-6])+1,10),))))))))))) -> 冥王哈迪斯 | I98: ="1"&VLOOKUP(RC[-1],Sheet1!R2C2:R127C3,2,FALSE) -> 131439 | J98: 131439 | K98: =IFERROR(FIND(13,RC[-4],1),"") -> 14 | L98: =IF(RC[-1]="","",MID(RC[-5],RC[-1],6)) -> 131439 | M98: =SUBSTITUTE(RC[-6],RC[-1],RC[-3],1) -> "你们无法逃离黑暗"|3#1314394|1
A99: 17002 | B99: 无尽-石头人 | D99: 1 | E99: =MID(RC[-4],1,3)&"|30" -> 170|30 | F99: 3|1 | G99: "山崩地裂——"|3#1323114|1 | H99: =IFERROR(MID(RC[-6],SEARCH("-10",RC[-6])+3,10),IFERROR(MID(RC[-6],SEARCH("-9",RC[-6])+2,10),IFERROR(MID(RC[-6],SEARCH("-8",RC[-6])+2,10),IFERROR(MID(RC[-6],SEARCH("-7",RC[-6])+2,10),IFERROR(MID(RC[-6],SEARCH("-6",RC[-6])+2,10),IFERROR(MID(RC[-6],SEARCH("-5",RC[-6])+2,10),IFERROR(MID(RC[-6],SEARCH("-4",RC[-6])+2,10),IFERROR(MID(RC[-6],SEARCH("-3",RC[-6])+2,10),IFERROR(MID(RC[-6],SEARCH("-2",RC[-6])+2,10),IFERROR(MID(RC[-6],SEARCH("-1",RC[-6])+2,10),IFERROR(MID(RC[-6],SEARCH("-",RC[-6])+1,10),))))))))))) -> 石头人 | I99: ="1"&VLOOKUP(RC[-1],Sheet1!R2C2:R127C3,2,FALSE) -> 132311 | J99: 132311 | K99: =IFERROR(FIND(13,RC[-4],1),"") -> 12 | L99: =IF(RC[-1]="","",MID(RC[-5],RC[-1],6)) -> 132311 | M99: =SUBSTITUTE(RC[-6],RC[-1],RC[-3],1) -> "山崩地裂——"|3#1323114|1
A100: 17102 | B100: 无尽-血源牧师 | D100: 1 | E100: =MID(RC[-4],1,3)&"|30" -> 171|30 | F100: 3|1 | G100: "一切归于深渊"|3#1323414|1 | H100: =IFERROR(MID(RC[-6],SEARCH("-10",RC[-6])+3,10),IFERROR(MID(RC[-6],SEARCH("-9",RC[-6])+2,10),IFERROR(MID(RC[-6],SEARCH("-8",RC[-6])+2,10),IFERROR(MID(RC[-6],SEARCH("-7",RC[-6])+2,10),IFERROR(MID(RC[-6],SEARCH("-6",RC[-6])+2,10),IFERROR(MID(RC[-6],SEARCH("-5",RC[-6])+2,10),IFERROR(MID(RC[-6],SEARCH("-4",RC[-6])+2,10),IFERROR(MID(RC[-6],SEARCH("-3",RC[-6])+2,10),IFERROR(MID(RC[-6],SEARCH("-2",RC[-6])+2,10),IFERROR(MID(RC[-6],SEARCH("-1",RC[-6])+2,10),IFERROR(MID(RC[-6],SEARCH("-",RC[-6])+1,10),))))))))))) -> 血源牧师 | I100: ="1"&VLOOKUP(RC[-1],Sheet1!R2C2:R127C3,2,FALSE) -> 132341 | J100: 132341 | K100: =IFERROR(FIND(13,RC[-4],1),"") -> 12 | L100: =IF(RC[-1]="","",MID(RC[-5],RC[-1],6)) -> 132341 | M100: =SUBSTITUTE(RC[-6],RC[-1],RC[-3],1) -> "一切归于深渊"|3#1323414|1
A101: 17202 | B101: 无尽-屠夫 | D101: 1 | E101: =MID(RC[-4],1,3)&"|30" -> 172|30 | F101: 3|1 | G101: "美妙的血肉——"|3#1324104|1 | H101: =IFERROR(MID(RC[-6],SEARCH("-10",RC[-6])+3,10),IFERROR(MID(RC[-6],SEARCH("-9",RC[-6])+2,10),IFERROR(MID(RC[-6],SEARCH("-8",RC[-6])+2,10),IFERROR(MID(RC[-6],SEARCH("-7",RC[-6])+2,10),IFERROR(MID(RC[-6],SEARCH("-6",RC[-6])+2,10),IFERROR(MID(RC[-6],SEARCH("-5",RC[-6])+2,10),IFERROR(MID(RC[-6],SEARCH("-4",RC[-6])+2,10),IFERROR(MID(RC[-6],SEARCH("-3",RC[-6])+2,10),IFERROR(MID(RC[-6],SEARCH("-2",RC[-6])+2,10),IFERROR(MID(RC[-6],SEARCH("-1",RC[-6])+2,10),IFERROR(MID(RC[-6],SEARCH("-",RC[-6])+1,10),))))))))))) -> 屠夫 | I101: ="1"&VLOOKUP(RC[-1],Sheet1!R2C2:R127C3,2,FALSE) -> 132410 | J101: 132410 | K101: =IFERROR(FIND(13,RC[-4],1),"") -> 13 | L101: =IF(RC[-1]="","",MID(RC[-5],RC[-1],6)) -> 132410 | M101: =SUBSTITUTE(RC[-6],RC[-1],RC[-3],1) -> "美妙的血肉——"|3#1324104|1
A102: 17302 | B102: 无尽-树精 | D102: 1 | E102: =MID(RC[-4],1,3)&"|30" -> 173|30 | F102: 3|1 | G102: "你将迎来终结。"|3#1324114|1 | H102: =IFERROR(MID(RC[-6],SEARCH("-10",RC[-6])+3,10),IFERROR(MID(RC[-6],SEARCH("-9",RC[-6])+2,10),IFERROR(MID(RC[-6],SEARCH("-8",RC[-6])+2,10),IFERROR(MID(RC[-6],SEARCH("-7",RC[-6])+2,10),IFERROR(MID(RC[-6],SEARCH("-6",RC[-6])+2,10),IFERROR(MID(RC[-6],SEARCH("-5",RC[-6])+2,10),IFERROR(MID(RC[-6],SEARCH("-4",RC[-6])+2,10),IFERROR(MID(RC[-6],SEARCH("-3",RC[-6])+2,10),IFERROR(MID(RC[-6],SEARCH("-2",RC[-6])+2,10),IFERROR(MID(RC[-6],SEARCH("-1",RC[-6])+2,10),IFERROR(MID(RC[-6],SEARCH("-",RC[-6])+1,10),))))))))))) -> 树精 | I102: ="1"&VLOOKUP(RC[-1],Sheet1!R2C2:R127C3,2,FALSE) -> 132411 | J102: 132411 | K102: =IFERROR(FIND(13,RC[-4],1),"") -> 13 | L102: =IF(RC[-1]="","",MID(RC[-5],RC[-1],6)) -> 132411 | M102: =SUBSTITUTE(RC[-6],RC[-1],RC[-3],1) -> "你将迎来终结。"|3#1324114|1
A103: 17402 | B103: 无尽-牛头人 | D103: 1 | E103: =MID(RC[-4],1,3)&"|30" -> 174|30 | F103: 3|1 | G103: "你们无法阻挡我！"|3#1324004|1 | H103: =IFERROR(MID(RC[-6],SEARCH("-10",RC[-6])+3,10),IFERROR(MID(RC[-6],SEARCH("-9",RC[-6])+2,10),IFERROR(MID(RC[-6],SEARCH("-8",RC[-6])+2,10),IFERROR(MID(RC[-6],SEARCH("-7",RC[-6])+2,10),IFERROR(MID(RC[-6],SEARCH("-6",RC[-6])+2,10),IFERROR(MID(RC[-6],SEARCH("-5",RC[-6])+2,10),IFERROR(MID(RC[-6],SEARCH("-4",RC[-6])+2,10),IFERROR(MID(RC[-6],SEARCH("-3",RC[-6])+2,10),IFERROR(MID(RC[-6],SEARCH("-2",RC[-6])+2,10),IFERROR(MID(RC[-6],SEARCH("-1",RC[-6])+2,10),IFERROR(MID(RC[-6],SEARCH("-",RC[-6])+1,10),))))))))))) -> 牛头人 | I103: ="1"&VLOOKUP(RC[-1],Sheet1!R2C2:R127C3,2,FALSE) -> 132400 | J103: 132400 | K103: =IFERROR(FIND(13,RC[-4],1),"") -> 14 | L103: =IF(RC[-1]="","",MID(RC[-5],RC[-1],6)) -> 132400 | M103: =SUBSTITUTE(RC[-6],RC[-1],RC[-3],1) -> "你们无法阻挡我！"|3#1324004|1
A104: 17502 | B104: 无尽-火女 | D104: 1 | E104: =MID(RC[-4],1,3)&"|30" -> 175|30 | F104: 3|1 | G104: "黑火将焚毁世界"|3#1324304|1 | H104: =IFERROR(MID(RC[-6],SEARCH("-10",RC[-6])+3,10),IFERROR(MID(RC[-6],SEARCH("-9",RC[-6])+2,10),IFERROR(MID(RC[-6],SEARCH("-8",RC[-6])+2,10),IFERROR(MID(RC[-6],SEARCH("-7",RC[-6])+2,10),IFERROR(MID(RC[-6],SEARCH("-6",RC[-6])+2,10),IFERROR(MID(RC[-6],SEARCH("-5",RC[-6])+2,10),IFERROR(MID(RC[-6],SEARCH("-4",RC[-6])+2,10),IFERROR(MID(RC[-6],SEARCH("-3",RC[-6])+2,10),IFERROR(MID(RC[-6],SEARCH("-2",RC[-6])+2,10),IFERROR(MID(RC[-6],SEARCH("-1",RC[-6])+2,10),IFERROR(MID(RC[-6],SEARCH("-",RC[-6])+1,10),))))))))))) -> 火女 | I104: ="1"&VLOOKUP(RC[-1],Sheet1!R2C2:R127C3,2,FALSE) -> 132430 | J104: 132430 | K104: =IFERROR(FIND(13,RC[-4],1),"") -> 13 | L104: =IF(RC[-1]="","",MID(RC[-5],RC[-1],6)) -> 132430 | M104: =SUBSTITUTE(RC[-6],RC[-1],RC[-3],1) -> "黑火将焚毁世界"|3#1324304|1
A105: 17602 | B105: 无尽-半人马 | D105: 1 | E105: =MID(RC[-4],1,3)&"|30" -> 176|30 | F105: 3|1 | G105: "深渊的号角已经吹响！"|3#1324014|1 | H105: =IFERROR(MID(RC[-6],SEARCH("-10",RC[-6])+3,10),IFERROR(MID(RC[-6],SEARCH("-9",RC[-6])+2,10),IFERROR(MID(RC[-6],SEARCH("-8",RC[-6])+2,10),IFERROR(MID(RC[-6],SEARCH("-7",RC[-6])+2,10),IFERROR(MID(RC[-6],SEARCH("-6",RC[-6])+2,10),IFERROR(MID(RC[-6],SEARCH("-5",RC[-6])+2,10),IFERROR(MID(RC[-6],SEARCH("-4",RC[-6])+2,10),IFERROR(MID(RC[-6],SEARCH("-3",RC[-6])+2,10),IFERROR(MID(RC[-6],SEARCH("-2",RC[-6])+2,10),IFERROR(MID(RC[-6],SEARCH("-1",RC[-6])+2,10),IFERROR(MID(RC[-6],SEARCH("-",RC[-6])+1,10),))))))))))) -> 半人马 | I105: ="1"&VLOOKUP(RC[-1],Sheet1!R2C2:R127C3,2,FALSE) -> 132401 | J105: 132401 | K105: =IFERROR(FIND(13,RC[-4],1),"") -> 16 | L105: =IF(RC[-1]="","",MID(RC[-5],RC[-1],6)) -> 132401 | M105: =SUBSTITUTE(RC[-6],RC[-1],RC[-3],1) -> "深渊的号角已经吹响！"|3#1324014|1
A106: 17702 | B106: 无尽-食人魔 | D106: 1 | E106: =MID(RC[-4],1,3)&"|30" -> 177|30 | F106: 3|1 | G106: "我会吃掉你们——"|3#1324314|1 | H106: =IFERROR(MID(RC[-6],SEARCH("-10",RC[-6])+3,10),IFERROR(MID(RC[-6],SEARCH("-9",RC[-6])+2,10),IFERROR(MID(RC[-6],SEARCH("-8",RC[-6])+2,10),IFERROR(MID(RC[-6],SEARCH("-7",RC[-6])+2,10),IFERROR(MID(RC[-6],SEARCH("-6",RC[-6])+2,10),IFERROR(MID(RC[-6],SEARCH("-5",RC[-6])+2,10),IFERROR(MID(RC[-6],SEARCH("-4",RC[-6])+2,10),IFERROR(MID(RC[-6],SEARCH("-3",RC[-6])+2,10),IFERROR(MID(RC[-6],SEARCH("-2",RC[-6])+2,10),IFERROR(MID(RC[-6],SEARCH("-1",RC[-6])+2,10),IFERROR(MID(RC[-6],SEARCH("-",RC[-6])+1,10),))))))))))) -> 食人魔 | I106: ="1"&VLOOKUP(RC[-1],Sheet1!R2C2:R127C3,2,FALSE) -> 132431 | J106: 132431 | K106: =IFERROR(FIND(13,RC[-4],1),"") -> 14 | L106: =IF(RC[-1]="","",MID(RC[-5],RC[-1],6)) -> 132431 | M106: =SUBSTITUTE(RC[-6],RC[-1],RC[-3],1) -> "我会吃掉你们——"|3#1324314|1
A107: 17802 | B107: 无尽-基伦 | D107: 1 | E107: =MID(RC[-4],1,3)&"|30" -> 178|30 | F107: 3|1 | G107: "你们必将失败！"|3#1324024|1 | H107: =IFERROR(MID(RC[-6],SEARCH("-10",RC[-6])+3,10),IFERROR(MID(RC[-6],SEARCH("-9",RC[-6])+2,10),IFERROR(MID(RC[-6],SEARCH("-8",RC[-6])+2,10),IFERROR(MID(RC[-6],SEARCH("-7",RC[-6])+2,10),IFERROR(MID(RC[-6],SEARCH("-6",RC[-6])+2,10),IFERROR(MID(RC[-6],SEARCH("-5",RC[-6])+2,10),IFERROR(MID(RC[-6],SEARCH("-4",RC[-6])+2,10),IFERROR(MID(RC[-6],SEARCH("-3",RC[-6])+2,10),IFERROR(MID(RC[-6],SEARCH("-2",RC[-6])+2,10),IFERROR(MID(RC[-6],SEARCH("-1",RC[-6])+2,10),IFERROR(MID(RC[-6],SEARCH("-",RC[-6])+1,10),))))))))))) -> 基伦 | I107: ="1"&VLOOKUP(RC[-1],Sheet1!R2C2:R127C3,2,FALSE) -> 132402 | J107: 132402 | K107: =IFERROR(FIND(13,RC[-4],1),"") -> 13 | L107: =IF(RC[-1]="","",MID(RC[-5],RC[-1],6)) -> 132402 | M107: =SUBSTITUTE(RC[-6],RC[-1],RC[-3],1) -> "你们必将失败！"|3#1324024|1
A108: 17902 | B108: 无尽-女警 | D108: 1 | E108: =MID(RC[-4],1,3)&"|30" -> 179|30 | F108: 3|1 | G108: "怎么？你们在妄想些什么？"|3#1324204|1 | H108: =IFERROR(MID(RC[-6],SEARCH("-10",RC[-6])+3,10),IFERROR(MID(RC[-6],SEARCH("-9",RC[-6])+2,10),IFERROR(MID(RC[-6],SEARCH("-8",RC[-6])+2,10),IFERROR(MID(RC[-6],SEARCH("-7",RC[-6])+2,10),IFERROR(MID(RC[-6],SEARCH("-6",RC[-6])+2,10),IFERROR(MID(RC[-6],SEARCH("-5",RC[-6])+2,10),IFERROR(MID(RC[-6],SEARCH("-4",RC[-6])+2,10),IFERROR(MID(RC[-6],SEARCH("-3",RC[-6])+2,10),IFERROR(MID(RC[-6],SEARCH("-2",RC[-6])+2,10),IFERROR(MID(RC[-6],SEARCH("-1",RC[-6])+2,10),IFERROR(MID(RC[-6],SEARCH("-",RC[-6])+1,10),))))))))))) -> 女警 | I108: ="1"&VLOOKUP(RC[-1],Sheet1!R2C2:R127C3,2,FALSE) -> 132420 | J108: 132420 | K108: =IFERROR(FIND(13,RC[-4],1),"") -> 18 | L108: =IF(RC[-1]="","",MID(RC[-5],RC[-1],6)) -> 132420 | M108: =SUBSTITUTE(RC[-6],RC[-1],RC[-3],1) -> "怎么？你们在妄想些什么？"|3#1324204|1
A109: 18002 | B109: 无尽-小黑 | D109: 1 | E109: =MID(RC[-4],1,3)&"|30" -> 180|30 | F109: 3|1 | G109: "黑暗之弓，深渊之矢"|3#1324284|1 | H109: =IFERROR(MID(RC[-6],SEARCH("-10",RC[-6])+3,10),IFERROR(MID(RC[-6],SEARCH("-9",RC[-6])+2,10),IFERROR(MID(RC[-6],SEARCH("-8",RC[-6])+2,10),IFERROR(MID(RC[-6],SEARCH("-7",RC[-6])+2,10),IFERROR(MID(RC[-6],SEARCH("-6",RC[-6])+2,10),IFERROR(MID(RC[-6],SEARCH("-5",RC[-6])+2,10),IFERROR(MID(RC[-6],SEARCH("-4",RC[-6])+2,10),IFERROR(MID(RC[-6],SEARCH("-3",RC[-6])+2,10),IFERROR(MID(RC[-6],SEARCH("-2",RC[-6])+2,10),IFERROR(MID(RC[-6],SEARCH("-1",RC[-6])+2,10),IFERROR(MID(RC[-6],SEARCH("-",RC[-6])+1,10),))))))))))) -> 小黑 | I109: ="1"&VLOOKUP(RC[-1],Sheet1!R2C2:R127C3,2,FALSE) -> 132428 | J109: 132428 | K109: =IFERROR(FIND(13,RC[-4],1),"") -> 15 | L109: =IF(RC[-1]="","",MID(RC[-5],RC[-1],6)) -> 132428 | M109: =SUBSTITUTE(RC[-6],RC[-1],RC[-3],1) -> "黑暗之弓，深渊之矢"|3#1324284|1
A110: 18102 | B110: 无尽-熊阿宝 | D110: 1 | E110: =MID(RC[-4],1,3)&"|30" -> 181|30 | F110: 3|1 | G110: "醉生梦死最是省事"|3#1324124|1 | H110: =IFERROR(MID(RC[-6],SEARCH("-10",RC[-6])+3,10),IFERROR(MID(RC[-6],SEARCH("-9",RC[-6])+2,10),IFERROR(MID(RC[-6],SEARCH("-8",RC[-6])+2,10),IFERROR(MID(RC[-6],SEARCH("-7",RC[-6])+2,10),IFERROR(MID(RC[-6],SEARCH("-6",RC[-6])+2,10),IFERROR(MID(RC[-6],SEARCH("-5",RC[-6])+2,10),IFERROR(MID(RC[-6],SEARCH("-4",RC[-6])+2,10),IFERROR(MID(RC[-6],SEARCH("-3",RC[-6])+2,10),IFERROR(MID(RC[-6],SEARCH("-2",RC[-6])+2,10),IFERROR(MID(RC[-6],SEARCH("-1",RC[-6])+2,10),IFERROR(MID(RC[-6],SEARCH("-",RC[-6])+1,10),))))))))))) -> 熊阿宝 | I110: ="1"&VLOOKUP(RC[-1],Sheet1!R2C2:R127C3,2,FALSE) -> 132412 | J110: 132412 | K110: =IFERROR(FIND(13,RC[-4],1),"") -> 14 | L110: =IF(RC[-1]="","",MID(RC[-5],RC[-1],6)) -> 132412 | M110: =SUBSTITUTE(RC[-6],RC[-1],RC[-3],1) -> "醉生梦死最是省事"|3#1324124|1
A111: 18202 | B111: 无尽-血色指挥官 | D111: 1 | E111: =MID(RC[-4],1,3)&"|30" -> 182|30 | F111: 3|1 | G111: "所有光芒都将死亡"|3#1324084|1 | H111: =IFERROR(MID(RC[-6],SEARCH("-10",RC[-6])+3,10),IFERROR(MID(RC[-6],SEARCH("-9",RC[-6])+2,10),IFERROR(MID(RC[-6],SEARCH("-8",RC[-6])+2,10),IFERROR(MID(RC[-6],SEARCH("-7",RC[-6])+2,10),IFERROR(MID(RC[-6],SEARCH("-6",RC[-6])+2,10),IFERROR(MID(RC[-6],SEARCH("-5",RC[-6])+2,10),IFERROR(MID(RC[-6],SEARCH("-4",RC[-6])+2,10),IFERROR(MID(RC[-6],SEARCH("-3",RC[-6])+2,10),IFERROR(MID(RC[-6],SEARCH("-2",RC[-6])+2,10),IFERROR(MID(RC[-6],SEARCH("-1",RC[-6])+2,10),IFERROR(MID(RC[-6],SEARCH("-",RC[-6])+1,10),))))))))))) -> 血色指挥官 | I111: ="1"&VLOOKUP(RC[-1],Sheet1!R2C2:R127C3,2,FALSE) -> 132408 | J111: 132408 | K111: =IFERROR(FIND(13,RC[-4],1),"") -> 14 | L111: =IF(RC[-1]="","",MID(RC[-5],RC[-1],6)) -> 132408 | M111: =SUBSTITUTE(RC[-6],RC[-1],RC[-3],1) -> "所有光芒都将死亡"|3#1324084|1
A112: 18302 | B112: 无尽-大检察官 | D112: 1 | E112: =MID(RC[-4],1,3)&"|30" -> 183|30 | F112: 3|1 | G112: "深渊之光！"|3#1324404|1 | H112: =IFERROR(MID(RC[-6],SEARCH("-10",RC[-6])+3,10),IFERROR(MID(RC[-6],SEARCH("-9",RC[-6])+2,10),IFERROR(MID(RC[-6],SEARCH("-8",RC[-6])+2,10),IFERROR(MID(RC[-6],SEARCH("-7",RC[-6])+2,10),IFERROR(MID(RC[-6],SEARCH("-6",RC[-6])+2,10),IFERROR(MID(RC[-6],SEARCH("-5",RC[-6])+2,10),IFERROR(MID(RC[-6],SEARCH("-4",RC[-6])+2,10),IFERROR(MID(RC[-6],SEARCH("-3",RC[-6])+2,10),IFERROR(MID(RC[-6],SEARCH("-2",RC[-6])+2,10),IFERROR(MID(RC[-6],SEARCH("-1",RC[-6])+2,10),IFERROR(MID(RC[-6],SEARCH("-",RC[-6])+1,10),))))))))))) -> 大检察官 | I112: ="1"&VLOOKUP(RC[-1],Sheet1!R2C2:R127C3,2,FALSE) -> 132440 | J112: 132440 | K112: =IFERROR(FIND(13,RC[-4],1),"") -> 11 | L112: =IF(RC[-1]="","",MID(RC[-5],RC[-1],6)) -> 132440 | M112: =SUBSTITUTE(RC[-6],RC[-1],RC[-3],1) -> "深渊之光！"|3#1324404|1
A113: 18402 | B113: 无尽-恶魔猎手 | D113: 1 | E113: =MID(RC[-4],1,3)&"|30" -> 184|30 | F113: 3|1 | G113: "深渊的迷雾将吞噬你们"|3#1324094|1 | H113: =IFERROR(MID(RC[-6],SEARCH("-10",RC[-6])+3,10),IFERROR(MID(RC[-6],SEARCH("-9",RC[-6])+2,10),IFERROR(MID(RC[-6],SEARCH("-8",RC[-6])+2,10),IFERROR(MID(RC[-6],SEARCH("-7",RC[-6])+2,10),IFERROR(MID(RC[-6],SEARCH("-6",RC[-6])+2,10),IFERROR(MID(RC[-6],SEARCH("-5",RC[-6])+2,10),IFERROR(MID(RC[-6],SEARCH("-4",RC[-6])+2,10),IFERROR(MID(RC[-6],SEARCH("-3",RC[-6])+2,10),IFERROR(MID(RC[-6],SEARCH("-2",RC[-6])+2,10),IFERROR(MID(RC[-6],SEARCH("-1",RC[-6])+2,10),IFERROR(MID(RC[-6],SEARCH("-",RC[-6])+1,10),))))))))))) -> 恶魔猎手 | I113: ="1"&VLOOKUP(RC[-1],Sheet1!R2C2:R127C3,2,FALSE) -> 132409 | J113: 132409 | K113: =IFERROR(FIND(13,RC[-4],1),"") -> 16 | L113: =IF(RC[-1]="","",MID(RC[-5],RC[-1],6)) -> 132409 | M113: =SUBSTITUTE(RC[-6],RC[-1],RC[-3],1) -> "深渊的迷雾将吞噬你们"|3#1324094|1
A114: 18502 | B114: 无尽-神圣牧师 | D114: 1 | E114: =MID(RC[-4],1,3)&"|30" -> 185|30 | F114: 3|1 | G114: "这才是无穷无尽的——"|3#1324494|1 | H114: =IFERROR(MID(RC[-6],SEARCH("-10",RC[-6])+3,10),IFERROR(MID(RC[-6],SEARCH("-9",RC[-6])+2,10),IFERROR(MID(RC[-6],SEARCH("-8",RC[-6])+2,10),IFERROR(MID(RC[-6],SEARCH("-7",RC[-6])+2,10),IFERROR(MID(RC[-6],SEARCH("-6",RC[-6])+2,10),IFERROR(MID(RC[-6],SEARCH("-5",RC[-6])+2,10),IFERROR(MID(RC[-6],SEARCH("-4",RC[-6])+2,10),IFERROR(MID(RC[-6],SEARCH("-3",RC[-6])+2,10),IFERROR(MID(RC[-6],SEARCH("-2",RC[-6])+2,10),IFERROR(MID(RC[-6],SEARCH("-1",RC[-6])+2,10),IFERROR(MID(RC[-6],SEARCH("-",RC[-6])+1,10),))))))))))) -> 神圣牧师 | I114: ="1"&VLOOKUP(RC[-1],Sheet1!R2C2:R127C3,2,FALSE) -> 132449 | J114: 132449 | K114: =IFERROR(FIND(13,RC[-4],1),"") -> 16 | L114: =IF(RC[-1]="","",MID(RC[-5],RC[-1],6)) -> 132449 | M114: =SUBSTITUTE(RC[-6],RC[-1],RC[-3],1) -> "这才是无穷无尽的——"|3#1324494|1
A115: 19002 | B115: 无尽-四爪博士 | D115: 1 | E115: =MID(RC[-4],1,3)&"|30" -> 190|30 | F115: 3|1 | G115: "追寻的真理于此将止！"|3#1309994|1 | H115: =IFERROR(MID(RC[-6],SEARCH("-10",RC[-6])+3,10),IFERROR(MID(RC[-6],SEARCH("-9",RC[-6])+2,10),IFERROR(MID(RC[-6],SEARCH("-8",RC[-6])+2,10),IFERROR(MID(RC[-6],SEARCH("-7",RC[-6])+2,10),IFERROR(MID(RC[-6],SEARCH("-6",RC[-6])+2,10),IFERROR(MID(RC[-6],SEARCH("-5",RC[-6])+2,10),IFERROR(MID(RC[-6],SEARCH("-4",RC[-6])+2,10),IFERROR(MID(RC[-6],SEARCH("-3",RC[-6])+2,10),IFERROR(MID(RC[-6],SEARCH("-2",RC[-6])+2,10),IFERROR(MID(RC[-6],SEARCH("-1",RC[-6])+2,10),IFERROR(MID(RC[-6],SEARCH("-",RC[-6])+1,10),))))))))))) -> 四爪博士 | I115: ="1"&VLOOKUP(RC[-1],Sheet1!R2C2:R127C3,2,FALSE) -> 130999 | J115: 130999 | K115: =IFERROR(FIND(13,RC[-4],1),"") -> 16 | L115: =IF(RC[-1]="","",MID(RC[-5],RC[-1],6)) -> 130999 | M115: =SUBSTITUTE(RC[-6],RC[-1],RC[-3],1) -> "追寻的真理于此将止！"|3#1309994|1
A116: 19102 | B116: 无尽-红颅鬼 | D116: 1 | E116: =MID(RC[-4],1,3)&"|30" -> 191|30 | F116: 3|1 | G116: "随我到深渊里去吧！——"|3#1309984|1 | H116: =IFERROR(MID(RC[-6],SEARCH("-10",RC[-6])+3,10),IFERROR(MID(RC[-6],SEARCH("-9",RC[-6])+2,10),IFERROR(MID(RC[-6],SEARCH("-8",RC[-6])+2,10),IFERROR(MID(RC[-6],SEARCH("-7",RC[-6])+2,10),IFERROR(MID(RC[-6],SEARCH("-6",RC[-6])+2,10),IFERROR(MID(RC[-6],SEARCH("-5",RC[-6])+2,10),IFERROR(MID(RC[-6],SEARCH("-4",RC[-6])+2,10),IFERROR(MID(RC[-6],SEARCH("-3",RC[-6])+2,10),IFERROR(MID(RC[-6],SEARCH("-2",RC[-6])+2,10),IFERROR(MID(RC[-6],SEARCH("-1",RC[-6])+2,10),IFERROR(MID(RC[-6],SEARCH("-",RC[-6])+1,10),))))))))))) -> 红颅鬼 | I116: ="1"&VLOOKUP(RC[-1],Sheet1!R2C2:R127C3,2,FALSE) -> 130998 | J116: 130998 | K116: =IFERROR(FIND(13,RC[-4],1),"") -> 17 | L116: =IF(RC[-1]="","",MID(RC[-5],RC[-1],6)) -> 130998 | M116: =SUBSTITUTE(RC[-6],RC[-1],RC[-3],1) -> "随我到深渊里去吧！——"|3#1309984|1
A117: 19202 | B117: 无尽-独眼巨人 | D117: 1 | E117: =MID(RC[-4],1,3)&"|30" -> 192|30 | F117: 3|1 | G117: "你们也尝尝这滋味！"|3#1319994|1 | H117: =IFERROR(MID(RC[-6],SEARCH("-10",RC[-6])+3,10),IFERROR(MID(RC[-6],SEARCH("-9",RC[-6])+2,10),IFERROR(MID(RC[-6],SEARCH("-8",RC[-6])+2,10),IFERROR(MID(RC[-6],SEARCH("-7",RC[-6])+2,10),IFERROR(MID(RC[-6],SEARCH("-6",RC[-6])+2,10),IFERROR(MID(RC[-6],SEARCH("-5",RC[-6])+2,10),IFERROR(MID(RC[-6],SEARCH("-4",RC[-6])+2,10),IFERROR(MID(RC[-6],SEARCH("-3",RC[-6])+2,10),IFERROR(MID(RC[-6],SEARCH("-2",RC[-6])+2,10),IFERROR(MID(RC[-6],SEARCH("-1",RC[-6])+2,10),IFERROR(MID(RC[-6],SEARCH("-",RC[-6])+1,10),))))))))))) -> 独眼巨人 | I117: ="1"&VLOOKUP(RC[-1],Sheet1!R2C2:R127C3,2,FALSE) -> 131999 | J117: 131999 | K117: =IFERROR(FIND(13,RC[-4],1),"") -> 15 | L117: =IF(RC[-1]="","",MID(RC[-5],RC[-1],6)) -> 131999 | M117: =SUBSTITUTE(RC[-6],RC[-1],RC[-3],1) -> "你们也尝尝这滋味！"|3#1319994|1
A118: 19302 | B118: 无尽-憎恶 | D118: 1 | E118: =MID(RC[-4],1,3)&"|30" -> 193|30 | F118: 3|1 | G118: "美妙的血肉——"|3#1329994|1 | H118: =IFERROR(MID(RC[-6],SEARCH("-10",RC[-6])+3,10),IFERROR(MID(RC[-6],SEARCH("-9",RC[-6])+2,10),IFERROR(MID(RC[-6],SEARCH("-8",RC[-6])+2,10),IFERROR(MID(RC[-6],SEARCH("-7",RC[-6])+2,10),IFERROR(MID(RC[-6],SEARCH("-6",RC[-6])+2,10),IFERROR(MID(RC[-6],SEARCH("-5",RC[-6])+2,10),IFERROR(MID(RC[-6],SEARCH("-4",RC[-6])+2,10),IFERROR(MID(RC[-6],SEARCH("-3",RC[-6])+2,10),IFERROR(MID(RC[-6],SEARCH("-2",RC[-6])+2,10),IFERROR(MID(RC[-6],SEARCH("-1",RC[-6])+2,10),IFERROR(MID(RC[-6],SEARCH("-",RC[-6])+1,10),))))))))))) -> 憎恶 | I118: ="1"&VLOOKUP(RC[-1],Sheet1!R2C2:R127C3,2,FALSE) -> 132999 | J118: 132999 | K118: =IFERROR(FIND(13,RC[-4],1),"") -> 13 | L118: =IF(RC[-1]="","",MID(RC[-5],RC[-1],6)) -> 132999 | M118: =SUBSTITUTE(RC[-6],RC[-1],RC[-3],1) -> "美妙的血肉——"|3#1329994|1
A119: 19402 | B119: 无尽-大地泰坦 | D119: 1 | E119: =MID(RC[-4],1,3)&"|30" -> 194|30 | F119: 3|1 | G119: "随大地一起崩塌吧！"|3#1339994|1 | H119: =IFERROR(MID(RC[-6],SEARCH("-10",RC[-6])+3,10),IFERROR(MID(RC[-6],SEARCH("-9",RC[-6])+2,10),IFERROR(MID(RC[-6],SEARCH("-8",RC[-6])+2,10),IFERROR(MID(RC[-6],SEARCH("-7",RC[-6])+2,10),IFERROR(MID(RC[-6],SEARCH("-6",RC[-6])+2,10),IFERROR(MID(RC[-6],SEARCH("-5",RC[-6])+2,10),IFERROR(MID(RC[-6],SEARCH("-4",RC[-6])+2,10),IFERROR(MID(RC[-6],SEARCH("-3",RC[-6])+2,10),IFERROR(MID(RC[-6],SEARCH("-2",RC[-6])+2,10),IFERROR(MID(RC[-6],SEARCH("-1",RC[-6])+2,10),IFERROR(MID(RC[-6],SEARCH("-",RC[-6])+1,10),))))))))))) -> 大地泰坦 | I119: ="1"&VLOOKUP(RC[-1],Sheet1!R2C2:R127C3,2,FALSE) -> 133999 | J119: 133999 | K119: =IFERROR(FIND(13,RC[-4],1),"") -> 15 | L119: =IF(RC[-1]="","",MID(RC[-5],RC[-1],6)) -> 133999 | M119: =SUBSTITUTE(RC[-6],RC[-1],RC[-3],1) -> "随大地一起崩塌吧！"|3#1339994|1
A120: 19502 | B120: 无尽-战争主宰 | D120: 1 | E120: =MID(RC[-4],1,3)&"|30" -> 195|30 | F120: 3|1 | G120: "你们的失败已经注定——"|3#1339984|1 | H120: =IFERROR(MID(RC[-6],SEARCH("-10",RC[-6])+3,10),IFERROR(MID(RC[-6],SEARCH("-9",RC[-6])+2,10),IFERROR(MID(RC[-6],SEARCH("-8",RC[-6])+2,10),IFERROR(MID(RC[-6],SEARCH("-7",RC[-6])+2,10),IFERROR(MID(RC[-6],SEARCH("-6",RC[-6])+2,10),IFERROR(MID(RC[-6],SEARCH("-5",RC[-6])+2,10),IFERROR(MID(RC[-6],SEARCH("-4",RC[-6])+2,10),IFERROR(MID(RC[-6],SEARCH("-3",RC[-6])+2,10),IFERROR(MID(RC[-6],SEARCH("-2",RC[-6])+2,10),IFERROR(MID(RC[-6],SEARCH("-1",RC[-6])+2,10),IFERROR(MID(RC[-6],SEARCH("-",RC[-6])+1,10),))))))))))) -> 战争主宰 | I120: ="1"&VLOOKUP(RC[-1],Sheet1!R2C2:R127C3,2,FALSE) -> 133998 | J120: 133998 | K120: =IFERROR(FIND(13,RC[-4],1),"") -> 17 | L120: =IF(RC[-1]="","",MID(RC[-5],RC[-1],6)) -> 133998 | M120: =SUBSTITUTE(RC[-6],RC[-1],RC[-3],1) -> "你们的失败已经注定——"|3#1339984|1
A121: 995101 | B121: 叛军-钢铁酋长 | D121: 2 | E121: 15 | F121: 3|1 | G121: "你的挠痒痒让我感觉很无聊"|3#325109|1 | H121: =IFERROR(MID(RC[-6],SEARCH("-10",RC[-6])+3,10),IFERROR(MID(RC[-6],SEARCH("-9",RC[-6])+2,10),IFERROR(MID(RC[-6],SEARCH("-8",RC[-6])+2,10),IFERROR(MID(RC[-6],SEARCH("-7",RC[-6])+2,10),IFERROR(MID(RC[-6],SEARCH("-6",RC[-6])+2,10),IFERROR(MID(RC[-6],SEARCH("-5",RC[-6])+2,10),IFERROR(MID(RC[-6],SEARCH("-4",RC[-6])+2,10),IFERROR(MID(RC[-6],SEARCH("-3",RC[-6])+2,10),IFERROR(MID(RC[-6],SEARCH("-2",RC[-6])+2,10),IFERROR(MID(RC[-6],SEARCH("-1",RC[-6])+2,10),IFERROR(MID(RC[-6],SEARCH("-",RC[-6])+1,10),))))))))))) -> 钢铁酋长 | I121: ="1"&VLOOKUP(RC[-1],Sheet1!R2C2:R127C3,2,FALSE) -> 132510 | J121: 132510 | K121: =IFERROR(FIND(13,RC[-4],1),"") ->  | L121: =IF(RC[-1]="","",MID(RC[-5],RC[-1],6)) ->  | M121: =SUBSTITUTE(RC[-6],RC[-1],RC[-3],1) -> "你的挠痒痒让我感觉很无聊"|3#325109|1 | N121: =IFERROR(FIND("#3",RC[-7],1),"") -> 17 | O121: =IF(RC[-1]="","",MID(RC[-8],RC[-1]+1,5)) -> 32510 | P121: =VLOOKUP(RC[-8],Sheet1!R2C2:R127C3,2,FALSE) -> 32510 | Q121: =SUBSTITUTE(RC[-10],RC[-2],RC[-1],1) -> "你的挠痒痒让我感觉很无聊"|3#325109|1
A122: 995201 | B122: 叛军-恶魔猎手 | D122: 2 | E122: 15 | F122: 3|1 | G122: "我已经给了你充足的时间……"|3#324099|1 | H122: =IFERROR(MID(RC[-6],SEARCH("-10",RC[-6])+3,10),IFERROR(MID(RC[-6],SEARCH("-9",RC[-6])+2,10),IFERROR(MID(RC[-6],SEARCH("-8",RC[-6])+2,10),IFERROR(MID(RC[-6],SEARCH("-7",RC[-6])+2,10),IFERROR(MID(RC[-6],SEARCH("-6",RC[-6])+2,10),IFERROR(MID(RC[-6],SEARCH("-5",RC[-6])+2,10),IFERROR(MID(RC[-6],SEARCH("-4",RC[-6])+2,10),IFERROR(MID(RC[-6],SEARCH("-3",RC[-6])+2,10),IFERROR(MID(RC[-6],SEARCH("-2",RC[-6])+2,10),IFERROR(MID(RC[-6],SEARCH("-1",RC[-6])+2,10),IFERROR(MID(RC[-6],SEARCH("-",RC[-6])+1,10),))))))))))) -> 恶魔猎手 | I122: ="1"&VLOOKUP(RC[-1],Sheet1!R2C2:R127C3,2,FALSE) -> 132409 | J122: 132409 | K122: =IFERROR(FIND(13,RC[-4],1),"") ->  | L122: =IF(RC[-1]="","",MID(RC[-5],RC[-1],6)) ->  | M122: =SUBSTITUTE(RC[-6],RC[-1],RC[-3],1) -> "我已经给了你充足的时间……"|3#324099|1 | N122: =IFERROR(FIND("#3",RC[-7],1),"") -> 18 | O122: =IF(RC[-1]="","",MID(RC[-8],RC[-1]+1,5)) -> 32409 | P122: =VLOOKUP(RC[-8],Sheet1!R2C2:R127C3,2,FALSE) -> 32409 | Q122: =SUBSTITUTE(RC[-10],RC[-2],RC[-1],1) -> "我已经给了你充足的时间……"|3#324099|1
A123: 995301 | B123: 叛军-牛头人 | D123: 2 | E123: 15 | F123: 3|1 | G123: "我的怒气爆表了！"|3#324009|1 | H123: =IFERROR(MID(RC[-6],SEARCH("-10",RC[-6])+3,10),IFERROR(MID(RC[-6],SEARCH("-9",RC[-6])+2,10),IFERROR(MID(RC[-6],SEARCH("-8",RC[-6])+2,10),IFERROR(MID(RC[-6],SEARCH("-7",RC[-6])+2,10),IFERROR(MID(RC[-6],SEARCH("-6",RC[-6])+2,10),IFERROR(MID(RC[-6],SEARCH("-5",RC[-6])+2,10),IFERROR(MID(RC[-6],SEARCH("-4",RC[-6])+2,10),IFERROR(MID(RC[-6],SEARCH("-3",RC[-6])+2,10),IFERROR(MID(RC[-6],SEARCH("-2",RC[-6])+2,10),IFERROR(MID(RC[-6],SEARCH("-1",RC[-6])+2,10),IFERROR(MID(RC[-6],SEARCH("-",RC[-6])+1,10),))))))))))) -> 牛头人 | I123: ="1"&VLOOKUP(RC[-1],Sheet1!R2C2:R127C3,2,FALSE) -> 132400 | J123: 132400 | K123: =IFERROR(FIND(13,RC[-4],1),"") ->  | L123: =IF(RC[-1]="","",MID(RC[-5],RC[-1],6)) ->  | M123: =SUBSTITUTE(RC[-6],RC[-1],RC[-3],1) -> "我的怒气爆表了！"|3#324009|1 | N123: =IFERROR(FIND("#3",RC[-7],1),"") -> 13 | O123: =IF(RC[-1]="","",MID(RC[-8],RC[-1]+1,5)) -> 32400 | P123: =VLOOKUP(RC[-8],Sheet1!R2C2:R127C3,2,FALSE) -> 32400 | Q123: =SUBSTITUTE(RC[-10],RC[-2],RC[-1],1) -> "我的怒气爆表了！"|3#324009|1
A124: 995401 | B124: 叛军-小黑 | D124: 2 | E124: 15 | F124: 3|1 | G124: "跟我一起沐浴死亡吧"|3#324289|1 | H124: =IFERROR(MID(RC[-6],SEARCH("-10",RC[-6])+3,10),IFERROR(MID(RC[-6],SEARCH("-9",RC[-6])+2,10),IFERROR(MID(RC[-6],SEARCH("-8",RC[-6])+2,10),IFERROR(MID(RC[-6],SEARCH("-7",RC[-6])+2,10),IFERROR(MID(RC[-6],SEARCH("-6",RC[-6])+2,10),IFERROR(MID(RC[-6],SEARCH("-5",RC[-6])+2,10),IFERROR(MID(RC[-6],SEARCH("-4",RC[-6])+2,10),IFERROR(MID(RC[-6],SEARCH("-3",RC[-6])+2,10),IFERROR(MID(RC[-6],SEARCH("-2",RC[-6])+2,10),IFERROR(MID(RC[-6],SEARCH("-1",RC[-6])+2,10),IFERROR(MID(RC[-6],SEARCH("-",RC[-6])+1,10),))))))))))) -> 小黑 | I124: ="1"&VLOOKUP(RC[-1],Sheet1!R2C2:R127C3,2,FALSE) -> 132428 | J124: 132428 | K124: =IFERROR(FIND(13,RC[-4],1),"") ->  | L124: =IF(RC[-1]="","",MID(RC[-5],RC[-1],6)) ->  | M124: =SUBSTITUTE(RC[-6],RC[-1],RC[-3],1) -> "跟我一起沐浴死亡吧"|3#324289|1 | N124: =IFERROR(FIND("#3",RC[-7],1),"") -> 14 | O124: =IF(RC[-1]="","",MID(RC[-8],RC[-1]+1,5)) -> 32428 | P124: =VLOOKUP(RC[-8],Sheet1!R2C2:R127C3,2,FALSE) -> 32428 | Q124: =SUBSTITUTE(RC[-10],RC[-2],RC[-1],1) -> "跟我一起沐浴死亡吧"|3#324289|1
A125: 995501 | B125: 叛军-火女 | D125: 2 | E125: 15 | F125: 3|1 | G125: "被烧成焦炭吧"|3#324309|1 | H125: =IFERROR(MID(RC[-6],SEARCH("-10",RC[-6])+3,10),IFERROR(MID(RC[-6],SEARCH("-9",RC[-6])+2,10),IFERROR(MID(RC[-6],SEARCH("-8",RC[-6])+2,10),IFERROR(MID(RC[-6],SEARCH("-7",RC[-6])+2,10),IFERROR(MID(RC[-6],SEARCH("-6",RC[-6])+2,10),IFERROR(MID(RC[-6],SEARCH("-5",RC[-6])+2,10),IFERROR(MID(RC[-6],SEARCH("-4",RC[-6])+2,10),IFERROR(MID(RC[-6],SEARCH("-3",RC[-6])+2,10),IFERROR(MID(RC[-6],SEARCH("-2",RC[-6])+2,10),IFERROR(MID(RC[-6],SEARCH("-1",RC[-6])+2,10),IFERROR(MID(RC[-6],SEARCH("-",RC[-6])+1,10),))))))))))) -> 火女 | I125: ="1"&VLOOKUP(RC[-1],Sheet1!R2C2:R127C3,2,FALSE) -> 132430 | J125: 132430 | K125: =IFERROR(FIND(13,RC[-4],1),"") ->  | L125: =IF(RC[-1]="","",MID(RC[-5],RC[-1],6)) ->  | M125: =SUBSTITUTE(RC[-6],RC[-1],RC[-3],1) -> "被烧成焦炭吧"|3#324309|1 | N125: =IFERROR(FIND("#3",RC[-7],1),"") -> 11 | O125: =IF(RC[-1]="","",MID(RC[-8],RC[-1]+1,5)) -> 32430 | P125: =VLOOKUP(RC[-8],Sheet1!R2C2:R127C3,2,FALSE) -> 32430 | Q125: =SUBSTITUTE(RC[-10],RC[-2],RC[-1],1) -> "被烧成焦炭吧"|3#324309|1
A126: 996101 | B126: 叛军-大力神 | D126: 2 | E126: 15 | F126: 3|1 | G126: "这也是试练吗？该结束了！"|3#314199|1 | H126: =IFERROR(MID(RC[-6],SEARCH("-10",RC[-6])+3,10),IFERROR(MID(RC[-6],SEARCH("-9",RC[-6])+2,10),IFERROR(MID(RC[-6],SEARCH("-8",RC[-6])+2,10),IFERROR(MID(RC[-6],SEARCH("-7",RC[-6])+2,10),IFERROR(MID(RC[-6],SEARCH("-6",RC[-6])+2,10),IFERROR(MID(RC[-6],SEARCH("-5",RC[-6])+2,10),IFERROR(MID(RC[-6],SEARCH("-4",RC[-6])+2,10),IFERROR(MID(RC[-6],SEARCH("-3",RC[-6])+2,10),IFERROR(MID(RC[-6],SEARCH("-2",RC[-6])+2,10),IFERROR(MID(RC[-6],SEARCH("-1",RC[-6])+2,10),IFERROR(MID(RC[-6],SEARCH("-",RC[-6])+1,10),))))))))))) -> 大力神 | I126: ="1"&VLOOKUP(RC[-1],Sheet1!R2C2:R127C3,2,FALSE) -> 131419 | J126: 131419 | K126: =IFERROR(FIND(13,RC[-4],1),"") ->  | L126: =IF(RC[-1]="","",MID(RC[-5],RC[-1],6)) ->  | M126: =SUBSTITUTE(RC[-6],RC[-1],RC[-3],1) -> "这也是试练吗？该结束了！"|3#314199|1 | N126: =IFERROR(FIND("#3",RC[-7],1),"") -> 17 | O126: =IF(RC[-1]="","",MID(RC[-8],RC[-1]+1,5)) -> 31419 | P126: =VLOOKUP(RC[-8],Sheet1!R2C2:R127C3,2,FALSE) -> 31419 | Q126: =SUBSTITUTE(RC[-10],RC[-2],RC[-1],1) -> "这也是试练吗？该结束了！"|3#314199|1
A127: 996201 | B127: 叛军-狩猎女神 | D127: 2 | E127: 15 | F127: 3|1 | G127: "狩猎时间到~"|3#314319|1 | H127: =IFERROR(MID(RC[-6],SEARCH("-10",RC[-6])+3,10),IFERROR(MID(RC[-6],SEARCH("-9",RC[-6])+2,10),IFERROR(MID(RC[-6],SEARCH("-8",RC[-6])+2,10),IFERROR(MID(RC[-6],SEARCH("-7",RC[-6])+2,10),IFERROR(MID(RC[-6],SEARCH("-6",RC[-6])+2,10),IFERROR(MID(RC[-6],SEARCH("-5",RC[-6])+2,10),IFERROR(MID(RC[-6],SEARCH("-4",RC[-6])+2,10),IFERROR(MID(RC[-6],SEARCH("-3",RC[-6])+2,10),IFERROR(MID(RC[-6],SEARCH("-2",RC[-6])+2,10),IFERROR(MID(RC[-6],SEARCH("-1",RC[-6])+2,10),IFERROR(MID(RC[-6],SEARCH("-",RC[-6])+1,10),))))))))))) -> 狩猎女神 | I127: ="1"&VLOOKUP(RC[-1],Sheet1!R2C2:R127C3,2,FALSE) -> 131431 | J127: 131431 | K127: =IFERROR(FIND(13,RC[-4],1),"") ->  | L127: =IF(RC[-1]="","",MID(RC[-5],RC[-1],6)) ->  | M127: =SUBSTITUTE(RC[-6],RC[-1],RC[-3],1) -> "狩猎时间到~"|3#314319|1 | N127: =IFERROR(FIND("#3",RC[-7],1),"") -> 11 | O127: =IF(RC[-1]="","",MID(RC[-8],RC[-1]+1,5)) -> 31431 | P127: =VLOOKUP(RC[-8],Sheet1!R2C2:R127C3,2,FALSE) -> 31431 | Q127: =SUBSTITUTE(RC[-10],RC[-2],RC[-1],1) -> "狩猎时间到~"|3#314319|1
A128: 996301 | B128: 叛军-美杜莎 | D128: 2 | E128: 15 | F128: 3|1 | G128: "永远地沉眠吧！"|3#314309|1 | H128: =IFERROR(MID(RC[-6],SEARCH("-10",RC[-6])+3,10),IFERROR(MID(RC[-6],SEARCH("-9",RC[-6])+2,10),IFERROR(MID(RC[-6],SEARCH("-8",RC[-6])+2,10),IFERROR(MID(RC[-6],SEARCH("-7",RC[-6])+2,10),IFERROR(MID(RC[-6],SEARCH("-6",RC[-6])+2,10),IFERROR(MID(RC[-6],SEARCH("-5",RC[-6])+2,10),IFERROR(MID(RC[-6],SEARCH("-4",RC[-6])+2,10),IFERROR(MID(RC[-6],SEARCH("-3",RC[-6])+2,10),IFERROR(MID(RC[-6],SEARCH("-2",RC[-6])+2,10),IFERROR(MID(RC[-6],SEARCH("-1",RC[-6])+2,10),IFERROR(MID(RC[-6],SEARCH("-",RC[-6])+1,10),))))))))))) -> 美杜莎 | I128: ="1"&VLOOKUP(RC[-1],Sheet1!R2C2:R127C3,2,FALSE) -> 131430 | J128: 131430 | K128: =IFERROR(FIND(13,RC[-4],1),"") ->  | L128: =IF(RC[-1]="","",MID(RC[-5],RC[-1],6)) ->  | M128: =SUBSTITUTE(RC[-6],RC[-1],RC[-3],1) -> "永远地沉眠吧！"|3#314309|1 | N128: =IFERROR(FIND("#3",RC[-7],1),"") -> 12 | O128: =IF(RC[-1]="","",MID(RC[-8],RC[-1]+1,5)) -> 31430 | P128: =VLOOKUP(RC[-8],Sheet1!R2C2:R127C3,2,FALSE) -> 31430 | Q128: =SUBSTITUTE(RC[-10],RC[-2],RC[-1],1) -> "永远地沉眠吧！"|3#314309|1
A129: 996401 | B129: 叛军-冥王哈迪斯 | D129: 2 | E129: 15 | F129: 3|1 | G129: "用你的死亡，取悦于我"|3#314399|1 | H129: =IFERROR(MID(RC[-6],SEARCH("-10",RC[-6])+3,10),IFERROR(MID(RC[-6],SEARCH("-9",RC[-6])+2,10),IFERROR(MID(RC[-6],SEARCH("-8",RC[-6])+2,10),IFERROR(MID(RC[-6],SEARCH("-7",RC[-6])+2,10),IFERROR(MID(RC[-6],SEARCH("-6",RC[-6])+2,10),IFERROR(MID(RC[-6],SEARCH("-5",RC[-6])+2,10),IFERROR(MID(RC[-6],SEARCH("-4",RC[-6])+2,10),IFERROR(MID(RC[-6],SEARCH("-3",RC[-6])+2,10),IFERROR(MID(RC[-6],SEARCH("-2",RC[-6])+2,10),IFERROR(MID(RC[-6],SEARCH("-1",RC[-6])+2,10),IFERROR(MID(RC[-6],SEARCH("-",RC[-6])+1,10),))))))))))) -> 冥王哈迪斯 | I129: ="1"&VLOOKUP(RC[-1],Sheet1!R2C2:R127C3,2,FALSE) -> 131439 | J129: 131439 | K129: =IFERROR(FIND(13,RC[-4],1),"") ->  | L129: =IF(RC[-1]="","",MID(RC[-5],RC[-1],6)) ->  | M129: =SUBSTITUTE(RC[-6],RC[-1],RC[-3],1) -> "用你的死亡，取悦于我"|3#314399|1 | N129: =IFERROR(FIND("#3",RC[-7],1),"") -> 15 | O129: =IF(RC[-1]="","",MID(RC[-8],RC[-1]+1,5)) -> 31439 | P129: =VLOOKUP(RC[-8],Sheet1!R2C2:R127C3,2,FALSE) -> 31439 | Q129: =SUBSTITUTE(RC[-10],RC[-2],RC[-1],1) -> "用你的死亡，取悦于我"|3#314399|1
A130: 996501 | B130: 叛军-潘多拉 | D130: 2 | E130: 15 | F130: 3|1 | G130: "灾难啊……是指这样吗？"|3#315309|1 | H130: =IFERROR(MID(RC[-6],SEARCH("-10",RC[-6])+3,10),IFERROR(MID(RC[-6],SEARCH("-9",RC[-6])+2,10),IFERROR(MID(RC[-6],SEARCH("-8",RC[-6])+2,10),IFERROR(MID(RC[-6],SEARCH("-7",RC[-6])+2,10),IFERROR(MID(RC[-6],SEARCH("-6",RC[-6])+2,10),IFERROR(MID(RC[-6],SEARCH("-5",RC[-6])+2,10),IFERROR(MID(RC[-6],SEARCH("-4",RC[-6])+2,10),IFERROR(MID(RC[-6],SEARCH("-3",RC[-6])+2,10),IFERROR(MID(RC[-6],SEARCH("-2",RC[-6])+2,10),IFERROR(MID(RC[-6],SEARCH("-1",RC[-6])+2,10),IFERROR(MID(RC[-6],SEARCH("-",RC[-6])+1,10),))))))))))) -> 潘多拉 | I130: ="1"&VLOOKUP(RC[-1],Sheet1!R2C2:R127C3,2,FALSE) -> 131530 | J130: 131530 | K130: =IFERROR(FIND(13,RC[-4],1),"") ->  | L130: =IF(RC[-1]="","",MID(RC[-5],RC[-1],6)) ->  | M130: =SUBSTITUTE(RC[-6],RC[-1],RC[-3],1) -> "灾难啊……是指这样吗？"|3#315309|1 | N130: =IFERROR(FIND("#3",RC[-7],1),"") -> 16 | O130: =IF(RC[-1]="","",MID(RC[-8],RC[-1]+1,5)) -> 31530 | P130: =VLOOKUP(RC[-8],Sheet1!R2C2:R127C3,2,FALSE) -> 31530 | Q130: =SUBSTITUTE(RC[-10],RC[-2],RC[-1],1) -> "灾难啊……是指这样吗？"|3#315309|1
A131: 997101 | B131: 叛军-黑暗骑士 | D131: 2 | E131: 15 | F131: 3|1 | G131: "我没时间和你们玩闹"|3#305209|1 | H131: =IFERROR(MID(RC[-6],SEARCH("-10",RC[-6])+3,10),IFERROR(MID(RC[-6],SEARCH("-9",RC[-6])+2,10),IFERROR(MID(RC[-6],SEARCH("-8",RC[-6])+2,10),IFERROR(MID(RC[-6],SEARCH("-7",RC[-6])+2,10),IFERROR(MID(RC[-6],SEARCH("-6",RC[-6])+2,10),IFERROR(MID(RC[-6],SEARCH("-5",RC[-6])+2,10),IFERROR(MID(RC[-6],SEARCH("-4",RC[-6])+2,10),IFERROR(MID(RC[-6],SEARCH("-3",RC[-6])+2,10),IFERROR(MID(RC[-6],SEARCH("-2",RC[-6])+2,10),IFERROR(MID(RC[-6],SEARCH("-1",RC[-6])+2,10),IFERROR(MID(RC[-6],SEARCH("-",RC[-6])+1,10),))))))))))) -> 黑暗骑士 | I131: ="1"&VLOOKUP(RC[-1],Sheet1!R2C2:R127C3,2,FALSE) -> 130520 | J131: 130520 | K131: =IFERROR(FIND(13,RC[-4],1),"") ->  | L131: =IF(RC[-1]="","",MID(RC[-5],RC[-1],6)) ->  | M131: =SUBSTITUTE(RC[-6],RC[-1],RC[-3],1) -> "我没时间和你们玩闹"|3#305209|1 | N131: =IFERROR(FIND("#3",RC[-7],1),"") -> 14 | O131: =IF(RC[-1]="","",MID(RC[-8],RC[-1]+1,5)) -> 30520 | P131: =VLOOKUP(RC[-8],Sheet1!R2C2:R127C3,2,FALSE) -> 30520 | Q131: =SUBSTITUTE(RC[-10],RC[-2],RC[-1],1) -> "我没时间和你们玩闹"|3#305209|1
A132: 997201 | B132: 叛军-地狱骑士 | D132: 2 | E132: 15 | F132: 3|1 | G132: "去地狱里忏悔吧！"|3#304039|1 | H132: =IFERROR(MID(RC[-6],SEARCH("-10",RC[-6])+3,10),IFERROR(MID(RC[-6],SEARCH("-9",RC[-6])+2,10),IFERROR(MID(RC[-6],SEARCH("-8",RC[-6])+2,10),IFERROR(MID(RC[-6],SEARCH("-7",RC[-6])+2,10),IFERROR(MID(RC[-6],SEARCH("-6",RC[-6])+2,10),IFERROR(MID(RC[-6],SEARCH("-5",RC[-6])+2,10),IFERROR(MID(RC[-6],SEARCH("-4",RC[-6])+2,10),IFERROR(MID(RC[-6],SEARCH("-3",RC[-6])+2,10),IFERROR(MID(RC[-6],SEARCH("-2",RC[-6])+2,10),IFERROR(MID(RC[-6],SEARCH("-1",RC[-6])+2,10),IFERROR(MID(RC[-6],SEARCH("-",RC[-6])+1,10),))))))))))) -> 地狱骑士 | I132: ="1"&VLOOKUP(RC[-1],Sheet1!R2C2:R127C3,2,FALSE) -> 130403 | J132: 130403 | K132: =IFERROR(FIND(13,RC[-4],1),"") ->  | L132: =IF(RC[-1]="","",MID(RC[-5],RC[-1],6)) ->  | M132: =SUBSTITUTE(RC[-6],RC[-1],RC[-3],1) -> "去地狱里忏悔吧！"|3#304039|1 | N132: =IFERROR(FIND("#3",RC[-7],1),"") -> 13 | O132: =IF(RC[-1]="","",MID(RC[-8],RC[-1]+1,5)) -> 30403 | P132: =VLOOKUP(RC[-8],Sheet1!R2C2:R127C3,2,FALSE) -> 30403 | Q132: =SUBSTITUTE(RC[-10],RC[-2],RC[-1],1) -> "去地狱里忏悔吧！"|3#304039|1
A133: 997301 | B133: 叛军-超级队长 | D133: 2 | E133: 15 | F133: 3|1 | G133: "你们的意志不够坚定"|3#303019|1 | H133: =IFERROR(MID(RC[-6],SEARCH("-10",RC[-6])+3,10),IFERROR(MID(RC[-6],SEARCH("-9",RC[-6])+2,10),IFERROR(MID(RC[-6],SEARCH("-8",RC[-6])+2,10),IFERROR(MID(RC[-6],SEARCH("-7",RC[-6])+2,10),IFERROR(MID(RC[-6],SEARCH("-6",RC[-6])+2,10),IFERROR(MID(RC[-6],SEARCH("-5",RC[-6])+2,10),IFERROR(MID(RC[-6],SEARCH("-4",RC[-6])+2,10),IFERROR(MID(RC[-6],SEARCH("-3",RC[-6])+2,10),IFERROR(MID(RC[-6],SEARCH("-2",RC[-6])+2,10),IFERROR(MID(RC[-6],SEARCH("-1",RC[-6])+2,10),IFERROR(MID(RC[-6],SEARCH("-",RC[-6])+1,10),))))))))))) -> 超级队长 | I133: ="1"&VLOOKUP(RC[-1],Sheet1!R2C2:R127C3,2,FALSE) -> 130301 | J133: 130301 | K133: =IFERROR(FIND(13,RC[-4],1),"") ->  | L133: =IF(RC[-1]="","",MID(RC[-5],RC[-1],6)) ->  | M133: =SUBSTITUTE(RC[-6],RC[-1],RC[-3],1) -> "你们的意志不够坚定"|3#303019|1 | N133: =IFERROR(FIND("#3",RC[-7],1),"") -> 14 | O133: =IF(RC[-1]="","",MID(RC[-8],RC[-1]+1,5)) -> 30301 | P133: =VLOOKUP(RC[-8],Sheet1!R2C2:R127C3,2,FALSE) -> 30301 | Q133: =SUBSTITUTE(RC[-10],RC[-2],RC[-1],1) -> "你们的意志不够坚定"|3#303019|1
A134: 997401 | B134: 叛军-铁人 | D134: 2 | E134: 15 | F134: 3|1 | G134: "接受科技的洗礼！"|3#304289|1 | H134: =IFERROR(MID(RC[-6],SEARCH("-10",RC[-6])+3,10),IFERROR(MID(RC[-6],SEARCH("-9",RC[-6])+2,10),IFERROR(MID(RC[-6],SEARCH("-8",RC[-6])+2,10),IFERROR(MID(RC[-6],SEARCH("-7",RC[-6])+2,10),IFERROR(MID(RC[-6],SEARCH("-6",RC[-6])+2,10),IFERROR(MID(RC[-6],SEARCH("-5",RC[-6])+2,10),IFERROR(MID(RC[-6],SEARCH("-4",RC[-6])+2,10),IFERROR(MID(RC[-6],SEARCH("-3",RC[-6])+2,10),IFERROR(MID(RC[-6],SEARCH("-2",RC[-6])+2,10),IFERROR(MID(RC[-6],SEARCH("-1",RC[-6])+2,10),IFERROR(MID(RC[-6],SEARCH("-",RC[-6])+1,10),))))))))))) -> 铁人 | I134: ="1"&VLOOKUP(RC[-1],Sheet1!R2C2:R127C3,2,FALSE) -> 130428 | J134: 130428 | K134: =IFERROR(FIND(13,RC[-4],1),"") ->  | L134: =IF(RC[-1]="","",MID(RC[-5],RC[-1],6)) ->  | M134: =SUBSTITUTE(RC[-6],RC[-1],RC[-3],1) -> "接受科技的洗礼！"|3#304289|1 | N134: =IFERROR(FIND("#3",RC[-7],1),"") -> 13 | O134: =IF(RC[-1]="","",MID(RC[-8],RC[-1]+1,5)) -> 30428 | P134: =VLOOKUP(RC[-8],Sheet1!R2C2:R127C3,2,FALSE) -> 30428 | Q134: =SUBSTITUTE(RC[-10],RC[-2],RC[-1],1) -> "接受科技的洗礼！"|3#304289|1
A135: 997501 | B135: 叛军-雷神 | D135: 2 | E135: 15 | F135: 3|1 | G135: "这是你们触犯神灵的惩罚"|3#304319|1 | H135: =IFERROR(MID(RC[-6],SEARCH("-10",RC[-6])+3,10),IFERROR(MID(RC[-6],SEARCH("-9",RC[-6])+2,10),IFERROR(MID(RC[-6],SEARCH("-8",RC[-6])+2,10),IFERROR(MID(RC[-6],SEARCH("-7",RC[-6])+2,10),IFERROR(MID(RC[-6],SEARCH("-6",RC[-6])+2,10),IFERROR(MID(RC[-6],SEARCH("-5",RC[-6])+2,10),IFERROR(MID(RC[-6],SEARCH("-4",RC[-6])+2,10),IFERROR(MID(RC[-6],SEARCH("-3",RC[-6])+2,10),IFERROR(MID(RC[-6],SEARCH("-2",RC[-6])+2,10),IFERROR(MID(RC[-6],SEARCH("-1",RC[-6])+2,10),IFERROR(MID(RC[-6],SEARCH("-",RC[-6])+1,10),))))))))))) -> 雷神 | I135: ="1"&VLOOKUP(RC[-1],Sheet1!R2C2:R127C3,2,FALSE) -> 130431 | J135: 130431 | K135: =IFERROR(FIND(13,RC[-4],1),"") ->  | L135: =IF(RC[-1]="","",MID(RC[-5],RC[-1],6)) ->  | M135: =SUBSTITUTE(RC[-6],RC[-1],RC[-3],1) -> "这是你们触犯神灵的惩罚"|3#304319|1 | N135: =IFERROR(FIND("#3",RC[-7],1),"") -> 16 | O135: =IF(RC[-1]="","",MID(RC[-8],RC[-1]+1,5)) -> 30431 | P135: =VLOOKUP(RC[-8],Sheet1!R2C2:R127C3,2,FALSE) -> 30431 | Q135: =SUBSTITUTE(RC[-10],RC[-2],RC[-1],1) -> "这是你们触犯神灵的惩罚"|3#304319|1
A136: 998101 | B136: 叛军-大地泰坦 | D136: 2 | E136: 15 | F136: 3|1 | G136: "大地会重新接纳你们——在你们死后"|3#339999|1 | H136: =IFERROR(MID(RC[-6],SEARCH("-10",RC[-6])+3,10),IFERROR(MID(RC[-6],SEARCH("-9",RC[-6])+2,10),IFERROR(MID(RC[-6],SEARCH("-8",RC[-6])+2,10),IFERROR(MID(RC[-6],SEARCH("-7",RC[-6])+2,10),IFERROR(MID(RC[-6],SEARCH("-6",RC[-6])+2,10),IFERROR(MID(RC[-6],SEARCH("-5",RC[-6])+2,10),IFERROR(MID(RC[-6],SEARCH("-4",RC[-6])+2,10),IFERROR(MID(RC[-6],SEARCH("-3",RC[-6])+2,10),IFERROR(MID(RC[-6],SEARCH("-2",RC[-6])+2,10),IFERROR(MID(RC[-6],SEARCH("-1",RC[-6])+2,10),IFERROR(MID(RC[-6],SEARCH("-",RC[-6])+1,10),))))))))))) -> 大地泰坦 | I136: ="1"&VLOOKUP(RC[-1],Sheet1!R2C2:R127C3,2,FALSE) -> 133999 | J136: 133999 | K136: =IFERROR(FIND(13,RC[-4],1),"") ->  | L136: =IF(RC[-1]="","",MID(RC[-5],RC[-1],6)) ->  | M136: =SUBSTITUTE(RC[-6],RC[-1],RC[-3],1) -> "大地会重新接纳你们——在你们死后"|3#339999|1 | N136: =IFERROR(FIND("#3",RC[-7],1),"") -> 21 | O136: =IF(RC[-1]="","",MID(RC[-8],RC[-1]+1,5)) -> 33999 | P136: =VLOOKUP(RC[-8],Sheet1!R2C2:R127C3,2,FALSE) -> 33999 | Q136: =SUBSTITUTE(RC[-10],RC[-2],RC[-1],1) -> "大地会重新接纳你们——在你们死后"|3#339999|1
A137: 999101 | B137: 叛军-战争主宰 | D137: 2 | E137: 15 | F137: 3|1 | G137: "嗡——清理时间到！"|3#339989|1 | H137: =IFERROR(MID(RC[-6],SEARCH("-10",RC[-6])+3,10),IFERROR(MID(RC[-6],SEARCH("-9",RC[-6])+2,10),IFERROR(MID(RC[-6],SEARCH("-8",RC[-6])+2,10),IFERROR(MID(RC[-6],SEARCH("-7",RC[-6])+2,10),IFERROR(MID(RC[-6],SEARCH("-6",RC[-6])+2,10),IFERROR(MID(RC[-6],SEARCH("-5",RC[-6])+2,10),IFERROR(MID(RC[-6],SEARCH("-4",RC[-6])+2,10),IFERROR(MID(RC[-6],SEARCH("-3",RC[-6])+2,10),IFERROR(MID(RC[-6],SEARCH("-2",RC[-6])+2,10),IFERROR(MID(RC[-6],SEARCH("-1",RC[-6])+2,10),IFERROR(MID(RC[-6],SEARCH("-",RC[-6])+1,10),))))))))))) -> 战争主宰 | I137: ="1"&VLOOKUP(RC[-1],Sheet1!R2C2:R127C3,2,FALSE) -> 133998 | J137: 133998 | K137: =IFERROR(FIND(13,RC[-4],1),"") ->  | L137: =IF(RC[-1]="","",MID(RC[-5],RC[-1],6)) ->  | M137: =SUBSTITUTE(RC[-6],RC[-1],RC[-3],1) -> "嗡——清理时间到！"|3#339989|1 | N137: =IFERROR(FIND("#3",RC[-7],1),"") -> 14 | O137: =IF(RC[-1]="","",MID(RC[-8],RC[-1]+1,5)) -> 33998 | P137: =VLOOKUP(RC[-8],Sheet1!R2C2:R127C3,2,FALSE) -> 33998 | Q137: =SUBSTITUTE(RC[-10],RC[-2],RC[-1],1) -> "嗡——清理时间到！"|3#339989|1
A138: 995101 | B138: 叛军-刀锋猎人 | D138: 2 | E138: 15 | F138: 3|1 | G138: "你的挣扎毫无意义"|3#304029|1 | H138: =IFERROR(MID(RC[-6],SEARCH("-10",RC[-6])+3,10),IFERROR(MID(RC[-6],SEARCH("-9",RC[-6])+2,10),IFERROR(MID(RC[-6],SEARCH("-8",RC[-6])+2,10),IFERROR(MID(RC[-6],SEARCH("-7",RC[-6])+2,10),IFERROR(MID(RC[-6],SEARCH("-6",RC[-6])+2,10),IFERROR(MID(RC[-6],SEARCH("-5",RC[-6])+2,10),IFERROR(MID(RC[-6],SEARCH("-4",RC[-6])+2,10),IFERROR(MID(RC[-6],SEARCH("-3",RC[-6])+2,10),IFERROR(MID(RC[-6],SEARCH("-2",RC[-6])+2,10),IFERROR(MID(RC[-6],SEARCH("-1",RC[-6])+2,10),IFERROR(MID(RC[-6],SEARCH("-",RC[-6])+1,10),))))))))))) -> 刀锋猎人 | I138: ="1"&VLOOKUP(RC[-1],Sheet1!R2C2:R127C3,2,FALSE) -> 130402 | J138: 130402 | K138: =IFERROR(FIND(13,RC[-4],1),"") ->  | L138: =IF(RC[-1]="","",MID(RC[-5],RC[-1],6)) ->  | M138: =SUBSTITUTE(RC[-6],RC[-1],RC[-3],1) -> "你的挣扎毫无意义"|3#304029|1 | N138: =IFERROR(FIND("#3",RC[-7],1),"") -> 13 | O138: =IF(RC[-1]="","",MID(RC[-8],RC[-1]+1,5)) -> 30402 | P138: =VLOOKUP(RC[-8],Sheet1!R2C2:R127C3,2,FALSE) -> 30402 | Q138: =SUBSTITUTE(RC[-10],RC[-2],RC[-1],1) -> "你的挣扎毫无意义"|3#304029|1
A139: 995201 | B139: 叛军-地狱骑士 | D139: 2 | E139: 15 | F139: 3|1 | G139: "去地狱里忏悔吧！"|3#304039|1 | H139: =IFERROR(MID(RC[-6],SEARCH("-10",RC[-6])+3,10),IFERROR(MID(RC[-6],SEARCH("-9",RC[-6])+2,10),IFERROR(MID(RC[-6],SEARCH("-8",RC[-6])+2,10),IFERROR(MID(RC[-6],SEARCH("-7",RC[-6])+2,10),IFERROR(MID(RC[-6],SEARCH("-6",RC[-6])+2,10),IFERROR(MID(RC[-6],SEARCH("-5",RC[-6])+2,10),IFERROR(MID(RC[-6],SEARCH("-4",RC[-6])+2,10),IFERROR(MID(RC[-6],SEARCH("-3",RC[-6])+2,10),IFERROR(MID(RC[-6],SEARCH("-2",RC[-6])+2,10),IFERROR(MID(RC[-6],SEARCH("-1",RC[-6])+2,10),IFERROR(MID(RC[-6],SEARCH("-",RC[-6])+1,10),))))))))))) -> 地狱骑士 | I139: ="1"&VLOOKUP(RC[-1],Sheet1!R2C2:R127C3,2,FALSE) -> 130403 | J139: 130403 | K139: =IFERROR(FIND(13,RC[-4],1),"") ->  | L139: =IF(RC[-1]="","",MID(RC[-5],RC[-1],6)) ->  | M139: =SUBSTITUTE(RC[-6],RC[-1],RC[-3],1) -> "去地狱里忏悔吧！"|3#304039|1 | N139: =IFERROR(FIND("#3",RC[-7],1),"") -> 13 | O139: =IF(RC[-1]="","",MID(RC[-8],RC[-1]+1,5)) -> 30403 | P139: =VLOOKUP(RC[-8],Sheet1!R2C2:R127C3,2,FALSE) -> 30403 | Q139: =SUBSTITUTE(RC[-10],RC[-2],RC[-1],1) -> "去地狱里忏悔吧！"|3#304039|1
A140: 995301 | B140: 叛军-树人 | D140: 2 | E140: 15 | F140: 3|1 | G140: "你们的血肉会滋养大地"|3#304119|1 | H140: =IFERROR(MID(RC[-6],SEARCH("-10",RC[-6])+3,10),IFERROR(MID(RC[-6],SEARCH("-9",RC[-6])+2,10),IFERROR(MID(RC[-6],SEARCH("-8",RC[-6])+2,10),IFERROR(MID(RC[-6],SEARCH("-7",RC[-6])+2,10),IFERROR(MID(RC[-6],SEARCH("-6",RC[-6])+2,10),IFERROR(MID(RC[-6],SEARCH("-5",RC[-6])+2,10),IFERROR(MID(RC[-6],SEARCH("-4",RC[-6])+2,10),IFERROR(MID(RC[-6],SEARCH("-3",RC[-6])+2,10),IFERROR(MID(RC[-6],SEARCH("-2",RC[-6])+2,10),IFERROR(MID(RC[-6],SEARCH("-1",RC[-6])+2,10),IFERROR(MID(RC[-6],SEARCH("-",RC[-6])+1,10),))))))))))) -> 树人 | I140: ="1"&VLOOKUP(RC[-1],Sheet1!R2C2:R127C3,2,FALSE) -> 130411 | J140: 130411 | K140: =IFERROR(FIND(13,RC[-4],1),"") ->  | L140: =IF(RC[-1]="","",MID(RC[-5],RC[-1],6)) ->  | M140: =SUBSTITUTE(RC[-6],RC[-1],RC[-3],1) -> "你们的血肉会滋养大地"|3#304119|1 | N140: =IFERROR(FIND("#3",RC[-7],1),"") -> 15 | O140: =IF(RC[-1]="","",MID(RC[-8],RC[-1]+1,5)) -> 30411 | P140: =VLOOKUP(RC[-8],Sheet1!R2C2:R127C3,2,FALSE) -> 30411 | Q140: =SUBSTITUTE(RC[-10],RC[-2],RC[-1],1) -> "你们的血肉会滋养大地"|3#304119|1
A141: 995401 | B141: 叛军-铁人 | D141: 2 | E141: 15 | F141: 3|1 | G141: "接受科技的洗礼！"|3#304289|1 | H141: =IFERROR(MID(RC[-6],SEARCH("-10",RC[-6])+3,10),IFERROR(MID(RC[-6],SEARCH("-9",RC[-6])+2,10),IFERROR(MID(RC[-6],SEARCH("-8",RC[-6])+2,10),IFERROR(MID(RC[-6],SEARCH("-7",RC[-6])+2,10),IFERROR(MID(RC[-6],SEARCH("-6",RC[-6])+2,10),IFERROR(MID(RC[-6],SEARCH("-5",RC[-6])+2,10),IFERROR(MID(RC[-6],SEARCH("-4",RC[-6])+2,10),IFERROR(MID(RC[-6],SEARCH("-3",RC[-6])+2,10),IFERROR(MID(RC[-6],SEARCH("-2",RC[-6])+2,10),IFERROR(MID(RC[-6],SEARCH("-1",RC[-6])+2,10),IFERROR(MID(RC[-6],SEARCH("-",RC[-6])+1,10),))))))))))) -> 铁人 | I141: ="1"&VLOOKUP(RC[-1],Sheet1!R2C2:R127C3,2,FALSE) -> 130428 | J141: 130428 | K141: =IFERROR(FIND(13,RC[-4],1),"") ->  | L141: =IF(RC[-1]="","",MID(RC[-5],RC[-1],6)) ->  | M141: =SUBSTITUTE(RC[-6],RC[-1],RC[-3],1) -> "接受科技的洗礼！"|3#304289|1 | N141: =IFERROR(FIND("#3",RC[-7],1),"") -> 13 | O141: =IF(RC[-1]="","",MID(RC[-8],RC[-1]+1,5)) -> 30428 | P141: =VLOOKUP(RC[-8],Sheet1!R2C2:R127C3,2,FALSE) -> 30428 | Q141: =SUBSTITUTE(RC[-10],RC[-2],RC[-1],1) -> "接受科技的洗礼！"|3#304289|1
A142: 995501 | B142: 叛军-雷神 | D142: 2 | E142: 15 | F142: 3|1 | G142: "这是你们触犯神灵的惩罚"|3#304319|1 | H142: =IFERROR(MID(RC[-6],SEARCH("-10",RC[-6])+3,10),IFERROR(MID(RC[-6],SEARCH("-9",RC[-6])+2,10),IFERROR(MID(RC[-6],SEARCH("-8",RC[-6])+2,10),IFERROR(MID(RC[-6],SEARCH("-7",RC[-6])+2,10),IFERROR(MID(RC[-6],SEARCH("-6",RC[-6])+2,10),IFERROR(MID(RC[-6],SEARCH("-5",RC[-6])+2,10),IFERROR(MID(RC[-6],SEARCH("-4",RC[-6])+2,10),IFERROR(MID(RC[-6],SEARCH("-3",RC[-6])+2,10),IFERROR(MID(RC[-6],SEARCH("-2",RC[-6])+2,10),IFERROR(MID(RC[-6],SEARCH("-1",RC[-6])+2,10),IFERROR(MID(RC[-6],SEARCH("-",RC[-6])+1,10),))))))))))) -> 雷神 | I142: ="1"&VLOOKUP(RC[-1],Sheet1!R2C2:R127C3,2,FALSE) -> 130431 | J142: 130431 | K142: =IFERROR(FIND(13,RC[-4],1),"") ->  | L142: =IF(RC[-1]="","",MID(RC[-5],RC[-1],6)) ->  | M142: =SUBSTITUTE(RC[-6],RC[-1],RC[-3],1) -> "这是你们触犯神灵的惩罚"|3#304319|1 | N142: =IFERROR(FIND("#3",RC[-7],1),"") -> 16 | O142: =IF(RC[-1]="","",MID(RC[-8],RC[-1]+1,5)) -> 30431 | P142: =VLOOKUP(RC[-8],Sheet1!R2C2:R127C3,2,FALSE) -> 30431 | Q142: =SUBSTITUTE(RC[-10],RC[-2],RC[-1],1) -> "这是你们触犯神灵的惩罚"|3#304319|1
A143: 996101 | B143: 叛军-查理大帝 | D143: 2 | E143: 15 | F143: 3|1 | G143: "我预见了你们的失败，因为我必将胜利！"|3#314029|1 | H143: =IFERROR(MID(RC[-6],SEARCH("-10",RC[-6])+3,10),IFERROR(MID(RC[-6],SEARCH("-9",RC[-6])+2,10),IFERROR(MID(RC[-6],SEARCH("-8",RC[-6])+2,10),IFERROR(MID(RC[-6],SEARCH("-7",RC[-6])+2,10),IFERROR(MID(RC[-6],SEARCH("-6",RC[-6])+2,10),IFERROR(MID(RC[-6],SEARCH("-5",RC[-6])+2,10),IFERROR(MID(RC[-6],SEARCH("-4",RC[-6])+2,10),IFERROR(MID(RC[-6],SEARCH("-3",RC[-6])+2,10),IFERROR(MID(RC[-6],SEARCH("-2",RC[-6])+2,10),IFERROR(MID(RC[-6],SEARCH("-1",RC[-6])+2,10),IFERROR(MID(RC[-6],SEARCH("-",RC[-6])+1,10),))))))))))) -> 查理大帝 | I143: ="1"&VLOOKUP(RC[-1],Sheet1!R2C2:R127C3,2,FALSE) -> 131402 | J143: 131402 | K143: =IFERROR(FIND(13,RC[-4],1),"") ->  | L143: =IF(RC[-1]="","",MID(RC[-5],RC[-1],6)) ->  | M143: =SUBSTITUTE(RC[-6],RC[-1],RC[-3],1) -> "我预见了你们的失败，因为我必将胜利！"|3#314029|1 | N143: =IFERROR(FIND("#3",RC[-7],1),"") -> 23 | O143: =IF(RC[-1]="","",MID(RC[-8],RC[-1]+1,5)) -> 31402 | P143: =VLOOKUP(RC[-8],Sheet1!R2C2:R127C3,2,FALSE) -> 31402 | Q143: =SUBSTITUTE(RC[-10],RC[-2],RC[-1],1) -> "我预见了你们的失败，因为我必将胜利！"|3#314029|1
A144: 996201 | B144: 叛军-德古拉伯爵 | D144: 2 | E144: 15 | F144: 3|1 | G144: "我将剥夺你们的一切！"|3#314019|1 | H144: =IFERROR(MID(RC[-6],SEARCH("-10",RC[-6])+3,10),IFERROR(MID(RC[-6],SEARCH("-9",RC[-6])+2,10),IFERROR(MID(RC[-6],SEARCH("-8",RC[-6])+2,10),IFERROR(MID(RC[-6],SEARCH("-7",RC[-6])+2,10),IFERROR(MID(RC[-6],SEARCH("-6",RC[-6])+2,10),IFERROR(MID(RC[-6],SEARCH("-5",RC[-6])+2,10),IFERROR(MID(RC[-6],SEARCH("-4",RC[-6])+2,10),IFERROR(MID(RC[-6],SEARCH("-3",RC[-6])+2,10),IFERROR(MID(RC[-6],SEARCH("-2",RC[-6])+2,10),IFERROR(MID(RC[-6],SEARCH("-1",RC[-6])+2,10),IFERROR(MID(RC[-6],SEARCH("-",RC[-6])+1,10),))))))))))) -> 德古拉伯爵 | I144: ="1"&VLOOKUP(RC[-1],Sheet1!R2C2:R127C3,2,FALSE) -> 131401 | J144: 131401 | K144: =IFERROR(FIND(13,RC[-4],1),"") ->  | L144: =IF(RC[-1]="","",MID(RC[-5],RC[-1],6)) ->  | M144: =SUBSTITUTE(RC[-6],RC[-1],RC[-3],1) -> "我将剥夺你们的一切！"|3#314019|1 | N144: =IFERROR(FIND("#3",RC[-7],1),"") -> 15 | O144: =IF(RC[-1]="","",MID(RC[-8],RC[-1]+1,5)) -> 31401 | P144: =VLOOKUP(RC[-8],Sheet1!R2C2:R127C3,2,FALSE) -> 31401 | Q144: =SUBSTITUTE(RC[-10],RC[-2],RC[-1],1) -> "我将剥夺你们的一切！"|3#314019|1
A145: 996301 | B145: 叛军-美杜莎 | D145: 2 | E145: 15 | F145: 3|1 | G145: "永远地沉眠吧！"|3#314309|1 | H145: =IFERROR(MID(RC[-6],SEARCH("-10",RC[-6])+3,10),IFERROR(MID(RC[-6],SEARCH("-9",RC[-6])+2,10),IFERROR(MID(RC[-6],SEARCH("-8",RC[-6])+2,10),IFERROR(MID(RC[-6],SEARCH("-7",RC[-6])+2,10),IFERROR(MID(RC[-6],SEARCH("-6",RC[-6])+2,10),IFERROR(MID(RC[-6],SEARCH("-5",RC[-6])+2,10),IFERROR(MID(RC[-6],SEARCH("-4",RC[-6])+2,10),IFERROR(MID(RC[-6],SEARCH("-3",RC[-6])+2,10),IFERROR(MID(RC[-6],SEARCH("-2",RC[-6])+2,10),IFERROR(MID(RC[-6],SEARCH("-1",RC[-6])+2,10),IFERROR(MID(RC[-6],SEARCH("-",RC[-6])+1,10),))))))))))) -> 美杜莎 | I145: ="1"&VLOOKUP(RC[-1],Sheet1!R2C2:R127C3,2,FALSE) -> 131430 | J145: 131430 | K145: =IFERROR(FIND(13,RC[-4],1),"") ->  | L145: =IF(RC[-1]="","",MID(RC[-5],RC[-1],6)) ->  | M145: =SUBSTITUTE(RC[-6],RC[-1],RC[-3],1) -> "永远地沉眠吧！"|3#314309|1 | N145: =IFERROR(FIND("#3",RC[-7],1),"") -> 12 | O145: =IF(RC[-1]="","",MID(RC[-8],RC[-1]+1,5)) -> 31430 | P145: =VLOOKUP(RC[-8],Sheet1!R2C2:R127C3,2,FALSE) -> 31430 | Q145: =SUBSTITUTE(RC[-10],RC[-2],RC[-1],1) -> "永远地沉眠吧！"|3#314309|1
A146: 996401 | B146: 叛军-冥王哈迪斯 | D146: 2 | E146: 15 | F146: 3|1 | G146: "用你的死亡，取悦于我"|3#314399|1 | H146: =IFERROR(MID(RC[-6],SEARCH("-10",RC[-6])+3,10),IFERROR(MID(RC[-6],SEARCH("-9",RC[-6])+2,10),IFERROR(MID(RC[-6],SEARCH("-8",RC[-6])+2,10),IFERROR(MID(RC[-6],SEARCH("-7",RC[-6])+2,10),IFERROR(MID(RC[-6],SEARCH("-6",RC[-6])+2,10),IFERROR(MID(RC[-6],SEARCH("-5",RC[-6])+2,10),IFERROR(MID(RC[-6],SEARCH("-4",RC[-6])+2,10),IFERROR(MID(RC[-6],SEARCH("-3",RC[-6])+2,10),IFERROR(MID(RC[-6],SEARCH("-2",RC[-6])+2,10),IFERROR(MID(RC[-6],SEARCH("-1",RC[-6])+2,10),IFERROR(MID(RC[-6],SEARCH("-",RC[-6])+1,10),))))))))))) -> 冥王哈迪斯 | I146: ="1"&VLOOKUP(RC[-1],Sheet1!R2C2:R127C3,2,FALSE) -> 131439 | J146: 131439 | K146: =IFERROR(FIND(13,RC[-4],1),"") ->  | L146: =IF(RC[-1]="","",MID(RC[-5],RC[-1],6)) ->  | M146: =SUBSTITUTE(RC[-6],RC[-1],RC[-3],1) -> "用你的死亡，取悦于我"|3#314399|1 | N146: =IFERROR(FIND("#3",RC[-7],1),"") -> 15 | O146: =IF(RC[-1]="","",MID(RC[-8],RC[-1]+1,5)) -> 31439 | P146: =VLOOKUP(RC[-8],Sheet1!R2C2:R127C3,2,FALSE) -> 31439 | Q146: =SUBSTITUTE(RC[-10],RC[-2],RC[-1],1) -> "用你的死亡，取悦于我"|3#314399|1
A147: 996501 | B147: 叛军-狩猎女神 | D147: 2 | E147: 15 | F147: 3|1 | G147: "狩猎时间到~"|3#314319|1 | H147: =IFERROR(MID(RC[-6],SEARCH("-10",RC[-6])+3,10),IFERROR(MID(RC[-6],SEARCH("-9",RC[-6])+2,10),IFERROR(MID(RC[-6],SEARCH("-8",RC[-6])+2,10),IFERROR(MID(RC[-6],SEARCH("-7",RC[-6])+2,10),IFERROR(MID(RC[-6],SEARCH("-6",RC[-6])+2,10),IFERROR(MID(RC[-6],SEARCH("-5",RC[-6])+2,10),IFERROR(MID(RC[-6],SEARCH("-4",RC[-6])+2,10),IFERROR(MID(RC[-6],SEARCH("-3",RC[-6])+2,10),IFERROR(MID(RC[-6],SEARCH("-2",RC[-6])+2,10),IFERROR(MID(RC[-6],SEARCH("-1",RC[-6])+2,10),IFERROR(MID(RC[-6],SEARCH("-",RC[-6])+1,10),))))))))))) -> 狩猎女神 | I147: ="1"&VLOOKUP(RC[-1],Sheet1!R2C2:R127C3,2,FALSE) -> 131431 | J147: 131431 | K147: =IFERROR(FIND(13,RC[-4],1),"") ->  | L147: =IF(RC[-1]="","",MID(RC[-5],RC[-1],6)) ->  | M147: =SUBSTITUTE(RC[-6],RC[-1],RC[-3],1) -> "狩猎时间到~"|3#314319|1 | N147: =IFERROR(FIND("#3",RC[-7],1),"") -> 11 | O147: =IF(RC[-1]="","",MID(RC[-8],RC[-1]+1,5)) -> 31431 | P147: =VLOOKUP(RC[-8],Sheet1!R2C2:R127C3,2,FALSE) -> 31431 | Q147: =SUBSTITUTE(RC[-10],RC[-2],RC[-1],1) -> "狩猎时间到~"|3#314319|1
A148: 997101 | B148: 叛军-牛头人 | D148: 2 | E148: 15 | F148: 3|1 | G148: "我的怒气爆表了！"|3#324009|1 | H148: =IFERROR(MID(RC[-6],SEARCH("-10",RC[-6])+3,10),IFERROR(MID(RC[-6],SEARCH("-9",RC[-6])+2,10),IFERROR(MID(RC[-6],SEARCH("-8",RC[-6])+2,10),IFERROR(MID(RC[-6],SEARCH("-7",RC[-6])+2,10),IFERROR(MID(RC[-6],SEARCH("-6",RC[-6])+2,10),IFERROR(MID(RC[-6],SEARCH("-5",RC[-6])+2,10),IFERROR(MID(RC[-6],SEARCH("-4",RC[-6])+2,10),IFERROR(MID(RC[-6],SEARCH("-3",RC[-6])+2,10),IFERROR(MID(RC[-6],SEARCH("-2",RC[-6])+2,10),IFERROR(MID(RC[-6],SEARCH("-1",RC[-6])+2,10),IFERROR(MID(RC[-6],SEARCH("-",RC[-6])+1,10),))))))))))) -> 牛头人 | I148: ="1"&VLOOKUP(RC[-1],Sheet1!R2C2:R127C3,2,FALSE) -> 132400 | J148: 132400 | K148: =IFERROR(FIND(13,RC[-4],1),"") ->  | L148: =IF(RC[-1]="","",MID(RC[-5],RC[-1],6)) ->  | M148: =SUBSTITUTE(RC[-6],RC[-1],RC[-3],1) -> "我的怒气爆表了！"|3#324009|1 | N148: =IFERROR(FIND("#3",RC[-7],1),"") -> 13 | O148: =IF(RC[-1]="","",MID(RC[-8],RC[-1]+1,5)) -> 32400 | P148: =VLOOKUP(RC[-8],Sheet1!R2C2:R127C3,2,FALSE) -> 32400 | Q148: =SUBSTITUTE(RC[-10],RC[-2],RC[-1],1) -> "我的怒气爆表了！"|3#324009|1
A149: 997201 | B149: 叛军-血色指挥官 | D149: 2 | E149: 15 | F149: 3|1 | G149: "感受这光芒！"|3#324089|1 | H149: =IFERROR(MID(RC[-6],SEARCH("-10",RC[-6])+3,10),IFERROR(MID(RC[-6],SEARCH("-9",RC[-6])+2,10),IFERROR(MID(RC[-6],SEARCH("-8",RC[-6])+2,10),IFERROR(MID(RC[-6],SEARCH("-7",RC[-6])+2,10),IFERROR(MID(RC[-6],SEARCH("-6",RC[-6])+2,10),IFERROR(MID(RC[-6],SEARCH("-5",RC[-6])+2,10),IFERROR(MID(RC[-6],SEARCH("-4",RC[-6])+2,10),IFERROR(MID(RC[-6],SEARCH("-3",RC[-6])+2,10),IFERROR(MID(RC[-6],SEARCH("-2",RC[-6])+2,10),IFERROR(MID(RC[-6],SEARCH("-1",RC[-6])+2,10),IFERROR(MID(RC[-6],SEARCH("-",RC[-6])+1,10),))))))))))) -> 血色指挥官 | I149: ="1"&VLOOKUP(RC[-1],Sheet1!R2C2:R127C3,2,FALSE) -> 132408 | J149: 132408 | K149: =IFERROR(FIND(13,RC[-4],1),"") ->  | L149: =IF(RC[-1]="","",MID(RC[-5],RC[-1],6)) ->  | M149: =SUBSTITUTE(RC[-6],RC[-1],RC[-3],1) -> "感受这光芒！"|3#324089|1 | N149: =IFERROR(FIND("#3",RC[-7],1),"") -> 11 | O149: =IF(RC[-1]="","",MID(RC[-8],RC[-1]+1,5)) -> 32408 | P149: =VLOOKUP(RC[-8],Sheet1!R2C2:R127C3,2,FALSE) -> 32408 | Q149: =SUBSTITUTE(RC[-10],RC[-2],RC[-1],1) -> "感受这光芒！"|3#324089|1
A150: 997301 | B150: 叛军-熊阿宝 | D150: 2 | E150: 15 | F150: 3|1 | G150: "什么叫碾压性的优势？"|3#324129|1 | H150: =IFERROR(MID(RC[-6],SEARCH("-10",RC[-6])+3,10),IFERROR(MID(RC[-6],SEARCH("-9",RC[-6])+2,10),IFERROR(MID(RC[-6],SEARCH("-8",RC[-6])+2,10),IFERROR(MID(RC[-6],SEARCH("-7",RC[-6])+2,10),IFERROR(MID(RC[-6],SEARCH("-6",RC[-6])+2,10),IFERROR(MID(RC[-6],SEARCH("-5",RC[-6])+2,10),IFERROR(MID(RC[-6],SEARCH("-4",RC[-6])+2,10),IFERROR(MID(RC[-6],SEARCH("-3",RC[-6])+2,10),IFERROR(MID(RC[-6],SEARCH("-2",RC[-6])+2,10),IFERROR(MID(RC[-6],SEARCH("-1",RC[-6])+2,10),IFERROR(MID(RC[-6],SEARCH("-",RC[-6])+1,10),))))))))))) -> 熊阿宝 | I150: ="1"&VLOOKUP(RC[-1],Sheet1!R2C2:R127C3,2,FALSE) -> 132412 | J150: 132412 | K150: =IFERROR(FIND(13,RC[-4],1),"") ->  | L150: =IF(RC[-1]="","",MID(RC[-5],RC[-1],6)) ->  | M150: =SUBSTITUTE(RC[-6],RC[-1],RC[-3],1) -> "什么叫碾压性的优势？"|3#324129|1 | N150: =IFERROR(FIND("#3",RC[-7],1),"") -> 15 | O150: =IF(RC[-1]="","",MID(RC[-8],RC[-1]+1,5)) -> 32412 | P150: =VLOOKUP(RC[-8],Sheet1!R2C2:R127C3,2,FALSE) -> 32412 | Q150: =SUBSTITUTE(RC[-10],RC[-2],RC[-1],1) -> "什么叫碾压性的优势？"|3#324129|1
A151: 997401 | B151: 叛军-小黑 | D151: 2 | E151: 15 | F151: 3|1 | G151: "跟我一起沐浴死亡吧"|3#324289|1 | H151: =IFERROR(MID(RC[-6],SEARCH("-10",RC[-6])+3,10),IFERROR(MID(RC[-6],SEARCH("-9",RC[-6])+2,10),IFERROR(MID(RC[-6],SEARCH("-8",RC[-6])+2,10),IFERROR(MID(RC[-6],SEARCH("-7",RC[-6])+2,10),IFERROR(MID(RC[-6],SEARCH("-6",RC[-6])+2,10),IFERROR(MID(RC[-6],SEARCH("-5",RC[-6])+2,10),IFERROR(MID(RC[-6],SEARCH("-4",RC[-6])+2,10),IFERROR(MID(RC[-6],SEARCH("-3",RC[-6])+2,10),IFERROR(MID(RC[-6],SEARCH("-2",RC[-6])+2,10),IFERROR(MID(RC[-6],SEARCH("-1",RC[-6])+2,10),IFERROR(MID(RC[-6],SEARCH("-",RC[-6])+1,10),))))))))))) -> 小黑 | I151: ="1"&VLOOKUP(RC[-1],Sheet1!R2C2:R127C3,2,FALSE) -> 132428 | J151: 132428 | K151: =IFERROR(FIND(13,RC[-4],1),"") ->  | L151: =IF(RC[-1]="","",MID(RC[-5],RC[-1],6)) ->  | M151: =SUBSTITUTE(RC[-6],RC[-1],RC[-3],1) -> "跟我一起沐浴死亡吧"|3#324289|1 | N151: =IFERROR(FIND("#3",RC[-7],1),"") -> 14 | O151: =IF(RC[-1]="","",MID(RC[-8],RC[-1]+1,5)) -> 32428 | P151: =VLOOKUP(RC[-8],Sheet1!R2C2:R127C3,2,FALSE) -> 32428 | Q151: =SUBSTITUTE(RC[-10],RC[-2],RC[-1],1) -> "跟我一起沐浴死亡吧"|3#324289|1
A152: 997501 | B152: 叛军-火女 | D152: 2 | E152: 15 | F152: 3|1 | G152: "被烧成焦炭吧"|3#324309|1 | H152: =IFERROR(MID(RC[-6],SEARCH("-10",RC[-6])+3,10),IFERROR(MID(RC[-6],SEARCH("-9",RC[-6])+2,10),IFERROR(MID(RC[-6],SEARCH("-8",RC[-6])+2,10),IFERROR(MID(RC[-6],SEARCH("-7",RC[-6])+2,10),IFERROR(MID(RC[-6],SEARCH("-6",RC[-6])+2,10),IFERROR(MID(RC[-6],SEARCH("-5",RC[-6])+2,10),IFERROR(MID(RC[-6],SEARCH("-4",RC[-6])+2,10),IFERROR(MID(RC[-6],SEARCH("-3",RC[-6])+2,10),IFERROR(MID(RC[-6],SEARCH("-2",RC[-6])+2,10),IFERROR(MID(RC[-6],SEARCH("-1",RC[-6])+2,10),IFERROR(MID(RC[-6],SEARCH("-",RC[-6])+1,10),))))))))))) -> 火女 | I152: ="1"&VLOOKUP(RC[-1],Sheet1!R2C2:R127C3,2,FALSE) -> 132430 | J152: 132430 | K152: =IFERROR(FIND(13,RC[-4],1),"") ->  | L152: =IF(RC[-1]="","",MID(RC[-5],RC[-1],6)) ->  | M152: =SUBSTITUTE(RC[-6],RC[-1],RC[-3],1) -> "被烧成焦炭吧"|3#324309|1 | N152: =IFERROR(FIND("#3",RC[-7],1),"") -> 11 | O152: =IF(RC[-1]="","",MID(RC[-8],RC[-1]+1,5)) -> 32430 | P152: =VLOOKUP(RC[-8],Sheet1!R2C2:R127C3,2,FALSE) -> 32430 | Q152: =SUBSTITUTE(RC[-10],RC[-2],RC[-1],1) -> "被烧成焦炭吧"|3#324309|1
A153: 998101 | B153: 叛军-大地泰坦 | D153: 2 | E153: 15 | F153: 3|1 | G153: "大地会重新接纳你们——在你们死后"|3#339999|1 | H153: =IFERROR(MID(RC[-6],SEARCH("-10",RC[-6])+3,10),IFERROR(MID(RC[-6],SEARCH("-9",RC[-6])+2,10),IFERROR(MID(RC[-6],SEARCH("-8",RC[-6])+2,10),IFERROR(MID(RC[-6],SEARCH("-7",RC[-6])+2,10),IFERROR(MID(RC[-6],SEARCH("-6",RC[-6])+2,10),IFERROR(MID(RC[-6],SEARCH("-5",RC[-6])+2,10),IFERROR(MID(RC[-6],SEARCH("-4",RC[-6])+2,10),IFERROR(MID(RC[-6],SEARCH("-3",RC[-6])+2,10),IFERROR(MID(RC[-6],SEARCH("-2",RC[-6])+2,10),IFERROR(MID(RC[-6],SEARCH("-1",RC[-6])+2,10),IFERROR(MID(RC[-6],SEARCH("-",RC[-6])+1,10),))))))))))) -> 大地泰坦 | I153: ="1"&VLOOKUP(RC[-1],Sheet1!R2C2:R127C3,2,FALSE) -> 133999 | J153: 133999 | K153: =IFERROR(FIND(13,RC[-4],1),"") ->  | L153: =IF(RC[-1]="","",MID(RC[-5],RC[-1],6)) ->  | M153: =SUBSTITUTE(RC[-6],RC[-1],RC[-3],1) -> "大地会重新接纳你们——在你们死后"|3#339999|1 | N153: =IFERROR(FIND("#3",RC[-7],1),"") -> 21 | O153: =IF(RC[-1]="","",MID(RC[-8],RC[-1]+1,5)) -> 33999 | P153: =VLOOKUP(RC[-8],Sheet1!R2C2:R127C3,2,FALSE) -> 33999 | Q153: =SUBSTITUTE(RC[-10],RC[-2],RC[-1],1) -> "大地会重新接纳你们——在你们死后"|3#339999|1
A154: 999101 | B154: 叛军-战争主宰 | D154: 2 | E154: 15 | F154: 3|1 | G154: "嗡——清理时间到！"|3#339989|1 | H154: =IFERROR(MID(RC[-6],SEARCH("-10",RC[-6])+3,10),IFERROR(MID(RC[-6],SEARCH("-9",RC[-6])+2,10),IFERROR(MID(RC[-6],SEARCH("-8",RC[-6])+2,10),IFERROR(MID(RC[-6],SEARCH("-7",RC[-6])+2,10),IFERROR(MID(RC[-6],SEARCH("-6",RC[-6])+2,10),IFERROR(MID(RC[-6],SEARCH("-5",RC[-6])+2,10),IFERROR(MID(RC[-6],SEARCH("-4",RC[-6])+2,10),IFERROR(MID(RC[-6],SEARCH("-3",RC[-6])+2,10),IFERROR(MID(RC[-6],SEARCH("-2",RC[-6])+2,10),IFERROR(MID(RC[-6],SEARCH("-1",RC[-6])+2,10),IFERROR(MID(RC[-6],SEARCH("-",RC[-6])+1,10),))))))))))) -> 战争主宰 | I154: ="1"&VLOOKUP(RC[-1],Sheet1!R2C2:R127C3,2,FALSE) -> 133998 | J154: 133998 | K154: =IFERROR(FIND(13,RC[-4],1),"") ->  | L154: =IF(RC[-1]="","",MID(RC[-5],RC[-1],6)) ->  | M154: =SUBSTITUTE(RC[-6],RC[-1],RC[-3],1) -> "嗡——清理时间到！"|3#339989|1 | N154: =IFERROR(FIND("#3",RC[-7],1),"") -> 14 | O154: =IF(RC[-1]="","",MID(RC[-8],RC[-1]+1,5)) -> 33998 | P154: =VLOOKUP(RC[-8],Sheet1!R2C2:R127C3,2,FALSE) -> 33998 | Q154: =SUBSTITUTE(RC[-10],RC[-2],RC[-1],1) -> "嗡——清理时间到！"|3#339989|1
A155: 60035401 | B155: 英雄副本3-5狩猎女神 | D155: 1 | E155: 600354|80 | F155: 3|1 | G155: "月之影就此降临——"|3#400048|1 | H155: =IFERROR(MID(RC[-6],SEARCH("-10",RC[-6])+3,10),IFERROR(MID(RC[-6],SEARCH("-9",RC[-6])+2,10),IFERROR(MID(RC[-6],SEARCH("-8",RC[-6])+2,10),IFERROR(MID(RC[-6],SEARCH("-7",RC[-6])+2,10),IFERROR(MID(RC[-6],SEARCH("-6",RC[-6])+2,10),IFERROR(MID(RC[-6],SEARCH("-5",RC[-6])+2,10),IFERROR(MID(RC[-6],SEARCH("-4",RC[-6])+2,10),IFERROR(MID(RC[-6],SEARCH("-3",RC[-6])+2,10),IFERROR(MID(RC[-6],SEARCH("-2",RC[-6])+2,10),IFERROR(MID(RC[-6],SEARCH("-1",RC[-6])+2,10),IFERROR(MID(RC[-6],SEARCH("-",RC[-6])+1,10),))))))))))) -> 狩猎女神 | I155: ="1"&VLOOKUP(RC[-1],Sheet1!R2C2:R127C3,2,FALSE) -> 131431 | J155: 131431 | K155: =IFERROR(FIND(13,RC[-4],1),"") ->  | L155: =IF(RC[-1]="","",MID(RC[-5],RC[-1],6)) ->  | M155: =SUBSTITUTE(RC[-6],RC[-1],RC[-3],1) -> "月之影就此降临——"|3#400048|1 | N155: =IFERROR(FIND("#3",RC[-7],1),"") ->  | O155: =IF(RC[-1]="","",MID(RC[-8],RC[-1]+1,5)) ->  | P155: =VLOOKUP(RC[-8],Sheet1!R2C2:R127C3,2,FALSE) -> 31431 | Q155: =SUBSTITUTE(RC[-10],RC[-2],RC[-1],1) -> "月之影就此降临——"|3#400048|1
A156: 60035402 | B156: 英雄副本3-5狩猎女神 | D156: 1 | E156: 600354|50 | F156: 3|1 | G156: "你无处可逃……"|3#400048|1 | H156: =IFERROR(MID(RC[-6],SEARCH("-10",RC[-6])+3,10),IFERROR(MID(RC[-6],SEARCH("-9",RC[-6])+2,10),IFERROR(MID(RC[-6],SEARCH("-8",RC[-6])+2,10),IFERROR(MID(RC[-6],SEARCH("-7",RC[-6])+2,10),IFERROR(MID(RC[-6],SEARCH("-6",RC[-6])+2,10),IFERROR(MID(RC[-6],SEARCH("-5",RC[-6])+2,10),IFERROR(MID(RC[-6],SEARCH("-4",RC[-6])+2,10),IFERROR(MID(RC[-6],SEARCH("-3",RC[-6])+2,10),IFERROR(MID(RC[-6],SEARCH("-2",RC[-6])+2,10),IFERROR(MID(RC[-6],SEARCH("-1",RC[-6])+2,10),IFERROR(MID(RC[-6],SEARCH("-",RC[-6])+1,10),))))))))))) -> 狩猎女神 | I156: ="1"&VLOOKUP(RC[-1],Sheet1!R2C2:R127C3,2,FALSE) -> 131431 | J156: 131431 | K156: =IFERROR(FIND(13,RC[-4],1),"") ->  | L156: =IF(RC[-1]="","",MID(RC[-5],RC[-1],6)) ->  | M156: =SUBSTITUTE(RC[-6],RC[-1],RC[-3],1) -> "你无处可逃……"|3#400048|1 | N156: =IFERROR(FIND("#3",RC[-7],1),"") ->  | O156: =IF(RC[-1]="","",MID(RC[-8],RC[-1]+1,5)) ->  | P156: =VLOOKUP(RC[-8],Sheet1!R2C2:R127C3,2,FALSE) -> 31431 | Q156: =SUBSTITUTE(RC[-10],RC[-2],RC[-1],1) -> "你无处可逃……"|3#400048|1
A157: 60035403 | B157: 英雄副本3-5狩猎女神 | D157: 1 | E157: 600354|20 | F157: 3|1 | G157: "真是个烦人的家伙"|3#400048|1 | H157: =IFERROR(MID(RC[-6],SEARCH("-10",RC[-6])+3,10),IFERROR(MID(RC[-6],SEARCH("-9",RC[-6])+2,10),IFERROR(MID(RC[-6],SEARCH("-8",RC[-6])+2,10),IFERROR(MID(RC[-6],SEARCH("-7",RC[-6])+2,10),IFERROR(MID(RC[-6],SEARCH("-6",RC[-6])+2,10),IFERROR(MID(RC[-6],SEARCH("-5",RC[-6])+2,10),IFERROR(MID(RC[-6],SEARCH("-4",RC[-6])+2,10),IFERROR(MID(RC[-6],SEARCH("-3",RC[-6])+2,10),IFERROR(MID(RC[-6],SEARCH("-2",RC[-6])+2,10),IFERROR(MID(RC[-6],SEARCH("-1",RC[-6])+2,10),IFERROR(MID(RC[-6],SEARCH("-",RC[-6])+1,10),))))))))))) -> 狩猎女神 | I157: ="1"&VLOOKUP(RC[-1],Sheet1!R2C2:R127C3,2,FALSE) -> 131431 | J157: 131431 | K157: =IFERROR(FIND(13,RC[-4],1),"") ->  | L157: =IF(RC[-1]="","",MID(RC[-5],RC[-1],6)) ->  | M157: =SUBSTITUTE(RC[-6],RC[-1],RC[-3],1) -> "真是个烦人的家伙"|3#400048|1 | N157: =IFERROR(FIND("#3",RC[-7],1),"") ->  | O157: =IF(RC[-1]="","",MID(RC[-8],RC[-1]+1,5)) ->  | P157: =VLOOKUP(RC[-8],Sheet1!R2C2:R127C3,2,FALSE) -> 31431 | Q157: =SUBSTITUTE(RC[-10],RC[-2],RC[-1],1) -> "真是个烦人的家伙"|3#400048|1
A158: 60035404 | B158: 英雄副本3-5狩猎女神 | D158: 6 | F158: 3|1 | G158: "继续在月光下起舞吧，那伴随着死亡的舞蹈！"|3#400048|1 | H158: =IFERROR(MID(RC[-6],SEARCH("-10",RC[-6])+3,10),IFERROR(MID(RC[-6],SEARCH("-9",RC[-6])+2,10),IFERROR(MID(RC[-6],SEARCH("-8",RC[-6])+2,10),IFERROR(MID(RC[-6],SEARCH("-7",RC[-6])+2,10),IFERROR(MID(RC[-6],SEARCH("-6",RC[-6])+2,10),IFERROR(MID(RC[-6],SEARCH("-5",RC[-6])+2,10),IFERROR(MID(RC[-6],SEARCH("-4",RC[-6])+2,10),IFERROR(MID(RC[-6],SEARCH("-3",RC[-6])+2,10),IFERROR(MID(RC[-6],SEARCH("-2",RC[-6])+2,10),IFERROR(MID(RC[-6],SEARCH("-1",RC[-6])+2,10),IFERROR(MID(RC[-6],SEARCH("-",RC[-6])+1,10),))))))))))) -> 狩猎女神 | I158: ="1"&VLOOKUP(RC[-1],Sheet1!R2C2:R127C3,2,FALSE) -> 131431 | J158: 131431 | K158: =IFERROR(FIND(13,RC[-4],1),"") ->  | L158: =IF(RC[-1]="","",MID(RC[-5],RC[-1],6)) ->  | M158: =SUBSTITUTE(RC[-6],RC[-1],RC[-3],1) -> "继续在月光下起舞吧，那伴随着死亡的舞蹈！"|3#400048|1 | N158: =IFERROR(FIND("#3",RC[-7],1),"") ->  | O158: =IF(RC[-1]="","",MID(RC[-8],RC[-1]+1,5)) ->  | P158: =VLOOKUP(RC[-8],Sheet1!R2C2:R127C3,2,FALSE) -> 31431 | Q158: =SUBSTITUTE(RC[-10],RC[-2],RC[-1],1) -> "继续在月光下起舞吧，那伴随着死亡的舞蹈！"|3#400048|1
A159: 60065101 | B159: 英雄副本6-5血色指挥官 | D159: 4 | F159: 3|1 | G159: "这也是救赎，对于我的"|3#1324084|1 | H159: =IFERROR(MID(RC[-6],SEARCH("-10",RC[-6])+3,10),IFERROR(MID(RC[-6],SEARCH("-9",RC[-6])+2,10),IFERROR(MID(RC[-6],SEARCH("-8",RC[-6])+2,10),IFERROR(MID(RC[-6],SEARCH("-7",RC[-6])+2,10),IFERROR(MID(RC[-6],SEARCH("-6",RC[-6])+2,10),IFERROR(MID(RC[-6],SEARCH("-5",RC[-6])+2,10),IFERROR(MID(RC[-6],SEARCH("-4",RC[-6])+2,10),IFERROR(MID(RC[-6],SEARCH("-3",RC[-6])+2,10),IFERROR(MID(RC[-6],SEARCH("-2",RC[-6])+2,10),IFERROR(MID(RC[-6],SEARCH("-1",RC[-6])+2,10),IFERROR(MID(RC[-6],SEARCH("-",RC[-6])+1,10),))))))))))) -> 血色指挥官 | I159: ="1"&VLOOKUP(RC[-1],Sheet1!R2C2:R127C3,2,FALSE) -> 132408 | J159: 132408 | K159: =IFERROR(FIND(13,RC[-4],1),"") -> 16 | L159: =IF(RC[-1]="","",MID(RC[-5],RC[-1],6)) -> 132408 | M159: =SUBSTITUTE(RC[-6],RC[-1],RC[-3],1) -> "这也是救赎，对于我的"|3#1324084|1
A160: 60065102 | B160: 英雄副本6-5血色指挥官 | D160: 2 | E160: 12 | F160: 3|1 | G160: "每个人都需要被拯救，被需要，还有，被杀死"|5#1324084|1 | H160: =IFERROR(MID(RC[-6],SEARCH("-10",RC[-6])+3,10),IFERROR(MID(RC[-6],SEARCH("-9",RC[-6])+2,10),IFERROR(MID(RC[-6],SEARCH("-8",RC[-6])+2,10),IFERROR(MID(RC[-6],SEARCH("-7",RC[-6])+2,10),IFERROR(MID(RC[-6],SEARCH("-6",RC[-6])+2,10),IFERROR(MID(RC[-6],SEARCH("-5",RC[-6])+2,10),IFERROR(MID(RC[-6],SEARCH("-4",RC[-6])+2,10),IFERROR(MID(RC[-6],SEARCH("-3",RC[-6])+2,10),IFERROR(MID(RC[-6],SEARCH("-2",RC[-6])+2,10),IFERROR(MID(RC[-6],SEARCH("-1",RC[-6])+2,10),IFERROR(MID(RC[-6],SEARCH("-",RC[-6])+1,10),))))))))))) -> 血色指挥官 | I160: ="1"&VLOOKUP(RC[-1],Sheet1!R2C2:R127C3,2,FALSE) -> 132408 | J160: 132408 | K160: =IFERROR(FIND(13,RC[-4],1),"") -> 26 | L160: =IF(RC[-1]="","",MID(RC[-5],RC[-1],6)) -> 132408 | M160: =SUBSTITUTE(RC[-6],RC[-1],RC[-3],1) -> "每个人都需要被拯救，被需要，还有，被杀死"|5#1324084|1
A161: 60065103 | B161: 英雄副本6-5血色指挥官 | D161: 2 | E161: 20 | F161: 3|1 | G161: "就像现在，我需要一场鲜血的洗礼，一场自我的救赎"|5#1324084|1 | H161: =IFERROR(MID(RC[-6],SEARCH("-10",RC[-6])+3,10),IFERROR(MID(RC[-6],SEARCH("-9",RC[-6])+2,10),IFERROR(MID(RC[-6],SEARCH("-8",RC[-6])+2,10),IFERROR(MID(RC[-6],SEARCH("-7",RC[-6])+2,10),IFERROR(MID(RC[-6],SEARCH("-6",RC[-6])+2,10),IFERROR(MID(RC[-6],SEARCH("-5",RC[-6])+2,10),IFERROR(MID(RC[-6],SEARCH("-4",RC[-6])+2,10),IFERROR(MID(RC[-6],SEARCH("-3",RC[-6])+2,10),IFERROR(MID(RC[-6],SEARCH("-2",RC[-6])+2,10),IFERROR(MID(RC[-6],SEARCH("-1",RC[-6])+2,10),IFERROR(MID(RC[-6],SEARCH("-",RC[-6])+1,10),))))))))))) -> 血色指挥官 | I161: ="1"&VLOOKUP(RC[-1],Sheet1!R2C2:R127C3,2,FALSE) -> 132408 | J161: 132408 | K161: =IFERROR(FIND(13,RC[-4],1),"") -> 29 | L161: =IF(RC[-1]="","",MID(RC[-5],RC[-1],6)) -> 132408 | M161: =SUBSTITUTE(RC[-6],RC[-1],RC[-3],1) -> "就像现在，我需要一场鲜血的洗礼，一场自我的救赎"|5#1324084|1
A162: 60065104 | B162: 英雄副本6-5血色指挥官 | D162: 3 | F162: 3 | G162: "但愿鲜血奔腾在你的心灵，却从不积郁于双眼……这也算，一次拯救的尝试，对于你我的"|4 | H162: =IFERROR(MID(RC[-6],SEARCH("-10",RC[-6])+3,10),IFERROR(MID(RC[-6],SEARCH("-9",RC[-6])+2,10),IFERROR(MID(RC[-6],SEARCH("-8",RC[-6])+2,10),IFERROR(MID(RC[-6],SEARCH("-7",RC[-6])+2,10),IFERROR(MID(RC[-6],SEARCH("-6",RC[-6])+2,10),IFERROR(MID(RC[-6],SEARCH("-5",RC[-6])+2,10),IFERROR(MID(RC[-6],SEARCH("-4",RC[-6])+2,10),IFERROR(MID(RC[-6],SEARCH("-3",RC[-6])+2,10),IFERROR(MID(RC[-6],SEARCH("-2",RC[-6])+2,10),IFERROR(MID(RC[-6],SEARCH("-1",RC[-6])+2,10),IFERROR(MID(RC[-6],SEARCH("-",RC[-6])+1,10),))))))))))) -> 血色指挥官 | I162: ="1"&VLOOKUP(RC[-1],Sheet1!R2C2:R127C3,2,FALSE) -> 132408 | J162: 132408 | K162: =IFERROR(FIND(13,RC[-4],1),"") ->  | L162: =IF(RC[-1]="","",MID(RC[-5],RC[-1],6)) ->  | M162: =SUBSTITUTE(RC[-6],RC[-1],RC[-3],1) -> "但愿鲜血奔腾在你的心灵，却从不积郁于双眼……这也算，一次拯救的尝试，对于你我的"|4
A163: 60065105 | B163: 英雄副本6-5血色指挥官 | D163: 2 | E163: 28 | F163: 3|1 | G163: "沐浴鲜血之后才能重生"|5#1324084|1 | H163: =IFERROR(MID(RC[-6],SEARCH("-10",RC[-6])+3,10),IFERROR(MID(RC[-6],SEARCH("-9",RC[-6])+2,10),IFERROR(MID(RC[-6],SEARCH("-8",RC[-6])+2,10),IFERROR(MID(RC[-6],SEARCH("-7",RC[-6])+2,10),IFERROR(MID(RC[-6],SEARCH("-6",RC[-6])+2,10),IFERROR(MID(RC[-6],SEARCH("-5",RC[-6])+2,10),IFERROR(MID(RC[-6],SEARCH("-4",RC[-6])+2,10),IFERROR(MID(RC[-6],SEARCH("-3",RC[-6])+2,10),IFERROR(MID(RC[-6],SEARCH("-2",RC[-6])+2,10),IFERROR(MID(RC[-6],SEARCH("-1",RC[-6])+2,10),IFERROR(MID(RC[-6],SEARCH("-",RC[-6])+1,10),))))))))))) -> 血色指挥官 | I163: ="1"&VLOOKUP(RC[-1],Sheet1!R2C2:R127C3,2,FALSE) -> 132408 | J163: 132408 | K163: =IFERROR(FIND(13,RC[-4],1),"") -> 16 | L163: =IF(RC[-1]="","",MID(RC[-5],RC[-1],6)) -> 132408 | M163: =SUBSTITUTE(RC[-6],RC[-1],RC[-3],1) -> "沐浴鲜血之后才能重生"|5#1324084|1
A164: 60095401 | B164: 英雄副本9-5超凡博士 | C164: 3 | D164: 6 | F164: 3|1 | G164: "魔法诠释着世界的奥秘"|3#1304384|1 | H164: =IFERROR(MID(RC[-6],SEARCH("-10",RC[-6])+3,10),IFERROR(MID(RC[-6],SEARCH("-9",RC[-6])+2,10),IFERROR(MID(RC[-6],SEARCH("-8",RC[-6])+2,10),IFERROR(MID(RC[-6],SEARCH("-7",RC[-6])+2,10),IFERROR(MID(RC[-6],SEARCH("-6",RC[-6])+2,10),IFERROR(MID(RC[-6],SEARCH("-5",RC[-6])+2,10),IFERROR(MID(RC[-6],SEARCH("-4",RC[-6])+2,10),IFERROR(MID(RC[-6],SEARCH("-3",RC[-6])+2,10),IFERROR(MID(RC[-6],SEARCH("-2",RC[-6])+2,10),IFERROR(MID(RC[-6],SEARCH("-1",RC[-6])+2,10),IFERROR(MID(RC[-6],SEARCH("-",RC[-6])+1,10),))))))))))) -> 超凡博士 | I164: ="1"&VLOOKUP(RC[-1],Sheet1!R2C2:R127C3,2,FALSE) -> 130438 | J164: 130438 | K164: =IFERROR(FIND(13,RC[-4],1),"") -> 16 | L164: =IF(RC[-1]="","",MID(RC[-5],RC[-1],6)) -> 130438 | M164: =SUBSTITUTE(RC[-6],RC[-1],RC[-3],1) -> "魔法诠释着世界的奥秘"|3#1304384|1
A165: 60095402 | B165: 英雄副本9-5超凡博士 | D165: 1 | E165: 600954|50 | F165: 3|1 | G165: "可解释的，归于科学，无可解释的，归于神秘"|3#1304384|1 | H165: =IFERROR(MID(RC[-6],SEARCH("-10",RC[-6])+3,10),IFERROR(MID(RC[-6],SEARCH("-9",RC[-6])+2,10),IFERROR(MID(RC[-6],SEARCH("-8",RC[-6])+2,10),IFERROR(MID(RC[-6],SEARCH("-7",RC[-6])+2,10),IFERROR(MID(RC[-6],SEARCH("-6",RC[-6])+2,10),IFERROR(MID(RC[-6],SEARCH("-5",RC[-6])+2,10),IFERROR(MID(RC[-6],SEARCH("-4",RC[-6])+2,10),IFERROR(MID(RC[-6],SEARCH("-3",RC[-6])+2,10),IFERROR(MID(RC[-6],SEARCH("-2",RC[-6])+2,10),IFERROR(MID(RC[-6],SEARCH("-1",RC[-6])+2,10),IFERROR(MID(RC[-6],SEARCH("-",RC[-6])+1,10),))))))))))) -> 超凡博士 | I165: ="1"&VLOOKUP(RC[-1],Sheet1!R2C2:R127C3,2,FALSE) -> 130438 | J165: 130438 | K165: =IFERROR(FIND(13,RC[-4],1),"") -> 26 | L165: =IF(RC[-1]="","",MID(RC[-5],RC[-1],6)) -> 130438 | M165: =SUBSTITUTE(RC[-6],RC[-1],RC[-3],1) -> "可解释的，归于科学，无可解释的，归于神秘"|3#1304384|1
A166: 60125101 | B166: 英雄副本12-5恶魔猎手 | D166: 1 | E166: 601251|80 | F166: 3|1 | G166: "在弥漫的毒雾中失去方向吧……"|3#1324094|1 | H166: =IFERROR(MID(RC[-6],SEARCH("-10",RC[-6])+3,10),IFERROR(MID(RC[-6],SEARCH("-9",RC[-6])+2,10),IFERROR(MID(RC[-6],SEARCH("-8",RC[-6])+2,10),IFERROR(MID(RC[-6],SEARCH("-7",RC[-6])+2,10),IFERROR(MID(RC[-6],SEARCH("-6",RC[-6])+2,10),IFERROR(MID(RC[-6],SEARCH("-5",RC[-6])+2,10),IFERROR(MID(RC[-6],SEARCH("-4",RC[-6])+2,10),IFERROR(MID(RC[-6],SEARCH("-3",RC[-6])+2,10),IFERROR(MID(RC[-6],SEARCH("-2",RC[-6])+2,10),IFERROR(MID(RC[-6],SEARCH("-1",RC[-6])+2,10),IFERROR(MID(RC[-6],SEARCH("-",RC[-6])+1,10),))))))))))) -> 恶魔猎手 | I166: ="1"&VLOOKUP(RC[-1],Sheet1!R2C2:R127C3,2,FALSE) -> 132409 | J166: 132409 | K166: =IFERROR(FIND(13,RC[-4],1),"") -> 20 | L166: =IF(RC[-1]="","",MID(RC[-5],RC[-1],6)) -> 132409 | M166: =SUBSTITUTE(RC[-6],RC[-1],RC[-3],1) -> "在弥漫的毒雾中失去方向吧……"|3#1324094|1
A167: 60125102 | B167: 英雄副本12-5恶魔猎手 | D167: 1 | E167: 601251|30 | F167: 3|1 | G167: "独行者……在迷茫中前进，比迷雾中前进更加艰难"|3#1324094|1 | H167: =IFERROR(MID(RC[-6],SEARCH("-10",RC[-6])+3,10),IFERROR(MID(RC[-6],SEARCH("-9",RC[-6])+2,10),IFERROR(MID(RC[-6],SEARCH("-8",RC[-6])+2,10),IFERROR(MID(RC[-6],SEARCH("-7",RC[-6])+2,10),IFERROR(MID(RC[-6],SEARCH("-6",RC[-6])+2,10),IFERROR(MID(RC[-6],SEARCH("-5",RC[-6])+2,10),IFERROR(MID(RC[-6],SEARCH("-4",RC[-6])+2,10),IFERROR(MID(RC[-6],SEARCH("-3",RC[-6])+2,10),IFERROR(MID(RC[-6],SEARCH("-2",RC[-6])+2,10),IFERROR(MID(RC[-6],SEARCH("-1",RC[-6])+2,10),IFERROR(MID(RC[-6],SEARCH("-",RC[-6])+1,10),))))))))))) -> 恶魔猎手 | I167: ="1"&VLOOKUP(RC[-1],Sheet1!R2C2:R127C3,2,FALSE) -> 132409 | J167: 132409 | K167: =IFERROR(FIND(13,RC[-4],1),"") -> 28 | L167: =IF(RC[-1]="","",MID(RC[-5],RC[-1],6)) -> 132409 | M167: =SUBSTITUTE(RC[-6],RC[-1],RC[-3],1) -> "独行者……在迷茫中前进，比迷雾中前进更加艰难"|3#1324094|1
A168: 60125103 | B168: 英雄副本12-5恶魔猎手 | D168: 2 | E168: 15 | F168: 3|1 | G168: "英雄？每一个的背后都有千千万万的枯骨，无关好坏"|5#1324094|1 | H168: =IFERROR(MID(RC[-6],SEARCH("-10",RC[-6])+3,10),IFERROR(MID(RC[-6],SEARCH("-9",RC[-6])+2,10),IFERROR(MID(RC[-6],SEARCH("-8",RC[-6])+2,10),IFERROR(MID(RC[-6],SEARCH("-7",RC[-6])+2,10),IFERROR(MID(RC[-6],SEARCH("-6",RC[-6])+2,10),IFERROR(MID(RC[-6],SEARCH("-5",RC[-6])+2,10),IFERROR(MID(RC[-6],SEARCH("-4",RC[-6])+2,10),IFERROR(MID(RC[-6],SEARCH("-3",RC[-6])+2,10),IFERROR(MID(RC[-6],SEARCH("-2",RC[-6])+2,10),IFERROR(MID(RC[-6],SEARCH("-1",RC[-6])+2,10),IFERROR(MID(RC[-6],SEARCH("-",RC[-6])+1,10),))))))))))) -> 恶魔猎手 | I168: ="1"&VLOOKUP(RC[-1],Sheet1!R2C2:R127C3,2,FALSE) -> 132409 | J168: 132409 | K168: =IFERROR(FIND(13,RC[-4],1),"") -> 29 | L168: =IF(RC[-1]="","",MID(RC[-5],RC[-1],6)) -> 132409 | M168: =SUBSTITUTE(RC[-6],RC[-1],RC[-3],1) -> "英雄？每一个的背后都有千千万万的枯骨，无关好坏"|5#1324094|1
A169: 60125104 | B169: 英雄副本12-5恶魔猎手 | D169: 2 | E169: 20 | F169: 3|1 | G169: "对错好坏很多时候无关紧要，重要的是，你足够强大吗？"|5#1324094|1 | H169: =IFERROR(MID(RC[-6],SEARCH("-10",RC[-6])+3,10),IFERROR(MID(RC[-6],SEARCH("-9",RC[-6])+2,10),IFERROR(MID(RC[-6],SEARCH("-8",RC[-6])+2,10),IFERROR(MID(RC[-6],SEARCH("-7",RC[-6])+2,10),IFERROR(MID(RC[-6],SEARCH("-6",RC[-6])+2,10),IFERROR(MID(RC[-6],SEARCH("-5",RC[-6])+2,10),IFERROR(MID(RC[-6],SEARCH("-4",RC[-6])+2,10),IFERROR(MID(RC[-6],SEARCH("-3",RC[-6])+2,10),IFERROR(MID(RC[-6],SEARCH("-2",RC[-6])+2,10),IFERROR(MID(RC[-6],SEARCH("-1",RC[-6])+2,10),IFERROR(MID(RC[-6],SEARCH("-",RC[-6])+1,10),))))))))))) -> 恶魔猎手 | I169: ="1"&VLOOKUP(RC[-1],Sheet1!R2C2:R127C3,2,FALSE) -> 132409 | J169: 132409 | K169: =IFERROR(FIND(13,RC[-4],1),"") -> 31 | L169: =IF(RC[-1]="","",MID(RC[-5],RC[-1],6)) -> 132409 | M169: =SUBSTITUTE(RC[-6],RC[-1],RC[-3],1) -> "对错好坏很多时候无关紧要，重要的是，你足够强大吗？"|5#1324094|1
A170: 60155401 | B170: 英雄副本15-5红颅鬼 | C170: 3 | D170: 4 | F170: 3|1 | G170: "看到了吗？那如堕深渊的痛苦，感受一下吧……"|3#1304304|1 | H170: =IFERROR(MID(RC[-6],SEARCH("-10",RC[-6])+3,10),IFERROR(MID(RC[-6],SEARCH("-9",RC[-6])+2,10),IFERROR(MID(RC[-6],SEARCH("-8",RC[-6])+2,10),IFERROR(MID(RC[-6],SEARCH("-7",RC[-6])+2,10),IFERROR(MID(RC[-6],SEARCH("-6",RC[-6])+2,10),IFERROR(MID(RC[-6],SEARCH("-5",RC[-6])+2,10),IFERROR(MID(RC[-6],SEARCH("-4",RC[-6])+2,10),IFERROR(MID(RC[-6],SEARCH("-3",RC[-6])+2,10),IFERROR(MID(RC[-6],SEARCH("-2",RC[-6])+2,10),IFERROR(MID(RC[-6],SEARCH("-1",RC[-6])+2,10),IFERROR(MID(RC[-6],SEARCH("-",RC[-6])+1,10),))))))))))) -> 红颅鬼 | I170: ="1"&VLOOKUP(RC[-1],Sheet1!R2C2:R127C3,2,FALSE) -> 130998 | J170: 130430 | K170: =IFERROR(FIND(13,RC[-4],1),"") -> 27 | L170: =IF(RC[-1]="","",MID(RC[-5],RC[-1],6)) -> 130430 | M170: =SUBSTITUTE(RC[-6],RC[-1],RC[-3],1) -> "看到了吗？那如堕深渊的痛苦，感受一下吧……"|3#1304304|1
A171: 60155402 | B171: 英雄副本15-5红颅鬼 | D171: 1 | E171: 601554|30 | F171: 3|1 | G171: "罪恶吗……罪恶啊……那就如此恶贯满盈，直至结束吧"|3#1304304|1 | H171: =IFERROR(MID(RC[-6],SEARCH("-10",RC[-6])+3,10),IFERROR(MID(RC[-6],SEARCH("-9",RC[-6])+2,10),IFERROR(MID(RC[-6],SEARCH("-8",RC[-6])+2,10),IFERROR(MID(RC[-6],SEARCH("-7",RC[-6])+2,10),IFERROR(MID(RC[-6],SEARCH("-6",RC[-6])+2,10),IFERROR(MID(RC[-6],SEARCH("-5",RC[-6])+2,10),IFERROR(MID(RC[-6],SEARCH("-4",RC[-6])+2,10),IFERROR(MID(RC[-6],SEARCH("-3",RC[-6])+2,10),IFERROR(MID(RC[-6],SEARCH("-2",RC[-6])+2,10),IFERROR(MID(RC[-6],SEARCH("-1",RC[-6])+2,10),IFERROR(MID(RC[-6],SEARCH("-",RC[-6])+1,10),))))))))))) -> 红颅鬼 | I171: ="1"&VLOOKUP(RC[-1],Sheet1!R2C2:R127C3,2,FALSE) -> 130998 | J171: 130430 | K171: =IFERROR(FIND(13,RC[-4],1),"") -> 30 | L171: =IF(RC[-1]="","",MID(RC[-5],RC[-1],6)) -> 130430 | M171: =SUBSTITUTE(RC[-6],RC[-1],RC[-3],1) -> "罪恶吗……罪恶啊……那就如此恶贯满盈，直至结束吧"|3#1304304|1
A172: 60185101 | B172: 英雄副本18-5德古拉伯爵 | D172: 1 | E172: 601851|90 | F172: 3|1 | G172: "杀戮，嗜血，这是你们所赋予的，我所偿还的"|3#1314014|1 | H172: =IFERROR(MID(RC[-6],SEARCH("-10",RC[-6])+3,10),IFERROR(MID(RC[-6],SEARCH("-9",RC[-6])+2,10),IFERROR(MID(RC[-6],SEARCH("-8",RC[-6])+2,10),IFERROR(MID(RC[-6],SEARCH("-7",RC[-6])+2,10),IFERROR(MID(RC[-6],SEARCH("-6",RC[-6])+2,10),IFERROR(MID(RC[-6],SEARCH("-5",RC[-6])+2,10),IFERROR(MID(RC[-6],SEARCH("-4",RC[-6])+2,10),IFERROR(MID(RC[-6],SEARCH("-3",RC[-6])+2,10),IFERROR(MID(RC[-6],SEARCH("-2",RC[-6])+2,10),IFERROR(MID(RC[-6],SEARCH("-1",RC[-6])+2,10),IFERROR(MID(RC[-6],SEARCH("-",RC[-6])+1,10),))))))))))) -> 德古拉伯爵 | I172: ="1"&VLOOKUP(RC[-1],Sheet1!R2C2:R127C3,2,FALSE) -> 131401 | J172: 131401 | K172: =IFERROR(FIND(13,RC[-4],1),"") -> 26 | L172: =IF(RC[-1]="","",MID(RC[-5],RC[-1],6)) -> 131401 | M172: =SUBSTITUTE(RC[-6],RC[-1],RC[-3],1) -> "杀戮，嗜血，这是你们所赋予的，我所偿还的"|3#1314014|1
A173: 60185102 | B173: 英雄副本18-5德古拉伯爵 | D173: 1 | E173: 601851|55 | F173: 3|1 | G173: "死亡弥漫的黑夜，鲜血的盛宴"|3#1314014|1 | H173: =IFERROR(MID(RC[-6],SEARCH("-10",RC[-6])+3,10),IFERROR(MID(RC[-6],SEARCH("-9",RC[-6])+2,10),IFERROR(MID(RC[-6],SEARCH("-8",RC[-6])+2,10),IFERROR(MID(RC[-6],SEARCH("-7",RC[-6])+2,10),IFERROR(MID(RC[-6],SEARCH("-6",RC[-6])+2,10),IFERROR(MID(RC[-6],SEARCH("-5",RC[-6])+2,10),IFERROR(MID(RC[-6],SEARCH("-4",RC[-6])+2,10),IFERROR(MID(RC[-6],SEARCH("-3",RC[-6])+2,10),IFERROR(MID(RC[-6],SEARCH("-2",RC[-6])+2,10),IFERROR(MID(RC[-6],SEARCH("-1",RC[-6])+2,10),IFERROR(MID(RC[-6],SEARCH("-",RC[-6])+1,10),))))))))))) -> 德古拉伯爵 | I173: ="1"&VLOOKUP(RC[-1],Sheet1!R2C2:R127C3,2,FALSE) -> 131401 | J173: 131401 | K173: =IFERROR(FIND(13,RC[-4],1),"") -> 19 | L173: =IF(RC[-1]="","",MID(RC[-5],RC[-1],6)) -> 131401 | M173: =SUBSTITUTE(RC[-6],RC[-1],RC[-3],1) -> "死亡弥漫的黑夜，鲜血的盛宴"|3#1314014|1
A174: 60185103 | B174: 英雄副本18-5德古拉伯爵 | D174: 1 | E174: 601851|20 | F174: 3|1 | G174: "你的心脏，你的鲜血，你的生命，给我，交给我！"|3#1314014|1 | H174: =IFERROR(MID(RC[-6],SEARCH("-10",RC[-6])+3,10),IFERROR(MID(RC[-6],SEARCH("-9",RC[-6])+2,10),IFERROR(MID(RC[-6],SEARCH("-8",RC[-6])+2,10),IFERROR(MID(RC[-6],SEARCH("-7",RC[-6])+2,10),IFERROR(MID(RC[-6],SEARCH("-6",RC[-6])+2,10),IFERROR(MID(RC[-6],SEARCH("-5",RC[-6])+2,10),IFERROR(MID(RC[-6],SEARCH("-4",RC[-6])+2,10),IFERROR(MID(RC[-6],SEARCH("-3",RC[-6])+2,10),IFERROR(MID(RC[-6],SEARCH("-2",RC[-6])+2,10),IFERROR(MID(RC[-6],SEARCH("-1",RC[-6])+2,10),IFERROR(MID(RC[-6],SEARCH("-",RC[-6])+1,10),))))))))))) -> 德古拉伯爵 | I174: ="1"&VLOOKUP(RC[-1],Sheet1!R2C2:R127C3,2,FALSE) -> 131401 | J174: 131401 | K174: =IFERROR(FIND(13,RC[-4],1),"") -> 28 | L174: =IF(RC[-1]="","",MID(RC[-5],RC[-1],6)) -> 131401 | M174: =SUBSTITUTE(RC[-6],RC[-1],RC[-3],1) -> "你的心脏，你的鲜血，你的生命，给我，交给我！"|3#1314014|1
A175: 60185104 | B175: 英雄副本18-5德古拉伯爵 | C175: 2 | D175: 7 | F175: 3|1 | G175: "我闻到了鲜血的味道……"|3#1314014|1 | H175: =IFERROR(MID(RC[-6],SEARCH("-10",RC[-6])+3,10),IFERROR(MID(RC[-6],SEARCH("-9",RC[-6])+2,10),IFERROR(MID(RC[-6],SEARCH("-8",RC[-6])+2,10),IFERROR(MID(RC[-6],SEARCH("-7",RC[-6])+2,10),IFERROR(MID(RC[-6],SEARCH("-6",RC[-6])+2,10),IFERROR(MID(RC[-6],SEARCH("-5",RC[-6])+2,10),IFERROR(MID(RC[-6],SEARCH("-4",RC[-6])+2,10),IFERROR(MID(RC[-6],SEARCH("-3",RC[-6])+2,10),IFERROR(MID(RC[-6],SEARCH("-2",RC[-6])+2,10),IFERROR(MID(RC[-6],SEARCH("-1",RC[-6])+2,10),IFERROR(MID(RC[-6],SEARCH("-",RC[-6])+1,10),))))))))))) -> 德古拉伯爵 | I175: ="1"&VLOOKUP(RC[-1],Sheet1!R2C2:R127C3,2,FALSE) -> 131401 | J175: 131401 | K175: =IFERROR(FIND(13,RC[-4],1),"") -> 17 | L175: =IF(RC[-1]="","",MID(RC[-5],RC[-1],6)) -> 131401 | M175: =SUBSTITUTE(RC[-6],RC[-1],RC[-3],1) -> "我闻到了鲜血的味道……"|3#1314014|1
A176: 60215201 | B176: 英雄副本21-5大力神 | D176: 2 | E176: 15 | F176: 3|1 | G176: "掌控你的力量，你的愤怒，你的意志才是你最强大的武器"|5#1314194|1 | H176: =IFERROR(MID(RC[-6],SEARCH("-10",RC[-6])+3,10),IFERROR(MID(RC[-6],SEARCH("-9",RC[-6])+2,10),IFERROR(MID(RC[-6],SEARCH("-8",RC[-6])+2,10),IFERROR(MID(RC[-6],SEARCH("-7",RC[-6])+2,10),IFERROR(MID(RC[-6],SEARCH("-6",RC[-6])+2,10),IFERROR(MID(RC[-6],SEARCH("-5",RC[-6])+2,10),IFERROR(MID(RC[-6],SEARCH("-4",RC[-6])+2,10),IFERROR(MID(RC[-6],SEARCH("-3",RC[-6])+2,10),IFERROR(MID(RC[-6],SEARCH("-2",RC[-6])+2,10),IFERROR(MID(RC[-6],SEARCH("-1",RC[-6])+2,10),IFERROR(MID(RC[-6],SEARCH("-",RC[-6])+1,10),))))))))))) -> 大力神 | I176: ="1"&VLOOKUP(RC[-1],Sheet1!R2C2:R127C3,2,FALSE) -> 131419 | J176: 131419 | K176: =IFERROR(FIND(13,RC[-4],1),"") -> 31 | L176: =IF(RC[-1]="","",MID(RC[-5],RC[-1],6)) -> 131419 | M176: =SUBSTITUTE(RC[-6],RC[-1],RC[-3],1) -> "掌控你的力量，你的愤怒，你的意志才是你最强大的武器"|5#1314194|1
A177: 60215202 | B177: 英雄副本21-5大力神 | D177: 2 | E177: 20 | F177: 3|1 | G177: "拥有驾驭力量的意志，远比拥有力量重要得多"|5#1314194|1 | H177: =IFERROR(MID(RC[-6],SEARCH("-10",RC[-6])+3,10),IFERROR(MID(RC[-6],SEARCH("-9",RC[-6])+2,10),IFERROR(MID(RC[-6],SEARCH("-8",RC[-6])+2,10),IFERROR(MID(RC[-6],SEARCH("-7",RC[-6])+2,10),IFERROR(MID(RC[-6],SEARCH("-6",RC[-6])+2,10),IFERROR(MID(RC[-6],SEARCH("-5",RC[-6])+2,10),IFERROR(MID(RC[-6],SEARCH("-4",RC[-6])+2,10),IFERROR(MID(RC[-6],SEARCH("-3",RC[-6])+2,10),IFERROR(MID(RC[-6],SEARCH("-2",RC[-6])+2,10),IFERROR(MID(RC[-6],SEARCH("-1",RC[-6])+2,10),IFERROR(MID(RC[-6],SEARCH("-",RC[-6])+1,10),))))))))))) -> 大力神 | I177: ="1"&VLOOKUP(RC[-1],Sheet1!R2C2:R127C3,2,FALSE) -> 131419 | J177: 131419 | K177: =IFERROR(FIND(13,RC[-4],1),"") -> 26 | L177: =IF(RC[-1]="","",MID(RC[-5],RC[-1],6)) -> 131419 | M177: =SUBSTITUTE(RC[-6],RC[-1],RC[-3],1) -> "拥有驾驭力量的意志，远比拥有力量重要得多"|5#1314194|1
A178: 60215203 | B178: 英雄副本21-5大力神 | D178: 1 | E178: 602152|80 | F178: 3|1 | G178: "这就是你的失败！"|3#1314194|1 | H178: =IFERROR(MID(RC[-6],SEARCH("-10",RC[-6])+3,10),IFERROR(MID(RC[-6],SEARCH("-9",RC[-6])+2,10),IFERROR(MID(RC[-6],SEARCH("-8",RC[-6])+2,10),IFERROR(MID(RC[-6],SEARCH("-7",RC[-6])+2,10),IFERROR(MID(RC[-6],SEARCH("-6",RC[-6])+2,10),IFERROR(MID(RC[-6],SEARCH("-5",RC[-6])+2,10),IFERROR(MID(RC[-6],SEARCH("-4",RC[-6])+2,10),IFERROR(MID(RC[-6],SEARCH("-3",RC[-6])+2,10),IFERROR(MID(RC[-6],SEARCH("-2",RC[-6])+2,10),IFERROR(MID(RC[-6],SEARCH("-1",RC[-6])+2,10),IFERROR(MID(RC[-6],SEARCH("-",RC[-6])+1,10),))))))))))) -> 大力神 | I178: ="1"&VLOOKUP(RC[-1],Sheet1!R2C2:R127C3,2,FALSE) -> 131419 | J178: 131419 | K178: =IFERROR(FIND(13,RC[-4],1),"") -> 14 | L178: =IF(RC[-1]="","",MID(RC[-5],RC[-1],6)) -> 131419 | M178: =SUBSTITUTE(RC[-6],RC[-1],RC[-3],1) -> "这就是你的失败！"|3#1314194|1
A179: 60215204 | B179: 英雄副本21-5大力神 | D179: 1 | E179: 602152|30 | F179: 3|1 | G179: "我怎么能倒在这里……"|3#1314194|1 | H179: =IFERROR(MID(RC[-6],SEARCH("-10",RC[-6])+3,10),IFERROR(MID(RC[-6],SEARCH("-9",RC[-6])+2,10),IFERROR(MID(RC[-6],SEARCH("-8",RC[-6])+2,10),IFERROR(MID(RC[-6],SEARCH("-7",RC[-6])+2,10),IFERROR(MID(RC[-6],SEARCH("-6",RC[-6])+2,10),IFERROR(MID(RC[-6],SEARCH("-5",RC[-6])+2,10),IFERROR(MID(RC[-6],SEARCH("-4",RC[-6])+2,10),IFERROR(MID(RC[-6],SEARCH("-3",RC[-6])+2,10),IFERROR(MID(RC[-6],SEARCH("-2",RC[-6])+2,10),IFERROR(MID(RC[-6],SEARCH("-1",RC[-6])+2,10),IFERROR(MID(RC[-6],SEARCH("-",RC[-6])+1,10),))))))))))) -> 大力神 | I179: ="1"&VLOOKUP(RC[-1],Sheet1!R2C2:R127C3,2,FALSE) -> 131419 | J179: 131419 | K179: =IFERROR(FIND(13,RC[-4],1),"") -> 16 | L179: =IF(RC[-1]="","",MID(RC[-5],RC[-1],6)) -> 131419 | M179: =SUBSTITUTE(RC[-6],RC[-1],RC[-3],1) -> "我怎么能倒在这里……"|3#1314194|1
A180: 60245101 | B180: 英雄副本24-5刀锋猎人 | D180: 1 | E180: 602451|80 | F180: 3|1 | G180: "我的剑会将你斩杀！"|3#1304024|1 | H180: =IFERROR(MID(RC[-6],SEARCH("-10",RC[-6])+3,10),IFERROR(MID(RC[-6],SEARCH("-9",RC[-6])+2,10),IFERROR(MID(RC[-6],SEARCH("-8",RC[-6])+2,10),IFERROR(MID(RC[-6],SEARCH("-7",RC[-6])+2,10),IFERROR(MID(RC[-6],SEARCH("-6",RC[-6])+2,10),IFERROR(MID(RC[-6],SEARCH("-5",RC[-6])+2,10),IFERROR(MID(RC[-6],SEARCH("-4",RC[-6])+2,10),IFERROR(MID(RC[-6],SEARCH("-3",RC[-6])+2,10),IFERROR(MID(RC[-6],SEARCH("-2",RC[-6])+2,10),IFERROR(MID(RC[-6],SEARCH("-1",RC[-6])+2,10),IFERROR(MID(RC[-6],SEARCH("-",RC[-6])+1,10),))))))))))) -> 刀锋猎人 | I180: ="1"&VLOOKUP(RC[-1],Sheet1!R2C2:R127C3,2,FALSE) -> 130402 | J180: 130402 | K180: =IFERROR(FIND(13,RC[-4],1),"") -> 15 | L180: =IF(RC[-1]="","",MID(RC[-5],RC[-1],6)) -> 130402 | M180: =SUBSTITUTE(RC[-6],RC[-1],RC[-3],1) -> "我的剑会将你斩杀！"|3#1304024|1
A181: 60245102 | B181: 英雄副本24-5刀锋猎人 | D181: 1 | E181: 602451|50 | F181: 3|1 | G181: "我是不会怜悯的！"|3#1304024|1 | H181: =IFERROR(MID(RC[-6],SEARCH("-10",RC[-6])+3,10),IFERROR(MID(RC[-6],SEARCH("-9",RC[-6])+2,10),IFERROR(MID(RC[-6],SEARCH("-8",RC[-6])+2,10),IFERROR(MID(RC[-6],SEARCH("-7",RC[-6])+2,10),IFERROR(MID(RC[-6],SEARCH("-6",RC[-6])+2,10),IFERROR(MID(RC[-6],SEARCH("-5",RC[-6])+2,10),IFERROR(MID(RC[-6],SEARCH("-4",RC[-6])+2,10),IFERROR(MID(RC[-6],SEARCH("-3",RC[-6])+2,10),IFERROR(MID(RC[-6],SEARCH("-2",RC[-6])+2,10),IFERROR(MID(RC[-6],SEARCH("-1",RC[-6])+2,10),IFERROR(MID(RC[-6],SEARCH("-",RC[-6])+1,10),))))))))))) -> 刀锋猎人 | I181: ="1"&VLOOKUP(RC[-1],Sheet1!R2C2:R127C3,2,FALSE) -> 130402 | J181: 130402 | K181: =IFERROR(FIND(13,RC[-4],1),"") -> 14 | L181: =IF(RC[-1]="","",MID(RC[-5],RC[-1],6)) -> 130402 | M181: =SUBSTITUTE(RC[-6],RC[-1],RC[-3],1) -> "我是不会怜悯的！"|3#1304024|1
A182: 60245103 | B182: 英雄副本24-5刀锋猎人 | D182: 1 | E182: 602451|30 | F182: 3|1 | G182: "吸血鬼都该死！——"|3#1304024|1 | H182: =IFERROR(MID(RC[-6],SEARCH("-10",RC[-6])+3,10),IFERROR(MID(RC[-6],SEARCH("-9",RC[-6])+2,10),IFERROR(MID(RC[-6],SEARCH("-8",RC[-6])+2,10),IFERROR(MID(RC[-6],SEARCH("-7",RC[-6])+2,10),IFERROR(MID(RC[-6],SEARCH("-6",RC[-6])+2,10),IFERROR(MID(RC[-6],SEARCH("-5",RC[-6])+2,10),IFERROR(MID(RC[-6],SEARCH("-4",RC[-6])+2,10),IFERROR(MID(RC[-6],SEARCH("-3",RC[-6])+2,10),IFERROR(MID(RC[-6],SEARCH("-2",RC[-6])+2,10),IFERROR(MID(RC[-6],SEARCH("-1",RC[-6])+2,10),IFERROR(MID(RC[-6],SEARCH("-",RC[-6])+1,10),))))))))))) -> 刀锋猎人 | I182: ="1"&VLOOKUP(RC[-1],Sheet1!R2C2:R127C3,2,FALSE) -> 130402 | J182: 130402 | K182: =IFERROR(FIND(13,RC[-4],1),"") -> 15 | L182: =IF(RC[-1]="","",MID(RC[-5],RC[-1],6)) -> 130402 | M182: =SUBSTITUTE(RC[-6],RC[-1],RC[-3],1) -> "吸血鬼都该死！——"|3#1304024|1
A183: 60245104 | B183: 英雄副本24-5刀锋猎人 | C183: 2 | D183: 7 | F183: 3|1 | G183: "看看，这就是你们的结局！"|3#1304024|1 | H183: =IFERROR(MID(RC[-6],SEARCH("-10",RC[-6])+3,10),IFERROR(MID(RC[-6],SEARCH("-9",RC[-6])+2,10),IFERROR(MID(RC[-6],SEARCH("-8",RC[-6])+2,10),IFERROR(MID(RC[-6],SEARCH("-7",RC[-6])+2,10),IFERROR(MID(RC[-6],SEARCH("-6",RC[-6])+2,10),IFERROR(MID(RC[-6],SEARCH("-5",RC[-6])+2,10),IFERROR(MID(RC[-6],SEARCH("-4",RC[-6])+2,10),IFERROR(MID(RC[-6],SEARCH("-3",RC[-6])+2,10),IFERROR(MID(RC[-6],SEARCH("-2",RC[-6])+2,10),IFERROR(MID(RC[-6],SEARCH("-1",RC[-6])+2,10),IFERROR(MID(RC[-6],SEARCH("-",RC[-6])+1,10),))))))))))) -> 刀锋猎人 | I183: ="1"&VLOOKUP(RC[-1],Sheet1!R2C2:R127C3,2,FALSE) -> 130402 | J183: 130402 | K183: =IFERROR(FIND(13,RC[-4],1),"") -> 18 | L183: =IF(RC[-1]="","",MID(RC[-5],RC[-1],6)) -> 130402 | M183: =SUBSTITUTE(RC[-6],RC[-1],RC[-3],1) -> "看看，这就是你们的结局！"|3#1304024|1
A184: 60275101 | B184: 英雄副本27-5憎恶 | C184: 0 | D184: 4 | F184: 3|1 | G184: "死亡会令我更强大——"|3#1329994|1 | H184: =IFERROR(MID(RC[-6],SEARCH("-10",RC[-6])+3,10),IFERROR(MID(RC[-6],SEARCH("-9",RC[-6])+2,10),IFERROR(MID(RC[-6],SEARCH("-8",RC[-6])+2,10),IFERROR(MID(RC[-6],SEARCH("-7",RC[-6])+2,10),IFERROR(MID(RC[-6],SEARCH("-6",RC[-6])+2,10),IFERROR(MID(RC[-6],SEARCH("-5",RC[-6])+2,10),IFERROR(MID(RC[-6],SEARCH("-4",RC[-6])+2,10),IFERROR(MID(RC[-6],SEARCH("-3",RC[-6])+2,10),IFERROR(MID(RC[-6],SEARCH("-2",RC[-6])+2,10),IFERROR(MID(RC[-6],SEARCH("-1",RC[-6])+2,10),IFERROR(MID(RC[-6],SEARCH("-",RC[-6])+1,10),))))))))))) -> 憎恶 | I184: ="1"&VLOOKUP(RC[-1],Sheet1!R2C2:R127C3,2,FALSE) -> 132999 | J184: 132999 | K184: =IFERROR(FIND(13,RC[-4],1),"") -> 16 | L184: =IF(RC[-1]="","",MID(RC[-5],RC[-1],6)) -> 132999 | M184: =SUBSTITUTE(RC[-6],RC[-1],RC[-3],1) -> "死亡会令我更强大——"|3#1329994|1
A185: 60305201 | B185: 英雄副本30-5野蛮巨人 | D185: 1 | E185: 603052|80 | F185: 3|1 | G185: "你竟敢伤害我！"|3#1304104|1 | H185: =IFERROR(MID(RC[-6],SEARCH("-10",RC[-6])+3,10),IFERROR(MID(RC[-6],SEARCH("-9",RC[-6])+2,10),IFERROR(MID(RC[-6],SEARCH("-8",RC[-6])+2,10),IFERROR(MID(RC[-6],SEARCH("-7",RC[-6])+2,10),IFERROR(MID(RC[-6],SEARCH("-6",RC[-6])+2,10),IFERROR(MID(RC[-6],SEARCH("-5",RC[-6])+2,10),IFERROR(MID(RC[-6],SEARCH("-4",RC[-6])+2,10),IFERROR(MID(RC[-6],SEARCH("-3",RC[-6])+2,10),IFERROR(MID(RC[-6],SEARCH("-2",RC[-6])+2,10),IFERROR(MID(RC[-6],SEARCH("-1",RC[-6])+2,10),IFERROR(MID(RC[-6],SEARCH("-",RC[-6])+1,10),))))))))))) -> 野蛮巨人 | I185: ="1"&VLOOKUP(RC[-1],Sheet1!R2C2:R127C3,2,FALSE) -> 130410 | J185: 130410 | K185: =IFERROR(FIND(13,RC[-4],1),"") -> 13 | L185: =IF(RC[-1]="","",MID(RC[-5],RC[-1],6)) -> 130410 | M185: =SUBSTITUTE(RC[-6],RC[-1],RC[-3],1) -> "你竟敢伤害我！"|3#1304104|1
A186: 60305202 | B186: 英雄副本30-5野蛮巨人 | D186: 1 | E186: 603052|30 | F186: 3|1 | G186: "我不会倒下的！！！"|3#1304104|1 | H186: =IFERROR(MID(RC[-6],SEARCH("-10",RC[-6])+3,10),IFERROR(MID(RC[-6],SEARCH("-9",RC[-6])+2,10),IFERROR(MID(RC[-6],SEARCH("-8",RC[-6])+2,10),IFERROR(MID(RC[-6],SEARCH("-7",RC[-6])+2,10),IFERROR(MID(RC[-6],SEARCH("-6",RC[-6])+2,10),IFERROR(MID(RC[-6],SEARCH("-5",RC[-6])+2,10),IFERROR(MID(RC[-6],SEARCH("-4",RC[-6])+2,10),IFERROR(MID(RC[-6],SEARCH("-3",RC[-6])+2,10),IFERROR(MID(RC[-6],SEARCH("-2",RC[-6])+2,10),IFERROR(MID(RC[-6],SEARCH("-1",RC[-6])+2,10),IFERROR(MID(RC[-6],SEARCH("-",RC[-6])+1,10),))))))))))) -> 野蛮巨人 | I186: ="1"&VLOOKUP(RC[-1],Sheet1!R2C2:R127C3,2,FALSE) -> 130410 | J186: 130410 | K186: =IFERROR(FIND(13,RC[-4],1),"") -> 15 | L186: =IF(RC[-1]="","",MID(RC[-5],RC[-1],6)) -> 130410 | M186: =SUBSTITUTE(RC[-6],RC[-1],RC[-3],1) -> "我不会倒下的！！！"|3#1304104|1
A187: 60305203 | B187: 英雄副本30-5野蛮巨人 | C187: 2 | D187: 6 | F187: 3|1 | G187: "愤怒！我感受到了！！"|3#1304104|1 | H187: =IFERROR(MID(RC[-6],SEARCH("-10",RC[-6])+3,10),IFERROR(MID(RC[-6],SEARCH("-9",RC[-6])+2,10),IFERROR(MID(RC[-6],SEARCH("-8",RC[-6])+2,10),IFERROR(MID(RC[-6],SEARCH("-7",RC[-6])+2,10),IFERROR(MID(RC[-6],SEARCH("-6",RC[-6])+2,10),IFERROR(MID(RC[-6],SEARCH("-5",RC[-6])+2,10),IFERROR(MID(RC[-6],SEARCH("-4",RC[-6])+2,10),IFERROR(MID(RC[-6],SEARCH("-3",RC[-6])+2,10),IFERROR(MID(RC[-6],SEARCH("-2",RC[-6])+2,10),IFERROR(MID(RC[-6],SEARCH("-1",RC[-6])+2,10),IFERROR(MID(RC[-6],SEARCH("-",RC[-6])+1,10),))))))))))) -> 野蛮巨人 | I187: ="1"&VLOOKUP(RC[-1],Sheet1!R2C2:R127C3,2,FALSE) -> 130410 | J187: 130410 | K187: =IFERROR(FIND(13,RC[-4],1),"") -> 16 | L187: =IF(RC[-1]="","",MID(RC[-5],RC[-1],6)) -> 130410 | M187: =SUBSTITUTE(RC[-6],RC[-1],RC[-3],1) -> "愤怒！我感受到了！！"|3#1304104|1
A188: 60335401 | B188: 英雄副本33-5宙斯 | D188: 1 | E188: 603354|50 | F188: 3|1 | G188: "我可是众神之王！"|3#1314384|1 | H188: =IFERROR(MID(RC[-6],SEARCH("-10",RC[-6])+3,10),IFERROR(MID(RC[-6],SEARCH("-9",RC[-6])+2,10),IFERROR(MID(RC[-6],SEARCH("-8",RC[-6])+2,10),IFERROR(MID(RC[-6],SEARCH("-7",RC[-6])+2,10),IFERROR(MID(RC[-6],SEARCH("-6",RC[-6])+2,10),IFERROR(MID(RC[-6],SEARCH("-5",RC[-6])+2,10),IFERROR(MID(RC[-6],SEARCH("-4",RC[-6])+2,10),IFERROR(MID(RC[-6],SEARCH("-3",RC[-6])+2,10),IFERROR(MID(RC[-6],SEARCH("-2",RC[-6])+2,10),IFERROR(MID(RC[-6],SEARCH("-1",RC[-6])+2,10),IFERROR(MID(RC[-6],SEARCH("-",RC[-6])+1,10),))))))))))) -> 宙斯 | I188: ="1"&VLOOKUP(RC[-1],Sheet1!R2C2:R127C3,2,FALSE) -> 131438 | J188: 131438 | K188: =IFERROR(FIND(13,RC[-4],1),"") -> 14 | L188: =IF(RC[-1]="","",MID(RC[-5],RC[-1],6)) -> 131438 | M188: =SUBSTITUTE(RC[-6],RC[-1],RC[-3],1) -> "我可是众神之王！"|3#1314384|1
A189: 60335402 | B189: 英雄副本33-5宙斯 | D189: 1 | E189: 603354|50 | F189: 4|3|1 | G189: 3#"你知道冒犯神王的下场是什么吗？"|3#1314384|1 | H189: =IFERROR(MID(RC[-6],SEARCH("-10",RC[-6])+3,10),IFERROR(MID(RC[-6],SEARCH("-9",RC[-6])+2,10),IFERROR(MID(RC[-6],SEARCH("-8",RC[-6])+2,10),IFERROR(MID(RC[-6],SEARCH("-7",RC[-6])+2,10),IFERROR(MID(RC[-6],SEARCH("-6",RC[-6])+2,10),IFERROR(MID(RC[-6],SEARCH("-5",RC[-6])+2,10),IFERROR(MID(RC[-6],SEARCH("-4",RC[-6])+2,10),IFERROR(MID(RC[-6],SEARCH("-3",RC[-6])+2,10),IFERROR(MID(RC[-6],SEARCH("-2",RC[-6])+2,10),IFERROR(MID(RC[-6],SEARCH("-1",RC[-6])+2,10),IFERROR(MID(RC[-6],SEARCH("-",RC[-6])+1,10),))))))))))) -> 宙斯 | I189: ="1"&VLOOKUP(RC[-1],Sheet1!R2C2:R127C3,2,FALSE) -> 131438 | J189: 131438 | K189: =IFERROR(FIND(13,RC[-4],1),"") -> 23 | L189: =IF(RC[-1]="","",MID(RC[-5],RC[-1],6)) -> 131438 | M189: =SUBSTITUTE(RC[-6],RC[-1],RC[-3],1) -> 3#"你知道冒犯神王的下场是什么吗？"|3#1314384|1
A190: 60335403 | B190: 英雄副本33-5宙斯 | D190: 4 | F190: 3|1 | G190: "你将在此死去！"|3#1314384|1 | H190: =IFERROR(MID(RC[-6],SEARCH("-10",RC[-6])+3,10),IFERROR(MID(RC[-6],SEARCH("-9",RC[-6])+2,10),IFERROR(MID(RC[-6],SEARCH("-8",RC[-6])+2,10),IFERROR(MID(RC[-6],SEARCH("-7",RC[-6])+2,10),IFERROR(MID(RC[-6],SEARCH("-6",RC[-6])+2,10),IFERROR(MID(RC[-6],SEARCH("-5",RC[-6])+2,10),IFERROR(MID(RC[-6],SEARCH("-4",RC[-6])+2,10),IFERROR(MID(RC[-6],SEARCH("-3",RC[-6])+2,10),IFERROR(MID(RC[-6],SEARCH("-2",RC[-6])+2,10),IFERROR(MID(RC[-6],SEARCH("-1",RC[-6])+2,10),IFERROR(MID(RC[-6],SEARCH("-",RC[-6])+1,10),))))))))))) -> 宙斯 | I190: ="1"&VLOOKUP(RC[-1],Sheet1!R2C2:R127C3,2,FALSE) -> 131438 | J190: 131438 | K190: =IFERROR(FIND(13,RC[-4],1),"") -> 13 | L190: =IF(RC[-1]="","",MID(RC[-5],RC[-1],6)) -> 131438 | M190: =SUBSTITUTE(RC[-6],RC[-1],RC[-3],1) -> "你将在此死去！"|3#1314384|1
A191: 60335404 | B191: 英雄副本33-5宙斯 | D191: 4 | F191: 4|3|1 | G191: 3#"死亡吧，并且坠入永恒的审判炼狱！"|3#1314384|1 | H191: =IFERROR(MID(RC[-6],SEARCH("-10",RC[-6])+3,10),IFERROR(MID(RC[-6],SEARCH("-9",RC[-6])+2,10),IFERROR(MID(RC[-6],SEARCH("-8",RC[-6])+2,10),IFERROR(MID(RC[-6],SEARCH("-7",RC[-6])+2,10),IFERROR(MID(RC[-6],SEARCH("-6",RC[-6])+2,10),IFERROR(MID(RC[-6],SEARCH("-5",RC[-6])+2,10),IFERROR(MID(RC[-6],SEARCH("-4",RC[-6])+2,10),IFERROR(MID(RC[-6],SEARCH("-3",RC[-6])+2,10),IFERROR(MID(RC[-6],SEARCH("-2",RC[-6])+2,10),IFERROR(MID(RC[-6],SEARCH("-1",RC[-6])+2,10),IFERROR(MID(RC[-6],SEARCH("-",RC[-6])+1,10),))))))))))) -> 宙斯 | I191: ="1"&VLOOKUP(RC[-1],Sheet1!R2C2:R127C3,2,FALSE) -> 131438 | J191: 131438 | K191: =IFERROR(FIND(13,RC[-4],1),"") -> 24 | L191: =IF(RC[-1]="","",MID(RC[-5],RC[-1],6)) -> 131438 | M191: =SUBSTITUTE(RC[-6],RC[-1],RC[-3],1) -> 3#"死亡吧，并且坠入永恒的审判炼狱！"|3#1314384|1
A192: 10000001 | B192: 1-1死亡武士 | D192: 1 | E192: 100000|80 | F192: 3|4|1 | G192: "你来真的？"|3#1#1303024|1 | H192: =IFERROR(MID(RC[-6],SEARCH("-10",RC[-6])+3,10),IFERROR(MID(RC[-6],SEARCH("-9",RC[-6])+2,10),IFERROR(MID(RC[-6],SEARCH("-8",RC[-6])+2,10),IFERROR(MID(RC[-6],SEARCH("-7",RC[-6])+2,10),IFERROR(MID(RC[-6],SEARCH("-6",RC[-6])+2,10),IFERROR(MID(RC[-6],SEARCH("-5",RC[-6])+2,10),IFERROR(MID(RC[-6],SEARCH("-4",RC[-6])+2,10),IFERROR(MID(RC[-6],SEARCH("-3",RC[-6])+2,10),IFERROR(MID(RC[-6],SEARCH("-2",RC[-6])+2,10),IFERROR(MID(RC[-6],SEARCH("-1",RC[-6])+2,10),IFERROR(MID(RC[-6],SEARCH("-",RC[-6])+1,10),))))))))))) -> 死亡武士 | I192: ="1"&VLOOKUP(RC[-1],Sheet1!R2C2:R127C3,2,FALSE) -> 130302 | J192: 130302 | K192: =IFERROR(FIND(13,RC[-4],1),"") -> 13 | L192: =IF(RC[-1]="","",MID(RC[-5],RC[-1],6)) -> 130302 | M192: =SUBSTITUTE(RC[-6],RC[-1],RC[-3],1) -> "你来真的？"|3#1#1303024|1
A193: 10015201 | B193: 2-6食人魔 | D193: 1 | E193: 100132|95 | F193: 3|1 | G193: "食物，烤熟了才好吃！"|3#400011|1 | H193: =IFERROR(MID(RC[-6],SEARCH("-10",RC[-6])+3,10),IFERROR(MID(RC[-6],SEARCH("-9",RC[-6])+2,10),IFERROR(MID(RC[-6],SEARCH("-8",RC[-6])+2,10),IFERROR(MID(RC[-6],SEARCH("-7",RC[-6])+2,10),IFERROR(MID(RC[-6],SEARCH("-6",RC[-6])+2,10),IFERROR(MID(RC[-6],SEARCH("-5",RC[-6])+2,10),IFERROR(MID(RC[-6],SEARCH("-4",RC[-6])+2,10),IFERROR(MID(RC[-6],SEARCH("-3",RC[-6])+2,10),IFERROR(MID(RC[-6],SEARCH("-2",RC[-6])+2,10),IFERROR(MID(RC[-6],SEARCH("-1",RC[-6])+2,10),IFERROR(MID(RC[-6],SEARCH("-",RC[-6])+1,10),))))))))))) -> 食人魔 | I193: ="1"&VLOOKUP(RC[-1],Sheet1!R2C2:R127C3,2,FALSE) -> 132431 | J193: 132431 | K193: =IFERROR(FIND(13,RC[-4],1),"") ->  | L193: =IF(RC[-1]="","",MID(RC[-5],RC[-1],6)) ->  | M193: =SUBSTITUTE(RC[-6],RC[-1],RC[-3],1) -> "食物，烤熟了才好吃！"|3#400011|1
A194: 10015202 | B194: 2-6食人魔 | D194: 1 | E194: 100132|60 | F194: 3|1 | G194: "你能挡住几次？"|3#400011|1 | H194: =IFERROR(MID(RC[-6],SEARCH("-10",RC[-6])+3,10),IFERROR(MID(RC[-6],SEARCH("-9",RC[-6])+2,10),IFERROR(MID(RC[-6],SEARCH("-8",RC[-6])+2,10),IFERROR(MID(RC[-6],SEARCH("-7",RC[-6])+2,10),IFERROR(MID(RC[-6],SEARCH("-6",RC[-6])+2,10),IFERROR(MID(RC[-6],SEARCH("-5",RC[-6])+2,10),IFERROR(MID(RC[-6],SEARCH("-4",RC[-6])+2,10),IFERROR(MID(RC[-6],SEARCH("-3",RC[-6])+2,10),IFERROR(MID(RC[-6],SEARCH("-2",RC[-6])+2,10),IFERROR(MID(RC[-6],SEARCH("-1",RC[-6])+2,10),IFERROR(MID(RC[-6],SEARCH("-",RC[-6])+1,10),))))))))))) -> 食人魔 | I194: ="1"&VLOOKUP(RC[-1],Sheet1!R2C2:R127C3,2,FALSE) -> 132431 | J194: 132431 | K194: =IFERROR(FIND(13,RC[-4],1),"") ->  | L194: =IF(RC[-1]="","",MID(RC[-5],RC[-1],6)) ->  | M194: =SUBSTITUTE(RC[-6],RC[-1],RC[-3],1) -> "你能挡住几次？"|3#400011|1
A195: 10015203 | B195: 2-6食人魔 | D195: 1 | E195: 100132|25 | F195: 3|1 | G195: "FFF！！！"|3#400011|1 | H195: =IFERROR(MID(RC[-6],SEARCH("-10",RC[-6])+3,10),IFERROR(MID(RC[-6],SEARCH("-9",RC[-6])+2,10),IFERROR(MID(RC[-6],SEARCH("-8",RC[-6])+2,10),IFERROR(MID(RC[-6],SEARCH("-7",RC[-6])+2,10),IFERROR(MID(RC[-6],SEARCH("-6",RC[-6])+2,10),IFERROR(MID(RC[-6],SEARCH("-5",RC[-6])+2,10),IFERROR(MID(RC[-6],SEARCH("-4",RC[-6])+2,10),IFERROR(MID(RC[-6],SEARCH("-3",RC[-6])+2,10),IFERROR(MID(RC[-6],SEARCH("-2",RC[-6])+2,10),IFERROR(MID(RC[-6],SEARCH("-1",RC[-6])+2,10),IFERROR(MID(RC[-6],SEARCH("-",RC[-6])+1,10),))))))))))) -> 食人魔 | I195: ="1"&VLOOKUP(RC[-1],Sheet1!R2C2:R127C3,2,FALSE) -> 132431 | J195: 132431 | K195: =IFERROR(FIND(13,RC[-4],1),"") ->  | L195: =IF(RC[-1]="","",MID(RC[-5],RC[-1],6)) ->  | M195: =SUBSTITUTE(RC[-6],RC[-1],RC[-3],1) -> "FFF！！！"|3#400011|1
A196: 10022201 | B196: 3-3杰克船长 | D196: 1 | E196: 100222|80 | F196: 3|1 | G196: "开炮！"|3#1313014|1 | H196: =IFERROR(MID(RC[-6],SEARCH("-10",RC[-6])+3,10),IFERROR(MID(RC[-6],SEARCH("-9",RC[-6])+2,10),IFERROR(MID(RC[-6],SEARCH("-8",RC[-6])+2,10),IFERROR(MID(RC[-6],SEARCH("-7",RC[-6])+2,10),IFERROR(MID(RC[-6],SEARCH("-6",RC[-6])+2,10),IFERROR(MID(RC[-6],SEARCH("-5",RC[-6])+2,10),IFERROR(MID(RC[-6],SEARCH("-4",RC[-6])+2,10),IFERROR(MID(RC[-6],SEARCH("-3",RC[-6])+2,10),IFERROR(MID(RC[-6],SEARCH("-2",RC[-6])+2,10),IFERROR(MID(RC[-6],SEARCH("-1",RC[-6])+2,10),IFERROR(MID(RC[-6],SEARCH("-",RC[-6])+1,10),))))))))))) -> 杰克船长 | I196: ="1"&VLOOKUP(RC[-1],Sheet1!R2C2:R127C3,2,FALSE) -> 131301 | J196: 131301 | K196: =IFERROR(FIND(13,RC[-4],1),"") -> 9 | L196: =IF(RC[-1]="","",MID(RC[-5],RC[-1],6)) -> 131301 | M196: =SUBSTITUTE(RC[-6],RC[-1],RC[-3],1) -> "开炮！"|3#1313014|1
A197: 10022202 | B197: 3-3杰克船长 | D197: 1 | E197: 100222|50 | F197: 3|1 | G197: "不要留情！"|3#1313014|1 | H197: =IFERROR(MID(RC[-6],SEARCH("-10",RC[-6])+3,10),IFERROR(MID(RC[-6],SEARCH("-9",RC[-6])+2,10),IFERROR(MID(RC[-6],SEARCH("-8",RC[-6])+2,10),IFERROR(MID(RC[-6],SEARCH("-7",RC[-6])+2,10),IFERROR(MID(RC[-6],SEARCH("-6",RC[-6])+2,10),IFERROR(MID(RC[-6],SEARCH("-5",RC[-6])+2,10),IFERROR(MID(RC[-6],SEARCH("-4",RC[-6])+2,10),IFERROR(MID(RC[-6],SEARCH("-3",RC[-6])+2,10),IFERROR(MID(RC[-6],SEARCH("-2",RC[-6])+2,10),IFERROR(MID(RC[-6],SEARCH("-1",RC[-6])+2,10),IFERROR(MID(RC[-6],SEARCH("-",RC[-6])+1,10),))))))))))) -> 杰克船长 | I197: ="1"&VLOOKUP(RC[-1],Sheet1!R2C2:R127C3,2,FALSE) -> 131301 | J197: 131301 | K197: =IFERROR(FIND(13,RC[-4],1),"") -> 11 | L197: =IF(RC[-1]="","",MID(RC[-5],RC[-1],6)) -> 131301 | M197: =SUBSTITUTE(RC[-6],RC[-1],RC[-3],1) -> "不要留情！"|3#1313014|1
A198: 10022203 | B198: 3-3杰克船长 | D198: 1 | E198: 100222|20 | F198: 3|1 | G198: "去死吧！！"|3#1313014|1 | H198: =IFERROR(MID(RC[-6],SEARCH("-10",RC[-6])+3,10),IFERROR(MID(RC[-6],SEARCH("-9",RC[-6])+2,10),IFERROR(MID(RC[-6],SEARCH("-8",RC[-6])+2,10),IFERROR(MID(RC[-6],SEARCH("-7",RC[-6])+2,10),IFERROR(MID(RC[-6],SEARCH("-6",RC[-6])+2,10),IFERROR(MID(RC[-6],SEARCH("-5",RC[-6])+2,10),IFERROR(MID(RC[-6],SEARCH("-4",RC[-6])+2,10),IFERROR(MID(RC[-6],SEARCH("-3",RC[-6])+2,10),IFERROR(MID(RC[-6],SEARCH("-2",RC[-6])+2,10),IFERROR(MID(RC[-6],SEARCH("-1",RC[-6])+2,10),IFERROR(MID(RC[-6],SEARCH("-",RC[-6])+1,10),))))))))))) -> 杰克船长 | I198: ="1"&VLOOKUP(RC[-1],Sheet1!R2C2:R127C3,2,FALSE) -> 131301 | J198: 131301 | K198: =IFERROR(FIND(13,RC[-4],1),"") -> 11 | L198: =IF(RC[-1]="","",MID(RC[-5],RC[-1],6)) -> 131301 | M198: =SUBSTITUTE(RC[-6],RC[-1],RC[-3],1) -> "去死吧！！"|3#1313014|1
A199: 10025301 | B199: 3-6基伦 | D199: 1 | E199: 100253|40 | F199: 4|1|4|2|4|2|4|2|4|2|4|2|4|2|4|2|4|2|4|2|4|2|4|2|4|2|4|2|4|2|4|2|4|2|4|2|4|2|4|2 | G199: 0.5#400004|2#1#100253|400005|0#1.5#100253|400005|0#1.5#100253|400005|0#1.5#100253|400005|0#1.5#100253|400005|0#1.5#100253|400005|0#1.5#100253|400005|0#1.5#100253|400005|0#1.5#100253|400005|0#1.5#100253|400005|0#1.5#100253|400005|0#1.5#100253|400005|0#1.5#100253|400005|0#1.5#100253|400005|0#1.5#100253|400005|0#1.5#100253|400005|0#1.5#100253|400005|0#1.5#100253|400005|0#1.5#100253|400005|0 | H199: =IFERROR(MID(RC[-6],SEARCH("-10",RC[-6])+3,10),IFERROR(MID(RC[-6],SEARCH("-9",RC[-6])+2,10),IFERROR(MID(RC[-6],SEARCH("-8",RC[-6])+2,10),IFERROR(MID(RC[-6],SEARCH("-7",RC[-6])+2,10),IFERROR(MID(RC[-6],SEARCH("-6",RC[-6])+2,10),IFERROR(MID(RC[-6],SEARCH("-5",RC[-6])+2,10),IFERROR(MID(RC[-6],SEARCH("-4",RC[-6])+2,10),IFERROR(MID(RC[-6],SEARCH("-3",RC[-6])+2,10),IFERROR(MID(RC[-6],SEARCH("-2",RC[-6])+2,10),IFERROR(MID(RC[-6],SEARCH("-1",RC[-6])+2,10),IFERROR(MID(RC[-6],SEARCH("-",RC[-6])+1,10),))))))))))) -> 基伦 | I199: ="1"&VLOOKUP(RC[-1],Sheet1!R2C2:R127C3,2,FALSE) -> 132402 | J199: 132402 | K199: =IFERROR(FIND(13,RC[-4],1),"") ->  | L199: =IF(RC[-1]="","",MID(RC[-5],RC[-1],6)) ->  | M199: =SUBSTITUTE(RC[-6],RC[-1],RC[-3],1) -> 0.5#400004|2#1#100253|400005|0#1.5#100253|400005|0#1.5#100253|400005|0#1.5#100253|400005|0#1.5#100253|400005|0#1.5#100253|400005|0#1.5#100253|400005|0#1.5#100253|400005|0#1.5#100253|400005|0#1.5#100253|400005|0#1.5#100253|400005|0#1.5#100253|400005|0#1.5#100253|400005|0#1.5#100253|400005|0#1.5#100253|400005|0#1.5#100253|400005|0#1.5#100253|400005|0#1.5#100253|400005|0#1.5#100253|400005|0
A200: 10025302 | B200: 3-6基伦 | D200: 1 | E200: 100253|40 | F200: 3|4|3|4|3|4|3 | G200: "这就是我的正义！"|2#2#"战争无分对错"|2#2#"我必须坚守我的立场"|2#2#"请你们消失吧！"|2 | H200: =IFERROR(MID(RC[-6],SEARCH("-10",RC[-6])+3,10),IFERROR(MID(RC[-6],SEARCH("-9",RC[-6])+2,10),IFERROR(MID(RC[-6],SEARCH("-8",RC[-6])+2,10),IFERROR(MID(RC[-6],SEARCH("-7",RC[-6])+2,10),IFERROR(MID(RC[-6],SEARCH("-6",RC[-6])+2,10),IFERROR(MID(RC[-6],SEARCH("-5",RC[-6])+2,10),IFERROR(MID(RC[-6],SEARCH("-4",RC[-6])+2,10),IFERROR(MID(RC[-6],SEARCH("-3",RC[-6])+2,10),IFERROR(MID(RC[-6],SEARCH("-2",RC[-6])+2,10),IFERROR(MID(RC[-6],SEARCH("-1",RC[-6])+2,10),IFERROR(MID(RC[-6],SEARCH("-",RC[-6])+1,10),))))))))))) -> 基伦 | I200: ="1"&VLOOKUP(RC[-1],Sheet1!R2C2:R127C3,2,FALSE) -> 132402 | J200: 132402 | K200: =IFERROR(FIND(13,RC[-4],1),"") ->  | L200: =IF(RC[-1]="","",MID(RC[-5],RC[-1],6)) ->  | M200: =SUBSTITUTE(RC[-6],RC[-1],RC[-3],1) -> "这就是我的正义！"|2#2#"战争无分对错"|2#2#"我必须坚守我的立场"|2#2#"请你们消失吧！"|2
A201: 10025303 | B201: 3-6基伦 | D201: 3 | F201: 3 | G201: "死亡并不可怕……"|2 | H201: =IFERROR(MID(RC[-6],SEARCH("-10",RC[-6])+3,10),IFERROR(MID(RC[-6],SEARCH("-9",RC[-6])+2,10),IFERROR(MID(RC[-6],SEARCH("-8",RC[-6])+2,10),IFERROR(MID(RC[-6],SEARCH("-7",RC[-6])+2,10),IFERROR(MID(RC[-6],SEARCH("-6",RC[-6])+2,10),IFERROR(MID(RC[-6],SEARCH("-5",RC[-6])+2,10),IFERROR(MID(RC[-6],SEARCH("-4",RC[-6])+2,10),IFERROR(MID(RC[-6],SEARCH("-3",RC[-6])+2,10),IFERROR(MID(RC[-6],SEARCH("-2",RC[-6])+2,10),IFERROR(MID(RC[-6],SEARCH("-1",RC[-6])+2,10),IFERROR(MID(RC[-6],SEARCH("-",RC[-6])+1,10),))))))))))) -> 基伦 | I201: ="1"&VLOOKUP(RC[-1],Sheet1!R2C2:R127C3,2,FALSE) -> 132402 | J201: 132402 | K201: =IFERROR(FIND(13,RC[-4],1),"") ->  | L201: =IF(RC[-1]="","",MID(RC[-5],RC[-1],6)) ->  | M201: =SUBSTITUTE(RC[-6],RC[-1],RC[-3],1) -> "死亡并不可怕……"|2
A202: 10033201 | B202: 4-4女警 | D202: 2 | E202: 7 | F202: 1|4|3|4|1|4|3|4|1|4|1|4|3|4|1|4|1|4|1|4|1|4|1|4|1|4|1|4|1|4|1|4|1|4|1|4|1|4|1|4|1|4|1|4|1|4|3 | G202: 1324204|1#10#"你能挡住几次？"|3#2#1324204|1#10#"我可是有20发子弹"|3#2#1324204|1#12#1324204|1#1#"狙击子弹的填装太慢了"|3#11#1324204|1#12#1324204|1#7#1324204|1#7#1324204|1#7#1324204|1#7#1324204|1#7#1324204|1#7#1324204|1#7#1324204|1#7#1324204|1#7#1324204|1#7#1324204|1#7#1324204|1#7#1324204|1#7#1324204|1#7#1324204|1#7#1#"糟糕，子弹用完了"|3 | H202: =IFERROR(MID(RC[-6],SEARCH("-10",RC[-6])+3,10),IFERROR(MID(RC[-6],SEARCH("-9",RC[-6])+2,10),IFERROR(MID(RC[-6],SEARCH("-8",RC[-6])+2,10),IFERROR(MID(RC[-6],SEARCH("-7",RC[-6])+2,10),IFERROR(MID(RC[-6],SEARCH("-6",RC[-6])+2,10),IFERROR(MID(RC[-6],SEARCH("-5",RC[-6])+2,10),IFERROR(MID(RC[-6],SEARCH("-4",RC[-6])+2,10),IFERROR(MID(RC[-6],SEARCH("-3",RC[-6])+2,10),IFERROR(MID(RC[-6],SEARCH("-2",RC[-6])+2,10),IFERROR(MID(RC[-6],SEARCH("-1",RC[-6])+2,10),IFERROR(MID(RC[-6],SEARCH("-",RC[-6])+1,10),))))))))))) -> 女警 | I202: ="1"&VLOOKUP(RC[-1],Sheet1!R2C2:R127C3,2,FALSE) -> 132420 | J202: 132420 | K202: =IFERROR(FIND(13,RC[-4],1),"") -> 1 | L202: =IF(RC[-1]="","",MID(RC[-5],RC[-1],6)) -> 132420 | M202: =SUBSTITUTE(RC[-6],RC[-1],RC[-3],1) -> 1324204|1#10#"你能挡住几次？"|3#2#1324204|1#10#"我可是有20发子弹"|3#2#1324204|1#12#1324204|1#1#"狙击子弹的填装太慢了"|3#11#1324204|1#12#1324204|1#7#1324204|1#7#1324204|1#7#1324204|1#7#1324204|1#7#1324204|1#7#1324204|1#7#1324204|1#7#1324204|1#7#1324204|1#7#1324204|1#7#1324204|1#7#1324204|1#7#1324204|1#7#1324204|1#7#1#"糟糕，子弹用完了"|3
A203: 10037201 | B203: 4-8天使长 | D203: 1 | E203: 100372|90 | F203: 3|4|1 | G203: "圣光不止拯救，还有惩戒！"|3#1#400002|1 | H203: =IFERROR(MID(RC[-6],SEARCH("-10",RC[-6])+3,10),IFERROR(MID(RC[-6],SEARCH("-9",RC[-6])+2,10),IFERROR(MID(RC[-6],SEARCH("-8",RC[-6])+2,10),IFERROR(MID(RC[-6],SEARCH("-7",RC[-6])+2,10),IFERROR(MID(RC[-6],SEARCH("-6",RC[-6])+2,10),IFERROR(MID(RC[-6],SEARCH("-5",RC[-6])+2,10),IFERROR(MID(RC[-6],SEARCH("-4",RC[-6])+2,10),IFERROR(MID(RC[-6],SEARCH("-3",RC[-6])+2,10),IFERROR(MID(RC[-6],SEARCH("-2",RC[-6])+2,10),IFERROR(MID(RC[-6],SEARCH("-1",RC[-6])+2,10),IFERROR(MID(RC[-6],SEARCH("-",RC[-6])+1,10),))))))))))) -> 天使长 | I203: ="1"&VLOOKUP(RC[-1],Sheet1!R2C2:R127C3,2,FALSE) -> 131341 | J203: 131341 | K203: =IFERROR(FIND(13,RC[-4],1),"") ->  | L203: =IF(RC[-1]="","",MID(RC[-5],RC[-1],6)) ->  | M203: =SUBSTITUTE(RC[-6],RC[-1],RC[-3],1) -> "圣光不止拯救，还有惩戒！"|3#1#400002|1
A204: 10037202 | B204: 4-8天使长 | D204: 1 | E204: 100372|55 | F204: 3|4|1 | G204: "圣光不止拯救，还有惩戒！"|3#1#400002|1 | H204: =IFERROR(MID(RC[-6],SEARCH("-10",RC[-6])+3,10),IFERROR(MID(RC[-6],SEARCH("-9",RC[-6])+2,10),IFERROR(MID(RC[-6],SEARCH("-8",RC[-6])+2,10),IFERROR(MID(RC[-6],SEARCH("-7",RC[-6])+2,10),IFERROR(MID(RC[-6],SEARCH("-6",RC[-6])+2,10),IFERROR(MID(RC[-6],SEARCH("-5",RC[-6])+2,10),IFERROR(MID(RC[-6],SEARCH("-4",RC[-6])+2,10),IFERROR(MID(RC[-6],SEARCH("-3",RC[-6])+2,10),IFERROR(MID(RC[-6],SEARCH("-2",RC[-6])+2,10),IFERROR(MID(RC[-6],SEARCH("-1",RC[-6])+2,10),IFERROR(MID(RC[-6],SEARCH("-",RC[-6])+1,10),))))))))))) -> 天使长 | I204: ="1"&VLOOKUP(RC[-1],Sheet1!R2C2:R127C3,2,FALSE) -> 131341 | J204: 131341 | K204: =IFERROR(FIND(13,RC[-4],1),"") ->  | L204: =IF(RC[-1]="","",MID(RC[-5],RC[-1],6)) ->  | M204: =SUBSTITUTE(RC[-6],RC[-1],RC[-3],1) -> "圣光不止拯救，还有惩戒！"|3#1#400002|1
A205: 10037203 | B205: 4-8天使长 | D205: 1 | E205: 100372|20 | F205: 3|4|1 | G205: "圣光不止拯救，还有惩戒！"|3#1#400002|1 | H205: =IFERROR(MID(RC[-6],SEARCH("-10",RC[-6])+3,10),IFERROR(MID(RC[-6],SEARCH("-9",RC[-6])+2,10),IFERROR(MID(RC[-6],SEARCH("-8",RC[-6])+2,10),IFERROR(MID(RC[-6],SEARCH("-7",RC[-6])+2,10),IFERROR(MID(RC[-6],SEARCH("-6",RC[-6])+2,10),IFERROR(MID(RC[-6],SEARCH("-5",RC[-6])+2,10),IFERROR(MID(RC[-6],SEARCH("-4",RC[-6])+2,10),IFERROR(MID(RC[-6],SEARCH("-3",RC[-6])+2,10),IFERROR(MID(RC[-6],SEARCH("-2",RC[-6])+2,10),IFERROR(MID(RC[-6],SEARCH("-1",RC[-6])+2,10),IFERROR(MID(RC[-6],SEARCH("-",RC[-6])+1,10),))))))))))) -> 天使长 | I205: ="1"&VLOOKUP(RC[-1],Sheet1!R2C2:R127C3,2,FALSE) -> 131341 | J205: 131341 | K205: =IFERROR(FIND(13,RC[-4],1),"") ->  | L205: =IF(RC[-1]="","",MID(RC[-5],RC[-1],6)) ->  | M205: =SUBSTITUTE(RC[-6],RC[-1],RC[-3],1) -> "圣光不止拯救，还有惩戒！"|3#1#400002|1
A206: 10045301 | B206: 5-6德古拉伯爵 | D206: 1 | E206: 100453|80 | F206: 3|1 | G206: "我需要鲜血"|2#400009|1 | H206: =IFERROR(MID(RC[-6],SEARCH("-10",RC[-6])+3,10),IFERROR(MID(RC[-6],SEARCH("-9",RC[-6])+2,10),IFERROR(MID(RC[-6],SEARCH("-8",RC[-6])+2,10),IFERROR(MID(RC[-6],SEARCH("-7",RC[-6])+2,10),IFERROR(MID(RC[-6],SEARCH("-6",RC[-6])+2,10),IFERROR(MID(RC[-6],SEARCH("-5",RC[-6])+2,10),IFERROR(MID(RC[-6],SEARCH("-4",RC[-6])+2,10),IFERROR(MID(RC[-6],SEARCH("-3",RC[-6])+2,10),IFERROR(MID(RC[-6],SEARCH("-2",RC[-6])+2,10),IFERROR(MID(RC[-6],SEARCH("-1",RC[-6])+2,10),IFERROR(MID(RC[-6],SEARCH("-",RC[-6])+1,10),))))))))))) -> 德古拉伯爵 | I206: ="1"&VLOOKUP(RC[-1],Sheet1!R2C2:R127C3,2,FALSE) -> 131401 | J206: 131401 | K206: =IFERROR(FIND(13,RC[-4],1),"") ->  | L206: =IF(RC[-1]="","",MID(RC[-5],RC[-1],6)) ->  | M206: =SUBSTITUTE(RC[-6],RC[-1],RC[-3],1) -> "我需要鲜血"|2#400009|1
A207: 10045302 | B207: 5-6德古拉伯爵 | D207: 1 | E207: 100453|30 | F207: 3|1 | G207: "我需要鲜血"|2#400009|1 | H207: =IFERROR(MID(RC[-6],SEARCH("-10",RC[-6])+3,10),IFERROR(MID(RC[-6],SEARCH("-9",RC[-6])+2,10),IFERROR(MID(RC[-6],SEARCH("-8",RC[-6])+2,10),IFERROR(MID(RC[-6],SEARCH("-7",RC[-6])+2,10),IFERROR(MID(RC[-6],SEARCH("-6",RC[-6])+2,10),IFERROR(MID(RC[-6],SEARCH("-5",RC[-6])+2,10),IFERROR(MID(RC[-6],SEARCH("-4",RC[-6])+2,10),IFERROR(MID(RC[-6],SEARCH("-3",RC[-6])+2,10),IFERROR(MID(RC[-6],SEARCH("-2",RC[-6])+2,10),IFERROR(MID(RC[-6],SEARCH("-1",RC[-6])+2,10),IFERROR(MID(RC[-6],SEARCH("-",RC[-6])+1,10),))))))))))) -> 德古拉伯爵 | I207: ="1"&VLOOKUP(RC[-1],Sheet1!R2C2:R127C3,2,FALSE) -> 131401 | J207: 131401 | K207: =IFERROR(FIND(13,RC[-4],1),"") ->  | L207: =IF(RC[-1]="","",MID(RC[-5],RC[-1],6)) ->  | M207: =SUBSTITUTE(RC[-6],RC[-1],RC[-3],1) -> "我需要鲜血"|2#400009|1
A208: 10049401 | B208: 5-10红颅鬼 | D208: 6 | F208: 3|4|1 | G208: "杀害我的人？胆量不错"|3#1#400025|1 | H208: =IFERROR(MID(RC[-6],SEARCH("-10",RC[-6])+3,10),IFERROR(MID(RC[-6],SEARCH("-9",RC[-6])+2,10),IFERROR(MID(RC[-6],SEARCH("-8",RC[-6])+2,10),IFERROR(MID(RC[-6],SEARCH("-7",RC[-6])+2,10),IFERROR(MID(RC[-6],SEARCH("-6",RC[-6])+2,10),IFERROR(MID(RC[-6],SEARCH("-5",RC[-6])+2,10),IFERROR(MID(RC[-6],SEARCH("-4",RC[-6])+2,10),IFERROR(MID(RC[-6],SEARCH("-3",RC[-6])+2,10),IFERROR(MID(RC[-6],SEARCH("-2",RC[-6])+2,10),IFERROR(MID(RC[-6],SEARCH("-1",RC[-6])+2,10),IFERROR(MID(RC[-6],SEARCH("-",RC[-6])+1,10),))))))))))) -> 红颅鬼 | I208: ="1"&VLOOKUP(RC[-1],Sheet1!R2C2:R127C3,2,FALSE) -> 130998 | J208: 130430 | K208: =IFERROR(FIND(13,RC[-4],1),"") ->  | L208: =IF(RC[-1]="","",MID(RC[-5],RC[-1],6)) ->  | M208: =SUBSTITUTE(RC[-6],RC[-1],RC[-3],1) -> "杀害我的人？胆量不错"|3#1#400025|1
A209: 10049402 | B209: 5-10红颅鬼 | D209: 1 | E209: 100494|50 | F209: 3|4|1 | G209: "怒火都快把我脑袋烧红了"|3#1#400025|1 | H209: =IFERROR(MID(RC[-6],SEARCH("-10",RC[-6])+3,10),IFERROR(MID(RC[-6],SEARCH("-9",RC[-6])+2,10),IFERROR(MID(RC[-6],SEARCH("-8",RC[-6])+2,10),IFERROR(MID(RC[-6],SEARCH("-7",RC[-6])+2,10),IFERROR(MID(RC[-6],SEARCH("-6",RC[-6])+2,10),IFERROR(MID(RC[-6],SEARCH("-5",RC[-6])+2,10),IFERROR(MID(RC[-6],SEARCH("-4",RC[-6])+2,10),IFERROR(MID(RC[-6],SEARCH("-3",RC[-6])+2,10),IFERROR(MID(RC[-6],SEARCH("-2",RC[-6])+2,10),IFERROR(MID(RC[-6],SEARCH("-1",RC[-6])+2,10),IFERROR(MID(RC[-6],SEARCH("-",RC[-6])+1,10),))))))))))) -> 红颅鬼 | I209: ="1"&VLOOKUP(RC[-1],Sheet1!R2C2:R127C3,2,FALSE) -> 130998 | J209: 130430 | K209: =IFERROR(FIND(13,RC[-4],1),"") ->  | L209: =IF(RC[-1]="","",MID(RC[-5],RC[-1],6)) ->  | M209: =SUBSTITUTE(RC[-6],RC[-1],RC[-3],1) -> "怒火都快把我脑袋烧红了"|3#1#400025|1
A210: 10052301 | B210: 6-3鹰眸 | D210: 1 | E210: 100523|70 | F210: 3|1 | G210: "箭已满弓"|2#1304204|1 | H210: =IFERROR(MID(RC[-6],SEARCH("-10",RC[-6])+3,10),IFERROR(MID(RC[-6],SEARCH("-9",RC[-6])+2,10),IFERROR(MID(RC[-6],SEARCH("-8",RC[-6])+2,10),IFERROR(MID(RC[-6],SEARCH("-7",RC[-6])+2,10),IFERROR(MID(RC[-6],SEARCH("-6",RC[-6])+2,10),IFERROR(MID(RC[-6],SEARCH("-5",RC[-6])+2,10),IFERROR(MID(RC[-6],SEARCH("-4",RC[-6])+2,10),IFERROR(MID(RC[-6],SEARCH("-3",RC[-6])+2,10),IFERROR(MID(RC[-6],SEARCH("-2",RC[-6])+2,10),IFERROR(MID(RC[-6],SEARCH("-1",RC[-6])+2,10),IFERROR(MID(RC[-6],SEARCH("-",RC[-6])+1,10),))))))))))) -> 鹰眸 | I210: ="1"&VLOOKUP(RC[-1],Sheet1!R2C2:R127C3,2,FALSE) -> 130420 | J210: 130420 | K210: =IFERROR(FIND(13,RC[-4],1),"") -> 10 | L210: =IF(RC[-1]="","",MID(RC[-5],RC[-1],6)) -> 130420 | M210: =SUBSTITUTE(RC[-6],RC[-1],RC[-3],1) -> "箭已满弓"|2#1304204|1
A211: 10052302 | B211: 6-3鹰眸 | D211: 1 | E211: 100523|30 | F211: 3|1 | G211: "一击致命！"|2#1304204|1 | H211: =IFERROR(MID(RC[-6],SEARCH("-10",RC[-6])+3,10),IFERROR(MID(RC[-6],SEARCH("-9",RC[-6])+2,10),IFERROR(MID(RC[-6],SEARCH("-8",RC[-6])+2,10),IFERROR(MID(RC[-6],SEARCH("-7",RC[-6])+2,10),IFERROR(MID(RC[-6],SEARCH("-6",RC[-6])+2,10),IFERROR(MID(RC[-6],SEARCH("-5",RC[-6])+2,10),IFERROR(MID(RC[-6],SEARCH("-4",RC[-6])+2,10),IFERROR(MID(RC[-6],SEARCH("-3",RC[-6])+2,10),IFERROR(MID(RC[-6],SEARCH("-2",RC[-6])+2,10),IFERROR(MID(RC[-6],SEARCH("-1",RC[-6])+2,10),IFERROR(MID(RC[-6],SEARCH("-",RC[-6])+1,10),))))))))))) -> 鹰眸 | I211: ="1"&VLOOKUP(RC[-1],Sheet1!R2C2:R127C3,2,FALSE) -> 130420 | J211: 130420 | K211: =IFERROR(FIND(13,RC[-4],1),"") -> 11 | L211: =IF(RC[-1]="","",MID(RC[-5],RC[-1],6)) -> 130420 | M211: =SUBSTITUTE(RC[-6],RC[-1],RC[-3],1) -> "一击致命！"|2#1304204|1
A212: 10052303 | B212: 6-3鹰眸 | D212: 6 | F212: 3|1 | G212: "你的心脏——我就收下了！"|2#1304204|1 | H212: =IFERROR(MID(RC[-6],SEARCH("-10",RC[-6])+3,10),IFERROR(MID(RC[-6],SEARCH("-9",RC[-6])+2,10),IFERROR(MID(RC[-6],SEARCH("-8",RC[-6])+2,10),IFERROR(MID(RC[-6],SEARCH("-7",RC[-6])+2,10),IFERROR(MID(RC[-6],SEARCH("-6",RC[-6])+2,10),IFERROR(MID(RC[-6],SEARCH("-5",RC[-6])+2,10),IFERROR(MID(RC[-6],SEARCH("-4",RC[-6])+2,10),IFERROR(MID(RC[-6],SEARCH("-3",RC[-6])+2,10),IFERROR(MID(RC[-6],SEARCH("-2",RC[-6])+2,10),IFERROR(MID(RC[-6],SEARCH("-1",RC[-6])+2,10),IFERROR(MID(RC[-6],SEARCH("-",RC[-6])+1,10),))))))))))) -> 鹰眸 | I212: ="1"&VLOOKUP(RC[-1],Sheet1!R2C2:R127C3,2,FALSE) -> 130420 | J212: 130420 | K212: =IFERROR(FIND(13,RC[-4],1),"") -> 18 | L212: =IF(RC[-1]="","",MID(RC[-5],RC[-1],6)) -> 130420 | M212: =SUBSTITUTE(RC[-6],RC[-1],RC[-3],1) -> "你的心脏——我就收下了！"|2#1304204|1
A213: 10055301 | B213: 6-6死亡武士 | C213: 2 | D213: 1 | E213: 100553|70 | F213: 1 | G213: 1303024|1 | H213: =IFERROR(MID(RC[-6],SEARCH("-10",RC[-6])+3,10),IFERROR(MID(RC[-6],SEARCH("-9",RC[-6])+2,10),IFERROR(MID(RC[-6],SEARCH("-8",RC[-6])+2,10),IFERROR(MID(RC[-6],SEARCH("-7",RC[-6])+2,10),IFERROR(MID(RC[-6],SEARCH("-6",RC[-6])+2,10),IFERROR(MID(RC[-6],SEARCH("-5",RC[-6])+2,10),IFERROR(MID(RC[-6],SEARCH("-4",RC[-6])+2,10),IFERROR(MID(RC[-6],SEARCH("-3",RC[-6])+2,10),IFERROR(MID(RC[-6],SEARCH("-2",RC[-6])+2,10),IFERROR(MID(RC[-6],SEARCH("-1",RC[-6])+2,10),IFERROR(MID(RC[-6],SEARCH("-",RC[-6])+1,10),))))))))))) -> 死亡武士 | I213: ="1"&VLOOKUP(RC[-1],Sheet1!R2C2:R127C3,2,FALSE) -> 130302 | J213: 130302 | K213: =IFERROR(FIND(13,RC[-4],1),"") -> 1 | L213: =IF(RC[-1]="","",MID(RC[-5],RC[-1],6)) -> 130302 | M213: =SUBSTITUTE(RC[-6],RC[-1],RC[-3],1) -> 1303024|1
A214: 10055302 | B214: 6-6死亡武士 | C214: 1 | D214: 1 | E214: 100553|40 | F214: 3|4|3|4|3|4|3|1 | G214: "死亡武士将在3秒后恢复所有生命值"|1#1#"死亡武士将在2秒后恢复所有生命值"|1#1#"死亡武士将在1秒后恢复所有生命值"|1#1#"我可是不死的！"|5#400001|2 | H214: =IFERROR(MID(RC[-6],SEARCH("-10",RC[-6])+3,10),IFERROR(MID(RC[-6],SEARCH("-9",RC[-6])+2,10),IFERROR(MID(RC[-6],SEARCH("-8",RC[-6])+2,10),IFERROR(MID(RC[-6],SEARCH("-7",RC[-6])+2,10),IFERROR(MID(RC[-6],SEARCH("-6",RC[-6])+2,10),IFERROR(MID(RC[-6],SEARCH("-5",RC[-6])+2,10),IFERROR(MID(RC[-6],SEARCH("-4",RC[-6])+2,10),IFERROR(MID(RC[-6],SEARCH("-3",RC[-6])+2,10),IFERROR(MID(RC[-6],SEARCH("-2",RC[-6])+2,10),IFERROR(MID(RC[-6],SEARCH("-1",RC[-6])+2,10),IFERROR(MID(RC[-6],SEARCH("-",RC[-6])+1,10),))))))))))) -> 死亡武士 | I214: ="1"&VLOOKUP(RC[-1],Sheet1!R2C2:R127C3,2,FALSE) -> 130302 | J214: 130302 | K214: =IFERROR(FIND(13,RC[-4],1),"") ->  | L214: =IF(RC[-1]="","",MID(RC[-5],RC[-1],6)) ->  | M214: =SUBSTITUTE(RC[-6],RC[-1],RC[-3],1) -> "死亡武士将在3秒后恢复所有生命值"|1#1#"死亡武士将在2秒后恢复所有生命值"|1#1#"死亡武士将在1秒后恢复所有生命值"|1#1#"我可是不死的！"|5#400001|2
A215: 10059301 | B215: 6-10超级队长 | D215: 2 | E215: 15 | F215: 3|1 | G215: "胜利终将到来"|2#400026|1 | H215: =IFERROR(MID(RC[-6],SEARCH("-10",RC[-6])+3,10),IFERROR(MID(RC[-6],SEARCH("-9",RC[-6])+2,10),IFERROR(MID(RC[-6],SEARCH("-8",RC[-6])+2,10),IFERROR(MID(RC[-6],SEARCH("-7",RC[-6])+2,10),IFERROR(MID(RC[-6],SEARCH("-6",RC[-6])+2,10),IFERROR(MID(RC[-6],SEARCH("-5",RC[-6])+2,10),IFERROR(MID(RC[-6],SEARCH("-4",RC[-6])+2,10),IFERROR(MID(RC[-6],SEARCH("-3",RC[-6])+2,10),IFERROR(MID(RC[-6],SEARCH("-2",RC[-6])+2,10),IFERROR(MID(RC[-6],SEARCH("-1",RC[-6])+2,10),IFERROR(MID(RC[-6],SEARCH("-",RC[-6])+1,10),))))))))))) -> 超级队长 | I215: ="1"&VLOOKUP(RC[-1],Sheet1!R2C2:R127C3,2,FALSE) -> 130301 | J215: 130301 | K215: =IFERROR(FIND(13,RC[-4],1),"") ->  | L215: =IF(RC[-1]="","",MID(RC[-5],RC[-1],6)) ->  | M215: =SUBSTITUTE(RC[-6],RC[-1],RC[-3],1) -> "胜利终将到来"|2#400026|1
A216: 10059302 | B216: 6-10超级队长 | D216: 2 | E216: 30 | F216: 3|1 | G216: "我将一如既往"|2#400026|1 | H216: =IFERROR(MID(RC[-6],SEARCH("-10",RC[-6])+3,10),IFERROR(MID(RC[-6],SEARCH("-9",RC[-6])+2,10),IFERROR(MID(RC[-6],SEARCH("-8",RC[-6])+2,10),IFERROR(MID(RC[-6],SEARCH("-7",RC[-6])+2,10),IFERROR(MID(RC[-6],SEARCH("-6",RC[-6])+2,10),IFERROR(MID(RC[-6],SEARCH("-5",RC[-6])+2,10),IFERROR(MID(RC[-6],SEARCH("-4",RC[-6])+2,10),IFERROR(MID(RC[-6],SEARCH("-3",RC[-6])+2,10),IFERROR(MID(RC[-6],SEARCH("-2",RC[-6])+2,10),IFERROR(MID(RC[-6],SEARCH("-1",RC[-6])+2,10),IFERROR(MID(RC[-6],SEARCH("-",RC[-6])+1,10),))))))))))) -> 超级队长 | I216: ="1"&VLOOKUP(RC[-1],Sheet1!R2C2:R127C3,2,FALSE) -> 130301 | J216: 130301 | K216: =IFERROR(FIND(13,RC[-4],1),"") ->  | L216: =IF(RC[-1]="","",MID(RC[-5],RC[-1],6)) ->  | M216: =SUBSTITUTE(RC[-6],RC[-1],RC[-3],1) -> "我将一如既往"|2#400026|1
A217: 10059303 | B217: 6-10超级队长 | D217: 2 | E217: 45 | F217: 1 | G217: 400026|1 | H217: =IFERROR(MID(RC[-6],SEARCH("-10",RC[-6])+3,10),IFERROR(MID(RC[-6],SEARCH("-9",RC[-6])+2,10),IFERROR(MID(RC[-6],SEARCH("-8",RC[-6])+2,10),IFERROR(MID(RC[-6],SEARCH("-7",RC[-6])+2,10),IFERROR(MID(RC[-6],SEARCH("-6",RC[-6])+2,10),IFERROR(MID(RC[-6],SEARCH("-5",RC[-6])+2,10),IFERROR(MID(RC[-6],SEARCH("-4",RC[-6])+2,10),IFERROR(MID(RC[-6],SEARCH("-3",RC[-6])+2,10),IFERROR(MID(RC[-6],SEARCH("-2",RC[-6])+2,10),IFERROR(MID(RC[-6],SEARCH("-1",RC[-6])+2,10),IFERROR(MID(RC[-6],SEARCH("-",RC[-6])+1,10),))))))))))) -> 超级队长 | I217: ="1"&VLOOKUP(RC[-1],Sheet1!R2C2:R127C3,2,FALSE) -> 130301 | J217: 130301 | K217: =IFERROR(FIND(13,RC[-4],1),"") ->  | L217: =IF(RC[-1]="","",MID(RC[-5],RC[-1],6)) ->  | M217: =SUBSTITUTE(RC[-6],RC[-1],RC[-3],1) -> 400026|1
A218: 10059304 | B218: 6-10超级队长 | D218: 2 | E218: 60 | F218: 1 | G218: 400026|1 | H218: =IFERROR(MID(RC[-6],SEARCH("-10",RC[-6])+3,10),IFERROR(MID(RC[-6],SEARCH("-9",RC[-6])+2,10),IFERROR(MID(RC[-6],SEARCH("-8",RC[-6])+2,10),IFERROR(MID(RC[-6],SEARCH("-7",RC[-6])+2,10),IFERROR(MID(RC[-6],SEARCH("-6",RC[-6])+2,10),IFERROR(MID(RC[-6],SEARCH("-5",RC[-6])+2,10),IFERROR(MID(RC[-6],SEARCH("-4",RC[-6])+2,10),IFERROR(MID(RC[-6],SEARCH("-3",RC[-6])+2,10),IFERROR(MID(RC[-6],SEARCH("-2",RC[-6])+2,10),IFERROR(MID(RC[-6],SEARCH("-1",RC[-6])+2,10),IFERROR(MID(RC[-6],SEARCH("-",RC[-6])+1,10),))))))))))) -> 超级队长 | I218: ="1"&VLOOKUP(RC[-1],Sheet1!R2C2:R127C3,2,FALSE) -> 130301 | J218: 130301 | K218: =IFERROR(FIND(13,RC[-4],1),"") ->  | L218: =IF(RC[-1]="","",MID(RC[-5],RC[-1],6)) ->  | M218: =SUBSTITUTE(RC[-6],RC[-1],RC[-3],1) -> 400026|1
A219: 10059305 | B219: 6-10超级队长 | D219: 2 | E219: 75 | F219: 3|1 | G219: "你能坚持多久？"|2#400026|1 | H219: =IFERROR(MID(RC[-6],SEARCH("-10",RC[-6])+3,10),IFERROR(MID(RC[-6],SEARCH("-9",RC[-6])+2,10),IFERROR(MID(RC[-6],SEARCH("-8",RC[-6])+2,10),IFERROR(MID(RC[-6],SEARCH("-7",RC[-6])+2,10),IFERROR(MID(RC[-6],SEARCH("-6",RC[-6])+2,10),IFERROR(MID(RC[-6],SEARCH("-5",RC[-6])+2,10),IFERROR(MID(RC[-6],SEARCH("-4",RC[-6])+2,10),IFERROR(MID(RC[-6],SEARCH("-3",RC[-6])+2,10),IFERROR(MID(RC[-6],SEARCH("-2",RC[-6])+2,10),IFERROR(MID(RC[-6],SEARCH("-1",RC[-6])+2,10),IFERROR(MID(RC[-6],SEARCH("-",RC[-6])+1,10),))))))))))) -> 超级队长 | I219: ="1"&VLOOKUP(RC[-1],Sheet1!R2C2:R127C3,2,FALSE) -> 130301 | J219: 130301 | K219: =IFERROR(FIND(13,RC[-4],1),"") ->  | L219: =IF(RC[-1]="","",MID(RC[-5],RC[-1],6)) ->  | M219: =SUBSTITUTE(RC[-6],RC[-1],RC[-3],1) -> "你能坚持多久？"|2#400026|1
A220: 10059306 | B220: 6-10超级队长 | D220: 2 | E220: 90 | F220: 1 | G220: 400026|1 | H220: =IFERROR(MID(RC[-6],SEARCH("-10",RC[-6])+3,10),IFERROR(MID(RC[-6],SEARCH("-9",RC[-6])+2,10),IFERROR(MID(RC[-6],SEARCH("-8",RC[-6])+2,10),IFERROR(MID(RC[-6],SEARCH("-7",RC[-6])+2,10),IFERROR(MID(RC[-6],SEARCH("-6",RC[-6])+2,10),IFERROR(MID(RC[-6],SEARCH("-5",RC[-6])+2,10),IFERROR(MID(RC[-6],SEARCH("-4",RC[-6])+2,10),IFERROR(MID(RC[-6],SEARCH("-3",RC[-6])+2,10),IFERROR(MID(RC[-6],SEARCH("-2",RC[-6])+2,10),IFERROR(MID(RC[-6],SEARCH("-1",RC[-6])+2,10),IFERROR(MID(RC[-6],SEARCH("-",RC[-6])+1,10),))))))))))) -> 超级队长 | I220: ="1"&VLOOKUP(RC[-1],Sheet1!R2C2:R127C3,2,FALSE) -> 130301 | J220: 130301 | K220: =IFERROR(FIND(13,RC[-4],1),"") ->  | L220: =IF(RC[-1]="","",MID(RC[-5],RC[-1],6)) ->  | M220: =SUBSTITUTE(RC[-6],RC[-1],RC[-3],1) -> 400026|1
A221: 10069501 | B221: 7-10圣女贞德 | D221: 1 | E221: 100694|70 | F221: 3|1 | G221: "坚持住！我是你的后盾！"|3#400006|1 | H221: =IFERROR(MID(RC[-6],SEARCH("-10",RC[-6])+3,10),IFERROR(MID(RC[-6],SEARCH("-9",RC[-6])+2,10),IFERROR(MID(RC[-6],SEARCH("-8",RC[-6])+2,10),IFERROR(MID(RC[-6],SEARCH("-7",RC[-6])+2,10),IFERROR(MID(RC[-6],SEARCH("-6",RC[-6])+2,10),IFERROR(MID(RC[-6],SEARCH("-5",RC[-6])+2,10),IFERROR(MID(RC[-6],SEARCH("-4",RC[-6])+2,10),IFERROR(MID(RC[-6],SEARCH("-3",RC[-6])+2,10),IFERROR(MID(RC[-6],SEARCH("-2",RC[-6])+2,10),IFERROR(MID(RC[-6],SEARCH("-1",RC[-6])+2,10),IFERROR(MID(RC[-6],SEARCH("-",RC[-6])+1,10),))))))))))) -> 圣女贞德 | I221: ="1"&VLOOKUP(RC[-1],Sheet1!R2C2:R127C3,2,FALSE) -> 131440 | J221: 131440 | K221: =IFERROR(FIND(13,RC[-4],1),"") ->  | L221: =IF(RC[-1]="","",MID(RC[-5],RC[-1],6)) ->  | M221: =SUBSTITUTE(RC[-6],RC[-1],RC[-3],1) -> "坚持住！我是你的后盾！"|3#400006|1
A222: 10069502 | B222: 7-10圣女贞德 | D222: 1 | E222: 100694|30 | F222: 3|1 | G222: "我们不会失败！"|3#400006|1 | H222: =IFERROR(MID(RC[-6],SEARCH("-10",RC[-6])+3,10),IFERROR(MID(RC[-6],SEARCH("-9",RC[-6])+2,10),IFERROR(MID(RC[-6],SEARCH("-8",RC[-6])+2,10),IFERROR(MID(RC[-6],SEARCH("-7",RC[-6])+2,10),IFERROR(MID(RC[-6],SEARCH("-6",RC[-6])+2,10),IFERROR(MID(RC[-6],SEARCH("-5",RC[-6])+2,10),IFERROR(MID(RC[-6],SEARCH("-4",RC[-6])+2,10),IFERROR(MID(RC[-6],SEARCH("-3",RC[-6])+2,10),IFERROR(MID(RC[-6],SEARCH("-2",RC[-6])+2,10),IFERROR(MID(RC[-6],SEARCH("-1",RC[-6])+2,10),IFERROR(MID(RC[-6],SEARCH("-",RC[-6])+1,10),))))))))))) -> 圣女贞德 | I222: ="1"&VLOOKUP(RC[-1],Sheet1!R2C2:R127C3,2,FALSE) -> 131440 | J222: 131440 | K222: =IFERROR(FIND(13,RC[-4],1),"") ->  | L222: =IF(RC[-1]="","",MID(RC[-5],RC[-1],6)) ->  | M222: =SUBSTITUTE(RC[-6],RC[-1],RC[-3],1) -> "我们不会失败！"|3#400006|1
A223: 10072301 | B223: 8-3食人魔 | D223: 1 | E223: 100723|80 | F223: 1 | G223: 400007|1 | H223: =IFERROR(MID(RC[-6],SEARCH("-10",RC[-6])+3,10),IFERROR(MID(RC[-6],SEARCH("-9",RC[-6])+2,10),IFERROR(MID(RC[-6],SEARCH("-8",RC[-6])+2,10),IFERROR(MID(RC[-6],SEARCH("-7",RC[-6])+2,10),IFERROR(MID(RC[-6],SEARCH("-6",RC[-6])+2,10),IFERROR(MID(RC[-6],SEARCH("-5",RC[-6])+2,10),IFERROR(MID(RC[-6],SEARCH("-4",RC[-6])+2,10),IFERROR(MID(RC[-6],SEARCH("-3",RC[-6])+2,10),IFERROR(MID(RC[-6],SEARCH("-2",RC[-6])+2,10),IFERROR(MID(RC[-6],SEARCH("-1",RC[-6])+2,10),IFERROR(MID(RC[-6],SEARCH("-",RC[-6])+1,10),))))))))))) -> 食人魔 | I223: ="1"&VLOOKUP(RC[-1],Sheet1!R2C2:R127C3,2,FALSE) -> 132431 | J223: 132431 | K223: =IFERROR(FIND(13,RC[-4],1),"") ->  | L223: =IF(RC[-1]="","",MID(RC[-5],RC[-1],6)) ->  | M223: =SUBSTITUTE(RC[-6],RC[-1],RC[-3],1) -> 400007|1
A224: 10072302 | B224: 8-3食人魔 | D224: 1 | E224: 100723|50 | F224: 1 | G224: 400007|1 | H224: =IFERROR(MID(RC[-6],SEARCH("-10",RC[-6])+3,10),IFERROR(MID(RC[-6],SEARCH("-9",RC[-6])+2,10),IFERROR(MID(RC[-6],SEARCH("-8",RC[-6])+2,10),IFERROR(MID(RC[-6],SEARCH("-7",RC[-6])+2,10),IFERROR(MID(RC[-6],SEARCH("-6",RC[-6])+2,10),IFERROR(MID(RC[-6],SEARCH("-5",RC[-6])+2,10),IFERROR(MID(RC[-6],SEARCH("-4",RC[-6])+2,10),IFERROR(MID(RC[-6],SEARCH("-3",RC[-6])+2,10),IFERROR(MID(RC[-6],SEARCH("-2",RC[-6])+2,10),IFERROR(MID(RC[-6],SEARCH("-1",RC[-6])+2,10),IFERROR(MID(RC[-6],SEARCH("-",RC[-6])+1,10),))))))))))) -> 食人魔 | I224: ="1"&VLOOKUP(RC[-1],Sheet1!R2C2:R127C3,2,FALSE) -> 132431 | J224: 132431 | K224: =IFERROR(FIND(13,RC[-4],1),"") ->  | L224: =IF(RC[-1]="","",MID(RC[-5],RC[-1],6)) ->  | M224: =SUBSTITUTE(RC[-6],RC[-1],RC[-3],1) -> 400007|1
A225: 10072303 | B225: 8-3食人魔 | D225: 1 | E225: 100723|20 | F225: 1 | G225: 400007|1 | H225: =IFERROR(MID(RC[-6],SEARCH("-10",RC[-6])+3,10),IFERROR(MID(RC[-6],SEARCH("-9",RC[-6])+2,10),IFERROR(MID(RC[-6],SEARCH("-8",RC[-6])+2,10),IFERROR(MID(RC[-6],SEARCH("-7",RC[-6])+2,10),IFERROR(MID(RC[-6],SEARCH("-6",RC[-6])+2,10),IFERROR(MID(RC[-6],SEARCH("-5",RC[-6])+2,10),IFERROR(MID(RC[-6],SEARCH("-4",RC[-6])+2,10),IFERROR(MID(RC[-6],SEARCH("-3",RC[-6])+2,10),IFERROR(MID(RC[-6],SEARCH("-2",RC[-6])+2,10),IFERROR(MID(RC[-6],SEARCH("-1",RC[-6])+2,10),IFERROR(MID(RC[-6],SEARCH("-",RC[-6])+1,10),))))))))))) -> 食人魔 | I225: ="1"&VLOOKUP(RC[-1],Sheet1!R2C2:R127C3,2,FALSE) -> 132431 | J225: 132431 | K225: =IFERROR(FIND(13,RC[-4],1),"") ->  | L225: =IF(RC[-1]="","",MID(RC[-5],RC[-1],6)) ->  | M225: =SUBSTITUTE(RC[-6],RC[-1],RC[-3],1) -> 400007|1
A226: 10072304 | B226: 8-3食人魔 | C226: 0 | D226: 4 | F226: 3|4|1 | G226: "我将献祭死者……"|2#2#400008|1 | H226: =IFERROR(MID(RC[-6],SEARCH("-10",RC[-6])+3,10),IFERROR(MID(RC[-6],SEARCH("-9",RC[-6])+2,10),IFERROR(MID(RC[-6],SEARCH("-8",RC[-6])+2,10),IFERROR(MID(RC[-6],SEARCH("-7",RC[-6])+2,10),IFERROR(MID(RC[-6],SEARCH("-6",RC[-6])+2,10),IFERROR(MID(RC[-6],SEARCH("-5",RC[-6])+2,10),IFERROR(MID(RC[-6],SEARCH("-4",RC[-6])+2,10),IFERROR(MID(RC[-6],SEARCH("-3",RC[-6])+2,10),IFERROR(MID(RC[-6],SEARCH("-2",RC[-6])+2,10),IFERROR(MID(RC[-6],SEARCH("-1",RC[-6])+2,10),IFERROR(MID(RC[-6],SEARCH("-",RC[-6])+1,10),))))))))))) -> 食人魔 | I226: ="1"&VLOOKUP(RC[-1],Sheet1!R2C2:R127C3,2,FALSE) -> 132431 | J226: 132431 | K226: =IFERROR(FIND(13,RC[-4],1),"") ->  | L226: =IF(RC[-1]="","",MID(RC[-5],RC[-1],6)) ->  | M226: =SUBSTITUTE(RC[-6],RC[-1],RC[-3],1) -> "我将献祭死者……"|2#2#400008|1
A227: 10079401 | B227: 8-10阿努比斯 | D227: 1 | E227: 100794|80 | F227: 3|1 | G227: "感受死亡——"|3#1314084|1 | H227: =IFERROR(MID(RC[-6],SEARCH("-10",RC[-6])+3,10),IFERROR(MID(RC[-6],SEARCH("-9",RC[-6])+2,10),IFERROR(MID(RC[-6],SEARCH("-8",RC[-6])+2,10),IFERROR(MID(RC[-6],SEARCH("-7",RC[-6])+2,10),IFERROR(MID(RC[-6],SEARCH("-6",RC[-6])+2,10),IFERROR(MID(RC[-6],SEARCH("-5",RC[-6])+2,10),IFERROR(MID(RC[-6],SEARCH("-4",RC[-6])+2,10),IFERROR(MID(RC[-6],SEARCH("-3",RC[-6])+2,10),IFERROR(MID(RC[-6],SEARCH("-2",RC[-6])+2,10),IFERROR(MID(RC[-6],SEARCH("-1",RC[-6])+2,10),IFERROR(MID(RC[-6],SEARCH("-",RC[-6])+1,10),))))))))))) -> 阿努比斯 | I227: ="1"&VLOOKUP(RC[-1],Sheet1!R2C2:R127C3,2,FALSE) -> 131408 | J227: 131408 | K227: =IFERROR(FIND(13,RC[-4],1),"") -> 12 | L227: =IF(RC[-1]="","",MID(RC[-5],RC[-1],6)) -> 131408 | M227: =SUBSTITUTE(RC[-6],RC[-1],RC[-3],1) -> "感受死亡——"|3#1314084|1
A228: 10079402 | B228: 8-10阿努比斯 | D228: 1 | E228: 100794|50 | F228: 3|1 | G228: "我手握天平，生死尽在掌握——"|3#1314084|1 | H228: =IFERROR(MID(RC[-6],SEARCH("-10",RC[-6])+3,10),IFERROR(MID(RC[-6],SEARCH("-9",RC[-6])+2,10),IFERROR(MID(RC[-6],SEARCH("-8",RC[-6])+2,10),IFERROR(MID(RC[-6],SEARCH("-7",RC[-6])+2,10),IFERROR(MID(RC[-6],SEARCH("-6",RC[-6])+2,10),IFERROR(MID(RC[-6],SEARCH("-5",RC[-6])+2,10),IFERROR(MID(RC[-6],SEARCH("-4",RC[-6])+2,10),IFERROR(MID(RC[-6],SEARCH("-3",RC[-6])+2,10),IFERROR(MID(RC[-6],SEARCH("-2",RC[-6])+2,10),IFERROR(MID(RC[-6],SEARCH("-1",RC[-6])+2,10),IFERROR(MID(RC[-6],SEARCH("-",RC[-6])+1,10),))))))))))) -> 阿努比斯 | I228: ="1"&VLOOKUP(RC[-1],Sheet1!R2C2:R127C3,2,FALSE) -> 131408 | J228: 131408 | K228: =IFERROR(FIND(13,RC[-4],1),"") -> 20 | L228: =IF(RC[-1]="","",MID(RC[-5],RC[-1],6)) -> 131408 | M228: =SUBSTITUTE(RC[-6],RC[-1],RC[-3],1) -> "我手握天平，生死尽在掌握——"|3#1314084|1
A229: 10079403 | B229: 8-10阿努比斯 | D229: 1 | E229: 100794|20 | F229: 3|1 | G229: "愚蠢的人类！"|3#1314084|1 | H229: =IFERROR(MID(RC[-6],SEARCH("-10",RC[-6])+3,10),IFERROR(MID(RC[-6],SEARCH("-9",RC[-6])+2,10),IFERROR(MID(RC[-6],SEARCH("-8",RC[-6])+2,10),IFERROR(MID(RC[-6],SEARCH("-7",RC[-6])+2,10),IFERROR(MID(RC[-6],SEARCH("-6",RC[-6])+2,10),IFERROR(MID(RC[-6],SEARCH("-5",RC[-6])+2,10),IFERROR(MID(RC[-6],SEARCH("-4",RC[-6])+2,10),IFERROR(MID(RC[-6],SEARCH("-3",RC[-6])+2,10),IFERROR(MID(RC[-6],SEARCH("-2",RC[-6])+2,10),IFERROR(MID(RC[-6],SEARCH("-1",RC[-6])+2,10),IFERROR(MID(RC[-6],SEARCH("-",RC[-6])+1,10),))))))))))) -> 阿努比斯 | I229: ="1"&VLOOKUP(RC[-1],Sheet1!R2C2:R127C3,2,FALSE) -> 131408 | J229: 131408 | K229: =IFERROR(FIND(13,RC[-4],1),"") -> 12 | L229: =IF(RC[-1]="","",MID(RC[-5],RC[-1],6)) -> 131408 | M229: =SUBSTITUTE(RC[-6],RC[-1],RC[-3],1) -> "愚蠢的人类！"|3#1314084|1
A230: 10085401 | B230: 9-6女警 | C230: 3 | D230: 4 | F230: 3|4|1 | G230: "这发子弹献给死者……"|2#1#400010|1 | H230: =IFERROR(MID(RC[-6],SEARCH("-10",RC[-6])+3,10),IFERROR(MID(RC[-6],SEARCH("-9",RC[-6])+2,10),IFERROR(MID(RC[-6],SEARCH("-8",RC[-6])+2,10),IFERROR(MID(RC[-6],SEARCH("-7",RC[-6])+2,10),IFERROR(MID(RC[-6],SEARCH("-6",RC[-6])+2,10),IFERROR(MID(RC[-6],SEARCH("-5",RC[-6])+2,10),IFERROR(MID(RC[-6],SEARCH("-4",RC[-6])+2,10),IFERROR(MID(RC[-6],SEARCH("-3",RC[-6])+2,10),IFERROR(MID(RC[-6],SEARCH("-2",RC[-6])+2,10),IFERROR(MID(RC[-6],SEARCH("-1",RC[-6])+2,10),IFERROR(MID(RC[-6],SEARCH("-",RC[-6])+1,10),))))))))))) -> 女警 | I230: ="1"&VLOOKUP(RC[-1],Sheet1!R2C2:R127C3,2,FALSE) -> 132420 | J230: 132420 | K230: =IFERROR(FIND(13,RC[-4],1),"") ->  | L230: =IF(RC[-1]="","",MID(RC[-5],RC[-1],6)) ->  | M230: =SUBSTITUTE(RC[-6],RC[-1],RC[-3],1) -> "这发子弹献给死者……"|2#1#400010|1
A231: 10089401 | B231: 9-10火女 | D231: 2 | E231: 10 | F231: 3|1 | G231: "燃烧吧，我们将在生死的间隙中迎来胜利"|2#400012|1 | H231: =IFERROR(MID(RC[-6],SEARCH("-10",RC[-6])+3,10),IFERROR(MID(RC[-6],SEARCH("-9",RC[-6])+2,10),IFERROR(MID(RC[-6],SEARCH("-8",RC[-6])+2,10),IFERROR(MID(RC[-6],SEARCH("-7",RC[-6])+2,10),IFERROR(MID(RC[-6],SEARCH("-6",RC[-6])+2,10),IFERROR(MID(RC[-6],SEARCH("-5",RC[-6])+2,10),IFERROR(MID(RC[-6],SEARCH("-4",RC[-6])+2,10),IFERROR(MID(RC[-6],SEARCH("-3",RC[-6])+2,10),IFERROR(MID(RC[-6],SEARCH("-2",RC[-6])+2,10),IFERROR(MID(RC[-6],SEARCH("-1",RC[-6])+2,10),IFERROR(MID(RC[-6],SEARCH("-",RC[-6])+1,10),))))))))))) -> 火女 | I231: ="1"&VLOOKUP(RC[-1],Sheet1!R2C2:R127C3,2,FALSE) -> 132430 | J231: 132430 | K231: =IFERROR(FIND(13,RC[-4],1),"") ->  | L231: =IF(RC[-1]="","",MID(RC[-5],RC[-1],6)) ->  | M231: =SUBSTITUTE(RC[-6],RC[-1],RC[-3],1) -> "燃烧吧，我们将在生死的间隙中迎来胜利"|2#400012|1
A232: 10089402 | B232: 9-10火女 | D232: 1 | E232: 100894|80 | F232: 3|1 | G232: "燃烧吧！只要留下灰烬！"|2#400013|1 | H232: =IFERROR(MID(RC[-6],SEARCH("-10",RC[-6])+3,10),IFERROR(MID(RC[-6],SEARCH("-9",RC[-6])+2,10),IFERROR(MID(RC[-6],SEARCH("-8",RC[-6])+2,10),IFERROR(MID(RC[-6],SEARCH("-7",RC[-6])+2,10),IFERROR(MID(RC[-6],SEARCH("-6",RC[-6])+2,10),IFERROR(MID(RC[-6],SEARCH("-5",RC[-6])+2,10),IFERROR(MID(RC[-6],SEARCH("-4",RC[-6])+2,10),IFERROR(MID(RC[-6],SEARCH("-3",RC[-6])+2,10),IFERROR(MID(RC[-6],SEARCH("-2",RC[-6])+2,10),IFERROR(MID(RC[-6],SEARCH("-1",RC[-6])+2,10),IFERROR(MID(RC[-6],SEARCH("-",RC[-6])+1,10),))))))))))) -> 火女 | I232: ="1"&VLOOKUP(RC[-1],Sheet1!R2C2:R127C3,2,FALSE) -> 132430 | J232: 132430 | K232: =IFERROR(FIND(13,RC[-4],1),"") -> 21 | L232: =IF(RC[-1]="","",MID(RC[-5],RC[-1],6)) -> 13|1 | M232: =SUBSTITUTE(RC[-6],RC[-1],RC[-3],1) -> "燃烧吧！只要留下灰烬！"|2#4000132430
A233: 10089403 | B233: 9-10火女 | D233: 1 | E233: 100894|50 | F233: 3|1 | G233: "像不灭的火焰一样……"|2#400013|1 | H233: =IFERROR(MID(RC[-6],SEARCH("-10",RC[-6])+3,10),IFERROR(MID(RC[-6],SEARCH("-9",RC[-6])+2,10),IFERROR(MID(RC[-6],SEARCH("-8",RC[-6])+2,10),IFERROR(MID(RC[-6],SEARCH("-7",RC[-6])+2,10),IFERROR(MID(RC[-6],SEARCH("-6",RC[-6])+2,10),IFERROR(MID(RC[-6],SEARCH("-5",RC[-6])+2,10),IFERROR(MID(RC[-6],SEARCH("-4",RC[-6])+2,10),IFERROR(MID(RC[-6],SEARCH("-3",RC[-6])+2,10),IFERROR(MID(RC[-6],SEARCH("-2",RC[-6])+2,10),IFERROR(MID(RC[-6],SEARCH("-1",RC[-6])+2,10),IFERROR(MID(RC[-6],SEARCH("-",RC[-6])+1,10),))))))))))) -> 火女 | I233: ="1"&VLOOKUP(RC[-1],Sheet1!R2C2:R127C3,2,FALSE) -> 132430 | J233: 132430 | K233: =IFERROR(FIND(13,RC[-4],1),"") -> 20 | L233: =IF(RC[-1]="","",MID(RC[-5],RC[-1],6)) -> 13|1 | M233: =SUBSTITUTE(RC[-6],RC[-1],RC[-3],1) -> "像不灭的火焰一样……"|2#4000132430
A234: 10092301 | B234: 10-3熊阿宝 | D234: 1 | E234: 100923|90 | F234: 3|1 | G234: "我的棍子不会留情"|2#400014|1 | H234: =IFERROR(MID(RC[-6],SEARCH("-10",RC[-6])+3,10),IFERROR(MID(RC[-6],SEARCH("-9",RC[-6])+2,10),IFERROR(MID(RC[-6],SEARCH("-8",RC[-6])+2,10),IFERROR(MID(RC[-6],SEARCH("-7",RC[-6])+2,10),IFERROR(MID(RC[-6],SEARCH("-6",RC[-6])+2,10),IFERROR(MID(RC[-6],SEARCH("-5",RC[-6])+2,10),IFERROR(MID(RC[-6],SEARCH("-4",RC[-6])+2,10),IFERROR(MID(RC[-6],SEARCH("-3",RC[-6])+2,10),IFERROR(MID(RC[-6],SEARCH("-2",RC[-6])+2,10),IFERROR(MID(RC[-6],SEARCH("-1",RC[-6])+2,10),IFERROR(MID(RC[-6],SEARCH("-",RC[-6])+1,10),))))))))))) -> 熊阿宝 | I234: ="1"&VLOOKUP(RC[-1],Sheet1!R2C2:R127C3,2,FALSE) -> 132412 | J234: 132412 | K234: =IFERROR(FIND(13,RC[-4],1),"") ->  | L234: =IF(RC[-1]="","",MID(RC[-5],RC[-1],6)) ->  | M234: =SUBSTITUTE(RC[-6],RC[-1],RC[-3],1) -> "我的棍子不会留情"|2#400014|1
A235: 10092302 | B235: 10-3熊阿宝 | D235: 1 | E235: 100923|50 | F235: 3|1 | G235: "砸！一棍子砸不死就两棍子！"|2#400014|1 | H235: =IFERROR(MID(RC[-6],SEARCH("-10",RC[-6])+3,10),IFERROR(MID(RC[-6],SEARCH("-9",RC[-6])+2,10),IFERROR(MID(RC[-6],SEARCH("-8",RC[-6])+2,10),IFERROR(MID(RC[-6],SEARCH("-7",RC[-6])+2,10),IFERROR(MID(RC[-6],SEARCH("-6",RC[-6])+2,10),IFERROR(MID(RC[-6],SEARCH("-5",RC[-6])+2,10),IFERROR(MID(RC[-6],SEARCH("-4",RC[-6])+2,10),IFERROR(MID(RC[-6],SEARCH("-3",RC[-6])+2,10),IFERROR(MID(RC[-6],SEARCH("-2",RC[-6])+2,10),IFERROR(MID(RC[-6],SEARCH("-1",RC[-6])+2,10),IFERROR(MID(RC[-6],SEARCH("-",RC[-6])+1,10),))))))))))) -> 熊阿宝 | I235: ="1"&VLOOKUP(RC[-1],Sheet1!R2C2:R127C3,2,FALSE) -> 132412 | J235: 132412 | K235: =IFERROR(FIND(13,RC[-4],1),"") ->  | L235: =IF(RC[-1]="","",MID(RC[-5],RC[-1],6)) ->  | M235: =SUBSTITUTE(RC[-6],RC[-1],RC[-3],1) -> "砸！一棍子砸不死就两棍子！"|2#400014|1
A236: 10092303 | B236: 10-3熊阿宝 | D236: 1 | E236: 100923|10 | F236: 3|1 | G236: "最后一下！"|2#400014|1 | H236: =IFERROR(MID(RC[-6],SEARCH("-10",RC[-6])+3,10),IFERROR(MID(RC[-6],SEARCH("-9",RC[-6])+2,10),IFERROR(MID(RC[-6],SEARCH("-8",RC[-6])+2,10),IFERROR(MID(RC[-6],SEARCH("-7",RC[-6])+2,10),IFERROR(MID(RC[-6],SEARCH("-6",RC[-6])+2,10),IFERROR(MID(RC[-6],SEARCH("-5",RC[-6])+2,10),IFERROR(MID(RC[-6],SEARCH("-4",RC[-6])+2,10),IFERROR(MID(RC[-6],SEARCH("-3",RC[-6])+2,10),IFERROR(MID(RC[-6],SEARCH("-2",RC[-6])+2,10),IFERROR(MID(RC[-6],SEARCH("-1",RC[-6])+2,10),IFERROR(MID(RC[-6],SEARCH("-",RC[-6])+1,10),))))))))))) -> 熊阿宝 | I236: ="1"&VLOOKUP(RC[-1],Sheet1!R2C2:R127C3,2,FALSE) -> 132412 | J236: 132412 | K236: =IFERROR(FIND(13,RC[-4],1),"") ->  | L236: =IF(RC[-1]="","",MID(RC[-5],RC[-1],6)) ->  | M236: =SUBSTITUTE(RC[-6],RC[-1],RC[-3],1) -> "最后一下！"|2#400014|1
A237: 10099401 | B237: 10-10德古拉伯爵 | D237: 1 | E237: 100994|80 | F237: 3|4|1 | G237: "我嗅到了鲜血的味道……"|2#1#400027|1 | H237: =IFERROR(MID(RC[-6],SEARCH("-10",RC[-6])+3,10),IFERROR(MID(RC[-6],SEARCH("-9",RC[-6])+2,10),IFERROR(MID(RC[-6],SEARCH("-8",RC[-6])+2,10),IFERROR(MID(RC[-6],SEARCH("-7",RC[-6])+2,10),IFERROR(MID(RC[-6],SEARCH("-6",RC[-6])+2,10),IFERROR(MID(RC[-6],SEARCH("-5",RC[-6])+2,10),IFERROR(MID(RC[-6],SEARCH("-4",RC[-6])+2,10),IFERROR(MID(RC[-6],SEARCH("-3",RC[-6])+2,10),IFERROR(MID(RC[-6],SEARCH("-2",RC[-6])+2,10),IFERROR(MID(RC[-6],SEARCH("-1",RC[-6])+2,10),IFERROR(MID(RC[-6],SEARCH("-",RC[-6])+1,10),))))))))))) -> 德古拉伯爵 | I237: ="1"&VLOOKUP(RC[-1],Sheet1!R2C2:R127C3,2,FALSE) -> 131401 | J237: 131401 | K237: =IFERROR(FIND(13,RC[-4],1),"") ->  | L237: =IF(RC[-1]="","",MID(RC[-5],RC[-1],6)) ->  | M237: =SUBSTITUTE(RC[-6],RC[-1],RC[-3],1) -> "我嗅到了鲜血的味道……"|2#1#400027|1
A238: 10099402 | B238: 10-10德古拉伯爵 | D238: 1 | E238: 100994|30 | F238: 3|4|1 | G238: "鲜血！给我！……"|2#1#400027|1 | H238: =IFERROR(MID(RC[-6],SEARCH("-10",RC[-6])+3,10),IFERROR(MID(RC[-6],SEARCH("-9",RC[-6])+2,10),IFERROR(MID(RC[-6],SEARCH("-8",RC[-6])+2,10),IFERROR(MID(RC[-6],SEARCH("-7",RC[-6])+2,10),IFERROR(MID(RC[-6],SEARCH("-6",RC[-6])+2,10),IFERROR(MID(RC[-6],SEARCH("-5",RC[-6])+2,10),IFERROR(MID(RC[-6],SEARCH("-4",RC[-6])+2,10),IFERROR(MID(RC[-6],SEARCH("-3",RC[-6])+2,10),IFERROR(MID(RC[-6],SEARCH("-2",RC[-6])+2,10),IFERROR(MID(RC[-6],SEARCH("-1",RC[-6])+2,10),IFERROR(MID(RC[-6],SEARCH("-",RC[-6])+1,10),))))))))))) -> 德古拉伯爵 | I238: ="1"&VLOOKUP(RC[-1],Sheet1!R2C2:R127C3,2,FALSE) -> 131401 | J238: 131401 | K238: =IFERROR(FIND(13,RC[-4],1),"") ->  | L238: =IF(RC[-1]="","",MID(RC[-5],RC[-1],6)) ->  | M238: =SUBSTITUTE(RC[-6],RC[-1],RC[-3],1) -> "鲜血！给我！……"|2#1#400027|1
A239: 10102301 | B239: 11-3石头人 | D239: 1 | E239: 101023|50 | F239: 3|1 | G239: "我不会倒下……"|2#400015|2 | H239: =IFERROR(MID(RC[-6],SEARCH("-10",RC[-6])+3,10),IFERROR(MID(RC[-6],SEARCH("-9",RC[-6])+2,10),IFERROR(MID(RC[-6],SEARCH("-8",RC[-6])+2,10),IFERROR(MID(RC[-6],SEARCH("-7",RC[-6])+2,10),IFERROR(MID(RC[-6],SEARCH("-6",RC[-6])+2,10),IFERROR(MID(RC[-6],SEARCH("-5",RC[-6])+2,10),IFERROR(MID(RC[-6],SEARCH("-4",RC[-6])+2,10),IFERROR(MID(RC[-6],SEARCH("-3",RC[-6])+2,10),IFERROR(MID(RC[-6],SEARCH("-2",RC[-6])+2,10),IFERROR(MID(RC[-6],SEARCH("-1",RC[-6])+2,10),IFERROR(MID(RC[-6],SEARCH("-",RC[-6])+1,10),))))))))))) -> 石头人 | I239: ="1"&VLOOKUP(RC[-1],Sheet1!R2C2:R127C3,2,FALSE) -> 132311 | J239: 132311 | K239: =IFERROR(FIND(13,RC[-4],1),"") ->  | L239: =IF(RC[-1]="","",MID(RC[-5],RC[-1],6)) ->  | M239: =SUBSTITUTE(RC[-6],RC[-1],RC[-3],1) -> "我不会倒下……"|2#400015|2
A240: 10102302 | B240: 11-3石头人 | D240: 1 | E240: 101023|30 | F240: 3|1 | G240: "坚如磐石……！"|2#400015|2 | H240: =IFERROR(MID(RC[-6],SEARCH("-10",RC[-6])+3,10),IFERROR(MID(RC[-6],SEARCH("-9",RC[-6])+2,10),IFERROR(MID(RC[-6],SEARCH("-8",RC[-6])+2,10),IFERROR(MID(RC[-6],SEARCH("-7",RC[-6])+2,10),IFERROR(MID(RC[-6],SEARCH("-6",RC[-6])+2,10),IFERROR(MID(RC[-6],SEARCH("-5",RC[-6])+2,10),IFERROR(MID(RC[-6],SEARCH("-4",RC[-6])+2,10),IFERROR(MID(RC[-6],SEARCH("-3",RC[-6])+2,10),IFERROR(MID(RC[-6],SEARCH("-2",RC[-6])+2,10),IFERROR(MID(RC[-6],SEARCH("-1",RC[-6])+2,10),IFERROR(MID(RC[-6],SEARCH("-",RC[-6])+1,10),))))))))))) -> 石头人 | I240: ="1"&VLOOKUP(RC[-1],Sheet1!R2C2:R127C3,2,FALSE) -> 132311 | J240: 132311 | K240: =IFERROR(FIND(13,RC[-4],1),"") ->  | L240: =IF(RC[-1]="","",MID(RC[-5],RC[-1],6)) ->  | M240: =SUBSTITUTE(RC[-6],RC[-1],RC[-3],1) -> "坚如磐石……！"|2#400015|2
A241: 10109301 | B241: 11-10白魔法师 | D241: 2 | E241: 10 | F241: 3|1 | G241: "这才是大力神该有的英勇！"|3#400017|2 | H241: =IFERROR(MID(RC[-6],SEARCH("-10",RC[-6])+3,10),IFERROR(MID(RC[-6],SEARCH("-9",RC[-6])+2,10),IFERROR(MID(RC[-6],SEARCH("-8",RC[-6])+2,10),IFERROR(MID(RC[-6],SEARCH("-7",RC[-6])+2,10),IFERROR(MID(RC[-6],SEARCH("-6",RC[-6])+2,10),IFERROR(MID(RC[-6],SEARCH("-5",RC[-6])+2,10),IFERROR(MID(RC[-6],SEARCH("-4",RC[-6])+2,10),IFERROR(MID(RC[-6],SEARCH("-3",RC[-6])+2,10),IFERROR(MID(RC[-6],SEARCH("-2",RC[-6])+2,10),IFERROR(MID(RC[-6],SEARCH("-1",RC[-6])+2,10),IFERROR(MID(RC[-6],SEARCH("-",RC[-6])+1,10),))))))))))) -> 白魔法师 | I241: ="1"&VLOOKUP(RC[-1],Sheet1!R2C2:R127C3,2,FALSE) -> 131140 | J241: 131140 | K241: =IFERROR(FIND(13,RC[-4],1),"") ->  | L241: =IF(RC[-1]="","",MID(RC[-5],RC[-1],6)) ->  | M241: =SUBSTITUTE(RC[-6],RC[-1],RC[-3],1) -> "这才是大力神该有的英勇！"|3#400017|2
A242: 10109302 | B242: 11-10白魔法师 | D242: 1 | E242: 101094|30 | F242: 3|4|1 | G242: "你的战斗还未结束！"|3#2#400016|2 | H242: =IFERROR(MID(RC[-6],SEARCH("-10",RC[-6])+3,10),IFERROR(MID(RC[-6],SEARCH("-9",RC[-6])+2,10),IFERROR(MID(RC[-6],SEARCH("-8",RC[-6])+2,10),IFERROR(MID(RC[-6],SEARCH("-7",RC[-6])+2,10),IFERROR(MID(RC[-6],SEARCH("-6",RC[-6])+2,10),IFERROR(MID(RC[-6],SEARCH("-5",RC[-6])+2,10),IFERROR(MID(RC[-6],SEARCH("-4",RC[-6])+2,10),IFERROR(MID(RC[-6],SEARCH("-3",RC[-6])+2,10),IFERROR(MID(RC[-6],SEARCH("-2",RC[-6])+2,10),IFERROR(MID(RC[-6],SEARCH("-1",RC[-6])+2,10),IFERROR(MID(RC[-6],SEARCH("-",RC[-6])+1,10),))))))))))) -> 白魔法师 | I242: ="1"&VLOOKUP(RC[-1],Sheet1!R2C2:R127C3,2,FALSE) -> 131140 | J242: 131140 | K242: =IFERROR(FIND(13,RC[-4],1),"") ->  | L242: =IF(RC[-1]="","",MID(RC[-5],RC[-1],6)) ->  | M242: =SUBSTITUTE(RC[-6],RC[-1],RC[-3],1) -> "你的战斗还未结束！"|3#2#400016|2
A243: 10109401 | B243: 11-10大力神 | D243: 5 | E243: 100 | F243: 1 | G243: 1314194|0 | H243: =IFERROR(MID(RC[-6],SEARCH("-10",RC[-6])+3,10),IFERROR(MID(RC[-6],SEARCH("-9",RC[-6])+2,10),IFERROR(MID(RC[-6],SEARCH("-8",RC[-6])+2,10),IFERROR(MID(RC[-6],SEARCH("-7",RC[-6])+2,10),IFERROR(MID(RC[-6],SEARCH("-6",RC[-6])+2,10),IFERROR(MID(RC[-6],SEARCH("-5",RC[-6])+2,10),IFERROR(MID(RC[-6],SEARCH("-4",RC[-6])+2,10),IFERROR(MID(RC[-6],SEARCH("-3",RC[-6])+2,10),IFERROR(MID(RC[-6],SEARCH("-2",RC[-6])+2,10),IFERROR(MID(RC[-6],SEARCH("-1",RC[-6])+2,10),IFERROR(MID(RC[-6],SEARCH("-",RC[-6])+1,10),))))))))))) -> 大力神 | I243: ="1"&VLOOKUP(RC[-1],Sheet1!R2C2:R127C3,2,FALSE) -> 131419 | J243: 131419 | K243: =IFERROR(FIND(13,RC[-4],1),"") -> 1 | L243: =IF(RC[-1]="","",MID(RC[-5],RC[-1],6)) -> 131419 | M243: =SUBSTITUTE(RC[-6],RC[-1],RC[-3],1) -> 1314194|0
A244: 10109402 | B244: 11-10大力神 | D244: 3 | F244: 3 | G244: "这也是……试练吗……"|3 | H244: =IFERROR(MID(RC[-6],SEARCH("-10",RC[-6])+3,10),IFERROR(MID(RC[-6],SEARCH("-9",RC[-6])+2,10),IFERROR(MID(RC[-6],SEARCH("-8",RC[-6])+2,10),IFERROR(MID(RC[-6],SEARCH("-7",RC[-6])+2,10),IFERROR(MID(RC[-6],SEARCH("-6",RC[-6])+2,10),IFERROR(MID(RC[-6],SEARCH("-5",RC[-6])+2,10),IFERROR(MID(RC[-6],SEARCH("-4",RC[-6])+2,10),IFERROR(MID(RC[-6],SEARCH("-3",RC[-6])+2,10),IFERROR(MID(RC[-6],SEARCH("-2",RC[-6])+2,10),IFERROR(MID(RC[-6],SEARCH("-1",RC[-6])+2,10),IFERROR(MID(RC[-6],SEARCH("-",RC[-6])+1,10),))))))))))) -> 大力神 | I244: ="1"&VLOOKUP(RC[-1],Sheet1!R2C2:R127C3,2,FALSE) -> 131419 | J244: 131419 | K244: =IFERROR(FIND(13,RC[-4],1),"") ->  | L244: =IF(RC[-1]="","",MID(RC[-5],RC[-1],6)) ->  | M244: =SUBSTITUTE(RC[-6],RC[-1],RC[-3],1) -> "这也是……试练吗……"|3
A245: 10115401 | B245: 12-6恶魔猎手 | D245: 1 | E245: 101154|80 | F245: 3|1 | G245: "以此为你们的坟墓"|2#400018|1 | H245: =IFERROR(MID(RC[-6],SEARCH("-10",RC[-6])+3,10),IFERROR(MID(RC[-6],SEARCH("-9",RC[-6])+2,10),IFERROR(MID(RC[-6],SEARCH("-8",RC[-6])+2,10),IFERROR(MID(RC[-6],SEARCH("-7",RC[-6])+2,10),IFERROR(MID(RC[-6],SEARCH("-6",RC[-6])+2,10),IFERROR(MID(RC[-6],SEARCH("-5",RC[-6])+2,10),IFERROR(MID(RC[-6],SEARCH("-4",RC[-6])+2,10),IFERROR(MID(RC[-6],SEARCH("-3",RC[-6])+2,10),IFERROR(MID(RC[-6],SEARCH("-2",RC[-6])+2,10),IFERROR(MID(RC[-6],SEARCH("-1",RC[-6])+2,10),IFERROR(MID(RC[-6],SEARCH("-",RC[-6])+1,10),))))))))))) -> 恶魔猎手 | I245: ="1"&VLOOKUP(RC[-1],Sheet1!R2C2:R127C3,2,FALSE) -> 132409 | J245: 132409 | K245: =IFERROR(FIND(13,RC[-4],1),"") ->  | L245: =IF(RC[-1]="","",MID(RC[-5],RC[-1],6)) ->  | M245: =SUBSTITUTE(RC[-6],RC[-1],RC[-3],1) -> "以此为你们的坟墓"|2#400018|1
A246: 10115402 | B246: 12-6恶魔猎手 | D246: 1 | E246: 101154|50 | F246: 3|1 | G246: "绽放吧！"|2#400018|1 | H246: =IFERROR(MID(RC[-6],SEARCH("-10",RC[-6])+3,10),IFERROR(MID(RC[-6],SEARCH("-9",RC[-6])+2,10),IFERROR(MID(RC[-6],SEARCH("-8",RC[-6])+2,10),IFERROR(MID(RC[-6],SEARCH("-7",RC[-6])+2,10),IFERROR(MID(RC[-6],SEARCH("-6",RC[-6])+2,10),IFERROR(MID(RC[-6],SEARCH("-5",RC[-6])+2,10),IFERROR(MID(RC[-6],SEARCH("-4",RC[-6])+2,10),IFERROR(MID(RC[-6],SEARCH("-3",RC[-6])+2,10),IFERROR(MID(RC[-6],SEARCH("-2",RC[-6])+2,10),IFERROR(MID(RC[-6],SEARCH("-1",RC[-6])+2,10),IFERROR(MID(RC[-6],SEARCH("-",RC[-6])+1,10),))))))))))) -> 恶魔猎手 | I246: ="1"&VLOOKUP(RC[-1],Sheet1!R2C2:R127C3,2,FALSE) -> 132409 | J246: 132409 | K246: =IFERROR(FIND(13,RC[-4],1),"") ->  | L246: =IF(RC[-1]="","",MID(RC[-5],RC[-1],6)) ->  | M246: =SUBSTITUTE(RC[-6],RC[-1],RC[-3],1) -> "绽放吧！"|2#400018|1
A247: 10115403 | B247: 12-6恶魔猎手 | D247: 1 | E247: 101154|20 | F247: 3|1 | G247: "希望都将被腐蚀"|2#400018|1 | H247: =IFERROR(MID(RC[-6],SEARCH("-10",RC[-6])+3,10),IFERROR(MID(RC[-6],SEARCH("-9",RC[-6])+2,10),IFERROR(MID(RC[-6],SEARCH("-8",RC[-6])+2,10),IFERROR(MID(RC[-6],SEARCH("-7",RC[-6])+2,10),IFERROR(MID(RC[-6],SEARCH("-6",RC[-6])+2,10),IFERROR(MID(RC[-6],SEARCH("-5",RC[-6])+2,10),IFERROR(MID(RC[-6],SEARCH("-4",RC[-6])+2,10),IFERROR(MID(RC[-6],SEARCH("-3",RC[-6])+2,10),IFERROR(MID(RC[-6],SEARCH("-2",RC[-6])+2,10),IFERROR(MID(RC[-6],SEARCH("-1",RC[-6])+2,10),IFERROR(MID(RC[-6],SEARCH("-",RC[-6])+1,10),))))))))))) -> 恶魔猎手 | I247: ="1"&VLOOKUP(RC[-1],Sheet1!R2C2:R127C3,2,FALSE) -> 132409 | J247: 132409 | K247: =IFERROR(FIND(13,RC[-4],1),"") ->  | L247: =IF(RC[-1]="","",MID(RC[-5],RC[-1],6)) ->  | M247: =SUBSTITUTE(RC[-6],RC[-1],RC[-3],1) -> "希望都将被腐蚀"|2#400018|1
A248: 10118401 | B248: 12-9牛头人 | D248: 1 | E248: 101184|80 | F248: 3|1 | G248: "你们无法战胜我！"|2#1324004|1 | H248: =IFERROR(MID(RC[-6],SEARCH("-10",RC[-6])+3,10),IFERROR(MID(RC[-6],SEARCH("-9",RC[-6])+2,10),IFERROR(MID(RC[-6],SEARCH("-8",RC[-6])+2,10),IFERROR(MID(RC[-6],SEARCH("-7",RC[-6])+2,10),IFERROR(MID(RC[-6],SEARCH("-6",RC[-6])+2,10),IFERROR(MID(RC[-6],SEARCH("-5",RC[-6])+2,10),IFERROR(MID(RC[-6],SEARCH("-4",RC[-6])+2,10),IFERROR(MID(RC[-6],SEARCH("-3",RC[-6])+2,10),IFERROR(MID(RC[-6],SEARCH("-2",RC[-6])+2,10),IFERROR(MID(RC[-6],SEARCH("-1",RC[-6])+2,10),IFERROR(MID(RC[-6],SEARCH("-",RC[-6])+1,10),))))))))))) -> 牛头人 | I248: ="1"&VLOOKUP(RC[-1],Sheet1!R2C2:R127C3,2,FALSE) -> 132400 | J248: 132400 | K248: =IFERROR(FIND(13,RC[-4],1),"") -> 14 | L248: =IF(RC[-1]="","",MID(RC[-5],RC[-1],6)) -> 132400 | M248: =SUBSTITUTE(RC[-6],RC[-1],RC[-3],1) -> "你们无法战胜我！"|2#1324004|1
A249: 10118402 | B249: 12-9牛头人 | D249: 1 | E249: 101184|55 | F249: 3|1 | G249: "劈开一切！"|2#1324004|1 | H249: =IFERROR(MID(RC[-6],SEARCH("-10",RC[-6])+3,10),IFERROR(MID(RC[-6],SEARCH("-9",RC[-6])+2,10),IFERROR(MID(RC[-6],SEARCH("-8",RC[-6])+2,10),IFERROR(MID(RC[-6],SEARCH("-7",RC[-6])+2,10),IFERROR(MID(RC[-6],SEARCH("-6",RC[-6])+2,10),IFERROR(MID(RC[-6],SEARCH("-5",RC[-6])+2,10),IFERROR(MID(RC[-6],SEARCH("-4",RC[-6])+2,10),IFERROR(MID(RC[-6],SEARCH("-3",RC[-6])+2,10),IFERROR(MID(RC[-6],SEARCH("-2",RC[-6])+2,10),IFERROR(MID(RC[-6],SEARCH("-1",RC[-6])+2,10),IFERROR(MID(RC[-6],SEARCH("-",RC[-6])+1,10),))))))))))) -> 牛头人 | I249: ="1"&VLOOKUP(RC[-1],Sheet1!R2C2:R127C3,2,FALSE) -> 132400 | J249: 132400 | K249: =IFERROR(FIND(13,RC[-4],1),"") -> 11 | L249: =IF(RC[-1]="","",MID(RC[-5],RC[-1],6)) -> 132400 | M249: =SUBSTITUTE(RC[-6],RC[-1],RC[-3],1) -> "劈开一切！"|2#1324004|1
A250: 10118403 | B250: 12-9牛头人 | D250: 1 | E250: 101184|30 | F250: 3|1 | G250: "我无法被阻拦！"|2#1324004|1 | H250: =IFERROR(MID(RC[-6],SEARCH("-10",RC[-6])+3,10),IFERROR(MID(RC[-6],SEARCH("-9",RC[-6])+2,10),IFERROR(MID(RC[-6],SEARCH("-8",RC[-6])+2,10),IFERROR(MID(RC[-6],SEARCH("-7",RC[-6])+2,10),IFERROR(MID(RC[-6],SEARCH("-6",RC[-6])+2,10),IFERROR(MID(RC[-6],SEARCH("-5",RC[-6])+2,10),IFERROR(MID(RC[-6],SEARCH("-4",RC[-6])+2,10),IFERROR(MID(RC[-6],SEARCH("-3",RC[-6])+2,10),IFERROR(MID(RC[-6],SEARCH("-2",RC[-6])+2,10),IFERROR(MID(RC[-6],SEARCH("-1",RC[-6])+2,10),IFERROR(MID(RC[-6],SEARCH("-",RC[-6])+1,10),))))))))))) -> 牛头人 | I250: ="1"&VLOOKUP(RC[-1],Sheet1!R2C2:R127C3,2,FALSE) -> 132400 | J250: 132400 | K250: =IFERROR(FIND(13,RC[-4],1),"") -> 13 | L250: =IF(RC[-1]="","",MID(RC[-5],RC[-1],6)) -> 132400 | M250: =SUBSTITUTE(RC[-6],RC[-1],RC[-3],1) -> "我无法被阻拦！"|2#1324004|1
A251: 10119001 | B251: 12-10野蛮巨人 | D251: 1 | E251: 101190|90 | F251: 3|1 | G251: "吼吼吼！！！"|2#400019|1 | H251: =IFERROR(MID(RC[-6],SEARCH("-10",RC[-6])+3,10),IFERROR(MID(RC[-6],SEARCH("-9",RC[-6])+2,10),IFERROR(MID(RC[-6],SEARCH("-8",RC[-6])+2,10),IFERROR(MID(RC[-6],SEARCH("-7",RC[-6])+2,10),IFERROR(MID(RC[-6],SEARCH("-6",RC[-6])+2,10),IFERROR(MID(RC[-6],SEARCH("-5",RC[-6])+2,10),IFERROR(MID(RC[-6],SEARCH("-4",RC[-6])+2,10),IFERROR(MID(RC[-6],SEARCH("-3",RC[-6])+2,10),IFERROR(MID(RC[-6],SEARCH("-2",RC[-6])+2,10),IFERROR(MID(RC[-6],SEARCH("-1",RC[-6])+2,10),IFERROR(MID(RC[-6],SEARCH("-",RC[-6])+1,10),))))))))))) -> 野蛮巨人 | I251: ="1"&VLOOKUP(RC[-1],Sheet1!R2C2:R127C3,2,FALSE) -> 130410 | J251: 130410 | K251: =IFERROR(FIND(13,RC[-4],1),"") ->  | L251: =IF(RC[-1]="","",MID(RC[-5],RC[-1],6)) ->  | M251: =SUBSTITUTE(RC[-6],RC[-1],RC[-3],1) -> "吼吼吼！！！"|2#400019|1
A252: 10119002 | B252: 12-10野蛮巨人 | D252: 1 | E252: 101190|50 | F252: 1 | G252: 400019|1 | H252: =IFERROR(MID(RC[-6],SEARCH("-10",RC[-6])+3,10),IFERROR(MID(RC[-6],SEARCH("-9",RC[-6])+2,10),IFERROR(MID(RC[-6],SEARCH("-8",RC[-6])+2,10),IFERROR(MID(RC[-6],SEARCH("-7",RC[-6])+2,10),IFERROR(MID(RC[-6],SEARCH("-6",RC[-6])+2,10),IFERROR(MID(RC[-6],SEARCH("-5",RC[-6])+2,10),IFERROR(MID(RC[-6],SEARCH("-4",RC[-6])+2,10),IFERROR(MID(RC[-6],SEARCH("-3",RC[-6])+2,10),IFERROR(MID(RC[-6],SEARCH("-2",RC[-6])+2,10),IFERROR(MID(RC[-6],SEARCH("-1",RC[-6])+2,10),IFERROR(MID(RC[-6],SEARCH("-",RC[-6])+1,10),))))))))))) -> 野蛮巨人 | I252: ="1"&VLOOKUP(RC[-1],Sheet1!R2C2:R127C3,2,FALSE) -> 130410 | J252: 130410 | K252: =IFERROR(FIND(13,RC[-4],1),"") ->  | L252: =IF(RC[-1]="","",MID(RC[-5],RC[-1],6)) ->  | M252: =SUBSTITUTE(RC[-6],RC[-1],RC[-3],1) -> 400019|1
A253: 10119003 | B253: 12-10野蛮巨人 | D253: 1 | E253: 101190|10 | F253: 3|1 | G253: "死吧！"|2#400019|1 | H253: =IFERROR(MID(RC[-6],SEARCH("-10",RC[-6])+3,10),IFERROR(MID(RC[-6],SEARCH("-9",RC[-6])+2,10),IFERROR(MID(RC[-6],SEARCH("-8",RC[-6])+2,10),IFERROR(MID(RC[-6],SEARCH("-7",RC[-6])+2,10),IFERROR(MID(RC[-6],SEARCH("-6",RC[-6])+2,10),IFERROR(MID(RC[-6],SEARCH("-5",RC[-6])+2,10),IFERROR(MID(RC[-6],SEARCH("-4",RC[-6])+2,10),IFERROR(MID(RC[-6],SEARCH("-3",RC[-6])+2,10),IFERROR(MID(RC[-6],SEARCH("-2",RC[-6])+2,10),IFERROR(MID(RC[-6],SEARCH("-1",RC[-6])+2,10),IFERROR(MID(RC[-6],SEARCH("-",RC[-6])+1,10),))))))))))) -> 野蛮巨人 | I253: ="1"&VLOOKUP(RC[-1],Sheet1!R2C2:R127C3,2,FALSE) -> 130410 | J253: 130410 | K253: =IFERROR(FIND(13,RC[-4],1),"") ->  | L253: =IF(RC[-1]="","",MID(RC[-5],RC[-1],6)) ->  | M253: =SUBSTITUTE(RC[-6],RC[-1],RC[-3],1) -> "死吧！"|2#400019|1
A254: 10119004 | B254: 12-10野蛮巨人 | D254: 1 | E254: 101190|30 | F254: 3|1|4|3|1 | G254: "怒火！！"|2#400020|2#20#"破坏！！"|2#400021|2 | H254: =IFERROR(MID(RC[-6],SEARCH("-10",RC[-6])+3,10),IFERROR(MID(RC[-6],SEARCH("-9",RC[-6])+2,10),IFERROR(MID(RC[-6],SEARCH("-8",RC[-6])+2,10),IFERROR(MID(RC[-6],SEARCH("-7",RC[-6])+2,10),IFERROR(MID(RC[-6],SEARCH("-6",RC[-6])+2,10),IFERROR(MID(RC[-6],SEARCH("-5",RC[-6])+2,10),IFERROR(MID(RC[-6],SEARCH("-4",RC[-6])+2,10),IFERROR(MID(RC[-6],SEARCH("-3",RC[-6])+2,10),IFERROR(MID(RC[-6],SEARCH("-2",RC[-6])+2,10),IFERROR(MID(RC[-6],SEARCH("-1",RC[-6])+2,10),IFERROR(MID(RC[-6],SEARCH("-",RC[-6])+1,10),))))))))))) -> 野蛮巨人 | I254: ="1"&VLOOKUP(RC[-1],Sheet1!R2C2:R127C3,2,FALSE) -> 130410 | J254: 130410 | K254: =IFERROR(FIND(13,RC[-4],1),"") ->  | L254: =IF(RC[-1]="","",MID(RC[-5],RC[-1],6)) ->  | M254: =SUBSTITUTE(RC[-6],RC[-1],RC[-3],1) -> "怒火！！"|2#400020|2#20#"破坏！！"|2#400021|2
A255: 10122501 | B255: 13-3鹰眸 | D255: 1 | E255: 101225|70 | F255: 3|1 | G255: "箭已满弓"|2#1304204|1 | H255: =IFERROR(MID(RC[-6],SEARCH("-10",RC[-6])+3,10),IFERROR(MID(RC[-6],SEARCH("-9",RC[-6])+2,10),IFERROR(MID(RC[-6],SEARCH("-8",RC[-6])+2,10),IFERROR(MID(RC[-6],SEARCH("-7",RC[-6])+2,10),IFERROR(MID(RC[-6],SEARCH("-6",RC[-6])+2,10),IFERROR(MID(RC[-6],SEARCH("-5",RC[-6])+2,10),IFERROR(MID(RC[-6],SEARCH("-4",RC[-6])+2,10),IFERROR(MID(RC[-6],SEARCH("-3",RC[-6])+2,10),IFERROR(MID(RC[-6],SEARCH("-2",RC[-6])+2,10),IFERROR(MID(RC[-6],SEARCH("-1",RC[-6])+2,10),IFERROR(MID(RC[-6],SEARCH("-",RC[-6])+1,10),))))))))))) -> 鹰眸 | I255: ="1"&VLOOKUP(RC[-1],Sheet1!R2C2:R127C3,2,FALSE) -> 130420 | J255: 130420 | K255: =IFERROR(FIND(13,RC[-4],1),"") -> 10 | L255: =IF(RC[-1]="","",MID(RC[-5],RC[-1],6)) -> 130420 | M255: =SUBSTITUTE(RC[-6],RC[-1],RC[-3],1) -> "箭已满弓"|2#1304204|1
A256: 10122502 | B256: 13-3鹰眸 | D256: 1 | E256: 101225|30 | F256: 3|1 | G256: "一击致命！"|2#1304204|1 | H256: =IFERROR(MID(RC[-6],SEARCH("-10",RC[-6])+3,10),IFERROR(MID(RC[-6],SEARCH("-9",RC[-6])+2,10),IFERROR(MID(RC[-6],SEARCH("-8",RC[-6])+2,10),IFERROR(MID(RC[-6],SEARCH("-7",RC[-6])+2,10),IFERROR(MID(RC[-6],SEARCH("-6",RC[-6])+2,10),IFERROR(MID(RC[-6],SEARCH("-5",RC[-6])+2,10),IFERROR(MID(RC[-6],SEARCH("-4",RC[-6])+2,10),IFERROR(MID(RC[-6],SEARCH("-3",RC[-6])+2,10),IFERROR(MID(RC[-6],SEARCH("-2",RC[-6])+2,10),IFERROR(MID(RC[-6],SEARCH("-1",RC[-6])+2,10),IFERROR(MID(RC[-6],SEARCH("-",RC[-6])+1,10),))))))))))) -> 鹰眸 | I256: ="1"&VLOOKUP(RC[-1],Sheet1!R2C2:R127C3,2,FALSE) -> 130420 | J256: 130420 | K256: =IFERROR(FIND(13,RC[-4],1),"") -> 11 | L256: =IF(RC[-1]="","",MID(RC[-5],RC[-1],6)) -> 130420 | M256: =SUBSTITUTE(RC[-6],RC[-1],RC[-3],1) -> "一击致命！"|2#1304204|1
A257: 10122503 | B257: 13-3鹰眸 | D257: 6 | F257: 3|1 | G257: "你的心脏——我就收下了！"|2#1304204|1 | H257: =IFERROR(MID(RC[-6],SEARCH("-10",RC[-6])+3,10),IFERROR(MID(RC[-6],SEARCH("-9",RC[-6])+2,10),IFERROR(MID(RC[-6],SEARCH("-8",RC[-6])+2,10),IFERROR(MID(RC[-6],SEARCH("-7",RC[-6])+2,10),IFERROR(MID(RC[-6],SEARCH("-6",RC[-6])+2,10),IFERROR(MID(RC[-6],SEARCH("-5",RC[-6])+2,10),IFERROR(MID(RC[-6],SEARCH("-4",RC[-6])+2,10),IFERROR(MID(RC[-6],SEARCH("-3",RC[-6])+2,10),IFERROR(MID(RC[-6],SEARCH("-2",RC[-6])+2,10),IFERROR(MID(RC[-6],SEARCH("-1",RC[-6])+2,10),IFERROR(MID(RC[-6],SEARCH("-",RC[-6])+1,10),))))))))))) -> 鹰眸 | I257: ="1"&VLOOKUP(RC[-1],Sheet1!R2C2:R127C3,2,FALSE) -> 130420 | J257: 130420 | K257: =IFERROR(FIND(13,RC[-4],1),"") -> 18 | L257: =IF(RC[-1]="","",MID(RC[-5],RC[-1],6)) -> 130420 | M257: =SUBSTITUTE(RC[-6],RC[-1],RC[-3],1) -> "你的心脏——我就收下了！"|2#1304204|1
A258: 10125301 | B258: 13-6致命特工 | C258: 2 | D258: 4 | F258: 3|1 | G258: "死亡是战争的养料"|2#400022|1 | H258: =IFERROR(MID(RC[-6],SEARCH("-10",RC[-6])+3,10),IFERROR(MID(RC[-6],SEARCH("-9",RC[-6])+2,10),IFERROR(MID(RC[-6],SEARCH("-8",RC[-6])+2,10),IFERROR(MID(RC[-6],SEARCH("-7",RC[-6])+2,10),IFERROR(MID(RC[-6],SEARCH("-6",RC[-6])+2,10),IFERROR(MID(RC[-6],SEARCH("-5",RC[-6])+2,10),IFERROR(MID(RC[-6],SEARCH("-4",RC[-6])+2,10),IFERROR(MID(RC[-6],SEARCH("-3",RC[-6])+2,10),IFERROR(MID(RC[-6],SEARCH("-2",RC[-6])+2,10),IFERROR(MID(RC[-6],SEARCH("-1",RC[-6])+2,10),IFERROR(MID(RC[-6],SEARCH("-",RC[-6])+1,10),))))))))))) -> 致命特工 | I258: ="1"&VLOOKUP(RC[-1],Sheet1!R2C2:R127C3,2,FALSE) -> 130401 | J258: 130401 | K258: =IFERROR(FIND(13,RC[-4],1),"") ->  | L258: =IF(RC[-1]="","",MID(RC[-5],RC[-1],6)) ->  | M258: =SUBSTITUTE(RC[-6],RC[-1],RC[-3],1) -> "死亡是战争的养料"|2#400022|1
A259: 10125302 | B259: 13-6致命特工 | D259: 5 | E259: 300 | F259: 3|1 | G259: "你们让我愤怒"|2#400022|0 | H259: =IFERROR(MID(RC[-6],SEARCH("-10",RC[-6])+3,10),IFERROR(MID(RC[-6],SEARCH("-9",RC[-6])+2,10),IFERROR(MID(RC[-6],SEARCH("-8",RC[-6])+2,10),IFERROR(MID(RC[-6],SEARCH("-7",RC[-6])+2,10),IFERROR(MID(RC[-6],SEARCH("-6",RC[-6])+2,10),IFERROR(MID(RC[-6],SEARCH("-5",RC[-6])+2,10),IFERROR(MID(RC[-6],SEARCH("-4",RC[-6])+2,10),IFERROR(MID(RC[-6],SEARCH("-3",RC[-6])+2,10),IFERROR(MID(RC[-6],SEARCH("-2",RC[-6])+2,10),IFERROR(MID(RC[-6],SEARCH("-1",RC[-6])+2,10),IFERROR(MID(RC[-6],SEARCH("-",RC[-6])+1,10),))))))))))) -> 致命特工 | I259: ="1"&VLOOKUP(RC[-1],Sheet1!R2C2:R127C3,2,FALSE) -> 130401 | J259: 130401 | K259: =IFERROR(FIND(13,RC[-4],1),"") ->  | L259: =IF(RC[-1]="","",MID(RC[-5],RC[-1],6)) ->  | M259: =SUBSTITUTE(RC[-6],RC[-1],RC[-3],1) -> "你们让我愤怒"|2#400022|0
A260: 10129501 | B260: 13-10超凡博士 | D260: 1 | E260: 101295|70 | F260: 3|1 | G260: "魔法的奥秘……"|2#1304385|1 | H260: =IFERROR(MID(RC[-6],SEARCH("-10",RC[-6])+3,10),IFERROR(MID(RC[-6],SEARCH("-9",RC[-6])+2,10),IFERROR(MID(RC[-6],SEARCH("-8",RC[-6])+2,10),IFERROR(MID(RC[-6],SEARCH("-7",RC[-6])+2,10),IFERROR(MID(RC[-6],SEARCH("-6",RC[-6])+2,10),IFERROR(MID(RC[-6],SEARCH("-5",RC[-6])+2,10),IFERROR(MID(RC[-6],SEARCH("-4",RC[-6])+2,10),IFERROR(MID(RC[-6],SEARCH("-3",RC[-6])+2,10),IFERROR(MID(RC[-6],SEARCH("-2",RC[-6])+2,10),IFERROR(MID(RC[-6],SEARCH("-1",RC[-6])+2,10),IFERROR(MID(RC[-6],SEARCH("-",RC[-6])+1,10),))))))))))) -> 超凡博士 | I260: ="1"&VLOOKUP(RC[-1],Sheet1!R2C2:R127C3,2,FALSE) -> 130438 | J260: 130438 | K260: =IFERROR(FIND(13,RC[-4],1),"") -> 13 | L260: =IF(RC[-1]="","",MID(RC[-5],RC[-1],6)) -> 130438 | M260: =SUBSTITUTE(RC[-6],RC[-1],RC[-3],1) -> "魔法的奥秘……"|2#1304385|1
A261: 10129502 | B261: 13-10超凡博士 | D261: 1 | E261: 101295|30 | F261: 3|1 | G261: "揭开谜底的时候到了"|2#1304385|1 | H261: =IFERROR(MID(RC[-6],SEARCH("-10",RC[-6])+3,10),IFERROR(MID(RC[-6],SEARCH("-9",RC[-6])+2,10),IFERROR(MID(RC[-6],SEARCH("-8",RC[-6])+2,10),IFERROR(MID(RC[-6],SEARCH("-7",RC[-6])+2,10),IFERROR(MID(RC[-6],SEARCH("-6",RC[-6])+2,10),IFERROR(MID(RC[-6],SEARCH("-5",RC[-6])+2,10),IFERROR(MID(RC[-6],SEARCH("-4",RC[-6])+2,10),IFERROR(MID(RC[-6],SEARCH("-3",RC[-6])+2,10),IFERROR(MID(RC[-6],SEARCH("-2",RC[-6])+2,10),IFERROR(MID(RC[-6],SEARCH("-1",RC[-6])+2,10),IFERROR(MID(RC[-6],SEARCH("-",RC[-6])+1,10),))))))))))) -> 超凡博士 | I261: ="1"&VLOOKUP(RC[-1],Sheet1!R2C2:R127C3,2,FALSE) -> 130438 | J261: 130438 | K261: =IFERROR(FIND(13,RC[-4],1),"") -> 15 | L261: =IF(RC[-1]="","",MID(RC[-5],RC[-1],6)) -> 130438 | M261: =SUBSTITUTE(RC[-6],RC[-1],RC[-3],1) -> "揭开谜底的时候到了"|2#1304385|1
A262: 10129503 | B262: 13-10超凡博士 | D262: 1 | E262: 101294|50 | F262: 3|1 | G262: "不要耍小聪明"|2#1304385|1 | H262: =IFERROR(MID(RC[-6],SEARCH("-10",RC[-6])+3,10),IFERROR(MID(RC[-6],SEARCH("-9",RC[-6])+2,10),IFERROR(MID(RC[-6],SEARCH("-8",RC[-6])+2,10),IFERROR(MID(RC[-6],SEARCH("-7",RC[-6])+2,10),IFERROR(MID(RC[-6],SEARCH("-6",RC[-6])+2,10),IFERROR(MID(RC[-6],SEARCH("-5",RC[-6])+2,10),IFERROR(MID(RC[-6],SEARCH("-4",RC[-6])+2,10),IFERROR(MID(RC[-6],SEARCH("-3",RC[-6])+2,10),IFERROR(MID(RC[-6],SEARCH("-2",RC[-6])+2,10),IFERROR(MID(RC[-6],SEARCH("-1",RC[-6])+2,10),IFERROR(MID(RC[-6],SEARCH("-",RC[-6])+1,10),))))))))))) -> 超凡博士 | I262: ="1"&VLOOKUP(RC[-1],Sheet1!R2C2:R127C3,2,FALSE) -> 130438 | J262: 130438 | K262: =IFERROR(FIND(13,RC[-4],1),"") -> 12 | L262: =IF(RC[-1]="","",MID(RC[-5],RC[-1],6)) -> 130438 | M262: =SUBSTITUTE(RC[-6],RC[-1],RC[-3],1) -> "不要耍小聪明"|2#1304385|1
A263: 10129504 | B263: 13-10超凡博士 | D263: 6 | F263: 3|1 | G263: "你们不该惹怒我"|2#1304385|1 | H263: =IFERROR(MID(RC[-6],SEARCH("-10",RC[-6])+3,10),IFERROR(MID(RC[-6],SEARCH("-9",RC[-6])+2,10),IFERROR(MID(RC[-6],SEARCH("-8",RC[-6])+2,10),IFERROR(MID(RC[-6],SEARCH("-7",RC[-6])+2,10),IFERROR(MID(RC[-6],SEARCH("-6",RC[-6])+2,10),IFERROR(MID(RC[-6],SEARCH("-5",RC[-6])+2,10),IFERROR(MID(RC[-6],SEARCH("-4",RC[-6])+2,10),IFERROR(MID(RC[-6],SEARCH("-3",RC[-6])+2,10),IFERROR(MID(RC[-6],SEARCH("-2",RC[-6])+2,10),IFERROR(MID(RC[-6],SEARCH("-1",RC[-6])+2,10),IFERROR(MID(RC[-6],SEARCH("-",RC[-6])+1,10),))))))))))) -> 超凡博士 | I263: ="1"&VLOOKUP(RC[-1],Sheet1!R2C2:R127C3,2,FALSE) -> 130438 | J263: 130438 | K263: =IFERROR(FIND(13,RC[-4],1),"") -> 13 | L263: =IF(RC[-1]="","",MID(RC[-5],RC[-1],6)) -> 130438 | M263: =SUBSTITUTE(RC[-6],RC[-1],RC[-3],1) -> "你们不该惹怒我"|2#1304385|1
A264: 10132401 | B264: 14-3斯巴达 | D264: 2 | E264: 20 | F264: 3|1 | G264: "这里是——斯巴达！！"|2#400024|1 | H264: =IFERROR(MID(RC[-6],SEARCH("-10",RC[-6])+3,10),IFERROR(MID(RC[-6],SEARCH("-9",RC[-6])+2,10),IFERROR(MID(RC[-6],SEARCH("-8",RC[-6])+2,10),IFERROR(MID(RC[-6],SEARCH("-7",RC[-6])+2,10),IFERROR(MID(RC[-6],SEARCH("-6",RC[-6])+2,10),IFERROR(MID(RC[-6],SEARCH("-5",RC[-6])+2,10),IFERROR(MID(RC[-6],SEARCH("-4",RC[-6])+2,10),IFERROR(MID(RC[-6],SEARCH("-3",RC[-6])+2,10),IFERROR(MID(RC[-6],SEARCH("-2",RC[-6])+2,10),IFERROR(MID(RC[-6],SEARCH("-1",RC[-6])+2,10),IFERROR(MID(RC[-6],SEARCH("-",RC[-6])+1,10),))))))))))) -> 斯巴达 | I264: ="1"&VLOOKUP(RC[-1],Sheet1!R2C2:R127C3,2,FALSE) -> 131410 | J264: 131410 | K264: =IFERROR(FIND(13,RC[-4],1),"") ->  | L264: =IF(RC[-1]="","",MID(RC[-5],RC[-1],6)) ->  | M264: =SUBSTITUTE(RC[-6],RC[-1],RC[-3],1) -> "这里是——斯巴达！！"|2#400024|1
A265: 10139301 | B265: 14-10雷神 | D265: 4 | F265: 3|1 | G265: "你们别想得逞"|2#1304314|1 | H265: =IFERROR(MID(RC[-6],SEARCH("-10",RC[-6])+3,10),IFERROR(MID(RC[-6],SEARCH("-9",RC[-6])+2,10),IFERROR(MID(RC[-6],SEARCH("-8",RC[-6])+2,10),IFERROR(MID(RC[-6],SEARCH("-7",RC[-6])+2,10),IFERROR(MID(RC[-6],SEARCH("-6",RC[-6])+2,10),IFERROR(MID(RC[-6],SEARCH("-5",RC[-6])+2,10),IFERROR(MID(RC[-6],SEARCH("-4",RC[-6])+2,10),IFERROR(MID(RC[-6],SEARCH("-3",RC[-6])+2,10),IFERROR(MID(RC[-6],SEARCH("-2",RC[-6])+2,10),IFERROR(MID(RC[-6],SEARCH("-1",RC[-6])+2,10),IFERROR(MID(RC[-6],SEARCH("-",RC[-6])+1,10),))))))))))) -> 雷神 | I265: ="1"&VLOOKUP(RC[-1],Sheet1!R2C2:R127C3,2,FALSE) -> 130431 | J265: 130431 | K265: =IFERROR(FIND(13,RC[-4],1),"") -> 12 | L265: =IF(RC[-1]="","",MID(RC[-5],RC[-1],6)) -> 130431 | M265: =SUBSTITUTE(RC[-6],RC[-1],RC[-3],1) -> "你们别想得逞"|2#1304314|1
A266: 10139302 | B266: 14-10雷神 | D266: 2 | E266: 10 | F266: 3|1 | G266: "你们别想得逞"|2#1304314|1 | H266: =IFERROR(MID(RC[-6],SEARCH("-10",RC[-6])+3,10),IFERROR(MID(RC[-6],SEARCH("-9",RC[-6])+2,10),IFERROR(MID(RC[-6],SEARCH("-8",RC[-6])+2,10),IFERROR(MID(RC[-6],SEARCH("-7",RC[-6])+2,10),IFERROR(MID(RC[-6],SEARCH("-6",RC[-6])+2,10),IFERROR(MID(RC[-6],SEARCH("-5",RC[-6])+2,10),IFERROR(MID(RC[-6],SEARCH("-4",RC[-6])+2,10),IFERROR(MID(RC[-6],SEARCH("-3",RC[-6])+2,10),IFERROR(MID(RC[-6],SEARCH("-2",RC[-6])+2,10),IFERROR(MID(RC[-6],SEARCH("-1",RC[-6])+2,10),IFERROR(MID(RC[-6],SEARCH("-",RC[-6])+1,10),))))))))))) -> 雷神 | I266: ="1"&VLOOKUP(RC[-1],Sheet1!R2C2:R127C3,2,FALSE) -> 130431 | J266: 130431 | K266: =IFERROR(FIND(13,RC[-4],1),"") -> 12 | L266: =IF(RC[-1]="","",MID(RC[-5],RC[-1],6)) -> 130431 | M266: =SUBSTITUTE(RC[-6],RC[-1],RC[-3],1) -> "你们别想得逞"|2#1304314|1
A267: 10139303 | B267: 14-10雷神 | D267: 1 | E267: 101393|70 | F267: 3|1 | G267: "你们别想得逞"|2#1304314|1 | H267: =IFERROR(MID(RC[-6],SEARCH("-10",RC[-6])+3,10),IFERROR(MID(RC[-6],SEARCH("-9",RC[-6])+2,10),IFERROR(MID(RC[-6],SEARCH("-8",RC[-6])+2,10),IFERROR(MID(RC[-6],SEARCH("-7",RC[-6])+2,10),IFERROR(MID(RC[-6],SEARCH("-6",RC[-6])+2,10),IFERROR(MID(RC[-6],SEARCH("-5",RC[-6])+2,10),IFERROR(MID(RC[-6],SEARCH("-4",RC[-6])+2,10),IFERROR(MID(RC[-6],SEARCH("-3",RC[-6])+2,10),IFERROR(MID(RC[-6],SEARCH("-2",RC[-6])+2,10),IFERROR(MID(RC[-6],SEARCH("-1",RC[-6])+2,10),IFERROR(MID(RC[-6],SEARCH("-",RC[-6])+1,10),))))))))))) -> 雷神 | I267: ="1"&VLOOKUP(RC[-1],Sheet1!R2C2:R127C3,2,FALSE) -> 130431 | J267: 130431 | K267: =IFERROR(FIND(13,RC[-4],1),"") -> 12 | L267: =IF(RC[-1]="","",MID(RC[-5],RC[-1],6)) -> 130431 | M267: =SUBSTITUTE(RC[-6],RC[-1],RC[-3],1) -> "你们别想得逞"|2#1304314|1
A268: 10139304 | B268: 14-10雷神 | D268: 1 | E268: 101393|30 | F268: 3|1 | G268: "你们别想得逞"|2#1304314|1 | H268: =IFERROR(MID(RC[-6],SEARCH("-10",RC[-6])+3,10),IFERROR(MID(RC[-6],SEARCH("-9",RC[-6])+2,10),IFERROR(MID(RC[-6],SEARCH("-8",RC[-6])+2,10),IFERROR(MID(RC[-6],SEARCH("-7",RC[-6])+2,10),IFERROR(MID(RC[-6],SEARCH("-6",RC[-6])+2,10),IFERROR(MID(RC[-6],SEARCH("-5",RC[-6])+2,10),IFERROR(MID(RC[-6],SEARCH("-4",RC[-6])+2,10),IFERROR(MID(RC[-6],SEARCH("-3",RC[-6])+2,10),IFERROR(MID(RC[-6],SEARCH("-2",RC[-6])+2,10),IFERROR(MID(RC[-6],SEARCH("-1",RC[-6])+2,10),IFERROR(MID(RC[-6],SEARCH("-",RC[-6])+1,10),))))))))))) -> 雷神 | I268: ="1"&VLOOKUP(RC[-1],Sheet1!R2C2:R127C3,2,FALSE) -> 130431 | J268: 130431 | K268: =IFERROR(FIND(13,RC[-4],1),"") -> 12 | L268: =IF(RC[-1]="","",MID(RC[-5],RC[-1],6)) -> 130431 | M268: =SUBSTITUTE(RC[-6],RC[-1],RC[-3],1) -> "你们别想得逞"|2#1304314|1
A269: 10148301 | B269: 15-9铁人 | D269: 6 | F269: 3|1 | G269: "击杀我的队友……也来尝试一下我的愤怒吧！"|3#1304284|1 | H269: =IFERROR(MID(RC[-6],SEARCH("-10",RC[-6])+3,10),IFERROR(MID(RC[-6],SEARCH("-9",RC[-6])+2,10),IFERROR(MID(RC[-6],SEARCH("-8",RC[-6])+2,10),IFERROR(MID(RC[-6],SEARCH("-7",RC[-6])+2,10),IFERROR(MID(RC[-6],SEARCH("-6",RC[-6])+2,10),IFERROR(MID(RC[-6],SEARCH("-5",RC[-6])+2,10),IFERROR(MID(RC[-6],SEARCH("-4",RC[-6])+2,10),IFERROR(MID(RC[-6],SEARCH("-3",RC[-6])+2,10),IFERROR(MID(RC[-6],SEARCH("-2",RC[-6])+2,10),IFERROR(MID(RC[-6],SEARCH("-1",RC[-6])+2,10),IFERROR(MID(RC[-6],SEARCH("-",RC[-6])+1,10),))))))))))) -> 铁人 | I269: ="1"&VLOOKUP(RC[-1],Sheet1!R2C2:R127C3,2,FALSE) -> 130428 | J269: 130428 | K269: =IFERROR(FIND(13,RC[-4],1),"") -> 26 | L269: =IF(RC[-1]="","",MID(RC[-5],RC[-1],6)) -> 130428 | M269: =SUBSTITUTE(RC[-6],RC[-1],RC[-3],1) -> "击杀我的队友……也来尝试一下我的愤怒吧！"|3#1304284|1
A270: 10148302 | B270: 15-9铁人 | D270: 1 | E270: 101483|30 | F270: 3|4|1 | G270: "痛楚……你们能明白吗？"|3#2#1304284|1 | H270: =IFERROR(MID(RC[-6],SEARCH("-10",RC[-6])+3,10),IFERROR(MID(RC[-6],SEARCH("-9",RC[-6])+2,10),IFERROR(MID(RC[-6],SEARCH("-8",RC[-6])+2,10),IFERROR(MID(RC[-6],SEARCH("-7",RC[-6])+2,10),IFERROR(MID(RC[-6],SEARCH("-6",RC[-6])+2,10),IFERROR(MID(RC[-6],SEARCH("-5",RC[-6])+2,10),IFERROR(MID(RC[-6],SEARCH("-4",RC[-6])+2,10),IFERROR(MID(RC[-6],SEARCH("-3",RC[-6])+2,10),IFERROR(MID(RC[-6],SEARCH("-2",RC[-6])+2,10),IFERROR(MID(RC[-6],SEARCH("-1",RC[-6])+2,10),IFERROR(MID(RC[-6],SEARCH("-",RC[-6])+1,10),))))))))))) -> 铁人 | I270: ="1"&VLOOKUP(RC[-1],Sheet1!R2C2:R127C3,2,FALSE) -> 130428 | J270: 130428 | K270: =IFERROR(FIND(13,RC[-4],1),"") -> 19 | L270: =IF(RC[-1]="","",MID(RC[-5],RC[-1],6)) -> 130428 | M270: =SUBSTITUTE(RC[-6],RC[-1],RC[-3],1) -> "痛楚……你们能明白吗？"|3#2#1304284|1
A271: 10148303 | B271: 15-9铁人 | D271: 7 | F271: 3|1 | G271: "你们需要被销毁……"|3#1304284|1 | H271: =IFERROR(MID(RC[-6],SEARCH("-10",RC[-6])+3,10),IFERROR(MID(RC[-6],SEARCH("-9",RC[-6])+2,10),IFERROR(MID(RC[-6],SEARCH("-8",RC[-6])+2,10),IFERROR(MID(RC[-6],SEARCH("-7",RC[-6])+2,10),IFERROR(MID(RC[-6],SEARCH("-6",RC[-6])+2,10),IFERROR(MID(RC[-6],SEARCH("-5",RC[-6])+2,10),IFERROR(MID(RC[-6],SEARCH("-4",RC[-6])+2,10),IFERROR(MID(RC[-6],SEARCH("-3",RC[-6])+2,10),IFERROR(MID(RC[-6],SEARCH("-2",RC[-6])+2,10),IFERROR(MID(RC[-6],SEARCH("-1",RC[-6])+2,10),IFERROR(MID(RC[-6],SEARCH("-",RC[-6])+1,10),))))))))))) -> 铁人 | I271: ="1"&VLOOKUP(RC[-1],Sheet1!R2C2:R127C3,2,FALSE) -> 130428 | J271: 130428 | K271: =IFERROR(FIND(13,RC[-4],1),"") -> 15 | L271: =IF(RC[-1]="","",MID(RC[-5],RC[-1],6)) -> 130428 | M271: =SUBSTITUTE(RC[-6],RC[-1],RC[-3],1) -> "你们需要被销毁……"|3#1304284|1
A272: 10149001 | B272: 15-10战争主宰 | D272: 1 | E272: 101490|80 | F272: 3|1 | G272: "收到指令：完全消灭！"|3#400044|1 | H272: =IFERROR(MID(RC[-6],SEARCH("-10",RC[-6])+3,10),IFERROR(MID(RC[-6],SEARCH("-9",RC[-6])+2,10),IFERROR(MID(RC[-6],SEARCH("-8",RC[-6])+2,10),IFERROR(MID(RC[-6],SEARCH("-7",RC[-6])+2,10),IFERROR(MID(RC[-6],SEARCH("-6",RC[-6])+2,10),IFERROR(MID(RC[-6],SEARCH("-5",RC[-6])+2,10),IFERROR(MID(RC[-6],SEARCH("-4",RC[-6])+2,10),IFERROR(MID(RC[-6],SEARCH("-3",RC[-6])+2,10),IFERROR(MID(RC[-6],SEARCH("-2",RC[-6])+2,10),IFERROR(MID(RC[-6],SEARCH("-1",RC[-6])+2,10),IFERROR(MID(RC[-6],SEARCH("-",RC[-6])+1,10),))))))))))) -> 战争主宰 | I272: ="1"&VLOOKUP(RC[-1],Sheet1!R2C2:R127C3,2,FALSE) -> 133998 | J272: 133998 | K272: =IFERROR(FIND(13,RC[-4],1),"") ->  | L272: =IF(RC[-1]="","",MID(RC[-5],RC[-1],6)) ->  | M272: =SUBSTITUTE(RC[-6],RC[-1],RC[-3],1) -> "收到指令：完全消灭！"|3#400044|1
A273: 10149002 | B273: 15-10战争主宰 | D273: 1 | E273: 101490|50 | F273: 3|1 | G273: "清理——"|3#400044|1 | H273: =IFERROR(MID(RC[-6],SEARCH("-10",RC[-6])+3,10),IFERROR(MID(RC[-6],SEARCH("-9",RC[-6])+2,10),IFERROR(MID(RC[-6],SEARCH("-8",RC[-6])+2,10),IFERROR(MID(RC[-6],SEARCH("-7",RC[-6])+2,10),IFERROR(MID(RC[-6],SEARCH("-6",RC[-6])+2,10),IFERROR(MID(RC[-6],SEARCH("-5",RC[-6])+2,10),IFERROR(MID(RC[-6],SEARCH("-4",RC[-6])+2,10),IFERROR(MID(RC[-6],SEARCH("-3",RC[-6])+2,10),IFERROR(MID(RC[-6],SEARCH("-2",RC[-6])+2,10),IFERROR(MID(RC[-6],SEARCH("-1",RC[-6])+2,10),IFERROR(MID(RC[-6],SEARCH("-",RC[-6])+1,10),))))))))))) -> 战争主宰 | I273: ="1"&VLOOKUP(RC[-1],Sheet1!R2C2:R127C3,2,FALSE) -> 133998 | J273: 133998 | K273: =IFERROR(FIND(13,RC[-4],1),"") ->  | L273: =IF(RC[-1]="","",MID(RC[-5],RC[-1],6)) ->  | M273: =SUBSTITUTE(RC[-6],RC[-1],RC[-3],1) -> "清理——"|3#400044|1
A274: 10149003 | B274: 15-10战争主宰 | D274: 1 | E274: 101490|20 | F274: 3|1 | G274: "一个不留！"|3#400044|1 | H274: =IFERROR(MID(RC[-6],SEARCH("-10",RC[-6])+3,10),IFERROR(MID(RC[-6],SEARCH("-9",RC[-6])+2,10),IFERROR(MID(RC[-6],SEARCH("-8",RC[-6])+2,10),IFERROR(MID(RC[-6],SEARCH("-7",RC[-6])+2,10),IFERROR(MID(RC[-6],SEARCH("-6",RC[-6])+2,10),IFERROR(MID(RC[-6],SEARCH("-5",RC[-6])+2,10),IFERROR(MID(RC[-6],SEARCH("-4",RC[-6])+2,10),IFERROR(MID(RC[-6],SEARCH("-3",RC[-6])+2,10),IFERROR(MID(RC[-6],SEARCH("-2",RC[-6])+2,10),IFERROR(MID(RC[-6],SEARCH("-1",RC[-6])+2,10),IFERROR(MID(RC[-6],SEARCH("-",RC[-6])+1,10),))))))))))) -> 战争主宰 | I274: ="1"&VLOOKUP(RC[-1],Sheet1!R2C2:R127C3,2,FALSE) -> 133998 | J274: 133998 | K274: =IFERROR(FIND(13,RC[-4],1),"") ->  | L274: =IF(RC[-1]="","",MID(RC[-5],RC[-1],6)) ->  | M274: =SUBSTITUTE(RC[-6],RC[-1],RC[-3],1) -> "一个不留！"|3#400044|1
A275: 10149004 | B275: 15-10战争主宰 | D275: 2 | E275: 25 | F275: 3|1 | G275: "清理——"|3#400044|1 | H275: =IFERROR(MID(RC[-6],SEARCH("-10",RC[-6])+3,10),IFERROR(MID(RC[-6],SEARCH("-9",RC[-6])+2,10),IFERROR(MID(RC[-6],SEARCH("-8",RC[-6])+2,10),IFERROR(MID(RC[-6],SEARCH("-7",RC[-6])+2,10),IFERROR(MID(RC[-6],SEARCH("-6",RC[-6])+2,10),IFERROR(MID(RC[-6],SEARCH("-5",RC[-6])+2,10),IFERROR(MID(RC[-6],SEARCH("-4",RC[-6])+2,10),IFERROR(MID(RC[-6],SEARCH("-3",RC[-6])+2,10),IFERROR(MID(RC[-6],SEARCH("-2",RC[-6])+2,10),IFERROR(MID(RC[-6],SEARCH("-1",RC[-6])+2,10),IFERROR(MID(RC[-6],SEARCH("-",RC[-6])+1,10),))))))))))) -> 战争主宰 | I275: ="1"&VLOOKUP(RC[-1],Sheet1!R2C2:R127C3,2,FALSE) -> 133998 | J275: 133998 | K275: =IFERROR(FIND(13,RC[-4],1),"") ->  | L275: =IF(RC[-1]="","",MID(RC[-5],RC[-1],6)) ->  | M275: =SUBSTITUTE(RC[-6],RC[-1],RC[-3],1) -> "清理——"|3#400044|1
A276: 10155401 | B276: 16-6半人马 | D276: 2 | E276: 10 | F276: 3|1 | G276: "奔腾的血液，只要可以奔跑就不会停息"|3#1324015|1 | H276: =IFERROR(MID(RC[-6],SEARCH("-10",RC[-6])+3,10),IFERROR(MID(RC[-6],SEARCH("-9",RC[-6])+2,10),IFERROR(MID(RC[-6],SEARCH("-8",RC[-6])+2,10),IFERROR(MID(RC[-6],SEARCH("-7",RC[-6])+2,10),IFERROR(MID(RC[-6],SEARCH("-6",RC[-6])+2,10),IFERROR(MID(RC[-6],SEARCH("-5",RC[-6])+2,10),IFERROR(MID(RC[-6],SEARCH("-4",RC[-6])+2,10),IFERROR(MID(RC[-6],SEARCH("-3",RC[-6])+2,10),IFERROR(MID(RC[-6],SEARCH("-2",RC[-6])+2,10),IFERROR(MID(RC[-6],SEARCH("-1",RC[-6])+2,10),IFERROR(MID(RC[-6],SEARCH("-",RC[-6])+1,10),))))))))))) -> 半人马 | I276: ="1"&VLOOKUP(RC[-1],Sheet1!R2C2:R127C3,2,FALSE) -> 132401 | J276: 132401 | K276: =IFERROR(FIND(13,RC[-4],1),"") -> 23 | L276: =IF(RC[-1]="","",MID(RC[-5],RC[-1],6)) -> 132401 | M276: =SUBSTITUTE(RC[-6],RC[-1],RC[-3],1) -> "奔腾的血液，只要可以奔跑就不会停息"|3#1324015|1
A277: 10155301 | B277: 16-6食人魔 | D277: 1 | E277: 10155401|50 | F277: 3|1 | G277: "品尝火焰吧……"|3#1324314|1 | H277: =IFERROR(MID(RC[-6],SEARCH("-10",RC[-6])+3,10),IFERROR(MID(RC[-6],SEARCH("-9",RC[-6])+2,10),IFERROR(MID(RC[-6],SEARCH("-8",RC[-6])+2,10),IFERROR(MID(RC[-6],SEARCH("-7",RC[-6])+2,10),IFERROR(MID(RC[-6],SEARCH("-6",RC[-6])+2,10),IFERROR(MID(RC[-6],SEARCH("-5",RC[-6])+2,10),IFERROR(MID(RC[-6],SEARCH("-4",RC[-6])+2,10),IFERROR(MID(RC[-6],SEARCH("-3",RC[-6])+2,10),IFERROR(MID(RC[-6],SEARCH("-2",RC[-6])+2,10),IFERROR(MID(RC[-6],SEARCH("-1",RC[-6])+2,10),IFERROR(MID(RC[-6],SEARCH("-",RC[-6])+1,10),))))))))))) -> 食人魔 | I277: ="1"&VLOOKUP(RC[-1],Sheet1!R2C2:R127C3,2,FALSE) -> 132431 | J277: 132431 | K277: =IFERROR(FIND(13,RC[-4],1),"") -> 13 | L277: =IF(RC[-1]="","",MID(RC[-5],RC[-1],6)) -> 132431 | M277: =SUBSTITUTE(RC[-6],RC[-1],RC[-3],1) -> "品尝火焰吧……"|3#1324314|1
A278: 10159301 | B278: 16-10大检察官 | D278: 1 | E278: 101594|70 | F278: 3|1 | G278: "你们要为此付出代价！"|3#1324404|1 | H278: =IFERROR(MID(RC[-6],SEARCH("-10",RC[-6])+3,10),IFERROR(MID(RC[-6],SEARCH("-9",RC[-6])+2,10),IFERROR(MID(RC[-6],SEARCH("-8",RC[-6])+2,10),IFERROR(MID(RC[-6],SEARCH("-7",RC[-6])+2,10),IFERROR(MID(RC[-6],SEARCH("-6",RC[-6])+2,10),IFERROR(MID(RC[-6],SEARCH("-5",RC[-6])+2,10),IFERROR(MID(RC[-6],SEARCH("-4",RC[-6])+2,10),IFERROR(MID(RC[-6],SEARCH("-3",RC[-6])+2,10),IFERROR(MID(RC[-6],SEARCH("-2",RC[-6])+2,10),IFERROR(MID(RC[-6],SEARCH("-1",RC[-6])+2,10),IFERROR(MID(RC[-6],SEARCH("-",RC[-6])+1,10),))))))))))) -> 大检察官 | I278: ="1"&VLOOKUP(RC[-1],Sheet1!R2C2:R127C3,2,FALSE) -> 132440 | J278: 132440 | K278: =IFERROR(FIND(13,RC[-4],1),"") -> 16 | L278: =IF(RC[-1]="","",MID(RC[-5],RC[-1],6)) -> 132440 | M278: =SUBSTITUTE(RC[-6],RC[-1],RC[-3],1) -> "你们要为此付出代价！"|3#1324404|1
A279: 10159302 | B279: 16-10大检察官 | D279: 1 | E279: 101594|30 | F279: 3|1 | G279: "你们要为此付出代价！"|3#1324404|1 | H279: =IFERROR(MID(RC[-6],SEARCH("-10",RC[-6])+3,10),IFERROR(MID(RC[-6],SEARCH("-9",RC[-6])+2,10),IFERROR(MID(RC[-6],SEARCH("-8",RC[-6])+2,10),IFERROR(MID(RC[-6],SEARCH("-7",RC[-6])+2,10),IFERROR(MID(RC[-6],SEARCH("-6",RC[-6])+2,10),IFERROR(MID(RC[-6],SEARCH("-5",RC[-6])+2,10),IFERROR(MID(RC[-6],SEARCH("-4",RC[-6])+2,10),IFERROR(MID(RC[-6],SEARCH("-3",RC[-6])+2,10),IFERROR(MID(RC[-6],SEARCH("-2",RC[-6])+2,10),IFERROR(MID(RC[-6],SEARCH("-1",RC[-6])+2,10),IFERROR(MID(RC[-6],SEARCH("-",RC[-6])+1,10),))))))))))) -> 大检察官 | I279: ="1"&VLOOKUP(RC[-1],Sheet1!R2C2:R127C3,2,FALSE) -> 132440 | J279: 132440 | K279: =IFERROR(FIND(13,RC[-4],1),"") -> 16 | L279: =IF(RC[-1]="","",MID(RC[-5],RC[-1],6)) -> 132440 | M279: =SUBSTITUTE(RC[-6],RC[-1],RC[-3],1) -> "你们要为此付出代价！"|3#1324404|1
A280: 10159401 | B280: 16-10血色指挥官 | D280: 5 | E280: 100 | F280: 1 | G280: 1324085|0 | H280: =IFERROR(MID(RC[-6],SEARCH("-10",RC[-6])+3,10),IFERROR(MID(RC[-6],SEARCH("-9",RC[-6])+2,10),IFERROR(MID(RC[-6],SEARCH("-8",RC[-6])+2,10),IFERROR(MID(RC[-6],SEARCH("-7",RC[-6])+2,10),IFERROR(MID(RC[-6],SEARCH("-6",RC[-6])+2,10),IFERROR(MID(RC[-6],SEARCH("-5",RC[-6])+2,10),IFERROR(MID(RC[-6],SEARCH("-4",RC[-6])+2,10),IFERROR(MID(RC[-6],SEARCH("-3",RC[-6])+2,10),IFERROR(MID(RC[-6],SEARCH("-2",RC[-6])+2,10),IFERROR(MID(RC[-6],SEARCH("-1",RC[-6])+2,10),IFERROR(MID(RC[-6],SEARCH("-",RC[-6])+1,10),))))))))))) -> 血色指挥官 | I280: ="1"&VLOOKUP(RC[-1],Sheet1!R2C2:R127C3,2,FALSE) -> 132408 | J280: 132408 | K280: =IFERROR(FIND(13,RC[-4],1),"") -> 1 | L280: =IF(RC[-1]="","",MID(RC[-5],RC[-1],6)) -> 132408 | M280: =SUBSTITUTE(RC[-6],RC[-1],RC[-3],1) -> 1324085|0
A281: 10162401 | B281: 17-3小黑 | D281: 2 | E281: 10 | F281: 3|1 | G281: "黑暗将淹没你们"|3#1324284|1 | H281: =IFERROR(MID(RC[-6],SEARCH("-10",RC[-6])+3,10),IFERROR(MID(RC[-6],SEARCH("-9",RC[-6])+2,10),IFERROR(MID(RC[-6],SEARCH("-8",RC[-6])+2,10),IFERROR(MID(RC[-6],SEARCH("-7",RC[-6])+2,10),IFERROR(MID(RC[-6],SEARCH("-6",RC[-6])+2,10),IFERROR(MID(RC[-6],SEARCH("-5",RC[-6])+2,10),IFERROR(MID(RC[-6],SEARCH("-4",RC[-6])+2,10),IFERROR(MID(RC[-6],SEARCH("-3",RC[-6])+2,10),IFERROR(MID(RC[-6],SEARCH("-2",RC[-6])+2,10),IFERROR(MID(RC[-6],SEARCH("-1",RC[-6])+2,10),IFERROR(MID(RC[-6],SEARCH("-",RC[-6])+1,10),))))))))))) -> 小黑 | I281: ="1"&VLOOKUP(RC[-1],Sheet1!R2C2:R127C3,2,FALSE) -> 132428 | J281: 132428 | K281: =IFERROR(FIND(13,RC[-4],1),"") -> 13 | L281: =IF(RC[-1]="","",MID(RC[-5],RC[-1],6)) -> 132428 | M281: =SUBSTITUTE(RC[-6],RC[-1],RC[-3],1) -> "黑暗将淹没你们"|3#1324284|1
A282: 10162402 | B282: 17-3小黑 | D282: 2 | E282: 20 | F282: 3|1 | G282: "箭之所向……"|3#1324284|1 | H282: =IFERROR(MID(RC[-6],SEARCH("-10",RC[-6])+3,10),IFERROR(MID(RC[-6],SEARCH("-9",RC[-6])+2,10),IFERROR(MID(RC[-6],SEARCH("-8",RC[-6])+2,10),IFERROR(MID(RC[-6],SEARCH("-7",RC[-6])+2,10),IFERROR(MID(RC[-6],SEARCH("-6",RC[-6])+2,10),IFERROR(MID(RC[-6],SEARCH("-5",RC[-6])+2,10),IFERROR(MID(RC[-6],SEARCH("-4",RC[-6])+2,10),IFERROR(MID(RC[-6],SEARCH("-3",RC[-6])+2,10),IFERROR(MID(RC[-6],SEARCH("-2",RC[-6])+2,10),IFERROR(MID(RC[-6],SEARCH("-1",RC[-6])+2,10),IFERROR(MID(RC[-6],SEARCH("-",RC[-6])+1,10),))))))))))) -> 小黑 | I282: ="1"&VLOOKUP(RC[-1],Sheet1!R2C2:R127C3,2,FALSE) -> 132428 | J282: 132428 | K282: =IFERROR(FIND(13,RC[-4],1),"") -> 12 | L282: =IF(RC[-1]="","",MID(RC[-5],RC[-1],6)) -> 132428 | M282: =SUBSTITUTE(RC[-6],RC[-1],RC[-3],1) -> "箭之所向……"|3#1324284|1
A283: 10162403 | B283: 17-3小黑 | D283: 2 | E283: 30 | F283: 3|1 | G283: "被遗忘吧……"|3#1324284|1 | H283: =IFERROR(MID(RC[-6],SEARCH("-10",RC[-6])+3,10),IFERROR(MID(RC[-6],SEARCH("-9",RC[-6])+2,10),IFERROR(MID(RC[-6],SEARCH("-8",RC[-6])+2,10),IFERROR(MID(RC[-6],SEARCH("-7",RC[-6])+2,10),IFERROR(MID(RC[-6],SEARCH("-6",RC[-6])+2,10),IFERROR(MID(RC[-6],SEARCH("-5",RC[-6])+2,10),IFERROR(MID(RC[-6],SEARCH("-4",RC[-6])+2,10),IFERROR(MID(RC[-6],SEARCH("-3",RC[-6])+2,10),IFERROR(MID(RC[-6],SEARCH("-2",RC[-6])+2,10),IFERROR(MID(RC[-6],SEARCH("-1",RC[-6])+2,10),IFERROR(MID(RC[-6],SEARCH("-",RC[-6])+1,10),))))))))))) -> 小黑 | I283: ="1"&VLOOKUP(RC[-1],Sheet1!R2C2:R127C3,2,FALSE) -> 132428 | J283: 132428 | K283: =IFERROR(FIND(13,RC[-4],1),"") -> 12 | L283: =IF(RC[-1]="","",MID(RC[-5],RC[-1],6)) -> 132428 | M283: =SUBSTITUTE(RC[-6],RC[-1],RC[-3],1) -> "被遗忘吧……"|3#1324284|1
A284: 10169001 | B284: 17-10独眼巨人 | D284: 1 | E284: 101690|80 | F284: 3|1 | G284: "痛楚……"|3#400045|1 | H284: =IFERROR(MID(RC[-6],SEARCH("-10",RC[-6])+3,10),IFERROR(MID(RC[-6],SEARCH("-9",RC[-6])+2,10),IFERROR(MID(RC[-6],SEARCH("-8",RC[-6])+2,10),IFERROR(MID(RC[-6],SEARCH("-7",RC[-6])+2,10),IFERROR(MID(RC[-6],SEARCH("-6",RC[-6])+2,10),IFERROR(MID(RC[-6],SEARCH("-5",RC[-6])+2,10),IFERROR(MID(RC[-6],SEARCH("-4",RC[-6])+2,10),IFERROR(MID(RC[-6],SEARCH("-3",RC[-6])+2,10),IFERROR(MID(RC[-6],SEARCH("-2",RC[-6])+2,10),IFERROR(MID(RC[-6],SEARCH("-1",RC[-6])+2,10),IFERROR(MID(RC[-6],SEARCH("-",RC[-6])+1,10),))))))))))) -> 独眼巨人 | I284: ="1"&VLOOKUP(RC[-1],Sheet1!R2C2:R127C3,2,FALSE) -> 131999 | J284: 131999 | K284: =IFERROR(FIND(13,RC[-4],1),"") ->  | L284: =IF(RC[-1]="","",MID(RC[-5],RC[-1],6)) ->  | M284: =SUBSTITUTE(RC[-6],RC[-1],RC[-3],1) -> "痛楚……"|3#400045|1
A285: 10169002 | B285: 17-10独眼巨人 | D285: 1 | E285: 101690|50 | F285: 3|1 | G285: "愤怒！！！"|3#400045|1 | H285: =IFERROR(MID(RC[-6],SEARCH("-10",RC[-6])+3,10),IFERROR(MID(RC[-6],SEARCH("-9",RC[-6])+2,10),IFERROR(MID(RC[-6],SEARCH("-8",RC[-6])+2,10),IFERROR(MID(RC[-6],SEARCH("-7",RC[-6])+2,10),IFERROR(MID(RC[-6],SEARCH("-6",RC[-6])+2,10),IFERROR(MID(RC[-6],SEARCH("-5",RC[-6])+2,10),IFERROR(MID(RC[-6],SEARCH("-4",RC[-6])+2,10),IFERROR(MID(RC[-6],SEARCH("-3",RC[-6])+2,10),IFERROR(MID(RC[-6],SEARCH("-2",RC[-6])+2,10),IFERROR(MID(RC[-6],SEARCH("-1",RC[-6])+2,10),IFERROR(MID(RC[-6],SEARCH("-",RC[-6])+1,10),))))))))))) -> 独眼巨人 | I285: ="1"&VLOOKUP(RC[-1],Sheet1!R2C2:R127C3,2,FALSE) -> 131999 | J285: 131999 | K285: =IFERROR(FIND(13,RC[-4],1),"") ->  | L285: =IF(RC[-1]="","",MID(RC[-5],RC[-1],6)) ->  | M285: =SUBSTITUTE(RC[-6],RC[-1],RC[-3],1) -> "愤怒！！！"|3#400045|1
A286: 10169003 | B286: 17-10独眼巨人 | D286: 1 | E286: 101690|20 | F286: 3|1 | G286: "毁灭！！！！！"|3#400045|1 | H286: =IFERROR(MID(RC[-6],SEARCH("-10",RC[-6])+3,10),IFERROR(MID(RC[-6],SEARCH("-9",RC[-6])+2,10),IFERROR(MID(RC[-6],SEARCH("-8",RC[-6])+2,10),IFERROR(MID(RC[-6],SEARCH("-7",RC[-6])+2,10),IFERROR(MID(RC[-6],SEARCH("-6",RC[-6])+2,10),IFERROR(MID(RC[-6],SEARCH("-5",RC[-6])+2,10),IFERROR(MID(RC[-6],SEARCH("-4",RC[-6])+2,10),IFERROR(MID(RC[-6],SEARCH("-3",RC[-6])+2,10),IFERROR(MID(RC[-6],SEARCH("-2",RC[-6])+2,10),IFERROR(MID(RC[-6],SEARCH("-1",RC[-6])+2,10),IFERROR(MID(RC[-6],SEARCH("-",RC[-6])+1,10),))))))))))) -> 独眼巨人 | I286: ="1"&VLOOKUP(RC[-1],Sheet1!R2C2:R127C3,2,FALSE) -> 131999 | J286: 131999 | K286: =IFERROR(FIND(13,RC[-4],1),"") ->  | L286: =IF(RC[-1]="","",MID(RC[-5],RC[-1],6)) ->  | M286: =SUBSTITUTE(RC[-6],RC[-1],RC[-3],1) -> "毁灭！！！！！"|3#400045|1
A287: 10175301 | B287: 18-6野蛮巨人 | C287: 3 | D287: 4 | F287: 3|1 | G287: "怒火在燃烧"|3#1304104|1 | H287: =IFERROR(MID(RC[-6],SEARCH("-10",RC[-6])+3,10),IFERROR(MID(RC[-6],SEARCH("-9",RC[-6])+2,10),IFERROR(MID(RC[-6],SEARCH("-8",RC[-6])+2,10),IFERROR(MID(RC[-6],SEARCH("-7",RC[-6])+2,10),IFERROR(MID(RC[-6],SEARCH("-6",RC[-6])+2,10),IFERROR(MID(RC[-6],SEARCH("-5",RC[-6])+2,10),IFERROR(MID(RC[-6],SEARCH("-4",RC[-6])+2,10),IFERROR(MID(RC[-6],SEARCH("-3",RC[-6])+2,10),IFERROR(MID(RC[-6],SEARCH("-2",RC[-6])+2,10),IFERROR(MID(RC[-6],SEARCH("-1",RC[-6])+2,10),IFERROR(MID(RC[-6],SEARCH("-",RC[-6])+1,10),))))))))))) -> 野蛮巨人 | I287: ="1"&VLOOKUP(RC[-1],Sheet1!R2C2:R127C3,2,FALSE) -> 130410 | J287: 130410 | K287: =IFERROR(FIND(13,RC[-4],1),"") -> 11 | L287: =IF(RC[-1]="","",MID(RC[-5],RC[-1],6)) -> 130410 | M287: =SUBSTITUTE(RC[-6],RC[-1],RC[-3],1) -> "怒火在燃烧"|3#1304104|1
A288: 10179301 | B288: 18-10火女 | D288: 1 | E288: 101794|50 | F288: 3|1 | G288: "火焰吞噬一切"|3#1324304|1 | H288: =IFERROR(MID(RC[-6],SEARCH("-10",RC[-6])+3,10),IFERROR(MID(RC[-6],SEARCH("-9",RC[-6])+2,10),IFERROR(MID(RC[-6],SEARCH("-8",RC[-6])+2,10),IFERROR(MID(RC[-6],SEARCH("-7",RC[-6])+2,10),IFERROR(MID(RC[-6],SEARCH("-6",RC[-6])+2,10),IFERROR(MID(RC[-6],SEARCH("-5",RC[-6])+2,10),IFERROR(MID(RC[-6],SEARCH("-4",RC[-6])+2,10),IFERROR(MID(RC[-6],SEARCH("-3",RC[-6])+2,10),IFERROR(MID(RC[-6],SEARCH("-2",RC[-6])+2,10),IFERROR(MID(RC[-6],SEARCH("-1",RC[-6])+2,10),IFERROR(MID(RC[-6],SEARCH("-",RC[-6])+1,10),))))))))))) -> 火女 | I288: ="1"&VLOOKUP(RC[-1],Sheet1!R2C2:R127C3,2,FALSE) -> 132430 | J288: 132430 | K288: =IFERROR(FIND(13,RC[-4],1),"") -> 12 | L288: =IF(RC[-1]="","",MID(RC[-5],RC[-1],6)) -> 132430 | M288: =SUBSTITUTE(RC[-6],RC[-1],RC[-3],1) -> "火焰吞噬一切"|3#1324304|1
A289: 10179302 | B289: 18-10火女 | D289: 1 | E289: 101793|50 | F289: 3|1 | G289: "火焰吞噬一切"|3#1324304|1 | H289: =IFERROR(MID(RC[-6],SEARCH("-10",RC[-6])+3,10),IFERROR(MID(RC[-6],SEARCH("-9",RC[-6])+2,10),IFERROR(MID(RC[-6],SEARCH("-8",RC[-6])+2,10),IFERROR(MID(RC[-6],SEARCH("-7",RC[-6])+2,10),IFERROR(MID(RC[-6],SEARCH("-6",RC[-6])+2,10),IFERROR(MID(RC[-6],SEARCH("-5",RC[-6])+2,10),IFERROR(MID(RC[-6],SEARCH("-4",RC[-6])+2,10),IFERROR(MID(RC[-6],SEARCH("-3",RC[-6])+2,10),IFERROR(MID(RC[-6],SEARCH("-2",RC[-6])+2,10),IFERROR(MID(RC[-6],SEARCH("-1",RC[-6])+2,10),IFERROR(MID(RC[-6],SEARCH("-",RC[-6])+1,10),))))))))))) -> 火女 | I289: ="1"&VLOOKUP(RC[-1],Sheet1!R2C2:R127C3,2,FALSE) -> 132430 | J289: 132430 | K289: =IFERROR(FIND(13,RC[-4],1),"") -> 12 | L289: =IF(RC[-1]="","",MID(RC[-5],RC[-1],6)) -> 132430 | M289: =SUBSTITUTE(RC[-6],RC[-1],RC[-3],1) -> "火焰吞噬一切"|3#1324304|1
A290: 10182301 | B290: 19-3血源牧师 | C290: 3 | D290: 6 | F290: 3|1 | G290: "血液是生命之光"|3#1323414|1 | H290: =IFERROR(MID(RC[-6],SEARCH("-10",RC[-6])+3,10),IFERROR(MID(RC[-6],SEARCH("-9",RC[-6])+2,10),IFERROR(MID(RC[-6],SEARCH("-8",RC[-6])+2,10),IFERROR(MID(RC[-6],SEARCH("-7",RC[-6])+2,10),IFERROR(MID(RC[-6],SEARCH("-6",RC[-6])+2,10),IFERROR(MID(RC[-6],SEARCH("-5",RC[-6])+2,10),IFERROR(MID(RC[-6],SEARCH("-4",RC[-6])+2,10),IFERROR(MID(RC[-6],SEARCH("-3",RC[-6])+2,10),IFERROR(MID(RC[-6],SEARCH("-2",RC[-6])+2,10),IFERROR(MID(RC[-6],SEARCH("-1",RC[-6])+2,10),IFERROR(MID(RC[-6],SEARCH("-",RC[-6])+1,10),))))))))))) -> 血源牧师 | I290: ="1"&VLOOKUP(RC[-1],Sheet1!R2C2:R127C3,2,FALSE) -> 132341 | J290: 132341 | K290: =IFERROR(FIND(13,RC[-4],1),"") -> 13 | L290: =IF(RC[-1]="","",MID(RC[-5],RC[-1],6)) -> 132341 | M290: =SUBSTITUTE(RC[-6],RC[-1],RC[-3],1) -> "血液是生命之光"|3#1323414|1
A291: 10189401 | B291: 19-10憎恶 | D291: 1 | E291: 101894|90 | F291: 3|1 | G291: "憎恶！"|3#1329994|1 | H291: =IFERROR(MID(RC[-6],SEARCH("-10",RC[-6])+3,10),IFERROR(MID(RC[-6],SEARCH("-9",RC[-6])+2,10),IFERROR(MID(RC[-6],SEARCH("-8",RC[-6])+2,10),IFERROR(MID(RC[-6],SEARCH("-7",RC[-6])+2,10),IFERROR(MID(RC[-6],SEARCH("-6",RC[-6])+2,10),IFERROR(MID(RC[-6],SEARCH("-5",RC[-6])+2,10),IFERROR(MID(RC[-6],SEARCH("-4",RC[-6])+2,10),IFERROR(MID(RC[-6],SEARCH("-3",RC[-6])+2,10),IFERROR(MID(RC[-6],SEARCH("-2",RC[-6])+2,10),IFERROR(MID(RC[-6],SEARCH("-1",RC[-6])+2,10),IFERROR(MID(RC[-6],SEARCH("-",RC[-6])+1,10),))))))))))) -> 憎恶 | I291: ="1"&VLOOKUP(RC[-1],Sheet1!R2C2:R127C3,2,FALSE) -> 132999 | J291: 132999 | K291: =IFERROR(FIND(13,RC[-4],1),"") -> 9 | L291: =IF(RC[-1]="","",MID(RC[-5],RC[-1],6)) -> 132999 | M291: =SUBSTITUTE(RC[-6],RC[-1],RC[-3],1) -> "憎恶！"|3#1329994|1
A292: 10189402 | B292: 19-10憎恶 | D292: 1 | E292: 101894|55 | F292: 3|1 | G292: "屠杀！"|3#1329994|1 | H292: =IFERROR(MID(RC[-6],SEARCH("-10",RC[-6])+3,10),IFERROR(MID(RC[-6],SEARCH("-9",RC[-6])+2,10),IFERROR(MID(RC[-6],SEARCH("-8",RC[-6])+2,10),IFERROR(MID(RC[-6],SEARCH("-7",RC[-6])+2,10),IFERROR(MID(RC[-6],SEARCH("-6",RC[-6])+2,10),IFERROR(MID(RC[-6],SEARCH("-5",RC[-6])+2,10),IFERROR(MID(RC[-6],SEARCH("-4",RC[-6])+2,10),IFERROR(MID(RC[-6],SEARCH("-3",RC[-6])+2,10),IFERROR(MID(RC[-6],SEARCH("-2",RC[-6])+2,10),IFERROR(MID(RC[-6],SEARCH("-1",RC[-6])+2,10),IFERROR(MID(RC[-6],SEARCH("-",RC[-6])+1,10),))))))))))) -> 憎恶 | I292: ="1"&VLOOKUP(RC[-1],Sheet1!R2C2:R127C3,2,FALSE) -> 132999 | J292: 132999 | K292: =IFERROR(FIND(13,RC[-4],1),"") -> 9 | L292: =IF(RC[-1]="","",MID(RC[-5],RC[-1],6)) -> 132999 | M292: =SUBSTITUTE(RC[-6],RC[-1],RC[-3],1) -> "屠杀！"|3#1329994|1
A293: 10189403 | B293: 19-10憎恶 | D293: 1 | E293: 101894|20 | F293: 3|1 | G293: "死亡！"|3#1329994|1 | H293: =IFERROR(MID(RC[-6],SEARCH("-10",RC[-6])+3,10),IFERROR(MID(RC[-6],SEARCH("-9",RC[-6])+2,10),IFERROR(MID(RC[-6],SEARCH("-8",RC[-6])+2,10),IFERROR(MID(RC[-6],SEARCH("-7",RC[-6])+2,10),IFERROR(MID(RC[-6],SEARCH("-6",RC[-6])+2,10),IFERROR(MID(RC[-6],SEARCH("-5",RC[-6])+2,10),IFERROR(MID(RC[-6],SEARCH("-4",RC[-6])+2,10),IFERROR(MID(RC[-6],SEARCH("-3",RC[-6])+2,10),IFERROR(MID(RC[-6],SEARCH("-2",RC[-6])+2,10),IFERROR(MID(RC[-6],SEARCH("-1",RC[-6])+2,10),IFERROR(MID(RC[-6],SEARCH("-",RC[-6])+1,10),))))))))))) -> 憎恶 | I293: ="1"&VLOOKUP(RC[-1],Sheet1!R2C2:R127C3,2,FALSE) -> 132999 | J293: 132999 | K293: =IFERROR(FIND(13,RC[-4],1),"") -> 9 | L293: =IF(RC[-1]="","",MID(RC[-5],RC[-1],6)) -> 132999 | M293: =SUBSTITUTE(RC[-6],RC[-1],RC[-3],1) -> "死亡！"|3#1329994|1
A294: 10195401 | B294: 20-6雷神 | D294: 7 | F294: 3|1 | G294: "这是——雷神之怒！"|3#1304314|1 | H294: =IFERROR(MID(RC[-6],SEARCH("-10",RC[-6])+3,10),IFERROR(MID(RC[-6],SEARCH("-9",RC[-6])+2,10),IFERROR(MID(RC[-6],SEARCH("-8",RC[-6])+2,10),IFERROR(MID(RC[-6],SEARCH("-7",RC[-6])+2,10),IFERROR(MID(RC[-6],SEARCH("-6",RC[-6])+2,10),IFERROR(MID(RC[-6],SEARCH("-5",RC[-6])+2,10),IFERROR(MID(RC[-6],SEARCH("-4",RC[-6])+2,10),IFERROR(MID(RC[-6],SEARCH("-3",RC[-6])+2,10),IFERROR(MID(RC[-6],SEARCH("-2",RC[-6])+2,10),IFERROR(MID(RC[-6],SEARCH("-1",RC[-6])+2,10),IFERROR(MID(RC[-6],SEARCH("-",RC[-6])+1,10),))))))))))) -> 雷神 | I294: ="1"&VLOOKUP(RC[-1],Sheet1!R2C2:R127C3,2,FALSE) -> 130431 | J294: 130431 | K294: =IFERROR(FIND(13,RC[-4],1),"") -> 15 | L294: =IF(RC[-1]="","",MID(RC[-5],RC[-1],6)) -> 130431 | M294: =SUBSTITUTE(RC[-6],RC[-1],RC[-3],1) -> "这是——雷神之怒！"|3#1304314|1
A295: 10195402 | B295: 20-6雷神 | C295: 2 | D295: 6 | F295: 3|1 | G295: "惩戒之雷！"|3#1304314|1 | H295: =IFERROR(MID(RC[-6],SEARCH("-10",RC[-6])+3,10),IFERROR(MID(RC[-6],SEARCH("-9",RC[-6])+2,10),IFERROR(MID(RC[-6],SEARCH("-8",RC[-6])+2,10),IFERROR(MID(RC[-6],SEARCH("-7",RC[-6])+2,10),IFERROR(MID(RC[-6],SEARCH("-6",RC[-6])+2,10),IFERROR(MID(RC[-6],SEARCH("-5",RC[-6])+2,10),IFERROR(MID(RC[-6],SEARCH("-4",RC[-6])+2,10),IFERROR(MID(RC[-6],SEARCH("-3",RC[-6])+2,10),IFERROR(MID(RC[-6],SEARCH("-2",RC[-6])+2,10),IFERROR(MID(RC[-6],SEARCH("-1",RC[-6])+2,10),IFERROR(MID(RC[-6],SEARCH("-",RC[-6])+1,10),))))))))))) -> 雷神 | I295: ="1"&VLOOKUP(RC[-1],Sheet1!R2C2:R127C3,2,FALSE) -> 130431 | J295: 130431 | K295: =IFERROR(FIND(13,RC[-4],1),"") -> 11 | L295: =IF(RC[-1]="","",MID(RC[-5],RC[-1],6)) -> 130431 | M295: =SUBSTITUTE(RC[-6],RC[-1],RC[-3],1) -> "惩戒之雷！"|3#1304314|1
A296: 10199401 | B296: 20-10树人 | D296: 1 | E296: 101994|30 | F296: 3|1 | G296: "吼！！"|3#1304114|1 | H296: =IFERROR(MID(RC[-6],SEARCH("-10",RC[-6])+3,10),IFERROR(MID(RC[-6],SEARCH("-9",RC[-6])+2,10),IFERROR(MID(RC[-6],SEARCH("-8",RC[-6])+2,10),IFERROR(MID(RC[-6],SEARCH("-7",RC[-6])+2,10),IFERROR(MID(RC[-6],SEARCH("-6",RC[-6])+2,10),IFERROR(MID(RC[-6],SEARCH("-5",RC[-6])+2,10),IFERROR(MID(RC[-6],SEARCH("-4",RC[-6])+2,10),IFERROR(MID(RC[-6],SEARCH("-3",RC[-6])+2,10),IFERROR(MID(RC[-6],SEARCH("-2",RC[-6])+2,10),IFERROR(MID(RC[-6],SEARCH("-1",RC[-6])+2,10),IFERROR(MID(RC[-6],SEARCH("-",RC[-6])+1,10),))))))))))) -> 树人 | I296: ="1"&VLOOKUP(RC[-1],Sheet1!R2C2:R127C3,2,FALSE) -> 130411 | J296: 130411 | K296: =IFERROR(FIND(13,RC[-4],1),"") -> 9 | L296: =IF(RC[-1]="","",MID(RC[-5],RC[-1],6)) -> 130411 | M296: =SUBSTITUTE(RC[-6],RC[-1],RC[-3],1) -> "吼！！"|3#1304114|1
A297: 10208301 | B297: 21-9狩猎女神 | C297: 2 | D297: 4 | F297: 3|1 | G297: "月来之箭，从不射空！"|3#1314314|1 | H297: =IFERROR(MID(RC[-6],SEARCH("-10",RC[-6])+3,10),IFERROR(MID(RC[-6],SEARCH("-9",RC[-6])+2,10),IFERROR(MID(RC[-6],SEARCH("-8",RC[-6])+2,10),IFERROR(MID(RC[-6],SEARCH("-7",RC[-6])+2,10),IFERROR(MID(RC[-6],SEARCH("-6",RC[-6])+2,10),IFERROR(MID(RC[-6],SEARCH("-5",RC[-6])+2,10),IFERROR(MID(RC[-6],SEARCH("-4",RC[-6])+2,10),IFERROR(MID(RC[-6],SEARCH("-3",RC[-6])+2,10),IFERROR(MID(RC[-6],SEARCH("-2",RC[-6])+2,10),IFERROR(MID(RC[-6],SEARCH("-1",RC[-6])+2,10),IFERROR(MID(RC[-6],SEARCH("-",RC[-6])+1,10),))))))))))) -> 狩猎女神 | I297: ="1"&VLOOKUP(RC[-1],Sheet1!R2C2:R127C3,2,FALSE) -> 131431 | J297: 131431 | K297: =IFERROR(FIND(13,RC[-4],1),"") -> 16 | L297: =IF(RC[-1]="","",MID(RC[-5],RC[-1],6)) -> 131431 | M297: =SUBSTITUTE(RC[-6],RC[-1],RC[-3],1) -> "月来之箭，从不射空！"|3#1314314|1
A298: 10208302 | B298: 21-9狩猎女神 | D298: 1 | E298: 102083|50 | F298: 3|4|1 | G298: "神灵不可冒犯"|3#1.5#1314314|1 | H298: =IFERROR(MID(RC[-6],SEARCH("-10",RC[-6])+3,10),IFERROR(MID(RC[-6],SEARCH("-9",RC[-6])+2,10),IFERROR(MID(RC[-6],SEARCH("-8",RC[-6])+2,10),IFERROR(MID(RC[-6],SEARCH("-7",RC[-6])+2,10),IFERROR(MID(RC[-6],SEARCH("-6",RC[-6])+2,10),IFERROR(MID(RC[-6],SEARCH("-5",RC[-6])+2,10),IFERROR(MID(RC[-6],SEARCH("-4",RC[-6])+2,10),IFERROR(MID(RC[-6],SEARCH("-3",RC[-6])+2,10),IFERROR(MID(RC[-6],SEARCH("-2",RC[-6])+2,10),IFERROR(MID(RC[-6],SEARCH("-1",RC[-6])+2,10),IFERROR(MID(RC[-6],SEARCH("-",RC[-6])+1,10),))))))))))) -> 狩猎女神 | I298: ="1"&VLOOKUP(RC[-1],Sheet1!R2C2:R127C3,2,FALSE) -> 131431 | J298: 131431 | K298: =IFERROR(FIND(13,RC[-4],1),"") -> 16 | L298: =IF(RC[-1]="","",MID(RC[-5],RC[-1],6)) -> 131431 | M298: =SUBSTITUTE(RC[-6],RC[-1],RC[-3],1) -> "神灵不可冒犯"|3#1.5#1314314|1
A299: 10212301 | B299: 22-3半人马 | D299: 2 | E299: 10 | F299: 3|1 | G299: "冲锋！！！"|3#1324014|1 | H299: =IFERROR(MID(RC[-6],SEARCH("-10",RC[-6])+3,10),IFERROR(MID(RC[-6],SEARCH("-9",RC[-6])+2,10),IFERROR(MID(RC[-6],SEARCH("-8",RC[-6])+2,10),IFERROR(MID(RC[-6],SEARCH("-7",RC[-6])+2,10),IFERROR(MID(RC[-6],SEARCH("-6",RC[-6])+2,10),IFERROR(MID(RC[-6],SEARCH("-5",RC[-6])+2,10),IFERROR(MID(RC[-6],SEARCH("-4",RC[-6])+2,10),IFERROR(MID(RC[-6],SEARCH("-3",RC[-6])+2,10),IFERROR(MID(RC[-6],SEARCH("-2",RC[-6])+2,10),IFERROR(MID(RC[-6],SEARCH("-1",RC[-6])+2,10),IFERROR(MID(RC[-6],SEARCH("-",RC[-6])+1,10),))))))))))) -> 半人马 | I299: ="1"&VLOOKUP(RC[-1],Sheet1!R2C2:R127C3,2,FALSE) -> 132401 | J299: 132401 | K299: =IFERROR(FIND(13,RC[-4],1),"") -> 11 | L299: =IF(RC[-1]="","",MID(RC[-5],RC[-1],6)) -> 132401 | M299: =SUBSTITUTE(RC[-6],RC[-1],RC[-3],1) -> "冲锋！！！"|3#1324014|1
A300: 10212302 | B300: 22-3半人马 | D300: 2 | E300: 20 | F300: 3|1 | G300: "我们的铁蹄，无处可挡！"|3#1324014|1 | H300: =IFERROR(MID(RC[-6],SEARCH("-10",RC[-6])+3,10),IFERROR(MID(RC[-6],SEARCH("-9",RC[-6])+2,10),IFERROR(MID(RC[-6],SEARCH("-8",RC[-6])+2,10),IFERROR(MID(RC[-6],SEARCH("-7",RC[-6])+2,10),IFERROR(MID(RC[-6],SEARCH("-6",RC[-6])+2,10),IFERROR(MID(RC[-6],SEARCH("-5",RC[-6])+2,10),IFERROR(MID(RC[-6],SEARCH("-4",RC[-6])+2,10),IFERROR(MID(RC[-6],SEARCH("-3",RC[-6])+2,10),IFERROR(MID(RC[-6],SEARCH("-2",RC[-6])+2,10),IFERROR(MID(RC[-6],SEARCH("-1",RC[-6])+2,10),IFERROR(MID(RC[-6],SEARCH("-",RC[-6])+1,10),))))))))))) -> 半人马 | I300: ="1"&VLOOKUP(RC[-1],Sheet1!R2C2:R127C3,2,FALSE) -> 132401 | J300: 132401 | K300: =IFERROR(FIND(13,RC[-4],1),"") -> 17 | L300: =IF(RC[-1]="","",MID(RC[-5],RC[-1],6)) -> 132401 | M300: =SUBSTITUTE(RC[-6],RC[-1],RC[-3],1) -> "我们的铁蹄，无处可挡！"|3#1324014|1
A301: 10212303 | B301: 22-3半人马 | D301: 2 | E301: 30 | F301: 3|1 | G301: "我将永不停歇——在死亡到来之前！"|3#1324014|1 | H301: =IFERROR(MID(RC[-6],SEARCH("-10",RC[-6])+3,10),IFERROR(MID(RC[-6],SEARCH("-9",RC[-6])+2,10),IFERROR(MID(RC[-6],SEARCH("-8",RC[-6])+2,10),IFERROR(MID(RC[-6],SEARCH("-7",RC[-6])+2,10),IFERROR(MID(RC[-6],SEARCH("-6",RC[-6])+2,10),IFERROR(MID(RC[-6],SEARCH("-5",RC[-6])+2,10),IFERROR(MID(RC[-6],SEARCH("-4",RC[-6])+2,10),IFERROR(MID(RC[-6],SEARCH("-3",RC[-6])+2,10),IFERROR(MID(RC[-6],SEARCH("-2",RC[-6])+2,10),IFERROR(MID(RC[-6],SEARCH("-1",RC[-6])+2,10),IFERROR(MID(RC[-6],SEARCH("-",RC[-6])+1,10),))))))))))) -> 半人马 | I301: ="1"&VLOOKUP(RC[-1],Sheet1!R2C2:R127C3,2,FALSE) -> 132401 | J301: 132401 | K301: =IFERROR(FIND(13,RC[-4],1),"") -> 22 | L301: =IF(RC[-1]="","",MID(RC[-5],RC[-1],6)) -> 132401 | M301: =SUBSTITUTE(RC[-6],RC[-1],RC[-3],1) -> "我将永不停歇——在死亡到来之前！"|3#1324014|1
A302: 10219501 | B302: 22-10潘多拉 | C302: 2 | D302: 4 | F302: 3|1 | G302: "星辰都将陨落……"|3#1315304|1 | H302: =IFERROR(MID(RC[-6],SEARCH("-10",RC[-6])+3,10),IFERROR(MID(RC[-6],SEARCH("-9",RC[-6])+2,10),IFERROR(MID(RC[-6],SEARCH("-8",RC[-6])+2,10),IFERROR(MID(RC[-6],SEARCH("-7",RC[-6])+2,10),IFERROR(MID(RC[-6],SEARCH("-6",RC[-6])+2,10),IFERROR(MID(RC[-6],SEARCH("-5",RC[-6])+2,10),IFERROR(MID(RC[-6],SEARCH("-4",RC[-6])+2,10),IFERROR(MID(RC[-6],SEARCH("-3",RC[-6])+2,10),IFERROR(MID(RC[-6],SEARCH("-2",RC[-6])+2,10),IFERROR(MID(RC[-6],SEARCH("-1",RC[-6])+2,10),IFERROR(MID(RC[-6],SEARCH("-",RC[-6])+1,10),))))))))))) -> 潘多拉 | I302: ="1"&VLOOKUP(RC[-1],Sheet1!R2C2:R127C3,2,FALSE) -> 131530 | J302: 131530 | K302: =IFERROR(FIND(13,RC[-4],1),"") -> 14 | L302: =IF(RC[-1]="","",MID(RC[-5],RC[-1],6)) -> 131530 | M302: =SUBSTITUTE(RC[-6],RC[-1],RC[-3],1) -> "星辰都将陨落……"|3#1315304|1
A303: 10219502 | B303: 22-10潘多拉 | D303: 1 | E303: 102195|50 | F303: 3|4|1|3 | G303: "我引领灾……不，不对"|2#2#1315304|1#"我，既是灾难！"|3 | H303: =IFERROR(MID(RC[-6],SEARCH("-10",RC[-6])+3,10),IFERROR(MID(RC[-6],SEARCH("-9",RC[-6])+2,10),IFERROR(MID(RC[-6],SEARCH("-8",RC[-6])+2,10),IFERROR(MID(RC[-6],SEARCH("-7",RC[-6])+2,10),IFERROR(MID(RC[-6],SEARCH("-6",RC[-6])+2,10),IFERROR(MID(RC[-6],SEARCH("-5",RC[-6])+2,10),IFERROR(MID(RC[-6],SEARCH("-4",RC[-6])+2,10),IFERROR(MID(RC[-6],SEARCH("-3",RC[-6])+2,10),IFERROR(MID(RC[-6],SEARCH("-2",RC[-6])+2,10),IFERROR(MID(RC[-6],SEARCH("-1",RC[-6])+2,10),IFERROR(MID(RC[-6],SEARCH("-",RC[-6])+1,10),))))))))))) -> 潘多拉 | I303: ="1"&VLOOKUP(RC[-1],Sheet1!R2C2:R127C3,2,FALSE) -> 131530 | J303: 131530 | K303: =IFERROR(FIND(13,RC[-4],1),"") -> 18 | L303: =IF(RC[-1]="","",MID(RC[-5],RC[-1],6)) -> 131530 | M303: =SUBSTITUTE(RC[-6],RC[-1],RC[-3],1) -> "我引领灾……不，不对"|2#2#1315304|1#"我，既是灾难！"|3
A304: 10225401 | B304: 23-6刀锋猎人 | D304: 1 | E304: 102254|90 | F304: 3|1 | G304: "我行走于黑夜里"|3#1304024|1 | H304: =IFERROR(MID(RC[-6],SEARCH("-10",RC[-6])+3,10),IFERROR(MID(RC[-6],SEARCH("-9",RC[-6])+2,10),IFERROR(MID(RC[-6],SEARCH("-8",RC[-6])+2,10),IFERROR(MID(RC[-6],SEARCH("-7",RC[-6])+2,10),IFERROR(MID(RC[-6],SEARCH("-6",RC[-6])+2,10),IFERROR(MID(RC[-6],SEARCH("-5",RC[-6])+2,10),IFERROR(MID(RC[-6],SEARCH("-4",RC[-6])+2,10),IFERROR(MID(RC[-6],SEARCH("-3",RC[-6])+2,10),IFERROR(MID(RC[-6],SEARCH("-2",RC[-6])+2,10),IFERROR(MID(RC[-6],SEARCH("-1",RC[-6])+2,10),IFERROR(MID(RC[-6],SEARCH("-",RC[-6])+1,10),))))))))))) -> 刀锋猎人 | I304: ="1"&VLOOKUP(RC[-1],Sheet1!R2C2:R127C3,2,FALSE) -> 130402 | J304: 130402 | K304: =IFERROR(FIND(13,RC[-4],1),"") -> 13 | L304: =IF(RC[-1]="","",MID(RC[-5],RC[-1],6)) -> 130402 | M304: =SUBSTITUTE(RC[-6],RC[-1],RC[-3],1) -> "我行走于黑夜里"|3#1304024|1
A305: 10225402 | B305: 23-6刀锋猎人 | D305: 1 | E305: 102254|55 | F305: 3|1 | G305: "猎杀于鲜血中"|3#1304024|1 | H305: =IFERROR(MID(RC[-6],SEARCH("-10",RC[-6])+3,10),IFERROR(MID(RC[-6],SEARCH("-9",RC[-6])+2,10),IFERROR(MID(RC[-6],SEARCH("-8",RC[-6])+2,10),IFERROR(MID(RC[-6],SEARCH("-7",RC[-6])+2,10),IFERROR(MID(RC[-6],SEARCH("-6",RC[-6])+2,10),IFERROR(MID(RC[-6],SEARCH("-5",RC[-6])+2,10),IFERROR(MID(RC[-6],SEARCH("-4",RC[-6])+2,10),IFERROR(MID(RC[-6],SEARCH("-3",RC[-6])+2,10),IFERROR(MID(RC[-6],SEARCH("-2",RC[-6])+2,10),IFERROR(MID(RC[-6],SEARCH("-1",RC[-6])+2,10),IFERROR(MID(RC[-6],SEARCH("-",RC[-6])+1,10),))))))))))) -> 刀锋猎人 | I305: ="1"&VLOOKUP(RC[-1],Sheet1!R2C2:R127C3,2,FALSE) -> 130402 | J305: 130402 | K305: =IFERROR(FIND(13,RC[-4],1),"") -> 12 | L305: =IF(RC[-1]="","",MID(RC[-5],RC[-1],6)) -> 130402 | M305: =SUBSTITUTE(RC[-6],RC[-1],RC[-3],1) -> "猎杀于鲜血中"|3#1304024|1
A306: 10225403 | B306: 23-6刀锋猎人 | D306: 1 | E306: 102254|20 | F306: 3|1 | G306: "我将死于战斗，但不该止步于此"|3#1304024|1 | H306: =IFERROR(MID(RC[-6],SEARCH("-10",RC[-6])+3,10),IFERROR(MID(RC[-6],SEARCH("-9",RC[-6])+2,10),IFERROR(MID(RC[-6],SEARCH("-8",RC[-6])+2,10),IFERROR(MID(RC[-6],SEARCH("-7",RC[-6])+2,10),IFERROR(MID(RC[-6],SEARCH("-6",RC[-6])+2,10),IFERROR(MID(RC[-6],SEARCH("-5",RC[-6])+2,10),IFERROR(MID(RC[-6],SEARCH("-4",RC[-6])+2,10),IFERROR(MID(RC[-6],SEARCH("-3",RC[-6])+2,10),IFERROR(MID(RC[-6],SEARCH("-2",RC[-6])+2,10),IFERROR(MID(RC[-6],SEARCH("-1",RC[-6])+2,10),IFERROR(MID(RC[-6],SEARCH("-",RC[-6])+1,10),))))))))))) -> 刀锋猎人 | I306: ="1"&VLOOKUP(RC[-1],Sheet1!R2C2:R127C3,2,FALSE) -> 130402 | J306: 130402 | K306: =IFERROR(FIND(13,RC[-4],1),"") -> 20 | L306: =IF(RC[-1]="","",MID(RC[-5],RC[-1],6)) -> 130402 | M306: =SUBSTITUTE(RC[-6],RC[-1],RC[-3],1) -> "我将死于战斗，但不该止步于此"|3#1304024|1
A307: 10229001 | B307: 23-10战争主宰 | D307: 2 | E307: 15 | F307: 3|1 | G307: "反应炉加热完全——"|3#400044|1 | H307: =IFERROR(MID(RC[-6],SEARCH("-10",RC[-6])+3,10),IFERROR(MID(RC[-6],SEARCH("-9",RC[-6])+2,10),IFERROR(MID(RC[-6],SEARCH("-8",RC[-6])+2,10),IFERROR(MID(RC[-6],SEARCH("-7",RC[-6])+2,10),IFERROR(MID(RC[-6],SEARCH("-6",RC[-6])+2,10),IFERROR(MID(RC[-6],SEARCH("-5",RC[-6])+2,10),IFERROR(MID(RC[-6],SEARCH("-4",RC[-6])+2,10),IFERROR(MID(RC[-6],SEARCH("-3",RC[-6])+2,10),IFERROR(MID(RC[-6],SEARCH("-2",RC[-6])+2,10),IFERROR(MID(RC[-6],SEARCH("-1",RC[-6])+2,10),IFERROR(MID(RC[-6],SEARCH("-",RC[-6])+1,10),))))))))))) -> 战争主宰 | I307: ="1"&VLOOKUP(RC[-1],Sheet1!R2C2:R127C3,2,FALSE) -> 133998 | J307: 133998 | K307: =IFERROR(FIND(13,RC[-4],1),"") ->  | L307: =IF(RC[-1]="","",MID(RC[-5],RC[-1],6)) ->  | M307: =SUBSTITUTE(RC[-6],RC[-1],RC[-3],1) -> "反应炉加热完全——"|3#400044|1
A308: 10229002 | B308: 23-10战争主宰 | D308: 2 | E308: 30 | F308: 3|1 | G308: "弹药填装完毕！"|3#400044|1 | H308: =IFERROR(MID(RC[-6],SEARCH("-10",RC[-6])+3,10),IFERROR(MID(RC[-6],SEARCH("-9",RC[-6])+2,10),IFERROR(MID(RC[-6],SEARCH("-8",RC[-6])+2,10),IFERROR(MID(RC[-6],SEARCH("-7",RC[-6])+2,10),IFERROR(MID(RC[-6],SEARCH("-6",RC[-6])+2,10),IFERROR(MID(RC[-6],SEARCH("-5",RC[-6])+2,10),IFERROR(MID(RC[-6],SEARCH("-4",RC[-6])+2,10),IFERROR(MID(RC[-6],SEARCH("-3",RC[-6])+2,10),IFERROR(MID(RC[-6],SEARCH("-2",RC[-6])+2,10),IFERROR(MID(RC[-6],SEARCH("-1",RC[-6])+2,10),IFERROR(MID(RC[-6],SEARCH("-",RC[-6])+1,10),))))))))))) -> 战争主宰 | I308: ="1"&VLOOKUP(RC[-1],Sheet1!R2C2:R127C3,2,FALSE) -> 133998 | J308: 133998 | K308: =IFERROR(FIND(13,RC[-4],1),"") ->  | L308: =IF(RC[-1]="","",MID(RC[-5],RC[-1],6)) ->  | M308: =SUBSTITUTE(RC[-6],RC[-1],RC[-3],1) -> "弹药填装完毕！"|3#400044|1
A309: 10229003 | B309: 23-10战争主宰 | D309: 2 | E309: 45 | F309: 3|1 | G309: "指引：消灭！"|3#400044|1 | H309: =IFERROR(MID(RC[-6],SEARCH("-10",RC[-6])+3,10),IFERROR(MID(RC[-6],SEARCH("-9",RC[-6])+2,10),IFERROR(MID(RC[-6],SEARCH("-8",RC[-6])+2,10),IFERROR(MID(RC[-6],SEARCH("-7",RC[-6])+2,10),IFERROR(MID(RC[-6],SEARCH("-6",RC[-6])+2,10),IFERROR(MID(RC[-6],SEARCH("-5",RC[-6])+2,10),IFERROR(MID(RC[-6],SEARCH("-4",RC[-6])+2,10),IFERROR(MID(RC[-6],SEARCH("-3",RC[-6])+2,10),IFERROR(MID(RC[-6],SEARCH("-2",RC[-6])+2,10),IFERROR(MID(RC[-6],SEARCH("-1",RC[-6])+2,10),IFERROR(MID(RC[-6],SEARCH("-",RC[-6])+1,10),))))))))))) -> 战争主宰 | I309: ="1"&VLOOKUP(RC[-1],Sheet1!R2C2:R127C3,2,FALSE) -> 133998 | J309: 133998 | K309: =IFERROR(FIND(13,RC[-4],1),"") ->  | L309: =IF(RC[-1]="","",MID(RC[-5],RC[-1],6)) ->  | M309: =SUBSTITUTE(RC[-6],RC[-1],RC[-3],1) -> "指引：消灭！"|3#400044|1
A310: 10229004 | B310: 23-10战争主宰 | D310: 2 | E310: 60 | F310: 3|1 | G310: "弹药填装完毕！"|3#400044|1 | H310: =IFERROR(MID(RC[-6],SEARCH("-10",RC[-6])+3,10),IFERROR(MID(RC[-6],SEARCH("-9",RC[-6])+2,10),IFERROR(MID(RC[-6],SEARCH("-8",RC[-6])+2,10),IFERROR(MID(RC[-6],SEARCH("-7",RC[-6])+2,10),IFERROR(MID(RC[-6],SEARCH("-6",RC[-6])+2,10),IFERROR(MID(RC[-6],SEARCH("-5",RC[-6])+2,10),IFERROR(MID(RC[-6],SEARCH("-4",RC[-6])+2,10),IFERROR(MID(RC[-6],SEARCH("-3",RC[-6])+2,10),IFERROR(MID(RC[-6],SEARCH("-2",RC[-6])+2,10),IFERROR(MID(RC[-6],SEARCH("-1",RC[-6])+2,10),IFERROR(MID(RC[-6],SEARCH("-",RC[-6])+1,10),))))))))))) -> 战争主宰 | I310: ="1"&VLOOKUP(RC[-1],Sheet1!R2C2:R127C3,2,FALSE) -> 133998 | J310: 133998 | K310: =IFERROR(FIND(13,RC[-4],1),"") ->  | L310: =IF(RC[-1]="","",MID(RC[-5],RC[-1],6)) ->  | M310: =SUBSTITUTE(RC[-6],RC[-1],RC[-3],1) -> "弹药填装完毕！"|3#400044|1
A311: 10235401 | B311: 24-6基伦 | D311: 1 | E311: 102354|50 | F311: 3|1 | G311: "坚守自己的正义"|3#1324024|1 | H311: =IFERROR(MID(RC[-6],SEARCH("-10",RC[-6])+3,10),IFERROR(MID(RC[-6],SEARCH("-9",RC[-6])+2,10),IFERROR(MID(RC[-6],SEARCH("-8",RC[-6])+2,10),IFERROR(MID(RC[-6],SEARCH("-7",RC[-6])+2,10),IFERROR(MID(RC[-6],SEARCH("-6",RC[-6])+2,10),IFERROR(MID(RC[-6],SEARCH("-5",RC[-6])+2,10),IFERROR(MID(RC[-6],SEARCH("-4",RC[-6])+2,10),IFERROR(MID(RC[-6],SEARCH("-3",RC[-6])+2,10),IFERROR(MID(RC[-6],SEARCH("-2",RC[-6])+2,10),IFERROR(MID(RC[-6],SEARCH("-1",RC[-6])+2,10),IFERROR(MID(RC[-6],SEARCH("-",RC[-6])+1,10),))))))))))) -> 基伦 | I311: ="1"&VLOOKUP(RC[-1],Sheet1!R2C2:R127C3,2,FALSE) -> 132402 | J311: 132402 | K311: =IFERROR(FIND(13,RC[-4],1),"") -> 13 | L311: =IF(RC[-1]="","",MID(RC[-5],RC[-1],6)) -> 132402 | M311: =SUBSTITUTE(RC[-6],RC[-1],RC[-3],1) -> "坚守自己的正义"|3#1324024|1
A312: 10235402 | B312: 24-6基伦 | D312: 2 | E312: 25 | F312: 3|1 | G312: "时间证明一切"|3#1324024|1 | H312: =IFERROR(MID(RC[-6],SEARCH("-10",RC[-6])+3,10),IFERROR(MID(RC[-6],SEARCH("-9",RC[-6])+2,10),IFERROR(MID(RC[-6],SEARCH("-8",RC[-6])+2,10),IFERROR(MID(RC[-6],SEARCH("-7",RC[-6])+2,10),IFERROR(MID(RC[-6],SEARCH("-6",RC[-6])+2,10),IFERROR(MID(RC[-6],SEARCH("-5",RC[-6])+2,10),IFERROR(MID(RC[-6],SEARCH("-4",RC[-6])+2,10),IFERROR(MID(RC[-6],SEARCH("-3",RC[-6])+2,10),IFERROR(MID(RC[-6],SEARCH("-2",RC[-6])+2,10),IFERROR(MID(RC[-6],SEARCH("-1",RC[-6])+2,10),IFERROR(MID(RC[-6],SEARCH("-",RC[-6])+1,10),))))))))))) -> 基伦 | I312: ="1"&VLOOKUP(RC[-1],Sheet1!R2C2:R127C3,2,FALSE) -> 132402 | J312: 132402 | K312: =IFERROR(FIND(13,RC[-4],1),"") -> 12 | L312: =IF(RC[-1]="","",MID(RC[-5],RC[-1],6)) -> 132402 | M312: =SUBSTITUTE(RC[-6],RC[-1],RC[-3],1) -> "时间证明一切"|3#1324024|1
A313: 10235403 | B313: 24-6基伦 | D313: 4 | F313: 3|1 | G313: "忠于正义，死于本心"|3#1324024|1 | H313: =IFERROR(MID(RC[-6],SEARCH("-10",RC[-6])+3,10),IFERROR(MID(RC[-6],SEARCH("-9",RC[-6])+2,10),IFERROR(MID(RC[-6],SEARCH("-8",RC[-6])+2,10),IFERROR(MID(RC[-6],SEARCH("-7",RC[-6])+2,10),IFERROR(MID(RC[-6],SEARCH("-6",RC[-6])+2,10),IFERROR(MID(RC[-6],SEARCH("-5",RC[-6])+2,10),IFERROR(MID(RC[-6],SEARCH("-4",RC[-6])+2,10),IFERROR(MID(RC[-6],SEARCH("-3",RC[-6])+2,10),IFERROR(MID(RC[-6],SEARCH("-2",RC[-6])+2,10),IFERROR(MID(RC[-6],SEARCH("-1",RC[-6])+2,10),IFERROR(MID(RC[-6],SEARCH("-",RC[-6])+1,10),))))))))))) -> 基伦 | I313: ="1"&VLOOKUP(RC[-1],Sheet1!R2C2:R127C3,2,FALSE) -> 132402 | J313: 132402 | K313: =IFERROR(FIND(13,RC[-4],1),"") -> 15 | L313: =IF(RC[-1]="","",MID(RC[-5],RC[-1],6)) -> 132402 | M313: =SUBSTITUTE(RC[-6],RC[-1],RC[-3],1) -> "忠于正义，死于本心"|3#1324024|1
A314: 10239401 | B314: 24-10雅典娜 | D314: 1 | E314: 102390|80 | F314: 3|1 | G314: "智慧的光芒笼罩世间"|3#1314414|1 | H314: =IFERROR(MID(RC[-6],SEARCH("-10",RC[-6])+3,10),IFERROR(MID(RC[-6],SEARCH("-9",RC[-6])+2,10),IFERROR(MID(RC[-6],SEARCH("-8",RC[-6])+2,10),IFERROR(MID(RC[-6],SEARCH("-7",RC[-6])+2,10),IFERROR(MID(RC[-6],SEARCH("-6",RC[-6])+2,10),IFERROR(MID(RC[-6],SEARCH("-5",RC[-6])+2,10),IFERROR(MID(RC[-6],SEARCH("-4",RC[-6])+2,10),IFERROR(MID(RC[-6],SEARCH("-3",RC[-6])+2,10),IFERROR(MID(RC[-6],SEARCH("-2",RC[-6])+2,10),IFERROR(MID(RC[-6],SEARCH("-1",RC[-6])+2,10),IFERROR(MID(RC[-6],SEARCH("-",RC[-6])+1,10),))))))))))) -> 雅典娜 | I314: ="1"&VLOOKUP(RC[-1],Sheet1!R2C2:R127C3,2,FALSE) -> 131441 | J314: 131441 | K314: =IFERROR(FIND(13,RC[-4],1),"") -> 15 | L314: =IF(RC[-1]="","",MID(RC[-5],RC[-1],6)) -> 131441 | M314: =SUBSTITUTE(RC[-6],RC[-1],RC[-3],1) -> "智慧的光芒笼罩世间"|3#1314414|1
A315: 10239402 | B315: 24-10雅典娜 | D315: 1 | E315: 102390|60 | F315: 3|1 | G315: "勇敢地战斗吧"|3#1314414|1 | H315: =IFERROR(MID(RC[-6],SEARCH("-10",RC[-6])+3,10),IFERROR(MID(RC[-6],SEARCH("-9",RC[-6])+2,10),IFERROR(MID(RC[-6],SEARCH("-8",RC[-6])+2,10),IFERROR(MID(RC[-6],SEARCH("-7",RC[-6])+2,10),IFERROR(MID(RC[-6],SEARCH("-6",RC[-6])+2,10),IFERROR(MID(RC[-6],SEARCH("-5",RC[-6])+2,10),IFERROR(MID(RC[-6],SEARCH("-4",RC[-6])+2,10),IFERROR(MID(RC[-6],SEARCH("-3",RC[-6])+2,10),IFERROR(MID(RC[-6],SEARCH("-2",RC[-6])+2,10),IFERROR(MID(RC[-6],SEARCH("-1",RC[-6])+2,10),IFERROR(MID(RC[-6],SEARCH("-",RC[-6])+1,10),))))))))))) -> 雅典娜 | I315: ="1"&VLOOKUP(RC[-1],Sheet1!R2C2:R127C3,2,FALSE) -> 131441 | J315: 131441 | K315: =IFERROR(FIND(13,RC[-4],1),"") -> 12 | L315: =IF(RC[-1]="","",MID(RC[-5],RC[-1],6)) -> 131441 | M315: =SUBSTITUTE(RC[-6],RC[-1],RC[-3],1) -> "勇敢地战斗吧"|3#1314414|1
A316: 10239403 | B316: 24-10雅典娜 | D316: 1 | E316: 102390|40 | F316: 3|1 | G316: "坚持住！"|3#1314414|1 | H316: =IFERROR(MID(RC[-6],SEARCH("-10",RC[-6])+3,10),IFERROR(MID(RC[-6],SEARCH("-9",RC[-6])+2,10),IFERROR(MID(RC[-6],SEARCH("-8",RC[-6])+2,10),IFERROR(MID(RC[-6],SEARCH("-7",RC[-6])+2,10),IFERROR(MID(RC[-6],SEARCH("-6",RC[-6])+2,10),IFERROR(MID(RC[-6],SEARCH("-5",RC[-6])+2,10),IFERROR(MID(RC[-6],SEARCH("-4",RC[-6])+2,10),IFERROR(MID(RC[-6],SEARCH("-3",RC[-6])+2,10),IFERROR(MID(RC[-6],SEARCH("-2",RC[-6])+2,10),IFERROR(MID(RC[-6],SEARCH("-1",RC[-6])+2,10),IFERROR(MID(RC[-6],SEARCH("-",RC[-6])+1,10),))))))))))) -> 雅典娜 | I316: ="1"&VLOOKUP(RC[-1],Sheet1!R2C2:R127C3,2,FALSE) -> 131441 | J316: 131441 | K316: =IFERROR(FIND(13,RC[-4],1),"") -> 10 | L316: =IF(RC[-1]="","",MID(RC[-5],RC[-1],6)) -> 131441 | M316: =SUBSTITUTE(RC[-6],RC[-1],RC[-3],1) -> "坚持住！"|3#1314414|1
A317: 10239404 | B317: 24-10雅典娜 | D317: 1 | E317: 102390|20 | F317: 3|1 | G317: "你不该倒下！"|3#1314414|1 | H317: =IFERROR(MID(RC[-6],SEARCH("-10",RC[-6])+3,10),IFERROR(MID(RC[-6],SEARCH("-9",RC[-6])+2,10),IFERROR(MID(RC[-6],SEARCH("-8",RC[-6])+2,10),IFERROR(MID(RC[-6],SEARCH("-7",RC[-6])+2,10),IFERROR(MID(RC[-6],SEARCH("-6",RC[-6])+2,10),IFERROR(MID(RC[-6],SEARCH("-5",RC[-6])+2,10),IFERROR(MID(RC[-6],SEARCH("-4",RC[-6])+2,10),IFERROR(MID(RC[-6],SEARCH("-3",RC[-6])+2,10),IFERROR(MID(RC[-6],SEARCH("-2",RC[-6])+2,10),IFERROR(MID(RC[-6],SEARCH("-1",RC[-6])+2,10),IFERROR(MID(RC[-6],SEARCH("-",RC[-6])+1,10),))))))))))) -> 雅典娜 | I317: ="1"&VLOOKUP(RC[-1],Sheet1!R2C2:R127C3,2,FALSE) -> 131441 | J317: 131441 | K317: =IFERROR(FIND(13,RC[-4],1),"") -> 12 | L317: =IF(RC[-1]="","",MID(RC[-5],RC[-1],6)) -> 131441 | M317: =SUBSTITUTE(RC[-6],RC[-1],RC[-3],1) -> "你不该倒下！"|3#1314414|1
A318: 10242401 | B318: 25-3石头人 | D318: 1 | E318: 102424|90 | F318: 3|1 | G318: "大地之花，绽放吧"|3#1323114|1 | H318: =IFERROR(MID(RC[-6],SEARCH("-10",RC[-6])+3,10),IFERROR(MID(RC[-6],SEARCH("-9",RC[-6])+2,10),IFERROR(MID(RC[-6],SEARCH("-8",RC[-6])+2,10),IFERROR(MID(RC[-6],SEARCH("-7",RC[-6])+2,10),IFERROR(MID(RC[-6],SEARCH("-6",RC[-6])+2,10),IFERROR(MID(RC[-6],SEARCH("-5",RC[-6])+2,10),IFERROR(MID(RC[-6],SEARCH("-4",RC[-6])+2,10),IFERROR(MID(RC[-6],SEARCH("-3",RC[-6])+2,10),IFERROR(MID(RC[-6],SEARCH("-2",RC[-6])+2,10),IFERROR(MID(RC[-6],SEARCH("-1",RC[-6])+2,10),IFERROR(MID(RC[-6],SEARCH("-",RC[-6])+1,10),))))))))))) -> 石头人 | I318: ="1"&VLOOKUP(RC[-1],Sheet1!R2C2:R127C3,2,FALSE) -> 132311 | J318: 132311 | K318: =IFERROR(FIND(13,RC[-4],1),"") -> 14 | L318: =IF(RC[-1]="","",MID(RC[-5],RC[-1],6)) -> 132311 | M318: =SUBSTITUTE(RC[-6],RC[-1],RC[-3],1) -> "大地之花，绽放吧"|3#1323114|1
A319: 10242402 | B319: 25-3石头人 | D319: 1 | E319: 102424|50 | F319: 3|1 | G319: "粉碎吧！"|3#1323114|1 | H319: =IFERROR(MID(RC[-6],SEARCH("-10",RC[-6])+3,10),IFERROR(MID(RC[-6],SEARCH("-9",RC[-6])+2,10),IFERROR(MID(RC[-6],SEARCH("-8",RC[-6])+2,10),IFERROR(MID(RC[-6],SEARCH("-7",RC[-6])+2,10),IFERROR(MID(RC[-6],SEARCH("-6",RC[-6])+2,10),IFERROR(MID(RC[-6],SEARCH("-5",RC[-6])+2,10),IFERROR(MID(RC[-6],SEARCH("-4",RC[-6])+2,10),IFERROR(MID(RC[-6],SEARCH("-3",RC[-6])+2,10),IFERROR(MID(RC[-6],SEARCH("-2",RC[-6])+2,10),IFERROR(MID(RC[-6],SEARCH("-1",RC[-6])+2,10),IFERROR(MID(RC[-6],SEARCH("-",RC[-6])+1,10),))))))))))) -> 石头人 | I319: ="1"&VLOOKUP(RC[-1],Sheet1!R2C2:R127C3,2,FALSE) -> 132311 | J319: 132311 | K319: =IFERROR(FIND(13,RC[-4],1),"") -> 10 | L319: =IF(RC[-1]="","",MID(RC[-5],RC[-1],6)) -> 132311 | M319: =SUBSTITUTE(RC[-6],RC[-1],RC[-3],1) -> "粉碎吧！"|3#1323114|1
A320: 10242403 | B320: 25-3石头人 | D320: 1 | E320: 102424|10 | F320: 3|1 | G320: "回归大地……"|3#1323114|1 | H320: =IFERROR(MID(RC[-6],SEARCH("-10",RC[-6])+3,10),IFERROR(MID(RC[-6],SEARCH("-9",RC[-6])+2,10),IFERROR(MID(RC[-6],SEARCH("-8",RC[-6])+2,10),IFERROR(MID(RC[-6],SEARCH("-7",RC[-6])+2,10),IFERROR(MID(RC[-6],SEARCH("-6",RC[-6])+2,10),IFERROR(MID(RC[-6],SEARCH("-5",RC[-6])+2,10),IFERROR(MID(RC[-6],SEARCH("-4",RC[-6])+2,10),IFERROR(MID(RC[-6],SEARCH("-3",RC[-6])+2,10),IFERROR(MID(RC[-6],SEARCH("-2",RC[-6])+2,10),IFERROR(MID(RC[-6],SEARCH("-1",RC[-6])+2,10),IFERROR(MID(RC[-6],SEARCH("-",RC[-6])+1,10),))))))))))) -> 石头人 | I320: ="1"&VLOOKUP(RC[-1],Sheet1!R2C2:R127C3,2,FALSE) -> 132311 | J320: 132311 | K320: =IFERROR(FIND(13,RC[-4],1),"") -> 12 | L320: =IF(RC[-1]="","",MID(RC[-5],RC[-1],6)) -> 132311 | M320: =SUBSTITUTE(RC[-6],RC[-1],RC[-3],1) -> "回归大地……"|3#1323114|1
A321: 10249301 | B321: 25-10大检察官 | D321: 1 | E321: 102494|70 | F321: 3|1 | G321: "你们要为此付出代价！"|3#1324404|1 | H321: =IFERROR(MID(RC[-6],SEARCH("-10",RC[-6])+3,10),IFERROR(MID(RC[-6],SEARCH("-9",RC[-6])+2,10),IFERROR(MID(RC[-6],SEARCH("-8",RC[-6])+2,10),IFERROR(MID(RC[-6],SEARCH("-7",RC[-6])+2,10),IFERROR(MID(RC[-6],SEARCH("-6",RC[-6])+2,10),IFERROR(MID(RC[-6],SEARCH("-5",RC[-6])+2,10),IFERROR(MID(RC[-6],SEARCH("-4",RC[-6])+2,10),IFERROR(MID(RC[-6],SEARCH("-3",RC[-6])+2,10),IFERROR(MID(RC[-6],SEARCH("-2",RC[-6])+2,10),IFERROR(MID(RC[-6],SEARCH("-1",RC[-6])+2,10),IFERROR(MID(RC[-6],SEARCH("-",RC[-6])+1,10),))))))))))) -> 大检察官 | I321: ="1"&VLOOKUP(RC[-1],Sheet1!R2C2:R127C3,2,FALSE) -> 132440 | J321: 132440 | K321: =IFERROR(FIND(13,RC[-4],1),"") -> 16 | L321: =IF(RC[-1]="","",MID(RC[-5],RC[-1],6)) -> 132440 | M321: =SUBSTITUTE(RC[-6],RC[-1],RC[-3],1) -> "你们要为此付出代价！"|3#1324404|1
A322: 10249302 | B322: 25-10大检察官 | D322: 1 | E322: 102494|30 | F322: 3|1 | G322: "不能倒下！"|3#1324404|1 | H322: =IFERROR(MID(RC[-6],SEARCH("-10",RC[-6])+3,10),IFERROR(MID(RC[-6],SEARCH("-9",RC[-6])+2,10),IFERROR(MID(RC[-6],SEARCH("-8",RC[-6])+2,10),IFERROR(MID(RC[-6],SEARCH("-7",RC[-6])+2,10),IFERROR(MID(RC[-6],SEARCH("-6",RC[-6])+2,10),IFERROR(MID(RC[-6],SEARCH("-5",RC[-6])+2,10),IFERROR(MID(RC[-6],SEARCH("-4",RC[-6])+2,10),IFERROR(MID(RC[-6],SEARCH("-3",RC[-6])+2,10),IFERROR(MID(RC[-6],SEARCH("-2",RC[-6])+2,10),IFERROR(MID(RC[-6],SEARCH("-1",RC[-6])+2,10),IFERROR(MID(RC[-6],SEARCH("-",RC[-6])+1,10),))))))))))) -> 大检察官 | I322: ="1"&VLOOKUP(RC[-1],Sheet1!R2C2:R127C3,2,FALSE) -> 132440 | J322: 132440 | K322: =IFERROR(FIND(13,RC[-4],1),"") -> 11 | L322: =IF(RC[-1]="","",MID(RC[-5],RC[-1],6)) -> 132440 | M322: =SUBSTITUTE(RC[-6],RC[-1],RC[-3],1) -> "不能倒下！"|3#1324404|1
A323: 10249401 | B323: 25-10血色指挥官 | D323: 1 | E323: 102494|50 | F323: 3|1 | G323: "鲜血的献祭！"|3#1324085|1 | H323: =IFERROR(MID(RC[-6],SEARCH("-10",RC[-6])+3,10),IFERROR(MID(RC[-6],SEARCH("-9",RC[-6])+2,10),IFERROR(MID(RC[-6],SEARCH("-8",RC[-6])+2,10),IFERROR(MID(RC[-6],SEARCH("-7",RC[-6])+2,10),IFERROR(MID(RC[-6],SEARCH("-6",RC[-6])+2,10),IFERROR(MID(RC[-6],SEARCH("-5",RC[-6])+2,10),IFERROR(MID(RC[-6],SEARCH("-4",RC[-6])+2,10),IFERROR(MID(RC[-6],SEARCH("-3",RC[-6])+2,10),IFERROR(MID(RC[-6],SEARCH("-2",RC[-6])+2,10),IFERROR(MID(RC[-6],SEARCH("-1",RC[-6])+2,10),IFERROR(MID(RC[-6],SEARCH("-",RC[-6])+1,10),))))))))))) -> 血色指挥官 | I323: ="1"&VLOOKUP(RC[-1],Sheet1!R2C2:R127C3,2,FALSE) -> 132408 | J323: 132408 | K323: =IFERROR(FIND(13,RC[-4],1),"") -> 12 | L323: =IF(RC[-1]="","",MID(RC[-5],RC[-1],6)) -> 132408 | M323: =SUBSTITUTE(RC[-6],RC[-1],RC[-3],1) -> "鲜血的献祭！"|3#1324085|1
A324: 10255401 | B324: 26-6小黑 | D324: 4 | F324: 3|1 | G324: "黑暗因死亡而降临"|3#400033|1 | H324: =IFERROR(MID(RC[-6],SEARCH("-10",RC[-6])+3,10),IFERROR(MID(RC[-6],SEARCH("-9",RC[-6])+2,10),IFERROR(MID(RC[-6],SEARCH("-8",RC[-6])+2,10),IFERROR(MID(RC[-6],SEARCH("-7",RC[-6])+2,10),IFERROR(MID(RC[-6],SEARCH("-6",RC[-6])+2,10),IFERROR(MID(RC[-6],SEARCH("-5",RC[-6])+2,10),IFERROR(MID(RC[-6],SEARCH("-4",RC[-6])+2,10),IFERROR(MID(RC[-6],SEARCH("-3",RC[-6])+2,10),IFERROR(MID(RC[-6],SEARCH("-2",RC[-6])+2,10),IFERROR(MID(RC[-6],SEARCH("-1",RC[-6])+2,10),IFERROR(MID(RC[-6],SEARCH("-",RC[-6])+1,10),))))))))))) -> 小黑 | I324: ="1"&VLOOKUP(RC[-1],Sheet1!R2C2:R127C3,2,FALSE) -> 132428 | J324: 132428 | K324: =IFERROR(FIND(13,RC[-4],1),"") ->  | L324: =IF(RC[-1]="","",MID(RC[-5],RC[-1],6)) ->  | M324: =SUBSTITUTE(RC[-6],RC[-1],RC[-3],1) -> "黑暗因死亡而降临"|3#400033|1
A325: 10255402 | B325: 26-6小黑 | D325: 1 | E325: 102554|50 | F325: 3|1 | G325: "我正盯着你呢"|3#400033|1 | H325: =IFERROR(MID(RC[-6],SEARCH("-10",RC[-6])+3,10),IFERROR(MID(RC[-6],SEARCH("-9",RC[-6])+2,10),IFERROR(MID(RC[-6],SEARCH("-8",RC[-6])+2,10),IFERROR(MID(RC[-6],SEARCH("-7",RC[-6])+2,10),IFERROR(MID(RC[-6],SEARCH("-6",RC[-6])+2,10),IFERROR(MID(RC[-6],SEARCH("-5",RC[-6])+2,10),IFERROR(MID(RC[-6],SEARCH("-4",RC[-6])+2,10),IFERROR(MID(RC[-6],SEARCH("-3",RC[-6])+2,10),IFERROR(MID(RC[-6],SEARCH("-2",RC[-6])+2,10),IFERROR(MID(RC[-6],SEARCH("-1",RC[-6])+2,10),IFERROR(MID(RC[-6],SEARCH("-",RC[-6])+1,10),))))))))))) -> 小黑 | I325: ="1"&VLOOKUP(RC[-1],Sheet1!R2C2:R127C3,2,FALSE) -> 132428 | J325: 132428 | K325: =IFERROR(FIND(13,RC[-4],1),"") ->  | L325: =IF(RC[-1]="","",MID(RC[-5],RC[-1],6)) ->  | M325: =SUBSTITUTE(RC[-6],RC[-1],RC[-3],1) -> "我正盯着你呢"|3#400033|1
A326: 10255403 | B326: 26-6小黑 | D326: 2 | E326: 15 | F326: 3|1 | G326: "死亡的时候到了……"|3#400033|1 | H326: =IFERROR(MID(RC[-6],SEARCH("-10",RC[-6])+3,10),IFERROR(MID(RC[-6],SEARCH("-9",RC[-6])+2,10),IFERROR(MID(RC[-6],SEARCH("-8",RC[-6])+2,10),IFERROR(MID(RC[-6],SEARCH("-7",RC[-6])+2,10),IFERROR(MID(RC[-6],SEARCH("-6",RC[-6])+2,10),IFERROR(MID(RC[-6],SEARCH("-5",RC[-6])+2,10),IFERROR(MID(RC[-6],SEARCH("-4",RC[-6])+2,10),IFERROR(MID(RC[-6],SEARCH("-3",RC[-6])+2,10),IFERROR(MID(RC[-6],SEARCH("-2",RC[-6])+2,10),IFERROR(MID(RC[-6],SEARCH("-1",RC[-6])+2,10),IFERROR(MID(RC[-6],SEARCH("-",RC[-6])+1,10),))))))))))) -> 小黑 | I326: ="1"&VLOOKUP(RC[-1],Sheet1!R2C2:R127C3,2,FALSE) -> 132428 | J326: 132428 | K326: =IFERROR(FIND(13,RC[-4],1),"") ->  | L326: =IF(RC[-1]="","",MID(RC[-5],RC[-1],6)) ->  | M326: =SUBSTITUTE(RC[-6],RC[-1],RC[-3],1) -> "死亡的时候到了……"|3#400033|1
A327: 10259501 | B327: 26-10火女 | D327: 1 | E327: 102596|70 | F327: 3|1 | G327: "退后！"|3#400034|1 | H327: =IFERROR(MID(RC[-6],SEARCH("-10",RC[-6])+3,10),IFERROR(MID(RC[-6],SEARCH("-9",RC[-6])+2,10),IFERROR(MID(RC[-6],SEARCH("-8",RC[-6])+2,10),IFERROR(MID(RC[-6],SEARCH("-7",RC[-6])+2,10),IFERROR(MID(RC[-6],SEARCH("-6",RC[-6])+2,10),IFERROR(MID(RC[-6],SEARCH("-5",RC[-6])+2,10),IFERROR(MID(RC[-6],SEARCH("-4",RC[-6])+2,10),IFERROR(MID(RC[-6],SEARCH("-3",RC[-6])+2,10),IFERROR(MID(RC[-6],SEARCH("-2",RC[-6])+2,10),IFERROR(MID(RC[-6],SEARCH("-1",RC[-6])+2,10),IFERROR(MID(RC[-6],SEARCH("-",RC[-6])+1,10),))))))))))) -> 火女 | I327: ="1"&VLOOKUP(RC[-1],Sheet1!R2C2:R127C3,2,FALSE) -> 132430 | J327: 132430 | K327: =IFERROR(FIND(13,RC[-4],1),"") ->  | L327: =IF(RC[-1]="","",MID(RC[-5],RC[-1],6)) ->  | M327: =SUBSTITUTE(RC[-6],RC[-1],RC[-3],1) -> "退后！"|3#400034|1
A328: 10259502 | B328: 26-10火女 | D328: 1 | E328: 102596|30 | F328: 3|1 | G328: "给我滚开！"|3#400034|1 | H328: =IFERROR(MID(RC[-6],SEARCH("-10",RC[-6])+3,10),IFERROR(MID(RC[-6],SEARCH("-9",RC[-6])+2,10),IFERROR(MID(RC[-6],SEARCH("-8",RC[-6])+2,10),IFERROR(MID(RC[-6],SEARCH("-7",RC[-6])+2,10),IFERROR(MID(RC[-6],SEARCH("-6",RC[-6])+2,10),IFERROR(MID(RC[-6],SEARCH("-5",RC[-6])+2,10),IFERROR(MID(RC[-6],SEARCH("-4",RC[-6])+2,10),IFERROR(MID(RC[-6],SEARCH("-3",RC[-6])+2,10),IFERROR(MID(RC[-6],SEARCH("-2",RC[-6])+2,10),IFERROR(MID(RC[-6],SEARCH("-1",RC[-6])+2,10),IFERROR(MID(RC[-6],SEARCH("-",RC[-6])+1,10),))))))))))) -> 火女 | I328: ="1"&VLOOKUP(RC[-1],Sheet1!R2C2:R127C3,2,FALSE) -> 132430 | J328: 132430 | K328: =IFERROR(FIND(13,RC[-4],1),"") ->  | L328: =IF(RC[-1]="","",MID(RC[-5],RC[-1],6)) ->  | M328: =SUBSTITUTE(RC[-6],RC[-1],RC[-3],1) -> "给我滚开！"|3#400034|1
A329: 10259503 | B329: 26-10火女 | D329: 4 | F329: 3|1 | G329: "无法饶恕……"|3#400034|1 | H329: =IFERROR(MID(RC[-6],SEARCH("-10",RC[-6])+3,10),IFERROR(MID(RC[-6],SEARCH("-9",RC[-6])+2,10),IFERROR(MID(RC[-6],SEARCH("-8",RC[-6])+2,10),IFERROR(MID(RC[-6],SEARCH("-7",RC[-6])+2,10),IFERROR(MID(RC[-6],SEARCH("-6",RC[-6])+2,10),IFERROR(MID(RC[-6],SEARCH("-5",RC[-6])+2,10),IFERROR(MID(RC[-6],SEARCH("-4",RC[-6])+2,10),IFERROR(MID(RC[-6],SEARCH("-3",RC[-6])+2,10),IFERROR(MID(RC[-6],SEARCH("-2",RC[-6])+2,10),IFERROR(MID(RC[-6],SEARCH("-1",RC[-6])+2,10),IFERROR(MID(RC[-6],SEARCH("-",RC[-6])+1,10),))))))))))) -> 火女 | I329: ="1"&VLOOKUP(RC[-1],Sheet1!R2C2:R127C3,2,FALSE) -> 132430 | J329: 132430 | K329: =IFERROR(FIND(13,RC[-4],1),"") ->  | L329: =IF(RC[-1]="","",MID(RC[-5],RC[-1],6)) ->  | M329: =SUBSTITUTE(RC[-6],RC[-1],RC[-3],1) -> "无法饶恕……"|3#400034|1
A330: 10265401 | B330: 27-6亚马逊女王 | C330: 0 | D330: 5 | E330: 100 | F330: 3|1 | G330: "我看到你们了……"|3#400035|0 | H330: =IFERROR(MID(RC[-6],SEARCH("-10",RC[-6])+3,10),IFERROR(MID(RC[-6],SEARCH("-9",RC[-6])+2,10),IFERROR(MID(RC[-6],SEARCH("-8",RC[-6])+2,10),IFERROR(MID(RC[-6],SEARCH("-7",RC[-6])+2,10),IFERROR(MID(RC[-6],SEARCH("-6",RC[-6])+2,10),IFERROR(MID(RC[-6],SEARCH("-5",RC[-6])+2,10),IFERROR(MID(RC[-6],SEARCH("-4",RC[-6])+2,10),IFERROR(MID(RC[-6],SEARCH("-3",RC[-6])+2,10),IFERROR(MID(RC[-6],SEARCH("-2",RC[-6])+2,10),IFERROR(MID(RC[-6],SEARCH("-1",RC[-6])+2,10),IFERROR(MID(RC[-6],SEARCH("-",RC[-6])+1,10),))))))))))) -> 亚马逊女王 | I330: ="1"&VLOOKUP(RC[-1],Sheet1!R2C2:R127C3,2,FALSE) -> 131420 | J330: 131420 | K330: =IFERROR(FIND(13,RC[-4],1),"") ->  | L330: =IF(RC[-1]="","",MID(RC[-5],RC[-1],6)) ->  | M330: =SUBSTITUTE(RC[-6],RC[-1],RC[-3],1) -> "我看到你们了……"|3#400035|0
A331: 10269501 | B331: 27-10树人 | D331: 1 | E331: 102695|40 | F331: 3|1 | G331: "死亡……如此美妙……"|3#400036|1 | H331: =IFERROR(MID(RC[-6],SEARCH("-10",RC[-6])+3,10),IFERROR(MID(RC[-6],SEARCH("-9",RC[-6])+2,10),IFERROR(MID(RC[-6],SEARCH("-8",RC[-6])+2,10),IFERROR(MID(RC[-6],SEARCH("-7",RC[-6])+2,10),IFERROR(MID(RC[-6],SEARCH("-6",RC[-6])+2,10),IFERROR(MID(RC[-6],SEARCH("-5",RC[-6])+2,10),IFERROR(MID(RC[-6],SEARCH("-4",RC[-6])+2,10),IFERROR(MID(RC[-6],SEARCH("-3",RC[-6])+2,10),IFERROR(MID(RC[-6],SEARCH("-2",RC[-6])+2,10),IFERROR(MID(RC[-6],SEARCH("-1",RC[-6])+2,10),IFERROR(MID(RC[-6],SEARCH("-",RC[-6])+1,10),))))))))))) -> 树人 | I331: ="1"&VLOOKUP(RC[-1],Sheet1!R2C2:R127C3,2,FALSE) -> 130411 | J331: 130411 | K331: =IFERROR(FIND(13,RC[-4],1),"") ->  | L331: =IF(RC[-1]="","",MID(RC[-5],RC[-1],6)) ->  | M331: =SUBSTITUTE(RC[-6],RC[-1],RC[-3],1) -> "死亡……如此美妙……"|3#400036|1
A332: 10269502 | B332: 27-10树人 | C332: 0 | D332: 5 | E332: 100 | F332: 1 | G332: 1304114|0 | H332: =IFERROR(MID(RC[-6],SEARCH("-10",RC[-6])+3,10),IFERROR(MID(RC[-6],SEARCH("-9",RC[-6])+2,10),IFERROR(MID(RC[-6],SEARCH("-8",RC[-6])+2,10),IFERROR(MID(RC[-6],SEARCH("-7",RC[-6])+2,10),IFERROR(MID(RC[-6],SEARCH("-6",RC[-6])+2,10),IFERROR(MID(RC[-6],SEARCH("-5",RC[-6])+2,10),IFERROR(MID(RC[-6],SEARCH("-4",RC[-6])+2,10),IFERROR(MID(RC[-6],SEARCH("-3",RC[-6])+2,10),IFERROR(MID(RC[-6],SEARCH("-2",RC[-6])+2,10),IFERROR(MID(RC[-6],SEARCH("-1",RC[-6])+2,10),IFERROR(MID(RC[-6],SEARCH("-",RC[-6])+1,10),))))))))))) -> 树人 | I332: ="1"&VLOOKUP(RC[-1],Sheet1!R2C2:R127C3,2,FALSE) -> 130411 | J332: 130411 | K332: =IFERROR(FIND(13,RC[-4],1),"") -> 1 | L332: =IF(RC[-1]="","",MID(RC[-5],RC[-1],6)) -> 130411 | M332: =SUBSTITUTE(RC[-6],RC[-1],RC[-3],1) -> 1304114|0
A333: 10275401 | B333: 28-6死亡武士 | C333: 2 | D333: 6 | F333: 3|1 | G333: "死亡重复着死亡，而你也是这样"|3#1303024|1 | H333: =IFERROR(MID(RC[-6],SEARCH("-10",RC[-6])+3,10),IFERROR(MID(RC[-6],SEARCH("-9",RC[-6])+2,10),IFERROR(MID(RC[-6],SEARCH("-8",RC[-6])+2,10),IFERROR(MID(RC[-6],SEARCH("-7",RC[-6])+2,10),IFERROR(MID(RC[-6],SEARCH("-6",RC[-6])+2,10),IFERROR(MID(RC[-6],SEARCH("-5",RC[-6])+2,10),IFERROR(MID(RC[-6],SEARCH("-4",RC[-6])+2,10),IFERROR(MID(RC[-6],SEARCH("-3",RC[-6])+2,10),IFERROR(MID(RC[-6],SEARCH("-2",RC[-6])+2,10),IFERROR(MID(RC[-6],SEARCH("-1",RC[-6])+2,10),IFERROR(MID(RC[-6],SEARCH("-",RC[-6])+1,10),))))))))))) -> 死亡武士 | I333: ="1"&VLOOKUP(RC[-1],Sheet1!R2C2:R127C3,2,FALSE) -> 130302 | J333: 130302 | K333: =IFERROR(FIND(13,RC[-4],1),"") -> 20 | L333: =IF(RC[-1]="","",MID(RC[-5],RC[-1],6)) -> 130302 | M333: =SUBSTITUTE(RC[-6],RC[-1],RC[-3],1) -> "死亡重复着死亡，而你也是这样"|3#1303024|1
A334: 10275402 | B334: 28-6死亡武士 | D334: 1 | E334: 102754|20 | F334: 3|1 | G334: "死亡重复着死亡，而你也是这样"|3#1303024|1 | H334: =IFERROR(MID(RC[-6],SEARCH("-10",RC[-6])+3,10),IFERROR(MID(RC[-6],SEARCH("-9",RC[-6])+2,10),IFERROR(MID(RC[-6],SEARCH("-8",RC[-6])+2,10),IFERROR(MID(RC[-6],SEARCH("-7",RC[-6])+2,10),IFERROR(MID(RC[-6],SEARCH("-6",RC[-6])+2,10),IFERROR(MID(RC[-6],SEARCH("-5",RC[-6])+2,10),IFERROR(MID(RC[-6],SEARCH("-4",RC[-6])+2,10),IFERROR(MID(RC[-6],SEARCH("-3",RC[-6])+2,10),IFERROR(MID(RC[-6],SEARCH("-2",RC[-6])+2,10),IFERROR(MID(RC[-6],SEARCH("-1",RC[-6])+2,10),IFERROR(MID(RC[-6],SEARCH("-",RC[-6])+1,10),))))))))))) -> 死亡武士 | I334: ="1"&VLOOKUP(RC[-1],Sheet1!R2C2:R127C3,2,FALSE) -> 130302 | J334: 130302 | K334: =IFERROR(FIND(13,RC[-4],1),"") -> 20 | L334: =IF(RC[-1]="","",MID(RC[-5],RC[-1],6)) -> 130302 | M334: =SUBSTITUTE(RC[-6],RC[-1],RC[-3],1) -> "死亡重复着死亡，而你也是这样"|3#1303024|1
A335: 10279501 | B335: 28-10冥王哈迪斯 | D335: 2 | E335: 10 | F335: 3|4|3|4|1 | G335: "愚蠢的凡人，就凭你们，也想对付我？"|2.5#3#"我可是……黑暗的源头！"|3#1#400037|1 | H335: =IFERROR(MID(RC[-6],SEARCH("-10",RC[-6])+3,10),IFERROR(MID(RC[-6],SEARCH("-9",RC[-6])+2,10),IFERROR(MID(RC[-6],SEARCH("-8",RC[-6])+2,10),IFERROR(MID(RC[-6],SEARCH("-7",RC[-6])+2,10),IFERROR(MID(RC[-6],SEARCH("-6",RC[-6])+2,10),IFERROR(MID(RC[-6],SEARCH("-5",RC[-6])+2,10),IFERROR(MID(RC[-6],SEARCH("-4",RC[-6])+2,10),IFERROR(MID(RC[-6],SEARCH("-3",RC[-6])+2,10),IFERROR(MID(RC[-6],SEARCH("-2",RC[-6])+2,10),IFERROR(MID(RC[-6],SEARCH("-1",RC[-6])+2,10),IFERROR(MID(RC[-6],SEARCH("-",RC[-6])+1,10),))))))))))) -> 冥王哈迪斯 | I335: ="1"&VLOOKUP(RC[-1],Sheet1!R2C2:R127C3,2,FALSE) -> 131439 | J335: 131439 | K335: =IFERROR(FIND(13,RC[-4],1),"") ->  | L335: =IF(RC[-1]="","",MID(RC[-5],RC[-1],6)) ->  | M335: =SUBSTITUTE(RC[-6],RC[-1],RC[-3],1) -> "愚蠢的凡人，就凭你们，也想对付我？"|2.5#3#"我可是……黑暗的源头！"|3#1#400037|1
A336: 10279502 | B336: 28-10冥王哈迪斯 | C336: 0 | D336: 5 | E336: 100 | F336: 1 | G336: 1314394|0 | H336: =IFERROR(MID(RC[-6],SEARCH("-10",RC[-6])+3,10),IFERROR(MID(RC[-6],SEARCH("-9",RC[-6])+2,10),IFERROR(MID(RC[-6],SEARCH("-8",RC[-6])+2,10),IFERROR(MID(RC[-6],SEARCH("-7",RC[-6])+2,10),IFERROR(MID(RC[-6],SEARCH("-6",RC[-6])+2,10),IFERROR(MID(RC[-6],SEARCH("-5",RC[-6])+2,10),IFERROR(MID(RC[-6],SEARCH("-4",RC[-6])+2,10),IFERROR(MID(RC[-6],SEARCH("-3",RC[-6])+2,10),IFERROR(MID(RC[-6],SEARCH("-2",RC[-6])+2,10),IFERROR(MID(RC[-6],SEARCH("-1",RC[-6])+2,10),IFERROR(MID(RC[-6],SEARCH("-",RC[-6])+1,10),))))))))))) -> 冥王哈迪斯 | I336: ="1"&VLOOKUP(RC[-1],Sheet1!R2C2:R127C3,2,FALSE) -> 131439 | J336: 131439 | K336: =IFERROR(FIND(13,RC[-4],1),"") -> 1 | L336: =IF(RC[-1]="","",MID(RC[-5],RC[-1],6)) -> 131439 | M336: =SUBSTITUTE(RC[-6],RC[-1],RC[-3],1) -> 1314394|0
A337: 10285301 | B337: 29-6超级队长 | D337: 2 | E337: 4.5 | F337: 2 | G337: 102853|400038|2 | H337: =IFERROR(MID(RC[-6],SEARCH("-10",RC[-6])+3,10),IFERROR(MID(RC[-6],SEARCH("-9",RC[-6])+2,10),IFERROR(MID(RC[-6],SEARCH("-8",RC[-6])+2,10),IFERROR(MID(RC[-6],SEARCH("-7",RC[-6])+2,10),IFERROR(MID(RC[-6],SEARCH("-6",RC[-6])+2,10),IFERROR(MID(RC[-6],SEARCH("-5",RC[-6])+2,10),IFERROR(MID(RC[-6],SEARCH("-4",RC[-6])+2,10),IFERROR(MID(RC[-6],SEARCH("-3",RC[-6])+2,10),IFERROR(MID(RC[-6],SEARCH("-2",RC[-6])+2,10),IFERROR(MID(RC[-6],SEARCH("-1",RC[-6])+2,10),IFERROR(MID(RC[-6],SEARCH("-",RC[-6])+1,10),))))))))))) -> 超级队长 | I337: ="1"&VLOOKUP(RC[-1],Sheet1!R2C2:R127C3,2,FALSE) -> 130301 | J337: 130301 | K337: =IFERROR(FIND(13,RC[-4],1),"") ->  | L337: =IF(RC[-1]="","",MID(RC[-5],RC[-1],6)) ->  | M337: =SUBSTITUTE(RC[-6],RC[-1],RC[-3],1) -> 102853|400038|2
A338: 10285302 | B338: 29-6超级队长 | D338: 1 | E338: 102853|80 | F338: 1 | G338: 1303014|1 | H338: =IFERROR(MID(RC[-6],SEARCH("-10",RC[-6])+3,10),IFERROR(MID(RC[-6],SEARCH("-9",RC[-6])+2,10),IFERROR(MID(RC[-6],SEARCH("-8",RC[-6])+2,10),IFERROR(MID(RC[-6],SEARCH("-7",RC[-6])+2,10),IFERROR(MID(RC[-6],SEARCH("-6",RC[-6])+2,10),IFERROR(MID(RC[-6],SEARCH("-5",RC[-6])+2,10),IFERROR(MID(RC[-6],SEARCH("-4",RC[-6])+2,10),IFERROR(MID(RC[-6],SEARCH("-3",RC[-6])+2,10),IFERROR(MID(RC[-6],SEARCH("-2",RC[-6])+2,10),IFERROR(MID(RC[-6],SEARCH("-1",RC[-6])+2,10),IFERROR(MID(RC[-6],SEARCH("-",RC[-6])+1,10),))))))))))) -> 超级队长 | I338: ="1"&VLOOKUP(RC[-1],Sheet1!R2C2:R127C3,2,FALSE) -> 130301 | J338: 130301 | K338: =IFERROR(FIND(13,RC[-4],1),"") -> 1 | L338: =IF(RC[-1]="","",MID(RC[-5],RC[-1],6)) -> 130301 | M338: =SUBSTITUTE(RC[-6],RC[-1],RC[-3],1) -> 1303014|1
A339: 10285303 | B339: 29-6超级队长 | D339: 1 | E339: 102853|50 | F339: 1 | G339: 1303014|1 | H339: =IFERROR(MID(RC[-6],SEARCH("-10",RC[-6])+3,10),IFERROR(MID(RC[-6],SEARCH("-9",RC[-6])+2,10),IFERROR(MID(RC[-6],SEARCH("-8",RC[-6])+2,10),IFERROR(MID(RC[-6],SEARCH("-7",RC[-6])+2,10),IFERROR(MID(RC[-6],SEARCH("-6",RC[-6])+2,10),IFERROR(MID(RC[-6],SEARCH("-5",RC[-6])+2,10),IFERROR(MID(RC[-6],SEARCH("-4",RC[-6])+2,10),IFERROR(MID(RC[-6],SEARCH("-3",RC[-6])+2,10),IFERROR(MID(RC[-6],SEARCH("-2",RC[-6])+2,10),IFERROR(MID(RC[-6],SEARCH("-1",RC[-6])+2,10),IFERROR(MID(RC[-6],SEARCH("-",RC[-6])+1,10),))))))))))) -> 超级队长 | I339: ="1"&VLOOKUP(RC[-1],Sheet1!R2C2:R127C3,2,FALSE) -> 130301 | J339: 130301 | K339: =IFERROR(FIND(13,RC[-4],1),"") -> 1 | L339: =IF(RC[-1]="","",MID(RC[-5],RC[-1],6)) -> 130301 | M339: =SUBSTITUTE(RC[-6],RC[-1],RC[-3],1) -> 1303014|1
A340: 10285304 | B340: 29-6超级队长 | D340: 1 | E340: 102853|20 | F340: 1 | G340: 1303014|1 | H340: =IFERROR(MID(RC[-6],SEARCH("-10",RC[-6])+3,10),IFERROR(MID(RC[-6],SEARCH("-9",RC[-6])+2,10),IFERROR(MID(RC[-6],SEARCH("-8",RC[-6])+2,10),IFERROR(MID(RC[-6],SEARCH("-7",RC[-6])+2,10),IFERROR(MID(RC[-6],SEARCH("-6",RC[-6])+2,10),IFERROR(MID(RC[-6],SEARCH("-5",RC[-6])+2,10),IFERROR(MID(RC[-6],SEARCH("-4",RC[-6])+2,10),IFERROR(MID(RC[-6],SEARCH("-3",RC[-6])+2,10),IFERROR(MID(RC[-6],SEARCH("-2",RC[-6])+2,10),IFERROR(MID(RC[-6],SEARCH("-1",RC[-6])+2,10),IFERROR(MID(RC[-6],SEARCH("-",RC[-6])+1,10),))))))))))) -> 超级队长 | I340: ="1"&VLOOKUP(RC[-1],Sheet1!R2C2:R127C3,2,FALSE) -> 130301 | J340: 130301 | K340: =IFERROR(FIND(13,RC[-4],1),"") -> 1 | L340: =IF(RC[-1]="","",MID(RC[-5],RC[-1],6)) -> 130301 | M340: =SUBSTITUTE(RC[-6],RC[-1],RC[-3],1) -> 1303014|1
A341: 10285305 | B341: 29-6超级队长 | D341: 2 | E341: 8 | F341: 3 | G341: "堕落？我只是坚持我的坚持而已"|3 | H341: =IFERROR(MID(RC[-6],SEARCH("-10",RC[-6])+3,10),IFERROR(MID(RC[-6],SEARCH("-9",RC[-6])+2,10),IFERROR(MID(RC[-6],SEARCH("-8",RC[-6])+2,10),IFERROR(MID(RC[-6],SEARCH("-7",RC[-6])+2,10),IFERROR(MID(RC[-6],SEARCH("-6",RC[-6])+2,10),IFERROR(MID(RC[-6],SEARCH("-5",RC[-6])+2,10),IFERROR(MID(RC[-6],SEARCH("-4",RC[-6])+2,10),IFERROR(MID(RC[-6],SEARCH("-3",RC[-6])+2,10),IFERROR(MID(RC[-6],SEARCH("-2",RC[-6])+2,10),IFERROR(MID(RC[-6],SEARCH("-1",RC[-6])+2,10),IFERROR(MID(RC[-6],SEARCH("-",RC[-6])+1,10),))))))))))) -> 超级队长 | I341: ="1"&VLOOKUP(RC[-1],Sheet1!R2C2:R127C3,2,FALSE) -> 130301 | J341: 130301 | K341: =IFERROR(FIND(13,RC[-4],1),"") ->  | L341: =IF(RC[-1]="","",MID(RC[-5],RC[-1],6)) ->  | M341: =SUBSTITUTE(RC[-6],RC[-1],RC[-3],1) -> "堕落？我只是坚持我的坚持而已"|3
A342: 10285306 | B342: 29-6超级队长 | D342: 2 | E342: 15 | F342: 3 | G342: "不要否认，我只是你的另一面"|3 | H342: =IFERROR(MID(RC[-6],SEARCH("-10",RC[-6])+3,10),IFERROR(MID(RC[-6],SEARCH("-9",RC[-6])+2,10),IFERROR(MID(RC[-6],SEARCH("-8",RC[-6])+2,10),IFERROR(MID(RC[-6],SEARCH("-7",RC[-6])+2,10),IFERROR(MID(RC[-6],SEARCH("-6",RC[-6])+2,10),IFERROR(MID(RC[-6],SEARCH("-5",RC[-6])+2,10),IFERROR(MID(RC[-6],SEARCH("-4",RC[-6])+2,10),IFERROR(MID(RC[-6],SEARCH("-3",RC[-6])+2,10),IFERROR(MID(RC[-6],SEARCH("-2",RC[-6])+2,10),IFERROR(MID(RC[-6],SEARCH("-1",RC[-6])+2,10),IFERROR(MID(RC[-6],SEARCH("-",RC[-6])+1,10),))))))))))) -> 超级队长 | I342: ="1"&VLOOKUP(RC[-1],Sheet1!R2C2:R127C3,2,FALSE) -> 130301 | J342: 130301 | K342: =IFERROR(FIND(13,RC[-4],1),"") ->  | L342: =IF(RC[-1]="","",MID(RC[-5],RC[-1],6)) ->  | M342: =SUBSTITUTE(RC[-6],RC[-1],RC[-3],1) -> "不要否认，我只是你的另一面"|3
A343: 10285307 | B343: 29-6超级队长 | D343: 2 | E343: 25 | F343: 3 | G343: "从本质上来说，我们一样卑劣，一样肮脏"|3 | H343: =IFERROR(MID(RC[-6],SEARCH("-10",RC[-6])+3,10),IFERROR(MID(RC[-6],SEARCH("-9",RC[-6])+2,10),IFERROR(MID(RC[-6],SEARCH("-8",RC[-6])+2,10),IFERROR(MID(RC[-6],SEARCH("-7",RC[-6])+2,10),IFERROR(MID(RC[-6],SEARCH("-6",RC[-6])+2,10),IFERROR(MID(RC[-6],SEARCH("-5",RC[-6])+2,10),IFERROR(MID(RC[-6],SEARCH("-4",RC[-6])+2,10),IFERROR(MID(RC[-6],SEARCH("-3",RC[-6])+2,10),IFERROR(MID(RC[-6],SEARCH("-2",RC[-6])+2,10),IFERROR(MID(RC[-6],SEARCH("-1",RC[-6])+2,10),IFERROR(MID(RC[-6],SEARCH("-",RC[-6])+1,10),))))))))))) -> 超级队长 | I343: ="1"&VLOOKUP(RC[-1],Sheet1!R2C2:R127C3,2,FALSE) -> 130301 | J343: 130301 | K343: =IFERROR(FIND(13,RC[-4],1),"") ->  | L343: =IF(RC[-1]="","",MID(RC[-5],RC[-1],6)) ->  | M343: =SUBSTITUTE(RC[-6],RC[-1],RC[-3],1) -> "从本质上来说，我们一样卑劣，一样肮脏"|3
A344: 10285308 | B344: 29-6超级队长 | D344: 2 | E344: 35 | F344: 3 | G344: "什么堕落？只是我们的坚持不一样而已"|3 | H344: =IFERROR(MID(RC[-6],SEARCH("-10",RC[-6])+3,10),IFERROR(MID(RC[-6],SEARCH("-9",RC[-6])+2,10),IFERROR(MID(RC[-6],SEARCH("-8",RC[-6])+2,10),IFERROR(MID(RC[-6],SEARCH("-7",RC[-6])+2,10),IFERROR(MID(RC[-6],SEARCH("-6",RC[-6])+2,10),IFERROR(MID(RC[-6],SEARCH("-5",RC[-6])+2,10),IFERROR(MID(RC[-6],SEARCH("-4",RC[-6])+2,10),IFERROR(MID(RC[-6],SEARCH("-3",RC[-6])+2,10),IFERROR(MID(RC[-6],SEARCH("-2",RC[-6])+2,10),IFERROR(MID(RC[-6],SEARCH("-1",RC[-6])+2,10),IFERROR(MID(RC[-6],SEARCH("-",RC[-6])+1,10),))))))))))) -> 超级队长 | I344: ="1"&VLOOKUP(RC[-1],Sheet1!R2C2:R127C3,2,FALSE) -> 130301 | J344: 130301 | K344: =IFERROR(FIND(13,RC[-4],1),"") ->  | L344: =IF(RC[-1]="","",MID(RC[-5],RC[-1],6)) ->  | M344: =SUBSTITUTE(RC[-6],RC[-1],RC[-3],1) -> "什么堕落？只是我们的坚持不一样而已"|3
A345: 10285309 | B345: 29-6超级队长 | D345: 3 | F345: 3 | G345: "至死不休……"|3 | H345: =IFERROR(MID(RC[-6],SEARCH("-10",RC[-6])+3,10),IFERROR(MID(RC[-6],SEARCH("-9",RC[-6])+2,10),IFERROR(MID(RC[-6],SEARCH("-8",RC[-6])+2,10),IFERROR(MID(RC[-6],SEARCH("-7",RC[-6])+2,10),IFERROR(MID(RC[-6],SEARCH("-6",RC[-6])+2,10),IFERROR(MID(RC[-6],SEARCH("-5",RC[-6])+2,10),IFERROR(MID(RC[-6],SEARCH("-4",RC[-6])+2,10),IFERROR(MID(RC[-6],SEARCH("-3",RC[-6])+2,10),IFERROR(MID(RC[-6],SEARCH("-2",RC[-6])+2,10),IFERROR(MID(RC[-6],SEARCH("-1",RC[-6])+2,10),IFERROR(MID(RC[-6],SEARCH("-",RC[-6])+1,10),))))))))))) -> 超级队长 | I345: ="1"&VLOOKUP(RC[-1],Sheet1!R2C2:R127C3,2,FALSE) -> 130301 | J345: 130301 | K345: =IFERROR(FIND(13,RC[-4],1),"") ->  | L345: =IF(RC[-1]="","",MID(RC[-5],RC[-1],6)) ->  | M345: =SUBSTITUTE(RC[-6],RC[-1],RC[-3],1) -> "至死不休……"|3
A346: 10288201 | B346: 29-9弓弩刺客 | D346: 2 | E346: 6 | F346: 2 | G346: 102853|400039|2 | H346: =IFERROR(MID(RC[-6],SEARCH("-10",RC[-6])+3,10),IFERROR(MID(RC[-6],SEARCH("-9",RC[-6])+2,10),IFERROR(MID(RC[-6],SEARCH("-8",RC[-6])+2,10),IFERROR(MID(RC[-6],SEARCH("-7",RC[-6])+2,10),IFERROR(MID(RC[-6],SEARCH("-6",RC[-6])+2,10),IFERROR(MID(RC[-6],SEARCH("-5",RC[-6])+2,10),IFERROR(MID(RC[-6],SEARCH("-4",RC[-6])+2,10),IFERROR(MID(RC[-6],SEARCH("-3",RC[-6])+2,10),IFERROR(MID(RC[-6],SEARCH("-2",RC[-6])+2,10),IFERROR(MID(RC[-6],SEARCH("-1",RC[-6])+2,10),IFERROR(MID(RC[-6],SEARCH("-",RC[-6])+1,10),))))))))))) -> 弓弩刺客 | I346: ="1"&VLOOKUP(RC[-1],Sheet1!R2C2:R127C3,2,FALSE) -> 131220 | J346: 131220 | K346: =IFERROR(FIND(13,RC[-4],1),"") ->  | L346: =IF(RC[-1]="","",MID(RC[-5],RC[-1],6)) ->  | M346: =SUBSTITUTE(RC[-6],RC[-1],RC[-3],1) -> 102853|400039|2
A347: 10289401 | B347: 29-10白凤凰 | D347: 2 | E347: 6 | F347: 2 | G347: 102853|400040|2 | H347: =IFERROR(MID(RC[-6],SEARCH("-10",RC[-6])+3,10),IFERROR(MID(RC[-6],SEARCH("-9",RC[-6])+2,10),IFERROR(MID(RC[-6],SEARCH("-8",RC[-6])+2,10),IFERROR(MID(RC[-6],SEARCH("-7",RC[-6])+2,10),IFERROR(MID(RC[-6],SEARCH("-6",RC[-6])+2,10),IFERROR(MID(RC[-6],SEARCH("-5",RC[-6])+2,10),IFERROR(MID(RC[-6],SEARCH("-4",RC[-6])+2,10),IFERROR(MID(RC[-6],SEARCH("-3",RC[-6])+2,10),IFERROR(MID(RC[-6],SEARCH("-2",RC[-6])+2,10),IFERROR(MID(RC[-6],SEARCH("-1",RC[-6])+2,10),IFERROR(MID(RC[-6],SEARCH("-",RC[-6])+1,10),))))))))))) -> 白凤凰 | I347: ="1"&VLOOKUP(RC[-1],Sheet1!R2C2:R127C3,2,FALSE) -> 130440 | J347: 130440 | K347: =IFERROR(FIND(13,RC[-4],1),"") ->  | L347: =IF(RC[-1]="","",MID(RC[-5],RC[-1],6)) ->  | M347: =SUBSTITUTE(RC[-6],RC[-1],RC[-3],1) -> 102853|400040|2
A348: 10289402 | B348: 29-10白凤凰 | D348: 1 | E348: 102895|50 | F348: 3|1 | G348: "燃烧吧，凤凰，燃烧吧，世界！"|3#1304404|1 | H348: =IFERROR(MID(RC[-6],SEARCH("-10",RC[-6])+3,10),IFERROR(MID(RC[-6],SEARCH("-9",RC[-6])+2,10),IFERROR(MID(RC[-6],SEARCH("-8",RC[-6])+2,10),IFERROR(MID(RC[-6],SEARCH("-7",RC[-6])+2,10),IFERROR(MID(RC[-6],SEARCH("-6",RC[-6])+2,10),IFERROR(MID(RC[-6],SEARCH("-5",RC[-6])+2,10),IFERROR(MID(RC[-6],SEARCH("-4",RC[-6])+2,10),IFERROR(MID(RC[-6],SEARCH("-3",RC[-6])+2,10),IFERROR(MID(RC[-6],SEARCH("-2",RC[-6])+2,10),IFERROR(MID(RC[-6],SEARCH("-1",RC[-6])+2,10),IFERROR(MID(RC[-6],SEARCH("-",RC[-6])+1,10),))))))))))) -> 白凤凰 | I348: ="1"&VLOOKUP(RC[-1],Sheet1!R2C2:R127C3,2,FALSE) -> 130440 | J348: 130440 | K348: =IFERROR(FIND(13,RC[-4],1),"") -> 20 | L348: =IF(RC[-1]="","",MID(RC[-5],RC[-1],6)) -> 130440 | M348: =SUBSTITUTE(RC[-6],RC[-1],RC[-3],1) -> "燃烧吧，凤凰，燃烧吧，世界！"|3#1304404|1
A349: 10289403 | B349: 29-10白凤凰 | D349: 1 | E349: 102895|20 | F349: 3|1 | G349: "光辉是希望，黑暗也是"|3#1304404|1 | H349: =IFERROR(MID(RC[-6],SEARCH("-10",RC[-6])+3,10),IFERROR(MID(RC[-6],SEARCH("-9",RC[-6])+2,10),IFERROR(MID(RC[-6],SEARCH("-8",RC[-6])+2,10),IFERROR(MID(RC[-6],SEARCH("-7",RC[-6])+2,10),IFERROR(MID(RC[-6],SEARCH("-6",RC[-6])+2,10),IFERROR(MID(RC[-6],SEARCH("-5",RC[-6])+2,10),IFERROR(MID(RC[-6],SEARCH("-4",RC[-6])+2,10),IFERROR(MID(RC[-6],SEARCH("-3",RC[-6])+2,10),IFERROR(MID(RC[-6],SEARCH("-2",RC[-6])+2,10),IFERROR(MID(RC[-6],SEARCH("-1",RC[-6])+2,10),IFERROR(MID(RC[-6],SEARCH("-",RC[-6])+1,10),))))))))))) -> 白凤凰 | I349: ="1"&VLOOKUP(RC[-1],Sheet1!R2C2:R127C3,2,FALSE) -> 130440 | J349: 130440 | K349: =IFERROR(FIND(13,RC[-4],1),"") -> 16 | L349: =IF(RC[-1]="","",MID(RC[-5],RC[-1],6)) -> 130440 | M349: =SUBSTITUTE(RC[-6],RC[-1],RC[-3],1) -> "光辉是希望，黑暗也是"|3#1304404|1
A350: 10289501 | B350: 29-10超凡博士 | D350: 4 | F350: 3|1 | G350: "湮灭吧"|3#1304384|1 | H350: =IFERROR(MID(RC[-6],SEARCH("-10",RC[-6])+3,10),IFERROR(MID(RC[-6],SEARCH("-9",RC[-6])+2,10),IFERROR(MID(RC[-6],SEARCH("-8",RC[-6])+2,10),IFERROR(MID(RC[-6],SEARCH("-7",RC[-6])+2,10),IFERROR(MID(RC[-6],SEARCH("-6",RC[-6])+2,10),IFERROR(MID(RC[-6],SEARCH("-5",RC[-6])+2,10),IFERROR(MID(RC[-6],SEARCH("-4",RC[-6])+2,10),IFERROR(MID(RC[-6],SEARCH("-3",RC[-6])+2,10),IFERROR(MID(RC[-6],SEARCH("-2",RC[-6])+2,10),IFERROR(MID(RC[-6],SEARCH("-1",RC[-6])+2,10),IFERROR(MID(RC[-6],SEARCH("-",RC[-6])+1,10),))))))))))) -> 超凡博士 | I350: ="1"&VLOOKUP(RC[-1],Sheet1!R2C2:R127C3,2,FALSE) -> 130438 | J350: 130438 | K350: =IFERROR(FIND(13,RC[-4],1),"") -> 9 | L350: =IF(RC[-1]="","",MID(RC[-5],RC[-1],6)) -> 130438 | M350: =SUBSTITUTE(RC[-6],RC[-1],RC[-3],1) -> "湮灭吧"|3#1304384|1
A351: 10289502 | B351: 29-10超凡博士 | D351: 1 | E351: 102895|70 | F351: 3|1 | G351: "我将见证毁灭，见证死亡，见证终焉之时的到来"|5#400041|2 | H351: =IFERROR(MID(RC[-6],SEARCH("-10",RC[-6])+3,10),IFERROR(MID(RC[-6],SEARCH("-9",RC[-6])+2,10),IFERROR(MID(RC[-6],SEARCH("-8",RC[-6])+2,10),IFERROR(MID(RC[-6],SEARCH("-7",RC[-6])+2,10),IFERROR(MID(RC[-6],SEARCH("-6",RC[-6])+2,10),IFERROR(MID(RC[-6],SEARCH("-5",RC[-6])+2,10),IFERROR(MID(RC[-6],SEARCH("-4",RC[-6])+2,10),IFERROR(MID(RC[-6],SEARCH("-3",RC[-6])+2,10),IFERROR(MID(RC[-6],SEARCH("-2",RC[-6])+2,10),IFERROR(MID(RC[-6],SEARCH("-1",RC[-6])+2,10),IFERROR(MID(RC[-6],SEARCH("-",RC[-6])+1,10),))))))))))) -> 超凡博士 | I351: ="1"&VLOOKUP(RC[-1],Sheet1!R2C2:R127C3,2,FALSE) -> 130438 | J351: 130438 | K351: =IFERROR(FIND(13,RC[-4],1),"") ->  | L351: =IF(RC[-1]="","",MID(RC[-5],RC[-1],6)) ->  | M351: =SUBSTITUTE(RC[-6],RC[-1],RC[-3],1) -> "我将见证毁灭，见证死亡，见证终焉之时的到来"|5#400041|2
A352: 10289503 | B352: 29-10超凡博士 | D352: 8 | E352: 400041 | F352: 4|2|4|2 | G352: 1#102895|400042|2#2#102895|400042|2 | H352: =IFERROR(MID(RC[-6],SEARCH("-10",RC[-6])+3,10),IFERROR(MID(RC[-6],SEARCH("-9",RC[-6])+2,10),IFERROR(MID(RC[-6],SEARCH("-8",RC[-6])+2,10),IFERROR(MID(RC[-6],SEARCH("-7",RC[-6])+2,10),IFERROR(MID(RC[-6],SEARCH("-6",RC[-6])+2,10),IFERROR(MID(RC[-6],SEARCH("-5",RC[-6])+2,10),IFERROR(MID(RC[-6],SEARCH("-4",RC[-6])+2,10),IFERROR(MID(RC[-6],SEARCH("-3",RC[-6])+2,10),IFERROR(MID(RC[-6],SEARCH("-2",RC[-6])+2,10),IFERROR(MID(RC[-6],SEARCH("-1",RC[-6])+2,10),IFERROR(MID(RC[-6],SEARCH("-",RC[-6])+1,10),))))))))))) -> 超凡博士 | I352: ="1"&VLOOKUP(RC[-1],Sheet1!R2C2:R127C3,2,FALSE) -> 130438 | J352: 130438 | K352: =IFERROR(FIND(13,RC[-4],1),"") ->  | L352: =IF(RC[-1]="","",MID(RC[-5],RC[-1],6)) ->  | M352: =SUBSTITUTE(RC[-6],RC[-1],RC[-3],1) -> 1#102895|400042|2#2#102895|400042|2
A353: 10289504 | B353: 29-10超凡博士 | D353: 8 | E353: 400041 | F353: 4|2|4|2 | G353: 5#102895|400042|2#2#102895|400042|2 | H353: =IFERROR(MID(RC[-6],SEARCH("-10",RC[-6])+3,10),IFERROR(MID(RC[-6],SEARCH("-9",RC[-6])+2,10),IFERROR(MID(RC[-6],SEARCH("-8",RC[-6])+2,10),IFERROR(MID(RC[-6],SEARCH("-7",RC[-6])+2,10),IFERROR(MID(RC[-6],SEARCH("-6",RC[-6])+2,10),IFERROR(MID(RC[-6],SEARCH("-5",RC[-6])+2,10),IFERROR(MID(RC[-6],SEARCH("-4",RC[-6])+2,10),IFERROR(MID(RC[-6],SEARCH("-3",RC[-6])+2,10),IFERROR(MID(RC[-6],SEARCH("-2",RC[-6])+2,10),IFERROR(MID(RC[-6],SEARCH("-1",RC[-6])+2,10),IFERROR(MID(RC[-6],SEARCH("-",RC[-6])+1,10),))))))))))) -> 超凡博士 | I353: ="1"&VLOOKUP(RC[-1],Sheet1!R2C2:R127C3,2,FALSE) -> 130438 | J353: 130438 | K353: =IFERROR(FIND(13,RC[-4],1),"") ->  | L353: =IF(RC[-1]="","",MID(RC[-5],RC[-1],6)) ->  | M353: =SUBSTITUTE(RC[-6],RC[-1],RC[-3],1) -> 5#102895|400042|2#2#102895|400042|2
A354: 10289505 | B354: 29-10超凡博士 | D354: 8 | E354: 400041 | F354: 4|2|4|2 | G354: 9#102895|400042|2#2#102895|400042|2 | H354: =IFERROR(MID(RC[-6],SEARCH("-10",RC[-6])+3,10),IFERROR(MID(RC[-6],SEARCH("-9",RC[-6])+2,10),IFERROR(MID(RC[-6],SEARCH("-8",RC[-6])+2,10),IFERROR(MID(RC[-6],SEARCH("-7",RC[-6])+2,10),IFERROR(MID(RC[-6],SEARCH("-6",RC[-6])+2,10),IFERROR(MID(RC[-6],SEARCH("-5",RC[-6])+2,10),IFERROR(MID(RC[-6],SEARCH("-4",RC[-6])+2,10),IFERROR(MID(RC[-6],SEARCH("-3",RC[-6])+2,10),IFERROR(MID(RC[-6],SEARCH("-2",RC[-6])+2,10),IFERROR(MID(RC[-6],SEARCH("-1",RC[-6])+2,10),IFERROR(MID(RC[-6],SEARCH("-",RC[-6])+1,10),))))))))))) -> 超凡博士 | I354: ="1"&VLOOKUP(RC[-1],Sheet1!R2C2:R127C3,2,FALSE) -> 130438 | J354: 130438 | K354: =IFERROR(FIND(13,RC[-4],1),"") ->  | L354: =IF(RC[-1]="","",MID(RC[-5],RC[-1],6)) ->  | M354: =SUBSTITUTE(RC[-6],RC[-1],RC[-3],1) -> 9#102895|400042|2#2#102895|400042|2
A355: 10289506 | B355: 29-10超凡博士 | D355: 8 | E355: 400041 | F355: 4|2|4|2 | G355: 13#102895|400042|2#2#102895|400042|2 | H355: =IFERROR(MID(RC[-6],SEARCH("-10",RC[-6])+3,10),IFERROR(MID(RC[-6],SEARCH("-9",RC[-6])+2,10),IFERROR(MID(RC[-6],SEARCH("-8",RC[-6])+2,10),IFERROR(MID(RC[-6],SEARCH("-7",RC[-6])+2,10),IFERROR(MID(RC[-6],SEARCH("-6",RC[-6])+2,10),IFERROR(MID(RC[-6],SEARCH("-5",RC[-6])+2,10),IFERROR(MID(RC[-6],SEARCH("-4",RC[-6])+2,10),IFERROR(MID(RC[-6],SEARCH("-3",RC[-6])+2,10),IFERROR(MID(RC[-6],SEARCH("-2",RC[-6])+2,10),IFERROR(MID(RC[-6],SEARCH("-1",RC[-6])+2,10),IFERROR(MID(RC[-6],SEARCH("-",RC[-6])+1,10),))))))))))) -> 超凡博士 | I355: ="1"&VLOOKUP(RC[-1],Sheet1!R2C2:R127C3,2,FALSE) -> 130438 | J355: 130438 | K355: =IFERROR(FIND(13,RC[-4],1),"") -> 1 | L355: =IF(RC[-1]="","",MID(RC[-5],RC[-1],6)) -> 13#102 | M355: =SUBSTITUTE(RC[-6],RC[-1],RC[-3],1) -> 130438895|400042|2#2#102895|400042|2
A356: 10289507 | B356: 29-10超凡博士 | D356: 8 | E356: 400041 | F356: 4|2|4|2 | G356: 17#102895|400042|2#2#102895|400042|2 | H356: =IFERROR(MID(RC[-6],SEARCH("-10",RC[-6])+3,10),IFERROR(MID(RC[-6],SEARCH("-9",RC[-6])+2,10),IFERROR(MID(RC[-6],SEARCH("-8",RC[-6])+2,10),IFERROR(MID(RC[-6],SEARCH("-7",RC[-6])+2,10),IFERROR(MID(RC[-6],SEARCH("-6",RC[-6])+2,10),IFERROR(MID(RC[-6],SEARCH("-5",RC[-6])+2,10),IFERROR(MID(RC[-6],SEARCH("-4",RC[-6])+2,10),IFERROR(MID(RC[-6],SEARCH("-3",RC[-6])+2,10),IFERROR(MID(RC[-6],SEARCH("-2",RC[-6])+2,10),IFERROR(MID(RC[-6],SEARCH("-1",RC[-6])+2,10),IFERROR(MID(RC[-6],SEARCH("-",RC[-6])+1,10),))))))))))) -> 超凡博士 | I356: ="1"&VLOOKUP(RC[-1],Sheet1!R2C2:R127C3,2,FALSE) -> 130438 | J356: 130438 | K356: =IFERROR(FIND(13,RC[-4],1),"") ->  | L356: =IF(RC[-1]="","",MID(RC[-5],RC[-1],6)) ->  | M356: =SUBSTITUTE(RC[-6],RC[-1],RC[-3],1) -> 17#102895|400042|2#2#102895|400042|2
A357: 10289508 | B357: 29-10超凡博士 | D357: 8 | E357: 400041 | F357: 4|2|4|2 | G357: 21#102895|400042|2#2#102895|400042|2 | H357: =IFERROR(MID(RC[-6],SEARCH("-10",RC[-6])+3,10),IFERROR(MID(RC[-6],SEARCH("-9",RC[-6])+2,10),IFERROR(MID(RC[-6],SEARCH("-8",RC[-6])+2,10),IFERROR(MID(RC[-6],SEARCH("-7",RC[-6])+2,10),IFERROR(MID(RC[-6],SEARCH("-6",RC[-6])+2,10),IFERROR(MID(RC[-6],SEARCH("-5",RC[-6])+2,10),IFERROR(MID(RC[-6],SEARCH("-4",RC[-6])+2,10),IFERROR(MID(RC[-6],SEARCH("-3",RC[-6])+2,10),IFERROR(MID(RC[-6],SEARCH("-2",RC[-6])+2,10),IFERROR(MID(RC[-6],SEARCH("-1",RC[-6])+2,10),IFERROR(MID(RC[-6],SEARCH("-",RC[-6])+1,10),))))))))))) -> 超凡博士 | I357: ="1"&VLOOKUP(RC[-1],Sheet1!R2C2:R127C3,2,FALSE) -> 130438 | J357: 130438 | K357: =IFERROR(FIND(13,RC[-4],1),"") ->  | L357: =IF(RC[-1]="","",MID(RC[-5],RC[-1],6)) ->  | M357: =SUBSTITUTE(RC[-6],RC[-1],RC[-3],1) -> 21#102895|400042|2#2#102895|400042|2
A358: 10289509 | B358: 29-10超凡博士 | D358: 8 | E358: 400041 | F358: 4|2|4|2 | G358: 25#102895|400042|2#2#102895|400042|2 | H358: =IFERROR(MID(RC[-6],SEARCH("-10",RC[-6])+3,10),IFERROR(MID(RC[-6],SEARCH("-9",RC[-6])+2,10),IFERROR(MID(RC[-6],SEARCH("-8",RC[-6])+2,10),IFERROR(MID(RC[-6],SEARCH("-7",RC[-6])+2,10),IFERROR(MID(RC[-6],SEARCH("-6",RC[-6])+2,10),IFERROR(MID(RC[-6],SEARCH("-5",RC[-6])+2,10),IFERROR(MID(RC[-6],SEARCH("-4",RC[-6])+2,10),IFERROR(MID(RC[-6],SEARCH("-3",RC[-6])+2,10),IFERROR(MID(RC[-6],SEARCH("-2",RC[-6])+2,10),IFERROR(MID(RC[-6],SEARCH("-1",RC[-6])+2,10),IFERROR(MID(RC[-6],SEARCH("-",RC[-6])+1,10),))))))))))) -> 超凡博士 | I358: ="1"&VLOOKUP(RC[-1],Sheet1!R2C2:R127C3,2,FALSE) -> 130438 | J358: 130438 | K358: =IFERROR(FIND(13,RC[-4],1),"") ->  | L358: =IF(RC[-1]="","",MID(RC[-5],RC[-1],6)) ->  | M358: =SUBSTITUTE(RC[-6],RC[-1],RC[-3],1) -> 25#102895|400042|2#2#102895|400042|2
A359: 10289510 | B359: 29-10超凡博士 | D359: 8 | E359: 400041 | F359: 4|2|4|2 | G359: 29#102895|400042|2#2#102895|400042|2 | H359: =IFERROR(MID(RC[-6],SEARCH("-10",RC[-6])+3,10),IFERROR(MID(RC[-6],SEARCH("-9",RC[-6])+2,10),IFERROR(MID(RC[-6],SEARCH("-8",RC[-6])+2,10),IFERROR(MID(RC[-6],SEARCH("-7",RC[-6])+2,10),IFERROR(MID(RC[-6],SEARCH("-6",RC[-6])+2,10),IFERROR(MID(RC[-6],SEARCH("-5",RC[-6])+2,10),IFERROR(MID(RC[-6],SEARCH("-4",RC[-6])+2,10),IFERROR(MID(RC[-6],SEARCH("-3",RC[-6])+2,10),IFERROR(MID(RC[-6],SEARCH("-2",RC[-6])+2,10),IFERROR(MID(RC[-6],SEARCH("-1",RC[-6])+2,10),IFERROR(MID(RC[-6],SEARCH("-",RC[-6])+1,10),))))))))))) -> 超凡博士 | I359: ="1"&VLOOKUP(RC[-1],Sheet1!R2C2:R127C3,2,FALSE) -> 130438 | J359: 130438 | K359: =IFERROR(FIND(13,RC[-4],1),"") ->  | L359: =IF(RC[-1]="","",MID(RC[-5],RC[-1],6)) ->  | M359: =SUBSTITUTE(RC[-6],RC[-1],RC[-3],1) -> 29#102895|400042|2#2#102895|400042|2
A360: 10298401 | B360: 30-9刀锋猎人 | D360: 4 | F360: 3|1 | G360: "这里不允许通过！"|3#1304024|1 | H360: =IFERROR(MID(RC[-6],SEARCH("-10",RC[-6])+3,10),IFERROR(MID(RC[-6],SEARCH("-9",RC[-6])+2,10),IFERROR(MID(RC[-6],SEARCH("-8",RC[-6])+2,10),IFERROR(MID(RC[-6],SEARCH("-7",RC[-6])+2,10),IFERROR(MID(RC[-6],SEARCH("-6",RC[-6])+2,10),IFERROR(MID(RC[-6],SEARCH("-5",RC[-6])+2,10),IFERROR(MID(RC[-6],SEARCH("-4",RC[-6])+2,10),IFERROR(MID(RC[-6],SEARCH("-3",RC[-6])+2,10),IFERROR(MID(RC[-6],SEARCH("-2",RC[-6])+2,10),IFERROR(MID(RC[-6],SEARCH("-1",RC[-6])+2,10),IFERROR(MID(RC[-6],SEARCH("-",RC[-6])+1,10),))))))))))) -> 刀锋猎人 | I360: ="1"&VLOOKUP(RC[-1],Sheet1!R2C2:R127C3,2,FALSE) -> 130402 | J360: 130402 | K360: =IFERROR(FIND(13,RC[-4],1),"") -> 14 | L360: =IF(RC[-1]="","",MID(RC[-5],RC[-1],6)) -> 130402 | M360: =SUBSTITUTE(RC[-6],RC[-1],RC[-3],1) -> "这里不允许通过！"|3#1304024|1
A361: 10298402 | B361: 30-9刀锋猎人 | D361: 1 | E361: 102984|70 | F361: 3|1 | G361: "接受命运吧"|3#1304024|1 | H361: =IFERROR(MID(RC[-6],SEARCH("-10",RC[-6])+3,10),IFERROR(MID(RC[-6],SEARCH("-9",RC[-6])+2,10),IFERROR(MID(RC[-6],SEARCH("-8",RC[-6])+2,10),IFERROR(MID(RC[-6],SEARCH("-7",RC[-6])+2,10),IFERROR(MID(RC[-6],SEARCH("-6",RC[-6])+2,10),IFERROR(MID(RC[-6],SEARCH("-5",RC[-6])+2,10),IFERROR(MID(RC[-6],SEARCH("-4",RC[-6])+2,10),IFERROR(MID(RC[-6],SEARCH("-3",RC[-6])+2,10),IFERROR(MID(RC[-6],SEARCH("-2",RC[-6])+2,10),IFERROR(MID(RC[-6],SEARCH("-1",RC[-6])+2,10),IFERROR(MID(RC[-6],SEARCH("-",RC[-6])+1,10),))))))))))) -> 刀锋猎人 | I361: ="1"&VLOOKUP(RC[-1],Sheet1!R2C2:R127C3,2,FALSE) -> 130402 | J361: 130402 | K361: =IFERROR(FIND(13,RC[-4],1),"") -> 11 | L361: =IF(RC[-1]="","",MID(RC[-5],RC[-1],6)) -> 130402 | M361: =SUBSTITUTE(RC[-6],RC[-1],RC[-3],1) -> "接受命运吧"|3#1304024|1
A362: 10298403 | B362: 30-9刀锋猎人 | D362: 1 | E362: 102984|20 | F362: 3|1 | G362: "我是一个猎人，而你们是猎物"|3#1304024|1 | H362: =IFERROR(MID(RC[-6],SEARCH("-10",RC[-6])+3,10),IFERROR(MID(RC[-6],SEARCH("-9",RC[-6])+2,10),IFERROR(MID(RC[-6],SEARCH("-8",RC[-6])+2,10),IFERROR(MID(RC[-6],SEARCH("-7",RC[-6])+2,10),IFERROR(MID(RC[-6],SEARCH("-6",RC[-6])+2,10),IFERROR(MID(RC[-6],SEARCH("-5",RC[-6])+2,10),IFERROR(MID(RC[-6],SEARCH("-4",RC[-6])+2,10),IFERROR(MID(RC[-6],SEARCH("-3",RC[-6])+2,10),IFERROR(MID(RC[-6],SEARCH("-2",RC[-6])+2,10),IFERROR(MID(RC[-6],SEARCH("-1",RC[-6])+2,10),IFERROR(MID(RC[-6],SEARCH("-",RC[-6])+1,10),))))))))))) -> 刀锋猎人 | I362: ="1"&VLOOKUP(RC[-1],Sheet1!R2C2:R127C3,2,FALSE) -> 130402 | J362: 130402 | K362: =IFERROR(FIND(13,RC[-4],1),"") -> 19 | L362: =IF(RC[-1]="","",MID(RC[-5],RC[-1],6)) -> 130402 | M362: =SUBSTITUTE(RC[-6],RC[-1],RC[-3],1) -> "我是一个猎人，而你们是猎物"|3#1304024|1
A363: 10302301 | B363: 31-3斯巴达 | D363: 1 | E363: 103023|80 | F363: 3|1 | G363: "我的盾不会后退！"|3#400024|1 | H363: =IFERROR(MID(RC[-6],SEARCH("-10",RC[-6])+3,10),IFERROR(MID(RC[-6],SEARCH("-9",RC[-6])+2,10),IFERROR(MID(RC[-6],SEARCH("-8",RC[-6])+2,10),IFERROR(MID(RC[-6],SEARCH("-7",RC[-6])+2,10),IFERROR(MID(RC[-6],SEARCH("-6",RC[-6])+2,10),IFERROR(MID(RC[-6],SEARCH("-5",RC[-6])+2,10),IFERROR(MID(RC[-6],SEARCH("-4",RC[-6])+2,10),IFERROR(MID(RC[-6],SEARCH("-3",RC[-6])+2,10),IFERROR(MID(RC[-6],SEARCH("-2",RC[-6])+2,10),IFERROR(MID(RC[-6],SEARCH("-1",RC[-6])+2,10),IFERROR(MID(RC[-6],SEARCH("-",RC[-6])+1,10),))))))))))) -> 斯巴达 | I363: ="1"&VLOOKUP(RC[-1],Sheet1!R2C2:R127C3,2,FALSE) -> 131410 | J363: 131410 | K363: =IFERROR(FIND(13,RC[-4],1),"") ->  | L363: =IF(RC[-1]="","",MID(RC[-5],RC[-1],6)) ->  | M363: =SUBSTITUTE(RC[-6],RC[-1],RC[-3],1) -> "我的盾不会后退！"|3#400024|1
A364: 10302302 | B364: 31-3斯巴达 | D364: 1 | E364: 103023|30 | F364: 3|1 | G364: "这里无路可走！"|3#400024|1 | H364: =IFERROR(MID(RC[-6],SEARCH("-10",RC[-6])+3,10),IFERROR(MID(RC[-6],SEARCH("-9",RC[-6])+2,10),IFERROR(MID(RC[-6],SEARCH("-8",RC[-6])+2,10),IFERROR(MID(RC[-6],SEARCH("-7",RC[-6])+2,10),IFERROR(MID(RC[-6],SEARCH("-6",RC[-6])+2,10),IFERROR(MID(RC[-6],SEARCH("-5",RC[-6])+2,10),IFERROR(MID(RC[-6],SEARCH("-4",RC[-6])+2,10),IFERROR(MID(RC[-6],SEARCH("-3",RC[-6])+2,10),IFERROR(MID(RC[-6],SEARCH("-2",RC[-6])+2,10),IFERROR(MID(RC[-6],SEARCH("-1",RC[-6])+2,10),IFERROR(MID(RC[-6],SEARCH("-",RC[-6])+1,10),))))))))))) -> 斯巴达 | I364: ="1"&VLOOKUP(RC[-1],Sheet1!R2C2:R127C3,2,FALSE) -> 131410 | J364: 131410 | K364: =IFERROR(FIND(13,RC[-4],1),"") ->  | L364: =IF(RC[-1]="","",MID(RC[-5],RC[-1],6)) ->  | M364: =SUBSTITUTE(RC[-6],RC[-1],RC[-3],1) -> "这里无路可走！"|3#400024|1
A365: 10308301 | B365: 31-9熊阿宝 | D365: 1 | E365: 103083|80 | F365: 3|1 | G365: "我的棍子不会留情"|2#400014|1 | H365: =IFERROR(MID(RC[-6],SEARCH("-10",RC[-6])+3,10),IFERROR(MID(RC[-6],SEARCH("-9",RC[-6])+2,10),IFERROR(MID(RC[-6],SEARCH("-8",RC[-6])+2,10),IFERROR(MID(RC[-6],SEARCH("-7",RC[-6])+2,10),IFERROR(MID(RC[-6],SEARCH("-6",RC[-6])+2,10),IFERROR(MID(RC[-6],SEARCH("-5",RC[-6])+2,10),IFERROR(MID(RC[-6],SEARCH("-4",RC[-6])+2,10),IFERROR(MID(RC[-6],SEARCH("-3",RC[-6])+2,10),IFERROR(MID(RC[-6],SEARCH("-2",RC[-6])+2,10),IFERROR(MID(RC[-6],SEARCH("-1",RC[-6])+2,10),IFERROR(MID(RC[-6],SEARCH("-",RC[-6])+1,10),))))))))))) -> 熊阿宝 | I365: ="1"&VLOOKUP(RC[-1],Sheet1!R2C2:R127C3,2,FALSE) -> 132412 | J365: 132412 | K365: =IFERROR(FIND(13,RC[-4],1),"") ->  | L365: =IF(RC[-1]="","",MID(RC[-5],RC[-1],6)) ->  | M365: =SUBSTITUTE(RC[-6],RC[-1],RC[-3],1) -> "我的棍子不会留情"|2#400014|1
A366: 10308302 | B366: 31-9熊阿宝 | D366: 1 | E366: 103083|50 | F366: 3|1 | G366: "碎粉掉你们！"|2#400014|1 | H366: =IFERROR(MID(RC[-6],SEARCH("-10",RC[-6])+3,10),IFERROR(MID(RC[-6],SEARCH("-9",RC[-6])+2,10),IFERROR(MID(RC[-6],SEARCH("-8",RC[-6])+2,10),IFERROR(MID(RC[-6],SEARCH("-7",RC[-6])+2,10),IFERROR(MID(RC[-6],SEARCH("-6",RC[-6])+2,10),IFERROR(MID(RC[-6],SEARCH("-5",RC[-6])+2,10),IFERROR(MID(RC[-6],SEARCH("-4",RC[-6])+2,10),IFERROR(MID(RC[-6],SEARCH("-3",RC[-6])+2,10),IFERROR(MID(RC[-6],SEARCH("-2",RC[-6])+2,10),IFERROR(MID(RC[-6],SEARCH("-1",RC[-6])+2,10),IFERROR(MID(RC[-6],SEARCH("-",RC[-6])+1,10),))))))))))) -> 熊阿宝 | I366: ="1"&VLOOKUP(RC[-1],Sheet1!R2C2:R127C3,2,FALSE) -> 132412 | J366: 132412 | K366: =IFERROR(FIND(13,RC[-4],1),"") ->  | L366: =IF(RC[-1]="","",MID(RC[-5],RC[-1],6)) ->  | M366: =SUBSTITUTE(RC[-6],RC[-1],RC[-3],1) -> "碎粉掉你们！"|2#400014|1
A367: 10308303 | B367: 31-9熊阿宝 | D367: 1 | E367: 103083|20 | F367: 3|1 | G367: "你们无路可走了！"|2#400014|1 | H367: =IFERROR(MID(RC[-6],SEARCH("-10",RC[-6])+3,10),IFERROR(MID(RC[-6],SEARCH("-9",RC[-6])+2,10),IFERROR(MID(RC[-6],SEARCH("-8",RC[-6])+2,10),IFERROR(MID(RC[-6],SEARCH("-7",RC[-6])+2,10),IFERROR(MID(RC[-6],SEARCH("-6",RC[-6])+2,10),IFERROR(MID(RC[-6],SEARCH("-5",RC[-6])+2,10),IFERROR(MID(RC[-6],SEARCH("-4",RC[-6])+2,10),IFERROR(MID(RC[-6],SEARCH("-3",RC[-6])+2,10),IFERROR(MID(RC[-6],SEARCH("-2",RC[-6])+2,10),IFERROR(MID(RC[-6],SEARCH("-1",RC[-6])+2,10),IFERROR(MID(RC[-6],SEARCH("-",RC[-6])+1,10),))))))))))) -> 熊阿宝 | I367: ="1"&VLOOKUP(RC[-1],Sheet1!R2C2:R127C3,2,FALSE) -> 132412 | J367: 132412 | K367: =IFERROR(FIND(13,RC[-4],1),"") ->  | L367: =IF(RC[-1]="","",MID(RC[-5],RC[-1],6)) ->  | M367: =SUBSTITUTE(RC[-6],RC[-1],RC[-3],1) -> "你们无路可走了！"|2#400014|1
A368: 10315301 | B368: 32-6食人魔 | D368: 4 | F368: 3|1 | G368: "吞噬生命……"|2#400008|1 | H368: =IFERROR(MID(RC[-6],SEARCH("-10",RC[-6])+3,10),IFERROR(MID(RC[-6],SEARCH("-9",RC[-6])+2,10),IFERROR(MID(RC[-6],SEARCH("-8",RC[-6])+2,10),IFERROR(MID(RC[-6],SEARCH("-7",RC[-6])+2,10),IFERROR(MID(RC[-6],SEARCH("-6",RC[-6])+2,10),IFERROR(MID(RC[-6],SEARCH("-5",RC[-6])+2,10),IFERROR(MID(RC[-6],SEARCH("-4",RC[-6])+2,10),IFERROR(MID(RC[-6],SEARCH("-3",RC[-6])+2,10),IFERROR(MID(RC[-6],SEARCH("-2",RC[-6])+2,10),IFERROR(MID(RC[-6],SEARCH("-1",RC[-6])+2,10),IFERROR(MID(RC[-6],SEARCH("-",RC[-6])+1,10),))))))))))) -> 食人魔 | I368: ="1"&VLOOKUP(RC[-1],Sheet1!R2C2:R127C3,2,FALSE) -> 132431 | J368: 132431 | K368: =IFERROR(FIND(13,RC[-4],1),"") ->  | L368: =IF(RC[-1]="","",MID(RC[-5],RC[-1],6)) ->  | M368: =SUBSTITUTE(RC[-6],RC[-1],RC[-3],1) -> "吞噬生命……"|2#400008|1
A369: 10315302 | B369: 32-6食人魔 | D369: 2 | E369: 20 | F369: 3|1 | G369: "随火焰而逝，残留下恐惧……"|2#1324314|1 | H369: =IFERROR(MID(RC[-6],SEARCH("-10",RC[-6])+3,10),IFERROR(MID(RC[-6],SEARCH("-9",RC[-6])+2,10),IFERROR(MID(RC[-6],SEARCH("-8",RC[-6])+2,10),IFERROR(MID(RC[-6],SEARCH("-7",RC[-6])+2,10),IFERROR(MID(RC[-6],SEARCH("-6",RC[-6])+2,10),IFERROR(MID(RC[-6],SEARCH("-5",RC[-6])+2,10),IFERROR(MID(RC[-6],SEARCH("-4",RC[-6])+2,10),IFERROR(MID(RC[-6],SEARCH("-3",RC[-6])+2,10),IFERROR(MID(RC[-6],SEARCH("-2",RC[-6])+2,10),IFERROR(MID(RC[-6],SEARCH("-1",RC[-6])+2,10),IFERROR(MID(RC[-6],SEARCH("-",RC[-6])+1,10),))))))))))) -> 食人魔 | I369: ="1"&VLOOKUP(RC[-1],Sheet1!R2C2:R127C3,2,FALSE) -> 132431 | J369: 132431 | K369: =IFERROR(FIND(13,RC[-4],1),"") -> 19 | L369: =IF(RC[-1]="","",MID(RC[-5],RC[-1],6)) -> 132431 | M369: =SUBSTITUTE(RC[-6],RC[-1],RC[-3],1) -> "随火焰而逝，残留下恐惧……"|2#1324314|1
A370: 10315303 | B370: 32-6食人魔 | D370: 1 | E370: 103153|80 | F370: 3|1 | G370: "随贪婪前行，却将一切焚毁……"|2#1324314|1 | H370: =IFERROR(MID(RC[-6],SEARCH("-10",RC[-6])+3,10),IFERROR(MID(RC[-6],SEARCH("-9",RC[-6])+2,10),IFERROR(MID(RC[-6],SEARCH("-8",RC[-6])+2,10),IFERROR(MID(RC[-6],SEARCH("-7",RC[-6])+2,10),IFERROR(MID(RC[-6],SEARCH("-6",RC[-6])+2,10),IFERROR(MID(RC[-6],SEARCH("-5",RC[-6])+2,10),IFERROR(MID(RC[-6],SEARCH("-4",RC[-6])+2,10),IFERROR(MID(RC[-6],SEARCH("-3",RC[-6])+2,10),IFERROR(MID(RC[-6],SEARCH("-2",RC[-6])+2,10),IFERROR(MID(RC[-6],SEARCH("-1",RC[-6])+2,10),IFERROR(MID(RC[-6],SEARCH("-",RC[-6])+1,10),))))))))))) -> 食人魔 | I370: ="1"&VLOOKUP(RC[-1],Sheet1!R2C2:R127C3,2,FALSE) -> 132431 | J370: 132431 | K370: =IFERROR(FIND(13,RC[-4],1),"") -> 20 | L370: =IF(RC[-1]="","",MID(RC[-5],RC[-1],6)) -> 132431 | M370: =SUBSTITUTE(RC[-6],RC[-1],RC[-3],1) -> "随贪婪前行，却将一切焚毁……"|2#1324314|1
A371: 10315304 | B371: 32-6食人魔 | D371: 1 | E371: 103153|30 | F371: 3|1 | G371: "我是贪婪的，是的，对自由也是。"|2#1324314|1 | H371: =IFERROR(MID(RC[-6],SEARCH("-10",RC[-6])+3,10),IFERROR(MID(RC[-6],SEARCH("-9",RC[-6])+2,10),IFERROR(MID(RC[-6],SEARCH("-8",RC[-6])+2,10),IFERROR(MID(RC[-6],SEARCH("-7",RC[-6])+2,10),IFERROR(MID(RC[-6],SEARCH("-6",RC[-6])+2,10),IFERROR(MID(RC[-6],SEARCH("-5",RC[-6])+2,10),IFERROR(MID(RC[-6],SEARCH("-4",RC[-6])+2,10),IFERROR(MID(RC[-6],SEARCH("-3",RC[-6])+2,10),IFERROR(MID(RC[-6],SEARCH("-2",RC[-6])+2,10),IFERROR(MID(RC[-6],SEARCH("-1",RC[-6])+2,10),IFERROR(MID(RC[-6],SEARCH("-",RC[-6])+1,10),))))))))))) -> 食人魔 | I371: ="1"&VLOOKUP(RC[-1],Sheet1!R2C2:R127C3,2,FALSE) -> 132431 | J371: 132431 | K371: =IFERROR(FIND(13,RC[-4],1),"") -> 21 | L371: =IF(RC[-1]="","",MID(RC[-5],RC[-1],6)) -> 132431 | M371: =SUBSTITUTE(RC[-6],RC[-1],RC[-3],1) -> "我是贪婪的，是的，对自由也是。"|2#1324314|1
A372: 10319401 | B372: 32-10德古拉伯爵 | D372: 1 | E372: 103194|50 | F372: 3|1 | G372: "我在堕落与献血中索求着，了无止境地索求着……"|4#400027|1 | H372: =IFERROR(MID(RC[-6],SEARCH("-10",RC[-6])+3,10),IFERROR(MID(RC[-6],SEARCH("-9",RC[-6])+2,10),IFERROR(MID(RC[-6],SEARCH("-8",RC[-6])+2,10),IFERROR(MID(RC[-6],SEARCH("-7",RC[-6])+2,10),IFERROR(MID(RC[-6],SEARCH("-6",RC[-6])+2,10),IFERROR(MID(RC[-6],SEARCH("-5",RC[-6])+2,10),IFERROR(MID(RC[-6],SEARCH("-4",RC[-6])+2,10),IFERROR(MID(RC[-6],SEARCH("-3",RC[-6])+2,10),IFERROR(MID(RC[-6],SEARCH("-2",RC[-6])+2,10),IFERROR(MID(RC[-6],SEARCH("-1",RC[-6])+2,10),IFERROR(MID(RC[-6],SEARCH("-",RC[-6])+1,10),))))))))))) -> 德古拉伯爵 | I372: ="1"&VLOOKUP(RC[-1],Sheet1!R2C2:R127C3,2,FALSE) -> 131401 | J372: 131401 | K372: =IFERROR(FIND(13,RC[-4],1),"") ->  | L372: =IF(RC[-1]="","",MID(RC[-5],RC[-1],6)) ->  | M372: =SUBSTITUTE(RC[-6],RC[-1],RC[-3],1) -> "我在堕落与献血中索求着，了无止境地索求着……"|4#400027|1
A373: 10319501 | B373: 32-10美杜莎 | D373: 2 | E373: 10 | F373: 3|1 | G373: "无法超脱的灵魂，就如此沉沦于躯壳内以至永远吧。"|4#1314305|1 | H373: =IFERROR(MID(RC[-6],SEARCH("-10",RC[-6])+3,10),IFERROR(MID(RC[-6],SEARCH("-9",RC[-6])+2,10),IFERROR(MID(RC[-6],SEARCH("-8",RC[-6])+2,10),IFERROR(MID(RC[-6],SEARCH("-7",RC[-6])+2,10),IFERROR(MID(RC[-6],SEARCH("-6",RC[-6])+2,10),IFERROR(MID(RC[-6],SEARCH("-5",RC[-6])+2,10),IFERROR(MID(RC[-6],SEARCH("-4",RC[-6])+2,10),IFERROR(MID(RC[-6],SEARCH("-3",RC[-6])+2,10),IFERROR(MID(RC[-6],SEARCH("-2",RC[-6])+2,10),IFERROR(MID(RC[-6],SEARCH("-1",RC[-6])+2,10),IFERROR(MID(RC[-6],SEARCH("-",RC[-6])+1,10),))))))))))) -> 美杜莎 | I373: ="1"&VLOOKUP(RC[-1],Sheet1!R2C2:R127C3,2,FALSE) -> 131430 | J373: 131430 | K373: =IFERROR(FIND(13,RC[-4],1),"") -> 29 | L373: =IF(RC[-1]="","",MID(RC[-5],RC[-1],6)) -> 131430 | M373: =SUBSTITUTE(RC[-6],RC[-1],RC[-3],1) -> "无法超脱的灵魂，就如此沉沦于躯壳内以至永远吧。"|4#1314305|1
A374: 10319502 | B374: 32-10美杜莎 | D374: 2 | E374: 30 | F374: 3|1 | G374: "无法觉醒的自我，就如此沉睡于顽石内直到死亡吧。"|4#1314305|1 | H374: =IFERROR(MID(RC[-6],SEARCH("-10",RC[-6])+3,10),IFERROR(MID(RC[-6],SEARCH("-9",RC[-6])+2,10),IFERROR(MID(RC[-6],SEARCH("-8",RC[-6])+2,10),IFERROR(MID(RC[-6],SEARCH("-7",RC[-6])+2,10),IFERROR(MID(RC[-6],SEARCH("-6",RC[-6])+2,10),IFERROR(MID(RC[-6],SEARCH("-5",RC[-6])+2,10),IFERROR(MID(RC[-6],SEARCH("-4",RC[-6])+2,10),IFERROR(MID(RC[-6],SEARCH("-3",RC[-6])+2,10),IFERROR(MID(RC[-6],SEARCH("-2",RC[-6])+2,10),IFERROR(MID(RC[-6],SEARCH("-1",RC[-6])+2,10),IFERROR(MID(RC[-6],SEARCH("-",RC[-6])+1,10),))))))))))) -> 美杜莎 | I374: ="1"&VLOOKUP(RC[-1],Sheet1!R2C2:R127C3,2,FALSE) -> 131430 | J374: 131430 | K374: =IFERROR(FIND(13,RC[-4],1),"") -> 29 | L374: =IF(RC[-1]="","",MID(RC[-5],RC[-1],6)) -> 131430 | M374: =SUBSTITUTE(RC[-6],RC[-1],RC[-3],1) -> "无法觉醒的自我，就如此沉睡于顽石内直到死亡吧。"|4#1314305|1
A375: 10325301 | B375: 33-6半人马 | D375: 1 | E375: 103253|80 | F375: 3|1 | G375: "奔腾的血液，是追逐自由的意志！"|4#1324014|1 | H375: =IFERROR(MID(RC[-6],SEARCH("-10",RC[-6])+3,10),IFERROR(MID(RC[-6],SEARCH("-9",RC[-6])+2,10),IFERROR(MID(RC[-6],SEARCH("-8",RC[-6])+2,10),IFERROR(MID(RC[-6],SEARCH("-7",RC[-6])+2,10),IFERROR(MID(RC[-6],SEARCH("-6",RC[-6])+2,10),IFERROR(MID(RC[-6],SEARCH("-5",RC[-6])+2,10),IFERROR(MID(RC[-6],SEARCH("-4",RC[-6])+2,10),IFERROR(MID(RC[-6],SEARCH("-3",RC[-6])+2,10),IFERROR(MID(RC[-6],SEARCH("-2",RC[-6])+2,10),IFERROR(MID(RC[-6],SEARCH("-1",RC[-6])+2,10),IFERROR(MID(RC[-6],SEARCH("-",RC[-6])+1,10),))))))))))) -> 半人马 | I375: ="1"&VLOOKUP(RC[-1],Sheet1!R2C2:R127C3,2,FALSE) -> 132401 | J375: 132401 | K375: =IFERROR(FIND(13,RC[-4],1),"") -> 21 | L375: =IF(RC[-1]="","",MID(RC[-5],RC[-1],6)) -> 132401 | M375: =SUBSTITUTE(RC[-6],RC[-1],RC[-3],1) -> "奔腾的血液，是追逐自由的意志！"|4#1324014|1
A376: 10325302 | B376: 33-6半人马 | D376: 1 | E376: 103253|50 | F376: 3|1 | G376: "我所失去的……不，我从未拥有过……"|4#1324014|1 | H376: =IFERROR(MID(RC[-6],SEARCH("-10",RC[-6])+3,10),IFERROR(MID(RC[-6],SEARCH("-9",RC[-6])+2,10),IFERROR(MID(RC[-6],SEARCH("-8",RC[-6])+2,10),IFERROR(MID(RC[-6],SEARCH("-7",RC[-6])+2,10),IFERROR(MID(RC[-6],SEARCH("-6",RC[-6])+2,10),IFERROR(MID(RC[-6],SEARCH("-5",RC[-6])+2,10),IFERROR(MID(RC[-6],SEARCH("-4",RC[-6])+2,10),IFERROR(MID(RC[-6],SEARCH("-3",RC[-6])+2,10),IFERROR(MID(RC[-6],SEARCH("-2",RC[-6])+2,10),IFERROR(MID(RC[-6],SEARCH("-1",RC[-6])+2,10),IFERROR(MID(RC[-6],SEARCH("-",RC[-6])+1,10),))))))))))) -> 半人马 | I376: ="1"&VLOOKUP(RC[-1],Sheet1!R2C2:R127C3,2,FALSE) -> 132401 | J376: 132401 | K376: =IFERROR(FIND(13,RC[-4],1),"") -> 23 | L376: =IF(RC[-1]="","",MID(RC[-5],RC[-1],6)) -> 132401 | M376: =SUBSTITUTE(RC[-6],RC[-1],RC[-3],1) -> "我所失去的……不，我从未拥有过……"|4#1324014|1
A377: 10325303 | B377: 33-6半人马 | D377: 1 | E377: 103253|20 | F377: 3|1 | G377: "我也希冀着追逐那样的光芒……"|4#1324014|1 | H377: =IFERROR(MID(RC[-6],SEARCH("-10",RC[-6])+3,10),IFERROR(MID(RC[-6],SEARCH("-9",RC[-6])+2,10),IFERROR(MID(RC[-6],SEARCH("-8",RC[-6])+2,10),IFERROR(MID(RC[-6],SEARCH("-7",RC[-6])+2,10),IFERROR(MID(RC[-6],SEARCH("-6",RC[-6])+2,10),IFERROR(MID(RC[-6],SEARCH("-5",RC[-6])+2,10),IFERROR(MID(RC[-6],SEARCH("-4",RC[-6])+2,10),IFERROR(MID(RC[-6],SEARCH("-3",RC[-6])+2,10),IFERROR(MID(RC[-6],SEARCH("-2",RC[-6])+2,10),IFERROR(MID(RC[-6],SEARCH("-1",RC[-6])+2,10),IFERROR(MID(RC[-6],SEARCH("-",RC[-6])+1,10),))))))))))) -> 半人马 | I377: ="1"&VLOOKUP(RC[-1],Sheet1!R2C2:R127C3,2,FALSE) -> 132401 | J377: 132401 | K377: =IFERROR(FIND(13,RC[-4],1),"") -> 20 | L377: =IF(RC[-1]="","",MID(RC[-5],RC[-1],6)) -> 132401 | M377: =SUBSTITUTE(RC[-6],RC[-1],RC[-3],1) -> "我也希冀着追逐那样的光芒……"|4#1324014|1
A378: 10325304 | B378: 33-6半人马 | D378: 3 | F378: 3 | G378: "只能是奢望吗？……" | H378: =IFERROR(MID(RC[-6],SEARCH("-10",RC[-6])+3,10),IFERROR(MID(RC[-6],SEARCH("-9",RC[-6])+2,10),IFERROR(MID(RC[-6],SEARCH("-8",RC[-6])+2,10),IFERROR(MID(RC[-6],SEARCH("-7",RC[-6])+2,10),IFERROR(MID(RC[-6],SEARCH("-6",RC[-6])+2,10),IFERROR(MID(RC[-6],SEARCH("-5",RC[-6])+2,10),IFERROR(MID(RC[-6],SEARCH("-4",RC[-6])+2,10),IFERROR(MID(RC[-6],SEARCH("-3",RC[-6])+2,10),IFERROR(MID(RC[-6],SEARCH("-2",RC[-6])+2,10),IFERROR(MID(RC[-6],SEARCH("-1",RC[-6])+2,10),IFERROR(MID(RC[-6],SEARCH("-",RC[-6])+1,10),))))))))))) -> 半人马 | I378: ="1"&VLOOKUP(RC[-1],Sheet1!R2C2:R127C3,2,FALSE) -> 132401 | J378: 132401 | K378: =IFERROR(FIND(13,RC[-4],1),"") ->  | L378: =IF(RC[-1]="","",MID(RC[-5],RC[-1],6)) ->  | M378: =SUBSTITUTE(RC[-6],RC[-1],RC[-3],1) -> "只能是奢望吗？……"
A379: 10329301 | B379: 33-10野蛮巨人 | D379: 1 | E379: 103293|80 | F379: 3|4|1 | G379: "愤怒却无济于事，于是我如此存在着——"|3#1#400019|1 | H379: =IFERROR(MID(RC[-6],SEARCH("-10",RC[-6])+3,10),IFERROR(MID(RC[-6],SEARCH("-9",RC[-6])+2,10),IFERROR(MID(RC[-6],SEARCH("-8",RC[-6])+2,10),IFERROR(MID(RC[-6],SEARCH("-7",RC[-6])+2,10),IFERROR(MID(RC[-6],SEARCH("-6",RC[-6])+2,10),IFERROR(MID(RC[-6],SEARCH("-5",RC[-6])+2,10),IFERROR(MID(RC[-6],SEARCH("-4",RC[-6])+2,10),IFERROR(MID(RC[-6],SEARCH("-3",RC[-6])+2,10),IFERROR(MID(RC[-6],SEARCH("-2",RC[-6])+2,10),IFERROR(MID(RC[-6],SEARCH("-1",RC[-6])+2,10),IFERROR(MID(RC[-6],SEARCH("-",RC[-6])+1,10),))))))))))) -> 野蛮巨人 | I379: ="1"&VLOOKUP(RC[-1],Sheet1!R2C2:R127C3,2,FALSE) -> 130410 | J379: 130410 | K379: =IFERROR(FIND(13,RC[-4],1),"") ->  | L379: =IF(RC[-1]="","",MID(RC[-5],RC[-1],6)) ->  | M379: =SUBSTITUTE(RC[-6],RC[-1],RC[-3],1) -> "愤怒却无济于事，于是我如此存在着——"|3#1#400019|1
A380: 10329302 | B380: 33-10野蛮巨人 | D380: 1 | E380: 103293|30 | F380: 3|4|1 | G380: "无可饶恕的，却是……我无法反驳的"|3#1#400019|1 | H380: =IFERROR(MID(RC[-6],SEARCH("-10",RC[-6])+3,10),IFERROR(MID(RC[-6],SEARCH("-9",RC[-6])+2,10),IFERROR(MID(RC[-6],SEARCH("-8",RC[-6])+2,10),IFERROR(MID(RC[-6],SEARCH("-7",RC[-6])+2,10),IFERROR(MID(RC[-6],SEARCH("-6",RC[-6])+2,10),IFERROR(MID(RC[-6],SEARCH("-5",RC[-6])+2,10),IFERROR(MID(RC[-6],SEARCH("-4",RC[-6])+2,10),IFERROR(MID(RC[-6],SEARCH("-3",RC[-6])+2,10),IFERROR(MID(RC[-6],SEARCH("-2",RC[-6])+2,10),IFERROR(MID(RC[-6],SEARCH("-1",RC[-6])+2,10),IFERROR(MID(RC[-6],SEARCH("-",RC[-6])+1,10),))))))))))) -> 野蛮巨人 | I380: ="1"&VLOOKUP(RC[-1],Sheet1!R2C2:R127C3,2,FALSE) -> 130410 | J380: 130410 | K380: =IFERROR(FIND(13,RC[-4],1),"") ->  | L380: =IF(RC[-1]="","",MID(RC[-5],RC[-1],6)) ->  | M380: =SUBSTITUTE(RC[-6],RC[-1],RC[-3],1) -> "无可饶恕的，却是……我无法反驳的"|3#1#400019|1
A381: 10332301 | B381: 34-3地狱骑士 | D381: 1 | E381: 103323|50 | F381: 3|1 | G381: "死吧！！！"|3#1304034|1 | H381: =IFERROR(MID(RC[-6],SEARCH("-10",RC[-6])+3,10),IFERROR(MID(RC[-6],SEARCH("-9",RC[-6])+2,10),IFERROR(MID(RC[-6],SEARCH("-8",RC[-6])+2,10),IFERROR(MID(RC[-6],SEARCH("-7",RC[-6])+2,10),IFERROR(MID(RC[-6],SEARCH("-6",RC[-6])+2,10),IFERROR(MID(RC[-6],SEARCH("-5",RC[-6])+2,10),IFERROR(MID(RC[-6],SEARCH("-4",RC[-6])+2,10),IFERROR(MID(RC[-6],SEARCH("-3",RC[-6])+2,10),IFERROR(MID(RC[-6],SEARCH("-2",RC[-6])+2,10),IFERROR(MID(RC[-6],SEARCH("-1",RC[-6])+2,10),IFERROR(MID(RC[-6],SEARCH("-",RC[-6])+1,10),))))))))))) -> 地狱骑士 | I381: ="1"&VLOOKUP(RC[-1],Sheet1!R2C2:R127C3,2,FALSE) -> 130403 | J381: 130403 | K381: =IFERROR(FIND(13,RC[-4],1),"") -> 11 | L381: =IF(RC[-1]="","",MID(RC[-5],RC[-1],6)) -> 130403 | M381: =SUBSTITUTE(RC[-6],RC[-1],RC[-3],1) -> "死吧！！！"|3#1304034|1
A382: 10332302 | B382: 34-3地狱骑士 | C382: 2 | D382: 4 | F382: 3|1 | G382: "死亡重复死亡，接受审判吧！"|3#1304034|1 | H382: =IFERROR(MID(RC[-6],SEARCH("-10",RC[-6])+3,10),IFERROR(MID(RC[-6],SEARCH("-9",RC[-6])+2,10),IFERROR(MID(RC[-6],SEARCH("-8",RC[-6])+2,10),IFERROR(MID(RC[-6],SEARCH("-7",RC[-6])+2,10),IFERROR(MID(RC[-6],SEARCH("-6",RC[-6])+2,10),IFERROR(MID(RC[-6],SEARCH("-5",RC[-6])+2,10),IFERROR(MID(RC[-6],SEARCH("-4",RC[-6])+2,10),IFERROR(MID(RC[-6],SEARCH("-3",RC[-6])+2,10),IFERROR(MID(RC[-6],SEARCH("-2",RC[-6])+2,10),IFERROR(MID(RC[-6],SEARCH("-1",RC[-6])+2,10),IFERROR(MID(RC[-6],SEARCH("-",RC[-6])+1,10),))))))))))) -> 地狱骑士 | I382: ="1"&VLOOKUP(RC[-1],Sheet1!R2C2:R127C3,2,FALSE) -> 130403 | J382: 130403 | K382: =IFERROR(FIND(13,RC[-4],1),"") -> 19 | L382: =IF(RC[-1]="","",MID(RC[-5],RC[-1],6)) -> 130403 | M382: =SUBSTITUTE(RC[-6],RC[-1],RC[-3],1) -> "死亡重复死亡，接受审判吧！"|3#1304034|1
A383: 10338401 | B383: 34-9四爪博士 | D383: 2 | E383: 25 | F383: 3|1 | G383: "迎接死亡！！"|3#1309994|1 | H383: =IFERROR(MID(RC[-6],SEARCH("-10",RC[-6])+3,10),IFERROR(MID(RC[-6],SEARCH("-9",RC[-6])+2,10),IFERROR(MID(RC[-6],SEARCH("-8",RC[-6])+2,10),IFERROR(MID(RC[-6],SEARCH("-7",RC[-6])+2,10),IFERROR(MID(RC[-6],SEARCH("-6",RC[-6])+2,10),IFERROR(MID(RC[-6],SEARCH("-5",RC[-6])+2,10),IFERROR(MID(RC[-6],SEARCH("-4",RC[-6])+2,10),IFERROR(MID(RC[-6],SEARCH("-3",RC[-6])+2,10),IFERROR(MID(RC[-6],SEARCH("-2",RC[-6])+2,10),IFERROR(MID(RC[-6],SEARCH("-1",RC[-6])+2,10),IFERROR(MID(RC[-6],SEARCH("-",RC[-6])+1,10),))))))))))) -> 四爪博士 | I383: ="1"&VLOOKUP(RC[-1],Sheet1!R2C2:R127C3,2,FALSE) -> 130999 | J383: 130999 | K383: =IFERROR(FIND(13,RC[-4],1),"") -> 12 | L383: =IF(RC[-1]="","",MID(RC[-5],RC[-1],6)) -> 130999 | M383: =SUBSTITUTE(RC[-6],RC[-1],RC[-3],1) -> "迎接死亡！！"|3#1309994|1
A384: 10338402 | B384: 34-9四爪博士 | D384: 1 | E384: 103384|70 | F384: 3|1 | G384: "你们的存在就是我们的阻碍，无关对错！"|3#1309994|1 | H384: =IFERROR(MID(RC[-6],SEARCH("-10",RC[-6])+3,10),IFERROR(MID(RC[-6],SEARCH("-9",RC[-6])+2,10),IFERROR(MID(RC[-6],SEARCH("-8",RC[-6])+2,10),IFERROR(MID(RC[-6],SEARCH("-7",RC[-6])+2,10),IFERROR(MID(RC[-6],SEARCH("-6",RC[-6])+2,10),IFERROR(MID(RC[-6],SEARCH("-5",RC[-6])+2,10),IFERROR(MID(RC[-6],SEARCH("-4",RC[-6])+2,10),IFERROR(MID(RC[-6],SEARCH("-3",RC[-6])+2,10),IFERROR(MID(RC[-6],SEARCH("-2",RC[-6])+2,10),IFERROR(MID(RC[-6],SEARCH("-1",RC[-6])+2,10),IFERROR(MID(RC[-6],SEARCH("-",RC[-6])+1,10),))))))))))) -> 四爪博士 | I384: ="1"&VLOOKUP(RC[-1],Sheet1!R2C2:R127C3,2,FALSE) -> 130999 | J384: 130999 | K384: =IFERROR(FIND(13,RC[-4],1),"") -> 24 | L384: =IF(RC[-1]="","",MID(RC[-5],RC[-1],6)) -> 130999 | M384: =SUBSTITUTE(RC[-6],RC[-1],RC[-3],1) -> "你们的存在就是我们的阻碍，无关对错！"|3#1309994|1
A385: 10338403 | B385: 34-9四爪博士 | D385: 1 | E385: 103384|30 | F385: 3|1 | G385: "妨碍我的，都必须死！"|3#1309994|1 | H385: =IFERROR(MID(RC[-6],SEARCH("-10",RC[-6])+3,10),IFERROR(MID(RC[-6],SEARCH("-9",RC[-6])+2,10),IFERROR(MID(RC[-6],SEARCH("-8",RC[-6])+2,10),IFERROR(MID(RC[-6],SEARCH("-7",RC[-6])+2,10),IFERROR(MID(RC[-6],SEARCH("-6",RC[-6])+2,10),IFERROR(MID(RC[-6],SEARCH("-5",RC[-6])+2,10),IFERROR(MID(RC[-6],SEARCH("-4",RC[-6])+2,10),IFERROR(MID(RC[-6],SEARCH("-3",RC[-6])+2,10),IFERROR(MID(RC[-6],SEARCH("-2",RC[-6])+2,10),IFERROR(MID(RC[-6],SEARCH("-1",RC[-6])+2,10),IFERROR(MID(RC[-6],SEARCH("-",RC[-6])+1,10),))))))))))) -> 四爪博士 | I385: ="1"&VLOOKUP(RC[-1],Sheet1!R2C2:R127C3,2,FALSE) -> 130999 | J385: 130999 | K385: =IFERROR(FIND(13,RC[-4],1),"") -> 16 | L385: =IF(RC[-1]="","",MID(RC[-5],RC[-1],6)) -> 130999 | M385: =SUBSTITUTE(RC[-6],RC[-1],RC[-3],1) -> "妨碍我的，都必须死！"|3#1309994|1
A386: 10339401 | B386: 34-10战争主宰 | D386: 2 | E386: 15 | F386: 3|1 | G386: "消灭——"|3#400044|1 | H386: =IFERROR(MID(RC[-6],SEARCH("-10",RC[-6])+3,10),IFERROR(MID(RC[-6],SEARCH("-9",RC[-6])+2,10),IFERROR(MID(RC[-6],SEARCH("-8",RC[-6])+2,10),IFERROR(MID(RC[-6],SEARCH("-7",RC[-6])+2,10),IFERROR(MID(RC[-6],SEARCH("-6",RC[-6])+2,10),IFERROR(MID(RC[-6],SEARCH("-5",RC[-6])+2,10),IFERROR(MID(RC[-6],SEARCH("-4",RC[-6])+2,10),IFERROR(MID(RC[-6],SEARCH("-3",RC[-6])+2,10),IFERROR(MID(RC[-6],SEARCH("-2",RC[-6])+2,10),IFERROR(MID(RC[-6],SEARCH("-1",RC[-6])+2,10),IFERROR(MID(RC[-6],SEARCH("-",RC[-6])+1,10),))))))))))) -> 战争主宰 | I386: ="1"&VLOOKUP(RC[-1],Sheet1!R2C2:R127C3,2,FALSE) -> 133998 | J386: 133998 | K386: =IFERROR(FIND(13,RC[-4],1),"") ->  | L386: =IF(RC[-1]="","",MID(RC[-5],RC[-1],6)) ->  | M386: =SUBSTITUTE(RC[-6],RC[-1],RC[-3],1) -> "消灭——"|3#400044|1
A387: 10339402 | B387: 34-10战争主宰 | D387: 2 | E387: 25 | F387: 3|1 | G387: "死亡——"|3#400044|1 | H387: =IFERROR(MID(RC[-6],SEARCH("-10",RC[-6])+3,10),IFERROR(MID(RC[-6],SEARCH("-9",RC[-6])+2,10),IFERROR(MID(RC[-6],SEARCH("-8",RC[-6])+2,10),IFERROR(MID(RC[-6],SEARCH("-7",RC[-6])+2,10),IFERROR(MID(RC[-6],SEARCH("-6",RC[-6])+2,10),IFERROR(MID(RC[-6],SEARCH("-5",RC[-6])+2,10),IFERROR(MID(RC[-6],SEARCH("-4",RC[-6])+2,10),IFERROR(MID(RC[-6],SEARCH("-3",RC[-6])+2,10),IFERROR(MID(RC[-6],SEARCH("-2",RC[-6])+2,10),IFERROR(MID(RC[-6],SEARCH("-1",RC[-6])+2,10),IFERROR(MID(RC[-6],SEARCH("-",RC[-6])+1,10),))))))))))) -> 战争主宰 | I387: ="1"&VLOOKUP(RC[-1],Sheet1!R2C2:R127C3,2,FALSE) -> 133998 | J387: 133998 | K387: =IFERROR(FIND(13,RC[-4],1),"") ->  | L387: =IF(RC[-1]="","",MID(RC[-5],RC[-1],6)) ->  | M387: =SUBSTITUTE(RC[-6],RC[-1],RC[-3],1) -> "死亡——"|3#400044|1
A388: 10339403 | B388: 34-10战争主宰 | D388: 2 | E388: 35 | F388: 3|1 | G388: "毁灭——"|3#400044|1 | H388: =IFERROR(MID(RC[-6],SEARCH("-10",RC[-6])+3,10),IFERROR(MID(RC[-6],SEARCH("-9",RC[-6])+2,10),IFERROR(MID(RC[-6],SEARCH("-8",RC[-6])+2,10),IFERROR(MID(RC[-6],SEARCH("-7",RC[-6])+2,10),IFERROR(MID(RC[-6],SEARCH("-6",RC[-6])+2,10),IFERROR(MID(RC[-6],SEARCH("-5",RC[-6])+2,10),IFERROR(MID(RC[-6],SEARCH("-4",RC[-6])+2,10),IFERROR(MID(RC[-6],SEARCH("-3",RC[-6])+2,10),IFERROR(MID(RC[-6],SEARCH("-2",RC[-6])+2,10),IFERROR(MID(RC[-6],SEARCH("-1",RC[-6])+2,10),IFERROR(MID(RC[-6],SEARCH("-",RC[-6])+1,10),))))))))))) -> 战争主宰 | I388: ="1"&VLOOKUP(RC[-1],Sheet1!R2C2:R127C3,2,FALSE) -> 133998 | J388: 133998 | K388: =IFERROR(FIND(13,RC[-4],1),"") ->  | L388: =IF(RC[-1]="","",MID(RC[-5],RC[-1],6)) ->  | M388: =SUBSTITUTE(RC[-6],RC[-1],RC[-3],1) -> "毁灭——"|3#400044|1
A389: 10339404 | B389: 34-10战争主宰 | D389: 2 | E389: 45 | F389: 3|1 | G389: "不复存在——！！！"|3#400044|1 | H389: =IFERROR(MID(RC[-6],SEARCH("-10",RC[-6])+3,10),IFERROR(MID(RC[-6],SEARCH("-9",RC[-6])+2,10),IFERROR(MID(RC[-6],SEARCH("-8",RC[-6])+2,10),IFERROR(MID(RC[-6],SEARCH("-7",RC[-6])+2,10),IFERROR(MID(RC[-6],SEARCH("-6",RC[-6])+2,10),IFERROR(MID(RC[-6],SEARCH("-5",RC[-6])+2,10),IFERROR(MID(RC[-6],SEARCH("-4",RC[-6])+2,10),IFERROR(MID(RC[-6],SEARCH("-3",RC[-6])+2,10),IFERROR(MID(RC[-6],SEARCH("-2",RC[-6])+2,10),IFERROR(MID(RC[-6],SEARCH("-1",RC[-6])+2,10),IFERROR(MID(RC[-6],SEARCH("-",RC[-6])+1,10),))))))))))) -> 战争主宰 | I389: ="1"&VLOOKUP(RC[-1],Sheet1!R2C2:R127C3,2,FALSE) -> 133998 | J389: 133998 | K389: =IFERROR(FIND(13,RC[-4],1),"") ->  | L389: =IF(RC[-1]="","",MID(RC[-5],RC[-1],6)) ->  | M389: =SUBSTITUTE(RC[-6],RC[-1],RC[-3],1) -> "不复存在——！！！"|3#400044|1
A390: 10345301 | B390: 35-6石头人 | D390: 1 | E390: 103453|70 | F390: 3|1 | G390: "坚如磐石……！"|2#400015|2 | H390: =IFERROR(MID(RC[-6],SEARCH("-10",RC[-6])+3,10),IFERROR(MID(RC[-6],SEARCH("-9",RC[-6])+2,10),IFERROR(MID(RC[-6],SEARCH("-8",RC[-6])+2,10),IFERROR(MID(RC[-6],SEARCH("-7",RC[-6])+2,10),IFERROR(MID(RC[-6],SEARCH("-6",RC[-6])+2,10),IFERROR(MID(RC[-6],SEARCH("-5",RC[-6])+2,10),IFERROR(MID(RC[-6],SEARCH("-4",RC[-6])+2,10),IFERROR(MID(RC[-6],SEARCH("-3",RC[-6])+2,10),IFERROR(MID(RC[-6],SEARCH("-2",RC[-6])+2,10),IFERROR(MID(RC[-6],SEARCH("-1",RC[-6])+2,10),IFERROR(MID(RC[-6],SEARCH("-",RC[-6])+1,10),))))))))))) -> 石头人 | I390: ="1"&VLOOKUP(RC[-1],Sheet1!R2C2:R127C3,2,FALSE) -> 132311 | J390: 132311 | K390: =IFERROR(FIND(13,RC[-4],1),"") ->  | L390: =IF(RC[-1]="","",MID(RC[-5],RC[-1],6)) ->  | M390: =SUBSTITUTE(RC[-6],RC[-1],RC[-3],1) -> "坚如磐石……！"|2#400015|2
A391: 10345302 | B391: 35-6石头人 | D391: 1 | E391: 103453|30 | F391: 3|1 | G391: "不会倒下！！！"|2#400015|2 | H391: =IFERROR(MID(RC[-6],SEARCH("-10",RC[-6])+3,10),IFERROR(MID(RC[-6],SEARCH("-9",RC[-6])+2,10),IFERROR(MID(RC[-6],SEARCH("-8",RC[-6])+2,10),IFERROR(MID(RC[-6],SEARCH("-7",RC[-6])+2,10),IFERROR(MID(RC[-6],SEARCH("-6",RC[-6])+2,10),IFERROR(MID(RC[-6],SEARCH("-5",RC[-6])+2,10),IFERROR(MID(RC[-6],SEARCH("-4",RC[-6])+2,10),IFERROR(MID(RC[-6],SEARCH("-3",RC[-6])+2,10),IFERROR(MID(RC[-6],SEARCH("-2",RC[-6])+2,10),IFERROR(MID(RC[-6],SEARCH("-1",RC[-6])+2,10),IFERROR(MID(RC[-6],SEARCH("-",RC[-6])+1,10),))))))))))) -> 石头人 | I391: ="1"&VLOOKUP(RC[-1],Sheet1!R2C2:R127C3,2,FALSE) -> 132311 | J391: 132311 | K391: =IFERROR(FIND(13,RC[-4],1),"") ->  | L391: =IF(RC[-1]="","",MID(RC[-5],RC[-1],6)) ->  | M391: =SUBSTITUTE(RC[-6],RC[-1],RC[-3],1) -> "不会倒下！！！"|2#400015|2
A392: 10345303 | B392: 35-6石头人 | C392: 0 | D392: 5 | E392: 100 | F392: 3|1 | G392: "大地的愤怒！"|2#1323114|0 | H392: =IFERROR(MID(RC[-6],SEARCH("-10",RC[-6])+3,10),IFERROR(MID(RC[-6],SEARCH("-9",RC[-6])+2,10),IFERROR(MID(RC[-6],SEARCH("-8",RC[-6])+2,10),IFERROR(MID(RC[-6],SEARCH("-7",RC[-6])+2,10),IFERROR(MID(RC[-6],SEARCH("-6",RC[-6])+2,10),IFERROR(MID(RC[-6],SEARCH("-5",RC[-6])+2,10),IFERROR(MID(RC[-6],SEARCH("-4",RC[-6])+2,10),IFERROR(MID(RC[-6],SEARCH("-3",RC[-6])+2,10),IFERROR(MID(RC[-6],SEARCH("-2",RC[-6])+2,10),IFERROR(MID(RC[-6],SEARCH("-1",RC[-6])+2,10),IFERROR(MID(RC[-6],SEARCH("-",RC[-6])+1,10),))))))))))) -> 石头人 | I392: ="1"&VLOOKUP(RC[-1],Sheet1!R2C2:R127C3,2,FALSE) -> 132311 | J392: 132311 | K392: =IFERROR(FIND(13,RC[-4],1),"") -> 12 | L392: =IF(RC[-1]="","",MID(RC[-5],RC[-1],6)) -> 132311 | M392: =SUBSTITUTE(RC[-6],RC[-1],RC[-3],1) -> "大地的愤怒！"|2#1323114|0
A393: 10349501 | B393: 35-10阿努比斯 | D393: 1 | E393: 103495|80 | F393: 3|1 | G393: "神灵不容亵渎——"|2#1314084|1 | H393: =IFERROR(MID(RC[-6],SEARCH("-10",RC[-6])+3,10),IFERROR(MID(RC[-6],SEARCH("-9",RC[-6])+2,10),IFERROR(MID(RC[-6],SEARCH("-8",RC[-6])+2,10),IFERROR(MID(RC[-6],SEARCH("-7",RC[-6])+2,10),IFERROR(MID(RC[-6],SEARCH("-6",RC[-6])+2,10),IFERROR(MID(RC[-6],SEARCH("-5",RC[-6])+2,10),IFERROR(MID(RC[-6],SEARCH("-4",RC[-6])+2,10),IFERROR(MID(RC[-6],SEARCH("-3",RC[-6])+2,10),IFERROR(MID(RC[-6],SEARCH("-2",RC[-6])+2,10),IFERROR(MID(RC[-6],SEARCH("-1",RC[-6])+2,10),IFERROR(MID(RC[-6],SEARCH("-",RC[-6])+1,10),))))))))))) -> 阿努比斯 | I393: ="1"&VLOOKUP(RC[-1],Sheet1!R2C2:R127C3,2,FALSE) -> 131408 | J393: 131408 | K393: =IFERROR(FIND(13,RC[-4],1),"") -> 14 | L393: =IF(RC[-1]="","",MID(RC[-5],RC[-1],6)) -> 131408 | M393: =SUBSTITUTE(RC[-6],RC[-1],RC[-3],1) -> "神灵不容亵渎——"|2#1314084|1
A394: 10349502 | B394: 35-10阿努比斯 | D394: 1 | E394: 103495|50 | F394: 3|1 | G394: "该死的——"|2#1314084|1 | H394: =IFERROR(MID(RC[-6],SEARCH("-10",RC[-6])+3,10),IFERROR(MID(RC[-6],SEARCH("-9",RC[-6])+2,10),IFERROR(MID(RC[-6],SEARCH("-8",RC[-6])+2,10),IFERROR(MID(RC[-6],SEARCH("-7",RC[-6])+2,10),IFERROR(MID(RC[-6],SEARCH("-6",RC[-6])+2,10),IFERROR(MID(RC[-6],SEARCH("-5",RC[-6])+2,10),IFERROR(MID(RC[-6],SEARCH("-4",RC[-6])+2,10),IFERROR(MID(RC[-6],SEARCH("-3",RC[-6])+2,10),IFERROR(MID(RC[-6],SEARCH("-2",RC[-6])+2,10),IFERROR(MID(RC[-6],SEARCH("-1",RC[-6])+2,10),IFERROR(MID(RC[-6],SEARCH("-",RC[-6])+1,10),))))))))))) -> 阿努比斯 | I394: ="1"&VLOOKUP(RC[-1],Sheet1!R2C2:R127C3,2,FALSE) -> 131408 | J394: 131408 | K394: =IFERROR(FIND(13,RC[-4],1),"") -> 11 | L394: =IF(RC[-1]="","",MID(RC[-5],RC[-1],6)) -> 131408 | M394: =SUBSTITUTE(RC[-6],RC[-1],RC[-3],1) -> "该死的——"|2#1314084|1
A395: 10349503 | B395: 35-10阿努比斯 | D395: 1 | E395: 103495|20 | F395: 3|1 | G395: "堕落？那也无法控制神灵！"|2#1314084|1 | H395: =IFERROR(MID(RC[-6],SEARCH("-10",RC[-6])+3,10),IFERROR(MID(RC[-6],SEARCH("-9",RC[-6])+2,10),IFERROR(MID(RC[-6],SEARCH("-8",RC[-6])+2,10),IFERROR(MID(RC[-6],SEARCH("-7",RC[-6])+2,10),IFERROR(MID(RC[-6],SEARCH("-6",RC[-6])+2,10),IFERROR(MID(RC[-6],SEARCH("-5",RC[-6])+2,10),IFERROR(MID(RC[-6],SEARCH("-4",RC[-6])+2,10),IFERROR(MID(RC[-6],SEARCH("-3",RC[-6])+2,10),IFERROR(MID(RC[-6],SEARCH("-2",RC[-6])+2,10),IFERROR(MID(RC[-6],SEARCH("-1",RC[-6])+2,10),IFERROR(MID(RC[-6],SEARCH("-",RC[-6])+1,10),))))))))))) -> 阿努比斯 | I395: ="1"&VLOOKUP(RC[-1],Sheet1!R2C2:R127C3,2,FALSE) -> 131408 | J395: 131408 | K395: =IFERROR(FIND(13,RC[-4],1),"") -> 18 | L395: =IF(RC[-1]="","",MID(RC[-5],RC[-1],6)) -> 131408 | M395: =SUBSTITUTE(RC[-6],RC[-1],RC[-3],1) -> "堕落？那也无法控制神灵！"|2#1314084|1
A396: 10349504 | B396: 35-10阿努比斯 | D396: 2 | E396: 4.5 | F396: 2 | G396: 103495|400043|2 | H396: =IFERROR(MID(RC[-6],SEARCH("-10",RC[-6])+3,10),IFERROR(MID(RC[-6],SEARCH("-9",RC[-6])+2,10),IFERROR(MID(RC[-6],SEARCH("-8",RC[-6])+2,10),IFERROR(MID(RC[-6],SEARCH("-7",RC[-6])+2,10),IFERROR(MID(RC[-6],SEARCH("-6",RC[-6])+2,10),IFERROR(MID(RC[-6],SEARCH("-5",RC[-6])+2,10),IFERROR(MID(RC[-6],SEARCH("-4",RC[-6])+2,10),IFERROR(MID(RC[-6],SEARCH("-3",RC[-6])+2,10),IFERROR(MID(RC[-6],SEARCH("-2",RC[-6])+2,10),IFERROR(MID(RC[-6],SEARCH("-1",RC[-6])+2,10),IFERROR(MID(RC[-6],SEARCH("-",RC[-6])+1,10),))))))))))) -> 阿努比斯 | I396: ="1"&VLOOKUP(RC[-1],Sheet1!R2C2:R127C3,2,FALSE) -> 131408 | J396: 131408 | K396: =IFERROR(FIND(13,RC[-4],1),"") ->  | L396: =IF(RC[-1]="","",MID(RC[-5],RC[-1],6)) ->  | M396: =SUBSTITUTE(RC[-6],RC[-1],RC[-3],1) -> 103495|400043|2
A397: 10355501 | B397: 36-6鹰眸 | D397: 1 | E397: 103555|90 | F397: 3|1 | G397: "我的箭指着你的心脏"|3#1304204|1 | H397: =IFERROR(MID(RC[-6],SEARCH("-10",RC[-6])+3,10),IFERROR(MID(RC[-6],SEARCH("-9",RC[-6])+2,10),IFERROR(MID(RC[-6],SEARCH("-8",RC[-6])+2,10),IFERROR(MID(RC[-6],SEARCH("-7",RC[-6])+2,10),IFERROR(MID(RC[-6],SEARCH("-6",RC[-6])+2,10),IFERROR(MID(RC[-6],SEARCH("-5",RC[-6])+2,10),IFERROR(MID(RC[-6],SEARCH("-4",RC[-6])+2,10),IFERROR(MID(RC[-6],SEARCH("-3",RC[-6])+2,10),IFERROR(MID(RC[-6],SEARCH("-2",RC[-6])+2,10),IFERROR(MID(RC[-6],SEARCH("-1",RC[-6])+2,10),IFERROR(MID(RC[-6],SEARCH("-",RC[-6])+1,10),))))))))))) -> 鹰眸 | I397: ="1"&VLOOKUP(RC[-1],Sheet1!R2C2:R127C3,2,FALSE) -> 130420 | J397: 130420 | K397: =IFERROR(FIND(13,RC[-4],1),"") -> 15 | L397: =IF(RC[-1]="","",MID(RC[-5],RC[-1],6)) -> 130420 | M397: =SUBSTITUTE(RC[-6],RC[-1],RC[-3],1) -> "我的箭指着你的心脏"|3#1304204|1
A398: 10355502 | B398: 36-6鹰眸 | D398: 1 | E398: 103555|60 | F398: 3|1 | G398: "你们无处可躲"|3#1304204|1 | H398: =IFERROR(MID(RC[-6],SEARCH("-10",RC[-6])+3,10),IFERROR(MID(RC[-6],SEARCH("-9",RC[-6])+2,10),IFERROR(MID(RC[-6],SEARCH("-8",RC[-6])+2,10),IFERROR(MID(RC[-6],SEARCH("-7",RC[-6])+2,10),IFERROR(MID(RC[-6],SEARCH("-6",RC[-6])+2,10),IFERROR(MID(RC[-6],SEARCH("-5",RC[-6])+2,10),IFERROR(MID(RC[-6],SEARCH("-4",RC[-6])+2,10),IFERROR(MID(RC[-6],SEARCH("-3",RC[-6])+2,10),IFERROR(MID(RC[-6],SEARCH("-2",RC[-6])+2,10),IFERROR(MID(RC[-6],SEARCH("-1",RC[-6])+2,10),IFERROR(MID(RC[-6],SEARCH("-",RC[-6])+1,10),))))))))))) -> 鹰眸 | I398: ="1"&VLOOKUP(RC[-1],Sheet1!R2C2:R127C3,2,FALSE) -> 130420 | J398: 130420 | K398: =IFERROR(FIND(13,RC[-4],1),"") -> 12 | L398: =IF(RC[-1]="","",MID(RC[-5],RC[-1],6)) -> 130420 | M398: =SUBSTITUTE(RC[-6],RC[-1],RC[-3],1) -> "你们无处可躲"|3#1304204|1
A399: 10355503 | B399: 36-6鹰眸 | D399: 1 | E399: 103555|30 | F399: 3|1 | G399: "愿我们再也不见"|3#1304204|1 | H399: =IFERROR(MID(RC[-6],SEARCH("-10",RC[-6])+3,10),IFERROR(MID(RC[-6],SEARCH("-9",RC[-6])+2,10),IFERROR(MID(RC[-6],SEARCH("-8",RC[-6])+2,10),IFERROR(MID(RC[-6],SEARCH("-7",RC[-6])+2,10),IFERROR(MID(RC[-6],SEARCH("-6",RC[-6])+2,10),IFERROR(MID(RC[-6],SEARCH("-5",RC[-6])+2,10),IFERROR(MID(RC[-6],SEARCH("-4",RC[-6])+2,10),IFERROR(MID(RC[-6],SEARCH("-3",RC[-6])+2,10),IFERROR(MID(RC[-6],SEARCH("-2",RC[-6])+2,10),IFERROR(MID(RC[-6],SEARCH("-1",RC[-6])+2,10),IFERROR(MID(RC[-6],SEARCH("-",RC[-6])+1,10),))))))))))) -> 鹰眸 | I399: ="1"&VLOOKUP(RC[-1],Sheet1!R2C2:R127C3,2,FALSE) -> 130420 | J399: 130420 | K399: =IFERROR(FIND(13,RC[-4],1),"") -> 13 | L399: =IF(RC[-1]="","",MID(RC[-5],RC[-1],6)) -> 130420 | M399: =SUBSTITUTE(RC[-6],RC[-1],RC[-3],1) -> "愿我们再也不见"|3#1304204|1
A400: 10359501 | B400: 36-10红颅鬼 | D400: 2 | E400: 15 | F400: 3|1 | G400: "你们的时间到了"|3#400046|1 | H400: =IFERROR(MID(RC[-6],SEARCH("-10",RC[-6])+3,10),IFERROR(MID(RC[-6],SEARCH("-9",RC[-6])+2,10),IFERROR(MID(RC[-6],SEARCH("-8",RC[-6])+2,10),IFERROR(MID(RC[-6],SEARCH("-7",RC[-6])+2,10),IFERROR(MID(RC[-6],SEARCH("-6",RC[-6])+2,10),IFERROR(MID(RC[-6],SEARCH("-5",RC[-6])+2,10),IFERROR(MID(RC[-6],SEARCH("-4",RC[-6])+2,10),IFERROR(MID(RC[-6],SEARCH("-3",RC[-6])+2,10),IFERROR(MID(RC[-6],SEARCH("-2",RC[-6])+2,10),IFERROR(MID(RC[-6],SEARCH("-1",RC[-6])+2,10),IFERROR(MID(RC[-6],SEARCH("-",RC[-6])+1,10),))))))))))) -> 红颅鬼 | I400: ="1"&VLOOKUP(RC[-1],Sheet1!R2C2:R127C3,2,FALSE) -> 130998 | J400: 130430 | K400: =IFERROR(FIND(13,RC[-4],1),"") ->  | L400: =IF(RC[-1]="","",MID(RC[-5],RC[-1],6)) ->  | M400: =SUBSTITUTE(RC[-6],RC[-1],RC[-3],1) -> "你们的时间到了"|3#400046|1
A401: 10359502 | B401: 36-10红颅鬼 | D401: 2 | E401: 25 | F401: 3|1 | G401: "你们的时间到了"|3#400046|1 | H401: =IFERROR(MID(RC[-6],SEARCH("-10",RC[-6])+3,10),IFERROR(MID(RC[-6],SEARCH("-9",RC[-6])+2,10),IFERROR(MID(RC[-6],SEARCH("-8",RC[-6])+2,10),IFERROR(MID(RC[-6],SEARCH("-7",RC[-6])+2,10),IFERROR(MID(RC[-6],SEARCH("-6",RC[-6])+2,10),IFERROR(MID(RC[-6],SEARCH("-5",RC[-6])+2,10),IFERROR(MID(RC[-6],SEARCH("-4",RC[-6])+2,10),IFERROR(MID(RC[-6],SEARCH("-3",RC[-6])+2,10),IFERROR(MID(RC[-6],SEARCH("-2",RC[-6])+2,10),IFERROR(MID(RC[-6],SEARCH("-1",RC[-6])+2,10),IFERROR(MID(RC[-6],SEARCH("-",RC[-6])+1,10),))))))))))) -> 红颅鬼 | I401: ="1"&VLOOKUP(RC[-1],Sheet1!R2C2:R127C3,2,FALSE) -> 130998 | J401: 130430 | K401: =IFERROR(FIND(13,RC[-4],1),"") ->  | L401: =IF(RC[-1]="","",MID(RC[-5],RC[-1],6)) ->  | M401: =SUBSTITUTE(RC[-6],RC[-1],RC[-3],1) -> "你们的时间到了"|3#400046|1
A402: 10359503 | B402: 36-10红颅鬼 | D402: 2 | E402: 35 | F402: 3|1 | G402: "你们的时间到了"|3#400046|1 | H402: =IFERROR(MID(RC[-6],SEARCH("-10",RC[-6])+3,10),IFERROR(MID(RC[-6],SEARCH("-9",RC[-6])+2,10),IFERROR(MID(RC[-6],SEARCH("-8",RC[-6])+2,10),IFERROR(MID(RC[-6],SEARCH("-7",RC[-6])+2,10),IFERROR(MID(RC[-6],SEARCH("-6",RC[-6])+2,10),IFERROR(MID(RC[-6],SEARCH("-5",RC[-6])+2,10),IFERROR(MID(RC[-6],SEARCH("-4",RC[-6])+2,10),IFERROR(MID(RC[-6],SEARCH("-3",RC[-6])+2,10),IFERROR(MID(RC[-6],SEARCH("-2",RC[-6])+2,10),IFERROR(MID(RC[-6],SEARCH("-1",RC[-6])+2,10),IFERROR(MID(RC[-6],SEARCH("-",RC[-6])+1,10),))))))))))) -> 红颅鬼 | I402: ="1"&VLOOKUP(RC[-1],Sheet1!R2C2:R127C3,2,FALSE) -> 130998 | J402: 130430 | K402: =IFERROR(FIND(13,RC[-4],1),"") ->  | L402: =IF(RC[-1]="","",MID(RC[-5],RC[-1],6)) ->  | M402: =SUBSTITUTE(RC[-6],RC[-1],RC[-3],1) -> "你们的时间到了"|3#400046|1
A403: 10365501 | B403: 37-6圣女贞德 | D403: 2 | E403: 25 | F403: 3|1 | G403: "神游走于时间长河，不会放弃任何一人"|3#1314404|1 | H403: =IFERROR(MID(RC[-6],SEARCH("-10",RC[-6])+3,10),IFERROR(MID(RC[-6],SEARCH("-9",RC[-6])+2,10),IFERROR(MID(RC[-6],SEARCH("-8",RC[-6])+2,10),IFERROR(MID(RC[-6],SEARCH("-7",RC[-6])+2,10),IFERROR(MID(RC[-6],SEARCH("-6",RC[-6])+2,10),IFERROR(MID(RC[-6],SEARCH("-5",RC[-6])+2,10),IFERROR(MID(RC[-6],SEARCH("-4",RC[-6])+2,10),IFERROR(MID(RC[-6],SEARCH("-3",RC[-6])+2,10),IFERROR(MID(RC[-6],SEARCH("-2",RC[-6])+2,10),IFERROR(MID(RC[-6],SEARCH("-1",RC[-6])+2,10),IFERROR(MID(RC[-6],SEARCH("-",RC[-6])+1,10),))))))))))) -> 圣女贞德 | I403: ="1"&VLOOKUP(RC[-1],Sheet1!R2C2:R127C3,2,FALSE) -> 131440 | J403: 131440 | K403: =IFERROR(FIND(13,RC[-4],1),"") -> 23 | L403: =IF(RC[-1]="","",MID(RC[-5],RC[-1],6)) -> 131440 | M403: =SUBSTITUTE(RC[-6],RC[-1],RC[-3],1) -> "神游走于时间长河，不会放弃任何一人"|3#1314404|1
A404: 10365502 | B404: 37-6圣女贞德 | D404: 1 | E404: 103655|50 | F404: 3|1 | G404: "展开吧！"|3#1314404|1 | H404: =IFERROR(MID(RC[-6],SEARCH("-10",RC[-6])+3,10),IFERROR(MID(RC[-6],SEARCH("-9",RC[-6])+2,10),IFERROR(MID(RC[-6],SEARCH("-8",RC[-6])+2,10),IFERROR(MID(RC[-6],SEARCH("-7",RC[-6])+2,10),IFERROR(MID(RC[-6],SEARCH("-6",RC[-6])+2,10),IFERROR(MID(RC[-6],SEARCH("-5",RC[-6])+2,10),IFERROR(MID(RC[-6],SEARCH("-4",RC[-6])+2,10),IFERROR(MID(RC[-6],SEARCH("-3",RC[-6])+2,10),IFERROR(MID(RC[-6],SEARCH("-2",RC[-6])+2,10),IFERROR(MID(RC[-6],SEARCH("-1",RC[-6])+2,10),IFERROR(MID(RC[-6],SEARCH("-",RC[-6])+1,10),))))))))))) -> 圣女贞德 | I404: ="1"&VLOOKUP(RC[-1],Sheet1!R2C2:R127C3,2,FALSE) -> 131440 | J404: 131440 | K404: =IFERROR(FIND(13,RC[-4],1),"") -> 10 | L404: =IF(RC[-1]="","",MID(RC[-5],RC[-1],6)) -> 131440 | M404: =SUBSTITUTE(RC[-6],RC[-1],RC[-3],1) -> "展开吧！"|3#1314404|1
A405: 10365503 | B405: 37-6圣女贞德 | D405: 4 | F405: 3|1 | G405: "随我前进！"|3#1314404|1 | H405: =IFERROR(MID(RC[-6],SEARCH("-10",RC[-6])+3,10),IFERROR(MID(RC[-6],SEARCH("-9",RC[-6])+2,10),IFERROR(MID(RC[-6],SEARCH("-8",RC[-6])+2,10),IFERROR(MID(RC[-6],SEARCH("-7",RC[-6])+2,10),IFERROR(MID(RC[-6],SEARCH("-6",RC[-6])+2,10),IFERROR(MID(RC[-6],SEARCH("-5",RC[-6])+2,10),IFERROR(MID(RC[-6],SEARCH("-4",RC[-6])+2,10),IFERROR(MID(RC[-6],SEARCH("-3",RC[-6])+2,10),IFERROR(MID(RC[-6],SEARCH("-2",RC[-6])+2,10),IFERROR(MID(RC[-6],SEARCH("-1",RC[-6])+2,10),IFERROR(MID(RC[-6],SEARCH("-",RC[-6])+1,10),))))))))))) -> 圣女贞德 | I405: ="1"&VLOOKUP(RC[-1],Sheet1!R2C2:R127C3,2,FALSE) -> 131440 | J405: 131440 | K405: =IFERROR(FIND(13,RC[-4],1),"") -> 11 | L405: =IF(RC[-1]="","",MID(RC[-5],RC[-1],6)) -> 131440 | M405: =SUBSTITUTE(RC[-6],RC[-1],RC[-3],1) -> "随我前进！"|3#1314404|1
A406: 10375501 | B406: 38-6食人魔 | D406: 1 | E406: 103755|80 | F406: 3|1 | G406: "我感觉自己在燃烧！"|3#1324314|1 | H406: =IFERROR(MID(RC[-6],SEARCH("-10",RC[-6])+3,10),IFERROR(MID(RC[-6],SEARCH("-9",RC[-6])+2,10),IFERROR(MID(RC[-6],SEARCH("-8",RC[-6])+2,10),IFERROR(MID(RC[-6],SEARCH("-7",RC[-6])+2,10),IFERROR(MID(RC[-6],SEARCH("-6",RC[-6])+2,10),IFERROR(MID(RC[-6],SEARCH("-5",RC[-6])+2,10),IFERROR(MID(RC[-6],SEARCH("-4",RC[-6])+2,10),IFERROR(MID(RC[-6],SEARCH("-3",RC[-6])+2,10),IFERROR(MID(RC[-6],SEARCH("-2",RC[-6])+2,10),IFERROR(MID(RC[-6],SEARCH("-1",RC[-6])+2,10),IFERROR(MID(RC[-6],SEARCH("-",RC[-6])+1,10),))))))))))) -> 食人魔 | I406: ="1"&VLOOKUP(RC[-1],Sheet1!R2C2:R127C3,2,FALSE) -> 132431 | J406: 132431 | K406: =IFERROR(FIND(13,RC[-4],1),"") -> 15 | L406: =IF(RC[-1]="","",MID(RC[-5],RC[-1],6)) -> 132431 | M406: =SUBSTITUTE(RC[-6],RC[-1],RC[-3],1) -> "我感觉自己在燃烧！"|3#1324314|1
A407: 10375502 | B407: 38-6食人魔 | D407: 1 | E407: 103755|50 | F407: 3|1 | G407: "沸腾不已！"|3#1324314|1 | H407: =IFERROR(MID(RC[-6],SEARCH("-10",RC[-6])+3,10),IFERROR(MID(RC[-6],SEARCH("-9",RC[-6])+2,10),IFERROR(MID(RC[-6],SEARCH("-8",RC[-6])+2,10),IFERROR(MID(RC[-6],SEARCH("-7",RC[-6])+2,10),IFERROR(MID(RC[-6],SEARCH("-6",RC[-6])+2,10),IFERROR(MID(RC[-6],SEARCH("-5",RC[-6])+2,10),IFERROR(MID(RC[-6],SEARCH("-4",RC[-6])+2,10),IFERROR(MID(RC[-6],SEARCH("-3",RC[-6])+2,10),IFERROR(MID(RC[-6],SEARCH("-2",RC[-6])+2,10),IFERROR(MID(RC[-6],SEARCH("-1",RC[-6])+2,10),IFERROR(MID(RC[-6],SEARCH("-",RC[-6])+1,10),))))))))))) -> 食人魔 | I407: ="1"&VLOOKUP(RC[-1],Sheet1!R2C2:R127C3,2,FALSE) -> 132431 | J407: 132431 | K407: =IFERROR(FIND(13,RC[-4],1),"") -> 11 | L407: =IF(RC[-1]="","",MID(RC[-5],RC[-1],6)) -> 132431 | M407: =SUBSTITUTE(RC[-6],RC[-1],RC[-3],1) -> "沸腾不已！"|3#1324314|1
A408: 10375503 | B408: 38-6食人魔 | D408: 1 | E408: 103755|20 | F408: 3|1 | G408: "快要燃烧起来了！"|3#1324314|1 | H408: =IFERROR(MID(RC[-6],SEARCH("-10",RC[-6])+3,10),IFERROR(MID(RC[-6],SEARCH("-9",RC[-6])+2,10),IFERROR(MID(RC[-6],SEARCH("-8",RC[-6])+2,10),IFERROR(MID(RC[-6],SEARCH("-7",RC[-6])+2,10),IFERROR(MID(RC[-6],SEARCH("-6",RC[-6])+2,10),IFERROR(MID(RC[-6],SEARCH("-5",RC[-6])+2,10),IFERROR(MID(RC[-6],SEARCH("-4",RC[-6])+2,10),IFERROR(MID(RC[-6],SEARCH("-3",RC[-6])+2,10),IFERROR(MID(RC[-6],SEARCH("-2",RC[-6])+2,10),IFERROR(MID(RC[-6],SEARCH("-1",RC[-6])+2,10),IFERROR(MID(RC[-6],SEARCH("-",RC[-6])+1,10),))))))))))) -> 食人魔 | I408: ="1"&VLOOKUP(RC[-1],Sheet1!R2C2:R127C3,2,FALSE) -> 132431 | J408: 132431 | K408: =IFERROR(FIND(13,RC[-4],1),"") -> 14 | L408: =IF(RC[-1]="","",MID(RC[-5],RC[-1],6)) -> 132431 | M408: =SUBSTITUTE(RC[-6],RC[-1],RC[-3],1) -> "快要燃烧起来了！"|3#1324314|1
A409: 10379001 | B409: 38-10独眼巨人 | D409: 2 | E409: 30 | F409: 3|1 | G409: "粉碎！"|3#400045|1 | H409: =IFERROR(MID(RC[-6],SEARCH("-10",RC[-6])+3,10),IFERROR(MID(RC[-6],SEARCH("-9",RC[-6])+2,10),IFERROR(MID(RC[-6],SEARCH("-8",RC[-6])+2,10),IFERROR(MID(RC[-6],SEARCH("-7",RC[-6])+2,10),IFERROR(MID(RC[-6],SEARCH("-6",RC[-6])+2,10),IFERROR(MID(RC[-6],SEARCH("-5",RC[-6])+2,10),IFERROR(MID(RC[-6],SEARCH("-4",RC[-6])+2,10),IFERROR(MID(RC[-6],SEARCH("-3",RC[-6])+2,10),IFERROR(MID(RC[-6],SEARCH("-2",RC[-6])+2,10),IFERROR(MID(RC[-6],SEARCH("-1",RC[-6])+2,10),IFERROR(MID(RC[-6],SEARCH("-",RC[-6])+1,10),))))))))))) -> 独眼巨人 | I409: ="1"&VLOOKUP(RC[-1],Sheet1!R2C2:R127C3,2,FALSE) -> 131999 | J409: 131999 | K409: =IFERROR(FIND(13,RC[-4],1),"") ->  | L409: =IF(RC[-1]="","",MID(RC[-5],RC[-1],6)) ->  | M409: =SUBSTITUTE(RC[-6],RC[-1],RC[-3],1) -> "粉碎！"|3#400045|1
A410: 10379002 | B410: 38-10独眼巨人 | D410: 1 | E410: 103790|80 | F410: 3|1 | G410: "什么都不会留下！"|3#400045|1 | H410: =IFERROR(MID(RC[-6],SEARCH("-10",RC[-6])+3,10),IFERROR(MID(RC[-6],SEARCH("-9",RC[-6])+2,10),IFERROR(MID(RC[-6],SEARCH("-8",RC[-6])+2,10),IFERROR(MID(RC[-6],SEARCH("-7",RC[-6])+2,10),IFERROR(MID(RC[-6],SEARCH("-6",RC[-6])+2,10),IFERROR(MID(RC[-6],SEARCH("-5",RC[-6])+2,10),IFERROR(MID(RC[-6],SEARCH("-4",RC[-6])+2,10),IFERROR(MID(RC[-6],SEARCH("-3",RC[-6])+2,10),IFERROR(MID(RC[-6],SEARCH("-2",RC[-6])+2,10),IFERROR(MID(RC[-6],SEARCH("-1",RC[-6])+2,10),IFERROR(MID(RC[-6],SEARCH("-",RC[-6])+1,10),))))))))))) -> 独眼巨人 | I410: ="1"&VLOOKUP(RC[-1],Sheet1!R2C2:R127C3,2,FALSE) -> 131999 | J410: 131999 | K410: =IFERROR(FIND(13,RC[-4],1),"") ->  | L410: =IF(RC[-1]="","",MID(RC[-5],RC[-1],6)) ->  | M410: =SUBSTITUTE(RC[-6],RC[-1],RC[-3],1) -> "什么都不会留下！"|3#400045|1
A411: 10379003 | B411: 38-10独眼巨人 | D411: 1 | E411: 103790|30 | F411: 3|1 | G411: "区区人类而已——"|3#400045|1 | H411: =IFERROR(MID(RC[-6],SEARCH("-10",RC[-6])+3,10),IFERROR(MID(RC[-6],SEARCH("-9",RC[-6])+2,10),IFERROR(MID(RC[-6],SEARCH("-8",RC[-6])+2,10),IFERROR(MID(RC[-6],SEARCH("-7",RC[-6])+2,10),IFERROR(MID(RC[-6],SEARCH("-6",RC[-6])+2,10),IFERROR(MID(RC[-6],SEARCH("-5",RC[-6])+2,10),IFERROR(MID(RC[-6],SEARCH("-4",RC[-6])+2,10),IFERROR(MID(RC[-6],SEARCH("-3",RC[-6])+2,10),IFERROR(MID(RC[-6],SEARCH("-2",RC[-6])+2,10),IFERROR(MID(RC[-6],SEARCH("-1",RC[-6])+2,10),IFERROR(MID(RC[-6],SEARCH("-",RC[-6])+1,10),))))))))))) -> 独眼巨人 | I411: ="1"&VLOOKUP(RC[-1],Sheet1!R2C2:R127C3,2,FALSE) -> 131999 | J411: 131999 | K411: =IFERROR(FIND(13,RC[-4],1),"") ->  | L411: =IF(RC[-1]="","",MID(RC[-5],RC[-1],6)) ->  | M411: =SUBSTITUTE(RC[-6],RC[-1],RC[-3],1) -> "区区人类而已——"|3#400045|1
A412: 10388501 | B412: 39-9圣女贞德 | D412: 2 | E412: 25 | F412: 3|1 | G412: "不能屈服！"|3#1314404|1 | H412: =IFERROR(MID(RC[-6],SEARCH("-10",RC[-6])+3,10),IFERROR(MID(RC[-6],SEARCH("-9",RC[-6])+2,10),IFERROR(MID(RC[-6],SEARCH("-8",RC[-6])+2,10),IFERROR(MID(RC[-6],SEARCH("-7",RC[-6])+2,10),IFERROR(MID(RC[-6],SEARCH("-6",RC[-6])+2,10),IFERROR(MID(RC[-6],SEARCH("-5",RC[-6])+2,10),IFERROR(MID(RC[-6],SEARCH("-4",RC[-6])+2,10),IFERROR(MID(RC[-6],SEARCH("-3",RC[-6])+2,10),IFERROR(MID(RC[-6],SEARCH("-2",RC[-6])+2,10),IFERROR(MID(RC[-6],SEARCH("-1",RC[-6])+2,10),IFERROR(MID(RC[-6],SEARCH("-",RC[-6])+1,10),))))))))))) -> 圣女贞德 | I412: ="1"&VLOOKUP(RC[-1],Sheet1!R2C2:R127C3,2,FALSE) -> 131440 | J412: 131440 | K412: =IFERROR(FIND(13,RC[-4],1),"") -> 11 | L412: =IF(RC[-1]="","",MID(RC[-5],RC[-1],6)) -> 131440 | M412: =SUBSTITUTE(RC[-6],RC[-1],RC[-3],1) -> "不能屈服！"|3#1314404|1
A413: 10388502 | B413: 39-9圣女贞德 | D413: 1 | E413: 103655|50 | F413: 3|1 | G413: "我将引领你们，走向胜利！"|3#1314404|1 | H413: =IFERROR(MID(RC[-6],SEARCH("-10",RC[-6])+3,10),IFERROR(MID(RC[-6],SEARCH("-9",RC[-6])+2,10),IFERROR(MID(RC[-6],SEARCH("-8",RC[-6])+2,10),IFERROR(MID(RC[-6],SEARCH("-7",RC[-6])+2,10),IFERROR(MID(RC[-6],SEARCH("-6",RC[-6])+2,10),IFERROR(MID(RC[-6],SEARCH("-5",RC[-6])+2,10),IFERROR(MID(RC[-6],SEARCH("-4",RC[-6])+2,10),IFERROR(MID(RC[-6],SEARCH("-3",RC[-6])+2,10),IFERROR(MID(RC[-6],SEARCH("-2",RC[-6])+2,10),IFERROR(MID(RC[-6],SEARCH("-1",RC[-6])+2,10),IFERROR(MID(RC[-6],SEARCH("-",RC[-6])+1,10),))))))))))) -> 圣女贞德 | I413: ="1"&VLOOKUP(RC[-1],Sheet1!R2C2:R127C3,2,FALSE) -> 131440 | J413: 131440 | K413: =IFERROR(FIND(13,RC[-4],1),"") -> 18 | L413: =IF(RC[-1]="","",MID(RC[-5],RC[-1],6)) -> 131440 | M413: =SUBSTITUTE(RC[-6],RC[-1],RC[-3],1) -> "我将引领你们，走向胜利！"|3#1314404|1
A414: 10388503 | B414: 39-9圣女贞德 | D414: 4 | F414: 3|1 | G414: "随我前进！"|3#1314404|1 | H414: =IFERROR(MID(RC[-6],SEARCH("-10",RC[-6])+3,10),IFERROR(MID(RC[-6],SEARCH("-9",RC[-6])+2,10),IFERROR(MID(RC[-6],SEARCH("-8",RC[-6])+2,10),IFERROR(MID(RC[-6],SEARCH("-7",RC[-6])+2,10),IFERROR(MID(RC[-6],SEARCH("-6",RC[-6])+2,10),IFERROR(MID(RC[-6],SEARCH("-5",RC[-6])+2,10),IFERROR(MID(RC[-6],SEARCH("-4",RC[-6])+2,10),IFERROR(MID(RC[-6],SEARCH("-3",RC[-6])+2,10),IFERROR(MID(RC[-6],SEARCH("-2",RC[-6])+2,10),IFERROR(MID(RC[-6],SEARCH("-1",RC[-6])+2,10),IFERROR(MID(RC[-6],SEARCH("-",RC[-6])+1,10),))))))))))) -> 圣女贞德 | I414: ="1"&VLOOKUP(RC[-1],Sheet1!R2C2:R127C3,2,FALSE) -> 131440 | J414: 131440 | K414: =IFERROR(FIND(13,RC[-4],1),"") -> 11 | L414: =IF(RC[-1]="","",MID(RC[-5],RC[-1],6)) -> 131440 | M414: =SUBSTITUTE(RC[-6],RC[-1],RC[-3],1) -> "随我前进！"|3#1314404|1
A415: 10388504 | B415: 39-9圣女贞德 | D415: 3 | F415: 3 | G415: "我需要一个十字架……神啊……"|3 | H415: =IFERROR(MID(RC[-6],SEARCH("-10",RC[-6])+3,10),IFERROR(MID(RC[-6],SEARCH("-9",RC[-6])+2,10),IFERROR(MID(RC[-6],SEARCH("-8",RC[-6])+2,10),IFERROR(MID(RC[-6],SEARCH("-7",RC[-6])+2,10),IFERROR(MID(RC[-6],SEARCH("-6",RC[-6])+2,10),IFERROR(MID(RC[-6],SEARCH("-5",RC[-6])+2,10),IFERROR(MID(RC[-6],SEARCH("-4",RC[-6])+2,10),IFERROR(MID(RC[-6],SEARCH("-3",RC[-6])+2,10),IFERROR(MID(RC[-6],SEARCH("-2",RC[-6])+2,10),IFERROR(MID(RC[-6],SEARCH("-1",RC[-6])+2,10),IFERROR(MID(RC[-6],SEARCH("-",RC[-6])+1,10),))))))))))) -> 圣女贞德 | I415: ="1"&VLOOKUP(RC[-1],Sheet1!R2C2:R127C3,2,FALSE) -> 131440 | J415: 131440 | K415: =IFERROR(FIND(13,RC[-4],1),"") ->  | L415: =IF(RC[-1]="","",MID(RC[-5],RC[-1],6)) ->  | M415: =SUBSTITUTE(RC[-6],RC[-1],RC[-3],1) -> "我需要一个十字架……神啊……"|3
A416: 10395501 | B416: 40-6火女 | D416: 6 | F416: 3|1 | G416: "竟敢杀害我的手下——"|3#1324304|1 | H416: =IFERROR(MID(RC[-6],SEARCH("-10",RC[-6])+3,10),IFERROR(MID(RC[-6],SEARCH("-9",RC[-6])+2,10),IFERROR(MID(RC[-6],SEARCH("-8",RC[-6])+2,10),IFERROR(MID(RC[-6],SEARCH("-7",RC[-6])+2,10),IFERROR(MID(RC[-6],SEARCH("-6",RC[-6])+2,10),IFERROR(MID(RC[-6],SEARCH("-5",RC[-6])+2,10),IFERROR(MID(RC[-6],SEARCH("-4",RC[-6])+2,10),IFERROR(MID(RC[-6],SEARCH("-3",RC[-6])+2,10),IFERROR(MID(RC[-6],SEARCH("-2",RC[-6])+2,10),IFERROR(MID(RC[-6],SEARCH("-1",RC[-6])+2,10),IFERROR(MID(RC[-6],SEARCH("-",RC[-6])+1,10),))))))))))) -> 火女 | I416: ="1"&VLOOKUP(RC[-1],Sheet1!R2C2:R127C3,2,FALSE) -> 132430 | J416: 132430 | K416: =IFERROR(FIND(13,RC[-4],1),"") -> 16 | L416: =IF(RC[-1]="","",MID(RC[-5],RC[-1],6)) -> 132430 | M416: =SUBSTITUTE(RC[-6],RC[-1],RC[-3],1) -> "竟敢杀害我的手下——"|3#1324304|1
A417: 10395502 | B417: 40-6火女 | D417: 2 | E417: 25 | F417: 3|1 | G417: "死亡的时刻到了！"|3#1324304|1 | H417: =IFERROR(MID(RC[-6],SEARCH("-10",RC[-6])+3,10),IFERROR(MID(RC[-6],SEARCH("-9",RC[-6])+2,10),IFERROR(MID(RC[-6],SEARCH("-8",RC[-6])+2,10),IFERROR(MID(RC[-6],SEARCH("-7",RC[-6])+2,10),IFERROR(MID(RC[-6],SEARCH("-6",RC[-6])+2,10),IFERROR(MID(RC[-6],SEARCH("-5",RC[-6])+2,10),IFERROR(MID(RC[-6],SEARCH("-4",RC[-6])+2,10),IFERROR(MID(RC[-6],SEARCH("-3",RC[-6])+2,10),IFERROR(MID(RC[-6],SEARCH("-2",RC[-6])+2,10),IFERROR(MID(RC[-6],SEARCH("-1",RC[-6])+2,10),IFERROR(MID(RC[-6],SEARCH("-",RC[-6])+1,10),))))))))))) -> 火女 | I417: ="1"&VLOOKUP(RC[-1],Sheet1!R2C2:R127C3,2,FALSE) -> 132430 | J417: 132430 | K417: =IFERROR(FIND(13,RC[-4],1),"") -> 14 | L417: =IF(RC[-1]="","",MID(RC[-5],RC[-1],6)) -> 132430 | M417: =SUBSTITUTE(RC[-6],RC[-1],RC[-3],1) -> "死亡的时刻到了！"|3#1324304|1
A418: 10395503 | B418: 40-6火女 | D418: 1 | E418: 103955|30 | F418: 3|1 | G418: "离我远点！"|3#1324304|1 | H418: =IFERROR(MID(RC[-6],SEARCH("-10",RC[-6])+3,10),IFERROR(MID(RC[-6],SEARCH("-9",RC[-6])+2,10),IFERROR(MID(RC[-6],SEARCH("-8",RC[-6])+2,10),IFERROR(MID(RC[-6],SEARCH("-7",RC[-6])+2,10),IFERROR(MID(RC[-6],SEARCH("-6",RC[-6])+2,10),IFERROR(MID(RC[-6],SEARCH("-5",RC[-6])+2,10),IFERROR(MID(RC[-6],SEARCH("-4",RC[-6])+2,10),IFERROR(MID(RC[-6],SEARCH("-3",RC[-6])+2,10),IFERROR(MID(RC[-6],SEARCH("-2",RC[-6])+2,10),IFERROR(MID(RC[-6],SEARCH("-1",RC[-6])+2,10),IFERROR(MID(RC[-6],SEARCH("-",RC[-6])+1,10),))))))))))) -> 火女 | I418: ="1"&VLOOKUP(RC[-1],Sheet1!R2C2:R127C3,2,FALSE) -> 132430 | J418: 132430 | K418: =IFERROR(FIND(13,RC[-4],1),"") -> 11 | L418: =IF(RC[-1]="","",MID(RC[-5],RC[-1],6)) -> 132430 | M418: =SUBSTITUTE(RC[-6],RC[-1],RC[-3],1) -> "离我远点！"|3#1324304|1
A419: 10399001 | B419: 40-10大地泰坦 | D419: 2 | E419: 15 | F419: 3|1 | G419: "大地也会颤栗！！"|3#400047|1 | H419: =IFERROR(MID(RC[-6],SEARCH("-10",RC[-6])+3,10),IFERROR(MID(RC[-6],SEARCH("-9",RC[-6])+2,10),IFERROR(MID(RC[-6],SEARCH("-8",RC[-6])+2,10),IFERROR(MID(RC[-6],SEARCH("-7",RC[-6])+2,10),IFERROR(MID(RC[-6],SEARCH("-6",RC[-6])+2,10),IFERROR(MID(RC[-6],SEARCH("-5",RC[-6])+2,10),IFERROR(MID(RC[-6],SEARCH("-4",RC[-6])+2,10),IFERROR(MID(RC[-6],SEARCH("-3",RC[-6])+2,10),IFERROR(MID(RC[-6],SEARCH("-2",RC[-6])+2,10),IFERROR(MID(RC[-6],SEARCH("-1",RC[-6])+2,10),IFERROR(MID(RC[-6],SEARCH("-",RC[-6])+1,10),))))))))))) -> 大地泰坦 | I419: ="1"&VLOOKUP(RC[-1],Sheet1!R2C2:R127C3,2,FALSE) -> 133999 | J419: 133999 | K419: =IFERROR(FIND(13,RC[-4],1),"") ->  | L419: =IF(RC[-1]="","",MID(RC[-5],RC[-1],6)) ->  | M419: =SUBSTITUTE(RC[-6],RC[-1],RC[-3],1) -> "大地也会颤栗！！"|3#400047|1
A420: 10399002 | B420: 40-10大地泰坦 | D420: 2 | E420: 25 | F420: 3|1 | G420: "周而复始——"|3#400047|1 | H420: =IFERROR(MID(RC[-6],SEARCH("-10",RC[-6])+3,10),IFERROR(MID(RC[-6],SEARCH("-9",RC[-6])+2,10),IFERROR(MID(RC[-6],SEARCH("-8",RC[-6])+2,10),IFERROR(MID(RC[-6],SEARCH("-7",RC[-6])+2,10),IFERROR(MID(RC[-6],SEARCH("-6",RC[-6])+2,10),IFERROR(MID(RC[-6],SEARCH("-5",RC[-6])+2,10),IFERROR(MID(RC[-6],SEARCH("-4",RC[-6])+2,10),IFERROR(MID(RC[-6],SEARCH("-3",RC[-6])+2,10),IFERROR(MID(RC[-6],SEARCH("-2",RC[-6])+2,10),IFERROR(MID(RC[-6],SEARCH("-1",RC[-6])+2,10),IFERROR(MID(RC[-6],SEARCH("-",RC[-6])+1,10),))))))))))) -> 大地泰坦 | I420: ="1"&VLOOKUP(RC[-1],Sheet1!R2C2:R127C3,2,FALSE) -> 133999 | J420: 133999 | K420: =IFERROR(FIND(13,RC[-4],1),"") ->  | L420: =IF(RC[-1]="","",MID(RC[-5],RC[-1],6)) ->  | M420: =SUBSTITUTE(RC[-6],RC[-1],RC[-3],1) -> "周而复始——"|3#400047|1
A421: 10399003 | B421: 40-10大地泰坦 | D421: 2 | E421: 35 | F421: 3|1 | G421: "毁灭总是无时无刻在发生"|3#400047|1 | H421: =IFERROR(MID(RC[-6],SEARCH("-10",RC[-6])+3,10),IFERROR(MID(RC[-6],SEARCH("-9",RC[-6])+2,10),IFERROR(MID(RC[-6],SEARCH("-8",RC[-6])+2,10),IFERROR(MID(RC[-6],SEARCH("-7",RC[-6])+2,10),IFERROR(MID(RC[-6],SEARCH("-6",RC[-6])+2,10),IFERROR(MID(RC[-6],SEARCH("-5",RC[-6])+2,10),IFERROR(MID(RC[-6],SEARCH("-4",RC[-6])+2,10),IFERROR(MID(RC[-6],SEARCH("-3",RC[-6])+2,10),IFERROR(MID(RC[-6],SEARCH("-2",RC[-6])+2,10),IFERROR(MID(RC[-6],SEARCH("-1",RC[-6])+2,10),IFERROR(MID(RC[-6],SEARCH("-",RC[-6])+1,10),))))))))))) -> 大地泰坦 | I421: ="1"&VLOOKUP(RC[-1],Sheet1!R2C2:R127C3,2,FALSE) -> 133999 | J421: 133999 | K421: =IFERROR(FIND(13,RC[-4],1),"") ->  | L421: =IF(RC[-1]="","",MID(RC[-5],RC[-1],6)) ->  | M421: =SUBSTITUTE(RC[-6],RC[-1],RC[-3],1) -> "毁灭总是无时无刻在发生"|3#400047|1
A422: 10399004 | B422: 40-10大地泰坦 | D422: 2 | E422: 45 | F422: 3|1 | G422: "你们必将失败！"|3#400047|1 | H422: =IFERROR(MID(RC[-6],SEARCH("-10",RC[-6])+3,10),IFERROR(MID(RC[-6],SEARCH("-9",RC[-6])+2,10),IFERROR(MID(RC[-6],SEARCH("-8",RC[-6])+2,10),IFERROR(MID(RC[-6],SEARCH("-7",RC[-6])+2,10),IFERROR(MID(RC[-6],SEARCH("-6",RC[-6])+2,10),IFERROR(MID(RC[-6],SEARCH("-5",RC[-6])+2,10),IFERROR(MID(RC[-6],SEARCH("-4",RC[-6])+2,10),IFERROR(MID(RC[-6],SEARCH("-3",RC[-6])+2,10),IFERROR(MID(RC[-6],SEARCH("-2",RC[-6])+2,10),IFERROR(MID(RC[-6],SEARCH("-1",RC[-6])+2,10),IFERROR(MID(RC[-6],SEARCH("-",RC[-6])+1,10),))))))))))) -> 大地泰坦 | I422: ="1"&VLOOKUP(RC[-1],Sheet1!R2C2:R127C3,2,FALSE) -> 133999 | J422: 133999 | K422: =IFERROR(FIND(13,RC[-4],1),"") ->  | L422: =IF(RC[-1]="","",MID(RC[-5],RC[-1],6)) ->  | M422: =SUBSTITUTE(RC[-6],RC[-1],RC[-3],1) -> "你们必将失败！"|3#400047|1
A423: 10405501 | B423: 41-6鹰眸 | D423: 2 | E423: 20 | F423: 3|1 | G423: "可笑地逃窜吧"|3#1304204|1 | H423: =IFERROR(MID(RC[-6],SEARCH("-10",RC[-6])+3,10),IFERROR(MID(RC[-6],SEARCH("-9",RC[-6])+2,10),IFERROR(MID(RC[-6],SEARCH("-8",RC[-6])+2,10),IFERROR(MID(RC[-6],SEARCH("-7",RC[-6])+2,10),IFERROR(MID(RC[-6],SEARCH("-6",RC[-6])+2,10),IFERROR(MID(RC[-6],SEARCH("-5",RC[-6])+2,10),IFERROR(MID(RC[-6],SEARCH("-4",RC[-6])+2,10),IFERROR(MID(RC[-6],SEARCH("-3",RC[-6])+2,10),IFERROR(MID(RC[-6],SEARCH("-2",RC[-6])+2,10),IFERROR(MID(RC[-6],SEARCH("-1",RC[-6])+2,10),IFERROR(MID(RC[-6],SEARCH("-",RC[-6])+1,10),))))))))))) -> 鹰眸 | I423: ="1"&VLOOKUP(RC[-1],Sheet1!R2C2:R127C3,2,FALSE) -> 130420 | J423: 130420 | K423: =IFERROR(FIND(13,RC[-4],1),"") -> 12 | L423: =IF(RC[-1]="","",MID(RC[-5],RC[-1],6)) -> 130420 | M423: =SUBSTITUTE(RC[-6],RC[-1],RC[-3],1) -> "可笑地逃窜吧"|3#1304204|1
A424: 10405502 | B424: 41-6鹰眸 | D424: 2 | E424: 30 | F424: 3|1 | G424: "绝地反杀的戏码我可玩得多了"|3#1304204|1 | H424: =IFERROR(MID(RC[-6],SEARCH("-10",RC[-6])+3,10),IFERROR(MID(RC[-6],SEARCH("-9",RC[-6])+2,10),IFERROR(MID(RC[-6],SEARCH("-8",RC[-6])+2,10),IFERROR(MID(RC[-6],SEARCH("-7",RC[-6])+2,10),IFERROR(MID(RC[-6],SEARCH("-6",RC[-6])+2,10),IFERROR(MID(RC[-6],SEARCH("-5",RC[-6])+2,10),IFERROR(MID(RC[-6],SEARCH("-4",RC[-6])+2,10),IFERROR(MID(RC[-6],SEARCH("-3",RC[-6])+2,10),IFERROR(MID(RC[-6],SEARCH("-2",RC[-6])+2,10),IFERROR(MID(RC[-6],SEARCH("-1",RC[-6])+2,10),IFERROR(MID(RC[-6],SEARCH("-",RC[-6])+1,10),))))))))))) -> 鹰眸 | I424: ="1"&VLOOKUP(RC[-1],Sheet1!R2C2:R127C3,2,FALSE) -> 130420 | J424: 130420 | K424: =IFERROR(FIND(13,RC[-4],1),"") -> 19 | L424: =IF(RC[-1]="","",MID(RC[-5],RC[-1],6)) -> 130420 | M424: =SUBSTITUTE(RC[-6],RC[-1],RC[-3],1) -> "绝地反杀的戏码我可玩得多了"|3#1304204|1
A425: 10405503 | B425: 41-6鹰眸 | D425: 6 | F425: 3|1 | G425: "死吧！"|3#1304204|1 | H425: =IFERROR(MID(RC[-6],SEARCH("-10",RC[-6])+3,10),IFERROR(MID(RC[-6],SEARCH("-9",RC[-6])+2,10),IFERROR(MID(RC[-6],SEARCH("-8",RC[-6])+2,10),IFERROR(MID(RC[-6],SEARCH("-7",RC[-6])+2,10),IFERROR(MID(RC[-6],SEARCH("-6",RC[-6])+2,10),IFERROR(MID(RC[-6],SEARCH("-5",RC[-6])+2,10),IFERROR(MID(RC[-6],SEARCH("-4",RC[-6])+2,10),IFERROR(MID(RC[-6],SEARCH("-3",RC[-6])+2,10),IFERROR(MID(RC[-6],SEARCH("-2",RC[-6])+2,10),IFERROR(MID(RC[-6],SEARCH("-1",RC[-6])+2,10),IFERROR(MID(RC[-6],SEARCH("-",RC[-6])+1,10),))))))))))) -> 鹰眸 | I425: ="1"&VLOOKUP(RC[-1],Sheet1!R2C2:R127C3,2,FALSE) -> 130420 | J425: 130420 | K425: =IFERROR(FIND(13,RC[-4],1),"") -> 9 | L425: =IF(RC[-1]="","",MID(RC[-5],RC[-1],6)) -> 130420 | M425: =SUBSTITUTE(RC[-6],RC[-1],RC[-3],1) -> "死吧！"|3#1304204|1
A426: 10409501 | B426: 41-10野蛮巨人 | D426: 1 | E426: 104095|80 | F426: 3|1 | G426: "你们会被砸成肉饼"|3#1304104|1 | H426: =IFERROR(MID(RC[-6],SEARCH("-10",RC[-6])+3,10),IFERROR(MID(RC[-6],SEARCH("-9",RC[-6])+2,10),IFERROR(MID(RC[-6],SEARCH("-8",RC[-6])+2,10),IFERROR(MID(RC[-6],SEARCH("-7",RC[-6])+2,10),IFERROR(MID(RC[-6],SEARCH("-6",RC[-6])+2,10),IFERROR(MID(RC[-6],SEARCH("-5",RC[-6])+2,10),IFERROR(MID(RC[-6],SEARCH("-4",RC[-6])+2,10),IFERROR(MID(RC[-6],SEARCH("-3",RC[-6])+2,10),IFERROR(MID(RC[-6],SEARCH("-2",RC[-6])+2,10),IFERROR(MID(RC[-6],SEARCH("-1",RC[-6])+2,10),IFERROR(MID(RC[-6],SEARCH("-",RC[-6])+1,10),))))))))))) -> 野蛮巨人 | I426: ="1"&VLOOKUP(RC[-1],Sheet1!R2C2:R127C3,2,FALSE) -> 130410 | J426: 130410 | K426: =IFERROR(FIND(13,RC[-4],1),"") -> 14 | L426: =IF(RC[-1]="","",MID(RC[-5],RC[-1],6)) -> 130410 | M426: =SUBSTITUTE(RC[-6],RC[-1],RC[-3],1) -> "你们会被砸成肉饼"|3#1304104|1
A427: 10409502 | B427: 41-10野蛮巨人 | D427: 1 | E427: 104095|50 | F427: 3|1 | G427: "我很愤怒"|3#1304104|1 | H427: =IFERROR(MID(RC[-6],SEARCH("-10",RC[-6])+3,10),IFERROR(MID(RC[-6],SEARCH("-9",RC[-6])+2,10),IFERROR(MID(RC[-6],SEARCH("-8",RC[-6])+2,10),IFERROR(MID(RC[-6],SEARCH("-7",RC[-6])+2,10),IFERROR(MID(RC[-6],SEARCH("-6",RC[-6])+2,10),IFERROR(MID(RC[-6],SEARCH("-5",RC[-6])+2,10),IFERROR(MID(RC[-6],SEARCH("-4",RC[-6])+2,10),IFERROR(MID(RC[-6],SEARCH("-3",RC[-6])+2,10),IFERROR(MID(RC[-6],SEARCH("-2",RC[-6])+2,10),IFERROR(MID(RC[-6],SEARCH("-1",RC[-6])+2,10),IFERROR(MID(RC[-6],SEARCH("-",RC[-6])+1,10),))))))))))) -> 野蛮巨人 | I427: ="1"&VLOOKUP(RC[-1],Sheet1!R2C2:R127C3,2,FALSE) -> 130410 | J427: 130410 | K427: =IFERROR(FIND(13,RC[-4],1),"") -> 10 | L427: =IF(RC[-1]="","",MID(RC[-5],RC[-1],6)) -> 130410 | M427: =SUBSTITUTE(RC[-6],RC[-1],RC[-3],1) -> "我很愤怒"|3#1304104|1
A428: 10409503 | B428: 41-10野蛮巨人 | D428: 1 | E428: 104095|20 | F428: 3|1 | G428: "怒火会吞噬你们！"|3#1304104|1 | H428: =IFERROR(MID(RC[-6],SEARCH("-10",RC[-6])+3,10),IFERROR(MID(RC[-6],SEARCH("-9",RC[-6])+2,10),IFERROR(MID(RC[-6],SEARCH("-8",RC[-6])+2,10),IFERROR(MID(RC[-6],SEARCH("-7",RC[-6])+2,10),IFERROR(MID(RC[-6],SEARCH("-6",RC[-6])+2,10),IFERROR(MID(RC[-6],SEARCH("-5",RC[-6])+2,10),IFERROR(MID(RC[-6],SEARCH("-4",RC[-6])+2,10),IFERROR(MID(RC[-6],SEARCH("-3",RC[-6])+2,10),IFERROR(MID(RC[-6],SEARCH("-2",RC[-6])+2,10),IFERROR(MID(RC[-6],SEARCH("-1",RC[-6])+2,10),IFERROR(MID(RC[-6],SEARCH("-",RC[-6])+1,10),))))))))))) -> 野蛮巨人 | I428: ="1"&VLOOKUP(RC[-1],Sheet1!R2C2:R127C3,2,FALSE) -> 130410 | J428: 130410 | K428: =IFERROR(FIND(13,RC[-4],1),"") -> 14 | L428: =IF(RC[-1]="","",MID(RC[-5],RC[-1],6)) -> 130410 | M428: =SUBSTITUTE(RC[-6],RC[-1],RC[-3],1) -> "怒火会吞噬你们！"|3#1304104|1
A429: 10415501 | B429: 42-6树人 | D429: 1 | E429: 104155|70 | F429: 3|1 | G429: "吼——！"|3#1304114|1 | H429: =IFERROR(MID(RC[-6],SEARCH("-10",RC[-6])+3,10),IFERROR(MID(RC[-6],SEARCH("-9",RC[-6])+2,10),IFERROR(MID(RC[-6],SEARCH("-8",RC[-6])+2,10),IFERROR(MID(RC[-6],SEARCH("-7",RC[-6])+2,10),IFERROR(MID(RC[-6],SEARCH("-6",RC[-6])+2,10),IFERROR(MID(RC[-6],SEARCH("-5",RC[-6])+2,10),IFERROR(MID(RC[-6],SEARCH("-4",RC[-6])+2,10),IFERROR(MID(RC[-6],SEARCH("-3",RC[-6])+2,10),IFERROR(MID(RC[-6],SEARCH("-2",RC[-6])+2,10),IFERROR(MID(RC[-6],SEARCH("-1",RC[-6])+2,10),IFERROR(MID(RC[-6],SEARCH("-",RC[-6])+1,10),))))))))))) -> 树人 | I429: ="1"&VLOOKUP(RC[-1],Sheet1!R2C2:R127C3,2,FALSE) -> 130411 | J429: 130411 | K429: =IFERROR(FIND(13,RC[-4],1),"") -> 10 | L429: =IF(RC[-1]="","",MID(RC[-5],RC[-1],6)) -> 130411 | M429: =SUBSTITUTE(RC[-6],RC[-1],RC[-3],1) -> "吼——！"|3#1304114|1
A430: 10415502 | B430: 42-6树人 | D430: 1 | E430: 104155|20 | F430: 3|1 | G430: "吼——！"|3#1304114|1 | H430: =IFERROR(MID(RC[-6],SEARCH("-10",RC[-6])+3,10),IFERROR(MID(RC[-6],SEARCH("-9",RC[-6])+2,10),IFERROR(MID(RC[-6],SEARCH("-8",RC[-6])+2,10),IFERROR(MID(RC[-6],SEARCH("-7",RC[-6])+2,10),IFERROR(MID(RC[-6],SEARCH("-6",RC[-6])+2,10),IFERROR(MID(RC[-6],SEARCH("-5",RC[-6])+2,10),IFERROR(MID(RC[-6],SEARCH("-4",RC[-6])+2,10),IFERROR(MID(RC[-6],SEARCH("-3",RC[-6])+2,10),IFERROR(MID(RC[-6],SEARCH("-2",RC[-6])+2,10),IFERROR(MID(RC[-6],SEARCH("-1",RC[-6])+2,10),IFERROR(MID(RC[-6],SEARCH("-",RC[-6])+1,10),))))))))))) -> 树人 | I430: ="1"&VLOOKUP(RC[-1],Sheet1!R2C2:R127C3,2,FALSE) -> 130411 | J430: 130411 | K430: =IFERROR(FIND(13,RC[-4],1),"") -> 10 | L430: =IF(RC[-1]="","",MID(RC[-5],RC[-1],6)) -> 130411 | M430: =SUBSTITUTE(RC[-6],RC[-1],RC[-3],1) -> "吼——！"|3#1304114|1
A431: 10415503 | B431: 42-6树人 | D431: 6 | F431: 3|1 | G431: "死——！！！！！！"|3#1304114|1 | H431: =IFERROR(MID(RC[-6],SEARCH("-10",RC[-6])+3,10),IFERROR(MID(RC[-6],SEARCH("-9",RC[-6])+2,10),IFERROR(MID(RC[-6],SEARCH("-8",RC[-6])+2,10),IFERROR(MID(RC[-6],SEARCH("-7",RC[-6])+2,10),IFERROR(MID(RC[-6],SEARCH("-6",RC[-6])+2,10),IFERROR(MID(RC[-6],SEARCH("-5",RC[-6])+2,10),IFERROR(MID(RC[-6],SEARCH("-4",RC[-6])+2,10),IFERROR(MID(RC[-6],SEARCH("-3",RC[-6])+2,10),IFERROR(MID(RC[-6],SEARCH("-2",RC[-6])+2,10),IFERROR(MID(RC[-6],SEARCH("-1",RC[-6])+2,10),IFERROR(MID(RC[-6],SEARCH("-",RC[-6])+1,10),))))))))))) -> 树人 | I431: ="1"&VLOOKUP(RC[-1],Sheet1!R2C2:R127C3,2,FALSE) -> 130411 | J431: 130411 | K431: =IFERROR(FIND(13,RC[-4],1),"") -> 15 | L431: =IF(RC[-1]="","",MID(RC[-5],RC[-1],6)) -> 130411 | M431: =SUBSTITUTE(RC[-6],RC[-1],RC[-3],1) -> "死——！！！！！！"|3#1304114|1
A432: 10419501 | B432: 42-10刀锋猎人 | D432: 1 | E432: 104195|50 | F432: 3|1 | G432: "你们已经输了"|3#1304024|1 | H432: =IFERROR(MID(RC[-6],SEARCH("-10",RC[-6])+3,10),IFERROR(MID(RC[-6],SEARCH("-9",RC[-6])+2,10),IFERROR(MID(RC[-6],SEARCH("-8",RC[-6])+2,10),IFERROR(MID(RC[-6],SEARCH("-7",RC[-6])+2,10),IFERROR(MID(RC[-6],SEARCH("-6",RC[-6])+2,10),IFERROR(MID(RC[-6],SEARCH("-5",RC[-6])+2,10),IFERROR(MID(RC[-6],SEARCH("-4",RC[-6])+2,10),IFERROR(MID(RC[-6],SEARCH("-3",RC[-6])+2,10),IFERROR(MID(RC[-6],SEARCH("-2",RC[-6])+2,10),IFERROR(MID(RC[-6],SEARCH("-1",RC[-6])+2,10),IFERROR(MID(RC[-6],SEARCH("-",RC[-6])+1,10),))))))))))) -> 刀锋猎人 | I432: ="1"&VLOOKUP(RC[-1],Sheet1!R2C2:R127C3,2,FALSE) -> 130402 | J432: 130402 | K432: =IFERROR(FIND(13,RC[-4],1),"") -> 12 | L432: =IF(RC[-1]="","",MID(RC[-5],RC[-1],6)) -> 130402 | M432: =SUBSTITUTE(RC[-6],RC[-1],RC[-3],1) -> "你们已经输了"|3#1304024|1
A433: 10419502 | B433: 42-10刀锋猎人 | D433: 6 | F433: 3|1 | G433: "死亡？你们也要死去！"|3#1304024|1 | H433: =IFERROR(MID(RC[-6],SEARCH("-10",RC[-6])+3,10),IFERROR(MID(RC[-6],SEARCH("-9",RC[-6])+2,10),IFERROR(MID(RC[-6],SEARCH("-8",RC[-6])+2,10),IFERROR(MID(RC[-6],SEARCH("-7",RC[-6])+2,10),IFERROR(MID(RC[-6],SEARCH("-6",RC[-6])+2,10),IFERROR(MID(RC[-6],SEARCH("-5",RC[-6])+2,10),IFERROR(MID(RC[-6],SEARCH("-4",RC[-6])+2,10),IFERROR(MID(RC[-6],SEARCH("-3",RC[-6])+2,10),IFERROR(MID(RC[-6],SEARCH("-2",RC[-6])+2,10),IFERROR(MID(RC[-6],SEARCH("-1",RC[-6])+2,10),IFERROR(MID(RC[-6],SEARCH("-",RC[-6])+1,10),))))))))))) -> 刀锋猎人 | I433: ="1"&VLOOKUP(RC[-1],Sheet1!R2C2:R127C3,2,FALSE) -> 130402 | J433: 130402 | K433: =IFERROR(FIND(13,RC[-4],1),"") -> 16 | L433: =IF(RC[-1]="","",MID(RC[-5],RC[-1],6)) -> 130402 | M433: =SUBSTITUTE(RC[-6],RC[-1],RC[-3],1) -> "死亡？你们也要死去！"|3#1304024|1
A434: 10419503 | B434: 42-10刀锋猎人 | D434: 2 | E434: 30 | F434: 3|1 | G434: "猎杀时刻！"|3#1304024|1 | H434: =IFERROR(MID(RC[-6],SEARCH("-10",RC[-6])+3,10),IFERROR(MID(RC[-6],SEARCH("-9",RC[-6])+2,10),IFERROR(MID(RC[-6],SEARCH("-8",RC[-6])+2,10),IFERROR(MID(RC[-6],SEARCH("-7",RC[-6])+2,10),IFERROR(MID(RC[-6],SEARCH("-6",RC[-6])+2,10),IFERROR(MID(RC[-6],SEARCH("-5",RC[-6])+2,10),IFERROR(MID(RC[-6],SEARCH("-4",RC[-6])+2,10),IFERROR(MID(RC[-6],SEARCH("-3",RC[-6])+2,10),IFERROR(MID(RC[-6],SEARCH("-2",RC[-6])+2,10),IFERROR(MID(RC[-6],SEARCH("-1",RC[-6])+2,10),IFERROR(MID(RC[-6],SEARCH("-",RC[-6])+1,10),))))))))))) -> 刀锋猎人 | I434: ="1"&VLOOKUP(RC[-1],Sheet1!R2C2:R127C3,2,FALSE) -> 130402 | J434: 130402 | K434: =IFERROR(FIND(13,RC[-4],1),"") -> 11 | L434: =IF(RC[-1]="","",MID(RC[-5],RC[-1],6)) -> 130402 | M434: =SUBSTITUTE(RC[-6],RC[-1],RC[-3],1) -> "猎杀时刻！"|3#1304024|1
A435: 10425501 | B435: 43-6半人马 | D435: 1 | E435: 104255|90 | F435: 3|1 | G435: "奔跑吧！"|3#1324014|1 | H435: =IFERROR(MID(RC[-6],SEARCH("-10",RC[-6])+3,10),IFERROR(MID(RC[-6],SEARCH("-9",RC[-6])+2,10),IFERROR(MID(RC[-6],SEARCH("-8",RC[-6])+2,10),IFERROR(MID(RC[-6],SEARCH("-7",RC[-6])+2,10),IFERROR(MID(RC[-6],SEARCH("-6",RC[-6])+2,10),IFERROR(MID(RC[-6],SEARCH("-5",RC[-6])+2,10),IFERROR(MID(RC[-6],SEARCH("-4",RC[-6])+2,10),IFERROR(MID(RC[-6],SEARCH("-3",RC[-6])+2,10),IFERROR(MID(RC[-6],SEARCH("-2",RC[-6])+2,10),IFERROR(MID(RC[-6],SEARCH("-1",RC[-6])+2,10),IFERROR(MID(RC[-6],SEARCH("-",RC[-6])+1,10),))))))))))) -> 半人马 | I435: ="1"&VLOOKUP(RC[-1],Sheet1!R2C2:R127C3,2,FALSE) -> 132401 | J435: 132401 | K435: =IFERROR(FIND(13,RC[-4],1),"") -> 10 | L435: =IF(RC[-1]="","",MID(RC[-5],RC[-1],6)) -> 132401 | M435: =SUBSTITUTE(RC[-6],RC[-1],RC[-3],1) -> "奔跑吧！"|3#1324014|1
A436: 10425502 | B436: 43-6半人马 | D436: 1 | E436: 104255|60 | F436: 3|1 | G436: "掠夺吧！"|3#1324014|1 | H436: =IFERROR(MID(RC[-6],SEARCH("-10",RC[-6])+3,10),IFERROR(MID(RC[-6],SEARCH("-9",RC[-6])+2,10),IFERROR(MID(RC[-6],SEARCH("-8",RC[-6])+2,10),IFERROR(MID(RC[-6],SEARCH("-7",RC[-6])+2,10),IFERROR(MID(RC[-6],SEARCH("-6",RC[-6])+2,10),IFERROR(MID(RC[-6],SEARCH("-5",RC[-6])+2,10),IFERROR(MID(RC[-6],SEARCH("-4",RC[-6])+2,10),IFERROR(MID(RC[-6],SEARCH("-3",RC[-6])+2,10),IFERROR(MID(RC[-6],SEARCH("-2",RC[-6])+2,10),IFERROR(MID(RC[-6],SEARCH("-1",RC[-6])+2,10),IFERROR(MID(RC[-6],SEARCH("-",RC[-6])+1,10),))))))))))) -> 半人马 | I436: ="1"&VLOOKUP(RC[-1],Sheet1!R2C2:R127C3,2,FALSE) -> 132401 | J436: 132401 | K436: =IFERROR(FIND(13,RC[-4],1),"") -> 10 | L436: =IF(RC[-1]="","",MID(RC[-5],RC[-1],6)) -> 132401 | M436: =SUBSTITUTE(RC[-6],RC[-1],RC[-3],1) -> "掠夺吧！"|3#1324014|1
A437: 10425503 | B437: 43-6半人马 | D437: 1 | E437: 104255|30 | F437: 3|1 | G437: "厮杀吧！"|3#1324014|1 | H437: =IFERROR(MID(RC[-6],SEARCH("-10",RC[-6])+3,10),IFERROR(MID(RC[-6],SEARCH("-9",RC[-6])+2,10),IFERROR(MID(RC[-6],SEARCH("-8",RC[-6])+2,10),IFERROR(MID(RC[-6],SEARCH("-7",RC[-6])+2,10),IFERROR(MID(RC[-6],SEARCH("-6",RC[-6])+2,10),IFERROR(MID(RC[-6],SEARCH("-5",RC[-6])+2,10),IFERROR(MID(RC[-6],SEARCH("-4",RC[-6])+2,10),IFERROR(MID(RC[-6],SEARCH("-3",RC[-6])+2,10),IFERROR(MID(RC[-6],SEARCH("-2",RC[-6])+2,10),IFERROR(MID(RC[-6],SEARCH("-1",RC[-6])+2,10),IFERROR(MID(RC[-6],SEARCH("-",RC[-6])+1,10),))))))))))) -> 半人马 | I437: ="1"&VLOOKUP(RC[-1],Sheet1!R2C2:R127C3,2,FALSE) -> 132401 | J437: 132401 | K437: =IFERROR(FIND(13,RC[-4],1),"") -> 10 | L437: =IF(RC[-1]="","",MID(RC[-5],RC[-1],6)) -> 132401 | M437: =SUBSTITUTE(RC[-6],RC[-1],RC[-3],1) -> "厮杀吧！"|3#1324014|1
A438: 10435501 | B438: 44-6基伦 | D438: 1 | E438: 104355|70 | F438: 3|1 | G438: "这是正义之剑！"|3#1324024|1 | H438: =IFERROR(MID(RC[-6],SEARCH("-10",RC[-6])+3,10),IFERROR(MID(RC[-6],SEARCH("-9",RC[-6])+2,10),IFERROR(MID(RC[-6],SEARCH("-8",RC[-6])+2,10),IFERROR(MID(RC[-6],SEARCH("-7",RC[-6])+2,10),IFERROR(MID(RC[-6],SEARCH("-6",RC[-6])+2,10),IFERROR(MID(RC[-6],SEARCH("-5",RC[-6])+2,10),IFERROR(MID(RC[-6],SEARCH("-4",RC[-6])+2,10),IFERROR(MID(RC[-6],SEARCH("-3",RC[-6])+2,10),IFERROR(MID(RC[-6],SEARCH("-2",RC[-6])+2,10),IFERROR(MID(RC[-6],SEARCH("-1",RC[-6])+2,10),IFERROR(MID(RC[-6],SEARCH("-",RC[-6])+1,10),))))))))))) -> 基伦 | I438: ="1"&VLOOKUP(RC[-1],Sheet1!R2C2:R127C3,2,FALSE) -> 132402 | J438: 132402 | K438: =IFERROR(FIND(13,RC[-4],1),"") -> 13 | L438: =IF(RC[-1]="","",MID(RC[-5],RC[-1],6)) -> 132402 | M438: =SUBSTITUTE(RC[-6],RC[-1],RC[-3],1) -> "这是正义之剑！"|3#1324024|1
A439: 10435502 | B439: 44-6基伦 | D439: 1 | E439: 104355|20 | F439: 3|1 | G439: "无关形式，无关结局——"|3#1324024|1 | H439: =IFERROR(MID(RC[-6],SEARCH("-10",RC[-6])+3,10),IFERROR(MID(RC[-6],SEARCH("-9",RC[-6])+2,10),IFERROR(MID(RC[-6],SEARCH("-8",RC[-6])+2,10),IFERROR(MID(RC[-6],SEARCH("-7",RC[-6])+2,10),IFERROR(MID(RC[-6],SEARCH("-6",RC[-6])+2,10),IFERROR(MID(RC[-6],SEARCH("-5",RC[-6])+2,10),IFERROR(MID(RC[-6],SEARCH("-4",RC[-6])+2,10),IFERROR(MID(RC[-6],SEARCH("-3",RC[-6])+2,10),IFERROR(MID(RC[-6],SEARCH("-2",RC[-6])+2,10),IFERROR(MID(RC[-6],SEARCH("-1",RC[-6])+2,10),IFERROR(MID(RC[-6],SEARCH("-",RC[-6])+1,10),))))))))))) -> 基伦 | I439: ="1"&VLOOKUP(RC[-1],Sheet1!R2C2:R127C3,2,FALSE) -> 132402 | J439: 132402 | K439: =IFERROR(FIND(13,RC[-4],1),"") -> 17 | L439: =IF(RC[-1]="","",MID(RC[-5],RC[-1],6)) -> 132402 | M439: =SUBSTITUTE(RC[-6],RC[-1],RC[-3],1) -> "无关形式，无关结局——"|3#1324024|1
A440: 10435503 | B440: 44-6基伦 | D440: 6 | F440: 3|1 | G440: "这是死亡之果！"|3#1324024|1 | H440: =IFERROR(MID(RC[-6],SEARCH("-10",RC[-6])+3,10),IFERROR(MID(RC[-6],SEARCH("-9",RC[-6])+2,10),IFERROR(MID(RC[-6],SEARCH("-8",RC[-6])+2,10),IFERROR(MID(RC[-6],SEARCH("-7",RC[-6])+2,10),IFERROR(MID(RC[-6],SEARCH("-6",RC[-6])+2,10),IFERROR(MID(RC[-6],SEARCH("-5",RC[-6])+2,10),IFERROR(MID(RC[-6],SEARCH("-4",RC[-6])+2,10),IFERROR(MID(RC[-6],SEARCH("-3",RC[-6])+2,10),IFERROR(MID(RC[-6],SEARCH("-2",RC[-6])+2,10),IFERROR(MID(RC[-6],SEARCH("-1",RC[-6])+2,10),IFERROR(MID(RC[-6],SEARCH("-",RC[-6])+1,10),))))))))))) -> 基伦 | I440: ="1"&VLOOKUP(RC[-1],Sheet1!R2C2:R127C3,2,FALSE) -> 132402 | J440: 132402 | K440: =IFERROR(FIND(13,RC[-4],1),"") -> 13 | L440: =IF(RC[-1]="","",MID(RC[-5],RC[-1],6)) -> 132402 | M440: =SUBSTITUTE(RC[-6],RC[-1],RC[-3],1) -> "这是死亡之果！"|3#1324024|1
A441: 10439501 | B441: 44-10恶魔猎手 | D441: 1 | E441: 104395|80 | F441: 3|1 | G441: "失败？不存在的"|3#1324094|1 | H441: =IFERROR(MID(RC[-6],SEARCH("-10",RC[-6])+3,10),IFERROR(MID(RC[-6],SEARCH("-9",RC[-6])+2,10),IFERROR(MID(RC[-6],SEARCH("-8",RC[-6])+2,10),IFERROR(MID(RC[-6],SEARCH("-7",RC[-6])+2,10),IFERROR(MID(RC[-6],SEARCH("-6",RC[-6])+2,10),IFERROR(MID(RC[-6],SEARCH("-5",RC[-6])+2,10),IFERROR(MID(RC[-6],SEARCH("-4",RC[-6])+2,10),IFERROR(MID(RC[-6],SEARCH("-3",RC[-6])+2,10),IFERROR(MID(RC[-6],SEARCH("-2",RC[-6])+2,10),IFERROR(MID(RC[-6],SEARCH("-1",RC[-6])+2,10),IFERROR(MID(RC[-6],SEARCH("-",RC[-6])+1,10),))))))))))) -> 恶魔猎手 | I441: ="1"&VLOOKUP(RC[-1],Sheet1!R2C2:R127C3,2,FALSE) -> 132409 | J441: 132409 | K441: =IFERROR(FIND(13,RC[-4],1),"") -> 13 | L441: =IF(RC[-1]="","",MID(RC[-5],RC[-1],6)) -> 132409 | M441: =SUBSTITUTE(RC[-6],RC[-1],RC[-3],1) -> "失败？不存在的"|3#1324094|1
A442: 10439502 | B442: 44-10恶魔猎手 | D442: 1 | E442: 104395|50 | F442: 3|1 | G442: "我不能后退"|3#1324094|1 | H442: =IFERROR(MID(RC[-6],SEARCH("-10",RC[-6])+3,10),IFERROR(MID(RC[-6],SEARCH("-9",RC[-6])+2,10),IFERROR(MID(RC[-6],SEARCH("-8",RC[-6])+2,10),IFERROR(MID(RC[-6],SEARCH("-7",RC[-6])+2,10),IFERROR(MID(RC[-6],SEARCH("-6",RC[-6])+2,10),IFERROR(MID(RC[-6],SEARCH("-5",RC[-6])+2,10),IFERROR(MID(RC[-6],SEARCH("-4",RC[-6])+2,10),IFERROR(MID(RC[-6],SEARCH("-3",RC[-6])+2,10),IFERROR(MID(RC[-6],SEARCH("-2",RC[-6])+2,10),IFERROR(MID(RC[-6],SEARCH("-1",RC[-6])+2,10),IFERROR(MID(RC[-6],SEARCH("-",RC[-6])+1,10),))))))))))) -> 恶魔猎手 | I442: ="1"&VLOOKUP(RC[-1],Sheet1!R2C2:R127C3,2,FALSE) -> 132409 | J442: 132409 | K442: =IFERROR(FIND(13,RC[-4],1),"") -> 11 | L442: =IF(RC[-1]="","",MID(RC[-5],RC[-1],6)) -> 132409 | M442: =SUBSTITUTE(RC[-6],RC[-1],RC[-3],1) -> "我不能后退"|3#1324094|1
A443: 10439503 | B443: 44-10恶魔猎手 | D443: 1 | E443: 104395|20 | F443: 3|1 | G443: "你们必须沉眠于此"|3#1324094|1 | H443: =IFERROR(MID(RC[-6],SEARCH("-10",RC[-6])+3,10),IFERROR(MID(RC[-6],SEARCH("-9",RC[-6])+2,10),IFERROR(MID(RC[-6],SEARCH("-8",RC[-6])+2,10),IFERROR(MID(RC[-6],SEARCH("-7",RC[-6])+2,10),IFERROR(MID(RC[-6],SEARCH("-6",RC[-6])+2,10),IFERROR(MID(RC[-6],SEARCH("-5",RC[-6])+2,10),IFERROR(MID(RC[-6],SEARCH("-4",RC[-6])+2,10),IFERROR(MID(RC[-6],SEARCH("-3",RC[-6])+2,10),IFERROR(MID(RC[-6],SEARCH("-2",RC[-6])+2,10),IFERROR(MID(RC[-6],SEARCH("-1",RC[-6])+2,10),IFERROR(MID(RC[-6],SEARCH("-",RC[-6])+1,10),))))))))))) -> 恶魔猎手 | I443: ="1"&VLOOKUP(RC[-1],Sheet1!R2C2:R127C3,2,FALSE) -> 132409 | J443: 132409 | K443: =IFERROR(FIND(13,RC[-4],1),"") -> 14 | L443: =IF(RC[-1]="","",MID(RC[-5],RC[-1],6)) -> 132409 | M443: =SUBSTITUTE(RC[-6],RC[-1],RC[-3],1) -> "你们必须沉眠于此"|3#1324094|1
A444: 10445501 | B444: 45-6牛头人 | D444: 2 | E444: 15 | F444: 3|1 | G444: "这一斧子，山都能劈开！"|3#1324004|1 | H444: =IFERROR(MID(RC[-6],SEARCH("-10",RC[-6])+3,10),IFERROR(MID(RC[-6],SEARCH("-9",RC[-6])+2,10),IFERROR(MID(RC[-6],SEARCH("-8",RC[-6])+2,10),IFERROR(MID(RC[-6],SEARCH("-7",RC[-6])+2,10),IFERROR(MID(RC[-6],SEARCH("-6",RC[-6])+2,10),IFERROR(MID(RC[-6],SEARCH("-5",RC[-6])+2,10),IFERROR(MID(RC[-6],SEARCH("-4",RC[-6])+2,10),IFERROR(MID(RC[-6],SEARCH("-3",RC[-6])+2,10),IFERROR(MID(RC[-6],SEARCH("-2",RC[-6])+2,10),IFERROR(MID(RC[-6],SEARCH("-1",RC[-6])+2,10),IFERROR(MID(RC[-6],SEARCH("-",RC[-6])+1,10),))))))))))) -> 牛头人 | I444: ="1"&VLOOKUP(RC[-1],Sheet1!R2C2:R127C3,2,FALSE) -> 132400 | J444: 132400 | K444: =IFERROR(FIND(13,RC[-4],1),"") -> 17 | L444: =IF(RC[-1]="","",MID(RC[-5],RC[-1],6)) -> 132400 | M444: =SUBSTITUTE(RC[-6],RC[-1],RC[-3],1) -> "这一斧子，山都能劈开！"|3#1324004|1
A445: 10445502 | B445: 45-6牛头人 | D445: 2 | E445: 30 | F445: 3|1 | G445: "粉碎吧！"|3#1324004|1 | H445: =IFERROR(MID(RC[-6],SEARCH("-10",RC[-6])+3,10),IFERROR(MID(RC[-6],SEARCH("-9",RC[-6])+2,10),IFERROR(MID(RC[-6],SEARCH("-8",RC[-6])+2,10),IFERROR(MID(RC[-6],SEARCH("-7",RC[-6])+2,10),IFERROR(MID(RC[-6],SEARCH("-6",RC[-6])+2,10),IFERROR(MID(RC[-6],SEARCH("-5",RC[-6])+2,10),IFERROR(MID(RC[-6],SEARCH("-4",RC[-6])+2,10),IFERROR(MID(RC[-6],SEARCH("-3",RC[-6])+2,10),IFERROR(MID(RC[-6],SEARCH("-2",RC[-6])+2,10),IFERROR(MID(RC[-6],SEARCH("-1",RC[-6])+2,10),IFERROR(MID(RC[-6],SEARCH("-",RC[-6])+1,10),))))))))))) -> 牛头人 | I445: ="1"&VLOOKUP(RC[-1],Sheet1!R2C2:R127C3,2,FALSE) -> 132400 | J445: 132400 | K445: =IFERROR(FIND(13,RC[-4],1),"") -> 10 | L445: =IF(RC[-1]="","",MID(RC[-5],RC[-1],6)) -> 132400 | M445: =SUBSTITUTE(RC[-6],RC[-1],RC[-3],1) -> "粉碎吧！"|3#1324004|1
A446: 10445503 | B446: 45-6牛头人 | D446: 4 | F446: 3|1 | G446: "这是硝烟的盛宴！"|3#1324004|1 | H446: =IFERROR(MID(RC[-6],SEARCH("-10",RC[-6])+3,10),IFERROR(MID(RC[-6],SEARCH("-9",RC[-6])+2,10),IFERROR(MID(RC[-6],SEARCH("-8",RC[-6])+2,10),IFERROR(MID(RC[-6],SEARCH("-7",RC[-6])+2,10),IFERROR(MID(RC[-6],SEARCH("-6",RC[-6])+2,10),IFERROR(MID(RC[-6],SEARCH("-5",RC[-6])+2,10),IFERROR(MID(RC[-6],SEARCH("-4",RC[-6])+2,10),IFERROR(MID(RC[-6],SEARCH("-3",RC[-6])+2,10),IFERROR(MID(RC[-6],SEARCH("-2",RC[-6])+2,10),IFERROR(MID(RC[-6],SEARCH("-1",RC[-6])+2,10),IFERROR(MID(RC[-6],SEARCH("-",RC[-6])+1,10),))))))))))) -> 牛头人 | I446: ="1"&VLOOKUP(RC[-1],Sheet1!R2C2:R127C3,2,FALSE) -> 132400 | J446: 132400 | K446: =IFERROR(FIND(13,RC[-4],1),"") -> 14 | L446: =IF(RC[-1]="","",MID(RC[-5],RC[-1],6)) -> 132400 | M446: =SUBSTITUTE(RC[-6],RC[-1],RC[-3],1) -> "这是硝烟的盛宴！"|3#1324004|1
A447: 10449501 | B447: 45-10巫妖之王 | D447: 1 | E447: 104495|80 | F447: 3|1 | G447: "接我一剑——"|3#1325004|1 | H447: =IFERROR(MID(RC[-6],SEARCH("-10",RC[-6])+3,10),IFERROR(MID(RC[-6],SEARCH("-9",RC[-6])+2,10),IFERROR(MID(RC[-6],SEARCH("-8",RC[-6])+2,10),IFERROR(MID(RC[-6],SEARCH("-7",RC[-6])+2,10),IFERROR(MID(RC[-6],SEARCH("-6",RC[-6])+2,10),IFERROR(MID(RC[-6],SEARCH("-5",RC[-6])+2,10),IFERROR(MID(RC[-6],SEARCH("-4",RC[-6])+2,10),IFERROR(MID(RC[-6],SEARCH("-3",RC[-6])+2,10),IFERROR(MID(RC[-6],SEARCH("-2",RC[-6])+2,10),IFERROR(MID(RC[-6],SEARCH("-1",RC[-6])+2,10),IFERROR(MID(RC[-6],SEARCH("-",RC[-6])+1,10),))))))))))) -> 巫妖之王 | I447: ="1"&VLOOKUP(RC[-1],Sheet1!R2C2:R127C3,2,FALSE) -> 132500 | J447: 132500 | K447: =IFERROR(FIND(13,RC[-4],1),"") -> 12 | L447: =IF(RC[-1]="","",MID(RC[-5],RC[-1],6)) -> 132500 | M447: =SUBSTITUTE(RC[-6],RC[-1],RC[-3],1) -> "接我一剑——"|3#1325004|1
A448: 10449502 | B448: 45-10巫妖之王 | D448: 1 | E448: 104495|50 | F448: 3|1 | G448: "你的实力不错——"|3#1325004|1 | H448: =IFERROR(MID(RC[-6],SEARCH("-10",RC[-6])+3,10),IFERROR(MID(RC[-6],SEARCH("-9",RC[-6])+2,10),IFERROR(MID(RC[-6],SEARCH("-8",RC[-6])+2,10),IFERROR(MID(RC[-6],SEARCH("-7",RC[-6])+2,10),IFERROR(MID(RC[-6],SEARCH("-6",RC[-6])+2,10),IFERROR(MID(RC[-6],SEARCH("-5",RC[-6])+2,10),IFERROR(MID(RC[-6],SEARCH("-4",RC[-6])+2,10),IFERROR(MID(RC[-6],SEARCH("-3",RC[-6])+2,10),IFERROR(MID(RC[-6],SEARCH("-2",RC[-6])+2,10),IFERROR(MID(RC[-6],SEARCH("-1",RC[-6])+2,10),IFERROR(MID(RC[-6],SEARCH("-",RC[-6])+1,10),))))))))))) -> 巫妖之王 | I448: ="1"&VLOOKUP(RC[-1],Sheet1!R2C2:R127C3,2,FALSE) -> 132500 | J448: 132500 | K448: =IFERROR(FIND(13,RC[-4],1),"") -> 14 | L448: =IF(RC[-1]="","",MID(RC[-5],RC[-1],6)) -> 132500 | M448: =SUBSTITUTE(RC[-6],RC[-1],RC[-3],1) -> "你的实力不错——"|3#1325004|1
A449: 10449503 | B449: 45-10巫妖之王 | D449: 1 | E449: 104495|20 | F449: 3|1 | G449: "不过也就到此为止了！"|3#1325004|1 | H449: =IFERROR(MID(RC[-6],SEARCH("-10",RC[-6])+3,10),IFERROR(MID(RC[-6],SEARCH("-9",RC[-6])+2,10),IFERROR(MID(RC[-6],SEARCH("-8",RC[-6])+2,10),IFERROR(MID(RC[-6],SEARCH("-7",RC[-6])+2,10),IFERROR(MID(RC[-6],SEARCH("-6",RC[-6])+2,10),IFERROR(MID(RC[-6],SEARCH("-5",RC[-6])+2,10),IFERROR(MID(RC[-6],SEARCH("-4",RC[-6])+2,10),IFERROR(MID(RC[-6],SEARCH("-3",RC[-6])+2,10),IFERROR(MID(RC[-6],SEARCH("-2",RC[-6])+2,10),IFERROR(MID(RC[-6],SEARCH("-1",RC[-6])+2,10),IFERROR(MID(RC[-6],SEARCH("-",RC[-6])+1,10),))))))))))) -> 巫妖之王 | I449: ="1"&VLOOKUP(RC[-1],Sheet1!R2C2:R127C3,2,FALSE) -> 132500 | J449: 132500 | K449: =IFERROR(FIND(13,RC[-4],1),"") -> 16 | L449: =IF(RC[-1]="","",MID(RC[-5],RC[-1],6)) -> 132500 | M449: =SUBSTITUTE(RC[-6],RC[-1],RC[-3],1) -> "不过也就到此为止了！"|3#1325004|1
A450: 10452501 | B450: 46-3女警 | D450: 6 | F450: 3|1 | G450: "你被逮捕了！蠢货！"|3#1324204|1 | H450: =IFERROR(MID(RC[-6],SEARCH("-10",RC[-6])+3,10),IFERROR(MID(RC[-6],SEARCH("-9",RC[-6])+2,10),IFERROR(MID(RC[-6],SEARCH("-8",RC[-6])+2,10),IFERROR(MID(RC[-6],SEARCH("-7",RC[-6])+2,10),IFERROR(MID(RC[-6],SEARCH("-6",RC[-6])+2,10),IFERROR(MID(RC[-6],SEARCH("-5",RC[-6])+2,10),IFERROR(MID(RC[-6],SEARCH("-4",RC[-6])+2,10),IFERROR(MID(RC[-6],SEARCH("-3",RC[-6])+2,10),IFERROR(MID(RC[-6],SEARCH("-2",RC[-6])+2,10),IFERROR(MID(RC[-6],SEARCH("-1",RC[-6])+2,10),IFERROR(MID(RC[-6],SEARCH("-",RC[-6])+1,10),))))))))))) -> 女警 | I450: ="1"&VLOOKUP(RC[-1],Sheet1!R2C2:R127C3,2,FALSE) -> 132420 | J450: 132420 | K450: =IFERROR(FIND(13,RC[-4],1),"") -> 15 | L450: =IF(RC[-1]="","",MID(RC[-5],RC[-1],6)) -> 132420 | M450: =SUBSTITUTE(RC[-6],RC[-1],RC[-3],1) -> "你被逮捕了！蠢货！"|3#1324204|1
A451: 10452502 | B451: 46-3女警 | D451: 1 | E451: 104525|80 | F451: 3|1 | G451: "弹无虚发！"|3#1324204|1 | H451: =IFERROR(MID(RC[-6],SEARCH("-10",RC[-6])+3,10),IFERROR(MID(RC[-6],SEARCH("-9",RC[-6])+2,10),IFERROR(MID(RC[-6],SEARCH("-8",RC[-6])+2,10),IFERROR(MID(RC[-6],SEARCH("-7",RC[-6])+2,10),IFERROR(MID(RC[-6],SEARCH("-6",RC[-6])+2,10),IFERROR(MID(RC[-6],SEARCH("-5",RC[-6])+2,10),IFERROR(MID(RC[-6],SEARCH("-4",RC[-6])+2,10),IFERROR(MID(RC[-6],SEARCH("-3",RC[-6])+2,10),IFERROR(MID(RC[-6],SEARCH("-2",RC[-6])+2,10),IFERROR(MID(RC[-6],SEARCH("-1",RC[-6])+2,10),IFERROR(MID(RC[-6],SEARCH("-",RC[-6])+1,10),))))))))))) -> 女警 | I451: ="1"&VLOOKUP(RC[-1],Sheet1!R2C2:R127C3,2,FALSE) -> 132420 | J451: 132420 | K451: =IFERROR(FIND(13,RC[-4],1),"") -> 11 | L451: =IF(RC[-1]="","",MID(RC[-5],RC[-1],6)) -> 132420 | M451: =SUBSTITUTE(RC[-6],RC[-1],RC[-3],1) -> "弹无虚发！"|3#1324204|1
A452: 10452503 | B452: 46-3女警 | D452: 1 | E452: 104525|30 | F452: 3|1 | G452: "还需要再来一发！"|3#1324204|1 | H452: =IFERROR(MID(RC[-6],SEARCH("-10",RC[-6])+3,10),IFERROR(MID(RC[-6],SEARCH("-9",RC[-6])+2,10),IFERROR(MID(RC[-6],SEARCH("-8",RC[-6])+2,10),IFERROR(MID(RC[-6],SEARCH("-7",RC[-6])+2,10),IFERROR(MID(RC[-6],SEARCH("-6",RC[-6])+2,10),IFERROR(MID(RC[-6],SEARCH("-5",RC[-6])+2,10),IFERROR(MID(RC[-6],SEARCH("-4",RC[-6])+2,10),IFERROR(MID(RC[-6],SEARCH("-3",RC[-6])+2,10),IFERROR(MID(RC[-6],SEARCH("-2",RC[-6])+2,10),IFERROR(MID(RC[-6],SEARCH("-1",RC[-6])+2,10),IFERROR(MID(RC[-6],SEARCH("-",RC[-6])+1,10),))))))))))) -> 女警 | I452: ="1"&VLOOKUP(RC[-1],Sheet1!R2C2:R127C3,2,FALSE) -> 132420 | J452: 132420 | K452: =IFERROR(FIND(13,RC[-4],1),"") -> 14 | L452: =IF(RC[-1]="","",MID(RC[-5],RC[-1],6)) -> 132420 | M452: =SUBSTITUTE(RC[-6],RC[-1],RC[-3],1) -> "还需要再来一发！"|3#1324204|1
A453: 10459001 | B453: 46-10憎恶 | D453: 1 | E453: 104590|80 | F453: 3|1 | G453: "憎恶！"|3#1329994|1 | H453: =IFERROR(MID(RC[-6],SEARCH("-10",RC[-6])+3,10),IFERROR(MID(RC[-6],SEARCH("-9",RC[-6])+2,10),IFERROR(MID(RC[-6],SEARCH("-8",RC[-6])+2,10),IFERROR(MID(RC[-6],SEARCH("-7",RC[-6])+2,10),IFERROR(MID(RC[-6],SEARCH("-6",RC[-6])+2,10),IFERROR(MID(RC[-6],SEARCH("-5",RC[-6])+2,10),IFERROR(MID(RC[-6],SEARCH("-4",RC[-6])+2,10),IFERROR(MID(RC[-6],SEARCH("-3",RC[-6])+2,10),IFERROR(MID(RC[-6],SEARCH("-2",RC[-6])+2,10),IFERROR(MID(RC[-6],SEARCH("-1",RC[-6])+2,10),IFERROR(MID(RC[-6],SEARCH("-",RC[-6])+1,10),))))))))))) -> 憎恶 | I453: ="1"&VLOOKUP(RC[-1],Sheet1!R2C2:R127C3,2,FALSE) -> 132999 | J453: 132999 | K453: =IFERROR(FIND(13,RC[-4],1),"") -> 9 | L453: =IF(RC[-1]="","",MID(RC[-5],RC[-1],6)) -> 132999 | M453: =SUBSTITUTE(RC[-6],RC[-1],RC[-3],1) -> "憎恶！"|3#1329994|1
A454: 10459002 | B454: 46-10憎恶 | D454: 1 | E454: 104590|60 | F454: 3|1 | G454: "屠杀！"|3#1329994|1 | H454: =IFERROR(MID(RC[-6],SEARCH("-10",RC[-6])+3,10),IFERROR(MID(RC[-6],SEARCH("-9",RC[-6])+2,10),IFERROR(MID(RC[-6],SEARCH("-8",RC[-6])+2,10),IFERROR(MID(RC[-6],SEARCH("-7",RC[-6])+2,10),IFERROR(MID(RC[-6],SEARCH("-6",RC[-6])+2,10),IFERROR(MID(RC[-6],SEARCH("-5",RC[-6])+2,10),IFERROR(MID(RC[-6],SEARCH("-4",RC[-6])+2,10),IFERROR(MID(RC[-6],SEARCH("-3",RC[-6])+2,10),IFERROR(MID(RC[-6],SEARCH("-2",RC[-6])+2,10),IFERROR(MID(RC[-6],SEARCH("-1",RC[-6])+2,10),IFERROR(MID(RC[-6],SEARCH("-",RC[-6])+1,10),))))))))))) -> 憎恶 | I454: ="1"&VLOOKUP(RC[-1],Sheet1!R2C2:R127C3,2,FALSE) -> 132999 | J454: 132999 | K454: =IFERROR(FIND(13,RC[-4],1),"") -> 9 | L454: =IF(RC[-1]="","",MID(RC[-5],RC[-1],6)) -> 132999 | M454: =SUBSTITUTE(RC[-6],RC[-1],RC[-3],1) -> "屠杀！"|3#1329994|1
A455: 10459003 | B455: 46-10憎恶 | D455: 1 | E455: 104590|40 | F455: 3|1 | G455: "血肉！"|3#1329994|1 | H455: =IFERROR(MID(RC[-6],SEARCH("-10",RC[-6])+3,10),IFERROR(MID(RC[-6],SEARCH("-9",RC[-6])+2,10),IFERROR(MID(RC[-6],SEARCH("-8",RC[-6])+2,10),IFERROR(MID(RC[-6],SEARCH("-7",RC[-6])+2,10),IFERROR(MID(RC[-6],SEARCH("-6",RC[-6])+2,10),IFERROR(MID(RC[-6],SEARCH("-5",RC[-6])+2,10),IFERROR(MID(RC[-6],SEARCH("-4",RC[-6])+2,10),IFERROR(MID(RC[-6],SEARCH("-3",RC[-6])+2,10),IFERROR(MID(RC[-6],SEARCH("-2",RC[-6])+2,10),IFERROR(MID(RC[-6],SEARCH("-1",RC[-6])+2,10),IFERROR(MID(RC[-6],SEARCH("-",RC[-6])+1,10),))))))))))) -> 憎恶 | I455: ="1"&VLOOKUP(RC[-1],Sheet1!R2C2:R127C3,2,FALSE) -> 132999 | J455: 132999 | K455: =IFERROR(FIND(13,RC[-4],1),"") -> 9 | L455: =IF(RC[-1]="","",MID(RC[-5],RC[-1],6)) -> 132999 | M455: =SUBSTITUTE(RC[-6],RC[-1],RC[-3],1) -> "血肉！"|3#1329994|1
A456: 10459004 | B456: 46-10憎恶 | D456: 1 | E456: 104590|20 | F456: 3|1 | G456: "死亡！"|3#1329994|1 | H456: =IFERROR(MID(RC[-6],SEARCH("-10",RC[-6])+3,10),IFERROR(MID(RC[-6],SEARCH("-9",RC[-6])+2,10),IFERROR(MID(RC[-6],SEARCH("-8",RC[-6])+2,10),IFERROR(MID(RC[-6],SEARCH("-7",RC[-6])+2,10),IFERROR(MID(RC[-6],SEARCH("-6",RC[-6])+2,10),IFERROR(MID(RC[-6],SEARCH("-5",RC[-6])+2,10),IFERROR(MID(RC[-6],SEARCH("-4",RC[-6])+2,10),IFERROR(MID(RC[-6],SEARCH("-3",RC[-6])+2,10),IFERROR(MID(RC[-6],SEARCH("-2",RC[-6])+2,10),IFERROR(MID(RC[-6],SEARCH("-1",RC[-6])+2,10),IFERROR(MID(RC[-6],SEARCH("-",RC[-6])+1,10),))))))))))) -> 憎恶 | I456: ="1"&VLOOKUP(RC[-1],Sheet1!R2C2:R127C3,2,FALSE) -> 132999 | J456: 132999 | K456: =IFERROR(FIND(13,RC[-4],1),"") -> 9 | L456: =IF(RC[-1]="","",MID(RC[-5],RC[-1],6)) -> 132999 | M456: =SUBSTITUTE(RC[-6],RC[-1],RC[-3],1) -> "死亡！"|3#1329994|1
A457: 10462501 | B457: 47-3佐罗 | D457: 1 | E457: 104625|70 | F457: 3|1 | G457: "你将死在这剑下"|3#1314034|1 | H457: =IFERROR(MID(RC[-6],SEARCH("-10",RC[-6])+3,10),IFERROR(MID(RC[-6],SEARCH("-9",RC[-6])+2,10),IFERROR(MID(RC[-6],SEARCH("-8",RC[-6])+2,10),IFERROR(MID(RC[-6],SEARCH("-7",RC[-6])+2,10),IFERROR(MID(RC[-6],SEARCH("-6",RC[-6])+2,10),IFERROR(MID(RC[-6],SEARCH("-5",RC[-6])+2,10),IFERROR(MID(RC[-6],SEARCH("-4",RC[-6])+2,10),IFERROR(MID(RC[-6],SEARCH("-3",RC[-6])+2,10),IFERROR(MID(RC[-6],SEARCH("-2",RC[-6])+2,10),IFERROR(MID(RC[-6],SEARCH("-1",RC[-6])+2,10),IFERROR(MID(RC[-6],SEARCH("-",RC[-6])+1,10),))))))))))) -> 佐罗 | I457: ="1"&VLOOKUP(RC[-1],Sheet1!R2C2:R127C3,2,FALSE) -> 131403 | J457: 131403 | K457: =IFERROR(FIND(13,RC[-4],1),"") -> 13 | L457: =IF(RC[-1]="","",MID(RC[-5],RC[-1],6)) -> 131403 | M457: =SUBSTITUTE(RC[-6],RC[-1],RC[-3],1) -> "你将死在这剑下"|3#1314034|1
A458: 10462502 | B458: 47-3佐罗 | D458: 1 | E458: 104625|30 | F458: 3|1 | G458: "你将死在这剑下"|3#1314034|1 | H458: =IFERROR(MID(RC[-6],SEARCH("-10",RC[-6])+3,10),IFERROR(MID(RC[-6],SEARCH("-9",RC[-6])+2,10),IFERROR(MID(RC[-6],SEARCH("-8",RC[-6])+2,10),IFERROR(MID(RC[-6],SEARCH("-7",RC[-6])+2,10),IFERROR(MID(RC[-6],SEARCH("-6",RC[-6])+2,10),IFERROR(MID(RC[-6],SEARCH("-5",RC[-6])+2,10),IFERROR(MID(RC[-6],SEARCH("-4",RC[-6])+2,10),IFERROR(MID(RC[-6],SEARCH("-3",RC[-6])+2,10),IFERROR(MID(RC[-6],SEARCH("-2",RC[-6])+2,10),IFERROR(MID(RC[-6],SEARCH("-1",RC[-6])+2,10),IFERROR(MID(RC[-6],SEARCH("-",RC[-6])+1,10),))))))))))) -> 佐罗 | I458: ="1"&VLOOKUP(RC[-1],Sheet1!R2C2:R127C3,2,FALSE) -> 131403 | J458: 131403 | K458: =IFERROR(FIND(13,RC[-4],1),"") -> 13 | L458: =IF(RC[-1]="","",MID(RC[-5],RC[-1],6)) -> 131403 | M458: =SUBSTITUTE(RC[-6],RC[-1],RC[-3],1) -> "你将死在这剑下"|3#1314034|1
A459: 10462503 | B459: 47-3佐罗 | D459: 2 | E459: 30 | F459: 3|1 | G459: "你的死期到了"|3#1314034|1 | H459: =IFERROR(MID(RC[-6],SEARCH("-10",RC[-6])+3,10),IFERROR(MID(RC[-6],SEARCH("-9",RC[-6])+2,10),IFERROR(MID(RC[-6],SEARCH("-8",RC[-6])+2,10),IFERROR(MID(RC[-6],SEARCH("-7",RC[-6])+2,10),IFERROR(MID(RC[-6],SEARCH("-6",RC[-6])+2,10),IFERROR(MID(RC[-6],SEARCH("-5",RC[-6])+2,10),IFERROR(MID(RC[-6],SEARCH("-4",RC[-6])+2,10),IFERROR(MID(RC[-6],SEARCH("-3",RC[-6])+2,10),IFERROR(MID(RC[-6],SEARCH("-2",RC[-6])+2,10),IFERROR(MID(RC[-6],SEARCH("-1",RC[-6])+2,10),IFERROR(MID(RC[-6],SEARCH("-",RC[-6])+1,10),))))))))))) -> 佐罗 | I459: ="1"&VLOOKUP(RC[-1],Sheet1!R2C2:R127C3,2,FALSE) -> 131403 | J459: 131403 | K459: =IFERROR(FIND(13,RC[-4],1),"") -> 12 | L459: =IF(RC[-1]="","",MID(RC[-5],RC[-1],6)) -> 131403 | M459: =SUBSTITUTE(RC[-6],RC[-1],RC[-3],1) -> "你的死期到了"|3#1314034|1
A460: 10462504 | B460: 47-3佐罗 | D460: 6 | F460: 3|1 | G460: "让它沾染上你的鲜血"|3#1314034|1 | H460: =IFERROR(MID(RC[-6],SEARCH("-10",RC[-6])+3,10),IFERROR(MID(RC[-6],SEARCH("-9",RC[-6])+2,10),IFERROR(MID(RC[-6],SEARCH("-8",RC[-6])+2,10),IFERROR(MID(RC[-6],SEARCH("-7",RC[-6])+2,10),IFERROR(MID(RC[-6],SEARCH("-6",RC[-6])+2,10),IFERROR(MID(RC[-6],SEARCH("-5",RC[-6])+2,10),IFERROR(MID(RC[-6],SEARCH("-4",RC[-6])+2,10),IFERROR(MID(RC[-6],SEARCH("-3",RC[-6])+2,10),IFERROR(MID(RC[-6],SEARCH("-2",RC[-6])+2,10),IFERROR(MID(RC[-6],SEARCH("-1",RC[-6])+2,10),IFERROR(MID(RC[-6],SEARCH("-",RC[-6])+1,10),))))))))))) -> 佐罗 | I460: ="1"&VLOOKUP(RC[-1],Sheet1!R2C2:R127C3,2,FALSE) -> 131403 | J460: 131403 | K460: =IFERROR(FIND(13,RC[-4],1),"") -> 15 | L460: =IF(RC[-1]="","",MID(RC[-5],RC[-1],6)) -> 131403 | M460: =SUBSTITUTE(RC[-6],RC[-1],RC[-3],1) -> "让它沾染上你的鲜血"|3#1314034|1
A461: 10469501 | B461: 47-10美杜莎 | D461: 1 | E461: 104695|80 | F461: 3|1 | G461: "成为妆点阴影的石像吧"|3#1314304|1 | H461: =IFERROR(MID(RC[-6],SEARCH("-10",RC[-6])+3,10),IFERROR(MID(RC[-6],SEARCH("-9",RC[-6])+2,10),IFERROR(MID(RC[-6],SEARCH("-8",RC[-6])+2,10),IFERROR(MID(RC[-6],SEARCH("-7",RC[-6])+2,10),IFERROR(MID(RC[-6],SEARCH("-6",RC[-6])+2,10),IFERROR(MID(RC[-6],SEARCH("-5",RC[-6])+2,10),IFERROR(MID(RC[-6],SEARCH("-4",RC[-6])+2,10),IFERROR(MID(RC[-6],SEARCH("-3",RC[-6])+2,10),IFERROR(MID(RC[-6],SEARCH("-2",RC[-6])+2,10),IFERROR(MID(RC[-6],SEARCH("-1",RC[-6])+2,10),IFERROR(MID(RC[-6],SEARCH("-",RC[-6])+1,10),))))))))))) -> 美杜莎 | I461: ="1"&VLOOKUP(RC[-1],Sheet1!R2C2:R127C3,2,FALSE) -> 131430 | J461: 131430 | K461: =IFERROR(FIND(13,RC[-4],1),"") -> 16 | L461: =IF(RC[-1]="","",MID(RC[-5],RC[-1],6)) -> 131430 | M461: =SUBSTITUTE(RC[-6],RC[-1],RC[-3],1) -> "成为妆点阴影的石像吧"|3#1314304|1
A462: 10469502 | B462: 47-10美杜莎 | D462: 1 | E462: 104695|50 | F462: 3|1 | G462: "看着我——"|3#1314304|1 | H462: =IFERROR(MID(RC[-6],SEARCH("-10",RC[-6])+3,10),IFERROR(MID(RC[-6],SEARCH("-9",RC[-6])+2,10),IFERROR(MID(RC[-6],SEARCH("-8",RC[-6])+2,10),IFERROR(MID(RC[-6],SEARCH("-7",RC[-6])+2,10),IFERROR(MID(RC[-6],SEARCH("-6",RC[-6])+2,10),IFERROR(MID(RC[-6],SEARCH("-5",RC[-6])+2,10),IFERROR(MID(RC[-6],SEARCH("-4",RC[-6])+2,10),IFERROR(MID(RC[-6],SEARCH("-3",RC[-6])+2,10),IFERROR(MID(RC[-6],SEARCH("-2",RC[-6])+2,10),IFERROR(MID(RC[-6],SEARCH("-1",RC[-6])+2,10),IFERROR(MID(RC[-6],SEARCH("-",RC[-6])+1,10),))))))))))) -> 美杜莎 | I462: ="1"&VLOOKUP(RC[-1],Sheet1!R2C2:R127C3,2,FALSE) -> 131430 | J462: 131430 | K462: =IFERROR(FIND(13,RC[-4],1),"") -> 11 | L462: =IF(RC[-1]="","",MID(RC[-5],RC[-1],6)) -> 131430 | M462: =SUBSTITUTE(RC[-6],RC[-1],RC[-3],1) -> "看着我——"|3#1314304|1
A463: 10469503 | B463: 47-10美杜莎 | D463: 1 | E463: 104695|20 | F463: 3|1 | G463: "你将要变成一块石头"|3#1314304|1 | H463: =IFERROR(MID(RC[-6],SEARCH("-10",RC[-6])+3,10),IFERROR(MID(RC[-6],SEARCH("-9",RC[-6])+2,10),IFERROR(MID(RC[-6],SEARCH("-8",RC[-6])+2,10),IFERROR(MID(RC[-6],SEARCH("-7",RC[-6])+2,10),IFERROR(MID(RC[-6],SEARCH("-6",RC[-6])+2,10),IFERROR(MID(RC[-6],SEARCH("-5",RC[-6])+2,10),IFERROR(MID(RC[-6],SEARCH("-4",RC[-6])+2,10),IFERROR(MID(RC[-6],SEARCH("-3",RC[-6])+2,10),IFERROR(MID(RC[-6],SEARCH("-2",RC[-6])+2,10),IFERROR(MID(RC[-6],SEARCH("-1",RC[-6])+2,10),IFERROR(MID(RC[-6],SEARCH("-",RC[-6])+1,10),))))))))))) -> 美杜莎 | I463: ="1"&VLOOKUP(RC[-1],Sheet1!R2C2:R127C3,2,FALSE) -> 131430 | J463: 131430 | K463: =IFERROR(FIND(13,RC[-4],1),"") -> 15 | L463: =IF(RC[-1]="","",MID(RC[-5],RC[-1],6)) -> 131430 | M463: =SUBSTITUTE(RC[-6],RC[-1],RC[-3],1) -> "你将要变成一块石头"|3#1314304|1
A464: 10475501 | B464: 48-6致命特工 | D464: 1 | E464: 104755|80 | F464: 3|1 | G464: "精准，而致命"|3#1304014|1 | H464: =IFERROR(MID(RC[-6],SEARCH("-10",RC[-6])+3,10),IFERROR(MID(RC[-6],SEARCH("-9",RC[-6])+2,10),IFERROR(MID(RC[-6],SEARCH("-8",RC[-6])+2,10),IFERROR(MID(RC[-6],SEARCH("-7",RC[-6])+2,10),IFERROR(MID(RC[-6],SEARCH("-6",RC[-6])+2,10),IFERROR(MID(RC[-6],SEARCH("-5",RC[-6])+2,10),IFERROR(MID(RC[-6],SEARCH("-4",RC[-6])+2,10),IFERROR(MID(RC[-6],SEARCH("-3",RC[-6])+2,10),IFERROR(MID(RC[-6],SEARCH("-2",RC[-6])+2,10),IFERROR(MID(RC[-6],SEARCH("-1",RC[-6])+2,10),IFERROR(MID(RC[-6],SEARCH("-",RC[-6])+1,10),))))))))))) -> 致命特工 | I464: ="1"&VLOOKUP(RC[-1],Sheet1!R2C2:R127C3,2,FALSE) -> 130401 | J464: 130401 | K464: =IFERROR(FIND(13,RC[-4],1),"") -> 12 | L464: =IF(RC[-1]="","",MID(RC[-5],RC[-1],6)) -> 130401 | M464: =SUBSTITUTE(RC[-6],RC[-1],RC[-3],1) -> "精准，而致命"|3#1304014|1
A465: 10475502 | B465: 48-6致命特工 | D465: 1 | E465: 104755|55 | F465: 1 | G465: 1304014|1 | H465: =IFERROR(MID(RC[-6],SEARCH("-10",RC[-6])+3,10),IFERROR(MID(RC[-6],SEARCH("-9",RC[-6])+2,10),IFERROR(MID(RC[-6],SEARCH("-8",RC[-6])+2,10),IFERROR(MID(RC[-6],SEARCH("-7",RC[-6])+2,10),IFERROR(MID(RC[-6],SEARCH("-6",RC[-6])+2,10),IFERROR(MID(RC[-6],SEARCH("-5",RC[-6])+2,10),IFERROR(MID(RC[-6],SEARCH("-4",RC[-6])+2,10),IFERROR(MID(RC[-6],SEARCH("-3",RC[-6])+2,10),IFERROR(MID(RC[-6],SEARCH("-2",RC[-6])+2,10),IFERROR(MID(RC[-6],SEARCH("-1",RC[-6])+2,10),IFERROR(MID(RC[-6],SEARCH("-",RC[-6])+1,10),))))))))))) -> 致命特工 | I465: ="1"&VLOOKUP(RC[-1],Sheet1!R2C2:R127C3,2,FALSE) -> 130401 | J465: 130401 | K465: =IFERROR(FIND(13,RC[-4],1),"") -> 1 | L465: =IF(RC[-1]="","",MID(RC[-5],RC[-1],6)) -> 130401 | M465: =SUBSTITUTE(RC[-6],RC[-1],RC[-3],1) -> 1304014|1
A466: 10475503 | B466: 48-6致命特工 | D466: 1 | E466: 104755|25 | F466: 3|1 | G466: "杀戮，很简单"|3#1304014|1 | H466: =IFERROR(MID(RC[-6],SEARCH("-10",RC[-6])+3,10),IFERROR(MID(RC[-6],SEARCH("-9",RC[-6])+2,10),IFERROR(MID(RC[-6],SEARCH("-8",RC[-6])+2,10),IFERROR(MID(RC[-6],SEARCH("-7",RC[-6])+2,10),IFERROR(MID(RC[-6],SEARCH("-6",RC[-6])+2,10),IFERROR(MID(RC[-6],SEARCH("-5",RC[-6])+2,10),IFERROR(MID(RC[-6],SEARCH("-4",RC[-6])+2,10),IFERROR(MID(RC[-6],SEARCH("-3",RC[-6])+2,10),IFERROR(MID(RC[-6],SEARCH("-2",RC[-6])+2,10),IFERROR(MID(RC[-6],SEARCH("-1",RC[-6])+2,10),IFERROR(MID(RC[-6],SEARCH("-",RC[-6])+1,10),))))))))))) -> 致命特工 | I466: ="1"&VLOOKUP(RC[-1],Sheet1!R2C2:R127C3,2,FALSE) -> 130401 | J466: 130401 | K466: =IFERROR(FIND(13,RC[-4],1),"") -> 12 | L466: =IF(RC[-1]="","",MID(RC[-5],RC[-1],6)) -> 130401 | M466: =SUBSTITUTE(RC[-6],RC[-1],RC[-3],1) -> "杀戮，很简单"|3#1304014|1
A467: 10479501 | B467: 48-10地狱骑士 | D467: 1 | E467: 104795|70 | F467: 3|1 | G467: "罪恶都将成为过去"|3#1304034|1 | H467: =IFERROR(MID(RC[-6],SEARCH("-10",RC[-6])+3,10),IFERROR(MID(RC[-6],SEARCH("-9",RC[-6])+2,10),IFERROR(MID(RC[-6],SEARCH("-8",RC[-6])+2,10),IFERROR(MID(RC[-6],SEARCH("-7",RC[-6])+2,10),IFERROR(MID(RC[-6],SEARCH("-6",RC[-6])+2,10),IFERROR(MID(RC[-6],SEARCH("-5",RC[-6])+2,10),IFERROR(MID(RC[-6],SEARCH("-4",RC[-6])+2,10),IFERROR(MID(RC[-6],SEARCH("-3",RC[-6])+2,10),IFERROR(MID(RC[-6],SEARCH("-2",RC[-6])+2,10),IFERROR(MID(RC[-6],SEARCH("-1",RC[-6])+2,10),IFERROR(MID(RC[-6],SEARCH("-",RC[-6])+1,10),))))))))))) -> 地狱骑士 | I467: ="1"&VLOOKUP(RC[-1],Sheet1!R2C2:R127C3,2,FALSE) -> 130403 | J467: 130403 | K467: =IFERROR(FIND(13,RC[-4],1),"") -> 14 | L467: =IF(RC[-1]="","",MID(RC[-5],RC[-1],6)) -> 130403 | M467: =SUBSTITUTE(RC[-6],RC[-1],RC[-3],1) -> "罪恶都将成为过去"|3#1304034|1
A468: 10479502 | B468: 48-10地狱骑士 | D468: 1 | E468: 104795|30 | F468: 3|1 | G468: "因为全都即将死去！"|3#1304034|1 | H468: =IFERROR(MID(RC[-6],SEARCH("-10",RC[-6])+3,10),IFERROR(MID(RC[-6],SEARCH("-9",RC[-6])+2,10),IFERROR(MID(RC[-6],SEARCH("-8",RC[-6])+2,10),IFERROR(MID(RC[-6],SEARCH("-7",RC[-6])+2,10),IFERROR(MID(RC[-6],SEARCH("-6",RC[-6])+2,10),IFERROR(MID(RC[-6],SEARCH("-5",RC[-6])+2,10),IFERROR(MID(RC[-6],SEARCH("-4",RC[-6])+2,10),IFERROR(MID(RC[-6],SEARCH("-3",RC[-6])+2,10),IFERROR(MID(RC[-6],SEARCH("-2",RC[-6])+2,10),IFERROR(MID(RC[-6],SEARCH("-1",RC[-6])+2,10),IFERROR(MID(RC[-6],SEARCH("-",RC[-6])+1,10),))))))))))) -> 地狱骑士 | I468: ="1"&VLOOKUP(RC[-1],Sheet1!R2C2:R127C3,2,FALSE) -> 130403 | J468: 130403 | K468: =IFERROR(FIND(13,RC[-4],1),"") -> 15 | L468: =IF(RC[-1]="","",MID(RC[-5],RC[-1],6)) -> 130403 | M468: =SUBSTITUTE(RC[-6],RC[-1],RC[-3],1) -> "因为全都即将死去！"|3#1304034|1
A469: 10479503 | B469: 48-10地狱骑士 | D469: 6 | F469: 3|1 | G469: "结束一切！"|3#1304034|1 | H469: =IFERROR(MID(RC[-6],SEARCH("-10",RC[-6])+3,10),IFERROR(MID(RC[-6],SEARCH("-9",RC[-6])+2,10),IFERROR(MID(RC[-6],SEARCH("-8",RC[-6])+2,10),IFERROR(MID(RC[-6],SEARCH("-7",RC[-6])+2,10),IFERROR(MID(RC[-6],SEARCH("-6",RC[-6])+2,10),IFERROR(MID(RC[-6],SEARCH("-5",RC[-6])+2,10),IFERROR(MID(RC[-6],SEARCH("-4",RC[-6])+2,10),IFERROR(MID(RC[-6],SEARCH("-3",RC[-6])+2,10),IFERROR(MID(RC[-6],SEARCH("-2",RC[-6])+2,10),IFERROR(MID(RC[-6],SEARCH("-1",RC[-6])+2,10),IFERROR(MID(RC[-6],SEARCH("-",RC[-6])+1,10),))))))))))) -> 地狱骑士 | I469: ="1"&VLOOKUP(RC[-1],Sheet1!R2C2:R127C3,2,FALSE) -> 130403 | J469: 130403 | K469: =IFERROR(FIND(13,RC[-4],1),"") -> 11 | L469: =IF(RC[-1]="","",MID(RC[-5],RC[-1],6)) -> 130403 | M469: =SUBSTITUTE(RC[-6],RC[-1],RC[-3],1) -> "结束一切！"|3#1304034|1
A470: 10485501 | B470: 49-6死亡武士 | C470: 2 | D470: 6 | F470: 3|1 | G470: "死吧！"|3#1303024|1 | H470: =IFERROR(MID(RC[-6],SEARCH("-10",RC[-6])+3,10),IFERROR(MID(RC[-6],SEARCH("-9",RC[-6])+2,10),IFERROR(MID(RC[-6],SEARCH("-8",RC[-6])+2,10),IFERROR(MID(RC[-6],SEARCH("-7",RC[-6])+2,10),IFERROR(MID(RC[-6],SEARCH("-6",RC[-6])+2,10),IFERROR(MID(RC[-6],SEARCH("-5",RC[-6])+2,10),IFERROR(MID(RC[-6],SEARCH("-4",RC[-6])+2,10),IFERROR(MID(RC[-6],SEARCH("-3",RC[-6])+2,10),IFERROR(MID(RC[-6],SEARCH("-2",RC[-6])+2,10),IFERROR(MID(RC[-6],SEARCH("-1",RC[-6])+2,10),IFERROR(MID(RC[-6],SEARCH("-",RC[-6])+1,10),))))))))))) -> 死亡武士 | I470: ="1"&VLOOKUP(RC[-1],Sheet1!R2C2:R127C3,2,FALSE) -> 130302 | J470: 130302 | K470: =IFERROR(FIND(13,RC[-4],1),"") -> 9 | L470: =IF(RC[-1]="","",MID(RC[-5],RC[-1],6)) -> 130302 | M470: =SUBSTITUTE(RC[-6],RC[-1],RC[-3],1) -> "死吧！"|3#1303024|1
A471: 10485502 | B471: 49-6死亡武士 | D471: 1 | E471: 104855|50 | F471: 3|1 | G471: "哟，不得了不得了"|3#1303024|1 | H471: =IFERROR(MID(RC[-6],SEARCH("-10",RC[-6])+3,10),IFERROR(MID(RC[-6],SEARCH("-9",RC[-6])+2,10),IFERROR(MID(RC[-6],SEARCH("-8",RC[-6])+2,10),IFERROR(MID(RC[-6],SEARCH("-7",RC[-6])+2,10),IFERROR(MID(RC[-6],SEARCH("-6",RC[-6])+2,10),IFERROR(MID(RC[-6],SEARCH("-5",RC[-6])+2,10),IFERROR(MID(RC[-6],SEARCH("-4",RC[-6])+2,10),IFERROR(MID(RC[-6],SEARCH("-3",RC[-6])+2,10),IFERROR(MID(RC[-6],SEARCH("-2",RC[-6])+2,10),IFERROR(MID(RC[-6],SEARCH("-1",RC[-6])+2,10),IFERROR(MID(RC[-6],SEARCH("-",RC[-6])+1,10),))))))))))) -> 死亡武士 | I471: ="1"&VLOOKUP(RC[-1],Sheet1!R2C2:R127C3,2,FALSE) -> 130302 | J471: 130302 | K471: =IFERROR(FIND(13,RC[-4],1),"") -> 14 | L471: =IF(RC[-1]="","",MID(RC[-5],RC[-1],6)) -> 130302 | M471: =SUBSTITUTE(RC[-6],RC[-1],RC[-3],1) -> "哟，不得了不得了"|3#1303024|1
A472: 10489501 | B472: 49-10德古拉伯爵 | D472: 1 | E472: 104895|70 | F472: 3|1 | G472: "将血肉都献祭出来吧！"|3#400027|1 | H472: =IFERROR(MID(RC[-6],SEARCH("-10",RC[-6])+3,10),IFERROR(MID(RC[-6],SEARCH("-9",RC[-6])+2,10),IFERROR(MID(RC[-6],SEARCH("-8",RC[-6])+2,10),IFERROR(MID(RC[-6],SEARCH("-7",RC[-6])+2,10),IFERROR(MID(RC[-6],SEARCH("-6",RC[-6])+2,10),IFERROR(MID(RC[-6],SEARCH("-5",RC[-6])+2,10),IFERROR(MID(RC[-6],SEARCH("-4",RC[-6])+2,10),IFERROR(MID(RC[-6],SEARCH("-3",RC[-6])+2,10),IFERROR(MID(RC[-6],SEARCH("-2",RC[-6])+2,10),IFERROR(MID(RC[-6],SEARCH("-1",RC[-6])+2,10),IFERROR(MID(RC[-6],SEARCH("-",RC[-6])+1,10),))))))))))) -> 德古拉伯爵 | I472: ="1"&VLOOKUP(RC[-1],Sheet1!R2C2:R127C3,2,FALSE) -> 131401 | J472: 131401 | K472: =IFERROR(FIND(13,RC[-4],1),"") ->  | L472: =IF(RC[-1]="","",MID(RC[-5],RC[-1],6)) ->  | M472: =SUBSTITUTE(RC[-6],RC[-1],RC[-3],1) -> "将血肉都献祭出来吧！"|3#400027|1
A473: 10489502 | B473: 49-10德古拉伯爵 | D473: 1 | E473: 104895|30 | F473: 3|1 | G473: "你们只能是食物——"|3#400027|1 | H473: =IFERROR(MID(RC[-6],SEARCH("-10",RC[-6])+3,10),IFERROR(MID(RC[-6],SEARCH("-9",RC[-6])+2,10),IFERROR(MID(RC[-6],SEARCH("-8",RC[-6])+2,10),IFERROR(MID(RC[-6],SEARCH("-7",RC[-6])+2,10),IFERROR(MID(RC[-6],SEARCH("-6",RC[-6])+2,10),IFERROR(MID(RC[-6],SEARCH("-5",RC[-6])+2,10),IFERROR(MID(RC[-6],SEARCH("-4",RC[-6])+2,10),IFERROR(MID(RC[-6],SEARCH("-3",RC[-6])+2,10),IFERROR(MID(RC[-6],SEARCH("-2",RC[-6])+2,10),IFERROR(MID(RC[-6],SEARCH("-1",RC[-6])+2,10),IFERROR(MID(RC[-6],SEARCH("-",RC[-6])+1,10),))))))))))) -> 德古拉伯爵 | I473: ="1"&VLOOKUP(RC[-1],Sheet1!R2C2:R127C3,2,FALSE) -> 131401 | J473: 131401 | K473: =IFERROR(FIND(13,RC[-4],1),"") ->  | L473: =IF(RC[-1]="","",MID(RC[-5],RC[-1],6)) ->  | M473: =SUBSTITUTE(RC[-6],RC[-1],RC[-3],1) -> "你们只能是食物——"|3#400027|1
A474: 10495501 | B474: 50-6亚马逊女王 | D474: 1 | E474: 104955|70 | F474: 3|1 | G474: "你们应该承受这些"|3#1314204|1 | H474: =IFERROR(MID(RC[-6],SEARCH("-10",RC[-6])+3,10),IFERROR(MID(RC[-6],SEARCH("-9",RC[-6])+2,10),IFERROR(MID(RC[-6],SEARCH("-8",RC[-6])+2,10),IFERROR(MID(RC[-6],SEARCH("-7",RC[-6])+2,10),IFERROR(MID(RC[-6],SEARCH("-6",RC[-6])+2,10),IFERROR(MID(RC[-6],SEARCH("-5",RC[-6])+2,10),IFERROR(MID(RC[-6],SEARCH("-4",RC[-6])+2,10),IFERROR(MID(RC[-6],SEARCH("-3",RC[-6])+2,10),IFERROR(MID(RC[-6],SEARCH("-2",RC[-6])+2,10),IFERROR(MID(RC[-6],SEARCH("-1",RC[-6])+2,10),IFERROR(MID(RC[-6],SEARCH("-",RC[-6])+1,10),))))))))))) -> 亚马逊女王 | I474: ="1"&VLOOKUP(RC[-1],Sheet1!R2C2:R127C3,2,FALSE) -> 131420 | J474: 131420 | K474: =IFERROR(FIND(13,RC[-4],1),"") -> 14 | L474: =IF(RC[-1]="","",MID(RC[-5],RC[-1],6)) -> 131420 | M474: =SUBSTITUTE(RC[-6],RC[-1],RC[-3],1) -> "你们应该承受这些"|3#1314204|1
A475: 10495502 | B475: 50-6亚马逊女王 | D475: 1 | E475: 104955|30 | F475: 3|1 | G475: "火焰是救赎"|3#1314204|1 | H475: =IFERROR(MID(RC[-6],SEARCH("-10",RC[-6])+3,10),IFERROR(MID(RC[-6],SEARCH("-9",RC[-6])+2,10),IFERROR(MID(RC[-6],SEARCH("-8",RC[-6])+2,10),IFERROR(MID(RC[-6],SEARCH("-7",RC[-6])+2,10),IFERROR(MID(RC[-6],SEARCH("-6",RC[-6])+2,10),IFERROR(MID(RC[-6],SEARCH("-5",RC[-6])+2,10),IFERROR(MID(RC[-6],SEARCH("-4",RC[-6])+2,10),IFERROR(MID(RC[-6],SEARCH("-3",RC[-6])+2,10),IFERROR(MID(RC[-6],SEARCH("-2",RC[-6])+2,10),IFERROR(MID(RC[-6],SEARCH("-1",RC[-6])+2,10),IFERROR(MID(RC[-6],SEARCH("-",RC[-6])+1,10),))))))))))) -> 亚马逊女王 | I475: ="1"&VLOOKUP(RC[-1],Sheet1!R2C2:R127C3,2,FALSE) -> 131420 | J475: 131420 | K475: =IFERROR(FIND(13,RC[-4],1),"") -> 11 | L475: =IF(RC[-1]="","",MID(RC[-5],RC[-1],6)) -> 131420 | M475: =SUBSTITUTE(RC[-6],RC[-1],RC[-3],1) -> "火焰是救赎"|3#1314204|1
A476: 10495503 | B476: 50-6亚马逊女王 | D476: 6 | F476: 3|1 | G476: "化为焦炭吧"|3#1314204|1 | H476: =IFERROR(MID(RC[-6],SEARCH("-10",RC[-6])+3,10),IFERROR(MID(RC[-6],SEARCH("-9",RC[-6])+2,10),IFERROR(MID(RC[-6],SEARCH("-8",RC[-6])+2,10),IFERROR(MID(RC[-6],SEARCH("-7",RC[-6])+2,10),IFERROR(MID(RC[-6],SEARCH("-6",RC[-6])+2,10),IFERROR(MID(RC[-6],SEARCH("-5",RC[-6])+2,10),IFERROR(MID(RC[-6],SEARCH("-4",RC[-6])+2,10),IFERROR(MID(RC[-6],SEARCH("-3",RC[-6])+2,10),IFERROR(MID(RC[-6],SEARCH("-2",RC[-6])+2,10),IFERROR(MID(RC[-6],SEARCH("-1",RC[-6])+2,10),IFERROR(MID(RC[-6],SEARCH("-",RC[-6])+1,10),))))))))))) -> 亚马逊女王 | I476: ="1"&VLOOKUP(RC[-1],Sheet1!R2C2:R127C3,2,FALSE) -> 131420 | J476: 131420 | K476: =IFERROR(FIND(13,RC[-4],1),"") -> 11 | L476: =IF(RC[-1]="","",MID(RC[-5],RC[-1],6)) -> 131420 | M476: =SUBSTITUTE(RC[-6],RC[-1],RC[-3],1) -> "化为焦炭吧"|3#1314204|1
A477: 10499501 | B477: 50-10树人 | D477: 1 | E477: 104995|85 | F477: 3|1 | G477: "吼！！！"|3#1304114|1 | H477: =IFERROR(MID(RC[-6],SEARCH("-10",RC[-6])+3,10),IFERROR(MID(RC[-6],SEARCH("-9",RC[-6])+2,10),IFERROR(MID(RC[-6],SEARCH("-8",RC[-6])+2,10),IFERROR(MID(RC[-6],SEARCH("-7",RC[-6])+2,10),IFERROR(MID(RC[-6],SEARCH("-6",RC[-6])+2,10),IFERROR(MID(RC[-6],SEARCH("-5",RC[-6])+2,10),IFERROR(MID(RC[-6],SEARCH("-4",RC[-6])+2,10),IFERROR(MID(RC[-6],SEARCH("-3",RC[-6])+2,10),IFERROR(MID(RC[-6],SEARCH("-2",RC[-6])+2,10),IFERROR(MID(RC[-6],SEARCH("-1",RC[-6])+2,10),IFERROR(MID(RC[-6],SEARCH("-",RC[-6])+1,10),))))))))))) -> 树人 | I477: ="1"&VLOOKUP(RC[-1],Sheet1!R2C2:R127C3,2,FALSE) -> 130411 | J477: 130411 | K477: =IFERROR(FIND(13,RC[-4],1),"") -> 10 | L477: =IF(RC[-1]="","",MID(RC[-5],RC[-1],6)) -> 130411 | M477: =SUBSTITUTE(RC[-6],RC[-1],RC[-3],1) -> "吼！！！"|3#1304114|1
A478: 10499502 | B478: 50-10树人 | D478: 1 | E478: 104995|55 | F478: 3|1 | G478: "啊！！！"|3#1304114|1 | H478: =IFERROR(MID(RC[-6],SEARCH("-10",RC[-6])+3,10),IFERROR(MID(RC[-6],SEARCH("-9",RC[-6])+2,10),IFERROR(MID(RC[-6],SEARCH("-8",RC[-6])+2,10),IFERROR(MID(RC[-6],SEARCH("-7",RC[-6])+2,10),IFERROR(MID(RC[-6],SEARCH("-6",RC[-6])+2,10),IFERROR(MID(RC[-6],SEARCH("-5",RC[-6])+2,10),IFERROR(MID(RC[-6],SEARCH("-4",RC[-6])+2,10),IFERROR(MID(RC[-6],SEARCH("-3",RC[-6])+2,10),IFERROR(MID(RC[-6],SEARCH("-2",RC[-6])+2,10),IFERROR(MID(RC[-6],SEARCH("-1",RC[-6])+2,10),IFERROR(MID(RC[-6],SEARCH("-",RC[-6])+1,10),))))))))))) -> 树人 | I478: ="1"&VLOOKUP(RC[-1],Sheet1!R2C2:R127C3,2,FALSE) -> 130411 | J478: 130411 | K478: =IFERROR(FIND(13,RC[-4],1),"") -> 10 | L478: =IF(RC[-1]="","",MID(RC[-5],RC[-1],6)) -> 130411 | M478: =SUBSTITUTE(RC[-6],RC[-1],RC[-3],1) -> "啊！！！"|3#1304114|1
A479: 10499503 | B479: 50-10树人 | D479: 1 | E479: 104995|25 | F479: 3|1 | G479: "死！！！"|3#1304114|1 | H479: =IFERROR(MID(RC[-6],SEARCH("-10",RC[-6])+3,10),IFERROR(MID(RC[-6],SEARCH("-9",RC[-6])+2,10),IFERROR(MID(RC[-6],SEARCH("-8",RC[-6])+2,10),IFERROR(MID(RC[-6],SEARCH("-7",RC[-6])+2,10),IFERROR(MID(RC[-6],SEARCH("-6",RC[-6])+2,10),IFERROR(MID(RC[-6],SEARCH("-5",RC[-6])+2,10),IFERROR(MID(RC[-6],SEARCH("-4",RC[-6])+2,10),IFERROR(MID(RC[-6],SEARCH("-3",RC[-6])+2,10),IFERROR(MID(RC[-6],SEARCH("-2",RC[-6])+2,10),IFERROR(MID(RC[-6],SEARCH("-1",RC[-6])+2,10),IFERROR(MID(RC[-6],SEARCH("-",RC[-6])+1,10),))))))))))) -> 树人 | I479: ="1"&VLOOKUP(RC[-1],Sheet1!R2C2:R127C3,2,FALSE) -> 130411 | J479: 130411 | K479: =IFERROR(FIND(13,RC[-4],1),"") -> 10 | L479: =IF(RC[-1]="","",MID(RC[-5],RC[-1],6)) -> 130411 | M479: =SUBSTITUTE(RC[-6],RC[-1],RC[-3],1) -> "死！！！"|3#1304114|1
A480: 10502501 | B480: 51-3树精 | D480: 1 | E480: 105025|80 | F480: 3|4|1 | G480: "一个新的世界……"|3#2#1324114|1
A481: 10502502 | B481: 51-3树精 | D481: 1 | E481: 105025|50 | F481: 3|4|1 | G481: "将你的一切都交出来！"|3#2#1324114|1
A482: 10502503 | B482: 51-3树精 | D482: 1 | E482: 105025|20 | F482: 3|4|1 | G482: "战争即将开始——"|3#2#1324114|1
A483: 10509501 | B483: 51-10海元素领主 | D483: 1 | E483: 105095|50 | F483: 3|4|1 | G483: "感受一下这冰冷的海水！"|3#2#400049|1
A484: 10509502 | B484: 51-10海元素领主 | C484: 2 | D484: 6 | F484: 3|1 | G484: "大海将赋予它们永眠！"|3#400049|1
A485: 10515501 | B485: 52-6刀锋猎人 | D485: 1 | E485: 105155|80 | F485: 3|4|1 | G485: "将一切都交出来！"|3#2#1304024|1
A486: 10515502 | B486: 52-6刀锋猎人 | D486: 1 | E486: 105155|50 | F486: 3|4|1 | G486: "掠夺？不，这是一场侵略！"|3#2#1304024|1
A487: 10515503 | B487: 52-6刀锋猎人 | D487: 1 | E487: 105155|20 | F487: 3|4|1 | G487: "我需要做的事情还有很多……"|3#2#1304024|1
A488: 10519501 | B488: 52-10终极队长 | D488: 1 | E488: 105195|60 | F488: 3|1 | G488: "我早已赌上了一切！"|3#400050|1
A489: 10519502 | B489: 52-10终极队长 | D489: 6 | F489: 3|1 | G489: "随我前进！！！！"|3#400050|1
A490: 10519503 | B490: 52-10终极队长 | D490: 2 | E490: 20 | F490: 3|1 | G490: "我们不会在这里失败！！"|3#400050|1
A491: 10525501 | B491: 53-6恶魔猎手 | D491: 1 | E491: 105255|80 | F491: 3|4|1 | G491: "愚蠢之人"|3#2#1324094|1
A492: 10525502 | B492: 53-6恶魔猎手 | D492: 1 | E492: 105255|55 | F492: 3|4|1 | G492: "将你的一切都交出来！"|3#2#1324094|1
A493: 10525503 | B493: 53-6恶魔猎手 | D493: 1 | E493: 105255|30 | F493: 3|4|1 | G493: "战争已经开始！！"|3#2#1324094|1
A494: 10529501 | B494: 53-10半人马 | D494: 1 | E494: 105295|90 | F494: 3|4|1 | G494: "侵略！掠夺！战争！"|3#2#1324014|1
A495: 10529502 | B495: 53-10半人马 | D495: 1 | E495: 105295|60 | F495: 3|4|1 | G495: "愚蠢！"|3#2#1324014|1
A496: 10529503 | B496: 53-10半人马 | D496: 1 | E496: 105295|30 | F496: 3|4|1 | G496: "侵略不需要无所谓的心理负担！"|3#2#1324014|1
A497: 10529504 | B497: 53-10半人马 | D497: 3 | F497: 3 | G497: "这怎么可能！——"|3
A498: 10532501 | B498: 54-3斯巴达 | D498: 1 | E498: 105325|90 | F498: 3|1 | G498: "给我后退！"|3#400024|1
A499: 10532502 | B499: 54-3斯巴达 | D499: 1 | E499: 105325|30 | F499: 3|1 | G499: "你们将止于此！"|3#400024|1
A500: 10539501 | B500: 54-10大力神 | D500: 1 | E500: 105395|70 | F500: 3|1 | G500: "你拦不住我的。"|3#1314194|1
A501: 10539502 | B501: 54-10大力神 | D501: 1 | E501: 105395|30 | F501: 3|1 | G501: "这确实不是正义之举。"|3#1314194|1
A502: 10539503 | B502: 54-10大力神 | D502: 2 | E502: 15 | F502: 3|1 | G502: "我会击垮你！"|3#1314194|1
A503: 10539504 | B503: 54-10大力神 | D503: 4 | F503: 3|1 | G503: "不要无谓的挣扎！"|3#1314194|1
A504: 10545501 | B504: 55-6野蛮巨人 | C504: 2 | D504: 6 | F504: 3|1 | G504: "吼！！！"|3#1304104|1
A505: 10545502 | B505: 55-6野蛮巨人 | D505: 1 | E505: 105455|50 | F505: 3|1 | G505: "死吧——"|3#1304104|1
A506: 10549501 | B506: 55-10死亡武士 | D506: 1 | E506: 105495|70 | F506: 1 | G506: 1303024|1
A507: 10549502 | B507: 55-10死亡武士 | D507: 1 | E507: 105495|50 | F507: 3|4|3|4|3|4|3|4|3|4|3|1 | G507: "死亡武士将在5秒后恢复所有生命值"|1#1#"死亡武士将在4秒后恢复所有生命值"|1#1#"死亡武士将在3秒后恢复所有生命值"|1#1#"死亡武士将在2秒后恢复所有生命值"|1#1#"死亡武士将在5秒后恢复所有生命值"|1#1#"我是不死的！"|2#400001|2
A508: 10549503 | B508: 55-10死亡武士 | D508: 1 | E508: 105495|10 | F508: 1 | G508: 1303024|1

Sheet: Sheet1
B2: 红颅鬼 | C2: 30998 | D2: =RC[1]&"02" -> 11002 | E2: 110 | F2: 超级队长 | G2: ="无尽-"&RC[-1] -> 无尽-超级队长 | J2: 400028|2
B3: 四爪博士 | C3: 30999 | D3: =RC[1]&"02" -> 11102 | E3: 111 | F3: 死亡武士 | G3: ="无尽-"&RC[-1] -> 无尽-死亡武士 | J3: 400029|2#2.6#999999|400032|2#0.3#999999|400030|2
B4: 独眼巨人 | C4: 31999 | D4: =RC[1]&"02" -> 11202 | E4: 112 | F4: 红头魔 | G4: ="无尽-"&RC[-1] -> 无尽-红头魔 | J4: "你们将重归于大地——"|3#400031|1
B5: 憎恶 | C5: 32999 | D5: =RC[1]&"02" -> 11302 | E5: 113 | F5: 终极队长 | G5: ="无尽-"&RC[-1] -> 无尽-终极队长 | J5: "无穷无尽……"|3#1304014|1
B6: 战争主宰 | C6: 33998 | D6: =RC[1]&"02" -> 11402 | E6: 114 | F6: 雷神 | G6: ="无尽-"&RC[-1] -> 无尽-雷神 | J6: "奔赴死亡的深渊吧"|3#1303024|1
B7: 大地泰坦 | C7: 33999 | D7: =RC[1]&"02" -> 11502 | E7: 115 | F7: 野蛮巨人 | G7: ="无尽-"&RC[-1] -> 无尽-野蛮巨人 | J7: "没有尽头，没有胜利，也没有希望……"|3#1303014|1
B8: 金鱼佬广广 | C8: 39999 | D8: =RC[1]&"02" -> 11602 | E8: 116 | F8: 致命特工 | G8: ="无尽-"&RC[-1] -> 无尽-致命特工 | J8: "这是来自目不可及之处的箭矢！"|3#1304204|1
B9: 绿品传承核心 | C9: 33100 | D9: =RC[1]&"02" -> 11702 | E9: 117 | F9: 鹰眸 | G9: ="无尽-"&RC[-1] -> 无尽-鹰眸 | J9: "深渊的魔法……"|3#1304384|1
B10: 蓝品传承核心 | C10: 33200 | D10: =RC[1]&"02" -> 11802 | E10: 118 | F10: 刀锋猎人 | G10: ="无尽-"&RC[-1] -> 无尽-刀锋猎人 | J10: "我感受到了无尽的苦痛"|3#1304404|1
B11: 紫品传承核心 | C11: 33300 | D11: =RC[1]&"02" -> 11902 | E11: 119 | F11: 地狱骑士 | G11: ="无尽-"&RC[-1] -> 无尽-地狱骑士 | J11: "杀之不尽"|3#1304024|1
B12: 橙品传承核心 | C12: 33400 | D12: =RC[1]&"02" -> 12002 | E12: 120 | F12: 铁人 | G12: ="无尽-"&RC[-1] -> 无尽-铁人 | J12: "这才是真正的地狱！"|3#1304034|1
B13: 红品传承核心 | C13: 33500 | D13: =RC[1]&"02" -> 12102 | E13: 121 | F13: 树人 | G13: ="无尽-"&RC[-1] -> 无尽-树人 | J13: "通通粉碎掉吧！"|3#1304104|1
B14: 见习警察 | C14: 30000 | D14: =RC[1]&"02" -> 12202 | E14: 122 | F14: 超凡博士 | G14: ="无尽-"&RC[-1] -> 无尽-超凡博士 | J14: "吼——"|3#1304114|1
B15: 初代机甲 | C15: 30010 | D15: =RC[1]&"02" -> 12302 | E15: 123 | F15: 白凤凰 | G15: ="无尽-"&RC[-1] -> 无尽-白凤凰 | J15: "你们打开了地狱之门——"|3#1304294|1
B16: a型激光机械 | C16: 30020 | D16: =RC[1]&"02" -> 12402 | E16: 124 | F16: 地狱铁拳 | G16: ="无尽-"&RC[-1] -> 无尽-地狱铁拳 | J16: "在这里，真理的轨迹异常明确……"|3#1304214|1
B17: a型镭射机械 | C17: 30030 | D17: =RC[1]&"02" -> 12502 | E17: 125 | F17: 混沌女巫 | G17: ="无尽-"&RC[-1] -> 无尽-混沌女巫 | J17: "雷霆啊，驱散它们！"|3#1304304|1
B18: 见习护士 | C18: 30040 | D18: =RC[1]&"02" -> 14002 | E18: 140 | F18: 杰克船长 | G18: ="无尽-"&RC[-1] -> 无尽-杰克船长 | J18: "堕落也是混沌的一部分"|3#1304404|1
B19: 防暴警察 | C19: 30100 | D19: =RC[1]&"02" -> 14102 | E19: 141 | F19: 天使长 | G19: ="无尽-"&RC[-1] -> 无尽-天使长 | J19: "来自黑暗，一击必杀！"|3#1313004|1
B20: 战争机甲 | C20: 30110 | D20: =RC[1]&"02" -> 14202 | E20: 142 | F20: 独眼野蛮人 | G20: ="无尽-"&RC[-1] -> 无尽-独眼野蛮人 | J20: "无尽的炮火与厮杀！"|3#1313014|1
B21: b型激光机械 | C21: 30120 | D21: =RC[1]&"02" -> 14302 | E21: 143 | F21: 圣女贞德 | G21: ="无尽-"&RC[-1] -> 无尽-圣女贞德 | J21: "来吧，投身于深渊——"|3#1313104|1
B22: b型镭射机械 | C22: 30130 | D22: =RC[1]&"02" -> 14402 | E22: 144 | F22: 美杜莎 | G22: ="无尽-"&RC[-1] -> 无尽-美杜莎 | J22: "黑暗弥漫之处，便是狩猎之时"|3#1313204|1
B23: 战地护士 | C23: 30140 | D23: =RC[1]&"02" -> 14502 | E23: 145 | F23: 德古拉伯爵 | G23: ="无尽-"&RC[-1] -> 无尽-德古拉伯爵 | J23: "信仰堕落吧"|3#1313404|1
B24: 精英特警 | C24: 30200 | D24: =RC[1]&"02" -> 14602 | E24: 146 | F24: 狩猎女神 | G24: ="无尽-"&RC[-1] -> 无尽-狩猎女神 | J24: "光辉源于黑暗"|3#1313404|1
B25: 王牌机甲 | C25: 30210 | D25: =RC[1]&"02" -> 14702 | E25: 147 | F25: 查理大帝 | G25: ="无尽-"&RC[-1] -> 无尽-查理大帝 | J25: "我将征服这一切！"|3#1314004|1
B26: 智能激光机械 | C26: 30220 | D26: =RC[1]&"02" -> 14802 | E26: 148 | F26: 佐罗 | G26: ="无尽-"&RC[-1] -> 无尽-佐罗 | J26: "这是亡者的归属"|3#1314014|1
B27: 智能镭射机械 | C27: 30230 | D27: =RC[1]&"02" -> 14902 | E27: 149 | F27: 亚马逊女王 | G27: ="无尽-"&RC[-1] -> 无尽-亚马逊女王 | J27: "鲜血如此诱人……"|3#1314024|1
B28: 精英护士 | C28: 30240 | D28: =RC[1]&"02" -> 15002 | E28: 150 | F28: 宙斯 | G28: ="无尽-"&RC[-1] -> 无尽-宙斯 | J28: "砸碎你们！"|3#1314104|1
B29: 警察局长 | C29: 30300 | D29: =RC[1]&"02" -> 15102 | E29: 151 | F29: 斯巴达 | G29: ="无尽-"&RC[-1] -> 无尽-斯巴达 | J29: "沉眠于深渊……"|3#1314304|1
B30: 初号机 | C30: 30310 | D30: =RC[1]&"02" -> 15202 | E30: 152 | F30: 阿努比斯 | G30: ="无尽-"&RC[-1] -> 无尽-阿努比斯 | J30: "你们无法逃离黑暗"|3#1314314|1
B31: 零式激光炮 | C31: 30320 | D31: =RC[1]&"02" -> 15302 | E31: 153 | F31: 雅典娜 | G31: ="无尽-"&RC[-1] -> 无尽-雅典娜 | J31: "快逃吧，不然你就要死了"|3#1314324|1
B32: 热熔镭射炮 | C32: 30330 | D32: =RC[1]&"02" -> 15402 | E32: 154 | F32: 大力神 | G32: ="无尽-"&RC[-1] -> 无尽-大力神 | J32: "当你凝视深渊，深渊也在凝视着你"|3#1314404|1
B33: 护士长 | C33: 30340 | D33: =RC[1]&"02" -> 15502 | E33: 155 | F33: 冥王哈迪斯 | G33: ="无尽-"&RC[-1] -> 无尽-冥王哈迪斯 | J33: "你们必将失败！"|3#1323004|1
B34: 超级队长 | C34: 30301 | D34: =RC[1]&"02" -> 17002 | E34: 170 | F34: 石头人 | G34: ="无尽-"&RC[-1] -> 无尽-石头人 | J34: "深渊的号角已经吹响！"|3#1323014|1
B35: 死亡武士 | C35: 30302 | D35: =RC[1]&"02" -> 17102 | E35: 171 | F35: 血源牧师 | G35: ="无尽-"&RC[-1] -> 无尽-血源牧师 | J35: "山崩地裂——"|3#1323104|1
B36: 红头魔 | C36: 30430 | D36: =RC[1]&"02" -> 17202 | E36: 172 | F36: 屠夫 | G36: ="无尽-"&RC[-1] -> 无尽-屠夫 | J36: "怎么？你们在妄想些什么？"|3#1323204|1
B37: 终极队长 | C37: 30400 | D37: =RC[1]&"02" -> 17302 | E37: 173 | F37: 树精 | G37: ="无尽-"&RC[-1] -> 无尽-树精 | J37: "我会吃掉你们——"|3#1323304|1
B38: 雷神 | C38: 30431 | D38: =RC[1]&"02" -> 17402 | E38: 174 | F38: 牛头人 | G38: ="无尽-"&RC[-1] -> 无尽-牛头人 | J38: "一切归于深渊"|3#1323404|1
B39: 野蛮巨人 | C39: 30410 | D39: =RC[1]&"02" -> 17502 | E39: 175 | F39: 火女 | G39: ="无尽-"&RC[-1] -> 无尽-火女 | J39: "深渊的迷雾将吞噬你们"|3#1324004|1
B40: 致命特工 | C40: 30401 | D40: =RC[1]&"02" -> 17602 | E40: 176 | F40: 半人马 | G40: ="无尽-"&RC[-1] -> 无尽-半人马 | J40: "你们无法阻挡我！"|3#1324014|1
B41: 鹰眸 | C41: 30420 | D41: =RC[1]&"02" -> 17702 | E41: 177 | F41: 食人魔 | G41: ="无尽-"&RC[-1] -> 无尽-食人魔 | J41: "所有光芒都将死亡"|3#1324024|1
B42: 刀锋猎人 | C42: 30402 | D42: =RC[1]&"02" -> 17802 | E42: 178 | F42: 基伦 | G42: ="无尽-"&RC[-1] -> 无尽-基伦 | J42: "醉生梦死最是省事"|3#1324104|1
B43: 地狱骑士 | C43: 30403 | D43: =RC[1]&"02" -> 17902 | E43: 179 | F43: 女警 | G43: ="无尽-"&RC[-1] -> 无尽-女警 | J43: "黑暗之弓，深渊之矢"|3#1324204|1
B44: 铁人 | C44: 30428 | D44: =RC[1]&"02" -> 18002 | E44: 180 | F44: 小黑 | G44: ="无尽-"&RC[-1] -> 无尽-小黑 | J44: "黑火将焚毁世界"|3#1324304|1
B45: 树人 | C45: 30411 | D45: =RC[1]&"02" -> 18102 | E45: 181 | F45: 熊阿宝 | G45: ="无尽-"&RC[-1] -> 无尽-熊阿宝 | J45: "深渊之光！"|3#1324404|1
B46: 超凡博士 | C46: 30438 | D46: =RC[1]&"02" -> 18202 | E46: 182 | F46: 血色指挥官 | G46: ="无尽-"&RC[-1] -> 无尽-血色指挥官 | J46: "这才是无穷无尽的——"|3#1324414|1
B47: 白凤凰 | C47: 30440 | D47: =RC[1]&"02" -> 18302 | E47: 183 | F47: 大检察官 | G47: ="无尽-"&RC[-1] -> 无尽-大检察官 | J47: "追寻的真理于此将止！"|3#1309994|1
B48: 地狱铁拳 | C48: 30429 | D48: =RC[1]&"02" -> 18402 | E48: 184 | F48: 恶魔猎手 | G48: ="无尽-"&RC[-1] -> 无尽-恶魔猎手 | J48: "随我到深渊里去吧！——"|3#1309984|1
B49: 混沌女巫 | C49: 30449 | D49: =RC[1]&"02" -> 18502 | E49: 185 | F49: 神圣牧师 | G49: ="无尽-"&RC[-1] -> 无尽-神圣牧师 | J49: "你们也尝尝这滋味！"|3#1319994|1
B50: 黑暗骑士 | C50: 30520 | D50: =RC[1]&"02" -> 19002 | E50: 190 | F50: 四爪博士 | G50: ="无尽-"&RC[-1] -> 无尽-四爪博士 | J50: "美妙的血肉——"|3#1329994|1
B51: 狼叔 | C51: 30500 | D51: =RC[1]&"02" -> 19102 | E51: 191 | F51: 红颅鬼 | G51: ="无尽-"&RC[-1] -> 无尽-红颅鬼 | J51: "随大地一起崩塌吧！"|3#1339994|1
B52: 角斗士 | C52: 31000 | D52: =RC[1]&"02" -> 19202 | E52: 192 | F52: 独眼巨人 | G52: ="无尽-"&RC[-1] -> 无尽-独眼巨人 | J52: "你们的失败已经注定——"|3#1339984|1
B53: 见习武士 | C53: 31010 | D53: =RC[1]&"02" -> 19302 | E53: 193 | F53: 憎恶 | G53: ="无尽-"&RC[-1] -> 无尽-憎恶 | J53: "这可是致命的——"|3#1303004|1
B54: 见习刺客 | C54: 31020 | D54: =RC[1]&"02" -> 19402 | E54: 194 | F54: 大地泰坦 | G54: ="无尽-"&RC[-1] -> 无尽-大地泰坦 | J54: "奔赴死亡的深渊吧"|3#1303014|1
B55: 黑魔学徒 | C55: 31030 | D55: =RC[1]&"02" -> 19502 | E55: 195 | F55: 战争主宰 | G55: ="无尽-"&RC[-1] -> 无尽-战争主宰 | J55: "没有尽头，没有胜利，也没有希望……"|3#1303024|1
B56: 白魔学徒 | C56: 31040 | J56: "这是来自目不可及之处的箭矢！"|3#1303204|1
B57: 剑斗士 | C57: 31100 | J57: "深渊的魔法……"|3#1303304|1
B58: 高级武士 | C58: 31110 | J58: "我感受到了无尽的苦痛"|3#1303404|1
B59: 高级刺客 | C59: 31120 | J59: "杀之不尽"|3#1304004|1
B60: 黑魔法师 | C60: 31130 | J60: "这才是真正的地狱！"|3#1304014|1
B61: 白魔法师 | C61: 31140 | J61: "通通粉碎掉吧！"|3#1304104|1
B62: 角斗之王 | C62: 31200 | J62: "吼——"|3#1304114|1
B63: 盔甲武士 | C63: 31210 | J63: "你们打开了地狱之门——"|3#1304204|1
B64: 弓弩刺客 | C64: 31220 | J64: "在这里，真理的轨迹异常明确……"|3#1304214|1
B65: 黑魔导师 | C65: 31230 | J65: "雷霆啊，驱散它们！"|3#1304304|1
B66: 白魔导师 | C66: 31240 | J66: "堕落也是混沌的一部分"|3#1304404|1
B67: 竞技场王者 | C67: 31300 | J67: "来自黑暗，一击必杀！"|3#1313004|1
B68: 重甲武士 | C68: 31310 | J68: "无尽的炮火与厮杀！"|3#1313014|1
B69: 影杀者 | C69: 31320 | J69: "来吧，投身于深渊——"|3#1313104|1
B70: 暗影巫师 | C70: 31330 | J70: "黑暗弥漫之处，便是狩猎之时"|3#1313204|1
B71: 圣光牧师 | C71: 31340 | J71: "信仰堕落吧"|3#1313404|1
B72: 杰克船长 | C72: 31301 | J72: "光辉源于黑暗"|3#1313404|1
B73: 天使长 | C73: 31341 | J73: "我将征服这一切！"|3#1314004|1
B74: 独眼野蛮人 | C74: 31400 | J74: "这是亡者的归属"|3#1314014|1
B75: 圣女贞德 | C75: 31440 | J75: "鲜血如此诱人……"|3#1314024|1
B76: 美杜莎 | C76: 31430 | J76: "砸碎你们！"|3#1314104|1
B77: 德古拉伯爵 | C77: 31401 | J77: "沉眠于深渊……"|3#1314304|1
B78: 狩猎女神 | C78: 31431 | J78: "你们无法逃离黑暗"|3#1314314|1
B79: 查理大帝 | C79: 31402 | J79: "快逃吧，不然你就要死了"|3#1314324|1
B80: 佐罗 | C80: 31403 | J80: "当你凝视深渊，深渊也在凝视着你"|3#1314404|1
B81: 亚马逊女王 | C81: 31420 | J81: "你们必将失败！"|3#1323004|1
B82: 宙斯 | C82: 31438 | J82: "深渊的号角已经吹响！"|3#1323014|1
B83: 斯巴达 | C83: 31410 | J83: "山崩地裂——"|3#1323104|1
B84: 阿努比斯 | C84: 31408 | J84: "怎么？你们在妄想些什么？"|3#1323204|1
B85: 雅典娜 | C85: 31441 | J85: "我会吃掉你们——"|3#1323304|1
B86: 大力神 | C86: 31419 | J86: "一切归于深渊"|3#1323404|1
B87: 冥王哈迪斯 | C87: 31439 | J87: "深渊的迷雾将吞噬你们"|3#1324004|1
B88: 潘多拉 | C88: 31530 | J88: "你们无法阻挡我！"|3#1324014|1
B89: 奎爷 | C89: 31500 | J89: "所有光芒都将死亡"|3#1324024|1
B90: 恶劣地精 | C90: 32000 | J90: "醉生梦死最是省事"|3#1324104|1
B91: 新生骷髅 | C91: 32010 | J91: "黑暗之弓，深渊之矢"|3#1324204|1
B92: 矮人民兵 | C92: 32020 | J92: "黑火将焚毁世界"|3#1324304|1
B93: 初级海元素 | C93: 32030 | J93: "深渊之光！"|3#1324404|1
B94: 初级水元素 | C94: 32040 | J94: "这才是无穷无尽的——"|3#1324414|1
B95: 地精盗贼 | C95: 32100 | J95: "追寻的真理于此将止！"|3#1309994|1
B96: 骷髅战士 | C96: 32110 | J96: "随我到深渊里去吧！——"|3#1309984|1
B97: 矮人火枪手 | C97: 32120 | J97: "你们也尝尝这滋味！"|3#1319994|1
B98: 高级海元素 | C98: 32130 | J98: "美妙的血肉——"|3#1329994|1
B99: 高级水元素 | C99: 32140 | J99: "随大地一起崩塌吧！"|3#1339994|1
B100: 地精大盗 | C100: 32200 | J100: "你们的失败已经注定——"|3#1339984|1
B101: 骷髅勇士 | C101: 32210 | J101: "你的挠痒痒让我感觉很无聊"|3#325109|1
B102: 精英火枪手 | C102: 32220 | J102: "我已经给了你充足的时间……"|3#324009|1
B103: 海元素领主 | C103: 32230 | J103: "我的怒气爆表了！"|3#324019|1
B104: 水元素领主 | C104: 32240 | J104: "跟我一起沐浴死亡吧"|3#324209|1
B105: 地精神偷 | C105: 32300 | J105: "被烧成焦炭吧"|3#324309|1
B106: 骷髅王 | C106: 32310 | J106: "这也是试练吗？该结束了！"|3#314109|1
B107: 传说哥 | C107: 32320 | J107: "狩猎时间到~"|3#314329|1
B108: 海元素国王 | C108: 32330 | J108: "永远地沉眠吧！"|3#314309|1
B109: 水元素国王 | C109: 32340 | J109: "用你的死亡，取悦于我"|3#314319|1
B110: 石头人 | C110: 32311 | J110: "灾难啊……是指这样吗？"|3#315309|1
B111: 血源牧师 | C111: 32341 | J111: "我没时间和你们玩闹"|3#305209|1
B112: 屠夫 | C112: 32410 | J112: "去地狱里忏悔吧！"|3#304019|1
B113: 树精 | C113: 32411 | J113: "你们的意志不够坚定"|3#303029|1
B114: 牛头人 | C114: 32400 | J114: "接受科技的洗礼！"|3#304219|1
B115: 火女 | C115: 32430 | J115: "这是你们触犯神灵的惩罚"|3#304309|1
B116: 半人马 | C116: 32401 | J116: "大地会重新接纳你们——在你们死后"|3#339999|1
B117: 食人魔 | C117: 32431 | J117: "嗡——清理时间到！"|3#339989|1
B118: 基伦 | C118: 32402 | J118: "你的挣扎毫无意义"|3#304009|1
B119: 女警 | C119: 32420 | J119: "去地狱里忏悔吧！"|3#304019|1
B120: 小黑 | C120: 32428 | J120: "你们的血肉会滋养大地"|3#304119|1
B121: 熊阿宝 | C121: 32412 | J121: "接受科技的洗礼！"|3#304219|1
B122: 血色指挥官 | C122: 32408 | J122: "这是你们触犯神灵的惩罚"|3#304309|1
B123: 大检察官 | C123: 32440 | J123: "我预见了你们的失败，因为我必将胜利！"|3#314009|1
B124: 恶魔猎手 | C124: 32409 | J124: "我将剥夺你们的一切！"|3#314029|1
B125: 神圣牧师 | C125: 32449 | J125: "永远地沉眠吧！"|3#314309|1
B126: 巫妖之王 | C126: 32500 | J126: "用你的死亡，取悦于我"|3#314319|1
B127: 钢铁酋长 | C127: 32510 | J127: "狩猎时间到~"|3#314329|1
J128: "我的怒气爆表了！"|3#324019|1
J129: "感受这光芒！"|3#324029|1
J130: "什么叫碾压性的优势？"|3#324109|1
J131: "跟我一起沐浴死亡吧"|3#324209|1
J132: "被烧成焦炭吧"|3#324309|1
J133: "大地会重新接纳你们——在你们死后"|3#339999|1
J134: "嗡——清理时间到！"|3#339989|1
J135: "月之影就此降临——"|3#400048|1
J136: "你无处可逃……"|3#400048|1
J137: "真是个烦人的家伙"|3#400048|1
J138: "继续在月光下起舞吧，那伴随着死亡的舞蹈！"|3#400048|1
J139: "这也是救赎，对于我的"|3#1324024|1
J140: "每个人都需要被拯救，被需要，还有，被杀死"|5#1324024|1
J141: "就像现在，我需要一场鲜血的洗礼，一场自我的救赎"|5#1324024|1
J142: "但愿鲜血奔腾在你的心灵，却从不积郁于双眼……这也算，一次拯救的尝试，对于你我的"|4
J143: "沐浴鲜血之后才能重生"|5#1324024|1
J144: "魔法诠释着世界的奥秘"|3#1303304|1
J145: "可解释的，归于科学，无可解释的，归于神秘"|3#1303304|1
J146: "在弥漫的毒雾中失去方向吧……"|3#1324004|1
J147: "独行者……在迷茫中前进，比迷雾中前进更加艰难"|3#1324004|1
J148: "英雄？每一个的背后都有千千万万的枯骨，无关好坏"|5#1324004|1
J149: "对错好坏很多时候无关紧要，重要的是，你足够强大吗？"|5#1324004|1
J150: "看到了吗？那如堕深渊的痛苦，感受一下吧……"|3#1309984|1
J151: "罪恶吗……罪恶啊……那就如此恶贯满盈，直至结束吧"|3#1309984|1
J152: "杀戮，嗜血，这是你们所赋予的，我所偿还的"|3#1314024|1
J153: "死亡弥漫的黑夜，鲜血的盛宴"|3#1314024|1
J154: "你的心脏，你的鲜血，你的生命，给我，交给我！"|3#1314024|1
J155: "我闻到了鲜血的味道……"|3#1314024|1
J156: "掌控你的力量，你的愤怒，你的意志才是你最强大的武器"|5#1314104|1
J157: "拥有驾驭力量的意志，远比拥有力量重要得多"|5#1324004|1
J158: "这就是你的失败！"|3#1324004|1
J159: "我怎么能倒在这里……"|3#1324004|1
J160: "你来真的？"|3#1#1303014|1
J161: "食物，烤熟了才好吃！"|3#400011|1
J162: "你能挡住几次？"|3#400011|1
J163: "FFF！！！"|3#400011|1
J164: 0.5#400004|2#1#100253|400005|0#1.5#100253|400005|0#1.5#100253|400005|0#1.5#100253|400005|0#1.5#100253|400005|0#1.5#100253|400005|0#1.5#100253|400005|0#1.5#100253|400005|0#1.5#100253|400005|0#1.5#100253|400005|0#1.5#100253|400005|0#1.5#100253|400005|0#1.5#100253|400005|0#1.5#100253|400005|0#1.5#100253|400005|0#1.5#100253|400005|0#1.5#100253|400005|0#1.5#100253|400005|0#1.5#100253|400005|0
J165: "这就是我的正义！"|2#0.5#"战争无分对错"|2#2#"我必须坚守我的立场"|2#2#"请你们消失吧！"|2
J166: "死亡并不可怕……"|2
J167: 1323204|1#5#"你能挡住几次？"|3#2#1323204|1#5#"我可是有20发子弹"|3#2#1323204|1#7#1323204|1#1#"狙击子弹的填装太慢了"|3#6#1323204|1#7#1323204|1#7#1323204|1#7#1323204|1#7#1323204|1#7#1323204|1#7#1323204|1#7#1323204|1#7#1323204|1#7#1323204|1#7#1323204|1#7#1323204|1#7#1323204|1#7#1323204|1#7#1323204|1#7#1323204|1#7#1#"糟糕，子弹用完了"|3
J168: "圣光忽悠着你"|3#400003|2#0.7#100372|400002|0#0.4#100372|400002|0#0.4#100372|400002|0#5.5#"光明与我同在"|3#400003|2#0.7#100372|400002|0#0.4#100372|400002|0#0.4#100372|400002|0#5.5#"我会拯救所有人"|3#400003|2#0.7#100372|400002|0#0.4#100372|400002|0#0.4#100372|400002|0#5.5#400003|2#0.7#100372|400002|0#0.4#100372|400002|0#0.4#100372|400002|0#5.5#400003|2#0.7#100372|400002|0#0.4#100372|400002|0#0.4#100372|400002|0#5.5#400003|2#0.7#100372|400002|0#0.4#100372|400002|0#0.4#100372|400002|0#5.5#400003|2#0.7#100372|400002|0#0.4#100372|400002|0#0.4#100372|400002|0#5.5#400003|2#0.7#100372|400002|0#0.4#100372|400002|0#0.4#100372|400002|0#5.5#400003|2#0.7#100372|400002|0#0.4#100372|400002|0#0.4#100372|400002|0#5.5#400003|2#0.7#100372|400002|0#0.4#100372|400002|0#0.4#100372|400002|0#5.5#400003|2#0.7#100372|400002|0#0.4#100372|400002|0#0.4#100372|400002|0#5.5#400003|2#0.7#100372|400002|0#0.4#100372|400002|0#0.4#100372|400002|0#5.5#400003|2#0.7#100372|400002|0#0.4#100372|400002|0#0.4#100372|400002|0#5.5#400003|2#0.7#100372|400002|0#0.4#100372|400002|0#0.4#100372|400002|0
J169: "我需要鲜血"|2#400009|1
J170: "我需要鲜血"|2#400009|1
J171: "杀害我的人？胆量不错"|3#1#400025|1
J172: "怒火都快把我脑袋烧红了"|3#1#400025|1
J173: 1303014|1
J174: "我可是不死的！"|5#5#400001|2
J175: "胜利终将到来"|2#400026|1
J176: "我将一如既往"|2#400026|1
J177: 400026|1
J178: 400026|1
J179: "你能坚持多久？"|2#400026|1
J180: 400026|1
J181: "坚持住！我是你的后盾！"|3#400006|1
J182: "我们不会失败！"|3#400006|1
J183: 400007|1
J184: 400007|1
J185: 400007|1
J186: "我将献祭死者……"|2#2#400008|1
J187: "感受死亡——"|3#1314014|1
J188: "我手握天平，生死尽在掌握——"|3#1314014|1
J189: "愚蠢的人类！"|3#1314014|1
J190: "这发子弹献给死者……"|2#1#400010|1
J191: "燃烧吧，我们将在生死的间隙中迎来胜利"|2#400012|1
J192: "燃烧吧！只要留下灰烬！"|2#400013|1
J193: "像不灭的火焰一样……"|2#400013|1
J194: "我的棍子不会留情"|2#400014|1
J195: "砸！一棍子砸不死就两棍子！"|2#400014|1
J196: "最后一下！"|2#400014|1
J197: "我嗅到了鲜血的味道……"|2#1#400027|1
J198: "鲜血！给我！……"|2#1#400027|1
J199: "我不会倒下……"|2#400015|2
J200: "坚如磐石……！"|2#400015|2
J201: "这才是大力神该有的英勇！"|3#400017|2
J202: "你的战斗还未结束！"|3#2#400016|2
J203: 1314104|0
J204: "这也是……试练吗……"|3
J205: "以此为你们的坟墓"|2#400018|1
J206: "绽放吧！"|2#400018|1
J207: "希望都将被腐蚀"|2#400018|1
J208: "你们无法战胜我！"|2#1324014|1
J209: "劈开一切！"|2#1324014|1
J210: "我无法被阻拦！"|2#1324014|1
J211: "吼吼吼！！！"|2#400019|1
J212: 400019|1
J213: "死吧！"|2#400019|1
J214: "怒火！！"|2#400020|2#20#"破坏！！"|2#400021|2
J215: "箭已满弓"|2#1303204|1
J216: "一击致命！"|2#1303204|1
J217: "你的心脏——我就收下了！"|2#1303204|1
J218: "死亡是战争的养料"|2#400022|1
J219: "你们让我愤怒"|2#400022|0
J220: "魔法的奥秘……"|2#1303305|1
J221: "揭开谜底的时候到了"|2#1303305|1
J222: "不要耍小聪明"|2#1303305|1
J223: "你们不改惹怒我"|2#1303305|1
J224: "这里是——斯巴达！！"|2#400024|1
J225: "你们别想得逞"|2#1304304|1
J226: "你们别想得逞"|2#1304304|1
J227: "你们别想得逞"|2#1304304|1
J228: "你们别想得逞"|2#1304304|1
J229: "击杀我的队友……也来尝试一下我的愤怒吧！"|3#1304214|1
J230: "痛楚……你们能明白吗？"|3#2#1304217|1
J231: "你们需要被销毁……"|3#1304217|1
J232: "收到指令：完全消灭！"|3#400044|1
J233: "清理——"|3#400044|1
J234: "一个不留！"|3#400044|1
J235: "清理——"|3#400044|1
J236: "奔腾的血液，只要可以奔跑就不会停息"|3#1323015|1
J237: "品尝火焰吧……"|3#1323304|1
J238: "你们要为此付出代价！"|3#1324404|1
J239: "你们要为此付出代价！"|3#1324404|1
J240: 1324025|0
J241: "黑暗将淹没你们"|3#1324204|1
J242: "箭之所向……"|3#1324204|1
J243: "被遗忘吧……"|3#1324204|1
J244: "痛楚……"|3#400045|1
J245: "愤怒！！！"|3#400045|1
J246: "毁灭！！！！！"|3#400045|1
J247: "怒火在燃烧"|3#1304104|1
J248: "火焰吞噬一切"|3#1324304|1
J249: "火焰吞噬一切"|3#1324304|1
J250: "血液是生命之光"|3#1323404|1
J251: "憎恶！"|3#1329994|1
J252: "屠杀！"|3#1329994|1
J253: "死亡！"|3#1329994|1
J254: "这是——雷神之怒！"|3#1304304|1
J255: "惩戒之雷！"|3#1304304|1
J256: "吼！！"|3#1304114|1
J257: "月来之箭，从不射空！"|3#1314324|1
J258: "神灵不可冒犯"|3#1.5#1314324|1
J259: "冲锋！！！"|3#1323014|1
J260: "我们的铁蹄，无处可挡！"|3#1323014|1
J261: "我将永不停歇——在死亡到来之前！"|3#1323014|1
J262: "星辰都将陨落……"|3#1315304|1
J263: "我引领灾……不，不对"|2#2#1315304|1#"我，既是灾难！"|3
J264: "我行走于黑夜里"|3#1304004|1
J265: "猎杀于鲜血中"|3#1304004|1
J266: "我将死于战斗，但不该止步于此"|3#1304004|1
J267: "反应炉加热完全——"|3#400044|1
J268: "弹药填装完毕！"|3#400044|1
J269: "指引：消灭！"|3#400044|1
J270: "弹药填装完毕！"|3#400044|1
J271: "坚守自己的正义"|3#1323004|1
J272: "时间证明一切"|3#1323004|1
J273: "忠于正义，死于本心"|3#1323004|1
J274: "智慧的光芒笼罩世间"|3#1314404|1
J275: "勇敢地战斗吧"|3#1314404|1
J276: "坚持住！"|3#1314404|1
J277: "你不该倒下！"|3#1314404|1
J278: "大地之花，绽放吧"|3#1323104|1
J279: "粉碎吧！"|3#1323104|1
J280: "回归大地……"|3#1323104|1
J281: "你们要为此付出代价！"|3#1324404|1
J282: "不能倒下！"|3#1324404|1
J283: "鲜血的献祭！"|3#1324025|1
J284: "黑暗因死亡而降临"|3#400033|1
J285: "我正盯着你呢"|3#400033|1
J286: "死亡的时候到了……"|3#400033|1
J287: "退后！"|3#400034|1
J288: "给我滚开！"|3#400034|1
J289: "无法饶恕……"|3#400034|1
J290: "我看到你们了……"|3#400035|0
J291: "死亡……如此美妙……"|3#400036|1
J292: 1304114|0
J293: "死亡重复着死亡，而你也是这样"|3#1303014|1
J294: "死亡重复着死亡，而你也是这样"|3#1303014|1
J295: "愚蠢的凡人，就凭你们，也想对付我？"|2.5#3#"我可是……黑暗的源头！"|3#1#400037|1
J296: 1314314|0
J297: 102853|400038|2
J298: 1303024|1
J299: 1303024|1
J300: 1303024|1
J301: "堕落？我只是坚持我的坚持而已"|3
J302: "不要否认，我只是你的另一面"|3
J303: "从本质上来说，我们一样卑劣，一样肮脏"|3
J304: "什么堕落？只是我们的坚持不一样而已"|3
J305: "至死不休……"|3
J306: 102853|400039|2
J307: 102853|400040|2
J308: "燃烧吧，凤凰，燃烧吧，世界！"|3#1303404|1
J309: "光辉是希望，黑暗也是"|3#1303404|1
J310: "湮灭吧"|3#1303304|1
J311: "我将见证毁灭，见证死亡，见证终焉之时的到来"|5#400041|2
J312: 1#102895|400042|2#2#102895|400042|2
J313: 5#102895|400042|2#2#102895|400042|2
J314: 9#102895|400042|2#2#102895|400042|2
J315: 13#102895|400042|2#2#102895|400042|2
J316: 17#102895|400042|2#2#102895|400042|2
J317: 21#102895|400042|2#2#102895|400042|2
J318: 25#102895|400042|2#2#102895|400042|2
J319: 29#102895|400042|2#2#102895|400042|2
J320: "这里不允许通过！"|3#1304004|1
J321: "接受命运吧"|3#1304004|1
J322: "我是一个猎人，而你们是猎物"|3#1304004|1
J323: "我的盾不会后退！"|3#400024|1
J324: "这里无路可走！"|3#400024|1
J325: "我的棍子不会留情"|2#400014|1
J326: "碎粉掉你们！"|2#400014|1
J327: "你们无路可走了！"|2#400014|1
J328: "吞噬生命……"|2#400008|1
J329: "随火焰而逝，残留下恐惧……"|2#1323304|1
J330: "随贪婪前行，却将一切焚毁……"|2#1323304|1
J331: "我是贪婪的，是的，对自由也是。"|2#1323304|1
J332: "我在堕落与献血中索求着，了无止境地索求着……"|4#400027|1
J333: "无法超脱的灵魂，就如此沉沦于躯壳内以至永远吧。"|4#1314305|1
J334: "无法觉醒的自我，就如此沉睡于顽石内直到死亡吧。"|4#1314305|1
J335: "奔腾的血液，是追逐自由的意志！"|4#1323014|1
J336: "我所失去的……不，我从未拥有过……"|4#1323014|1
J337: "我也希冀着追逐那样的光芒……"|4#1323014|1
J338: "只能是奢望吗？……"
J339: "愤怒却无济于事，于是我如此存在着——"|3#1#400019|1
J340: "无可饶恕的，却是……我无法反驳的"|3#1#400019|1
J341: "死吧！！！"|3#1304014|1
J342: "死亡重复死亡，接受审判吧！"|3#1304014|1
J343: "迎接死亡！！"|3#1309994|1
J344: "你们的存在就是我们的阻碍，无关对错！"|3#1309994|1
J345: "妨碍我的，都必须死！"|3#1309994|1
J346: "消灭——"|3#400044|1
J347: "死亡——"|3#400044|1
J348: "毁灭——"|3#400044|1
J349: "不复存在——！！！"|3#400044|1
J350: "坚如磐石……！"|2#400015|2
J351: "不会倒下！！！"|2#400015|2
J352: "大地的愤怒！"|2#1323104|0
J353: "神灵不容亵渎——"|2#1314014|1
J354: "该死的——"|2#1314014|1
J355: "堕落？那也无法控制神灵！"|2#1314014|1
J356: 103495|400043|2
J357: "我的箭指着你的心脏"|3#1303204|1
J358: "你们无处可躲"|3#1303204|1
J359: "愿我们再也不见"|3#1303204|1
J360: "你们的时间到了"|3#400046|1
J361: "你们的时间到了"|3#400046|1
J362: "你们的时间到了"|3#400046|1
J363: "神游走于时间长河，不会放弃任何一人"|3#1313404|1
J364: "展开吧！"|3#1313404|1
J365: "随我前进！"|3#1313404|1
J366: "我感觉自己在燃烧！"|3#1323304|1
J367: "沸腾不已！"|3#1323304|1
J368: "快要燃烧起来了！"|3#1323304|1
J369: "粉碎！"|3#400045|1
J370: "什么都不会留下！"|3#400045|1
J371: "区区人类而已——"|3#400045|1
J372: "不能屈服！"|3#1313404|1
J373: "我将引领你们，走向胜利！"|3#1313404|1
J374: "随我前进！"|3#1313404|1
J375: "我需要一个十字架……神啊……"|3
J376: "竟敢杀害我的手下——"|3#1324304|1
J377: "死亡的时刻到了！"|3#1324304|1
J378: "离我远点！"|3#1324304|1
J379: "大地也会颤栗！！"|3#400047|1
J380: "周而复始——"|3#400047|1
J381: "毁灭总是无时无刻在发生"|3#400047|1
J382: "你们必将失败！"|3#400047|1
J383: "可笑地逃窜吧"|3#1303204|1
J384: "绝地反杀的戏码我可玩得多了"|3#1303204|1
J385: "死吧！"|3#1303204|1
J386: "你们会被砸成肉饼"|3#1304104|1
J387: "我很愤怒"|3#1304104|1
J388: "怒火会吞噬你们！"|3#1304104|1
J389: "吼——！"|3#1304114|1
J390: "吼——！"|3#1304114|1
J391: "死——！！！！！！"|3#1304114|1
J392: "你们已经输了"|3#1304004|1
J393: "死亡？你们也要死去！"|3#1304004|1
J394: "猎杀时刻！"|3#1304004|1
J395: "奔跑吧！"|3#1323014|1
J396: "掠夺吧！"|3#1323014|1
J397: "厮杀吧！"|3#1323014|1
J398: "这是正义之剑！"|3#1323004|1
J399: "无关形式，无关结局——"|3#1323004|1
J400: "这是死亡之果！"|3#1323004|1
J401: "失败？不存在的"|3#1324004|1
J402: "我不能后退"|3#1324004|1
J403: "你们必须沉眠于此"|3#1324004|1
J404: "这一斧子，山都能劈开！"|3#1324014|1
J405: "粉碎吧！"|3#1324014|1
J406: "这是硝烟的盛宴！"|3#1324014|1
J407: "接我一剑——"|3#1325004|1
J408: "你的实力不错——"|3#1325004|1
J409: "不过也就到此为止了！"|3#1325004|1
J410: "你被逮捕了！蠢货！"|3#1323204|1
J411: "弹无虚发！"|3#1323204|1
J412: "还需要再来一发！"|3#1323204|1
J413: "憎恶！"|3#1329994|1
J414: "屠杀！"|3#1329994|1
J415: "血肉！"|3#1329994|1
J416: "死亡！"|3#1329994|1
J417: "你将死在这剑下"|3#1313004|1
J418: "你将死在这剑下"|3#1313004|1
J419: "你的死期到了"|3#1313004|1
J420: "让它沾染上你的鲜血"|3#1313004|1
J421: "成为妆点阴影的石像吧"|3#1314304|1
J422: "看着我——"|3#1314304|1
J423: "你将要变成一块石头"|3#1314304|1
J424: "精准，而致命"|3#1303004|1
J425: 1303004|1
J426: "杀戮，很简单"|3#1303004|1
J427: "罪恶都将成为过去"|3#1304014|1
J428: "因为全都即将死去！"|3#1304014|1
J429: "结束一切！"|3#1304014|1
J430: "死吧！"|3#1303014|1
J431: "哟，不得了不得了"|3#1303014|1
J432: "将血肉都献祭出来吧！"|3#400009|1
J433: "你们只能是食物——"|3#400009|1
J434: "你们应该承受这些"|3#1313204|1
J435: "火焰是救赎"|3#1313204|1
J436: "化为焦炭吧"|3#1313204|1
J437: "吼！！！"|3#1304114|1
J438: "啊！！！"|3#1304114|1
J439: "死！！！"|3#1304114|1