Sheet: 配置
A1: 服务端文件名 | B1: 服务端对应工作表号 | C1: 客户端文件名 | D1: 客户端对应工作表号 | E1: erl头部 | F1: erl内容格式 | G1: erl尾部 | H1: 客户端特殊处理
A2: hang_up_drop.txt | B2: 1 | C2: hang_up_drop.cnf|HangUpDrop | D2: 1 | F2: get(drop_item_id) -> #$ | H2: 2=>drop_item_id

Sheet: 挂机掉落
A1: drop_item_id|drop_item_id | B1: drop_item_num|drop_item_num | C1: drop_rate|drop_rate
A2: 不可空 | B2: 不可空 | C2: 不可空
A3: 数字 | B3: 数字 | C3: 数字
A6: 掉落物品ID | B6: 掉落物品数量 | C6: 掉落概率(万分比)
A7: 19003 | B7: 100 | C7: 6944
A8: 19005 | B8: 1 | C8: 3472
A9: 19006 | B9: 1 | C9: 694
A10: 10002 | B10: 1 | C10: 694
A11: 13462 | B11: 1 | C11: 27
A12: 13463 | B12: 1 | C12: 55
A13: 13615 | B13: 1 | C13: 138
A14: 13616 | B14: 1 | C14: 13

Sheet: 挂机产出
B2: 掉落物品 | C2: 物品id | D2: 单位 | E2: 数量期望 | F2: 概率
B3: 金币 | C3: 19003 | D3: 100 | E3: 100000 | F3: =INT((RC[-1]/RC[-2])/(60*24)*10000) -> 6944
B4: 钻石 | C4: 19005 | D4: 1 | E4: 500 | F4: =INT((RC[-1]/RC[-2])/(60*24)*10000) -> 3472
B5: 魂晶 | C5: 19006 | D5: 1 | E5: 100 | F5: =INT((RC[-1]/RC[-2])/(60*24)*10000) -> 694
B6: 进阶石 | C6: 10002 | D6: 1 | E6: 100 | F6: =INT((RC[-1]/RC[-2])/(60*24)*10000) -> 694
B7: 20资推荐英雄碎片 | C7: 13462 | D7: 1 | E7: 4 | F7: =INT((RC[-1]/RC[-2])/(60*24)*10000) -> 27
B8: 20资无合击英雄碎片 | C8: 13463 | D8: 1 | E8: 8 | F8: =INT((RC[-1]/RC[-2])/(60*24)*10000) -> 55
B9: 初级传承箱 | C9: 13615 | D9: 1 | E9: 20 | F9: =INT((RC[-1]/RC[-2])/(60*24)*10000) -> 138
B10: 中级传承箱 | C10: 13616 | D10: 1 | E10: 2 | F10: =INT((RC[-1]/RC[-2])/(60*24)*10000) -> 13