Sheet: 配置
A1: 服务端文件名 | B1: 服务端对应工作表号 | C1: 客户端文件名 | D1: 客户端对应工作表号 | E1: erl头部 | F1: erl内容格式 | G1: erl尾部 | H1: 客户端特殊处理
A2: config_activity.txt | B2: 1 | C2: config_activity.cnf|Activity | D2: 1 | F2: get(id) -> #$ | H2: 1=>id,sort|sort_list
A3: config_level_shop.txt | B3: 2 | C3: config_level_shop.cnf|LevelShop | D3: 2 | F3: get(id) -> #$ | H3: 2=>level
A4: config_level_shop_goods.txt | B4: 3 | C4: config_level_shop_goods.cnf|LevelShopGoods | D4: 3 | F4: get(id) -> #$ | H4: 2=>goods_id
A5: config_open_server_fund.txt | B5: 4 | C5: config_open_server_fund.cnf|OpenServerFund | D5: 4 | F5: get(id) -> #$ | H5: 2=>id
A6: config_all_the_people_welfare.txt | B6: 5 | C6: config_all_the_people_welfare.cnf|AllThePeopleWelfare | D6: 5 | F6: get(id) -> #$ | H6: 2=>id
A7: config_level_gift.txt | B7: 6 | C7: config_level_gift.cnf|LevelGift | D7: 6 | F7: get(level) -> #$ | H7: 2=>level
A8: config_limit_activity.txt | B8: 7 | C8: config_limit_activity.cnf|LimitActivity | D8: 7 | F8: get(id) -> #$ | H8: 2=>id
C9: config_activity_advance_notice.cnf|ActivityAdvanceNotice | D9: 8 | F9: get(system_id) -> #$ | H9: 2=>system_id
A10: festival_activity.txt | B10: 9 | C10: config_festival_activity.cnf|FestivalActivity | D10: 9 | F10: get(id) -> #$ | H10: 2=>id
A11: festival_activity_param.txt | B11: 10 | C11: config_festival_activity_param.cnf|FestivalActivityParam | D11: 10 | F11: get(id) -> #$ | H11: 2=>id
A12: limit_drop.txt | B12: 11 | C12: config_limit_drop.cnf|LimitDrop | D12: 11 | F12: get(id) -> #$ | H12: 2=>id

Sheet: 1.活动时间配置
A1: id|id | B1: data_id|data_id | C1: sort| | D1: name| | E1: time_type|time_type | F1: days|days | G1: need_role_level|need_role_level | H1: server_list|server_list | I1: star_date|star_date | J1: star_time|star_time | K1: over_date|over_date | L1: over_time|over_time | M1: reward_over_date|reward_over_date | N1: reward_over_time|reward_over_time
A2: 不可空 | B2: 不可空 | C2: 不可空 | D2: 不可空 | E2: 不可空 | F2: 不可空 | G2: 不可空 | H2: 可空#不需字段 | I2: 不可空 | J2: 不可空 | K2: 不可空 | L2: 不可空 | M2: 不可空 | N2: 不可空
A3: 数字 | B3: 数字 | C3: 数字 | D3: 字符串 | E3: 数字 | F3: 数字 | G3: 数字 | H3: 一维数组 | I3: 数字 | J3: 数字 | K3: 数字 | L3: 数字 | M3: 数字 | N3: 数字
H4: 不定长
A6: 系统模块ID | B6: 数据ID | C6: 排序 | D6: 活动名称 | E6: 时间类型 | F6: 开服多少天后有效,包括当天(天) | G6: 需要角色等级 | H6: 开放的服务器列表(填空表示所有服务器开放) | I6: 开始日期 | J6: 开始时间[小时:分钟] | K6: 结束日期 | L6: 结束时间[小时:分钟] | M6: 奖励结束日期 | N6: 奖励结束时间
A7: 1001 | B7: 1 | C7: 1 | D7: 指定时间 | E7: 1 | F7: 10 | G7: 1 | H7: 999 | I7: 20170104 | J7: 1510 | K7: 20171014 | L7: 2030 | M7: 20171014 | N7: 2030
A8: 1002 | B8: 2 | C8: 1 | D8: 每日事件 | E8: 2 | F8: 10 | G8: 1 | H8: 999 | I8: 0 | J8: 1510 | K8: 0 | L8: 2030 | M8: 0 | N8: 2030
A9: 1003 | B9: 3 | C9: 1 | D9: 每周事件 | E9: 3 | F9: 10 | G9: 1 | H9: 999 | I9: 1 | J9: 1510 | K9: 5 | L9: 2030 | M9: 5 | N9: 2030
A10: 1004 | B10: 4 | C10: 1 | D10: 月份事件 | E10: 4 | F10: 10 | G10: 1 | H10: 999 | I10: 5 | J10: 1510 | K10: 16 | L10: 2030 | M10: 16 | N10: 2030
A11: 52 | B11: 5 | C11: 1 | D11: 七日活动 | E11: 5 | F11: 1 | G11: 1 | I11: 1 | J11: 0 | K11: 7 | L11: 2359 | M11: 8 | N11: 2359
A12: 89 | B12: 6 | C12: 1 | D12: 七日活动2 | E12: 5 | F12: 8 | G12: 1 | I12: 8 | J12: 0 | K12: 14 | L12: 2359 | M12: 15 | N12: 2359
A13: 74 | B13: 7 | C13: 1 | D13: 单次充值（开服首周） | E13: 5 | F13: 1 | G13: 1 | I13: 1 | J13: 0 | K13: 7 | L13: 2359 | M13: 0 | N13: 2359
A14: 74 | B14: 8 | C14: 2 | D14: 单次充值（每周循环） | E14: 3 | F14: 8 | G14: 1 | I14: 1 | J14: 0 | K14: 0 | L14: 2359 | M14: 0 | N14: 2359
A15: 75 | B15: 9 | C15: 1 | D15: 累计充值（开服1~3） | E15: 5 | F15: 1 | G15: 1 | I15: 1 | J15: 0 | K15: 3 | L15: 2359 | M15: 3 | N15: 2359
A16: 75 | B16: 10 | C16: 2 | D16: 累计充值（开服4~6） | E16: 5 | F16: 1 | G16: 1 | I16: 4 | J16: 0 | K16: 6 | L16: 2359 | M16: 6 | N16: 2359
A17: 75 | B17: 11 | C17: 3 | D17: 累计充值（每周1~3） | E17: 3 | F17: 7 | G17: 1 | I17: 1 | J17: 0 | K17: 3 | L17: 2359 | M17: 3 | N17: 2359
A18: 75 | B18: 12 | C18: 4 | D18: 累计充值（每周4~0） | E18: 3 | F18: 7 | G18: 1 | I18: 4 | J18: 0 | K18: 0 | L18: 2359 | M18: 0 | N18: 2359
A19: 77 | B19: 13 | C19: 1 | D19: 招募活动 | E19: 5 | F19: 1 | G19: 1 | H19: 999 | I19: 1 | J19: 0 | K19: 5 | L19: 2359 | M19: 5 | N19: 2359
A20: 95 | B20: 15 | C20: 1 | D20: 特惠季 | E20: 5 | F20: 3 | G20: 1 | H20: 999 | I20: 3 | J20: 0 | K20: 5 | L20: 2359 | M20: =RC[-2] -> 5 | N20: 2359
A21: 96 | B21: 16 | C21: 1 | D21: 特惠推送 | E21: 5 | F21: 4 | G21: 1 | H21: 999 | I21: 3 | J21: 0 | K21: 5 | L21: 2359 | M21: 5 | N21: 2359
A22: 129 | B22: 99 | C22: 1 | D22: 春节活动 | E22: 1 | F22: 1 | G22: 1 | H22: 999 | I22: 20180215 | J22: 0 | K22: 20180221 | L22: 2359 | M22: =RC[-2] -> 20180221 | N22: 2359
A23: 119 | B23: 1000 | C23: 1 | D23: 春节活动 | E23: 1 | F23: 1 | G23: 1 | I23: 20190204 | J23: 0 | K23: 20190210 | L23: 2359 | M23: =RC[-2] -> 20190210 | N23: 2359
A24: 127 | B24: 19 | C24: 3 | D24: 充值回馈（6~10） | E24: 6 | F24: 6 | G24: 1 | H24: 999 | I24: 6 | J24: 5 | K24: 10 | L24: 2359 | M24: 10 | N24: 2359
A25: 94 | B25: 14 | C25: 1 | D25: 超值购1-8 | E25: 7 | F25: 1 | G25: 1 | I25: 1 | J25: 0 | K25: 8 | L25: 2359 | M25: =RC[-2] -> 8 | N25: 2359
A26: 130 | B26: 23 | C26: 1 | D26: 新超值购7-12 | E26: 6 | F26: 7 | G26: 1 | H26: 999 | I26: 7 | J26: 0 | K26: 12 | L26: 2359 | M26: =RC[-2] -> 12 | N26: 2359
A27: 130 | B27: 400 | C27: 2 | D27: 新超值购19-24 | E27: 6 | F27: 19 | G27: 1 | H27: 999 | I27: 19 | J27: 0 | K27: 24 | L27: 2359 | M27: =RC[-2] -> 24 | N27: 2359
A28: 135 | B28: 36 | C28: 1 | D28: 开服转盘1-7 | E28: 6 | F28: 1 | G28: 1 | I28: 1 | J28: 0 | K28: 7 | L28: 2359 | M28: =RC[-2] -> 7 | N28: 2359
A29: 97 | B29: 17 | C29: 1 | D29: 开服冲榜 | E29: 5 | F29: 1 | G29: 1 | I29: 1 | J29: 0 | K29: 7 | L29: 2359 | M29: 7 | N29: 2359
A30: 127 | B30: 30 | C30: 1 | D30: 充值回馈（开服） | E30: 1 | F30: 1 | G30: 1 | I30: 20190218 | J30: 0 | K30: 20190222 | L30: 2359 | M30: =RC[-2] -> 20190222 | N30: 2359
A31: 127 | B31: 31 | C31: 2 | D31: 充值回馈（开服） | E31: 1 | F31: 1 | G31: 1 | I31: 20190304 | J31: 0 | K31: 20190308 | L31: 2359 | M31: =RC[-2] -> 20190308 | N31: 2359
A32: 127 | B32: 32 | C32: 32 | D32: 充值回馈（开服） | E32: 1 | F32: 1 | G32: 1 | I32: 20190211 | J32: 0 | K32: 20190215 | L32: 2359 | M32: =RC[-2] -> 20190215 | N32: 2359
A33: 128 | B33: 22 | C33: 2 | D33: 深海女王8~10 | E33: 6 | F33: 4 | G33: 1 | H33: 26 | I33: 8 | J33: 0 | K33: 10 | L33: 2359 | M33: =RC[-2] -> 10 | N33: 2359
A34: 128 | B34: 40 | C34: 3 | D34: 大地之子11~13 | E34: 6 | F34: 8 | G34: 1 | H34: 26 | I34: 11 | J34: 0 | K34: 13 | L34: 2359 | M34: =RC[-2] -> 13 | N34: 2359
A35: 128 | B35: 56 | C35: 4 | D35: 深海女王2~3 | E35: 6 | F35: 2 | G35: 1 | I35: 2 | J35: 0 | K35: 3 | L35: 2359 | M35: =RC[-2] -> 3 | N35: 2359
A36: 128 | B36: 57 | C36: 5 | D36: 大地之子6~7 | E36: 6 | F36: 6 | G36: 1 | I36: 6 | J36: 0 | K36: 7 | L36: 2359 | M36: =RC[-2] -> 7 | N36: 2359
A37: 128 | B37: 54 | C37: 6 | D37: 深海女王(循环) | E37: 1 | F37: 14 | G37: 1 | I37: 20190304 | J37: 0 | K37: 20190306 | L37: 2359 | M37: =RC[-2] -> 20190306 | N37: 2359
A38: 128 | B38: 55 | C38: 7 | D38: 大地之子(循环) | E38: 1 | F38: 14 | G38: 1 | I38: 20190308 | J38: 0 | K38: 20190310 | L38: 2359 | M38: =RC[-2] -> 20190310 | N38: 2359
A39: 128 | B39: 59 | C39: 1 | D39: 深海女王(循环) | E39: 1 | F39: 14 | G39: 1 | I39: 20190225 | J39: 0 | K39: 20190227 | L39: 2359 | M39: =RC[-2] -> 20190227 | N39: 2359
A40: 128 | B40: 58 | C40: 8 | D40: 大地之子(循环) | E40: 1 | F40: 14 | G40: 1 | I40: 20190301 | J40: 0 | K40: 20190303 | L40: 2359 | M40: =RC[-2] -> 20190303 | N40: 2359
A41: 131 | B41: 51 | C41: 1 | D41: 特殊扭蛋 | E41: 1 | F41: 1 | G41: 1 | I41: 20190225 | J41: 0 | K41: 20190303 | L41: 2359 | M41: =RC[-2] -> 20190303 | N41: 2359
A42: 135 | B42: 500 | C42: 2 | D42: 版本转盘5天 | E42: 1 | F42: 10 | G42: 40 | I42: 20190110 | J42: 0 | K42: 20190113 | L42: 2359 | M42: =RC[-2] -> 20190113 | N42: 2359
A43: 135 | B43: 502 | C43: 3 | D43: 版本转盘5天 | E43: 1 | F43: 10 | G43: 40 | I43: 20190225 | J43: 0 | K43: 20190303 | L43: 2359 | M43: =RC[-2] -> 20190303 | N43: 2359
A44: 135 | B44: 503 | C44: 4 | D44: 版本转盘5天 | E44: 1 | F44: 10 | G44: 40 | I44: 20190207 | J44: 0 | K44: 20190210 | L44: 2359 | M44: =RC[-2] -> 20190210 | N44: 2359
A45: 132 | B45: 106 | C45: 1 | D45: 活动热卖（版本） | E45: 1 | F45: 1 | G45: 1 | I45: 20190309 | J45: 0 | K45: 20190310 | L45: 2359 | M45: =RC[-2] -> 20190310 | N45: 2359
A46: 132 | B46: 107 | C46: 2 | D46: 活动热卖（版本） | E46: 1 | F46: 1 | G46: 1 | I46: 20190302 | J46: 0 | K46: 20190303 | L46: 2359 | M46: =RC[-2] -> 20190303 | N46: 2359
A47: 132 | B47: 108 | C47: 3 | D47: 活动热卖（版本） | E47: 1 | F47: 1 | G47: 1 | I47: 20190216 | J47: 0 | K47: 20190217 | L47: 2359 | M47: =RC[-2] -> 20190217 | N47: 2359
A48: 146 | B48: 202 | C48: 1 | D48: 限时招募 | E48: 6 | F48: =RC[3] -> 11 | G48: 1 | H48: 999 | I48: 11 | J48: 0 | K48: 13 | L48: 2359 | M48: =RC[-2] -> 13 | N48: 2359
A49: 146 | B49: 203 | C49: 2 | D49: 限时招募 | E49: 6 | F49: =RC[3] -> 17 | G49: 1 | H49: 24 | I49: 17 | J49: 0 | K49: 19 | L49: 2359 | M49: =RC[-2] -> 19 | N49: 2359
A50: 146 | B50: 204 | C50: 3 | D50: 限时招募 | E50: 6 | F50: =RC[3] -> 23 | G50: 1 | H50: 21|22 | I50: 23 | J50: 0 | K50: 25 | L50: 2359 | M50: =RC[-2] -> 25 | N50: 2359
A51: 146 | B51: 207 | C51: 8 | D51: 限时招募B（8-9） | E51: 6 | F51: =RC[3] -> 8 | G51: 1 | I51: 8 | J51: 0 | K51: 9 | L51: 2359 | M51: =RC[-2] -> 9 | N51: 2359
A52: 146 | B52: 208 | C52: 7 | D52: 限时招募A（4-5） | E52: 6 | F52: =RC[3] -> 4 | G52: 1 | I52: 4 | J52: 0 | K52: 5 | L52: 2359 | M52: =RC[-2] -> 5 | N52: 2359
A53: 146 | B53: 205 | C53: 4 | D53: 限时招募（B租） | E53: 1 | F53: 10 | G53: 1 | I53: 20190304 | J53: 0 | K53: 20190306 | L53: 2359 | M53: =RC[-2] -> 20190306 | N53: 2359
A54: 146 | B54: 206 | C54: 5 | D54: 限时招募（A租） | E54: 1 | F54: 10 | G54: 1 | I54: 20190222 | J54: 0 | K54: 20190224 | L54: 2359 | M54: =RC[-2] -> 20190224 | N54: 2359
A55: 146 | B55: 209 | C55: 6 | D55: 限时招募（A租） | E55: 1 | F55: 10 | G55: 1 | I55: 20190308 | J55: 0 | K55: 20190310 | L55: 2359 | M55: =RC[-2] -> 20190310 | N55: 2359

Sheet: 2.等级商店
A1: level|level | B1: valid_time|valid_time | C1: goods_id_list|goods_id_list | D1: titlename| | E1: text| | F1: system_type| | G1: icon_zoom|
A2: 不可空 | B2: 不可空 | C2: 可空#不需字段 | D2: 不可空 | E2: 不可空 | F2: 不可空 | G2: 不可空
A3: 数字 | B3: 数字 | C3: 一维数组 | D3: 字符串 | E3: 字符串 | F3: 数字 | G3: 数字
C4: 不定长
A6: 等级 | B6: 有效时间(分钟) | C6: 商品ID列表 | D6: 系统名 | E6: 功能描述 | F6: 前往界面 | G6: 图标缩放比例
A7: 20 | B7: 2880 | C7: 201|202 | D7: 勇者试炼 | E7: 挑战勇者试炼，获取更强装备 | F7: 17 | G7: 0.8
A8: 22 | B8: 2880 | C8: 221|222|223 | D8: 第五阵位 | E8: 第五阵位开启，队伍成型 | F8: 8 | G8: 0.9
A9: 23 | B9: 2880 | C9: 231|232 | D9: 军团 | E9: 加入军团，强强联手 | F9: 22 | G9: 0.9
A10: 25 | B10: 2880 | C10: 251|252|253 | D10: 再次进阶 | E10: 英雄再次进阶，属性提升 | F10: 8 | G10: 0.9
A11: 29 | B11: 2880 | C11: 291|292|293 | D11: 装备精炼 | E11: 装备精炼开启，提升装备属性 | F11: 5 | G11: 0.9
A12: 35 | B12: 2880 | C12: 351|352 | D12: 英雄潜能 | E12: 升级潜能，强化技能效果 | F12: 44 | G12: 0.9
A13: 37 | B13: 2880 | C13: 371|372 | D13: 精灵升华 | E13: 精灵升华，大幅提升属性 | F13: 87 | G13: 0.9
A14: 39 | B14: 2880 | C14: 391|392|393 | D14: 圣器精炼 | E14: 圣器精炼开启，提升圣器属性 | F14: 6 | G14: 0.9
A15: 45 | B15: 2880 | C15: 451|452|453 | D15: 英雄觉醒 | E15: 开启英雄觉醒，增加大量属性 | F15: 8 | G15: 0.9 | H15: 50 | I15: 2880 | J15: 501|502 | K15: 占卜 | L15: 通晓占卜之术，掌握未来命运 | M15: 113 | N15: 0.9

Sheet: 3.等级商店商品
A1: goods_id|goods_id | B1: cost_type_list|cost_type_list | C1: cost_value_list|cost_value_list | D1: item_id|item_id | E1: item_num|item_num | F1: buy_num_max|buy_num_max | G1: sale|
A2: 不可空 | B2: 可空#不需字段 | C2: 可空#不需字段 | D2: 不可空 | E2: 不可空 | F2: 不可空 | G2: 不可空
A3: 数字 | B3: 一维数组 | C3: 一维数组 | D3: 数字 | E3: 数字 | F3: 数字 | G3: 数字
B4: 不定长 | C4: 不定长 | D4: 不定长 | E4: 不定长
A6: 商品ID | B6: 消耗类型列表 | C6: 消耗值列表 | D6: 物品ID | E6: 物品数量 | F6: 购买数量上限(0=表示无上限) | G6: 折扣标签 | H6: 备注 | I6: 单价 | J6: 原价
A7: 1 | B7: 5 | C7: 90 | D7: 19012 | E7: 1000 | F7: 1 | G7: 9 | H7: 威名 | I7: 0.1 | J7: 100
A8: 2 | B8: 5 | C8: 480 | D8: 13310 | E8: 20 | F8: 1 | G8: 8 | H8: 紫装碎片4选1 | I8: 30 | J8: 600
A9: 3 | B9: 5 | C9: 120 | D9: 19103 | E9: 20 | F9: 1 | G9: 6 | H9: 金币 | I9: 10 | J9: 200
A10: 4 | B10: 5 | C10: 2240 | D10: 13434 | E10: 1 | F10: 1 | G10: 7 | H10: 核心英雄6选1 | I10: 3200 | J10: 3200
A11: 5 | B11: 5 | C11: 2100 | D11: 10019 | E11: 10 | F11: 1 | G11: 7 | H11: 次元核心 | I11: 300 | J11: 3000
A12: 6 | B12: 5 | C12: 400 | D12: 33300 | E12: 10 | F12: 1 | G12: 4 | H12: 紫品传承核心 | I12: 100 | J12: 1000
A13: 7 | B13: 5 | C13: 800 | D13: 19006 | E13: 1000 | F13: 1 | G13: 8 | H13: 魂晶 | I13: 1 | J13: 1000
A14: 8 | B14: 5 | C14: 300 | D14: 10013 | E14: 50 | F14: 1 | G14: 6 | H14: 紫品精炼石 | I14: 10 | J14: 500
A15: 9 | B15: 5 | C15: 180 | D15: 19012 | E15: 2000 | F15: 1 | G15: 9 | H15: 威名 | I15: 0.1 | J15: 200
A16: 10 | B16: 5 | C16: 800 | D16: 13003 | E16: 20 | F16: 1 | G16: 4 | H16: 橙品装备碎片箱 | I16: 100 | J16: 2000
A17: 11 | B17: 5 | C17: 500 | D17: 19103 | E17: 100 | F17: 1 | G17: 5 | H17: 金币 | I17: 10 | J17: 1000
A18: 12 | B18: 5 | C18: 160 | D18: 19020 | E18: 2000 | F18: 1 | G18: 8 | H18: 军团贡献 | I18: 0.1 | J18: 200
A19: 13 | B19: 5 | C19: 1120 | D19: 13329 | E19: 40 | F19: 1 | G19: 7 | H19: 核心英雄碎片 | I19: 40 | J19: 1600
A20: 14 | B20: 5 | C20: 1080 | D20: 13436 | E20: 40 | F20: 1 | G20: 9 | H20: 核心配合英雄碎片 | I20: 30 | J20: 1200
A21: 15 | B21: 5 | C21: 240 | D21: 10015 | E21: 20 | F21: 1 | G21: 6 | H21: 讨伐令 | I21: 20 | J21: 400
A22: 16 | B22: 5 | C22: 600 | D22: 10004 | E22: 100 | F22: 1 | G22: 4 | H22: 潜能合剂 | I22: 15 | J22: 1500
A23: 17 | B23: 5 | C23: 400 | D23: 19014 | E23: 5000 | F23: 1 | G23: 8 | H23: 战功 | I23: 0.1 | J23: 500
A24: 18 | B24: 5 | C24: 200 | D24: 10010 | E24: 100 | F24: 1 | G24: 4 | H24: 圣器精炼石 | I24: 5 | J24: 500
A25: 19 | B25: 5 | C25: 2000 | D25: 13008 | E25: 20 | F25: 1 | G25: 5 | H25: 圣器碎片箱 | I25: 200 | J25: 4000
A26: 20 | B26: 5 | C26: 250 | D26: 10001 | E26: 20 | F26: 1 | G26: 5 | H26: 精力药剂 | I26: 25 | J26: 500
A27: 21 | B27: 5 | C27: 320 | D27: 13646 | E27: 10 | F27: 1 | G27: 8 | H27: 精灵培养材料各十 | I27: 40 | J27: 400
A28: 22 | B28: 5 | C28: 400 | D28: 19028 | E28: 500 | F28: 1 | G28: 8 | H28: 无尽石 | I28: 1 | J28: 500
A29: 23 | B29: 5 | C29: 2000 | D29: 13324 | E29: 1 | F29: 1 | G29: 8 | H29: 任选精灵升华道具 | I29: 2500 | J29: 2500
A30: 24 | B30: 5 | C30: 400 | D30: 19017 | E30: 500 | F30: 1 | G30: 8 | H30: 神魂 | I30: 1 | J30: 500
A31: 25 | B31: 5 | C31: 600 | D31: 10008 | E31: 300 | F31: 1 | G31: 8 | H31: 觉醒水晶 | I31: 2.5 | J31: 750
A32: 26 | B32: 5 | C32: 1400 | D32: 13017 | E32: 10 | F32: 1 | G32: 7 | H32: 觉醒材料箱 | I32: 200 | J32: 2000
A33: 27 | B33: 5 | C33: 1050 | D33: 13016 | E33: 30 | F33: 1 | G33: 7 | H33: 觉醒材料箱 | I33: 50 | J33: 1500
A34: 28 | B34: 5 | C34: 300 | D34: 10002 | E34: 500 | F34: 1 | G34: 40 | H34: 进阶石 | I34: 1 | J34: 500
A35: 29 | B35: 5 | C35: 250 | D35: 19103 | E35: 50 | F35: 1 | G35: 50 | H35: 金币 | I35: 10 | J35: 500
A36: 30 | B36: 5 | C36: 700 | D36: 10021 | E36: 50 | F36: 1 | G36: 30 | H36: 刷新令 | I36: 20 | J36: 1000
A37: 201 | B37: 5 | C37: 576 | D37: 13601 | E37: 1 | F37: 1 | G37: 40 | H37: 骑士套装*1 | I37: 960 | J37: 960 | K37: 骑士套装*1 原价960 6折，可购买1次
A38: 202 | B38: 5 | C38: 100 | D38: 19103 | E38: 20 | F38: 1 | G38: 50 | H38: 金币*10W | I38: 10 | J38: 200 | K38: 金币*10W 原价200 5折，可购买1次
A39: 221 | B39: 5 | C39: 2100 | D39: 10019 | E39: 10 | F39: 1 | G39: 30 | H39: 次元核心*10 | I39: 300 | J39: 3000 | K39: 次元核心*10 原价3000 7折，可购买1次
A40: 222 | B40: 5 | C40: 200 | D40: 33300 | E40: 5 | F40: 3 | G40: 60 | H40: 紫品传承核心*5 | I40: 100 | J40: 500 | K40: 紫品传承核心*5 原价500 4折，可购买3次
A41: 223 | B41: 5 | C41: 150 | D41: 19103 | E41: 30 | F41: 1 | G41: 50 | H41: 金币*10W | I41: 10 | J41: 300 | K41: 金币*10W 原价300 5折，可购买1次
A42: 231 | B42: 5 | C42: 280 | D42: 13329 | E42: 10 | F42: 4 | G42: 30 | H42: 橙品英雄碎片箱（顶级主）*10 | I42: 40 | J42: 400 | K42: 橙品英雄碎片箱（顶级主）*10 原价400 7折，可购买4次
A43: 232 | B43: 5 | C43: 270 | D43: 13436 | E43: 10 | F43: 4 | G43: 10 | H43: 橙品英雄碎片箱（顶级副）*10 | I43: 30 | J43: 300 | K43: 橙品英雄碎片箱（顶级副）*10 原价300 9折，可购买4次
A44: 251 | B44: 5 | C44: 40 | D44: 10002 | E44: 100 | F44: 5 | G44: 60 | H44: 进阶石*100 | I44: 1 | J44: 100 | K44: 进阶石*100 原价100 4折，可购买5次
A45: 252 | B45: 5 | C45: 280 | D45: 10021 | E45: 20 | F45: 3 | G45: 30 | H45: 刷新令*20 | I45: 20 | J45: 400 | K45: 刷新令*20 原价400 7折，可购买3次
A46: 253 | B46: 5 | C46: 250 | D46: 19103 | E46: 50 | F46: 1 | G46: 50 | H46: 金币*10W | I46: 10 | J46: 500 | K46: 金币*10W 原价500 5折，可购买1次
A47: 291 | B47: 5 | C47: 300 | D47: 10013 | E47: 50 | F47: 1 | G47: 40 | H47: 紫品精炼石*50 | I47: 10 | J47: 500 | K47: 紫品精炼石*50 原价500 6折，可购买1次
A48: 292 | B48: 5 | C48: 270 | D48: 13310 | E48: 10 | F48: 4 | G48: 10 | H48: 紫装碎片4选1*10 | I48: 30 | J48: 300 | K48: 紫装碎片4选1*10 原价300 9折，可购买4次
A49: 293 | B49: 5 | C49: 250 | D49: 19103 | E49: 50 | F49: 2 | G49: 50 | H49: 金币*20W | I49: 10 | J49: 500 | K49: 金币*20W 原价500 5折，可购买2次
A50: 351 | B50: 5 | C50: 320 | D50: 10015 | E50: 20 | F50: 1 | G50: 20 | H50: 讨伐令*20 | I50: 20 | J50: 400 | K50: 讨伐令*20 原价400 8折，可购买1次
A51: 352 | B51: 5 | C51: 450 | D51: 10004 | E51: 100 | F51: 10 | G51: 70 | H51: 潜能合剂*100 | I51: 15 | J51: 1500 | K51: 潜能合剂*100 原价1500 3折，可购买10次
A52: 371 | B52: 5 | C52: 160 | D52: 13646 | E52: 5 | F52: 3 | G52: 20 | H52: 精灵培养材料各十*5 | I52: 40 | J52: 200 | K52: 精灵培养材料各十*5 原价200 8折，可购买3次
A53: 372 | B53: 5 | C53: 2000 | D53: 13324 | E53: 1 | F53: 1 | G53: 20 | H53: 任选精灵升华道具*1 | I53: 2500 | J53: 2500 | K53: 任选精灵升华道具*1 原价2500 8折，可购买1次
A54: 391 | B54: 5 | C54: 1000 | D54: 10010 | E54: 500 | F54: 3 | G54: 60 | H54: 圣器精炼石*500 | I54: 5 | J54: 2500 | K54: 圣器精炼石*500 原价2500 4折，可购买3次
A55: 392 | B55: 5 | C55: 300 | D55: 13008 | E55: 5 | F55: 5 | G55: 70 | H55: 圣器碎片箱*5 | I55: 200 | J55: 1000 | K55: 圣器碎片箱*5 原价1000 3折，可购买5次
A56: 393 | B56: 5 | C56: 200 | D56: 10001 | E56: 10 | F56: 2 | G56: 20 | H56: 精力丹*10 | I56: 25 | J56: 250 | K56: 精力丹*10 原价250 8折，可购买2次
A57: 451 | B57: 5 | C57: 200 | D57: 10008 | E57: 100 | F57: 5 | G57: 20 | H57: 觉醒水晶*100 | I57: 2.5 | J57: 250 | K57: 觉醒水晶*100 原价250 8折，可购买5次
A58: 452 | B58: 5 | C58: 280 | D58: 13017 | E58: 2 | F58: 5 | G58: 30 | H58: 觉醒材料箱（紫）*2 | I58: 200 | J58: 400 | K58: 觉醒材料箱（紫）*2 原价400 7折，可购买5次
A59: 453 | B59: 5 | C59: 105 | D59: 13016 | E59: 3 | F59: 10 | G59: 30 | H59: 觉醒材料箱（蓝）*3 | I59: 50 | J59: 150 | K59: 觉醒材料箱（蓝）*3 原价150 7折，可购买10次
A60: 501 | B60: 5 | C60: 400 | D60: 10009 | E60: 10 | F60: 5 | G60: 20 | H60: 预言星徽*10 | I60: 50 | J60: 500 | K60: 预言星徽*10 原价500 8折，可购买5次
A61: 502 | B61: 5 | C61: 150 | D61: 19103 | E61: 30 | F61: 10 | G61: 50 | H61: 金币*30W | I61: 10 | J61: 300 | K61: 金币*30W 原价300 5折，可购买10次

Sheet: 4.开服基金
A1: id|id | B1: need_role_level|need_role_level | C1: diamond|diamond
A2: 不可空 | B2: 不可空 | C2: 不可空
A3: 数字 | B3: 数字 | C3: 数字
A6: 奖励ID | B6: 需要的角色等级 | C6: 奖励钻石
A7: 1 | B7: 10 | C7: 500
A8: 2 | B8: 25 | C8: 1000
A9: 3 | B9: 35 | C9: 1500
A10: 4 | B10: 45 | C10: 2000
A11: 5 | B11: 55 | C11: 2500
A12: 6 | B12: 60 | C12: 2500

Sheet: 5.全民福利
A1: id|id | B1: need_buy_num|need_buy_num | C1: item_id_list|item_id_list | D1: item_num_list|item_num_list
A2: 不可空 | B2: 不可空 | C2: 可空#不需字段 | D2: 可空#不需字段
A3: 数字 | B3: 数字 | C3: 一维数组 | D3: 一维数组
C4: 不定长 | D4: 不定长
A6: 福利ID | B6: 需要的购买人数 | C6: 获得的物品ID列表 | D6: 获得的物品数量列表
A7: 1 | B7: 20 | C7: 19005 | D7: 100
A8: 2 | B8: 40 | C8: 19005 | D8: 200
A9: 3 | B9: 80 | C9: 19006 | D9: 300
A10: 4 | B10: 120 | C10: 19005 | D10: 400
A11: 5 | B11: 160 | C11: 19005 | D11: 500
A12: 6 | B12: 200 | C12: 19028 | D12: 600
A13: 7 | B13: 240 | C13: 19005 | D13: 700
A14: 8 | B14: 280 | C14: 19005 | D14: 800
A15: 9 | B15: 320 | C15: 19005 | D15: 900
A16: 10 | B16: 360 | C16: 19005 | D16: 1000

Sheet: 6.等级礼包数据
A1: level|level | B1: item_id_list|item_id_list | C1: item_num_list|item_num_list
A2: 不可空 | B2: 可空#不需字段 | C2: 可空#不需字段
A3: 数字 | B3: 一维数组 | C3: 一维数组
B4: 不定长 | C4: 不定长
A6: 等级 | B6: 物品ID列表 | C6: 物品数量列表
A7: 7 | B7: 19005|19103|20101|33100 | C7: 20|10|1|3 | D7: 钻石*20、金币*100000、绿品武器*1、绿品传承核心*3 | I7: 51 | J7: 19005|19103|10096|10009 | K7: 100|40|2|10 | L7: 钻石*100、金币*400000、占星水晶*2、预言星徽*10
A8: 9 | B8: 19005|19103|10003|13014 | C8: 20|10|50|10 | D8: 钻石*20、金币*100000、培养丹*50、橙品英雄碎片宝箱*10 | I8: 54 | J8: 19005|19103|13015|10009 | K8: 120|40|10|10 | L8: 钻石*120、金币*400000、觉醒材料箱（绿）*10、预言星徽*10
A9: 11 | B9: 19005|19006|10021|13024 | C9: 30|200|10|5 | D9: 钻石*30、魂晶*200、刷新令*10、随机绿品英雄*5
A10: 13 | B10: 19005|19103|42201|13049 | C10: 30|15|10|5 | D10: 钻石*30、金币*150000、蓝水晶*10、圣器碎片箱*5
A11: 15 | B11: 19005|19103|33200|10002 | C11: 30|15|4|50 | D11: 钻石*30、金币*150000、蓝品传承核心*4、进阶石*50
A12: 17 | B12: 19005|19103|13010|10002 | C12: 40|15|1|50 | D12: 钻石*40、金币*150000、紫品圣器箱*1、进阶石*50
A13: 20 | B13: 19005|19103|19012|13007 | C13: 40|15|500|5 | D13: 钻石*40、金币*150000、威名*500、装备碎片箱*5
A14: 22 | B14: 19005|19103|21201|10019 | C14: 50|15|1|1 | D14: 钻石*50、金币*150000、蓝品衣服*1、次元核心*1
A15: 23 | B15: 19005|19103|13620|10022 | C15: 50|15|1|10 | D15: 钻石*50、金币*150000、希望精灵*1、灵性精粹*10
A16: 25 | B16: 19005|19103|22201|13049 | C16: 50|15|1|8 | D16: 钻石*50、金币*150000、蓝品鞋子*1、圣器碎片箱*8
A17: 27 | B17: 19005|19103|10003|42301 | C17: 60|15|50|5 | D17: 钻石*60、金币*150000、蓝品护腕*1、紫水晶*5
A18: 29 | B18: 19005|19103|33300|10013 | C18: 60|15|5|10 | D18: 钻石*60、金币*150000、紫品传承核心*5、紫品精炼石*10
A19: 31 | B19: 19005|19103|13007|10022 | C19: 70|20|10|10 | D19: 钻石*70、金币*200000、装备碎片箱*10、灵性精粹*10
A20: 32 | B20: 19005|19103|13626|10022 | C20: 70|20|1|15 | D20: 钻石*70、金币*200000、花之妖精*1、灵性精粹*15
A21: 33 | B21: 19005|19103|19020|10004 | C21: 70|20|1000|100 | D21: 钻石*70、金币*200000、军团贡献*1000、潜能药剂*100
A22: 36 | B22: 19005|19103|10004|10015 | C22: 80|20|100|10 | D22: 钻石*80、金币*200000、潜能药剂*100、讨伐令*10
A23: 39 | B23: 19005|19103|10010|13049 | C23: 80|30|100|12 | D23: 钻石*80、金币*300000、圣器精炼石*100、圣器碎片箱*12
A24: 42 | B24: 19005|19103|33400|10101 | C24: 90|30|5|5 | D24: 钻石*90、金币*300000、橙品传承核心*5、扭蛋币*5
A25: 45 | B25: 19005|19103|19017|10008 | C25: 90|30|200|100 | D25: 钻石*90、金币*300000、神魂*200、觉醒水晶*100
A26: 48 | B26: 19005|19103|13015|13016 | C26: 100|40|5|2 | D26: 钻石*100、金币*400000、觉醒材料箱（绿）*5、觉醒材料箱（蓝）*2

Sheet: 7.限时活动
A1: id|id | B1: type|type | C1: context|context | D1: reward_times_max|reward_times_max | E1: reward_item_id_list|reward_item_id_list | F1: reward_item_num_list|reward_item_num_list
A2: 不可空 | B2: 不可空 | C2: 不可空 | D2: 不可空 | E2: 可空#不需字段 | F2: 可空#不需字段
A3: 数字 | B3: 数字 | C3: 数字 | D3: 数字 | E3: 一维数组 | F3: 一维数组
E4: 不定长 | F4: 不定长
A6: 数据逻辑id | B6: 限时活动类型 | C6: 上下文 | D6: 奖励次数上限 | E6: 奖励的物品ID | F6: 奖励的物品数量
A7: 100 | B7: 1 | C7: 2002 | D7: 2 | E7: 19006|19103 | F7: 688|68
A8: 101 | B8: 1 | C8: 2003 | D8: 2 | E8: 10014|19103 | F8: 128|88
A9: 102 | B9: 1 | C9: 2004 | D9: 2 | E9: 19017|19103 | F9: 3888|128
A10: 103 | B10: 1 | C10: 2005 | D10: 2 | E10: 10004|19103 | F10: 666|188
A11: 200 | B11: 2 | C11: 6 | D11: 1 | E11: 19005|10000|10001 | F11: 150|2|2
A12: 201 | B12: 2 | C12: 25 | D12: 1 | E12: 13329|10001|19103 | F12: 20|4|20
A13: 202 | B13: 2 | C13: 50 | D13: 1 | E13: 13329|10000|19103 | F13: 30|4|35
A14: 203 | B14: 2 | C14: 100 | D14: 1 | E14: 10014|19103 | F14: 50|100
A15: 204 | B15: 2 | C15: 200 | D15: 1 | E15: 13316|10010|19103 | F15: 1|200|100
A16: 205 | B16: 2 | C16: 300 | D16: 1 | E16: 13302|19103 | F16: 160|110
A17: 206 | B17: 2 | C17: 500 | D17: 1 | E17: 13302|19103 | F17: 240|140
A18: 207 | B18: 2 | C18: 700 | D18: 1 | E18: 13302|19103 | F18: 240|140
A19: 208 | B19: 2 | C19: 1000 | D19: 1 | E19: 13302|19103 | F19: 320|270
A20: 209 | B20: 2 | C20: 1500 | D20: 1 | E20: 13302|19103 | F20: 400|400
A21: 210 | B21: 2 | C21: 2000 | D21: 1 | E21: 13302|19103 | F21: 400|400
A22: 211 | B22: 2 | C22: 2500 | D22: 1 | E22: 13302|19103 | F22: 400|400
A23: 212 | B23: 2 | C23: 3000 | D23: 1 | E23: 13302|19103 | F23: 400|400
A24: 213 | B24: 2 | C24: 3500 | D24: 1 | E24: 13302|19103 | F24: 400|400
A25: 214 | B25: 2 | C25: 4000 | D25: 1 | E25: 13302|19103 | F25: 400|400
A26: 215 | B26: 2 | C26: 4500 | D26: 1 | E26: 13302|19103 | F26: 400|400
A27: 300 | B27: 3 | C27: 20 | D27: 1 | E27: 13408|13410 | F27: 10|10
A28: 301 | B28: 3 | C28: 40 | D28: 1 | E28: 13407|13409 | F28: 20|20
A29: 302 | B29: 3 | C29: 60 | D29: 1 | E29: 13329|13406 | F29: 20|20
A30: 303 | B30: 3 | C30: 90 | D30: 1 | E30: 13408|13410 | F30: 30|30
A31: 304 | B31: 3 | C31: 120 | D31: 1 | E31: 13407|13409 | F31: 30|30
A32: 305 | B32: 3 | C32: 150 | D32: 1 | E32: 13329|13406 | F32: 30|30
A33: 306 | B33: 3 | C33: 190 | D33: 1 | E33: 13408|13410 | F33: 40|40
A34: 307 | B34: 3 | C34: 230 | D34: 1 | E34: 13407|13409 | F34: 50|50
A35: 308 | B35: 3 | C35: 270 | D35: 1 | E35: 13329|13406 | F35: 50|50
A36: 401 | B36: 4 | C36: 4 | D36: 1 | E36: 13400|10000|19103 | F36: 1|2|5
A37: 402 | B37: 4 | C37: 200 | D37: 1 | E37: 20400|10001|19103 | F37: 1|10|20
A38: 403 | B38: 4 | C38: 500 | D38: 1 | E38: 13622|10021|19103 | F38: 1|20|50
A39: 404 | B39: 4 | C39: 50 | D39: 1 | E39: 13399|23301|19103 | F39: 1|1|10

Sheet: 8.限时活动预告
A1: system_id|system_id | B1: module_txt_list| | C1: week_day_list|week_day_list | D1: need_role_level|need_role_level | E1: start_begin_notice_time| | F1: start_end_notice_time| | G1: is_declare| | H1: advance_notice| | I1: start_time| | J1: start_notice| | K1: interval_time| | L1: over_time| | M1: over_begin_notice_time|| | N1: over_end_notice_time| | O1: over_advance_notice| | P1: over_notice|
A2: 不可空 | B2: 不可空 | C2: 不可空 | D2: 不可空 | E2: 不可空 | F2: 不可空 | G2: 不可空 | H2: 可空#不需字段 | I2: 不可空 | J2: 可空#不需字段 | K2: 不可空 | L2: 不可空 | M2: 可空#不需字段 | N2: 可空#不需字段 | O2: 可空#不需字段 | P2: 可空#不需字段
A3: 数字 | B3: 一维数组 | C3: 一维数组 | D3: 数字 | E3: 一维数组 | F3: 一维数组 | G3: 数字 | H3: 字符串 | I3: 一维数组 | J3: 字符串 | K3: 数字 | L3: 一维数组 | M3: 一维数组 | N3: 一维数组 | O3: 字符串 | P3: 字符串
B4: 不定长 | C4: 不定长 | E4: 不定长 | F4: 不定长 | H4: 不定长 | I4: 不定长 | J4: 不定长 | L4: 不定长 | M4: 不定长 | N4: 不定长 | O4: 不定长 | P4: 不定长
A6: 系统模块ID | C6: 星期几(0=星期天) | D6: 需要的角色等级 | E6: 公告开始时间[小时分钟] | F6: 公告结束时间[小时分钟] | G6: 是否需要预告 | H6: 预告内容 | I6: 活动开启时间 | J6: 活动开始公告内容 | K6: 公告间隔时间(秒) | L6: 活动结束时间[小时分钟] | M6: 公告开始时间[小时分钟] | N6: 公告结束时间[小时分钟] | O6: 结束预告内容 | P6: 活动结束公告内容
A7: 47 | B7: "世界BOSS" | C7: 1|3|5 | D7: 35 | E7: 1855 | F7: 1859 | G7: 1 | H7: 世界BOSS将在%s出现，请做好准备，赢取丰厚奖励！ | I7: 1900 | J7: 世界BOSS已刷新，请大家踊跃参与击杀! | K7: 30 | L7: 2000
A8: 72 | B8: "跨服对决" | C8: 0|1|2|3|4|5|6 | D8: 20 | E8: 1155 | F8: 1159 | G8: 1 | H8: 跨服对决将在%s打响，在战斗中狂欢吧！ | I8: 1200 | J8: 跨服对决已经开放，这是一场肆虐的盛宴！欢呼并战斗吧！ | K8: 30 | L8: 1300
A9: 84 | B9: "怪物攻城" | C9: 2|4|6 | D9: 20 | E9: 1855 | F9: 1859 | G9: 1 | H9: 怪物将在%s进攻，务必做好堤防！ | I9: 1900 | J9: 无数怪物离开了栖息地，对各城镇发起冲击，请火速前往阻止 | K9: 30 | L9: 1930
A10: 16 | B10: "消耗减半"|"双倍功勋" | C10: 0|1|2|3|4|5|6 | D10: 35 | E10: 1155|1755 | F10: 1159|1759 | G10: 0 | I10: 1200|1800 | K10: 30 | L10: 1400|2200
A11: 134 | B11: "限时组队" | C11: 0|1|2|3|4|5|6 | D11: 31 | E11: 1955 | F11: 1959 | G11: 1 | H11: 空间管理局将在%s打开空间通道，请大家把握时机！ | I11: 2000 | J11: 空间管理局通道已打开！大家赶紧去参加跨服组队副本吧！ | K11: 30 | L11: 2200 | M11: 2155 | N11: 2159 | O11: 空间管理局将在%s关闭空间通道。 | P11: 空间管理局已关闭空间通道，请大家明天同一时间再度参与跨服组队副本！

Sheet: 9.节日活动
A1: activity_type|activity_type | B1: name| | D1: icon| | E1: id|id | F1: sort| | G1: head| | H1: scale| | I1: excursion| | J1: decorate| | K1: decorate_x| | L1: decorate_y| | M1: test_res| | N1: test_res_x| | O1: test_res_y| | P1: effect| | Q1: desc| | R1: time_type|time_type | S1: days|days | T1: server_list|server_list | U1: star_date|star_date | V1: star_time|star_time | W1: over_date|over_date | X1: over_time|over_time | Y1: reward_over_date|reward_over_date | Z1: reward_over_time|reward_over_time | AA1: param_list|param_list
A2: 不可空 | B2: 不可空 | D2: 不可空 | E2: 不可空 | F2: 不可空 | G2: 可空#不需字段 | H2: 可空#不需字段 | I2: 可空#不需字段 | J2: 可空#不需字段 | K2: 可空#不需字段 | L2: 可空#不需字段 | M2: 可空#不需字段 | N2: 可空#不需字段 | O2: 可空#不需字段 | P2: 可空#不需字段 | Q2: 不可空 | R2: 不可空 | S2: 不可空 | T2: 可空#不需字段 | U2: 不可空 | V2: 不可空 | W2: 不可空 | X2: 不可空 | Y2: 不可空 | Z2: 不可空 | AA2: 可空#不需字段
A3: 数字 | B3: 字符串 | D3: 字符串 | E3: 数字 | F3: 数字 | G3: 数字 | H3: 数字 | I3: 一维数组 | J3: 一维数组 | K3: 一维数组 | L3: 一维数组 | M3: 一维数组 | N3: 一维数组 | O3: 一维数组 | P3: 一维数组 | Q3: 字符串 | R3: 数字 | S3: 数字 | T3: 一维数组 | U3: 数字 | V3: 数字 | W3: 数字 | X3: 数字 | Y3: 数字 | Z3: 数字 | AA3: 一维数组
I4: 不定长 | J4: 不定长 | K4: 不定长 | L4: 不定长 | M4: 不定长 | N4: 不定长 | O4: 不定长 | P4: 不定长 | T4: 不定长 | AA4: 不定长
A6: 活动类型 | B6: 活动名 | C6: 备注 | D6: 图标 | E6: 活动ID | F6: 排序权值 | G6: 半身像ID | H6: 半身像缩放 | I6: 半身像偏移 | J6: 装饰图片 | K6: 装饰偏移X | L6: 装饰偏移Y | M6: 美术字 | N6: 美术字 | O6: 美术字 | P6: 特效ID | Q6: 活动描述 | R6: 时间类型 | S6: 开服多少天后有效 | T6: 开放的服务器列表 | U6: 开始日期 | V6: 开始时间[小时:分钟] | W6: 结束日期 | X6: 结束时间[小时:分钟] | Y6: 奖励结束日期 | Z6: 奖励结束时间 | AA6: 活动参数ID列表
A7: 2 | B7: 累充豪礼 | C7: 开服1~3天 | D7: btn_cumulative_recharge | E7: =ROW()-6 -> 1 | F7: 90 | G7: 31330 | H7: 1 | I7: 200|350 | J7: "sp_activity_gold"|"sp_activity_candle" | K7: 57|415 | L7: 253|268 | M7: "sp_activity_test6" | N7: 50 | O7: 430 | P7: 200001|200002 | Q7: 活动期间，累计充值金额达到指定额度可以领取对应奖励 | R7: 6 | S7: =RC[2] -> 1 | U7: 1 | V7: 0000 | W7: 3 | X7: 2359 | Y7: =RC[-2] -> 3 | Z7: 2359 | AA7: 2275|2276|2277|2278|2279|2280|2281|2282|2283|2284|2285
A8: 2 | B8: 累充豪礼 | C8: 开服4~5天 | D8: btn_cumulative_recharge | E8: =ROW()-6 -> 2 | F8: 90 | G8: 31330 | H8: 1 | I8: 200|350 | J8: "sp_activity_gold"|"sp_activity_candle" | K8: 57|415 | L8: 253|268 | M8: "sp_activity_test6" | N8: 50 | O8: 430 | P8: 200001|200002 | Q8: 活动期间，累计充值金额达到指定额度可以领取对应奖励 | R8: 6 | S8: =RC[2] -> 4 | U8: 4 | V8: 0000 | W8: 5 | X8: 2359 | Y8: =RC[-2] -> 5 | Z8: 2359 | AA8: 2286|2287|2288|2289|2290|2291|2292|2293|2294|2295|2296
A9: 2 | B9: 累充豪礼 | C9: 开服6~7天 | D9: btn_cumulative_recharge | E9: =ROW()-6 -> 3 | F9: 90 | G9: 31330 | H9: 1 | I9: 200|350 | J9: "sp_activity_gold"|"sp_activity_candle" | K9: 57|415 | L9: 253|268 | M9: "sp_activity_test6" | N9: 50 | O9: 430 | P9: 200001|200002 | Q9: 活动期间，累计充值金额达到指定额度可以领取对应奖励 | R9: 6 | S9: =RC[2] -> 6 | U9: 6 | V9: 0000 | W9: 7 | X9: 2359 | Y9: =RC[-2] -> 7 | Z9: 2359 | AA9: 2286|2287|2288|2289|2290|2291|2292|2293|2294|2295|2296
A10: 1 | B10: 单充豪礼 | C10: 开服1~3天 | D10: btn_diamond | E10: =ROW()-6 -> 4 | F10: 89 | G10: 31330 | H10: 1 | I10: 200|350 | J10: "sp_activity_gold"|"sp_activity_candle" | K10: 57|415 | L10: 253|268 | M10: "sp_activity_test1" | N10: 50 | O10: 430 | P10: 200001|200002 | Q10: 活动期间，单笔充值金额达到指定额度可以领取对应奖励 | R10: 6 | S10: =RC[2] -> 1 | U10: 1 | V10: 0000 | W10: 3 | X10: 2359 | Y10: =RC[-2] -> 3 | Z10: 2359 | AA10: 1012|1013|1014|1015|1016|1017|1018|1019
A11: 1 | B11: 单充豪礼 | C11: 开服4~5天 | D11: btn_diamond | E11: =ROW()-6 -> 5 | F11: 89 | G11: 31330 | H11: 1 | I11: 200|350 | J11: "sp_activity_gold"|"sp_activity_candle" | K11: 57|415 | L11: 253|268 | M11: "sp_activity_test1" | N11: 50 | O11: 430 | P11: 200001|200002 | Q11: 活动期间，单笔充值金额达到指定额度可以领取对应奖励 | R11: 6 | S11: =RC[2] -> 4 | U11: 4 | V11: 0000 | W11: 5 | X11: 2359 | Y11: =RC[-2] -> 5 | Z11: 2359 | AA11: 1020|1021|1022|1023|1024|1025|1026|1027
A12: 1 | B12: 单充豪礼 | C12: 开服6~7天 | D12: btn_diamond | E12: =ROW()-6 -> 6 | F12: 89 | G12: 31330 | H12: 1 | I12: 200|350 | J12: "sp_activity_gold"|"sp_activity_candle" | K12: 57|415 | L12: 253|268 | M12: "sp_activity_test1" | N12: 50 | O12: 430 | P12: 200001|200002 | Q12: 活动期间，单笔充值金额达到指定额度可以领取对应奖励 | R12: 6 | S12: =RC[2] -> 6 | U12: 6 | V12: 0000 | W12: 7 | X12: 2359 | Y12: =RC[-2] -> 7 | Z12: 2359 | AA12: 1020|1021|1022|1023|1024|1025|1026|1027
A13: 6 | B13: 开服特惠 | C13: 开服1~2天 | D13: btn_store | E13: =ROW()-6 -> 7 | F13: 70 | G13: 30438 | H13: 1 | I13: 200|350 | J13: "sp_activity_gold"|"sp_activity_candle" | K13: 57|415 | L13: 253|268 | M13: "sp_activity_test9" | N13: 50 | O13: 430 | P13: 200001|200002 | Q13: 开服首日限时打折，欲购从速！ | R13: 6 | S13: =RC[2] -> 1 | U13: 1 | V13: 0000 | W13: 2 | X13: 2359 | Y13: =RC[-2] -> 2 | Z13: 2359 | AA13: 3001|3002|3003|3004
A14: 15 | B14: 挑战主线 | C14: 开服1~2天 | D14: btn_daily | E14: =ROW()-6 -> 8 | F14: 80 | G14: 31403 | H14: 1 | I14: 270|400 | J14: "sp_activity_gold"|"sp_activity_candle" | K14: 57|415 | L14: 253|268 | M14: "sp_activity_test11" | N14: 50 | O14: 430 | P14: 200001|200002 | Q14: 活动期间，挑战主线副本可以领取对应奖励 | R14: 6 | S14: =RC[2] -> 1 | U14: 1 | V14: 0000 | W14: 2 | X14: 2359 | Y14: =RC[-2] -> 2 | Z14: 2359 | AA14: 6000|6001|6002|6003|6004
A15: 10 | B15: 开服登陆 | C15: 开服1~3天 | D15: btn_daily | E15: =ROW()-6 -> 9 | F15: 87 | G15: 32412 | H15: 1 | I15: 180|370 | J15: "sp_activity_gold"|"sp_activity_candle" | K15: 57|415 | L15: 253|268 | M15: "sp_activity_test2" | N15: 50 | O15: 430 | P15: 200001|200002 | Q15: 活动期间，在指定日期登录即可以领取对应奖励 | R15: 6 | S15: =RC[2] -> 1 | U15: 1 | V15: 0000 | W15: 3 | X15: 2359 | Y15: =RC[-2] -> 3 | Z15: 2359 | AA15: 11010|11011|11012
A16: 7 | B16: 勇者试炼 | C16: 开服1~3天 | D16: btn_reward | E16: =ROW()-6 -> 10 | F16: 60 | G16: 32431 | H16: 1 | I16: 190|340 | J16: "sp_activity_gold"|"sp_activity_candle" | K16: 57|415 | L16: 253|268 | M16: "sp_activity_test3" | N16: 50 | O16: 430 | P16: 200001|200002 | Q16: 活动期间，挑战勇者试炼可以领取对应奖励 | R16: 6 | S16: =RC[2] -> 1 | U16: 1 | V16: 0000 | W16: 3 | X16: 2359 | Y16: =RC[-2] -> 3 | Z16: 2359 | AA16: 15010|15011|15012|15013|15014
A17: 3 | B17: 限时召唤 | C17: 开服1~3天 | D17: btn_recruit | E17: =ROW()-6 -> 11 | F17: 80 | G17: 30449 | H17: 1 | I17: 190|385 | J17: "sp_activity_gold"|"sp_activity_candle" | K17: 57|415 | L17: 253|268 | M17: "sp_activity_test8" | N17: 50 | O17: 430 | P17: 200001|200002 | Q17: 活动期间，在高级召唤中召唤次数达到指定目标可以领取对应奖励 | R17: 6 | S17: =RC[2] -> 1 | U17: 1 | V17: 0000 | W17: 3 | X17: 2359 | Y17: =RC[-2] -> 3 | Z17: 2359 | AA17: 10000|10001|10002|10003|10004|10005
A18: 14 | B18: 钻石奖励 | C18: 开服1~7天 | D18: btn_daily | E18: =ROW()-6 -> 12 | F18: 80 | G18: 31403 | H18: 1 | I18: 270|400 | J18: "sp_activity_gold"|"sp_activity_candle" | K18: 57|415 | L18: 253|268 | M18: "sp_activity_test11" | N18: 50 | O18: 430 | P18: 200001|200002 | Q18: 活动期间，消耗钻石达到指定额度可以指定奖励 | R18: 6 | S18: =RC[2] -> 1 | U18: 1 | V18: 0000 | W18: 7 | X18: 2359 | Y18: =RC[-2] -> 7 | Z18: =RC[-2] -> 2359 | AA18: 32024|32025|32026|32027|32028|32029|32030|32031|32032|32033|32034|32035|32036|32037|32038|32039|32040
A19: 15 | B19: 竞技之王 | C19: 开服3~4天 | D19: btn_daily | E19: =ROW()-6 -> 13 | F19: 80 | G19: 31403 | H19: 1 | I19: 270|400 | J19: "sp_activity_gold"|"sp_activity_candle" | K19: 57|415 | L19: 253|268 | M19: "sp_activity_test11" | N19: 50 | O19: 430 | P19: 200001|200002 | Q19: 活动期间，挑战竞技场可以领取对应奖励 | R19: 6 | S19: =RC[2] -> 3 | U19: 3 | V19: 0000 | W19: 4 | X19: 2359 | Y19: =RC[-2] -> 4 | Z19: 2359 | AA19: 8027|8028|8029|8030|8031|8032|8033|8034|8035|8036
A20: 6 | B20: 折扣商铺 | C20: 开服3~4天 | D20: btn_store | E20: =ROW()-6 -> 14 | F20: 70 | G20: 30438 | H20: 1 | I20: 200|350 | J20: "sp_activity_gold"|"sp_activity_candle" | K20: 57|415 | L20: 253|268 | M20: "sp_activity_test9" | N20: 50 | O20: 430 | P20: 200001|200002 | Q20: 活动期间，各类商品折扣出售 | R20: 6 | S20: =RC[2] -> 3 | U20: 3 | V20: 0000 | W20: 4 | X20: 2359 | Y20: =RC[-2] -> 4 | Z20: 2359 | AA20: 3005|3006|3007|3008|3009|3010|3011|3012|3013|3014|3015|3016|3017|3018
A21: 4 | B21: 单充豪礼 | C21: 开服5~7天 | D21: btn_diamond | E21: =ROW()-6 -> 15 | F21: 89 | G21: 31330 | H21: 1 | I21: 200|350 | J21: "sp_activity_gold"|"sp_activity_candle" | K21: 57|415 | L21: 253|268 | M21: "sp_activity_test1" | N21: 50 | O21: 430 | P21: 200001|200002 | Q21: 活动期间，单笔充值金额达到指定额度可以领取对应奖励 | R21: 6 | S21: =RC[2] -> 5 | U21: 5 | V21: 0000 | W21: 7 | X21: 2359 | Y21: =RC[-2] -> 7 | Z21: 2359 | AA21: 1028|1029|1030|1031|1032|1033|1034|1035
A22: 10 | B22: 活动登陆 | C22: 开服第5~8天 | D22: btn_daily | E22: =ROW()-6 -> 16 | F22: 50 | G22: 32412 | H22: 1 | I22: 180|370 | J22: "sp_activity_gold"|"sp_activity_candle" | K22: 57|415 | L22: 253|268 | M22: "sp_activity_test2" | N22: 50 | O22: 430 | P22: 200001|200002 | Q22: 活动期间，在指定日期登录即可以领取对应奖励 | R22: 6 | S22: =RC[2] -> 5 | U22: 5 | V22: 0000 | W22: 8 | X22: 2359 | Y22: =RC[-2] -> 8 | Z22: 2359 | AA22: 11049|11050|11051|11052
A23: 7 | B23: 组队挑战 | C23: 开服第5~8天 | D23: btn_daily | E23: =ROW()-6 -> 17 | F23: 70 | G23: 31403 | H23: 1 | I23: 270|400 | J23: "sp_activity_gold"|"sp_activity_candle" | K23: 57|415 | L23: 253|268 | M23: "sp_activity_test11" | N23: 50 | O23: 430 | P23: 200001|200002 | Q23: 活动期间,完成指定任务可以领取对应奖励 | R23: 6 | S23: =RC[2] -> 5 | U23: 5 | V23: 0000 | W23: 8 | X23: 2359 | Y23: =RC[-2] -> 8 | Z23: 2359 | AA23: 12008|12009|12010|12011|12012|12013|12014
A24: 15 | B24: 英雄培养 | C24: 开服第5~8天 | D24: btn_daily | E24: =ROW()-6 -> 18 | F24: 80 | G24: 31403 | H24: 1 | I24: 270|400 | J24: "sp_activity_gold"|"sp_activity_candle" | K24: 57|415 | L24: 253|268 | M24: "sp_activity_test11" | N24: 50 | O24: 430 | P24: 200001|200002 | Q24: 活动期间，培养英雄次数达到指定目标以领取对应奖励 | R24: 6 | S24: =RC[2] -> 5 | U24: 5 | V24: 0000 | W24: 8 | X24: 2359 | Y24: =RC[-2] -> 8 | Z24: 2359 | AA24: 33037|33038|33039|33040|33041|33042|33043|33044|33045|33046
A25: 6 | B25: 折扣商铺 | C25: 开服第5~6天 | D25: btn_store | E25: =ROW()-6 -> 19 | F25: 70 | G25: 30438 | H25: 1 | I25: 200|350 | J25: "sp_activity_gold"|"sp_activity_candle" | K25: 57|415 | L25: 253|268 | M25: "sp_activity_test9" | N25: 50 | O25: 430 | P25: 200001|200002 | Q25: 活动期间，各类商品折扣出售 | R25: 6 | S25: =RC[2] -> 5 | U25: 5 | V25: 0000 | W25: 6 | X25: 2359 | Y25: =RC[-2] -> 6 | Z25: 2359 | AA25: 3019|3020|3021|3022|3023|3024|3025|3026|3027|3028
A26: 6 | B26: 折扣商铺 | C26: 开服第7~8天 | D26: btn_store | E26: =ROW()-6 -> 20 | F26: 70 | G26: 30438 | H26: 1 | I26: 200|350 | J26: "sp_activity_gold"|"sp_activity_candle" | K26: 57|415 | L26: 253|268 | M26: "sp_activity_test9" | N26: 50 | O26: 430 | P26: 200001|200002 | Q26: 活动期间，各类商品折扣出售 | R26: 6 | S26: =RC[2] -> 7 | U26: 7 | V26: 0000 | W26: 8 | X26: 2359 | Y26: =RC[-2] -> 8 | Z26: 2359 | AA26: 3029|3030|3031|3032|3033|3034
A27: 10 | B27: 登陆奖励 | C27: 开服9~12天 | D27: btn_cumulative_recharge | E27: =ROW()-6 -> 21 | F27: 40 | G27: 31440 | H27: 1 | I27: 200|390 | J27: "sp_activity_gold"|"sp_activity_candle" | K27: 57|415 | L27: 253|268 | M27: "sp_activity_test2" | N27: 50 | O27: 430 | P27: 200001|200002 | Q27: 活动期间，在指定日期登录即可以领取对应奖励！ | R27: 6 | S27: =RC[2] -> 9 | U27: 9 | V27: 0000 | W27: 12 | X27: 2359 | Y27: =RC[-2] -> 12 | Z27: 2359 | AA27: 11053|11054|11055|11056
A28: 7 | B28: 活跃狂欢 | C28: 开服9~12天 | D28: btn_daily | E28: =ROW()-6 -> 22 | F28: 70 | G28: 31403 | H28: 1 | I28: 270|400 | J28: "sp_activity_gold"|"sp_activity_candle" | K28: 57|415 | L28: 253|268 | M28: "sp_activity_test11" | N28: 50 | O28: 430 | P28: 200001|200002 | Q28: 活动期间,完成指定任务可以领取对应奖励 | R28: 6 | S28: =RC[2] -> 9 | U28: 9 | V28: 0000 | W28: 12 | X28: 2359 | Y28: =RC[-2] -> 12 | Z28: 2359 | AA28: 13062|13063|13064|13065|13066|13067|13068|13069|13070|13071|13072|13073
A29: 6 | B29: 折扣商铺 | C29: 开服9~10天 | D29: btn_store | E29: =ROW()-6 -> 23 | F29: 70 | G29: 30438 | H29: 1 | I29: 200|350 | J29: "sp_activity_gold"|"sp_activity_candle" | K29: 57|415 | L29: 253|268 | M29: "sp_activity_test9" | N29: 50 | O29: 430 | P29: 200001|200002 | Q29: 活动期间，各类商品折扣出售 | R29: 6 | S29: =RC[2] -> 9 | U29: 9 | V29: 0000 | W29: 10 | X29: 2359 | Y29: =RC[-2] -> 10 | Z29: 2359 | AA29: 3035|3036|3037|3038|3039|3040|3041|3042|3043|3044|3045|3046|3047|3048|3049
A30: 6 | B30: 折扣商铺 | C30: 开服11~12天 | D30: btn_store | E30: =ROW()-6 -> 24 | F30: 70 | G30: 30438 | H30: 1 | I30: 200|350 | J30: "sp_activity_gold"|"sp_activity_candle" | K30: 57|415 | L30: 253|268 | M30: "sp_activity_test9" | N30: 50 | O30: 430 | P30: 200001|200002 | Q30: 活动期间，各类商品折扣出售 | R30: 6 | S30: =RC[2] -> 11 | U30: 11 | V30: 0000 | W30: 12 | X30: 2359 | Y30: =RC[-2] -> 12 | Z30: 2359 | AA30: 3050|3051|3052|3053|3054|3055|3056|3057|3058|3059|3060|3061|3062|3063|3064
A31: 14 | B31: 钻石奖励 | C31: 开服9~12天 | D31: btn_daily | E31: =ROW()-6 -> 25 | F31: 80 | G31: 31403 | H31: 1 | I31: 270|400 | J31: "sp_activity_gold"|"sp_activity_candle" | K31: 57|415 | L31: 253|268 | M31: "sp_activity_test11" | N31: 50 | O31: 430 | P31: 200001|200002 | Q31: 活动期间，消耗钻石达到指定额度可以指定奖励 | R31: 6 | S31: =RC[2] -> 9 | U31: 9 | V31: 0000 | W31: 12 | X31: 2359 | Y31: =RC[-2] -> 12 | Z31: =RC[-2] -> 2359 | AA31: 32089|32090|32091|32092|32093|32094|32095|32096|32097|32098|32099|32100|32101|32102|32103|32104|32105
A32: 2 | B32: 累充豪礼 | C32: 循环周1-3 | D32: btn_diamond | E32: =ROW()-6 -> 26 | F32: 90 | G32: 32412 | H32: 1 | I32: 180|370 | J32: "sp_activity_gold"|"sp_activity_candle" | K32: 57|415 | L32: 253|268 | M32: "sp_activity_test6" | N32: 50 | O32: 430 | P32: 200001|200002 | Q32: 活动期间，累计充值金额达到指定额度可以领取对应奖励 | R32: 1 | S32: 8 | U32: 20190304 | V32: 0000 | W32: 20190306 | X32: 2359 | Y32: =RC[-2] -> 20190306 | Z32: 2359 | AA32: 2253|2254|2255|2256|2257|2258|2259|2260|2261|2262|2263
A33: 1 | B33: 单充豪礼 | C33: 循环周1-3 | D33: btn_diamond | E33: =ROW()-6 -> 27 | F33: 80 | G33: 31330 | H33: 1 | I33: 200|350 | J33: "sp_activity_gold"|"sp_activity_candle" | K33: 57|415 | L33: 253|268 | M33: "sp_activity_test1" | N33: 50 | O33: 430 | P33: 200001|200002 | Q33: 活动期间，单笔充值金额达到指定额度可以领取对应奖励 | R33: 1 | S33: 8 | U33: 20190304 | V33: 0000 | W33: 20190306 | X33: 2359 | Y33: =RC[-2] -> 20190306 | Z33: 2359 | AA33: 1068|1069|1070|1071|1072|1073|1074|1075
A34: 2 | B34: 累充豪礼 | C34: 循环周4-5 | D34: btn_diamond | E34: =ROW()-6 -> 28 | F34: 90 | G34: 32412 | H34: 1 | I34: 180|370 | J34: "sp_activity_gold"|"sp_activity_candle" | K34: 57|415 | L34: 253|268 | M34: "sp_activity_test6" | N34: 50 | O34: 430 | P34: 200001|200002 | Q34: 活动期间，累计充值金额达到指定额度可以领取对应奖励 | R34: 1 | S34: 8 | U34: 20190307 | V34: 0000 | W34: 20190308 | X34: 2359 | Y34: =RC[-2] -> 20190308 | Z34: 2359 | AA34: 2264|2265|2266|2267|2268|2269|2270|2271|2272|2273|2274
A35: 1 | B35: 单充豪礼 | C35: 循环周4-5 | D35: btn_diamond | E35: =ROW()-6 -> 29 | F35: 80 | G35: 31330 | H35: 1 | I35: 200|350 | J35: "sp_activity_gold"|"sp_activity_candle" | K35: 57|415 | L35: 253|268 | M35: "sp_activity_test1" | N35: 50 | O35: 430 | P35: 200001|200002 | Q35: 活动期间，单笔充值金额达到指定额度可以领取对应奖励 | R35: 1 | S35: 8 | U35: 20190307 | V35: 0000 | W35: 20190308 | X35: 2359 | Y35: =RC[-2] -> 20190308 | Z35: 2359 | AA35: 1076|1077|1078|1079|1080|1081|1082|1083
A36: 6 | B36: 折扣商铺 | C36: 循环周4-5 | D36: btn_store | E36: =ROW()-6 -> 30 | F36: 70 | G36: 30438 | H36: 1 | I36: 200|350 | J36: "sp_activity_gold"|"sp_activity_candle" | K36: 57|415 | L36: 253|268 | M36: "sp_activity_test9" | N36: 50 | O36: 430 | P36: 200001|200002 | Q36: 活动期间，各类商品折扣出售 | R36: 1 | S36: 13 | U36: 20190307 | V36: 0000 | W36: 20190308 | X36: 2359 | Y36: =RC[-2] -> 20190308 | Z36: 2359 | AA36: 3077|3078|3079|3080|3081|3082|3083|3084|3085|3086|3087|3088
A37: 2 | B37: 累充豪礼 | C37: 循环周6-7 | D37: btn_diamond | E37: =ROW()-6 -> 31 | F37: 90 | G37: 32412 | H37: 1 | I37: 180|370 | J37: "sp_activity_gold"|"sp_activity_candle" | K37: 57|415 | L37: 253|268 | M37: "sp_activity_test6" | N37: 50 | O37: 430 | P37: 200001|200002 | Q37: 活动期间，累计充值金额达到指定额度可以领取对应奖励 | R37: 1 | S37: 8 | U37: 20190309 | V37: 0000 | W37: 20190310 | X37: 2359 | Y37: =RC[-2] -> 20190310 | Z37: 2359 | AA37: 2264|2265|2266|2267|2268|2269|2270|2271|2272|2273|2274
A38: 1 | B38: 单充豪礼 | C38: 循环周6-7 | D38: btn_diamond | E38: =ROW()-6 -> 32 | F38: 80 | G38: 31330 | H38: 1 | I38: 200|350 | J38: "sp_activity_gold"|"sp_activity_candle" | K38: 57|415 | L38: 253|268 | M38: "sp_activity_test1" | N38: 50 | O38: 430 | P38: 200001|200002 | Q38: 活动期间，单笔充值金额达到指定额度可以领取对应奖励 | R38: 1 | S38: 8 | U38: 20190309 | V38: 0000 | W38: 20190310 | X38: 2359 | Y38: =RC[-2] -> 20190310 | Z38: 2359 | AA38: 1076|1077|1078|1079|1080|1081|1082|1083
A39: 2 | B39: 累充豪礼 | C39: 循环周1-3 | D39: btn_diamond | E39: =ROW()-6 -> 33 | F39: 90 | G39: 32412 | H39: 1 | I39: 180|370 | J39: "sp_activity_gold"|"sp_activity_candle" | K39: 57|415 | L39: 253|268 | M39: "sp_activity_test6" | N39: 50 | O39: 430 | P39: 200001|200002 | Q39: 活动期间，累计充值金额达到指定额度可以领取对应奖励 | R39: 1 | S39: 8 | U39: 20190225 | V39: 0000 | W39: 20190227 | X39: 2359 | Y39: =RC[-2] -> 20190227 | Z39: 2359 | AA39: 2297|2298|2299|2300|2301|2302|2303|2304|2305|2306|2307
A40: 1 | B40: 单充豪礼 | C40: 循环周1-3 | D40: btn_diamond | E40: =ROW()-6 -> 34 | F40: 80 | G40: 31330 | H40: 1 | I40: 200|350 | J40: "sp_activity_gold"|"sp_activity_candle" | K40: 57|415 | L40: 253|268 | M40: "sp_activity_test1" | N40: 50 | O40: 430 | P40: 200001|200002 | Q40: 活动期间，单笔充值金额达到指定额度可以领取对应奖励 | R40: 1 | S40: 8 | U40: 20190225 | V40: 0000 | W40: 20190227 | X40: 2359 | Y40: =RC[-2] -> 20190227 | Z40: 2359 | AA40: 1098|1099|1100|1101|1102|1103|1104|1105
A41: 2 | B41: 累充豪礼 | C41: 循环周4-5 | D41: btn_diamond | E41: =ROW()-6 -> 35 | F41: 90 | G41: 32412 | H41: 1 | I41: 180|370 | J41: "sp_activity_gold"|"sp_activity_candle" | K41: 57|415 | L41: 253|268 | M41: "sp_activity_test6" | N41: 50 | O41: 430 | P41: 200001|200002 | Q41: 活动期间，累计充值金额达到指定额度可以领取对应奖励 | R41: 1 | S41: 8 | U41: 20190228 | V41: 0000 | W41: 20190301 | X41: 2359 | Y41: =RC[-2] -> 20190301 | Z41: 2359 | AA41: 2308|2309|2310|2311|2312|2313|2314|2315|2316|2317|2318
A42: 1 | B42: 单充豪礼 | C42: 循环周4-5 | D42: btn_diamond | E42: =ROW()-6 -> 36 | F42: 80 | G42: 31330 | H42: 1 | I42: 200|350 | J42: "sp_activity_gold"|"sp_activity_candle" | K42: 57|415 | L42: 253|268 | M42: "sp_activity_test1" | N42: 50 | O42: 430 | P42: 200001|200002 | Q42: 活动期间，单笔充值金额达到指定额度可以领取对应奖励 | R42: 1 | S42: 8 | U42: 20190228 | V42: 0000 | W42: 20190301 | X42: 2359 | Y42: =RC[-2] -> 20190301 | Z42: 2359 | AA42: 1106|1107|1108|1109|1110|1111|1112|1113
A43: 6 | B43: 折扣商铺 | C43: 循环周4-5 | D43: btn_store | E43: =ROW()-6 -> 37 | F43: 70 | G43: 30438 | H43: 1 | I43: 200|350 | J43: "sp_activity_gold"|"sp_activity_candle" | K43: 57|415 | L43: 253|268 | M43: "sp_activity_test9" | N43: 50 | O43: 430 | P43: 200001|200002 | Q43: 活动期间，各类商品折扣出售 | R43: 1 | S43: 13 | U43: 20190228 | V43: 0000 | W43: 20190301 | X43: 2359 | Y43: =RC[-2] -> 20190301 | Z43: 2359 | AA43: 3089|3090|3091|3092|3093|3094|3095|3096|3097|3098|3099|3100
A44: 2 | B44: 累充豪礼 | C44: 循环周6-7 | D44: btn_diamond | E44: =ROW()-6 -> 38 | F44: 90 | G44: 32412 | H44: 1 | I44: 180|370 | J44: "sp_activity_gold"|"sp_activity_candle" | K44: 57|415 | L44: 253|268 | M44: "sp_activity_test6" | N44: 50 | O44: 430 | P44: 200001|200002 | Q44: 活动期间，累计充值金额达到指定额度可以领取对应奖励 | R44: 1 | S44: 8 | U44: 20190302 | V44: 0000 | W44: 20190303 | X44: 2359 | Y44: =RC[-2] -> 20190303 | Z44: 2359 | AA44: 2308|2309|2310|2311|2312|2313|2314|2315|2316|2317|2318
A45: 1 | B45: 单充豪礼 | C45: 循环周6-7 | D45: btn_diamond | E45: =ROW()-6 -> 39 | F45: 80 | G45: 31330 | H45: 1 | I45: 200|350 | J45: "sp_activity_gold"|"sp_activity_candle" | K45: 57|415 | L45: 253|268 | M45: "sp_activity_test1" | N45: 50 | O45: 430 | P45: 200001|200002 | Q45: 活动期间，单笔充值金额达到指定额度可以领取对应奖励 | R45: 1 | S45: 8 | U45: 20190302 | V45: 0000 | W45: 20190303 | X45: 2359 | Y45: =RC[-2] -> 20190303 | Z45: 2359 | AA45: 1106|1107|1108|1109|1110|1111|1112|1113
A46: 2 | B46: 累充豪礼 | C46: 循环周1-3 | D46: btn_diamond | E46: =ROW()-6 -> 40 | F46: 90 | G46: 32412 | H46: 1 | I46: 180|370 | J46: "sp_activity_gold"|"sp_activity_candle" | K46: 57|415 | L46: 253|268 | M46: "sp_activity_test6" | N46: 50 | O46: 430 | P46: 200001|200002 | Q46: 活动期间，累计充值金额达到指定额度可以领取对应奖励 | R46: 1 | S46: 8 | U46: 20190211 | V46: 0000 | W46: 20190213 | X46: 2359 | Y46: =RC[-2] -> 20190213 | Z46: 2359 | AA46: 2319|2320|2321|2322|2323|2324|2325|2326|2327|2328|2329
A47: 1 | B47: 单充豪礼 | C47: 循环周1-3 | D47: btn_diamond | E47: =ROW()-6 -> 41 | F47: 80 | G47: 31330 | H47: 1 | I47: 200|350 | J47: "sp_activity_gold"|"sp_activity_candle" | K47: 57|415 | L47: 253|268 | M47: "sp_activity_test1" | N47: 50 | O47: 430 | P47: 200001|200002 | Q47: 活动期间，单笔充值金额达到指定额度可以领取对应奖励 | R47: 1 | S47: 8 | U47: 20190211 | V47: 0000 | W47: 20190213 | X47: 2359 | Y47: =RC[-2] -> 20190213 | Z47: 2359 | AA47: 1114|1115|1116|1117|1118|1119|1120|1121
A48: 2 | B48: 累充豪礼 | C48: 循环周4-5 | D48: btn_diamond | E48: =ROW()-6 -> 42 | F48: 90 | G48: 32412 | H48: 1 | I48: 180|370 | J48: "sp_activity_gold"|"sp_activity_candle" | K48: 57|415 | L48: 253|268 | M48: "sp_activity_test6" | N48: 50 | O48: 430 | P48: 200001|200002 | Q48: 活动期间，累计充值金额达到指定额度可以领取对应奖励 | R48: 1 | S48: 8 | U48: 20190214 | V48: 0000 | W48: 20190215 | X48: 2359 | Y48: =RC[-2] -> 20190215 | Z48: 2359 | AA48: 2330|2331|2332|2333|2334|2335|2336|2337|2338|2339|2340
A49: 1 | B49: 单充豪礼 | C49: 循环周4-5 | D49: btn_diamond | E49: =ROW()-6 -> 43 | F49: 80 | G49: 31330 | H49: 1 | I49: 200|350 | J49: "sp_activity_gold"|"sp_activity_candle" | K49: 57|415 | L49: 253|268 | M49: "sp_activity_test1" | N49: 50 | O49: 430 | P49: 200001|200002 | Q49: 活动期间，单笔充值金额达到指定额度可以领取对应奖励 | R49: 1 | S49: 8 | U49: 20190214 | V49: 0000 | W49: 20190215 | X49: 2359 | Y49: =RC[-2] -> 20190215 | Z49: 2359 | AA49: 1122|1123|1124|1125|1126|1127|1128|1129
A50: 6 | B50: 折扣商铺 | C50: 循环周4-5 | D50: btn_store | E50: =ROW()-6 -> 44 | F50: 70 | G50: 30438 | H50: 1 | I50: 200|350 | J50: "sp_activity_gold"|"sp_activity_candle" | K50: 57|415 | L50: 253|268 | M50: "sp_activity_test9" | N50: 50 | O50: 430 | P50: 200001|200002 | Q50: 活动期间，各类商品折扣出售 | R50: 1 | S50: 13 | U50: 20190214 | V50: 0000 | W50: 20190215 | X50: 2359 | Y50: =RC[-2] -> 20190215 | Z50: 2359 | AA50: 3077|3078|3079|3080|3081|3082|3083|3084|3085|3086|3087|3088
A51: 2 | B51: 累充豪礼 | C51: 循环周6-7 | D51: btn_diamond | E51: =ROW()-6 -> 45 | F51: 90 | G51: 32412 | H51: 1 | I51: 180|370 | J51: "sp_activity_gold"|"sp_activity_candle" | K51: 57|415 | L51: 253|268 | M51: "sp_activity_test6" | N51: 50 | O51: 430 | P51: 200001|200002 | Q51: 活动期间，累计充值金额达到指定额度可以领取对应奖励 | R51: 1 | S51: 8 | U51: 20190216 | V51: 0000 | W51: 20190217 | X51: 2359 | Y51: =RC[-2] -> 20190217 | Z51: 2359 | AA51: 2330|2331|2332|2333|2334|2335|2336|2337|2338|2339|2340
A52: 1 | B52: 单充豪礼 | C52: 循环周6-7 | D52: btn_diamond | E52: =ROW()-6 -> 46 | F52: 80 | G52: 31330 | H52: 1 | I52: 200|350 | J52: "sp_activity_gold"|"sp_activity_candle" | K52: 57|415 | L52: 253|268 | M52: "sp_activity_test1" | N52: 50 | O52: 430 | P52: 200001|200002 | Q52: 活动期间，单笔充值金额达到指定额度可以领取对应奖励 | R52: 1 | S52: 8 | U52: 20190216 | V52: 0000 | W52: 20190217 | X52: 2359 | Y52: =RC[-2] -> 20190217 | Z52: 2359 | AA52: 1122|1123|1124|1125|1126|1127|1128|1129
A53: 7 | B53: 活跃狂欢 | C53: 循环周1-3 | D53: btn_daily | E53: =ROW()-6 -> 47 | F53: 70 | G53: 31403 | H53: 1 | I53: 270|400 | J53: "sp_activity_gold"|"sp_activity_candle" | K53: 57|415 | L53: 253|268 | M53: "sp_activity_test11" | N53: 50 | O53: 430 | P53: 200001|200002 | Q53: 活动期间,完成指定任务可以领取对应奖励 | R53: 3 | S53: 13 | U53: 1 | V53: 0000 | W53: 3 | X53: 2359 | Y53: =RC[-2] -> 3 | Z53: 2359 | AA53: 19000|20000|19001|19002|19003|19004|19005|19006|19007|19008|19009|19010|20001|20002|20003|20004|20005|20006|20007|20008|20009|20010
A54: 7 | B54: 活跃狂欢 | C54: 循环周4-5 | D54: btn_daily | E54: =ROW()-6 -> 48 | F54: 70 | G54: 31403 | H54: 1 | I54: 270|400 | J54: "sp_activity_gold"|"sp_activity_candle" | K54: 57|415 | L54: 253|268 | M54: "sp_activity_test11" | N54: 50 | O54: 430 | P54: 200001|200002 | Q54: 活动期间,完成指定任务可以领取对应奖励 | R54: 3 | S54: 13 | U54: 4 | V54: 0000 | W54: 5 | X54: 2359 | Y54: =RC[-2] -> 5 | Z54: 2359 | AA54: 16024|8061|16025|16026|16027|16028|16029|8062|8063|8064|8065|8066
A55: 7 | B55: 活跃狂欢 | C55: 循环周6-7 | D55: btn_daily | E55: =ROW()-6 -> 49 | F55: 70 | G55: 31403 | H55: 1 | I55: 270|400 | J55: "sp_activity_gold"|"sp_activity_candle" | K55: 57|415 | L55: 253|268 | M55: "sp_activity_test11" | N55: 50 | O55: 430 | P55: 200001|200002 | Q55: 活动期间,完成指定任务可以领取对应奖励 | R55: 3 | S55: 13 | U55: 6 | V55: 0000 | W55: 7 | X55: 2359 | Y55: =RC[-2] -> 7 | Z55: 2359 | AA55: 33031|13074|33032|33033|33034|33035|33036|13075|13076|13077|13078|13079
A56: 14 | B56: 钻石奖励 | C56: 循环周1-7 | D56: btn_daily | E56: =ROW()-6 -> 50 | F56: 70 | G56: 31403 | H56: 1 | I56: 270|400 | J56: "sp_activity_gold"|"sp_activity_candle" | K56: 57|415 | L56: 253|268 | M56: "sp_activity_test11" | N56: 50 | O56: 430 | P56: 200001|200002 | Q56: 活动期间，消耗钻石达到指定额度可以指定奖励 | R56: 1 | S56: 13 | U56: 20190304 | V56: 0000 | W56: 20190307 | X56: 2359 | Y56: =RC[-2] -> 20190307 | Z56: 2359 | AA56: 32106|32107|32108|32109|32110|32111|32112|32113|32114|32115|32116|32117|32118|32119|32120|32121|32122
A57: 14 | B57: 钻石奖励 | C57: 循环周1-7 | D57: btn_daily | E57: =ROW()-6 -> 51 | F57: 70 | G57: 31403 | H57: 1 | I57: 270|400 | J57: "sp_activity_gold"|"sp_activity_candle" | K57: 57|415 | L57: 253|268 | M57: "sp_activity_test11" | N57: 50 | O57: 430 | P57: 200001|200002 | Q57: 活动期间，消耗钻石达到指定额度可以指定奖励 | R57: 1 | S57: 13 | U57: 20190308 | V57: 0000 | W57: 20190310 | X57: 2359 | Y57: =RC[-2] -> 20190310 | Z57: 2359 | AA57: 32140|32141|32142|32143|32144|32145|32146|32147|32148|32149|32150|32151|32152|32153|32154|32155|32156
A58: 14 | B58: 钻石奖励 | C58: 循环周1-7 | D58: btn_daily | E58: =ROW()-6 -> 52 | F58: 70 | G58: 31403 | H58: 1 | I58: 270|400 | J58: "sp_activity_gold"|"sp_activity_candle" | K58: 57|415 | L58: 253|268 | M58: "sp_activity_test11" | N58: 50 | O58: 430 | P58: 200001|200002 | Q58: 活动期间，消耗钻石达到指定额度可以指定奖励 | R58: 1 | S58: 13 | U58: 20190225 | V58: 0000 | W58: 20190303 | X58: 2359 | Y58: =RC[-2] -> 20190303 | Z58: 2359 | AA58: 32123|32124|32125|32126|32127|32128|32129|32130|32131|32132|32133|32134|32135|32136|32137|32138|32139
A59: 14 | B59: 钻石奖励 | C59: 循环周1-7 | D59: btn_daily | E59: =ROW()-6 -> 53 | F59: 70 | G59: 31403 | H59: 1 | I59: 270|400 | J59: "sp_activity_gold"|"sp_activity_candle" | K59: 57|415 | L59: 253|268 | M59: "sp_activity_test11" | N59: 50 | O59: 430 | P59: 200001|200002 | Q59: 活动期间，消耗钻石达到指定额度可以指定奖励 | R59: 1 | S59: 13 | U59: 20190211 | V59: 0000 | W59: 20190217 | X59: 2359 | Y59: =RC[-2] -> 20190217 | Z59: 2359 | AA59: 32123|32124|32125|32126|32127|32128|32129|32130|32131|32132|32133|32134|32135|32136|32137|32138|32139
A60: 9 | B60: 2019 | C60: 2019活动 | D60: btn_2019 | E60: =ROW()-6 -> 54 | F60: 97 | G60: 31440 | H60: 1 | I60: 200|390 | J60: "sp_activity_gold"|"sp_activity_candle" | K60: 57|415 | L60: 253|268 | M60: "sp_activity_test2" | N60: 50 | O60: 430 | P60: 200001|200002 | Q60: 活动期间，在指定日期登录即可以领取对应奖励 | R60: 1 | S60: 1 | U60: 20190101 | V60: 0000 | W60: 20190105 | X60: 2359 | Y60: =RC[-2] -> 20190105 | Z60: 2359 | AA60: 5027|5028|5029|5030|5031
A61: 17 | B61: 鞭炮特卖 | C61: 圣诞活动 | D61: btn_newyear | E61: =ROW()-6 -> 55 | F61: 99 | G61: 31330 | H61: 1 | I61: 200|350 | J61: "sp_activity_gold"|"sp_activity_candle" | K61: 57|415 | L61: 253|268 | M61: "sp_activity_test1" | N61: 50 | O61: 430 | P61: 200001|200002 | Q61: 活动期间，单笔充值金额达到指定额度可以领取对应奖励 | R61: 1 | S61: 1 | U61: 20190204 | V61: 0000 | W61: 20190210 | X61: 2359 | Y61: =RC[-2] -> 20190210 | Z61: 2359 | AA61: 1084|1085|1086|1087|1088|1089|1090|1091|1092|1093|1094|1095|1096|1097
A62: 9 | B62: 喜迎新春 | C62: 喜迎新春 | D62: btn_newyear | E62: =ROW()-6 -> 56 | F62: 97 | G62: 31440 | H62: 1 | I62: 200|390 | J62: "sp_activity_gold"|"sp_activity_candle" | K62: 57|415 | L62: 253|268 | M62: "sp_activity_test2" | N62: 50 | O62: 430 | P62: 200001|200002 | Q62: 活动期间，在指定日期登录即可以领取对应奖励 | R62: 1 | S62: 1 | U62: 20190204 | V62: 0000 | W62: 20190210 | X62: 2359 | Y62: =RC[-2] -> 20190210 | Z62: 2359 | AA62: 5020|5021|5022|5023|5024|5025|5026
A63: 16 | B63: 春节大冒险 | C63: 圣诞活动 | D63: btn_newyear | E63: =ROW()-6 -> 57 | F63: 98 | G63: 31403 | H63: 1 | I63: 270|400 | J63: "sp_activity_gold"|"sp_activity_candle" | K63: 57|415 | L63: 253|268 | M63: "sp_activity_test11" | N63: 50 | O63: 430 | P63: 200001|200002 | Q63: 活动期间，完成指定任务可领取对应奖励 | R63: 1 | S63: 1 | U63: 20190204 | V63: 0000 | W63: 20190210 | X63: 2359 | Y63: =RC[-2] -> 20190210 | Z63: 2359 | AA63: 6059|7049|8067|15018|14009|17008|13080|16030|12015|6060|6061|6062|6063|6064|6065|6066|6067|7050|7051|7052|7053|7054|7055|7056|7057|8068|8069|8070|8071|8072|8073|8074|8075|13081|13082|13083|13084|13085|13086|13087|13088

Sheet: 10.节日活动参数
A1: id|id | B1: logic_type|logic_type | C1: showplan|is_stage_target | D1: is_need_take|is_need_take | E1: desc| | F1: x|x | G1: y|y | H1: reward_times|reward_times | I1: showittem| | J1: is_daily_reset|is_daily_reset | K1: reward_item_id_list|reward_item_id_list | L1: reward_item_num_list|reward_item_num_list | M1: discount|
A2: 不可空 | B2: 不可空 | C2: 不可空 | D2: 不可空 | E2: 可空#不需字段 | F2: 不可空 | G2: 可空#不需字段 | H2: 不可空 | I2: 不可空 | J2: 不可空 | K2: 可空#不需字段 | L2: 可空#不需字段 | M2: 可空#不需字段 | O2: 充值id | P2: 商品名
A3: 数字 | B3: 数字 | C3: 数字 | D3: 数字 | E3: 字符串 | F3: 数字 | G3: 数字 | H3: 数字 | I3: 数字 | J3: 数字 | K3: 一维数组 | L3: 一维数组 | M3: 数字 | O3: 2001 | P3: 40钻
K4: 不定长 | L4: 不定长 | O4: 2002 | P4: 80钻
O5: 2003 | P5: 120钻
A6: 目标ID | B6: 逻辑类型 | C6: 是否显示进度(是否阶段目标) | D6: 是否需要领取的目标 | E6: 描述 | F6: 上下文值x | G6: 上下文值y | H6: 奖励次数 | I6: 是否显示次数 | J6: 是否每日重置 | K6: 奖励的物品ID列表 | L6: 奖励的物品数量列表 | M6: 折扣标识 | O6: 2004 | P6: 200钻
A7: 1001 | B7: =INT(RC[-1]/1000) -> 1 | C7: 0 | D7: 1 | E7: ="活动期间单笔充值"&VLOOKUP(RC[1],R2C15:R16C16,2,FALSE) -> 活动期间单笔充值120钻 | F7: 2003 | H7: 2 | I7: 1 | J7: 0 | K7: 10014|19103 | L7: 128|88 | N7: 单笔充值x=充值ID | O7: 2005 | P7: 400钻
A8: 1002 | B8: =INT(RC[-1]/1000) -> 1 | C8: 0 | D8: 1 | E8: ="活动期间单笔充值"&VLOOKUP(RC[1],R2C15:R11C16,2,FALSE) -> 活动期间单笔充值400钻 | F8: 2005 | H8: 2 | I8: 1 | J8: 0 | K8: 10004|19103 | L8: 488|188 | O8: 2006 | P8: 800钻
A9: 1003 | B9: =INT(RC[-1]/1000) -> 1 | C9: 0 | D9: 1 | E9: ="活动期间单笔充值"&VLOOKUP(RC[1],R2C15:R11C16,2,FALSE) -> 活动期间单笔充值800钻 | F9: 2006 | H9: 2 | I9: 1 | J9: 0 | K9: 13324|13646|19103 | L9: 2|50|298 | O9: 2007 | P9: 1200钻
A10: 1004 | B10: =INT(RC[-1]/1000) -> 1 | C10: 0 | D10: 1 | E10: ="活动期间单笔充值"&VLOOKUP(RC[1],R2C15:R11C16,2,FALSE) -> 活动期间单笔充值2000钻 | F10: 2008 | H10: 1 | I10: 1 | J10: 0 | K10: 10008|19103 | L10: 3888|598 | O10: 2008 | P10: 2000钻
A11: 1006 | B11: =INT(RC[-1]/1000) -> 1 | C11: 0 | D11: 1 | E11: ="活动期间单笔充值"&VLOOKUP(RC[1],R2C15:R11C16,2,FALSE) -> 活动期间单笔充值40钻 | F11: 2001 | H11: 1 | I11: 1 | J11: 0 | K11: 19005 | L11: 300 | O11: 2009 | P11: 4000钻
A12: 1007 | B12: =INT(RC[-1]/1000) -> 1 | C12: 0 | D12: 1 | E12: =IF(RC[5]=1,"(每日重置)：",)&"活动期间单笔充值"&VLOOKUP(RC[1],R2C15:R11C16,2,FALSE) -> 活动期间单笔充值80钻 | F12: 2002 | H12: 1 | I12: 1 | J12: 0 | K12: 10000|10001|13320 | L12: 10|10|5 | O12: 2010 | P12: 8000钻
A13: 1008 | B13: =INT(RC[-1]/1000) -> 1 | C13: 0 | D13: 1 | E13: =IF(RC[5]=1,"(每日重置)：",)&"活动期间单笔充值"&VLOOKUP(RC[1],R2C15:R11C16,2,FALSE) -> 活动期间单笔充值120钻 | F13: 2003 | H13: 1 | I13: 1 | J13: 0 | K13: 13016|13015|10000 | L13: 20|60|20 | O13: 2011 | P13: 20000钻
A14: 1009 | B14: =INT(RC[-1]/1000) -> 1 | C14: 0 | D14: 1 | E14: =IF(RC[5]=1,"(每日重置)：",)&"活动期间单笔充值"&VLOOKUP(RC[1],R2C15:R11C16,2,FALSE) -> 活动期间单笔充值200钻 | F14: 2004 | H14: 1 | I14: 1 | J14: 0 | K14: 13016|10008|19017 | L14: 30|500|888 | O14: 2012 | P14: 40000钻
A15: 1010 | B15: =INT(RC[-1]/1000) -> 1 | C15: 0 | D15: 1 | E15: =IF(RC[5]=1,"(每日重置)：",)&"活动期间单笔充值"&VLOOKUP(RC[1],R2C15:R11C16,2,FALSE) -> 活动期间单笔充值400钻 | F15: 2005 | H15: 1 | I15: 1 | J15: 0 | K15: 13016|10008|19017 | L15: 50|1000|1888 | O15: 2013 | P15: 80000钻
A16: 1011 | B16: =INT(RC[-1]/1000) -> 1 | C16: 0 | D16: 1 | E16: =IF(RC[5]=1,"(每日重置)：",)&"活动期间单笔充值"&VLOOKUP(RC[1],R2C15:R11C16,2,FALSE) -> 活动期间单笔充值800钻 | F16: 2006 | H16: 1 | I16: 1 | J16: 0 | K16: 13017|13016|10008 | L16: 10|50|2000 | O16: 2014 | P16: 200000钻
A17: 1012 | B17: =INT(RC[-1]/1000) -> 1 | C17: 0 | D17: 1 | E17: =IF(RC[5]=1,"(每日重置)：",)&"活动期间单笔充值"&VLOOKUP(RC[1],R2C15:R16C16,2,FALSE) -> (每日重置)：活动期间单笔充值80钻 | F17: 2002 | H17: 1 | I17: 1 | J17: 1 | K17: 10000|10001|19103 | L17: 2|2|10
A18: 1013 | B18: =INT(RC[-1]/1000) -> 1 | C18: 0 | D18: 1 | E18: =IF(RC[5]=1,"(每日重置)：",)&"活动期间单笔充值"&VLOOKUP(RC[1],R2C15:R16C16,2,FALSE) -> (每日重置)：活动期间单笔充值200钻 | F18: 2004 | H18: 1 | I18: 1 | J18: 1 | K18: 10000|10002|19103 | L18: 2|100|10
A19: 1014 | B19: =INT(RC[-1]/1000) -> 1 | C19: 0 | D19: 1 | E19: =IF(RC[5]=1,"(每日重置)：",)&"活动期间单笔充值"&VLOOKUP(RC[1],R2C15:R16C16,2,FALSE) -> (每日重置)：活动期间单笔充值400钻 | F19: 2005 | H19: 1 | I19: 1 | J19: 1 | K19: 10014|15001|10021|19103 | L19: 50|5|5|20
A20: 1015 | B20: =INT(RC[-1]/1000) -> 1 | C20: 0 | D20: 1 | E20: =IF(RC[5]=1,"(每日重置)：",)&"活动期间单笔充值"&VLOOKUP(RC[1],R2C15:R16C16,2,FALSE) -> (每日重置)：活动期间单笔充值800钻 | F20: 2006 | H20: 1 | I20: 1 | J20: 1 | K20: 10010|10014|10003|19103 | L20: 100|60|100|50
A21: 1016 | B21: =INT(RC[-1]/1000) -> 1 | C21: 0 | D21: 1 | E21: =IF(RC[5]=1,"(每日重置)：",)&"活动期间单笔充值"&VLOOKUP(RC[1],R2C15:R16C16,2,FALSE) -> (每日重置)：活动期间单笔充值2000钻 | F21: 2008 | H21: 1 | I21: 1 | J21: 1 | K21: 13324|10022|10003|19103 | L21: 1|60|200|40
A22: 1017 | B22: =INT(RC[-1]/1000) -> 1 | C22: 0 | D22: 1 | E22: =IF(RC[5]=1,"(每日重置)：",)&"活动期间单笔充值"&VLOOKUP(RC[1],R2C15:R16C16,2,FALSE) -> (每日重置)：活动期间单笔充值4000钻 | F22: 2009 | H22: 1 | I22: 1 | J22: 1 | K22: 13401|10003|10004|19103 | L22: 30|1888|200|100
A23: 1018 | B23: =INT(RC[-1]/1000) -> 1 | C23: 0 | D23: 1 | E23: =IF(RC[5]=1,"(每日重置)：",)&"活动期间单笔充值"&VLOOKUP(RC[1],R2C15:R16C16,2,FALSE) -> (每日重置)：活动期间单笔充值8000钻 | F23: 2010 | H23: 1 | I23: 1 | J23: 1 | K23: 13401|10004|42301|19103 | L23: 60|500|15|150
A24: 1019 | B24: =INT(RC[-1]/1000) -> 1 | C24: 0 | D24: 1 | E24: =IF(RC[5]=1,"(每日重置)：",)&"活动期间单笔充值"&VLOOKUP(RC[1],R2C15:R16C16,2,FALSE) -> (每日重置)：活动期间单笔充值20000钻 | F24: 2011 | H24: 1 | I24: 1 | J24: 1 | K24: 13401|13397|10022|19103 | L24: 120|3|300|500
A25: 1020 | B25: =INT(RC[-1]/1000) -> 1 | C25: 0 | D25: 1 | E25: =IF(RC[5]=1,"(每日重置)：",)&"活动期间单笔充值"&VLOOKUP(RC[1],R2C15:R16C16,2,FALSE) -> (每日重置)：活动期间单笔充值80钻 | F25: 2002 | H25: 1 | I25: 1 | J25: 1 | K25: 10000|10101|19103 | L25: 2|1|10
A26: 1021 | B26: =INT(RC[-1]/1000) -> 1 | C26: 0 | D26: 1 | E26: =IF(RC[5]=1,"(每日重置)：",)&"活动期间单笔充值"&VLOOKUP(RC[1],R2C15:R16C16,2,FALSE) -> (每日重置)：活动期间单笔充值200钻 | F26: 2004 | H26: 1 | I26: 1 | J26: 1 | K26: 10000|42301|19103 | L26: 2|4|20
A27: 1022 | B27: =INT(RC[-1]/1000) -> 1 | C27: 0 | D27: 1 | E27: =IF(RC[5]=1,"(每日重置)：",)&"活动期间单笔充值"&VLOOKUP(RC[1],R2C15:R16C16,2,FALSE) -> (每日重置)：活动期间单笔充值400钻 | F27: 2005 | H27: 1 | I27: 1 | J27: 1 | K27: 12532|10003|10008|13016 | L27: 40|100|200|15
A28: 1023 | B28: =INT(RC[-1]/1000) -> 1 | C28: 0 | D28: 1 | E28: =IF(RC[5]=1,"(每日重置)：",)&"活动期间单笔充值"&VLOOKUP(RC[1],R2C15:R16C16,2,FALSE) -> (每日重置)：活动期间单笔充值800钻 | F28: 2006 | H28: 1 | I28: 1 | J28: 1 | K28: 13016|10010|10014|19103 | L28: 25|400|100|100
A29: 1024 | B29: =INT(RC[-1]/1000) -> 1 | C29: 0 | D29: 1 | E29: =IF(RC[5]=1,"(每日重置)：",)&"活动期间单笔充值"&VLOOKUP(RC[1],R2C15:R16C16,2,FALSE) -> (每日重置)：活动期间单笔充值2000钻 | F29: 2008 | H29: 1 | I29: 1 | J29: 1 | K29: 13017|80100|10100|10004 | L29: 30|1|3|150
A30: 1025 | B30: =INT(RC[-1]/1000) -> 1 | C30: 0 | D30: 1 | E30: =IF(RC[5]=1,"(每日重置)：",)&"活动期间单笔充值"&VLOOKUP(RC[1],R2C15:R16C16,2,FALSE) -> (每日重置)：活动期间单笔充值4000钻 | F30: 2009 | H30: 1 | I30: 1 | J30: 1 | K30: 13402|13646|13324|19103 | L30: 30|60|2|150
A31: 1026 | B31: =INT(RC[-1]/1000) -> 1 | C31: 0 | D31: 1 | E31: =IF(RC[5]=1,"(每日重置)：",)&"活动期间单笔充值"&VLOOKUP(RC[1],R2C15:R16C16,2,FALSE) -> (每日重置)：活动期间单笔充值8000钻 | F31: 2010 | H31: 1 | I31: 1 | J31: 1 | K31: 13402|80101|10100|13646 | L31: 60|1|10|80
A32: 1027 | B32: =INT(RC[-1]/1000) -> 1 | C32: 0 | D32: 1 | E32: =IF(RC[5]=1,"(每日重置)：",)&"活动期间单笔充值"&VLOOKUP(RC[1],R2C15:R16C16,2,FALSE) -> (每日重置)：活动期间单笔充值20000钻 | F32: 2011 | H32: 1 | I32: 1 | J32: 1 | K32: 13402|13392|10004|13646 | L32: 120|2|800|100
A33: 1028 | B33: =INT(RC[-1]/1000) -> 1 | C33: 0 | D33: 1 | E33: =IF(RC[5]=1,"(每日重置)：",)&"活动期间单笔充值"&VLOOKUP(RC[1],R2C15:R16C16,2,FALSE) -> 活动期间单笔充值80钻 | F33: 2002 | H33: 99 | I33: 1 | J33: 0 | K33: 10108 | L33: 8
A34: 1029 | B34: =INT(RC[-1]/1000) -> 1 | C34: 0 | D34: 1 | E34: =IF(RC[5]=1,"(每日重置)：",)&"活动期间单笔充值"&VLOOKUP(RC[1],R2C15:R16C16,2,FALSE) -> 活动期间单笔充值200钻 | F34: 2004 | H34: 50 | I34: 1 | J34: 0 | K34: 10108 | L34: 20
A35: 1030 | B35: =INT(RC[-1]/1000) -> 1 | C35: 0 | D35: 1 | E35: =IF(RC[5]=1,"(每日重置)：",)&"活动期间单笔充值"&VLOOKUP(RC[1],R2C15:R16C16,2,FALSE) -> 活动期间单笔充值400钻 | F35: 2005 | H35: 50 | I35: 1 | J35: 0 | K35: 10108 | L35: 40
A36: 1031 | B36: =INT(RC[-1]/1000) -> 1 | C36: 0 | D36: 1 | E36: =IF(RC[5]=1,"(每日重置)：",)&"活动期间单笔充值"&VLOOKUP(RC[1],R2C15:R16C16,2,FALSE) -> 活动期间单笔充值800钻 | F36: 2006 | H36: 50 | I36: 1 | J36: 0 | K36: 10108 | L36: 80
A37: 1032 | B37: =INT(RC[-1]/1000) -> 1 | C37: 0 | D37: 1 | E37: =IF(RC[5]=1,"(每日重置)：",)&"活动期间单笔充值"&VLOOKUP(RC[1],R2C15:R16C16,2,FALSE) -> 活动期间单笔充值2000钻 | F37: 2008 | H37: 30 | I37: 1 | J37: 0 | K37: 10108 | L37: 200
A38: 1033 | B38: =INT(RC[-1]/1000) -> 1 | C38: 0 | D38: 1 | E38: =IF(RC[5]=1,"(每日重置)：",)&"活动期间单笔充值"&VLOOKUP(RC[1],R2C15:R16C16,2,FALSE) -> 活动期间单笔充值4000钻 | F38: 2009 | H38: 30 | I38: 1 | J38: 0 | K38: 10108 | L38: 400
A39: 1034 | B39: =INT(RC[-1]/1000) -> 1 | C39: 0 | D39: 1 | E39: =IF(RC[5]=1,"(每日重置)：",)&"活动期间单笔充值"&VLOOKUP(RC[1],R2C15:R16C16,2,FALSE) -> 活动期间单笔充值8000钻 | F39: 2010 | H39: 20 | I39: 1 | J39: 0 | K39: 10108 | L39: 800
A40: 1035 | B40: =INT(RC[-1]/1000) -> 1 | C40: 0 | D40: 1 | E40: =IF(RC[5]=1,"(每日重置)：",)&"活动期间单笔充值"&VLOOKUP(RC[1],R2C15:R16C16,2,FALSE) -> 活动期间单笔充值20000钻 | F40: 2011 | H40: 20 | I40: 1 | J40: 0 | K40: 10108 | L40: 2000
A41: 1036 | B41: =INT(RC[-1]/1000) -> 1 | C41: 0 | D41: 1 | E41: =IF(RC[5]=1,"(每日重置)：",)&"活动期间单笔充值"&VLOOKUP(RC[1],R2C15:R16C16,2,FALSE) -> (每日重置)：活动期间单笔充值80钻 | F41: 2002 | H41: 2 | I41: 1 | J41: 1 | K41: 10101|19103 | L41: 1|10
A42: 1037 | B42: =INT(RC[-1]/1000) -> 1 | C42: 0 | D42: 1 | E42: =IF(RC[5]=1,"(每日重置)：",)&"活动期间单笔充值"&VLOOKUP(RC[1],R2C15:R16C16,2,FALSE) -> (每日重置)：活动期间单笔充值200钻 | F42: 2004 | H42: 1 | I42: 1 | J42: 1 | K42: 42301|19103 | L42: 4|20
A43: 1038 | B43: =INT(RC[-1]/1000) -> 1 | C43: 0 | D43: 1 | E43: =IF(RC[5]=1,"(每日重置)：",)&"活动期间单笔充值"&VLOOKUP(RC[1],R2C15:R16C16,2,FALSE) -> (每日重置)：活动期间单笔充值400钻 | F43: 2005 | H43: 1 | I43: 1 | J43: 1 | K43: 10003|10008|19103 | L43: 100|200|80
A44: 1039 | B44: =INT(RC[-1]/1000) -> 1 | C44: 0 | D44: 1 | E44: =IF(RC[5]=1,"(每日重置)：",)&"活动期间单笔充值"&VLOOKUP(RC[1],R2C15:R16C16,2,FALSE) -> (每日重置)：活动期间单笔充值800钻 | F44: 2006 | H44: 2 | I44: 1 | J44: 1 | K44: 13017|10014|19103 | L44: 15|100|100
A45: 1040 | B45: =INT(RC[-1]/1000) -> 1 | C45: 0 | D45: 1 | E45: =IF(RC[5]=1,"(每日重置)：",)&"活动期间单笔充值"&VLOOKUP(RC[1],R2C15:R16C16,2,FALSE) -> (每日重置)：活动期间单笔充值2000钻 | F45: 2008 | H45: 1 | I45: 1 | J45: 1 | K45: 80100|10100|10004 | L45: 1|3|150
A46: 1041 | B46: =INT(RC[-1]/1000) -> 1 | C46: 0 | D46: 1 | E46: =IF(RC[5]=1,"(每日重置)：",)&"活动期间单笔充值"&VLOOKUP(RC[1],R2C15:R16C16,2,FALSE) -> (每日重置)：活动期间单笔充值4000钻 | F46: 2009 | H46: 1 | I46: 1 | J46: 1 | K46: 13646|13324|19103 | L46: 60|2|150
A47: 1042 | B47: =INT(RC[-1]/1000) -> 1 | C47: 0 | D47: 1 | E47: =IF(RC[5]=1,"(每日重置)：",)&"活动期间单笔充值"&VLOOKUP(RC[1],R2C15:R16C16,2,FALSE) -> (每日重置)：活动期间单笔充值8000钻 | F47: 2010 | H47: 1 | I47: 1 | J47: 1 | K47: 80101|10100 | L47: 1|10
A48: 1043 | B48: =INT(RC[-1]/1000) -> 1 | C48: 0 | D48: 1 | E48: =IF(RC[5]=1,"(每日重置)：",)&"活动期间单笔充值"&VLOOKUP(RC[1],R2C15:R16C16,2,FALSE) -> (每日重置)：活动期间单笔充值20000钻 | F48: 2011 | H48: 1 | I48: 1 | J48: 1 | K48: 13417|13392|10004 | L48: 1|2|800
A49: 1044 | B49: =INT(RC[-1]/1000) -> 1 | C49: 0 | D49: 1 | E49: =IF(RC[5]=1,"(每日重置)：",)&"活动期间单笔充值"&VLOOKUP(RC[1],R2C15:R16C16,2,FALSE) -> (每日重置)：活动期间单笔充值80钻 | F49: 2002 | H49: 2 | I49: 1 | J49: 1 | K49: 10101|19103 | L49: 1|15
A50: 1045 | B50: =INT(RC[-1]/1000) -> 1 | C50: 0 | D50: 1 | E50: =IF(RC[5]=1,"(每日重置)：",)&"活动期间单笔充值"&VLOOKUP(RC[1],R2C15:R16C16,2,FALSE) -> (每日重置)：活动期间单笔充值200钻 | F50: 2004 | H50: 1 | I50: 1 | J50: 1 | K50: 10010|19103 | L50: 250|20
A51: 1046 | B51: =INT(RC[-1]/1000) -> 1 | C51: 0 | D51: 1 | E51: =IF(RC[5]=1,"(每日重置)：",)&"活动期间单笔充值"&VLOOKUP(RC[1],R2C15:R16C16,2,FALSE) -> (每日重置)：活动期间单笔充值400钻 | F51: 2005 | H51: 1 | I51: 1 | J51: 1 | K51: 12532|10008|19103 | L51: 40|200|80
A52: 1047 | B52: =INT(RC[-1]/1000) -> 1 | C52: 0 | D52: 1 | E52: =IF(RC[5]=1,"(每日重置)：",)&"活动期间单笔充值"&VLOOKUP(RC[1],R2C15:R16C16,2,FALSE) -> (每日重置)：活动期间单笔充值800钻 | F52: 2006 | H52: 2 | I52: 1 | J52: 1 | K52: 13017|10010|19103 | L52: 20|400|100
A53: 1048 | B53: =INT(RC[-1]/1000) -> 1 | C53: 0 | D53: 1 | E53: =IF(RC[5]=1,"(每日重置)：",)&"活动期间单笔充值"&VLOOKUP(RC[1],R2C15:R16C16,2,FALSE) -> (每日重置)：活动期间单笔充值2000钻 | F53: 2008 | H53: 1 | I53: 1 | J53: 1 | K53: 80100|10100|10004 | L53: 1|3|150
A54: 1049 | B54: =INT(RC[-1]/1000) -> 1 | C54: 0 | D54: 1 | E54: =IF(RC[5]=1,"(每日重置)：",)&"活动期间单笔充值"&VLOOKUP(RC[1],R2C15:R16C16,2,FALSE) -> (每日重置)：活动期间单笔充值4000钻 | F54: 2009 | H54: 1 | I54: 1 | J54: 1 | K54: 13646|13324|19103 | L54: 60|2|150
A55: 1050 | B55: =INT(RC[-1]/1000) -> 1 | C55: 0 | D55: 1 | E55: =IF(RC[5]=1,"(每日重置)：",)&"活动期间单笔充值"&VLOOKUP(RC[1],R2C15:R16C16,2,FALSE) -> (每日重置)：活动期间单笔充值8000钻 | F55: 2010 | H55: 1 | I55: 1 | J55: 1 | K55: 80101|10100 | L55: 1|15
A56: 1051 | B56: =INT(RC[-1]/1000) -> 1 | C56: 0 | D56: 1 | E56: =IF(RC[5]=1,"(每日重置)：",)&"活动期间单笔充值"&VLOOKUP(RC[1],R2C15:R16C16,2,FALSE) -> (每日重置)：活动期间单笔充值20000钻 | F56: 2011 | H56: 1 | I56: 1 | J56: 1 | K56: 13417|13392|10004 | L56: 1|2|1000
A57: 1052 | B57: =INT(RC[-1]/1000) -> 1 | C57: 0 | D57: 1 | E57: =IF(RC[5]=1,"(每日重置)：",)&"活动期间单笔充值"&VLOOKUP(RC[1],R2C15:R16C16,2,FALSE) -> (每日重置)：活动期间单笔充值80钻 | F57: 2002 | H57: 1 | I57: 1 | J57: 1 | K57: 10000|19017 | L57: 2|200
A58: 1053 | B58: =INT(RC[-1]/1000) -> 1 | C58: 0 | D58: 1 | E58: =IF(RC[5]=1,"(每日重置)：",)&"活动期间单笔充值"&VLOOKUP(RC[1],R2C15:R16C16,2,FALSE) -> (每日重置)：活动期间单笔充值200钻 | F58: 2004 | H58: 1 | I58: 1 | J58: 1 | K58: 42301|19103 | L58: 4|20
A59: 1054 | B59: =INT(RC[-1]/1000) -> 1 | C59: 0 | D59: 1 | E59: =IF(RC[5]=1,"(每日重置)：",)&"活动期间单笔充值"&VLOOKUP(RC[1],R2C15:R16C16,2,FALSE) -> (每日重置)：活动期间单笔充值400钻 | F59: 2005 | H59: 1 | I59: 1 | J59: 1 | K59: 10003|10008|19103 | L59: 100|200|80
A60: 1055 | B60: =INT(RC[-1]/1000) -> 1 | C60: 0 | D60: 1 | E60: =IF(RC[5]=1,"(每日重置)：",)&"活动期间单笔充值"&VLOOKUP(RC[1],R2C15:R16C16,2,FALSE) -> (每日重置)：活动期间单笔充值800钻 | F60: 2006 | H60: 2 | I60: 1 | J60: 1 | K60: 13016|10014|19103 | L60: 20|100|100
A61: 1056 | B61: =INT(RC[-1]/1000) -> 1 | C61: 0 | D61: 1 | E61: =IF(RC[5]=1,"(每日重置)：",)&"活动期间单笔充值"&VLOOKUP(RC[1],R2C15:R16C16,2,FALSE) -> (每日重置)：活动期间单笔充值2000钻 | F61: 2008 | H61: 1 | I61: 1 | J61: 1 | K61: 80100|13017|10004 | L61: 1|10|150
A62: 1057 | B62: =INT(RC[-1]/1000) -> 1 | C62: 0 | D62: 1 | E62: =IF(RC[5]=1,"(每日重置)：",)&"活动期间单笔充值"&VLOOKUP(RC[1],R2C15:R16C16,2,FALSE) -> (每日重置)：活动期间单笔充值4000钻 | F62: 2009 | H62: 1 | I62: 1 | J62: 1 | K62: 13401|13324|19103 | L62: 40|2|150
A63: 1058 | B63: =INT(RC[-1]/1000) -> 1 | C63: 0 | D63: 1 | E63: =IF(RC[5]=1,"(每日重置)：",)&"活动期间单笔充值"&VLOOKUP(RC[1],R2C15:R16C16,2,FALSE) -> (每日重置)：活动期间单笔充值8000钻 | F63: 2010 | H63: 1 | I63: 1 | J63: 1 | K63: 13401|13017|10003 | L63: 60|40|1000
A64: 1059 | B64: =INT(RC[-1]/1000) -> 1 | C64: 0 | D64: 1 | E64: =IF(RC[5]=1,"(每日重置)：",)&"活动期间单笔充值"&VLOOKUP(RC[1],R2C15:R16C16,2,FALSE) -> (每日重置)：活动期间单笔充值20000钻 | F64: 2011 | H64: 1 | I64: 1 | J64: 1 | K64: 13401|13392|10004 | L64: 120|2|1000
A65: 1060 | B65: =INT(RC[-1]/1000) -> 1 | C65: 0 | D65: 1 | E65: =IF(RC[5]=1,"(每日重置)：",)&"活动期间单笔充值"&VLOOKUP(RC[1],R2C15:R16C16,2,FALSE) -> (每日重置)：活动期间单笔充值80钻 | F65: 2002 | H65: 1 | I65: 1 | J65: 1 | K65: 10000|19017 | L65: 3|200
A66: 1061 | B66: =INT(RC[-1]/1000) -> 1 | C66: 0 | D66: 1 | E66: =IF(RC[5]=1,"(每日重置)：",)&"活动期间单笔充值"&VLOOKUP(RC[1],R2C15:R16C16,2,FALSE) -> (每日重置)：活动期间单笔充值200钻 | F66: 2004 | H66: 1 | I66: 1 | J66: 1 | K66: 10010|19103 | L66: 250|20
A67: 1062 | B67: =INT(RC[-1]/1000) -> 1 | C67: 0 | D67: 1 | E67: =IF(RC[5]=1,"(每日重置)：",)&"活动期间单笔充值"&VLOOKUP(RC[1],R2C15:R16C16,2,FALSE) -> (每日重置)：活动期间单笔充值400钻 | F67: 2005 | H67: 1 | I67: 1 | J67: 1 | K67: 12532|10008|19103 | L67: 40|200|80
A68: 1063 | B68: =INT(RC[-1]/1000) -> 1 | C68: 0 | D68: 1 | E68: =IF(RC[5]=1,"(每日重置)：",)&"活动期间单笔充值"&VLOOKUP(RC[1],R2C15:R16C16,2,FALSE) -> (每日重置)：活动期间单笔充值800钻 | F68: 2006 | H68: 2 | I68: 1 | J68: 1 | K68: 13016|10010|19103 | L68: 25|400|100
A69: 1064 | B69: =INT(RC[-1]/1000) -> 1 | C69: 0 | D69: 1 | E69: =IF(RC[5]=1,"(每日重置)：",)&"活动期间单笔充值"&VLOOKUP(RC[1],R2C15:R16C16,2,FALSE) -> (每日重置)：活动期间单笔充值2000钻 | F69: 2008 | H69: 1 | I69: 1 | J69: 1 | K69: 80100|13017|10004 | L69: 1|10|150
A70: 1065 | B70: =INT(RC[-1]/1000) -> 1 | C70: 0 | D70: 1 | E70: =IF(RC[5]=1,"(每日重置)：",)&"活动期间单笔充值"&VLOOKUP(RC[1],R2C15:R16C16,2,FALSE) -> (每日重置)：活动期间单笔充值4000钻 | F70: 2009 | H70: 1 | I70: 1 | J70: 1 | K70: 13401|13324|19103 | L70: 40|2|150
A71: 1066 | B71: =INT(RC[-1]/1000) -> 1 | C71: 0 | D71: 1 | E71: =IF(RC[5]=1,"(每日重置)：",)&"活动期间单笔充值"&VLOOKUP(RC[1],R2C15:R16C16,2,FALSE) -> (每日重置)：活动期间单笔充值8000钻 | F71: 2010 | H71: 1 | I71: 1 | J71: 1 | K71: 13401|13017|10003 | L71: 60|40|1000
A72: 1067 | B72: =INT(RC[-1]/1000) -> 1 | C72: 0 | D72: 1 | E72: =IF(RC[5]=1,"(每日重置)：",)&"活动期间单笔充值"&VLOOKUP(RC[1],R2C15:R16C16,2,FALSE) -> (每日重置)：活动期间单笔充值20000钻 | F72: 2011 | H72: 1 | I72: 1 | J72: 1 | K72: 13401|13392|10004 | L72: 120|2|1000
A73: 1068 | B73: =INT(RC[-1]/1000) -> 1 | C73: 0 | D73: 1 | E73: =IF(RC[5]=1,"(每日重置)：",)&"活动期间单笔充值"&VLOOKUP(RC[1],R2C15:R16C16,2,FALSE) -> (每日重置)：活动期间单笔充值80钻 | F73: 2002 | H73: 1 | I73: 1 | J73: 1 | K73: 16301|10000|10115|10096|10009 | L73: 5|5|5|1|5
A74: 1069 | B74: =INT(RC[-1]/1000) -> 1 | C74: 0 | D74: 1 | E74: =IF(RC[5]=1,"(每日重置)：",)&"活动期间单笔充值"&VLOOKUP(RC[1],R2C15:R16C16,2,FALSE) -> (每日重置)：活动期间单笔充值200钻 | F74: 2004 | H74: 1 | I74: 1 | J74: 1 | K74: 16301|10000|10115|10096|10009 | L74: 10|7|5|1|5
A75: 1070 | B75: =INT(RC[-1]/1000) -> 1 | C75: 0 | D75: 1 | E75: =IF(RC[5]=1,"(每日重置)：",)&"活动期间单笔充值"&VLOOKUP(RC[1],R2C15:R16C16,2,FALSE) -> (每日重置)：活动期间单笔充值400钻 | F75: 2005 | H75: 1 | I75: 1 | J75: 1 | K75: 16301|10008|10115|10096|10009 | L75: 20|700|10|2|10
A76: 1071 | B76: =INT(RC[-1]/1000) -> 1 | C76: 0 | D76: 1 | E76: =IF(RC[5]=1,"(每日重置)：",)&"活动期间单笔充值"&VLOOKUP(RC[1],R2C15:R16C16,2,FALSE) -> (每日重置)：活动期间单笔充值800钻 | F76: 2006 | H76: 1 | I76: 1 | J76: 1 | K76: 16301|80100|13016|10115|13392 | L76: 40|1|25|20|1
A77: 1072 | B77: =INT(RC[-1]/1000) -> 1 | C77: 0 | D77: 1 | E77: =IF(RC[5]=1,"(每日重置)：",)&"活动期间单笔充值"&VLOOKUP(RC[1],R2C15:R16C16,2,FALSE) -> (每日重置)：活动期间单笔充值2000钻 | F77: 2008 | H77: 1 | I77: 1 | J77: 1 | K77: 16301|80100|13017|13393|13392 | L77: 80|1|25|1|2
A78: 1073 | B78: =INT(RC[-1]/1000) -> 1 | C78: 0 | D78: 1 | E78: =IF(RC[5]=1,"(每日重置)：",)&"活动期间单笔充值"&VLOOKUP(RC[1],R2C15:R16C16,2,FALSE) -> (每日重置)：活动期间单笔充值4000钻 | F78: 2009 | H78: 1 | I78: 1 | J78: 1 | K78: 16301|13402|80120|13393|13392 | L78: 160|60|1|2|3
A79: 1074 | B79: =INT(RC[-1]/1000) -> 1 | C79: 0 | D79: 1 | E79: =IF(RC[5]=1,"(每日重置)：",)&"活动期间单笔充值"&VLOOKUP(RC[1],R2C15:R16C16,2,FALSE) -> (每日重置)：活动期间单笔充值8000钻 | F79: 2010 | H79: 1 | I79: 1 | J79: 1 | K79: 16301|13402|80120|13393|13392 | L79: 320|100|1|3|4
A80: 1075 | B80: =INT(RC[-1]/1000) -> 1 | C80: 0 | D80: 1 | E80: =IF(RC[5]=1,"(每日重置)：",)&"活动期间单笔充值"&VLOOKUP(RC[1],R2C15:R16C16,2,FALSE) -> (每日重置)：活动期间单笔充值20000钻 | F80: 2011 | H80: 1 | I80: 1 | J80: 1 | K80: 16301|13402|80120|13393|13392 | L80: 480|160|2|4|5
A81: 1076 | B81: =INT(RC[-1]/1000) -> 1 | C81: 0 | D81: 1 | E81: =IF(RC[5]=1,"(每日重置)：",)&"活动期间单笔充值"&VLOOKUP(RC[1],R2C15:R16C16,2,FALSE) -> (每日重置)：活动期间单笔充值80钻 | F81: 2002 | H81: 1 | I81: 1 | J81: 1 | K81: 16301|10003|10000|10115|13316 | L81: 5|100|5|5|1
A82: 1077 | B82: =INT(RC[-1]/1000) -> 1 | C82: 0 | D82: 1 | E82: =IF(RC[5]=1,"(每日重置)：",)&"活动期间单笔充值"&VLOOKUP(RC[1],R2C15:R16C16,2,FALSE) -> (每日重置)：活动期间单笔充值200钻 | F82: 2004 | H82: 1 | I82: 1 | J82: 1 | K82: 16301|10000|10115|10118|13316 | L82: 10|7|5|5|1
A83: 1078 | B83: =INT(RC[-1]/1000) -> 1 | C83: 0 | D83: 1 | E83: =IF(RC[5]=1,"(每日重置)：",)&"活动期间单笔充值"&VLOOKUP(RC[1],R2C15:R16C16,2,FALSE) -> (每日重置)：活动期间单笔充值400钻 | F83: 2005 | H83: 1 | I83: 1 | J83: 1 | K83: 16301|10008|10115|10118|13316 | L83: 20|700|10|5|1
A84: 1079 | B84: =INT(RC[-1]/1000) -> 1 | C84: 0 | D84: 1 | E84: =IF(RC[5]=1,"(每日重置)：",)&"活动期间单笔充值"&VLOOKUP(RC[1],R2C15:R16C16,2,FALSE) -> (每日重置)：活动期间单笔充值800钻 | F84: 2006 | H84: 2 | I84: 1 | J84: 1 | K84: 16301|13646|10115|10118|13392 | L84: 40|100|20|10|1
A85: 1080 | B85: =INT(RC[-1]/1000) -> 1 | C85: 0 | D85: 1 | E85: =IF(RC[5]=1,"(每日重置)：",)&"活动期间单笔充值"&VLOOKUP(RC[1],R2C15:R16C16,2,FALSE) -> (每日重置)：活动期间单笔充值2000钻 | F85: 2008 | H85: 1 | I85: 1 | J85: 1 | K85: 16301|13646|10118|13599|13392 | L85: 80|200|20|30|2
A86: 1081 | B86: =INT(RC[-1]/1000) -> 1 | C86: 0 | D86: 1 | E86: =IF(RC[5]=1,"(每日重置)：",)&"活动期间单笔充值"&VLOOKUP(RC[1],R2C15:R16C16,2,FALSE) -> (每日重置)：活动期间单笔充值4000钻 | F86: 2009 | H86: 1 | I86: 1 | J86: 1 | K86: 16301|13402|13599|80120|13392 | L86: 160|60|60|1|3
A87: 1082 | B87: =INT(RC[-1]/1000) -> 1 | C87: 0 | D87: 1 | E87: =IF(RC[5]=1,"(每日重置)：",)&"活动期间单笔充值"&VLOOKUP(RC[1],R2C15:R16C16,2,FALSE) -> (每日重置)：活动期间单笔充值8000钻 | F87: 2010 | H87: 1 | I87: 1 | J87: 1 | K87: 16301|13402|13599|80120|13392 | L87: 320|100|120|1|4
A88: 1083 | B88: =INT(RC[-1]/1000) -> 1 | C88: 0 | D88: 1 | E88: =IF(RC[5]=1,"(每日重置)：",)&"活动期间单笔充值"&VLOOKUP(RC[1],R2C15:R16C16,2,FALSE) -> (每日重置)：活动期间单笔充值20000钻 | F88: 2011 | H88: 1 | I88: 1 | J88: 1 | K88: 16301|13402|13599|80120|13392 | L88: 480|160|240|2|5
A89: 1084 | B89: =INT(RC[-1]/1000) -> 1 | C89: 0 | D89: 1 | E89: =IF(RC[5]=1,"(每日重置)：",)&"活动期间单笔充值"&VLOOKUP(RC[1],R2C15:R16C16,2,FALSE) -> 活动期间单笔充值40钻 | F89: 2001 | H89: 99 | I89: 1 | J89: 0 | K89: 10089|19103 | L89: 6|5
A90: 1085 | B90: =INT(RC[-1]/1000) -> 1 | C90: 0 | D90: 1 | E90: =IF(RC[5]=1,"(每日重置)：",)&"活动期间单笔充值"&VLOOKUP(RC[1],R2C15:R16C16,2,FALSE) -> 活动期间单笔充值80钻 | F90: 2002 | H90: 99 | I90: 1 | J90: 0 | K90: 10089|10000 | L90: 12|2
A91: 1086 | B91: =INT(RC[-1]/1000) -> 1 | C91: 0 | D91: 1 | E91: =IF(RC[5]=1,"(每日重置)：",)&"活动期间单笔充值"&VLOOKUP(RC[1],R2C15:R16C16,2,FALSE) -> 活动期间单笔充值120钻 | F91: 2003 | H91: 99 | I91: 1 | J91: 0 | K91: 10089|10001 | L91: 18|3
A92: 1087 | B92: =INT(RC[-1]/1000) -> 1 | C92: 0 | D92: 1 | E92: =IF(RC[5]=1,"(每日重置)：",)&"活动期间单笔充值"&VLOOKUP(RC[1],R2C15:R16C16,2,FALSE) -> 活动期间单笔充值200钻 | F92: 2004 | H92: 99 | I92: 1 | J92: 0 | K92: 10089|19103 | L92: 30|30
A93: 1088 | B93: =INT(RC[-1]/1000) -> 1 | C93: 0 | D93: 1 | E93: =IF(RC[5]=1,"(每日重置)：",)&"活动期间单笔充值"&VLOOKUP(RC[1],R2C15:R16C16,2,FALSE) -> 活动期间单笔充值400钻 | F93: 2005 | H93: 99 | I93: 1 | J93: 0 | K93: 10089|10000|10001 | L93: 60|6|6
A94: 1089 | B94: =INT(RC[-1]/1000) -> 1 | C94: 0 | D94: 1 | E94: =IF(RC[5]=1,"(每日重置)：",)&"活动期间单笔充值"&VLOOKUP(RC[1],R2C15:R16C16,2,FALSE) -> 活动期间单笔充值800钻 | F94: 2006 | H94: 99 | I94: 1 | J94: 0 | K94: 10089|10022 | L94: 120|50
A95: 1090 | B95: =INT(RC[-1]/1000) -> 1 | C95: 0 | D95: 1 | E95: =IF(RC[5]=1,"(每日重置)：",)&"活动期间单笔充值"&VLOOKUP(RC[1],R2C15:R16C16,2,FALSE) -> 活动期间单笔充值1200钻 | F95: 2007 | H95: 99 | I95: 1 | J95: 0 | K95: 10090|10014 | L95: 60|200
A96: 1091 | B96: =INT(RC[-1]/1000) -> 1 | C96: 0 | D96: 1 | E96: =IF(RC[5]=1,"(每日重置)：",)&"活动期间单笔充值"&VLOOKUP(RC[1],R2C15:R16C16,2,FALSE) -> 活动期间单笔充值2000钻 | F96: 2008 | H96: 99 | I96: 1 | J96: 0 | K96: 10090|10010 | L96: 100|1500
A97: 1092 | B97: =INT(RC[-1]/1000) -> 1 | C97: 0 | D97: 1 | E97: =IF(RC[5]=1,"(每日重置)：",)&"活动期间单笔充值"&VLOOKUP(RC[1],R2C15:R16C16,2,FALSE) -> 活动期间单笔充值4000钻 | F97: 2009 | H97: 99 | I97: 1 | J97: 0 | K97: 10090|13392|13619 | L97: 200|1|1
A98: 1093 | B98: =INT(RC[-1]/1000) -> 1 | C98: 0 | D98: 1 | E98: =IF(RC[5]=1,"(每日重置)：",)&"活动期间单笔充值"&VLOOKUP(RC[1],R2C15:R16C16,2,FALSE) -> 活动期间单笔充值8000钻 | F98: 2010 | H98: 99 | I98: 1 | J98: 0 | K98: 10090|13324|10022 | L98: 400|2|500
A99: 1094 | B99: =INT(RC[-1]/1000) -> 1 | C99: 0 | D99: 1 | E99: =IF(RC[5]=1,"(每日重置)：",)&"活动期间单笔充值"&VLOOKUP(RC[1],R2C15:R16C16,2,FALSE) -> 活动期间单笔充值20000钻 | F99: 2011 | H99: 99 | I99: 1 | J99: 0 | K99: 10090|13384|10003|10004 | L99: 1000|1|2000|2000
A100: 1095 | B100: =INT(RC[-1]/1000) -> 1 | C100: 0 | D100: 1 | E100: =IF(RC[5]=1,"(每日重置)：",)&"活动期间单笔充值"&VLOOKUP(RC[1],R2C15:R16C16,2,FALSE) -> 活动期间单笔充值40000钻 | F100: 2012 | H100: 99 | I100: 1 | J100: 0 | K100: 10090|13593 | L100: 2000|12
A101: 1096 | B101: =INT(RC[-1]/1000) -> 1 | C101: 0 | D101: 1 | E101: =IF(RC[5]=1,"(每日重置)：",)&"活动期间单笔充值"&VLOOKUP(RC[1],R2C15:R16C16,2,FALSE) -> 活动期间单笔充值80000钻 | F101: 2013 | H101: 99 | I101: 1 | J101: 0 | K101: 10090|13593 | L101: 4000|25
A102: 1097 | B102: =INT(RC[-1]/1000) -> 1 | C102: 0 | D102: 1 | E102: =IF(RC[5]=1,"(每日重置)：",)&"活动期间单笔充值"&VLOOKUP(RC[1],R2C15:R16C16,2,FALSE) -> 活动期间单笔充值200000钻 | F102: 2014 | H102: 99 | I102: 1 | J102: 0 | K102: 10090|13593 | L102: 10000|64
A103: 1098 | B103: =INT(RC[-1]/1000) -> 1 | C103: 0 | D103: 1 | E103: =IF(RC[5]=1,"(每日重置)：",)&"活动期间单笔充值"&VLOOKUP(RC[1],R2C15:R16C16,2,FALSE) -> (每日重置)：活动期间单笔充值80钻 | F103: 2002 | H103: 1 | I103: 1 | J103: 1 | K103: 16301|10000|10115|10096|10009 | L103: 5|5|5|1|5
A104: 1099 | B104: =INT(RC[-1]/1000) -> 1 | C104: 0 | D104: 1 | E104: =IF(RC[5]=1,"(每日重置)：",)&"活动期间单笔充值"&VLOOKUP(RC[1],R2C15:R16C16,2,FALSE) -> (每日重置)：活动期间单笔充值200钻 | F104: 2004 | H104: 1 | I104: 1 | J104: 1 | K104: 16301|10000|10115|10096|10009 | L104: 10|7|5|1|5
A105: 1100 | B105: =INT(RC[-1]/1000) -> 1 | C105: 0 | D105: 1 | E105: =IF(RC[5]=1,"(每日重置)：",)&"活动期间单笔充值"&VLOOKUP(RC[1],R2C15:R16C16,2,FALSE) -> (每日重置)：活动期间单笔充值400钻 | F105: 2005 | H105: 1 | I105: 1 | J105: 1 | K105: 16301|10008|10115|10096|10009 | L105: 20|700|10|2|10
A106: 1101 | B106: =INT(RC[-1]/1000) -> 1 | C106: 0 | D106: 1 | E106: =IF(RC[5]=1,"(每日重置)：",)&"活动期间单笔充值"&VLOOKUP(RC[1],R2C15:R16C16,2,FALSE) -> (每日重置)：活动期间单笔充值800钻 | F106: 2006 | H106: 1 | I106: 1 | J106: 1 | K106: 16301|80100|13016|10115|13392 | L106: 40|1|25|20|1
A107: 1102 | B107: =INT(RC[-1]/1000) -> 1 | C107: 0 | D107: 1 | E107: =IF(RC[5]=1,"(每日重置)：",)&"活动期间单笔充值"&VLOOKUP(RC[1],R2C15:R16C16,2,FALSE) -> (每日重置)：活动期间单笔充值2000钻 | F107: 2008 | H107: 1 | I107: 1 | J107: 1 | K107: 16301|80100|13017|13393|13392 | L107: 80|1|25|1|2
A108: 1103 | B108: =INT(RC[-1]/1000) -> 1 | C108: 0 | D108: 1 | E108: =IF(RC[5]=1,"(每日重置)：",)&"活动期间单笔充值"&VLOOKUP(RC[1],R2C15:R16C16,2,FALSE) -> (每日重置)：活动期间单笔充值4000钻 | F108: 2009 | H108: 1 | I108: 1 | J108: 1 | K108: 16301|13402|80120|13393|13392 | L108: 160|60|1|2|3
A109: 1104 | B109: =INT(RC[-1]/1000) -> 1 | C109: 0 | D109: 1 | E109: =IF(RC[5]=1,"(每日重置)：",)&"活动期间单笔充值"&VLOOKUP(RC[1],R2C15:R16C16,2,FALSE) -> (每日重置)：活动期间单笔充值8000钻 | F109: 2010 | H109: 1 | I109: 1 | J109: 1 | K109: 16301|13402|80120|13393|13392 | L109: 320|100|1|3|4
A110: 1105 | B110: =INT(RC[-1]/1000) -> 1 | C110: 0 | D110: 1 | E110: =IF(RC[5]=1,"(每日重置)：",)&"活动期间单笔充值"&VLOOKUP(RC[1],R2C15:R16C16,2,FALSE) -> (每日重置)：活动期间单笔充值20000钻 | F110: 2011 | H110: 1 | I110: 1 | J110: 1 | K110: 16301|13402|80120|13393|13392 | L110: 480|160|2|4|5
A111: 1106 | B111: =INT(RC[-1]/1000) -> 1 | C111: 0 | D111: 1 | E111: =IF(RC[5]=1,"(每日重置)：",)&"活动期间单笔充值"&VLOOKUP(RC[1],R2C15:R16C16,2,FALSE) -> (每日重置)：活动期间单笔充值80钻 | F111: 2002 | H111: 1 | I111: 1 | J111: 1 | K111: 16301|10003|10000|10115|13316 | L111: 5|100|5|5|1
A112: 1107 | B112: =INT(RC[-1]/1000) -> 1 | C112: 0 | D112: 1 | E112: =IF(RC[5]=1,"(每日重置)：",)&"活动期间单笔充值"&VLOOKUP(RC[1],R2C15:R16C16,2,FALSE) -> (每日重置)：活动期间单笔充值200钻 | F112: 2004 | H112: 1 | I112: 1 | J112: 1 | K112: 16301|10000|10115|10118|13316 | L112: 10|7|5|5|1
A113: 1108 | B113: =INT(RC[-1]/1000) -> 1 | C113: 0 | D113: 1 | E113: =IF(RC[5]=1,"(每日重置)：",)&"活动期间单笔充值"&VLOOKUP(RC[1],R2C15:R16C16,2,FALSE) -> (每日重置)：活动期间单笔充值400钻 | F113: 2005 | H113: 1 | I113: 1 | J113: 1 | K113: 16301|10008|10115|10118|13316 | L113: 20|700|10|5|1
A114: 1109 | B114: =INT(RC[-1]/1000) -> 1 | C114: 0 | D114: 1 | E114: =IF(RC[5]=1,"(每日重置)：",)&"活动期间单笔充值"&VLOOKUP(RC[1],R2C15:R16C16,2,FALSE) -> (每日重置)：活动期间单笔充值800钻 | F114: 2006 | H114: 1 | I114: 1 | J114: 1 | K114: 16301|13646|10115|10118|13392 | L114: 40|100|20|10|1
A115: 1110 | B115: =INT(RC[-1]/1000) -> 1 | C115: 0 | D115: 1 | E115: =IF(RC[5]=1,"(每日重置)：",)&"活动期间单笔充值"&VLOOKUP(RC[1],R2C15:R16C16,2,FALSE) -> (每日重置)：活动期间单笔充值2000钻 | F115: 2008 | H115: 1 | I115: 1 | J115: 1 | K115: 16301|13646|10118|13599|13392 | L115: 80|200|20|30|2
A116: 1111 | B116: =INT(RC[-1]/1000) -> 1 | C116: 0 | D116: 1 | E116: =IF(RC[5]=1,"(每日重置)：",)&"活动期间单笔充值"&VLOOKUP(RC[1],R2C15:R16C16,2,FALSE) -> (每日重置)：活动期间单笔充值4000钻 | F116: 2009 | H116: 1 | I116: 1 | J116: 1 | K116: 16301|13402|13599|80120|13392 | L116: 160|60|60|1|3
A117: 1112 | B117: =INT(RC[-1]/1000) -> 1 | C117: 0 | D117: 1 | E117: =IF(RC[5]=1,"(每日重置)：",)&"活动期间单笔充值"&VLOOKUP(RC[1],R2C15:R16C16,2,FALSE) -> (每日重置)：活动期间单笔充值8000钻 | F117: 2010 | H117: 1 | I117: 1 | J117: 1 | K117: 16301|13402|13599|80120|13392 | L117: 320|100|120|1|4
A118: 1113 | B118: =INT(RC[-1]/1000) -> 1 | C118: 0 | D118: 1 | E118: =IF(RC[5]=1,"(每日重置)：",)&"活动期间单笔充值"&VLOOKUP(RC[1],R2C15:R16C16,2,FALSE) -> (每日重置)：活动期间单笔充值20000钻 | F118: 2011 | H118: 1 | I118: 1 | J118: 1 | K118: 16301|13402|13599|80120|13392 | L118: 480|160|240|2|5
A119: 1114 | B119: =INT(RC[-1]/1000) -> 1 | C119: 0 | D119: 1 | E119: =IF(RC[5]=1,"(每日重置)：",)&"活动期间单笔充值"&VLOOKUP(RC[1],R2C15:R16C16,2,FALSE) -> (每日重置)：活动期间单笔充值80钻 | F119: 2002 | H119: 1 | I119: 1 | J119: 1 | K119: 12503|10003|10000|10004|13316 | L119: 5|100|5|50|1
A120: 1115 | B120: =INT(RC[-1]/1000) -> 1 | C120: 0 | D120: 1 | E120: =IF(RC[5]=1,"(每日重置)：",)&"活动期间单笔充值"&VLOOKUP(RC[1],R2C15:R16C16,2,FALSE) -> (每日重置)：活动期间单笔充值200钻 | F120: 2004 | H120: 1 | I120: 1 | J120: 1 | K120: 12503|10003|10000|10010|13316 | L120: 10|5|7|250|1
A121: 1116 | B121: =INT(RC[-1]/1000) -> 1 | C121: 0 | D121: 1 | E121: =IF(RC[5]=1,"(每日重置)：",)&"活动期间单笔充值"&VLOOKUP(RC[1],R2C15:R16C16,2,FALSE) -> (每日重置)：活动期间单笔充值400钻 | F121: 2005 | H121: 1 | I121: 1 | J121: 1 | K121: 12503|10008|10010|10004|13316 | L121: 20|700|300|100|1
A122: 1117 | B122: =INT(RC[-1]/1000) -> 1 | C122: 0 | D122: 1 | E122: =IF(RC[5]=1,"(每日重置)：",)&"活动期间单笔充值"&VLOOKUP(RC[1],R2C15:R16C16,2,FALSE) -> (每日重置)：活动期间单笔充值800钻 | F122: 2006 | H122: 1 | I122: 1 | J122: 1 | K122: 12503|80100|13016|10010|13392 | L122: 40|1|20|400|1
A123: 1118 | B123: =INT(RC[-1]/1000) -> 1 | C123: 0 | D123: 1 | E123: =IF(RC[5]=1,"(每日重置)：",)&"活动期间单笔充值"&VLOOKUP(RC[1],R2C15:R16C16,2,FALSE) -> (每日重置)：活动期间单笔充值2000钻 | F123: 2008 | H123: 1 | I123: 1 | J123: 1 | K123: 12503|80100|13017|10010|13392 | L123: 80|1|20|800|2
A124: 1119 | B124: =INT(RC[-1]/1000) -> 1 | C124: 0 | D124: 1 | E124: =IF(RC[5]=1,"(每日重置)：",)&"活动期间单笔充值"&VLOOKUP(RC[1],R2C15:R16C16,2,FALSE) -> (每日重置)：活动期间单笔充值4000钻 | F124: 2009 | H124: 1 | I124: 1 | J124: 1 | K124: 12503|13402|10008|80101|13392 | L124: 160|30|3000|1|3
A125: 1120 | B125: =INT(RC[-1]/1000) -> 1 | C125: 0 | D125: 1 | E125: =IF(RC[5]=1,"(每日重置)：",)&"活动期间单笔充值"&VLOOKUP(RC[1],R2C15:R16C16,2,FALSE) -> (每日重置)：活动期间单笔充值8000钻 | F125: 2010 | H125: 1 | I125: 1 | J125: 1 | K125: 12503|13402|10004|10014|13392 | L125: 320|60|700|700|4
A126: 1121 | B126: =INT(RC[-1]/1000) -> 1 | C126: 0 | D126: 1 | E126: =IF(RC[5]=1,"(每日重置)：",)&"活动期间单笔充值"&VLOOKUP(RC[1],R2C15:R16C16,2,FALSE) -> (每日重置)：活动期间单笔充值20000钻 | F126: 2011 | H126: 1 | I126: 1 | J126: 1 | K126: 12503|13402|10004|10014|13392 | L126: 480|120|1500|1500|5
A127: 1122 | B127: =INT(RC[-1]/1000) -> 1 | C127: 0 | D127: 1 | E127: =IF(RC[5]=1,"(每日重置)：",)&"活动期间单笔充值"&VLOOKUP(RC[1],R2C15:R16C16,2,FALSE) -> (每日重置)：活动期间单笔充值80钻 | F127: 2002 | H127: 1 | I127: 1 | J127: 1 | K127: 12502|10003|10000|10004|13316 | L127: 5|100|5|50|1
A128: 1123 | B128: =INT(RC[-1]/1000) -> 1 | C128: 0 | D128: 1 | E128: =IF(RC[5]=1,"(每日重置)：",)&"活动期间单笔充值"&VLOOKUP(RC[1],R2C15:R16C16,2,FALSE) -> (每日重置)：活动期间单笔充值200钻 | F128: 2004 | H128: 1 | I128: 1 | J128: 1 | K128: 12502|10096|10000|10010|13316 | L128: 10|5|7|250|1
A129: 1124 | B129: =INT(RC[-1]/1000) -> 1 | C129: 0 | D129: 1 | E129: =IF(RC[5]=1,"(每日重置)：",)&"活动期间单笔充值"&VLOOKUP(RC[1],R2C15:R16C16,2,FALSE) -> (每日重置)：活动期间单笔充值400钻 | F129: 2005 | H129: 1 | I129: 1 | J129: 1 | K129: 12502|10096|10008|10010|13316 | L129: 20|5|700|300|1
A130: 1125 | B130: =INT(RC[-1]/1000) -> 1 | C130: 0 | D130: 1 | E130: =IF(RC[5]=1,"(每日重置)：",)&"活动期间单笔充值"&VLOOKUP(RC[1],R2C15:R16C16,2,FALSE) -> (每日重置)：活动期间单笔充值800钻 | F130: 2006 | H130: 1 | I130: 1 | J130: 1 | K130: 12502|80100|13646|10010|13392 | L130: 40|1|50|400|1
A131: 1126 | B131: =INT(RC[-1]/1000) -> 1 | C131: 0 | D131: 1 | E131: =IF(RC[5]=1,"(每日重置)：",)&"活动期间单笔充值"&VLOOKUP(RC[1],R2C15:R16C16,2,FALSE) -> (每日重置)：活动期间单笔充值2000钻 | F131: 2008 | H131: 1 | I131: 1 | J131: 1 | K131: 12502|80100|13646|10010|13392 | L131: 80|1|100|800|2
A132: 1127 | B132: =INT(RC[-1]/1000) -> 1 | C132: 0 | D132: 1 | E132: =IF(RC[5]=1,"(每日重置)：",)&"活动期间单笔充值"&VLOOKUP(RC[1],R2C15:R16C16,2,FALSE) -> (每日重置)：活动期间单笔充值4000钻 | F132: 2009 | H132: 1 | I132: 1 | J132: 1 | K132: 12502|13402|10008|80101|13392 | L132: 160|30|3000|1|3
A133: 1128 | B133: =INT(RC[-1]/1000) -> 1 | C133: 0 | D133: 1 | E133: =IF(RC[5]=1,"(每日重置)：",)&"活动期间单笔充值"&VLOOKUP(RC[1],R2C15:R16C16,2,FALSE) -> (每日重置)：活动期间单笔充值8000钻 | F133: 2010 | H133: 1 | I133: 1 | J133: 1 | K133: 12502|13402|10004|10014|13392 | L133: 320|60|700|700|4
A134: 1129 | B134: =INT(RC[-1]/1000) -> 1 | C134: 0 | D134: 1 | E134: =IF(RC[5]=1,"(每日重置)：",)&"活动期间单笔充值"&VLOOKUP(RC[1],R2C15:R16C16,2,FALSE) -> (每日重置)：活动期间单笔充值20000钻 | F134: 2011 | H134: 1 | I134: 1 | J134: 1 | K134: 12502|13402|10004|10014|13392 | L134: 480|120|1500|1500|5
A135: 2001 | B135: =INT(RC[-1]/1000) -> 2 | C135: 1 | D135: 1 | E135: =IF(RC[5]=1,"(每日重置)：",)&"活动期间累计充值"&RC[1]*10&"钻（%s/"&RC[1]*10&"）" -> 活动期间累计充值60钻（%s/60） | F135: 6 | H135: 1 | I135: 0 | J135: 0 | K135: 19005 | L135: 300 | N135: 累计充值x=累计充值目标（单位：元）
A136: 2002 | B136: =INT(RC[-1]/1000) -> 2 | C136: 1 | D136: 1 | E136: =IF(RC[5]=1,"(每日重置)：",)&"活动期间累计充值"&RC[1]*10&"钻（%s/"&RC[1]*10&"）" -> 活动期间累计充值250钻（%s/250） | F136: 25 | H136: 1 | I136: 0 | J136: 0 | K136: 13329|10001|19103 | L136: 20|4|20
A137: 2003 | B137: =INT(RC[-1]/1000) -> 2 | C137: 1 | D137: 1 | E137: =IF(RC[5]=1,"(每日重置)：",)&"活动期间累计充值"&RC[1]*10&"钻（%s/"&RC[1]*10&"）" -> 活动期间累计充值500钻（%s/500） | F137: 50 | H137: 1 | I137: 0 | J137: 0 | K137: 13329|10000|19103 | L137: 20|4|30
A138: 2004 | B138: =INT(RC[-1]/1000) -> 2 | C138: 1 | D138: 1 | E138: =IF(RC[5]=1,"(每日重置)：",)&"活动期间累计充值"&RC[1]*10&"钻（%s/"&RC[1]*10&"）" -> 活动期间累计充值1000钻（%s/1000） | F138: 100 | H138: 1 | I138: 0 | J138: 0 | K138: 10014|19103 | L138: 50|50
A139: 2005 | B139: =INT(RC[-1]/1000) -> 2 | C139: 1 | D139: 1 | E139: =IF(RC[5]=1,"(每日重置)：",)&"活动期间累计充值"&RC[1]*10&"钻（%s/"&RC[1]*10&"）" -> 活动期间累计充值2000钻（%s/2000） | F139: 200 | H139: 1 | I139: 0 | J139: 0 | K139: 13316|10010|19103 | L139: 1|100|80
A140: 2006 | B140: =INT(RC[-1]/1000) -> 2 | C140: 1 | D140: 1 | E140: =IF(RC[5]=1,"(每日重置)：",)&"活动期间累计充值"&RC[1]*10&"钻（%s/"&RC[1]*10&"）" -> 活动期间累计充值5000钻（%s/5000） | F140: 500 | H140: 1 | I140: 0 | J140: 0 | K140: 21401 | L140: 1
A141: 2007 | B141: =INT(RC[-1]/1000) -> 2 | C141: 1 | D141: 1 | E141: =IF(RC[5]=1,"(每日重置)：",)&"活动期间累计充值"&RC[1]*10&"钻（%s/"&RC[1]*10&"）" -> 活动期间累计充值10000钻（%s/10000） | F141: 1000 | H141: 1 | I141: 0 | J141: 0 | K141: 13434|10022|13646|13324 | L141: 1|50|10|1
A142: 2008 | B142: =INT(RC[-1]/1000) -> 2 | C142: 1 | D142: 1 | E142: =IF(RC[5]=1,"(每日重置)：",)&"活动期间累计充值"&RC[1]*10&"钻（%s/"&RC[1]*10&"）" -> 活动期间累计充值20000钻（%s/20000） | F142: 2000 | H142: 1 | I142: 0 | J142: 0 | K142: 13333|10022|13646|13324 | L142: 1|80|15|2
A143: 2009 | B143: =INT(RC[-1]/1000) -> 2 | C143: 1 | D143: 1 | E143: =IF(RC[5]=1,"(每日重置)：",)&"活动期间累计充值"&RC[1]*10&"钻（%s/"&RC[1]*10&"）" -> 活动期间累计充值35000钻（%s/35000） | F143: 3500 | H143: 1 | I143: 0 | J143: 0 | K143: 13434|23401 | L143: 1|1
A144: 2010 | B144: =INT(RC[-1]/1000) -> 2 | C144: 1 | D144: 1 | E144: =IF(RC[5]=1,"(每日重置)：",)&"活动期间累计充值"&RC[1]*10&"钻（%s/"&RC[1]*10&"）" -> 活动期间累计充值55000钻（%s/55000） | F144: 5500 | H144: 1 | I144: 0 | J144: 0 | K144: 13435|20401 | L144: 2|1
A145: 2011 | B145: =INT(RC[-1]/1000) -> 2 | C145: 1 | D145: 1 | E145: =IF(RC[5]=1,"(每日重置)：",)&"活动期间累计充值"&RC[1]*10&"钻（%s/"&RC[1]*10&"）" -> 活动期间累计充值60钻（%s/60） | F145: 6 | H145: 1 | I145: 0 | J145: 0 | K145: 10000|10001 | L145: 5|5
A146: 2012 | B146: =INT(RC[-1]/1000) -> 2 | C146: 1 | D146: 1 | E146: =IF(RC[5]=1,"(每日重置)：",)&"活动期间累计充值"&RC[1]*10&"钻（%s/"&RC[1]*10&"）" -> 活动期间累计充值250钻（%s/250） | F146: 25 | H146: 1 | I146: 0 | J146: 0 | K146: 10022|10001 | L146: 10|10
A147: 2013 | B147: =INT(RC[-1]/1000) -> 2 | C147: 1 | D147: 1 | E147: =IF(RC[5]=1,"(每日重置)：",)&"活动期间累计充值"&RC[1]*10&"钻（%s/"&RC[1]*10&"）" -> 活动期间累计充值500钻（%s/500） | F147: 50 | H147: 1 | I147: 0 | J147: 0 | K147: 10022|10000 | L147: 15|10
A148: 2014 | B148: =INT(RC[-1]/1000) -> 2 | C148: 1 | D148: 1 | E148: =IF(RC[5]=1,"(每日重置)：",)&"活动期间累计充值"&RC[1]*10&"钻（%s/"&RC[1]*10&"）" -> 活动期间累计充值1500钻（%s/1500） | F148: 150 | H148: 1 | I148: 0 | J148: 0 | K148: 13336 | L148: 1
A149: 2015 | B149: =INT(RC[-1]/1000) -> 2 | C149: 1 | D149: 1 | E149: =IF(RC[5]=1,"(每日重置)：",)&"活动期间累计充值"&RC[1]*10&"钻（%s/"&RC[1]*10&"）" -> 活动期间累计充值5000钻（%s/5000） | F149: 500 | H149: 1 | I149: 0 | J149: 0 | K149: 13324|10010 | L149: 2|888
A150: 2016 | B150: =INT(RC[-1]/1000) -> 2 | C150: 1 | D150: 1 | E150: =IF(RC[5]=1,"(每日重置)：",)&"活动期间累计充值"&RC[1]*10&"钻（%s/"&RC[1]*10&"）" -> 活动期间累计充值10000钻（%s/10000） | F150: 1000 | H150: 1 | I150: 0 | J150: 0 | K150: 21402|10014 | L150: 1|288
A151: 2017 | B151: =INT(RC[-1]/1000) -> 2 | C151: 1 | D151: 1 | E151: =IF(RC[5]=1,"(每日重置)：",)&"活动期间累计充值"&RC[1]*10&"钻（%s/"&RC[1]*10&"）" -> 活动期间累计充值15000钻（%s/15000） | F151: 1500 | H151: 1 | I151: 0 | J151: 0 | K151: 13324|10022|13646 | L151: 3|80|30
A152: 2018 | B152: =INT(RC[-1]/1000) -> 2 | C152: 1 | D152: 1 | E152: =IF(RC[5]=1,"(每日重置)：",)&"活动期间累计充值"&RC[1]*10&"钻（%s/"&RC[1]*10&"）" -> 活动期间累计充值20000钻（%s/20000） | F152: 2000 | H152: 1 | I152: 0 | J152: 0 | K152: 20402|15012|10022 | L152: 1|30|80
A153: 2019 | B153: =INT(RC[-1]/1000) -> 2 | C153: 1 | D153: 1 | E153: =IF(RC[5]=1,"(每日重置)：",)&"活动期间累计充值"&RC[1]*10&"钻（%s/"&RC[1]*10&"）" -> 活动期间累计充值30000钻（%s/30000） | F153: 3000 | H153: 1 | I153: 0 | J153: 0 | K153: 10014|10010 | L153: 468|1188
A154: 2020 | B154: =INT(RC[-1]/1000) -> 2 | C154: 1 | D154: 1 | E154: =IF(RC[5]=1,"(每日重置)：",)&"活动期间累计充值"&RC[1]*10&"钻（%s/"&RC[1]*10&"）" -> 活动期间累计充值40000钻（%s/40000） | F154: 4000 | H154: 1 | I154: 0 | J154: 0 | K154: 23402|15012|10022 | L154: 1|60|100
A155: 2021 | B155: =INT(RC[-1]/1000) -> 2 | C155: 1 | D155: 1 | E155: =IF(RC[5]=1,"(每日重置)：",)&"活动期间累计充值"&RC[1]*10&"钻（%s/"&RC[1]*10&"）" -> 活动期间累计充值55000钻（%s/55000） | F155: 5500 | H155: 1 | I155: 0 | J155: 0 | K155: 22402|15012|10022 | L155: 1|120|100
A156: 2022 | B156: =INT(RC[-1]/1000) -> 2 | C156: 1 | D156: 1 | E156: =IF(RC[5]=1,"(每日重置)：",)&"活动期间累计充值"&RC[1]*10&"钻（%s/"&RC[1]*10&"）" -> 活动期间累计充值60钻（%s/60） | F156: 6 | H156: 1 | I156: 0 | J156: 0 | K156: 10000|10001 | L156: 5|5
A157: 2023 | B157: =INT(RC[-1]/1000) -> 2 | C157: 1 | D157: 1 | E157: =IF(RC[5]=1,"(每日重置)：",)&"活动期间累计充值"&RC[1]*10&"钻（%s/"&RC[1]*10&"）" -> 活动期间累计充值250钻（%s/250） | F157: 25 | H157: 1 | I157: 0 | J157: 0 | K157: 10101|10001 | L157: 2|10
A158: 2024 | B158: =INT(RC[-1]/1000) -> 2 | C158: 1 | D158: 1 | E158: =IF(RC[5]=1,"(每日重置)：",)&"活动期间累计充值"&RC[1]*10&"钻（%s/"&RC[1]*10&"）" -> 活动期间累计充值500钻（%s/500） | F158: 50 | H158: 1 | I158: 0 | J158: 0 | K158: 10100|10000 | L158: 1|10
A159: 2025 | B159: =INT(RC[-1]/1000) -> 2 | C159: 1 | D159: 1 | E159: =IF(RC[5]=1,"(每日重置)：",)&"活动期间累计充值"&RC[1]*10&"钻（%s/"&RC[1]*10&"）" -> 活动期间累计充值1000钻（%s/1000） | F159: 100 | H159: 1 | I159: 0 | J159: 0 | K159: 80001|10014 | L159: 1|60
A160: 2026 | B160: =INT(RC[-1]/1000) -> 2 | C160: 1 | D160: 1 | E160: =IF(RC[5]=1,"(每日重置)：",)&"活动期间累计充值"&RC[1]*10&"钻（%s/"&RC[1]*10&"）" -> 活动期间累计充值2000钻（%s/2000） | F160: 200 | H160: 1 | I160: 0 | J160: 0 | K160: 80011|10010 | L160: 2|500
A161: 2027 | B161: =INT(RC[-1]/1000) -> 2 | C161: 1 | D161: 1 | E161: =IF(RC[5]=1,"(每日重置)：",)&"活动期间累计充值"&RC[1]*10&"钻（%s/"&RC[1]*10&"）" -> 活动期间累计充值3000钻（%s/3000） | F161: 300 | H161: 1 | I161: 0 | J161: 0 | K161: 19030|10014 | L161: 3688|128
A162: 2028 | B162: =INT(RC[-1]/1000) -> 2 | C162: 1 | D162: 1 | E162: =IF(RC[5]=1,"(每日重置)：",)&"活动期间累计充值"&RC[1]*10&"钻（%s/"&RC[1]*10&"）" -> 活动期间累计充值6000钻（%s/6000） | F162: 600 | H162: 1 | I162: 0 | J162: 0 | K162: 80100|10101 | L162: 1|10
A163: 2029 | B163: =INT(RC[-1]/1000) -> 2 | C163: 1 | D163: 1 | E163: =IF(RC[5]=1,"(每日重置)：",)&"活动期间累计充值"&RC[1]*10&"钻（%s/"&RC[1]*10&"）" -> 活动期间累计充值10000钻（%s/10000） | F163: 1000 | H163: 1 | I163: 0 | J163: 0 | K163: 13336|10101 | L163: 1|15
A164: 2030 | B164: =INT(RC[-1]/1000) -> 2 | C164: 1 | D164: 1 | E164: =IF(RC[5]=1,"(每日重置)：",)&"活动期间累计充值"&RC[1]*10&"钻（%s/"&RC[1]*10&"）" -> 活动期间累计充值15000钻（%s/15000） | F164: 1500 | H164: 1 | I164: 0 | J164: 0 | K164: 80100|10014 | L164: 1|188
A165: 2031 | B165: =INT(RC[-1]/1000) -> 2 | C165: 1 | D165: 1 | E165: =IF(RC[5]=1,"(每日重置)：",)&"活动期间累计充值"&RC[1]*10&"钻（%s/"&RC[1]*10&"）" -> 活动期间累计充值20000钻（%s/20000） | F165: 2000 | H165: 1 | I165: 0 | J165: 0 | K165: 21405|10010 | L165: 1|500
A166: 2032 | B166: =INT(RC[-1]/1000) -> 2 | C166: 1 | D166: 1 | E166: =IF(RC[5]=1,"(每日重置)：",)&"活动期间累计充值"&RC[1]*10&"钻（%s/"&RC[1]*10&"）" -> 活动期间累计充值30000钻（%s/30000） | F166: 3000 | H166: 1 | I166: 0 | J166: 0 | K166: 80100|10101 | L166: 2|20
A167: 2033 | B167: =INT(RC[-1]/1000) -> 2 | C167: 1 | D167: 1 | E167: =IF(RC[5]=1,"(每日重置)：",)&"活动期间累计充值"&RC[1]*10&"钻（%s/"&RC[1]*10&"）" -> 活动期间累计充值40000钻（%s/40000） | F167: 4000 | H167: 1 | I167: 0 | J167: 0 | K167: 20405|10101 | L167: 1|30
A168: 2034 | B168: =INT(RC[-1]/1000) -> 2 | C168: 1 | D168: 1 | E168: =IF(RC[5]=1,"(每日重置)：",)&"活动期间累计充值"&RC[1]*10&"钻（%s/"&RC[1]*10&"）" -> 活动期间累计充值55000钻（%s/55000） | F168: 5500 | H168: 1 | I168: 0 | J168: 0 | K168: 23405|22405|80100 | L168: 1|1|1
A169: 2035 | B169: =INT(RC[-1]/1000) -> 2 | C169: 1 | D169: 1 | E169: =IF(RC[5]=1,"(每日重置)：",)&"活动期间累计充值"&RC[1]*10&"钻（%s/"&RC[1]*10&"）" -> 活动期间累计充值60钻（%s/60） | F169: 6 | H169: 1 | I169: 0 | J169: 0 | K169: 10000|10001 | L169: 5|5
A170: 2036 | B170: =INT(RC[-1]/1000) -> 2 | C170: 1 | D170: 1 | E170: =IF(RC[5]=1,"(每日重置)：",)&"活动期间累计充值"&RC[1]*10&"钻（%s/"&RC[1]*10&"）" -> 活动期间累计充值250钻（%s/250） | F170: 25 | H170: 1 | I170: 0 | J170: 0 | K170: 42301|10001 | L170: 2|10
A171: 2037 | B171: =INT(RC[-1]/1000) -> 2 | C171: 1 | D171: 1 | E171: =IF(RC[5]=1,"(每日重置)：",)&"活动期间累计充值"&RC[1]*10&"钻（%s/"&RC[1]*10&"）" -> 活动期间累计充值500钻（%s/500） | F171: 50 | H171: 1 | I171: 0 | J171: 0 | K171: 33400|10000 | L171: 8|10
A172: 2038 | B172: =INT(RC[-1]/1000) -> 2 | C172: 1 | D172: 1 | E172: =IF(RC[5]=1,"(每日重置)：",)&"活动期间累计充值"&RC[1]*10&"钻（%s/"&RC[1]*10&"）" -> 活动期间累计充值1000钻（%s/1000） | F172: 100 | H172: 1 | I172: 0 | J172: 0 | K172: 10022|13320 | L172: 40|10
A173: 2039 | B173: =INT(RC[-1]/1000) -> 2 | C173: 1 | D173: 1 | E173: =IF(RC[5]=1,"(每日重置)：",)&"活动期间累计充值"&RC[1]*10&"钻（%s/"&RC[1]*10&"）" -> 活动期间累计充值2000钻（%s/2000） | F173: 200 | H173: 1 | I173: 0 | J173: 0 | K173: 13334 | L173: 1
A174: 2040 | B174: =INT(RC[-1]/1000) -> 2 | C174: 1 | D174: 1 | E174: =IF(RC[5]=1,"(每日重置)：",)&"活动期间累计充值"&RC[1]*10&"钻（%s/"&RC[1]*10&"）" -> 活动期间累计充值3500钻（%s/3500） | F174: 350 | H174: 1 | I174: 0 | J174: 0 | K174: 13434|13435|10008 | L174: 1|1|400
A175: 2041 | B175: =INT(RC[-1]/1000) -> 2 | C175: 1 | D175: 1 | E175: =IF(RC[5]=1,"(每日重置)：",)&"活动期间累计充值"&RC[1]*10&"钻（%s/"&RC[1]*10&"）" -> 活动期间累计充值6000钻（%s/6000） | F175: 600 | H175: 1 | I175: 0 | J175: 0 | K175: 21403|10010 | L175: 1|300
A176: 2042 | B176: =INT(RC[-1]/1000) -> 2 | C176: 1 | D176: 1 | E176: =IF(RC[5]=1,"(每日重置)：",)&"活动期间累计充值"&RC[1]*10&"钻（%s/"&RC[1]*10&"）" -> 活动期间累计充值10000钻（%s/10000） | F176: 1000 | H176: 1 | I176: 0 | J176: 0 | K176: 13434|13333|13435|19017 | L176: 1|1|1|1188
A177: 2043 | B177: =INT(RC[-1]/1000) -> 2 | C177: 1 | D177: 1 | E177: =IF(RC[5]=1,"(每日重置)：",)&"活动期间累计充值"&RC[1]*10&"钻（%s/"&RC[1]*10&"）" -> 活动期间累计充值15000钻（%s/15000） | F177: 1500 | H177: 1 | I177: 0 | J177: 0 | K177: 20403|10022 | L177: 1|50
A178: 2044 | B178: =INT(RC[-1]/1000) -> 2 | C178: 1 | D178: 1 | E178: =IF(RC[5]=1,"(每日重置)：",)&"活动期间累计充值"&RC[1]*10&"钻（%s/"&RC[1]*10&"）" -> 活动期间累计充值20000钻（%s/20000） | F178: 2000 | H178: 1 | I178: 0 | J178: 0 | K178: 13434|13435|10008 | L178: 2|2|500
A179: 2045 | B179: =INT(RC[-1]/1000) -> 2 | C179: 1 | D179: 1 | E179: =IF(RC[5]=1,"(每日重置)：",)&"活动期间累计充值"&RC[1]*10&"钻（%s/"&RC[1]*10&"）" -> 活动期间累计充值30000钻（%s/30000） | F179: 3000 | H179: 1 | I179: 0 | J179: 0 | K179: 23403|10004 | L179: 1|666
A180: 2046 | B180: =INT(RC[-1]/1000) -> 2 | C180: 1 | D180: 1 | E180: =IF(RC[5]=1,"(每日重置)：",)&"活动期间累计充值"&RC[1]*10&"钻（%s/"&RC[1]*10&"）" -> 活动期间累计充值40000钻（%s/40000） | F180: 4000 | H180: 1 | I180: 0 | J180: 0 | K180: 13333|19006|10008 | L180: 2|2888|2000
A181: 2047 | B181: =INT(RC[-1]/1000) -> 2 | C181: 1 | D181: 1 | E181: =IF(RC[5]=1,"(每日重置)：",)&"活动期间累计充值"&RC[1]*10&"钻（%s/"&RC[1]*10&"）" -> 活动期间累计充值55000钻（%s/55000） | F181: 5500 | H181: 1 | I181: 0 | J181: 0 | K181: 22403|13434|19017 | L181: 1|3|2888
A182: 2048 | B182: =INT(RC[-1]/1000) -> 2 | C182: 1 | D182: 1 | E182: =IF(RC[5]=1,"(每日重置)：",)&"活动期间累计充值"&RC[1]*10&"钻（%s/"&RC[1]*10&"）" -> 活动期间累计充值60钻（%s/60） | F182: 6 | H182: 1 | I182: 0 | J182: 0 | K182: 19005 | L182: 300
A183: 2049 | B183: =INT(RC[-1]/1000) -> 2 | C183: 1 | D183: 1 | E183: =IF(RC[5]=1,"(每日重置)：",)&"活动期间累计充值"&RC[1]*10&"钻（%s/"&RC[1]*10&"）" -> 活动期间累计充值250钻（%s/250） | F183: 25 | H183: 1 | I183: 0 | J183: 0 | K183: 13329|10001|19103 | L183: 20|4|20
A184: 2050 | B184: =INT(RC[-1]/1000) -> 2 | C184: 1 | D184: 1 | E184: =IF(RC[5]=1,"(每日重置)：",)&"活动期间累计充值"&RC[1]*10&"钻（%s/"&RC[1]*10&"）" -> 活动期间累计充值500钻（%s/500） | F184: 50 | H184: 1 | I184: 0 | J184: 0 | K184: 13329|10000|19103 | L184: 20|4|30
A185: 2051 | B185: =INT(RC[-1]/1000) -> 2 | C185: 1 | D185: 1 | E185: =IF(RC[5]=1,"(每日重置)：",)&"活动期间累计充值"&RC[1]*10&"钻（%s/"&RC[1]*10&"）" -> 活动期间累计充值1000钻（%s/1000） | F185: 100 | H185: 1 | I185: 0 | J185: 0 | K185: 10014|19103 | L185: 50|50
A186: 2052 | B186: =INT(RC[-1]/1000) -> 2 | C186: 1 | D186: 1 | E186: =IF(RC[5]=1,"(每日重置)：",)&"活动期间累计充值"&RC[1]*10&"钻（%s/"&RC[1]*10&"）" -> 活动期间累计充值2000钻（%s/2000） | F186: 200 | H186: 1 | I186: 0 | J186: 0 | K186: 21401 | L186: 1
A187: 2053 | B187: =INT(RC[-1]/1000) -> 2 | C187: 1 | D187: 1 | E187: =IF(RC[5]=1,"(每日重置)：",)&"活动期间累计充值"&RC[1]*10&"钻（%s/"&RC[1]*10&"）" -> 活动期间累计充值4000钻（%s/4000） | F187: 400 | H187: 1 | I187: 0 | J187: 0 | K187: 13434|13435 | L187: 1|1
A188: 2054 | B188: =INT(RC[-1]/1000) -> 2 | C188: 1 | D188: 1 | E188: =IF(RC[5]=1,"(每日重置)：",)&"活动期间累计充值"&RC[1]*10&"钻（%s/"&RC[1]*10&"）" -> 活动期间累计充值8000钻（%s/8000） | F188: 800 | H188: 1 | I188: 0 | J188: 0 | K188: 23401|10035 | L188: 1|2
A189: 2055 | B189: =INT(RC[-1]/1000) -> 2 | C189: 1 | D189: 1 | E189: =IF(RC[5]=1,"(每日重置)：",)&"活动期间累计充值"&RC[1]*10&"钻（%s/"&RC[1]*10&"）" -> 活动期间累计充值15000钻（%s/15000） | F189: 1500 | H189: 1 | I189: 0 | J189: 0 | K189: 10014|10010 | L189: 300|1000
A190: 2056 | B190: =INT(RC[-1]/1000) -> 2 | C190: 1 | D190: 1 | E190: =IF(RC[5]=1,"(每日重置)：",)&"活动期间累计充值"&RC[1]*10&"钻（%s/"&RC[1]*10&"）" -> 活动期间累计充值30000钻（%s/30000） | F190: 3000 | H190: 1 | I190: 0 | J190: 0 | K190: 22401|10022 | L190: 1|200
A191: 2057 | B191: =INT(RC[-1]/1000) -> 2 | C191: 1 | D191: 1 | E191: =IF(RC[5]=1,"(每日重置)：",)&"活动期间累计充值"&RC[1]*10&"钻（%s/"&RC[1]*10&"）" -> 活动期间累计充值55000钻（%s/55000） | F191: 5500 | H191: 1 | I191: 0 | J191: 0 | K191: 20401|10035 | L191: 1|5
A192: 2058 | B192: =INT(RC[-1]/1000) -> 2 | C192: 1 | D192: 1 | E192: =IF(RC[5]=1,"(每日重置)：",)&"活动期间累计充值"&RC[1]*10&"钻（%s/"&RC[1]*10&"）" -> 活动期间累计充值60钻（%s/60） | F192: 6 | H192: 1 | I192: 0 | J192: 0 | K192: 10000|10001 | L192: 5|5
A193: 2059 | B193: =INT(RC[-1]/1000) -> 2 | C193: 1 | D193: 1 | E193: =IF(RC[5]=1,"(每日重置)：",)&"活动期间累计充值"&RC[1]*10&"钻（%s/"&RC[1]*10&"）" -> 活动期间累计充值250钻（%s/250） | F193: 25 | H193: 1 | I193: 0 | J193: 0 | K193: 10101|10001 | L193: 2|10
A194: 2060 | B194: =INT(RC[-1]/1000) -> 2 | C194: 1 | D194: 1 | E194: =IF(RC[5]=1,"(每日重置)：",)&"活动期间累计充值"&RC[1]*10&"钻（%s/"&RC[1]*10&"）" -> 活动期间累计充值500钻（%s/500） | F194: 50 | H194: 1 | I194: 0 | J194: 0 | K194: 10100|10000 | L194: 1|10
A195: 2061 | B195: =INT(RC[-1]/1000) -> 2 | C195: 1 | D195: 1 | E195: =IF(RC[5]=1,"(每日重置)：",)&"活动期间累计充值"&RC[1]*10&"钻（%s/"&RC[1]*10&"）" -> 活动期间累计充值1000钻（%s/1000） | F195: 100 | H195: 1 | I195: 0 | J195: 0 | K195: 13336 | L195: 1
A196: 2062 | B196: =INT(RC[-1]/1000) -> 2 | C196: 1 | D196: 1 | E196: =IF(RC[5]=1,"(每日重置)：",)&"活动期间累计充值"&RC[1]*10&"钻（%s/"&RC[1]*10&"）" -> 活动期间累计充值2000钻（%s/2000） | F196: 200 | H196: 1 | I196: 0 | J196: 0 | K196: 80011|10101|10014 | L196: 2|4|50
A197: 2063 | B197: =INT(RC[-1]/1000) -> 2 | C197: 1 | D197: 1 | E197: =IF(RC[5]=1,"(每日重置)：",)&"活动期间累计充值"&RC[1]*10&"钻（%s/"&RC[1]*10&"）" -> 活动期间累计充值3500钻（%s/3500） | F197: 350 | H197: 1 | I197: 0 | J197: 0 | K197: 80001|10101|10010 | L197: 2|6|300
A198: 2064 | B198: =INT(RC[-1]/1000) -> 2 | C198: 1 | D198: 1 | E198: =IF(RC[5]=1,"(每日重置)：",)&"活动期间累计充值"&RC[1]*10&"钻（%s/"&RC[1]*10&"）" -> 活动期间累计充值6000钻（%s/6000） | F198: 600 | H198: 1 | I198: 0 | J198: 0 | K198: 21405 | L198: 1
A199: 2065 | B199: =INT(RC[-1]/1000) -> 2 | C199: 1 | D199: 1 | E199: =IF(RC[5]=1,"(每日重置)：",)&"活动期间累计充值"&RC[1]*10&"钻（%s/"&RC[1]*10&"）" -> 活动期间累计充值10000钻（%s/10000） | F199: 1000 | H199: 1 | I199: 0 | J199: 0 | K199: 80100|10101 | L199: 1|18
A200: 2066 | B200: =INT(RC[-1]/1000) -> 2 | C200: 1 | D200: 1 | E200: =IF(RC[5]=1,"(每日重置)：",)&"活动期间累计充值"&RC[1]*10&"钻（%s/"&RC[1]*10&"）" -> 活动期间累计充值15000钻（%s/15000） | F200: 1500 | H200: 1 | I200: 0 | J200: 0 | K200: 20405|10014 | L200: 1|88
A201: 2067 | B201: =INT(RC[-1]/1000) -> 2 | C201: 1 | D201: 1 | E201: =IF(RC[5]=1,"(每日重置)：",)&"活动期间累计充值"&RC[1]*10&"钻（%s/"&RC[1]*10&"）" -> 活动期间累计充值20000钻（%s/20000） | F201: 2000 | H201: 1 | I201: 0 | J201: 0 | K201: 80100|10010 | L201: 2|400
A202: 2068 | B202: =INT(RC[-1]/1000) -> 2 | C202: 1 | D202: 1 | E202: =IF(RC[5]=1,"(每日重置)：",)&"活动期间累计充值"&RC[1]*10&"钻（%s/"&RC[1]*10&"）" -> 活动期间累计充值30000钻（%s/30000） | F202: 3000 | H202: 1 | I202: 0 | J202: 0 | K202: 23405|10101 | L202: 1|25
A203: 2069 | B203: =INT(RC[-1]/1000) -> 2 | C203: 1 | D203: 1 | E203: =IF(RC[5]=1,"(每日重置)：",)&"活动期间累计充值"&RC[1]*10&"钻（%s/"&RC[1]*10&"）" -> 活动期间累计充值40000钻（%s/40000） | F203: 4000 | H203: 1 | I203: 0 | J203: 0 | K203: 80100|10004 | L203: 2|666
A204: 2070 | B204: =INT(RC[-1]/1000) -> 2 | C204: 1 | D204: 1 | E204: =IF(RC[5]=1,"(每日重置)：",)&"活动期间累计充值"&RC[1]*10&"钻（%s/"&RC[1]*10&"）" -> 活动期间累计充值55000钻（%s/55000） | F204: 5500 | H204: 1 | I204: 0 | J204: 0 | K204: 22405|80101 | L204: 1|1
A205: 2071 | B205: =INT(RC[-1]/1000) -> 2 | C205: 1 | D205: 1 | E205: =IF(RC[5]=1,"(每日重置)：",)&"活动期间累计充值"&RC[1]*10&"钻（%s/"&RC[1]*10&"）" -> 活动期间累计充值60钻（%s/60） | F205: 6 | H205: 1 | I205: 0 | J205: 0 | K205: 19005 | L205: 300
A206: 2072 | B206: =INT(RC[-1]/1000) -> 2 | C206: 1 | D206: 1 | E206: =IF(RC[5]=1,"(每日重置)：",)&"活动期间累计充值"&RC[1]*10&"钻（%s/"&RC[1]*10&"）" -> 活动期间累计充值250钻（%s/250） | F206: 25 | H206: 1 | I206: 0 | J206: 0 | K206: 10003|19103 | L206: 200|20
A207: 2073 | B207: =INT(RC[-1]/1000) -> 2 | C207: 1 | D207: 1 | E207: =IF(RC[5]=1,"(每日重置)：",)&"活动期间累计充值"&RC[1]*10&"钻（%s/"&RC[1]*10&"）" -> 活动期间累计充值500钻（%s/500） | F207: 50 | H207: 1 | I207: 0 | J207: 0 | K207: 10003|19103 | L207: 500|30
A208: 2074 | B208: =INT(RC[-1]/1000) -> 2 | C208: 1 | D208: 1 | E208: =IF(RC[5]=1,"(每日重置)：",)&"活动期间累计充值"&RC[1]*10&"钻（%s/"&RC[1]*10&"）" -> 活动期间累计充值1000钻（%s/1000） | F208: 100 | H208: 1 | I208: 0 | J208: 0 | K208: 21401 | L208: 1
A209: 2075 | B209: =INT(RC[-1]/1000) -> 2 | C209: 1 | D209: 1 | E209: =IF(RC[5]=1,"(每日重置)：",)&"活动期间累计充值"&RC[1]*10&"钻（%s/"&RC[1]*10&"）" -> 活动期间累计充值2000钻（%s/2000） | F209: 200 | H209: 1 | I209: 0 | J209: 0 | K209: 22401|10022 | L209: 1|20
A210: 2076 | B210: =INT(RC[-1]/1000) -> 2 | C210: 1 | D210: 1 | E210: =IF(RC[5]=1,"(每日重置)：",)&"活动期间累计充值"&RC[1]*10&"钻（%s/"&RC[1]*10&"）" -> 活动期间累计充值3500钻（%s/3500） | F210: 350 | H210: 1 | I210: 0 | J210: 0 | K210: 23401|10022 | L210: 1|50
A211: 2077 | B211: =INT(RC[-1]/1000) -> 2 | C211: 1 | D211: 1 | E211: =IF(RC[5]=1,"(每日重置)：",)&"活动期间累计充值"&RC[1]*10&"钻（%s/"&RC[1]*10&"）" -> 活动期间累计充值6000钻（%s/6000） | F211: 600 | H211: 1 | I211: 0 | J211: 0 | K211: 20401|10022 | L211: 1|120
A212: 2078 | B212: =INT(RC[-1]/1000) -> 2 | C212: 1 | D212: 1 | E212: =IF(RC[5]=1,"(每日重置)：",)&"活动期间累计充值"&RC[1]*10&"钻（%s/"&RC[1]*10&"）" -> 活动期间累计充值10000钻（%s/10000） | F212: 1000 | H212: 1 | I212: 0 | J212: 0 | K212: 13417|10003 | L212: 1|1000
A213: 2079 | B213: =INT(RC[-1]/1000) -> 2 | C213: 1 | D213: 1 | E213: =IF(RC[5]=1,"(每日重置)：",)&"活动期间累计充值"&RC[1]*10&"钻（%s/"&RC[1]*10&"）" -> 活动期间累计充值15000钻（%s/15000） | F213: 1500 | H213: 1 | I213: 0 | J213: 0 | K213: 13397|10022|15011 | L213: 1|200|10
A214: 2080 | B214: =INT(RC[-1]/1000) -> 2 | C214: 1 | D214: 1 | E214: =IF(RC[5]=1,"(每日重置)：",)&"活动期间累计充值"&RC[1]*10&"钻（%s/"&RC[1]*10&"）" -> 活动期间累计充值20000钻（%s/20000） | F214: 2000 | H214: 1 | I214: 0 | J214: 0 | K214: 13397|10022|15011 | L214: 1|200|10
A215: 2081 | B215: =INT(RC[-1]/1000) -> 2 | C215: 1 | D215: 1 | E215: =IF(RC[5]=1,"(每日重置)：",)&"活动期间累计充值"&RC[1]*10&"钻（%s/"&RC[1]*10&"）" -> 活动期间累计充值25000钻（%s/25000） | F215: 2500 | H215: 1 | I215: 0 | J215: 0 | K215: 13397|10022|15011 | L215: 1|200|10
A216: 2082 | B216: =INT(RC[-1]/1000) -> 2 | C216: 1 | D216: 1 | E216: =IF(RC[5]=1,"(每日重置)：",)&"活动期间累计充值"&RC[1]*10&"钻（%s/"&RC[1]*10&"）" -> 活动期间累计充值30000钻（%s/30000） | F216: 3000 | H216: 1 | I216: 0 | J216: 0 | K216: 13397|10022|15011 | L216: 1|200|10
A217: 2083 | B217: =INT(RC[-1]/1000) -> 2 | C217: 1 | D217: 1 | E217: =IF(RC[5]=1,"(每日重置)：",)&"活动期间累计充值"&RC[1]*10&"钻（%s/"&RC[1]*10&"）" -> 活动期间累计充值40000钻（%s/40000） | F217: 4000 | H217: 1 | I217: 0 | J217: 0 | K217: 13398|10022|15011 | L217: 1|200|20
A218: 2084 | B218: =INT(RC[-1]/1000) -> 2 | C218: 1 | D218: 1 | E218: =IF(RC[5]=1,"(每日重置)：",)&"活动期间累计充值"&RC[1]*10&"钻（%s/"&RC[1]*10&"）" -> 活动期间累计充值50000钻（%s/50000） | F218: 5000 | H218: 1 | I218: 0 | J218: 0 | K218: 13417|13393|10022|15011 | L218: 1|1|200|30
A219: 2085 | B219: =INT(RC[-1]/1000) -> 2 | C219: 1 | D219: 1 | E219: =IF(RC[5]=1,"(每日重置)：",)&"活动期间累计充值"&RC[1]*10&"钻（%s/"&RC[1]*10&"）" -> 活动期间累计充值60钻（%s/60） | F219: 6 | H219: 1 | I219: 0 | J219: 0 | K219: 10004 | L219: 100
A220: 2086 | B220: =INT(RC[-1]/1000) -> 2 | C220: 1 | D220: 1 | E220: =IF(RC[5]=1,"(每日重置)：",)&"活动期间累计充值"&RC[1]*10&"钻（%s/"&RC[1]*10&"）" -> 活动期间累计充值250钻（%s/250） | F220: 25 | H220: 1 | I220: 0 | J220: 0 | K220: 10004 | L220: 300
A221: 2087 | B221: =INT(RC[-1]/1000) -> 2 | C221: 1 | D221: 1 | E221: =IF(RC[5]=1,"(每日重置)：",)&"活动期间累计充值"&RC[1]*10&"钻（%s/"&RC[1]*10&"）" -> 活动期间累计充值500钻（%s/500） | F221: 50 | H221: 1 | I221: 0 | J221: 0 | K221: 10004 | L221: 400
A222: 2088 | B222: =INT(RC[-1]/1000) -> 2 | C222: 1 | D222: 1 | E222: =IF(RC[5]=1,"(每日重置)：",)&"活动期间累计充值"&RC[1]*10&"钻（%s/"&RC[1]*10&"）" -> 活动期间累计充值1500钻（%s/1500） | F222: 150 | H222: 1 | I222: 0 | J222: 0 | K222: 22402 | L222: 1
A223: 2089 | B223: =INT(RC[-1]/1000) -> 2 | C223: 1 | D223: 1 | E223: =IF(RC[5]=1,"(每日重置)：",)&"活动期间累计充值"&RC[1]*10&"钻（%s/"&RC[1]*10&"）" -> 活动期间累计充值2880钻（%s/2880） | F223: 288 | H223: 1 | I223: 0 | J223: 0 | K223: 21402 | L223: 1
A224: 2090 | B224: =INT(RC[-1]/1000) -> 2 | C224: 1 | D224: 1 | E224: =IF(RC[5]=1,"(每日重置)：",)&"活动期间累计充值"&RC[1]*10&"钻（%s/"&RC[1]*10&"）" -> 活动期间累计充值4680钻（%s/4680） | F224: 468 | H224: 1 | I224: 0 | J224: 0 | K224: 20402 | L224: 1
A225: 2091 | B225: =INT(RC[-1]/1000) -> 2 | C225: 1 | D225: 1 | E225: =IF(RC[5]=1,"(每日重置)：",)&"活动期间累计充值"&RC[1]*10&"钻（%s/"&RC[1]*10&"）" -> 活动期间累计充值7680钻（%s/7680） | F225: 768 | H225: 1 | I225: 0 | J225: 0 | K225: 23402|15012 | L225: 1|30
A226: 2092 | B226: =INT(RC[-1]/1000) -> 2 | C226: 1 | D226: 1 | E226: =IF(RC[5]=1,"(每日重置)：",)&"活动期间累计充值"&RC[1]*10&"钻（%s/"&RC[1]*10&"）" -> 活动期间累计充值12000钻（%s/12000） | F226: 1200 | H226: 1 | I226: 0 | J226: 0 | K226: 13417|15012 | L226: 1|60
A227: 2093 | B227: =INT(RC[-1]/1000) -> 2 | C227: 1 | D227: 1 | E227: =IF(RC[5]=1,"(每日重置)：",)&"活动期间累计充值"&RC[1]*10&"钻（%s/"&RC[1]*10&"）" -> 活动期间累计充值16000钻（%s/16000） | F227: 1600 | H227: 1 | I227: 0 | J227: 0 | K227: 13392|13324|10010 | L227: 1|2|388
A228: 2094 | B228: =INT(RC[-1]/1000) -> 2 | C228: 1 | D228: 1 | E228: =IF(RC[5]=1,"(每日重置)：",)&"活动期间累计充值"&RC[1]*10&"钻（%s/"&RC[1]*10&"）" -> 活动期间累计充值20000钻（%s/20000） | F228: 2000 | H228: 1 | I228: 0 | J228: 0 | K228: 13392|13324|10010 | L228: 1|2|688
A229: 2095 | B229: =INT(RC[-1]/1000) -> 2 | C229: 1 | D229: 1 | E229: =IF(RC[5]=1,"(每日重置)：",)&"活动期间累计充值"&RC[1]*10&"钻（%s/"&RC[1]*10&"）" -> 活动期间累计充值25000钻（%s/25000） | F229: 2500 | H229: 1 | I229: 0 | J229: 0 | K229: 13392|13324|15012 | L229: 1|3|60
A230: 2096 | B230: =INT(RC[-1]/1000) -> 2 | C230: 1 | D230: 1 | E230: =IF(RC[5]=1,"(每日重置)：",)&"活动期间累计充值"&RC[1]*10&"钻（%s/"&RC[1]*10&"）" -> 活动期间累计充值30000钻（%s/30000） | F230: 3000 | H230: 1 | I230: 0 | J230: 0 | K230: 13392|13324|15012 | L230: 1|3|60
A231: 2097 | B231: =INT(RC[-1]/1000) -> 2 | C231: 1 | D231: 1 | E231: =IF(RC[5]=1,"(每日重置)：",)&"活动期间累计充值"&RC[1]*10&"钻（%s/"&RC[1]*10&"）" -> 活动期间累计充值40000钻（%s/40000） | F231: 4000 | H231: 1 | I231: 0 | J231: 0 | K231: 13393|13324|10010 | L231: 1|4|998
A232: 2098 | B232: =INT(RC[-1]/1000) -> 2 | C232: 1 | D232: 1 | E232: =IF(RC[5]=1,"(每日重置)：",)&"活动期间累计充值"&RC[1]*10&"钻（%s/"&RC[1]*10&"）" -> 活动期间累计充值50000钻（%s/50000） | F232: 5000 | H232: 1 | I232: 0 | J232: 0 | K232: 13417|13393|13324|10010 | L232: 1|1|4|998
A233: 2099 | B233: =INT(RC[-1]/1000) -> 2 | C233: 1 | D233: 1 | E233: =IF(RC[5]=1,"(每日重置)：",)&"活动期间累计充值"&RC[1]*10&"钻（%s/"&RC[1]*10&"）" -> 活动期间累计充值60钻（%s/60） | F233: 6 | H233: 1 | I233: 0 | J233: 0 | K233: 10000|10001 | L233: 5|5
A234: 2100 | B234: =INT(RC[-1]/1000) -> 2 | C234: 1 | D234: 1 | E234: =IF(RC[5]=1,"(每日重置)：",)&"活动期间累计充值"&RC[1]*10&"钻（%s/"&RC[1]*10&"）" -> 活动期间累计充值250钻（%s/250） | F234: 25 | H234: 1 | I234: 0 | J234: 0 | K234: 10101|10001 | L234: 2|10
A235: 2101 | B235: =INT(RC[-1]/1000) -> 2 | C235: 1 | D235: 1 | E235: =IF(RC[5]=1,"(每日重置)：",)&"活动期间累计充值"&RC[1]*10&"钻（%s/"&RC[1]*10&"）" -> 活动期间累计充值500钻（%s/500） | F235: 50 | H235: 1 | I235: 0 | J235: 0 | K235: 10100|10000 | L235: 1|10
A236: 2102 | B236: =INT(RC[-1]/1000) -> 2 | C236: 1 | D236: 1 | E236: =IF(RC[5]=1,"(每日重置)：",)&"活动期间累计充值"&RC[1]*10&"钻（%s/"&RC[1]*10&"）" -> 活动期间累计充值1000钻（%s/1000） | F236: 100 | H236: 1 | I236: 0 | J236: 0 | K236: 13336 | L236: 1
A237: 2103 | B237: =INT(RC[-1]/1000) -> 2 | C237: 1 | D237: 1 | E237: =IF(RC[5]=1,"(每日重置)：",)&"活动期间累计充值"&RC[1]*10&"钻（%s/"&RC[1]*10&"）" -> 活动期间累计充值2000钻（%s/2000） | F237: 200 | H237: 1 | I237: 0 | J237: 0 | K237: 80100 | L237: 1
A238: 2104 | B238: =INT(RC[-1]/1000) -> 2 | C238: 1 | D238: 1 | E238: =IF(RC[5]=1,"(每日重置)：",)&"活动期间累计充值"&RC[1]*10&"钻（%s/"&RC[1]*10&"）" -> 活动期间累计充值3500钻（%s/3500） | F238: 350 | H238: 1 | I238: 0 | J238: 0 | K238: 21405 | L238: 1
A239: 2105 | B239: =INT(RC[-1]/1000) -> 2 | C239: 1 | D239: 1 | E239: =IF(RC[5]=1,"(每日重置)：",)&"活动期间累计充值"&RC[1]*10&"钻（%s/"&RC[1]*10&"）" -> 活动期间累计充值6000钻（%s/6000） | F239: 600 | H239: 1 | I239: 0 | J239: 0 | K239: 20405|10101 | L239: 1|10
A240: 2106 | B240: =INT(RC[-1]/1000) -> 2 | C240: 1 | D240: 1 | E240: =IF(RC[5]=1,"(每日重置)：",)&"活动期间累计充值"&RC[1]*10&"钻（%s/"&RC[1]*10&"）" -> 活动期间累计充值10000钻（%s/10000） | F240: 1000 | H240: 1 | I240: 0 | J240: 0 | K240: 23405|10101 | L240: 1|20
A241: 2107 | B241: =INT(RC[-1]/1000) -> 2 | C241: 1 | D241: 1 | E241: =IF(RC[5]=1,"(每日重置)：",)&"活动期间累计充值"&RC[1]*10&"钻（%s/"&RC[1]*10&"）" -> 活动期间累计充值15000钻（%s/15000） | F241: 1500 | H241: 1 | I241: 0 | J241: 0 | K241: 22405|80100 | L241: 1|1
A242: 2108 | B242: =INT(RC[-1]/1000) -> 2 | C242: 1 | D242: 1 | E242: =IF(RC[5]=1,"(每日重置)：",)&"活动期间累计充值"&RC[1]*10&"钻（%s/"&RC[1]*10&"）" -> 活动期间累计充值20000钻（%s/20000） | F242: 2000 | H242: 1 | I242: 0 | J242: 0 | K242: 80100|10101 | L242: 1|30
A243: 2109 | B243: =INT(RC[-1]/1000) -> 2 | C243: 1 | D243: 1 | E243: =IF(RC[5]=1,"(每日重置)：",)&"活动期间累计充值"&RC[1]*10&"钻（%s/"&RC[1]*10&"）" -> 活动期间累计充值25000钻（%s/25000） | F243: 2500 | H243: 1 | I243: 0 | J243: 0 | K243: 80100|10101 | L243: 1|30
A244: 2110 | B244: =INT(RC[-1]/1000) -> 2 | C244: 1 | D244: 1 | E244: =IF(RC[5]=1,"(每日重置)：",)&"活动期间累计充值"&RC[1]*10&"钻（%s/"&RC[1]*10&"）" -> 活动期间累计充值30000钻（%s/30000） | F244: 3000 | H244: 1 | I244: 0 | J244: 0 | K244: 80100|10101 | L244: 1|30
A245: 2111 | B245: =INT(RC[-1]/1000) -> 2 | C245: 1 | D245: 1 | E245: =IF(RC[5]=1,"(每日重置)：",)&"活动期间累计充值"&RC[1]*10&"钻（%s/"&RC[1]*10&"）" -> 活动期间累计充值40000钻（%s/40000） | F245: 4000 | H245: 1 | I245: 0 | J245: 0 | K245: 80101|10101 | L245: 1|35
A246: 2112 | B246: =INT(RC[-1]/1000) -> 2 | C246: 1 | D246: 1 | E246: =IF(RC[5]=1,"(每日重置)：",)&"活动期间累计充值"&RC[1]*10&"钻（%s/"&RC[1]*10&"）" -> 活动期间累计充值50000钻（%s/50000） | F246: 5000 | H246: 1 | I246: 0 | J246: 0 | K246: 80101|10101 | L246: 1|35
A247: 2113 | B247: =INT(RC[-1]/1000) -> 2 | C247: 1 | D247: 1 | E247: =IF(RC[5]=1,"(每日重置)：",)&"活动期间累计充值"&RC[1]*10&"钻（%s/"&RC[1]*10&"）" -> 活动期间累计充值60钻（%s/60） | F247: 6 | H247: 1 | I247: 0 | J247: 0 | K247: 10000|10001 | L247: 5|5
A248: 2114 | B248: =INT(RC[-1]/1000) -> 2 | C248: 1 | D248: 1 | E248: =IF(RC[5]=1,"(每日重置)：",)&"活动期间累计充值"&RC[1]*10&"钻（%s/"&RC[1]*10&"）" -> 活动期间累计充值250钻（%s/250） | F248: 25 | H248: 1 | I248: 0 | J248: 0 | K248: 42301|10001 | L248: 2|10
A249: 2115 | B249: =INT(RC[-1]/1000) -> 2 | C249: 1 | D249: 1 | E249: =IF(RC[5]=1,"(每日重置)：",)&"活动期间累计充值"&RC[1]*10&"钻（%s/"&RC[1]*10&"）" -> 活动期间累计充值500钻（%s/500） | F249: 50 | H249: 1 | I249: 0 | J249: 0 | K249: 33400|10000 | L249: 8|10
A250: 2116 | B250: =INT(RC[-1]/1000) -> 2 | C250: 1 | D250: 1 | E250: =IF(RC[5]=1,"(每日重置)：",)&"活动期间累计充值"&RC[1]*10&"钻（%s/"&RC[1]*10&"）" -> 活动期间累计充值1000钻（%s/1000） | F250: 100 | H250: 1 | I250: 0 | J250: 0 | K250: 10022|13320 | L250: 40|10
A251: 2117 | B251: =INT(RC[-1]/1000) -> 2 | C251: 1 | D251: 1 | E251: =IF(RC[5]=1,"(每日重置)：",)&"活动期间累计充值"&RC[1]*10&"钻（%s/"&RC[1]*10&"）" -> 活动期间累计充值2000钻（%s/2000） | F251: 200 | H251: 1 | I251: 0 | J251: 0 | K251: 13334 | L251: 1
A252: 2118 | B252: =INT(RC[-1]/1000) -> 2 | C252: 1 | D252: 1 | E252: =IF(RC[5]=1,"(每日重置)：",)&"活动期间累计充值"&RC[1]*10&"钻（%s/"&RC[1]*10&"）" -> 活动期间累计充值3500钻（%s/3500） | F252: 350 | H252: 1 | I252: 0 | J252: 0 | K252: 20403 | L252: 1
A253: 2119 | B253: =INT(RC[-1]/1000) -> 2 | C253: 1 | D253: 1 | E253: =IF(RC[5]=1,"(每日重置)：",)&"活动期间累计充值"&RC[1]*10&"钻（%s/"&RC[1]*10&"）" -> 活动期间累计充值6000钻（%s/6000） | F253: 600 | H253: 1 | I253: 0 | J253: 0 | K253: 21403|13435 | L253: 1|1
A254: 2120 | B254: =INT(RC[-1]/1000) -> 2 | C254: 1 | D254: 1 | E254: =IF(RC[5]=1,"(每日重置)：",)&"活动期间累计充值"&RC[1]*10&"钻（%s/"&RC[1]*10&"）" -> 活动期间累计充值10000钻（%s/10000） | F254: 1000 | H254: 1 | I254: 0 | J254: 0 | K254: 22403|13434|10008 | L254: 1|1|500
A255: 2121 | B255: =INT(RC[-1]/1000) -> 2 | C255: 1 | D255: 1 | E255: =IF(RC[5]=1,"(每日重置)：",)&"活动期间累计充值"&RC[1]*10&"钻（%s/"&RC[1]*10&"）" -> 活动期间累计充值15000钻（%s/15000） | F255: 1500 | H255: 1 | I255: 0 | J255: 0 | K255: 23403|13434|13435 | L255: 1|1|1
A256: 2122 | B256: =INT(RC[-1]/1000) -> 2 | C256: 1 | D256: 1 | E256: =IF(RC[5]=1,"(每日重置)：",)&"活动期间累计充值"&RC[1]*10&"钻（%s/"&RC[1]*10&"）" -> 活动期间累计充值20000钻（%s/20000） | F256: 2000 | H256: 1 | I256: 0 | J256: 0 | K256: 10008|13017 | L256: 1688|30
A257: 2123 | B257: =INT(RC[-1]/1000) -> 2 | C257: 1 | D257: 1 | E257: =IF(RC[5]=1,"(每日重置)：",)&"活动期间累计充值"&RC[1]*10&"钻（%s/"&RC[1]*10&"）" -> 活动期间累计充值25000钻（%s/25000） | F257: 2500 | H257: 1 | I257: 0 | J257: 0 | K257: 10008|13017 | L257: 1688|30
A258: 2124 | B258: =INT(RC[-1]/1000) -> 2 | C258: 1 | D258: 1 | E258: =IF(RC[5]=1,"(每日重置)：",)&"活动期间累计充值"&RC[1]*10&"钻（%s/"&RC[1]*10&"）" -> 活动期间累计充值30000钻（%s/30000） | F258: 3000 | H258: 1 | I258: 0 | J258: 0 | K258: 10008|13017 | L258: 1688|30
A259: 2125 | B259: =INT(RC[-1]/1000) -> 2 | C259: 1 | D259: 1 | E259: =IF(RC[5]=1,"(每日重置)：",)&"活动期间累计充值"&RC[1]*10&"钻（%s/"&RC[1]*10&"）" -> 活动期间累计充值40000钻（%s/40000） | F259: 4000 | H259: 1 | I259: 0 | J259: 0 | K259: 10008|13017 | L259: 2888|50
A260: 2126 | B260: =INT(RC[-1]/1000) -> 2 | C260: 1 | D260: 1 | E260: =IF(RC[5]=1,"(每日重置)：",)&"活动期间累计充值"&RC[1]*10&"钻（%s/"&RC[1]*10&"）" -> 活动期间累计充值50000钻（%s/50000） | F260: 5000 | H260: 1 | I260: 0 | J260: 0 | K260: 10008|13017 | L260: 2888|50
A261: 2127 | B261: =INT(RC[-1]/1000) -> 2 | C261: 1 | D261: 1 | E261: =IF(RC[5]=1,"(每日重置)：",)&"活动期间累计充值"&RC[1]*10&"钻（%s/"&RC[1]*10&"）" -> 活动期间累计充值250钻（%s/250） | F261: 25 | H261: 1 | I261: 0 | J261: 0 | K261: 10000|10002 | L261: 2|100
A262: 2128 | B262: =INT(RC[-1]/1000) -> 2 | C262: 1 | D262: 1 | E262: =IF(RC[5]=1,"(每日重置)：",)&"活动期间累计充值"&RC[1]*10&"钻（%s/"&RC[1]*10&"）" -> 活动期间累计充值750钻（%s/750） | F262: 75 | H262: 1 | I262: 0 | J262: 0 | K262: 10019|10001|10002 | L262: 3|2|200
A263: 2129 | B263: =INT(RC[-1]/1000) -> 2 | C263: 1 | D263: 1 | E263: =IF(RC[5]=1,"(每日重置)：",)&"活动期间累计充值"&RC[1]*10&"钻（%s/"&RC[1]*10&"）" -> 活动期间累计充值2500钻（%s/2500） | F263: 250 | H263: 1 | I263: 0 | J263: 0 | K263: 13379|19103|10002 | L263: 1|20|300
A264: 2130 | B264: =INT(RC[-1]/1000) -> 2 | C264: 1 | D264: 1 | E264: =IF(RC[5]=1,"(每日重置)：",)&"活动期间累计充值"&RC[1]*10&"钻（%s/"&RC[1]*10&"）" -> 活动期间累计充值5000钻（%s/5000） | F264: 500 | H264: 1 | I264: 0 | J264: 0 | K264: 13324|19103|10003 | L264: 1|50|200
A265: 2131 | B265: =INT(RC[-1]/1000) -> 2 | C265: 1 | D265: 1 | E265: =IF(RC[5]=1,"(每日重置)：",)&"活动期间累计充值"&RC[1]*10&"钻（%s/"&RC[1]*10&"）" -> 活动期间累计充值12500钻（%s/12500） | F265: 1250 | H265: 1 | I265: 0 | J265: 0 | K265: 31540|19006|10003 | L265: 1|500|300
A266: 2132 | B266: =INT(RC[-1]/1000) -> 2 | C266: 1 | D266: 1 | E266: =IF(RC[5]=1,"(每日重置)：",)&"活动期间累计充值"&RC[1]*10&"钻（%s/"&RC[1]*10&"）" -> 活动期间累计充值25000钻（%s/25000） | F266: 2500 | H266: 1 | I266: 0 | J266: 0 | K266: 31540|19006|10014 | L266: 1|1000|50
A267: 2133 | B267: =INT(RC[-1]/1000) -> 2 | C267: 1 | D267: 1 | E267: =IF(RC[5]=1,"(每日重置)：",)&"活动期间累计充值"&RC[1]*10&"钻（%s/"&RC[1]*10&"）" -> 活动期间累计充值37500钻（%s/37500） | F267: 3750 | H267: 1 | I267: 0 | J267: 0 | K267: 31540|13392|10014 | L267: 1|1|80
A268: 2134 | B268: =INT(RC[-1]/1000) -> 2 | C268: 1 | D268: 1 | E268: =IF(RC[5]=1,"(每日重置)：",)&"活动期间累计充值"&RC[1]*10&"钻（%s/"&RC[1]*10&"）" -> 活动期间累计充值50000钻（%s/50000） | F268: 5000 | H268: 1 | I268: 0 | J268: 0 | K268: 13417|13392|10004 | L268: 1|1|100
A269: 2135 | B269: =INT(RC[-1]/1000) -> 2 | C269: 1 | D269: 1 | E269: =IF(RC[5]=1,"(每日重置)：",)&"活动期间累计充值"&RC[1]*10&"钻（%s/"&RC[1]*10&"）" -> 活动期间累计充值75000钻（%s/75000） | F269: 7500 | H269: 1 | I269: 0 | J269: 0 | K269: 13417|13392|10004 | L269: 1|2|300
A270: 2136 | B270: =INT(RC[-1]/1000) -> 2 | C270: 1 | D270: 1 | E270: =IF(RC[5]=1,"(每日重置)：",)&"活动期间累计充值"&RC[1]*10&"钻（%s/"&RC[1]*10&"）" -> 活动期间累计充值100000钻（%s/100000） | F270: 10000 | H270: 1 | I270: 0 | J270: 0 | K270: 15011|13646|10010 | L270: 90|50|1000
A271: 2137 | B271: =INT(RC[-1]/1000) -> 2 | C271: 1 | D271: 1 | E271: =IF(RC[5]=1,"(每日重置)：",)&"活动期间累计充值"&RC[1]*10&"钻（%s/"&RC[1]*10&"）" -> 活动期间累计充值125000钻（%s/125000） | F271: 12500 | H271: 1 | I271: 0 | J271: 0 | K271: 15011|13646|10014 | L271: 120|80|300
A272: 2141 | B272: =INT(RC[-1]/1000) -> 2 | C272: 1 | D272: 1 | E272: =IF(RC[5]=1,"(每日重置)：",)&"活动期间累计充值"&RC[1]*10&"钻（%s/"&RC[1]*10&"）" -> 活动期间累计充值60钻（%s/60） | F272: 6 | H272: 1 | I272: 0 | J272: 0 | K272: 19005 | L272: 300
A273: 2142 | B273: =INT(RC[-1]/1000) -> 2 | C273: 1 | D273: 1 | E273: =IF(RC[5]=1,"(每日重置)：",)&"活动期间累计充值"&RC[1]*10&"钻（%s/"&RC[1]*10&"）" -> 活动期间累计充值300钻（%s/300） | F273: 30 | H273: 1 | I273: 0 | J273: 0 | K273: 10019|19103 | L273: 3|20
A274: 2143 | B274: =INT(RC[-1]/1000) -> 2 | C274: 1 | D274: 1 | E274: =IF(RC[5]=1,"(每日重置)：",)&"活动期间累计充值"&RC[1]*10&"钻（%s/"&RC[1]*10&"）" -> 活动期间累计充值1000钻（%s/1000） | F274: 100 | H274: 1 | I274: 0 | J274: 0 | K274: 10019|10021 | L274: 7|40
A275: 2144 | B275: =INT(RC[-1]/1000) -> 2 | C275: 1 | D275: 1 | E275: =IF(RC[5]=1,"(每日重置)：",)&"活动期间累计充值"&RC[1]*10&"钻（%s/"&RC[1]*10&"）" -> 活动期间累计充值2000钻（%s/2000） | F275: 200 | H275: 1 | I275: 0 | J275: 0 | K275: 13316|19006|10003 | L275: 2|1500|200
A276: 2145 | B276: =INT(RC[-1]/1000) -> 2 | C276: 1 | D276: 1 | E276: =IF(RC[5]=1,"(每日重置)：",)&"活动期间累计充值"&RC[1]*10&"钻（%s/"&RC[1]*10&"）" -> 活动期间累计充值3500钻（%s/3500） | F276: 350 | H276: 1 | I276: 0 | J276: 0 | K276: 13380|19103 | L276: 1|300
A277: 2146 | B277: =INT(RC[-1]/1000) -> 2 | C277: 1 | D277: 1 | E277: =IF(RC[5]=1,"(每日重置)：",)&"活动期间累计充值"&RC[1]*10&"钻（%s/"&RC[1]*10&"）" -> 活动期间累计充值5000钻（%s/5000） | F277: 500 | H277: 1 | I277: 0 | J277: 0 | K277: 13379|13401|10003 | L277: 1|20|500
A278: 2147 | B278: =INT(RC[-1]/1000) -> 2 | C278: 1 | D278: 1 | E278: =IF(RC[5]=1,"(每日重置)：",)&"活动期间累计充值"&RC[1]*10&"钻（%s/"&RC[1]*10&"）" -> 活动期间累计充值7000钻（%s/7000） | F278: 700 | H278: 1 | I278: 0 | J278: 0 | K278: 13401|13397|19103 | L278: 30|1|500
A279: 2148 | B279: =INT(RC[-1]/1000) -> 2 | C279: 1 | D279: 1 | E279: =IF(RC[5]=1,"(每日重置)：",)&"活动期间累计充值"&RC[1]*10&"钻（%s/"&RC[1]*10&"）" -> 活动期间累计充值10000钻（%s/10000） | F279: 1000 | H279: 1 | I279: 0 | J279: 0 | K279: 13401|10014|15011 | L279: 40|360|10
A280: 2149 | B280: =INT(RC[-1]/1000) -> 2 | C280: 1 | D280: 1 | E280: =IF(RC[5]=1,"(每日重置)：",)&"活动期间累计充值"&RC[1]*10&"钻（%s/"&RC[1]*10&"）" -> 活动期间累计充值15000钻（%s/15000） | F280: 1500 | H280: 1 | I280: 0 | J280: 0 | K280: 13401|10022|15011 | L280: 70|160|20
A281: 2150 | B281: =INT(RC[-1]/1000) -> 2 | C281: 1 | D281: 1 | E281: =IF(RC[5]=1,"(每日重置)：",)&"活动期间累计充值"&RC[1]*10&"钻（%s/"&RC[1]*10&"）" -> 活动期间累计充值20000钻（%s/20000） | F281: 2000 | H281: 1 | I281: 0 | J281: 0 | K281: 10022|15011 | L281: 200|30
A282: 2151 | B282: =INT(RC[-1]/1000) -> 2 | C282: 1 | D282: 1 | E282: =IF(RC[5]=1,"(每日重置)：",)&"活动期间累计充值"&RC[1]*10&"钻（%s/"&RC[1]*10&"）" -> 活动期间累计充值25000钻（%s/25000） | F282: 2500 | H282: 1 | I282: 0 | J282: 0 | K282: 13401|10022|15011 | L282: 80|180|30
A283: 2152 | B283: =INT(RC[-1]/1000) -> 2 | C283: 1 | D283: 1 | E283: =IF(RC[5]=1,"(每日重置)：",)&"活动期间累计充值"&RC[1]*10&"钻（%s/"&RC[1]*10&"）" -> 活动期间累计充值30000钻（%s/30000） | F283: 3000 | H283: 1 | I283: 0 | J283: 0 | K283: 10022|15011 | L283: 240|30
A284: 2153 | B284: =INT(RC[-1]/1000) -> 2 | C284: 1 | D284: 1 | E284: =IF(RC[5]=1,"(每日重置)：",)&"活动期间累计充值"&RC[1]*10&"钻（%s/"&RC[1]*10&"）" -> 活动期间累计充值40000钻（%s/40000） | F284: 4000 | H284: 1 | I284: 0 | J284: 0 | K284: 13401|10022|15011 | L284: 80|300|60
A285: 2154 | B285: =INT(RC[-1]/1000) -> 2 | C285: 1 | D285: 1 | E285: =IF(RC[5]=1,"(每日重置)：",)&"活动期间累计充值"&RC[1]*10&"钻（%s/"&RC[1]*10&"）" -> 活动期间累计充值50000钻（%s/50000） | F285: 5000 | H285: 1 | I285: 0 | J285: 0 | K285: 10022 | L285: 500
A286: 2155 | B286: =INT(RC[-1]/1000) -> 2 | C286: 1 | D286: 1 | E286: =IF(RC[5]=1,"(每日重置)：",)&"活动期间累计充值"&RC[1]*10&"钻（%s/"&RC[1]*10&"）" -> 活动期间累计充值250钻（%s/250） | F286: 25 | H286: 1 | I286: 0 | J286: 0 | K286: 80010|80000 | L286: 1|1
A287: 2156 | B287: =INT(RC[-1]/1000) -> 2 | C287: 1 | D287: 1 | E287: =IF(RC[5]=1,"(每日重置)：",)&"活动期间累计充值"&RC[1]*10&"钻（%s/"&RC[1]*10&"）" -> 活动期间累计充值750钻（%s/750） | F287: 75 | H287: 1 | I287: 0 | J287: 0 | K287: 13379|10100 | L287: 1|2
A288: 2157 | B288: =INT(RC[-1]/1000) -> 2 | C288: 1 | D288: 1 | E288: =IF(RC[5]=1,"(每日重置)：",)&"活动期间累计充值"&RC[1]*10&"钻（%s/"&RC[1]*10&"）" -> 活动期间累计充值2500钻（%s/2500） | F288: 250 | H288: 1 | I288: 0 | J288: 0 | K288: 13379|19103|10003 | L288: 1|20|100
A289: 2158 | B289: =INT(RC[-1]/1000) -> 2 | C289: 1 | D289: 1 | E289: =IF(RC[5]=1,"(每日重置)：",)&"活动期间累计充值"&RC[1]*10&"钻（%s/"&RC[1]*10&"）" -> 活动期间累计充值5000钻（%s/5000） | F289: 500 | H289: 1 | I289: 0 | J289: 0 | K289: 31540|19103|10003 | L289: 1|50|200
A290: 2159 | B290: =INT(RC[-1]/1000) -> 2 | C290: 1 | D290: 1 | E290: =IF(RC[5]=1,"(每日重置)：",)&"活动期间累计充值"&RC[1]*10&"钻（%s/"&RC[1]*10&"）" -> 活动期间累计充值12500钻（%s/12500） | F290: 1250 | H290: 1 | I290: 0 | J290: 0 | K290: 31540|13392|10004 | L290: 1|1|100
A291: 2160 | B291: =INT(RC[-1]/1000) -> 2 | C291: 1 | D291: 1 | E291: =IF(RC[5]=1,"(每日重置)：",)&"活动期间累计充值"&RC[1]*10&"钻（%s/"&RC[1]*10&"）" -> 活动期间累计充值25000钻（%s/25000） | F291: 2500 | H291: 1 | I291: 0 | J291: 0 | K291: 31540|80100|13392|19030 | L291: 1|1|1|5000
A292: 2161 | B292: =INT(RC[-1]/1000) -> 2 | C292: 1 | D292: 1 | E292: =IF(RC[5]=1,"(每日重置)：",)&"活动期间累计充值"&RC[1]*10&"钻（%s/"&RC[1]*10&"）" -> 活动期间累计充值37500钻（%s/37500） | F292: 3750 | H292: 1 | I292: 0 | J292: 0 | K292: 13417|80100|13324|19030 | L292: 1|1|2|5000
A293: 2162 | B293: =INT(RC[-1]/1000) -> 2 | C293: 1 | D293: 1 | E293: =IF(RC[5]=1,"(每日重置)：",)&"活动期间累计充值"&RC[1]*10&"钻（%s/"&RC[1]*10&"）" -> 活动期间累计充值50000钻（%s/50000） | F293: 5000 | H293: 1 | I293: 0 | J293: 0 | K293: 13417|13324|10010|10014 | L293: 1|2|300|200
A294: 2163 | B294: =INT(RC[-1]/1000) -> 2 | C294: 1 | D294: 1 | E294: =IF(RC[5]=1,"(每日重置)：",)&"活动期间累计充值"&RC[1]*10&"钻（%s/"&RC[1]*10&"）" -> 活动期间累计充值75000钻（%s/75000） | F294: 7500 | H294: 1 | I294: 0 | J294: 0 | K294: 13417|13017|10010|10014 | L294: 2|20|1000|500
A295: 2164 | B295: =INT(RC[-1]/1000) -> 2 | C295: 1 | D295: 1 | E295: =IF(RC[5]=1,"(每日重置)：",)&"活动期间累计充值"&RC[1]*10&"钻（%s/"&RC[1]*10&"）" -> 活动期间累计充值100000钻（%s/100000） | F295: 10000 | H295: 1 | I295: 0 | J295: 0 | K295: 80101|15012|13017|10014 | L295: 1|90|20|500
A296: 2165 | B296: =INT(RC[-1]/1000) -> 2 | C296: 1 | D296: 1 | E296: =IF(RC[5]=1,"(每日重置)：",)&"活动期间累计充值"&RC[1]*10&"钻（%s/"&RC[1]*10&"）" -> 活动期间累计充值125000钻（%s/125000） | F296: 12500 | H296: 1 | I296: 0 | J296: 0 | K296: 80101|15012|13017|10014 | L296: 1|120|25|500
A297: 2169 | B297: =INT(RC[-1]/1000) -> 2 | C297: 1 | D297: 1 | E297: =IF(RC[5]=1,"(每日重置)：",)&"活动期间累计充值"&RC[1]*10&"钻（%s/"&RC[1]*10&"）" -> 活动期间累计充值250钻（%s/250） | F297: 25 | H297: 1 | I297: 0 | J297: 0 | K297: 10000|10008 | L297: 3|100
A298: 2170 | B298: =INT(RC[-1]/1000) -> 2 | C298: 1 | D298: 1 | E298: =IF(RC[5]=1,"(每日重置)：",)&"活动期间累计充值"&RC[1]*10&"钻（%s/"&RC[1]*10&"）" -> 活动期间累计充值750钻（%s/750） | F298: 75 | H298: 1 | I298: 0 | J298: 0 | K298: 10001|13015|10008 | L298: 5|10|300
A299: 2171 | B299: =INT(RC[-1]/1000) -> 2 | C299: 1 | D299: 1 | E299: =IF(RC[5]=1,"(每日重置)：",)&"活动期间累计充值"&RC[1]*10&"钻（%s/"&RC[1]*10&"）" -> 活动期间累计充值2500钻（%s/2500） | F299: 250 | H299: 1 | I299: 0 | J299: 0 | K299: 10116|10010|13015 | L299: 50|300|20
A300: 2172 | B300: =INT(RC[-1]/1000) -> 2 | C300: 1 | D300: 1 | E300: =IF(RC[5]=1,"(每日重置)：",)&"活动期间累计充值"&RC[1]*10&"钻（%s/"&RC[1]*10&"）" -> 活动期间累计充值5000钻（%s/5000） | F300: 500 | H300: 1 | I300: 0 | J300: 0 | K300: 31540|10116|19103 | L300: 1|50|50
A301: 2173 | B301: =INT(RC[-1]/1000) -> 2 | C301: 1 | D301: 1 | E301: =IF(RC[5]=1,"(每日重置)：",)&"活动期间累计充值"&RC[1]*10&"钻（%s/"&RC[1]*10&"）" -> 活动期间累计充值12500钻（%s/12500） | F301: 1250 | H301: 1 | I301: 0 | J301: 0 | K301: 31540|10116|80100 | L301: 1|100|1
A302: 2174 | B302: =INT(RC[-1]/1000) -> 2 | C302: 1 | D302: 1 | E302: =IF(RC[5]=1,"(每日重置)：",)&"活动期间累计充值"&RC[1]*10&"钻（%s/"&RC[1]*10&"）" -> 活动期间累计充值25000钻（%s/25000） | F302: 2500 | H302: 1 | I302: 0 | J302: 0 | K302: 13417|10116|80100|13016 | L302: 1|100|1|20
A303: 2175 | B303: =INT(RC[-1]/1000) -> 2 | C303: 1 | D303: 1 | E303: =IF(RC[5]=1,"(每日重置)：",)&"活动期间累计充值"&RC[1]*10&"钻（%s/"&RC[1]*10&"）" -> 活动期间累计充值37500钻（%s/37500） | F303: 3750 | H303: 1 | I303: 0 | J303: 0 | K303: 13417|10116|13324|13016 | L303: 1|100|2|30
A304: 2176 | B304: =INT(RC[-1]/1000) -> 2 | C304: 1 | D304: 1 | E304: =IF(RC[5]=1,"(每日重置)：",)&"活动期间累计充值"&RC[1]*10&"钻（%s/"&RC[1]*10&"）" -> 活动期间累计充值50000钻（%s/50000） | F304: 5000 | H304: 1 | I304: 0 | J304: 0 | K304: 13418|13324|13017|10008 | L304: 1|2|30|800
A305: 2177 | B305: =INT(RC[-1]/1000) -> 2 | C305: 1 | D305: 1 | E305: =IF(RC[5]=1,"(每日重置)：",)&"活动期间累计充值"&RC[1]*10&"钻（%s/"&RC[1]*10&"）" -> 活动期间累计充值75000钻（%s/75000） | F305: 7500 | H305: 1 | I305: 0 | J305: 0 | K305: 13418|80101|13017|10008 | L305: 1|1|50|1000
A306: 2178 | B306: =INT(RC[-1]/1000) -> 2 | C306: 1 | D306: 1 | E306: =IF(RC[5]=1,"(每日重置)：",)&"活动期间累计充值"&RC[1]*10&"钻（%s/"&RC[1]*10&"）" -> 活动期间累计充值100000钻（%s/100000） | F306: 10000 | H306: 1 | I306: 0 | J306: 0 | K306: 13418|13324|13017|10008 | L306: 2|3|50|1000
A307: 2179 | B307: =INT(RC[-1]/1000) -> 2 | C307: 1 | D307: 1 | E307: =IF(RC[5]=1,"(每日重置)：",)&"活动期间累计充值"&RC[1]*10&"钻（%s/"&RC[1]*10&"）" -> 活动期间累计充值125000钻（%s/125000） | F307: 12500 | H307: 1 | I307: 0 | J307: 0 | K307: 13418|13324|13017|10008 | L307: 2|4|60|1100
A308: 2183 | B308: =INT(RC[-1]/1000) -> 2 | C308: 1 | D308: 1 | E308: =IF(RC[5]=1,"(每日重置)：",)&"活动期间累计充值"&RC[1]*10&"钻（%s/"&RC[1]*10&"）" -> 活动期间累计充值60钻（%s/60） | F308: 6 | H308: 1 | I308: 0 | J308: 0 | K308: 13599|10022 | L308: 5|40
A309: 2184 | B309: =INT(RC[-1]/1000) -> 2 | C309: 1 | D309: 1 | E309: =IF(RC[5]=1,"(每日重置)：",)&"活动期间累计充值"&RC[1]*10&"钻（%s/"&RC[1]*10&"）" -> 活动期间累计充值250钻（%s/250） | F309: 25 | H309: 1 | I309: 0 | J309: 0 | K309: 13599|10022 | L309: 15|80
A310: 2185 | B310: =INT(RC[-1]/1000) -> 2 | C310: 1 | D310: 1 | E310: =IF(RC[5]=1,"(每日重置)：",)&"活动期间累计充值"&RC[1]*10&"钻（%s/"&RC[1]*10&"）" -> 活动期间累计充值500钻（%s/500） | F310: 50 | H310: 1 | I310: 0 | J310: 0 | K310: 13599|10022 | L310: 30|120
A311: 2186 | B311: =INT(RC[-1]/1000) -> 2 | C311: 1 | D311: 1 | E311: =IF(RC[5]=1,"(每日重置)：",)&"活动期间累计充值"&RC[1]*10&"钻（%s/"&RC[1]*10&"）" -> 活动期间累计充值1000钻（%s/1000） | F311: 100 | H311: 1 | I311: 0 | J311: 0 | K311: 13599|10022 | L311: 50|160
A312: 2187 | B312: =INT(RC[-1]/1000) -> 2 | C312: 1 | D312: 1 | E312: =IF(RC[5]=1,"(每日重置)：",)&"活动期间累计充值"&RC[1]*10&"钻（%s/"&RC[1]*10&"）" -> 活动期间累计充值2000钻（%s/2000） | F312: 200 | H312: 1 | I312: 0 | J312: 0 | K312: 13599|10022 | L312: 80|200
A313: 2188 | B313: =INT(RC[-1]/1000) -> 2 | C313: 1 | D313: 1 | E313: =IF(RC[5]=1,"(每日重置)：",)&"活动期间累计充值"&RC[1]*10&"钻（%s/"&RC[1]*10&"）" -> 活动期间累计充值3500钻（%s/3500） | F313: 350 | H313: 1 | I313: 0 | J313: 0 | K313: 13599|13401|10022 | L313: 120|60|240
A314: 2189 | B314: =INT(RC[-1]/1000) -> 2 | C314: 1 | D314: 1 | E314: =IF(RC[5]=1,"(每日重置)：",)&"活动期间累计充值"&RC[1]*10&"钻（%s/"&RC[1]*10&"）" -> 活动期间累计充值5000钻（%s/5000） | F314: 500 | H314: 1 | I314: 0 | J314: 0 | K314: 13599|13401|13596 | L314: 120|100|20
A315: 2190 | B315: =INT(RC[-1]/1000) -> 2 | C315: 1 | D315: 1 | E315: =IF(RC[5]=1,"(每日重置)：",)&"活动期间累计充值"&RC[1]*10&"钻（%s/"&RC[1]*10&"）" -> 活动期间累计充值10000钻（%s/10000） | F315: 1000 | H315: 1 | I315: 0 | J315: 0 | K315: 13596|13392|13619|10022 | L315: 60|2|4|320
A316: 2191 | B316: =INT(RC[-1]/1000) -> 2 | C316: 1 | D316: 1 | E316: =IF(RC[5]=1,"(每日重置)：",)&"活动期间累计充值"&RC[1]*10&"钻（%s/"&RC[1]*10&"）" -> 活动期间累计充值15000钻（%s/15000） | F316: 1500 | H316: 1 | I316: 0 | J316: 0 | K316: 13596|13385|10004|10022 | L316: 60|40|2000|400
A317: 2192 | B317: =INT(RC[-1]/1000) -> 2 | C317: 1 | D317: 1 | E317: =IF(RC[5]=1,"(每日重置)：",)&"活动期间累计充值"&RC[1]*10&"钻（%s/"&RC[1]*10&"）" -> 活动期间累计充值20000钻（%s/20000） | F317: 2000 | H317: 1 | I317: 0 | J317: 0 | K317: 13596|13385|13619|10022 | L317: 60|80|5|500
A318: 2193 | B318: =INT(RC[-1]/1000) -> 2 | C318: 1 | D318: 1 | E318: =IF(RC[5]=1,"(每日重置)：",)&"活动期间累计充值"&RC[1]*10&"钻（%s/"&RC[1]*10&"）" -> 活动期间累计充值25000钻（%s/25000） | F318: 2500 | H318: 1 | I318: 0 | J318: 0 | K318: 13596|13385|10004|10022 | L318: 60|120|3000|600
A319: 2194 | B319: =INT(RC[-1]/1000) -> 2 | C319: 1 | D319: 1 | E319: =IF(RC[5]=1,"(每日重置)：",)&"活动期间累计充值"&RC[1]*10&"钻（%s/"&RC[1]*10&"）" -> 活动期间累计充值30000钻（%s/30000） | F319: 3000 | H319: 1 | I319: 0 | J319: 0 | K319: 13385|13596|13619|10022 | L319: 160|60|6|700
A320: 2195 | B320: =INT(RC[-1]/1000) -> 2 | C320: 1 | D320: 1 | E320: =IF(RC[5]=1,"(每日重置)：",)&"活动期间累计充值"&RC[1]*10&"钻（%s/"&RC[1]*10&"）" -> 活动期间累计充值40000钻（%s/40000） | F320: 4000 | H320: 1 | I320: 0 | J320: 0 | K320: 13385|13596|10004|10022 | L320: 240|80|5000|800
A321: 2196 | B321: =INT(RC[-1]/1000) -> 2 | C321: 1 | D321: 1 | E321: =IF(RC[5]=1,"(每日重置)：",)&"活动期间累计充值"&RC[1]*10&"钻（%s/"&RC[1]*10&"）" -> 活动期间累计充值50000钻（%s/50000） | F321: 5000 | H321: 1 | I321: 0 | J321: 0 | K321: 13385|13459|10004|10022 | L321: 320|320|8000|1000
A322: 2197 | B322: =INT(RC[-1]/1000) -> 2 | C322: 1 | D322: 1 | E322: =IF(RC[5]=1,"(每日重置)：",)&"活动期间累计充值"&RC[1]*10&"钻（%s/"&RC[1]*10&"）" -> 活动期间累计充值60钻（%s/60） | F322: 6 | H322: 1 | I322: 0 | J322: 0 | K322: 80000|80010 | L322: 1|1
A323: 2198 | B323: =INT(RC[-1]/1000) -> 2 | C323: 1 | D323: 1 | E323: =IF(RC[5]=1,"(每日重置)：",)&"活动期间累计充值"&RC[1]*10&"钻（%s/"&RC[1]*10&"）" -> 活动期间累计充值300钻（%s/300） | F323: 30 | H323: 1 | I323: 0 | J323: 0 | K323: 80001|80011|10100 | L323: 2|2|2
A324: 2199 | B324: =INT(RC[-1]/1000) -> 2 | C324: 1 | D324: 1 | E324: =IF(RC[5]=1,"(每日重置)：",)&"活动期间累计充值"&RC[1]*10&"钻（%s/"&RC[1]*10&"）" -> 活动期间累计充值1000钻（%s/1000） | F324: 100 | H324: 1 | I324: 0 | J324: 0 | K324: 13401|10116 | L324: 20|50
A325: 2200 | B325: =INT(RC[-1]/1000) -> 2 | C325: 1 | D325: 1 | E325: =IF(RC[5]=1,"(每日重置)：",)&"活动期间累计充值"&RC[1]*10&"钻（%s/"&RC[1]*10&"）" -> 活动期间累计充值2000钻（%s/2000） | F325: 200 | H325: 1 | I325: 0 | J325: 0 | K325: 13401|80100 | L325: 30|1
A326: 2201 | B326: =INT(RC[-1]/1000) -> 2 | C326: 1 | D326: 1 | E326: =IF(RC[5]=1,"(每日重置)：",)&"活动期间累计充值"&RC[1]*10&"钻（%s/"&RC[1]*10&"）" -> 活动期间累计充值3500钻（%s/3500） | F326: 350 | H326: 1 | I326: 0 | J326: 0 | K326: 13401|10116|10014 | L326: 40|50|500
A327: 2202 | B327: =INT(RC[-1]/1000) -> 2 | C327: 1 | D327: 1 | E327: =IF(RC[5]=1,"(每日重置)：",)&"活动期间累计充值"&RC[1]*10&"钻（%s/"&RC[1]*10&"）" -> 活动期间累计充值5000钻（%s/5000） | F327: 500 | H327: 1 | I327: 0 | J327: 0 | K327: 13401|10116|19030 | L327: 70|50|5000
A328: 2203 | B328: =INT(RC[-1]/1000) -> 2 | C328: 1 | D328: 1 | E328: =IF(RC[5]=1,"(每日重置)：",)&"活动期间累计充值"&RC[1]*10&"钻（%s/"&RC[1]*10&"）" -> 活动期间累计充值7000钻（%s/7000） | F328: 700 | H328: 1 | I328: 0 | J328: 0 | K328: 13401|80100|10116 | L328: 80|1|50
A329: 2204 | B329: =INT(RC[-1]/1000) -> 2 | C329: 1 | D329: 1 | E329: =IF(RC[5]=1,"(每日重置)：",)&"活动期间累计充值"&RC[1]*10&"钻（%s/"&RC[1]*10&"）" -> 活动期间累计充值10000钻（%s/10000） | F329: 1000 | H329: 1 | I329: 0 | J329: 0 | K329: 13392|10116|13324 | L329: 1|100|3
A330: 2205 | B330: =INT(RC[-1]/1000) -> 2 | C330: 1 | D330: 1 | E330: =IF(RC[5]=1,"(每日重置)：",)&"活动期间累计充值"&RC[1]*10&"钻（%s/"&RC[1]*10&"）" -> 活动期间累计充值15000钻（%s/15000） | F330: 1500 | H330: 1 | I330: 0 | J330: 0 | K330: 13401|80100|10116|19030 | L330: 80|1|100|8000
A331: 2206 | B331: =INT(RC[-1]/1000) -> 2 | C331: 1 | D331: 1 | E331: =IF(RC[5]=1,"(每日重置)：",)&"活动期间累计充值"&RC[1]*10&"钻（%s/"&RC[1]*10&"）" -> 活动期间累计充值20000钻（%s/20000） | F331: 2000 | H331: 1 | I331: 0 | J331: 0 | K331: 13392|13324|10010 | L331: 1|4|800
A332: 2207 | B332: =INT(RC[-1]/1000) -> 2 | C332: 1 | D332: 1 | E332: =IF(RC[5]=1,"(每日重置)：",)&"活动期间累计充值"&RC[1]*10&"钻（%s/"&RC[1]*10&"）" -> 活动期间累计充值25000钻（%s/25000） | F332: 2500 | H332: 1 | I332: 0 | J332: 0 | K332: 80100|13324|10010 | L332: 1|4|800
A333: 2208 | B333: =INT(RC[-1]/1000) -> 2 | C333: 1 | D333: 1 | E333: =IF(RC[5]=1,"(每日重置)：",)&"活动期间累计充值"&RC[1]*10&"钻（%s/"&RC[1]*10&"）" -> 活动期间累计充值30000钻（%s/30000） | F333: 3000 | H333: 1 | I333: 0 | J333: 0 | K333: 13392|13324|10010 | L333: 2|500|1000
A334: 2209 | B334: =INT(RC[-1]/1000) -> 2 | C334: 1 | D334: 1 | E334: =IF(RC[5]=1,"(每日重置)：",)&"活动期间累计充值"&RC[1]*10&"钻（%s/"&RC[1]*10&"）" -> 活动期间累计充值40000钻（%s/40000） | F334: 4000 | H334: 1 | I334: 0 | J334: 0 | K334: 80101|13324 | L334: 1|5
A335: 2210 | B335: =INT(RC[-1]/1000) -> 2 | C335: 1 | D335: 1 | E335: =IF(RC[5]=1,"(每日重置)：",)&"活动期间累计充值"&RC[1]*10&"钻（%s/"&RC[1]*10&"）" -> 活动期间累计充值50000钻（%s/50000） | F335: 5000 | H335: 1 | I335: 0 | J335: 0 | K335: 80101|13324 | L335: 1|6
A336: 2211 | B336: =INT(RC[-1]/1000) -> 2 | C336: 1 | D336: 1 | E336: =IF(RC[5]=1,"(每日重置)：",)&"活动期间累计充值"&RC[1]*10&"钻（%s/"&RC[1]*10&"）" -> 活动期间累计充值60钻（%s/60） | F336: 6 | H336: 1 | I336: 0 | J336: 0 | K336: 10015|10000 | L336: 10|2
A337: 2212 | B337: =INT(RC[-1]/1000) -> 2 | C337: 1 | D337: 1 | E337: =IF(RC[5]=1,"(每日重置)：",)&"活动期间累计充值"&RC[1]*10&"钻（%s/"&RC[1]*10&"）" -> 活动期间累计充值300钻（%s/300） | F337: 30 | H337: 1 | I337: 0 | J337: 0 | K337: 10015|10004 | L337: 10|100
A338: 2213 | B338: =INT(RC[-1]/1000) -> 2 | C338: 1 | D338: 1 | E338: =IF(RC[5]=1,"(每日重置)：",)&"活动期间累计充值"&RC[1]*10&"钻（%s/"&RC[1]*10&"）" -> 活动期间累计充值1000钻（%s/1000） | F338: 100 | H338: 1 | I338: 0 | J338: 0 | K338: 13401|10116 | L338: 20|50
A339: 2214 | B339: =INT(RC[-1]/1000) -> 2 | C339: 1 | D339: 1 | E339: =IF(RC[5]=1,"(每日重置)：",)&"活动期间累计充值"&RC[1]*10&"钻（%s/"&RC[1]*10&"）" -> 活动期间累计充值2000钻（%s/2000） | F339: 200 | H339: 1 | I339: 0 | J339: 0 | K339: 13401|10004 | L339: 30|300
A340: 2215 | B340: =INT(RC[-1]/1000) -> 2 | C340: 1 | D340: 1 | E340: =IF(RC[5]=1,"(每日重置)：",)&"活动期间累计充值"&RC[1]*10&"钻（%s/"&RC[1]*10&"）" -> 活动期间累计充值3500钻（%s/3500） | F340: 350 | H340: 1 | I340: 0 | J340: 0 | K340: 13401|10116|10014 | L340: 40|50|150
A341: 2216 | B341: =INT(RC[-1]/1000) -> 2 | C341: 1 | D341: 1 | E341: =IF(RC[5]=1,"(每日重置)：",)&"活动期间累计充值"&RC[1]*10&"钻（%s/"&RC[1]*10&"）" -> 活动期间累计充值5000钻（%s/5000） | F341: 500 | H341: 1 | I341: 0 | J341: 0 | K341: 13401|10116 | L341: 70|100
A342: 2217 | B342: =INT(RC[-1]/1000) -> 2 | C342: 1 | D342: 1 | E342: =IF(RC[5]=1,"(每日重置)：",)&"活动期间累计充值"&RC[1]*10&"钻（%s/"&RC[1]*10&"）" -> 活动期间累计充值7000钻（%s/7000） | F342: 700 | H342: 1 | I342: 0 | J342: 0 | K342: 13401|10004 | L342: 80|500
A343: 2218 | B343: =INT(RC[-1]/1000) -> 2 | C343: 1 | D343: 1 | E343: =IF(RC[5]=1,"(每日重置)：",)&"活动期间累计充值"&RC[1]*10&"钻（%s/"&RC[1]*10&"）" -> 活动期间累计充值10000钻（%s/10000） | F343: 1000 | H343: 1 | I343: 0 | J343: 0 | K343: 13401|13392|10004 | L343: 80|1|750
A344: 2219 | B344: =INT(RC[-1]/1000) -> 2 | C344: 1 | D344: 1 | E344: =IF(RC[5]=1,"(每日重置)：",)&"活动期间累计充值"&RC[1]*10&"钻（%s/"&RC[1]*10&"）" -> 活动期间累计充值15000钻（%s/15000） | F344: 1500 | H344: 1 | I344: 0 | J344: 0 | K344: 13392|10022|10004 | L344: 1|200|888
A345: 2220 | B345: =INT(RC[-1]/1000) -> 2 | C345: 1 | D345: 1 | E345: =IF(RC[5]=1,"(每日重置)：",)&"活动期间累计充值"&RC[1]*10&"钻（%s/"&RC[1]*10&"）" -> 活动期间累计充值20000钻（%s/20000） | F345: 2000 | H345: 1 | I345: 0 | J345: 0 | K345: 13392|10022|10004 | L345: 1|200|998
A346: 2221 | B346: =INT(RC[-1]/1000) -> 2 | C346: 1 | D346: 1 | E346: =IF(RC[5]=1,"(每日重置)：",)&"活动期间累计充值"&RC[1]*10&"钻（%s/"&RC[1]*10&"）" -> 活动期间累计充值25000钻（%s/25000） | F346: 2500 | H346: 1 | I346: 0 | J346: 0 | K346: 13392|10022|10004 | L346: 1|200|1088
A347: 2222 | B347: =INT(RC[-1]/1000) -> 2 | C347: 1 | D347: 1 | E347: =IF(RC[5]=1,"(每日重置)：",)&"活动期间累计充值"&RC[1]*10&"钻（%s/"&RC[1]*10&"）" -> 活动期间累计充值30000钻（%s/30000） | F347: 3000 | H347: 1 | I347: 0 | J347: 0 | K347: 13392|10022|10004 | L347: 1|200|1188
A348: 2223 | B348: =INT(RC[-1]/1000) -> 2 | C348: 1 | D348: 1 | E348: =IF(RC[5]=1,"(每日重置)：",)&"活动期间累计充值"&RC[1]*10&"钻（%s/"&RC[1]*10&"）" -> 活动期间累计充值40000钻（%s/40000） | F348: 4000 | H348: 1 | I348: 0 | J348: 0 | K348: 13392|10022|10004 | L348: 1|400|2088
A349: 2224 | B349: =INT(RC[-1]/1000) -> 2 | C349: 1 | D349: 1 | E349: =IF(RC[5]=1,"(每日重置)：",)&"活动期间累计充值"&RC[1]*10&"钻（%s/"&RC[1]*10&"）" -> 活动期间累计充值50000钻（%s/50000） | F349: 5000 | H349: 1 | I349: 0 | J349: 0 | K349: 13392|10022|10004 | L349: 1|400|2288
A350: 2225 | B350: =INT(RC[-1]/1000) -> 2 | C350: 1 | D350: 1 | E350: =IF(RC[5]=1,"(每日重置)：",)&"活动期间累计充值"&RC[1]*10&"钻（%s/"&RC[1]*10&"）" -> 活动期间累计充值60钻（%s/60） | F350: 6 | H350: 1 | I350: 0 | J350: 0 | K350: 10096|19105 | L350: 1|20
A351: 2226 | B351: =INT(RC[-1]/1000) -> 2 | C351: 1 | D351: 1 | E351: =IF(RC[5]=1,"(每日重置)：",)&"活动期间累计充值"&RC[1]*10&"钻（%s/"&RC[1]*10&"）" -> 活动期间累计充值300钻（%s/300） | F351: 30 | H351: 1 | I351: 0 | J351: 0 | K351: 10096|19105 | L351: 4|50
A352: 2227 | B352: =INT(RC[-1]/1000) -> 2 | C352: 1 | D352: 1 | E352: =IF(RC[5]=1,"(每日重置)：",)&"活动期间累计充值"&RC[1]*10&"钻（%s/"&RC[1]*10&"）" -> 活动期间累计充值1000钻（%s/1000） | F352: 100 | H352: 1 | I352: 0 | J352: 0 | K352: 13339|10096 | L352: 1|10
A353: 2228 | B353: =INT(RC[-1]/1000) -> 2 | C353: 1 | D353: 1 | E353: =IF(RC[5]=1,"(每日重置)：",)&"活动期间累计充值"&RC[1]*10&"钻（%s/"&RC[1]*10&"）" -> 活动期间累计充值2000钻（%s/2000） | F353: 200 | H353: 1 | I353: 0 | J353: 0 | K353: 13501 | L353: 1
A354: 2229 | B354: =INT(RC[-1]/1000) -> 2 | C354: 1 | D354: 1 | E354: =IF(RC[5]=1,"(每日重置)：",)&"活动期间累计充值"&RC[1]*10&"钻（%s/"&RC[1]*10&"）" -> 活动期间累计充值3500钻（%s/3500） | F354: 350 | H354: 1 | I354: 0 | J354: 0 | K354: 13501|13402 | L354: 1|20
A355: 2230 | B355: =INT(RC[-1]/1000) -> 2 | C355: 1 | D355: 1 | E355: =IF(RC[5]=1,"(每日重置)：",)&"活动期间累计充值"&RC[1]*10&"钻（%s/"&RC[1]*10&"）" -> 活动期间累计充值5000钻（%s/5000） | F355: 500 | H355: 1 | I355: 0 | J355: 0 | K355: 13501|13402 | L355: 1|30
A356: 2231 | B356: =INT(RC[-1]/1000) -> 2 | C356: 1 | D356: 1 | E356: =IF(RC[5]=1,"(每日重置)：",)&"活动期间累计充值"&RC[1]*10&"钻（%s/"&RC[1]*10&"）" -> 活动期间累计充值7000钻（%s/7000） | F356: 700 | H356: 1 | I356: 0 | J356: 0 | K356: 13501|13402|70300 | L356: 1|40|10
A357: 2232 | B357: =INT(RC[-1]/1000) -> 2 | C357: 1 | D357: 1 | E357: =IF(RC[5]=1,"(每日重置)：",)&"活动期间累计充值"&RC[1]*10&"钻（%s/"&RC[1]*10&"）" -> 活动期间累计充值10000钻（%s/10000） | F357: 1000 | H357: 1 | I357: 0 | J357: 0 | K357: 13502|13402|70300 | L357: 1|70|10
A358: 2233 | B358: =INT(RC[-1]/1000) -> 2 | C358: 1 | D358: 1 | E358: =IF(RC[5]=1,"(每日重置)：",)&"活动期间累计充值"&RC[1]*10&"钻（%s/"&RC[1]*10&"）" -> 活动期间累计充值15000钻（%s/15000） | F358: 1500 | H358: 1 | I358: 0 | J358: 0 | K358: 13502|13402|10096 | L358: 1|80|50
A359: 2234 | B359: =INT(RC[-1]/1000) -> 2 | C359: 1 | D359: 1 | E359: =IF(RC[5]=1,"(每日重置)：",)&"活动期间累计充值"&RC[1]*10&"钻（%s/"&RC[1]*10&"）" -> 活动期间累计充值20000钻（%s/20000） | F359: 2000 | H359: 1 | I359: 0 | J359: 0 | K359: 13502|13402|10096 | L359: 1|80|60
A360: 2235 | B360: =INT(RC[-1]/1000) -> 2 | C360: 1 | D360: 1 | E360: =IF(RC[5]=1,"(每日重置)：",)&"活动期间累计充值"&RC[1]*10&"钻（%s/"&RC[1]*10&"）" -> 活动期间累计充值25000钻（%s/25000） | F360: 2500 | H360: 1 | I360: 0 | J360: 0 | K360: 13502|13402|10096 | L360: 1|80|70
A361: 2236 | B361: =INT(RC[-1]/1000) -> 2 | C361: 1 | D361: 1 | E361: =IF(RC[5]=1,"(每日重置)：",)&"活动期间累计充值"&RC[1]*10&"钻（%s/"&RC[1]*10&"）" -> 活动期间累计充值30000钻（%s/30000） | F361: 3000 | H361: 1 | I361: 0 | J361: 0 | K361: 13503|13402|10096 | L361: 1|80|80
A362: 2237 | B362: =INT(RC[-1]/1000) -> 2 | C362: 1 | D362: 1 | E362: =IF(RC[5]=1,"(每日重置)：",)&"活动期间累计充值"&RC[1]*10&"钻（%s/"&RC[1]*10&"）" -> 活动期间累计充值40000钻（%s/40000） | F362: 4000 | H362: 1 | I362: 0 | J362: 0 | K362: 13503|13402|10096 | L362: 1|160|150
A363: 2238 | B363: =INT(RC[-1]/1000) -> 2 | C363: 1 | D363: 1 | E363: =IF(RC[5]=1,"(每日重置)：",)&"活动期间累计充值"&RC[1]*10&"钻（%s/"&RC[1]*10&"）" -> 活动期间累计充值50000钻（%s/50000） | F363: 5000 | H363: 1 | I363: 0 | J363: 0 | K363: 13501|13402|10096 | L363: 1|160|160
A364: 2239 | B364: =INT(RC[-1]/1000) -> 2 | C364: 1 | D364: 1 | E364: =IF(RC[5]=1,"(每日重置)：",)&"活动期间累计充值"&RC[1]*10&"钻（%s/"&RC[1]*10&"）" -> 活动期间累计充值60钻（%s/60） | F364: 6 | H364: 1 | I364: 0 | J364: 0 | K364: 10112|19103 | L364: 10|10
A365: 2240 | B365: =INT(RC[-1]/1000) -> 2 | C365: 1 | D365: 1 | E365: =IF(RC[5]=1,"(每日重置)：",)&"活动期间累计充值"&RC[1]*10&"钻（%s/"&RC[1]*10&"）" -> 活动期间累计充值300钻（%s/300） | F365: 30 | H365: 1 | I365: 0 | J365: 0 | K365: 10112|19103 | L365: 20|50
A366: 2241 | B366: =INT(RC[-1]/1000) -> 2 | C366: 1 | D366: 1 | E366: =IF(RC[5]=1,"(每日重置)：",)&"活动期间累计充值"&RC[1]*10&"钻（%s/"&RC[1]*10&"）" -> 活动期间累计充值1000钻（%s/1000） | F366: 100 | H366: 1 | I366: 0 | J366: 0 | K366: 10112|10014 | L366: 30|40
A367: 2242 | B367: =INT(RC[-1]/1000) -> 2 | C367: 1 | D367: 1 | E367: =IF(RC[5]=1,"(每日重置)：",)&"活动期间累计充值"&RC[1]*10&"钻（%s/"&RC[1]*10&"）" -> 活动期间累计充值2000钻（%s/2000） | F367: 200 | H367: 1 | I367: 0 | J367: 0 | K367: 80100|10112 | L367: 1|40
A368: 2243 | B368: =INT(RC[-1]/1000) -> 2 | C368: 1 | D368: 1 | E368: =IF(RC[5]=1,"(每日重置)：",)&"活动期间累计充值"&RC[1]*10&"钻（%s/"&RC[1]*10&"）" -> 活动期间累计充值3500钻（%s/3500） | F368: 350 | H368: 1 | I368: 0 | J368: 0 | K368: 13402|10022|19017 | L368: 20|100|800
A369: 2244 | B369: =INT(RC[-1]/1000) -> 2 | C369: 1 | D369: 1 | E369: =IF(RC[5]=1,"(每日重置)：",)&"活动期间累计充值"&RC[1]*10&"钻（%s/"&RC[1]*10&"）" -> 活动期间累计充值5000钻（%s/5000） | F369: 500 | H369: 1 | I369: 0 | J369: 0 | K369: 13402|42301|10008 | L369: 30|12|400
A370: 2245 | B370: =INT(RC[-1]/1000) -> 2 | C370: 1 | D370: 1 | E370: =IF(RC[5]=1,"(每日重置)：",)&"活动期间累计充值"&RC[1]*10&"钻（%s/"&RC[1]*10&"）" -> 活动期间累计充值7000钻（%s/7000） | F370: 700 | H370: 1 | I370: 0 | J370: 0 | K370: 80100|13402|10101 | L370: 1|40|10
A371: 2246 | B371: =INT(RC[-1]/1000) -> 2 | C371: 1 | D371: 1 | E371: =IF(RC[5]=1,"(每日重置)：",)&"活动期间累计充值"&RC[1]*10&"钻（%s/"&RC[1]*10&"）" -> 活动期间累计充值10000钻（%s/10000） | F371: 1000 | H371: 1 | I371: 0 | J371: 0 | K371: 13402|10022|19017 | L371: 70|150|1500
A372: 2247 | B372: =INT(RC[-1]/1000) -> 2 | C372: 1 | D372: 1 | E372: =IF(RC[5]=1,"(每日重置)：",)&"活动期间累计充值"&RC[1]*10&"钻（%s/"&RC[1]*10&"）" -> 活动期间累计充值15000钻（%s/15000） | F372: 1500 | H372: 1 | I372: 0 | J372: 0 | K372: 80100|13402|10101|10096 | L372: 1|80|20|20
A373: 2248 | B373: =INT(RC[-1]/1000) -> 2 | C373: 1 | D373: 1 | E373: =IF(RC[5]=1,"(每日重置)：",)&"活动期间累计充值"&RC[1]*10&"钻（%s/"&RC[1]*10&"）" -> 活动期间累计充值20000钻（%s/20000） | F373: 2000 | H373: 1 | I373: 0 | J373: 0 | K373: 13402|13619|10008 | L373: 80|1|1500
A374: 2249 | B374: =INT(RC[-1]/1000) -> 2 | C374: 1 | D374: 1 | E374: =IF(RC[5]=1,"(每日重置)：",)&"活动期间累计充值"&RC[1]*10&"钻（%s/"&RC[1]*10&"）" -> 活动期间累计充值25000钻（%s/25000） | F374: 2500 | H374: 1 | I374: 0 | J374: 0 | K374: 80100|13402|10022 | L374: 1|80|200
A375: 2250 | B375: =INT(RC[-1]/1000) -> 2 | C375: 1 | D375: 1 | E375: =IF(RC[5]=1,"(每日重置)：",)&"活动期间累计充值"&RC[1]*10&"钻（%s/"&RC[1]*10&"）" -> 活动期间累计充值30000钻（%s/30000） | F375: 3000 | H375: 1 | I375: 0 | J375: 0 | K375: 13402|10004 | L375: 80|1000
A376: 2251 | B376: =INT(RC[-1]/1000) -> 2 | C376: 1 | D376: 1 | E376: =IF(RC[5]=1,"(每日重置)：",)&"活动期间累计充值"&RC[1]*10&"钻（%s/"&RC[1]*10&"）" -> 活动期间累计充值40000钻（%s/40000） | F376: 4000 | H376: 1 | I376: 0 | J376: 0 | K376: 80101|13402|13619 | L376: 1|160|2
A377: 2252 | B377: =INT(RC[-1]/1000) -> 2 | C377: 1 | D377: 1 | E377: =IF(RC[5]=1,"(每日重置)：",)&"活动期间累计充值"&RC[1]*10&"钻（%s/"&RC[1]*10&"）" -> 活动期间累计充值50000钻（%s/50000） | F377: 5000 | H377: 1 | I377: 0 | J377: 0 | K377: 80101|13402|10004 | L377: 1|160|1000
A378: 2253 | B378: =INT(RC[-1]/1000) -> 2 | C378: 1 | D378: 1 | E378: =IF(RC[5]=1,"(每日重置)：",)&"活动期间累计充值"&RC[1]*10&"钻（%s/"&RC[1]*10&"）" -> 活动期间累计充值250钻（%s/250） | F378: 25 | H378: 1 | I378: 0 | J378: 0 | K378: 10000|10001|10010|10096|42301 | L378: 5|5|50|1|1
A379: 2254 | B379: =INT(RC[-1]/1000) -> 2 | C379: 1 | D379: 1 | E379: =IF(RC[5]=1,"(每日重置)：",)&"活动期间累计充值"&RC[1]*10&"钻（%s/"&RC[1]*10&"）" -> 活动期间累计充值750钻（%s/750） | F379: 75 | H379: 1 | I379: 0 | J379: 0 | K379: 19103|10003|10010|10004|42301 | L379: 30|200|200|200|3
A380: 2255 | B380: =INT(RC[-1]/1000) -> 2 | C380: 1 | D380: 1 | E380: =IF(RC[5]=1,"(每日重置)：",)&"活动期间累计充值"&RC[1]*10&"钻（%s/"&RC[1]*10&"）" -> 活动期间累计充值2500钻（%s/2500） | F380: 250 | H380: 1 | I380: 0 | J380: 0 | K380: 13501|31540|10004|10014|42301 | L380: 1|1|300|300|6
A381: 2256 | B381: =INT(RC[-1]/1000) -> 2 | C381: 1 | D381: 1 | E381: =IF(RC[5]=1,"(每日重置)：",)&"活动期间累计充值"&RC[1]*10&"钻（%s/"&RC[1]*10&"）" -> 活动期间累计充值5000钻（%s/5000） | F381: 500 | H381: 1 | I381: 0 | J381: 0 | K381: 13417|31540|10096|10009|10004 | L381: 1|1|10|10|500
A382: 2257 | B382: =INT(RC[-1]/1000) -> 2 | C382: 1 | D382: 1 | E382: =IF(RC[5]=1,"(每日重置)：",)&"活动期间累计充值"&RC[1]*10&"钻（%s/"&RC[1]*10&"）" -> 活动期间累计充值12500钻（%s/12500） | F382: 1250 | H382: 1 | I382: 0 | J382: 0 | K382: 13501|31540|13418|80110|16300 | L382: 1|1|1|1|1
A383: 2258 | B383: =INT(RC[-1]/1000) -> 2 | C383: 1 | D383: 1 | E383: =IF(RC[5]=1,"(每日重置)：",)&"活动期间累计充值"&RC[1]*10&"钻（%s/"&RC[1]*10&"）" -> 活动期间累计充值25000钻（%s/25000） | F383: 2500 | H383: 1 | I383: 0 | J383: 0 | K383: 13389|80121|80111|10014|16300 | L383: 1|1|1|1000|1
A384: 2259 | B384: =INT(RC[-1]/1000) -> 2 | C384: 1 | D384: 1 | E384: =IF(RC[5]=1,"(每日重置)：",)&"活动期间累计充值"&RC[1]*10&"钻（%s/"&RC[1]*10&"）" -> 活动期间累计充值37500钻（%s/37500） | F384: 3750 | H384: 1 | I384: 0 | J384: 0 | K384: 13389|80121|80111|13418|16300 | L384: 1|1|1|1|1
A385: 2260 | B385: =INT(RC[-1]/1000) -> 2 | C385: 1 | D385: 1 | E385: =IF(RC[5]=1,"(每日重置)：",)&"活动期间累计充值"&RC[1]*10&"钻（%s/"&RC[1]*10&"）" -> 活动期间累计充值50000钻（%s/50000） | F385: 5000 | H385: 1 | I385: 0 | J385: 0 | K385: 13389|80121|13418|80111|10010 | L385: 2|1|1|1|3000
A386: 2261 | B386: =INT(RC[-1]/1000) -> 2 | C386: 1 | D386: 1 | E386: =IF(RC[5]=1,"(每日重置)：",)&"活动期间累计充值"&RC[1]*10&"钻（%s/"&RC[1]*10&"）" -> 活动期间累计充值75000钻（%s/75000） | F386: 7500 | H386: 1 | I386: 0 | J386: 0 | K386: 13389|80121|13418|80111|13017 | L386: 2|1|1|1|150
A387: 2262 | B387: =INT(RC[-1]/1000) -> 2 | C387: 1 | D387: 1 | E387: =IF(RC[5]=1,"(每日重置)：",)&"活动期间累计充值"&RC[1]*10&"钻（%s/"&RC[1]*10&"）" -> 活动期间累计充值100000钻（%s/100000） | F387: 10000 | H387: 1 | I387: 0 | J387: 0 | K387: 13389|80122|80112|13418|13017 | L387: 3|1|1|1|200
A388: 2263 | B388: =INT(RC[-1]/1000) -> 2 | C388: 1 | D388: 1 | E388: =IF(RC[5]=1,"(每日重置)：",)&"活动期间累计充值"&RC[1]*10&"钻（%s/"&RC[1]*10&"）" -> 活动期间累计充值125000钻（%s/125000） | F388: 12500 | H388: 1 | I388: 0 | J388: 0 | K388: 13389|80122|80112|13418|13017 | L388: 3|1|1|1|250
A389: 2264 | B389: =INT(RC[-1]/1000) -> 2 | C389: 1 | D389: 1 | E389: =IF(RC[5]=1,"(每日重置)：",)&"活动期间累计充值"&RC[1]*10&"钻（%s/"&RC[1]*10&"）" -> 活动期间累计充值250钻（%s/250） | F389: 25 | H389: 1 | I389: 0 | J389: 0 | K389: 10000|10001|10010|10096|42301 | L389: 5|5|50|1|1
A390: 2265 | B390: =INT(RC[-1]/1000) -> 2 | C390: 1 | D390: 1 | E390: =IF(RC[5]=1,"(每日重置)：",)&"活动期间累计充值"&RC[1]*10&"钻（%s/"&RC[1]*10&"）" -> 活动期间累计充值750钻（%s/750） | F390: 75 | H390: 1 | I390: 0 | J390: 0 | K390: 10112|19103|10003|10010|42301 | L390: 10|30|200|200|3
A391: 2266 | B391: =INT(RC[-1]/1000) -> 2 | C391: 1 | D391: 1 | E391: =IF(RC[5]=1,"(每日重置)：",)&"活动期间累计充值"&RC[1]*10&"钻（%s/"&RC[1]*10&"）" -> 活动期间累计充值2500钻（%s/2500） | F391: 250 | H391: 1 | I391: 0 | J391: 0 | K391: 10112|31540|10004|10014|42301 | L391: 50|1|150|150|6
A392: 2267 | B392: =INT(RC[-1]/1000) -> 2 | C392: 1 | D392: 1 | E392: =IF(RC[5]=1,"(每日重置)：",)&"活动期间累计充值"&RC[1]*10&"钻（%s/"&RC[1]*10&"）" -> 活动期间累计充值5000钻（%s/5000） | F392: 500 | H392: 1 | I392: 0 | J392: 0 | K392: 80101|31540|13417|10014|10004 | L392: 1|1|1|300|500
A393: 2268 | B393: =INT(RC[-1]/1000) -> 2 | C393: 1 | D393: 1 | E393: =IF(RC[5]=1,"(每日重置)：",)&"活动期间累计充值"&RC[1]*10&"钻（%s/"&RC[1]*10&"）" -> 活动期间累计充值12500钻（%s/12500） | F393: 1250 | H393: 1 | I393: 0 | J393: 0 | K393: 80101|31540|13418|80110|16300 | L393: 1|1|1|1|1
A394: 2269 | B394: =INT(RC[-1]/1000) -> 2 | C394: 1 | D394: 1 | E394: =IF(RC[5]=1,"(每日重置)：",)&"活动期间累计充值"&RC[1]*10&"钻（%s/"&RC[1]*10&"）" -> 活动期间累计充值25000钻（%s/25000） | F394: 2500 | H394: 1 | I394: 0 | J394: 0 | K394: 13389|80121|80111|13418|10004 | L394: 1|1|1|1|1000
A395: 2270 | B395: =INT(RC[-1]/1000) -> 2 | C395: 1 | D395: 1 | E395: =IF(RC[5]=1,"(每日重置)：",)&"活动期间累计充值"&RC[1]*10&"钻（%s/"&RC[1]*10&"）" -> 活动期间累计充值37500钻（%s/37500） | F395: 3750 | H395: 1 | I395: 0 | J395: 0 | K395: 13389|80121|80111|13418|16300 | L395: 1|1|1|1|1
A396: 2271 | B396: =INT(RC[-1]/1000) -> 2 | C396: 1 | D396: 1 | E396: =IF(RC[5]=1,"(每日重置)：",)&"活动期间累计充值"&RC[1]*10&"钻（%s/"&RC[1]*10&"）" -> 活动期间累计充值50000钻（%s/50000） | F396: 5000 | H396: 1 | I396: 0 | J396: 0 | K396: 13389|80121|13418|80111|10014 | L396: 2|1|1|1|2000
A397: 2272 | B397: =INT(RC[-1]/1000) -> 2 | C397: 1 | D397: 1 | E397: =IF(RC[5]=1,"(每日重置)：",)&"活动期间累计充值"&RC[1]*10&"钻（%s/"&RC[1]*10&"）" -> 活动期间累计充值75000钻（%s/75000） | F397: 7500 | H397: 1 | I397: 0 | J397: 0 | K397: 13389|80121|13418|80111|10010 | L397: 2|1|1|1|5000
A398: 2273 | B398: =INT(RC[-1]/1000) -> 2 | C398: 1 | D398: 1 | E398: =IF(RC[5]=1,"(每日重置)：",)&"活动期间累计充值"&RC[1]*10&"钻（%s/"&RC[1]*10&"）" -> 活动期间累计充值100000钻（%s/100000） | F398: 10000 | H398: 1 | I398: 0 | J398: 0 | K398: 13389|80112|13418|80122|13646 | L398: 3|1|1|1|2000
A399: 2274 | B399: =INT(RC[-1]/1000) -> 2 | C399: 1 | D399: 1 | E399: =IF(RC[5]=1,"(每日重置)：",)&"活动期间累计充值"&RC[1]*10&"钻（%s/"&RC[1]*10&"）" -> 活动期间累计充值125000钻（%s/125000） | F399: 12500 | H399: 1 | I399: 0 | J399: 0 | K399: 13389|80112|13418|80122|13646 | L399: 3|1|1|1|2500
A400: 2275 | B400: =INT(RC[-1]/1000) -> 2 | C400: 1 | D400: 1 | E400: =IF(RC[5]=1,"(每日重置)：",)&"活动期间累计充值"&RC[1]*10&"钻（%s/"&RC[1]*10&"）" -> 活动期间累计充值250钻（%s/250） | F400: 25 | H400: 1 | I400: 0 | J400: 0 | K400: 10000|10002 | L400: 2|100
A401: 2276 | B401: =INT(RC[-1]/1000) -> 2 | C401: 1 | D401: 1 | E401: =IF(RC[5]=1,"(每日重置)：",)&"活动期间累计充值"&RC[1]*10&"钻（%s/"&RC[1]*10&"）" -> 活动期间累计充值750钻（%s/750） | F401: 75 | H401: 1 | I401: 0 | J401: 0 | K401: 10019|10001|10002 | L401: 3|2|200
A402: 2277 | B402: =INT(RC[-1]/1000) -> 2 | C402: 1 | D402: 1 | E402: =IF(RC[5]=1,"(每日重置)：",)&"活动期间累计充值"&RC[1]*10&"钻（%s/"&RC[1]*10&"）" -> 活动期间累计充值2500钻（%s/2500） | F402: 250 | H402: 1 | I402: 0 | J402: 0 | K402: 13380|19103|10002 | L402: 1|20|300
A403: 2278 | B403: =INT(RC[-1]/1000) -> 2 | C403: 1 | D403: 1 | E403: =IF(RC[5]=1,"(每日重置)：",)&"活动期间累计充值"&RC[1]*10&"钻（%s/"&RC[1]*10&"）" -> 活动期间累计充值5000钻（%s/5000） | F403: 500 | H403: 1 | I403: 0 | J403: 0 | K403: 13417|13324|19103|10003 | L403: 1|1|50|200
A404: 2279 | B404: =INT(RC[-1]/1000) -> 2 | C404: 1 | D404: 1 | E404: =IF(RC[5]=1,"(每日重置)：",)&"活动期间累计充值"&RC[1]*10&"钻（%s/"&RC[1]*10&"）" -> 活动期间累计充值12500钻（%s/12500） | F404: 1250 | H404: 1 | I404: 0 | J404: 0 | K404: 13417|31540|19006|10003 | L404: 1|1|500|300
A405: 2280 | B405: =INT(RC[-1]/1000) -> 2 | C405: 1 | D405: 1 | E405: =IF(RC[5]=1,"(每日重置)：",)&"活动期间累计充值"&RC[1]*10&"钻（%s/"&RC[1]*10&"）" -> 活动期间累计充值25000钻（%s/25000） | F405: 2500 | H405: 1 | I405: 0 | J405: 0 | K405: 13417|31540|19006|10014 | L405: 1|1|1000|50
A406: 2281 | B406: =INT(RC[-1]/1000) -> 2 | C406: 1 | D406: 1 | E406: =IF(RC[5]=1,"(每日重置)：",)&"活动期间累计充值"&RC[1]*10&"钻（%s/"&RC[1]*10&"）" -> 活动期间累计充值37500钻（%s/37500） | F406: 3750 | H406: 1 | I406: 0 | J406: 0 | K406: 13417|31540|13392|10014 | L406: 1|1|1|80
A407: 2282 | B407: =INT(RC[-1]/1000) -> 2 | C407: 1 | D407: 1 | E407: =IF(RC[5]=1,"(每日重置)：",)&"活动期间累计充值"&RC[1]*10&"钻（%s/"&RC[1]*10&"）" -> 活动期间累计充值50000钻（%s/50000） | F407: 5000 | H407: 1 | I407: 0 | J407: 0 | K407: 13417|13392|10004|10014 | L407: 1|1|100|120
A408: 2283 | B408: =INT(RC[-1]/1000) -> 2 | C408: 1 | D408: 1 | E408: =IF(RC[5]=1,"(每日重置)：",)&"活动期间累计充值"&RC[1]*10&"钻（%s/"&RC[1]*10&"）" -> 活动期间累计充值75000钻（%s/75000） | F408: 7500 | H408: 1 | I408: 0 | J408: 0 | K408: 13417|13392|10004|10014 | L408: 1|2|300|160
A409: 2284 | B409: =INT(RC[-1]/1000) -> 2 | C409: 1 | D409: 1 | E409: =IF(RC[5]=1,"(每日重置)：",)&"活动期间累计充值"&RC[1]*10&"钻（%s/"&RC[1]*10&"）" -> 活动期间累计充值100000钻（%s/100000） | F409: 10000 | H409: 1 | I409: 0 | J409: 0 | K409: 15011|13646|10010|10004 | L409: 90|500|1000|1000
A410: 2285 | B410: =INT(RC[-1]/1000) -> 2 | C410: 1 | D410: 1 | E410: =IF(RC[5]=1,"(每日重置)：",)&"活动期间累计充值"&RC[1]*10&"钻（%s/"&RC[1]*10&"）" -> 活动期间累计充值125000钻（%s/125000） | F410: 12500 | H410: 1 | I410: 0 | J410: 0 | K410: 15011|13646|10014|10004 | L410: 120|800|300|2000
A411: 2286 | B411: =INT(RC[-1]/1000) -> 2 | C411: 1 | D411: 1 | E411: =IF(RC[5]=1,"(每日重置)：",)&"活动期间累计充值"&RC[1]*10&"钻（%s/"&RC[1]*10&"）" -> 活动期间累计充值250钻（%s/250） | F411: 25 | H411: 1 | I411: 0 | J411: 0 | K411: 80010|80000 | L411: 1|1
A412: 2287 | B412: =INT(RC[-1]/1000) -> 2 | C412: 1 | D412: 1 | E412: =IF(RC[5]=1,"(每日重置)：",)&"活动期间累计充值"&RC[1]*10&"钻（%s/"&RC[1]*10&"）" -> 活动期间累计充值750钻（%s/750） | F412: 75 | H412: 1 | I412: 0 | J412: 0 | K412: 13380|10100 | L412: 1|2
A413: 2288 | B413: =INT(RC[-1]/1000) -> 2 | C413: 1 | D413: 1 | E413: =IF(RC[5]=1,"(每日重置)：",)&"活动期间累计充值"&RC[1]*10&"钻（%s/"&RC[1]*10&"）" -> 活动期间累计充值2500钻（%s/2500） | F413: 250 | H413: 1 | I413: 0 | J413: 0 | K413: 13379|10116|19103|10003 | L413: 1|50|20|100
A414: 2289 | B414: =INT(RC[-1]/1000) -> 2 | C414: 1 | D414: 1 | E414: =IF(RC[5]=1,"(每日重置)：",)&"活动期间累计充值"&RC[1]*10&"钻（%s/"&RC[1]*10&"）" -> 活动期间累计充值5000钻（%s/5000） | F414: 500 | H414: 1 | I414: 0 | J414: 0 | K414: 13417|31540|10116|10003 | L414: 1|1|50|200
A415: 2290 | B415: =INT(RC[-1]/1000) -> 2 | C415: 1 | D415: 1 | E415: =IF(RC[5]=1,"(每日重置)：",)&"活动期间累计充值"&RC[1]*10&"钻（%s/"&RC[1]*10&"）" -> 活动期间累计充值12500钻（%s/12500） | F415: 1250 | H415: 1 | I415: 0 | J415: 0 | K415: 13417|10116|13392|10004 | L415: 1|100|1|100
A416: 2291 | B416: =INT(RC[-1]/1000) -> 2 | C416: 1 | D416: 1 | E416: =IF(RC[5]=1,"(每日重置)：",)&"活动期间累计充值"&RC[1]*10&"钻（%s/"&RC[1]*10&"）" -> 活动期间累计充值25000钻（%s/25000） | F416: 2500 | H416: 1 | I416: 0 | J416: 0 | K416: 13418|10116|80100|19028 | L416: 1|100|1|5000
A417: 2292 | B417: =INT(RC[-1]/1000) -> 2 | C417: 1 | D417: 1 | E417: =IF(RC[5]=1,"(每日重置)：",)&"活动期间累计充值"&RC[1]*10&"钻（%s/"&RC[1]*10&"）" -> 活动期间累计充值37500钻（%s/37500） | F417: 3750 | H417: 1 | I417: 0 | J417: 0 | K417: 13418|80100|10116|19028 | L417: 1|1|100|5000
A418: 2293 | B418: =INT(RC[-1]/1000) -> 2 | C418: 1 | D418: 1 | E418: =IF(RC[5]=1,"(每日重置)：",)&"活动期间累计充值"&RC[1]*10&"钻（%s/"&RC[1]*10&"）" -> 活动期间累计充值50000钻（%s/50000） | F418: 5000 | H418: 1 | I418: 0 | J418: 0 | K418: 13418|13324|10010|10014 | L418: 1|2|300|200
A419: 2294 | B419: =INT(RC[-1]/1000) -> 2 | C419: 1 | D419: 1 | E419: =IF(RC[5]=1,"(每日重置)：",)&"活动期间累计充值"&RC[1]*10&"钻（%s/"&RC[1]*10&"）" -> 活动期间累计充值75000钻（%s/75000） | F419: 7500 | H419: 1 | I419: 0 | J419: 0 | K419: 13418|13017|10010|10014 | L419: 1|20|1000|500
A420: 2295 | B420: =INT(RC[-1]/1000) -> 2 | C420: 1 | D420: 1 | E420: =IF(RC[5]=1,"(每日重置)：",)&"活动期间累计充值"&RC[1]*10&"钻（%s/"&RC[1]*10&"）" -> 活动期间累计充值100000钻（%s/100000） | F420: 10000 | H420: 1 | I420: 0 | J420: 0 | K420: 80101|15012|13017|10014 | L420: 1|90|20|500
A421: 2296 | B421: =INT(RC[-1]/1000) -> 2 | C421: 1 | D421: 1 | E421: =IF(RC[5]=1,"(每日重置)：",)&"活动期间累计充值"&RC[1]*10&"钻（%s/"&RC[1]*10&"）" -> 活动期间累计充值125000钻（%s/125000） | F421: 12500 | H421: 1 | I421: 0 | J421: 0 | K421: 80101|15012|13017|10014 | L421: 1|120|25|500
A422: 2297 | B422: =INT(RC[-1]/1000) -> 2 | C422: 1 | D422: 1 | E422: =IF(RC[5]=1,"(每日重置)：",)&"活动期间累计充值"&RC[1]*10&"钻（%s/"&RC[1]*10&"）" -> 活动期间累计充值250钻（%s/250） | F422: 25 | H422: 1 | I422: 0 | J422: 0 | K422: 10000|10001|10010|10096|42301 | L422: 5|5|50|1|1
A423: 2298 | B423: =INT(RC[-1]/1000) -> 2 | C423: 1 | D423: 1 | E423: =IF(RC[5]=1,"(每日重置)：",)&"活动期间累计充值"&RC[1]*10&"钻（%s/"&RC[1]*10&"）" -> 活动期间累计充值750钻（%s/750） | F423: 75 | H423: 1 | I423: 0 | J423: 0 | K423: 19103|10003|10010|10004|42301 | L423: 30|200|200|200|3
A424: 2299 | B424: =INT(RC[-1]/1000) -> 2 | C424: 1 | D424: 1 | E424: =IF(RC[5]=1,"(每日重置)：",)&"活动期间累计充值"&RC[1]*10&"钻（%s/"&RC[1]*10&"）" -> 活动期间累计充值2500钻（%s/2500） | F424: 250 | H424: 1 | I424: 0 | J424: 0 | K424: 13501|31540|10004|10014|42301 | L424: 1|1|300|300|6
A425: 2300 | B425: =INT(RC[-1]/1000) -> 2 | C425: 1 | D425: 1 | E425: =IF(RC[5]=1,"(每日重置)：",)&"活动期间累计充值"&RC[1]*10&"钻（%s/"&RC[1]*10&"）" -> 活动期间累计充值5000钻（%s/5000） | F425: 500 | H425: 1 | I425: 0 | J425: 0 | K425: 13417|31540|10096|10009|10004 | L425: 1|1|10|10|500
A426: 2301 | B426: =INT(RC[-1]/1000) -> 2 | C426: 1 | D426: 1 | E426: =IF(RC[5]=1,"(每日重置)：",)&"活动期间累计充值"&RC[1]*10&"钻（%s/"&RC[1]*10&"）" -> 活动期间累计充值12500钻（%s/12500） | F426: 1250 | H426: 1 | I426: 0 | J426: 0 | K426: 13501|31540|13418|80110|16300 | L426: 1|1|1|1|1
A427: 2302 | B427: =INT(RC[-1]/1000) -> 2 | C427: 1 | D427: 1 | E427: =IF(RC[5]=1,"(每日重置)：",)&"活动期间累计充值"&RC[1]*10&"钻（%s/"&RC[1]*10&"）" -> 活动期间累计充值25000钻（%s/25000） | F427: 2500 | H427: 1 | I427: 0 | J427: 0 | K427: 13389|80121|80111|10014|16300 | L427: 1|1|1|1000|1
A428: 2303 | B428: =INT(RC[-1]/1000) -> 2 | C428: 1 | D428: 1 | E428: =IF(RC[5]=1,"(每日重置)：",)&"活动期间累计充值"&RC[1]*10&"钻（%s/"&RC[1]*10&"）" -> 活动期间累计充值37500钻（%s/37500） | F428: 3750 | H428: 1 | I428: 0 | J428: 0 | K428: 13389|80121|80111|13418|16300 | L428: 1|1|1|1|1
A429: 2304 | B429: =INT(RC[-1]/1000) -> 2 | C429: 1 | D429: 1 | E429: =IF(RC[5]=1,"(每日重置)：",)&"活动期间累计充值"&RC[1]*10&"钻（%s/"&RC[1]*10&"）" -> 活动期间累计充值50000钻（%s/50000） | F429: 5000 | H429: 1 | I429: 0 | J429: 0 | K429: 13389|80121|13418|80111|10010 | L429: 2|1|1|1|3000
A430: 2305 | B430: =INT(RC[-1]/1000) -> 2 | C430: 1 | D430: 1 | E430: =IF(RC[5]=1,"(每日重置)：",)&"活动期间累计充值"&RC[1]*10&"钻（%s/"&RC[1]*10&"）" -> 活动期间累计充值75000钻（%s/75000） | F430: 7500 | H430: 1 | I430: 0 | J430: 0 | K430: 13389|80121|13418|80111|13017 | L430: 2|1|1|1|150
A431: 2306 | B431: =INT(RC[-1]/1000) -> 2 | C431: 1 | D431: 1 | E431: =IF(RC[5]=1,"(每日重置)：",)&"活动期间累计充值"&RC[1]*10&"钻（%s/"&RC[1]*10&"）" -> 活动期间累计充值100000钻（%s/100000） | F431: 10000 | H431: 1 | I431: 0 | J431: 0 | K431: 13389|80122|80112|13418|13017 | L431: 3|1|1|1|200
A432: 2307 | B432: =INT(RC[-1]/1000) -> 2 | C432: 1 | D432: 1 | E432: =IF(RC[5]=1,"(每日重置)：",)&"活动期间累计充值"&RC[1]*10&"钻（%s/"&RC[1]*10&"）" -> 活动期间累计充值125000钻（%s/125000） | F432: 12500 | H432: 1 | I432: 0 | J432: 0 | K432: 13389|80122|80112|13418|13017 | L432: 3|1|1|1|250
A433: 2308 | B433: =INT(RC[-1]/1000) -> 2 | C433: 1 | D433: 1 | E433: =IF(RC[5]=1,"(每日重置)：",)&"活动期间累计充值"&RC[1]*10&"钻（%s/"&RC[1]*10&"）" -> 活动期间累计充值250钻（%s/250） | F433: 25 | H433: 1 | I433: 0 | J433: 0 | K433: 10000|10001|10010|10096|42301 | L433: 5|5|50|1|1
A434: 2309 | B434: =INT(RC[-1]/1000) -> 2 | C434: 1 | D434: 1 | E434: =IF(RC[5]=1,"(每日重置)：",)&"活动期间累计充值"&RC[1]*10&"钻（%s/"&RC[1]*10&"）" -> 活动期间累计充值750钻（%s/750） | F434: 75 | H434: 1 | I434: 0 | J434: 0 | K434: 10112|19103|10003|10010|42301 | L434: 10|30|200|200|3
A435: 2310 | B435: =INT(RC[-1]/1000) -> 2 | C435: 1 | D435: 1 | E435: =IF(RC[5]=1,"(每日重置)：",)&"活动期间累计充值"&RC[1]*10&"钻（%s/"&RC[1]*10&"）" -> 活动期间累计充值2500钻（%s/2500） | F435: 250 | H435: 1 | I435: 0 | J435: 0 | K435: 10112|31540|10004|10014|42301 | L435: 50|1|150|150|6
A436: 2311 | B436: =INT(RC[-1]/1000) -> 2 | C436: 1 | D436: 1 | E436: =IF(RC[5]=1,"(每日重置)：",)&"活动期间累计充值"&RC[1]*10&"钻（%s/"&RC[1]*10&"）" -> 活动期间累计充值5000钻（%s/5000） | F436: 500 | H436: 1 | I436: 0 | J436: 0 | K436: 80101|31540|13417|10014|10004 | L436: 1|1|1|300|500
A437: 2312 | B437: =INT(RC[-1]/1000) -> 2 | C437: 1 | D437: 1 | E437: =IF(RC[5]=1,"(每日重置)：",)&"活动期间累计充值"&RC[1]*10&"钻（%s/"&RC[1]*10&"）" -> 活动期间累计充值12500钻（%s/12500） | F437: 1250 | H437: 1 | I437: 0 | J437: 0 | K437: 80101|31540|13418|80110|16300 | L437: 1|1|1|1|1
A438: 2313 | B438: =INT(RC[-1]/1000) -> 2 | C438: 1 | D438: 1 | E438: =IF(RC[5]=1,"(每日重置)：",)&"活动期间累计充值"&RC[1]*10&"钻（%s/"&RC[1]*10&"）" -> 活动期间累计充值25000钻（%s/25000） | F438: 2500 | H438: 1 | I438: 0 | J438: 0 | K438: 13389|80121|80111|13418|10004 | L438: 1|1|1|1|1000
A439: 2314 | B439: =INT(RC[-1]/1000) -> 2 | C439: 1 | D439: 1 | E439: =IF(RC[5]=1,"(每日重置)：",)&"活动期间累计充值"&RC[1]*10&"钻（%s/"&RC[1]*10&"）" -> 活动期间累计充值37500钻（%s/37500） | F439: 3750 | H439: 1 | I439: 0 | J439: 0 | K439: 13389|80121|80111|13418|16300 | L439: 1|1|1|1|1
A440: 2315 | B440: =INT(RC[-1]/1000) -> 2 | C440: 1 | D440: 1 | E440: =IF(RC[5]=1,"(每日重置)：",)&"活动期间累计充值"&RC[1]*10&"钻（%s/"&RC[1]*10&"）" -> 活动期间累计充值50000钻（%s/50000） | F440: 5000 | H440: 1 | I440: 0 | J440: 0 | K440: 13389|80121|13418|80111|10014 | L440: 2|1|1|1|2000
A441: 2316 | B441: =INT(RC[-1]/1000) -> 2 | C441: 1 | D441: 1 | E441: =IF(RC[5]=1,"(每日重置)：",)&"活动期间累计充值"&RC[1]*10&"钻（%s/"&RC[1]*10&"）" -> 活动期间累计充值75000钻（%s/75000） | F441: 7500 | H441: 1 | I441: 0 | J441: 0 | K441: 13389|80121|13418|80111|10010 | L441: 2|1|1|1|5000
A442: 2317 | B442: =INT(RC[-1]/1000) -> 2 | C442: 1 | D442: 1 | E442: =IF(RC[5]=1,"(每日重置)：",)&"活动期间累计充值"&RC[1]*10&"钻（%s/"&RC[1]*10&"）" -> 活动期间累计充值100000钻（%s/100000） | F442: 10000 | H442: 1 | I442: 0 | J442: 0 | K442: 13389|80112|13418|80122|13646 | L442: 3|1|1|1|2000
A443: 2318 | B443: =INT(RC[-1]/1000) -> 2 | C443: 1 | D443: 1 | E443: =IF(RC[5]=1,"(每日重置)：",)&"活动期间累计充值"&RC[1]*10&"钻（%s/"&RC[1]*10&"）" -> 活动期间累计充值125000钻（%s/125000） | F443: 12500 | H443: 1 | I443: 0 | J443: 0 | K443: 13389|80112|13418|80122|13646 | L443: 3|1|1|1|2500
A444: 2319 | B444: =INT(RC[-1]/1000) -> 2 | C444: 1 | D444: 1 | E444: =IF(RC[5]=1,"(每日重置)：",)&"活动期间累计充值"&RC[1]*10&"钻（%s/"&RC[1]*10&"）" -> 活动期间累计充值250钻（%s/250） | F444: 25 | H444: 1 | I444: 0 | J444: 0 | K444: 10000|10001|10010|10096|42301 | L444: 5|5|50|1|1
A445: 2320 | B445: =INT(RC[-1]/1000) -> 2 | C445: 1 | D445: 1 | E445: =IF(RC[5]=1,"(每日重置)：",)&"活动期间累计充值"&RC[1]*10&"钻（%s/"&RC[1]*10&"）" -> 活动期间累计充值750钻（%s/750） | F445: 75 | H445: 1 | I445: 0 | J445: 0 | K445: 10112|19103|10003|10010|42301 | L445: 10|30|200|200|3
A446: 2321 | B446: =INT(RC[-1]/1000) -> 2 | C446: 1 | D446: 1 | E446: =IF(RC[5]=1,"(每日重置)：",)&"活动期间累计充值"&RC[1]*10&"钻（%s/"&RC[1]*10&"）" -> 活动期间累计充值2500钻（%s/2500） | F446: 250 | H446: 1 | I446: 0 | J446: 0 | K446: 13501|31540|10004|10014|42301 | L446: 1|1|100|100|6
A447: 2322 | B447: =INT(RC[-1]/1000) -> 2 | C447: 1 | D447: 1 | E447: =IF(RC[5]=1,"(每日重置)：",)&"活动期间累计充值"&RC[1]*10&"钻（%s/"&RC[1]*10&"）" -> 活动期间累计充值5000钻（%s/5000） | F447: 500 | H447: 1 | I447: 0 | J447: 0 | K447: 13417|31540|10096|10009|10022 | L447: 1|1|10|10|50
A448: 2323 | B448: =INT(RC[-1]/1000) -> 2 | C448: 1 | D448: 1 | E448: =IF(RC[5]=1,"(每日重置)：",)&"活动期间累计充值"&RC[1]*10&"钻（%s/"&RC[1]*10&"）" -> 活动期间累计充值12500钻（%s/12500） | F448: 1250 | H448: 1 | I448: 0 | J448: 0 | K448: 13501|31540|13418|10014|10022 | L448: 1|1|1|300|100
A449: 2324 | B449: =INT(RC[-1]/1000) -> 2 | C449: 1 | D449: 1 | E449: =IF(RC[5]=1,"(每日重置)：",)&"活动期间累计充值"&RC[1]*10&"钻（%s/"&RC[1]*10&"）" -> 活动期间累计充值25000钻（%s/25000） | F449: 2500 | H449: 1 | I449: 0 | J449: 0 | K449: 13393|30501|80110|10014|10022 | L449: 1|1|1|300|150
A450: 2325 | B450: =INT(RC[-1]/1000) -> 2 | C450: 1 | D450: 1 | E450: =IF(RC[5]=1,"(每日重置)：",)&"活动期间累计充值"&RC[1]*10&"钻（%s/"&RC[1]*10&"）" -> 活动期间累计充值37500钻（%s/37500） | F450: 3750 | H450: 1 | I450: 0 | J450: 0 | K450: 13393|30501|80110|10014|10022 | L450: 1|1|1|800|200
A451: 2326 | B451: =INT(RC[-1]/1000) -> 2 | C451: 1 | D451: 1 | E451: =IF(RC[5]=1,"(每日重置)：",)&"活动期间累计充值"&RC[1]*10&"钻（%s/"&RC[1]*10&"）" -> 活动期间累计充值50000钻（%s/50000） | F451: 5000 | H451: 1 | I451: 0 | J451: 0 | K451: 13393|30501|13418|10014|10022 | L451: 1|1|1|1000|300
A452: 2327 | B452: =INT(RC[-1]/1000) -> 2 | C452: 1 | D452: 1 | E452: =IF(RC[5]=1,"(每日重置)：",)&"活动期间累计充值"&RC[1]*10&"钻（%s/"&RC[1]*10&"）" -> 活动期间累计充值75000钻（%s/75000） | F452: 7500 | H452: 1 | I452: 0 | J452: 0 | K452: 13393|30501|13418|80110|10014 | L452: 1|1|1|1|1500
A453: 2328 | B453: =INT(RC[-1]/1000) -> 2 | C453: 1 | D453: 1 | E453: =IF(RC[5]=1,"(每日重置)：",)&"活动期间累计充值"&RC[1]*10&"钻（%s/"&RC[1]*10&"）" -> 活动期间累计充值100000钻（%s/100000） | F453: 10000 | H453: 1 | I453: 0 | J453: 0 | K453: 13389|80111|13418|30501|10014 | L453: 1|1|1|1|2000
A454: 2329 | B454: =INT(RC[-1]/1000) -> 2 | C454: 1 | D454: 1 | E454: =IF(RC[5]=1,"(每日重置)：",)&"活动期间累计充值"&RC[1]*10&"钻（%s/"&RC[1]*10&"）" -> 活动期间累计充值125000钻（%s/125000） | F454: 12500 | H454: 1 | I454: 0 | J454: 0 | K454: 13389|80111|13418|30501|13017 | L454: 1|1|1|1|250
A455: 2330 | B455: =INT(RC[-1]/1000) -> 2 | C455: 1 | D455: 1 | E455: =IF(RC[5]=1,"(每日重置)：",)&"活动期间累计充值"&RC[1]*10&"钻（%s/"&RC[1]*10&"）" -> 活动期间累计充值250钻（%s/250） | F455: 25 | H455: 1 | I455: 0 | J455: 0 | K455: 10000|10001|10010|10096|42301 | L455: 5|5|50|1|1
A456: 2331 | B456: =INT(RC[-1]/1000) -> 2 | C456: 1 | D456: 1 | E456: =IF(RC[5]=1,"(每日重置)：",)&"活动期间累计充值"&RC[1]*10&"钻（%s/"&RC[1]*10&"）" -> 活动期间累计充值750钻（%s/750） | F456: 75 | H456: 1 | I456: 0 | J456: 0 | K456: 10112|19103|10003|10010|42301 | L456: 10|30|200|200|3
A457: 2332 | B457: =INT(RC[-1]/1000) -> 2 | C457: 1 | D457: 1 | E457: =IF(RC[5]=1,"(每日重置)：",)&"活动期间累计充值"&RC[1]*10&"钻（%s/"&RC[1]*10&"）" -> 活动期间累计充值2500钻（%s/2500） | F457: 250 | H457: 1 | I457: 0 | J457: 0 | K457: 13599|31540|10004|10014|42301 | L457: 20|1|150|150|6
A458: 2333 | B458: =INT(RC[-1]/1000) -> 2 | C458: 1 | D458: 1 | E458: =IF(RC[5]=1,"(每日重置)：",)&"活动期间累计充值"&RC[1]*10&"钻（%s/"&RC[1]*10&"）" -> 活动期间累计充值5000钻（%s/5000） | F458: 500 | H458: 1 | I458: 0 | J458: 0 | K458: 13599|10014|13417|31540|10022 | L458: 20|150|1|1|50
A459: 2334 | B459: =INT(RC[-1]/1000) -> 2 | C459: 1 | D459: 1 | E459: =IF(RC[5]=1,"(每日重置)：",)&"活动期间累计充值"&RC[1]*10&"钻（%s/"&RC[1]*10&"）" -> 活动期间累计充值12500钻（%s/12500） | F459: 1250 | H459: 1 | I459: 0 | J459: 0 | K459: 13599|13418|31540|10009|10022 | L459: 30|1|1|20|100
A460: 2335 | B460: =INT(RC[-1]/1000) -> 2 | C460: 1 | D460: 1 | E460: =IF(RC[5]=1,"(每日重置)：",)&"活动期间累计充值"&RC[1]*10&"钻（%s/"&RC[1]*10&"）" -> 活动期间累计充值25000钻（%s/25000） | F460: 2500 | H460: 1 | I460: 0 | J460: 0 | K460: 13599|30521|80110|10014|10022 | L460: 40|1|1|300|150
A461: 2336 | B461: =INT(RC[-1]/1000) -> 2 | C461: 1 | D461: 1 | E461: =IF(RC[5]=1,"(每日重置)：",)&"活动期间累计充值"&RC[1]*10&"钻（%s/"&RC[1]*10&"）" -> 活动期间累计充值37500钻（%s/37500） | F461: 3750 | H461: 1 | I461: 0 | J461: 0 | K461: 13599|30521|80110|10014|10022 | L461: 40|1|1|800|200
A462: 2337 | B462: =INT(RC[-1]/1000) -> 2 | C462: 1 | D462: 1 | E462: =IF(RC[5]=1,"(每日重置)：",)&"活动期间累计充值"&RC[1]*10&"钻（%s/"&RC[1]*10&"）" -> 活动期间累计充值50000钻（%s/50000） | F462: 5000 | H462: 1 | I462: 0 | J462: 0 | K462: 80110|13418|30521|10014|10022 | L462: 2|1|1|1000|300
A463: 2338 | B463: =INT(RC[-1]/1000) -> 2 | C463: 1 | D463: 1 | E463: =IF(RC[5]=1,"(每日重置)：",)&"活动期间累计充值"&RC[1]*10&"钻（%s/"&RC[1]*10&"）" -> 活动期间累计充值75000钻（%s/75000） | F463: 7500 | H463: 1 | I463: 0 | J463: 0 | K463: 80110|13418|30521|10014|10010 | L463: 2|1|1|1500|2000
A464: 2339 | B464: =INT(RC[-1]/1000) -> 2 | C464: 1 | D464: 1 | E464: =IF(RC[5]=1,"(每日重置)：",)&"活动期间累计充值"&RC[1]*10&"钻（%s/"&RC[1]*10&"）" -> 活动期间累计充值100000钻（%s/100000） | F464: 10000 | H464: 1 | I464: 0 | J464: 0 | K464: 13389|80111|13418|30521|10014 | L464: 1|1|1|1|2000
A465: 2340 | B465: =INT(RC[-1]/1000) -> 2 | C465: 1 | D465: 1 | E465: =IF(RC[5]=1,"(每日重置)：",)&"活动期间累计充值"&RC[1]*10&"钻（%s/"&RC[1]*10&"）" -> 活动期间累计充值125000钻（%s/125000） | F465: 12500 | H465: 1 | I465: 0 | J465: 0 | K465: 13389|80111|13418|30521|13017 | L465: 1|1|1|1|250
A466: 3001 | B466: =INT(RC[-1]/1000) -> 3 | C466: 0 | D466: 0 | F466: 240 | H466: 20 | I466: 1 | J466: 0 | K466: 10019 | L466: 1 | M466: 20 | N466: 打折兑换x=所需
A467: 3002 | B467: =INT(RC[-1]/1000) -> 3 | C467: 0 | D467: 0 | F467: 40 | H467: 10 | I467: 1 | J467: 0 | K467: 10002 | L467: 50 | M467: 20
A468: 3003 | B468: =INT(RC[-1]/1000) -> 3 | C468: 0 | D468: 0 | F468: 72 | H468: 10 | I468: 1 | J468: 0 | K468: 10003 | L468: 30 | M468: 20
A469: 3004 | B469: =INT(RC[-1]/1000) -> 3 | C469: 0 | D469: 0 | F469: 60 | H469: 10 | I469: 1 | J469: 0 | K469: 19103 | L469: 10 | M469: 40
A470: 3005 | B470: =INT(RC[-1]/1000) -> 3 | C470: 0 | D470: 0 | F470: 250 | H470: 2 | I470: 1 | J470: 0 | K470: 10000 | L470: 10
A471: 3006 | B471: =INT(RC[-1]/1000) -> 3 | C471: 0 | D471: 0 | F471: 250 | H471: 2 | I471: 1 | J471: 0 | K471: 10001 | L471: 10
A472: 3007 | B472: =INT(RC[-1]/1000) -> 3 | C472: 0 | D472: 0 | F472: 36 | H472: 15 | I472: 1 | J472: 0 | K472: 10003 | L472: 15 | M472: 20
A473: 3008 | B473: =INT(RC[-1]/1000) -> 3 | C473: 0 | D473: 0 | F473: 400 | H473: 5 | I473: 1 | J473: 0 | K473: 10022 | L473: 10 | M473: 20
A474: 3009 | B474: =INT(RC[-1]/1000) -> 3 | C474: 0 | D474: 0 | F474: 350 | H474: 5 | I474: 1 | J474: 0 | K474: 19103 | L474: 50 | M474: 30
A475: 3010 | B475: =INT(RC[-1]/1000) -> 3 | C475: 0 | D475: 0 | F475: 80 | H475: 5 | I475: 1 | J475: 0 | K475: 10021 | L475: 5 | M475: 20
A476: 3011 | B476: =INT(RC[-1]/1000) -> 3 | C476: 0 | D476: 0 | F476: 100 | H476: 5 | I476: 1 | J476: 0 | K476: 33400 | L476: 1 | M476: 50
A477: 3012 | B477: =INT(RC[-1]/1000) -> 3 | C477: 0 | D477: 0 | F477: 225 | H477: 5 | I477: 1 | J477: 0 | K477: 42301 | L477: 1 | M477: 40
A478: 3013 | B478: =INT(RC[-1]/1000) -> 3 | C478: 0 | D478: 0 | F478: 180 | H478: 5 | I478: 1 | J478: 0 | K478: 19006 | L478: 200 | M478: 10
A479: 3014 | B479: =INT(RC[-1]/1000) -> 3 | C479: 0 | D479: 0 | F479: 160 | H479: 5 | I479: 1 | J479: 0 | K479: 10014 | L479: 10 | M479: 20
A480: 3015 | B480: =INT(RC[-1]/1000) -> 3 | C480: 0 | D480: 0 | F480: 210 | H480: 10 | I480: 1 | J480: 0 | K480: 10004 | L480: 20 | M480: 30
A481: 3016 | B481: =INT(RC[-1]/1000) -> 3 | C481: 0 | D481: 0 | F481: 160 | H481: 5 | I481: 1 | J481: 0 | K481: 10010 | L481: 40 | M481: 20
A482: 3017 | B482: =INT(RC[-1]/1000) -> 3 | C482: 0 | D482: 0 | F482: 40 | H482: 10 | I482: 1 | J482: 0 | K482: 10002 | L482: 50 | M482: 20
A483: 3018 | B483: =INT(RC[-1]/1000) -> 3 | C483: 0 | D483: 0 | F483: 800 | H483: 5 | I483: 1 | J483: 0 | K483: 19103 | L483: 100 | M483: 20
A484: 3019 | B484: =INT(RC[-1]/1000) -> 3 | C484: 0 | D484: 0 | F484: 90 | H484: 20 | I484: 1 | J484: 0 | K484: 10003 | L484: 50 | M484: 40
A485: 3020 | B485: =INT(RC[-1]/1000) -> 3 | C485: 0 | D485: 0 | F485: 2250 | H485: 1 | I485: 1 | J485: 0 | K485: 10036 | L485: 1 | M485: 10
A486: 3021 | B486: =INT(RC[-1]/1000) -> 3 | C486: 0 | D486: 0 | F486: 2250 | H486: 1 | I486: 1 | J486: 0 | K486: 10035 | L486: 1 | M486: 10
A487: 3022 | B487: =INT(RC[-1]/1000) -> 3 | C487: 0 | D487: 0 | F487: 2250 | H487: 1 | I487: 1 | J487: 0 | K487: 10040 | L487: 1 | M487: 10
A488: 3023 | B488: =INT(RC[-1]/1000) -> 3 | C488: 0 | D488: 0 | F488: 2250 | H488: 1 | I488: 1 | J488: 0 | K488: 10034 | L488: 1 | M488: 10
A489: 3024 | B489: =INT(RC[-1]/1000) -> 3 | C489: 0 | D489: 0 | F489: 250 | H489: 5 | I489: 1 | J489: 0 | K489: 19103 | L489: 50 | M489: 50
A490: 3025 | B490: =INT(RC[-1]/1000) -> 3 | C490: 0 | D490: 0 | F490: 350 | H490: 5 | I490: 1 | J490: 0 | K490: 10022 | L490: 10 | M490: 30
A491: 3026 | B491: =INT(RC[-1]/1000) -> 3 | C491: 0 | D491: 0 | F491: 80 | H491: 5 | I491: 1 | J491: 0 | K491: 10021 | L491: 5 | M491: 20
A492: 3027 | B492: =INT(RC[-1]/1000) -> 3 | C492: 0 | D492: 0 | F492: 100 | H492: 5 | I492: 1 | J492: 0 | K492: 33400 | L492: 1 | M492: 50
A493: 3028 | B493: =INT(RC[-1]/1000) -> 3 | C493: 0 | D493: 0 | F493: 150 | H493: 5 | I493: 1 | J493: 0 | K493: 42301 | L493: 1 | M493: 60
A494: 3029 | B494: =INT(RC[-1]/1000) -> 3 | C494: 0 | D494: 0 | F494: 75 | H494: 30 | I494: 1 | J494: 0 | K494: 10003 | L494: 50 | M494: 50
A495: 3030 | B495: =INT(RC[-1]/1000) -> 3 | C495: 0 | D495: 0 | F495: 200 | H495: 5 | I495: 1 | J495: 0 | K495: 19103 | L495: 50 | M495: 60
A496: 3031 | B496: =INT(RC[-1]/1000) -> 3 | C496: 0 | D496: 0 | F496: 350 | H496: 5 | I496: 1 | J496: 0 | K496: 10022 | L496: 10 | M496: 30
A497: 3032 | B497: =INT(RC[-1]/1000) -> 3 | C497: 0 | D497: 0 | F497: 80 | H497: 5 | I497: 1 | J497: 0 | K497: 10021 | L497: 5 | M497: 20
A498: 3033 | B498: =INT(RC[-1]/1000) -> 3 | C498: 0 | D498: 0 | F498: 100 | H498: 5 | I498: 1 | J498: 0 | K498: 33400 | L498: 1 | M498: 50
A499: 3034 | B499: =INT(RC[-1]/1000) -> 3 | C499: 0 | D499: 0 | F499: 150 | H499: 5 | I499: 1 | J499: 0 | K499: 42301 | L499: 1 | M499: 60
A500: 3035 | B500: =INT(RC[-1]/1000) -> 3 | C500: 0 | D500: 0 | F500: 88 | H500: 50 | I500: 1 | J500: 0 | K500: 10008 | L500: 50 | M500: 70
A501: 3036 | B501: =INT(RC[-1]/1000) -> 3 | C501: 0 | D501: 0 | F501: 184 | H501: 5 | I501: 1 | J501: 0 | K501: 13017 | L501: 1 | M501: 90
A502: 3037 | B502: =INT(RC[-1]/1000) -> 3 | C502: 0 | D502: 0 | F502: 46 | H502: 5 | I502: 1 | J502: 0 | K502: 13016 | L502: 1 | M502: 90
A503: 3038 | B503: =INT(RC[-1]/1000) -> 3 | C503: 0 | D503: 0 | F503: 11 | H503: 10 | I503: 1 | J503: 0 | K503: 13015 | L503: 1 | M503: 90
A504: 3039 | B504: =INT(RC[-1]/1000) -> 3 | C504: 0 | D504: 0 | F504: 405 | H504: 4 | I504: 1 | J504: 0 | K504: 13401 | L504: 10 | M504: 90
A505: 3040 | B505: =INT(RC[-1]/1000) -> 3 | C505: 0 | D505: 0 | F505: 2560 | H505: 1 | I505: 1 | J505: 0 | K505: 13379 | L505: 1 | M505: 80
A506: 3041 | B506: =INT(RC[-1]/1000) -> 3 | C506: 0 | D506: 0 | F506: 1920 | H506: 1 | I506: 1 | J506: 0 | K506: 13380 | L506: 1 | M506: 80
A507: 3042 | B507: =INT(RC[-1]/1000) -> 3 | C507: 0 | D507: 0 | F507: 2250 | H507: 1 | I507: 1 | J507: 0 | K507: 10036 | L507: 1 | M507: 90
A508: 3043 | B508: =INT(RC[-1]/1000) -> 3 | C508: 0 | D508: 0 | F508: 2250 | H508: 1 | I508: 1 | J508: 0 | K508: 10035 | L508: 1 | M508: 90
A509: 3044 | B509: =INT(RC[-1]/1000) -> 3 | C509: 0 | D509: 0 | F509: 2250 | H509: 1 | I509: 1 | J509: 0 | K509: 10040 | L509: 1 | M509: 90
A510: 3045 | B510: =INT(RC[-1]/1000) -> 3 | C510: 0 | D510: 0 | F510: 2250 | H510: 1 | I510: 1 | J510: 0 | K510: 10034 | L510: 1 | M510: 90
A511: 3046 | B511: =INT(RC[-1]/1000) -> 3 | C511: 0 | D511: 0 | F511: 350 | H511: 10 | I511: 1 | J511: 0 | K511: 10022 | L511: 10 | M511: 70
A512: 3047 | B512: =INT(RC[-1]/1000) -> 3 | C512: 0 | D512: 0 | F512: 80 | H512: 10 | I512: 1 | J512: 0 | K512: 10021 | L512: 5 | M512: 80
A513: 3048 | B513: =INT(RC[-1]/1000) -> 3 | C513: 0 | D513: 0 | F513: 100 | H513: 10 | I513: 1 | J513: 0 | K513: 33400 | L513: 1 | M513: 50
A514: 3049 | B514: =INT(RC[-1]/1000) -> 3 | C514: 0 | D514: 0 | F514: 150 | H514: 10 | I514: 1 | J514: 0 | K514: 42301 | L514: 1 | M514: 40
A515: 3050 | B515: =INT(RC[-1]/1000) -> 3 | C515: 0 | D515: 0 | F515: 75 | H515: 50 | I515: 1 | J515: 0 | K515: 10008 | L515: 50 | M515: 60
A516: 3051 | B516: =INT(RC[-1]/1000) -> 3 | C516: 0 | D516: 0 | F516: 163 | H516: 5 | I516: 1 | J516: 0 | K516: 13017 | L516: 1 | M516: 80
A517: 3052 | B517: =INT(RC[-1]/1000) -> 3 | C517: 0 | D517: 0 | F517: 41 | H517: 5 | I517: 1 | J517: 0 | K517: 13016 | L517: 1 | M517: 80
A518: 3053 | B518: =INT(RC[-1]/1000) -> 3 | C518: 0 | D518: 0 | F518: 10 | H518: 10 | I518: 1 | J518: 0 | K518: 13015 | L518: 1 | M518: 80
A519: 3054 | B519: =INT(RC[-1]/1000) -> 3 | C519: 0 | D519: 0 | F519: 360 | H519: 4 | I519: 1 | J519: 0 | K519: 12532 | L519: 10 | M519: 80
A520: 3055 | B520: =INT(RC[-1]/1000) -> 3 | C520: 0 | D520: 0 | F520: 2240 | H520: 1 | I520: 1 | J520: 0 | K520: 13379 | L520: 1 | M520: 70
A521: 3056 | B521: =INT(RC[-1]/1000) -> 3 | C521: 0 | D521: 0 | F521: 1680 | H521: 1 | I521: 1 | J521: 0 | K521: 13380 | L521: 1 | M521: 70
A522: 3057 | B522: =INT(RC[-1]/1000) -> 3 | C522: 0 | D522: 0 | F522: 2000 | H522: 1 | I522: 1 | J522: 0 | K522: 10036 | L522: 1 | M522: 80
A523: 3058 | B523: =INT(RC[-1]/1000) -> 3 | C523: 0 | D523: 0 | F523: 2000 | H523: 1 | I523: 1 | J523: 0 | K523: 10035 | L523: 1 | M523: 80
A524: 3059 | B524: =INT(RC[-1]/1000) -> 3 | C524: 0 | D524: 0 | F524: 2000 | H524: 1 | I524: 1 | J524: 0 | K524: 10040 | L524: 1 | M524: 80
A525: 3060 | B525: =INT(RC[-1]/1000) -> 3 | C525: 0 | D525: 0 | F525: 2000 | H525: 1 | I525: 1 | J525: 0 | K525: 10034 | L525: 1 | M525: 80
A526: 3061 | B526: =INT(RC[-1]/1000) -> 3 | C526: 0 | D526: 0 | F526: 350 | H526: 10 | I526: 1 | J526: 0 | K526: 10022 | L526: 10 | M526: 70
A527: 3062 | B527: =INT(RC[-1]/1000) -> 3 | C527: 0 | D527: 0 | F527: 80 | H527: 10 | I527: 1 | J527: 0 | K527: 10021 | L527: 5 | M527: 80
A528: 3063 | B528: =INT(RC[-1]/1000) -> 3 | C528: 0 | D528: 0 | F528: 100 | H528: 10 | I528: 1 | J528: 0 | K528: 33400 | L528: 1 | M528: 50
A529: 3064 | B529: =INT(RC[-1]/1000) -> 3 | C529: 0 | D529: 0 | F529: 150 | H529: 10 | I529: 1 | J529: 0 | K529: 42301 | L529: 1 | M529: 40
A530: 3065 | B530: =INT(RC[-1]/1000) -> 3 | C530: 0 | D530: 0 | F530: 630 | H530: 2 | I530: 1 | J530: 0 | K530: 13599 | L530: 5 | M530: 70
A531: 3066 | B531: =INT(RC[-1]/1000) -> 3 | C531: 0 | D531: 0 | F531: 2250 | H531: 2 | I531: 1 | J531: 0 | K531: 10036 | L531: 1 | M531: 90
A532: 3067 | B532: =INT(RC[-1]/1000) -> 3 | C532: 0 | D532: 0 | F532: 2250 | H532: 2 | I532: 1 | J532: 0 | K532: 10035 | L532: 1 | M532: 90
A533: 3068 | B533: =INT(RC[-1]/1000) -> 3 | C533: 0 | D533: 0 | F533: 2250 | H533: 2 | I533: 1 | J533: 0 | K533: 10040 | L533: 1 | M533: 90
A534: 3069 | B534: =INT(RC[-1]/1000) -> 3 | C534: 0 | D534: 0 | F534: 2250 | H534: 2 | I534: 1 | J534: 0 | K534: 10034 | L534: 1 | M534: 90
A535: 3070 | B535: =INT(RC[-1]/1000) -> 3 | C535: 0 | D535: 0 | F535: 405 | H535: 2 | I535: 1 | J535: 0 | K535: 13401 | L535: 10 | M535: 80
A536: 3071 | B536: =INT(RC[-1]/1000) -> 3 | C536: 0 | D536: 0 | F536: 350 | H536: 2 | I536: 1 | J536: 0 | K536: 10022 | L536: 10 | M536: 80
A537: 3072 | B537: =INT(RC[-1]/1000) -> 3 | C537: 0 | D537: 0 | F537: 80 | H537: 2 | I537: 1 | J537: 0 | K537: 10021 | L537: 5 | M537: 90
A538: 3073 | B538: =INT(RC[-1]/1000) -> 3 | C538: 0 | D538: 0 | F538: 100 | H538: 2 | I538: 1 | J538: 0 | K538: 33400 | L538: 1 | M538: 90
A539: 3074 | B539: =INT(RC[-1]/1000) -> 3 | C539: 0 | D539: 0 | F539: 150 | H539: 2 | I539: 1 | J539: 0 | K539: 42301 | L539: 1 | M539: 90
A540: 3075 | B540: =INT(RC[-1]/1000) -> 3 | C540: 0 | D540: 0 | F540: 2560 | H540: 2 | I540: 1 | J540: 0 | K540: 13379 | L540: 1 | M540: 90
A541: 3076 | B541: =INT(RC[-1]/1000) -> 3 | C541: 0 | D541: 0 | F541: 1920 | H541: 2 | I541: 1 | J541: 0 | K541: 13380 | L541: 1 | M541: 70
A542: 3077 | B542: =INT(RC[-1]/1000) -> 3 | C542: 0 | D542: 0 | F542: 630 | H542: 2 | I542: 1 | J542: 0 | K542: 13599 | L542: 5 | M542: 90
A543: 3078 | B543: =INT(RC[-1]/1000) -> 3 | C543: 0 | D543: 0 | F543: 2000 | H543: 2 | I543: 1 | J543: 0 | K543: 13324 | L543: 1 | M543: 80
A544: 3079 | B544: =INT(RC[-1]/1000) -> 3 | C544: 0 | D544: 0 | F544: 100 | H544: 4 | I544: 1 | J544: 0 | K544: 19034 | L544: 5000 | M544: 40
A545: 3080 | B545: =INT(RC[-1]/1000) -> 3 | C545: 0 | D545: 0 | F545: 1200 | H545: 10 | I545: 1 | J545: 0 | K545: 10014 | L545: 150 | M545: 40
A546: 3081 | B546: =INT(RC[-1]/1000) -> 3 | C546: 0 | D546: 0 | F546: 2400 | H546: 4 | I546: 1 | J546: 0 | K546: 13646 | L546: 100 | M546: 60
A547: 3082 | B547: =INT(RC[-1]/1000) -> 3 | C547: 0 | D547: 0 | F547: 2250 | H547: 2 | I547: 1 | J547: 0 | K547: 10039 | L547: 1 | M547: 90
A548: 3083 | B548: =INT(RC[-1]/1000) -> 3 | C548: 0 | D548: 0 | F548: 200 | H548: 10 | I548: 1 | J548: 0 | K548: 10022 | L548: 10 | M548: 40
A549: 3084 | B549: =INT(RC[-1]/1000) -> 3 | C549: 0 | D549: 0 | F549: 225 | H549: 10 | I549: 1 | J549: 0 | K549: 42301 | L549: 1 | M549: 30
A550: 3085 | B550: =INT(RC[-1]/1000) -> 3 | C550: 0 | D550: 0 | F550: 140 | H550: 10 | I550: 1 | J550: 0 | K550: 33400 | L550: 1 | M550: 50
A551: 3086 | B551: =INT(RC[-1]/1000) -> 3 | C551: 0 | D551: 0 | F551: 1000 | H551: 10 | I551: 1 | J551: 0 | K551: 10008 | L551: 500 | M551: 50
A552: 3087 | B552: =INT(RC[-1]/1000) -> 3 | C552: 0 | D552: 0 | F552: 1400 | H552: 2 | I552: 1 | J552: 0 | K552: 10115 | L552: 20 | M552: 70
A553: 3088 | B553: =INT(RC[-1]/1000) -> 3 | C553: 0 | D553: 0 | F553: 1120 | H553: 2 | I553: 1 | J553: 0 | K553: 10118 | L553: 20 | M553: 70
A554: 3089 | B554: =INT(RC[-1]/1000) -> 3 | C554: 0 | D554: 0 | F554: 630 | H554: 2 | I554: 1 | J554: 0 | K554: 13599 | L554: 5 | M554: 90
A555: 3090 | B555: =INT(RC[-1]/1000) -> 3 | C555: 0 | D555: 0 | F555: 2000 | H555: 2 | I555: 1 | J555: 0 | K555: 13324 | L555: 1 | M555: 80
A556: 3091 | B556: =INT(RC[-1]/1000) -> 3 | C556: 0 | D556: 0 | F556: 900 | H556: 4 | I556: 1 | J556: 0 | K556: 10004 | L556: 100 | M556: 60
A557: 3092 | B557: =INT(RC[-1]/1000) -> 3 | C557: 0 | D557: 0 | F557: 1500 | H557: 4 | I557: 1 | J557: 0 | K557: 10014 | L557: 150 | M557: 50
A558: 3093 | B558: =INT(RC[-1]/1000) -> 3 | C558: 0 | D558: 0 | F558: 1600 | H558: 2 | I558: 1 | J558: 0 | K558: 13646 | L558: 100 | M558: 40
A559: 3094 | B559: =INT(RC[-1]/1000) -> 3 | C559: 0 | D559: 0 | F559: 2250 | H559: 2 | I559: 1 | J559: 0 | K559: 10039 | L559: 1 | M559: 90
A560: 3095 | B560: =INT(RC[-1]/1000) -> 3 | C560: 0 | D560: 0 | F560: 200 | H560: 10 | I560: 1 | J560: 0 | K560: 10022 | L560: 10 | M560: 40
A561: 3096 | B561: =INT(RC[-1]/1000) -> 3 | C561: 0 | D561: 0 | F561: 115 | H561: 10 | I561: 1 | J561: 0 | K561: 42301 | L561: 1 | M561: 30
A562: 3097 | B562: =INT(RC[-1]/1000) -> 3 | C562: 0 | D562: 0 | F562: 100 | H562: 10 | I562: 1 | J562: 0 | K562: 33400 | L562: 1 | M562: 50
A563: 3098 | B563: =INT(RC[-1]/1000) -> 3 | C563: 0 | D563: 0 | F563: 625 | H563: 10 | I563: 1 | J563: 0 | K563: 10008 | L563: 500 | M563: 50
A564: 3099 | B564: 3 | C564: 0 | D564: 0 | F564: 1400 | H564: 2 | I564: 1 | J564: 0 | K564: 10115 | L564: 20 | M564: 70
A565: 3100 | B565: 3 | C565: 0 | D565: 0 | F565: 1120 | H565: 2 | I565: 1 | J565: 0 | K565: 10118 | L565: 20 | M565: 70
A566: 4001 | B566: =INT(RC[-1]/1000) -> 4 | C566: 0 | D566: 0 | F566: 10084 | G566: 2250 | H566: 10 | I566: 1 | J566: 0 | K566: 10034 | L566: 1 | N566: 代币兑换x=物品ID；y=所需数量
A567: 4002 | B567: =INT(RC[-1]/1000) -> 4 | C567: 0 | D567: 0 | F567: 10084 | G567: 2250 | H567: 10 | I567: 1 | J567: 0 | K567: 10035 | L567: 1
A568: 4003 | B568: =INT(RC[-1]/1000) -> 4 | C568: 0 | D568: 0 | F568: 10084 | G568: 2250 | H568: 10 | I568: 1 | J568: 0 | K568: 10036 | L568: 1
A569: 4004 | B569: =INT(RC[-1]/1000) -> 4 | C569: 0 | D569: 0 | F569: 10084 | G569: 2250 | H569: 10 | I569: 1 | J569: 0 | K569: 10040 | L569: 1
A570: 4005 | B570: =INT(RC[-1]/1000) -> 4 | C570: 0 | D570: 0 | F570: 10084 | G570: 380 | H570: 8 | I570: 1 | J570: 0 | K570: 13318 | L570: 1
A571: 4006 | B571: =INT(RC[-1]/1000) -> 4 | C571: 0 | D571: 0 | F571: 10084 | G571: 380 | H571: 8 | I571: 1 | J571: 0 | K571: 13319 | L571: 1
A572: 4007 | B572: =INT(RC[-1]/1000) -> 4 | C572: 0 | D572: 0 | F572: 10084 | G572: 82 | H572: 60 | I572: 1 | J572: 0 | K572: 11401 | L572: 1
A573: 4008 | B573: =INT(RC[-1]/1000) -> 4 | C573: 0 | D573: 0 | F573: 10084 | G573: 82 | H573: 60 | I573: 1 | J573: 0 | K573: 11402 | L573: 1
A574: 4009 | B574: =INT(RC[-1]/1000) -> 4 | C574: 0 | D574: 0 | F574: 10084 | G574: 82 | H574: 60 | I574: 1 | J574: 0 | K574: 11403 | L574: 1
A575: 4010 | B575: =INT(RC[-1]/1000) -> 4 | C575: 0 | D575: 0 | F575: 10084 | G575: 82 | H575: 60 | I575: 1 | J575: 0 | K575: 11404 | L575: 1
A576: 4011 | B576: =INT(RC[-1]/1000) -> 4 | C576: 0 | D576: 0 | F576: 10084 | G576: 36 | H576: 40 | I576: 1 | J576: 0 | K576: 11305 | L576: 1
A577: 4012 | B577: =INT(RC[-1]/1000) -> 4 | C577: 0 | D577: 0 | F577: 10084 | G577: 36 | H577: 40 | I577: 1 | J577: 0 | K577: 11306 | L577: 1
A578: 4013 | B578: =INT(RC[-1]/1000) -> 4 | C578: 0 | D578: 0 | F578: 10084 | G578: 36 | H578: 40 | I578: 1 | J578: 0 | K578: 11307 | L578: 1
A579: 4014 | B579: =INT(RC[-1]/1000) -> 4 | C579: 0 | D579: 0 | F579: 10084 | G579: 36 | H579: 40 | I579: 1 | J579: 0 | K579: 11308 | L579: 1
A580: 4015 | B580: =INT(RC[-1]/1000) -> 4 | C580: 0 | D580: 0 | F580: 10084 | G580: 45 | H580: 500 | I580: 1 | J580: 0 | K580: 10022 | L580: 1
A581: 4016 | B581: =INT(RC[-1]/1000) -> 4 | C581: 0 | D581: 0 | F581: 10084 | G581: 300 | H581: 50 | I581: 1 | J581: 0 | K581: 42301 | L581: 1
A582: 4017 | B582: =INT(RC[-1]/1000) -> 4 | C582: 0 | D582: 0 | F582: 10084 | G582: 10 | H582: 800 | I582: 1 | J582: 0 | K582: 10004 | L582: 1
A583: 4018 | B583: =INT(RC[-1]/1000) -> 4 | C583: 0 | D583: 0 | F583: 10084 | G583: 20 | H583: 200 | I583: 1 | J583: 0 | K583: 10014 | L583: 1
A584: 4019 | B584: =INT(RC[-1]/1000) -> 4 | C584: 0 | D584: 0 | F584: 10084 | G584: 5 | H584: 500 | I584: 1 | J584: 0 | K584: 10010 | L584: 1
A585: 4020 | B585: =INT(RC[-1]/1000) -> 4 | C585: 0 | D585: 0 | F585: 10084 | G585: 90 | H585: 50 | I585: 1 | J585: 0 | K585: 33300 | L585: 1
A586: 4021 | B586: =INT(RC[-1]/1000) -> 4 | C586: 0 | D586: 0 | F586: 10084 | G586: 9 | H586: 500 | I586: 1 | J586: 0 | K586: 19103 | L586: 1
A587: 4022 | B587: =INT(RC[-1]/1000) -> 4 | C587: 0 | D587: 0 | F587: 10107 | G587: 1 | H587: 999 | I587: 1 | J587: 0 | K587: 10108 | L587: 1
A588: 4023 | B588: =INT(RC[-1]/1000) -> 4 | C588: 0 | D588: 0 | F588: 10107 | G588: 10 | H588: 999 | I588: 1 | J588: 0 | K588: 10108 | L588: 10
A589: 4024 | B589: =INT(RC[-1]/1000) -> 4 | C589: 0 | D589: 0 | F589: 10107 | G589: 100 | H589: 999 | I589: 1 | J589: 0 | K589: 10108 | L589: 100
A590: 5001 | B590: =INT(RC[-1]/1000) -> 5 | C590: 0 | D590: 1 | E590: =MID(RC[1],5,2)*1&"月"&MID(RC[1],7,2)*1&"日登陆即可领取" -> 4月29日登陆即可领取 | F590: 20180429 | H590: 1 | I590: 0 | J590: 0 | K590: 10084|19103 | L590: 100|5 | N590: 登陆x=年月日
A591: 5002 | B591: =INT(RC[-1]/1000) -> 5 | C591: 0 | D591: 1 | E591: =MID(RC[1],5,2)*1&"月"&MID(RC[1],7,2)*1&"日登陆即可领取" -> 4月30日登陆即可领取 | F591: 20180430 | H591: 1 | I591: 0 | J591: 0 | K591: 10084|19103 | L591: 100|10
A592: 5003 | B592: =INT(RC[-1]/1000) -> 5 | C592: 0 | D592: 1 | E592: =MID(RC[1],5,2)*1&"月"&MID(RC[1],7,2)*1&"日登陆即可领取" -> 5月1日登陆即可领取 | F592: 20180501 | H592: 1 | I592: 0 | J592: 0 | K592: 10084|19103 | L592: 100|20
A593: 5004 | B593: =INT(RC[-1]/1000) -> 5 | C593: 0 | D593: 1 | E593: =MID(RC[1],5,2)*1&"月"&MID(RC[1],7,2)*1&"日登陆即可领取" -> 5月2日登陆即可领取 | F593: 20180502 | H593: 1 | I593: 0 | J593: 0 | K593: 10084|19103 | L593: 100|30
A594: 5005 | B594: =INT(RC[-1]/1000) -> 5 | C594: 0 | D594: 1 | E594: =MID(RC[1],5,2)*1&"月"&MID(RC[1],7,2)*1&"日登陆即可领取" -> 5月3日登陆即可领取 | F594: 20180503 | H594: 1 | I594: 0 | J594: 0 | K594: 10084|19103 | L594: 100|40
A595: 5006 | B595: =INT(RC[-1]/1000) -> 5 | C595: 0 | D595: 1 | E595: =MID(RC[1],5,2)*1&"月"&MID(RC[1],7,2)*1&"日登陆即可领取" -> 5月4日登陆即可领取 | F595: 20180504 | H595: 1 | I595: 0 | J595: 0 | K595: 10084|19103 | L595: 100|50
A596: 5007 | B596: =INT(RC[-1]/1000) -> 5 | C596: 0 | D596: 1 | E596: =MID(RC[1],5,2)*1&"月"&MID(RC[1],7,2)*1&"日登陆即可领取" -> 5月5日登陆即可领取 | F596: 20180505 | H596: 1 | I596: 0 | J596: 0 | K596: 10084|19103 | L596: 100|60
A597: 5008 | B597: =INT(RC[-1]/1000) -> 5 | C597: 0 | D597: 1 | E597: =MID(RC[1],5,2)*1&"月"&MID(RC[1],7,2)*1&"日登陆即可领取" -> 6月16日登陆即可领取 | F597: 20180616 | H597: 1 | I597: 0 | J597: 0 | K597: 10078|10077 | L597: 5|10 | N597: 登陆x=年月日
A598: 5009 | B598: =INT(RC[-1]/1000) -> 5 | C598: 0 | D598: 1 | E598: =MID(RC[1],5,2)*1&"月"&MID(RC[1],7,2)*1&"日登陆即可领取" -> 6月17日登陆即可领取 | F598: 20180617 | H598: 1 | I598: 0 | J598: 0 | K598: 10078|10077 | L598: 5|10
A599: 5010 | B599: =INT(RC[-1]/1000) -> 5 | C599: 0 | D599: 1 | E599: =MID(RC[1],5,2)*1&"月"&MID(RC[1],7,2)*1&"日登陆即可领取" -> 6月18日登陆即可领取 | F599: 20180618 | H599: 1 | I599: 0 | J599: 0 | K599: 10078|10077 | L599: 5|10
A600: 5011 | B600: =INT(RC[-1]/1000) -> 5 | C600: 0 | D600: 1 | E600: =MID(RC[1],5,2)*1&"月"&MID(RC[1],7,2)*1&"日登陆即可领取" -> 6月19日登陆即可领取 | F600: 20180619 | H600: 1 | I600: 0 | J600: 0 | K600: 10078|10077 | L600: 5|10
A601: 5012 | B601: =INT(RC[-1]/1000) -> 5 | C601: 0 | D601: 1 | E601: =MID(RC[1],5,2)*1&"月"&MID(RC[1],7,2)*1&"日登陆即可领取" -> 6月20日登陆即可领取 | F601: 20180620 | H601: 1 | I601: 0 | J601: 0 | K601: 10078|10077 | L601: 5|10
A602: 5013 | B602: =INT(RC[-1]/1000) -> 5 | C602: 0 | D602: 1 | E602: =MID(RC[1],5,2)*1&"月"&MID(RC[1],7,2)*1&"日登陆即可领取" -> 8月17日登陆即可领取 | F602: 20180817 | H602: 1 | I602: 0 | J602: 0 | K602: 10074|10073 | L602: 5|10 | N602: 登陆x=年月日
A603: 5014 | B603: =INT(RC[-1]/1000) -> 5 | C603: 0 | D603: 1 | E603: =MID(RC[1],5,2)*1&"月"&MID(RC[1],7,2)*1&"日登陆即可领取" -> 8月18日登陆即可领取 | F603: 20180818 | H603: 1 | I603: 0 | J603: 0 | K603: 10074|10073 | L603: 5|10
A604: 5015 | B604: =INT(RC[-1]/1000) -> 5 | C604: 0 | D604: 1 | E604: =MID(RC[1],5,2)*1&"月"&MID(RC[1],7,2)*1&"日登陆即可领取" -> 8月19日登陆即可领取 | F604: 20180819 | H604: 1 | I604: 0 | J604: 0 | K604: 10074|10073 | L604: 5|10
A605: 5016 | B605: =INT(RC[-1]/1000) -> 5 | C605: 0 | D605: 1 | E605: =MID(RC[1],5,2)*1&"月"&MID(RC[1],7,2)*1&"日登陆即可领取" -> 8月20日登陆即可领取 | F605: 20180820 | H605: 1 | I605: 0 | J605: 0 | K605: 10074|10073 | L605: 5|10
A606: 5017 | B606: =INT(RC[-1]/1000) -> 5 | C606: 0 | D606: 1 | E606: =MID(RC[1],5,2)*1&"月"&MID(RC[1],7,2)*1&"日登陆即可领取" -> 8月21日登陆即可领取 | F606: 20180821 | H606: 1 | I606: 0 | J606: 0 | K606: 10074|10073 | L606: 5|10
A607: 5018 | B607: =INT(RC[-1]/1000) -> 5 | C607: 0 | D607: 1 | E607: =MID(RC[1],5,2)*1&"月"&MID(RC[1],7,2)*1&"日登陆即可领取" -> 8月22日登陆即可领取 | F607: 20180822 | H607: 1 | I607: 0 | J607: 0 | K607: 10074|10073 | L607: 5|10
A608: 5019 | B608: =INT(RC[-1]/1000) -> 5 | C608: 0 | D608: 1 | E608: =MID(RC[1],5,2)*1&"月"&MID(RC[1],7,2)*1&"日登陆即可领取" -> 8月23日登陆即可领取 | F608: 20180823 | H608: 1 | I608: 0 | J608: 0 | K608: 10074|10073 | L608: 5|10
A609: 5020 | B609: =INT(RC[-1]/1000) -> 5 | C609: 0 | D609: 1 | E609: =MID(RC[1],5,2)*1&"月"&MID(RC[1],7,2)*1&"日登陆即可领取" -> 2月4日登陆即可领取 | F609: 20190204 | H609: 1 | I609: 0 | J609: 0 | K609: 13058|10089|10088 | L609: 1|5|10
A610: 5021 | B610: =INT(RC[-1]/1000) -> 5 | C610: 0 | D610: 1 | E610: =MID(RC[1],5,2)*1&"月"&MID(RC[1],7,2)*1&"日登陆即可领取" -> 2月5日登陆即可领取 | F610: 20190205 | H610: 1 | I610: 0 | J610: 0 | K610: 13058|10089|10088 | L610: 1|5|10
A611: 5022 | B611: =INT(RC[-1]/1000) -> 5 | C611: 0 | D611: 1 | E611: =MID(RC[1],5,2)*1&"月"&MID(RC[1],7,2)*1&"日登陆即可领取" -> 2月6日登陆即可领取 | F611: 20190206 | H611: 1 | I611: 0 | J611: 0 | K611: 13058|10089|10088 | L611: 2|5|10
A612: 5023 | B612: =INT(RC[-1]/1000) -> 5 | C612: 0 | D612: 1 | E612: =MID(RC[1],5,2)*1&"月"&MID(RC[1],7,2)*1&"日登陆即可领取" -> 2月7日登陆即可领取 | F612: 20190207 | H612: 1 | I612: 0 | J612: 0 | K612: 13058|10089|10088 | L612: 2|5|10
A613: 5024 | B613: =INT(RC[-1]/1000) -> 5 | C613: 0 | D613: 1 | E613: =MID(RC[1],5,2)*1&"月"&MID(RC[1],7,2)*1&"日登陆即可领取" -> 2月8日登陆即可领取 | F613: 20190208 | H613: 1 | I613: 0 | J613: 0 | K613: 13058|10089|10088 | L613: 3|5|10
A614: 5025 | B614: =INT(RC[-1]/1000) -> 5 | C614: 0 | D614: 1 | E614: =MID(RC[1],5,2)*1&"月"&MID(RC[1],7,2)*1&"日登陆即可领取" -> 2月9日登陆即可领取 | F614: 20190209 | H614: 1 | I614: 0 | J614: 0 | K614: 13058|10089|10088 | L614: 3|5|10
A615: 5026 | B615: =INT(RC[-1]/1000) -> 5 | C615: 0 | D615: 1 | E615: =MID(RC[1],5,2)*1&"月"&MID(RC[1],7,2)*1&"日登陆即可领取" -> 2月10日登陆即可领取 | F615: 20190210 | H615: 1 | I615: 0 | J615: 0 | K615: 13058|10089|10088 | L615: 4|5|10
A616: 5027 | B616: =INT(RC[-1]/1000) -> 5 | C616: 0 | D616: 1 | E616: =MID(RC[1],5,2)*1&"月"&MID(RC[1],7,2)*1&"日登陆即可领取" -> 2月11日登陆即可领取 | F616: 20190211 | H616: 1 | I616: 0 | J616: 0 | K616: 19006|13379|13324 | L616: 2019|1|1 | N616: 登陆x=年月日
A617: 5028 | B617: =INT(RC[-1]/1000) -> 5 | C617: 0 | D617: 1 | E617: =MID(RC[1],5,2)*1&"月"&MID(RC[1],7,2)*1&"日登陆即可领取" -> 2月12日登陆即可领取 | F617: 20190212 | H617: 1 | I617: 0 | J617: 0 | K617: 10013|42201 | L617: 20|19
A618: 5029 | B618: =INT(RC[-1]/1000) -> 5 | C618: 0 | D618: 1 | E618: =MID(RC[1],5,2)*1&"月"&MID(RC[1],7,2)*1&"日登陆即可领取" -> 2月13日登陆即可领取 | F618: 20190213 | H618: 1 | I618: 0 | J618: 0 | K618: 33200|10014 | L618: 20|19
A619: 5030 | B619: =INT(RC[-1]/1000) -> 5 | C619: 0 | D619: 1 | E619: =MID(RC[1],5,2)*1&"月"&MID(RC[1],7,2)*1&"日登陆即可领取" -> 2月14日登陆即可领取 | F619: 20190214 | H619: 1 | I619: 0 | J619: 0 | K619: 19012|19013|19014|19030 | L619: 2019|2019|2019|2019
A620: 5031 | B620: =INT(RC[-1]/1000) -> 5 | C620: 0 | D620: 1 | E620: =MID(RC[1],5,2)*1&"月"&MID(RC[1],7,2)*1&"日登陆即可领取" -> 2月15日登陆即可领取 | F620: 20190215 | H620: 1 | I620: 0 | J620: 0 | K620: 10003|42301 | L620: 201|9
A621: 6000 | B621: =INT(RC[-1]/1000) -> 6 | C621: 1 | D621: 1 | E621: ="累计通关主线副本"&RC[1]&"次（%s/"&RC[1]&"）" -> 累计通关主线副本20次（%s/20） | F621: 20 | H621: 1 | I621: 0 | J621: 0 | K621: 10000|10001|10108 | L621: 1|1|5 | N621: 通关主线副本关卡（包括扫荡）x=所需次数
A622: 6001 | B622: =INT(RC[-1]/1000) -> 6 | C622: 1 | D622: 1 | E622: ="累计通关主线副本"&RC[1]&"次（%s/"&RC[1]&"）" -> 累计通关主线副本50次（%s/50） | F622: 50 | H622: 1 | I622: 0 | J622: 0 | K622: 19103|10108 | L622: 5|5
A623: 6002 | B623: =INT(RC[-1]/1000) -> 6 | C623: 1 | D623: 1 | E623: ="累计通关主线副本"&RC[1]&"次（%s/"&RC[1]&"）" -> 累计通关主线副本100次（%s/100） | F623: 100 | H623: 1 | I623: 0 | J623: 0 | K623: 42201|10108 | L623: 5|10
A624: 6003 | B624: =INT(RC[-1]/1000) -> 6 | C624: 1 | D624: 1 | E624: ="累计通关主线副本"&RC[1]&"次（%s/"&RC[1]&"）" -> 累计通关主线副本150次（%s/150） | F624: 150 | H624: 1 | I624: 0 | J624: 0 | K624: 10021|10108 | L624: 10|10
A625: 6004 | B625: =INT(RC[-1]/1000) -> 6 | C625: 1 | D625: 1 | E625: ="累计通关主线副本"&RC[1]&"次（%s/"&RC[1]&"）" -> 累计通关主线副本200次（%s/200） | F625: 200 | H625: 1 | I625: 0 | J625: 0 | K625: 10013|10108 | L625: 20|15
A626: 6010 | B626: =INT(RC[-1]/1000) -> 6 | C626: 1 | D626: 1 | E626: ="（每日任务）：通关主线副本"&RC[1]&"次（%s/"&RC[1]&"）" -> （每日任务）：通关主线副本5次（%s/5） | F626: 5 | H626: 1 | I626: 0 | J626: 1 | K626: 10084 | L626: 5
A627: 6011 | B627: =INT(RC[-1]/1000) -> 6 | C627: 1 | D627: 1 | E627: ="累计通关主线副本"&RC[1]&"次（%s/"&RC[1]&"）" -> 累计通关主线副本20次（%s/20） | F627: 20 | H627: 1 | I627: 0 | J627: 0 | K627: 10084|19006 | L627: 20|50
A628: 6012 | B628: =INT(RC[-1]/1000) -> 6 | C628: 1 | D628: 1 | E628: ="累计通关主线副本"&RC[1]&"次（%s/"&RC[1]&"）" -> 累计通关主线副本40次（%s/40） | F628: 40 | H628: 1 | I628: 0 | J628: 0 | K628: 10084|19006 | L628: 20|50
A629: 6013 | B629: =INT(RC[-1]/1000) -> 6 | C629: 1 | D629: 1 | E629: ="累计通关主线副本"&RC[1]&"次（%s/"&RC[1]&"）" -> 累计通关主线副本80次（%s/80） | F629: 80 | H629: 1 | I629: 0 | J629: 0 | K629: 10084|19006 | L629: 40|100
A630: 6014 | B630: =INT(RC[-1]/1000) -> 6 | C630: 1 | D630: 1 | E630: ="累计通关主线副本"&RC[1]&"次（%s/"&RC[1]&"）" -> 累计通关主线副本120次（%s/120） | F630: 120 | H630: 1 | I630: 0 | J630: 0 | K630: 10084|19006 | L630: 40|100
A631: 6015 | B631: =INT(RC[-1]/1000) -> 6 | C631: 1 | D631: 1 | E631: ="累计通关主线副本"&RC[1]&"次（%s/"&RC[1]&"）" -> 累计通关主线副本180次（%s/180） | F631: 180 | H631: 1 | I631: 0 | J631: 0 | K631: 10084|19006 | L631: 60|200
A632: 6016 | B632: =INT(RC[-1]/1000) -> 6 | C632: 1 | D632: 1 | E632: ="累计通关主线副本"&RC[1]&"次（%s/"&RC[1]&"）" -> 累计通关主线副本240次（%s/240） | F632: 240 | H632: 1 | I632: 0 | J632: 0 | K632: 10084|19006 | L632: 60|200
A633: 6017 | B633: =INT(RC[-1]/1000) -> 6 | C633: 1 | D633: 1 | E633: ="（每日任务）：通关主线副本"&RC[1]&"次（%s/"&RC[1]&"）" -> （每日任务）：通关主线副本10次（%s/10） | F633: 10 | H633: 1 | I633: 0 | J633: 1 | K633: 10078|10077 | L633: 1|5
A634: 6018 | B634: =INT(RC[-1]/1000) -> 6 | C634: 1 | D634: 1 | E634: ="累计通关主线副本"&RC[1]&"次（%s/"&RC[1]&"）" -> 累计通关主线副本50次（%s/50） | F634: 50 | H634: 1 | I634: 0 | J634: 0 | K634: 10078|10077 | L634: 1|5
A635: 6019 | B635: =INT(RC[-1]/1000) -> 6 | C635: 1 | D635: 1 | E635: ="累计通关主线副本"&RC[1]&"次（%s/"&RC[1]&"）" -> 累计通关主线副本100次（%s/100） | F635: 100 | H635: 1 | I635: 0 | J635: 0 | K635: 10078|10077 | L635: 2|5
A636: 6020 | B636: =INT(RC[-1]/1000) -> 6 | C636: 1 | D636: 1 | E636: ="累计通关主线副本"&RC[1]&"次（%s/"&RC[1]&"）" -> 累计通关主线副本200次（%s/200） | F636: 200 | H636: 1 | I636: 0 | J636: 0 | K636: 10078|10077 | L636: 3|10
A637: 6021 | B637: =INT(RC[-1]/1000) -> 6 | C637: 1 | D637: 1 | E637: ="累计通关主线副本"&RC[1]&"次（%s/"&RC[1]&"）" -> 累计通关主线副本300次（%s/300） | F637: 300 | H637: 1 | I637: 0 | J637: 0 | K637: 10078|10077 | L637: 4|10
A638: 6022 | B638: =INT(RC[-1]/1000) -> 6 | C638: 1 | D638: 1 | E638: ="累计通关主线副本"&RC[1]&"次（%s/"&RC[1]&"）" -> 累计通关主线副本400次（%s/400） | F638: 400 | H638: 1 | I638: 0 | J638: 0 | K638: 10078|10077 | L638: 5|10
A639: 6023 | B639: =INT(RC[-1]/1000) -> 6 | C639: 1 | D639: 1 | E639: ="累计通关主线副本"&RC[1]&"次（%s/"&RC[1]&"）" -> 累计通关主线副本600次（%s/600） | F639: 600 | H639: 1 | I639: 0 | J639: 0 | K639: 10078|10077 | L639: 6|20
A640: 6024 | B640: =INT(RC[-1]/1000) -> 6 | C640: 1 | D640: 1 | E640: ="累计通关主线副本"&RC[1]&"次（%s/"&RC[1]&"）" -> 累计通关主线副本800次（%s/800） | F640: 800 | H640: 1 | I640: 0 | J640: 0 | K640: 10078|10077 | L640: 7|20
A641: 6025 | B641: =INT(RC[-1]/1000) -> 6 | C641: 1 | D641: 1 | E641: ="累计通关主线副本"&RC[1]&"次（%s/"&RC[1]&"）" -> 累计通关主线副本1000次（%s/1000） | F641: 1000 | H641: 1 | I641: 0 | J641: 0 | K641: 10078|10077 | L641: 8|20
A642: 6026 | B642: =INT(RC[-1]/1000) -> 6 | C642: 1 | D642: 1 | E642: ="（每日任务）：通关主线副本"&RC[1]&"次（%s/"&RC[1]&"）" -> （每日任务）：通关主线副本10次（%s/10） | F642: 10 | H642: 1 | I642: 0 | J642: 1 | K642: 10005 | L642: 5
A643: 6027 | B643: =INT(RC[-1]/1000) -> 6 | C643: 1 | D643: 1 | E643: ="累计通关主线副本"&RC[1]&"次（%s/"&RC[1]&"）" -> 累计通关主线副本50次（%s/50） | F643: 50 | H643: 1 | I643: 0 | J643: 0 | K643: 19103 | L643: 20
A644: 6028 | B644: =INT(RC[-1]/1000) -> 6 | C644: 1 | D644: 1 | E644: ="累计通关主线副本"&RC[1]&"次（%s/"&RC[1]&"）" -> 累计通关主线副本100次（%s/100） | F644: 100 | H644: 1 | I644: 0 | J644: 0 | K644: 13598|10005 | L644: 5|10
A645: 6029 | B645: =INT(RC[-1]/1000) -> 6 | C645: 1 | D645: 1 | E645: ="累计通关主线副本"&RC[1]&"次（%s/"&RC[1]&"）" -> 累计通关主线副本150次（%s/150） | F645: 150 | H645: 1 | I645: 0 | J645: 0 | K645: 19103 | L645: 30
A646: 6030 | B646: =INT(RC[-1]/1000) -> 6 | C646: 1 | D646: 1 | E646: ="累计通关主线副本"&RC[1]&"次（%s/"&RC[1]&"）" -> 累计通关主线副本200次（%s/200） | F646: 200 | H646: 1 | I646: 0 | J646: 0 | K646: 19103 | L646: 40
A647: 6031 | B647: =INT(RC[-1]/1000) -> 6 | C647: 1 | D647: 1 | E647: ="累计通关主线副本"&RC[1]&"次（%s/"&RC[1]&"）" -> 累计通关主线副本300次（%s/300） | F647: 300 | H647: 1 | I647: 0 | J647: 0 | K647: 13598|10005 | L647: 5|10
A648: 6032 | B648: =INT(RC[-1]/1000) -> 6 | C648: 1 | D648: 1 | E648: ="累计通关主线副本"&RC[1]&"次（%s/"&RC[1]&"）" -> 累计通关主线副本400次（%s/400） | F648: 400 | H648: 1 | I648: 0 | J648: 0 | K648: 19103 | L648: 50
A649: 6033 | B649: =INT(RC[-1]/1000) -> 6 | C649: 1 | D649: 1 | E649: ="累计通关主线副本"&RC[1]&"次（%s/"&RC[1]&"）" -> 累计通关主线副本500次（%s/500） | F649: 500 | H649: 1 | I649: 0 | J649: 0 | K649: 13598|10005 | L649: 10|20
A650: 6034 | B650: =INT(RC[-1]/1000) -> 6 | C650: 1 | D650: 1 | E650: ="（每日任务）：通关主线副本"&RC[1]&"次（%s/"&RC[1]&"）" -> （每日任务）：通关主线副本10次（%s/10） | F650: 10 | H650: 1 | I650: 0 | J650: 1 | K650: 10000 | L650: 1
A651: 6035 | B651: =INT(RC[-1]/1000) -> 6 | C651: 1 | D651: 1 | E651: ="累计通关主线副本"&RC[1]&"次（%s/"&RC[1]&"）" -> 累计通关主线副本50次（%s/50） | F651: 50 | H651: 1 | I651: 0 | J651: 0 | K651: 19103 | L651: 20
A652: 6036 | B652: =INT(RC[-1]/1000) -> 6 | C652: 1 | D652: 1 | E652: ="累计通关主线副本"&RC[1]&"次（%s/"&RC[1]&"）" -> 累计通关主线副本100次（%s/100） | F652: 100 | H652: 1 | I652: 0 | J652: 0 | K652: 13599|10005 | L652: 5|10
A653: 6037 | B653: =INT(RC[-1]/1000) -> 6 | C653: 1 | D653: 1 | E653: ="累计通关主线副本"&RC[1]&"次（%s/"&RC[1]&"）" -> 累计通关主线副本150次（%s/150） | F653: 150 | H653: 1 | I653: 0 | J653: 0 | K653: 19103 | L653: 30
A654: 6038 | B654: =INT(RC[-1]/1000) -> 6 | C654: 1 | D654: 1 | E654: ="累计通关主线副本"&RC[1]&"次（%s/"&RC[1]&"）" -> 累计通关主线副本200次（%s/200） | F654: 200 | H654: 1 | I654: 0 | J654: 0 | K654: 19103 | L654: 40
A655: 6039 | B655: =INT(RC[-1]/1000) -> 6 | C655: 1 | D655: 1 | E655: ="累计通关主线副本"&RC[1]&"次（%s/"&RC[1]&"）" -> 累计通关主线副本300次（%s/300） | F655: 300 | H655: 1 | I655: 0 | J655: 0 | K655: 13599|10005 | L655: 5|10
A656: 6040 | B656: =INT(RC[-1]/1000) -> 6 | C656: 1 | D656: 1 | E656: ="累计通关主线副本"&RC[1]&"次（%s/"&RC[1]&"）" -> 累计通关主线副本400次（%s/400） | F656: 400 | H656: 1 | I656: 0 | J656: 0 | K656: 19103 | L656: 50
A657: 6041 | B657: =INT(RC[-1]/1000) -> 6 | C657: 1 | D657: 1 | E657: ="累计通关主线副本"&RC[1]&"次（%s/"&RC[1]&"）" -> 累计通关主线副本500次（%s/500） | F657: 500 | H657: 1 | I657: 0 | J657: 0 | K657: 13599|10005 | L657: 10|20
A658: 6042 | B658: =INT(RC[-1]/1000) -> 6 | C658: 1 | D658: 1 | E658: ="（每日任务）：七夕活动期间，通关主线副本"&RC[1]&"次（%s/"&RC[1]&"）" -> （每日任务）：七夕活动期间，通关主线副本10次（%s/10） | F658: 10 | H658: 1 | I658: 0 | J658: 1 | K658: 10074|10073 | L658: 1|5
A659: 6043 | B659: =INT(RC[-1]/1000) -> 6 | C659: 1 | D659: 1 | E659: ="七夕活动期间，累计通关主线副本"&RC[1]&"次（%s/"&RC[1]&"）" -> 七夕活动期间，累计通关主线副本50次（%s/50） | F659: 50 | H659: 1 | I659: 0 | J659: 0 | K659: 10074|10073 | L659: 1|5
A660: 6044 | B660: =INT(RC[-1]/1000) -> 6 | C660: 1 | D660: 1 | E660: ="七夕活动期间，累计通关主线副本"&RC[1]&"次（%s/"&RC[1]&"）" -> 七夕活动期间，累计通关主线副本100次（%s/100） | F660: 100 | H660: 1 | I660: 0 | J660: 0 | K660: 10074|10073 | L660: 2|5
A661: 6045 | B661: =INT(RC[-1]/1000) -> 6 | C661: 1 | D661: 1 | E661: ="七夕活动期间，累计通关主线副本"&RC[1]&"次（%s/"&RC[1]&"）" -> 七夕活动期间，累计通关主线副本150次（%s/150） | F661: 150 | H661: 1 | I661: 0 | J661: 0 | K661: 10074|10073 | L661: 3|10
A662: 6046 | B662: =INT(RC[-1]/1000) -> 6 | C662: 1 | D662: 1 | E662: ="七夕活动期间，累计通关主线副本"&RC[1]&"次（%s/"&RC[1]&"）" -> 七夕活动期间，累计通关主线副本200次（%s/200） | F662: 200 | H662: 1 | I662: 0 | J662: 0 | K662: 10074|10073 | L662: 4|10
A663: 6047 | B663: =INT(RC[-1]/1000) -> 6 | C663: 1 | D663: 1 | E663: ="七夕活动期间，累计通关主线副本"&RC[1]&"次（%s/"&RC[1]&"）" -> 七夕活动期间，累计通关主线副本300次（%s/300） | F663: 300 | H663: 1 | I663: 0 | J663: 0 | K663: 10074|10073 | L663: 5|10
A664: 6048 | B664: =INT(RC[-1]/1000) -> 6 | C664: 1 | D664: 1 | E664: ="七夕活动期间，累计通关主线副本"&RC[1]&"次（%s/"&RC[1]&"）" -> 七夕活动期间，累计通关主线副本400次（%s/400） | F664: 400 | H664: 1 | I664: 0 | J664: 0 | K664: 10074|10073 | L664: 6|20
A665: 6049 | B665: =INT(RC[-1]/1000) -> 6 | C665: 1 | D665: 1 | E665: ="七夕活动期间，累计通关主线副本"&RC[1]&"次（%s/"&RC[1]&"）" -> 七夕活动期间，累计通关主线副本500次（%s/500） | F665: 500 | H665: 1 | I665: 0 | J665: 0 | K665: 10074|10073 | L665: 7|20
A666: 6050 | B666: =INT(RC[-1]/1000) -> 6 | C666: 1 | D666: 1 | E666: ="七夕活动期间，累计通关主线副本"&RC[1]&"次（%s/"&RC[1]&"）" -> 七夕活动期间，累计通关主线副本500次（%s/500） | F666: 500 | H666: 1 | I666: 0 | J666: 0 | K666: 10074|10073 | L666: 8|20
A667: 6051 | B667: =INT(RC[-1]/1000) -> 6 | C667: 1 | D667: 1 | E667: ="（每日任务）：通关主线副本"&RC[1]&"次（%s/"&RC[1]&"）" -> （每日任务）：通关主线副本10次（%s/10） | F667: 10 | H667: 1 | I667: 0 | J667: 1 | K667: 10000 | L667: 1
A668: 6052 | B668: =INT(RC[-1]/1000) -> 6 | C668: 1 | D668: 1 | E668: ="累计通关主线副本"&RC[1]&"次（%s/"&RC[1]&"）" -> 累计通关主线副本50次（%s/50） | F668: 50 | H668: 1 | I668: 0 | J668: 0 | K668: 19103 | L668: 20
A669: 6053 | B669: =INT(RC[-1]/1000) -> 6 | C669: 1 | D669: 1 | E669: ="累计通关主线副本"&RC[1]&"次（%s/"&RC[1]&"）" -> 累计通关主线副本100次（%s/100） | F669: 100 | H669: 1 | I669: 0 | J669: 0 | K669: 10116|19103 | L669: 5|20
A670: 6054 | B670: =INT(RC[-1]/1000) -> 6 | C670: 1 | D670: 1 | E670: ="累计通关主线副本"&RC[1]&"次（%s/"&RC[1]&"）" -> 累计通关主线副本150次（%s/150） | F670: 150 | H670: 1 | I670: 0 | J670: 0 | K670: 19103 | L670: 30
A671: 6055 | B671: =INT(RC[-1]/1000) -> 6 | C671: 1 | D671: 1 | E671: ="累计通关主线副本"&RC[1]&"次（%s/"&RC[1]&"）" -> 累计通关主线副本200次（%s/200） | F671: 200 | H671: 1 | I671: 0 | J671: 0 | K671: 19103 | L671: 40
A672: 6056 | B672: =INT(RC[-1]/1000) -> 6 | C672: 1 | D672: 1 | E672: ="累计通关主线副本"&RC[1]&"次（%s/"&RC[1]&"）" -> 累计通关主线副本300次（%s/300） | F672: 300 | H672: 1 | I672: 0 | J672: 0 | K672: 10116|19103 | L672: 5|40
A673: 6057 | B673: =INT(RC[-1]/1000) -> 6 | C673: 1 | D673: 1 | E673: ="累计通关主线副本"&RC[1]&"次（%s/"&RC[1]&"）" -> 累计通关主线副本400次（%s/400） | F673: 400 | H673: 1 | I673: 0 | J673: 0 | K673: 19103 | L673: 50
A674: 6058 | B674: =INT(RC[-1]/1000) -> 6 | C674: 1 | D674: 1 | E674: ="累计通关主线副本"&RC[1]&"次（%s/"&RC[1]&"）" -> 累计通关主线副本500次（%s/500） | F674: 500 | H674: 1 | I674: 0 | J674: 0 | K674: 10116|19103 | L674: 10|50
A675: 6059 | B675: =INT(RC[-1]/1000) -> 6 | C675: 1 | D675: 1 | E675: ="（每日任务）：通关主线副本"&RC[1]&"次（%s/"&RC[1]&"）" -> （每日任务）：通关主线副本10次（%s/10） | F675: 10 | H675: 1 | I675: 0 | J675: 1 | K675: 10089|10088 | L675: 1|5
A676: 6060 | B676: =INT(RC[-1]/1000) -> 6 | C676: 1 | D676: 1 | E676: ="累计通关主线副本"&RC[1]&"次（%s/"&RC[1]&"）" -> 累计通关主线副本50次（%s/50） | F676: 50 | H676: 1 | I676: 0 | J676: 0 | K676: 10089|10088 | L676: 1|5
A677: 6061 | B677: =INT(RC[-1]/1000) -> 6 | C677: 1 | D677: 1 | E677: ="累计通关主线副本"&RC[1]&"次（%s/"&RC[1]&"）" -> 累计通关主线副本100次（%s/100） | F677: 100 | H677: 1 | I677: 0 | J677: 0 | K677: 10089|10088 | L677: 2|5
A678: 6062 | B678: =INT(RC[-1]/1000) -> 6 | C678: 1 | D678: 1 | E678: ="累计通关主线副本"&RC[1]&"次（%s/"&RC[1]&"）" -> 累计通关主线副本200次（%s/200） | F678: 200 | H678: 1 | I678: 0 | J678: 0 | K678: 10089|10088 | L678: 3|10
A679: 6063 | B679: =INT(RC[-1]/1000) -> 6 | C679: 1 | D679: 1 | E679: ="累计通关主线副本"&RC[1]&"次（%s/"&RC[1]&"）" -> 累计通关主线副本300次（%s/300） | F679: 300 | H679: 1 | I679: 0 | J679: 0 | K679: 10089|10088 | L679: 4|10
A680: 6064 | B680: =INT(RC[-1]/1000) -> 6 | C680: 1 | D680: 1 | E680: ="累计通关主线副本"&RC[1]&"次（%s/"&RC[1]&"）" -> 累计通关主线副本400次（%s/400） | F680: 400 | H680: 1 | I680: 0 | J680: 0 | K680: 10089|10088 | L680: 5|10
A681: 6065 | B681: =INT(RC[-1]/1000) -> 6 | C681: 1 | D681: 1 | E681: ="累计通关主线副本"&RC[1]&"次（%s/"&RC[1]&"）" -> 累计通关主线副本600次（%s/600） | F681: 600 | H681: 1 | I681: 0 | J681: 0 | K681: 10089|10088 | L681: 6|20
A682: 6066 | B682: =INT(RC[-1]/1000) -> 6 | C682: 1 | D682: 1 | E682: ="累计通关主线副本"&RC[1]&"次（%s/"&RC[1]&"）" -> 累计通关主线副本800次（%s/800） | F682: 800 | H682: 1 | I682: 0 | J682: 0 | K682: 10089|10088 | L682: 7|20
A683: 6067 | B683: =INT(RC[-1]/1000) -> 6 | C683: 1 | D683: 1 | E683: ="累计通关主线副本"&RC[1]&"次（%s/"&RC[1]&"）" -> 累计通关主线副本1000次（%s/1000） | F683: 1000 | H683: 1 | I683: 0 | J683: 0 | K683: 10089|10088 | L683: 8|20
A684: 7000 | B684: =INT(RC[-1]/1000) -> 7 | C684: 1 | D684: 1 | E684: =IF(RC[5]=1,"（每日任务）：",)&"争夺圣器"&RC[1]&"次（%s/"&RC[1]&"）" -> （每日任务）：争夺圣器5次（%s/5） | F684: 5 | H684: 1 | I684: 0 | J684: 1 | K684: 10084 | L684: 5 | N684: 圣器争夺（无论胜负）（包括战5次）x=所需次数
A685: 7001 | B685: =INT(RC[-1]/1000) -> 7 | C685: 1 | D685: 1 | E685: =IF(RC[5]=1,"（每日任务）：",)&"争夺圣器"&RC[1]&"次（%s/"&RC[1]&"）" -> 争夺圣器20次（%s/20） | F685: 20 | H685: 1 | I685: 0 | J685: 0 | K685: 10084|19006 | L685: 20|2
A686: 7002 | B686: =INT(RC[-1]/1000) -> 7 | C686: 1 | D686: 1 | E686: =IF(RC[5]=1,"（每日任务）：",)&"争夺圣器"&RC[1]&"次（%s/"&RC[1]&"）" -> 争夺圣器40次（%s/40） | F686: 40 | H686: 1 | I686: 0 | J686: 0 | K686: 10084|19006 | L686: 20|2
A687: 7003 | B687: =INT(RC[-1]/1000) -> 7 | C687: 1 | D687: 1 | E687: =IF(RC[5]=1,"（每日任务）：",)&"争夺圣器"&RC[1]&"次（%s/"&RC[1]&"）" -> 争夺圣器80次（%s/80） | F687: 80 | H687: 1 | I687: 0 | J687: 0 | K687: 10084|19006 | L687: 40|3
A688: 7004 | B688: =INT(RC[-1]/1000) -> 7 | C688: 1 | D688: 1 | E688: =IF(RC[5]=1,"（每日任务）：",)&"争夺圣器"&RC[1]&"次（%s/"&RC[1]&"）" -> 争夺圣器120次（%s/120） | F688: 120 | H688: 1 | I688: 0 | J688: 0 | K688: 10084|19006 | L688: 40|3
A689: 7005 | B689: =INT(RC[-1]/1000) -> 7 | C689: 1 | D689: 1 | E689: =IF(RC[5]=1,"（每日任务）：",)&"争夺圣器"&RC[1]&"次（%s/"&RC[1]&"）" -> 争夺圣器180次（%s/180） | F689: 180 | H689: 1 | I689: 0 | J689: 0 | K689: 10084|19006 | L689: 60|5
A690: 7006 | B690: =INT(RC[-1]/1000) -> 7 | C690: 1 | D690: 1 | E690: =IF(RC[5]=1,"（每日任务）：",)&"争夺圣器"&RC[1]&"次（%s/"&RC[1]&"）" -> 争夺圣器240次（%s/240） | F690: 240 | H690: 1 | I690: 0 | J690: 0 | K690: 10084|19006 | L690: 60|5
A691: 7007 | B691: =INT(RC[-1]/1000) -> 7 | C691: 1 | D691: 1 | E691: =IF(RC[5]=1,"（每日任务）：",)&"争夺圣器"&RC[1]&"次（%s/"&RC[1]&"）" -> （每日任务）：争夺圣器10次（%s/10） | F691: 10 | H691: 1 | I691: 0 | J691: 1 | K691: 10078|10077 | L691: 1|5 | N691: 圣器争夺（无论胜负）（包括战5次）x=所需次数
A692: 7008 | B692: =INT(RC[-1]/1000) -> 7 | C692: 1 | D692: 1 | E692: =IF(RC[5]=1,"（每日任务）：",)&"争夺圣器"&RC[1]&"次（%s/"&RC[1]&"）" -> 争夺圣器50次（%s/50） | F692: 50 | H692: 1 | I692: 0 | J692: 0 | K692: 10078|10077 | L692: 1|5
A693: 7009 | B693: =INT(RC[-1]/1000) -> 7 | C693: 1 | D693: 1 | E693: =IF(RC[5]=1,"（每日任务）：",)&"争夺圣器"&RC[1]&"次（%s/"&RC[1]&"）" -> 争夺圣器100次（%s/100） | F693: 100 | H693: 1 | I693: 0 | J693: 0 | K693: 10078|10077 | L693: 2|5
A694: 7010 | B694: =INT(RC[-1]/1000) -> 7 | C694: 1 | D694: 1 | E694: =IF(RC[5]=1,"（每日任务）：",)&"争夺圣器"&RC[1]&"次（%s/"&RC[1]&"）" -> 争夺圣器200次（%s/200） | F694: 200 | H694: 1 | I694: 0 | J694: 0 | K694: 10078|10077 | L694: 3|10
A695: 7011 | B695: =INT(RC[-1]/1000) -> 7 | C695: 1 | D695: 1 | E695: =IF(RC[5]=1,"（每日任务）：",)&"争夺圣器"&RC[1]&"次（%s/"&RC[1]&"）" -> 争夺圣器300次（%s/300） | F695: 300 | H695: 1 | I695: 0 | J695: 0 | K695: 10078|10077 | L695: 4|10
A696: 7012 | B696: =INT(RC[-1]/1000) -> 7 | C696: 1 | D696: 1 | E696: =IF(RC[5]=1,"（每日任务）：",)&"争夺圣器"&RC[1]&"次（%s/"&RC[1]&"）" -> 争夺圣器400次（%s/400） | F696: 400 | H696: 1 | I696: 0 | J696: 0 | K696: 10078|10077 | L696: 5|10
A697: 7013 | B697: =INT(RC[-1]/1000) -> 7 | C697: 1 | D697: 1 | E697: =IF(RC[5]=1,"（每日任务）：",)&"争夺圣器"&RC[1]&"次（%s/"&RC[1]&"）" -> 争夺圣器600次（%s/600） | F697: 600 | H697: 1 | I697: 0 | J697: 0 | K697: 10078|10077 | L697: 6|20
A698: 7014 | B698: =INT(RC[-1]/1000) -> 7 | C698: 1 | D698: 1 | E698: =IF(RC[5]=1,"（每日任务）：",)&"争夺圣器"&RC[1]&"次（%s/"&RC[1]&"）" -> 争夺圣器800次（%s/800） | F698: 800 | H698: 1 | I698: 0 | J698: 0 | K698: 10078|10077 | L698: 7|20
A699: 7015 | B699: =INT(RC[-1]/1000) -> 7 | C699: 1 | D699: 1 | E699: =IF(RC[5]=1,"（每日任务）：",)&"争夺圣器"&RC[1]&"次（%s/"&RC[1]&"）" -> 争夺圣器1000次（%s/1000） | F699: 1000 | H699: 1 | I699: 0 | J699: 0 | K699: 10078|10077 | L699: 8|20
A700: 7016 | B700: =INT(RC[-1]/1000) -> 7 | C700: 1 | D700: 1 | E700: =IF(RC[5]=1,"（每日任务）：",)&"争夺圣器"&RC[1]&"次（%s/"&RC[1]&"）" -> （每日任务）：争夺圣器10次（%s/10） | F700: 10 | H700: 1 | I700: 0 | J700: 1 | K700: 10112 | L700: 5 | N700: 圣器争夺（无论胜负）（包括战5次）x=所需次数
A701: 7017 | B701: =INT(RC[-1]/1000) -> 7 | C701: 1 | D701: 1 | E701: =IF(RC[5]=1,"（每日任务）：",)&"争夺圣器"&RC[1]&"次（%s/"&RC[1]&"）" -> 争夺圣器50次（%s/50） | F701: 50 | H701: 1 | I701: 0 | J701: 0 | K701: 42301 | L701: 4
A702: 7018 | B702: =INT(RC[-1]/1000) -> 7 | C702: 1 | D702: 1 | E702: =IF(RC[5]=1,"（每日任务）：",)&"争夺圣器"&RC[1]&"次（%s/"&RC[1]&"）" -> 争夺圣器100次（%s/100） | F702: 100 | H702: 1 | I702: 0 | J702: 0 | K702: 13598|10112 | L702: 5|5
A703: 7019 | B703: =INT(RC[-1]/1000) -> 7 | C703: 1 | D703: 1 | E703: =IF(RC[5]=1,"（每日任务）：",)&"争夺圣器"&RC[1]&"次（%s/"&RC[1]&"）" -> 争夺圣器150次（%s/150） | F703: 150 | H703: 1 | I703: 0 | J703: 0 | K703: 42301 | L703: 6
A704: 7020 | B704: =INT(RC[-1]/1000) -> 7 | C704: 1 | D704: 1 | E704: =IF(RC[5]=1,"（每日任务）：",)&"争夺圣器"&RC[1]&"次（%s/"&RC[1]&"）" -> 争夺圣器200次（%s/200） | F704: 200 | H704: 1 | I704: 0 | J704: 0 | K704: 42301 | L704: 8
A705: 7021 | B705: =INT(RC[-1]/1000) -> 7 | C705: 1 | D705: 1 | E705: =IF(RC[5]=1,"（每日任务）：",)&"争夺圣器"&RC[1]&"次（%s/"&RC[1]&"）" -> 争夺圣器300次（%s/300） | F705: 300 | H705: 1 | I705: 0 | J705: 0 | K705: 13598|10112 | L705: 5|5
A706: 7022 | B706: =INT(RC[-1]/1000) -> 7 | C706: 1 | D706: 1 | E706: =IF(RC[5]=1,"（每日任务）：",)&"争夺圣器"&RC[1]&"次（%s/"&RC[1]&"）" -> 争夺圣器400次（%s/400） | F706: 400 | H706: 1 | I706: 0 | J706: 0 | K706: 42301 | L706: 10
A707: 7023 | B707: =INT(RC[-1]/1000) -> 7 | C707: 1 | D707: 1 | E707: =IF(RC[5]=1,"（每日任务）：",)&"争夺圣器"&RC[1]&"次（%s/"&RC[1]&"）" -> 争夺圣器500次（%s/500） | F707: 500 | H707: 1 | I707: 0 | J707: 0 | K707: 13598|10112 | L707: 10|10
A708: 7024 | B708: =INT(RC[-1]/1000) -> 7 | C708: 1 | D708: 1 | E708: =IF(RC[5]=1,"（每日任务）：",)&"争夺圣器"&RC[1]&"次（%s/"&RC[1]&"）" -> （每日任务）：争夺圣器10次（%s/10） | F708: 10 | H708: 1 | I708: 0 | J708: 1 | K708: 10001 | L708: 1 | N708: 圣器争夺（无论胜负）（包括战5次）x=所需次数
A709: 7025 | B709: =INT(RC[-1]/1000) -> 7 | C709: 1 | D709: 1 | E709: =IF(RC[5]=1,"（每日任务）：",)&"争夺圣器"&RC[1]&"次（%s/"&RC[1]&"）" -> 争夺圣器50次（%s/50） | F709: 50 | H709: 1 | I709: 0 | J709: 0 | K709: 42301 | L709: 4
A710: 7026 | B710: =INT(RC[-1]/1000) -> 7 | C710: 1 | D710: 1 | E710: =IF(RC[5]=1,"（每日任务）：",)&"争夺圣器"&RC[1]&"次（%s/"&RC[1]&"）" -> 争夺圣器100次（%s/100） | F710: 100 | H710: 1 | I710: 0 | J710: 0 | K710: 13599|10112 | L710: 5|5
A711: 7027 | B711: =INT(RC[-1]/1000) -> 7 | C711: 1 | D711: 1 | E711: =IF(RC[5]=1,"（每日任务）：",)&"争夺圣器"&RC[1]&"次（%s/"&RC[1]&"）" -> 争夺圣器150次（%s/150） | F711: 150 | H711: 1 | I711: 0 | J711: 0 | K711: 42301 | L711: 6
A712: 7028 | B712: =INT(RC[-1]/1000) -> 7 | C712: 1 | D712: 1 | E712: =IF(RC[5]=1,"（每日任务）：",)&"争夺圣器"&RC[1]&"次（%s/"&RC[1]&"）" -> 争夺圣器200次（%s/200） | F712: 200 | H712: 1 | I712: 0 | J712: 0 | K712: 42301 | L712: 8
A713: 7029 | B713: =INT(RC[-1]/1000) -> 7 | C713: 1 | D713: 1 | E713: =IF(RC[5]=1,"（每日任务）：",)&"争夺圣器"&RC[1]&"次（%s/"&RC[1]&"）" -> 争夺圣器300次（%s/300） | F713: 300 | H713: 1 | I713: 0 | J713: 0 | K713: 13599|10112 | L713: 5|5
A714: 7030 | B714: =INT(RC[-1]/1000) -> 7 | C714: 1 | D714: 1 | E714: =IF(RC[5]=1,"（每日任务）：",)&"争夺圣器"&RC[1]&"次（%s/"&RC[1]&"）" -> 争夺圣器400次（%s/400） | F714: 400 | H714: 1 | I714: 0 | J714: 0 | K714: 42301 | L714: 10
A715: 7031 | B715: =INT(RC[-1]/1000) -> 7 | C715: 1 | D715: 1 | E715: =IF(RC[5]=1,"（每日任务）：",)&"争夺圣器"&RC[1]&"次（%s/"&RC[1]&"）" -> 争夺圣器500次（%s/500） | F715: 500 | H715: 1 | I715: 0 | J715: 0 | K715: 13599|10112 | L715: 10|10
A716: 7032 | B716: =INT(RC[-1]/1000) -> 7 | C716: 1 | D716: 1 | E716: =IF(RC[5]=1,"（每日任务）：",)&"争夺圣器"&RC[1]&"次（%s/"&RC[1]&"）" -> （每日任务）：争夺圣器10次（%s/10） | F716: 10 | H716: 1 | I716: 0 | J716: 1 | K716: 10074|10073 | L716: 1|5
A717: 7033 | B717: =INT(RC[-1]/1000) -> 7 | C717: 1 | D717: 1 | E717: =IF(RC[5]=1,"（每日任务）：",)&"争夺圣器"&RC[1]&"次（%s/"&RC[1]&"）" -> 争夺圣器50次（%s/50） | F717: 50 | H717: 1 | I717: 0 | J717: 0 | K717: 10074|10073 | L717: 1|5
A718: 7034 | B718: =INT(RC[-1]/1000) -> 7 | C718: 1 | D718: 1 | E718: =IF(RC[5]=1,"（每日任务）：",)&"争夺圣器"&RC[1]&"次（%s/"&RC[1]&"）" -> 争夺圣器100次（%s/100） | F718: 100 | H718: 1 | I718: 0 | J718: 0 | K718: 10074|10073 | L718: 2|5
A719: 7035 | B719: =INT(RC[-1]/1000) -> 7 | C719: 1 | D719: 1 | E719: =IF(RC[5]=1,"（每日任务）：",)&"争夺圣器"&RC[1]&"次（%s/"&RC[1]&"）" -> 争夺圣器200次（%s/200） | F719: 200 | H719: 1 | I719: 0 | J719: 0 | K719: 10074|10073 | L719: 3|10
A720: 7036 | B720: =INT(RC[-1]/1000) -> 7 | C720: 1 | D720: 1 | E720: =IF(RC[5]=1,"（每日任务）：",)&"争夺圣器"&RC[1]&"次（%s/"&RC[1]&"）" -> 争夺圣器300次（%s/300） | F720: 300 | H720: 1 | I720: 0 | J720: 0 | K720: 10074|10073 | L720: 4|10
A721: 7037 | B721: =INT(RC[-1]/1000) -> 7 | C721: 1 | D721: 1 | E721: =IF(RC[5]=1,"（每日任务）：",)&"争夺圣器"&RC[1]&"次（%s/"&RC[1]&"）" -> 争夺圣器400次（%s/400） | F721: 400 | H721: 1 | I721: 0 | J721: 0 | K721: 10074|10073 | L721: 5|10
A722: 7038 | B722: =INT(RC[-1]/1000) -> 7 | C722: 1 | D722: 1 | E722: =IF(RC[5]=1,"（每日任务）：",)&"争夺圣器"&RC[1]&"次（%s/"&RC[1]&"）" -> 争夺圣器600次（%s/600） | F722: 600 | H722: 1 | I722: 0 | J722: 0 | K722: 10074|10073 | L722: 6|20
A723: 7039 | B723: =INT(RC[-1]/1000) -> 7 | C723: 1 | D723: 1 | E723: =IF(RC[5]=1,"（每日任务）：",)&"争夺圣器"&RC[1]&"次（%s/"&RC[1]&"）" -> 争夺圣器800次（%s/800） | F723: 800 | H723: 1 | I723: 0 | J723: 0 | K723: 10074|10073 | L723: 7|20
A724: 7040 | B724: =INT(RC[-1]/1000) -> 7 | C724: 1 | D724: 1 | E724: =IF(RC[5]=1,"（每日任务）：",)&"争夺圣器"&RC[1]&"次（%s/"&RC[1]&"）" -> 争夺圣器1000次（%s/1000） | F724: 1000 | H724: 1 | I724: 0 | J724: 0 | K724: 10074|10073 | L724: 8|20
A725: 7041 | B725: =INT(RC[-1]/1000) -> 7 | C725: 1 | D725: 1 | E725: =IF(RC[5]=1,"（每日任务）：",)&"争夺圣器"&RC[1]&"次（%s/"&RC[1]&"）" -> （每日任务）：争夺圣器10次（%s/10） | F725: 10 | H725: 1 | I725: 0 | J725: 1 | K725: 10010 | L725: 20 | N725: 圣器争夺（无论胜负）（包括战5次）x=所需次数
A726: 7042 | B726: =INT(RC[-1]/1000) -> 7 | C726: 1 | D726: 1 | E726: =IF(RC[5]=1,"（每日任务）：",)&"争夺圣器"&RC[1]&"次（%s/"&RC[1]&"）" -> 争夺圣器50次（%s/50） | F726: 50 | H726: 1 | I726: 0 | J726: 0 | K726: 42301 | L726: 4
A727: 7043 | B727: =INT(RC[-1]/1000) -> 7 | C727: 1 | D727: 1 | E727: =IF(RC[5]=1,"（每日任务）：",)&"争夺圣器"&RC[1]&"次（%s/"&RC[1]&"）" -> 争夺圣器100次（%s/100） | F727: 100 | H727: 1 | I727: 0 | J727: 0 | K727: 10116|10010 | L727: 5|20
A728: 7044 | B728: =INT(RC[-1]/1000) -> 7 | C728: 1 | D728: 1 | E728: =IF(RC[5]=1,"（每日任务）：",)&"争夺圣器"&RC[1]&"次（%s/"&RC[1]&"）" -> 争夺圣器150次（%s/150） | F728: 150 | H728: 1 | I728: 0 | J728: 0 | K728: 42301 | L728: 6
A729: 7045 | B729: =INT(RC[-1]/1000) -> 7 | C729: 1 | D729: 1 | E729: =IF(RC[5]=1,"（每日任务）：",)&"争夺圣器"&RC[1]&"次（%s/"&RC[1]&"）" -> 争夺圣器200次（%s/200） | F729: 200 | H729: 1 | I729: 0 | J729: 0 | K729: 42301 | L729: 8
A730: 7046 | B730: =INT(RC[-1]/1000) -> 7 | C730: 1 | D730: 1 | E730: =IF(RC[5]=1,"（每日任务）：",)&"争夺圣器"&RC[1]&"次（%s/"&RC[1]&"）" -> 争夺圣器300次（%s/300） | F730: 300 | H730: 1 | I730: 0 | J730: 0 | K730: 10116|10014 | L730: 5|20
A731: 7047 | B731: =INT(RC[-1]/1000) -> 7 | C731: 1 | D731: 1 | E731: =IF(RC[5]=1,"（每日任务）：",)&"争夺圣器"&RC[1]&"次（%s/"&RC[1]&"）" -> 争夺圣器400次（%s/400） | F731: 400 | H731: 1 | I731: 0 | J731: 0 | K731: 42301 | L731: 10
A732: 7048 | B732: =INT(RC[-1]/1000) -> 7 | C732: 1 | D732: 1 | E732: =IF(RC[5]=1,"（每日任务）：",)&"争夺圣器"&RC[1]&"次（%s/"&RC[1]&"）" -> 争夺圣器500次（%s/500） | F732: 500 | H732: 1 | I732: 0 | J732: 0 | K732: 10116|10014 | L732: 10|50
A733: 7049 | B733: =INT(RC[-1]/1000) -> 7 | C733: 1 | D733: 1 | E733: =IF(RC[5]=1,"（每日任务）：",)&"争夺圣器"&RC[1]&"次（%s/"&RC[1]&"）" -> （每日任务）：争夺圣器10次（%s/10） | F733: 10 | H733: 1 | I733: 0 | J733: 1 | K733: 10089|10088 | L733: 1|5
A734: 7050 | B734: =INT(RC[-1]/1000) -> 7 | C734: 1 | D734: 1 | E734: =IF(RC[5]=1,"（每日任务）：",)&"争夺圣器"&RC[1]&"次（%s/"&RC[1]&"）" -> 争夺圣器30次（%s/30） | F734: 30 | H734: 1 | I734: 0 | J734: 0 | K734: 10089|10088 | L734: 1|5
A735: 7051 | B735: =INT(RC[-1]/1000) -> 7 | C735: 1 | D735: 1 | E735: =IF(RC[5]=1,"（每日任务）：",)&"争夺圣器"&RC[1]&"次（%s/"&RC[1]&"）" -> 争夺圣器60次（%s/60） | F735: 60 | H735: 1 | I735: 0 | J735: 0 | K735: 10089|10088 | L735: 2|5
A736: 7052 | B736: =INT(RC[-1]/1000) -> 7 | C736: 1 | D736: 1 | E736: =IF(RC[5]=1,"（每日任务）：",)&"争夺圣器"&RC[1]&"次（%s/"&RC[1]&"）" -> 争夺圣器120次（%s/120） | F736: 120 | H736: 1 | I736: 0 | J736: 0 | K736: 10089|10088 | L736: 3|10
A737: 7053 | B737: =INT(RC[-1]/1000) -> 7 | C737: 1 | D737: 1 | E737: =IF(RC[5]=1,"（每日任务）：",)&"争夺圣器"&RC[1]&"次（%s/"&RC[1]&"）" -> 争夺圣器180次（%s/180） | F737: 180 | H737: 1 | I737: 0 | J737: 0 | K737: 10089|10088 | L737: 4|10
A738: 7054 | B738: =INT(RC[-1]/1000) -> 7 | C738: 1 | D738: 1 | E738: =IF(RC[5]=1,"（每日任务）：",)&"争夺圣器"&RC[1]&"次（%s/"&RC[1]&"）" -> 争夺圣器240次（%s/240） | F738: 240 | H738: 1 | I738: 0 | J738: 0 | K738: 10089|10088 | L738: 5|10
A739: 7055 | B739: =INT(RC[-1]/1000) -> 7 | C739: 1 | D739: 1 | E739: =IF(RC[5]=1,"（每日任务）：",)&"争夺圣器"&RC[1]&"次（%s/"&RC[1]&"）" -> 争夺圣器360次（%s/360） | F739: 360 | H739: 1 | I739: 0 | J739: 0 | K739: 10089|10088 | L739: 6|20
A740: 7056 | B740: =INT(RC[-1]/1000) -> 7 | C740: 1 | D740: 1 | E740: =IF(RC[5]=1,"（每日任务）：",)&"争夺圣器"&RC[1]&"次（%s/"&RC[1]&"）" -> 争夺圣器480次（%s/480） | F740: 480 | H740: 1 | I740: 0 | J740: 0 | K740: 10089|10088 | L740: 7|20
A741: 7057 | B741: =INT(RC[-1]/1000) -> 7 | C741: 1 | D741: 1 | E741: =IF(RC[5]=1,"（每日任务）：",)&"争夺圣器"&RC[1]&"次（%s/"&RC[1]&"）" -> 争夺圣器600次（%s/600） | F741: 600 | H741: 1 | I741: 0 | J741: 0 | K741: 10089|10088 | L741: 8|20
A742: 8000 | B742: =INT(RC[-1]/1000) -> 8 | C742: 1 | D742: 1 | E742: =IF(RC[5]=1,"(每日任务)：",)&"竞技场累计胜利"&RC[1]&"次（%s/"&RC[1]&"）" -> 竞技场累计胜利15次（%s/15） | F742: 15 | H742: 1 | I742: 0 | J742: 0 | K742: 10107 | L742: 2 | N742: 挑战竞技场（无论胜负）x=所需次数
A743: 8001 | B743: =INT(RC[-1]/1000) -> 8 | C743: 1 | D743: 1 | E743: =IF(RC[5]=1,"(每日任务)：",)&"竞技场累计胜利"&RC[1]&"次（%s/"&RC[1]&"）" -> 竞技场累计胜利30次（%s/30） | F743: 30 | H743: 1 | I743: 0 | J743: 0 | K743: 10107 | L743: 2
A744: 8002 | B744: =INT(RC[-1]/1000) -> 8 | C744: 1 | D744: 1 | E744: =IF(RC[5]=1,"(每日任务)：",)&"竞技场累计胜利"&RC[1]&"次（%s/"&RC[1]&"）" -> 竞技场累计胜利50次（%s/50） | F744: 50 | H744: 1 | I744: 0 | J744: 0 | K744: 10107 | L744: 3
A745: 8003 | B745: =INT(RC[-1]/1000) -> 8 | C745: 1 | D745: 1 | E745: =IF(RC[5]=1,"(每日任务)：",)&"竞技场累计胜利"&RC[1]&"次（%s/"&RC[1]&"）" -> 竞技场累计胜利75次（%s/75） | F745: 75 | H745: 1 | I745: 0 | J745: 0 | K745: 10107 | L745: 4
A746: 8004 | B746: =INT(RC[-1]/1000) -> 8 | C746: 1 | D746: 1 | E746: =IF(RC[5]=1,"(每日任务)：",)&"竞技场累计胜利"&RC[1]&"次（%s/"&RC[1]&"）" -> 竞技场累计胜利110次（%s/110） | F746: 110 | H746: 1 | I746: 0 | J746: 0 | K746: 10107 | L746: 5
A747: 8005 | B747: =INT(RC[-1]/1000) -> 8 | C747: 1 | D747: 1 | E747: =IF(RC[5]=1,"(每日任务)：",)&"竞技场累计胜利"&RC[1]&"次（%s/"&RC[1]&"）" -> 竞技场累计胜利150次（%s/150） | F747: 150 | H747: 1 | I747: 0 | J747: 0 | K747: 10107 | L747: 6
A748: 8006 | B748: =INT(RC[-1]/1000) -> 8 | C748: 1 | D748: 1 | E748: =IF(RC[5]=1,"(每日任务)：",)&"竞技场累计胜利"&RC[1]&"次（%s/"&RC[1]&"）" -> 竞技场累计胜利225次（%s/225） | F748: 225 | H748: 1 | I748: 0 | J748: 0 | K748: 10107 | L748: 8
A749: 8007 | B749: =INT(RC[-1]/1000) -> 8 | C749: 1 | D749: 1 | E749: =IF(RC[5]=1,"(每日任务)：",)&"竞技场累计胜利"&RC[1]&"次（%s/"&RC[1]&"）" -> 竞技场累计胜利300次（%s/300） | F749: 300 | H749: 1 | I749: 0 | J749: 0 | K749: 10107 | L749: 10
A750: 8008 | B750: =INT(RC[-1]/1000) -> 8 | C750: 1 | D750: 1 | E750: =IF(RC[5]=1,"(每日任务)：",)&"竞技场累计胜利"&RC[1]&"次（%s/"&RC[1]&"）" -> 竞技场累计胜利375次（%s/375） | F750: 375 | H750: 1 | I750: 0 | J750: 0 | K750: 10107 | L750: 10
A751: 8009 | B751: =INT(RC[-1]/1000) -> 8 | C751: 1 | D751: 1 | E751: =IF(RC[5]=1,"(每日任务)：",)&"竞技场累计胜利"&RC[1]&"次（%s/"&RC[1]&"）" -> 竞技场累计胜利450次（%s/450） | F751: 450 | H751: 1 | I751: 0 | J751: 0 | K751: 10107 | L751: 10
A752: 8010 | B752: =INT(RC[-1]/1000) -> 8 | C752: 1 | D752: 1 | E752: =IF(RC[5]=1,"(每日任务)：",)&"竞技场累计胜利"&RC[1]&"次（%s/"&RC[1]&"）" -> (每日任务)：竞技场累计胜利5次（%s/5） | F752: 5 | H752: 1 | I752: 0 | J752: 1 | K752: 10084 | L752: 5
A753: 8011 | B753: =INT(RC[-1]/1000) -> 8 | C753: 1 | D753: 1 | E753: =IF(RC[5]=1,"(每日任务)：",)&"竞技场累计胜利"&RC[1]&"次（%s/"&RC[1]&"）" -> 竞技场累计胜利20次（%s/20） | F753: 20 | H753: 1 | I753: 0 | J753: 0 | K753: 10084|19006 | L753: 20|500
A754: 8012 | B754: =INT(RC[-1]/1000) -> 8 | C754: 1 | D754: 1 | E754: =IF(RC[5]=1,"(每日任务)：",)&"竞技场累计胜利"&RC[1]&"次（%s/"&RC[1]&"）" -> 竞技场累计胜利40次（%s/40） | F754: 40 | H754: 1 | I754: 0 | J754: 0 | K754: 10084|19006 | L754: 20|500
A755: 8013 | B755: =INT(RC[-1]/1000) -> 8 | C755: 1 | D755: 1 | E755: =IF(RC[5]=1,"(每日任务)：",)&"竞技场累计胜利"&RC[1]&"次（%s/"&RC[1]&"）" -> 竞技场累计胜利80次（%s/80） | F755: 80 | H755: 1 | I755: 0 | J755: 0 | K755: 10084|19006 | L755: 40|1000
A756: 8014 | B756: =INT(RC[-1]/1000) -> 8 | C756: 1 | D756: 1 | E756: =IF(RC[5]=1,"(每日任务)：",)&"竞技场累计胜利"&RC[1]&"次（%s/"&RC[1]&"）" -> 竞技场累计胜利120次（%s/120） | F756: 120 | H756: 1 | I756: 0 | J756: 0 | K756: 10084|19006 | L756: 40|1000
A757: 8015 | B757: =INT(RC[-1]/1000) -> 8 | C757: 1 | D757: 1 | E757: =IF(RC[5]=1,"(每日任务)：",)&"竞技场累计胜利"&RC[1]&"次（%s/"&RC[1]&"）" -> 竞技场累计胜利180次（%s/180） | F757: 180 | H757: 1 | I757: 0 | J757: 0 | K757: 10084|19006 | L757: 60|2000
A758: 8016 | B758: =INT(RC[-1]/1000) -> 8 | C758: 1 | D758: 1 | E758: =IF(RC[5]=1,"(每日任务)：",)&"竞技场累计胜利"&RC[1]&"次（%s/"&RC[1]&"）" -> 竞技场累计胜利240次（%s/240） | F758: 240 | H758: 1 | I758: 0 | J758: 0 | K758: 10084|19006 | L758: 60|2000
A759: 8017 | B759: =INT(RC[-1]/1000) -> 8 | C759: 1 | D759: 1 | E759: =IF(RC[5]=1,"(每日任务)：",)&"竞技场累计胜利"&RC[1]&"次（%s/"&RC[1]&"）" -> 竞技场累计胜利15次（%s/15） | F759: 15 | H759: 1 | I759: 0 | J759: 0 | K759: 10108 | L759: 2 | N759: 挑战竞技场（无论胜负）x=所需次数
A760: 8018 | B760: =INT(RC[-1]/1000) -> 8 | C760: 1 | D760: 1 | E760: =IF(RC[5]=1,"(每日任务)：",)&"竞技场累计胜利"&RC[1]&"次（%s/"&RC[1]&"）" -> 竞技场累计胜利30次（%s/30） | F760: 30 | H760: 1 | I760: 0 | J760: 0 | K760: 10108 | L760: 2
A761: 8019 | B761: =INT(RC[-1]/1000) -> 8 | C761: 1 | D761: 1 | E761: =IF(RC[5]=1,"(每日任务)：",)&"竞技场累计胜利"&RC[1]&"次（%s/"&RC[1]&"）" -> 竞技场累计胜利50次（%s/50） | F761: 50 | H761: 1 | I761: 0 | J761: 0 | K761: 10108 | L761: 3
A762: 8020 | B762: =INT(RC[-1]/1000) -> 8 | C762: 1 | D762: 1 | E762: =IF(RC[5]=1,"(每日任务)：",)&"竞技场累计胜利"&RC[1]&"次（%s/"&RC[1]&"）" -> 竞技场累计胜利75次（%s/75） | F762: 75 | H762: 1 | I762: 0 | J762: 0 | K762: 10108 | L762: 4
A763: 8021 | B763: =INT(RC[-1]/1000) -> 8 | C763: 1 | D763: 1 | E763: =IF(RC[5]=1,"(每日任务)：",)&"竞技场累计胜利"&RC[1]&"次（%s/"&RC[1]&"）" -> 竞技场累计胜利110次（%s/110） | F763: 110 | H763: 1 | I763: 0 | J763: 0 | K763: 10108 | L763: 5
A764: 8022 | B764: =INT(RC[-1]/1000) -> 8 | C764: 1 | D764: 1 | E764: =IF(RC[5]=1,"(每日任务)：",)&"竞技场累计胜利"&RC[1]&"次（%s/"&RC[1]&"）" -> 竞技场累计胜利150次（%s/150） | F764: 150 | H764: 1 | I764: 0 | J764: 0 | K764: 10108 | L764: 6
A765: 8023 | B765: =INT(RC[-1]/1000) -> 8 | C765: 1 | D765: 1 | E765: =IF(RC[5]=1,"(每日任务)：",)&"竞技场累计胜利"&RC[1]&"次（%s/"&RC[1]&"）" -> 竞技场累计胜利225次（%s/225） | F765: 225 | H765: 1 | I765: 0 | J765: 0 | K765: 10108 | L765: 8
A766: 8024 | B766: =INT(RC[-1]/1000) -> 8 | C766: 1 | D766: 1 | E766: =IF(RC[5]=1,"(每日任务)：",)&"竞技场累计胜利"&RC[1]&"次（%s/"&RC[1]&"）" -> 竞技场累计胜利300次（%s/300） | F766: 300 | H766: 1 | I766: 0 | J766: 0 | K766: 10108 | L766: 10
A767: 8025 | B767: =INT(RC[-1]/1000) -> 8 | C767: 1 | D767: 1 | E767: =IF(RC[5]=1,"(每日任务)：",)&"竞技场累计胜利"&RC[1]&"次（%s/"&RC[1]&"）" -> 竞技场累计胜利375次（%s/375） | F767: 375 | H767: 1 | I767: 0 | J767: 0 | K767: 10108 | L767: 10
A768: 8026 | B768: =INT(RC[-1]/1000) -> 8 | C768: 1 | D768: 1 | E768: =IF(RC[5]=1,"(每日任务)：",)&"竞技场累计胜利"&RC[1]&"次（%s/"&RC[1]&"）" -> 竞技场累计胜利450次（%s/450） | F768: 450 | H768: 1 | I768: 0 | J768: 0 | K768: 10108 | L768: 10
A769: 8027 | B769: =INT(RC[-1]/1000) -> 8 | C769: 1 | D769: 1 | E769: =IF(RC[5]=1,"(每日任务)：",)&"竞技场累计胜利"&RC[1]&"次（%s/"&RC[1]&"）" -> 竞技场累计胜利15次（%s/15） | F769: 15 | H769: 1 | I769: 0 | J769: 0 | K769: 19013 | L769: 200
A770: 8028 | B770: =INT(RC[-1]/1000) -> 8 | C770: 1 | D770: 1 | E770: =IF(RC[5]=1,"(每日任务)：",)&"竞技场累计胜利"&RC[1]&"次（%s/"&RC[1]&"）" -> 竞技场累计胜利30次（%s/30） | F770: 30 | H770: 1 | I770: 0 | J770: 0 | K770: 19013 | L770: 200
A771: 8029 | B771: =INT(RC[-1]/1000) -> 8 | C771: 1 | D771: 1 | E771: =IF(RC[5]=1,"(每日任务)：",)&"竞技场累计胜利"&RC[1]&"次（%s/"&RC[1]&"）" -> 竞技场累计胜利50次（%s/50） | F771: 50 | H771: 1 | I771: 0 | J771: 0 | K771: 19013 | L771: 300
A772: 8030 | B772: =INT(RC[-1]/1000) -> 8 | C772: 1 | D772: 1 | E772: =IF(RC[5]=1,"(每日任务)：",)&"竞技场累计胜利"&RC[1]&"次（%s/"&RC[1]&"）" -> 竞技场累计胜利75次（%s/75） | F772: 75 | H772: 1 | I772: 0 | J772: 0 | K772: 19013 | L772: 400
A773: 8031 | B773: =INT(RC[-1]/1000) -> 8 | C773: 1 | D773: 1 | E773: =IF(RC[5]=1,"(每日任务)：",)&"竞技场累计胜利"&RC[1]&"次（%s/"&RC[1]&"）" -> 竞技场累计胜利110次（%s/110） | F773: 110 | H773: 1 | I773: 0 | J773: 0 | K773: 19013 | L773: 500
A774: 8032 | B774: =INT(RC[-1]/1000) -> 8 | C774: 1 | D774: 1 | E774: =IF(RC[5]=1,"(每日任务)：",)&"竞技场累计胜利"&RC[1]&"次（%s/"&RC[1]&"）" -> 竞技场累计胜利150次（%s/150） | F774: 150 | H774: 1 | I774: 0 | J774: 0 | K774: 19013 | L774: 600
A775: 8033 | B775: =INT(RC[-1]/1000) -> 8 | C775: 1 | D775: 1 | E775: =IF(RC[5]=1,"(每日任务)：",)&"竞技场累计胜利"&RC[1]&"次（%s/"&RC[1]&"）" -> 竞技场累计胜利225次（%s/225） | F775: 225 | H775: 1 | I775: 0 | J775: 0 | K775: 19013 | L775: 800
A776: 8034 | B776: =INT(RC[-1]/1000) -> 8 | C776: 1 | D776: 1 | E776: =IF(RC[5]=1,"(每日任务)：",)&"竞技场累计胜利"&RC[1]&"次（%s/"&RC[1]&"）" -> 竞技场累计胜利300次（%s/300） | F776: 300 | H776: 1 | I776: 0 | J776: 0 | K776: 19013 | L776: 1000
A777: 8035 | B777: =INT(RC[-1]/1000) -> 8 | C777: 1 | D777: 1 | E777: =IF(RC[5]=1,"(每日任务)：",)&"竞技场累计胜利"&RC[1]&"次（%s/"&RC[1]&"）" -> 竞技场累计胜利375次（%s/375） | F777: 375 | H777: 1 | I777: 0 | J777: 0 | K777: 19013 | L777: 1200
A778: 8036 | B778: =INT(RC[-1]/1000) -> 8 | C778: 1 | D778: 1 | E778: =IF(RC[5]=1,"(每日任务)：",)&"竞技场累计胜利"&RC[1]&"次（%s/"&RC[1]&"）" -> 竞技场累计胜利450次（%s/450） | F778: 450 | H778: 1 | I778: 0 | J778: 0 | K778: 19013 | L778: 1500
A779: 8037 | B779: =INT(RC[-1]/1000) -> 8 | C779: 1 | D779: 1 | E779: =IF(RC[5]=1,"(每日任务)：",)&"竞技场累计胜利"&RC[1]&"次（%s/"&RC[1]&"）" -> (每日任务)：竞技场累计胜利5次（%s/5） | F779: 5 | H779: 1 | I779: 0 | J779: 1 | K779: 10078|10077 | L779: 1|5
A780: 8038 | B780: =INT(RC[-1]/1000) -> 8 | C780: 1 | D780: 1 | E780: =IF(RC[5]=1,"(每日任务)：",)&"竞技场累计胜利"&RC[1]&"次（%s/"&RC[1]&"）" -> (每日任务)：竞技场累计胜利5次（%s/5） | F780: 5 | H780: 1 | I780: 0 | J780: 1 | K780: 10001 | L780: 1
A781: 8039 | B781: =INT(RC[-1]/1000) -> 8 | C781: 1 | D781: 1 | E781: =IF(RC[5]=1,"(每日任务)：",)&"竞技场累计胜利"&RC[1]&"次（%s/"&RC[1]&"）" -> (每日任务)：竞技场累计胜利5次（%s/5） | F781: 5 | H781: 1 | I781: 0 | J781: 1 | K781: 10074|10073 | L781: 1|5
A782: 8040 | B782: =INT(RC[-1]/1000) -> 8 | C782: 1 | D782: 1 | E782: =IF(RC[5]=1,"(每日任务)：",)&"竞技场累计胜利"&RC[1]&"次（%s/"&RC[1]&"）" -> (每日任务)：竞技场累计胜利5次（%s/5） | F782: 5 | H782: 1 | I782: 0 | J782: 1 | K782: 10001 | L782: 1
A783: 8041 | B783: =INT(RC[-1]/1000) -> 8 | C783: 1 | D783: 1 | E783: =IF(RC[5]=1,"(每日任务)：",)&"竞技场累计胜利"&RC[1]&"次（%s/"&RC[1]&"）" -> 竞技场累计胜利25次（%s/25） | F783: 25 | H783: 1 | I783: 0 | J783: 0 | K783: 19013 | L783: 500
A784: 8042 | B784: =INT(RC[-1]/1000) -> 8 | C784: 1 | D784: 1 | E784: =IF(RC[5]=1,"(每日任务)：",)&"竞技场累计胜利"&RC[1]&"次（%s/"&RC[1]&"）" -> 竞技场累计胜利50次（%s/50） | F784: 50 | H784: 1 | I784: 0 | J784: 0 | K784: 19013 | L784: 500
A785: 8043 | B785: =INT(RC[-1]/1000) -> 8 | C785: 1 | D785: 1 | E785: =IF(RC[5]=1,"(每日任务)：",)&"竞技场累计胜利"&RC[1]&"次（%s/"&RC[1]&"）" -> 竞技场累计胜利75次（%s/75） | F785: 75 | H785: 1 | I785: 0 | J785: 0 | K785: 19013 | L785: 500
A786: 8044 | B786: =INT(RC[-1]/1000) -> 8 | C786: 1 | D786: 1 | E786: =IF(RC[5]=1,"(每日任务)：",)&"竞技场累计胜利"&RC[1]&"次（%s/"&RC[1]&"）" -> 竞技场累计胜利100次（%s/100） | F786: 100 | H786: 1 | I786: 0 | J786: 0 | K786: 19013 | L786: 500
A787: 8045 | B787: =INT(RC[-1]/1000) -> 8 | C787: 1 | D787: 1 | E787: =IF(RC[5]=1,"(每日任务)：",)&"竞技场累计胜利"&RC[1]&"次（%s/"&RC[1]&"）" -> 竞技场累计胜利150次（%s/150） | F787: 150 | H787: 1 | I787: 0 | J787: 0 | K787: 19013 | L787: 1000
A788: 8046 | B788: =INT(RC[-1]/1000) -> 8 | C788: 1 | D788: 1 | E788: =IF(RC[5]=1,"(每日任务)：",)&"竞技场累计胜利"&RC[1]&"次（%s/"&RC[1]&"）" -> 竞技场累计胜利200次（%s/200） | F788: 200 | H788: 1 | I788: 0 | J788: 0 | K788: 19013 | L788: 1000
A789: 8047 | B789: =INT(RC[-1]/1000) -> 8 | C789: 1 | D789: 1 | E789: =IF(RC[5]=1,"(每日任务)：",)&"竞技场累计胜利"&RC[1]&"次（%s/"&RC[1]&"）" -> 竞技场累计胜利250次（%s/250） | F789: 250 | H789: 1 | I789: 0 | J789: 0 | K789: 19013 | L789: 1000
A790: 8048 | B790: =INT(RC[-1]/1000) -> 8 | C790: 1 | D790: 1 | E790: =IF(RC[5]=1,"(每日任务)：",)&"竞技场累计胜利"&RC[1]&"次（%s/"&RC[1]&"）" -> 竞技场累计胜利300次（%s/300） | F790: 300 | H790: 1 | I790: 0 | J790: 0 | K790: 19013 | L790: 1000
A791: 8049 | B791: =INT(RC[-1]/1000) -> 8 | C791: 1 | D791: 1 | E791: =IF(RC[5]=1,"(每日任务)：",)&"竞技场累计胜利"&RC[1]&"次（%s/"&RC[1]&"）" -> 竞技场累计胜利400次（%s/400） | F791: 400 | H791: 1 | I791: 0 | J791: 0 | K791: 19013 | L791: 1500
A792: 8050 | B792: =INT(RC[-1]/1000) -> 8 | C792: 1 | D792: 1 | E792: =IF(RC[5]=1,"(每日任务)：",)&"竞技场累计胜利"&RC[1]&"次（%s/"&RC[1]&"）" -> 竞技场累计胜利500次（%s/500） | F792: 500 | H792: 1 | I792: 0 | J792: 0 | K792: 19013 | L792: 1500
A793: 8051 | B793: =INT(RC[-1]/1000) -> 8 | C793: 1 | D793: 1 | E793: =IF(RC[5]=1,"(每日任务)：",)&"竞技场累计胜利"&RC[1]&"次（%s/"&RC[1]&"）" -> (每日任务)：竞技场累计胜利10次（%s/10） | F793: 10 | H793: 1 | I793: 0 | J793: 1 | K793: 10005 | L793: 5 | N793: 挑战竞技场（无论胜负）x=所需次数
A794: 8052 | B794: =INT(RC[-1]/1000) -> 8 | C794: 1 | D794: 1 | E794: =IF(RC[5]=1,"(每日任务)：",)&"竞技场累计胜利"&RC[1]&"次（%s/"&RC[1]&"）" -> 竞技场累计胜利50次（%s/50） | F794: 50 | H794: 1 | I794: 0 | J794: 0 | K794: 19013 | L794: 1000
A795: 8053 | B795: =INT(RC[-1]/1000) -> 8 | C795: 1 | D795: 1 | E795: =IF(RC[5]=1,"(每日任务)：",)&"竞技场累计胜利"&RC[1]&"次（%s/"&RC[1]&"）" -> 竞技场累计胜利100次（%s/100） | F795: 100 | H795: 1 | I795: 0 | J795: 0 | K795: 10005 | L795: 10
A796: 8054 | B796: =INT(RC[-1]/1000) -> 8 | C796: 1 | D796: 1 | E796: =IF(RC[5]=1,"(每日任务)：",)&"竞技场累计胜利"&RC[1]&"次（%s/"&RC[1]&"）" -> 竞技场累计胜利150次（%s/150） | F796: 150 | H796: 1 | I796: 0 | J796: 0 | K796: 19013 | L796: 1000
A797: 8055 | B797: =INT(RC[-1]/1000) -> 8 | C797: 1 | D797: 1 | E797: =IF(RC[5]=1,"(每日任务)：",)&"竞技场累计胜利"&RC[1]&"次（%s/"&RC[1]&"）" -> 竞技场累计胜利200次（%s/200） | F797: 200 | H797: 1 | I797: 0 | J797: 0 | K797: 19013 | L797: 2000
A798: 8056 | B798: =INT(RC[-1]/1000) -> 8 | C798: 1 | D798: 1 | E798: =IF(RC[5]=1,"(每日任务)：",)&"竞技场累计胜利"&RC[1]&"次（%s/"&RC[1]&"）" -> 竞技场累计胜利300次（%s/300） | F798: 300 | H798: 1 | I798: 0 | J798: 0 | K798: 10005 | L798: 10
A799: 8057 | B799: =INT(RC[-1]/1000) -> 8 | C799: 1 | D799: 1 | E799: =IF(RC[5]=1,"(每日任务)：",)&"竞技场累计胜利"&RC[1]&"次（%s/"&RC[1]&"）" -> 竞技场累计胜利400次（%s/400） | F799: 400 | H799: 1 | I799: 0 | J799: 0 | K799: 19013 | L799: 2000
A800: 8058 | B800: =INT(RC[-1]/1000) -> 8 | C800: 1 | D800: 1 | E800: =IF(RC[5]=1,"(每日任务)：",)&"竞技场累计胜利"&RC[1]&"次（%s/"&RC[1]&"）" -> 竞技场累计胜利500次（%s/500） | F800: 500 | H800: 1 | I800: 0 | J800: 0 | K800: 10005 | L800: 20
A801: 8059 | B801: =INT(RC[-1]/1000) -> 8 | C801: 1 | D801: 1 | E801: =IF(RC[5]=1,"(每日任务)：",)&"竞技场累计胜利"&RC[1]&"次（%s/"&RC[1]&"）" -> 竞技场累计胜利600次（%s/600） | F801: 600 | H801: 1 | I801: 0 | J801: 0 | K801: 19013 | L801: 2000
A802: 8060 | B802: =INT(RC[-1]/1000) -> 8 | C802: 1 | D802: 1 | E802: =IF(RC[5]=1,"(每日任务)：",)&"竞技场累计胜利"&RC[1]&"次（%s/"&RC[1]&"）" -> 竞技场累计胜利700次（%s/700） | F802: 700 | H802: 1 | I802: 0 | J802: 0 | K802: 19013 | L802: 4000
A803: 8061 | B803: =INT(RC[-1]/1000) -> 8 | C803: 1 | D803: 1 | E803: =IF(RC[5]=1,"(每日任务)：",)&"竞技场累计胜利"&RC[1]&"次（%s/"&RC[1]&"）" -> (每日任务)：竞技场累计胜利5次（%s/5） | F803: 5 | H803: 1 | I803: 0 | J803: 1 | K803: 10005 | L803: 5
A804: 8062 | B804: =INT(RC[-1]/1000) -> 8 | C804: 1 | D804: 1 | E804: =IF(RC[5]=1,"(每日任务)：",)&"竞技场累计胜利"&RC[1]&"次（%s/"&RC[1]&"）" -> 竞技场累计胜利20次（%s/20） | F804: 20 | H804: 1 | I804: 0 | J804: 0 | K804: 19013 | L804: 1000
A805: 8063 | B805: =INT(RC[-1]/1000) -> 8 | C805: 1 | D805: 1 | E805: =IF(RC[5]=1,"(每日任务)：",)&"竞技场累计胜利"&RC[1]&"次（%s/"&RC[1]&"）" -> 竞技场累计胜利40次（%s/40） | F805: 40 | H805: 1 | I805: 0 | J805: 0 | K805: 10005 | L805: 10
A806: 8064 | B806: =INT(RC[-1]/1000) -> 8 | C806: 1 | D806: 1 | E806: =IF(RC[5]=1,"(每日任务)：",)&"竞技场累计胜利"&RC[1]&"次（%s/"&RC[1]&"）" -> 竞技场累计胜利60次（%s/60） | F806: 60 | H806: 1 | I806: 0 | J806: 0 | K806: 19013 | L806: 1000
A807: 8065 | B807: =INT(RC[-1]/1000) -> 8 | C807: 1 | D807: 1 | E807: =IF(RC[5]=1,"(每日任务)：",)&"竞技场累计胜利"&RC[1]&"次（%s/"&RC[1]&"）" -> 竞技场累计胜利80次（%s/80） | F807: 80 | H807: 1 | I807: 0 | J807: 0 | K807: 19013 | L807: 2000
A808: 8066 | B808: =INT(RC[-1]/1000) -> 8 | C808: 1 | D808: 1 | E808: =IF(RC[5]=1,"(每日任务)：",)&"竞技场累计胜利"&RC[1]&"次（%s/"&RC[1]&"）" -> 竞技场累计胜利100次（%s/100） | F808: 100 | H808: 1 | I808: 0 | J808: 0 | K808: 10005 | L808: 10
A809: 8067 | B809: =INT(RC[-1]/1000) -> 8 | C809: 1 | D809: 1 | E809: =IF(RC[5]=1,"(每日任务)：",)&"竞技场累计胜利"&RC[1]&"次（%s/"&RC[1]&"）" -> (每日任务)：竞技场累计胜利5次（%s/5） | F809: 5 | H809: 1 | I809: 0 | J809: 1 | K809: 10089|10088 | L809: 1|5 | N809: 挑战竞技场（无论胜负）x=所需次数
A810: 8068 | B810: =INT(RC[-1]/1000) -> 8 | C810: 1 | D810: 1 | E810: =IF(RC[5]=1,"(每日任务)：",)&"竞技场累计胜利"&RC[1]&"次（%s/"&RC[1]&"）" -> 竞技场累计胜利20次（%s/20） | F810: 20 | H810: 1 | I810: 0 | J810: 0 | K810: 10089|10088 | L810: 1|5
A811: 8069 | B811: =INT(RC[-1]/1000) -> 8 | C811: 1 | D811: 1 | E811: =IF(RC[5]=1,"(每日任务)：",)&"竞技场累计胜利"&RC[1]&"次（%s/"&RC[1]&"）" -> 竞技场累计胜利40次（%s/40） | F811: 40 | H811: 1 | I811: 0 | J811: 0 | K811: 10089|10088 | L811: 2|5
A812: 8070 | B812: =INT(RC[-1]/1000) -> 8 | C812: 1 | D812: 1 | E812: =IF(RC[5]=1,"(每日任务)：",)&"竞技场累计胜利"&RC[1]&"次（%s/"&RC[1]&"）" -> 竞技场累计胜利80次（%s/80） | F812: 80 | H812: 1 | I812: 0 | J812: 0 | K812: 10089|10088 | L812: 3|10
A813: 8071 | B813: =INT(RC[-1]/1000) -> 8 | C813: 1 | D813: 1 | E813: =IF(RC[5]=1,"(每日任务)：",)&"竞技场累计胜利"&RC[1]&"次（%s/"&RC[1]&"）" -> 竞技场累计胜利120次（%s/120） | F813: 120 | H813: 1 | I813: 0 | J813: 0 | K813: 10089|10088 | L813: 4|10
A814: 8072 | B814: =INT(RC[-1]/1000) -> 8 | C814: 1 | D814: 1 | E814: =IF(RC[5]=1,"(每日任务)：",)&"竞技场累计胜利"&RC[1]&"次（%s/"&RC[1]&"）" -> 竞技场累计胜利160次（%s/160） | F814: 160 | H814: 1 | I814: 0 | J814: 0 | K814: 10089|10088 | L814: 5|10
A815: 8073 | B815: =INT(RC[-1]/1000) -> 8 | C815: 1 | D815: 1 | E815: =IF(RC[5]=1,"(每日任务)：",)&"竞技场累计胜利"&RC[1]&"次（%s/"&RC[1]&"）" -> 竞技场累计胜利240次（%s/240） | F815: 240 | H815: 1 | I815: 0 | J815: 0 | K815: 10089|10088 | L815: 6|20
A816: 8074 | B816: =INT(RC[-1]/1000) -> 8 | C816: 1 | D816: 1 | E816: =IF(RC[5]=1,"(每日任务)：",)&"竞技场累计胜利"&RC[1]&"次（%s/"&RC[1]&"）" -> 竞技场累计胜利320次（%s/320） | F816: 320 | H816: 1 | I816: 0 | J816: 0 | K816: 10089|10088 | L816: 7|20
A817: 8075 | B817: =INT(RC[-1]/1000) -> 8 | C817: 1 | D817: 1 | E817: =IF(RC[5]=1,"(每日任务)：",)&"竞技场累计胜利"&RC[1]&"次（%s/"&RC[1]&"）" -> 竞技场累计胜利400次（%s/400） | F817: 400 | H817: 1 | I817: 0 | J817: 0 | K817: 10089|10088 | L817: 8|20
A818: 9000 | B818: =INT(RC[-1]/1000) -> 9 | C818: 1 | D818: 1 | E818: ="累计击杀无尽深渊怪物"&RC[1]&"只（%s/"&RC[1]&"）" -> 累计击杀无尽深渊怪物500只（%s/500） | F818: 500 | H818: 1 | I818: 0 | J818: 0 | K818: 19028 | L818: 200 | N818: 无尽深渊击杀怪物数量x=所需数量
A819: 9001 | B819: =INT(RC[-1]/1000) -> 9 | C819: 1 | D819: 1 | E819: ="累计击杀无尽深渊怪物"&RC[1]&"只（%s/"&RC[1]&"）" -> 累计击杀无尽深渊怪物1000只（%s/1000） | F819: 1000 | H819: 1 | I819: 0 | J819: 0 | K819: 19028 | L819: 200
A820: 9002 | B820: =INT(RC[-1]/1000) -> 9 | C820: 1 | D820: 1 | E820: ="累计击杀无尽深渊怪物"&RC[1]&"只（%s/"&RC[1]&"）" -> 累计击杀无尽深渊怪物2000只（%s/2000） | F820: 2000 | H820: 1 | I820: 0 | J820: 0 | K820: 19028 | L820: 300
A821: 9003 | B821: =INT(RC[-1]/1000) -> 9 | C821: 1 | D821: 1 | E821: ="累计击杀无尽深渊怪物"&RC[1]&"只（%s/"&RC[1]&"）" -> 累计击杀无尽深渊怪物3000只（%s/3000） | F821: 3000 | H821: 1 | I821: 0 | J821: 0 | K821: 19028 | L821: 300
A822: 9004 | B822: =INT(RC[-1]/1000) -> 9 | C822: 1 | D822: 1 | E822: ="累计击杀无尽深渊怪物"&RC[1]&"只（%s/"&RC[1]&"）" -> 累计击杀无尽深渊怪物4500只（%s/4500） | F822: 4500 | H822: 1 | I822: 0 | J822: 0 | K822: 19028 | L822: 500
A823: 9005 | B823: =INT(RC[-1]/1000) -> 9 | C823: 1 | D823: 1 | E823: ="累计击杀无尽深渊怪物"&RC[1]&"只（%s/"&RC[1]&"）" -> 累计击杀无尽深渊怪物6000只（%s/6000） | F823: 6000 | H823: 1 | I823: 0 | J823: 0 | K823: 19028 | L823: 500
A824: 9006 | B824: =INT(RC[-1]/1000) -> 9 | C824: 1 | D824: 1 | E824: ="累计击杀无尽深渊怪物"&RC[1]&"只（%s/"&RC[1]&"）" -> 累计击杀无尽深渊怪物8000只（%s/8000） | F824: 8000 | H824: 1 | I824: 0 | J824: 0 | K824: 19028 | L824: 800
A825: 9007 | B825: =INT(RC[-1]/1000) -> 9 | C825: 1 | D825: 1 | E825: ="累计击杀无尽深渊怪物"&RC[1]&"只（%s/"&RC[1]&"）" -> 累计击杀无尽深渊怪物10000只（%s/10000） | F825: 10000 | H825: 1 | I825: 0 | J825: 0 | K825: 19028 | L825: 800
A826: 10000 | B826: =INT(RC[-1]/1000) -> 10 | C826: 1 | D826: 1 | E826: ="累计进行"&RC[1]&"次召唤（%s/"&RC[1]&"）" -> 累计进行20次召唤（%s/20） | F826: 20 | H826: 1 | I826: 0 | J826: 0 | K826: 10019 | L826: 3 | N826: 高级召唤x=所需次数
A827: 10001 | B827: =INT(RC[-1]/1000) -> 10 | C827: 1 | D827: 1 | E827: ="累计进行"&RC[1]&"次召唤（%s/"&RC[1]&"）" -> 累计进行40次召唤（%s/40） | F827: 40 | H827: 1 | I827: 0 | J827: 0 | K827: 13300 | L827: 1
A828: 10002 | B828: =INT(RC[-1]/1000) -> 10 | C828: 1 | D828: 1 | E828: ="累计进行"&RC[1]&"次召唤（%s/"&RC[1]&"）" -> 累计进行70次召唤（%s/70） | F828: 70 | H828: 1 | I828: 0 | J828: 0 | K828: 13435 | L828: 1
A829: 10003 | B829: =INT(RC[-1]/1000) -> 10 | C829: 1 | D829: 1 | E829: ="累计进行"&RC[1]&"次召唤（%s/"&RC[1]&"）" -> 累计进行100次召唤（%s/100） | F829: 100 | H829: 1 | I829: 0 | J829: 0 | K829: 13434 | L829: 1
A830: 10004 | B830: =INT(RC[-1]/1000) -> 10 | C830: 1 | D830: 1 | E830: ="累计进行"&RC[1]&"次召唤（%s/"&RC[1]&"）" -> 累计进行140次召唤（%s/140） | F830: 140 | H830: 1 | I830: 0 | J830: 0 | K830: 13434|13435 | L830: 1|1
A831: 10005 | B831: =INT(RC[-1]/1000) -> 10 | C831: 1 | D831: 1 | E831: ="累计进行"&RC[1]&"次召唤（%s/"&RC[1]&"）（赠送顶级红品合击组合）" -> 累计进行180次召唤（%s/180）（赠送顶级红品合击组合） | F831: 180 | H831: 1 | I831: 0 | J831: 0 | K831: 13379|13380 | L831: 2|2
A832: 11000 | B832: 11 | C832: 0 | D832: 1 | E832: %s登陆即可领取 | F832: 6 | H832: 1 | I832: 0 | J832: 0 | K832: 19005|10022 | L832: 100|10 | N832: 开服登陆x=开服第几天
A833: 11001 | B833: 11 | C833: 0 | D833: 1 | E833: %s登陆即可领取 | F833: 7 | H833: 1 | I833: 0 | J833: 0 | K833: 19005|10022 | L833: 100|10
A834: 11002 | B834: 11 | C834: 0 | D834: 1 | E834: %s登陆即可领取 | F834: 8 | H834: 1 | I834: 0 | J834: 0 | K834: 19005|10022 | L834: 100|10
A835: 11003 | B835: 11 | C835: 0 | D835: 1 | E835: %s登陆即可领取 | F835: 9 | H835: 1 | I835: 0 | J835: 0 | K835: 19005|10022 | L835: 100|10
A836: 11004 | B836: 11 | C836: 0 | D836: 1 | E836: %s登陆即可领取 | F836: 10 | H836: 1 | I836: 0 | J836: 0 | K836: 19005|10022 | L836: 100|10
A837: 11005 | B837: 11 | C837: 0 | D837: 1 | E837: %s登陆即可领取 | F837: 11 | H837: 1 | I837: 0 | J837: 0 | K837: 10102|10101|19030 | L837: 1|1|500
A838: 11006 | B838: 11 | C838: 0 | D838: 1 | E838: %s登陆即可领取 | F838: 12 | H838: 1 | I838: 0 | J838: 0 | K838: 10102|10101|19005 | L838: 1|1|100
A839: 11007 | B839: 11 | C839: 0 | D839: 1 | E839: %s登陆即可领取 | F839: 13 | H839: 1 | I839: 0 | J839: 0 | K839: 10102|10101|19006 | L839: 1|1|150
A840: 11008 | B840: 11 | C840: 0 | D840: 1 | E840: %s登陆即可领取 | F840: 14 | H840: 1 | I840: 0 | J840: 0 | K840: 10102|10101|19012 | L840: 1|1|2000
A841: 11009 | B841: 11 | C841: 0 | D841: 1 | E841: %s登陆即可领取 | F841: 15 | H841: 1 | I841: 0 | J841: 0 | K841: 10102|10101|19017 | L841: 1|1|250
A842: 11010 | B842: 11 | C842: 0 | D842: 1 | E842: %s登陆即可领取 | F842: 1 | H842: 1 | I842: 0 | J842: 0 | K842: 19005 | L842: 100
A843: 11011 | B843: 11 | C843: 0 | D843: 1 | E843: %s登陆即可领取 | F843: 2 | H843: 1 | I843: 0 | J843: 0 | K843: 19005 | L843: 300
A844: 11012 | B844: 11 | C844: 0 | D844: 1 | E844: %s登陆即可领取 | F844: 3 | H844: 1 | I844: 0 | J844: 0 | K844: 19005 | L844: 500
A845: 11013 | B845: 11 | C845: 0 | D845: 1 | E845: %s登陆即可领取 | F845: 1 | H845: 1 | I845: 0 | J845: 0 | K845: 19005 | L845: 100
A846: 11014 | B846: 11 | C846: 0 | D846: 1 | E846: %s登陆即可领取 | F846: 2 | H846: 1 | I846: 0 | J846: 0 | K846: 19005 | L846: 100
A847: 11015 | B847: 11 | C847: 0 | D847: 1 | E847: %s登陆即可领取 | F847: 3 | H847: 1 | I847: 0 | J847: 0 | K847: 19005 | L847: 100
A848: 11016 | B848: 11 | C848: 0 | D848: 1 | E848: %s登陆即可领取 | F848: 7 | H848: 1 | I848: 0 | J848: 0 | K848: 19005|10022 | L848: 100|10
A849: 11017 | B849: 11 | C849: 0 | D849: 1 | E849: %s登陆即可领取 | F849: 8 | H849: 1 | I849: 0 | J849: 0 | K849: 19005|10022 | L849: 100|10
A850: 11018 | B850: 11 | C850: 0 | D850: 1 | E850: %s登陆即可领取 | F850: 9 | H850: 1 | I850: 0 | J850: 0 | K850: 19005|10022 | L850: 100|10
A851: 11019 | B851: 11 | C851: 0 | D851: 1 | E851: %s登陆即可领取 | F851: 10 | H851: 1 | I851: 0 | J851: 0 | K851: 19005|10022 | L851: 100|10
A852: 11020 | B852: 11 | C852: 0 | D852: 1 | E852: %s登陆即可领取 | F852: 11 | H852: 1 | I852: 0 | J852: 0 | K852: 19005|10022 | L852: 100|10
A853: 11021 | B853: 11 | C853: 0 | D853: 1 | E853: %s登陆即可领取 | F853: 12 | H853: 1 | I853: 0 | J853: 0 | K853: 19005|10022 | L853: 100|10
A854: 11022 | B854: 11 | C854: 0 | D854: 1 | E854: %s登陆即可领取 | F854: 13 | H854: 1 | I854: 0 | J854: 0 | K854: 10103|10101|19030 | L854: 1|1|500
A855: 11023 | B855: 11 | C855: 0 | D855: 1 | E855: %s登陆即可领取 | F855: 14 | H855: 1 | I855: 0 | J855: 0 | K855: 10103|10101|19005 | L855: 1|1|100
A856: 11024 | B856: 11 | C856: 0 | D856: 1 | E856: %s登陆即可领取 | F856: 15 | H856: 1 | I856: 0 | J856: 0 | K856: 10103|10101|19006 | L856: 1|1|150
A857: 11025 | B857: 11 | C857: 0 | D857: 1 | E857: %s登陆即可领取 | F857: 16 | H857: 1 | I857: 0 | J857: 0 | K857: 10103|10101|19012 | L857: 1|1|2000
A858: 11026 | B858: 11 | C858: 0 | D858: 1 | E858: %s登陆即可领取 | F858: 17 | H858: 1 | I858: 0 | J858: 0 | K858: 10103|10101|19017 | L858: 1|1|250
A859: 11027 | B859: 11 | C859: 0 | D859: 1 | E859: %s登陆即可领取 | F859: 18 | H859: 1 | I859: 0 | J859: 0 | K859: 10103|10101|19017 | L859: 1|1|250
A860: 11028 | B860: 11 | C860: 0 | D860: 1 | E860: %s登陆即可领取 | F860: 8 | H860: 1 | I860: 0 | J860: 0 | K860: 10101|19030 | L860: 1|500
A861: 11029 | B861: 11 | C861: 0 | D861: 1 | E861: %s登陆即可领取 | F861: 9 | H861: 1 | I861: 0 | J861: 0 | K861: 10101|19030 | L861: 1|500
A862: 11030 | B862: 11 | C862: 0 | D862: 1 | E862: %s登陆即可领取 | F862: 10 | H862: 1 | I862: 0 | J862: 0 | K862: 10101|19030 | L862: 1|500
A863: 11031 | B863: 11 | C863: 0 | D863: 1 | E863: %s登陆即可领取 | F863: 11 | H863: 1 | I863: 0 | J863: 0 | K863: 10101|19030 | L863: 2|500
A864: 11032 | B864: 11 | C864: 0 | D864: 1 | E864: %s登陆即可领取 | F864: 12 | H864: 1 | I864: 0 | J864: 0 | K864: 10101|19030 | L864: 2|500
A865: 11033 | B865: 11 | C865: 0 | D865: 1 | E865: %s登陆即可领取 | F865: 13 | H865: 1 | I865: 0 | J865: 0 | K865: 10101|19030 | L865: 2|500
A866: 11034 | B866: 11 | C866: 0 | D866: 1 | E866: %s登陆即可领取 | F866: 14 | H866: 1 | I866: 0 | J866: 0 | K866: 10101|19030 | L866: 2|500
A867: 11035 | B867: 11 | C867: 0 | D867: 1 | E867: %s登陆即可领取 | F867: 15 | H867: 1 | I867: 0 | J867: 0 | K867: 10096|19103 | L867: 1|10
A868: 11036 | B868: 11 | C868: 0 | D868: 1 | E868: %s登陆即可领取 | F868: 16 | H868: 1 | I868: 0 | J868: 0 | K868: 10096|19103 | L868: 1|10
A869: 11037 | B869: 11 | C869: 0 | D869: 1 | E869: %s登陆即可领取 | F869: 17 | H869: 1 | I869: 0 | J869: 0 | K869: 10096|19103 | L869: 1|10
A870: 11038 | B870: 11 | C870: 0 | D870: 1 | E870: %s登陆即可领取 | F870: 18 | H870: 1 | I870: 0 | J870: 0 | K870: 10096|19103 | L870: 1|10
A871: 11039 | B871: 11 | C871: 0 | D871: 1 | E871: %s登陆即可领取 | F871: 19 | H871: 1 | I871: 0 | J871: 0 | K871: 10096|19103 | L871: 1|10
A872: 11042 | B872: 11 | C872: 0 | D872: 1 | E872: %s登陆即可领取 | F872: 20 | H872: 1 | I872: 0 | J872: 0 | K872: 10005|10112 | L872: 5|5
A873: 11043 | B873: 11 | C873: 0 | D873: 1 | E873: %s登陆即可领取 | F873: 21 | H873: 1 | I873: 0 | J873: 0 | K873: 10005|10112 | L873: 5|5
A874: 11044 | B874: 11 | C874: 0 | D874: 1 | E874: %s登陆即可领取 | F874: 22 | H874: 1 | I874: 0 | J874: 0 | K874: 10005|10112 | L874: 5|5
A875: 11045 | B875: 11 | C875: 0 | D875: 1 | E875: %s登陆即可领取 | F875: 23 | H875: 1 | I875: 0 | J875: 0 | K875: 10005|10112 | L875: 5|5
A876: 11046 | B876: 11 | C876: 0 | D876: 1 | E876: %s登陆即可领取 | F876: 24 | H876: 1 | I876: 0 | J876: 0 | K876: 10005|10112 | L876: 5|5
A877: 11047 | B877: 11 | C877: 0 | D877: 1 | E877: %s登陆即可领取 | F877: 25 | H877: 1 | I877: 0 | J877: 0 | K877: 10005|10112 | L877: 5|5
A878: 11048 | B878: 11 | C878: 0 | D878: 1 | E878: %s登陆即可领取 | F878: 26 | H878: 1 | I878: 0 | J878: 0 | K878: 10005|10112 | L878: 5|5
A879: 11049 | B879: 11 | C879: 0 | D879: 1 | E879: %s登陆即可领取 | F879: 5 | H879: 1 | I879: 0 | J879: 0 | K879: 10101|19030 | L879: 1|500
A880: 11050 | B880: 11 | C880: 0 | D880: 1 | E880: %s登陆即可领取 | F880: 6 | H880: 1 | I880: 0 | J880: 0 | K880: 10101|19030 | L880: 1|500
A881: 11051 | B881: 11 | C881: 0 | D881: 1 | E881: %s登陆即可领取 | F881: 7 | H881: 1 | I881: 0 | J881: 0 | K881: 10101|19030 | L881: 2|500
A882: 11052 | B882: 11 | C882: 0 | D882: 1 | E882: %s登陆即可领取 | F882: 8 | H882: 1 | I882: 0 | J882: 0 | K882: 10101|19030 | L882: 2|500
A883: 11053 | B883: 11 | C883: 0 | D883: 1 | E883: %s登陆即可领取 | F883: 9 | H883: 1 | I883: 0 | J883: 0 | K883: 10000|12532 | L883: 1|10
A884: 11054 | B884: 11 | C884: 0 | D884: 1 | E884: %s登陆即可领取 | F884: 10 | H884: 1 | I884: 0 | J884: 0 | K884: 10000|12532 | L884: 1|10
A885: 11055 | B885: 11 | C885: 0 | D885: 1 | E885: %s登陆即可领取 | F885: 11 | H885: 1 | I885: 0 | J885: 0 | K885: 10000|12532 | L885: 1|10
A886: 11056 | B886: 11 | C886: 0 | D886: 1 | E886: %s登陆即可领取 | F886: 12 | H886: 1 | I886: 0 | J886: 0 | K886: 10000|12532 | L886: 1|10
A887: 12000 | B887: =INT(RC[-1]/1000) -> 12 | C887: 1 | D887: 1 | E887: =IF(RC[5]=1,"(每日任务):","")&"通关"&RC[1]&"次跨服组队副本（%s/"&RC[1]&"）" -> (每日任务):通关3次跨服组队副本（%s/3） | F887: 3 | H887: 1 | I887: 0 | J887: 1 | K887: 10102 | L887: 1 | N887: 组队副本x=通关次数
A888: 12001 | B888: =INT(RC[-1]/1000) -> 12 | C888: 1 | D888: 1 | E888: =IF(RC[5]=1,"(每日任务):","")&"通关"&RC[1]&"次跨服组队副本（%s/"&RC[1]&"）" -> (每日任务):通关5次跨服组队副本（%s/5） | F888: 5 | H888: 1 | I888: 0 | J888: 1 | K888: 10102|19030 | L888: 1|100
A889: 12002 | B889: =INT(RC[-1]/1000) -> 12 | C889: 1 | D889: 1 | E889: =IF(RC[5]=1,"(每日任务):","")&"通关"&RC[1]&"次跨服组队副本（%s/"&RC[1]&"）" -> 通关3次跨服组队副本（%s/3） | F889: 3 | H889: 1 | I889: 0 | J889: 0 | K889: 10101|19030 | L889: 1|100
A890: 12003 | B890: =INT(RC[-1]/1000) -> 12 | C890: 1 | D890: 1 | E890: =IF(RC[5]=1,"(每日任务):","")&"通关"&RC[1]&"次跨服组队副本（%s/"&RC[1]&"）" -> 通关6次跨服组队副本（%s/6） | F890: 6 | H890: 1 | I890: 0 | J890: 0 | K890: 10101|19030 | L890: 1|200
A891: 12004 | B891: =INT(RC[-1]/1000) -> 12 | C891: 1 | D891: 1 | E891: =IF(RC[5]=1,"(每日任务):","")&"通关"&RC[1]&"次跨服组队副本（%s/"&RC[1]&"）" -> 通关10次跨服组队副本（%s/10） | F891: 10 | H891: 1 | I891: 0 | J891: 0 | K891: 10101|19030 | L891: 1|300
A892: 12005 | B892: =INT(RC[-1]/1000) -> 12 | C892: 1 | D892: 1 | E892: =IF(RC[5]=1,"(每日任务):","")&"通关"&RC[1]&"次跨服组队副本（%s/"&RC[1]&"）" -> 通关15次跨服组队副本（%s/15） | F892: 15 | H892: 1 | I892: 0 | J892: 0 | K892: 10101|19030 | L892: 1|400
A893: 12006 | B893: =INT(RC[-1]/1000) -> 12 | C893: 1 | D893: 1 | E893: =IF(RC[5]=1,"(每日任务):","")&"通关"&RC[1]&"次跨服组队副本（%s/"&RC[1]&"）" -> 通关25次跨服组队副本（%s/25） | F893: 25 | H893: 1 | I893: 0 | J893: 0 | K893: 10101|19030 | L893: 1|600
A894: 12007 | B894: =INT(RC[-1]/1000) -> 12 | C894: 1 | D894: 1 | E894: =IF(RC[5]=1,"(每日任务):","")&"通关"&RC[1]&"次跨服组队副本（%s/"&RC[1]&"）" -> 通关40次跨服组队副本（%s/40） | F894: 40 | H894: 1 | I894: 0 | J894: 0 | K894: 10101|19030 | L894: 1|1000
A895: 12008 | B895: =INT(RC[-1]/1000) -> 12 | C895: 1 | D895: 1 | E895: =IF(RC[5]=1,"(每日任务):","")&"通关"&RC[1]&"次跨服组队副本（%s/"&RC[1]&"）" -> (每日任务):通关1次跨服组队副本（%s/1） | F895: 1 | H895: 1 | I895: 0 | J895: 1 | K895: 10101 | L895: 1
A896: 12009 | B896: =INT(RC[-1]/1000) -> 12 | C896: 1 | D896: 1 | E896: =IF(RC[5]=1,"(每日任务):","")&"通关"&RC[1]&"次跨服组队副本（%s/"&RC[1]&"）" -> 通关2次跨服组队副本（%s/2） | F896: 2 | H896: 1 | I896: 0 | J896: 0 | K896: 80010|80000|10100 | L896: 1|1|1
A897: 12010 | B897: =INT(RC[-1]/1000) -> 12 | C897: 1 | D897: 1 | E897: =IF(RC[5]=1,"(每日任务):","")&"通关"&RC[1]&"次跨服组队副本（%s/"&RC[1]&"）" -> 通关4次跨服组队副本（%s/4） | F897: 4 | H897: 1 | I897: 0 | J897: 0 | K897: 80011|10100 | L897: 1|1
A898: 12011 | B898: =INT(RC[-1]/1000) -> 12 | C898: 1 | D898: 1 | E898: =IF(RC[5]=1,"(每日任务):","")&"通关"&RC[1]&"次跨服组队副本（%s/"&RC[1]&"）" -> 通关6次跨服组队副本（%s/6） | F898: 6 | H898: 1 | I898: 0 | J898: 0 | K898: 80001|10100 | L898: 1|1
A899: 12012 | B899: =INT(RC[-1]/1000) -> 12 | C899: 1 | D899: 1 | E899: =IF(RC[5]=1,"(每日任务):","")&"通关"&RC[1]&"次跨服组队副本（%s/"&RC[1]&"）" -> 通关9次跨服组队副本（%s/9） | F899: 9 | H899: 1 | I899: 0 | J899: 0 | K899: 13392 | L899: 1
A900: 12013 | B900: =INT(RC[-1]/1000) -> 12 | C900: 1 | D900: 1 | E900: =IF(RC[5]=1,"(每日任务):","")&"通关"&RC[1]&"次跨服组队副本（%s/"&RC[1]&"）" -> 通关12次跨服组队副本（%s/12） | F900: 12 | H900: 1 | I900: 0 | J900: 0 | K900: 13324 | L900: 1
A901: 12014 | B901: =INT(RC[-1]/1000) -> 12 | C901: 1 | D901: 1 | E901: =IF(RC[5]=1,"(每日任务):","")&"通关"&RC[1]&"次跨服组队副本（%s/"&RC[1]&"）" -> 通关15次跨服组队副本（%s/15） | F901: 15 | H901: 1 | I901: 0 | J901: 0 | K901: 80100 | L901: 1
A902: 12015 | B902: =INT(RC[-1]/1000) -> 12 | C902: 1 | D902: 1 | E902: =IF(RC[5]=1,"(每日任务):","")&"通关"&RC[1]&"次跨服组队副本（%s/"&RC[1]&"）" -> (每日任务):通关1次跨服组队副本（%s/1） | F902: 1 | H902: 1 | I902: 0 | J902: 1 | K902: 10089|10088 | L902: 1|5
A903: 13000 | B903: =INT(RC[-1]/1000) -> 13 | C903: 1 | D903: 1 | E903: =IF(RC[5]=1,"（每日任务）：",)&"累计通关精英副本"&RC[1]&"次（%s/"&RC[1]&"）" -> 累计通关精英副本20次（%s/20） | F903: 20 | H903: 1 | I903: 0 | J903: 0 | K903: 19017 | L903: 100 | N903: 通关精英副本
A904: 13001 | B904: =INT(RC[-1]/1000) -> 13 | C904: 1 | D904: 1 | E904: =IF(RC[5]=1,"（每日任务）：",)&"累计通关精英副本"&RC[1]&"次（%s/"&RC[1]&"）" -> 累计通关精英副本40次（%s/40） | F904: 40 | H904: 1 | I904: 0 | J904: 0 | K904: 19017 | L904: 100
A905: 13002 | B905: =INT(RC[-1]/1000) -> 13 | C905: 1 | D905: 1 | E905: =IF(RC[5]=1,"（每日任务）：",)&"累计通关精英副本"&RC[1]&"次（%s/"&RC[1]&"）" -> 累计通关精英副本80次（%s/80） | F905: 80 | H905: 1 | I905: 0 | J905: 0 | K905: 19017 | L905: 200
A906: 13003 | B906: =INT(RC[-1]/1000) -> 13 | C906: 1 | D906: 1 | E906: =IF(RC[5]=1,"（每日任务）：",)&"累计通关精英副本"&RC[1]&"次（%s/"&RC[1]&"）" -> 累计通关精英副本230次（%s/230） | F906: 230 | H906: 1 | I906: 0 | J906: 0 | K906: 19017 | L906: 200
A907: 13004 | B907: =INT(RC[-1]/1000) -> 13 | C907: 1 | D907: 1 | E907: =IF(RC[5]=1,"（每日任务）：",)&"累计通关精英副本"&RC[1]&"次（%s/"&RC[1]&"）" -> 累计通关精英副本160次（%s/160） | F907: 160 | H907: 1 | I907: 0 | J907: 0 | K907: 19017 | L907: 200
A908: 13005 | B908: =INT(RC[-1]/1000) -> 13 | C908: 1 | D908: 1 | E908: =IF(RC[5]=1,"（每日任务）：",)&"累计通关精英副本"&RC[1]&"次（%s/"&RC[1]&"）" -> 累计通关精英副本240次（%s/240） | F908: 240 | H908: 1 | I908: 0 | J908: 0 | K908: 19017 | L908: 500
A909: 13006 | B909: =INT(RC[-1]/1000) -> 13 | C909: 1 | D909: 1 | E909: =IF(RC[5]=1,"（每日任务）：",)&"累计通关精英副本"&RC[1]&"次（%s/"&RC[1]&"）" -> 累计通关精英副本320次（%s/320） | F909: 320 | H909: 1 | I909: 0 | J909: 0 | K909: 19017 | L909: 500
A910: 13007 | B910: =INT(RC[-1]/1000) -> 13 | C910: 1 | D910: 1 | E910: =IF(RC[5]=1,"（每日任务）：",)&"累计通关精英副本"&RC[1]&"次（%s/"&RC[1]&"）" -> 累计通关精英副本400次（%s/400） | F910: 400 | H910: 1 | I910: 0 | J910: 0 | K910: 19017 | L910: 500
A911: 13008 | B911: =INT(RC[-1]/1000) -> 13 | C911: 1 | D911: 1 | E911: =IF(RC[5]=1,"（每日任务）：",)&"累计通关精英副本"&RC[1]&"次（%s/"&RC[1]&"）" -> （每日任务）：累计通关精英副本3次（%s/3） | F911: 3 | H911: 1 | I911: 0 | J911: 1 | K911: 10078|10077 | L911: 1|5
A912: 13009 | B912: =INT(RC[-1]/1000) -> 13 | C912: 1 | D912: 1 | E912: =IF(RC[5]=1,"（每日任务）：",)&"累计通关精英副本"&RC[1]&"次（%s/"&RC[1]&"）" -> 累计通关精英副本20次（%s/20） | F912: 20 | H912: 1 | I912: 0 | J912: 0 | K912: 10078|10077 | L912: 1|5
A913: 13010 | B913: =INT(RC[-1]/1000) -> 13 | C913: 1 | D913: 1 | E913: =IF(RC[5]=1,"（每日任务）：",)&"累计通关精英副本"&RC[1]&"次（%s/"&RC[1]&"）" -> 累计通关精英副本40次（%s/40） | F913: 40 | H913: 1 | I913: 0 | J913: 0 | K913: 10078|10077 | L913: 2|5
A914: 13011 | B914: =INT(RC[-1]/1000) -> 13 | C914: 1 | D914: 1 | E914: =IF(RC[5]=1,"（每日任务）：",)&"累计通关精英副本"&RC[1]&"次（%s/"&RC[1]&"）" -> 累计通关精英副本80次（%s/80） | F914: 80 | H914: 1 | I914: 0 | J914: 0 | K914: 10078|10077 | L914: 3|10
A915: 13012 | B915: =INT(RC[-1]/1000) -> 13 | C915: 1 | D915: 1 | E915: =IF(RC[5]=1,"（每日任务）：",)&"累计通关精英副本"&RC[1]&"次（%s/"&RC[1]&"）" -> 累计通关精英副本120次（%s/120） | F915: 120 | H915: 1 | I915: 0 | J915: 0 | K915: 10078|10077 | L915: 4|10
A916: 13013 | B916: =INT(RC[-1]/1000) -> 13 | C916: 1 | D916: 1 | E916: =IF(RC[5]=1,"（每日任务）：",)&"累计通关精英副本"&RC[1]&"次（%s/"&RC[1]&"）" -> 累计通关精英副本160次（%s/160） | F916: 160 | H916: 1 | I916: 0 | J916: 0 | K916: 10078|10077 | L916: 5|10
A917: 13014 | B917: =INT(RC[-1]/1000) -> 13 | C917: 1 | D917: 1 | E917: =IF(RC[5]=1,"（每日任务）：",)&"累计通关精英副本"&RC[1]&"次（%s/"&RC[1]&"）" -> 累计通关精英副本240次（%s/240） | F917: 240 | H917: 1 | I917: 0 | J917: 0 | K917: 10078|10077 | L917: 6|20
A918: 13015 | B918: =INT(RC[-1]/1000) -> 13 | C918: 1 | D918: 1 | E918: =IF(RC[5]=1,"（每日任务）：",)&"累计通关精英副本"&RC[1]&"次（%s/"&RC[1]&"）" -> 累计通关精英副本320次（%s/320） | F918: 320 | H918: 1 | I918: 0 | J918: 0 | K918: 10078|10077 | L918: 7|20
A919: 13016 | B919: =INT(RC[-1]/1000) -> 13 | C919: 1 | D919: 1 | E919: =IF(RC[5]=1,"（每日任务）：",)&"累计通关精英副本"&RC[1]&"次（%s/"&RC[1]&"）" -> 累计通关精英副本400次（%s/400） | F919: 400 | H919: 1 | I919: 0 | J919: 0 | K919: 10078|10077 | L919: 8|20
A920: 13017 | B920: =INT(RC[-1]/1000) -> 13 | C920: 1 | D920: 1 | E920: =IF(RC[5]=1,"（每日任务）：",)&"累计通关精英副本"&RC[1]&"次（%s/"&RC[1]&"）" -> （每日任务）：累计通关精英副本5次（%s/5） | F920: 5 | H920: 1 | I920: 0 | J920: 1 | K920: 10000|13401 | L920: 1|5
A921: 13018 | B921: =INT(RC[-1]/1000) -> 13 | C921: 1 | D921: 1 | E921: =IF(RC[5]=1,"（每日任务）：",)&"累计通关精英副本"&RC[1]&"次（%s/"&RC[1]&"）" -> 累计通关精英副本10次（%s/10） | F921: 10 | H921: 1 | I921: 0 | J921: 0 | K921: 19017 | L921: 100
A922: 13019 | B922: =INT(RC[-1]/1000) -> 13 | C922: 1 | D922: 1 | E922: =IF(RC[5]=1,"（每日任务）：",)&"累计通关精英副本"&RC[1]&"次（%s/"&RC[1]&"）" -> 累计通关精英副本20次（%s/20） | F922: 20 | H922: 1 | I922: 0 | J922: 0 | K922: 19017 | L922: 100
A923: 13020 | B923: =INT(RC[-1]/1000) -> 13 | C923: 1 | D923: 1 | E923: =IF(RC[5]=1,"（每日任务）：",)&"累计通关精英副本"&RC[1]&"次（%s/"&RC[1]&"）" -> 累计通关精英副本30次（%s/30） | F923: 30 | H923: 1 | I923: 0 | J923: 0 | K923: 19017 | L923: 150
A924: 13021 | B924: =INT(RC[-1]/1000) -> 13 | C924: 1 | D924: 1 | E924: =IF(RC[5]=1,"（每日任务）：",)&"累计通关精英副本"&RC[1]&"次（%s/"&RC[1]&"）" -> 累计通关精英副本40次（%s/40） | F924: 40 | H924: 1 | I924: 0 | J924: 0 | K924: 19017 | L924: 150
A925: 13022 | B925: =INT(RC[-1]/1000) -> 13 | C925: 1 | D925: 1 | E925: =IF(RC[5]=1,"（每日任务）：",)&"累计通关精英副本"&RC[1]&"次（%s/"&RC[1]&"）" -> 累计通关精英副本60次（%s/60） | F925: 60 | H925: 1 | I925: 0 | J925: 0 | K925: 19017 | L925: 200
A926: 13023 | B926: =INT(RC[-1]/1000) -> 13 | C926: 1 | D926: 1 | E926: =IF(RC[5]=1,"（每日任务）：",)&"累计通关精英副本"&RC[1]&"次（%s/"&RC[1]&"）" -> 累计通关精英副本80次（%s/80） | F926: 80 | H926: 1 | I926: 0 | J926: 0 | K926: 19017 | L926: 200
A927: 13024 | B927: =INT(RC[-1]/1000) -> 13 | C927: 1 | D927: 1 | E927: =IF(RC[5]=1,"（每日任务）：",)&"累计通关精英副本"&RC[1]&"次（%s/"&RC[1]&"）" -> 累计通关精英副本100次（%s/100） | F927: 100 | H927: 1 | I927: 0 | J927: 0 | K927: 19017|13401 | L927: 300|10
A928: 13025 | B928: =INT(RC[-1]/1000) -> 13 | C928: 1 | D928: 1 | E928: =IF(RC[5]=1,"（每日任务）：",)&"累计通关精英副本"&RC[1]&"次（%s/"&RC[1]&"）" -> 累计通关精英副本150次（%s/150） | F928: 150 | H928: 1 | I928: 0 | J928: 0 | K928: 19017 | L928: 400
A929: 13026 | B929: =INT(RC[-1]/1000) -> 13 | C929: 1 | D929: 1 | E929: =IF(RC[5]=1,"（每日任务）：",)&"累计通关精英副本"&RC[1]&"次（%s/"&RC[1]&"）" -> 累计通关精英副本200次（%s/200） | F929: 200 | H929: 1 | I929: 0 | J929: 0 | K929: 19017|13401 | L929: 500|10
A930: 13027 | B930: =INT(RC[-1]/1000) -> 13 | C930: 1 | D930: 1 | E930: =IF(RC[5]=1,"（每日任务）：",)&"累计通关精英副本"&RC[1]&"次（%s/"&RC[1]&"）" -> 累计通关精英副本250次（%s/250） | F930: 250 | H930: 1 | I930: 0 | J930: 0 | K930: 19017 | L930: 600
A931: 13028 | B931: =INT(RC[-1]/1000) -> 13 | C931: 1 | D931: 1 | E931: =IF(RC[5]=1,"（每日任务）：",)&"累计通关精英副本"&RC[1]&"次（%s/"&RC[1]&"）" -> 累计通关精英副本300次（%s/300） | F931: 300 | H931: 1 | I931: 0 | J931: 0 | K931: 19017|13401 | L931: 800|10
A932: 13029 | B932: =INT(RC[-1]/1000) -> 13 | C932: 1 | D932: 1 | E932: =IF(RC[5]=1,"（每日任务）：",)&"累计通关精英副本"&RC[1]&"次（%s/"&RC[1]&"）" -> （每日任务）：累计通关精英副本5次（%s/5） | F932: 5 | H932: 1 | I932: 0 | J932: 1 | K932: 19017 | L932: 200
A933: 13030 | B933: =INT(RC[-1]/1000) -> 13 | C933: 1 | D933: 1 | E933: =IF(RC[5]=1,"（每日任务）：",)&"累计通关精英副本"&RC[1]&"次（%s/"&RC[1]&"）" -> 累计通关精英副本20次（%s/20） | F933: 20 | H933: 1 | I933: 0 | J933: 0 | K933: 19017 | L933: 200
A934: 13031 | B934: =INT(RC[-1]/1000) -> 13 | C934: 1 | D934: 1 | E934: =IF(RC[5]=1,"（每日任务）：",)&"累计通关精英副本"&RC[1]&"次（%s/"&RC[1]&"）" -> 累计通关精英副本40次（%s/40） | F934: 40 | H934: 1 | I934: 0 | J934: 0 | K934: 13598|10022 | L934: 5|20
A935: 13032 | B935: =INT(RC[-1]/1000) -> 13 | C935: 1 | D935: 1 | E935: =IF(RC[5]=1,"（每日任务）：",)&"累计通关精英副本"&RC[1]&"次（%s/"&RC[1]&"）" -> 累计通关精英副本60次（%s/60） | F935: 60 | H935: 1 | I935: 0 | J935: 0 | K935: 19017 | L935: 300
A936: 13033 | B936: =INT(RC[-1]/1000) -> 13 | C936: 1 | D936: 1 | E936: =IF(RC[5]=1,"（每日任务）：",)&"累计通关精英副本"&RC[1]&"次（%s/"&RC[1]&"）" -> 累计通关精英副本80次（%s/80） | F936: 80 | H936: 1 | I936: 0 | J936: 0 | K936: 19017 | L936: 400
A937: 13034 | B937: =INT(RC[-1]/1000) -> 13 | C937: 1 | D937: 1 | E937: =IF(RC[5]=1,"（每日任务）：",)&"累计通关精英副本"&RC[1]&"次（%s/"&RC[1]&"）" -> 累计通关精英副本120次（%s/120） | F937: 120 | H937: 1 | I937: 0 | J937: 0 | K937: 13598|10022 | L937: 5|20
A938: 13035 | B938: =INT(RC[-1]/1000) -> 13 | C938: 1 | D938: 1 | E938: =IF(RC[5]=1,"（每日任务）：",)&"累计通关精英副本"&RC[1]&"次（%s/"&RC[1]&"）" -> 累计通关精英副本160次（%s/160） | F938: 160 | H938: 1 | I938: 0 | J938: 0 | K938: 19017 | L938: 500
A939: 13036 | B939: =INT(RC[-1]/1000) -> 13 | C939: 1 | D939: 1 | E939: =IF(RC[5]=1,"（每日任务）：",)&"累计通关精英副本"&RC[1]&"次（%s/"&RC[1]&"）" -> 累计通关精英副本200次（%s/200） | F939: 200 | H939: 1 | I939: 0 | J939: 0 | K939: 13598|10022 | L939: 10|40
A940: 13037 | B940: =INT(RC[-1]/1000) -> 13 | C940: 1 | D940: 1 | E940: =IF(RC[5]=1,"（每日任务）：",)&"累计通关精英副本"&RC[1]&"次（%s/"&RC[1]&"）" -> （每日任务）：累计通关精英副本5次（%s/5） | F940: 5 | H940: 1 | I940: 0 | J940: 1 | K940: 10000 | L940: 1
A941: 13038 | B941: =INT(RC[-1]/1000) -> 13 | C941: 1 | D941: 1 | E941: =IF(RC[5]=1,"（每日任务）：",)&"累计通关精英副本"&RC[1]&"次（%s/"&RC[1]&"）" -> 累计通关精英副本20次（%s/20） | F941: 20 | H941: 1 | I941: 0 | J941: 0 | K941: 19017 | L941: 200
A942: 13039 | B942: =INT(RC[-1]/1000) -> 13 | C942: 1 | D942: 1 | E942: =IF(RC[5]=1,"（每日任务）：",)&"累计通关精英副本"&RC[1]&"次（%s/"&RC[1]&"）" -> 累计通关精英副本40次（%s/40） | F942: 40 | H942: 1 | I942: 0 | J942: 0 | K942: 13599|10022 | L942: 5|25
A943: 13040 | B943: =INT(RC[-1]/1000) -> 13 | C943: 1 | D943: 1 | E943: =IF(RC[5]=1,"（每日任务）：",)&"累计通关精英副本"&RC[1]&"次（%s/"&RC[1]&"）" -> 累计通关精英副本60次（%s/60） | F943: 60 | H943: 1 | I943: 0 | J943: 0 | K943: 19017 | L943: 300
A944: 13041 | B944: =INT(RC[-1]/1000) -> 13 | C944: 1 | D944: 1 | E944: =IF(RC[5]=1,"（每日任务）：",)&"累计通关精英副本"&RC[1]&"次（%s/"&RC[1]&"）" -> 累计通关精英副本80次（%s/80） | F944: 80 | H944: 1 | I944: 0 | J944: 0 | K944: 19017 | L944: 400
A945: 13042 | B945: =INT(RC[-1]/1000) -> 13 | C945: 1 | D945: 1 | E945: =IF(RC[5]=1,"（每日任务）：",)&"累计通关精英副本"&RC[1]&"次（%s/"&RC[1]&"）" -> 累计通关精英副本120次（%s/120） | F945: 120 | H945: 1 | I945: 0 | J945: 0 | K945: 13599|10022 | L945: 5|25
A946: 13043 | B946: =INT(RC[-1]/1000) -> 13 | C946: 1 | D946: 1 | E946: =IF(RC[5]=1,"（每日任务）：",)&"累计通关精英副本"&RC[1]&"次（%s/"&RC[1]&"）" -> 累计通关精英副本160次（%s/160） | F946: 160 | H946: 1 | I946: 0 | J946: 0 | K946: 19017 | L946: 500
A947: 13044 | B947: =INT(RC[-1]/1000) -> 13 | C947: 1 | D947: 1 | E947: =IF(RC[5]=1,"（每日任务）：",)&"累计通关精英副本"&RC[1]&"次（%s/"&RC[1]&"）" -> 累计通关精英副本200次（%s/200） | F947: 200 | H947: 1 | I947: 0 | J947: 0 | K947: 13599|10022 | L947: 10|50
A948: 13045 | B948: =INT(RC[-1]/1000) -> 13 | C948: 1 | D948: 1 | E948: =IF(RC[5]=1,"（每日任务）：",)&"累计通关精英副本"&RC[1]&"次（%s/"&RC[1]&"）" -> （每日任务）：累计通关精英副本3次（%s/3） | F948: 3 | H948: 1 | I948: 0 | J948: 1 | K948: 10074|10073 | L948: 1|5
A949: 13046 | B949: =INT(RC[-1]/1000) -> 13 | C949: 1 | D949: 1 | E949: =IF(RC[5]=1,"（每日任务）：",)&"累计通关精英副本"&RC[1]&"次（%s/"&RC[1]&"）" -> 累计通关精英副本20次（%s/20） | F949: 20 | H949: 1 | I949: 0 | J949: 0 | K949: 10074|10073 | L949: 1|5
A950: 13047 | B950: =INT(RC[-1]/1000) -> 13 | C950: 1 | D950: 1 | E950: =IF(RC[5]=1,"（每日任务）：",)&"累计通关精英副本"&RC[1]&"次（%s/"&RC[1]&"）" -> 累计通关精英副本40次（%s/40） | F950: 40 | H950: 1 | I950: 0 | J950: 0 | K950: 10074|10073 | L950: 2|5
A951: 13048 | B951: =INT(RC[-1]/1000) -> 13 | C951: 1 | D951: 1 | E951: =IF(RC[5]=1,"（每日任务）：",)&"累计通关精英副本"&RC[1]&"次（%s/"&RC[1]&"）" -> 累计通关精英副本80次（%s/80） | F951: 80 | H951: 1 | I951: 0 | J951: 0 | K951: 10074|10073 | L951: 3|10
A952: 13049 | B952: =INT(RC[-1]/1000) -> 13 | C952: 1 | D952: 1 | E952: =IF(RC[5]=1,"（每日任务）：",)&"累计通关精英副本"&RC[1]&"次（%s/"&RC[1]&"）" -> 累计通关精英副本120次（%s/120） | F952: 120 | H952: 1 | I952: 0 | J952: 0 | K952: 10074|10073 | L952: 4|10
A953: 13050 | B953: =INT(RC[-1]/1000) -> 13 | C953: 1 | D953: 1 | E953: =IF(RC[5]=1,"（每日任务）：",)&"累计通关精英副本"&RC[1]&"次（%s/"&RC[1]&"）" -> 累计通关精英副本160次（%s/160） | F953: 160 | H953: 1 | I953: 0 | J953: 0 | K953: 10074|10073 | L953: 5|10
A954: 13051 | B954: =INT(RC[-1]/1000) -> 13 | C954: 1 | D954: 1 | E954: =IF(RC[5]=1,"（每日任务）：",)&"累计通关精英副本"&RC[1]&"次（%s/"&RC[1]&"）" -> 累计通关精英副本240次（%s/240） | F954: 240 | H954: 1 | I954: 0 | J954: 0 | K954: 10074|10073 | L954: 6|20
A955: 13052 | B955: =INT(RC[-1]/1000) -> 13 | C955: 1 | D955: 1 | E955: =IF(RC[5]=1,"（每日任务）：",)&"累计通关精英副本"&RC[1]&"次（%s/"&RC[1]&"）" -> 累计通关精英副本320次（%s/320） | F955: 320 | H955: 1 | I955: 0 | J955: 0 | K955: 10074|10073 | L955: 7|20
A956: 13053 | B956: =INT(RC[-1]/1000) -> 13 | C956: 1 | D956: 1 | E956: =IF(RC[5]=1,"（每日任务）：",)&"累计通关精英副本"&RC[1]&"次（%s/"&RC[1]&"）" -> 累计通关精英副本400次（%s/400） | F956: 400 | H956: 1 | I956: 0 | J956: 0 | K956: 10074|10073 | L956: 8|20
A957: 13054 | B957: =INT(RC[-1]/1000) -> 13 | C957: 1 | D957: 1 | E957: =IF(RC[5]=1,"（每日任务）：",)&"累计通关精英副本"&RC[1]&"次（%s/"&RC[1]&"）" -> （每日任务）：累计通关精英副本5次（%s/5） | F957: 5 | H957: 1 | I957: 0 | J957: 1 | K957: 19017 | L957: 200
A958: 13055 | B958: =INT(RC[-1]/1000) -> 13 | C958: 1 | D958: 1 | E958: =IF(RC[5]=1,"（每日任务）：",)&"累计通关精英副本"&RC[1]&"次（%s/"&RC[1]&"）" -> 累计通关精英副本20次（%s/20） | F958: 20 | H958: 1 | I958: 0 | J958: 0 | K958: 19017 | L958: 200
A959: 13056 | B959: =INT(RC[-1]/1000) -> 13 | C959: 1 | D959: 1 | E959: =IF(RC[5]=1,"（每日任务）：",)&"累计通关精英副本"&RC[1]&"次（%s/"&RC[1]&"）" -> 累计通关精英副本40次（%s/40） | F959: 40 | H959: 1 | I959: 0 | J959: 0 | K959: 10116|10022 | L959: 5|20
A960: 13057 | B960: =INT(RC[-1]/1000) -> 13 | C960: 1 | D960: 1 | E960: =IF(RC[5]=1,"（每日任务）：",)&"累计通关精英副本"&RC[1]&"次（%s/"&RC[1]&"）" -> 累计通关精英副本60次（%s/60） | F960: 60 | H960: 1 | I960: 0 | J960: 0 | K960: 19017 | L960: 300
A961: 13058 | B961: =INT(RC[-1]/1000) -> 13 | C961: 1 | D961: 1 | E961: =IF(RC[5]=1,"（每日任务）：",)&"累计通关精英副本"&RC[1]&"次（%s/"&RC[1]&"）" -> 累计通关精英副本80次（%s/80） | F961: 80 | H961: 1 | I961: 0 | J961: 0 | K961: 19017 | L961: 400
A962: 13059 | B962: =INT(RC[-1]/1000) -> 13 | C962: 1 | D962: 1 | E962: =IF(RC[5]=1,"（每日任务）：",)&"累计通关精英副本"&RC[1]&"次（%s/"&RC[1]&"）" -> 累计通关精英副本120次（%s/120） | F962: 120 | H962: 1 | I962: 0 | J962: 0 | K962: 10116|10022 | L962: 5|20
A963: 13060 | B963: =INT(RC[-1]/1000) -> 13 | C963: 1 | D963: 1 | E963: =IF(RC[5]=1,"（每日任务）：",)&"累计通关精英副本"&RC[1]&"次（%s/"&RC[1]&"）" -> 累计通关精英副本160次（%s/160） | F963: 160 | H963: 1 | I963: 0 | J963: 0 | K963: 19017 | L963: 500
A964: 13061 | B964: =INT(RC[-1]/1000) -> 13 | C964: 1 | D964: 1 | E964: =IF(RC[5]=1,"（每日任务）：",)&"累计通关精英副本"&RC[1]&"次（%s/"&RC[1]&"）" -> 累计通关精英副本200次（%s/200） | F964: 200 | H964: 1 | I964: 0 | J964: 0 | K964: 10116|10022 | L964: 10|40
A965: 13062 | B965: =INT(RC[-1]/1000) -> 13 | C965: 1 | D965: 1 | E965: =IF(RC[5]=1,"（每日任务）：",)&"累计通关精英副本"&RC[1]&"次（%s/"&RC[1]&"）" -> （每日任务）：累计通关精英副本5次（%s/5） | F965: 5 | H965: 1 | I965: 0 | J965: 1 | K965: 10000|12532 | L965: 1|5
A966: 13063 | B966: =INT(RC[-1]/1000) -> 13 | C966: 1 | D966: 1 | E966: =IF(RC[5]=1,"（每日任务）：",)&"累计通关精英副本"&RC[1]&"次（%s/"&RC[1]&"）" -> 累计通关精英副本10次（%s/10） | F966: 10 | H966: 1 | I966: 0 | J966: 0 | K966: 19017 | L966: 100
A967: 13064 | B967: =INT(RC[-1]/1000) -> 13 | C967: 1 | D967: 1 | E967: =IF(RC[5]=1,"（每日任务）：",)&"累计通关精英副本"&RC[1]&"次（%s/"&RC[1]&"）" -> 累计通关精英副本20次（%s/20） | F967: 20 | H967: 1 | I967: 0 | J967: 0 | K967: 19017 | L967: 100
A968: 13065 | B968: =INT(RC[-1]/1000) -> 13 | C968: 1 | D968: 1 | E968: =IF(RC[5]=1,"（每日任务）：",)&"累计通关精英副本"&RC[1]&"次（%s/"&RC[1]&"）" -> 累计通关精英副本30次（%s/30） | F968: 30 | H968: 1 | I968: 0 | J968: 0 | K968: 19017 | L968: 150
A969: 13066 | B969: =INT(RC[-1]/1000) -> 13 | C969: 1 | D969: 1 | E969: =IF(RC[5]=1,"（每日任务）：",)&"累计通关精英副本"&RC[1]&"次（%s/"&RC[1]&"）" -> 累计通关精英副本40次（%s/40） | F969: 40 | H969: 1 | I969: 0 | J969: 0 | K969: 19017 | L969: 150
A970: 13067 | B970: =INT(RC[-1]/1000) -> 13 | C970: 1 | D970: 1 | E970: =IF(RC[5]=1,"（每日任务）：",)&"累计通关精英副本"&RC[1]&"次（%s/"&RC[1]&"）" -> 累计通关精英副本60次（%s/60） | F970: 60 | H970: 1 | I970: 0 | J970: 0 | K970: 19017 | L970: 200
A971: 13068 | B971: =INT(RC[-1]/1000) -> 13 | C971: 1 | D971: 1 | E971: =IF(RC[5]=1,"（每日任务）：",)&"累计通关精英副本"&RC[1]&"次（%s/"&RC[1]&"）" -> 累计通关精英副本80次（%s/80） | F971: 80 | H971: 1 | I971: 0 | J971: 0 | K971: 19017 | L971: 200
A972: 13069 | B972: =INT(RC[-1]/1000) -> 13 | C972: 1 | D972: 1 | E972: =IF(RC[5]=1,"（每日任务）：",)&"累计通关精英副本"&RC[1]&"次（%s/"&RC[1]&"）" -> 累计通关精英副本100次（%s/100） | F972: 100 | H972: 1 | I972: 0 | J972: 0 | K972: 19017|12532 | L972: 300|10
A973: 13070 | B973: =INT(RC[-1]/1000) -> 13 | C973: 1 | D973: 1 | E973: =IF(RC[5]=1,"（每日任务）：",)&"累计通关精英副本"&RC[1]&"次（%s/"&RC[1]&"）" -> 累计通关精英副本150次（%s/150） | F973: 150 | H973: 1 | I973: 0 | J973: 0 | K973: 19017 | L973: 400
A974: 13071 | B974: =INT(RC[-1]/1000) -> 13 | C974: 1 | D974: 1 | E974: =IF(RC[5]=1,"（每日任务）：",)&"累计通关精英副本"&RC[1]&"次（%s/"&RC[1]&"）" -> 累计通关精英副本200次（%s/200） | F974: 200 | H974: 1 | I974: 0 | J974: 0 | K974: 19017|12532 | L974: 500|10
A975: 13072 | B975: =INT(RC[-1]/1000) -> 13 | C975: 1 | D975: 1 | E975: =IF(RC[5]=1,"（每日任务）：",)&"累计通关精英副本"&RC[1]&"次（%s/"&RC[1]&"）" -> 累计通关精英副本250次（%s/250） | F975: 250 | H975: 1 | I975: 0 | J975: 0 | K975: 19017 | L975: 600
A976: 13073 | B976: =INT(RC[-1]/1000) -> 13 | C976: 1 | D976: 1 | E976: =IF(RC[5]=1,"（每日任务）：",)&"累计通关精英副本"&RC[1]&"次（%s/"&RC[1]&"）" -> 累计通关精英副本300次（%s/300） | F976: 300 | H976: 1 | I976: 0 | J976: 0 | K976: 19017|12532 | L976: 800|10
A977: 13074 | B977: =INT(RC[-1]/1000) -> 13 | C977: 1 | D977: 1 | E977: =IF(RC[5]=1,"（每日任务）：",)&"累计通关精英副本"&RC[1]&"次（%s/"&RC[1]&"）" -> （每日任务）：累计通关精英副本5次（%s/5） | F977: 5 | H977: 1 | I977: 0 | J977: 1 | K977: 13599 | L977: 1
A978: 13075 | B978: =INT(RC[-1]/1000) -> 13 | C978: 1 | D978: 1 | E978: =IF(RC[5]=1,"（每日任务）：",)&"累计通关精英副本"&RC[1]&"次（%s/"&RC[1]&"）" -> 累计通关精英副本30次（%s/30） | F978: 30 | H978: 1 | I978: 0 | J978: 0 | K978: 10008 | L978: 40
A979: 13076 | B979: =INT(RC[-1]/1000) -> 13 | C979: 1 | D979: 1 | E979: =IF(RC[5]=1,"（每日任务）：",)&"累计通关精英副本"&RC[1]&"次（%s/"&RC[1]&"）" -> 累计通关精英副本60次（%s/60） | F979: 60 | H979: 1 | I979: 0 | J979: 0 | K979: 13599 | L979: 5
A980: 13077 | B980: =INT(RC[-1]/1000) -> 13 | C980: 1 | D980: 1 | E980: =IF(RC[5]=1,"（每日任务）：",)&"累计通关精英副本"&RC[1]&"次（%s/"&RC[1]&"）" -> 累计通关精英副本90次（%s/90） | F980: 90 | H980: 1 | I980: 0 | J980: 0 | K980: 10008 | L980: 40
A981: 13078 | B981: =INT(RC[-1]/1000) -> 13 | C981: 1 | D981: 1 | E981: =IF(RC[5]=1,"（每日任务）：",)&"累计通关精英副本"&RC[1]&"次（%s/"&RC[1]&"）" -> 累计通关精英副本120次（%s/120） | F981: 120 | H981: 1 | I981: 0 | J981: 0 | K981: 10008 | L981: 100
A982: 13079 | B982: =INT(RC[-1]/1000) -> 13 | C982: 1 | D982: 1 | E982: =IF(RC[5]=1,"（每日任务）：",)&"累计通关精英副本"&RC[1]&"次（%s/"&RC[1]&"）" -> 累计通关精英副本150次（%s/150） | F982: 150 | H982: 1 | I982: 0 | J982: 0 | K982: 13599 | L982: 5
A983: 13080 | B983: =INT(RC[-1]/1000) -> 13 | C983: 1 | D983: 1 | E983: =IF(RC[5]=1,"（每日任务）：",)&"累计通关精英副本"&RC[1]&"次（%s/"&RC[1]&"）" -> （每日任务）：累计通关精英副本3次（%s/3） | F983: 3 | H983: 1 | I983: 0 | J983: 1 | K983: 10089|10088 | L983: 1|5
A984: 13081 | B984: =INT(RC[-1]/1000) -> 13 | C984: 1 | D984: 1 | E984: =IF(RC[5]=1,"（每日任务）：",)&"累计通关精英副本"&RC[1]&"次（%s/"&RC[1]&"）" -> 累计通关精英副本20次（%s/20） | F984: 20 | H984: 1 | I984: 0 | J984: 0 | K984: 10089|10088 | L984: 1|5
A985: 13082 | B985: =INT(RC[-1]/1000) -> 13 | C985: 1 | D985: 1 | E985: =IF(RC[5]=1,"（每日任务）：",)&"累计通关精英副本"&RC[1]&"次（%s/"&RC[1]&"）" -> 累计通关精英副本40次（%s/40） | F985: 40 | H985: 1 | I985: 0 | J985: 0 | K985: 10089|10088 | L985: 2|5
A986: 13083 | B986: =INT(RC[-1]/1000) -> 13 | C986: 1 | D986: 1 | E986: =IF(RC[5]=1,"（每日任务）：",)&"累计通关精英副本"&RC[1]&"次（%s/"&RC[1]&"）" -> 累计通关精英副本80次（%s/80） | F986: 80 | H986: 1 | I986: 0 | J986: 0 | K986: 10089|10088 | L986: 3|10
A987: 13084 | B987: =INT(RC[-1]/1000) -> 13 | C987: 1 | D987: 1 | E987: =IF(RC[5]=1,"（每日任务）：",)&"累计通关精英副本"&RC[1]&"次（%s/"&RC[1]&"）" -> 累计通关精英副本120次（%s/120） | F987: 120 | H987: 1 | I987: 0 | J987: 0 | K987: 10089|10088 | L987: 4|10
A988: 13085 | B988: =INT(RC[-1]/1000) -> 13 | C988: 1 | D988: 1 | E988: =IF(RC[5]=1,"（每日任务）：",)&"累计通关精英副本"&RC[1]&"次（%s/"&RC[1]&"）" -> 累计通关精英副本160次（%s/160） | F988: 160 | H988: 1 | I988: 0 | J988: 0 | K988: 10089|10088 | L988: 5|10
A989: 13086 | B989: =INT(RC[-1]/1000) -> 13 | C989: 1 | D989: 1 | E989: =IF(RC[5]=1,"（每日任务）：",)&"累计通关精英副本"&RC[1]&"次（%s/"&RC[1]&"）" -> 累计通关精英副本240次（%s/240） | F989: 240 | H989: 1 | I989: 0 | J989: 0 | K989: 10089|10088 | L989: 6|20
A990: 13087 | B990: =INT(RC[-1]/1000) -> 13 | C990: 1 | D990: 1 | E990: =IF(RC[5]=1,"（每日任务）：",)&"累计通关精英副本"&RC[1]&"次（%s/"&RC[1]&"）" -> 累计通关精英副本320次（%s/320） | F990: 320 | H990: 1 | I990: 0 | J990: 0 | K990: 10089|10088 | L990: 7|20
A991: 13088 | B991: =INT(RC[-1]/1000) -> 13 | C991: 1 | D991: 1 | E991: =IF(RC[5]=1,"（每日任务）：",)&"累计通关精英副本"&RC[1]&"次（%s/"&RC[1]&"）" -> 累计通关精英副本400次（%s/400） | F991: 400 | H991: 1 | I991: 0 | J991: 0 | K991: 10089|10088 | L991: 8|20
A992: 14000 | B992: =INT(RC[-1]/1000) -> 14 | C992: 1 | D992: 1 | E992: =IF(RC[5]=1,"（每日任务）:",)&"累计战胜勇者试炼精英关卡"&RC[1]&"次（%s/"&RC[1]&"）" -> （每日任务）:累计战胜勇者试炼精英关卡1次（%s/1） | F992: 1 | H992: 1 | I992: 0 | J992: 1 | K992: 19103 | L992: 5 | N992: 战胜勇者试炼精英关卡
A993: 14001 | B993: =INT(RC[-1]/1000) -> 14 | C993: 1 | D993: 1 | E993: =IF(RC[5]=1,"（每日任务）:",)&"累计战胜勇者试炼精英关卡"&RC[1]&"次（%s/"&RC[1]&"）" -> 累计战胜勇者试炼精英关卡2次（%s/2） | F993: 2 | H993: 1 | I993: 0 | J993: 0 | K993: 19103 | L993: 20
A994: 14002 | B994: =INT(RC[-1]/1000) -> 14 | C994: 1 | D994: 1 | E994: =IF(RC[5]=1,"（每日任务）:",)&"累计战胜勇者试炼精英关卡"&RC[1]&"次（%s/"&RC[1]&"）" -> 累计战胜勇者试炼精英关卡4次（%s/4） | F994: 4 | H994: 1 | I994: 0 | J994: 0 | K994: 19103 | L994: 20
A995: 14003 | B995: =INT(RC[-1]/1000) -> 14 | C995: 1 | D995: 1 | E995: =IF(RC[5]=1,"（每日任务）:",)&"累计战胜勇者试炼精英关卡"&RC[1]&"次（%s/"&RC[1]&"）" -> 累计战胜勇者试炼精英关卡6次（%s/6） | F995: 6 | H995: 1 | I995: 0 | J995: 0 | K995: 19103 | L995: 20
A996: 14004 | B996: =INT(RC[-1]/1000) -> 14 | C996: 1 | D996: 1 | E996: =IF(RC[5]=1,"（每日任务）:",)&"累计战胜勇者试炼精英关卡"&RC[1]&"次（%s/"&RC[1]&"）" -> 累计战胜勇者试炼精英关卡8次（%s/8） | F996: 8 | H996: 1 | I996: 0 | J996: 0 | K996: 19103 | L996: 20
A997: 14005 | B997: =INT(RC[-1]/1000) -> 14 | C997: 1 | D997: 1 | E997: =IF(RC[5]=1,"（每日任务）:",)&"累计战胜勇者试炼精英关卡"&RC[1]&"次（%s/"&RC[1]&"）" -> 累计战胜勇者试炼精英关卡12次（%s/12） | F997: 12 | H997: 1 | I997: 0 | J997: 0 | K997: 19103 | L997: 50
A998: 14006 | B998: =INT(RC[-1]/1000) -> 14 | C998: 1 | D998: 1 | E998: =IF(RC[5]=1,"（每日任务）:",)&"累计战胜勇者试炼精英关卡"&RC[1]&"次（%s/"&RC[1]&"）" -> 累计战胜勇者试炼精英关卡16次（%s/16） | F998: 16 | H998: 1 | I998: 0 | J998: 0 | K998: 19103 | L998: 50
A999: 14007 | B999: =INT(RC[-1]/1000) -> 14 | C999: 1 | D999: 1 | E999: =IF(RC[5]=1,"（每日任务）:",)&"累计战胜勇者试炼精英关卡"&RC[1]&"次（%s/"&RC[1]&"）" -> 累计战胜勇者试炼精英关卡20次（%s/20） | F999: 20 | H999: 1 | I999: 0 | J999: 0 | K999: 19103 | L999: 50
A1000: 14008 | B1000: =INT(RC[-1]/1000) -> 14 | C1000: 1 | D1000: 1 | E1000: =IF(RC[5]=1,"（每日任务）:",)&"累计战胜勇者试炼精英关卡"&RC[1]&"次（%s/"&RC[1]&"）" -> 累计战胜勇者试炼精英关卡24次（%s/24） | F1000: 24 | H1000: 1 | I1000: 0 | J1000: 0 | K1000: 19103 | L1000: 50
A1001: 14009 | B1001: =INT(RC[-1]/1000) -> 14 | C1001: 1 | D1001: 1 | E1001: =IF(RC[5]=1,"（每日任务）:",)&"累计战胜勇者试炼精英关卡"&RC[1]&"次（%s/"&RC[1]&"）" -> （每日任务）:累计战胜勇者试炼精英关卡3次（%s/3） | F1001: 3 | H1001: 1 | I1001: 0 | J1001: 1 | K1001: 10089|10088 | L1001: 1|5
A1002: 15000 | B1002: =INT(RC[-1]/1000) -> 15 | C1002: 1 | D1002: 1 | E1002: ="累计勇者试炼重置"&RC[1]&"次（%s/"&RC[1]&"）" -> 累计勇者试炼重置1次（%s/1） | F1002: 1 | H1002: 1 | I1002: 0 | J1002: 0 | K1002: 10000|10001|10107 | L1002: 1|1|1 | N1002: 累计勇者试炼重置
A1003: 15001 | B1003: =INT(RC[-1]/1000) -> 15 | C1003: 1 | D1003: 1 | E1003: ="累计勇者试炼重置"&RC[1]&"次（%s/"&RC[1]&"）" -> 累计勇者试炼重置3次（%s/3） | F1003: 3 | H1003: 1 | I1003: 0 | J1003: 0 | K1003: 19103|10107 | L1003: 5|2
A1004: 15002 | B1004: =INT(RC[-1]/1000) -> 15 | C1004: 1 | D1004: 1 | E1004: ="累计勇者试炼重置"&RC[1]&"次（%s/"&RC[1]&"）" -> 累计勇者试炼重置5次（%s/5） | F1004: 5 | H1004: 1 | I1004: 0 | J1004: 0 | K1004: 42201|10107 | L1004: 5|2
A1005: 15003 | B1005: =INT(RC[-1]/1000) -> 15 | C1005: 1 | D1005: 1 | E1005: ="累计勇者试炼重置"&RC[1]&"次（%s/"&RC[1]&"）" -> 累计勇者试炼重置7次（%s/7） | F1005: 7 | H1005: 1 | I1005: 0 | J1005: 0 | K1005: 10021|10107 | L1005: 10|3
A1006: 15004 | B1006: =INT(RC[-1]/1000) -> 15 | C1006: 1 | D1006: 1 | E1006: ="累计勇者试炼重置"&RC[1]&"次（%s/"&RC[1]&"）" -> 累计勇者试炼重置9次（%s/9） | F1006: 9 | H1006: 1 | I1006: 0 | J1006: 0 | K1006: 10013|10107 | L1006: 20|3
A1007: 15005 | B1007: =INT(RC[-1]/1000) -> 15 | C1007: 1 | D1007: 1 | E1007: ="累计勇者试炼重置"&RC[1]&"次（%s/"&RC[1]&"）" -> 累计勇者试炼重置1次（%s/1） | F1007: 1 | H1007: 1 | I1007: 0 | J1007: 0 | K1007: 10000|10001|10108 | L1007: 1|1|1
A1008: 15006 | B1008: =INT(RC[-1]/1000) -> 15 | C1008: 1 | D1008: 1 | E1008: ="累计勇者试炼重置"&RC[1]&"次（%s/"&RC[1]&"）" -> 累计勇者试炼重置3次（%s/3） | F1008: 3 | H1008: 1 | I1008: 0 | J1008: 0 | K1008: 19103|10108 | L1008: 5|2
A1009: 15007 | B1009: =INT(RC[-1]/1000) -> 15 | C1009: 1 | D1009: 1 | E1009: ="累计勇者试炼重置"&RC[1]&"次（%s/"&RC[1]&"）" -> 累计勇者试炼重置5次（%s/5） | F1009: 5 | H1009: 1 | I1009: 0 | J1009: 0 | K1009: 42201|10108 | L1009: 5|2
A1010: 15008 | B1010: =INT(RC[-1]/1000) -> 15 | C1010: 1 | D1010: 1 | E1010: ="累计勇者试炼重置"&RC[1]&"次（%s/"&RC[1]&"）" -> 累计勇者试炼重置7次（%s/7） | F1010: 7 | H1010: 1 | I1010: 0 | J1010: 0 | K1010: 10021|10108 | L1010: 10|3
A1011: 15009 | B1011: =INT(RC[-1]/1000) -> 15 | C1011: 1 | D1011: 1 | E1011: ="累计勇者试炼重置"&RC[1]&"次（%s/"&RC[1]&"）" -> 累计勇者试炼重置9次（%s/9） | F1011: 9 | H1011: 1 | I1011: 0 | J1011: 0 | K1011: 10013|10108 | L1011: 20|3
A1012: 15010 | B1012: =INT(RC[-1]/1000) -> 15 | C1012: 1 | D1012: 1 | E1012: ="累计勇者试炼重置"&RC[1]&"次（%s/"&RC[1]&"）" -> 累计勇者试炼重置1次（%s/1） | F1012: 1 | H1012: 1 | I1012: 0 | J1012: 0 | K1012: 10000|10001|10108 | L1012: 1|1|5
A1013: 15011 | B1013: =INT(RC[-1]/1000) -> 15 | C1013: 1 | D1013: 1 | E1013: ="累计勇者试炼重置"&RC[1]&"次（%s/"&RC[1]&"）" -> 累计勇者试炼重置3次（%s/3） | F1013: 3 | H1013: 1 | I1013: 0 | J1013: 0 | K1013: 19103|10108 | L1013: 5|5
A1014: 15012 | B1014: =INT(RC[-1]/1000) -> 15 | C1014: 1 | D1014: 1 | E1014: ="累计勇者试炼重置"&RC[1]&"次（%s/"&RC[1]&"）" -> 累计勇者试炼重置5次（%s/5） | F1014: 5 | H1014: 1 | I1014: 0 | J1014: 0 | K1014: 42201|10108 | L1014: 5|10
A1015: 15013 | B1015: =INT(RC[-1]/1000) -> 15 | C1015: 1 | D1015: 1 | E1015: ="累计勇者试炼重置"&RC[1]&"次（%s/"&RC[1]&"）" -> 累计勇者试炼重置7次（%s/7） | F1015: 7 | H1015: 1 | I1015: 0 | J1015: 0 | K1015: 10021|10108 | L1015: 10|10
A1016: 15014 | B1016: =INT(RC[-1]/1000) -> 15 | C1016: 1 | D1016: 1 | E1016: ="累计勇者试炼重置"&RC[1]&"次（%s/"&RC[1]&"）" -> 累计勇者试炼重置9次（%s/9） | F1016: 9 | H1016: 1 | I1016: 0 | J1016: 0 | K1016: 10013|10108 | L1016: 20|15
A1017: 15015 | B1017: =INT(RC[-1]/1000) -> 15 | C1017: 1 | D1017: 1 | E1017: ="（每日任务）累计勇者试炼重置"&RC[1]&"次（%s/"&RC[1]&"）" -> （每日任务）累计勇者试炼重置2次（%s/2） | F1017: 2 | H1017: 1 | I1017: 0 | J1017: 1 | K1017: 10078|10077 | L1017: 1|5
A1018: 15016 | B1018: =INT(RC[-1]/1000) -> 15 | C1018: 1 | D1018: 1 | E1018: ="（每日任务）累计勇者试炼重置"&RC[1]&"次（%s/"&RC[1]&"）" -> （每日任务）累计勇者试炼重置2次（%s/2） | F1018: 2 | H1018: 1 | I1018: 0 | J1018: 1 | K1018: 10001 | L1018: 1
A1019: 15017 | B1019: =INT(RC[-1]/1000) -> 15 | C1019: 1 | D1019: 1 | E1019: ="（每日任务）七夕活动期间：累计勇者试炼重置"&RC[1]&"次（%s/"&RC[1]&"）" -> （每日任务）七夕活动期间：累计勇者试炼重置2次（%s/2） | F1019: 2 | H1019: 1 | I1019: 0 | J1019: 1 | K1019: 10074|10073 | L1019: 1|5
A1020: 15018 | B1020: =INT(RC[-1]/1000) -> 15 | C1020: 1 | D1020: 1 | E1020: ="（每日任务）累计勇者试炼重置"&RC[1]&"次（%s/"&RC[1]&"）" -> （每日任务）累计勇者试炼重置2次（%s/2） | F1020: 2 | H1020: 1 | I1020: 0 | J1020: 1 | K1020: 10089|10088 | L1020: 1|5
A1021: 16000 | B1021: =INT(RC[-1]/1000) -> 16 | C1021: 1 | D1021: 1 | E1021: =IF(RC[5]=1,"（每日任务）:",)&"累计讨伐叛军"&RC[1]&"次（%s/"&RC[1]&"）" -> （每日任务）:累计讨伐叛军5次（%s/5） | F1021: 5 | H1021: 1 | I1021: 0 | J1021: 1 | K1021: 10078|10077 | L1021: 1|5 | N1021: 累计讨伐叛军x=战斗次数
A1022: 16001 | B1022: =INT(RC[-1]/1000) -> 16 | C1022: 1 | D1022: 1 | E1022: =IF(RC[5]=1,"（每日任务）:",)&"累计讨伐叛军"&RC[1]&"次（%s/"&RC[1]&"）" -> （每日任务）:累计讨伐叛军5次（%s/5） | F1022: 5 | H1022: 1 | I1022: 0 | J1022: 1 | K1022: 10000 | L1022: 1
A1023: 16002 | B1023: =INT(RC[-1]/1000) -> 16 | C1023: 1 | D1023: 1 | E1023: =IF(RC[5]=1,"（每日任务）:",)&"累计讨伐叛军"&RC[1]&"次（%s/"&RC[1]&"）" -> （每日任务）:累计讨伐叛军5次（%s/5） | F1023: 5 | H1023: 1 | I1023: 0 | J1023: 1 | K1023: 10074|10073 | L1023: 1|5
A1024: 16014 | B1024: =INT(RC[-1]/1000) -> 16 | C1024: 1 | D1024: 1 | E1024: =IF(RC[5]=1,"（每日任务）:",)&"累计讨伐叛军"&RC[1]&"次（%s/"&RC[1]&"）" -> （每日任务）:累计讨伐叛军5次（%s/5） | F1024: 5 | H1024: 1 | I1024: 0 | J1024: 1 | K1024: 10112 | L1024: 5
A1025: 16015 | B1025: =INT(RC[-1]/1000) -> 16 | C1025: 1 | D1025: 1 | E1025: =IF(RC[5]=1,"（每日任务）:",)&"累计讨伐叛军"&RC[1]&"次（%s/"&RC[1]&"）" -> 累计讨伐叛军20次（%s/20） | F1025: 20 | H1025: 1 | I1025: 0 | J1025: 0 | K1025: 10004 | L1025: 50
A1026: 16016 | B1026: =INT(RC[-1]/1000) -> 16 | C1026: 1 | D1026: 1 | E1026: =IF(RC[5]=1,"（每日任务）:",)&"累计讨伐叛军"&RC[1]&"次（%s/"&RC[1]&"）" -> 累计讨伐叛军40次（%s/40） | F1026: 40 | H1026: 1 | I1026: 0 | J1026: 0 | K1026: 10112 | L1026: 5
A1027: 16017 | B1027: =INT(RC[-1]/1000) -> 16 | C1027: 1 | D1027: 1 | E1027: =IF(RC[5]=1,"（每日任务）:",)&"累计讨伐叛军"&RC[1]&"次（%s/"&RC[1]&"）" -> 累计讨伐叛军60次（%s/60） | F1027: 60 | H1027: 1 | I1027: 0 | J1027: 0 | K1027: 10004 | L1027: 50
A1028: 16018 | B1028: =INT(RC[-1]/1000) -> 16 | C1028: 1 | D1028: 1 | E1028: =IF(RC[5]=1,"（每日任务）:",)&"累计讨伐叛军"&RC[1]&"次（%s/"&RC[1]&"）" -> 累计讨伐叛军80次（%s/80） | F1028: 80 | H1028: 1 | I1028: 0 | J1028: 0 | K1028: 10004 | L1028: 100
A1029: 16019 | B1029: =INT(RC[-1]/1000) -> 16 | C1029: 1 | D1029: 1 | E1029: =IF(RC[5]=1,"（每日任务）:",)&"累计讨伐叛军"&RC[1]&"次（%s/"&RC[1]&"）" -> 累计讨伐叛军120次（%s/120） | F1029: 120 | H1029: 1 | I1029: 0 | J1029: 0 | K1029: 10112 | L1029: 5
A1030: 16020 | B1030: =INT(RC[-1]/1000) -> 16 | C1030: 1 | D1030: 1 | E1030: =IF(RC[5]=1,"（每日任务）:",)&"累计讨伐叛军"&RC[1]&"次（%s/"&RC[1]&"）" -> 累计讨伐叛军160次（%s/160） | F1030: 160 | H1030: 1 | I1030: 0 | J1030: 0 | K1030: 10004 | L1030: 100
A1031: 16021 | B1031: =INT(RC[-1]/1000) -> 16 | C1031: 1 | D1031: 1 | E1031: =IF(RC[5]=1,"（每日任务）:",)&"累计讨伐叛军"&RC[1]&"次（%s/"&RC[1]&"）" -> 累计讨伐叛军200次（%s/200） | F1031: 200 | H1031: 1 | I1031: 0 | J1031: 0 | K1031: 10112 | L1031: 10
A1032: 16022 | B1032: =INT(RC[-1]/1000) -> 16 | C1032: 1 | D1032: 1 | E1032: =IF(RC[5]=1,"（每日任务）:",)&"累计讨伐叛军"&RC[1]&"次（%s/"&RC[1]&"）" -> 累计讨伐叛军240次（%s/240） | F1032: 240 | H1032: 1 | I1032: 0 | J1032: 0 | K1032: 10004 | L1032: 100
A1033: 16023 | B1033: =INT(RC[-1]/1000) -> 16 | C1033: 1 | D1033: 1 | E1033: =IF(RC[5]=1,"（每日任务）:",)&"累计讨伐叛军"&RC[1]&"次（%s/"&RC[1]&"）" -> 累计讨伐叛军280次（%s/280） | F1033: 280 | H1033: 1 | I1033: 0 | J1033: 0 | K1033: 10004 | L1033: 200
A1034: 16024 | B1034: =INT(RC[-1]/1000) -> 16 | C1034: 1 | D1034: 1 | E1034: =IF(RC[5]=1,"（每日任务）:",)&"累计讨伐叛军"&RC[1]&"次（%s/"&RC[1]&"）" -> （每日任务）:累计讨伐叛军1次（%s/1） | F1034: 1 | H1034: 1 | I1034: 0 | J1034: 1 | K1034: 10112 | L1034: 5
A1035: 16025 | B1035: =INT(RC[-1]/1000) -> 16 | C1035: 1 | D1035: 1 | E1035: =IF(RC[5]=1,"（每日任务）:",)&"累计讨伐叛军"&RC[1]&"次（%s/"&RC[1]&"）" -> 累计讨伐叛军10次（%s/10） | F1035: 10 | H1035: 1 | I1035: 0 | J1035: 0 | K1035: 10004 | L1035: 50
A1036: 16026 | B1036: =INT(RC[-1]/1000) -> 16 | C1036: 1 | D1036: 1 | E1036: =IF(RC[5]=1,"（每日任务）:",)&"累计讨伐叛军"&RC[1]&"次（%s/"&RC[1]&"）" -> 累计讨伐叛军20次（%s/20） | F1036: 20 | H1036: 1 | I1036: 0 | J1036: 0 | K1036: 10112 | L1036: 5
A1037: 16027 | B1037: =INT(RC[-1]/1000) -> 16 | C1037: 1 | D1037: 1 | E1037: =IF(RC[5]=1,"（每日任务）:",)&"累计讨伐叛军"&RC[1]&"次（%s/"&RC[1]&"）" -> 累计讨伐叛军30次（%s/30） | F1037: 30 | H1037: 1 | I1037: 0 | J1037: 0 | K1037: 10004 | L1037: 50
A1038: 16028 | B1038: =INT(RC[-1]/1000) -> 16 | C1038: 1 | D1038: 1 | E1038: =IF(RC[5]=1,"（每日任务）:",)&"累计讨伐叛军"&RC[1]&"次（%s/"&RC[1]&"）" -> 累计讨伐叛军40次（%s/40） | F1038: 40 | H1038: 1 | I1038: 0 | J1038: 0 | K1038: 10004 | L1038: 100
A1039: 16029 | B1039: =INT(RC[-1]/1000) -> 16 | C1039: 1 | D1039: 1 | E1039: =IF(RC[5]=1,"（每日任务）:",)&"累计讨伐叛军"&RC[1]&"次（%s/"&RC[1]&"）" -> 累计讨伐叛军50次（%s/50） | F1039: 50 | H1039: 1 | I1039: 0 | J1039: 0 | K1039: 10112 | L1039: 5
A1040: 16030 | B1040: =INT(RC[-1]/1000) -> 16 | C1040: 1 | D1040: 1 | E1040: =IF(RC[5]=1,"（每日任务）:",)&"累计讨伐叛军"&RC[1]&"次（%s/"&RC[1]&"）" -> （每日任务）:累计讨伐叛军5次（%s/5） | F1040: 5 | H1040: 1 | I1040: 0 | J1040: 1 | K1040: 10089|10088 | L1040: 1|5
A1041: 17000 | B1041: =INT(RC[-1]/1000) -> 17 | C1041: 1 | D1041: 1 | E1041: ="累计挑战无尽深渊"&RC[1]&"次（%s/"&RC[1]&"）" -> 累计挑战无尽深渊1次（%s/1） | F1041: 1 | H1041: 1 | I1041: 0 | J1041: 0 | K1041: 19028 | L1041: 200 | N1041: 累计挑战深渊次数
A1042: 17001 | B1042: =INT(RC[-1]/1000) -> 17 | C1042: 1 | D1042: 1 | E1042: ="累计挑战无尽深渊"&RC[1]&"次（%s/"&RC[1]&"）" -> 累计挑战无尽深渊3次（%s/3） | F1042: 3 | H1042: 1 | I1042: 0 | J1042: 0 | K1042: 19028 | L1042: 200
A1043: 17002 | B1043: =INT(RC[-1]/1000) -> 17 | C1043: 1 | D1043: 1 | E1043: ="累计挑战无尽深渊"&RC[1]&"次（%s/"&RC[1]&"）" -> 累计挑战无尽深渊5次（%s/5） | F1043: 5 | H1043: 1 | I1043: 0 | J1043: 0 | K1043: 19028 | L1043: 300
A1044: 17003 | B1044: =INT(RC[-1]/1000) -> 17 | C1044: 1 | D1044: 1 | E1044: ="累计挑战无尽深渊"&RC[1]&"次（%s/"&RC[1]&"）" -> 累计挑战无尽深渊7次（%s/7） | F1044: 7 | H1044: 1 | I1044: 0 | J1044: 0 | K1044: 19028 | L1044: 300
A1045: 17004 | B1045: =INT(RC[-1]/1000) -> 17 | C1045: 1 | D1045: 1 | E1045: ="累计挑战无尽深渊"&RC[1]&"次（%s/"&RC[1]&"）" -> 累计挑战无尽深渊9次（%s/9） | F1045: 9 | H1045: 1 | I1045: 0 | J1045: 0 | K1045: 19028 | L1045: 500
A1046: 17005 | B1046: =INT(RC[-1]/1000) -> 17 | C1046: 1 | D1046: 1 | E1046: ="累计挑战无尽深渊"&RC[1]&"次（%s/"&RC[1]&"）" -> 累计挑战无尽深渊11次（%s/11） | F1046: 11 | H1046: 1 | I1046: 0 | J1046: 0 | K1046: 19028 | L1046: 500
A1047: 17006 | B1047: =INT(RC[-1]/1000) -> 17 | C1047: 1 | D1047: 1 | E1047: ="累计挑战无尽深渊"&RC[1]&"次（%s/"&RC[1]&"）" -> 累计挑战无尽深渊13次（%s/13） | F1047: 13 | H1047: 1 | I1047: 0 | J1047: 0 | K1047: 19028 | L1047: 800
A1048: 17007 | B1048: =INT(RC[-1]/1000) -> 17 | C1048: 1 | D1048: 1 | E1048: ="累计挑战无尽深渊"&RC[1]&"次（%s/"&RC[1]&"）" -> 累计挑战无尽深渊15次（%s/15） | F1048: 15 | H1048: 1 | I1048: 0 | J1048: 0 | K1048: 19028 | L1048: 800
A1049: 17008 | B1049: =INT(RC[-1]/1000) -> 17 | C1049: 1 | D1049: 1 | E1049: ="（每日任务）:累计挑战无尽深渊"&RC[1]&"次（%s/"&RC[1]&"）" -> （每日任务）:累计挑战无尽深渊1次（%s/1） | F1049: 1 | H1049: 1 | I1049: 0 | J1049: 1 | K1049: 10089|10088 | L1049: 1|5
A1050: 18000 | B1050: =INT(RC[-1]/1000) -> 18 | C1050: 1 | D1050: 1 | E1050: ="累计挑战王者赛"&RC[1]&"次（%s/"&RC[1]&"）" -> 累计挑战王者赛1次（%s/1） | F1050: 1 | H1050: 1 | I1050: 0 | J1050: 0 | K1050: 19003 | L1050: 1 | N1050: 累计挑战王者赛次数
A1051: 19000 | B1051: =INT(RC[-1]/1000) -> 19 | C1051: 1 | D1051: 1 | E1051: ="(每日任务）在占卜系统中累计翻牌"&RC[1]&"次（%s/"&RC[1]&"）" -> (每日任务）在占卜系统中累计翻牌30次（%s/30） | F1051: 30 | H1051: 1 | I1051: 0 | J1051: 1 | K1051: 10096 | L1051: 1 | N1051: 累计翻卡次数（包括低级和高级）
A1052: 19001 | B1052: =INT(RC[-1]/1000) -> 19 | C1052: 1 | D1052: 1 | E1052: ="在占卜系统中累计翻牌"&RC[1]&"次（%s/"&RC[1]&"）" -> 在占卜系统中累计翻牌30次（%s/30） | F1052: 30 | H1052: 1 | I1052: 0 | J1052: 0 | K1052: 13056 | L1052: 1
A1053: 19002 | B1053: =INT(RC[-1]/1000) -> 19 | C1053: 1 | D1053: 1 | E1053: ="在占卜系统中累计翻牌"&RC[1]&"次（%s/"&RC[1]&"）" -> 在占卜系统中累计翻牌60次（%s/60） | F1053: 60 | H1053: 1 | I1053: 0 | J1053: 0 | K1053: 13056|70300 | L1053: 1|1
A1054: 19003 | B1054: =INT(RC[-1]/1000) -> 19 | C1054: 1 | D1054: 1 | E1054: ="在占卜系统中累计翻牌"&RC[1]&"次（%s/"&RC[1]&"）" -> 在占卜系统中累计翻牌90次（%s/90） | F1054: 90 | H1054: 1 | I1054: 0 | J1054: 0 | K1054: 13056|70300 | L1054: 1|2
A1055: 19004 | B1055: =INT(RC[-1]/1000) -> 19 | C1055: 1 | D1055: 1 | E1055: ="在占卜系统中累计翻牌"&RC[1]&"次（%s/"&RC[1]&"）" -> 在占卜系统中累计翻牌120次（%s/120） | F1055: 120 | H1055: 1 | I1055: 0 | J1055: 0 | K1055: 13056|70300 | L1055: 1|3
A1056: 19005 | B1056: =INT(RC[-1]/1000) -> 19 | C1056: 1 | D1056: 1 | E1056: ="在占卜系统中累计翻牌"&RC[1]&"次（%s/"&RC[1]&"）" -> 在占卜系统中累计翻牌180次（%s/180） | F1056: 180 | H1056: 1 | I1056: 0 | J1056: 0 | K1056: 10009|70300 | L1056: 5|10
A1057: 19006 | B1057: =INT(RC[-1]/1000) -> 19 | C1057: 1 | D1057: 1 | E1057: ="在占卜系统中累计翻牌"&RC[1]&"次（%s/"&RC[1]&"）" -> 在占卜系统中累计翻牌240次（%s/240） | F1057: 240 | H1057: 1 | I1057: 0 | J1057: 0 | K1057: 10009|70300 | L1057: 10|10
A1058: 19007 | B1058: =INT(RC[-1]/1000) -> 19 | C1058: 1 | D1058: 1 | E1058: ="在占卜系统中累计翻牌"&RC[1]&"次（%s/"&RC[1]&"）" -> 在占卜系统中累计翻牌300次（%s/300） | F1058: 300 | H1058: 1 | I1058: 0 | J1058: 0 | K1058: 10009|70300 | L1058: 15|10
A1059: 19008 | B1059: =INT(RC[-1]/1000) -> 19 | C1059: 1 | D1059: 1 | E1059: ="在占卜系统中累计翻牌"&RC[1]&"次（%s/"&RC[1]&"）" -> 在占卜系统中累计翻牌360次（%s/360） | F1059: 360 | H1059: 1 | I1059: 0 | J1059: 0 | K1059: 13501 | L1059: 1
A1060: 19009 | B1060: =INT(RC[-1]/1000) -> 19 | C1060: 1 | D1060: 1 | E1060: ="在占卜系统中累计翻牌"&RC[1]&"次（%s/"&RC[1]&"）" -> 在占卜系统中累计翻牌480次（%s/480） | F1060: 480 | H1060: 1 | I1060: 0 | J1060: 0 | K1060: 10009|70300 | L1060: 20|20
A1061: 19010 | B1061: =INT(RC[-1]/1000) -> 19 | C1061: 1 | D1061: 1 | E1061: ="在占卜系统中累计翻牌"&RC[1]&"次（%s/"&RC[1]&"）" -> 在占卜系统中累计翻牌600次（%s/600） | F1061: 600 | H1061: 1 | I1061: 0 | J1061: 0 | K1061: 13506 | L1061: 1
A1062: 20000 | B1062: =INT(RC[-1]/1000) -> 20 | C1062: 1 | D1062: 1 | E1062: =IF(RC[5]=1,"(每日任务:)",)&"在占星中累计翻牌"&RC[1]&"次.（%s/"&RC[1]&"）" -> (每日任务:)在占星中累计翻牌3次.（%s/3） | F1062: 3 | H1062: 1 | I1062: 0 | J1062: 1 | K1062: 10009 | L1062: 2 | N1062: 累计高级翻卡（占卜）次数
A1063: 20001 | B1063: =INT(RC[-1]/1000) -> 20 | C1063: 1 | D1063: 1 | E1063: =IF(RC[5]=1,"(每日任务:)",)&"在占星中累计翻牌"&RC[1]&"次.（%s/"&RC[1]&"）" -> 在占星中累计翻牌10次.（%s/10） | F1063: 10 | H1063: 1 | I1063: 0 | J1063: 0 | K1063: 13056 | L1063: 1
A1064: 20002 | B1064: =INT(RC[-1]/1000) -> 20 | C1064: 1 | D1064: 1 | E1064: =IF(RC[5]=1,"(每日任务:)",)&"在占星中累计翻牌"&RC[1]&"次.（%s/"&RC[1]&"）" -> 在占星中累计翻牌20次.（%s/20） | F1064: 20 | H1064: 1 | I1064: 0 | J1064: 0 | K1064: 13056|70300 | L1064: 1|1
A1065: 20003 | B1065: =INT(RC[-1]/1000) -> 20 | C1065: 1 | D1065: 1 | E1065: =IF(RC[5]=1,"(每日任务:)",)&"在占星中累计翻牌"&RC[1]&"次.（%s/"&RC[1]&"）" -> 在占星中累计翻牌30次.（%s/30） | F1065: 30 | H1065: 1 | I1065: 0 | J1065: 0 | K1065: 13339|70300 | L1065: 1|2
A1066: 20004 | B1066: =INT(RC[-1]/1000) -> 20 | C1066: 1 | D1066: 1 | E1066: =IF(RC[5]=1,"(每日任务:)",)&"在占星中累计翻牌"&RC[1]&"次.（%s/"&RC[1]&"）" -> 在占星中累计翻牌40次.（%s/40） | F1066: 40 | H1066: 1 | I1066: 0 | J1066: 0 | K1066: 13339|70300 | L1066: 1|5
A1067: 20005 | B1067: =INT(RC[-1]/1000) -> 20 | C1067: 1 | D1067: 1 | E1067: =IF(RC[5]=1,"(每日任务:)",)&"在占星中累计翻牌"&RC[1]&"次.（%s/"&RC[1]&"）" -> 在占星中累计翻牌60次.（%s/60） | F1067: 60 | H1067: 1 | I1067: 0 | J1067: 0 | K1067: 10009|70300 | L1067: 10|10
A1068: 20006 | B1068: =INT(RC[-1]/1000) -> 20 | C1068: 1 | D1068: 1 | E1068: =IF(RC[5]=1,"(每日任务:)",)&"在占星中累计翻牌"&RC[1]&"次.（%s/"&RC[1]&"）" -> 在占星中累计翻牌80次.（%s/80） | F1068: 80 | H1068: 1 | I1068: 0 | J1068: 0 | K1068: 10009|70300 | L1068: 15|10
A1069: 20007 | B1069: =INT(RC[-1]/1000) -> 20 | C1069: 1 | D1069: 1 | E1069: =IF(RC[5]=1,"(每日任务:)",)&"在占星中累计翻牌"&RC[1]&"次.（%s/"&RC[1]&"）" -> 在占星中累计翻牌100次.（%s/100） | F1069: 100 | H1069: 1 | I1069: 0 | J1069: 0 | K1069: 10009|70300 | L1069: 20|10
A1070: 20008 | B1070: =INT(RC[-1]/1000) -> 20 | C1070: 1 | D1070: 1 | E1070: =IF(RC[5]=1,"(每日任务:)",)&"在占星中累计翻牌"&RC[1]&"次.（%s/"&RC[1]&"）" -> 在占星中累计翻牌120次.（%s/120） | F1070: 120 | H1070: 1 | I1070: 0 | J1070: 0 | K1070: 13501|10009 | L1070: 1|20
A1071: 20009 | B1071: =INT(RC[-1]/1000) -> 20 | C1071: 1 | D1071: 1 | E1071: =IF(RC[5]=1,"(每日任务:)",)&"在占星中累计翻牌"&RC[1]&"次.（%s/"&RC[1]&"）" -> 在占星中累计翻牌160次.（%s/160） | F1071: 160 | H1071: 1 | I1071: 0 | J1071: 0 | K1071: 13501|10009|70300 | L1071: 1|30|10
A1072: 20010 | B1072: =INT(RC[-1]/1000) -> 20 | C1072: 1 | D1072: 1 | E1072: =IF(RC[5]=1,"(每日任务:)",)&"在占星中累计翻牌"&RC[1]&"次.（%s/"&RC[1]&"）" -> 在占星中累计翻牌200次.（%s/200） | F1072: 200 | H1072: 1 | I1072: 0 | J1072: 0 | K1072: 13506|10009|70300 | L1072: 1|30|10
A1073: 21000 | B1073: =INT(RC[-1]/1000) -> 21 | C1073: 1 | D1073: 1 | E1073: ="同时拥有"&RC[1]&"张10级的卡牌（%s/"&RC[1]&"）" -> 同时拥有1张10级的卡牌（%s/1） | F1073: 1 | H1073: 1 | I1073: 0 | J1073: 0 | K1073: 13056|19032 | L1073: 1|150 | N1073: 1.同时拥有X張Y级以上的卡牌
A1074: 22000 | B1074: =INT(RC[-1]/1000) -> 22 | C1074: 1 | D1074: 1 | E1074: ="同时拥有"&RC[1]&"张20级的卡牌（%s/"&RC[1]&"）" -> 同时拥有1张20级的卡牌（%s/1） | F1074: 1 | H1074: 1 | I1074: 0 | J1074: 0 | K1074: 13056|19032 | L1074: 1|150 | N1074: 1.同时拥有X張Y级以上的卡牌
A1075: 23000 | B1075: =INT(RC[-1]/1000) -> 23 | C1075: 1 | D1075: 1 | E1075: ="同时拥有"&RC[1]&"张30级的卡牌（%s/"&RC[1]&"）" -> 同时拥有1张30级的卡牌（%s/1） | F1075: 1 | H1075: 1 | I1075: 0 | J1075: 0 | K1075: 13056|19032 | L1075: 1|150 | N1075: 1.同时拥有X張Y级以上的卡牌
A1076: 24000 | B1076: =INT(RC[-1]/1000) -> 24 | C1076: 1 | D1076: 1 | E1076: ="同时拥有"&RC[1]&"张40级的卡牌（%s/"&RC[1]&"）" -> 同时拥有1张40级的卡牌（%s/1） | F1076: 1 | H1076: 1 | I1076: 0 | J1076: 0 | K1076: 13056|19032 | L1076: 1|150 | N1076: 1.同时拥有X張Y级以上的卡牌
A1077: 25000 | B1077: =INT(RC[-1]/1000) -> 25 | C1077: 1 | D1077: 1 | E1077: ="同时拥有"&RC[1]&"张50级的卡牌（%s/"&RC[1]&"）" -> 同时拥有1张50级的卡牌（%s/1） | F1077: 1 | H1077: 1 | I1077: 0 | J1077: 0 | K1077: 13056|19032 | L1077: 1|150 | N1077: 1.同时拥有X張Y级以上的卡牌
A1078: 26000 | B1078: =INT(RC[-1]/1000) -> 26 | C1078: 1 | D1078: 1 | E1078: ="同时拥有"&RC[1]&"張+1阶以上的卡牌（%s/"&RC[1]&"）" -> 同时拥有1張+1阶以上的卡牌（%s/1） | F1078: 1 | H1078: 1 | I1078: 0 | J1078: 0 | K1078: 13339|19032 | L1078: 1|500 | N1078: 2.同时拥有X張Y阶以上的卡牌
A1079: 27000 | B1079: =INT(RC[-1]/1000) -> 27 | C1079: 1 | D1079: 1 | E1079: ="同时拥有"&RC[1]&"張+2阶以上的卡牌（%s/"&RC[1]&"）" -> 同时拥有1張+2阶以上的卡牌（%s/1） | F1079: 1 | H1079: 1 | I1079: 0 | J1079: 0 | K1079: 13339|19032 | L1079: 1|500 | N1079: 2.同时拥有X張Y阶以上的卡牌
A1080: 28000 | B1080: =INT(RC[-1]/1000) -> 28 | C1080: 1 | D1080: 1 | E1080: ="同时拥有"&RC[1]&"張+3阶以上的卡牌（%s/"&RC[1]&"）" -> 同时拥有1張+3阶以上的卡牌（%s/1） | F1080: 1 | H1080: 1 | I1080: 0 | J1080: 0 | K1080: 13339|19032 | L1080: 1|500 | N1080: 2.同时拥有X張Y阶以上的卡牌
A1081: 29000 | B1081: =INT(RC[-1]/1000) -> 29 | C1081: 1 | D1081: 1 | E1081: ="同时拥有"&RC[1]&"張+4阶以上的卡牌（%s/"&RC[1]&"）" -> 同时拥有1張+4阶以上的卡牌（%s/1） | F1081: 1 | H1081: 1 | I1081: 0 | J1081: 0 | K1081: 13339|19032 | L1081: 1|500 | N1081: 2.同时拥有X張Y阶以上的卡牌
A1082: 30000 | B1082: =INT(RC[-1]/1000) -> 30 | C1082: 1 | D1082: 1 | E1082: ="同时拥有"&RC[1]&"張+5阶以上的卡牌（%s/"&RC[1]&"）" -> 同时拥有1張+5阶以上的卡牌（%s/1） | F1082: 1 | H1082: 1 | I1082: 0 | J1082: 0 | K1082: 13339|19032 | L1082: 1|500 | N1082: 2.同时拥有X張Y阶以上的卡牌
A1083: 31000 | B1083: =INT(RC[-1]/1000) -> 31 | C1083: 1 | D1083: 1 | E1083: ="历收藏值最高达到"&RC[1]&"（%s/"&RC[1]&"）" -> 历收藏值最高达到20（%s/20） | F1083: 20 | H1083: 1 | I1083: 0 | J1083: 0 | K1083: 70300|19032 | L1083: 20|800 | N1083: 3.历史卡牌收藏值最高达到X
A1084: 32000 | B1084: =INT(RC[-1]/1000) -> 32 | C1084: 1 | D1084: 1 | E1084: ="（每天一次）活动期间消耗任意数量钻石" -> （每天一次）活动期间消耗任意数量钻石 | F1084: 1 | H1084: 1 | I1084: 0 | J1084: 1 | K1084: 10107 | L1084: 5 | N1084: 4.活动期间累计消耗X钻石
A1085: 32001 | B1085: =INT(RC[-1]/1000) -> 32 | C1085: 1 | D1085: 1 | E1085: ="活动期间消耗"&RC[1]&"钻（%s/"&RC[1]&"）" -> 活动期间消耗100钻（%s/100） | F1085: 100 | H1085: 1 | I1085: 0 | J1085: 0 | K1085: 10107 | L1085: 10
A1086: 32002 | B1086: =INT(RC[-1]/1000) -> 32 | C1086: 1 | D1086: 1 | E1086: ="活动期间消耗"&RC[1]&"钻（%s/"&RC[1]&"）" -> 活动期间消耗500钻（%s/500） | F1086: 500 | H1086: 1 | I1086: 0 | J1086: 0 | K1086: 10107 | L1086: 20
A1087: 32003 | B1087: =INT(RC[-1]/1000) -> 32 | C1087: 1 | D1087: 1 | E1087: ="活动期间消耗"&RC[1]&"钻（%s/"&RC[1]&"）" -> 活动期间消耗1000钻（%s/1000） | F1087: 1000 | H1087: 1 | I1087: 0 | J1087: 0 | K1087: 10107 | L1087: 25
A1088: 32004 | B1088: =INT(RC[-1]/1000) -> 32 | C1088: 1 | D1088: 1 | E1088: ="活动期间消耗"&RC[1]&"钻（%s/"&RC[1]&"）" -> 活动期间消耗1500钻（%s/1500） | F1088: 1500 | H1088: 1 | I1088: 0 | J1088: 0 | K1088: 10107 | L1088: 25
A1089: 32005 | B1089: =INT(RC[-1]/1000) -> 32 | C1089: 1 | D1089: 1 | E1089: ="活动期间消耗"&RC[1]&"钻（%s/"&RC[1]&"）" -> 活动期间消耗2000钻（%s/2000） | F1089: 2000 | H1089: 1 | I1089: 0 | J1089: 0 | K1089: 10107 | L1089: 25
A1090: 32006 | B1090: =INT(RC[-1]/1000) -> 32 | C1090: 1 | D1090: 1 | E1090: ="活动期间消耗"&RC[1]&"钻（%s/"&RC[1]&"）" -> 活动期间消耗3000钻（%s/3000） | F1090: 3000 | H1090: 1 | I1090: 0 | J1090: 0 | K1090: 10107 | L1090: 50
A1091: 32007 | B1091: =INT(RC[-1]/1000) -> 32 | C1091: 1 | D1091: 1 | E1091: ="活动期间消耗"&RC[1]&"钻（%s/"&RC[1]&"）" -> 活动期间消耗4000钻（%s/4000） | F1091: 4000 | H1091: 1 | I1091: 0 | J1091: 0 | K1091: 10107 | L1091: 50
A1092: 32008 | B1092: =INT(RC[-1]/1000) -> 32 | C1092: 1 | D1092: 1 | E1092: ="活动期间消耗"&RC[1]&"钻（%s/"&RC[1]&"）" -> 活动期间消耗5000钻（%s/5000） | F1092: 5000 | H1092: 1 | I1092: 0 | J1092: 0 | K1092: 10107 | L1092: 50
A1093: 32009 | B1093: =INT(RC[-1]/1000) -> 32 | C1093: 1 | D1093: 1 | E1093: ="活动期间消耗"&RC[1]&"钻（%s/"&RC[1]&"）" -> 活动期间消耗6000钻（%s/6000） | F1093: 6000 | H1093: 1 | I1093: 0 | J1093: 0 | K1093: 10107 | L1093: 50
A1094: 32010 | B1094: =INT(RC[-1]/1000) -> 32 | C1094: 1 | D1094: 1 | E1094: ="活动期间消耗"&RC[1]&"钻（%s/"&RC[1]&"）" -> 活动期间消耗7000钻（%s/7000） | F1094: 7000 | H1094: 1 | I1094: 0 | J1094: 0 | K1094: 10107 | L1094: 50
A1095: 32011 | B1095: =INT(RC[-1]/1000) -> 32 | C1095: 1 | D1095: 1 | E1095: ="活动期间消耗"&RC[1]&"钻（%s/"&RC[1]&"）" -> 活动期间消耗8000钻（%s/8000） | F1095: 8000 | H1095: 1 | I1095: 0 | J1095: 0 | K1095: 10107 | L1095: 50
A1096: 32012 | B1096: =INT(RC[-1]/1000) -> 32 | C1096: 1 | D1096: 1 | E1096: ="活动期间消耗"&RC[1]&"钻（%s/"&RC[1]&"）" -> 活动期间消耗9000钻（%s/9000） | F1096: 9000 | H1096: 1 | I1096: 0 | J1096: 0 | K1096: 10107 | L1096: 50
A1097: 32013 | B1097: =INT(RC[-1]/1000) -> 32 | C1097: 1 | D1097: 1 | E1097: ="活动期间消耗"&RC[1]&"钻（%s/"&RC[1]&"）" -> 活动期间消耗10000钻（%s/10000） | F1097: 10000 | H1097: 1 | I1097: 0 | J1097: 0 | K1097: 10107 | L1097: 50
A1098: 32014 | B1098: =INT(RC[-1]/1000) -> 32 | C1098: 1 | D1098: 1 | E1098: ="活动期间消耗"&RC[1]&"钻（%s/"&RC[1]&"）" -> 活动期间消耗12000钻（%s/12000） | F1098: 12000 | H1098: 1 | I1098: 0 | J1098: 0 | K1098: 10107 | L1098: 80
A1099: 32015 | B1099: =INT(RC[-1]/1000) -> 32 | C1099: 1 | D1099: 1 | E1099: ="活动期间消耗"&RC[1]&"钻（%s/"&RC[1]&"）" -> 活动期间消耗14000钻（%s/14000） | F1099: 14000 | H1099: 1 | I1099: 0 | J1099: 0 | K1099: 10107 | L1099: 80
A1100: 32016 | B1100: =INT(RC[-1]/1000) -> 32 | C1100: 1 | D1100: 1 | E1100: ="活动期间消耗"&RC[1]&"钻（%s/"&RC[1]&"）" -> 活动期间消耗16000钻（%s/16000） | F1100: 16000 | H1100: 1 | I1100: 0 | J1100: 0 | K1100: 10107 | L1100: 80
A1101: 32017 | B1101: =INT(RC[-1]/1000) -> 32 | C1101: 1 | D1101: 1 | E1101: ="活动期间消耗"&RC[1]&"钻（%s/"&RC[1]&"）" -> 活动期间消耗18000钻（%s/18000） | F1101: 18000 | H1101: 1 | I1101: 0 | J1101: 0 | K1101: 10107 | L1101: 80
A1102: 32018 | B1102: =INT(RC[-1]/1000) -> 32 | C1102: 1 | D1102: 1 | E1102: ="活动期间消耗"&RC[1]&"钻（%s/"&RC[1]&"）" -> 活动期间消耗20000钻（%s/20000） | F1102: 20000 | H1102: 1 | I1102: 0 | J1102: 0 | K1102: 10107 | L1102: 80
A1103: 32019 | B1103: =INT(RC[-1]/1000) -> 32 | C1103: 1 | D1103: 1 | E1103: ="活动期间消耗"&RC[1]&"钻（%s/"&RC[1]&"）" -> 活动期间消耗22000钻（%s/22000） | F1103: 22000 | H1103: 1 | I1103: 0 | J1103: 0 | K1103: 10107 | L1103: 80
A1104: 32020 | B1104: =INT(RC[-1]/1000) -> 32 | C1104: 1 | D1104: 1 | E1104: ="活动期间消耗"&RC[1]&"钻（%s/"&RC[1]&"）" -> 活动期间消耗24000钻（%s/24000） | F1104: 24000 | H1104: 1 | I1104: 0 | J1104: 0 | K1104: 10107 | L1104: 80
A1105: 32021 | B1105: =INT(RC[-1]/1000) -> 32 | C1105: 1 | D1105: 1 | E1105: ="活动期间消耗"&RC[1]&"钻（%s/"&RC[1]&"）" -> 活动期间消耗26000钻（%s/26000） | F1105: 26000 | H1105: 1 | I1105: 0 | J1105: 0 | K1105: 10107 | L1105: 80
A1106: 32022 | B1106: =INT(RC[-1]/1000) -> 32 | C1106: 1 | D1106: 1 | E1106: ="活动期间消耗"&RC[1]&"钻（%s/"&RC[1]&"）" -> 活动期间消耗28000钻（%s/28000） | F1106: 28000 | H1106: 1 | I1106: 0 | J1106: 0 | K1106: 10107 | L1106: 80
A1107: 32023 | B1107: =INT(RC[-1]/1000) -> 32 | C1107: 1 | D1107: 1 | E1107: ="活动期间消耗"&RC[1]&"钻（%s/"&RC[1]&"）" -> 活动期间消耗30000钻（%s/30000） | F1107: 30000 | H1107: 1 | I1107: 0 | J1107: 0 | K1107: 10107 | L1107: 80
A1108: 32024 | B1108: =INT(RC[-1]/1000) -> 32 | C1108: 1 | D1108: 1 | E1108: ="（每天一次）活动期间消耗任意数量钻石" -> （每天一次）活动期间消耗任意数量钻石 | F1108: 1 | H1108: 1 | I1108: 0 | J1108: 1 | K1108: 10108 | L1108: 5 | N1108: 4.活动期间累计消耗X钻石
A1109: 32025 | B1109: =INT(RC[-1]/1000) -> 32 | C1109: 1 | D1109: 1 | E1109: ="活动期间消耗"&RC[1]&"钻（%s/"&RC[1]&"）" -> 活动期间消耗200钻（%s/200） | F1109: 200 | H1109: 1 | I1109: 0 | J1109: 0 | K1109: 10108 | L1109: 10
A1110: 32026 | B1110: =INT(RC[-1]/1000) -> 32 | C1110: 1 | D1110: 1 | E1110: ="活动期间消耗"&RC[1]&"钻（%s/"&RC[1]&"）" -> 活动期间消耗1000钻（%s/1000） | F1110: 1000 | H1110: 1 | I1110: 0 | J1110: 0 | K1110: 10108 | L1110: 20
A1111: 32027 | B1111: =INT(RC[-1]/1000) -> 32 | C1111: 1 | D1111: 1 | E1111: ="活动期间消耗"&RC[1]&"钻（%s/"&RC[1]&"）" -> 活动期间消耗2000钻（%s/2000） | F1111: 2000 | H1111: 1 | I1111: 0 | J1111: 0 | K1111: 10108 | L1111: 25
A1112: 32028 | B1112: =INT(RC[-1]/1000) -> 32 | C1112: 1 | D1112: 1 | E1112: ="活动期间消耗"&RC[1]&"钻（%s/"&RC[1]&"）" -> 活动期间消耗4000钻（%s/4000） | F1112: 4000 | H1112: 1 | I1112: 0 | J1112: 0 | K1112: 10108 | L1112: 40
A1113: 32029 | B1113: =INT(RC[-1]/1000) -> 32 | C1113: 1 | D1113: 1 | E1113: ="活动期间消耗"&RC[1]&"钻（%s/"&RC[1]&"）" -> 活动期间消耗6000钻（%s/6000） | F1113: 6000 | H1113: 1 | I1113: 0 | J1113: 0 | K1113: 10108 | L1113: 40
A1114: 32030 | B1114: =INT(RC[-1]/1000) -> 32 | C1114: 1 | D1114: 1 | E1114: ="活动期间消耗"&RC[1]&"钻（%s/"&RC[1]&"）" -> 活动期间消耗10000钻（%s/10000） | F1114: 10000 | H1114: 1 | I1114: 0 | J1114: 0 | K1114: 10108 | L1114: 70
A1115: 32031 | B1115: =INT(RC[-1]/1000) -> 32 | C1115: 1 | D1115: 1 | E1115: ="活动期间消耗"&RC[1]&"钻（%s/"&RC[1]&"）" -> 活动期间消耗14000钻（%s/14000） | F1115: 14000 | H1115: 1 | I1115: 0 | J1115: 0 | K1115: 10108 | L1115: 70
A1116: 32032 | B1116: =INT(RC[-1]/1000) -> 32 | C1116: 1 | D1116: 1 | E1116: ="活动期间消耗"&RC[1]&"钻（%s/"&RC[1]&"）" -> 活动期间消耗20000钻（%s/20000） | F1116: 20000 | H1116: 1 | I1116: 0 | J1116: 0 | K1116: 10108 | L1116: 100
A1117: 32033 | B1117: =INT(RC[-1]/1000) -> 32 | C1117: 1 | D1117: 1 | E1117: ="活动期间消耗"&RC[1]&"钻（%s/"&RC[1]&"）" -> 活动期间消耗30000钻（%s/30000） | F1117: 30000 | H1117: 1 | I1117: 0 | J1117: 0 | K1117: 10108 | L1117: 150
A1118: 32034 | B1118: =INT(RC[-1]/1000) -> 32 | C1118: 1 | D1118: 1 | E1118: ="活动期间消耗"&RC[1]&"钻（%s/"&RC[1]&"）" -> 活动期间消耗40000钻（%s/40000） | F1118: 40000 | H1118: 1 | I1118: 0 | J1118: 0 | K1118: 10108 | L1118: 150
A1119: 32035 | B1119: =INT(RC[-1]/1000) -> 32 | C1119: 1 | D1119: 1 | E1119: ="活动期间消耗"&RC[1]&"钻（%s/"&RC[1]&"）" -> 活动期间消耗50000钻（%s/50000） | F1119: 50000 | H1119: 1 | I1119: 0 | J1119: 0 | K1119: 10108 | L1119: 150
A1120: 32036 | B1120: =INT(RC[-1]/1000) -> 32 | C1120: 1 | D1120: 1 | E1120: ="活动期间消耗"&RC[1]&"钻（%s/"&RC[1]&"）" -> 活动期间消耗60000钻（%s/60000） | F1120: 60000 | H1120: 1 | I1120: 0 | J1120: 0 | K1120: 10108 | L1120: 150
A1121: 32037 | B1121: =INT(RC[-1]/1000) -> 32 | C1121: 1 | D1121: 1 | E1121: ="活动期间消耗"&RC[1]&"钻（%s/"&RC[1]&"）" -> 活动期间消耗70000钻（%s/70000） | F1121: 70000 | H1121: 1 | I1121: 0 | J1121: 0 | K1121: 10108 | L1121: 150
A1122: 32038 | B1122: =INT(RC[-1]/1000) -> 32 | C1122: 1 | D1122: 1 | E1122: ="活动期间消耗"&RC[1]&"钻（%s/"&RC[1]&"）" -> 活动期间消耗80000钻（%s/80000） | F1122: 80000 | H1122: 1 | I1122: 0 | J1122: 0 | K1122: 10108 | L1122: 150
A1123: 32039 | B1123: =INT(RC[-1]/1000) -> 32 | C1123: 1 | D1123: 1 | E1123: ="活动期间消耗"&RC[1]&"钻（%s/"&RC[1]&"）" -> 活动期间消耗90000钻（%s/90000） | F1123: 90000 | H1123: 1 | I1123: 0 | J1123: 0 | K1123: 10108 | L1123: 150
A1124: 32040 | B1124: =INT(RC[-1]/1000) -> 32 | C1124: 1 | D1124: 1 | E1124: ="活动期间消耗"&RC[1]&"钻（%s/"&RC[1]&"）" -> 活动期间消耗100000钻（%s/100000） | F1124: 100000 | H1124: 1 | I1124: 0 | J1124: 0 | K1124: 10108 | L1124: 150
A1125: 32048 | B1125: =INT(RC[-1]/1000) -> 32 | C1125: 1 | D1125: 1 | E1125: ="（每天一次）活动期间消耗任意数量钻石" -> （每天一次）活动期间消耗任意数量钻石 | F1125: 1 | H1125: 1 | I1125: 0 | J1125: 1 | K1125: 19105 | L1125: 6 | N1125: 4.活动期间累计消耗X钻石
A1126: 32049 | B1126: =INT(RC[-1]/1000) -> 32 | C1126: 1 | D1126: 1 | E1126: ="活动期间消耗"&RC[1]&"钻（%s/"&RC[1]&"）" -> 活动期间消耗200钻（%s/200） | F1126: 200 | H1126: 1 | I1126: 0 | J1126: 0 | K1126: 19017 | L1126: 200
A1127: 32050 | B1127: =INT(RC[-1]/1000) -> 32 | C1127: 1 | D1127: 1 | E1127: ="活动期间消耗"&RC[1]&"钻（%s/"&RC[1]&"）" -> 活动期间消耗500钻（%s/500） | F1127: 500 | H1127: 1 | I1127: 0 | J1127: 0 | K1127: 42301 | L1127: 2
A1128: 32051 | B1128: =INT(RC[-1]/1000) -> 32 | C1128: 1 | D1128: 1 | E1128: ="活动期间消耗"&RC[1]&"钻（%s/"&RC[1]&"）" -> 活动期间消耗1000钻（%s/1000） | F1128: 1000 | H1128: 1 | I1128: 0 | J1128: 0 | K1128: 10022 | L1128: 25
A1129: 32052 | B1129: =INT(RC[-1]/1000) -> 32 | C1129: 1 | D1129: 1 | E1129: ="活动期间消耗"&RC[1]&"钻（%s/"&RC[1]&"）" -> 活动期间消耗2000钻（%s/2000） | F1129: 2000 | H1129: 1 | I1129: 0 | J1129: 0 | K1129: 10014 | L1129: 50
A1130: 32053 | B1130: =INT(RC[-1]/1000) -> 32 | C1130: 1 | D1130: 1 | E1130: ="活动期间消耗"&RC[1]&"钻（%s/"&RC[1]&"）" -> 活动期间消耗3000钻（%s/3000） | F1130: 3000 | H1130: 1 | I1130: 0 | J1130: 0 | K1130: 10010 | L1130: 200
A1131: 32054 | B1131: =INT(RC[-1]/1000) -> 32 | C1131: 1 | D1131: 1 | E1131: ="活动期间消耗"&RC[1]&"钻（%s/"&RC[1]&"）" -> 活动期间消耗5000钻（%s/5000） | F1131: 5000 | H1131: 1 | I1131: 0 | J1131: 0 | K1131: 13501 | L1131: 1
A1132: 32055 | B1132: =INT(RC[-1]/1000) -> 32 | C1132: 1 | D1132: 1 | E1132: ="活动期间消耗"&RC[1]&"钻（%s/"&RC[1]&"）" -> 活动期间消耗7000钻（%s/7000） | F1132: 7000 | H1132: 1 | I1132: 0 | J1132: 0 | K1132: 13324 | L1132: 1
A1133: 32056 | B1133: =INT(RC[-1]/1000) -> 32 | C1133: 1 | D1133: 1 | E1133: ="活动期间消耗"&RC[1]&"钻（%s/"&RC[1]&"）" -> 活动期间消耗10000钻（%s/10000） | F1133: 10000 | H1133: 1 | I1133: 0 | J1133: 0 | K1133: 13502 | L1133: 1
A1134: 32057 | B1134: =INT(RC[-1]/1000) -> 32 | C1134: 1 | D1134: 1 | E1134: ="活动期间消耗"&RC[1]&"钻（%s/"&RC[1]&"）" -> 活动期间消耗15000钻（%s/15000） | F1134: 15000 | H1134: 1 | I1134: 0 | J1134: 0 | K1134: 10008 | L1134: 1000
A1135: 32058 | B1135: =INT(RC[-1]/1000) -> 32 | C1135: 1 | D1135: 1 | E1135: ="活动期间消耗"&RC[1]&"钻（%s/"&RC[1]&"）" -> 活动期间消耗20000钻（%s/20000） | F1135: 20000 | H1135: 1 | I1135: 0 | J1135: 0 | K1135: 10022 | L1135: 100
A1136: 32059 | B1136: =INT(RC[-1]/1000) -> 32 | C1136: 1 | D1136: 1 | E1136: ="活动期间消耗"&RC[1]&"钻（%s/"&RC[1]&"）" -> 活动期间消耗25000钻（%s/25000） | F1136: 25000 | H1136: 1 | I1136: 0 | J1136: 0 | K1136: 10014 | L1136: 200
A1137: 32060 | B1137: =INT(RC[-1]/1000) -> 32 | C1137: 1 | D1137: 1 | E1137: ="活动期间消耗"&RC[1]&"钻（%s/"&RC[1]&"）" -> 活动期间消耗30000钻（%s/30000） | F1137: 30000 | H1137: 1 | I1137: 0 | J1137: 0 | K1137: 13506 | L1137: 1
A1138: 32061 | B1138: =INT(RC[-1]/1000) -> 32 | C1138: 1 | D1138: 1 | E1138: ="活动期间消耗"&RC[1]&"钻（%s/"&RC[1]&"）" -> 活动期间消耗35000钻（%s/35000） | F1138: 35000 | H1138: 1 | I1138: 0 | J1138: 0 | K1138: 13324 | L1138: 2
A1139: 32062 | B1139: =INT(RC[-1]/1000) -> 32 | C1139: 1 | D1139: 1 | E1139: ="活动期间消耗"&RC[1]&"钻（%s/"&RC[1]&"）" -> 活动期间消耗40000钻（%s/40000） | F1139: 40000 | H1139: 1 | I1139: 0 | J1139: 0 | K1139: 10008 | L1139: 1
A1140: 32063 | B1140: =INT(RC[-1]/1000) -> 32 | C1140: 1 | D1140: 1 | E1140: ="活动期间消耗"&RC[1]&"钻（%s/"&RC[1]&"）" -> 活动期间消耗45000钻（%s/45000） | F1140: 45000 | H1140: 1 | I1140: 0 | J1140: 0 | K1140: 10022 | L1140: 12
A1141: 32064 | B1141: =INT(RC[-1]/1000) -> 32 | C1141: 1 | D1141: 1 | E1141: ="活动期间消耗"&RC[1]&"钻（%s/"&RC[1]&"）" -> 活动期间消耗50000钻（%s/50000） | F1141: 50000 | H1141: 1 | I1141: 0 | J1141: 0 | K1141: 13505 | L1141: 1
A1142: 32072 | B1142: =INT(RC[-1]/1000) -> 32 | C1142: 1 | D1142: 1 | E1142: ="（每天一次）活动期间消耗任意数量钻石" -> （每天一次）活动期间消耗任意数量钻石 | F1142: 1 | H1142: 1 | I1142: 0 | J1142: 1 | K1142: 19103 | L1142: 5 | N1142: 4.活动期间累计消耗X钻石
A1143: 32073 | B1143: =INT(RC[-1]/1000) -> 32 | C1143: 1 | D1143: 1 | E1143: ="活动期间消耗"&RC[1]&"钻（%s/"&RC[1]&"）" -> 活动期间消耗200钻（%s/200） | F1143: 200 | H1143: 1 | I1143: 0 | J1143: 0 | K1143: 19006 | L1143: 200
A1144: 32074 | B1144: =INT(RC[-1]/1000) -> 32 | C1144: 1 | D1144: 1 | E1144: ="活动期间消耗"&RC[1]&"钻（%s/"&RC[1]&"）" -> 活动期间消耗500钻（%s/500） | F1144: 500 | H1144: 1 | I1144: 0 | J1144: 0 | K1144: 42301 | L1144: 2
A1145: 32075 | B1145: =INT(RC[-1]/1000) -> 32 | C1145: 1 | D1145: 1 | E1145: ="活动期间消耗"&RC[1]&"钻（%s/"&RC[1]&"）" -> 活动期间消耗1000钻（%s/1000） | F1145: 1000 | H1145: 1 | I1145: 0 | J1145: 0 | K1145: 10022 | L1145: 20
A1146: 32076 | B1146: =INT(RC[-1]/1000) -> 32 | C1146: 1 | D1146: 1 | E1146: ="活动期间消耗"&RC[1]&"钻（%s/"&RC[1]&"）" -> 活动期间消耗2000钻（%s/2000） | F1146: 2000 | H1146: 1 | I1146: 0 | J1146: 0 | K1146: 10014 | L1146: 50
A1147: 32077 | B1147: =INT(RC[-1]/1000) -> 32 | C1147: 1 | D1147: 1 | E1147: ="活动期间消耗"&RC[1]&"钻（%s/"&RC[1]&"）" -> 活动期间消耗3000钻（%s/3000） | F1147: 3000 | H1147: 1 | I1147: 0 | J1147: 0 | K1147: 10010 | L1147: 200
A1148: 32078 | B1148: =INT(RC[-1]/1000) -> 32 | C1148: 1 | D1148: 1 | E1148: ="活动期间消耗"&RC[1]&"钻（%s/"&RC[1]&"）" -> 活动期间消耗5000钻（%s/5000） | F1148: 5000 | H1148: 1 | I1148: 0 | J1148: 0 | K1148: 13324 | L1148: 1
A1149: 32079 | B1149: =INT(RC[-1]/1000) -> 32 | C1149: 1 | D1149: 1 | E1149: ="活动期间消耗"&RC[1]&"钻（%s/"&RC[1]&"）" -> 活动期间消耗7000钻（%s/7000） | F1149: 7000 | H1149: 1 | I1149: 0 | J1149: 0 | K1149: 10008 | L1149: 600
A1150: 32080 | B1150: =INT(RC[-1]/1000) -> 32 | C1150: 1 | D1150: 1 | E1150: ="活动期间消耗"&RC[1]&"钻（%s/"&RC[1]&"）" -> 活动期间消耗10000钻（%s/10000） | F1150: 10000 | H1150: 1 | I1150: 0 | J1150: 0 | K1150: 13392 | L1150: 1
A1151: 32081 | B1151: =INT(RC[-1]/1000) -> 32 | C1151: 1 | D1151: 1 | E1151: ="活动期间消耗"&RC[1]&"钻（%s/"&RC[1]&"）" -> 活动期间消耗15000钻（%s/15000） | F1151: 15000 | H1151: 1 | I1151: 0 | J1151: 0 | K1151: 10022 | L1151: 100
A1152: 32082 | B1152: =INT(RC[-1]/1000) -> 32 | C1152: 1 | D1152: 1 | E1152: ="活动期间消耗"&RC[1]&"钻（%s/"&RC[1]&"）" -> 活动期间消耗20000钻（%s/20000） | F1152: 20000 | H1152: 1 | I1152: 0 | J1152: 0 | K1152: 80100 | L1152: 1
A1153: 32083 | B1153: =INT(RC[-1]/1000) -> 32 | C1153: 1 | D1153: 1 | E1153: ="活动期间消耗"&RC[1]&"钻（%s/"&RC[1]&"）" -> 活动期间消耗25000钻（%s/25000） | F1153: 25000 | H1153: 1 | I1153: 0 | J1153: 0 | K1153: 10014 | L1153: 200
A1154: 32084 | B1154: =INT(RC[-1]/1000) -> 32 | C1154: 1 | D1154: 1 | E1154: ="活动期间消耗"&RC[1]&"钻（%s/"&RC[1]&"）" -> 活动期间消耗30000钻（%s/30000） | F1154: 30000 | H1154: 1 | I1154: 0 | J1154: 0 | K1154: 80100 | L1154: 1
A1155: 32085 | B1155: =INT(RC[-1]/1000) -> 32 | C1155: 1 | D1155: 1 | E1155: ="活动期间消耗"&RC[1]&"钻（%s/"&RC[1]&"）" -> 活动期间消耗35000钻（%s/35000） | F1155: 35000 | H1155: 1 | I1155: 0 | J1155: 0 | K1155: 10010 | L1155: 600
A1156: 32086 | B1156: =INT(RC[-1]/1000) -> 32 | C1156: 1 | D1156: 1 | E1156: ="活动期间消耗"&RC[1]&"钻（%s/"&RC[1]&"）" -> 活动期间消耗40000钻（%s/40000） | F1156: 40000 | H1156: 1 | I1156: 0 | J1156: 0 | K1156: 80100 | L1156: 1
A1157: 32087 | B1157: =INT(RC[-1]/1000) -> 32 | C1157: 1 | D1157: 1 | E1157: ="活动期间消耗"&RC[1]&"钻（%s/"&RC[1]&"）" -> 活动期间消耗45000钻（%s/45000） | F1157: 45000 | H1157: 1 | I1157: 0 | J1157: 0 | K1157: 13324 | L1157: 2
A1158: 32088 | B1158: =INT(RC[-1]/1000) -> 32 | C1158: 1 | D1158: 1 | E1158: ="活动期间消耗"&RC[1]&"钻（%s/"&RC[1]&"）" -> 活动期间消耗50000钻（%s/50000） | F1158: 50000 | H1158: 1 | I1158: 0 | J1158: 0 | K1158: 80100 | L1158: 1
A1159: 32089 | B1159: =INT(RC[-1]/1000) -> 32 | C1159: 1 | D1159: 1 | E1159: ="（每天一次）活动期间消耗任意数量钻石" -> （每天一次）活动期间消耗任意数量钻石 | F1159: 1 | H1159: 1 | I1159: 0 | J1159: 1 | K1159: 10003 | L1159: 25 | N1159: 4.活动期间累计消耗X钻石
A1160: 32090 | B1160: =INT(RC[-1]/1000) -> 32 | C1160: 1 | D1160: 1 | E1160: ="活动期间消耗"&RC[1]&"钻（%s/"&RC[1]&"）" -> 活动期间消耗400钻（%s/400） | F1160: 400 | H1160: 1 | I1160: 0 | J1160: 0 | K1160: 10003 | L1160: 50
A1161: 32091 | B1161: =INT(RC[-1]/1000) -> 32 | C1161: 1 | D1161: 1 | E1161: ="活动期间消耗"&RC[1]&"钻（%s/"&RC[1]&"）" -> 活动期间消耗2000钻（%s/2000） | F1161: 2000 | H1161: 1 | I1161: 0 | J1161: 0 | K1161: 10003 | L1161: 100
A1162: 32092 | B1162: =INT(RC[-1]/1000) -> 32 | C1162: 1 | D1162: 1 | E1162: ="活动期间消耗"&RC[1]&"钻（%s/"&RC[1]&"）" -> 活动期间消耗4000钻（%s/4000） | F1162: 4000 | H1162: 1 | I1162: 0 | J1162: 0 | K1162: 10003 | L1162: 125
A1163: 32093 | B1163: =INT(RC[-1]/1000) -> 32 | C1163: 1 | D1163: 1 | E1163: ="活动期间消耗"&RC[1]&"钻（%s/"&RC[1]&"）" -> 活动期间消耗8000钻（%s/8000） | F1163: 8000 | H1163: 1 | I1163: 0 | J1163: 0 | K1163: 10003 | L1163: 200
A1164: 32094 | B1164: =INT(RC[-1]/1000) -> 32 | C1164: 1 | D1164: 1 | E1164: ="活动期间消耗"&RC[1]&"钻（%s/"&RC[1]&"）" -> 活动期间消耗12000钻（%s/12000） | F1164: 12000 | H1164: 1 | I1164: 0 | J1164: 0 | K1164: 10003 | L1164: 200
A1165: 32095 | B1165: =INT(RC[-1]/1000) -> 32 | C1165: 1 | D1165: 1 | E1165: ="活动期间消耗"&RC[1]&"钻（%s/"&RC[1]&"）" -> 活动期间消耗20000钻（%s/20000） | F1165: 20000 | H1165: 1 | I1165: 0 | J1165: 0 | K1165: 10003 | L1165: 350
A1166: 32096 | B1166: =INT(RC[-1]/1000) -> 32 | C1166: 1 | D1166: 1 | E1166: ="活动期间消耗"&RC[1]&"钻（%s/"&RC[1]&"）" -> 活动期间消耗28000钻（%s/28000） | F1166: 28000 | H1166: 1 | I1166: 0 | J1166: 0 | K1166: 10003 | L1166: 350
A1167: 32097 | B1167: =INT(RC[-1]/1000) -> 32 | C1167: 1 | D1167: 1 | E1167: ="活动期间消耗"&RC[1]&"钻（%s/"&RC[1]&"）" -> 活动期间消耗40000钻（%s/40000） | F1167: 40000 | H1167: 1 | I1167: 0 | J1167: 0 | K1167: 10003 | L1167: 500
A1168: 32098 | B1168: =INT(RC[-1]/1000) -> 32 | C1168: 1 | D1168: 1 | E1168: ="活动期间消耗"&RC[1]&"钻（%s/"&RC[1]&"）" -> 活动期间消耗60000钻（%s/60000） | F1168: 60000 | H1168: 1 | I1168: 0 | J1168: 0 | K1168: 10003 | L1168: 1000
A1169: 32099 | B1169: =INT(RC[-1]/1000) -> 32 | C1169: 1 | D1169: 1 | E1169: ="活动期间消耗"&RC[1]&"钻（%s/"&RC[1]&"）" -> 活动期间消耗80000钻（%s/80000） | F1169: 80000 | H1169: 1 | I1169: 0 | J1169: 0 | K1169: 10003 | L1169: 1000
A1170: 32100 | B1170: =INT(RC[-1]/1000) -> 32 | C1170: 1 | D1170: 1 | E1170: ="活动期间消耗"&RC[1]&"钻（%s/"&RC[1]&"）" -> 活动期间消耗100000钻（%s/100000） | F1170: 100000 | H1170: 1 | I1170: 0 | J1170: 0 | K1170: 10003 | L1170: 1000
A1171: 32101 | B1171: =INT(RC[-1]/1000) -> 32 | C1171: 1 | D1171: 1 | E1171: ="活动期间消耗"&RC[1]&"钻（%s/"&RC[1]&"）" -> 活动期间消耗120000钻（%s/120000） | F1171: 120000 | H1171: 1 | I1171: 0 | J1171: 0 | K1171: 10003 | L1171: 1000
A1172: 32102 | B1172: =INT(RC[-1]/1000) -> 32 | C1172: 1 | D1172: 1 | E1172: ="活动期间消耗"&RC[1]&"钻（%s/"&RC[1]&"）" -> 活动期间消耗140000钻（%s/140000） | F1172: 140000 | H1172: 1 | I1172: 0 | J1172: 0 | K1172: 10003 | L1172: 1000
A1173: 32103 | B1173: =INT(RC[-1]/1000) -> 32 | C1173: 1 | D1173: 1 | E1173: ="活动期间消耗"&RC[1]&"钻（%s/"&RC[1]&"）" -> 活动期间消耗160000钻（%s/160000） | F1173: 160000 | H1173: 1 | I1173: 0 | J1173: 0 | K1173: 10003 | L1173: 1000
A1174: 32104 | B1174: =INT(RC[-1]/1000) -> 32 | C1174: 1 | D1174: 1 | E1174: ="活动期间消耗"&RC[1]&"钻（%s/"&RC[1]&"）" -> 活动期间消耗180000钻（%s/180000） | F1174: 180000 | H1174: 1 | I1174: 0 | J1174: 0 | K1174: 10003 | L1174: 1000
A1175: 32105 | B1175: =INT(RC[-1]/1000) -> 32 | C1175: 1 | D1175: 1 | E1175: ="活动期间消耗"&RC[1]&"钻（%s/"&RC[1]&"）" -> 活动期间消耗200000钻（%s/200000） | F1175: 200000 | H1175: 1 | I1175: 0 | J1175: 0 | K1175: 10003 | L1175: 1000
A1176: 32106 | B1176: =INT(RC[-1]/1000) -> 32 | C1176: 1 | D1176: 1 | E1176: ="（每天一次）活动期间消耗任意数量钻石" -> （每天一次）活动期间消耗任意数量钻石 | F1176: 1 | H1176: 1 | I1176: 0 | J1176: 1 | K1176: 10003 | L1176: 25 | N1176: 4.活动期间累计消耗X钻石
A1177: 32107 | B1177: =INT(RC[-1]/1000) -> 32 | C1177: 1 | D1177: 1 | E1177: ="活动期间消耗"&RC[1]&"钻（%s/"&RC[1]&"）" -> 活动期间消耗400钻（%s/400） | F1177: 400 | H1177: 1 | I1177: 0 | J1177: 0 | K1177: 10003 | L1177: 25
A1178: 32108 | B1178: =INT(RC[-1]/1000) -> 32 | C1178: 1 | D1178: 1 | E1178: ="活动期间消耗"&RC[1]&"钻（%s/"&RC[1]&"）" -> 活动期间消耗2000钻（%s/2000） | F1178: 2000 | H1178: 1 | I1178: 0 | J1178: 0 | K1178: 42301|10003|33400 | L1178: 1|50|2
A1179: 32109 | B1179: =INT(RC[-1]/1000) -> 32 | C1179: 1 | D1179: 1 | E1179: ="活动期间消耗"&RC[1]&"钻（%s/"&RC[1]&"）" -> 活动期间消耗4000钻（%s/4000） | F1179: 4000 | H1179: 1 | I1179: 0 | J1179: 0 | K1179: 42301|10003|33400 | L1179: 2|65|2
A1180: 32110 | B1180: =INT(RC[-1]/1000) -> 32 | C1180: 1 | D1180: 1 | E1180: ="活动期间消耗"&RC[1]&"钻（%s/"&RC[1]&"）" -> 活动期间消耗8000钻（%s/8000） | F1180: 8000 | H1180: 1 | I1180: 0 | J1180: 0 | K1180: 10100|10003|33400 | L1180: 2|100|2
A1181: 32111 | B1181: =INT(RC[-1]/1000) -> 32 | C1181: 1 | D1181: 1 | E1181: ="活动期间消耗"&RC[1]&"钻（%s/"&RC[1]&"）" -> 活动期间消耗12000钻（%s/12000） | F1181: 12000 | H1181: 1 | I1181: 0 | J1181: 0 | K1181: 10014|10003|33400 | L1181: 50|100|2
A1182: 32112 | B1182: =INT(RC[-1]/1000) -> 32 | C1182: 1 | D1182: 1 | E1182: ="活动期间消耗"&RC[1]&"钻（%s/"&RC[1]&"）" -> 活动期间消耗20000钻（%s/20000） | F1182: 20000 | H1182: 1 | I1182: 0 | J1182: 0 | K1182: 13324|10003|42301|13392 | L1182: 1|160|3|1
A1183: 32113 | B1183: =INT(RC[-1]/1000) -> 32 | C1183: 1 | D1183: 1 | E1183: ="活动期间消耗"&RC[1]&"钻（%s/"&RC[1]&"）" -> 活动期间消耗28000钻（%s/28000） | F1183: 28000 | H1183: 1 | I1183: 0 | J1183: 0 | K1183: 10112|10003|42301|33400 | L1183: 25|160|4|3
A1184: 32114 | B1184: =INT(RC[-1]/1000) -> 32 | C1184: 1 | D1184: 1 | E1184: ="活动期间消耗"&RC[1]&"钻（%s/"&RC[1]&"）" -> 活动期间消耗40000钻（%s/40000） | F1184: 40000 | H1184: 1 | I1184: 0 | J1184: 0 | K1184: 10008|10003|42301|33400|13392 | L1184: 300|250|6|3|1
A1185: 32115 | B1185: =INT(RC[-1]/1000) -> 32 | C1185: 1 | D1185: 1 | E1185: ="活动期间消耗"&RC[1]&"钻（%s/"&RC[1]&"）" -> 活动期间消耗60000钻（%s/60000） | F1185: 60000 | H1185: 1 | I1185: 0 | J1185: 0 | K1185: 70300|10004|42301|33400 | L1185: 10|100|10|4
A1186: 32116 | B1186: =INT(RC[-1]/1000) -> 32 | C1186: 1 | D1186: 1 | E1186: ="活动期间消耗"&RC[1]&"钻（%s/"&RC[1]&"）" -> 活动期间消耗80000钻（%s/80000） | F1186: 80000 | H1186: 1 | I1186: 0 | J1186: 0 | K1186: 10112|42301|10004|33400|13417 | L1186: 25|12|100|4|1
A1187: 32117 | B1187: =INT(RC[-1]/1000) -> 32 | C1187: 1 | D1187: 1 | E1187: ="活动期间消耗"&RC[1]&"钻（%s/"&RC[1]&"）" -> 活动期间消耗100000钻（%s/100000） | F1187: 100000 | H1187: 1 | I1187: 0 | J1187: 0 | K1187: 10014|10004|42301|33400 | L1187: 100|125|12|4
A1188: 32118 | B1188: =INT(RC[-1]/1000) -> 32 | C1188: 1 | D1188: 1 | E1188: ="活动期间消耗"&RC[1]&"钻（%s/"&RC[1]&"）" -> 活动期间消耗120000钻（%s/120000） | F1188: 120000 | H1188: 1 | I1188: 0 | J1188: 0 | K1188: 13324|10014|10004|33400|13418 | L1188: 1|100|125|5|1
A1189: 32119 | B1189: =INT(RC[-1]/1000) -> 32 | C1189: 1 | D1189: 1 | E1189: ="活动期间消耗"&RC[1]&"钻（%s/"&RC[1]&"）" -> 活动期间消耗140000钻（%s/140000） | F1189: 140000 | H1189: 1 | I1189: 0 | J1189: 0 | K1189: 10014|42301|10004|33400 | L1189: 100|12|125|5
A1190: 32120 | B1190: =INT(RC[-1]/1000) -> 32 | C1190: 1 | D1190: 1 | E1190: ="活动期间消耗"&RC[1]&"钻（%s/"&RC[1]&"）" -> 活动期间消耗160000钻（%s/160000） | F1190: 160000 | H1190: 1 | I1190: 0 | J1190: 0 | K1190: 10008|10004|42301|33400|30501 | L1190: 500|150|12|7|1
A1191: 32121 | B1191: =INT(RC[-1]/1000) -> 32 | C1191: 1 | D1191: 1 | E1191: ="活动期间消耗"&RC[1]&"钻（%s/"&RC[1]&"）" -> 活动期间消耗180000钻（%s/180000） | F1191: 180000 | H1191: 1 | I1191: 0 | J1191: 0 | K1191: 70300|10004|10014|33400 | L1191: 40|150|150|7
A1192: 32122 | B1192: =INT(RC[-1]/1000) -> 32 | C1192: 1 | D1192: 1 | E1192: ="活动期间消耗"&RC[1]&"钻（%s/"&RC[1]&"）" -> 活动期间消耗200000钻（%s/200000） | F1192: 200000 | H1192: 1 | I1192: 0 | J1192: 0 | K1192: 10014|42301|10004|33400|30521 | L1192: 150|14|150|7|1
A1193: 32123 | B1193: =INT(RC[-1]/1000) -> 32 | C1193: 1 | D1193: 1 | E1193: ="（每天一次）活动期间消耗任意数量钻石" -> （每天一次）活动期间消耗任意数量钻石 | F1193: 1 | H1193: 1 | I1193: 0 | J1193: 1 | K1193: 10003 | L1193: 25 | N1193: 4.活动期间累计消耗X钻石
A1194: 32124 | B1194: =INT(RC[-1]/1000) -> 32 | C1194: 1 | D1194: 1 | E1194: ="活动期间消耗"&RC[1]&"钻（%s/"&RC[1]&"）" -> 活动期间消耗400钻（%s/400） | F1194: 400 | H1194: 1 | I1194: 0 | J1194: 0 | K1194: 10003|33400 | L1194: 50|1
A1195: 32125 | B1195: =INT(RC[-1]/1000) -> 32 | C1195: 1 | D1195: 1 | E1195: ="活动期间消耗"&RC[1]&"钻（%s/"&RC[1]&"）" -> 活动期间消耗2000钻（%s/2000） | F1195: 2000 | H1195: 1 | I1195: 0 | J1195: 0 | K1195: 42301|10003|33400 | L1195: 1|100|2
A1196: 32126 | B1196: =INT(RC[-1]/1000) -> 32 | C1196: 1 | D1196: 1 | E1196: ="活动期间消耗"&RC[1]&"钻（%s/"&RC[1]&"）" -> 活动期间消耗4000钻（%s/4000） | F1196: 4000 | H1196: 1 | I1196: 0 | J1196: 0 | K1196: 42301|10003|33400 | L1196: 2|130|2
A1197: 32127 | B1197: =INT(RC[-1]/1000) -> 32 | C1197: 1 | D1197: 1 | E1197: ="活动期间消耗"&RC[1]&"钻（%s/"&RC[1]&"）" -> 活动期间消耗8000钻（%s/8000） | F1197: 8000 | H1197: 1 | I1197: 0 | J1197: 0 | K1197: 10100|10003|33400 | L1197: 2|200|2
A1198: 32128 | B1198: =INT(RC[-1]/1000) -> 32 | C1198: 1 | D1198: 1 | E1198: ="活动期间消耗"&RC[1]&"钻（%s/"&RC[1]&"）" -> 活动期间消耗12000钻（%s/12000） | F1198: 12000 | H1198: 1 | I1198: 0 | J1198: 0 | K1198: 10014|10003|33400 | L1198: 50|200|2
A1199: 32129 | B1199: =INT(RC[-1]/1000) -> 32 | C1199: 1 | D1199: 1 | E1199: ="活动期间消耗"&RC[1]&"钻（%s/"&RC[1]&"）" -> 活动期间消耗20000钻（%s/20000） | F1199: 20000 | H1199: 1 | I1199: 0 | J1199: 0 | K1199: 13324|10003|33400 | L1199: 1|350|3
A1200: 32130 | B1200: =INT(RC[-1]/1000) -> 32 | C1200: 1 | D1200: 1 | E1200: ="活动期间消耗"&RC[1]&"钻（%s/"&RC[1]&"）" -> 活动期间消耗28000钻（%s/28000） | F1200: 28000 | H1200: 1 | I1200: 0 | J1200: 0 | K1200: 10112|10003|42301|33400 | L1200: 50|350|4|3
A1201: 32131 | B1201: =INT(RC[-1]/1000) -> 32 | C1201: 1 | D1201: 1 | E1201: ="活动期间消耗"&RC[1]&"钻（%s/"&RC[1]&"）" -> 活动期间消耗40000钻（%s/40000） | F1201: 40000 | H1201: 1 | I1201: 0 | J1201: 0 | K1201: 10008|10003|42301|33400 | L1201: 600|500|6|3
A1202: 32132 | B1202: =INT(RC[-1]/1000) -> 32 | C1202: 1 | D1202: 1 | E1202: ="活动期间消耗"&RC[1]&"钻（%s/"&RC[1]&"）" -> 活动期间消耗60000钻（%s/60000） | F1202: 60000 | H1202: 1 | I1202: 0 | J1202: 0 | K1202: 70300|10004|42301|33400 | L1202: 20|200|10|4
A1203: 32133 | B1203: =INT(RC[-1]/1000) -> 32 | C1203: 1 | D1203: 1 | E1203: ="活动期间消耗"&RC[1]&"钻（%s/"&RC[1]&"）" -> 活动期间消耗80000钻（%s/80000） | F1203: 80000 | H1203: 1 | I1203: 0 | J1203: 0 | K1203: 10112|42301|10004|33400|13417 | L1203: 50|12|200|4|1
A1204: 32134 | B1204: =INT(RC[-1]/1000) -> 32 | C1204: 1 | D1204: 1 | E1204: ="活动期间消耗"&RC[1]&"钻（%s/"&RC[1]&"）" -> 活动期间消耗100000钻（%s/100000） | F1204: 100000 | H1204: 1 | I1204: 0 | J1204: 0 | K1204: 10014|10004|42301|33400 | L1204: 100|250|12|4
A1205: 32135 | B1205: =INT(RC[-1]/1000) -> 32 | C1205: 1 | D1205: 1 | E1205: ="活动期间消耗"&RC[1]&"钻（%s/"&RC[1]&"）" -> 活动期间消耗120000钻（%s/120000） | F1205: 120000 | H1205: 1 | I1205: 0 | J1205: 0 | K1205: 13324|10014|10004|33400|13418 | L1205: 1|200|250|5|1
A1206: 32136 | B1206: =INT(RC[-1]/1000) -> 32 | C1206: 1 | D1206: 1 | E1206: ="活动期间消耗"&RC[1]&"钻（%s/"&RC[1]&"）" -> 活动期间消耗140000钻（%s/140000） | F1206: 140000 | H1206: 1 | I1206: 0 | J1206: 0 | K1206: 10014|42301|10004|33400 | L1206: 200|12|250|5
A1207: 32137 | B1207: =INT(RC[-1]/1000) -> 32 | C1207: 1 | D1207: 1 | E1207: ="活动期间消耗"&RC[1]&"钻（%s/"&RC[1]&"）" -> 活动期间消耗160000钻（%s/160000） | F1207: 160000 | H1207: 1 | I1207: 0 | J1207: 0 | K1207: 10008|10004|42301|33400|30501 | L1207: 1000|300|12|7|1
A1208: 32138 | B1208: =INT(RC[-1]/1000) -> 32 | C1208: 1 | D1208: 1 | E1208: ="活动期间消耗"&RC[1]&"钻（%s/"&RC[1]&"）" -> 活动期间消耗180000钻（%s/180000） | F1208: 180000 | H1208: 1 | I1208: 0 | J1208: 0 | K1208: 70300|10004|10014|33400 | L1208: 40|300|300|7
A1209: 32139 | B1209: =INT(RC[-1]/1000) -> 32 | C1209: 1 | D1209: 1 | E1209: ="活动期间消耗"&RC[1]&"钻（%s/"&RC[1]&"）" -> 活动期间消耗200000钻（%s/200000） | F1209: 200000 | H1209: 1 | I1209: 0 | J1209: 0 | K1209: 10014|42301|10004|33400|30521 | L1209: 300|14|300|7|1
A1210: 32140 | B1210: =INT(RC[-1]/1000) -> 32 | C1210: 1 | D1210: 1 | E1210: ="（每天一次）活动期间消耗任意数量钻石" -> （每天一次）活动期间消耗任意数量钻石 | F1210: 1 | H1210: 1 | I1210: 0 | J1210: 1 | K1210: 10022 | L1210: 5 | N1210: 4.活动期间累计消耗X钻石
A1211: 32141 | B1211: =INT(RC[-1]/1000) -> 32 | C1211: 1 | D1211: 1 | E1211: ="活动期间消耗"&RC[1]&"钻（%s/"&RC[1]&"）" -> 活动期间消耗400钻（%s/400） | F1211: 400 | H1211: 1 | I1211: 0 | J1211: 0 | K1211: 10022|33400 | L1211: 5|1
A1212: 32142 | B1212: =INT(RC[-1]/1000) -> 32 | C1212: 1 | D1212: 1 | E1212: ="活动期间消耗"&RC[1]&"钻（%s/"&RC[1]&"）" -> 活动期间消耗2000钻（%s/2000） | F1212: 2000 | H1212: 1 | I1212: 0 | J1212: 0 | K1212: 42301|10022|33400 | L1212: 1|5|2
A1213: 32143 | B1213: =INT(RC[-1]/1000) -> 32 | C1213: 1 | D1213: 1 | E1213: ="活动期间消耗"&RC[1]&"钻（%s/"&RC[1]&"）" -> 活动期间消耗4000钻（%s/4000） | F1213: 4000 | H1213: 1 | I1213: 0 | J1213: 0 | K1213: 42301|10022|33400 | L1213: 2|5|2
A1214: 32144 | B1214: =INT(RC[-1]/1000) -> 32 | C1214: 1 | D1214: 1 | E1214: ="活动期间消耗"&RC[1]&"钻（%s/"&RC[1]&"）" -> 活动期间消耗8000钻（%s/8000） | F1214: 8000 | H1214: 1 | I1214: 0 | J1214: 0 | K1214: 10004|10022|33400 | L1214: 50|10|2
A1215: 32145 | B1215: =INT(RC[-1]/1000) -> 32 | C1215: 1 | D1215: 1 | E1215: ="活动期间消耗"&RC[1]&"钻（%s/"&RC[1]&"）" -> 活动期间消耗12000钻（%s/12000） | F1215: 12000 | H1215: 1 | I1215: 0 | J1215: 0 | K1215: 10014|10022|33400 | L1215: 25|10|2
A1216: 32146 | B1216: =INT(RC[-1]/1000) -> 32 | C1216: 1 | D1216: 1 | E1216: ="活动期间消耗"&RC[1]&"钻（%s/"&RC[1]&"）" -> 活动期间消耗20000钻（%s/20000） | F1216: 20000 | H1216: 1 | I1216: 0 | J1216: 0 | K1216: 13324|10022|33400|13392 | L1216: 1|15|3|1
A1217: 32147 | B1217: =INT(RC[-1]/1000) -> 32 | C1217: 1 | D1217: 1 | E1217: ="活动期间消耗"&RC[1]&"钻（%s/"&RC[1]&"）" -> 活动期间消耗28000钻（%s/28000） | F1217: 28000 | H1217: 1 | I1217: 0 | J1217: 0 | K1217: 10112|10022|42301|33400 | L1217: 25|20|4|3
A1218: 32148 | B1218: =INT(RC[-1]/1000) -> 32 | C1218: 1 | D1218: 1 | E1218: ="活动期间消耗"&RC[1]&"钻（%s/"&RC[1]&"）" -> 活动期间消耗40000钻（%s/40000） | F1218: 40000 | H1218: 1 | I1218: 0 | J1218: 0 | K1218: 10008|10022|42301|33400|13392 | L1218: 300|250|6|3|1
A1219: 32149 | B1219: =INT(RC[-1]/1000) -> 32 | C1219: 1 | D1219: 1 | E1219: ="活动期间消耗"&RC[1]&"钻（%s/"&RC[1]&"）" -> 活动期间消耗60000钻（%s/60000） | F1219: 60000 | H1219: 1 | I1219: 0 | J1219: 0 | K1219: 70300|10022|42301|33400 | L1219: 10|30|10|4
A1220: 32150 | B1220: =INT(RC[-1]/1000) -> 32 | C1220: 1 | D1220: 1 | E1220: ="活动期间消耗"&RC[1]&"钻（%s/"&RC[1]&"）" -> 活动期间消耗80000钻（%s/80000） | F1220: 80000 | H1220: 1 | I1220: 0 | J1220: 0 | K1220: 10112|42301|10022|33400|13417 | L1220: 25|12|35|4|1
A1221: 32151 | B1221: =INT(RC[-1]/1000) -> 32 | C1221: 1 | D1221: 1 | E1221: ="活动期间消耗"&RC[1]&"钻（%s/"&RC[1]&"）" -> 活动期间消耗100000钻（%s/100000） | F1221: 100000 | H1221: 1 | I1221: 0 | J1221: 0 | K1221: 10014|10022|42301|33400 | L1221: 100|40|12|4
A1222: 32152 | B1222: =INT(RC[-1]/1000) -> 32 | C1222: 1 | D1222: 1 | E1222: ="活动期间消耗"&RC[1]&"钻（%s/"&RC[1]&"）" -> 活动期间消耗120000钻（%s/120000） | F1222: 120000 | H1222: 1 | I1222: 0 | J1222: 0 | K1222: 13324|10014|10022|33400|13418 | L1222: 1|100|45|5|1
A1223: 32153 | B1223: =INT(RC[-1]/1000) -> 32 | C1223: 1 | D1223: 1 | E1223: ="活动期间消耗"&RC[1]&"钻（%s/"&RC[1]&"）" -> 活动期间消耗140000钻（%s/140000） | F1223: 140000 | H1223: 1 | I1223: 0 | J1223: 0 | K1223: 42301|10004|10022|33400 | L1223: 12|125|50|5
A1224: 32154 | B1224: =INT(RC[-1]/1000) -> 32 | C1224: 1 | D1224: 1 | E1224: ="活动期间消耗"&RC[1]&"钻（%s/"&RC[1]&"）" -> 活动期间消耗160000钻（%s/160000） | F1224: 160000 | H1224: 1 | I1224: 0 | J1224: 0 | K1224: 10008|10022|42301|33400|30501 | L1224: 500|55|12|7|1
A1225: 32155 | B1225: =INT(RC[-1]/1000) -> 32 | C1225: 1 | D1225: 1 | E1225: ="活动期间消耗"&RC[1]&"钻（%s/"&RC[1]&"）" -> 活动期间消耗180000钻（%s/180000） | F1225: 180000 | H1225: 1 | I1225: 0 | J1225: 0 | K1225: 70300|10022|10014|33400 | L1225: 40|60|150|7
A1226: 32156 | B1226: =INT(RC[-1]/1000) -> 32 | C1226: 1 | D1226: 1 | E1226: ="活动期间消耗"&RC[1]&"钻（%s/"&RC[1]&"）" -> 活动期间消耗200000钻（%s/200000） | F1226: 200000 | H1226: 1 | I1226: 0 | J1226: 0 | K1226: 10014|42301|10022|33400|30521 | L1226: 150|14|65|7|1
A1227: 33000 | B1227: =INT(RC[-1]/1000) -> 33 | C1227: 1 | D1227: 1 | E1227: =IF(RC[5]=1,"(每日任务)：",)&"英雄培养"&RC[1]&"次（%s/"&RC[1]&"）" -> (每日任务)：英雄培养5次（%s/5） | F1227: 5 | H1227: 1 | I1227: 0 | J1227: 1 | K1227: 10022 | L1227: 5 | N1227: 5.培养X次，点击一次算一次
A1228: 33001 | B1228: =INT(RC[-1]/1000) -> 33 | C1228: 1 | D1228: 1 | E1228: =IF(RC[5]=1,"(每日任务)：",)&"英雄培养"&RC[1]&"次（%s/"&RC[1]&"）" -> 英雄培养50次（%s/50） | F1228: 50 | H1228: 1 | I1228: 0 | J1228: 0 | K1228: 10022 | L1228: 10
A1229: 33002 | B1229: =INT(RC[-1]/1000) -> 33 | C1229: 1 | D1229: 1 | E1229: =IF(RC[5]=1,"(每日任务)：",)&"英雄培养"&RC[1]&"次（%s/"&RC[1]&"）" -> 英雄培养100次（%s/100） | F1229: 100 | H1229: 1 | I1229: 0 | J1229: 0 | K1229: 10022 | L1229: 10
A1230: 33003 | B1230: =INT(RC[-1]/1000) -> 33 | C1230: 1 | D1230: 1 | E1230: =IF(RC[5]=1,"(每日任务)：",)&"英雄培养"&RC[1]&"次（%s/"&RC[1]&"）" -> 英雄培养200次（%s/200） | F1230: 200 | H1230: 1 | I1230: 0 | J1230: 0 | K1230: 10022 | L1230: 15
A1231: 33004 | B1231: =INT(RC[-1]/1000) -> 33 | C1231: 1 | D1231: 1 | E1231: =IF(RC[5]=1,"(每日任务)：",)&"英雄培养"&RC[1]&"次（%s/"&RC[1]&"）" -> 英雄培养300次（%s/300） | F1231: 300 | H1231: 1 | I1231: 0 | J1231: 0 | K1231: 10022 | L1231: 15
A1232: 33005 | B1232: =INT(RC[-1]/1000) -> 33 | C1232: 1 | D1232: 1 | E1232: =IF(RC[5]=1,"(每日任务)：",)&"英雄培养"&RC[1]&"次（%s/"&RC[1]&"）" -> 英雄培养400次（%s/400） | F1232: 400 | H1232: 1 | I1232: 0 | J1232: 0 | K1232: 10022 | L1232: 15
A1233: 33006 | B1233: =INT(RC[-1]/1000) -> 33 | C1233: 1 | D1233: 1 | E1233: =IF(RC[5]=1,"(每日任务)：",)&"英雄培养"&RC[1]&"次（%s/"&RC[1]&"）" -> 英雄培养600次（%s/600） | F1233: 600 | H1233: 1 | I1233: 0 | J1233: 0 | K1233: 10022 | L1233: 20
A1234: 33007 | B1234: =INT(RC[-1]/1000) -> 33 | C1234: 1 | D1234: 1 | E1234: =IF(RC[5]=1,"(每日任务)：",)&"英雄培养"&RC[1]&"次（%s/"&RC[1]&"）" -> 英雄培养800次（%s/800） | F1234: 800 | H1234: 1 | I1234: 0 | J1234: 0 | K1234: 10022 | L1234: 20
A1235: 33008 | B1235: =INT(RC[-1]/1000) -> 33 | C1235: 1 | D1235: 1 | E1235: =IF(RC[5]=1,"(每日任务)：",)&"英雄培养"&RC[1]&"次（%s/"&RC[1]&"）" -> 英雄培养1000次（%s/1000） | F1235: 1000 | H1235: 1 | I1235: 0 | J1235: 0 | K1235: 10022 | L1235: 20
A1236: 33009 | B1236: =INT(RC[-1]/1000) -> 33 | C1236: 1 | D1236: 1 | E1236: =IF(RC[5]=1,"(每日任务)：",)&"英雄培养"&RC[1]&"次（%s/"&RC[1]&"）" -> 英雄培养1500次（%s/1500） | F1236: 1500 | H1236: 1 | I1236: 0 | J1236: 0 | K1236: 10022 | L1236: 30
A1237: 33010 | B1237: =INT(RC[-1]/1000) -> 33 | C1237: 1 | D1237: 1 | E1237: =IF(RC[5]=1,"(每日任务)：",)&"英雄培养"&RC[1]&"次（%s/"&RC[1]&"）" -> (每日任务)：英雄培养1次（%s/1） | F1237: 1 | H1237: 1 | I1237: 0 | J1237: 1 | K1237: 10101 | L1237: 1
A1238: 33011 | B1238: =INT(RC[-1]/1000) -> 33 | C1238: 1 | D1238: 1 | E1238: =IF(RC[5]=1,"(每日任务)：",)&"英雄培养"&RC[1]&"次（%s/"&RC[1]&"）" -> 英雄培养50次（%s/50） | F1238: 50 | H1238: 1 | I1238: 0 | J1238: 0 | K1238: 80010|80000|10100 | L1238: 1|1|1
A1239: 33012 | B1239: =INT(RC[-1]/1000) -> 33 | C1239: 1 | D1239: 1 | E1239: =IF(RC[5]=1,"(每日任务)：",)&"英雄培养"&RC[1]&"次（%s/"&RC[1]&"）" -> 英雄培养100次（%s/100） | F1239: 100 | H1239: 1 | I1239: 0 | J1239: 0 | K1239: 80011|10100 | L1239: 1|1
A1240: 33013 | B1240: =INT(RC[-1]/1000) -> 33 | C1240: 1 | D1240: 1 | E1240: =IF(RC[5]=1,"(每日任务)：",)&"英雄培养"&RC[1]&"次（%s/"&RC[1]&"）" -> 英雄培养200次（%s/200） | F1240: 200 | H1240: 1 | I1240: 0 | J1240: 0 | K1240: 80001|10100 | L1240: 1|1
A1241: 33014 | B1241: =INT(RC[-1]/1000) -> 33 | C1241: 1 | D1241: 1 | E1241: =IF(RC[5]=1,"(每日任务)：",)&"英雄培养"&RC[1]&"次（%s/"&RC[1]&"）" -> 英雄培养300次（%s/300） | F1241: 300 | H1241: 1 | I1241: 0 | J1241: 0 | K1241: 13392 | L1241: 1
A1242: 33015 | B1242: =INT(RC[-1]/1000) -> 33 | C1242: 1 | D1242: 1 | E1242: =IF(RC[5]=1,"(每日任务)：",)&"英雄培养"&RC[1]&"次（%s/"&RC[1]&"）" -> 英雄培养400次（%s/400） | F1242: 400 | H1242: 1 | I1242: 0 | J1242: 0 | K1242: 13324 | L1242: 1
A1243: 33016 | B1243: =INT(RC[-1]/1000) -> 33 | C1243: 1 | D1243: 1 | E1243: =IF(RC[5]=1,"(每日任务)：",)&"英雄培养"&RC[1]&"次（%s/"&RC[1]&"）" -> 英雄培养600次（%s/600） | F1243: 600 | H1243: 1 | I1243: 0 | J1243: 0 | K1243: 80100 | L1243: 1
A1244: 33020 | B1244: =INT(RC[-1]/1000) -> 33 | C1244: 1 | D1244: 1 | E1244: =IF(RC[5]=1,"(每日任务)：",)&"英雄培养"&RC[1]&"次（%s/"&RC[1]&"）" -> (每日任务)：英雄培养10次（%s/10） | F1244: 10 | H1244: 1 | I1244: 0 | J1244: 1 | K1244: 10014 | L1244: 2 | N1244: 5.培养X次，点击一次算一次
A1245: 33021 | B1245: =INT(RC[-1]/1000) -> 33 | C1245: 1 | D1245: 1 | E1245: =IF(RC[5]=1,"(每日任务)：",)&"英雄培养"&RC[1]&"次（%s/"&RC[1]&"）" -> 英雄培养100次（%s/100） | F1245: 100 | H1245: 1 | I1245: 0 | J1245: 0 | K1245: 19103 | L1245: 10
A1246: 33022 | B1246: =INT(RC[-1]/1000) -> 33 | C1246: 1 | D1246: 1 | E1246: =IF(RC[5]=1,"(每日任务)：",)&"英雄培养"&RC[1]&"次（%s/"&RC[1]&"）" -> 英雄培养200次（%s/200） | F1246: 200 | H1246: 1 | I1246: 0 | J1246: 0 | K1246: 19103 | L1246: 20
A1247: 33023 | B1247: =INT(RC[-1]/1000) -> 33 | C1247: 1 | D1247: 1 | E1247: =IF(RC[5]=1,"(每日任务)：",)&"英雄培养"&RC[1]&"次（%s/"&RC[1]&"）" -> 英雄培养300次（%s/300） | F1247: 300 | H1247: 1 | I1247: 0 | J1247: 0 | K1247: 19103 | L1247: 30
A1248: 33024 | B1248: =INT(RC[-1]/1000) -> 33 | C1248: 1 | D1248: 1 | E1248: =IF(RC[5]=1,"(每日任务)：",)&"英雄培养"&RC[1]&"次（%s/"&RC[1]&"）" -> 英雄培养400次（%s/400） | F1248: 400 | H1248: 1 | I1248: 0 | J1248: 0 | K1248: 19103 | L1248: 40
A1249: 33025 | B1249: =INT(RC[-1]/1000) -> 33 | C1249: 1 | D1249: 1 | E1249: =IF(RC[5]=1,"(每日任务)：",)&"英雄培养"&RC[1]&"次（%s/"&RC[1]&"）" -> 英雄培养600次（%s/600） | F1249: 600 | H1249: 1 | I1249: 0 | J1249: 0 | K1249: 19103 | L1249: 50
A1250: 33026 | B1250: =INT(RC[-1]/1000) -> 33 | C1250: 1 | D1250: 1 | E1250: =IF(RC[5]=1,"(每日任务)：",)&"英雄培养"&RC[1]&"次（%s/"&RC[1]&"）" -> 英雄培养800次（%s/800） | F1250: 800 | H1250: 1 | I1250: 0 | J1250: 0 | K1250: 19103 | L1250: 60
A1251: 33027 | B1251: =INT(RC[-1]/1000) -> 33 | C1251: 1 | D1251: 1 | E1251: =IF(RC[5]=1,"(每日任务)：",)&"英雄培养"&RC[1]&"次（%s/"&RC[1]&"）" -> 英雄培养1000次（%s/1000） | F1251: 1000 | H1251: 1 | I1251: 0 | J1251: 0 | K1251: 19103 | L1251: 70
A1252: 33028 | B1252: =INT(RC[-1]/1000) -> 33 | C1252: 1 | D1252: 1 | E1252: =IF(RC[5]=1,"(每日任务)：",)&"英雄培养"&RC[1]&"次（%s/"&RC[1]&"）" -> 英雄培养1200次（%s/1200） | F1252: 1200 | H1252: 1 | I1252: 0 | J1252: 0 | K1252: 19103 | L1252: 80
A1253: 33029 | B1253: =INT(RC[-1]/1000) -> 33 | C1253: 1 | D1253: 1 | E1253: =IF(RC[5]=1,"(每日任务)：",)&"英雄培养"&RC[1]&"次（%s/"&RC[1]&"）" -> 英雄培养1600次（%s/1600） | F1253: 1600 | H1253: 1 | I1253: 0 | J1253: 0 | K1253: 19103 | L1253: 90
A1254: 33030 | B1254: =INT(RC[-1]/1000) -> 33 | C1254: 1 | D1254: 1 | E1254: =IF(RC[5]=1,"(每日任务)：",)&"英雄培养"&RC[1]&"次（%s/"&RC[1]&"）" -> 英雄培养2000次（%s/2000） | F1254: 2000 | H1254: 1 | I1254: 0 | J1254: 0 | K1254: 19103 | L1254: 100
A1255: 33031 | B1255: =INT(RC[-1]/1000) -> 33 | C1255: 1 | D1255: 1 | E1255: =IF(RC[5]=1,"(每日任务)：",)&"英雄培养"&RC[1]&"次（%s/"&RC[1]&"）" -> (每日任务)：英雄培养5次（%s/5） | F1255: 5 | H1255: 1 | I1255: 0 | J1255: 1 | K1255: 13599 | L1255: 1
A1256: 33032 | B1256: =INT(RC[-1]/1000) -> 33 | C1256: 1 | D1256: 1 | E1256: =IF(RC[5]=1,"(每日任务)：",)&"英雄培养"&RC[1]&"次（%s/"&RC[1]&"）" -> 英雄培养100次（%s/100） | F1256: 100 | H1256: 1 | I1256: 0 | J1256: 0 | K1256: 10022 | L1256: 20
A1257: 33033 | B1257: =INT(RC[-1]/1000) -> 33 | C1257: 1 | D1257: 1 | E1257: =IF(RC[5]=1,"(每日任务)：",)&"英雄培养"&RC[1]&"次（%s/"&RC[1]&"）" -> 英雄培养200次（%s/200） | F1257: 200 | H1257: 1 | I1257: 0 | J1257: 0 | K1257: 13599 | L1257: 5
A1258: 33034 | B1258: =INT(RC[-1]/1000) -> 33 | C1258: 1 | D1258: 1 | E1258: =IF(RC[5]=1,"(每日任务)：",)&"英雄培养"&RC[1]&"次（%s/"&RC[1]&"）" -> 英雄培养300次（%s/300） | F1258: 300 | H1258: 1 | I1258: 0 | J1258: 0 | K1258: 10022 | L1258: 20
A1259: 33035 | B1259: =INT(RC[-1]/1000) -> 33 | C1259: 1 | D1259: 1 | E1259: =IF(RC[5]=1,"(每日任务)：",)&"英雄培养"&RC[1]&"次（%s/"&RC[1]&"）" -> 英雄培养400次（%s/400） | F1259: 400 | H1259: 1 | I1259: 0 | J1259: 0 | K1259: 10022 | L1259: 50
A1260: 33036 | B1260: =INT(RC[-1]/1000) -> 33 | C1260: 1 | D1260: 1 | E1260: =IF(RC[5]=1,"(每日任务)：",)&"英雄培养"&RC[1]&"次（%s/"&RC[1]&"）" -> 英雄培养500次（%s/500） | F1260: 500 | H1260: 1 | I1260: 0 | J1260: 0 | K1260: 13599 | L1260: 5
A1261: 33037 | B1261: =INT(RC[-1]/1000) -> 33 | C1261: 1 | D1261: 1 | E1261: =IF(RC[5]=1,"(每日任务)：",)&"英雄培养"&RC[1]&"次（%s/"&RC[1]&"）" -> (每日任务)：英雄培养1次（%s/1） | F1261: 1 | H1261: 1 | I1261: 0 | J1261: 1 | K1261: 10022 | L1261: 5 | N1261: 5.培养X次，点击一次算一次
A1262: 33038 | B1262: =INT(RC[-1]/1000) -> 33 | C1262: 1 | D1262: 1 | E1262: =IF(RC[5]=1,"(每日任务)：",)&"英雄培养"&RC[1]&"次（%s/"&RC[1]&"）" -> 英雄培养50次（%s/50） | F1262: 50 | H1262: 1 | I1262: 0 | J1262: 0 | K1262: 10022 | L1262: 10
A1263: 33039 | B1263: =INT(RC[-1]/1000) -> 33 | C1263: 1 | D1263: 1 | E1263: =IF(RC[5]=1,"(每日任务)：",)&"英雄培养"&RC[1]&"次（%s/"&RC[1]&"）" -> 英雄培养100次（%s/100） | F1263: 100 | H1263: 1 | I1263: 0 | J1263: 0 | K1263: 10022 | L1263: 10
A1264: 33040 | B1264: =INT(RC[-1]/1000) -> 33 | C1264: 1 | D1264: 1 | E1264: =IF(RC[5]=1,"(每日任务)：",)&"英雄培养"&RC[1]&"次（%s/"&RC[1]&"）" -> 英雄培养200次（%s/200） | F1264: 200 | H1264: 1 | I1264: 0 | J1264: 0 | K1264: 10022 | L1264: 30
A1265: 33041 | B1265: =INT(RC[-1]/1000) -> 33 | C1265: 1 | D1265: 1 | E1265: =IF(RC[5]=1,"(每日任务)：",)&"英雄培养"&RC[1]&"次（%s/"&RC[1]&"）" -> 英雄培养300次（%s/300） | F1265: 300 | H1265: 1 | I1265: 0 | J1265: 0 | K1265: 10022 | L1265: 40
A1266: 33042 | B1266: =INT(RC[-1]/1000) -> 33 | C1266: 1 | D1266: 1 | E1266: =IF(RC[5]=1,"(每日任务)：",)&"英雄培养"&RC[1]&"次（%s/"&RC[1]&"）" -> 英雄培养400次（%s/400） | F1266: 400 | H1266: 1 | I1266: 0 | J1266: 0 | K1266: 10022 | L1266: 50
A1267: 33043 | B1267: =INT(RC[-1]/1000) -> 33 | C1267: 1 | D1267: 1 | E1267: =IF(RC[5]=1,"(每日任务)：",)&"英雄培养"&RC[1]&"次（%s/"&RC[1]&"）" -> 英雄培养500次（%s/500） | F1267: 500 | H1267: 1 | I1267: 0 | J1267: 0 | K1267: 10022 | L1267: 60
A1268: 33044 | B1268: =INT(RC[-1]/1000) -> 33 | C1268: 1 | D1268: 1 | E1268: =IF(RC[5]=1,"(每日任务)：",)&"英雄培养"&RC[1]&"次（%s/"&RC[1]&"）" -> 英雄培养600次（%s/600） | F1268: 600 | H1268: 1 | I1268: 0 | J1268: 0 | K1268: 10022 | L1268: 70
A1269: 33045 | B1269: =INT(RC[-1]/1000) -> 33 | C1269: 1 | D1269: 1 | E1269: =IF(RC[5]=1,"(每日任务)：",)&"英雄培养"&RC[1]&"次（%s/"&RC[1]&"）" -> 英雄培养700次（%s/700） | F1269: 700 | H1269: 1 | I1269: 0 | J1269: 0 | K1269: 10022 | L1269: 80
A1270: 33046 | B1270: =INT(RC[-1]/1000) -> 33 | C1270: 1 | D1270: 1 | E1270: =IF(RC[5]=1,"(每日任务)：",)&"英雄培养"&RC[1]&"次（%s/"&RC[1]&"）" -> 英雄培养800次（%s/800） | F1270: 800 | H1270: 1 | I1270: 0 | J1270: 0 | K1270: 10022 | L1270: 100
A1271: 34000 | B1271: =INT(RC[-1]/1000) -> 34 | C1271: 1 | D1271: 1 | E1271: ="（每日任务）精灵培养"&RC[1]&"次（%s/"&RC[1]&"）" -> （每日任务）精灵培养5次（%s/5） | F1271: 5 | H1271: 1 | I1271: 0 | J1271: 1 | K1271: 10030|10031 | L1271: 5|5 | N1271: 6.精灵升华X次，点击一次算一次
A1272: 34001 | B1272: =INT(RC[-1]/1000) -> 34 | C1272: 1 | D1272: 1 | E1272: ="（每日任务）精灵培养"&RC[1]&"次（%s/"&RC[1]&"）" -> （每日任务）精灵培养10次（%s/10） | F1272: 10 | H1272: 1 | I1272: 0 | J1272: 1 | K1272: 10032|10033 | L1272: 5|5
A1273: 34002 | B1273: =INT(RC[-1]/1000) -> 34 | C1273: 1 | D1273: 1 | E1273: ="（每日任务）精灵培养"&RC[1]&"次（%s/"&RC[1]&"）" -> （每日任务）精灵培养20次（%s/20） | F1273: 20 | H1273: 1 | I1273: 0 | J1273: 1 | K1273: 13646 | L1273: 1
A1274: 34003 | B1274: =INT(RC[-1]/1000) -> 34 | C1274: 1 | D1274: 1 | E1274: ="（每日任务）精灵培养"&RC[1]&"次（%s/"&RC[1]&"）" -> （每日任务）精灵培养50次（%s/50） | F1274: 50 | H1274: 1 | I1274: 0 | J1274: 1 | K1274: 13646 | L1274: 2
A1275: 34004 | B1275: =INT(RC[-1]/1000) -> 34 | C1275: 1 | D1275: 1 | E1275: ="（每日任务）精灵培养"&RC[1]&"次（%s/"&RC[1]&"）" -> （每日任务）精灵培养100次（%s/100） | F1275: 100 | H1275: 1 | I1275: 0 | J1275: 1 | K1275: 13646 | L1275: 3
A1276: 35001 | B1276: =INT(RC[-1]/1000) -> 35 | C1276: 1 | D1276: 1 | E1276: ="累计扭蛋"&RC[1]&"次（%s/"&RC[1]&"）" -> 累计扭蛋5次（%s/5） | F1276: 5 | H1276: 1 | I1276: 0 | J1276: 1 | K1276: 19003 | L1276: 1 | N1276: 扭蛋次数
A1277: 36001 | B1277: =INT(RC[-1]/1000) -> 36 | C1277: 1 | D1277: 1 | E1277: =IF(RC[5]=1,"(每日任务):",)&"累计精炼装备"&RC[1]&"次（%s/"&RC[1]&"）" -> (每日任务):累计精炼装备5次（%s/5） | F1277: 5 | H1277: 1 | I1277: 0 | J1277: 1 | K1277: 10003 | L1277: 10 | N1277: 装备精炼次数
A1278: 36002 | B1278: =INT(RC[-1]/1000) -> 36 | C1278: 1 | D1278: 1 | E1278: =IF(RC[5]=1,"(每日任务):",)&"累计精炼装备"&RC[1]&"次（%s/"&RC[1]&"）" -> 累计精炼装备150次（%s/150） | F1278: 150 | H1278: 1 | I1278: 0 | J1278: 0 | K1278: 19103 | L1278: 10
A1279: 36003 | B1279: =INT(RC[-1]/1000) -> 36 | C1279: 1 | D1279: 1 | E1279: =IF(RC[5]=1,"(每日任务):",)&"累计精炼装备"&RC[1]&"次（%s/"&RC[1]&"）" -> 累计精炼装备300次（%s/300） | F1279: 300 | H1279: 1 | I1279: 0 | J1279: 0 | K1279: 19103 | L1279: 20
A1280: 36004 | B1280: =INT(RC[-1]/1000) -> 36 | C1280: 1 | D1280: 1 | E1280: =IF(RC[5]=1,"(每日任务):",)&"累计精炼装备"&RC[1]&"次（%s/"&RC[1]&"）" -> 累计精炼装备450次（%s/450） | F1280: 450 | H1280: 1 | I1280: 0 | J1280: 0 | K1280: 19103 | L1280: 30
A1281: 36005 | B1281: =INT(RC[-1]/1000) -> 36 | C1281: 1 | D1281: 1 | E1281: =IF(RC[5]=1,"(每日任务):",)&"累计精炼装备"&RC[1]&"次（%s/"&RC[1]&"）" -> 累计精炼装备600次（%s/600） | F1281: 600 | H1281: 1 | I1281: 0 | J1281: 0 | K1281: 19103 | L1281: 40
A1282: 36006 | B1282: =INT(RC[-1]/1000) -> 36 | C1282: 1 | D1282: 1 | E1282: =IF(RC[5]=1,"(每日任务):",)&"累计精炼装备"&RC[1]&"次（%s/"&RC[1]&"）" -> 累计精炼装备900次（%s/900） | F1282: 900 | H1282: 1 | I1282: 0 | J1282: 0 | K1282: 19103 | L1282: 50
A1283: 36007 | B1283: =INT(RC[-1]/1000) -> 36 | C1283: 1 | D1283: 1 | E1283: =IF(RC[5]=1,"(每日任务):",)&"累计精炼装备"&RC[1]&"次（%s/"&RC[1]&"）" -> 累计精炼装备1200次（%s/1200） | F1283: 1200 | H1283: 1 | I1283: 0 | J1283: 0 | K1283: 19103 | L1283: 60
A1284: 36008 | B1284: =INT(RC[-1]/1000) -> 36 | C1284: 1 | D1284: 1 | E1284: =IF(RC[5]=1,"(每日任务):",)&"累计精炼装备"&RC[1]&"次（%s/"&RC[1]&"）" -> 累计精炼装备1500次（%s/1500） | F1284: 1500 | H1284: 1 | I1284: 0 | J1284: 0 | K1284: 19103 | L1284: 70
A1285: 36009 | B1285: =INT(RC[-1]/1000) -> 36 | C1285: 1 | D1285: 1 | E1285: =IF(RC[5]=1,"(每日任务):",)&"累计精炼装备"&RC[1]&"次（%s/"&RC[1]&"）" -> 累计精炼装备1800次（%s/1800） | F1285: 1800 | H1285: 1 | I1285: 0 | J1285: 0 | K1285: 19103 | L1285: 80
A1286: 36010 | B1286: =INT(RC[-1]/1000) -> 36 | C1286: 1 | D1286: 1 | E1286: =IF(RC[5]=1,"(每日任务):",)&"累计精炼装备"&RC[1]&"次（%s/"&RC[1]&"）" -> 累计精炼装备2400次（%s/2400） | F1286: 2400 | H1286: 1 | I1286: 0 | J1286: 0 | K1286: 19103 | L1286: 90
A1287: 36011 | B1287: =INT(RC[-1]/1000) -> 36 | C1287: 1 | D1287: 1 | E1287: =IF(RC[5]=1,"(每日任务):",)&"累计精炼装备"&RC[1]&"次（%s/"&RC[1]&"）" -> 累计精炼装备3000次（%s/3000） | F1287: 3000 | H1287: 1 | I1287: 0 | J1287: 0 | K1287: 19103 | L1287: 100
A1288: 37000 | B1288: 37 | C1288: 1 | D1288: 1 | E1288: ="累计进行"&RC[1]&"次限时扭蛋（%s/"&RC[1]&"）" -> 累计进行10次限时扭蛋（%s/10） | F1288: 10 | H1288: 1 | I1288: 0 | J1288: 0 | K1288: 10004 | L1288: 300 | N1288: 限时扭蛋
A1289: 37001 | B1289: 37 | C1289: 1 | D1289: 1 | E1289: ="累计进行"&RC[1]&"次限时扭蛋（%s/"&RC[1]&"）" -> 累计进行30次限时扭蛋（%s/30） | F1289: 30 | H1289: 1 | I1289: 0 | J1289: 0 | K1289: 10022 | L1289: 100
A1290: 37002 | B1290: 37 | C1290: 1 | D1290: 1 | E1290: ="累计进行"&RC[1]&"次限时扭蛋（%s/"&RC[1]&"）" -> 累计进行60次限时扭蛋（%s/60） | F1290: 60 | H1290: 1 | I1290: 0 | J1290: 0 | K1290: 13392 | L1290: 1
A1291: 37003 | B1291: 37 | C1291: 1 | D1291: 1 | E1291: ="累计进行"&RC[1]&"次限时扭蛋（%s/"&RC[1]&"）" -> 累计进行100次限时扭蛋（%s/100） | F1291: 100 | H1291: 1 | I1291: 0 | J1291: 0 | K1291: 80100 | L1291: 1
A1292: 37004 | B1292: 37 | C1292: 1 | D1292: 1 | E1292: ="累计进行"&RC[1]&"次限时扭蛋（%s/"&RC[1]&"）" -> 累计进行150次限时扭蛋（%s/150） | F1292: 150 | H1292: 1 | I1292: 0 | J1292: 0 | K1292: 13392|10010 | L1292: 2|100
A1293: 37005 | B1293: 37 | C1293: 1 | D1293: 1 | E1293: ="累计进行"&RC[1]&"次限时扭蛋（%s/"&RC[1]&"）" -> 累计进行200次限时扭蛋（%s/200） | F1293: 200 | H1293: 1 | I1293: 0 | J1293: 0 | K1293: 80100 | L1293: 1
A1294: 37006 | B1294: 37 | C1294: 1 | D1294: 1 | E1294: ="累计进行"&RC[1]&"次限时扭蛋（%s/"&RC[1]&"）" -> 累计进行250次限时扭蛋（%s/250） | F1294: 250 | H1294: 1 | I1294: 0 | J1294: 0 | K1294: 13392|10010 | L1294: 3|200
A1295: 37007 | B1295: 37 | C1295: 1 | D1295: 1 | E1295: ="累计进行"&RC[1]&"次限时扭蛋（%s/"&RC[1]&"）" -> 累计进行300次限时扭蛋（%s/300） | F1295: 300 | H1295: 1 | I1295: 0 | J1295: 0 | K1295: 80100 | L1295: 1
A1296: 37008 | B1296: 37 | C1296: 1 | D1296: 1 | E1296: ="累计进行"&RC[1]&"次限时扭蛋（%s/"&RC[1]&"）" -> 累计进行400次限时扭蛋（%s/400） | F1296: 400 | H1296: 1 | I1296: 0 | J1296: 0 | K1296: 13392|10010 | L1296: 4|500
A1297: 37009 | B1297: 37 | C1297: 1 | D1297: 1 | E1297: ="累计进行"&RC[1]&"次限时扭蛋（%s/"&RC[1]&"）" -> 累计进行500次限时扭蛋（%s/500） | F1297: 500 | H1297: 1 | I1297: 0 | J1297: 0 | K1297: 80101 | L1297: 1
A1298: 37010 | B1298: 37 | C1298: 1 | D1298: 1 | E1298: ="累计进行"&RC[1]&"次限时扭蛋（%s/"&RC[1]&"）" -> 累计进行600次限时扭蛋（%s/600） | F1298: 600 | H1298: 1 | I1298: 0 | J1298: 0 | K1298: 13470 | L1298: 1
A1299: 37011 | B1299: 37 | C1299: 1 | D1299: 1 | E1299: ="累计进行"&RC[1]&"次限时扭蛋（%s/"&RC[1]&"）" -> 累计进行800次限时扭蛋（%s/800） | F1299: 800 | H1299: 1 | I1299: 0 | J1299: 0 | K1299: 13470|13384 | L1299: 1|1
A1300: 37012 | B1300: 37 | C1300: 1 | D1300: 1 | E1300: ="累计进行"&RC[1]&"次限时扭蛋（%s/"&RC[1]&"）" -> 累计进行1000次限时扭蛋（%s/1000） | F1300: 1000 | H1300: 1 | I1300: 0 | J1300: 0 | K1300: 13393|13384 | L1300: 1|1

Sheet: 11.限时掉落
A1: id| | B1: type|type | C1: drop_item_id|drop_item_id | D1: star_date|star_date | E1: over_date|over_date | F1: |drop_rate | G1: drop_num_min|drop_num_min | H1: drop_num_max|drop_num_max
A2: 不可空 | B2: 不可空 | C2: 不可空 | D2: 不可空 | E2: 不可空 | F2: 不可空 | G2: 不可空 | H2: 不可空
A3: 数字 | B3: 数字 | C3: 数字 | D3: 数字 | E3: 数字 | F3: 数字 | G3: 数字 | H3: 数字
A6: ID | B6: 副本类型 | C6: 掉落道具ID | D6: 开始日期 | E6: 结束日期 | F6: 掉落几率 | G6: 掉落数量下限 | H6: 掉落数量上限
A7: 1 | B7: 1 | C7: 10093 | D7: 20161223 | E7: 20161229 | F7: 3333 | G7: 1 | H7: 2
A8: 2 | B8: 3 | C8: 10093 | D8: 20161223 | E8: 20161229 | F8: 5000 | G8: 1 | H8: 3
A9: 3 | B9: 4 | C9: 10093 | D9: 20161223 | E9: 20161229 | F9: 5000 | G9: 1 | H9: 5
A10: 4 | B10: 999 | C10: 10093 | D10: 20161223 | E10: 20161229 | F10: 2500 | G10: 1 | H10: 3
A11: 5 | B11: 9999 | C11: 10093 | D11: 20161223 | E11: 20161229 | F11: 2500 | G11: 1 | H11: 3
A12: 6 | B12: 1 | C12: 10077 | D12: 20180616 | E12: 20180620 | F12: 3333 | G12: 1 | H12: 2
A13: 7 | B13: 3 | C13: 10077 | D13: 20180616 | E13: 20180620 | F13: 5000 | G13: 1 | H13: 3
A14: 8 | B14: 4 | C14: 10077 | D14: 20180616 | E14: 20180620 | F14: 5000 | G14: 1 | H14: 5
A15: 9 | B15: 999 | C15: 10077 | D15: 20180616 | E15: 20180620 | F15: 2500 | G15: 1 | H15: 3
A16: 10 | B16: 9999 | C16: 10077 | D16: 20180616 | E16: 20180620 | F16: 2500 | G16: 1 | H16: 3
A17: 11 | B17: 1 | C17: 10078 | D17: 20180616 | E17: 20180620 | F17: 500 | G17: 1 | H17: 1
A18: 12 | B18: 3 | C18: 10078 | D18: 20180616 | E18: 20180620 | F18: 500 | G18: 1 | H18: 1
A19: 13 | B19: 4 | C19: 10078 | D19: 20180616 | E19: 20180620 | F19: 500 | G19: 1 | H19: 1
A20: 14 | B20: 999 | C20: 10078 | D20: 20180616 | E20: 20180620 | F20: 500 | G20: 1 | H20: 1
A21: 15 | B21: 9999 | C21: 10078 | D21: 20180616 | E21: 20180620 | F21: 500 | G21: 1 | H21: 1
A22: 11 | B22: 1 | C22: 10093 | D22: 20181225 | E22: 20181231 | F22: 3333 | G22: 1 | H22: 2
A23: 12 | B23: 3 | C23: 10093 | D23: 20181225 | E23: 20181231 | F23: 5000 | G23: 1 | H23: 3
A24: 13 | B24: 4 | C24: 10093 | D24: 20181225 | E24: 20181231 | F24: 3333 | G24: 1 | H24: 5
A25: 14 | B25: 999 | C25: 10093 | D25: 20181225 | E25: 20181231 | F25: 2500 | G25: 1 | H25: 3
A26: 15 | B26: 9999 | C26: 10093 | D26: 20181225 | E26: 20181231 | F26: 2500 | G26: 1 | H26: 3
A27: 16 | B27: 1 | C27: 10094 | D27: 20181225 | E27: 20181231 | F27: 250 | G27: 1 | H27: 1
A28: 17 | B28: 3 | C28: 10094 | D28: 20181225 | E28: 20181231 | F28: 500 | G28: 1 | H28: 1
A29: 18 | B29: 4 | C29: 10094 | D29: 20181225 | E29: 20181231 | F29: 500 | G29: 1 | H29: 1
A30: 19 | B30: 999 | C30: 10094 | D30: 20181225 | E30: 20181231 | F30: 250 | G30: 1 | H30: 1
A31: 20 | B31: 1 | C31: 10088 | D31: 20190204 | E31: 20190210 | F31: 3333 | G31: 1 | H31: 2
A32: 21 | B32: 3 | C32: 10088 | D32: 20190204 | E32: 20190210 | F32: 5000 | G32: 1 | H32: 3
A33: 22 | B33: 4 | C33: 10088 | D33: 20190204 | E33: 20190210 | F33: 5000 | G33: 1 | H33: 5
A34: 23 | B34: 999 | C34: 10088 | D34: 20190204 | E34: 20190210 | F34: 2500 | G34: 1 | H34: 3
A35: 24 | B35: 9999 | C35: 10088 | D35: 20190204 | E35: 20190210 | F35: 2500 | G35: 1 | H35: 3
A36: 25 | B36: 1 | C36: 10089 | D36: 20190204 | E36: 20190210 | F36: 500 | G36: 1 | H36: 1
A37: 26 | B37: 3 | C37: 10089 | D37: 20190204 | E37: 20190210 | F37: 500 | G37: 1 | H37: 1
A38: 27 | B38: 4 | C38: 10089 | D38: 20190204 | E38: 20190210 | F38: 500 | G38: 1 | H38: 1
A39: 28 | B39: 999 | C39: 10089 | D39: 20190204 | E39: 20190210 | F39: 500 | G39: 1 | H39: 1
A40: 29 | B40: 9999 | C40: 10089 | D40: 20190204 | E40: 20190210 | F40: 500 | G40: 1 | H40: 1