Sheet: 配置
A1: 服务端文件名 | B1: 服务端对应工作表号 | C1: 客户端文件名 | D1: 客户端对应工作表号 | E1: erl头部 | F1: erl内容格式 | G1: erl尾部 | H1: 客户端特殊处理
A2: config_hero_shop_slot.txt | B2: 1 | F2: get(id) -> #$
A3: config_hero_shop.txt | B3: 2 | C3: config_hero_shop.cnf|HeroShop | D3: 2 | F3: get(goods_id) -> #$ | H3: 2=>goods_id

Sheet: 商店槽位配置
A1: |slot | B1: |goods_list
A2: 不可空 | B2: 不可空
A3: 数字 | B3: 一维数组
B4: 不定长
A6: 商店槽位 | B6: 商品随机列表
A7: 1 | B7: 1|2|3|4|5|6|7|8|9|10|11|12|13|14|15|16|17|18|19|20|21|22|23|24|25|26|27|28|29|30|31|32|33|34|35|36|37|38|39|40|41|42
A8: 2 | B8: 1001|1002|1003|1004|1005|1006|1007|1008|1009|1010|1011|1012|1013|1014|1015|1016|1017|1018|1019|1020|1021|1022|1023|1024|1025|1026|1027|1028|1029|1030|1031|1032|1033|1034|1035|1036|1037|1038|1039|1040|1041|1042|1043|1044|1045|1046|1047|1048|1049|1050|1051|1052|1053|1054|1055|1056|1057|1058|1059|1060|1061|1062|1063|1064|1065|1066|1067|1068|1069|1070|1071|1072|1073|1074|1075|1076|1077|1078|1079|1080|1081|1082|1083|1084|1085|1086|1087|1088|1089|1090|1091|1092|1093|1094|1095|1096|1097|1098|1099|1100|1101|1102|1103|1104|1105|1106|1107|1108|1109|1110|1111|1112|1113|1114|1115|1116|1117|1118|1119|1120|1121|1122|1123|1124|1125|1126
A9: 3 | B9: 101|102|103|104|105|106|107|108|109|110|111|112|113|114|115|116|117|118|119|120|121|122|123|124|125|126|127|128|129|130|131|132|133|134|135|136|137|138|139
A10: 4 | B10: 1301|1302|1303|1304|1305|1306|1307|1308|1309|1310|1311|1312|1313|1314|1315|1316|1317|1318|1319|1320|1321|1322|1323|1324|1325|1326|1327|1328|1329|1330|1331|1332|1333|1334|1335|1336|1337|1338|1339|1340|1341|1342|1343|1344|1345|1346|1347|1348|1349|1350|1351|1352|1353|1354|1355|1356|1357|1358|1359|1360|1361|1362|1363|1364|1365|1366|1367|1368|1369|1370|1371|1372|1373|1374|1375|1376|1377|1378|1379|1380|1381|1382|1383|1384|1385|1386|1387|1388|1389|1390|1391|1392|1393|1394|1395|1396|1397|1398|1399|1400|1401|1402|1403|1404|1405|1406|1407|1408|1409|1410|1411|1412|1413|1414|1415|1416|1417|1418|1419|1420|1421|1422|1423|1424|1425|1426
A11: 5 | B11: 201|202|203|204|205|206|207|208|209|210|211|212|213|214|215|216|217|218|219|220|221|222|223|224|225|226|227|228|229|230|231|232|233|234|235|236|237|238|239
A12: 6 | B12: 1601|1602|1603|1604|1605|1606|1607|1608|1609|1610|1611|1612|1613|1614|1615|1616|1617|1618|1619|1620|1621|1622|1623|1624|1625|1626|1627|1628|1629|1630|1631|1632|1633|1634|1635|1636|1637|1638|1639|1640|1641|1642|1643|1644|1645|1646|1647|1648|1649|1650|1651|1652|1653|1654|1655|1656|1657|1658|1659|1660|1661|1662|1663|1664|1665|1666|1667|1668|1669|1670|1671|1672|1673|1674|1675|1676|1677|1678|1679|1680|1681|1682|1683|1684|1685|1686|1687|1688|1689|1690|1691|1692|1693|1694|1695|1696|1697|1698|1699|1700|1701|1702|1703|1704|1705|1706|1707|1708|1709|1710|1711|1712|1713|1714|1715|1716|1717|1718|1719|1720|1721|1722|1723|1724|1725|1726

Sheet: 商品
A1: goods_id|goods_id | B1: item_id|item_id | C1: item_num|item_num | D1: buy_num_max|buy_num_max | E1: need_role_level|need_role_level | F1: rate|rate | G1: cost_type_list|cost_type_list | H1: cost_value_list|cost_value_list | I1: is_recommend|
A2: 不可空 | B2: 不可空 | C2: 不可空 | D2: 不可空 | E2: 不可空 | F2: 不可空 | G2: 可空#不需字段 | H2: 可空#不需字段 | I2: 不可空
A3: 数字 | B3: 数字 | C3: 数字 | D3: 数字 | E3: 数字 | F3: 数字 | G3: 一维数组 | H3: 一维数组 | I3: 数字
G4: 不定长 | H4: 不定长
A6: 商品ID | B6: 物品ID | C6: 物品数量 | D6: 购买数量上限(0=表示无上限) | E6: 等级限制 | F6: 刷出概率 | G6: 消耗类型列表 | H6: 消耗值列表 | I6: 是否推荐
A7: 1 | B7: 10002 | C7: 50 | D7: 1 | E7: 5 | F7: 10 | G7: 6 | H7: 50 | I7: 0
A8: 2 | B8: 10003 | C8: 10 | D8: 1 | E8: 9 | F8: 10 | G8: 6 | H8: 30 | I8: 1
A9: 3 | B9: 10004 | C9: 10 | D9: 1 | E9: 35 | F9: 10 | G9: 6 | H9: 150 | I9: 1
A10: 4 | B10: 10002 | C10: 100 | D10: 1 | E10: 5 | F10: 10 | G10: 6 | H10: =R[-3]C*2 -> 100 | I10: 0
A11: 5 | B11: 10003 | C11: 20 | D11: 1 | E11: 9 | F11: 10 | G11: 6 | H11: 60 | I11: 1
A12: 6 | B12: 10004 | C12: 20 | D12: 1 | E12: 35 | F12: 10 | G12: 6 | H12: =R[-3]C*2 -> 300 | I12: 1
A13: 7 | B13: 10002 | C13: 200 | D13: 1 | E13: 5 | F13: 10 | G13: 6 | H13: =R[-3]C*2 -> 200 | I13: 0
A14: 8 | B14: 10003 | C14: 30 | D14: 1 | E14: 9 | F14: 10 | G14: 6 | H14: 90 | I14: 1
A15: 9 | B15: 10004 | C15: 40 | D15: 1 | E15: 35 | F15: 10 | G15: 6 | H15: =R[-3]C*2 -> 600 | I15: 1
A16: 10 | B16: 10002 | C16: 100 | D16: 1 | E16: 5 | F16: 10 | G16: 5 | H16: 100 | I16: 0
A17: 11 | B17: 10003 | C17: 20 | D17: 1 | E17: 9 | F17: 10 | G17: 5 | H17: 60 | I17: 1
A18: 12 | B18: 10004 | C18: 20 | D18: 1 | E18: 35 | F18: 10 | G18: 5 | H18: 300 | I18: 1
A19: 13 | B19: 10002 | C19: 150 | D19: 1 | E19: 5 | F19: 10 | G19: 5 | H19: 150 | I19: 0
A20: 14 | B20: 10003 | C20: 40 | D20: 1 | E20: 9 | F20: 10 | G20: 5 | H20: 120 | I20: 1
A21: 15 | B21: 10004 | C21: 30 | D21: 1 | E21: 35 | F21: 10 | G21: 5 | H21: 450 | I21: 1
A22: 16 | B22: 10002 | C22: 200 | D22: 1 | E22: 5 | F22: 10 | G22: 5 | H22: 200 | I22: 0
A23: 17 | B23: 10003 | C23: 60 | D23: 1 | E23: 9 | F23: 10 | G23: 5 | H23: 180 | I23: 1
A24: 18 | B24: 10004 | C24: 40 | D24: 1 | E24: 35 | F24: 10 | G24: 5 | H24: 600 | I24: 1
A25: 19 | B25: 33200 | C25: 1 | D25: 1 | E25: 1 | F25: 5 | G25: 6 | H25: 50 | I25: 0
A26: 20 | B26: 33200 | C26: 2 | D26: 1 | E26: 1 | F26: 5 | G26: 6 | H26: 100 | I26: 0
A27: 21 | B27: 33200 | C27: 5 | D27: 1 | E27: 1 | F27: 5 | G27: 6 | H27: 250 | I27: 0
A28: 22 | B28: 33300 | C28: 1 | D28: 1 | E28: 1 | F28: 5 | G28: 6 | H28: 100 | I28: 1
A29: 23 | B29: 33300 | C29: 2 | D29: 1 | E29: 1 | F29: 5 | G29: 6 | H29: 200 | I29: 1
A30: 24 | B30: 33300 | C30: 5 | D30: 1 | E30: 1 | F30: 5 | G30: 6 | H30: 500 | I30: 1
A31: 25 | B31: 33400 | C31: 1 | D31: 1 | E31: 1 | F31: 5 | G31: 6 | H31: 200 | I31: 1
A32: 26 | B32: 33400 | C32: 2 | D32: 1 | E32: 1 | F32: 5 | G32: 6 | H32: 400 | I32: 1
A33: 27 | B33: 33400 | C33: 5 | D33: 1 | E33: 1 | F33: 5 | G33: 6 | H33: 1000 | I33: 1
A34: 28 | B34: 33200 | C34: 1 | D34: 1 | E34: 1 | F34: 5 | G34: 5 | H34: 40 | I34: 0
A35: 29 | B35: 33200 | C35: 2 | D35: 1 | E35: 1 | F35: 5 | G35: 5 | H35: 80 | I35: 0
A36: 30 | B36: 33200 | C36: 5 | D36: 1 | E36: 1 | F36: 5 | G36: 5 | H36: 200 | I36: 0
A37: 31 | B37: 33300 | C37: 1 | D37: 1 | E37: 1 | F37: 5 | G37: 5 | H37: 80 | I37: 1
A38: 32 | B38: 33300 | C38: 2 | D38: 1 | E38: 1 | F38: 5 | G38: 5 | H38: 160 | I38: 1
A39: 33 | B39: 33300 | C39: 5 | D39: 1 | E39: 1 | F39: 5 | G39: 5 | H39: 400 | I39: 1
A40: 34 | B40: 33400 | C40: 1 | D40: 1 | E40: 1 | F40: 5 | G40: 5 | H40: 160 | I40: 1
A41: 35 | B41: 33400 | C41: 2 | D41: 1 | E41: 1 | F41: 5 | G41: 5 | H41: 320 | I41: 1
A42: 36 | B42: 33400 | C42: 5 | D42: 1 | E42: 1 | F42: 5 | G42: 5 | H42: 800 | I42: 1
A43: 37 | B43: 19003 | C43: 50000 | D43: 1 | E43: 1 | F43: 10 | G43: 6 | H43: 50 | I43: 0
A44: 38 | B44: 19003 | C44: 100000 | D44: 1 | E44: 1 | F44: 10 | G44: 6 | H44: 100 | I44: 0
A45: 39 | B45: 19003 | C45: 150000 | D45: 1 | E45: 1 | F45: 10 | G45: 6 | H45: 150 | I45: 0
A46: 40 | B46: 19003 | C46: 50000 | D46: 1 | E46: 1 | F46: 10 | G46: 5 | H46: 50 | I46: 0
A47: 41 | B47: 19003 | C47: 100000 | D47: 1 | E47: 1 | F47: 10 | G47: 5 | H47: 100 | I47: 0
A48: 42 | B48: 19003 | C48: 150000 | D48: 1 | E48: 1 | F48: 10 | G48: 5 | H48: 150 | I48: 0
A49: 101 | B49: 10002 | C49: 50 | D49: 1 | E49: 5 | F49: 10 | G49: 6 | H49: 50 | I49: 0
A50: 102 | B50: 10004 | C50: 10 | D50: 1 | E50: 35 | F50: 10 | G50: 6 | H50: 150 | I50: 1
A51: 103 | B51: 10002 | C51: 100 | D51: 1 | E51: 5 | F51: 10 | G51: 6 | H51: 100 | I51: 0
A52: 104 | B52: 10004 | C52: 20 | D52: 1 | E52: 35 | F52: 10 | G52: 6 | H52: 300 | I52: 1
A53: 105 | B53: 10002 | C53: 200 | D53: 1 | E53: 5 | F53: 10 | G53: 6 | H53: 200 | I53: 0
A54: 106 | B54: 10004 | C54: 40 | D54: 1 | E54: 35 | F54: 10 | G54: 6 | H54: 600 | I54: 1
A55: 107 | B55: 10002 | C55: 100 | D55: 1 | E55: 5 | F55: 10 | G55: 5 | H55: 100 | I55: 0
A56: 108 | B56: 10003 | C56: 20 | D56: 1 | E56: 9 | F56: 10 | G56: 5 | H56: 60 | I56: 1
A57: 109 | B57: 10004 | C57: 20 | D57: 1 | E57: 35 | F57: 10 | G57: 5 | H57: 300 | I57: 1
A58: 110 | B58: 10002 | C58: 150 | D58: 1 | E58: 5 | F58: 10 | G58: 5 | H58: 150 | I58: 0
A59: 111 | B59: 10003 | C59: 40 | D59: 1 | E59: 9 | F59: 10 | G59: 5 | H59: 120 | I59: 1
A60: 112 | B60: 10004 | C60: 30 | D60: 1 | E60: 35 | F60: 10 | G60: 5 | H60: 450 | I60: 1
A61: 113 | B61: 10002 | C61: 200 | D61: 1 | E61: 5 | F61: 10 | G61: 5 | H61: 200 | I61: 0
A62: 114 | B62: 10003 | C62: 60 | D62: 1 | E62: 9 | F62: 10 | G62: 5 | H62: 180 | I62: 1
A63: 115 | B63: 10004 | C63: 40 | D63: 1 | E63: 35 | F63: 10 | G63: 5 | H63: 600 | I63: 1
A64: 116 | B64: 33200 | C64: 1 | D64: 1 | E64: 1 | F64: 5 | G64: 6 | H64: 50 | I64: 0
A65: 117 | B65: 33200 | C65: 2 | D65: 1 | E65: 1 | F65: 5 | G65: 6 | H65: 100 | I65: 0
A66: 118 | B66: 33200 | C66: 5 | D66: 1 | E66: 1 | F66: 5 | G66: 6 | H66: 250 | I66: 0
A67: 119 | B67: 33300 | C67: 1 | D67: 1 | E67: 1 | F67: 5 | G67: 6 | H67: 100 | I67: 1
A68: 120 | B68: 33300 | C68: 2 | D68: 1 | E68: 1 | F68: 5 | G68: 6 | H68: 200 | I68: 1
A69: 121 | B69: 33300 | C69: 5 | D69: 1 | E69: 1 | F69: 5 | G69: 6 | H69: 500 | I69: 1
A70: 122 | B70: 33400 | C70: 1 | D70: 1 | E70: 1 | F70: 5 | G70: 6 | H70: 200 | I70: 1
A71: 123 | B71: 33400 | C71: 2 | D71: 1 | E71: 1 | F71: 5 | G71: 6 | H71: 400 | I71: 1
A72: 124 | B72: 33400 | C72: 5 | D72: 1 | E72: 1 | F72: 5 | G72: 6 | H72: 1000 | I72: 1
A73: 125 | B73: 33200 | C73: 1 | D73: 1 | E73: 1 | F73: 5 | G73: 5 | H73: 40 | I73: 0
A74: 126 | B74: 33200 | C74: 2 | D74: 1 | E74: 1 | F74: 5 | G74: 5 | H74: 80 | I74: 0
A75: 127 | B75: 33200 | C75: 5 | D75: 1 | E75: 1 | F75: 5 | G75: 5 | H75: 200 | I75: 0
A76: 128 | B76: 33300 | C76: 1 | D76: 1 | E76: 1 | F76: 5 | G76: 5 | H76: 80 | I76: 1
A77: 129 | B77: 33300 | C77: 2 | D77: 1 | E77: 1 | F77: 5 | G77: 5 | H77: 160 | I77: 1
A78: 130 | B78: 33300 | C78: 5 | D78: 1 | E78: 1 | F78: 5 | G78: 5 | H78: 400 | I78: 1
A79: 131 | B79: 33400 | C79: 1 | D79: 1 | E79: 1 | F79: 5 | G79: 5 | H79: 160 | I79: 1
A80: 132 | B80: 33400 | C80: 2 | D80: 1 | E80: 1 | F80: 5 | G80: 5 | H80: 320 | I80: 1
A81: 133 | B81: 33400 | C81: 5 | D81: 1 | E81: 1 | F81: 5 | G81: 5 | H81: 800 | I81: 1
A82: 134 | B82: 19003 | C82: 50000 | D82: 1 | E82: 1 | F82: 10 | G82: 6 | H82: 50 | I82: 0
A83: 135 | B83: 19003 | C83: 100000 | D83: 1 | E83: 1 | F83: 10 | G83: 6 | H83: 100 | I83: 0
A84: 136 | B84: 19003 | C84: 150000 | D84: 1 | E84: 1 | F84: 10 | G84: 6 | H84: 150 | I84: 0
A85: 137 | B85: 19003 | C85: 50000 | D85: 1 | E85: 1 | F85: 10 | G85: 5 | H85: 50 | I85: 0
A86: 138 | B86: 19003 | C86: 100000 | D86: 1 | E86: 1 | F86: 10 | G86: 5 | H86: 100 | I86: 0
A87: 139 | B87: 19003 | C87: 150000 | D87: 1 | E87: 1 | F87: 10 | G87: 5 | H87: 150 | I87: 0
A88: 201 | B88: 10002 | C88: 50 | D88: 1 | E88: 5 | F88: 10 | G88: 6 | H88: 50 | I88: 0
A89: 202 | B89: 10004 | C89: 10 | D89: 1 | E89: 35 | F89: 10 | G89: 6 | H89: 150 | I89: 1
A90: 203 | B90: 10002 | C90: 100 | D90: 1 | E90: 5 | F90: 10 | G90: 6 | H90: 100 | I90: 0
A91: 204 | B91: 10004 | C91: 20 | D91: 1 | E91: 35 | F91: 10 | G91: 6 | H91: 300 | I91: 1
A92: 205 | B92: 10002 | C92: 200 | D92: 1 | E92: 5 | F92: 10 | G92: 6 | H92: 200 | I92: 0
A93: 206 | B93: 10004 | C93: 40 | D93: 1 | E93: 35 | F93: 10 | G93: 6 | H93: 600 | I93: 1
A94: 207 | B94: 10002 | C94: 100 | D94: 1 | E94: 5 | F94: 10 | G94: 5 | H94: 100 | I94: 0
A95: 208 | B95: 10003 | C95: 20 | D95: 1 | E95: 9 | F95: 10 | G95: 5 | H95: 60 | I95: 1
A96: 209 | B96: 10004 | C96: 20 | D96: 1 | E96: 35 | F96: 10 | G96: 5 | H96: 300 | I96: 1
A97: 210 | B97: 10002 | C97: 150 | D97: 1 | E97: 5 | F97: 10 | G97: 5 | H97: 150 | I97: 0
A98: 211 | B98: 10003 | C98: 40 | D98: 1 | E98: 9 | F98: 10 | G98: 5 | H98: 120 | I98: 1
A99: 212 | B99: 10004 | C99: 30 | D99: 1 | E99: 35 | F99: 10 | G99: 5 | H99: 450 | I99: 1
A100: 213 | B100: 10002 | C100: 200 | D100: 1 | E100: 5 | F100: 10 | G100: 5 | H100: 200 | I100: 0
A101: 214 | B101: 10003 | C101: 60 | D101: 1 | E101: 9 | F101: 10 | G101: 5 | H101: 180 | I101: 1
A102: 215 | B102: 10004 | C102: 40 | D102: 1 | E102: 35 | F102: 10 | G102: 5 | H102: 600 | I102: 1
A103: 216 | B103: 33200 | C103: 1 | D103: 1 | E103: 1 | F103: 5 | G103: 6 | H103: 50 | I103: 0
A104: 217 | B104: 33200 | C104: 2 | D104: 1 | E104: 1 | F104: 5 | G104: 6 | H104: 100 | I104: 0
A105: 218 | B105: 33200 | C105: 5 | D105: 1 | E105: 1 | F105: 5 | G105: 6 | H105: 250 | I105: 0
A106: 219 | B106: 33300 | C106: 1 | D106: 1 | E106: 1 | F106: 5 | G106: 6 | H106: 100 | I106: 1
A107: 220 | B107: 33300 | C107: 2 | D107: 1 | E107: 1 | F107: 5 | G107: 6 | H107: 200 | I107: 1
A108: 221 | B108: 33300 | C108: 5 | D108: 1 | E108: 1 | F108: 5 | G108: 6 | H108: 500 | I108: 1
A109: 222 | B109: 33400 | C109: 1 | D109: 1 | E109: 1 | F109: 5 | G109: 6 | H109: 200 | I109: 1
A110: 223 | B110: 33400 | C110: 2 | D110: 1 | E110: 1 | F110: 5 | G110: 6 | H110: 400 | I110: 1
A111: 224 | B111: 33400 | C111: 5 | D111: 1 | E111: 1 | F111: 5 | G111: 6 | H111: 1000 | I111: 1
A112: 225 | B112: 33200 | C112: 1 | D112: 1 | E112: 1 | F112: 5 | G112: 5 | H112: 40 | I112: 0
A113: 226 | B113: 33200 | C113: 2 | D113: 1 | E113: 1 | F113: 5 | G113: 5 | H113: 80 | I113: 0
A114: 227 | B114: 33200 | C114: 5 | D114: 1 | E114: 1 | F114: 5 | G114: 5 | H114: 200 | I114: 0
A115: 228 | B115: 33300 | C115: 1 | D115: 1 | E115: 1 | F115: 5 | G115: 5 | H115: 80 | I115: 1
A116: 229 | B116: 33300 | C116: 2 | D116: 1 | E116: 1 | F116: 5 | G116: 5 | H116: 160 | I116: 1
A117: 230 | B117: 33300 | C117: 5 | D117: 1 | E117: 1 | F117: 5 | G117: 5 | H117: 400 | I117: 1
A118: 231 | B118: 33400 | C118: 1 | D118: 1 | E118: 1 | F118: 5 | G118: 5 | H118: 160 | I118: 1
A119: 232 | B119: 33400 | C119: 2 | D119: 1 | E119: 1 | F119: 5 | G119: 5 | H119: 320 | I119: 1
A120: 233 | B120: 33400 | C120: 5 | D120: 1 | E120: 1 | F120: 5 | G120: 5 | H120: 800 | I120: 1
A121: 234 | B121: 19003 | C121: 50000 | D121: 1 | E121: 1 | F121: 10 | G121: 6 | H121: 50 | I121: 0
A122: 235 | B122: 19003 | C122: 100000 | D122: 1 | E122: 1 | F122: 10 | G122: 6 | H122: 100 | I122: 0
A123: 236 | B123: 19003 | C123: 150000 | D123: 1 | E123: 1 | F123: 10 | G123: 6 | H123: 150 | I123: 0
A124: 237 | B124: 19003 | C124: 50000 | D124: 1 | E124: 1 | F124: 10 | G124: 5 | H124: 50 | I124: 0
A125: 238 | B125: 19003 | C125: 100000 | D125: 1 | E125: 1 | F125: 10 | G125: 5 | H125: 100 | I125: 0
A126: 239 | B126: 19003 | C126: 150000 | D126: 1 | E126: 1 | F126: 10 | G126: 5 | H126: 150 | I126: 0
A127: 1001 | B127: 30300 | C127: 1 | D127: 1 | E127: 1 | F127: 1 | G127: 6 | H127: =RC[-5]*RC[3] -> 800 | I127: 0 | J127: =VLOOKUP(RC[-8],Sheet1!C2:C3,2,FALSE) -> 警察局长 | K127: =VLOOKUP(RC[-1],Sheet1!C5:C6,2,FALSE) -> 800
A128: 1002 | B128: 30310 | C128: 1 | D128: 1 | E128: 1 | F128: 1 | G128: 6 | H128: =RC[-5]*RC[3] -> 800 | I128: 0 | J128: =VLOOKUP(RC[-8],Sheet1!C2:C3,2,FALSE) -> 初号机 | K128: =VLOOKUP(RC[-1],Sheet1!C5:C6,2,FALSE) -> 800
A129: 1003 | B129: 30320 | C129: 1 | D129: 1 | E129: 1 | F129: 1 | G129: 6 | H129: =RC[-5]*RC[3] -> 800 | I129: 0 | J129: =VLOOKUP(RC[-8],Sheet1!C2:C3,2,FALSE) -> 零式激光炮 | K129: =VLOOKUP(RC[-1],Sheet1!C5:C6,2,FALSE) -> 800
A130: 1004 | B130: 30330 | C130: 1 | D130: 1 | E130: 1 | F130: 1 | G130: 6 | H130: =RC[-5]*RC[3] -> 800 | I130: 0 | J130: =VLOOKUP(RC[-8],Sheet1!C2:C3,2,FALSE) -> 热熔镭射炮 | K130: =VLOOKUP(RC[-1],Sheet1!C5:C6,2,FALSE) -> 800
A131: 1005 | B131: 30340 | C131: 1 | D131: 1 | E131: 1 | F131: 1 | G131: 6 | H131: =RC[-5]*RC[3] -> 800 | I131: 0 | J131: =VLOOKUP(RC[-8],Sheet1!C2:C3,2,FALSE) -> 护士长 | K131: =VLOOKUP(RC[-1],Sheet1!C5:C6,2,FALSE) -> 800
A132: 1006 | B132: 30301 | C132: 1 | D132: 1 | E132: 1 | F132: 1 | G132: 6 | H132: =RC[-5]*RC[3] -> 880 | I132: 0 | J132: =VLOOKUP(RC[-8],Sheet1!C2:C3,2,FALSE) -> 超级队长 | K132: =VLOOKUP(RC[-1],Sheet1!C5:C6,2,FALSE) -> 880
A133: 1007 | B133: 30302 | C133: 1 | D133: 1 | E133: 1 | F133: 1 | G133: 6 | H133: =RC[-5]*RC[3] -> 880 | I133: 0 | J133: =VLOOKUP(RC[-8],Sheet1!C2:C3,2,FALSE) -> 死亡武士 | K133: =VLOOKUP(RC[-1],Sheet1!C5:C6,2,FALSE) -> 880
A134: 1008 | B134: 30430 | C134: 1 | D134: 1 | E134: 1 | F134: 1 | G134: 6 | H134: =RC[-5]*RC[3] -> 2400 | I134: 0 | J134: =VLOOKUP(RC[-8],Sheet1!C2:C3,2,FALSE) -> 红颅鬼 | K134: =VLOOKUP(RC[-1],Sheet1!C5:C6,2,FALSE) -> 2400
A135: 1009 | B135: 30400 | C135: 1 | D135: 1 | E135: 1 | F135: 1 | G135: 6 | H135: =RC[-5]*RC[3] -> 2400 | I135: 0 | J135: =VLOOKUP(RC[-8],Sheet1!C2:C3,2,FALSE) -> 终极队长 | K135: =VLOOKUP(RC[-1],Sheet1!C5:C6,2,FALSE) -> 2400
A136: 1010 | B136: 30431 | C136: 1 | D136: 1 | E136: 1 | F136: 1 | G136: 6 | H136: =RC[-5]*RC[3] -> 2400 | I136: 0 | J136: =VLOOKUP(RC[-8],Sheet1!C2:C3,2,FALSE) -> 雷神 | K136: =VLOOKUP(RC[-1],Sheet1!C5:C6,2,FALSE) -> 2400
A137: 1011 | B137: 30410 | C137: 1 | D137: 1 | E137: 1 | F137: 1 | G137: 6 | H137: =RC[-5]*RC[3] -> 2400 | I137: 0 | J137: =VLOOKUP(RC[-8],Sheet1!C2:C3,2,FALSE) -> 野蛮巨人 | K137: =VLOOKUP(RC[-1],Sheet1!C5:C6,2,FALSE) -> 2400
A138: 1012 | B138: 30401 | C138: 1 | D138: 1 | E138: 1 | F138: 1 | G138: 6 | H138: =RC[-5]*RC[3] -> 2400 | I138: 0 | J138: =VLOOKUP(RC[-8],Sheet1!C2:C3,2,FALSE) -> 致命特工 | K138: =VLOOKUP(RC[-1],Sheet1!C5:C6,2,FALSE) -> 2400
A139: 1013 | B139: 30420 | C139: 1 | D139: 1 | E139: 1 | F139: 1 | G139: 6 | H139: =RC[-5]*RC[3] -> 2400 | I139: 0 | J139: =VLOOKUP(RC[-8],Sheet1!C2:C3,2,FALSE) -> 鹰眸 | K139: =VLOOKUP(RC[-1],Sheet1!C5:C6,2,FALSE) -> 2400
A140: 1014 | B140: 30402 | C140: 1 | D140: 1 | E140: 1 | F140: 1 | G140: 6 | H140: =RC[-5]*RC[3] -> 2400 | I140: 0 | J140: =VLOOKUP(RC[-8],Sheet1!C2:C3,2,FALSE) -> 刀锋猎人 | K140: =VLOOKUP(RC[-1],Sheet1!C5:C6,2,FALSE) -> 2400
A141: 1015 | B141: 30403 | C141: 1 | D141: 1 | E141: 1 | F141: 1 | G141: 6 | H141: =RC[-5]*RC[3] -> 2400 | I141: 0 | J141: =VLOOKUP(RC[-8],Sheet1!C2:C3,2,FALSE) -> 地狱骑士 | K141: =VLOOKUP(RC[-1],Sheet1!C5:C6,2,FALSE) -> 2400
A142: 1016 | B142: 30428 | C142: 1 | D142: 1 | E142: 1 | F142: 0 | G142: 6 | H142: =RC[-5]*RC[3] -> 3200 | I142: 0 | J142: =VLOOKUP(RC[-8],Sheet1!C2:C3,2,FALSE) -> 铁人 | K142: =VLOOKUP(RC[-1],Sheet1!C5:C6,2,FALSE) -> 3200
A143: 1017 | B143: 30411 | C143: 1 | D143: 1 | E143: 1 | F143: 1 | G143: 6 | H143: =RC[-5]*RC[3] -> 2400 | I143: 0 | J143: =VLOOKUP(RC[-8],Sheet1!C2:C3,2,FALSE) -> 树人 | K143: =VLOOKUP(RC[-1],Sheet1!C5:C6,2,FALSE) -> 2400
A144: 1018 | B144: 30438 | C144: 1 | D144: 1 | E144: 1 | F144: 0 | G144: 6 | H144: =RC[-5]*RC[3] -> 3200 | I144: 0 | J144: =VLOOKUP(RC[-8],Sheet1!C2:C3,2,FALSE) -> 超凡博士 | K144: =VLOOKUP(RC[-1],Sheet1!C5:C6,2,FALSE) -> 3200
A145: 1019 | B145: 30440 | C145: 1 | D145: 1 | E145: 1 | F145: 1 | G145: 6 | H145: =RC[-5]*RC[3] -> 2400 | I145: 0 | J145: =VLOOKUP(RC[-8],Sheet1!C2:C3,2,FALSE) -> 白凤凰 | K145: =VLOOKUP(RC[-1],Sheet1!C5:C6,2,FALSE) -> 2400
A146: 1020 | B146: 30429 | C146: 1 | D146: 1 | E146: 1 | F146: 1 | G146: 6 | H146: =RC[-5]*RC[3] -> 3200 | I146: 0 | J146: =VLOOKUP(RC[-8],Sheet1!C2:C3,2,FALSE) -> 地狱铁拳 | K146: =VLOOKUP(RC[-1],Sheet1!C5:C6,2,FALSE) -> 3200
A147: 1021 | B147: 30449 | C147: 1 | D147: 1 | E147: 1 | F147: 1 | G147: 6 | H147: =RC[-5]*RC[3] -> 3200 | I147: 0 | J147: =VLOOKUP(RC[-8],Sheet1!C2:C3,2,FALSE) -> 混沌女巫 | K147: =VLOOKUP(RC[-1],Sheet1!C5:C6,2,FALSE) -> 3200
A148: 1022 | B148: 12300 | C148: 5 | D148: 1 | E148: 1 | F148: 20 | G148: 6 | H148: =RC[-5]*RC[3] -> 100 | I148: 0 | J148: =VLOOKUP(RC[-8],Sheet1!C2:C3,2,FALSE) -> 警察局长碎片 | K148: =VLOOKUP(RC[-1],Sheet1!C5:C6,2,FALSE) -> 20
A149: 1023 | B149: 12301 | C149: 5 | D149: 1 | E149: 1 | F149: 20 | G149: 6 | H149: =RC[-5]*RC[3] -> 100 | I149: 0 | J149: =VLOOKUP(RC[-8],Sheet1!C2:C3,2,FALSE) -> 初号机碎片 | K149: =VLOOKUP(RC[-1],Sheet1!C5:C6,2,FALSE) -> 20
A150: 1024 | B150: 12302 | C150: 5 | D150: 1 | E150: 1 | F150: 20 | G150: 6 | H150: =RC[-5]*RC[3] -> 100 | I150: 0 | J150: =VLOOKUP(RC[-8],Sheet1!C2:C3,2,FALSE) -> 零式激光炮碎片 | K150: =VLOOKUP(RC[-1],Sheet1!C5:C6,2,FALSE) -> 20
A151: 1025 | B151: 12303 | C151: 5 | D151: 1 | E151: 1 | F151: 20 | G151: 6 | H151: =RC[-5]*RC[3] -> 100 | I151: 0 | J151: =VLOOKUP(RC[-8],Sheet1!C2:C3,2,FALSE) -> 热熔镭射炮碎片 | K151: =VLOOKUP(RC[-1],Sheet1!C5:C6,2,FALSE) -> 20
A152: 1026 | B152: 12304 | C152: 5 | D152: 1 | E152: 1 | F152: 20 | G152: 6 | H152: =RC[-5]*RC[3] -> 100 | I152: 0 | J152: =VLOOKUP(RC[-8],Sheet1!C2:C3,2,FALSE) -> 护士长碎片 | K152: =VLOOKUP(RC[-1],Sheet1!C5:C6,2,FALSE) -> 20
A153: 1027 | B153: 12305 | C153: 5 | D153: 1 | E153: 1 | F153: 20 | G153: 6 | H153: =RC[-5]*RC[3] -> 110 | I153: 0 | J153: =VLOOKUP(RC[-8],Sheet1!C2:C3,2,FALSE) -> 超级队长碎片 | K153: =VLOOKUP(RC[-1],Sheet1!C5:C6,2,FALSE) -> 22
A154: 1028 | B154: 12306 | C154: 5 | D154: 1 | E154: 1 | F154: 20 | G154: 6 | H154: =RC[-5]*RC[3] -> 110 | I154: 0 | J154: =VLOOKUP(RC[-8],Sheet1!C2:C3,2,FALSE) -> 死亡武士碎片 | K154: =VLOOKUP(RC[-1],Sheet1!C5:C6,2,FALSE) -> 22
A155: 1029 | B155: 12400 | C155: 5 | D155: 1 | E155: 1 | F155: 20 | G155: 6 | H155: =RC[-5]*RC[3] -> 150 | I155: 0 | J155: =VLOOKUP(RC[-8],Sheet1!C2:C3,2,FALSE) -> 红颅鬼碎片 | K155: =VLOOKUP(RC[-1],Sheet1!C5:C6,2,FALSE) -> 30
A156: 1030 | B156: 12401 | C156: 5 | D156: 1 | E156: 1 | F156: 20 | G156: 6 | H156: =RC[-5]*RC[3] -> 150 | I156: 0 | J156: =VLOOKUP(RC[-8],Sheet1!C2:C3,2,FALSE) -> 终极队长碎片 | K156: =VLOOKUP(RC[-1],Sheet1!C5:C6,2,FALSE) -> 30
A157: 1031 | B157: 12402 | C157: 5 | D157: 1 | E157: 1 | F157: 20 | G157: 6 | H157: =RC[-5]*RC[3] -> 150 | I157: 0 | J157: =VLOOKUP(RC[-8],Sheet1!C2:C3,2,FALSE) -> 雷神碎片 | K157: =VLOOKUP(RC[-1],Sheet1!C5:C6,2,FALSE) -> 30
A158: 1032 | B158: 12403 | C158: 5 | D158: 1 | E158: 1 | F158: 20 | G158: 6 | H158: =RC[-5]*RC[3] -> 150 | I158: 0 | J158: =VLOOKUP(RC[-8],Sheet1!C2:C3,2,FALSE) -> 野蛮巨人碎片 | K158: =VLOOKUP(RC[-1],Sheet1!C5:C6,2,FALSE) -> 30
A159: 1033 | B159: 12404 | C159: 5 | D159: 1 | E159: 1 | F159: 20 | G159: 6 | H159: =RC[-5]*RC[3] -> 150 | I159: 0 | J159: =VLOOKUP(RC[-8],Sheet1!C2:C3,2,FALSE) -> 致命特工碎片 | K159: =VLOOKUP(RC[-1],Sheet1!C5:C6,2,FALSE) -> 30
A160: 1034 | B160: 12405 | C160: 5 | D160: 1 | E160: 1 | F160: 20 | G160: 6 | H160: =RC[-5]*RC[3] -> 150 | I160: 0 | J160: =VLOOKUP(RC[-8],Sheet1!C2:C3,2,FALSE) -> 鹰眸碎片 | K160: =VLOOKUP(RC[-1],Sheet1!C5:C6,2,FALSE) -> 30
A161: 1035 | B161: 12406 | C161: 5 | D161: 1 | E161: 1 | F161: 20 | G161: 6 | H161: =RC[-5]*RC[3] -> 150 | I161: 0 | J161: =VLOOKUP(RC[-8],Sheet1!C2:C3,2,FALSE) -> 刀锋猎人碎片 | K161: =VLOOKUP(RC[-1],Sheet1!C5:C6,2,FALSE) -> 30
A162: 1036 | B162: 12407 | C162: 5 | D162: 1 | E162: 1 | F162: 20 | G162: 6 | H162: =RC[-5]*RC[3] -> 150 | I162: 0 | J162: =VLOOKUP(RC[-8],Sheet1!C2:C3,2,FALSE) -> 地狱骑士碎片 | K162: =VLOOKUP(RC[-1],Sheet1!C5:C6,2,FALSE) -> 30
A163: 1037 | B163: 12408 | C163: 5 | D163: 1 | E163: 1 | F163: 0 | G163: 6 | H163: =RC[-5]*RC[3] -> 200 | I163: 0 | J163: =VLOOKUP(RC[-8],Sheet1!C2:C3,2,FALSE) -> 铁人碎片 | K163: =VLOOKUP(RC[-1],Sheet1!C5:C6,2,FALSE) -> 40
A164: 1038 | B164: 12409 | C164: 5 | D164: 1 | E164: 1 | F164: 20 | G164: 6 | H164: =RC[-5]*RC[3] -> 150 | I164: 0 | J164: =VLOOKUP(RC[-8],Sheet1!C2:C3,2,FALSE) -> 树人碎片 | K164: =VLOOKUP(RC[-1],Sheet1!C5:C6,2,FALSE) -> 30
A165: 1039 | B165: 12410 | C165: 5 | D165: 1 | E165: 1 | F165: 0 | G165: 6 | H165: =RC[-5]*RC[3] -> 200 | I165: 0 | J165: =VLOOKUP(RC[-8],Sheet1!C2:C3,2,FALSE) -> 超凡博士碎片 | K165: =VLOOKUP(RC[-1],Sheet1!C5:C6,2,FALSE) -> 40
A166: 1040 | B166: 12411 | C166: 5 | D166: 1 | E166: 1 | F166: 20 | G166: 6 | H166: =RC[-5]*RC[3] -> 150 | I166: 0 | J166: =VLOOKUP(RC[-8],Sheet1!C2:C3,2,FALSE) -> 白凤凰碎片 | K166: =VLOOKUP(RC[-1],Sheet1!C5:C6,2,FALSE) -> 30
A167: 1041 | B167: 12412 | C167: 5 | D167: 1 | E167: 1 | F167: 20 | G167: 6 | H167: =RC[-5]*RC[3] -> 200 | I167: 0 | J167: =VLOOKUP(RC[-8],Sheet1!C2:C3,2,FALSE) -> 地狱铁拳碎片 | K167: =VLOOKUP(RC[-1],Sheet1!C5:C6,2,FALSE) -> 40
A168: 1042 | B168: 12413 | C168: 5 | D168: 1 | E168: 1 | F168: 20 | G168: 6 | H168: =RC[-5]*RC[3] -> 200 | I168: 0 | J168: =VLOOKUP(RC[-8],Sheet1!C2:C3,2,FALSE) -> 混沌女巫碎片 | K168: =VLOOKUP(RC[-1],Sheet1!C5:C6,2,FALSE) -> 40
A169: 1043 | B169: 12300 | C169: 10 | D169: 1 | E169: 1 | F169: 20 | G169: 6 | H169: =RC[-5]*RC[3] -> 200 | I169: 0 | J169: =VLOOKUP(RC[-8],Sheet1!C2:C3,2,FALSE) -> 警察局长碎片 | K169: =VLOOKUP(RC[-1],Sheet1!C5:C6,2,FALSE) -> 20
A170: 1044 | B170: 12301 | C170: 10 | D170: 1 | E170: 1 | F170: 20 | G170: 6 | H170: =RC[-5]*RC[3] -> 200 | I170: 0 | J170: =VLOOKUP(RC[-8],Sheet1!C2:C3,2,FALSE) -> 初号机碎片 | K170: =VLOOKUP(RC[-1],Sheet1!C5:C6,2,FALSE) -> 20
A171: 1045 | B171: 12302 | C171: 10 | D171: 1 | E171: 1 | F171: 20 | G171: 6 | H171: =RC[-5]*RC[3] -> 200 | I171: 0 | J171: =VLOOKUP(RC[-8],Sheet1!C2:C3,2,FALSE) -> 零式激光炮碎片 | K171: =VLOOKUP(RC[-1],Sheet1!C5:C6,2,FALSE) -> 20
A172: 1046 | B172: 12303 | C172: 10 | D172: 1 | E172: 1 | F172: 20 | G172: 6 | H172: =RC[-5]*RC[3] -> 200 | I172: 0 | J172: =VLOOKUP(RC[-8],Sheet1!C2:C3,2,FALSE) -> 热熔镭射炮碎片 | K172: =VLOOKUP(RC[-1],Sheet1!C5:C6,2,FALSE) -> 20
A173: 1047 | B173: 12304 | C173: 10 | D173: 1 | E173: 1 | F173: 20 | G173: 6 | H173: =RC[-5]*RC[3] -> 200 | I173: 0 | J173: =VLOOKUP(RC[-8],Sheet1!C2:C3,2,FALSE) -> 护士长碎片 | K173: =VLOOKUP(RC[-1],Sheet1!C5:C6,2,FALSE) -> 20
A174: 1048 | B174: 12305 | C174: 10 | D174: 1 | E174: 1 | F174: 20 | G174: 6 | H174: =RC[-5]*RC[3] -> 220 | I174: 0 | J174: =VLOOKUP(RC[-8],Sheet1!C2:C3,2,FALSE) -> 超级队长碎片 | K174: =VLOOKUP(RC[-1],Sheet1!C5:C6,2,FALSE) -> 22
A175: 1049 | B175: 12306 | C175: 10 | D175: 1 | E175: 1 | F175: 20 | G175: 6 | H175: =RC[-5]*RC[3] -> 220 | I175: 0 | J175: =VLOOKUP(RC[-8],Sheet1!C2:C3,2,FALSE) -> 死亡武士碎片 | K175: =VLOOKUP(RC[-1],Sheet1!C5:C6,2,FALSE) -> 22
A176: 1050 | B176: 12400 | C176: 10 | D176: 1 | E176: 1 | F176: 20 | G176: 6 | H176: =RC[-5]*RC[3] -> 300 | I176: 0 | J176: =VLOOKUP(RC[-8],Sheet1!C2:C3,2,FALSE) -> 红颅鬼碎片 | K176: =VLOOKUP(RC[-1],Sheet1!C5:C6,2,FALSE) -> 30
A177: 1051 | B177: 12401 | C177: 10 | D177: 1 | E177: 1 | F177: 20 | G177: 6 | H177: =RC[-5]*RC[3] -> 300 | I177: 0 | J177: =VLOOKUP(RC[-8],Sheet1!C2:C3,2,FALSE) -> 终极队长碎片 | K177: =VLOOKUP(RC[-1],Sheet1!C5:C6,2,FALSE) -> 30
A178: 1052 | B178: 12402 | C178: 10 | D178: 1 | E178: 1 | F178: 20 | G178: 6 | H178: =RC[-5]*RC[3] -> 300 | I178: 0 | J178: =VLOOKUP(RC[-8],Sheet1!C2:C3,2,FALSE) -> 雷神碎片 | K178: =VLOOKUP(RC[-1],Sheet1!C5:C6,2,FALSE) -> 30
A179: 1053 | B179: 12403 | C179: 10 | D179: 1 | E179: 1 | F179: 20 | G179: 6 | H179: =RC[-5]*RC[3] -> 300 | I179: 0 | J179: =VLOOKUP(RC[-8],Sheet1!C2:C3,2,FALSE) -> 野蛮巨人碎片 | K179: =VLOOKUP(RC[-1],Sheet1!C5:C6,2,FALSE) -> 30
A180: 1054 | B180: 12404 | C180: 10 | D180: 1 | E180: 1 | F180: 20 | G180: 6 | H180: =RC[-5]*RC[3] -> 300 | I180: 0 | J180: =VLOOKUP(RC[-8],Sheet1!C2:C3,2,FALSE) -> 致命特工碎片 | K180: =VLOOKUP(RC[-1],Sheet1!C5:C6,2,FALSE) -> 30
A181: 1055 | B181: 12405 | C181: 10 | D181: 1 | E181: 1 | F181: 20 | G181: 6 | H181: =RC[-5]*RC[3] -> 300 | I181: 0 | J181: =VLOOKUP(RC[-8],Sheet1!C2:C3,2,FALSE) -> 鹰眸碎片 | K181: =VLOOKUP(RC[-1],Sheet1!C5:C6,2,FALSE) -> 30
A182: 1056 | B182: 12406 | C182: 10 | D182: 1 | E182: 1 | F182: 20 | G182: 6 | H182: =RC[-5]*RC[3] -> 300 | I182: 0 | J182: =VLOOKUP(RC[-8],Sheet1!C2:C3,2,FALSE) -> 刀锋猎人碎片 | K182: =VLOOKUP(RC[-1],Sheet1!C5:C6,2,FALSE) -> 30
A183: 1057 | B183: 12407 | C183: 10 | D183: 1 | E183: 1 | F183: 20 | G183: 6 | H183: =RC[-5]*RC[3] -> 300 | I183: 0 | J183: =VLOOKUP(RC[-8],Sheet1!C2:C3,2,FALSE) -> 地狱骑士碎片 | K183: =VLOOKUP(RC[-1],Sheet1!C5:C6,2,FALSE) -> 30
A184: 1058 | B184: 12408 | C184: 10 | D184: 1 | E184: 1 | F184: 0 | G184: 6 | H184: =RC[-5]*RC[3] -> 400 | I184: 0 | J184: =VLOOKUP(RC[-8],Sheet1!C2:C3,2,FALSE) -> 铁人碎片 | K184: =VLOOKUP(RC[-1],Sheet1!C5:C6,2,FALSE) -> 40
A185: 1059 | B185: 12409 | C185: 10 | D185: 1 | E185: 1 | F185: 20 | G185: 6 | H185: =RC[-5]*RC[3] -> 300 | I185: 0 | J185: =VLOOKUP(RC[-8],Sheet1!C2:C3,2,FALSE) -> 树人碎片 | K185: =VLOOKUP(RC[-1],Sheet1!C5:C6,2,FALSE) -> 30
A186: 1060 | B186: 12410 | C186: 10 | D186: 1 | E186: 1 | F186: 0 | G186: 6 | H186: =RC[-5]*RC[3] -> 400 | I186: 0 | J186: =VLOOKUP(RC[-8],Sheet1!C2:C3,2,FALSE) -> 超凡博士碎片 | K186: =VLOOKUP(RC[-1],Sheet1!C5:C6,2,FALSE) -> 40
A187: 1061 | B187: 12411 | C187: 10 | D187: 1 | E187: 1 | F187: 20 | G187: 6 | H187: =RC[-5]*RC[3] -> 300 | I187: 0 | J187: =VLOOKUP(RC[-8],Sheet1!C2:C3,2,FALSE) -> 白凤凰碎片 | K187: =VLOOKUP(RC[-1],Sheet1!C5:C6,2,FALSE) -> 30
A188: 1062 | B188: 12412 | C188: 10 | D188: 1 | E188: 1 | F188: 20 | G188: 6 | H188: =RC[-5]*RC[3] -> 400 | I188: 0 | J188: =VLOOKUP(RC[-8],Sheet1!C2:C3,2,FALSE) -> 地狱铁拳碎片 | K188: =VLOOKUP(RC[-1],Sheet1!C5:C6,2,FALSE) -> 40
A189: 1063 | B189: 12413 | C189: 10 | D189: 1 | E189: 1 | F189: 20 | G189: 6 | H189: =RC[-5]*RC[3] -> 400 | I189: 0 | J189: =VLOOKUP(RC[-8],Sheet1!C2:C3,2,FALSE) -> 混沌女巫碎片 | K189: =VLOOKUP(RC[-1],Sheet1!C5:C6,2,FALSE) -> 40
A190: 1064 | B190: 30300 | C190: 1 | D190: 1 | E190: 1 | F190: 1 | G190: 5 | H190: =RC[-5]*RC[3] -> 800 | I190: 0 | J190: =VLOOKUP(RC[-8],Sheet1!C2:C3,2,FALSE) -> 警察局长 | K190: =VLOOKUP(RC[-1],Sheet1!C5:C6,2,FALSE) -> 800
A191: 1065 | B191: 30310 | C191: 1 | D191: 1 | E191: 1 | F191: 1 | G191: 5 | H191: =RC[-5]*RC[3] -> 800 | I191: 0 | J191: =VLOOKUP(RC[-8],Sheet1!C2:C3,2,FALSE) -> 初号机 | K191: =VLOOKUP(RC[-1],Sheet1!C5:C6,2,FALSE) -> 800
A192: 1066 | B192: 30320 | C192: 1 | D192: 1 | E192: 1 | F192: 1 | G192: 5 | H192: =RC[-5]*RC[3] -> 800 | I192: 0 | J192: =VLOOKUP(RC[-8],Sheet1!C2:C3,2,FALSE) -> 零式激光炮 | K192: =VLOOKUP(RC[-1],Sheet1!C5:C6,2,FALSE) -> 800
A193: 1067 | B193: 30330 | C193: 1 | D193: 1 | E193: 1 | F193: 1 | G193: 5 | H193: =RC[-5]*RC[3] -> 800 | I193: 0 | J193: =VLOOKUP(RC[-8],Sheet1!C2:C3,2,FALSE) -> 热熔镭射炮 | K193: =VLOOKUP(RC[-1],Sheet1!C5:C6,2,FALSE) -> 800
A194: 1068 | B194: 30340 | C194: 1 | D194: 1 | E194: 1 | F194: 1 | G194: 5 | H194: =RC[-5]*RC[3] -> 800 | I194: 0 | J194: =VLOOKUP(RC[-8],Sheet1!C2:C3,2,FALSE) -> 护士长 | K194: =VLOOKUP(RC[-1],Sheet1!C5:C6,2,FALSE) -> 800
A195: 1069 | B195: 30301 | C195: 1 | D195: 1 | E195: 1 | F195: 1 | G195: 5 | H195: =RC[-5]*RC[3] -> 880 | I195: 0 | J195: =VLOOKUP(RC[-8],Sheet1!C2:C3,2,FALSE) -> 超级队长 | K195: =VLOOKUP(RC[-1],Sheet1!C5:C6,2,FALSE) -> 880
A196: 1070 | B196: 30302 | C196: 1 | D196: 1 | E196: 1 | F196: 1 | G196: 5 | H196: =RC[-5]*RC[3] -> 880 | I196: 0 | J196: =VLOOKUP(RC[-8],Sheet1!C2:C3,2,FALSE) -> 死亡武士 | K196: =VLOOKUP(RC[-1],Sheet1!C5:C6,2,FALSE) -> 880
A197: 1071 | B197: 30430 | C197: 1 | D197: 1 | E197: 1 | F197: 1 | G197: 5 | H197: =RC[-5]*RC[3] -> 2400 | I197: 0 | J197: =VLOOKUP(RC[-8],Sheet1!C2:C3,2,FALSE) -> 红颅鬼 | K197: =VLOOKUP(RC[-1],Sheet1!C5:C6,2,FALSE) -> 2400
A198: 1072 | B198: 30400 | C198: 1 | D198: 1 | E198: 1 | F198: 1 | G198: 5 | H198: =RC[-5]*RC[3] -> 2400 | I198: 0 | J198: =VLOOKUP(RC[-8],Sheet1!C2:C3,2,FALSE) -> 终极队长 | K198: =VLOOKUP(RC[-1],Sheet1!C5:C6,2,FALSE) -> 2400
A199: 1073 | B199: 30431 | C199: 1 | D199: 1 | E199: 1 | F199: 1 | G199: 5 | H199: =RC[-5]*RC[3] -> 2400 | I199: 0 | J199: =VLOOKUP(RC[-8],Sheet1!C2:C3,2,FALSE) -> 雷神 | K199: =VLOOKUP(RC[-1],Sheet1!C5:C6,2,FALSE) -> 2400
A200: 1074 | B200: 30410 | C200: 1 | D200: 1 | E200: 1 | F200: 1 | G200: 5 | H200: =RC[-5]*RC[3] -> 2400 | I200: 0 | J200: =VLOOKUP(RC[-8],Sheet1!C2:C3,2,FALSE) -> 野蛮巨人 | K200: =VLOOKUP(RC[-1],Sheet1!C5:C6,2,FALSE) -> 2400
A201: 1075 | B201: 30401 | C201: 1 | D201: 1 | E201: 1 | F201: 1 | G201: 5 | H201: =RC[-5]*RC[3] -> 2400 | I201: 0 | J201: =VLOOKUP(RC[-8],Sheet1!C2:C3,2,FALSE) -> 致命特工 | K201: =VLOOKUP(RC[-1],Sheet1!C5:C6,2,FALSE) -> 2400
A202: 1076 | B202: 30420 | C202: 1 | D202: 1 | E202: 1 | F202: 1 | G202: 5 | H202: =RC[-5]*RC[3] -> 2400 | I202: 0 | J202: =VLOOKUP(RC[-8],Sheet1!C2:C3,2,FALSE) -> 鹰眸 | K202: =VLOOKUP(RC[-1],Sheet1!C5:C6,2,FALSE) -> 2400
A203: 1077 | B203: 30402 | C203: 1 | D203: 1 | E203: 1 | F203: 1 | G203: 5 | H203: =RC[-5]*RC[3] -> 2400 | I203: 0 | J203: =VLOOKUP(RC[-8],Sheet1!C2:C3,2,FALSE) -> 刀锋猎人 | K203: =VLOOKUP(RC[-1],Sheet1!C5:C6,2,FALSE) -> 2400
A204: 1078 | B204: 30403 | C204: 1 | D204: 1 | E204: 1 | F204: 1 | G204: 5 | H204: =RC[-5]*RC[3] -> 2400 | I204: 0 | J204: =VLOOKUP(RC[-8],Sheet1!C2:C3,2,FALSE) -> 地狱骑士 | K204: =VLOOKUP(RC[-1],Sheet1!C5:C6,2,FALSE) -> 2400
A205: 1079 | B205: 30428 | C205: 1 | D205: 1 | E205: 1 | F205: 0 | G205: 5 | H205: =RC[-5]*RC[3] -> 3200 | I205: 0 | J205: =VLOOKUP(RC[-8],Sheet1!C2:C3,2,FALSE) -> 铁人 | K205: =VLOOKUP(RC[-1],Sheet1!C5:C6,2,FALSE) -> 3200
A206: 1080 | B206: 30411 | C206: 1 | D206: 1 | E206: 1 | F206: 1 | G206: 5 | H206: =RC[-5]*RC[3] -> 2400 | I206: 0 | J206: =VLOOKUP(RC[-8],Sheet1!C2:C3,2,FALSE) -> 树人 | K206: =VLOOKUP(RC[-1],Sheet1!C5:C6,2,FALSE) -> 2400
A207: 1081 | B207: 30438 | C207: 1 | D207: 1 | E207: 1 | F207: 0 | G207: 5 | H207: =RC[-5]*RC[3] -> 3200 | I207: 0 | J207: =VLOOKUP(RC[-8],Sheet1!C2:C3,2,FALSE) -> 超凡博士 | K207: =VLOOKUP(RC[-1],Sheet1!C5:C6,2,FALSE) -> 3200
A208: 1082 | B208: 30440 | C208: 1 | D208: 1 | E208: 1 | F208: 1 | G208: 5 | H208: =RC[-5]*RC[3] -> 2400 | I208: 0 | J208: =VLOOKUP(RC[-8],Sheet1!C2:C3,2,FALSE) -> 白凤凰 | K208: =VLOOKUP(RC[-1],Sheet1!C5:C6,2,FALSE) -> 2400
A209: 1083 | B209: 30429 | C209: 1 | D209: 1 | E209: 1 | F209: 1 | G209: 5 | H209: =RC[-5]*RC[3] -> 3200 | I209: 0 | J209: =VLOOKUP(RC[-8],Sheet1!C2:C3,2,FALSE) -> 地狱铁拳 | K209: =VLOOKUP(RC[-1],Sheet1!C5:C6,2,FALSE) -> 3200
A210: 1084 | B210: 30449 | C210: 1 | D210: 1 | E210: 1 | F210: 1 | G210: 5 | H210: =RC[-5]*RC[3] -> 3200 | I210: 0 | J210: =VLOOKUP(RC[-8],Sheet1!C2:C3,2,FALSE) -> 混沌女巫 | K210: =VLOOKUP(RC[-1],Sheet1!C5:C6,2,FALSE) -> 3200
A211: 1085 | B211: 12300 | C211: 5 | D211: 1 | E211: 1 | F211: 20 | G211: 5 | H211: =RC[-5]*RC[3] -> 100 | I211: 0 | J211: =VLOOKUP(RC[-8],Sheet1!C2:C3,2,FALSE) -> 警察局长碎片 | K211: =VLOOKUP(RC[-1],Sheet1!C5:C6,2,FALSE) -> 20
A212: 1086 | B212: 12301 | C212: 5 | D212: 1 | E212: 1 | F212: 20 | G212: 5 | H212: =RC[-5]*RC[3] -> 100 | I212: 0 | J212: =VLOOKUP(RC[-8],Sheet1!C2:C3,2,FALSE) -> 初号机碎片 | K212: =VLOOKUP(RC[-1],Sheet1!C5:C6,2,FALSE) -> 20
A213: 1087 | B213: 12302 | C213: 5 | D213: 1 | E213: 1 | F213: 20 | G213: 5 | H213: =RC[-5]*RC[3] -> 100 | I213: 0 | J213: =VLOOKUP(RC[-8],Sheet1!C2:C3,2,FALSE) -> 零式激光炮碎片 | K213: =VLOOKUP(RC[-1],Sheet1!C5:C6,2,FALSE) -> 20
A214: 1088 | B214: 12303 | C214: 5 | D214: 1 | E214: 1 | F214: 20 | G214: 5 | H214: =RC[-5]*RC[3] -> 100 | I214: 0 | J214: =VLOOKUP(RC[-8],Sheet1!C2:C3,2,FALSE) -> 热熔镭射炮碎片 | K214: =VLOOKUP(RC[-1],Sheet1!C5:C6,2,FALSE) -> 20
A215: 1089 | B215: 12304 | C215: 5 | D215: 1 | E215: 1 | F215: 20 | G215: 5 | H215: =RC[-5]*RC[3] -> 100 | I215: 0 | J215: =VLOOKUP(RC[-8],Sheet1!C2:C3,2,FALSE) -> 护士长碎片 | K215: =VLOOKUP(RC[-1],Sheet1!C5:C6,2,FALSE) -> 20
A216: 1090 | B216: 12305 | C216: 5 | D216: 1 | E216: 1 | F216: 20 | G216: 5 | H216: =RC[-5]*RC[3] -> 110 | I216: 0 | J216: =VLOOKUP(RC[-8],Sheet1!C2:C3,2,FALSE) -> 超级队长碎片 | K216: =VLOOKUP(RC[-1],Sheet1!C5:C6,2,FALSE) -> 22
A217: 1091 | B217: 12306 | C217: 5 | D217: 1 | E217: 1 | F217: 20 | G217: 5 | H217: =RC[-5]*RC[3] -> 110 | I217: 0 | J217: =VLOOKUP(RC[-8],Sheet1!C2:C3,2,FALSE) -> 死亡武士碎片 | K217: =VLOOKUP(RC[-1],Sheet1!C5:C6,2,FALSE) -> 22
A218: 1092 | B218: 12400 | C218: 5 | D218: 1 | E218: 1 | F218: 20 | G218: 5 | H218: =RC[-5]*RC[3] -> 150 | I218: 0 | J218: =VLOOKUP(RC[-8],Sheet1!C2:C3,2,FALSE) -> 红颅鬼碎片 | K218: =VLOOKUP(RC[-1],Sheet1!C5:C6,2,FALSE) -> 30
A219: 1093 | B219: 12401 | C219: 5 | D219: 1 | E219: 1 | F219: 20 | G219: 5 | H219: =RC[-5]*RC[3] -> 150 | I219: 0 | J219: =VLOOKUP(RC[-8],Sheet1!C2:C3,2,FALSE) -> 终极队长碎片 | K219: =VLOOKUP(RC[-1],Sheet1!C5:C6,2,FALSE) -> 30
A220: 1094 | B220: 12402 | C220: 5 | D220: 1 | E220: 1 | F220: 20 | G220: 5 | H220: =RC[-5]*RC[3] -> 150 | I220: 0 | J220: =VLOOKUP(RC[-8],Sheet1!C2:C3,2,FALSE) -> 雷神碎片 | K220: =VLOOKUP(RC[-1],Sheet1!C5:C6,2,FALSE) -> 30
A221: 1095 | B221: 12403 | C221: 5 | D221: 1 | E221: 1 | F221: 20 | G221: 5 | H221: =RC[-5]*RC[3] -> 150 | I221: 0 | J221: =VLOOKUP(RC[-8],Sheet1!C2:C3,2,FALSE) -> 野蛮巨人碎片 | K221: =VLOOKUP(RC[-1],Sheet1!C5:C6,2,FALSE) -> 30
A222: 1096 | B222: 12404 | C222: 5 | D222: 1 | E222: 1 | F222: 20 | G222: 5 | H222: =RC[-5]*RC[3] -> 150 | I222: 0 | J222: =VLOOKUP(RC[-8],Sheet1!C2:C3,2,FALSE) -> 致命特工碎片 | K222: =VLOOKUP(RC[-1],Sheet1!C5:C6,2,FALSE) -> 30
A223: 1097 | B223: 12405 | C223: 5 | D223: 1 | E223: 1 | F223: 20 | G223: 5 | H223: =RC[-5]*RC[3] -> 150 | I223: 0 | J223: =VLOOKUP(RC[-8],Sheet1!C2:C3,2,FALSE) -> 鹰眸碎片 | K223: =VLOOKUP(RC[-1],Sheet1!C5:C6,2,FALSE) -> 30
A224: 1098 | B224: 12406 | C224: 5 | D224: 1 | E224: 1 | F224: 20 | G224: 5 | H224: =RC[-5]*RC[3] -> 150 | I224: 0 | J224: =VLOOKUP(RC[-8],Sheet1!C2:C3,2,FALSE) -> 刀锋猎人碎片 | K224: =VLOOKUP(RC[-1],Sheet1!C5:C6,2,FALSE) -> 30
A225: 1099 | B225: 12407 | C225: 5 | D225: 1 | E225: 1 | F225: 20 | G225: 5 | H225: =RC[-5]*RC[3] -> 150 | I225: 0 | J225: =VLOOKUP(RC[-8],Sheet1!C2:C3,2,FALSE) -> 地狱骑士碎片 | K225: =VLOOKUP(RC[-1],Sheet1!C5:C6,2,FALSE) -> 30
A226: 1100 | B226: 12408 | C226: 5 | D226: 1 | E226: 1 | F226: 20 | G226: 5 | H226: =RC[-5]*RC[3] -> 200 | I226: 0 | J226: =VLOOKUP(RC[-8],Sheet1!C2:C3,2,FALSE) -> 铁人碎片 | K226: =VLOOKUP(RC[-1],Sheet1!C5:C6,2,FALSE) -> 40
A227: 1101 | B227: 12409 | C227: 5 | D227: 1 | E227: 1 | F227: 20 | G227: 5 | H227: =RC[-5]*RC[3] -> 150 | I227: 0 | J227: =VLOOKUP(RC[-8],Sheet1!C2:C3,2,FALSE) -> 树人碎片 | K227: =VLOOKUP(RC[-1],Sheet1!C5:C6,2,FALSE) -> 30
A228: 1102 | B228: 12410 | C228: 5 | D228: 1 | E228: 1 | F228: 20 | G228: 5 | H228: =RC[-5]*RC[3] -> 200 | I228: 0 | J228: =VLOOKUP(RC[-8],Sheet1!C2:C3,2,FALSE) -> 超凡博士碎片 | K228: =VLOOKUP(RC[-1],Sheet1!C5:C6,2,FALSE) -> 40
A229: 1103 | B229: 12411 | C229: 5 | D229: 1 | E229: 1 | F229: 20 | G229: 5 | H229: =RC[-5]*RC[3] -> 150 | I229: 0 | J229: =VLOOKUP(RC[-8],Sheet1!C2:C3,2,FALSE) -> 白凤凰碎片 | K229: =VLOOKUP(RC[-1],Sheet1!C5:C6,2,FALSE) -> 30
A230: 1104 | B230: 12412 | C230: 5 | D230: 1 | E230: 1 | F230: 20 | G230: 5 | H230: =RC[-5]*RC[3] -> 200 | I230: 0 | J230: =VLOOKUP(RC[-8],Sheet1!C2:C3,2,FALSE) -> 地狱铁拳碎片 | K230: =VLOOKUP(RC[-1],Sheet1!C5:C6,2,FALSE) -> 40
A231: 1105 | B231: 12413 | C231: 5 | D231: 1 | E231: 1 | F231: 20 | G231: 5 | H231: =RC[-5]*RC[3] -> 200 | I231: 0 | J231: =VLOOKUP(RC[-8],Sheet1!C2:C3,2,FALSE) -> 混沌女巫碎片 | K231: =VLOOKUP(RC[-1],Sheet1!C5:C6,2,FALSE) -> 40
A232: 1106 | B232: 12300 | C232: 10 | D232: 1 | E232: 1 | F232: 20 | G232: 5 | H232: =RC[-5]*RC[3] -> 200 | I232: 0 | J232: =VLOOKUP(RC[-8],Sheet1!C2:C3,2,FALSE) -> 警察局长碎片 | K232: =VLOOKUP(RC[-1],Sheet1!C5:C6,2,FALSE) -> 20
A233: 1107 | B233: 12301 | C233: 10 | D233: 1 | E233: 1 | F233: 20 | G233: 5 | H233: =RC[-5]*RC[3] -> 200 | I233: 0 | J233: =VLOOKUP(RC[-8],Sheet1!C2:C3,2,FALSE) -> 初号机碎片 | K233: =VLOOKUP(RC[-1],Sheet1!C5:C6,2,FALSE) -> 20
A234: 1108 | B234: 12302 | C234: 10 | D234: 1 | E234: 1 | F234: 20 | G234: 5 | H234: =RC[-5]*RC[3] -> 200 | I234: 0 | J234: =VLOOKUP(RC[-8],Sheet1!C2:C3,2,FALSE) -> 零式激光炮碎片 | K234: =VLOOKUP(RC[-1],Sheet1!C5:C6,2,FALSE) -> 20
A235: 1109 | B235: 12303 | C235: 10 | D235: 1 | E235: 1 | F235: 20 | G235: 5 | H235: =RC[-5]*RC[3] -> 200 | I235: 0 | J235: =VLOOKUP(RC[-8],Sheet1!C2:C3,2,FALSE) -> 热熔镭射炮碎片 | K235: =VLOOKUP(RC[-1],Sheet1!C5:C6,2,FALSE) -> 20
A236: 1110 | B236: 12304 | C236: 10 | D236: 1 | E236: 1 | F236: 20 | G236: 5 | H236: =RC[-5]*RC[3] -> 200 | I236: 0 | J236: =VLOOKUP(RC[-8],Sheet1!C2:C3,2,FALSE) -> 护士长碎片 | K236: =VLOOKUP(RC[-1],Sheet1!C5:C6,2,FALSE) -> 20
A237: 1111 | B237: 12305 | C237: 10 | D237: 1 | E237: 1 | F237: 20 | G237: 5 | H237: =RC[-5]*RC[3] -> 220 | I237: 0 | J237: =VLOOKUP(RC[-8],Sheet1!C2:C3,2,FALSE) -> 超级队长碎片 | K237: =VLOOKUP(RC[-1],Sheet1!C5:C6,2,FALSE) -> 22
A238: 1112 | B238: 12306 | C238: 10 | D238: 1 | E238: 1 | F238: 20 | G238: 5 | H238: =RC[-5]*RC[3] -> 220 | I238: 0 | J238: =VLOOKUP(RC[-8],Sheet1!C2:C3,2,FALSE) -> 死亡武士碎片 | K238: =VLOOKUP(RC[-1],Sheet1!C5:C6,2,FALSE) -> 22
A239: 1113 | B239: 12400 | C239: 10 | D239: 1 | E239: 1 | F239: 20 | G239: 5 | H239: =RC[-5]*RC[3] -> 300 | I239: 0 | J239: =VLOOKUP(RC[-8],Sheet1!C2:C3,2,FALSE) -> 红颅鬼碎片 | K239: =VLOOKUP(RC[-1],Sheet1!C5:C6,2,FALSE) -> 30
A240: 1114 | B240: 12401 | C240: 10 | D240: 1 | E240: 1 | F240: 20 | G240: 5 | H240: =RC[-5]*RC[3] -> 300 | I240: 0 | J240: =VLOOKUP(RC[-8],Sheet1!C2:C3,2,FALSE) -> 终极队长碎片 | K240: =VLOOKUP(RC[-1],Sheet1!C5:C6,2,FALSE) -> 30
A241: 1115 | B241: 12402 | C241: 10 | D241: 1 | E241: 1 | F241: 20 | G241: 5 | H241: =RC[-5]*RC[3] -> 300 | I241: 0 | J241: =VLOOKUP(RC[-8],Sheet1!C2:C3,2,FALSE) -> 雷神碎片 | K241: =VLOOKUP(RC[-1],Sheet1!C5:C6,2,FALSE) -> 30
A242: 1116 | B242: 12403 | C242: 10 | D242: 1 | E242: 1 | F242: 20 | G242: 5 | H242: =RC[-5]*RC[3] -> 300 | I242: 0 | J242: =VLOOKUP(RC[-8],Sheet1!C2:C3,2,FALSE) -> 野蛮巨人碎片 | K242: =VLOOKUP(RC[-1],Sheet1!C5:C6,2,FALSE) -> 30
A243: 1117 | B243: 12404 | C243: 10 | D243: 1 | E243: 1 | F243: 20 | G243: 5 | H243: =RC[-5]*RC[3] -> 300 | I243: 0 | J243: =VLOOKUP(RC[-8],Sheet1!C2:C3,2,FALSE) -> 致命特工碎片 | K243: =VLOOKUP(RC[-1],Sheet1!C5:C6,2,FALSE) -> 30
A244: 1118 | B244: 12405 | C244: 10 | D244: 1 | E244: 1 | F244: 20 | G244: 5 | H244: =RC[-5]*RC[3] -> 300 | I244: 0 | J244: =VLOOKUP(RC[-8],Sheet1!C2:C3,2,FALSE) -> 鹰眸碎片 | K244: =VLOOKUP(RC[-1],Sheet1!C5:C6,2,FALSE) -> 30
A245: 1119 | B245: 12406 | C245: 10 | D245: 1 | E245: 1 | F245: 20 | G245: 5 | H245: =RC[-5]*RC[3] -> 300 | I245: 0 | J245: =VLOOKUP(RC[-8],Sheet1!C2:C3,2,FALSE) -> 刀锋猎人碎片 | K245: =VLOOKUP(RC[-1],Sheet1!C5:C6,2,FALSE) -> 30
A246: 1120 | B246: 12407 | C246: 10 | D246: 1 | E246: 1 | F246: 20 | G246: 5 | H246: =RC[-5]*RC[3] -> 300 | I246: 0 | J246: =VLOOKUP(RC[-8],Sheet1!C2:C3,2,FALSE) -> 地狱骑士碎片 | K246: =VLOOKUP(RC[-1],Sheet1!C5:C6,2,FALSE) -> 30
A247: 1121 | B247: 12408 | C247: 10 | D247: 1 | E247: 1 | F247: 20 | G247: 5 | H247: =RC[-5]*RC[3] -> 400 | I247: 0 | J247: =VLOOKUP(RC[-8],Sheet1!C2:C3,2,FALSE) -> 铁人碎片 | K247: =VLOOKUP(RC[-1],Sheet1!C5:C6,2,FALSE) -> 40
A248: 1122 | B248: 12409 | C248: 10 | D248: 1 | E248: 1 | F248: 20 | G248: 5 | H248: =RC[-5]*RC[3] -> 300 | I248: 0 | J248: =VLOOKUP(RC[-8],Sheet1!C2:C3,2,FALSE) -> 树人碎片 | K248: =VLOOKUP(RC[-1],Sheet1!C5:C6,2,FALSE) -> 30
A249: 1123 | B249: 12410 | C249: 10 | D249: 1 | E249: 1 | F249: 20 | G249: 5 | H249: =RC[-5]*RC[3] -> 400 | I249: 0 | J249: =VLOOKUP(RC[-8],Sheet1!C2:C3,2,FALSE) -> 超凡博士碎片 | K249: =VLOOKUP(RC[-1],Sheet1!C5:C6,2,FALSE) -> 40
A250: 1124 | B250: 12411 | C250: 10 | D250: 1 | E250: 1 | F250: 20 | G250: 5 | H250: =RC[-5]*RC[3] -> 300 | I250: 0 | J250: =VLOOKUP(RC[-8],Sheet1!C2:C3,2,FALSE) -> 白凤凰碎片 | K250: =VLOOKUP(RC[-1],Sheet1!C5:C6,2,FALSE) -> 30
A251: 1125 | B251: 12412 | C251: 10 | D251: 1 | E251: 1 | F251: 20 | G251: 5 | H251: =RC[-5]*RC[3] -> 400 | I251: 0 | J251: =VLOOKUP(RC[-8],Sheet1!C2:C3,2,FALSE) -> 地狱铁拳碎片 | K251: =VLOOKUP(RC[-1],Sheet1!C5:C6,2,FALSE) -> 40
A252: 1126 | B252: 12413 | C252: 10 | D252: 1 | E252: 1 | F252: 20 | G252: 5 | H252: =RC[-5]*RC[3] -> 400 | I252: 0 | J252: =VLOOKUP(RC[-8],Sheet1!C2:C3,2,FALSE) -> 混沌女巫碎片 | K252: =VLOOKUP(RC[-1],Sheet1!C5:C6,2,FALSE) -> 40
A253: 1301 | B253: 31300 | C253: 1 | D253: 1 | E253: 1 | F253: 1 | G253: 6 | H253: =RC[-5]*RC[3] -> 800 | I253: 0 | J253: =VLOOKUP(RC[-8],Sheet1!C2:C3,2,FALSE) -> 竞技场王者 | K253: =VLOOKUP(RC[-1],Sheet1!C5:C6,2,FALSE) -> 800
A254: 1302 | B254: 31310 | C254: 1 | D254: 1 | E254: 1 | F254: 1 | G254: 6 | H254: =RC[-5]*RC[3] -> 800 | I254: 0 | J254: =VLOOKUP(RC[-8],Sheet1!C2:C3,2,FALSE) -> 重甲武士 | K254: =VLOOKUP(RC[-1],Sheet1!C5:C6,2,FALSE) -> 800
A255: 1303 | B255: 31320 | C255: 1 | D255: 1 | E255: 1 | F255: 1 | G255: 6 | H255: =RC[-5]*RC[3] -> 800 | I255: 0 | J255: =VLOOKUP(RC[-8],Sheet1!C2:C3,2,FALSE) -> 影杀者 | K255: =VLOOKUP(RC[-1],Sheet1!C5:C6,2,FALSE) -> 800
A256: 1304 | B256: 31330 | C256: 1 | D256: 1 | E256: 1 | F256: 1 | G256: 6 | H256: =RC[-5]*RC[3] -> 800 | I256: 0 | J256: =VLOOKUP(RC[-8],Sheet1!C2:C3,2,FALSE) -> 暗影巫师 | K256: =VLOOKUP(RC[-1],Sheet1!C5:C6,2,FALSE) -> 800
A257: 1305 | B257: 31340 | C257: 1 | D257: 1 | E257: 1 | F257: 1 | G257: 6 | H257: =RC[-5]*RC[3] -> 800 | I257: 0 | J257: =VLOOKUP(RC[-8],Sheet1!C2:C3,2,FALSE) -> 圣光牧师 | K257: =VLOOKUP(RC[-1],Sheet1!C5:C6,2,FALSE) -> 800
A258: 1306 | B258: 31301 | C258: 1 | D258: 1 | E258: 1 | F258: 1 | G258: 6 | H258: =RC[-5]*RC[3] -> 880 | I258: 0 | J258: =VLOOKUP(RC[-8],Sheet1!C2:C3,2,FALSE) -> 杰克船长 | K258: =VLOOKUP(RC[-1],Sheet1!C5:C6,2,FALSE) -> 880
A259: 1307 | B259: 31341 | C259: 1 | D259: 1 | E259: 1 | F259: 1 | G259: 6 | H259: =RC[-5]*RC[3] -> 880 | I259: 0 | J259: =VLOOKUP(RC[-8],Sheet1!C2:C3,2,FALSE) -> 天使长 | K259: =VLOOKUP(RC[-1],Sheet1!C5:C6,2,FALSE) -> 880
A260: 1308 | B260: 31400 | C260: 1 | D260: 1 | E260: 1 | F260: 1 | G260: 6 | H260: =RC[-5]*RC[3] -> 2400 | I260: 0 | J260: =VLOOKUP(RC[-8],Sheet1!C2:C3,2,FALSE) -> 独眼巨人 | K260: =VLOOKUP(RC[-1],Sheet1!C5:C6,2,FALSE) -> 2400
A261: 1309 | B261: 31440 | C261: 1 | D261: 1 | E261: 1 | F261: 1 | G261: 6 | H261: =RC[-5]*RC[3] -> 2400 | I261: 0 | J261: =VLOOKUP(RC[-8],Sheet1!C2:C3,2,FALSE) -> 圣女贞德 | K261: =VLOOKUP(RC[-1],Sheet1!C5:C6,2,FALSE) -> 2400
A262: 1310 | B262: 31430 | C262: 1 | D262: 1 | E262: 1 | F262: 1 | G262: 6 | H262: =RC[-5]*RC[3] -> 2400 | I262: 0 | J262: =VLOOKUP(RC[-8],Sheet1!C2:C3,2,FALSE) -> 美杜莎 | K262: =VLOOKUP(RC[-1],Sheet1!C5:C6,2,FALSE) -> 2400
A263: 1311 | B263: 31401 | C263: 1 | D263: 1 | E263: 1 | F263: 1 | G263: 6 | H263: =RC[-5]*RC[3] -> 2400 | I263: 0 | J263: =VLOOKUP(RC[-8],Sheet1!C2:C3,2,FALSE) -> 德古拉伯爵 | K263: =VLOOKUP(RC[-1],Sheet1!C5:C6,2,FALSE) -> 2400
A264: 1312 | B264: 31431 | C264: 1 | D264: 1 | E264: 1 | F264: 1 | G264: 6 | H264: =RC[-5]*RC[3] -> 2400 | I264: 0 | J264: =VLOOKUP(RC[-8],Sheet1!C2:C3,2,FALSE) -> 狩猎女神 | K264: =VLOOKUP(RC[-1],Sheet1!C5:C6,2,FALSE) -> 2400
A265: 1313 | B265: 31402 | C265: 1 | D265: 1 | E265: 1 | F265: 1 | G265: 6 | H265: =RC[-5]*RC[3] -> 2400 | I265: 0 | J265: =VLOOKUP(RC[-8],Sheet1!C2:C3,2,FALSE) -> 查理大帝 | K265: =VLOOKUP(RC[-1],Sheet1!C5:C6,2,FALSE) -> 2400
A266: 1314 | B266: 31403 | C266: 1 | D266: 1 | E266: 1 | F266: 1 | G266: 6 | H266: =RC[-5]*RC[3] -> 2400 | I266: 0 | J266: =VLOOKUP(RC[-8],Sheet1!C2:C3,2,FALSE) -> 佐罗 | K266: =VLOOKUP(RC[-1],Sheet1!C5:C6,2,FALSE) -> 2400
A267: 1315 | B267: 31420 | C267: 1 | D267: 1 | E267: 1 | F267: 1 | G267: 6 | H267: =RC[-5]*RC[3] -> 2400 | I267: 0 | J267: =VLOOKUP(RC[-8],Sheet1!C2:C3,2,FALSE) -> 亚马逊女王 | K267: =VLOOKUP(RC[-1],Sheet1!C5:C6,2,FALSE) -> 2400
A268: 1316 | B268: 31438 | C268: 1 | D268: 1 | E268: 1 | F268: 0 | G268: 6 | H268: =RC[-5]*RC[3] -> 3200 | I268: 0 | J268: =VLOOKUP(RC[-8],Sheet1!C2:C3,2,FALSE) -> 宙斯 | K268: =VLOOKUP(RC[-1],Sheet1!C5:C6,2,FALSE) -> 3200
A269: 1317 | B269: 31410 | C269: 1 | D269: 1 | E269: 1 | F269: 1 | G269: 6 | H269: =RC[-5]*RC[3] -> 2400 | I269: 0 | J269: =VLOOKUP(RC[-8],Sheet1!C2:C3,2,FALSE) -> 斯巴达 | K269: =VLOOKUP(RC[-1],Sheet1!C5:C6,2,FALSE) -> 2400
A270: 1318 | B270: 31408 | C270: 1 | D270: 1 | E270: 1 | F270: 0 | G270: 6 | H270: =RC[-5]*RC[3] -> 3200 | I270: 0 | J270: =VLOOKUP(RC[-8],Sheet1!C2:C3,2,FALSE) -> 阿努比斯 | K270: =VLOOKUP(RC[-1],Sheet1!C5:C6,2,FALSE) -> 3200
A271: 1319 | B271: 31441 | C271: 1 | D271: 1 | E271: 1 | F271: 1 | G271: 6 | H271: =RC[-5]*RC[3] -> 2400 | I271: 0 | J271: =VLOOKUP(RC[-8],Sheet1!C2:C3,2,FALSE) -> 雅典娜 | K271: =VLOOKUP(RC[-1],Sheet1!C5:C6,2,FALSE) -> 2400
A272: 1320 | B272: 31419 | C272: 1 | D272: 1 | E272: 1 | F272: 1 | G272: 6 | H272: =RC[-5]*RC[3] -> 3200 | I272: 0 | J272: =VLOOKUP(RC[-8],Sheet1!C2:C3,2,FALSE) -> 大力神 | K272: =VLOOKUP(RC[-1],Sheet1!C5:C6,2,FALSE) -> 3200
A273: 1321 | B273: 31439 | C273: 1 | D273: 1 | E273: 1 | F273: 1 | G273: 6 | H273: =RC[-5]*RC[3] -> 3200 | I273: 0 | J273: =VLOOKUP(RC[-8],Sheet1!C2:C3,2,FALSE) -> 冥王哈迪斯 | K273: =VLOOKUP(RC[-1],Sheet1!C5:C6,2,FALSE) -> 3200
A274: 1322 | B274: 12330 | C274: 5 | D274: 1 | E274: 1 | F274: 20 | G274: 6 | H274: =RC[-5]*RC[3] -> 100 | I274: 0 | J274: =VLOOKUP(RC[-8],Sheet1!C2:C3,2,FALSE) -> 竞技场王者碎片 | K274: =VLOOKUP(RC[-1],Sheet1!C5:C6,2,FALSE) -> 20
A275: 1323 | B275: 12331 | C275: 5 | D275: 1 | E275: 1 | F275: 20 | G275: 6 | H275: =RC[-5]*RC[3] -> 100 | I275: 0 | J275: =VLOOKUP(RC[-8],Sheet1!C2:C3,2,FALSE) -> 重甲武士碎片 | K275: =VLOOKUP(RC[-1],Sheet1!C5:C6,2,FALSE) -> 20
A276: 1324 | B276: 12332 | C276: 5 | D276: 1 | E276: 1 | F276: 20 | G276: 6 | H276: =RC[-5]*RC[3] -> 100 | I276: 0 | J276: =VLOOKUP(RC[-8],Sheet1!C2:C3,2,FALSE) -> 影杀者碎片 | K276: =VLOOKUP(RC[-1],Sheet1!C5:C6,2,FALSE) -> 20
A277: 1325 | B277: 12333 | C277: 5 | D277: 1 | E277: 1 | F277: 20 | G277: 6 | H277: =RC[-5]*RC[3] -> 100 | I277: 0 | J277: =VLOOKUP(RC[-8],Sheet1!C2:C3,2,FALSE) -> 暗影巫师碎片 | K277: =VLOOKUP(RC[-1],Sheet1!C5:C6,2,FALSE) -> 20
A278: 1326 | B278: 12334 | C278: 5 | D278: 1 | E278: 1 | F278: 20 | G278: 6 | H278: =RC[-5]*RC[3] -> 100 | I278: 0 | J278: =VLOOKUP(RC[-8],Sheet1!C2:C3,2,FALSE) -> 圣光牧师碎片 | K278: =VLOOKUP(RC[-1],Sheet1!C5:C6,2,FALSE) -> 20
A279: 1327 | B279: 12335 | C279: 5 | D279: 1 | E279: 1 | F279: 20 | G279: 6 | H279: =RC[-5]*RC[3] -> 110 | I279: 0 | J279: =VLOOKUP(RC[-8],Sheet1!C2:C3,2,FALSE) -> 杰克船长碎片 | K279: =VLOOKUP(RC[-1],Sheet1!C5:C6,2,FALSE) -> 22
A280: 1328 | B280: 12336 | C280: 5 | D280: 1 | E280: 1 | F280: 20 | G280: 6 | H280: =RC[-5]*RC[3] -> 110 | I280: 0 | J280: =VLOOKUP(RC[-8],Sheet1!C2:C3,2,FALSE) -> 天使长碎片 | K280: =VLOOKUP(RC[-1],Sheet1!C5:C6,2,FALSE) -> 22
A281: 1329 | B281: 12430 | C281: 5 | D281: 1 | E281: 1 | F281: 20 | G281: 6 | H281: =RC[-5]*RC[3] -> 150 | I281: 0 | J281: =VLOOKUP(RC[-8],Sheet1!C2:C3,2,FALSE) -> 独眼巨人碎片 | K281: =VLOOKUP(RC[-1],Sheet1!C5:C6,2,FALSE) -> 30
A282: 1330 | B282: 12431 | C282: 5 | D282: 1 | E282: 1 | F282: 20 | G282: 6 | H282: =RC[-5]*RC[3] -> 150 | I282: 0 | J282: =VLOOKUP(RC[-8],Sheet1!C2:C3,2,FALSE) -> 圣女贞德碎片 | K282: =VLOOKUP(RC[-1],Sheet1!C5:C6,2,FALSE) -> 30
A283: 1331 | B283: 12432 | C283: 5 | D283: 1 | E283: 1 | F283: 20 | G283: 6 | H283: =RC[-5]*RC[3] -> 150 | I283: 0 | J283: =VLOOKUP(RC[-8],Sheet1!C2:C3,2,FALSE) -> 美杜莎碎片 | K283: =VLOOKUP(RC[-1],Sheet1!C5:C6,2,FALSE) -> 30
A284: 1332 | B284: 12433 | C284: 5 | D284: 1 | E284: 1 | F284: 20 | G284: 6 | H284: =RC[-5]*RC[3] -> 150 | I284: 0 | J284: =VLOOKUP(RC[-8],Sheet1!C2:C3,2,FALSE) -> 德古拉伯爵碎片 | K284: =VLOOKUP(RC[-1],Sheet1!C5:C6,2,FALSE) -> 30
A285: 1333 | B285: 12434 | C285: 5 | D285: 1 | E285: 1 | F285: 20 | G285: 6 | H285: =RC[-5]*RC[3] -> 150 | I285: 0 | J285: =VLOOKUP(RC[-8],Sheet1!C2:C3,2,FALSE) -> 狩猎女神碎片 | K285: =VLOOKUP(RC[-1],Sheet1!C5:C6,2,FALSE) -> 30
A286: 1334 | B286: 12435 | C286: 5 | D286: 1 | E286: 1 | F286: 20 | G286: 6 | H286: =RC[-5]*RC[3] -> 150 | I286: 0 | J286: =VLOOKUP(RC[-8],Sheet1!C2:C3,2,FALSE) -> 查理大帝碎片 | K286: =VLOOKUP(RC[-1],Sheet1!C5:C6,2,FALSE) -> 30
A287: 1335 | B287: 12436 | C287: 5 | D287: 1 | E287: 1 | F287: 20 | G287: 6 | H287: =RC[-5]*RC[3] -> 150 | I287: 0 | J287: =VLOOKUP(RC[-8],Sheet1!C2:C3,2,FALSE) -> 佐罗碎片 | K287: =VLOOKUP(RC[-1],Sheet1!C5:C6,2,FALSE) -> 30
A288: 1336 | B288: 12437 | C288: 5 | D288: 1 | E288: 1 | F288: 20 | G288: 6 | H288: =RC[-5]*RC[3] -> 150 | I288: 0 | J288: =VLOOKUP(RC[-8],Sheet1!C2:C3,2,FALSE) -> 亚马逊女王碎片 | K288: =VLOOKUP(RC[-1],Sheet1!C5:C6,2,FALSE) -> 30
A289: 1337 | B289: 12438 | C289: 5 | D289: 1 | E289: 1 | F289: 0 | G289: 6 | H289: =RC[-5]*RC[3] -> 200 | I289: 0 | J289: =VLOOKUP(RC[-8],Sheet1!C2:C3,2,FALSE) -> 宙斯碎片 | K289: =VLOOKUP(RC[-1],Sheet1!C5:C6,2,FALSE) -> 40
A290: 1338 | B290: 12439 | C290: 5 | D290: 1 | E290: 1 | F290: 20 | G290: 6 | H290: =RC[-5]*RC[3] -> 150 | I290: 0 | J290: =VLOOKUP(RC[-8],Sheet1!C2:C3,2,FALSE) -> 斯巴达碎片 | K290: =VLOOKUP(RC[-1],Sheet1!C5:C6,2,FALSE) -> 30
A291: 1339 | B291: 12440 | C291: 5 | D291: 1 | E291: 1 | F291: 0 | G291: 6 | H291: =RC[-5]*RC[3] -> 200 | I291: 0 | J291: =VLOOKUP(RC[-8],Sheet1!C2:C3,2,FALSE) -> 阿努比斯碎片 | K291: =VLOOKUP(RC[-1],Sheet1!C5:C6,2,FALSE) -> 40
A292: 1340 | B292: 12441 | C292: 5 | D292: 1 | E292: 1 | F292: 20 | G292: 6 | H292: =RC[-5]*RC[3] -> 150 | I292: 0 | J292: =VLOOKUP(RC[-8],Sheet1!C2:C3,2,FALSE) -> 雅典娜碎片 | K292: =VLOOKUP(RC[-1],Sheet1!C5:C6,2,FALSE) -> 30
A293: 1341 | B293: 12442 | C293: 5 | D293: 1 | E293: 1 | F293: 20 | G293: 6 | H293: =RC[-5]*RC[3] -> 200 | I293: 0 | J293: =VLOOKUP(RC[-8],Sheet1!C2:C3,2,FALSE) -> 大力神碎片 | K293: =VLOOKUP(RC[-1],Sheet1!C5:C6,2,FALSE) -> 40
A294: 1342 | B294: 12443 | C294: 5 | D294: 1 | E294: 1 | F294: 20 | G294: 6 | H294: =RC[-5]*RC[3] -> 200 | I294: 0 | J294: =VLOOKUP(RC[-8],Sheet1!C2:C3,2,FALSE) -> 冥王哈迪斯碎片 | K294: =VLOOKUP(RC[-1],Sheet1!C5:C6,2,FALSE) -> 40
A295: 1343 | B295: 12330 | C295: 10 | D295: 1 | E295: 1 | F295: 20 | G295: 6 | H295: =RC[-5]*RC[3] -> 200 | I295: 0 | J295: =VLOOKUP(RC[-8],Sheet1!C2:C3,2,FALSE) -> 竞技场王者碎片 | K295: =VLOOKUP(RC[-1],Sheet1!C5:C6,2,FALSE) -> 20
A296: 1344 | B296: 12331 | C296: 10 | D296: 1 | E296: 1 | F296: 20 | G296: 6 | H296: =RC[-5]*RC[3] -> 200 | I296: 0 | J296: =VLOOKUP(RC[-8],Sheet1!C2:C3,2,FALSE) -> 重甲武士碎片 | K296: =VLOOKUP(RC[-1],Sheet1!C5:C6,2,FALSE) -> 20
A297: 1345 | B297: 12332 | C297: 10 | D297: 1 | E297: 1 | F297: 20 | G297: 6 | H297: =RC[-5]*RC[3] -> 200 | I297: 0 | J297: =VLOOKUP(RC[-8],Sheet1!C2:C3,2,FALSE) -> 影杀者碎片 | K297: =VLOOKUP(RC[-1],Sheet1!C5:C6,2,FALSE) -> 20
A298: 1346 | B298: 12333 | C298: 10 | D298: 1 | E298: 1 | F298: 20 | G298: 6 | H298: =RC[-5]*RC[3] -> 200 | I298: 0 | J298: =VLOOKUP(RC[-8],Sheet1!C2:C3,2,FALSE) -> 暗影巫师碎片 | K298: =VLOOKUP(RC[-1],Sheet1!C5:C6,2,FALSE) -> 20
A299: 1347 | B299: 12334 | C299: 10 | D299: 1 | E299: 1 | F299: 20 | G299: 6 | H299: =RC[-5]*RC[3] -> 200 | I299: 0 | J299: =VLOOKUP(RC[-8],Sheet1!C2:C3,2,FALSE) -> 圣光牧师碎片 | K299: =VLOOKUP(RC[-1],Sheet1!C5:C6,2,FALSE) -> 20
A300: 1348 | B300: 12335 | C300: 10 | D300: 1 | E300: 1 | F300: 20 | G300: 6 | H300: =RC[-5]*RC[3] -> 220 | I300: 0 | J300: =VLOOKUP(RC[-8],Sheet1!C2:C3,2,FALSE) -> 杰克船长碎片 | K300: =VLOOKUP(RC[-1],Sheet1!C5:C6,2,FALSE) -> 22
A301: 1349 | B301: 12336 | C301: 10 | D301: 1 | E301: 1 | F301: 20 | G301: 6 | H301: =RC[-5]*RC[3] -> 220 | I301: 0 | J301: =VLOOKUP(RC[-8],Sheet1!C2:C3,2,FALSE) -> 天使长碎片 | K301: =VLOOKUP(RC[-1],Sheet1!C5:C6,2,FALSE) -> 22
A302: 1350 | B302: 12430 | C302: 10 | D302: 1 | E302: 1 | F302: 20 | G302: 6 | H302: =RC[-5]*RC[3] -> 300 | I302: 0 | J302: =VLOOKUP(RC[-8],Sheet1!C2:C3,2,FALSE) -> 独眼巨人碎片 | K302: =VLOOKUP(RC[-1],Sheet1!C5:C6,2,FALSE) -> 30
A303: 1351 | B303: 12431 | C303: 10 | D303: 1 | E303: 1 | F303: 20 | G303: 6 | H303: =RC[-5]*RC[3] -> 300 | I303: 0 | J303: =VLOOKUP(RC[-8],Sheet1!C2:C3,2,FALSE) -> 圣女贞德碎片 | K303: =VLOOKUP(RC[-1],Sheet1!C5:C6,2,FALSE) -> 30
A304: 1352 | B304: 12432 | C304: 10 | D304: 1 | E304: 1 | F304: 20 | G304: 6 | H304: =RC[-5]*RC[3] -> 300 | I304: 0 | J304: =VLOOKUP(RC[-8],Sheet1!C2:C3,2,FALSE) -> 美杜莎碎片 | K304: =VLOOKUP(RC[-1],Sheet1!C5:C6,2,FALSE) -> 30
A305: 1353 | B305: 12433 | C305: 10 | D305: 1 | E305: 1 | F305: 20 | G305: 6 | H305: =RC[-5]*RC[3] -> 300 | I305: 0 | J305: =VLOOKUP(RC[-8],Sheet1!C2:C3,2,FALSE) -> 德古拉伯爵碎片 | K305: =VLOOKUP(RC[-1],Sheet1!C5:C6,2,FALSE) -> 30
A306: 1354 | B306: 12434 | C306: 10 | D306: 1 | E306: 1 | F306: 20 | G306: 6 | H306: =RC[-5]*RC[3] -> 300 | I306: 0 | J306: =VLOOKUP(RC[-8],Sheet1!C2:C3,2,FALSE) -> 狩猎女神碎片 | K306: =VLOOKUP(RC[-1],Sheet1!C5:C6,2,FALSE) -> 30
A307: 1355 | B307: 12435 | C307: 10 | D307: 1 | E307: 1 | F307: 20 | G307: 6 | H307: =RC[-5]*RC[3] -> 300 | I307: 0 | J307: =VLOOKUP(RC[-8],Sheet1!C2:C3,2,FALSE) -> 查理大帝碎片 | K307: =VLOOKUP(RC[-1],Sheet1!C5:C6,2,FALSE) -> 30
A308: 1356 | B308: 12436 | C308: 10 | D308: 1 | E308: 1 | F308: 20 | G308: 6 | H308: =RC[-5]*RC[3] -> 300 | I308: 0 | J308: =VLOOKUP(RC[-8],Sheet1!C2:C3,2,FALSE) -> 佐罗碎片 | K308: =VLOOKUP(RC[-1],Sheet1!C5:C6,2,FALSE) -> 30
A309: 1357 | B309: 12437 | C309: 10 | D309: 1 | E309: 1 | F309: 20 | G309: 6 | H309: =RC[-5]*RC[3] -> 300 | I309: 0 | J309: =VLOOKUP(RC[-8],Sheet1!C2:C3,2,FALSE) -> 亚马逊女王碎片 | K309: =VLOOKUP(RC[-1],Sheet1!C5:C6,2,FALSE) -> 30
A310: 1358 | B310: 12438 | C310: 10 | D310: 1 | E310: 1 | F310: 0 | G310: 6 | H310: =RC[-5]*RC[3] -> 400 | I310: 0 | J310: =VLOOKUP(RC[-8],Sheet1!C2:C3,2,FALSE) -> 宙斯碎片 | K310: =VLOOKUP(RC[-1],Sheet1!C5:C6,2,FALSE) -> 40
A311: 1359 | B311: 12439 | C311: 10 | D311: 1 | E311: 1 | F311: 20 | G311: 6 | H311: =RC[-5]*RC[3] -> 300 | I311: 0 | J311: =VLOOKUP(RC[-8],Sheet1!C2:C3,2,FALSE) -> 斯巴达碎片 | K311: =VLOOKUP(RC[-1],Sheet1!C5:C6,2,FALSE) -> 30
A312: 1360 | B312: 12440 | C312: 10 | D312: 1 | E312: 1 | F312: 0 | G312: 6 | H312: =RC[-5]*RC[3] -> 400 | I312: 0 | J312: =VLOOKUP(RC[-8],Sheet1!C2:C3,2,FALSE) -> 阿努比斯碎片 | K312: =VLOOKUP(RC[-1],Sheet1!C5:C6,2,FALSE) -> 40
A313: 1361 | B313: 12441 | C313: 10 | D313: 1 | E313: 1 | F313: 20 | G313: 6 | H313: =RC[-5]*RC[3] -> 300 | I313: 0 | J313: =VLOOKUP(RC[-8],Sheet1!C2:C3,2,FALSE) -> 雅典娜碎片 | K313: =VLOOKUP(RC[-1],Sheet1!C5:C6,2,FALSE) -> 30
A314: 1362 | B314: 12442 | C314: 10 | D314: 1 | E314: 1 | F314: 20 | G314: 6 | H314: =RC[-5]*RC[3] -> 400 | I314: 0 | J314: =VLOOKUP(RC[-8],Sheet1!C2:C3,2,FALSE) -> 大力神碎片 | K314: =VLOOKUP(RC[-1],Sheet1!C5:C6,2,FALSE) -> 40
A315: 1363 | B315: 12443 | C315: 10 | D315: 1 | E315: 1 | F315: 20 | G315: 6 | H315: =RC[-5]*RC[3] -> 400 | I315: 0 | J315: =VLOOKUP(RC[-8],Sheet1!C2:C3,2,FALSE) -> 冥王哈迪斯碎片 | K315: =VLOOKUP(RC[-1],Sheet1!C5:C6,2,FALSE) -> 40
A316: 1364 | B316: 31300 | C316: 1 | D316: 1 | E316: 1 | F316: 1 | G316: 5 | H316: =RC[-5]*RC[3] -> 800 | I316: 0 | J316: =VLOOKUP(RC[-8],Sheet1!C2:C3,2,FALSE) -> 竞技场王者 | K316: =VLOOKUP(RC[-1],Sheet1!C5:C6,2,FALSE) -> 800
A317: 1365 | B317: 31310 | C317: 1 | D317: 1 | E317: 1 | F317: 1 | G317: 5 | H317: =RC[-5]*RC[3] -> 800 | I317: 0 | J317: =VLOOKUP(RC[-8],Sheet1!C2:C3,2,FALSE) -> 重甲武士 | K317: =VLOOKUP(RC[-1],Sheet1!C5:C6,2,FALSE) -> 800
A318: 1366 | B318: 31320 | C318: 1 | D318: 1 | E318: 1 | F318: 1 | G318: 5 | H318: =RC[-5]*RC[3] -> 800 | I318: 0 | J318: =VLOOKUP(RC[-8],Sheet1!C2:C3,2,FALSE) -> 影杀者 | K318: =VLOOKUP(RC[-1],Sheet1!C5:C6,2,FALSE) -> 800
A319: 1367 | B319: 31330 | C319: 1 | D319: 1 | E319: 1 | F319: 1 | G319: 5 | H319: =RC[-5]*RC[3] -> 800 | I319: 0 | J319: =VLOOKUP(RC[-8],Sheet1!C2:C3,2,FALSE) -> 暗影巫师 | K319: =VLOOKUP(RC[-1],Sheet1!C5:C6,2,FALSE) -> 800
A320: 1368 | B320: 31340 | C320: 1 | D320: 1 | E320: 1 | F320: 1 | G320: 5 | H320: =RC[-5]*RC[3] -> 800 | I320: 0 | J320: =VLOOKUP(RC[-8],Sheet1!C2:C3,2,FALSE) -> 圣光牧师 | K320: =VLOOKUP(RC[-1],Sheet1!C5:C6,2,FALSE) -> 800
A321: 1369 | B321: 31301 | C321: 1 | D321: 1 | E321: 1 | F321: 1 | G321: 5 | H321: =RC[-5]*RC[3] -> 880 | I321: 0 | J321: =VLOOKUP(RC[-8],Sheet1!C2:C3,2,FALSE) -> 杰克船长 | K321: =VLOOKUP(RC[-1],Sheet1!C5:C6,2,FALSE) -> 880
A322: 1370 | B322: 31341 | C322: 1 | D322: 1 | E322: 1 | F322: 1 | G322: 5 | H322: =RC[-5]*RC[3] -> 880 | I322: 0 | J322: =VLOOKUP(RC[-8],Sheet1!C2:C3,2,FALSE) -> 天使长 | K322: =VLOOKUP(RC[-1],Sheet1!C5:C6,2,FALSE) -> 880
A323: 1371 | B323: 31400 | C323: 1 | D323: 1 | E323: 1 | F323: 1 | G323: 5 | H323: =RC[-5]*RC[3] -> 2400 | I323: 0 | J323: =VLOOKUP(RC[-8],Sheet1!C2:C3,2,FALSE) -> 独眼巨人 | K323: =VLOOKUP(RC[-1],Sheet1!C5:C6,2,FALSE) -> 2400
A324: 1372 | B324: 31440 | C324: 1 | D324: 1 | E324: 1 | F324: 1 | G324: 5 | H324: =RC[-5]*RC[3] -> 2400 | I324: 0 | J324: =VLOOKUP(RC[-8],Sheet1!C2:C3,2,FALSE) -> 圣女贞德 | K324: =VLOOKUP(RC[-1],Sheet1!C5:C6,2,FALSE) -> 2400
A325: 1373 | B325: 31430 | C325: 1 | D325: 1 | E325: 1 | F325: 1 | G325: 5 | H325: =RC[-5]*RC[3] -> 2400 | I325: 0 | J325: =VLOOKUP(RC[-8],Sheet1!C2:C3,2,FALSE) -> 美杜莎 | K325: =VLOOKUP(RC[-1],Sheet1!C5:C6,2,FALSE) -> 2400
A326: 1374 | B326: 31401 | C326: 1 | D326: 1 | E326: 1 | F326: 1 | G326: 5 | H326: =RC[-5]*RC[3] -> 2400 | I326: 0 | J326: =VLOOKUP(RC[-8],Sheet1!C2:C3,2,FALSE) -> 德古拉伯爵 | K326: =VLOOKUP(RC[-1],Sheet1!C5:C6,2,FALSE) -> 2400
A327: 1375 | B327: 31431 | C327: 1 | D327: 1 | E327: 1 | F327: 1 | G327: 5 | H327: =RC[-5]*RC[3] -> 2400 | I327: 0 | J327: =VLOOKUP(RC[-8],Sheet1!C2:C3,2,FALSE) -> 狩猎女神 | K327: =VLOOKUP(RC[-1],Sheet1!C5:C6,2,FALSE) -> 2400
A328: 1376 | B328: 31402 | C328: 1 | D328: 1 | E328: 1 | F328: 1 | G328: 5 | H328: =RC[-5]*RC[3] -> 2400 | I328: 0 | J328: =VLOOKUP(RC[-8],Sheet1!C2:C3,2,FALSE) -> 查理大帝 | K328: =VLOOKUP(RC[-1],Sheet1!C5:C6,2,FALSE) -> 2400
A329: 1377 | B329: 31403 | C329: 1 | D329: 1 | E329: 1 | F329: 1 | G329: 5 | H329: =RC[-5]*RC[3] -> 2400 | I329: 0 | J329: =VLOOKUP(RC[-8],Sheet1!C2:C3,2,FALSE) -> 佐罗 | K329: =VLOOKUP(RC[-1],Sheet1!C5:C6,2,FALSE) -> 2400
A330: 1378 | B330: 31420 | C330: 1 | D330: 1 | E330: 1 | F330: 1 | G330: 5 | H330: =RC[-5]*RC[3] -> 2400 | I330: 0 | J330: =VLOOKUP(RC[-8],Sheet1!C2:C3,2,FALSE) -> 亚马逊女王 | K330: =VLOOKUP(RC[-1],Sheet1!C5:C6,2,FALSE) -> 2400
A331: 1379 | B331: 31438 | C331: 1 | D331: 1 | E331: 1 | F331: 0 | G331: 5 | H331: =RC[-5]*RC[3] -> 3200 | I331: 0 | J331: =VLOOKUP(RC[-8],Sheet1!C2:C3,2,FALSE) -> 宙斯 | K331: =VLOOKUP(RC[-1],Sheet1!C5:C6,2,FALSE) -> 3200
A332: 1380 | B332: 31410 | C332: 1 | D332: 1 | E332: 1 | F332: 1 | G332: 5 | H332: =RC[-5]*RC[3] -> 2400 | I332: 0 | J332: =VLOOKUP(RC[-8],Sheet1!C2:C3,2,FALSE) -> 斯巴达 | K332: =VLOOKUP(RC[-1],Sheet1!C5:C6,2,FALSE) -> 2400
A333: 1381 | B333: 31408 | C333: 1 | D333: 1 | E333: 1 | F333: 0 | G333: 5 | H333: =RC[-5]*RC[3] -> 3200 | I333: 0 | J333: =VLOOKUP(RC[-8],Sheet1!C2:C3,2,FALSE) -> 阿努比斯 | K333: =VLOOKUP(RC[-1],Sheet1!C5:C6,2,FALSE) -> 3200
A334: 1382 | B334: 31441 | C334: 1 | D334: 1 | E334: 1 | F334: 1 | G334: 5 | H334: =RC[-5]*RC[3] -> 2400 | I334: 0 | J334: =VLOOKUP(RC[-8],Sheet1!C2:C3,2,FALSE) -> 雅典娜 | K334: =VLOOKUP(RC[-1],Sheet1!C5:C6,2,FALSE) -> 2400
A335: 1383 | B335: 31419 | C335: 1 | D335: 1 | E335: 1 | F335: 1 | G335: 5 | H335: =RC[-5]*RC[3] -> 3200 | I335: 0 | J335: =VLOOKUP(RC[-8],Sheet1!C2:C3,2,FALSE) -> 大力神 | K335: =VLOOKUP(RC[-1],Sheet1!C5:C6,2,FALSE) -> 3200
A336: 1384 | B336: 31439 | C336: 1 | D336: 1 | E336: 1 | F336: 1 | G336: 5 | H336: =RC[-5]*RC[3] -> 3200 | I336: 0 | J336: =VLOOKUP(RC[-8],Sheet1!C2:C3,2,FALSE) -> 冥王哈迪斯 | K336: =VLOOKUP(RC[-1],Sheet1!C5:C6,2,FALSE) -> 3200
A337: 1385 | B337: 12330 | C337: 5 | D337: 1 | E337: 1 | F337: 20 | G337: 5 | H337: =RC[-5]*RC[3] -> 100 | I337: 0 | J337: =VLOOKUP(RC[-8],Sheet1!C2:C3,2,FALSE) -> 竞技场王者碎片 | K337: =VLOOKUP(RC[-1],Sheet1!C5:C6,2,FALSE) -> 20
A338: 1386 | B338: 12331 | C338: 5 | D338: 1 | E338: 1 | F338: 20 | G338: 5 | H338: =RC[-5]*RC[3] -> 100 | I338: 0 | J338: =VLOOKUP(RC[-8],Sheet1!C2:C3,2,FALSE) -> 重甲武士碎片 | K338: =VLOOKUP(RC[-1],Sheet1!C5:C6,2,FALSE) -> 20
A339: 1387 | B339: 12332 | C339: 5 | D339: 1 | E339: 1 | F339: 20 | G339: 5 | H339: =RC[-5]*RC[3] -> 100 | I339: 0 | J339: =VLOOKUP(RC[-8],Sheet1!C2:C3,2,FALSE) -> 影杀者碎片 | K339: =VLOOKUP(RC[-1],Sheet1!C5:C6,2,FALSE) -> 20
A340: 1388 | B340: 12333 | C340: 5 | D340: 1 | E340: 1 | F340: 20 | G340: 5 | H340: =RC[-5]*RC[3] -> 100 | I340: 0 | J340: =VLOOKUP(RC[-8],Sheet1!C2:C3,2,FALSE) -> 暗影巫师碎片 | K340: =VLOOKUP(RC[-1],Sheet1!C5:C6,2,FALSE) -> 20
A341: 1389 | B341: 12334 | C341: 5 | D341: 1 | E341: 1 | F341: 20 | G341: 5 | H341: =RC[-5]*RC[3] -> 100 | I341: 0 | J341: =VLOOKUP(RC[-8],Sheet1!C2:C3,2,FALSE) -> 圣光牧师碎片 | K341: =VLOOKUP(RC[-1],Sheet1!C5:C6,2,FALSE) -> 20
A342: 1390 | B342: 12335 | C342: 5 | D342: 1 | E342: 1 | F342: 20 | G342: 5 | H342: =RC[-5]*RC[3] -> 110 | I342: 0 | J342: =VLOOKUP(RC[-8],Sheet1!C2:C3,2,FALSE) -> 杰克船长碎片 | K342: =VLOOKUP(RC[-1],Sheet1!C5:C6,2,FALSE) -> 22
A343: 1391 | B343: 12336 | C343: 5 | D343: 1 | E343: 1 | F343: 20 | G343: 5 | H343: =RC[-5]*RC[3] -> 110 | I343: 0 | J343: =VLOOKUP(RC[-8],Sheet1!C2:C3,2,FALSE) -> 天使长碎片 | K343: =VLOOKUP(RC[-1],Sheet1!C5:C6,2,FALSE) -> 22
A344: 1392 | B344: 12430 | C344: 5 | D344: 1 | E344: 1 | F344: 20 | G344: 5 | H344: =RC[-5]*RC[3] -> 150 | I344: 0 | J344: =VLOOKUP(RC[-8],Sheet1!C2:C3,2,FALSE) -> 独眼巨人碎片 | K344: =VLOOKUP(RC[-1],Sheet1!C5:C6,2,FALSE) -> 30
A345: 1393 | B345: 12431 | C345: 5 | D345: 1 | E345: 1 | F345: 20 | G345: 5 | H345: =RC[-5]*RC[3] -> 150 | I345: 0 | J345: =VLOOKUP(RC[-8],Sheet1!C2:C3,2,FALSE) -> 圣女贞德碎片 | K345: =VLOOKUP(RC[-1],Sheet1!C5:C6,2,FALSE) -> 30
A346: 1394 | B346: 12432 | C346: 5 | D346: 1 | E346: 1 | F346: 20 | G346: 5 | H346: =RC[-5]*RC[3] -> 150 | I346: 0 | J346: =VLOOKUP(RC[-8],Sheet1!C2:C3,2,FALSE) -> 美杜莎碎片 | K346: =VLOOKUP(RC[-1],Sheet1!C5:C6,2,FALSE) -> 30
A347: 1395 | B347: 12433 | C347: 5 | D347: 1 | E347: 1 | F347: 20 | G347: 5 | H347: =RC[-5]*RC[3] -> 150 | I347: 0 | J347: =VLOOKUP(RC[-8],Sheet1!C2:C3,2,FALSE) -> 德古拉伯爵碎片 | K347: =VLOOKUP(RC[-1],Sheet1!C5:C6,2,FALSE) -> 30
A348: 1396 | B348: 12434 | C348: 5 | D348: 1 | E348: 1 | F348: 20 | G348: 5 | H348: =RC[-5]*RC[3] -> 150 | I348: 0 | J348: =VLOOKUP(RC[-8],Sheet1!C2:C3,2,FALSE) -> 狩猎女神碎片 | K348: =VLOOKUP(RC[-1],Sheet1!C5:C6,2,FALSE) -> 30
A349: 1397 | B349: 12435 | C349: 5 | D349: 1 | E349: 1 | F349: 20 | G349: 5 | H349: =RC[-5]*RC[3] -> 150 | I349: 0 | J349: =VLOOKUP(RC[-8],Sheet1!C2:C3,2,FALSE) -> 查理大帝碎片 | K349: =VLOOKUP(RC[-1],Sheet1!C5:C6,2,FALSE) -> 30
A350: 1398 | B350: 12436 | C350: 5 | D350: 1 | E350: 1 | F350: 20 | G350: 5 | H350: =RC[-5]*RC[3] -> 150 | I350: 0 | J350: =VLOOKUP(RC[-8],Sheet1!C2:C3,2,FALSE) -> 佐罗碎片 | K350: =VLOOKUP(RC[-1],Sheet1!C5:C6,2,FALSE) -> 30
A351: 1399 | B351: 12437 | C351: 5 | D351: 1 | E351: 1 | F351: 20 | G351: 5 | H351: =RC[-5]*RC[3] -> 150 | I351: 0 | J351: =VLOOKUP(RC[-8],Sheet1!C2:C3,2,FALSE) -> 亚马逊女王碎片 | K351: =VLOOKUP(RC[-1],Sheet1!C5:C6,2,FALSE) -> 30
A352: 1400 | B352: 12438 | C352: 5 | D352: 1 | E352: 1 | F352: 20 | G352: 5 | H352: =RC[-5]*RC[3] -> 200 | I352: 0 | J352: =VLOOKUP(RC[-8],Sheet1!C2:C3,2,FALSE) -> 宙斯碎片 | K352: =VLOOKUP(RC[-1],Sheet1!C5:C6,2,FALSE) -> 40
A353: 1401 | B353: 12439 | C353: 5 | D353: 1 | E353: 1 | F353: 20 | G353: 5 | H353: =RC[-5]*RC[3] -> 150 | I353: 0 | J353: =VLOOKUP(RC[-8],Sheet1!C2:C3,2,FALSE) -> 斯巴达碎片 | K353: =VLOOKUP(RC[-1],Sheet1!C5:C6,2,FALSE) -> 30
A354: 1402 | B354: 12440 | C354: 5 | D354: 1 | E354: 1 | F354: 20 | G354: 5 | H354: =RC[-5]*RC[3] -> 200 | I354: 0 | J354: =VLOOKUP(RC[-8],Sheet1!C2:C3,2,FALSE) -> 阿努比斯碎片 | K354: =VLOOKUP(RC[-1],Sheet1!C5:C6,2,FALSE) -> 40
A355: 1403 | B355: 12441 | C355: 5 | D355: 1 | E355: 1 | F355: 20 | G355: 5 | H355: =RC[-5]*RC[3] -> 150 | I355: 0 | J355: =VLOOKUP(RC[-8],Sheet1!C2:C3,2,FALSE) -> 雅典娜碎片 | K355: =VLOOKUP(RC[-1],Sheet1!C5:C6,2,FALSE) -> 30
A356: 1404 | B356: 12442 | C356: 5 | D356: 1 | E356: 1 | F356: 20 | G356: 5 | H356: =RC[-5]*RC[3] -> 200 | I356: 0 | J356: =VLOOKUP(RC[-8],Sheet1!C2:C3,2,FALSE) -> 大力神碎片 | K356: =VLOOKUP(RC[-1],Sheet1!C5:C6,2,FALSE) -> 40
A357: 1405 | B357: 12443 | C357: 5 | D357: 1 | E357: 1 | F357: 20 | G357: 5 | H357: =RC[-5]*RC[3] -> 200 | I357: 0 | J357: =VLOOKUP(RC[-8],Sheet1!C2:C3,2,FALSE) -> 冥王哈迪斯碎片 | K357: =VLOOKUP(RC[-1],Sheet1!C5:C6,2,FALSE) -> 40
A358: 1406 | B358: 12330 | C358: 10 | D358: 1 | E358: 1 | F358: 20 | G358: 5 | H358: =RC[-5]*RC[3] -> 200 | I358: 0 | J358: =VLOOKUP(RC[-8],Sheet1!C2:C3,2,FALSE) -> 竞技场王者碎片 | K358: =VLOOKUP(RC[-1],Sheet1!C5:C6,2,FALSE) -> 20
A359: 1407 | B359: 12331 | C359: 10 | D359: 1 | E359: 1 | F359: 20 | G359: 5 | H359: =RC[-5]*RC[3] -> 200 | I359: 0 | J359: =VLOOKUP(RC[-8],Sheet1!C2:C3,2,FALSE) -> 重甲武士碎片 | K359: =VLOOKUP(RC[-1],Sheet1!C5:C6,2,FALSE) -> 20
A360: 1408 | B360: 12332 | C360: 10 | D360: 1 | E360: 1 | F360: 20 | G360: 5 | H360: =RC[-5]*RC[3] -> 200 | I360: 0 | J360: =VLOOKUP(RC[-8],Sheet1!C2:C3,2,FALSE) -> 影杀者碎片 | K360: =VLOOKUP(RC[-1],Sheet1!C5:C6,2,FALSE) -> 20
A361: 1409 | B361: 12333 | C361: 10 | D361: 1 | E361: 1 | F361: 20 | G361: 5 | H361: =RC[-5]*RC[3] -> 200 | I361: 0 | J361: =VLOOKUP(RC[-8],Sheet1!C2:C3,2,FALSE) -> 暗影巫师碎片 | K361: =VLOOKUP(RC[-1],Sheet1!C5:C6,2,FALSE) -> 20
A362: 1410 | B362: 12334 | C362: 10 | D362: 1 | E362: 1 | F362: 20 | G362: 5 | H362: =RC[-5]*RC[3] -> 200 | I362: 0 | J362: =VLOOKUP(RC[-8],Sheet1!C2:C3,2,FALSE) -> 圣光牧师碎片 | K362: =VLOOKUP(RC[-1],Sheet1!C5:C6,2,FALSE) -> 20
A363: 1411 | B363: 12335 | C363: 10 | D363: 1 | E363: 1 | F363: 20 | G363: 5 | H363: =RC[-5]*RC[3] -> 220 | I363: 0 | J363: =VLOOKUP(RC[-8],Sheet1!C2:C3,2,FALSE) -> 杰克船长碎片 | K363: =VLOOKUP(RC[-1],Sheet1!C5:C6,2,FALSE) -> 22
A364: 1412 | B364: 12336 | C364: 10 | D364: 1 | E364: 1 | F364: 20 | G364: 5 | H364: =RC[-5]*RC[3] -> 220 | I364: 0 | J364: =VLOOKUP(RC[-8],Sheet1!C2:C3,2,FALSE) -> 天使长碎片 | K364: =VLOOKUP(RC[-1],Sheet1!C5:C6,2,FALSE) -> 22
A365: 1413 | B365: 12430 | C365: 10 | D365: 1 | E365: 1 | F365: 20 | G365: 5 | H365: =RC[-5]*RC[3] -> 300 | I365: 0 | J365: =VLOOKUP(RC[-8],Sheet1!C2:C3,2,FALSE) -> 独眼巨人碎片 | K365: =VLOOKUP(RC[-1],Sheet1!C5:C6,2,FALSE) -> 30
A366: 1414 | B366: 12431 | C366: 10 | D366: 1 | E366: 1 | F366: 20 | G366: 5 | H366: =RC[-5]*RC[3] -> 300 | I366: 0 | J366: =VLOOKUP(RC[-8],Sheet1!C2:C3,2,FALSE) -> 圣女贞德碎片 | K366: =VLOOKUP(RC[-1],Sheet1!C5:C6,2,FALSE) -> 30
A367: 1415 | B367: 12432 | C367: 10 | D367: 1 | E367: 1 | F367: 20 | G367: 5 | H367: =RC[-5]*RC[3] -> 300 | I367: 0 | J367: =VLOOKUP(RC[-8],Sheet1!C2:C3,2,FALSE) -> 美杜莎碎片 | K367: =VLOOKUP(RC[-1],Sheet1!C5:C6,2,FALSE) -> 30
A368: 1416 | B368: 12433 | C368: 10 | D368: 1 | E368: 1 | F368: 20 | G368: 5 | H368: =RC[-5]*RC[3] -> 300 | I368: 0 | J368: =VLOOKUP(RC[-8],Sheet1!C2:C3,2,FALSE) -> 德古拉伯爵碎片 | K368: =VLOOKUP(RC[-1],Sheet1!C5:C6,2,FALSE) -> 30
A369: 1417 | B369: 12434 | C369: 10 | D369: 1 | E369: 1 | F369: 20 | G369: 5 | H369: =RC[-5]*RC[3] -> 300 | I369: 0 | J369: =VLOOKUP(RC[-8],Sheet1!C2:C3,2,FALSE) -> 狩猎女神碎片 | K369: =VLOOKUP(RC[-1],Sheet1!C5:C6,2,FALSE) -> 30
A370: 1418 | B370: 12435 | C370: 10 | D370: 1 | E370: 1 | F370: 20 | G370: 5 | H370: =RC[-5]*RC[3] -> 300 | I370: 0 | J370: =VLOOKUP(RC[-8],Sheet1!C2:C3,2,FALSE) -> 查理大帝碎片 | K370: =VLOOKUP(RC[-1],Sheet1!C5:C6,2,FALSE) -> 30
A371: 1419 | B371: 12436 | C371: 10 | D371: 1 | E371: 1 | F371: 20 | G371: 5 | H371: =RC[-5]*RC[3] -> 300 | I371: 0 | J371: =VLOOKUP(RC[-8],Sheet1!C2:C3,2,FALSE) -> 佐罗碎片 | K371: =VLOOKUP(RC[-1],Sheet1!C5:C6,2,FALSE) -> 30
A372: 1420 | B372: 12437 | C372: 10 | D372: 1 | E372: 1 | F372: 20 | G372: 5 | H372: =RC[-5]*RC[3] -> 300 | I372: 0 | J372: =VLOOKUP(RC[-8],Sheet1!C2:C3,2,FALSE) -> 亚马逊女王碎片 | K372: =VLOOKUP(RC[-1],Sheet1!C5:C6,2,FALSE) -> 30
A373: 1421 | B373: 12438 | C373: 10 | D373: 1 | E373: 1 | F373: 20 | G373: 5 | H373: =RC[-5]*RC[3] -> 400 | I373: 0 | J373: =VLOOKUP(RC[-8],Sheet1!C2:C3,2,FALSE) -> 宙斯碎片 | K373: =VLOOKUP(RC[-1],Sheet1!C5:C6,2,FALSE) -> 40
A374: 1422 | B374: 12439 | C374: 10 | D374: 1 | E374: 1 | F374: 20 | G374: 5 | H374: =RC[-5]*RC[3] -> 300 | I374: 0 | J374: =VLOOKUP(RC[-8],Sheet1!C2:C3,2,FALSE) -> 斯巴达碎片 | K374: =VLOOKUP(RC[-1],Sheet1!C5:C6,2,FALSE) -> 30
A375: 1423 | B375: 12440 | C375: 10 | D375: 1 | E375: 1 | F375: 20 | G375: 5 | H375: =RC[-5]*RC[3] -> 400 | I375: 0 | J375: =VLOOKUP(RC[-8],Sheet1!C2:C3,2,FALSE) -> 阿努比斯碎片 | K375: =VLOOKUP(RC[-1],Sheet1!C5:C6,2,FALSE) -> 40
A376: 1424 | B376: 12441 | C376: 10 | D376: 1 | E376: 1 | F376: 20 | G376: 5 | H376: =RC[-5]*RC[3] -> 300 | I376: 0 | J376: =VLOOKUP(RC[-8],Sheet1!C2:C3,2,FALSE) -> 雅典娜碎片 | K376: =VLOOKUP(RC[-1],Sheet1!C5:C6,2,FALSE) -> 30
A377: 1425 | B377: 12442 | C377: 10 | D377: 1 | E377: 1 | F377: 20 | G377: 5 | H377: =RC[-5]*RC[3] -> 400 | I377: 0 | J377: =VLOOKUP(RC[-8],Sheet1!C2:C3,2,FALSE) -> 大力神碎片 | K377: =VLOOKUP(RC[-1],Sheet1!C5:C6,2,FALSE) -> 40
A378: 1426 | B378: 12443 | C378: 10 | D378: 1 | E378: 1 | F378: 20 | G378: 5 | H378: =RC[-5]*RC[3] -> 400 | I378: 0 | J378: =VLOOKUP(RC[-8],Sheet1!C2:C3,2,FALSE) -> 冥王哈迪斯碎片 | K378: =VLOOKUP(RC[-1],Sheet1!C5:C6,2,FALSE) -> 40
A379: 1601 | B379: 32300 | C379: 1 | D379: 1 | E379: 1 | F379: 1 | G379: 6 | H379: =RC[-5]*RC[3] -> 800 | I379: 0 | J379: =VLOOKUP(RC[-8],Sheet1!C2:C3,2,FALSE) -> 地精神偷 | K379: =VLOOKUP(RC[-1],Sheet1!C5:C6,2,FALSE) -> 800
A380: 1602 | B380: 32310 | C380: 1 | D380: 1 | E380: 1 | F380: 1 | G380: 6 | H380: =RC[-5]*RC[3] -> 800 | I380: 0 | J380: =VLOOKUP(RC[-8],Sheet1!C2:C3,2,FALSE) -> 骷髅王 | K380: =VLOOKUP(RC[-1],Sheet1!C5:C6,2,FALSE) -> 800
A381: 1603 | B381: 32320 | C381: 1 | D381: 1 | E381: 1 | F381: 1 | G381: 6 | H381: =RC[-5]*RC[3] -> 800 | I381: 0 | J381: =VLOOKUP(RC[-8],Sheet1!C2:C3,2,FALSE) -> 传说哥 | K381: =VLOOKUP(RC[-1],Sheet1!C5:C6,2,FALSE) -> 800
A382: 1604 | B382: 32330 | C382: 1 | D382: 1 | E382: 1 | F382: 1 | G382: 6 | H382: =RC[-5]*RC[3] -> 800 | I382: 0 | J382: =VLOOKUP(RC[-8],Sheet1!C2:C3,2,FALSE) -> 海元素国王 | K382: =VLOOKUP(RC[-1],Sheet1!C5:C6,2,FALSE) -> 800
A383: 1605 | B383: 32340 | C383: 1 | D383: 1 | E383: 1 | F383: 1 | G383: 6 | H383: =RC[-5]*RC[3] -> 800 | I383: 0 | J383: =VLOOKUP(RC[-8],Sheet1!C2:C3,2,FALSE) -> 水元素国王 | K383: =VLOOKUP(RC[-1],Sheet1!C5:C6,2,FALSE) -> 800
A384: 1606 | B384: 32311 | C384: 1 | D384: 1 | E384: 1 | F384: 1 | G384: 6 | H384: =RC[-5]*RC[3] -> 880 | I384: 0 | J384: =VLOOKUP(RC[-8],Sheet1!C2:C3,2,FALSE) -> 石头人 | K384: =VLOOKUP(RC[-1],Sheet1!C5:C6,2,FALSE) -> 880
A385: 1607 | B385: 32341 | C385: 1 | D385: 1 | E385: 1 | F385: 1 | G385: 6 | H385: =RC[-5]*RC[3] -> 880 | I385: 0 | J385: =VLOOKUP(RC[-8],Sheet1!C2:C3,2,FALSE) -> 血源牧师 | K385: =VLOOKUP(RC[-1],Sheet1!C5:C6,2,FALSE) -> 880
A386: 1608 | B386: 32410 | C386: 1 | D386: 1 | E386: 1 | F386: 1 | G386: 6 | H386: =RC[-5]*RC[3] -> 2400 | I386: 0 | J386: =VLOOKUP(RC[-8],Sheet1!C2:C3,2,FALSE) -> 憎恶 | K386: =VLOOKUP(RC[-1],Sheet1!C5:C6,2,FALSE) -> 2400
A387: 1609 | B387: 32411 | C387: 1 | D387: 1 | E387: 1 | F387: 1 | G387: 6 | H387: =RC[-5]*RC[3] -> 2400 | I387: 0 | J387: =VLOOKUP(RC[-8],Sheet1!C2:C3,2,FALSE) -> 树精 | K387: =VLOOKUP(RC[-1],Sheet1!C5:C6,2,FALSE) -> 2400
A388: 1610 | B388: 32400 | C388: 1 | D388: 1 | E388: 1 | F388: 1 | G388: 6 | H388: =RC[-5]*RC[3] -> 2400 | I388: 0 | J388: =VLOOKUP(RC[-8],Sheet1!C2:C3,2,FALSE) -> 牛头人 | K388: =VLOOKUP(RC[-1],Sheet1!C5:C6,2,FALSE) -> 2400
A389: 1611 | B389: 32430 | C389: 1 | D389: 1 | E389: 1 | F389: 1 | G389: 6 | H389: =RC[-5]*RC[3] -> 2400 | I389: 0 | J389: =VLOOKUP(RC[-8],Sheet1!C2:C3,2,FALSE) -> 火女 | K389: =VLOOKUP(RC[-1],Sheet1!C5:C6,2,FALSE) -> 2400
A390: 1612 | B390: 32401 | C390: 1 | D390: 1 | E390: 1 | F390: 1 | G390: 6 | H390: =RC[-5]*RC[3] -> 2400 | I390: 0 | J390: =VLOOKUP(RC[-8],Sheet1!C2:C3,2,FALSE) -> 半人马 | K390: =VLOOKUP(RC[-1],Sheet1!C5:C6,2,FALSE) -> 2400
A391: 1613 | B391: 32431 | C391: 1 | D391: 1 | E391: 1 | F391: 1 | G391: 6 | H391: =RC[-5]*RC[3] -> 2400 | I391: 0 | J391: =VLOOKUP(RC[-8],Sheet1!C2:C3,2,FALSE) -> 食人魔 | K391: =VLOOKUP(RC[-1],Sheet1!C5:C6,2,FALSE) -> 2400
A392: 1614 | B392: 32402 | C392: 1 | D392: 1 | E392: 1 | F392: 1 | G392: 6 | H392: =RC[-5]*RC[3] -> 2400 | I392: 0 | J392: =VLOOKUP(RC[-8],Sheet1!C2:C3,2,FALSE) -> 基伦 | K392: =VLOOKUP(RC[-1],Sheet1!C5:C6,2,FALSE) -> 2400
A393: 1615 | B393: 32420 | C393: 1 | D393: 1 | E393: 1 | F393: 1 | G393: 6 | H393: =RC[-5]*RC[3] -> 2400 | I393: 0 | J393: =VLOOKUP(RC[-8],Sheet1!C2:C3,2,FALSE) -> 女警 | K393: =VLOOKUP(RC[-1],Sheet1!C5:C6,2,FALSE) -> 2400
A394: 1616 | B394: 32428 | C394: 1 | D394: 1 | E394: 1 | F394: 0 | G394: 6 | H394: =RC[-5]*RC[3] -> 3200 | I394: 0 | J394: =VLOOKUP(RC[-8],Sheet1!C2:C3,2,FALSE) -> 小黑 | K394: =VLOOKUP(RC[-1],Sheet1!C5:C6,2,FALSE) -> 3200
A395: 1617 | B395: 32412 | C395: 1 | D395: 1 | E395: 1 | F395: 1 | G395: 6 | H395: =RC[-5]*RC[3] -> 2400 | I395: 0 | J395: =VLOOKUP(RC[-8],Sheet1!C2:C3,2,FALSE) -> 熊阿宝 | K395: =VLOOKUP(RC[-1],Sheet1!C5:C6,2,FALSE) -> 2400
A396: 1618 | B396: 32408 | C396: 1 | D396: 1 | E396: 1 | F396: 0 | G396: 6 | H396: =RC[-5]*RC[3] -> 3200 | I396: 0 | J396: =VLOOKUP(RC[-8],Sheet1!C2:C3,2,FALSE) -> 血色指挥官 | K396: =VLOOKUP(RC[-1],Sheet1!C5:C6,2,FALSE) -> 3200
A397: 1619 | B397: 32440 | C397: 1 | D397: 1 | E397: 1 | F397: 1 | G397: 6 | H397: =RC[-5]*RC[3] -> 2400 | I397: 0 | J397: =VLOOKUP(RC[-8],Sheet1!C2:C3,2,FALSE) -> 大检察官 | K397: =VLOOKUP(RC[-1],Sheet1!C5:C6,2,FALSE) -> 2400
A398: 1620 | B398: 32409 | C398: 1 | D398: 1 | E398: 1 | F398: 1 | G398: 6 | H398: =RC[-5]*RC[3] -> 3200 | I398: 0 | J398: =VLOOKUP(RC[-8],Sheet1!C2:C3,2,FALSE) -> 恶魔猎手 | K398: =VLOOKUP(RC[-1],Sheet1!C5:C6,2,FALSE) -> 3200
A399: 1621 | B399: 32449 | C399: 1 | D399: 1 | E399: 1 | F399: 1 | G399: 6 | H399: =RC[-5]*RC[3] -> 3200 | I399: 0 | J399: =VLOOKUP(RC[-8],Sheet1!C2:C3,2,FALSE) -> 神圣牧师 | K399: =VLOOKUP(RC[-1],Sheet1!C5:C6,2,FALSE) -> 3200
A400: 1622 | B400: 12360 | C400: 5 | D400: 1 | E400: 1 | F400: 20 | G400: 6 | H400: =RC[-5]*RC[3] -> 100 | I400: 0 | J400: =VLOOKUP(RC[-8],Sheet1!C2:C3,2,FALSE) -> 地精神偷碎片 | K400: =VLOOKUP(RC[-1],Sheet1!C5:C6,2,FALSE) -> 20
A401: 1623 | B401: 12361 | C401: 5 | D401: 1 | E401: 1 | F401: 20 | G401: 6 | H401: =RC[-5]*RC[3] -> 100 | I401: 0 | J401: =VLOOKUP(RC[-8],Sheet1!C2:C3,2,FALSE) -> 骷髅王碎片 | K401: =VLOOKUP(RC[-1],Sheet1!C5:C6,2,FALSE) -> 20
A402: 1624 | B402: 12362 | C402: 5 | D402: 1 | E402: 1 | F402: 20 | G402: 6 | H402: =RC[-5]*RC[3] -> 100 | I402: 0 | J402: =VLOOKUP(RC[-8],Sheet1!C2:C3,2,FALSE) -> 传说哥碎片 | K402: =VLOOKUP(RC[-1],Sheet1!C5:C6,2,FALSE) -> 20
A403: 1625 | B403: 12363 | C403: 5 | D403: 1 | E403: 1 | F403: 20 | G403: 6 | H403: =RC[-5]*RC[3] -> 100 | I403: 0 | J403: =VLOOKUP(RC[-8],Sheet1!C2:C3,2,FALSE) -> 海元素国王碎片 | K403: =VLOOKUP(RC[-1],Sheet1!C5:C6,2,FALSE) -> 20
A404: 1626 | B404: 12364 | C404: 5 | D404: 1 | E404: 1 | F404: 20 | G404: 6 | H404: =RC[-5]*RC[3] -> 100 | I404: 0 | J404: =VLOOKUP(RC[-8],Sheet1!C2:C3,2,FALSE) -> 水元素国王碎片 | K404: =VLOOKUP(RC[-1],Sheet1!C5:C6,2,FALSE) -> 20
A405: 1627 | B405: 12365 | C405: 5 | D405: 1 | E405: 1 | F405: 20 | G405: 6 | H405: =RC[-5]*RC[3] -> 110 | I405: 0 | J405: =VLOOKUP(RC[-8],Sheet1!C2:C3,2,FALSE) -> 石头人碎片 | K405: =VLOOKUP(RC[-1],Sheet1!C5:C6,2,FALSE) -> 22
A406: 1628 | B406: 12366 | C406: 5 | D406: 1 | E406: 1 | F406: 20 | G406: 6 | H406: =RC[-5]*RC[3] -> 110 | I406: 0 | J406: =VLOOKUP(RC[-8],Sheet1!C2:C3,2,FALSE) -> 血源牧师碎片 | K406: =VLOOKUP(RC[-1],Sheet1!C5:C6,2,FALSE) -> 22
A407: 1629 | B407: 12460 | C407: 5 | D407: 1 | E407: 1 | F407: 20 | G407: 6 | H407: =RC[-5]*RC[3] -> 150 | I407: 0 | J407: =VLOOKUP(RC[-8],Sheet1!C2:C3,2,FALSE) -> 憎恶碎片 | K407: =VLOOKUP(RC[-1],Sheet1!C5:C6,2,FALSE) -> 30
A408: 1630 | B408: 12461 | C408: 5 | D408: 1 | E408: 1 | F408: 20 | G408: 6 | H408: =RC[-5]*RC[3] -> 150 | I408: 0 | J408: =VLOOKUP(RC[-8],Sheet1!C2:C3,2,FALSE) -> 树精碎片 | K408: =VLOOKUP(RC[-1],Sheet1!C5:C6,2,FALSE) -> 30
A409: 1631 | B409: 12462 | C409: 5 | D409: 1 | E409: 1 | F409: 20 | G409: 6 | H409: =RC[-5]*RC[3] -> 150 | I409: 0 | J409: =VLOOKUP(RC[-8],Sheet1!C2:C3,2,FALSE) -> 牛头人碎片 | K409: =VLOOKUP(RC[-1],Sheet1!C5:C6,2,FALSE) -> 30
A410: 1632 | B410: 12463 | C410: 5 | D410: 1 | E410: 1 | F410: 20 | G410: 6 | H410: =RC[-5]*RC[3] -> 150 | I410: 0 | J410: =VLOOKUP(RC[-8],Sheet1!C2:C3,2,FALSE) -> 火女碎片 | K410: =VLOOKUP(RC[-1],Sheet1!C5:C6,2,FALSE) -> 30
A411: 1633 | B411: 12464 | C411: 5 | D411: 1 | E411: 1 | F411: 20 | G411: 6 | H411: =RC[-5]*RC[3] -> 150 | I411: 0 | J411: =VLOOKUP(RC[-8],Sheet1!C2:C3,2,FALSE) -> 半人马碎片 | K411: =VLOOKUP(RC[-1],Sheet1!C5:C6,2,FALSE) -> 30
A412: 1634 | B412: 12465 | C412: 5 | D412: 1 | E412: 1 | F412: 20 | G412: 6 | H412: =RC[-5]*RC[3] -> 150 | I412: 0 | J412: =VLOOKUP(RC[-8],Sheet1!C2:C3,2,FALSE) -> 食人魔碎片 | K412: =VLOOKUP(RC[-1],Sheet1!C5:C6,2,FALSE) -> 30
A413: 1635 | B413: 12466 | C413: 5 | D413: 1 | E413: 1 | F413: 20 | G413: 6 | H413: =RC[-5]*RC[3] -> 150 | I413: 0 | J413: =VLOOKUP(RC[-8],Sheet1!C2:C3,2,FALSE) -> 基伦碎片 | K413: =VLOOKUP(RC[-1],Sheet1!C5:C6,2,FALSE) -> 30
A414: 1636 | B414: 12467 | C414: 5 | D414: 1 | E414: 1 | F414: 20 | G414: 6 | H414: =RC[-5]*RC[3] -> 150 | I414: 0 | J414: =VLOOKUP(RC[-8],Sheet1!C2:C3,2,FALSE) -> 女警碎片 | K414: =VLOOKUP(RC[-1],Sheet1!C5:C6,2,FALSE) -> 30
A415: 1637 | B415: 12468 | C415: 5 | D415: 1 | E415: 1 | F415: 0 | G415: 6 | H415: =RC[-5]*RC[3] -> 200 | I415: 0 | J415: =VLOOKUP(RC[-8],Sheet1!C2:C3,2,FALSE) -> 小黑碎片 | K415: =VLOOKUP(RC[-1],Sheet1!C5:C6,2,FALSE) -> 40
A416: 1638 | B416: 12469 | C416: 5 | D416: 1 | E416: 1 | F416: 20 | G416: 6 | H416: =RC[-5]*RC[3] -> 150 | I416: 0 | J416: =VLOOKUP(RC[-8],Sheet1!C2:C3,2,FALSE) -> 熊阿宝碎片 | K416: =VLOOKUP(RC[-1],Sheet1!C5:C6,2,FALSE) -> 30
A417: 1639 | B417: 12470 | C417: 5 | D417: 1 | E417: 1 | F417: 0 | G417: 6 | H417: =RC[-5]*RC[3] -> 200 | I417: 0 | J417: =VLOOKUP(RC[-8],Sheet1!C2:C3,2,FALSE) -> 血色指挥官碎片 | K417: =VLOOKUP(RC[-1],Sheet1!C5:C6,2,FALSE) -> 40
A418: 1640 | B418: 12471 | C418: 5 | D418: 1 | E418: 1 | F418: 20 | G418: 6 | H418: =RC[-5]*RC[3] -> 150 | I418: 0 | J418: =VLOOKUP(RC[-8],Sheet1!C2:C3,2,FALSE) -> 大检察官碎片 | K418: =VLOOKUP(RC[-1],Sheet1!C5:C6,2,FALSE) -> 30
A419: 1641 | B419: 12472 | C419: 5 | D419: 1 | E419: 1 | F419: 20 | G419: 6 | H419: =RC[-5]*RC[3] -> 200 | I419: 0 | J419: =VLOOKUP(RC[-8],Sheet1!C2:C3,2,FALSE) -> 恶魔猎手碎片 | K419: =VLOOKUP(RC[-1],Sheet1!C5:C6,2,FALSE) -> 40
A420: 1642 | B420: 12473 | C420: 5 | D420: 1 | E420: 1 | F420: 20 | G420: 6 | H420: =RC[-5]*RC[3] -> 200 | I420: 0 | J420: =VLOOKUP(RC[-8],Sheet1!C2:C3,2,FALSE) -> 神圣牧师碎片 | K420: =VLOOKUP(RC[-1],Sheet1!C5:C6,2,FALSE) -> 40
A421: 1643 | B421: 12360 | C421: 10 | D421: 1 | E421: 1 | F421: 20 | G421: 6 | H421: =RC[-5]*RC[3] -> 200 | I421: 0 | J421: =VLOOKUP(RC[-8],Sheet1!C2:C3,2,FALSE) -> 地精神偷碎片 | K421: =VLOOKUP(RC[-1],Sheet1!C5:C6,2,FALSE) -> 20
A422: 1644 | B422: 12361 | C422: 10 | D422: 1 | E422: 1 | F422: 20 | G422: 6 | H422: =RC[-5]*RC[3] -> 200 | I422: 0 | J422: =VLOOKUP(RC[-8],Sheet1!C2:C3,2,FALSE) -> 骷髅王碎片 | K422: =VLOOKUP(RC[-1],Sheet1!C5:C6,2,FALSE) -> 20
A423: 1645 | B423: 12362 | C423: 10 | D423: 1 | E423: 1 | F423: 20 | G423: 6 | H423: =RC[-5]*RC[3] -> 200 | I423: 0 | J423: =VLOOKUP(RC[-8],Sheet1!C2:C3,2,FALSE) -> 传说哥碎片 | K423: =VLOOKUP(RC[-1],Sheet1!C5:C6,2,FALSE) -> 20
A424: 1646 | B424: 12363 | C424: 10 | D424: 1 | E424: 1 | F424: 20 | G424: 6 | H424: =RC[-5]*RC[3] -> 200 | I424: 0 | J424: =VLOOKUP(RC[-8],Sheet1!C2:C3,2,FALSE) -> 海元素国王碎片 | K424: =VLOOKUP(RC[-1],Sheet1!C5:C6,2,FALSE) -> 20
A425: 1647 | B425: 12364 | C425: 10 | D425: 1 | E425: 1 | F425: 20 | G425: 6 | H425: =RC[-5]*RC[3] -> 200 | I425: 0 | J425: =VLOOKUP(RC[-8],Sheet1!C2:C3,2,FALSE) -> 水元素国王碎片 | K425: =VLOOKUP(RC[-1],Sheet1!C5:C6,2,FALSE) -> 20
A426: 1648 | B426: 12365 | C426: 10 | D426: 1 | E426: 1 | F426: 20 | G426: 6 | H426: =RC[-5]*RC[3] -> 220 | I426: 0 | J426: =VLOOKUP(RC[-8],Sheet1!C2:C3,2,FALSE) -> 石头人碎片 | K426: =VLOOKUP(RC[-1],Sheet1!C5:C6,2,FALSE) -> 22
A427: 1649 | B427: 12366 | C427: 10 | D427: 1 | E427: 1 | F427: 20 | G427: 6 | H427: =RC[-5]*RC[3] -> 220 | I427: 0 | J427: =VLOOKUP(RC[-8],Sheet1!C2:C3,2,FALSE) -> 血源牧师碎片 | K427: =VLOOKUP(RC[-1],Sheet1!C5:C6,2,FALSE) -> 22
A428: 1650 | B428: 12460 | C428: 10 | D428: 1 | E428: 1 | F428: 20 | G428: 6 | H428: =RC[-5]*RC[3] -> 300 | I428: 0 | J428: =VLOOKUP(RC[-8],Sheet1!C2:C3,2,FALSE) -> 憎恶碎片 | K428: =VLOOKUP(RC[-1],Sheet1!C5:C6,2,FALSE) -> 30
A429: 1651 | B429: 12461 | C429: 10 | D429: 1 | E429: 1 | F429: 20 | G429: 6 | H429: =RC[-5]*RC[3] -> 300 | I429: 0 | J429: =VLOOKUP(RC[-8],Sheet1!C2:C3,2,FALSE) -> 树精碎片 | K429: =VLOOKUP(RC[-1],Sheet1!C5:C6,2,FALSE) -> 30
A430: 1652 | B430: 12462 | C430: 10 | D430: 1 | E430: 1 | F430: 20 | G430: 6 | H430: =RC[-5]*RC[3] -> 300 | I430: 0 | J430: =VLOOKUP(RC[-8],Sheet1!C2:C3,2,FALSE) -> 牛头人碎片 | K430: =VLOOKUP(RC[-1],Sheet1!C5:C6,2,FALSE) -> 30
A431: 1653 | B431: 12463 | C431: 10 | D431: 1 | E431: 1 | F431: 20 | G431: 6 | H431: =RC[-5]*RC[3] -> 300 | I431: 0 | J431: =VLOOKUP(RC[-8],Sheet1!C2:C3,2,FALSE) -> 火女碎片 | K431: =VLOOKUP(RC[-1],Sheet1!C5:C6,2,FALSE) -> 30
A432: 1654 | B432: 12464 | C432: 10 | D432: 1 | E432: 1 | F432: 20 | G432: 6 | H432: =RC[-5]*RC[3] -> 300 | I432: 0 | J432: =VLOOKUP(RC[-8],Sheet1!C2:C3,2,FALSE) -> 半人马碎片 | K432: =VLOOKUP(RC[-1],Sheet1!C5:C6,2,FALSE) -> 30
A433: 1655 | B433: 12465 | C433: 10 | D433: 1 | E433: 1 | F433: 20 | G433: 6 | H433: =RC[-5]*RC[3] -> 300 | I433: 0 | J433: =VLOOKUP(RC[-8],Sheet1!C2:C3,2,FALSE) -> 食人魔碎片 | K433: =VLOOKUP(RC[-1],Sheet1!C5:C6,2,FALSE) -> 30
A434: 1656 | B434: 12466 | C434: 10 | D434: 1 | E434: 1 | F434: 20 | G434: 6 | H434: =RC[-5]*RC[3] -> 300 | I434: 0 | J434: =VLOOKUP(RC[-8],Sheet1!C2:C3,2,FALSE) -> 基伦碎片 | K434: =VLOOKUP(RC[-1],Sheet1!C5:C6,2,FALSE) -> 30
A435: 1657 | B435: 12467 | C435: 10 | D435: 1 | E435: 1 | F435: 20 | G435: 6 | H435: =RC[-5]*RC[3] -> 300 | I435: 0 | J435: =VLOOKUP(RC[-8],Sheet1!C2:C3,2,FALSE) -> 女警碎片 | K435: =VLOOKUP(RC[-1],Sheet1!C5:C6,2,FALSE) -> 30
A436: 1658 | B436: 12468 | C436: 10 | D436: 1 | E436: 1 | F436: 0 | G436: 6 | H436: =RC[-5]*RC[3] -> 400 | I436: 0 | J436: =VLOOKUP(RC[-8],Sheet1!C2:C3,2,FALSE) -> 小黑碎片 | K436: =VLOOKUP(RC[-1],Sheet1!C5:C6,2,FALSE) -> 40
A437: 1659 | B437: 12469 | C437: 10 | D437: 1 | E437: 1 | F437: 20 | G437: 6 | H437: =RC[-5]*RC[3] -> 300 | I437: 0 | J437: =VLOOKUP(RC[-8],Sheet1!C2:C3,2,FALSE) -> 熊阿宝碎片 | K437: =VLOOKUP(RC[-1],Sheet1!C5:C6,2,FALSE) -> 30
A438: 1660 | B438: 12470 | C438: 10 | D438: 1 | E438: 1 | F438: 0 | G438: 6 | H438: =RC[-5]*RC[3] -> 400 | I438: 0 | J438: =VLOOKUP(RC[-8],Sheet1!C2:C3,2,FALSE) -> 血色指挥官碎片 | K438: =VLOOKUP(RC[-1],Sheet1!C5:C6,2,FALSE) -> 40
A439: 1661 | B439: 12471 | C439: 10 | D439: 1 | E439: 1 | F439: 20 | G439: 6 | H439: =RC[-5]*RC[3] -> 300 | I439: 0 | J439: =VLOOKUP(RC[-8],Sheet1!C2:C3,2,FALSE) -> 大检察官碎片 | K439: =VLOOKUP(RC[-1],Sheet1!C5:C6,2,FALSE) -> 30
A440: 1662 | B440: 12472 | C440: 10 | D440: 1 | E440: 1 | F440: 20 | G440: 6 | H440: =RC[-5]*RC[3] -> 400 | I440: 0 | J440: =VLOOKUP(RC[-8],Sheet1!C2:C3,2,FALSE) -> 恶魔猎手碎片 | K440: =VLOOKUP(RC[-1],Sheet1!C5:C6,2,FALSE) -> 40
A441: 1663 | B441: 12473 | C441: 10 | D441: 1 | E441: 1 | F441: 20 | G441: 6 | H441: =RC[-5]*RC[3] -> 400 | I441: 0 | J441: =VLOOKUP(RC[-8],Sheet1!C2:C3,2,FALSE) -> 神圣牧师碎片 | K441: =VLOOKUP(RC[-1],Sheet1!C5:C6,2,FALSE) -> 40
A442: 1664 | B442: 32300 | C442: 1 | D442: 1 | E442: 1 | F442: 1 | G442: 5 | H442: =RC[-5]*RC[3] -> 800 | I442: 0 | J442: =VLOOKUP(RC[-8],Sheet1!C2:C3,2,FALSE) -> 地精神偷 | K442: =VLOOKUP(RC[-1],Sheet1!C5:C6,2,FALSE) -> 800
A443: 1665 | B443: 32310 | C443: 1 | D443: 1 | E443: 1 | F443: 1 | G443: 5 | H443: =RC[-5]*RC[3] -> 800 | I443: 0 | J443: =VLOOKUP(RC[-8],Sheet1!C2:C3,2,FALSE) -> 骷髅王 | K443: =VLOOKUP(RC[-1],Sheet1!C5:C6,2,FALSE) -> 800
A444: 1666 | B444: 32320 | C444: 1 | D444: 1 | E444: 1 | F444: 1 | G444: 5 | H444: =RC[-5]*RC[3] -> 800 | I444: 0 | J444: =VLOOKUP(RC[-8],Sheet1!C2:C3,2,FALSE) -> 传说哥 | K444: =VLOOKUP(RC[-1],Sheet1!C5:C6,2,FALSE) -> 800
A445: 1667 | B445: 32330 | C445: 1 | D445: 1 | E445: 1 | F445: 1 | G445: 5 | H445: =RC[-5]*RC[3] -> 800 | I445: 0 | J445: =VLOOKUP(RC[-8],Sheet1!C2:C3,2,FALSE) -> 海元素国王 | K445: =VLOOKUP(RC[-1],Sheet1!C5:C6,2,FALSE) -> 800
A446: 1668 | B446: 32340 | C446: 1 | D446: 1 | E446: 1 | F446: 1 | G446: 5 | H446: =RC[-5]*RC[3] -> 800 | I446: 0 | J446: =VLOOKUP(RC[-8],Sheet1!C2:C3,2,FALSE) -> 水元素国王 | K446: =VLOOKUP(RC[-1],Sheet1!C5:C6,2,FALSE) -> 800
A447: 1669 | B447: 32311 | C447: 1 | D447: 1 | E447: 1 | F447: 1 | G447: 5 | H447: =RC[-5]*RC[3] -> 880 | I447: 0 | J447: =VLOOKUP(RC[-8],Sheet1!C2:C3,2,FALSE) -> 石头人 | K447: =VLOOKUP(RC[-1],Sheet1!C5:C6,2,FALSE) -> 880
A448: 1670 | B448: 32341 | C448: 1 | D448: 1 | E448: 1 | F448: 1 | G448: 5 | H448: =RC[-5]*RC[3] -> 880 | I448: 0 | J448: =VLOOKUP(RC[-8],Sheet1!C2:C3,2,FALSE) -> 血源牧师 | K448: =VLOOKUP(RC[-1],Sheet1!C5:C6,2,FALSE) -> 880
A449: 1671 | B449: 32410 | C449: 1 | D449: 1 | E449: 1 | F449: 1 | G449: 5 | H449: =RC[-5]*RC[3] -> 2400 | I449: 0 | J449: =VLOOKUP(RC[-8],Sheet1!C2:C3,2,FALSE) -> 憎恶 | K449: =VLOOKUP(RC[-1],Sheet1!C5:C6,2,FALSE) -> 2400
A450: 1672 | B450: 32411 | C450: 1 | D450: 1 | E450: 1 | F450: 1 | G450: 5 | H450: =RC[-5]*RC[3] -> 2400 | I450: 0 | J450: =VLOOKUP(RC[-8],Sheet1!C2:C3,2,FALSE) -> 树精 | K450: =VLOOKUP(RC[-1],Sheet1!C5:C6,2,FALSE) -> 2400
A451: 1673 | B451: 32400 | C451: 1 | D451: 1 | E451: 1 | F451: 1 | G451: 5 | H451: =RC[-5]*RC[3] -> 2400 | I451: 0 | J451: =VLOOKUP(RC[-8],Sheet1!C2:C3,2,FALSE) -> 牛头人 | K451: =VLOOKUP(RC[-1],Sheet1!C5:C6,2,FALSE) -> 2400
A452: 1674 | B452: 32430 | C452: 1 | D452: 1 | E452: 1 | F452: 1 | G452: 5 | H452: =RC[-5]*RC[3] -> 2400 | I452: 0 | J452: =VLOOKUP(RC[-8],Sheet1!C2:C3,2,FALSE) -> 火女 | K452: =VLOOKUP(RC[-1],Sheet1!C5:C6,2,FALSE) -> 2400
A453: 1675 | B453: 32401 | C453: 1 | D453: 1 | E453: 1 | F453: 1 | G453: 5 | H453: =RC[-5]*RC[3] -> 2400 | I453: 0 | J453: =VLOOKUP(RC[-8],Sheet1!C2:C3,2,FALSE) -> 半人马 | K453: =VLOOKUP(RC[-1],Sheet1!C5:C6,2,FALSE) -> 2400
A454: 1676 | B454: 32431 | C454: 1 | D454: 1 | E454: 1 | F454: 1 | G454: 5 | H454: =RC[-5]*RC[3] -> 2400 | I454: 0 | J454: =VLOOKUP(RC[-8],Sheet1!C2:C3,2,FALSE) -> 食人魔 | K454: =VLOOKUP(RC[-1],Sheet1!C5:C6,2,FALSE) -> 2400
A455: 1677 | B455: 32402 | C455: 1 | D455: 1 | E455: 1 | F455: 1 | G455: 5 | H455: =RC[-5]*RC[3] -> 2400 | I455: 0 | J455: =VLOOKUP(RC[-8],Sheet1!C2:C3,2,FALSE) -> 基伦 | K455: =VLOOKUP(RC[-1],Sheet1!C5:C6,2,FALSE) -> 2400
A456: 1678 | B456: 32420 | C456: 1 | D456: 1 | E456: 1 | F456: 1 | G456: 5 | H456: =RC[-5]*RC[3] -> 2400 | I456: 0 | J456: =VLOOKUP(RC[-8],Sheet1!C2:C3,2,FALSE) -> 女警 | K456: =VLOOKUP(RC[-1],Sheet1!C5:C6,2,FALSE) -> 2400
A457: 1679 | B457: 32428 | C457: 1 | D457: 1 | E457: 1 | F457: 0 | G457: 5 | H457: =RC[-5]*RC[3] -> 3200 | I457: 0 | J457: =VLOOKUP(RC[-8],Sheet1!C2:C3,2,FALSE) -> 小黑 | K457: =VLOOKUP(RC[-1],Sheet1!C5:C6,2,FALSE) -> 3200
A458: 1680 | B458: 32412 | C458: 1 | D458: 1 | E458: 1 | F458: 1 | G458: 5 | H458: =RC[-5]*RC[3] -> 2400 | I458: 0 | J458: =VLOOKUP(RC[-8],Sheet1!C2:C3,2,FALSE) -> 熊阿宝 | K458: =VLOOKUP(RC[-1],Sheet1!C5:C6,2,FALSE) -> 2400
A459: 1681 | B459: 32408 | C459: 1 | D459: 1 | E459: 1 | F459: 0 | G459: 5 | H459: =RC[-5]*RC[3] -> 3200 | I459: 0 | J459: =VLOOKUP(RC[-8],Sheet1!C2:C3,2,FALSE) -> 血色指挥官 | K459: =VLOOKUP(RC[-1],Sheet1!C5:C6,2,FALSE) -> 3200
A460: 1682 | B460: 32440 | C460: 1 | D460: 1 | E460: 1 | F460: 1 | G460: 5 | H460: =RC[-5]*RC[3] -> 2400 | I460: 0 | J460: =VLOOKUP(RC[-8],Sheet1!C2:C3,2,FALSE) -> 大检察官 | K460: =VLOOKUP(RC[-1],Sheet1!C5:C6,2,FALSE) -> 2400
A461: 1683 | B461: 32409 | C461: 1 | D461: 1 | E461: 1 | F461: 1 | G461: 5 | H461: =RC[-5]*RC[3] -> 3200 | I461: 0 | J461: =VLOOKUP(RC[-8],Sheet1!C2:C3,2,FALSE) -> 恶魔猎手 | K461: =VLOOKUP(RC[-1],Sheet1!C5:C6,2,FALSE) -> 3200
A462: 1684 | B462: 32449 | C462: 1 | D462: 1 | E462: 1 | F462: 1 | G462: 5 | H462: =RC[-5]*RC[3] -> 3200 | I462: 0 | J462: =VLOOKUP(RC[-8],Sheet1!C2:C3,2,FALSE) -> 神圣牧师 | K462: =VLOOKUP(RC[-1],Sheet1!C5:C6,2,FALSE) -> 3200
A463: 1685 | B463: 12360 | C463: 5 | D463: 1 | E463: 1 | F463: 20 | G463: 5 | H463: =RC[-5]*RC[3] -> 100 | I463: 0 | J463: =VLOOKUP(RC[-8],Sheet1!C2:C3,2,FALSE) -> 地精神偷碎片 | K463: =VLOOKUP(RC[-1],Sheet1!C5:C6,2,FALSE) -> 20
A464: 1686 | B464: 12361 | C464: 5 | D464: 1 | E464: 1 | F464: 20 | G464: 5 | H464: =RC[-5]*RC[3] -> 100 | I464: 0 | J464: =VLOOKUP(RC[-8],Sheet1!C2:C3,2,FALSE) -> 骷髅王碎片 | K464: =VLOOKUP(RC[-1],Sheet1!C5:C6,2,FALSE) -> 20
A465: 1687 | B465: 12362 | C465: 5 | D465: 1 | E465: 1 | F465: 20 | G465: 5 | H465: =RC[-5]*RC[3] -> 100 | I465: 0 | J465: =VLOOKUP(RC[-8],Sheet1!C2:C3,2,FALSE) -> 传说哥碎片 | K465: =VLOOKUP(RC[-1],Sheet1!C5:C6,2,FALSE) -> 20
A466: 1688 | B466: 12363 | C466: 5 | D466: 1 | E466: 1 | F466: 20 | G466: 5 | H466: =RC[-5]*RC[3] -> 100 | I466: 0 | J466: =VLOOKUP(RC[-8],Sheet1!C2:C3,2,FALSE) -> 海元素国王碎片 | K466: =VLOOKUP(RC[-1],Sheet1!C5:C6,2,FALSE) -> 20
A467: 1689 | B467: 12364 | C467: 5 | D467: 1 | E467: 1 | F467: 20 | G467: 5 | H467: =RC[-5]*RC[3] -> 100 | I467: 0 | J467: =VLOOKUP(RC[-8],Sheet1!C2:C3,2,FALSE) -> 水元素国王碎片 | K467: =VLOOKUP(RC[-1],Sheet1!C5:C6,2,FALSE) -> 20
A468: 1690 | B468: 12365 | C468: 5 | D468: 1 | E468: 1 | F468: 20 | G468: 5 | H468: =RC[-5]*RC[3] -> 110 | I468: 0 | J468: =VLOOKUP(RC[-8],Sheet1!C2:C3,2,FALSE) -> 石头人碎片 | K468: =VLOOKUP(RC[-1],Sheet1!C5:C6,2,FALSE) -> 22
A469: 1691 | B469: 12366 | C469: 5 | D469: 1 | E469: 1 | F469: 20 | G469: 5 | H469: =RC[-5]*RC[3] -> 110 | I469: 0 | J469: =VLOOKUP(RC[-8],Sheet1!C2:C3,2,FALSE) -> 血源牧师碎片 | K469: =VLOOKUP(RC[-1],Sheet1!C5:C6,2,FALSE) -> 22
A470: 1692 | B470: 12460 | C470: 5 | D470: 1 | E470: 1 | F470: 20 | G470: 5 | H470: =RC[-5]*RC[3] -> 150 | I470: 0 | J470: =VLOOKUP(RC[-8],Sheet1!C2:C3,2,FALSE) -> 憎恶碎片 | K470: =VLOOKUP(RC[-1],Sheet1!C5:C6,2,FALSE) -> 30
A471: 1693 | B471: 12461 | C471: 5 | D471: 1 | E471: 1 | F471: 20 | G471: 5 | H471: =RC[-5]*RC[3] -> 150 | I471: 0 | J471: =VLOOKUP(RC[-8],Sheet1!C2:C3,2,FALSE) -> 树精碎片 | K471: =VLOOKUP(RC[-1],Sheet1!C5:C6,2,FALSE) -> 30
A472: 1694 | B472: 12462 | C472: 5 | D472: 1 | E472: 1 | F472: 20 | G472: 5 | H472: =RC[-5]*RC[3] -> 150 | I472: 0 | J472: =VLOOKUP(RC[-8],Sheet1!C2:C3,2,FALSE) -> 牛头人碎片 | K472: =VLOOKUP(RC[-1],Sheet1!C5:C6,2,FALSE) -> 30
A473: 1695 | B473: 12463 | C473: 5 | D473: 1 | E473: 1 | F473: 20 | G473: 5 | H473: =RC[-5]*RC[3] -> 150 | I473: 0 | J473: =VLOOKUP(RC[-8],Sheet1!C2:C3,2,FALSE) -> 火女碎片 | K473: =VLOOKUP(RC[-1],Sheet1!C5:C6,2,FALSE) -> 30
A474: 1696 | B474: 12464 | C474: 5 | D474: 1 | E474: 1 | F474: 20 | G474: 5 | H474: =RC[-5]*RC[3] -> 150 | I474: 0 | J474: =VLOOKUP(RC[-8],Sheet1!C2:C3,2,FALSE) -> 半人马碎片 | K474: =VLOOKUP(RC[-1],Sheet1!C5:C6,2,FALSE) -> 30
A475: 1697 | B475: 12465 | C475: 5 | D475: 1 | E475: 1 | F475: 20 | G475: 5 | H475: =RC[-5]*RC[3] -> 150 | I475: 0 | J475: =VLOOKUP(RC[-8],Sheet1!C2:C3,2,FALSE) -> 食人魔碎片 | K475: =VLOOKUP(RC[-1],Sheet1!C5:C6,2,FALSE) -> 30
A476: 1698 | B476: 12466 | C476: 5 | D476: 1 | E476: 1 | F476: 20 | G476: 5 | H476: =RC[-5]*RC[3] -> 150 | I476: 0 | J476: =VLOOKUP(RC[-8],Sheet1!C2:C3,2,FALSE) -> 基伦碎片 | K476: =VLOOKUP(RC[-1],Sheet1!C5:C6,2,FALSE) -> 30
A477: 1699 | B477: 12467 | C477: 5 | D477: 1 | E477: 1 | F477: 20 | G477: 5 | H477: =RC[-5]*RC[3] -> 150 | I477: 0 | J477: =VLOOKUP(RC[-8],Sheet1!C2:C3,2,FALSE) -> 女警碎片 | K477: =VLOOKUP(RC[-1],Sheet1!C5:C6,2,FALSE) -> 30
A478: 1700 | B478: 12468 | C478: 5 | D478: 1 | E478: 1 | F478: 20 | G478: 5 | H478: =RC[-5]*RC[3] -> 200 | I478: 0 | J478: =VLOOKUP(RC[-8],Sheet1!C2:C3,2,FALSE) -> 小黑碎片 | K478: =VLOOKUP(RC[-1],Sheet1!C5:C6,2,FALSE) -> 40
A479: 1701 | B479: 12469 | C479: 5 | D479: 1 | E479: 1 | F479: 20 | G479: 5 | H479: =RC[-5]*RC[3] -> 150 | I479: 0 | J479: =VLOOKUP(RC[-8],Sheet1!C2:C3,2,FALSE) -> 熊阿宝碎片 | K479: =VLOOKUP(RC[-1],Sheet1!C5:C6,2,FALSE) -> 30
A480: 1702 | B480: 12470 | C480: 5 | D480: 1 | E480: 1 | F480: 20 | G480: 5 | H480: =RC[-5]*RC[3] -> 200 | I480: 0 | J480: =VLOOKUP(RC[-8],Sheet1!C2:C3,2,FALSE) -> 血色指挥官碎片 | K480: =VLOOKUP(RC[-1],Sheet1!C5:C6,2,FALSE) -> 40
A481: 1703 | B481: 12471 | C481: 5 | D481: 1 | E481: 1 | F481: 20 | G481: 5 | H481: =RC[-5]*RC[3] -> 150 | I481: 0 | J481: =VLOOKUP(RC[-8],Sheet1!C2:C3,2,FALSE) -> 大检察官碎片 | K481: =VLOOKUP(RC[-1],Sheet1!C5:C6,2,FALSE) -> 30
A482: 1704 | B482: 12472 | C482: 5 | D482: 1 | E482: 1 | F482: 20 | G482: 5 | H482: =RC[-5]*RC[3] -> 200 | I482: 0 | J482: =VLOOKUP(RC[-8],Sheet1!C2:C3,2,FALSE) -> 恶魔猎手碎片 | K482: =VLOOKUP(RC[-1],Sheet1!C5:C6,2,FALSE) -> 40
A483: 1705 | B483: 12473 | C483: 5 | D483: 1 | E483: 1 | F483: 20 | G483: 5 | H483: =RC[-5]*RC[3] -> 200 | I483: 0 | J483: =VLOOKUP(RC[-8],Sheet1!C2:C3,2,FALSE) -> 神圣牧师碎片 | K483: =VLOOKUP(RC[-1],Sheet1!C5:C6,2,FALSE) -> 40
A484: 1706 | B484: 12360 | C484: 10 | D484: 1 | E484: 1 | F484: 20 | G484: 5 | H484: =RC[-5]*RC[3] -> 200 | I484: 0 | J484: =VLOOKUP(RC[-8],Sheet1!C2:C3,2,FALSE) -> 地精神偷碎片 | K484: =VLOOKUP(RC[-1],Sheet1!C5:C6,2,FALSE) -> 20
A485: 1707 | B485: 12361 | C485: 10 | D485: 1 | E485: 1 | F485: 20 | G485: 5 | H485: =RC[-5]*RC[3] -> 200 | I485: 0 | J485: =VLOOKUP(RC[-8],Sheet1!C2:C3,2,FALSE) -> 骷髅王碎片 | K485: =VLOOKUP(RC[-1],Sheet1!C5:C6,2,FALSE) -> 20
A486: 1708 | B486: 12362 | C486: 10 | D486: 1 | E486: 1 | F486: 20 | G486: 5 | H486: =RC[-5]*RC[3] -> 200 | I486: 0 | J486: =VLOOKUP(RC[-8],Sheet1!C2:C3,2,FALSE) -> 传说哥碎片 | K486: =VLOOKUP(RC[-1],Sheet1!C5:C6,2,FALSE) -> 20
A487: 1709 | B487: 12363 | C487: 10 | D487: 1 | E487: 1 | F487: 20 | G487: 5 | H487: =RC[-5]*RC[3] -> 200 | I487: 0 | J487: =VLOOKUP(RC[-8],Sheet1!C2:C3,2,FALSE) -> 海元素国王碎片 | K487: =VLOOKUP(RC[-1],Sheet1!C5:C6,2,FALSE) -> 20
A488: 1710 | B488: 12364 | C488: 10 | D488: 1 | E488: 1 | F488: 20 | G488: 5 | H488: =RC[-5]*RC[3] -> 200 | I488: 0 | J488: =VLOOKUP(RC[-8],Sheet1!C2:C3,2,FALSE) -> 水元素国王碎片 | K488: =VLOOKUP(RC[-1],Sheet1!C5:C6,2,FALSE) -> 20
A489: 1711 | B489: 12365 | C489: 10 | D489: 1 | E489: 1 | F489: 20 | G489: 5 | H489: =RC[-5]*RC[3] -> 220 | I489: 0 | J489: =VLOOKUP(RC[-8],Sheet1!C2:C3,2,FALSE) -> 石头人碎片 | K489: =VLOOKUP(RC[-1],Sheet1!C5:C6,2,FALSE) -> 22
A490: 1712 | B490: 12366 | C490: 10 | D490: 1 | E490: 1 | F490: 20 | G490: 5 | H490: =RC[-5]*RC[3] -> 220 | I490: 0 | J490: =VLOOKUP(RC[-8],Sheet1!C2:C3,2,FALSE) -> 血源牧师碎片 | K490: =VLOOKUP(RC[-1],Sheet1!C5:C6,2,FALSE) -> 22
A491: 1713 | B491: 12460 | C491: 10 | D491: 1 | E491: 1 | F491: 20 | G491: 5 | H491: =RC[-5]*RC[3] -> 300 | I491: 0 | J491: =VLOOKUP(RC[-8],Sheet1!C2:C3,2,FALSE) -> 憎恶碎片 | K491: =VLOOKUP(RC[-1],Sheet1!C5:C6,2,FALSE) -> 30
A492: 1714 | B492: 12461 | C492: 10 | D492: 1 | E492: 1 | F492: 20 | G492: 5 | H492: =RC[-5]*RC[3] -> 300 | I492: 0 | J492: =VLOOKUP(RC[-8],Sheet1!C2:C3,2,FALSE) -> 树精碎片 | K492: =VLOOKUP(RC[-1],Sheet1!C5:C6,2,FALSE) -> 30
A493: 1715 | B493: 12462 | C493: 10 | D493: 1 | E493: 1 | F493: 20 | G493: 5 | H493: =RC[-5]*RC[3] -> 300 | I493: 0 | J493: =VLOOKUP(RC[-8],Sheet1!C2:C3,2,FALSE) -> 牛头人碎片 | K493: =VLOOKUP(RC[-1],Sheet1!C5:C6,2,FALSE) -> 30
A494: 1716 | B494: 12463 | C494: 10 | D494: 1 | E494: 1 | F494: 20 | G494: 5 | H494: =RC[-5]*RC[3] -> 300 | I494: 0 | J494: =VLOOKUP(RC[-8],Sheet1!C2:C3,2,FALSE) -> 火女碎片 | K494: =VLOOKUP(RC[-1],Sheet1!C5:C6,2,FALSE) -> 30
A495: 1717 | B495: 12464 | C495: 10 | D495: 1 | E495: 1 | F495: 20 | G495: 5 | H495: =RC[-5]*RC[3] -> 300 | I495: 0 | J495: =VLOOKUP(RC[-8],Sheet1!C2:C3,2,FALSE) -> 半人马碎片 | K495: =VLOOKUP(RC[-1],Sheet1!C5:C6,2,FALSE) -> 30
A496: 1718 | B496: 12465 | C496: 10 | D496: 1 | E496: 1 | F496: 20 | G496: 5 | H496: =RC[-5]*RC[3] -> 300 | I496: 0 | J496: =VLOOKUP(RC[-8],Sheet1!C2:C3,2,FALSE) -> 食人魔碎片 | K496: =VLOOKUP(RC[-1],Sheet1!C5:C6,2,FALSE) -> 30
A497: 1719 | B497: 12466 | C497: 10 | D497: 1 | E497: 1 | F497: 20 | G497: 5 | H497: =RC[-5]*RC[3] -> 300 | I497: 0 | J497: =VLOOKUP(RC[-8],Sheet1!C2:C3,2,FALSE) -> 基伦碎片 | K497: =VLOOKUP(RC[-1],Sheet1!C5:C6,2,FALSE) -> 30
A498: 1720 | B498: 12467 | C498: 10 | D498: 1 | E498: 1 | F498: 20 | G498: 5 | H498: =RC[-5]*RC[3] -> 300 | I498: 0 | J498: =VLOOKUP(RC[-8],Sheet1!C2:C3,2,FALSE) -> 女警碎片 | K498: =VLOOKUP(RC[-1],Sheet1!C5:C6,2,FALSE) -> 30
A499: 1721 | B499: 12468 | C499: 10 | D499: 1 | E499: 1 | F499: 20 | G499: 5 | H499: =RC[-5]*RC[3] -> 400 | I499: 0 | J499: =VLOOKUP(RC[-8],Sheet1!C2:C3,2,FALSE) -> 小黑碎片 | K499: =VLOOKUP(RC[-1],Sheet1!C5:C6,2,FALSE) -> 40
A500: 1722 | B500: 12469 | C500: 10 | D500: 1 | E500: 1 | F500: 20 | G500: 5 | H500: =RC[-5]*RC[3] -> 300 | I500: 0 | J500: =VLOOKUP(RC[-8],Sheet1!C2:C3,2,FALSE) -> 熊阿宝碎片 | K500: =VLOOKUP(RC[-1],Sheet1!C5:C6,2,FALSE) -> 30
A501: 1723 | B501: 12470 | C501: 10 | D501: 1 | E501: 1 | F501: 20 | G501: 5 | H501: =RC[-5]*RC[3] -> 400 | I501: 0 | J501: =VLOOKUP(RC[-8],Sheet1!C2:C3,2,FALSE) -> 血色指挥官碎片 | K501: =VLOOKUP(RC[-1],Sheet1!C5:C6,2,FALSE) -> 40
A502: 1724 | B502: 12471 | C502: 10 | D502: 1 | E502: 1 | F502: 20 | G502: 5 | H502: =RC[-5]*RC[3] -> 300 | I502: 0 | J502: =VLOOKUP(RC[-8],Sheet1!C2:C3,2,FALSE) -> 大检察官碎片 | K502: =VLOOKUP(RC[-1],Sheet1!C5:C6,2,FALSE) -> 30
A503: 1725 | B503: 12472 | C503: 10 | D503: 1 | E503: 1 | F503: 20 | G503: 5 | H503: =RC[-5]*RC[3] -> 400 | I503: 0 | J503: =VLOOKUP(RC[-8],Sheet1!C2:C3,2,FALSE) -> 恶魔猎手碎片 | K503: =VLOOKUP(RC[-1],Sheet1!C5:C6,2,FALSE) -> 40
A504: 1726 | B504: 12473 | C504: 10 | D504: 1 | E504: 1 | F504: 20 | G504: 5 | H504: =RC[-5]*RC[3] -> 400 | I504: 0 | J504: =VLOOKUP(RC[-8],Sheet1!C2:C3,2,FALSE) -> 神圣牧师碎片 | K504: =VLOOKUP(RC[-1],Sheet1!C5:C6,2,FALSE) -> 40

Sheet: Sheet1
B2: 英雄ID | C2: 英雄名称 | E2: 英雄 | F2: 价值
B3: 30000 | C3: 见习警察 | E3: 警察局长 | F3: 800
B4: 30010 | C4: 初代机甲 | E4: 初号机 | F4: 800
B5: 30020 | C5: a型激光机械 | E5: 零式激光炮 | F5: 800
B6: 30030 | C6: a型镭射机械 | E6: 热熔镭射炮 | F6: 800
B7: 30040 | C7: 见习护士 | E7: 护士长 | F7: 800
B8: 30100 | C8: 防暴警察 | E8: 超级队长 | F8: 880
B9: 30110 | C9: 战争机甲 | E9: 死亡武士 | F9: 880
B10: 30120 | C10: b型激光机械 | E10: 红颅鬼 | F10: 2400
B11: 30130 | C11: b型镭射机械 | E11: 终极队长 | F11: 2400
B12: 30140 | C12: 战地护士 | E12: 雷神 | F12: 2400
B13: 30200 | C13: 精英特警 | E13: 野蛮巨人 | F13: 2400
B14: 30210 | C14: 王牌机甲 | E14: 致命特工 | F14: 2400
B15: 30220 | C15: 智能激光机械 | E15: 鹰眸 | F15: 2400
B16: 30230 | C16: 智能镭射机械 | E16: 刀锋猎人 | F16: 2400
B17: 30240 | C17: 精英护士 | E17: 地狱骑士 | F17: 2400
B18: 30300 | C18: 警察局长 | E18: 铁人 | F18: 3200
B19: 30310 | C19: 初号机 | E19: 树人 | F19: 2400
B20: 30320 | C20: 零式激光炮 | E20: 超凡博士 | F20: 3200
B21: 30330 | C21: 热熔镭射炮 | E21: 白凤凰 | F21: 2400
B22: 30340 | C22: 护士长 | E22: 黑暗骑士 | F22: 8000
B23: 30301 | C23: 超级队长 | E23: 地狱铁拳 | F23: 3200
B24: 30302 | C24: 死亡武士 | E24: 狼叔 | F24: 8000
B25: 30430 | C25: 红颅鬼 | E25: 混沌女巫 | F25: 3200
B26: 30400 | C26: 终极队长 | E26: 竞技场王者 | F26: 800
B27: 30431 | C27: 雷神 | E27: 重甲武士 | F27: 800
B28: 30410 | C28: 野蛮巨人 | E28: 影杀者 | F28: 800
B29: 30401 | C29: 致命特工 | E29: 暗影巫师 | F29: 800
B30: 30420 | C30: 鹰眸 | E30: 圣光牧师 | F30: 800
B31: 30402 | C31: 刀锋猎人 | E31: 杰克船长 | F31: 880
B32: 30403 | C32: 地狱骑士 | E32: 天使长 | F32: 880
B33: 30428 | C33: 铁人 | E33: 独眼巨人 | F33: 2400
B34: 30411 | C34: 树人 | E34: 圣女贞德 | F34: 2400
B35: 30438 | C35: 超凡博士 | E35: 美杜莎 | F35: 2400
B36: 30440 | C36: 白凤凰 | E36: 德古拉伯爵 | F36: 2400
B37: 30429 | C37: 地狱铁拳 | E37: 狩猎女神 | F37: 2400
B38: 30449 | C38: 混沌女巫 | E38: 查理大帝 | F38: 2400
B39: 30520 | C39: 黑暗骑士 | E39: 佐罗 | F39: 2400
B40: 30500 | C40: 狼叔 | E40: 亚马逊女王 | F40: 2400
B41: 31000 | C41: 角斗士 | E41: 宙斯 | F41: 3200
B42: 31010 | C42: 见习武士 | E42: 斯巴达 | F42: 2400
B43: 31020 | C43: 见习刺客 | E43: 阿努比斯 | F43: 3200
B44: 31030 | C44: 黑魔学徒 | E44: 雅典娜 | F44: 2400
B45: 31040 | C45: 白魔学徒 | E45: 潘多拉 | F45: 8000
B46: 31100 | C46: 剑斗士 | E46: 大力神 | F46: 3200
B47: 31110 | C47: 高级武士 | E47: 奎爷 | F47: 8000
B48: 31120 | C48: 高级刺客 | E48: 冥王哈迪斯 | F48: 3200
B49: 31130 | C49: 黑魔法师 | E49: 地精神偷 | F49: 800
B50: 31140 | C50: 白魔法师 | E50: 骷髅王 | F50: 800
B51: 31200 | C51: 角斗之王 | E51: 传说哥 | F51: 800
B52: 31210 | C52: 盔甲武士 | E52: 海元素国王 | F52: 800
B53: 31220 | C53: 弓弩刺客 | E53: 水元素国王 | F53: 800
B54: 31230 | C54: 黑魔导师 | E54: 石头人 | F54: 880
B55: 31240 | C55: 白魔导师 | E55: 血源牧师 | F55: 880
B56: 31300 | C56: 竞技场王者 | E56: 憎恶 | F56: 2400
B57: 31310 | C57: 重甲武士 | E57: 树精 | F57: 2400
B58: 31320 | C58: 影杀者 | E58: 牛头人 | F58: 2400
B59: 31330 | C59: 暗影巫师 | E59: 火女 | F59: 2400
B60: 31340 | C60: 圣光牧师 | E60: 半人马 | F60: 2400
B61: 31301 | C61: 杰克船长 | E61: 食人魔 | F61: 2400
B62: 31341 | C62: 天使长 | E62: 基伦 | F62: 2400
B63: 31400 | C63: 独眼巨人 | E63: 女警 | F63: 2400
B64: 31440 | C64: 圣女贞德 | E64: 小黑 | F64: 3200
B65: 31430 | C65: 美杜莎 | E65: 熊阿宝 | F65: 2400
B66: 31401 | C66: 德古拉伯爵 | E66: 血色指挥官 | F66: 3200
B67: 31431 | C67: 狩猎女神 | E67: 大检察官 | F67: 2400
B68: 31402 | C68: 查理大帝 | E68: 巫妖之王 | F68: 8000
B69: 31403 | C69: 佐罗 | E69: 恶魔猎手 | F69: 3200
B70: 31420 | C70: 亚马逊女王 | E70: 钢铁酋长 | F70: 8000
B71: 31438 | C71: 宙斯 | E71: 神圣牧师 | F71: 3200
B72: 31410 | C72: 斯巴达
B73: 31408 | C73: 阿努比斯 | E73: =R[-70]C&"碎片" -> 警察局长碎片 | F73: =R[-70]C/RC[1] -> 20 | G73: 40
B74: 31441 | C74: 雅典娜 | E74: =R[-70]C&"碎片" -> 初号机碎片 | F74: =R[-70]C/RC[1] -> 20 | G74: 40
B75: 31419 | C75: 大力神 | E75: =R[-70]C&"碎片" -> 零式激光炮碎片 | F75: =R[-70]C/RC[1] -> 20 | G75: 40
B76: 31439 | C76: 冥王哈迪斯 | E76: =R[-70]C&"碎片" -> 热熔镭射炮碎片 | F76: =R[-70]C/RC[1] -> 20 | G76: 40
B77: 31530 | C77: 潘多拉 | E77: =R[-70]C&"碎片" -> 护士长碎片 | F77: =R[-70]C/RC[1] -> 20 | G77: 40
B78: 31500 | C78: 奎爷 | E78: =R[-70]C&"碎片" -> 超级队长碎片 | F78: =R[-70]C/RC[1] -> 22 | G78: 40
B79: 32000 | C79: 恶劣地精 | E79: =R[-70]C&"碎片" -> 死亡武士碎片 | F79: =R[-70]C/RC[1] -> 22 | G79: 40
B80: 32010 | C80: 新生骷髅 | E80: =R[-70]C&"碎片" -> 红颅鬼碎片 | F80: =R[-70]C/RC[1] -> 30 | G80: 80
B81: 32020 | C81: 矮人民兵 | E81: =R[-70]C&"碎片" -> 终极队长碎片 | F81: =R[-70]C/RC[1] -> 30 | G81: 80
B82: 32030 | C82: 初级海元素 | E82: =R[-70]C&"碎片" -> 雷神碎片 | F82: =R[-70]C/RC[1] -> 30 | G82: 80
B83: 32040 | C83: 初级水元素 | E83: =R[-70]C&"碎片" -> 野蛮巨人碎片 | F83: =R[-70]C/RC[1] -> 30 | G83: 80
B84: 32100 | C84: 地精盗贼 | E84: =R[-70]C&"碎片" -> 致命特工碎片 | F84: =R[-70]C/RC[1] -> 30 | G84: 80
B85: 32110 | C85: 骷髅战士 | E85: =R[-70]C&"碎片" -> 鹰眸碎片 | F85: =R[-70]C/RC[1] -> 30 | G85: 80
B86: 32120 | C86: 矮人火枪手 | E86: =R[-70]C&"碎片" -> 刀锋猎人碎片 | F86: =R[-70]C/RC[1] -> 30 | G86: 80
B87: 32130 | C87: 高级海元素 | E87: =R[-70]C&"碎片" -> 地狱骑士碎片 | F87: =R[-70]C/RC[1] -> 30 | G87: 80
B88: 32140 | C88: 高级水元素 | E88: =R[-70]C&"碎片" -> 铁人碎片 | F88: =R[-70]C/RC[1] -> 40 | G88: 80
B89: 32200 | C89: 地精大盗 | E89: =R[-70]C&"碎片" -> 树人碎片 | F89: =R[-70]C/RC[1] -> 30 | G89: 80
B90: 32210 | C90: 骷髅勇士 | E90: =R[-70]C&"碎片" -> 超凡博士碎片 | F90: =R[-70]C/RC[1] -> 40 | G90: 80
B91: 32220 | C91: 精英火枪手 | E91: =R[-70]C&"碎片" -> 白凤凰碎片 | F91: =R[-70]C/RC[1] -> 30 | G91: 80
B92: 32230 | C92: 海元素领主 | E92: =R[-70]C&"碎片" -> 黑暗骑士碎片 | F92: =R[-70]C/RC[1] -> 50 | G92: 160
B93: 32240 | C93: 水元素领主 | E93: =R[-70]C&"碎片" -> 地狱铁拳碎片 | F93: =R[-70]C/RC[1] -> 40 | G93: 80
B94: 32300 | C94: 地精神偷 | E94: =R[-70]C&"碎片" -> 狼叔碎片 | F94: =R[-70]C/RC[1] -> 50 | G94: 160
B95: 32310 | C95: 骷髅王 | E95: =R[-70]C&"碎片" -> 混沌女巫碎片 | F95: =R[-70]C/RC[1] -> 40 | G95: 80
B96: 32320 | C96: 传说哥 | E96: =R[-70]C&"碎片" -> 竞技场王者碎片 | F96: =R[-70]C/RC[1] -> 20 | G96: 40
B97: 32330 | C97: 海元素国王 | E97: =R[-70]C&"碎片" -> 重甲武士碎片 | F97: =R[-70]C/RC[1] -> 20 | G97: 40
B98: 32340 | C98: 水元素国王 | E98: =R[-70]C&"碎片" -> 影杀者碎片 | F98: =R[-70]C/RC[1] -> 20 | G98: 40
B99: 32311 | C99: 石头人 | E99: =R[-70]C&"碎片" -> 暗影巫师碎片 | F99: =R[-70]C/RC[1] -> 20 | G99: 40
B100: 32341 | C100: 血源牧师 | E100: =R[-70]C&"碎片" -> 圣光牧师碎片 | F100: =R[-70]C/RC[1] -> 20 | G100: 40
B101: 32410 | C101: 憎恶 | E101: =R[-70]C&"碎片" -> 杰克船长碎片 | F101: =R[-70]C/RC[1] -> 22 | G101: 40
B102: 32411 | C102: 树精 | E102: =R[-70]C&"碎片" -> 天使长碎片 | F102: =R[-70]C/RC[1] -> 22 | G102: 40
B103: 32400 | C103: 牛头人 | E103: =R[-70]C&"碎片" -> 独眼巨人碎片 | F103: =R[-70]C/RC[1] -> 30 | G103: 80
B104: 32430 | C104: 火女 | E104: =R[-70]C&"碎片" -> 圣女贞德碎片 | F104: =R[-70]C/RC[1] -> 30 | G104: 80
B105: 32401 | C105: 半人马 | E105: =R[-70]C&"碎片" -> 美杜莎碎片 | F105: =R[-70]C/RC[1] -> 30 | G105: 80
B106: 32431 | C106: 食人魔 | E106: =R[-70]C&"碎片" -> 德古拉伯爵碎片 | F106: =R[-70]C/RC[1] -> 30 | G106: 80
B107: 32402 | C107: 基伦 | E107: =R[-70]C&"碎片" -> 狩猎女神碎片 | F107: =R[-70]C/RC[1] -> 30 | G107: 80
B108: 32420 | C108: 女警 | E108: =R[-70]C&"碎片" -> 查理大帝碎片 | F108: =R[-70]C/RC[1] -> 30 | G108: 80
B109: 32428 | C109: 小黑 | E109: =R[-70]C&"碎片" -> 佐罗碎片 | F109: =R[-70]C/RC[1] -> 30 | G109: 80
B110: 32412 | C110: 熊阿宝 | E110: =R[-70]C&"碎片" -> 亚马逊女王碎片 | F110: =R[-70]C/RC[1] -> 30 | G110: 80
B111: 32408 | C111: 血色指挥官 | E111: =R[-70]C&"碎片" -> 宙斯碎片 | F111: =R[-70]C/RC[1] -> 40 | G111: 80
B112: 32440 | C112: 大检察官 | E112: =R[-70]C&"碎片" -> 斯巴达碎片 | F112: =R[-70]C/RC[1] -> 30 | G112: 80
B113: 32409 | C113: 恶魔猎手 | E113: =R[-70]C&"碎片" -> 阿努比斯碎片 | F113: =R[-70]C/RC[1] -> 40 | G113: 80
B114: 32449 | C114: 神圣牧师 | E114: =R[-70]C&"碎片" -> 雅典娜碎片 | F114: =R[-70]C/RC[1] -> 30 | G114: 80
B115: 32500 | C115: 巫妖之王 | E115: =R[-70]C&"碎片" -> 潘多拉碎片 | F115: =R[-70]C/RC[1] -> 50 | G115: 160
B116: 32510 | C116: 钢铁酋长 | E116: =R[-70]C&"碎片" -> 大力神碎片 | F116: =R[-70]C/RC[1] -> 40 | G116: 80
B117: 12200 | C117: 精英特警碎片 | E117: =R[-70]C&"碎片" -> 奎爷碎片 | F117: =R[-70]C/RC[1] -> 50 | G117: 160
B118: 12201 | C118: 王牌机甲碎片 | E118: =R[-70]C&"碎片" -> 冥王哈迪斯碎片 | F118: =R[-70]C/RC[1] -> 40 | G118: 80
B119: 12202 | C119: 智能激光机械碎片 | E119: =R[-70]C&"碎片" -> 地精神偷碎片 | F119: =R[-70]C/RC[1] -> 20 | G119: 40
B120: 12203 | C120: 智能镭射机械碎片 | E120: =R[-70]C&"碎片" -> 骷髅王碎片 | F120: =R[-70]C/RC[1] -> 20 | G120: 40
B121: 12204 | C121: 精英护士碎片 | E121: =R[-70]C&"碎片" -> 传说哥碎片 | F121: =R[-70]C/RC[1] -> 20 | G121: 40
B122: 12300 | C122: 警察局长碎片 | E122: =R[-70]C&"碎片" -> 海元素国王碎片 | F122: =R[-70]C/RC[1] -> 20 | G122: 40
B123: 12301 | C123: 初号机碎片 | E123: =R[-70]C&"碎片" -> 水元素国王碎片 | F123: =R[-70]C/RC[1] -> 20 | G123: 40
B124: 12302 | C124: 零式激光炮碎片 | E124: =R[-70]C&"碎片" -> 石头人碎片 | F124: =R[-70]C/RC[1] -> 22 | G124: 40
B125: 12303 | C125: 热熔镭射炮碎片 | E125: =R[-70]C&"碎片" -> 血源牧师碎片 | F125: =R[-70]C/RC[1] -> 22 | G125: 40
B126: 12304 | C126: 护士长碎片 | E126: =R[-70]C&"碎片" -> 憎恶碎片 | F126: =R[-70]C/RC[1] -> 30 | G126: 80
B127: 12305 | C127: 超级队长碎片 | E127: =R[-70]C&"碎片" -> 树精碎片 | F127: =R[-70]C/RC[1] -> 30 | G127: 80
B128: 12306 | C128: 死亡武士碎片 | E128: =R[-70]C&"碎片" -> 牛头人碎片 | F128: =R[-70]C/RC[1] -> 30 | G128: 80
B129: 12400 | C129: 红颅鬼碎片 | E129: =R[-70]C&"碎片" -> 火女碎片 | F129: =R[-70]C/RC[1] -> 30 | G129: 80
B130: 12401 | C130: 终极队长碎片 | E130: =R[-70]C&"碎片" -> 半人马碎片 | F130: =R[-70]C/RC[1] -> 30 | G130: 80
B131: 12402 | C131: 雷神碎片 | E131: =R[-70]C&"碎片" -> 食人魔碎片 | F131: =R[-70]C/RC[1] -> 30 | G131: 80
B132: 12403 | C132: 野蛮巨人碎片 | E132: =R[-70]C&"碎片" -> 基伦碎片 | F132: =R[-70]C/RC[1] -> 30 | G132: 80
B133: 12404 | C133: 致命特工碎片 | E133: =R[-70]C&"碎片" -> 女警碎片 | F133: =R[-70]C/RC[1] -> 30 | G133: 80
B134: 12405 | C134: 鹰眸碎片 | E134: =R[-70]C&"碎片" -> 小黑碎片 | F134: =R[-70]C/RC[1] -> 40 | G134: 80
B135: 12406 | C135: 刀锋猎人碎片 | E135: =R[-70]C&"碎片" -> 熊阿宝碎片 | F135: =R[-70]C/RC[1] -> 30 | G135: 80
B136: 12407 | C136: 地狱骑士碎片 | E136: =R[-70]C&"碎片" -> 血色指挥官碎片 | F136: =R[-70]C/RC[1] -> 40 | G136: 80
B137: 12408 | C137: 铁人碎片 | E137: =R[-70]C&"碎片" -> 大检察官碎片 | F137: =R[-70]C/RC[1] -> 30 | G137: 80
B138: 12409 | C138: 树人碎片 | E138: =R[-70]C&"碎片" -> 巫妖之王碎片 | F138: =R[-70]C/RC[1] -> 50 | G138: 160
B139: 12410 | C139: 超凡博士碎片 | E139: =R[-70]C&"碎片" -> 恶魔猎手碎片 | F139: =R[-70]C/RC[1] -> 40 | G139: 80
B140: 12411 | C140: 白凤凰碎片 | E140: =R[-70]C&"碎片" -> 钢铁酋长碎片 | F140: =R[-70]C/RC[1] -> 50 | G140: 160
B141: 12412 | C141: 地狱铁拳碎片 | E141: =R[-70]C&"碎片" -> 神圣牧师碎片 | F141: =R[-70]C/RC[1] -> 40 | G141: 80
B142: 12413 | C142: 混沌女巫碎片
B143: 12500 | C143: 黑暗骑士碎片
B144: 12501 | C144: 狼叔碎片
B145: 12230 | C145: 角斗之王碎片
B146: 12231 | C146: 盔甲武士碎片
B147: 12232 | C147: 弓弩刺客碎片
B148: 12233 | C148: 黑魔导师碎片
B149: 12234 | C149: 白魔导师碎片
B150: 12330 | C150: 竞技场王者碎片
B151: 12331 | C151: 重甲武士碎片
B152: 12332 | C152: 影杀者碎片
B153: 12333 | C153: 暗影巫师碎片
B154: 12334 | C154: 圣光牧师碎片
B155: 12335 | C155: 杰克船长碎片
B156: 12336 | C156: 天使长碎片
B157: 12430 | C157: 独眼巨人碎片
B158: 12431 | C158: 圣女贞德碎片
B159: 12432 | C159: 美杜莎碎片
B160: 12433 | C160: 德古拉伯爵碎片
B161: 12434 | C161: 狩猎女神碎片
B162: 12435 | C162: 查理大帝碎片
B163: 12436 | C163: 佐罗碎片
B164: 12437 | C164: 亚马逊女王碎片
B165: 12438 | C165: 宙斯碎片
B166: 12439 | C166: 斯巴达碎片
B167: 12440 | C167: 阿努比斯碎片
B168: 12441 | C168: 雅典娜碎片
B169: 12442 | C169: 大力神碎片
B170: 12443 | C170: 冥王哈迪斯碎片
B171: 12530 | C171: 潘多拉碎片
B172: 12531 | C172: 奎爷碎片
B173: 12260 | C173: 地精大盗碎片
B174: 12261 | C174: 骷髅勇士碎片
B175: 12262 | C175: 精英火枪手碎片
B176: 12263 | C176: 海元素领主碎片
B177: 12264 | C177: 水元素领主碎片
B178: 12360 | C178: 地精神偷碎片
B179: 12361 | C179: 骷髅王碎片
B180: 12362 | C180: 传说哥碎片
B181: 12363 | C181: 海元素国王碎片
B182: 12364 | C182: 水元素国王碎片
B183: 12365 | C183: 石头人碎片
B184: 12366 | C184: 血源牧师碎片
B185: 12460 | C185: 憎恶碎片
B186: 12461 | C186: 树精碎片
B187: 12462 | C187: 牛头人碎片
B188: 12463 | C188: 火女碎片
B189: 12464 | C189: 半人马碎片
B190: 12465 | C190: 食人魔碎片
B191: 12466 | C191: 基伦碎片
B192: 12467 | C192: 女警碎片
B193: 12468 | C193: 小黑碎片
B194: 12469 | C194: 熊阿宝碎片
B195: 12470 | C195: 血色指挥官碎片
B196: 12471 | C196: 大检察官碎片
B197: 12472 | C197: 恶魔猎手碎片
B198: 12473 | C198: 神圣牧师碎片
B199: 12560 | C199: 巫妖之王碎片
B200: 12561 | C200: 钢铁酋长碎片