Sheet: 配置
A1: 服务端文件名 | B1: 服务端对应工作表号 | C1: 客户端文件名 | D1: 客户端对应工作表号 | E1: erl头部 | F1: erl内容格式 | G1: erl尾部 | H1: 客户端特殊处理
A2: config_guild.txt | B2: 1 | C2: config_guild.cnf|Guild | D2: 1 | F2: get(level) -> #$ | H2: 2=>level
A3: config_guild_icon.txt | B3: 2 | C3: config_guild_icon.cnf|GuildIcon | D3: 2 | F3: get(id) -> #$ | H3: 2=>id
A4: config_guild_privilege.txt | B4: 3 | C4: config_guild_privilege.cnf|GuildPrivilege | D4: 3 | F4: get(id) -> #$ | H4: 2=>id
A5: config_guild_qy.txt | B5: 4 | C5: config_guild_qy.cnf|GuildQY | D5: 4 | F5: get(type) -> #$ | H5: 2=>type
A6: config_guild_qs_reward.txt | B6: 5 | C6: config_guild_qs_reward.cnf|GuildQSReward | D6: 5 | F6: get(qs) -> #$ | H6: 1=>qs,guild_level|skill_list
A7: config_guild_event.txt | B7: 6 | C7: config_guild_event.cnf|GuildEvent | D7: 6 | F7: get(id) -> #$ | H7: 2=>id
A8: config_guild_skill.txt | B8: 7 | C8: config_guild_skill.cnf|GuildSkill | D8: 7 | F8: get(id) -> #$ | H8: 1=>id,level|skill_list
A9: config_guild_fb.txt | B9: 8 | C9: config_guild_fb.cnf|GuildFB | D9: 8 | F9: get(id) -> #$ | H9: 2=>id
A10: config_guild_building.txt | B10: 9 | C10: config_guild_building.cnf|GuildBuilding | D10: 9 | F10: get(id) -> #$ | H10: 2=>id

Sheet: 军团配置
A1: level|level | B1: need_exp|need_exp | C1: member_max|member_max
A2: 不可空 | B2: 不可空 | C2: 不可空
A3: 数字 | B3: 数字 | C3: 数字
A6: 工会等级 | B6: 升级需要的经验 | C6: 成员数量
A7: 1 | B7: 5000 | C7: 30 | D7: =ROUND(RC[-2]/300,2) -> 16.67 | E7: =ROUND(RC[-1]/RC[-2],2) -> 0.56
A8: 2 | B8: =R[-1]C*2 -> 10000 | C8: 32 | D8: =ROUND(RC[-2]/300,2) -> 33.33 | E8: =ROUND(RC[-1]/RC[-2],2) -> 1.04
A9: 3 | B9: =R[-1]C*2 -> 20000 | C9: 34 | D9: =ROUND(RC[-2]/300,2) -> 66.67 | E9: =ROUND(RC[-1]/RC[-2],2) -> 1.96
A10: 4 | B10: =R[-1]C*2 -> 40000 | C10: 36 | D10: =ROUND(RC[-2]/300,2) -> 133.33 | E10: =ROUND(RC[-1]/RC[-2],2) -> 3.7
A11: 5 | B11: =R[-1]C*2 -> 80000 | C11: 38 | D11: =ROUND(RC[-2]/300,2) -> 266.67 | E11: =ROUND(RC[-1]/RC[-2],2) -> 7.02
A12: 6 | B12: =R[-1]C*2 -> 160000 | C12: 40 | D12: =ROUND(RC[-2]/300,2) -> 533.33 | E12: =ROUND(RC[-1]/RC[-2],2) -> 13.33
A13: 7 | B13: =R[-1]C*2 -> 320000 | C13: 42 | D13: =ROUND(RC[-2]/300,2) -> 1066.67 | E13: =ROUND(RC[-1]/RC[-2],2) -> 25.4
A14: 8 | B14: =R[-1]C*2 -> 640000 | C14: 44 | D14: =ROUND(RC[-2]/300,2) -> 2133.33 | E14: =ROUND(RC[-1]/RC[-2],2) -> 48.48
A15: 9 | B15: =R[-1]C*2 -> 1280000 | C15: 46 | D15: =ROUND(RC[-2]/300,2) -> 4266.67 | E15: =ROUND(RC[-1]/RC[-2],2) -> 92.75
A16: 10 | B16: 0 | C16: 48 | D16: =ROUND(RC[-2]/300,2) -> 0 | E16: =ROUND(RC[-1]/RC[-2],2) -> 0

Sheet: 军团徽章
A1: id|id | B1: need_rank|need_rank
A2: 不可空 | B2: 不可空
A3: 数字 | B3: 字符串
A6: 徽章ID | B6: 需要的工会排名
A7: 1 | B7: 1
A8: 2 | B8: 2
A9: 3 | B9: 3
A10: 4 | B10: 4
A11: 5 | B11: 5
A12: 6 | B12: 6
A13: 7 | B13: 7
A14: 8 | B14: 8
A15: 9 | B15: 9
A16: 10 | B16: 10

Sheet: 职位权限
A1: id|id | B1: dismiss|dismiss | C1: apply_check|apply_check | D1: leave|leave | E1: level|level | F1: appoint_assist|appoint_assist | G1: kick_out|kick_out | H1: inside_msg|inside_msg | I1: level|level | J1: recall| | K1: accuse| | L1: skill| | M1: reset| | N1: declare_war|
A2: 不可空 | B2: 不可空 | C2: 不可空 | D2: 不可空 | E2: 不可空 | F2: 不可空 | G2: 不可空 | H2: 不可空 | I2: 不可空 | J2: 不可空 | K2: 不可空 | L2: 不可空 | M2: 不可空 | N2: 不可空
A3: 数字 | B3: 字符串 | C3: 数字 | D3: 数字 | E3: 数字 | F3: 数字 | G3: 数字 | H3: 数字 | I3: 数字 | J3: 数字 | K3: 数字 | L3: 数字 | M3: 数字 | N3: 数字
A6: 职位 | B6: 解散工会 | C6: 审核入会 | D6: 退出工会 | E6: 转移会长 | F6: 任命副会长 | G6: 踢人 | H6: 发布内部消息 | I6: 发布宣言 | J6: 可被罢免 | K6: 可被弹劾 | L6: 能不能点技能 | M6: 能不重置副本 | N6: 能不能宣战
A7: 1 | B7: 1 | C7: 1 | D7: 0 | E7: 1 | F7: 1 | G7: 1 | H7: 1 | I7: 1 | J7: 0 | K7: 1 | L7: 1 | M7: 1 | N7: 1
A8: 2 | B8: 0 | C8: 1 | D8: 1 | E8: 0 | F8: 0 | G8: 1 | H8: 1 | I8: 1 | J8: 1 | K8: 0 | L8: 1 | M8: 1 | N8: 1
A9: 3 | B9: 0 | C9: 0 | D9: 1 | E9: 0 | F9: 0 | G9: 0 | H9: 0 | I9: 0 | J9: 0 | K9: 0 | L9: 0 | M9: 0 | N9: 0

Sheet: 捐献配置
A1: type|type | B1: name| | C1: cost_type_list|cost_type_list | D1: cost_value_list|cost_value_list | E1: need_vip_level|need_vip_level | F1: crit_rate|crit_rate | G1: exp|exp | H1: crit_exp|crit_exp | I1: contribution|contribution | J1: crit_contribution|crit_contribution | K1: qs|qs
A2: 不可空 | B2: 不可空 | C2: 可空#不需字段 | D2: 可空#不需字段 | E2: 不可空 | F2: 不可空 | G2: 不可空 | H2: 不可空 | I2: 不可空 | J2: 不可空 | K2: 不可空
A3: 数字 | B3: 字符串 | C3: 一维数组 | D3: 一维数组 | E3: 数字 | F3: 数字 | G3: 数字 | H3: 数字 | I3: 数字 | J3: 数字 | K3: 数字
C4: 不定长 | D4: 不定长
A6: 泉涌类型 | B6: 操作名称 | C6: 消耗类型列表 | D6: 消耗值列表 | E6: 需要的VIP等级 | F6: 暴击值 | G6: 获得经验 | H6: 获得暴击经验 | I6: 获得贡献值 | J6: 获得暴击贡献值 | K6: 获得的泉水值
A7: 1 | B7: 初级建设 | C7: 3 | D7: 3000 | E7: 0 | F7: 45 | G7: 10 | H7: 15 | I7: 100 | J7: 150 | K7: 1
A8: 2 | B8: 中级建设 | C8: 5 | D8: 30 | E8: 0 | F8: 450 | G8: 50 | H8: 75 | I8: 500 | J8: 750 | K8: 3
A9: 3 | B9: 高级建设 | C9: 5 | D9: 288 | E9: 1 | F9: 4500 | G9: 300 | H9: 450 | I9: 3000 | J9: 4500 | K9: 5

Sheet: 捐献奖励
A1: qs|qs | B1: guild_level|guild_level | C1: item_id_list|item_id_list | D1: item_num_list|item_num_list
A2: 不可空 | B2: 不可空 | C2: 不可空 | D2: 不可空
A3: 数字 | B3: 数字 | C3: 一维数组 | D3: 一维数组
C4: 不定长 | D4: 不定长
A6: 泉水 | B6: 工会等级 | C6: 奖励物品ID列表 | D6: 奖励物品数量列表
A7: 30 | B7: 1 | C7: 19020 | D7: =RC[-2]*50+100 -> 150
A8: 30 | B8: 2 | C8: 19020 | D8: =RC[-2]*50+100 -> 200
A9: 30 | B9: 3 | C9: 19020 | D9: =RC[-2]*50+100 -> 250
A10: 30 | B10: 4 | C10: 19020 | D10: =RC[-2]*50+100 -> 300
A11: 30 | B11: 5 | C11: 19020 | D11: =RC[-2]*50+100 -> 350
A12: 30 | B12: 6 | C12: 19020 | D12: =RC[-2]*50+100 -> 400
A13: 30 | B13: 7 | C13: 19020 | D13: =RC[-2]*50+100 -> 450
A14: 30 | B14: 8 | C14: 19020 | D14: =RC[-2]*50+100 -> 500
A15: 30 | B15: 9 | C15: 19020 | D15: =RC[-2]*50+100 -> 550
A16: 30 | B16: 10 | C16: 19020 | D16: =RC[-2]*50+100 -> 600
A17: 60 | B17: 1 | C17: 19003 | D17: =RC[-2]*10000+50000 -> 60000
A18: 60 | B18: 2 | C18: 19003 | D18: =RC[-2]*10000+50000 -> 70000
A19: 60 | B19: 3 | C19: 19003 | D19: =RC[-2]*10000+50000 -> 80000
A20: 60 | B20: 4 | C20: 19003 | D20: =RC[-2]*10000+50000 -> 90000
A21: 60 | B21: 5 | C21: 19003 | D21: =RC[-2]*10000+50000 -> 100000
A22: 60 | B22: 6 | C22: 19003 | D22: =RC[-2]*10000+50000 -> 110000
A23: 60 | B23: 7 | C23: 19003 | D23: =RC[-2]*10000+50000 -> 120000
A24: 60 | B24: 8 | C24: 19003 | D24: =RC[-2]*10000+50000 -> 130000
A25: 60 | B25: 9 | C25: 19003 | D25: =RC[-2]*10000+50000 -> 140000
A26: 60 | B26: 10 | C26: 19003 | D26: =RC[-2]*10000+50000 -> 150000
A27: 90 | B27: 1 | C27: 19005 | D27: =RC[-2]*10+50 -> 60
A28: 90 | B28: 2 | C28: 19005 | D28: =RC[-2]*10+50 -> 70
A29: 90 | B29: 3 | C29: 19005 | D29: =RC[-2]*10+50 -> 80
A30: 90 | B30: 4 | C30: 19005 | D30: =RC[-2]*10+50 -> 90
A31: 90 | B31: 5 | C31: 19005 | D31: =RC[-2]*10+50 -> 100
A32: 90 | B32: 6 | C32: 19005 | D32: =RC[-2]*10+50 -> 110
A33: 90 | B33: 7 | C33: 19005 | D33: =RC[-2]*10+50 -> 120
A34: 90 | B34: 8 | C34: 19005 | D34: =RC[-2]*10+50 -> 130
A35: 90 | B35: 9 | C35: 19005 | D35: =RC[-2]*10+50 -> 140
A36: 90 | B36: 10 | C36: 19005 | D36: =RC[-2]*10+50 -> 150
A37: 120 | B37: 1 | C37: 19020 | D37: =RC[-2]*100+200 -> 300
A38: 120 | B38: 2 | C38: 19020 | D38: =RC[-2]*100+200 -> 400
A39: 120 | B39: 3 | C39: 19020 | D39: =RC[-2]*100+200 -> 500
A40: 120 | B40: 4 | C40: 19020 | D40: =RC[-2]*100+200 -> 600
A41: 120 | B41: 5 | C41: 19020 | D41: =RC[-2]*100+200 -> 700
A42: 120 | B42: 6 | C42: 19020 | D42: =RC[-2]*100+200 -> 800
A43: 120 | B43: 7 | C43: 19020 | D43: =RC[-2]*100+200 -> 900
A44: 120 | B44: 8 | C44: 19020 | D44: =RC[-2]*100+200 -> 1000
A45: 120 | B45: 9 | C45: 19020 | D45: =RC[-2]*100+200 -> 1100
A46: 120 | B46: 10 | C46: 19020 | D46: =RC[-2]*100+200 -> 1200

Sheet: 军团事件
A1: id|id | B1: desc|desc
A2: 不可空 | B2: 不可空
A3: 数字 | B3: 字符串
A6: 事件ID | B6: 事件描述
A7: 1 | B7: <COLOR VALUE=FFC4641A>%s</COLOR>加入了军团。
A8: 2 | B8: <COLOR VALUE=FFC4641A>%s</COLOR>退出了军团。
A9: 3 | B9: <COLOR VALUE=FFC4641A>%s</COLOR>被请离了军团。
A10: 4 | B10: <COLOR VALUE=FFC4641A>%s</COLOR>进行了一次低级建设，为军团增加了<COLOR VALUE=FF28871e>%s</COLOR>经验。
A11: 5 | B11: <COLOR VALUE=FFC4641A>%s</COLOR>进行了一次中级建设，为军团增加了<COLOR VALUE=FF28871e>%s</COLOR>经验。
A12: 6 | B12: <COLOR VALUE=FFC4641A>%s</COLOR>进行了一次高级建设，为军团增加了<COLOR VALUE=FF28871e>%s</COLOR>经验，欢迎次日再来。
A13: 7 | B13: 前任军团长将军团长之位转让给了<COLOR VALUE=FFC4641A>%s</COLOR>。
A14: 8 | B14: <COLOR VALUE=FFC4641A>%s</COLOR>被任命为军团副团长。
A15: 9 | B15: <COLOR VALUE=FFC4641A>%s</COLOR>被撤销了军团副团长的职位。
A16: 10 | B16: <COLOR VALUE=FFC4641A>%s</COLOR>对军团长发起了弹劾。（如果一天内军团长还未上线，职位将转交给<COLOR VALUE=FFC4641A>%s</COLOR>）
A17: 11 | B17: 全军团齐心协力，击败了<COLOR VALUE=FFC4641A>%s</COLOR>，为军团增加了<COLOR VALUE=FF28871e>%s</COLOR>经验。

Sheet: 军团技能
A1: id|id | B1: name| | C1: icon| | D1: level|level | E1: need_guild_level|need_guild_level | F1: cost_guild_exp|cost_guild_exp | G1: cost_type_list|cost_type_list | H1: cost_value_list|cost_value_list | I1: add_pro_type|add_pro_type | J1: add_pro_value|add_pro_value
A2: 不可空 | B2: 不可空 | C2: 不可空 | D2: 不可空 | E2: 不可空 | F2: 不可空 | G2: 可空#不需字段 | H2: 可空#不需字段 | I2: 可空#不需字段 | J2: 可空#不需字段
A3: 数字 | B3: 字符串 | C3: 数字 | D3: 数字 | E3: 数字 | F3: 数字 | G3: 一维数组 | H3: 一维数组 | I3: 一维数组 | J3: 一维数组
G4: 不定长 | H4: 不定长 | I4: 不定长 | J4: 不定长
A6: 技能ID | B6: 技能名字 | C6: 技能图标 | D6: 技能等级 | E6: 需要公会等级(管理) | F6: 开启消耗公会经验(管理) | G6: 升级消耗类型 | H6: 升级消耗值 | I6: 增加属性类型 | J6: 增加属性值
A7: 1 | B7: 攻击强化 | C7: 1001 | D7: 1 | E7: 1 | F7: 1100 | G7: 20 | H7: 1100 | I7: 1 | J7: 30
A8: 1 | B8: 攻击强化 | C8: 1001 | D8: 2 | E8: 1 | F8: 1200 | G8: 20 | H8: 1200 | I8: 1 | J8: 60
A9: 1 | B9: 攻击强化 | C9: 1001 | D9: 3 | E9: 1 | F9: 1300 | G9: 20 | H9: 1300 | I9: 1 | J9: 90
A10: 1 | B10: 攻击强化 | C10: 1001 | D10: 4 | E10: 1 | F10: 1400 | G10: 20 | H10: 1400 | I10: 1 | J10: 120
A11: 1 | B11: 攻击强化 | C11: 1001 | D11: 5 | E11: 1 | F11: 1500 | G11: 20 | H11: 1500 | I11: 1 | J11: 150
A12: 1 | B12: 攻击强化 | C12: 1001 | D12: 6 | E12: 1 | F12: 1600 | G12: 20 | H12: 1600 | I12: 1 | J12: 180
A13: 1 | B13: 攻击强化 | C13: 1001 | D13: 7 | E13: 1 | F13: 1700 | G13: 20 | H13: 1700 | I13: 1 | J13: 210
A14: 1 | B14: 攻击强化 | C14: 1001 | D14: 8 | E14: 1 | F14: 1800 | G14: 20 | H14: 1800 | I14: 1 | J14: 240
A15: 1 | B15: 攻击强化 | C15: 1001 | D15: 9 | E15: 1 | F15: 1900 | G15: 20 | H15: 1900 | I15: 1 | J15: 270
A16: 1 | B16: 攻击强化 | C16: 1001 | D16: 10 | E16: 1 | F16: 2000 | G16: 20 | H16: 2000 | I16: 1 | J16: 300
A17: 1 | B17: 攻击强化 | C17: 1001 | D17: 11 | E17: =R[-10]C+1 -> 2 | F17: 2100 | G17: 20 | H17: 2100 | I17: 1 | J17: 330
A18: 1 | B18: 攻击强化 | C18: 1001 | D18: 12 | E18: =R[-10]C+1 -> 2 | F18: 2200 | G18: 20 | H18: 2200 | I18: 1 | J18: 360
A19: 1 | B19: 攻击强化 | C19: 1001 | D19: 13 | E19: =R[-10]C+1 -> 2 | F19: 2300 | G19: 20 | H19: 2300 | I19: 1 | J19: 390
A20: 1 | B20: 攻击强化 | C20: 1001 | D20: 14 | E20: =R[-10]C+1 -> 2 | F20: 2400 | G20: 20 | H20: 2400 | I20: 1 | J20: 420
A21: 1 | B21: 攻击强化 | C21: 1001 | D21: 15 | E21: =R[-10]C+1 -> 2 | F21: 2500 | G21: 20 | H21: 2500 | I21: 1 | J21: 450
A22: 1 | B22: 攻击强化 | C22: 1001 | D22: 16 | E22: =R[-10]C+1 -> 2 | F22: 2600 | G22: 20 | H22: 2600 | I22: 1 | J22: 480
A23: 1 | B23: 攻击强化 | C23: 1001 | D23: 17 | E23: =R[-10]C+1 -> 2 | F23: 2700 | G23: 20 | H23: 2700 | I23: 1 | J23: 510
A24: 1 | B24: 攻击强化 | C24: 1001 | D24: 18 | E24: =R[-10]C+1 -> 2 | F24: 2800 | G24: 20 | H24: 2800 | I24: 1 | J24: 540
A25: 1 | B25: 攻击强化 | C25: 1001 | D25: 19 | E25: =R[-10]C+1 -> 2 | F25: 2900 | G25: 20 | H25: 2900 | I25: 1 | J25: 570
A26: 1 | B26: 攻击强化 | C26: 1001 | D26: 20 | E26: =R[-10]C+1 -> 2 | F26: 3000 | G26: 20 | H26: 3000 | I26: 1 | J26: 600
A27: 1 | B27: 攻击强化 | C27: 1001 | D27: 21 | E27: =R[-10]C+1 -> 3 | F27: 3100 | G27: 20 | H27: 3100 | I27: 1 | J27: 630
A28: 1 | B28: 攻击强化 | C28: 1001 | D28: 22 | E28: =R[-10]C+1 -> 3 | F28: 3200 | G28: 20 | H28: 3200 | I28: 1 | J28: 660
A29: 1 | B29: 攻击强化 | C29: 1001 | D29: 23 | E29: =R[-10]C+1 -> 3 | F29: 3300 | G29: 20 | H29: 3300 | I29: 1 | J29: 690
A30: 1 | B30: 攻击强化 | C30: 1001 | D30: 24 | E30: =R[-10]C+1 -> 3 | F30: 3400 | G30: 20 | H30: 3400 | I30: 1 | J30: 720
A31: 1 | B31: 攻击强化 | C31: 1001 | D31: 25 | E31: =R[-10]C+1 -> 3 | F31: 3500 | G31: 20 | H31: 3500 | I31: 1 | J31: 750
A32: 1 | B32: 攻击强化 | C32: 1001 | D32: 26 | E32: =R[-10]C+1 -> 3 | F32: 3600 | G32: 20 | H32: 3600 | I32: 1 | J32: 780
A33: 1 | B33: 攻击强化 | C33: 1001 | D33: 27 | E33: =R[-10]C+1 -> 3 | F33: 3700 | G33: 20 | H33: 3700 | I33: 1 | J33: 810
A34: 1 | B34: 攻击强化 | C34: 1001 | D34: 28 | E34: =R[-10]C+1 -> 3 | F34: 3800 | G34: 20 | H34: 3800 | I34: 1 | J34: 840
A35: 1 | B35: 攻击强化 | C35: 1001 | D35: 29 | E35: =R[-10]C+1 -> 3 | F35: 3900 | G35: 20 | H35: 3900 | I35: 1 | J35: 870
A36: 1 | B36: 攻击强化 | C36: 1001 | D36: 30 | E36: =R[-10]C+1 -> 3 | F36: 4000 | G36: 20 | H36: 4000 | I36: 1 | J36: 900
A37: 1 | B37: 攻击强化 | C37: 1001 | D37: 31 | E37: =R[-10]C+1 -> 4 | F37: 4100 | G37: 20 | H37: 4100 | I37: 1 | J37: 930
A38: 1 | B38: 攻击强化 | C38: 1001 | D38: 32 | E38: =R[-10]C+1 -> 4 | F38: 4200 | G38: 20 | H38: 4200 | I38: 1 | J38: 960
A39: 1 | B39: 攻击强化 | C39: 1001 | D39: 33 | E39: =R[-10]C+1 -> 4 | F39: 4300 | G39: 20 | H39: 4300 | I39: 1 | J39: 990
A40: 1 | B40: 攻击强化 | C40: 1001 | D40: 34 | E40: =R[-10]C+1 -> 4 | F40: 4400 | G40: 20 | H40: 4400 | I40: 1 | J40: 1020
A41: 1 | B41: 攻击强化 | C41: 1001 | D41: 35 | E41: =R[-10]C+1 -> 4 | F41: 4500 | G41: 20 | H41: 4500 | I41: 1 | J41: 1050
A42: 1 | B42: 攻击强化 | C42: 1001 | D42: 36 | E42: =R[-10]C+1 -> 4 | F42: 4600 | G42: 20 | H42: 4600 | I42: 1 | J42: 1080
A43: 1 | B43: 攻击强化 | C43: 1001 | D43: 37 | E43: =R[-10]C+1 -> 4 | F43: 4700 | G43: 20 | H43: 4700 | I43: 1 | J43: 1110
A44: 1 | B44: 攻击强化 | C44: 1001 | D44: 38 | E44: =R[-10]C+1 -> 4 | F44: 4800 | G44: 20 | H44: 4800 | I44: 1 | J44: 1140
A45: 1 | B45: 攻击强化 | C45: 1001 | D45: 39 | E45: =R[-10]C+1 -> 4 | F45: 4900 | G45: 20 | H45: 4900 | I45: 1 | J45: 1170
A46: 1 | B46: 攻击强化 | C46: 1001 | D46: 40 | E46: =R[-10]C+1 -> 4 | F46: 5000 | G46: 20 | H46: 5000 | I46: 1 | J46: 1200
A47: 1 | B47: 攻击强化 | C47: 1001 | D47: 41 | E47: =R[-10]C+1 -> 5 | F47: 5100 | G47: 20 | H47: 5100 | I47: 1 | J47: 1230
A48: 1 | B48: 攻击强化 | C48: 1001 | D48: 42 | E48: =R[-10]C+1 -> 5 | F48: 5200 | G48: 20 | H48: 5200 | I48: 1 | J48: 1260
A49: 1 | B49: 攻击强化 | C49: 1001 | D49: 43 | E49: =R[-10]C+1 -> 5 | F49: 5300 | G49: 20 | H49: 5300 | I49: 1 | J49: 1290
A50: 1 | B50: 攻击强化 | C50: 1001 | D50: 44 | E50: =R[-10]C+1 -> 5 | F50: 5400 | G50: 20 | H50: 5400 | I50: 1 | J50: 1320
A51: 1 | B51: 攻击强化 | C51: 1001 | D51: 45 | E51: =R[-10]C+1 -> 5 | F51: 5500 | G51: 20 | H51: 5500 | I51: 1 | J51: 1350
A52: 1 | B52: 攻击强化 | C52: 1001 | D52: 46 | E52: =R[-10]C+1 -> 5 | F52: 5600 | G52: 20 | H52: 5600 | I52: 1 | J52: 1380
A53: 1 | B53: 攻击强化 | C53: 1001 | D53: 47 | E53: =R[-10]C+1 -> 5 | F53: 5700 | G53: 20 | H53: 5700 | I53: 1 | J53: 1410
A54: 1 | B54: 攻击强化 | C54: 1001 | D54: 48 | E54: =R[-10]C+1 -> 5 | F54: 5800 | G54: 20 | H54: 5800 | I54: 1 | J54: 1440
A55: 1 | B55: 攻击强化 | C55: 1001 | D55: 49 | E55: =R[-10]C+1 -> 5 | F55: 5900 | G55: 20 | H55: 5900 | I55: 1 | J55: 1470
A56: 1 | B56: 攻击强化 | C56: 1001 | D56: 50 | E56: =R[-10]C+1 -> 5 | F56: 6000 | G56: 20 | H56: 6000 | I56: 1 | J56: 1500
A57: 1 | B57: 攻击强化 | C57: 1001 | D57: 51 | E57: =R[-10]C+1 -> 6 | F57: 6100 | G57: 20 | H57: 6100 | I57: 1 | J57: 1530
A58: 1 | B58: 攻击强化 | C58: 1001 | D58: 52 | E58: =R[-10]C+1 -> 6 | F58: 6200 | G58: 20 | H58: 6200 | I58: 1 | J58: 1560
A59: 1 | B59: 攻击强化 | C59: 1001 | D59: 53 | E59: =R[-10]C+1 -> 6 | F59: 6300 | G59: 20 | H59: 6300 | I59: 1 | J59: 1590
A60: 1 | B60: 攻击强化 | C60: 1001 | D60: 54 | E60: =R[-10]C+1 -> 6 | F60: 6400 | G60: 20 | H60: 6400 | I60: 1 | J60: 1620
A61: 1 | B61: 攻击强化 | C61: 1001 | D61: 55 | E61: =R[-10]C+1 -> 6 | F61: 6500 | G61: 20 | H61: 6500 | I61: 1 | J61: 1650
A62: 1 | B62: 攻击强化 | C62: 1001 | D62: 56 | E62: =R[-10]C+1 -> 6 | F62: 6600 | G62: 20 | H62: 6600 | I62: 1 | J62: 1680
A63: 1 | B63: 攻击强化 | C63: 1001 | D63: 57 | E63: =R[-10]C+1 -> 6 | F63: 6700 | G63: 20 | H63: 6700 | I63: 1 | J63: 1710
A64: 1 | B64: 攻击强化 | C64: 1001 | D64: 58 | E64: =R[-10]C+1 -> 6 | F64: 6800 | G64: 20 | H64: 6800 | I64: 1 | J64: 1740
A65: 1 | B65: 攻击强化 | C65: 1001 | D65: 59 | E65: =R[-10]C+1 -> 6 | F65: 6900 | G65: 20 | H65: 6900 | I65: 1 | J65: 1770
A66: 1 | B66: 攻击强化 | C66: 1001 | D66: 60 | E66: =R[-10]C+1 -> 6 | F66: 7000 | G66: 20 | H66: 7000 | I66: 1 | J66: 1800
A67: 1 | B67: 攻击强化 | C67: 1001 | D67: 61 | E67: =R[-10]C+1 -> 7 | F67: 7100 | G67: 20 | H67: 7100 | I67: 1 | J67: 1830
A68: 1 | B68: 攻击强化 | C68: 1001 | D68: 62 | E68: =R[-10]C+1 -> 7 | F68: 7200 | G68: 20 | H68: 7200 | I68: 1 | J68: 1860
A69: 1 | B69: 攻击强化 | C69: 1001 | D69: 63 | E69: =R[-10]C+1 -> 7 | F69: 7300 | G69: 20 | H69: 7300 | I69: 1 | J69: 1890
A70: 1 | B70: 攻击强化 | C70: 1001 | D70: 64 | E70: =R[-10]C+1 -> 7 | F70: 7400 | G70: 20 | H70: 7400 | I70: 1 | J70: 1920
A71: 1 | B71: 攻击强化 | C71: 1001 | D71: 65 | E71: =R[-10]C+1 -> 7 | F71: 7500 | G71: 20 | H71: 7500 | I71: 1 | J71: 1950
A72: 1 | B72: 攻击强化 | C72: 1001 | D72: 66 | E72: =R[-10]C+1 -> 7 | F72: 7600 | G72: 20 | H72: 7600 | I72: 1 | J72: 1980
A73: 1 | B73: 攻击强化 | C73: 1001 | D73: 67 | E73: =R[-10]C+1 -> 7 | F73: 7700 | G73: 20 | H73: 7700 | I73: 1 | J73: 2010
A74: 1 | B74: 攻击强化 | C74: 1001 | D74: 68 | E74: =R[-10]C+1 -> 7 | F74: 7800 | G74: 20 | H74: 7800 | I74: 1 | J74: 2040
A75: 1 | B75: 攻击强化 | C75: 1001 | D75: 69 | E75: =R[-10]C+1 -> 7 | F75: 7900 | G75: 20 | H75: 7900 | I75: 1 | J75: 2070
A76: 1 | B76: 攻击强化 | C76: 1001 | D76: 70 | E76: =R[-10]C+1 -> 7 | F76: 8000 | G76: 20 | H76: 8000 | I76: 1 | J76: 2100
A77: 1 | B77: 攻击强化 | C77: 1001 | D77: 71 | E77: =R[-10]C+1 -> 8 | F77: 8100 | G77: 20 | H77: 8100 | I77: 1 | J77: 2130
A78: 1 | B78: 攻击强化 | C78: 1001 | D78: 72 | E78: =R[-10]C+1 -> 8 | F78: 8200 | G78: 20 | H78: 8200 | I78: 1 | J78: 2160
A79: 1 | B79: 攻击强化 | C79: 1001 | D79: 73 | E79: =R[-10]C+1 -> 8 | F79: 8300 | G79: 20 | H79: 8300 | I79: 1 | J79: 2190
A80: 1 | B80: 攻击强化 | C80: 1001 | D80: 74 | E80: =R[-10]C+1 -> 8 | F80: 8400 | G80: 20 | H80: 8400 | I80: 1 | J80: 2220
A81: 1 | B81: 攻击强化 | C81: 1001 | D81: 75 | E81: =R[-10]C+1 -> 8 | F81: 8500 | G81: 20 | H81: 8500 | I81: 1 | J81: 2250
A82: 1 | B82: 攻击强化 | C82: 1001 | D82: 76 | E82: =R[-10]C+1 -> 8 | F82: 8600 | G82: 20 | H82: 8600 | I82: 1 | J82: 2280
A83: 1 | B83: 攻击强化 | C83: 1001 | D83: 77 | E83: =R[-10]C+1 -> 8 | F83: 8700 | G83: 20 | H83: 8700 | I83: 1 | J83: 2310
A84: 1 | B84: 攻击强化 | C84: 1001 | D84: 78 | E84: =R[-10]C+1 -> 8 | F84: 8800 | G84: 20 | H84: 8800 | I84: 1 | J84: 2340
A85: 1 | B85: 攻击强化 | C85: 1001 | D85: 79 | E85: =R[-10]C+1 -> 8 | F85: 8900 | G85: 20 | H85: 8900 | I85: 1 | J85: 2370
A86: 1 | B86: 攻击强化 | C86: 1001 | D86: 80 | E86: =R[-10]C+1 -> 8 | F86: 9000 | G86: 20 | H86: 9000 | I86: 1 | J86: 2400
A87: 1 | B87: 攻击强化 | C87: 1001 | D87: 81 | E87: =R[-10]C+1 -> 9 | F87: 9100 | G87: 20 | H87: 9100 | I87: 1 | J87: 2430
A88: 1 | B88: 攻击强化 | C88: 1001 | D88: 82 | E88: =R[-10]C+1 -> 9 | F88: 9200 | G88: 20 | H88: 9200 | I88: 1 | J88: 2460
A89: 1 | B89: 攻击强化 | C89: 1001 | D89: 83 | E89: =R[-10]C+1 -> 9 | F89: 9300 | G89: 20 | H89: 9300 | I89: 1 | J89: 2490
A90: 1 | B90: 攻击强化 | C90: 1001 | D90: 84 | E90: =R[-10]C+1 -> 9 | F90: 9400 | G90: 20 | H90: 9400 | I90: 1 | J90: 2520
A91: 1 | B91: 攻击强化 | C91: 1001 | D91: 85 | E91: =R[-10]C+1 -> 9 | F91: 9500 | G91: 20 | H91: 9500 | I91: 1 | J91: 2550
A92: 1 | B92: 攻击强化 | C92: 1001 | D92: 86 | E92: =R[-10]C+1 -> 9 | F92: 9600 | G92: 20 | H92: 9600 | I92: 1 | J92: 2580
A93: 1 | B93: 攻击强化 | C93: 1001 | D93: 87 | E93: =R[-10]C+1 -> 9 | F93: 9700 | G93: 20 | H93: 9700 | I93: 1 | J93: 2610
A94: 1 | B94: 攻击强化 | C94: 1001 | D94: 88 | E94: =R[-10]C+1 -> 9 | F94: 9800 | G94: 20 | H94: 9800 | I94: 1 | J94: 2640
A95: 1 | B95: 攻击强化 | C95: 1001 | D95: 89 | E95: =R[-10]C+1 -> 9 | F95: 9900 | G95: 20 | H95: 9900 | I95: 1 | J95: 2670
A96: 1 | B96: 攻击强化 | C96: 1001 | D96: 90 | E96: =R[-10]C+1 -> 9 | F96: 10000 | G96: 20 | H96: 10000 | I96: 1 | J96: 2700
A97: 1 | B97: 攻击强化 | C97: 1001 | D97: 91 | E97: =R[-10]C+1 -> 10 | F97: 10100 | G97: 20 | H97: 10100 | I97: 1 | J97: 2730
A98: 1 | B98: 攻击强化 | C98: 1001 | D98: 92 | E98: =R[-10]C+1 -> 10 | F98: 10200 | G98: 20 | H98: 10200 | I98: 1 | J98: 2760
A99: 1 | B99: 攻击强化 | C99: 1001 | D99: 93 | E99: =R[-10]C+1 -> 10 | F99: 10300 | G99: 20 | H99: 10300 | I99: 1 | J99: 2790
A100: 1 | B100: 攻击强化 | C100: 1001 | D100: 94 | E100: =R[-10]C+1 -> 10 | F100: 10400 | G100: 20 | H100: 10400 | I100: 1 | J100: 2820
A101: 1 | B101: 攻击强化 | C101: 1001 | D101: 95 | E101: =R[-10]C+1 -> 10 | F101: 10500 | G101: 20 | H101: 10500 | I101: 1 | J101: 2850
A102: 1 | B102: 攻击强化 | C102: 1001 | D102: 96 | E102: =R[-10]C+1 -> 10 | F102: 10600 | G102: 20 | H102: 10600 | I102: 1 | J102: 2880
A103: 1 | B103: 攻击强化 | C103: 1001 | D103: 97 | E103: =R[-10]C+1 -> 10 | F103: 10700 | G103: 20 | H103: 10700 | I103: 1 | J103: 2910
A104: 1 | B104: 攻击强化 | C104: 1001 | D104: 98 | E104: =R[-10]C+1 -> 10 | F104: 10800 | G104: 20 | H104: 10800 | I104: 1 | J104: 2940
A105: 1 | B105: 攻击强化 | C105: 1001 | D105: 99 | E105: =R[-10]C+1 -> 10 | F105: 10900 | G105: 20 | H105: 10900 | I105: 1 | J105: 2970
A106: 1 | B106: 攻击强化 | C106: 1001 | D106: 100 | E106: =R[-10]C+1 -> 10 | F106: 11000 | G106: 20 | H106: 11000 | I106: 1 | J106: 3000
A107: 2 | B107: 物防强化 | C107: 1002 | D107: =R[-100]C -> 1 | E107: =R[-100]C -> 1 | F107: 1100 | G107: 20 | H107: 1100 | I107: =R[-100]C+1 -> 2 | J107: 30
A108: 2 | B108: 物防强化 | C108: 1002 | D108: =R[-100]C -> 2 | E108: =R[-100]C -> 1 | F108: 1200 | G108: 20 | H108: 1200 | I108: =R[-100]C+1 -> 2 | J108: 60
A109: 2 | B109: 物防强化 | C109: 1002 | D109: =R[-100]C -> 3 | E109: =R[-100]C -> 1 | F109: 1300 | G109: 20 | H109: 1300 | I109: =R[-100]C+1 -> 2 | J109: 90
A110: 2 | B110: 物防强化 | C110: 1002 | D110: =R[-100]C -> 4 | E110: =R[-100]C -> 1 | F110: 1400 | G110: 20 | H110: 1400 | I110: =R[-100]C+1 -> 2 | J110: 120
A111: 2 | B111: 物防强化 | C111: 1002 | D111: =R[-100]C -> 5 | E111: =R[-100]C -> 1 | F111: 1500 | G111: 20 | H111: 1500 | I111: =R[-100]C+1 -> 2 | J111: 150
A112: 2 | B112: 物防强化 | C112: 1002 | D112: =R[-100]C -> 6 | E112: =R[-100]C -> 1 | F112: 1600 | G112: 20 | H112: 1600 | I112: =R[-100]C+1 -> 2 | J112: 180
A113: 2 | B113: 物防强化 | C113: 1002 | D113: =R[-100]C -> 7 | E113: =R[-100]C -> 1 | F113: 1700 | G113: 20 | H113: 1700 | I113: =R[-100]C+1 -> 2 | J113: 210
A114: 2 | B114: 物防强化 | C114: 1002 | D114: =R[-100]C -> 8 | E114: =R[-100]C -> 1 | F114: 1800 | G114: 20 | H114: 1800 | I114: =R[-100]C+1 -> 2 | J114: 240
A115: 2 | B115: 物防强化 | C115: 1002 | D115: =R[-100]C -> 9 | E115: =R[-100]C -> 1 | F115: 1900 | G115: 20 | H115: 1900 | I115: =R[-100]C+1 -> 2 | J115: 270
A116: 2 | B116: 物防强化 | C116: 1002 | D116: =R[-100]C -> 10 | E116: =R[-100]C -> 1 | F116: 2000 | G116: 20 | H116: 2000 | I116: =R[-100]C+1 -> 2 | J116: 300
A117: 2 | B117: 物防强化 | C117: 1002 | D117: =R[-100]C -> 11 | E117: =R[-100]C -> 2 | F117: 2100 | G117: 20 | H117: 2100 | I117: =R[-100]C+1 -> 2 | J117: 330
A118: 2 | B118: 物防强化 | C118: 1002 | D118: =R[-100]C -> 12 | E118: =R[-100]C -> 2 | F118: 2200 | G118: 20 | H118: 2200 | I118: =R[-100]C+1 -> 2 | J118: 360
A119: 2 | B119: 物防强化 | C119: 1002 | D119: =R[-100]C -> 13 | E119: =R[-100]C -> 2 | F119: 2300 | G119: 20 | H119: 2300 | I119: =R[-100]C+1 -> 2 | J119: 390
A120: 2 | B120: 物防强化 | C120: 1002 | D120: =R[-100]C -> 14 | E120: =R[-100]C -> 2 | F120: 2400 | G120: 20 | H120: 2400 | I120: =R[-100]C+1 -> 2 | J120: 420
A121: 2 | B121: 物防强化 | C121: 1002 | D121: =R[-100]C -> 15 | E121: =R[-100]C -> 2 | F121: 2500 | G121: 20 | H121: 2500 | I121: =R[-100]C+1 -> 2 | J121: 450
A122: 2 | B122: 物防强化 | C122: 1002 | D122: =R[-100]C -> 16 | E122: =R[-100]C -> 2 | F122: 2600 | G122: 20 | H122: 2600 | I122: =R[-100]C+1 -> 2 | J122: 480
A123: 2 | B123: 物防强化 | C123: 1002 | D123: =R[-100]C -> 17 | E123: =R[-100]C -> 2 | F123: 2700 | G123: 20 | H123: 2700 | I123: =R[-100]C+1 -> 2 | J123: 510
A124: 2 | B124: 物防强化 | C124: 1002 | D124: =R[-100]C -> 18 | E124: =R[-100]C -> 2 | F124: 2800 | G124: 20 | H124: 2800 | I124: =R[-100]C+1 -> 2 | J124: 540
A125: 2 | B125: 物防强化 | C125: 1002 | D125: =R[-100]C -> 19 | E125: =R[-100]C -> 2 | F125: 2900 | G125: 20 | H125: 2900 | I125: =R[-100]C+1 -> 2 | J125: 570
A126: 2 | B126: 物防强化 | C126: 1002 | D126: =R[-100]C -> 20 | E126: =R[-100]C -> 2 | F126: 3000 | G126: 20 | H126: 3000 | I126: =R[-100]C+1 -> 2 | J126: 600
A127: 2 | B127: 物防强化 | C127: 1002 | D127: =R[-100]C -> 21 | E127: =R[-100]C -> 3 | F127: 3100 | G127: 20 | H127: 3100 | I127: =R[-100]C+1 -> 2 | J127: 630
A128: 2 | B128: 物防强化 | C128: 1002 | D128: =R[-100]C -> 22 | E128: =R[-100]C -> 3 | F128: 3200 | G128: 20 | H128: 3200 | I128: =R[-100]C+1 -> 2 | J128: 660
A129: 2 | B129: 物防强化 | C129: 1002 | D129: =R[-100]C -> 23 | E129: =R[-100]C -> 3 | F129: 3300 | G129: 20 | H129: 3300 | I129: =R[-100]C+1 -> 2 | J129: 690
A130: 2 | B130: 物防强化 | C130: 1002 | D130: =R[-100]C -> 24 | E130: =R[-100]C -> 3 | F130: 3400 | G130: 20 | H130: 3400 | I130: =R[-100]C+1 -> 2 | J130: 720
A131: 2 | B131: 物防强化 | C131: 1002 | D131: =R[-100]C -> 25 | E131: =R[-100]C -> 3 | F131: 3500 | G131: 20 | H131: 3500 | I131: =R[-100]C+1 -> 2 | J131: 750
A132: 2 | B132: 物防强化 | C132: 1002 | D132: =R[-100]C -> 26 | E132: =R[-100]C -> 3 | F132: 3600 | G132: 20 | H132: 3600 | I132: =R[-100]C+1 -> 2 | J132: 780
A133: 2 | B133: 物防强化 | C133: 1002 | D133: =R[-100]C -> 27 | E133: =R[-100]C -> 3 | F133: 3700 | G133: 20 | H133: 3700 | I133: =R[-100]C+1 -> 2 | J133: 810
A134: 2 | B134: 物防强化 | C134: 1002 | D134: =R[-100]C -> 28 | E134: =R[-100]C -> 3 | F134: 3800 | G134: 20 | H134: 3800 | I134: =R[-100]C+1 -> 2 | J134: 840
A135: 2 | B135: 物防强化 | C135: 1002 | D135: =R[-100]C -> 29 | E135: =R[-100]C -> 3 | F135: 3900 | G135: 20 | H135: 3900 | I135: =R[-100]C+1 -> 2 | J135: 870
A136: 2 | B136: 物防强化 | C136: 1002 | D136: =R[-100]C -> 30 | E136: =R[-100]C -> 3 | F136: 4000 | G136: 20 | H136: 4000 | I136: =R[-100]C+1 -> 2 | J136: 900
A137: 2 | B137: 物防强化 | C137: 1002 | D137: =R[-100]C -> 31 | E137: =R[-100]C -> 4 | F137: 4100 | G137: 20 | H137: 4100 | I137: =R[-100]C+1 -> 2 | J137: 930
A138: 2 | B138: 物防强化 | C138: 1002 | D138: =R[-100]C -> 32 | E138: =R[-100]C -> 4 | F138: 4200 | G138: 20 | H138: 4200 | I138: =R[-100]C+1 -> 2 | J138: 960
A139: 2 | B139: 物防强化 | C139: 1002 | D139: =R[-100]C -> 33 | E139: =R[-100]C -> 4 | F139: 4300 | G139: 20 | H139: 4300 | I139: =R[-100]C+1 -> 2 | J139: 990
A140: 2 | B140: 物防强化 | C140: 1002 | D140: =R[-100]C -> 34 | E140: =R[-100]C -> 4 | F140: 4400 | G140: 20 | H140: 4400 | I140: =R[-100]C+1 -> 2 | J140: 1020
A141: 2 | B141: 物防强化 | C141: 1002 | D141: =R[-100]C -> 35 | E141: =R[-100]C -> 4 | F141: 4500 | G141: 20 | H141: 4500 | I141: =R[-100]C+1 -> 2 | J141: 1050
A142: 2 | B142: 物防强化 | C142: 1002 | D142: =R[-100]C -> 36 | E142: =R[-100]C -> 4 | F142: 4600 | G142: 20 | H142: 4600 | I142: =R[-100]C+1 -> 2 | J142: 1080
A143: 2 | B143: 物防强化 | C143: 1002 | D143: =R[-100]C -> 37 | E143: =R[-100]C -> 4 | F143: 4700 | G143: 20 | H143: 4700 | I143: =R[-100]C+1 -> 2 | J143: 1110
A144: 2 | B144: 物防强化 | C144: 1002 | D144: =R[-100]C -> 38 | E144: =R[-100]C -> 4 | F144: 4800 | G144: 20 | H144: 4800 | I144: =R[-100]C+1 -> 2 | J144: 1140
A145: 2 | B145: 物防强化 | C145: 1002 | D145: =R[-100]C -> 39 | E145: =R[-100]C -> 4 | F145: 4900 | G145: 20 | H145: 4900 | I145: =R[-100]C+1 -> 2 | J145: 1170
A146: 2 | B146: 物防强化 | C146: 1002 | D146: =R[-100]C -> 40 | E146: =R[-100]C -> 4 | F146: 5000 | G146: 20 | H146: 5000 | I146: =R[-100]C+1 -> 2 | J146: 1200
A147: 2 | B147: 物防强化 | C147: 1002 | D147: =R[-100]C -> 41 | E147: =R[-100]C -> 5 | F147: 5100 | G147: 20 | H147: 5100 | I147: =R[-100]C+1 -> 2 | J147: 1230
A148: 2 | B148: 物防强化 | C148: 1002 | D148: =R[-100]C -> 42 | E148: =R[-100]C -> 5 | F148: 5200 | G148: 20 | H148: 5200 | I148: =R[-100]C+1 -> 2 | J148: 1260
A149: 2 | B149: 物防强化 | C149: 1002 | D149: =R[-100]C -> 43 | E149: =R[-100]C -> 5 | F149: 5300 | G149: 20 | H149: 5300 | I149: =R[-100]C+1 -> 2 | J149: 1290
A150: 2 | B150: 物防强化 | C150: 1002 | D150: =R[-100]C -> 44 | E150: =R[-100]C -> 5 | F150: 5400 | G150: 20 | H150: 5400 | I150: =R[-100]C+1 -> 2 | J150: 1320
A151: 2 | B151: 物防强化 | C151: 1002 | D151: =R[-100]C -> 45 | E151: =R[-100]C -> 5 | F151: 5500 | G151: 20 | H151: 5500 | I151: =R[-100]C+1 -> 2 | J151: 1350
A152: 2 | B152: 物防强化 | C152: 1002 | D152: =R[-100]C -> 46 | E152: =R[-100]C -> 5 | F152: 5600 | G152: 20 | H152: 5600 | I152: =R[-100]C+1 -> 2 | J152: 1380
A153: 2 | B153: 物防强化 | C153: 1002 | D153: =R[-100]C -> 47 | E153: =R[-100]C -> 5 | F153: 5700 | G153: 20 | H153: 5700 | I153: =R[-100]C+1 -> 2 | J153: 1410
A154: 2 | B154: 物防强化 | C154: 1002 | D154: =R[-100]C -> 48 | E154: =R[-100]C -> 5 | F154: 5800 | G154: 20 | H154: 5800 | I154: =R[-100]C+1 -> 2 | J154: 1440
A155: 2 | B155: 物防强化 | C155: 1002 | D155: =R[-100]C -> 49 | E155: =R[-100]C -> 5 | F155: 5900 | G155: 20 | H155: 5900 | I155: =R[-100]C+1 -> 2 | J155: 1470
A156: 2 | B156: 物防强化 | C156: 1002 | D156: =R[-100]C -> 50 | E156: =R[-100]C -> 5 | F156: 6000 | G156: 20 | H156: 6000 | I156: =R[-100]C+1 -> 2 | J156: 1500
A157: 2 | B157: 物防强化 | C157: 1002 | D157: =R[-100]C -> 51 | E157: =R[-100]C -> 6 | F157: 6100 | G157: 20 | H157: 6100 | I157: =R[-100]C+1 -> 2 | J157: 1530
A158: 2 | B158: 物防强化 | C158: 1002 | D158: =R[-100]C -> 52 | E158: =R[-100]C -> 6 | F158: 6200 | G158: 20 | H158: 6200 | I158: =R[-100]C+1 -> 2 | J158: 1560
A159: 2 | B159: 物防强化 | C159: 1002 | D159: =R[-100]C -> 53 | E159: =R[-100]C -> 6 | F159: 6300 | G159: 20 | H159: 6300 | I159: =R[-100]C+1 -> 2 | J159: 1590
A160: 2 | B160: 物防强化 | C160: 1002 | D160: =R[-100]C -> 54 | E160: =R[-100]C -> 6 | F160: 6400 | G160: 20 | H160: 6400 | I160: =R[-100]C+1 -> 2 | J160: 1620
A161: 2 | B161: 物防强化 | C161: 1002 | D161: =R[-100]C -> 55 | E161: =R[-100]C -> 6 | F161: 6500 | G161: 20 | H161: 6500 | I161: =R[-100]C+1 -> 2 | J161: 1650
A162: 2 | B162: 物防强化 | C162: 1002 | D162: =R[-100]C -> 56 | E162: =R[-100]C -> 6 | F162: 6600 | G162: 20 | H162: 6600 | I162: =R[-100]C+1 -> 2 | J162: 1680
A163: 2 | B163: 物防强化 | C163: 1002 | D163: =R[-100]C -> 57 | E163: =R[-100]C -> 6 | F163: 6700 | G163: 20 | H163: 6700 | I163: =R[-100]C+1 -> 2 | J163: 1710
A164: 2 | B164: 物防强化 | C164: 1002 | D164: =R[-100]C -> 58 | E164: =R[-100]C -> 6 | F164: 6800 | G164: 20 | H164: 6800 | I164: =R[-100]C+1 -> 2 | J164: 1740
A165: 2 | B165: 物防强化 | C165: 1002 | D165: =R[-100]C -> 59 | E165: =R[-100]C -> 6 | F165: 6900 | G165: 20 | H165: 6900 | I165: =R[-100]C+1 -> 2 | J165: 1770
A166: 2 | B166: 物防强化 | C166: 1002 | D166: =R[-100]C -> 60 | E166: =R[-100]C -> 6 | F166: 7000 | G166: 20 | H166: 7000 | I166: =R[-100]C+1 -> 2 | J166: 1800
A167: 2 | B167: 物防强化 | C167: 1002 | D167: =R[-100]C -> 61 | E167: =R[-100]C -> 7 | F167: 7100 | G167: 20 | H167: 7100 | I167: =R[-100]C+1 -> 2 | J167: 1830
A168: 2 | B168: 物防强化 | C168: 1002 | D168: =R[-100]C -> 62 | E168: =R[-100]C -> 7 | F168: 7200 | G168: 20 | H168: 7200 | I168: =R[-100]C+1 -> 2 | J168: 1860
A169: 2 | B169: 物防强化 | C169: 1002 | D169: =R[-100]C -> 63 | E169: =R[-100]C -> 7 | F169: 7300 | G169: 20 | H169: 7300 | I169: =R[-100]C+1 -> 2 | J169: 1890
A170: 2 | B170: 物防强化 | C170: 1002 | D170: =R[-100]C -> 64 | E170: =R[-100]C -> 7 | F170: 7400 | G170: 20 | H170: 7400 | I170: =R[-100]C+1 -> 2 | J170: 1920
A171: 2 | B171: 物防强化 | C171: 1002 | D171: =R[-100]C -> 65 | E171: =R[-100]C -> 7 | F171: 7500 | G171: 20 | H171: 7500 | I171: =R[-100]C+1 -> 2 | J171: 1950
A172: 2 | B172: 物防强化 | C172: 1002 | D172: =R[-100]C -> 66 | E172: =R[-100]C -> 7 | F172: 7600 | G172: 20 | H172: 7600 | I172: =R[-100]C+1 -> 2 | J172: 1980
A173: 2 | B173: 物防强化 | C173: 1002 | D173: =R[-100]C -> 67 | E173: =R[-100]C -> 7 | F173: 7700 | G173: 20 | H173: 7700 | I173: =R[-100]C+1 -> 2 | J173: 2010
A174: 2 | B174: 物防强化 | C174: 1002 | D174: =R[-100]C -> 68 | E174: =R[-100]C -> 7 | F174: 7800 | G174: 20 | H174: 7800 | I174: =R[-100]C+1 -> 2 | J174: 2040
A175: 2 | B175: 物防强化 | C175: 1002 | D175: =R[-100]C -> 69 | E175: =R[-100]C -> 7 | F175: 7900 | G175: 20 | H175: 7900 | I175: =R[-100]C+1 -> 2 | J175: 2070
A176: 2 | B176: 物防强化 | C176: 1002 | D176: =R[-100]C -> 70 | E176: =R[-100]C -> 7 | F176: 8000 | G176: 20 | H176: 8000 | I176: =R[-100]C+1 -> 2 | J176: 2100
A177: 2 | B177: 物防强化 | C177: 1002 | D177: =R[-100]C -> 71 | E177: =R[-100]C -> 8 | F177: 8100 | G177: 20 | H177: 8100 | I177: =R[-100]C+1 -> 2 | J177: 2130
A178: 2 | B178: 物防强化 | C178: 1002 | D178: =R[-100]C -> 72 | E178: =R[-100]C -> 8 | F178: 8200 | G178: 20 | H178: 8200 | I178: =R[-100]C+1 -> 2 | J178: 2160
A179: 2 | B179: 物防强化 | C179: 1002 | D179: =R[-100]C -> 73 | E179: =R[-100]C -> 8 | F179: 8300 | G179: 20 | H179: 8300 | I179: =R[-100]C+1 -> 2 | J179: 2190
A180: 2 | B180: 物防强化 | C180: 1002 | D180: =R[-100]C -> 74 | E180: =R[-100]C -> 8 | F180: 8400 | G180: 20 | H180: 8400 | I180: =R[-100]C+1 -> 2 | J180: 2220
A181: 2 | B181: 物防强化 | C181: 1002 | D181: =R[-100]C -> 75 | E181: =R[-100]C -> 8 | F181: 8500 | G181: 20 | H181: 8500 | I181: =R[-100]C+1 -> 2 | J181: 2250
A182: 2 | B182: 物防强化 | C182: 1002 | D182: =R[-100]C -> 76 | E182: =R[-100]C -> 8 | F182: 8600 | G182: 20 | H182: 8600 | I182: =R[-100]C+1 -> 2 | J182: 2280
A183: 2 | B183: 物防强化 | C183: 1002 | D183: =R[-100]C -> 77 | E183: =R[-100]C -> 8 | F183: 8700 | G183: 20 | H183: 8700 | I183: =R[-100]C+1 -> 2 | J183: 2310
A184: 2 | B184: 物防强化 | C184: 1002 | D184: =R[-100]C -> 78 | E184: =R[-100]C -> 8 | F184: 8800 | G184: 20 | H184: 8800 | I184: =R[-100]C+1 -> 2 | J184: 2340
A185: 2 | B185: 物防强化 | C185: 1002 | D185: =R[-100]C -> 79 | E185: =R[-100]C -> 8 | F185: 8900 | G185: 20 | H185: 8900 | I185: =R[-100]C+1 -> 2 | J185: 2370
A186: 2 | B186: 物防强化 | C186: 1002 | D186: =R[-100]C -> 80 | E186: =R[-100]C -> 8 | F186: 9000 | G186: 20 | H186: 9000 | I186: =R[-100]C+1 -> 2 | J186: 2400
A187: 2 | B187: 物防强化 | C187: 1002 | D187: =R[-100]C -> 81 | E187: =R[-100]C -> 9 | F187: 9100 | G187: 20 | H187: 9100 | I187: =R[-100]C+1 -> 2 | J187: 2430
A188: 2 | B188: 物防强化 | C188: 1002 | D188: =R[-100]C -> 82 | E188: =R[-100]C -> 9 | F188: 9200 | G188: 20 | H188: 9200 | I188: =R[-100]C+1 -> 2 | J188: 2460
A189: 2 | B189: 物防强化 | C189: 1002 | D189: =R[-100]C -> 83 | E189: =R[-100]C -> 9 | F189: 9300 | G189: 20 | H189: 9300 | I189: =R[-100]C+1 -> 2 | J189: 2490
A190: 2 | B190: 物防强化 | C190: 1002 | D190: =R[-100]C -> 84 | E190: =R[-100]C -> 9 | F190: 9400 | G190: 20 | H190: 9400 | I190: =R[-100]C+1 -> 2 | J190: 2520
A191: 2 | B191: 物防强化 | C191: 1002 | D191: =R[-100]C -> 85 | E191: =R[-100]C -> 9 | F191: 9500 | G191: 20 | H191: 9500 | I191: =R[-100]C+1 -> 2 | J191: 2550
A192: 2 | B192: 物防强化 | C192: 1002 | D192: =R[-100]C -> 86 | E192: =R[-100]C -> 9 | F192: 9600 | G192: 20 | H192: 9600 | I192: =R[-100]C+1 -> 2 | J192: 2580
A193: 2 | B193: 物防强化 | C193: 1002 | D193: =R[-100]C -> 87 | E193: =R[-100]C -> 9 | F193: 9700 | G193: 20 | H193: 9700 | I193: =R[-100]C+1 -> 2 | J193: 2610
A194: 2 | B194: 物防强化 | C194: 1002 | D194: =R[-100]C -> 88 | E194: =R[-100]C -> 9 | F194: 9800 | G194: 20 | H194: 9800 | I194: =R[-100]C+1 -> 2 | J194: 2640
A195: 2 | B195: 物防强化 | C195: 1002 | D195: =R[-100]C -> 89 | E195: =R[-100]C -> 9 | F195: 9900 | G195: 20 | H195: 9900 | I195: =R[-100]C+1 -> 2 | J195: 2670
A196: 2 | B196: 物防强化 | C196: 1002 | D196: =R[-100]C -> 90 | E196: =R[-100]C -> 9 | F196: 10000 | G196: 20 | H196: 10000 | I196: =R[-100]C+1 -> 2 | J196: 2700
A197: 2 | B197: 物防强化 | C197: 1002 | D197: =R[-100]C -> 91 | E197: =R[-100]C -> 10 | F197: 10100 | G197: 20 | H197: 10100 | I197: =R[-100]C+1 -> 2 | J197: 2730
A198: 2 | B198: 物防强化 | C198: 1002 | D198: =R[-100]C -> 92 | E198: =R[-100]C -> 10 | F198: 10200 | G198: 20 | H198: 10200 | I198: =R[-100]C+1 -> 2 | J198: 2760
A199: 2 | B199: 物防强化 | C199: 1002 | D199: =R[-100]C -> 93 | E199: =R[-100]C -> 10 | F199: 10300 | G199: 20 | H199: 10300 | I199: =R[-100]C+1 -> 2 | J199: 2790
A200: 2 | B200: 物防强化 | C200: 1002 | D200: =R[-100]C -> 94 | E200: =R[-100]C -> 10 | F200: 10400 | G200: 20 | H200: 10400 | I200: =R[-100]C+1 -> 2 | J200: 2820
A201: 2 | B201: 物防强化 | C201: 1002 | D201: =R[-100]C -> 95 | E201: =R[-100]C -> 10 | F201: 10500 | G201: 20 | H201: 10500 | I201: =R[-100]C+1 -> 2 | J201: 2850
A202: 2 | B202: 物防强化 | C202: 1002 | D202: =R[-100]C -> 96 | E202: =R[-100]C -> 10 | F202: 10600 | G202: 20 | H202: 10600 | I202: =R[-100]C+1 -> 2 | J202: 2880
A203: 2 | B203: 物防强化 | C203: 1002 | D203: =R[-100]C -> 97 | E203: =R[-100]C -> 10 | F203: 10700 | G203: 20 | H203: 10700 | I203: =R[-100]C+1 -> 2 | J203: 2910
A204: 2 | B204: 物防强化 | C204: 1002 | D204: =R[-100]C -> 98 | E204: =R[-100]C -> 10 | F204: 10800 | G204: 20 | H204: 10800 | I204: =R[-100]C+1 -> 2 | J204: 2940
A205: 2 | B205: 物防强化 | C205: 1002 | D205: =R[-100]C -> 99 | E205: =R[-100]C -> 10 | F205: 10900 | G205: 20 | H205: 10900 | I205: =R[-100]C+1 -> 2 | J205: 2970
A206: 2 | B206: 物防强化 | C206: 1002 | D206: =R[-100]C -> 100 | E206: =R[-100]C -> 10 | F206: 11000 | G206: 20 | H206: 11000 | I206: =R[-100]C+1 -> 2 | J206: 3000
A207: 3 | B207: 法防强化 | C207: 1003 | D207: =R[-100]C -> 1 | E207: =R[-100]C -> 1 | F207: 1100 | G207: 20 | H207: 1100 | I207: =R[-100]C+1 -> 3 | J207: 30
A208: 3 | B208: 法防强化 | C208: 1003 | D208: =R[-100]C -> 2 | E208: =R[-100]C -> 1 | F208: 1200 | G208: 20 | H208: 1200 | I208: =R[-100]C+1 -> 3 | J208: 60
A209: 3 | B209: 法防强化 | C209: 1003 | D209: =R[-100]C -> 3 | E209: =R[-100]C -> 1 | F209: 1300 | G209: 20 | H209: 1300 | I209: =R[-100]C+1 -> 3 | J209: 90
A210: 3 | B210: 法防强化 | C210: 1003 | D210: =R[-100]C -> 4 | E210: =R[-100]C -> 1 | F210: 1400 | G210: 20 | H210: 1400 | I210: =R[-100]C+1 -> 3 | J210: 120
A211: 3 | B211: 法防强化 | C211: 1003 | D211: =R[-100]C -> 5 | E211: =R[-100]C -> 1 | F211: 1500 | G211: 20 | H211: 1500 | I211: =R[-100]C+1 -> 3 | J211: 150
A212: 3 | B212: 法防强化 | C212: 1003 | D212: =R[-100]C -> 6 | E212: =R[-100]C -> 1 | F212: 1600 | G212: 20 | H212: 1600 | I212: =R[-100]C+1 -> 3 | J212: 180
A213: 3 | B213: 法防强化 | C213: 1003 | D213: =R[-100]C -> 7 | E213: =R[-100]C -> 1 | F213: 1700 | G213: 20 | H213: 1700 | I213: =R[-100]C+1 -> 3 | J213: 210
A214: 3 | B214: 法防强化 | C214: 1003 | D214: =R[-100]C -> 8 | E214: =R[-100]C -> 1 | F214: 1800 | G214: 20 | H214: 1800 | I214: =R[-100]C+1 -> 3 | J214: 240
A215: 3 | B215: 法防强化 | C215: 1003 | D215: =R[-100]C -> 9 | E215: =R[-100]C -> 1 | F215: 1900 | G215: 20 | H215: 1900 | I215: =R[-100]C+1 -> 3 | J215: 270
A216: 3 | B216: 法防强化 | C216: 1003 | D216: =R[-100]C -> 10 | E216: =R[-100]C -> 1 | F216: 2000 | G216: 20 | H216: 2000 | I216: =R[-100]C+1 -> 3 | J216: 300
A217: 3 | B217: 法防强化 | C217: 1003 | D217: =R[-100]C -> 11 | E217: =R[-100]C -> 2 | F217: 2100 | G217: 20 | H217: 2100 | I217: =R[-100]C+1 -> 3 | J217: 330
A218: 3 | B218: 法防强化 | C218: 1003 | D218: =R[-100]C -> 12 | E218: =R[-100]C -> 2 | F218: 2200 | G218: 20 | H218: 2200 | I218: =R[-100]C+1 -> 3 | J218: 360
A219: 3 | B219: 法防强化 | C219: 1003 | D219: =R[-100]C -> 13 | E219: =R[-100]C -> 2 | F219: 2300 | G219: 20 | H219: 2300 | I219: =R[-100]C+1 -> 3 | J219: 390
A220: 3 | B220: 法防强化 | C220: 1003 | D220: =R[-100]C -> 14 | E220: =R[-100]C -> 2 | F220: 2400 | G220: 20 | H220: 2400 | I220: =R[-100]C+1 -> 3 | J220: 420
A221: 3 | B221: 法防强化 | C221: 1003 | D221: =R[-100]C -> 15 | E221: =R[-100]C -> 2 | F221: 2500 | G221: 20 | H221: 2500 | I221: =R[-100]C+1 -> 3 | J221: 450
A222: 3 | B222: 法防强化 | C222: 1003 | D222: =R[-100]C -> 16 | E222: =R[-100]C -> 2 | F222: 2600 | G222: 20 | H222: 2600 | I222: =R[-100]C+1 -> 3 | J222: 480
A223: 3 | B223: 法防强化 | C223: 1003 | D223: =R[-100]C -> 17 | E223: =R[-100]C -> 2 | F223: 2700 | G223: 20 | H223: 2700 | I223: =R[-100]C+1 -> 3 | J223: 510
A224: 3 | B224: 法防强化 | C224: 1003 | D224: =R[-100]C -> 18 | E224: =R[-100]C -> 2 | F224: 2800 | G224: 20 | H224: 2800 | I224: =R[-100]C+1 -> 3 | J224: 540
A225: 3 | B225: 法防强化 | C225: 1003 | D225: =R[-100]C -> 19 | E225: =R[-100]C -> 2 | F225: 2900 | G225: 20 | H225: 2900 | I225: =R[-100]C+1 -> 3 | J225: 570
A226: 3 | B226: 法防强化 | C226: 1003 | D226: =R[-100]C -> 20 | E226: =R[-100]C -> 2 | F226: 3000 | G226: 20 | H226: 3000 | I226: =R[-100]C+1 -> 3 | J226: 600
A227: 3 | B227: 法防强化 | C227: 1003 | D227: =R[-100]C -> 21 | E227: =R[-100]C -> 3 | F227: 3100 | G227: 20 | H227: 3100 | I227: =R[-100]C+1 -> 3 | J227: 630
A228: 3 | B228: 法防强化 | C228: 1003 | D228: =R[-100]C -> 22 | E228: =R[-100]C -> 3 | F228: 3200 | G228: 20 | H228: 3200 | I228: =R[-100]C+1 -> 3 | J228: 660
A229: 3 | B229: 法防强化 | C229: 1003 | D229: =R[-100]C -> 23 | E229: =R[-100]C -> 3 | F229: 3300 | G229: 20 | H229: 3300 | I229: =R[-100]C+1 -> 3 | J229: 690
A230: 3 | B230: 法防强化 | C230: 1003 | D230: =R[-100]C -> 24 | E230: =R[-100]C -> 3 | F230: 3400 | G230: 20 | H230: 3400 | I230: =R[-100]C+1 -> 3 | J230: 720
A231: 3 | B231: 法防强化 | C231: 1003 | D231: =R[-100]C -> 25 | E231: =R[-100]C -> 3 | F231: 3500 | G231: 20 | H231: 3500 | I231: =R[-100]C+1 -> 3 | J231: 750
A232: 3 | B232: 法防强化 | C232: 1003 | D232: =R[-100]C -> 26 | E232: =R[-100]C -> 3 | F232: 3600 | G232: 20 | H232: 3600 | I232: =R[-100]C+1 -> 3 | J232: 780
A233: 3 | B233: 法防强化 | C233: 1003 | D233: =R[-100]C -> 27 | E233: =R[-100]C -> 3 | F233: 3700 | G233: 20 | H233: 3700 | I233: =R[-100]C+1 -> 3 | J233: 810
A234: 3 | B234: 法防强化 | C234: 1003 | D234: =R[-100]C -> 28 | E234: =R[-100]C -> 3 | F234: 3800 | G234: 20 | H234: 3800 | I234: =R[-100]C+1 -> 3 | J234: 840
A235: 3 | B235: 法防强化 | C235: 1003 | D235: =R[-100]C -> 29 | E235: =R[-100]C -> 3 | F235: 3900 | G235: 20 | H235: 3900 | I235: =R[-100]C+1 -> 3 | J235: 870
A236: 3 | B236: 法防强化 | C236: 1003 | D236: =R[-100]C -> 30 | E236: =R[-100]C -> 3 | F236: 4000 | G236: 20 | H236: 4000 | I236: =R[-100]C+1 -> 3 | J236: 900
A237: 3 | B237: 法防强化 | C237: 1003 | D237: =R[-100]C -> 31 | E237: =R[-100]C -> 4 | F237: 4100 | G237: 20 | H237: 4100 | I237: =R[-100]C+1 -> 3 | J237: 930
A238: 3 | B238: 法防强化 | C238: 1003 | D238: =R[-100]C -> 32 | E238: =R[-100]C -> 4 | F238: 4200 | G238: 20 | H238: 4200 | I238: =R[-100]C+1 -> 3 | J238: 960
A239: 3 | B239: 法防强化 | C239: 1003 | D239: =R[-100]C -> 33 | E239: =R[-100]C -> 4 | F239: 4300 | G239: 20 | H239: 4300 | I239: =R[-100]C+1 -> 3 | J239: 990
A240: 3 | B240: 法防强化 | C240: 1003 | D240: =R[-100]C -> 34 | E240: =R[-100]C -> 4 | F240: 4400 | G240: 20 | H240: 4400 | I240: =R[-100]C+1 -> 3 | J240: 1020
A241: 3 | B241: 法防强化 | C241: 1003 | D241: =R[-100]C -> 35 | E241: =R[-100]C -> 4 | F241: 4500 | G241: 20 | H241: 4500 | I241: =R[-100]C+1 -> 3 | J241: 1050
A242: 3 | B242: 法防强化 | C242: 1003 | D242: =R[-100]C -> 36 | E242: =R[-100]C -> 4 | F242: 4600 | G242: 20 | H242: 4600 | I242: =R[-100]C+1 -> 3 | J242: 1080
A243: 3 | B243: 法防强化 | C243: 1003 | D243: =R[-100]C -> 37 | E243: =R[-100]C -> 4 | F243: 4700 | G243: 20 | H243: 4700 | I243: =R[-100]C+1 -> 3 | J243: 1110
A244: 3 | B244: 法防强化 | C244: 1003 | D244: =R[-100]C -> 38 | E244: =R[-100]C -> 4 | F244: 4800 | G244: 20 | H244: 4800 | I244: =R[-100]C+1 -> 3 | J244: 1140
A245: 3 | B245: 法防强化 | C245: 1003 | D245: =R[-100]C -> 39 | E245: =R[-100]C -> 4 | F245: 4900 | G245: 20 | H245: 4900 | I245: =R[-100]C+1 -> 3 | J245: 1170
A246: 3 | B246: 法防强化 | C246: 1003 | D246: =R[-100]C -> 40 | E246: =R[-100]C -> 4 | F246: 5000 | G246: 20 | H246: 5000 | I246: =R[-100]C+1 -> 3 | J246: 1200
A247: 3 | B247: 法防强化 | C247: 1003 | D247: =R[-100]C -> 41 | E247: =R[-100]C -> 5 | F247: 5100 | G247: 20 | H247: 5100 | I247: =R[-100]C+1 -> 3 | J247: 1230
A248: 3 | B248: 法防强化 | C248: 1003 | D248: =R[-100]C -> 42 | E248: =R[-100]C -> 5 | F248: 5200 | G248: 20 | H248: 5200 | I248: =R[-100]C+1 -> 3 | J248: 1260
A249: 3 | B249: 法防强化 | C249: 1003 | D249: =R[-100]C -> 43 | E249: =R[-100]C -> 5 | F249: 5300 | G249: 20 | H249: 5300 | I249: =R[-100]C+1 -> 3 | J249: 1290
A250: 3 | B250: 法防强化 | C250: 1003 | D250: =R[-100]C -> 44 | E250: =R[-100]C -> 5 | F250: 5400 | G250: 20 | H250: 5400 | I250: =R[-100]C+1 -> 3 | J250: 1320
A251: 3 | B251: 法防强化 | C251: 1003 | D251: =R[-100]C -> 45 | E251: =R[-100]C -> 5 | F251: 5500 | G251: 20 | H251: 5500 | I251: =R[-100]C+1 -> 3 | J251: 1350
A252: 3 | B252: 法防强化 | C252: 1003 | D252: =R[-100]C -> 46 | E252: =R[-100]C -> 5 | F252: 5600 | G252: 20 | H252: 5600 | I252: =R[-100]C+1 -> 3 | J252: 1380
A253: 3 | B253: 法防强化 | C253: 1003 | D253: =R[-100]C -> 47 | E253: =R[-100]C -> 5 | F253: 5700 | G253: 20 | H253: 5700 | I253: =R[-100]C+1 -> 3 | J253: 1410
A254: 3 | B254: 法防强化 | C254: 1003 | D254: =R[-100]C -> 48 | E254: =R[-100]C -> 5 | F254: 5800 | G254: 20 | H254: 5800 | I254: =R[-100]C+1 -> 3 | J254: 1440
A255: 3 | B255: 法防强化 | C255: 1003 | D255: =R[-100]C -> 49 | E255: =R[-100]C -> 5 | F255: 5900 | G255: 20 | H255: 5900 | I255: =R[-100]C+1 -> 3 | J255: 1470
A256: 3 | B256: 法防强化 | C256: 1003 | D256: =R[-100]C -> 50 | E256: =R[-100]C -> 5 | F256: 6000 | G256: 20 | H256: 6000 | I256: =R[-100]C+1 -> 3 | J256: 1500
A257: 3 | B257: 法防强化 | C257: 1003 | D257: =R[-100]C -> 51 | E257: =R[-100]C -> 6 | F257: 6100 | G257: 20 | H257: 6100 | I257: =R[-100]C+1 -> 3 | J257: 1530
A258: 3 | B258: 法防强化 | C258: 1003 | D258: =R[-100]C -> 52 | E258: =R[-100]C -> 6 | F258: 6200 | G258: 20 | H258: 6200 | I258: =R[-100]C+1 -> 3 | J258: 1560
A259: 3 | B259: 法防强化 | C259: 1003 | D259: =R[-100]C -> 53 | E259: =R[-100]C -> 6 | F259: 6300 | G259: 20 | H259: 6300 | I259: =R[-100]C+1 -> 3 | J259: 1590
A260: 3 | B260: 法防强化 | C260: 1003 | D260: =R[-100]C -> 54 | E260: =R[-100]C -> 6 | F260: 6400 | G260: 20 | H260: 6400 | I260: =R[-100]C+1 -> 3 | J260: 1620
A261: 3 | B261: 法防强化 | C261: 1003 | D261: =R[-100]C -> 55 | E261: =R[-100]C -> 6 | F261: 6500 | G261: 20 | H261: 6500 | I261: =R[-100]C+1 -> 3 | J261: 1650
A262: 3 | B262: 法防强化 | C262: 1003 | D262: =R[-100]C -> 56 | E262: =R[-100]C -> 6 | F262: 6600 | G262: 20 | H262: 6600 | I262: =R[-100]C+1 -> 3 | J262: 1680
A263: 3 | B263: 法防强化 | C263: 1003 | D263: =R[-100]C -> 57 | E263: =R[-100]C -> 6 | F263: 6700 | G263: 20 | H263: 6700 | I263: =R[-100]C+1 -> 3 | J263: 1710
A264: 3 | B264: 法防强化 | C264: 1003 | D264: =R[-100]C -> 58 | E264: =R[-100]C -> 6 | F264: 6800 | G264: 20 | H264: 6800 | I264: =R[-100]C+1 -> 3 | J264: 1740
A265: 3 | B265: 法防强化 | C265: 1003 | D265: =R[-100]C -> 59 | E265: =R[-100]C -> 6 | F265: 6900 | G265: 20 | H265: 6900 | I265: =R[-100]C+1 -> 3 | J265: 1770
A266: 3 | B266: 法防强化 | C266: 1003 | D266: =R[-100]C -> 60 | E266: =R[-100]C -> 6 | F266: 7000 | G266: 20 | H266: 7000 | I266: =R[-100]C+1 -> 3 | J266: 1800
A267: 3 | B267: 法防强化 | C267: 1003 | D267: =R[-100]C -> 61 | E267: =R[-100]C -> 7 | F267: 7100 | G267: 20 | H267: 7100 | I267: =R[-100]C+1 -> 3 | J267: 1830
A268: 3 | B268: 法防强化 | C268: 1003 | D268: =R[-100]C -> 62 | E268: =R[-100]C -> 7 | F268: 7200 | G268: 20 | H268: 7200 | I268: =R[-100]C+1 -> 3 | J268: 1860
A269: 3 | B269: 法防强化 | C269: 1003 | D269: =R[-100]C -> 63 | E269: =R[-100]C -> 7 | F269: 7300 | G269: 20 | H269: 7300 | I269: =R[-100]C+1 -> 3 | J269: 1890
A270: 3 | B270: 法防强化 | C270: 1003 | D270: =R[-100]C -> 64 | E270: =R[-100]C -> 7 | F270: 7400 | G270: 20 | H270: 7400 | I270: =R[-100]C+1 -> 3 | J270: 1920
A271: 3 | B271: 法防强化 | C271: 1003 | D271: =R[-100]C -> 65 | E271: =R[-100]C -> 7 | F271: 7500 | G271: 20 | H271: 7500 | I271: =R[-100]C+1 -> 3 | J271: 1950
A272: 3 | B272: 法防强化 | C272: 1003 | D272: =R[-100]C -> 66 | E272: =R[-100]C -> 7 | F272: 7600 | G272: 20 | H272: 7600 | I272: =R[-100]C+1 -> 3 | J272: 1980
A273: 3 | B273: 法防强化 | C273: 1003 | D273: =R[-100]C -> 67 | E273: =R[-100]C -> 7 | F273: 7700 | G273: 20 | H273: 7700 | I273: =R[-100]C+1 -> 3 | J273: 2010
A274: 3 | B274: 法防强化 | C274: 1003 | D274: =R[-100]C -> 68 | E274: =R[-100]C -> 7 | F274: 7800 | G274: 20 | H274: 7800 | I274: =R[-100]C+1 -> 3 | J274: 2040
A275: 3 | B275: 法防强化 | C275: 1003 | D275: =R[-100]C -> 69 | E275: =R[-100]C -> 7 | F275: 7900 | G275: 20 | H275: 7900 | I275: =R[-100]C+1 -> 3 | J275: 2070
A276: 3 | B276: 法防强化 | C276: 1003 | D276: =R[-100]C -> 70 | E276: =R[-100]C -> 7 | F276: 8000 | G276: 20 | H276: 8000 | I276: =R[-100]C+1 -> 3 | J276: 2100
A277: 3 | B277: 法防强化 | C277: 1003 | D277: =R[-100]C -> 71 | E277: =R[-100]C -> 8 | F277: 8100 | G277: 20 | H277: 8100 | I277: =R[-100]C+1 -> 3 | J277: 2130
A278: 3 | B278: 法防强化 | C278: 1003 | D278: =R[-100]C -> 72 | E278: =R[-100]C -> 8 | F278: 8200 | G278: 20 | H278: 8200 | I278: =R[-100]C+1 -> 3 | J278: 2160
A279: 3 | B279: 法防强化 | C279: 1003 | D279: =R[-100]C -> 73 | E279: =R[-100]C -> 8 | F279: 8300 | G279: 20 | H279: 8300 | I279: =R[-100]C+1 -> 3 | J279: 2190
A280: 3 | B280: 法防强化 | C280: 1003 | D280: =R[-100]C -> 74 | E280: =R[-100]C -> 8 | F280: 8400 | G280: 20 | H280: 8400 | I280: =R[-100]C+1 -> 3 | J280: 2220
A281: 3 | B281: 法防强化 | C281: 1003 | D281: =R[-100]C -> 75 | E281: =R[-100]C -> 8 | F281: 8500 | G281: 20 | H281: 8500 | I281: =R[-100]C+1 -> 3 | J281: 2250
A282: 3 | B282: 法防强化 | C282: 1003 | D282: =R[-100]C -> 76 | E282: =R[-100]C -> 8 | F282: 8600 | G282: 20 | H282: 8600 | I282: =R[-100]C+1 -> 3 | J282: 2280
A283: 3 | B283: 法防强化 | C283: 1003 | D283: =R[-100]C -> 77 | E283: =R[-100]C -> 8 | F283: 8700 | G283: 20 | H283: 8700 | I283: =R[-100]C+1 -> 3 | J283: 2310
A284: 3 | B284: 法防强化 | C284: 1003 | D284: =R[-100]C -> 78 | E284: =R[-100]C -> 8 | F284: 8800 | G284: 20 | H284: 8800 | I284: =R[-100]C+1 -> 3 | J284: 2340
A285: 3 | B285: 法防强化 | C285: 1003 | D285: =R[-100]C -> 79 | E285: =R[-100]C -> 8 | F285: 8900 | G285: 20 | H285: 8900 | I285: =R[-100]C+1 -> 3 | J285: 2370
A286: 3 | B286: 法防强化 | C286: 1003 | D286: =R[-100]C -> 80 | E286: =R[-100]C -> 8 | F286: 9000 | G286: 20 | H286: 9000 | I286: =R[-100]C+1 -> 3 | J286: 2400
A287: 3 | B287: 法防强化 | C287: 1003 | D287: =R[-100]C -> 81 | E287: =R[-100]C -> 9 | F287: 9100 | G287: 20 | H287: 9100 | I287: =R[-100]C+1 -> 3 | J287: 2430
A288: 3 | B288: 法防强化 | C288: 1003 | D288: =R[-100]C -> 82 | E288: =R[-100]C -> 9 | F288: 9200 | G288: 20 | H288: 9200 | I288: =R[-100]C+1 -> 3 | J288: 2460
A289: 3 | B289: 法防强化 | C289: 1003 | D289: =R[-100]C -> 83 | E289: =R[-100]C -> 9 | F289: 9300 | G289: 20 | H289: 9300 | I289: =R[-100]C+1 -> 3 | J289: 2490
A290: 3 | B290: 法防强化 | C290: 1003 | D290: =R[-100]C -> 84 | E290: =R[-100]C -> 9 | F290: 9400 | G290: 20 | H290: 9400 | I290: =R[-100]C+1 -> 3 | J290: 2520
A291: 3 | B291: 法防强化 | C291: 1003 | D291: =R[-100]C -> 85 | E291: =R[-100]C -> 9 | F291: 9500 | G291: 20 | H291: 9500 | I291: =R[-100]C+1 -> 3 | J291: 2550
A292: 3 | B292: 法防强化 | C292: 1003 | D292: =R[-100]C -> 86 | E292: =R[-100]C -> 9 | F292: 9600 | G292: 20 | H292: 9600 | I292: =R[-100]C+1 -> 3 | J292: 2580
A293: 3 | B293: 法防强化 | C293: 1003 | D293: =R[-100]C -> 87 | E293: =R[-100]C -> 9 | F293: 9700 | G293: 20 | H293: 9700 | I293: =R[-100]C+1 -> 3 | J293: 2610
A294: 3 | B294: 法防强化 | C294: 1003 | D294: =R[-100]C -> 88 | E294: =R[-100]C -> 9 | F294: 9800 | G294: 20 | H294: 9800 | I294: =R[-100]C+1 -> 3 | J294: 2640
A295: 3 | B295: 法防强化 | C295: 1003 | D295: =R[-100]C -> 89 | E295: =R[-100]C -> 9 | F295: 9900 | G295: 20 | H295: 9900 | I295: =R[-100]C+1 -> 3 | J295: 2670
A296: 3 | B296: 法防强化 | C296: 1003 | D296: =R[-100]C -> 90 | E296: =R[-100]C -> 9 | F296: 10000 | G296: 20 | H296: 10000 | I296: =R[-100]C+1 -> 3 | J296: 2700
A297: 3 | B297: 法防强化 | C297: 1003 | D297: =R[-100]C -> 91 | E297: =R[-100]C -> 10 | F297: 10100 | G297: 20 | H297: 10100 | I297: =R[-100]C+1 -> 3 | J297: 2730
A298: 3 | B298: 法防强化 | C298: 1003 | D298: =R[-100]C -> 92 | E298: =R[-100]C -> 10 | F298: 10200 | G298: 20 | H298: 10200 | I298: =R[-100]C+1 -> 3 | J298: 2760
A299: 3 | B299: 法防强化 | C299: 1003 | D299: =R[-100]C -> 93 | E299: =R[-100]C -> 10 | F299: 10300 | G299: 20 | H299: 10300 | I299: =R[-100]C+1 -> 3 | J299: 2790
A300: 3 | B300: 法防强化 | C300: 1003 | D300: =R[-100]C -> 94 | E300: =R[-100]C -> 10 | F300: 10400 | G300: 20 | H300: 10400 | I300: =R[-100]C+1 -> 3 | J300: 2820
A301: 3 | B301: 法防强化 | C301: 1003 | D301: =R[-100]C -> 95 | E301: =R[-100]C -> 10 | F301: 10500 | G301: 20 | H301: 10500 | I301: =R[-100]C+1 -> 3 | J301: 2850
A302: 3 | B302: 法防强化 | C302: 1003 | D302: =R[-100]C -> 96 | E302: =R[-100]C -> 10 | F302: 10600 | G302: 20 | H302: 10600 | I302: =R[-100]C+1 -> 3 | J302: 2880
A303: 3 | B303: 法防强化 | C303: 1003 | D303: =R[-100]C -> 97 | E303: =R[-100]C -> 10 | F303: 10700 | G303: 20 | H303: 10700 | I303: =R[-100]C+1 -> 3 | J303: 2910
A304: 3 | B304: 法防强化 | C304: 1003 | D304: =R[-100]C -> 98 | E304: =R[-100]C -> 10 | F304: 10800 | G304: 20 | H304: 10800 | I304: =R[-100]C+1 -> 3 | J304: 2940
A305: 3 | B305: 法防强化 | C305: 1003 | D305: =R[-100]C -> 99 | E305: =R[-100]C -> 10 | F305: 10900 | G305: 20 | H305: 10900 | I305: =R[-100]C+1 -> 3 | J305: 2970
A306: 3 | B306: 法防强化 | C306: 1003 | D306: =R[-100]C -> 100 | E306: =R[-100]C -> 10 | F306: 11000 | G306: 20 | H306: 11000 | I306: =R[-100]C+1 -> 3 | J306: 3000
A307: 4 | B307: 生命强化 | C307: 1004 | D307: =R[-100]C -> 1 | E307: =R[-100]C -> 1 | F307: 1100 | G307: 20 | H307: 1100 | I307: =R[-100]C+1 -> 4 | J307: 300
A308: 4 | B308: 生命强化 | C308: 1004 | D308: =R[-100]C -> 2 | E308: =R[-100]C -> 1 | F308: 1200 | G308: 20 | H308: 1200 | I308: =R[-100]C+1 -> 4 | J308: 600
A309: 4 | B309: 生命强化 | C309: 1004 | D309: =R[-100]C -> 3 | E309: =R[-100]C -> 1 | F309: 1300 | G309: 20 | H309: 1300 | I309: =R[-100]C+1 -> 4 | J309: 900
A310: 4 | B310: 生命强化 | C310: 1004 | D310: =R[-100]C -> 4 | E310: =R[-100]C -> 1 | F310: 1400 | G310: 20 | H310: 1400 | I310: =R[-100]C+1 -> 4 | J310: 1200
A311: 4 | B311: 生命强化 | C311: 1004 | D311: =R[-100]C -> 5 | E311: =R[-100]C -> 1 | F311: 1500 | G311: 20 | H311: 1500 | I311: =R[-100]C+1 -> 4 | J311: 1500
A312: 4 | B312: 生命强化 | C312: 1004 | D312: =R[-100]C -> 6 | E312: =R[-100]C -> 1 | F312: 1600 | G312: 20 | H312: 1600 | I312: =R[-100]C+1 -> 4 | J312: 1800
A313: 4 | B313: 生命强化 | C313: 1004 | D313: =R[-100]C -> 7 | E313: =R[-100]C -> 1 | F313: 1700 | G313: 20 | H313: 1700 | I313: =R[-100]C+1 -> 4 | J313: 2100
A314: 4 | B314: 生命强化 | C314: 1004 | D314: =R[-100]C -> 8 | E314: =R[-100]C -> 1 | F314: 1800 | G314: 20 | H314: 1800 | I314: =R[-100]C+1 -> 4 | J314: 2400
A315: 4 | B315: 生命强化 | C315: 1004 | D315: =R[-100]C -> 9 | E315: =R[-100]C -> 1 | F315: 1900 | G315: 20 | H315: 1900 | I315: =R[-100]C+1 -> 4 | J315: 2700
A316: 4 | B316: 生命强化 | C316: 1004 | D316: =R[-100]C -> 10 | E316: =R[-100]C -> 1 | F316: 2000 | G316: 20 | H316: 2000 | I316: =R[-100]C+1 -> 4 | J316: 3000
A317: 4 | B317: 生命强化 | C317: 1004 | D317: =R[-100]C -> 11 | E317: =R[-100]C -> 2 | F317: 2100 | G317: 20 | H317: 2100 | I317: =R[-100]C+1 -> 4 | J317: 3300
A318: 4 | B318: 生命强化 | C318: 1004 | D318: =R[-100]C -> 12 | E318: =R[-100]C -> 2 | F318: 2200 | G318: 20 | H318: 2200 | I318: =R[-100]C+1 -> 4 | J318: 3600
A319: 4 | B319: 生命强化 | C319: 1004 | D319: =R[-100]C -> 13 | E319: =R[-100]C -> 2 | F319: 2300 | G319: 20 | H319: 2300 | I319: =R[-100]C+1 -> 4 | J319: 3900
A320: 4 | B320: 生命强化 | C320: 1004 | D320: =R[-100]C -> 14 | E320: =R[-100]C -> 2 | F320: 2400 | G320: 20 | H320: 2400 | I320: =R[-100]C+1 -> 4 | J320: 4200
A321: 4 | B321: 生命强化 | C321: 1004 | D321: =R[-100]C -> 15 | E321: =R[-100]C -> 2 | F321: 2500 | G321: 20 | H321: 2500 | I321: =R[-100]C+1 -> 4 | J321: 4500
A322: 4 | B322: 生命强化 | C322: 1004 | D322: =R[-100]C -> 16 | E322: =R[-100]C -> 2 | F322: 2600 | G322: 20 | H322: 2600 | I322: =R[-100]C+1 -> 4 | J322: 4800
A323: 4 | B323: 生命强化 | C323: 1004 | D323: =R[-100]C -> 17 | E323: =R[-100]C -> 2 | F323: 2700 | G323: 20 | H323: 2700 | I323: =R[-100]C+1 -> 4 | J323: 5100
A324: 4 | B324: 生命强化 | C324: 1004 | D324: =R[-100]C -> 18 | E324: =R[-100]C -> 2 | F324: 2800 | G324: 20 | H324: 2800 | I324: =R[-100]C+1 -> 4 | J324: 5400
A325: 4 | B325: 生命强化 | C325: 1004 | D325: =R[-100]C -> 19 | E325: =R[-100]C -> 2 | F325: 2900 | G325: 20 | H325: 2900 | I325: =R[-100]C+1 -> 4 | J325: 5700
A326: 4 | B326: 生命强化 | C326: 1004 | D326: =R[-100]C -> 20 | E326: =R[-100]C -> 2 | F326: 3000 | G326: 20 | H326: 3000 | I326: =R[-100]C+1 -> 4 | J326: 6000
A327: 4 | B327: 生命强化 | C327: 1004 | D327: =R[-100]C -> 21 | E327: =R[-100]C -> 3 | F327: 3100 | G327: 20 | H327: 3100 | I327: =R[-100]C+1 -> 4 | J327: 6300
A328: 4 | B328: 生命强化 | C328: 1004 | D328: =R[-100]C -> 22 | E328: =R[-100]C -> 3 | F328: 3200 | G328: 20 | H328: 3200 | I328: =R[-100]C+1 -> 4 | J328: 6600
A329: 4 | B329: 生命强化 | C329: 1004 | D329: =R[-100]C -> 23 | E329: =R[-100]C -> 3 | F329: 3300 | G329: 20 | H329: 3300 | I329: =R[-100]C+1 -> 4 | J329: 6900
A330: 4 | B330: 生命强化 | C330: 1004 | D330: =R[-100]C -> 24 | E330: =R[-100]C -> 3 | F330: 3400 | G330: 20 | H330: 3400 | I330: =R[-100]C+1 -> 4 | J330: 7200
A331: 4 | B331: 生命强化 | C331: 1004 | D331: =R[-100]C -> 25 | E331: =R[-100]C -> 3 | F331: 3500 | G331: 20 | H331: 3500 | I331: =R[-100]C+1 -> 4 | J331: 7500
A332: 4 | B332: 生命强化 | C332: 1004 | D332: =R[-100]C -> 26 | E332: =R[-100]C -> 3 | F332: 3600 | G332: 20 | H332: 3600 | I332: =R[-100]C+1 -> 4 | J332: 7800
A333: 4 | B333: 生命强化 | C333: 1004 | D333: =R[-100]C -> 27 | E333: =R[-100]C -> 3 | F333: 3700 | G333: 20 | H333: 3700 | I333: =R[-100]C+1 -> 4 | J333: 8100
A334: 4 | B334: 生命强化 | C334: 1004 | D334: =R[-100]C -> 28 | E334: =R[-100]C -> 3 | F334: 3800 | G334: 20 | H334: 3800 | I334: =R[-100]C+1 -> 4 | J334: 8400
A335: 4 | B335: 生命强化 | C335: 1004 | D335: =R[-100]C -> 29 | E335: =R[-100]C -> 3 | F335: 3900 | G335: 20 | H335: 3900 | I335: =R[-100]C+1 -> 4 | J335: 8700
A336: 4 | B336: 生命强化 | C336: 1004 | D336: =R[-100]C -> 30 | E336: =R[-100]C -> 3 | F336: 4000 | G336: 20 | H336: 4000 | I336: =R[-100]C+1 -> 4 | J336: 9000
A337: 4 | B337: 生命强化 | C337: 1004 | D337: =R[-100]C -> 31 | E337: =R[-100]C -> 4 | F337: 4100 | G337: 20 | H337: 4100 | I337: =R[-100]C+1 -> 4 | J337: 9300
A338: 4 | B338: 生命强化 | C338: 1004 | D338: =R[-100]C -> 32 | E338: =R[-100]C -> 4 | F338: 4200 | G338: 20 | H338: 4200 | I338: =R[-100]C+1 -> 4 | J338: 9600
A339: 4 | B339: 生命强化 | C339: 1004 | D339: =R[-100]C -> 33 | E339: =R[-100]C -> 4 | F339: 4300 | G339: 20 | H339: 4300 | I339: =R[-100]C+1 -> 4 | J339: 9900
A340: 4 | B340: 生命强化 | C340: 1004 | D340: =R[-100]C -> 34 | E340: =R[-100]C -> 4 | F340: 4400 | G340: 20 | H340: 4400 | I340: =R[-100]C+1 -> 4 | J340: 10200
A341: 4 | B341: 生命强化 | C341: 1004 | D341: =R[-100]C -> 35 | E341: =R[-100]C -> 4 | F341: 4500 | G341: 20 | H341: 4500 | I341: =R[-100]C+1 -> 4 | J341: 10500
A342: 4 | B342: 生命强化 | C342: 1004 | D342: =R[-100]C -> 36 | E342: =R[-100]C -> 4 | F342: 4600 | G342: 20 | H342: 4600 | I342: =R[-100]C+1 -> 4 | J342: 10800
A343: 4 | B343: 生命强化 | C343: 1004 | D343: =R[-100]C -> 37 | E343: =R[-100]C -> 4 | F343: 4700 | G343: 20 | H343: 4700 | I343: =R[-100]C+1 -> 4 | J343: 11100
A344: 4 | B344: 生命强化 | C344: 1004 | D344: =R[-100]C -> 38 | E344: =R[-100]C -> 4 | F344: 4800 | G344: 20 | H344: 4800 | I344: =R[-100]C+1 -> 4 | J344: 11400
A345: 4 | B345: 生命强化 | C345: 1004 | D345: =R[-100]C -> 39 | E345: =R[-100]C -> 4 | F345: 4900 | G345: 20 | H345: 4900 | I345: =R[-100]C+1 -> 4 | J345: 11700
A346: 4 | B346: 生命强化 | C346: 1004 | D346: =R[-100]C -> 40 | E346: =R[-100]C -> 4 | F346: 5000 | G346: 20 | H346: 5000 | I346: =R[-100]C+1 -> 4 | J346: 12000
A347: 4 | B347: 生命强化 | C347: 1004 | D347: =R[-100]C -> 41 | E347: =R[-100]C -> 5 | F347: 5100 | G347: 20 | H347: 5100 | I347: =R[-100]C+1 -> 4 | J347: 12300
A348: 4 | B348: 生命强化 | C348: 1004 | D348: =R[-100]C -> 42 | E348: =R[-100]C -> 5 | F348: 5200 | G348: 20 | H348: 5200 | I348: =R[-100]C+1 -> 4 | J348: 12600
A349: 4 | B349: 生命强化 | C349: 1004 | D349: =R[-100]C -> 43 | E349: =R[-100]C -> 5 | F349: 5300 | G349: 20 | H349: 5300 | I349: =R[-100]C+1 -> 4 | J349: 12900
A350: 4 | B350: 生命强化 | C350: 1004 | D350: =R[-100]C -> 44 | E350: =R[-100]C -> 5 | F350: 5400 | G350: 20 | H350: 5400 | I350: =R[-100]C+1 -> 4 | J350: 13200
A351: 4 | B351: 生命强化 | C351: 1004 | D351: =R[-100]C -> 45 | E351: =R[-100]C -> 5 | F351: 5500 | G351: 20 | H351: 5500 | I351: =R[-100]C+1 -> 4 | J351: 13500
A352: 4 | B352: 生命强化 | C352: 1004 | D352: =R[-100]C -> 46 | E352: =R[-100]C -> 5 | F352: 5600 | G352: 20 | H352: 5600 | I352: =R[-100]C+1 -> 4 | J352: 13800
A353: 4 | B353: 生命强化 | C353: 1004 | D353: =R[-100]C -> 47 | E353: =R[-100]C -> 5 | F353: 5700 | G353: 20 | H353: 5700 | I353: =R[-100]C+1 -> 4 | J353: 14100
A354: 4 | B354: 生命强化 | C354: 1004 | D354: =R[-100]C -> 48 | E354: =R[-100]C -> 5 | F354: 5800 | G354: 20 | H354: 5800 | I354: =R[-100]C+1 -> 4 | J354: 14400
A355: 4 | B355: 生命强化 | C355: 1004 | D355: =R[-100]C -> 49 | E355: =R[-100]C -> 5 | F355: 5900 | G355: 20 | H355: 5900 | I355: =R[-100]C+1 -> 4 | J355: 14700
A356: 4 | B356: 生命强化 | C356: 1004 | D356: =R[-100]C -> 50 | E356: =R[-100]C -> 5 | F356: 6000 | G356: 20 | H356: 6000 | I356: =R[-100]C+1 -> 4 | J356: 15000
A357: 4 | B357: 生命强化 | C357: 1004 | D357: =R[-100]C -> 51 | E357: =R[-100]C -> 6 | F357: 6100 | G357: 20 | H357: 6100 | I357: =R[-100]C+1 -> 4 | J357: 15300
A358: 4 | B358: 生命强化 | C358: 1004 | D358: =R[-100]C -> 52 | E358: =R[-100]C -> 6 | F358: 6200 | G358: 20 | H358: 6200 | I358: =R[-100]C+1 -> 4 | J358: 15600
A359: 4 | B359: 生命强化 | C359: 1004 | D359: =R[-100]C -> 53 | E359: =R[-100]C -> 6 | F359: 6300 | G359: 20 | H359: 6300 | I359: =R[-100]C+1 -> 4 | J359: 15900
A360: 4 | B360: 生命强化 | C360: 1004 | D360: =R[-100]C -> 54 | E360: =R[-100]C -> 6 | F360: 6400 | G360: 20 | H360: 6400 | I360: =R[-100]C+1 -> 4 | J360: 16200
A361: 4 | B361: 生命强化 | C361: 1004 | D361: =R[-100]C -> 55 | E361: =R[-100]C -> 6 | F361: 6500 | G361: 20 | H361: 6500 | I361: =R[-100]C+1 -> 4 | J361: 16500
A362: 4 | B362: 生命强化 | C362: 1004 | D362: =R[-100]C -> 56 | E362: =R[-100]C -> 6 | F362: 6600 | G362: 20 | H362: 6600 | I362: =R[-100]C+1 -> 4 | J362: 16800
A363: 4 | B363: 生命强化 | C363: 1004 | D363: =R[-100]C -> 57 | E363: =R[-100]C -> 6 | F363: 6700 | G363: 20 | H363: 6700 | I363: =R[-100]C+1 -> 4 | J363: 17100
A364: 4 | B364: 生命强化 | C364: 1004 | D364: =R[-100]C -> 58 | E364: =R[-100]C -> 6 | F364: 6800 | G364: 20 | H364: 6800 | I364: =R[-100]C+1 -> 4 | J364: 17400
A365: 4 | B365: 生命强化 | C365: 1004 | D365: =R[-100]C -> 59 | E365: =R[-100]C -> 6 | F365: 6900 | G365: 20 | H365: 6900 | I365: =R[-100]C+1 -> 4 | J365: 17700
A366: 4 | B366: 生命强化 | C366: 1004 | D366: =R[-100]C -> 60 | E366: =R[-100]C -> 6 | F366: 7000 | G366: 20 | H366: 7000 | I366: =R[-100]C+1 -> 4 | J366: 18000
A367: 4 | B367: 生命强化 | C367: 1004 | D367: =R[-100]C -> 61 | E367: =R[-100]C -> 7 | F367: 7100 | G367: 20 | H367: 7100 | I367: =R[-100]C+1 -> 4 | J367: 18300
A368: 4 | B368: 生命强化 | C368: 1004 | D368: =R[-100]C -> 62 | E368: =R[-100]C -> 7 | F368: 7200 | G368: 20 | H368: 7200 | I368: =R[-100]C+1 -> 4 | J368: 18600
A369: 4 | B369: 生命强化 | C369: 1004 | D369: =R[-100]C -> 63 | E369: =R[-100]C -> 7 | F369: 7300 | G369: 20 | H369: 7300 | I369: =R[-100]C+1 -> 4 | J369: 18900
A370: 4 | B370: 生命强化 | C370: 1004 | D370: =R[-100]C -> 64 | E370: =R[-100]C -> 7 | F370: 7400 | G370: 20 | H370: 7400 | I370: =R[-100]C+1 -> 4 | J370: 19200
A371: 4 | B371: 生命强化 | C371: 1004 | D371: =R[-100]C -> 65 | E371: =R[-100]C -> 7 | F371: 7500 | G371: 20 | H371: 7500 | I371: =R[-100]C+1 -> 4 | J371: 19500
A372: 4 | B372: 生命强化 | C372: 1004 | D372: =R[-100]C -> 66 | E372: =R[-100]C -> 7 | F372: 7600 | G372: 20 | H372: 7600 | I372: =R[-100]C+1 -> 4 | J372: 19800
A373: 4 | B373: 生命强化 | C373: 1004 | D373: =R[-100]C -> 67 | E373: =R[-100]C -> 7 | F373: 7700 | G373: 20 | H373: 7700 | I373: =R[-100]C+1 -> 4 | J373: 20100
A374: 4 | B374: 生命强化 | C374: 1004 | D374: =R[-100]C -> 68 | E374: =R[-100]C -> 7 | F374: 7800 | G374: 20 | H374: 7800 | I374: =R[-100]C+1 -> 4 | J374: 20400
A375: 4 | B375: 生命强化 | C375: 1004 | D375: =R[-100]C -> 69 | E375: =R[-100]C -> 7 | F375: 7900 | G375: 20 | H375: 7900 | I375: =R[-100]C+1 -> 4 | J375: 20700
A376: 4 | B376: 生命强化 | C376: 1004 | D376: =R[-100]C -> 70 | E376: =R[-100]C -> 7 | F376: 8000 | G376: 20 | H376: 8000 | I376: =R[-100]C+1 -> 4 | J376: 21000
A377: 4 | B377: 生命强化 | C377: 1004 | D377: =R[-100]C -> 71 | E377: =R[-100]C -> 8 | F377: 8100 | G377: 20 | H377: 8100 | I377: =R[-100]C+1 -> 4 | J377: 21300
A378: 4 | B378: 生命强化 | C378: 1004 | D378: =R[-100]C -> 72 | E378: =R[-100]C -> 8 | F378: 8200 | G378: 20 | H378: 8200 | I378: =R[-100]C+1 -> 4 | J378: 21600
A379: 4 | B379: 生命强化 | C379: 1004 | D379: =R[-100]C -> 73 | E379: =R[-100]C -> 8 | F379: 8300 | G379: 20 | H379: 8300 | I379: =R[-100]C+1 -> 4 | J379: 21900
A380: 4 | B380: 生命强化 | C380: 1004 | D380: =R[-100]C -> 74 | E380: =R[-100]C -> 8 | F380: 8400 | G380: 20 | H380: 8400 | I380: =R[-100]C+1 -> 4 | J380: 22200
A381: 4 | B381: 生命强化 | C381: 1004 | D381: =R[-100]C -> 75 | E381: =R[-100]C -> 8 | F381: 8500 | G381: 20 | H381: 8500 | I381: =R[-100]C+1 -> 4 | J381: 22500
A382: 4 | B382: 生命强化 | C382: 1004 | D382: =R[-100]C -> 76 | E382: =R[-100]C -> 8 | F382: 8600 | G382: 20 | H382: 8600 | I382: =R[-100]C+1 -> 4 | J382: 22800
A383: 4 | B383: 生命强化 | C383: 1004 | D383: =R[-100]C -> 77 | E383: =R[-100]C -> 8 | F383: 8700 | G383: 20 | H383: 8700 | I383: =R[-100]C+1 -> 4 | J383: 23100
A384: 4 | B384: 生命强化 | C384: 1004 | D384: =R[-100]C -> 78 | E384: =R[-100]C -> 8 | F384: 8800 | G384: 20 | H384: 8800 | I384: =R[-100]C+1 -> 4 | J384: 23400
A385: 4 | B385: 生命强化 | C385: 1004 | D385: =R[-100]C -> 79 | E385: =R[-100]C -> 8 | F385: 8900 | G385: 20 | H385: 8900 | I385: =R[-100]C+1 -> 4 | J385: 23700
A386: 4 | B386: 生命强化 | C386: 1004 | D386: =R[-100]C -> 80 | E386: =R[-100]C -> 8 | F386: 9000 | G386: 20 | H386: 9000 | I386: =R[-100]C+1 -> 4 | J386: 24000
A387: 4 | B387: 生命强化 | C387: 1004 | D387: =R[-100]C -> 81 | E387: =R[-100]C -> 9 | F387: 9100 | G387: 20 | H387: 9100 | I387: =R[-100]C+1 -> 4 | J387: 24300
A388: 4 | B388: 生命强化 | C388: 1004 | D388: =R[-100]C -> 82 | E388: =R[-100]C -> 9 | F388: 9200 | G388: 20 | H388: 9200 | I388: =R[-100]C+1 -> 4 | J388: 24600
A389: 4 | B389: 生命强化 | C389: 1004 | D389: =R[-100]C -> 83 | E389: =R[-100]C -> 9 | F389: 9300 | G389: 20 | H389: 9300 | I389: =R[-100]C+1 -> 4 | J389: 24900
A390: 4 | B390: 生命强化 | C390: 1004 | D390: =R[-100]C -> 84 | E390: =R[-100]C -> 9 | F390: 9400 | G390: 20 | H390: 9400 | I390: =R[-100]C+1 -> 4 | J390: 25200
A391: 4 | B391: 生命强化 | C391: 1004 | D391: =R[-100]C -> 85 | E391: =R[-100]C -> 9 | F391: 9500 | G391: 20 | H391: 9500 | I391: =R[-100]C+1 -> 4 | J391: 25500
A392: 4 | B392: 生命强化 | C392: 1004 | D392: =R[-100]C -> 86 | E392: =R[-100]C -> 9 | F392: 9600 | G392: 20 | H392: 9600 | I392: =R[-100]C+1 -> 4 | J392: 25800
A393: 4 | B393: 生命强化 | C393: 1004 | D393: =R[-100]C -> 87 | E393: =R[-100]C -> 9 | F393: 9700 | G393: 20 | H393: 9700 | I393: =R[-100]C+1 -> 4 | J393: 26100
A394: 4 | B394: 生命强化 | C394: 1004 | D394: =R[-100]C -> 88 | E394: =R[-100]C -> 9 | F394: 9800 | G394: 20 | H394: 9800 | I394: =R[-100]C+1 -> 4 | J394: 26400
A395: 4 | B395: 生命强化 | C395: 1004 | D395: =R[-100]C -> 89 | E395: =R[-100]C -> 9 | F395: 9900 | G395: 20 | H395: 9900 | I395: =R[-100]C+1 -> 4 | J395: 26700
A396: 4 | B396: 生命强化 | C396: 1004 | D396: =R[-100]C -> 90 | E396: =R[-100]C -> 9 | F396: 10000 | G396: 20 | H396: 10000 | I396: =R[-100]C+1 -> 4 | J396: 27000
A397: 4 | B397: 生命强化 | C397: 1004 | D397: =R[-100]C -> 91 | E397: =R[-100]C -> 10 | F397: 10100 | G397: 20 | H397: 10100 | I397: =R[-100]C+1 -> 4 | J397: 27300
A398: 4 | B398: 生命强化 | C398: 1004 | D398: =R[-100]C -> 92 | E398: =R[-100]C -> 10 | F398: 10200 | G398: 20 | H398: 10200 | I398: =R[-100]C+1 -> 4 | J398: 27600
A399: 4 | B399: 生命强化 | C399: 1004 | D399: =R[-100]C -> 93 | E399: =R[-100]C -> 10 | F399: 10300 | G399: 20 | H399: 10300 | I399: =R[-100]C+1 -> 4 | J399: 27900
A400: 4 | B400: 生命强化 | C400: 1004 | D400: =R[-100]C -> 94 | E400: =R[-100]C -> 10 | F400: 10400 | G400: 20 | H400: 10400 | I400: =R[-100]C+1 -> 4 | J400: 28200
A401: 4 | B401: 生命强化 | C401: 1004 | D401: =R[-100]C -> 95 | E401: =R[-100]C -> 10 | F401: 10500 | G401: 20 | H401: 10500 | I401: =R[-100]C+1 -> 4 | J401: 28500
A402: 4 | B402: 生命强化 | C402: 1004 | D402: =R[-100]C -> 96 | E402: =R[-100]C -> 10 | F402: 10600 | G402: 20 | H402: 10600 | I402: =R[-100]C+1 -> 4 | J402: 28800
A403: 4 | B403: 生命强化 | C403: 1004 | D403: =R[-100]C -> 97 | E403: =R[-100]C -> 10 | F403: 10700 | G403: 20 | H403: 10700 | I403: =R[-100]C+1 -> 4 | J403: 29100
A404: 4 | B404: 生命强化 | C404: 1004 | D404: =R[-100]C -> 98 | E404: =R[-100]C -> 10 | F404: 10800 | G404: 20 | H404: 10800 | I404: =R[-100]C+1 -> 4 | J404: 29400
A405: 4 | B405: 生命强化 | C405: 1004 | D405: =R[-100]C -> 99 | E405: =R[-100]C -> 10 | F405: 10900 | G405: 20 | H405: 10900 | I405: =R[-100]C+1 -> 4 | J405: 29700
A406: 4 | B406: 生命强化 | C406: 1004 | D406: =R[-100]C -> 100 | E406: =R[-100]C -> 10 | F406: 11000 | G406: 20 | H406: 11000 | I406: =R[-100]C+1 -> 4 | J406: 30000

Sheet: 军团副本
A1: id|id | B1: chapter_bg_id| | C1: chapter_icon_id| | D1: name| | E1: gamelevel_list|map_list | F1: contrapose| | G1: kill_exp|kill_exp | H1: battle_contribution|battle_contribution | I1: kill_contribution|kill_contribution | J1: map_reward_id_list|map_reward_id_list | K1: map_reward_num_list|map_reward_num_list | L1: chapter_reward_list|chapter_reward_list
A2: 不可空 | B2: 可空#不需字段 | C2: 不可空 | D2: 不可空 | E2: 不可空 | F2: 不可空 | G2: 不可空 | H2: 不可空 | I2: 不可空 | J2: 不可空 | K2: 不可空 | L2: 不可空
A3: 数字 | B3: 数字 | C3: 字符串 | D3: 字符串 | E3: 一维数组 | F3: 一维数组 | G3: 数字 | H3: 数字 | I3: 数字 | J3: 一维数组 | K3: 一维数组 | L3: 二维数组
E4: 不定长 | F4: 不定长 | G4: 不定长 | H4: 不定长 | I4: 不定长 | J4: 不定长 | K4: 不定长 | L4: 不定长
A6: 章节 | B6: 章节图标ID | C6: 章节名ID | D6: 名字 | E6: 关卡列表 | F6: 阵容克制 | G6: 击杀奖励工会经验 | H6: 挑战奖励贡献值 | I6: 击杀奖励贡献值 | J6: 关卡奖励ID列表 | K6: 关卡奖励数量列表 | L6: 章节奖励列表 | O6: 10 | P6: 10 | Q6: 10 | R6: 10 | S6: 10 | T6: 10 | U6: 50 | V6: 50 | W6: 20 | X6: 20 | Y6: 20 | Z6: 20 | AA6: 20 | AB6: 20 | AC6: 100 | AD6: 100 | AE6: 10 | AF6: 10 | AG6: 10 | AH6: 10 | AI6: 10 | AJ6: 10 | AK6: 50 | AL6: 50 | AM6: 50000 | AN6: 50000 | AO6: 50000 | AP6: 50000 | AQ6: 50000 | AR6: 50000 | AS6: 250000 | AT6: 250000 | AU6: 100 | AV6: 100 | AW6: 100 | AX6: 100 | AY6: 100 | AZ6: 100 | BA6: 500 | BB6: 500 | BC6: 1000 | BD6: 1000 | BE6: 1000 | BF6: 1000 | BG6: 1000 | BH6: 1000 | BI6: 5000 | BJ6: 5000 | BN6: 1 | BO6: 5 | BP6: 单价
A7: 1 | B7: 1 | C7: 1 | D7: 第一章 混战 | E7: =990+RC[-4]*10&"|"&991+RC[-4]*10&"|"&992+RC[-4]*10 -> 1000|1001|1002 | F7: 0|1|2 | G7: 500 | H7: 210 | I7: 500 | J7: 19005|10022|10004|10004|10004|10004|10004|10004|10004|10004|10010|10010|10010|10010|10010|10010|10010|10010|10014|10014|10014|10014|10014|10014|10014|10014|19003|19003|19003|19003|19003|19003|19003|19003|19006|19006|19006|19006|19006|19006|19006|19006|19012|19012|19012|19012|19012|19012|19012|19012 | K7: =RC[2]&"|"&RC[3]&"|"&RC[4]&"|"&RC[5]&"|"&RC[6]&"|"&RC[7]&"|"&RC[8]&"|"&RC[9]&"|"&RC[10]&"|"&RC[11]&"|"&RC[12]&"|"&RC[13]&"|"&RC[14]&"|"&RC[15]&"|"&RC[16]&"|"&RC[17]&"|"&RC[18]&"|"&RC[19]&"|"&RC[20]&"|"&RC[21]&"|"&RC[22]&"|"&RC[23]&"|"&RC[24]&"|"&RC[25]&"|"&RC[26]&"|"&RC[27]&"|"&RC[28]&"|"&RC[29]&"|"&RC[30]&"|"&RC[31]&"|"&RC[32]&"|"&RC[33]&"|"&RC[34]&"|"&RC[35]&"|"&RC[36]&"|"&RC[37]&"|"&RC[38]&"|"&RC[39]&"|"&RC[40]&"|"&RC[41]&"|"&RC[42]&"|"&RC[43]&"|"&RC[44]&"|"&RC[45]&"|"&RC[46]&"|"&RC[47]&"|"&RC[48]&"|"&RC[49]&"|"&RC[50]&"|"&RC[51] -> 888|10|10|10|10|10|10|10|52|52|21|21|21|21|21|21|105|105|10|10|10|10|10|10|52|52|52500|52500|52500|52500|52500|52500|262500|262500|105|105|105|105|105|105|525|525|1050|1050|1050|1050|1050|1050|5250|5250 | L7: 19005|200#10022|10 | M7: 888 | N7: 10 | O7: =INT(R6C*(1+0.05*RC1)) -> 10 | P7: =INT(R6C*(1+0.05*RC1)) -> 10 | Q7: =INT(R6C*(1+0.05*RC1)) -> 10 | R7: =INT(R6C*(1+0.05*RC1)) -> 10 | S7: =INT(R6C*(1+0.05*RC1)) -> 10 | T7: =INT(R6C*(1+0.05*RC1)) -> 10 | U7: =INT(R6C*(1+0.05*RC1)) -> 52 | V7: =INT(R6C*(1+0.05*RC1)) -> 52 | W7: =INT(R6C*(1+0.05*RC1)) -> 21 | X7: =INT(R6C*(1+0.05*RC1)) -> 21 | Y7: =INT(R6C*(1+0.05*RC1)) -> 21 | Z7: =INT(R6C*(1+0.05*RC1)) -> 21 | AA7: =INT(R6C*(1+0.05*RC1)) -> 21 | AB7: =INT(R6C*(1+0.05*RC1)) -> 21 | AC7: =INT(R6C*(1+0.05*RC1)) -> 105 | AD7: =INT(R6C*(1+0.05*RC1)) -> 105 | AE7: =INT(R6C*(1+0.05*RC1)) -> 10 | AF7: =INT(R6C*(1+0.05*RC1)) -> 10 | AG7: =INT(R6C*(1+0.05*RC1)) -> 10 | AH7: =INT(R6C*(1+0.05*RC1)) -> 10 | AI7: =INT(R6C*(1+0.05*RC1)) -> 10 | AJ7: =INT(R6C*(1+0.05*RC1)) -> 10 | AK7: =INT(R6C*(1+0.05*RC1)) -> 52 | AL7: =INT(R6C*(1+0.05*RC1)) -> 52 | AM7: =INT(R6C*(1+0.05*RC1)) -> 52500 | AN7: =INT(R6C*(1+0.05*RC1)) -> 52500 | AO7: =INT(R6C*(1+0.05*RC1)) -> 52500 | AP7: =INT(R6C*(1+0.05*RC1)) -> 52500 | AQ7: =INT(R6C*(1+0.05*RC1)) -> 52500 | AR7: =INT(R6C*(1+0.05*RC1)) -> 52500 | AS7: =INT(R6C*(1+0.05*RC1)) -> 262500 | AT7: =INT(R6C*(1+0.05*RC1)) -> 262500 | AU7: =INT(R6C*(1+0.05*RC1)) -> 105 | AV7: =INT(R6C*(1+0.05*RC1)) -> 105 | AW7: =INT(R6C*(1+0.05*RC1)) -> 105 | AX7: =INT(R6C*(1+0.05*RC1)) -> 105 | AY7: =INT(R6C*(1+0.05*RC1)) -> 105 | AZ7: =INT(R6C*(1+0.05*RC1)) -> 105 | BA7: =INT(R6C*(1+0.05*RC1)) -> 525 | BB7: =INT(R6C*(1+0.05*RC1)) -> 525 | BC7: =INT(R6C*(1+0.05*RC1)) -> 1050 | BD7: =INT(R6C*(1+0.05*RC1)) -> 1050 | BE7: =INT(R6C*(1+0.05*RC1)) -> 1050 | BF7: =INT(R6C*(1+0.05*RC1)) -> 1050 | BG7: =INT(R6C*(1+0.05*RC1)) -> 1050 | BH7: =INT(R6C*(1+0.05*RC1)) -> 1050 | BI7: =INT(R6C*(1+0.05*RC1)) -> 5250 | BJ7: =INT(R6C*(1+0.05*RC1)) -> 5250 | BL7: 潜能合剂 | BM7: 10004 | BN7: =100/RC[2]*3/2 -> 10 | BO7: =RC66*R6C -> 50 | BP7: 15 | BQ7: =RC[-1]*RC[-2] -> 750
A8: 2 | B8: 2 | C8: 2 | D8: 第二章 杀戮 | E8: =990+RC[-4]*10&"|"&991+RC[-4]*10&"|"&992+RC[-4]*10 -> 1010|1011|1012 | F8: 0|1|2 | G8: 500 | H8: 220 | I8: 500 | J8: 19005|10022|10004|10004|10004|10004|10004|10004|10004|10004|10010|10010|10010|10010|10010|10010|10010|10010|10014|10014|10014|10014|10014|10014|10014|10014|19003|19003|19003|19003|19003|19003|19003|19003|19006|19006|19006|19006|19006|19006|19006|19006|19012|19012|19012|19012|19012|19012|19012|19012 | K8: =RC[2]&"|"&RC[3]&"|"&RC[4]&"|"&RC[5]&"|"&RC[6]&"|"&RC[7]&"|"&RC[8]&"|"&RC[9]&"|"&RC[10]&"|"&RC[11]&"|"&RC[12]&"|"&RC[13]&"|"&RC[14]&"|"&RC[15]&"|"&RC[16]&"|"&RC[17]&"|"&RC[18]&"|"&RC[19]&"|"&RC[20]&"|"&RC[21]&"|"&RC[22]&"|"&RC[23]&"|"&RC[24]&"|"&RC[25]&"|"&RC[26]&"|"&RC[27]&"|"&RC[28]&"|"&RC[29]&"|"&RC[30]&"|"&RC[31]&"|"&RC[32]&"|"&RC[33]&"|"&RC[34]&"|"&RC[35]&"|"&RC[36]&"|"&RC[37]&"|"&RC[38]&"|"&RC[39]&"|"&RC[40]&"|"&RC[41]&"|"&RC[42]&"|"&RC[43]&"|"&RC[44]&"|"&RC[45]&"|"&RC[46]&"|"&RC[47]&"|"&RC[48]&"|"&RC[49]&"|"&RC[50]&"|"&RC[51] -> 888|10|11|11|11|11|11|11|55|55|22|22|22|22|22|22|110|110|11|11|11|11|11|11|55|55|55000|55000|55000|55000|55000|55000|275000|275000|110|110|110|110|110|110|550|550|1100|1100|1100|1100|1100|1100|5500|5500 | L8: 19005|200#19006|500 | M8: 888 | N8: 10 | O8: =INT(R6C*(1+0.05*RC1)) -> 11 | P8: =INT(R6C*(1+0.05*RC1)) -> 11 | Q8: =INT(R6C*(1+0.05*RC1)) -> 11 | R8: =INT(R6C*(1+0.05*RC1)) -> 11 | S8: =INT(R6C*(1+0.05*RC1)) -> 11 | T8: =INT(R6C*(1+0.05*RC1)) -> 11 | U8: =INT(R6C*(1+0.05*RC1)) -> 55 | V8: =INT(R6C*(1+0.05*RC1)) -> 55 | W8: =INT(R6C*(1+0.05*RC1)) -> 22 | X8: =INT(R6C*(1+0.05*RC1)) -> 22 | Y8: =INT(R6C*(1+0.05*RC1)) -> 22 | Z8: =INT(R6C*(1+0.05*RC1)) -> 22 | AA8: =INT(R6C*(1+0.05*RC1)) -> 22 | AB8: =INT(R6C*(1+0.05*RC1)) -> 22 | AC8: =INT(R6C*(1+0.05*RC1)) -> 110 | AD8: =INT(R6C*(1+0.05*RC1)) -> 110 | AE8: =INT(R6C*(1+0.05*RC1)) -> 11 | AF8: =INT(R6C*(1+0.05*RC1)) -> 11 | AG8: =INT(R6C*(1+0.05*RC1)) -> 11 | AH8: =INT(R6C*(1+0.05*RC1)) -> 11 | AI8: =INT(R6C*(1+0.05*RC1)) -> 11 | AJ8: =INT(R6C*(1+0.05*RC1)) -> 11 | AK8: =INT(R6C*(1+0.05*RC1)) -> 55 | AL8: =INT(R6C*(1+0.05*RC1)) -> 55 | AM8: =INT(R6C*(1+0.05*RC1)) -> 55000 | AN8: =INT(R6C*(1+0.05*RC1)) -> 55000 | AO8: =INT(R6C*(1+0.05*RC1)) -> 55000 | AP8: =INT(R6C*(1+0.05*RC1)) -> 55000 | AQ8: =INT(R6C*(1+0.05*RC1)) -> 55000 | AR8: =INT(R6C*(1+0.05*RC1)) -> 55000 | AS8: =INT(R6C*(1+0.05*RC1)) -> 275000 | AT8: =INT(R6C*(1+0.05*RC1)) -> 275000 | AU8: =INT(R6C*(1+0.05*RC1)) -> 110 | AV8: =INT(R6C*(1+0.05*RC1)) -> 110 | AW8: =INT(R6C*(1+0.05*RC1)) -> 110 | AX8: =INT(R6C*(1+0.05*RC1)) -> 110 | AY8: =INT(R6C*(1+0.05*RC1)) -> 110 | AZ8: =INT(R6C*(1+0.05*RC1)) -> 110 | BA8: =INT(R6C*(1+0.05*RC1)) -> 550 | BB8: =INT(R6C*(1+0.05*RC1)) -> 550 | BC8: =INT(R6C*(1+0.05*RC1)) -> 1100 | BD8: =INT(R6C*(1+0.05*RC1)) -> 1100 | BE8: =INT(R6C*(1+0.05*RC1)) -> 1100 | BF8: =INT(R6C*(1+0.05*RC1)) -> 1100 | BG8: =INT(R6C*(1+0.05*RC1)) -> 1100 | BH8: =INT(R6C*(1+0.05*RC1)) -> 1100 | BI8: =INT(R6C*(1+0.05*RC1)) -> 5500 | BJ8: =INT(R6C*(1+0.05*RC1)) -> 5500 | BL8: 圣器精炼石 | BM8: 10010 | BN8: =100/RC[2] -> 20 | BO8: =RC66*R6C -> 100 | BP8: 5 | BQ8: =RC[-1]*RC[-2] -> 500
A9: 3 | B9: 3 | C9: 3 | D9: 第三章 攻坚 | E9: =990+RC[-4]*10&"|"&991+RC[-4]*10&"|"&992+RC[-4]*10 -> 1020|1021|1022 | F9: 0|1|2 | G9: 500 | H9: 230 | I9: 500 | J9: 19005|10022|10004|10004|10004|10004|10004|10004|10004|10004|10010|10010|10010|10010|10010|10010|10010|10010|10014|10014|10014|10014|10014|10014|10014|10014|19003|19003|19003|19003|19003|19003|19003|19003|19006|19006|19006|19006|19006|19006|19006|19006|19012|19012|19012|19012|19012|19012|19012|19012 | K9: =RC[2]&"|"&RC[3]&"|"&RC[4]&"|"&RC[5]&"|"&RC[6]&"|"&RC[7]&"|"&RC[8]&"|"&RC[9]&"|"&RC[10]&"|"&RC[11]&"|"&RC[12]&"|"&RC[13]&"|"&RC[14]&"|"&RC[15]&"|"&RC[16]&"|"&RC[17]&"|"&RC[18]&"|"&RC[19]&"|"&RC[20]&"|"&RC[21]&"|"&RC[22]&"|"&RC[23]&"|"&RC[24]&"|"&RC[25]&"|"&RC[26]&"|"&RC[27]&"|"&RC[28]&"|"&RC[29]&"|"&RC[30]&"|"&RC[31]&"|"&RC[32]&"|"&RC[33]&"|"&RC[34]&"|"&RC[35]&"|"&RC[36]&"|"&RC[37]&"|"&RC[38]&"|"&RC[39]&"|"&RC[40]&"|"&RC[41]&"|"&RC[42]&"|"&RC[43]&"|"&RC[44]&"|"&RC[45]&"|"&RC[46]&"|"&RC[47]&"|"&RC[48]&"|"&RC[49]&"|"&RC[50]&"|"&RC[51] -> 888|10|11|11|11|11|11|11|57|57|23|23|23|23|23|23|115|115|11|11|11|11|11|11|57|57|57500|57500|57500|57500|57500|57500|287500|287500|115|115|115|115|115|115|575|575|1150|1150|1150|1150|1150|1150|5750|5750 | L9: 19005|200#19012|5000 | M9: 888 | N9: 10 | O9: =INT(R6C*(1+0.05*RC1)) -> 11 | P9: =INT(R6C*(1+0.05*RC1)) -> 11 | Q9: =INT(R6C*(1+0.05*RC1)) -> 11 | R9: =INT(R6C*(1+0.05*RC1)) -> 11 | S9: =INT(R6C*(1+0.05*RC1)) -> 11 | T9: =INT(R6C*(1+0.05*RC1)) -> 11 | U9: =INT(R6C*(1+0.05*RC1)) -> 57 | V9: =INT(R6C*(1+0.05*RC1)) -> 57 | W9: =INT(R6C*(1+0.05*RC1)) -> 23 | X9: =INT(R6C*(1+0.05*RC1)) -> 23 | Y9: =INT(R6C*(1+0.05*RC1)) -> 23 | Z9: =INT(R6C*(1+0.05*RC1)) -> 23 | AA9: =INT(R6C*(1+0.05*RC1)) -> 23 | AB9: =INT(R6C*(1+0.05*RC1)) -> 23 | AC9: =INT(R6C*(1+0.05*RC1)) -> 115 | AD9: =INT(R6C*(1+0.05*RC1)) -> 115 | AE9: =INT(R6C*(1+0.05*RC1)) -> 11 | AF9: =INT(R6C*(1+0.05*RC1)) -> 11 | AG9: =INT(R6C*(1+0.05*RC1)) -> 11 | AH9: =INT(R6C*(1+0.05*RC1)) -> 11 | AI9: =INT(R6C*(1+0.05*RC1)) -> 11 | AJ9: =INT(R6C*(1+0.05*RC1)) -> 11 | AK9: =INT(R6C*(1+0.05*RC1)) -> 57 | AL9: =INT(R6C*(1+0.05*RC1)) -> 57 | AM9: =INT(R6C*(1+0.05*RC1)) -> 57500 | AN9: =INT(R6C*(1+0.05*RC1)) -> 57500 | AO9: =INT(R6C*(1+0.05*RC1)) -> 57500 | AP9: =INT(R6C*(1+0.05*RC1)) -> 57500 | AQ9: =INT(R6C*(1+0.05*RC1)) -> 57500 | AR9: =INT(R6C*(1+0.05*RC1)) -> 57500 | AS9: =INT(R6C*(1+0.05*RC1)) -> 287500 | AT9: =INT(R6C*(1+0.05*RC1)) -> 287500 | AU9: =INT(R6C*(1+0.05*RC1)) -> 115 | AV9: =INT(R6C*(1+0.05*RC1)) -> 115 | AW9: =INT(R6C*(1+0.05*RC1)) -> 115 | AX9: =INT(R6C*(1+0.05*RC1)) -> 115 | AY9: =INT(R6C*(1+0.05*RC1)) -> 115 | AZ9: =INT(R6C*(1+0.05*RC1)) -> 115 | BA9: =INT(R6C*(1+0.05*RC1)) -> 575 | BB9: =INT(R6C*(1+0.05*RC1)) -> 575 | BC9: =INT(R6C*(1+0.05*RC1)) -> 1150 | BD9: =INT(R6C*(1+0.05*RC1)) -> 1150 | BE9: =INT(R6C*(1+0.05*RC1)) -> 1150 | BF9: =INT(R6C*(1+0.05*RC1)) -> 1150 | BG9: =INT(R6C*(1+0.05*RC1)) -> 1150 | BH9: =INT(R6C*(1+0.05*RC1)) -> 1150 | BI9: =INT(R6C*(1+0.05*RC1)) -> 5750 | BJ9: =INT(R6C*(1+0.05*RC1)) -> 5750 | BL9: 紫品精炼石 | BM9: 10014 | BN9: =100/RC[2] -> 10 | BO9: =RC66*R6C -> 50 | BP9: 10 | BQ9: =RC[-1]*RC[-2] -> 500
A10: 4 | B10: 1 | C10: 4 | D10: 第四章 倾巢 | E10: =990+RC[-4]*10&"|"&991+RC[-4]*10&"|"&992+RC[-4]*10 -> 1030|1031|1032 | F10: 0|1|2 | G10: 500 | H10: 240 | I10: 500 | J10: 19005|10022|10004|10004|10004|10004|10004|10004|10004|10004|10010|10010|10010|10010|10010|10010|10010|10010|10014|10014|10014|10014|10014|10014|10014|10014|19003|19003|19003|19003|19003|19003|19003|19003|19006|19006|19006|19006|19006|19006|19006|19006|19012|19012|19012|19012|19012|19012|19012|19012 | K10: =RC[2]&"|"&RC[3]&"|"&RC[4]&"|"&RC[5]&"|"&RC[6]&"|"&RC[7]&"|"&RC[8]&"|"&RC[9]&"|"&RC[10]&"|"&RC[11]&"|"&RC[12]&"|"&RC[13]&"|"&RC[14]&"|"&RC[15]&"|"&RC[16]&"|"&RC[17]&"|"&RC[18]&"|"&RC[19]&"|"&RC[20]&"|"&RC[21]&"|"&RC[22]&"|"&RC[23]&"|"&RC[24]&"|"&RC[25]&"|"&RC[26]&"|"&RC[27]&"|"&RC[28]&"|"&RC[29]&"|"&RC[30]&"|"&RC[31]&"|"&RC[32]&"|"&RC[33]&"|"&RC[34]&"|"&RC[35]&"|"&RC[36]&"|"&RC[37]&"|"&RC[38]&"|"&RC[39]&"|"&RC[40]&"|"&RC[41]&"|"&RC[42]&"|"&RC[43]&"|"&RC[44]&"|"&RC[45]&"|"&RC[46]&"|"&RC[47]&"|"&RC[48]&"|"&RC[49]&"|"&RC[50]&"|"&RC[51] -> 888|10|12|12|12|12|12|12|60|60|24|24|24|24|24|24|120|120|12|12|12|12|12|12|60|60|60000|60000|60000|60000|60000|60000|300000|300000|120|120|120|120|120|120|600|600|1200|1200|1200|1200|1200|1200|6000|6000 | L10: 19005|200#19103|50 | M10: 888 | N10: 10 | O10: =INT(R6C*(1+0.05*RC1)) -> 12 | P10: =INT(R6C*(1+0.05*RC1)) -> 12 | Q10: =INT(R6C*(1+0.05*RC1)) -> 12 | R10: =INT(R6C*(1+0.05*RC1)) -> 12 | S10: =INT(R6C*(1+0.05*RC1)) -> 12 | T10: =INT(R6C*(1+0.05*RC1)) -> 12 | U10: =INT(R6C*(1+0.05*RC1)) -> 60 | V10: =INT(R6C*(1+0.05*RC1)) -> 60 | W10: =INT(R6C*(1+0.05*RC1)) -> 24 | X10: =INT(R6C*(1+0.05*RC1)) -> 24 | Y10: =INT(R6C*(1+0.05*RC1)) -> 24 | Z10: =INT(R6C*(1+0.05*RC1)) -> 24 | AA10: =INT(R6C*(1+0.05*RC1)) -> 24 | AB10: =INT(R6C*(1+0.05*RC1)) -> 24 | AC10: =INT(R6C*(1+0.05*RC1)) -> 120 | AD10: =INT(R6C*(1+0.05*RC1)) -> 120 | AE10: =INT(R6C*(1+0.05*RC1)) -> 12 | AF10: =INT(R6C*(1+0.05*RC1)) -> 12 | AG10: =INT(R6C*(1+0.05*RC1)) -> 12 | AH10: =INT(R6C*(1+0.05*RC1)) -> 12 | AI10: =INT(R6C*(1+0.05*RC1)) -> 12 | AJ10: =INT(R6C*(1+0.05*RC1)) -> 12 | AK10: =INT(R6C*(1+0.05*RC1)) -> 60 | AL10: =INT(R6C*(1+0.05*RC1)) -> 60 | AM10: =INT(R6C*(1+0.05*RC1)) -> 60000 | AN10: =INT(R6C*(1+0.05*RC1)) -> 60000 | AO10: =INT(R6C*(1+0.05*RC1)) -> 60000 | AP10: =INT(R6C*(1+0.05*RC1)) -> 60000 | AQ10: =INT(R6C*(1+0.05*RC1)) -> 60000 | AR10: =INT(R6C*(1+0.05*RC1)) -> 60000 | AS10: =INT(R6C*(1+0.05*RC1)) -> 300000 | AT10: =INT(R6C*(1+0.05*RC1)) -> 300000 | AU10: =INT(R6C*(1+0.05*RC1)) -> 120 | AV10: =INT(R6C*(1+0.05*RC1)) -> 120 | AW10: =INT(R6C*(1+0.05*RC1)) -> 120 | AX10: =INT(R6C*(1+0.05*RC1)) -> 120 | AY10: =INT(R6C*(1+0.05*RC1)) -> 120 | AZ10: =INT(R6C*(1+0.05*RC1)) -> 120 | BA10: =INT(R6C*(1+0.05*RC1)) -> 600 | BB10: =INT(R6C*(1+0.05*RC1)) -> 600 | BC10: =INT(R6C*(1+0.05*RC1)) -> 1200 | BD10: =INT(R6C*(1+0.05*RC1)) -> 1200 | BE10: =INT(R6C*(1+0.05*RC1)) -> 1200 | BF10: =INT(R6C*(1+0.05*RC1)) -> 1200 | BG10: =INT(R6C*(1+0.05*RC1)) -> 1200 | BH10: =INT(R6C*(1+0.05*RC1)) -> 1200 | BI10: =INT(R6C*(1+0.05*RC1)) -> 6000 | BJ10: =INT(R6C*(1+0.05*RC1)) -> 6000 | BL10: 金币 | BM10: 19003 | BN10: =100/RC[2]/2 -> 50000 | BO10: =RC66*R6C -> 250000 | BP10: 0.001 | BQ10: =RC[-1]*RC[-2] -> 250
A11: 5 | B11: 2 | C11: 5 | D11: 第五章 战争 | E11: =990+RC[-4]*10&"|"&991+RC[-4]*10&"|"&992+RC[-4]*10 -> 1040|1041|1042 | F11: 0|1|2 | G11: 500 | H11: 250 | I11: 500 | J11: 19005|10022|10004|10004|10004|10004|10004|10004|10004|10004|10010|10010|10010|10010|10010|10010|10010|10010|10014|10014|10014|10014|10014|10014|10014|10014|19003|19003|19003|19003|19003|19003|19003|19003|19006|19006|19006|19006|19006|19006|19006|19006|19012|19012|19012|19012|19012|19012|19012|19012 | K11: =RC[2]&"|"&RC[3]&"|"&RC[4]&"|"&RC[5]&"|"&RC[6]&"|"&RC[7]&"|"&RC[8]&"|"&RC[9]&"|"&RC[10]&"|"&RC[11]&"|"&RC[12]&"|"&RC[13]&"|"&RC[14]&"|"&RC[15]&"|"&RC[16]&"|"&RC[17]&"|"&RC[18]&"|"&RC[19]&"|"&RC[20]&"|"&RC[21]&"|"&RC[22]&"|"&RC[23]&"|"&RC[24]&"|"&RC[25]&"|"&RC[26]&"|"&RC[27]&"|"&RC[28]&"|"&RC[29]&"|"&RC[30]&"|"&RC[31]&"|"&RC[32]&"|"&RC[33]&"|"&RC[34]&"|"&RC[35]&"|"&RC[36]&"|"&RC[37]&"|"&RC[38]&"|"&RC[39]&"|"&RC[40]&"|"&RC[41]&"|"&RC[42]&"|"&RC[43]&"|"&RC[44]&"|"&RC[45]&"|"&RC[46]&"|"&RC[47]&"|"&RC[48]&"|"&RC[49]&"|"&RC[50]&"|"&RC[51] -> 888|10|12|12|12|12|12|12|62|62|25|25|25|25|25|25|125|125|12|12|12|12|12|12|62|62|62500|62500|62500|62500|62500|62500|312500|312500|125|125|125|125|125|125|625|625|1250|1250|1250|1250|1250|1250|6250|6250 | L11: 19005|200#10022|10 | M11: 888 | N11: 10 | O11: =INT(R6C*(1+0.05*RC1)) -> 12 | P11: =INT(R6C*(1+0.05*RC1)) -> 12 | Q11: =INT(R6C*(1+0.05*RC1)) -> 12 | R11: =INT(R6C*(1+0.05*RC1)) -> 12 | S11: =INT(R6C*(1+0.05*RC1)) -> 12 | T11: =INT(R6C*(1+0.05*RC1)) -> 12 | U11: =INT(R6C*(1+0.05*RC1)) -> 62 | V11: =INT(R6C*(1+0.05*RC1)) -> 62 | W11: =INT(R6C*(1+0.05*RC1)) -> 25 | X11: =INT(R6C*(1+0.05*RC1)) -> 25 | Y11: =INT(R6C*(1+0.05*RC1)) -> 25 | Z11: =INT(R6C*(1+0.05*RC1)) -> 25 | AA11: =INT(R6C*(1+0.05*RC1)) -> 25 | AB11: =INT(R6C*(1+0.05*RC1)) -> 25 | AC11: =INT(R6C*(1+0.05*RC1)) -> 125 | AD11: =INT(R6C*(1+0.05*RC1)) -> 125 | AE11: =INT(R6C*(1+0.05*RC1)) -> 12 | AF11: =INT(R6C*(1+0.05*RC1)) -> 12 | AG11: =INT(R6C*(1+0.05*RC1)) -> 12 | AH11: =INT(R6C*(1+0.05*RC1)) -> 12 | AI11: =INT(R6C*(1+0.05*RC1)) -> 12 | AJ11: =INT(R6C*(1+0.05*RC1)) -> 12 | AK11: =INT(R6C*(1+0.05*RC1)) -> 62 | AL11: =INT(R6C*(1+0.05*RC1)) -> 62 | AM11: =INT(R6C*(1+0.05*RC1)) -> 62500 | AN11: =INT(R6C*(1+0.05*RC1)) -> 62500 | AO11: =INT(R6C*(1+0.05*RC1)) -> 62500 | AP11: =INT(R6C*(1+0.05*RC1)) -> 62500 | AQ11: =INT(R6C*(1+0.05*RC1)) -> 62500 | AR11: =INT(R6C*(1+0.05*RC1)) -> 62500 | AS11: =INT(R6C*(1+0.05*RC1)) -> 312500 | AT11: =INT(R6C*(1+0.05*RC1)) -> 312500 | AU11: =INT(R6C*(1+0.05*RC1)) -> 125 | AV11: =INT(R6C*(1+0.05*RC1)) -> 125 | AW11: =INT(R6C*(1+0.05*RC1)) -> 125 | AX11: =INT(R6C*(1+0.05*RC1)) -> 125 | AY11: =INT(R6C*(1+0.05*RC1)) -> 125 | AZ11: =INT(R6C*(1+0.05*RC1)) -> 125 | BA11: =INT(R6C*(1+0.05*RC1)) -> 625 | BB11: =INT(R6C*(1+0.05*RC1)) -> 625 | BC11: =INT(R6C*(1+0.05*RC1)) -> 1250 | BD11: =INT(R6C*(1+0.05*RC1)) -> 1250 | BE11: =INT(R6C*(1+0.05*RC1)) -> 1250 | BF11: =INT(R6C*(1+0.05*RC1)) -> 1250 | BG11: =INT(R6C*(1+0.05*RC1)) -> 1250 | BH11: =INT(R6C*(1+0.05*RC1)) -> 1250 | BI11: =INT(R6C*(1+0.05*RC1)) -> 6250 | BJ11: =INT(R6C*(1+0.05*RC1)) -> 6250 | BL11: 魂晶 | BM11: 19006 | BN11: =100/RC[2] -> 100 | BO11: =RC66*R6C -> 500 | BP11: 1 | BQ11: =RC[-1]*RC[-2] -> 500
A12: 6 | B12: 3 | C12: 6 | D12: 第六章 精准 | E12: =990+RC[-4]*10&"|"&991+RC[-4]*10&"|"&992+RC[-4]*10 -> 1050|1051|1052 | F12: 0|1|2 | G12: 500 | H12: 260 | I12: 500 | J12: 19005|10022|10004|10004|10004|10004|10004|10004|10004|10004|10010|10010|10010|10010|10010|10010|10010|10010|10014|10014|10014|10014|10014|10014|10014|10014|19003|19003|19003|19003|19003|19003|19003|19003|19006|19006|19006|19006|19006|19006|19006|19006|19012|19012|19012|19012|19012|19012|19012|19012 | K12: =RC[2]&"|"&RC[3]&"|"&RC[4]&"|"&RC[5]&"|"&RC[6]&"|"&RC[7]&"|"&RC[8]&"|"&RC[9]&"|"&RC[10]&"|"&RC[11]&"|"&RC[12]&"|"&RC[13]&"|"&RC[14]&"|"&RC[15]&"|"&RC[16]&"|"&RC[17]&"|"&RC[18]&"|"&RC[19]&"|"&RC[20]&"|"&RC[21]&"|"&RC[22]&"|"&RC[23]&"|"&RC[24]&"|"&RC[25]&"|"&RC[26]&"|"&RC[27]&"|"&RC[28]&"|"&RC[29]&"|"&RC[30]&"|"&RC[31]&"|"&RC[32]&"|"&RC[33]&"|"&RC[34]&"|"&RC[35]&"|"&RC[36]&"|"&RC[37]&"|"&RC[38]&"|"&RC[39]&"|"&RC[40]&"|"&RC[41]&"|"&RC[42]&"|"&RC[43]&"|"&RC[44]&"|"&RC[45]&"|"&RC[46]&"|"&RC[47]&"|"&RC[48]&"|"&RC[49]&"|"&RC[50]&"|"&RC[51] -> 888|10|13|13|13|13|13|13|65|65|26|26|26|26|26|26|130|130|13|13|13|13|13|13|65|65|65000|65000|65000|65000|65000|65000|325000|325000|130|130|130|130|130|130|650|650|1300|1300|1300|1300|1300|1300|6500|6500 | L12: 19005|200#19006|500 | M12: 888 | N12: 10 | O12: =INT(R6C*(1+0.05*RC1)) -> 13 | P12: =INT(R6C*(1+0.05*RC1)) -> 13 | Q12: =INT(R6C*(1+0.05*RC1)) -> 13 | R12: =INT(R6C*(1+0.05*RC1)) -> 13 | S12: =INT(R6C*(1+0.05*RC1)) -> 13 | T12: =INT(R6C*(1+0.05*RC1)) -> 13 | U12: =INT(R6C*(1+0.05*RC1)) -> 65 | V12: =INT(R6C*(1+0.05*RC1)) -> 65 | W12: =INT(R6C*(1+0.05*RC1)) -> 26 | X12: =INT(R6C*(1+0.05*RC1)) -> 26 | Y12: =INT(R6C*(1+0.05*RC1)) -> 26 | Z12: =INT(R6C*(1+0.05*RC1)) -> 26 | AA12: =INT(R6C*(1+0.05*RC1)) -> 26 | AB12: =INT(R6C*(1+0.05*RC1)) -> 26 | AC12: =INT(R6C*(1+0.05*RC1)) -> 130 | AD12: =INT(R6C*(1+0.05*RC1)) -> 130 | AE12: =INT(R6C*(1+0.05*RC1)) -> 13 | AF12: =INT(R6C*(1+0.05*RC1)) -> 13 | AG12: =INT(R6C*(1+0.05*RC1)) -> 13 | AH12: =INT(R6C*(1+0.05*RC1)) -> 13 | AI12: =INT(R6C*(1+0.05*RC1)) -> 13 | AJ12: =INT(R6C*(1+0.05*RC1)) -> 13 | AK12: =INT(R6C*(1+0.05*RC1)) -> 65 | AL12: =INT(R6C*(1+0.05*RC1)) -> 65 | AM12: =INT(R6C*(1+0.05*RC1)) -> 65000 | AN12: =INT(R6C*(1+0.05*RC1)) -> 65000 | AO12: =INT(R6C*(1+0.05*RC1)) -> 65000 | AP12: =INT(R6C*(1+0.05*RC1)) -> 65000 | AQ12: =INT(R6C*(1+0.05*RC1)) -> 65000 | AR12: =INT(R6C*(1+0.05*RC1)) -> 65000 | AS12: =INT(R6C*(1+0.05*RC1)) -> 325000 | AT12: =INT(R6C*(1+0.05*RC1)) -> 325000 | AU12: =INT(R6C*(1+0.05*RC1)) -> 130 | AV12: =INT(R6C*(1+0.05*RC1)) -> 130 | AW12: =INT(R6C*(1+0.05*RC1)) -> 130 | AX12: =INT(R6C*(1+0.05*RC1)) -> 130 | AY12: =INT(R6C*(1+0.05*RC1)) -> 130 | AZ12: =INT(R6C*(1+0.05*RC1)) -> 130 | BA12: =INT(R6C*(1+0.05*RC1)) -> 650 | BB12: =INT(R6C*(1+0.05*RC1)) -> 650 | BC12: =INT(R6C*(1+0.05*RC1)) -> 1300 | BD12: =INT(R6C*(1+0.05*RC1)) -> 1300 | BE12: =INT(R6C*(1+0.05*RC1)) -> 1300 | BF12: =INT(R6C*(1+0.05*RC1)) -> 1300 | BG12: =INT(R6C*(1+0.05*RC1)) -> 1300 | BH12: =INT(R6C*(1+0.05*RC1)) -> 1300 | BI12: =INT(R6C*(1+0.05*RC1)) -> 6500 | BJ12: =INT(R6C*(1+0.05*RC1)) -> 6500 | BL12: 威名 | BM12: 19012 | BN12: =100/RC[2] -> 1000 | BO12: =RC66*R6C -> 5000 | BP12: 0.1 | BQ12: =RC[-1]*RC[-2] -> 500
A13: 7 | B13: 1 | C13: 7 | D13: 第七章 盛宴 | E13: =990+RC[-4]*10&"|"&991+RC[-4]*10&"|"&992+RC[-4]*10 -> 1060|1061|1062 | F13: 0|1|2 | G13: 500 | H13: 270 | I13: 500 | J13: 19005|10022|10004|10004|10004|10004|10004|10004|10004|10004|10010|10010|10010|10010|10010|10010|10010|10010|10014|10014|10014|10014|10014|10014|10014|10014|19003|19003|19003|19003|19003|19003|19003|19003|19006|19006|19006|19006|19006|19006|19006|19006|19012|19012|19012|19012|19012|19012|19012|19012 | K13: =RC[2]&"|"&RC[3]&"|"&RC[4]&"|"&RC[5]&"|"&RC[6]&"|"&RC[7]&"|"&RC[8]&"|"&RC[9]&"|"&RC[10]&"|"&RC[11]&"|"&RC[12]&"|"&RC[13]&"|"&RC[14]&"|"&RC[15]&"|"&RC[16]&"|"&RC[17]&"|"&RC[18]&"|"&RC[19]&"|"&RC[20]&"|"&RC[21]&"|"&RC[22]&"|"&RC[23]&"|"&RC[24]&"|"&RC[25]&"|"&RC[26]&"|"&RC[27]&"|"&RC[28]&"|"&RC[29]&"|"&RC[30]&"|"&RC[31]&"|"&RC[32]&"|"&RC[33]&"|"&RC[34]&"|"&RC[35]&"|"&RC[36]&"|"&RC[37]&"|"&RC[38]&"|"&RC[39]&"|"&RC[40]&"|"&RC[41]&"|"&RC[42]&"|"&RC[43]&"|"&RC[44]&"|"&RC[45]&"|"&RC[46]&"|"&RC[47]&"|"&RC[48]&"|"&RC[49]&"|"&RC[50]&"|"&RC[51] -> 888|10|13|13|13|13|13|13|67|67|27|27|27|27|27|27|135|135|13|13|13|13|13|13|67|67|67500|67500|67500|67500|67500|67500|337500|337500|135|135|135|135|135|135|675|675|1350|1350|1350|1350|1350|1350|6750|6750 | L13: 19005|200#19012|5000 | M13: 888 | N13: 10 | O13: =INT(R6C*(1+0.05*RC1)) -> 13 | P13: =INT(R6C*(1+0.05*RC1)) -> 13 | Q13: =INT(R6C*(1+0.05*RC1)) -> 13 | R13: =INT(R6C*(1+0.05*RC1)) -> 13 | S13: =INT(R6C*(1+0.05*RC1)) -> 13 | T13: =INT(R6C*(1+0.05*RC1)) -> 13 | U13: =INT(R6C*(1+0.05*RC1)) -> 67 | V13: =INT(R6C*(1+0.05*RC1)) -> 67 | W13: =INT(R6C*(1+0.05*RC1)) -> 27 | X13: =INT(R6C*(1+0.05*RC1)) -> 27 | Y13: =INT(R6C*(1+0.05*RC1)) -> 27 | Z13: =INT(R6C*(1+0.05*RC1)) -> 27 | AA13: =INT(R6C*(1+0.05*RC1)) -> 27 | AB13: =INT(R6C*(1+0.05*RC1)) -> 27 | AC13: =INT(R6C*(1+0.05*RC1)) -> 135 | AD13: =INT(R6C*(1+0.05*RC1)) -> 135 | AE13: =INT(R6C*(1+0.05*RC1)) -> 13 | AF13: =INT(R6C*(1+0.05*RC1)) -> 13 | AG13: =INT(R6C*(1+0.05*RC1)) -> 13 | AH13: =INT(R6C*(1+0.05*RC1)) -> 13 | AI13: =INT(R6C*(1+0.05*RC1)) -> 13 | AJ13: =INT(R6C*(1+0.05*RC1)) -> 13 | AK13: =INT(R6C*(1+0.05*RC1)) -> 67 | AL13: =INT(R6C*(1+0.05*RC1)) -> 67 | AM13: =INT(R6C*(1+0.05*RC1)) -> 67500 | AN13: =INT(R6C*(1+0.05*RC1)) -> 67500 | AO13: =INT(R6C*(1+0.05*RC1)) -> 67500 | AP13: =INT(R6C*(1+0.05*RC1)) -> 67500 | AQ13: =INT(R6C*(1+0.05*RC1)) -> 67500 | AR13: =INT(R6C*(1+0.05*RC1)) -> 67500 | AS13: =INT(R6C*(1+0.05*RC1)) -> 337500 | AT13: =INT(R6C*(1+0.05*RC1)) -> 337500 | AU13: =INT(R6C*(1+0.05*RC1)) -> 135 | AV13: =INT(R6C*(1+0.05*RC1)) -> 135 | AW13: =INT(R6C*(1+0.05*RC1)) -> 135 | AX13: =INT(R6C*(1+0.05*RC1)) -> 135 | AY13: =INT(R6C*(1+0.05*RC1)) -> 135 | AZ13: =INT(R6C*(1+0.05*RC1)) -> 135 | BA13: =INT(R6C*(1+0.05*RC1)) -> 675 | BB13: =INT(R6C*(1+0.05*RC1)) -> 675 | BC13: =INT(R6C*(1+0.05*RC1)) -> 1350 | BD13: =INT(R6C*(1+0.05*RC1)) -> 1350 | BE13: =INT(R6C*(1+0.05*RC1)) -> 1350 | BF13: =INT(R6C*(1+0.05*RC1)) -> 1350 | BG13: =INT(R6C*(1+0.05*RC1)) -> 1350 | BH13: =INT(R6C*(1+0.05*RC1)) -> 1350 | BI13: =INT(R6C*(1+0.05*RC1)) -> 6750 | BJ13: =INT(R6C*(1+0.05*RC1)) -> 6750 | BL13: 精灵精华 | BM13: 10022 | BO13: 10 | BP13: 50 | BQ13: =RC[-1]*RC[-2] -> 500
A14: 8 | B14: 2 | C14: 8 | D14: 第八章 光明 | E14: =990+RC[-4]*10&"|"&991+RC[-4]*10&"|"&992+RC[-4]*10 -> 1070|1071|1072 | F14: 0|1|2 | G14: 500 | H14: 280 | I14: 500 | J14: 19005|10022|10004|10004|10004|10004|10004|10004|10004|10004|10010|10010|10010|10010|10010|10010|10010|10010|10014|10014|10014|10014|10014|10014|10014|10014|19003|19003|19003|19003|19003|19003|19003|19003|19006|19006|19006|19006|19006|19006|19006|19006|19012|19012|19012|19012|19012|19012|19012|19012 | K14: =RC[2]&"|"&RC[3]&"|"&RC[4]&"|"&RC[5]&"|"&RC[6]&"|"&RC[7]&"|"&RC[8]&"|"&RC[9]&"|"&RC[10]&"|"&RC[11]&"|"&RC[12]&"|"&RC[13]&"|"&RC[14]&"|"&RC[15]&"|"&RC[16]&"|"&RC[17]&"|"&RC[18]&"|"&RC[19]&"|"&RC[20]&"|"&RC[21]&"|"&RC[22]&"|"&RC[23]&"|"&RC[24]&"|"&RC[25]&"|"&RC[26]&"|"&RC[27]&"|"&RC[28]&"|"&RC[29]&"|"&RC[30]&"|"&RC[31]&"|"&RC[32]&"|"&RC[33]&"|"&RC[34]&"|"&RC[35]&"|"&RC[36]&"|"&RC[37]&"|"&RC[38]&"|"&RC[39]&"|"&RC[40]&"|"&RC[41]&"|"&RC[42]&"|"&RC[43]&"|"&RC[44]&"|"&RC[45]&"|"&RC[46]&"|"&RC[47]&"|"&RC[48]&"|"&RC[49]&"|"&RC[50]&"|"&RC[51] -> 888|10|14|14|14|14|14|14|70|70|28|28|28|28|28|28|140|140|14|14|14|14|14|14|70|70|70000|70000|70000|70000|70000|70000|350000|350000|140|140|140|140|140|140|700|700|1400|1400|1400|1400|1400|1400|7000|7000 | L14: 19005|200#19103|50 | M14: 888 | N14: 10 | O14: =INT(R6C*(1+0.05*RC1)) -> 14 | P14: =INT(R6C*(1+0.05*RC1)) -> 14 | Q14: =INT(R6C*(1+0.05*RC1)) -> 14 | R14: =INT(R6C*(1+0.05*RC1)) -> 14 | S14: =INT(R6C*(1+0.05*RC1)) -> 14 | T14: =INT(R6C*(1+0.05*RC1)) -> 14 | U14: =INT(R6C*(1+0.05*RC1)) -> 70 | V14: =INT(R6C*(1+0.05*RC1)) -> 70 | W14: =INT(R6C*(1+0.05*RC1)) -> 28 | X14: =INT(R6C*(1+0.05*RC1)) -> 28 | Y14: =INT(R6C*(1+0.05*RC1)) -> 28 | Z14: =INT(R6C*(1+0.05*RC1)) -> 28 | AA14: =INT(R6C*(1+0.05*RC1)) -> 28 | AB14: =INT(R6C*(1+0.05*RC1)) -> 28 | AC14: =INT(R6C*(1+0.05*RC1)) -> 140 | AD14: =INT(R6C*(1+0.05*RC1)) -> 140 | AE14: =INT(R6C*(1+0.05*RC1)) -> 14 | AF14: =INT(R6C*(1+0.05*RC1)) -> 14 | AG14: =INT(R6C*(1+0.05*RC1)) -> 14 | AH14: =INT(R6C*(1+0.05*RC1)) -> 14 | AI14: =INT(R6C*(1+0.05*RC1)) -> 14 | AJ14: =INT(R6C*(1+0.05*RC1)) -> 14 | AK14: =INT(R6C*(1+0.05*RC1)) -> 70 | AL14: =INT(R6C*(1+0.05*RC1)) -> 70 | AM14: =INT(R6C*(1+0.05*RC1)) -> 70000 | AN14: =INT(R6C*(1+0.05*RC1)) -> 70000 | AO14: =INT(R6C*(1+0.05*RC1)) -> 70000 | AP14: =INT(R6C*(1+0.05*RC1)) -> 70000 | AQ14: =INT(R6C*(1+0.05*RC1)) -> 70000 | AR14: =INT(R6C*(1+0.05*RC1)) -> 70000 | AS14: =INT(R6C*(1+0.05*RC1)) -> 350000 | AT14: =INT(R6C*(1+0.05*RC1)) -> 350000 | AU14: =INT(R6C*(1+0.05*RC1)) -> 140 | AV14: =INT(R6C*(1+0.05*RC1)) -> 140 | AW14: =INT(R6C*(1+0.05*RC1)) -> 140 | AX14: =INT(R6C*(1+0.05*RC1)) -> 140 | AY14: =INT(R6C*(1+0.05*RC1)) -> 140 | AZ14: =INT(R6C*(1+0.05*RC1)) -> 140 | BA14: =INT(R6C*(1+0.05*RC1)) -> 700 | BB14: =INT(R6C*(1+0.05*RC1)) -> 700 | BC14: =INT(R6C*(1+0.05*RC1)) -> 1400 | BD14: =INT(R6C*(1+0.05*RC1)) -> 1400 | BE14: =INT(R6C*(1+0.05*RC1)) -> 1400 | BF14: =INT(R6C*(1+0.05*RC1)) -> 1400 | BG14: =INT(R6C*(1+0.05*RC1)) -> 1400 | BH14: =INT(R6C*(1+0.05*RC1)) -> 1400 | BI14: =INT(R6C*(1+0.05*RC1)) -> 7000 | BJ14: =INT(R6C*(1+0.05*RC1)) -> 7000 | BL14: 钻石 | BM14: 19005 | BO14: 888 | BP14: 1 | BQ14: =RC[-1]*RC[-2] -> 888
A15: 9 | B15: 3 | C15: 9 | D15: 第九章 坚守 | E15: =990+RC[-4]*10&"|"&991+RC[-4]*10&"|"&992+RC[-4]*10 -> 1080|1081|1082 | F15: 0|1|2 | G15: 500 | H15: 290 | I15: 500 | J15: 19005|10022|10004|10004|10004|10004|10004|10004|10004|10004|10010|10010|10010|10010|10010|10010|10010|10010|10014|10014|10014|10014|10014|10014|10014|10014|19003|19003|19003|19003|19003|19003|19003|19003|19006|19006|19006|19006|19006|19006|19006|19006|19012|19012|19012|19012|19012|19012|19012|19012 | K15: =RC[2]&"|"&RC[3]&"|"&RC[4]&"|"&RC[5]&"|"&RC[6]&"|"&RC[7]&"|"&RC[8]&"|"&RC[9]&"|"&RC[10]&"|"&RC[11]&"|"&RC[12]&"|"&RC[13]&"|"&RC[14]&"|"&RC[15]&"|"&RC[16]&"|"&RC[17]&"|"&RC[18]&"|"&RC[19]&"|"&RC[20]&"|"&RC[21]&"|"&RC[22]&"|"&RC[23]&"|"&RC[24]&"|"&RC[25]&"|"&RC[26]&"|"&RC[27]&"|"&RC[28]&"|"&RC[29]&"|"&RC[30]&"|"&RC[31]&"|"&RC[32]&"|"&RC[33]&"|"&RC[34]&"|"&RC[35]&"|"&RC[36]&"|"&RC[37]&"|"&RC[38]&"|"&RC[39]&"|"&RC[40]&"|"&RC[41]&"|"&RC[42]&"|"&RC[43]&"|"&RC[44]&"|"&RC[45]&"|"&RC[46]&"|"&RC[47]&"|"&RC[48]&"|"&RC[49]&"|"&RC[50]&"|"&RC[51] -> 888|10|14|14|14|14|14|14|72|72|29|29|29|29|29|29|145|145|14|14|14|14|14|14|72|72|72500|72500|72500|72500|72500|72500|362500|362500|145|145|145|145|145|145|725|725|1450|1450|1450|1450|1450|1450|7250|7250 | L15: 19005|200#10022|10 | M15: 888 | N15: 10 | O15: =INT(R6C*(1+0.05*RC1)) -> 14 | P15: =INT(R6C*(1+0.05*RC1)) -> 14 | Q15: =INT(R6C*(1+0.05*RC1)) -> 14 | R15: =INT(R6C*(1+0.05*RC1)) -> 14 | S15: =INT(R6C*(1+0.05*RC1)) -> 14 | T15: =INT(R6C*(1+0.05*RC1)) -> 14 | U15: =INT(R6C*(1+0.05*RC1)) -> 72 | V15: =INT(R6C*(1+0.05*RC1)) -> 72 | W15: =INT(R6C*(1+0.05*RC1)) -> 29 | X15: =INT(R6C*(1+0.05*RC1)) -> 29 | Y15: =INT(R6C*(1+0.05*RC1)) -> 29 | Z15: =INT(R6C*(1+0.05*RC1)) -> 29 | AA15: =INT(R6C*(1+0.05*RC1)) -> 29 | AB15: =INT(R6C*(1+0.05*RC1)) -> 29 | AC15: =INT(R6C*(1+0.05*RC1)) -> 145 | AD15: =INT(R6C*(1+0.05*RC1)) -> 145 | AE15: =INT(R6C*(1+0.05*RC1)) -> 14 | AF15: =INT(R6C*(1+0.05*RC1)) -> 14 | AG15: =INT(R6C*(1+0.05*RC1)) -> 14 | AH15: =INT(R6C*(1+0.05*RC1)) -> 14 | AI15: =INT(R6C*(1+0.05*RC1)) -> 14 | AJ15: =INT(R6C*(1+0.05*RC1)) -> 14 | AK15: =INT(R6C*(1+0.05*RC1)) -> 72 | AL15: =INT(R6C*(1+0.05*RC1)) -> 72 | AM15: =INT(R6C*(1+0.05*RC1)) -> 72500 | AN15: =INT(R6C*(1+0.05*RC1)) -> 72500 | AO15: =INT(R6C*(1+0.05*RC1)) -> 72500 | AP15: =INT(R6C*(1+0.05*RC1)) -> 72500 | AQ15: =INT(R6C*(1+0.05*RC1)) -> 72500 | AR15: =INT(R6C*(1+0.05*RC1)) -> 72500 | AS15: =INT(R6C*(1+0.05*RC1)) -> 362500 | AT15: =INT(R6C*(1+0.05*RC1)) -> 362500 | AU15: =INT(R6C*(1+0.05*RC1)) -> 145 | AV15: =INT(R6C*(1+0.05*RC1)) -> 145 | AW15: =INT(R6C*(1+0.05*RC1)) -> 145 | AX15: =INT(R6C*(1+0.05*RC1)) -> 145 | AY15: =INT(R6C*(1+0.05*RC1)) -> 145 | AZ15: =INT(R6C*(1+0.05*RC1)) -> 145 | BA15: =INT(R6C*(1+0.05*RC1)) -> 725 | BB15: =INT(R6C*(1+0.05*RC1)) -> 725 | BC15: =INT(R6C*(1+0.05*RC1)) -> 1450 | BD15: =INT(R6C*(1+0.05*RC1)) -> 1450 | BE15: =INT(R6C*(1+0.05*RC1)) -> 1450 | BF15: =INT(R6C*(1+0.05*RC1)) -> 1450 | BG15: =INT(R6C*(1+0.05*RC1)) -> 1450 | BH15: =INT(R6C*(1+0.05*RC1)) -> 1450 | BI15: =INT(R6C*(1+0.05*RC1)) -> 7250 | BJ15: =INT(R6C*(1+0.05*RC1)) -> 7250
A16: 10 | B16: 1 | C16: 10 | D16: 第十章 正义 | E16: =990+RC[-4]*10&"|"&991+RC[-4]*10&"|"&992+RC[-4]*10 -> 1090|1091|1092 | F16: 0|1|2 | G16: 500 | H16: 300 | I16: 500 | J16: 19005|10022|10004|10004|10004|10004|10004|10004|10004|10004|10010|10010|10010|10010|10010|10010|10010|10010|10014|10014|10014|10014|10014|10014|10014|10014|19003|19003|19003|19003|19003|19003|19003|19003|19006|19006|19006|19006|19006|19006|19006|19006|19012|19012|19012|19012|19012|19012|19012|19012 | K16: =RC[2]&"|"&RC[3]&"|"&RC[4]&"|"&RC[5]&"|"&RC[6]&"|"&RC[7]&"|"&RC[8]&"|"&RC[9]&"|"&RC[10]&"|"&RC[11]&"|"&RC[12]&"|"&RC[13]&"|"&RC[14]&"|"&RC[15]&"|"&RC[16]&"|"&RC[17]&"|"&RC[18]&"|"&RC[19]&"|"&RC[20]&"|"&RC[21]&"|"&RC[22]&"|"&RC[23]&"|"&RC[24]&"|"&RC[25]&"|"&RC[26]&"|"&RC[27]&"|"&RC[28]&"|"&RC[29]&"|"&RC[30]&"|"&RC[31]&"|"&RC[32]&"|"&RC[33]&"|"&RC[34]&"|"&RC[35]&"|"&RC[36]&"|"&RC[37]&"|"&RC[38]&"|"&RC[39]&"|"&RC[40]&"|"&RC[41]&"|"&RC[42]&"|"&RC[43]&"|"&RC[44]&"|"&RC[45]&"|"&RC[46]&"|"&RC[47]&"|"&RC[48]&"|"&RC[49]&"|"&RC[50]&"|"&RC[51] -> 888|10|15|15|15|15|15|15|75|75|30|30|30|30|30|30|150|150|15|15|15|15|15|15|75|75|75000|75000|75000|75000|75000|75000|375000|375000|150|150|150|150|150|150|750|750|1500|1500|1500|1500|1500|1500|7500|7500 | L16: 19005|200#19006|500 | M16: 888 | N16: 10 | O16: =INT(R6C*(1+0.05*RC1)) -> 15 | P16: =INT(R6C*(1+0.05*RC1)) -> 15 | Q16: =INT(R6C*(1+0.05*RC1)) -> 15 | R16: =INT(R6C*(1+0.05*RC1)) -> 15 | S16: =INT(R6C*(1+0.05*RC1)) -> 15 | T16: =INT(R6C*(1+0.05*RC1)) -> 15 | U16: =INT(R6C*(1+0.05*RC1)) -> 75 | V16: =INT(R6C*(1+0.05*RC1)) -> 75 | W16: =INT(R6C*(1+0.05*RC1)) -> 30 | X16: =INT(R6C*(1+0.05*RC1)) -> 30 | Y16: =INT(R6C*(1+0.05*RC1)) -> 30 | Z16: =INT(R6C*(1+0.05*RC1)) -> 30 | AA16: =INT(R6C*(1+0.05*RC1)) -> 30 | AB16: =INT(R6C*(1+0.05*RC1)) -> 30 | AC16: =INT(R6C*(1+0.05*RC1)) -> 150 | AD16: =INT(R6C*(1+0.05*RC1)) -> 150 | AE16: =INT(R6C*(1+0.05*RC1)) -> 15 | AF16: =INT(R6C*(1+0.05*RC1)) -> 15 | AG16: =INT(R6C*(1+0.05*RC1)) -> 15 | AH16: =INT(R6C*(1+0.05*RC1)) -> 15 | AI16: =INT(R6C*(1+0.05*RC1)) -> 15 | AJ16: =INT(R6C*(1+0.05*RC1)) -> 15 | AK16: =INT(R6C*(1+0.05*RC1)) -> 75 | AL16: =INT(R6C*(1+0.05*RC1)) -> 75 | AM16: =INT(R6C*(1+0.05*RC1)) -> 75000 | AN16: =INT(R6C*(1+0.05*RC1)) -> 75000 | AO16: =INT(R6C*(1+0.05*RC1)) -> 75000 | AP16: =INT(R6C*(1+0.05*RC1)) -> 75000 | AQ16: =INT(R6C*(1+0.05*RC1)) -> 75000 | AR16: =INT(R6C*(1+0.05*RC1)) -> 75000 | AS16: =INT(R6C*(1+0.05*RC1)) -> 375000 | AT16: =INT(R6C*(1+0.05*RC1)) -> 375000 | AU16: =INT(R6C*(1+0.05*RC1)) -> 150 | AV16: =INT(R6C*(1+0.05*RC1)) -> 150 | AW16: =INT(R6C*(1+0.05*RC1)) -> 150 | AX16: =INT(R6C*(1+0.05*RC1)) -> 150 | AY16: =INT(R6C*(1+0.05*RC1)) -> 150 | AZ16: =INT(R6C*(1+0.05*RC1)) -> 150 | BA16: =INT(R6C*(1+0.05*RC1)) -> 750 | BB16: =INT(R6C*(1+0.05*RC1)) -> 750 | BC16: =INT(R6C*(1+0.05*RC1)) -> 1500 | BD16: =INT(R6C*(1+0.05*RC1)) -> 1500 | BE16: =INT(R6C*(1+0.05*RC1)) -> 1500 | BF16: =INT(R6C*(1+0.05*RC1)) -> 1500 | BG16: =INT(R6C*(1+0.05*RC1)) -> 1500 | BH16: =INT(R6C*(1+0.05*RC1)) -> 1500 | BI16: =INT(R6C*(1+0.05*RC1)) -> 7500 | BJ16: =INT(R6C*(1+0.05*RC1)) -> 7500
A17: 11 | B17: 2 | C17: 11 | D17: 第十一章 狩猎 | E17: =990+RC[-4]*10&"|"&991+RC[-4]*10&"|"&992+RC[-4]*10 -> 1100|1101|1102 | F17: 0|1|2 | G17: 500 | H17: 310 | I17: 500 | J17: 19005|10022|10004|10004|10004|10004|10004|10004|10004|10004|10010|10010|10010|10010|10010|10010|10010|10010|10014|10014|10014|10014|10014|10014|10014|10014|19003|19003|19003|19003|19003|19003|19003|19003|19006|19006|19006|19006|19006|19006|19006|19006|19012|19012|19012|19012|19012|19012|19012|19012 | K17: =RC[2]&"|"&RC[3]&"|"&RC[4]&"|"&RC[5]&"|"&RC[6]&"|"&RC[7]&"|"&RC[8]&"|"&RC[9]&"|"&RC[10]&"|"&RC[11]&"|"&RC[12]&"|"&RC[13]&"|"&RC[14]&"|"&RC[15]&"|"&RC[16]&"|"&RC[17]&"|"&RC[18]&"|"&RC[19]&"|"&RC[20]&"|"&RC[21]&"|"&RC[22]&"|"&RC[23]&"|"&RC[24]&"|"&RC[25]&"|"&RC[26]&"|"&RC[27]&"|"&RC[28]&"|"&RC[29]&"|"&RC[30]&"|"&RC[31]&"|"&RC[32]&"|"&RC[33]&"|"&RC[34]&"|"&RC[35]&"|"&RC[36]&"|"&RC[37]&"|"&RC[38]&"|"&RC[39]&"|"&RC[40]&"|"&RC[41]&"|"&RC[42]&"|"&RC[43]&"|"&RC[44]&"|"&RC[45]&"|"&RC[46]&"|"&RC[47]&"|"&RC[48]&"|"&RC[49]&"|"&RC[50]&"|"&RC[51] -> 888|10|15|15|15|15|15|15|77|77|31|31|31|31|31|31|155|155|15|15|15|15|15|15|77|77|77500|77500|77500|77500|77500|77500|387500|387500|155|155|155|155|155|155|775|775|1550|1550|1550|1550|1550|1550|7750|7750 | L17: 19005|200#19012|5000 | M17: 888 | N17: 10 | O17: =INT(R6C*(1+0.05*RC1)) -> 15 | P17: =INT(R6C*(1+0.05*RC1)) -> 15 | Q17: =INT(R6C*(1+0.05*RC1)) -> 15 | R17: =INT(R6C*(1+0.05*RC1)) -> 15 | S17: =INT(R6C*(1+0.05*RC1)) -> 15 | T17: =INT(R6C*(1+0.05*RC1)) -> 15 | U17: =INT(R6C*(1+0.05*RC1)) -> 77 | V17: =INT(R6C*(1+0.05*RC1)) -> 77 | W17: =INT(R6C*(1+0.05*RC1)) -> 31 | X17: =INT(R6C*(1+0.05*RC1)) -> 31 | Y17: =INT(R6C*(1+0.05*RC1)) -> 31 | Z17: =INT(R6C*(1+0.05*RC1)) -> 31 | AA17: =INT(R6C*(1+0.05*RC1)) -> 31 | AB17: =INT(R6C*(1+0.05*RC1)) -> 31 | AC17: =INT(R6C*(1+0.05*RC1)) -> 155 | AD17: =INT(R6C*(1+0.05*RC1)) -> 155 | AE17: =INT(R6C*(1+0.05*RC1)) -> 15 | AF17: =INT(R6C*(1+0.05*RC1)) -> 15 | AG17: =INT(R6C*(1+0.05*RC1)) -> 15 | AH17: =INT(R6C*(1+0.05*RC1)) -> 15 | AI17: =INT(R6C*(1+0.05*RC1)) -> 15 | AJ17: =INT(R6C*(1+0.05*RC1)) -> 15 | AK17: =INT(R6C*(1+0.05*RC1)) -> 77 | AL17: =INT(R6C*(1+0.05*RC1)) -> 77 | AM17: =INT(R6C*(1+0.05*RC1)) -> 77500 | AN17: =INT(R6C*(1+0.05*RC1)) -> 77500 | AO17: =INT(R6C*(1+0.05*RC1)) -> 77500 | AP17: =INT(R6C*(1+0.05*RC1)) -> 77500 | AQ17: =INT(R6C*(1+0.05*RC1)) -> 77500 | AR17: =INT(R6C*(1+0.05*RC1)) -> 77500 | AS17: =INT(R6C*(1+0.05*RC1)) -> 387500 | AT17: =INT(R6C*(1+0.05*RC1)) -> 387500 | AU17: =INT(R6C*(1+0.05*RC1)) -> 155 | AV17: =INT(R6C*(1+0.05*RC1)) -> 155 | AW17: =INT(R6C*(1+0.05*RC1)) -> 155 | AX17: =INT(R6C*(1+0.05*RC1)) -> 155 | AY17: =INT(R6C*(1+0.05*RC1)) -> 155 | AZ17: =INT(R6C*(1+0.05*RC1)) -> 155 | BA17: =INT(R6C*(1+0.05*RC1)) -> 775 | BB17: =INT(R6C*(1+0.05*RC1)) -> 775 | BC17: =INT(R6C*(1+0.05*RC1)) -> 1550 | BD17: =INT(R6C*(1+0.05*RC1)) -> 1550 | BE17: =INT(R6C*(1+0.05*RC1)) -> 1550 | BF17: =INT(R6C*(1+0.05*RC1)) -> 1550 | BG17: =INT(R6C*(1+0.05*RC1)) -> 1550 | BH17: =INT(R6C*(1+0.05*RC1)) -> 1550 | BI17: =INT(R6C*(1+0.05*RC1)) -> 7750 | BJ17: =INT(R6C*(1+0.05*RC1)) -> 7750
A18: 12 | B18: 3 | C18: 12 | D18: 第十二章 剑影 | E18: =990+RC[-4]*10&"|"&991+RC[-4]*10&"|"&992+RC[-4]*10 -> 1110|1111|1112 | F18: 0|1|2 | G18: 500 | H18: 320 | I18: 500 | J18: 19005|10022|10004|10004|10004|10004|10004|10004|10004|10004|10010|10010|10010|10010|10010|10010|10010|10010|10014|10014|10014|10014|10014|10014|10014|10014|19003|19003|19003|19003|19003|19003|19003|19003|19006|19006|19006|19006|19006|19006|19006|19006|19012|19012|19012|19012|19012|19012|19012|19012 | K18: =RC[2]&"|"&RC[3]&"|"&RC[4]&"|"&RC[5]&"|"&RC[6]&"|"&RC[7]&"|"&RC[8]&"|"&RC[9]&"|"&RC[10]&"|"&RC[11]&"|"&RC[12]&"|"&RC[13]&"|"&RC[14]&"|"&RC[15]&"|"&RC[16]&"|"&RC[17]&"|"&RC[18]&"|"&RC[19]&"|"&RC[20]&"|"&RC[21]&"|"&RC[22]&"|"&RC[23]&"|"&RC[24]&"|"&RC[25]&"|"&RC[26]&"|"&RC[27]&"|"&RC[28]&"|"&RC[29]&"|"&RC[30]&"|"&RC[31]&"|"&RC[32]&"|"&RC[33]&"|"&RC[34]&"|"&RC[35]&"|"&RC[36]&"|"&RC[37]&"|"&RC[38]&"|"&RC[39]&"|"&RC[40]&"|"&RC[41]&"|"&RC[42]&"|"&RC[43]&"|"&RC[44]&"|"&RC[45]&"|"&RC[46]&"|"&RC[47]&"|"&RC[48]&"|"&RC[49]&"|"&RC[50]&"|"&RC[51] -> 888|10|16|16|16|16|16|16|80|80|32|32|32|32|32|32|160|160|16|16|16|16|16|16|80|80|80000|80000|80000|80000|80000|80000|400000|400000|160|160|160|160|160|160|800|800|1600|1600|1600|1600|1600|1600|8000|8000 | L18: 19005|200#19103|50 | M18: 888 | N18: 10 | O18: =INT(R6C*(1+0.05*RC1)) -> 16 | P18: =INT(R6C*(1+0.05*RC1)) -> 16 | Q18: =INT(R6C*(1+0.05*RC1)) -> 16 | R18: =INT(R6C*(1+0.05*RC1)) -> 16 | S18: =INT(R6C*(1+0.05*RC1)) -> 16 | T18: =INT(R6C*(1+0.05*RC1)) -> 16 | U18: =INT(R6C*(1+0.05*RC1)) -> 80 | V18: =INT(R6C*(1+0.05*RC1)) -> 80 | W18: =INT(R6C*(1+0.05*RC1)) -> 32 | X18: =INT(R6C*(1+0.05*RC1)) -> 32 | Y18: =INT(R6C*(1+0.05*RC1)) -> 32 | Z18: =INT(R6C*(1+0.05*RC1)) -> 32 | AA18: =INT(R6C*(1+0.05*RC1)) -> 32 | AB18: =INT(R6C*(1+0.05*RC1)) -> 32 | AC18: =INT(R6C*(1+0.05*RC1)) -> 160 | AD18: =INT(R6C*(1+0.05*RC1)) -> 160 | AE18: =INT(R6C*(1+0.05*RC1)) -> 16 | AF18: =INT(R6C*(1+0.05*RC1)) -> 16 | AG18: =INT(R6C*(1+0.05*RC1)) -> 16 | AH18: =INT(R6C*(1+0.05*RC1)) -> 16 | AI18: =INT(R6C*(1+0.05*RC1)) -> 16 | AJ18: =INT(R6C*(1+0.05*RC1)) -> 16 | AK18: =INT(R6C*(1+0.05*RC1)) -> 80 | AL18: =INT(R6C*(1+0.05*RC1)) -> 80 | AM18: =INT(R6C*(1+0.05*RC1)) -> 80000 | AN18: =INT(R6C*(1+0.05*RC1)) -> 80000 | AO18: =INT(R6C*(1+0.05*RC1)) -> 80000 | AP18: =INT(R6C*(1+0.05*RC1)) -> 80000 | AQ18: =INT(R6C*(1+0.05*RC1)) -> 80000 | AR18: =INT(R6C*(1+0.05*RC1)) -> 80000 | AS18: =INT(R6C*(1+0.05*RC1)) -> 400000 | AT18: =INT(R6C*(1+0.05*RC1)) -> 400000 | AU18: =INT(R6C*(1+0.05*RC1)) -> 160 | AV18: =INT(R6C*(1+0.05*RC1)) -> 160 | AW18: =INT(R6C*(1+0.05*RC1)) -> 160 | AX18: =INT(R6C*(1+0.05*RC1)) -> 160 | AY18: =INT(R6C*(1+0.05*RC1)) -> 160 | AZ18: =INT(R6C*(1+0.05*RC1)) -> 160 | BA18: =INT(R6C*(1+0.05*RC1)) -> 800 | BB18: =INT(R6C*(1+0.05*RC1)) -> 800 | BC18: =INT(R6C*(1+0.05*RC1)) -> 1600 | BD18: =INT(R6C*(1+0.05*RC1)) -> 1600 | BE18: =INT(R6C*(1+0.05*RC1)) -> 1600 | BF18: =INT(R6C*(1+0.05*RC1)) -> 1600 | BG18: =INT(R6C*(1+0.05*RC1)) -> 1600 | BH18: =INT(R6C*(1+0.05*RC1)) -> 1600 | BI18: =INT(R6C*(1+0.05*RC1)) -> 8000 | BJ18: =INT(R6C*(1+0.05*RC1)) -> 8000
A19: 13 | B19: 1 | C19: 13 | D19: 第十三章 奥秘 | E19: =990+RC[-4]*10&"|"&991+RC[-4]*10&"|"&992+RC[-4]*10 -> 1120|1121|1122 | F19: 0|1|2 | G19: 500 | H19: 330 | I19: 500 | J19: 19005|10022|10004|10004|10004|10004|10004|10004|10004|10004|10010|10010|10010|10010|10010|10010|10010|10010|10014|10014|10014|10014|10014|10014|10014|10014|19003|19003|19003|19003|19003|19003|19003|19003|19006|19006|19006|19006|19006|19006|19006|19006|19012|19012|19012|19012|19012|19012|19012|19012 | K19: =RC[2]&"|"&RC[3]&"|"&RC[4]&"|"&RC[5]&"|"&RC[6]&"|"&RC[7]&"|"&RC[8]&"|"&RC[9]&"|"&RC[10]&"|"&RC[11]&"|"&RC[12]&"|"&RC[13]&"|"&RC[14]&"|"&RC[15]&"|"&RC[16]&"|"&RC[17]&"|"&RC[18]&"|"&RC[19]&"|"&RC[20]&"|"&RC[21]&"|"&RC[22]&"|"&RC[23]&"|"&RC[24]&"|"&RC[25]&"|"&RC[26]&"|"&RC[27]&"|"&RC[28]&"|"&RC[29]&"|"&RC[30]&"|"&RC[31]&"|"&RC[32]&"|"&RC[33]&"|"&RC[34]&"|"&RC[35]&"|"&RC[36]&"|"&RC[37]&"|"&RC[38]&"|"&RC[39]&"|"&RC[40]&"|"&RC[41]&"|"&RC[42]&"|"&RC[43]&"|"&RC[44]&"|"&RC[45]&"|"&RC[46]&"|"&RC[47]&"|"&RC[48]&"|"&RC[49]&"|"&RC[50]&"|"&RC[51] -> 888|10|16|16|16|16|16|16|82|82|33|33|33|33|33|33|165|165|16|16|16|16|16|16|82|82|82500|82500|82500|82500|82500|82500|412500|412500|165|165|165|165|165|165|825|825|1650|1650|1650|1650|1650|1650|8250|8250 | L19: 19005|200#10022|10 | M19: 888 | N19: 10 | O19: =INT(R6C*(1+0.05*RC1)) -> 16 | P19: =INT(R6C*(1+0.05*RC1)) -> 16 | Q19: =INT(R6C*(1+0.05*RC1)) -> 16 | R19: =INT(R6C*(1+0.05*RC1)) -> 16 | S19: =INT(R6C*(1+0.05*RC1)) -> 16 | T19: =INT(R6C*(1+0.05*RC1)) -> 16 | U19: =INT(R6C*(1+0.05*RC1)) -> 82 | V19: =INT(R6C*(1+0.05*RC1)) -> 82 | W19: =INT(R6C*(1+0.05*RC1)) -> 33 | X19: =INT(R6C*(1+0.05*RC1)) -> 33 | Y19: =INT(R6C*(1+0.05*RC1)) -> 33 | Z19: =INT(R6C*(1+0.05*RC1)) -> 33 | AA19: =INT(R6C*(1+0.05*RC1)) -> 33 | AB19: =INT(R6C*(1+0.05*RC1)) -> 33 | AC19: =INT(R6C*(1+0.05*RC1)) -> 165 | AD19: =INT(R6C*(1+0.05*RC1)) -> 165 | AE19: =INT(R6C*(1+0.05*RC1)) -> 16 | AF19: =INT(R6C*(1+0.05*RC1)) -> 16 | AG19: =INT(R6C*(1+0.05*RC1)) -> 16 | AH19: =INT(R6C*(1+0.05*RC1)) -> 16 | AI19: =INT(R6C*(1+0.05*RC1)) -> 16 | AJ19: =INT(R6C*(1+0.05*RC1)) -> 16 | AK19: =INT(R6C*(1+0.05*RC1)) -> 82 | AL19: =INT(R6C*(1+0.05*RC1)) -> 82 | AM19: =INT(R6C*(1+0.05*RC1)) -> 82500 | AN19: =INT(R6C*(1+0.05*RC1)) -> 82500 | AO19: =INT(R6C*(1+0.05*RC1)) -> 82500 | AP19: =INT(R6C*(1+0.05*RC1)) -> 82500 | AQ19: =INT(R6C*(1+0.05*RC1)) -> 82500 | AR19: =INT(R6C*(1+0.05*RC1)) -> 82500 | AS19: =INT(R6C*(1+0.05*RC1)) -> 412500 | AT19: =INT(R6C*(1+0.05*RC1)) -> 412500 | AU19: =INT(R6C*(1+0.05*RC1)) -> 165 | AV19: =INT(R6C*(1+0.05*RC1)) -> 165 | AW19: =INT(R6C*(1+0.05*RC1)) -> 165 | AX19: =INT(R6C*(1+0.05*RC1)) -> 165 | AY19: =INT(R6C*(1+0.05*RC1)) -> 165 | AZ19: =INT(R6C*(1+0.05*RC1)) -> 165 | BA19: =INT(R6C*(1+0.05*RC1)) -> 825 | BB19: =INT(R6C*(1+0.05*RC1)) -> 825 | BC19: =INT(R6C*(1+0.05*RC1)) -> 1650 | BD19: =INT(R6C*(1+0.05*RC1)) -> 1650 | BE19: =INT(R6C*(1+0.05*RC1)) -> 1650 | BF19: =INT(R6C*(1+0.05*RC1)) -> 1650 | BG19: =INT(R6C*(1+0.05*RC1)) -> 1650 | BH19: =INT(R6C*(1+0.05*RC1)) -> 1650 | BI19: =INT(R6C*(1+0.05*RC1)) -> 8250 | BJ19: =INT(R6C*(1+0.05*RC1)) -> 8250
A20: 14 | B20: 2 | C20: 14 | D20: 第十四章 潜行 | E20: =990+RC[-4]*10&"|"&991+RC[-4]*10&"|"&992+RC[-4]*10 -> 1130|1131|1132 | F20: 0|1|2 | G20: 500 | H20: 340 | I20: 500 | J20: 19005|10022|10004|10004|10004|10004|10004|10004|10004|10004|10010|10010|10010|10010|10010|10010|10010|10010|10014|10014|10014|10014|10014|10014|10014|10014|19003|19003|19003|19003|19003|19003|19003|19003|19006|19006|19006|19006|19006|19006|19006|19006|19012|19012|19012|19012|19012|19012|19012|19012 | K20: =RC[2]&"|"&RC[3]&"|"&RC[4]&"|"&RC[5]&"|"&RC[6]&"|"&RC[7]&"|"&RC[8]&"|"&RC[9]&"|"&RC[10]&"|"&RC[11]&"|"&RC[12]&"|"&RC[13]&"|"&RC[14]&"|"&RC[15]&"|"&RC[16]&"|"&RC[17]&"|"&RC[18]&"|"&RC[19]&"|"&RC[20]&"|"&RC[21]&"|"&RC[22]&"|"&RC[23]&"|"&RC[24]&"|"&RC[25]&"|"&RC[26]&"|"&RC[27]&"|"&RC[28]&"|"&RC[29]&"|"&RC[30]&"|"&RC[31]&"|"&RC[32]&"|"&RC[33]&"|"&RC[34]&"|"&RC[35]&"|"&RC[36]&"|"&RC[37]&"|"&RC[38]&"|"&RC[39]&"|"&RC[40]&"|"&RC[41]&"|"&RC[42]&"|"&RC[43]&"|"&RC[44]&"|"&RC[45]&"|"&RC[46]&"|"&RC[47]&"|"&RC[48]&"|"&RC[49]&"|"&RC[50]&"|"&RC[51] -> 888|10|17|17|17|17|17|17|85|85|34|34|34|34|34|34|170|170|17|17|17|17|17|17|85|85|85000|85000|85000|85000|85000|85000|425000|425000|170|170|170|170|170|170|850|850|1700|1700|1700|1700|1700|1700|8500|8500 | L20: 19005|200#19006|500 | M20: 888 | N20: 10 | O20: =INT(R6C*(1+0.05*RC1)) -> 17 | P20: =INT(R6C*(1+0.05*RC1)) -> 17 | Q20: =INT(R6C*(1+0.05*RC1)) -> 17 | R20: =INT(R6C*(1+0.05*RC1)) -> 17 | S20: =INT(R6C*(1+0.05*RC1)) -> 17 | T20: =INT(R6C*(1+0.05*RC1)) -> 17 | U20: =INT(R6C*(1+0.05*RC1)) -> 85 | V20: =INT(R6C*(1+0.05*RC1)) -> 85 | W20: =INT(R6C*(1+0.05*RC1)) -> 34 | X20: =INT(R6C*(1+0.05*RC1)) -> 34 | Y20: =INT(R6C*(1+0.05*RC1)) -> 34 | Z20: =INT(R6C*(1+0.05*RC1)) -> 34 | AA20: =INT(R6C*(1+0.05*RC1)) -> 34 | AB20: =INT(R6C*(1+0.05*RC1)) -> 34 | AC20: =INT(R6C*(1+0.05*RC1)) -> 170 | AD20: =INT(R6C*(1+0.05*RC1)) -> 170 | AE20: =INT(R6C*(1+0.05*RC1)) -> 17 | AF20: =INT(R6C*(1+0.05*RC1)) -> 17 | AG20: =INT(R6C*(1+0.05*RC1)) -> 17 | AH20: =INT(R6C*(1+0.05*RC1)) -> 17 | AI20: =INT(R6C*(1+0.05*RC1)) -> 17 | AJ20: =INT(R6C*(1+0.05*RC1)) -> 17 | AK20: =INT(R6C*(1+0.05*RC1)) -> 85 | AL20: =INT(R6C*(1+0.05*RC1)) -> 85 | AM20: =INT(R6C*(1+0.05*RC1)) -> 85000 | AN20: =INT(R6C*(1+0.05*RC1)) -> 85000 | AO20: =INT(R6C*(1+0.05*RC1)) -> 85000 | AP20: =INT(R6C*(1+0.05*RC1)) -> 85000 | AQ20: =INT(R6C*(1+0.05*RC1)) -> 85000 | AR20: =INT(R6C*(1+0.05*RC1)) -> 85000 | AS20: =INT(R6C*(1+0.05*RC1)) -> 425000 | AT20: =INT(R6C*(1+0.05*RC1)) -> 425000 | AU20: =INT(R6C*(1+0.05*RC1)) -> 170 | AV20: =INT(R6C*(1+0.05*RC1)) -> 170 | AW20: =INT(R6C*(1+0.05*RC1)) -> 170 | AX20: =INT(R6C*(1+0.05*RC1)) -> 170 | AY20: =INT(R6C*(1+0.05*RC1)) -> 170 | AZ20: =INT(R6C*(1+0.05*RC1)) -> 170 | BA20: =INT(R6C*(1+0.05*RC1)) -> 850 | BB20: =INT(R6C*(1+0.05*RC1)) -> 850 | BC20: =INT(R6C*(1+0.05*RC1)) -> 1700 | BD20: =INT(R6C*(1+0.05*RC1)) -> 1700 | BE20: =INT(R6C*(1+0.05*RC1)) -> 1700 | BF20: =INT(R6C*(1+0.05*RC1)) -> 1700 | BG20: =INT(R6C*(1+0.05*RC1)) -> 1700 | BH20: =INT(R6C*(1+0.05*RC1)) -> 1700 | BI20: =INT(R6C*(1+0.05*RC1)) -> 8500 | BJ20: =INT(R6C*(1+0.05*RC1)) -> 8500
A21: 15 | B21: 3 | C21: 15 | D21: 第十五章 希望 | E21: =990+RC[-4]*10&"|"&991+RC[-4]*10&"|"&992+RC[-4]*10 -> 1140|1141|1142 | F21: 0|1|2 | G21: 500 | H21: 350 | I21: 500 | J21: 19005|10022|10004|10004|10004|10004|10004|10004|10004|10004|10010|10010|10010|10010|10010|10010|10010|10010|10014|10014|10014|10014|10014|10014|10014|10014|19003|19003|19003|19003|19003|19003|19003|19003|19006|19006|19006|19006|19006|19006|19006|19006|19012|19012|19012|19012|19012|19012|19012|19012 | K21: =RC[2]&"|"&RC[3]&"|"&RC[4]&"|"&RC[5]&"|"&RC[6]&"|"&RC[7]&"|"&RC[8]&"|"&RC[9]&"|"&RC[10]&"|"&RC[11]&"|"&RC[12]&"|"&RC[13]&"|"&RC[14]&"|"&RC[15]&"|"&RC[16]&"|"&RC[17]&"|"&RC[18]&"|"&RC[19]&"|"&RC[20]&"|"&RC[21]&"|"&RC[22]&"|"&RC[23]&"|"&RC[24]&"|"&RC[25]&"|"&RC[26]&"|"&RC[27]&"|"&RC[28]&"|"&RC[29]&"|"&RC[30]&"|"&RC[31]&"|"&RC[32]&"|"&RC[33]&"|"&RC[34]&"|"&RC[35]&"|"&RC[36]&"|"&RC[37]&"|"&RC[38]&"|"&RC[39]&"|"&RC[40]&"|"&RC[41]&"|"&RC[42]&"|"&RC[43]&"|"&RC[44]&"|"&RC[45]&"|"&RC[46]&"|"&RC[47]&"|"&RC[48]&"|"&RC[49]&"|"&RC[50]&"|"&RC[51] -> 888|10|17|17|17|17|17|17|87|87|35|35|35|35|35|35|175|175|17|17|17|17|17|17|87|87|87500|87500|87500|87500|87500|87500|437500|437500|175|175|175|175|175|175|875|875|1750|1750|1750|1750|1750|1750|8750|8750 | L21: 19005|200#19012|5000 | M21: 888 | N21: 10 | O21: =INT(R6C*(1+0.05*RC1)) -> 17 | P21: =INT(R6C*(1+0.05*RC1)) -> 17 | Q21: =INT(R6C*(1+0.05*RC1)) -> 17 | R21: =INT(R6C*(1+0.05*RC1)) -> 17 | S21: =INT(R6C*(1+0.05*RC1)) -> 17 | T21: =INT(R6C*(1+0.05*RC1)) -> 17 | U21: =INT(R6C*(1+0.05*RC1)) -> 87 | V21: =INT(R6C*(1+0.05*RC1)) -> 87 | W21: =INT(R6C*(1+0.05*RC1)) -> 35 | X21: =INT(R6C*(1+0.05*RC1)) -> 35 | Y21: =INT(R6C*(1+0.05*RC1)) -> 35 | Z21: =INT(R6C*(1+0.05*RC1)) -> 35 | AA21: =INT(R6C*(1+0.05*RC1)) -> 35 | AB21: =INT(R6C*(1+0.05*RC1)) -> 35 | AC21: =INT(R6C*(1+0.05*RC1)) -> 175 | AD21: =INT(R6C*(1+0.05*RC1)) -> 175 | AE21: =INT(R6C*(1+0.05*RC1)) -> 17 | AF21: =INT(R6C*(1+0.05*RC1)) -> 17 | AG21: =INT(R6C*(1+0.05*RC1)) -> 17 | AH21: =INT(R6C*(1+0.05*RC1)) -> 17 | AI21: =INT(R6C*(1+0.05*RC1)) -> 17 | AJ21: =INT(R6C*(1+0.05*RC1)) -> 17 | AK21: =INT(R6C*(1+0.05*RC1)) -> 87 | AL21: =INT(R6C*(1+0.05*RC1)) -> 87 | AM21: =INT(R6C*(1+0.05*RC1)) -> 87500 | AN21: =INT(R6C*(1+0.05*RC1)) -> 87500 | AO21: =INT(R6C*(1+0.05*RC1)) -> 87500 | AP21: =INT(R6C*(1+0.05*RC1)) -> 87500 | AQ21: =INT(R6C*(1+0.05*RC1)) -> 87500 | AR21: =INT(R6C*(1+0.05*RC1)) -> 87500 | AS21: =INT(R6C*(1+0.05*RC1)) -> 437500 | AT21: =INT(R6C*(1+0.05*RC1)) -> 437500 | AU21: =INT(R6C*(1+0.05*RC1)) -> 175 | AV21: =INT(R6C*(1+0.05*RC1)) -> 175 | AW21: =INT(R6C*(1+0.05*RC1)) -> 175 | AX21: =INT(R6C*(1+0.05*RC1)) -> 175 | AY21: =INT(R6C*(1+0.05*RC1)) -> 175 | AZ21: =INT(R6C*(1+0.05*RC1)) -> 175 | BA21: =INT(R6C*(1+0.05*RC1)) -> 875 | BB21: =INT(R6C*(1+0.05*RC1)) -> 875 | BC21: =INT(R6C*(1+0.05*RC1)) -> 1750 | BD21: =INT(R6C*(1+0.05*RC1)) -> 1750 | BE21: =INT(R6C*(1+0.05*RC1)) -> 1750 | BF21: =INT(R6C*(1+0.05*RC1)) -> 1750 | BG21: =INT(R6C*(1+0.05*RC1)) -> 1750 | BH21: =INT(R6C*(1+0.05*RC1)) -> 1750 | BI21: =INT(R6C*(1+0.05*RC1)) -> 8750 | BJ21: =INT(R6C*(1+0.05*RC1)) -> 8750
A22: 16 | B22: 1 | C22: 16 | D22: 第十六章 无畏 | E22: =990+RC[-4]*10&"|"&991+RC[-4]*10&"|"&992+RC[-4]*10 -> 1150|1151|1152 | F22: 0|1|2 | G22: 500 | H22: 360 | I22: 500 | J22: 19005|10022|10004|10004|10004|10004|10004|10004|10004|10004|10010|10010|10010|10010|10010|10010|10010|10010|10014|10014|10014|10014|10014|10014|10014|10014|19003|19003|19003|19003|19003|19003|19003|19003|19006|19006|19006|19006|19006|19006|19006|19006|19012|19012|19012|19012|19012|19012|19012|19012 | K22: =RC[2]&"|"&RC[3]&"|"&RC[4]&"|"&RC[5]&"|"&RC[6]&"|"&RC[7]&"|"&RC[8]&"|"&RC[9]&"|"&RC[10]&"|"&RC[11]&"|"&RC[12]&"|"&RC[13]&"|"&RC[14]&"|"&RC[15]&"|"&RC[16]&"|"&RC[17]&"|"&RC[18]&"|"&RC[19]&"|"&RC[20]&"|"&RC[21]&"|"&RC[22]&"|"&RC[23]&"|"&RC[24]&"|"&RC[25]&"|"&RC[26]&"|"&RC[27]&"|"&RC[28]&"|"&RC[29]&"|"&RC[30]&"|"&RC[31]&"|"&RC[32]&"|"&RC[33]&"|"&RC[34]&"|"&RC[35]&"|"&RC[36]&"|"&RC[37]&"|"&RC[38]&"|"&RC[39]&"|"&RC[40]&"|"&RC[41]&"|"&RC[42]&"|"&RC[43]&"|"&RC[44]&"|"&RC[45]&"|"&RC[46]&"|"&RC[47]&"|"&RC[48]&"|"&RC[49]&"|"&RC[50]&"|"&RC[51] -> 888|10|18|18|18|18|18|18|90|90|36|36|36|36|36|36|180|180|18|18|18|18|18|18|90|90|90000|90000|90000|90000|90000|90000|450000|450000|180|180|180|180|180|180|900|900|1800|1800|1800|1800|1800|1800|9000|9000 | L22: 19005|200#19103|50 | M22: 888 | N22: 10 | O22: =INT(R6C*(1+0.05*RC1)) -> 18 | P22: =INT(R6C*(1+0.05*RC1)) -> 18 | Q22: =INT(R6C*(1+0.05*RC1)) -> 18 | R22: =INT(R6C*(1+0.05*RC1)) -> 18 | S22: =INT(R6C*(1+0.05*RC1)) -> 18 | T22: =INT(R6C*(1+0.05*RC1)) -> 18 | U22: =INT(R6C*(1+0.05*RC1)) -> 90 | V22: =INT(R6C*(1+0.05*RC1)) -> 90 | W22: =INT(R6C*(1+0.05*RC1)) -> 36 | X22: =INT(R6C*(1+0.05*RC1)) -> 36 | Y22: =INT(R6C*(1+0.05*RC1)) -> 36 | Z22: =INT(R6C*(1+0.05*RC1)) -> 36 | AA22: =INT(R6C*(1+0.05*RC1)) -> 36 | AB22: =INT(R6C*(1+0.05*RC1)) -> 36 | AC22: =INT(R6C*(1+0.05*RC1)) -> 180 | AD22: =INT(R6C*(1+0.05*RC1)) -> 180 | AE22: =INT(R6C*(1+0.05*RC1)) -> 18 | AF22: =INT(R6C*(1+0.05*RC1)) -> 18 | AG22: =INT(R6C*(1+0.05*RC1)) -> 18 | AH22: =INT(R6C*(1+0.05*RC1)) -> 18 | AI22: =INT(R6C*(1+0.05*RC1)) -> 18 | AJ22: =INT(R6C*(1+0.05*RC1)) -> 18 | AK22: =INT(R6C*(1+0.05*RC1)) -> 90 | AL22: =INT(R6C*(1+0.05*RC1)) -> 90 | AM22: =INT(R6C*(1+0.05*RC1)) -> 90000 | AN22: =INT(R6C*(1+0.05*RC1)) -> 90000 | AO22: =INT(R6C*(1+0.05*RC1)) -> 90000 | AP22: =INT(R6C*(1+0.05*RC1)) -> 90000 | AQ22: =INT(R6C*(1+0.05*RC1)) -> 90000 | AR22: =INT(R6C*(1+0.05*RC1)) -> 90000 | AS22: =INT(R6C*(1+0.05*RC1)) -> 450000 | AT22: =INT(R6C*(1+0.05*RC1)) -> 450000 | AU22: =INT(R6C*(1+0.05*RC1)) -> 180 | AV22: =INT(R6C*(1+0.05*RC1)) -> 180 | AW22: =INT(R6C*(1+0.05*RC1)) -> 180 | AX22: =INT(R6C*(1+0.05*RC1)) -> 180 | AY22: =INT(R6C*(1+0.05*RC1)) -> 180 | AZ22: =INT(R6C*(1+0.05*RC1)) -> 180 | BA22: =INT(R6C*(1+0.05*RC1)) -> 900 | BB22: =INT(R6C*(1+0.05*RC1)) -> 900 | BC22: =INT(R6C*(1+0.05*RC1)) -> 1800 | BD22: =INT(R6C*(1+0.05*RC1)) -> 1800 | BE22: =INT(R6C*(1+0.05*RC1)) -> 1800 | BF22: =INT(R6C*(1+0.05*RC1)) -> 1800 | BG22: =INT(R6C*(1+0.05*RC1)) -> 1800 | BH22: =INT(R6C*(1+0.05*RC1)) -> 1800 | BI22: =INT(R6C*(1+0.05*RC1)) -> 9000 | BJ22: =INT(R6C*(1+0.05*RC1)) -> 9000
A23: 17 | B23: 2 | C23: 17 | D23: 第十七章 死亡 | E23: =990+RC[-4]*10&"|"&991+RC[-4]*10&"|"&992+RC[-4]*10 -> 1160|1161|1162 | F23: 0|1|2 | G23: 500 | H23: 370 | I23: 500 | J23: 19005|10022|10004|10004|10004|10004|10004|10004|10004|10004|10010|10010|10010|10010|10010|10010|10010|10010|10014|10014|10014|10014|10014|10014|10014|10014|19003|19003|19003|19003|19003|19003|19003|19003|19006|19006|19006|19006|19006|19006|19006|19006|19012|19012|19012|19012|19012|19012|19012|19012 | K23: =RC[2]&"|"&RC[3]&"|"&RC[4]&"|"&RC[5]&"|"&RC[6]&"|"&RC[7]&"|"&RC[8]&"|"&RC[9]&"|"&RC[10]&"|"&RC[11]&"|"&RC[12]&"|"&RC[13]&"|"&RC[14]&"|"&RC[15]&"|"&RC[16]&"|"&RC[17]&"|"&RC[18]&"|"&RC[19]&"|"&RC[20]&"|"&RC[21]&"|"&RC[22]&"|"&RC[23]&"|"&RC[24]&"|"&RC[25]&"|"&RC[26]&"|"&RC[27]&"|"&RC[28]&"|"&RC[29]&"|"&RC[30]&"|"&RC[31]&"|"&RC[32]&"|"&RC[33]&"|"&RC[34]&"|"&RC[35]&"|"&RC[36]&"|"&RC[37]&"|"&RC[38]&"|"&RC[39]&"|"&RC[40]&"|"&RC[41]&"|"&RC[42]&"|"&RC[43]&"|"&RC[44]&"|"&RC[45]&"|"&RC[46]&"|"&RC[47]&"|"&RC[48]&"|"&RC[49]&"|"&RC[50]&"|"&RC[51] -> 888|10|18|18|18|18|18|18|92|92|37|37|37|37|37|37|185|185|18|18|18|18|18|18|92|92|92500|92500|92500|92500|92500|92500|462500|462500|185|185|185|185|185|185|925|925|1850|1850|1850|1850|1850|1850|9250|9250 | L23: 19005|200#10022|10 | M23: 888 | N23: 10 | O23: =INT(R6C*(1+0.05*RC1)) -> 18 | P23: =INT(R6C*(1+0.05*RC1)) -> 18 | Q23: =INT(R6C*(1+0.05*RC1)) -> 18 | R23: =INT(R6C*(1+0.05*RC1)) -> 18 | S23: =INT(R6C*(1+0.05*RC1)) -> 18 | T23: =INT(R6C*(1+0.05*RC1)) -> 18 | U23: =INT(R6C*(1+0.05*RC1)) -> 92 | V23: =INT(R6C*(1+0.05*RC1)) -> 92 | W23: =INT(R6C*(1+0.05*RC1)) -> 37 | X23: =INT(R6C*(1+0.05*RC1)) -> 37 | Y23: =INT(R6C*(1+0.05*RC1)) -> 37 | Z23: =INT(R6C*(1+0.05*RC1)) -> 37 | AA23: =INT(R6C*(1+0.05*RC1)) -> 37 | AB23: =INT(R6C*(1+0.05*RC1)) -> 37 | AC23: =INT(R6C*(1+0.05*RC1)) -> 185 | AD23: =INT(R6C*(1+0.05*RC1)) -> 185 | AE23: =INT(R6C*(1+0.05*RC1)) -> 18 | AF23: =INT(R6C*(1+0.05*RC1)) -> 18 | AG23: =INT(R6C*(1+0.05*RC1)) -> 18 | AH23: =INT(R6C*(1+0.05*RC1)) -> 18 | AI23: =INT(R6C*(1+0.05*RC1)) -> 18 | AJ23: =INT(R6C*(1+0.05*RC1)) -> 18 | AK23: =INT(R6C*(1+0.05*RC1)) -> 92 | AL23: =INT(R6C*(1+0.05*RC1)) -> 92 | AM23: =INT(R6C*(1+0.05*RC1)) -> 92500 | AN23: =INT(R6C*(1+0.05*RC1)) -> 92500 | AO23: =INT(R6C*(1+0.05*RC1)) -> 92500 | AP23: =INT(R6C*(1+0.05*RC1)) -> 92500 | AQ23: =INT(R6C*(1+0.05*RC1)) -> 92500 | AR23: =INT(R6C*(1+0.05*RC1)) -> 92500 | AS23: =INT(R6C*(1+0.05*RC1)) -> 462500 | AT23: =INT(R6C*(1+0.05*RC1)) -> 462500 | AU23: =INT(R6C*(1+0.05*RC1)) -> 185 | AV23: =INT(R6C*(1+0.05*RC1)) -> 185 | AW23: =INT(R6C*(1+0.05*RC1)) -> 185 | AX23: =INT(R6C*(1+0.05*RC1)) -> 185 | AY23: =INT(R6C*(1+0.05*RC1)) -> 185 | AZ23: =INT(R6C*(1+0.05*RC1)) -> 185 | BA23: =INT(R6C*(1+0.05*RC1)) -> 925 | BB23: =INT(R6C*(1+0.05*RC1)) -> 925 | BC23: =INT(R6C*(1+0.05*RC1)) -> 1850 | BD23: =INT(R6C*(1+0.05*RC1)) -> 1850 | BE23: =INT(R6C*(1+0.05*RC1)) -> 1850 | BF23: =INT(R6C*(1+0.05*RC1)) -> 1850 | BG23: =INT(R6C*(1+0.05*RC1)) -> 1850 | BH23: =INT(R6C*(1+0.05*RC1)) -> 1850 | BI23: =INT(R6C*(1+0.05*RC1)) -> 9250 | BJ23: =INT(R6C*(1+0.05*RC1)) -> 9250
A24: 18 | B24: 3 | C24: 18 | D24: 第十八章 野性 | E24: =990+RC[-4]*10&"|"&991+RC[-4]*10&"|"&992+RC[-4]*10 -> 1170|1171|1172 | F24: 0|1|2 | G24: 500 | H24: 380 | I24: 500 | J24: 19005|10022|10004|10004|10004|10004|10004|10004|10004|10004|10010|10010|10010|10010|10010|10010|10010|10010|10014|10014|10014|10014|10014|10014|10014|10014|19003|19003|19003|19003|19003|19003|19003|19003|19006|19006|19006|19006|19006|19006|19006|19006|19012|19012|19012|19012|19012|19012|19012|19012 | K24: =RC[2]&"|"&RC[3]&"|"&RC[4]&"|"&RC[5]&"|"&RC[6]&"|"&RC[7]&"|"&RC[8]&"|"&RC[9]&"|"&RC[10]&"|"&RC[11]&"|"&RC[12]&"|"&RC[13]&"|"&RC[14]&"|"&RC[15]&"|"&RC[16]&"|"&RC[17]&"|"&RC[18]&"|"&RC[19]&"|"&RC[20]&"|"&RC[21]&"|"&RC[22]&"|"&RC[23]&"|"&RC[24]&"|"&RC[25]&"|"&RC[26]&"|"&RC[27]&"|"&RC[28]&"|"&RC[29]&"|"&RC[30]&"|"&RC[31]&"|"&RC[32]&"|"&RC[33]&"|"&RC[34]&"|"&RC[35]&"|"&RC[36]&"|"&RC[37]&"|"&RC[38]&"|"&RC[39]&"|"&RC[40]&"|"&RC[41]&"|"&RC[42]&"|"&RC[43]&"|"&RC[44]&"|"&RC[45]&"|"&RC[46]&"|"&RC[47]&"|"&RC[48]&"|"&RC[49]&"|"&RC[50]&"|"&RC[51] -> 888|10|19|19|19|19|19|19|95|95|38|38|38|38|38|38|190|190|19|19|19|19|19|19|95|95|95000|95000|95000|95000|95000|95000|475000|475000|190|190|190|190|190|190|950|950|1900|1900|1900|1900|1900|1900|9500|9500 | L24: 19005|200#19006|500 | M24: 888 | N24: 10 | O24: =INT(R6C*(1+0.05*RC1)) -> 19 | P24: =INT(R6C*(1+0.05*RC1)) -> 19 | Q24: =INT(R6C*(1+0.05*RC1)) -> 19 | R24: =INT(R6C*(1+0.05*RC1)) -> 19 | S24: =INT(R6C*(1+0.05*RC1)) -> 19 | T24: =INT(R6C*(1+0.05*RC1)) -> 19 | U24: =INT(R6C*(1+0.05*RC1)) -> 95 | V24: =INT(R6C*(1+0.05*RC1)) -> 95 | W24: =INT(R6C*(1+0.05*RC1)) -> 38 | X24: =INT(R6C*(1+0.05*RC1)) -> 38 | Y24: =INT(R6C*(1+0.05*RC1)) -> 38 | Z24: =INT(R6C*(1+0.05*RC1)) -> 38 | AA24: =INT(R6C*(1+0.05*RC1)) -> 38 | AB24: =INT(R6C*(1+0.05*RC1)) -> 38 | AC24: =INT(R6C*(1+0.05*RC1)) -> 190 | AD24: =INT(R6C*(1+0.05*RC1)) -> 190 | AE24: =INT(R6C*(1+0.05*RC1)) -> 19 | AF24: =INT(R6C*(1+0.05*RC1)) -> 19 | AG24: =INT(R6C*(1+0.05*RC1)) -> 19 | AH24: =INT(R6C*(1+0.05*RC1)) -> 19 | AI24: =INT(R6C*(1+0.05*RC1)) -> 19 | AJ24: =INT(R6C*(1+0.05*RC1)) -> 19 | AK24: =INT(R6C*(1+0.05*RC1)) -> 95 | AL24: =INT(R6C*(1+0.05*RC1)) -> 95 | AM24: =INT(R6C*(1+0.05*RC1)) -> 95000 | AN24: =INT(R6C*(1+0.05*RC1)) -> 95000 | AO24: =INT(R6C*(1+0.05*RC1)) -> 95000 | AP24: =INT(R6C*(1+0.05*RC1)) -> 95000 | AQ24: =INT(R6C*(1+0.05*RC1)) -> 95000 | AR24: =INT(R6C*(1+0.05*RC1)) -> 95000 | AS24: =INT(R6C*(1+0.05*RC1)) -> 475000 | AT24: =INT(R6C*(1+0.05*RC1)) -> 475000 | AU24: =INT(R6C*(1+0.05*RC1)) -> 190 | AV24: =INT(R6C*(1+0.05*RC1)) -> 190 | AW24: =INT(R6C*(1+0.05*RC1)) -> 190 | AX24: =INT(R6C*(1+0.05*RC1)) -> 190 | AY24: =INT(R6C*(1+0.05*RC1)) -> 190 | AZ24: =INT(R6C*(1+0.05*RC1)) -> 190 | BA24: =INT(R6C*(1+0.05*RC1)) -> 950 | BB24: =INT(R6C*(1+0.05*RC1)) -> 950 | BC24: =INT(R6C*(1+0.05*RC1)) -> 1900 | BD24: =INT(R6C*(1+0.05*RC1)) -> 1900 | BE24: =INT(R6C*(1+0.05*RC1)) -> 1900 | BF24: =INT(R6C*(1+0.05*RC1)) -> 1900 | BG24: =INT(R6C*(1+0.05*RC1)) -> 1900 | BH24: =INT(R6C*(1+0.05*RC1)) -> 1900 | BI24: =INT(R6C*(1+0.05*RC1)) -> 9500 | BJ24: =INT(R6C*(1+0.05*RC1)) -> 9500
A25: 19 | B25: 1 | C25: 19 | D25: 第十九章 新生 | E25: =990+RC[-4]*10&"|"&991+RC[-4]*10&"|"&992+RC[-4]*10 -> 1180|1181|1182 | F25: 0|1|2 | G25: 500 | H25: 390 | I25: 500 | J25: 19005|10022|10004|10004|10004|10004|10004|10004|10004|10004|10010|10010|10010|10010|10010|10010|10010|10010|10014|10014|10014|10014|10014|10014|10014|10014|19003|19003|19003|19003|19003|19003|19003|19003|19006|19006|19006|19006|19006|19006|19006|19006|19012|19012|19012|19012|19012|19012|19012|19012 | K25: =RC[2]&"|"&RC[3]&"|"&RC[4]&"|"&RC[5]&"|"&RC[6]&"|"&RC[7]&"|"&RC[8]&"|"&RC[9]&"|"&RC[10]&"|"&RC[11]&"|"&RC[12]&"|"&RC[13]&"|"&RC[14]&"|"&RC[15]&"|"&RC[16]&"|"&RC[17]&"|"&RC[18]&"|"&RC[19]&"|"&RC[20]&"|"&RC[21]&"|"&RC[22]&"|"&RC[23]&"|"&RC[24]&"|"&RC[25]&"|"&RC[26]&"|"&RC[27]&"|"&RC[28]&"|"&RC[29]&"|"&RC[30]&"|"&RC[31]&"|"&RC[32]&"|"&RC[33]&"|"&RC[34]&"|"&RC[35]&"|"&RC[36]&"|"&RC[37]&"|"&RC[38]&"|"&RC[39]&"|"&RC[40]&"|"&RC[41]&"|"&RC[42]&"|"&RC[43]&"|"&RC[44]&"|"&RC[45]&"|"&RC[46]&"|"&RC[47]&"|"&RC[48]&"|"&RC[49]&"|"&RC[50]&"|"&RC[51] -> 888|10|19|19|19|19|19|19|97|97|39|39|39|39|39|39|195|195|19|19|19|19|19|19|97|97|97500|97500|97500|97500|97500|97500|487500|487500|195|195|195|195|195|195|975|975|1950|1950|1950|1950|1950|1950|9750|9750 | L25: 19005|200#19012|5000 | M25: 888 | N25: 10 | O25: =INT(R6C*(1+0.05*RC1)) -> 19 | P25: =INT(R6C*(1+0.05*RC1)) -> 19 | Q25: =INT(R6C*(1+0.05*RC1)) -> 19 | R25: =INT(R6C*(1+0.05*RC1)) -> 19 | S25: =INT(R6C*(1+0.05*RC1)) -> 19 | T25: =INT(R6C*(1+0.05*RC1)) -> 19 | U25: =INT(R6C*(1+0.05*RC1)) -> 97 | V25: =INT(R6C*(1+0.05*RC1)) -> 97 | W25: =INT(R6C*(1+0.05*RC1)) -> 39 | X25: =INT(R6C*(1+0.05*RC1)) -> 39 | Y25: =INT(R6C*(1+0.05*RC1)) -> 39 | Z25: =INT(R6C*(1+0.05*RC1)) -> 39 | AA25: =INT(R6C*(1+0.05*RC1)) -> 39 | AB25: =INT(R6C*(1+0.05*RC1)) -> 39 | AC25: =INT(R6C*(1+0.05*RC1)) -> 195 | AD25: =INT(R6C*(1+0.05*RC1)) -> 195 | AE25: =INT(R6C*(1+0.05*RC1)) -> 19 | AF25: =INT(R6C*(1+0.05*RC1)) -> 19 | AG25: =INT(R6C*(1+0.05*RC1)) -> 19 | AH25: =INT(R6C*(1+0.05*RC1)) -> 19 | AI25: =INT(R6C*(1+0.05*RC1)) -> 19 | AJ25: =INT(R6C*(1+0.05*RC1)) -> 19 | AK25: =INT(R6C*(1+0.05*RC1)) -> 97 | AL25: =INT(R6C*(1+0.05*RC1)) -> 97 | AM25: =INT(R6C*(1+0.05*RC1)) -> 97500 | AN25: =INT(R6C*(1+0.05*RC1)) -> 97500 | AO25: =INT(R6C*(1+0.05*RC1)) -> 97500 | AP25: =INT(R6C*(1+0.05*RC1)) -> 97500 | AQ25: =INT(R6C*(1+0.05*RC1)) -> 97500 | AR25: =INT(R6C*(1+0.05*RC1)) -> 97500 | AS25: =INT(R6C*(1+0.05*RC1)) -> 487500 | AT25: =INT(R6C*(1+0.05*RC1)) -> 487500 | AU25: =INT(R6C*(1+0.05*RC1)) -> 195 | AV25: =INT(R6C*(1+0.05*RC1)) -> 195 | AW25: =INT(R6C*(1+0.05*RC1)) -> 195 | AX25: =INT(R6C*(1+0.05*RC1)) -> 195 | AY25: =INT(R6C*(1+0.05*RC1)) -> 195 | AZ25: =INT(R6C*(1+0.05*RC1)) -> 195 | BA25: =INT(R6C*(1+0.05*RC1)) -> 975 | BB25: =INT(R6C*(1+0.05*RC1)) -> 975 | BC25: =INT(R6C*(1+0.05*RC1)) -> 1950 | BD25: =INT(R6C*(1+0.05*RC1)) -> 1950 | BE25: =INT(R6C*(1+0.05*RC1)) -> 1950 | BF25: =INT(R6C*(1+0.05*RC1)) -> 1950 | BG25: =INT(R6C*(1+0.05*RC1)) -> 1950 | BH25: =INT(R6C*(1+0.05*RC1)) -> 1950 | BI25: =INT(R6C*(1+0.05*RC1)) -> 9750 | BJ25: =INT(R6C*(1+0.05*RC1)) -> 9750
A26: 20 | B26: 2 | C26: 20 | D26: 第二十章 烈焰 | E26: =990+RC[-4]*10&"|"&991+RC[-4]*10&"|"&992+RC[-4]*10 -> 1190|1191|1192 | F26: 0|1|2 | G26: 500 | H26: 400 | I26: 500 | J26: 19005|10022|10004|10004|10004|10004|10004|10004|10004|10004|10010|10010|10010|10010|10010|10010|10010|10010|10014|10014|10014|10014|10014|10014|10014|10014|19003|19003|19003|19003|19003|19003|19003|19003|19006|19006|19006|19006|19006|19006|19006|19006|19012|19012|19012|19012|19012|19012|19012|19012 | K26: =RC[2]&"|"&RC[3]&"|"&RC[4]&"|"&RC[5]&"|"&RC[6]&"|"&RC[7]&"|"&RC[8]&"|"&RC[9]&"|"&RC[10]&"|"&RC[11]&"|"&RC[12]&"|"&RC[13]&"|"&RC[14]&"|"&RC[15]&"|"&RC[16]&"|"&RC[17]&"|"&RC[18]&"|"&RC[19]&"|"&RC[20]&"|"&RC[21]&"|"&RC[22]&"|"&RC[23]&"|"&RC[24]&"|"&RC[25]&"|"&RC[26]&"|"&RC[27]&"|"&RC[28]&"|"&RC[29]&"|"&RC[30]&"|"&RC[31]&"|"&RC[32]&"|"&RC[33]&"|"&RC[34]&"|"&RC[35]&"|"&RC[36]&"|"&RC[37]&"|"&RC[38]&"|"&RC[39]&"|"&RC[40]&"|"&RC[41]&"|"&RC[42]&"|"&RC[43]&"|"&RC[44]&"|"&RC[45]&"|"&RC[46]&"|"&RC[47]&"|"&RC[48]&"|"&RC[49]&"|"&RC[50]&"|"&RC[51] -> 888|10|20|20|20|20|20|20|100|100|40|40|40|40|40|40|200|200|20|20|20|20|20|20|100|100|100000|100000|100000|100000|100000|100000|500000|500000|200|200|200|200|200|200|1000|1000|2000|2000|2000|2000|2000|2000|10000|10000 | L26: 19005|200#19103|50 | M26: 888 | N26: 10 | O26: =INT(R6C*(1+0.05*RC1)) -> 20 | P26: =INT(R6C*(1+0.05*RC1)) -> 20 | Q26: =INT(R6C*(1+0.05*RC1)) -> 20 | R26: =INT(R6C*(1+0.05*RC1)) -> 20 | S26: =INT(R6C*(1+0.05*RC1)) -> 20 | T26: =INT(R6C*(1+0.05*RC1)) -> 20 | U26: =INT(R6C*(1+0.05*RC1)) -> 100 | V26: =INT(R6C*(1+0.05*RC1)) -> 100 | W26: =INT(R6C*(1+0.05*RC1)) -> 40 | X26: =INT(R6C*(1+0.05*RC1)) -> 40 | Y26: =INT(R6C*(1+0.05*RC1)) -> 40 | Z26: =INT(R6C*(1+0.05*RC1)) -> 40 | AA26: =INT(R6C*(1+0.05*RC1)) -> 40 | AB26: =INT(R6C*(1+0.05*RC1)) -> 40 | AC26: =INT(R6C*(1+0.05*RC1)) -> 200 | AD26: =INT(R6C*(1+0.05*RC1)) -> 200 | AE26: =INT(R6C*(1+0.05*RC1)) -> 20 | AF26: =INT(R6C*(1+0.05*RC1)) -> 20 | AG26: =INT(R6C*(1+0.05*RC1)) -> 20 | AH26: =INT(R6C*(1+0.05*RC1)) -> 20 | AI26: =INT(R6C*(1+0.05*RC1)) -> 20 | AJ26: =INT(R6C*(1+0.05*RC1)) -> 20 | AK26: =INT(R6C*(1+0.05*RC1)) -> 100 | AL26: =INT(R6C*(1+0.05*RC1)) -> 100 | AM26: =INT(R6C*(1+0.05*RC1)) -> 100000 | AN26: =INT(R6C*(1+0.05*RC1)) -> 100000 | AO26: =INT(R6C*(1+0.05*RC1)) -> 100000 | AP26: =INT(R6C*(1+0.05*RC1)) -> 100000 | AQ26: =INT(R6C*(1+0.05*RC1)) -> 100000 | AR26: =INT(R6C*(1+0.05*RC1)) -> 100000 | AS26: =INT(R6C*(1+0.05*RC1)) -> 500000 | AT26: =INT(R6C*(1+0.05*RC1)) -> 500000 | AU26: =INT(R6C*(1+0.05*RC1)) -> 200 | AV26: =INT(R6C*(1+0.05*RC1)) -> 200 | AW26: =INT(R6C*(1+0.05*RC1)) -> 200 | AX26: =INT(R6C*(1+0.05*RC1)) -> 200 | AY26: =INT(R6C*(1+0.05*RC1)) -> 200 | AZ26: =INT(R6C*(1+0.05*RC1)) -> 200 | BA26: =INT(R6C*(1+0.05*RC1)) -> 1000 | BB26: =INT(R6C*(1+0.05*RC1)) -> 1000 | BC26: =INT(R6C*(1+0.05*RC1)) -> 2000 | BD26: =INT(R6C*(1+0.05*RC1)) -> 2000 | BE26: =INT(R6C*(1+0.05*RC1)) -> 2000 | BF26: =INT(R6C*(1+0.05*RC1)) -> 2000 | BG26: =INT(R6C*(1+0.05*RC1)) -> 2000 | BH26: =INT(R6C*(1+0.05*RC1)) -> 2000 | BI26: =INT(R6C*(1+0.05*RC1)) -> 10000 | BJ26: =INT(R6C*(1+0.05*RC1)) -> 10000
A27: 21 | B27: 3 | C27: 21 | D27: 第二十一章 湮灭 | E27: =990+RC[-4]*10&"|"&991+RC[-4]*10&"|"&992+RC[-4]*10 -> 1200|1201|1202 | F27: 0|1|2 | G27: 500 | H27: 410 | I27: 500 | J27: 19005|10022|10004|10004|10004|10004|10004|10004|10004|10004|10010|10010|10010|10010|10010|10010|10010|10010|10014|10014|10014|10014|10014|10014|10014|10014|19003|19003|19003|19003|19003|19003|19003|19003|19006|19006|19006|19006|19006|19006|19006|19006|19012|19012|19012|19012|19012|19012|19012|19012 | K27: =RC[2]&"|"&RC[3]&"|"&RC[4]&"|"&RC[5]&"|"&RC[6]&"|"&RC[7]&"|"&RC[8]&"|"&RC[9]&"|"&RC[10]&"|"&RC[11]&"|"&RC[12]&"|"&RC[13]&"|"&RC[14]&"|"&RC[15]&"|"&RC[16]&"|"&RC[17]&"|"&RC[18]&"|"&RC[19]&"|"&RC[20]&"|"&RC[21]&"|"&RC[22]&"|"&RC[23]&"|"&RC[24]&"|"&RC[25]&"|"&RC[26]&"|"&RC[27]&"|"&RC[28]&"|"&RC[29]&"|"&RC[30]&"|"&RC[31]&"|"&RC[32]&"|"&RC[33]&"|"&RC[34]&"|"&RC[35]&"|"&RC[36]&"|"&RC[37]&"|"&RC[38]&"|"&RC[39]&"|"&RC[40]&"|"&RC[41]&"|"&RC[42]&"|"&RC[43]&"|"&RC[44]&"|"&RC[45]&"|"&RC[46]&"|"&RC[47]&"|"&RC[48]&"|"&RC[49]&"|"&RC[50]&"|"&RC[51] -> 888|10|20|20|20|20|20|20|102|102|41|41|41|41|41|41|205|205|20|20|20|20|20|20|102|102|102500|102500|102500|102500|102500|102500|512500|512500|205|205|205|205|205|205|1025|1025|2050|2050|2050|2050|2050|2050|10250|10250 | L27: 19005|200#10022|15 | M27: 888 | N27: 10 | O27: =INT(R6C*(1+0.05*RC1)) -> 20 | P27: =INT(R6C*(1+0.05*RC1)) -> 20 | Q27: =INT(R6C*(1+0.05*RC1)) -> 20 | R27: =INT(R6C*(1+0.05*RC1)) -> 20 | S27: =INT(R6C*(1+0.05*RC1)) -> 20 | T27: =INT(R6C*(1+0.05*RC1)) -> 20 | U27: =INT(R6C*(1+0.05*RC1)) -> 102 | V27: =INT(R6C*(1+0.05*RC1)) -> 102 | W27: =INT(R6C*(1+0.05*RC1)) -> 41 | X27: =INT(R6C*(1+0.05*RC1)) -> 41 | Y27: =INT(R6C*(1+0.05*RC1)) -> 41 | Z27: =INT(R6C*(1+0.05*RC1)) -> 41 | AA27: =INT(R6C*(1+0.05*RC1)) -> 41 | AB27: =INT(R6C*(1+0.05*RC1)) -> 41 | AC27: =INT(R6C*(1+0.05*RC1)) -> 205 | AD27: =INT(R6C*(1+0.05*RC1)) -> 205 | AE27: =INT(R6C*(1+0.05*RC1)) -> 20 | AF27: =INT(R6C*(1+0.05*RC1)) -> 20 | AG27: =INT(R6C*(1+0.05*RC1)) -> 20 | AH27: =INT(R6C*(1+0.05*RC1)) -> 20 | AI27: =INT(R6C*(1+0.05*RC1)) -> 20 | AJ27: =INT(R6C*(1+0.05*RC1)) -> 20 | AK27: =INT(R6C*(1+0.05*RC1)) -> 102 | AL27: =INT(R6C*(1+0.05*RC1)) -> 102 | AM27: =INT(R6C*(1+0.05*RC1)) -> 102500 | AN27: =INT(R6C*(1+0.05*RC1)) -> 102500 | AO27: =INT(R6C*(1+0.05*RC1)) -> 102500 | AP27: =INT(R6C*(1+0.05*RC1)) -> 102500 | AQ27: =INT(R6C*(1+0.05*RC1)) -> 102500 | AR27: =INT(R6C*(1+0.05*RC1)) -> 102500 | AS27: =INT(R6C*(1+0.05*RC1)) -> 512500 | AT27: =INT(R6C*(1+0.05*RC1)) -> 512500 | AU27: =INT(R6C*(1+0.05*RC1)) -> 205 | AV27: =INT(R6C*(1+0.05*RC1)) -> 205 | AW27: =INT(R6C*(1+0.05*RC1)) -> 205 | AX27: =INT(R6C*(1+0.05*RC1)) -> 205 | AY27: =INT(R6C*(1+0.05*RC1)) -> 205 | AZ27: =INT(R6C*(1+0.05*RC1)) -> 205 | BA27: =INT(R6C*(1+0.05*RC1)) -> 1025 | BB27: =INT(R6C*(1+0.05*RC1)) -> 1025 | BC27: =INT(R6C*(1+0.05*RC1)) -> 2050 | BD27: =INT(R6C*(1+0.05*RC1)) -> 2050 | BE27: =INT(R6C*(1+0.05*RC1)) -> 2050 | BF27: =INT(R6C*(1+0.05*RC1)) -> 2050 | BG27: =INT(R6C*(1+0.05*RC1)) -> 2050 | BH27: =INT(R6C*(1+0.05*RC1)) -> 2050 | BI27: =INT(R6C*(1+0.05*RC1)) -> 10250 | BJ27: =INT(R6C*(1+0.05*RC1)) -> 10250
A28: 22 | B28: 1 | C28: 22 | D28: 第二十二章 风暴 | E28: =990+RC[-4]*10&"|"&991+RC[-4]*10&"|"&992+RC[-4]*10 -> 1210|1211|1212 | F28: 0|1|2 | G28: 500 | H28: 420 | I28: 500 | J28: 19005|10022|10004|10004|10004|10004|10004|10004|10004|10004|10010|10010|10010|10010|10010|10010|10010|10010|10014|10014|10014|10014|10014|10014|10014|10014|19003|19003|19003|19003|19003|19003|19003|19003|19006|19006|19006|19006|19006|19006|19006|19006|19012|19012|19012|19012|19012|19012|19012|19012 | K28: =RC[2]&"|"&RC[3]&"|"&RC[4]&"|"&RC[5]&"|"&RC[6]&"|"&RC[7]&"|"&RC[8]&"|"&RC[9]&"|"&RC[10]&"|"&RC[11]&"|"&RC[12]&"|"&RC[13]&"|"&RC[14]&"|"&RC[15]&"|"&RC[16]&"|"&RC[17]&"|"&RC[18]&"|"&RC[19]&"|"&RC[20]&"|"&RC[21]&"|"&RC[22]&"|"&RC[23]&"|"&RC[24]&"|"&RC[25]&"|"&RC[26]&"|"&RC[27]&"|"&RC[28]&"|"&RC[29]&"|"&RC[30]&"|"&RC[31]&"|"&RC[32]&"|"&RC[33]&"|"&RC[34]&"|"&RC[35]&"|"&RC[36]&"|"&RC[37]&"|"&RC[38]&"|"&RC[39]&"|"&RC[40]&"|"&RC[41]&"|"&RC[42]&"|"&RC[43]&"|"&RC[44]&"|"&RC[45]&"|"&RC[46]&"|"&RC[47]&"|"&RC[48]&"|"&RC[49]&"|"&RC[50]&"|"&RC[51] -> 888|10|21|21|21|21|21|21|105|105|42|42|42|42|42|42|210|210|21|21|21|21|21|21|105|105|105000|105000|105000|105000|105000|105000|525000|525000|210|210|210|210|210|210|1050|1050|2100|2100|2100|2100|2100|2100|10500|10500 | L28: 19005|200#19006|750 | M28: 888 | N28: 10 | O28: =INT(R6C*(1+0.05*RC1)) -> 21 | P28: =INT(R6C*(1+0.05*RC1)) -> 21 | Q28: =INT(R6C*(1+0.05*RC1)) -> 21 | R28: =INT(R6C*(1+0.05*RC1)) -> 21 | S28: =INT(R6C*(1+0.05*RC1)) -> 21 | T28: =INT(R6C*(1+0.05*RC1)) -> 21 | U28: =INT(R6C*(1+0.05*RC1)) -> 105 | V28: =INT(R6C*(1+0.05*RC1)) -> 105 | W28: =INT(R6C*(1+0.05*RC1)) -> 42 | X28: =INT(R6C*(1+0.05*RC1)) -> 42 | Y28: =INT(R6C*(1+0.05*RC1)) -> 42 | Z28: =INT(R6C*(1+0.05*RC1)) -> 42 | AA28: =INT(R6C*(1+0.05*RC1)) -> 42 | AB28: =INT(R6C*(1+0.05*RC1)) -> 42 | AC28: =INT(R6C*(1+0.05*RC1)) -> 210 | AD28: =INT(R6C*(1+0.05*RC1)) -> 210 | AE28: =INT(R6C*(1+0.05*RC1)) -> 21 | AF28: =INT(R6C*(1+0.05*RC1)) -> 21 | AG28: =INT(R6C*(1+0.05*RC1)) -> 21 | AH28: =INT(R6C*(1+0.05*RC1)) -> 21 | AI28: =INT(R6C*(1+0.05*RC1)) -> 21 | AJ28: =INT(R6C*(1+0.05*RC1)) -> 21 | AK28: =INT(R6C*(1+0.05*RC1)) -> 105 | AL28: =INT(R6C*(1+0.05*RC1)) -> 105 | AM28: =INT(R6C*(1+0.05*RC1)) -> 105000 | AN28: =INT(R6C*(1+0.05*RC1)) -> 105000 | AO28: =INT(R6C*(1+0.05*RC1)) -> 105000 | AP28: =INT(R6C*(1+0.05*RC1)) -> 105000 | AQ28: =INT(R6C*(1+0.05*RC1)) -> 105000 | AR28: =INT(R6C*(1+0.05*RC1)) -> 105000 | AS28: =INT(R6C*(1+0.05*RC1)) -> 525000 | AT28: =INT(R6C*(1+0.05*RC1)) -> 525000 | AU28: =INT(R6C*(1+0.05*RC1)) -> 210 | AV28: =INT(R6C*(1+0.05*RC1)) -> 210 | AW28: =INT(R6C*(1+0.05*RC1)) -> 210 | AX28: =INT(R6C*(1+0.05*RC1)) -> 210 | AY28: =INT(R6C*(1+0.05*RC1)) -> 210 | AZ28: =INT(R6C*(1+0.05*RC1)) -> 210 | BA28: =INT(R6C*(1+0.05*RC1)) -> 1050 | BB28: =INT(R6C*(1+0.05*RC1)) -> 1050 | BC28: =INT(R6C*(1+0.05*RC1)) -> 2100 | BD28: =INT(R6C*(1+0.05*RC1)) -> 2100 | BE28: =INT(R6C*(1+0.05*RC1)) -> 2100 | BF28: =INT(R6C*(1+0.05*RC1)) -> 2100 | BG28: =INT(R6C*(1+0.05*RC1)) -> 2100 | BH28: =INT(R6C*(1+0.05*RC1)) -> 2100 | BI28: =INT(R6C*(1+0.05*RC1)) -> 10500 | BJ28: =INT(R6C*(1+0.05*RC1)) -> 10500
A29: 23 | B29: 2 | C29: 23 | D29: 第二十三章 天空 | E29: =990+RC[-4]*10&"|"&991+RC[-4]*10&"|"&992+RC[-4]*10 -> 1220|1221|1222 | F29: 0|1|2 | G29: 500 | H29: 430 | I29: 500 | J29: 19005|10022|10004|10004|10004|10004|10004|10004|10004|10004|10010|10010|10010|10010|10010|10010|10010|10010|10014|10014|10014|10014|10014|10014|10014|10014|19003|19003|19003|19003|19003|19003|19003|19003|19006|19006|19006|19006|19006|19006|19006|19006|19012|19012|19012|19012|19012|19012|19012|19012 | K29: =RC[2]&"|"&RC[3]&"|"&RC[4]&"|"&RC[5]&"|"&RC[6]&"|"&RC[7]&"|"&RC[8]&"|"&RC[9]&"|"&RC[10]&"|"&RC[11]&"|"&RC[12]&"|"&RC[13]&"|"&RC[14]&"|"&RC[15]&"|"&RC[16]&"|"&RC[17]&"|"&RC[18]&"|"&RC[19]&"|"&RC[20]&"|"&RC[21]&"|"&RC[22]&"|"&RC[23]&"|"&RC[24]&"|"&RC[25]&"|"&RC[26]&"|"&RC[27]&"|"&RC[28]&"|"&RC[29]&"|"&RC[30]&"|"&RC[31]&"|"&RC[32]&"|"&RC[33]&"|"&RC[34]&"|"&RC[35]&"|"&RC[36]&"|"&RC[37]&"|"&RC[38]&"|"&RC[39]&"|"&RC[40]&"|"&RC[41]&"|"&RC[42]&"|"&RC[43]&"|"&RC[44]&"|"&RC[45]&"|"&RC[46]&"|"&RC[47]&"|"&RC[48]&"|"&RC[49]&"|"&RC[50]&"|"&RC[51] -> 888|10|21|21|21|21|21|21|107|107|43|43|43|43|43|43|215|215|21|21|21|21|21|21|107|107|107500|107500|107500|107500|107500|107500|537500|537500|215|215|215|215|215|215|1075|1075|2150|2150|2150|2150|2150|2150|10750|10750 | L29: 19005|200#19012|7500 | M29: 888 | N29: 10 | O29: =INT(R6C*(1+0.05*RC1)) -> 21 | P29: =INT(R6C*(1+0.05*RC1)) -> 21 | Q29: =INT(R6C*(1+0.05*RC1)) -> 21 | R29: =INT(R6C*(1+0.05*RC1)) -> 21 | S29: =INT(R6C*(1+0.05*RC1)) -> 21 | T29: =INT(R6C*(1+0.05*RC1)) -> 21 | U29: =INT(R6C*(1+0.05*RC1)) -> 107 | V29: =INT(R6C*(1+0.05*RC1)) -> 107 | W29: =INT(R6C*(1+0.05*RC1)) -> 43 | X29: =INT(R6C*(1+0.05*RC1)) -> 43 | Y29: =INT(R6C*(1+0.05*RC1)) -> 43 | Z29: =INT(R6C*(1+0.05*RC1)) -> 43 | AA29: =INT(R6C*(1+0.05*RC1)) -> 43 | AB29: =INT(R6C*(1+0.05*RC1)) -> 43 | AC29: =INT(R6C*(1+0.05*RC1)) -> 215 | AD29: =INT(R6C*(1+0.05*RC1)) -> 215 | AE29: =INT(R6C*(1+0.05*RC1)) -> 21 | AF29: =INT(R6C*(1+0.05*RC1)) -> 21 | AG29: =INT(R6C*(1+0.05*RC1)) -> 21 | AH29: =INT(R6C*(1+0.05*RC1)) -> 21 | AI29: =INT(R6C*(1+0.05*RC1)) -> 21 | AJ29: =INT(R6C*(1+0.05*RC1)) -> 21 | AK29: =INT(R6C*(1+0.05*RC1)) -> 107 | AL29: =INT(R6C*(1+0.05*RC1)) -> 107 | AM29: =INT(R6C*(1+0.05*RC1)) -> 107500 | AN29: =INT(R6C*(1+0.05*RC1)) -> 107500 | AO29: =INT(R6C*(1+0.05*RC1)) -> 107500 | AP29: =INT(R6C*(1+0.05*RC1)) -> 107500 | AQ29: =INT(R6C*(1+0.05*RC1)) -> 107500 | AR29: =INT(R6C*(1+0.05*RC1)) -> 107500 | AS29: =INT(R6C*(1+0.05*RC1)) -> 537500 | AT29: =INT(R6C*(1+0.05*RC1)) -> 537500 | AU29: =INT(R6C*(1+0.05*RC1)) -> 215 | AV29: =INT(R6C*(1+0.05*RC1)) -> 215 | AW29: =INT(R6C*(1+0.05*RC1)) -> 215 | AX29: =INT(R6C*(1+0.05*RC1)) -> 215 | AY29: =INT(R6C*(1+0.05*RC1)) -> 215 | AZ29: =INT(R6C*(1+0.05*RC1)) -> 215 | BA29: =INT(R6C*(1+0.05*RC1)) -> 1075 | BB29: =INT(R6C*(1+0.05*RC1)) -> 1075 | BC29: =INT(R6C*(1+0.05*RC1)) -> 2150 | BD29: =INT(R6C*(1+0.05*RC1)) -> 2150 | BE29: =INT(R6C*(1+0.05*RC1)) -> 2150 | BF29: =INT(R6C*(1+0.05*RC1)) -> 2150 | BG29: =INT(R6C*(1+0.05*RC1)) -> 2150 | BH29: =INT(R6C*(1+0.05*RC1)) -> 2150 | BI29: =INT(R6C*(1+0.05*RC1)) -> 10750 | BJ29: =INT(R6C*(1+0.05*RC1)) -> 10750
A30: 24 | B30: 3 | C30: 24 | D30: 第二十四章 终焉 | E30: =990+RC[-4]*10&"|"&991+RC[-4]*10&"|"&992+RC[-4]*10 -> 1230|1231|1232 | F30: 0|1|2 | G30: 500 | H30: 440 | I30: 500 | J30: 19005|10022|10004|10004|10004|10004|10004|10004|10004|10004|10010|10010|10010|10010|10010|10010|10010|10010|10014|10014|10014|10014|10014|10014|10014|10014|19003|19003|19003|19003|19003|19003|19003|19003|19006|19006|19006|19006|19006|19006|19006|19006|19012|19012|19012|19012|19012|19012|19012|19012 | K30: =RC[2]&"|"&RC[3]&"|"&RC[4]&"|"&RC[5]&"|"&RC[6]&"|"&RC[7]&"|"&RC[8]&"|"&RC[9]&"|"&RC[10]&"|"&RC[11]&"|"&RC[12]&"|"&RC[13]&"|"&RC[14]&"|"&RC[15]&"|"&RC[16]&"|"&RC[17]&"|"&RC[18]&"|"&RC[19]&"|"&RC[20]&"|"&RC[21]&"|"&RC[22]&"|"&RC[23]&"|"&RC[24]&"|"&RC[25]&"|"&RC[26]&"|"&RC[27]&"|"&RC[28]&"|"&RC[29]&"|"&RC[30]&"|"&RC[31]&"|"&RC[32]&"|"&RC[33]&"|"&RC[34]&"|"&RC[35]&"|"&RC[36]&"|"&RC[37]&"|"&RC[38]&"|"&RC[39]&"|"&RC[40]&"|"&RC[41]&"|"&RC[42]&"|"&RC[43]&"|"&RC[44]&"|"&RC[45]&"|"&RC[46]&"|"&RC[47]&"|"&RC[48]&"|"&RC[49]&"|"&RC[50]&"|"&RC[51] -> 888|10|22|22|22|22|22|22|110|110|44|44|44|44|44|44|220|220|22|22|22|22|22|22|110|110|110000|110000|110000|110000|110000|110000|550000|550000|220|220|220|220|220|220|1100|1100|2200|2200|2200|2200|2200|2200|11000|11000 | L30: 19005|200#19103|75 | M30: 888 | N30: 10 | O30: =INT(R6C*(1+0.05*RC1)) -> 22 | P30: =INT(R6C*(1+0.05*RC1)) -> 22 | Q30: =INT(R6C*(1+0.05*RC1)) -> 22 | R30: =INT(R6C*(1+0.05*RC1)) -> 22 | S30: =INT(R6C*(1+0.05*RC1)) -> 22 | T30: =INT(R6C*(1+0.05*RC1)) -> 22 | U30: =INT(R6C*(1+0.05*RC1)) -> 110 | V30: =INT(R6C*(1+0.05*RC1)) -> 110 | W30: =INT(R6C*(1+0.05*RC1)) -> 44 | X30: =INT(R6C*(1+0.05*RC1)) -> 44 | Y30: =INT(R6C*(1+0.05*RC1)) -> 44 | Z30: =INT(R6C*(1+0.05*RC1)) -> 44 | AA30: =INT(R6C*(1+0.05*RC1)) -> 44 | AB30: =INT(R6C*(1+0.05*RC1)) -> 44 | AC30: =INT(R6C*(1+0.05*RC1)) -> 220 | AD30: =INT(R6C*(1+0.05*RC1)) -> 220 | AE30: =INT(R6C*(1+0.05*RC1)) -> 22 | AF30: =INT(R6C*(1+0.05*RC1)) -> 22 | AG30: =INT(R6C*(1+0.05*RC1)) -> 22 | AH30: =INT(R6C*(1+0.05*RC1)) -> 22 | AI30: =INT(R6C*(1+0.05*RC1)) -> 22 | AJ30: =INT(R6C*(1+0.05*RC1)) -> 22 | AK30: =INT(R6C*(1+0.05*RC1)) -> 110 | AL30: =INT(R6C*(1+0.05*RC1)) -> 110 | AM30: =INT(R6C*(1+0.05*RC1)) -> 110000 | AN30: =INT(R6C*(1+0.05*RC1)) -> 110000 | AO30: =INT(R6C*(1+0.05*RC1)) -> 110000 | AP30: =INT(R6C*(1+0.05*RC1)) -> 110000 | AQ30: =INT(R6C*(1+0.05*RC1)) -> 110000 | AR30: =INT(R6C*(1+0.05*RC1)) -> 110000 | AS30: =INT(R6C*(1+0.05*RC1)) -> 550000 | AT30: =INT(R6C*(1+0.05*RC1)) -> 550000 | AU30: =INT(R6C*(1+0.05*RC1)) -> 220 | AV30: =INT(R6C*(1+0.05*RC1)) -> 220 | AW30: =INT(R6C*(1+0.05*RC1)) -> 220 | AX30: =INT(R6C*(1+0.05*RC1)) -> 220 | AY30: =INT(R6C*(1+0.05*RC1)) -> 220 | AZ30: =INT(R6C*(1+0.05*RC1)) -> 220 | BA30: =INT(R6C*(1+0.05*RC1)) -> 1100 | BB30: =INT(R6C*(1+0.05*RC1)) -> 1100 | BC30: =INT(R6C*(1+0.05*RC1)) -> 2200 | BD30: =INT(R6C*(1+0.05*RC1)) -> 2200 | BE30: =INT(R6C*(1+0.05*RC1)) -> 2200 | BF30: =INT(R6C*(1+0.05*RC1)) -> 2200 | BG30: =INT(R6C*(1+0.05*RC1)) -> 2200 | BH30: =INT(R6C*(1+0.05*RC1)) -> 2200 | BI30: =INT(R6C*(1+0.05*RC1)) -> 11000 | BJ30: =INT(R6C*(1+0.05*RC1)) -> 11000
A31: 25 | B31: 1 | C31: 25 | D31: 第二十五章 地狱 | E31: =990+RC[-4]*10&"|"&991+RC[-4]*10&"|"&992+RC[-4]*10 -> 1240|1241|1242 | F31: 0|1|2 | G31: 500 | H31: 450 | I31: 500 | J31: 19005|10022|10004|10004|10004|10004|10004|10004|10004|10004|10010|10010|10010|10010|10010|10010|10010|10010|10014|10014|10014|10014|10014|10014|10014|10014|19003|19003|19003|19003|19003|19003|19003|19003|19006|19006|19006|19006|19006|19006|19006|19006|19012|19012|19012|19012|19012|19012|19012|19012 | K31: =RC[2]&"|"&RC[3]&"|"&RC[4]&"|"&RC[5]&"|"&RC[6]&"|"&RC[7]&"|"&RC[8]&"|"&RC[9]&"|"&RC[10]&"|"&RC[11]&"|"&RC[12]&"|"&RC[13]&"|"&RC[14]&"|"&RC[15]&"|"&RC[16]&"|"&RC[17]&"|"&RC[18]&"|"&RC[19]&"|"&RC[20]&"|"&RC[21]&"|"&RC[22]&"|"&RC[23]&"|"&RC[24]&"|"&RC[25]&"|"&RC[26]&"|"&RC[27]&"|"&RC[28]&"|"&RC[29]&"|"&RC[30]&"|"&RC[31]&"|"&RC[32]&"|"&RC[33]&"|"&RC[34]&"|"&RC[35]&"|"&RC[36]&"|"&RC[37]&"|"&RC[38]&"|"&RC[39]&"|"&RC[40]&"|"&RC[41]&"|"&RC[42]&"|"&RC[43]&"|"&RC[44]&"|"&RC[45]&"|"&RC[46]&"|"&RC[47]&"|"&RC[48]&"|"&RC[49]&"|"&RC[50]&"|"&RC[51] -> 888|10|22|22|22|22|22|22|112|112|45|45|45|45|45|45|225|225|22|22|22|22|22|22|112|112|112500|112500|112500|112500|112500|112500|562500|562500|225|225|225|225|225|225|1125|1125|2250|2250|2250|2250|2250|2250|11250|11250 | L31: 19005|200#10022|15 | M31: 888 | N31: 10 | O31: =INT(R6C*(1+0.05*RC1)) -> 22 | P31: =INT(R6C*(1+0.05*RC1)) -> 22 | Q31: =INT(R6C*(1+0.05*RC1)) -> 22 | R31: =INT(R6C*(1+0.05*RC1)) -> 22 | S31: =INT(R6C*(1+0.05*RC1)) -> 22 | T31: =INT(R6C*(1+0.05*RC1)) -> 22 | U31: =INT(R6C*(1+0.05*RC1)) -> 112 | V31: =INT(R6C*(1+0.05*RC1)) -> 112 | W31: =INT(R6C*(1+0.05*RC1)) -> 45 | X31: =INT(R6C*(1+0.05*RC1)) -> 45 | Y31: =INT(R6C*(1+0.05*RC1)) -> 45 | Z31: =INT(R6C*(1+0.05*RC1)) -> 45 | AA31: =INT(R6C*(1+0.05*RC1)) -> 45 | AB31: =INT(R6C*(1+0.05*RC1)) -> 45 | AC31: =INT(R6C*(1+0.05*RC1)) -> 225 | AD31: =INT(R6C*(1+0.05*RC1)) -> 225 | AE31: =INT(R6C*(1+0.05*RC1)) -> 22 | AF31: =INT(R6C*(1+0.05*RC1)) -> 22 | AG31: =INT(R6C*(1+0.05*RC1)) -> 22 | AH31: =INT(R6C*(1+0.05*RC1)) -> 22 | AI31: =INT(R6C*(1+0.05*RC1)) -> 22 | AJ31: =INT(R6C*(1+0.05*RC1)) -> 22 | AK31: =INT(R6C*(1+0.05*RC1)) -> 112 | AL31: =INT(R6C*(1+0.05*RC1)) -> 112 | AM31: =INT(R6C*(1+0.05*RC1)) -> 112500 | AN31: =INT(R6C*(1+0.05*RC1)) -> 112500 | AO31: =INT(R6C*(1+0.05*RC1)) -> 112500 | AP31: =INT(R6C*(1+0.05*RC1)) -> 112500 | AQ31: =INT(R6C*(1+0.05*RC1)) -> 112500 | AR31: =INT(R6C*(1+0.05*RC1)) -> 112500 | AS31: =INT(R6C*(1+0.05*RC1)) -> 562500 | AT31: =INT(R6C*(1+0.05*RC1)) -> 562500 | AU31: =INT(R6C*(1+0.05*RC1)) -> 225 | AV31: =INT(R6C*(1+0.05*RC1)) -> 225 | AW31: =INT(R6C*(1+0.05*RC1)) -> 225 | AX31: =INT(R6C*(1+0.05*RC1)) -> 225 | AY31: =INT(R6C*(1+0.05*RC1)) -> 225 | AZ31: =INT(R6C*(1+0.05*RC1)) -> 225 | BA31: =INT(R6C*(1+0.05*RC1)) -> 1125 | BB31: =INT(R6C*(1+0.05*RC1)) -> 1125 | BC31: =INT(R6C*(1+0.05*RC1)) -> 2250 | BD31: =INT(R6C*(1+0.05*RC1)) -> 2250 | BE31: =INT(R6C*(1+0.05*RC1)) -> 2250 | BF31: =INT(R6C*(1+0.05*RC1)) -> 2250 | BG31: =INT(R6C*(1+0.05*RC1)) -> 2250 | BH31: =INT(R6C*(1+0.05*RC1)) -> 2250 | BI31: =INT(R6C*(1+0.05*RC1)) -> 11250 | BJ31: =INT(R6C*(1+0.05*RC1)) -> 11250
A32: 26 | B32: 2 | C32: 26 | D32: 第二十六章 神罚 | E32: =990+RC[-4]*10&"|"&991+RC[-4]*10&"|"&992+RC[-4]*10 -> 1250|1251|1252 | F32: 0|1|2 | G32: 500 | H32: 460 | I32: 500 | J32: 19005|10022|10004|10004|10004|10004|10004|10004|10004|10004|10010|10010|10010|10010|10010|10010|10010|10010|10014|10014|10014|10014|10014|10014|10014|10014|19003|19003|19003|19003|19003|19003|19003|19003|19006|19006|19006|19006|19006|19006|19006|19006|19012|19012|19012|19012|19012|19012|19012|19012 | K32: =RC[2]&"|"&RC[3]&"|"&RC[4]&"|"&RC[5]&"|"&RC[6]&"|"&RC[7]&"|"&RC[8]&"|"&RC[9]&"|"&RC[10]&"|"&RC[11]&"|"&RC[12]&"|"&RC[13]&"|"&RC[14]&"|"&RC[15]&"|"&RC[16]&"|"&RC[17]&"|"&RC[18]&"|"&RC[19]&"|"&RC[20]&"|"&RC[21]&"|"&RC[22]&"|"&RC[23]&"|"&RC[24]&"|"&RC[25]&"|"&RC[26]&"|"&RC[27]&"|"&RC[28]&"|"&RC[29]&"|"&RC[30]&"|"&RC[31]&"|"&RC[32]&"|"&RC[33]&"|"&RC[34]&"|"&RC[35]&"|"&RC[36]&"|"&RC[37]&"|"&RC[38]&"|"&RC[39]&"|"&RC[40]&"|"&RC[41]&"|"&RC[42]&"|"&RC[43]&"|"&RC[44]&"|"&RC[45]&"|"&RC[46]&"|"&RC[47]&"|"&RC[48]&"|"&RC[49]&"|"&RC[50]&"|"&RC[51] -> 888|10|23|23|23|23|23|23|115|115|46|46|46|46|46|46|230|230|23|23|23|23|23|23|115|115|115000|115000|115000|115000|115000|115000|575000|575000|230|230|230|230|230|230|1150|1150|2300|2300|2300|2300|2300|2300|11500|11500 | L32: 19005|200#19006|750 | M32: 888 | N32: 10 | O32: =INT(R6C*(1+0.05*RC1)) -> 23 | P32: =INT(R6C*(1+0.05*RC1)) -> 23 | Q32: =INT(R6C*(1+0.05*RC1)) -> 23 | R32: =INT(R6C*(1+0.05*RC1)) -> 23 | S32: =INT(R6C*(1+0.05*RC1)) -> 23 | T32: =INT(R6C*(1+0.05*RC1)) -> 23 | U32: =INT(R6C*(1+0.05*RC1)) -> 115 | V32: =INT(R6C*(1+0.05*RC1)) -> 115 | W32: =INT(R6C*(1+0.05*RC1)) -> 46 | X32: =INT(R6C*(1+0.05*RC1)) -> 46 | Y32: =INT(R6C*(1+0.05*RC1)) -> 46 | Z32: =INT(R6C*(1+0.05*RC1)) -> 46 | AA32: =INT(R6C*(1+0.05*RC1)) -> 46 | AB32: =INT(R6C*(1+0.05*RC1)) -> 46 | AC32: =INT(R6C*(1+0.05*RC1)) -> 230 | AD32: =INT(R6C*(1+0.05*RC1)) -> 230 | AE32: =INT(R6C*(1+0.05*RC1)) -> 23 | AF32: =INT(R6C*(1+0.05*RC1)) -> 23 | AG32: =INT(R6C*(1+0.05*RC1)) -> 23 | AH32: =INT(R6C*(1+0.05*RC1)) -> 23 | AI32: =INT(R6C*(1+0.05*RC1)) -> 23 | AJ32: =INT(R6C*(1+0.05*RC1)) -> 23 | AK32: =INT(R6C*(1+0.05*RC1)) -> 115 | AL32: =INT(R6C*(1+0.05*RC1)) -> 115 | AM32: =INT(R6C*(1+0.05*RC1)) -> 115000 | AN32: =INT(R6C*(1+0.05*RC1)) -> 115000 | AO32: =INT(R6C*(1+0.05*RC1)) -> 115000 | AP32: =INT(R6C*(1+0.05*RC1)) -> 115000 | AQ32: =INT(R6C*(1+0.05*RC1)) -> 115000 | AR32: =INT(R6C*(1+0.05*RC1)) -> 115000 | AS32: =INT(R6C*(1+0.05*RC1)) -> 575000 | AT32: =INT(R6C*(1+0.05*RC1)) -> 575000 | AU32: =INT(R6C*(1+0.05*RC1)) -> 230 | AV32: =INT(R6C*(1+0.05*RC1)) -> 230 | AW32: =INT(R6C*(1+0.05*RC1)) -> 230 | AX32: =INT(R6C*(1+0.05*RC1)) -> 230 | AY32: =INT(R6C*(1+0.05*RC1)) -> 230 | AZ32: =INT(R6C*(1+0.05*RC1)) -> 230 | BA32: =INT(R6C*(1+0.05*RC1)) -> 1150 | BB32: =INT(R6C*(1+0.05*RC1)) -> 1150 | BC32: =INT(R6C*(1+0.05*RC1)) -> 2300 | BD32: =INT(R6C*(1+0.05*RC1)) -> 2300 | BE32: =INT(R6C*(1+0.05*RC1)) -> 2300 | BF32: =INT(R6C*(1+0.05*RC1)) -> 2300 | BG32: =INT(R6C*(1+0.05*RC1)) -> 2300 | BH32: =INT(R6C*(1+0.05*RC1)) -> 2300 | BI32: =INT(R6C*(1+0.05*RC1)) -> 11500 | BJ32: =INT(R6C*(1+0.05*RC1)) -> 11500
A33: 27 | B33: 3 | C33: 27 | D33: 第二十七章 腐朽 | E33: =990+RC[-4]*10&"|"&991+RC[-4]*10&"|"&992+RC[-4]*10 -> 1260|1261|1262 | F33: 0|1|2 | G33: 500 | H33: 470 | I33: 500 | J33: 19005|10022|10004|10004|10004|10004|10004|10004|10004|10004|10010|10010|10010|10010|10010|10010|10010|10010|10014|10014|10014|10014|10014|10014|10014|10014|19003|19003|19003|19003|19003|19003|19003|19003|19006|19006|19006|19006|19006|19006|19006|19006|19012|19012|19012|19012|19012|19012|19012|19012 | K33: =RC[2]&"|"&RC[3]&"|"&RC[4]&"|"&RC[5]&"|"&RC[6]&"|"&RC[7]&"|"&RC[8]&"|"&RC[9]&"|"&RC[10]&"|"&RC[11]&"|"&RC[12]&"|"&RC[13]&"|"&RC[14]&"|"&RC[15]&"|"&RC[16]&"|"&RC[17]&"|"&RC[18]&"|"&RC[19]&"|"&RC[20]&"|"&RC[21]&"|"&RC[22]&"|"&RC[23]&"|"&RC[24]&"|"&RC[25]&"|"&RC[26]&"|"&RC[27]&"|"&RC[28]&"|"&RC[29]&"|"&RC[30]&"|"&RC[31]&"|"&RC[32]&"|"&RC[33]&"|"&RC[34]&"|"&RC[35]&"|"&RC[36]&"|"&RC[37]&"|"&RC[38]&"|"&RC[39]&"|"&RC[40]&"|"&RC[41]&"|"&RC[42]&"|"&RC[43]&"|"&RC[44]&"|"&RC[45]&"|"&RC[46]&"|"&RC[47]&"|"&RC[48]&"|"&RC[49]&"|"&RC[50]&"|"&RC[51] -> 888|10|23|23|23|23|23|23|117|117|47|47|47|47|47|47|235|235|23|23|23|23|23|23|117|117|117500|117500|117500|117500|117500|117500|587500|587500|235|235|235|235|235|235|1175|1175|2350|2350|2350|2350|2350|2350|11750|11750 | L33: 19005|200#19012|7500 | M33: 888 | N33: 10 | O33: =INT(R6C*(1+0.05*RC1)) -> 23 | P33: =INT(R6C*(1+0.05*RC1)) -> 23 | Q33: =INT(R6C*(1+0.05*RC1)) -> 23 | R33: =INT(R6C*(1+0.05*RC1)) -> 23 | S33: =INT(R6C*(1+0.05*RC1)) -> 23 | T33: =INT(R6C*(1+0.05*RC1)) -> 23 | U33: =INT(R6C*(1+0.05*RC1)) -> 117 | V33: =INT(R6C*(1+0.05*RC1)) -> 117 | W33: =INT(R6C*(1+0.05*RC1)) -> 47 | X33: =INT(R6C*(1+0.05*RC1)) -> 47 | Y33: =INT(R6C*(1+0.05*RC1)) -> 47 | Z33: =INT(R6C*(1+0.05*RC1)) -> 47 | AA33: =INT(R6C*(1+0.05*RC1)) -> 47 | AB33: =INT(R6C*(1+0.05*RC1)) -> 47 | AC33: =INT(R6C*(1+0.05*RC1)) -> 235 | AD33: =INT(R6C*(1+0.05*RC1)) -> 235 | AE33: =INT(R6C*(1+0.05*RC1)) -> 23 | AF33: =INT(R6C*(1+0.05*RC1)) -> 23 | AG33: =INT(R6C*(1+0.05*RC1)) -> 23 | AH33: =INT(R6C*(1+0.05*RC1)) -> 23 | AI33: =INT(R6C*(1+0.05*RC1)) -> 23 | AJ33: =INT(R6C*(1+0.05*RC1)) -> 23 | AK33: =INT(R6C*(1+0.05*RC1)) -> 117 | AL33: =INT(R6C*(1+0.05*RC1)) -> 117 | AM33: =INT(R6C*(1+0.05*RC1)) -> 117500 | AN33: =INT(R6C*(1+0.05*RC1)) -> 117500 | AO33: =INT(R6C*(1+0.05*RC1)) -> 117500 | AP33: =INT(R6C*(1+0.05*RC1)) -> 117500 | AQ33: =INT(R6C*(1+0.05*RC1)) -> 117500 | AR33: =INT(R6C*(1+0.05*RC1)) -> 117500 | AS33: =INT(R6C*(1+0.05*RC1)) -> 587500 | AT33: =INT(R6C*(1+0.05*RC1)) -> 587500 | AU33: =INT(R6C*(1+0.05*RC1)) -> 235 | AV33: =INT(R6C*(1+0.05*RC1)) -> 235 | AW33: =INT(R6C*(1+0.05*RC1)) -> 235 | AX33: =INT(R6C*(1+0.05*RC1)) -> 235 | AY33: =INT(R6C*(1+0.05*RC1)) -> 235 | AZ33: =INT(R6C*(1+0.05*RC1)) -> 235 | BA33: =INT(R6C*(1+0.05*RC1)) -> 1175 | BB33: =INT(R6C*(1+0.05*RC1)) -> 1175 | BC33: =INT(R6C*(1+0.05*RC1)) -> 2350 | BD33: =INT(R6C*(1+0.05*RC1)) -> 2350 | BE33: =INT(R6C*(1+0.05*RC1)) -> 2350 | BF33: =INT(R6C*(1+0.05*RC1)) -> 2350 | BG33: =INT(R6C*(1+0.05*RC1)) -> 2350 | BH33: =INT(R6C*(1+0.05*RC1)) -> 2350 | BI33: =INT(R6C*(1+0.05*RC1)) -> 11750 | BJ33: =INT(R6C*(1+0.05*RC1)) -> 11750
A34: 28 | B34: 1 | C34: 28 | D34: 第二十八章 征服 | E34: =990+RC[-4]*10&"|"&991+RC[-4]*10&"|"&992+RC[-4]*10 -> 1270|1271|1272 | F34: 0|1|2 | G34: 500 | H34: 480 | I34: 500 | J34: 19005|10022|10004|10004|10004|10004|10004|10004|10004|10004|10010|10010|10010|10010|10010|10010|10010|10010|10014|10014|10014|10014|10014|10014|10014|10014|19003|19003|19003|19003|19003|19003|19003|19003|19006|19006|19006|19006|19006|19006|19006|19006|19012|19012|19012|19012|19012|19012|19012|19012 | K34: =RC[2]&"|"&RC[3]&"|"&RC[4]&"|"&RC[5]&"|"&RC[6]&"|"&RC[7]&"|"&RC[8]&"|"&RC[9]&"|"&RC[10]&"|"&RC[11]&"|"&RC[12]&"|"&RC[13]&"|"&RC[14]&"|"&RC[15]&"|"&RC[16]&"|"&RC[17]&"|"&RC[18]&"|"&RC[19]&"|"&RC[20]&"|"&RC[21]&"|"&RC[22]&"|"&RC[23]&"|"&RC[24]&"|"&RC[25]&"|"&RC[26]&"|"&RC[27]&"|"&RC[28]&"|"&RC[29]&"|"&RC[30]&"|"&RC[31]&"|"&RC[32]&"|"&RC[33]&"|"&RC[34]&"|"&RC[35]&"|"&RC[36]&"|"&RC[37]&"|"&RC[38]&"|"&RC[39]&"|"&RC[40]&"|"&RC[41]&"|"&RC[42]&"|"&RC[43]&"|"&RC[44]&"|"&RC[45]&"|"&RC[46]&"|"&RC[47]&"|"&RC[48]&"|"&RC[49]&"|"&RC[50]&"|"&RC[51] -> 888|10|24|24|24|24|24|24|120|120|48|48|48|48|48|48|240|240|24|24|24|24|24|24|120|120|120000|120000|120000|120000|120000|120000|600000|600000|240|240|240|240|240|240|1200|1200|2400|2400|2400|2400|2400|2400|12000|12000 | L34: 19005|200#19103|75 | M34: 888 | N34: 10 | O34: =INT(R6C*(1+0.05*RC1)) -> 24 | P34: =INT(R6C*(1+0.05*RC1)) -> 24 | Q34: =INT(R6C*(1+0.05*RC1)) -> 24 | R34: =INT(R6C*(1+0.05*RC1)) -> 24 | S34: =INT(R6C*(1+0.05*RC1)) -> 24 | T34: =INT(R6C*(1+0.05*RC1)) -> 24 | U34: =INT(R6C*(1+0.05*RC1)) -> 120 | V34: =INT(R6C*(1+0.05*RC1)) -> 120 | W34: =INT(R6C*(1+0.05*RC1)) -> 48 | X34: =INT(R6C*(1+0.05*RC1)) -> 48 | Y34: =INT(R6C*(1+0.05*RC1)) -> 48 | Z34: =INT(R6C*(1+0.05*RC1)) -> 48 | AA34: =INT(R6C*(1+0.05*RC1)) -> 48 | AB34: =INT(R6C*(1+0.05*RC1)) -> 48 | AC34: =INT(R6C*(1+0.05*RC1)) -> 240 | AD34: =INT(R6C*(1+0.05*RC1)) -> 240 | AE34: =INT(R6C*(1+0.05*RC1)) -> 24 | AF34: =INT(R6C*(1+0.05*RC1)) -> 24 | AG34: =INT(R6C*(1+0.05*RC1)) -> 24 | AH34: =INT(R6C*(1+0.05*RC1)) -> 24 | AI34: =INT(R6C*(1+0.05*RC1)) -> 24 | AJ34: =INT(R6C*(1+0.05*RC1)) -> 24 | AK34: =INT(R6C*(1+0.05*RC1)) -> 120 | AL34: =INT(R6C*(1+0.05*RC1)) -> 120 | AM34: =INT(R6C*(1+0.05*RC1)) -> 120000 | AN34: =INT(R6C*(1+0.05*RC1)) -> 120000 | AO34: =INT(R6C*(1+0.05*RC1)) -> 120000 | AP34: =INT(R6C*(1+0.05*RC1)) -> 120000 | AQ34: =INT(R6C*(1+0.05*RC1)) -> 120000 | AR34: =INT(R6C*(1+0.05*RC1)) -> 120000 | AS34: =INT(R6C*(1+0.05*RC1)) -> 600000 | AT34: =INT(R6C*(1+0.05*RC1)) -> 600000 | AU34: =INT(R6C*(1+0.05*RC1)) -> 240 | AV34: =INT(R6C*(1+0.05*RC1)) -> 240 | AW34: =INT(R6C*(1+0.05*RC1)) -> 240 | AX34: =INT(R6C*(1+0.05*RC1)) -> 240 | AY34: =INT(R6C*(1+0.05*RC1)) -> 240 | AZ34: =INT(R6C*(1+0.05*RC1)) -> 240 | BA34: =INT(R6C*(1+0.05*RC1)) -> 1200 | BB34: =INT(R6C*(1+0.05*RC1)) -> 1200 | BC34: =INT(R6C*(1+0.05*RC1)) -> 2400 | BD34: =INT(R6C*(1+0.05*RC1)) -> 2400 | BE34: =INT(R6C*(1+0.05*RC1)) -> 2400 | BF34: =INT(R6C*(1+0.05*RC1)) -> 2400 | BG34: =INT(R6C*(1+0.05*RC1)) -> 2400 | BH34: =INT(R6C*(1+0.05*RC1)) -> 2400 | BI34: =INT(R6C*(1+0.05*RC1)) -> 12000 | BJ34: =INT(R6C*(1+0.05*RC1)) -> 12000
A35: 29 | B35: 2 | C35: 29 | D35: 第二十九章 嗜血 | E35: =990+RC[-4]*10&"|"&991+RC[-4]*10&"|"&992+RC[-4]*10 -> 1280|1281|1282 | F35: 0|1|2 | G35: 500 | H35: 490 | I35: 500 | J35: 19005|10022|10004|10004|10004|10004|10004|10004|10004|10004|10010|10010|10010|10010|10010|10010|10010|10010|10014|10014|10014|10014|10014|10014|10014|10014|19003|19003|19003|19003|19003|19003|19003|19003|19006|19006|19006|19006|19006|19006|19006|19006|19012|19012|19012|19012|19012|19012|19012|19012 | K35: =RC[2]&"|"&RC[3]&"|"&RC[4]&"|"&RC[5]&"|"&RC[6]&"|"&RC[7]&"|"&RC[8]&"|"&RC[9]&"|"&RC[10]&"|"&RC[11]&"|"&RC[12]&"|"&RC[13]&"|"&RC[14]&"|"&RC[15]&"|"&RC[16]&"|"&RC[17]&"|"&RC[18]&"|"&RC[19]&"|"&RC[20]&"|"&RC[21]&"|"&RC[22]&"|"&RC[23]&"|"&RC[24]&"|"&RC[25]&"|"&RC[26]&"|"&RC[27]&"|"&RC[28]&"|"&RC[29]&"|"&RC[30]&"|"&RC[31]&"|"&RC[32]&"|"&RC[33]&"|"&RC[34]&"|"&RC[35]&"|"&RC[36]&"|"&RC[37]&"|"&RC[38]&"|"&RC[39]&"|"&RC[40]&"|"&RC[41]&"|"&RC[42]&"|"&RC[43]&"|"&RC[44]&"|"&RC[45]&"|"&RC[46]&"|"&RC[47]&"|"&RC[48]&"|"&RC[49]&"|"&RC[50]&"|"&RC[51] -> 888|10|24|24|24|24|24|24|122|122|49|49|49|49|49|49|245|245|24|24|24|24|24|24|122|122|122500|122500|122500|122500|122500|122500|612500|612500|245|245|245|245|245|245|1225|1225|2450|2450|2450|2450|2450|2450|12250|12250 | L35: 19005|200#10022|15 | M35: 888 | N35: 10 | O35: =INT(R6C*(1+0.05*RC1)) -> 24 | P35: =INT(R6C*(1+0.05*RC1)) -> 24 | Q35: =INT(R6C*(1+0.05*RC1)) -> 24 | R35: =INT(R6C*(1+0.05*RC1)) -> 24 | S35: =INT(R6C*(1+0.05*RC1)) -> 24 | T35: =INT(R6C*(1+0.05*RC1)) -> 24 | U35: =INT(R6C*(1+0.05*RC1)) -> 122 | V35: =INT(R6C*(1+0.05*RC1)) -> 122 | W35: =INT(R6C*(1+0.05*RC1)) -> 49 | X35: =INT(R6C*(1+0.05*RC1)) -> 49 | Y35: =INT(R6C*(1+0.05*RC1)) -> 49 | Z35: =INT(R6C*(1+0.05*RC1)) -> 49 | AA35: =INT(R6C*(1+0.05*RC1)) -> 49 | AB35: =INT(R6C*(1+0.05*RC1)) -> 49 | AC35: =INT(R6C*(1+0.05*RC1)) -> 245 | AD35: =INT(R6C*(1+0.05*RC1)) -> 245 | AE35: =INT(R6C*(1+0.05*RC1)) -> 24 | AF35: =INT(R6C*(1+0.05*RC1)) -> 24 | AG35: =INT(R6C*(1+0.05*RC1)) -> 24 | AH35: =INT(R6C*(1+0.05*RC1)) -> 24 | AI35: =INT(R6C*(1+0.05*RC1)) -> 24 | AJ35: =INT(R6C*(1+0.05*RC1)) -> 24 | AK35: =INT(R6C*(1+0.05*RC1)) -> 122 | AL35: =INT(R6C*(1+0.05*RC1)) -> 122 | AM35: =INT(R6C*(1+0.05*RC1)) -> 122500 | AN35: =INT(R6C*(1+0.05*RC1)) -> 122500 | AO35: =INT(R6C*(1+0.05*RC1)) -> 122500 | AP35: =INT(R6C*(1+0.05*RC1)) -> 122500 | AQ35: =INT(R6C*(1+0.05*RC1)) -> 122500 | AR35: =INT(R6C*(1+0.05*RC1)) -> 122500 | AS35: =INT(R6C*(1+0.05*RC1)) -> 612500 | AT35: =INT(R6C*(1+0.05*RC1)) -> 612500 | AU35: =INT(R6C*(1+0.05*RC1)) -> 245 | AV35: =INT(R6C*(1+0.05*RC1)) -> 245 | AW35: =INT(R6C*(1+0.05*RC1)) -> 245 | AX35: =INT(R6C*(1+0.05*RC1)) -> 245 | AY35: =INT(R6C*(1+0.05*RC1)) -> 245 | AZ35: =INT(R6C*(1+0.05*RC1)) -> 245 | BA35: =INT(R6C*(1+0.05*RC1)) -> 1225 | BB35: =INT(R6C*(1+0.05*RC1)) -> 1225 | BC35: =INT(R6C*(1+0.05*RC1)) -> 2450 | BD35: =INT(R6C*(1+0.05*RC1)) -> 2450 | BE35: =INT(R6C*(1+0.05*RC1)) -> 2450 | BF35: =INT(R6C*(1+0.05*RC1)) -> 2450 | BG35: =INT(R6C*(1+0.05*RC1)) -> 2450 | BH35: =INT(R6C*(1+0.05*RC1)) -> 2450 | BI35: =INT(R6C*(1+0.05*RC1)) -> 12250 | BJ35: =INT(R6C*(1+0.05*RC1)) -> 12250
A36: 30 | B36: 3 | C36: 30 | D36: 第三十章 试练 | E36: =990+RC[-4]*10&"|"&991+RC[-4]*10&"|"&992+RC[-4]*10 -> 1290|1291|1292 | F36: 0|1|2 | G36: 500 | H36: 500 | I36: 500 | J36: 19005|10022|10004|10004|10004|10004|10004|10004|10004|10004|10010|10010|10010|10010|10010|10010|10010|10010|10014|10014|10014|10014|10014|10014|10014|10014|19003|19003|19003|19003|19003|19003|19003|19003|19006|19006|19006|19006|19006|19006|19006|19006|19012|19012|19012|19012|19012|19012|19012|19012 | K36: =RC[2]&"|"&RC[3]&"|"&RC[4]&"|"&RC[5]&"|"&RC[6]&"|"&RC[7]&"|"&RC[8]&"|"&RC[9]&"|"&RC[10]&"|"&RC[11]&"|"&RC[12]&"|"&RC[13]&"|"&RC[14]&"|"&RC[15]&"|"&RC[16]&"|"&RC[17]&"|"&RC[18]&"|"&RC[19]&"|"&RC[20]&"|"&RC[21]&"|"&RC[22]&"|"&RC[23]&"|"&RC[24]&"|"&RC[25]&"|"&RC[26]&"|"&RC[27]&"|"&RC[28]&"|"&RC[29]&"|"&RC[30]&"|"&RC[31]&"|"&RC[32]&"|"&RC[33]&"|"&RC[34]&"|"&RC[35]&"|"&RC[36]&"|"&RC[37]&"|"&RC[38]&"|"&RC[39]&"|"&RC[40]&"|"&RC[41]&"|"&RC[42]&"|"&RC[43]&"|"&RC[44]&"|"&RC[45]&"|"&RC[46]&"|"&RC[47]&"|"&RC[48]&"|"&RC[49]&"|"&RC[50]&"|"&RC[51] -> 888|10|25|25|25|25|25|25|125|125|50|50|50|50|50|50|250|250|25|25|25|25|25|25|125|125|125000|125000|125000|125000|125000|125000|625000|625000|250|250|250|250|250|250|1250|1250|2500|2500|2500|2500|2500|2500|12500|12500 | L36: 19005|200#19006|750 | M36: 888 | N36: 10 | O36: =INT(R6C*(1+0.05*RC1)) -> 25 | P36: =INT(R6C*(1+0.05*RC1)) -> 25 | Q36: =INT(R6C*(1+0.05*RC1)) -> 25 | R36: =INT(R6C*(1+0.05*RC1)) -> 25 | S36: =INT(R6C*(1+0.05*RC1)) -> 25 | T36: =INT(R6C*(1+0.05*RC1)) -> 25 | U36: =INT(R6C*(1+0.05*RC1)) -> 125 | V36: =INT(R6C*(1+0.05*RC1)) -> 125 | W36: =INT(R6C*(1+0.05*RC1)) -> 50 | X36: =INT(R6C*(1+0.05*RC1)) -> 50 | Y36: =INT(R6C*(1+0.05*RC1)) -> 50 | Z36: =INT(R6C*(1+0.05*RC1)) -> 50 | AA36: =INT(R6C*(1+0.05*RC1)) -> 50 | AB36: =INT(R6C*(1+0.05*RC1)) -> 50 | AC36: =INT(R6C*(1+0.05*RC1)) -> 250 | AD36: =INT(R6C*(1+0.05*RC1)) -> 250 | AE36: =INT(R6C*(1+0.05*RC1)) -> 25 | AF36: =INT(R6C*(1+0.05*RC1)) -> 25 | AG36: =INT(R6C*(1+0.05*RC1)) -> 25 | AH36: =INT(R6C*(1+0.05*RC1)) -> 25 | AI36: =INT(R6C*(1+0.05*RC1)) -> 25 | AJ36: =INT(R6C*(1+0.05*RC1)) -> 25 | AK36: =INT(R6C*(1+0.05*RC1)) -> 125 | AL36: =INT(R6C*(1+0.05*RC1)) -> 125 | AM36: =INT(R6C*(1+0.05*RC1)) -> 125000 | AN36: =INT(R6C*(1+0.05*RC1)) -> 125000 | AO36: =INT(R6C*(1+0.05*RC1)) -> 125000 | AP36: =INT(R6C*(1+0.05*RC1)) -> 125000 | AQ36: =INT(R6C*(1+0.05*RC1)) -> 125000 | AR36: =INT(R6C*(1+0.05*RC1)) -> 125000 | AS36: =INT(R6C*(1+0.05*RC1)) -> 625000 | AT36: =INT(R6C*(1+0.05*RC1)) -> 625000 | AU36: =INT(R6C*(1+0.05*RC1)) -> 250 | AV36: =INT(R6C*(1+0.05*RC1)) -> 250 | AW36: =INT(R6C*(1+0.05*RC1)) -> 250 | AX36: =INT(R6C*(1+0.05*RC1)) -> 250 | AY36: =INT(R6C*(1+0.05*RC1)) -> 250 | AZ36: =INT(R6C*(1+0.05*RC1)) -> 250 | BA36: =INT(R6C*(1+0.05*RC1)) -> 1250 | BB36: =INT(R6C*(1+0.05*RC1)) -> 1250 | BC36: =INT(R6C*(1+0.05*RC1)) -> 2500 | BD36: =INT(R6C*(1+0.05*RC1)) -> 2500 | BE36: =INT(R6C*(1+0.05*RC1)) -> 2500 | BF36: =INT(R6C*(1+0.05*RC1)) -> 2500 | BG36: =INT(R6C*(1+0.05*RC1)) -> 2500 | BH36: =INT(R6C*(1+0.05*RC1)) -> 2500 | BI36: =INT(R6C*(1+0.05*RC1)) -> 12500 | BJ36: =INT(R6C*(1+0.05*RC1)) -> 12500
A37: 31 | B37: 1 | C37: 31 | D37: 第三十一章 暗夜 | E37: =990+RC[-4]*10&"|"&991+RC[-4]*10&"|"&992+RC[-4]*10 -> 1300|1301|1302 | F37: 0|1|2 | G37: 500 | H37: 510 | I37: 500 | J37: 19005|10022|10004|10004|10004|10004|10004|10004|10004|10004|10010|10010|10010|10010|10010|10010|10010|10010|10014|10014|10014|10014|10014|10014|10014|10014|19003|19003|19003|19003|19003|19003|19003|19003|19006|19006|19006|19006|19006|19006|19006|19006|19012|19012|19012|19012|19012|19012|19012|19012 | K37: =RC[2]&"|"&RC[3]&"|"&RC[4]&"|"&RC[5]&"|"&RC[6]&"|"&RC[7]&"|"&RC[8]&"|"&RC[9]&"|"&RC[10]&"|"&RC[11]&"|"&RC[12]&"|"&RC[13]&"|"&RC[14]&"|"&RC[15]&"|"&RC[16]&"|"&RC[17]&"|"&RC[18]&"|"&RC[19]&"|"&RC[20]&"|"&RC[21]&"|"&RC[22]&"|"&RC[23]&"|"&RC[24]&"|"&RC[25]&"|"&RC[26]&"|"&RC[27]&"|"&RC[28]&"|"&RC[29]&"|"&RC[30]&"|"&RC[31]&"|"&RC[32]&"|"&RC[33]&"|"&RC[34]&"|"&RC[35]&"|"&RC[36]&"|"&RC[37]&"|"&RC[38]&"|"&RC[39]&"|"&RC[40]&"|"&RC[41]&"|"&RC[42]&"|"&RC[43]&"|"&RC[44]&"|"&RC[45]&"|"&RC[46]&"|"&RC[47]&"|"&RC[48]&"|"&RC[49]&"|"&RC[50]&"|"&RC[51] -> 888|10|25|25|25|25|25|25|127|127|51|51|51|51|51|51|255|255|25|25|25|25|25|25|127|127|127500|127500|127500|127500|127500|127500|637500|637500|255|255|255|255|255|255|1275|1275|2550|2550|2550|2550|2550|2550|12750|12750 | L37: 19005|200#19012|7500 | M37: 888 | N37: 10 | O37: =INT(R6C*(1+0.05*RC1)) -> 25 | P37: =INT(R6C*(1+0.05*RC1)) -> 25 | Q37: =INT(R6C*(1+0.05*RC1)) -> 25 | R37: =INT(R6C*(1+0.05*RC1)) -> 25 | S37: =INT(R6C*(1+0.05*RC1)) -> 25 | T37: =INT(R6C*(1+0.05*RC1)) -> 25 | U37: =INT(R6C*(1+0.05*RC1)) -> 127 | V37: =INT(R6C*(1+0.05*RC1)) -> 127 | W37: =INT(R6C*(1+0.05*RC1)) -> 51 | X37: =INT(R6C*(1+0.05*RC1)) -> 51 | Y37: =INT(R6C*(1+0.05*RC1)) -> 51 | Z37: =INT(R6C*(1+0.05*RC1)) -> 51 | AA37: =INT(R6C*(1+0.05*RC1)) -> 51 | AB37: =INT(R6C*(1+0.05*RC1)) -> 51 | AC37: =INT(R6C*(1+0.05*RC1)) -> 255 | AD37: =INT(R6C*(1+0.05*RC1)) -> 255 | AE37: =INT(R6C*(1+0.05*RC1)) -> 25 | AF37: =INT(R6C*(1+0.05*RC1)) -> 25 | AG37: =INT(R6C*(1+0.05*RC1)) -> 25 | AH37: =INT(R6C*(1+0.05*RC1)) -> 25 | AI37: =INT(R6C*(1+0.05*RC1)) -> 25 | AJ37: =INT(R6C*(1+0.05*RC1)) -> 25 | AK37: =INT(R6C*(1+0.05*RC1)) -> 127 | AL37: =INT(R6C*(1+0.05*RC1)) -> 127 | AM37: =INT(R6C*(1+0.05*RC1)) -> 127500 | AN37: =INT(R6C*(1+0.05*RC1)) -> 127500 | AO37: =INT(R6C*(1+0.05*RC1)) -> 127500 | AP37: =INT(R6C*(1+0.05*RC1)) -> 127500 | AQ37: =INT(R6C*(1+0.05*RC1)) -> 127500 | AR37: =INT(R6C*(1+0.05*RC1)) -> 127500 | AS37: =INT(R6C*(1+0.05*RC1)) -> 637500 | AT37: =INT(R6C*(1+0.05*RC1)) -> 637500 | AU37: =INT(R6C*(1+0.05*RC1)) -> 255 | AV37: =INT(R6C*(1+0.05*RC1)) -> 255 | AW37: =INT(R6C*(1+0.05*RC1)) -> 255 | AX37: =INT(R6C*(1+0.05*RC1)) -> 255 | AY37: =INT(R6C*(1+0.05*RC1)) -> 255 | AZ37: =INT(R6C*(1+0.05*RC1)) -> 255 | BA37: =INT(R6C*(1+0.05*RC1)) -> 1275 | BB37: =INT(R6C*(1+0.05*RC1)) -> 1275 | BC37: =INT(R6C*(1+0.05*RC1)) -> 2550 | BD37: =INT(R6C*(1+0.05*RC1)) -> 2550 | BE37: =INT(R6C*(1+0.05*RC1)) -> 2550 | BF37: =INT(R6C*(1+0.05*RC1)) -> 2550 | BG37: =INT(R6C*(1+0.05*RC1)) -> 2550 | BH37: =INT(R6C*(1+0.05*RC1)) -> 2550 | BI37: =INT(R6C*(1+0.05*RC1)) -> 12750 | BJ37: =INT(R6C*(1+0.05*RC1)) -> 12750
A38: 32 | B38: 2 | C38: 32 | D38: 第三十二章 智慧 | E38: =990+RC[-4]*10&"|"&991+RC[-4]*10&"|"&992+RC[-4]*10 -> 1310|1311|1312 | F38: 0|1|2 | G38: 500 | H38: 520 | I38: 500 | J38: 19005|10022|10004|10004|10004|10004|10004|10004|10004|10004|10010|10010|10010|10010|10010|10010|10010|10010|10014|10014|10014|10014|10014|10014|10014|10014|19003|19003|19003|19003|19003|19003|19003|19003|19006|19006|19006|19006|19006|19006|19006|19006|19012|19012|19012|19012|19012|19012|19012|19012 | K38: =RC[2]&"|"&RC[3]&"|"&RC[4]&"|"&RC[5]&"|"&RC[6]&"|"&RC[7]&"|"&RC[8]&"|"&RC[9]&"|"&RC[10]&"|"&RC[11]&"|"&RC[12]&"|"&RC[13]&"|"&RC[14]&"|"&RC[15]&"|"&RC[16]&"|"&RC[17]&"|"&RC[18]&"|"&RC[19]&"|"&RC[20]&"|"&RC[21]&"|"&RC[22]&"|"&RC[23]&"|"&RC[24]&"|"&RC[25]&"|"&RC[26]&"|"&RC[27]&"|"&RC[28]&"|"&RC[29]&"|"&RC[30]&"|"&RC[31]&"|"&RC[32]&"|"&RC[33]&"|"&RC[34]&"|"&RC[35]&"|"&RC[36]&"|"&RC[37]&"|"&RC[38]&"|"&RC[39]&"|"&RC[40]&"|"&RC[41]&"|"&RC[42]&"|"&RC[43]&"|"&RC[44]&"|"&RC[45]&"|"&RC[46]&"|"&RC[47]&"|"&RC[48]&"|"&RC[49]&"|"&RC[50]&"|"&RC[51] -> 888|10|26|26|26|26|26|26|130|130|52|52|52|52|52|52|260|260|26|26|26|26|26|26|130|130|130000|130000|130000|130000|130000|130000|650000|650000|260|260|260|260|260|260|1300|1300|2600|2600|2600|2600|2600|2600|13000|13000 | L38: 19005|200#19103|75 | M38: 888 | N38: 10 | O38: =INT(R6C*(1+0.05*RC1)) -> 26 | P38: =INT(R6C*(1+0.05*RC1)) -> 26 | Q38: =INT(R6C*(1+0.05*RC1)) -> 26 | R38: =INT(R6C*(1+0.05*RC1)) -> 26 | S38: =INT(R6C*(1+0.05*RC1)) -> 26 | T38: =INT(R6C*(1+0.05*RC1)) -> 26 | U38: =INT(R6C*(1+0.05*RC1)) -> 130 | V38: =INT(R6C*(1+0.05*RC1)) -> 130 | W38: =INT(R6C*(1+0.05*RC1)) -> 52 | X38: =INT(R6C*(1+0.05*RC1)) -> 52 | Y38: =INT(R6C*(1+0.05*RC1)) -> 52 | Z38: =INT(R6C*(1+0.05*RC1)) -> 52 | AA38: =INT(R6C*(1+0.05*RC1)) -> 52 | AB38: =INT(R6C*(1+0.05*RC1)) -> 52 | AC38: =INT(R6C*(1+0.05*RC1)) -> 260 | AD38: =INT(R6C*(1+0.05*RC1)) -> 260 | AE38: =INT(R6C*(1+0.05*RC1)) -> 26 | AF38: =INT(R6C*(1+0.05*RC1)) -> 26 | AG38: =INT(R6C*(1+0.05*RC1)) -> 26 | AH38: =INT(R6C*(1+0.05*RC1)) -> 26 | AI38: =INT(R6C*(1+0.05*RC1)) -> 26 | AJ38: =INT(R6C*(1+0.05*RC1)) -> 26 | AK38: =INT(R6C*(1+0.05*RC1)) -> 130 | AL38: =INT(R6C*(1+0.05*RC1)) -> 130 | AM38: =INT(R6C*(1+0.05*RC1)) -> 130000 | AN38: =INT(R6C*(1+0.05*RC1)) -> 130000 | AO38: =INT(R6C*(1+0.05*RC1)) -> 130000 | AP38: =INT(R6C*(1+0.05*RC1)) -> 130000 | AQ38: =INT(R6C*(1+0.05*RC1)) -> 130000 | AR38: =INT(R6C*(1+0.05*RC1)) -> 130000 | AS38: =INT(R6C*(1+0.05*RC1)) -> 650000 | AT38: =INT(R6C*(1+0.05*RC1)) -> 650000 | AU38: =INT(R6C*(1+0.05*RC1)) -> 260 | AV38: =INT(R6C*(1+0.05*RC1)) -> 260 | AW38: =INT(R6C*(1+0.05*RC1)) -> 260 | AX38: =INT(R6C*(1+0.05*RC1)) -> 260 | AY38: =INT(R6C*(1+0.05*RC1)) -> 260 | AZ38: =INT(R6C*(1+0.05*RC1)) -> 260 | BA38: =INT(R6C*(1+0.05*RC1)) -> 1300 | BB38: =INT(R6C*(1+0.05*RC1)) -> 1300 | BC38: =INT(R6C*(1+0.05*RC1)) -> 2600 | BD38: =INT(R6C*(1+0.05*RC1)) -> 2600 | BE38: =INT(R6C*(1+0.05*RC1)) -> 2600 | BF38: =INT(R6C*(1+0.05*RC1)) -> 2600 | BG38: =INT(R6C*(1+0.05*RC1)) -> 2600 | BH38: =INT(R6C*(1+0.05*RC1)) -> 2600 | BI38: =INT(R6C*(1+0.05*RC1)) -> 13000 | BJ38: =INT(R6C*(1+0.05*RC1)) -> 13000
A39: 33 | B39: 3 | C39: 33 | D39: 第三十三章 屠杀 | E39: =990+RC[-4]*10&"|"&991+RC[-4]*10&"|"&992+RC[-4]*10 -> 1320|1321|1322 | F39: 0|1|2 | G39: 500 | H39: 530 | I39: 500 | J39: 19005|10022|10004|10004|10004|10004|10004|10004|10004|10004|10010|10010|10010|10010|10010|10010|10010|10010|10014|10014|10014|10014|10014|10014|10014|10014|19003|19003|19003|19003|19003|19003|19003|19003|19006|19006|19006|19006|19006|19006|19006|19006|19012|19012|19012|19012|19012|19012|19012|19012 | K39: =RC[2]&"|"&RC[3]&"|"&RC[4]&"|"&RC[5]&"|"&RC[6]&"|"&RC[7]&"|"&RC[8]&"|"&RC[9]&"|"&RC[10]&"|"&RC[11]&"|"&RC[12]&"|"&RC[13]&"|"&RC[14]&"|"&RC[15]&"|"&RC[16]&"|"&RC[17]&"|"&RC[18]&"|"&RC[19]&"|"&RC[20]&"|"&RC[21]&"|"&RC[22]&"|"&RC[23]&"|"&RC[24]&"|"&RC[25]&"|"&RC[26]&"|"&RC[27]&"|"&RC[28]&"|"&RC[29]&"|"&RC[30]&"|"&RC[31]&"|"&RC[32]&"|"&RC[33]&"|"&RC[34]&"|"&RC[35]&"|"&RC[36]&"|"&RC[37]&"|"&RC[38]&"|"&RC[39]&"|"&RC[40]&"|"&RC[41]&"|"&RC[42]&"|"&RC[43]&"|"&RC[44]&"|"&RC[45]&"|"&RC[46]&"|"&RC[47]&"|"&RC[48]&"|"&RC[49]&"|"&RC[50]&"|"&RC[51] -> 888|10|26|26|26|26|26|26|132|132|53|53|53|53|53|53|265|265|26|26|26|26|26|26|132|132|132500|132500|132500|132500|132500|132500|662500|662500|265|265|265|265|265|265|1325|1325|2650|2650|2650|2650|2650|2650|13250|13250 | L39: 19005|200#10022|15 | M39: 888 | N39: 10 | O39: =INT(R6C*(1+0.05*RC1)) -> 26 | P39: =INT(R6C*(1+0.05*RC1)) -> 26 | Q39: =INT(R6C*(1+0.05*RC1)) -> 26 | R39: =INT(R6C*(1+0.05*RC1)) -> 26 | S39: =INT(R6C*(1+0.05*RC1)) -> 26 | T39: =INT(R6C*(1+0.05*RC1)) -> 26 | U39: =INT(R6C*(1+0.05*RC1)) -> 132 | V39: =INT(R6C*(1+0.05*RC1)) -> 132 | W39: =INT(R6C*(1+0.05*RC1)) -> 53 | X39: =INT(R6C*(1+0.05*RC1)) -> 53 | Y39: =INT(R6C*(1+0.05*RC1)) -> 53 | Z39: =INT(R6C*(1+0.05*RC1)) -> 53 | AA39: =INT(R6C*(1+0.05*RC1)) -> 53 | AB39: =INT(R6C*(1+0.05*RC1)) -> 53 | AC39: =INT(R6C*(1+0.05*RC1)) -> 265 | AD39: =INT(R6C*(1+0.05*RC1)) -> 265 | AE39: =INT(R6C*(1+0.05*RC1)) -> 26 | AF39: =INT(R6C*(1+0.05*RC1)) -> 26 | AG39: =INT(R6C*(1+0.05*RC1)) -> 26 | AH39: =INT(R6C*(1+0.05*RC1)) -> 26 | AI39: =INT(R6C*(1+0.05*RC1)) -> 26 | AJ39: =INT(R6C*(1+0.05*RC1)) -> 26 | AK39: =INT(R6C*(1+0.05*RC1)) -> 132 | AL39: =INT(R6C*(1+0.05*RC1)) -> 132 | AM39: =INT(R6C*(1+0.05*RC1)) -> 132500 | AN39: =INT(R6C*(1+0.05*RC1)) -> 132500 | AO39: =INT(R6C*(1+0.05*RC1)) -> 132500 | AP39: =INT(R6C*(1+0.05*RC1)) -> 132500 | AQ39: =INT(R6C*(1+0.05*RC1)) -> 132500 | AR39: =INT(R6C*(1+0.05*RC1)) -> 132500 | AS39: =INT(R6C*(1+0.05*RC1)) -> 662500 | AT39: =INT(R6C*(1+0.05*RC1)) -> 662500 | AU39: =INT(R6C*(1+0.05*RC1)) -> 265 | AV39: =INT(R6C*(1+0.05*RC1)) -> 265 | AW39: =INT(R6C*(1+0.05*RC1)) -> 265 | AX39: =INT(R6C*(1+0.05*RC1)) -> 265 | AY39: =INT(R6C*(1+0.05*RC1)) -> 265 | AZ39: =INT(R6C*(1+0.05*RC1)) -> 265 | BA39: =INT(R6C*(1+0.05*RC1)) -> 1325 | BB39: =INT(R6C*(1+0.05*RC1)) -> 1325 | BC39: =INT(R6C*(1+0.05*RC1)) -> 2650 | BD39: =INT(R6C*(1+0.05*RC1)) -> 2650 | BE39: =INT(R6C*(1+0.05*RC1)) -> 2650 | BF39: =INT(R6C*(1+0.05*RC1)) -> 2650 | BG39: =INT(R6C*(1+0.05*RC1)) -> 2650 | BH39: =INT(R6C*(1+0.05*RC1)) -> 2650 | BI39: =INT(R6C*(1+0.05*RC1)) -> 13250 | BJ39: =INT(R6C*(1+0.05*RC1)) -> 13250
A40: 34 | B40: 1 | C40: 34 | D40: 第三十四章 血液 | E40: =990+RC[-4]*10&"|"&991+RC[-4]*10&"|"&992+RC[-4]*10 -> 1330|1331|1332 | F40: 0|1|2 | G40: 500 | H40: 540 | I40: 500 | J40: 19005|10022|10004|10004|10004|10004|10004|10004|10004|10004|10010|10010|10010|10010|10010|10010|10010|10010|10014|10014|10014|10014|10014|10014|10014|10014|19003|19003|19003|19003|19003|19003|19003|19003|19006|19006|19006|19006|19006|19006|19006|19006|19012|19012|19012|19012|19012|19012|19012|19012 | K40: =RC[2]&"|"&RC[3]&"|"&RC[4]&"|"&RC[5]&"|"&RC[6]&"|"&RC[7]&"|"&RC[8]&"|"&RC[9]&"|"&RC[10]&"|"&RC[11]&"|"&RC[12]&"|"&RC[13]&"|"&RC[14]&"|"&RC[15]&"|"&RC[16]&"|"&RC[17]&"|"&RC[18]&"|"&RC[19]&"|"&RC[20]&"|"&RC[21]&"|"&RC[22]&"|"&RC[23]&"|"&RC[24]&"|"&RC[25]&"|"&RC[26]&"|"&RC[27]&"|"&RC[28]&"|"&RC[29]&"|"&RC[30]&"|"&RC[31]&"|"&RC[32]&"|"&RC[33]&"|"&RC[34]&"|"&RC[35]&"|"&RC[36]&"|"&RC[37]&"|"&RC[38]&"|"&RC[39]&"|"&RC[40]&"|"&RC[41]&"|"&RC[42]&"|"&RC[43]&"|"&RC[44]&"|"&RC[45]&"|"&RC[46]&"|"&RC[47]&"|"&RC[48]&"|"&RC[49]&"|"&RC[50]&"|"&RC[51] -> 888|10|27|27|27|27|27|27|135|135|54|54|54|54|54|54|270|270|27|27|27|27|27|27|135|135|135000|135000|135000|135000|135000|135000|675000|675000|270|270|270|270|270|270|1350|1350|2700|2700|2700|2700|2700|2700|13500|13500 | L40: 19005|200#19006|750 | M40: 888 | N40: 10 | O40: =INT(R6C*(1+0.05*RC1)) -> 27 | P40: =INT(R6C*(1+0.05*RC1)) -> 27 | Q40: =INT(R6C*(1+0.05*RC1)) -> 27 | R40: =INT(R6C*(1+0.05*RC1)) -> 27 | S40: =INT(R6C*(1+0.05*RC1)) -> 27 | T40: =INT(R6C*(1+0.05*RC1)) -> 27 | U40: =INT(R6C*(1+0.05*RC1)) -> 135 | V40: =INT(R6C*(1+0.05*RC1)) -> 135 | W40: =INT(R6C*(1+0.05*RC1)) -> 54 | X40: =INT(R6C*(1+0.05*RC1)) -> 54 | Y40: =INT(R6C*(1+0.05*RC1)) -> 54 | Z40: =INT(R6C*(1+0.05*RC1)) -> 54 | AA40: =INT(R6C*(1+0.05*RC1)) -> 54 | AB40: =INT(R6C*(1+0.05*RC1)) -> 54 | AC40: =INT(R6C*(1+0.05*RC1)) -> 270 | AD40: =INT(R6C*(1+0.05*RC1)) -> 270 | AE40: =INT(R6C*(1+0.05*RC1)) -> 27 | AF40: =INT(R6C*(1+0.05*RC1)) -> 27 | AG40: =INT(R6C*(1+0.05*RC1)) -> 27 | AH40: =INT(R6C*(1+0.05*RC1)) -> 27 | AI40: =INT(R6C*(1+0.05*RC1)) -> 27 | AJ40: =INT(R6C*(1+0.05*RC1)) -> 27 | AK40: =INT(R6C*(1+0.05*RC1)) -> 135 | AL40: =INT(R6C*(1+0.05*RC1)) -> 135 | AM40: =INT(R6C*(1+0.05*RC1)) -> 135000 | AN40: =INT(R6C*(1+0.05*RC1)) -> 135000 | AO40: =INT(R6C*(1+0.05*RC1)) -> 135000 | AP40: =INT(R6C*(1+0.05*RC1)) -> 135000 | AQ40: =INT(R6C*(1+0.05*RC1)) -> 135000 | AR40: =INT(R6C*(1+0.05*RC1)) -> 135000 | AS40: =INT(R6C*(1+0.05*RC1)) -> 675000 | AT40: =INT(R6C*(1+0.05*RC1)) -> 675000 | AU40: =INT(R6C*(1+0.05*RC1)) -> 270 | AV40: =INT(R6C*(1+0.05*RC1)) -> 270 | AW40: =INT(R6C*(1+0.05*RC1)) -> 270 | AX40: =INT(R6C*(1+0.05*RC1)) -> 270 | AY40: =INT(R6C*(1+0.05*RC1)) -> 270 | AZ40: =INT(R6C*(1+0.05*RC1)) -> 270 | BA40: =INT(R6C*(1+0.05*RC1)) -> 1350 | BB40: =INT(R6C*(1+0.05*RC1)) -> 1350 | BC40: =INT(R6C*(1+0.05*RC1)) -> 2700 | BD40: =INT(R6C*(1+0.05*RC1)) -> 2700 | BE40: =INT(R6C*(1+0.05*RC1)) -> 2700 | BF40: =INT(R6C*(1+0.05*RC1)) -> 2700 | BG40: =INT(R6C*(1+0.05*RC1)) -> 2700 | BH40: =INT(R6C*(1+0.05*RC1)) -> 2700 | BI40: =INT(R6C*(1+0.05*RC1)) -> 13500 | BJ40: =INT(R6C*(1+0.05*RC1)) -> 13500
A41: 35 | B41: 2 | C41: 35 | D41: 第三十五章 遗忘 | E41: =990+RC[-4]*10&"|"&991+RC[-4]*10&"|"&992+RC[-4]*10 -> 1340|1341|1342 | F41: 0|1|2 | G41: 500 | H41: 550 | I41: 500 | J41: 19005|10022|10004|10004|10004|10004|10004|10004|10004|10004|10010|10010|10010|10010|10010|10010|10010|10010|10014|10014|10014|10014|10014|10014|10014|10014|19003|19003|19003|19003|19003|19003|19003|19003|19006|19006|19006|19006|19006|19006|19006|19006|19012|19012|19012|19012|19012|19012|19012|19012 | K41: =RC[2]&"|"&RC[3]&"|"&RC[4]&"|"&RC[5]&"|"&RC[6]&"|"&RC[7]&"|"&RC[8]&"|"&RC[9]&"|"&RC[10]&"|"&RC[11]&"|"&RC[12]&"|"&RC[13]&"|"&RC[14]&"|"&RC[15]&"|"&RC[16]&"|"&RC[17]&"|"&RC[18]&"|"&RC[19]&"|"&RC[20]&"|"&RC[21]&"|"&RC[22]&"|"&RC[23]&"|"&RC[24]&"|"&RC[25]&"|"&RC[26]&"|"&RC[27]&"|"&RC[28]&"|"&RC[29]&"|"&RC[30]&"|"&RC[31]&"|"&RC[32]&"|"&RC[33]&"|"&RC[34]&"|"&RC[35]&"|"&RC[36]&"|"&RC[37]&"|"&RC[38]&"|"&RC[39]&"|"&RC[40]&"|"&RC[41]&"|"&RC[42]&"|"&RC[43]&"|"&RC[44]&"|"&RC[45]&"|"&RC[46]&"|"&RC[47]&"|"&RC[48]&"|"&RC[49]&"|"&RC[50]&"|"&RC[51] -> 888|10|27|27|27|27|27|27|137|137|55|55|55|55|55|55|275|275|27|27|27|27|27|27|137|137|137500|137500|137500|137500|137500|137500|687500|687500|275|275|275|275|275|275|1375|1375|2750|2750|2750|2750|2750|2750|13750|13750 | L41: 19005|200#19012|7500 | M41: 888 | N41: 10 | O41: =INT(R6C*(1+0.05*RC1)) -> 27 | P41: =INT(R6C*(1+0.05*RC1)) -> 27 | Q41: =INT(R6C*(1+0.05*RC1)) -> 27 | R41: =INT(R6C*(1+0.05*RC1)) -> 27 | S41: =INT(R6C*(1+0.05*RC1)) -> 27 | T41: =INT(R6C*(1+0.05*RC1)) -> 27 | U41: =INT(R6C*(1+0.05*RC1)) -> 137 | V41: =INT(R6C*(1+0.05*RC1)) -> 137 | W41: =INT(R6C*(1+0.05*RC1)) -> 55 | X41: =INT(R6C*(1+0.05*RC1)) -> 55 | Y41: =INT(R6C*(1+0.05*RC1)) -> 55 | Z41: =INT(R6C*(1+0.05*RC1)) -> 55 | AA41: =INT(R6C*(1+0.05*RC1)) -> 55 | AB41: =INT(R6C*(1+0.05*RC1)) -> 55 | AC41: =INT(R6C*(1+0.05*RC1)) -> 275 | AD41: =INT(R6C*(1+0.05*RC1)) -> 275 | AE41: =INT(R6C*(1+0.05*RC1)) -> 27 | AF41: =INT(R6C*(1+0.05*RC1)) -> 27 | AG41: =INT(R6C*(1+0.05*RC1)) -> 27 | AH41: =INT(R6C*(1+0.05*RC1)) -> 27 | AI41: =INT(R6C*(1+0.05*RC1)) -> 27 | AJ41: =INT(R6C*(1+0.05*RC1)) -> 27 | AK41: =INT(R6C*(1+0.05*RC1)) -> 137 | AL41: =INT(R6C*(1+0.05*RC1)) -> 137 | AM41: =INT(R6C*(1+0.05*RC1)) -> 137500 | AN41: =INT(R6C*(1+0.05*RC1)) -> 137500 | AO41: =INT(R6C*(1+0.05*RC1)) -> 137500 | AP41: =INT(R6C*(1+0.05*RC1)) -> 137500 | AQ41: =INT(R6C*(1+0.05*RC1)) -> 137500 | AR41: =INT(R6C*(1+0.05*RC1)) -> 137500 | AS41: =INT(R6C*(1+0.05*RC1)) -> 687500 | AT41: =INT(R6C*(1+0.05*RC1)) -> 687500 | AU41: =INT(R6C*(1+0.05*RC1)) -> 275 | AV41: =INT(R6C*(1+0.05*RC1)) -> 275 | AW41: =INT(R6C*(1+0.05*RC1)) -> 275 | AX41: =INT(R6C*(1+0.05*RC1)) -> 275 | AY41: =INT(R6C*(1+0.05*RC1)) -> 275 | AZ41: =INT(R6C*(1+0.05*RC1)) -> 275 | BA41: =INT(R6C*(1+0.05*RC1)) -> 1375 | BB41: =INT(R6C*(1+0.05*RC1)) -> 1375 | BC41: =INT(R6C*(1+0.05*RC1)) -> 2750 | BD41: =INT(R6C*(1+0.05*RC1)) -> 2750 | BE41: =INT(R6C*(1+0.05*RC1)) -> 2750 | BF41: =INT(R6C*(1+0.05*RC1)) -> 2750 | BG41: =INT(R6C*(1+0.05*RC1)) -> 2750 | BH41: =INT(R6C*(1+0.05*RC1)) -> 2750 | BI41: =INT(R6C*(1+0.05*RC1)) -> 13750 | BJ41: =INT(R6C*(1+0.05*RC1)) -> 13750
A42: 36 | B42: 3 | C42: 36 | D42: 第三十六章 神圣 | E42: =990+RC[-4]*10&"|"&991+RC[-4]*10&"|"&992+RC[-4]*10 -> 1350|1351|1352 | F42: 0|1|2 | G42: 500 | H42: 560 | I42: 500 | J42: 19005|10022|10004|10004|10004|10004|10004|10004|10004|10004|10010|10010|10010|10010|10010|10010|10010|10010|10014|10014|10014|10014|10014|10014|10014|10014|19003|19003|19003|19003|19003|19003|19003|19003|19006|19006|19006|19006|19006|19006|19006|19006|19012|19012|19012|19012|19012|19012|19012|19012 | K42: =RC[2]&"|"&RC[3]&"|"&RC[4]&"|"&RC[5]&"|"&RC[6]&"|"&RC[7]&"|"&RC[8]&"|"&RC[9]&"|"&RC[10]&"|"&RC[11]&"|"&RC[12]&"|"&RC[13]&"|"&RC[14]&"|"&RC[15]&"|"&RC[16]&"|"&RC[17]&"|"&RC[18]&"|"&RC[19]&"|"&RC[20]&"|"&RC[21]&"|"&RC[22]&"|"&RC[23]&"|"&RC[24]&"|"&RC[25]&"|"&RC[26]&"|"&RC[27]&"|"&RC[28]&"|"&RC[29]&"|"&RC[30]&"|"&RC[31]&"|"&RC[32]&"|"&RC[33]&"|"&RC[34]&"|"&RC[35]&"|"&RC[36]&"|"&RC[37]&"|"&RC[38]&"|"&RC[39]&"|"&RC[40]&"|"&RC[41]&"|"&RC[42]&"|"&RC[43]&"|"&RC[44]&"|"&RC[45]&"|"&RC[46]&"|"&RC[47]&"|"&RC[48]&"|"&RC[49]&"|"&RC[50]&"|"&RC[51] -> 888|10|28|28|28|28|28|28|140|140|56|56|56|56|56|56|280|280|28|28|28|28|28|28|140|140|140000|140000|140000|140000|140000|140000|700000|700000|280|280|280|280|280|280|1400|1400|2800|2800|2800|2800|2800|2800|14000|14000 | L42: 19005|200#19103|75 | M42: 888 | N42: 10 | O42: =INT(R6C*(1+0.05*RC1)) -> 28 | P42: =INT(R6C*(1+0.05*RC1)) -> 28 | Q42: =INT(R6C*(1+0.05*RC1)) -> 28 | R42: =INT(R6C*(1+0.05*RC1)) -> 28 | S42: =INT(R6C*(1+0.05*RC1)) -> 28 | T42: =INT(R6C*(1+0.05*RC1)) -> 28 | U42: =INT(R6C*(1+0.05*RC1)) -> 140 | V42: =INT(R6C*(1+0.05*RC1)) -> 140 | W42: =INT(R6C*(1+0.05*RC1)) -> 56 | X42: =INT(R6C*(1+0.05*RC1)) -> 56 | Y42: =INT(R6C*(1+0.05*RC1)) -> 56 | Z42: =INT(R6C*(1+0.05*RC1)) -> 56 | AA42: =INT(R6C*(1+0.05*RC1)) -> 56 | AB42: =INT(R6C*(1+0.05*RC1)) -> 56 | AC42: =INT(R6C*(1+0.05*RC1)) -> 280 | AD42: =INT(R6C*(1+0.05*RC1)) -> 280 | AE42: =INT(R6C*(1+0.05*RC1)) -> 28 | AF42: =INT(R6C*(1+0.05*RC1)) -> 28 | AG42: =INT(R6C*(1+0.05*RC1)) -> 28 | AH42: =INT(R6C*(1+0.05*RC1)) -> 28 | AI42: =INT(R6C*(1+0.05*RC1)) -> 28 | AJ42: =INT(R6C*(1+0.05*RC1)) -> 28 | AK42: =INT(R6C*(1+0.05*RC1)) -> 140 | AL42: =INT(R6C*(1+0.05*RC1)) -> 140 | AM42: =INT(R6C*(1+0.05*RC1)) -> 140000 | AN42: =INT(R6C*(1+0.05*RC1)) -> 140000 | AO42: =INT(R6C*(1+0.05*RC1)) -> 140000 | AP42: =INT(R6C*(1+0.05*RC1)) -> 140000 | AQ42: =INT(R6C*(1+0.05*RC1)) -> 140000 | AR42: =INT(R6C*(1+0.05*RC1)) -> 140000 | AS42: =INT(R6C*(1+0.05*RC1)) -> 700000 | AT42: =INT(R6C*(1+0.05*RC1)) -> 700000 | AU42: =INT(R6C*(1+0.05*RC1)) -> 280 | AV42: =INT(R6C*(1+0.05*RC1)) -> 280 | AW42: =INT(R6C*(1+0.05*RC1)) -> 280 | AX42: =INT(R6C*(1+0.05*RC1)) -> 280 | AY42: =INT(R6C*(1+0.05*RC1)) -> 280 | AZ42: =INT(R6C*(1+0.05*RC1)) -> 280 | BA42: =INT(R6C*(1+0.05*RC1)) -> 1400 | BB42: =INT(R6C*(1+0.05*RC1)) -> 1400 | BC42: =INT(R6C*(1+0.05*RC1)) -> 2800 | BD42: =INT(R6C*(1+0.05*RC1)) -> 2800 | BE42: =INT(R6C*(1+0.05*RC1)) -> 2800 | BF42: =INT(R6C*(1+0.05*RC1)) -> 2800 | BG42: =INT(R6C*(1+0.05*RC1)) -> 2800 | BH42: =INT(R6C*(1+0.05*RC1)) -> 2800 | BI42: =INT(R6C*(1+0.05*RC1)) -> 14000 | BJ42: =INT(R6C*(1+0.05*RC1)) -> 14000
A43: 37 | B43: 1 | C43: 37 | D43: 第三十七章 钢铁 | E43: =990+RC[-4]*10&"|"&991+RC[-4]*10&"|"&992+RC[-4]*10 -> 1360|1361|1362 | F43: 0|1|2 | G43: 500 | H43: 570 | I43: 500 | J43: 19005|10022|10004|10004|10004|10004|10004|10004|10004|10004|10010|10010|10010|10010|10010|10010|10010|10010|10014|10014|10014|10014|10014|10014|10014|10014|19003|19003|19003|19003|19003|19003|19003|19003|19006|19006|19006|19006|19006|19006|19006|19006|19012|19012|19012|19012|19012|19012|19012|19012 | K43: =RC[2]&"|"&RC[3]&"|"&RC[4]&"|"&RC[5]&"|"&RC[6]&"|"&RC[7]&"|"&RC[8]&"|"&RC[9]&"|"&RC[10]&"|"&RC[11]&"|"&RC[12]&"|"&RC[13]&"|"&RC[14]&"|"&RC[15]&"|"&RC[16]&"|"&RC[17]&"|"&RC[18]&"|"&RC[19]&"|"&RC[20]&"|"&RC[21]&"|"&RC[22]&"|"&RC[23]&"|"&RC[24]&"|"&RC[25]&"|"&RC[26]&"|"&RC[27]&"|"&RC[28]&"|"&RC[29]&"|"&RC[30]&"|"&RC[31]&"|"&RC[32]&"|"&RC[33]&"|"&RC[34]&"|"&RC[35]&"|"&RC[36]&"|"&RC[37]&"|"&RC[38]&"|"&RC[39]&"|"&RC[40]&"|"&RC[41]&"|"&RC[42]&"|"&RC[43]&"|"&RC[44]&"|"&RC[45]&"|"&RC[46]&"|"&RC[47]&"|"&RC[48]&"|"&RC[49]&"|"&RC[50]&"|"&RC[51] -> 888|10|28|28|28|28|28|28|142|142|57|57|57|57|57|57|285|285|28|28|28|28|28|28|142|142|142500|142500|142500|142500|142500|142500|712500|712500|285|285|285|285|285|285|1425|1425|2850|2850|2850|2850|2850|2850|14250|14250 | L43: 19005|200#10022|15 | M43: 888 | N43: 10 | O43: =INT(R6C*(1+0.05*RC1)) -> 28 | P43: =INT(R6C*(1+0.05*RC1)) -> 28 | Q43: =INT(R6C*(1+0.05*RC1)) -> 28 | R43: =INT(R6C*(1+0.05*RC1)) -> 28 | S43: =INT(R6C*(1+0.05*RC1)) -> 28 | T43: =INT(R6C*(1+0.05*RC1)) -> 28 | U43: =INT(R6C*(1+0.05*RC1)) -> 142 | V43: =INT(R6C*(1+0.05*RC1)) -> 142 | W43: =INT(R6C*(1+0.05*RC1)) -> 57 | X43: =INT(R6C*(1+0.05*RC1)) -> 57 | Y43: =INT(R6C*(1+0.05*RC1)) -> 57 | Z43: =INT(R6C*(1+0.05*RC1)) -> 57 | AA43: =INT(R6C*(1+0.05*RC1)) -> 57 | AB43: =INT(R6C*(1+0.05*RC1)) -> 57 | AC43: =INT(R6C*(1+0.05*RC1)) -> 285 | AD43: =INT(R6C*(1+0.05*RC1)) -> 285 | AE43: =INT(R6C*(1+0.05*RC1)) -> 28 | AF43: =INT(R6C*(1+0.05*RC1)) -> 28 | AG43: =INT(R6C*(1+0.05*RC1)) -> 28 | AH43: =INT(R6C*(1+0.05*RC1)) -> 28 | AI43: =INT(R6C*(1+0.05*RC1)) -> 28 | AJ43: =INT(R6C*(1+0.05*RC1)) -> 28 | AK43: =INT(R6C*(1+0.05*RC1)) -> 142 | AL43: =INT(R6C*(1+0.05*RC1)) -> 142 | AM43: =INT(R6C*(1+0.05*RC1)) -> 142500 | AN43: =INT(R6C*(1+0.05*RC1)) -> 142500 | AO43: =INT(R6C*(1+0.05*RC1)) -> 142500 | AP43: =INT(R6C*(1+0.05*RC1)) -> 142500 | AQ43: =INT(R6C*(1+0.05*RC1)) -> 142500 | AR43: =INT(R6C*(1+0.05*RC1)) -> 142500 | AS43: =INT(R6C*(1+0.05*RC1)) -> 712500 | AT43: =INT(R6C*(1+0.05*RC1)) -> 712500 | AU43: =INT(R6C*(1+0.05*RC1)) -> 285 | AV43: =INT(R6C*(1+0.05*RC1)) -> 285 | AW43: =INT(R6C*(1+0.05*RC1)) -> 285 | AX43: =INT(R6C*(1+0.05*RC1)) -> 285 | AY43: =INT(R6C*(1+0.05*RC1)) -> 285 | AZ43: =INT(R6C*(1+0.05*RC1)) -> 285 | BA43: =INT(R6C*(1+0.05*RC1)) -> 1425 | BB43: =INT(R6C*(1+0.05*RC1)) -> 1425 | BC43: =INT(R6C*(1+0.05*RC1)) -> 2850 | BD43: =INT(R6C*(1+0.05*RC1)) -> 2850 | BE43: =INT(R6C*(1+0.05*RC1)) -> 2850 | BF43: =INT(R6C*(1+0.05*RC1)) -> 2850 | BG43: =INT(R6C*(1+0.05*RC1)) -> 2850 | BH43: =INT(R6C*(1+0.05*RC1)) -> 2850 | BI43: =INT(R6C*(1+0.05*RC1)) -> 14250 | BJ43: =INT(R6C*(1+0.05*RC1)) -> 14250
A44: 38 | B44: 2 | C44: 38 | D44: 第三十八章 毁灭 | E44: =990+RC[-4]*10&"|"&991+RC[-4]*10&"|"&992+RC[-4]*10 -> 1370|1371|1372 | F44: 0|1|2 | G44: 500 | H44: 580 | I44: 500 | J44: 19005|10022|10004|10004|10004|10004|10004|10004|10004|10004|10010|10010|10010|10010|10010|10010|10010|10010|10014|10014|10014|10014|10014|10014|10014|10014|19003|19003|19003|19003|19003|19003|19003|19003|19006|19006|19006|19006|19006|19006|19006|19006|19012|19012|19012|19012|19012|19012|19012|19012 | K44: =RC[2]&"|"&RC[3]&"|"&RC[4]&"|"&RC[5]&"|"&RC[6]&"|"&RC[7]&"|"&RC[8]&"|"&RC[9]&"|"&RC[10]&"|"&RC[11]&"|"&RC[12]&"|"&RC[13]&"|"&RC[14]&"|"&RC[15]&"|"&RC[16]&"|"&RC[17]&"|"&RC[18]&"|"&RC[19]&"|"&RC[20]&"|"&RC[21]&"|"&RC[22]&"|"&RC[23]&"|"&RC[24]&"|"&RC[25]&"|"&RC[26]&"|"&RC[27]&"|"&RC[28]&"|"&RC[29]&"|"&RC[30]&"|"&RC[31]&"|"&RC[32]&"|"&RC[33]&"|"&RC[34]&"|"&RC[35]&"|"&RC[36]&"|"&RC[37]&"|"&RC[38]&"|"&RC[39]&"|"&RC[40]&"|"&RC[41]&"|"&RC[42]&"|"&RC[43]&"|"&RC[44]&"|"&RC[45]&"|"&RC[46]&"|"&RC[47]&"|"&RC[48]&"|"&RC[49]&"|"&RC[50]&"|"&RC[51] -> 888|10|29|29|29|29|29|29|145|145|58|58|58|58|58|58|290|290|29|29|29|29|29|29|145|145|145000|145000|145000|145000|145000|145000|725000|725000|290|290|290|290|290|290|1450|1450|2900|2900|2900|2900|2900|2900|14500|14500 | L44: 19005|200#19006|750 | M44: 888 | N44: 10 | O44: =INT(R6C*(1+0.05*RC1)) -> 29 | P44: =INT(R6C*(1+0.05*RC1)) -> 29 | Q44: =INT(R6C*(1+0.05*RC1)) -> 29 | R44: =INT(R6C*(1+0.05*RC1)) -> 29 | S44: =INT(R6C*(1+0.05*RC1)) -> 29 | T44: =INT(R6C*(1+0.05*RC1)) -> 29 | U44: =INT(R6C*(1+0.05*RC1)) -> 145 | V44: =INT(R6C*(1+0.05*RC1)) -> 145 | W44: =INT(R6C*(1+0.05*RC1)) -> 58 | X44: =INT(R6C*(1+0.05*RC1)) -> 58 | Y44: =INT(R6C*(1+0.05*RC1)) -> 58 | Z44: =INT(R6C*(1+0.05*RC1)) -> 58 | AA44: =INT(R6C*(1+0.05*RC1)) -> 58 | AB44: =INT(R6C*(1+0.05*RC1)) -> 58 | AC44: =INT(R6C*(1+0.05*RC1)) -> 290 | AD44: =INT(R6C*(1+0.05*RC1)) -> 290 | AE44: =INT(R6C*(1+0.05*RC1)) -> 29 | AF44: =INT(R6C*(1+0.05*RC1)) -> 29 | AG44: =INT(R6C*(1+0.05*RC1)) -> 29 | AH44: =INT(R6C*(1+0.05*RC1)) -> 29 | AI44: =INT(R6C*(1+0.05*RC1)) -> 29 | AJ44: =INT(R6C*(1+0.05*RC1)) -> 29 | AK44: =INT(R6C*(1+0.05*RC1)) -> 145 | AL44: =INT(R6C*(1+0.05*RC1)) -> 145 | AM44: =INT(R6C*(1+0.05*RC1)) -> 145000 | AN44: =INT(R6C*(1+0.05*RC1)) -> 145000 | AO44: =INT(R6C*(1+0.05*RC1)) -> 145000 | AP44: =INT(R6C*(1+0.05*RC1)) -> 145000 | AQ44: =INT(R6C*(1+0.05*RC1)) -> 145000 | AR44: =INT(R6C*(1+0.05*RC1)) -> 145000 | AS44: =INT(R6C*(1+0.05*RC1)) -> 725000 | AT44: =INT(R6C*(1+0.05*RC1)) -> 725000 | AU44: =INT(R6C*(1+0.05*RC1)) -> 290 | AV44: =INT(R6C*(1+0.05*RC1)) -> 290 | AW44: =INT(R6C*(1+0.05*RC1)) -> 290 | AX44: =INT(R6C*(1+0.05*RC1)) -> 290 | AY44: =INT(R6C*(1+0.05*RC1)) -> 290 | AZ44: =INT(R6C*(1+0.05*RC1)) -> 290 | BA44: =INT(R6C*(1+0.05*RC1)) -> 1450 | BB44: =INT(R6C*(1+0.05*RC1)) -> 1450 | BC44: =INT(R6C*(1+0.05*RC1)) -> 2900 | BD44: =INT(R6C*(1+0.05*RC1)) -> 2900 | BE44: =INT(R6C*(1+0.05*RC1)) -> 2900 | BF44: =INT(R6C*(1+0.05*RC1)) -> 2900 | BG44: =INT(R6C*(1+0.05*RC1)) -> 2900 | BH44: =INT(R6C*(1+0.05*RC1)) -> 2900 | BI44: =INT(R6C*(1+0.05*RC1)) -> 14500 | BJ44: =INT(R6C*(1+0.05*RC1)) -> 14500
A45: 39 | B45: 3 | C45: 39 | D45: 第三十九章 碾压 | E45: =990+RC[-4]*10&"|"&991+RC[-4]*10&"|"&992+RC[-4]*10 -> 1380|1381|1382 | F45: 0|1|2 | G45: 500 | H45: 590 | I45: 500 | J45: 19005|10022|10004|10004|10004|10004|10004|10004|10004|10004|10010|10010|10010|10010|10010|10010|10010|10010|10014|10014|10014|10014|10014|10014|10014|10014|19003|19003|19003|19003|19003|19003|19003|19003|19006|19006|19006|19006|19006|19006|19006|19006|19012|19012|19012|19012|19012|19012|19012|19012 | K45: =RC[2]&"|"&RC[3]&"|"&RC[4]&"|"&RC[5]&"|"&RC[6]&"|"&RC[7]&"|"&RC[8]&"|"&RC[9]&"|"&RC[10]&"|"&RC[11]&"|"&RC[12]&"|"&RC[13]&"|"&RC[14]&"|"&RC[15]&"|"&RC[16]&"|"&RC[17]&"|"&RC[18]&"|"&RC[19]&"|"&RC[20]&"|"&RC[21]&"|"&RC[22]&"|"&RC[23]&"|"&RC[24]&"|"&RC[25]&"|"&RC[26]&"|"&RC[27]&"|"&RC[28]&"|"&RC[29]&"|"&RC[30]&"|"&RC[31]&"|"&RC[32]&"|"&RC[33]&"|"&RC[34]&"|"&RC[35]&"|"&RC[36]&"|"&RC[37]&"|"&RC[38]&"|"&RC[39]&"|"&RC[40]&"|"&RC[41]&"|"&RC[42]&"|"&RC[43]&"|"&RC[44]&"|"&RC[45]&"|"&RC[46]&"|"&RC[47]&"|"&RC[48]&"|"&RC[49]&"|"&RC[50]&"|"&RC[51] -> 888|10|29|29|29|29|29|29|147|147|59|59|59|59|59|59|295|295|29|29|29|29|29|29|147|147|147500|147500|147500|147500|147500|147500|737500|737500|295|295|295|295|295|295|1475|1475|2950|2950|2950|2950|2950|2950|14750|14750 | L45: 19005|200#19012|7500 | M45: 888 | N45: 10 | O45: =INT(R6C*(1+0.05*RC1)) -> 29 | P45: =INT(R6C*(1+0.05*RC1)) -> 29 | Q45: =INT(R6C*(1+0.05*RC1)) -> 29 | R45: =INT(R6C*(1+0.05*RC1)) -> 29 | S45: =INT(R6C*(1+0.05*RC1)) -> 29 | T45: =INT(R6C*(1+0.05*RC1)) -> 29 | U45: =INT(R6C*(1+0.05*RC1)) -> 147 | V45: =INT(R6C*(1+0.05*RC1)) -> 147 | W45: =INT(R6C*(1+0.05*RC1)) -> 59 | X45: =INT(R6C*(1+0.05*RC1)) -> 59 | Y45: =INT(R6C*(1+0.05*RC1)) -> 59 | Z45: =INT(R6C*(1+0.05*RC1)) -> 59 | AA45: =INT(R6C*(1+0.05*RC1)) -> 59 | AB45: =INT(R6C*(1+0.05*RC1)) -> 59 | AC45: =INT(R6C*(1+0.05*RC1)) -> 295 | AD45: =INT(R6C*(1+0.05*RC1)) -> 295 | AE45: =INT(R6C*(1+0.05*RC1)) -> 29 | AF45: =INT(R6C*(1+0.05*RC1)) -> 29 | AG45: =INT(R6C*(1+0.05*RC1)) -> 29 | AH45: =INT(R6C*(1+0.05*RC1)) -> 29 | AI45: =INT(R6C*(1+0.05*RC1)) -> 29 | AJ45: =INT(R6C*(1+0.05*RC1)) -> 29 | AK45: =INT(R6C*(1+0.05*RC1)) -> 147 | AL45: =INT(R6C*(1+0.05*RC1)) -> 147 | AM45: =INT(R6C*(1+0.05*RC1)) -> 147500 | AN45: =INT(R6C*(1+0.05*RC1)) -> 147500 | AO45: =INT(R6C*(1+0.05*RC1)) -> 147500 | AP45: =INT(R6C*(1+0.05*RC1)) -> 147500 | AQ45: =INT(R6C*(1+0.05*RC1)) -> 147500 | AR45: =INT(R6C*(1+0.05*RC1)) -> 147500 | AS45: =INT(R6C*(1+0.05*RC1)) -> 737500 | AT45: =INT(R6C*(1+0.05*RC1)) -> 737500 | AU45: =INT(R6C*(1+0.05*RC1)) -> 295 | AV45: =INT(R6C*(1+0.05*RC1)) -> 295 | AW45: =INT(R6C*(1+0.05*RC1)) -> 295 | AX45: =INT(R6C*(1+0.05*RC1)) -> 295 | AY45: =INT(R6C*(1+0.05*RC1)) -> 295 | AZ45: =INT(R6C*(1+0.05*RC1)) -> 295 | BA45: =INT(R6C*(1+0.05*RC1)) -> 1475 | BB45: =INT(R6C*(1+0.05*RC1)) -> 1475 | BC45: =INT(R6C*(1+0.05*RC1)) -> 2950 | BD45: =INT(R6C*(1+0.05*RC1)) -> 2950 | BE45: =INT(R6C*(1+0.05*RC1)) -> 2950 | BF45: =INT(R6C*(1+0.05*RC1)) -> 2950 | BG45: =INT(R6C*(1+0.05*RC1)) -> 2950 | BH45: =INT(R6C*(1+0.05*RC1)) -> 2950 | BI45: =INT(R6C*(1+0.05*RC1)) -> 14750 | BJ45: =INT(R6C*(1+0.05*RC1)) -> 14750
A46: 40 | B46: 1 | C46: 40 | D46: 第四十章 亡者 | E46: =990+RC[-4]*10&"|"&991+RC[-4]*10&"|"&992+RC[-4]*10 -> 1390|1391|1392 | F46: 0|1|2 | G46: 500 | H46: 600 | I46: 500 | J46: 19005|10022|10004|10004|10004|10004|10004|10004|10004|10004|10010|10010|10010|10010|10010|10010|10010|10010|10014|10014|10014|10014|10014|10014|10014|10014|19003|19003|19003|19003|19003|19003|19003|19003|19006|19006|19006|19006|19006|19006|19006|19006|19012|19012|19012|19012|19012|19012|19012|19012 | K46: =RC[2]&"|"&RC[3]&"|"&RC[4]&"|"&RC[5]&"|"&RC[6]&"|"&RC[7]&"|"&RC[8]&"|"&RC[9]&"|"&RC[10]&"|"&RC[11]&"|"&RC[12]&"|"&RC[13]&"|"&RC[14]&"|"&RC[15]&"|"&RC[16]&"|"&RC[17]&"|"&RC[18]&"|"&RC[19]&"|"&RC[20]&"|"&RC[21]&"|"&RC[22]&"|"&RC[23]&"|"&RC[24]&"|"&RC[25]&"|"&RC[26]&"|"&RC[27]&"|"&RC[28]&"|"&RC[29]&"|"&RC[30]&"|"&RC[31]&"|"&RC[32]&"|"&RC[33]&"|"&RC[34]&"|"&RC[35]&"|"&RC[36]&"|"&RC[37]&"|"&RC[38]&"|"&RC[39]&"|"&RC[40]&"|"&RC[41]&"|"&RC[42]&"|"&RC[43]&"|"&RC[44]&"|"&RC[45]&"|"&RC[46]&"|"&RC[47]&"|"&RC[48]&"|"&RC[49]&"|"&RC[50]&"|"&RC[51] -> 888|10|30|30|30|30|30|30|150|150|60|60|60|60|60|60|300|300|30|30|30|30|30|30|150|150|150000|150000|150000|150000|150000|150000|750000|750000|300|300|300|300|300|300|1500|1500|3000|3000|3000|3000|3000|3000|15000|15000 | L46: 19005|200#19103|75 | M46: 888 | N46: 10 | O46: =INT(R6C*(1+0.05*RC1)) -> 30 | P46: =INT(R6C*(1+0.05*RC1)) -> 30 | Q46: =INT(R6C*(1+0.05*RC1)) -> 30 | R46: =INT(R6C*(1+0.05*RC1)) -> 30 | S46: =INT(R6C*(1+0.05*RC1)) -> 30 | T46: =INT(R6C*(1+0.05*RC1)) -> 30 | U46: =INT(R6C*(1+0.05*RC1)) -> 150 | V46: =INT(R6C*(1+0.05*RC1)) -> 150 | W46: =INT(R6C*(1+0.05*RC1)) -> 60 | X46: =INT(R6C*(1+0.05*RC1)) -> 60 | Y46: =INT(R6C*(1+0.05*RC1)) -> 60 | Z46: =INT(R6C*(1+0.05*RC1)) -> 60 | AA46: =INT(R6C*(1+0.05*RC1)) -> 60 | AB46: =INT(R6C*(1+0.05*RC1)) -> 60 | AC46: =INT(R6C*(1+0.05*RC1)) -> 300 | AD46: =INT(R6C*(1+0.05*RC1)) -> 300 | AE46: =INT(R6C*(1+0.05*RC1)) -> 30 | AF46: =INT(R6C*(1+0.05*RC1)) -> 30 | AG46: =INT(R6C*(1+0.05*RC1)) -> 30 | AH46: =INT(R6C*(1+0.05*RC1)) -> 30 | AI46: =INT(R6C*(1+0.05*RC1)) -> 30 | AJ46: =INT(R6C*(1+0.05*RC1)) -> 30 | AK46: =INT(R6C*(1+0.05*RC1)) -> 150 | AL46: =INT(R6C*(1+0.05*RC1)) -> 150 | AM46: =INT(R6C*(1+0.05*RC1)) -> 150000 | AN46: =INT(R6C*(1+0.05*RC1)) -> 150000 | AO46: =INT(R6C*(1+0.05*RC1)) -> 150000 | AP46: =INT(R6C*(1+0.05*RC1)) -> 150000 | AQ46: =INT(R6C*(1+0.05*RC1)) -> 150000 | AR46: =INT(R6C*(1+0.05*RC1)) -> 150000 | AS46: =INT(R6C*(1+0.05*RC1)) -> 750000 | AT46: =INT(R6C*(1+0.05*RC1)) -> 750000 | AU46: =INT(R6C*(1+0.05*RC1)) -> 300 | AV46: =INT(R6C*(1+0.05*RC1)) -> 300 | AW46: =INT(R6C*(1+0.05*RC1)) -> 300 | AX46: =INT(R6C*(1+0.05*RC1)) -> 300 | AY46: =INT(R6C*(1+0.05*RC1)) -> 300 | AZ46: =INT(R6C*(1+0.05*RC1)) -> 300 | BA46: =INT(R6C*(1+0.05*RC1)) -> 1500 | BB46: =INT(R6C*(1+0.05*RC1)) -> 1500 | BC46: =INT(R6C*(1+0.05*RC1)) -> 3000 | BD46: =INT(R6C*(1+0.05*RC1)) -> 3000 | BE46: =INT(R6C*(1+0.05*RC1)) -> 3000 | BF46: =INT(R6C*(1+0.05*RC1)) -> 3000 | BG46: =INT(R6C*(1+0.05*RC1)) -> 3000 | BH46: =INT(R6C*(1+0.05*RC1)) -> 3000 | BI46: =INT(R6C*(1+0.05*RC1)) -> 15000 | BJ46: =INT(R6C*(1+0.05*RC1)) -> 15000
A47: 41 | B47: 2 | C47: 41 | D47: 第四十一章 野蛮 | E47: =990+RC[-4]*10&"|"&991+RC[-4]*10&"|"&992+RC[-4]*10 -> 1400|1401|1402 | F47: 0|1|2 | G47: 500 | H47: 610 | I47: 500 | J47: 19005|10022|10004|10004|10004|10004|10004|10004|10004|10004|10010|10010|10010|10010|10010|10010|10010|10010|10014|10014|10014|10014|10014|10014|10014|10014|19003|19003|19003|19003|19003|19003|19003|19003|19006|19006|19006|19006|19006|19006|19006|19006|19012|19012|19012|19012|19012|19012|19012|19012 | K47: =RC[2]&"|"&RC[3]&"|"&RC[4]&"|"&RC[5]&"|"&RC[6]&"|"&RC[7]&"|"&RC[8]&"|"&RC[9]&"|"&RC[10]&"|"&RC[11]&"|"&RC[12]&"|"&RC[13]&"|"&RC[14]&"|"&RC[15]&"|"&RC[16]&"|"&RC[17]&"|"&RC[18]&"|"&RC[19]&"|"&RC[20]&"|"&RC[21]&"|"&RC[22]&"|"&RC[23]&"|"&RC[24]&"|"&RC[25]&"|"&RC[26]&"|"&RC[27]&"|"&RC[28]&"|"&RC[29]&"|"&RC[30]&"|"&RC[31]&"|"&RC[32]&"|"&RC[33]&"|"&RC[34]&"|"&RC[35]&"|"&RC[36]&"|"&RC[37]&"|"&RC[38]&"|"&RC[39]&"|"&RC[40]&"|"&RC[41]&"|"&RC[42]&"|"&RC[43]&"|"&RC[44]&"|"&RC[45]&"|"&RC[46]&"|"&RC[47]&"|"&RC[48]&"|"&RC[49]&"|"&RC[50]&"|"&RC[51] -> 888|10|30|30|30|30|30|30|152|152|61|61|61|61|61|61|305|305|30|30|30|30|30|30|152|152|152500|152500|152500|152500|152500|152500|762500|762500|305|305|305|305|305|305|1525|1525|3050|3050|3050|3050|3050|3050|15250|15250 | L47: 19005|200#10022|20 | M47: 888 | N47: 10 | O47: =INT(R6C*(1+0.05*RC1)) -> 30 | P47: =INT(R6C*(1+0.05*RC1)) -> 30 | Q47: =INT(R6C*(1+0.05*RC1)) -> 30 | R47: =INT(R6C*(1+0.05*RC1)) -> 30 | S47: =INT(R6C*(1+0.05*RC1)) -> 30 | T47: =INT(R6C*(1+0.05*RC1)) -> 30 | U47: =INT(R6C*(1+0.05*RC1)) -> 152 | V47: =INT(R6C*(1+0.05*RC1)) -> 152 | W47: =INT(R6C*(1+0.05*RC1)) -> 61 | X47: =INT(R6C*(1+0.05*RC1)) -> 61 | Y47: =INT(R6C*(1+0.05*RC1)) -> 61 | Z47: =INT(R6C*(1+0.05*RC1)) -> 61 | AA47: =INT(R6C*(1+0.05*RC1)) -> 61 | AB47: =INT(R6C*(1+0.05*RC1)) -> 61 | AC47: =INT(R6C*(1+0.05*RC1)) -> 305 | AD47: =INT(R6C*(1+0.05*RC1)) -> 305 | AE47: =INT(R6C*(1+0.05*RC1)) -> 30 | AF47: =INT(R6C*(1+0.05*RC1)) -> 30 | AG47: =INT(R6C*(1+0.05*RC1)) -> 30 | AH47: =INT(R6C*(1+0.05*RC1)) -> 30 | AI47: =INT(R6C*(1+0.05*RC1)) -> 30 | AJ47: =INT(R6C*(1+0.05*RC1)) -> 30 | AK47: =INT(R6C*(1+0.05*RC1)) -> 152 | AL47: =INT(R6C*(1+0.05*RC1)) -> 152 | AM47: =INT(R6C*(1+0.05*RC1)) -> 152500 | AN47: =INT(R6C*(1+0.05*RC1)) -> 152500 | AO47: =INT(R6C*(1+0.05*RC1)) -> 152500 | AP47: =INT(R6C*(1+0.05*RC1)) -> 152500 | AQ47: =INT(R6C*(1+0.05*RC1)) -> 152500 | AR47: =INT(R6C*(1+0.05*RC1)) -> 152500 | AS47: =INT(R6C*(1+0.05*RC1)) -> 762500 | AT47: =INT(R6C*(1+0.05*RC1)) -> 762500 | AU47: =INT(R6C*(1+0.05*RC1)) -> 305 | AV47: =INT(R6C*(1+0.05*RC1)) -> 305 | AW47: =INT(R6C*(1+0.05*RC1)) -> 305 | AX47: =INT(R6C*(1+0.05*RC1)) -> 305 | AY47: =INT(R6C*(1+0.05*RC1)) -> 305 | AZ47: =INT(R6C*(1+0.05*RC1)) -> 305 | BA47: =INT(R6C*(1+0.05*RC1)) -> 1525 | BB47: =INT(R6C*(1+0.05*RC1)) -> 1525 | BC47: =INT(R6C*(1+0.05*RC1)) -> 3050 | BD47: =INT(R6C*(1+0.05*RC1)) -> 3050 | BE47: =INT(R6C*(1+0.05*RC1)) -> 3050 | BF47: =INT(R6C*(1+0.05*RC1)) -> 3050 | BG47: =INT(R6C*(1+0.05*RC1)) -> 3050 | BH47: =INT(R6C*(1+0.05*RC1)) -> 3050 | BI47: =INT(R6C*(1+0.05*RC1)) -> 15250 | BJ47: =INT(R6C*(1+0.05*RC1)) -> 15250
A48: 42 | B48: 3 | C48: 42 | D48: 第四十二章 燎原 | E48: =990+RC[-4]*10&"|"&991+RC[-4]*10&"|"&992+RC[-4]*10 -> 1410|1411|1412 | F48: 0|1|2 | G48: 500 | H48: 620 | I48: 500 | J48: 19005|10022|10004|10004|10004|10004|10004|10004|10004|10004|10010|10010|10010|10010|10010|10010|10010|10010|10014|10014|10014|10014|10014|10014|10014|10014|19003|19003|19003|19003|19003|19003|19003|19003|19006|19006|19006|19006|19006|19006|19006|19006|19012|19012|19012|19012|19012|19012|19012|19012 | K48: =RC[2]&"|"&RC[3]&"|"&RC[4]&"|"&RC[5]&"|"&RC[6]&"|"&RC[7]&"|"&RC[8]&"|"&RC[9]&"|"&RC[10]&"|"&RC[11]&"|"&RC[12]&"|"&RC[13]&"|"&RC[14]&"|"&RC[15]&"|"&RC[16]&"|"&RC[17]&"|"&RC[18]&"|"&RC[19]&"|"&RC[20]&"|"&RC[21]&"|"&RC[22]&"|"&RC[23]&"|"&RC[24]&"|"&RC[25]&"|"&RC[26]&"|"&RC[27]&"|"&RC[28]&"|"&RC[29]&"|"&RC[30]&"|"&RC[31]&"|"&RC[32]&"|"&RC[33]&"|"&RC[34]&"|"&RC[35]&"|"&RC[36]&"|"&RC[37]&"|"&RC[38]&"|"&RC[39]&"|"&RC[40]&"|"&RC[41]&"|"&RC[42]&"|"&RC[43]&"|"&RC[44]&"|"&RC[45]&"|"&RC[46]&"|"&RC[47]&"|"&RC[48]&"|"&RC[49]&"|"&RC[50]&"|"&RC[51] -> 888|10|31|31|31|31|31|31|155|155|62|62|62|62|62|62|310|310|31|31|31|31|31|31|155|155|155000|155000|155000|155000|155000|155000|775000|775000|310|310|310|310|310|310|1550|1550|3100|3100|3100|3100|3100|3100|15500|15500 | L48: 19005|200#19006|1000 | M48: 888 | N48: 10 | O48: =INT(R6C*(1+0.05*RC1)) -> 31 | P48: =INT(R6C*(1+0.05*RC1)) -> 31 | Q48: =INT(R6C*(1+0.05*RC1)) -> 31 | R48: =INT(R6C*(1+0.05*RC1)) -> 31 | S48: =INT(R6C*(1+0.05*RC1)) -> 31 | T48: =INT(R6C*(1+0.05*RC1)) -> 31 | U48: =INT(R6C*(1+0.05*RC1)) -> 155 | V48: =INT(R6C*(1+0.05*RC1)) -> 155 | W48: =INT(R6C*(1+0.05*RC1)) -> 62 | X48: =INT(R6C*(1+0.05*RC1)) -> 62 | Y48: =INT(R6C*(1+0.05*RC1)) -> 62 | Z48: =INT(R6C*(1+0.05*RC1)) -> 62 | AA48: =INT(R6C*(1+0.05*RC1)) -> 62 | AB48: =INT(R6C*(1+0.05*RC1)) -> 62 | AC48: =INT(R6C*(1+0.05*RC1)) -> 310 | AD48: =INT(R6C*(1+0.05*RC1)) -> 310 | AE48: =INT(R6C*(1+0.05*RC1)) -> 31 | AF48: =INT(R6C*(1+0.05*RC1)) -> 31 | AG48: =INT(R6C*(1+0.05*RC1)) -> 31 | AH48: =INT(R6C*(1+0.05*RC1)) -> 31 | AI48: =INT(R6C*(1+0.05*RC1)) -> 31 | AJ48: =INT(R6C*(1+0.05*RC1)) -> 31 | AK48: =INT(R6C*(1+0.05*RC1)) -> 155 | AL48: =INT(R6C*(1+0.05*RC1)) -> 155 | AM48: =INT(R6C*(1+0.05*RC1)) -> 155000 | AN48: =INT(R6C*(1+0.05*RC1)) -> 155000 | AO48: =INT(R6C*(1+0.05*RC1)) -> 155000 | AP48: =INT(R6C*(1+0.05*RC1)) -> 155000 | AQ48: =INT(R6C*(1+0.05*RC1)) -> 155000 | AR48: =INT(R6C*(1+0.05*RC1)) -> 155000 | AS48: =INT(R6C*(1+0.05*RC1)) -> 775000 | AT48: =INT(R6C*(1+0.05*RC1)) -> 775000 | AU48: =INT(R6C*(1+0.05*RC1)) -> 310 | AV48: =INT(R6C*(1+0.05*RC1)) -> 310 | AW48: =INT(R6C*(1+0.05*RC1)) -> 310 | AX48: =INT(R6C*(1+0.05*RC1)) -> 310 | AY48: =INT(R6C*(1+0.05*RC1)) -> 310 | AZ48: =INT(R6C*(1+0.05*RC1)) -> 310 | BA48: =INT(R6C*(1+0.05*RC1)) -> 1550 | BB48: =INT(R6C*(1+0.05*RC1)) -> 1550 | BC48: =INT(R6C*(1+0.05*RC1)) -> 3100 | BD48: =INT(R6C*(1+0.05*RC1)) -> 3100 | BE48: =INT(R6C*(1+0.05*RC1)) -> 3100 | BF48: =INT(R6C*(1+0.05*RC1)) -> 3100 | BG48: =INT(R6C*(1+0.05*RC1)) -> 3100 | BH48: =INT(R6C*(1+0.05*RC1)) -> 3100 | BI48: =INT(R6C*(1+0.05*RC1)) -> 15500 | BJ48: =INT(R6C*(1+0.05*RC1)) -> 15500
A49: 43 | B49: 1 | C49: 43 | D49: 第四十三章 永恒 | E49: =990+RC[-4]*10&"|"&991+RC[-4]*10&"|"&992+RC[-4]*10 -> 1420|1421|1422 | F49: 0|1|2 | G49: 500 | H49: 630 | I49: 500 | J49: 19005|10022|10004|10004|10004|10004|10004|10004|10004|10004|10010|10010|10010|10010|10010|10010|10010|10010|10014|10014|10014|10014|10014|10014|10014|10014|19003|19003|19003|19003|19003|19003|19003|19003|19006|19006|19006|19006|19006|19006|19006|19006|19012|19012|19012|19012|19012|19012|19012|19012 | K49: =RC[2]&"|"&RC[3]&"|"&RC[4]&"|"&RC[5]&"|"&RC[6]&"|"&RC[7]&"|"&RC[8]&"|"&RC[9]&"|"&RC[10]&"|"&RC[11]&"|"&RC[12]&"|"&RC[13]&"|"&RC[14]&"|"&RC[15]&"|"&RC[16]&"|"&RC[17]&"|"&RC[18]&"|"&RC[19]&"|"&RC[20]&"|"&RC[21]&"|"&RC[22]&"|"&RC[23]&"|"&RC[24]&"|"&RC[25]&"|"&RC[26]&"|"&RC[27]&"|"&RC[28]&"|"&RC[29]&"|"&RC[30]&"|"&RC[31]&"|"&RC[32]&"|"&RC[33]&"|"&RC[34]&"|"&RC[35]&"|"&RC[36]&"|"&RC[37]&"|"&RC[38]&"|"&RC[39]&"|"&RC[40]&"|"&RC[41]&"|"&RC[42]&"|"&RC[43]&"|"&RC[44]&"|"&RC[45]&"|"&RC[46]&"|"&RC[47]&"|"&RC[48]&"|"&RC[49]&"|"&RC[50]&"|"&RC[51] -> 888|10|31|31|31|31|31|31|157|157|63|63|63|63|63|63|315|315|31|31|31|31|31|31|157|157|157500|157500|157500|157500|157500|157500|787500|787500|315|315|315|315|315|315|1575|1575|3150|3150|3150|3150|3150|3150|15750|15750 | L49: 19005|200#19012|10000 | M49: 888 | N49: 10 | O49: =INT(R6C*(1+0.05*RC1)) -> 31 | P49: =INT(R6C*(1+0.05*RC1)) -> 31 | Q49: =INT(R6C*(1+0.05*RC1)) -> 31 | R49: =INT(R6C*(1+0.05*RC1)) -> 31 | S49: =INT(R6C*(1+0.05*RC1)) -> 31 | T49: =INT(R6C*(1+0.05*RC1)) -> 31 | U49: =INT(R6C*(1+0.05*RC1)) -> 157 | V49: =INT(R6C*(1+0.05*RC1)) -> 157 | W49: =INT(R6C*(1+0.05*RC1)) -> 63 | X49: =INT(R6C*(1+0.05*RC1)) -> 63 | Y49: =INT(R6C*(1+0.05*RC1)) -> 63 | Z49: =INT(R6C*(1+0.05*RC1)) -> 63 | AA49: =INT(R6C*(1+0.05*RC1)) -> 63 | AB49: =INT(R6C*(1+0.05*RC1)) -> 63 | AC49: =INT(R6C*(1+0.05*RC1)) -> 315 | AD49: =INT(R6C*(1+0.05*RC1)) -> 315 | AE49: =INT(R6C*(1+0.05*RC1)) -> 31 | AF49: =INT(R6C*(1+0.05*RC1)) -> 31 | AG49: =INT(R6C*(1+0.05*RC1)) -> 31 | AH49: =INT(R6C*(1+0.05*RC1)) -> 31 | AI49: =INT(R6C*(1+0.05*RC1)) -> 31 | AJ49: =INT(R6C*(1+0.05*RC1)) -> 31 | AK49: =INT(R6C*(1+0.05*RC1)) -> 157 | AL49: =INT(R6C*(1+0.05*RC1)) -> 157 | AM49: =INT(R6C*(1+0.05*RC1)) -> 157500 | AN49: =INT(R6C*(1+0.05*RC1)) -> 157500 | AO49: =INT(R6C*(1+0.05*RC1)) -> 157500 | AP49: =INT(R6C*(1+0.05*RC1)) -> 157500 | AQ49: =INT(R6C*(1+0.05*RC1)) -> 157500 | AR49: =INT(R6C*(1+0.05*RC1)) -> 157500 | AS49: =INT(R6C*(1+0.05*RC1)) -> 787500 | AT49: =INT(R6C*(1+0.05*RC1)) -> 787500 | AU49: =INT(R6C*(1+0.05*RC1)) -> 315 | AV49: =INT(R6C*(1+0.05*RC1)) -> 315 | AW49: =INT(R6C*(1+0.05*RC1)) -> 315 | AX49: =INT(R6C*(1+0.05*RC1)) -> 315 | AY49: =INT(R6C*(1+0.05*RC1)) -> 315 | AZ49: =INT(R6C*(1+0.05*RC1)) -> 315 | BA49: =INT(R6C*(1+0.05*RC1)) -> 1575 | BB49: =INT(R6C*(1+0.05*RC1)) -> 1575 | BC49: =INT(R6C*(1+0.05*RC1)) -> 3150 | BD49: =INT(R6C*(1+0.05*RC1)) -> 3150 | BE49: =INT(R6C*(1+0.05*RC1)) -> 3150 | BF49: =INT(R6C*(1+0.05*RC1)) -> 3150 | BG49: =INT(R6C*(1+0.05*RC1)) -> 3150 | BH49: =INT(R6C*(1+0.05*RC1)) -> 3150 | BI49: =INT(R6C*(1+0.05*RC1)) -> 15750 | BJ49: =INT(R6C*(1+0.05*RC1)) -> 15750
A50: 44 | B50: 2 | C50: 44 | D50: 第四十四章 轰鸣 | E50: =990+RC[-4]*10&"|"&991+RC[-4]*10&"|"&992+RC[-4]*10 -> 1430|1431|1432 | F50: 0|1|2 | G50: 500 | H50: 640 | I50: 500 | J50: 19005|10022|10004|10004|10004|10004|10004|10004|10004|10004|10010|10010|10010|10010|10010|10010|10010|10010|10014|10014|10014|10014|10014|10014|10014|10014|19003|19003|19003|19003|19003|19003|19003|19003|19006|19006|19006|19006|19006|19006|19006|19006|19012|19012|19012|19012|19012|19012|19012|19012 | K50: =RC[2]&"|"&RC[3]&"|"&RC[4]&"|"&RC[5]&"|"&RC[6]&"|"&RC[7]&"|"&RC[8]&"|"&RC[9]&"|"&RC[10]&"|"&RC[11]&"|"&RC[12]&"|"&RC[13]&"|"&RC[14]&"|"&RC[15]&"|"&RC[16]&"|"&RC[17]&"|"&RC[18]&"|"&RC[19]&"|"&RC[20]&"|"&RC[21]&"|"&RC[22]&"|"&RC[23]&"|"&RC[24]&"|"&RC[25]&"|"&RC[26]&"|"&RC[27]&"|"&RC[28]&"|"&RC[29]&"|"&RC[30]&"|"&RC[31]&"|"&RC[32]&"|"&RC[33]&"|"&RC[34]&"|"&RC[35]&"|"&RC[36]&"|"&RC[37]&"|"&RC[38]&"|"&RC[39]&"|"&RC[40]&"|"&RC[41]&"|"&RC[42]&"|"&RC[43]&"|"&RC[44]&"|"&RC[45]&"|"&RC[46]&"|"&RC[47]&"|"&RC[48]&"|"&RC[49]&"|"&RC[50]&"|"&RC[51] -> 888|10|32|32|32|32|32|32|160|160|64|64|64|64|64|64|320|320|32|32|32|32|32|32|160|160|160000|160000|160000|160000|160000|160000|800000|800000|320|320|320|320|320|320|1600|1600|3200|3200|3200|3200|3200|3200|16000|16000 | L50: 19005|200#19103|100 | M50: 888 | N50: 10 | O50: =INT(R6C*(1+0.05*RC1)) -> 32 | P50: =INT(R6C*(1+0.05*RC1)) -> 32 | Q50: =INT(R6C*(1+0.05*RC1)) -> 32 | R50: =INT(R6C*(1+0.05*RC1)) -> 32 | S50: =INT(R6C*(1+0.05*RC1)) -> 32 | T50: =INT(R6C*(1+0.05*RC1)) -> 32 | U50: =INT(R6C*(1+0.05*RC1)) -> 160 | V50: =INT(R6C*(1+0.05*RC1)) -> 160 | W50: =INT(R6C*(1+0.05*RC1)) -> 64 | X50: =INT(R6C*(1+0.05*RC1)) -> 64 | Y50: =INT(R6C*(1+0.05*RC1)) -> 64 | Z50: =INT(R6C*(1+0.05*RC1)) -> 64 | AA50: =INT(R6C*(1+0.05*RC1)) -> 64 | AB50: =INT(R6C*(1+0.05*RC1)) -> 64 | AC50: =INT(R6C*(1+0.05*RC1)) -> 320 | AD50: =INT(R6C*(1+0.05*RC1)) -> 320 | AE50: =INT(R6C*(1+0.05*RC1)) -> 32 | AF50: =INT(R6C*(1+0.05*RC1)) -> 32 | AG50: =INT(R6C*(1+0.05*RC1)) -> 32 | AH50: =INT(R6C*(1+0.05*RC1)) -> 32 | AI50: =INT(R6C*(1+0.05*RC1)) -> 32 | AJ50: =INT(R6C*(1+0.05*RC1)) -> 32 | AK50: =INT(R6C*(1+0.05*RC1)) -> 160 | AL50: =INT(R6C*(1+0.05*RC1)) -> 160 | AM50: =INT(R6C*(1+0.05*RC1)) -> 160000 | AN50: =INT(R6C*(1+0.05*RC1)) -> 160000 | AO50: =INT(R6C*(1+0.05*RC1)) -> 160000 | AP50: =INT(R6C*(1+0.05*RC1)) -> 160000 | AQ50: =INT(R6C*(1+0.05*RC1)) -> 160000 | AR50: =INT(R6C*(1+0.05*RC1)) -> 160000 | AS50: =INT(R6C*(1+0.05*RC1)) -> 800000 | AT50: =INT(R6C*(1+0.05*RC1)) -> 800000 | AU50: =INT(R6C*(1+0.05*RC1)) -> 320 | AV50: =INT(R6C*(1+0.05*RC1)) -> 320 | AW50: =INT(R6C*(1+0.05*RC1)) -> 320 | AX50: =INT(R6C*(1+0.05*RC1)) -> 320 | AY50: =INT(R6C*(1+0.05*RC1)) -> 320 | AZ50: =INT(R6C*(1+0.05*RC1)) -> 320 | BA50: =INT(R6C*(1+0.05*RC1)) -> 1600 | BB50: =INT(R6C*(1+0.05*RC1)) -> 1600 | BC50: =INT(R6C*(1+0.05*RC1)) -> 3200 | BD50: =INT(R6C*(1+0.05*RC1)) -> 3200 | BE50: =INT(R6C*(1+0.05*RC1)) -> 3200 | BF50: =INT(R6C*(1+0.05*RC1)) -> 3200 | BG50: =INT(R6C*(1+0.05*RC1)) -> 3200 | BH50: =INT(R6C*(1+0.05*RC1)) -> 3200 | BI50: =INT(R6C*(1+0.05*RC1)) -> 16000 | BJ50: =INT(R6C*(1+0.05*RC1)) -> 16000
A51: 45 | B51: 3 | C51: 45 | D51: 第四十五章 狂野 | E51: =990+RC[-4]*10&"|"&991+RC[-4]*10&"|"&992+RC[-4]*10 -> 1440|1441|1442 | F51: 0|1|2 | G51: 500 | H51: 650 | I51: 500 | J51: 19005|10022|10004|10004|10004|10004|10004|10004|10004|10004|10010|10010|10010|10010|10010|10010|10010|10010|10014|10014|10014|10014|10014|10014|10014|10014|19003|19003|19003|19003|19003|19003|19003|19003|19006|19006|19006|19006|19006|19006|19006|19006|19012|19012|19012|19012|19012|19012|19012|19012 | K51: =RC[2]&"|"&RC[3]&"|"&RC[4]&"|"&RC[5]&"|"&RC[6]&"|"&RC[7]&"|"&RC[8]&"|"&RC[9]&"|"&RC[10]&"|"&RC[11]&"|"&RC[12]&"|"&RC[13]&"|"&RC[14]&"|"&RC[15]&"|"&RC[16]&"|"&RC[17]&"|"&RC[18]&"|"&RC[19]&"|"&RC[20]&"|"&RC[21]&"|"&RC[22]&"|"&RC[23]&"|"&RC[24]&"|"&RC[25]&"|"&RC[26]&"|"&RC[27]&"|"&RC[28]&"|"&RC[29]&"|"&RC[30]&"|"&RC[31]&"|"&RC[32]&"|"&RC[33]&"|"&RC[34]&"|"&RC[35]&"|"&RC[36]&"|"&RC[37]&"|"&RC[38]&"|"&RC[39]&"|"&RC[40]&"|"&RC[41]&"|"&RC[42]&"|"&RC[43]&"|"&RC[44]&"|"&RC[45]&"|"&RC[46]&"|"&RC[47]&"|"&RC[48]&"|"&RC[49]&"|"&RC[50]&"|"&RC[51] -> 888|10|32|32|32|32|32|32|162|162|65|65|65|65|65|65|325|325|32|32|32|32|32|32|162|162|162500|162500|162500|162500|162500|162500|812500|812500|325|325|325|325|325|325|1625|1625|3250|3250|3250|3250|3250|3250|16250|16250 | L51: 19005|200#10022|20 | M51: 888 | N51: 10 | O51: =INT(R6C*(1+0.05*RC1)) -> 32 | P51: =INT(R6C*(1+0.05*RC1)) -> 32 | Q51: =INT(R6C*(1+0.05*RC1)) -> 32 | R51: =INT(R6C*(1+0.05*RC1)) -> 32 | S51: =INT(R6C*(1+0.05*RC1)) -> 32 | T51: =INT(R6C*(1+0.05*RC1)) -> 32 | U51: =INT(R6C*(1+0.05*RC1)) -> 162 | V51: =INT(R6C*(1+0.05*RC1)) -> 162 | W51: =INT(R6C*(1+0.05*RC1)) -> 65 | X51: =INT(R6C*(1+0.05*RC1)) -> 65 | Y51: =INT(R6C*(1+0.05*RC1)) -> 65 | Z51: =INT(R6C*(1+0.05*RC1)) -> 65 | AA51: =INT(R6C*(1+0.05*RC1)) -> 65 | AB51: =INT(R6C*(1+0.05*RC1)) -> 65 | AC51: =INT(R6C*(1+0.05*RC1)) -> 325 | AD51: =INT(R6C*(1+0.05*RC1)) -> 325 | AE51: =INT(R6C*(1+0.05*RC1)) -> 32 | AF51: =INT(R6C*(1+0.05*RC1)) -> 32 | AG51: =INT(R6C*(1+0.05*RC1)) -> 32 | AH51: =INT(R6C*(1+0.05*RC1)) -> 32 | AI51: =INT(R6C*(1+0.05*RC1)) -> 32 | AJ51: =INT(R6C*(1+0.05*RC1)) -> 32 | AK51: =INT(R6C*(1+0.05*RC1)) -> 162 | AL51: =INT(R6C*(1+0.05*RC1)) -> 162 | AM51: =INT(R6C*(1+0.05*RC1)) -> 162500 | AN51: =INT(R6C*(1+0.05*RC1)) -> 162500 | AO51: =INT(R6C*(1+0.05*RC1)) -> 162500 | AP51: =INT(R6C*(1+0.05*RC1)) -> 162500 | AQ51: =INT(R6C*(1+0.05*RC1)) -> 162500 | AR51: =INT(R6C*(1+0.05*RC1)) -> 162500 | AS51: =INT(R6C*(1+0.05*RC1)) -> 812500 | AT51: =INT(R6C*(1+0.05*RC1)) -> 812500 | AU51: =INT(R6C*(1+0.05*RC1)) -> 325 | AV51: =INT(R6C*(1+0.05*RC1)) -> 325 | AW51: =INT(R6C*(1+0.05*RC1)) -> 325 | AX51: =INT(R6C*(1+0.05*RC1)) -> 325 | AY51: =INT(R6C*(1+0.05*RC1)) -> 325 | AZ51: =INT(R6C*(1+0.05*RC1)) -> 325 | BA51: =INT(R6C*(1+0.05*RC1)) -> 1625 | BB51: =INT(R6C*(1+0.05*RC1)) -> 1625 | BC51: =INT(R6C*(1+0.05*RC1)) -> 3250 | BD51: =INT(R6C*(1+0.05*RC1)) -> 3250 | BE51: =INT(R6C*(1+0.05*RC1)) -> 3250 | BF51: =INT(R6C*(1+0.05*RC1)) -> 3250 | BG51: =INT(R6C*(1+0.05*RC1)) -> 3250 | BH51: =INT(R6C*(1+0.05*RC1)) -> 3250 | BI51: =INT(R6C*(1+0.05*RC1)) -> 16250 | BJ51: =INT(R6C*(1+0.05*RC1)) -> 16250
A52: 46 | B52: 1 | C52: 46 | D52: 第四十六章 灾厄 | E52: =990+RC[-4]*10&"|"&991+RC[-4]*10&"|"&992+RC[-4]*10 -> 1450|1451|1452 | F52: 0|1|2 | G52: 500 | H52: 660 | I52: 500 | J52: 19005|10022|10004|10004|10004|10004|10004|10004|10004|10004|10010|10010|10010|10010|10010|10010|10010|10010|10014|10014|10014|10014|10014|10014|10014|10014|19003|19003|19003|19003|19003|19003|19003|19003|19006|19006|19006|19006|19006|19006|19006|19006|19012|19012|19012|19012|19012|19012|19012|19012 | K52: =RC[2]&"|"&RC[3]&"|"&RC[4]&"|"&RC[5]&"|"&RC[6]&"|"&RC[7]&"|"&RC[8]&"|"&RC[9]&"|"&RC[10]&"|"&RC[11]&"|"&RC[12]&"|"&RC[13]&"|"&RC[14]&"|"&RC[15]&"|"&RC[16]&"|"&RC[17]&"|"&RC[18]&"|"&RC[19]&"|"&RC[20]&"|"&RC[21]&"|"&RC[22]&"|"&RC[23]&"|"&RC[24]&"|"&RC[25]&"|"&RC[26]&"|"&RC[27]&"|"&RC[28]&"|"&RC[29]&"|"&RC[30]&"|"&RC[31]&"|"&RC[32]&"|"&RC[33]&"|"&RC[34]&"|"&RC[35]&"|"&RC[36]&"|"&RC[37]&"|"&RC[38]&"|"&RC[39]&"|"&RC[40]&"|"&RC[41]&"|"&RC[42]&"|"&RC[43]&"|"&RC[44]&"|"&RC[45]&"|"&RC[46]&"|"&RC[47]&"|"&RC[48]&"|"&RC[49]&"|"&RC[50]&"|"&RC[51] -> 888|10|33|33|33|33|33|33|165|165|66|66|66|66|66|66|330|330|33|33|33|33|33|33|165|165|165000|165000|165000|165000|165000|165000|825000|825000|330|330|330|330|330|330|1650|1650|3300|3300|3300|3300|3300|3300|16500|16500 | L52: 19005|200#19006|1000 | M52: 888 | N52: 10 | O52: =INT(R6C*(1+0.05*RC1)) -> 33 | P52: =INT(R6C*(1+0.05*RC1)) -> 33 | Q52: =INT(R6C*(1+0.05*RC1)) -> 33 | R52: =INT(R6C*(1+0.05*RC1)) -> 33 | S52: =INT(R6C*(1+0.05*RC1)) -> 33 | T52: =INT(R6C*(1+0.05*RC1)) -> 33 | U52: =INT(R6C*(1+0.05*RC1)) -> 165 | V52: =INT(R6C*(1+0.05*RC1)) -> 165 | W52: =INT(R6C*(1+0.05*RC1)) -> 66 | X52: =INT(R6C*(1+0.05*RC1)) -> 66 | Y52: =INT(R6C*(1+0.05*RC1)) -> 66 | Z52: =INT(R6C*(1+0.05*RC1)) -> 66 | AA52: =INT(R6C*(1+0.05*RC1)) -> 66 | AB52: =INT(R6C*(1+0.05*RC1)) -> 66 | AC52: =INT(R6C*(1+0.05*RC1)) -> 330 | AD52: =INT(R6C*(1+0.05*RC1)) -> 330 | AE52: =INT(R6C*(1+0.05*RC1)) -> 33 | AF52: =INT(R6C*(1+0.05*RC1)) -> 33 | AG52: =INT(R6C*(1+0.05*RC1)) -> 33 | AH52: =INT(R6C*(1+0.05*RC1)) -> 33 | AI52: =INT(R6C*(1+0.05*RC1)) -> 33 | AJ52: =INT(R6C*(1+0.05*RC1)) -> 33 | AK52: =INT(R6C*(1+0.05*RC1)) -> 165 | AL52: =INT(R6C*(1+0.05*RC1)) -> 165 | AM52: =INT(R6C*(1+0.05*RC1)) -> 165000 | AN52: =INT(R6C*(1+0.05*RC1)) -> 165000 | AO52: =INT(R6C*(1+0.05*RC1)) -> 165000 | AP52: =INT(R6C*(1+0.05*RC1)) -> 165000 | AQ52: =INT(R6C*(1+0.05*RC1)) -> 165000 | AR52: =INT(R6C*(1+0.05*RC1)) -> 165000 | AS52: =INT(R6C*(1+0.05*RC1)) -> 825000 | AT52: =INT(R6C*(1+0.05*RC1)) -> 825000 | AU52: =INT(R6C*(1+0.05*RC1)) -> 330 | AV52: =INT(R6C*(1+0.05*RC1)) -> 330 | AW52: =INT(R6C*(1+0.05*RC1)) -> 330 | AX52: =INT(R6C*(1+0.05*RC1)) -> 330 | AY52: =INT(R6C*(1+0.05*RC1)) -> 330 | AZ52: =INT(R6C*(1+0.05*RC1)) -> 330 | BA52: =INT(R6C*(1+0.05*RC1)) -> 1650 | BB52: =INT(R6C*(1+0.05*RC1)) -> 1650 | BC52: =INT(R6C*(1+0.05*RC1)) -> 3300 | BD52: =INT(R6C*(1+0.05*RC1)) -> 3300 | BE52: =INT(R6C*(1+0.05*RC1)) -> 3300 | BF52: =INT(R6C*(1+0.05*RC1)) -> 3300 | BG52: =INT(R6C*(1+0.05*RC1)) -> 3300 | BH52: =INT(R6C*(1+0.05*RC1)) -> 3300 | BI52: =INT(R6C*(1+0.05*RC1)) -> 16500 | BJ52: =INT(R6C*(1+0.05*RC1)) -> 16500
A53: 47 | B53: 2 | C53: 47 | D53: 第四十七章 锋芒 | E53: =990+RC[-4]*10&"|"&991+RC[-4]*10&"|"&992+RC[-4]*10 -> 1460|1461|1462 | F53: 0|1|2 | G53: 500 | H53: 670 | I53: 500 | J53: 19005|10022|10004|10004|10004|10004|10004|10004|10004|10004|10010|10010|10010|10010|10010|10010|10010|10010|10014|10014|10014|10014|10014|10014|10014|10014|19003|19003|19003|19003|19003|19003|19003|19003|19006|19006|19006|19006|19006|19006|19006|19006|19012|19012|19012|19012|19012|19012|19012|19012 | K53: =RC[2]&"|"&RC[3]&"|"&RC[4]&"|"&RC[5]&"|"&RC[6]&"|"&RC[7]&"|"&RC[8]&"|"&RC[9]&"|"&RC[10]&"|"&RC[11]&"|"&RC[12]&"|"&RC[13]&"|"&RC[14]&"|"&RC[15]&"|"&RC[16]&"|"&RC[17]&"|"&RC[18]&"|"&RC[19]&"|"&RC[20]&"|"&RC[21]&"|"&RC[22]&"|"&RC[23]&"|"&RC[24]&"|"&RC[25]&"|"&RC[26]&"|"&RC[27]&"|"&RC[28]&"|"&RC[29]&"|"&RC[30]&"|"&RC[31]&"|"&RC[32]&"|"&RC[33]&"|"&RC[34]&"|"&RC[35]&"|"&RC[36]&"|"&RC[37]&"|"&RC[38]&"|"&RC[39]&"|"&RC[40]&"|"&RC[41]&"|"&RC[42]&"|"&RC[43]&"|"&RC[44]&"|"&RC[45]&"|"&RC[46]&"|"&RC[47]&"|"&RC[48]&"|"&RC[49]&"|"&RC[50]&"|"&RC[51] -> 888|10|33|33|33|33|33|33|167|167|67|67|67|67|67|67|335|335|33|33|33|33|33|33|167|167|167500|167500|167500|167500|167500|167500|837500|837500|335|335|335|335|335|335|1675|1675|3350|3350|3350|3350|3350|3350|16750|16750 | L53: 19005|200#19012|10000 | M53: 888 | N53: 10 | O53: =INT(R6C*(1+0.05*RC1)) -> 33 | P53: =INT(R6C*(1+0.05*RC1)) -> 33 | Q53: =INT(R6C*(1+0.05*RC1)) -> 33 | R53: =INT(R6C*(1+0.05*RC1)) -> 33 | S53: =INT(R6C*(1+0.05*RC1)) -> 33 | T53: =INT(R6C*(1+0.05*RC1)) -> 33 | U53: =INT(R6C*(1+0.05*RC1)) -> 167 | V53: =INT(R6C*(1+0.05*RC1)) -> 167 | W53: =INT(R6C*(1+0.05*RC1)) -> 67 | X53: =INT(R6C*(1+0.05*RC1)) -> 67 | Y53: =INT(R6C*(1+0.05*RC1)) -> 67 | Z53: =INT(R6C*(1+0.05*RC1)) -> 67 | AA53: =INT(R6C*(1+0.05*RC1)) -> 67 | AB53: =INT(R6C*(1+0.05*RC1)) -> 67 | AC53: =INT(R6C*(1+0.05*RC1)) -> 335 | AD53: =INT(R6C*(1+0.05*RC1)) -> 335 | AE53: =INT(R6C*(1+0.05*RC1)) -> 33 | AF53: =INT(R6C*(1+0.05*RC1)) -> 33 | AG53: =INT(R6C*(1+0.05*RC1)) -> 33 | AH53: =INT(R6C*(1+0.05*RC1)) -> 33 | AI53: =INT(R6C*(1+0.05*RC1)) -> 33 | AJ53: =INT(R6C*(1+0.05*RC1)) -> 33 | AK53: =INT(R6C*(1+0.05*RC1)) -> 167 | AL53: =INT(R6C*(1+0.05*RC1)) -> 167 | AM53: =INT(R6C*(1+0.05*RC1)) -> 167500 | AN53: =INT(R6C*(1+0.05*RC1)) -> 167500 | AO53: =INT(R6C*(1+0.05*RC1)) -> 167500 | AP53: =INT(R6C*(1+0.05*RC1)) -> 167500 | AQ53: =INT(R6C*(1+0.05*RC1)) -> 167500 | AR53: =INT(R6C*(1+0.05*RC1)) -> 167500 | AS53: =INT(R6C*(1+0.05*RC1)) -> 837500 | AT53: =INT(R6C*(1+0.05*RC1)) -> 837500 | AU53: =INT(R6C*(1+0.05*RC1)) -> 335 | AV53: =INT(R6C*(1+0.05*RC1)) -> 335 | AW53: =INT(R6C*(1+0.05*RC1)) -> 335 | AX53: =INT(R6C*(1+0.05*RC1)) -> 335 | AY53: =INT(R6C*(1+0.05*RC1)) -> 335 | AZ53: =INT(R6C*(1+0.05*RC1)) -> 335 | BA53: =INT(R6C*(1+0.05*RC1)) -> 1675 | BB53: =INT(R6C*(1+0.05*RC1)) -> 1675 | BC53: =INT(R6C*(1+0.05*RC1)) -> 3350 | BD53: =INT(R6C*(1+0.05*RC1)) -> 3350 | BE53: =INT(R6C*(1+0.05*RC1)) -> 3350 | BF53: =INT(R6C*(1+0.05*RC1)) -> 3350 | BG53: =INT(R6C*(1+0.05*RC1)) -> 3350 | BH53: =INT(R6C*(1+0.05*RC1)) -> 3350 | BI53: =INT(R6C*(1+0.05*RC1)) -> 16750 | BJ53: =INT(R6C*(1+0.05*RC1)) -> 16750
A54: 48 | B54: 3 | C54: 48 | D54: 第四十八章 熔岩 | E54: =990+RC[-4]*10&"|"&991+RC[-4]*10&"|"&992+RC[-4]*10 -> 1470|1471|1472 | F54: 0|1|2 | G54: 500 | H54: 680 | I54: 500 | J54: 19005|10022|10004|10004|10004|10004|10004|10004|10004|10004|10010|10010|10010|10010|10010|10010|10010|10010|10014|10014|10014|10014|10014|10014|10014|10014|19003|19003|19003|19003|19003|19003|19003|19003|19006|19006|19006|19006|19006|19006|19006|19006|19012|19012|19012|19012|19012|19012|19012|19012 | K54: =RC[2]&"|"&RC[3]&"|"&RC[4]&"|"&RC[5]&"|"&RC[6]&"|"&RC[7]&"|"&RC[8]&"|"&RC[9]&"|"&RC[10]&"|"&RC[11]&"|"&RC[12]&"|"&RC[13]&"|"&RC[14]&"|"&RC[15]&"|"&RC[16]&"|"&RC[17]&"|"&RC[18]&"|"&RC[19]&"|"&RC[20]&"|"&RC[21]&"|"&RC[22]&"|"&RC[23]&"|"&RC[24]&"|"&RC[25]&"|"&RC[26]&"|"&RC[27]&"|"&RC[28]&"|"&RC[29]&"|"&RC[30]&"|"&RC[31]&"|"&RC[32]&"|"&RC[33]&"|"&RC[34]&"|"&RC[35]&"|"&RC[36]&"|"&RC[37]&"|"&RC[38]&"|"&RC[39]&"|"&RC[40]&"|"&RC[41]&"|"&RC[42]&"|"&RC[43]&"|"&RC[44]&"|"&RC[45]&"|"&RC[46]&"|"&RC[47]&"|"&RC[48]&"|"&RC[49]&"|"&RC[50]&"|"&RC[51] -> 888|10|34|34|34|34|34|34|170|170|68|68|68|68|68|68|340|340|34|34|34|34|34|34|170|170|170000|170000|170000|170000|170000|170000|850000|850000|340|340|340|340|340|340|1700|1700|3400|3400|3400|3400|3400|3400|17000|17000 | L54: 19005|200#19103|100 | M54: 888 | N54: 10 | O54: =INT(R6C*(1+0.05*RC1)) -> 34 | P54: =INT(R6C*(1+0.05*RC1)) -> 34 | Q54: =INT(R6C*(1+0.05*RC1)) -> 34 | R54: =INT(R6C*(1+0.05*RC1)) -> 34 | S54: =INT(R6C*(1+0.05*RC1)) -> 34 | T54: =INT(R6C*(1+0.05*RC1)) -> 34 | U54: =INT(R6C*(1+0.05*RC1)) -> 170 | V54: =INT(R6C*(1+0.05*RC1)) -> 170 | W54: =INT(R6C*(1+0.05*RC1)) -> 68 | X54: =INT(R6C*(1+0.05*RC1)) -> 68 | Y54: =INT(R6C*(1+0.05*RC1)) -> 68 | Z54: =INT(R6C*(1+0.05*RC1)) -> 68 | AA54: =INT(R6C*(1+0.05*RC1)) -> 68 | AB54: =INT(R6C*(1+0.05*RC1)) -> 68 | AC54: =INT(R6C*(1+0.05*RC1)) -> 340 | AD54: =INT(R6C*(1+0.05*RC1)) -> 340 | AE54: =INT(R6C*(1+0.05*RC1)) -> 34 | AF54: =INT(R6C*(1+0.05*RC1)) -> 34 | AG54: =INT(R6C*(1+0.05*RC1)) -> 34 | AH54: =INT(R6C*(1+0.05*RC1)) -> 34 | AI54: =INT(R6C*(1+0.05*RC1)) -> 34 | AJ54: =INT(R6C*(1+0.05*RC1)) -> 34 | AK54: =INT(R6C*(1+0.05*RC1)) -> 170 | AL54: =INT(R6C*(1+0.05*RC1)) -> 170 | AM54: =INT(R6C*(1+0.05*RC1)) -> 170000 | AN54: =INT(R6C*(1+0.05*RC1)) -> 170000 | AO54: =INT(R6C*(1+0.05*RC1)) -> 170000 | AP54: =INT(R6C*(1+0.05*RC1)) -> 170000 | AQ54: =INT(R6C*(1+0.05*RC1)) -> 170000 | AR54: =INT(R6C*(1+0.05*RC1)) -> 170000 | AS54: =INT(R6C*(1+0.05*RC1)) -> 850000 | AT54: =INT(R6C*(1+0.05*RC1)) -> 850000 | AU54: =INT(R6C*(1+0.05*RC1)) -> 340 | AV54: =INT(R6C*(1+0.05*RC1)) -> 340 | AW54: =INT(R6C*(1+0.05*RC1)) -> 340 | AX54: =INT(R6C*(1+0.05*RC1)) -> 340 | AY54: =INT(R6C*(1+0.05*RC1)) -> 340 | AZ54: =INT(R6C*(1+0.05*RC1)) -> 340 | BA54: =INT(R6C*(1+0.05*RC1)) -> 1700 | BB54: =INT(R6C*(1+0.05*RC1)) -> 1700 | BC54: =INT(R6C*(1+0.05*RC1)) -> 3400 | BD54: =INT(R6C*(1+0.05*RC1)) -> 3400 | BE54: =INT(R6C*(1+0.05*RC1)) -> 3400 | BF54: =INT(R6C*(1+0.05*RC1)) -> 3400 | BG54: =INT(R6C*(1+0.05*RC1)) -> 3400 | BH54: =INT(R6C*(1+0.05*RC1)) -> 3400 | BI54: =INT(R6C*(1+0.05*RC1)) -> 17000 | BJ54: =INT(R6C*(1+0.05*RC1)) -> 17000
A55: 49 | B55: 1 | C55: 49 | D55: 第四十九章 不朽 | E55: =990+RC[-4]*10&"|"&991+RC[-4]*10&"|"&992+RC[-4]*10 -> 1480|1481|1482 | F55: 0|1|2 | G55: 500 | H55: 690 | I55: 500 | J55: 19005|10022|10004|10004|10004|10004|10004|10004|10004|10004|10010|10010|10010|10010|10010|10010|10010|10010|10014|10014|10014|10014|10014|10014|10014|10014|19003|19003|19003|19003|19003|19003|19003|19003|19006|19006|19006|19006|19006|19006|19006|19006|19012|19012|19012|19012|19012|19012|19012|19012 | K55: =RC[2]&"|"&RC[3]&"|"&RC[4]&"|"&RC[5]&"|"&RC[6]&"|"&RC[7]&"|"&RC[8]&"|"&RC[9]&"|"&RC[10]&"|"&RC[11]&"|"&RC[12]&"|"&RC[13]&"|"&RC[14]&"|"&RC[15]&"|"&RC[16]&"|"&RC[17]&"|"&RC[18]&"|"&RC[19]&"|"&RC[20]&"|"&RC[21]&"|"&RC[22]&"|"&RC[23]&"|"&RC[24]&"|"&RC[25]&"|"&RC[26]&"|"&RC[27]&"|"&RC[28]&"|"&RC[29]&"|"&RC[30]&"|"&RC[31]&"|"&RC[32]&"|"&RC[33]&"|"&RC[34]&"|"&RC[35]&"|"&RC[36]&"|"&RC[37]&"|"&RC[38]&"|"&RC[39]&"|"&RC[40]&"|"&RC[41]&"|"&RC[42]&"|"&RC[43]&"|"&RC[44]&"|"&RC[45]&"|"&RC[46]&"|"&RC[47]&"|"&RC[48]&"|"&RC[49]&"|"&RC[50]&"|"&RC[51] -> 888|10|34|34|34|34|34|34|172|172|69|69|69|69|69|69|345|345|34|34|34|34|34|34|172|172|172500|172500|172500|172500|172500|172500|862500|862500|345|345|345|345|345|345|1725|1725|3450|3450|3450|3450|3450|3450|17250|17250 | L55: 19005|200#10022|20 | M55: 888 | N55: 10 | O55: =INT(R6C*(1+0.05*RC1)) -> 34 | P55: =INT(R6C*(1+0.05*RC1)) -> 34 | Q55: =INT(R6C*(1+0.05*RC1)) -> 34 | R55: =INT(R6C*(1+0.05*RC1)) -> 34 | S55: =INT(R6C*(1+0.05*RC1)) -> 34 | T55: =INT(R6C*(1+0.05*RC1)) -> 34 | U55: =INT(R6C*(1+0.05*RC1)) -> 172 | V55: =INT(R6C*(1+0.05*RC1)) -> 172 | W55: =INT(R6C*(1+0.05*RC1)) -> 69 | X55: =INT(R6C*(1+0.05*RC1)) -> 69 | Y55: =INT(R6C*(1+0.05*RC1)) -> 69 | Z55: =INT(R6C*(1+0.05*RC1)) -> 69 | AA55: =INT(R6C*(1+0.05*RC1)) -> 69 | AB55: =INT(R6C*(1+0.05*RC1)) -> 69 | AC55: =INT(R6C*(1+0.05*RC1)) -> 345 | AD55: =INT(R6C*(1+0.05*RC1)) -> 345 | AE55: =INT(R6C*(1+0.05*RC1)) -> 34 | AF55: =INT(R6C*(1+0.05*RC1)) -> 34 | AG55: =INT(R6C*(1+0.05*RC1)) -> 34 | AH55: =INT(R6C*(1+0.05*RC1)) -> 34 | AI55: =INT(R6C*(1+0.05*RC1)) -> 34 | AJ55: =INT(R6C*(1+0.05*RC1)) -> 34 | AK55: =INT(R6C*(1+0.05*RC1)) -> 172 | AL55: =INT(R6C*(1+0.05*RC1)) -> 172 | AM55: =INT(R6C*(1+0.05*RC1)) -> 172500 | AN55: =INT(R6C*(1+0.05*RC1)) -> 172500 | AO55: =INT(R6C*(1+0.05*RC1)) -> 172500 | AP55: =INT(R6C*(1+0.05*RC1)) -> 172500 | AQ55: =INT(R6C*(1+0.05*RC1)) -> 172500 | AR55: =INT(R6C*(1+0.05*RC1)) -> 172500 | AS55: =INT(R6C*(1+0.05*RC1)) -> 862500 | AT55: =INT(R6C*(1+0.05*RC1)) -> 862500 | AU55: =INT(R6C*(1+0.05*RC1)) -> 345 | AV55: =INT(R6C*(1+0.05*RC1)) -> 345 | AW55: =INT(R6C*(1+0.05*RC1)) -> 345 | AX55: =INT(R6C*(1+0.05*RC1)) -> 345 | AY55: =INT(R6C*(1+0.05*RC1)) -> 345 | AZ55: =INT(R6C*(1+0.05*RC1)) -> 345 | BA55: =INT(R6C*(1+0.05*RC1)) -> 1725 | BB55: =INT(R6C*(1+0.05*RC1)) -> 1725 | BC55: =INT(R6C*(1+0.05*RC1)) -> 3450 | BD55: =INT(R6C*(1+0.05*RC1)) -> 3450 | BE55: =INT(R6C*(1+0.05*RC1)) -> 3450 | BF55: =INT(R6C*(1+0.05*RC1)) -> 3450 | BG55: =INT(R6C*(1+0.05*RC1)) -> 3450 | BH55: =INT(R6C*(1+0.05*RC1)) -> 3450 | BI55: =INT(R6C*(1+0.05*RC1)) -> 17250 | BJ55: =INT(R6C*(1+0.05*RC1)) -> 17250
A56: 50 | B56: 2 | C56: 50 | D56: 第五十章 怒吼 | E56: =990+RC[-4]*10&"|"&991+RC[-4]*10&"|"&992+RC[-4]*10 -> 1490|1491|1492 | F56: 0|1|2 | G56: 500 | H56: 700 | I56: 500 | J56: 19005|10022|10004|10004|10004|10004|10004|10004|10004|10004|10010|10010|10010|10010|10010|10010|10010|10010|10014|10014|10014|10014|10014|10014|10014|10014|19003|19003|19003|19003|19003|19003|19003|19003|19006|19006|19006|19006|19006|19006|19006|19006|19012|19012|19012|19012|19012|19012|19012|19012 | K56: =RC[2]&"|"&RC[3]&"|"&RC[4]&"|"&RC[5]&"|"&RC[6]&"|"&RC[7]&"|"&RC[8]&"|"&RC[9]&"|"&RC[10]&"|"&RC[11]&"|"&RC[12]&"|"&RC[13]&"|"&RC[14]&"|"&RC[15]&"|"&RC[16]&"|"&RC[17]&"|"&RC[18]&"|"&RC[19]&"|"&RC[20]&"|"&RC[21]&"|"&RC[22]&"|"&RC[23]&"|"&RC[24]&"|"&RC[25]&"|"&RC[26]&"|"&RC[27]&"|"&RC[28]&"|"&RC[29]&"|"&RC[30]&"|"&RC[31]&"|"&RC[32]&"|"&RC[33]&"|"&RC[34]&"|"&RC[35]&"|"&RC[36]&"|"&RC[37]&"|"&RC[38]&"|"&RC[39]&"|"&RC[40]&"|"&RC[41]&"|"&RC[42]&"|"&RC[43]&"|"&RC[44]&"|"&RC[45]&"|"&RC[46]&"|"&RC[47]&"|"&RC[48]&"|"&RC[49]&"|"&RC[50]&"|"&RC[51] -> 888|10|35|35|35|35|35|35|175|175|70|70|70|70|70|70|350|350|35|35|35|35|35|35|175|175|175000|175000|175000|175000|175000|175000|875000|875000|350|350|350|350|350|350|1750|1750|3500|3500|3500|3500|3500|3500|17500|17500 | L56: 19005|200#19006|1000 | M56: 888 | N56: 10 | O56: =INT(R6C*(1+0.05*RC1)) -> 35 | P56: =INT(R6C*(1+0.05*RC1)) -> 35 | Q56: =INT(R6C*(1+0.05*RC1)) -> 35 | R56: =INT(R6C*(1+0.05*RC1)) -> 35 | S56: =INT(R6C*(1+0.05*RC1)) -> 35 | T56: =INT(R6C*(1+0.05*RC1)) -> 35 | U56: =INT(R6C*(1+0.05*RC1)) -> 175 | V56: =INT(R6C*(1+0.05*RC1)) -> 175 | W56: =INT(R6C*(1+0.05*RC1)) -> 70 | X56: =INT(R6C*(1+0.05*RC1)) -> 70 | Y56: =INT(R6C*(1+0.05*RC1)) -> 70 | Z56: =INT(R6C*(1+0.05*RC1)) -> 70 | AA56: =INT(R6C*(1+0.05*RC1)) -> 70 | AB56: =INT(R6C*(1+0.05*RC1)) -> 70 | AC56: =INT(R6C*(1+0.05*RC1)) -> 350 | AD56: =INT(R6C*(1+0.05*RC1)) -> 350 | AE56: =INT(R6C*(1+0.05*RC1)) -> 35 | AF56: =INT(R6C*(1+0.05*RC1)) -> 35 | AG56: =INT(R6C*(1+0.05*RC1)) -> 35 | AH56: =INT(R6C*(1+0.05*RC1)) -> 35 | AI56: =INT(R6C*(1+0.05*RC1)) -> 35 | AJ56: =INT(R6C*(1+0.05*RC1)) -> 35 | AK56: =INT(R6C*(1+0.05*RC1)) -> 175 | AL56: =INT(R6C*(1+0.05*RC1)) -> 175 | AM56: =INT(R6C*(1+0.05*RC1)) -> 175000 | AN56: =INT(R6C*(1+0.05*RC1)) -> 175000 | AO56: =INT(R6C*(1+0.05*RC1)) -> 175000 | AP56: =INT(R6C*(1+0.05*RC1)) -> 175000 | AQ56: =INT(R6C*(1+0.05*RC1)) -> 175000 | AR56: =INT(R6C*(1+0.05*RC1)) -> 175000 | AS56: =INT(R6C*(1+0.05*RC1)) -> 875000 | AT56: =INT(R6C*(1+0.05*RC1)) -> 875000 | AU56: =INT(R6C*(1+0.05*RC1)) -> 350 | AV56: =INT(R6C*(1+0.05*RC1)) -> 350 | AW56: =INT(R6C*(1+0.05*RC1)) -> 350 | AX56: =INT(R6C*(1+0.05*RC1)) -> 350 | AY56: =INT(R6C*(1+0.05*RC1)) -> 350 | AZ56: =INT(R6C*(1+0.05*RC1)) -> 350 | BA56: =INT(R6C*(1+0.05*RC1)) -> 1750 | BB56: =INT(R6C*(1+0.05*RC1)) -> 1750 | BC56: =INT(R6C*(1+0.05*RC1)) -> 3500 | BD56: =INT(R6C*(1+0.05*RC1)) -> 3500 | BE56: =INT(R6C*(1+0.05*RC1)) -> 3500 | BF56: =INT(R6C*(1+0.05*RC1)) -> 3500 | BG56: =INT(R6C*(1+0.05*RC1)) -> 3500 | BH56: =INT(R6C*(1+0.05*RC1)) -> 3500 | BI56: =INT(R6C*(1+0.05*RC1)) -> 17500 | BJ56: =INT(R6C*(1+0.05*RC1)) -> 17500

Sheet: 军团建筑
A1: id|id | B1: name| | C1: need_guild_level|need_guild_level | D1: is_show|
A2: 不可空 | B2: 不可空 | C2: 不可空 | D2: 不可空
A3: 数字 | B3: 字符串 | C3: 数字 | D3: 数字
A6: 建筑ID | B6: 操作名称 | C6: 需要的工会等级 | D6: 是否显示
A7: 1 | B7: 奇迹之泉 | C7: 1 | D7: 1
A8: 2 | B8: 公会大厅 | C8: 1 | D8: 1
A9: 3 | B9: 军团副本 | C9: 2 | D9: 1
A10: 4 | B10: 公会商店 | C10: 1 | D10: 1
A11: 5 | B11: 训练所 | C11: 3 | D11: 1
A12: 6 | B12: 工会战 | C12: 4 | D12: 1

Sheet: 精灵秘境
A2: 不可空 | B2: 不可空 | C2: 不可空 | D2: 不可空 | E2: 不可空 | F2: 不可空 | G2: 不可空 | H2: 不可空 | I2: 不可空
A3: 数字 | B3: 一维数组 | C3: 字符串 | D3: 数字 | E3: 数字 | F3: 数字 | G3: 数字 | H3: 二维数组 | I3: 一维数组
B4: 不定长 | H4: 不定长 | I4: 不定长
A6: 秘境id | B6: 出现日期 | C6: 秘境名称 | D6: 显示精灵 | E6: 显示场景 | F6: 场景偏移 | G6: 秘境等级 | H6: 秘境奖励 | I6: 奖励预览
A7: 1 | B7: 1|3|5 | C7: 希望秘境 | D7: 50001 | E7: 4000 | F7: 0 | G7: 1 | H7: 1|1011#3|1012#10|1013 | I7: 10030|10031|19020|10022
A8: 1 | B8: 1|3|5 | C8: 希望秘境 | D8: 50001 | E8: 4000 | F8: 0 | G8: 2 | H8: 1|1021#3|1022#10|1023 | I8: 10030|10031|19020|10022
A9: 1 | B9: 1|3|5 | C9: 希望秘境 | D9: 50001 | E9: 4000 | F9: 0 | G9: 3 | H9: 1|1031#3|1032#10|1033 | I9: 10030|10031|19020|10022
A10: 1 | B10: 1|3|5 | C10: 希望秘境 | D10: 50001 | E10: 4000 | F10: 0 | G10: 4 | H10: 1|1041#3|1042#10|1043 | I10: 10030|10031|19020|10022
A11: 1 | B11: 1|3|5 | C11: 希望秘境 | D11: 50001 | E11: 4000 | F11: 0 | G11: 5 | H11: 1|1051#3|1052#10|1053 | I11: 10030|10031|19020|10022
A12: 1 | B12: 1|3|5 | C12: 希望秘境 | D12: 50001 | E12: 4000 | F12: 0 | G12: 6 | H12: 1|1061#3|1062#10|1063 | I12: 10030|10031|19020|10022
A13: 1 | B13: 1|3|5 | C13: 希望秘境 | D13: 50001 | E13: 4000 | F13: 0 | G13: 7 | H13: 1|1071#3|1072#10|1073 | I13: 10030|10031|19020|10022
A14: 1 | B14: 1|3|5 | C14: 希望秘境 | D14: 50001 | E14: 4000 | F14: 0 | G14: 8 | H14: 1|1081#3|1082#10|1083 | I14: 10030|10031|19020|10022
A15: 1 | B15: 1|3|5 | C15: 希望秘境 | D15: 50001 | E15: 4000 | F15: 0 | G15: 9 | H15: 1|1091#3|1092#10|1093 | I15: 10030|10031|19020|10022
A16: 1 | B16: 1|3|5 | C16: 希望秘境 | D16: 50001 | E16: 4000 | F16: 0 | G16: 10 | H16: 1|1101#3|1102#10|1103 | I16: 10030|10031|19020|10022
A17: 2 | B17: 2|4|6 | C17: 冰川秘境 | D17: 50012 | E17: 1800 | F17: 0 | G17: 1 | H17: 1|2011#3|2012#10|2013 | I17: 10032|10033|19020|10022
A18: 2 | B18: 2|4|6 | C18: 冰川秘境 | D18: 50012 | E18: 1800 | F18: 0 | G18: 2 | H18: 1|2021#3|2022#10|2023 | I18: 10032|10033|19020|10022
A19: 2 | B19: 2|4|6 | C19: 冰川秘境 | D19: 50012 | E19: 1800 | F19: 0 | G19: 3 | H19: 1|2031#3|2032#10|2033 | I19: 10032|10033|19020|10022
A20: 2 | B20: 2|4|6 | C20: 冰川秘境 | D20: 50012 | E20: 1800 | F20: 0 | G20: 4 | H20: 1|2041#3|2042#10|2043 | I20: 10032|10033|19020|10022
A21: 2 | B21: 2|4|6 | C21: 冰川秘境 | D21: 50012 | E21: 1800 | F21: 0 | G21: 5 | H21: 1|2051#3|2052#10|2053 | I21: 10032|10033|19020|10022
A22: 2 | B22: 2|4|6 | C22: 冰川秘境 | D22: 50012 | E22: 1800 | F22: 0 | G22: 6 | H22: 1|2061#3|2062#10|2063 | I22: 10032|10033|19020|10022
A23: 2 | B23: 2|4|6 | C23: 冰川秘境 | D23: 50012 | E23: 1800 | F23: 0 | G23: 7 | H23: 1|2071#3|2072#10|2073 | I23: 10032|10033|19020|10022
A24: 2 | B24: 2|4|6 | C24: 冰川秘境 | D24: 50012 | E24: 1800 | F24: 0 | G24: 8 | H24: 1|2081#3|2082#10|2083 | I24: 10032|10033|19020|10022
A25: 2 | B25: 2|4|6 | C25: 冰川秘境 | D25: 50012 | E25: 1800 | F25: 0 | G25: 9 | H25: 1|2091#3|2092#10|2093 | I25: 10032|10033|19020|10022
A26: 2 | B26: 2|4|6 | C26: 冰川秘境 | D26: 50012 | E26: 1800 | F26: 0 | G26: 10 | H26: 1|2101#3|2102#10|2103 | I26: 10032|10033|19020|10022
A27: 3 | B27: 7 | C27: 炼狱秘境 | D27: 50011 | E27: 1500 | F27: 0 | G27: 1 | H27: 1|3011#3|3012#10|3013 | I27: 10030|10031|10032|10033|19020|10022
A28: 3 | B28: 7 | C28: 炼狱秘境 | D28: 50011 | E28: 1500 | F28: 0 | G28: 2 | H28: 1|3021#3|3022#10|3023 | I28: 10030|10031|10032|10033|19020|10022
A29: 3 | B29: 7 | C29: 炼狱秘境 | D29: 50011 | E29: 1500 | F29: 0 | G29: 3 | H29: 1|3031#3|3032#10|3033 | I29: 10030|10031|10032|10033|19020|10022
A30: 3 | B30: 7 | C30: 炼狱秘境 | D30: 50011 | E30: 1500 | F30: 0 | G30: 4 | H30: 1|3041#3|3042#10|3043 | I30: 10030|10031|10032|10033|19020|10022
A31: 3 | B31: 7 | C31: 炼狱秘境 | D31: 50011 | E31: 1500 | F31: 0 | G31: 5 | H31: 1|3051#3|3052#10|3053 | I31: 10030|10031|10032|10033|19020|10022
A32: 3 | B32: 7 | C32: 炼狱秘境 | D32: 50011 | E32: 1500 | F32: 0 | G32: 6 | H32: 1|3061#3|3062#10|3063 | I32: 10030|10031|10032|10033|19020|10022
A33: 3 | B33: 7 | C33: 炼狱秘境 | D33: 50011 | E33: 1500 | F33: 0 | G33: 7 | H33: 1|3071#3|3072#10|3073 | I33: 10030|10031|10032|10033|19020|10022
A34: 3 | B34: 7 | C34: 炼狱秘境 | D34: 50011 | E34: 1500 | F34: 0 | G34: 8 | H34: 1|3081#3|3082#10|3083 | I34: 10030|10031|10032|10033|19020|10022
A35: 3 | B35: 7 | C35: 炼狱秘境 | D35: 50011 | E35: 1500 | F35: 0 | G35: 9 | H35: 1|3091#3|3092#10|3093 | I35: 10030|10031|10032|10033|19020|10022
A36: 3 | B36: 7 | C36: 炼狱秘境 | D36: 50011 | E36: 1500 | F36: 0 | G36: 10 | H36: 1|3101#3|3102#10|3103 | I36: 10030|10031|10032|10033|19020|10022

Sheet: 秘境升级
A2: 不可空 | B2: 不可空 | C2: 可空#不需字段 | D2: 不可空
A3: 数字 | B3: 数字 | C3: 二维数组 | D3: 数字
C4: 不定长
A6: 秘境等级 | B6: 升级经验 | C6: 探索提供经验 | D6: 需要军团等级
A7: 1 | B7: 100 | C7: 1|5#3|2#10|1 | D7: 1
A8: 2 | B8: 200 | C8: 1|5#3|2#10|1 | D8: 2
A9: 3 | B9: 300 | C9: 1|5#3|2#10|1 | D9: 3
A10: 4 | B10: 400 | C10: 1|5#3|2#10|1 | D10: 4
A11: 5 | B11: 500 | C11: 1|5#3|2#10|1 | D11: 5
A12: 6 | B12: 600 | C12: 1|5#3|2#10|1 | D12: 6
A13: 7 | B13: 700 | C13: 1|5#3|2#10|1 | D13: 7
A14: 8 | B14: 800 | C14: 1|5#3|2#10|1 | D14: 8
A15: 9 | B15: 900 | C15: 1|5#3|2#10|1 | D15: 9
A16: 10 | B16: 0 | D16: 10

Sheet: 秘境奖励
A2: 不可空 | B2: 不可空 | C2: 不可空
A3: 数字 | B3: 一维数组 | C3: 一维数组
B4: 不定长 | C4: 不定长
A6: 奖励id | B6: 奖励内容 | C6: 奖励数量
A7: 1011 | B7: 10030|10031|19020|10022 | C7: 5|5|500|5
A8: 1021 | B8: 10030|10031|19020|10022 | C8: 5|5|600|5
A9: 1031 | B9: 10030|10031|19020|10022 | C9: 10|10|600|5
A10: 1041 | B10: 10030|10031|19020|10022 | C10: 10|10|700|5
A11: 1051 | B11: 10030|10031|19020|10022 | C11: 10|10|800|5
A12: 1061 | B12: 10030|10031|19020|10022 | C12: 15|15|800|5
A13: 1071 | B13: 10030|10031|19020|10022 | C13: 15|15|900|5
A14: 1081 | B14: 10030|10031|19020|10022 | C14: 15|15|900|7
A15: 1091 | B15: 10030|10031|19020|10022 | C15: 15|15|1000|7
A16: 1101 | B16: 10030|10031|19020|10022 | C16: 20|20|1000|7
A17: 1012 | B17: 19020|10022 | C17: 100|1
A18: 1022 | B18: 19020|10022 | C18: 150|1
A19: 1032 | B19: 19020|10022 | C19: 200|1
A20: 1042 | B20: 19020|10022 | C20: 250|1
A21: 1052 | B21: 19020|10022 | C21: 300|2
A22: 1062 | B22: 19020|10022 | C22: 350|2
A23: 1072 | B23: 19020|10022 | C23: 400|2
A24: 1082 | B24: 19020|10022 | C24: 450|2
A25: 1092 | B25: 19020|10022 | C25: 500|2
A26: 1102 | B26: 19020 | C26: 50
A27: 1013 | B27: 19020 | C27: 50
A28: 1023 | B28: 19020 | C28: 50
A29: 1033 | B29: 19020 | C29: 50
A30: 1043 | B30: 19020 | C30: 50
A31: 1053 | B31: 19020 | C31: 50
A32: 1063 | B32: 19020 | C32: 50
A33: 1073 | B33: 19020 | C33: 50
A34: 1083 | B34: 19020 | C34: 50
A35: 1093 | B35: 19020 | C35: 50
A36: 1103 | B36: 19020 | C36: 50
A37: 2011 | B37: 10032|10033|19020|10022 | C37: 5|5|500|5
A38: 2021 | B38: 10032|10033|19020|10022 | C38: 5|5|600|5
A39: 2031 | B39: 10032|10033|19020|10022 | C39: 10|10|600|5
A40: 2041 | B40: 10032|10033|19020|10022 | C40: 10|10|700|5
A41: 2051 | B41: 10032|10033|19020|10022 | C41: 10|10|800|5
A42: 2061 | B42: 10032|10033|19020|10022 | C42: 15|15|800|5
A43: 2071 | B43: 10032|10033|19020|10022 | C43: 15|15|900|5
A44: 2081 | B44: 10032|10033|19020|10022 | C44: 15|15|900|7
A45: 2091 | B45: 10032|10033|19020|10022 | C45: 15|15|1000|7
A46: 2101 | B46: 10032|10033|19020|10022 | C46: 20|20|1000|7
A47: 2012 | B47: 19020|10022 | C47: 100|1
A48: 2022 | B48: 19020|10022 | C48: 150|1
A49: 2032 | B49: 19020|10022 | C49: 200|1
A50: 2042 | B50: 19020|10022 | C50: 250|1
A51: 2052 | B51: 19020|10022 | C51: 300|2
A52: 2062 | B52: 19020|10022 | C52: 350|2
A53: 2072 | B53: 19020|10022 | C53: 400|2
A54: 2082 | B54: 19020|10022 | C54: 450|2
A55: 2092 | B55: 19020|10022 | C55: 500|2
A56: 2102 | B56: 19020 | C56: 50
A57: 2013 | B57: 19020 | C57: 50
A58: 2023 | B58: 19020 | C58: 50
A59: 2033 | B59: 19020 | C59: 50
A60: 2043 | B60: 19020 | C60: 50
A61: 2053 | B61: 19020 | C61: 50
A62: 2063 | B62: 19020 | C62: 50
A63: 2073 | B63: 19020 | C63: 50
A64: 2083 | B64: 19020 | C64: 50
A65: 2093 | B65: 19020 | C65: 50
A66: 2103 | B66: 19020 | C66: 50
A67: 3011 | B67: 10030|10031|10032|10033|19020|10022 | C67: 5|5|5|5|500|5
A68: 3021 | B68: 10030|10031|10032|10033|19020|10022 | C68: 5|5|5|5|600|5
A69: 3031 | B69: 10030|10031|10032|10033|19020|10022 | C69: 10|10|10|10|600|5
A70: 3041 | B70: 10030|10031|10032|10033|19020|10022 | C70: 10|10|10|10|700|5
A71: 3051 | B71: 10030|10031|10032|10033|19020|10022 | C71: 10|10|10|10|800|5
A72: 3061 | B72: 10030|10031|10032|10033|19020|10022 | C72: 15|15|15|15|800|5
A73: 3071 | B73: 10030|10031|10032|10033|19020|10022 | C73: 15|15|15|15|900|5
A74: 3081 | B74: 10030|10031|10032|10033|19020|10022 | C74: 15|15|15|15|900|7
A75: 3091 | B75: 10030|10031|10032|10033|19020|10022 | C75: 15|15|15|15|1000|7
A76: 3101 | B76: 10030|10031|10032|10033|19020|10022 | C76: 20|20|20|20|1000|7
A77: 3012 | B77: 19020|10022 | C77: 100|1
A78: 3022 | B78: 19020|10022 | C78: 150|1
A79: 3032 | B79: 19020|10022 | C79: 200|1
A80: 3042 | B80: 19020|10022 | C80: 250|1
A81: 3052 | B81: 19020|10022 | C81: 300|2
A82: 3062 | B82: 19020|10022 | C82: 350|2
A83: 3072 | B83: 19020|10022 | C83: 400|2
A84: 3082 | B84: 19020|10022 | C84: 450|2
A85: 3092 | B85: 19020|10022 | C85: 500|2
A86: 3102 | B86: 19020 | C86: 50
A87: 3013 | B87: 19020 | C87: 50
A88: 3023 | B88: 19020 | C88: 50
A89: 3033 | B89: 19020 | C89: 50
A90: 3043 | B90: 19020 | C90: 50
A91: 3053 | B91: 19020 | C91: 50
A92: 3063 | B92: 19020 | C92: 50
A93: 3073 | B93: 19020 | C93: 50
A94: 3083 | B94: 19020 | C94: 50
A95: 3093 | B95: 19020 | C95: 50
A96: 3103 | B96: 19020 | C96: 50

Sheet: 累计探索
A2: 不可空 | B2: 不可空 | C2: 不可空
A3: 数字 | B3: 一维数组 | C3: 一维数组
B4: 不定长 | C4: 不定长
A6: 周累计天数 | B6: 累计奖励 | C6: 奖励数量
A7: 1 | B7: 10030|10031|19020|10022 | C7: 20|20|1000|7
A8: 3 | B8: 10030|10031|19020|10022 | C8: 20|20|1000|7
A9: 7 | B9: 10030|10031|19020|10022 | C9: 20|20|1000|7