Sheet: 配置
A1: 服务端文件名 | B1: 服务端对应工作表号 | C1: 客户端文件名 | D1: 客户端对应工作表号 | E1: erl头部 | F1: erl内容格式 | G1: erl尾部 | H1: 客户端特殊处理
A2: config_guild_item_shop.txt | B2: 1 | C2: config_guild_item_shop.cnf|GuildItemShop | D2: 1 | F2: get(id) -> #$ | H2: 2=>goods_id
A3: config_guild_award_shop.txt | B3: 2 | C3: config_guild_award_shop.cnf|GuildAwardShop | D3: 2 | F3: get(id) -> #$ | H3: 2=>goods_id
A4: config_guild_limit_shop.txt | B4: 3 | C4: config_guild_limit_shop.cnf|GuildLimitShop | D4: 3 | F4: get(id) -> #$ | H4: 2=>goods_id
A5: config_guild_limit_shop_slot.txt | B5: 4 | F5: get(slot) -> #$

Sheet: 道具商品
A1: goods_id|goods_id | B1: item_id|entity_id | C1: item_num|entity_num | D1: need_role_level|need_role_level | E1: need_guild_level|need_guild_level | F1: cost_type_list|cost_type_list | G1: cost_value_list|cost_value_list | H1: buy_num_max|buy_num_max | I1: buy_type|
A2: 不可空 | B2: 不可空 | C2: 不可空 | D2: 不可空 | E2: 不可空 | F2: 可空#不需字段 | G2: 可空#不需字段 | H2: 不可空 | I2: 不可空
A3: 数字 | B3: 数字 | C3: 数字 | D3: 数字 | E3: 数字 | F3: 一维数组 | G3: 一维数组 | H3: 数字 | I3: 数字
F4: 不定长 | G4: 不定长
A6: ID | B6: 物品ID | C6: 商品实体数量 | D6: 需要的角色等级 | E6: 需要的工会等级 | F6: 消耗类型列表 | G6: 消耗值列表 | H6: 购买数量上限(0=表示无上限) | I6: 购买限制类型 | J6: 备注 | K6: 折扣
A7: 1 | B7: 15022 | C7: 1 | D7: 1 | E7: 1 | F7: 20 | G7: 800 | H7: 10 | I7: 0 | J7: 大地之子碎片*1 | K7: 全价
A8: 2 | B8: 12408 | C8: 1 | D8: 1 | E8: 1 | F8: 20 | G8: 400 | H8: 10 | I8: 0 | J8: 铁人碎片*1 | K8: 全价
A9: 3 | B9: 12410 | C9: 1 | D9: 1 | E9: 1 | F9: 20 | G9: 400 | H9: 10 | I9: 0 | J9: 超凡博士碎片*1 | K9: 全价
A10: 4 | B10: 12438 | C10: 1 | D10: 1 | E10: 1 | F10: 20 | G10: 400 | H10: 10 | I10: 0 | J10: 宙斯碎片*1 | K10: 全价
A11: 5 | B11: 12440 | C11: 1 | D11: 1 | E11: 1 | F11: 20 | G11: 400 | H11: 10 | I11: 0 | J11: 阿努比斯碎片*1 | K11: 全价
A12: 6 | B12: 12468 | C12: 1 | D12: 1 | E12: 1 | F12: 20 | G12: 400 | H12: 10 | I12: 0 | J12: 小黑碎片*1 | K12: 全价
A13: 7 | B13: 12470 | C13: 1 | D13: 1 | E13: 1 | F13: 20 | G13: 400 | H13: 10 | I13: 0 | J13: 血色指挥官碎片*1 | K13: 全价
A14: 8 | B14: 10022 | C14: 5 | D14: 1 | E14: 1 | F14: 20 | G14: 2500 | H14: 5 | I14: 0 | J14: 精灵精华*5 | K14: 全价
A15: 9 | B15: 19003 | C15: 100000 | D15: 1 | E15: 1 | F15: 20 | G15: 500 | H15: 3 | I15: 0 | J15: 金币*100000 | K15: 5折
A16: 10 | B16: 10003 | C16: 50 | D16: 1 | E16: 2 | F16: 20 | G16: 1200 | H16: 3 | I16: 0 | J16: 培养丹*50 | K16: 8折
A17: 11 | B17: 19012 | C17: 500 | D17: 1 | E17: 2 | F17: 20 | G17: 450 | H17: 3 | I17: 0 | J17: 威名*500 | K17: 9折
A18: 12 | B18: 10004 | C18: 20 | D18: 35 | E18: 3 | F18: 20 | G18: 1500 | H18: 3 | I18: 0 | J18: 潜能药剂*20 | K18: 5折
A19: 13 | B19: 19017 | C19: 100 | D19: 45 | E19: 4 | F19: 20 | G19: 900 | H19: 3 | I19: 0 | J19: 神魂*100 | K19: 9折
A20: 14 | B20: 10008 | C20: 50 | D20: 45 | E20: 4 | F20: 20 | G20: 1000 | H20: 3 | I20: 0 | J20: 觉醒水晶*50 | K20: 8折
A21: 15 | B21: 33300 | C21: 1 | D21: 1 | E21: 1 | F21: 20 | G21: 500 | H21: 10 | I21: 0 | J21: 紫品传承核心*1 | K21: 5折
A22: 16 | B22: 10002 | C22: 100 | D22: 1 | E22: 1 | F22: 20 | G22: 500 | H22: 3 | I22: 0 | J22: 进阶石*100 | K22: 5折

Sheet: 奖励商品
A1: goods_id|goods_id | C1: item_id|entity_id | D1: item_num|entity_num | E1: need_role_level|need_role_level | F1: need_guild_level|need_guild_level | G1: cost_type_list|cost_type_list | H1: cost_value_list|cost_value_list | I1: buy_num_max|buy_num_max | J1: buy_type| | K1: discount|
A2: 不可空 | C2: 不可空 | D2: 不可空 | E2: 不可空 | F2: 不可空 | G2: 可空#不需字段 | H2: 可空#不需字段 | I2: 不可空 | J2: 不可空 | K2: 不可空
A3: 数字 | C3: 数字 | D3: 数字 | E3: 数字 | F3: 数字 | G3: 一维数组 | H3: 一维数组 | I3: 数字 | J3: 数字 | K3: 数字
G4: 不定长 | H4: 不定长
A6: 商品ID | C6: 商品实体ID | D6: 商品实体数量 | E6: 需要的角色等级 | F6: 需要的工会等级 | G6: 消耗类型列表 | H6: 消耗值列表 | I6: 购买数量上限(0=表示无上限) | J6: 购买限制类型 | K6: 折扣数
A7: 1 | B7: 灵性精粹*20 | C7: 10022 | D7: 20 | E7: 1 | F7: 2 | G7: 20 | H7: =500*RC[-4]*RC[3]/10 -> 1000 | I7: 1 | J7: 1 | K7: 1
A8: 2 | B8: 荣耀护腕*1 | C8: 23303 | D8: 1 | E8: 1 | F8: 3 | G8: 20 | H8: =24000*RC[-4]*RC[3]/10 -> 2400 | I8: 1 | J8: 1 | K8: 1
A9: 3 | B9: 灵性精粹*50 | C9: 10022 | D9: 50 | E9: 1 | F9: 4 | G9: 20 | H9: =500*RC[-4]*RC[3]/10 -> 2500 | I9: 1 | J9: 1 | K9: 1
A10: 4 | B10: 金币*60W | C10: 19103 | D10: 60 | E10: 1 | F10: 5 | G10: 20 | H10: =100*RC[-4]*RC[3]/10 -> 600 | I10: 1 | J10: 1 | K10: 1
A11: 5 | B11: 威名*8000 | C11: 19012 | D11: 8000 | E11: 1 | F11: 6 | G11: 20 | H11: =1*RC[-4]*RC[3]/10 -> 800 | I11: 1 | J11: 1 | K11: 1
A12: 6 | B12: 金币*100W | C12: 19103 | D12: 100 | E12: 1 | F12: 7 | G12: 20 | H12: =100*RC[-4]*RC[3]/10 -> 1000 | I12: 1 | J12: 1 | K12: 1
A13: 7 | B13: 钻石*1000 | C13: 19005 | D13: 1000 | E13: 1 | F13: 8 | G13: 20 | H13: =10*RC[-4]*RC[3]/10 -> 1000 | I13: 1 | J13: 1 | K13: 1
A14: 8 | B14: 灵性精粹*15 | C14: 10022 | D14: 15 | E14: 1 | F14: 1 | G14: 20 | H14: 500 | I14: 1 | J14: 1 | K14: 1

Sheet: 限时商品
B1: goods_id|goods_id | D1: item_id|entity_id | E1: item_num|entity_num | F1: need_role_level|need_role_level | G1: need_guild_level|need_guild_level | H1: |refresh_rate | I1: cost_type_list|cost_type_list | J1: cost_value_list|cost_value_list | K1: buy_num_max|buy_num_max | L1: buy_type| | M1: discount|
B2: 不可空 | D2: 不可空 | E2: 不可空 | F2: 不可空 | G2: 不可空 | H2: 不可空 | I2: 可空#不需字段 | J2: 可空#不需字段 | K2: 不可空 | L2: 不可空 | M2: 不可空
B3: 数字 | D3: 数字 | E3: 数字 | F3: 数字 | G3: 数字 | H3: 数字 | I3: 一维数组 | J3: 一维数组 | K3: 数字 | L3: 数字 | M3: 数字
I4: 不定长 | J4: 不定长
B6: 商品ID | D6: 商品实体ID | E6: 商品实体数量 | F6: 需要的角色等级 | G6: 需要的工会等级 | H6: 刷出概率 | I6: 消耗类型列表 | J6: 消耗值列表 | K6: 购买数量上限(0=表示无上限) | L6: 购买限制类型 | M6: 折扣数
A7: =IF(MOD(RC[1],100)=1,RC[1],R[-1]C&"|"&RC[1]) -> 1001 | B7: 1001 | C7: =VLOOKUP(RC[1],Sheet1!C[-2]:C[-1],2,FALSE) -> 红颅鬼 | D7: 30430 | E7: 1 | F7: 1 | G7: 1 | H7: 1 | I7: 5 | J7: =ROUND(IFERROR(VLOOKUP(RC[-7],Sheet1!C[-6]:C[-5],2,FALSE),RC[4])*RC[-5]*RC[3]/10,0) -> 2160 | K7: 5 | L7: 0 | M7: 9
A8: =IF(MOD(RC[1],100)=1,RC[1],R[-1]C&"|"&RC[1]) -> 1001|1002 | B8: 1002 | C8: =VLOOKUP(RC[1],Sheet1!C[-2]:C[-1],2,FALSE) -> 终极队长 | D8: 30400 | E8: 1 | F8: 1 | G8: 1 | H8: 1 | I8: 5 | J8: =ROUND(IFERROR(VLOOKUP(RC[-7],Sheet1!C[-6]:C[-5],2,FALSE),RC[4])*RC[-5]*RC[3]/10,0) -> 2160 | K8: 5 | L8: 0 | M8: 9
A9: =IF(MOD(RC[1],100)=1,RC[1],R[-1]C&"|"&RC[1]) -> 1001|1002|1003 | B9: 1003 | C9: =VLOOKUP(RC[1],Sheet1!C[-2]:C[-1],2,FALSE) -> 雷神 | D9: 30431 | E9: 1 | F9: 1 | G9: 1 | H9: 1 | I9: 5 | J9: =ROUND(IFERROR(VLOOKUP(RC[-7],Sheet1!C[-6]:C[-5],2,FALSE),RC[4])*RC[-5]*RC[3]/10,0) -> 2160 | K9: 5 | L9: 0 | M9: 9
A10: =IF(MOD(RC[1],100)=1,RC[1],R[-1]C&"|"&RC[1]) -> 1001|1002|1003|1004 | B10: 1004 | C10: =VLOOKUP(RC[1],Sheet1!C[-2]:C[-1],2,FALSE) -> 野蛮巨人 | D10: 30410 | E10: 1 | F10: 1 | G10: 1 | H10: 1 | I10: 5 | J10: =ROUND(IFERROR(VLOOKUP(RC[-7],Sheet1!C[-6]:C[-5],2,FALSE),RC[4])*RC[-5]*RC[3]/10,0) -> 2160 | K10: 5 | L10: 0 | M10: 9
A11: =IF(MOD(RC[1],100)=1,RC[1],R[-1]C&"|"&RC[1]) -> 1001|1002|1003|1004|1005 | B11: 1005 | C11: =VLOOKUP(RC[1],Sheet1!C[-2]:C[-1],2,FALSE) -> 致命特工 | D11: 30401 | E11: 1 | F11: 1 | G11: 1 | H11: 1 | I11: 5 | J11: =ROUND(IFERROR(VLOOKUP(RC[-7],Sheet1!C[-6]:C[-5],2,FALSE),RC[4])*RC[-5]*RC[3]/10,0) -> 2160 | K11: 5 | L11: 0 | M11: 9
A12: =IF(MOD(RC[1],100)=1,RC[1],R[-1]C&"|"&RC[1]) -> 1001|1002|1003|1004|1005|1006 | B12: 1006 | C12: =VLOOKUP(RC[1],Sheet1!C[-2]:C[-1],2,FALSE) -> 鹰眸 | D12: 30420 | E12: 1 | F12: 1 | G12: 1 | H12: 1 | I12: 5 | J12: =ROUND(IFERROR(VLOOKUP(RC[-7],Sheet1!C[-6]:C[-5],2,FALSE),RC[4])*RC[-5]*RC[3]/10,0) -> 2160 | K12: 5 | L12: 0 | M12: 9
A13: =IF(MOD(RC[1],100)=1,RC[1],R[-1]C&"|"&RC[1]) -> 1001|1002|1003|1004|1005|1006|1007 | B13: 1007 | C13: =VLOOKUP(RC[1],Sheet1!C[-2]:C[-1],2,FALSE) -> 刀锋猎人 | D13: 30402 | E13: 1 | F13: 1 | G13: 1 | H13: 1 | I13: 5 | J13: =ROUND(IFERROR(VLOOKUP(RC[-7],Sheet1!C[-6]:C[-5],2,FALSE),RC[4])*RC[-5]*RC[3]/10,0) -> 2160 | K13: 5 | L13: 0 | M13: 9
A14: =IF(MOD(RC[1],100)=1,RC[1],R[-1]C&"|"&RC[1]) -> 1001|1002|1003|1004|1005|1006|1007|1008 | B14: 1008 | C14: =VLOOKUP(RC[1],Sheet1!C[-2]:C[-1],2,FALSE) -> 地狱骑士 | D14: 30403 | E14: 1 | F14: 1 | G14: 1 | H14: 1 | I14: 5 | J14: =ROUND(IFERROR(VLOOKUP(RC[-7],Sheet1!C[-6]:C[-5],2,FALSE),RC[4])*RC[-5]*RC[3]/10,0) -> 2160 | K14: 5 | L14: 0 | M14: 9
A15: =IF(MOD(RC[1],100)=1,RC[1],R[-1]C&"|"&RC[1]) -> 1001|1002|1003|1004|1005|1006|1007|1008|1009 | B15: 1009 | C15: =VLOOKUP(RC[1],Sheet1!C[-2]:C[-1],2,FALSE) -> 铁人 | D15: 30428 | E15: 1 | F15: 1 | G15: 1 | H15: 0 | I15: 5 | J15: =ROUND(IFERROR(VLOOKUP(RC[-7],Sheet1!C[-6]:C[-5],2,FALSE),RC[4])*RC[-5]*RC[3]/10,0) -> 2880 | K15: 5 | L15: 0 | M15: 9
A16: =IF(MOD(RC[1],100)=1,RC[1],R[-1]C&"|"&RC[1]) -> 1001|1002|1003|1004|1005|1006|1007|1008|1009|1010 | B16: 1010 | C16: =VLOOKUP(RC[1],Sheet1!C[-2]:C[-1],2,FALSE) -> 树人 | D16: 30411 | E16: 1 | F16: 1 | G16: 1 | H16: 1 | I16: 5 | J16: =ROUND(IFERROR(VLOOKUP(RC[-7],Sheet1!C[-6]:C[-5],2,FALSE),RC[4])*RC[-5]*RC[3]/10,0) -> 2160 | K16: 5 | L16: 0 | M16: 9
A17: =IF(MOD(RC[1],100)=1,RC[1],R[-1]C&"|"&RC[1]) -> 1001|1002|1003|1004|1005|1006|1007|1008|1009|1010|1011 | B17: 1011 | C17: =VLOOKUP(RC[1],Sheet1!C[-2]:C[-1],2,FALSE) -> 超凡博士 | D17: 30438 | E17: 1 | F17: 1 | G17: 1 | H17: 0 | I17: 5 | J17: =ROUND(IFERROR(VLOOKUP(RC[-7],Sheet1!C[-6]:C[-5],2,FALSE),RC[4])*RC[-5]*RC[3]/10,0) -> 2880 | K17: 5 | L17: 0 | M17: 9
A18: =IF(MOD(RC[1],100)=1,RC[1],R[-1]C&"|"&RC[1]) -> 1001|1002|1003|1004|1005|1006|1007|1008|1009|1010|1011|1012 | B18: 1012 | C18: =VLOOKUP(RC[1],Sheet1!C[-2]:C[-1],2,FALSE) -> 白凤凰 | D18: 30440 | E18: 1 | F18: 1 | G18: 1 | H18: 1 | I18: 5 | J18: =ROUND(IFERROR(VLOOKUP(RC[-7],Sheet1!C[-6]:C[-5],2,FALSE),RC[4])*RC[-5]*RC[3]/10,0) -> 2160 | K18: 5 | L18: 0 | M18: 9
A19: =IF(MOD(RC[1],100)=1,RC[1],R[-1]C&"|"&RC[1]) -> 1001|1002|1003|1004|1005|1006|1007|1008|1009|1010|1011|1012|1013 | B19: 1013 | C19: =VLOOKUP(RC[1],Sheet1!C[-2]:C[-1],2,FALSE) -> 地狱铁拳 | D19: 30429 | E19: 1 | F19: 1 | G19: 1 | H19: 1 | I19: 5 | J19: =ROUND(IFERROR(VLOOKUP(RC[-7],Sheet1!C[-6]:C[-5],2,FALSE),RC[4])*RC[-5]*RC[3]/10,0) -> 2880 | K19: 5 | L19: 0 | M19: 9
A20: =IF(MOD(RC[1],100)=1,RC[1],R[-1]C&"|"&RC[1]) -> 1001|1002|1003|1004|1005|1006|1007|1008|1009|1010|1011|1012|1013|1014 | B20: 1014 | C20: =VLOOKUP(RC[1],Sheet1!C[-2]:C[-1],2,FALSE) -> 混沌女巫 | D20: 30449 | E20: 1 | F20: 1 | G20: 1 | H20: 1 | I20: 5 | J20: =ROUND(IFERROR(VLOOKUP(RC[-7],Sheet1!C[-6]:C[-5],2,FALSE),RC[4])*RC[-5]*RC[3]/10,0) -> 2880 | K20: 5 | L20: 0 | M20: 9
A21: =IF(MOD(RC[1],100)=1,RC[1],R[-1]C&"|"&RC[1]) -> 1001|1002|1003|1004|1005|1006|1007|1008|1009|1010|1011|1012|1013|1014|1015 | B21: 1015 | C21: =VLOOKUP(RC[1],Sheet1!C[-2]:C[-1],2,FALSE) -> 红颅鬼碎片 | D21: 12400 | E21: 20 | F21: 1 | G21: 1 | H21: 20 | I21: 5 | J21: =ROUND(IFERROR(VLOOKUP(RC[-7],Sheet1!C[-6]:C[-5],2,FALSE),RC[4])*RC[-5]*RC[3]/10,0) -> 480 | K21: 10 | L21: 0 | M21: 8
A22: =IF(MOD(RC[1],100)=1,RC[1],R[-1]C&"|"&RC[1]) -> 1001|1002|1003|1004|1005|1006|1007|1008|1009|1010|1011|1012|1013|1014|1015|1016 | B22: 1016 | C22: =VLOOKUP(RC[1],Sheet1!C[-2]:C[-1],2,FALSE) -> 终极队长碎片 | D22: 12401 | E22: 20 | F22: 1 | G22: 1 | H22: 20 | I22: 5 | J22: =ROUND(IFERROR(VLOOKUP(RC[-7],Sheet1!C[-6]:C[-5],2,FALSE),RC[4])*RC[-5]*RC[3]/10,0) -> 480 | K22: 10 | L22: 0 | M22: 8
A23: =IF(MOD(RC[1],100)=1,RC[1],R[-1]C&"|"&RC[1]) -> 1001|1002|1003|1004|1005|1006|1007|1008|1009|1010|1011|1012|1013|1014|1015|1016|1017 | B23: 1017 | C23: =VLOOKUP(RC[1],Sheet1!C[-2]:C[-1],2,FALSE) -> 雷神碎片 | D23: 12402 | E23: 20 | F23: 1 | G23: 1 | H23: 20 | I23: 5 | J23: =ROUND(IFERROR(VLOOKUP(RC[-7],Sheet1!C[-6]:C[-5],2,FALSE),RC[4])*RC[-5]*RC[3]/10,0) -> 480 | K23: 10 | L23: 0 | M23: 8
A24: =IF(MOD(RC[1],100)=1,RC[1],R[-1]C&"|"&RC[1]) -> 1001|1002|1003|1004|1005|1006|1007|1008|1009|1010|1011|1012|1013|1014|1015|1016|1017|1018 | B24: 1018 | C24: =VLOOKUP(RC[1],Sheet1!C[-2]:C[-1],2,FALSE) -> 野蛮巨人碎片 | D24: 12403 | E24: 20 | F24: 1 | G24: 1 | H24: 20 | I24: 5 | J24: =ROUND(IFERROR(VLOOKUP(RC[-7],Sheet1!C[-6]:C[-5],2,FALSE),RC[4])*RC[-5]*RC[3]/10,0) -> 480 | K24: 10 | L24: 0 | M24: 8
A25: =IF(MOD(RC[1],100)=1,RC[1],R[-1]C&"|"&RC[1]) -> 1001|1002|1003|1004|1005|1006|1007|1008|1009|1010|1011|1012|1013|1014|1015|1016|1017|1018|1019 | B25: 1019 | C25: =VLOOKUP(RC[1],Sheet1!C[-2]:C[-1],2,FALSE) -> 致命特工碎片 | D25: 12404 | E25: 20 | F25: 1 | G25: 1 | H25: 20 | I25: 5 | J25: =ROUND(IFERROR(VLOOKUP(RC[-7],Sheet1!C[-6]:C[-5],2,FALSE),RC[4])*RC[-5]*RC[3]/10,0) -> 480 | K25: 10 | L25: 0 | M25: 8
A26: =IF(MOD(RC[1],100)=1,RC[1],R[-1]C&"|"&RC[1]) -> 1001|1002|1003|1004|1005|1006|1007|1008|1009|1010|1011|1012|1013|1014|1015|1016|1017|1018|1019|1020 | B26: 1020 | C26: =VLOOKUP(RC[1],Sheet1!C[-2]:C[-1],2,FALSE) -> 鹰眸碎片 | D26: 12405 | E26: 20 | F26: 1 | G26: 1 | H26: 20 | I26: 5 | J26: =ROUND(IFERROR(VLOOKUP(RC[-7],Sheet1!C[-6]:C[-5],2,FALSE),RC[4])*RC[-5]*RC[3]/10,0) -> 480 | K26: 10 | L26: 0 | M26: 8
A27: =IF(MOD(RC[1],100)=1,RC[1],R[-1]C&"|"&RC[1]) -> 1001|1002|1003|1004|1005|1006|1007|1008|1009|1010|1011|1012|1013|1014|1015|1016|1017|1018|1019|1020|1021 | B27: 1021 | C27: =VLOOKUP(RC[1],Sheet1!C[-2]:C[-1],2,FALSE) -> 刀锋猎人碎片 | D27: 12406 | E27: 20 | F27: 1 | G27: 1 | H27: 20 | I27: 5 | J27: =ROUND(IFERROR(VLOOKUP(RC[-7],Sheet1!C[-6]:C[-5],2,FALSE),RC[4])*RC[-5]*RC[3]/10,0) -> 480 | K27: 10 | L27: 0 | M27: 8
A28: =IF(MOD(RC[1],100)=1,RC[1],R[-1]C&"|"&RC[1]) -> 1001|1002|1003|1004|1005|1006|1007|1008|1009|1010|1011|1012|1013|1014|1015|1016|1017|1018|1019|1020|1021|1022 | B28: 1022 | C28: =VLOOKUP(RC[1],Sheet1!C[-2]:C[-1],2,FALSE) -> 地狱骑士碎片 | D28: 12407 | E28: 20 | F28: 1 | G28: 1 | H28: 20 | I28: 5 | J28: =ROUND(IFERROR(VLOOKUP(RC[-7],Sheet1!C[-6]:C[-5],2,FALSE),RC[4])*RC[-5]*RC[3]/10,0) -> 480 | K28: 10 | L28: 0 | M28: 8
A29: =IF(MOD(RC[1],100)=1,RC[1],R[-1]C&"|"&RC[1]) -> 1001|1002|1003|1004|1005|1006|1007|1008|1009|1010|1011|1012|1013|1014|1015|1016|1017|1018|1019|1020|1021|1022|1023 | B29: 1023 | C29: =VLOOKUP(RC[1],Sheet1!C[-2]:C[-1],2,FALSE) -> 铁人碎片 | D29: 12408 | E29: 20 | F29: 1 | G29: 1 | H29: 20 | I29: 5 | J29: =ROUND(IFERROR(VLOOKUP(RC[-7],Sheet1!C[-6]:C[-5],2,FALSE),RC[4])*RC[-5]*RC[3]/10,0) -> 640 | K29: 10 | L29: 0 | M29: 8
A30: =IF(MOD(RC[1],100)=1,RC[1],R[-1]C&"|"&RC[1]) -> 1001|1002|1003|1004|1005|1006|1007|1008|1009|1010|1011|1012|1013|1014|1015|1016|1017|1018|1019|1020|1021|1022|1023|1024 | B30: 1024 | C30: =VLOOKUP(RC[1],Sheet1!C[-2]:C[-1],2,FALSE) -> 树人碎片 | D30: 12409 | E30: 20 | F30: 1 | G30: 1 | H30: 20 | I30: 5 | J30: =ROUND(IFERROR(VLOOKUP(RC[-7],Sheet1!C[-6]:C[-5],2,FALSE),RC[4])*RC[-5]*RC[3]/10,0) -> 480 | K30: 10 | L30: 0 | M30: 8
A31: =IF(MOD(RC[1],100)=1,RC[1],R[-1]C&"|"&RC[1]) -> 1001|1002|1003|1004|1005|1006|1007|1008|1009|1010|1011|1012|1013|1014|1015|1016|1017|1018|1019|1020|1021|1022|1023|1024|1025 | B31: 1025 | C31: =VLOOKUP(RC[1],Sheet1!C[-2]:C[-1],2,FALSE) -> 超凡博士碎片 | D31: 12410 | E31: 20 | F31: 1 | G31: 1 | H31: 20 | I31: 5 | J31: =ROUND(IFERROR(VLOOKUP(RC[-7],Sheet1!C[-6]:C[-5],2,FALSE),RC[4])*RC[-5]*RC[3]/10,0) -> 640 | K31: 10 | L31: 0 | M31: 8
A32: =IF(MOD(RC[1],100)=1,RC[1],R[-1]C&"|"&RC[1]) -> 1001|1002|1003|1004|1005|1006|1007|1008|1009|1010|1011|1012|1013|1014|1015|1016|1017|1018|1019|1020|1021|1022|1023|1024|1025|1026 | B32: 1026 | C32: =VLOOKUP(RC[1],Sheet1!C[-2]:C[-1],2,FALSE) -> 白凤凰碎片 | D32: 12411 | E32: 20 | F32: 1 | G32: 1 | H32: 20 | I32: 5 | J32: =ROUND(IFERROR(VLOOKUP(RC[-7],Sheet1!C[-6]:C[-5],2,FALSE),RC[4])*RC[-5]*RC[3]/10,0) -> 480 | K32: 10 | L32: 0 | M32: 8
A33: =IF(MOD(RC[1],100)=1,RC[1],R[-1]C&"|"&RC[1]) -> 1001|1002|1003|1004|1005|1006|1007|1008|1009|1010|1011|1012|1013|1014|1015|1016|1017|1018|1019|1020|1021|1022|1023|1024|1025|1026|1027 | B33: 1027 | C33: =VLOOKUP(RC[1],Sheet1!C[-2]:C[-1],2,FALSE) -> 地狱铁拳碎片 | D33: 12412 | E33: 20 | F33: 1 | G33: 1 | H33: 20 | I33: 5 | J33: =ROUND(IFERROR(VLOOKUP(RC[-7],Sheet1!C[-6]:C[-5],2,FALSE),RC[4])*RC[-5]*RC[3]/10,0) -> 640 | K33: 10 | L33: 0 | M33: 8
A34: =IF(MOD(RC[1],100)=1,RC[1],R[-1]C&"|"&RC[1]) -> 1001|1002|1003|1004|1005|1006|1007|1008|1009|1010|1011|1012|1013|1014|1015|1016|1017|1018|1019|1020|1021|1022|1023|1024|1025|1026|1027|1028 | B34: 1028 | C34: =VLOOKUP(RC[1],Sheet1!C[-2]:C[-1],2,FALSE) -> 混沌女巫碎片 | D34: 12413 | E34: 20 | F34: 1 | G34: 1 | H34: 20 | I34: 5 | J34: =ROUND(IFERROR(VLOOKUP(RC[-7],Sheet1!C[-6]:C[-5],2,FALSE),RC[4])*RC[-5]*RC[3]/10,0) -> 640 | K34: 10 | L34: 0 | M34: 8
A35: =IF(MOD(RC[1],100)=1,RC[1],R[-1]C&"|"&RC[1]) -> 1001|1002|1003|1004|1005|1006|1007|1008|1009|1010|1011|1012|1013|1014|1015|1016|1017|1018|1019|1020|1021|1022|1023|1024|1025|1026|1027|1028|1029 | B35: 1029 | C35: =VLOOKUP(RC[1],Sheet1!C[-2]:C[-1],2,FALSE) -> 红颅鬼碎片 | D35: 12400 | E35: 10 | F35: 1 | G35: 1 | H35: 10 | I35: 5 | J35: =ROUND(IFERROR(VLOOKUP(RC[-7],Sheet1!C[-6]:C[-5],2,FALSE),RC[4])*RC[-5]*RC[3]/10,0) -> 240 | K35: 10 | L35: 0 | M35: 8
A36: =IF(MOD(RC[1],100)=1,RC[1],R[-1]C&"|"&RC[1]) -> 1001|1002|1003|1004|1005|1006|1007|1008|1009|1010|1011|1012|1013|1014|1015|1016|1017|1018|1019|1020|1021|1022|1023|1024|1025|1026|1027|1028|1029|1030 | B36: 1030 | C36: =VLOOKUP(RC[1],Sheet1!C[-2]:C[-1],2,FALSE) -> 终极队长碎片 | D36: 12401 | E36: 10 | F36: 1 | G36: 1 | H36: 10 | I36: 5 | J36: =ROUND(IFERROR(VLOOKUP(RC[-7],Sheet1!C[-6]:C[-5],2,FALSE),RC[4])*RC[-5]*RC[3]/10,0) -> 240 | K36: 10 | L36: 0 | M36: 8
A37: =IF(MOD(RC[1],100)=1,RC[1],R[-1]C&"|"&RC[1]) -> 1001|1002|1003|1004|1005|1006|1007|1008|1009|1010|1011|1012|1013|1014|1015|1016|1017|1018|1019|1020|1021|1022|1023|1024|1025|1026|1027|1028|1029|1030|1031 | B37: 1031 | C37: =VLOOKUP(RC[1],Sheet1!C[-2]:C[-1],2,FALSE) -> 雷神碎片 | D37: 12402 | E37: 10 | F37: 1 | G37: 1 | H37: 10 | I37: 5 | J37: =ROUND(IFERROR(VLOOKUP(RC[-7],Sheet1!C[-6]:C[-5],2,FALSE),RC[4])*RC[-5]*RC[3]/10,0) -> 240 | K37: 10 | L37: 0 | M37: 8
A38: =IF(MOD(RC[1],100)=1,RC[1],R[-1]C&"|"&RC[1]) -> 1001|1002|1003|1004|1005|1006|1007|1008|1009|1010|1011|1012|1013|1014|1015|1016|1017|1018|1019|1020|1021|1022|1023|1024|1025|1026|1027|1028|1029|1030|1031|1032 | B38: 1032 | C38: =VLOOKUP(RC[1],Sheet1!C[-2]:C[-1],2,FALSE) -> 野蛮巨人碎片 | D38: 12403 | E38: 10 | F38: 1 | G38: 1 | H38: 10 | I38: 5 | J38: =ROUND(IFERROR(VLOOKUP(RC[-7],Sheet1!C[-6]:C[-5],2,FALSE),RC[4])*RC[-5]*RC[3]/10,0) -> 240 | K38: 10 | L38: 0 | M38: 8
A39: =IF(MOD(RC[1],100)=1,RC[1],R[-1]C&"|"&RC[1]) -> 1001|1002|1003|1004|1005|1006|1007|1008|1009|1010|1011|1012|1013|1014|1015|1016|1017|1018|1019|1020|1021|1022|1023|1024|1025|1026|1027|1028|1029|1030|1031|1032|1033 | B39: 1033 | C39: =VLOOKUP(RC[1],Sheet1!C[-2]:C[-1],2,FALSE) -> 致命特工碎片 | D39: 12404 | E39: 10 | F39: 1 | G39: 1 | H39: 10 | I39: 5 | J39: =ROUND(IFERROR(VLOOKUP(RC[-7],Sheet1!C[-6]:C[-5],2,FALSE),RC[4])*RC[-5]*RC[3]/10,0) -> 240 | K39: 10 | L39: 0 | M39: 8
A40: =IF(MOD(RC[1],100)=1,RC[1],R[-1]C&"|"&RC[1]) -> 1001|1002|1003|1004|1005|1006|1007|1008|1009|1010|1011|1012|1013|1014|1015|1016|1017|1018|1019|1020|1021|1022|1023|1024|1025|1026|1027|1028|1029|1030|1031|1032|1033|1034 | B40: 1034 | C40: =VLOOKUP(RC[1],Sheet1!C[-2]:C[-1],2,FALSE) -> 鹰眸碎片 | D40: 12405 | E40: 10 | F40: 1 | G40: 1 | H40: 10 | I40: 5 | J40: =ROUND(IFERROR(VLOOKUP(RC[-7],Sheet1!C[-6]:C[-5],2,FALSE),RC[4])*RC[-5]*RC[3]/10,0) -> 240 | K40: 10 | L40: 0 | M40: 8
A41: =IF(MOD(RC[1],100)=1,RC[1],R[-1]C&"|"&RC[1]) -> 1001|1002|1003|1004|1005|1006|1007|1008|1009|1010|1011|1012|1013|1014|1015|1016|1017|1018|1019|1020|1021|1022|1023|1024|1025|1026|1027|1028|1029|1030|1031|1032|1033|1034|1035 | B41: 1035 | C41: =VLOOKUP(RC[1],Sheet1!C[-2]:C[-1],2,FALSE) -> 刀锋猎人碎片 | D41: 12406 | E41: 10 | F41: 1 | G41: 1 | H41: 10 | I41: 5 | J41: =ROUND(IFERROR(VLOOKUP(RC[-7],Sheet1!C[-6]:C[-5],2,FALSE),RC[4])*RC[-5]*RC[3]/10,0) -> 240 | K41: 10 | L41: 0 | M41: 8
A42: =IF(MOD(RC[1],100)=1,RC[1],R[-1]C&"|"&RC[1]) -> 1001|1002|1003|1004|1005|1006|1007|1008|1009|1010|1011|1012|1013|1014|1015|1016|1017|1018|1019|1020|1021|1022|1023|1024|1025|1026|1027|1028|1029|1030|1031|1032|1033|1034|1035|1036 | B42: 1036 | C42: =VLOOKUP(RC[1],Sheet1!C[-2]:C[-1],2,FALSE) -> 地狱骑士碎片 | D42: 12407 | E42: 10 | F42: 1 | G42: 1 | H42: 10 | I42: 5 | J42: =ROUND(IFERROR(VLOOKUP(RC[-7],Sheet1!C[-6]:C[-5],2,FALSE),RC[4])*RC[-5]*RC[3]/10,0) -> 240 | K42: 10 | L42: 0 | M42: 8
A43: =IF(MOD(RC[1],100)=1,RC[1],R[-1]C&"|"&RC[1]) -> 1001|1002|1003|1004|1005|1006|1007|1008|1009|1010|1011|1012|1013|1014|1015|1016|1017|1018|1019|1020|1021|1022|1023|1024|1025|1026|1027|1028|1029|1030|1031|1032|1033|1034|1035|1036|1037 | B43: 1037 | C43: =VLOOKUP(RC[1],Sheet1!C[-2]:C[-1],2,FALSE) -> 铁人碎片 | D43: 12408 | E43: 10 | F43: 1 | G43: 1 | H43: 10 | I43: 5 | J43: =ROUND(IFERROR(VLOOKUP(RC[-7],Sheet1!C[-6]:C[-5],2,FALSE),RC[4])*RC[-5]*RC[3]/10,0) -> 320 | K43: 10 | L43: 0 | M43: 8
A44: =IF(MOD(RC[1],100)=1,RC[1],R[-1]C&"|"&RC[1]) -> 1001|1002|1003|1004|1005|1006|1007|1008|1009|1010|1011|1012|1013|1014|1015|1016|1017|1018|1019|1020|1021|1022|1023|1024|1025|1026|1027|1028|1029|1030|1031|1032|1033|1034|1035|1036|1037|1038 | B44: 1038 | C44: =VLOOKUP(RC[1],Sheet1!C[-2]:C[-1],2,FALSE) -> 树人碎片 | D44: 12409 | E44: 10 | F44: 1 | G44: 1 | H44: 10 | I44: 5 | J44: =ROUND(IFERROR(VLOOKUP(RC[-7],Sheet1!C[-6]:C[-5],2,FALSE),RC[4])*RC[-5]*RC[3]/10,0) -> 240 | K44: 10 | L44: 0 | M44: 8
A45: =IF(MOD(RC[1],100)=1,RC[1],R[-1]C&"|"&RC[1]) -> 1001|1002|1003|1004|1005|1006|1007|1008|1009|1010|1011|1012|1013|1014|1015|1016|1017|1018|1019|1020|1021|1022|1023|1024|1025|1026|1027|1028|1029|1030|1031|1032|1033|1034|1035|1036|1037|1038|1039 | B45: 1039 | C45: =VLOOKUP(RC[1],Sheet1!C[-2]:C[-1],2,FALSE) -> 超凡博士碎片 | D45: 12410 | E45: 10 | F45: 1 | G45: 1 | H45: 10 | I45: 5 | J45: =ROUND(IFERROR(VLOOKUP(RC[-7],Sheet1!C[-6]:C[-5],2,FALSE),RC[4])*RC[-5]*RC[3]/10,0) -> 320 | K45: 10 | L45: 0 | M45: 8
A46: =IF(MOD(RC[1],100)=1,RC[1],R[-1]C&"|"&RC[1]) -> 1001|1002|1003|1004|1005|1006|1007|1008|1009|1010|1011|1012|1013|1014|1015|1016|1017|1018|1019|1020|1021|1022|1023|1024|1025|1026|1027|1028|1029|1030|1031|1032|1033|1034|1035|1036|1037|1038|1039|1040 | B46: 1040 | C46: =VLOOKUP(RC[1],Sheet1!C[-2]:C[-1],2,FALSE) -> 白凤凰碎片 | D46: 12411 | E46: 10 | F46: 1 | G46: 1 | H46: 10 | I46: 5 | J46: =ROUND(IFERROR(VLOOKUP(RC[-7],Sheet1!C[-6]:C[-5],2,FALSE),RC[4])*RC[-5]*RC[3]/10,0) -> 240 | K46: 10 | L46: 0 | M46: 8
A47: =IF(MOD(RC[1],100)=1,RC[1],R[-1]C&"|"&RC[1]) -> 1001|1002|1003|1004|1005|1006|1007|1008|1009|1010|1011|1012|1013|1014|1015|1016|1017|1018|1019|1020|1021|1022|1023|1024|1025|1026|1027|1028|1029|1030|1031|1032|1033|1034|1035|1036|1037|1038|1039|1040|1041 | B47: 1041 | C47: =VLOOKUP(RC[1],Sheet1!C[-2]:C[-1],2,FALSE) -> 地狱铁拳碎片 | D47: 12412 | E47: 10 | F47: 1 | G47: 1 | H47: 10 | I47: 5 | J47: =ROUND(IFERROR(VLOOKUP(RC[-7],Sheet1!C[-6]:C[-5],2,FALSE),RC[4])*RC[-5]*RC[3]/10,0) -> 320 | K47: 10 | L47: 0 | M47: 8
A48: =IF(MOD(RC[1],100)=1,RC[1],R[-1]C&"|"&RC[1]) -> 1001|1002|1003|1004|1005|1006|1007|1008|1009|1010|1011|1012|1013|1014|1015|1016|1017|1018|1019|1020|1021|1022|1023|1024|1025|1026|1027|1028|1029|1030|1031|1032|1033|1034|1035|1036|1037|1038|1039|1040|1041|1042 | B48: 1042 | C48: =VLOOKUP(RC[1],Sheet1!C[-2]:C[-1],2,FALSE) -> 混沌女巫碎片 | D48: 12413 | E48: 10 | F48: 1 | G48: 1 | H48: 10 | I48: 5 | J48: =ROUND(IFERROR(VLOOKUP(RC[-7],Sheet1!C[-6]:C[-5],2,FALSE),RC[4])*RC[-5]*RC[3]/10,0) -> 320 | K48: 10 | L48: 0 | M48: 8
A49: =IF(MOD(RC[1],100)=1,RC[1],R[-1]C&"|"&RC[1]) -> 2001 | B49: 2001 | C49: 潜能药剂 | D49: 10004 | E49: 50 | F49: 1 | G49: 1 | H49: 1 | I49: 5 | J49: =ROUND(IFERROR(VLOOKUP(RC[-7],Sheet1!C[-6]:C[-5],2,FALSE),RC[4])*RC[-5]*RC[3]/10,0) -> 375 | K49: 10 | L49: 0 | M49: 5 | N49: 15
A50: =IF(MOD(RC[1],100)=1,RC[1],R[-1]C&"|"&RC[1]) -> 2001|2002 | B50: 2002 | C50: 潜能药剂 | D50: 10004 | E50: 100 | F50: 1 | G50: 1 | H50: 1 | I50: 5 | J50: =ROUND(IFERROR(VLOOKUP(RC[-7],Sheet1!C[-6]:C[-5],2,FALSE),RC[4])*RC[-5]*RC[3]/10,0) -> 750 | K50: 10 | L50: 0 | M50: 5 | N50: 15
A51: =IF(MOD(RC[1],100)=1,RC[1],R[-1]C&"|"&RC[1]) -> 2001|2002|2003 | B51: 2003 | C51: 潜能药剂 | D51: 10004 | E51: 150 | F51: 1 | G51: 1 | H51: 1 | I51: 5 | J51: =ROUND(IFERROR(VLOOKUP(RC[-7],Sheet1!C[-6]:C[-5],2,FALSE),RC[4])*RC[-5]*RC[3]/10,0) -> 1125 | K51: 10 | L51: 0 | M51: 5 | N51: 15
A52: =IF(MOD(RC[1],100)=1,RC[1],R[-1]C&"|"&RC[1]) -> 2001|2002|2003|2004 | B52: 2004 | C52: 潜能药剂 | D52: 10004 | E52: 200 | F52: 1 | G52: 1 | H52: 1 | I52: 5 | J52: =ROUND(IFERROR(VLOOKUP(RC[-7],Sheet1!C[-6]:C[-5],2,FALSE),RC[4])*RC[-5]*RC[3]/10,0) -> 1500 | K52: 10 | L52: 0 | M52: 5 | N52: 15
A53: =IF(MOD(RC[1],100)=1,RC[1],R[-1]C&"|"&RC[1]) -> 2001|2002|2003|2004|2005 | B53: 2005 | C53: 潜能药剂 | D53: 10004 | E53: 250 | F53: 1 | G53: 1 | H53: 1 | I53: 5 | J53: =ROUND(IFERROR(VLOOKUP(RC[-7],Sheet1!C[-6]:C[-5],2,FALSE),RC[4])*RC[-5]*RC[3]/10,0) -> 1875 | K53: 10 | L53: 0 | M53: 5 | N53: 15
A54: =IF(MOD(RC[1],100)=1,RC[1],R[-1]C&"|"&RC[1]) -> 2001|2002|2003|2004|2005|2006 | B54: 2006 | C54: 潜能药剂 | D54: 10004 | E54: 300 | F54: 1 | G54: 1 | H54: 1 | I54: 5 | J54: =ROUND(IFERROR(VLOOKUP(RC[-7],Sheet1!C[-6]:C[-5],2,FALSE),RC[4])*RC[-5]*RC[3]/10,0) -> 2250 | K54: 10 | L54: 0 | M54: 5 | N54: 15
A55: =IF(MOD(RC[1],100)=1,RC[1],R[-1]C&"|"&RC[1]) -> 2001|2002|2003|2004|2005|2006|2007 | B55: 2007 | C55: 潜能药剂 | D55: 10004 | E55: 400 | F55: 1 | G55: 1 | H55: 1 | I55: 5 | J55: =ROUND(IFERROR(VLOOKUP(RC[-7],Sheet1!C[-6]:C[-5],2,FALSE),RC[4])*RC[-5]*RC[3]/10,0) -> 3000 | K55: 10 | L55: 0 | M55: 5 | N55: 15
A56: =IF(MOD(RC[1],100)=1,RC[1],R[-1]C&"|"&RC[1]) -> 2001|2002|2003|2004|2005|2006|2007|2008 | B56: 2008 | C56: 潜能药剂 | D56: 10004 | E56: 500 | F56: 1 | G56: 1 | H56: 1 | I56: 5 | J56: =ROUND(IFERROR(VLOOKUP(RC[-7],Sheet1!C[-6]:C[-5],2,FALSE),RC[4])*RC[-5]*RC[3]/10,0) -> 3750 | K56: 10 | L56: 0 | M56: 5 | N56: 15
A57: =IF(MOD(RC[1],100)=1,RC[1],R[-1]C&"|"&RC[1]) -> 2001|2002|2003|2004|2005|2006|2007|2008|2009 | B57: 2009 | C57: 进阶石 | D57: 10002 | E57: 200 | F57: 1 | G57: 1 | H57: 2 | I57: 5 | J57: =ROUND(IFERROR(VLOOKUP(RC[-7],Sheet1!C[-6]:C[-5],2,FALSE),RC[4])*RC[-5]*RC[3]/10,0) -> 160 | K57: 10 | L57: 0 | M57: 8 | N57: 1
A58: =IF(MOD(RC[1],100)=1,RC[1],R[-1]C&"|"&RC[1]) -> 2001|2002|2003|2004|2005|2006|2007|2008|2009|2010 | B58: 2010 | C58: 进阶石 | D58: 10002 | E58: 400 | F58: 1 | G58: 1 | H58: 2 | I58: 5 | J58: =ROUND(IFERROR(VLOOKUP(RC[-7],Sheet1!C[-6]:C[-5],2,FALSE),RC[4])*RC[-5]*RC[3]/10,0) -> 320 | K58: 10 | L58: 0 | M58: 8 | N58: 1
A59: =IF(MOD(RC[1],100)=1,RC[1],R[-1]C&"|"&RC[1]) -> 2001|2002|2003|2004|2005|2006|2007|2008|2009|2010|2011 | B59: 2011 | C59: 进阶石 | D59: 10002 | E59: 600 | F59: 1 | G59: 1 | H59: 2 | I59: 5 | J59: =ROUND(IFERROR(VLOOKUP(RC[-7],Sheet1!C[-6]:C[-5],2,FALSE),RC[4])*RC[-5]*RC[3]/10,0) -> 480 | K59: 10 | L59: 0 | M59: 8 | N59: 1
A60: =IF(MOD(RC[1],100)=1,RC[1],R[-1]C&"|"&RC[1]) -> 2001|2002|2003|2004|2005|2006|2007|2008|2009|2010|2011|2012 | B60: 2012 | C60: 进阶石 | D60: 10002 | E60: 800 | F60: 1 | G60: 1 | H60: 2 | I60: 5 | J60: =ROUND(IFERROR(VLOOKUP(RC[-7],Sheet1!C[-6]:C[-5],2,FALSE),RC[4])*RC[-5]*RC[3]/10,0) -> 640 | K60: 10 | L60: 0 | M60: 8 | N60: 1
A61: =IF(MOD(RC[1],100)=1,RC[1],R[-1]C&"|"&RC[1]) -> 2001|2002|2003|2004|2005|2006|2007|2008|2009|2010|2011|2012|2013 | B61: 2013 | C61: 培养石 | D61: 10003 | E61: 100 | F61: 1 | G61: 1 | H61: 2 | I61: 5 | J61: =ROUND(IFERROR(VLOOKUP(RC[-7],Sheet1!C[-6]:C[-5],2,FALSE),RC[4])*RC[-5]*RC[3]/10,0) -> 250 | K61: 10 | L61: 0 | M61: 5 | N61: 5
A62: =IF(MOD(RC[1],100)=1,RC[1],R[-1]C&"|"&RC[1]) -> 2001|2002|2003|2004|2005|2006|2007|2008|2009|2010|2011|2012|2013|2014 | B62: 2014 | C62: 培养石 | D62: 10003 | E62: 150 | F62: 1 | G62: 1 | H62: 2 | I62: 5 | J62: =ROUND(IFERROR(VLOOKUP(RC[-7],Sheet1!C[-6]:C[-5],2,FALSE),RC[4])*RC[-5]*RC[3]/10,0) -> 375 | K62: 10 | L62: 0 | M62: 5 | N62: 5
A63: =IF(MOD(RC[1],100)=1,RC[1],R[-1]C&"|"&RC[1]) -> 2001|2002|2003|2004|2005|2006|2007|2008|2009|2010|2011|2012|2013|2014|2015 | B63: 2015 | C63: 培养石 | D63: 10003 | E63: 200 | F63: 1 | G63: 1 | H63: 2 | I63: 5 | J63: =ROUND(IFERROR(VLOOKUP(RC[-7],Sheet1!C[-6]:C[-5],2,FALSE),RC[4])*RC[-5]*RC[3]/10,0) -> 500 | K63: 10 | L63: 0 | M63: 5 | N63: 5
A64: =IF(MOD(RC[1],100)=1,RC[1],R[-1]C&"|"&RC[1]) -> 2001|2002|2003|2004|2005|2006|2007|2008|2009|2010|2011|2012|2013|2014|2015|2016 | B64: 2016 | C64: 培养石 | D64: 10003 | E64: 250 | F64: 1 | G64: 1 | H64: 2 | I64: 5 | J64: =ROUND(IFERROR(VLOOKUP(RC[-7],Sheet1!C[-6]:C[-5],2,FALSE),RC[4])*RC[-5]*RC[3]/10,0) -> 625 | K64: 10 | L64: 0 | M64: 5 | N64: 5
A65: =IF(MOD(RC[1],100)=1,RC[1],R[-1]C&"|"&RC[1]) -> 2001|2002|2003|2004|2005|2006|2007|2008|2009|2010|2011|2012|2013|2014|2015|2016|2017 | B65: 2017 | C65: 培养石 | D65: 10003 | E65: 300 | F65: 1 | G65: 1 | H65: 2 | I65: 5 | J65: =ROUND(IFERROR(VLOOKUP(RC[-7],Sheet1!C[-6]:C[-5],2,FALSE),RC[4])*RC[-5]*RC[3]/10,0) -> 750 | K65: 10 | L65: 0 | M65: 5 | N65: 5
A66: =IF(MOD(RC[1],100)=1,RC[1],R[-1]C&"|"&RC[1]) -> 3001 | B66: 3001 | C66: =VLOOKUP(RC[1],Sheet1!C[-2]:C[-1],2,FALSE) -> 独眼巨人 | D66: 31400 | E66: 1 | F66: 1 | G66: 1 | H66: 1 | I66: 5 | J66: =ROUND(IFERROR(VLOOKUP(RC[-7],Sheet1!C[-6]:C[-5],2,FALSE),RC[4])*RC[-5]*RC[3]/10,0) -> 2160 | K66: 5 | L66: 0 | M66: 9
A67: =IF(MOD(RC[1],100)=1,RC[1],R[-1]C&"|"&RC[1]) -> 3001|3002 | B67: 3002 | C67: =VLOOKUP(RC[1],Sheet1!C[-2]:C[-1],2,FALSE) -> 圣女贞德 | D67: 31440 | E67: 1 | F67: 1 | G67: 1 | H67: 1 | I67: 5 | J67: =ROUND(IFERROR(VLOOKUP(RC[-7],Sheet1!C[-6]:C[-5],2,FALSE),RC[4])*RC[-5]*RC[3]/10,0) -> 2160 | K67: 5 | L67: 0 | M67: 9
A68: =IF(MOD(RC[1],100)=1,RC[1],R[-1]C&"|"&RC[1]) -> 3001|3002|3003 | B68: 3003 | C68: =VLOOKUP(RC[1],Sheet1!C[-2]:C[-1],2,FALSE) -> 美杜莎 | D68: 31430 | E68: 1 | F68: 1 | G68: 1 | H68: 1 | I68: 5 | J68: =ROUND(IFERROR(VLOOKUP(RC[-7],Sheet1!C[-6]:C[-5],2,FALSE),RC[4])*RC[-5]*RC[3]/10,0) -> 2160 | K68: 5 | L68: 0 | M68: 9
A69: =IF(MOD(RC[1],100)=1,RC[1],R[-1]C&"|"&RC[1]) -> 3001|3002|3003|3004 | B69: 3004 | C69: =VLOOKUP(RC[1],Sheet1!C[-2]:C[-1],2,FALSE) -> 德古拉伯爵 | D69: 31401 | E69: 1 | F69: 1 | G69: 1 | H69: 1 | I69: 5 | J69: =ROUND(IFERROR(VLOOKUP(RC[-7],Sheet1!C[-6]:C[-5],2,FALSE),RC[4])*RC[-5]*RC[3]/10,0) -> 2160 | K69: 5 | L69: 0 | M69: 9
A70: =IF(MOD(RC[1],100)=1,RC[1],R[-1]C&"|"&RC[1]) -> 3001|3002|3003|3004|3005 | B70: 3005 | C70: =VLOOKUP(RC[1],Sheet1!C[-2]:C[-1],2,FALSE) -> 狩猎女神 | D70: 31431 | E70: 1 | F70: 1 | G70: 1 | H70: 1 | I70: 5 | J70: =ROUND(IFERROR(VLOOKUP(RC[-7],Sheet1!C[-6]:C[-5],2,FALSE),RC[4])*RC[-5]*RC[3]/10,0) -> 2160 | K70: 5 | L70: 0 | M70: 9
A71: =IF(MOD(RC[1],100)=1,RC[1],R[-1]C&"|"&RC[1]) -> 3001|3002|3003|3004|3005|3006 | B71: 3006 | C71: =VLOOKUP(RC[1],Sheet1!C[-2]:C[-1],2,FALSE) -> 查理大帝 | D71: 31402 | E71: 1 | F71: 1 | G71: 1 | H71: 1 | I71: 5 | J71: =ROUND(IFERROR(VLOOKUP(RC[-7],Sheet1!C[-6]:C[-5],2,FALSE),RC[4])*RC[-5]*RC[3]/10,0) -> 2160 | K71: 5 | L71: 0 | M71: 9
A72: =IF(MOD(RC[1],100)=1,RC[1],R[-1]C&"|"&RC[1]) -> 3001|3002|3003|3004|3005|3006|3007 | B72: 3007 | C72: =VLOOKUP(RC[1],Sheet1!C[-2]:C[-1],2,FALSE) -> 佐罗 | D72: 31403 | E72: 1 | F72: 1 | G72: 1 | H72: 1 | I72: 5 | J72: =ROUND(IFERROR(VLOOKUP(RC[-7],Sheet1!C[-6]:C[-5],2,FALSE),RC[4])*RC[-5]*RC[3]/10,0) -> 2160 | K72: 5 | L72: 0 | M72: 9
A73: =IF(MOD(RC[1],100)=1,RC[1],R[-1]C&"|"&RC[1]) -> 3001|3002|3003|3004|3005|3006|3007|3008 | B73: 3008 | C73: =VLOOKUP(RC[1],Sheet1!C[-2]:C[-1],2,FALSE) -> 亚马逊女王 | D73: 31420 | E73: 1 | F73: 1 | G73: 1 | H73: 1 | I73: 5 | J73: =ROUND(IFERROR(VLOOKUP(RC[-7],Sheet1!C[-6]:C[-5],2,FALSE),RC[4])*RC[-5]*RC[3]/10,0) -> 2160 | K73: 5 | L73: 0 | M73: 9
A74: =IF(MOD(RC[1],100)=1,RC[1],R[-1]C&"|"&RC[1]) -> 3001|3002|3003|3004|3005|3006|3007|3008|3009 | B74: 3009 | C74: =VLOOKUP(RC[1],Sheet1!C[-2]:C[-1],2,FALSE) -> 宙斯 | D74: 31438 | E74: 1 | F74: 1 | G74: 1 | H74: 0 | I74: 5 | J74: =ROUND(IFERROR(VLOOKUP(RC[-7],Sheet1!C[-6]:C[-5],2,FALSE),RC[4])*RC[-5]*RC[3]/10,0) -> 2880 | K74: 5 | L74: 0 | M74: 9
A75: =IF(MOD(RC[1],100)=1,RC[1],R[-1]C&"|"&RC[1]) -> 3001|3002|3003|3004|3005|3006|3007|3008|3009|3010 | B75: 3010 | C75: =VLOOKUP(RC[1],Sheet1!C[-2]:C[-1],2,FALSE) -> 斯巴达 | D75: 31410 | E75: 1 | F75: 1 | G75: 1 | H75: 1 | I75: 5 | J75: =ROUND(IFERROR(VLOOKUP(RC[-7],Sheet1!C[-6]:C[-5],2,FALSE),RC[4])*RC[-5]*RC[3]/10,0) -> 2160 | K75: 5 | L75: 0 | M75: 9
A76: =IF(MOD(RC[1],100)=1,RC[1],R[-1]C&"|"&RC[1]) -> 3001|3002|3003|3004|3005|3006|3007|3008|3009|3010|3011 | B76: 3011 | C76: =VLOOKUP(RC[1],Sheet1!C[-2]:C[-1],2,FALSE) -> 阿努比斯 | D76: 31408 | E76: 1 | F76: 1 | G76: 1 | H76: 0 | I76: 5 | J76: =ROUND(IFERROR(VLOOKUP(RC[-7],Sheet1!C[-6]:C[-5],2,FALSE),RC[4])*RC[-5]*RC[3]/10,0) -> 2880 | K76: 5 | L76: 0 | M76: 9
A77: =IF(MOD(RC[1],100)=1,RC[1],R[-1]C&"|"&RC[1]) -> 3001|3002|3003|3004|3005|3006|3007|3008|3009|3010|3011|3012 | B77: 3012 | C77: =VLOOKUP(RC[1],Sheet1!C[-2]:C[-1],2,FALSE) -> 雅典娜 | D77: 31441 | E77: 1 | F77: 1 | G77: 1 | H77: 1 | I77: 5 | J77: =ROUND(IFERROR(VLOOKUP(RC[-7],Sheet1!C[-6]:C[-5],2,FALSE),RC[4])*RC[-5]*RC[3]/10,0) -> 2160 | K77: 5 | L77: 0 | M77: 9
A78: =IF(MOD(RC[1],100)=1,RC[1],R[-1]C&"|"&RC[1]) -> 3001|3002|3003|3004|3005|3006|3007|3008|3009|3010|3011|3012|3013 | B78: 3013 | C78: =VLOOKUP(RC[1],Sheet1!C[-2]:C[-1],2,FALSE) -> 大力神 | D78: 31419 | E78: 1 | F78: 1 | G78: 1 | H78: 1 | I78: 5 | J78: =ROUND(IFERROR(VLOOKUP(RC[-7],Sheet1!C[-6]:C[-5],2,FALSE),RC[4])*RC[-5]*RC[3]/10,0) -> 2880 | K78: 5 | L78: 0 | M78: 9
A79: =IF(MOD(RC[1],100)=1,RC[1],R[-1]C&"|"&RC[1]) -> 3001|3002|3003|3004|3005|3006|3007|3008|3009|3010|3011|3012|3013|3014 | B79: 3014 | C79: =VLOOKUP(RC[1],Sheet1!C[-2]:C[-1],2,FALSE) -> 冥王哈迪斯 | D79: 31439 | E79: 1 | F79: 1 | G79: 1 | H79: 1 | I79: 5 | J79: =ROUND(IFERROR(VLOOKUP(RC[-7],Sheet1!C[-6]:C[-5],2,FALSE),RC[4])*RC[-5]*RC[3]/10,0) -> 2880 | K79: 5 | L79: 0 | M79: 9
A80: =IF(MOD(RC[1],100)=1,RC[1],R[-1]C&"|"&RC[1]) -> 3001|3002|3003|3004|3005|3006|3007|3008|3009|3010|3011|3012|3013|3014|3015 | B80: 3015 | C80: =VLOOKUP(RC[1],Sheet1!C[-2]:C[-1],2,FALSE) -> 独眼巨人碎片 | D80: 12430 | E80: 20 | F80: 1 | G80: 1 | H80: 20 | I80: 5 | J80: =ROUND(IFERROR(VLOOKUP(RC[-7],Sheet1!C[-6]:C[-5],2,FALSE),RC[4])*RC[-5]*RC[3]/10,0) -> 480 | K80: 10 | L80: 0 | M80: 8
A81: =IF(MOD(RC[1],100)=1,RC[1],R[-1]C&"|"&RC[1]) -> 3001|3002|3003|3004|3005|3006|3007|3008|3009|3010|3011|3012|3013|3014|3015|3016 | B81: 3016 | C81: =VLOOKUP(RC[1],Sheet1!C[-2]:C[-1],2,FALSE) -> 圣女贞德碎片 | D81: 12431 | E81: 20 | F81: 1 | G81: 1 | H81: 20 | I81: 5 | J81: =ROUND(IFERROR(VLOOKUP(RC[-7],Sheet1!C[-6]:C[-5],2,FALSE),RC[4])*RC[-5]*RC[3]/10,0) -> 480 | K81: 10 | L81: 0 | M81: 8
A82: =IF(MOD(RC[1],100)=1,RC[1],R[-1]C&"|"&RC[1]) -> 3001|3002|3003|3004|3005|3006|3007|3008|3009|3010|3011|3012|3013|3014|3015|3016|3017 | B82: 3017 | C82: =VLOOKUP(RC[1],Sheet1!C[-2]:C[-1],2,FALSE) -> 亚马逊女王碎片 | D82: 12437 | E82: 20 | F82: 1 | G82: 1 | H82: 20 | I82: 5 | J82: =ROUND(IFERROR(VLOOKUP(RC[-7],Sheet1!C[-6]:C[-5],2,FALSE),RC[4])*RC[-5]*RC[3]/10,0) -> 480 | K82: 10 | L82: 0 | M82: 8
A83: =IF(MOD(RC[1],100)=1,RC[1],R[-1]C&"|"&RC[1]) -> 3001|3002|3003|3004|3005|3006|3007|3008|3009|3010|3011|3012|3013|3014|3015|3016|3017|3018 | B83: 3018 | C83: =VLOOKUP(RC[1],Sheet1!C[-2]:C[-1],2,FALSE) -> 美杜莎碎片 | D83: 12432 | E83: 20 | F83: 1 | G83: 1 | H83: 20 | I83: 5 | J83: =ROUND(IFERROR(VLOOKUP(RC[-7],Sheet1!C[-6]:C[-5],2,FALSE),RC[4])*RC[-5]*RC[3]/10,0) -> 480 | K83: 10 | L83: 0 | M83: 8
A84: =IF(MOD(RC[1],100)=1,RC[1],R[-1]C&"|"&RC[1]) -> 3001|3002|3003|3004|3005|3006|3007|3008|3009|3010|3011|3012|3013|3014|3015|3016|3017|3018|3019 | B84: 3019 | C84: =VLOOKUP(RC[1],Sheet1!C[-2]:C[-1],2,FALSE) -> 宙斯碎片 | D84: 12438 | E84: 20 | F84: 1 | G84: 1 | H84: 20 | I84: 5 | J84: =ROUND(IFERROR(VLOOKUP(RC[-7],Sheet1!C[-6]:C[-5],2,FALSE),RC[4])*RC[-5]*RC[3]/10,0) -> 640 | K84: 10 | L84: 0 | M84: 8
A85: =IF(MOD(RC[1],100)=1,RC[1],R[-1]C&"|"&RC[1]) -> 3001|3002|3003|3004|3005|3006|3007|3008|3009|3010|3011|3012|3013|3014|3015|3016|3017|3018|3019|3020 | B85: 3020 | C85: =VLOOKUP(RC[1],Sheet1!C[-2]:C[-1],2,FALSE) -> 德古拉伯爵碎片 | D85: 12433 | E85: 20 | F85: 1 | G85: 1 | H85: 20 | I85: 5 | J85: =ROUND(IFERROR(VLOOKUP(RC[-7],Sheet1!C[-6]:C[-5],2,FALSE),RC[4])*RC[-5]*RC[3]/10,0) -> 480 | K85: 10 | L85: 0 | M85: 8
A86: =IF(MOD(RC[1],100)=1,RC[1],R[-1]C&"|"&RC[1]) -> 3001|3002|3003|3004|3005|3006|3007|3008|3009|3010|3011|3012|3013|3014|3015|3016|3017|3018|3019|3020|3021 | B86: 3021 | C86: =VLOOKUP(RC[1],Sheet1!C[-2]:C[-1],2,FALSE) -> 斯巴达碎片 | D86: 12439 | E86: 20 | F86: 1 | G86: 1 | H86: 20 | I86: 5 | J86: =ROUND(IFERROR(VLOOKUP(RC[-7],Sheet1!C[-6]:C[-5],2,FALSE),RC[4])*RC[-5]*RC[3]/10,0) -> 480 | K86: 10 | L86: 0 | M86: 8
A87: =IF(MOD(RC[1],100)=1,RC[1],R[-1]C&"|"&RC[1]) -> 3001|3002|3003|3004|3005|3006|3007|3008|3009|3010|3011|3012|3013|3014|3015|3016|3017|3018|3019|3020|3021|3022 | B87: 3022 | C87: =VLOOKUP(RC[1],Sheet1!C[-2]:C[-1],2,FALSE) -> 狩猎女神碎片 | D87: 12434 | E87: 20 | F87: 1 | G87: 1 | H87: 20 | I87: 5 | J87: =ROUND(IFERROR(VLOOKUP(RC[-7],Sheet1!C[-6]:C[-5],2,FALSE),RC[4])*RC[-5]*RC[3]/10,0) -> 480 | K87: 10 | L87: 0 | M87: 8
A88: =IF(MOD(RC[1],100)=1,RC[1],R[-1]C&"|"&RC[1]) -> 3001|3002|3003|3004|3005|3006|3007|3008|3009|3010|3011|3012|3013|3014|3015|3016|3017|3018|3019|3020|3021|3022|3023 | B88: 3023 | C88: =VLOOKUP(RC[1],Sheet1!C[-2]:C[-1],2,FALSE) -> 大力神碎片 | D88: 12442 | E88: 20 | F88: 1 | G88: 1 | H88: 20 | I88: 5 | J88: =ROUND(IFERROR(VLOOKUP(RC[-7],Sheet1!C[-6]:C[-5],2,FALSE),RC[4])*RC[-5]*RC[3]/10,0) -> 640 | K88: 10 | L88: 0 | M88: 8
A89: =IF(MOD(RC[1],100)=1,RC[1],R[-1]C&"|"&RC[1]) -> 3001|3002|3003|3004|3005|3006|3007|3008|3009|3010|3011|3012|3013|3014|3015|3016|3017|3018|3019|3020|3021|3022|3023|3024 | B89: 3024 | C89: =VLOOKUP(RC[1],Sheet1!C[-2]:C[-1],2,FALSE) -> 查理大帝碎片 | D89: 12435 | E89: 20 | F89: 1 | G89: 1 | H89: 20 | I89: 5 | J89: =ROUND(IFERROR(VLOOKUP(RC[-7],Sheet1!C[-6]:C[-5],2,FALSE),RC[4])*RC[-5]*RC[3]/10,0) -> 480 | K89: 10 | L89: 0 | M89: 8
A90: =IF(MOD(RC[1],100)=1,RC[1],R[-1]C&"|"&RC[1]) -> 3001|3002|3003|3004|3005|3006|3007|3008|3009|3010|3011|3012|3013|3014|3015|3016|3017|3018|3019|3020|3021|3022|3023|3024|3025 | B90: 3025 | C90: =VLOOKUP(RC[1],Sheet1!C[-2]:C[-1],2,FALSE) -> 冥王哈迪斯碎片 | D90: 12443 | E90: 20 | F90: 1 | G90: 1 | H90: 20 | I90: 5 | J90: =ROUND(IFERROR(VLOOKUP(RC[-7],Sheet1!C[-6]:C[-5],2,FALSE),RC[4])*RC[-5]*RC[3]/10,0) -> 640 | K90: 10 | L90: 0 | M90: 8
A91: =IF(MOD(RC[1],100)=1,RC[1],R[-1]C&"|"&RC[1]) -> 3001|3002|3003|3004|3005|3006|3007|3008|3009|3010|3011|3012|3013|3014|3015|3016|3017|3018|3019|3020|3021|3022|3023|3024|3025|3026 | B91: 3026 | C91: =VLOOKUP(RC[1],Sheet1!C[-2]:C[-1],2,FALSE) -> 佐罗碎片 | D91: 12436 | E91: 20 | F91: 1 | G91: 1 | H91: 20 | I91: 5 | J91: =ROUND(IFERROR(VLOOKUP(RC[-7],Sheet1!C[-6]:C[-5],2,FALSE),RC[4])*RC[-5]*RC[3]/10,0) -> 480 | K91: 10 | L91: 0 | M91: 8
A92: =IF(MOD(RC[1],100)=1,RC[1],R[-1]C&"|"&RC[1]) -> 3001|3002|3003|3004|3005|3006|3007|3008|3009|3010|3011|3012|3013|3014|3015|3016|3017|3018|3019|3020|3021|3022|3023|3024|3025|3026|3027 | B92: 3027 | C92: =VLOOKUP(RC[1],Sheet1!C[-2]:C[-1],2,FALSE) -> 阿努比斯碎片 | D92: 12440 | E92: 20 | F92: 1 | G92: 1 | H92: 20 | I92: 5 | J92: =ROUND(IFERROR(VLOOKUP(RC[-7],Sheet1!C[-6]:C[-5],2,FALSE),RC[4])*RC[-5]*RC[3]/10,0) -> 640 | K92: 10 | L92: 0 | M92: 8
A93: =IF(MOD(RC[1],100)=1,RC[1],R[-1]C&"|"&RC[1]) -> 3001|3002|3003|3004|3005|3006|3007|3008|3009|3010|3011|3012|3013|3014|3015|3016|3017|3018|3019|3020|3021|3022|3023|3024|3025|3026|3027|3028 | B93: 3028 | C93: =VLOOKUP(RC[1],Sheet1!C[-2]:C[-1],2,FALSE) -> 雅典娜碎片 | D93: 12441 | E93: 20 | F93: 1 | G93: 1 | H93: 20 | I93: 5 | J93: =ROUND(IFERROR(VLOOKUP(RC[-7],Sheet1!C[-6]:C[-5],2,FALSE),RC[4])*RC[-5]*RC[3]/10,0) -> 480 | K93: 10 | L93: 0 | M93: 8
A94: =IF(MOD(RC[1],100)=1,RC[1],R[-1]C&"|"&RC[1]) -> 3001|3002|3003|3004|3005|3006|3007|3008|3009|3010|3011|3012|3013|3014|3015|3016|3017|3018|3019|3020|3021|3022|3023|3024|3025|3026|3027|3028|3029 | B94: 3029 | C94: =VLOOKUP(RC[1],Sheet1!C[-2]:C[-1],2,FALSE) -> 独眼巨人碎片 | D94: 12430 | E94: 20 | F94: 1 | G94: 1 | H94: 20 | I94: 5 | J94: =ROUND(IFERROR(VLOOKUP(RC[-7],Sheet1!C[-6]:C[-5],2,FALSE),RC[4])*RC[-5]*RC[3]/10,0) -> 480 | K94: 10 | L94: 0 | M94: 8
A95: =IF(MOD(RC[1],100)=1,RC[1],R[-1]C&"|"&RC[1]) -> 3001|3002|3003|3004|3005|3006|3007|3008|3009|3010|3011|3012|3013|3014|3015|3016|3017|3018|3019|3020|3021|3022|3023|3024|3025|3026|3027|3028|3029|3030 | B95: 3030 | C95: =VLOOKUP(RC[1],Sheet1!C[-2]:C[-1],2,FALSE) -> 圣女贞德碎片 | D95: 12431 | E95: 20 | F95: 1 | G95: 1 | H95: 20 | I95: 5 | J95: =ROUND(IFERROR(VLOOKUP(RC[-7],Sheet1!C[-6]:C[-5],2,FALSE),RC[4])*RC[-5]*RC[3]/10,0) -> 480 | K95: 10 | L95: 0 | M95: 8
A96: =IF(MOD(RC[1],100)=1,RC[1],R[-1]C&"|"&RC[1]) -> 3001|3002|3003|3004|3005|3006|3007|3008|3009|3010|3011|3012|3013|3014|3015|3016|3017|3018|3019|3020|3021|3022|3023|3024|3025|3026|3027|3028|3029|3030|3031 | B96: 3031 | C96: =VLOOKUP(RC[1],Sheet1!C[-2]:C[-1],2,FALSE) -> 亚马逊女王碎片 | D96: 12437 | E96: 10 | F96: 1 | G96: 1 | H96: 10 | I96: 5 | J96: =ROUND(IFERROR(VLOOKUP(RC[-7],Sheet1!C[-6]:C[-5],2,FALSE),RC[4])*RC[-5]*RC[3]/10,0) -> 240 | K96: 10 | L96: 0 | M96: 8
A97: =IF(MOD(RC[1],100)=1,RC[1],R[-1]C&"|"&RC[1]) -> 3001|3002|3003|3004|3005|3006|3007|3008|3009|3010|3011|3012|3013|3014|3015|3016|3017|3018|3019|3020|3021|3022|3023|3024|3025|3026|3027|3028|3029|3030|3031|3032 | B97: 3032 | C97: =VLOOKUP(RC[1],Sheet1!C[-2]:C[-1],2,FALSE) -> 美杜莎碎片 | D97: 12432 | E97: 10 | F97: 1 | G97: 1 | H97: 10 | I97: 5 | J97: =ROUND(IFERROR(VLOOKUP(RC[-7],Sheet1!C[-6]:C[-5],2,FALSE),RC[4])*RC[-5]*RC[3]/10,0) -> 240 | K97: 10 | L97: 0 | M97: 8
A98: =IF(MOD(RC[1],100)=1,RC[1],R[-1]C&"|"&RC[1]) -> 3001|3002|3003|3004|3005|3006|3007|3008|3009|3010|3011|3012|3013|3014|3015|3016|3017|3018|3019|3020|3021|3022|3023|3024|3025|3026|3027|3028|3029|3030|3031|3032|3033 | B98: 3033 | C98: =VLOOKUP(RC[1],Sheet1!C[-2]:C[-1],2,FALSE) -> 宙斯碎片 | D98: 12438 | E98: 10 | F98: 1 | G98: 1 | H98: 10 | I98: 5 | J98: =ROUND(IFERROR(VLOOKUP(RC[-7],Sheet1!C[-6]:C[-5],2,FALSE),RC[4])*RC[-5]*RC[3]/10,0) -> 320 | K98: 10 | L98: 0 | M98: 8
A99: =IF(MOD(RC[1],100)=1,RC[1],R[-1]C&"|"&RC[1]) -> 3001|3002|3003|3004|3005|3006|3007|3008|3009|3010|3011|3012|3013|3014|3015|3016|3017|3018|3019|3020|3021|3022|3023|3024|3025|3026|3027|3028|3029|3030|3031|3032|3033|3034 | B99: 3034 | C99: =VLOOKUP(RC[1],Sheet1!C[-2]:C[-1],2,FALSE) -> 德古拉伯爵碎片 | D99: 12433 | E99: 10 | F99: 1 | G99: 1 | H99: 10 | I99: 5 | J99: =ROUND(IFERROR(VLOOKUP(RC[-7],Sheet1!C[-6]:C[-5],2,FALSE),RC[4])*RC[-5]*RC[3]/10,0) -> 240 | K99: 10 | L99: 0 | M99: 8
A100: =IF(MOD(RC[1],100)=1,RC[1],R[-1]C&"|"&RC[1]) -> 3001|3002|3003|3004|3005|3006|3007|3008|3009|3010|3011|3012|3013|3014|3015|3016|3017|3018|3019|3020|3021|3022|3023|3024|3025|3026|3027|3028|3029|3030|3031|3032|3033|3034|3035 | B100: 3035 | C100: =VLOOKUP(RC[1],Sheet1!C[-2]:C[-1],2,FALSE) -> 斯巴达碎片 | D100: 12439 | E100: 10 | F100: 1 | G100: 1 | H100: 10 | I100: 5 | J100: =ROUND(IFERROR(VLOOKUP(RC[-7],Sheet1!C[-6]:C[-5],2,FALSE),RC[4])*RC[-5]*RC[3]/10,0) -> 240 | K100: 10 | L100: 0 | M100: 8
A101: =IF(MOD(RC[1],100)=1,RC[1],R[-1]C&"|"&RC[1]) -> 3001|3002|3003|3004|3005|3006|3007|3008|3009|3010|3011|3012|3013|3014|3015|3016|3017|3018|3019|3020|3021|3022|3023|3024|3025|3026|3027|3028|3029|3030|3031|3032|3033|3034|3035|3036 | B101: 3036 | C101: =VLOOKUP(RC[1],Sheet1!C[-2]:C[-1],2,FALSE) -> 狩猎女神碎片 | D101: 12434 | E101: 10 | F101: 1 | G101: 1 | H101: 10 | I101: 5 | J101: =ROUND(IFERROR(VLOOKUP(RC[-7],Sheet1!C[-6]:C[-5],2,FALSE),RC[4])*RC[-5]*RC[3]/10,0) -> 240 | K101: 10 | L101: 0 | M101: 8
A102: =IF(MOD(RC[1],100)=1,RC[1],R[-1]C&"|"&RC[1]) -> 3001|3002|3003|3004|3005|3006|3007|3008|3009|3010|3011|3012|3013|3014|3015|3016|3017|3018|3019|3020|3021|3022|3023|3024|3025|3026|3027|3028|3029|3030|3031|3032|3033|3034|3035|3036|3037 | B102: 3037 | C102: =VLOOKUP(RC[1],Sheet1!C[-2]:C[-1],2,FALSE) -> 大力神碎片 | D102: 12442 | E102: 10 | F102: 1 | G102: 1 | H102: 10 | I102: 5 | J102: =ROUND(IFERROR(VLOOKUP(RC[-7],Sheet1!C[-6]:C[-5],2,FALSE),RC[4])*RC[-5]*RC[3]/10,0) -> 320 | K102: 10 | L102: 0 | M102: 8
A103: =IF(MOD(RC[1],100)=1,RC[1],R[-1]C&"|"&RC[1]) -> 3001|3002|3003|3004|3005|3006|3007|3008|3009|3010|3011|3012|3013|3014|3015|3016|3017|3018|3019|3020|3021|3022|3023|3024|3025|3026|3027|3028|3029|3030|3031|3032|3033|3034|3035|3036|3037|3038 | B103: 3038 | C103: =VLOOKUP(RC[1],Sheet1!C[-2]:C[-1],2,FALSE) -> 查理大帝碎片 | D103: 12435 | E103: 10 | F103: 1 | G103: 1 | H103: 10 | I103: 5 | J103: =ROUND(IFERROR(VLOOKUP(RC[-7],Sheet1!C[-6]:C[-5],2,FALSE),RC[4])*RC[-5]*RC[3]/10,0) -> 240 | K103: 10 | L103: 0 | M103: 8
A104: =IF(MOD(RC[1],100)=1,RC[1],R[-1]C&"|"&RC[1]) -> 3001|3002|3003|3004|3005|3006|3007|3008|3009|3010|3011|3012|3013|3014|3015|3016|3017|3018|3019|3020|3021|3022|3023|3024|3025|3026|3027|3028|3029|3030|3031|3032|3033|3034|3035|3036|3037|3038|3039 | B104: 3039 | C104: =VLOOKUP(RC[1],Sheet1!C[-2]:C[-1],2,FALSE) -> 冥王哈迪斯碎片 | D104: 12443 | E104: 10 | F104: 1 | G104: 1 | H104: 10 | I104: 5 | J104: =ROUND(IFERROR(VLOOKUP(RC[-7],Sheet1!C[-6]:C[-5],2,FALSE),RC[4])*RC[-5]*RC[3]/10,0) -> 320 | K104: 10 | L104: 0 | M104: 8
A105: =IF(MOD(RC[1],100)=1,RC[1],R[-1]C&"|"&RC[1]) -> 3001|3002|3003|3004|3005|3006|3007|3008|3009|3010|3011|3012|3013|3014|3015|3016|3017|3018|3019|3020|3021|3022|3023|3024|3025|3026|3027|3028|3029|3030|3031|3032|3033|3034|3035|3036|3037|3038|3039|3040 | B105: 3040 | C105: =VLOOKUP(RC[1],Sheet1!C[-2]:C[-1],2,FALSE) -> 佐罗碎片 | D105: 12436 | E105: 10 | F105: 1 | G105: 1 | H105: 10 | I105: 5 | J105: =ROUND(IFERROR(VLOOKUP(RC[-7],Sheet1!C[-6]:C[-5],2,FALSE),RC[4])*RC[-5]*RC[3]/10,0) -> 240 | K105: 10 | L105: 0 | M105: 8
A106: =IF(MOD(RC[1],100)=1,RC[1],R[-1]C&"|"&RC[1]) -> 3001|3002|3003|3004|3005|3006|3007|3008|3009|3010|3011|3012|3013|3014|3015|3016|3017|3018|3019|3020|3021|3022|3023|3024|3025|3026|3027|3028|3029|3030|3031|3032|3033|3034|3035|3036|3037|3038|3039|3040|3041 | B106: 3041 | C106: =VLOOKUP(RC[1],Sheet1!C[-2]:C[-1],2,FALSE) -> 阿努比斯碎片 | D106: 12440 | E106: 10 | F106: 1 | G106: 1 | H106: 10 | I106: 5 | J106: =ROUND(IFERROR(VLOOKUP(RC[-7],Sheet1!C[-6]:C[-5],2,FALSE),RC[4])*RC[-5]*RC[3]/10,0) -> 320 | K106: 10 | L106: 0 | M106: 8
A107: =IF(MOD(RC[1],100)=1,RC[1],R[-1]C&"|"&RC[1]) -> 3001|3002|3003|3004|3005|3006|3007|3008|3009|3010|3011|3012|3013|3014|3015|3016|3017|3018|3019|3020|3021|3022|3023|3024|3025|3026|3027|3028|3029|3030|3031|3032|3033|3034|3035|3036|3037|3038|3039|3040|3041|3042 | B107: 3042 | C107: =VLOOKUP(RC[1],Sheet1!C[-2]:C[-1],2,FALSE) -> 雅典娜碎片 | D107: 12441 | E107: 10 | F107: 1 | G107: 1 | H107: 10 | I107: 5 | J107: =ROUND(IFERROR(VLOOKUP(RC[-7],Sheet1!C[-6]:C[-5],2,FALSE),RC[4])*RC[-5]*RC[3]/10,0) -> 240 | K107: 10 | L107: 0 | M107: 8
A108: =IF(MOD(RC[1],100)=1,RC[1],R[-1]C&"|"&RC[1]) -> 4001 | B108: 4001 | C108: 魂晶 | D108: 19006 | E108: 500 | F108: 1 | G108: 1 | H108: 1 | I108: 5 | J108: =ROUND(IFERROR(VLOOKUP(RC[-7],Sheet1!C[-6]:C[-5],2,FALSE),RC[4])*RC[-5]*RC[3]/10,0) -> 400 | K108: 10 | L108: 0 | M108: 8 | N108: 1
A109: =IF(MOD(RC[1],100)=1,RC[1],R[-1]C&"|"&RC[1]) -> 4001|4002 | B109: 4002 | C109: 魂晶 | D109: 19006 | E109: 600 | F109: 1 | G109: 1 | H109: 1 | I109: 5 | J109: =ROUND(IFERROR(VLOOKUP(RC[-7],Sheet1!C[-6]:C[-5],2,FALSE),RC[4])*RC[-5]*RC[3]/10,0) -> 480 | K109: 10 | L109: 0 | M109: 8 | N109: 1
A110: =IF(MOD(RC[1],100)=1,RC[1],R[-1]C&"|"&RC[1]) -> 4001|4002|4003 | B110: 4003 | C110: 魂晶 | D110: 19006 | E110: 800 | F110: 1 | G110: 1 | H110: 1 | I110: 5 | J110: =ROUND(IFERROR(VLOOKUP(RC[-7],Sheet1!C[-6]:C[-5],2,FALSE),RC[4])*RC[-5]*RC[3]/10,0) -> 640 | K110: 10 | L110: 0 | M110: 8 | N110: 1
A111: =IF(MOD(RC[1],100)=1,RC[1],R[-1]C&"|"&RC[1]) -> 4001|4002|4003|4004 | B111: 4004 | C111: 威名 | D111: 19012 | E111: 2000 | F111: 1 | G111: 1 | H111: 1 | I111: 5 | J111: =ROUND(IFERROR(VLOOKUP(RC[-7],Sheet1!C[-6]:C[-5],2,FALSE),RC[4])*RC[-5]*RC[3]/10,0) -> 160 | K111: 10 | L111: 0 | M111: 8 | N111: 0.1
A112: =IF(MOD(RC[1],100)=1,RC[1],R[-1]C&"|"&RC[1]) -> 4001|4002|4003|4004|4005 | B112: 4005 | C112: 威名 | D112: 19012 | E112: 3000 | F112: 1 | G112: 1 | H112: 1 | I112: 5 | J112: =ROUND(IFERROR(VLOOKUP(RC[-7],Sheet1!C[-6]:C[-5],2,FALSE),RC[4])*RC[-5]*RC[3]/10,0) -> 240 | K112: 10 | L112: 0 | M112: 8 | N112: 0.1
A113: =IF(MOD(RC[1],100)=1,RC[1],R[-1]C&"|"&RC[1]) -> 4001|4002|4003|4004|4005|4006 | B113: 4006 | C113: 威名 | D113: 19012 | E113: 4000 | F113: 1 | G113: 1 | H113: 1 | I113: 5 | J113: =ROUND(IFERROR(VLOOKUP(RC[-7],Sheet1!C[-6]:C[-5],2,FALSE),RC[4])*RC[-5]*RC[3]/10,0) -> 320 | K113: 10 | L113: 0 | M113: 8 | N113: 0.1
A114: =IF(MOD(RC[1],100)=1,RC[1],R[-1]C&"|"&RC[1]) -> 4001|4002|4003|4004|4005|4006|4007 | B114: 4007 | C114: 声望 | D114: 19013 | E114: 2000 | F114: 1 | G114: 1 | H114: 1 | I114: 5 | J114: =ROUND(IFERROR(VLOOKUP(RC[-7],Sheet1!C[-6]:C[-5],2,FALSE),RC[4])*RC[-5]*RC[3]/10,0) -> 160 | K114: 10 | L114: 0 | M114: 8 | N114: 0.1
A115: =IF(MOD(RC[1],100)=1,RC[1],R[-1]C&"|"&RC[1]) -> 4001|4002|4003|4004|4005|4006|4007|4008 | B115: 4008 | C115: 声望 | D115: 19013 | E115: 3000 | F115: 1 | G115: 1 | H115: 1 | I115: 5 | J115: =ROUND(IFERROR(VLOOKUP(RC[-7],Sheet1!C[-6]:C[-5],2,FALSE),RC[4])*RC[-5]*RC[3]/10,0) -> 240 | K115: 10 | L115: 0 | M115: 8 | N115: 0.1
A116: =IF(MOD(RC[1],100)=1,RC[1],R[-1]C&"|"&RC[1]) -> 4001|4002|4003|4004|4005|4006|4007|4008|4009 | B116: 4009 | C116: 声望 | D116: 19013 | E116: 4000 | F116: 1 | G116: 1 | H116: 1 | I116: 5 | J116: =ROUND(IFERROR(VLOOKUP(RC[-7],Sheet1!C[-6]:C[-5],2,FALSE),RC[4])*RC[-5]*RC[3]/10,0) -> 320 | K116: 10 | L116: 0 | M116: 8 | N116: 0.1
A117: =IF(MOD(RC[1],100)=1,RC[1],R[-1]C&"|"&RC[1]) -> 4001|4002|4003|4004|4005|4006|4007|4008|4009|4010 | B117: 4010 | C117: 战功 | D117: 19014 | E117: 2000 | F117: 1 | G117: 1 | H117: 1 | I117: 5 | J117: =ROUND(IFERROR(VLOOKUP(RC[-7],Sheet1!C[-6]:C[-5],2,FALSE),RC[4])*RC[-5]*RC[3]/10,0) -> 160 | K117: 10 | L117: 0 | M117: 8 | N117: 0.1
A118: =IF(MOD(RC[1],100)=1,RC[1],R[-1]C&"|"&RC[1]) -> 4001|4002|4003|4004|4005|4006|4007|4008|4009|4010|4011 | B118: 4011 | C118: 战功 | D118: 19014 | E118: 3000 | F118: 1 | G118: 1 | H118: 1 | I118: 5 | J118: =ROUND(IFERROR(VLOOKUP(RC[-7],Sheet1!C[-6]:C[-5],2,FALSE),RC[4])*RC[-5]*RC[3]/10,0) -> 240 | K118: 10 | L118: 0 | M118: 8 | N118: 0.1
A119: =IF(MOD(RC[1],100)=1,RC[1],R[-1]C&"|"&RC[1]) -> 4001|4002|4003|4004|4005|4006|4007|4008|4009|4010|4011|4012 | B119: 4012 | C119: 战功 | D119: 19014 | E119: 4000 | F119: 1 | G119: 1 | H119: 1 | I119: 5 | J119: =ROUND(IFERROR(VLOOKUP(RC[-7],Sheet1!C[-6]:C[-5],2,FALSE),RC[4])*RC[-5]*RC[3]/10,0) -> 320 | K119: 10 | L119: 0 | M119: 8 | N119: 0.1
A120: =IF(MOD(RC[1],100)=1,RC[1],R[-1]C&"|"&RC[1]) -> 4001|4002|4003|4004|4005|4006|4007|4008|4009|4010|4011|4012|4013 | B120: 4013 | C120: 军团贡献 | D120: 19020 | E120: 2000 | F120: 1 | G120: 1 | H120: 1 | I120: 5 | J120: =ROUND(IFERROR(VLOOKUP(RC[-7],Sheet1!C[-6]:C[-5],2,FALSE),RC[4])*RC[-5]*RC[3]/10,0) -> 160 | K120: 10 | L120: 0 | M120: 8 | N120: 0.1
A121: =IF(MOD(RC[1],100)=1,RC[1],R[-1]C&"|"&RC[1]) -> 4001|4002|4003|4004|4005|4006|4007|4008|4009|4010|4011|4012|4013|4014 | B121: 4014 | C121: 军团贡献 | D121: 19020 | E121: 3000 | F121: 1 | G121: 1 | H121: 1 | I121: 5 | J121: =ROUND(IFERROR(VLOOKUP(RC[-7],Sheet1!C[-6]:C[-5],2,FALSE),RC[4])*RC[-5]*RC[3]/10,0) -> 240 | K121: 10 | L121: 0 | M121: 8 | N121: 0.1
A122: =IF(MOD(RC[1],100)=1,RC[1],R[-1]C&"|"&RC[1]) -> 4001|4002|4003|4004|4005|4006|4007|4008|4009|4010|4011|4012|4013|4014|4015 | B122: 4015 | C122: 军团贡献 | D122: 19020 | E122: 4000 | F122: 1 | G122: 1 | H122: 1 | I122: 5 | J122: =ROUND(IFERROR(VLOOKUP(RC[-7],Sheet1!C[-6]:C[-5],2,FALSE),RC[4])*RC[-5]*RC[3]/10,0) -> 320 | K122: 10 | L122: 0 | M122: 8 | N122: 0.1
A123: =IF(MOD(RC[1],100)=1,RC[1],R[-1]C&"|"&RC[1]) -> 4001|4002|4003|4004|4005|4006|4007|4008|4009|4010|4011|4012|4013|4014|4015|4016 | B123: 4016 | C123: 无尽石 | D123: 19028 | E123: 300 | F123: 1 | G123: 1 | H123: 1 | I123: 5 | J123: =ROUND(IFERROR(VLOOKUP(RC[-7],Sheet1!C[-6]:C[-5],2,FALSE),RC[4])*RC[-5]*RC[3]/10,0) -> 240 | K123: 10 | L123: 0 | M123: 8 | N123: 1
A124: =IF(MOD(RC[1],100)=1,RC[1],R[-1]C&"|"&RC[1]) -> 4001|4002|4003|4004|4005|4006|4007|4008|4009|4010|4011|4012|4013|4014|4015|4016|4017 | B124: 4017 | C124: 无尽石 | D124: 19028 | E124: 400 | F124: 1 | G124: 1 | H124: 1 | I124: 5 | J124: =ROUND(IFERROR(VLOOKUP(RC[-7],Sheet1!C[-6]:C[-5],2,FALSE),RC[4])*RC[-5]*RC[3]/10,0) -> 320 | K124: 10 | L124: 0 | M124: 8 | N124: 1
A125: =IF(MOD(RC[1],100)=1,RC[1],R[-1]C&"|"&RC[1]) -> 4001|4002|4003|4004|4005|4006|4007|4008|4009|4010|4011|4012|4013|4014|4015|4016|4017|4018 | B125: 4018 | C125: 无尽石 | D125: 19028 | E125: 500 | F125: 1 | G125: 1 | H125: 1 | I125: 5 | J125: =ROUND(IFERROR(VLOOKUP(RC[-7],Sheet1!C[-6]:C[-5],2,FALSE),RC[4])*RC[-5]*RC[3]/10,0) -> 400 | K125: 10 | L125: 0 | M125: 8 | N125: 1
A126: =IF(MOD(RC[1],100)=1,RC[1],R[-1]C&"|"&RC[1]) -> 4001|4002|4003|4004|4005|4006|4007|4008|4009|4010|4011|4012|4013|4014|4015|4016|4017|4018|4019 | B126: 4019 | C126: 讨伐令 | D126: 10015 | E126: 10 | F126: 1 | G126: 1 | H126: 1 | I126: 5 | J126: =ROUND(IFERROR(VLOOKUP(RC[-7],Sheet1!C[-6]:C[-5],2,FALSE),RC[4])*RC[-5]*RC[3]/10,0) -> 160 | K126: 10 | L126: 0 | M126: 8 | N126: 20
A127: =IF(MOD(RC[1],100)=1,RC[1],R[-1]C&"|"&RC[1]) -> 4001|4002|4003|4004|4005|4006|4007|4008|4009|4010|4011|4012|4013|4014|4015|4016|4017|4018|4019|4020 | B127: 4020 | C127: 讨伐令 | D127: 10015 | E127: 15 | F127: 1 | G127: 1 | H127: 1 | I127: 5 | J127: =ROUND(IFERROR(VLOOKUP(RC[-7],Sheet1!C[-6]:C[-5],2,FALSE),RC[4])*RC[-5]*RC[3]/10,0) -> 240 | K127: 10 | L127: 0 | M127: 8 | N127: 20
A128: =IF(MOD(RC[1],100)=1,RC[1],R[-1]C&"|"&RC[1]) -> 4001|4002|4003|4004|4005|4006|4007|4008|4009|4010|4011|4012|4013|4014|4015|4016|4017|4018|4019|4020|4021 | B128: 4021 | C128: 讨伐令 | D128: 10015 | E128: 20 | F128: 1 | G128: 1 | H128: 1 | I128: 5 | J128: =ROUND(IFERROR(VLOOKUP(RC[-7],Sheet1!C[-6]:C[-5],2,FALSE),RC[4])*RC[-5]*RC[3]/10,0) -> 320 | K128: 10 | L128: 0 | M128: 8 | N128: 20
A129: =IF(MOD(RC[1],100)=1,RC[1],R[-1]C&"|"&RC[1]) -> 5001 | B129: 5001 | C129: =VLOOKUP(RC[1],Sheet1!C[-2]:C[-1],2,FALSE) -> 憎恶 | D129: 32410 | E129: 1 | F129: 1 | G129: 1 | H129: 1 | I129: 5 | J129: =ROUND(IFERROR(VLOOKUP(RC[-7],Sheet1!C[-6]:C[-5],2,FALSE),RC[4])*RC[-5]*RC[3]/10,0) -> 2160 | K129: 5 | L129: 0 | M129: 9
A130: =IF(MOD(RC[1],100)=1,RC[1],R[-1]C&"|"&RC[1]) -> 5001|5002 | B130: 5002 | C130: =VLOOKUP(RC[1],Sheet1!C[-2]:C[-1],2,FALSE) -> 树精 | D130: 32411 | E130: 1 | F130: 1 | G130: 1 | H130: 1 | I130: 5 | J130: =ROUND(IFERROR(VLOOKUP(RC[-7],Sheet1!C[-6]:C[-5],2,FALSE),RC[4])*RC[-5]*RC[3]/10,0) -> 2160 | K130: 5 | L130: 0 | M130: 9
A131: =IF(MOD(RC[1],100)=1,RC[1],R[-1]C&"|"&RC[1]) -> 5001|5002|5003 | B131: 5003 | C131: =VLOOKUP(RC[1],Sheet1!C[-2]:C[-1],2,FALSE) -> 牛头人 | D131: 32400 | E131: 1 | F131: 1 | G131: 1 | H131: 1 | I131: 5 | J131: =ROUND(IFERROR(VLOOKUP(RC[-7],Sheet1!C[-6]:C[-5],2,FALSE),RC[4])*RC[-5]*RC[3]/10,0) -> 2160 | K131: 5 | L131: 0 | M131: 9
A132: =IF(MOD(RC[1],100)=1,RC[1],R[-1]C&"|"&RC[1]) -> 5001|5002|5003|5004 | B132: 5004 | C132: =VLOOKUP(RC[1],Sheet1!C[-2]:C[-1],2,FALSE) -> 火女 | D132: 32430 | E132: 1 | F132: 1 | G132: 1 | H132: 1 | I132: 5 | J132: =ROUND(IFERROR(VLOOKUP(RC[-7],Sheet1!C[-6]:C[-5],2,FALSE),RC[4])*RC[-5]*RC[3]/10,0) -> 2160 | K132: 5 | L132: 0 | M132: 9
A133: =IF(MOD(RC[1],100)=1,RC[1],R[-1]C&"|"&RC[1]) -> 5001|5002|5003|5004|5005 | B133: 5005 | C133: =VLOOKUP(RC[1],Sheet1!C[-2]:C[-1],2,FALSE) -> 半人马 | D133: 32401 | E133: 1 | F133: 1 | G133: 1 | H133: 1 | I133: 5 | J133: =ROUND(IFERROR(VLOOKUP(RC[-7],Sheet1!C[-6]:C[-5],2,FALSE),RC[4])*RC[-5]*RC[3]/10,0) -> 2160 | K133: 5 | L133: 0 | M133: 9
A134: =IF(MOD(RC[1],100)=1,RC[1],R[-1]C&"|"&RC[1]) -> 5001|5002|5003|5004|5005|5006 | B134: 5006 | C134: =VLOOKUP(RC[1],Sheet1!C[-2]:C[-1],2,FALSE) -> 食人魔 | D134: 32431 | E134: 1 | F134: 1 | G134: 1 | H134: 1 | I134: 5 | J134: =ROUND(IFERROR(VLOOKUP(RC[-7],Sheet1!C[-6]:C[-5],2,FALSE),RC[4])*RC[-5]*RC[3]/10,0) -> 2160 | K134: 5 | L134: 0 | M134: 9
A135: =IF(MOD(RC[1],100)=1,RC[1],R[-1]C&"|"&RC[1]) -> 5001|5002|5003|5004|5005|5006|5007 | B135: 5007 | C135: =VLOOKUP(RC[1],Sheet1!C[-2]:C[-1],2,FALSE) -> 基伦 | D135: 32402 | E135: 1 | F135: 1 | G135: 1 | H135: 1 | I135: 5 | J135: =ROUND(IFERROR(VLOOKUP(RC[-7],Sheet1!C[-6]:C[-5],2,FALSE),RC[4])*RC[-5]*RC[3]/10,0) -> 2160 | K135: 5 | L135: 0 | M135: 9
A136: =IF(MOD(RC[1],100)=1,RC[1],R[-1]C&"|"&RC[1]) -> 5001|5002|5003|5004|5005|5006|5007|5008 | B136: 5008 | C136: =VLOOKUP(RC[1],Sheet1!C[-2]:C[-1],2,FALSE) -> 女警 | D136: 32420 | E136: 1 | F136: 1 | G136: 1 | H136: 1 | I136: 5 | J136: =ROUND(IFERROR(VLOOKUP(RC[-7],Sheet1!C[-6]:C[-5],2,FALSE),RC[4])*RC[-5]*RC[3]/10,0) -> 2160 | K136: 5 | L136: 0 | M136: 9
A137: =IF(MOD(RC[1],100)=1,RC[1],R[-1]C&"|"&RC[1]) -> 5001|5002|5003|5004|5005|5006|5007|5008|5009 | B137: 5009 | C137: =VLOOKUP(RC[1],Sheet1!C[-2]:C[-1],2,FALSE) -> 小黑 | D137: 32428 | E137: 1 | F137: 1 | G137: 1 | H137: 0 | I137: 5 | J137: =ROUND(IFERROR(VLOOKUP(RC[-7],Sheet1!C[-6]:C[-5],2,FALSE),RC[4])*RC[-5]*RC[3]/10,0) -> 2880 | K137: 5 | L137: 0 | M137: 9
A138: =IF(MOD(RC[1],100)=1,RC[1],R[-1]C&"|"&RC[1]) -> 5001|5002|5003|5004|5005|5006|5007|5008|5009|5010 | B138: 5010 | C138: =VLOOKUP(RC[1],Sheet1!C[-2]:C[-1],2,FALSE) -> 熊阿宝 | D138: 32412 | E138: 1 | F138: 1 | G138: 1 | H138: 1 | I138: 5 | J138: =ROUND(IFERROR(VLOOKUP(RC[-7],Sheet1!C[-6]:C[-5],2,FALSE),RC[4])*RC[-5]*RC[3]/10,0) -> 2160 | K138: 5 | L138: 0 | M138: 9
A139: =IF(MOD(RC[1],100)=1,RC[1],R[-1]C&"|"&RC[1]) -> 5001|5002|5003|5004|5005|5006|5007|5008|5009|5010|5011 | B139: 5011 | C139: =VLOOKUP(RC[1],Sheet1!C[-2]:C[-1],2,FALSE) -> 血色指挥官 | D139: 32408 | E139: 1 | F139: 1 | G139: 1 | H139: 0 | I139: 5 | J139: =ROUND(IFERROR(VLOOKUP(RC[-7],Sheet1!C[-6]:C[-5],2,FALSE),RC[4])*RC[-5]*RC[3]/10,0) -> 2880 | K139: 5 | L139: 0 | M139: 9
A140: =IF(MOD(RC[1],100)=1,RC[1],R[-1]C&"|"&RC[1]) -> 5001|5002|5003|5004|5005|5006|5007|5008|5009|5010|5011|5012 | B140: 5012 | C140: =VLOOKUP(RC[1],Sheet1!C[-2]:C[-1],2,FALSE) -> 大检察官 | D140: 32440 | E140: 1 | F140: 1 | G140: 1 | H140: 1 | I140: 5 | J140: =ROUND(IFERROR(VLOOKUP(RC[-7],Sheet1!C[-6]:C[-5],2,FALSE),RC[4])*RC[-5]*RC[3]/10,0) -> 2160 | K140: 5 | L140: 0 | M140: 9
A141: =IF(MOD(RC[1],100)=1,RC[1],R[-1]C&"|"&RC[1]) -> 5001|5002|5003|5004|5005|5006|5007|5008|5009|5010|5011|5012|5013 | B141: 5013 | C141: =VLOOKUP(RC[1],Sheet1!C[-2]:C[-1],2,FALSE) -> 恶魔猎手 | D141: 32409 | E141: 1 | F141: 1 | G141: 1 | H141: 1 | I141: 5 | J141: =ROUND(IFERROR(VLOOKUP(RC[-7],Sheet1!C[-6]:C[-5],2,FALSE),RC[4])*RC[-5]*RC[3]/10,0) -> 2880 | K141: 5 | L141: 0 | M141: 9
A142: =IF(MOD(RC[1],100)=1,RC[1],R[-1]C&"|"&RC[1]) -> 5001|5002|5003|5004|5005|5006|5007|5008|5009|5010|5011|5012|5013|5014 | B142: 5014 | C142: =VLOOKUP(RC[1],Sheet1!C[-2]:C[-1],2,FALSE) -> 神圣牧师 | D142: 32449 | E142: 1 | F142: 1 | G142: 1 | H142: 1 | I142: 5 | J142: =ROUND(IFERROR(VLOOKUP(RC[-7],Sheet1!C[-6]:C[-5],2,FALSE),RC[4])*RC[-5]*RC[3]/10,0) -> 2880 | K142: 5 | L142: 0 | M142: 9
A143: =IF(MOD(RC[1],100)=1,RC[1],R[-1]C&"|"&RC[1]) -> 5001|5002|5003|5004|5005|5006|5007|5008|5009|5010|5011|5012|5013|5014|5015 | B143: 5015 | C143: =VLOOKUP(RC[1],Sheet1!C[-2]:C[-1],2,FALSE) -> 憎恶碎片 | D143: 12460 | E143: 20 | F143: 1 | G143: 1 | H143: 20 | I143: 5 | J143: =ROUND(IFERROR(VLOOKUP(RC[-7],Sheet1!C[-6]:C[-5],2,FALSE),RC[4])*RC[-5]*RC[3]/10,0) -> 480 | K143: 10 | L143: 0 | M143: 8
A144: =IF(MOD(RC[1],100)=1,RC[1],R[-1]C&"|"&RC[1]) -> 5001|5002|5003|5004|5005|5006|5007|5008|5009|5010|5011|5012|5013|5014|5015|5016 | B144: 5016 | C144: =VLOOKUP(RC[1],Sheet1!C[-2]:C[-1],2,FALSE) -> 树精碎片 | D144: 12461 | E144: 20 | F144: 1 | G144: 1 | H144: 20 | I144: 5 | J144: =ROUND(IFERROR(VLOOKUP(RC[-7],Sheet1!C[-6]:C[-5],2,FALSE),RC[4])*RC[-5]*RC[3]/10,0) -> 480 | K144: 10 | L144: 0 | M144: 8
A145: =IF(MOD(RC[1],100)=1,RC[1],R[-1]C&"|"&RC[1]) -> 5001|5002|5003|5004|5005|5006|5007|5008|5009|5010|5011|5012|5013|5014|5015|5016|5017 | B145: 5017 | C145: =VLOOKUP(RC[1],Sheet1!C[-2]:C[-1],2,FALSE) -> 女警碎片 | D145: 12467 | E145: 20 | F145: 1 | G145: 1 | H145: 20 | I145: 5 | J145: =ROUND(IFERROR(VLOOKUP(RC[-7],Sheet1!C[-6]:C[-5],2,FALSE),RC[4])*RC[-5]*RC[3]/10,0) -> 480 | K145: 10 | L145: 0 | M145: 8
A146: =IF(MOD(RC[1],100)=1,RC[1],R[-1]C&"|"&RC[1]) -> 5001|5002|5003|5004|5005|5006|5007|5008|5009|5010|5011|5012|5013|5014|5015|5016|5017|5018 | B146: 5018 | C146: =VLOOKUP(RC[1],Sheet1!C[-2]:C[-1],2,FALSE) -> 牛头人碎片 | D146: 12462 | E146: 20 | F146: 1 | G146: 1 | H146: 20 | I146: 5 | J146: =ROUND(IFERROR(VLOOKUP(RC[-7],Sheet1!C[-6]:C[-5],2,FALSE),RC[4])*RC[-5]*RC[3]/10,0) -> 480 | K146: 10 | L146: 0 | M146: 8
A147: =IF(MOD(RC[1],100)=1,RC[1],R[-1]C&"|"&RC[1]) -> 5001|5002|5003|5004|5005|5006|5007|5008|5009|5010|5011|5012|5013|5014|5015|5016|5017|5018|5019 | B147: 5019 | C147: =VLOOKUP(RC[1],Sheet1!C[-2]:C[-1],2,FALSE) -> 小黑碎片 | D147: 12468 | E147: 20 | F147: 1 | G147: 1 | H147: 20 | I147: 5 | J147: =ROUND(IFERROR(VLOOKUP(RC[-7],Sheet1!C[-6]:C[-5],2,FALSE),RC[4])*RC[-5]*RC[3]/10,0) -> 640 | K147: 10 | L147: 0 | M147: 8
A148: =IF(MOD(RC[1],100)=1,RC[1],R[-1]C&"|"&RC[1]) -> 5001|5002|5003|5004|5005|5006|5007|5008|5009|5010|5011|5012|5013|5014|5015|5016|5017|5018|5019|5020 | B148: 5020 | C148: =VLOOKUP(RC[1],Sheet1!C[-2]:C[-1],2,FALSE) -> 火女碎片 | D148: 12463 | E148: 20 | F148: 1 | G148: 1 | H148: 20 | I148: 5 | J148: =ROUND(IFERROR(VLOOKUP(RC[-7],Sheet1!C[-6]:C[-5],2,FALSE),RC[4])*RC[-5]*RC[3]/10,0) -> 480 | K148: 10 | L148: 0 | M148: 8
A149: =IF(MOD(RC[1],100)=1,RC[1],R[-1]C&"|"&RC[1]) -> 5001|5002|5003|5004|5005|5006|5007|5008|5009|5010|5011|5012|5013|5014|5015|5016|5017|5018|5019|5020|5021 | B149: 5021 | C149: =VLOOKUP(RC[1],Sheet1!C[-2]:C[-1],2,FALSE) -> 熊阿宝碎片 | D149: 12469 | E149: 20 | F149: 1 | G149: 1 | H149: 20 | I149: 5 | J149: =ROUND(IFERROR(VLOOKUP(RC[-7],Sheet1!C[-6]:C[-5],2,FALSE),RC[4])*RC[-5]*RC[3]/10,0) -> 480 | K149: 10 | L149: 0 | M149: 8
A150: =IF(MOD(RC[1],100)=1,RC[1],R[-1]C&"|"&RC[1]) -> 5001|5002|5003|5004|5005|5006|5007|5008|5009|5010|5011|5012|5013|5014|5015|5016|5017|5018|5019|5020|5021|5022 | B150: 5022 | C150: =VLOOKUP(RC[1],Sheet1!C[-2]:C[-1],2,FALSE) -> 半人马碎片 | D150: 12464 | E150: 20 | F150: 1 | G150: 1 | H150: 20 | I150: 5 | J150: =ROUND(IFERROR(VLOOKUP(RC[-7],Sheet1!C[-6]:C[-5],2,FALSE),RC[4])*RC[-5]*RC[3]/10,0) -> 480 | K150: 10 | L150: 0 | M150: 8
A151: =IF(MOD(RC[1],100)=1,RC[1],R[-1]C&"|"&RC[1]) -> 5001|5002|5003|5004|5005|5006|5007|5008|5009|5010|5011|5012|5013|5014|5015|5016|5017|5018|5019|5020|5021|5022|5023 | B151: 5023 | C151: =VLOOKUP(RC[1],Sheet1!C[-2]:C[-1],2,FALSE) -> 恶魔猎手碎片 | D151: 12472 | E151: 20 | F151: 1 | G151: 1 | H151: 20 | I151: 5 | J151: =ROUND(IFERROR(VLOOKUP(RC[-7],Sheet1!C[-6]:C[-5],2,FALSE),RC[4])*RC[-5]*RC[3]/10,0) -> 640 | K151: 10 | L151: 0 | M151: 8
A152: =IF(MOD(RC[1],100)=1,RC[1],R[-1]C&"|"&RC[1]) -> 5001|5002|5003|5004|5005|5006|5007|5008|5009|5010|5011|5012|5013|5014|5015|5016|5017|5018|5019|5020|5021|5022|5023|5024 | B152: 5024 | C152: =VLOOKUP(RC[1],Sheet1!C[-2]:C[-1],2,FALSE) -> 食人魔碎片 | D152: 12465 | E152: 20 | F152: 1 | G152: 1 | H152: 20 | I152: 5 | J152: =ROUND(IFERROR(VLOOKUP(RC[-7],Sheet1!C[-6]:C[-5],2,FALSE),RC[4])*RC[-5]*RC[3]/10,0) -> 480 | K152: 10 | L152: 0 | M152: 8
A153: =IF(MOD(RC[1],100)=1,RC[1],R[-1]C&"|"&RC[1]) -> 5001|5002|5003|5004|5005|5006|5007|5008|5009|5010|5011|5012|5013|5014|5015|5016|5017|5018|5019|5020|5021|5022|5023|5024|5025 | B153: 5025 | C153: =VLOOKUP(RC[1],Sheet1!C[-2]:C[-1],2,FALSE) -> 神圣牧师碎片 | D153: 12473 | E153: 20 | F153: 1 | G153: 1 | H153: 20 | I153: 5 | J153: =ROUND(IFERROR(VLOOKUP(RC[-7],Sheet1!C[-6]:C[-5],2,FALSE),RC[4])*RC[-5]*RC[3]/10,0) -> 640 | K153: 10 | L153: 0 | M153: 8
A154: =IF(MOD(RC[1],100)=1,RC[1],R[-1]C&"|"&RC[1]) -> 5001|5002|5003|5004|5005|5006|5007|5008|5009|5010|5011|5012|5013|5014|5015|5016|5017|5018|5019|5020|5021|5022|5023|5024|5025|5026 | B154: 5026 | C154: =VLOOKUP(RC[1],Sheet1!C[-2]:C[-1],2,FALSE) -> 基伦碎片 | D154: 12466 | E154: 20 | F154: 1 | G154: 1 | H154: 20 | I154: 5 | J154: =ROUND(IFERROR(VLOOKUP(RC[-7],Sheet1!C[-6]:C[-5],2,FALSE),RC[4])*RC[-5]*RC[3]/10,0) -> 480 | K154: 10 | L154: 0 | M154: 8
A155: =IF(MOD(RC[1],100)=1,RC[1],R[-1]C&"|"&RC[1]) -> 5001|5002|5003|5004|5005|5006|5007|5008|5009|5010|5011|5012|5013|5014|5015|5016|5017|5018|5019|5020|5021|5022|5023|5024|5025|5026|5027 | B155: 5027 | C155: =VLOOKUP(RC[1],Sheet1!C[-2]:C[-1],2,FALSE) -> 血色指挥官碎片 | D155: 12470 | E155: 20 | F155: 1 | G155: 1 | H155: 20 | I155: 5 | J155: =ROUND(IFERROR(VLOOKUP(RC[-7],Sheet1!C[-6]:C[-5],2,FALSE),RC[4])*RC[-5]*RC[3]/10,0) -> 640 | K155: 10 | L155: 0 | M155: 8
A156: =IF(MOD(RC[1],100)=1,RC[1],R[-1]C&"|"&RC[1]) -> 5001|5002|5003|5004|5005|5006|5007|5008|5009|5010|5011|5012|5013|5014|5015|5016|5017|5018|5019|5020|5021|5022|5023|5024|5025|5026|5027|5028 | B156: 5028 | C156: =VLOOKUP(RC[1],Sheet1!C[-2]:C[-1],2,FALSE) -> 大检察官碎片 | D156: 12471 | E156: 20 | F156: 1 | G156: 1 | H156: 20 | I156: 5 | J156: =ROUND(IFERROR(VLOOKUP(RC[-7],Sheet1!C[-6]:C[-5],2,FALSE),RC[4])*RC[-5]*RC[3]/10,0) -> 480 | K156: 10 | L156: 0 | M156: 8
A157: =IF(MOD(RC[1],100)=1,RC[1],R[-1]C&"|"&RC[1]) -> 5001|5002|5003|5004|5005|5006|5007|5008|5009|5010|5011|5012|5013|5014|5015|5016|5017|5018|5019|5020|5021|5022|5023|5024|5025|5026|5027|5028|5029 | B157: 5029 | C157: =VLOOKUP(RC[1],Sheet1!C[-2]:C[-1],2,FALSE) -> 憎恶碎片 | D157: 12460 | E157: 20 | F157: 1 | G157: 1 | H157: 20 | I157: 5 | J157: =ROUND(IFERROR(VLOOKUP(RC[-7],Sheet1!C[-6]:C[-5],2,FALSE),RC[4])*RC[-5]*RC[3]/10,0) -> 480 | K157: 10 | L157: 0 | M157: 8
A158: =IF(MOD(RC[1],100)=1,RC[1],R[-1]C&"|"&RC[1]) -> 5001|5002|5003|5004|5005|5006|5007|5008|5009|5010|5011|5012|5013|5014|5015|5016|5017|5018|5019|5020|5021|5022|5023|5024|5025|5026|5027|5028|5029|5030 | B158: 5030 | C158: =VLOOKUP(RC[1],Sheet1!C[-2]:C[-1],2,FALSE) -> 树精碎片 | D158: 12461 | E158: 20 | F158: 1 | G158: 1 | H158: 20 | I158: 5 | J158: =ROUND(IFERROR(VLOOKUP(RC[-7],Sheet1!C[-6]:C[-5],2,FALSE),RC[4])*RC[-5]*RC[3]/10,0) -> 480 | K158: 10 | L158: 0 | M158: 8
A159: =IF(MOD(RC[1],100)=1,RC[1],R[-1]C&"|"&RC[1]) -> 5001|5002|5003|5004|5005|5006|5007|5008|5009|5010|5011|5012|5013|5014|5015|5016|5017|5018|5019|5020|5021|5022|5023|5024|5025|5026|5027|5028|5029|5030|5031 | B159: 5031 | C159: =VLOOKUP(RC[1],Sheet1!C[-2]:C[-1],2,FALSE) -> 女警碎片 | D159: 12467 | E159: 10 | F159: 1 | G159: 1 | H159: 10 | I159: 5 | J159: =ROUND(IFERROR(VLOOKUP(RC[-7],Sheet1!C[-6]:C[-5],2,FALSE),RC[4])*RC[-5]*RC[3]/10,0) -> 240 | K159: 10 | L159: 0 | M159: 8
A160: =IF(MOD(RC[1],100)=1,RC[1],R[-1]C&"|"&RC[1]) -> 5001|5002|5003|5004|5005|5006|5007|5008|5009|5010|5011|5012|5013|5014|5015|5016|5017|5018|5019|5020|5021|5022|5023|5024|5025|5026|5027|5028|5029|5030|5031|5032 | B160: 5032 | C160: =VLOOKUP(RC[1],Sheet1!C[-2]:C[-1],2,FALSE) -> 牛头人碎片 | D160: 12462 | E160: 10 | F160: 1 | G160: 1 | H160: 10 | I160: 5 | J160: =ROUND(IFERROR(VLOOKUP(RC[-7],Sheet1!C[-6]:C[-5],2,FALSE),RC[4])*RC[-5]*RC[3]/10,0) -> 240 | K160: 10 | L160: 0 | M160: 8
A161: =IF(MOD(RC[1],100)=1,RC[1],R[-1]C&"|"&RC[1]) -> 5001|5002|5003|5004|5005|5006|5007|5008|5009|5010|5011|5012|5013|5014|5015|5016|5017|5018|5019|5020|5021|5022|5023|5024|5025|5026|5027|5028|5029|5030|5031|5032|5033 | B161: 5033 | C161: =VLOOKUP(RC[1],Sheet1!C[-2]:C[-1],2,FALSE) -> 小黑碎片 | D161: 12468 | E161: 10 | F161: 1 | G161: 1 | H161: 10 | I161: 5 | J161: =ROUND(IFERROR(VLOOKUP(RC[-7],Sheet1!C[-6]:C[-5],2,FALSE),RC[4])*RC[-5]*RC[3]/10,0) -> 320 | K161: 10 | L161: 0 | M161: 8
A162: =IF(MOD(RC[1],100)=1,RC[1],R[-1]C&"|"&RC[1]) -> 5001|5002|5003|5004|5005|5006|5007|5008|5009|5010|5011|5012|5013|5014|5015|5016|5017|5018|5019|5020|5021|5022|5023|5024|5025|5026|5027|5028|5029|5030|5031|5032|5033|5034 | B162: 5034 | C162: =VLOOKUP(RC[1],Sheet1!C[-2]:C[-1],2,FALSE) -> 火女碎片 | D162: 12463 | E162: 10 | F162: 1 | G162: 1 | H162: 10 | I162: 5 | J162: =ROUND(IFERROR(VLOOKUP(RC[-7],Sheet1!C[-6]:C[-5],2,FALSE),RC[4])*RC[-5]*RC[3]/10,0) -> 240 | K162: 10 | L162: 0 | M162: 8
A163: =IF(MOD(RC[1],100)=1,RC[1],R[-1]C&"|"&RC[1]) -> 5001|5002|5003|5004|5005|5006|5007|5008|5009|5010|5011|5012|5013|5014|5015|5016|5017|5018|5019|5020|5021|5022|5023|5024|5025|5026|5027|5028|5029|5030|5031|5032|5033|5034|5035 | B163: 5035 | C163: =VLOOKUP(RC[1],Sheet1!C[-2]:C[-1],2,FALSE) -> 熊阿宝碎片 | D163: 12469 | E163: 10 | F163: 1 | G163: 1 | H163: 10 | I163: 5 | J163: =ROUND(IFERROR(VLOOKUP(RC[-7],Sheet1!C[-6]:C[-5],2,FALSE),RC[4])*RC[-5]*RC[3]/10,0) -> 240 | K163: 10 | L163: 0 | M163: 8
A164: =IF(MOD(RC[1],100)=1,RC[1],R[-1]C&"|"&RC[1]) -> 5001|5002|5003|5004|5005|5006|5007|5008|5009|5010|5011|5012|5013|5014|5015|5016|5017|5018|5019|5020|5021|5022|5023|5024|5025|5026|5027|5028|5029|5030|5031|5032|5033|5034|5035|5036 | B164: 5036 | C164: =VLOOKUP(RC[1],Sheet1!C[-2]:C[-1],2,FALSE) -> 半人马碎片 | D164: 12464 | E164: 10 | F164: 1 | G164: 1 | H164: 10 | I164: 5 | J164: =ROUND(IFERROR(VLOOKUP(RC[-7],Sheet1!C[-6]:C[-5],2,FALSE),RC[4])*RC[-5]*RC[3]/10,0) -> 240 | K164: 10 | L164: 0 | M164: 8
A165: =IF(MOD(RC[1],100)=1,RC[1],R[-1]C&"|"&RC[1]) -> 5001|5002|5003|5004|5005|5006|5007|5008|5009|5010|5011|5012|5013|5014|5015|5016|5017|5018|5019|5020|5021|5022|5023|5024|5025|5026|5027|5028|5029|5030|5031|5032|5033|5034|5035|5036|5037 | B165: 5037 | C165: =VLOOKUP(RC[1],Sheet1!C[-2]:C[-1],2,FALSE) -> 恶魔猎手碎片 | D165: 12472 | E165: 10 | F165: 1 | G165: 1 | H165: 10 | I165: 5 | J165: =ROUND(IFERROR(VLOOKUP(RC[-7],Sheet1!C[-6]:C[-5],2,FALSE),RC[4])*RC[-5]*RC[3]/10,0) -> 320 | K165: 10 | L165: 0 | M165: 8
A166: =IF(MOD(RC[1],100)=1,RC[1],R[-1]C&"|"&RC[1]) -> 5001|5002|5003|5004|5005|5006|5007|5008|5009|5010|5011|5012|5013|5014|5015|5016|5017|5018|5019|5020|5021|5022|5023|5024|5025|5026|5027|5028|5029|5030|5031|5032|5033|5034|5035|5036|5037|5038 | B166: 5038 | C166: =VLOOKUP(RC[1],Sheet1!C[-2]:C[-1],2,FALSE) -> 食人魔碎片 | D166: 12465 | E166: 10 | F166: 1 | G166: 1 | H166: 10 | I166: 5 | J166: =ROUND(IFERROR(VLOOKUP(RC[-7],Sheet1!C[-6]:C[-5],2,FALSE),RC[4])*RC[-5]*RC[3]/10,0) -> 240 | K166: 10 | L166: 0 | M166: 8
A167: =IF(MOD(RC[1],100)=1,RC[1],R[-1]C&"|"&RC[1]) -> 5001|5002|5003|5004|5005|5006|5007|5008|5009|5010|5011|5012|5013|5014|5015|5016|5017|5018|5019|5020|5021|5022|5023|5024|5025|5026|5027|5028|5029|5030|5031|5032|5033|5034|5035|5036|5037|5038|5039 | B167: 5039 | C167: =VLOOKUP(RC[1],Sheet1!C[-2]:C[-1],2,FALSE) -> 神圣牧师碎片 | D167: 12473 | E167: 10 | F167: 1 | G167: 1 | H167: 10 | I167: 5 | J167: =ROUND(IFERROR(VLOOKUP(RC[-7],Sheet1!C[-6]:C[-5],2,FALSE),RC[4])*RC[-5]*RC[3]/10,0) -> 320 | K167: 10 | L167: 0 | M167: 8
A168: =IF(MOD(RC[1],100)=1,RC[1],R[-1]C&"|"&RC[1]) -> 5001|5002|5003|5004|5005|5006|5007|5008|5009|5010|5011|5012|5013|5014|5015|5016|5017|5018|5019|5020|5021|5022|5023|5024|5025|5026|5027|5028|5029|5030|5031|5032|5033|5034|5035|5036|5037|5038|5039|5040 | B168: 5040 | C168: =VLOOKUP(RC[1],Sheet1!C[-2]:C[-1],2,FALSE) -> 基伦碎片 | D168: 12466 | E168: 10 | F168: 1 | G168: 1 | H168: 10 | I168: 5 | J168: =ROUND(IFERROR(VLOOKUP(RC[-7],Sheet1!C[-6]:C[-5],2,FALSE),RC[4])*RC[-5]*RC[3]/10,0) -> 240 | K168: 10 | L168: 0 | M168: 8
A169: =IF(MOD(RC[1],100)=1,RC[1],R[-1]C&"|"&RC[1]) -> 5001|5002|5003|5004|5005|5006|5007|5008|5009|5010|5011|5012|5013|5014|5015|5016|5017|5018|5019|5020|5021|5022|5023|5024|5025|5026|5027|5028|5029|5030|5031|5032|5033|5034|5035|5036|5037|5038|5039|5040|5041 | B169: 5041 | C169: =VLOOKUP(RC[1],Sheet1!C[-2]:C[-1],2,FALSE) -> 血色指挥官碎片 | D169: 12470 | E169: 10 | F169: 1 | G169: 1 | H169: 10 | I169: 5 | J169: =ROUND(IFERROR(VLOOKUP(RC[-7],Sheet1!C[-6]:C[-5],2,FALSE),RC[4])*RC[-5]*RC[3]/10,0) -> 320 | K169: 10 | L169: 0 | M169: 8
A170: =IF(MOD(RC[1],100)=1,RC[1],R[-1]C&"|"&RC[1]) -> 5001|5002|5003|5004|5005|5006|5007|5008|5009|5010|5011|5012|5013|5014|5015|5016|5017|5018|5019|5020|5021|5022|5023|5024|5025|5026|5027|5028|5029|5030|5031|5032|5033|5034|5035|5036|5037|5038|5039|5040|5041|5042 | B170: 5042 | C170: =VLOOKUP(RC[1],Sheet1!C[-2]:C[-1],2,FALSE) -> 大检察官碎片 | D170: 12471 | E170: 10 | F170: 1 | G170: 1 | H170: 10 | I170: 5 | J170: =ROUND(IFERROR(VLOOKUP(RC[-7],Sheet1!C[-6]:C[-5],2,FALSE),RC[4])*RC[-5]*RC[3]/10,0) -> 240 | K170: 10 | L170: 0 | M170: 8
A171: =IF(MOD(RC[1],100)=1,RC[1],R[-1]C&"|"&RC[1]) -> 6001 | B171: 6001 | C171: 觉醒水晶 | D171: 10008 | E171: 100 | F171: 45 | G171: 1 | H171: 2 | I171: 5 | J171: =ROUND(IFERROR(VLOOKUP(RC[-7],Sheet1!C[-6]:C[-5],2,FALSE),RC[4])*RC[-5]*RC[3]/10,0) -> 200 | K171: 10 | L171: 0 | M171: 8 | N171: 2.5
A172: =IF(MOD(RC[1],100)=1,RC[1],R[-1]C&"|"&RC[1]) -> 6001|6002 | B172: 6002 | C172: 觉醒水晶 | D172: 10008 | E172: 200 | F172: 45 | G172: 1 | H172: 2 | I172: 5 | J172: =ROUND(IFERROR(VLOOKUP(RC[-7],Sheet1!C[-6]:C[-5],2,FALSE),RC[4])*RC[-5]*RC[3]/10,0) -> 400 | K172: 10 | L172: 0 | M172: 8 | N172: 2.5
A173: =IF(MOD(RC[1],100)=1,RC[1],R[-1]C&"|"&RC[1]) -> 6001|6002|6003 | B173: 6003 | C173: 觉醒水晶 | D173: 10008 | E173: 300 | F173: 45 | G173: 1 | H173: 2 | I173: 5 | J173: =ROUND(IFERROR(VLOOKUP(RC[-7],Sheet1!C[-6]:C[-5],2,FALSE),RC[4])*RC[-5]*RC[3]/10,0) -> 600 | K173: 10 | L173: 0 | M173: 8 | N173: 2.5
A174: =IF(MOD(RC[1],100)=1,RC[1],R[-1]C&"|"&RC[1]) -> 6001|6002|6003|6004 | B174: 6004 | C174: 觉醒水晶 | D174: 10008 | E174: 400 | F174: 45 | G174: 1 | H174: 2 | I174: 5 | J174: =ROUND(IFERROR(VLOOKUP(RC[-7],Sheet1!C[-6]:C[-5],2,FALSE),RC[4])*RC[-5]*RC[3]/10,0) -> 800 | K174: 10 | L174: 0 | M174: 8 | N174: 2.5
A175: =IF(MOD(RC[1],100)=1,RC[1],R[-1]C&"|"&RC[1]) -> 6001|6002|6003|6004|6005 | B175: 6005 | C175: 觉醒水晶 | D175: 10008 | E175: 500 | F175: 45 | G175: 1 | H175: 2 | I175: 5 | J175: =ROUND(IFERROR(VLOOKUP(RC[-7],Sheet1!C[-6]:C[-5],2,FALSE),RC[4])*RC[-5]*RC[3]/10,0) -> 1000 | K175: 10 | L175: 0 | M175: 8 | N175: 2.5
A176: =IF(MOD(RC[1],100)=1,RC[1],R[-1]C&"|"&RC[1]) -> 6001|6002|6003|6004|6005|6006 | B176: 6006 | C176: 觉醒材料箱 | D176: 13015 | E176: 20 | F176: 45 | G176: 1 | H176: 1 | I176: 5 | J176: =ROUND(IFERROR(VLOOKUP(RC[-7],Sheet1!C[-6]:C[-5],2,FALSE),RC[4])*RC[-5]*RC[3]/10,0) -> 200 | K176: 10 | L176: 0 | M176: 8 | N176: 12.5
A177: =IF(MOD(RC[1],100)=1,RC[1],R[-1]C&"|"&RC[1]) -> 6001|6002|6003|6004|6005|6006|6007 | B177: 6007 | C177: 觉醒材料箱 | D177: 13015 | E177: 25 | F177: 45 | G177: 1 | H177: 1 | I177: 5 | J177: =ROUND(IFERROR(VLOOKUP(RC[-7],Sheet1!C[-6]:C[-5],2,FALSE),RC[4])*RC[-5]*RC[3]/10,0) -> 250 | K177: 10 | L177: 0 | M177: 8 | N177: 12.5
A178: =IF(MOD(RC[1],100)=1,RC[1],R[-1]C&"|"&RC[1]) -> 6001|6002|6003|6004|6005|6006|6007|6008 | B178: 6008 | C178: 觉醒材料箱 | D178: 13015 | E178: 30 | F178: 45 | G178: 1 | H178: 1 | I178: 5 | J178: =ROUND(IFERROR(VLOOKUP(RC[-7],Sheet1!C[-6]:C[-5],2,FALSE),RC[4])*RC[-5]*RC[3]/10,0) -> 300 | K178: 10 | L178: 0 | M178: 8 | N178: 12.5
A179: =IF(MOD(RC[1],100)=1,RC[1],R[-1]C&"|"&RC[1]) -> 6001|6002|6003|6004|6005|6006|6007|6008|6009 | B179: 6009 | C179: 觉醒材料箱 | D179: 13015 | E179: 35 | F179: 45 | G179: 1 | H179: 1 | I179: 5 | J179: =ROUND(IFERROR(VLOOKUP(RC[-7],Sheet1!C[-6]:C[-5],2,FALSE),RC[4])*RC[-5]*RC[3]/10,0) -> 350 | K179: 10 | L179: 0 | M179: 8 | N179: 12.5
A180: =IF(MOD(RC[1],100)=1,RC[1],R[-1]C&"|"&RC[1]) -> 6001|6002|6003|6004|6005|6006|6007|6008|6009|6010 | B180: 6010 | C180: 觉醒材料箱 | D180: 13015 | E180: 40 | F180: 45 | G180: 1 | H180: 1 | I180: 5 | J180: =ROUND(IFERROR(VLOOKUP(RC[-7],Sheet1!C[-6]:C[-5],2,FALSE),RC[4])*RC[-5]*RC[3]/10,0) -> 400 | K180: 10 | L180: 0 | M180: 8 | N180: 12.5
A181: =IF(MOD(RC[1],100)=1,RC[1],R[-1]C&"|"&RC[1]) -> 6001|6002|6003|6004|6005|6006|6007|6008|6009|6010|6011 | B181: 6011 | C181: 觉醒材料箱 | D181: 13015 | E181: 45 | F181: 45 | G181: 1 | H181: 1 | I181: 5 | J181: =ROUND(IFERROR(VLOOKUP(RC[-7],Sheet1!C[-6]:C[-5],2,FALSE),RC[4])*RC[-5]*RC[3]/10,0) -> 450 | K181: 10 | L181: 0 | M181: 8 | N181: 12.5
A182: =IF(MOD(RC[1],100)=1,RC[1],R[-1]C&"|"&RC[1]) -> 6001|6002|6003|6004|6005|6006|6007|6008|6009|6010|6011|6012 | B182: 6012 | C182: 觉醒材料箱 | D182: 13015 | E182: 50 | F182: 45 | G182: 1 | H182: 1 | I182: 5 | J182: =ROUND(IFERROR(VLOOKUP(RC[-7],Sheet1!C[-6]:C[-5],2,FALSE),RC[4])*RC[-5]*RC[3]/10,0) -> 500 | K182: 10 | L182: 0 | M182: 8 | N182: 12.5
A183: =IF(MOD(RC[1],100)=1,RC[1],R[-1]C&"|"&RC[1]) -> 6001|6002|6003|6004|6005|6006|6007|6008|6009|6010|6011|6012|6013 | B183: 6013 | C183: 觉醒材料箱 | D183: 13016 | E183: 10 | F183: 45 | G183: 1 | H183: 1 | I183: 5 | J183: =ROUND(IFERROR(VLOOKUP(RC[-7],Sheet1!C[-6]:C[-5],2,FALSE),RC[4])*RC[-5]*RC[3]/10,0) -> 357 | K183: 10 | L183: 0 | M183: 7 | N183: 51
A184: =IF(MOD(RC[1],100)=1,RC[1],R[-1]C&"|"&RC[1]) -> 6001|6002|6003|6004|6005|6006|6007|6008|6009|6010|6011|6012|6013|6014 | B184: 6014 | C184: 觉醒材料箱 | D184: 13016 | E184: 15 | F184: 45 | G184: 1 | H184: 1 | I184: 5 | J184: =ROUND(IFERROR(VLOOKUP(RC[-7],Sheet1!C[-6]:C[-5],2,FALSE),RC[4])*RC[-5]*RC[3]/10,0) -> 536 | K184: 10 | L184: 0 | M184: 7 | N184: 51
A185: =IF(MOD(RC[1],100)=1,RC[1],R[-1]C&"|"&RC[1]) -> 6001|6002|6003|6004|6005|6006|6007|6008|6009|6010|6011|6012|6013|6014|6015 | B185: 6015 | C185: 觉醒材料箱 | D185: 13016 | E185: 20 | F185: 45 | G185: 1 | H185: 1 | I185: 5 | J185: =ROUND(IFERROR(VLOOKUP(RC[-7],Sheet1!C[-6]:C[-5],2,FALSE),RC[4])*RC[-5]*RC[3]/10,0) -> 714 | K185: 10 | L185: 0 | M185: 7 | N185: 51
A186: =IF(MOD(RC[1],100)=1,RC[1],R[-1]C&"|"&RC[1]) -> 6001|6002|6003|6004|6005|6006|6007|6008|6009|6010|6011|6012|6013|6014|6015|6016 | B186: 6016 | C186: 神魂 | D186: 19017 | E186: 500 | F186: 45 | G186: 1 | H186: 3 | I186: 5 | J186: =ROUND(IFERROR(VLOOKUP(RC[-7],Sheet1!C[-6]:C[-5],2,FALSE),RC[4])*RC[-5]*RC[3]/10,0) -> 400 | K186: 10 | L186: 0 | M186: 8 | N186: 1
A187: =IF(MOD(RC[1],100)=1,RC[1],R[-1]C&"|"&RC[1]) -> 6001|6002|6003|6004|6005|6006|6007|6008|6009|6010|6011|6012|6013|6014|6015|6016|6017 | B187: 6017 | C187: 神魂 | D187: 19017 | E187: 600 | F187: 45 | G187: 1 | H187: 3 | I187: 5 | J187: =ROUND(IFERROR(VLOOKUP(RC[-7],Sheet1!C[-6]:C[-5],2,FALSE),RC[4])*RC[-5]*RC[3]/10,0) -> 480 | K187: 10 | L187: 0 | M187: 8 | N187: 1
A188: =IF(MOD(RC[1],100)=1,RC[1],R[-1]C&"|"&RC[1]) -> 6001|6002|6003|6004|6005|6006|6007|6008|6009|6010|6011|6012|6013|6014|6015|6016|6017|6018 | B188: 6018 | C188: 神魂 | D188: 19017 | E188: 700 | F188: 45 | G188: 1 | H188: 3 | I188: 5 | J188: =ROUND(IFERROR(VLOOKUP(RC[-7],Sheet1!C[-6]:C[-5],2,FALSE),RC[4])*RC[-5]*RC[3]/10,0) -> 560 | K188: 10 | L188: 0 | M188: 8 | N188: 1
A189: =IF(MOD(RC[1],100)=1,RC[1],R[-1]C&"|"&RC[1]) -> 6001|6002|6003|6004|6005|6006|6007|6008|6009|6010|6011|6012|6013|6014|6015|6016|6017|6018|6019 | B189: 6019 | C189: 神魂 | D189: 19017 | E189: 800 | F189: 45 | G189: 1 | H189: 3 | I189: 5 | J189: =ROUND(IFERROR(VLOOKUP(RC[-7],Sheet1!C[-6]:C[-5],2,FALSE),RC[4])*RC[-5]*RC[3]/10,0) -> 640 | K189: 10 | L189: 0 | M189: 8 | N189: 1

Sheet: 限时商店槽位
A1: |slot | B1: |goods_list
A2: 不可空 | B2: 不可空
A3: 数字 | B3: 一维数组
B4: 不定长
A6: 商店槽位 | B6: 商品随机列表
A7: 1 | B7: 1001|1002|1003|1004|1005|1006|1007|1008|1009|1010|1011|1012|1013|1014|1015|1016|1017|1018|1019|1020|1021|1022|1023|1024|1025|1026|1027|1028|1029|1030|1031|1032|1033|1034|1035|1036|1037|1038|1039|1040|1041|1042
A8: 2 | B8: 2001|2002|2003|2004|2005|2006|2007|2008|2009|2010|2011|2012|2013|2014|2015|2016|2017
A9: 3 | B9: 3001|3002|3003|3004|3005|3006|3007|3008|3009|3010|3011|3012|3013|3014|3015|3016|3017|3018|3019|3020|3021|3022|3023|3024|3025|3026|3027|3028|3029|3030|3031|3032|3033|3034|3035|3036|3037|3038|3039|3040|3041|3042
A10: 4 | B10: 4001|4002|4003|4004|4005|4006|4007|4008|4009|4010|4011|4012|4013|4014|4015|4016|4017|4018|4019|4020|4021
A11: 5 | B11: 5001|5002|5003|5004|5005|5006|5007|5008|5009|5010|5011|5012|5013|5014|5015|5016|5017|5018|5019|5020|5021|5022|5023|5024|5025|5026|5027|5028|5029|5030|5031|5032|5033|5034|5035|5036|5037|5038|5039|5040|5041|5042
A12: 6 | B12: 6001|6002|6003|6004|6005|6006|6007|6008|6009|6010|6011|6012|6013|6014|6015|6016|6017|6018|6019

Sheet: Sheet1
A2: 英雄ID | B2: 英雄名称 | D2: 英雄 | E2: 价值
A3: 30000 | B3: 见习警察 | D3: 警察局长 | E3: 800
A4: 30010 | B4: 初代机甲 | D4: 初号机 | E4: 800
A5: 30020 | B5: a型激光机械 | D5: 零式激光炮 | E5: 800
A6: 30030 | B6: a型镭射机械 | D6: 热熔镭射炮 | E6: 800
A7: 30040 | B7: 见习护士 | D7: 护士长 | E7: 800
A8: 30100 | B8: 防暴警察 | D8: 超级队长 | E8: 880
A9: 30110 | B9: 战争机甲 | D9: 死亡武士 | E9: 880
A10: 30120 | B10: b型激光机械 | D10: 红颅鬼 | E10: 2400
A11: 30130 | B11: b型镭射机械 | D11: 终极队长 | E11: 2400
A12: 30140 | B12: 战地护士 | D12: 雷神 | E12: 2400
A13: 30200 | B13: 精英特警 | D13: 野蛮巨人 | E13: 2400
A14: 30210 | B14: 王牌机甲 | D14: 致命特工 | E14: 2400
A15: 30220 | B15: 智能激光机械 | D15: 鹰眸 | E15: 2400
A16: 30230 | B16: 智能镭射机械 | D16: 刀锋猎人 | E16: 2400
A17: 30240 | B17: 精英护士 | D17: 地狱骑士 | E17: 2400
A18: 30300 | B18: 警察局长 | D18: 铁人 | E18: 3200
A19: 30310 | B19: 初号机 | D19: 树人 | E19: 2400
A20: 30320 | B20: 零式激光炮 | D20: 超凡博士 | E20: 3200
A21: 30330 | B21: 热熔镭射炮 | D21: 白凤凰 | E21: 2400
A22: 30340 | B22: 护士长 | D22: 黑暗骑士 | E22: 8000
A23: 30301 | B23: 超级队长 | D23: 地狱铁拳 | E23: 3200
A24: 30302 | B24: 死亡武士 | D24: 狼叔 | E24: 8000
A25: 30430 | B25: 红颅鬼 | D25: 混沌女巫 | E25: 3200
A26: 30400 | B26: 终极队长 | D26: 竞技场王者 | E26: 800
A27: 30431 | B27: 雷神 | D27: 重甲武士 | E27: 800
A28: 30410 | B28: 野蛮巨人 | D28: 影杀者 | E28: 800
A29: 30401 | B29: 致命特工 | D29: 暗影巫师 | E29: 800
A30: 30420 | B30: 鹰眸 | D30: 圣光牧师 | E30: 800
A31: 30402 | B31: 刀锋猎人 | D31: 杰克船长 | E31: 880
A32: 30403 | B32: 地狱骑士 | D32: 天使长 | E32: 880
A33: 30428 | B33: 铁人 | D33: 独眼巨人 | E33: 2400
A34: 30411 | B34: 树人 | D34: 圣女贞德 | E34: 2400
A35: 30438 | B35: 超凡博士 | D35: 美杜莎 | E35: 2400
A36: 30440 | B36: 白凤凰 | D36: 德古拉伯爵 | E36: 2400
A37: 30429 | B37: 地狱铁拳 | D37: 狩猎女神 | E37: 2400
A38: 30449 | B38: 混沌女巫 | D38: 查理大帝 | E38: 2400
A39: 30520 | B39: 黑暗骑士 | D39: 佐罗 | E39: 2400
A40: 30500 | B40: 狼叔 | D40: 亚马逊女王 | E40: 2400
A41: 31000 | B41: 角斗士 | D41: 宙斯 | E41: 3200
A42: 31010 | B42: 见习武士 | D42: 斯巴达 | E42: 2400
A43: 31020 | B43: 见习刺客 | D43: 阿努比斯 | E43: 3200
A44: 31030 | B44: 黑魔学徒 | D44: 雅典娜 | E44: 2400
A45: 31040 | B45: 白魔学徒 | D45: 潘多拉 | E45: 8000
A46: 31100 | B46: 剑斗士 | D46: 大力神 | E46: 3200
A47: 31110 | B47: 高级武士 | D47: 奎爷 | E47: 8000
A48: 31120 | B48: 高级刺客 | D48: 冥王哈迪斯 | E48: 3200
A49: 31130 | B49: 黑魔法师 | D49: 地精神偷 | E49: 800
A50: 31140 | B50: 白魔法师 | D50: 骷髅王 | E50: 800
A51: 31200 | B51: 角斗之王 | D51: 传说哥 | E51: 800
A52: 31210 | B52: 盔甲武士 | D52: 海元素国王 | E52: 800
A53: 31220 | B53: 弓弩刺客 | D53: 水元素国王 | E53: 800
A54: 31230 | B54: 黑魔导师 | D54: 石头人 | E54: 880
A55: 31240 | B55: 白魔导师 | D55: 血源牧师 | E55: 880
A56: 31300 | B56: 竞技场王者 | D56: 憎恶 | E56: 2400
A57: 31310 | B57: 重甲武士 | D57: 树精 | E57: 2400
A58: 31320 | B58: 影杀者 | D58: 牛头人 | E58: 2400
A59: 31330 | B59: 暗影巫师 | D59: 火女 | E59: 2400
A60: 31340 | B60: 圣光牧师 | D60: 半人马 | E60: 2400
A61: 31301 | B61: 杰克船长 | D61: 食人魔 | E61: 2400
A62: 31341 | B62: 天使长 | D62: 基伦 | E62: 2400
A63: 31400 | B63: 独眼巨人 | D63: 女警 | E63: 2400
A64: 31440 | B64: 圣女贞德 | D64: 小黑 | E64: 3200
A65: 31430 | B65: 美杜莎 | D65: 熊阿宝 | E65: 2400
A66: 31401 | B66: 德古拉伯爵 | D66: 血色指挥官 | E66: 3200
A67: 31431 | B67: 狩猎女神 | D67: 大检察官 | E67: 2400
A68: 31402 | B68: 查理大帝 | D68: 巫妖之王 | E68: 8000
A69: 31403 | B69: 佐罗 | D69: 恶魔猎手 | E69: 3200
A70: 31420 | B70: 亚马逊女王 | D70: 钢铁酋长 | E70: 8000
A71: 31438 | B71: 宙斯 | D71: 神圣牧师 | E71: 3200
A72: 31410 | B72: 斯巴达
A73: 31408 | B73: 阿努比斯 | D73: 警察局长碎片 | E73: 20 | F73: 40
A74: 31441 | B74: 雅典娜 | D74: 初号机碎片 | E74: 20 | F74: 40
A75: 31419 | B75: 大力神 | D75: 零式激光炮碎片 | E75: 20 | F75: 40
A76: 31439 | B76: 冥王哈迪斯 | D76: 热熔镭射炮碎片 | E76: 20 | F76: 40
A77: 31530 | B77: 潘多拉 | D77: 护士长碎片 | E77: 20 | F77: 40
A78: 31500 | B78: 奎爷 | D78: 超级队长碎片 | E78: 22 | F78: 40
A79: 32000 | B79: 恶劣地精 | D79: 死亡武士碎片 | E79: 22 | F79: 40
A80: 32010 | B80: 新生骷髅 | D80: 红颅鬼碎片 | E80: 30 | F80: 80
A81: 32020 | B81: 矮人民兵 | D81: 终极队长碎片 | E81: 30 | F81: 80
A82: 32030 | B82: 初级海元素 | D82: 雷神碎片 | E82: 30 | F82: 80
A83: 32040 | B83: 初级水元素 | D83: 野蛮巨人碎片 | E83: 30 | F83: 80
A84: 32100 | B84: 地精盗贼 | D84: 致命特工碎片 | E84: 30 | F84: 80
A85: 32110 | B85: 骷髅战士 | D85: 鹰眸碎片 | E85: 30 | F85: 80
A86: 32120 | B86: 矮人火枪手 | D86: 刀锋猎人碎片 | E86: 30 | F86: 80
A87: 32130 | B87: 高级海元素 | D87: 地狱骑士碎片 | E87: 30 | F87: 80
A88: 32140 | B88: 高级水元素 | D88: 铁人碎片 | E88: 40 | F88: 80
A89: 32200 | B89: 地精大盗 | D89: 树人碎片 | E89: 30 | F89: 80
A90: 32210 | B90: 骷髅勇士 | D90: 超凡博士碎片 | E90: 40 | F90: 80
A91: 32220 | B91: 精英火枪手 | D91: 白凤凰碎片 | E91: 30 | F91: 80
A92: 32230 | B92: 海元素领主 | D92: 黑暗骑士碎片 | E92: 50 | F92: 160
A93: 32240 | B93: 水元素领主 | D93: 地狱铁拳碎片 | E93: 40 | F93: 80
A94: 32300 | B94: 地精神偷 | D94: 狼叔碎片 | E94: 50 | F94: 160
A95: 32310 | B95: 骷髅王 | D95: 混沌女巫碎片 | E95: 40 | F95: 80
A96: 32320 | B96: 传说哥 | D96: 竞技场王者碎片 | E96: 20 | F96: 40
A97: 32330 | B97: 海元素国王 | D97: 重甲武士碎片 | E97: 20 | F97: 40
A98: 32340 | B98: 水元素国王 | D98: 影杀者碎片 | E98: 20 | F98: 40
A99: 32311 | B99: 石头人 | D99: 暗影巫师碎片 | E99: 20 | F99: 40
A100: 32341 | B100: 血源牧师 | D100: 圣光牧师碎片 | E100: 20 | F100: 40
A101: 32410 | B101: 憎恶 | D101: 杰克船长碎片 | E101: 22 | F101: 40
A102: 32411 | B102: 树精 | D102: 天使长碎片 | E102: 22 | F102: 40
A103: 32400 | B103: 牛头人 | D103: 独眼巨人碎片 | E103: 30 | F103: 80
A104: 32430 | B104: 火女 | D104: 圣女贞德碎片 | E104: 30 | F104: 80
A105: 32401 | B105: 半人马 | D105: 美杜莎碎片 | E105: 30 | F105: 80
A106: 32431 | B106: 食人魔 | D106: 德古拉伯爵碎片 | E106: 30 | F106: 80
A107: 32402 | B107: 基伦 | D107: 狩猎女神碎片 | E107: 30 | F107: 80
A108: 32420 | B108: 女警 | D108: 查理大帝碎片 | E108: 30 | F108: 80
A109: 32428 | B109: 小黑 | D109: 佐罗碎片 | E109: 30 | F109: 80
A110: 32412 | B110: 熊阿宝 | D110: 亚马逊女王碎片 | E110: 30 | F110: 80
A111: 32408 | B111: 血色指挥官 | D111: 宙斯碎片 | E111: 40 | F111: 80
A112: 32440 | B112: 大检察官 | D112: 斯巴达碎片 | E112: 30 | F112: 80
A113: 32409 | B113: 恶魔猎手 | D113: 阿努比斯碎片 | E113: 40 | F113: 80
A114: 32449 | B114: 神圣牧师 | D114: 雅典娜碎片 | E114: 30 | F114: 80
A115: 32500 | B115: 巫妖之王 | D115: 潘多拉碎片 | E115: 50 | F115: 160
A116: 32510 | B116: 钢铁酋长 | D116: 大力神碎片 | E116: 40 | F116: 80
A117: 12200 | B117: 精英特警碎片 | D117: 奎爷碎片 | E117: 50 | F117: 160
A118: 12201 | B118: 王牌机甲碎片 | D118: 冥王哈迪斯碎片 | E118: 40 | F118: 80
A119: 12202 | B119: 智能激光机械碎片 | D119: 地精神偷碎片 | E119: 20 | F119: 40
A120: 12203 | B120: 智能镭射机械碎片 | D120: 骷髅王碎片 | E120: 20 | F120: 40
A121: 12204 | B121: 精英护士碎片 | D121: 传说哥碎片 | E121: 20 | F121: 40
A122: 12300 | B122: 警察局长碎片 | D122: 海元素国王碎片 | E122: 20 | F122: 40
A123: 12301 | B123: 初号机碎片 | D123: 水元素国王碎片 | E123: 20 | F123: 40
A124: 12302 | B124: 零式激光炮碎片 | D124: 石头人碎片 | E124: 22 | F124: 40
A125: 12303 | B125: 热熔镭射炮碎片 | D125: 血源牧师碎片 | E125: 22 | F125: 40
A126: 12304 | B126: 护士长碎片 | D126: 憎恶碎片 | E126: 30 | F126: 80
A127: 12305 | B127: 超级队长碎片 | D127: 树精碎片 | E127: 30 | F127: 80
A128: 12306 | B128: 死亡武士碎片 | D128: 牛头人碎片 | E128: 30 | F128: 80
A129: 12400 | B129: 红颅鬼碎片 | D129: 火女碎片 | E129: 30 | F129: 80
A130: 12401 | B130: 终极队长碎片 | D130: 半人马碎片 | E130: 30 | F130: 80
A131: 12402 | B131: 雷神碎片 | D131: 食人魔碎片 | E131: 30 | F131: 80
A132: 12403 | B132: 野蛮巨人碎片 | D132: 基伦碎片 | E132: 30 | F132: 80
A133: 12404 | B133: 致命特工碎片 | D133: 女警碎片 | E133: 30 | F133: 80
A134: 12405 | B134: 鹰眸碎片 | D134: 小黑碎片 | E134: 40 | F134: 80
A135: 12406 | B135: 刀锋猎人碎片 | D135: 熊阿宝碎片 | E135: 30 | F135: 80
A136: 12407 | B136: 地狱骑士碎片 | D136: 血色指挥官碎片 | E136: 40 | F136: 80
A137: 12408 | B137: 铁人碎片 | D137: 大检察官碎片 | E137: 30 | F137: 80
A138: 12409 | B138: 树人碎片 | D138: 巫妖之王碎片 | E138: 50 | F138: 160
A139: 12410 | B139: 超凡博士碎片 | D139: 恶魔猎手碎片 | E139: 40 | F139: 80
A140: 12411 | B140: 白凤凰碎片 | D140: 钢铁酋长碎片 | E140: 50 | F140: 160
A141: 12412 | B141: 地狱铁拳碎片 | D141: 神圣牧师碎片 | E141: 40 | F141: 80
A142: 12413 | B142: 混沌女巫碎片
A143: 12500 | B143: 黑暗骑士碎片
A144: 12501 | B144: 狼叔碎片
A145: 12230 | B145: 角斗之王碎片
A146: 12231 | B146: 盔甲武士碎片
A147: 12232 | B147: 弓弩刺客碎片
A148: 12233 | B148: 黑魔导师碎片
A149: 12234 | B149: 白魔导师碎片
A150: 12330 | B150: 竞技场王者碎片
A151: 12331 | B151: 重甲武士碎片
A152: 12332 | B152: 影杀者碎片
A153: 12333 | B153: 暗影巫师碎片
A154: 12334 | B154: 圣光牧师碎片
A155: 12335 | B155: 杰克船长碎片
A156: 12336 | B156: 天使长碎片
A157: 12430 | B157: 独眼巨人碎片
A158: 12431 | B158: 圣女贞德碎片
A159: 12432 | B159: 美杜莎碎片
A160: 12433 | B160: 德古拉伯爵碎片
A161: 12434 | B161: 狩猎女神碎片
A162: 12435 | B162: 查理大帝碎片
A163: 12436 | B163: 佐罗碎片
A164: 12437 | B164: 亚马逊女王碎片
A165: 12438 | B165: 宙斯碎片
A166: 12439 | B166: 斯巴达碎片
A167: 12440 | B167: 阿努比斯碎片
A168: 12441 | B168: 雅典娜碎片
A169: 12442 | B169: 大力神碎片
A170: 12443 | B170: 冥王哈迪斯碎片
A171: 12530 | B171: 潘多拉碎片
A172: 12531 | B172: 奎爷碎片
A173: 12260 | B173: 地精大盗碎片
A174: 12261 | B174: 骷髅勇士碎片
A175: 12262 | B175: 精英火枪手碎片
A176: 12263 | B176: 海元素领主碎片
A177: 12264 | B177: 水元素领主碎片
A178: 12360 | B178: 地精神偷碎片
A179: 12361 | B179: 骷髅王碎片
A180: 12362 | B180: 传说哥碎片
A181: 12363 | B181: 海元素国王碎片
A182: 12364 | B182: 水元素国王碎片
A183: 12365 | B183: 石头人碎片
A184: 12366 | B184: 血源牧师碎片
A185: 12460 | B185: 憎恶碎片
A186: 12461 | B186: 树精碎片
A187: 12462 | B187: 牛头人碎片
A188: 12463 | B188: 火女碎片
A189: 12464 | B189: 半人马碎片
A190: 12465 | B190: 食人魔碎片
A191: 12466 | B191: 基伦碎片
A192: 12467 | B192: 女警碎片
A193: 12468 | B193: 小黑碎片
A194: 12469 | B194: 熊阿宝碎片
A195: 12470 | B195: 血色指挥官碎片
A196: 12471 | B196: 大检察官碎片
A197: 12472 | B197: 恶魔猎手碎片
A198: 12473 | B198: 神圣牧师碎片
A199: 12560 | B199: 巫妖之王碎片
A200: 12561 | B200: 钢铁酋长碎片