Sheet: 配置
A1: 服务端文件名 | B1: 服务端对应工作表号 | C1: 客户端文件名 | D1: 客户端对应工作表号 | E1: erl头部 | F1: erl内容格式 | G1: erl尾部 | H1: 客户端特殊处理
C2: config_accurate_recommend.cnf|AccurateRecommend | D2: 1 | F2: get(id) -> #$ | H2: 2=>id
A3: accurate_recommend_goods.txt | B3: 2 | C3: config_accurate_recommend_gift.cnf|AccurateRecommendGift | D3: 2 | F3: get(id) -> #$ | H3: 2=>id

Sheet: 推送
A1: id| | B1: lv_min|lv_min | C1: lv_max|lv_max | D1: gift_list|
A2: 不可空 | B2: 不可空 | C2: 不可空 | D2: 不可空
A3: 数字 | B3: 数字 | C3: 数字 | D3: 一维数组
D4: 不定长
A6: ID | B6: 等级区间小 | C6: 等级区间大 | D6: 礼包列表
A7: 1 | B7: 0 | C7: =IF(R[1]C[-1]="",999,R[1]C[-1]-1) -> 4 | D7: =RC[1] -> 1|2|3|4|5 | E7: 1|2|3|4|5 | F7: 3 | G7: 英雄升级
A8: 2 | B8: 5 | C8: =IF(R[1]C[-1]="",999,R[1]C[-1]-1) -> 6 | D8: =R[-1]C&"|"&RC[1] -> 1|2|3|4|5|6|7|8|9|10 | E8: 6|7|8|9|10 | F8: 5 | G8: 英雄进阶
A9: 3 | B9: 7 | C9: =IF(R[1]C[-1]="",999,R[1]C[-1]-1) -> 8 | D9: =R[-1]C&"|"&RC[1] -> 1|2|3|4|5|6|7|8|9|10|11|12|13|14|15 | E9: 11|12|13|14|15 | F9: 7 | G9: 装备强化
A10: 4 | B10: 9 | C10: =IF(R[1]C[-1]="",999,R[1]C[-1]-1) -> 13 | D10: =R[-1]C&"|"&RC[1] -> 1|2|3|4|5|6|7|8|9|10|11|12|13|14|15|16|17|18|19|20 | E10: 16|17|18|19|20 | F10: 9 | G10: 英雄培养
A11: 5 | B11: 14 | C11: =IF(R[1]C[-1]="",999,R[1]C[-1]-1) -> 24 | D11: =R[-1]C&"|"&RC[1] -> 1|2|3|4|5|6|7|8|9|10|11|12|13|14|15|16|17|18|19|20|21|22|23|24|25 | E11: 21|22|23|24|25 | F11: 14 | G11: 圣器强化
A12: 6 | B12: 25 | C12: =IF(R[1]C[-1]="",999,R[1]C[-1]-1) -> 27 | D12: =R[-1]C&"|"&RC[1] -> 1|2|3|4|5|6|7|8|9|10|11|12|13|14|15|16|17|18|19|20|21|22|23|24|25|26|27|28|29|30 | E12: 26|27|28|29|30 | F12: 25 | G12: 精灵升级
A13: 7 | B13: 28 | C13: =IF(R[1]C[-1]="",999,R[1]C[-1]-1) -> 28 | D13: =R[-1]C&"|"&RC[1] -> 1|2|3|4|5|6|7|8|9|10|11|12|13|14|15|16|17|18|19|20|21|22|23|24|25|26|27|28|29|30|31|32|33|34|35 | E13: 31|32|33|34|35 | F13: 28 | G13: 精灵升华
A14: 8 | B14: 29 | C14: =IF(R[1]C[-1]="",999,R[1]C[-1]-1) -> 34 | D14: =R[-1]C&"|"&RC[1] -> 1|2|3|4|5|6|7|8|9|10|11|12|13|14|15|16|17|18|19|20|21|22|23|24|25|26|27|28|29|30|31|32|33|34|35|36|37|38|39|40 | E14: 36|37|38|39|40 | F14: 29 | G14: 装备精炼
A15: 9 | B15: 35 | C15: =IF(R[1]C[-1]="",999,R[1]C[-1]-1) -> 38 | D15: =R[-1]C&"|"&RC[1] -> 1|2|3|4|5|6|7|8|9|10|11|12|13|14|15|16|17|18|19|20|21|22|23|24|25|26|27|28|29|30|31|32|33|34|35|36|37|38|39|40|41|42|43|44|45 | E15: 41|42|43|44|45 | F15: 35 | G15: 英雄潜能
A16: 10 | B16: 39 | C16: =IF(R[1]C[-1]="",999,R[1]C[-1]-1) -> 44 | D16: =R[-1]C&"|"&RC[1] -> 1|2|3|4|5|6|7|8|9|10|11|12|13|14|15|16|17|18|19|20|21|22|23|24|25|26|27|28|29|30|31|32|33|34|35|36|37|38|39|40|41|42|43|44|45|46|47|48|49|50 | E16: 46|47|48|49|50 | F16: 39 | G16: 圣器精炼
A17: 11 | B17: 45 | C17: =IF(R[1]C[-1]="",999,R[1]C[-1]-1) -> 999 | D17: =R[-1]C&"|"&RC[1] -> 1|2|3|4|5|6|7|8|9|10|11|12|13|14|15|16|17|18|19|20|21|22|23|24|25|26|27|28|29|30|31|32|33|34|35|36|37|38|39|40|41|42|43|44|45|46|47|48|49|50|51|52|53|54|55 | E17: 51|52|53|54|55 | F17: 45 | G17: 英雄觉醒

Sheet: 礼包
A1: id|id | B1: weight| | C1: item_id|item_id | D1: item_num|item_num | E1: system_id| | F1: buy_max_num|buy_max_num | G1: recharge_id|recharge_id | H1: discount_rmb|
A2: 不可空 | B2: 不可空 | C2: 不可空 | D2: 不可空 | E2: 不可空 | F2: 不可空 | G2: 不可空 | H2: 可空#不需字段
A3: 数字 | B3: 数字 | C3: 数字 | D3: 数字 | E3: 数字 | F3: 数字 | G3: 数字 | H3: 数字
A6: ID | B6: 权重 | C6: 物品ID | D6: 物品数量 | E6: 系统ID | F6: 每日限购次数 | G6: 对应充值ID | H6: 显示折扣
A7: =ROW()-6 -> 1 | B7: 100 | C7: 13802 | D7: 1 | E7: 35 | F7: 1 | G7: 2002 | H7: 3 | I7: 英雄升级30元3折包
A8: =ROW()-6 -> 2 | B8: 80 | C8: 13803 | D8: 1 | E8: 35 | F8: 1 | G8: 2003 | H8: 4 | I8: 英雄升级68元4折包
A9: =ROW()-6 -> 3 | B9: 60 | C9: 13804 | D9: 1 | E9: 35 | F9: 1 | G9: 2004 | H9: 4 | I9: 英雄升级98元4折包
A10: =ROW()-6 -> 4 | B10: 40 | C10: 13805 | D10: 1 | E10: 35 | F10: 2 | G10: 2005 | H10: 5 | I10: 英雄升级168元5折包
A11: =ROW()-6 -> 5 | B11: 20 | C11: 13805 | D11: 1 | E11: 35 | F11: 3 | G11: 2006 | H11: 5 | I11: 英雄升级268元5折包
A12: =ROW()-6 -> 6 | B12: =R[-5]C -> 100 | C12: 13807 | D12: 1 | E12: 36 | F12: =R[-5]C -> 1 | G12: =R[-5]C -> 2002 | H12: =R[-5]C -> 3 | I12: 英雄进阶30元3折包
A13: =ROW()-6 -> 7 | B13: =R[-5]C -> 80 | C13: 13808 | D13: 1 | E13: 36 | F13: =R[-5]C -> 1 | G13: =R[-5]C -> 2003 | H13: =R[-5]C -> 4 | I13: 英雄进阶68元4折包
A14: =ROW()-6 -> 8 | B14: =R[-5]C -> 60 | C14: 13809 | D14: 1 | E14: 36 | F14: =R[-5]C -> 1 | G14: =R[-5]C -> 2004 | H14: =R[-5]C -> 4 | I14: 英雄进阶98元4折包
A15: =ROW()-6 -> 9 | B15: =R[-5]C -> 40 | C15: 13810 | D15: 1 | E15: 36 | F15: =R[-5]C -> 2 | G15: =R[-5]C -> 2005 | H15: =R[-5]C -> 5 | I15: 英雄进阶168元5折包
A16: =ROW()-6 -> 10 | B16: =R[-5]C -> 20 | C16: 13811 | D16: 1 | E16: 36 | F16: =R[-5]C -> 3 | G16: =R[-5]C -> 2006 | H16: =R[-5]C -> 5 | I16: 英雄进阶268元5折包
A17: =ROW()-6 -> 11 | B17: =R[-5]C -> 100 | C17: 13813 | D17: 1 | E17: 38 | F17: =R[-5]C -> 1 | G17: =R[-5]C -> 2002 | H17: =R[-5]C -> 3 | I17: 装备强化30元3折包
A18: =ROW()-6 -> 12 | B18: =R[-5]C -> 80 | C18: 13814 | D18: 1 | E18: 38 | F18: =R[-5]C -> 1 | G18: =R[-5]C -> 2003 | H18: =R[-5]C -> 4 | I18: 装备强化68元4折包
A19: =ROW()-6 -> 13 | B19: =R[-5]C -> 60 | C19: 13815 | D19: 1 | E19: 38 | F19: =R[-5]C -> 1 | G19: =R[-5]C -> 2004 | H19: =R[-5]C -> 4 | I19: 装备强化98元4折包
A20: =ROW()-6 -> 14 | B20: =R[-5]C -> 40 | C20: 13816 | D20: 1 | E20: 38 | F20: =R[-5]C -> 2 | G20: =R[-5]C -> 2005 | H20: =R[-5]C -> 5 | I20: 装备强化168元5折包
A21: =ROW()-6 -> 15 | B21: =R[-5]C -> 20 | C21: 13817 | D21: 1 | E21: 38 | F21: =R[-5]C -> 3 | G21: =R[-5]C -> 2006 | H21: =R[-5]C -> 5 | I21: 装备强化268元5折包
A22: =ROW()-6 -> 16 | B22: =R[-5]C -> 100 | C22: 13819 | D22: 1 | E22: 40 | F22: =R[-5]C -> 1 | G22: =R[-5]C -> 2002 | H22: =R[-5]C -> 3 | I22: 英雄培养30元3折包
A23: =ROW()-6 -> 17 | B23: =R[-5]C -> 80 | C23: 13820 | D23: 1 | E23: 40 | F23: =R[-5]C -> 1 | G23: =R[-5]C -> 2003 | H23: =R[-5]C -> 4 | I23: 英雄培养68元4折包
A24: =ROW()-6 -> 18 | B24: =R[-5]C -> 60 | C24: 13821 | D24: 1 | E24: 40 | F24: =R[-5]C -> 1 | G24: =R[-5]C -> 2004 | H24: =R[-5]C -> 4 | I24: 英雄培养98元4折包
A25: =ROW()-6 -> 19 | B25: =R[-5]C -> 40 | C25: 13822 | D25: 1 | E25: 40 | F25: =R[-5]C -> 2 | G25: =R[-5]C -> 2005 | H25: =R[-5]C -> 5 | I25: 英雄培养168元5折包
A26: =ROW()-6 -> 20 | B26: =R[-5]C -> 20 | C26: 13823 | D26: 1 | E26: 40 | F26: =R[-5]C -> 3 | G26: =R[-5]C -> 2006 | H26: =R[-5]C -> 5 | I26: 英雄培养268元5折包
A27: =ROW()-6 -> 21 | B27: =R[-5]C -> 100 | C27: 13825 | D27: 1 | E27: 42 | F27: =R[-5]C -> 1 | G27: =R[-5]C -> 2002 | H27: =R[-5]C -> 3 | I27: 圣器强化30元3折包
A28: =ROW()-6 -> 22 | B28: =R[-5]C -> 80 | C28: 13826 | D28: 1 | E28: 42 | F28: =R[-5]C -> 1 | G28: =R[-5]C -> 2003 | H28: =R[-5]C -> 4 | I28: 圣器强化68元4折包
A29: =ROW()-6 -> 23 | B29: =R[-5]C -> 60 | C29: 13827 | D29: 1 | E29: 42 | F29: =R[-5]C -> 1 | G29: =R[-5]C -> 2004 | H29: =R[-5]C -> 4 | I29: 圣器强化98元4折包
A30: =ROW()-6 -> 24 | B30: =R[-5]C -> 40 | C30: 13828 | D30: 1 | E30: 42 | F30: =R[-5]C -> 2 | G30: =R[-5]C -> 2005 | H30: =R[-5]C -> 5 | I30: 圣器强化168元5折包
A31: =ROW()-6 -> 25 | B31: =R[-5]C -> 20 | C31: 13829 | D31: 1 | E31: 42 | F31: =R[-5]C -> 3 | G31: =R[-5]C -> 2006 | H31: =R[-5]C -> 5 | I31: 圣器强化268元5折包
A32: =ROW()-6 -> 26 | B32: =R[-5]C -> 100 | C32: 13831 | D32: 1 | E32: 64 | F32: =R[-5]C -> 1 | G32: =R[-5]C -> 2002 | H32: =R[-5]C -> 3 | I32: 精灵升级30元3折包
A33: =ROW()-6 -> 27 | B33: =R[-5]C -> 80 | C33: 13832 | D33: 1 | E33: 64 | F33: =R[-5]C -> 1 | G33: =R[-5]C -> 2003 | H33: =R[-5]C -> 4 | I33: 精灵升级68元4折包
A34: =ROW()-6 -> 28 | B34: =R[-5]C -> 60 | C34: 13833 | D34: 1 | E34: 64 | F34: =R[-5]C -> 1 | G34: =R[-5]C -> 2004 | H34: =R[-5]C -> 4 | I34: 精灵升级98元4折包
A35: =ROW()-6 -> 29 | B35: =R[-5]C -> 40 | C35: 13834 | D35: 1 | E35: 64 | F35: =R[-5]C -> 2 | G35: =R[-5]C -> 2005 | H35: =R[-5]C -> 5 | I35: 精灵升级168元5折包
A36: =ROW()-6 -> 30 | B36: =R[-5]C -> 20 | C36: 13835 | D36: 1 | E36: 64 | F36: =R[-5]C -> 3 | G36: =R[-5]C -> 2006 | H36: =R[-5]C -> 5 | I36: 精灵升级268元5折包
A37: =ROW()-6 -> 31 | B37: =R[-5]C -> 100 | C37: 13837 | D37: 1 | E37: 87 | F37: =R[-5]C -> 1 | G37: =R[-5]C -> 2002 | H37: =R[-5]C -> 3 | I37: 精灵升华30元3折包
A38: =ROW()-6 -> 32 | B38: =R[-5]C -> 80 | C38: 13838 | D38: 1 | E38: 87 | F38: =R[-5]C -> 1 | G38: =R[-5]C -> 2003 | H38: =R[-5]C -> 4 | I38: 精灵升华68元4折包
A39: =ROW()-6 -> 33 | B39: =R[-5]C -> 60 | C39: 13839 | D39: 1 | E39: 87 | F39: =R[-5]C -> 1 | G39: =R[-5]C -> 2004 | H39: =R[-5]C -> 4 | I39: 精灵升华98元4折包
A40: =ROW()-6 -> 34 | B40: =R[-5]C -> 40 | C40: 13840 | D40: 1 | E40: 87 | F40: =R[-5]C -> 2 | G40: =R[-5]C -> 2005 | H40: =R[-5]C -> 5 | I40: 精灵升华168元5折包
A41: =ROW()-6 -> 35 | B41: =R[-5]C -> 20 | C41: 13841 | D41: 1 | E41: 87 | F41: =R[-5]C -> 3 | G41: =R[-5]C -> 2006 | H41: =R[-5]C -> 5 | I41: 精灵升华268元5折包
A42: =ROW()-6 -> 36 | B42: =R[-5]C -> 100 | C42: 13843 | D42: 1 | E42: 39 | F42: =R[-5]C -> 1 | G42: =R[-5]C -> 2002 | H42: =R[-5]C -> 3 | I42: 装备精炼30元3折包
A43: =ROW()-6 -> 37 | B43: =R[-5]C -> 80 | C43: 13844 | D43: 1 | E43: 39 | F43: =R[-5]C -> 1 | G43: =R[-5]C -> 2003 | H43: =R[-5]C -> 4 | I43: 装备精炼68元4折包
A44: =ROW()-6 -> 38 | B44: =R[-5]C -> 60 | C44: 13845 | D44: 1 | E44: 39 | F44: =R[-5]C -> 1 | G44: =R[-5]C -> 2004 | H44: =R[-5]C -> 4 | I44: 装备精炼98元4折包
A45: =ROW()-6 -> 39 | B45: =R[-5]C -> 40 | C45: 13846 | D45: 1 | E45: 39 | F45: =R[-5]C -> 2 | G45: =R[-5]C -> 2005 | H45: =R[-5]C -> 5 | I45: 装备精炼168元5折包
A46: =ROW()-6 -> 40 | B46: =R[-5]C -> 20 | C46: 13847 | D46: 1 | E46: 39 | F46: =R[-5]C -> 3 | G46: =R[-5]C -> 2006 | H46: =R[-5]C -> 5 | I46: 装备精炼268元5折包
A47: =ROW()-6 -> 41 | B47: =R[-5]C -> 100 | C47: 13849 | D47: 1 | E47: 44 | F47: =R[-5]C -> 1 | G47: =R[-5]C -> 2002 | H47: =R[-5]C -> 3 | I47: 英雄潜能30元3折包
A48: =ROW()-6 -> 42 | B48: =R[-5]C -> 80 | C48: 13850 | D48: 1 | E48: 44 | F48: =R[-5]C -> 1 | G48: =R[-5]C -> 2003 | H48: =R[-5]C -> 4 | I48: 英雄潜能68元4折包
A49: =ROW()-6 -> 43 | B49: =R[-5]C -> 60 | C49: 13851 | D49: 1 | E49: 44 | F49: =R[-5]C -> 1 | G49: =R[-5]C -> 2004 | H49: =R[-5]C -> 4 | I49: 英雄潜能98元4折包
A50: =ROW()-6 -> 44 | B50: =R[-5]C -> 40 | C50: 13852 | D50: 1 | E50: 44 | F50: =R[-5]C -> 2 | G50: =R[-5]C -> 2005 | H50: =R[-5]C -> 5 | I50: 英雄潜能168元5折包
A51: =ROW()-6 -> 45 | B51: =R[-5]C -> 20 | C51: 13853 | D51: 1 | E51: 44 | F51: =R[-5]C -> 3 | G51: =R[-5]C -> 2006 | H51: =R[-5]C -> 5 | I51: 英雄潜能268元5折包
A52: =ROW()-6 -> 46 | B52: =R[-5]C -> 100 | C52: 13855 | D52: 1 | E52: 43 | F52: =R[-5]C -> 1 | G52: =R[-5]C -> 2002 | H52: =R[-5]C -> 3 | I52: 圣器精炼30元3折包
A53: =ROW()-6 -> 47 | B53: =R[-5]C -> 80 | C53: 13856 | D53: 1 | E53: 43 | F53: =R[-5]C -> 1 | G53: =R[-5]C -> 2003 | H53: =R[-5]C -> 4 | I53: 圣器精炼68元4折包
A54: =ROW()-6 -> 48 | B54: =R[-5]C -> 60 | C54: 13857 | D54: 1 | E54: 43 | F54: =R[-5]C -> 1 | G54: =R[-5]C -> 2004 | H54: =R[-5]C -> 4 | I54: 圣器精炼98元4折包
A55: =ROW()-6 -> 49 | B55: =R[-5]C -> 40 | C55: 13858 | D55: 1 | E55: 43 | F55: =R[-5]C -> 2 | G55: =R[-5]C -> 2005 | H55: =R[-5]C -> 5 | I55: 圣器精炼168元5折包
A56: =ROW()-6 -> 50 | B56: =R[-5]C -> 20 | C56: 13859 | D56: 1 | E56: 43 | F56: =R[-5]C -> 3 | G56: =R[-5]C -> 2006 | H56: =R[-5]C -> 5 | I56: 圣器精炼268元5折包
A57: =ROW()-6 -> 51 | B57: =R[-5]C -> 100 | C57: 13861 | D57: 1 | E57: 45 | F57: =R[-5]C -> 1 | G57: =R[-5]C -> 2002 | H57: =R[-5]C -> 3 | I57: 英雄觉醒30元3折包
A58: =ROW()-6 -> 52 | B58: =R[-5]C -> 80 | C58: 13862 | D58: 1 | E58: 45 | F58: =R[-5]C -> 1 | G58: =R[-5]C -> 2003 | H58: =R[-5]C -> 4 | I58: 英雄觉醒68元4折包
A59: =ROW()-6 -> 53 | B59: =R[-5]C -> 60 | C59: 13863 | D59: 1 | E59: 45 | F59: =R[-5]C -> 1 | G59: =R[-5]C -> 2004 | H59: =R[-5]C -> 4 | I59: 英雄觉醒98元4折包
A60: =ROW()-6 -> 54 | B60: =R[-5]C -> 40 | C60: 13864 | D60: 1 | E60: 45 | F60: =R[-5]C -> 2 | G60: =R[-5]C -> 2005 | H60: =R[-5]C -> 5 | I60: 英雄觉醒168元5折包
A61: =ROW()-6 -> 55 | B61: =R[-5]C -> 20 | C61: 13865 | D61: 1 | E61: 45 | F61: =R[-5]C -> 3 | G61: =R[-5]C -> 2006 | H61: =R[-5]C -> 5 | I61: 英雄觉醒268元5折包