Sheet: 配置
A1: 服务端文件名 | B1: 服务端对应工作表号 | C1: 客户端文件名 | D1: 客户端对应工作表号 | E1: erl头部 | F1: erl内容格式 | G1: erl尾部 | H1: 客户端特殊处理
A2: heart_of_world.txt | B2: 1 | C2: config_heart_of_world.cnf|HeartOfWorld | D2: 1 | F2: get(stage) -> #$ | H2: 1=>stage,level|elves_list
A3: spirit.txt | B3: 2 | C3: config_spirit.cnf|Spirit | D3: 2 | F3: get(id) -> #$ | H3: 2=>id
A4: spirit_enhance.txt | B4: 3 | C4: config_spirit_enhance.cnf|SpiritEnhace | D4: 3 | F4: get(id) -> #$ | H4: 1=>id,enhance_level|enhance_list
A5: spirit_pokedex.txt | B5: 4 | C5: config_spirit_pokedex.cnf|SpiritPokedex | D5: 4 | F5: get(id) -> #$ | H5: 1=>id,pokedex_level|pokedex_list
A6: sprite_train.txt | B6: 5 | C6: config_sprite_train.cnf|SpriteTrain | D6: 5 | F6: get(id) -> #$ | H6: 1=>id,stage|stage_list
A7: sprite_talent_skill.txt | B7: 6 | C7: config_sprite_talent_skill.cnf|SpriteTalentSkill | D7: 6 | F7: get(id) -> #$ | H7: 1=>id,level|skill_list
A8: sprite_star_up.txt | B8: 7 | C8: config_sprite_star_up.cnf|SpriteStarUp | D8: 7 | F8: get(star) -> #$ | H8: 2=>star
A9: sprite_special_property.txt | B9: 8 | C9: config_sprite_special_property.cnf|SpriteSpecialProperty | D9: 8 | F9: get(id) -> #$ | H9: 1=>id,star|star_list
A10: sprite_qualifications.txt | B10: 9 | C10: config_sprite_qualifications.cnf|SpriteQualifications | D10: 9 | F10: get(qualifications) -> #$ | H10: 2=>qualifications

Sheet: 世界之心
A1: stage|stage | B1: level|level | C1: name| | D1: add_pro_type|add_pro_type | E1: add_pro_value|add_pro_value | F1: award_item|award_item | G1: cost_item|cost_item | H1: award_desc| | I1: effect_name| | J1: sp_show_property|
A2: 不可空 | B2: 不可空 | C2: 不可空 | D2: 不可空 | E2: 不可空 | F2: 不可空 | G2: 不可空 | H2: 不可空 | I2: 不可空 | J2: 可空#不需字段
A3: 数字 | B3: 数字 | C3: 字符串 | D3: 一维数组 | E3: 一维数组 | F3: 一维数组 | G3: 一维数组 | H3: 字符串 | I3: 字符串 | J3: 字符串
D4: 不定长 | E4: 不定长 | F4: 不定长 | G4: 不定长
A6: 阶段 | B6: 等级 | C6: 阶段名称 | D6: 增加的属性类型(属性类型|属性类型) | E6: 增加的属性值(属性值|属性值) | F6: 奖励的物品(Id|数量) | G6: 升级消耗物品(物品ID|物品数量) | H6: 奖励的描述 | I6: 特效名称 | J6: 阶段描述
A7: 1 | B7: 1 | C7: 无尽虚空 | D7: 0 | E7: 0 | F7: 13620|1 | G7: 10020|1 | H7: 全体出战英雄攻击+25 | I7: buff_jingling | J7: 天赋属性：血量+250
A8: 1 | B8: 2 | C8: 无尽虚空 | D8: 4 | E8: 250 | F8: 0 | G8: 10020|0 | H8: 全体出战英雄血量+250 | I8: buff_jingling
A9: 2 | B9: 1 | C9: 希望光辉 | D9: 1 | E9: 29 | F9: 0 | G9: 10020|1 | H9: 全体出战英雄攻击+29 | I9: buff_jingling | J9: 天赋属性：血量+292
A10: 2 | B10: 2 | C10: 希望光辉 | D10: 0 | E10: 0 | F10: 19005|100 | G10: 10020|1 | H10: 钻石*100 | I10: buff_jingling
A11: 2 | B11: 3 | C11: 希望光辉 | D11: 4 | E11: 292 | F11: 0 | G11: 10020|0 | H11: 全体出战英雄血量+292 | I11: buff_jingling
A12: 3 | B12: 1 | C12: 璀璨文明 | D12: 1 | E12: 33 | F12: 0 | G12: 10020|1 | H12: 全体出战英雄攻击+33 | I12: buff_jingling
A13: 3 | B13: 2 | C13: 璀璨文明 | D13: 4 | E13: 333 | F13: 0 | G13: 10020|1 | H13: 全体出战英雄血量+333 | I13: buff_jingling
A14: 3 | B14: 3 | C14: 璀璨文明 | D14: 21 | E14: 5 | F14: 0 | G14: 10020|1 | H14: 全体出战英雄怒气+5 | I14: buff_jingling
A15: 3 | B15: 4 | C15: 璀璨文明 | D15: 22|23|24|25 | E15: 100|100|100|100 | F15: 0 | G15: 10020|0 | H15: 出战英雄基础属性+1% | I15: buff_jingling
A16: 4 | B16: 1 | C16: 原生黑洞 | D16: 1 | E16: 38 | F16: 0 | G16: 10020|1 | H16: 全体出战英雄攻击+38 | I16: buff_jingling
A17: 4 | B17: 2 | C17: 原生黑洞 | D17: 2 | E17: 38 | F17: 0 | G17: 10020|1 | H17: 全体出战英雄物防+38 | I17: buff_jingling
A18: 4 | B18: 3 | C18: 原生黑洞 | D18: 3 | E18: 38 | F18: 0 | G18: 10020|1 | H18: 全体出战英雄魔防+38 | I18: buff_jingling
A19: 4 | B19: 4 | C19: 原生黑洞 | D19: 0 | E19: 0 | F19: 19005|150 | G19: 10020|1 | H19: 钻石*150 | I19: buff_jingling
A20: 4 | B20: 5 | C20: 原生黑洞 | D20: 22|23|24|25 | E20: 100|100|100|100 | F20: 0 | G20: 10020|0 | H20: 出战英雄基础属性+1% | I20: buff_jingling
A21: 5 | B21: 1 | C21: 万有引力 | D21: 4 | E21: 417 | F21: 0 | G21: 10020|1 | H21: 全体出战英雄血量+417 | I21: buff_jingling
A22: 5 | B22: 2 | C22: 万有引力 | D22: 1 | E22: 42 | F22: 0 | G22: 10020|1 | H22: 全体出战英雄攻击+42 | I22: buff_jingling
A23: 5 | B23: 3 | C23: 万有引力 | D23: 2 | E23: 42 | F23: 0 | G23: 10020|1 | H23: 全体出战英雄物防+42 | I23: buff_jingling
A24: 5 | B24: 4 | C24: 万有引力 | D24: 3 | E24: 42 | F24: 0 | G24: 10020|1 | H24: 全体出战英雄魔防+42 | I24: buff_jingling
A25: 5 | B25: 5 | C25: 万有引力 | D25: 0 | E25: 0 | F25: 19005|200 | G25: 10020|2 | H25: 钻石*200 | I25: buff_jingling
A26: 5 | B26: 6 | C26: 万有引力 | D26: 22|23|24|25 | E26: 100|100|100|100 | F26: 0 | G26: 10020|0 | H26: 出战英雄基础属性+1% | I26: buff_jingling
A27: 6 | B27: 1 | C27: 绚烂星云 | D27: 4 | E27: 459 | F27: 0 | G27: 10020|1 | H27: 全体出战英雄血量+459 | I27: buff_jingling
A28: 6 | B28: 2 | C28: 绚烂星云 | D28: 1 | E28: 46 | F28: 0 | G28: 10020|1 | H28: 全体出战英雄攻击+46 | I28: buff_jingling
A29: 6 | B29: 3 | C29: 绚烂星云 | D29: 2 | E29: 46 | F29: 0 | G29: 10020|1 | H29: 全体出战英雄物防+46 | I29: buff_jingling
A30: 6 | B30: 4 | C30: 绚烂星云 | D30: 3 | E30: 46 | F30: 0 | G30: 10020|1 | H30: 全体出战英雄魔防+46 | I30: buff_jingling
A31: 6 | B31: 5 | C31: 绚烂星云 | D31: 21 | E31: 5 | F31: 0 | G31: 10020|2 | H31: 全体出战英雄怒气+5 | I31: buff_jingling
A32: 6 | B32: 6 | C32: 绚烂星云 | D32: 22|23|24|25 | E32: 200|200|200|200 | F32: 0 | G32: 10020|0 | H32: 出战英雄基础属性+2% | I32: buff_jingling
A33: 7 | B33: 1 | C33: 灼热恒星 | D33: 4 | E33: 500 | F33: 0 | G33: 10020|2 | H33: 全体出战英雄血量+500 | I33: buff_jingling
A34: 7 | B34: 2 | C34: 灼热恒星 | D34: 1 | E34: 50 | F34: 0 | G34: 10020|2 | H34: 全体出战英雄攻击+50 | I34: buff_jingling
A35: 7 | B35: 3 | C35: 灼热恒星 | D35: 2 | E35: 50 | F35: 0 | G35: 10020|2 | H35: 全体出战英雄物防+50 | I35: buff_jingling
A36: 7 | B36: 4 | C36: 灼热恒星 | D36: 3 | E36: 50 | F36: 0 | G36: 10020|2 | H36: 全体出战英雄魔防+50 | I36: buff_jingling
A37: 7 | B37: 5 | C37: 灼热恒星 | D37: 0 | E37: 0 | F37: 10022|5 | G37: 10020|3 | H37: 灵性精粹*5 | I37: buff_jingling
A38: 7 | B38: 6 | C38: 灼热恒星 | D38: 22|23|24|25 | E38: 200|200|200|200 | F38: 0 | G38: 10020|0 | H38: 出战英雄基础属性+2% | I38: buff_jingling
A39: 8 | B39: 1 | C39: 陨落流星 | D39: 4 | E39: 542 | F39: 0 | G39: 10020|2 | H39: 全体出战英雄血量+542 | I39: buff_jingling
A40: 8 | B40: 2 | C40: 陨落流星 | D40: 1 | E40: 54 | F40: 0 | G40: 10020|2 | H40: 全体出战英雄攻击+54 | I40: buff_jingling
A41: 8 | B41: 3 | C41: 陨落流星 | D41: 2 | E41: 54 | F41: 0 | G41: 10020|2 | H41: 全体出战英雄物防+54 | I41: buff_jingling
A42: 8 | B42: 4 | C42: 陨落流星 | D42: 3 | E42: 54 | F42: 0 | G42: 10020|2 | H42: 全体出战英雄魔防+54 | I42: buff_jingling
A43: 8 | B43: 5 | C43: 陨落流星 | D43: 0 | E43: 0 | F43: 10022|5 | G43: 10020|3 | H43: 灵性精粹*5 | I43: buff_jingling
A44: 8 | B44: 6 | C44: 陨落流星 | D44: 22|23|24|25 | E44: 200|200|200|200 | F44: 0 | G44: 10020|0 | H44: 出战英雄基础属性+2% | I44: buff_jingling
A45: 9 | B45: 1 | C45: 射线洪流 | D45: 4 | E45: 584 | F45: 0 | G45: 10020|2 | H45: 全体出战英雄血量+584 | I45: buff_jingling
A46: 9 | B46: 2 | C46: 射线洪流 | D46: 1 | E46: 58 | F46: 0 | G46: 10020|2 | H46: 全体出战英雄攻击+58 | I46: buff_jingling
A47: 9 | B47: 3 | C47: 射线洪流 | D47: 2 | E47: 58 | F47: 0 | G47: 10020|2 | H47: 全体出战英雄物防+58 | I47: buff_jingling
A48: 9 | B48: 4 | C48: 射线洪流 | D48: 3 | E48: 58 | F48: 0 | G48: 10020|2 | H48: 全体出战英雄魔防+58 | I48: buff_jingling
A49: 9 | B49: 5 | C49: 射线洪流 | D49: 21 | E49: 5 | F49: 0 | G49: 10020|3 | H49: 全体出战英雄怒气+5 | I49: buff_jingling
A50: 9 | B50: 6 | C50: 射线洪流 | D50: 22|23|24|25 | E50: 200|200|200|200 | F50: 0 | G50: 10020|0 | H50: 出战英雄基础属性+2% | I50: buff_jingling
A51: 10 | B51: 1 | C51: 起源元素 | D51: 4 | E51: 625 | F51: 0 | G51: 10020|3 | H51: 全体出战英雄血量+625 | I51: buff_jingling
A52: 10 | B52: 2 | C52: 起源元素 | D52: 1 | E52: 63 | F52: 0 | G52: 10020|3 | H52: 全体出战英雄攻击+63 | I52: buff_jingling
A53: 10 | B53: 3 | C53: 起源元素 | D53: 2 | E53: 63 | F53: 0 | G53: 10020|3 | H53: 全体出战英雄物防+63 | I53: buff_jingling
A54: 10 | B54: 4 | C54: 起源元素 | D54: 3 | E54: 63 | F54: 0 | G54: 10020|3 | H54: 全体出战英雄魔防+63 | I54: buff_jingling
A55: 10 | B55: 5 | C55: 起源元素 | D55: 0 | E55: 0 | F55: 10022|10 | G55: 10020|4 | H55: 灵性精粹*10 | I55: buff_jingling
A56: 10 | B56: 6 | C56: 起源元素 | D56: 22|23|24|25 | E56: 200|200|200|200 | F56: 0 | G56: 10020|0 | H56: 出战英雄基础属性+2% | I56: buff_jingling
A57: 11 | B57: 1 | C57: 星辰长河 | D57: 4 | E57: 667 | F57: 0 | G57: 10020|3 | H57: 全体出战英雄血量+667 | I57: buff_jingling
A58: 11 | B58: 2 | C58: 星辰长河 | D58: 1 | E58: 67 | F58: 0 | G58: 10020|3 | H58: 全体出战英雄攻击+67 | I58: buff_jingling
A59: 11 | B59: 3 | C59: 星辰长河 | D59: 2 | E59: 67 | F59: 0 | G59: 10020|3 | H59: 全体出战英雄物防+67 | I59: buff_jingling
A60: 11 | B60: 4 | C60: 星辰长河 | D60: 3 | E60: 67 | F60: 0 | G60: 10020|3 | H60: 全体出战英雄魔防+67 | I60: buff_jingling
A61: 11 | B61: 5 | C61: 星辰长河 | D61: 0 | E61: 0 | F61: 10022|10 | G61: 10020|4 | H61: 灵性精粹*10 | I61: buff_jingling
A62: 11 | B62: 6 | C62: 星辰长河 | D62: 22|23|24|25 | E62: 300|300|300|300 | F62: 0 | G62: 10020|0 | H62: 出战英雄基础属性+3% | I62: buff_jingling
A63: 12 | B63: 1 | C63: 星空巨兽 | D63: 4 | E63: 709 | F63: 0 | G63: 10020|3 | H63: 全体出战英雄血量+709 | I63: buff_jingling
A64: 12 | B64: 2 | C64: 星空巨兽 | D64: 1 | E64: 71 | F64: 0 | G64: 10020|3 | H64: 全体出战英雄攻击+71 | I64: buff_jingling
A65: 12 | B65: 3 | C65: 星空巨兽 | D65: 2 | E65: 71 | F65: 0 | G65: 10020|3 | H65: 全体出战英雄物防+71 | I65: buff_jingling
A66: 12 | B66: 4 | C66: 星空巨兽 | D66: 3 | E66: 71 | F66: 0 | G66: 10020|3 | H66: 全体出战英雄魔防+71 | I66: buff_jingling
A67: 12 | B67: 5 | C67: 星空巨兽 | D67: 0 | E67: 0 | F67: 10022|10 | G67: 10020|4 | H67: 灵性精粹*10 | I67: buff_jingling
A68: 12 | B68: 6 | C68: 星空巨兽 | D68: 22|23|24|25 | E68: 300|300|300|300 | F68: 0 | G68: 10020|0 | H68: 出战英雄基础属性+3% | I68: buff_jingling
A69: 13 | B69: 1 | C69: 黑暗星域 | D69: 4 | E69: 750 | F69: 0 | G69: 10020|4 | H69: 全体出战英雄血量+750 | I69: buff_jingling
A70: 13 | B70: 2 | C70: 黑暗星域 | D70: 1 | E70: 75 | F70: 0 | G70: 10020|4 | H70: 全体出战英雄攻击+75 | I70: buff_jingling
A71: 13 | B71: 3 | C71: 黑暗星域 | D71: 2 | E71: 75 | F71: 0 | G71: 10020|4 | H71: 全体出战英雄物防+75 | I71: buff_jingling
A72: 13 | B72: 4 | C72: 黑暗星域 | D72: 3 | E72: 75 | F72: 0 | G72: 10020|4 | H72: 全体出战英雄魔防+75 | I72: buff_jingling
A73: 13 | B73: 5 | C73: 黑暗星域 | D73: 21 | E73: 5 | F73: 0 | G73: 10020|5 | H73: 全体出战英雄怒气+5 | I73: buff_jingling
A74: 13 | B74: 6 | C74: 黑暗星域 | D74: 22|23|24|25 | E74: 300|300|300|300 | F74: 0 | G74: 10020|0 | H74: 出战英雄基础属性+3% | I74: buff_jingling
A75: 14 | B75: 1 | C75: 终极混沌 | D75: 4 | E75: 792 | F75: 0 | G75: 10020|4 | H75: 全体出战英雄血量+792 | I75: buff_jingling
A76: 14 | B76: 2 | C76: 终极混沌 | D76: 1 | E76: 79 | F76: 0 | G76: 10020|4 | H76: 全体出战英雄攻击+79 | I76: buff_jingling
A77: 14 | B77: 3 | C77: 终极混沌 | D77: 2 | E77: 79 | F77: 0 | G77: 10020|4 | H77: 全体出战英雄物防+79 | I77: buff_jingling
A78: 14 | B78: 4 | C78: 终极混沌 | D78: 3 | E78: 79 | F78: 0 | G78: 10020|4 | H78: 全体出战英雄魔防+79 | I78: buff_jingling
A79: 14 | B79: 5 | C79: 终极混沌 | D79: 0 | E79: 0 | F79: 10022|10 | G79: 10020|5 | H79: 灵性精粹*10 | I79: buff_jingling
A80: 14 | B80: 6 | C80: 终极混沌 | D80: 22|23|24|25 | E80: 300|300|300|300 | F80: 0 | G80: 10020|0 | H80: 出战英雄基础属性+3% | I80: buff_jingling
A81: 15 | B81: 1 | C81: 智慧曙光 | D81: 4 | E81: 834 | F81: 0 | G81: 10020|4 | H81: 全体出战英雄血量+834 | I81: buff_jingling
A82: 15 | B82: 2 | C82: 智慧曙光 | D82: 1 | E82: 83 | F82: 0 | G82: 10020|4 | H82: 全体出战英雄攻击+83 | I82: buff_jingling
A83: 15 | B83: 3 | C83: 智慧曙光 | D83: 2 | E83: 83 | F83: 0 | G83: 10020|4 | H83: 全体出战英雄物防+83 | I83: buff_jingling
A84: 15 | B84: 4 | C84: 智慧曙光 | D84: 3 | E84: 83 | F84: 0 | G84: 10020|4 | H84: 全体出战英雄魔防+83 | I84: buff_jingling
A85: 15 | B85: 5 | C85: 智慧曙光 | D85: 0 | E85: 0 | F85: 10022|10 | G85: 10020|5 | H85: 灵性精粹*10 | I85: buff_jingling
A86: 15 | B86: 6 | C86: 智慧曙光 | D86: 22|23|24|25 | E86: 300|300|300|300 | F86: 0 | G86: 10020|0 | H86: 出战英雄基础属性+3% | I86: buff_jingling
A87: 16 | B87: 1 | C87: 永恒生命 | D87: 4 | E87: 875 | F87: 0 | G87: 10020|5 | H87: 全体出战英雄血量+875 | I87: buff_jingling
A88: 16 | B88: 2 | C88: 永恒生命 | D88: 1 | E88: 88 | F88: 0 | G88: 10020|5 | H88: 全体出战英雄攻击+88 | I88: buff_jingling
A89: 16 | B89: 3 | C89: 永恒生命 | D89: 2 | E89: 88 | F89: 0 | G89: 10020|5 | H89: 全体出战英雄物防+88 | I89: buff_jingling
A90: 16 | B90: 4 | C90: 永恒生命 | D90: 3 | E90: 88 | F90: 0 | G90: 10020|5 | H90: 全体出战英雄魔防+88 | I90: buff_jingling
A91: 16 | B91: 5 | C91: 永恒生命 | D91: 0 | E91: 0 | F91: 10022|10 | G91: 10020|6 | H91: 灵性精粹*10 | I91: buff_jingling
A92: 16 | B92: 6 | C92: 永恒生命 | D92: 22|23|24|25 | E92: 400|400|400|400 | F92: 0 | G92: 10020|0 | H92: 出战英雄基础属性+4% | I92: buff_jingling
A93: 17 | B93: 1 | C93: 湮灭之地 | D93: 4 | E93: 917 | F93: 0 | G93: 10020|5 | H93: 全体出战英雄血量+917 | I93: buff_jingling
A94: 17 | B94: 2 | C94: 湮灭之地 | D94: 1 | E94: 92 | F94: 0 | G94: 10020|5 | H94: 全体出战英雄攻击+92 | I94: buff_jingling
A95: 17 | B95: 3 | C95: 湮灭之地 | D95: 2 | E95: 92 | F95: 0 | G95: 10020|5 | H95: 全体出战英雄物防+92 | I95: buff_jingling
A96: 17 | B96: 4 | C96: 湮灭之地 | D96: 3 | E96: 92 | F96: 0 | G96: 10020|5 | H96: 全体出战英雄魔防+92 | I96: buff_jingling
A97: 17 | B97: 5 | C97: 湮灭之地 | D97: 0 | E97: 0 | F97: 10022|10 | G97: 10020|6 | H97: 灵性精粹*10 | I97: buff_jingling
A98: 17 | B98: 6 | C98: 湮灭之地 | D98: 22|23|24|25 | E98: 400|400|400|400 | F98: 0 | G98: 10020|0 | H98: 出战英雄基础属性+4% | I98: buff_jingling
A99: 18 | B99: 1 | C99: 亡者低语 | D99: 4 | E99: 959 | F99: 0 | G99: 10020|5 | H99: 全体出战英雄血量+959 | I99: buff_jingling
A100: 18 | B100: 2 | C100: 亡者低语 | D100: 1 | E100: 96 | F100: 0 | G100: 10020|5 | H100: 全体出战英雄攻击+96 | I100: buff_jingling
A101: 18 | B101: 3 | C101: 亡者低语 | D101: 2 | E101: 96 | F101: 0 | G101: 10020|5 | H101: 全体出战英雄物防+96 | I101: buff_jingling
A102: 18 | B102: 4 | C102: 亡者低语 | D102: 3 | E102: 96 | F102: 0 | G102: 10020|5 | H102: 全体出战英雄魔防+96 | I102: buff_jingling
A103: 18 | B103: 5 | C103: 亡者低语 | D103: 0 | E103: 0 | F103: 10022|10 | G103: 10020|6 | H103: 灵性精粹*10 | I103: buff_jingling
A104: 18 | B104: 6 | C104: 亡者低语 | D104: 22|23|24|25 | E104: 400|400|400|400 | F104: 0 | G104: 10020|0 | H104: 出战英雄基础属性+4% | I104: buff_jingling
A105: 19 | B105: 1 | C105: 末日彼岸 | D105: 4 | E105: 1000 | F105: 0 | G105: 10020|6 | H105: 全体出战英雄血量+1000 | I105: buff_jingling
A106: 19 | B106: 2 | C106: 末日彼岸 | D106: 1 | E106: 100 | F106: 0 | G106: 10020|6 | H106: 全体出战英雄攻击+100 | I106: buff_jingling
A107: 19 | B107: 3 | C107: 末日彼岸 | D107: 2 | E107: 100 | F107: 0 | G107: 10020|6 | H107: 全体出战英雄物防+100 | I107: buff_jingling
A108: 19 | B108: 4 | C108: 末日彼岸 | D108: 3 | E108: 100 | F108: 0 | G108: 10020|6 | H108: 全体出战英雄魔防+100 | I108: buff_jingling
A109: 19 | B109: 5 | C109: 末日彼岸 | D109: 0 | E109: 0 | F109: 10022|10 | G109: 10020|7 | H109: 灵性精粹*10 | I109: buff_jingling
A110: 19 | B110: 6 | C110: 末日彼岸 | D110: 22|23|24|25 | E110: 400|400|400|400 | F110: 0 | G110: 10020|0 | H110: 出战英雄基础属性+4% | I110: buff_jingling

Sheet: 精灵
A1: id|id | B1: name| | C1: sort_id| | D1: pokedex_id|pokedex_id | E1: appear_skill_id| | F1: bless_skill_icon| | G1: auto_skill_id| | H1: special_skill_id| | I1: common_skill_id| | J1: quality| | K1: approach| | M1: icon_id| | N1: model_type| | O1: model_id| | P1: init_move_speed| | Q1: battle_scale| | R1: systemid| | S1: init_star|init_star | T1: star_max|star_max | U1: qualifications|qualifications | V1: star_up_cost_item_id|star_up_cost_item_id | W1: fragment_num|fragment_num | X1: bless_effect_id| | Y1: down_bless_effect_id|
A2: 不可空 | B2: 不可空 | C2: 不可空 | D2: 不可空 | E2: 可空#不需字段 | F2: 不可空 | G2: 不可空 | H2: 不可空 | I2: 不可空 | J2: 不可空 | K2: 不可空 | M2: 不可空 | N2: 不可空 | O2: 不可空 | P2: 不可空 | Q2: 可空#不需字段 | R2: 可空#不需字段 | S2: 不可空 | T2: 不可空 | U2: 不可空 | V2: 不可空 | W2: 不可空 | X2: 可空#不需字段 | Y2: 可空#不需字段
A3: 数字 | B3: 字符串 | C3: 数字 | D3: 数字 | E3: 数字 | F3: 数字 | G3: 数字 | H3: 数字 | I3: 数字 | J3: 数字 | K3: 字符串 | M3: 数字 | N3: 字符串 | O3: 数字 | P3: 数字 | Q3: 数字 | R3: 一维数组 | S3: 数字 | T3: 数字 | U3: 一维数组 | V3: 数字 | W3: 数字 | X3: 数字 | Y3: 数字
R4: 不定长 | U4: 不定长
A6: 精灵ID | B6: 精灵名称 | C6: 排序ID | D6: 所属的图鉴ID | E6: 出场效果技能ID | F6: 祝福技能图标 | G6: 自动技能ID | H6: 特殊技能ID | I6: 通用技能ID | J6: 品质 | K6: 获取途径 | M6: 头像id | N6: 模型类型 | O6: 模型ID | P6: 初始移动速度 | Q6: 战斗缩放系数 | R6: 获取途径 | S6: 初始星数 | T6: 星数上限 | U6: 精灵资质 | V6: 升星消耗的物品ID(碎片) | W6: 重复激活返还碎片数量 | X6: 祝福特效ID | Y6: 下层祝福特效ID
A7: 50001 | B7: 希望精灵 | C7: 1 | D7: 1 | E7: 500011 | F7: 500012 | G7: 500013 | H7: 500014 | I7: 500015 | J7: 1 | K7: 点亮世界之心激活 | L7: 点亮世界之心激活 | M7: 50001 | N7: sprite | O7: 50001 | P7: 100 | Q7: 0.5 | S7: 0 | T7: 2 | U7: =RC[5]&"|"&RC[5]+2&IF(RC[-1]>1,"|"&RC[5]+5&IF(RC[-1]>2,"|"&RC[5]+9&IF(RC[-1]>3,"|"&RC[5]+14&IF(RC[-1]>4,"|"&RC[5]+20,""),""),""),"") -> 10|12|15 | V7: 15001 | W7: 30 | X7: 500012 | Z7: 10
A8: 50002 | B8: 绝境梦魇 | C8: 6 | D8: 1 | E8: 500021 | F8: 500022 | G8: 500023 | H8: 500024 | I8: 500025 | J8: 3 | K8: 敬请期待 | L8: 深渊商店兑换合成 | M8: 50000 | N8: sprite | O8: 50001 | P8: 100 | Q8: 0.5 | S8: 0 | T8: 3 | U8: =RC[5]&"|"&RC[5]+2&IF(RC[-1]>1,"|"&RC[5]+5&IF(RC[-1]>2,"|"&RC[5]+9&IF(RC[-1]>3,"|"&RC[5]+14&IF(RC[-1]>4,"|"&RC[5]+20,""),""),""),"") -> 14|16|19|23 | V8: 15002 | W8: 30 | Z8: 14
A9: 50011 | B9: 炼狱灵龙 | C9: 2 | D9: 2 | E9: 500111 | F9: 500112 | G9: 500113 | H9: 500114 | I9: 500115 | J9: 3 | K9: 充值礼包中获得 | L9: 充值礼包中获得 | M9: 50011 | N9: sprite | O9: 50011 | P9: 100 | Q9: 0.5 | S9: 0 | T9: 3 | U9: =RC[5]&"|"&RC[5]+2&IF(RC[-1]>1,"|"&RC[5]+5&IF(RC[-1]>2,"|"&RC[5]+9&IF(RC[-1]>3,"|"&RC[5]+14&IF(RC[-1]>4,"|"&RC[5]+20,""),""),""),"") -> 18|20|23|27 | V9: 15011 | W9: 90 | X9: 500112 | Z9: 18
A10: 50012 | B10: 深海女王 | C10: 3 | D10: 2 | E10: 500121 | F10: 500122 | G10: 500123 | H10: 500124 | I10: 500125 | J10: 3 | K10: 限时活动中获得 | L10: 限时活动中获得 | M10: 50012 | N10: sprite | O10: 50012 | P10: 100 | Q10: 0.5 | R10: 128 | S10: 0 | T10: 3 | U10: =RC[5]&"|"&RC[5]+2&IF(RC[-1]>1,"|"&RC[5]+5&IF(RC[-1]>2,"|"&RC[5]+9&IF(RC[-1]>3,"|"&RC[5]+14&IF(RC[-1]>4,"|"&RC[5]+20,""),""),""),"") -> 19|21|24|28 | V10: 15012 | W10: 90 | Y10: 5001225 | Z10: 19
A11: 50021 | B11: 暴风元灵 | C11: 7 | D11: 3 | E11: 500211 | F11: 500212 | G11: 500213 | H11: 500214 | I11: 500215 | J11: 3 | K11: 敬请期待 | L11: 限时活动中兑换合成 | M11: 50000 | N11: sprite | O11: 50001 | P11: 100 | Q11: 0.5 | S11: 0 | T11: 3 | U11: =RC[5]&"|"&RC[5]+2&IF(RC[-1]>1,"|"&RC[5]+5&IF(RC[-1]>2,"|"&RC[5]+9&IF(RC[-1]>3,"|"&RC[5]+14&IF(RC[-1]>4,"|"&RC[5]+20,""),""),""),"") -> 16|18|21|25 | V11: 15021 | W11: 30 | Z11: 16
A12: 50022 | B12: 大地之子 | C12: 5 | D12: 3 | E12: 500221 | F12: 500222 | G12: 500223 | H12: 500224 | I12: 500225 | J12: 3 | K12: 军团商店兑换合成 | L12: 军团商店兑换合成 | M12: 50022 | N12: sprite | O12: 50022 | P12: 100 | Q12: 0.5 | R12: 69 | S12: 0 | T12: 3 | U12: =RC[5]&"|"&RC[5]+2&IF(RC[-1]>1,"|"&RC[5]+5&IF(RC[-1]>2,"|"&RC[5]+9&IF(RC[-1]>3,"|"&RC[5]+14&IF(RC[-1]>4,"|"&RC[5]+20,""),""),""),"") -> 14|16|19|23 | V12: 15022 | W12: 30 | X12: 500222 | Z12: 14
A13: 50031 | B13: 花之妖精 | C13: 4 | D13: 4 | E13: 500311 | F13: 500312 | G13: 500313 | H13: 500314 | I13: 500315 | J13: 3 | K13: 七天活动中获得 | L13: 七天活动中获得 | M13: 50031 | N13: sprite | O13: 50031 | P13: 100 | Q13: 0.5 | R13: 59|52 | S13: 0 | T13: 3 | U13: =RC[5]&"|"&RC[5]+2&IF(RC[-1]>1,"|"&RC[5]+5&IF(RC[-1]>2,"|"&RC[5]+9&IF(RC[-1]>3,"|"&RC[5]+14&IF(RC[-1]>4,"|"&RC[5]+20,""),""),""),"") -> 12|14|17|21 | V13: 15031 | W13: 30 | X13: 500312 | Z13: 12
A14: 50032 | B14: 森之古树 | C14: 8 | D14: 4 | E14: 500321 | F14: 500322 | G14: 500323 | H14: 500324 | I14: 500325 | J14: 3 | K14: 敬请期待 | L14: 敬请期待 | M14: 50000 | N14: sprite | O14: 50031 | P14: 100 | Q14: 0.5 | S14: 0 | T14: 3 | U14: =RC[5]&"|"&RC[5]+2&IF(RC[-1]>1,"|"&RC[5]+5&IF(RC[-1]>2,"|"&RC[5]+9&IF(RC[-1]>3,"|"&RC[5]+14&IF(RC[-1]>4,"|"&RC[5]+20,""),""),""),"") -> 12|14|17|21 | V14: 15032 | W14: 30 | Z14: 12

Sheet: 精灵强化
A1: id|id | B1: enhance_level|enhance_level | C1: cost_item_id_list|cost_item_id_list | D1: cost_item_num_list|cost_item_num_list | E1: pro_type_list|pro_type_list | F1: pro_value_list|pro_value_list | G1: need_level|
A2: 不可空 | B2: 不可空 | C2: 不可空 | D2: 不可空 | E2: 不可空 | F2: 不可空 | G2: 不可空
A3: 数字 | B3: 数字 | C3: 一维数组 | D3: 一维数组 | E3: 一维数组 | F3: 一维数组 | G3: 数字
C4: 不定长 | D4: 不定长 | E4: 不定长 | F4: 不定长
A6: 精灵ID | B6: 强化等级 | C6: 消耗道具Id列表 | D6: 消耗道具数量列表 | E6: 当前级总属性类型列表 | F6: 当前级总属性值列表 | G6: 所需玩家等级
A7: 50001 | B7: 0 | C7: 10022 | D7: 5 | E7: 4|1|2|3 | F7: 2800|40|40|40 | G7: 23
A8: 50001 | B8: 1 | C8: 10022 | D8: 5 | E8: 4|1|2|3 | F8: 4200|60|60|60 | G8: 23
A9: 50001 | B9: 2 | C9: 10022 | D9: 10 | E9: 4|1|2|3 | F9: 5600|80|80|80 | G9: 23
A10: 50001 | B10: 3 | C10: 10022 | D10: 10 | E10: 4|1|2|3 | F10: 7000|100|100|100 | G10: 23
A11: 50001 | B11: 4 | C11: 10022 | D11: 15 | E11: 4|1|2|3 | F11: 8400|120|120|120 | G11: 23
A12: 50001 | B12: 5 | C12: 10022 | D12: 15 | E12: 4|1|2|3 | F12: 9800|140|140|140 | G12: 23
A13: 50001 | B13: 6 | C13: 10022 | D13: 20 | E13: 4|1|2|3 | F13: 11200|160|160|160 | G13: 23
A14: 50001 | B14: 7 | C14: 10022 | D14: 20 | E14: 4|1|2|3 | F14: 12600|180|180|180 | G14: 23
A15: 50001 | B15: 8 | C15: 10022 | D15: 25 | E15: 4|1|2|3 | F15: 14000|200|200|200 | G15: 23
A16: 50001 | B16: 9 | C16: 10022 | D16: 25 | E16: 4|1|2|3 | F16: 15400|220|220|220 | G16: 23
A17: 50001 | B17: 10 | C17: 10022 | D17: 30 | E17: 4|1|2|3 | F17: 16800|240|240|240 | G17: 30
A18: 50001 | B18: 11 | C18: 10022 | D18: 30 | E18: 4|1|2|3 | F18: 18900|270|270|270 | G18: 30
A19: 50001 | B19: 12 | C19: 10022 | D19: 35 | E19: 4|1|2|3 | F19: 21000|300|300|300 | G19: 30
A20: 50001 | B20: 13 | C20: 10022 | D20: 35 | E20: 4|1|2|3 | F20: 23100|330|330|330 | G20: 30
A21: 50001 | B21: 14 | C21: 10022 | D21: 40 | E21: 4|1|2|3 | F21: 25200|360|360|360 | G21: 30
A22: 50001 | B22: 15 | C22: 10022 | D22: 40 | E22: 4|1|2|3 | F22: 27300|390|390|390 | G22: 30
A23: 50001 | B23: 16 | C23: 10022 | D23: 45 | E23: 4|1|2|3 | F23: 29400|420|420|420 | G23: 30
A24: 50001 | B24: 17 | C24: 10022 | D24: 45 | E24: 4|1|2|3 | F24: 31500|450|450|450 | G24: 30
A25: 50001 | B25: 18 | C25: 10022 | D25: 50 | E25: 4|1|2|3 | F25: 33600|480|480|480 | G25: 30
A26: 50001 | B26: 19 | C26: 10022 | D26: 55 | E26: 4|1|2|3 | F26: 35700|510|510|510 | G26: 30
A27: 50001 | B27: 20 | C27: 10022 | D27: 60 | E27: 4|1|2|3 | F27: 37800|540|540|540 | G27: 35
A28: 50001 | B28: 21 | C28: 10022 | D28: 65 | E28: 4|1|2|3 | F28: 40600|580|580|580 | G28: 35
A29: 50001 | B29: 22 | C29: 10022 | D29: 70 | E29: 4|1|2|3 | F29: 43400|620|620|620 | G29: 35
A30: 50001 | B30: 23 | C30: 10022 | D30: 75 | E30: 4|1|2|3 | F30: 46200|660|660|660 | G30: 35
A31: 50001 | B31: 24 | C31: 10022 | D31: 80 | E31: 4|1|2|3 | F31: 49000|700|700|700 | G31: 35
A32: 50001 | B32: 25 | C32: 10022 | D32: 85 | E32: 4|1|2|3 | F32: 51800|740|740|740 | G32: 35
A33: 50001 | B33: 26 | C33: 10022 | D33: 90 | E33: 4|1|2|3 | F33: 54600|780|780|780 | G33: 35
A34: 50001 | B34: 27 | C34: 10022 | D34: 95 | E34: 4|1|2|3 | F34: 57400|820|820|820 | G34: 35
A35: 50001 | B35: 28 | C35: 10022 | D35: 100 | E35: 4|1|2|3 | F35: 60200|860|860|860 | G35: 35
A36: 50001 | B36: 29 | C36: 10022 | D36: 110 | E36: 4|1|2|3 | F36: 63000|900|900|900 | G36: 35
A37: 50001 | B37: 30 | C37: 10022 | D37: 120 | E37: 4|1|2|3 | F37: 65800|940|940|940 | G37: 40
A38: 50001 | B38: 31 | C38: 10022 | D38: 130 | E38: 4|1|2|3 | F38: 69300|990|990|990 | G38: 40
A39: 50001 | B39: 32 | C39: 10022 | D39: 140 | E39: 4|1|2|3 | F39: 72800|1040|1040|1040 | G39: 40
A40: 50001 | B40: 33 | C40: 10022 | D40: 150 | E40: 4|1|2|3 | F40: 76300|1090|1090|1090 | G40: 40
A41: 50001 | B41: 34 | C41: 10022 | D41: 160 | E41: 4|1|2|3 | F41: 79800|1140|1140|1140 | G41: 40
A42: 50001 | B42: 35 | C42: 10022 | D42: 170 | E42: 4|1|2|3 | F42: 83300|1190|1190|1190 | G42: 40
A43: 50001 | B43: 36 | C43: 10022 | D43: 180 | E43: 4|1|2|3 | F43: 86800|1240|1240|1240 | G43: 40
A44: 50001 | B44: 37 | C44: 10022 | D44: 190 | E44: 4|1|2|3 | F44: 90300|1290|1290|1290 | G44: 40
A45: 50001 | B45: 38 | C45: 10022 | D45: 200 | E45: 4|1|2|3 | F45: 93800|1340|1340|1340 | G45: 40
A46: 50001 | B46: 39 | C46: 10022 | D46: 215 | E46: 4|1|2|3 | F46: 97300|1390|1390|1390 | G46: 40
A47: 50001 | B47: 40 | C47: 10022 | D47: 230 | E47: 4|1|2|3 | F47: 100800|1440|1440|1440 | G47: 45
A48: 50001 | B48: 41 | C48: 10022 | D48: 245 | E48: 4|1|2|3 | F48: 105000|1500|1500|1500 | G48: 45
A49: 50001 | B49: 42 | C49: 10022 | D49: 260 | E49: 4|1|2|3 | F49: 109200|1560|1560|1560 | G49: 45
A50: 50001 | B50: 43 | C50: 10022 | D50: 275 | E50: 4|1|2|3 | F50: 113400|1620|1620|1620 | G50: 45
A51: 50001 | B51: 44 | C51: 10022 | D51: 290 | E51: 4|1|2|3 | F51: 117600|1680|1680|1680 | G51: 45
A52: 50001 | B52: 45 | C52: 10022 | D52: 305 | E52: 4|1|2|3 | F52: 121800|1740|1740|1740 | G52: 45
A53: 50001 | B53: 46 | C53: 10022 | D53: 320 | E53: 4|1|2|3 | F53: 126000|1800|1800|1800 | G53: 45
A54: 50001 | B54: 47 | C54: 10022 | D54: 335 | E54: 4|1|2|3 | F54: 130200|1860|1860|1860 | G54: 45
A55: 50001 | B55: 48 | C55: 10022 | D55: 350 | E55: 4|1|2|3 | F55: 134400|1920|1920|1920 | G55: 45
A56: 50001 | B56: 49 | C56: 10022 | D56: 370 | E56: 4|1|2|3 | F56: 138600|1980|1980|1980 | G56: 45
A57: 50001 | B57: 50 | C57: 10022 | D57: 390 | E57: 4|1|2|3 | F57: 142800|2040|2040|2040 | G57: 50
A58: 50001 | B58: 51 | C58: 10022 | D58: 410 | E58: 4|1|2|3 | F58: 147700|2110|2110|2110 | G58: 50
A59: 50001 | B59: 52 | C59: 10022 | D59: 430 | E59: 4|1|2|3 | F59: 152600|2180|2180|2180 | G59: 50
A60: 50001 | B60: 53 | C60: 10022 | D60: 450 | E60: 4|1|2|3 | F60: 157500|2250|2250|2250 | G60: 50
A61: 50001 | B61: 54 | C61: 10022 | D61: 470 | E61: 4|1|2|3 | F61: 162400|2320|2320|2320 | G61: 50
A62: 50001 | B62: 55 | C62: 10022 | D62: 490 | E62: 4|1|2|3 | F62: 167300|2390|2390|2390 | G62: 50
A63: 50001 | B63: 56 | C63: 10022 | D63: 510 | E63: 4|1|2|3 | F63: 172200|2460|2460|2460 | G63: 50
A64: 50001 | B64: 57 | C64: 10022 | D64: 530 | E64: 4|1|2|3 | F64: 177100|2530|2530|2530 | G64: 50
A65: 50001 | B65: 58 | C65: 10022 | D65: 550 | E65: 4|1|2|3 | F65: 182000|2600|2600|2600 | G65: 50
A66: 50001 | B66: 59 | C66: 10022 | D66: 575 | E66: 4|1|2|3 | F66: 186900|2670|2670|2670 | G66: 50
A67: 50001 | B67: 60 | C67: 10022 | D67: 600 | E67: 4|1|2|3 | F67: 191800|2740|2740|2740 | G67: 55
A68: 50001 | B68: 61 | C68: 10022 | D68: 625 | E68: 4|1|2|3 | F68: 197400|2820|2820|2820 | G68: 55
A69: 50001 | B69: 62 | C69: 10022 | D69: 650 | E69: 4|1|2|3 | F69: 203000|2900|2900|2900 | G69: 55
A70: 50001 | B70: 63 | C70: 10022 | D70: 675 | E70: 4|1|2|3 | F70: 208600|2980|2980|2980 | G70: 55
A71: 50001 | B71: 64 | C71: 10022 | D71: 700 | E71: 4|1|2|3 | F71: 214200|3060|3060|3060 | G71: 55
A72: 50001 | B72: 65 | C72: 10022 | D72: 725 | E72: 4|1|2|3 | F72: 219800|3140|3140|3140 | G72: 55
A73: 50001 | B73: 66 | C73: 10022 | D73: 750 | E73: 4|1|2|3 | F73: 225400|3220|3220|3220 | G73: 55
A74: 50001 | B74: 67 | C74: 10022 | D74: 775 | E74: 4|1|2|3 | F74: 231000|3300|3300|3300 | G74: 55
A75: 50001 | B75: 68 | C75: 10022 | D75: 800 | E75: 4|1|2|3 | F75: 236600|3380|3380|3380 | G75: 55
A76: 50001 | B76: 69 | C76: 10022 | D76: 830 | E76: 4|1|2|3 | F76: 242200|3460|3460|3460 | G76: 55
A77: 50001 | B77: 70 | C77: 10022 | D77: 860 | E77: 4|1|2|3 | F77: 247800|3540|3540|3540 | G77: 60
A78: 50001 | B78: 71 | C78: 10022 | D78: 890 | E78: 4|1|2|3 | F78: 254100|3630|3630|3630 | G78: 60
A79: 50001 | B79: 72 | C79: 10022 | D79: 920 | E79: 4|1|2|3 | F79: 260400|3720|3720|3720 | G79: 60
A80: 50001 | B80: 73 | C80: 10022 | D80: 950 | E80: 4|1|2|3 | F80: 266700|3810|3810|3810 | G80: 60
A81: 50001 | B81: 74 | C81: 10022 | D81: 980 | E81: 4|1|2|3 | F81: 273000|3900|3900|3900 | G81: 60
A82: 50001 | B82: 75 | C82: 10022 | D82: 1010 | E82: 4|1|2|3 | F82: 279300|3990|3990|3990 | G82: 60
A83: 50001 | B83: 76 | C83: 10022 | D83: 1040 | E83: 4|1|2|3 | F83: 285600|4080|4080|4080 | G83: 60
A84: 50001 | B84: 77 | C84: 10022 | D84: 1070 | E84: 4|1|2|3 | F84: 291900|4170|4170|4170 | G84: 60
A85: 50001 | B85: 78 | C85: 10022 | D85: 1100 | E85: 4|1|2|3 | F85: 298200|4260|4260|4260 | G85: 60
A86: 50001 | B86: 79 | C86: 10022 | D86: 1135 | E86: 4|1|2|3 | F86: 304500|4350|4350|4350 | G86: 60
A87: 50001 | B87: 80 | C87: 10022 | D87: 1170 | E87: 4|1|2|3 | F87: 310800|4440|4440|4440 | G87: 65
A88: 50001 | B88: 81 | C88: 10022 | D88: 1205 | E88: 4|1|2|3 | F88: 317800|4540|4540|4540 | G88: 65
A89: 50001 | B89: 82 | C89: 10022 | D89: 1240 | E89: 4|1|2|3 | F89: 324800|4640|4640|4640 | G89: 65
A90: 50001 | B90: 83 | C90: 10022 | D90: 1275 | E90: 4|1|2|3 | F90: 331800|4740|4740|4740 | G90: 65
A91: 50001 | B91: 84 | C91: 10022 | D91: 1310 | E91: 4|1|2|3 | F91: 338800|4840|4840|4840 | G91: 65
A92: 50001 | B92: 85 | C92: 10022 | D92: 1345 | E92: 4|1|2|3 | F92: 345800|4940|4940|4940 | G92: 65
A93: 50001 | B93: 86 | C93: 10022 | D93: 1380 | E93: 4|1|2|3 | F93: 352800|5040|5040|5040 | G93: 65
A94: 50001 | B94: 87 | C94: 10022 | D94: 1415 | E94: 4|1|2|3 | F94: 359800|5140|5140|5140 | G94: 65
A95: 50001 | B95: 88 | C95: 10022 | D95: 1450 | E95: 4|1|2|3 | F95: 366800|5240|5240|5240 | G95: 65
A96: 50001 | B96: 89 | C96: 10022 | D96: 1490 | E96: 4|1|2|3 | F96: 373800|5340|5340|5340 | G96: 65
A97: 50001 | B97: 90 | C97: 10022 | D97: 1530 | E97: 4|1|2|3 | F97: 380800|5440|5440|5440 | G97: 70
A98: 50001 | B98: 91 | C98: 10022 | D98: 1570 | E98: 4|1|2|3 | F98: 388500|5550|5550|5550 | G98: 70
A99: 50001 | B99: 92 | C99: 10022 | D99: 1610 | E99: 4|1|2|3 | F99: 396200|5660|5660|5660 | G99: 70
A100: 50001 | B100: 93 | C100: 10022 | D100: 1650 | E100: 4|1|2|3 | F100: 403900|5770|5770|5770 | G100: 70
A101: 50001 | B101: 94 | C101: 10022 | D101: 1690 | E101: 4|1|2|3 | F101: 411600|5880|5880|5880 | G101: 70
A102: 50001 | B102: 95 | C102: 10022 | D102: 1730 | E102: 4|1|2|3 | F102: 419300|5990|5990|5990 | G102: 70
A103: 50001 | B103: 96 | C103: 10022 | D103: 1770 | E103: 4|1|2|3 | F103: 427000|6100|6100|6100 | G103: 70
A104: 50001 | B104: 97 | C104: 10022 | D104: 1810 | E104: 4|1|2|3 | F104: 434700|6210|6210|6210 | G104: 70
A105: 50001 | B105: 98 | C105: 10022 | D105: 1850 | E105: 4|1|2|3 | F105: 442400|6320|6320|6320 | G105: 70
A106: 50001 | B106: 99 | C106: 10022 | D106: 1900 | E106: 4|1|2|3 | F106: 450100|6430|6430|6430 | G106: 70
A107: 50001 | B107: 100 | C107: 10022 | D107: 0 | E107: 4|1|2|3 | F107: 457800|6540|6540|6540 | G107: 75
A108: 50002 | B108: 0 | C108: 10022 | D108: 5 | E108: 4|1|2|3 | F108: 2800|40|40|40 | G108: =R[-101]C -> 23
A109: 50002 | B109: 1 | C109: 10022 | D109: 5 | E109: 4|1|2|3 | F109: 4200|60|60|60 | G109: =R[-101]C -> 23
A110: 50002 | B110: 2 | C110: 10022 | D110: 10 | E110: 4|1|2|3 | F110: 5600|80|80|80 | G110: =R[-101]C -> 23
A111: 50002 | B111: 3 | C111: 10022 | D111: 10 | E111: 4|1|2|3 | F111: 7000|100|100|100 | G111: =R[-101]C -> 23
A112: 50002 | B112: 4 | C112: 10022 | D112: 15 | E112: 4|1|2|3 | F112: 8400|120|120|120 | G112: =R[-101]C -> 23
A113: 50002 | B113: 5 | C113: 10022 | D113: 15 | E113: 4|1|2|3 | F113: 9800|140|140|140 | G113: =R[-101]C -> 23
A114: 50002 | B114: 6 | C114: 10022 | D114: 20 | E114: 4|1|2|3 | F114: 11200|160|160|160 | G114: =R[-101]C -> 23
A115: 50002 | B115: 7 | C115: 10022 | D115: 20 | E115: 4|1|2|3 | F115: 12600|180|180|180 | G115: =R[-101]C -> 23
A116: 50002 | B116: 8 | C116: 10022 | D116: 25 | E116: 4|1|2|3 | F116: 14000|200|200|200 | G116: =R[-101]C -> 23
A117: 50002 | B117: 9 | C117: 10022 | D117: 25 | E117: 4|1|2|3 | F117: 15400|220|220|220 | G117: =R[-101]C -> 23
A118: 50002 | B118: 10 | C118: 10022 | D118: 30 | E118: 4|1|2|3 | F118: 16800|240|240|240 | G118: =R[-101]C -> 30
A119: 50002 | B119: 11 | C119: 10022 | D119: 30 | E119: 4|1|2|3 | F119: 18900|270|270|270 | G119: =R[-101]C -> 30
A120: 50002 | B120: 12 | C120: 10022 | D120: 35 | E120: 4|1|2|3 | F120: 21000|300|300|300 | G120: =R[-101]C -> 30
A121: 50002 | B121: 13 | C121: 10022 | D121: 35 | E121: 4|1|2|3 | F121: 23100|330|330|330 | G121: =R[-101]C -> 30
A122: 50002 | B122: 14 | C122: 10022 | D122: 40 | E122: 4|1|2|3 | F122: 25200|360|360|360 | G122: =R[-101]C -> 30
A123: 50002 | B123: 15 | C123: 10022 | D123: 40 | E123: 4|1|2|3 | F123: 27300|390|390|390 | G123: =R[-101]C -> 30
A124: 50002 | B124: 16 | C124: 10022 | D124: 45 | E124: 4|1|2|3 | F124: 29400|420|420|420 | G124: =R[-101]C -> 30
A125: 50002 | B125: 17 | C125: 10022 | D125: 45 | E125: 4|1|2|3 | F125: 31500|450|450|450 | G125: =R[-101]C -> 30
A126: 50002 | B126: 18 | C126: 10022 | D126: 50 | E126: 4|1|2|3 | F126: 33600|480|480|480 | G126: =R[-101]C -> 30
A127: 50002 | B127: 19 | C127: 10022 | D127: 55 | E127: 4|1|2|3 | F127: 35700|510|510|510 | G127: =R[-101]C -> 30
A128: 50002 | B128: 20 | C128: 10022 | D128: 60 | E128: 4|1|2|3 | F128: 37800|540|540|540 | G128: =R[-101]C -> 35
A129: 50002 | B129: 21 | C129: 10022 | D129: 65 | E129: 4|1|2|3 | F129: 40600|580|580|580 | G129: =R[-101]C -> 35
A130: 50002 | B130: 22 | C130: 10022 | D130: 70 | E130: 4|1|2|3 | F130: 43400|620|620|620 | G130: =R[-101]C -> 35
A131: 50002 | B131: 23 | C131: 10022 | D131: 75 | E131: 4|1|2|3 | F131: 46200|660|660|660 | G131: =R[-101]C -> 35
A132: 50002 | B132: 24 | C132: 10022 | D132: 80 | E132: 4|1|2|3 | F132: 49000|700|700|700 | G132: =R[-101]C -> 35
A133: 50002 | B133: 25 | C133: 10022 | D133: 85 | E133: 4|1|2|3 | F133: 51800|740|740|740 | G133: =R[-101]C -> 35
A134: 50002 | B134: 26 | C134: 10022 | D134: 90 | E134: 4|1|2|3 | F134: 54600|780|780|780 | G134: =R[-101]C -> 35
A135: 50002 | B135: 27 | C135: 10022 | D135: 95 | E135: 4|1|2|3 | F135: 57400|820|820|820 | G135: =R[-101]C -> 35
A136: 50002 | B136: 28 | C136: 10022 | D136: 100 | E136: 4|1|2|3 | F136: 60200|860|860|860 | G136: =R[-101]C -> 35
A137: 50002 | B137: 29 | C137: 10022 | D137: 110 | E137: 4|1|2|3 | F137: 63000|900|900|900 | G137: =R[-101]C -> 35
A138: 50002 | B138: 30 | C138: 10022 | D138: 120 | E138: 4|1|2|3 | F138: 65800|940|940|940 | G138: =R[-101]C -> 40
A139: 50002 | B139: 31 | C139: 10022 | D139: 130 | E139: 4|1|2|3 | F139: 69300|990|990|990 | G139: =R[-101]C -> 40
A140: 50002 | B140: 32 | C140: 10022 | D140: 140 | E140: 4|1|2|3 | F140: 72800|1040|1040|1040 | G140: =R[-101]C -> 40
A141: 50002 | B141: 33 | C141: 10022 | D141: 150 | E141: 4|1|2|3 | F141: 76300|1090|1090|1090 | G141: =R[-101]C -> 40
A142: 50002 | B142: 34 | C142: 10022 | D142: 160 | E142: 4|1|2|3 | F142: 79800|1140|1140|1140 | G142: =R[-101]C -> 40
A143: 50002 | B143: 35 | C143: 10022 | D143: 170 | E143: 4|1|2|3 | F143: 83300|1190|1190|1190 | G143: =R[-101]C -> 40
A144: 50002 | B144: 36 | C144: 10022 | D144: 180 | E144: 4|1|2|3 | F144: 86800|1240|1240|1240 | G144: =R[-101]C -> 40
A145: 50002 | B145: 37 | C145: 10022 | D145: 190 | E145: 4|1|2|3 | F145: 90300|1290|1290|1290 | G145: =R[-101]C -> 40
A146: 50002 | B146: 38 | C146: 10022 | D146: 200 | E146: 4|1|2|3 | F146: 93800|1340|1340|1340 | G146: =R[-101]C -> 40
A147: 50002 | B147: 39 | C147: 10022 | D147: 215 | E147: 4|1|2|3 | F147: 97300|1390|1390|1390 | G147: =R[-101]C -> 40
A148: 50002 | B148: 40 | C148: 10022 | D148: 230 | E148: 4|1|2|3 | F148: 100800|1440|1440|1440 | G148: =R[-101]C -> 45
A149: 50002 | B149: 41 | C149: 10022 | D149: 245 | E149: 4|1|2|3 | F149: 105000|1500|1500|1500 | G149: =R[-101]C -> 45
A150: 50002 | B150: 42 | C150: 10022 | D150: 260 | E150: 4|1|2|3 | F150: 109200|1560|1560|1560 | G150: =R[-101]C -> 45
A151: 50002 | B151: 43 | C151: 10022 | D151: 275 | E151: 4|1|2|3 | F151: 113400|1620|1620|1620 | G151: =R[-101]C -> 45
A152: 50002 | B152: 44 | C152: 10022 | D152: 290 | E152: 4|1|2|3 | F152: 117600|1680|1680|1680 | G152: =R[-101]C -> 45
A153: 50002 | B153: 45 | C153: 10022 | D153: 305 | E153: 4|1|2|3 | F153: 121800|1740|1740|1740 | G153: =R[-101]C -> 45
A154: 50002 | B154: 46 | C154: 10022 | D154: 320 | E154: 4|1|2|3 | F154: 126000|1800|1800|1800 | G154: =R[-101]C -> 45
A155: 50002 | B155: 47 | C155: 10022 | D155: 335 | E155: 4|1|2|3 | F155: 130200|1860|1860|1860 | G155: =R[-101]C -> 45
A156: 50002 | B156: 48 | C156: 10022 | D156: 350 | E156: 4|1|2|3 | F156: 134400|1920|1920|1920 | G156: =R[-101]C -> 45
A157: 50002 | B157: 49 | C157: 10022 | D157: 370 | E157: 4|1|2|3 | F157: 138600|1980|1980|1980 | G157: =R[-101]C -> 45
A158: 50002 | B158: 50 | C158: 10022 | D158: 390 | E158: 4|1|2|3 | F158: 142800|2040|2040|2040 | G158: =R[-101]C -> 50
A159: 50002 | B159: 51 | C159: 10022 | D159: 410 | E159: 4|1|2|3 | F159: 147700|2110|2110|2110 | G159: =R[-101]C -> 50
A160: 50002 | B160: 52 | C160: 10022 | D160: 430 | E160: 4|1|2|3 | F160: 152600|2180|2180|2180 | G160: =R[-101]C -> 50
A161: 50002 | B161: 53 | C161: 10022 | D161: 450 | E161: 4|1|2|3 | F161: 157500|2250|2250|2250 | G161: =R[-101]C -> 50
A162: 50002 | B162: 54 | C162: 10022 | D162: 470 | E162: 4|1|2|3 | F162: 162400|2320|2320|2320 | G162: =R[-101]C -> 50
A163: 50002 | B163: 55 | C163: 10022 | D163: 490 | E163: 4|1|2|3 | F163: 167300|2390|2390|2390 | G163: =R[-101]C -> 50
A164: 50002 | B164: 56 | C164: 10022 | D164: 510 | E164: 4|1|2|3 | F164: 172200|2460|2460|2460 | G164: =R[-101]C -> 50
A165: 50002 | B165: 57 | C165: 10022 | D165: 530 | E165: 4|1|2|3 | F165: 177100|2530|2530|2530 | G165: =R[-101]C -> 50
A166: 50002 | B166: 58 | C166: 10022 | D166: 550 | E166: 4|1|2|3 | F166: 182000|2600|2600|2600 | G166: =R[-101]C -> 50
A167: 50002 | B167: 59 | C167: 10022 | D167: 575 | E167: 4|1|2|3 | F167: 186900|2670|2670|2670 | G167: =R[-101]C -> 50
A168: 50002 | B168: 60 | C168: 10022 | D168: 600 | E168: 4|1|2|3 | F168: 191800|2740|2740|2740 | G168: =R[-101]C -> 55
A169: 50002 | B169: 61 | C169: 10022 | D169: 625 | E169: 4|1|2|3 | F169: 197400|2820|2820|2820 | G169: =R[-101]C -> 55
A170: 50002 | B170: 62 | C170: 10022 | D170: 650 | E170: 4|1|2|3 | F170: 203000|2900|2900|2900 | G170: =R[-101]C -> 55
A171: 50002 | B171: 63 | C171: 10022 | D171: 675 | E171: 4|1|2|3 | F171: 208600|2980|2980|2980 | G171: =R[-101]C -> 55
A172: 50002 | B172: 64 | C172: 10022 | D172: 700 | E172: 4|1|2|3 | F172: 214200|3060|3060|3060 | G172: =R[-101]C -> 55
A173: 50002 | B173: 65 | C173: 10022 | D173: 725 | E173: 4|1|2|3 | F173: 219800|3140|3140|3140 | G173: =R[-101]C -> 55
A174: 50002 | B174: 66 | C174: 10022 | D174: 750 | E174: 4|1|2|3 | F174: 225400|3220|3220|3220 | G174: =R[-101]C -> 55
A175: 50002 | B175: 67 | C175: 10022 | D175: 775 | E175: 4|1|2|3 | F175: 231000|3300|3300|3300 | G175: =R[-101]C -> 55
A176: 50002 | B176: 68 | C176: 10022 | D176: 800 | E176: 4|1|2|3 | F176: 236600|3380|3380|3380 | G176: =R[-101]C -> 55
A177: 50002 | B177: 69 | C177: 10022 | D177: 830 | E177: 4|1|2|3 | F177: 242200|3460|3460|3460 | G177: =R[-101]C -> 55
A178: 50002 | B178: 70 | C178: 10022 | D178: 860 | E178: 4|1|2|3 | F178: 247800|3540|3540|3540 | G178: =R[-101]C -> 60
A179: 50002 | B179: 71 | C179: 10022 | D179: 890 | E179: 4|1|2|3 | F179: 254100|3630|3630|3630 | G179: =R[-101]C -> 60
A180: 50002 | B180: 72 | C180: 10022 | D180: 920 | E180: 4|1|2|3 | F180: 260400|3720|3720|3720 | G180: =R[-101]C -> 60
A181: 50002 | B181: 73 | C181: 10022 | D181: 950 | E181: 4|1|2|3 | F181: 266700|3810|3810|3810 | G181: =R[-101]C -> 60
A182: 50002 | B182: 74 | C182: 10022 | D182: 980 | E182: 4|1|2|3 | F182: 273000|3900|3900|3900 | G182: =R[-101]C -> 60
A183: 50002 | B183: 75 | C183: 10022 | D183: 1010 | E183: 4|1|2|3 | F183: 279300|3990|3990|3990 | G183: =R[-101]C -> 60
A184: 50002 | B184: 76 | C184: 10022 | D184: 1040 | E184: 4|1|2|3 | F184: 285600|4080|4080|4080 | G184: =R[-101]C -> 60
A185: 50002 | B185: 77 | C185: 10022 | D185: 1070 | E185: 4|1|2|3 | F185: 291900|4170|4170|4170 | G185: =R[-101]C -> 60
A186: 50002 | B186: 78 | C186: 10022 | D186: 1100 | E186: 4|1|2|3 | F186: 298200|4260|4260|4260 | G186: =R[-101]C -> 60
A187: 50002 | B187: 79 | C187: 10022 | D187: 1135 | E187: 4|1|2|3 | F187: 304500|4350|4350|4350 | G187: =R[-101]C -> 60
A188: 50002 | B188: 80 | C188: 10022 | D188: 1170 | E188: 4|1|2|3 | F188: 310800|4440|4440|4440 | G188: =R[-101]C -> 65
A189: 50002 | B189: 81 | C189: 10022 | D189: 1205 | E189: 4|1|2|3 | F189: 317800|4540|4540|4540 | G189: =R[-101]C -> 65
A190: 50002 | B190: 82 | C190: 10022 | D190: 1240 | E190: 4|1|2|3 | F190: 324800|4640|4640|4640 | G190: =R[-101]C -> 65
A191: 50002 | B191: 83 | C191: 10022 | D191: 1275 | E191: 4|1|2|3 | F191: 331800|4740|4740|4740 | G191: =R[-101]C -> 65
A192: 50002 | B192: 84 | C192: 10022 | D192: 1310 | E192: 4|1|2|3 | F192: 338800|4840|4840|4840 | G192: =R[-101]C -> 65
A193: 50002 | B193: 85 | C193: 10022 | D193: 1345 | E193: 4|1|2|3 | F193: 345800|4940|4940|4940 | G193: =R[-101]C -> 65
A194: 50002 | B194: 86 | C194: 10022 | D194: 1380 | E194: 4|1|2|3 | F194: 352800|5040|5040|5040 | G194: =R[-101]C -> 65
A195: 50002 | B195: 87 | C195: 10022 | D195: 1415 | E195: 4|1|2|3 | F195: 359800|5140|5140|5140 | G195: =R[-101]C -> 65
A196: 50002 | B196: 88 | C196: 10022 | D196: 1450 | E196: 4|1|2|3 | F196: 366800|5240|5240|5240 | G196: =R[-101]C -> 65
A197: 50002 | B197: 89 | C197: 10022 | D197: 1490 | E197: 4|1|2|3 | F197: 373800|5340|5340|5340 | G197: =R[-101]C -> 65
A198: 50002 | B198: 90 | C198: 10022 | D198: 1530 | E198: 4|1|2|3 | F198: 380800|5440|5440|5440 | G198: =R[-101]C -> 70
A199: 50002 | B199: 91 | C199: 10022 | D199: 1570 | E199: 4|1|2|3 | F199: 388500|5550|5550|5550 | G199: =R[-101]C -> 70
A200: 50002 | B200: 92 | C200: 10022 | D200: 1610 | E200: 4|1|2|3 | F200: 396200|5660|5660|5660 | G200: =R[-101]C -> 70
A201: 50002 | B201: 93 | C201: 10022 | D201: 1650 | E201: 4|1|2|3 | F201: 403900|5770|5770|5770 | G201: =R[-101]C -> 70
A202: 50002 | B202: 94 | C202: 10022 | D202: 1690 | E202: 4|1|2|3 | F202: 411600|5880|5880|5880 | G202: =R[-101]C -> 70
A203: 50002 | B203: 95 | C203: 10022 | D203: 1730 | E203: 4|1|2|3 | F203: 419300|5990|5990|5990 | G203: =R[-101]C -> 70
A204: 50002 | B204: 96 | C204: 10022 | D204: 1770 | E204: 4|1|2|3 | F204: 427000|6100|6100|6100 | G204: =R[-101]C -> 70
A205: 50002 | B205: 97 | C205: 10022 | D205: 1810 | E205: 4|1|2|3 | F205: 434700|6210|6210|6210 | G205: =R[-101]C -> 70
A206: 50002 | B206: 98 | C206: 10022 | D206: 1850 | E206: 4|1|2|3 | F206: 442400|6320|6320|6320 | G206: =R[-101]C -> 70
A207: 50002 | B207: 99 | C207: 10022 | D207: 1900 | E207: 4|1|2|3 | F207: 450100|6430|6430|6430 | G207: =R[-101]C -> 70
A208: 50002 | B208: 100 | C208: 10022 | D208: 0 | E208: 4|1|2|3 | F208: 457800|6540|6540|6540 | G208: =R[-101]C -> 75
A209: 50011 | B209: 0 | C209: 10022 | D209: 5 | E209: 4|1|2|3 | F209: 400|280|40|40 | G209: =R[-101]C -> 23
A210: 50011 | B210: 1 | C210: 10022 | D210: 5 | E210: 4|1|2|3 | F210: 600|420|60|60 | G210: =R[-101]C -> 23
A211: 50011 | B211: 2 | C211: 10022 | D211: 10 | E211: 4|1|2|3 | F211: 800|560|80|80 | G211: =R[-101]C -> 23
A212: 50011 | B212: 3 | C212: 10022 | D212: 10 | E212: 4|1|2|3 | F212: 1000|700|100|100 | G212: =R[-101]C -> 23
A213: 50011 | B213: 4 | C213: 10022 | D213: 15 | E213: 4|1|2|3 | F213: 1200|840|120|120 | G213: =R[-101]C -> 23
A214: 50011 | B214: 5 | C214: 10022 | D214: 15 | E214: 4|1|2|3 | F214: 1400|980|140|140 | G214: =R[-101]C -> 23
A215: 50011 | B215: 6 | C215: 10022 | D215: 20 | E215: 4|1|2|3 | F215: 1600|1120|160|160 | G215: =R[-101]C -> 23
A216: 50011 | B216: 7 | C216: 10022 | D216: 20 | E216: 4|1|2|3 | F216: 1800|1260|180|180 | G216: =R[-101]C -> 23
A217: 50011 | B217: 8 | C217: 10022 | D217: 25 | E217: 4|1|2|3 | F217: 2000|1400|200|200 | G217: =R[-101]C -> 23
A218: 50011 | B218: 9 | C218: 10022 | D218: 25 | E218: 4|1|2|3 | F218: 2200|1540|220|220 | G218: =R[-101]C -> 23
A219: 50011 | B219: 10 | C219: 10022 | D219: 30 | E219: 4|1|2|3 | F219: 2400|1680|240|240 | G219: =R[-101]C -> 30
A220: 50011 | B220: 11 | C220: 10022 | D220: 30 | E220: 4|1|2|3 | F220: 2700|1890|270|270 | G220: =R[-101]C -> 30
A221: 50011 | B221: 12 | C221: 10022 | D221: 35 | E221: 4|1|2|3 | F221: 3000|2100|300|300 | G221: =R[-101]C -> 30
A222: 50011 | B222: 13 | C222: 10022 | D222: 35 | E222: 4|1|2|3 | F222: 3300|2310|330|330 | G222: =R[-101]C -> 30
A223: 50011 | B223: 14 | C223: 10022 | D223: 40 | E223: 4|1|2|3 | F223: 3600|2520|360|360 | G223: =R[-101]C -> 30
A224: 50011 | B224: 15 | C224: 10022 | D224: 40 | E224: 4|1|2|3 | F224: 3900|2730|390|390 | G224: =R[-101]C -> 30
A225: 50011 | B225: 16 | C225: 10022 | D225: 45 | E225: 4|1|2|3 | F225: 4200|2940|420|420 | G225: =R[-101]C -> 30
A226: 50011 | B226: 17 | C226: 10022 | D226: 45 | E226: 4|1|2|3 | F226: 4500|3150|450|450 | G226: =R[-101]C -> 30
A227: 50011 | B227: 18 | C227: 10022 | D227: 50 | E227: 4|1|2|3 | F227: 4800|3360|480|480 | G227: =R[-101]C -> 30
A228: 50011 | B228: 19 | C228: 10022 | D228: 55 | E228: 4|1|2|3 | F228: 5100|3570|510|510 | G228: =R[-101]C -> 30
A229: 50011 | B229: 20 | C229: 10022 | D229: 60 | E229: 4|1|2|3 | F229: 5400|3780|540|540 | G229: =R[-101]C -> 35
A230: 50011 | B230: 21 | C230: 10022 | D230: 65 | E230: 4|1|2|3 | F230: 5800|4060|580|580 | G230: =R[-101]C -> 35
A231: 50011 | B231: 22 | C231: 10022 | D231: 70 | E231: 4|1|2|3 | F231: 6200|4340|620|620 | G231: =R[-101]C -> 35
A232: 50011 | B232: 23 | C232: 10022 | D232: 75 | E232: 4|1|2|3 | F232: 6600|4620|660|660 | G232: =R[-101]C -> 35
A233: 50011 | B233: 24 | C233: 10022 | D233: 80 | E233: 4|1|2|3 | F233: 7000|4900|700|700 | G233: =R[-101]C -> 35
A234: 50011 | B234: 25 | C234: 10022 | D234: 85 | E234: 4|1|2|3 | F234: 7400|5180|740|740 | G234: =R[-101]C -> 35
A235: 50011 | B235: 26 | C235: 10022 | D235: 90 | E235: 4|1|2|3 | F235: 7800|5460|780|780 | G235: =R[-101]C -> 35
A236: 50011 | B236: 27 | C236: 10022 | D236: 95 | E236: 4|1|2|3 | F236: 8200|5740|820|820 | G236: =R[-101]C -> 35
A237: 50011 | B237: 28 | C237: 10022 | D237: 100 | E237: 4|1|2|3 | F237: 8600|6020|860|860 | G237: =R[-101]C -> 35
A238: 50011 | B238: 29 | C238: 10022 | D238: 110 | E238: 4|1|2|3 | F238: 9000|6300|900|900 | G238: =R[-101]C -> 35
A239: 50011 | B239: 30 | C239: 10022 | D239: 120 | E239: 4|1|2|3 | F239: 9400|6580|940|940 | G239: =R[-101]C -> 40
A240: 50011 | B240: 31 | C240: 10022 | D240: 130 | E240: 4|1|2|3 | F240: 9900|6930|990|990 | G240: =R[-101]C -> 40
A241: 50011 | B241: 32 | C241: 10022 | D241: 140 | E241: 4|1|2|3 | F241: 10400|7280|1040|1040 | G241: =R[-101]C -> 40
A242: 50011 | B242: 33 | C242: 10022 | D242: 150 | E242: 4|1|2|3 | F242: 10900|7630|1090|1090 | G242: =R[-101]C -> 40
A243: 50011 | B243: 34 | C243: 10022 | D243: 160 | E243: 4|1|2|3 | F243: 11400|7980|1140|1140 | G243: =R[-101]C -> 40
A244: 50011 | B244: 35 | C244: 10022 | D244: 170 | E244: 4|1|2|3 | F244: 11900|8330|1190|1190 | G244: =R[-101]C -> 40
A245: 50011 | B245: 36 | C245: 10022 | D245: 180 | E245: 4|1|2|3 | F245: 12400|8680|1240|1240 | G245: =R[-101]C -> 40
A246: 50011 | B246: 37 | C246: 10022 | D246: 190 | E246: 4|1|2|3 | F246: 12900|9030|1290|1290 | G246: =R[-101]C -> 40
A247: 50011 | B247: 38 | C247: 10022 | D247: 200 | E247: 4|1|2|3 | F247: 13400|9380|1340|1340 | G247: =R[-101]C -> 40
A248: 50011 | B248: 39 | C248: 10022 | D248: 215 | E248: 4|1|2|3 | F248: 13900|9730|1390|1390 | G248: =R[-101]C -> 40
A249: 50011 | B249: 40 | C249: 10022 | D249: 230 | E249: 4|1|2|3 | F249: 14400|10080|1440|1440 | G249: =R[-101]C -> 45
A250: 50011 | B250: 41 | C250: 10022 | D250: 245 | E250: 4|1|2|3 | F250: 15000|10500|1500|1500 | G250: =R[-101]C -> 45
A251: 50011 | B251: 42 | C251: 10022 | D251: 260 | E251: 4|1|2|3 | F251: 15600|10920|1560|1560 | G251: =R[-101]C -> 45
A252: 50011 | B252: 43 | C252: 10022 | D252: 275 | E252: 4|1|2|3 | F252: 16200|11340|1620|1620 | G252: =R[-101]C -> 45
A253: 50011 | B253: 44 | C253: 10022 | D253: 290 | E253: 4|1|2|3 | F253: 16800|11760|1680|1680 | G253: =R[-101]C -> 45
A254: 50011 | B254: 45 | C254: 10022 | D254: 305 | E254: 4|1|2|3 | F254: 17400|12180|1740|1740 | G254: =R[-101]C -> 45
A255: 50011 | B255: 46 | C255: 10022 | D255: 320 | E255: 4|1|2|3 | F255: 18000|12600|1800|1800 | G255: =R[-101]C -> 45
A256: 50011 | B256: 47 | C256: 10022 | D256: 335 | E256: 4|1|2|3 | F256: 18600|13020|1860|1860 | G256: =R[-101]C -> 45
A257: 50011 | B257: 48 | C257: 10022 | D257: 350 | E257: 4|1|2|3 | F257: 19200|13440|1920|1920 | G257: =R[-101]C -> 45
A258: 50011 | B258: 49 | C258: 10022 | D258: 370 | E258: 4|1|2|3 | F258: 19800|13860|1980|1980 | G258: =R[-101]C -> 45
A259: 50011 | B259: 50 | C259: 10022 | D259: 390 | E259: 4|1|2|3 | F259: 20400|14280|2040|2040 | G259: =R[-101]C -> 50
A260: 50011 | B260: 51 | C260: 10022 | D260: 410 | E260: 4|1|2|3 | F260: 21100|14770|2110|2110 | G260: =R[-101]C -> 50
A261: 50011 | B261: 52 | C261: 10022 | D261: 430 | E261: 4|1|2|3 | F261: 21800|15260|2180|2180 | G261: =R[-101]C -> 50
A262: 50011 | B262: 53 | C262: 10022 | D262: 450 | E262: 4|1|2|3 | F262: 22500|15750|2250|2250 | G262: =R[-101]C -> 50
A263: 50011 | B263: 54 | C263: 10022 | D263: 470 | E263: 4|1|2|3 | F263: 23200|16240|2320|2320 | G263: =R[-101]C -> 50
A264: 50011 | B264: 55 | C264: 10022 | D264: 490 | E264: 4|1|2|3 | F264: 23900|16730|2390|2390 | G264: =R[-101]C -> 50
A265: 50011 | B265: 56 | C265: 10022 | D265: 510 | E265: 4|1|2|3 | F265: 24600|17220|2460|2460 | G265: =R[-101]C -> 50
A266: 50011 | B266: 57 | C266: 10022 | D266: 530 | E266: 4|1|2|3 | F266: 25300|17710|2530|2530 | G266: =R[-101]C -> 50
A267: 50011 | B267: 58 | C267: 10022 | D267: 550 | E267: 4|1|2|3 | F267: 26000|18200|2600|2600 | G267: =R[-101]C -> 50
A268: 50011 | B268: 59 | C268: 10022 | D268: 575 | E268: 4|1|2|3 | F268: 26700|18690|2670|2670 | G268: =R[-101]C -> 50
A269: 50011 | B269: 60 | C269: 10022 | D269: 600 | E269: 4|1|2|3 | F269: 27400|19180|2740|2740 | G269: =R[-101]C -> 55
A270: 50011 | B270: 61 | C270: 10022 | D270: 625 | E270: 4|1|2|3 | F270: 28200|19740|2820|2820 | G270: =R[-101]C -> 55
A271: 50011 | B271: 62 | C271: 10022 | D271: 650 | E271: 4|1|2|3 | F271: 29000|20300|2900|2900 | G271: =R[-101]C -> 55
A272: 50011 | B272: 63 | C272: 10022 | D272: 675 | E272: 4|1|2|3 | F272: 29800|20860|2980|2980 | G272: =R[-101]C -> 55
A273: 50011 | B273: 64 | C273: 10022 | D273: 700 | E273: 4|1|2|3 | F273: 30600|21420|3060|3060 | G273: =R[-101]C -> 55
A274: 50011 | B274: 65 | C274: 10022 | D274: 725 | E274: 4|1|2|3 | F274: 31400|21980|3140|3140 | G274: =R[-101]C -> 55
A275: 50011 | B275: 66 | C275: 10022 | D275: 750 | E275: 4|1|2|3 | F275: 32200|22540|3220|3220 | G275: =R[-101]C -> 55
A276: 50011 | B276: 67 | C276: 10022 | D276: 775 | E276: 4|1|2|3 | F276: 33000|23100|3300|3300 | G276: =R[-101]C -> 55
A277: 50011 | B277: 68 | C277: 10022 | D277: 800 | E277: 4|1|2|3 | F277: 33800|23660|3380|3380 | G277: =R[-101]C -> 55
A278: 50011 | B278: 69 | C278: 10022 | D278: 830 | E278: 4|1|2|3 | F278: 34600|24220|3460|3460 | G278: =R[-101]C -> 55
A279: 50011 | B279: 70 | C279: 10022 | D279: 860 | E279: 4|1|2|3 | F279: 35400|24780|3540|3540 | G279: =R[-101]C -> 60
A280: 50011 | B280: 71 | C280: 10022 | D280: 890 | E280: 4|1|2|3 | F280: 36300|25410|3630|3630 | G280: =R[-101]C -> 60
A281: 50011 | B281: 72 | C281: 10022 | D281: 920 | E281: 4|1|2|3 | F281: 37200|26040|3720|3720 | G281: =R[-101]C -> 60
A282: 50011 | B282: 73 | C282: 10022 | D282: 950 | E282: 4|1|2|3 | F282: 38100|26670|3810|3810 | G282: =R[-101]C -> 60
A283: 50011 | B283: 74 | C283: 10022 | D283: 980 | E283: 4|1|2|3 | F283: 39000|27300|3900|3900 | G283: =R[-101]C -> 60
A284: 50011 | B284: 75 | C284: 10022 | D284: 1010 | E284: 4|1|2|3 | F284: 39900|27930|3990|3990 | G284: =R[-101]C -> 60
A285: 50011 | B285: 76 | C285: 10022 | D285: 1040 | E285: 4|1|2|3 | F285: 40800|28560|4080|4080 | G285: =R[-101]C -> 60
A286: 50011 | B286: 77 | C286: 10022 | D286: 1070 | E286: 4|1|2|3 | F286: 41700|29190|4170|4170 | G286: =R[-101]C -> 60
A287: 50011 | B287: 78 | C287: 10022 | D287: 1100 | E287: 4|1|2|3 | F287: 42600|29820|4260|4260 | G287: =R[-101]C -> 60
A288: 50011 | B288: 79 | C288: 10022 | D288: 1135 | E288: 4|1|2|3 | F288: 43500|30450|4350|4350 | G288: =R[-101]C -> 60
A289: 50011 | B289: 80 | C289: 10022 | D289: 1170 | E289: 4|1|2|3 | F289: 44400|31080|4440|4440 | G289: =R[-101]C -> 65
A290: 50011 | B290: 81 | C290: 10022 | D290: 1205 | E290: 4|1|2|3 | F290: 45400|31780|4540|4540 | G290: =R[-101]C -> 65
A291: 50011 | B291: 82 | C291: 10022 | D291: 1240 | E291: 4|1|2|3 | F291: 46400|32480|4640|4640 | G291: =R[-101]C -> 65
A292: 50011 | B292: 83 | C292: 10022 | D292: 1275 | E292: 4|1|2|3 | F292: 47400|33180|4740|4740 | G292: =R[-101]C -> 65
A293: 50011 | B293: 84 | C293: 10022 | D293: 1310 | E293: 4|1|2|3 | F293: 48400|33880|4840|4840 | G293: =R[-101]C -> 65
A294: 50011 | B294: 85 | C294: 10022 | D294: 1345 | E294: 4|1|2|3 | F294: 49400|34580|4940|4940 | G294: =R[-101]C -> 65
A295: 50011 | B295: 86 | C295: 10022 | D295: 1380 | E295: 4|1|2|3 | F295: 50400|35280|5040|5040 | G295: =R[-101]C -> 65
A296: 50011 | B296: 87 | C296: 10022 | D296: 1415 | E296: 4|1|2|3 | F296: 51400|35980|5140|5140 | G296: =R[-101]C -> 65
A297: 50011 | B297: 88 | C297: 10022 | D297: 1450 | E297: 4|1|2|3 | F297: 52400|36680|5240|5240 | G297: =R[-101]C -> 65
A298: 50011 | B298: 89 | C298: 10022 | D298: 1490 | E298: 4|1|2|3 | F298: 53400|37380|5340|5340 | G298: =R[-101]C -> 65
A299: 50011 | B299: 90 | C299: 10022 | D299: 1530 | E299: 4|1|2|3 | F299: 54400|38080|5440|5440 | G299: =R[-101]C -> 70
A300: 50011 | B300: 91 | C300: 10022 | D300: 1570 | E300: 4|1|2|3 | F300: 55500|38850|5550|5550 | G300: =R[-101]C -> 70
A301: 50011 | B301: 92 | C301: 10022 | D301: 1610 | E301: 4|1|2|3 | F301: 56600|39620|5660|5660 | G301: =R[-101]C -> 70
A302: 50011 | B302: 93 | C302: 10022 | D302: 1650 | E302: 4|1|2|3 | F302: 57700|40390|5770|5770 | G302: =R[-101]C -> 70
A303: 50011 | B303: 94 | C303: 10022 | D303: 1690 | E303: 4|1|2|3 | F303: 58800|41160|5880|5880 | G303: =R[-101]C -> 70
A304: 50011 | B304: 95 | C304: 10022 | D304: 1730 | E304: 4|1|2|3 | F304: 59900|41930|5990|5990 | G304: =R[-101]C -> 70
A305: 50011 | B305: 96 | C305: 10022 | D305: 1770 | E305: 4|1|2|3 | F305: 61000|42700|6100|6100 | G305: =R[-101]C -> 70
A306: 50011 | B306: 97 | C306: 10022 | D306: 1810 | E306: 4|1|2|3 | F306: 62100|43470|6210|6210 | G306: =R[-101]C -> 70
A307: 50011 | B307: 98 | C307: 10022 | D307: 1850 | E307: 4|1|2|3 | F307: 63200|44240|6320|6320 | G307: =R[-101]C -> 70
A308: 50011 | B308: 99 | C308: 10022 | D308: 1900 | E308: 4|1|2|3 | F308: 64300|45010|6430|6430 | G308: =R[-101]C -> 70
A309: 50011 | B309: 100 | C309: 10022 | D309: 0 | E309: 4|1|2|3 | F309: 65400|45780|6540|6540 | G309: =R[-101]C -> 75
A310: 50012 | B310: 0 | C310: 10022 | D310: 5 | E310: 4|1|2|3 | F310: 400|40|40|280 | G310: =R[-101]C -> 23
A311: 50012 | B311: 1 | C311: 10022 | D311: 5 | E311: 4|1|2|3 | F311: 600|60|60|420 | G311: =R[-101]C -> 23
A312: 50012 | B312: 2 | C312: 10022 | D312: 10 | E312: 4|1|2|3 | F312: 800|80|80|560 | G312: =R[-101]C -> 23
A313: 50012 | B313: 3 | C313: 10022 | D313: 10 | E313: 4|1|2|3 | F313: 1000|100|100|700 | G313: =R[-101]C -> 23
A314: 50012 | B314: 4 | C314: 10022 | D314: 15 | E314: 4|1|2|3 | F314: 1200|120|120|840 | G314: =R[-101]C -> 23
A315: 50012 | B315: 5 | C315: 10022 | D315: 15 | E315: 4|1|2|3 | F315: 1400|140|140|980 | G315: =R[-101]C -> 23
A316: 50012 | B316: 6 | C316: 10022 | D316: 20 | E316: 4|1|2|3 | F316: 1600|160|160|1120 | G316: =R[-101]C -> 23
A317: 50012 | B317: 7 | C317: 10022 | D317: 20 | E317: 4|1|2|3 | F317: 1800|180|180|1260 | G317: =R[-101]C -> 23
A318: 50012 | B318: 8 | C318: 10022 | D318: 25 | E318: 4|1|2|3 | F318: 2000|200|200|1400 | G318: =R[-101]C -> 23
A319: 50012 | B319: 9 | C319: 10022 | D319: 25 | E319: 4|1|2|3 | F319: 2200|220|220|1540 | G319: =R[-101]C -> 23
A320: 50012 | B320: 10 | C320: 10022 | D320: 30 | E320: 4|1|2|3 | F320: 2400|240|240|1680 | G320: =R[-101]C -> 30
A321: 50012 | B321: 11 | C321: 10022 | D321: 30 | E321: 4|1|2|3 | F321: 2700|270|270|1890 | G321: =R[-101]C -> 30
A322: 50012 | B322: 12 | C322: 10022 | D322: 35 | E322: 4|1|2|3 | F322: 3000|300|300|2100 | G322: =R[-101]C -> 30
A323: 50012 | B323: 13 | C323: 10022 | D323: 35 | E323: 4|1|2|3 | F323: 3300|330|330|2310 | G323: =R[-101]C -> 30
A324: 50012 | B324: 14 | C324: 10022 | D324: 40 | E324: 4|1|2|3 | F324: 3600|360|360|2520 | G324: =R[-101]C -> 30
A325: 50012 | B325: 15 | C325: 10022 | D325: 40 | E325: 4|1|2|3 | F325: 3900|390|390|2730 | G325: =R[-101]C -> 30
A326: 50012 | B326: 16 | C326: 10022 | D326: 45 | E326: 4|1|2|3 | F326: 4200|420|420|2940 | G326: =R[-101]C -> 30
A327: 50012 | B327: 17 | C327: 10022 | D327: 45 | E327: 4|1|2|3 | F327: 4500|450|450|3150 | G327: =R[-101]C -> 30
A328: 50012 | B328: 18 | C328: 10022 | D328: 50 | E328: 4|1|2|3 | F328: 4800|480|480|3360 | G328: =R[-101]C -> 30
A329: 50012 | B329: 19 | C329: 10022 | D329: 55 | E329: 4|1|2|3 | F329: 5100|510|510|3570 | G329: =R[-101]C -> 30
A330: 50012 | B330: 20 | C330: 10022 | D330: 60 | E330: 4|1|2|3 | F330: 5400|540|540|3780 | G330: =R[-101]C -> 35
A331: 50012 | B331: 21 | C331: 10022 | D331: 65 | E331: 4|1|2|3 | F331: 5800|580|580|4060 | G331: =R[-101]C -> 35
A332: 50012 | B332: 22 | C332: 10022 | D332: 70 | E332: 4|1|2|3 | F332: 6200|620|620|4340 | G332: =R[-101]C -> 35
A333: 50012 | B333: 23 | C333: 10022 | D333: 75 | E333: 4|1|2|3 | F333: 6600|660|660|4620 | G333: =R[-101]C -> 35
A334: 50012 | B334: 24 | C334: 10022 | D334: 80 | E334: 4|1|2|3 | F334: 7000|700|700|4900 | G334: =R[-101]C -> 35
A335: 50012 | B335: 25 | C335: 10022 | D335: 85 | E335: 4|1|2|3 | F335: 7400|740|740|5180 | G335: =R[-101]C -> 35
A336: 50012 | B336: 26 | C336: 10022 | D336: 90 | E336: 4|1|2|3 | F336: 7800|780|780|5460 | G336: =R[-101]C -> 35
A337: 50012 | B337: 27 | C337: 10022 | D337: 95 | E337: 4|1|2|3 | F337: 8200|820|820|5740 | G337: =R[-101]C -> 35
A338: 50012 | B338: 28 | C338: 10022 | D338: 100 | E338: 4|1|2|3 | F338: 8600|860|860|6020 | G338: =R[-101]C -> 35
A339: 50012 | B339: 29 | C339: 10022 | D339: 110 | E339: 4|1|2|3 | F339: 9000|900|900|6300 | G339: =R[-101]C -> 35
A340: 50012 | B340: 30 | C340: 10022 | D340: 120 | E340: 4|1|2|3 | F340: 9400|940|940|6580 | G340: =R[-101]C -> 40
A341: 50012 | B341: 31 | C341: 10022 | D341: 130 | E341: 4|1|2|3 | F341: 9900|990|990|6930 | G341: =R[-101]C -> 40
A342: 50012 | B342: 32 | C342: 10022 | D342: 140 | E342: 4|1|2|3 | F342: 10400|1040|1040|7280 | G342: =R[-101]C -> 40
A343: 50012 | B343: 33 | C343: 10022 | D343: 150 | E343: 4|1|2|3 | F343: 10900|1090|1090|7630 | G343: =R[-101]C -> 40
A344: 50012 | B344: 34 | C344: 10022 | D344: 160 | E344: 4|1|2|3 | F344: 11400|1140|1140|7980 | G344: =R[-101]C -> 40
A345: 50012 | B345: 35 | C345: 10022 | D345: 170 | E345: 4|1|2|3 | F345: 11900|1190|1190|8330 | G345: =R[-101]C -> 40
A346: 50012 | B346: 36 | C346: 10022 | D346: 180 | E346: 4|1|2|3 | F346: 12400|1240|1240|8680 | G346: =R[-101]C -> 40
A347: 50012 | B347: 37 | C347: 10022 | D347: 190 | E347: 4|1|2|3 | F347: 12900|1290|1290|9030 | G347: =R[-101]C -> 40
A348: 50012 | B348: 38 | C348: 10022 | D348: 200 | E348: 4|1|2|3 | F348: 13400|1340|1340|9380 | G348: =R[-101]C -> 40
A349: 50012 | B349: 39 | C349: 10022 | D349: 215 | E349: 4|1|2|3 | F349: 13900|1390|1390|9730 | G349: =R[-101]C -> 40
A350: 50012 | B350: 40 | C350: 10022 | D350: 230 | E350: 4|1|2|3 | F350: 14400|1440|1440|10080 | G350: =R[-101]C -> 45
A351: 50012 | B351: 41 | C351: 10022 | D351: 245 | E351: 4|1|2|3 | F351: 15000|1500|1500|10500 | G351: =R[-101]C -> 45
A352: 50012 | B352: 42 | C352: 10022 | D352: 260 | E352: 4|1|2|3 | F352: 15600|1560|1560|10920 | G352: =R[-101]C -> 45
A353: 50012 | B353: 43 | C353: 10022 | D353: 275 | E353: 4|1|2|3 | F353: 16200|1620|1620|11340 | G353: =R[-101]C -> 45
A354: 50012 | B354: 44 | C354: 10022 | D354: 290 | E354: 4|1|2|3 | F354: 16800|1680|1680|11760 | G354: =R[-101]C -> 45
A355: 50012 | B355: 45 | C355: 10022 | D355: 305 | E355: 4|1|2|3 | F355: 17400|1740|1740|12180 | G355: =R[-101]C -> 45
A356: 50012 | B356: 46 | C356: 10022 | D356: 320 | E356: 4|1|2|3 | F356: 18000|1800|1800|12600 | G356: =R[-101]C -> 45
A357: 50012 | B357: 47 | C357: 10022 | D357: 335 | E357: 4|1|2|3 | F357: 18600|1860|1860|13020 | G357: =R[-101]C -> 45
A358: 50012 | B358: 48 | C358: 10022 | D358: 350 | E358: 4|1|2|3 | F358: 19200|1920|1920|13440 | G358: =R[-101]C -> 45
A359: 50012 | B359: 49 | C359: 10022 | D359: 370 | E359: 4|1|2|3 | F359: 19800|1980|1980|13860 | G359: =R[-101]C -> 45
A360: 50012 | B360: 50 | C360: 10022 | D360: 390 | E360: 4|1|2|3 | F360: 20400|2040|2040|14280 | G360: =R[-101]C -> 50
A361: 50012 | B361: 51 | C361: 10022 | D361: 410 | E361: 4|1|2|3 | F361: 21100|2110|2110|14770 | G361: =R[-101]C -> 50
A362: 50012 | B362: 52 | C362: 10022 | D362: 430 | E362: 4|1|2|3 | F362: 21800|2180|2180|15260 | G362: =R[-101]C -> 50
A363: 50012 | B363: 53 | C363: 10022 | D363: 450 | E363: 4|1|2|3 | F363: 22500|2250|2250|15750 | G363: =R[-101]C -> 50
A364: 50012 | B364: 54 | C364: 10022 | D364: 470 | E364: 4|1|2|3 | F364: 23200|2320|2320|16240 | G364: =R[-101]C -> 50
A365: 50012 | B365: 55 | C365: 10022 | D365: 490 | E365: 4|1|2|3 | F365: 23900|2390|2390|16730 | G365: =R[-101]C -> 50
A366: 50012 | B366: 56 | C366: 10022 | D366: 510 | E366: 4|1|2|3 | F366: 24600|2460|2460|17220 | G366: =R[-101]C -> 50
A367: 50012 | B367: 57 | C367: 10022 | D367: 530 | E367: 4|1|2|3 | F367: 25300|2530|2530|17710 | G367: =R[-101]C -> 50
A368: 50012 | B368: 58 | C368: 10022 | D368: 550 | E368: 4|1|2|3 | F368: 26000|2600|2600|18200 | G368: =R[-101]C -> 50
A369: 50012 | B369: 59 | C369: 10022 | D369: 575 | E369: 4|1|2|3 | F369: 26700|2670|2670|18690 | G369: =R[-101]C -> 50
A370: 50012 | B370: 60 | C370: 10022 | D370: 600 | E370: 4|1|2|3 | F370: 27400|2740|2740|19180 | G370: =R[-101]C -> 55
A371: 50012 | B371: 61 | C371: 10022 | D371: 625 | E371: 4|1|2|3 | F371: 28200|2820|2820|19740 | G371: =R[-101]C -> 55
A372: 50012 | B372: 62 | C372: 10022 | D372: 650 | E372: 4|1|2|3 | F372: 29000|2900|2900|20300 | G372: =R[-101]C -> 55
A373: 50012 | B373: 63 | C373: 10022 | D373: 675 | E373: 4|1|2|3 | F373: 29800|2980|2980|20860 | G373: =R[-101]C -> 55
A374: 50012 | B374: 64 | C374: 10022 | D374: 700 | E374: 4|1|2|3 | F374: 30600|3060|3060|21420 | G374: =R[-101]C -> 55
A375: 50012 | B375: 65 | C375: 10022 | D375: 725 | E375: 4|1|2|3 | F375: 31400|3140|3140|21980 | G375: =R[-101]C -> 55
A376: 50012 | B376: 66 | C376: 10022 | D376: 750 | E376: 4|1|2|3 | F376: 32200|3220|3220|22540 | G376: =R[-101]C -> 55
A377: 50012 | B377: 67 | C377: 10022 | D377: 775 | E377: 4|1|2|3 | F377: 33000|3300|3300|23100 | G377: =R[-101]C -> 55
A378: 50012 | B378: 68 | C378: 10022 | D378: 800 | E378: 4|1|2|3 | F378: 33800|3380|3380|23660 | G378: =R[-101]C -> 55
A379: 50012 | B379: 69 | C379: 10022 | D379: 830 | E379: 4|1|2|3 | F379: 34600|3460|3460|24220 | G379: =R[-101]C -> 55
A380: 50012 | B380: 70 | C380: 10022 | D380: 860 | E380: 4|1|2|3 | F380: 35400|3540|3540|24780 | G380: =R[-101]C -> 60
A381: 50012 | B381: 71 | C381: 10022 | D381: 890 | E381: 4|1|2|3 | F381: 36300|3630|3630|25410 | G381: =R[-101]C -> 60
A382: 50012 | B382: 72 | C382: 10022 | D382: 920 | E382: 4|1|2|3 | F382: 37200|3720|3720|26040 | G382: =R[-101]C -> 60
A383: 50012 | B383: 73 | C383: 10022 | D383: 950 | E383: 4|1|2|3 | F383: 38100|3810|3810|26670 | G383: =R[-101]C -> 60
A384: 50012 | B384: 74 | C384: 10022 | D384: 980 | E384: 4|1|2|3 | F384: 39000|3900|3900|27300 | G384: =R[-101]C -> 60
A385: 50012 | B385: 75 | C385: 10022 | D385: 1010 | E385: 4|1|2|3 | F385: 39900|3990|3990|27930 | G385: =R[-101]C -> 60
A386: 50012 | B386: 76 | C386: 10022 | D386: 1040 | E386: 4|1|2|3 | F386: 40800|4080|4080|28560 | G386: =R[-101]C -> 60
A387: 50012 | B387: 77 | C387: 10022 | D387: 1070 | E387: 4|1|2|3 | F387: 41700|4170|4170|29190 | G387: =R[-101]C -> 60
A388: 50012 | B388: 78 | C388: 10022 | D388: 1100 | E388: 4|1|2|3 | F388: 42600|4260|4260|29820 | G388: =R[-101]C -> 60
A389: 50012 | B389: 79 | C389: 10022 | D389: 1135 | E389: 4|1|2|3 | F389: 43500|4350|4350|30450 | G389: =R[-101]C -> 60
A390: 50012 | B390: 80 | C390: 10022 | D390: 1170 | E390: 4|1|2|3 | F390: 44400|4440|4440|31080 | G390: =R[-101]C -> 65
A391: 50012 | B391: 81 | C391: 10022 | D391: 1205 | E391: 4|1|2|3 | F391: 45400|4540|4540|31780 | G391: =R[-101]C -> 65
A392: 50012 | B392: 82 | C392: 10022 | D392: 1240 | E392: 4|1|2|3 | F392: 46400|4640|4640|32480 | G392: =R[-101]C -> 65
A393: 50012 | B393: 83 | C393: 10022 | D393: 1275 | E393: 4|1|2|3 | F393: 47400|4740|4740|33180 | G393: =R[-101]C -> 65
A394: 50012 | B394: 84 | C394: 10022 | D394: 1310 | E394: 4|1|2|3 | F394: 48400|4840|4840|33880 | G394: =R[-101]C -> 65
A395: 50012 | B395: 85 | C395: 10022 | D395: 1345 | E395: 4|1|2|3 | F395: 49400|4940|4940|34580 | G395: =R[-101]C -> 65
A396: 50012 | B396: 86 | C396: 10022 | D396: 1380 | E396: 4|1|2|3 | F396: 50400|5040|5040|35280 | G396: =R[-101]C -> 65
A397: 50012 | B397: 87 | C397: 10022 | D397: 1415 | E397: 4|1|2|3 | F397: 51400|5140|5140|35980 | G397: =R[-101]C -> 65
A398: 50012 | B398: 88 | C398: 10022 | D398: 1450 | E398: 4|1|2|3 | F398: 52400|5240|5240|36680 | G398: =R[-101]C -> 65
A399: 50012 | B399: 89 | C399: 10022 | D399: 1490 | E399: 4|1|2|3 | F399: 53400|5340|5340|37380 | G399: =R[-101]C -> 65
A400: 50012 | B400: 90 | C400: 10022 | D400: 1530 | E400: 4|1|2|3 | F400: 54400|5440|5440|38080 | G400: =R[-101]C -> 70
A401: 50012 | B401: 91 | C401: 10022 | D401: 1570 | E401: 4|1|2|3 | F401: 55500|5550|5550|38850 | G401: =R[-101]C -> 70
A402: 50012 | B402: 92 | C402: 10022 | D402: 1610 | E402: 4|1|2|3 | F402: 56600|5660|5660|39620 | G402: =R[-101]C -> 70
A403: 50012 | B403: 93 | C403: 10022 | D403: 1650 | E403: 4|1|2|3 | F403: 57700|5770|5770|40390 | G403: =R[-101]C -> 70
A404: 50012 | B404: 94 | C404: 10022 | D404: 1690 | E404: 4|1|2|3 | F404: 58800|5880|5880|41160 | G404: =R[-101]C -> 70
A405: 50012 | B405: 95 | C405: 10022 | D405: 1730 | E405: 4|1|2|3 | F405: 59900|5990|5990|41930 | G405: =R[-101]C -> 70
A406: 50012 | B406: 96 | C406: 10022 | D406: 1770 | E406: 4|1|2|3 | F406: 61000|6100|6100|42700 | G406: =R[-101]C -> 70
A407: 50012 | B407: 97 | C407: 10022 | D407: 1810 | E407: 4|1|2|3 | F407: 62100|6210|6210|43470 | G407: =R[-101]C -> 70
A408: 50012 | B408: 98 | C408: 10022 | D408: 1850 | E408: 4|1|2|3 | F408: 63200|6320|6320|44240 | G408: =R[-101]C -> 70
A409: 50012 | B409: 99 | C409: 10022 | D409: 1900 | E409: 4|1|2|3 | F409: 64300|6430|6430|45010 | G409: =R[-101]C -> 70
A410: 50012 | B410: 100 | C410: 10022 | D410: 0 | E410: 4|1|2|3 | F410: 65400|6540|6540|45780 | G410: =R[-101]C -> 75
A411: 50021 | B411: 0 | C411: 10022 | D411: 5 | E411: 4|1|2|3 | F411: 1000|100|100|100 | G411: =R[-101]C -> 23
A412: 50021 | B412: 1 | C412: 10022 | D412: 5 | E412: 4|1|2|3 | F412: 1500|150|150|150 | G412: =R[-101]C -> 23
A413: 50021 | B413: 2 | C413: 10022 | D413: 10 | E413: 4|1|2|3 | F413: 2000|200|200|200 | G413: =R[-101]C -> 23
A414: 50021 | B414: 3 | C414: 10022 | D414: 10 | E414: 4|1|2|3 | F414: 2500|250|250|250 | G414: =R[-101]C -> 23
A415: 50021 | B415: 4 | C415: 10022 | D415: 15 | E415: 4|1|2|3 | F415: 3000|300|300|300 | G415: =R[-101]C -> 23
A416: 50021 | B416: 5 | C416: 10022 | D416: 15 | E416: 4|1|2|3 | F416: 3500|350|350|350 | G416: =R[-101]C -> 23
A417: 50021 | B417: 6 | C417: 10022 | D417: 20 | E417: 4|1|2|3 | F417: 4000|400|400|400 | G417: =R[-101]C -> 23
A418: 50021 | B418: 7 | C418: 10022 | D418: 20 | E418: 4|1|2|3 | F418: 4500|450|450|450 | G418: =R[-101]C -> 23
A419: 50021 | B419: 8 | C419: 10022 | D419: 25 | E419: 4|1|2|3 | F419: 5000|500|500|500 | G419: =R[-101]C -> 23
A420: 50021 | B420: 9 | C420: 10022 | D420: 25 | E420: 4|1|2|3 | F420: 5500|550|550|550 | G420: =R[-101]C -> 23
A421: 50021 | B421: 10 | C421: 10022 | D421: 30 | E421: 4|1|2|3 | F421: 6000|600|600|600 | G421: =R[-101]C -> 30
A422: 50021 | B422: 11 | C422: 10022 | D422: 30 | E422: 4|1|2|3 | F422: 6750|675|675|675 | G422: =R[-101]C -> 30
A423: 50021 | B423: 12 | C423: 10022 | D423: 35 | E423: 4|1|2|3 | F423: 7500|750|750|750 | G423: =R[-101]C -> 30
A424: 50021 | B424: 13 | C424: 10022 | D424: 35 | E424: 4|1|2|3 | F424: 8250|825|825|825 | G424: =R[-101]C -> 30
A425: 50021 | B425: 14 | C425: 10022 | D425: 40 | E425: 4|1|2|3 | F425: 9000|900|900|900 | G425: =R[-101]C -> 30
A426: 50021 | B426: 15 | C426: 10022 | D426: 40 | E426: 4|1|2|3 | F426: 9750|975|975|975 | G426: =R[-101]C -> 30
A427: 50021 | B427: 16 | C427: 10022 | D427: 45 | E427: 4|1|2|3 | F427: 10500|1050|1050|1050 | G427: =R[-101]C -> 30
A428: 50021 | B428: 17 | C428: 10022 | D428: 45 | E428: 4|1|2|3 | F428: 11250|1125|1125|1125 | G428: =R[-101]C -> 30
A429: 50021 | B429: 18 | C429: 10022 | D429: 50 | E429: 4|1|2|3 | F429: 12000|1200|1200|1200 | G429: =R[-101]C -> 30
A430: 50021 | B430: 19 | C430: 10022 | D430: 55 | E430: 4|1|2|3 | F430: 12750|1275|1275|1275 | G430: =R[-101]C -> 30
A431: 50021 | B431: 20 | C431: 10022 | D431: 60 | E431: 4|1|2|3 | F431: 13500|1350|1350|1350 | G431: =R[-101]C -> 35
A432: 50021 | B432: 21 | C432: 10022 | D432: 65 | E432: 4|1|2|3 | F432: 14500|1450|1450|1450 | G432: =R[-101]C -> 35
A433: 50021 | B433: 22 | C433: 10022 | D433: 70 | E433: 4|1|2|3 | F433: 15500|1550|1550|1550 | G433: =R[-101]C -> 35
A434: 50021 | B434: 23 | C434: 10022 | D434: 75 | E434: 4|1|2|3 | F434: 16500|1650|1650|1650 | G434: =R[-101]C -> 35
A435: 50021 | B435: 24 | C435: 10022 | D435: 80 | E435: 4|1|2|3 | F435: 17500|1750|1750|1750 | G435: =R[-101]C -> 35
A436: 50021 | B436: 25 | C436: 10022 | D436: 85 | E436: 4|1|2|3 | F436: 18500|1850|1850|1850 | G436: =R[-101]C -> 35
A437: 50021 | B437: 26 | C437: 10022 | D437: 90 | E437: 4|1|2|3 | F437: 19500|1950|1950|1950 | G437: =R[-101]C -> 35
A438: 50021 | B438: 27 | C438: 10022 | D438: 95 | E438: 4|1|2|3 | F438: 20500|2050|2050|2050 | G438: =R[-101]C -> 35
A439: 50021 | B439: 28 | C439: 10022 | D439: 100 | E439: 4|1|2|3 | F439: 21500|2150|2150|2150 | G439: =R[-101]C -> 35
A440: 50021 | B440: 29 | C440: 10022 | D440: 110 | E440: 4|1|2|3 | F440: 22500|2250|2250|2250 | G440: =R[-101]C -> 35
A441: 50021 | B441: 30 | C441: 10022 | D441: 120 | E441: 4|1|2|3 | F441: 23500|2350|2350|2350 | G441: =R[-101]C -> 40
A442: 50021 | B442: 31 | C442: 10022 | D442: 130 | E442: 4|1|2|3 | F442: 24750|2475|2475|2475 | G442: =R[-101]C -> 40
A443: 50021 | B443: 32 | C443: 10022 | D443: 140 | E443: 4|1|2|3 | F443: 26000|2600|2600|2600 | G443: =R[-101]C -> 40
A444: 50021 | B444: 33 | C444: 10022 | D444: 150 | E444: 4|1|2|3 | F444: 27250|2725|2725|2725 | G444: =R[-101]C -> 40
A445: 50021 | B445: 34 | C445: 10022 | D445: 160 | E445: 4|1|2|3 | F445: 28500|2850|2850|2850 | G445: =R[-101]C -> 40
A446: 50021 | B446: 35 | C446: 10022 | D446: 170 | E446: 4|1|2|3 | F446: 29750|2975|2975|2975 | G446: =R[-101]C -> 40
A447: 50021 | B447: 36 | C447: 10022 | D447: 180 | E447: 4|1|2|3 | F447: 31000|3100|3100|3100 | G447: =R[-101]C -> 40
A448: 50021 | B448: 37 | C448: 10022 | D448: 190 | E448: 4|1|2|3 | F448: 32250|3225|3225|3225 | G448: =R[-101]C -> 40
A449: 50021 | B449: 38 | C449: 10022 | D449: 200 | E449: 4|1|2|3 | F449: 33500|3350|3350|3350 | G449: =R[-101]C -> 40
A450: 50021 | B450: 39 | C450: 10022 | D450: 215 | E450: 4|1|2|3 | F450: 34750|3475|3475|3475 | G450: =R[-101]C -> 40
A451: 50021 | B451: 40 | C451: 10022 | D451: 230 | E451: 4|1|2|3 | F451: 36000|3600|3600|3600 | G451: =R[-101]C -> 45
A452: 50021 | B452: 41 | C452: 10022 | D452: 245 | E452: 4|1|2|3 | F452: 37500|3750|3750|3750 | G452: =R[-101]C -> 45
A453: 50021 | B453: 42 | C453: 10022 | D453: 260 | E453: 4|1|2|3 | F453: 39000|3900|3900|3900 | G453: =R[-101]C -> 45
A454: 50021 | B454: 43 | C454: 10022 | D454: 275 | E454: 4|1|2|3 | F454: 40500|4050|4050|4050 | G454: =R[-101]C -> 45
A455: 50021 | B455: 44 | C455: 10022 | D455: 290 | E455: 4|1|2|3 | F455: 42000|4200|4200|4200 | G455: =R[-101]C -> 45
A456: 50021 | B456: 45 | C456: 10022 | D456: 305 | E456: 4|1|2|3 | F456: 43500|4350|4350|4350 | G456: =R[-101]C -> 45
A457: 50021 | B457: 46 | C457: 10022 | D457: 320 | E457: 4|1|2|3 | F457: 45000|4500|4500|4500 | G457: =R[-101]C -> 45
A458: 50021 | B458: 47 | C458: 10022 | D458: 335 | E458: 4|1|2|3 | F458: 46500|4650|4650|4650 | G458: =R[-101]C -> 45
A459: 50021 | B459: 48 | C459: 10022 | D459: 350 | E459: 4|1|2|3 | F459: 48000|4800|4800|4800 | G459: =R[-101]C -> 45
A460: 50021 | B460: 49 | C460: 10022 | D460: 370 | E460: 4|1|2|3 | F460: 49500|4950|4950|4950 | G460: =R[-101]C -> 45
A461: 50021 | B461: 50 | C461: 10022 | D461: 390 | E461: 4|1|2|3 | F461: 51000|5100|5100|5100 | G461: =R[-101]C -> 50
A462: 50021 | B462: 51 | C462: 10022 | D462: 410 | E462: 4|1|2|3 | F462: 52750|5275|5275|5275 | G462: =R[-101]C -> 50
A463: 50021 | B463: 52 | C463: 10022 | D463: 430 | E463: 4|1|2|3 | F463: 54500|5450|5450|5450 | G463: =R[-101]C -> 50
A464: 50021 | B464: 53 | C464: 10022 | D464: 450 | E464: 4|1|2|3 | F464: 56250|5625|5625|5625 | G464: =R[-101]C -> 50
A465: 50021 | B465: 54 | C465: 10022 | D465: 470 | E465: 4|1|2|3 | F465: 58000|5800|5800|5800 | G465: =R[-101]C -> 50
A466: 50021 | B466: 55 | C466: 10022 | D466: 490 | E466: 4|1|2|3 | F466: 59750|5975|5975|5975 | G466: =R[-101]C -> 50
A467: 50021 | B467: 56 | C467: 10022 | D467: 510 | E467: 4|1|2|3 | F467: 61500|6150|6150|6150 | G467: =R[-101]C -> 50
A468: 50021 | B468: 57 | C468: 10022 | D468: 530 | E468: 4|1|2|3 | F468: 63250|6325|6325|6325 | G468: =R[-101]C -> 50
A469: 50021 | B469: 58 | C469: 10022 | D469: 550 | E469: 4|1|2|3 | F469: 65000|6500|6500|6500 | G469: =R[-101]C -> 50
A470: 50021 | B470: 59 | C470: 10022 | D470: 575 | E470: 4|1|2|3 | F470: 66750|6675|6675|6675 | G470: =R[-101]C -> 50
A471: 50021 | B471: 60 | C471: 10022 | D471: 600 | E471: 4|1|2|3 | F471: 68500|6850|6850|6850 | G471: =R[-101]C -> 55
A472: 50021 | B472: 61 | C472: 10022 | D472: 625 | E472: 4|1|2|3 | F472: 70500|7050|7050|7050 | G472: =R[-101]C -> 55
A473: 50021 | B473: 62 | C473: 10022 | D473: 650 | E473: 4|1|2|3 | F473: 72500|7250|7250|7250 | G473: =R[-101]C -> 55
A474: 50021 | B474: 63 | C474: 10022 | D474: 675 | E474: 4|1|2|3 | F474: 74500|7450|7450|7450 | G474: =R[-101]C -> 55
A475: 50021 | B475: 64 | C475: 10022 | D475: 700 | E475: 4|1|2|3 | F475: 76500|7650|7650|7650 | G475: =R[-101]C -> 55
A476: 50021 | B476: 65 | C476: 10022 | D476: 725 | E476: 4|1|2|3 | F476: 78500|7850|7850|7850 | G476: =R[-101]C -> 55
A477: 50021 | B477: 66 | C477: 10022 | D477: 750 | E477: 4|1|2|3 | F477: 80500|8050|8050|8050 | G477: =R[-101]C -> 55
A478: 50021 | B478: 67 | C478: 10022 | D478: 775 | E478: 4|1|2|3 | F478: 82500|8250|8250|8250 | G478: =R[-101]C -> 55
A479: 50021 | B479: 68 | C479: 10022 | D479: 800 | E479: 4|1|2|3 | F479: 84500|8450|8450|8450 | G479: =R[-101]C -> 55
A480: 50021 | B480: 69 | C480: 10022 | D480: 830 | E480: 4|1|2|3 | F480: 86500|8650|8650|8650 | G480: =R[-101]C -> 55
A481: 50021 | B481: 70 | C481: 10022 | D481: 860 | E481: 4|1|2|3 | F481: 88500|8850|8850|8850 | G481: =R[-101]C -> 60
A482: 50021 | B482: 71 | C482: 10022 | D482: 890 | E482: 4|1|2|3 | F482: 90750|9075|9075|9075 | G482: =R[-101]C -> 60
A483: 50021 | B483: 72 | C483: 10022 | D483: 920 | E483: 4|1|2|3 | F483: 93000|9300|9300|9300 | G483: =R[-101]C -> 60
A484: 50021 | B484: 73 | C484: 10022 | D484: 950 | E484: 4|1|2|3 | F484: 95250|9525|9525|9525 | G484: =R[-101]C -> 60
A485: 50021 | B485: 74 | C485: 10022 | D485: 980 | E485: 4|1|2|3 | F485: 97500|9750|9750|9750 | G485: =R[-101]C -> 60
A486: 50021 | B486: 75 | C486: 10022 | D486: 1010 | E486: 4|1|2|3 | F486: 99750|9975|9975|9975 | G486: =R[-101]C -> 60
A487: 50021 | B487: 76 | C487: 10022 | D487: 1040 | E487: 4|1|2|3 | F487: 102000|10200|10200|10200 | G487: =R[-101]C -> 60
A488: 50021 | B488: 77 | C488: 10022 | D488: 1070 | E488: 4|1|2|3 | F488: 104250|10425|10425|10425 | G488: =R[-101]C -> 60
A489: 50021 | B489: 78 | C489: 10022 | D489: 1100 | E489: 4|1|2|3 | F489: 106500|10650|10650|10650 | G489: =R[-101]C -> 60
A490: 50021 | B490: 79 | C490: 10022 | D490: 1135 | E490: 4|1|2|3 | F490: 108750|10875|10875|10875 | G490: =R[-101]C -> 60
A491: 50021 | B491: 80 | C491: 10022 | D491: 1170 | E491: 4|1|2|3 | F491: 111000|11100|11100|11100 | G491: =R[-101]C -> 65
A492: 50021 | B492: 81 | C492: 10022 | D492: 1205 | E492: 4|1|2|3 | F492: 113500|11350|11350|11350 | G492: =R[-101]C -> 65
A493: 50021 | B493: 82 | C493: 10022 | D493: 1240 | E493: 4|1|2|3 | F493: 116000|11600|11600|11600 | G493: =R[-101]C -> 65
A494: 50021 | B494: 83 | C494: 10022 | D494: 1275 | E494: 4|1|2|3 | F494: 118500|11850|11850|11850 | G494: =R[-101]C -> 65
A495: 50021 | B495: 84 | C495: 10022 | D495: 1310 | E495: 4|1|2|3 | F495: 121000|12100|12100|12100 | G495: =R[-101]C -> 65
A496: 50021 | B496: 85 | C496: 10022 | D496: 1345 | E496: 4|1|2|3 | F496: 123500|12350|12350|12350 | G496: =R[-101]C -> 65
A497: 50021 | B497: 86 | C497: 10022 | D497: 1380 | E497: 4|1|2|3 | F497: 126000|12600|12600|12600 | G497: =R[-101]C -> 65
A498: 50021 | B498: 87 | C498: 10022 | D498: 1415 | E498: 4|1|2|3 | F498: 128500|12850|12850|12850 | G498: =R[-101]C -> 65
A499: 50021 | B499: 88 | C499: 10022 | D499: 1450 | E499: 4|1|2|3 | F499: 131000|13100|13100|13100 | G499: =R[-101]C -> 65
A500: 50021 | B500: 89 | C500: 10022 | D500: 1490 | E500: 4|1|2|3 | F500: 133500|13350|13350|13350 | G500: =R[-101]C -> 65
A501: 50021 | B501: 90 | C501: 10022 | D501: 1530 | E501: 4|1|2|3 | F501: 136000|13600|13600|13600 | G501: =R[-101]C -> 70
A502: 50021 | B502: 91 | C502: 10022 | D502: 1570 | E502: 4|1|2|3 | F502: 138750|13875|13875|13875 | G502: =R[-101]C -> 70
A503: 50021 | B503: 92 | C503: 10022 | D503: 1610 | E503: 4|1|2|3 | F503: 141500|14150|14150|14150 | G503: =R[-101]C -> 70
A504: 50021 | B504: 93 | C504: 10022 | D504: 1650 | E504: 4|1|2|3 | F504: 144250|14425|14425|14425 | G504: =R[-101]C -> 70
A505: 50021 | B505: 94 | C505: 10022 | D505: 1690 | E505: 4|1|2|3 | F505: 147000|14700|14700|14700 | G505: =R[-101]C -> 70
A506: 50021 | B506: 95 | C506: 10022 | D506: 1730 | E506: 4|1|2|3 | F506: 149750|14975|14975|14975 | G506: =R[-101]C -> 70
A507: 50021 | B507: 96 | C507: 10022 | D507: 1770 | E507: 4|1|2|3 | F507: 152500|15250|15250|15250 | G507: =R[-101]C -> 70
A508: 50021 | B508: 97 | C508: 10022 | D508: 1810 | E508: 4|1|2|3 | F508: 155250|15525|15525|15525 | G508: =R[-101]C -> 70
A509: 50021 | B509: 98 | C509: 10022 | D509: 1850 | E509: 4|1|2|3 | F509: 158000|15800|15800|15800 | G509: =R[-101]C -> 70
A510: 50021 | B510: 99 | C510: 10022 | D510: 1900 | E510: 4|1|2|3 | F510: 160750|16075|16075|16075 | G510: =R[-101]C -> 70
A511: 50021 | B511: 100 | C511: 10022 | D511: 0 | E511: 4|1|2|3 | F511: 163500|16350|16350|16350 | G511: =R[-101]C -> 75
A512: 50022 | B512: 0 | C512: 10022 | D512: 5 | E512: 4|1|2|3 | F512: 400|40|280|40 | G512: =R[-101]C -> 23
A513: 50022 | B513: 1 | C513: 10022 | D513: 5 | E513: 4|1|2|3 | F513: 600|60|420|60 | G513: =R[-101]C -> 23
A514: 50022 | B514: 2 | C514: 10022 | D514: 10 | E514: 4|1|2|3 | F514: 800|80|560|80 | G514: =R[-101]C -> 23
A515: 50022 | B515: 3 | C515: 10022 | D515: 10 | E515: 4|1|2|3 | F515: 1000|100|700|100 | G515: =R[-101]C -> 23
A516: 50022 | B516: 4 | C516: 10022 | D516: 15 | E516: 4|1|2|3 | F516: 1200|120|840|120 | G516: =R[-101]C -> 23
A517: 50022 | B517: 5 | C517: 10022 | D517: 15 | E517: 4|1|2|3 | F517: 1400|140|980|140 | G517: =R[-101]C -> 23
A518: 50022 | B518: 6 | C518: 10022 | D518: 20 | E518: 4|1|2|3 | F518: 1600|160|1120|160 | G518: =R[-101]C -> 23
A519: 50022 | B519: 7 | C519: 10022 | D519: 20 | E519: 4|1|2|3 | F519: 1800|180|1260|180 | G519: =R[-101]C -> 23
A520: 50022 | B520: 8 | C520: 10022 | D520: 25 | E520: 4|1|2|3 | F520: 2000|200|1400|200 | G520: =R[-101]C -> 23
A521: 50022 | B521: 9 | C521: 10022 | D521: 25 | E521: 4|1|2|3 | F521: 2200|220|1540|220 | G521: =R[-101]C -> 23
A522: 50022 | B522: 10 | C522: 10022 | D522: 30 | E522: 4|1|2|3 | F522: 2400|240|1680|240 | G522: =R[-101]C -> 30
A523: 50022 | B523: 11 | C523: 10022 | D523: 30 | E523: 4|1|2|3 | F523: 2700|270|1890|270 | G523: =R[-101]C -> 30
A524: 50022 | B524: 12 | C524: 10022 | D524: 35 | E524: 4|1|2|3 | F524: 3000|300|2100|300 | G524: =R[-101]C -> 30
A525: 50022 | B525: 13 | C525: 10022 | D525: 35 | E525: 4|1|2|3 | F525: 3300|330|2310|330 | G525: =R[-101]C -> 30
A526: 50022 | B526: 14 | C526: 10022 | D526: 40 | E526: 4|1|2|3 | F526: 3600|360|2520|360 | G526: =R[-101]C -> 30
A527: 50022 | B527: 15 | C527: 10022 | D527: 40 | E527: 4|1|2|3 | F527: 3900|390|2730|390 | G527: =R[-101]C -> 30
A528: 50022 | B528: 16 | C528: 10022 | D528: 45 | E528: 4|1|2|3 | F528: 4200|420|2940|420 | G528: =R[-101]C -> 30
A529: 50022 | B529: 17 | C529: 10022 | D529: 45 | E529: 4|1|2|3 | F529: 4500|450|3150|450 | G529: =R[-101]C -> 30
A530: 50022 | B530: 18 | C530: 10022 | D530: 50 | E530: 4|1|2|3 | F530: 4800|480|3360|480 | G530: =R[-101]C -> 30
A531: 50022 | B531: 19 | C531: 10022 | D531: 55 | E531: 4|1|2|3 | F531: 5100|510|3570|510 | G531: =R[-101]C -> 30
A532: 50022 | B532: 20 | C532: 10022 | D532: 60 | E532: 4|1|2|3 | F532: 5400|540|3780|540 | G532: =R[-101]C -> 35
A533: 50022 | B533: 21 | C533: 10022 | D533: 65 | E533: 4|1|2|3 | F533: 5800|580|4060|580 | G533: =R[-101]C -> 35
A534: 50022 | B534: 22 | C534: 10022 | D534: 70 | E534: 4|1|2|3 | F534: 6200|620|4340|620 | G534: =R[-101]C -> 35
A535: 50022 | B535: 23 | C535: 10022 | D535: 75 | E535: 4|1|2|3 | F535: 6600|660|4620|660 | G535: =R[-101]C -> 35
A536: 50022 | B536: 24 | C536: 10022 | D536: 80 | E536: 4|1|2|3 | F536: 7000|700|4900|700 | G536: =R[-101]C -> 35
A537: 50022 | B537: 25 | C537: 10022 | D537: 85 | E537: 4|1|2|3 | F537: 7400|740|5180|740 | G537: =R[-101]C -> 35
A538: 50022 | B538: 26 | C538: 10022 | D538: 90 | E538: 4|1|2|3 | F538: 7800|780|5460|780 | G538: =R[-101]C -> 35
A539: 50022 | B539: 27 | C539: 10022 | D539: 95 | E539: 4|1|2|3 | F539: 8200|820|5740|820 | G539: =R[-101]C -> 35
A540: 50022 | B540: 28 | C540: 10022 | D540: 100 | E540: 4|1|2|3 | F540: 8600|860|6020|860 | G540: =R[-101]C -> 35
A541: 50022 | B541: 29 | C541: 10022 | D541: 110 | E541: 4|1|2|3 | F541: 9000|900|6300|900 | G541: =R[-101]C -> 35
A542: 50022 | B542: 30 | C542: 10022 | D542: 120 | E542: 4|1|2|3 | F542: 9400|940|6580|940 | G542: =R[-101]C -> 40
A543: 50022 | B543: 31 | C543: 10022 | D543: 130 | E543: 4|1|2|3 | F543: 9900|990|6930|990 | G543: =R[-101]C -> 40
A544: 50022 | B544: 32 | C544: 10022 | D544: 140 | E544: 4|1|2|3 | F544: 10400|1040|7280|1040 | G544: =R[-101]C -> 40
A545: 50022 | B545: 33 | C545: 10022 | D545: 150 | E545: 4|1|2|3 | F545: 10900|1090|7630|1090 | G545: =R[-101]C -> 40
A546: 50022 | B546: 34 | C546: 10022 | D546: 160 | E546: 4|1|2|3 | F546: 11400|1140|7980|1140 | G546: =R[-101]C -> 40
A547: 50022 | B547: 35 | C547: 10022 | D547: 170 | E547: 4|1|2|3 | F547: 11900|1190|8330|1190 | G547: =R[-101]C -> 40
A548: 50022 | B548: 36 | C548: 10022 | D548: 180 | E548: 4|1|2|3 | F548: 12400|1240|8680|1240 | G548: =R[-101]C -> 40
A549: 50022 | B549: 37 | C549: 10022 | D549: 190 | E549: 4|1|2|3 | F549: 12900|1290|9030|1290 | G549: =R[-101]C -> 40
A550: 50022 | B550: 38 | C550: 10022 | D550: 200 | E550: 4|1|2|3 | F550: 13400|1340|9380|1340 | G550: =R[-101]C -> 40
A551: 50022 | B551: 39 | C551: 10022 | D551: 215 | E551: 4|1|2|3 | F551: 13900|1390|9730|1390 | G551: =R[-101]C -> 40
A552: 50022 | B552: 40 | C552: 10022 | D552: 230 | E552: 4|1|2|3 | F552: 14400|1440|10080|1440 | G552: =R[-101]C -> 45
A553: 50022 | B553: 41 | C553: 10022 | D553: 245 | E553: 4|1|2|3 | F553: 15000|1500|10500|1500 | G553: =R[-101]C -> 45
A554: 50022 | B554: 42 | C554: 10022 | D554: 260 | E554: 4|1|2|3 | F554: 15600|1560|10920|1560 | G554: =R[-101]C -> 45
A555: 50022 | B555: 43 | C555: 10022 | D555: 275 | E555: 4|1|2|3 | F555: 16200|1620|11340|1620 | G555: =R[-101]C -> 45
A556: 50022 | B556: 44 | C556: 10022 | D556: 290 | E556: 4|1|2|3 | F556: 16800|1680|11760|1680 | G556: =R[-101]C -> 45
A557: 50022 | B557: 45 | C557: 10022 | D557: 305 | E557: 4|1|2|3 | F557: 17400|1740|12180|1740 | G557: =R[-101]C -> 45
A558: 50022 | B558: 46 | C558: 10022 | D558: 320 | E558: 4|1|2|3 | F558: 18000|1800|12600|1800 | G558: =R[-101]C -> 45
A559: 50022 | B559: 47 | C559: 10022 | D559: 335 | E559: 4|1|2|3 | F559: 18600|1860|13020|1860 | G559: =R[-101]C -> 45
A560: 50022 | B560: 48 | C560: 10022 | D560: 350 | E560: 4|1|2|3 | F560: 19200|1920|13440|1920 | G560: =R[-101]C -> 45
A561: 50022 | B561: 49 | C561: 10022 | D561: 370 | E561: 4|1|2|3 | F561: 19800|1980|13860|1980 | G561: =R[-101]C -> 45
A562: 50022 | B562: 50 | C562: 10022 | D562: 390 | E562: 4|1|2|3 | F562: 20400|2040|14280|2040 | G562: =R[-101]C -> 50
A563: 50022 | B563: 51 | C563: 10022 | D563: 410 | E563: 4|1|2|3 | F563: 21100|2110|14770|2110 | G563: =R[-101]C -> 50
A564: 50022 | B564: 52 | C564: 10022 | D564: 430 | E564: 4|1|2|3 | F564: 21800|2180|15260|2180 | G564: =R[-101]C -> 50
A565: 50022 | B565: 53 | C565: 10022 | D565: 450 | E565: 4|1|2|3 | F565: 22500|2250|15750|2250 | G565: =R[-101]C -> 50
A566: 50022 | B566: 54 | C566: 10022 | D566: 470 | E566: 4|1|2|3 | F566: 23200|2320|16240|2320 | G566: =R[-101]C -> 50
A567: 50022 | B567: 55 | C567: 10022 | D567: 490 | E567: 4|1|2|3 | F567: 23900|2390|16730|2390 | G567: =R[-101]C -> 50
A568: 50022 | B568: 56 | C568: 10022 | D568: 510 | E568: 4|1|2|3 | F568: 24600|2460|17220|2460 | G568: =R[-101]C -> 50
A569: 50022 | B569: 57 | C569: 10022 | D569: 530 | E569: 4|1|2|3 | F569: 25300|2530|17710|2530 | G569: =R[-101]C -> 50
A570: 50022 | B570: 58 | C570: 10022 | D570: 550 | E570: 4|1|2|3 | F570: 26000|2600|18200|2600 | G570: =R[-101]C -> 50
A571: 50022 | B571: 59 | C571: 10022 | D571: 575 | E571: 4|1|2|3 | F571: 26700|2670|18690|2670 | G571: =R[-101]C -> 50
A572: 50022 | B572: 60 | C572: 10022 | D572: 600 | E572: 4|1|2|3 | F572: 27400|2740|19180|2740 | G572: =R[-101]C -> 55
A573: 50022 | B573: 61 | C573: 10022 | D573: 625 | E573: 4|1|2|3 | F573: 28200|2820|19740|2820 | G573: =R[-101]C -> 55
A574: 50022 | B574: 62 | C574: 10022 | D574: 650 | E574: 4|1|2|3 | F574: 29000|2900|20300|2900 | G574: =R[-101]C -> 55
A575: 50022 | B575: 63 | C575: 10022 | D575: 675 | E575: 4|1|2|3 | F575: 29800|2980|20860|2980 | G575: =R[-101]C -> 55
A576: 50022 | B576: 64 | C576: 10022 | D576: 700 | E576: 4|1|2|3 | F576: 30600|3060|21420|3060 | G576: =R[-101]C -> 55
A577: 50022 | B577: 65 | C577: 10022 | D577: 725 | E577: 4|1|2|3 | F577: 31400|3140|21980|3140 | G577: =R[-101]C -> 55
A578: 50022 | B578: 66 | C578: 10022 | D578: 750 | E578: 4|1|2|3 | F578: 32200|3220|22540|3220 | G578: =R[-101]C -> 55
A579: 50022 | B579: 67 | C579: 10022 | D579: 775 | E579: 4|1|2|3 | F579: 33000|3300|23100|3300 | G579: =R[-101]C -> 55
A580: 50022 | B580: 68 | C580: 10022 | D580: 800 | E580: 4|1|2|3 | F580: 33800|3380|23660|3380 | G580: =R[-101]C -> 55
A581: 50022 | B581: 69 | C581: 10022 | D581: 830 | E581: 4|1|2|3 | F581: 34600|3460|24220|3460 | G581: =R[-101]C -> 55
A582: 50022 | B582: 70 | C582: 10022 | D582: 860 | E582: 4|1|2|3 | F582: 35400|3540|24780|3540 | G582: =R[-101]C -> 60
A583: 50022 | B583: 71 | C583: 10022 | D583: 890 | E583: 4|1|2|3 | F583: 36300|3630|25410|3630 | G583: =R[-101]C -> 60
A584: 50022 | B584: 72 | C584: 10022 | D584: 920 | E584: 4|1|2|3 | F584: 37200|3720|26040|3720 | G584: =R[-101]C -> 60
A585: 50022 | B585: 73 | C585: 10022 | D585: 950 | E585: 4|1|2|3 | F585: 38100|3810|26670|3810 | G585: =R[-101]C -> 60
A586: 50022 | B586: 74 | C586: 10022 | D586: 980 | E586: 4|1|2|3 | F586: 39000|3900|27300|3900 | G586: =R[-101]C -> 60
A587: 50022 | B587: 75 | C587: 10022 | D587: 1010 | E587: 4|1|2|3 | F587: 39900|3990|27930|3990 | G587: =R[-101]C -> 60
A588: 50022 | B588: 76 | C588: 10022 | D588: 1040 | E588: 4|1|2|3 | F588: 40800|4080|28560|4080 | G588: =R[-101]C -> 60
A589: 50022 | B589: 77 | C589: 10022 | D589: 1070 | E589: 4|1|2|3 | F589: 41700|4170|29190|4170 | G589: =R[-101]C -> 60
A590: 50022 | B590: 78 | C590: 10022 | D590: 1100 | E590: 4|1|2|3 | F590: 42600|4260|29820|4260 | G590: =R[-101]C -> 60
A591: 50022 | B591: 79 | C591: 10022 | D591: 1135 | E591: 4|1|2|3 | F591: 43500|4350|30450|4350 | G591: =R[-101]C -> 60
A592: 50022 | B592: 80 | C592: 10022 | D592: 1170 | E592: 4|1|2|3 | F592: 44400|4440|31080|4440 | G592: =R[-101]C -> 65
A593: 50022 | B593: 81 | C593: 10022 | D593: 1205 | E593: 4|1|2|3 | F593: 45400|4540|31780|4540 | G593: =R[-101]C -> 65
A594: 50022 | B594: 82 | C594: 10022 | D594: 1240 | E594: 4|1|2|3 | F594: 46400|4640|32480|4640 | G594: =R[-101]C -> 65
A595: 50022 | B595: 83 | C595: 10022 | D595: 1275 | E595: 4|1|2|3 | F595: 47400|4740|33180|4740 | G595: =R[-101]C -> 65
A596: 50022 | B596: 84 | C596: 10022 | D596: 1310 | E596: 4|1|2|3 | F596: 48400|4840|33880|4840 | G596: =R[-101]C -> 65
A597: 50022 | B597: 85 | C597: 10022 | D597: 1345 | E597: 4|1|2|3 | F597: 49400|4940|34580|4940 | G597: =R[-101]C -> 65
A598: 50022 | B598: 86 | C598: 10022 | D598: 1380 | E598: 4|1|2|3 | F598: 50400|5040|35280|5040 | G598: =R[-101]C -> 65
A599: 50022 | B599: 87 | C599: 10022 | D599: 1415 | E599: 4|1|2|3 | F599: 51400|5140|35980|5140 | G599: =R[-101]C -> 65
A600: 50022 | B600: 88 | C600: 10022 | D600: 1450 | E600: 4|1|2|3 | F600: 52400|5240|36680|5240 | G600: =R[-101]C -> 65
A601: 50022 | B601: 89 | C601: 10022 | D601: 1490 | E601: 4|1|2|3 | F601: 53400|5340|37380|5340 | G601: =R[-101]C -> 65
A602: 50022 | B602: 90 | C602: 10022 | D602: 1530 | E602: 4|1|2|3 | F602: 54400|5440|38080|5440 | G602: =R[-101]C -> 70
A603: 50022 | B603: 91 | C603: 10022 | D603: 1570 | E603: 4|1|2|3 | F603: 55500|5550|38850|5550 | G603: =R[-101]C -> 70
A604: 50022 | B604: 92 | C604: 10022 | D604: 1610 | E604: 4|1|2|3 | F604: 56600|5660|39620|5660 | G604: =R[-101]C -> 70
A605: 50022 | B605: 93 | C605: 10022 | D605: 1650 | E605: 4|1|2|3 | F605: 57700|5770|40390|5770 | G605: =R[-101]C -> 70
A606: 50022 | B606: 94 | C606: 10022 | D606: 1690 | E606: 4|1|2|3 | F606: 58800|5880|41160|5880 | G606: =R[-101]C -> 70
A607: 50022 | B607: 95 | C607: 10022 | D607: 1730 | E607: 4|1|2|3 | F607: 59900|5990|41930|5990 | G607: =R[-101]C -> 70
A608: 50022 | B608: 96 | C608: 10022 | D608: 1770 | E608: 4|1|2|3 | F608: 61000|6100|42700|6100 | G608: =R[-101]C -> 70
A609: 50022 | B609: 97 | C609: 10022 | D609: 1810 | E609: 4|1|2|3 | F609: 62100|6210|43470|6210 | G609: =R[-101]C -> 70
A610: 50022 | B610: 98 | C610: 10022 | D610: 1850 | E610: 4|1|2|3 | F610: 63200|6320|44240|6320 | G610: =R[-101]C -> 70
A611: 50022 | B611: 99 | C611: 10022 | D611: 1900 | E611: 4|1|2|3 | F611: 64300|6430|45010|6430 | G611: =R[-101]C -> 70
A612: 50022 | B612: 100 | C612: 10022 | D612: 0 | E612: 4|1|2|3 | F612: 65400|6540|45780|6540 | G612: =R[-101]C -> 75
A613: 50031 | B613: 0 | C613: 10022 | D613: 5 | E613: 4|1|2|3 | F613: 1000|100|100|100 | G613: 25
A614: 50031 | B614: 1 | C614: 10022 | D614: 5 | E614: 4|1|2|3 | F614: 1500|150|150|150 | G614: 25
A615: 50031 | B615: 2 | C615: 10022 | D615: 10 | E615: 4|1|2|3 | F615: 2000|200|200|200 | G615: 25
A616: 50031 | B616: 3 | C616: 10022 | D616: 10 | E616: 4|1|2|3 | F616: 2500|250|250|250 | G616: 25
A617: 50031 | B617: 4 | C617: 10022 | D617: 15 | E617: 4|1|2|3 | F617: 3000|300|300|300 | G617: 25
A618: 50031 | B618: 5 | C618: 10022 | D618: 15 | E618: 4|1|2|3 | F618: 3500|350|350|350 | G618: 25
A619: 50031 | B619: 6 | C619: 10022 | D619: 20 | E619: 4|1|2|3 | F619: 4000|400|400|400 | G619: 25
A620: 50031 | B620: 7 | C620: 10022 | D620: 20 | E620: 4|1|2|3 | F620: 4500|450|450|450 | G620: 25
A621: 50031 | B621: 8 | C621: 10022 | D621: 25 | E621: 4|1|2|3 | F621: 5000|500|500|500 | G621: 25
A622: 50031 | B622: 9 | C622: 10022 | D622: 25 | E622: 4|1|2|3 | F622: 5500|550|550|550 | G622: 25
A623: 50031 | B623: 10 | C623: 10022 | D623: 30 | E623: 4|1|2|3 | F623: 6000|600|600|600 | G623: 30
A624: 50031 | B624: 11 | C624: 10022 | D624: 30 | E624: 4|1|2|3 | F624: 6750|675|675|675 | G624: 30
A625: 50031 | B625: 12 | C625: 10022 | D625: 35 | E625: 4|1|2|3 | F625: 7500|750|750|750 | G625: 30
A626: 50031 | B626: 13 | C626: 10022 | D626: 35 | E626: 4|1|2|3 | F626: 8250|825|825|825 | G626: 30
A627: 50031 | B627: 14 | C627: 10022 | D627: 40 | E627: 4|1|2|3 | F627: 9000|900|900|900 | G627: 30
A628: 50031 | B628: 15 | C628: 10022 | D628: 40 | E628: 4|1|2|3 | F628: 9750|975|975|975 | G628: 30
A629: 50031 | B629: 16 | C629: 10022 | D629: 45 | E629: 4|1|2|3 | F629: 10500|1050|1050|1050 | G629: 30
A630: 50031 | B630: 17 | C630: 10022 | D630: 45 | E630: 4|1|2|3 | F630: 11250|1125|1125|1125 | G630: 30
A631: 50031 | B631: 18 | C631: 10022 | D631: 50 | E631: 4|1|2|3 | F631: 12000|1200|1200|1200 | G631: 30
A632: 50031 | B632: 19 | C632: 10022 | D632: 55 | E632: 4|1|2|3 | F632: 12750|1275|1275|1275 | G632: 30
A633: 50031 | B633: 20 | C633: 10022 | D633: 60 | E633: 4|1|2|3 | F633: 13500|1350|1350|1350 | G633: 35
A634: 50031 | B634: 21 | C634: 10022 | D634: 65 | E634: 4|1|2|3 | F634: 14500|1450|1450|1450 | G634: 35
A635: 50031 | B635: 22 | C635: 10022 | D635: 70 | E635: 4|1|2|3 | F635: 15500|1550|1550|1550 | G635: 35
A636: 50031 | B636: 23 | C636: 10022 | D636: 75 | E636: 4|1|2|3 | F636: 16500|1650|1650|1650 | G636: 35
A637: 50031 | B637: 24 | C637: 10022 | D637: 80 | E637: 4|1|2|3 | F637: 17500|1750|1750|1750 | G637: 35
A638: 50031 | B638: 25 | C638: 10022 | D638: 85 | E638: 4|1|2|3 | F638: 18500|1850|1850|1850 | G638: 35
A639: 50031 | B639: 26 | C639: 10022 | D639: 90 | E639: 4|1|2|3 | F639: 19500|1950|1950|1950 | G639: 35
A640: 50031 | B640: 27 | C640: 10022 | D640: 95 | E640: 4|1|2|3 | F640: 20500|2050|2050|2050 | G640: 35
A641: 50031 | B641: 28 | C641: 10022 | D641: 100 | E641: 4|1|2|3 | F641: 21500|2150|2150|2150 | G641: 35
A642: 50031 | B642: 29 | C642: 10022 | D642: 110 | E642: 4|1|2|3 | F642: 22500|2250|2250|2250 | G642: 35
A643: 50031 | B643: 30 | C643: 10022 | D643: 120 | E643: 4|1|2|3 | F643: 23500|2350|2350|2350 | G643: 40
A644: 50031 | B644: 31 | C644: 10022 | D644: 130 | E644: 4|1|2|3 | F644: 24750|2475|2475|2475 | G644: 40
A645: 50031 | B645: 32 | C645: 10022 | D645: 140 | E645: 4|1|2|3 | F645: 26000|2600|2600|2600 | G645: 40
A646: 50031 | B646: 33 | C646: 10022 | D646: 150 | E646: 4|1|2|3 | F646: 27250|2725|2725|2725 | G646: 40
A647: 50031 | B647: 34 | C647: 10022 | D647: 160 | E647: 4|1|2|3 | F647: 28500|2850|2850|2850 | G647: 40
A648: 50031 | B648: 35 | C648: 10022 | D648: 170 | E648: 4|1|2|3 | F648: 29750|2975|2975|2975 | G648: 40
A649: 50031 | B649: 36 | C649: 10022 | D649: 180 | E649: 4|1|2|3 | F649: 31000|3100|3100|3100 | G649: 40
A650: 50031 | B650: 37 | C650: 10022 | D650: 190 | E650: 4|1|2|3 | F650: 32250|3225|3225|3225 | G650: 40
A651: 50031 | B651: 38 | C651: 10022 | D651: 200 | E651: 4|1|2|3 | F651: 33500|3350|3350|3350 | G651: 40
A652: 50031 | B652: 39 | C652: 10022 | D652: 215 | E652: 4|1|2|3 | F652: 34750|3475|3475|3475 | G652: 40
A653: 50031 | B653: 40 | C653: 10022 | D653: 230 | E653: 4|1|2|3 | F653: 36000|3600|3600|3600 | G653: 45
A654: 50031 | B654: 41 | C654: 10022 | D654: 245 | E654: 4|1|2|3 | F654: 37500|3750|3750|3750 | G654: 45
A655: 50031 | B655: 42 | C655: 10022 | D655: 260 | E655: 4|1|2|3 | F655: 39000|3900|3900|3900 | G655: 45
A656: 50031 | B656: 43 | C656: 10022 | D656: 275 | E656: 4|1|2|3 | F656: 40500|4050|4050|4050 | G656: 45
A657: 50031 | B657: 44 | C657: 10022 | D657: 290 | E657: 4|1|2|3 | F657: 42000|4200|4200|4200 | G657: 45
A658: 50031 | B658: 45 | C658: 10022 | D658: 305 | E658: 4|1|2|3 | F658: 43500|4350|4350|4350 | G658: 45
A659: 50031 | B659: 46 | C659: 10022 | D659: 320 | E659: 4|1|2|3 | F659: 45000|4500|4500|4500 | G659: 45
A660: 50031 | B660: 47 | C660: 10022 | D660: 335 | E660: 4|1|2|3 | F660: 46500|4650|4650|4650 | G660: 45
A661: 50031 | B661: 48 | C661: 10022 | D661: 350 | E661: 4|1|2|3 | F661: 48000|4800|4800|4800 | G661: 45
A662: 50031 | B662: 49 | C662: 10022 | D662: 370 | E662: 4|1|2|3 | F662: 49500|4950|4950|4950 | G662: 45
A663: 50031 | B663: 50 | C663: 10022 | D663: 390 | E663: 4|1|2|3 | F663: 51000|5100|5100|5100 | G663: 50
A664: 50031 | B664: 51 | C664: 10022 | D664: 410 | E664: 4|1|2|3 | F664: 52750|5275|5275|5275 | G664: 50
A665: 50031 | B665: 52 | C665: 10022 | D665: 430 | E665: 4|1|2|3 | F665: 54500|5450|5450|5450 | G665: 50
A666: 50031 | B666: 53 | C666: 10022 | D666: 450 | E666: 4|1|2|3 | F666: 56250|5625|5625|5625 | G666: 50
A667: 50031 | B667: 54 | C667: 10022 | D667: 470 | E667: 4|1|2|3 | F667: 58000|5800|5800|5800 | G667: 50
A668: 50031 | B668: 55 | C668: 10022 | D668: 490 | E668: 4|1|2|3 | F668: 59750|5975|5975|5975 | G668: 50
A669: 50031 | B669: 56 | C669: 10022 | D669: 510 | E669: 4|1|2|3 | F669: 61500|6150|6150|6150 | G669: 50
A670: 50031 | B670: 57 | C670: 10022 | D670: 530 | E670: 4|1|2|3 | F670: 63250|6325|6325|6325 | G670: 50
A671: 50031 | B671: 58 | C671: 10022 | D671: 550 | E671: 4|1|2|3 | F671: 65000|6500|6500|6500 | G671: 50
A672: 50031 | B672: 59 | C672: 10022 | D672: 575 | E672: 4|1|2|3 | F672: 66750|6675|6675|6675 | G672: 50
A673: 50031 | B673: 60 | C673: 10022 | D673: 600 | E673: 4|1|2|3 | F673: 68500|6850|6850|6850 | G673: 55
A674: 50031 | B674: 61 | C674: 10022 | D674: 625 | E674: 4|1|2|3 | F674: 70500|7050|7050|7050 | G674: 55
A675: 50031 | B675: 62 | C675: 10022 | D675: 650 | E675: 4|1|2|3 | F675: 72500|7250|7250|7250 | G675: 55
A676: 50031 | B676: 63 | C676: 10022 | D676: 675 | E676: 4|1|2|3 | F676: 74500|7450|7450|7450 | G676: 55
A677: 50031 | B677: 64 | C677: 10022 | D677: 700 | E677: 4|1|2|3 | F677: 76500|7650|7650|7650 | G677: 55
A678: 50031 | B678: 65 | C678: 10022 | D678: 725 | E678: 4|1|2|3 | F678: 78500|7850|7850|7850 | G678: 55
A679: 50031 | B679: 66 | C679: 10022 | D679: 750 | E679: 4|1|2|3 | F679: 80500|8050|8050|8050 | G679: 55
A680: 50031 | B680: 67 | C680: 10022 | D680: 775 | E680: 4|1|2|3 | F680: 82500|8250|8250|8250 | G680: 55
A681: 50031 | B681: 68 | C681: 10022 | D681: 800 | E681: 4|1|2|3 | F681: 84500|8450|8450|8450 | G681: 55
A682: 50031 | B682: 69 | C682: 10022 | D682: 830 | E682: 4|1|2|3 | F682: 86500|8650|8650|8650 | G682: 55
A683: 50031 | B683: 70 | C683: 10022 | D683: 860 | E683: 4|1|2|3 | F683: 88500|8850|8850|8850 | G683: 60
A684: 50031 | B684: 71 | C684: 10022 | D684: 890 | E684: 4|1|2|3 | F684: 90750|9075|9075|9075 | G684: 60
A685: 50031 | B685: 72 | C685: 10022 | D685: 920 | E685: 4|1|2|3 | F685: 93000|9300|9300|9300 | G685: 60
A686: 50031 | B686: 73 | C686: 10022 | D686: 950 | E686: 4|1|2|3 | F686: 95250|9525|9525|9525 | G686: 60
A687: 50031 | B687: 74 | C687: 10022 | D687: 980 | E687: 4|1|2|3 | F687: 97500|9750|9750|9750 | G687: 60
A688: 50031 | B688: 75 | C688: 10022 | D688: 1010 | E688: 4|1|2|3 | F688: 99750|9975|9975|9975 | G688: 60
A689: 50031 | B689: 76 | C689: 10022 | D689: 1040 | E689: 4|1|2|3 | F689: 102000|10200|10200|10200 | G689: 60
A690: 50031 | B690: 77 | C690: 10022 | D690: 1070 | E690: 4|1|2|3 | F690: 104250|10425|10425|10425 | G690: 60
A691: 50031 | B691: 78 | C691: 10022 | D691: 1100 | E691: 4|1|2|3 | F691: 106500|10650|10650|10650 | G691: 60
A692: 50031 | B692: 79 | C692: 10022 | D692: 1135 | E692: 4|1|2|3 | F692: 108750|10875|10875|10875 | G692: 60
A693: 50031 | B693: 80 | C693: 10022 | D693: 1170 | E693: 4|1|2|3 | F693: 111000|11100|11100|11100 | G693: 65
A694: 50031 | B694: 81 | C694: 10022 | D694: 1205 | E694: 4|1|2|3 | F694: 113500|11350|11350|11350 | G694: 65
A695: 50031 | B695: 82 | C695: 10022 | D695: 1240 | E695: 4|1|2|3 | F695: 116000|11600|11600|11600 | G695: 65
A696: 50031 | B696: 83 | C696: 10022 | D696: 1275 | E696: 4|1|2|3 | F696: 118500|11850|11850|11850 | G696: 65
A697: 50031 | B697: 84 | C697: 10022 | D697: 1310 | E697: 4|1|2|3 | F697: 121000|12100|12100|12100 | G697: 65
A698: 50031 | B698: 85 | C698: 10022 | D698: 1345 | E698: 4|1|2|3 | F698: 123500|12350|12350|12350 | G698: 65
A699: 50031 | B699: 86 | C699: 10022 | D699: 1380 | E699: 4|1|2|3 | F699: 126000|12600|12600|12600 | G699: 65
A700: 50031 | B700: 87 | C700: 10022 | D700: 1415 | E700: 4|1|2|3 | F700: 128500|12850|12850|12850 | G700: 65
A701: 50031 | B701: 88 | C701: 10022 | D701: 1450 | E701: 4|1|2|3 | F701: 131000|13100|13100|13100 | G701: 65
A702: 50031 | B702: 89 | C702: 10022 | D702: 1490 | E702: 4|1|2|3 | F702: 133500|13350|13350|13350 | G702: 65
A703: 50031 | B703: 90 | C703: 10022 | D703: 1530 | E703: 4|1|2|3 | F703: 136000|13600|13600|13600 | G703: 70
A704: 50031 | B704: 91 | C704: 10022 | D704: 1570 | E704: 4|1|2|3 | F704: 138750|13875|13875|13875 | G704: 70
A705: 50031 | B705: 92 | C705: 10022 | D705: 1610 | E705: 4|1|2|3 | F705: 141500|14150|14150|14150 | G705: 70
A706: 50031 | B706: 93 | C706: 10022 | D706: 1650 | E706: 4|1|2|3 | F706: 144250|14425|14425|14425 | G706: 70
A707: 50031 | B707: 94 | C707: 10022 | D707: 1690 | E707: 4|1|2|3 | F707: 147000|14700|14700|14700 | G707: 70
A708: 50031 | B708: 95 | C708: 10022 | D708: 1730 | E708: 4|1|2|3 | F708: 149750|14975|14975|14975 | G708: 70
A709: 50031 | B709: 96 | C709: 10022 | D709: 1770 | E709: 4|1|2|3 | F709: 152500|15250|15250|15250 | G709: 70
A710: 50031 | B710: 97 | C710: 10022 | D710: 1810 | E710: 4|1|2|3 | F710: 155250|15525|15525|15525 | G710: 70
A711: 50031 | B711: 98 | C711: 10022 | D711: 1850 | E711: 4|1|2|3 | F711: 158000|15800|15800|15800 | G711: 70
A712: 50031 | B712: 99 | C712: 10022 | D712: 1900 | E712: 4|1|2|3 | F712: 160750|16075|16075|16075 | G712: 70
A713: 50031 | B713: 100 | C713: 10022 | D713: 0 | E713: 4|1|2|3 | F713: 163500|16350|16350|16350 | G713: 75
A714: 50032 | B714: 0 | C714: 10022 | D714: 5 | E714: 4|1|2|3 | F714: 400|280|40|40 | G714: =R[-101]C -> 25
A715: 50032 | B715: 1 | C715: 10022 | D715: 5 | E715: 4|1|2|3 | F715: 600|420|60|60 | G715: =R[-101]C -> 25
A716: 50032 | B716: 2 | C716: 10022 | D716: 10 | E716: 4|1|2|3 | F716: 800|560|80|80 | G716: =R[-101]C -> 25
A717: 50032 | B717: 3 | C717: 10022 | D717: 10 | E717: 4|1|2|3 | F717: 1000|700|100|100 | G717: =R[-101]C -> 25
A718: 50032 | B718: 4 | C718: 10022 | D718: 15 | E718: 4|1|2|3 | F718: 1200|840|120|120 | G718: =R[-101]C -> 25
A719: 50032 | B719: 5 | C719: 10022 | D719: 15 | E719: 4|1|2|3 | F719: 1400|980|140|140 | G719: =R[-101]C -> 25
A720: 50032 | B720: 6 | C720: 10022 | D720: 20 | E720: 4|1|2|3 | F720: 1600|1120|160|160 | G720: =R[-101]C -> 25
A721: 50032 | B721: 7 | C721: 10022 | D721: 20 | E721: 4|1|2|3 | F721: 1800|1260|180|180 | G721: =R[-101]C -> 25
A722: 50032 | B722: 8 | C722: 10022 | D722: 25 | E722: 4|1|2|3 | F722: 2000|1400|200|200 | G722: =R[-101]C -> 25
A723: 50032 | B723: 9 | C723: 10022 | D723: 25 | E723: 4|1|2|3 | F723: 2200|1540|220|220 | G723: =R[-101]C -> 25
A724: 50032 | B724: 10 | C724: 10022 | D724: 30 | E724: 4|1|2|3 | F724: 2400|1680|240|240 | G724: =R[-101]C -> 30
A725: 50032 | B725: 11 | C725: 10022 | D725: 30 | E725: 4|1|2|3 | F725: 2700|1890|270|270 | G725: =R[-101]C -> 30
A726: 50032 | B726: 12 | C726: 10022 | D726: 35 | E726: 4|1|2|3 | F726: 3000|2100|300|300 | G726: =R[-101]C -> 30
A727: 50032 | B727: 13 | C727: 10022 | D727: 35 | E727: 4|1|2|3 | F727: 3300|2310|330|330 | G727: =R[-101]C -> 30
A728: 50032 | B728: 14 | C728: 10022 | D728: 40 | E728: 4|1|2|3 | F728: 3600|2520|360|360 | G728: =R[-101]C -> 30
A729: 50032 | B729: 15 | C729: 10022 | D729: 40 | E729: 4|1|2|3 | F729: 3900|2730|390|390 | G729: =R[-101]C -> 30
A730: 50032 | B730: 16 | C730: 10022 | D730: 45 | E730: 4|1|2|3 | F730: 4200|2940|420|420 | G730: =R[-101]C -> 30
A731: 50032 | B731: 17 | C731: 10022 | D731: 45 | E731: 4|1|2|3 | F731: 4500|3150|450|450 | G731: =R[-101]C -> 30
A732: 50032 | B732: 18 | C732: 10022 | D732: 50 | E732: 4|1|2|3 | F732: 4800|3360|480|480 | G732: =R[-101]C -> 30
A733: 50032 | B733: 19 | C733: 10022 | D733: 55 | E733: 4|1|2|3 | F733: 5100|3570|510|510 | G733: =R[-101]C -> 30
A734: 50032 | B734: 20 | C734: 10022 | D734: 60 | E734: 4|1|2|3 | F734: 5400|3780|540|540 | G734: =R[-101]C -> 35
A735: 50032 | B735: 21 | C735: 10022 | D735: 65 | E735: 4|1|2|3 | F735: 5800|4060|580|580 | G735: =R[-101]C -> 35
A736: 50032 | B736: 22 | C736: 10022 | D736: 70 | E736: 4|1|2|3 | F736: 6200|4340|620|620 | G736: =R[-101]C -> 35
A737: 50032 | B737: 23 | C737: 10022 | D737: 75 | E737: 4|1|2|3 | F737: 6600|4620|660|660 | G737: =R[-101]C -> 35
A738: 50032 | B738: 24 | C738: 10022 | D738: 80 | E738: 4|1|2|3 | F738: 7000|4900|700|700 | G738: =R[-101]C -> 35
A739: 50032 | B739: 25 | C739: 10022 | D739: 85 | E739: 4|1|2|3 | F739: 7400|5180|740|740 | G739: =R[-101]C -> 35
A740: 50032 | B740: 26 | C740: 10022 | D740: 90 | E740: 4|1|2|3 | F740: 7800|5460|780|780 | G740: =R[-101]C -> 35
A741: 50032 | B741: 27 | C741: 10022 | D741: 95 | E741: 4|1|2|3 | F741: 8200|5740|820|820 | G741: =R[-101]C -> 35
A742: 50032 | B742: 28 | C742: 10022 | D742: 100 | E742: 4|1|2|3 | F742: 8600|6020|860|860 | G742: =R[-101]C -> 35
A743: 50032 | B743: 29 | C743: 10022 | D743: 110 | E743: 4|1|2|3 | F743: 9000|6300|900|900 | G743: =R[-101]C -> 35
A744: 50032 | B744: 30 | C744: 10022 | D744: 120 | E744: 4|1|2|3 | F744: 9400|6580|940|940 | G744: =R[-101]C -> 40
A745: 50032 | B745: 31 | C745: 10022 | D745: 130 | E745: 4|1|2|3 | F745: 9900|6930|990|990 | G745: =R[-101]C -> 40
A746: 50032 | B746: 32 | C746: 10022 | D746: 140 | E746: 4|1|2|3 | F746: 10400|7280|1040|1040 | G746: =R[-101]C -> 40
A747: 50032 | B747: 33 | C747: 10022 | D747: 150 | E747: 4|1|2|3 | F747: 10900|7630|1090|1090 | G747: =R[-101]C -> 40
A748: 50032 | B748: 34 | C748: 10022 | D748: 160 | E748: 4|1|2|3 | F748: 11400|7980|1140|1140 | G748: =R[-101]C -> 40
A749: 50032 | B749: 35 | C749: 10022 | D749: 170 | E749: 4|1|2|3 | F749: 11900|8330|1190|1190 | G749: =R[-101]C -> 40
A750: 50032 | B750: 36 | C750: 10022 | D750: 180 | E750: 4|1|2|3 | F750: 12400|8680|1240|1240 | G750: =R[-101]C -> 40
A751: 50032 | B751: 37 | C751: 10022 | D751: 190 | E751: 4|1|2|3 | F751: 12900|9030|1290|1290 | G751: =R[-101]C -> 40
A752: 50032 | B752: 38 | C752: 10022 | D752: 200 | E752: 4|1|2|3 | F752: 13400|9380|1340|1340 | G752: =R[-101]C -> 40
A753: 50032 | B753: 39 | C753: 10022 | D753: 215 | E753: 4|1|2|3 | F753: 13900|9730|1390|1390 | G753: =R[-101]C -> 40
A754: 50032 | B754: 40 | C754: 10022 | D754: 230 | E754: 4|1|2|3 | F754: 14400|10080|1440|1440 | G754: =R[-101]C -> 45
A755: 50032 | B755: 41 | C755: 10022 | D755: 245 | E755: 4|1|2|3 | F755: 15000|10500|1500|1500 | G755: =R[-101]C -> 45
A756: 50032 | B756: 42 | C756: 10022 | D756: 260 | E756: 4|1|2|3 | F756: 15600|10920|1560|1560 | G756: =R[-101]C -> 45
A757: 50032 | B757: 43 | C757: 10022 | D757: 275 | E757: 4|1|2|3 | F757: 16200|11340|1620|1620 | G757: =R[-101]C -> 45
A758: 50032 | B758: 44 | C758: 10022 | D758: 290 | E758: 4|1|2|3 | F758: 16800|11760|1680|1680 | G758: =R[-101]C -> 45
A759: 50032 | B759: 45 | C759: 10022 | D759: 305 | E759: 4|1|2|3 | F759: 17400|12180|1740|1740 | G759: =R[-101]C -> 45
A760: 50032 | B760: 46 | C760: 10022 | D760: 320 | E760: 4|1|2|3 | F760: 18000|12600|1800|1800 | G760: =R[-101]C -> 45
A761: 50032 | B761: 47 | C761: 10022 | D761: 335 | E761: 4|1|2|3 | F761: 18600|13020|1860|1860 | G761: =R[-101]C -> 45
A762: 50032 | B762: 48 | C762: 10022 | D762: 350 | E762: 4|1|2|3 | F762: 19200|13440|1920|1920 | G762: =R[-101]C -> 45
A763: 50032 | B763: 49 | C763: 10022 | D763: 370 | E763: 4|1|2|3 | F763: 19800|13860|1980|1980 | G763: =R[-101]C -> 45
A764: 50032 | B764: 50 | C764: 10022 | D764: 390 | E764: 4|1|2|3 | F764: 20400|14280|2040|2040 | G764: =R[-101]C -> 50
A765: 50032 | B765: 51 | C765: 10022 | D765: 410 | E765: 4|1|2|3 | F765: 21100|14770|2110|2110 | G765: =R[-101]C -> 50
A766: 50032 | B766: 52 | C766: 10022 | D766: 430 | E766: 4|1|2|3 | F766: 21800|15260|2180|2180 | G766: =R[-101]C -> 50
A767: 50032 | B767: 53 | C767: 10022 | D767: 450 | E767: 4|1|2|3 | F767: 22500|15750|2250|2250 | G767: =R[-101]C -> 50
A768: 50032 | B768: 54 | C768: 10022 | D768: 470 | E768: 4|1|2|3 | F768: 23200|16240|2320|2320 | G768: =R[-101]C -> 50
A769: 50032 | B769: 55 | C769: 10022 | D769: 490 | E769: 4|1|2|3 | F769: 23900|16730|2390|2390 | G769: =R[-101]C -> 50
A770: 50032 | B770: 56 | C770: 10022 | D770: 510 | E770: 4|1|2|3 | F770: 24600|17220|2460|2460 | G770: =R[-101]C -> 50
A771: 50032 | B771: 57 | C771: 10022 | D771: 530 | E771: 4|1|2|3 | F771: 25300|17710|2530|2530 | G771: =R[-101]C -> 50
A772: 50032 | B772: 58 | C772: 10022 | D772: 550 | E772: 4|1|2|3 | F772: 26000|18200|2600|2600 | G772: =R[-101]C -> 50
A773: 50032 | B773: 59 | C773: 10022 | D773: 575 | E773: 4|1|2|3 | F773: 26700|18690|2670|2670 | G773: =R[-101]C -> 50
A774: 50032 | B774: 60 | C774: 10022 | D774: 600 | E774: 4|1|2|3 | F774: 27400|19180|2740|2740 | G774: =R[-101]C -> 55
A775: 50032 | B775: 61 | C775: 10022 | D775: 625 | E775: 4|1|2|3 | F775: 28200|19740|2820|2820 | G775: =R[-101]C -> 55
A776: 50032 | B776: 62 | C776: 10022 | D776: 650 | E776: 4|1|2|3 | F776: 29000|20300|2900|2900 | G776: =R[-101]C -> 55
A777: 50032 | B777: 63 | C777: 10022 | D777: 675 | E777: 4|1|2|3 | F777: 29800|20860|2980|2980 | G777: =R[-101]C -> 55
A778: 50032 | B778: 64 | C778: 10022 | D778: 700 | E778: 4|1|2|3 | F778: 30600|21420|3060|3060 | G778: =R[-101]C -> 55
A779: 50032 | B779: 65 | C779: 10022 | D779: 725 | E779: 4|1|2|3 | F779: 31400|21980|3140|3140 | G779: =R[-101]C -> 55
A780: 50032 | B780: 66 | C780: 10022 | D780: 750 | E780: 4|1|2|3 | F780: 32200|22540|3220|3220 | G780: =R[-101]C -> 55
A781: 50032 | B781: 67 | C781: 10022 | D781: 775 | E781: 4|1|2|3 | F781: 33000|23100|3300|3300 | G781: =R[-101]C -> 55
A782: 50032 | B782: 68 | C782: 10022 | D782: 800 | E782: 4|1|2|3 | F782: 33800|23660|3380|3380 | G782: =R[-101]C -> 55
A783: 50032 | B783: 69 | C783: 10022 | D783: 830 | E783: 4|1|2|3 | F783: 34600|24220|3460|3460 | G783: =R[-101]C -> 55
A784: 50032 | B784: 70 | C784: 10022 | D784: 860 | E784: 4|1|2|3 | F784: 35400|24780|3540|3540 | G784: =R[-101]C -> 60
A785: 50032 | B785: 71 | C785: 10022 | D785: 890 | E785: 4|1|2|3 | F785: 36300|25410|3630|3630 | G785: =R[-101]C -> 60
A786: 50032 | B786: 72 | C786: 10022 | D786: 920 | E786: 4|1|2|3 | F786: 37200|26040|3720|3720 | G786: =R[-101]C -> 60
A787: 50032 | B787: 73 | C787: 10022 | D787: 950 | E787: 4|1|2|3 | F787: 38100|26670|3810|3810 | G787: =R[-101]C -> 60
A788: 50032 | B788: 74 | C788: 10022 | D788: 980 | E788: 4|1|2|3 | F788: 39000|27300|3900|3900 | G788: =R[-101]C -> 60
A789: 50032 | B789: 75 | C789: 10022 | D789: 1010 | E789: 4|1|2|3 | F789: 39900|27930|3990|3990 | G789: =R[-101]C -> 60
A790: 50032 | B790: 76 | C790: 10022 | D790: 1040 | E790: 4|1|2|3 | F790: 40800|28560|4080|4080 | G790: =R[-101]C -> 60
A791: 50032 | B791: 77 | C791: 10022 | D791: 1070 | E791: 4|1|2|3 | F791: 41700|29190|4170|4170 | G791: =R[-101]C -> 60
A792: 50032 | B792: 78 | C792: 10022 | D792: 1100 | E792: 4|1|2|3 | F792: 42600|29820|4260|4260 | G792: =R[-101]C -> 60
A793: 50032 | B793: 79 | C793: 10022 | D793: 1135 | E793: 4|1|2|3 | F793: 43500|30450|4350|4350 | G793: =R[-101]C -> 60
A794: 50032 | B794: 80 | C794: 10022 | D794: 1170 | E794: 4|1|2|3 | F794: 44400|31080|4440|4440 | G794: =R[-101]C -> 65
A795: 50032 | B795: 81 | C795: 10022 | D795: 1205 | E795: 4|1|2|3 | F795: 45400|31780|4540|4540 | G795: =R[-101]C -> 65
A796: 50032 | B796: 82 | C796: 10022 | D796: 1240 | E796: 4|1|2|3 | F796: 46400|32480|4640|4640 | G796: =R[-101]C -> 65
A797: 50032 | B797: 83 | C797: 10022 | D797: 1275 | E797: 4|1|2|3 | F797: 47400|33180|4740|4740 | G797: =R[-101]C -> 65
A798: 50032 | B798: 84 | C798: 10022 | D798: 1310 | E798: 4|1|2|3 | F798: 48400|33880|4840|4840 | G798: =R[-101]C -> 65
A799: 50032 | B799: 85 | C799: 10022 | D799: 1345 | E799: 4|1|2|3 | F799: 49400|34580|4940|4940 | G799: =R[-101]C -> 65
A800: 50032 | B800: 86 | C800: 10022 | D800: 1380 | E800: 4|1|2|3 | F800: 50400|35280|5040|5040 | G800: =R[-101]C -> 65
A801: 50032 | B801: 87 | C801: 10022 | D801: 1415 | E801: 4|1|2|3 | F801: 51400|35980|5140|5140 | G801: =R[-101]C -> 65
A802: 50032 | B802: 88 | C802: 10022 | D802: 1450 | E802: 4|1|2|3 | F802: 52400|36680|5240|5240 | G802: =R[-101]C -> 65
A803: 50032 | B803: 89 | C803: 10022 | D803: 1490 | E803: 4|1|2|3 | F803: 53400|37380|5340|5340 | G803: =R[-101]C -> 65
A804: 50032 | B804: 90 | C804: 10022 | D804: 1530 | E804: 4|1|2|3 | F804: 54400|38080|5440|5440 | G804: =R[-101]C -> 70
A805: 50032 | B805: 91 | C805: 10022 | D805: 1570 | E805: 4|1|2|3 | F805: 55500|38850|5550|5550 | G805: =R[-101]C -> 70
A806: 50032 | B806: 92 | C806: 10022 | D806: 1610 | E806: 4|1|2|3 | F806: 56600|39620|5660|5660 | G806: =R[-101]C -> 70
A807: 50032 | B807: 93 | C807: 10022 | D807: 1650 | E807: 4|1|2|3 | F807: 57700|40390|5770|5770 | G807: =R[-101]C -> 70
A808: 50032 | B808: 94 | C808: 10022 | D808: 1690 | E808: 4|1|2|3 | F808: 58800|41160|5880|5880 | G808: =R[-101]C -> 70
A809: 50032 | B809: 95 | C809: 10022 | D809: 1730 | E809: 4|1|2|3 | F809: 59900|41930|5990|5990 | G809: =R[-101]C -> 70
A810: 50032 | B810: 96 | C810: 10022 | D810: 1770 | E810: 4|1|2|3 | F810: 61000|42700|6100|6100 | G810: =R[-101]C -> 70
A811: 50032 | B811: 97 | C811: 10022 | D811: 1810 | E811: 4|1|2|3 | F811: 62100|43470|6210|6210 | G811: =R[-101]C -> 70
A812: 50032 | B812: 98 | C812: 10022 | D812: 1850 | E812: 4|1|2|3 | F812: 63200|44240|6320|6320 | G812: =R[-101]C -> 70
A813: 50032 | B813: 99 | C813: 10022 | D813: 1900 | E813: 4|1|2|3 | F813: 64300|45010|6430|6430 | G813: =R[-101]C -> 70
A814: 50032 | B814: 100 | C814: 10022 | D814: 0 | E814: 4|1|2|3 | F814: 65400|45780|6540|6540 | G814: =R[-101]C -> 75

Sheet: 精灵图鉴
A1: id|id | B1: pokedex_level|pokedex_level | C1: name| | D1: spirit_list|spirit_list | E1: need_enhance_level|need_enhance_level | F1: pro_type|pro_type | G1: pro_value|pro_value
A2: 不可空 | B2: 不可空 | C2: 可空#不需字段 | D2: 不可空 | E2: 不可空 | F2: 不可空 | G2: 不可空
A3: 数字 | B3: 数字 | C3: 字符串 | D3: 一维数组 | E3: 数字 | F3: 数字 | G3: 数字
D4: 不定长
A6: 图鉴ID | B6: 图鉴等级 | C6: 图鉴名称 | D6: 需要的精灵列表 | E6: 需要的强化等级 | F6: 获得的属性类型 | G6: 获得的属性值(累积值)
A7: 1 | B7: 1 | C7: 绝境的曙光 | D7: 50001|50002 | E7: 0 | F7: 4 | G7: 100
A8: 1 | B8: 2 | C8: 绝境的曙光 | D8: 50001|50002 | E8: 5 | F8: 4 | G8: 200
A9: 1 | B9: 3 | C9: 绝境的曙光 | D9: 50001|50002 | E9: 10 | F9: 4 | G9: 400
A10: 1 | B10: 4 | C10: 绝境的曙光 | D10: 50001|50002 | E10: 15 | F10: 4 | G10: 600
A11: 1 | B11: 5 | C11: 绝境的曙光 | D11: 50001|50002 | E11: 20 | F11: 4 | G11: 800
A12: 1 | B12: 6 | C12: 绝境的曙光 | D12: 50001|50002 | E12: 25 | F12: 4 | G12: 1000
A13: 1 | B13: 7 | C13: 绝境的曙光 | D13: 50001|50002 | E13: 30 | F13: 4 | G13: 1200
A14: 1 | B14: 8 | C14: 绝境的曙光 | D14: 50001|50002 | E14: 35 | F14: 4 | G14: 1400
A15: 1 | B15: 9 | C15: 绝境的曙光 | D15: 50001|50002 | E15: 40 | F15: 4 | G15: 1600
A16: 1 | B16: 10 | C16: 绝境的曙光 | D16: 50001|50002 | E16: 45 | F16: 4 | G16: 1800
A17: 1 | B17: 11 | C17: 绝境的曙光 | D17: 50001|50002 | E17: 50 | F17: 4 | G17: 2000
A18: 1 | B18: 12 | C18: 绝境的曙光 | D18: 50001|50002 | E18: 55 | F18: 4 | G18: 2200
A19: 1 | B19: 13 | C19: 绝境的曙光 | D19: 50001|50002 | E19: 60 | F19: 4 | G19: 2400
A20: 1 | B20: 14 | C20: 绝境的曙光 | D20: 50001|50002 | E20: 65 | F20: 4 | G20: 2600
A21: 1 | B21: 15 | C21: 绝境的曙光 | D21: 50001|50002 | E21: 70 | F21: 4 | G21: 2800
A22: 1 | B22: 16 | C22: 绝境的曙光 | D22: 50001|50002 | E22: 75 | F22: 4 | G22: 3000
A23: 1 | B23: 17 | C23: 绝境的曙光 | D23: 50001|50002 | E23: 80 | F23: 4 | G23: 3200
A24: 1 | B24: 18 | C24: 绝境的曙光 | D24: 50001|50002 | E24: 85 | F24: 4 | G24: 3400
A25: 1 | B25: 19 | C25: 绝境的曙光 | D25: 50001|50002 | E25: 90 | F25: 4 | G25: 3600
A26: 1 | B26: 20 | C26: 绝境的曙光 | D26: 50001|50002 | E26: 95 | F26: 4 | G26: 3800
A27: 1 | B27: 21 | C27: 绝境的曙光 | D27: 50001|50002 | E27: 100 | F27: 4 | G27: 4000
A28: 2 | B28: 1 | C28: 冰与火之歌 | D28: 50011|50012 | E28: 0 | F28: 4 | G28: 100
A29: 2 | B29: 2 | C29: 冰与火之歌 | D29: 50011|50012 | E29: 5 | F29: 4 | G29: 200
A30: 2 | B30: 3 | C30: 冰与火之歌 | D30: 50011|50012 | E30: 10 | F30: 4 | G30: 400
A31: 2 | B31: 4 | C31: 冰与火之歌 | D31: 50011|50012 | E31: 15 | F31: 4 | G31: 600
A32: 2 | B32: 5 | C32: 冰与火之歌 | D32: 50011|50012 | E32: 20 | F32: 4 | G32: 800
A33: 2 | B33: 6 | C33: 冰与火之歌 | D33: 50011|50012 | E33: 25 | F33: 4 | G33: 1000
A34: 2 | B34: 7 | C34: 冰与火之歌 | D34: 50011|50012 | E34: 30 | F34: 4 | G34: 1200
A35: 2 | B35: 8 | C35: 冰与火之歌 | D35: 50011|50012 | E35: 35 | F35: 4 | G35: 1400
A36: 2 | B36: 9 | C36: 冰与火之歌 | D36: 50011|50012 | E36: 40 | F36: 4 | G36: 1600
A37: 2 | B37: 10 | C37: 冰与火之歌 | D37: 50011|50012 | E37: 45 | F37: 4 | G37: 1800
A38: 2 | B38: 11 | C38: 冰与火之歌 | D38: 50011|50012 | E38: 50 | F38: 4 | G38: 2000
A39: 2 | B39: 12 | C39: 冰与火之歌 | D39: 50011|50012 | E39: 55 | F39: 4 | G39: 2200
A40: 2 | B40: 13 | C40: 冰与火之歌 | D40: 50011|50012 | E40: 60 | F40: 4 | G40: 2400
A41: 2 | B41: 14 | C41: 冰与火之歌 | D41: 50011|50012 | E41: 65 | F41: 4 | G41: 2600
A42: 2 | B42: 15 | C42: 冰与火之歌 | D42: 50011|50012 | E42: 70 | F42: 4 | G42: 2800
A43: 2 | B43: 16 | C43: 冰与火之歌 | D43: 50011|50012 | E43: 75 | F43: 4 | G43: 3000
A44: 2 | B44: 17 | C44: 冰与火之歌 | D44: 50011|50012 | E44: 80 | F44: 4 | G44: 3200
A45: 2 | B45: 18 | C45: 冰与火之歌 | D45: 50011|50012 | E45: 85 | F45: 4 | G45: 3400
A46: 2 | B46: 19 | C46: 冰与火之歌 | D46: 50011|50012 | E46: 90 | F46: 4 | G46: 3600
A47: 2 | B47: 20 | C47: 冰与火之歌 | D47: 50011|50012 | E47: 95 | F47: 4 | G47: 3800
A48: 2 | B48: 21 | C48: 冰与火之歌 | D48: 50011|50012 | E48: 100 | F48: 4 | G48: 4000
A49: 3 | B49: 1 | C49: 呼啸的死地 | D49: 50021|50022 | E49: 0 | F49: 4 | G49: 100
A50: 3 | B50: 2 | C50: 呼啸的死地 | D50: 50021|50022 | E50: 5 | F50: 4 | G50: 200
A51: 3 | B51: 3 | C51: 呼啸的死地 | D51: 50021|50022 | E51: 10 | F51: 4 | G51: 400
A52: 3 | B52: 4 | C52: 呼啸的死地 | D52: 50021|50022 | E52: 15 | F52: 4 | G52: 600
A53: 3 | B53: 5 | C53: 呼啸的死地 | D53: 50021|50022 | E53: 20 | F53: 4 | G53: 800
A54: 3 | B54: 6 | C54: 呼啸的死地 | D54: 50021|50022 | E54: 25 | F54: 4 | G54: 1000
A55: 3 | B55: 7 | C55: 呼啸的死地 | D55: 50021|50022 | E55: 30 | F55: 4 | G55: 1200
A56: 3 | B56: 8 | C56: 呼啸的死地 | D56: 50021|50022 | E56: 35 | F56: 4 | G56: 1400
A57: 3 | B57: 9 | C57: 呼啸的死地 | D57: 50021|50022 | E57: 40 | F57: 4 | G57: 1600
A58: 3 | B58: 10 | C58: 呼啸的死地 | D58: 50021|50022 | E58: 45 | F58: 4 | G58: 1800
A59: 3 | B59: 11 | C59: 呼啸的死地 | D59: 50021|50022 | E59: 50 | F59: 4 | G59: 2000
A60: 3 | B60: 12 | C60: 呼啸的死地 | D60: 50021|50022 | E60: 55 | F60: 4 | G60: 2200
A61: 3 | B61: 13 | C61: 呼啸的死地 | D61: 50021|50022 | E61: 60 | F61: 4 | G61: 2400
A62: 3 | B62: 14 | C62: 呼啸的死地 | D62: 50021|50022 | E62: 65 | F62: 4 | G62: 2600
A63: 3 | B63: 15 | C63: 呼啸的死地 | D63: 50021|50022 | E63: 70 | F63: 4 | G63: 2800
A64: 3 | B64: 16 | C64: 呼啸的死地 | D64: 50021|50022 | E64: 75 | F64: 4 | G64: 3000
A65: 3 | B65: 17 | C65: 呼啸的死地 | D65: 50021|50022 | E65: 80 | F65: 4 | G65: 3200
A66: 3 | B66: 18 | C66: 呼啸的死地 | D66: 50021|50022 | E66: 85 | F66: 4 | G66: 3400
A67: 3 | B67: 19 | C67: 呼啸的死地 | D67: 50021|50022 | E67: 90 | F67: 4 | G67: 3600
A68: 3 | B68: 20 | C68: 呼啸的死地 | D68: 50021|50022 | E68: 95 | F68: 4 | G68: 3800
A69: 3 | B69: 21 | C69: 呼啸的死地 | D69: 50021|50022 | E69: 100 | F69: 4 | G69: 4000
A70: 4 | B70: 1 | C70: 万物皆凋零 | D70: 50031|50032 | E70: 0 | F70: 4 | G70: 100
A71: 4 | B71: 2 | C71: 万物皆凋零 | D71: 50031|50032 | E71: 5 | F71: 4 | G71: 200
A72: 4 | B72: 3 | C72: 万物皆凋零 | D72: 50031|50032 | E72: 10 | F72: 4 | G72: 400
A73: 4 | B73: 4 | C73: 万物皆凋零 | D73: 50031|50032 | E73: 15 | F73: 4 | G73: 600
A74: 4 | B74: 5 | C74: 万物皆凋零 | D74: 50031|50032 | E74: 20 | F74: 4 | G74: 800
A75: 4 | B75: 6 | C75: 万物皆凋零 | D75: 50031|50032 | E75: 25 | F75: 4 | G75: 1000
A76: 4 | B76: 7 | C76: 万物皆凋零 | D76: 50031|50032 | E76: 30 | F76: 4 | G76: 1200
A77: 4 | B77: 8 | C77: 万物皆凋零 | D77: 50031|50032 | E77: 35 | F77: 4 | G77: 1400
A78: 4 | B78: 9 | C78: 万物皆凋零 | D78: 50031|50032 | E78: 40 | F78: 4 | G78: 1600
A79: 4 | B79: 10 | C79: 万物皆凋零 | D79: 50031|50032 | E79: 45 | F79: 4 | G79: 1800
A80: 4 | B80: 11 | C80: 万物皆凋零 | D80: 50031|50032 | E80: 50 | F80: 4 | G80: 2000
A81: 4 | B81: 12 | C81: 万物皆凋零 | D81: 50031|50032 | E81: 55 | F81: 4 | G81: 2200
A82: 4 | B82: 13 | C82: 万物皆凋零 | D82: 50031|50032 | E82: 60 | F82: 4 | G82: 2400
A83: 4 | B83: 14 | C83: 万物皆凋零 | D83: 50031|50032 | E83: 65 | F83: 4 | G83: 2600
A84: 4 | B84: 15 | C84: 万物皆凋零 | D84: 50031|50032 | E84: 70 | F84: 4 | G84: 2800
A85: 4 | B85: 16 | C85: 万物皆凋零 | D85: 50031|50032 | E85: 75 | F85: 4 | G85: 3000
A86: 4 | B86: 17 | C86: 万物皆凋零 | D86: 50031|50032 | E86: 80 | F86: 4 | G86: 3200
A87: 4 | B87: 18 | C87: 万物皆凋零 | D87: 50031|50032 | E87: 85 | F87: 4 | G87: 3400
A88: 4 | B88: 19 | C88: 万物皆凋零 | D88: 50031|50032 | E88: 90 | F88: 4 | G88: 3600
A89: 4 | B89: 20 | C89: 万物皆凋零 | D89: 50031|50032 | E89: 95 | F89: 4 | G89: 3800
A90: 4 | B90: 21 | C90: 万物皆凋零 | D90: 50031|50032 | E90: 100 | F90: 4 | G90: 4000

Sheet: 精灵培养
A1: id|id | B1: stage|stage | C1: need_enhance_level|need_enhance_level | D1: need_train_times|need_train_times | E1: skill_level|skill_level | F1: talent_level|talent_level | G1: model_id|model_id | H1: pro_conversion_rate|pro_conversion_rate | I1: stage_up_cost_item|stage_up_cost_item | J1: cost_item_id_list|cost_item_id_list | K1: cost_item_num_list|cost_item_num_list | L1: pro_type_list|pro_type_list | M1: pro_value_list|pro_value_list | N1: total_pro_type_list|total_pro_type_list | O1: total_pro_value_list|total_pro_value_list
A2: 不可空 | B2: 不可空 | C2: 不可空 | D2: 不可空 | E2: 不可空 | F2: 不可空 | G2: 不可空 | H2: 不可空 | I2: 可空#不需字段 | J2: 不可空 | K2: 不可空 | L2: 可空#不需字段 | M2: 可空#不需字段 | N2: 可空#不需字段 | O2: 可空#不需字段
A3: 数字 | B3: 数字 | C3: 数字 | D3: 数字 | E3: 数字 | F3: 数字 | G3: 数字 | H3: 数字 | I3: 一维数组 | J3: 一维数组 | K3: 一维数组 | L3: 一维数组 | M3: 一维数组 | N3: 一维数组 | O3: 一维数组
I4: 不定长 | J4: 不定长 | K4: 不定长 | L4: 不定长 | M4: 不定长 | N4: 不定长 | O4: 不定长
A6: 精灵ID | B6: 阶段 | C6: 需要的强化等级 | D6: 升阶需要的培养次数 | E6: 技能等级 | F6: 天赋等级 | G6: 精灵模型Id | H6: 属性转换率(万分比) | I6: 升阶消耗的物品[id|num] | J6: 培养消耗的物品Id列表 | K6: 培养消耗的物品数量列表 | L6: 培养属性类型列表 | M6: 培养属性值列表 | N6: 上级培养总属性类型 | O6: 上级培养总属性列表
A7: 50001 | B7: 1 | C7: 0 | D7: 20 | E7: 1 | F7: 1 | G7: 1 | H7: 1000 | I7: 10034|1 | J7: 10030|10031|10032|10033 | K7: =RC[5]&"|"&RC[5]&"|"&RC[5]&"|"&RC[5] -> 5|5|5|5 | L7: 4|1|2|3 | M7: =RC[4]*10&"|"&RC[4]&"|"&RC[4]&"|"&RC[4] -> 50|5|5|5 | N7: 4|1|2|3 | O7: 0|0|0|0 | P7: 5 | Q7: 5
A8: 50001 | B8: 2 | C8: 5 | D8: 40 | E8: 2 | F8: 1 | G8: 1 | H8: 1100 | I8: 10034|2 | J8: 10030|10031|10032|10033 | K8: =RC[5]&"|"&RC[5]&"|"&RC[5]&"|"&RC[5] -> 10|10|10|10 | L8: 4|1|2|3 | M8: =RC[4]*10&"|"&RC[4]&"|"&RC[4]&"|"&RC[4] -> 50|5|5|5 | N8: 4|1|2|3 | O8: =SUMPRODUCT(R7C[2]:R[-1]C[2],R7C[-11]:R[-1]C[-11])*10&"|"&SUMPRODUCT(R7C[2]:R[-1]C[2],R7C[-11]:R[-1]C[-11])&"|"&SUMPRODUCT(R7C[2]:R[-1]C[2],R7C[-11]:R[-1]C[-11])&"|"&SUMPRODUCT(R7C[2]:R[-1]C[2],R7C[-11]:R[-1]C[-11]) -> 1000|100|100|100 | P8: 10 | Q8: 5
A9: 50001 | B9: 3 | C9: 10 | D9: 60 | E9: 3 | F9: 2 | G9: 1 | H9: 1200 | I9: 10034|3 | J9: 10030|10031|10032|10033 | K9: =RC[5]&"|"&RC[5]&"|"&RC[5]&"|"&RC[5] -> 20|20|20|20 | L9: 4|1|2|3 | M9: =RC[4]*10&"|"&RC[4]&"|"&RC[4]&"|"&RC[4] -> 100|10|10|10 | N9: 4|1|2|3 | O9: =SUMPRODUCT(R7C[2]:R[-1]C[2],R7C[-11]:R[-1]C[-11])*10&"|"&SUMPRODUCT(R7C[2]:R[-1]C[2],R7C[-11]:R[-1]C[-11])&"|"&SUMPRODUCT(R7C[2]:R[-1]C[2],R7C[-11]:R[-1]C[-11])&"|"&SUMPRODUCT(R7C[2]:R[-1]C[2],R7C[-11]:R[-1]C[-11]) -> 3000|300|300|300 | P9: 20 | Q9: 10
A10: 50001 | B10: 4 | C10: 15 | D10: 80 | E10: 4 | F10: 2 | G10: 1 | H10: 1300 | I10: 10034|4 | J10: 10030|10031|10032|10033 | K10: =RC[5]&"|"&RC[5]&"|"&RC[5]&"|"&RC[5] -> 25|25|25|25 | L10: 4|1|2|3 | M10: =RC[4]*10&"|"&RC[4]&"|"&RC[4]&"|"&RC[4] -> 100|10|10|10 | N10: 4|1|2|3 | O10: =SUMPRODUCT(R7C[2]:R[-1]C[2],R7C[-11]:R[-1]C[-11])*10&"|"&SUMPRODUCT(R7C[2]:R[-1]C[2],R7C[-11]:R[-1]C[-11])&"|"&SUMPRODUCT(R7C[2]:R[-1]C[2],R7C[-11]:R[-1]C[-11])&"|"&SUMPRODUCT(R7C[2]:R[-1]C[2],R7C[-11]:R[-1]C[-11]) -> 9000|900|900|900 | P10: 25 | Q10: 10
A11: 50001 | B11: 5 | C11: 20 | D11: 100 | E11: 5 | F11: 3 | G11: 1 | H11: 1400 | I11: 10034|5 | J11: 10030|10031|10032|10033 | K11: =RC[5]&"|"&RC[5]&"|"&RC[5]&"|"&RC[5] -> 30|30|30|30 | L11: 4|1|2|3 | M11: =RC[4]*10&"|"&RC[4]&"|"&RC[4]&"|"&RC[4] -> 100|10|10|10 | N11: 4|1|2|3 | O11: =SUMPRODUCT(R7C[2]:R[-1]C[2],R7C[-11]:R[-1]C[-11])*10&"|"&SUMPRODUCT(R7C[2]:R[-1]C[2],R7C[-11]:R[-1]C[-11])&"|"&SUMPRODUCT(R7C[2]:R[-1]C[2],R7C[-11]:R[-1]C[-11])&"|"&SUMPRODUCT(R7C[2]:R[-1]C[2],R7C[-11]:R[-1]C[-11]) -> 17000|1700|1700|1700 | P11: 30 | Q11: 10
A12: 50001 | B12: 6 | C12: 25 | D12: 120 | E12: 6 | F12: 3 | G12: 1 | H12: 1500 | I12: 10034|6 | J12: 10030|10031|10032|10033 | K12: =RC[5]&"|"&RC[5]&"|"&RC[5]&"|"&RC[5] -> 35|35|35|35 | L12: 4|1|2|3 | M12: =RC[4]*10&"|"&RC[4]&"|"&RC[4]&"|"&RC[4] -> 100|10|10|10 | N12: 4|1|2|3 | O12: =SUMPRODUCT(R7C[2]:R[-1]C[2],R7C[-11]:R[-1]C[-11])*10&"|"&SUMPRODUCT(R7C[2]:R[-1]C[2],R7C[-11]:R[-1]C[-11])&"|"&SUMPRODUCT(R7C[2]:R[-1]C[2],R7C[-11]:R[-1]C[-11])&"|"&SUMPRODUCT(R7C[2]:R[-1]C[2],R7C[-11]:R[-1]C[-11]) -> 27000|2700|2700|2700 | P12: 35 | Q12: 10
A13: 50001 | B13: 7 | C13: 30 | D13: 140 | E13: 7 | F13: 4 | G13: 1 | H13: 1600 | I13: 10034|7 | J13: 10030|10031|10032|10033 | K13: =RC[5]&"|"&RC[5]&"|"&RC[5]&"|"&RC[5] -> 60|60|60|60 | L13: 4|1|2|3 | M13: =RC[4]*10&"|"&RC[4]&"|"&RC[4]&"|"&RC[4] -> 150|15|15|15 | N13: 4|1|2|3 | O13: =SUMPRODUCT(R7C[2]:R[-1]C[2],R7C[-11]:R[-1]C[-11])*10&"|"&SUMPRODUCT(R7C[2]:R[-1]C[2],R7C[-11]:R[-1]C[-11])&"|"&SUMPRODUCT(R7C[2]:R[-1]C[2],R7C[-11]:R[-1]C[-11])&"|"&SUMPRODUCT(R7C[2]:R[-1]C[2],R7C[-11]:R[-1]C[-11]) -> 39000|3900|3900|3900 | P13: 60 | Q13: 15
A14: 50001 | B14: 8 | C14: 35 | D14: 160 | E14: 8 | F14: 4 | G14: 1 | H14: 1700 | I14: 10034|8 | J14: 10030|10031|10032|10033 | K14: =RC[5]&"|"&RC[5]&"|"&RC[5]&"|"&RC[5] -> 70|70|70|70 | L14: 4|1|2|3 | M14: =RC[4]*10&"|"&RC[4]&"|"&RC[4]&"|"&RC[4] -> 150|15|15|15 | N14: 4|1|2|3 | O14: =SUMPRODUCT(R7C[2]:R[-1]C[2],R7C[-11]:R[-1]C[-11])*10&"|"&SUMPRODUCT(R7C[2]:R[-1]C[2],R7C[-11]:R[-1]C[-11])&"|"&SUMPRODUCT(R7C[2]:R[-1]C[2],R7C[-11]:R[-1]C[-11])&"|"&SUMPRODUCT(R7C[2]:R[-1]C[2],R7C[-11]:R[-1]C[-11]) -> 60000|6000|6000|6000 | P14: 70 | Q14: 15
A15: 50001 | B15: 9 | C15: 40 | D15: 180 | E15: 9 | F15: 5 | G15: 1 | H15: 1800 | I15: 10034|9 | J15: 10030|10031|10032|10033 | K15: =RC[5]&"|"&RC[5]&"|"&RC[5]&"|"&RC[5] -> 80|80|80|80 | L15: 4|1|2|3 | M15: =RC[4]*10&"|"&RC[4]&"|"&RC[4]&"|"&RC[4] -> 150|15|15|15 | N15: 4|1|2|3 | O15: =SUMPRODUCT(R7C[2]:R[-1]C[2],R7C[-11]:R[-1]C[-11])*10&"|"&SUMPRODUCT(R7C[2]:R[-1]C[2],R7C[-11]:R[-1]C[-11])&"|"&SUMPRODUCT(R7C[2]:R[-1]C[2],R7C[-11]:R[-1]C[-11])&"|"&SUMPRODUCT(R7C[2]:R[-1]C[2],R7C[-11]:R[-1]C[-11]) -> 84000|8400|8400|8400 | P15: 80 | Q15: 15
A16: 50001 | B16: 10 | C16: 45 | D16: 200 | E16: 10 | F16: 5 | G16: 1 | H16: 1900 | I16: 10034|10 | J16: 10030|10031|10032|10033 | K16: =RC[5]&"|"&RC[5]&"|"&RC[5]&"|"&RC[5] -> 90|90|90|90 | L16: 4|1|2|3 | M16: =RC[4]*10&"|"&RC[4]&"|"&RC[4]&"|"&RC[4] -> 150|15|15|15 | N16: 4|1|2|3 | O16: =SUMPRODUCT(R7C[2]:R[-1]C[2],R7C[-11]:R[-1]C[-11])*10&"|"&SUMPRODUCT(R7C[2]:R[-1]C[2],R7C[-11]:R[-1]C[-11])&"|"&SUMPRODUCT(R7C[2]:R[-1]C[2],R7C[-11]:R[-1]C[-11])&"|"&SUMPRODUCT(R7C[2]:R[-1]C[2],R7C[-11]:R[-1]C[-11]) -> 111000|11100|11100|11100 | P16: 90 | Q16: 15
A17: 50001 | B17: 11 | C17: 50 | D17: 220 | E17: 11 | F17: 6 | G17: 1 | H17: 2000 | I17: 10034|11 | J17: 10030|10031|10032|10033 | K17: =RC[5]&"|"&RC[5]&"|"&RC[5]&"|"&RC[5] -> 120|120|120|120 | L17: 4|1|2|3 | M17: =RC[4]*10&"|"&RC[4]&"|"&RC[4]&"|"&RC[4] -> 200|20|20|20 | N17: 4|1|2|3 | O17: =SUMPRODUCT(R7C[2]:R[-1]C[2],R7C[-11]:R[-1]C[-11])*10&"|"&SUMPRODUCT(R7C[2]:R[-1]C[2],R7C[-11]:R[-1]C[-11])&"|"&SUMPRODUCT(R7C[2]:R[-1]C[2],R7C[-11]:R[-1]C[-11])&"|"&SUMPRODUCT(R7C[2]:R[-1]C[2],R7C[-11]:R[-1]C[-11]) -> 141000|14100|14100|14100 | P17: 120 | Q17: 20
A18: 50001 | B18: 12 | C18: 60 | D18: 240 | E18: 12 | F18: 6 | G18: 1 | H18: 2100 | I18: 10034|12 | J18: 10030|10031|10032|10033 | K18: =RC[5]&"|"&RC[5]&"|"&RC[5]&"|"&RC[5] -> 150|150|150|150 | L18: 4|1|2|3 | M18: =RC[4]*10&"|"&RC[4]&"|"&RC[4]&"|"&RC[4] -> 200|20|20|20 | N18: 4|1|2|3 | O18: =SUMPRODUCT(R7C[2]:R[-1]C[2],R7C[-11]:R[-1]C[-11])*10&"|"&SUMPRODUCT(R7C[2]:R[-1]C[2],R7C[-11]:R[-1]C[-11])&"|"&SUMPRODUCT(R7C[2]:R[-1]C[2],R7C[-11]:R[-1]C[-11])&"|"&SUMPRODUCT(R7C[2]:R[-1]C[2],R7C[-11]:R[-1]C[-11]) -> 185000|18500|18500|18500 | P18: 150 | Q18: 20
A19: 50001 | B19: 13 | C19: 70 | D19: 260 | E19: 13 | F19: 7 | G19: 1 | H19: 2200 | I19: 10034|13 | J19: 10030|10031|10032|10033 | K19: =RC[5]&"|"&RC[5]&"|"&RC[5]&"|"&RC[5] -> 180|180|180|180 | L19: 4|1|2|3 | M19: =RC[4]*10&"|"&RC[4]&"|"&RC[4]&"|"&RC[4] -> 200|20|20|20 | N19: 4|1|2|3 | O19: =SUMPRODUCT(R7C[2]:R[-1]C[2],R7C[-11]:R[-1]C[-11])*10&"|"&SUMPRODUCT(R7C[2]:R[-1]C[2],R7C[-11]:R[-1]C[-11])&"|"&SUMPRODUCT(R7C[2]:R[-1]C[2],R7C[-11]:R[-1]C[-11])&"|"&SUMPRODUCT(R7C[2]:R[-1]C[2],R7C[-11]:R[-1]C[-11]) -> 233000|23300|23300|23300 | P19: 180 | Q19: 20
A20: 50001 | B20: 14 | C20: 80 | D20: 280 | E20: 14 | F20: 7 | G20: 1 | H20: 2300 | I20: 10034|14 | J20: 10030|10031|10032|10033 | K20: =RC[5]&"|"&RC[5]&"|"&RC[5]&"|"&RC[5] -> 210|210|210|210 | L20: 4|1|2|3 | M20: =RC[4]*10&"|"&RC[4]&"|"&RC[4]&"|"&RC[4] -> 200|20|20|20 | N20: 4|1|2|3 | O20: =SUMPRODUCT(R7C[2]:R[-1]C[2],R7C[-11]:R[-1]C[-11])*10&"|"&SUMPRODUCT(R7C[2]:R[-1]C[2],R7C[-11]:R[-1]C[-11])&"|"&SUMPRODUCT(R7C[2]:R[-1]C[2],R7C[-11]:R[-1]C[-11])&"|"&SUMPRODUCT(R7C[2]:R[-1]C[2],R7C[-11]:R[-1]C[-11]) -> 285000|28500|28500|28500 | P20: 210 | Q20: 20
A21: 50001 | B21: 15 | C21: 100 | D21: 0 | E21: 15 | F21: 8 | G21: 1 | H21: 2400 | I21: 10034|0 | J21: 10030|10031|10032|10033 | K21: 0|0|0|0 | L21: 4|1|2|3 | M21: 0|0|0|0 | N21: 4|1|2|3 | O21: =SUMPRODUCT(R7C[2]:R[-1]C[2],R7C[-11]:R[-1]C[-11])*10&"|"&SUMPRODUCT(R7C[2]:R[-1]C[2],R7C[-11]:R[-1]C[-11])&"|"&SUMPRODUCT(R7C[2]:R[-1]C[2],R7C[-11]:R[-1]C[-11])&"|"&SUMPRODUCT(R7C[2]:R[-1]C[2],R7C[-11]:R[-1]C[-11]) -> 341000|34100|34100|34100
A22: 50002 | B22: =R[-15]C -> 1 | C22: =R[-15]C -> 0 | D22: =R[-15]C -> 20 | E22: =R[-15]C -> 1 | F22: =R[-15]C -> 1 | G22: =R[-15]C -> 1 | H22: =R[-15]C -> 1000 | I22: 10037|1 | J22: =R[-15]C -> 10030|10031|10032|10033 | K22: =R[-15]C -> 5|5|5|5 | L22: =R[-15]C -> 4|1|2|3 | M22: =R[-15]C -> 50|5|5|5 | N22: =R[-15]C -> 4|1|2|3 | O22: =R[-15]C -> 0|0|0|0
A23: 50002 | B23: =R[-15]C -> 2 | C23: =R[-15]C -> 5 | D23: =R[-15]C -> 40 | E23: =R[-15]C -> 2 | F23: =R[-15]C -> 1 | G23: =R[-15]C -> 1 | H23: =R[-15]C -> 1100 | I23: 10037|2 | J23: =R[-15]C -> 10030|10031|10032|10033 | K23: =R[-15]C -> 10|10|10|10 | L23: =R[-15]C -> 4|1|2|3 | M23: =R[-15]C -> 50|5|5|5 | N23: =R[-15]C -> 4|1|2|3 | O23: =R[-15]C -> 1000|100|100|100
A24: 50002 | B24: =R[-15]C -> 3 | C24: =R[-15]C -> 10 | D24: =R[-15]C -> 60 | E24: =R[-15]C -> 3 | F24: =R[-15]C -> 2 | G24: =R[-15]C -> 1 | H24: =R[-15]C -> 1200 | I24: 10037|3 | J24: =R[-15]C -> 10030|10031|10032|10033 | K24: =R[-15]C -> 20|20|20|20 | L24: =R[-15]C -> 4|1|2|3 | M24: =R[-15]C -> 100|10|10|10 | N24: =R[-15]C -> 4|1|2|3 | O24: =R[-15]C -> 3000|300|300|300
A25: 50002 | B25: =R[-15]C -> 4 | C25: =R[-15]C -> 15 | D25: =R[-15]C -> 80 | E25: =R[-15]C -> 4 | F25: =R[-15]C -> 2 | G25: =R[-15]C -> 1 | H25: =R[-15]C -> 1300 | I25: 10037|4 | J25: =R[-15]C -> 10030|10031|10032|10033 | K25: =R[-15]C -> 25|25|25|25 | L25: =R[-15]C -> 4|1|2|3 | M25: =R[-15]C -> 100|10|10|10 | N25: =R[-15]C -> 4|1|2|3 | O25: =R[-15]C -> 9000|900|900|900
A26: 50002 | B26: =R[-15]C -> 5 | C26: =R[-15]C -> 20 | D26: =R[-15]C -> 100 | E26: =R[-15]C -> 5 | F26: =R[-15]C -> 3 | G26: =R[-15]C -> 1 | H26: =R[-15]C -> 1400 | I26: 10037|5 | J26: =R[-15]C -> 10030|10031|10032|10033 | K26: =R[-15]C -> 30|30|30|30 | L26: =R[-15]C -> 4|1|2|3 | M26: =R[-15]C -> 100|10|10|10 | N26: =R[-15]C -> 4|1|2|3 | O26: =R[-15]C -> 17000|1700|1700|1700
A27: 50002 | B27: =R[-15]C -> 6 | C27: =R[-15]C -> 25 | D27: =R[-15]C -> 120 | E27: =R[-15]C -> 6 | F27: =R[-15]C -> 3 | G27: =R[-15]C -> 1 | H27: =R[-15]C -> 1500 | I27: 10037|6 | J27: =R[-15]C -> 10030|10031|10032|10033 | K27: =R[-15]C -> 35|35|35|35 | L27: =R[-15]C -> 4|1|2|3 | M27: =R[-15]C -> 100|10|10|10 | N27: =R[-15]C -> 4|1|2|3 | O27: =R[-15]C -> 27000|2700|2700|2700
A28: 50002 | B28: =R[-15]C -> 7 | C28: =R[-15]C -> 30 | D28: =R[-15]C -> 140 | E28: =R[-15]C -> 7 | F28: =R[-15]C -> 4 | G28: =R[-15]C -> 1 | H28: =R[-15]C -> 1600 | I28: 10037|7 | J28: =R[-15]C -> 10030|10031|10032|10033 | K28: =R[-15]C -> 60|60|60|60 | L28: =R[-15]C -> 4|1|2|3 | M28: =R[-15]C -> 150|15|15|15 | N28: =R[-15]C -> 4|1|2|3 | O28: =R[-15]C -> 39000|3900|3900|3900
A29: 50002 | B29: =R[-15]C -> 8 | C29: =R[-15]C -> 35 | D29: =R[-15]C -> 160 | E29: =R[-15]C -> 8 | F29: =R[-15]C -> 4 | G29: =R[-15]C -> 1 | H29: =R[-15]C -> 1700 | I29: 10037|8 | J29: =R[-15]C -> 10030|10031|10032|10033 | K29: =R[-15]C -> 70|70|70|70 | L29: =R[-15]C -> 4|1|2|3 | M29: =R[-15]C -> 150|15|15|15 | N29: =R[-15]C -> 4|1|2|3 | O29: =R[-15]C -> 60000|6000|6000|6000
A30: 50002 | B30: =R[-15]C -> 9 | C30: =R[-15]C -> 40 | D30: =R[-15]C -> 180 | E30: =R[-15]C -> 9 | F30: =R[-15]C -> 5 | G30: =R[-15]C -> 1 | H30: =R[-15]C -> 1800 | I30: 10037|9 | J30: =R[-15]C -> 10030|10031|10032|10033 | K30: =R[-15]C -> 80|80|80|80 | L30: =R[-15]C -> 4|1|2|3 | M30: =R[-15]C -> 150|15|15|15 | N30: =R[-15]C -> 4|1|2|3 | O30: =R[-15]C -> 84000|8400|8400|8400
A31: 50002 | B31: =R[-15]C -> 10 | C31: =R[-15]C -> 45 | D31: =R[-15]C -> 200 | E31: =R[-15]C -> 10 | F31: =R[-15]C -> 5 | G31: =R[-15]C -> 1 | H31: =R[-15]C -> 1900 | I31: 10037|10 | J31: =R[-15]C -> 10030|10031|10032|10033 | K31: =R[-15]C -> 90|90|90|90 | L31: =R[-15]C -> 4|1|2|3 | M31: =R[-15]C -> 150|15|15|15 | N31: =R[-15]C -> 4|1|2|3 | O31: =R[-15]C -> 111000|11100|11100|11100
A32: 50002 | B32: =R[-15]C -> 11 | C32: =R[-15]C -> 50 | D32: =R[-15]C -> 220 | E32: =R[-15]C -> 11 | F32: =R[-15]C -> 6 | G32: =R[-15]C -> 1 | H32: =R[-15]C -> 2000 | I32: 10037|11 | J32: =R[-15]C -> 10030|10031|10032|10033 | K32: =R[-15]C -> 120|120|120|120 | L32: =R[-15]C -> 4|1|2|3 | M32: =R[-15]C -> 200|20|20|20 | N32: =R[-15]C -> 4|1|2|3 | O32: =R[-15]C -> 141000|14100|14100|14100
A33: 50002 | B33: =R[-15]C -> 12 | C33: =R[-15]C -> 60 | D33: =R[-15]C -> 240 | E33: =R[-15]C -> 12 | F33: =R[-15]C -> 6 | G33: =R[-15]C -> 1 | H33: =R[-15]C -> 2100 | I33: 10037|12 | J33: =R[-15]C -> 10030|10031|10032|10033 | K33: =R[-15]C -> 150|150|150|150 | L33: =R[-15]C -> 4|1|2|3 | M33: =R[-15]C -> 200|20|20|20 | N33: =R[-15]C -> 4|1|2|3 | O33: =R[-15]C -> 185000|18500|18500|18500
A34: 50002 | B34: =R[-15]C -> 13 | C34: =R[-15]C -> 70 | D34: =R[-15]C -> 260 | E34: =R[-15]C -> 13 | F34: =R[-15]C -> 7 | G34: =R[-15]C -> 1 | H34: =R[-15]C -> 2200 | I34: 10037|13 | J34: =R[-15]C -> 10030|10031|10032|10033 | K34: =R[-15]C -> 180|180|180|180 | L34: =R[-15]C -> 4|1|2|3 | M34: =R[-15]C -> 200|20|20|20 | N34: =R[-15]C -> 4|1|2|3 | O34: =R[-15]C -> 233000|23300|23300|23300
A35: 50002 | B35: =R[-15]C -> 14 | C35: =R[-15]C -> 80 | D35: =R[-15]C -> 280 | E35: =R[-15]C -> 14 | F35: =R[-15]C -> 7 | G35: =R[-15]C -> 1 | H35: =R[-15]C -> 2300 | I35: 10037|14 | J35: =R[-15]C -> 10030|10031|10032|10033 | K35: =R[-15]C -> 210|210|210|210 | L35: =R[-15]C -> 4|1|2|3 | M35: =R[-15]C -> 200|20|20|20 | N35: =R[-15]C -> 4|1|2|3 | O35: =R[-15]C -> 285000|28500|28500|28500
A36: 50002 | B36: =R[-15]C -> 15 | C36: =R[-15]C -> 100 | D36: =R[-15]C -> 0 | E36: =R[-15]C -> 15 | F36: =R[-15]C -> 8 | G36: =R[-15]C -> 1 | H36: =R[-15]C -> 2400 | I36: 10037|0 | J36: =R[-15]C -> 10030|10031|10032|10033 | K36: =R[-15]C -> 0|0|0|0 | L36: =R[-15]C -> 4|1|2|3 | M36: =R[-15]C -> 0|0|0|0 | N36: =R[-15]C -> 4|1|2|3 | O36: =R[-15]C -> 341000|34100|34100|34100
A37: =R[-30]C+10 -> 50011 | B37: =R[-15]C -> 1 | C37: =R[-15]C -> 0 | D37: =R[-15]C -> 20 | E37: =R[-15]C -> 1 | F37: =R[-15]C -> 1 | G37: =R[-15]C -> 1 | H37: =R[-15]C -> 1000 | I37: 10035|1 | J37: =R[-15]C -> 10030|10031|10032|10033 | K37: =R[-15]C -> 5|5|5|5 | L37: =R[-15]C -> 4|1|2|3 | M37: =R[-15]C -> 50|5|5|5 | N37: =R[-15]C -> 4|1|2|3 | O37: =R[-15]C -> 0|0|0|0
A38: =R[-30]C+10 -> 50011 | B38: =R[-15]C -> 2 | C38: =R[-15]C -> 5 | D38: =R[-15]C -> 40 | E38: =R[-15]C -> 2 | F38: =R[-15]C -> 1 | G38: =R[-15]C -> 1 | H38: =R[-15]C -> 1100 | I38: 10035|2 | J38: =R[-15]C -> 10030|10031|10032|10033 | K38: =R[-15]C -> 10|10|10|10 | L38: =R[-15]C -> 4|1|2|3 | M38: =R[-15]C -> 50|5|5|5 | N38: =R[-15]C -> 4|1|2|3 | O38: =R[-15]C -> 1000|100|100|100
A39: =R[-30]C+10 -> 50011 | B39: =R[-15]C -> 3 | C39: =R[-15]C -> 10 | D39: =R[-15]C -> 60 | E39: =R[-15]C -> 3 | F39: =R[-15]C -> 2 | G39: =R[-15]C -> 1 | H39: =R[-15]C -> 1200 | I39: 10035|3 | J39: =R[-15]C -> 10030|10031|10032|10033 | K39: =R[-15]C -> 20|20|20|20 | L39: =R[-15]C -> 4|1|2|3 | M39: =R[-15]C -> 100|10|10|10 | N39: =R[-15]C -> 4|1|2|3 | O39: =R[-15]C -> 3000|300|300|300
A40: =R[-30]C+10 -> 50011 | B40: =R[-15]C -> 4 | C40: =R[-15]C -> 15 | D40: =R[-15]C -> 80 | E40: =R[-15]C -> 4 | F40: =R[-15]C -> 2 | G40: =R[-15]C -> 1 | H40: =R[-15]C -> 1300 | I40: 10035|4 | J40: =R[-15]C -> 10030|10031|10032|10033 | K40: =R[-15]C -> 25|25|25|25 | L40: =R[-15]C -> 4|1|2|3 | M40: =R[-15]C -> 100|10|10|10 | N40: =R[-15]C -> 4|1|2|3 | O40: =R[-15]C -> 9000|900|900|900
A41: =R[-30]C+10 -> 50011 | B41: =R[-15]C -> 5 | C41: =R[-15]C -> 20 | D41: =R[-15]C -> 100 | E41: =R[-15]C -> 5 | F41: =R[-15]C -> 3 | G41: =R[-15]C -> 1 | H41: =R[-15]C -> 1400 | I41: 10035|5 | J41: =R[-15]C -> 10030|10031|10032|10033 | K41: =R[-15]C -> 30|30|30|30 | L41: =R[-15]C -> 4|1|2|3 | M41: =R[-15]C -> 100|10|10|10 | N41: =R[-15]C -> 4|1|2|3 | O41: =R[-15]C -> 17000|1700|1700|1700
A42: =R[-30]C+10 -> 50011 | B42: =R[-15]C -> 6 | C42: =R[-15]C -> 25 | D42: =R[-15]C -> 120 | E42: =R[-15]C -> 6 | F42: =R[-15]C -> 3 | G42: =R[-15]C -> 1 | H42: =R[-15]C -> 1500 | I42: 10035|6 | J42: =R[-15]C -> 10030|10031|10032|10033 | K42: =R[-15]C -> 35|35|35|35 | L42: =R[-15]C -> 4|1|2|3 | M42: =R[-15]C -> 100|10|10|10 | N42: =R[-15]C -> 4|1|2|3 | O42: =R[-15]C -> 27000|2700|2700|2700
A43: =R[-30]C+10 -> 50011 | B43: =R[-15]C -> 7 | C43: =R[-15]C -> 30 | D43: =R[-15]C -> 140 | E43: =R[-15]C -> 7 | F43: =R[-15]C -> 4 | G43: =R[-15]C -> 1 | H43: =R[-15]C -> 1600 | I43: 10035|7 | J43: =R[-15]C -> 10030|10031|10032|10033 | K43: =R[-15]C -> 60|60|60|60 | L43: =R[-15]C -> 4|1|2|3 | M43: =R[-15]C -> 150|15|15|15 | N43: =R[-15]C -> 4|1|2|3 | O43: =R[-15]C -> 39000|3900|3900|3900
A44: =R[-30]C+10 -> 50011 | B44: =R[-15]C -> 8 | C44: =R[-15]C -> 35 | D44: =R[-15]C -> 160 | E44: =R[-15]C -> 8 | F44: =R[-15]C -> 4 | G44: =R[-15]C -> 1 | H44: =R[-15]C -> 1700 | I44: 10035|8 | J44: =R[-15]C -> 10030|10031|10032|10033 | K44: =R[-15]C -> 70|70|70|70 | L44: =R[-15]C -> 4|1|2|3 | M44: =R[-15]C -> 150|15|15|15 | N44: =R[-15]C -> 4|1|2|3 | O44: =R[-15]C -> 60000|6000|6000|6000
A45: =R[-30]C+10 -> 50011 | B45: =R[-15]C -> 9 | C45: =R[-15]C -> 40 | D45: =R[-15]C -> 180 | E45: =R[-15]C -> 9 | F45: =R[-15]C -> 5 | G45: =R[-15]C -> 1 | H45: =R[-15]C -> 1800 | I45: 10035|9 | J45: =R[-15]C -> 10030|10031|10032|10033 | K45: =R[-15]C -> 80|80|80|80 | L45: =R[-15]C -> 4|1|2|3 | M45: =R[-15]C -> 150|15|15|15 | N45: =R[-15]C -> 4|1|2|3 | O45: =R[-15]C -> 84000|8400|8400|8400
A46: =R[-30]C+10 -> 50011 | B46: =R[-15]C -> 10 | C46: =R[-15]C -> 45 | D46: =R[-15]C -> 200 | E46: =R[-15]C -> 10 | F46: =R[-15]C -> 5 | G46: =R[-15]C -> 1 | H46: =R[-15]C -> 1900 | I46: 10035|10 | J46: =R[-15]C -> 10030|10031|10032|10033 | K46: =R[-15]C -> 90|90|90|90 | L46: =R[-15]C -> 4|1|2|3 | M46: =R[-15]C -> 150|15|15|15 | N46: =R[-15]C -> 4|1|2|3 | O46: =R[-15]C -> 111000|11100|11100|11100
A47: =R[-30]C+10 -> 50011 | B47: =R[-15]C -> 11 | C47: =R[-15]C -> 50 | D47: =R[-15]C -> 220 | E47: =R[-15]C -> 11 | F47: =R[-15]C -> 6 | G47: =R[-15]C -> 1 | H47: =R[-15]C -> 2000 | I47: 10035|11 | J47: =R[-15]C -> 10030|10031|10032|10033 | K47: =R[-15]C -> 120|120|120|120 | L47: =R[-15]C -> 4|1|2|3 | M47: =R[-15]C -> 200|20|20|20 | N47: =R[-15]C -> 4|1|2|3 | O47: =R[-15]C -> 141000|14100|14100|14100
A48: =R[-30]C+10 -> 50011 | B48: =R[-15]C -> 12 | C48: =R[-15]C -> 60 | D48: =R[-15]C -> 240 | E48: =R[-15]C -> 12 | F48: =R[-15]C -> 6 | G48: =R[-15]C -> 1 | H48: =R[-15]C -> 2100 | I48: 10035|12 | J48: =R[-15]C -> 10030|10031|10032|10033 | K48: =R[-15]C -> 150|150|150|150 | L48: =R[-15]C -> 4|1|2|3 | M48: =R[-15]C -> 200|20|20|20 | N48: =R[-15]C -> 4|1|2|3 | O48: =R[-15]C -> 185000|18500|18500|18500
A49: =R[-30]C+10 -> 50011 | B49: =R[-15]C -> 13 | C49: =R[-15]C -> 70 | D49: =R[-15]C -> 260 | E49: =R[-15]C -> 13 | F49: =R[-15]C -> 7 | G49: =R[-15]C -> 1 | H49: =R[-15]C -> 2200 | I49: 10035|13 | J49: =R[-15]C -> 10030|10031|10032|10033 | K49: =R[-15]C -> 180|180|180|180 | L49: =R[-15]C -> 4|1|2|3 | M49: =R[-15]C -> 200|20|20|20 | N49: =R[-15]C -> 4|1|2|3 | O49: =R[-15]C -> 233000|23300|23300|23300
A50: =R[-30]C+10 -> 50011 | B50: =R[-15]C -> 14 | C50: =R[-15]C -> 80 | D50: =R[-15]C -> 280 | E50: =R[-15]C -> 14 | F50: =R[-15]C -> 7 | G50: =R[-15]C -> 1 | H50: =R[-15]C -> 2300 | I50: 10035|14 | J50: =R[-15]C -> 10030|10031|10032|10033 | K50: =R[-15]C -> 210|210|210|210 | L50: =R[-15]C -> 4|1|2|3 | M50: =R[-15]C -> 200|20|20|20 | N50: =R[-15]C -> 4|1|2|3 | O50: =R[-15]C -> 285000|28500|28500|28500
A51: =R[-30]C+10 -> 50011 | B51: =R[-15]C -> 15 | C51: =R[-15]C -> 100 | D51: =R[-15]C -> 0 | E51: =R[-15]C -> 15 | F51: =R[-15]C -> 8 | G51: =R[-15]C -> 1 | H51: =R[-15]C -> 2400 | I51: 10035|0 | J51: =R[-15]C -> 10030|10031|10032|10033 | K51: =R[-15]C -> 0|0|0|0 | L51: =R[-15]C -> 4|1|2|3 | M51: =R[-15]C -> 0|0|0|0 | N51: =R[-15]C -> 4|1|2|3 | O51: =R[-15]C -> 341000|34100|34100|34100
A52: =R[-30]C+10 -> 50012 | B52: =R[-15]C -> 1 | C52: =R[-15]C -> 0 | D52: =R[-15]C -> 20 | E52: =R[-15]C -> 1 | F52: =R[-15]C -> 1 | G52: =R[-15]C -> 1 | H52: =R[-15]C -> 1000 | I52: 10036|1 | J52: =R[-15]C -> 10030|10031|10032|10033 | K52: =R[-15]C -> 5|5|5|5 | L52: =R[-15]C -> 4|1|2|3 | M52: =R[-15]C -> 50|5|5|5 | N52: =R[-15]C -> 4|1|2|3 | O52: =R[-15]C -> 0|0|0|0
A53: =R[-30]C+10 -> 50012 | B53: =R[-15]C -> 2 | C53: =R[-15]C -> 5 | D53: =R[-15]C -> 40 | E53: =R[-15]C -> 2 | F53: =R[-15]C -> 1 | G53: =R[-15]C -> 1 | H53: =R[-15]C -> 1100 | I53: 10036|2 | J53: =R[-15]C -> 10030|10031|10032|10033 | K53: =R[-15]C -> 10|10|10|10 | L53: =R[-15]C -> 4|1|2|3 | M53: =R[-15]C -> 50|5|5|5 | N53: =R[-15]C -> 4|1|2|3 | O53: =R[-15]C -> 1000|100|100|100
A54: =R[-30]C+10 -> 50012 | B54: =R[-15]C -> 3 | C54: =R[-15]C -> 10 | D54: =R[-15]C -> 60 | E54: =R[-15]C -> 3 | F54: =R[-15]C -> 2 | G54: =R[-15]C -> 1 | H54: =R[-15]C -> 1200 | I54: 10036|3 | J54: =R[-15]C -> 10030|10031|10032|10033 | K54: =R[-15]C -> 20|20|20|20 | L54: =R[-15]C -> 4|1|2|3 | M54: =R[-15]C -> 100|10|10|10 | N54: =R[-15]C -> 4|1|2|3 | O54: =R[-15]C -> 3000|300|300|300
A55: =R[-30]C+10 -> 50012 | B55: =R[-15]C -> 4 | C55: =R[-15]C -> 15 | D55: =R[-15]C -> 80 | E55: =R[-15]C -> 4 | F55: =R[-15]C -> 2 | G55: =R[-15]C -> 1 | H55: =R[-15]C -> 1300 | I55: 10036|4 | J55: =R[-15]C -> 10030|10031|10032|10033 | K55: =R[-15]C -> 25|25|25|25 | L55: =R[-15]C -> 4|1|2|3 | M55: =R[-15]C -> 100|10|10|10 | N55: =R[-15]C -> 4|1|2|3 | O55: =R[-15]C -> 9000|900|900|900
A56: =R[-30]C+10 -> 50012 | B56: =R[-15]C -> 5 | C56: =R[-15]C -> 20 | D56: =R[-15]C -> 100 | E56: =R[-15]C -> 5 | F56: =R[-15]C -> 3 | G56: =R[-15]C -> 1 | H56: =R[-15]C -> 1400 | I56: 10036|5 | J56: =R[-15]C -> 10030|10031|10032|10033 | K56: =R[-15]C -> 30|30|30|30 | L56: =R[-15]C -> 4|1|2|3 | M56: =R[-15]C -> 100|10|10|10 | N56: =R[-15]C -> 4|1|2|3 | O56: =R[-15]C -> 17000|1700|1700|1700
A57: =R[-30]C+10 -> 50012 | B57: =R[-15]C -> 6 | C57: =R[-15]C -> 25 | D57: =R[-15]C -> 120 | E57: =R[-15]C -> 6 | F57: =R[-15]C -> 3 | G57: =R[-15]C -> 1 | H57: =R[-15]C -> 1500 | I57: 10036|6 | J57: =R[-15]C -> 10030|10031|10032|10033 | K57: =R[-15]C -> 35|35|35|35 | L57: =R[-15]C -> 4|1|2|3 | M57: =R[-15]C -> 100|10|10|10 | N57: =R[-15]C -> 4|1|2|3 | O57: =R[-15]C -> 27000|2700|2700|2700
A58: =R[-30]C+10 -> 50012 | B58: =R[-15]C -> 7 | C58: =R[-15]C -> 30 | D58: =R[-15]C -> 140 | E58: =R[-15]C -> 7 | F58: =R[-15]C -> 4 | G58: =R[-15]C -> 1 | H58: =R[-15]C -> 1600 | I58: 10036|7 | J58: =R[-15]C -> 10030|10031|10032|10033 | K58: =R[-15]C -> 60|60|60|60 | L58: =R[-15]C -> 4|1|2|3 | M58: =R[-15]C -> 150|15|15|15 | N58: =R[-15]C -> 4|1|2|3 | O58: =R[-15]C -> 39000|3900|3900|3900
A59: =R[-30]C+10 -> 50012 | B59: =R[-15]C -> 8 | C59: =R[-15]C -> 35 | D59: =R[-15]C -> 160 | E59: =R[-15]C -> 8 | F59: =R[-15]C -> 4 | G59: =R[-15]C -> 1 | H59: =R[-15]C -> 1700 | I59: 10036|8 | J59: =R[-15]C -> 10030|10031|10032|10033 | K59: =R[-15]C -> 70|70|70|70 | L59: =R[-15]C -> 4|1|2|3 | M59: =R[-15]C -> 150|15|15|15 | N59: =R[-15]C -> 4|1|2|3 | O59: =R[-15]C -> 60000|6000|6000|6000
A60: =R[-30]C+10 -> 50012 | B60: =R[-15]C -> 9 | C60: =R[-15]C -> 40 | D60: =R[-15]C -> 180 | E60: =R[-15]C -> 9 | F60: =R[-15]C -> 5 | G60: =R[-15]C -> 1 | H60: =R[-15]C -> 1800 | I60: 10036|9 | J60: =R[-15]C -> 10030|10031|10032|10033 | K60: =R[-15]C -> 80|80|80|80 | L60: =R[-15]C -> 4|1|2|3 | M60: =R[-15]C -> 150|15|15|15 | N60: =R[-15]C -> 4|1|2|3 | O60: =R[-15]C -> 84000|8400|8400|8400
A61: =R[-30]C+10 -> 50012 | B61: =R[-15]C -> 10 | C61: =R[-15]C -> 45 | D61: =R[-15]C -> 200 | E61: =R[-15]C -> 10 | F61: =R[-15]C -> 5 | G61: =R[-15]C -> 1 | H61: =R[-15]C -> 1900 | I61: 10036|10 | J61: =R[-15]C -> 10030|10031|10032|10033 | K61: =R[-15]C -> 90|90|90|90 | L61: =R[-15]C -> 4|1|2|3 | M61: =R[-15]C -> 150|15|15|15 | N61: =R[-15]C -> 4|1|2|3 | O61: =R[-15]C -> 111000|11100|11100|11100
A62: =R[-30]C+10 -> 50012 | B62: =R[-15]C -> 11 | C62: =R[-15]C -> 50 | D62: =R[-15]C -> 220 | E62: =R[-15]C -> 11 | F62: =R[-15]C -> 6 | G62: =R[-15]C -> 1 | H62: =R[-15]C -> 2000 | I62: 10036|11 | J62: =R[-15]C -> 10030|10031|10032|10033 | K62: =R[-15]C -> 120|120|120|120 | L62: =R[-15]C -> 4|1|2|3 | M62: =R[-15]C -> 200|20|20|20 | N62: =R[-15]C -> 4|1|2|3 | O62: =R[-15]C -> 141000|14100|14100|14100
A63: =R[-30]C+10 -> 50012 | B63: =R[-15]C -> 12 | C63: =R[-15]C -> 60 | D63: =R[-15]C -> 240 | E63: =R[-15]C -> 12 | F63: =R[-15]C -> 6 | G63: =R[-15]C -> 1 | H63: =R[-15]C -> 2100 | I63: 10036|12 | J63: =R[-15]C -> 10030|10031|10032|10033 | K63: =R[-15]C -> 150|150|150|150 | L63: =R[-15]C -> 4|1|2|3 | M63: =R[-15]C -> 200|20|20|20 | N63: =R[-15]C -> 4|1|2|3 | O63: =R[-15]C -> 185000|18500|18500|18500
A64: =R[-30]C+10 -> 50012 | B64: =R[-15]C -> 13 | C64: =R[-15]C -> 70 | D64: =R[-15]C -> 260 | E64: =R[-15]C -> 13 | F64: =R[-15]C -> 7 | G64: =R[-15]C -> 1 | H64: =R[-15]C -> 2200 | I64: 10036|13 | J64: =R[-15]C -> 10030|10031|10032|10033 | K64: =R[-15]C -> 180|180|180|180 | L64: =R[-15]C -> 4|1|2|3 | M64: =R[-15]C -> 200|20|20|20 | N64: =R[-15]C -> 4|1|2|3 | O64: =R[-15]C -> 233000|23300|23300|23300
A65: =R[-30]C+10 -> 50012 | B65: =R[-15]C -> 14 | C65: =R[-15]C -> 80 | D65: =R[-15]C -> 280 | E65: =R[-15]C -> 14 | F65: =R[-15]C -> 7 | G65: =R[-15]C -> 1 | H65: =R[-15]C -> 2300 | I65: 10036|14 | J65: =R[-15]C -> 10030|10031|10032|10033 | K65: =R[-15]C -> 210|210|210|210 | L65: =R[-15]C -> 4|1|2|3 | M65: =R[-15]C -> 200|20|20|20 | N65: =R[-15]C -> 4|1|2|3 | O65: =R[-15]C -> 285000|28500|28500|28500
A66: =R[-30]C+10 -> 50012 | B66: =R[-15]C -> 15 | C66: =R[-15]C -> 100 | D66: =R[-15]C -> 0 | E66: =R[-15]C -> 15 | F66: =R[-15]C -> 8 | G66: =R[-15]C -> 1 | H66: =R[-15]C -> 2400 | I66: 10036|0 | J66: =R[-15]C -> 10030|10031|10032|10033 | K66: =R[-15]C -> 0|0|0|0 | L66: =R[-15]C -> 4|1|2|3 | M66: =R[-15]C -> 0|0|0|0 | N66: =R[-15]C -> 4|1|2|3 | O66: =R[-15]C -> 341000|34100|34100|34100
A67: =R[-30]C+10 -> 50021 | B67: =R[-15]C -> 1 | C67: =R[-15]C -> 0 | D67: =R[-15]C -> 20 | E67: =R[-15]C -> 1 | F67: =R[-15]C -> 1 | G67: =R[-15]C -> 1 | H67: =R[-15]C -> 1000 | I67: 10038|1 | J67: =R[-15]C -> 10030|10031|10032|10033 | K67: =R[-15]C -> 5|5|5|5 | L67: =R[-15]C -> 4|1|2|3 | M67: =R[-15]C -> 50|5|5|5 | N67: =R[-15]C -> 4|1|2|3 | O67: =R[-15]C -> 0|0|0|0
A68: =R[-30]C+10 -> 50021 | B68: =R[-15]C -> 2 | C68: =R[-15]C -> 5 | D68: =R[-15]C -> 40 | E68: =R[-15]C -> 2 | F68: =R[-15]C -> 1 | G68: =R[-15]C -> 1 | H68: =R[-15]C -> 1100 | I68: 10038|2 | J68: =R[-15]C -> 10030|10031|10032|10033 | K68: =R[-15]C -> 10|10|10|10 | L68: =R[-15]C -> 4|1|2|3 | M68: =R[-15]C -> 50|5|5|5 | N68: =R[-15]C -> 4|1|2|3 | O68: =R[-15]C -> 1000|100|100|100
A69: =R[-30]C+10 -> 50021 | B69: =R[-15]C -> 3 | C69: =R[-15]C -> 10 | D69: =R[-15]C -> 60 | E69: =R[-15]C -> 3 | F69: =R[-15]C -> 2 | G69: =R[-15]C -> 1 | H69: =R[-15]C -> 1200 | I69: 10038|3 | J69: =R[-15]C -> 10030|10031|10032|10033 | K69: =R[-15]C -> 20|20|20|20 | L69: =R[-15]C -> 4|1|2|3 | M69: =R[-15]C -> 100|10|10|10 | N69: =R[-15]C -> 4|1|2|3 | O69: =R[-15]C -> 3000|300|300|300
A70: =R[-30]C+10 -> 50021 | B70: =R[-15]C -> 4 | C70: =R[-15]C -> 15 | D70: =R[-15]C -> 80 | E70: =R[-15]C -> 4 | F70: =R[-15]C -> 2 | G70: =R[-15]C -> 1 | H70: =R[-15]C -> 1300 | I70: 10038|4 | J70: =R[-15]C -> 10030|10031|10032|10033 | K70: =R[-15]C -> 25|25|25|25 | L70: =R[-15]C -> 4|1|2|3 | M70: =R[-15]C -> 100|10|10|10 | N70: =R[-15]C -> 4|1|2|3 | O70: =R[-15]C -> 9000|900|900|900
A71: =R[-30]C+10 -> 50021 | B71: =R[-15]C -> 5 | C71: =R[-15]C -> 20 | D71: =R[-15]C -> 100 | E71: =R[-15]C -> 5 | F71: =R[-15]C -> 3 | G71: =R[-15]C -> 1 | H71: =R[-15]C -> 1400 | I71: 10038|5 | J71: =R[-15]C -> 10030|10031|10032|10033 | K71: =R[-15]C -> 30|30|30|30 | L71: =R[-15]C -> 4|1|2|3 | M71: =R[-15]C -> 100|10|10|10 | N71: =R[-15]C -> 4|1|2|3 | O71: =R[-15]C -> 17000|1700|1700|1700
A72: =R[-30]C+10 -> 50021 | B72: =R[-15]C -> 6 | C72: =R[-15]C -> 25 | D72: =R[-15]C -> 120 | E72: =R[-15]C -> 6 | F72: =R[-15]C -> 3 | G72: =R[-15]C -> 1 | H72: =R[-15]C -> 1500 | I72: 10038|6 | J72: =R[-15]C -> 10030|10031|10032|10033 | K72: =R[-15]C -> 35|35|35|35 | L72: =R[-15]C -> 4|1|2|3 | M72: =R[-15]C -> 100|10|10|10 | N72: =R[-15]C -> 4|1|2|3 | O72: =R[-15]C -> 27000|2700|2700|2700
A73: =R[-30]C+10 -> 50021 | B73: =R[-15]C -> 7 | C73: =R[-15]C -> 30 | D73: =R[-15]C -> 140 | E73: =R[-15]C -> 7 | F73: =R[-15]C -> 4 | G73: =R[-15]C -> 1 | H73: =R[-15]C -> 1600 | I73: 10038|7 | J73: =R[-15]C -> 10030|10031|10032|10033 | K73: =R[-15]C -> 60|60|60|60 | L73: =R[-15]C -> 4|1|2|3 | M73: =R[-15]C -> 150|15|15|15 | N73: =R[-15]C -> 4|1|2|3 | O73: =R[-15]C -> 39000|3900|3900|3900
A74: =R[-30]C+10 -> 50021 | B74: =R[-15]C -> 8 | C74: =R[-15]C -> 35 | D74: =R[-15]C -> 160 | E74: =R[-15]C -> 8 | F74: =R[-15]C -> 4 | G74: =R[-15]C -> 1 | H74: =R[-15]C -> 1700 | I74: 10038|8 | J74: =R[-15]C -> 10030|10031|10032|10033 | K74: =R[-15]C -> 70|70|70|70 | L74: =R[-15]C -> 4|1|2|3 | M74: =R[-15]C -> 150|15|15|15 | N74: =R[-15]C -> 4|1|2|3 | O74: =R[-15]C -> 60000|6000|6000|6000
A75: =R[-30]C+10 -> 50021 | B75: =R[-15]C -> 9 | C75: =R[-15]C -> 40 | D75: =R[-15]C -> 180 | E75: =R[-15]C -> 9 | F75: =R[-15]C -> 5 | G75: =R[-15]C -> 1 | H75: =R[-15]C -> 1800 | I75: 10038|9 | J75: =R[-15]C -> 10030|10031|10032|10033 | K75: =R[-15]C -> 80|80|80|80 | L75: =R[-15]C -> 4|1|2|3 | M75: =R[-15]C -> 150|15|15|15 | N75: =R[-15]C -> 4|1|2|3 | O75: =R[-15]C -> 84000|8400|8400|8400
A76: =R[-30]C+10 -> 50021 | B76: =R[-15]C -> 10 | C76: =R[-15]C -> 45 | D76: =R[-15]C -> 200 | E76: =R[-15]C -> 10 | F76: =R[-15]C -> 5 | G76: =R[-15]C -> 1 | H76: =R[-15]C -> 1900 | I76: 10038|10 | J76: =R[-15]C -> 10030|10031|10032|10033 | K76: =R[-15]C -> 90|90|90|90 | L76: =R[-15]C -> 4|1|2|3 | M76: =R[-15]C -> 150|15|15|15 | N76: =R[-15]C -> 4|1|2|3 | O76: =R[-15]C -> 111000|11100|11100|11100
A77: =R[-30]C+10 -> 50021 | B77: =R[-15]C -> 11 | C77: =R[-15]C -> 50 | D77: =R[-15]C -> 220 | E77: =R[-15]C -> 11 | F77: =R[-15]C -> 6 | G77: =R[-15]C -> 1 | H77: =R[-15]C -> 2000 | I77: 10038|11 | J77: =R[-15]C -> 10030|10031|10032|10033 | K77: =R[-15]C -> 120|120|120|120 | L77: =R[-15]C -> 4|1|2|3 | M77: =R[-15]C -> 200|20|20|20 | N77: =R[-15]C -> 4|1|2|3 | O77: =R[-15]C -> 141000|14100|14100|14100
A78: =R[-30]C+10 -> 50021 | B78: =R[-15]C -> 12 | C78: =R[-15]C -> 60 | D78: =R[-15]C -> 240 | E78: =R[-15]C -> 12 | F78: =R[-15]C -> 6 | G78: =R[-15]C -> 1 | H78: =R[-15]C -> 2100 | I78: 10038|12 | J78: =R[-15]C -> 10030|10031|10032|10033 | K78: =R[-15]C -> 150|150|150|150 | L78: =R[-15]C -> 4|1|2|3 | M78: =R[-15]C -> 200|20|20|20 | N78: =R[-15]C -> 4|1|2|3 | O78: =R[-15]C -> 185000|18500|18500|18500
A79: =R[-30]C+10 -> 50021 | B79: =R[-15]C -> 13 | C79: =R[-15]C -> 70 | D79: =R[-15]C -> 260 | E79: =R[-15]C -> 13 | F79: =R[-15]C -> 7 | G79: =R[-15]C -> 1 | H79: =R[-15]C -> 2200 | I79: 10038|13 | J79: =R[-15]C -> 10030|10031|10032|10033 | K79: =R[-15]C -> 180|180|180|180 | L79: =R[-15]C -> 4|1|2|3 | M79: =R[-15]C -> 200|20|20|20 | N79: =R[-15]C -> 4|1|2|3 | O79: =R[-15]C -> 233000|23300|23300|23300
A80: =R[-30]C+10 -> 50021 | B80: =R[-15]C -> 14 | C80: =R[-15]C -> 80 | D80: =R[-15]C -> 280 | E80: =R[-15]C -> 14 | F80: =R[-15]C -> 7 | G80: =R[-15]C -> 1 | H80: =R[-15]C -> 2300 | I80: 10038|14 | J80: =R[-15]C -> 10030|10031|10032|10033 | K80: =R[-15]C -> 210|210|210|210 | L80: =R[-15]C -> 4|1|2|3 | M80: =R[-15]C -> 200|20|20|20 | N80: =R[-15]C -> 4|1|2|3 | O80: =R[-15]C -> 285000|28500|28500|28500
A81: =R[-30]C+10 -> 50021 | B81: =R[-15]C -> 15 | C81: =R[-15]C -> 100 | D81: =R[-15]C -> 0 | E81: =R[-15]C -> 15 | F81: =R[-15]C -> 8 | G81: =R[-15]C -> 1 | H81: =R[-15]C -> 2400 | I81: 10038|0 | J81: =R[-15]C -> 10030|10031|10032|10033 | K81: =R[-15]C -> 0|0|0|0 | L81: =R[-15]C -> 4|1|2|3 | M81: =R[-15]C -> 0|0|0|0 | N81: =R[-15]C -> 4|1|2|3 | O81: =R[-15]C -> 341000|34100|34100|34100
A82: =R[-30]C+10 -> 50022 | B82: =R[-15]C -> 1 | C82: =R[-15]C -> 0 | D82: =R[-15]C -> 20 | E82: =R[-15]C -> 1 | F82: =R[-15]C -> 1 | G82: =R[-15]C -> 1 | H82: =R[-15]C -> 1000 | I82: 10039|1 | J82: =R[-15]C -> 10030|10031|10032|10033 | K82: =R[-15]C -> 5|5|5|5 | L82: =R[-15]C -> 4|1|2|3 | M82: =R[-15]C -> 50|5|5|5 | N82: =R[-15]C -> 4|1|2|3 | O82: =R[-15]C -> 0|0|0|0
A83: =R[-30]C+10 -> 50022 | B83: =R[-15]C -> 2 | C83: =R[-15]C -> 5 | D83: =R[-15]C -> 40 | E83: =R[-15]C -> 2 | F83: =R[-15]C -> 1 | G83: =R[-15]C -> 1 | H83: =R[-15]C -> 1100 | I83: 10039|2 | J83: =R[-15]C -> 10030|10031|10032|10033 | K83: =R[-15]C -> 10|10|10|10 | L83: =R[-15]C -> 4|1|2|3 | M83: =R[-15]C -> 50|5|5|5 | N83: =R[-15]C -> 4|1|2|3 | O83: =R[-15]C -> 1000|100|100|100
A84: =R[-30]C+10 -> 50022 | B84: =R[-15]C -> 3 | C84: =R[-15]C -> 10 | D84: =R[-15]C -> 60 | E84: =R[-15]C -> 3 | F84: =R[-15]C -> 2 | G84: =R[-15]C -> 1 | H84: =R[-15]C -> 1200 | I84: 10039|3 | J84: =R[-15]C -> 10030|10031|10032|10033 | K84: =R[-15]C -> 20|20|20|20 | L84: =R[-15]C -> 4|1|2|3 | M84: =R[-15]C -> 100|10|10|10 | N84: =R[-15]C -> 4|1|2|3 | O84: =R[-15]C -> 3000|300|300|300
A85: =R[-30]C+10 -> 50022 | B85: =R[-15]C -> 4 | C85: =R[-15]C -> 15 | D85: =R[-15]C -> 80 | E85: =R[-15]C -> 4 | F85: =R[-15]C -> 2 | G85: =R[-15]C -> 1 | H85: =R[-15]C -> 1300 | I85: 10039|4 | J85: =R[-15]C -> 10030|10031|10032|10033 | K85: =R[-15]C -> 25|25|25|25 | L85: =R[-15]C -> 4|1|2|3 | M85: =R[-15]C -> 100|10|10|10 | N85: =R[-15]C -> 4|1|2|3 | O85: =R[-15]C -> 9000|900|900|900
A86: =R[-30]C+10 -> 50022 | B86: =R[-15]C -> 5 | C86: =R[-15]C -> 20 | D86: =R[-15]C -> 100 | E86: =R[-15]C -> 5 | F86: =R[-15]C -> 3 | G86: =R[-15]C -> 1 | H86: =R[-15]C -> 1400 | I86: 10039|5 | J86: =R[-15]C -> 10030|10031|10032|10033 | K86: =R[-15]C -> 30|30|30|30 | L86: =R[-15]C -> 4|1|2|3 | M86: =R[-15]C -> 100|10|10|10 | N86: =R[-15]C -> 4|1|2|3 | O86: =R[-15]C -> 17000|1700|1700|1700
A87: =R[-30]C+10 -> 50022 | B87: =R[-15]C -> 6 | C87: =R[-15]C -> 25 | D87: =R[-15]C -> 120 | E87: =R[-15]C -> 6 | F87: =R[-15]C -> 3 | G87: =R[-15]C -> 1 | H87: =R[-15]C -> 1500 | I87: 10039|6 | J87: =R[-15]C -> 10030|10031|10032|10033 | K87: =R[-15]C -> 35|35|35|35 | L87: =R[-15]C -> 4|1|2|3 | M87: =R[-15]C -> 100|10|10|10 | N87: =R[-15]C -> 4|1|2|3 | O87: =R[-15]C -> 27000|2700|2700|2700
A88: =R[-30]C+10 -> 50022 | B88: =R[-15]C -> 7 | C88: =R[-15]C -> 30 | D88: =R[-15]C -> 140 | E88: =R[-15]C -> 7 | F88: =R[-15]C -> 4 | G88: =R[-15]C -> 1 | H88: =R[-15]C -> 1600 | I88: 10039|7 | J88: =R[-15]C -> 10030|10031|10032|10033 | K88: =R[-15]C -> 60|60|60|60 | L88: =R[-15]C -> 4|1|2|3 | M88: =R[-15]C -> 150|15|15|15 | N88: =R[-15]C -> 4|1|2|3 | O88: =R[-15]C -> 39000|3900|3900|3900
A89: =R[-30]C+10 -> 50022 | B89: =R[-15]C -> 8 | C89: =R[-15]C -> 35 | D89: =R[-15]C -> 160 | E89: =R[-15]C -> 8 | F89: =R[-15]C -> 4 | G89: =R[-15]C -> 1 | H89: =R[-15]C -> 1700 | I89: 10039|8 | J89: =R[-15]C -> 10030|10031|10032|10033 | K89: =R[-15]C -> 70|70|70|70 | L89: =R[-15]C -> 4|1|2|3 | M89: =R[-15]C -> 150|15|15|15 | N89: =R[-15]C -> 4|1|2|3 | O89: =R[-15]C -> 60000|6000|6000|6000
A90: =R[-30]C+10 -> 50022 | B90: =R[-15]C -> 9 | C90: =R[-15]C -> 40 | D90: =R[-15]C -> 180 | E90: =R[-15]C -> 9 | F90: =R[-15]C -> 5 | G90: =R[-15]C -> 1 | H90: =R[-15]C -> 1800 | I90: 10039|9 | J90: =R[-15]C -> 10030|10031|10032|10033 | K90: =R[-15]C -> 80|80|80|80 | L90: =R[-15]C -> 4|1|2|3 | M90: =R[-15]C -> 150|15|15|15 | N90: =R[-15]C -> 4|1|2|3 | O90: =R[-15]C -> 84000|8400|8400|8400
A91: =R[-30]C+10 -> 50022 | B91: =R[-15]C -> 10 | C91: =R[-15]C -> 45 | D91: =R[-15]C -> 200 | E91: =R[-15]C -> 10 | F91: =R[-15]C -> 5 | G91: =R[-15]C -> 1 | H91: =R[-15]C -> 1900 | I91: 10039|10 | J91: =R[-15]C -> 10030|10031|10032|10033 | K91: =R[-15]C -> 90|90|90|90 | L91: =R[-15]C -> 4|1|2|3 | M91: =R[-15]C -> 150|15|15|15 | N91: =R[-15]C -> 4|1|2|3 | O91: =R[-15]C -> 111000|11100|11100|11100
A92: =R[-30]C+10 -> 50022 | B92: =R[-15]C -> 11 | C92: =R[-15]C -> 50 | D92: =R[-15]C -> 220 | E92: =R[-15]C -> 11 | F92: =R[-15]C -> 6 | G92: =R[-15]C -> 1 | H92: =R[-15]C -> 2000 | I92: 10039|11 | J92: =R[-15]C -> 10030|10031|10032|10033 | K92: =R[-15]C -> 120|120|120|120 | L92: =R[-15]C -> 4|1|2|3 | M92: =R[-15]C -> 200|20|20|20 | N92: =R[-15]C -> 4|1|2|3 | O92: =R[-15]C -> 141000|14100|14100|14100
A93: =R[-30]C+10 -> 50022 | B93: =R[-15]C -> 12 | C93: =R[-15]C -> 60 | D93: =R[-15]C -> 240 | E93: =R[-15]C -> 12 | F93: =R[-15]C -> 6 | G93: =R[-15]C -> 1 | H93: =R[-15]C -> 2100 | I93: 10039|12 | J93: =R[-15]C -> 10030|10031|10032|10033 | K93: =R[-15]C -> 150|150|150|150 | L93: =R[-15]C -> 4|1|2|3 | M93: =R[-15]C -> 200|20|20|20 | N93: =R[-15]C -> 4|1|2|3 | O93: =R[-15]C -> 185000|18500|18500|18500
A94: =R[-30]C+10 -> 50022 | B94: =R[-15]C -> 13 | C94: =R[-15]C -> 70 | D94: =R[-15]C -> 260 | E94: =R[-15]C -> 13 | F94: =R[-15]C -> 7 | G94: =R[-15]C -> 1 | H94: =R[-15]C -> 2200 | I94: 10039|13 | J94: =R[-15]C -> 10030|10031|10032|10033 | K94: =R[-15]C -> 180|180|180|180 | L94: =R[-15]C -> 4|1|2|3 | M94: =R[-15]C -> 200|20|20|20 | N94: =R[-15]C -> 4|1|2|3 | O94: =R[-15]C -> 233000|23300|23300|23300
A95: =R[-30]C+10 -> 50022 | B95: =R[-15]C -> 14 | C95: =R[-15]C -> 80 | D95: =R[-15]C -> 280 | E95: =R[-15]C -> 14 | F95: =R[-15]C -> 7 | G95: =R[-15]C -> 1 | H95: =R[-15]C -> 2300 | I95: 10039|14 | J95: =R[-15]C -> 10030|10031|10032|10033 | K95: =R[-15]C -> 210|210|210|210 | L95: =R[-15]C -> 4|1|2|3 | M95: =R[-15]C -> 200|20|20|20 | N95: =R[-15]C -> 4|1|2|3 | O95: =R[-15]C -> 285000|28500|28500|28500
A96: =R[-30]C+10 -> 50022 | B96: =R[-15]C -> 15 | C96: =R[-15]C -> 100 | D96: =R[-15]C -> 0 | E96: =R[-15]C -> 15 | F96: =R[-15]C -> 8 | G96: =R[-15]C -> 1 | H96: =R[-15]C -> 2400 | I96: 10039|0 | J96: =R[-15]C -> 10030|10031|10032|10033 | K96: =R[-15]C -> 0|0|0|0 | L96: =R[-15]C -> 4|1|2|3 | M96: =R[-15]C -> 0|0|0|0 | N96: =R[-15]C -> 4|1|2|3 | O96: =R[-15]C -> 341000|34100|34100|34100
A97: 50031 | B97: =R[-15]C -> 1 | C97: =R[-15]C -> 0 | D97: =R[-15]C -> 20 | E97: =R[-15]C -> 1 | F97: =R[-15]C -> 1 | G97: =R[-15]C -> 1 | H97: =R[-15]C -> 1000 | I97: 10040|1 | J97: =R[-15]C -> 10030|10031|10032|10033 | K97: =R[-15]C -> 5|5|5|5 | L97: =R[-15]C -> 4|1|2|3 | M97: =R[-15]C -> 50|5|5|5 | N97: =R[-15]C -> 4|1|2|3 | O97: =R[-15]C -> 0|0|0|0
A98: 50031 | B98: =R[-15]C -> 2 | C98: =R[-15]C -> 5 | D98: =R[-15]C -> 40 | E98: =R[-15]C -> 2 | F98: =R[-15]C -> 1 | G98: =R[-15]C -> 1 | H98: =R[-15]C -> 1100 | I98: 10040|2 | J98: =R[-15]C -> 10030|10031|10032|10033 | K98: =R[-15]C -> 10|10|10|10 | L98: =R[-15]C -> 4|1|2|3 | M98: =R[-15]C -> 50|5|5|5 | N98: =R[-15]C -> 4|1|2|3 | O98: =R[-15]C -> 1000|100|100|100
A99: 50031 | B99: =R[-15]C -> 3 | C99: =R[-15]C -> 10 | D99: =R[-15]C -> 60 | E99: =R[-15]C -> 3 | F99: =R[-15]C -> 2 | G99: =R[-15]C -> 1 | H99: =R[-15]C -> 1200 | I99: 10040|3 | J99: =R[-15]C -> 10030|10031|10032|10033 | K99: =R[-15]C -> 20|20|20|20 | L99: =R[-15]C -> 4|1|2|3 | M99: =R[-15]C -> 100|10|10|10 | N99: =R[-15]C -> 4|1|2|3 | O99: =R[-15]C -> 3000|300|300|300
A100: 50031 | B100: =R[-15]C -> 4 | C100: =R[-15]C -> 15 | D100: =R[-15]C -> 80 | E100: =R[-15]C -> 4 | F100: =R[-15]C -> 2 | G100: =R[-15]C -> 1 | H100: =R[-15]C -> 1300 | I100: 10040|4 | J100: =R[-15]C -> 10030|10031|10032|10033 | K100: =R[-15]C -> 25|25|25|25 | L100: =R[-15]C -> 4|1|2|3 | M100: =R[-15]C -> 100|10|10|10 | N100: =R[-15]C -> 4|1|2|3 | O100: =R[-15]C -> 9000|900|900|900
A101: 50031 | B101: =R[-15]C -> 5 | C101: =R[-15]C -> 20 | D101: =R[-15]C -> 100 | E101: =R[-15]C -> 5 | F101: =R[-15]C -> 3 | G101: =R[-15]C -> 1 | H101: =R[-15]C -> 1400 | I101: 10040|5 | J101: =R[-15]C -> 10030|10031|10032|10033 | K101: =R[-15]C -> 30|30|30|30 | L101: =R[-15]C -> 4|1|2|3 | M101: =R[-15]C -> 100|10|10|10 | N101: =R[-15]C -> 4|1|2|3 | O101: =R[-15]C -> 17000|1700|1700|1700
A102: 50031 | B102: =R[-15]C -> 6 | C102: =R[-15]C -> 25 | D102: =R[-15]C -> 120 | E102: =R[-15]C -> 6 | F102: =R[-15]C -> 3 | G102: =R[-15]C -> 1 | H102: =R[-15]C -> 1500 | I102: 10040|6 | J102: =R[-15]C -> 10030|10031|10032|10033 | K102: =R[-15]C -> 35|35|35|35 | L102: =R[-15]C -> 4|1|2|3 | M102: =R[-15]C -> 100|10|10|10 | N102: =R[-15]C -> 4|1|2|3 | O102: =R[-15]C -> 27000|2700|2700|2700
A103: 50031 | B103: =R[-15]C -> 7 | C103: =R[-15]C -> 30 | D103: =R[-15]C -> 140 | E103: =R[-15]C -> 7 | F103: =R[-15]C -> 4 | G103: =R[-15]C -> 1 | H103: =R[-15]C -> 1600 | I103: 10040|7 | J103: =R[-15]C -> 10030|10031|10032|10033 | K103: =R[-15]C -> 60|60|60|60 | L103: =R[-15]C -> 4|1|2|3 | M103: =R[-15]C -> 150|15|15|15 | N103: =R[-15]C -> 4|1|2|3 | O103: =R[-15]C -> 39000|3900|3900|3900
A104: 50031 | B104: =R[-15]C -> 8 | C104: =R[-15]C -> 35 | D104: =R[-15]C -> 160 | E104: =R[-15]C -> 8 | F104: =R[-15]C -> 4 | G104: =R[-15]C -> 1 | H104: =R[-15]C -> 1700 | I104: 10040|8 | J104: =R[-15]C -> 10030|10031|10032|10033 | K104: =R[-15]C -> 70|70|70|70 | L104: =R[-15]C -> 4|1|2|3 | M104: =R[-15]C -> 150|15|15|15 | N104: =R[-15]C -> 4|1|2|3 | O104: =R[-15]C -> 60000|6000|6000|6000
A105: 50031 | B105: =R[-15]C -> 9 | C105: =R[-15]C -> 40 | D105: =R[-15]C -> 180 | E105: =R[-15]C -> 9 | F105: =R[-15]C -> 5 | G105: =R[-15]C -> 1 | H105: =R[-15]C -> 1800 | I105: 10040|9 | J105: =R[-15]C -> 10030|10031|10032|10033 | K105: =R[-15]C -> 80|80|80|80 | L105: =R[-15]C -> 4|1|2|3 | M105: =R[-15]C -> 150|15|15|15 | N105: =R[-15]C -> 4|1|2|3 | O105: =R[-15]C -> 84000|8400|8400|8400
A106: 50031 | B106: =R[-15]C -> 10 | C106: =R[-15]C -> 45 | D106: =R[-15]C -> 200 | E106: =R[-15]C -> 10 | F106: =R[-15]C -> 5 | G106: =R[-15]C -> 1 | H106: =R[-15]C -> 1900 | I106: 10040|10 | J106: =R[-15]C -> 10030|10031|10032|10033 | K106: =R[-15]C -> 90|90|90|90 | L106: =R[-15]C -> 4|1|2|3 | M106: =R[-15]C -> 150|15|15|15 | N106: =R[-15]C -> 4|1|2|3 | O106: =R[-15]C -> 111000|11100|11100|11100
A107: 50031 | B107: =R[-15]C -> 11 | C107: =R[-15]C -> 50 | D107: =R[-15]C -> 220 | E107: =R[-15]C -> 11 | F107: =R[-15]C -> 6 | G107: =R[-15]C -> 1 | H107: =R[-15]C -> 2000 | I107: 10040|11 | J107: =R[-15]C -> 10030|10031|10032|10033 | K107: =R[-15]C -> 120|120|120|120 | L107: =R[-15]C -> 4|1|2|3 | M107: =R[-15]C -> 200|20|20|20 | N107: =R[-15]C -> 4|1|2|3 | O107: =R[-15]C -> 141000|14100|14100|14100
A108: 50031 | B108: =R[-15]C -> 12 | C108: =R[-15]C -> 60 | D108: =R[-15]C -> 240 | E108: =R[-15]C -> 12 | F108: =R[-15]C -> 6 | G108: =R[-15]C -> 1 | H108: =R[-15]C -> 2100 | I108: 10040|12 | J108: =R[-15]C -> 10030|10031|10032|10033 | K108: =R[-15]C -> 150|150|150|150 | L108: =R[-15]C -> 4|1|2|3 | M108: =R[-15]C -> 200|20|20|20 | N108: =R[-15]C -> 4|1|2|3 | O108: =R[-15]C -> 185000|18500|18500|18500
A109: 50031 | B109: =R[-15]C -> 13 | C109: =R[-15]C -> 70 | D109: =R[-15]C -> 260 | E109: =R[-15]C -> 13 | F109: =R[-15]C -> 7 | G109: =R[-15]C -> 1 | H109: =R[-15]C -> 2200 | I109: 10040|13 | J109: =R[-15]C -> 10030|10031|10032|10033 | K109: =R[-15]C -> 180|180|180|180 | L109: =R[-15]C -> 4|1|2|3 | M109: =R[-15]C -> 200|20|20|20 | N109: =R[-15]C -> 4|1|2|3 | O109: =R[-15]C -> 233000|23300|23300|23300
A110: 50031 | B110: =R[-15]C -> 14 | C110: =R[-15]C -> 80 | D110: =R[-15]C -> 280 | E110: =R[-15]C -> 14 | F110: =R[-15]C -> 7 | G110: =R[-15]C -> 1 | H110: =R[-15]C -> 2300 | I110: 10040|14 | J110: =R[-15]C -> 10030|10031|10032|10033 | K110: =R[-15]C -> 210|210|210|210 | L110: =R[-15]C -> 4|1|2|3 | M110: =R[-15]C -> 200|20|20|20 | N110: =R[-15]C -> 4|1|2|3 | O110: =R[-15]C -> 285000|28500|28500|28500
A111: 50031 | B111: =R[-15]C -> 15 | C111: =R[-15]C -> 100 | D111: =R[-15]C -> 0 | E111: =R[-15]C -> 15 | F111: =R[-15]C -> 8 | G111: =R[-15]C -> 1 | H111: =R[-15]C -> 2400 | I111: 10040|0 | J111: =R[-15]C -> 10030|10031|10032|10033 | K111: =R[-15]C -> 0|0|0|0 | L111: =R[-15]C -> 4|1|2|3 | M111: =R[-15]C -> 0|0|0|0 | N111: =R[-15]C -> 4|1|2|3 | O111: =R[-15]C -> 341000|34100|34100|34100
A112: 50032 | B112: =R[-15]C -> 1 | C112: =R[-15]C -> 0 | D112: =R[-15]C -> 20 | E112: =R[-15]C -> 1 | F112: =R[-15]C -> 1 | G112: =R[-15]C -> 1 | H112: =R[-15]C -> 1000 | I112: 10041|1 | J112: =R[-15]C -> 10030|10031|10032|10033 | K112: =R[-15]C -> 5|5|5|5 | L112: =R[-15]C -> 4|1|2|3 | M112: =R[-15]C -> 50|5|5|5 | N112: =R[-15]C -> 4|1|2|3 | O112: =R[-15]C -> 0|0|0|0
A113: 50032 | B113: =R[-15]C -> 2 | C113: =R[-15]C -> 5 | D113: =R[-15]C -> 40 | E113: =R[-15]C -> 2 | F113: =R[-15]C -> 1 | G113: =R[-15]C -> 1 | H113: =R[-15]C -> 1100 | I113: 10041|2 | J113: =R[-15]C -> 10030|10031|10032|10033 | K113: =R[-15]C -> 10|10|10|10 | L113: =R[-15]C -> 4|1|2|3 | M113: =R[-15]C -> 50|5|5|5 | N113: =R[-15]C -> 4|1|2|3 | O113: =R[-15]C -> 1000|100|100|100
A114: 50032 | B114: =R[-15]C -> 3 | C114: =R[-15]C -> 10 | D114: =R[-15]C -> 60 | E114: =R[-15]C -> 3 | F114: =R[-15]C -> 2 | G114: =R[-15]C -> 1 | H114: =R[-15]C -> 1200 | I114: 10041|3 | J114: =R[-15]C -> 10030|10031|10032|10033 | K114: =R[-15]C -> 20|20|20|20 | L114: =R[-15]C -> 4|1|2|3 | M114: =R[-15]C -> 100|10|10|10 | N114: =R[-15]C -> 4|1|2|3 | O114: =R[-15]C -> 3000|300|300|300
A115: 50032 | B115: =R[-15]C -> 4 | C115: =R[-15]C -> 15 | D115: =R[-15]C -> 80 | E115: =R[-15]C -> 4 | F115: =R[-15]C -> 2 | G115: =R[-15]C -> 1 | H115: =R[-15]C -> 1300 | I115: 10041|4 | J115: =R[-15]C -> 10030|10031|10032|10033 | K115: =R[-15]C -> 25|25|25|25 | L115: =R[-15]C -> 4|1|2|3 | M115: =R[-15]C -> 100|10|10|10 | N115: =R[-15]C -> 4|1|2|3 | O115: =R[-15]C -> 9000|900|900|900
A116: 50032 | B116: =R[-15]C -> 5 | C116: =R[-15]C -> 20 | D116: =R[-15]C -> 100 | E116: =R[-15]C -> 5 | F116: =R[-15]C -> 3 | G116: =R[-15]C -> 1 | H116: =R[-15]C -> 1400 | I116: 10041|5 | J116: =R[-15]C -> 10030|10031|10032|10033 | K116: =R[-15]C -> 30|30|30|30 | L116: =R[-15]C -> 4|1|2|3 | M116: =R[-15]C -> 100|10|10|10 | N116: =R[-15]C -> 4|1|2|3 | O116: =R[-15]C -> 17000|1700|1700|1700
A117: 50032 | B117: =R[-15]C -> 6 | C117: =R[-15]C -> 25 | D117: =R[-15]C -> 120 | E117: =R[-15]C -> 6 | F117: =R[-15]C -> 3 | G117: =R[-15]C -> 1 | H117: =R[-15]C -> 1500 | I117: 10041|6 | J117: =R[-15]C -> 10030|10031|10032|10033 | K117: =R[-15]C -> 35|35|35|35 | L117: =R[-15]C -> 4|1|2|3 | M117: =R[-15]C -> 100|10|10|10 | N117: =R[-15]C -> 4|1|2|3 | O117: =R[-15]C -> 27000|2700|2700|2700
A118: 50032 | B118: =R[-15]C -> 7 | C118: =R[-15]C -> 30 | D118: =R[-15]C -> 140 | E118: =R[-15]C -> 7 | F118: =R[-15]C -> 4 | G118: =R[-15]C -> 1 | H118: =R[-15]C -> 1600 | I118: 10041|7 | J118: =R[-15]C -> 10030|10031|10032|10033 | K118: =R[-15]C -> 60|60|60|60 | L118: =R[-15]C -> 4|1|2|3 | M118: =R[-15]C -> 150|15|15|15 | N118: =R[-15]C -> 4|1|2|3 | O118: =R[-15]C -> 39000|3900|3900|3900
A119: 50032 | B119: =R[-15]C -> 8 | C119: =R[-15]C -> 35 | D119: =R[-15]C -> 160 | E119: =R[-15]C -> 8 | F119: =R[-15]C -> 4 | G119: =R[-15]C -> 1 | H119: =R[-15]C -> 1700 | I119: 10041|8 | J119: =R[-15]C -> 10030|10031|10032|10033 | K119: =R[-15]C -> 70|70|70|70 | L119: =R[-15]C -> 4|1|2|3 | M119: =R[-15]C -> 150|15|15|15 | N119: =R[-15]C -> 4|1|2|3 | O119: =R[-15]C -> 60000|6000|6000|6000
A120: 50032 | B120: =R[-15]C -> 9 | C120: =R[-15]C -> 40 | D120: =R[-15]C -> 180 | E120: =R[-15]C -> 9 | F120: =R[-15]C -> 5 | G120: =R[-15]C -> 1 | H120: =R[-15]C -> 1800 | I120: 10041|9 | J120: =R[-15]C -> 10030|10031|10032|10033 | K120: =R[-15]C -> 80|80|80|80 | L120: =R[-15]C -> 4|1|2|3 | M120: =R[-15]C -> 150|15|15|15 | N120: =R[-15]C -> 4|1|2|3 | O120: =R[-15]C -> 84000|8400|8400|8400
A121: 50032 | B121: =R[-15]C -> 10 | C121: =R[-15]C -> 45 | D121: =R[-15]C -> 200 | E121: =R[-15]C -> 10 | F121: =R[-15]C -> 5 | G121: =R[-15]C -> 1 | H121: =R[-15]C -> 1900 | I121: 10041|10 | J121: =R[-15]C -> 10030|10031|10032|10033 | K121: =R[-15]C -> 90|90|90|90 | L121: =R[-15]C -> 4|1|2|3 | M121: =R[-15]C -> 150|15|15|15 | N121: =R[-15]C -> 4|1|2|3 | O121: =R[-15]C -> 111000|11100|11100|11100
A122: 50032 | B122: =R[-15]C -> 11 | C122: =R[-15]C -> 50 | D122: =R[-15]C -> 220 | E122: =R[-15]C -> 11 | F122: =R[-15]C -> 6 | G122: =R[-15]C -> 1 | H122: =R[-15]C -> 2000 | I122: 10041|11 | J122: =R[-15]C -> 10030|10031|10032|10033 | K122: =R[-15]C -> 120|120|120|120 | L122: =R[-15]C -> 4|1|2|3 | M122: =R[-15]C -> 200|20|20|20 | N122: =R[-15]C -> 4|1|2|3 | O122: =R[-15]C -> 141000|14100|14100|14100
A123: 50032 | B123: =R[-15]C -> 12 | C123: =R[-15]C -> 60 | D123: =R[-15]C -> 240 | E123: =R[-15]C -> 12 | F123: =R[-15]C -> 6 | G123: =R[-15]C -> 1 | H123: =R[-15]C -> 2100 | I123: 10041|12 | J123: =R[-15]C -> 10030|10031|10032|10033 | K123: =R[-15]C -> 150|150|150|150 | L123: =R[-15]C -> 4|1|2|3 | M123: =R[-15]C -> 200|20|20|20 | N123: =R[-15]C -> 4|1|2|3 | O123: =R[-15]C -> 185000|18500|18500|18500
A124: 50032 | B124: =R[-15]C -> 13 | C124: =R[-15]C -> 70 | D124: =R[-15]C -> 260 | E124: =R[-15]C -> 13 | F124: =R[-15]C -> 7 | G124: =R[-15]C -> 1 | H124: =R[-15]C -> 2200 | I124: 10041|13 | J124: =R[-15]C -> 10030|10031|10032|10033 | K124: =R[-15]C -> 180|180|180|180 | L124: =R[-15]C -> 4|1|2|3 | M124: =R[-15]C -> 200|20|20|20 | N124: =R[-15]C -> 4|1|2|3 | O124: =R[-15]C -> 233000|23300|23300|23300
A125: 50032 | B125: =R[-15]C -> 14 | C125: =R[-15]C -> 80 | D125: =R[-15]C -> 280 | E125: =R[-15]C -> 14 | F125: =R[-15]C -> 7 | G125: =R[-15]C -> 1 | H125: =R[-15]C -> 2300 | I125: 10041|14 | J125: =R[-15]C -> 10030|10031|10032|10033 | K125: =R[-15]C -> 210|210|210|210 | L125: =R[-15]C -> 4|1|2|3 | M125: =R[-15]C -> 200|20|20|20 | N125: =R[-15]C -> 4|1|2|3 | O125: =R[-15]C -> 285000|28500|28500|28500
A126: 50032 | B126: =R[-15]C -> 15 | C126: =R[-15]C -> 100 | D126: =R[-15]C -> 0 | E126: =R[-15]C -> 15 | F126: =R[-15]C -> 8 | G126: =R[-15]C -> 1 | H126: =R[-15]C -> 2400 | I126: 10041|0 | J126: =R[-15]C -> 10030|10031|10032|10033 | K126: =R[-15]C -> 0|0|0|0 | L126: =R[-15]C -> 4|1|2|3 | M126: =R[-15]C -> 0|0|0|0 | N126: =R[-15]C -> 4|1|2|3 | O126: =R[-15]C -> 341000|34100|34100|34100

Sheet: 精灵天赋技能
A1: id|id | B1: level|level | C1: name| | D1: desc| | E1: hero_pro_type_list|hero_pro_type_list | F1: hero_pro_value_list|hero_pro_value_list | G1: spirit_pro_type_list|spirit_pro_type_list | H1: spirit_pro_value_list|spirit_pro_value_list | I1: decrease_private_cd| | J1: decrease_public_cd| | K1: fb_type|fb_type | L1: extra_reward_drop_item_id|extra_reward_drop_item_id | M1: extra_reward_drop_item_rate|extra_reward_drop_item_rate | N1: extra_reward_currency_type|extra_reward_currency_type | O1: extra_reward_currency_rate|extra_reward_currency_rate
A2: 不可空 | B2: 不可空 | C2: 不可空 | D2: 不可空 | E2: 可空#不需字段 | F2: 可空#不需字段 | G2: 可空#不需字段 | H2: 可空#不需字段 | I2: 可空#不需字段 | J2: 可空#不需字段 | K2: 可空#不需字段 | L2: 可空#不需字段 | M2: 可空#不需字段 | N2: 可空#不需字段 | O2: 可空#不需字段
A3: 数字 | B3: 数字 | C3: 字符串 | D3: 字符串 | E3: 一维数组 | F3: 一维数组 | G3: 一维数组 | H3: 一维数组 | I3: 数字 | J3: 数字 | K3: 一维数组 | L3: 一维数组 | M3: 一维数组 | N3: 一维数组 | O3: 一维数组
E4: 不定长 | F4: 不定长 | G4: 不定长 | H4: 不定长 | K4: 不定长 | L4: 不定长 | M4: 不定长 | N4: 不定长 | O4: 不定长
A6: 精灵ID | B6: 天赋技能等级 | C6: 天赋技能名 | D6: 描述 | E6: 全体出战英雄属性类型 | F6: 全体出战英雄属性值 | G6: 全体精灵属性类型 | H6: 全体精灵属性值 | I6: 减少精灵专属技CD | J6: 减少精灵通用技CD | K6: 副本类型 | L6: 获得额外奖励的掉落物品ID | M6: 获得额外奖励的物品比例 | N6: 获得额外奖励的货币类型 | O6: 获得额外奖励的货币万分比
A7: 50001 | B7: 1 | C7: 希望之光 | D7: ="全体出战英雄生命+"&RC[2] -> 全体出战英雄生命+100 | E7: 4 | F7: 100
A8: 50001 | B8: 2 | C8: 希望之光 | D8: ="全体出战英雄生命+"&RC[2] -> 全体出战英雄生命+200 | E8: 4 | F8: 200
A9: 50001 | B9: 3 | C9: 希望之光 | D9: ="全体出战英雄生命+"&RC[2] -> 全体出战英雄生命+400 | E9: 4 | F9: 400
A10: 50001 | B10: 4 | C10: 希望之光 | D10: ="全体出战英雄生命+"&RC[2] -> 全体出战英雄生命+800 | E10: 4 | F10: 800
A11: 50001 | B11: 5 | C11: 希望之光 | D11: ="全体出战英雄生命+"&RC[2] -> 全体出战英雄生命+1600 | E11: 4 | F11: 1600
A12: 50001 | B12: 6 | C12: 希望之光 | D12: ="全体出战英雄生命+"&RC[2] -> 全体出战英雄生命+3200 | E12: 4 | F12: 3200
A13: 50001 | B13: 7 | C13: 希望之光 | D13: ="全体出战英雄生命+"&RC[2] -> 全体出战英雄生命+6400 | E13: 4 | F13: 6400
A14: 50001 | B14: 8 | C14: 希望之光 | D14: ="全体出战英雄生命+"&RC[2] -> 全体出战英雄生命+12800 | E14: 4 | F14: 12800
A15: 50002 | B15: 1 | C15: 绝境之战 | D15: ="全体精灵专属技能CD-"&MID(RC[5],1,3)&"s" -> 全体精灵专属技能CD-5s | I15: 5
A16: 50002 | B16: 2 | C16: 绝境之战 | D16: ="全体精灵专属技能CD-"&MID(RC[5],1,3)&"s" -> 全体精灵专属技能CD-10s | I16: 10
A17: 50002 | B17: 3 | C17: 绝境之战 | D17: ="全体精灵专属技能CD-"&MID(RC[5],1,3)&"s" -> 全体精灵专属技能CD-15s | I17: 15
A18: 50002 | B18: 4 | C18: 绝境之战 | D18: ="全体精灵专属技能CD-"&MID(RC[5],1,3)&"s" -> 全体精灵专属技能CD-20s | I18: 20
A19: 50002 | B19: 5 | C19: 绝境之战 | D19: ="全体精灵专属技能CD-"&MID(RC[5],1,3)&"s" -> 全体精灵专属技能CD-25s | I19: 25
A20: 50002 | B20: 6 | C20: 绝境之战 | D20: ="全体精灵专属技能CD-"&MID(RC[5],1,3)&"s" -> 全体精灵专属技能CD-30s | I20: 30
A21: 50002 | B21: 7 | C21: 绝境之战 | D21: ="全体精灵专属技能CD-"&MID(RC[5],1,3)&"s" -> 全体精灵专属技能CD-35s | I21: 35
A22: 50002 | B22: 8 | C22: 绝境之战 | D22: ="全体精灵专属技能CD-"&MID(RC[5],1,3)&"s" -> 全体精灵专属技能CD-40s | I22: 40
A23: 50011 | B23: 1 | C23: 灵魂沸腾 | D23: ="全体精灵攻击+"&RC[4] -> 全体精灵攻击+40 | G23: 1 | H23: 40
A24: 50011 | B24: 2 | C24: 灵魂沸腾 | D24: ="全体精灵攻击+"&RC[4] -> 全体精灵攻击+80 | G24: 1 | H24: 80
A25: 50011 | B25: 3 | C25: 灵魂沸腾 | D25: ="全体精灵攻击+"&RC[4] -> 全体精灵攻击+160 | G25: 1 | H25: 160
A26: 50011 | B26: 4 | C26: 灵魂沸腾 | D26: ="全体精灵攻击+"&RC[4] -> 全体精灵攻击+320 | G26: 1 | H26: 320
A27: 50011 | B27: 5 | C27: 灵魂沸腾 | D27: ="全体精灵攻击+"&RC[4] -> 全体精灵攻击+640 | G27: 1 | H27: 640
A28: 50011 | B28: 6 | C28: 灵魂沸腾 | D28: ="全体精灵攻击+"&RC[4] -> 全体精灵攻击+1280 | G28: 1 | H28: 1280
A29: 50011 | B29: 7 | C29: 灵魂沸腾 | D29: ="全体精灵攻击+"&RC[4] -> 全体精灵攻击+2560 | G29: 1 | H29: 2560
A30: 50011 | B30: 8 | C30: 灵魂沸腾 | D30: ="全体精灵攻击+"&RC[4] -> 全体精灵攻击+5120 | G30: 1 | H30: 5120
A31: 50012 | B31: 1 | C31: 海纳百川 | D31: ="全体出战英雄物防和法防+"&MID(RC[2],1,FIND("|",RC[2],1)-1) -> 全体出战英雄物防和法防+20 | E31: 2|3 | F31: 20|20
A32: 50012 | B32: 2 | C32: 海纳百川 | D32: ="全体出战英雄物防和法防+"&MID(RC[2],1,FIND("|",RC[2],1)-1) -> 全体出战英雄物防和法防+40 | E32: 2|3 | F32: 40|40
A33: 50012 | B33: 3 | C33: 海纳百川 | D33: ="全体出战英雄物防和法防+"&MID(RC[2],1,FIND("|",RC[2],1)-1) -> 全体出战英雄物防和法防+80 | E33: 2|3 | F33: 80|80
A34: 50012 | B34: 4 | C34: 海纳百川 | D34: ="全体出战英雄物防和法防+"&MID(RC[2],1,FIND("|",RC[2],1)-1) -> 全体出战英雄物防和法防+160 | E34: 2|3 | F34: 160|160
A35: 50012 | B35: 5 | C35: 海纳百川 | D35: ="全体出战英雄物防和法防+"&MID(RC[2],1,FIND("|",RC[2],1)-1) -> 全体出战英雄物防和法防+320 | E35: 2|3 | F35: 320|320
A36: 50012 | B36: 6 | C36: 海纳百川 | D36: ="全体出战英雄物防和法防+"&MID(RC[2],1,FIND("|",RC[2],1)-1) -> 全体出战英雄物防和法防+640 | E36: 2|3 | F36: 640|640
A37: 50012 | B37: 7 | C37: 海纳百川 | D37: ="全体出战英雄物防和法防+"&MID(RC[2],1,FIND("|",RC[2],1)-1) -> 全体出战英雄物防和法防+1280 | E37: 2|3 | F37: 1280|1280
A38: 50012 | B38: 8 | C38: 海纳百川 | D38: ="全体出战英雄物防和法防+"&MID(RC[2],1,FIND("|",RC[2],1)-1) -> 全体出战英雄物防和法防+2560 | E38: 2|3 | F38: 2560|2560
A39: 50021 | B39: 1 | C39: 暴风骤起 | D39: ="主线副本掉落金币+"&RC[11]/100&"%" -> 主线副本掉落金币+10% | K39: 1 | N39: 3 | O39: 1000
A40: 50021 | B40: 2 | C40: 暴风骤起 | D40: ="主线副本掉落金币+"&RC[11]/100&"%" -> 主线副本掉落金币+20% | K40: 1 | N40: 3 | O40: 2000
A41: 50021 | B41: 3 | C41: 暴风骤起 | D41: ="主线副本掉落金币+"&RC[11]/100&"%" -> 主线副本掉落金币+30% | K41: 1 | N41: 3 | O41: 3000
A42: 50021 | B42: 4 | C42: 暴风骤起 | D42: ="主线副本掉落金币+"&RC[11]/100&"%" -> 主线副本掉落金币+40% | K42: 1 | N42: 3 | O42: 4000
A43: 50021 | B43: 5 | C43: 暴风骤起 | D43: ="主线副本掉落金币+"&RC[11]/100&"%" -> 主线副本掉落金币+50% | K43: 1 | N43: 3 | O43: 5000
A44: 50021 | B44: 6 | C44: 暴风骤起 | D44: ="主线副本掉落金币+"&RC[11]/100&"%" -> 主线副本掉落金币+60% | K44: 1 | N44: 3 | O44: 6000
A45: 50021 | B45: 7 | C45: 暴风骤起 | D45: ="主线副本掉落金币+"&RC[11]/100&"%" -> 主线副本掉落金币+70% | K45: 1 | N45: 3 | O45: 7000
A46: 50021 | B46: 8 | C46: 暴风骤起 | D46: ="主线副本掉落金币+"&RC[11]/100&"%" -> 主线副本掉落金币+80% | K46: 1 | N46: 3 | O46: 8000
A47: 50022 | B47: 1 | C47: 稳如泰山 | D47: ="全体精灵通用技能CD-"&MID(RC[6],1,3)&"s" -> 全体精灵通用技能CD-5s | J47: 5
A48: 50022 | B48: 2 | C48: 稳如泰山 | D48: ="全体精灵通用技能CD-"&MID(RC[6],1,3)&"s" -> 全体精灵通用技能CD-10s | J48: 10
A49: 50022 | B49: 3 | C49: 稳如泰山 | D49: ="全体精灵通用技能CD-"&MID(RC[6],1,3)&"s" -> 全体精灵通用技能CD-15s | J49: 15
A50: 50022 | B50: 4 | C50: 稳如泰山 | D50: ="全体精灵通用技能CD-"&MID(RC[6],1,3)&"s" -> 全体精灵通用技能CD-20s | J50: 20
A51: 50022 | B51: 5 | C51: 稳如泰山 | D51: ="全体精灵通用技能CD-"&MID(RC[6],1,3)&"s" -> 全体精灵通用技能CD-25s | J51: 25
A52: 50022 | B52: 6 | C52: 稳如泰山 | D52: ="全体精灵通用技能CD-"&MID(RC[6],1,3)&"s" -> 全体精灵通用技能CD-30s | J52: 30
A53: 50022 | B53: 7 | C53: 稳如泰山 | D53: ="全体精灵通用技能CD-"&MID(RC[6],1,3)&"s" -> 全体精灵通用技能CD-35s | J53: 35
A54: 50022 | B54: 8 | C54: 稳如泰山 | D54: ="全体精灵通用技能CD-"&MID(RC[6],1,3)&"s" -> 全体精灵通用技能CD-40s | J54: 40
A55: 50031 | B55: 1 | C55: 灵魄共生 | D55: ="全体出战英雄攻击+"&RC[2] -> 全体出战英雄攻击+20 | E55: 1 | F55: 20
A56: 50031 | B56: 2 | C56: 灵魄共生 | D56: ="全体出战英雄攻击+"&RC[2] -> 全体出战英雄攻击+40 | E56: 1 | F56: 40
A57: 50031 | B57: 3 | C57: 灵魄共生 | D57: ="全体出战英雄攻击+"&RC[2] -> 全体出战英雄攻击+80 | E57: 1 | F57: 80
A58: 50031 | B58: 4 | C58: 灵魄共生 | D58: ="全体出战英雄攻击+"&RC[2] -> 全体出战英雄攻击+160 | E58: 1 | F58: 160
A59: 50031 | B59: 5 | C59: 灵魄共生 | D59: ="全体出战英雄攻击+"&RC[2] -> 全体出战英雄攻击+320 | E59: 1 | F59: 320
A60: 50031 | B60: 6 | C60: 灵魄共生 | D60: ="全体出战英雄攻击+"&RC[2] -> 全体出战英雄攻击+640 | E60: 1 | F60: 640
A61: 50031 | B61: 7 | C61: 灵魄共生 | D61: ="全体出战英雄攻击+"&RC[2] -> 全体出战英雄攻击+1280 | E61: 1 | F61: 1280
A62: 50031 | B62: 8 | C62: 灵魄共生 | D62: ="全体出战英雄攻击+"&RC[2] -> 全体出战英雄攻击+2560 | E62: 1 | F62: 2560
A63: 50032 | B63: 1 | C63: 遮天蔽日 | D63: ="全体精灵生命+"&RC[4] -> 全体精灵生命+400 | G63: 4 | H63: 400
A64: 50032 | B64: 2 | C64: 遮天蔽日 | D64: ="全体精灵生命+"&RC[4] -> 全体精灵生命+800 | G64: 4 | H64: 800
A65: 50032 | B65: 3 | C65: 遮天蔽日 | D65: ="全体精灵生命+"&RC[4] -> 全体精灵生命+1600 | G65: 4 | H65: 1600
A66: 50032 | B66: 4 | C66: 遮天蔽日 | D66: ="全体精灵生命+"&RC[4] -> 全体精灵生命+3200 | G66: 4 | H66: 3200
A67: 50032 | B67: 5 | C67: 遮天蔽日 | D67: ="全体精灵生命+"&RC[4] -> 全体精灵生命+6400 | G67: 4 | H67: 6400
A68: 50032 | B68: 6 | C68: 遮天蔽日 | D68: ="全体精灵生命+"&RC[4] -> 全体精灵生命+12800 | G68: 4 | H68: 12800
A69: 50032 | B69: 7 | C69: 遮天蔽日 | D69: ="全体精灵生命+"&RC[4] -> 全体精灵生命+25600 | G69: 4 | H69: 25600
A70: 50032 | B70: 8 | C70: 遮天蔽日 | D70: ="全体精灵生命+"&RC[4] -> 全体精灵生命+51200 | G70: 4 | H70: 51200

Sheet: 精灵升星
A1: star|star | B1: star_up_cost_item_num|star_up_cost_item_num
A2: 不可空 | B2: 不可空
A3: 数字 | B3: 数字
A6: 精灵星级 | B6: 升到下级所需消耗碎片数量 | D6: 总需碎片
A7: 0 | B7: 30 | D7: 90 | E7: 合成
A8: 1 | B8: =R[-1]C*2 -> 60 | D8: =R[-1]C+R[-1]C[-2] -> 120
A9: 2 | B9: =R[-1]C*2 -> 120 | C9: 初始精灵 | D9: =R[-1]C+R[-1]C[-2] -> 180
A10: 3 | B10: =R[-1]C*2 -> 240 | C10: 活跃精灵、早期的付费精灵 | D10: =R[-1]C+R[-1]C[-2] -> 300
A11: 4 | B11: =R[-1]C*2 -> 480 | C11: 后期的付费精灵 | D11: =R[-1]C+R[-1]C[-2] -> 540
A12: 5 | B12: =R[-1]C*2 -> 960 | C12: 终极赛事精灵 | D12: =R[-1]C+R[-1]C[-2] -> 1020
A13: 6 | B13: =R[-1]C*2 -> 1920 | C13: 暂未开放 | D13: =R[-1]C+R[-1]C[-2] -> 1980
A14: 7 | B14: =R[-1]C*2 -> 3840 | C14: 暂未开放 | D14: =R[-1]C+R[-1]C[-2] -> 3900

Sheet: 精灵特性
A1: id|id | B1: star|star | C1: bless_pro_type_list|bless_pro_type_list | D1: bless_pro_value_list|bless_pro_value_list | E1: bless_skill_trigger_mode| | F1: buff_target| | G1: buff_list| | H1: speciality_des| | I1: bless_skill_name| | J1: bless_skill_des|
A2: 不可空 | B2: 不可空 | C2: 可空#不需字段 | D2: 可空#不需字段 | E2: 可空#不需字段 | F2: 可空#不需字段 | G2: 可空#不需字段 | H2: 不可空 | I2: 不可空 | J2: 不可空
A3: 数字 | B3: 数字 | C3: 一维数组 | D3: 一维数组 | E3: 二维数组 | F3: 二维数组 | G3: 二维数组 | H3: 字符串 | I3: 字符串 | J3: 字符串
C4: 不定长 | D4: 不定长 | E4: 不定长 | F4: 不定长 | G4: 不定长
A6: 精灵ID | B6: 星级 | C6: 祝福提升属性类型 | D6: 祝福提升属性值 | E6: 祝福技能触发模式 | F6: BUFF命中目标逻辑 | G6: BUFF列表 | H6: 特性描述 | I6: 祝福技能名 | J6: 祝福技能描述 | K6: <COLOR VALUE=FF28871E></COLOR> | L6: 触发模式
A7: 50001 | B7: 0 | E7: 5|2000 | F7: 3|0|0 | G7: 10000|50001001 | H7: 解锁精灵祝福技能。 | I7: 生命源泉 | J7: 被精灵祝福的英雄回复生命时，<COLOR VALUE=FF28871E>20%</COLOR>几率额外回复精灵生命*<COLOR VALUE=FF28871E>5%</COLOR>的生命。 | L7: 1|技能类型|触发几率=使用对应类型的伤害技能时触发（作用阵营为2的）
A8: 50001 | B8: 1 | C8: 14 | D8: 1000 | E8: 5|2000 | F8: 3|0|0 | G8: =R[-1]C -> 10000|50001001 | H8: 提升被祝福的英雄<COLOR VALUE=FF28871E>10%</COLOR>抗暴率。 | I8: 生命源泉 | J8: 被精灵祝福的英雄回复生命时，<COLOR VALUE=FF28871E>20%</COLOR>几率额外回复精灵生命*<COLOR VALUE=FF28871E>5%</COLOR>的生命。 | L8: 2|技能类型|触发几率=受到对应类型的伤害技能伤害时触发（作用阵营为2的）
A9: 50001 | B9: 2 | C9: 14 | D9: 1000 | E9: 5|3000 | F9: 3|0|0 | G9: =R[-1]C -> 10000|50001001 | H9: 精灵祝福技能触发几率提升至<COLOR VALUE=FF28871E>30%</COLOR>。 | I9: 生命源泉 | J9: 被精灵祝福的英雄回复生命时，<COLOR VALUE=FF28871E>30%</COLOR>几率额外回复精灵生命*<COLOR VALUE=FF28871E>5%</COLOR>的生命。 | L9: 3|技能类型|触发几率=使用辅助技能时触发（作用阵营为1的）
A10: 50002 | B10: 0 | E10: 2|1|1000#2|3|1000 | F10: 2|0|0#3|0|0 | G10: 10000|50002001#10000|50002002 | H10: 解锁精灵祝福技能。 | I10: 噩梦缠身 | J10: 被精灵祝福的英雄受到普攻或特技的伤害时，<COLOR VALUE=FF28871E>10%</COLOR>几率对最近的敌人造成精灵生命*<COLOR VALUE=FF28871E>5%</COLOR>的伤害，并为英雄回复精灵生命*<COLOR VALUE=FF28871E>5%</COLOR>的生命。 | L10: 4|buff类型|触发几率=受到对应类型的buff命中时触发
A11: 50002 | B11: 1 | C11: 20 | D11: 1200 | E11: 2|1|1000#2|3|1000 | F11: 2|0|0#3|0|0 | G11: =R[-1]C -> 10000|50002001#10000|50002002 | H11: 提升被祝福的英雄<COLOR VALUE=FF28871E>12%</COLOR>抗击退强度。 | I11: 噩梦缠身 | J11: 被精灵祝福的英雄受到普攻或特技的伤害时，<COLOR VALUE=FF28871E>10%</COLOR>几率对最近的敌人造成精灵生命*<COLOR VALUE=FF28871E>5%</COLOR>的伤害，并为英雄回复精灵生命*<COLOR VALUE=FF28871E>5%</COLOR>的生命。 | L11: 5|触发几率=生命回复时触发（包括技能回血、buff回血、吸血等）
A12: 50002 | B12: 2 | C12: 20 | D12: 1200 | E12: 2|1|1500#2|3|1500 | F12: 2|0|0#3|0|0 | G12: =R[-1]C -> 10000|50002001#10000|50002002 | H12: 精灵祝福技能触发几率提升至<COLOR VALUE=FF28871E>15%</COLOR>。 | I12: 噩梦缠身 | J12: 被精灵祝福的英雄受到普攻或特技的伤害时，<COLOR VALUE=FF28871E>15%</COLOR>几率对最近的敌人造成精灵生命*<COLOR VALUE=FF28871E>5%</COLOR>的伤害，并为英雄回复精灵生命*<COLOR VALUE=FF28871E>5%</COLOR>的生命。
A13: 50002 | B13: 3 | C13: 20|19 | D13: 1200|1200 | E13: 2|1|1500#2|3|1500 | F13: 2|0|0#3|0|0 | G13: =R[-1]C -> 10000|50002001#10000|50002002 | H13: 提升被祝福的英雄<COLOR VALUE=FF28871E>12%</COLOR>击退强度。 | I13: 噩梦缠身 | J13: 被精灵祝福的英雄受到普攻或特技的伤害时，<COLOR VALUE=FF28871E>15%</COLOR>几率对最近的敌人造成精灵生命*<COLOR VALUE=FF28871E>5%</COLOR>的伤害，并为英雄回复精灵生命*<COLOR VALUE=FF28871E>5%</COLOR>的生命。
A14: 50011 | B14: 0 | E14: 1|3|5000 | F14: 1 | G14: 10000|50011001 | H14: 解锁精灵祝福技能。 | I14: 炼狱龙血 | J14: 被精灵祝福的英雄使用特技造成伤害时，<COLOR VALUE=FF28871E>50%</COLOR>几率附带灼烧效果，<COLOR VALUE=FF28871E>3</COLOR>秒内对敌人造成精灵攻击*<COLOR VALUE=FF28871E>50%</COLOR>的伤害。
A15: 50011 | B15: 1 | C15: 13 | D15: 1200 | E15: 1|3|5000 | F15: 1 | G15: =R[-1]C -> 10000|50011001 | H15: 提升被祝福的英雄<COLOR VALUE=FF28871E>12%</COLOR>暴击率。 | I15: 炼狱龙血 | J15: 被精灵祝福的英雄使用特技造成伤害时，<COLOR VALUE=FF28871E>50%</COLOR>几率附带灼烧效果，<COLOR VALUE=FF28871E>3</COLOR>秒内对敌人造成精灵攻击*<COLOR VALUE=FF28871E>50%</COLOR>的伤害。
A16: 50011 | B16: 2 | C16: 13 | D16: 1200 | E16: 1|3|7500 | F16: 1 | G16: =R[-1]C -> 10000|50011001 | H16: 精灵祝福技能触发几率提升至<COLOR VALUE=FF28871E>75%</COLOR>。 | I16: 炼狱龙血 | J16: 被精灵祝福的英雄使用特技造成伤害时，<COLOR VALUE=FF28871E>75%</COLOR>几率附带灼烧效果，<COLOR VALUE=FF28871E>3</COLOR>秒内对敌人造成精灵攻击*<COLOR VALUE=FF28871E>50%</COLOR>的伤害。
A17: 50011 | B17: 3 | C17: 13|15 | D17: 1200|1200 | E17: 1|3|7500 | F17: 1 | G17: =R[-1]C -> 10000|50011001 | H17: 提升被祝福的英雄<COLOR VALUE=FF28871E>12%</COLOR>暴击伤害。 | I17: 炼狱龙血 | J17: 被精灵祝福的英雄使用特技造成伤害时，<COLOR VALUE=FF28871E>75%</COLOR>几率附带灼烧效果，<COLOR VALUE=FF28871E>3</COLOR>秒内对敌人造成精灵攻击*<COLOR VALUE=FF28871E>50%</COLOR>的伤害。
A18: 50012 | B18: 0 | E18: 4|2|5000#4|3|5000#4|4|5000#4|9|5000 | F18: 3|0|0#3|0|0 | G18: 10000|50012001#10000|50012002 | H18: 解锁精灵祝福技能。 | I18: 凛冽冰泉 | J18: 被精灵祝福的英雄被眩晕、石化、冰冻、沉默时，<COLOR VALUE=FF28871E>50%</COLOR>几率净化该英雄身上的所有负面效果并回复精灵法防*<COLOR VALUE=FF28871E>100%</COLOR>的生命。
A19: 50012 | B19: 1 | C19: 12 | D19: 1200 | E19: 4|2|5000#4|3|5000#4|4|5000#4|9|5000 | F19: 3|0|0#3|0|0 | G19: =R[-1]C -> 10000|50012001#10000|50012002 | H19: 提升被祝福的英雄<COLOR VALUE=FF28871E>12%</COLOR>闪避率。 | I19: 凛冽冰泉 | J19: 被精灵祝福的英雄被眩晕、石化、冰冻、沉默时，<COLOR VALUE=FF28871E>50%</COLOR>几率净化该英雄身上的所有负面效果并回复精灵法防*<COLOR VALUE=FF28871E>100%</COLOR>的生命。
A20: 50012 | B20: 2 | C20: 12 | D20: 1200 | E20: 4|2|7500#4|3|7500#4|4|7500#4|9|7500 | F20: 3|0|0#3|0|0 | G20: =R[-1]C -> 10000|50012001#10000|50012002 | H20: 精灵祝福技能触发几率提升至<COLOR VALUE=FF28871E>75%</COLOR>。 | I20: 凛冽冰泉 | J20: 被精灵祝福的英雄被眩晕、石化、冰冻、沉默时，<COLOR VALUE=FF28871E>75%</COLOR>几率净化该英雄身上的所有负面效果并回复精灵法防*<COLOR VALUE=FF28871E>100%</COLOR>的生命。
A21: 50012 | B21: 3 | C21: 12|11 | D21: 1200|1200 | E21: 4|2|7500#4|3|7500#4|4|7500#4|9|7500 | F21: 3|0|0#3|0|0 | G21: =R[-1]C -> 10000|50012001#10000|50012002 | H21: 提升被祝福的英雄<COLOR VALUE=FF28871E>12%</COLOR>命中率。 | I21: 凛冽冰泉 | J21: 被精灵祝福的英雄被眩晕、石化、冰冻、沉默时，<COLOR VALUE=FF28871E>75%</COLOR>几率净化该英雄身上的所有负面效果并回复精灵法防*<COLOR VALUE=FF28871E>100%</COLOR>的生命。
A22: 50021 | B22: 0 | E22: 3|3|2000#3|4|2000 | F22: 4 | G22: 10000|50021001#10000|50021002 | H22: 解锁精灵祝福技能。 | I22: 风之气息 | J22: 被精灵祝福的英雄使用辅助类技能时，<COLOR VALUE=FF28871E>20%</COLOR>几率回复全体队友精灵攻击*<COLOR VALUE=FF28871E>20%</COLOR>+精灵生命*<COLOR VALUE=FF28871E>2%</COLOR>的生命。
A23: 50021 | B23: 1 | C23: 12 | D23: 1200 | E23: 3|3|2000#3|4|2000 | F23: 4 | G23: =R[-1]C -> 10000|50021001#10000|50021002 | H23: 提升被祝福的英雄<COLOR VALUE=FF28871E>12%</COLOR>闪避率。 | I23: 风之气息 | J23: 被精灵祝福的英雄使用辅助类技能时，<COLOR VALUE=FF28871E>20%</COLOR>几率回复全体队友精灵攻击*<COLOR VALUE=FF28871E>20%</COLOR>+精灵生命*<COLOR VALUE=FF28871E>2%</COLOR>的生命。
A24: 50021 | B24: 2 | C24: 12 | D24: 1200 | E24: 3|3|3000#3|4|3000 | F24: 4 | G24: =R[-1]C -> 10000|50021001#10000|50021002 | H24: 精灵祝福技能触发几率提升至<COLOR VALUE=FF28871E>30%</COLOR>。 | I24: 风之气息 | J24: 被精灵祝福的英雄使用辅助类技能时，<COLOR VALUE=FF28871E>30%</COLOR>几率回复全体队友精灵攻击*<COLOR VALUE=FF28871E>20%</COLOR>+精灵生命*<COLOR VALUE=FF28871E>2%</COLOR>的生命。
A25: 50021 | B25: 3 | C25: 12|13 | D25: 1200|1200 | E25: 3|3|3000#3|4|3000 | F25: 4 | G25: =R[-1]C -> 10000|50021001#10000|50021002 | H25: 提升被祝福的英雄<COLOR VALUE=FF28871E>12%</COLOR>暴击率。 | I25: 风之气息 | J25: 被精灵祝福的英雄使用辅助类技能时，<COLOR VALUE=FF28871E>30%</COLOR>几率回复全体队友精灵攻击*<COLOR VALUE=FF28871E>20%</COLOR>+精灵生命*<COLOR VALUE=FF28871E>2%</COLOR>的生命。
A26: 50022 | B26: 0 | E26: 2|1|2000#2|3|2000 | F26: 2|0|0 | G26: 10000|50022001 | H26: 解锁精灵祝福技能。 | I26: 山岩崩碎 | J26: 被精灵祝福的英雄受到普攻或特技的伤害时，<COLOR VALUE=FF28871E>20%</COLOR>几率对最近的敌人造成精灵物防*<COLOR VALUE=FF28871E>25%</COLOR>的伤害。
A27: 50022 | B27: 1 | C27: 14 | D27: 1200 | E27: 2|1|2000#2|3|2000 | F27: 2|0|0 | G27: =R[-1]C -> 10000|50022001 | H27: 提升被祝福的英雄<COLOR VALUE=FF28871E>12%</COLOR>抗暴率。 | I27: 山岩崩碎 | J27: 被精灵祝福的英雄受到普攻或特技的伤害时，<COLOR VALUE=FF28871E>20%</COLOR>几率对最近的敌人造成精灵物防*<COLOR VALUE=FF28871E>25%</COLOR>的伤害。
A28: 50022 | B28: 2 | C28: 14 | D28: 1200 | E28: 2|1|3000#2|3|3000 | F28: 2|0|0 | G28: =R[-1]C -> 10000|50022001 | H28: 精灵祝福技能触发几率提升至<COLOR VALUE=FF28871E>30%</COLOR>。 | I28: 山岩崩碎 | J28: 被精灵祝福的英雄受到普攻或特技的伤害时，<COLOR VALUE=FF28871E>30%</COLOR>几率对最近的敌人造成精灵物防*<COLOR VALUE=FF28871E>25%</COLOR>的伤害。
A29: 50022 | B29: 3 | C29: 14|5 | D29: 1200|1200 | E29: 2|1|3000#2|3|3000 | F29: 2|0|0 | G29: =R[-1]C -> 10000|50022001 | H29: 提升被祝福的英雄<COLOR VALUE=FF28871E>12%</COLOR>伤害减免。 | I29: 山岩崩碎 | J29: 被精灵祝福的英雄受到普攻或特技的伤害时，<COLOR VALUE=FF28871E>30%</COLOR>几率对最近的敌人造成精灵物防*<COLOR VALUE=FF28871E>25%</COLOR>的伤害。
A30: 50031 | B30: 0 | E30: 3|3|2000#3|4|2000 | F30: 2|2|0 | G30: 10000|50031001 | H30: 解锁精灵祝福技能。 | I30: 瑰艳猛毒 | J30: 被精灵祝福的英雄使用辅助类技能时，<COLOR VALUE=FF28871E>50%</COLOR>几率使血量最少的敌人中毒，<COLOR VALUE=FF28871E>3</COLOR>秒内造成精灵攻击*<COLOR VALUE=FF28871E>50%</COLOR>+精灵生命*<COLOR VALUE=FF28871E>5%</COLOR>的伤害。
A31: 50031 | B31: 1 | C31: 14 | D31: 1200 | E31: 3|3|2000#3|4|2000 | F31: 2|2|0 | G31: 10000|50031001 | H31: 提升被祝福的英雄<COLOR VALUE=FF28871E>12%</COLOR>抗暴率。 | I31: 瑰艳猛毒 | J31: 被精灵祝福的英雄使用辅助类技能时，<COLOR VALUE=FF28871E>50%</COLOR>几率使血量最少的敌人中毒，<COLOR VALUE=FF28871E>3</COLOR>秒内造成精灵攻击*<COLOR VALUE=FF28871E>50%</COLOR>+精灵生命*<COLOR VALUE=FF28871E>5%</COLOR>的伤害。
A32: 50031 | B32: 2 | C32: 14 | D32: 1200 | E32: 3|3|3000#3|4|3000 | F32: 2|2|0 | G32: 10000|50031001 | H32: 精灵祝福技能触发几率提升至<COLOR VALUE=FF28871E>75%</COLOR>。 | I32: 瑰艳猛毒 | J32: 被精灵祝福的英雄使用辅助类技能时，<COLOR VALUE=FF28871E>75%</COLOR>几率使血量最少的敌人中毒，<COLOR VALUE=FF28871E>3</COLOR>秒内造成精灵攻击*<COLOR VALUE=FF28871E>50%</COLOR>+精灵生命*<COLOR VALUE=FF28871E>5%</COLOR>的伤害。
A33: 50031 | B33: 3 | C33: 14|5 | D33: 1200|1200 | E33: 3|3|3000#3|4|3000 | F33: 2|2|0 | G33: 10000|50031001 | H33: 提升被祝福的英雄<COLOR VALUE=FF28871E>12%</COLOR>伤害。 | I33: 瑰艳猛毒 | J33: 被精灵祝福的英雄使用辅助类技能时，<COLOR VALUE=FF28871E>75%</COLOR>几率使血量最少的敌人中毒，<COLOR VALUE=FF28871E>3</COLOR>秒内造成精灵攻击*<COLOR VALUE=FF28871E>50%</COLOR>+精灵生命*<COLOR VALUE=FF28871E>5%</COLOR>的伤害。
A34: 50032 | B34: 0 | H34: 1 | I34: 老树盘根 | J34: 1
A35: 50032 | B35: 1 | H35: 1 | I35: 老树盘根 | J35: 1
A36: 50032 | B36: 2 | H36: 1 | I36: 老树盘根 | J36: 1
A37: 50032 | B37: 3 | H37: 1 | I37: 老树盘根 | J37: 1

Sheet: 精灵资质
A1: qualifications|qualifications | B1: add_rate|add_rate
A2: 不可空 | B2: 不可空
A3: 数字 | B3: 数字
A6: 精灵资质 | B6: 加成系数
A7: 0 | B7: 0
A8: 1 | B8: 0
A9: 2 | B9: 0
A10: 3 | B10: 0
A11: 4 | B11: 0
A12: 5 | B12: 0
A13: 6 | B13: 0
A14: 7 | B14: 0
A15: 8 | B15: 0
A16: 9 | B16: 0
A17: 10 | B17: 0
A18: 11 | B18: 500
A19: 12 | B19: 1000
A20: 13 | B20: 1500
A21: 14 | B21: 2000
A22: 15 | B22: 2500
A23: 16 | B23: 3000
A24: 17 | B24: 3500
A25: 18 | B25: 4000
A26: 19 | B26: 4500
A27: 20 | B27: 5000
A28: 21 | B28: 5500
A29: 22 | B29: 6000
A30: 23 | B30: 6500
A31: 24 | B31: 7000
A32: 25 | B32: 7500
A33: 26 | B33: 8000
A34: 27 | B34: 8500
A35: 28 | B35: 9000
A36: 29 | B36: 9500
A37: 30 | B37: 10000
A38: 31 | B38: 10500
A39: 32 | B39: 11000
A40: 33 | B40: 11500
A41: 34 | B41: 12000
A42: 35 | B42: 12500
A43: 36 | B43: 13000
A44: 37 | B44: 13500
A45: 38 | B45: 14000
A46: 39 | B46: 14500
A47: 40 | B47: 15000

Sheet: Sheet1
A2: 属性类型 | B2: 4 | C2: 1 | D2: 2 | E2: 3
A3: 精灵等级 | B3: 血量 | C3: 攻击 | D3: 物防 | E3: 魔防 | F3: 其它 | G3: 基础属性 | I3: 阶段 | J3: 奖励 | K3: 属性配置 | L3: 道具配置 | N3: 精灵等级 | O3: 阶段名
A4: 0 | B4: 0 | C4: 0 | D4: 0 | E4: 0 | G4: 0 | I4: 0 | N4: 0
A5: 1 | B5: 250 | C5: 25 | D5: 25 | E5: 25 | F5: 25 | G5: 0 | I5: 1 | J5: 全体出战英雄攻击+25 | K5: 1 | N5: 1 | O5: 无尽虚空
A6: 2 | B6: 292 | C6: 29 | D6: 29 | E6: 29 | G6: 0 | I6: 2 | J6: 钻石*100 | L6: 19005|100 | N6: 2 | O6: 希望光辉
A7: 3 | B7: 333 | C7: 33 | D7: 33 | E7: 33 | F7: 5 | G7: 100 | I7: 3 | J7: 全体出战英雄怒气+5 | K7: 21 | N7: 3 | O7: 璀璨文明
A8: 4 | B8: 375 | C8: 38 | D8: 38 | E8: 38 | G8: 100 | I8: 4 | J8: 钻石*150 | L8: 19005|150 | N8: 4 | O8: 原生黑洞
A9: 5 | B9: 417 | C9: 42 | D9: 42 | E9: 42 | G9: 100 | I9: 5 | J9: 钻石*200 | L9: 19005|200 | N9: 5 | O9: 万有引力
A10: 6 | B10: 459 | C10: 46 | D10: 46 | E10: 46 | F10: 5 | G10: 200 | I10: 6 | J10: 全体出战英雄怒气+5 | K10: 21 | N10: 6 | O10: 绚烂星云
A11: 7 | B11: 500 | C11: 50 | D11: 50 | E11: 50 | G11: 200 | I11: 7 | J11: 灵性精粹*5 | L11: 10022|5 | N11: 7 | O11: 灼热恒星
A12: 8 | B12: 542 | C12: 54 | D12: 54 | E12: 54 | G12: 200 | I12: 8 | J12: 灵性精粹*5 | L12: 10022|5 | N12: 8 | O12: 陨落流星
A13: 9 | B13: 584 | C13: 58 | D13: 58 | E13: 58 | F13: 5 | G13: 200 | I13: 9 | J13: 全体出战英雄怒气+5 | K13: 21 | N13: 9 | O13: 射线洪流
A14: 10 | B14: 625 | C14: 63 | D14: 63 | E14: 63 | G14: 200 | I14: 10 | J14: 灵性精粹*10 | L14: 10022|10 | N14: 10 | O14: 起源元素
A15: 11 | B15: 667 | C15: 67 | D15: 67 | E15: 67 | G15: 300 | I15: 11 | J15: 灵性精粹*10 | L15: 10022|10 | N15: 11 | O15: 星辰长河
A16: 12 | B16: 709 | C16: 71 | D16: 71 | E16: 71 | G16: 300 | I16: 12 | J16: 灵性精粹*10 | L16: 10022|10 | N16: 12 | O16: 星空巨兽
A17: 13 | B17: 750 | C17: 75 | D17: 75 | E17: 75 | F17: 5 | G17: 300 | I17: 13 | J17: 全体出战英雄怒气+5 | K17: 21 | N17: 13 | O17: 黑暗星域
A18: 14 | B18: 792 | C18: 79 | D18: 79 | E18: 79 | G18: 300 | I18: 14 | J18: 灵性精粹*10 | L18: 10022|10 | N18: 14 | O18: 终极混沌
A19: 15 | B19: 834 | C19: 83 | D19: 83 | E19: 83 | G19: 300 | I19: 15 | J19: 灵性精粹*10 | L19: 10022|10 | N19: 15 | O19: 智慧曙光
A20: 16 | B20: 875 | C20: 88 | D20: 88 | E20: 88 | G20: 400 | I20: 16 | J20: 灵性精粹*10 | L20: 10022|10 | N20: 16 | O20: 永恒生命
A21: 17 | B21: 917 | C21: 92 | D21: 92 | E21: 92 | G21: 400 | I21: 17 | J21: 灵性精粹*10 | L21: 10022|10 | N21: 17 | O21: 湮灭之地
A22: 18 | B22: 959 | C22: 96 | D22: 96 | E22: 96 | G22: 400 | I22: 18 | J22: 灵性精粹*10 | L22: 10022|10 | N22: 18 | O22: 亡者低语
A23: 19 | B23: 1000 | C23: 100 | D23: 100 | E23: 100 | G23: 400 | I23: 19 | J23: 灵性精粹*10 | L23: 10022|10 | N23: 19 | O23: 末日彼岸
A25: 精灵等级 | B25: 点消耗1 | C25: 点消耗2 | D25: 点消耗3 | E25: 点消耗4 | F25: 点消耗5 | G25: 点消耗6
A26: 1 | B26: 0 | C26: 0 | D26: 0 | E26: 0 | F26: 1 | G26: 0
A27: 2 | B27: 0 | C27: 1 | D27: 0 | E27: 0 | F27: 1 | G27: 0
A28: 3 | B28: 1 | C28: 1 | D28: 0 | E28: 0 | F28: 1 | G28: 0
A29: 4 | B29: 0 | C29: 1 | D29: 1 | E29: 1 | F29: 1 | G29: 0
A30: 5 | B30: 1 | C30: 1 | D30: 1 | E30: 1 | F30: 2 | G30: 0
A31: 6 | B31: 1 | C31: 1 | D31: 1 | E31: 1 | F31: 2 | G31: 0
A32: 7 | B32: 2 | C32: 2 | D32: 2 | E32: 2 | F32: 3 | G32: 0
A33: 8 | B33: 2 | C33: 2 | D33: 2 | E33: 2 | F33: 3 | G33: 0
A34: 9 | B34: 2 | C34: 2 | D34: 2 | E34: 2 | F34: 3 | G34: 0
A35: 10 | B35: 3 | C35: 3 | D35: 3 | E35: 3 | F35: 4 | G35: 0
A36: 11 | B36: 3 | C36: 3 | D36: 3 | E36: 3 | F36: 4 | G36: 0
A37: 12 | B37: 3 | C37: 3 | D37: 3 | E37: 3 | F37: 4 | G37: 0
A38: 13 | B38: 4 | C38: 4 | D38: 4 | E38: 4 | F38: 5 | G38: 0
A39: 14 | B39: 4 | C39: 4 | D39: 4 | E39: 4 | F39: 5 | G39: 0
A40: 15 | B40: 4 | C40: 4 | D40: 4 | E40: 4 | F40: 5 | G40: 0
A41: 16 | B41: 5 | C41: 5 | D41: 5 | E41: 5 | F41: 6 | G41: 0
A42: 17 | B42: 5 | C42: 5 | D42: 5 | E42: 5 | F42: 6 | G42: 0
A43: 18 | B43: 5 | C43: 5 | D43: 5 | E43: 5 | F43: 6 | G43: 0
A44: 19 | B44: 6 | C44: 6 | D44: 6 | E44: 6 | F44: 7 | G44: 0

Sheet: Sheet2
A2: 阶段 | B2: 等级 | C2: 阶段名称 | D2: 增加的属性类型(属性类型|属性类型) | E2: 增加的属性值(属性值|属性值) | F2: 奖励的物品(Id|数量) | G2: 升级消耗物品(物品ID|物品数量) | H2: 奖励的描述 | I2: 特效名称
A3: 1 | B3: 1 | C3: =VLOOKUP(RC[-2],Sheet1!R3C14:R23C15,2,FALSE) -> 无尽虚空 | D3: =IF(RC10=5,VLOOKUP(RC[-3],Sheet1!R3C9:R23C12,3,FALSE),IF(RC10=6,"22|23|24|25",VLOOKUP(Sheet1!R2C1,Sheet1!R2C1:R2C7,RC[6]+1,FALSE))) -> 1 | E3: =IF(RC10=6,VLOOKUP(RC1,Sheet1!R3C1:R23C7,RC10+1,FALSE)&"|"&VLOOKUP(RC1,Sheet1!R3C1:R23C7,RC10+1,FALSE)&"|"&VLOOKUP(RC1,Sheet1!R3C1:R23C7,RC10+1,FALSE)&"|"&VLOOKUP(RC1,Sheet1!R3C1:R23C7,RC10+1,FALSE),VLOOKUP(RC1,Sheet1!R3C1:R23C7,RC10+1,FALSE)) -> 25 | F3: =IF(RC[-2]=0,VLOOKUP(RC[-5],Sheet1!R3C9:R23C12,4,FALSE),0) -> 0 | G3: ="10020|"&VLOOKUP(RC[-6],Sheet1!R25C1:R44C7,RC[3]+1,FALSE) -> 10020|1 | H3: =IF(RC10=5,VLOOKUP(RC[-7],Sheet1!R3C9:R23C12,2,FALSE),IF(RC10=6,"出战英雄基础属性+"&VLOOKUP(RC1,Sheet1!R3C1:R23C7,RC10+1,FALSE)/100&"%","全体出战英雄"&VLOOKUP(Sheet1!R3C1,Sheet1!R2C1:R3C7,RC[2]+1,FALSE)&"+"&VLOOKUP(RC1,Sheet1!R3C1:R23C7,RC10+1,FALSE))) -> 全体出战英雄攻击+25 | I3: buff_jingling | J3: 5
A4: 1 | B4: =IF(RC[-1]=R[-1]C[-1],R[-1]C+1,1) -> 2 | C4: =VLOOKUP(RC[-2],Sheet1!R3C14:R23C15,2,FALSE) -> 无尽虚空 | D4: =IF(RC10=5,VLOOKUP(RC[-3],Sheet1!R3C9:R23C12,3,FALSE),IF(RC10=6,"22|23|24|25",VLOOKUP(Sheet1!R2C1,Sheet1!R2C1:R2C7,RC[6]+1,FALSE))) -> 4 | E4: =IF(RC10=6,VLOOKUP(RC1,Sheet1!R3C1:R23C7,RC10+1,FALSE)&"|"&VLOOKUP(RC1,Sheet1!R3C1:R23C7,RC10+1,FALSE)&"|"&VLOOKUP(RC1,Sheet1!R3C1:R23C7,RC10+1,FALSE)&"|"&VLOOKUP(RC1,Sheet1!R3C1:R23C7,RC10+1,FALSE),VLOOKUP(RC1,Sheet1!R3C1:R23C7,RC10+1,FALSE)) -> 250 | F4: =IF(RC[-2]=0,VLOOKUP(RC[-5],Sheet1!R3C9:R23C12,4,FALSE),0) -> 0 | G4: ="10020|"&VLOOKUP(RC[-6],Sheet1!R25C1:R44C7,RC[3]+1,FALSE) -> 10020|0 | H4: =IF(RC10=5,VLOOKUP(RC[-7],Sheet1!R3C9:R23C12,2,FALSE),IF(RC10=6,"出战英雄基础属性+"&VLOOKUP(RC1,Sheet1!R3C1:R23C7,RC10+1,FALSE)/100&"%","全体出战英雄"&VLOOKUP(Sheet1!R3C1,Sheet1!R2C1:R3C7,RC[2]+1,FALSE)&"+"&VLOOKUP(RC1,Sheet1!R3C1:R23C7,RC10+1,FALSE))) -> 全体出战英雄血量+250 | I4: buff_jingling | J4: 1
A5: 2 | B5: =IF(RC[-1]=R[-1]C[-1],R[-1]C+1,1) -> 1 | C5: =VLOOKUP(RC[-2],Sheet1!R3C14:R23C15,2,FALSE) -> 希望光辉 | D5: =IF(RC10=5,VLOOKUP(RC[-3],Sheet1!R3C9:R23C12,3,FALSE),IF(RC10=6,"22|23|24|25",VLOOKUP(Sheet1!R2C1,Sheet1!R2C1:R2C7,RC[6]+1,FALSE))) -> 1 | E5: =IF(RC10=6,VLOOKUP(RC1,Sheet1!R3C1:R23C7,RC10+1,FALSE)&"|"&VLOOKUP(RC1,Sheet1!R3C1:R23C7,RC10+1,FALSE)&"|"&VLOOKUP(RC1,Sheet1!R3C1:R23C7,RC10+1,FALSE)&"|"&VLOOKUP(RC1,Sheet1!R3C1:R23C7,RC10+1,FALSE),VLOOKUP(RC1,Sheet1!R3C1:R23C7,RC10+1,FALSE)) -> 29 | F5: =IF(RC[-2]=0,VLOOKUP(RC[-5],Sheet1!R3C9:R23C12,4,FALSE),0) -> 0 | G5: ="10020|"&VLOOKUP(RC[-6],Sheet1!R25C1:R44C7,RC[3]+1,FALSE) -> 10020|1 | H5: =IF(RC10=5,VLOOKUP(RC[-7],Sheet1!R3C9:R23C12,2,FALSE),IF(RC10=6,"出战英雄基础属性+"&VLOOKUP(RC1,Sheet1!R3C1:R23C7,RC10+1,FALSE)/100&"%","全体出战英雄"&VLOOKUP(Sheet1!R3C1,Sheet1!R2C1:R3C7,RC[2]+1,FALSE)&"+"&VLOOKUP(RC1,Sheet1!R3C1:R23C7,RC10+1,FALSE))) -> 全体出战英雄攻击+29 | I5: buff_jingling | J5: 2
A6: 2 | B6: =IF(RC[-1]=R[-1]C[-1],R[-1]C+1,1) -> 2 | C6: =VLOOKUP(RC[-2],Sheet1!R3C14:R23C15,2,FALSE) -> 希望光辉 | D6: =IF(RC10=5,VLOOKUP(RC[-3],Sheet1!R3C9:R23C12,3,FALSE),IF(RC10=6,"22|23|24|25",VLOOKUP(Sheet1!R2C1,Sheet1!R2C1:R2C7,RC[6]+1,FALSE))) -> 0 | E6: =IF(RC10=6,VLOOKUP(RC1,Sheet1!R3C1:R23C7,RC10+1,FALSE)&"|"&VLOOKUP(RC1,Sheet1!R3C1:R23C7,RC10+1,FALSE)&"|"&VLOOKUP(RC1,Sheet1!R3C1:R23C7,RC10+1,FALSE)&"|"&VLOOKUP(RC1,Sheet1!R3C1:R23C7,RC10+1,FALSE),VLOOKUP(RC1,Sheet1!R3C1:R23C7,RC10+1,FALSE)) -> 0 | F6: =IF(RC[-2]=0,VLOOKUP(RC[-5],Sheet1!R3C9:R23C12,4,FALSE),0) -> 19005|100 | G6: ="10020|"&VLOOKUP(RC[-6],Sheet1!R25C1:R44C7,RC[3]+1,FALSE) -> 10020|1 | H6: =IF(RC10=5,VLOOKUP(RC[-7],Sheet1!R3C9:R23C12,2,FALSE),IF(RC10=6,"出战英雄基础属性+"&VLOOKUP(RC1,Sheet1!R3C1:R23C7,RC10+1,FALSE)/100&"%","全体出战英雄"&VLOOKUP(Sheet1!R3C1,Sheet1!R2C1:R3C7,RC[2]+1,FALSE)&"+"&VLOOKUP(RC1,Sheet1!R3C1:R23C7,RC10+1,FALSE))) -> 钻石*100 | I6: buff_jingling | J6: 5
A7: 2 | B7: =IF(RC[-1]=R[-1]C[-1],R[-1]C+1,1) -> 3 | C7: =VLOOKUP(RC[-2],Sheet1!R3C14:R23C15,2,FALSE) -> 希望光辉 | D7: =IF(RC10=5,VLOOKUP(RC[-3],Sheet1!R3C9:R23C12,3,FALSE),IF(RC10=6,"22|23|24|25",VLOOKUP(Sheet1!R2C1,Sheet1!R2C1:R2C7,RC[6]+1,FALSE))) -> 4 | E7: =IF(RC10=6,VLOOKUP(RC1,Sheet1!R3C1:R23C7,RC10+1,FALSE)&"|"&VLOOKUP(RC1,Sheet1!R3C1:R23C7,RC10+1,FALSE)&"|"&VLOOKUP(RC1,Sheet1!R3C1:R23C7,RC10+1,FALSE)&"|"&VLOOKUP(RC1,Sheet1!R3C1:R23C7,RC10+1,FALSE),VLOOKUP(RC1,Sheet1!R3C1:R23C7,RC10+1,FALSE)) -> 292 | F7: =IF(RC[-2]=0,VLOOKUP(RC[-5],Sheet1!R3C9:R23C12,4,FALSE),0) -> 0 | G7: ="10020|"&VLOOKUP(RC[-6],Sheet1!R25C1:R44C7,RC[3]+1,FALSE) -> 10020|0 | H7: =IF(RC10=5,VLOOKUP(RC[-7],Sheet1!R3C9:R23C12,2,FALSE),IF(RC10=6,"出战英雄基础属性+"&VLOOKUP(RC1,Sheet1!R3C1:R23C7,RC10+1,FALSE)/100&"%","全体出战英雄"&VLOOKUP(Sheet1!R3C1,Sheet1!R2C1:R3C7,RC[2]+1,FALSE)&"+"&VLOOKUP(RC1,Sheet1!R3C1:R23C7,RC10+1,FALSE))) -> 全体出战英雄血量+292 | I7: buff_jingling | J7: 1
A8: 3 | B8: =IF(RC[-1]=R[-1]C[-1],R[-1]C+1,1) -> 1 | C8: =VLOOKUP(RC[-2],Sheet1!R3C14:R23C15,2,FALSE) -> 璀璨文明 | D8: =IF(RC10=5,VLOOKUP(RC[-3],Sheet1!R3C9:R23C12,3,FALSE),IF(RC10=6,"22|23|24|25",VLOOKUP(Sheet1!R2C1,Sheet1!R2C1:R2C7,RC[6]+1,FALSE))) -> 1 | E8: =IF(RC10=6,VLOOKUP(RC1,Sheet1!R3C1:R23C7,RC10+1,FALSE)&"|"&VLOOKUP(RC1,Sheet1!R3C1:R23C7,RC10+1,FALSE)&"|"&VLOOKUP(RC1,Sheet1!R3C1:R23C7,RC10+1,FALSE)&"|"&VLOOKUP(RC1,Sheet1!R3C1:R23C7,RC10+1,FALSE),VLOOKUP(RC1,Sheet1!R3C1:R23C7,RC10+1,FALSE)) -> 33 | F8: =IF(RC[-2]=0,VLOOKUP(RC[-5],Sheet1!R3C9:R23C12,4,FALSE),0) -> 0 | G8: ="10020|"&VLOOKUP(RC[-6],Sheet1!R25C1:R44C7,RC[3]+1,FALSE) -> 10020|1 | H8: =IF(RC10=5,VLOOKUP(RC[-7],Sheet1!R3C9:R23C12,2,FALSE),IF(RC10=6,"出战英雄基础属性+"&VLOOKUP(RC1,Sheet1!R3C1:R23C7,RC10+1,FALSE)/100&"%","全体出战英雄"&VLOOKUP(Sheet1!R3C1,Sheet1!R2C1:R3C7,RC[2]+1,FALSE)&"+"&VLOOKUP(RC1,Sheet1!R3C1:R23C7,RC10+1,FALSE))) -> 全体出战英雄攻击+33 | I8: buff_jingling | J8: 2
A9: 3 | B9: =IF(RC[-1]=R[-1]C[-1],R[-1]C+1,1) -> 2 | C9: =VLOOKUP(RC[-2],Sheet1!R3C14:R23C15,2,FALSE) -> 璀璨文明 | D9: =IF(RC10=5,VLOOKUP(RC[-3],Sheet1!R3C9:R23C12,3,FALSE),IF(RC10=6,"22|23|24|25",VLOOKUP(Sheet1!R2C1,Sheet1!R2C1:R2C7,RC[6]+1,FALSE))) -> 4 | E9: =IF(RC10=6,VLOOKUP(RC1,Sheet1!R3C1:R23C7,RC10+1,FALSE)&"|"&VLOOKUP(RC1,Sheet1!R3C1:R23C7,RC10+1,FALSE)&"|"&VLOOKUP(RC1,Sheet1!R3C1:R23C7,RC10+1,FALSE)&"|"&VLOOKUP(RC1,Sheet1!R3C1:R23C7,RC10+1,FALSE),VLOOKUP(RC1,Sheet1!R3C1:R23C7,RC10+1,FALSE)) -> 333 | F9: =IF(RC[-2]=0,VLOOKUP(RC[-5],Sheet1!R3C9:R23C12,4,FALSE),0) -> 0 | G9: ="10020|"&VLOOKUP(RC[-6],Sheet1!R25C1:R44C7,RC[3]+1,FALSE) -> 10020|1 | H9: =IF(RC10=5,VLOOKUP(RC[-7],Sheet1!R3C9:R23C12,2,FALSE),IF(RC10=6,"出战英雄基础属性+"&VLOOKUP(RC1,Sheet1!R3C1:R23C7,RC10+1,FALSE)/100&"%","全体出战英雄"&VLOOKUP(Sheet1!R3C1,Sheet1!R2C1:R3C7,RC[2]+1,FALSE)&"+"&VLOOKUP(RC1,Sheet1!R3C1:R23C7,RC10+1,FALSE))) -> 全体出战英雄血量+333 | I9: buff_jingling | J9: 1
A10: 3 | B10: =IF(RC[-1]=R[-1]C[-1],R[-1]C+1,1) -> 3 | C10: =VLOOKUP(RC[-2],Sheet1!R3C14:R23C15,2,FALSE) -> 璀璨文明 | D10: =IF(RC10=5,VLOOKUP(RC[-3],Sheet1!R3C9:R23C12,3,FALSE),IF(RC10=6,"22|23|24|25",VLOOKUP(Sheet1!R2C1,Sheet1!R2C1:R2C7,RC[6]+1,FALSE))) -> 21 | E10: =IF(RC10=6,VLOOKUP(RC1,Sheet1!R3C1:R23C7,RC10+1,FALSE)&"|"&VLOOKUP(RC1,Sheet1!R3C1:R23C7,RC10+1,FALSE)&"|"&VLOOKUP(RC1,Sheet1!R3C1:R23C7,RC10+1,FALSE)&"|"&VLOOKUP(RC1,Sheet1!R3C1:R23C7,RC10+1,FALSE),VLOOKUP(RC1,Sheet1!R3C1:R23C7,RC10+1,FALSE)) -> 5 | F10: =IF(RC[-2]=0,VLOOKUP(RC[-5],Sheet1!R3C9:R23C12,4,FALSE),0) -> 0 | G10: ="10020|"&VLOOKUP(RC[-6],Sheet1!R25C1:R44C7,RC[3]+1,FALSE) -> 10020|1 | H10: =IF(RC10=5,VLOOKUP(RC[-7],Sheet1!R3C9:R23C12,2,FALSE),IF(RC10=6,"出战英雄基础属性+"&VLOOKUP(RC1,Sheet1!R3C1:R23C7,RC10+1,FALSE)/100&"%","全体出战英雄"&VLOOKUP(Sheet1!R3C1,Sheet1!R2C1:R3C7,RC[2]+1,FALSE)&"+"&VLOOKUP(RC1,Sheet1!R3C1:R23C7,RC10+1,FALSE))) -> 全体出战英雄怒气+5 | I10: buff_jingling | J10: 5
A11: 3 | B11: =IF(RC[-1]=R[-1]C[-1],R[-1]C+1,1) -> 4 | C11: =VLOOKUP(RC[-2],Sheet1!R3C14:R23C15,2,FALSE) -> 璀璨文明 | D11: =IF(RC10=5,VLOOKUP(RC[-3],Sheet1!R3C9:R23C12,3,FALSE),IF(RC10=6,"22|23|24|25",VLOOKUP(Sheet1!R2C1,Sheet1!R2C1:R2C7,RC[6]+1,FALSE))) -> 22|23|24|25 | E11: =IF(RC10=6,VLOOKUP(RC1,Sheet1!R3C1:R23C7,RC10+1,FALSE)&"|"&VLOOKUP(RC1,Sheet1!R3C1:R23C7,RC10+1,FALSE)&"|"&VLOOKUP(RC1,Sheet1!R3C1:R23C7,RC10+1,FALSE)&"|"&VLOOKUP(RC1,Sheet1!R3C1:R23C7,RC10+1,FALSE),VLOOKUP(RC1,Sheet1!R3C1:R23C7,RC10+1,FALSE)) -> 100|100|100|100 | F11: =IF(RC[-2]=0,VLOOKUP(RC[-5],Sheet1!R3C9:R23C12,4,FALSE),0) -> 0 | G11: ="10020|"&VLOOKUP(RC[-6],Sheet1!R25C1:R44C7,RC[3]+1,FALSE) -> 10020|0 | H11: =IF(RC10=5,VLOOKUP(RC[-7],Sheet1!R3C9:R23C12,2,FALSE),IF(RC10=6,"出战英雄基础属性+"&VLOOKUP(RC1,Sheet1!R3C1:R23C7,RC10+1,FALSE)/100&"%","全体出战英雄"&VLOOKUP(Sheet1!R3C1,Sheet1!R2C1:R3C7,RC[2]+1,FALSE)&"+"&VLOOKUP(RC1,Sheet1!R3C1:R23C7,RC10+1,FALSE))) -> 出战英雄基础属性+1% | I11: buff_jingling | J11: 6
A12: 4 | B12: =IF(RC[-1]=R[-1]C[-1],R[-1]C+1,1) -> 1 | C12: =VLOOKUP(RC[-2],Sheet1!R3C14:R23C15,2,FALSE) -> 原生黑洞 | D12: =IF(RC10=5,VLOOKUP(RC[-3],Sheet1!R3C9:R23C12,3,FALSE),IF(RC10=6,"22|23|24|25",VLOOKUP(Sheet1!R2C1,Sheet1!R2C1:R2C7,RC[6]+1,FALSE))) -> 1 | E12: =IF(RC10=6,VLOOKUP(RC1,Sheet1!R3C1:R23C7,RC10+1,FALSE)&"|"&VLOOKUP(RC1,Sheet1!R3C1:R23C7,RC10+1,FALSE)&"|"&VLOOKUP(RC1,Sheet1!R3C1:R23C7,RC10+1,FALSE)&"|"&VLOOKUP(RC1,Sheet1!R3C1:R23C7,RC10+1,FALSE),VLOOKUP(RC1,Sheet1!R3C1:R23C7,RC10+1,FALSE)) -> 38 | F12: =IF(RC[-2]=0,VLOOKUP(RC[-5],Sheet1!R3C9:R23C12,4,FALSE),0) -> 0 | G12: ="10020|"&VLOOKUP(RC[-6],Sheet1!R25C1:R44C7,RC[3]+1,FALSE) -> 10020|1 | H12: =IF(RC10=5,VLOOKUP(RC[-7],Sheet1!R3C9:R23C12,2,FALSE),IF(RC10=6,"出战英雄基础属性+"&VLOOKUP(RC1,Sheet1!R3C1:R23C7,RC10+1,FALSE)/100&"%","全体出战英雄"&VLOOKUP(Sheet1!R3C1,Sheet1!R2C1:R3C7,RC[2]+1,FALSE)&"+"&VLOOKUP(RC1,Sheet1!R3C1:R23C7,RC10+1,FALSE))) -> 全体出战英雄攻击+38 | I12: buff_jingling | J12: 2
A13: 4 | B13: =IF(RC[-1]=R[-1]C[-1],R[-1]C+1,1) -> 2 | C13: =VLOOKUP(RC[-2],Sheet1!R3C14:R23C15,2,FALSE) -> 原生黑洞 | D13: =IF(RC10=5,VLOOKUP(RC[-3],Sheet1!R3C9:R23C12,3,FALSE),IF(RC10=6,"22|23|24|25",VLOOKUP(Sheet1!R2C1,Sheet1!R2C1:R2C7,RC[6]+1,FALSE))) -> 2 | E13: =IF(RC10=6,VLOOKUP(RC1,Sheet1!R3C1:R23C7,RC10+1,FALSE)&"|"&VLOOKUP(RC1,Sheet1!R3C1:R23C7,RC10+1,FALSE)&"|"&VLOOKUP(RC1,Sheet1!R3C1:R23C7,RC10+1,FALSE)&"|"&VLOOKUP(RC1,Sheet1!R3C1:R23C7,RC10+1,FALSE),VLOOKUP(RC1,Sheet1!R3C1:R23C7,RC10+1,FALSE)) -> 38 | F13: =IF(RC[-2]=0,VLOOKUP(RC[-5],Sheet1!R3C9:R23C12,4,FALSE),0) -> 0 | G13: ="10020|"&VLOOKUP(RC[-6],Sheet1!R25C1:R44C7,RC[3]+1,FALSE) -> 10020|1 | H13: =IF(RC10=5,VLOOKUP(RC[-7],Sheet1!R3C9:R23C12,2,FALSE),IF(RC10=6,"出战英雄基础属性+"&VLOOKUP(RC1,Sheet1!R3C1:R23C7,RC10+1,FALSE)/100&"%","全体出战英雄"&VLOOKUP(Sheet1!R3C1,Sheet1!R2C1:R3C7,RC[2]+1,FALSE)&"+"&VLOOKUP(RC1,Sheet1!R3C1:R23C7,RC10+1,FALSE))) -> 全体出战英雄物防+38 | I13: buff_jingling | J13: 3
A14: 4 | B14: =IF(RC[-1]=R[-1]C[-1],R[-1]C+1,1) -> 3 | C14: =VLOOKUP(RC[-2],Sheet1!R3C14:R23C15,2,FALSE) -> 原生黑洞 | D14: =IF(RC10=5,VLOOKUP(RC[-3],Sheet1!R3C9:R23C12,3,FALSE),IF(RC10=6,"22|23|24|25",VLOOKUP(Sheet1!R2C1,Sheet1!R2C1:R2C7,RC[6]+1,FALSE))) -> 3 | E14: =IF(RC10=6,VLOOKUP(RC1,Sheet1!R3C1:R23C7,RC10+1,FALSE)&"|"&VLOOKUP(RC1,Sheet1!R3C1:R23C7,RC10+1,FALSE)&"|"&VLOOKUP(RC1,Sheet1!R3C1:R23C7,RC10+1,FALSE)&"|"&VLOOKUP(RC1,Sheet1!R3C1:R23C7,RC10+1,FALSE),VLOOKUP(RC1,Sheet1!R3C1:R23C7,RC10+1,FALSE)) -> 38 | F14: =IF(RC[-2]=0,VLOOKUP(RC[-5],Sheet1!R3C9:R23C12,4,FALSE),0) -> 0 | G14: ="10020|"&VLOOKUP(RC[-6],Sheet1!R25C1:R44C7,RC[3]+1,FALSE) -> 10020|1 | H14: =IF(RC10=5,VLOOKUP(RC[-7],Sheet1!R3C9:R23C12,2,FALSE),IF(RC10=6,"出战英雄基础属性+"&VLOOKUP(RC1,Sheet1!R3C1:R23C7,RC10+1,FALSE)/100&"%","全体出战英雄"&VLOOKUP(Sheet1!R3C1,Sheet1!R2C1:R3C7,RC[2]+1,FALSE)&"+"&VLOOKUP(RC1,Sheet1!R3C1:R23C7,RC10+1,FALSE))) -> 全体出战英雄魔防+38 | I14: buff_jingling | J14: 4
A15: 4 | B15: =IF(RC[-1]=R[-1]C[-1],R[-1]C+1,1) -> 4 | C15: =VLOOKUP(RC[-2],Sheet1!R3C14:R23C15,2,FALSE) -> 原生黑洞 | D15: =IF(RC10=5,VLOOKUP(RC[-3],Sheet1!R3C9:R23C12,3,FALSE),IF(RC10=6,"22|23|24|25",VLOOKUP(Sheet1!R2C1,Sheet1!R2C1:R2C7,RC[6]+1,FALSE))) -> 0 | E15: =IF(RC10=6,VLOOKUP(RC1,Sheet1!R3C1:R23C7,RC10+1,FALSE)&"|"&VLOOKUP(RC1,Sheet1!R3C1:R23C7,RC10+1,FALSE)&"|"&VLOOKUP(RC1,Sheet1!R3C1:R23C7,RC10+1,FALSE)&"|"&VLOOKUP(RC1,Sheet1!R3C1:R23C7,RC10+1,FALSE),VLOOKUP(RC1,Sheet1!R3C1:R23C7,RC10+1,FALSE)) -> 0 | F15: =IF(RC[-2]=0,VLOOKUP(RC[-5],Sheet1!R3C9:R23C12,4,FALSE),0) -> 19005|150 | G15: ="10020|"&VLOOKUP(RC[-6],Sheet1!R25C1:R44C7,RC[3]+1,FALSE) -> 10020|1 | H15: =IF(RC10=5,VLOOKUP(RC[-7],Sheet1!R3C9:R23C12,2,FALSE),IF(RC10=6,"出战英雄基础属性+"&VLOOKUP(RC1,Sheet1!R3C1:R23C7,RC10+1,FALSE)/100&"%","全体出战英雄"&VLOOKUP(Sheet1!R3C1,Sheet1!R2C1:R3C7,RC[2]+1,FALSE)&"+"&VLOOKUP(RC1,Sheet1!R3C1:R23C7,RC10+1,FALSE))) -> 钻石*150 | I15: buff_jingling | J15: 5
A16: 4 | B16: =IF(RC[-1]=R[-1]C[-1],R[-1]C+1,1) -> 5 | C16: =VLOOKUP(RC[-2],Sheet1!R3C14:R23C15,2,FALSE) -> 原生黑洞 | D16: =IF(RC10=5,VLOOKUP(RC[-3],Sheet1!R3C9:R23C12,3,FALSE),IF(RC10=6,"22|23|24|25",VLOOKUP(Sheet1!R2C1,Sheet1!R2C1:R2C7,RC[6]+1,FALSE))) -> 22|23|24|25 | E16: =IF(RC10=6,VLOOKUP(RC1,Sheet1!R3C1:R23C7,RC10+1,FALSE)&"|"&VLOOKUP(RC1,Sheet1!R3C1:R23C7,RC10+1,FALSE)&"|"&VLOOKUP(RC1,Sheet1!R3C1:R23C7,RC10+1,FALSE)&"|"&VLOOKUP(RC1,Sheet1!R3C1:R23C7,RC10+1,FALSE),VLOOKUP(RC1,Sheet1!R3C1:R23C7,RC10+1,FALSE)) -> 100|100|100|100 | F16: =IF(RC[-2]=0,VLOOKUP(RC[-5],Sheet1!R3C9:R23C12,4,FALSE),0) -> 0 | G16: ="10020|"&VLOOKUP(RC[-6],Sheet1!R25C1:R44C7,RC[3]+1,FALSE) -> 10020|0 | H16: =IF(RC10=5,VLOOKUP(RC[-7],Sheet1!R3C9:R23C12,2,FALSE),IF(RC10=6,"出战英雄基础属性+"&VLOOKUP(RC1,Sheet1!R3C1:R23C7,RC10+1,FALSE)/100&"%","全体出战英雄"&VLOOKUP(Sheet1!R3C1,Sheet1!R2C1:R3C7,RC[2]+1,FALSE)&"+"&VLOOKUP(RC1,Sheet1!R3C1:R23C7,RC10+1,FALSE))) -> 出战英雄基础属性+1% | I16: buff_jingling | J16: 6
A17: 5 | B17: =IF(RC[-1]=R[-1]C[-1],R[-1]C+1,1) -> 1 | C17: =VLOOKUP(RC[-2],Sheet1!R3C14:R23C15,2,FALSE) -> 万有引力 | D17: =IF(RC10=5,VLOOKUP(RC[-3],Sheet1!R3C9:R23C12,3,FALSE),IF(RC10=6,"22|23|24|25",VLOOKUP(Sheet1!R2C1,Sheet1!R2C1:R2C7,RC[6]+1,FALSE))) -> 4 | E17: =IF(RC10=6,VLOOKUP(RC1,Sheet1!R3C1:R23C7,RC10+1,FALSE)&"|"&VLOOKUP(RC1,Sheet1!R3C1:R23C7,RC10+1,FALSE)&"|"&VLOOKUP(RC1,Sheet1!R3C1:R23C7,RC10+1,FALSE)&"|"&VLOOKUP(RC1,Sheet1!R3C1:R23C7,RC10+1,FALSE),VLOOKUP(RC1,Sheet1!R3C1:R23C7,RC10+1,FALSE)) -> 417 | F17: =IF(RC[-2]=0,VLOOKUP(RC[-5],Sheet1!R3C9:R23C12,4,FALSE),0) -> 0 | G17: ="10020|"&VLOOKUP(RC[-6],Sheet1!R25C1:R44C7,RC[3]+1,FALSE) -> 10020|1 | H17: =IF(RC10=5,VLOOKUP(RC[-7],Sheet1!R3C9:R23C12,2,FALSE),IF(RC10=6,"出战英雄基础属性+"&VLOOKUP(RC1,Sheet1!R3C1:R23C7,RC10+1,FALSE)/100&"%","全体出战英雄"&VLOOKUP(Sheet1!R3C1,Sheet1!R2C1:R3C7,RC[2]+1,FALSE)&"+"&VLOOKUP(RC1,Sheet1!R3C1:R23C7,RC10+1,FALSE))) -> 全体出战英雄血量+417 | I17: buff_jingling | J17: 1
A18: 5 | B18: =IF(RC[-1]=R[-1]C[-1],R[-1]C+1,1) -> 2 | C18: =VLOOKUP(RC[-2],Sheet1!R3C14:R23C15,2,FALSE) -> 万有引力 | D18: =IF(RC10=5,VLOOKUP(RC[-3],Sheet1!R3C9:R23C12,3,FALSE),IF(RC10=6,"22|23|24|25",VLOOKUP(Sheet1!R2C1,Sheet1!R2C1:R2C7,RC[6]+1,FALSE))) -> 1 | E18: =IF(RC10=6,VLOOKUP(RC1,Sheet1!R3C1:R23C7,RC10+1,FALSE)&"|"&VLOOKUP(RC1,Sheet1!R3C1:R23C7,RC10+1,FALSE)&"|"&VLOOKUP(RC1,Sheet1!R3C1:R23C7,RC10+1,FALSE)&"|"&VLOOKUP(RC1,Sheet1!R3C1:R23C7,RC10+1,FALSE),VLOOKUP(RC1,Sheet1!R3C1:R23C7,RC10+1,FALSE)) -> 42 | F18: =IF(RC[-2]=0,VLOOKUP(RC[-5],Sheet1!R3C9:R23C12,4,FALSE),0) -> 0 | G18: ="10020|"&VLOOKUP(RC[-6],Sheet1!R25C1:R44C7,RC[3]+1,FALSE) -> 10020|1 | H18: =IF(RC10=5,VLOOKUP(RC[-7],Sheet1!R3C9:R23C12,2,FALSE),IF(RC10=6,"出战英雄基础属性+"&VLOOKUP(RC1,Sheet1!R3C1:R23C7,RC10+1,FALSE)/100&"%","全体出战英雄"&VLOOKUP(Sheet1!R3C1,Sheet1!R2C1:R3C7,RC[2]+1,FALSE)&"+"&VLOOKUP(RC1,Sheet1!R3C1:R23C7,RC10+1,FALSE))) -> 全体出战英雄攻击+42 | I18: buff_jingling | J18: 2
A19: 5 | B19: =IF(RC[-1]=R[-1]C[-1],R[-1]C+1,1) -> 3 | C19: =VLOOKUP(RC[-2],Sheet1!R3C14:R23C15,2,FALSE) -> 万有引力 | D19: =IF(RC10=5,VLOOKUP(RC[-3],Sheet1!R3C9:R23C12,3,FALSE),IF(RC10=6,"22|23|24|25",VLOOKUP(Sheet1!R2C1,Sheet1!R2C1:R2C7,RC[6]+1,FALSE))) -> 2 | E19: =IF(RC10=6,VLOOKUP(RC1,Sheet1!R3C1:R23C7,RC10+1,FALSE)&"|"&VLOOKUP(RC1,Sheet1!R3C1:R23C7,RC10+1,FALSE)&"|"&VLOOKUP(RC1,Sheet1!R3C1:R23C7,RC10+1,FALSE)&"|"&VLOOKUP(RC1,Sheet1!R3C1:R23C7,RC10+1,FALSE),VLOOKUP(RC1,Sheet1!R3C1:R23C7,RC10+1,FALSE)) -> 42 | F19: =IF(RC[-2]=0,VLOOKUP(RC[-5],Sheet1!R3C9:R23C12,4,FALSE),0) -> 0 | G19: ="10020|"&VLOOKUP(RC[-6],Sheet1!R25C1:R44C7,RC[3]+1,FALSE) -> 10020|1 | H19: =IF(RC10=5,VLOOKUP(RC[-7],Sheet1!R3C9:R23C12,2,FALSE),IF(RC10=6,"出战英雄基础属性+"&VLOOKUP(RC1,Sheet1!R3C1:R23C7,RC10+1,FALSE)/100&"%","全体出战英雄"&VLOOKUP(Sheet1!R3C1,Sheet1!R2C1:R3C7,RC[2]+1,FALSE)&"+"&VLOOKUP(RC1,Sheet1!R3C1:R23C7,RC10+1,FALSE))) -> 全体出战英雄物防+42 | I19: buff_jingling | J19: 3
A20: 5 | B20: =IF(RC[-1]=R[-1]C[-1],R[-1]C+1,1) -> 4 | C20: =VLOOKUP(RC[-2],Sheet1!R3C14:R23C15,2,FALSE) -> 万有引力 | D20: =IF(RC10=5,VLOOKUP(RC[-3],Sheet1!R3C9:R23C12,3,FALSE),IF(RC10=6,"22|23|24|25",VLOOKUP(Sheet1!R2C1,Sheet1!R2C1:R2C7,RC[6]+1,FALSE))) -> 3 | E20: =IF(RC10=6,VLOOKUP(RC1,Sheet1!R3C1:R23C7,RC10+1,FALSE)&"|"&VLOOKUP(RC1,Sheet1!R3C1:R23C7,RC10+1,FALSE)&"|"&VLOOKUP(RC1,Sheet1!R3C1:R23C7,RC10+1,FALSE)&"|"&VLOOKUP(RC1,Sheet1!R3C1:R23C7,RC10+1,FALSE),VLOOKUP(RC1,Sheet1!R3C1:R23C7,RC10+1,FALSE)) -> 42 | F20: =IF(RC[-2]=0,VLOOKUP(RC[-5],Sheet1!R3C9:R23C12,4,FALSE),0) -> 0 | G20: ="10020|"&VLOOKUP(RC[-6],Sheet1!R25C1:R44C7,RC[3]+1,FALSE) -> 10020|1 | H20: =IF(RC10=5,VLOOKUP(RC[-7],Sheet1!R3C9:R23C12,2,FALSE),IF(RC10=6,"出战英雄基础属性+"&VLOOKUP(RC1,Sheet1!R3C1:R23C7,RC10+1,FALSE)/100&"%","全体出战英雄"&VLOOKUP(Sheet1!R3C1,Sheet1!R2C1:R3C7,RC[2]+1,FALSE)&"+"&VLOOKUP(RC1,Sheet1!R3C1:R23C7,RC10+1,FALSE))) -> 全体出战英雄魔防+42 | I20: buff_jingling | J20: 4
A21: 5 | B21: =IF(RC[-1]=R[-1]C[-1],R[-1]C+1,1) -> 5 | C21: =VLOOKUP(RC[-2],Sheet1!R3C14:R23C15,2,FALSE) -> 万有引力 | D21: =IF(RC10=5,VLOOKUP(RC[-3],Sheet1!R3C9:R23C12,3,FALSE),IF(RC10=6,"22|23|24|25",VLOOKUP(Sheet1!R2C1,Sheet1!R2C1:R2C7,RC[6]+1,FALSE))) -> 0 | E21: =IF(RC10=6,VLOOKUP(RC1,Sheet1!R3C1:R23C7,RC10+1,FALSE)&"|"&VLOOKUP(RC1,Sheet1!R3C1:R23C7,RC10+1,FALSE)&"|"&VLOOKUP(RC1,Sheet1!R3C1:R23C7,RC10+1,FALSE)&"|"&VLOOKUP(RC1,Sheet1!R3C1:R23C7,RC10+1,FALSE),VLOOKUP(RC1,Sheet1!R3C1:R23C7,RC10+1,FALSE)) -> 0 | F21: =IF(RC[-2]=0,VLOOKUP(RC[-5],Sheet1!R3C9:R23C12,4,FALSE),0) -> 19005|200 | G21: ="10020|"&VLOOKUP(RC[-6],Sheet1!R25C1:R44C7,RC[3]+1,FALSE) -> 10020|2 | H21: =IF(RC10=5,VLOOKUP(RC[-7],Sheet1!R3C9:R23C12,2,FALSE),IF(RC10=6,"出战英雄基础属性+"&VLOOKUP(RC1,Sheet1!R3C1:R23C7,RC10+1,FALSE)/100&"%","全体出战英雄"&VLOOKUP(Sheet1!R3C1,Sheet1!R2C1:R3C7,RC[2]+1,FALSE)&"+"&VLOOKUP(RC1,Sheet1!R3C1:R23C7,RC10+1,FALSE))) -> 钻石*200 | I21: buff_jingling | J21: 5
A22: 5 | B22: =IF(RC[-1]=R[-1]C[-1],R[-1]C+1,1) -> 6 | C22: =VLOOKUP(RC[-2],Sheet1!R3C14:R23C15,2,FALSE) -> 万有引力 | D22: =IF(RC10=5,VLOOKUP(RC[-3],Sheet1!R3C9:R23C12,3,FALSE),IF(RC10=6,"22|23|24|25",VLOOKUP(Sheet1!R2C1,Sheet1!R2C1:R2C7,RC[6]+1,FALSE))) -> 22|23|24|25 | E22: =IF(RC10=6,VLOOKUP(RC1,Sheet1!R3C1:R23C7,RC10+1,FALSE)&"|"&VLOOKUP(RC1,Sheet1!R3C1:R23C7,RC10+1,FALSE)&"|"&VLOOKUP(RC1,Sheet1!R3C1:R23C7,RC10+1,FALSE)&"|"&VLOOKUP(RC1,Sheet1!R3C1:R23C7,RC10+1,FALSE),VLOOKUP(RC1,Sheet1!R3C1:R23C7,RC10+1,FALSE)) -> 100|100|100|100 | F22: =IF(RC[-2]=0,VLOOKUP(RC[-5],Sheet1!R3C9:R23C12,4,FALSE),0) -> 0 | G22: ="10020|"&VLOOKUP(RC[-6],Sheet1!R25C1:R44C7,RC[3]+1,FALSE) -> 10020|0 | H22: =IF(RC10=5,VLOOKUP(RC[-7],Sheet1!R3C9:R23C12,2,FALSE),IF(RC10=6,"出战英雄基础属性+"&VLOOKUP(RC1,Sheet1!R3C1:R23C7,RC10+1,FALSE)/100&"%","全体出战英雄"&VLOOKUP(Sheet1!R3C1,Sheet1!R2C1:R3C7,RC[2]+1,FALSE)&"+"&VLOOKUP(RC1,Sheet1!R3C1:R23C7,RC10+1,FALSE))) -> 出战英雄基础属性+1% | I22: buff_jingling | J22: 6
A23: 6 | B23: =IF(RC[-1]=R[-1]C[-1],R[-1]C+1,1) -> 1 | C23: =VLOOKUP(RC[-2],Sheet1!R3C14:R23C15,2,FALSE) -> 绚烂星云 | D23: =IF(RC10=5,VLOOKUP(RC[-3],Sheet1!R3C9:R23C12,3,FALSE),IF(RC10=6,"22|23|24|25",VLOOKUP(Sheet1!R2C1,Sheet1!R2C1:R2C7,RC[6]+1,FALSE))) -> 4 | E23: =IF(RC10=6,VLOOKUP(RC1,Sheet1!R3C1:R23C7,RC10+1,FALSE)&"|"&VLOOKUP(RC1,Sheet1!R3C1:R23C7,RC10+1,FALSE)&"|"&VLOOKUP(RC1,Sheet1!R3C1:R23C7,RC10+1,FALSE)&"|"&VLOOKUP(RC1,Sheet1!R3C1:R23C7,RC10+1,FALSE),VLOOKUP(RC1,Sheet1!R3C1:R23C7,RC10+1,FALSE)) -> 459 | F23: =IF(RC[-2]=0,VLOOKUP(RC[-5],Sheet1!R3C9:R23C12,4,FALSE),0) -> 0 | G23: ="10020|"&VLOOKUP(RC[-6],Sheet1!R25C1:R44C7,RC[3]+1,FALSE) -> 10020|1 | H23: =IF(RC10=5,VLOOKUP(RC[-7],Sheet1!R3C9:R23C12,2,FALSE),IF(RC10=6,"出战英雄基础属性+"&VLOOKUP(RC1,Sheet1!R3C1:R23C7,RC10+1,FALSE)/100&"%","全体出战英雄"&VLOOKUP(Sheet1!R3C1,Sheet1!R2C1:R3C7,RC[2]+1,FALSE)&"+"&VLOOKUP(RC1,Sheet1!R3C1:R23C7,RC10+1,FALSE))) -> 全体出战英雄血量+459 | I23: buff_jingling | J23: 1
A24: 6 | B24: =IF(RC[-1]=R[-1]C[-1],R[-1]C+1,1) -> 2 | C24: =VLOOKUP(RC[-2],Sheet1!R3C14:R23C15,2,FALSE) -> 绚烂星云 | D24: =IF(RC10=5,VLOOKUP(RC[-3],Sheet1!R3C9:R23C12,3,FALSE),IF(RC10=6,"22|23|24|25",VLOOKUP(Sheet1!R2C1,Sheet1!R2C1:R2C7,RC[6]+1,FALSE))) -> 1 | E24: =IF(RC10=6,VLOOKUP(RC1,Sheet1!R3C1:R23C7,RC10+1,FALSE)&"|"&VLOOKUP(RC1,Sheet1!R3C1:R23C7,RC10+1,FALSE)&"|"&VLOOKUP(RC1,Sheet1!R3C1:R23C7,RC10+1,FALSE)&"|"&VLOOKUP(RC1,Sheet1!R3C1:R23C7,RC10+1,FALSE),VLOOKUP(RC1,Sheet1!R3C1:R23C7,RC10+1,FALSE)) -> 46 | F24: =IF(RC[-2]=0,VLOOKUP(RC[-5],Sheet1!R3C9:R23C12,4,FALSE),0) -> 0 | G24: ="10020|"&VLOOKUP(RC[-6],Sheet1!R25C1:R44C7,RC[3]+1,FALSE) -> 10020|1 | H24: =IF(RC10=5,VLOOKUP(RC[-7],Sheet1!R3C9:R23C12,2,FALSE),IF(RC10=6,"出战英雄基础属性+"&VLOOKUP(RC1,Sheet1!R3C1:R23C7,RC10+1,FALSE)/100&"%","全体出战英雄"&VLOOKUP(Sheet1!R3C1,Sheet1!R2C1:R3C7,RC[2]+1,FALSE)&"+"&VLOOKUP(RC1,Sheet1!R3C1:R23C7,RC10+1,FALSE))) -> 全体出战英雄攻击+46 | I24: buff_jingling | J24: 2
A25: 6 | B25: =IF(RC[-1]=R[-1]C[-1],R[-1]C+1,1) -> 3 | C25: =VLOOKUP(RC[-2],Sheet1!R3C14:R23C15,2,FALSE) -> 绚烂星云 | D25: =IF(RC10=5,VLOOKUP(RC[-3],Sheet1!R3C9:R23C12,3,FALSE),IF(RC10=6,"22|23|24|25",VLOOKUP(Sheet1!R2C1,Sheet1!R2C1:R2C7,RC[6]+1,FALSE))) -> 2 | E25: =IF(RC10=6,VLOOKUP(RC1,Sheet1!R3C1:R23C7,RC10+1,FALSE)&"|"&VLOOKUP(RC1,Sheet1!R3C1:R23C7,RC10+1,FALSE)&"|"&VLOOKUP(RC1,Sheet1!R3C1:R23C7,RC10+1,FALSE)&"|"&VLOOKUP(RC1,Sheet1!R3C1:R23C7,RC10+1,FALSE),VLOOKUP(RC1,Sheet1!R3C1:R23C7,RC10+1,FALSE)) -> 46 | F25: =IF(RC[-2]=0,VLOOKUP(RC[-5],Sheet1!R3C9:R23C12,4,FALSE),0) -> 0 | G25: ="10020|"&VLOOKUP(RC[-6],Sheet1!R25C1:R44C7,RC[3]+1,FALSE) -> 10020|1 | H25: =IF(RC10=5,VLOOKUP(RC[-7],Sheet1!R3C9:R23C12,2,FALSE),IF(RC10=6,"出战英雄基础属性+"&VLOOKUP(RC1,Sheet1!R3C1:R23C7,RC10+1,FALSE)/100&"%","全体出战英雄"&VLOOKUP(Sheet1!R3C1,Sheet1!R2C1:R3C7,RC[2]+1,FALSE)&"+"&VLOOKUP(RC1,Sheet1!R3C1:R23C7,RC10+1,FALSE))) -> 全体出战英雄物防+46 | I25: buff_jingling | J25: 3
A26: 6 | B26: =IF(RC[-1]=R[-1]C[-1],R[-1]C+1,1) -> 4 | C26: =VLOOKUP(RC[-2],Sheet1!R3C14:R23C15,2,FALSE) -> 绚烂星云 | D26: =IF(RC10=5,VLOOKUP(RC[-3],Sheet1!R3C9:R23C12,3,FALSE),IF(RC10=6,"22|23|24|25",VLOOKUP(Sheet1!R2C1,Sheet1!R2C1:R2C7,RC[6]+1,FALSE))) -> 3 | E26: =IF(RC10=6,VLOOKUP(RC1,Sheet1!R3C1:R23C7,RC10+1,FALSE)&"|"&VLOOKUP(RC1,Sheet1!R3C1:R23C7,RC10+1,FALSE)&"|"&VLOOKUP(RC1,Sheet1!R3C1:R23C7,RC10+1,FALSE)&"|"&VLOOKUP(RC1,Sheet1!R3C1:R23C7,RC10+1,FALSE),VLOOKUP(RC1,Sheet1!R3C1:R23C7,RC10+1,FALSE)) -> 46 | F26: =IF(RC[-2]=0,VLOOKUP(RC[-5],Sheet1!R3C9:R23C12,4,FALSE),0) -> 0 | G26: ="10020|"&VLOOKUP(RC[-6],Sheet1!R25C1:R44C7,RC[3]+1,FALSE) -> 10020|1 | H26: =IF(RC10=5,VLOOKUP(RC[-7],Sheet1!R3C9:R23C12,2,FALSE),IF(RC10=6,"出战英雄基础属性+"&VLOOKUP(RC1,Sheet1!R3C1:R23C7,RC10+1,FALSE)/100&"%","全体出战英雄"&VLOOKUP(Sheet1!R3C1,Sheet1!R2C1:R3C7,RC[2]+1,FALSE)&"+"&VLOOKUP(RC1,Sheet1!R3C1:R23C7,RC10+1,FALSE))) -> 全体出战英雄魔防+46 | I26: buff_jingling | J26: 4
A27: 6 | B27: =IF(RC[-1]=R[-1]C[-1],R[-1]C+1,1) -> 5 | C27: =VLOOKUP(RC[-2],Sheet1!R3C14:R23C15,2,FALSE) -> 绚烂星云 | D27: =IF(RC10=5,VLOOKUP(RC[-3],Sheet1!R3C9:R23C12,3,FALSE),IF(RC10=6,"22|23|24|25",VLOOKUP(Sheet1!R2C1,Sheet1!R2C1:R2C7,RC[6]+1,FALSE))) -> 21 | E27: =IF(RC10=6,VLOOKUP(RC1,Sheet1!R3C1:R23C7,RC10+1,FALSE)&"|"&VLOOKUP(RC1,Sheet1!R3C1:R23C7,RC10+1,FALSE)&"|"&VLOOKUP(RC1,Sheet1!R3C1:R23C7,RC10+1,FALSE)&"|"&VLOOKUP(RC1,Sheet1!R3C1:R23C7,RC10+1,FALSE),VLOOKUP(RC1,Sheet1!R3C1:R23C7,RC10+1,FALSE)) -> 5 | F27: =IF(RC[-2]=0,VLOOKUP(RC[-5],Sheet1!R3C9:R23C12,4,FALSE),0) -> 0 | G27: ="10020|"&VLOOKUP(RC[-6],Sheet1!R25C1:R44C7,RC[3]+1,FALSE) -> 10020|2 | H27: =IF(RC10=5,VLOOKUP(RC[-7],Sheet1!R3C9:R23C12,2,FALSE),IF(RC10=6,"出战英雄基础属性+"&VLOOKUP(RC1,Sheet1!R3C1:R23C7,RC10+1,FALSE)/100&"%","全体出战英雄"&VLOOKUP(Sheet1!R3C1,Sheet1!R2C1:R3C7,RC[2]+1,FALSE)&"+"&VLOOKUP(RC1,Sheet1!R3C1:R23C7,RC10+1,FALSE))) -> 全体出战英雄怒气+5 | I27: buff_jingling | J27: 5
A28: 6 | B28: =IF(RC[-1]=R[-1]C[-1],R[-1]C+1,1) -> 6 | C28: =VLOOKUP(RC[-2],Sheet1!R3C14:R23C15,2,FALSE) -> 绚烂星云 | D28: =IF(RC10=5,VLOOKUP(RC[-3],Sheet1!R3C9:R23C12,3,FALSE),IF(RC10=6,"22|23|24|25",VLOOKUP(Sheet1!R2C1,Sheet1!R2C1:R2C7,RC[6]+1,FALSE))) -> 22|23|24|25 | E28: =IF(RC10=6,VLOOKUP(RC1,Sheet1!R3C1:R23C7,RC10+1,FALSE)&"|"&VLOOKUP(RC1,Sheet1!R3C1:R23C7,RC10+1,FALSE)&"|"&VLOOKUP(RC1,Sheet1!R3C1:R23C7,RC10+1,FALSE)&"|"&VLOOKUP(RC1,Sheet1!R3C1:R23C7,RC10+1,FALSE),VLOOKUP(RC1,Sheet1!R3C1:R23C7,RC10+1,FALSE)) -> 200|200|200|200 | F28: =IF(RC[-2]=0,VLOOKUP(RC[-5],Sheet1!R3C9:R23C12,4,FALSE),0) -> 0 | G28: ="10020|"&VLOOKUP(RC[-6],Sheet1!R25C1:R44C7,RC[3]+1,FALSE) -> 10020|0 | H28: =IF(RC10=5,VLOOKUP(RC[-7],Sheet1!R3C9:R23C12,2,FALSE),IF(RC10=6,"出战英雄基础属性+"&VLOOKUP(RC1,Sheet1!R3C1:R23C7,RC10+1,FALSE)/100&"%","全体出战英雄"&VLOOKUP(Sheet1!R3C1,Sheet1!R2C1:R3C7,RC[2]+1,FALSE)&"+"&VLOOKUP(RC1,Sheet1!R3C1:R23C7,RC10+1,FALSE))) -> 出战英雄基础属性+2% | I28: buff_jingling | J28: 6
A29: 7 | B29: =IF(RC[-1]=R[-1]C[-1],R[-1]C+1,1) -> 1 | C29: =VLOOKUP(RC[-2],Sheet1!R3C14:R23C15,2,FALSE) -> 灼热恒星 | D29: =IF(RC10=5,VLOOKUP(RC[-3],Sheet1!R3C9:R23C12,3,FALSE),IF(RC10=6,"22|23|24|25",VLOOKUP(Sheet1!R2C1,Sheet1!R2C1:R2C7,RC[6]+1,FALSE))) -> 4 | E29: =IF(RC10=6,VLOOKUP(RC1,Sheet1!R3C1:R23C7,RC10+1,FALSE)&"|"&VLOOKUP(RC1,Sheet1!R3C1:R23C7,RC10+1,FALSE)&"|"&VLOOKUP(RC1,Sheet1!R3C1:R23C7,RC10+1,FALSE)&"|"&VLOOKUP(RC1,Sheet1!R3C1:R23C7,RC10+1,FALSE),VLOOKUP(RC1,Sheet1!R3C1:R23C7,RC10+1,FALSE)) -> 500 | F29: =IF(RC[-2]=0,VLOOKUP(RC[-5],Sheet1!R3C9:R23C12,4,FALSE),0) -> 0 | G29: ="10020|"&VLOOKUP(RC[-6],Sheet1!R25C1:R44C7,RC[3]+1,FALSE) -> 10020|2 | H29: =IF(RC10=5,VLOOKUP(RC[-7],Sheet1!R3C9:R23C12,2,FALSE),IF(RC10=6,"出战英雄基础属性+"&VLOOKUP(RC1,Sheet1!R3C1:R23C7,RC10+1,FALSE)/100&"%","全体出战英雄"&VLOOKUP(Sheet1!R3C1,Sheet1!R2C1:R3C7,RC[2]+1,FALSE)&"+"&VLOOKUP(RC1,Sheet1!R3C1:R23C7,RC10+1,FALSE))) -> 全体出战英雄血量+500 | I29: buff_jingling | J29: 1
A30: 7 | B30: =IF(RC[-1]=R[-1]C[-1],R[-1]C+1,1) -> 2 | C30: =VLOOKUP(RC[-2],Sheet1!R3C14:R23C15,2,FALSE) -> 灼热恒星 | D30: =IF(RC10=5,VLOOKUP(RC[-3],Sheet1!R3C9:R23C12,3,FALSE),IF(RC10=6,"22|23|24|25",VLOOKUP(Sheet1!R2C1,Sheet1!R2C1:R2C7,RC[6]+1,FALSE))) -> 1 | E30: =IF(RC10=6,VLOOKUP(RC1,Sheet1!R3C1:R23C7,RC10+1,FALSE)&"|"&VLOOKUP(RC1,Sheet1!R3C1:R23C7,RC10+1,FALSE)&"|"&VLOOKUP(RC1,Sheet1!R3C1:R23C7,RC10+1,FALSE)&"|"&VLOOKUP(RC1,Sheet1!R3C1:R23C7,RC10+1,FALSE),VLOOKUP(RC1,Sheet1!R3C1:R23C7,RC10+1,FALSE)) -> 50 | F30: =IF(RC[-2]=0,VLOOKUP(RC[-5],Sheet1!R3C9:R23C12,4,FALSE),0) -> 0 | G30: ="10020|"&VLOOKUP(RC[-6],Sheet1!R25C1:R44C7,RC[3]+1,FALSE) -> 10020|2 | H30: =IF(RC10=5,VLOOKUP(RC[-7],Sheet1!R3C9:R23C12,2,FALSE),IF(RC10=6,"出战英雄基础属性+"&VLOOKUP(RC1,Sheet1!R3C1:R23C7,RC10+1,FALSE)/100&"%","全体出战英雄"&VLOOKUP(Sheet1!R3C1,Sheet1!R2C1:R3C7,RC[2]+1,FALSE)&"+"&VLOOKUP(RC1,Sheet1!R3C1:R23C7,RC10+1,FALSE))) -> 全体出战英雄攻击+50 | I30: buff_jingling | J30: 2
A31: 7 | B31: =IF(RC[-1]=R[-1]C[-1],R[-1]C+1,1) -> 3 | C31: =VLOOKUP(RC[-2],Sheet1!R3C14:R23C15,2,FALSE) -> 灼热恒星 | D31: =IF(RC10=5,VLOOKUP(RC[-3],Sheet1!R3C9:R23C12,3,FALSE),IF(RC10=6,"22|23|24|25",VLOOKUP(Sheet1!R2C1,Sheet1!R2C1:R2C7,RC[6]+1,FALSE))) -> 2 | E31: =IF(RC10=6,VLOOKUP(RC1,Sheet1!R3C1:R23C7,RC10+1,FALSE)&"|"&VLOOKUP(RC1,Sheet1!R3C1:R23C7,RC10+1,FALSE)&"|"&VLOOKUP(RC1,Sheet1!R3C1:R23C7,RC10+1,FALSE)&"|"&VLOOKUP(RC1,Sheet1!R3C1:R23C7,RC10+1,FALSE),VLOOKUP(RC1,Sheet1!R3C1:R23C7,RC10+1,FALSE)) -> 50 | F31: =IF(RC[-2]=0,VLOOKUP(RC[-5],Sheet1!R3C9:R23C12,4,FALSE),0) -> 0 | G31: ="10020|"&VLOOKUP(RC[-6],Sheet1!R25C1:R44C7,RC[3]+1,FALSE) -> 10020|2 | H31: =IF(RC10=5,VLOOKUP(RC[-7],Sheet1!R3C9:R23C12,2,FALSE),IF(RC10=6,"出战英雄基础属性+"&VLOOKUP(RC1,Sheet1!R3C1:R23C7,RC10+1,FALSE)/100&"%","全体出战英雄"&VLOOKUP(Sheet1!R3C1,Sheet1!R2C1:R3C7,RC[2]+1,FALSE)&"+"&VLOOKUP(RC1,Sheet1!R3C1:R23C7,RC10+1,FALSE))) -> 全体出战英雄物防+50 | I31: buff_jingling | J31: 3
A32: 7 | B32: =IF(RC[-1]=R[-1]C[-1],R[-1]C+1,1) -> 4 | C32: =VLOOKUP(RC[-2],Sheet1!R3C14:R23C15,2,FALSE) -> 灼热恒星 | D32: =IF(RC10=5,VLOOKUP(RC[-3],Sheet1!R3C9:R23C12,3,FALSE),IF(RC10=6,"22|23|24|25",VLOOKUP(Sheet1!R2C1,Sheet1!R2C1:R2C7,RC[6]+1,FALSE))) -> 3 | E32: =IF(RC10=6,VLOOKUP(RC1,Sheet1!R3C1:R23C7,RC10+1,FALSE)&"|"&VLOOKUP(RC1,Sheet1!R3C1:R23C7,RC10+1,FALSE)&"|"&VLOOKUP(RC1,Sheet1!R3C1:R23C7,RC10+1,FALSE)&"|"&VLOOKUP(RC1,Sheet1!R3C1:R23C7,RC10+1,FALSE),VLOOKUP(RC1,Sheet1!R3C1:R23C7,RC10+1,FALSE)) -> 50 | F32: =IF(RC[-2]=0,VLOOKUP(RC[-5],Sheet1!R3C9:R23C12,4,FALSE),0) -> 0 | G32: ="10020|"&VLOOKUP(RC[-6],Sheet1!R25C1:R44C7,RC[3]+1,FALSE) -> 10020|2 | H32: =IF(RC10=5,VLOOKUP(RC[-7],Sheet1!R3C9:R23C12,2,FALSE),IF(RC10=6,"出战英雄基础属性+"&VLOOKUP(RC1,Sheet1!R3C1:R23C7,RC10+1,FALSE)/100&"%","全体出战英雄"&VLOOKUP(Sheet1!R3C1,Sheet1!R2C1:R3C7,RC[2]+1,FALSE)&"+"&VLOOKUP(RC1,Sheet1!R3C1:R23C7,RC10+1,FALSE))) -> 全体出战英雄魔防+50 | I32: buff_jingling | J32: 4
A33: 7 | B33: =IF(RC[-1]=R[-1]C[-1],R[-1]C+1,1) -> 5 | C33: =VLOOKUP(RC[-2],Sheet1!R3C14:R23C15,2,FALSE) -> 灼热恒星 | D33: =IF(RC10=5,VLOOKUP(RC[-3],Sheet1!R3C9:R23C12,3,FALSE),IF(RC10=6,"22|23|24|25",VLOOKUP(Sheet1!R2C1,Sheet1!R2C1:R2C7,RC[6]+1,FALSE))) -> 0 | E33: =IF(RC10=6,VLOOKUP(RC1,Sheet1!R3C1:R23C7,RC10+1,FALSE)&"|"&VLOOKUP(RC1,Sheet1!R3C1:R23C7,RC10+1,FALSE)&"|"&VLOOKUP(RC1,Sheet1!R3C1:R23C7,RC10+1,FALSE)&"|"&VLOOKUP(RC1,Sheet1!R3C1:R23C7,RC10+1,FALSE),VLOOKUP(RC1,Sheet1!R3C1:R23C7,RC10+1,FALSE)) -> 0 | F33: =IF(RC[-2]=0,VLOOKUP(RC[-5],Sheet1!R3C9:R23C12,4,FALSE),0) -> 10022|5 | G33: ="10020|"&VLOOKUP(RC[-6],Sheet1!R25C1:R44C7,RC[3]+1,FALSE) -> 10020|3 | H33: =IF(RC10=5,VLOOKUP(RC[-7],Sheet1!R3C9:R23C12,2,FALSE),IF(RC10=6,"出战英雄基础属性+"&VLOOKUP(RC1,Sheet1!R3C1:R23C7,RC10+1,FALSE)/100&"%","全体出战英雄"&VLOOKUP(Sheet1!R3C1,Sheet1!R2C1:R3C7,RC[2]+1,FALSE)&"+"&VLOOKUP(RC1,Sheet1!R3C1:R23C7,RC10+1,FALSE))) -> 灵性精粹*5 | I33: buff_jingling | J33: 5
A34: 7 | B34: =IF(RC[-1]=R[-1]C[-1],R[-1]C+1,1) -> 6 | C34: =VLOOKUP(RC[-2],Sheet1!R3C14:R23C15,2,FALSE) -> 灼热恒星 | D34: =IF(RC10=5,VLOOKUP(RC[-3],Sheet1!R3C9:R23C12,3,FALSE),IF(RC10=6,"22|23|24|25",VLOOKUP(Sheet1!R2C1,Sheet1!R2C1:R2C7,RC[6]+1,FALSE))) -> 22|23|24|25 | E34: =IF(RC10=6,VLOOKUP(RC1,Sheet1!R3C1:R23C7,RC10+1,FALSE)&"|"&VLOOKUP(RC1,Sheet1!R3C1:R23C7,RC10+1,FALSE)&"|"&VLOOKUP(RC1,Sheet1!R3C1:R23C7,RC10+1,FALSE)&"|"&VLOOKUP(RC1,Sheet1!R3C1:R23C7,RC10+1,FALSE),VLOOKUP(RC1,Sheet1!R3C1:R23C7,RC10+1,FALSE)) -> 200|200|200|200 | F34: =IF(RC[-2]=0,VLOOKUP(RC[-5],Sheet1!R3C9:R23C12,4,FALSE),0) -> 0 | G34: ="10020|"&VLOOKUP(RC[-6],Sheet1!R25C1:R44C7,RC[3]+1,FALSE) -> 10020|0 | H34: =IF(RC10=5,VLOOKUP(RC[-7],Sheet1!R3C9:R23C12,2,FALSE),IF(RC10=6,"出战英雄基础属性+"&VLOOKUP(RC1,Sheet1!R3C1:R23C7,RC10+1,FALSE)/100&"%","全体出战英雄"&VLOOKUP(Sheet1!R3C1,Sheet1!R2C1:R3C7,RC[2]+1,FALSE)&"+"&VLOOKUP(RC1,Sheet1!R3C1:R23C7,RC10+1,FALSE))) -> 出战英雄基础属性+2% | I34: buff_jingling | J34: 6
A35: 8 | B35: =IF(RC[-1]=R[-1]C[-1],R[-1]C+1,1) -> 1 | C35: =VLOOKUP(RC[-2],Sheet1!R3C14:R23C15,2,FALSE) -> 陨落流星 | D35: =IF(RC10=5,VLOOKUP(RC[-3],Sheet1!R3C9:R23C12,3,FALSE),IF(RC10=6,"22|23|24|25",VLOOKUP(Sheet1!R2C1,Sheet1!R2C1:R2C7,RC[6]+1,FALSE))) -> 4 | E35: =IF(RC10=6,VLOOKUP(RC1,Sheet1!R3C1:R23C7,RC10+1,FALSE)&"|"&VLOOKUP(RC1,Sheet1!R3C1:R23C7,RC10+1,FALSE)&"|"&VLOOKUP(RC1,Sheet1!R3C1:R23C7,RC10+1,FALSE)&"|"&VLOOKUP(RC1,Sheet1!R3C1:R23C7,RC10+1,FALSE),VLOOKUP(RC1,Sheet1!R3C1:R23C7,RC10+1,FALSE)) -> 542 | F35: =IF(RC[-2]=0,VLOOKUP(RC[-5],Sheet1!R3C9:R23C12,4,FALSE),0) -> 0 | G35: ="10020|"&VLOOKUP(RC[-6],Sheet1!R25C1:R44C7,RC[3]+1,FALSE) -> 10020|2 | H35: =IF(RC10=5,VLOOKUP(RC[-7],Sheet1!R3C9:R23C12,2,FALSE),IF(RC10=6,"出战英雄基础属性+"&VLOOKUP(RC1,Sheet1!R3C1:R23C7,RC10+1,FALSE)/100&"%","全体出战英雄"&VLOOKUP(Sheet1!R3C1,Sheet1!R2C1:R3C7,RC[2]+1,FALSE)&"+"&VLOOKUP(RC1,Sheet1!R3C1:R23C7,RC10+1,FALSE))) -> 全体出战英雄血量+542 | I35: buff_jingling | J35: 1
A36: 8 | B36: =IF(RC[-1]=R[-1]C[-1],R[-1]C+1,1) -> 2 | C36: =VLOOKUP(RC[-2],Sheet1!R3C14:R23C15,2,FALSE) -> 陨落流星 | D36: =IF(RC10=5,VLOOKUP(RC[-3],Sheet1!R3C9:R23C12,3,FALSE),IF(RC10=6,"22|23|24|25",VLOOKUP(Sheet1!R2C1,Sheet1!R2C1:R2C7,RC[6]+1,FALSE))) -> 1 | E36: =IF(RC10=6,VLOOKUP(RC1,Sheet1!R3C1:R23C7,RC10+1,FALSE)&"|"&VLOOKUP(RC1,Sheet1!R3C1:R23C7,RC10+1,FALSE)&"|"&VLOOKUP(RC1,Sheet1!R3C1:R23C7,RC10+1,FALSE)&"|"&VLOOKUP(RC1,Sheet1!R3C1:R23C7,RC10+1,FALSE),VLOOKUP(RC1,Sheet1!R3C1:R23C7,RC10+1,FALSE)) -> 54 | F36: =IF(RC[-2]=0,VLOOKUP(RC[-5],Sheet1!R3C9:R23C12,4,FALSE),0) -> 0 | G36: ="10020|"&VLOOKUP(RC[-6],Sheet1!R25C1:R44C7,RC[3]+1,FALSE) -> 10020|2 | H36: =IF(RC10=5,VLOOKUP(RC[-7],Sheet1!R3C9:R23C12,2,FALSE),IF(RC10=6,"出战英雄基础属性+"&VLOOKUP(RC1,Sheet1!R3C1:R23C7,RC10+1,FALSE)/100&"%","全体出战英雄"&VLOOKUP(Sheet1!R3C1,Sheet1!R2C1:R3C7,RC[2]+1,FALSE)&"+"&VLOOKUP(RC1,Sheet1!R3C1:R23C7,RC10+1,FALSE))) -> 全体出战英雄攻击+54 | I36: buff_jingling | J36: 2
A37: 8 | B37: =IF(RC[-1]=R[-1]C[-1],R[-1]C+1,1) -> 3 | C37: =VLOOKUP(RC[-2],Sheet1!R3C14:R23C15,2,FALSE) -> 陨落流星 | D37: =IF(RC10=5,VLOOKUP(RC[-3],Sheet1!R3C9:R23C12,3,FALSE),IF(RC10=6,"22|23|24|25",VLOOKUP(Sheet1!R2C1,Sheet1!R2C1:R2C7,RC[6]+1,FALSE))) -> 2 | E37: =IF(RC10=6,VLOOKUP(RC1,Sheet1!R3C1:R23C7,RC10+1,FALSE)&"|"&VLOOKUP(RC1,Sheet1!R3C1:R23C7,RC10+1,FALSE)&"|"&VLOOKUP(RC1,Sheet1!R3C1:R23C7,RC10+1,FALSE)&"|"&VLOOKUP(RC1,Sheet1!R3C1:R23C7,RC10+1,FALSE),VLOOKUP(RC1,Sheet1!R3C1:R23C7,RC10+1,FALSE)) -> 54 | F37: =IF(RC[-2]=0,VLOOKUP(RC[-5],Sheet1!R3C9:R23C12,4,FALSE),0) -> 0 | G37: ="10020|"&VLOOKUP(RC[-6],Sheet1!R25C1:R44C7,RC[3]+1,FALSE) -> 10020|2 | H37: =IF(RC10=5,VLOOKUP(RC[-7],Sheet1!R3C9:R23C12,2,FALSE),IF(RC10=6,"出战英雄基础属性+"&VLOOKUP(RC1,Sheet1!R3C1:R23C7,RC10+1,FALSE)/100&"%","全体出战英雄"&VLOOKUP(Sheet1!R3C1,Sheet1!R2C1:R3C7,RC[2]+1,FALSE)&"+"&VLOOKUP(RC1,Sheet1!R3C1:R23C7,RC10+1,FALSE))) -> 全体出战英雄物防+54 | I37: buff_jingling | J37: 3
A38: 8 | B38: =IF(RC[-1]=R[-1]C[-1],R[-1]C+1,1) -> 4 | C38: =VLOOKUP(RC[-2],Sheet1!R3C14:R23C15,2,FALSE) -> 陨落流星 | D38: =IF(RC10=5,VLOOKUP(RC[-3],Sheet1!R3C9:R23C12,3,FALSE),IF(RC10=6,"22|23|24|25",VLOOKUP(Sheet1!R2C1,Sheet1!R2C1:R2C7,RC[6]+1,FALSE))) -> 3 | E38: =IF(RC10=6,VLOOKUP(RC1,Sheet1!R3C1:R23C7,RC10+1,FALSE)&"|"&VLOOKUP(RC1,Sheet1!R3C1:R23C7,RC10+1,FALSE)&"|"&VLOOKUP(RC1,Sheet1!R3C1:R23C7,RC10+1,FALSE)&"|"&VLOOKUP(RC1,Sheet1!R3C1:R23C7,RC10+1,FALSE),VLOOKUP(RC1,Sheet1!R3C1:R23C7,RC10+1,FALSE)) -> 54 | F38: =IF(RC[-2]=0,VLOOKUP(RC[-5],Sheet1!R3C9:R23C12,4,FALSE),0) -> 0 | G38: ="10020|"&VLOOKUP(RC[-6],Sheet1!R25C1:R44C7,RC[3]+1,FALSE) -> 10020|2 | H38: =IF(RC10=5,VLOOKUP(RC[-7],Sheet1!R3C9:R23C12,2,FALSE),IF(RC10=6,"出战英雄基础属性+"&VLOOKUP(RC1,Sheet1!R3C1:R23C7,RC10+1,FALSE)/100&"%","全体出战英雄"&VLOOKUP(Sheet1!R3C1,Sheet1!R2C1:R3C7,RC[2]+1,FALSE)&"+"&VLOOKUP(RC1,Sheet1!R3C1:R23C7,RC10+1,FALSE))) -> 全体出战英雄魔防+54 | I38: buff_jingling | J38: 4
A39: 8 | B39: =IF(RC[-1]=R[-1]C[-1],R[-1]C+1,1) -> 5 | C39: =VLOOKUP(RC[-2],Sheet1!R3C14:R23C15,2,FALSE) -> 陨落流星 | D39: =IF(RC10=5,VLOOKUP(RC[-3],Sheet1!R3C9:R23C12,3,FALSE),IF(RC10=6,"22|23|24|25",VLOOKUP(Sheet1!R2C1,Sheet1!R2C1:R2C7,RC[6]+1,FALSE))) -> 0 | E39: =IF(RC10=6,VLOOKUP(RC1,Sheet1!R3C1:R23C7,RC10+1,FALSE)&"|"&VLOOKUP(RC1,Sheet1!R3C1:R23C7,RC10+1,FALSE)&"|"&VLOOKUP(RC1,Sheet1!R3C1:R23C7,RC10+1,FALSE)&"|"&VLOOKUP(RC1,Sheet1!R3C1:R23C7,RC10+1,FALSE),VLOOKUP(RC1,Sheet1!R3C1:R23C7,RC10+1,FALSE)) -> 0 | F39: =IF(RC[-2]=0,VLOOKUP(RC[-5],Sheet1!R3C9:R23C12,4,FALSE),0) -> 10022|5 | G39: ="10020|"&VLOOKUP(RC[-6],Sheet1!R25C1:R44C7,RC[3]+1,FALSE) -> 10020|3 | H39: =IF(RC10=5,VLOOKUP(RC[-7],Sheet1!R3C9:R23C12,2,FALSE),IF(RC10=6,"出战英雄基础属性+"&VLOOKUP(RC1,Sheet1!R3C1:R23C7,RC10+1,FALSE)/100&"%","全体出战英雄"&VLOOKUP(Sheet1!R3C1,Sheet1!R2C1:R3C7,RC[2]+1,FALSE)&"+"&VLOOKUP(RC1,Sheet1!R3C1:R23C7,RC10+1,FALSE))) -> 灵性精粹*5 | I39: buff_jingling | J39: 5
A40: 8 | B40: =IF(RC[-1]=R[-1]C[-1],R[-1]C+1,1) -> 6 | C40: =VLOOKUP(RC[-2],Sheet1!R3C14:R23C15,2,FALSE) -> 陨落流星 | D40: =IF(RC10=5,VLOOKUP(RC[-3],Sheet1!R3C9:R23C12,3,FALSE),IF(RC10=6,"22|23|24|25",VLOOKUP(Sheet1!R2C1,Sheet1!R2C1:R2C7,RC[6]+1,FALSE))) -> 22|23|24|25 | E40: =IF(RC10=6,VLOOKUP(RC1,Sheet1!R3C1:R23C7,RC10+1,FALSE)&"|"&VLOOKUP(RC1,Sheet1!R3C1:R23C7,RC10+1,FALSE)&"|"&VLOOKUP(RC1,Sheet1!R3C1:R23C7,RC10+1,FALSE)&"|"&VLOOKUP(RC1,Sheet1!R3C1:R23C7,RC10+1,FALSE),VLOOKUP(RC1,Sheet1!R3C1:R23C7,RC10+1,FALSE)) -> 200|200|200|200 | F40: =IF(RC[-2]=0,VLOOKUP(RC[-5],Sheet1!R3C9:R23C12,4,FALSE),0) -> 0 | G40: ="10020|"&VLOOKUP(RC[-6],Sheet1!R25C1:R44C7,RC[3]+1,FALSE) -> 10020|0 | H40: =IF(RC10=5,VLOOKUP(RC[-7],Sheet1!R3C9:R23C12,2,FALSE),IF(RC10=6,"出战英雄基础属性+"&VLOOKUP(RC1,Sheet1!R3C1:R23C7,RC10+1,FALSE)/100&"%","全体出战英雄"&VLOOKUP(Sheet1!R3C1,Sheet1!R2C1:R3C7,RC[2]+1,FALSE)&"+"&VLOOKUP(RC1,Sheet1!R3C1:R23C7,RC10+1,FALSE))) -> 出战英雄基础属性+2% | I40: buff_jingling | J40: 6
A41: 9 | B41: =IF(RC[-1]=R[-1]C[-1],R[-1]C+1,1) -> 1 | C41: =VLOOKUP(RC[-2],Sheet1!R3C14:R23C15,2,FALSE) -> 射线洪流 | D41: =IF(RC10=5,VLOOKUP(RC[-3],Sheet1!R3C9:R23C12,3,FALSE),IF(RC10=6,"22|23|24|25",VLOOKUP(Sheet1!R2C1,Sheet1!R2C1:R2C7,RC[6]+1,FALSE))) -> 4 | E41: =IF(RC10=6,VLOOKUP(RC1,Sheet1!R3C1:R23C7,RC10+1,FALSE)&"|"&VLOOKUP(RC1,Sheet1!R3C1:R23C7,RC10+1,FALSE)&"|"&VLOOKUP(RC1,Sheet1!R3C1:R23C7,RC10+1,FALSE)&"|"&VLOOKUP(RC1,Sheet1!R3C1:R23C7,RC10+1,FALSE),VLOOKUP(RC1,Sheet1!R3C1:R23C7,RC10+1,FALSE)) -> 584 | F41: =IF(RC[-2]=0,VLOOKUP(RC[-5],Sheet1!R3C9:R23C12,4,FALSE),0) -> 0 | G41: ="10020|"&VLOOKUP(RC[-6],Sheet1!R25C1:R44C7,RC[3]+1,FALSE) -> 10020|2 | H41: =IF(RC10=5,VLOOKUP(RC[-7],Sheet1!R3C9:R23C12,2,FALSE),IF(RC10=6,"出战英雄基础属性+"&VLOOKUP(RC1,Sheet1!R3C1:R23C7,RC10+1,FALSE)/100&"%","全体出战英雄"&VLOOKUP(Sheet1!R3C1,Sheet1!R2C1:R3C7,RC[2]+1,FALSE)&"+"&VLOOKUP(RC1,Sheet1!R3C1:R23C7,RC10+1,FALSE))) -> 全体出战英雄血量+584 | I41: buff_jingling | J41: 1
A42: 9 | B42: =IF(RC[-1]=R[-1]C[-1],R[-1]C+1,1) -> 2 | C42: =VLOOKUP(RC[-2],Sheet1!R3C14:R23C15,2,FALSE) -> 射线洪流 | D42: =IF(RC10=5,VLOOKUP(RC[-3],Sheet1!R3C9:R23C12,3,FALSE),IF(RC10=6,"22|23|24|25",VLOOKUP(Sheet1!R2C1,Sheet1!R2C1:R2C7,RC[6]+1,FALSE))) -> 1 | E42: =IF(RC10=6,VLOOKUP(RC1,Sheet1!R3C1:R23C7,RC10+1,FALSE)&"|"&VLOOKUP(RC1,Sheet1!R3C1:R23C7,RC10+1,FALSE)&"|"&VLOOKUP(RC1,Sheet1!R3C1:R23C7,RC10+1,FALSE)&"|"&VLOOKUP(RC1,Sheet1!R3C1:R23C7,RC10+1,FALSE),VLOOKUP(RC1,Sheet1!R3C1:R23C7,RC10+1,FALSE)) -> 58 | F42: =IF(RC[-2]=0,VLOOKUP(RC[-5],Sheet1!R3C9:R23C12,4,FALSE),0) -> 0 | G42: ="10020|"&VLOOKUP(RC[-6],Sheet1!R25C1:R44C7,RC[3]+1,FALSE) -> 10020|2 | H42: =IF(RC10=5,VLOOKUP(RC[-7],Sheet1!R3C9:R23C12,2,FALSE),IF(RC10=6,"出战英雄基础属性+"&VLOOKUP(RC1,Sheet1!R3C1:R23C7,RC10+1,FALSE)/100&"%","全体出战英雄"&VLOOKUP(Sheet1!R3C1,Sheet1!R2C1:R3C7,RC[2]+1,FALSE)&"+"&VLOOKUP(RC1,Sheet1!R3C1:R23C7,RC10+1,FALSE))) -> 全体出战英雄攻击+58 | I42: buff_jingling | J42: 2
A43: 9 | B43: =IF(RC[-1]=R[-1]C[-1],R[-1]C+1,1) -> 3 | C43: =VLOOKUP(RC[-2],Sheet1!R3C14:R23C15,2,FALSE) -> 射线洪流 | D43: =IF(RC10=5,VLOOKUP(RC[-3],Sheet1!R3C9:R23C12,3,FALSE),IF(RC10=6,"22|23|24|25",VLOOKUP(Sheet1!R2C1,Sheet1!R2C1:R2C7,RC[6]+1,FALSE))) -> 2 | E43: =IF(RC10=6,VLOOKUP(RC1,Sheet1!R3C1:R23C7,RC10+1,FALSE)&"|"&VLOOKUP(RC1,Sheet1!R3C1:R23C7,RC10+1,FALSE)&"|"&VLOOKUP(RC1,Sheet1!R3C1:R23C7,RC10+1,FALSE)&"|"&VLOOKUP(RC1,Sheet1!R3C1:R23C7,RC10+1,FALSE),VLOOKUP(RC1,Sheet1!R3C1:R23C7,RC10+1,FALSE)) -> 58 | F43: =IF(RC[-2]=0,VLOOKUP(RC[-5],Sheet1!R3C9:R23C12,4,FALSE),0) -> 0 | G43: ="10020|"&VLOOKUP(RC[-6],Sheet1!R25C1:R44C7,RC[3]+1,FALSE) -> 10020|2 | H43: =IF(RC10=5,VLOOKUP(RC[-7],Sheet1!R3C9:R23C12,2,FALSE),IF(RC10=6,"出战英雄基础属性+"&VLOOKUP(RC1,Sheet1!R3C1:R23C7,RC10+1,FALSE)/100&"%","全体出战英雄"&VLOOKUP(Sheet1!R3C1,Sheet1!R2C1:R3C7,RC[2]+1,FALSE)&"+"&VLOOKUP(RC1,Sheet1!R3C1:R23C7,RC10+1,FALSE))) -> 全体出战英雄物防+58 | I43: buff_jingling | J43: 3
A44: 9 | B44: =IF(RC[-1]=R[-1]C[-1],R[-1]C+1,1) -> 4 | C44: =VLOOKUP(RC[-2],Sheet1!R3C14:R23C15,2,FALSE) -> 射线洪流 | D44: =IF(RC10=5,VLOOKUP(RC[-3],Sheet1!R3C9:R23C12,3,FALSE),IF(RC10=6,"22|23|24|25",VLOOKUP(Sheet1!R2C1,Sheet1!R2C1:R2C7,RC[6]+1,FALSE))) -> 3 | E44: =IF(RC10=6,VLOOKUP(RC1,Sheet1!R3C1:R23C7,RC10+1,FALSE)&"|"&VLOOKUP(RC1,Sheet1!R3C1:R23C7,RC10+1,FALSE)&"|"&VLOOKUP(RC1,Sheet1!R3C1:R23C7,RC10+1,FALSE)&"|"&VLOOKUP(RC1,Sheet1!R3C1:R23C7,RC10+1,FALSE),VLOOKUP(RC1,Sheet1!R3C1:R23C7,RC10+1,FALSE)) -> 58 | F44: =IF(RC[-2]=0,VLOOKUP(RC[-5],Sheet1!R3C9:R23C12,4,FALSE),0) -> 0 | G44: ="10020|"&VLOOKUP(RC[-6],Sheet1!R25C1:R44C7,RC[3]+1,FALSE) -> 10020|2 | H44: =IF(RC10=5,VLOOKUP(RC[-7],Sheet1!R3C9:R23C12,2,FALSE),IF(RC10=6,"出战英雄基础属性+"&VLOOKUP(RC1,Sheet1!R3C1:R23C7,RC10+1,FALSE)/100&"%","全体出战英雄"&VLOOKUP(Sheet1!R3C1,Sheet1!R2C1:R3C7,RC[2]+1,FALSE)&"+"&VLOOKUP(RC1,Sheet1!R3C1:R23C7,RC10+1,FALSE))) -> 全体出战英雄魔防+58 | I44: buff_jingling | J44: 4
A45: 9 | B45: =IF(RC[-1]=R[-1]C[-1],R[-1]C+1,1) -> 5 | C45: =VLOOKUP(RC[-2],Sheet1!R3C14:R23C15,2,FALSE) -> 射线洪流 | D45: =IF(RC10=5,VLOOKUP(RC[-3],Sheet1!R3C9:R23C12,3,FALSE),IF(RC10=6,"22|23|24|25",VLOOKUP(Sheet1!R2C1,Sheet1!R2C1:R2C7,RC[6]+1,FALSE))) -> 21 | E45: =IF(RC10=6,VLOOKUP(RC1,Sheet1!R3C1:R23C7,RC10+1,FALSE)&"|"&VLOOKUP(RC1,Sheet1!R3C1:R23C7,RC10+1,FALSE)&"|"&VLOOKUP(RC1,Sheet1!R3C1:R23C7,RC10+1,FALSE)&"|"&VLOOKUP(RC1,Sheet1!R3C1:R23C7,RC10+1,FALSE),VLOOKUP(RC1,Sheet1!R3C1:R23C7,RC10+1,FALSE)) -> 5 | F45: =IF(RC[-2]=0,VLOOKUP(RC[-5],Sheet1!R3C9:R23C12,4,FALSE),0) -> 0 | G45: ="10020|"&VLOOKUP(RC[-6],Sheet1!R25C1:R44C7,RC[3]+1,FALSE) -> 10020|3 | H45: =IF(RC10=5,VLOOKUP(RC[-7],Sheet1!R3C9:R23C12,2,FALSE),IF(RC10=6,"出战英雄基础属性+"&VLOOKUP(RC1,Sheet1!R3C1:R23C7,RC10+1,FALSE)/100&"%","全体出战英雄"&VLOOKUP(Sheet1!R3C1,Sheet1!R2C1:R3C7,RC[2]+1,FALSE)&"+"&VLOOKUP(RC1,Sheet1!R3C1:R23C7,RC10+1,FALSE))) -> 全体出战英雄怒气+5 | I45: buff_jingling | J45: 5
A46: 9 | B46: =IF(RC[-1]=R[-1]C[-1],R[-1]C+1,1) -> 6 | C46: =VLOOKUP(RC[-2],Sheet1!R3C14:R23C15,2,FALSE) -> 射线洪流 | D46: =IF(RC10=5,VLOOKUP(RC[-3],Sheet1!R3C9:R23C12,3,FALSE),IF(RC10=6,"22|23|24|25",VLOOKUP(Sheet1!R2C1,Sheet1!R2C1:R2C7,RC[6]+1,FALSE))) -> 22|23|24|25 | E46: =IF(RC10=6,VLOOKUP(RC1,Sheet1!R3C1:R23C7,RC10+1,FALSE)&"|"&VLOOKUP(RC1,Sheet1!R3C1:R23C7,RC10+1,FALSE)&"|"&VLOOKUP(RC1,Sheet1!R3C1:R23C7,RC10+1,FALSE)&"|"&VLOOKUP(RC1,Sheet1!R3C1:R23C7,RC10+1,FALSE),VLOOKUP(RC1,Sheet1!R3C1:R23C7,RC10+1,FALSE)) -> 200|200|200|200 | F46: =IF(RC[-2]=0,VLOOKUP(RC[-5],Sheet1!R3C9:R23C12,4,FALSE),0) -> 0 | G46: ="10020|"&VLOOKUP(RC[-6],Sheet1!R25C1:R44C7,RC[3]+1,FALSE) -> 10020|0 | H46: =IF(RC10=5,VLOOKUP(RC[-7],Sheet1!R3C9:R23C12,2,FALSE),IF(RC10=6,"出战英雄基础属性+"&VLOOKUP(RC1,Sheet1!R3C1:R23C7,RC10+1,FALSE)/100&"%","全体出战英雄"&VLOOKUP(Sheet1!R3C1,Sheet1!R2C1:R3C7,RC[2]+1,FALSE)&"+"&VLOOKUP(RC1,Sheet1!R3C1:R23C7,RC10+1,FALSE))) -> 出战英雄基础属性+2% | I46: buff_jingling | J46: 6
A47: 10 | B47: =IF(RC[-1]=R[-1]C[-1],R[-1]C+1,1) -> 1 | C47: =VLOOKUP(RC[-2],Sheet1!R3C14:R23C15,2,FALSE) -> 起源元素 | D47: =IF(RC10=5,VLOOKUP(RC[-3],Sheet1!R3C9:R23C12,3,FALSE),IF(RC10=6,"22|23|24|25",VLOOKUP(Sheet1!R2C1,Sheet1!R2C1:R2C7,RC[6]+1,FALSE))) -> 4 | E47: =IF(RC10=6,VLOOKUP(RC1,Sheet1!R3C1:R23C7,RC10+1,FALSE)&"|"&VLOOKUP(RC1,Sheet1!R3C1:R23C7,RC10+1,FALSE)&"|"&VLOOKUP(RC1,Sheet1!R3C1:R23C7,RC10+1,FALSE)&"|"&VLOOKUP(RC1,Sheet1!R3C1:R23C7,RC10+1,FALSE),VLOOKUP(RC1,Sheet1!R3C1:R23C7,RC10+1,FALSE)) -> 625 | F47: =IF(RC[-2]=0,VLOOKUP(RC[-5],Sheet1!R3C9:R23C12,4,FALSE),0) -> 0 | G47: ="10020|"&VLOOKUP(RC[-6],Sheet1!R25C1:R44C7,RC[3]+1,FALSE) -> 10020|3 | H47: =IF(RC10=5,VLOOKUP(RC[-7],Sheet1!R3C9:R23C12,2,FALSE),IF(RC10=6,"出战英雄基础属性+"&VLOOKUP(RC1,Sheet1!R3C1:R23C7,RC10+1,FALSE)/100&"%","全体出战英雄"&VLOOKUP(Sheet1!R3C1,Sheet1!R2C1:R3C7,RC[2]+1,FALSE)&"+"&VLOOKUP(RC1,Sheet1!R3C1:R23C7,RC10+1,FALSE))) -> 全体出战英雄血量+625 | I47: buff_jingling | J47: 1
A48: 10 | B48: =IF(RC[-1]=R[-1]C[-1],R[-1]C+1,1) -> 2 | C48: =VLOOKUP(RC[-2],Sheet1!R3C14:R23C15,2,FALSE) -> 起源元素 | D48: =IF(RC10=5,VLOOKUP(RC[-3],Sheet1!R3C9:R23C12,3,FALSE),IF(RC10=6,"22|23|24|25",VLOOKUP(Sheet1!R2C1,Sheet1!R2C1:R2C7,RC[6]+1,FALSE))) -> 1 | E48: =IF(RC10=6,VLOOKUP(RC1,Sheet1!R3C1:R23C7,RC10+1,FALSE)&"|"&VLOOKUP(RC1,Sheet1!R3C1:R23C7,RC10+1,FALSE)&"|"&VLOOKUP(RC1,Sheet1!R3C1:R23C7,RC10+1,FALSE)&"|"&VLOOKUP(RC1,Sheet1!R3C1:R23C7,RC10+1,FALSE),VLOOKUP(RC1,Sheet1!R3C1:R23C7,RC10+1,FALSE)) -> 63 | F48: =IF(RC[-2]=0,VLOOKUP(RC[-5],Sheet1!R3C9:R23C12,4,FALSE),0) -> 0 | G48: ="10020|"&VLOOKUP(RC[-6],Sheet1!R25C1:R44C7,RC[3]+1,FALSE) -> 10020|3 | H48: =IF(RC10=5,VLOOKUP(RC[-7],Sheet1!R3C9:R23C12,2,FALSE),IF(RC10=6,"出战英雄基础属性+"&VLOOKUP(RC1,Sheet1!R3C1:R23C7,RC10+1,FALSE)/100&"%","全体出战英雄"&VLOOKUP(Sheet1!R3C1,Sheet1!R2C1:R3C7,RC[2]+1,FALSE)&"+"&VLOOKUP(RC1,Sheet1!R3C1:R23C7,RC10+1,FALSE))) -> 全体出战英雄攻击+63 | I48: buff_jingling | J48: 2
A49: 10 | B49: =IF(RC[-1]=R[-1]C[-1],R[-1]C+1,1) -> 3 | C49: =VLOOKUP(RC[-2],Sheet1!R3C14:R23C15,2,FALSE) -> 起源元素 | D49: =IF(RC10=5,VLOOKUP(RC[-3],Sheet1!R3C9:R23C12,3,FALSE),IF(RC10=6,"22|23|24|25",VLOOKUP(Sheet1!R2C1,Sheet1!R2C1:R2C7,RC[6]+1,FALSE))) -> 2 | E49: =IF(RC10=6,VLOOKUP(RC1,Sheet1!R3C1:R23C7,RC10+1,FALSE)&"|"&VLOOKUP(RC1,Sheet1!R3C1:R23C7,RC10+1,FALSE)&"|"&VLOOKUP(RC1,Sheet1!R3C1:R23C7,RC10+1,FALSE)&"|"&VLOOKUP(RC1,Sheet1!R3C1:R23C7,RC10+1,FALSE),VLOOKUP(RC1,Sheet1!R3C1:R23C7,RC10+1,FALSE)) -> 63 | F49: =IF(RC[-2]=0,VLOOKUP(RC[-5],Sheet1!R3C9:R23C12,4,FALSE),0) -> 0 | G49: ="10020|"&VLOOKUP(RC[-6],Sheet1!R25C1:R44C7,RC[3]+1,FALSE) -> 10020|3 | H49: =IF(RC10=5,VLOOKUP(RC[-7],Sheet1!R3C9:R23C12,2,FALSE),IF(RC10=6,"出战英雄基础属性+"&VLOOKUP(RC1,Sheet1!R3C1:R23C7,RC10+1,FALSE)/100&"%","全体出战英雄"&VLOOKUP(Sheet1!R3C1,Sheet1!R2C1:R3C7,RC[2]+1,FALSE)&"+"&VLOOKUP(RC1,Sheet1!R3C1:R23C7,RC10+1,FALSE))) -> 全体出战英雄物防+63 | I49: buff_jingling | J49: 3
A50: 10 | B50: =IF(RC[-1]=R[-1]C[-1],R[-1]C+1,1) -> 4 | C50: =VLOOKUP(RC[-2],Sheet1!R3C14:R23C15,2,FALSE) -> 起源元素 | D50: =IF(RC10=5,VLOOKUP(RC[-3],Sheet1!R3C9:R23C12,3,FALSE),IF(RC10=6,"22|23|24|25",VLOOKUP(Sheet1!R2C1,Sheet1!R2C1:R2C7,RC[6]+1,FALSE))) -> 3 | E50: =IF(RC10=6,VLOOKUP(RC1,Sheet1!R3C1:R23C7,RC10+1,FALSE)&"|"&VLOOKUP(RC1,Sheet1!R3C1:R23C7,RC10+1,FALSE)&"|"&VLOOKUP(RC1,Sheet1!R3C1:R23C7,RC10+1,FALSE)&"|"&VLOOKUP(RC1,Sheet1!R3C1:R23C7,RC10+1,FALSE),VLOOKUP(RC1,Sheet1!R3C1:R23C7,RC10+1,FALSE)) -> 63 | F50: =IF(RC[-2]=0,VLOOKUP(RC[-5],Sheet1!R3C9:R23C12,4,FALSE),0) -> 0 | G50: ="10020|"&VLOOKUP(RC[-6],Sheet1!R25C1:R44C7,RC[3]+1,FALSE) -> 10020|3 | H50: =IF(RC10=5,VLOOKUP(RC[-7],Sheet1!R3C9:R23C12,2,FALSE),IF(RC10=6,"出战英雄基础属性+"&VLOOKUP(RC1,Sheet1!R3C1:R23C7,RC10+1,FALSE)/100&"%","全体出战英雄"&VLOOKUP(Sheet1!R3C1,Sheet1!R2C1:R3C7,RC[2]+1,FALSE)&"+"&VLOOKUP(RC1,Sheet1!R3C1:R23C7,RC10+1,FALSE))) -> 全体出战英雄魔防+63 | I50: buff_jingling | J50: 4
A51: 10 | B51: =IF(RC[-1]=R[-1]C[-1],R[-1]C+1,1) -> 5 | C51: =VLOOKUP(RC[-2],Sheet1!R3C14:R23C15,2,FALSE) -> 起源元素 | D51: =IF(RC10=5,VLOOKUP(RC[-3],Sheet1!R3C9:R23C12,3,FALSE),IF(RC10=6,"22|23|24|25",VLOOKUP(Sheet1!R2C1,Sheet1!R2C1:R2C7,RC[6]+1,FALSE))) -> 0 | E51: =IF(RC10=6,VLOOKUP(RC1,Sheet1!R3C1:R23C7,RC10+1,FALSE)&"|"&VLOOKUP(RC1,Sheet1!R3C1:R23C7,RC10+1,FALSE)&"|"&VLOOKUP(RC1,Sheet1!R3C1:R23C7,RC10+1,FALSE)&"|"&VLOOKUP(RC1,Sheet1!R3C1:R23C7,RC10+1,FALSE),VLOOKUP(RC1,Sheet1!R3C1:R23C7,RC10+1,FALSE)) -> 0 | F51: =IF(RC[-2]=0,VLOOKUP(RC[-5],Sheet1!R3C9:R23C12,4,FALSE),0) -> 10022|10 | G51: ="10020|"&VLOOKUP(RC[-6],Sheet1!R25C1:R44C7,RC[3]+1,FALSE) -> 10020|4 | H51: =IF(RC10=5,VLOOKUP(RC[-7],Sheet1!R3C9:R23C12,2,FALSE),IF(RC10=6,"出战英雄基础属性+"&VLOOKUP(RC1,Sheet1!R3C1:R23C7,RC10+1,FALSE)/100&"%","全体出战英雄"&VLOOKUP(Sheet1!R3C1,Sheet1!R2C1:R3C7,RC[2]+1,FALSE)&"+"&VLOOKUP(RC1,Sheet1!R3C1:R23C7,RC10+1,FALSE))) -> 灵性精粹*10 | I51: buff_jingling | J51: 5
A52: 10 | B52: =IF(RC[-1]=R[-1]C[-1],R[-1]C+1,1) -> 6 | C52: =VLOOKUP(RC[-2],Sheet1!R3C14:R23C15,2,FALSE) -> 起源元素 | D52: =IF(RC10=5,VLOOKUP(RC[-3],Sheet1!R3C9:R23C12,3,FALSE),IF(RC10=6,"22|23|24|25",VLOOKUP(Sheet1!R2C1,Sheet1!R2C1:R2C7,RC[6]+1,FALSE))) -> 22|23|24|25 | E52: =IF(RC10=6,VLOOKUP(RC1,Sheet1!R3C1:R23C7,RC10+1,FALSE)&"|"&VLOOKUP(RC1,Sheet1!R3C1:R23C7,RC10+1,FALSE)&"|"&VLOOKUP(RC1,Sheet1!R3C1:R23C7,RC10+1,FALSE)&"|"&VLOOKUP(RC1,Sheet1!R3C1:R23C7,RC10+1,FALSE),VLOOKUP(RC1,Sheet1!R3C1:R23C7,RC10+1,FALSE)) -> 200|200|200|200 | F52: =IF(RC[-2]=0,VLOOKUP(RC[-5],Sheet1!R3C9:R23C12,4,FALSE),0) -> 0 | G52: ="10020|"&VLOOKUP(RC[-6],Sheet1!R25C1:R44C7,RC[3]+1,FALSE) -> 10020|0 | H52: =IF(RC10=5,VLOOKUP(RC[-7],Sheet1!R3C9:R23C12,2,FALSE),IF(RC10=6,"出战英雄基础属性+"&VLOOKUP(RC1,Sheet1!R3C1:R23C7,RC10+1,FALSE)/100&"%","全体出战英雄"&VLOOKUP(Sheet1!R3C1,Sheet1!R2C1:R3C7,RC[2]+1,FALSE)&"+"&VLOOKUP(RC1,Sheet1!R3C1:R23C7,RC10+1,FALSE))) -> 出战英雄基础属性+2% | I52: buff_jingling | J52: 6
A53: 11 | B53: =IF(RC[-1]=R[-1]C[-1],R[-1]C+1,1) -> 1 | C53: =VLOOKUP(RC[-2],Sheet1!R3C14:R23C15,2,FALSE) -> 星辰长河 | D53: =IF(RC10=5,VLOOKUP(RC[-3],Sheet1!R3C9:R23C12,3,FALSE),IF(RC10=6,"22|23|24|25",VLOOKUP(Sheet1!R2C1,Sheet1!R2C1:R2C7,RC[6]+1,FALSE))) -> 4 | E53: =IF(RC10=6,VLOOKUP(RC1,Sheet1!R3C1:R23C7,RC10+1,FALSE)&"|"&VLOOKUP(RC1,Sheet1!R3C1:R23C7,RC10+1,FALSE)&"|"&VLOOKUP(RC1,Sheet1!R3C1:R23C7,RC10+1,FALSE)&"|"&VLOOKUP(RC1,Sheet1!R3C1:R23C7,RC10+1,FALSE),VLOOKUP(RC1,Sheet1!R3C1:R23C7,RC10+1,FALSE)) -> 667 | F53: =IF(RC[-2]=0,VLOOKUP(RC[-5],Sheet1!R3C9:R23C12,4,FALSE),0) -> 0 | G53: ="10020|"&VLOOKUP(RC[-6],Sheet1!R25C1:R44C7,RC[3]+1,FALSE) -> 10020|3 | H53: =IF(RC10=5,VLOOKUP(RC[-7],Sheet1!R3C9:R23C12,2,FALSE),IF(RC10=6,"出战英雄基础属性+"&VLOOKUP(RC1,Sheet1!R3C1:R23C7,RC10+1,FALSE)/100&"%","全体出战英雄"&VLOOKUP(Sheet1!R3C1,Sheet1!R2C1:R3C7,RC[2]+1,FALSE)&"+"&VLOOKUP(RC1,Sheet1!R3C1:R23C7,RC10+1,FALSE))) -> 全体出战英雄血量+667 | I53: buff_jingling | J53: 1
A54: 11 | B54: =IF(RC[-1]=R[-1]C[-1],R[-1]C+1,1) -> 2 | C54: =VLOOKUP(RC[-2],Sheet1!R3C14:R23C15,2,FALSE) -> 星辰长河 | D54: =IF(RC10=5,VLOOKUP(RC[-3],Sheet1!R3C9:R23C12,3,FALSE),IF(RC10=6,"22|23|24|25",VLOOKUP(Sheet1!R2C1,Sheet1!R2C1:R2C7,RC[6]+1,FALSE))) -> 1 | E54: =IF(RC10=6,VLOOKUP(RC1,Sheet1!R3C1:R23C7,RC10+1,FALSE)&"|"&VLOOKUP(RC1,Sheet1!R3C1:R23C7,RC10+1,FALSE)&"|"&VLOOKUP(RC1,Sheet1!R3C1:R23C7,RC10+1,FALSE)&"|"&VLOOKUP(RC1,Sheet1!R3C1:R23C7,RC10+1,FALSE),VLOOKUP(RC1,Sheet1!R3C1:R23C7,RC10+1,FALSE)) -> 67 | F54: =IF(RC[-2]=0,VLOOKUP(RC[-5],Sheet1!R3C9:R23C12,4,FALSE),0) -> 0 | G54: ="10020|"&VLOOKUP(RC[-6],Sheet1!R25C1:R44C7,RC[3]+1,FALSE) -> 10020|3 | H54: =IF(RC10=5,VLOOKUP(RC[-7],Sheet1!R3C9:R23C12,2,FALSE),IF(RC10=6,"出战英雄基础属性+"&VLOOKUP(RC1,Sheet1!R3C1:R23C7,RC10+1,FALSE)/100&"%","全体出战英雄"&VLOOKUP(Sheet1!R3C1,Sheet1!R2C1:R3C7,RC[2]+1,FALSE)&"+"&VLOOKUP(RC1,Sheet1!R3C1:R23C7,RC10+1,FALSE))) -> 全体出战英雄攻击+67 | I54: buff_jingling | J54: 2
A55: 11 | B55: =IF(RC[-1]=R[-1]C[-1],R[-1]C+1,1) -> 3 | C55: =VLOOKUP(RC[-2],Sheet1!R3C14:R23C15,2,FALSE) -> 星辰长河 | D55: =IF(RC10=5,VLOOKUP(RC[-3],Sheet1!R3C9:R23C12,3,FALSE),IF(RC10=6,"22|23|24|25",VLOOKUP(Sheet1!R2C1,Sheet1!R2C1:R2C7,RC[6]+1,FALSE))) -> 2 | E55: =IF(RC10=6,VLOOKUP(RC1,Sheet1!R3C1:R23C7,RC10+1,FALSE)&"|"&VLOOKUP(RC1,Sheet1!R3C1:R23C7,RC10+1,FALSE)&"|"&VLOOKUP(RC1,Sheet1!R3C1:R23C7,RC10+1,FALSE)&"|"&VLOOKUP(RC1,Sheet1!R3C1:R23C7,RC10+1,FALSE),VLOOKUP(RC1,Sheet1!R3C1:R23C7,RC10+1,FALSE)) -> 67 | F55: =IF(RC[-2]=0,VLOOKUP(RC[-5],Sheet1!R3C9:R23C12,4,FALSE),0) -> 0 | G55: ="10020|"&VLOOKUP(RC[-6],Sheet1!R25C1:R44C7,RC[3]+1,FALSE) -> 10020|3 | H55: =IF(RC10=5,VLOOKUP(RC[-7],Sheet1!R3C9:R23C12,2,FALSE),IF(RC10=6,"出战英雄基础属性+"&VLOOKUP(RC1,Sheet1!R3C1:R23C7,RC10+1,FALSE)/100&"%","全体出战英雄"&VLOOKUP(Sheet1!R3C1,Sheet1!R2C1:R3C7,RC[2]+1,FALSE)&"+"&VLOOKUP(RC1,Sheet1!R3C1:R23C7,RC10+1,FALSE))) -> 全体出战英雄物防+67 | I55: buff_jingling | J55: 3
A56: 11 | B56: =IF(RC[-1]=R[-1]C[-1],R[-1]C+1,1) -> 4 | C56: =VLOOKUP(RC[-2],Sheet1!R3C14:R23C15,2,FALSE) -> 星辰长河 | D56: =IF(RC10=5,VLOOKUP(RC[-3],Sheet1!R3C9:R23C12,3,FALSE),IF(RC10=6,"22|23|24|25",VLOOKUP(Sheet1!R2C1,Sheet1!R2C1:R2C7,RC[6]+1,FALSE))) -> 3 | E56: =IF(RC10=6,VLOOKUP(RC1,Sheet1!R3C1:R23C7,RC10+1,FALSE)&"|"&VLOOKUP(RC1,Sheet1!R3C1:R23C7,RC10+1,FALSE)&"|"&VLOOKUP(RC1,Sheet1!R3C1:R23C7,RC10+1,FALSE)&"|"&VLOOKUP(RC1,Sheet1!R3C1:R23C7,RC10+1,FALSE),VLOOKUP(RC1,Sheet1!R3C1:R23C7,RC10+1,FALSE)) -> 67 | F56: =IF(RC[-2]=0,VLOOKUP(RC[-5],Sheet1!R3C9:R23C12,4,FALSE),0) -> 0 | G56: ="10020|"&VLOOKUP(RC[-6],Sheet1!R25C1:R44C7,RC[3]+1,FALSE) -> 10020|3 | H56: =IF(RC10=5,VLOOKUP(RC[-7],Sheet1!R3C9:R23C12,2,FALSE),IF(RC10=6,"出战英雄基础属性+"&VLOOKUP(RC1,Sheet1!R3C1:R23C7,RC10+1,FALSE)/100&"%","全体出战英雄"&VLOOKUP(Sheet1!R3C1,Sheet1!R2C1:R3C7,RC[2]+1,FALSE)&"+"&VLOOKUP(RC1,Sheet1!R3C1:R23C7,RC10+1,FALSE))) -> 全体出战英雄魔防+67 | I56: buff_jingling | J56: 4
A57: 11 | B57: =IF(RC[-1]=R[-1]C[-1],R[-1]C+1,1) -> 5 | C57: =VLOOKUP(RC[-2],Sheet1!R3C14:R23C15,2,FALSE) -> 星辰长河 | D57: =IF(RC10=5,VLOOKUP(RC[-3],Sheet1!R3C9:R23C12,3,FALSE),IF(RC10=6,"22|23|24|25",VLOOKUP(Sheet1!R2C1,Sheet1!R2C1:R2C7,RC[6]+1,FALSE))) -> 0 | E57: =IF(RC10=6,VLOOKUP(RC1,Sheet1!R3C1:R23C7,RC10+1,FALSE)&"|"&VLOOKUP(RC1,Sheet1!R3C1:R23C7,RC10+1,FALSE)&"|"&VLOOKUP(RC1,Sheet1!R3C1:R23C7,RC10+1,FALSE)&"|"&VLOOKUP(RC1,Sheet1!R3C1:R23C7,RC10+1,FALSE),VLOOKUP(RC1,Sheet1!R3C1:R23C7,RC10+1,FALSE)) -> 0 | F57: =IF(RC[-2]=0,VLOOKUP(RC[-5],Sheet1!R3C9:R23C12,4,FALSE),0) -> 10022|10 | G57: ="10020|"&VLOOKUP(RC[-6],Sheet1!R25C1:R44C7,RC[3]+1,FALSE) -> 10020|4 | H57: =IF(RC10=5,VLOOKUP(RC[-7],Sheet1!R3C9:R23C12,2,FALSE),IF(RC10=6,"出战英雄基础属性+"&VLOOKUP(RC1,Sheet1!R3C1:R23C7,RC10+1,FALSE)/100&"%","全体出战英雄"&VLOOKUP(Sheet1!R3C1,Sheet1!R2C1:R3C7,RC[2]+1,FALSE)&"+"&VLOOKUP(RC1,Sheet1!R3C1:R23C7,RC10+1,FALSE))) -> 灵性精粹*10 | I57: buff_jingling | J57: 5
A58: 11 | B58: =IF(RC[-1]=R[-1]C[-1],R[-1]C+1,1) -> 6 | C58: =VLOOKUP(RC[-2],Sheet1!R3C14:R23C15,2,FALSE) -> 星辰长河 | D58: =IF(RC10=5,VLOOKUP(RC[-3],Sheet1!R3C9:R23C12,3,FALSE),IF(RC10=6,"22|23|24|25",VLOOKUP(Sheet1!R2C1,Sheet1!R2C1:R2C7,RC[6]+1,FALSE))) -> 22|23|24|25 | E58: =IF(RC10=6,VLOOKUP(RC1,Sheet1!R3C1:R23C7,RC10+1,FALSE)&"|"&VLOOKUP(RC1,Sheet1!R3C1:R23C7,RC10+1,FALSE)&"|"&VLOOKUP(RC1,Sheet1!R3C1:R23C7,RC10+1,FALSE)&"|"&VLOOKUP(RC1,Sheet1!R3C1:R23C7,RC10+1,FALSE),VLOOKUP(RC1,Sheet1!R3C1:R23C7,RC10+1,FALSE)) -> 300|300|300|300 | F58: =IF(RC[-2]=0,VLOOKUP(RC[-5],Sheet1!R3C9:R23C12,4,FALSE),0) -> 0 | G58: ="10020|"&VLOOKUP(RC[-6],Sheet1!R25C1:R44C7,RC[3]+1,FALSE) -> 10020|0 | H58: =IF(RC10=5,VLOOKUP(RC[-7],Sheet1!R3C9:R23C12,2,FALSE),IF(RC10=6,"出战英雄基础属性+"&VLOOKUP(RC1,Sheet1!R3C1:R23C7,RC10+1,FALSE)/100&"%","全体出战英雄"&VLOOKUP(Sheet1!R3C1,Sheet1!R2C1:R3C7,RC[2]+1,FALSE)&"+"&VLOOKUP(RC1,Sheet1!R3C1:R23C7,RC10+1,FALSE))) -> 出战英雄基础属性+3% | I58: buff_jingling | J58: 6
A59: 12 | B59: =IF(RC[-1]=R[-1]C[-1],R[-1]C+1,1) -> 1 | C59: =VLOOKUP(RC[-2],Sheet1!R3C14:R23C15,2,FALSE) -> 星空巨兽 | D59: =IF(RC10=5,VLOOKUP(RC[-3],Sheet1!R3C9:R23C12,3,FALSE),IF(RC10=6,"22|23|24|25",VLOOKUP(Sheet1!R2C1,Sheet1!R2C1:R2C7,RC[6]+1,FALSE))) -> 4 | E59: =IF(RC10=6,VLOOKUP(RC1,Sheet1!R3C1:R23C7,RC10+1,FALSE)&"|"&VLOOKUP(RC1,Sheet1!R3C1:R23C7,RC10+1,FALSE)&"|"&VLOOKUP(RC1,Sheet1!R3C1:R23C7,RC10+1,FALSE)&"|"&VLOOKUP(RC1,Sheet1!R3C1:R23C7,RC10+1,FALSE),VLOOKUP(RC1,Sheet1!R3C1:R23C7,RC10+1,FALSE)) -> 709 | F59: =IF(RC[-2]=0,VLOOKUP(RC[-5],Sheet1!R3C9:R23C12,4,FALSE),0) -> 0 | G59: ="10020|"&VLOOKUP(RC[-6],Sheet1!R25C1:R44C7,RC[3]+1,FALSE) -> 10020|3 | H59: =IF(RC10=5,VLOOKUP(RC[-7],Sheet1!R3C9:R23C12,2,FALSE),IF(RC10=6,"出战英雄基础属性+"&VLOOKUP(RC1,Sheet1!R3C1:R23C7,RC10+1,FALSE)/100&"%","全体出战英雄"&VLOOKUP(Sheet1!R3C1,Sheet1!R2C1:R3C7,RC[2]+1,FALSE)&"+"&VLOOKUP(RC1,Sheet1!R3C1:R23C7,RC10+1,FALSE))) -> 全体出战英雄血量+709 | I59: buff_jingling | J59: 1
A60: 12 | B60: =IF(RC[-1]=R[-1]C[-1],R[-1]C+1,1) -> 2 | C60: =VLOOKUP(RC[-2],Sheet1!R3C14:R23C15,2,FALSE) -> 星空巨兽 | D60: =IF(RC10=5,VLOOKUP(RC[-3],Sheet1!R3C9:R23C12,3,FALSE),IF(RC10=6,"22|23|24|25",VLOOKUP(Sheet1!R2C1,Sheet1!R2C1:R2C7,RC[6]+1,FALSE))) -> 1 | E60: =IF(RC10=6,VLOOKUP(RC1,Sheet1!R3C1:R23C7,RC10+1,FALSE)&"|"&VLOOKUP(RC1,Sheet1!R3C1:R23C7,RC10+1,FALSE)&"|"&VLOOKUP(RC1,Sheet1!R3C1:R23C7,RC10+1,FALSE)&"|"&VLOOKUP(RC1,Sheet1!R3C1:R23C7,RC10+1,FALSE),VLOOKUP(RC1,Sheet1!R3C1:R23C7,RC10+1,FALSE)) -> 71 | F60: =IF(RC[-2]=0,VLOOKUP(RC[-5],Sheet1!R3C9:R23C12,4,FALSE),0) -> 0 | G60: ="10020|"&VLOOKUP(RC[-6],Sheet1!R25C1:R44C7,RC[3]+1,FALSE) -> 10020|3 | H60: =IF(RC10=5,VLOOKUP(RC[-7],Sheet1!R3C9:R23C12,2,FALSE),IF(RC10=6,"出战英雄基础属性+"&VLOOKUP(RC1,Sheet1!R3C1:R23C7,RC10+1,FALSE)/100&"%","全体出战英雄"&VLOOKUP(Sheet1!R3C1,Sheet1!R2C1:R3C7,RC[2]+1,FALSE)&"+"&VLOOKUP(RC1,Sheet1!R3C1:R23C7,RC10+1,FALSE))) -> 全体出战英雄攻击+71 | I60: buff_jingling | J60: 2
A61: 12 | B61: =IF(RC[-1]=R[-1]C[-1],R[-1]C+1,1) -> 3 | C61: =VLOOKUP(RC[-2],Sheet1!R3C14:R23C15,2,FALSE) -> 星空巨兽 | D61: =IF(RC10=5,VLOOKUP(RC[-3],Sheet1!R3C9:R23C12,3,FALSE),IF(RC10=6,"22|23|24|25",VLOOKUP(Sheet1!R2C1,Sheet1!R2C1:R2C7,RC[6]+1,FALSE))) -> 2 | E61: =IF(RC10=6,VLOOKUP(RC1,Sheet1!R3C1:R23C7,RC10+1,FALSE)&"|"&VLOOKUP(RC1,Sheet1!R3C1:R23C7,RC10+1,FALSE)&"|"&VLOOKUP(RC1,Sheet1!R3C1:R23C7,RC10+1,FALSE)&"|"&VLOOKUP(RC1,Sheet1!R3C1:R23C7,RC10+1,FALSE),VLOOKUP(RC1,Sheet1!R3C1:R23C7,RC10+1,FALSE)) -> 71 | F61: =IF(RC[-2]=0,VLOOKUP(RC[-5],Sheet1!R3C9:R23C12,4,FALSE),0) -> 0 | G61: ="10020|"&VLOOKUP(RC[-6],Sheet1!R25C1:R44C7,RC[3]+1,FALSE) -> 10020|3 | H61: =IF(RC10=5,VLOOKUP(RC[-7],Sheet1!R3C9:R23C12,2,FALSE),IF(RC10=6,"出战英雄基础属性+"&VLOOKUP(RC1,Sheet1!R3C1:R23C7,RC10+1,FALSE)/100&"%","全体出战英雄"&VLOOKUP(Sheet1!R3C1,Sheet1!R2C1:R3C7,RC[2]+1,FALSE)&"+"&VLOOKUP(RC1,Sheet1!R3C1:R23C7,RC10+1,FALSE))) -> 全体出战英雄物防+71 | I61: buff_jingling | J61: 3
A62: 12 | B62: =IF(RC[-1]=R[-1]C[-1],R[-1]C+1,1) -> 4 | C62: =VLOOKUP(RC[-2],Sheet1!R3C14:R23C15,2,FALSE) -> 星空巨兽 | D62: =IF(RC10=5,VLOOKUP(RC[-3],Sheet1!R3C9:R23C12,3,FALSE),IF(RC10=6,"22|23|24|25",VLOOKUP(Sheet1!R2C1,Sheet1!R2C1:R2C7,RC[6]+1,FALSE))) -> 3 | E62: =IF(RC10=6,VLOOKUP(RC1,Sheet1!R3C1:R23C7,RC10+1,FALSE)&"|"&VLOOKUP(RC1,Sheet1!R3C1:R23C7,RC10+1,FALSE)&"|"&VLOOKUP(RC1,Sheet1!R3C1:R23C7,RC10+1,FALSE)&"|"&VLOOKUP(RC1,Sheet1!R3C1:R23C7,RC10+1,FALSE),VLOOKUP(RC1,Sheet1!R3C1:R23C7,RC10+1,FALSE)) -> 71 | F62: =IF(RC[-2]=0,VLOOKUP(RC[-5],Sheet1!R3C9:R23C12,4,FALSE),0) -> 0 | G62: ="10020|"&VLOOKUP(RC[-6],Sheet1!R25C1:R44C7,RC[3]+1,FALSE) -> 10020|3 | H62: =IF(RC10=5,VLOOKUP(RC[-7],Sheet1!R3C9:R23C12,2,FALSE),IF(RC10=6,"出战英雄基础属性+"&VLOOKUP(RC1,Sheet1!R3C1:R23C7,RC10+1,FALSE)/100&"%","全体出战英雄"&VLOOKUP(Sheet1!R3C1,Sheet1!R2C1:R3C7,RC[2]+1,FALSE)&"+"&VLOOKUP(RC1,Sheet1!R3C1:R23C7,RC10+1,FALSE))) -> 全体出战英雄魔防+71 | I62: buff_jingling | J62: 4
A63: 12 | B63: =IF(RC[-1]=R[-1]C[-1],R[-1]C+1,1) -> 5 | C63: =VLOOKUP(RC[-2],Sheet1!R3C14:R23C15,2,FALSE) -> 星空巨兽 | D63: =IF(RC10=5,VLOOKUP(RC[-3],Sheet1!R3C9:R23C12,3,FALSE),IF(RC10=6,"22|23|24|25",VLOOKUP(Sheet1!R2C1,Sheet1!R2C1:R2C7,RC[6]+1,FALSE))) -> 0 | E63: =IF(RC10=6,VLOOKUP(RC1,Sheet1!R3C1:R23C7,RC10+1,FALSE)&"|"&VLOOKUP(RC1,Sheet1!R3C1:R23C7,RC10+1,FALSE)&"|"&VLOOKUP(RC1,Sheet1!R3C1:R23C7,RC10+1,FALSE)&"|"&VLOOKUP(RC1,Sheet1!R3C1:R23C7,RC10+1,FALSE),VLOOKUP(RC1,Sheet1!R3C1:R23C7,RC10+1,FALSE)) -> 0 | F63: =IF(RC[-2]=0,VLOOKUP(RC[-5],Sheet1!R3C9:R23C12,4,FALSE),0) -> 10022|10 | G63: ="10020|"&VLOOKUP(RC[-6],Sheet1!R25C1:R44C7,RC[3]+1,FALSE) -> 10020|4 | H63: =IF(RC10=5,VLOOKUP(RC[-7],Sheet1!R3C9:R23C12,2,FALSE),IF(RC10=6,"出战英雄基础属性+"&VLOOKUP(RC1,Sheet1!R3C1:R23C7,RC10+1,FALSE)/100&"%","全体出战英雄"&VLOOKUP(Sheet1!R3C1,Sheet1!R2C1:R3C7,RC[2]+1,FALSE)&"+"&VLOOKUP(RC1,Sheet1!R3C1:R23C7,RC10+1,FALSE))) -> 灵性精粹*10 | I63: buff_jingling | J63: 5
A64: 12 | B64: =IF(RC[-1]=R[-1]C[-1],R[-1]C+1,1) -> 6 | C64: =VLOOKUP(RC[-2],Sheet1!R3C14:R23C15,2,FALSE) -> 星空巨兽 | D64: =IF(RC10=5,VLOOKUP(RC[-3],Sheet1!R3C9:R23C12,3,FALSE),IF(RC10=6,"22|23|24|25",VLOOKUP(Sheet1!R2C1,Sheet1!R2C1:R2C7,RC[6]+1,FALSE))) -> 22|23|24|25 | E64: =IF(RC10=6,VLOOKUP(RC1,Sheet1!R3C1:R23C7,RC10+1,FALSE)&"|"&VLOOKUP(RC1,Sheet1!R3C1:R23C7,RC10+1,FALSE)&"|"&VLOOKUP(RC1,Sheet1!R3C1:R23C7,RC10+1,FALSE)&"|"&VLOOKUP(RC1,Sheet1!R3C1:R23C7,RC10+1,FALSE),VLOOKUP(RC1,Sheet1!R3C1:R23C7,RC10+1,FALSE)) -> 300|300|300|300 | F64: =IF(RC[-2]=0,VLOOKUP(RC[-5],Sheet1!R3C9:R23C12,4,FALSE),0) -> 0 | G64: ="10020|"&VLOOKUP(RC[-6],Sheet1!R25C1:R44C7,RC[3]+1,FALSE) -> 10020|0 | H64: =IF(RC10=5,VLOOKUP(RC[-7],Sheet1!R3C9:R23C12,2,FALSE),IF(RC10=6,"出战英雄基础属性+"&VLOOKUP(RC1,Sheet1!R3C1:R23C7,RC10+1,FALSE)/100&"%","全体出战英雄"&VLOOKUP(Sheet1!R3C1,Sheet1!R2C1:R3C7,RC[2]+1,FALSE)&"+"&VLOOKUP(RC1,Sheet1!R3C1:R23C7,RC10+1,FALSE))) -> 出战英雄基础属性+3% | I64: buff_jingling | J64: 6
A65: 13 | B65: =IF(RC[-1]=R[-1]C[-1],R[-1]C+1,1) -> 1 | C65: =VLOOKUP(RC[-2],Sheet1!R3C14:R23C15,2,FALSE) -> 黑暗星域 | D65: =IF(RC10=5,VLOOKUP(RC[-3],Sheet1!R3C9:R23C12,3,FALSE),IF(RC10=6,"22|23|24|25",VLOOKUP(Sheet1!R2C1,Sheet1!R2C1:R2C7,RC[6]+1,FALSE))) -> 4 | E65: =IF(RC10=6,VLOOKUP(RC1,Sheet1!R3C1:R23C7,RC10+1,FALSE)&"|"&VLOOKUP(RC1,Sheet1!R3C1:R23C7,RC10+1,FALSE)&"|"&VLOOKUP(RC1,Sheet1!R3C1:R23C7,RC10+1,FALSE)&"|"&VLOOKUP(RC1,Sheet1!R3C1:R23C7,RC10+1,FALSE),VLOOKUP(RC1,Sheet1!R3C1:R23C7,RC10+1,FALSE)) -> 750 | F65: =IF(RC[-2]=0,VLOOKUP(RC[-5],Sheet1!R3C9:R23C12,4,FALSE),0) -> 0 | G65: ="10020|"&VLOOKUP(RC[-6],Sheet1!R25C1:R44C7,RC[3]+1,FALSE) -> 10020|4 | H65: =IF(RC10=5,VLOOKUP(RC[-7],Sheet1!R3C9:R23C12,2,FALSE),IF(RC10=6,"出战英雄基础属性+"&VLOOKUP(RC1,Sheet1!R3C1:R23C7,RC10+1,FALSE)/100&"%","全体出战英雄"&VLOOKUP(Sheet1!R3C1,Sheet1!R2C1:R3C7,RC[2]+1,FALSE)&"+"&VLOOKUP(RC1,Sheet1!R3C1:R23C7,RC10+1,FALSE))) -> 全体出战英雄血量+750 | I65: buff_jingling | J65: 1
A66: 13 | B66: =IF(RC[-1]=R[-1]C[-1],R[-1]C+1,1) -> 2 | C66: =VLOOKUP(RC[-2],Sheet1!R3C14:R23C15,2,FALSE) -> 黑暗星域 | D66: =IF(RC10=5,VLOOKUP(RC[-3],Sheet1!R3C9:R23C12,3,FALSE),IF(RC10=6,"22|23|24|25",VLOOKUP(Sheet1!R2C1,Sheet1!R2C1:R2C7,RC[6]+1,FALSE))) -> 1 | E66: =IF(RC10=6,VLOOKUP(RC1,Sheet1!R3C1:R23C7,RC10+1,FALSE)&"|"&VLOOKUP(RC1,Sheet1!R3C1:R23C7,RC10+1,FALSE)&"|"&VLOOKUP(RC1,Sheet1!R3C1:R23C7,RC10+1,FALSE)&"|"&VLOOKUP(RC1,Sheet1!R3C1:R23C7,RC10+1,FALSE),VLOOKUP(RC1,Sheet1!R3C1:R23C7,RC10+1,FALSE)) -> 75 | F66: =IF(RC[-2]=0,VLOOKUP(RC[-5],Sheet1!R3C9:R23C12,4,FALSE),0) -> 0 | G66: ="10020|"&VLOOKUP(RC[-6],Sheet1!R25C1:R44C7,RC[3]+1,FALSE) -> 10020|4 | H66: =IF(RC10=5,VLOOKUP(RC[-7],Sheet1!R3C9:R23C12,2,FALSE),IF(RC10=6,"出战英雄基础属性+"&VLOOKUP(RC1,Sheet1!R3C1:R23C7,RC10+1,FALSE)/100&"%","全体出战英雄"&VLOOKUP(Sheet1!R3C1,Sheet1!R2C1:R3C7,RC[2]+1,FALSE)&"+"&VLOOKUP(RC1,Sheet1!R3C1:R23C7,RC10+1,FALSE))) -> 全体出战英雄攻击+75 | I66: buff_jingling | J66: 2
A67: 13 | B67: =IF(RC[-1]=R[-1]C[-1],R[-1]C+1,1) -> 3 | C67: =VLOOKUP(RC[-2],Sheet1!R3C14:R23C15,2,FALSE) -> 黑暗星域 | D67: =IF(RC10=5,VLOOKUP(RC[-3],Sheet1!R3C9:R23C12,3,FALSE),IF(RC10=6,"22|23|24|25",VLOOKUP(Sheet1!R2C1,Sheet1!R2C1:R2C7,RC[6]+1,FALSE))) -> 2 | E67: =IF(RC10=6,VLOOKUP(RC1,Sheet1!R3C1:R23C7,RC10+1,FALSE)&"|"&VLOOKUP(RC1,Sheet1!R3C1:R23C7,RC10+1,FALSE)&"|"&VLOOKUP(RC1,Sheet1!R3C1:R23C7,RC10+1,FALSE)&"|"&VLOOKUP(RC1,Sheet1!R3C1:R23C7,RC10+1,FALSE),VLOOKUP(RC1,Sheet1!R3C1:R23C7,RC10+1,FALSE)) -> 75 | F67: =IF(RC[-2]=0,VLOOKUP(RC[-5],Sheet1!R3C9:R23C12,4,FALSE),0) -> 0 | G67: ="10020|"&VLOOKUP(RC[-6],Sheet1!R25C1:R44C7,RC[3]+1,FALSE) -> 10020|4 | H67: =IF(RC10=5,VLOOKUP(RC[-7],Sheet1!R3C9:R23C12,2,FALSE),IF(RC10=6,"出战英雄基础属性+"&VLOOKUP(RC1,Sheet1!R3C1:R23C7,RC10+1,FALSE)/100&"%","全体出战英雄"&VLOOKUP(Sheet1!R3C1,Sheet1!R2C1:R3C7,RC[2]+1,FALSE)&"+"&VLOOKUP(RC1,Sheet1!R3C1:R23C7,RC10+1,FALSE))) -> 全体出战英雄物防+75 | I67: buff_jingling | J67: 3
A68: 13 | B68: =IF(RC[-1]=R[-1]C[-1],R[-1]C+1,1) -> 4 | C68: =VLOOKUP(RC[-2],Sheet1!R3C14:R23C15,2,FALSE) -> 黑暗星域 | D68: =IF(RC10=5,VLOOKUP(RC[-3],Sheet1!R3C9:R23C12,3,FALSE),IF(RC10=6,"22|23|24|25",VLOOKUP(Sheet1!R2C1,Sheet1!R2C1:R2C7,RC[6]+1,FALSE))) -> 3 | E68: =IF(RC10=6,VLOOKUP(RC1,Sheet1!R3C1:R23C7,RC10+1,FALSE)&"|"&VLOOKUP(RC1,Sheet1!R3C1:R23C7,RC10+1,FALSE)&"|"&VLOOKUP(RC1,Sheet1!R3C1:R23C7,RC10+1,FALSE)&"|"&VLOOKUP(RC1,Sheet1!R3C1:R23C7,RC10+1,FALSE),VLOOKUP(RC1,Sheet1!R3C1:R23C7,RC10+1,FALSE)) -> 75 | F68: =IF(RC[-2]=0,VLOOKUP(RC[-5],Sheet1!R3C9:R23C12,4,FALSE),0) -> 0 | G68: ="10020|"&VLOOKUP(RC[-6],Sheet1!R25C1:R44C7,RC[3]+1,FALSE) -> 10020|4 | H68: =IF(RC10=5,VLOOKUP(RC[-7],Sheet1!R3C9:R23C12,2,FALSE),IF(RC10=6,"出战英雄基础属性+"&VLOOKUP(RC1,Sheet1!R3C1:R23C7,RC10+1,FALSE)/100&"%","全体出战英雄"&VLOOKUP(Sheet1!R3C1,Sheet1!R2C1:R3C7,RC[2]+1,FALSE)&"+"&VLOOKUP(RC1,Sheet1!R3C1:R23C7,RC10+1,FALSE))) -> 全体出战英雄魔防+75 | I68: buff_jingling | J68: 4
A69: 13 | B69: =IF(RC[-1]=R[-1]C[-1],R[-1]C+1,1) -> 5 | C69: =VLOOKUP(RC[-2],Sheet1!R3C14:R23C15,2,FALSE) -> 黑暗星域 | D69: =IF(RC10=5,VLOOKUP(RC[-3],Sheet1!R3C9:R23C12,3,FALSE),IF(RC10=6,"22|23|24|25",VLOOKUP(Sheet1!R2C1,Sheet1!R2C1:R2C7,RC[6]+1,FALSE))) -> 21 | E69: =IF(RC10=6,VLOOKUP(RC1,Sheet1!R3C1:R23C7,RC10+1,FALSE)&"|"&VLOOKUP(RC1,Sheet1!R3C1:R23C7,RC10+1,FALSE)&"|"&VLOOKUP(RC1,Sheet1!R3C1:R23C7,RC10+1,FALSE)&"|"&VLOOKUP(RC1,Sheet1!R3C1:R23C7,RC10+1,FALSE),VLOOKUP(RC1,Sheet1!R3C1:R23C7,RC10+1,FALSE)) -> 5 | F69: =IF(RC[-2]=0,VLOOKUP(RC[-5],Sheet1!R3C9:R23C12,4,FALSE),0) -> 0 | G69: ="10020|"&VLOOKUP(RC[-6],Sheet1!R25C1:R44C7,RC[3]+1,FALSE) -> 10020|5 | H69: =IF(RC10=5,VLOOKUP(RC[-7],Sheet1!R3C9:R23C12,2,FALSE),IF(RC10=6,"出战英雄基础属性+"&VLOOKUP(RC1,Sheet1!R3C1:R23C7,RC10+1,FALSE)/100&"%","全体出战英雄"&VLOOKUP(Sheet1!R3C1,Sheet1!R2C1:R3C7,RC[2]+1,FALSE)&"+"&VLOOKUP(RC1,Sheet1!R3C1:R23C7,RC10+1,FALSE))) -> 全体出战英雄怒气+5 | I69: buff_jingling | J69: 5
A70: 13 | B70: =IF(RC[-1]=R[-1]C[-1],R[-1]C+1,1) -> 6 | C70: =VLOOKUP(RC[-2],Sheet1!R3C14:R23C15,2,FALSE) -> 黑暗星域 | D70: =IF(RC10=5,VLOOKUP(RC[-3],Sheet1!R3C9:R23C12,3,FALSE),IF(RC10=6,"22|23|24|25",VLOOKUP(Sheet1!R2C1,Sheet1!R2C1:R2C7,RC[6]+1,FALSE))) -> 22|23|24|25 | E70: =IF(RC10=6,VLOOKUP(RC1,Sheet1!R3C1:R23C7,RC10+1,FALSE)&"|"&VLOOKUP(RC1,Sheet1!R3C1:R23C7,RC10+1,FALSE)&"|"&VLOOKUP(RC1,Sheet1!R3C1:R23C7,RC10+1,FALSE)&"|"&VLOOKUP(RC1,Sheet1!R3C1:R23C7,RC10+1,FALSE),VLOOKUP(RC1,Sheet1!R3C1:R23C7,RC10+1,FALSE)) -> 300|300|300|300 | F70: =IF(RC[-2]=0,VLOOKUP(RC[-5],Sheet1!R3C9:R23C12,4,FALSE),0) -> 0 | G70: ="10020|"&VLOOKUP(RC[-6],Sheet1!R25C1:R44C7,RC[3]+1,FALSE) -> 10020|0 | H70: =IF(RC10=5,VLOOKUP(RC[-7],Sheet1!R3C9:R23C12,2,FALSE),IF(RC10=6,"出战英雄基础属性+"&VLOOKUP(RC1,Sheet1!R3C1:R23C7,RC10+1,FALSE)/100&"%","全体出战英雄"&VLOOKUP(Sheet1!R3C1,Sheet1!R2C1:R3C7,RC[2]+1,FALSE)&"+"&VLOOKUP(RC1,Sheet1!R3C1:R23C7,RC10+1,FALSE))) -> 出战英雄基础属性+3% | I70: buff_jingling | J70: 6
A71: 14 | B71: =IF(RC[-1]=R[-1]C[-1],R[-1]C+1,1) -> 1 | C71: =VLOOKUP(RC[-2],Sheet1!R3C14:R23C15,2,FALSE) -> 终极混沌 | D71: =IF(RC10=5,VLOOKUP(RC[-3],Sheet1!R3C9:R23C12,3,FALSE),IF(RC10=6,"22|23|24|25",VLOOKUP(Sheet1!R2C1,Sheet1!R2C1:R2C7,RC[6]+1,FALSE))) -> 4 | E71: =IF(RC10=6,VLOOKUP(RC1,Sheet1!R3C1:R23C7,RC10+1,FALSE)&"|"&VLOOKUP(RC1,Sheet1!R3C1:R23C7,RC10+1,FALSE)&"|"&VLOOKUP(RC1,Sheet1!R3C1:R23C7,RC10+1,FALSE)&"|"&VLOOKUP(RC1,Sheet1!R3C1:R23C7,RC10+1,FALSE),VLOOKUP(RC1,Sheet1!R3C1:R23C7,RC10+1,FALSE)) -> 792 | F71: =IF(RC[-2]=0,VLOOKUP(RC[-5],Sheet1!R3C9:R23C12,4,FALSE),0) -> 0 | G71: ="10020|"&VLOOKUP(RC[-6],Sheet1!R25C1:R44C7,RC[3]+1,FALSE) -> 10020|4 | H71: =IF(RC10=5,VLOOKUP(RC[-7],Sheet1!R3C9:R23C12,2,FALSE),IF(RC10=6,"出战英雄基础属性+"&VLOOKUP(RC1,Sheet1!R3C1:R23C7,RC10+1,FALSE)/100&"%","全体出战英雄"&VLOOKUP(Sheet1!R3C1,Sheet1!R2C1:R3C7,RC[2]+1,FALSE)&"+"&VLOOKUP(RC1,Sheet1!R3C1:R23C7,RC10+1,FALSE))) -> 全体出战英雄血量+792 | I71: buff_jingling | J71: 1
A72: 14 | B72: =IF(RC[-1]=R[-1]C[-1],R[-1]C+1,1) -> 2 | C72: =VLOOKUP(RC[-2],Sheet1!R3C14:R23C15,2,FALSE) -> 终极混沌 | D72: =IF(RC10=5,VLOOKUP(RC[-3],Sheet1!R3C9:R23C12,3,FALSE),IF(RC10=6,"22|23|24|25",VLOOKUP(Sheet1!R2C1,Sheet1!R2C1:R2C7,RC[6]+1,FALSE))) -> 1 | E72: =IF(RC10=6,VLOOKUP(RC1,Sheet1!R3C1:R23C7,RC10+1,FALSE)&"|"&VLOOKUP(RC1,Sheet1!R3C1:R23C7,RC10+1,FALSE)&"|"&VLOOKUP(RC1,Sheet1!R3C1:R23C7,RC10+1,FALSE)&"|"&VLOOKUP(RC1,Sheet1!R3C1:R23C7,RC10+1,FALSE),VLOOKUP(RC1,Sheet1!R3C1:R23C7,RC10+1,FALSE)) -> 79 | F72: =IF(RC[-2]=0,VLOOKUP(RC[-5],Sheet1!R3C9:R23C12,4,FALSE),0) -> 0 | G72: ="10020|"&VLOOKUP(RC[-6],Sheet1!R25C1:R44C7,RC[3]+1,FALSE) -> 10020|4 | H72: =IF(RC10=5,VLOOKUP(RC[-7],Sheet1!R3C9:R23C12,2,FALSE),IF(RC10=6,"出战英雄基础属性+"&VLOOKUP(RC1,Sheet1!R3C1:R23C7,RC10+1,FALSE)/100&"%","全体出战英雄"&VLOOKUP(Sheet1!R3C1,Sheet1!R2C1:R3C7,RC[2]+1,FALSE)&"+"&VLOOKUP(RC1,Sheet1!R3C1:R23C7,RC10+1,FALSE))) -> 全体出战英雄攻击+79 | I72: buff_jingling | J72: 2
A73: 14 | B73: =IF(RC[-1]=R[-1]C[-1],R[-1]C+1,1) -> 3 | C73: =VLOOKUP(RC[-2],Sheet1!R3C14:R23C15,2,FALSE) -> 终极混沌 | D73: =IF(RC10=5,VLOOKUP(RC[-3],Sheet1!R3C9:R23C12,3,FALSE),IF(RC10=6,"22|23|24|25",VLOOKUP(Sheet1!R2C1,Sheet1!R2C1:R2C7,RC[6]+1,FALSE))) -> 2 | E73: =IF(RC10=6,VLOOKUP(RC1,Sheet1!R3C1:R23C7,RC10+1,FALSE)&"|"&VLOOKUP(RC1,Sheet1!R3C1:R23C7,RC10+1,FALSE)&"|"&VLOOKUP(RC1,Sheet1!R3C1:R23C7,RC10+1,FALSE)&"|"&VLOOKUP(RC1,Sheet1!R3C1:R23C7,RC10+1,FALSE),VLOOKUP(RC1,Sheet1!R3C1:R23C7,RC10+1,FALSE)) -> 79 | F73: =IF(RC[-2]=0,VLOOKUP(RC[-5],Sheet1!R3C9:R23C12,4,FALSE),0) -> 0 | G73: ="10020|"&VLOOKUP(RC[-6],Sheet1!R25C1:R44C7,RC[3]+1,FALSE) -> 10020|4 | H73: =IF(RC10=5,VLOOKUP(RC[-7],Sheet1!R3C9:R23C12,2,FALSE),IF(RC10=6,"出战英雄基础属性+"&VLOOKUP(RC1,Sheet1!R3C1:R23C7,RC10+1,FALSE)/100&"%","全体出战英雄"&VLOOKUP(Sheet1!R3C1,Sheet1!R2C1:R3C7,RC[2]+1,FALSE)&"+"&VLOOKUP(RC1,Sheet1!R3C1:R23C7,RC10+1,FALSE))) -> 全体出战英雄物防+79 | I73: buff_jingling | J73: 3
A74: 14 | B74: =IF(RC[-1]=R[-1]C[-1],R[-1]C+1,1) -> 4 | C74: =VLOOKUP(RC[-2],Sheet1!R3C14:R23C15,2,FALSE) -> 终极混沌 | D74: =IF(RC10=5,VLOOKUP(RC[-3],Sheet1!R3C9:R23C12,3,FALSE),IF(RC10=6,"22|23|24|25",VLOOKUP(Sheet1!R2C1,Sheet1!R2C1:R2C7,RC[6]+1,FALSE))) -> 3 | E74: =IF(RC10=6,VLOOKUP(RC1,Sheet1!R3C1:R23C7,RC10+1,FALSE)&"|"&VLOOKUP(RC1,Sheet1!R3C1:R23C7,RC10+1,FALSE)&"|"&VLOOKUP(RC1,Sheet1!R3C1:R23C7,RC10+1,FALSE)&"|"&VLOOKUP(RC1,Sheet1!R3C1:R23C7,RC10+1,FALSE),VLOOKUP(RC1,Sheet1!R3C1:R23C7,RC10+1,FALSE)) -> 79 | F74: =IF(RC[-2]=0,VLOOKUP(RC[-5],Sheet1!R3C9:R23C12,4,FALSE),0) -> 0 | G74: ="10020|"&VLOOKUP(RC[-6],Sheet1!R25C1:R44C7,RC[3]+1,FALSE) -> 10020|4 | H74: =IF(RC10=5,VLOOKUP(RC[-7],Sheet1!R3C9:R23C12,2,FALSE),IF(RC10=6,"出战英雄基础属性+"&VLOOKUP(RC1,Sheet1!R3C1:R23C7,RC10+1,FALSE)/100&"%","全体出战英雄"&VLOOKUP(Sheet1!R3C1,Sheet1!R2C1:R3C7,RC[2]+1,FALSE)&"+"&VLOOKUP(RC1,Sheet1!R3C1:R23C7,RC10+1,FALSE))) -> 全体出战英雄魔防+79 | I74: buff_jingling | J74: 4
A75: 14 | B75: =IF(RC[-1]=R[-1]C[-1],R[-1]C+1,1) -> 5 | C75: =VLOOKUP(RC[-2],Sheet1!R3C14:R23C15,2,FALSE) -> 终极混沌 | D75: =IF(RC10=5,VLOOKUP(RC[-3],Sheet1!R3C9:R23C12,3,FALSE),IF(RC10=6,"22|23|24|25",VLOOKUP(Sheet1!R2C1,Sheet1!R2C1:R2C7,RC[6]+1,FALSE))) -> 0 | E75: =IF(RC10=6,VLOOKUP(RC1,Sheet1!R3C1:R23C7,RC10+1,FALSE)&"|"&VLOOKUP(RC1,Sheet1!R3C1:R23C7,RC10+1,FALSE)&"|"&VLOOKUP(RC1,Sheet1!R3C1:R23C7,RC10+1,FALSE)&"|"&VLOOKUP(RC1,Sheet1!R3C1:R23C7,RC10+1,FALSE),VLOOKUP(RC1,Sheet1!R3C1:R23C7,RC10+1,FALSE)) -> 0 | F75: =IF(RC[-2]=0,VLOOKUP(RC[-5],Sheet1!R3C9:R23C12,4,FALSE),0) -> 10022|10 | G75: ="10020|"&VLOOKUP(RC[-6],Sheet1!R25C1:R44C7,RC[3]+1,FALSE) -> 10020|5 | H75: =IF(RC10=5,VLOOKUP(RC[-7],Sheet1!R3C9:R23C12,2,FALSE),IF(RC10=6,"出战英雄基础属性+"&VLOOKUP(RC1,Sheet1!R3C1:R23C7,RC10+1,FALSE)/100&"%","全体出战英雄"&VLOOKUP(Sheet1!R3C1,Sheet1!R2C1:R3C7,RC[2]+1,FALSE)&"+"&VLOOKUP(RC1,Sheet1!R3C1:R23C7,RC10+1,FALSE))) -> 灵性精粹*10 | I75: buff_jingling | J75: 5
A76: 14 | B76: =IF(RC[-1]=R[-1]C[-1],R[-1]C+1,1) -> 6 | C76: =VLOOKUP(RC[-2],Sheet1!R3C14:R23C15,2,FALSE) -> 终极混沌 | D76: =IF(RC10=5,VLOOKUP(RC[-3],Sheet1!R3C9:R23C12,3,FALSE),IF(RC10=6,"22|23|24|25",VLOOKUP(Sheet1!R2C1,Sheet1!R2C1:R2C7,RC[6]+1,FALSE))) -> 22|23|24|25 | E76: =IF(RC10=6,VLOOKUP(RC1,Sheet1!R3C1:R23C7,RC10+1,FALSE)&"|"&VLOOKUP(RC1,Sheet1!R3C1:R23C7,RC10+1,FALSE)&"|"&VLOOKUP(RC1,Sheet1!R3C1:R23C7,RC10+1,FALSE)&"|"&VLOOKUP(RC1,Sheet1!R3C1:R23C7,RC10+1,FALSE),VLOOKUP(RC1,Sheet1!R3C1:R23C7,RC10+1,FALSE)) -> 300|300|300|300 | F76: =IF(RC[-2]=0,VLOOKUP(RC[-5],Sheet1!R3C9:R23C12,4,FALSE),0) -> 0 | G76: ="10020|"&VLOOKUP(RC[-6],Sheet1!R25C1:R44C7,RC[3]+1,FALSE) -> 10020|0 | H76: =IF(RC10=5,VLOOKUP(RC[-7],Sheet1!R3C9:R23C12,2,FALSE),IF(RC10=6,"出战英雄基础属性+"&VLOOKUP(RC1,Sheet1!R3C1:R23C7,RC10+1,FALSE)/100&"%","全体出战英雄"&VLOOKUP(Sheet1!R3C1,Sheet1!R2C1:R3C7,RC[2]+1,FALSE)&"+"&VLOOKUP(RC1,Sheet1!R3C1:R23C7,RC10+1,FALSE))) -> 出战英雄基础属性+3% | I76: buff_jingling | J76: 6
A77: 15 | B77: =IF(RC[-1]=R[-1]C[-1],R[-1]C+1,1) -> 1 | C77: =VLOOKUP(RC[-2],Sheet1!R3C14:R23C15,2,FALSE) -> 智慧曙光 | D77: =IF(RC10=5,VLOOKUP(RC[-3],Sheet1!R3C9:R23C12,3,FALSE),IF(RC10=6,"22|23|24|25",VLOOKUP(Sheet1!R2C1,Sheet1!R2C1:R2C7,RC[6]+1,FALSE))) -> 4 | E77: =IF(RC10=6,VLOOKUP(RC1,Sheet1!R3C1:R23C7,RC10+1,FALSE)&"|"&VLOOKUP(RC1,Sheet1!R3C1:R23C7,RC10+1,FALSE)&"|"&VLOOKUP(RC1,Sheet1!R3C1:R23C7,RC10+1,FALSE)&"|"&VLOOKUP(RC1,Sheet1!R3C1:R23C7,RC10+1,FALSE),VLOOKUP(RC1,Sheet1!R3C1:R23C7,RC10+1,FALSE)) -> 834 | F77: =IF(RC[-2]=0,VLOOKUP(RC[-5],Sheet1!R3C9:R23C12,4,FALSE),0) -> 0 | G77: ="10020|"&VLOOKUP(RC[-6],Sheet1!R25C1:R44C7,RC[3]+1,FALSE) -> 10020|4 | H77: =IF(RC10=5,VLOOKUP(RC[-7],Sheet1!R3C9:R23C12,2,FALSE),IF(RC10=6,"出战英雄基础属性+"&VLOOKUP(RC1,Sheet1!R3C1:R23C7,RC10+1,FALSE)/100&"%","全体出战英雄"&VLOOKUP(Sheet1!R3C1,Sheet1!R2C1:R3C7,RC[2]+1,FALSE)&"+"&VLOOKUP(RC1,Sheet1!R3C1:R23C7,RC10+1,FALSE))) -> 全体出战英雄血量+834 | I77: buff_jingling | J77: 1
A78: 15 | B78: =IF(RC[-1]=R[-1]C[-1],R[-1]C+1,1) -> 2 | C78: =VLOOKUP(RC[-2],Sheet1!R3C14:R23C15,2,FALSE) -> 智慧曙光 | D78: =IF(RC10=5,VLOOKUP(RC[-3],Sheet1!R3C9:R23C12,3,FALSE),IF(RC10=6,"22|23|24|25",VLOOKUP(Sheet1!R2C1,Sheet1!R2C1:R2C7,RC[6]+1,FALSE))) -> 1 | E78: =IF(RC10=6,VLOOKUP(RC1,Sheet1!R3C1:R23C7,RC10+1,FALSE)&"|"&VLOOKUP(RC1,Sheet1!R3C1:R23C7,RC10+1,FALSE)&"|"&VLOOKUP(RC1,Sheet1!R3C1:R23C7,RC10+1,FALSE)&"|"&VLOOKUP(RC1,Sheet1!R3C1:R23C7,RC10+1,FALSE),VLOOKUP(RC1,Sheet1!R3C1:R23C7,RC10+1,FALSE)) -> 83 | F78: =IF(RC[-2]=0,VLOOKUP(RC[-5],Sheet1!R3C9:R23C12,4,FALSE),0) -> 0 | G78: ="10020|"&VLOOKUP(RC[-6],Sheet1!R25C1:R44C7,RC[3]+1,FALSE) -> 10020|4 | H78: =IF(RC10=5,VLOOKUP(RC[-7],Sheet1!R3C9:R23C12,2,FALSE),IF(RC10=6,"出战英雄基础属性+"&VLOOKUP(RC1,Sheet1!R3C1:R23C7,RC10+1,FALSE)/100&"%","全体出战英雄"&VLOOKUP(Sheet1!R3C1,Sheet1!R2C1:R3C7,RC[2]+1,FALSE)&"+"&VLOOKUP(RC1,Sheet1!R3C1:R23C7,RC10+1,FALSE))) -> 全体出战英雄攻击+83 | I78: buff_jingling | J78: 2
A79: 15 | B79: =IF(RC[-1]=R[-1]C[-1],R[-1]C+1,1) -> 3 | C79: =VLOOKUP(RC[-2],Sheet1!R3C14:R23C15,2,FALSE) -> 智慧曙光 | D79: =IF(RC10=5,VLOOKUP(RC[-3],Sheet1!R3C9:R23C12,3,FALSE),IF(RC10=6,"22|23|24|25",VLOOKUP(Sheet1!R2C1,Sheet1!R2C1:R2C7,RC[6]+1,FALSE))) -> 2 | E79: =IF(RC10=6,VLOOKUP(RC1,Sheet1!R3C1:R23C7,RC10+1,FALSE)&"|"&VLOOKUP(RC1,Sheet1!R3C1:R23C7,RC10+1,FALSE)&"|"&VLOOKUP(RC1,Sheet1!R3C1:R23C7,RC10+1,FALSE)&"|"&VLOOKUP(RC1,Sheet1!R3C1:R23C7,RC10+1,FALSE),VLOOKUP(RC1,Sheet1!R3C1:R23C7,RC10+1,FALSE)) -> 83 | F79: =IF(RC[-2]=0,VLOOKUP(RC[-5],Sheet1!R3C9:R23C12,4,FALSE),0) -> 0 | G79: ="10020|"&VLOOKUP(RC[-6],Sheet1!R25C1:R44C7,RC[3]+1,FALSE) -> 10020|4 | H79: =IF(RC10=5,VLOOKUP(RC[-7],Sheet1!R3C9:R23C12,2,FALSE),IF(RC10=6,"出战英雄基础属性+"&VLOOKUP(RC1,Sheet1!R3C1:R23C7,RC10+1,FALSE)/100&"%","全体出战英雄"&VLOOKUP(Sheet1!R3C1,Sheet1!R2C1:R3C7,RC[2]+1,FALSE)&"+"&VLOOKUP(RC1,Sheet1!R3C1:R23C7,RC10+1,FALSE))) -> 全体出战英雄物防+83 | I79: buff_jingling | J79: 3
A80: 15 | B80: =IF(RC[-1]=R[-1]C[-1],R[-1]C+1,1) -> 4 | C80: =VLOOKUP(RC[-2],Sheet1!R3C14:R23C15,2,FALSE) -> 智慧曙光 | D80: =IF(RC10=5,VLOOKUP(RC[-3],Sheet1!R3C9:R23C12,3,FALSE),IF(RC10=6,"22|23|24|25",VLOOKUP(Sheet1!R2C1,Sheet1!R2C1:R2C7,RC[6]+1,FALSE))) -> 3 | E80: =IF(RC10=6,VLOOKUP(RC1,Sheet1!R3C1:R23C7,RC10+1,FALSE)&"|"&VLOOKUP(RC1,Sheet1!R3C1:R23C7,RC10+1,FALSE)&"|"&VLOOKUP(RC1,Sheet1!R3C1:R23C7,RC10+1,FALSE)&"|"&VLOOKUP(RC1,Sheet1!R3C1:R23C7,RC10+1,FALSE),VLOOKUP(RC1,Sheet1!R3C1:R23C7,RC10+1,FALSE)) -> 83 | F80: =IF(RC[-2]=0,VLOOKUP(RC[-5],Sheet1!R3C9:R23C12,4,FALSE),0) -> 0 | G80: ="10020|"&VLOOKUP(RC[-6],Sheet1!R25C1:R44C7,RC[3]+1,FALSE) -> 10020|4 | H80: =IF(RC10=5,VLOOKUP(RC[-7],Sheet1!R3C9:R23C12,2,FALSE),IF(RC10=6,"出战英雄基础属性+"&VLOOKUP(RC1,Sheet1!R3C1:R23C7,RC10+1,FALSE)/100&"%","全体出战英雄"&VLOOKUP(Sheet1!R3C1,Sheet1!R2C1:R3C7,RC[2]+1,FALSE)&"+"&VLOOKUP(RC1,Sheet1!R3C1:R23C7,RC10+1,FALSE))) -> 全体出战英雄魔防+83 | I80: buff_jingling | J80: 4
A81: 15 | B81: =IF(RC[-1]=R[-1]C[-1],R[-1]C+1,1) -> 5 | C81: =VLOOKUP(RC[-2],Sheet1!R3C14:R23C15,2,FALSE) -> 智慧曙光 | D81: =IF(RC10=5,VLOOKUP(RC[-3],Sheet1!R3C9:R23C12,3,FALSE),IF(RC10=6,"22|23|24|25",VLOOKUP(Sheet1!R2C1,Sheet1!R2C1:R2C7,RC[6]+1,FALSE))) -> 0 | E81: =IF(RC10=6,VLOOKUP(RC1,Sheet1!R3C1:R23C7,RC10+1,FALSE)&"|"&VLOOKUP(RC1,Sheet1!R3C1:R23C7,RC10+1,FALSE)&"|"&VLOOKUP(RC1,Sheet1!R3C1:R23C7,RC10+1,FALSE)&"|"&VLOOKUP(RC1,Sheet1!R3C1:R23C7,RC10+1,FALSE),VLOOKUP(RC1,Sheet1!R3C1:R23C7,RC10+1,FALSE)) -> 0 | F81: =IF(RC[-2]=0,VLOOKUP(RC[-5],Sheet1!R3C9:R23C12,4,FALSE),0) -> 10022|10 | G81: ="10020|"&VLOOKUP(RC[-6],Sheet1!R25C1:R44C7,RC[3]+1,FALSE) -> 10020|5 | H81: =IF(RC10=5,VLOOKUP(RC[-7],Sheet1!R3C9:R23C12,2,FALSE),IF(RC10=6,"出战英雄基础属性+"&VLOOKUP(RC1,Sheet1!R3C1:R23C7,RC10+1,FALSE)/100&"%","全体出战英雄"&VLOOKUP(Sheet1!R3C1,Sheet1!R2C1:R3C7,RC[2]+1,FALSE)&"+"&VLOOKUP(RC1,Sheet1!R3C1:R23C7,RC10+1,FALSE))) -> 灵性精粹*10 | I81: buff_jingling | J81: 5
A82: 15 | B82: =IF(RC[-1]=R[-1]C[-1],R[-1]C+1,1) -> 6 | C82: =VLOOKUP(RC[-2],Sheet1!R3C14:R23C15,2,FALSE) -> 智慧曙光 | D82: =IF(RC10=5,VLOOKUP(RC[-3],Sheet1!R3C9:R23C12,3,FALSE),IF(RC10=6,"22|23|24|25",VLOOKUP(Sheet1!R2C1,Sheet1!R2C1:R2C7,RC[6]+1,FALSE))) -> 22|23|24|25 | E82: =IF(RC10=6,VLOOKUP(RC1,Sheet1!R3C1:R23C7,RC10+1,FALSE)&"|"&VLOOKUP(RC1,Sheet1!R3C1:R23C7,RC10+1,FALSE)&"|"&VLOOKUP(RC1,Sheet1!R3C1:R23C7,RC10+1,FALSE)&"|"&VLOOKUP(RC1,Sheet1!R3C1:R23C7,RC10+1,FALSE),VLOOKUP(RC1,Sheet1!R3C1:R23C7,RC10+1,FALSE)) -> 300|300|300|300 | F82: =IF(RC[-2]=0,VLOOKUP(RC[-5],Sheet1!R3C9:R23C12,4,FALSE),0) -> 0 | G82: ="10020|"&VLOOKUP(RC[-6],Sheet1!R25C1:R44C7,RC[3]+1,FALSE) -> 10020|0 | H82: =IF(RC10=5,VLOOKUP(RC[-7],Sheet1!R3C9:R23C12,2,FALSE),IF(RC10=6,"出战英雄基础属性+"&VLOOKUP(RC1,Sheet1!R3C1:R23C7,RC10+1,FALSE)/100&"%","全体出战英雄"&VLOOKUP(Sheet1!R3C1,Sheet1!R2C1:R3C7,RC[2]+1,FALSE)&"+"&VLOOKUP(RC1,Sheet1!R3C1:R23C7,RC10+1,FALSE))) -> 出战英雄基础属性+3% | I82: buff_jingling | J82: 6
A83: 16 | B83: =IF(RC[-1]=R[-1]C[-1],R[-1]C+1,1) -> 1 | C83: =VLOOKUP(RC[-2],Sheet1!R3C14:R23C15,2,FALSE) -> 永恒生命 | D83: =IF(RC10=5,VLOOKUP(RC[-3],Sheet1!R3C9:R23C12,3,FALSE),IF(RC10=6,"22|23|24|25",VLOOKUP(Sheet1!R2C1,Sheet1!R2C1:R2C7,RC[6]+1,FALSE))) -> 4 | E83: =IF(RC10=6,VLOOKUP(RC1,Sheet1!R3C1:R23C7,RC10+1,FALSE)&"|"&VLOOKUP(RC1,Sheet1!R3C1:R23C7,RC10+1,FALSE)&"|"&VLOOKUP(RC1,Sheet1!R3C1:R23C7,RC10+1,FALSE)&"|"&VLOOKUP(RC1,Sheet1!R3C1:R23C7,RC10+1,FALSE),VLOOKUP(RC1,Sheet1!R3C1:R23C7,RC10+1,FALSE)) -> 875 | F83: =IF(RC[-2]=0,VLOOKUP(RC[-5],Sheet1!R3C9:R23C12,4,FALSE),0) -> 0 | G83: ="10020|"&VLOOKUP(RC[-6],Sheet1!R25C1:R44C7,RC[3]+1,FALSE) -> 10020|5 | H83: =IF(RC10=5,VLOOKUP(RC[-7],Sheet1!R3C9:R23C12,2,FALSE),IF(RC10=6,"出战英雄基础属性+"&VLOOKUP(RC1,Sheet1!R3C1:R23C7,RC10+1,FALSE)/100&"%","全体出战英雄"&VLOOKUP(Sheet1!R3C1,Sheet1!R2C1:R3C7,RC[2]+1,FALSE)&"+"&VLOOKUP(RC1,Sheet1!R3C1:R23C7,RC10+1,FALSE))) -> 全体出战英雄血量+875 | I83: buff_jingling | J83: 1
A84: 16 | B84: =IF(RC[-1]=R[-1]C[-1],R[-1]C+1,1) -> 2 | C84: =VLOOKUP(RC[-2],Sheet1!R3C14:R23C15,2,FALSE) -> 永恒生命 | D84: =IF(RC10=5,VLOOKUP(RC[-3],Sheet1!R3C9:R23C12,3,FALSE),IF(RC10=6,"22|23|24|25",VLOOKUP(Sheet1!R2C1,Sheet1!R2C1:R2C7,RC[6]+1,FALSE))) -> 1 | E84: =IF(RC10=6,VLOOKUP(RC1,Sheet1!R3C1:R23C7,RC10+1,FALSE)&"|"&VLOOKUP(RC1,Sheet1!R3C1:R23C7,RC10+1,FALSE)&"|"&VLOOKUP(RC1,Sheet1!R3C1:R23C7,RC10+1,FALSE)&"|"&VLOOKUP(RC1,Sheet1!R3C1:R23C7,RC10+1,FALSE),VLOOKUP(RC1,Sheet1!R3C1:R23C7,RC10+1,FALSE)) -> 88 | F84: =IF(RC[-2]=0,VLOOKUP(RC[-5],Sheet1!R3C9:R23C12,4,FALSE),0) -> 0 | G84: ="10020|"&VLOOKUP(RC[-6],Sheet1!R25C1:R44C7,RC[3]+1,FALSE) -> 10020|5 | H84: =IF(RC10=5,VLOOKUP(RC[-7],Sheet1!R3C9:R23C12,2,FALSE),IF(RC10=6,"出战英雄基础属性+"&VLOOKUP(RC1,Sheet1!R3C1:R23C7,RC10+1,FALSE)/100&"%","全体出战英雄"&VLOOKUP(Sheet1!R3C1,Sheet1!R2C1:R3C7,RC[2]+1,FALSE)&"+"&VLOOKUP(RC1,Sheet1!R3C1:R23C7,RC10+1,FALSE))) -> 全体出战英雄攻击+88 | I84: buff_jingling | J84: 2
A85: 16 | B85: =IF(RC[-1]=R[-1]C[-1],R[-1]C+1,1) -> 3 | C85: =VLOOKUP(RC[-2],Sheet1!R3C14:R23C15,2,FALSE) -> 永恒生命 | D85: =IF(RC10=5,VLOOKUP(RC[-3],Sheet1!R3C9:R23C12,3,FALSE),IF(RC10=6,"22|23|24|25",VLOOKUP(Sheet1!R2C1,Sheet1!R2C1:R2C7,RC[6]+1,FALSE))) -> 2 | E85: =IF(RC10=6,VLOOKUP(RC1,Sheet1!R3C1:R23C7,RC10+1,FALSE)&"|"&VLOOKUP(RC1,Sheet1!R3C1:R23C7,RC10+1,FALSE)&"|"&VLOOKUP(RC1,Sheet1!R3C1:R23C7,RC10+1,FALSE)&"|"&VLOOKUP(RC1,Sheet1!R3C1:R23C7,RC10+1,FALSE),VLOOKUP(RC1,Sheet1!R3C1:R23C7,RC10+1,FALSE)) -> 88 | F85: =IF(RC[-2]=0,VLOOKUP(RC[-5],Sheet1!R3C9:R23C12,4,FALSE),0) -> 0 | G85: ="10020|"&VLOOKUP(RC[-6],Sheet1!R25C1:R44C7,RC[3]+1,FALSE) -> 10020|5 | H85: =IF(RC10=5,VLOOKUP(RC[-7],Sheet1!R3C9:R23C12,2,FALSE),IF(RC10=6,"出战英雄基础属性+"&VLOOKUP(RC1,Sheet1!R3C1:R23C7,RC10+1,FALSE)/100&"%","全体出战英雄"&VLOOKUP(Sheet1!R3C1,Sheet1!R2C1:R3C7,RC[2]+1,FALSE)&"+"&VLOOKUP(RC1,Sheet1!R3C1:R23C7,RC10+1,FALSE))) -> 全体出战英雄物防+88 | I85: buff_jingling | J85: 3
A86: 16 | B86: =IF(RC[-1]=R[-1]C[-1],R[-1]C+1,1) -> 4 | C86: =VLOOKUP(RC[-2],Sheet1!R3C14:R23C15,2,FALSE) -> 永恒生命 | D86: =IF(RC10=5,VLOOKUP(RC[-3],Sheet1!R3C9:R23C12,3,FALSE),IF(RC10=6,"22|23|24|25",VLOOKUP(Sheet1!R2C1,Sheet1!R2C1:R2C7,RC[6]+1,FALSE))) -> 3 | E86: =IF(RC10=6,VLOOKUP(RC1,Sheet1!R3C1:R23C7,RC10+1,FALSE)&"|"&VLOOKUP(RC1,Sheet1!R3C1:R23C7,RC10+1,FALSE)&"|"&VLOOKUP(RC1,Sheet1!R3C1:R23C7,RC10+1,FALSE)&"|"&VLOOKUP(RC1,Sheet1!R3C1:R23C7,RC10+1,FALSE),VLOOKUP(RC1,Sheet1!R3C1:R23C7,RC10+1,FALSE)) -> 88 | F86: =IF(RC[-2]=0,VLOOKUP(RC[-5],Sheet1!R3C9:R23C12,4,FALSE),0) -> 0 | G86: ="10020|"&VLOOKUP(RC[-6],Sheet1!R25C1:R44C7,RC[3]+1,FALSE) -> 10020|5 | H86: =IF(RC10=5,VLOOKUP(RC[-7],Sheet1!R3C9:R23C12,2,FALSE),IF(RC10=6,"出战英雄基础属性+"&VLOOKUP(RC1,Sheet1!R3C1:R23C7,RC10+1,FALSE)/100&"%","全体出战英雄"&VLOOKUP(Sheet1!R3C1,Sheet1!R2C1:R3C7,RC[2]+1,FALSE)&"+"&VLOOKUP(RC1,Sheet1!R3C1:R23C7,RC10+1,FALSE))) -> 全体出战英雄魔防+88 | I86: buff_jingling | J86: 4
A87: 16 | B87: =IF(RC[-1]=R[-1]C[-1],R[-1]C+1,1) -> 5 | C87: =VLOOKUP(RC[-2],Sheet1!R3C14:R23C15,2,FALSE) -> 永恒生命 | D87: =IF(RC10=5,VLOOKUP(RC[-3],Sheet1!R3C9:R23C12,3,FALSE),IF(RC10=6,"22|23|24|25",VLOOKUP(Sheet1!R2C1,Sheet1!R2C1:R2C7,RC[6]+1,FALSE))) -> 0 | E87: =IF(RC10=6,VLOOKUP(RC1,Sheet1!R3C1:R23C7,RC10+1,FALSE)&"|"&VLOOKUP(RC1,Sheet1!R3C1:R23C7,RC10+1,FALSE)&"|"&VLOOKUP(RC1,Sheet1!R3C1:R23C7,RC10+1,FALSE)&"|"&VLOOKUP(RC1,Sheet1!R3C1:R23C7,RC10+1,FALSE),VLOOKUP(RC1,Sheet1!R3C1:R23C7,RC10+1,FALSE)) -> 0 | F87: =IF(RC[-2]=0,VLOOKUP(RC[-5],Sheet1!R3C9:R23C12,4,FALSE),0) -> 10022|10 | G87: ="10020|"&VLOOKUP(RC[-6],Sheet1!R25C1:R44C7,RC[3]+1,FALSE) -> 10020|6 | H87: =IF(RC10=5,VLOOKUP(RC[-7],Sheet1!R3C9:R23C12,2,FALSE),IF(RC10=6,"出战英雄基础属性+"&VLOOKUP(RC1,Sheet1!R3C1:R23C7,RC10+1,FALSE)/100&"%","全体出战英雄"&VLOOKUP(Sheet1!R3C1,Sheet1!R2C1:R3C7,RC[2]+1,FALSE)&"+"&VLOOKUP(RC1,Sheet1!R3C1:R23C7,RC10+1,FALSE))) -> 灵性精粹*10 | I87: buff_jingling | J87: 5
A88: 16 | B88: =IF(RC[-1]=R[-1]C[-1],R[-1]C+1,1) -> 6 | C88: =VLOOKUP(RC[-2],Sheet1!R3C14:R23C15,2,FALSE) -> 永恒生命 | D88: =IF(RC10=5,VLOOKUP(RC[-3],Sheet1!R3C9:R23C12,3,FALSE),IF(RC10=6,"22|23|24|25",VLOOKUP(Sheet1!R2C1,Sheet1!R2C1:R2C7,RC[6]+1,FALSE))) -> 22|23|24|25 | E88: =IF(RC10=6,VLOOKUP(RC1,Sheet1!R3C1:R23C7,RC10+1,FALSE)&"|"&VLOOKUP(RC1,Sheet1!R3C1:R23C7,RC10+1,FALSE)&"|"&VLOOKUP(RC1,Sheet1!R3C1:R23C7,RC10+1,FALSE)&"|"&VLOOKUP(RC1,Sheet1!R3C1:R23C7,RC10+1,FALSE),VLOOKUP(RC1,Sheet1!R3C1:R23C7,RC10+1,FALSE)) -> 400|400|400|400 | F88: =IF(RC[-2]=0,VLOOKUP(RC[-5],Sheet1!R3C9:R23C12,4,FALSE),0) -> 0 | G88: ="10020|"&VLOOKUP(RC[-6],Sheet1!R25C1:R44C7,RC[3]+1,FALSE) -> 10020|0 | H88: =IF(RC10=5,VLOOKUP(RC[-7],Sheet1!R3C9:R23C12,2,FALSE),IF(RC10=6,"出战英雄基础属性+"&VLOOKUP(RC1,Sheet1!R3C1:R23C7,RC10+1,FALSE)/100&"%","全体出战英雄"&VLOOKUP(Sheet1!R3C1,Sheet1!R2C1:R3C7,RC[2]+1,FALSE)&"+"&VLOOKUP(RC1,Sheet1!R3C1:R23C7,RC10+1,FALSE))) -> 出战英雄基础属性+4% | I88: buff_jingling | J88: 6
A89: 17 | B89: =IF(RC[-1]=R[-1]C[-1],R[-1]C+1,1) -> 1 | C89: =VLOOKUP(RC[-2],Sheet1!R3C14:R23C15,2,FALSE) -> 湮灭之地 | D89: =IF(RC10=5,VLOOKUP(RC[-3],Sheet1!R3C9:R23C12,3,FALSE),IF(RC10=6,"22|23|24|25",VLOOKUP(Sheet1!R2C1,Sheet1!R2C1:R2C7,RC[6]+1,FALSE))) -> 4 | E89: =IF(RC10=6,VLOOKUP(RC1,Sheet1!R3C1:R23C7,RC10+1,FALSE)&"|"&VLOOKUP(RC1,Sheet1!R3C1:R23C7,RC10+1,FALSE)&"|"&VLOOKUP(RC1,Sheet1!R3C1:R23C7,RC10+1,FALSE)&"|"&VLOOKUP(RC1,Sheet1!R3C1:R23C7,RC10+1,FALSE),VLOOKUP(RC1,Sheet1!R3C1:R23C7,RC10+1,FALSE)) -> 917 | F89: =IF(RC[-2]=0,VLOOKUP(RC[-5],Sheet1!R3C9:R23C12,4,FALSE),0) -> 0 | G89: ="10020|"&VLOOKUP(RC[-6],Sheet1!R25C1:R44C7,RC[3]+1,FALSE) -> 10020|5 | H89: =IF(RC10=5,VLOOKUP(RC[-7],Sheet1!R3C9:R23C12,2,FALSE),IF(RC10=6,"出战英雄基础属性+"&VLOOKUP(RC1,Sheet1!R3C1:R23C7,RC10+1,FALSE)/100&"%","全体出战英雄"&VLOOKUP(Sheet1!R3C1,Sheet1!R2C1:R3C7,RC[2]+1,FALSE)&"+"&VLOOKUP(RC1,Sheet1!R3C1:R23C7,RC10+1,FALSE))) -> 全体出战英雄血量+917 | I89: buff_jingling | J89: 1
A90: 17 | B90: =IF(RC[-1]=R[-1]C[-1],R[-1]C+1,1) -> 2 | C90: =VLOOKUP(RC[-2],Sheet1!R3C14:R23C15,2,FALSE) -> 湮灭之地 | D90: =IF(RC10=5,VLOOKUP(RC[-3],Sheet1!R3C9:R23C12,3,FALSE),IF(RC10=6,"22|23|24|25",VLOOKUP(Sheet1!R2C1,Sheet1!R2C1:R2C7,RC[6]+1,FALSE))) -> 1 | E90: =IF(RC10=6,VLOOKUP(RC1,Sheet1!R3C1:R23C7,RC10+1,FALSE)&"|"&VLOOKUP(RC1,Sheet1!R3C1:R23C7,RC10+1,FALSE)&"|"&VLOOKUP(RC1,Sheet1!R3C1:R23C7,RC10+1,FALSE)&"|"&VLOOKUP(RC1,Sheet1!R3C1:R23C7,RC10+1,FALSE),VLOOKUP(RC1,Sheet1!R3C1:R23C7,RC10+1,FALSE)) -> 92 | F90: =IF(RC[-2]=0,VLOOKUP(RC[-5],Sheet1!R3C9:R23C12,4,FALSE),0) -> 0 | G90: ="10020|"&VLOOKUP(RC[-6],Sheet1!R25C1:R44C7,RC[3]+1,FALSE) -> 10020|5 | H90: =IF(RC10=5,VLOOKUP(RC[-7],Sheet1!R3C9:R23C12,2,FALSE),IF(RC10=6,"出战英雄基础属性+"&VLOOKUP(RC1,Sheet1!R3C1:R23C7,RC10+1,FALSE)/100&"%","全体出战英雄"&VLOOKUP(Sheet1!R3C1,Sheet1!R2C1:R3C7,RC[2]+1,FALSE)&"+"&VLOOKUP(RC1,Sheet1!R3C1:R23C7,RC10+1,FALSE))) -> 全体出战英雄攻击+92 | I90: buff_jingling | J90: 2
A91: 17 | B91: =IF(RC[-1]=R[-1]C[-1],R[-1]C+1,1) -> 3 | C91: =VLOOKUP(RC[-2],Sheet1!R3C14:R23C15,2,FALSE) -> 湮灭之地 | D91: =IF(RC10=5,VLOOKUP(RC[-3],Sheet1!R3C9:R23C12,3,FALSE),IF(RC10=6,"22|23|24|25",VLOOKUP(Sheet1!R2C1,Sheet1!R2C1:R2C7,RC[6]+1,FALSE))) -> 2 | E91: =IF(RC10=6,VLOOKUP(RC1,Sheet1!R3C1:R23C7,RC10+1,FALSE)&"|"&VLOOKUP(RC1,Sheet1!R3C1:R23C7,RC10+1,FALSE)&"|"&VLOOKUP(RC1,Sheet1!R3C1:R23C7,RC10+1,FALSE)&"|"&VLOOKUP(RC1,Sheet1!R3C1:R23C7,RC10+1,FALSE),VLOOKUP(RC1,Sheet1!R3C1:R23C7,RC10+1,FALSE)) -> 92 | F91: =IF(RC[-2]=0,VLOOKUP(RC[-5],Sheet1!R3C9:R23C12,4,FALSE),0) -> 0 | G91: ="10020|"&VLOOKUP(RC[-6],Sheet1!R25C1:R44C7,RC[3]+1,FALSE) -> 10020|5 | H91: =IF(RC10=5,VLOOKUP(RC[-7],Sheet1!R3C9:R23C12,2,FALSE),IF(RC10=6,"出战英雄基础属性+"&VLOOKUP(RC1,Sheet1!R3C1:R23C7,RC10+1,FALSE)/100&"%","全体出战英雄"&VLOOKUP(Sheet1!R3C1,Sheet1!R2C1:R3C7,RC[2]+1,FALSE)&"+"&VLOOKUP(RC1,Sheet1!R3C1:R23C7,RC10+1,FALSE))) -> 全体出战英雄物防+92 | I91: buff_jingling | J91: 3
A92: 17 | B92: =IF(RC[-1]=R[-1]C[-1],R[-1]C+1,1) -> 4 | C92: =VLOOKUP(RC[-2],Sheet1!R3C14:R23C15,2,FALSE) -> 湮灭之地 | D92: =IF(RC10=5,VLOOKUP(RC[-3],Sheet1!R3C9:R23C12,3,FALSE),IF(RC10=6,"22|23|24|25",VLOOKUP(Sheet1!R2C1,Sheet1!R2C1:R2C7,RC[6]+1,FALSE))) -> 3 | E92: =IF(RC10=6,VLOOKUP(RC1,Sheet1!R3C1:R23C7,RC10+1,FALSE)&"|"&VLOOKUP(RC1,Sheet1!R3C1:R23C7,RC10+1,FALSE)&"|"&VLOOKUP(RC1,Sheet1!R3C1:R23C7,RC10+1,FALSE)&"|"&VLOOKUP(RC1,Sheet1!R3C1:R23C7,RC10+1,FALSE),VLOOKUP(RC1,Sheet1!R3C1:R23C7,RC10+1,FALSE)) -> 92 | F92: =IF(RC[-2]=0,VLOOKUP(RC[-5],Sheet1!R3C9:R23C12,4,FALSE),0) -> 0 | G92: ="10020|"&VLOOKUP(RC[-6],Sheet1!R25C1:R44C7,RC[3]+1,FALSE) -> 10020|5 | H92: =IF(RC10=5,VLOOKUP(RC[-7],Sheet1!R3C9:R23C12,2,FALSE),IF(RC10=6,"出战英雄基础属性+"&VLOOKUP(RC1,Sheet1!R3C1:R23C7,RC10+1,FALSE)/100&"%","全体出战英雄"&VLOOKUP(Sheet1!R3C1,Sheet1!R2C1:R3C7,RC[2]+1,FALSE)&"+"&VLOOKUP(RC1,Sheet1!R3C1:R23C7,RC10+1,FALSE))) -> 全体出战英雄魔防+92 | I92: buff_jingling | J92: 4
A93: 17 | B93: =IF(RC[-1]=R[-1]C[-1],R[-1]C+1,1) -> 5 | C93: =VLOOKUP(RC[-2],Sheet1!R3C14:R23C15,2,FALSE) -> 湮灭之地 | D93: =IF(RC10=5,VLOOKUP(RC[-3],Sheet1!R3C9:R23C12,3,FALSE),IF(RC10=6,"22|23|24|25",VLOOKUP(Sheet1!R2C1,Sheet1!R2C1:R2C7,RC[6]+1,FALSE))) -> 0 | E93: =IF(RC10=6,VLOOKUP(RC1,Sheet1!R3C1:R23C7,RC10+1,FALSE)&"|"&VLOOKUP(RC1,Sheet1!R3C1:R23C7,RC10+1,FALSE)&"|"&VLOOKUP(RC1,Sheet1!R3C1:R23C7,RC10+1,FALSE)&"|"&VLOOKUP(RC1,Sheet1!R3C1:R23C7,RC10+1,FALSE),VLOOKUP(RC1,Sheet1!R3C1:R23C7,RC10+1,FALSE)) -> 0 | F93: =IF(RC[-2]=0,VLOOKUP(RC[-5],Sheet1!R3C9:R23C12,4,FALSE),0) -> 10022|10 | G93: ="10020|"&VLOOKUP(RC[-6],Sheet1!R25C1:R44C7,RC[3]+1,FALSE) -> 10020|6 | H93: =IF(RC10=5,VLOOKUP(RC[-7],Sheet1!R3C9:R23C12,2,FALSE),IF(RC10=6,"出战英雄基础属性+"&VLOOKUP(RC1,Sheet1!R3C1:R23C7,RC10+1,FALSE)/100&"%","全体出战英雄"&VLOOKUP(Sheet1!R3C1,Sheet1!R2C1:R3C7,RC[2]+1,FALSE)&"+"&VLOOKUP(RC1,Sheet1!R3C1:R23C7,RC10+1,FALSE))) -> 灵性精粹*10 | I93: buff_jingling | J93: 5
A94: 17 | B94: =IF(RC[-1]=R[-1]C[-1],R[-1]C+1,1) -> 6 | C94: =VLOOKUP(RC[-2],Sheet1!R3C14:R23C15,2,FALSE) -> 湮灭之地 | D94: =IF(RC10=5,VLOOKUP(RC[-3],Sheet1!R3C9:R23C12,3,FALSE),IF(RC10=6,"22|23|24|25",VLOOKUP(Sheet1!R2C1,Sheet1!R2C1:R2C7,RC[6]+1,FALSE))) -> 22|23|24|25 | E94: =IF(RC10=6,VLOOKUP(RC1,Sheet1!R3C1:R23C7,RC10+1,FALSE)&"|"&VLOOKUP(RC1,Sheet1!R3C1:R23C7,RC10+1,FALSE)&"|"&VLOOKUP(RC1,Sheet1!R3C1:R23C7,RC10+1,FALSE)&"|"&VLOOKUP(RC1,Sheet1!R3C1:R23C7,RC10+1,FALSE),VLOOKUP(RC1,Sheet1!R3C1:R23C7,RC10+1,FALSE)) -> 400|400|400|400 | F94: =IF(RC[-2]=0,VLOOKUP(RC[-5],Sheet1!R3C9:R23C12,4,FALSE),0) -> 0 | G94: ="10020|"&VLOOKUP(RC[-6],Sheet1!R25C1:R44C7,RC[3]+1,FALSE) -> 10020|0 | H94: =IF(RC10=5,VLOOKUP(RC[-7],Sheet1!R3C9:R23C12,2,FALSE),IF(RC10=6,"出战英雄基础属性+"&VLOOKUP(RC1,Sheet1!R3C1:R23C7,RC10+1,FALSE)/100&"%","全体出战英雄"&VLOOKUP(Sheet1!R3C1,Sheet1!R2C1:R3C7,RC[2]+1,FALSE)&"+"&VLOOKUP(RC1,Sheet1!R3C1:R23C7,RC10+1,FALSE))) -> 出战英雄基础属性+4% | I94: buff_jingling | J94: 6
A95: 18 | B95: =IF(RC[-1]=R[-1]C[-1],R[-1]C+1,1) -> 1 | C95: =VLOOKUP(RC[-2],Sheet1!R3C14:R23C15,2,FALSE) -> 亡者低语 | D95: =IF(RC10=5,VLOOKUP(RC[-3],Sheet1!R3C9:R23C12,3,FALSE),IF(RC10=6,"22|23|24|25",VLOOKUP(Sheet1!R2C1,Sheet1!R2C1:R2C7,RC[6]+1,FALSE))) -> 4 | E95: =IF(RC10=6,VLOOKUP(RC1,Sheet1!R3C1:R23C7,RC10+1,FALSE)&"|"&VLOOKUP(RC1,Sheet1!R3C1:R23C7,RC10+1,FALSE)&"|"&VLOOKUP(RC1,Sheet1!R3C1:R23C7,RC10+1,FALSE)&"|"&VLOOKUP(RC1,Sheet1!R3C1:R23C7,RC10+1,FALSE),VLOOKUP(RC1,Sheet1!R3C1:R23C7,RC10+1,FALSE)) -> 959 | F95: =IF(RC[-2]=0,VLOOKUP(RC[-5],Sheet1!R3C9:R23C12,4,FALSE),0) -> 0 | G95: ="10020|"&VLOOKUP(RC[-6],Sheet1!R25C1:R44C7,RC[3]+1,FALSE) -> 10020|5 | H95: =IF(RC10=5,VLOOKUP(RC[-7],Sheet1!R3C9:R23C12,2,FALSE),IF(RC10=6,"出战英雄基础属性+"&VLOOKUP(RC1,Sheet1!R3C1:R23C7,RC10+1,FALSE)/100&"%","全体出战英雄"&VLOOKUP(Sheet1!R3C1,Sheet1!R2C1:R3C7,RC[2]+1,FALSE)&"+"&VLOOKUP(RC1,Sheet1!R3C1:R23C7,RC10+1,FALSE))) -> 全体出战英雄血量+959 | I95: buff_jingling | J95: 1
A96: 18 | B96: =IF(RC[-1]=R[-1]C[-1],R[-1]C+1,1) -> 2 | C96: =VLOOKUP(RC[-2],Sheet1!R3C14:R23C15,2,FALSE) -> 亡者低语 | D96: =IF(RC10=5,VLOOKUP(RC[-3],Sheet1!R3C9:R23C12,3,FALSE),IF(RC10=6,"22|23|24|25",VLOOKUP(Sheet1!R2C1,Sheet1!R2C1:R2C7,RC[6]+1,FALSE))) -> 1 | E96: =IF(RC10=6,VLOOKUP(RC1,Sheet1!R3C1:R23C7,RC10+1,FALSE)&"|"&VLOOKUP(RC1,Sheet1!R3C1:R23C7,RC10+1,FALSE)&"|"&VLOOKUP(RC1,Sheet1!R3C1:R23C7,RC10+1,FALSE)&"|"&VLOOKUP(RC1,Sheet1!R3C1:R23C7,RC10+1,FALSE),VLOOKUP(RC1,Sheet1!R3C1:R23C7,RC10+1,FALSE)) -> 96 | F96: =IF(RC[-2]=0,VLOOKUP(RC[-5],Sheet1!R3C9:R23C12,4,FALSE),0) -> 0 | G96: ="10020|"&VLOOKUP(RC[-6],Sheet1!R25C1:R44C7,RC[3]+1,FALSE) -> 10020|5 | H96: =IF(RC10=5,VLOOKUP(RC[-7],Sheet1!R3C9:R23C12,2,FALSE),IF(RC10=6,"出战英雄基础属性+"&VLOOKUP(RC1,Sheet1!R3C1:R23C7,RC10+1,FALSE)/100&"%","全体出战英雄"&VLOOKUP(Sheet1!R3C1,Sheet1!R2C1:R3C7,RC[2]+1,FALSE)&"+"&VLOOKUP(RC1,Sheet1!R3C1:R23C7,RC10+1,FALSE))) -> 全体出战英雄攻击+96 | I96: buff_jingling | J96: 2
A97: 18 | B97: =IF(RC[-1]=R[-1]C[-1],R[-1]C+1,1) -> 3 | C97: =VLOOKUP(RC[-2],Sheet1!R3C14:R23C15,2,FALSE) -> 亡者低语 | D97: =IF(RC10=5,VLOOKUP(RC[-3],Sheet1!R3C9:R23C12,3,FALSE),IF(RC10=6,"22|23|24|25",VLOOKUP(Sheet1!R2C1,Sheet1!R2C1:R2C7,RC[6]+1,FALSE))) -> 2 | E97: =IF(RC10=6,VLOOKUP(RC1,Sheet1!R3C1:R23C7,RC10+1,FALSE)&"|"&VLOOKUP(RC1,Sheet1!R3C1:R23C7,RC10+1,FALSE)&"|"&VLOOKUP(RC1,Sheet1!R3C1:R23C7,RC10+1,FALSE)&"|"&VLOOKUP(RC1,Sheet1!R3C1:R23C7,RC10+1,FALSE),VLOOKUP(RC1,Sheet1!R3C1:R23C7,RC10+1,FALSE)) -> 96 | F97: =IF(RC[-2]=0,VLOOKUP(RC[-5],Sheet1!R3C9:R23C12,4,FALSE),0) -> 0 | G97: ="10020|"&VLOOKUP(RC[-6],Sheet1!R25C1:R44C7,RC[3]+1,FALSE) -> 10020|5 | H97: =IF(RC10=5,VLOOKUP(RC[-7],Sheet1!R3C9:R23C12,2,FALSE),IF(RC10=6,"出战英雄基础属性+"&VLOOKUP(RC1,Sheet1!R3C1:R23C7,RC10+1,FALSE)/100&"%","全体出战英雄"&VLOOKUP(Sheet1!R3C1,Sheet1!R2C1:R3C7,RC[2]+1,FALSE)&"+"&VLOOKUP(RC1,Sheet1!R3C1:R23C7,RC10+1,FALSE))) -> 全体出战英雄物防+96 | I97: buff_jingling | J97: 3
A98: 18 | B98: =IF(RC[-1]=R[-1]C[-1],R[-1]C+1,1) -> 4 | C98: =VLOOKUP(RC[-2],Sheet1!R3C14:R23C15,2,FALSE) -> 亡者低语 | D98: =IF(RC10=5,VLOOKUP(RC[-3],Sheet1!R3C9:R23C12,3,FALSE),IF(RC10=6,"22|23|24|25",VLOOKUP(Sheet1!R2C1,Sheet1!R2C1:R2C7,RC[6]+1,FALSE))) -> 3 | E98: =IF(RC10=6,VLOOKUP(RC1,Sheet1!R3C1:R23C7,RC10+1,FALSE)&"|"&VLOOKUP(RC1,Sheet1!R3C1:R23C7,RC10+1,FALSE)&"|"&VLOOKUP(RC1,Sheet1!R3C1:R23C7,RC10+1,FALSE)&"|"&VLOOKUP(RC1,Sheet1!R3C1:R23C7,RC10+1,FALSE),VLOOKUP(RC1,Sheet1!R3C1:R23C7,RC10+1,FALSE)) -> 96 | F98: =IF(RC[-2]=0,VLOOKUP(RC[-5],Sheet1!R3C9:R23C12,4,FALSE),0) -> 0 | G98: ="10020|"&VLOOKUP(RC[-6],Sheet1!R25C1:R44C7,RC[3]+1,FALSE) -> 10020|5 | H98: =IF(RC10=5,VLOOKUP(RC[-7],Sheet1!R3C9:R23C12,2,FALSE),IF(RC10=6,"出战英雄基础属性+"&VLOOKUP(RC1,Sheet1!R3C1:R23C7,RC10+1,FALSE)/100&"%","全体出战英雄"&VLOOKUP(Sheet1!R3C1,Sheet1!R2C1:R3C7,RC[2]+1,FALSE)&"+"&VLOOKUP(RC1,Sheet1!R3C1:R23C7,RC10+1,FALSE))) -> 全体出战英雄魔防+96 | I98: buff_jingling | J98: 4
A99: 18 | B99: =IF(RC[-1]=R[-1]C[-1],R[-1]C+1,1) -> 5 | C99: =VLOOKUP(RC[-2],Sheet1!R3C14:R23C15,2,FALSE) -> 亡者低语 | D99: =IF(RC10=5,VLOOKUP(RC[-3],Sheet1!R3C9:R23C12,3,FALSE),IF(RC10=6,"22|23|24|25",VLOOKUP(Sheet1!R2C1,Sheet1!R2C1:R2C7,RC[6]+1,FALSE))) -> 0 | E99: =IF(RC10=6,VLOOKUP(RC1,Sheet1!R3C1:R23C7,RC10+1,FALSE)&"|"&VLOOKUP(RC1,Sheet1!R3C1:R23C7,RC10+1,FALSE)&"|"&VLOOKUP(RC1,Sheet1!R3C1:R23C7,RC10+1,FALSE)&"|"&VLOOKUP(RC1,Sheet1!R3C1:R23C7,RC10+1,FALSE),VLOOKUP(RC1,Sheet1!R3C1:R23C7,RC10+1,FALSE)) -> 0 | F99: =IF(RC[-2]=0,VLOOKUP(RC[-5],Sheet1!R3C9:R23C12,4,FALSE),0) -> 10022|10 | G99: ="10020|"&VLOOKUP(RC[-6],Sheet1!R25C1:R44C7,RC[3]+1,FALSE) -> 10020|6 | H99: =IF(RC10=5,VLOOKUP(RC[-7],Sheet1!R3C9:R23C12,2,FALSE),IF(RC10=6,"出战英雄基础属性+"&VLOOKUP(RC1,Sheet1!R3C1:R23C7,RC10+1,FALSE)/100&"%","全体出战英雄"&VLOOKUP(Sheet1!R3C1,Sheet1!R2C1:R3C7,RC[2]+1,FALSE)&"+"&VLOOKUP(RC1,Sheet1!R3C1:R23C7,RC10+1,FALSE))) -> 灵性精粹*10 | I99: buff_jingling | J99: 5
A100: 18 | B100: =IF(RC[-1]=R[-1]C[-1],R[-1]C+1,1) -> 6 | C100: =VLOOKUP(RC[-2],Sheet1!R3C14:R23C15,2,FALSE) -> 亡者低语 | D100: =IF(RC10=5,VLOOKUP(RC[-3],Sheet1!R3C9:R23C12,3,FALSE),IF(RC10=6,"22|23|24|25",VLOOKUP(Sheet1!R2C1,Sheet1!R2C1:R2C7,RC[6]+1,FALSE))) -> 22|23|24|25 | E100: =IF(RC10=6,VLOOKUP(RC1,Sheet1!R3C1:R23C7,RC10+1,FALSE)&"|"&VLOOKUP(RC1,Sheet1!R3C1:R23C7,RC10+1,FALSE)&"|"&VLOOKUP(RC1,Sheet1!R3C1:R23C7,RC10+1,FALSE)&"|"&VLOOKUP(RC1,Sheet1!R3C1:R23C7,RC10+1,FALSE),VLOOKUP(RC1,Sheet1!R3C1:R23C7,RC10+1,FALSE)) -> 400|400|400|400 | F100: =IF(RC[-2]=0,VLOOKUP(RC[-5],Sheet1!R3C9:R23C12,4,FALSE),0) -> 0 | G100: ="10020|"&VLOOKUP(RC[-6],Sheet1!R25C1:R44C7,RC[3]+1,FALSE) -> 10020|0 | H100: =IF(RC10=5,VLOOKUP(RC[-7],Sheet1!R3C9:R23C12,2,FALSE),IF(RC10=6,"出战英雄基础属性+"&VLOOKUP(RC1,Sheet1!R3C1:R23C7,RC10+1,FALSE)/100&"%","全体出战英雄"&VLOOKUP(Sheet1!R3C1,Sheet1!R2C1:R3C7,RC[2]+1,FALSE)&"+"&VLOOKUP(RC1,Sheet1!R3C1:R23C7,RC10+1,FALSE))) -> 出战英雄基础属性+4% | I100: buff_jingling | J100: 6
A101: 19 | B101: =IF(RC[-1]=R[-1]C[-1],R[-1]C+1,1) -> 1 | C101: =VLOOKUP(RC[-2],Sheet1!R3C14:R23C15,2,FALSE) -> 末日彼岸 | D101: =IF(RC10=5,VLOOKUP(RC[-3],Sheet1!R3C9:R23C12,3,FALSE),IF(RC10=6,"22|23|24|25",VLOOKUP(Sheet1!R2C1,Sheet1!R2C1:R2C7,RC[6]+1,FALSE))) -> 4 | E101: =IF(RC10=6,VLOOKUP(RC1,Sheet1!R3C1:R23C7,RC10+1,FALSE)&"|"&VLOOKUP(RC1,Sheet1!R3C1:R23C7,RC10+1,FALSE)&"|"&VLOOKUP(RC1,Sheet1!R3C1:R23C7,RC10+1,FALSE)&"|"&VLOOKUP(RC1,Sheet1!R3C1:R23C7,RC10+1,FALSE),VLOOKUP(RC1,Sheet1!R3C1:R23C7,RC10+1,FALSE)) -> 1000 | F101: =IF(RC[-2]=0,VLOOKUP(RC[-5],Sheet1!R3C9:R23C12,4,FALSE),0) -> 0 | G101: ="10020|"&VLOOKUP(RC[-6],Sheet1!R25C1:R44C7,RC[3]+1,FALSE) -> 10020|6 | H101: =IF(RC10=5,VLOOKUP(RC[-7],Sheet1!R3C9:R23C12,2,FALSE),IF(RC10=6,"出战英雄基础属性+"&VLOOKUP(RC1,Sheet1!R3C1:R23C7,RC10+1,FALSE)/100&"%","全体出战英雄"&VLOOKUP(Sheet1!R3C1,Sheet1!R2C1:R3C7,RC[2]+1,FALSE)&"+"&VLOOKUP(RC1,Sheet1!R3C1:R23C7,RC10+1,FALSE))) -> 全体出战英雄血量+1000 | I101: buff_jingling | J101: 1
A102: 19 | B102: =IF(RC[-1]=R[-1]C[-1],R[-1]C+1,1) -> 2 | C102: =VLOOKUP(RC[-2],Sheet1!R3C14:R23C15,2,FALSE) -> 末日彼岸 | D102: =IF(RC10=5,VLOOKUP(RC[-3],Sheet1!R3C9:R23C12,3,FALSE),IF(RC10=6,"22|23|24|25",VLOOKUP(Sheet1!R2C1,Sheet1!R2C1:R2C7,RC[6]+1,FALSE))) -> 1 | E102: =IF(RC10=6,VLOOKUP(RC1,Sheet1!R3C1:R23C7,RC10+1,FALSE)&"|"&VLOOKUP(RC1,Sheet1!R3C1:R23C7,RC10+1,FALSE)&"|"&VLOOKUP(RC1,Sheet1!R3C1:R23C7,RC10+1,FALSE)&"|"&VLOOKUP(RC1,Sheet1!R3C1:R23C7,RC10+1,FALSE),VLOOKUP(RC1,Sheet1!R3C1:R23C7,RC10+1,FALSE)) -> 100 | F102: =IF(RC[-2]=0,VLOOKUP(RC[-5],Sheet1!R3C9:R23C12,4,FALSE),0) -> 0 | G102: ="10020|"&VLOOKUP(RC[-6],Sheet1!R25C1:R44C7,RC[3]+1,FALSE) -> 10020|6 | H102: =IF(RC10=5,VLOOKUP(RC[-7],Sheet1!R3C9:R23C12,2,FALSE),IF(RC10=6,"出战英雄基础属性+"&VLOOKUP(RC1,Sheet1!R3C1:R23C7,RC10+1,FALSE)/100&"%","全体出战英雄"&VLOOKUP(Sheet1!R3C1,Sheet1!R2C1:R3C7,RC[2]+1,FALSE)&"+"&VLOOKUP(RC1,Sheet1!R3C1:R23C7,RC10+1,FALSE))) -> 全体出战英雄攻击+100 | I102: buff_jingling | J102: 2
A103: 19 | B103: =IF(RC[-1]=R[-1]C[-1],R[-1]C+1,1) -> 3 | C103: =VLOOKUP(RC[-2],Sheet1!R3C14:R23C15,2,FALSE) -> 末日彼岸 | D103: =IF(RC10=5,VLOOKUP(RC[-3],Sheet1!R3C9:R23C12,3,FALSE),IF(RC10=6,"22|23|24|25",VLOOKUP(Sheet1!R2C1,Sheet1!R2C1:R2C7,RC[6]+1,FALSE))) -> 2 | E103: =IF(RC10=6,VLOOKUP(RC1,Sheet1!R3C1:R23C7,RC10+1,FALSE)&"|"&VLOOKUP(RC1,Sheet1!R3C1:R23C7,RC10+1,FALSE)&"|"&VLOOKUP(RC1,Sheet1!R3C1:R23C7,RC10+1,FALSE)&"|"&VLOOKUP(RC1,Sheet1!R3C1:R23C7,RC10+1,FALSE),VLOOKUP(RC1,Sheet1!R3C1:R23C7,RC10+1,FALSE)) -> 100 | F103: =IF(RC[-2]=0,VLOOKUP(RC[-5],Sheet1!R3C9:R23C12,4,FALSE),0) -> 0 | G103: ="10020|"&VLOOKUP(RC[-6],Sheet1!R25C1:R44C7,RC[3]+1,FALSE) -> 10020|6 | H103: =IF(RC10=5,VLOOKUP(RC[-7],Sheet1!R3C9:R23C12,2,FALSE),IF(RC10=6,"出战英雄基础属性+"&VLOOKUP(RC1,Sheet1!R3C1:R23C7,RC10+1,FALSE)/100&"%","全体出战英雄"&VLOOKUP(Sheet1!R3C1,Sheet1!R2C1:R3C7,RC[2]+1,FALSE)&"+"&VLOOKUP(RC1,Sheet1!R3C1:R23C7,RC10+1,FALSE))) -> 全体出战英雄物防+100 | I103: buff_jingling | J103: 3
A104: 19 | B104: =IF(RC[-1]=R[-1]C[-1],R[-1]C+1,1) -> 4 | C104: =VLOOKUP(RC[-2],Sheet1!R3C14:R23C15,2,FALSE) -> 末日彼岸 | D104: =IF(RC10=5,VLOOKUP(RC[-3],Sheet1!R3C9:R23C12,3,FALSE),IF(RC10=6,"22|23|24|25",VLOOKUP(Sheet1!R2C1,Sheet1!R2C1:R2C7,RC[6]+1,FALSE))) -> 3 | E104: =IF(RC10=6,VLOOKUP(RC1,Sheet1!R3C1:R23C7,RC10+1,FALSE)&"|"&VLOOKUP(RC1,Sheet1!R3C1:R23C7,RC10+1,FALSE)&"|"&VLOOKUP(RC1,Sheet1!R3C1:R23C7,RC10+1,FALSE)&"|"&VLOOKUP(RC1,Sheet1!R3C1:R23C7,RC10+1,FALSE),VLOOKUP(RC1,Sheet1!R3C1:R23C7,RC10+1,FALSE)) -> 100 | F104: =IF(RC[-2]=0,VLOOKUP(RC[-5],Sheet1!R3C9:R23C12,4,FALSE),0) -> 0 | G104: ="10020|"&VLOOKUP(RC[-6],Sheet1!R25C1:R44C7,RC[3]+1,FALSE) -> 10020|6 | H104: =IF(RC10=5,VLOOKUP(RC[-7],Sheet1!R3C9:R23C12,2,FALSE),IF(RC10=6,"出战英雄基础属性+"&VLOOKUP(RC1,Sheet1!R3C1:R23C7,RC10+1,FALSE)/100&"%","全体出战英雄"&VLOOKUP(Sheet1!R3C1,Sheet1!R2C1:R3C7,RC[2]+1,FALSE)&"+"&VLOOKUP(RC1,Sheet1!R3C1:R23C7,RC10+1,FALSE))) -> 全体出战英雄魔防+100 | I104: buff_jingling | J104: 4
A105: 19 | B105: =IF(RC[-1]=R[-1]C[-1],R[-1]C+1,1) -> 5 | C105: =VLOOKUP(RC[-2],Sheet1!R3C14:R23C15,2,FALSE) -> 末日彼岸 | D105: =IF(RC10=5,VLOOKUP(RC[-3],Sheet1!R3C9:R23C12,3,FALSE),IF(RC10=6,"22|23|24|25",VLOOKUP(Sheet1!R2C1,Sheet1!R2C1:R2C7,RC[6]+1,FALSE))) -> 0 | E105: =IF(RC10=6,VLOOKUP(RC1,Sheet1!R3C1:R23C7,RC10+1,FALSE)&"|"&VLOOKUP(RC1,Sheet1!R3C1:R23C7,RC10+1,FALSE)&"|"&VLOOKUP(RC1,Sheet1!R3C1:R23C7,RC10+1,FALSE)&"|"&VLOOKUP(RC1,Sheet1!R3C1:R23C7,RC10+1,FALSE),VLOOKUP(RC1,Sheet1!R3C1:R23C7,RC10+1,FALSE)) -> 0 | F105: =IF(RC[-2]=0,VLOOKUP(RC[-5],Sheet1!R3C9:R23C12,4,FALSE),0) -> 10022|10 | G105: ="10020|"&VLOOKUP(RC[-6],Sheet1!R25C1:R44C7,RC[3]+1,FALSE) -> 10020|7 | H105: =IF(RC10=5,VLOOKUP(RC[-7],Sheet1!R3C9:R23C12,2,FALSE),IF(RC10=6,"出战英雄基础属性+"&VLOOKUP(RC1,Sheet1!R3C1:R23C7,RC10+1,FALSE)/100&"%","全体出战英雄"&VLOOKUP(Sheet1!R3C1,Sheet1!R2C1:R3C7,RC[2]+1,FALSE)&"+"&VLOOKUP(RC1,Sheet1!R3C1:R23C7,RC10+1,FALSE))) -> 灵性精粹*10 | I105: buff_jingling | J105: 5
A106: 19 | B106: =IF(RC[-1]=R[-1]C[-1],R[-1]C+1,1) -> 6 | C106: =VLOOKUP(RC[-2],Sheet1!R3C14:R23C15,2,FALSE) -> 末日彼岸 | D106: =IF(RC10=5,VLOOKUP(RC[-3],Sheet1!R3C9:R23C12,3,FALSE),IF(RC10=6,"22|23|24|25",VLOOKUP(Sheet1!R2C1,Sheet1!R2C1:R2C7,RC[6]+1,FALSE))) -> 22|23|24|25 | E106: =IF(RC10=6,VLOOKUP(RC1,Sheet1!R3C1:R23C7,RC10+1,FALSE)&"|"&VLOOKUP(RC1,Sheet1!R3C1:R23C7,RC10+1,FALSE)&"|"&VLOOKUP(RC1,Sheet1!R3C1:R23C7,RC10+1,FALSE)&"|"&VLOOKUP(RC1,Sheet1!R3C1:R23C7,RC10+1,FALSE),VLOOKUP(RC1,Sheet1!R3C1:R23C7,RC10+1,FALSE)) -> 400|400|400|400 | F106: =IF(RC[-2]=0,VLOOKUP(RC[-5],Sheet1!R3C9:R23C12,4,FALSE),0) -> 0 | G106: ="10020|"&VLOOKUP(RC[-6],Sheet1!R25C1:R44C7,RC[3]+1,FALSE) -> 10020|0 | H106: =IF(RC10=5,VLOOKUP(RC[-7],Sheet1!R3C9:R23C12,2,FALSE),IF(RC10=6,"出战英雄基础属性+"&VLOOKUP(RC1,Sheet1!R3C1:R23C7,RC10+1,FALSE)/100&"%","全体出战英雄"&VLOOKUP(Sheet1!R3C1,Sheet1!R2C1:R3C7,RC[2]+1,FALSE)&"+"&VLOOKUP(RC1,Sheet1!R3C1:R23C7,RC10+1,FALSE))) -> 出战英雄基础属性+4% | I106: buff_jingling | J106: 6