Sheet: 配置
A1: 服务端文件名 | B1: 服务端对应工作表号 | C1: 客户端文件名 | D1: 客户端对应工作表号 | E1: erl头部 | F1: erl内容格式 | G1: erl尾部 | H1: 客户端特殊处理
A2: christmas_boss_level.txt | B2: 1 | C2: config_christmas_boss_level.cnf|ChristmasBossLevel | D2: 1 | F2: get(type) -> #$ | H2: 1=>type,level|boss_level_list
A3: christmas_boss.txt | B3: 2 | C3: config_christmas_boss.cnf|ChristmasBoss | D3: 2 | F3: get(type) -> #$ | H3: 2=>type
A4: christmas_snowball.txt | B4: 3 | C4: config_christmas_snowball.cnf|ChristmasSnowBall | D4: 3 | F4: get(id) -> #$ | H4: 2=>id
A5: christmas_score_exchange_shop.txt | B5: 4 | C5: config_christmas_score_exchange_shop.cnf|ChristmasScoreExchangeShop | D5: 4 | F5: get(goods_id) -> #$ | H5: 2=>goods_id
A6: christmas_item_exchange_shop.txt | B6: 5 | C6: config_christmas_item_exchange_shop.cnf|ChristmasItemExchangeShop | D6: 5 | F6: get(goods_id) -> #$ | H6: 2=>goods_id

Sheet: boss等级配置
A1: type|type | B1: level|level | C1: |is_the_last_one | D1: boss_hp|boss_hp | E1: kill_reward_id_list|kill_reward_id_list | F1: kill_reward_num_list|kill_reward_num_list | G1: boss_reward_id_list|boss_reward_id_list | H1: boss_reward_num_list|boss_reward_num_list
A2: 不可空 | B2: 不可空 | C2: 不可空 | D2: 不可空 | E2: 不可空 | F2: 不可空 | G2: 不可空 | H2: 不可空
A3: 数字 | B3: 数字 | C3: 数字 | D3: 数字 | E3: 一维数组 | F3: 一维数组 | G3: 一维数组 | H3: 一维数组
E4: 不定长 | F4: 不定长 | G4: 不定长 | H4: 不定长
A6: boss类型 | B6: 等级 | C6: 是否最后一只 | D6: HP | E6: 击杀奖励ID列表 | F6: 击杀奖励数量列表 | G6: boss奖励ID列表 | H6: boss奖励数量列表 | I6: 50
A7: 1 | B7: 1 | C7: 0 | D7: 15000 | E7: 10087|19005 | F7: =INT(RC[-4]/5)+10&"|88" -> 10|88 | G7: 19005|19103|19006 | H7: =INT(RC[-6]/4-0.25)*10+100&"|"&INT(RC[-6]/4-0.25)*1+10&"|"&INT(RC[-6]/4-0.25)*10+100 -> 100|10|100
A8: 1 | B8: 2 | C8: 0 | D8: 18000 | E8: 10087|19005 | F8: =INT(RC[-4]/5)+10&"|88" -> 10|88 | G8: 19005|19103|19013 | H8: =INT(RC[-6]/4-0.25)*10+100&"|"&INT(RC[-6]/4-0.25)*1+10&"|"&INT(RC[-6]/4-0.25)*100+1000 -> 100|10|1000
A9: 1 | B9: 3 | C9: 0 | D9: 21000 | E9: 10087|19005 | F9: =INT(RC[-4]/5)+10&"|88" -> 10|88 | G9: 19005|19103|19012 | H9: =INT(RC[-6]/4-0.25)*10+100&"|"&INT(RC[-6]/4-0.25)*1+10&"|"&INT(RC[-6]/4-0.25)*100+1000 -> 100|10|1000
A10: 1 | B10: 4 | C10: 0 | D10: 24000 | E10: 10087|19005 | F10: =INT(RC[-4]/5)+10&"|88" -> 10|88 | G10: 19005|19103|19028 | H10: =INT(RC[-6]/4-0.25)*10+100&"|"&INT(RC[-6]/4-0.25)*1+10&"|"&INT(RC[-6]/4-0.25)*10+100 -> 100|10|100
A11: 1 | B11: 5 | C11: 0 | D11: 27000 | E11: 10087|19005 | F11: =INT(RC[-4]/5)+10&"|88" -> 11|88 | G11: 19005|19103|19006 | H11: =INT(RC[-6]/4-0.25)*10+100&"|"&INT(RC[-6]/4-0.25)*1+10&"|"&INT(RC[-6]/4-0.25)*10+100 -> 110|11|110
A12: 1 | B12: 6 | C12: 0 | D12: 30000 | E12: 10087|19005 | F12: =INT(RC[-4]/5)+10&"|88" -> 11|88 | G12: 19005|19103|19013 | H12: =INT(RC[-6]/4-0.25)*10+100&"|"&INT(RC[-6]/4-0.25)*1+10&"|"&INT(RC[-6]/4-0.25)*100+1000 -> 110|11|1100
A13: 1 | B13: 7 | C13: 0 | D13: 33000 | E13: 10087|19005 | F13: =INT(RC[-4]/5)+10&"|88" -> 11|88 | G13: 19005|19103|19012 | H13: =INT(RC[-6]/4-0.25)*10+100&"|"&INT(RC[-6]/4-0.25)*1+10&"|"&INT(RC[-6]/4-0.25)*100+1000 -> 110|11|1100
A14: 1 | B14: 8 | C14: 0 | D14: 36000 | E14: 10087|19005 | F14: =INT(RC[-4]/5)+10&"|88" -> 11|88 | G14: 19005|19103|19028 | H14: =INT(RC[-6]/4-0.25)*10+100&"|"&INT(RC[-6]/4-0.25)*1+10&"|"&INT(RC[-6]/4-0.25)*10+100 -> 110|11|110
A15: 1 | B15: 9 | C15: 0 | D15: 39000 | E15: 10087|19005 | F15: =INT(RC[-4]/5)+10&"|88" -> 11|88 | G15: 19005|19103|19006 | H15: =INT(RC[-6]/4-0.25)*10+100&"|"&INT(RC[-6]/4-0.25)*1+10&"|"&INT(RC[-6]/4-0.25)*10+100 -> 120|12|120
A16: 1 | B16: 10 | C16: 0 | D16: 42000 | E16: 10087|19005 | F16: =INT(RC[-4]/5)+10&"|88" -> 12|88 | G16: 19005|19103|19013 | H16: =INT(RC[-6]/4-0.25)*10+100&"|"&INT(RC[-6]/4-0.25)*1+10&"|"&INT(RC[-6]/4-0.25)*100+1000 -> 120|12|1200
A17: 1 | B17: 11 | C17: 0 | D17: 45000 | E17: 10087|19005 | F17: =INT(RC[-4]/5)+10&"|88" -> 12|88 | G17: 19005|19103|19012 | H17: =INT(RC[-6]/4-0.25)*10+100&"|"&INT(RC[-6]/4-0.25)*1+10&"|"&INT(RC[-6]/4-0.25)*100+1000 -> 120|12|1200
A18: 1 | B18: 12 | C18: 0 | D18: 48000 | E18: 10087|19005 | F18: =INT(RC[-4]/5)+10&"|88" -> 12|88 | G18: 19005|19103|19028 | H18: =INT(RC[-6]/4-0.25)*10+100&"|"&INT(RC[-6]/4-0.25)*1+10&"|"&INT(RC[-6]/4-0.25)*10+100 -> 120|12|120
A19: 1 | B19: 13 | C19: 0 | D19: 51000 | E19: 10087|19005 | F19: =INT(RC[-4]/5)+10&"|88" -> 12|88 | G19: 19005|19103|19006 | H19: =INT(RC[-6]/4-0.25)*10+100&"|"&INT(RC[-6]/4-0.25)*1+10&"|"&INT(RC[-6]/4-0.25)*10+100 -> 130|13|130
A20: 1 | B20: 14 | C20: 0 | D20: 54000 | E20: 10087|19005 | F20: =INT(RC[-4]/5)+10&"|88" -> 12|88 | G20: 19005|19103|19013 | H20: =INT(RC[-6]/4-0.25)*10+100&"|"&INT(RC[-6]/4-0.25)*1+10&"|"&INT(RC[-6]/4-0.25)*100+1000 -> 130|13|1300
A21: 1 | B21: 15 | C21: 0 | D21: 57000 | E21: 10087|19005 | F21: =INT(RC[-4]/5)+10&"|88" -> 13|88 | G21: 19005|19103|19012 | H21: =INT(RC[-6]/4-0.25)*10+100&"|"&INT(RC[-6]/4-0.25)*1+10&"|"&INT(RC[-6]/4-0.25)*100+1000 -> 130|13|1300
A22: 1 | B22: 16 | C22: 0 | D22: 60000 | E22: 10087|19005 | F22: =INT(RC[-4]/5)+10&"|88" -> 13|88 | G22: 19005|19103|19028 | H22: =INT(RC[-6]/4-0.25)*10+100&"|"&INT(RC[-6]/4-0.25)*1+10&"|"&INT(RC[-6]/4-0.25)*10+100 -> 130|13|130
A23: 1 | B23: 17 | C23: 0 | D23: 63000 | E23: 10087|19005 | F23: =INT(RC[-4]/5)+10&"|88" -> 13|88 | G23: 19005|19103|19006 | H23: =INT(RC[-6]/4-0.25)*10+100&"|"&INT(RC[-6]/4-0.25)*1+10&"|"&INT(RC[-6]/4-0.25)*10+100 -> 140|14|140
A24: 1 | B24: 18 | C24: 0 | D24: 66000 | E24: 10087|19005 | F24: =INT(RC[-4]/5)+10&"|88" -> 13|88 | G24: 19005|19103|19013 | H24: =INT(RC[-6]/4-0.25)*10+100&"|"&INT(RC[-6]/4-0.25)*1+10&"|"&INT(RC[-6]/4-0.25)*100+1000 -> 140|14|1400
A25: 1 | B25: 19 | C25: 0 | D25: 69000 | E25: 10087|19005 | F25: =INT(RC[-4]/5)+10&"|88" -> 13|88 | G25: 19005|19103|19012 | H25: =INT(RC[-6]/4-0.25)*10+100&"|"&INT(RC[-6]/4-0.25)*1+10&"|"&INT(RC[-6]/4-0.25)*100+1000 -> 140|14|1400
A26: 1 | B26: 20 | C26: 0 | D26: 72000 | E26: 10087|19005 | F26: =INT(RC[-4]/5)+10&"|88" -> 14|88 | G26: 19005|19103|19028 | H26: =INT(RC[-6]/4-0.25)*10+100&"|"&INT(RC[-6]/4-0.25)*1+10&"|"&INT(RC[-6]/4-0.25)*10+100 -> 140|14|140
A27: 1 | B27: 21 | C27: 0 | D27: 75000 | E27: 10087|19005 | F27: =INT(RC[-4]/5)+10&"|88" -> 14|88 | G27: 19005|19103|19006 | H27: =INT(RC[-6]/4-0.25)*10+100&"|"&INT(RC[-6]/4-0.25)*1+10&"|"&INT(RC[-6]/4-0.25)*10+100 -> 150|15|150
A28: 1 | B28: 22 | C28: 0 | D28: 78000 | E28: 10087|19005 | F28: =INT(RC[-4]/5)+10&"|88" -> 14|88 | G28: 19005|19103|19013 | H28: =INT(RC[-6]/4-0.25)*10+100&"|"&INT(RC[-6]/4-0.25)*1+10&"|"&INT(RC[-6]/4-0.25)*100+1000 -> 150|15|1500
A29: 1 | B29: 23 | C29: 0 | D29: 81000 | E29: 10087|19005 | F29: =INT(RC[-4]/5)+10&"|88" -> 14|88 | G29: 19005|19103|19012 | H29: =INT(RC[-6]/4-0.25)*10+100&"|"&INT(RC[-6]/4-0.25)*1+10&"|"&INT(RC[-6]/4-0.25)*100+1000 -> 150|15|1500
A30: 1 | B30: 24 | C30: 0 | D30: 84000 | E30: 10087|19005 | F30: =INT(RC[-4]/5)+10&"|88" -> 14|88 | G30: 19005|19103|19028 | H30: =INT(RC[-6]/4-0.25)*10+100&"|"&INT(RC[-6]/4-0.25)*1+10&"|"&INT(RC[-6]/4-0.25)*10+100 -> 150|15|150
A31: 1 | B31: 25 | C31: 0 | D31: 87000 | E31: 10087|19005 | F31: =INT(RC[-4]/5)+10&"|88" -> 15|88 | G31: 19005|19103|19006 | H31: =INT(RC[-6]/4-0.25)*10+100&"|"&INT(RC[-6]/4-0.25)*1+10&"|"&INT(RC[-6]/4-0.25)*10+100 -> 160|16|160
A32: 1 | B32: 26 | C32: 0 | D32: 90000 | E32: 10087|19005 | F32: =INT(RC[-4]/5)+10&"|88" -> 15|88 | G32: 19005|19103|19013 | H32: =INT(RC[-6]/4-0.25)*10+100&"|"&INT(RC[-6]/4-0.25)*1+10&"|"&INT(RC[-6]/4-0.25)*100+1000 -> 160|16|1600
A33: 1 | B33: 27 | C33: 0 | D33: 93000 | E33: 10087|19005 | F33: =INT(RC[-4]/5)+10&"|88" -> 15|88 | G33: 19005|19103|19012 | H33: =INT(RC[-6]/4-0.25)*10+100&"|"&INT(RC[-6]/4-0.25)*1+10&"|"&INT(RC[-6]/4-0.25)*100+1000 -> 160|16|1600
A34: 1 | B34: 28 | C34: 0 | D34: 96000 | E34: 10087|19005 | F34: =INT(RC[-4]/5)+10&"|88" -> 15|88 | G34: 19005|19103|19028 | H34: =INT(RC[-6]/4-0.25)*10+100&"|"&INT(RC[-6]/4-0.25)*1+10&"|"&INT(RC[-6]/4-0.25)*10+100 -> 160|16|160
A35: 1 | B35: 29 | C35: 0 | D35: 99000 | E35: 10087|19005 | F35: =INT(RC[-4]/5)+10&"|88" -> 15|88 | G35: 19005|19103|19006 | H35: =INT(RC[-6]/4-0.25)*10+100&"|"&INT(RC[-6]/4-0.25)*1+10&"|"&INT(RC[-6]/4-0.25)*10+100 -> 170|17|170
A36: 1 | B36: 30 | C36: 0 | D36: 102000 | E36: 10087|19005 | F36: =INT(RC[-4]/5)+10&"|88" -> 16|88 | G36: 19005|19103|19013 | H36: =INT(RC[-6]/4-0.25)*10+100&"|"&INT(RC[-6]/4-0.25)*1+10&"|"&INT(RC[-6]/4-0.25)*100+1000 -> 170|17|1700
A37: 1 | B37: 31 | C37: 0 | D37: 105000 | E37: 10087|19005 | F37: =INT(RC[-4]/5)+10&"|88" -> 16|88 | G37: 19005|19103|19012 | H37: =INT(RC[-6]/4-0.25)*10+100&"|"&INT(RC[-6]/4-0.25)*1+10&"|"&INT(RC[-6]/4-0.25)*100+1000 -> 170|17|1700
A38: 1 | B38: 32 | C38: 0 | D38: 108000 | E38: 10087|19005 | F38: =INT(RC[-4]/5)+10&"|88" -> 16|88 | G38: 19005|19103|19028 | H38: =INT(RC[-6]/4-0.25)*10+100&"|"&INT(RC[-6]/4-0.25)*1+10&"|"&INT(RC[-6]/4-0.25)*10+100 -> 170|17|170
A39: 1 | B39: 33 | C39: 0 | D39: 111000 | E39: 10087|19005 | F39: =INT(RC[-4]/5)+10&"|88" -> 16|88 | G39: 19005|19103|19006 | H39: =INT(RC[-6]/4-0.25)*10+100&"|"&INT(RC[-6]/4-0.25)*1+10&"|"&INT(RC[-6]/4-0.25)*10+100 -> 180|18|180
A40: 1 | B40: 34 | C40: 0 | D40: 114000 | E40: 10087|19005 | F40: =INT(RC[-4]/5)+10&"|88" -> 16|88 | G40: 19005|19103|19013 | H40: =INT(RC[-6]/4-0.25)*10+100&"|"&INT(RC[-6]/4-0.25)*1+10&"|"&INT(RC[-6]/4-0.25)*100+1000 -> 180|18|1800
A41: 1 | B41: 35 | C41: 0 | D41: 117000 | E41: 10087|19005 | F41: =INT(RC[-4]/5)+10&"|88" -> 17|88 | G41: 19005|19103|19012 | H41: =INT(RC[-6]/4-0.25)*10+100&"|"&INT(RC[-6]/4-0.25)*1+10&"|"&INT(RC[-6]/4-0.25)*100+1000 -> 180|18|1800
A42: 1 | B42: 36 | C42: 0 | D42: 120000 | E42: 10087|19005 | F42: =INT(RC[-4]/5)+10&"|88" -> 17|88 | G42: 19005|19103|19028 | H42: =INT(RC[-6]/4-0.25)*10+100&"|"&INT(RC[-6]/4-0.25)*1+10&"|"&INT(RC[-6]/4-0.25)*10+100 -> 180|18|180
A43: 1 | B43: 37 | C43: 0 | D43: 123000 | E43: 10087|19005 | F43: =INT(RC[-4]/5)+10&"|88" -> 17|88 | G43: 19005|19103|19006 | H43: =INT(RC[-6]/4-0.25)*10+100&"|"&INT(RC[-6]/4-0.25)*1+10&"|"&INT(RC[-6]/4-0.25)*10+100 -> 190|19|190
A44: 1 | B44: 38 | C44: 0 | D44: 126000 | E44: 10087|19005 | F44: =INT(RC[-4]/5)+10&"|88" -> 17|88 | G44: 19005|19103|19013 | H44: =INT(RC[-6]/4-0.25)*10+100&"|"&INT(RC[-6]/4-0.25)*1+10&"|"&INT(RC[-6]/4-0.25)*100+1000 -> 190|19|1900
A45: 1 | B45: 39 | C45: 0 | D45: 129000 | E45: 10087|19005 | F45: =INT(RC[-4]/5)+10&"|88" -> 17|88 | G45: 19005|19103|19012 | H45: =INT(RC[-6]/4-0.25)*10+100&"|"&INT(RC[-6]/4-0.25)*1+10&"|"&INT(RC[-6]/4-0.25)*100+1000 -> 190|19|1900
A46: 1 | B46: 40 | C46: 0 | D46: 132000 | E46: 10087|19005 | F46: =INT(RC[-4]/5)+10&"|88" -> 18|88 | G46: 19005|19103|19028 | H46: =INT(RC[-6]/4-0.25)*10+100&"|"&INT(RC[-6]/4-0.25)*1+10&"|"&INT(RC[-6]/4-0.25)*10+100 -> 190|19|190
A47: 1 | B47: 41 | C47: 0 | D47: 135000 | E47: 10087|19005 | F47: =INT(RC[-4]/5)+10&"|88" -> 18|88 | G47: 19005|19103|19006 | H47: =INT(RC[-6]/4-0.25)*10+100&"|"&INT(RC[-6]/4-0.25)*1+10&"|"&INT(RC[-6]/4-0.25)*10+100 -> 200|20|200
A48: 1 | B48: 42 | C48: 0 | D48: 138000 | E48: 10087|19005 | F48: =INT(RC[-4]/5)+10&"|88" -> 18|88 | G48: 19005|19103|19013 | H48: =INT(RC[-6]/4-0.25)*10+100&"|"&INT(RC[-6]/4-0.25)*1+10&"|"&INT(RC[-6]/4-0.25)*100+1000 -> 200|20|2000
A49: 1 | B49: 43 | C49: 0 | D49: 141000 | E49: 10087|19005 | F49: =INT(RC[-4]/5)+10&"|88" -> 18|88 | G49: 19005|19103|19012 | H49: =INT(RC[-6]/4-0.25)*10+100&"|"&INT(RC[-6]/4-0.25)*1+10&"|"&INT(RC[-6]/4-0.25)*100+1000 -> 200|20|2000
A50: 1 | B50: 44 | C50: 0 | D50: 144000 | E50: 10087|19005 | F50: =INT(RC[-4]/5)+10&"|88" -> 18|88 | G50: 19005|19103|19028 | H50: =INT(RC[-6]/4-0.25)*10+100&"|"&INT(RC[-6]/4-0.25)*1+10&"|"&INT(RC[-6]/4-0.25)*10+100 -> 200|20|200
A51: 1 | B51: 45 | C51: 0 | D51: 147000 | E51: 10087|19005 | F51: =INT(RC[-4]/5)+10&"|88" -> 19|88 | G51: 19005|19103|19006 | H51: =INT(RC[-6]/4-0.25)*10+100&"|"&INT(RC[-6]/4-0.25)*1+10&"|"&INT(RC[-6]/4-0.25)*10+100 -> 210|21|210
A52: 1 | B52: 46 | C52: 0 | D52: 150000 | E52: 10087|19005 | F52: =INT(RC[-4]/5)+10&"|88" -> 19|88 | G52: 19005|19103|19013 | H52: =INT(RC[-6]/4-0.25)*10+100&"|"&INT(RC[-6]/4-0.25)*1+10&"|"&INT(RC[-6]/4-0.25)*100+1000 -> 210|21|2100
A53: 1 | B53: 47 | C53: 0 | D53: 153000 | E53: 10087|19005 | F53: =INT(RC[-4]/5)+10&"|88" -> 19|88 | G53: 19005|19103|19012 | H53: =INT(RC[-6]/4-0.25)*10+100&"|"&INT(RC[-6]/4-0.25)*1+10&"|"&INT(RC[-6]/4-0.25)*100+1000 -> 210|21|2100
A54: 1 | B54: 48 | C54: 0 | D54: 156000 | E54: 10087|19005 | F54: =INT(RC[-4]/5)+10&"|88" -> 19|88 | G54: 19005|19103|19028 | H54: =INT(RC[-6]/4-0.25)*10+100&"|"&INT(RC[-6]/4-0.25)*1+10&"|"&INT(RC[-6]/4-0.25)*10+100 -> 210|21|210
A55: 1 | B55: 49 | C55: 0 | D55: 159000 | E55: 10087|19005 | F55: =INT(RC[-4]/5)+10&"|88" -> 19|88 | G55: 19005|19103|19006 | H55: =INT(RC[-6]/4-0.25)*10+100&"|"&INT(RC[-6]/4-0.25)*1+10&"|"&INT(RC[-6]/4-0.25)*10+100 -> 220|22|220
A56: 1 | B56: 50 | C56: 0 | D56: 162000 | E56: 10087|19005 | F56: =INT(RC[-4]/5)+10&"|88" -> 20|88 | G56: 19005|19103|19013 | H56: =INT(RC[-6]/4-0.25)*10+100&"|"&INT(RC[-6]/4-0.25)*1+10&"|"&INT(RC[-6]/4-0.25)*100+1000 -> 220|22|2200
A57: 1 | B57: 51 | C57: 0 | D57: 165000 | E57: 10087|19005 | F57: =INT(RC[-4]/5)+10&"|88" -> 20|88 | G57: 19005|19103|19012 | H57: =INT(RC[-6]/4-0.25)*10+100&"|"&INT(RC[-6]/4-0.25)*1+10&"|"&INT(RC[-6]/4-0.25)*100+1000 -> 220|22|2200
A58: 1 | B58: 52 | C58: 0 | D58: 168000 | E58: 10087|19005 | F58: =INT(RC[-4]/5)+10&"|88" -> 20|88 | G58: 19005|19103|19028 | H58: =INT(RC[-6]/4-0.25)*10+100&"|"&INT(RC[-6]/4-0.25)*1+10&"|"&INT(RC[-6]/4-0.25)*10+100 -> 220|22|220
A59: 1 | B59: 53 | C59: 0 | D59: 171000 | E59: 10087|19005 | F59: =INT(RC[-4]/5)+10&"|88" -> 20|88 | G59: 19005|19103|19006 | H59: =INT(RC[-6]/4-0.25)*10+100&"|"&INT(RC[-6]/4-0.25)*1+10&"|"&INT(RC[-6]/4-0.25)*10+100 -> 230|23|230
A60: 1 | B60: 54 | C60: 0 | D60: 174000 | E60: 10087|19005 | F60: =INT(RC[-4]/5)+10&"|88" -> 20|88 | G60: 19005|19103|19013 | H60: =INT(RC[-6]/4-0.25)*10+100&"|"&INT(RC[-6]/4-0.25)*1+10&"|"&INT(RC[-6]/4-0.25)*100+1000 -> 230|23|2300
A61: 1 | B61: 55 | C61: 0 | D61: 177000 | E61: 10087|19005 | F61: =INT(RC[-4]/5)+10&"|88" -> 21|88 | G61: 19005|19103|19012 | H61: =INT(RC[-6]/4-0.25)*10+100&"|"&INT(RC[-6]/4-0.25)*1+10&"|"&INT(RC[-6]/4-0.25)*100+1000 -> 230|23|2300
A62: 1 | B62: 56 | C62: 0 | D62: 180000 | E62: 10087|19005 | F62: =INT(RC[-4]/5)+10&"|88" -> 21|88 | G62: 19005|19103|19028 | H62: =INT(RC[-6]/4-0.25)*10+100&"|"&INT(RC[-6]/4-0.25)*1+10&"|"&INT(RC[-6]/4-0.25)*10+100 -> 230|23|230
A63: 1 | B63: 57 | C63: 0 | D63: 183000 | E63: 10087|19005 | F63: =INT(RC[-4]/5)+10&"|88" -> 21|88 | G63: 19005|19103|19006 | H63: =INT(RC[-6]/4-0.25)*10+100&"|"&INT(RC[-6]/4-0.25)*1+10&"|"&INT(RC[-6]/4-0.25)*10+100 -> 240|24|240
A64: 1 | B64: 58 | C64: 0 | D64: 186000 | E64: 10087|19005 | F64: =INT(RC[-4]/5)+10&"|88" -> 21|88 | G64: 19005|19103|19013 | H64: =INT(RC[-6]/4-0.25)*10+100&"|"&INT(RC[-6]/4-0.25)*1+10&"|"&INT(RC[-6]/4-0.25)*100+1000 -> 240|24|2400
A65: 1 | B65: 59 | C65: 0 | D65: 189000 | E65: 10087|19005 | F65: =INT(RC[-4]/5)+10&"|88" -> 21|88 | G65: 19005|19103|19012 | H65: =INT(RC[-6]/4-0.25)*10+100&"|"&INT(RC[-6]/4-0.25)*1+10&"|"&INT(RC[-6]/4-0.25)*100+1000 -> 240|24|2400
A66: 1 | B66: 60 | C66: 0 | D66: 192000 | E66: 10087|19005 | F66: =INT(RC[-4]/5)+10&"|88" -> 22|88 | G66: 19005|19103|19028 | H66: =INT(RC[-6]/4-0.25)*10+100&"|"&INT(RC[-6]/4-0.25)*1+10&"|"&INT(RC[-6]/4-0.25)*10+100 -> 240|24|240
A67: 1 | B67: 61 | C67: 0 | D67: 195000 | E67: 10087|19005 | F67: =INT(RC[-4]/5)+10&"|88" -> 22|88 | G67: 19005|19103|19006 | H67: =INT(RC[-6]/4-0.25)*10+100&"|"&INT(RC[-6]/4-0.25)*1+10&"|"&INT(RC[-6]/4-0.25)*10+100 -> 250|25|250
A68: 1 | B68: 62 | C68: 0 | D68: 198000 | E68: 10087|19005 | F68: =INT(RC[-4]/5)+10&"|88" -> 22|88 | G68: 19005|19103|19013 | H68: =INT(RC[-6]/4-0.25)*10+100&"|"&INT(RC[-6]/4-0.25)*1+10&"|"&INT(RC[-6]/4-0.25)*100+1000 -> 250|25|2500
A69: 1 | B69: 63 | C69: 0 | D69: 201000 | E69: 10087|19005 | F69: =INT(RC[-4]/5)+10&"|88" -> 22|88 | G69: 19005|19103|19012 | H69: =INT(RC[-6]/4-0.25)*10+100&"|"&INT(RC[-6]/4-0.25)*1+10&"|"&INT(RC[-6]/4-0.25)*100+1000 -> 250|25|2500
A70: 1 | B70: 64 | C70: 0 | D70: 204000 | E70: 10087|19005 | F70: =INT(RC[-4]/5)+10&"|88" -> 22|88 | G70: 19005|19103|19028 | H70: =INT(RC[-6]/4-0.25)*10+100&"|"&INT(RC[-6]/4-0.25)*1+10&"|"&INT(RC[-6]/4-0.25)*10+100 -> 250|25|250
A71: 1 | B71: 65 | C71: 0 | D71: 207000 | E71: 10087|19005 | F71: =INT(RC[-4]/5)+10&"|88" -> 23|88 | G71: 19005|19103|19006 | H71: =INT(RC[-6]/4-0.25)*10+100&"|"&INT(RC[-6]/4-0.25)*1+10&"|"&INT(RC[-6]/4-0.25)*10+100 -> 260|26|260
A72: 1 | B72: 66 | C72: 0 | D72: 210000 | E72: 10087|19005 | F72: =INT(RC[-4]/5)+10&"|88" -> 23|88 | G72: 19005|19103|19013 | H72: =INT(RC[-6]/4-0.25)*10+100&"|"&INT(RC[-6]/4-0.25)*1+10&"|"&INT(RC[-6]/4-0.25)*100+1000 -> 260|26|2600
A73: 1 | B73: 67 | C73: 0 | D73: 213000 | E73: 10087|19005 | F73: =INT(RC[-4]/5)+10&"|88" -> 23|88 | G73: 19005|19103|19012 | H73: =INT(RC[-6]/4-0.25)*10+100&"|"&INT(RC[-6]/4-0.25)*1+10&"|"&INT(RC[-6]/4-0.25)*100+1000 -> 260|26|2600
A74: 1 | B74: 68 | C74: 0 | D74: 216000 | E74: 10087|19005 | F74: =INT(RC[-4]/5)+10&"|88" -> 23|88 | G74: 19005|19103|19028 | H74: =INT(RC[-6]/4-0.25)*10+100&"|"&INT(RC[-6]/4-0.25)*1+10&"|"&INT(RC[-6]/4-0.25)*10+100 -> 260|26|260
A75: 1 | B75: 69 | C75: 0 | D75: 219000 | E75: 10087|19005 | F75: =INT(RC[-4]/5)+10&"|88" -> 23|88 | G75: 19005|19103|19006 | H75: =INT(RC[-6]/4-0.25)*10+100&"|"&INT(RC[-6]/4-0.25)*1+10&"|"&INT(RC[-6]/4-0.25)*10+100 -> 270|27|270
A76: 1 | B76: 70 | C76: 0 | D76: 222000 | E76: 10087|19005 | F76: =INT(RC[-4]/5)+10&"|88" -> 24|88 | G76: 19005|19103|19013 | H76: =INT(RC[-6]/4-0.25)*10+100&"|"&INT(RC[-6]/4-0.25)*1+10&"|"&INT(RC[-6]/4-0.25)*100+1000 -> 270|27|2700
A77: 1 | B77: 71 | C77: 0 | D77: 225000 | E77: 10087|19005 | F77: =INT(RC[-4]/5)+10&"|88" -> 24|88 | G77: 19005|19103|19012 | H77: =INT(RC[-6]/4-0.25)*10+100&"|"&INT(RC[-6]/4-0.25)*1+10&"|"&INT(RC[-6]/4-0.25)*100+1000 -> 270|27|2700
A78: 1 | B78: 72 | C78: 0 | D78: 228000 | E78: 10087|19005 | F78: =INT(RC[-4]/5)+10&"|88" -> 24|88 | G78: 19005|19103|19028 | H78: =INT(RC[-6]/4-0.25)*10+100&"|"&INT(RC[-6]/4-0.25)*1+10&"|"&INT(RC[-6]/4-0.25)*10+100 -> 270|27|270
A79: 1 | B79: 73 | C79: 0 | D79: 231000 | E79: 10087|19005 | F79: =INT(RC[-4]/5)+10&"|88" -> 24|88 | G79: 19005|19103|19006 | H79: =INT(RC[-6]/4-0.25)*10+100&"|"&INT(RC[-6]/4-0.25)*1+10&"|"&INT(RC[-6]/4-0.25)*10+100 -> 280|28|280
A80: 1 | B80: 74 | C80: 0 | D80: 234000 | E80: 10087|19005 | F80: =INT(RC[-4]/5)+10&"|88" -> 24|88 | G80: 19005|19103|19013 | H80: =INT(RC[-6]/4-0.25)*10+100&"|"&INT(RC[-6]/4-0.25)*1+10&"|"&INT(RC[-6]/4-0.25)*100+1000 -> 280|28|2800
A81: 1 | B81: 75 | C81: 0 | D81: 237000 | E81: 10087|19005 | F81: =INT(RC[-4]/5)+10&"|88" -> 25|88 | G81: 19005|19103|19012 | H81: =INT(RC[-6]/4-0.25)*10+100&"|"&INT(RC[-6]/4-0.25)*1+10&"|"&INT(RC[-6]/4-0.25)*100+1000 -> 280|28|2800
A82: 1 | B82: 76 | C82: 0 | D82: 240000 | E82: 10087|19005 | F82: =INT(RC[-4]/5)+10&"|88" -> 25|88 | G82: 19005|19103|19028 | H82: =INT(RC[-6]/4-0.25)*10+100&"|"&INT(RC[-6]/4-0.25)*1+10&"|"&INT(RC[-6]/4-0.25)*10+100 -> 280|28|280
A83: 1 | B83: 77 | C83: 0 | D83: 243000 | E83: 10087|19005 | F83: =INT(RC[-4]/5)+10&"|88" -> 25|88 | G83: 19005|19103|19006 | H83: =INT(RC[-6]/4-0.25)*10+100&"|"&INT(RC[-6]/4-0.25)*1+10&"|"&INT(RC[-6]/4-0.25)*10+100 -> 290|29|290
A84: 1 | B84: 78 | C84: 0 | D84: 246000 | E84: 10087|19005 | F84: =INT(RC[-4]/5)+10&"|88" -> 25|88 | G84: 19005|19103|19013 | H84: =INT(RC[-6]/4-0.25)*10+100&"|"&INT(RC[-6]/4-0.25)*1+10&"|"&INT(RC[-6]/4-0.25)*100+1000 -> 290|29|2900
A85: 1 | B85: 79 | C85: 0 | D85: 249000 | E85: 10087|19005 | F85: =INT(RC[-4]/5)+10&"|88" -> 25|88 | G85: 19005|19103|19012 | H85: =INT(RC[-6]/4-0.25)*10+100&"|"&INT(RC[-6]/4-0.25)*1+10&"|"&INT(RC[-6]/4-0.25)*100+1000 -> 290|29|2900
A86: 1 | B86: 80 | C86: 0 | D86: 252000 | E86: 10087|19005 | F86: =INT(RC[-4]/5)+10&"|88" -> 26|88 | G86: 19005|19103|19028 | H86: =INT(RC[-6]/4-0.25)*10+100&"|"&INT(RC[-6]/4-0.25)*1+10&"|"&INT(RC[-6]/4-0.25)*10+100 -> 290|29|290
A87: 1 | B87: 81 | C87: 0 | D87: 255000 | E87: 10087|19005 | F87: =INT(RC[-4]/5)+10&"|88" -> 26|88 | G87: 19005|19103|19006 | H87: =INT(RC[-6]/4-0.25)*10+100&"|"&INT(RC[-6]/4-0.25)*1+10&"|"&INT(RC[-6]/4-0.25)*10+100 -> 300|30|300
A88: 1 | B88: 82 | C88: 0 | D88: 258000 | E88: 10087|19005 | F88: =INT(RC[-4]/5)+10&"|88" -> 26|88 | G88: 19005|19103|19013 | H88: =INT(RC[-6]/4-0.25)*10+100&"|"&INT(RC[-6]/4-0.25)*1+10&"|"&INT(RC[-6]/4-0.25)*100+1000 -> 300|30|3000
A89: 1 | B89: 83 | C89: 0 | D89: 261000 | E89: 10087|19005 | F89: =INT(RC[-4]/5)+10&"|88" -> 26|88 | G89: 19005|19103|19012 | H89: =INT(RC[-6]/4-0.25)*10+100&"|"&INT(RC[-6]/4-0.25)*1+10&"|"&INT(RC[-6]/4-0.25)*100+1000 -> 300|30|3000
A90: 1 | B90: 84 | C90: 0 | D90: 264000 | E90: 10087|19005 | F90: =INT(RC[-4]/5)+10&"|88" -> 26|88 | G90: 19005|19103|19028 | H90: =INT(RC[-6]/4-0.25)*10+100&"|"&INT(RC[-6]/4-0.25)*1+10&"|"&INT(RC[-6]/4-0.25)*10+100 -> 300|30|300
A91: 1 | B91: 85 | C91: 0 | D91: 267000 | E91: 10087|19005 | F91: =INT(RC[-4]/5)+10&"|88" -> 27|88 | G91: 19005|19103|19006 | H91: =INT(RC[-6]/4-0.25)*10+100&"|"&INT(RC[-6]/4-0.25)*1+10&"|"&INT(RC[-6]/4-0.25)*10+100 -> 310|31|310
A92: 1 | B92: 86 | C92: 0 | D92: 270000 | E92: 10087|19005 | F92: =INT(RC[-4]/5)+10&"|88" -> 27|88 | G92: 19005|19103|19013 | H92: =INT(RC[-6]/4-0.25)*10+100&"|"&INT(RC[-6]/4-0.25)*1+10&"|"&INT(RC[-6]/4-0.25)*100+1000 -> 310|31|3100
A93: 1 | B93: 87 | C93: 0 | D93: 273000 | E93: 10087|19005 | F93: =INT(RC[-4]/5)+10&"|88" -> 27|88 | G93: 19005|19103|19012 | H93: =INT(RC[-6]/4-0.25)*10+100&"|"&INT(RC[-6]/4-0.25)*1+10&"|"&INT(RC[-6]/4-0.25)*100+1000 -> 310|31|3100
A94: 1 | B94: 88 | C94: 0 | D94: 276000 | E94: 10087|19005 | F94: =INT(RC[-4]/5)+10&"|88" -> 27|88 | G94: 19005|19103|19028 | H94: =INT(RC[-6]/4-0.25)*10+100&"|"&INT(RC[-6]/4-0.25)*1+10&"|"&INT(RC[-6]/4-0.25)*10+100 -> 310|31|310
A95: 1 | B95: 89 | C95: 0 | D95: 279000 | E95: 10087|19005 | F95: =INT(RC[-4]/5)+10&"|88" -> 27|88 | G95: 19005|19103|19006 | H95: =INT(RC[-6]/4-0.25)*10+100&"|"&INT(RC[-6]/4-0.25)*1+10&"|"&INT(RC[-6]/4-0.25)*10+100 -> 320|32|320
A96: 1 | B96: 90 | C96: 0 | D96: 282000 | E96: 10087|19005 | F96: =INT(RC[-4]/5)+10&"|88" -> 28|88 | G96: 19005|19103|19013 | H96: =INT(RC[-6]/4-0.25)*10+100&"|"&INT(RC[-6]/4-0.25)*1+10&"|"&INT(RC[-6]/4-0.25)*100+1000 -> 320|32|3200
A97: 1 | B97: 91 | C97: 0 | D97: 285000 | E97: 10087|19005 | F97: =INT(RC[-4]/5)+10&"|88" -> 28|88 | G97: 19005|19103|19012 | H97: =INT(RC[-6]/4-0.25)*10+100&"|"&INT(RC[-6]/4-0.25)*1+10&"|"&INT(RC[-6]/4-0.25)*100+1000 -> 320|32|3200
A98: 1 | B98: 92 | C98: 0 | D98: 288000 | E98: 10087|19005 | F98: =INT(RC[-4]/5)+10&"|88" -> 28|88 | G98: 19005|19103|19028 | H98: =INT(RC[-6]/4-0.25)*10+100&"|"&INT(RC[-6]/4-0.25)*1+10&"|"&INT(RC[-6]/4-0.25)*10+100 -> 320|32|320
A99: 1 | B99: 93 | C99: 0 | D99: 291000 | E99: 10087|19005 | F99: =INT(RC[-4]/5)+10&"|88" -> 28|88 | G99: 19005|19103|19006 | H99: =INT(RC[-6]/4-0.25)*10+100&"|"&INT(RC[-6]/4-0.25)*1+10&"|"&INT(RC[-6]/4-0.25)*10+100 -> 330|33|330
A100: 1 | B100: 94 | C100: 0 | D100: 294000 | E100: 10087|19005 | F100: =INT(RC[-4]/5)+10&"|88" -> 28|88 | G100: 19005|19103|19013 | H100: =INT(RC[-6]/4-0.25)*10+100&"|"&INT(RC[-6]/4-0.25)*1+10&"|"&INT(RC[-6]/4-0.25)*100+1000 -> 330|33|3300
A101: 1 | B101: 95 | C101: 0 | D101: 297000 | E101: 10087|19005 | F101: =INT(RC[-4]/5)+10&"|88" -> 29|88 | G101: 19005|19103|19012 | H101: =INT(RC[-6]/4-0.25)*10+100&"|"&INT(RC[-6]/4-0.25)*1+10&"|"&INT(RC[-6]/4-0.25)*100+1000 -> 330|33|3300
A102: 1 | B102: 96 | C102: 1 | D102: 300000 | E102: 10087|19005 | F102: =INT(RC[-4]/5)+10&"|88" -> 29|88 | G102: 19005|19103|19028 | H102: =INT(RC[-6]/4-0.25)*10+100&"|"&INT(RC[-6]/4-0.25)*1+10&"|"&INT(RC[-6]/4-0.25)*10+100 -> 330|33|330
A103: 2 | B103: 1 | C103: 0 | D103: 75000 | E103: 10087|19005 | F103: =INT(RC[-4]/5)*2+20&"|200" -> 20|200 | G103: 19005|19103|19006 | H103: =INT(RC[-6]/4-0.25)*20+200&"|"&INT(RC[-6]/4-0.25)*2+20&"|"&INT(RC[-6]/4-0.25)*20+200 -> 200|20|200
A104: 2 | B104: 2 | C104: 0 | D104: 82500 | E104: 10087|19005 | F104: =INT(RC[-4]/5)*2+20&"|200" -> 20|200 | G104: 19005|19103|19013 | H104: =INT(RC[-6]/4-0.25)*20+200&"|"&INT(RC[-6]/4-0.25)*2+20&"|"&INT(RC[-6]/4-0.25)*200+2000 -> 200|20|2000
A105: 2 | B105: 3 | C105: 0 | D105: 90000 | E105: 10087|19005 | F105: =INT(RC[-4]/5)*2+20&"|200" -> 20|200 | G105: 19005|19103|19012 | H105: =INT(RC[-6]/4-0.25)*20+200&"|"&INT(RC[-6]/4-0.25)*2+20&"|"&INT(RC[-6]/4-0.25)*200+2000 -> 200|20|2000
A106: 2 | B106: 4 | C106: 0 | D106: 97500 | E106: 10087|19005 | F106: =INT(RC[-4]/5)*2+20&"|200" -> 20|200 | G106: 19005|19103|19028 | H106: =INT(RC[-6]/4-0.25)*20+200&"|"&INT(RC[-6]/4-0.25)*2+20&"|"&INT(RC[-6]/4-0.25)*20+200 -> 200|20|200
A107: 2 | B107: 5 | C107: 0 | D107: 105000 | E107: 10087|19005 | F107: =INT(RC[-4]/5)*2+20&"|200" -> 22|200 | G107: 19005|19103|19006 | H107: =INT(RC[-6]/4-0.25)*20+200&"|"&INT(RC[-6]/4-0.25)*2+20&"|"&INT(RC[-6]/4-0.25)*20+200 -> 220|22|220
A108: 2 | B108: 6 | C108: 0 | D108: 112500 | E108: 10087|19005 | F108: =INT(RC[-4]/5)*2+20&"|200" -> 22|200 | G108: 19005|19103|19013 | H108: =INT(RC[-6]/4-0.25)*20+200&"|"&INT(RC[-6]/4-0.25)*2+20&"|"&INT(RC[-6]/4-0.25)*200+2000 -> 220|22|2200
A109: 2 | B109: 7 | C109: 0 | D109: 120000 | E109: 10087|19005 | F109: =INT(RC[-4]/5)*2+20&"|200" -> 22|200 | G109: 19005|19103|19012 | H109: =INT(RC[-6]/4-0.25)*20+200&"|"&INT(RC[-6]/4-0.25)*2+20&"|"&INT(RC[-6]/4-0.25)*200+2000 -> 220|22|2200
A110: 2 | B110: 8 | C110: 0 | D110: 127500 | E110: 10087|19005 | F110: =INT(RC[-4]/5)*2+20&"|200" -> 22|200 | G110: 19005|19103|19028 | H110: =INT(RC[-6]/4-0.25)*20+200&"|"&INT(RC[-6]/4-0.25)*2+20&"|"&INT(RC[-6]/4-0.25)*20+200 -> 220|22|220
A111: 2 | B111: 9 | C111: 0 | D111: 135000 | E111: 10087|19005 | F111: =INT(RC[-4]/5)*2+20&"|200" -> 22|200 | G111: 19005|19103|19006 | H111: =INT(RC[-6]/4-0.25)*20+200&"|"&INT(RC[-6]/4-0.25)*2+20&"|"&INT(RC[-6]/4-0.25)*20+200 -> 240|24|240
A112: 2 | B112: 10 | C112: 0 | D112: 142500 | E112: 10087|19005 | F112: =INT(RC[-4]/5)*2+20&"|200" -> 24|200 | G112: 19005|19103|19013 | H112: =INT(RC[-6]/4-0.25)*20+200&"|"&INT(RC[-6]/4-0.25)*2+20&"|"&INT(RC[-6]/4-0.25)*200+2000 -> 240|24|2400
A113: 2 | B113: 11 | C113: 0 | D113: 150000 | E113: 10087|19005 | F113: =INT(RC[-4]/5)*2+20&"|200" -> 24|200 | G113: 19005|19103|19012 | H113: =INT(RC[-6]/4-0.25)*20+200&"|"&INT(RC[-6]/4-0.25)*2+20&"|"&INT(RC[-6]/4-0.25)*200+2000 -> 240|24|2400
A114: 2 | B114: 12 | C114: 0 | D114: 157500 | E114: 10087|19005 | F114: =INT(RC[-4]/5)*2+20&"|200" -> 24|200 | G114: 19005|19103|19028 | H114: =INT(RC[-6]/4-0.25)*20+200&"|"&INT(RC[-6]/4-0.25)*2+20&"|"&INT(RC[-6]/4-0.25)*20+200 -> 240|24|240
A115: 2 | B115: 13 | C115: 0 | D115: 165000 | E115: 10087|19005 | F115: =INT(RC[-4]/5)*2+20&"|200" -> 24|200 | G115: 19005|19103|19006 | H115: =INT(RC[-6]/4-0.25)*20+200&"|"&INT(RC[-6]/4-0.25)*2+20&"|"&INT(RC[-6]/4-0.25)*20+200 -> 260|26|260
A116: 2 | B116: 14 | C116: 0 | D116: 172500 | E116: 10087|19005 | F116: =INT(RC[-4]/5)*2+20&"|200" -> 24|200 | G116: 19005|19103|19013 | H116: =INT(RC[-6]/4-0.25)*20+200&"|"&INT(RC[-6]/4-0.25)*2+20&"|"&INT(RC[-6]/4-0.25)*200+2000 -> 260|26|2600
A117: 2 | B117: 15 | C117: 0 | D117: 180000 | E117: 10087|19005 | F117: =INT(RC[-4]/5)*2+20&"|200" -> 26|200 | G117: 19005|19103|19012 | H117: =INT(RC[-6]/4-0.25)*20+200&"|"&INT(RC[-6]/4-0.25)*2+20&"|"&INT(RC[-6]/4-0.25)*200+2000 -> 260|26|2600
A118: 2 | B118: 16 | C118: 0 | D118: 187500 | E118: 10087|19005 | F118: =INT(RC[-4]/5)*2+20&"|200" -> 26|200 | G118: 19005|19103|19028 | H118: =INT(RC[-6]/4-0.25)*20+200&"|"&INT(RC[-6]/4-0.25)*2+20&"|"&INT(RC[-6]/4-0.25)*20+200 -> 260|26|260
A119: 2 | B119: 17 | C119: 0 | D119: 195000 | E119: 10087|19005 | F119: =INT(RC[-4]/5)*2+20&"|200" -> 26|200 | G119: 19005|19103|19006 | H119: =INT(RC[-6]/4-0.25)*20+200&"|"&INT(RC[-6]/4-0.25)*2+20&"|"&INT(RC[-6]/4-0.25)*20+200 -> 280|28|280
A120: 2 | B120: 18 | C120: 0 | D120: 202500 | E120: 10087|19005 | F120: =INT(RC[-4]/5)*2+20&"|200" -> 26|200 | G120: 19005|19103|19013 | H120: =INT(RC[-6]/4-0.25)*20+200&"|"&INT(RC[-6]/4-0.25)*2+20&"|"&INT(RC[-6]/4-0.25)*200+2000 -> 280|28|2800
A121: 2 | B121: 19 | C121: 0 | D121: 210000 | E121: 10087|19005 | F121: =INT(RC[-4]/5)*2+20&"|200" -> 26|200 | G121: 19005|19103|19012 | H121: =INT(RC[-6]/4-0.25)*20+200&"|"&INT(RC[-6]/4-0.25)*2+20&"|"&INT(RC[-6]/4-0.25)*200+2000 -> 280|28|2800
A122: 2 | B122: 20 | C122: 0 | D122: 217500 | E122: 10087|19005 | F122: =INT(RC[-4]/5)*2+20&"|200" -> 28|200 | G122: 19005|19103|19028 | H122: =INT(RC[-6]/4-0.25)*20+200&"|"&INT(RC[-6]/4-0.25)*2+20&"|"&INT(RC[-6]/4-0.25)*20+200 -> 280|28|280
A123: 2 | B123: 21 | C123: 0 | D123: 225000 | E123: 10087|19005 | F123: =INT(RC[-4]/5)*2+20&"|200" -> 28|200 | G123: 19005|19103|19006 | H123: =INT(RC[-6]/4-0.25)*20+200&"|"&INT(RC[-6]/4-0.25)*2+20&"|"&INT(RC[-6]/4-0.25)*20+200 -> 300|30|300
A124: 2 | B124: 22 | C124: 0 | D124: 232500 | E124: 10087|19005 | F124: =INT(RC[-4]/5)*2+20&"|200" -> 28|200 | G124: 19005|19103|19013 | H124: =INT(RC[-6]/4-0.25)*20+200&"|"&INT(RC[-6]/4-0.25)*2+20&"|"&INT(RC[-6]/4-0.25)*200+2000 -> 300|30|3000
A125: 2 | B125: 23 | C125: 0 | D125: 240000 | E125: 10087|19005 | F125: =INT(RC[-4]/5)*2+20&"|200" -> 28|200 | G125: 19005|19103|19012 | H125: =INT(RC[-6]/4-0.25)*20+200&"|"&INT(RC[-6]/4-0.25)*2+20&"|"&INT(RC[-6]/4-0.25)*200+2000 -> 300|30|3000
A126: 2 | B126: 24 | C126: 0 | D126: 247500 | E126: 10087|19005 | F126: =INT(RC[-4]/5)*2+20&"|200" -> 28|200 | G126: 19005|19103|19028 | H126: =INT(RC[-6]/4-0.25)*20+200&"|"&INT(RC[-6]/4-0.25)*2+20&"|"&INT(RC[-6]/4-0.25)*20+200 -> 300|30|300
A127: 2 | B127: 25 | C127: 0 | D127: 255000 | E127: 10087|19005 | F127: =INT(RC[-4]/5)*2+20&"|200" -> 30|200 | G127: 19005|19103|19006 | H127: =INT(RC[-6]/4-0.25)*20+200&"|"&INT(RC[-6]/4-0.25)*2+20&"|"&INT(RC[-6]/4-0.25)*20+200 -> 320|32|320
A128: 2 | B128: 26 | C128: 0 | D128: 262500 | E128: 10087|19005 | F128: =INT(RC[-4]/5)*2+20&"|200" -> 30|200 | G128: 19005|19103|19013 | H128: =INT(RC[-6]/4-0.25)*20+200&"|"&INT(RC[-6]/4-0.25)*2+20&"|"&INT(RC[-6]/4-0.25)*200+2000 -> 320|32|3200
A129: 2 | B129: 27 | C129: 0 | D129: 270000 | E129: 10087|19005 | F129: =INT(RC[-4]/5)*2+20&"|200" -> 30|200 | G129: 19005|19103|19012 | H129: =INT(RC[-6]/4-0.25)*20+200&"|"&INT(RC[-6]/4-0.25)*2+20&"|"&INT(RC[-6]/4-0.25)*200+2000 -> 320|32|3200
A130: 2 | B130: 28 | C130: 0 | D130: 277500 | E130: 10087|19005 | F130: =INT(RC[-4]/5)*2+20&"|200" -> 30|200 | G130: 19005|19103|19028 | H130: =INT(RC[-6]/4-0.25)*20+200&"|"&INT(RC[-6]/4-0.25)*2+20&"|"&INT(RC[-6]/4-0.25)*20+200 -> 320|32|320
A131: 2 | B131: 29 | C131: 0 | D131: 285000 | E131: 10087|19005 | F131: =INT(RC[-4]/5)*2+20&"|200" -> 30|200 | G131: 19005|19103|19006 | H131: =INT(RC[-6]/4-0.25)*20+200&"|"&INT(RC[-6]/4-0.25)*2+20&"|"&INT(RC[-6]/4-0.25)*20+200 -> 340|34|340
A132: 2 | B132: 30 | C132: 0 | D132: 292500 | E132: 10087|19005 | F132: =INT(RC[-4]/5)*2+20&"|200" -> 32|200 | G132: 19005|19103|19013 | H132: =INT(RC[-6]/4-0.25)*20+200&"|"&INT(RC[-6]/4-0.25)*2+20&"|"&INT(RC[-6]/4-0.25)*200+2000 -> 340|34|3400
A133: 2 | B133: 31 | C133: 0 | D133: 300000 | E133: 10087|19005 | F133: =INT(RC[-4]/5)*2+20&"|200" -> 32|200 | G133: 19005|19103|19012 | H133: =INT(RC[-6]/4-0.25)*20+200&"|"&INT(RC[-6]/4-0.25)*2+20&"|"&INT(RC[-6]/4-0.25)*200+2000 -> 340|34|3400
A134: 2 | B134: 32 | C134: 0 | D134: 307500 | E134: 10087|19005 | F134: =INT(RC[-4]/5)*2+20&"|200" -> 32|200 | G134: 19005|19103|19028 | H134: =INT(RC[-6]/4-0.25)*20+200&"|"&INT(RC[-6]/4-0.25)*2+20&"|"&INT(RC[-6]/4-0.25)*20+200 -> 340|34|340
A135: 2 | B135: 33 | C135: 0 | D135: 315000 | E135: 10087|19005 | F135: =INT(RC[-4]/5)*2+20&"|200" -> 32|200 | G135: 19005|19103|19006 | H135: =INT(RC[-6]/4-0.25)*20+200&"|"&INT(RC[-6]/4-0.25)*2+20&"|"&INT(RC[-6]/4-0.25)*20+200 -> 360|36|360
A136: 2 | B136: 34 | C136: 0 | D136: 322500 | E136: 10087|19005 | F136: =INT(RC[-4]/5)*2+20&"|200" -> 32|200 | G136: 19005|19103|19013 | H136: =INT(RC[-6]/4-0.25)*20+200&"|"&INT(RC[-6]/4-0.25)*2+20&"|"&INT(RC[-6]/4-0.25)*200+2000 -> 360|36|3600
A137: 2 | B137: 35 | C137: 0 | D137: 330000 | E137: 10087|19005 | F137: =INT(RC[-4]/5)*2+20&"|200" -> 34|200 | G137: 19005|19103|19012 | H137: =INT(RC[-6]/4-0.25)*20+200&"|"&INT(RC[-6]/4-0.25)*2+20&"|"&INT(RC[-6]/4-0.25)*200+2000 -> 360|36|3600
A138: 2 | B138: 36 | C138: 0 | D138: 337500 | E138: 10087|19005 | F138: =INT(RC[-4]/5)*2+20&"|200" -> 34|200 | G138: 19005|19103|19028 | H138: =INT(RC[-6]/4-0.25)*20+200&"|"&INT(RC[-6]/4-0.25)*2+20&"|"&INT(RC[-6]/4-0.25)*20+200 -> 360|36|360
A139: 2 | B139: 37 | C139: 0 | D139: 345000 | E139: 10087|19005 | F139: =INT(RC[-4]/5)*2+20&"|200" -> 34|200 | G139: 19005|19103|19006 | H139: =INT(RC[-6]/4-0.25)*20+200&"|"&INT(RC[-6]/4-0.25)*2+20&"|"&INT(RC[-6]/4-0.25)*20+200 -> 380|38|380
A140: 2 | B140: 38 | C140: 0 | D140: 352500 | E140: 10087|19005 | F140: =INT(RC[-4]/5)*2+20&"|200" -> 34|200 | G140: 19005|19103|19013 | H140: =INT(RC[-6]/4-0.25)*20+200&"|"&INT(RC[-6]/4-0.25)*2+20&"|"&INT(RC[-6]/4-0.25)*200+2000 -> 380|38|3800
A141: 2 | B141: 39 | C141: 0 | D141: 360000 | E141: 10087|19005 | F141: =INT(RC[-4]/5)*2+20&"|200" -> 34|200 | G141: 19005|19103|19012 | H141: =INT(RC[-6]/4-0.25)*20+200&"|"&INT(RC[-6]/4-0.25)*2+20&"|"&INT(RC[-6]/4-0.25)*200+2000 -> 380|38|3800
A142: 2 | B142: 40 | C142: 0 | D142: 367500 | E142: 10087|19005 | F142: =INT(RC[-4]/5)*2+20&"|200" -> 36|200 | G142: 19005|19103|19028 | H142: =INT(RC[-6]/4-0.25)*20+200&"|"&INT(RC[-6]/4-0.25)*2+20&"|"&INT(RC[-6]/4-0.25)*20+200 -> 380|38|380
A143: 2 | B143: 41 | C143: 0 | D143: 375000 | E143: 10087|19005 | F143: =INT(RC[-4]/5)*2+20&"|200" -> 36|200 | G143: 19005|19103|19006 | H143: =INT(RC[-6]/4-0.25)*20+200&"|"&INT(RC[-6]/4-0.25)*2+20&"|"&INT(RC[-6]/4-0.25)*20+200 -> 400|40|400
A144: 2 | B144: 42 | C144: 0 | D144: 382500 | E144: 10087|19005 | F144: =INT(RC[-4]/5)*2+20&"|200" -> 36|200 | G144: 19005|19103|19013 | H144: =INT(RC[-6]/4-0.25)*20+200&"|"&INT(RC[-6]/4-0.25)*2+20&"|"&INT(RC[-6]/4-0.25)*200+2000 -> 400|40|4000
A145: 2 | B145: 43 | C145: 0 | D145: 390000 | E145: 10087|19005 | F145: =INT(RC[-4]/5)*2+20&"|200" -> 36|200 | G145: 19005|19103|19012 | H145: =INT(RC[-6]/4-0.25)*20+200&"|"&INT(RC[-6]/4-0.25)*2+20&"|"&INT(RC[-6]/4-0.25)*200+2000 -> 400|40|4000
A146: 2 | B146: 44 | C146: 0 | D146: 397500 | E146: 10087|19005 | F146: =INT(RC[-4]/5)*2+20&"|200" -> 36|200 | G146: 19005|19103|19028 | H146: =INT(RC[-6]/4-0.25)*20+200&"|"&INT(RC[-6]/4-0.25)*2+20&"|"&INT(RC[-6]/4-0.25)*20+200 -> 400|40|400
A147: 2 | B147: 45 | C147: 0 | D147: 405000 | E147: 10087|19005 | F147: =INT(RC[-4]/5)*2+20&"|200" -> 38|200 | G147: 19005|19103|19006 | H147: =INT(RC[-6]/4-0.25)*20+200&"|"&INT(RC[-6]/4-0.25)*2+20&"|"&INT(RC[-6]/4-0.25)*20+200 -> 420|42|420
A148: 2 | B148: 46 | C148: 0 | D148: 412500 | E148: 10087|19005 | F148: =INT(RC[-4]/5)*2+20&"|200" -> 38|200 | G148: 19005|19103|19013 | H148: =INT(RC[-6]/4-0.25)*20+200&"|"&INT(RC[-6]/4-0.25)*2+20&"|"&INT(RC[-6]/4-0.25)*200+2000 -> 420|42|4200
A149: 2 | B149: 47 | C149: 0 | D149: 420000 | E149: 10087|19005 | F149: =INT(RC[-4]/5)*2+20&"|200" -> 38|200 | G149: 19005|19103|19012 | H149: =INT(RC[-6]/4-0.25)*20+200&"|"&INT(RC[-6]/4-0.25)*2+20&"|"&INT(RC[-6]/4-0.25)*200+2000 -> 420|42|4200
A150: 2 | B150: 48 | C150: 0 | D150: 427500 | E150: 10087|19005 | F150: =INT(RC[-4]/5)*2+20&"|200" -> 38|200 | G150: 19005|19103|19028 | H150: =INT(RC[-6]/4-0.25)*20+200&"|"&INT(RC[-6]/4-0.25)*2+20&"|"&INT(RC[-6]/4-0.25)*20+200 -> 420|42|420
A151: 2 | B151: 49 | C151: 0 | D151: 435000 | E151: 10087|19005 | F151: =INT(RC[-4]/5)*2+20&"|200" -> 38|200 | G151: 19005|19103|19006 | H151: =INT(RC[-6]/4-0.25)*20+200&"|"&INT(RC[-6]/4-0.25)*2+20&"|"&INT(RC[-6]/4-0.25)*20+200 -> 440|44|440
A152: 2 | B152: 50 | C152: 0 | D152: 442500 | E152: 10087|19005 | F152: =INT(RC[-4]/5)*2+20&"|200" -> 40|200 | G152: 19005|19103|19013 | H152: =INT(RC[-6]/4-0.25)*20+200&"|"&INT(RC[-6]/4-0.25)*2+20&"|"&INT(RC[-6]/4-0.25)*200+2000 -> 440|44|4400
A153: 2 | B153: 51 | C153: 0 | D153: 450000 | E153: 10087|19005 | F153: =INT(RC[-4]/5)*2+20&"|200" -> 40|200 | G153: 19005|19103|19012 | H153: =INT(RC[-6]/4-0.25)*20+200&"|"&INT(RC[-6]/4-0.25)*2+20&"|"&INT(RC[-6]/4-0.25)*200+2000 -> 440|44|4400
A154: 2 | B154: 52 | C154: 0 | D154: 457500 | E154: 10087|19005 | F154: =INT(RC[-4]/5)*2+20&"|200" -> 40|200 | G154: 19005|19103|19028 | H154: =INT(RC[-6]/4-0.25)*20+200&"|"&INT(RC[-6]/4-0.25)*2+20&"|"&INT(RC[-6]/4-0.25)*20+200 -> 440|44|440
A155: 2 | B155: 53 | C155: 0 | D155: 465000 | E155: 10087|19005 | F155: =INT(RC[-4]/5)*2+20&"|200" -> 40|200 | G155: 19005|19103|19006 | H155: =INT(RC[-6]/4-0.25)*20+200&"|"&INT(RC[-6]/4-0.25)*2+20&"|"&INT(RC[-6]/4-0.25)*20+200 -> 460|46|460
A156: 2 | B156: 54 | C156: 0 | D156: 472500 | E156: 10087|19005 | F156: =INT(RC[-4]/5)*2+20&"|200" -> 40|200 | G156: 19005|19103|19013 | H156: =INT(RC[-6]/4-0.25)*20+200&"|"&INT(RC[-6]/4-0.25)*2+20&"|"&INT(RC[-6]/4-0.25)*200+2000 -> 460|46|4600
A157: 2 | B157: 55 | C157: 0 | D157: 480000 | E157: 10087|19005 | F157: =INT(RC[-4]/5)*2+20&"|200" -> 42|200 | G157: 19005|19103|19012 | H157: =INT(RC[-6]/4-0.25)*20+200&"|"&INT(RC[-6]/4-0.25)*2+20&"|"&INT(RC[-6]/4-0.25)*200+2000 -> 460|46|4600
A158: 2 | B158: 56 | C158: 0 | D158: 487500 | E158: 10087|19005 | F158: =INT(RC[-4]/5)*2+20&"|200" -> 42|200 | G158: 19005|19103|19028 | H158: =INT(RC[-6]/4-0.25)*20+200&"|"&INT(RC[-6]/4-0.25)*2+20&"|"&INT(RC[-6]/4-0.25)*20+200 -> 460|46|460
A159: 2 | B159: 57 | C159: 0 | D159: 495000 | E159: 10087|19005 | F159: =INT(RC[-4]/5)*2+20&"|200" -> 42|200 | G159: 19005|19103|19006 | H159: =INT(RC[-6]/4-0.25)*20+200&"|"&INT(RC[-6]/4-0.25)*2+20&"|"&INT(RC[-6]/4-0.25)*20+200 -> 480|48|480
A160: 2 | B160: 58 | C160: 0 | D160: 502500 | E160: 10087|19005 | F160: =INT(RC[-4]/5)*2+20&"|200" -> 42|200 | G160: 19005|19103|19013 | H160: =INT(RC[-6]/4-0.25)*20+200&"|"&INT(RC[-6]/4-0.25)*2+20&"|"&INT(RC[-6]/4-0.25)*200+2000 -> 480|48|4800
A161: 2 | B161: 59 | C161: 0 | D161: 510000 | E161: 10087|19005 | F161: =INT(RC[-4]/5)*2+20&"|200" -> 42|200 | G161: 19005|19103|19012 | H161: =INT(RC[-6]/4-0.25)*20+200&"|"&INT(RC[-6]/4-0.25)*2+20&"|"&INT(RC[-6]/4-0.25)*200+2000 -> 480|48|4800
A162: 2 | B162: 60 | C162: 0 | D162: 517500 | E162: 10087|19005 | F162: =INT(RC[-4]/5)*2+20&"|200" -> 44|200 | G162: 19005|19103|19028 | H162: =INT(RC[-6]/4-0.25)*20+200&"|"&INT(RC[-6]/4-0.25)*2+20&"|"&INT(RC[-6]/4-0.25)*20+200 -> 480|48|480
A163: 2 | B163: 61 | C163: 0 | D163: 525000 | E163: 10087|19005 | F163: =INT(RC[-4]/5)*2+20&"|200" -> 44|200 | G163: 19005|19103|19006 | H163: =INT(RC[-6]/4-0.25)*20+200&"|"&INT(RC[-6]/4-0.25)*2+20&"|"&INT(RC[-6]/4-0.25)*20+200 -> 500|50|500
A164: 2 | B164: 62 | C164: 0 | D164: 532500 | E164: 10087|19005 | F164: =INT(RC[-4]/5)*2+20&"|200" -> 44|200 | G164: 19005|19103|19013 | H164: =INT(RC[-6]/4-0.25)*20+200&"|"&INT(RC[-6]/4-0.25)*2+20&"|"&INT(RC[-6]/4-0.25)*200+2000 -> 500|50|5000
A165: 2 | B165: 63 | C165: 0 | D165: 540000 | E165: 10087|19005 | F165: =INT(RC[-4]/5)*2+20&"|200" -> 44|200 | G165: 19005|19103|19012 | H165: =INT(RC[-6]/4-0.25)*20+200&"|"&INT(RC[-6]/4-0.25)*2+20&"|"&INT(RC[-6]/4-0.25)*200+2000 -> 500|50|5000
A166: 2 | B166: 64 | C166: 0 | D166: 547500 | E166: 10087|19005 | F166: =INT(RC[-4]/5)*2+20&"|200" -> 44|200 | G166: 19005|19103|19028 | H166: =INT(RC[-6]/4-0.25)*20+200&"|"&INT(RC[-6]/4-0.25)*2+20&"|"&INT(RC[-6]/4-0.25)*20+200 -> 500|50|500
A167: 2 | B167: 65 | C167: 0 | D167: 555000 | E167: 10087|19005 | F167: =INT(RC[-4]/5)*2+20&"|200" -> 46|200 | G167: 19005|19103|19006 | H167: =INT(RC[-6]/4-0.25)*20+200&"|"&INT(RC[-6]/4-0.25)*2+20&"|"&INT(RC[-6]/4-0.25)*20+200 -> 520|52|520
A168: 2 | B168: 66 | C168: 0 | D168: 562500 | E168: 10087|19005 | F168: =INT(RC[-4]/5)*2+20&"|200" -> 46|200 | G168: 19005|19103|19013 | H168: =INT(RC[-6]/4-0.25)*20+200&"|"&INT(RC[-6]/4-0.25)*2+20&"|"&INT(RC[-6]/4-0.25)*200+2000 -> 520|52|5200
A169: 2 | B169: 67 | C169: 0 | D169: 570000 | E169: 10087|19005 | F169: =INT(RC[-4]/5)*2+20&"|200" -> 46|200 | G169: 19005|19103|19012 | H169: =INT(RC[-6]/4-0.25)*20+200&"|"&INT(RC[-6]/4-0.25)*2+20&"|"&INT(RC[-6]/4-0.25)*200+2000 -> 520|52|5200
A170: 2 | B170: 68 | C170: 0 | D170: 577500 | E170: 10087|19005 | F170: =INT(RC[-4]/5)*2+20&"|200" -> 46|200 | G170: 19005|19103|19028 | H170: =INT(RC[-6]/4-0.25)*20+200&"|"&INT(RC[-6]/4-0.25)*2+20&"|"&INT(RC[-6]/4-0.25)*20+200 -> 520|52|520
A171: 2 | B171: 69 | C171: 0 | D171: 585000 | E171: 10087|19005 | F171: =INT(RC[-4]/5)*2+20&"|200" -> 46|200 | G171: 19005|19103|19006 | H171: =INT(RC[-6]/4-0.25)*20+200&"|"&INT(RC[-6]/4-0.25)*2+20&"|"&INT(RC[-6]/4-0.25)*20+200 -> 540|54|540
A172: 2 | B172: 70 | C172: 0 | D172: 592500 | E172: 10087|19005 | F172: =INT(RC[-4]/5)*2+20&"|200" -> 48|200 | G172: 19005|19103|19013 | H172: =INT(RC[-6]/4-0.25)*20+200&"|"&INT(RC[-6]/4-0.25)*2+20&"|"&INT(RC[-6]/4-0.25)*200+2000 -> 540|54|5400
A173: 2 | B173: 71 | C173: 0 | D173: 600000 | E173: 10087|19005 | F173: =INT(RC[-4]/5)*2+20&"|200" -> 48|200 | G173: 19005|19103|19012 | H173: =INT(RC[-6]/4-0.25)*20+200&"|"&INT(RC[-6]/4-0.25)*2+20&"|"&INT(RC[-6]/4-0.25)*200+2000 -> 540|54|5400
A174: 2 | B174: 72 | C174: 0 | D174: 607500 | E174: 10087|19005 | F174: =INT(RC[-4]/5)*2+20&"|200" -> 48|200 | G174: 19005|19103|19028 | H174: =INT(RC[-6]/4-0.25)*20+200&"|"&INT(RC[-6]/4-0.25)*2+20&"|"&INT(RC[-6]/4-0.25)*20+200 -> 540|54|540
A175: 2 | B175: 73 | C175: 0 | D175: 615000 | E175: 10087|19005 | F175: =INT(RC[-4]/5)*2+20&"|200" -> 48|200 | G175: 19005|19103|19006 | H175: =INT(RC[-6]/4-0.25)*20+200&"|"&INT(RC[-6]/4-0.25)*2+20&"|"&INT(RC[-6]/4-0.25)*20+200 -> 560|56|560
A176: 2 | B176: 74 | C176: 0 | D176: 622500 | E176: 10087|19005 | F176: =INT(RC[-4]/5)*2+20&"|200" -> 48|200 | G176: 19005|19103|19013 | H176: =INT(RC[-6]/4-0.25)*20+200&"|"&INT(RC[-6]/4-0.25)*2+20&"|"&INT(RC[-6]/4-0.25)*200+2000 -> 560|56|5600
A177: 2 | B177: 75 | C177: 0 | D177: 630000 | E177: 10087|19005 | F177: =INT(RC[-4]/5)*2+20&"|200" -> 50|200 | G177: 19005|19103|19012 | H177: =INT(RC[-6]/4-0.25)*20+200&"|"&INT(RC[-6]/4-0.25)*2+20&"|"&INT(RC[-6]/4-0.25)*200+2000 -> 560|56|5600
A178: 2 | B178: 76 | C178: 0 | D178: 637500 | E178: 10087|19005 | F178: =INT(RC[-4]/5)*2+20&"|200" -> 50|200 | G178: 19005|19103|19028 | H178: =INT(RC[-6]/4-0.25)*20+200&"|"&INT(RC[-6]/4-0.25)*2+20&"|"&INT(RC[-6]/4-0.25)*20+200 -> 560|56|560
A179: 2 | B179: 77 | C179: 0 | D179: 645000 | E179: 10087|19005 | F179: =INT(RC[-4]/5)*2+20&"|200" -> 50|200 | G179: 19005|19103|19006 | H179: =INT(RC[-6]/4-0.25)*20+200&"|"&INT(RC[-6]/4-0.25)*2+20&"|"&INT(RC[-6]/4-0.25)*20+200 -> 580|58|580
A180: 2 | B180: 78 | C180: 0 | D180: 652500 | E180: 10087|19005 | F180: =INT(RC[-4]/5)*2+20&"|200" -> 50|200 | G180: 19005|19103|19013 | H180: =INT(RC[-6]/4-0.25)*20+200&"|"&INT(RC[-6]/4-0.25)*2+20&"|"&INT(RC[-6]/4-0.25)*200+2000 -> 580|58|5800
A181: 2 | B181: 79 | C181: 0 | D181: 660000 | E181: 10087|19005 | F181: =INT(RC[-4]/5)*2+20&"|200" -> 50|200 | G181: 19005|19103|19012 | H181: =INT(RC[-6]/4-0.25)*20+200&"|"&INT(RC[-6]/4-0.25)*2+20&"|"&INT(RC[-6]/4-0.25)*200+2000 -> 580|58|5800
A182: 2 | B182: 80 | C182: 0 | D182: 667500 | E182: 10087|19005 | F182: =INT(RC[-4]/5)*2+20&"|200" -> 52|200 | G182: 19005|19103|19028 | H182: =INT(RC[-6]/4-0.25)*20+200&"|"&INT(RC[-6]/4-0.25)*2+20&"|"&INT(RC[-6]/4-0.25)*20+200 -> 580|58|580
A183: 2 | B183: 81 | C183: 0 | D183: 675000 | E183: 10087|19005 | F183: =INT(RC[-4]/5)*2+20&"|200" -> 52|200 | G183: 19005|19103|19006 | H183: =INT(RC[-6]/4-0.25)*20+200&"|"&INT(RC[-6]/4-0.25)*2+20&"|"&INT(RC[-6]/4-0.25)*20+200 -> 600|60|600
A184: 2 | B184: 82 | C184: 0 | D184: 682500 | E184: 10087|19005 | F184: =INT(RC[-4]/5)*2+20&"|200" -> 52|200 | G184: 19005|19103|19013 | H184: =INT(RC[-6]/4-0.25)*20+200&"|"&INT(RC[-6]/4-0.25)*2+20&"|"&INT(RC[-6]/4-0.25)*200+2000 -> 600|60|6000
A185: 2 | B185: 83 | C185: 0 | D185: 690000 | E185: 10087|19005 | F185: =INT(RC[-4]/5)*2+20&"|200" -> 52|200 | G185: 19005|19103|19012 | H185: =INT(RC[-6]/4-0.25)*20+200&"|"&INT(RC[-6]/4-0.25)*2+20&"|"&INT(RC[-6]/4-0.25)*200+2000 -> 600|60|6000
A186: 2 | B186: 84 | C186: 0 | D186: 697500 | E186: 10087|19005 | F186: =INT(RC[-4]/5)*2+20&"|200" -> 52|200 | G186: 19005|19103|19028 | H186: =INT(RC[-6]/4-0.25)*20+200&"|"&INT(RC[-6]/4-0.25)*2+20&"|"&INT(RC[-6]/4-0.25)*20+200 -> 600|60|600
A187: 2 | B187: 85 | C187: 0 | D187: 705000 | E187: 10087|19005 | F187: =INT(RC[-4]/5)*2+20&"|200" -> 54|200 | G187: 19005|19103|19006 | H187: =INT(RC[-6]/4-0.25)*20+200&"|"&INT(RC[-6]/4-0.25)*2+20&"|"&INT(RC[-6]/4-0.25)*20+200 -> 620|62|620
A188: 2 | B188: 86 | C188: 0 | D188: 712500 | E188: 10087|19005 | F188: =INT(RC[-4]/5)*2+20&"|200" -> 54|200 | G188: 19005|19103|19013 | H188: =INT(RC[-6]/4-0.25)*20+200&"|"&INT(RC[-6]/4-0.25)*2+20&"|"&INT(RC[-6]/4-0.25)*200+2000 -> 620|62|6200
A189: 2 | B189: 87 | C189: 0 | D189: 720000 | E189: 10087|19005 | F189: =INT(RC[-4]/5)*2+20&"|200" -> 54|200 | G189: 19005|19103|19012 | H189: =INT(RC[-6]/4-0.25)*20+200&"|"&INT(RC[-6]/4-0.25)*2+20&"|"&INT(RC[-6]/4-0.25)*200+2000 -> 620|62|6200
A190: 2 | B190: 88 | C190: 0 | D190: 727500 | E190: 10087|19005 | F190: =INT(RC[-4]/5)*2+20&"|200" -> 54|200 | G190: 19005|19103|19028 | H190: =INT(RC[-6]/4-0.25)*20+200&"|"&INT(RC[-6]/4-0.25)*2+20&"|"&INT(RC[-6]/4-0.25)*20+200 -> 620|62|620
A191: 2 | B191: 89 | C191: 0 | D191: 735000 | E191: 10087|19005 | F191: =INT(RC[-4]/5)*2+20&"|200" -> 54|200 | G191: 19005|19103|19006 | H191: =INT(RC[-6]/4-0.25)*20+200&"|"&INT(RC[-6]/4-0.25)*2+20&"|"&INT(RC[-6]/4-0.25)*20+200 -> 640|64|640
A192: 2 | B192: 90 | C192: 0 | D192: 742500 | E192: 10087|19005 | F192: =INT(RC[-4]/5)*2+20&"|200" -> 56|200 | G192: 19005|19103|19013 | H192: =INT(RC[-6]/4-0.25)*20+200&"|"&INT(RC[-6]/4-0.25)*2+20&"|"&INT(RC[-6]/4-0.25)*200+2000 -> 640|64|6400
A193: 2 | B193: 91 | C193: 0 | D193: 750000 | E193: 10087|19005 | F193: =INT(RC[-4]/5)*2+20&"|200" -> 56|200 | G193: 19005|19103|19012 | H193: =INT(RC[-6]/4-0.25)*20+200&"|"&INT(RC[-6]/4-0.25)*2+20&"|"&INT(RC[-6]/4-0.25)*200+2000 -> 640|64|6400
A194: 2 | B194: 92 | C194: 0 | D194: 757500 | E194: 10087|19005 | F194: =INT(RC[-4]/5)*2+20&"|200" -> 56|200 | G194: 19005|19103|19028 | H194: =INT(RC[-6]/4-0.25)*20+200&"|"&INT(RC[-6]/4-0.25)*2+20&"|"&INT(RC[-6]/4-0.25)*20+200 -> 640|64|640
A195: 2 | B195: 93 | C195: 0 | D195: 765000 | E195: 10087|19005 | F195: =INT(RC[-4]/5)*2+20&"|200" -> 56|200 | G195: 19005|19103|19006 | H195: =INT(RC[-6]/4-0.25)*20+200&"|"&INT(RC[-6]/4-0.25)*2+20&"|"&INT(RC[-6]/4-0.25)*20+200 -> 660|66|660
A196: 2 | B196: 94 | C196: 0 | D196: 772500 | E196: 10087|19005 | F196: =INT(RC[-4]/5)*2+20&"|200" -> 56|200 | G196: 19005|19103|19013 | H196: =INT(RC[-6]/4-0.25)*20+200&"|"&INT(RC[-6]/4-0.25)*2+20&"|"&INT(RC[-6]/4-0.25)*200+2000 -> 660|66|6600
A197: 2 | B197: 95 | C197: 0 | D197: 780000 | E197: 10087|19005 | F197: =INT(RC[-4]/5)*2+20&"|200" -> 58|200 | G197: 19005|19103|19012 | H197: =INT(RC[-6]/4-0.25)*20+200&"|"&INT(RC[-6]/4-0.25)*2+20&"|"&INT(RC[-6]/4-0.25)*200+2000 -> 660|66|6600
A198: 2 | B198: 96 | C198: 0 | D198: 787500 | E198: 10087|19005 | F198: =INT(RC[-4]/5)*2+20&"|200" -> 58|200 | G198: 19005|19103|19028 | H198: =INT(RC[-6]/4-0.25)*20+200&"|"&INT(RC[-6]/4-0.25)*2+20&"|"&INT(RC[-6]/4-0.25)*20+200 -> 660|66|660
A199: 2 | B199: 97 | C199: 0 | D199: 795000 | E199: 10087|19005 | F199: =INT(RC[-4]/5)*2+20&"|200" -> 58|200 | G199: 19005|19103|19006 | H199: =INT(RC[-6]/4-0.25)*20+200&"|"&INT(RC[-6]/4-0.25)*2+20&"|"&INT(RC[-6]/4-0.25)*20+200 -> 680|68|680
A200: 2 | B200: 98 | C200: 0 | D200: 802500 | E200: 10087|19005 | F200: =INT(RC[-4]/5)*2+20&"|200" -> 58|200 | G200: 19005|19103|19013 | H200: =INT(RC[-6]/4-0.25)*20+200&"|"&INT(RC[-6]/4-0.25)*2+20&"|"&INT(RC[-6]/4-0.25)*200+2000 -> 680|68|6800
A201: 2 | B201: 99 | C201: 0 | D201: 810000 | E201: 10087|19005 | F201: =INT(RC[-4]/5)*2+20&"|200" -> 58|200 | G201: 19005|19103|19012 | H201: =INT(RC[-6]/4-0.25)*20+200&"|"&INT(RC[-6]/4-0.25)*2+20&"|"&INT(RC[-6]/4-0.25)*200+2000 -> 680|68|6800
A202: 2 | B202: 100 | C202: 1 | D202: 817500 | E202: 10087|19005 | F202: =INT(RC[-4]/5)*2+20&"|200" -> 60|200 | G202: 19005|19103|19028 | H202: =INT(RC[-6]/4-0.25)*20+200&"|"&INT(RC[-6]/4-0.25)*2+20&"|"&INT(RC[-6]/4-0.25)*20+200 -> 680|68|680

Sheet: boss配置
A1: type|type | B1: revive_time|revive_time | C1: limit_item_list|limit_item_list | D1: model| | E1: scale_factor| | F1: name|
A2: 不可空 | B2: 不可空 | C2: 不可空 | D2: 不可空 | E2: 不可空 | F2: 不可空
A3: 数字 | B3: 数字 | C3: 一维数组 | D3: 数字 | E3: 数字 | F3: 字符串
C4: 不定长
A6: boss类型 | B6: 复活时间(秒) | C6: 可对Boss攻击的雪球列表 | D6: boss模型 | E6: 缩放 | F6: boss名
A7: 1 | B7: 3 | C7: 10088|10089 | D7: 31400 | E7: 0.7 | F7: 小年兽
A8: 2 | B8: 3 | C8: 10090 | D8: 33999 | E8: 0.6 | F8: 年兽头领

Sheet: 雪球配置
A1: id|id | B1: |damage_min | C1: |damage_max | D1: |reward_id_list | E1: |reward_num_list | F1: |reward_rate_list | I1: snowball_start_area| | J1: snowball_over_area|
A2: 不可空 | B2: 不可空 | C2: 不可空 | D2: 不可空 | E2: 不可空 | F2: 不可空 | I2: 不可空 | J2: 不可空
A3: 数字 | B3: 数字 | C3: 数字 | D3: 一维数组 | E3: 一维数组 | F3: 一维数组 | I3: 一维数组 | J3: 一维数组
D4: 不定长 | E4: 不定长 | F4: 不定长 | I4: 不定长 | J4: 不定长
A6: 雪球ID | B6: 伤害下限 | C6: 伤害上限 | D6: 奖励的物品ID列表 | E6: 数量 | F6: 奖励的物品几率列表 | G6: 期望积分 | H6: 副本掉落几率 | I6: 雪球发射范围 | J6: 雪球结束范围
A7: 10088 | B7: 1 | C7: 3 | D7: 10090 | E7: 1 | F7: 500 | G7: 2 | H7: 0.5 | I7: 95|105|70|80 | J7: 125|205|175|275 | K7: ←春节活动
A8: 10089 | B8: 10 | C8: 20 | D8: 10090 | E8: 1 | F8: 3000 | G8: 15 | H8: 0.05 | I8: 225|235|70|80 | J8: 125|205|175|275
A9: 10090 | B9: 80 | C9: 120 | D9: 10087|10087|10087|10087|10087|10087|10087|10087|10087|10087 | E9: 1|2|3|4|5|6|7|8|9|10 | F9: 1500|1400|1300|1200|1100|1000|800|600|400|150 | G9: 100 | H9: 灯笼=10钻 | I9: 160|170|70|80 | J9: 125|205|175|275
A10: 10077 | B10: 1 | C10: 3 | D10: 10079 | E10: 1 | F10: 500 | G10: 2 | H10: 0.5 | I10: 95|105|70|80 | J10: 125|205|175|275 | K10: ←端午节活动
A11: 10078 | B11: 10 | C11: 20 | D11: 10079 | E11: 1 | F11: 3000 | G11: 15 | H11: 0.05 | I11: 225|235|70|80 | J11: 125|205|175|275
A12: 10079 | B12: 80 | C12: 120 | D12: 10076|10076|10076|10076|10076|10076|10076|10076|10076|10076 | E12: 1|2|3|4|5|6|7|8|9|10 | F12: 1500|1400|1300|1200|1100|1000|800|600|400|150 | G12: 100 | H12: 艾叶=10钻 | I12: 160|170|70|80 | J12: 125|205|175|275
A13: 10073 | B13: 1 | C13: 3 | D13: 10075 | E13: 1 | F13: 500 | G13: 2 | H13: 0.5 | I13: 95|105|70|80 | J13: 125|205|175|275 | K13: ←七夕节活动
A14: 10074 | B14: 10 | C14: 20 | D14: 10075 | E14: 1 | F14: 3000 | G14: 15 | H14: 0.05 | I14: 225|235|70|80 | J14: 125|205|175|275
A15: 10075 | B15: 80 | C15: 120 | D15: 10072|10072|10072|10072|10072|10072|10072|10072|10072|10072 | E15: 1|2|3|4|5|6|7|8|9|10 | F15: 1500|1400|1300|1200|1100|1000|800|600|400|150 | G15: 100 | H15: 内啥=10钻 | I15: 160|170|70|80 | J15: 125|205|175|275
A16: 10093 | B16: 1 | C16: 3 | D16: 10095 | E16: 1 | F16: 500 | G16: =AVERAGE(RC[-5]:RC[-4]) -> 2 | H16: 0.5 | I16: 95|105|70|80 | J16: 125|205|175|275 | K16: ←圣诞节活动
A17: 10094 | B17: 10 | C17: 20 | D17: 10095 | E17: 1 | F17: 3000 | G17: =AVERAGE(RC[-5]:RC[-4]) -> 15 | H17: 0.05 | I17: 225|235|70|80 | J17: 125|205|175|275
A18: 10095 | B18: 80 | C18: 120 | D18: 10092|10092|10092|10092|10092|10092|10092|10092|10092|10092 | E18: 1|2|3|4|5|6|7|8|9|10 | F18: 1500|1400|1300|1200|1100|1000|800|600|400|150 | G18: =AVERAGE(RC[-5]:RC[-4]) -> 100 | H18: 圣诞帽=10钻 | I18: 160|170|70|80 | J18: 125|205|175|275

Sheet: 积分兑换商店
A1: goods_id|goods_id | B1: item_id|item_id | C1: item_num|item_num | D1: need_role_level|need_role_level | E1: need_history_score|need_history_score | F1: buy_num_max|buy_num_max | G1: cost_score|cost_score
A2: 不可空 | B2: 不可空 | C2: 不可空 | D2: 不可空 | E2: 不可空 | F2: 不可空 | G2: 不可空
A3: 数字 | B3: 数字 | C3: 数字 | D3: 数字 | E3: 数字 | F3: 数字 | G3: 数字
A6: 商品ID | B6: 物品ID | C6: 物品数量 | D6: 需要的角色等级 | E6: 需要的累计积分 | F6: 购买数量上限(0=表示无上限) | G6: 消耗的积分 | I6: 单价 | J6: 价值 | K6: 折扣 | L6: 0.1
A7: 1 | B7: 10087 | C7: 20 | D7: 0 | E7: 100 | F7: 1 | G7: =RC[3]*RC[4]/10/R6C12 -> 200 | I7: 10 | J7: =RC[-1]*RC[-7] -> 200 | K7: 1
A8: 2 | B8: 19006 | C8: 300 | D8: 0 | E8: 500 | F8: 1 | G8: =RC[3]*RC[4]/10/R6C12 -> 300 | H8: 魂晶 | I8: 1 | J8: =RC[-1]*RC[-7] -> 300 | K8: 1
A9: 3 | B9: 19012 | C9: 4000 | D9: 0 | E9: 1000 | F9: 1 | G9: =RC[3]*RC[4]/10/R6C12 -> 400 | H9: 威名 | I9: 0.1 | J9: =RC[-1]*RC[-7] -> 400 | K9: 1
A10: 4 | B10: 10021 | C10: 25 | D10: 0 | E10: 2000 | F10: 1 | G10: =RC[3]*RC[4]/10/R6C12 -> 500 | H10: 刷新令 | I10: 20 | J10: =RC[-1]*RC[-7] -> 500 | K10: 1
A11: 5 | B11: 10014 | C11: 30 | D11: 0 | E11: 4000 | F11: 1 | G11: =RC[3]*RC[4]/10/R6C12 -> 600 | H11: 橙品精炼石 | I11: 20 | J11: =RC[-1]*RC[-7] -> 600 | K11: 1
A12: 6 | B12: 10010 | C12: 140 | D12: 0 | E12: 6000 | F12: 1 | G12: =RC[3]*RC[4]/10/R6C12 -> 700 | H12: 圣器精炼石 | I12: 5 | J12: =RC[-1]*RC[-7] -> 700 | K12: 1
A13: 7 | B13: 19028 | C13: 800 | D13: 0 | E13: 8000 | F13: 1 | G13: =RC[3]*RC[4]/10/R6C12 -> 800 | H13: 无尽石 | I13: 1 | J13: =RC[-1]*RC[-7] -> 800 | K13: 1
A14: 8 | B14: 10004 | C14: 300 | D14: 0 | E14: 10000 | F14: 1 | G14: =RC[3]*RC[4]/10/R6C12 -> 900 | H14: 潜能药剂 | I14: 15 | J14: =RC[-1]*RC[-7] -> 4500 | K14: 0.2
A15: 9 | B15: 10022 | C15: 20 | D15: 0 | E15: 12500 | F15: 1 | G15: =RC[3]*RC[4]/10/R6C12 -> 1000 | H15: 灵性精粹 | I15: 50 | J15: =RC[-1]*RC[-7] -> 1000 | K15: 1
A16: 10 | B16: 19017 | C16: 1100 | D16: 0 | E16: 15000 | F16: 1 | G16: =RC[3]*RC[4]/10/R6C12 -> 1100 | H16: 神魂 | I16: 1 | J16: =RC[-1]*RC[-7] -> 1100 | K16: 1
A17: 11 | B17: 13324 | C17: 1 | D17: 0 | E17: 20000 | F17: 1 | G17: =RC[3]*RC[4]/10/R6C12 -> 2500 | H17: 精灵升华道具 | I17: 2500 | J17: =RC[-1]*RC[-7] -> 2500 | K17: 1
A18: 100 | B18: 13384 | C18: 1 | D18: 1 | E18: 0 | F18: 1 | G18: 80000 | H18: 任选红将 | I18: 25 | J18: =RC[-1]*RC[-7] -> 25 | K18: 10
A19: 101 | B19: 10000 | C19: 1 | D19: 1 | E19: 0 | F19: 10 | G19: =RC[3]*RC[4]/10/R6C12 -> 250 | H19: 体力药剂 | I19: 25 | J19: =RC[-1]*RC[-7] -> 25 | K19: 10
A20: 102 | B20: 10001 | C20: 1 | D20: 1 | E20: 0 | F20: 10 | G20: =RC[3]*RC[4]/10/R6C12 -> 250 | H20: 精力药剂 | I20: 25 | J20: =RC[-1]*RC[-7] -> 25 | K20: 10
A21: 103 | B21: 10010 | C21: 40 | D21: 39 | E21: 0 | F21: 50 | G21: =RC[3]*RC[4]/10/R6C12 -> 2000 | H21: 圣器精炼石 | I21: 5 | J21: =RC[-1]*RC[-7] -> 200 | K21: 10
A22: 104 | B22: 10014 | C22: 10 | D22: 29 | E22: 0 | F22: 50 | G22: =RC[3]*RC[4]/10/R6C12 -> 2000 | H22: 橙品精炼石 | I22: 20 | J22: =RC[-1]*RC[-7] -> 200 | K22: 10
A23: 105 | B23: 10008 | C23: 100 | D23: 45 | E23: 0 | F23: 20 | G23: =RC[3]*RC[4]/10/R6C12 -> 2250 | H23: 觉醒水晶 | I23: 2.5 | J23: =RC[-1]*RC[-7] -> 250 | K23: 9
A24: 106 | B24: 10002 | C24: 50 | D24: 6 | E24: 0 | F24: 100 | G24: =RC[3]*RC[4]/10/R6C12 -> 400 | H24: 进阶石 | I24: 1 | J24: =RC[-1]*RC[-7] -> 50 | K24: 8
A25: 107 | B25: 10021 | C25: 5 | D25: 10 | E25: 0 | F25: 10 | G25: =RC[3]*RC[4]/10/R6C12 -> 800 | H25: 刷新令 | I25: 20 | J25: =RC[-1]*RC[-7] -> 100 | K25: 8
A26: 108 | B26: 10022 | C26: 10 | D26: 25 | E26: 0 | F26: 50 | G26: =RC[3]*RC[4]/10/R6C12 -> 5000 | H26: 灵性精粹 | I26: 50 | J26: =RC[-1]*RC[-7] -> 500 | K26: 10
A27: 109 | B27: 33400 | C27: 1 | D27: 1 | E27: 0 | F27: 20 | G27: =RC[3]*RC[4]/10/R6C12 -> 1200 | H27: 橙品传承核心 | I27: 200 | J27: =RC[-1]*RC[-7] -> 200 | K27: 6
A28: 110 | B28: 42301 | C28: 1 | D28: 13 | E28: 0 | F28: 20 | G28: =RC[3]*RC[4]/10/R6C12 -> 1500 | H28: 紫水晶 | I28: 375 | J28: =RC[-1]*RC[-7] -> 375 | K28: 4
A29: 111 | B29: 19006 | C29: 500 | D29: 1 | E29: 0 | F29: 20 | G29: =RC[3]*RC[4]/10/R6C12 -> 4500 | H29: 魂晶 | I29: 1 | J29: =RC[-1]*RC[-7] -> 500 | K29: 9
A30: 112 | B30: 10004 | C30: 20 | D30: 35 | E30: 0 | F30: 100 | G30: =RC[3]*RC[4]/10/R6C12 -> 900 | H30: 潜能药剂 | I30: 15 | J30: =RC[-1]*RC[-7] -> 300 | K30: 3
A31: 113 | B31: 19017 | C31: 300 | D31: 45 | E31: 0 | F31: 20 | G31: =RC[3]*RC[4]/10/R6C12 -> 2400 | H31: 神魂 | I31: 1 | J31: =RC[-1]*RC[-7] -> 300 | K31: 8
A32: 114 | B32: 19103 | C32: 10 | D32: 1 | E32: 0 | F32: 0 | G32: =RC[3]*RC[4]/10/R6C12 -> 900 | H32: 金币（万） | I32: 10 | J32: =RC[-1]*RC[-7] -> 100 | K32: 9

Sheet: 道具兑换商店
A1: goods_id|goods_id | B1: item_id|item_id | C1: item_num|item_num | D1: need_role_level|need_role_level | E1: buy_num_max|buy_num_max | F1: cost_item_id_list|cost_item_id_list | G1: cost_item_num_list|cost_item_num_list
A2: 不可空 | B2: 不可空 | C2: 不可空 | D2: 不可空 | E2: 不可空 | F2: 可空#不需字段 | G2: 可空#不需字段
A3: 数字 | B3: 数字 | C3: 数字 | D3: 数字 | E3: 数字 | F3: 一维数组 | G3: 一维数组
F4: 不定长 | G4: 不定长
A6: 商品ID | B6: 物品ID | C6: 物品数量 | D6: 需要的角色等级 | E6: 购买数量上限(0=表示无上限) | F6: 消耗物品ID列表 | G6: 消耗物品数量列表 | H6: 备注 | I6: 单价 | J6: 价值 | K6: 折扣 | M6: 圣诞帽价值 | N6: 10
A7: 1 | B7: 13384 | C7: 1 | D7: 1 | E7: 1 | F7: 10087 | G7: =ROUND(RC[3]*RC[4]/10/R6C14,0) -> 800 | H7: 任选红将 | I7: 8000 | J7: =RC[-7]*RC[-1] -> 8000 | K7: 10 | L7: =RC[-7]*RC[-5] -> 800
A8: 2 | B8: 13392 | C8: 1 | D8: 13 | E8: 10 | F8: 10087 | G8: =ROUND(RC[3]*RC[4]/10/R6C14,0) -> 100 | H8: 任选顶级圣器 | I8: 1000 | J8: =RC[-7]*RC[-1] -> 1000 | K8: 10 | L8: =RC[-7]*RC[-5] -> 1000
A9: 3 | B9: 13316 | C9: 1 | D9: 13 | E9: 20 | F9: 10087 | G9: =ROUND(RC[3]*RC[4]/10/R6C14,0) -> 40 | H9: 任选橙品圣器 | I9: 500 | J9: =RC[-7]*RC[-1] -> 500 | K9: 8 | L9: =RC[-7]*RC[-5] -> 800
A10: 4 | B10: 13334 | C10: 1 | D10: 7 | E10: 4 | F10: 10087 | G10: =ROUND(RC[3]*RC[4]/10/R6C14,0) -> 660 | H10: 任选闪光橙装 | I10: 6600 | J10: =RC[-7]*RC[-1] -> 6600 | K10: 10 | L10: =RC[-7]*RC[-5] -> 2640
A11: 5 | B11: 15001 | C11: 5 | D11: 25 | E11: 12 | F11: 10087 | G11: =ROUND(RC[3]*RC[4]/10/R6C14,0) -> 25 | H11: 希望精灵碎片 | I11: 50 | J11: =RC[-7]*RC[-1] -> 250 | K11: 10 | L11: =RC[-7]*RC[-5] -> 300
A12: 6 | B12: 15031 | C12: 5 | D12: 25 | E12: 12 | F12: 10087 | G12: =ROUND(RC[3]*RC[4]/10/R6C14,0) -> 25 | H12: 花之妖精碎片 | I12: 50 | J12: =RC[-7]*RC[-1] -> 250 | K12: 10 | L12: =RC[-7]*RC[-5] -> 300
A13: 7 | B13: 15011 | C13: 5 | D13: 25 | E13: 12 | F13: 10087 | G13: =ROUND(RC[3]*RC[4]/10/R6C14,0) -> 40 | H13: 炼狱灵龙碎片 | I13: 80 | J13: =RC[-7]*RC[-1] -> 400 | K13: 10 | L13: =RC[-7]*RC[-5] -> 480
A14: 8 | B14: 15012 | C14: 5 | D14: 25 | E14: 12 | F14: 10087 | G14: =ROUND(RC[3]*RC[4]/10/R6C14,0) -> 40 | H14: 深海女王碎片 | I14: 80 | J14: =RC[-7]*RC[-1] -> 400 | K14: 10 | L14: =RC[-7]*RC[-5] -> 480
A15: 9 | B15: 15022 | C15: 5 | D15: 25 | E15: 12 | F15: 10087 | G15: =ROUND(RC[3]*RC[4]/10/R6C14,0) -> 40 | H15: 大地之子碎片 | I15: 80 | J15: =RC[-7]*RC[-1] -> 400 | K15: 10 | L15: =RC[-7]*RC[-5] -> 480
A16: 10 | B16: 33400 | C16: 5 | D16: 1 | E16: 0 | F16: 10087 | G16: =ROUND(RC[3]*RC[4]/10/R6C14,0) -> 50 | H16: 橙品传承核心 | I16: 200 | J16: =RC[-7]*RC[-1] -> 1000 | K16: 5 | L16: =RC[-7]*RC[-5] -> 0
A17: 11 | B17: 10003 | C17: 100 | D17: 9 | E17: 0 | F17: 10087 | G17: =ROUND(RC[3]*RC[4]/10/R6C14,0) -> 18 | H17: 培养石 | I17: 3 | J17: =RC[-7]*RC[-1] -> 300 | K17: 6 | L17: =RC[-7]*RC[-5] -> 0
A18: 12 | B18: 10004 | C18: 100 | D18: 35 | E18: 0 | F18: 10087 | G18: =ROUND(RC[3]*RC[4]/10/R6C14,0) -> 60 | H18: 潜能合剂 | I18: 15 | J18: =RC[-7]*RC[-1] -> 1500 | K18: 4 | L18: =RC[-7]*RC[-5] -> 0
A19: 13 | B19: 10014 | C19: 100 | D19: 29 | E19: 0 | F19: 10087 | G19: =ROUND(RC[3]*RC[4]/10/R6C14,0) -> 120 | H19: 橙品精炼石 | I19: 20 | J19: =RC[-7]*RC[-1] -> 2000 | K19: 6 | L19: =RC[-7]*RC[-5] -> 0
A20: 14 | B20: 10010 | C20: 100 | D20: 39 | E20: 0 | F20: 10087 | G20: =ROUND(RC[3]*RC[4]/10/R6C14,0) -> 40 | H20: 圣器精炼石 | I20: 5 | J20: =RC[-7]*RC[-1] -> 500 | K20: 8 | L20: =RC[-7]*RC[-5] -> 0
A21: 15 | B21: 10022 | C21: 100 | D21: 25 | E21: 0 | F21: 10087 | G21: =ROUND(RC[3]*RC[4]/10/R6C14,0) -> 250 | H21: 灵性精粹 | I21: 50 | J21: =RC[-7]*RC[-1] -> 5000 | K21: 5 | L21: =RC[-7]*RC[-5] -> 0
A22: 16 | B22: 19103 | C22: 1 | D22: 1 | E22: 0 | F22: 10087 | G22: =ROUND(RC[3]*RC[4]/10/R6C14,0) -> 1 | H22: 金币 | I22: 10 | J22: =RC[-7]*RC[-1] -> 10 | K22: 10 | L22: =RC[-7]*RC[-5] -> 0