Sheet: 配置
A1: 服务端文件名 | B1: 服务端对应工作表号 | C1: 客户端文件名 | D1: 客户端对应工作表号 | E1: erl头部 | F1: erl内容格式 | G1: erl尾部 | H1: 客户端特殊处理
A2: config_awaken_shop_slot.txt | B2: 1 | F2: get(id) -> #$
A3: config_awaken_shop.txt | B3: 2 | C3: config_awaken_shop.cnf|AwakenShop | D3: 2 | F3: get(goods_id) -> #$ | H3: 2=>goods_id

Sheet: 商店槽位配置
A1: |slot | B1: |goods_list
A2: 不可空 | B2: 不可空
A3: 数字 | B3: 一维数组
B4: 不定长
A6: 商店槽位 | B6: 商品随机列表
A7: 1 | B7: 1|2|3|4
A8: 2 | B8: 101|102|103|104
A9: 3 | B9: 1001|1002|1003|1004|1005|1006|1007|1008|1009|1010|1011|1012|1013|1014|1015|1016|1017|1018|1019|1020|1021|1022|1023|1024|1025|1026|1027|1028|1029|1030|1031|1032|1033|1034|1035|1036|1037|1038|1039|1040|1041|1042|1043|1044|1045|1046|1047|1048|1049|1050|1051|1052|1053|1054|1055|1056|1057|1058|1059|1060|1061|1062|1063|1064|1065|1066|1067|1068|1069|1070|1071|1072|1073|1074|1075|1076|1077|1078|1079|1080|1081|1082|1083|1084|1085|1086|1087|1088|1089|1090|1091|1092|1093|1094|1095|1096|1097|1098|1099|1100
A10: 4 | B10: 1201|1202|1203|1204|1205|1206|1207|1208|1209|1210|1211|1212|1213|1214|1215|1216|1217|1218|1219|1220|1221|1222|1223|1224|1225|1226|1227|1228|1229|1230|1231|1232|1233|1234|1235|1236|1237|1238|1239|1240|1241|1242|1243|1244|1245|1246|1247|1248|1249|1250|1251|1252|1253|1254|1255|1256|1257|1258|1259|1260|1261|1262|1263|1264|1265|1266|1267|1268|1269|1270|1271|1272|1273|1274|1275|1276|1277|1278|1279|1280|1281|1282|1283|1284|1285|1286|1287|1288|1289|1290|1291|1292|1293|1294|1295|1296|1297|1298|1299|1300
A11: 5 | B11: 1401|1402|1403|1404|1405|1406|1407|1408|1409|1410|1411|1412|1413|1414|1415|1416|1417|1418|1419|1420|1421|1422|1423|1424|1425|1426|1427|1428|1429|1430|1431|1432|1433|1434|1435|1436|1437|1438|1439|1440|1441|1442|1443|1444|1445|1446|1447|1448|1449|1450|1451|1452|1453|1454|1455|1456|1457|1458|1459|1460|1461|1462|1463|1464|1465|1466|1467|1468|1469|1470|1471|1472|1473|1474|1475|1476|1477|1478|1479|1480|1481|1482|1483|1484|1485|1486|1487|1488|1489|1490|1491|1492|1493|1494|1495|1496|1497|1498|1499|1500
A12: 6 | B12: 1601|1602|1603|1604|1605|1606|1607|1608|1609|1610|1611|1612|1613|1614|1615|1616|1617|1618|1619|1620|1621|1622|1623|1624|1625|1626|1627|1628|1629|1630|1631|1632|1633|1634|1635|1636|1637|1638|1639|1640|1641|1642|1643|1644|1645|1646|1647|1648|1649|1650|1651|1652|1653|1654|1655|1656|1657|1658|1659|1660|1661|1662|1663|1664|1665|1666|1667|1668|1669|1670|1671|1672|1673|1674|1675|1676|1677|1678|1679|1680|1681|1682|1683|1684|1685|1686|1687|1688|1689|1690|1691|1692|1693|1694|1695|1696|1697|1698|1699|1700

Sheet: 商品
A1: goods_id|goods_id | B1: item_id|item_id | C1: item_num|item_num | D1: buy_num_max|buy_num_max | E1: need_role_level|need_role_level | F1: rate|rate | G1: cost_type_list|cost_type_list | H1: cost_value_list|cost_value_list | I1: is_recommend|
A2: 不可空 | B2: 不可空 | C2: 不可空 | D2: 不可空 | E2: 不可空 | F2: 不可空 | G2: 可空#不需字段 | H2: 可空#不需字段 | I2: 不可空
A3: 数字 | B3: 数字 | C3: 数字 | D3: 数字 | E3: 数字 | F3: 数字 | G3: 一维数组 | H3: 一维数组 | I3: 数字
G4: 不定长 | H4: 不定长
A6: 商品ID | B6: 物品ID | C6: 物品数量 | D6: 购买数量上限(0=表示无上限) | E6: 等级限制 | F6: 刷出概率 | G6: 消耗类型列表 | H6: 消耗值列表 | I6: 是否推荐
A7: 1 | B7: 10008 | C7: 20 | D7: 1 | E7: 1 | F7: 1 | G7: 17 | H7: 50 | I7: 0
A8: 2 | B8: 10008 | C8: 40 | D8: 1 | E8: 1 | F8: 1 | G8: 17 | H8: 100 | I8: 0
A9: 3 | B9: 10008 | C9: 100 | D9: 1 | E9: 1 | F9: 1 | G9: 17 | H9: 250 | I9: 0
A10: 4 | B10: 10008 | C10: 200 | D10: 1 | E10: 1 | F10: 1 | G10: 17 | H10: 500 | I10: 0
A11: 101 | B11: 10008 | C11: 20 | D11: 1 | E11: 1 | F11: 1 | G11: 5 | H11: 50 | I11: 0
A12: 102 | B12: 10008 | C12: 40 | D12: 1 | E12: 1 | F12: 1 | G12: 5 | H12: 100 | I12: 0
A13: 103 | B13: 10008 | C13: 100 | D13: 1 | E13: 1 | F13: 1 | G13: 5 | H13: 250 | I13: 0
A14: 104 | B14: 10008 | C14: 200 | D14: 1 | E14: 1 | F14: 1 | G14: 5 | H14: 500 | I14: 0
A15: 1001 | B15: 60001 | C15: 1 | D15: 1 | E15: 1 | F15: 1 | G15: 17 | H15: =VLOOKUP(INT(MOD(RC[-6],1000)/100),Sheet1!R2C1:R8C2,2,FALSE)*RC[-5] -> 5 | I15: 0
A16: 1002 | B16: 60002 | C16: 1 | D16: 1 | E16: 1 | F16: 1 | G16: 17 | H16: =VLOOKUP(INT(MOD(RC[-6],1000)/100),Sheet1!R2C1:R8C2,2,FALSE)*RC[-5] -> 5 | I16: 0
A17: 1003 | B17: 60101 | C17: 1 | D17: 1 | E17: 1 | F17: 1 | G17: 17 | H17: =VLOOKUP(INT(MOD(RC[-6],1000)/100),Sheet1!R2C1:R8C2,2,FALSE)*RC[-5] -> 20 | I17: 0
A18: 1004 | B18: 60102 | C18: 1 | D18: 1 | E18: 1 | F18: 1 | G18: 17 | H18: =VLOOKUP(INT(MOD(RC[-6],1000)/100),Sheet1!R2C1:R8C2,2,FALSE)*RC[-5] -> 20 | I18: 0
A19: 1005 | B19: 60201 | C19: 1 | D19: 1 | E19: 55 | F19: 1 | G19: 17 | H19: =VLOOKUP(INT(MOD(RC[-6],1000)/100),Sheet1!R2C1:R8C2,2,FALSE)*RC[-5] -> 105 | I19: 0
A20: 1006 | B20: 60202 | C20: 1 | D20: 1 | E20: 55 | F20: 1 | G20: 17 | H20: =VLOOKUP(INT(MOD(RC[-6],1000)/100),Sheet1!R2C1:R8C2,2,FALSE)*RC[-5] -> 105 | I20: 0
A21: 1007 | B21: 60301 | C21: 1 | D21: 1 | E21: 60 | F21: 1 | G21: 17 | H21: =VLOOKUP(INT(MOD(RC[-6],1000)/100),Sheet1!R2C1:R8C2,2,FALSE)*RC[-5] -> 520 | I21: 0
A22: 1008 | B22: 60302 | C22: 1 | D22: 1 | E22: 60 | F22: 1 | G22: 17 | H22: =VLOOKUP(INT(MOD(RC[-6],1000)/100),Sheet1!R2C1:R8C2,2,FALSE)*RC[-5] -> 520 | I22: 0
A23: 1009 | B23: 60401 | C23: 1 | D23: 1 | E23: 70 | F23: 1 | G23: 17 | H23: =VLOOKUP(INT(MOD(RC[-6],1000)/100),Sheet1!R2C1:R8C2,2,FALSE)*RC[-5] -> 1355 | I23: 1
A24: 1010 | B24: 60402 | C24: 1 | D24: 1 | E24: 70 | F24: 1 | G24: 17 | H24: =VLOOKUP(INT(MOD(RC[-6],1000)/100),Sheet1!R2C1:R8C2,2,FALSE)*RC[-5] -> 1355 | I24: 1
A25: 1011 | B25: 60001 | C25: 2 | D25: 1 | E25: =R[-10]C -> 1 | F25: 1 | G25: 17 | H25: =VLOOKUP(INT(MOD(RC[-6],1000)/100),Sheet1!R2C1:R8C2,2,FALSE)*RC[-5] -> 10 | I25: =R[-10]C -> 0
A26: 1012 | B26: 60002 | C26: 2 | D26: 1 | E26: =R[-10]C -> 1 | F26: 1 | G26: 17 | H26: =VLOOKUP(INT(MOD(RC[-6],1000)/100),Sheet1!R2C1:R8C2,2,FALSE)*RC[-5] -> 10 | I26: =R[-10]C -> 0
A27: 1013 | B27: 60101 | C27: 2 | D27: 1 | E27: =R[-10]C -> 1 | F27: 1 | G27: 17 | H27: =VLOOKUP(INT(MOD(RC[-6],1000)/100),Sheet1!R2C1:R8C2,2,FALSE)*RC[-5] -> 40 | I27: =R[-10]C -> 0
A28: 1014 | B28: 60102 | C28: 2 | D28: 1 | E28: =R[-10]C -> 1 | F28: 1 | G28: 17 | H28: =VLOOKUP(INT(MOD(RC[-6],1000)/100),Sheet1!R2C1:R8C2,2,FALSE)*RC[-5] -> 40 | I28: =R[-10]C -> 0
A29: 1015 | B29: 60201 | C29: 2 | D29: 1 | E29: =R[-10]C -> 55 | F29: 1 | G29: 17 | H29: =VLOOKUP(INT(MOD(RC[-6],1000)/100),Sheet1!R2C1:R8C2,2,FALSE)*RC[-5] -> 210 | I29: =R[-10]C -> 0
A30: 1016 | B30: 60202 | C30: 2 | D30: 1 | E30: =R[-10]C -> 55 | F30: 1 | G30: 17 | H30: =VLOOKUP(INT(MOD(RC[-6],1000)/100),Sheet1!R2C1:R8C2,2,FALSE)*RC[-5] -> 210 | I30: =R[-10]C -> 0
A31: 1017 | B31: 60301 | C31: 2 | D31: 1 | E31: =R[-10]C -> 60 | F31: 1 | G31: 17 | H31: =VLOOKUP(INT(MOD(RC[-6],1000)/100),Sheet1!R2C1:R8C2,2,FALSE)*RC[-5] -> 1040 | I31: =R[-10]C -> 0
A32: 1018 | B32: 60302 | C32: 2 | D32: 1 | E32: =R[-10]C -> 60 | F32: 1 | G32: 17 | H32: =VLOOKUP(INT(MOD(RC[-6],1000)/100),Sheet1!R2C1:R8C2,2,FALSE)*RC[-5] -> 1040 | I32: =R[-10]C -> 0
A33: 1019 | B33: 60401 | C33: 2 | D33: 1 | E33: =R[-10]C -> 70 | F33: 1 | G33: 17 | H33: =VLOOKUP(INT(MOD(RC[-6],1000)/100),Sheet1!R2C1:R8C2,2,FALSE)*RC[-5] -> 2710 | I33: =R[-10]C -> 1
A34: 1020 | B34: 60402 | C34: 2 | D34: 1 | E34: =R[-10]C -> 70 | F34: 1 | G34: 17 | H34: =VLOOKUP(INT(MOD(RC[-6],1000)/100),Sheet1!R2C1:R8C2,2,FALSE)*RC[-5] -> 2710 | I34: =R[-10]C -> 1
A35: 1021 | B35: 60001 | C35: 3 | D35: 1 | E35: =R[-10]C -> 1 | F35: 1 | G35: 17 | H35: =VLOOKUP(INT(MOD(RC[-6],1000)/100),Sheet1!R2C1:R8C2,2,FALSE)*RC[-5] -> 15 | I35: =R[-10]C -> 0
A36: 1022 | B36: 60002 | C36: 3 | D36: 1 | E36: =R[-10]C -> 1 | F36: 1 | G36: 17 | H36: =VLOOKUP(INT(MOD(RC[-6],1000)/100),Sheet1!R2C1:R8C2,2,FALSE)*RC[-5] -> 15 | I36: =R[-10]C -> 0
A37: 1023 | B37: 60101 | C37: 3 | D37: 1 | E37: =R[-10]C -> 1 | F37: 1 | G37: 17 | H37: =VLOOKUP(INT(MOD(RC[-6],1000)/100),Sheet1!R2C1:R8C2,2,FALSE)*RC[-5] -> 60 | I37: =R[-10]C -> 0
A38: 1024 | B38: 60102 | C38: 3 | D38: 1 | E38: =R[-10]C -> 1 | F38: 1 | G38: 17 | H38: =VLOOKUP(INT(MOD(RC[-6],1000)/100),Sheet1!R2C1:R8C2,2,FALSE)*RC[-5] -> 60 | I38: =R[-10]C -> 0
A39: 1025 | B39: 60201 | C39: 3 | D39: 1 | E39: =R[-10]C -> 55 | F39: 1 | G39: 17 | H39: =VLOOKUP(INT(MOD(RC[-6],1000)/100),Sheet1!R2C1:R8C2,2,FALSE)*RC[-5] -> 315 | I39: =R[-10]C -> 0
A40: 1026 | B40: 60202 | C40: 3 | D40: 1 | E40: =R[-10]C -> 55 | F40: 1 | G40: 17 | H40: =VLOOKUP(INT(MOD(RC[-6],1000)/100),Sheet1!R2C1:R8C2,2,FALSE)*RC[-5] -> 315 | I40: =R[-10]C -> 0
A41: 1027 | B41: 60301 | C41: 3 | D41: 1 | E41: =R[-10]C -> 60 | F41: 1 | G41: 17 | H41: =VLOOKUP(INT(MOD(RC[-6],1000)/100),Sheet1!R2C1:R8C2,2,FALSE)*RC[-5] -> 1560 | I41: =R[-10]C -> 0
A42: 1028 | B42: 60302 | C42: 3 | D42: 1 | E42: =R[-10]C -> 60 | F42: 1 | G42: 17 | H42: =VLOOKUP(INT(MOD(RC[-6],1000)/100),Sheet1!R2C1:R8C2,2,FALSE)*RC[-5] -> 1560 | I42: =R[-10]C -> 0
A43: 1029 | B43: 60401 | C43: 3 | D43: 1 | E43: =R[-10]C -> 70 | F43: 1 | G43: 17 | H43: =VLOOKUP(INT(MOD(RC[-6],1000)/100),Sheet1!R2C1:R8C2,2,FALSE)*RC[-5] -> 4065 | I43: =R[-10]C -> 1
A44: 1030 | B44: 60402 | C44: 3 | D44: 1 | E44: =R[-10]C -> 70 | F44: 1 | G44: 17 | H44: =VLOOKUP(INT(MOD(RC[-6],1000)/100),Sheet1!R2C1:R8C2,2,FALSE)*RC[-5] -> 4065 | I44: =R[-10]C -> 1
A45: 1031 | B45: 60001 | C45: 4 | D45: 1 | E45: =R[-10]C -> 1 | F45: 1 | G45: 17 | H45: =VLOOKUP(INT(MOD(RC[-6],1000)/100),Sheet1!R2C1:R8C2,2,FALSE)*RC[-5] -> 20 | I45: =R[-10]C -> 0
A46: 1032 | B46: 60002 | C46: 4 | D46: 1 | E46: =R[-10]C -> 1 | F46: 1 | G46: 17 | H46: =VLOOKUP(INT(MOD(RC[-6],1000)/100),Sheet1!R2C1:R8C2,2,FALSE)*RC[-5] -> 20 | I46: =R[-10]C -> 0
A47: 1033 | B47: 60101 | C47: 4 | D47: 1 | E47: =R[-10]C -> 1 | F47: 1 | G47: 17 | H47: =VLOOKUP(INT(MOD(RC[-6],1000)/100),Sheet1!R2C1:R8C2,2,FALSE)*RC[-5] -> 80 | I47: =R[-10]C -> 0
A48: 1034 | B48: 60102 | C48: 4 | D48: 1 | E48: =R[-10]C -> 1 | F48: 1 | G48: 17 | H48: =VLOOKUP(INT(MOD(RC[-6],1000)/100),Sheet1!R2C1:R8C2,2,FALSE)*RC[-5] -> 80 | I48: =R[-10]C -> 0
A49: 1035 | B49: 60201 | C49: 4 | D49: 1 | E49: =R[-10]C -> 55 | F49: 1 | G49: 17 | H49: =VLOOKUP(INT(MOD(RC[-6],1000)/100),Sheet1!R2C1:R8C2,2,FALSE)*RC[-5] -> 420 | I49: =R[-10]C -> 0
A50: 1036 | B50: 60202 | C50: 4 | D50: 1 | E50: =R[-10]C -> 55 | F50: 1 | G50: 17 | H50: =VLOOKUP(INT(MOD(RC[-6],1000)/100),Sheet1!R2C1:R8C2,2,FALSE)*RC[-5] -> 420 | I50: =R[-10]C -> 0
A51: 1037 | B51: 60301 | C51: 4 | D51: 1 | E51: =R[-10]C -> 60 | F51: 1 | G51: 17 | H51: =VLOOKUP(INT(MOD(RC[-6],1000)/100),Sheet1!R2C1:R8C2,2,FALSE)*RC[-5] -> 2080 | I51: =R[-10]C -> 0
A52: 1038 | B52: 60302 | C52: 4 | D52: 1 | E52: =R[-10]C -> 60 | F52: 1 | G52: 17 | H52: =VLOOKUP(INT(MOD(RC[-6],1000)/100),Sheet1!R2C1:R8C2,2,FALSE)*RC[-5] -> 2080 | I52: =R[-10]C -> 0
A53: 1039 | B53: 60401 | C53: 4 | D53: 1 | E53: =R[-10]C -> 70 | F53: 1 | G53: 17 | H53: =VLOOKUP(INT(MOD(RC[-6],1000)/100),Sheet1!R2C1:R8C2,2,FALSE)*RC[-5] -> 5420 | I53: =R[-10]C -> 1
A54: 1040 | B54: 60402 | C54: 4 | D54: 1 | E54: =R[-10]C -> 70 | F54: 1 | G54: 17 | H54: =VLOOKUP(INT(MOD(RC[-6],1000)/100),Sheet1!R2C1:R8C2,2,FALSE)*RC[-5] -> 5420 | I54: =R[-10]C -> 1
A55: 1041 | B55: 60001 | C55: 5 | D55: 1 | E55: =R[-10]C -> 1 | F55: 1 | G55: 17 | H55: =VLOOKUP(INT(MOD(RC[-6],1000)/100),Sheet1!R2C1:R8C2,2,FALSE)*RC[-5] -> 25 | I55: =R[-10]C -> 0
A56: 1042 | B56: 60002 | C56: 5 | D56: 1 | E56: =R[-10]C -> 1 | F56: 1 | G56: 17 | H56: =VLOOKUP(INT(MOD(RC[-6],1000)/100),Sheet1!R2C1:R8C2,2,FALSE)*RC[-5] -> 25 | I56: =R[-10]C -> 0
A57: 1043 | B57: 60101 | C57: 5 | D57: 1 | E57: =R[-10]C -> 1 | F57: 1 | G57: 17 | H57: =VLOOKUP(INT(MOD(RC[-6],1000)/100),Sheet1!R2C1:R8C2,2,FALSE)*RC[-5] -> 100 | I57: =R[-10]C -> 0
A58: 1044 | B58: 60102 | C58: 5 | D58: 1 | E58: =R[-10]C -> 1 | F58: 1 | G58: 17 | H58: =VLOOKUP(INT(MOD(RC[-6],1000)/100),Sheet1!R2C1:R8C2,2,FALSE)*RC[-5] -> 100 | I58: =R[-10]C -> 0
A59: 1045 | B59: 60201 | C59: 5 | D59: 1 | E59: =R[-10]C -> 55 | F59: 1 | G59: 17 | H59: =VLOOKUP(INT(MOD(RC[-6],1000)/100),Sheet1!R2C1:R8C2,2,FALSE)*RC[-5] -> 525 | I59: =R[-10]C -> 0
A60: 1046 | B60: 60202 | C60: 5 | D60: 1 | E60: =R[-10]C -> 55 | F60: 1 | G60: 17 | H60: =VLOOKUP(INT(MOD(RC[-6],1000)/100),Sheet1!R2C1:R8C2,2,FALSE)*RC[-5] -> 525 | I60: =R[-10]C -> 0
A61: 1047 | B61: 60301 | C61: 5 | D61: 1 | E61: =R[-10]C -> 60 | F61: 1 | G61: 17 | H61: =VLOOKUP(INT(MOD(RC[-6],1000)/100),Sheet1!R2C1:R8C2,2,FALSE)*RC[-5] -> 2600 | I61: =R[-10]C -> 0
A62: 1048 | B62: 60302 | C62: 5 | D62: 1 | E62: =R[-10]C -> 60 | F62: 1 | G62: 17 | H62: =VLOOKUP(INT(MOD(RC[-6],1000)/100),Sheet1!R2C1:R8C2,2,FALSE)*RC[-5] -> 2600 | I62: =R[-10]C -> 0
A63: 1049 | B63: 60401 | C63: 5 | D63: 1 | E63: =R[-10]C -> 70 | F63: 1 | G63: 17 | H63: =VLOOKUP(INT(MOD(RC[-6],1000)/100),Sheet1!R2C1:R8C2,2,FALSE)*RC[-5] -> 6775 | I63: =R[-10]C -> 1
A64: 1050 | B64: 60402 | C64: 5 | D64: 1 | E64: =R[-10]C -> 70 | F64: 1 | G64: 17 | H64: =VLOOKUP(INT(MOD(RC[-6],1000)/100),Sheet1!R2C1:R8C2,2,FALSE)*RC[-5] -> 6775 | I64: =R[-10]C -> 1
A65: 1051 | B65: 60001 | C65: 1 | D65: 1 | E65: =R[-10]C -> 1 | F65: 1 | G65: 5 | H65: =VLOOKUP(INT(MOD(RC[-6],1000)/100),Sheet1!R2C1:R8C2,2,FALSE)*RC[-5] -> 5 | I65: =R[-10]C -> 0
A66: 1052 | B66: 60002 | C66: 1 | D66: 1 | E66: =R[-10]C -> 1 | F66: 1 | G66: 5 | H66: =VLOOKUP(INT(MOD(RC[-6],1000)/100),Sheet1!R2C1:R8C2,2,FALSE)*RC[-5] -> 5 | I66: =R[-10]C -> 0
A67: 1053 | B67: 60101 | C67: 1 | D67: 1 | E67: =R[-10]C -> 1 | F67: 1 | G67: 5 | H67: =VLOOKUP(INT(MOD(RC[-6],1000)/100),Sheet1!R2C1:R8C2,2,FALSE)*RC[-5] -> 20 | I67: =R[-10]C -> 0
A68: 1054 | B68: 60102 | C68: 1 | D68: 1 | E68: =R[-10]C -> 1 | F68: 1 | G68: 5 | H68: =VLOOKUP(INT(MOD(RC[-6],1000)/100),Sheet1!R2C1:R8C2,2,FALSE)*RC[-5] -> 20 | I68: =R[-10]C -> 0
A69: 1055 | B69: 60201 | C69: 1 | D69: 1 | E69: =R[-10]C -> 55 | F69: 1 | G69: 5 | H69: =VLOOKUP(INT(MOD(RC[-6],1000)/100),Sheet1!R2C1:R8C2,2,FALSE)*RC[-5] -> 105 | I69: =R[-10]C -> 0
A70: 1056 | B70: 60202 | C70: 1 | D70: 1 | E70: =R[-10]C -> 55 | F70: 1 | G70: 5 | H70: =VLOOKUP(INT(MOD(RC[-6],1000)/100),Sheet1!R2C1:R8C2,2,FALSE)*RC[-5] -> 105 | I70: =R[-10]C -> 0
A71: 1057 | B71: 60301 | C71: 1 | D71: 1 | E71: =R[-10]C -> 60 | F71: 1 | G71: 5 | H71: =VLOOKUP(INT(MOD(RC[-6],1000)/100),Sheet1!R2C1:R8C2,2,FALSE)*RC[-5] -> 520 | I71: =R[-10]C -> 0
A72: 1058 | B72: 60302 | C72: 1 | D72: 1 | E72: =R[-10]C -> 60 | F72: 1 | G72: 5 | H72: =VLOOKUP(INT(MOD(RC[-6],1000)/100),Sheet1!R2C1:R8C2,2,FALSE)*RC[-5] -> 520 | I72: =R[-10]C -> 0
A73: 1059 | B73: 60401 | C73: 1 | D73: 1 | E73: =R[-10]C -> 70 | F73: 1 | G73: 5 | H73: =VLOOKUP(INT(MOD(RC[-6],1000)/100),Sheet1!R2C1:R8C2,2,FALSE)*RC[-5] -> 1355 | I73: =R[-10]C -> 1
A74: 1060 | B74: 60402 | C74: 1 | D74: 1 | E74: =R[-10]C -> 70 | F74: 1 | G74: 5 | H74: =VLOOKUP(INT(MOD(RC[-6],1000)/100),Sheet1!R2C1:R8C2,2,FALSE)*RC[-5] -> 1355 | I74: =R[-10]C -> 1
A75: 1061 | B75: 60001 | C75: 2 | D75: 1 | E75: =R[-10]C -> 1 | F75: 1 | G75: 5 | H75: =VLOOKUP(INT(MOD(RC[-6],1000)/100),Sheet1!R2C1:R8C2,2,FALSE)*RC[-5] -> 10 | I75: =R[-10]C -> 0
A76: 1062 | B76: 60002 | C76: 2 | D76: 1 | E76: =R[-10]C -> 1 | F76: 1 | G76: 5 | H76: =VLOOKUP(INT(MOD(RC[-6],1000)/100),Sheet1!R2C1:R8C2,2,FALSE)*RC[-5] -> 10 | I76: =R[-10]C -> 0
A77: 1063 | B77: 60101 | C77: 2 | D77: 1 | E77: =R[-10]C -> 1 | F77: 1 | G77: 5 | H77: =VLOOKUP(INT(MOD(RC[-6],1000)/100),Sheet1!R2C1:R8C2,2,FALSE)*RC[-5] -> 40 | I77: =R[-10]C -> 0
A78: 1064 | B78: 60102 | C78: 2 | D78: 1 | E78: =R[-10]C -> 1 | F78: 1 | G78: 5 | H78: =VLOOKUP(INT(MOD(RC[-6],1000)/100),Sheet1!R2C1:R8C2,2,FALSE)*RC[-5] -> 40 | I78: =R[-10]C -> 0
A79: 1065 | B79: 60201 | C79: 2 | D79: 1 | E79: =R[-10]C -> 55 | F79: 1 | G79: 5 | H79: =VLOOKUP(INT(MOD(RC[-6],1000)/100),Sheet1!R2C1:R8C2,2,FALSE)*RC[-5] -> 210 | I79: =R[-10]C -> 0
A80: 1066 | B80: 60202 | C80: 2 | D80: 1 | E80: =R[-10]C -> 55 | F80: 1 | G80: 5 | H80: =VLOOKUP(INT(MOD(RC[-6],1000)/100),Sheet1!R2C1:R8C2,2,FALSE)*RC[-5] -> 210 | I80: =R[-10]C -> 0
A81: 1067 | B81: 60301 | C81: 2 | D81: 1 | E81: =R[-10]C -> 60 | F81: 1 | G81: 5 | H81: =VLOOKUP(INT(MOD(RC[-6],1000)/100),Sheet1!R2C1:R8C2,2,FALSE)*RC[-5] -> 1040 | I81: =R[-10]C -> 0
A82: 1068 | B82: 60302 | C82: 2 | D82: 1 | E82: =R[-10]C -> 60 | F82: 1 | G82: 5 | H82: =VLOOKUP(INT(MOD(RC[-6],1000)/100),Sheet1!R2C1:R8C2,2,FALSE)*RC[-5] -> 1040 | I82: =R[-10]C -> 0
A83: 1069 | B83: 60401 | C83: 2 | D83: 1 | E83: =R[-10]C -> 70 | F83: 1 | G83: 5 | H83: =VLOOKUP(INT(MOD(RC[-6],1000)/100),Sheet1!R2C1:R8C2,2,FALSE)*RC[-5] -> 2710 | I83: =R[-10]C -> 1
A84: 1070 | B84: 60402 | C84: 2 | D84: 1 | E84: =R[-10]C -> 70 | F84: 1 | G84: 5 | H84: =VLOOKUP(INT(MOD(RC[-6],1000)/100),Sheet1!R2C1:R8C2,2,FALSE)*RC[-5] -> 2710 | I84: =R[-10]C -> 1
A85: 1071 | B85: 60001 | C85: 3 | D85: 1 | E85: =R[-10]C -> 1 | F85: 1 | G85: 5 | H85: =VLOOKUP(INT(MOD(RC[-6],1000)/100),Sheet1!R2C1:R8C2,2,FALSE)*RC[-5] -> 15 | I85: =R[-10]C -> 0
A86: 1072 | B86: 60002 | C86: 3 | D86: 1 | E86: =R[-10]C -> 1 | F86: 1 | G86: 5 | H86: =VLOOKUP(INT(MOD(RC[-6],1000)/100),Sheet1!R2C1:R8C2,2,FALSE)*RC[-5] -> 15 | I86: =R[-10]C -> 0
A87: 1073 | B87: 60101 | C87: 3 | D87: 1 | E87: =R[-10]C -> 1 | F87: 1 | G87: 5 | H87: =VLOOKUP(INT(MOD(RC[-6],1000)/100),Sheet1!R2C1:R8C2,2,FALSE)*RC[-5] -> 60 | I87: =R[-10]C -> 0
A88: 1074 | B88: 60102 | C88: 3 | D88: 1 | E88: =R[-10]C -> 1 | F88: 1 | G88: 5 | H88: =VLOOKUP(INT(MOD(RC[-6],1000)/100),Sheet1!R2C1:R8C2,2,FALSE)*RC[-5] -> 60 | I88: =R[-10]C -> 0
A89: 1075 | B89: 60201 | C89: 3 | D89: 1 | E89: =R[-10]C -> 55 | F89: 1 | G89: 5 | H89: =VLOOKUP(INT(MOD(RC[-6],1000)/100),Sheet1!R2C1:R8C2,2,FALSE)*RC[-5] -> 315 | I89: =R[-10]C -> 0
A90: 1076 | B90: 60202 | C90: 3 | D90: 1 | E90: =R[-10]C -> 55 | F90: 1 | G90: 5 | H90: =VLOOKUP(INT(MOD(RC[-6],1000)/100),Sheet1!R2C1:R8C2,2,FALSE)*RC[-5] -> 315 | I90: =R[-10]C -> 0
A91: 1077 | B91: 60301 | C91: 3 | D91: 1 | E91: =R[-10]C -> 60 | F91: 1 | G91: 5 | H91: =VLOOKUP(INT(MOD(RC[-6],1000)/100),Sheet1!R2C1:R8C2,2,FALSE)*RC[-5] -> 1560 | I91: =R[-10]C -> 0
A92: 1078 | B92: 60302 | C92: 3 | D92: 1 | E92: =R[-10]C -> 60 | F92: 1 | G92: 5 | H92: =VLOOKUP(INT(MOD(RC[-6],1000)/100),Sheet1!R2C1:R8C2,2,FALSE)*RC[-5] -> 1560 | I92: =R[-10]C -> 0
A93: 1079 | B93: 60401 | C93: 3 | D93: 1 | E93: =R[-10]C -> 70 | F93: 1 | G93: 5 | H93: =VLOOKUP(INT(MOD(RC[-6],1000)/100),Sheet1!R2C1:R8C2,2,FALSE)*RC[-5] -> 4065 | I93: =R[-10]C -> 1
A94: 1080 | B94: 60402 | C94: 3 | D94: 1 | E94: =R[-10]C -> 70 | F94: 1 | G94: 5 | H94: =VLOOKUP(INT(MOD(RC[-6],1000)/100),Sheet1!R2C1:R8C2,2,FALSE)*RC[-5] -> 4065 | I94: =R[-10]C -> 1
A95: 1081 | B95: 60001 | C95: 4 | D95: 1 | E95: =R[-10]C -> 1 | F95: 1 | G95: 5 | H95: =VLOOKUP(INT(MOD(RC[-6],1000)/100),Sheet1!R2C1:R8C2,2,FALSE)*RC[-5] -> 20 | I95: =R[-10]C -> 0
A96: 1082 | B96: 60002 | C96: 4 | D96: 1 | E96: =R[-10]C -> 1 | F96: 1 | G96: 5 | H96: =VLOOKUP(INT(MOD(RC[-6],1000)/100),Sheet1!R2C1:R8C2,2,FALSE)*RC[-5] -> 20 | I96: =R[-10]C -> 0
A97: 1083 | B97: 60101 | C97: 4 | D97: 1 | E97: =R[-10]C -> 1 | F97: 1 | G97: 5 | H97: =VLOOKUP(INT(MOD(RC[-6],1000)/100),Sheet1!R2C1:R8C2,2,FALSE)*RC[-5] -> 80 | I97: =R[-10]C -> 0
A98: 1084 | B98: 60102 | C98: 4 | D98: 1 | E98: =R[-10]C -> 1 | F98: 1 | G98: 5 | H98: =VLOOKUP(INT(MOD(RC[-6],1000)/100),Sheet1!R2C1:R8C2,2,FALSE)*RC[-5] -> 80 | I98: =R[-10]C -> 0
A99: 1085 | B99: 60201 | C99: 4 | D99: 1 | E99: =R[-10]C -> 55 | F99: 1 | G99: 5 | H99: =VLOOKUP(INT(MOD(RC[-6],1000)/100),Sheet1!R2C1:R8C2,2,FALSE)*RC[-5] -> 420 | I99: =R[-10]C -> 0
A100: 1086 | B100: 60202 | C100: 4 | D100: 1 | E100: =R[-10]C -> 55 | F100: 1 | G100: 5 | H100: =VLOOKUP(INT(MOD(RC[-6],1000)/100),Sheet1!R2C1:R8C2,2,FALSE)*RC[-5] -> 420 | I100: =R[-10]C -> 0
A101: 1087 | B101: 60301 | C101: 4 | D101: 1 | E101: =R[-10]C -> 60 | F101: 1 | G101: 5 | H101: =VLOOKUP(INT(MOD(RC[-6],1000)/100),Sheet1!R2C1:R8C2,2,FALSE)*RC[-5] -> 2080 | I101: =R[-10]C -> 0
A102: 1088 | B102: 60302 | C102: 4 | D102: 1 | E102: =R[-10]C -> 60 | F102: 1 | G102: 5 | H102: =VLOOKUP(INT(MOD(RC[-6],1000)/100),Sheet1!R2C1:R8C2,2,FALSE)*RC[-5] -> 2080 | I102: =R[-10]C -> 0
A103: 1089 | B103: 60401 | C103: 4 | D103: 1 | E103: =R[-10]C -> 70 | F103: 1 | G103: 5 | H103: =VLOOKUP(INT(MOD(RC[-6],1000)/100),Sheet1!R2C1:R8C2,2,FALSE)*RC[-5] -> 5420 | I103: =R[-10]C -> 1
A104: 1090 | B104: 60402 | C104: 4 | D104: 1 | E104: =R[-10]C -> 70 | F104: 1 | G104: 5 | H104: =VLOOKUP(INT(MOD(RC[-6],1000)/100),Sheet1!R2C1:R8C2,2,FALSE)*RC[-5] -> 5420 | I104: =R[-10]C -> 1
A105: 1091 | B105: 60001 | C105: 5 | D105: 1 | E105: =R[-10]C -> 1 | F105: 1 | G105: 5 | H105: =VLOOKUP(INT(MOD(RC[-6],1000)/100),Sheet1!R2C1:R8C2,2,FALSE)*RC[-5] -> 25 | I105: =R[-10]C -> 0
A106: 1092 | B106: 60002 | C106: 5 | D106: 1 | E106: =R[-10]C -> 1 | F106: 1 | G106: 5 | H106: =VLOOKUP(INT(MOD(RC[-6],1000)/100),Sheet1!R2C1:R8C2,2,FALSE)*RC[-5] -> 25 | I106: =R[-10]C -> 0
A107: 1093 | B107: 60101 | C107: 5 | D107: 1 | E107: =R[-10]C -> 1 | F107: 1 | G107: 5 | H107: =VLOOKUP(INT(MOD(RC[-6],1000)/100),Sheet1!R2C1:R8C2,2,FALSE)*RC[-5] -> 100 | I107: =R[-10]C -> 0
A108: 1094 | B108: 60102 | C108: 5 | D108: 1 | E108: =R[-10]C -> 1 | F108: 1 | G108: 5 | H108: =VLOOKUP(INT(MOD(RC[-6],1000)/100),Sheet1!R2C1:R8C2,2,FALSE)*RC[-5] -> 100 | I108: =R[-10]C -> 0
A109: 1095 | B109: 60201 | C109: 5 | D109: 1 | E109: =R[-10]C -> 55 | F109: 1 | G109: 5 | H109: =VLOOKUP(INT(MOD(RC[-6],1000)/100),Sheet1!R2C1:R8C2,2,FALSE)*RC[-5] -> 525 | I109: =R[-10]C -> 0
A110: 1096 | B110: 60202 | C110: 5 | D110: 1 | E110: =R[-10]C -> 55 | F110: 1 | G110: 5 | H110: =VLOOKUP(INT(MOD(RC[-6],1000)/100),Sheet1!R2C1:R8C2,2,FALSE)*RC[-5] -> 525 | I110: =R[-10]C -> 0
A111: 1097 | B111: 60301 | C111: 5 | D111: 1 | E111: =R[-10]C -> 60 | F111: 1 | G111: 5 | H111: =VLOOKUP(INT(MOD(RC[-6],1000)/100),Sheet1!R2C1:R8C2,2,FALSE)*RC[-5] -> 2600 | I111: =R[-10]C -> 0
A112: 1098 | B112: 60302 | C112: 5 | D112: 1 | E112: =R[-10]C -> 60 | F112: 1 | G112: 5 | H112: =VLOOKUP(INT(MOD(RC[-6],1000)/100),Sheet1!R2C1:R8C2,2,FALSE)*RC[-5] -> 2600 | I112: =R[-10]C -> 0
A113: 1099 | B113: 60401 | C113: 5 | D113: 1 | E113: =R[-10]C -> 70 | F113: 1 | G113: 5 | H113: =VLOOKUP(INT(MOD(RC[-6],1000)/100),Sheet1!R2C1:R8C2,2,FALSE)*RC[-5] -> 6775 | I113: =R[-10]C -> 1
A114: 1100 | B114: 60402 | C114: 5 | D114: 1 | E114: =R[-10]C -> 70 | F114: 1 | G114: 5 | H114: =VLOOKUP(INT(MOD(RC[-6],1000)/100),Sheet1!R2C1:R8C2,2,FALSE)*RC[-5] -> 6775 | I114: =R[-10]C -> 1
A115: =R[-100]C+200 -> 1201 | B115: =R[-100]C+1000 -> 61001 | C115: =R[-100]C -> 1 | D115: =R[-100]C -> 1 | E115: =R[-100]C -> 1 | F115: =R[-100]C -> 1 | G115: =R[-100]C -> 17 | H115: =VLOOKUP(INT(MOD(RC[-6],1000)/100),Sheet1!R2C1:R8C2,2,FALSE)*RC[-5] -> 5 | I115: =R[-100]C -> 0
A116: =R[-100]C+200 -> 1202 | B116: =R[-100]C+1000 -> 61002 | C116: =R[-100]C -> 1 | D116: =R[-100]C -> 1 | E116: =R[-100]C -> 1 | F116: =R[-100]C -> 1 | G116: =R[-100]C -> 17 | H116: =VLOOKUP(INT(MOD(RC[-6],1000)/100),Sheet1!R2C1:R8C2,2,FALSE)*RC[-5] -> 5 | I116: =R[-100]C -> 0
A117: =R[-100]C+200 -> 1203 | B117: =R[-100]C+1000 -> 61101 | C117: =R[-100]C -> 1 | D117: =R[-100]C -> 1 | E117: =R[-100]C -> 1 | F117: =R[-100]C -> 1 | G117: =R[-100]C -> 17 | H117: =VLOOKUP(INT(MOD(RC[-6],1000)/100),Sheet1!R2C1:R8C2,2,FALSE)*RC[-5] -> 20 | I117: =R[-100]C -> 0
A118: =R[-100]C+200 -> 1204 | B118: =R[-100]C+1000 -> 61102 | C118: =R[-100]C -> 1 | D118: =R[-100]C -> 1 | E118: =R[-100]C -> 1 | F118: =R[-100]C -> 1 | G118: =R[-100]C -> 17 | H118: =VLOOKUP(INT(MOD(RC[-6],1000)/100),Sheet1!R2C1:R8C2,2,FALSE)*RC[-5] -> 20 | I118: =R[-100]C -> 0
A119: =R[-100]C+200 -> 1205 | B119: =R[-100]C+1000 -> 61201 | C119: =R[-100]C -> 1 | D119: =R[-100]C -> 1 | E119: =R[-100]C -> 55 | F119: =R[-100]C -> 1 | G119: =R[-100]C -> 17 | H119: =VLOOKUP(INT(MOD(RC[-6],1000)/100),Sheet1!R2C1:R8C2,2,FALSE)*RC[-5] -> 105 | I119: =R[-100]C -> 0
A120: =R[-100]C+200 -> 1206 | B120: =R[-100]C+1000 -> 61202 | C120: =R[-100]C -> 1 | D120: =R[-100]C -> 1 | E120: =R[-100]C -> 55 | F120: =R[-100]C -> 1 | G120: =R[-100]C -> 17 | H120: =VLOOKUP(INT(MOD(RC[-6],1000)/100),Sheet1!R2C1:R8C2,2,FALSE)*RC[-5] -> 105 | I120: =R[-100]C -> 0
A121: =R[-100]C+200 -> 1207 | B121: =R[-100]C+1000 -> 61301 | C121: =R[-100]C -> 1 | D121: =R[-100]C -> 1 | E121: =R[-100]C -> 60 | F121: =R[-100]C -> 1 | G121: =R[-100]C -> 17 | H121: =VLOOKUP(INT(MOD(RC[-6],1000)/100),Sheet1!R2C1:R8C2,2,FALSE)*RC[-5] -> 520 | I121: =R[-100]C -> 0
A122: =R[-100]C+200 -> 1208 | B122: =R[-100]C+1000 -> 61302 | C122: =R[-100]C -> 1 | D122: =R[-100]C -> 1 | E122: =R[-100]C -> 60 | F122: =R[-100]C -> 1 | G122: =R[-100]C -> 17 | H122: =VLOOKUP(INT(MOD(RC[-6],1000)/100),Sheet1!R2C1:R8C2,2,FALSE)*RC[-5] -> 520 | I122: =R[-100]C -> 0
A123: =R[-100]C+200 -> 1209 | B123: =R[-100]C+1000 -> 61401 | C123: =R[-100]C -> 1 | D123: =R[-100]C -> 1 | E123: =R[-100]C -> 70 | F123: =R[-100]C -> 1 | G123: =R[-100]C -> 17 | H123: =VLOOKUP(INT(MOD(RC[-6],1000)/100),Sheet1!R2C1:R8C2,2,FALSE)*RC[-5] -> 1355 | I123: =R[-100]C -> 1
A124: =R[-100]C+200 -> 1210 | B124: =R[-100]C+1000 -> 61402 | C124: =R[-100]C -> 1 | D124: =R[-100]C -> 1 | E124: =R[-100]C -> 70 | F124: =R[-100]C -> 1 | G124: =R[-100]C -> 17 | H124: =VLOOKUP(INT(MOD(RC[-6],1000)/100),Sheet1!R2C1:R8C2,2,FALSE)*RC[-5] -> 1355 | I124: =R[-100]C -> 1
A125: =R[-100]C+200 -> 1211 | B125: =R[-100]C+1000 -> 61001 | C125: =R[-100]C -> 2 | D125: =R[-100]C -> 1 | E125: =R[-100]C -> 1 | F125: =R[-100]C -> 1 | G125: =R[-100]C -> 17 | H125: =VLOOKUP(INT(MOD(RC[-6],1000)/100),Sheet1!R2C1:R8C2,2,FALSE)*RC[-5] -> 10 | I125: =R[-100]C -> 0
A126: =R[-100]C+200 -> 1212 | B126: =R[-100]C+1000 -> 61002 | C126: =R[-100]C -> 2 | D126: =R[-100]C -> 1 | E126: =R[-100]C -> 1 | F126: =R[-100]C -> 1 | G126: =R[-100]C -> 17 | H126: =VLOOKUP(INT(MOD(RC[-6],1000)/100),Sheet1!R2C1:R8C2,2,FALSE)*RC[-5] -> 10 | I126: =R[-100]C -> 0
A127: =R[-100]C+200 -> 1213 | B127: =R[-100]C+1000 -> 61101 | C127: =R[-100]C -> 2 | D127: =R[-100]C -> 1 | E127: =R[-100]C -> 1 | F127: =R[-100]C -> 1 | G127: =R[-100]C -> 17 | H127: =VLOOKUP(INT(MOD(RC[-6],1000)/100),Sheet1!R2C1:R8C2,2,FALSE)*RC[-5] -> 40 | I127: =R[-100]C -> 0
A128: =R[-100]C+200 -> 1214 | B128: =R[-100]C+1000 -> 61102 | C128: =R[-100]C -> 2 | D128: =R[-100]C -> 1 | E128: =R[-100]C -> 1 | F128: =R[-100]C -> 1 | G128: =R[-100]C -> 17 | H128: =VLOOKUP(INT(MOD(RC[-6],1000)/100),Sheet1!R2C1:R8C2,2,FALSE)*RC[-5] -> 40 | I128: =R[-100]C -> 0
A129: =R[-100]C+200 -> 1215 | B129: =R[-100]C+1000 -> 61201 | C129: =R[-100]C -> 2 | D129: =R[-100]C -> 1 | E129: =R[-100]C -> 55 | F129: =R[-100]C -> 1 | G129: =R[-100]C -> 17 | H129: =VLOOKUP(INT(MOD(RC[-6],1000)/100),Sheet1!R2C1:R8C2,2,FALSE)*RC[-5] -> 210 | I129: =R[-100]C -> 0
A130: =R[-100]C+200 -> 1216 | B130: =R[-100]C+1000 -> 61202 | C130: =R[-100]C -> 2 | D130: =R[-100]C -> 1 | E130: =R[-100]C -> 55 | F130: =R[-100]C -> 1 | G130: =R[-100]C -> 17 | H130: =VLOOKUP(INT(MOD(RC[-6],1000)/100),Sheet1!R2C1:R8C2,2,FALSE)*RC[-5] -> 210 | I130: =R[-100]C -> 0
A131: =R[-100]C+200 -> 1217 | B131: =R[-100]C+1000 -> 61301 | C131: =R[-100]C -> 2 | D131: =R[-100]C -> 1 | E131: =R[-100]C -> 60 | F131: =R[-100]C -> 1 | G131: =R[-100]C -> 17 | H131: =VLOOKUP(INT(MOD(RC[-6],1000)/100),Sheet1!R2C1:R8C2,2,FALSE)*RC[-5] -> 1040 | I131: =R[-100]C -> 0
A132: =R[-100]C+200 -> 1218 | B132: =R[-100]C+1000 -> 61302 | C132: =R[-100]C -> 2 | D132: =R[-100]C -> 1 | E132: =R[-100]C -> 60 | F132: =R[-100]C -> 1 | G132: =R[-100]C -> 17 | H132: =VLOOKUP(INT(MOD(RC[-6],1000)/100),Sheet1!R2C1:R8C2,2,FALSE)*RC[-5] -> 1040 | I132: =R[-100]C -> 0
A133: =R[-100]C+200 -> 1219 | B133: =R[-100]C+1000 -> 61401 | C133: =R[-100]C -> 2 | D133: =R[-100]C -> 1 | E133: =R[-100]C -> 70 | F133: =R[-100]C -> 1 | G133: =R[-100]C -> 17 | H133: =VLOOKUP(INT(MOD(RC[-6],1000)/100),Sheet1!R2C1:R8C2,2,FALSE)*RC[-5] -> 2710 | I133: =R[-100]C -> 1
A134: =R[-100]C+200 -> 1220 | B134: =R[-100]C+1000 -> 61402 | C134: =R[-100]C -> 2 | D134: =R[-100]C -> 1 | E134: =R[-100]C -> 70 | F134: =R[-100]C -> 1 | G134: =R[-100]C -> 17 | H134: =VLOOKUP(INT(MOD(RC[-6],1000)/100),Sheet1!R2C1:R8C2,2,FALSE)*RC[-5] -> 2710 | I134: =R[-100]C -> 1
A135: =R[-100]C+200 -> 1221 | B135: =R[-100]C+1000 -> 61001 | C135: =R[-100]C -> 3 | D135: =R[-100]C -> 1 | E135: =R[-100]C -> 1 | F135: =R[-100]C -> 1 | G135: =R[-100]C -> 17 | H135: =VLOOKUP(INT(MOD(RC[-6],1000)/100),Sheet1!R2C1:R8C2,2,FALSE)*RC[-5] -> 15 | I135: =R[-100]C -> 0
A136: =R[-100]C+200 -> 1222 | B136: =R[-100]C+1000 -> 61002 | C136: =R[-100]C -> 3 | D136: =R[-100]C -> 1 | E136: =R[-100]C -> 1 | F136: =R[-100]C -> 1 | G136: =R[-100]C -> 17 | H136: =VLOOKUP(INT(MOD(RC[-6],1000)/100),Sheet1!R2C1:R8C2,2,FALSE)*RC[-5] -> 15 | I136: =R[-100]C -> 0
A137: =R[-100]C+200 -> 1223 | B137: =R[-100]C+1000 -> 61101 | C137: =R[-100]C -> 3 | D137: =R[-100]C -> 1 | E137: =R[-100]C -> 1 | F137: =R[-100]C -> 1 | G137: =R[-100]C -> 17 | H137: =VLOOKUP(INT(MOD(RC[-6],1000)/100),Sheet1!R2C1:R8C2,2,FALSE)*RC[-5] -> 60 | I137: =R[-100]C -> 0
A138: =R[-100]C+200 -> 1224 | B138: =R[-100]C+1000 -> 61102 | C138: =R[-100]C -> 3 | D138: =R[-100]C -> 1 | E138: =R[-100]C -> 1 | F138: =R[-100]C -> 1 | G138: =R[-100]C -> 17 | H138: =VLOOKUP(INT(MOD(RC[-6],1000)/100),Sheet1!R2C1:R8C2,2,FALSE)*RC[-5] -> 60 | I138: =R[-100]C -> 0
A139: =R[-100]C+200 -> 1225 | B139: =R[-100]C+1000 -> 61201 | C139: =R[-100]C -> 3 | D139: =R[-100]C -> 1 | E139: =R[-100]C -> 55 | F139: =R[-100]C -> 1 | G139: =R[-100]C -> 17 | H139: =VLOOKUP(INT(MOD(RC[-6],1000)/100),Sheet1!R2C1:R8C2,2,FALSE)*RC[-5] -> 315 | I139: =R[-100]C -> 0
A140: =R[-100]C+200 -> 1226 | B140: =R[-100]C+1000 -> 61202 | C140: =R[-100]C -> 3 | D140: =R[-100]C -> 1 | E140: =R[-100]C -> 55 | F140: =R[-100]C -> 1 | G140: =R[-100]C -> 17 | H140: =VLOOKUP(INT(MOD(RC[-6],1000)/100),Sheet1!R2C1:R8C2,2,FALSE)*RC[-5] -> 315 | I140: =R[-100]C -> 0
A141: =R[-100]C+200 -> 1227 | B141: =R[-100]C+1000 -> 61301 | C141: =R[-100]C -> 3 | D141: =R[-100]C -> 1 | E141: =R[-100]C -> 60 | F141: =R[-100]C -> 1 | G141: =R[-100]C -> 17 | H141: =VLOOKUP(INT(MOD(RC[-6],1000)/100),Sheet1!R2C1:R8C2,2,FALSE)*RC[-5] -> 1560 | I141: =R[-100]C -> 0
A142: =R[-100]C+200 -> 1228 | B142: =R[-100]C+1000 -> 61302 | C142: =R[-100]C -> 3 | D142: =R[-100]C -> 1 | E142: =R[-100]C -> 60 | F142: =R[-100]C -> 1 | G142: =R[-100]C -> 17 | H142: =VLOOKUP(INT(MOD(RC[-6],1000)/100),Sheet1!R2C1:R8C2,2,FALSE)*RC[-5] -> 1560 | I142: =R[-100]C -> 0
A143: =R[-100]C+200 -> 1229 | B143: =R[-100]C+1000 -> 61401 | C143: =R[-100]C -> 3 | D143: =R[-100]C -> 1 | E143: =R[-100]C -> 70 | F143: =R[-100]C -> 1 | G143: =R[-100]C -> 17 | H143: =VLOOKUP(INT(MOD(RC[-6],1000)/100),Sheet1!R2C1:R8C2,2,FALSE)*RC[-5] -> 4065 | I143: =R[-100]C -> 1
A144: =R[-100]C+200 -> 1230 | B144: =R[-100]C+1000 -> 61402 | C144: =R[-100]C -> 3 | D144: =R[-100]C -> 1 | E144: =R[-100]C -> 70 | F144: =R[-100]C -> 1 | G144: =R[-100]C -> 17 | H144: =VLOOKUP(INT(MOD(RC[-6],1000)/100),Sheet1!R2C1:R8C2,2,FALSE)*RC[-5] -> 4065 | I144: =R[-100]C -> 1
A145: =R[-100]C+200 -> 1231 | B145: =R[-100]C+1000 -> 61001 | C145: =R[-100]C -> 4 | D145: =R[-100]C -> 1 | E145: =R[-100]C -> 1 | F145: =R[-100]C -> 1 | G145: =R[-100]C -> 17 | H145: =VLOOKUP(INT(MOD(RC[-6],1000)/100),Sheet1!R2C1:R8C2,2,FALSE)*RC[-5] -> 20 | I145: =R[-100]C -> 0
A146: =R[-100]C+200 -> 1232 | B146: =R[-100]C+1000 -> 61002 | C146: =R[-100]C -> 4 | D146: =R[-100]C -> 1 | E146: =R[-100]C -> 1 | F146: =R[-100]C -> 1 | G146: =R[-100]C -> 17 | H146: =VLOOKUP(INT(MOD(RC[-6],1000)/100),Sheet1!R2C1:R8C2,2,FALSE)*RC[-5] -> 20 | I146: =R[-100]C -> 0
A147: =R[-100]C+200 -> 1233 | B147: =R[-100]C+1000 -> 61101 | C147: =R[-100]C -> 4 | D147: =R[-100]C -> 1 | E147: =R[-100]C -> 1 | F147: =R[-100]C -> 1 | G147: =R[-100]C -> 17 | H147: =VLOOKUP(INT(MOD(RC[-6],1000)/100),Sheet1!R2C1:R8C2,2,FALSE)*RC[-5] -> 80 | I147: =R[-100]C -> 0
A148: =R[-100]C+200 -> 1234 | B148: =R[-100]C+1000 -> 61102 | C148: =R[-100]C -> 4 | D148: =R[-100]C -> 1 | E148: =R[-100]C -> 1 | F148: =R[-100]C -> 1 | G148: =R[-100]C -> 17 | H148: =VLOOKUP(INT(MOD(RC[-6],1000)/100),Sheet1!R2C1:R8C2,2,FALSE)*RC[-5] -> 80 | I148: =R[-100]C -> 0
A149: =R[-100]C+200 -> 1235 | B149: =R[-100]C+1000 -> 61201 | C149: =R[-100]C -> 4 | D149: =R[-100]C -> 1 | E149: =R[-100]C -> 55 | F149: =R[-100]C -> 1 | G149: =R[-100]C -> 17 | H149: =VLOOKUP(INT(MOD(RC[-6],1000)/100),Sheet1!R2C1:R8C2,2,FALSE)*RC[-5] -> 420 | I149: =R[-100]C -> 0
A150: =R[-100]C+200 -> 1236 | B150: =R[-100]C+1000 -> 61202 | C150: =R[-100]C -> 4 | D150: =R[-100]C -> 1 | E150: =R[-100]C -> 55 | F150: =R[-100]C -> 1 | G150: =R[-100]C -> 17 | H150: =VLOOKUP(INT(MOD(RC[-6],1000)/100),Sheet1!R2C1:R8C2,2,FALSE)*RC[-5] -> 420 | I150: =R[-100]C -> 0
A151: =R[-100]C+200 -> 1237 | B151: =R[-100]C+1000 -> 61301 | C151: =R[-100]C -> 4 | D151: =R[-100]C -> 1 | E151: =R[-100]C -> 60 | F151: =R[-100]C -> 1 | G151: =R[-100]C -> 17 | H151: =VLOOKUP(INT(MOD(RC[-6],1000)/100),Sheet1!R2C1:R8C2,2,FALSE)*RC[-5] -> 2080 | I151: =R[-100]C -> 0
A152: =R[-100]C+200 -> 1238 | B152: =R[-100]C+1000 -> 61302 | C152: =R[-100]C -> 4 | D152: =R[-100]C -> 1 | E152: =R[-100]C -> 60 | F152: =R[-100]C -> 1 | G152: =R[-100]C -> 17 | H152: =VLOOKUP(INT(MOD(RC[-6],1000)/100),Sheet1!R2C1:R8C2,2,FALSE)*RC[-5] -> 2080 | I152: =R[-100]C -> 0
A153: =R[-100]C+200 -> 1239 | B153: =R[-100]C+1000 -> 61401 | C153: =R[-100]C -> 4 | D153: =R[-100]C -> 1 | E153: =R[-100]C -> 70 | F153: =R[-100]C -> 1 | G153: =R[-100]C -> 17 | H153: =VLOOKUP(INT(MOD(RC[-6],1000)/100),Sheet1!R2C1:R8C2,2,FALSE)*RC[-5] -> 5420 | I153: =R[-100]C -> 1
A154: =R[-100]C+200 -> 1240 | B154: =R[-100]C+1000 -> 61402 | C154: =R[-100]C -> 4 | D154: =R[-100]C -> 1 | E154: =R[-100]C -> 70 | F154: =R[-100]C -> 1 | G154: =R[-100]C -> 17 | H154: =VLOOKUP(INT(MOD(RC[-6],1000)/100),Sheet1!R2C1:R8C2,2,FALSE)*RC[-5] -> 5420 | I154: =R[-100]C -> 1
A155: =R[-100]C+200 -> 1241 | B155: =R[-100]C+1000 -> 61001 | C155: =R[-100]C -> 5 | D155: =R[-100]C -> 1 | E155: =R[-100]C -> 1 | F155: =R[-100]C -> 1 | G155: =R[-100]C -> 17 | H155: =VLOOKUP(INT(MOD(RC[-6],1000)/100),Sheet1!R2C1:R8C2,2,FALSE)*RC[-5] -> 25 | I155: =R[-100]C -> 0
A156: =R[-100]C+200 -> 1242 | B156: =R[-100]C+1000 -> 61002 | C156: =R[-100]C -> 5 | D156: =R[-100]C -> 1 | E156: =R[-100]C -> 1 | F156: =R[-100]C -> 1 | G156: =R[-100]C -> 17 | H156: =VLOOKUP(INT(MOD(RC[-6],1000)/100),Sheet1!R2C1:R8C2,2,FALSE)*RC[-5] -> 25 | I156: =R[-100]C -> 0
A157: =R[-100]C+200 -> 1243 | B157: =R[-100]C+1000 -> 61101 | C157: =R[-100]C -> 5 | D157: =R[-100]C -> 1 | E157: =R[-100]C -> 1 | F157: =R[-100]C -> 1 | G157: =R[-100]C -> 17 | H157: =VLOOKUP(INT(MOD(RC[-6],1000)/100),Sheet1!R2C1:R8C2,2,FALSE)*RC[-5] -> 100 | I157: =R[-100]C -> 0
A158: =R[-100]C+200 -> 1244 | B158: =R[-100]C+1000 -> 61102 | C158: =R[-100]C -> 5 | D158: =R[-100]C -> 1 | E158: =R[-100]C -> 1 | F158: =R[-100]C -> 1 | G158: =R[-100]C -> 17 | H158: =VLOOKUP(INT(MOD(RC[-6],1000)/100),Sheet1!R2C1:R8C2,2,FALSE)*RC[-5] -> 100 | I158: =R[-100]C -> 0
A159: =R[-100]C+200 -> 1245 | B159: =R[-100]C+1000 -> 61201 | C159: =R[-100]C -> 5 | D159: =R[-100]C -> 1 | E159: =R[-100]C -> 55 | F159: =R[-100]C -> 1 | G159: =R[-100]C -> 17 | H159: =VLOOKUP(INT(MOD(RC[-6],1000)/100),Sheet1!R2C1:R8C2,2,FALSE)*RC[-5] -> 525 | I159: =R[-100]C -> 0
A160: =R[-100]C+200 -> 1246 | B160: =R[-100]C+1000 -> 61202 | C160: =R[-100]C -> 5 | D160: =R[-100]C -> 1 | E160: =R[-100]C -> 55 | F160: =R[-100]C -> 1 | G160: =R[-100]C -> 17 | H160: =VLOOKUP(INT(MOD(RC[-6],1000)/100),Sheet1!R2C1:R8C2,2,FALSE)*RC[-5] -> 525 | I160: =R[-100]C -> 0
A161: =R[-100]C+200 -> 1247 | B161: =R[-100]C+1000 -> 61301 | C161: =R[-100]C -> 5 | D161: =R[-100]C -> 1 | E161: =R[-100]C -> 60 | F161: =R[-100]C -> 1 | G161: =R[-100]C -> 17 | H161: =VLOOKUP(INT(MOD(RC[-6],1000)/100),Sheet1!R2C1:R8C2,2,FALSE)*RC[-5] -> 2600 | I161: =R[-100]C -> 0
A162: =R[-100]C+200 -> 1248 | B162: =R[-100]C+1000 -> 61302 | C162: =R[-100]C -> 5 | D162: =R[-100]C -> 1 | E162: =R[-100]C -> 60 | F162: =R[-100]C -> 1 | G162: =R[-100]C -> 17 | H162: =VLOOKUP(INT(MOD(RC[-6],1000)/100),Sheet1!R2C1:R8C2,2,FALSE)*RC[-5] -> 2600 | I162: =R[-100]C -> 0
A163: =R[-100]C+200 -> 1249 | B163: =R[-100]C+1000 -> 61401 | C163: =R[-100]C -> 5 | D163: =R[-100]C -> 1 | E163: =R[-100]C -> 70 | F163: =R[-100]C -> 1 | G163: =R[-100]C -> 17 | H163: =VLOOKUP(INT(MOD(RC[-6],1000)/100),Sheet1!R2C1:R8C2,2,FALSE)*RC[-5] -> 6775 | I163: =R[-100]C -> 1
A164: =R[-100]C+200 -> 1250 | B164: =R[-100]C+1000 -> 61402 | C164: =R[-100]C -> 5 | D164: =R[-100]C -> 1 | E164: =R[-100]C -> 70 | F164: =R[-100]C -> 1 | G164: =R[-100]C -> 17 | H164: =VLOOKUP(INT(MOD(RC[-6],1000)/100),Sheet1!R2C1:R8C2,2,FALSE)*RC[-5] -> 6775 | I164: =R[-100]C -> 1
A165: =R[-100]C+200 -> 1251 | B165: =R[-100]C+1000 -> 61001 | C165: =R[-100]C -> 1 | D165: =R[-100]C -> 1 | E165: =R[-100]C -> 1 | F165: =R[-100]C -> 1 | G165: =R[-100]C -> 5 | H165: =VLOOKUP(INT(MOD(RC[-6],1000)/100),Sheet1!R2C1:R8C2,2,FALSE)*RC[-5] -> 5 | I165: =R[-100]C -> 0
A166: =R[-100]C+200 -> 1252 | B166: =R[-100]C+1000 -> 61002 | C166: =R[-100]C -> 1 | D166: =R[-100]C -> 1 | E166: =R[-100]C -> 1 | F166: =R[-100]C -> 1 | G166: =R[-100]C -> 5 | H166: =VLOOKUP(INT(MOD(RC[-6],1000)/100),Sheet1!R2C1:R8C2,2,FALSE)*RC[-5] -> 5 | I166: =R[-100]C -> 0
A167: =R[-100]C+200 -> 1253 | B167: =R[-100]C+1000 -> 61101 | C167: =R[-100]C -> 1 | D167: =R[-100]C -> 1 | E167: =R[-100]C -> 1 | F167: =R[-100]C -> 1 | G167: =R[-100]C -> 5 | H167: =VLOOKUP(INT(MOD(RC[-6],1000)/100),Sheet1!R2C1:R8C2,2,FALSE)*RC[-5] -> 20 | I167: =R[-100]C -> 0
A168: =R[-100]C+200 -> 1254 | B168: =R[-100]C+1000 -> 61102 | C168: =R[-100]C -> 1 | D168: =R[-100]C -> 1 | E168: =R[-100]C -> 1 | F168: =R[-100]C -> 1 | G168: =R[-100]C -> 5 | H168: =VLOOKUP(INT(MOD(RC[-6],1000)/100),Sheet1!R2C1:R8C2,2,FALSE)*RC[-5] -> 20 | I168: =R[-100]C -> 0
A169: =R[-100]C+200 -> 1255 | B169: =R[-100]C+1000 -> 61201 | C169: =R[-100]C -> 1 | D169: =R[-100]C -> 1 | E169: =R[-100]C -> 55 | F169: =R[-100]C -> 1 | G169: =R[-100]C -> 5 | H169: =VLOOKUP(INT(MOD(RC[-6],1000)/100),Sheet1!R2C1:R8C2,2,FALSE)*RC[-5] -> 105 | I169: =R[-100]C -> 0
A170: =R[-100]C+200 -> 1256 | B170: =R[-100]C+1000 -> 61202 | C170: =R[-100]C -> 1 | D170: =R[-100]C -> 1 | E170: =R[-100]C -> 55 | F170: =R[-100]C -> 1 | G170: =R[-100]C -> 5 | H170: =VLOOKUP(INT(MOD(RC[-6],1000)/100),Sheet1!R2C1:R8C2,2,FALSE)*RC[-5] -> 105 | I170: =R[-100]C -> 0
A171: =R[-100]C+200 -> 1257 | B171: =R[-100]C+1000 -> 61301 | C171: =R[-100]C -> 1 | D171: =R[-100]C -> 1 | E171: =R[-100]C -> 60 | F171: =R[-100]C -> 1 | G171: =R[-100]C -> 5 | H171: =VLOOKUP(INT(MOD(RC[-6],1000)/100),Sheet1!R2C1:R8C2,2,FALSE)*RC[-5] -> 520 | I171: =R[-100]C -> 0
A172: =R[-100]C+200 -> 1258 | B172: =R[-100]C+1000 -> 61302 | C172: =R[-100]C -> 1 | D172: =R[-100]C -> 1 | E172: =R[-100]C -> 60 | F172: =R[-100]C -> 1 | G172: =R[-100]C -> 5 | H172: =VLOOKUP(INT(MOD(RC[-6],1000)/100),Sheet1!R2C1:R8C2,2,FALSE)*RC[-5] -> 520 | I172: =R[-100]C -> 0
A173: =R[-100]C+200 -> 1259 | B173: =R[-100]C+1000 -> 61401 | C173: =R[-100]C -> 1 | D173: =R[-100]C -> 1 | E173: =R[-100]C -> 70 | F173: =R[-100]C -> 1 | G173: =R[-100]C -> 5 | H173: =VLOOKUP(INT(MOD(RC[-6],1000)/100),Sheet1!R2C1:R8C2,2,FALSE)*RC[-5] -> 1355 | I173: =R[-100]C -> 1
A174: =R[-100]C+200 -> 1260 | B174: =R[-100]C+1000 -> 61402 | C174: =R[-100]C -> 1 | D174: =R[-100]C -> 1 | E174: =R[-100]C -> 70 | F174: =R[-100]C -> 1 | G174: =R[-100]C -> 5 | H174: =VLOOKUP(INT(MOD(RC[-6],1000)/100),Sheet1!R2C1:R8C2,2,FALSE)*RC[-5] -> 1355 | I174: =R[-100]C -> 1
A175: =R[-100]C+200 -> 1261 | B175: =R[-100]C+1000 -> 61001 | C175: =R[-100]C -> 2 | D175: =R[-100]C -> 1 | E175: =R[-100]C -> 1 | F175: =R[-100]C -> 1 | G175: =R[-100]C -> 5 | H175: =VLOOKUP(INT(MOD(RC[-6],1000)/100),Sheet1!R2C1:R8C2,2,FALSE)*RC[-5] -> 10 | I175: =R[-100]C -> 0
A176: =R[-100]C+200 -> 1262 | B176: =R[-100]C+1000 -> 61002 | C176: =R[-100]C -> 2 | D176: =R[-100]C -> 1 | E176: =R[-100]C -> 1 | F176: =R[-100]C -> 1 | G176: =R[-100]C -> 5 | H176: =VLOOKUP(INT(MOD(RC[-6],1000)/100),Sheet1!R2C1:R8C2,2,FALSE)*RC[-5] -> 10 | I176: =R[-100]C -> 0
A177: =R[-100]C+200 -> 1263 | B177: =R[-100]C+1000 -> 61101 | C177: =R[-100]C -> 2 | D177: =R[-100]C -> 1 | E177: =R[-100]C -> 1 | F177: =R[-100]C -> 1 | G177: =R[-100]C -> 5 | H177: =VLOOKUP(INT(MOD(RC[-6],1000)/100),Sheet1!R2C1:R8C2,2,FALSE)*RC[-5] -> 40 | I177: =R[-100]C -> 0
A178: =R[-100]C+200 -> 1264 | B178: =R[-100]C+1000 -> 61102 | C178: =R[-100]C -> 2 | D178: =R[-100]C -> 1 | E178: =R[-100]C -> 1 | F178: =R[-100]C -> 1 | G178: =R[-100]C -> 5 | H178: =VLOOKUP(INT(MOD(RC[-6],1000)/100),Sheet1!R2C1:R8C2,2,FALSE)*RC[-5] -> 40 | I178: =R[-100]C -> 0
A179: =R[-100]C+200 -> 1265 | B179: =R[-100]C+1000 -> 61201 | C179: =R[-100]C -> 2 | D179: =R[-100]C -> 1 | E179: =R[-100]C -> 55 | F179: =R[-100]C -> 1 | G179: =R[-100]C -> 5 | H179: =VLOOKUP(INT(MOD(RC[-6],1000)/100),Sheet1!R2C1:R8C2,2,FALSE)*RC[-5] -> 210 | I179: =R[-100]C -> 0
A180: =R[-100]C+200 -> 1266 | B180: =R[-100]C+1000 -> 61202 | C180: =R[-100]C -> 2 | D180: =R[-100]C -> 1 | E180: =R[-100]C -> 55 | F180: =R[-100]C -> 1 | G180: =R[-100]C -> 5 | H180: =VLOOKUP(INT(MOD(RC[-6],1000)/100),Sheet1!R2C1:R8C2,2,FALSE)*RC[-5] -> 210 | I180: =R[-100]C -> 0
A181: =R[-100]C+200 -> 1267 | B181: =R[-100]C+1000 -> 61301 | C181: =R[-100]C -> 2 | D181: =R[-100]C -> 1 | E181: =R[-100]C -> 60 | F181: =R[-100]C -> 1 | G181: =R[-100]C -> 5 | H181: =VLOOKUP(INT(MOD(RC[-6],1000)/100),Sheet1!R2C1:R8C2,2,FALSE)*RC[-5] -> 1040 | I181: =R[-100]C -> 0
A182: =R[-100]C+200 -> 1268 | B182: =R[-100]C+1000 -> 61302 | C182: =R[-100]C -> 2 | D182: =R[-100]C -> 1 | E182: =R[-100]C -> 60 | F182: =R[-100]C -> 1 | G182: =R[-100]C -> 5 | H182: =VLOOKUP(INT(MOD(RC[-6],1000)/100),Sheet1!R2C1:R8C2,2,FALSE)*RC[-5] -> 1040 | I182: =R[-100]C -> 0
A183: =R[-100]C+200 -> 1269 | B183: =R[-100]C+1000 -> 61401 | C183: =R[-100]C -> 2 | D183: =R[-100]C -> 1 | E183: =R[-100]C -> 70 | F183: =R[-100]C -> 1 | G183: =R[-100]C -> 5 | H183: =VLOOKUP(INT(MOD(RC[-6],1000)/100),Sheet1!R2C1:R8C2,2,FALSE)*RC[-5] -> 2710 | I183: =R[-100]C -> 1
A184: =R[-100]C+200 -> 1270 | B184: =R[-100]C+1000 -> 61402 | C184: =R[-100]C -> 2 | D184: =R[-100]C -> 1 | E184: =R[-100]C -> 70 | F184: =R[-100]C -> 1 | G184: =R[-100]C -> 5 | H184: =VLOOKUP(INT(MOD(RC[-6],1000)/100),Sheet1!R2C1:R8C2,2,FALSE)*RC[-5] -> 2710 | I184: =R[-100]C -> 1
A185: =R[-100]C+200 -> 1271 | B185: =R[-100]C+1000 -> 61001 | C185: =R[-100]C -> 3 | D185: =R[-100]C -> 1 | E185: =R[-100]C -> 1 | F185: =R[-100]C -> 1 | G185: =R[-100]C -> 5 | H185: =VLOOKUP(INT(MOD(RC[-6],1000)/100),Sheet1!R2C1:R8C2,2,FALSE)*RC[-5] -> 15 | I185: =R[-100]C -> 0
A186: =R[-100]C+200 -> 1272 | B186: =R[-100]C+1000 -> 61002 | C186: =R[-100]C -> 3 | D186: =R[-100]C -> 1 | E186: =R[-100]C -> 1 | F186: =R[-100]C -> 1 | G186: =R[-100]C -> 5 | H186: =VLOOKUP(INT(MOD(RC[-6],1000)/100),Sheet1!R2C1:R8C2,2,FALSE)*RC[-5] -> 15 | I186: =R[-100]C -> 0
A187: =R[-100]C+200 -> 1273 | B187: =R[-100]C+1000 -> 61101 | C187: =R[-100]C -> 3 | D187: =R[-100]C -> 1 | E187: =R[-100]C -> 1 | F187: =R[-100]C -> 1 | G187: =R[-100]C -> 5 | H187: =VLOOKUP(INT(MOD(RC[-6],1000)/100),Sheet1!R2C1:R8C2,2,FALSE)*RC[-5] -> 60 | I187: =R[-100]C -> 0
A188: =R[-100]C+200 -> 1274 | B188: =R[-100]C+1000 -> 61102 | C188: =R[-100]C -> 3 | D188: =R[-100]C -> 1 | E188: =R[-100]C -> 1 | F188: =R[-100]C -> 1 | G188: =R[-100]C -> 5 | H188: =VLOOKUP(INT(MOD(RC[-6],1000)/100),Sheet1!R2C1:R8C2,2,FALSE)*RC[-5] -> 60 | I188: =R[-100]C -> 0
A189: =R[-100]C+200 -> 1275 | B189: =R[-100]C+1000 -> 61201 | C189: =R[-100]C -> 3 | D189: =R[-100]C -> 1 | E189: =R[-100]C -> 55 | F189: =R[-100]C -> 1 | G189: =R[-100]C -> 5 | H189: =VLOOKUP(INT(MOD(RC[-6],1000)/100),Sheet1!R2C1:R8C2,2,FALSE)*RC[-5] -> 315 | I189: =R[-100]C -> 0
A190: =R[-100]C+200 -> 1276 | B190: =R[-100]C+1000 -> 61202 | C190: =R[-100]C -> 3 | D190: =R[-100]C -> 1 | E190: =R[-100]C -> 55 | F190: =R[-100]C -> 1 | G190: =R[-100]C -> 5 | H190: =VLOOKUP(INT(MOD(RC[-6],1000)/100),Sheet1!R2C1:R8C2,2,FALSE)*RC[-5] -> 315 | I190: =R[-100]C -> 0
A191: =R[-100]C+200 -> 1277 | B191: =R[-100]C+1000 -> 61301 | C191: =R[-100]C -> 3 | D191: =R[-100]C -> 1 | E191: =R[-100]C -> 60 | F191: =R[-100]C -> 1 | G191: =R[-100]C -> 5 | H191: =VLOOKUP(INT(MOD(RC[-6],1000)/100),Sheet1!R2C1:R8C2,2,FALSE)*RC[-5] -> 1560 | I191: =R[-100]C -> 0
A192: =R[-100]C+200 -> 1278 | B192: =R[-100]C+1000 -> 61302 | C192: =R[-100]C -> 3 | D192: =R[-100]C -> 1 | E192: =R[-100]C -> 60 | F192: =R[-100]C -> 1 | G192: =R[-100]C -> 5 | H192: =VLOOKUP(INT(MOD(RC[-6],1000)/100),Sheet1!R2C1:R8C2,2,FALSE)*RC[-5] -> 1560 | I192: =R[-100]C -> 0
A193: =R[-100]C+200 -> 1279 | B193: =R[-100]C+1000 -> 61401 | C193: =R[-100]C -> 3 | D193: =R[-100]C -> 1 | E193: =R[-100]C -> 70 | F193: =R[-100]C -> 1 | G193: =R[-100]C -> 5 | H193: =VLOOKUP(INT(MOD(RC[-6],1000)/100),Sheet1!R2C1:R8C2,2,FALSE)*RC[-5] -> 4065 | I193: =R[-100]C -> 1
A194: =R[-100]C+200 -> 1280 | B194: =R[-100]C+1000 -> 61402 | C194: =R[-100]C -> 3 | D194: =R[-100]C -> 1 | E194: =R[-100]C -> 70 | F194: =R[-100]C -> 1 | G194: =R[-100]C -> 5 | H194: =VLOOKUP(INT(MOD(RC[-6],1000)/100),Sheet1!R2C1:R8C2,2,FALSE)*RC[-5] -> 4065 | I194: =R[-100]C -> 1
A195: =R[-100]C+200 -> 1281 | B195: =R[-100]C+1000 -> 61001 | C195: =R[-100]C -> 4 | D195: =R[-100]C -> 1 | E195: =R[-100]C -> 1 | F195: =R[-100]C -> 1 | G195: =R[-100]C -> 5 | H195: =VLOOKUP(INT(MOD(RC[-6],1000)/100),Sheet1!R2C1:R8C2,2,FALSE)*RC[-5] -> 20 | I195: =R[-100]C -> 0
A196: =R[-100]C+200 -> 1282 | B196: =R[-100]C+1000 -> 61002 | C196: =R[-100]C -> 4 | D196: =R[-100]C -> 1 | E196: =R[-100]C -> 1 | F196: =R[-100]C -> 1 | G196: =R[-100]C -> 5 | H196: =VLOOKUP(INT(MOD(RC[-6],1000)/100),Sheet1!R2C1:R8C2,2,FALSE)*RC[-5] -> 20 | I196: =R[-100]C -> 0
A197: =R[-100]C+200 -> 1283 | B197: =R[-100]C+1000 -> 61101 | C197: =R[-100]C -> 4 | D197: =R[-100]C -> 1 | E197: =R[-100]C -> 1 | F197: =R[-100]C -> 1 | G197: =R[-100]C -> 5 | H197: =VLOOKUP(INT(MOD(RC[-6],1000)/100),Sheet1!R2C1:R8C2,2,FALSE)*RC[-5] -> 80 | I197: =R[-100]C -> 0
A198: =R[-100]C+200 -> 1284 | B198: =R[-100]C+1000 -> 61102 | C198: =R[-100]C -> 4 | D198: =R[-100]C -> 1 | E198: =R[-100]C -> 1 | F198: =R[-100]C -> 1 | G198: =R[-100]C -> 5 | H198: =VLOOKUP(INT(MOD(RC[-6],1000)/100),Sheet1!R2C1:R8C2,2,FALSE)*RC[-5] -> 80 | I198: =R[-100]C -> 0
A199: =R[-100]C+200 -> 1285 | B199: =R[-100]C+1000 -> 61201 | C199: =R[-100]C -> 4 | D199: =R[-100]C -> 1 | E199: =R[-100]C -> 55 | F199: =R[-100]C -> 1 | G199: =R[-100]C -> 5 | H199: =VLOOKUP(INT(MOD(RC[-6],1000)/100),Sheet1!R2C1:R8C2,2,FALSE)*RC[-5] -> 420 | I199: =R[-100]C -> 0
A200: =R[-100]C+200 -> 1286 | B200: =R[-100]C+1000 -> 61202 | C200: =R[-100]C -> 4 | D200: =R[-100]C -> 1 | E200: =R[-100]C -> 55 | F200: =R[-100]C -> 1 | G200: =R[-100]C -> 5 | H200: =VLOOKUP(INT(MOD(RC[-6],1000)/100),Sheet1!R2C1:R8C2,2,FALSE)*RC[-5] -> 420 | I200: =R[-100]C -> 0
A201: =R[-100]C+200 -> 1287 | B201: =R[-100]C+1000 -> 61301 | C201: =R[-100]C -> 4 | D201: =R[-100]C -> 1 | E201: =R[-100]C -> 60 | F201: =R[-100]C -> 1 | G201: =R[-100]C -> 5 | H201: =VLOOKUP(INT(MOD(RC[-6],1000)/100),Sheet1!R2C1:R8C2,2,FALSE)*RC[-5] -> 2080 | I201: =R[-100]C -> 0
A202: =R[-100]C+200 -> 1288 | B202: =R[-100]C+1000 -> 61302 | C202: =R[-100]C -> 4 | D202: =R[-100]C -> 1 | E202: =R[-100]C -> 60 | F202: =R[-100]C -> 1 | G202: =R[-100]C -> 5 | H202: =VLOOKUP(INT(MOD(RC[-6],1000)/100),Sheet1!R2C1:R8C2,2,FALSE)*RC[-5] -> 2080 | I202: =R[-100]C -> 0
A203: =R[-100]C+200 -> 1289 | B203: =R[-100]C+1000 -> 61401 | C203: =R[-100]C -> 4 | D203: =R[-100]C -> 1 | E203: =R[-100]C -> 70 | F203: =R[-100]C -> 1 | G203: =R[-100]C -> 5 | H203: =VLOOKUP(INT(MOD(RC[-6],1000)/100),Sheet1!R2C1:R8C2,2,FALSE)*RC[-5] -> 5420 | I203: =R[-100]C -> 1
A204: =R[-100]C+200 -> 1290 | B204: =R[-100]C+1000 -> 61402 | C204: =R[-100]C -> 4 | D204: =R[-100]C -> 1 | E204: =R[-100]C -> 70 | F204: =R[-100]C -> 1 | G204: =R[-100]C -> 5 | H204: =VLOOKUP(INT(MOD(RC[-6],1000)/100),Sheet1!R2C1:R8C2,2,FALSE)*RC[-5] -> 5420 | I204: =R[-100]C -> 1
A205: =R[-100]C+200 -> 1291 | B205: =R[-100]C+1000 -> 61001 | C205: =R[-100]C -> 5 | D205: =R[-100]C -> 1 | E205: =R[-100]C -> 1 | F205: =R[-100]C -> 1 | G205: =R[-100]C -> 5 | H205: =VLOOKUP(INT(MOD(RC[-6],1000)/100),Sheet1!R2C1:R8C2,2,FALSE)*RC[-5] -> 25 | I205: =R[-100]C -> 0
A206: =R[-100]C+200 -> 1292 | B206: =R[-100]C+1000 -> 61002 | C206: =R[-100]C -> 5 | D206: =R[-100]C -> 1 | E206: =R[-100]C -> 1 | F206: =R[-100]C -> 1 | G206: =R[-100]C -> 5 | H206: =VLOOKUP(INT(MOD(RC[-6],1000)/100),Sheet1!R2C1:R8C2,2,FALSE)*RC[-5] -> 25 | I206: =R[-100]C -> 0
A207: =R[-100]C+200 -> 1293 | B207: =R[-100]C+1000 -> 61101 | C207: =R[-100]C -> 5 | D207: =R[-100]C -> 1 | E207: =R[-100]C -> 1 | F207: =R[-100]C -> 1 | G207: =R[-100]C -> 5 | H207: =VLOOKUP(INT(MOD(RC[-6],1000)/100),Sheet1!R2C1:R8C2,2,FALSE)*RC[-5] -> 100 | I207: =R[-100]C -> 0
A208: =R[-100]C+200 -> 1294 | B208: =R[-100]C+1000 -> 61102 | C208: =R[-100]C -> 5 | D208: =R[-100]C -> 1 | E208: =R[-100]C -> 1 | F208: =R[-100]C -> 1 | G208: =R[-100]C -> 5 | H208: =VLOOKUP(INT(MOD(RC[-6],1000)/100),Sheet1!R2C1:R8C2,2,FALSE)*RC[-5] -> 100 | I208: =R[-100]C -> 0
A209: =R[-100]C+200 -> 1295 | B209: =R[-100]C+1000 -> 61201 | C209: =R[-100]C -> 5 | D209: =R[-100]C -> 1 | E209: =R[-100]C -> 55 | F209: =R[-100]C -> 1 | G209: =R[-100]C -> 5 | H209: =VLOOKUP(INT(MOD(RC[-6],1000)/100),Sheet1!R2C1:R8C2,2,FALSE)*RC[-5] -> 525 | I209: =R[-100]C -> 0
A210: =R[-100]C+200 -> 1296 | B210: =R[-100]C+1000 -> 61202 | C210: =R[-100]C -> 5 | D210: =R[-100]C -> 1 | E210: =R[-100]C -> 55 | F210: =R[-100]C -> 1 | G210: =R[-100]C -> 5 | H210: =VLOOKUP(INT(MOD(RC[-6],1000)/100),Sheet1!R2C1:R8C2,2,FALSE)*RC[-5] -> 525 | I210: =R[-100]C -> 0
A211: =R[-100]C+200 -> 1297 | B211: =R[-100]C+1000 -> 61301 | C211: =R[-100]C -> 5 | D211: =R[-100]C -> 1 | E211: =R[-100]C -> 60 | F211: =R[-100]C -> 1 | G211: =R[-100]C -> 5 | H211: =VLOOKUP(INT(MOD(RC[-6],1000)/100),Sheet1!R2C1:R8C2,2,FALSE)*RC[-5] -> 2600 | I211: =R[-100]C -> 0
A212: =R[-100]C+200 -> 1298 | B212: =R[-100]C+1000 -> 61302 | C212: =R[-100]C -> 5 | D212: =R[-100]C -> 1 | E212: =R[-100]C -> 60 | F212: =R[-100]C -> 1 | G212: =R[-100]C -> 5 | H212: =VLOOKUP(INT(MOD(RC[-6],1000)/100),Sheet1!R2C1:R8C2,2,FALSE)*RC[-5] -> 2600 | I212: =R[-100]C -> 0
A213: =R[-100]C+200 -> 1299 | B213: =R[-100]C+1000 -> 61401 | C213: =R[-100]C -> 5 | D213: =R[-100]C -> 1 | E213: =R[-100]C -> 70 | F213: =R[-100]C -> 1 | G213: =R[-100]C -> 5 | H213: =VLOOKUP(INT(MOD(RC[-6],1000)/100),Sheet1!R2C1:R8C2,2,FALSE)*RC[-5] -> 6775 | I213: =R[-100]C -> 1
A214: =R[-100]C+200 -> 1300 | B214: =R[-100]C+1000 -> 61402 | C214: =R[-100]C -> 5 | D214: =R[-100]C -> 1 | E214: =R[-100]C -> 70 | F214: =R[-100]C -> 1 | G214: =R[-100]C -> 5 | H214: =VLOOKUP(INT(MOD(RC[-6],1000)/100),Sheet1!R2C1:R8C2,2,FALSE)*RC[-5] -> 6775 | I214: =R[-100]C -> 1
A215: =R[-100]C+200 -> 1401 | B215: =R[-100]C+1000 -> 62001 | C215: =R[-100]C -> 1 | D215: =R[-100]C -> 1 | E215: =R[-100]C -> 1 | F215: =R[-100]C -> 1 | G215: =R[-100]C -> 17 | H215: =VLOOKUP(INT(MOD(RC[-6],1000)/100),Sheet1!R2C1:R8C2,2,FALSE)*RC[-5] -> 5 | I215: =R[-100]C -> 0
A216: =R[-100]C+200 -> 1402 | B216: =R[-100]C+1000 -> 62002 | C216: =R[-100]C -> 1 | D216: =R[-100]C -> 1 | E216: =R[-100]C -> 1 | F216: =R[-100]C -> 1 | G216: =R[-100]C -> 17 | H216: =VLOOKUP(INT(MOD(RC[-6],1000)/100),Sheet1!R2C1:R8C2,2,FALSE)*RC[-5] -> 5 | I216: =R[-100]C -> 0
A217: =R[-100]C+200 -> 1403 | B217: =R[-100]C+1000 -> 62101 | C217: =R[-100]C -> 1 | D217: =R[-100]C -> 1 | E217: =R[-100]C -> 1 | F217: =R[-100]C -> 1 | G217: =R[-100]C -> 17 | H217: =VLOOKUP(INT(MOD(RC[-6],1000)/100),Sheet1!R2C1:R8C2,2,FALSE)*RC[-5] -> 20 | I217: =R[-100]C -> 0
A218: =R[-100]C+200 -> 1404 | B218: =R[-100]C+1000 -> 62102 | C218: =R[-100]C -> 1 | D218: =R[-100]C -> 1 | E218: =R[-100]C -> 1 | F218: =R[-100]C -> 1 | G218: =R[-100]C -> 17 | H218: =VLOOKUP(INT(MOD(RC[-6],1000)/100),Sheet1!R2C1:R8C2,2,FALSE)*RC[-5] -> 20 | I218: =R[-100]C -> 0
A219: =R[-100]C+200 -> 1405 | B219: =R[-100]C+1000 -> 62201 | C219: =R[-100]C -> 1 | D219: =R[-100]C -> 1 | E219: =R[-100]C -> 55 | F219: =R[-100]C -> 1 | G219: =R[-100]C -> 17 | H219: =VLOOKUP(INT(MOD(RC[-6],1000)/100),Sheet1!R2C1:R8C2,2,FALSE)*RC[-5] -> 105 | I219: =R[-100]C -> 0
A220: =R[-100]C+200 -> 1406 | B220: =R[-100]C+1000 -> 62202 | C220: =R[-100]C -> 1 | D220: =R[-100]C -> 1 | E220: =R[-100]C -> 55 | F220: =R[-100]C -> 1 | G220: =R[-100]C -> 17 | H220: =VLOOKUP(INT(MOD(RC[-6],1000)/100),Sheet1!R2C1:R8C2,2,FALSE)*RC[-5] -> 105 | I220: =R[-100]C -> 0
A221: =R[-100]C+200 -> 1407 | B221: =R[-100]C+1000 -> 62301 | C221: =R[-100]C -> 1 | D221: =R[-100]C -> 1 | E221: =R[-100]C -> 60 | F221: =R[-100]C -> 1 | G221: =R[-100]C -> 17 | H221: =VLOOKUP(INT(MOD(RC[-6],1000)/100),Sheet1!R2C1:R8C2,2,FALSE)*RC[-5] -> 520 | I221: =R[-100]C -> 0
A222: =R[-100]C+200 -> 1408 | B222: =R[-100]C+1000 -> 62302 | C222: =R[-100]C -> 1 | D222: =R[-100]C -> 1 | E222: =R[-100]C -> 60 | F222: =R[-100]C -> 1 | G222: =R[-100]C -> 17 | H222: =VLOOKUP(INT(MOD(RC[-6],1000)/100),Sheet1!R2C1:R8C2,2,FALSE)*RC[-5] -> 520 | I222: =R[-100]C -> 0
A223: =R[-100]C+200 -> 1409 | B223: =R[-100]C+1000 -> 62401 | C223: =R[-100]C -> 1 | D223: =R[-100]C -> 1 | E223: =R[-100]C -> 70 | F223: =R[-100]C -> 1 | G223: =R[-100]C -> 17 | H223: =VLOOKUP(INT(MOD(RC[-6],1000)/100),Sheet1!R2C1:R8C2,2,FALSE)*RC[-5] -> 1355 | I223: =R[-100]C -> 1
A224: =R[-100]C+200 -> 1410 | B224: =R[-100]C+1000 -> 62402 | C224: =R[-100]C -> 1 | D224: =R[-100]C -> 1 | E224: =R[-100]C -> 70 | F224: =R[-100]C -> 1 | G224: =R[-100]C -> 17 | H224: =VLOOKUP(INT(MOD(RC[-6],1000)/100),Sheet1!R2C1:R8C2,2,FALSE)*RC[-5] -> 1355 | I224: =R[-100]C -> 1
A225: =R[-100]C+200 -> 1411 | B225: =R[-100]C+1000 -> 62001 | C225: =R[-100]C -> 2 | D225: =R[-100]C -> 1 | E225: =R[-100]C -> 1 | F225: =R[-100]C -> 1 | G225: =R[-100]C -> 17 | H225: =VLOOKUP(INT(MOD(RC[-6],1000)/100),Sheet1!R2C1:R8C2,2,FALSE)*RC[-5] -> 10 | I225: =R[-100]C -> 0
A226: =R[-100]C+200 -> 1412 | B226: =R[-100]C+1000 -> 62002 | C226: =R[-100]C -> 2 | D226: =R[-100]C -> 1 | E226: =R[-100]C -> 1 | F226: =R[-100]C -> 1 | G226: =R[-100]C -> 17 | H226: =VLOOKUP(INT(MOD(RC[-6],1000)/100),Sheet1!R2C1:R8C2,2,FALSE)*RC[-5] -> 10 | I226: =R[-100]C -> 0
A227: =R[-100]C+200 -> 1413 | B227: =R[-100]C+1000 -> 62101 | C227: =R[-100]C -> 2 | D227: =R[-100]C -> 1 | E227: =R[-100]C -> 1 | F227: =R[-100]C -> 1 | G227: =R[-100]C -> 17 | H227: =VLOOKUP(INT(MOD(RC[-6],1000)/100),Sheet1!R2C1:R8C2,2,FALSE)*RC[-5] -> 40 | I227: =R[-100]C -> 0
A228: =R[-100]C+200 -> 1414 | B228: =R[-100]C+1000 -> 62102 | C228: =R[-100]C -> 2 | D228: =R[-100]C -> 1 | E228: =R[-100]C -> 1 | F228: =R[-100]C -> 1 | G228: =R[-100]C -> 17 | H228: =VLOOKUP(INT(MOD(RC[-6],1000)/100),Sheet1!R2C1:R8C2,2,FALSE)*RC[-5] -> 40 | I228: =R[-100]C -> 0
A229: =R[-100]C+200 -> 1415 | B229: =R[-100]C+1000 -> 62201 | C229: =R[-100]C -> 2 | D229: =R[-100]C -> 1 | E229: =R[-100]C -> 55 | F229: =R[-100]C -> 1 | G229: =R[-100]C -> 17 | H229: =VLOOKUP(INT(MOD(RC[-6],1000)/100),Sheet1!R2C1:R8C2,2,FALSE)*RC[-5] -> 210 | I229: =R[-100]C -> 0
A230: =R[-100]C+200 -> 1416 | B230: =R[-100]C+1000 -> 62202 | C230: =R[-100]C -> 2 | D230: =R[-100]C -> 1 | E230: =R[-100]C -> 55 | F230: =R[-100]C -> 1 | G230: =R[-100]C -> 17 | H230: =VLOOKUP(INT(MOD(RC[-6],1000)/100),Sheet1!R2C1:R8C2,2,FALSE)*RC[-5] -> 210 | I230: =R[-100]C -> 0
A231: =R[-100]C+200 -> 1417 | B231: =R[-100]C+1000 -> 62301 | C231: =R[-100]C -> 2 | D231: =R[-100]C -> 1 | E231: =R[-100]C -> 60 | F231: =R[-100]C -> 1 | G231: =R[-100]C -> 17 | H231: =VLOOKUP(INT(MOD(RC[-6],1000)/100),Sheet1!R2C1:R8C2,2,FALSE)*RC[-5] -> 1040 | I231: =R[-100]C -> 0
A232: =R[-100]C+200 -> 1418 | B232: =R[-100]C+1000 -> 62302 | C232: =R[-100]C -> 2 | D232: =R[-100]C -> 1 | E232: =R[-100]C -> 60 | F232: =R[-100]C -> 1 | G232: =R[-100]C -> 17 | H232: =VLOOKUP(INT(MOD(RC[-6],1000)/100),Sheet1!R2C1:R8C2,2,FALSE)*RC[-5] -> 1040 | I232: =R[-100]C -> 0
A233: =R[-100]C+200 -> 1419 | B233: =R[-100]C+1000 -> 62401 | C233: =R[-100]C -> 2 | D233: =R[-100]C -> 1 | E233: =R[-100]C -> 70 | F233: =R[-100]C -> 1 | G233: =R[-100]C -> 17 | H233: =VLOOKUP(INT(MOD(RC[-6],1000)/100),Sheet1!R2C1:R8C2,2,FALSE)*RC[-5] -> 2710 | I233: =R[-100]C -> 1
A234: =R[-100]C+200 -> 1420 | B234: =R[-100]C+1000 -> 62402 | C234: =R[-100]C -> 2 | D234: =R[-100]C -> 1 | E234: =R[-100]C -> 70 | F234: =R[-100]C -> 1 | G234: =R[-100]C -> 17 | H234: =VLOOKUP(INT(MOD(RC[-6],1000)/100),Sheet1!R2C1:R8C2,2,FALSE)*RC[-5] -> 2710 | I234: =R[-100]C -> 1
A235: =R[-100]C+200 -> 1421 | B235: =R[-100]C+1000 -> 62001 | C235: =R[-100]C -> 3 | D235: =R[-100]C -> 1 | E235: =R[-100]C -> 1 | F235: =R[-100]C -> 1 | G235: =R[-100]C -> 17 | H235: =VLOOKUP(INT(MOD(RC[-6],1000)/100),Sheet1!R2C1:R8C2,2,FALSE)*RC[-5] -> 15 | I235: =R[-100]C -> 0
A236: =R[-100]C+200 -> 1422 | B236: =R[-100]C+1000 -> 62002 | C236: =R[-100]C -> 3 | D236: =R[-100]C -> 1 | E236: =R[-100]C -> 1 | F236: =R[-100]C -> 1 | G236: =R[-100]C -> 17 | H236: =VLOOKUP(INT(MOD(RC[-6],1000)/100),Sheet1!R2C1:R8C2,2,FALSE)*RC[-5] -> 15 | I236: =R[-100]C -> 0
A237: =R[-100]C+200 -> 1423 | B237: =R[-100]C+1000 -> 62101 | C237: =R[-100]C -> 3 | D237: =R[-100]C -> 1 | E237: =R[-100]C -> 1 | F237: =R[-100]C -> 1 | G237: =R[-100]C -> 17 | H237: =VLOOKUP(INT(MOD(RC[-6],1000)/100),Sheet1!R2C1:R8C2,2,FALSE)*RC[-5] -> 60 | I237: =R[-100]C -> 0
A238: =R[-100]C+200 -> 1424 | B238: =R[-100]C+1000 -> 62102 | C238: =R[-100]C -> 3 | D238: =R[-100]C -> 1 | E238: =R[-100]C -> 1 | F238: =R[-100]C -> 1 | G238: =R[-100]C -> 17 | H238: =VLOOKUP(INT(MOD(RC[-6],1000)/100),Sheet1!R2C1:R8C2,2,FALSE)*RC[-5] -> 60 | I238: =R[-100]C -> 0
A239: =R[-100]C+200 -> 1425 | B239: =R[-100]C+1000 -> 62201 | C239: =R[-100]C -> 3 | D239: =R[-100]C -> 1 | E239: =R[-100]C -> 55 | F239: =R[-100]C -> 1 | G239: =R[-100]C -> 17 | H239: =VLOOKUP(INT(MOD(RC[-6],1000)/100),Sheet1!R2C1:R8C2,2,FALSE)*RC[-5] -> 315 | I239: =R[-100]C -> 0
A240: =R[-100]C+200 -> 1426 | B240: =R[-100]C+1000 -> 62202 | C240: =R[-100]C -> 3 | D240: =R[-100]C -> 1 | E240: =R[-100]C -> 55 | F240: =R[-100]C -> 1 | G240: =R[-100]C -> 17 | H240: =VLOOKUP(INT(MOD(RC[-6],1000)/100),Sheet1!R2C1:R8C2,2,FALSE)*RC[-5] -> 315 | I240: =R[-100]C -> 0
A241: =R[-100]C+200 -> 1427 | B241: =R[-100]C+1000 -> 62301 | C241: =R[-100]C -> 3 | D241: =R[-100]C -> 1 | E241: =R[-100]C -> 60 | F241: =R[-100]C -> 1 | G241: =R[-100]C -> 17 | H241: =VLOOKUP(INT(MOD(RC[-6],1000)/100),Sheet1!R2C1:R8C2,2,FALSE)*RC[-5] -> 1560 | I241: =R[-100]C -> 0
A242: =R[-100]C+200 -> 1428 | B242: =R[-100]C+1000 -> 62302 | C242: =R[-100]C -> 3 | D242: =R[-100]C -> 1 | E242: =R[-100]C -> 60 | F242: =R[-100]C -> 1 | G242: =R[-100]C -> 17 | H242: =VLOOKUP(INT(MOD(RC[-6],1000)/100),Sheet1!R2C1:R8C2,2,FALSE)*RC[-5] -> 1560 | I242: =R[-100]C -> 0
A243: =R[-100]C+200 -> 1429 | B243: =R[-100]C+1000 -> 62401 | C243: =R[-100]C -> 3 | D243: =R[-100]C -> 1 | E243: =R[-100]C -> 70 | F243: =R[-100]C -> 1 | G243: =R[-100]C -> 17 | H243: =VLOOKUP(INT(MOD(RC[-6],1000)/100),Sheet1!R2C1:R8C2,2,FALSE)*RC[-5] -> 4065 | I243: =R[-100]C -> 1
A244: =R[-100]C+200 -> 1430 | B244: =R[-100]C+1000 -> 62402 | C244: =R[-100]C -> 3 | D244: =R[-100]C -> 1 | E244: =R[-100]C -> 70 | F244: =R[-100]C -> 1 | G244: =R[-100]C -> 17 | H244: =VLOOKUP(INT(MOD(RC[-6],1000)/100),Sheet1!R2C1:R8C2,2,FALSE)*RC[-5] -> 4065 | I244: =R[-100]C -> 1
A245: =R[-100]C+200 -> 1431 | B245: =R[-100]C+1000 -> 62001 | C245: =R[-100]C -> 4 | D245: =R[-100]C -> 1 | E245: =R[-100]C -> 1 | F245: =R[-100]C -> 1 | G245: =R[-100]C -> 17 | H245: =VLOOKUP(INT(MOD(RC[-6],1000)/100),Sheet1!R2C1:R8C2,2,FALSE)*RC[-5] -> 20 | I245: =R[-100]C -> 0
A246: =R[-100]C+200 -> 1432 | B246: =R[-100]C+1000 -> 62002 | C246: =R[-100]C -> 4 | D246: =R[-100]C -> 1 | E246: =R[-100]C -> 1 | F246: =R[-100]C -> 1 | G246: =R[-100]C -> 17 | H246: =VLOOKUP(INT(MOD(RC[-6],1000)/100),Sheet1!R2C1:R8C2,2,FALSE)*RC[-5] -> 20 | I246: =R[-100]C -> 0
A247: =R[-100]C+200 -> 1433 | B247: =R[-100]C+1000 -> 62101 | C247: =R[-100]C -> 4 | D247: =R[-100]C -> 1 | E247: =R[-100]C -> 1 | F247: =R[-100]C -> 1 | G247: =R[-100]C -> 17 | H247: =VLOOKUP(INT(MOD(RC[-6],1000)/100),Sheet1!R2C1:R8C2,2,FALSE)*RC[-5] -> 80 | I247: =R[-100]C -> 0
A248: =R[-100]C+200 -> 1434 | B248: =R[-100]C+1000 -> 62102 | C248: =R[-100]C -> 4 | D248: =R[-100]C -> 1 | E248: =R[-100]C -> 1 | F248: =R[-100]C -> 1 | G248: =R[-100]C -> 17 | H248: =VLOOKUP(INT(MOD(RC[-6],1000)/100),Sheet1!R2C1:R8C2,2,FALSE)*RC[-5] -> 80 | I248: =R[-100]C -> 0
A249: =R[-100]C+200 -> 1435 | B249: =R[-100]C+1000 -> 62201 | C249: =R[-100]C -> 4 | D249: =R[-100]C -> 1 | E249: =R[-100]C -> 55 | F249: =R[-100]C -> 1 | G249: =R[-100]C -> 17 | H249: =VLOOKUP(INT(MOD(RC[-6],1000)/100),Sheet1!R2C1:R8C2,2,FALSE)*RC[-5] -> 420 | I249: =R[-100]C -> 0
A250: =R[-100]C+200 -> 1436 | B250: =R[-100]C+1000 -> 62202 | C250: =R[-100]C -> 4 | D250: =R[-100]C -> 1 | E250: =R[-100]C -> 55 | F250: =R[-100]C -> 1 | G250: =R[-100]C -> 17 | H250: =VLOOKUP(INT(MOD(RC[-6],1000)/100),Sheet1!R2C1:R8C2,2,FALSE)*RC[-5] -> 420 | I250: =R[-100]C -> 0
A251: =R[-100]C+200 -> 1437 | B251: =R[-100]C+1000 -> 62301 | C251: =R[-100]C -> 4 | D251: =R[-100]C -> 1 | E251: =R[-100]C -> 60 | F251: =R[-100]C -> 1 | G251: =R[-100]C -> 17 | H251: =VLOOKUP(INT(MOD(RC[-6],1000)/100),Sheet1!R2C1:R8C2,2,FALSE)*RC[-5] -> 2080 | I251: =R[-100]C -> 0
A252: =R[-100]C+200 -> 1438 | B252: =R[-100]C+1000 -> 62302 | C252: =R[-100]C -> 4 | D252: =R[-100]C -> 1 | E252: =R[-100]C -> 60 | F252: =R[-100]C -> 1 | G252: =R[-100]C -> 17 | H252: =VLOOKUP(INT(MOD(RC[-6],1000)/100),Sheet1!R2C1:R8C2,2,FALSE)*RC[-5] -> 2080 | I252: =R[-100]C -> 0
A253: =R[-100]C+200 -> 1439 | B253: =R[-100]C+1000 -> 62401 | C253: =R[-100]C -> 4 | D253: =R[-100]C -> 1 | E253: =R[-100]C -> 70 | F253: =R[-100]C -> 1 | G253: =R[-100]C -> 17 | H253: =VLOOKUP(INT(MOD(RC[-6],1000)/100),Sheet1!R2C1:R8C2,2,FALSE)*RC[-5] -> 5420 | I253: =R[-100]C -> 1
A254: =R[-100]C+200 -> 1440 | B254: =R[-100]C+1000 -> 62402 | C254: =R[-100]C -> 4 | D254: =R[-100]C -> 1 | E254: =R[-100]C -> 70 | F254: =R[-100]C -> 1 | G254: =R[-100]C -> 17 | H254: =VLOOKUP(INT(MOD(RC[-6],1000)/100),Sheet1!R2C1:R8C2,2,FALSE)*RC[-5] -> 5420 | I254: =R[-100]C -> 1
A255: =R[-100]C+200 -> 1441 | B255: =R[-100]C+1000 -> 62001 | C255: =R[-100]C -> 5 | D255: =R[-100]C -> 1 | E255: =R[-100]C -> 1 | F255: =R[-100]C -> 1 | G255: =R[-100]C -> 17 | H255: =VLOOKUP(INT(MOD(RC[-6],1000)/100),Sheet1!R2C1:R8C2,2,FALSE)*RC[-5] -> 25 | I255: =R[-100]C -> 0
A256: =R[-100]C+200 -> 1442 | B256: =R[-100]C+1000 -> 62002 | C256: =R[-100]C -> 5 | D256: =R[-100]C -> 1 | E256: =R[-100]C -> 1 | F256: =R[-100]C -> 1 | G256: =R[-100]C -> 17 | H256: =VLOOKUP(INT(MOD(RC[-6],1000)/100),Sheet1!R2C1:R8C2,2,FALSE)*RC[-5] -> 25 | I256: =R[-100]C -> 0
A257: =R[-100]C+200 -> 1443 | B257: =R[-100]C+1000 -> 62101 | C257: =R[-100]C -> 5 | D257: =R[-100]C -> 1 | E257: =R[-100]C -> 1 | F257: =R[-100]C -> 1 | G257: =R[-100]C -> 17 | H257: =VLOOKUP(INT(MOD(RC[-6],1000)/100),Sheet1!R2C1:R8C2,2,FALSE)*RC[-5] -> 100 | I257: =R[-100]C -> 0
A258: =R[-100]C+200 -> 1444 | B258: =R[-100]C+1000 -> 62102 | C258: =R[-100]C -> 5 | D258: =R[-100]C -> 1 | E258: =R[-100]C -> 1 | F258: =R[-100]C -> 1 | G258: =R[-100]C -> 17 | H258: =VLOOKUP(INT(MOD(RC[-6],1000)/100),Sheet1!R2C1:R8C2,2,FALSE)*RC[-5] -> 100 | I258: =R[-100]C -> 0
A259: =R[-100]C+200 -> 1445 | B259: =R[-100]C+1000 -> 62201 | C259: =R[-100]C -> 5 | D259: =R[-100]C -> 1 | E259: =R[-100]C -> 55 | F259: =R[-100]C -> 1 | G259: =R[-100]C -> 17 | H259: =VLOOKUP(INT(MOD(RC[-6],1000)/100),Sheet1!R2C1:R8C2,2,FALSE)*RC[-5] -> 525 | I259: =R[-100]C -> 0
A260: =R[-100]C+200 -> 1446 | B260: =R[-100]C+1000 -> 62202 | C260: =R[-100]C -> 5 | D260: =R[-100]C -> 1 | E260: =R[-100]C -> 55 | F260: =R[-100]C -> 1 | G260: =R[-100]C -> 17 | H260: =VLOOKUP(INT(MOD(RC[-6],1000)/100),Sheet1!R2C1:R8C2,2,FALSE)*RC[-5] -> 525 | I260: =R[-100]C -> 0
A261: =R[-100]C+200 -> 1447 | B261: =R[-100]C+1000 -> 62301 | C261: =R[-100]C -> 5 | D261: =R[-100]C -> 1 | E261: =R[-100]C -> 60 | F261: =R[-100]C -> 1 | G261: =R[-100]C -> 17 | H261: =VLOOKUP(INT(MOD(RC[-6],1000)/100),Sheet1!R2C1:R8C2,2,FALSE)*RC[-5] -> 2600 | I261: =R[-100]C -> 0
A262: =R[-100]C+200 -> 1448 | B262: =R[-100]C+1000 -> 62302 | C262: =R[-100]C -> 5 | D262: =R[-100]C -> 1 | E262: =R[-100]C -> 60 | F262: =R[-100]C -> 1 | G262: =R[-100]C -> 17 | H262: =VLOOKUP(INT(MOD(RC[-6],1000)/100),Sheet1!R2C1:R8C2,2,FALSE)*RC[-5] -> 2600 | I262: =R[-100]C -> 0
A263: =R[-100]C+200 -> 1449 | B263: =R[-100]C+1000 -> 62401 | C263: =R[-100]C -> 5 | D263: =R[-100]C -> 1 | E263: =R[-100]C -> 70 | F263: =R[-100]C -> 1 | G263: =R[-100]C -> 17 | H263: =VLOOKUP(INT(MOD(RC[-6],1000)/100),Sheet1!R2C1:R8C2,2,FALSE)*RC[-5] -> 6775 | I263: =R[-100]C -> 1
A264: =R[-100]C+200 -> 1450 | B264: =R[-100]C+1000 -> 62402 | C264: =R[-100]C -> 5 | D264: =R[-100]C -> 1 | E264: =R[-100]C -> 70 | F264: =R[-100]C -> 1 | G264: =R[-100]C -> 17 | H264: =VLOOKUP(INT(MOD(RC[-6],1000)/100),Sheet1!R2C1:R8C2,2,FALSE)*RC[-5] -> 6775 | I264: =R[-100]C -> 1
A265: =R[-100]C+200 -> 1451 | B265: =R[-100]C+1000 -> 62001 | C265: =R[-100]C -> 1 | D265: =R[-100]C -> 1 | E265: =R[-100]C -> 1 | F265: =R[-100]C -> 1 | G265: =R[-100]C -> 5 | H265: =VLOOKUP(INT(MOD(RC[-6],1000)/100),Sheet1!R2C1:R8C2,2,FALSE)*RC[-5] -> 5 | I265: =R[-100]C -> 0
A266: =R[-100]C+200 -> 1452 | B266: =R[-100]C+1000 -> 62002 | C266: =R[-100]C -> 1 | D266: =R[-100]C -> 1 | E266: =R[-100]C -> 1 | F266: =R[-100]C -> 1 | G266: =R[-100]C -> 5 | H266: =VLOOKUP(INT(MOD(RC[-6],1000)/100),Sheet1!R2C1:R8C2,2,FALSE)*RC[-5] -> 5 | I266: =R[-100]C -> 0
A267: =R[-100]C+200 -> 1453 | B267: =R[-100]C+1000 -> 62101 | C267: =R[-100]C -> 1 | D267: =R[-100]C -> 1 | E267: =R[-100]C -> 1 | F267: =R[-100]C -> 1 | G267: =R[-100]C -> 5 | H267: =VLOOKUP(INT(MOD(RC[-6],1000)/100),Sheet1!R2C1:R8C2,2,FALSE)*RC[-5] -> 20 | I267: =R[-100]C -> 0
A268: =R[-100]C+200 -> 1454 | B268: =R[-100]C+1000 -> 62102 | C268: =R[-100]C -> 1 | D268: =R[-100]C -> 1 | E268: =R[-100]C -> 1 | F268: =R[-100]C -> 1 | G268: =R[-100]C -> 5 | H268: =VLOOKUP(INT(MOD(RC[-6],1000)/100),Sheet1!R2C1:R8C2,2,FALSE)*RC[-5] -> 20 | I268: =R[-100]C -> 0
A269: =R[-100]C+200 -> 1455 | B269: =R[-100]C+1000 -> 62201 | C269: =R[-100]C -> 1 | D269: =R[-100]C -> 1 | E269: =R[-100]C -> 55 | F269: =R[-100]C -> 1 | G269: =R[-100]C -> 5 | H269: =VLOOKUP(INT(MOD(RC[-6],1000)/100),Sheet1!R2C1:R8C2,2,FALSE)*RC[-5] -> 105 | I269: =R[-100]C -> 0
A270: =R[-100]C+200 -> 1456 | B270: =R[-100]C+1000 -> 62202 | C270: =R[-100]C -> 1 | D270: =R[-100]C -> 1 | E270: =R[-100]C -> 55 | F270: =R[-100]C -> 1 | G270: =R[-100]C -> 5 | H270: =VLOOKUP(INT(MOD(RC[-6],1000)/100),Sheet1!R2C1:R8C2,2,FALSE)*RC[-5] -> 105 | I270: =R[-100]C -> 0
A271: =R[-100]C+200 -> 1457 | B271: =R[-100]C+1000 -> 62301 | C271: =R[-100]C -> 1 | D271: =R[-100]C -> 1 | E271: =R[-100]C -> 60 | F271: =R[-100]C -> 1 | G271: =R[-100]C -> 5 | H271: =VLOOKUP(INT(MOD(RC[-6],1000)/100),Sheet1!R2C1:R8C2,2,FALSE)*RC[-5] -> 520 | I271: =R[-100]C -> 0
A272: =R[-100]C+200 -> 1458 | B272: =R[-100]C+1000 -> 62302 | C272: =R[-100]C -> 1 | D272: =R[-100]C -> 1 | E272: =R[-100]C -> 60 | F272: =R[-100]C -> 1 | G272: =R[-100]C -> 5 | H272: =VLOOKUP(INT(MOD(RC[-6],1000)/100),Sheet1!R2C1:R8C2,2,FALSE)*RC[-5] -> 520 | I272: =R[-100]C -> 0
A273: =R[-100]C+200 -> 1459 | B273: =R[-100]C+1000 -> 62401 | C273: =R[-100]C -> 1 | D273: =R[-100]C -> 1 | E273: =R[-100]C -> 70 | F273: =R[-100]C -> 1 | G273: =R[-100]C -> 5 | H273: =VLOOKUP(INT(MOD(RC[-6],1000)/100),Sheet1!R2C1:R8C2,2,FALSE)*RC[-5] -> 1355 | I273: =R[-100]C -> 1
A274: =R[-100]C+200 -> 1460 | B274: =R[-100]C+1000 -> 62402 | C274: =R[-100]C -> 1 | D274: =R[-100]C -> 1 | E274: =R[-100]C -> 70 | F274: =R[-100]C -> 1 | G274: =R[-100]C -> 5 | H274: =VLOOKUP(INT(MOD(RC[-6],1000)/100),Sheet1!R2C1:R8C2,2,FALSE)*RC[-5] -> 1355 | I274: =R[-100]C -> 1
A275: =R[-100]C+200 -> 1461 | B275: =R[-100]C+1000 -> 62001 | C275: =R[-100]C -> 2 | D275: =R[-100]C -> 1 | E275: =R[-100]C -> 1 | F275: =R[-100]C -> 1 | G275: =R[-100]C -> 5 | H275: =VLOOKUP(INT(MOD(RC[-6],1000)/100),Sheet1!R2C1:R8C2,2,FALSE)*RC[-5] -> 10 | I275: =R[-100]C -> 0
A276: =R[-100]C+200 -> 1462 | B276: =R[-100]C+1000 -> 62002 | C276: =R[-100]C -> 2 | D276: =R[-100]C -> 1 | E276: =R[-100]C -> 1 | F276: =R[-100]C -> 1 | G276: =R[-100]C -> 5 | H276: =VLOOKUP(INT(MOD(RC[-6],1000)/100),Sheet1!R2C1:R8C2,2,FALSE)*RC[-5] -> 10 | I276: =R[-100]C -> 0
A277: =R[-100]C+200 -> 1463 | B277: =R[-100]C+1000 -> 62101 | C277: =R[-100]C -> 2 | D277: =R[-100]C -> 1 | E277: =R[-100]C -> 1 | F277: =R[-100]C -> 1 | G277: =R[-100]C -> 5 | H277: =VLOOKUP(INT(MOD(RC[-6],1000)/100),Sheet1!R2C1:R8C2,2,FALSE)*RC[-5] -> 40 | I277: =R[-100]C -> 0
A278: =R[-100]C+200 -> 1464 | B278: =R[-100]C+1000 -> 62102 | C278: =R[-100]C -> 2 | D278: =R[-100]C -> 1 | E278: =R[-100]C -> 1 | F278: =R[-100]C -> 1 | G278: =R[-100]C -> 5 | H278: =VLOOKUP(INT(MOD(RC[-6],1000)/100),Sheet1!R2C1:R8C2,2,FALSE)*RC[-5] -> 40 | I278: =R[-100]C -> 0
A279: =R[-100]C+200 -> 1465 | B279: =R[-100]C+1000 -> 62201 | C279: =R[-100]C -> 2 | D279: =R[-100]C -> 1 | E279: =R[-100]C -> 55 | F279: =R[-100]C -> 1 | G279: =R[-100]C -> 5 | H279: =VLOOKUP(INT(MOD(RC[-6],1000)/100),Sheet1!R2C1:R8C2,2,FALSE)*RC[-5] -> 210 | I279: =R[-100]C -> 0
A280: =R[-100]C+200 -> 1466 | B280: =R[-100]C+1000 -> 62202 | C280: =R[-100]C -> 2 | D280: =R[-100]C -> 1 | E280: =R[-100]C -> 55 | F280: =R[-100]C -> 1 | G280: =R[-100]C -> 5 | H280: =VLOOKUP(INT(MOD(RC[-6],1000)/100),Sheet1!R2C1:R8C2,2,FALSE)*RC[-5] -> 210 | I280: =R[-100]C -> 0
A281: =R[-100]C+200 -> 1467 | B281: =R[-100]C+1000 -> 62301 | C281: =R[-100]C -> 2 | D281: =R[-100]C -> 1 | E281: =R[-100]C -> 60 | F281: =R[-100]C -> 1 | G281: =R[-100]C -> 5 | H281: =VLOOKUP(INT(MOD(RC[-6],1000)/100),Sheet1!R2C1:R8C2,2,FALSE)*RC[-5] -> 1040 | I281: =R[-100]C -> 0
A282: =R[-100]C+200 -> 1468 | B282: =R[-100]C+1000 -> 62302 | C282: =R[-100]C -> 2 | D282: =R[-100]C -> 1 | E282: =R[-100]C -> 60 | F282: =R[-100]C -> 1 | G282: =R[-100]C -> 5 | H282: =VLOOKUP(INT(MOD(RC[-6],1000)/100),Sheet1!R2C1:R8C2,2,FALSE)*RC[-5] -> 1040 | I282: =R[-100]C -> 0
A283: =R[-100]C+200 -> 1469 | B283: =R[-100]C+1000 -> 62401 | C283: =R[-100]C -> 2 | D283: =R[-100]C -> 1 | E283: =R[-100]C -> 70 | F283: =R[-100]C -> 1 | G283: =R[-100]C -> 5 | H283: =VLOOKUP(INT(MOD(RC[-6],1000)/100),Sheet1!R2C1:R8C2,2,FALSE)*RC[-5] -> 2710 | I283: =R[-100]C -> 1
A284: =R[-100]C+200 -> 1470 | B284: =R[-100]C+1000 -> 62402 | C284: =R[-100]C -> 2 | D284: =R[-100]C -> 1 | E284: =R[-100]C -> 70 | F284: =R[-100]C -> 1 | G284: =R[-100]C -> 5 | H284: =VLOOKUP(INT(MOD(RC[-6],1000)/100),Sheet1!R2C1:R8C2,2,FALSE)*RC[-5] -> 2710 | I284: =R[-100]C -> 1
A285: =R[-100]C+200 -> 1471 | B285: =R[-100]C+1000 -> 62001 | C285: =R[-100]C -> 3 | D285: =R[-100]C -> 1 | E285: =R[-100]C -> 1 | F285: =R[-100]C -> 1 | G285: =R[-100]C -> 5 | H285: =VLOOKUP(INT(MOD(RC[-6],1000)/100),Sheet1!R2C1:R8C2,2,FALSE)*RC[-5] -> 15 | I285: =R[-100]C -> 0
A286: =R[-100]C+200 -> 1472 | B286: =R[-100]C+1000 -> 62002 | C286: =R[-100]C -> 3 | D286: =R[-100]C -> 1 | E286: =R[-100]C -> 1 | F286: =R[-100]C -> 1 | G286: =R[-100]C -> 5 | H286: =VLOOKUP(INT(MOD(RC[-6],1000)/100),Sheet1!R2C1:R8C2,2,FALSE)*RC[-5] -> 15 | I286: =R[-100]C -> 0
A287: =R[-100]C+200 -> 1473 | B287: =R[-100]C+1000 -> 62101 | C287: =R[-100]C -> 3 | D287: =R[-100]C -> 1 | E287: =R[-100]C -> 1 | F287: =R[-100]C -> 1 | G287: =R[-100]C -> 5 | H287: =VLOOKUP(INT(MOD(RC[-6],1000)/100),Sheet1!R2C1:R8C2,2,FALSE)*RC[-5] -> 60 | I287: =R[-100]C -> 0
A288: =R[-100]C+200 -> 1474 | B288: =R[-100]C+1000 -> 62102 | C288: =R[-100]C -> 3 | D288: =R[-100]C -> 1 | E288: =R[-100]C -> 1 | F288: =R[-100]C -> 1 | G288: =R[-100]C -> 5 | H288: =VLOOKUP(INT(MOD(RC[-6],1000)/100),Sheet1!R2C1:R8C2,2,FALSE)*RC[-5] -> 60 | I288: =R[-100]C -> 0
A289: =R[-100]C+200 -> 1475 | B289: =R[-100]C+1000 -> 62201 | C289: =R[-100]C -> 3 | D289: =R[-100]C -> 1 | E289: =R[-100]C -> 55 | F289: =R[-100]C -> 1 | G289: =R[-100]C -> 5 | H289: =VLOOKUP(INT(MOD(RC[-6],1000)/100),Sheet1!R2C1:R8C2,2,FALSE)*RC[-5] -> 315 | I289: =R[-100]C -> 0
A290: =R[-100]C+200 -> 1476 | B290: =R[-100]C+1000 -> 62202 | C290: =R[-100]C -> 3 | D290: =R[-100]C -> 1 | E290: =R[-100]C -> 55 | F290: =R[-100]C -> 1 | G290: =R[-100]C -> 5 | H290: =VLOOKUP(INT(MOD(RC[-6],1000)/100),Sheet1!R2C1:R8C2,2,FALSE)*RC[-5] -> 315 | I290: =R[-100]C -> 0
A291: =R[-100]C+200 -> 1477 | B291: =R[-100]C+1000 -> 62301 | C291: =R[-100]C -> 3 | D291: =R[-100]C -> 1 | E291: =R[-100]C -> 60 | F291: =R[-100]C -> 1 | G291: =R[-100]C -> 5 | H291: =VLOOKUP(INT(MOD(RC[-6],1000)/100),Sheet1!R2C1:R8C2,2,FALSE)*RC[-5] -> 1560 | I291: =R[-100]C -> 0
A292: =R[-100]C+200 -> 1478 | B292: =R[-100]C+1000 -> 62302 | C292: =R[-100]C -> 3 | D292: =R[-100]C -> 1 | E292: =R[-100]C -> 60 | F292: =R[-100]C -> 1 | G292: =R[-100]C -> 5 | H292: =VLOOKUP(INT(MOD(RC[-6],1000)/100),Sheet1!R2C1:R8C2,2,FALSE)*RC[-5] -> 1560 | I292: =R[-100]C -> 0
A293: =R[-100]C+200 -> 1479 | B293: =R[-100]C+1000 -> 62401 | C293: =R[-100]C -> 3 | D293: =R[-100]C -> 1 | E293: =R[-100]C -> 70 | F293: =R[-100]C -> 1 | G293: =R[-100]C -> 5 | H293: =VLOOKUP(INT(MOD(RC[-6],1000)/100),Sheet1!R2C1:R8C2,2,FALSE)*RC[-5] -> 4065 | I293: =R[-100]C -> 1
A294: =R[-100]C+200 -> 1480 | B294: =R[-100]C+1000 -> 62402 | C294: =R[-100]C -> 3 | D294: =R[-100]C -> 1 | E294: =R[-100]C -> 70 | F294: =R[-100]C -> 1 | G294: =R[-100]C -> 5 | H294: =VLOOKUP(INT(MOD(RC[-6],1000)/100),Sheet1!R2C1:R8C2,2,FALSE)*RC[-5] -> 4065 | I294: =R[-100]C -> 1
A295: =R[-100]C+200 -> 1481 | B295: =R[-100]C+1000 -> 62001 | C295: =R[-100]C -> 4 | D295: =R[-100]C -> 1 | E295: =R[-100]C -> 1 | F295: =R[-100]C -> 1 | G295: =R[-100]C -> 5 | H295: =VLOOKUP(INT(MOD(RC[-6],1000)/100),Sheet1!R2C1:R8C2,2,FALSE)*RC[-5] -> 20 | I295: =R[-100]C -> 0
A296: =R[-100]C+200 -> 1482 | B296: =R[-100]C+1000 -> 62002 | C296: =R[-100]C -> 4 | D296: =R[-100]C -> 1 | E296: =R[-100]C -> 1 | F296: =R[-100]C -> 1 | G296: =R[-100]C -> 5 | H296: =VLOOKUP(INT(MOD(RC[-6],1000)/100),Sheet1!R2C1:R8C2,2,FALSE)*RC[-5] -> 20 | I296: =R[-100]C -> 0
A297: =R[-100]C+200 -> 1483 | B297: =R[-100]C+1000 -> 62101 | C297: =R[-100]C -> 4 | D297: =R[-100]C -> 1 | E297: =R[-100]C -> 1 | F297: =R[-100]C -> 1 | G297: =R[-100]C -> 5 | H297: =VLOOKUP(INT(MOD(RC[-6],1000)/100),Sheet1!R2C1:R8C2,2,FALSE)*RC[-5] -> 80 | I297: =R[-100]C -> 0
A298: =R[-100]C+200 -> 1484 | B298: =R[-100]C+1000 -> 62102 | C298: =R[-100]C -> 4 | D298: =R[-100]C -> 1 | E298: =R[-100]C -> 1 | F298: =R[-100]C -> 1 | G298: =R[-100]C -> 5 | H298: =VLOOKUP(INT(MOD(RC[-6],1000)/100),Sheet1!R2C1:R8C2,2,FALSE)*RC[-5] -> 80 | I298: =R[-100]C -> 0
A299: =R[-100]C+200 -> 1485 | B299: =R[-100]C+1000 -> 62201 | C299: =R[-100]C -> 4 | D299: =R[-100]C -> 1 | E299: =R[-100]C -> 55 | F299: =R[-100]C -> 1 | G299: =R[-100]C -> 5 | H299: =VLOOKUP(INT(MOD(RC[-6],1000)/100),Sheet1!R2C1:R8C2,2,FALSE)*RC[-5] -> 420 | I299: =R[-100]C -> 0
A300: =R[-100]C+200 -> 1486 | B300: =R[-100]C+1000 -> 62202 | C300: =R[-100]C -> 4 | D300: =R[-100]C -> 1 | E300: =R[-100]C -> 55 | F300: =R[-100]C -> 1 | G300: =R[-100]C -> 5 | H300: =VLOOKUP(INT(MOD(RC[-6],1000)/100),Sheet1!R2C1:R8C2,2,FALSE)*RC[-5] -> 420 | I300: =R[-100]C -> 0
A301: =R[-100]C+200 -> 1487 | B301: =R[-100]C+1000 -> 62301 | C301: =R[-100]C -> 4 | D301: =R[-100]C -> 1 | E301: =R[-100]C -> 60 | F301: =R[-100]C -> 1 | G301: =R[-100]C -> 5 | H301: =VLOOKUP(INT(MOD(RC[-6],1000)/100),Sheet1!R2C1:R8C2,2,FALSE)*RC[-5] -> 2080 | I301: =R[-100]C -> 0
A302: =R[-100]C+200 -> 1488 | B302: =R[-100]C+1000 -> 62302 | C302: =R[-100]C -> 4 | D302: =R[-100]C -> 1 | E302: =R[-100]C -> 60 | F302: =R[-100]C -> 1 | G302: =R[-100]C -> 5 | H302: =VLOOKUP(INT(MOD(RC[-6],1000)/100),Sheet1!R2C1:R8C2,2,FALSE)*RC[-5] -> 2080 | I302: =R[-100]C -> 0
A303: =R[-100]C+200 -> 1489 | B303: =R[-100]C+1000 -> 62401 | C303: =R[-100]C -> 4 | D303: =R[-100]C -> 1 | E303: =R[-100]C -> 70 | F303: =R[-100]C -> 1 | G303: =R[-100]C -> 5 | H303: =VLOOKUP(INT(MOD(RC[-6],1000)/100),Sheet1!R2C1:R8C2,2,FALSE)*RC[-5] -> 5420 | I303: =R[-100]C -> 1
A304: =R[-100]C+200 -> 1490 | B304: =R[-100]C+1000 -> 62402 | C304: =R[-100]C -> 4 | D304: =R[-100]C -> 1 | E304: =R[-100]C -> 70 | F304: =R[-100]C -> 1 | G304: =R[-100]C -> 5 | H304: =VLOOKUP(INT(MOD(RC[-6],1000)/100),Sheet1!R2C1:R8C2,2,FALSE)*RC[-5] -> 5420 | I304: =R[-100]C -> 1
A305: =R[-100]C+200 -> 1491 | B305: =R[-100]C+1000 -> 62001 | C305: =R[-100]C -> 5 | D305: =R[-100]C -> 1 | E305: =R[-100]C -> 1 | F305: =R[-100]C -> 1 | G305: =R[-100]C -> 5 | H305: =VLOOKUP(INT(MOD(RC[-6],1000)/100),Sheet1!R2C1:R8C2,2,FALSE)*RC[-5] -> 25 | I305: =R[-100]C -> 0
A306: =R[-100]C+200 -> 1492 | B306: =R[-100]C+1000 -> 62002 | C306: =R[-100]C -> 5 | D306: =R[-100]C -> 1 | E306: =R[-100]C -> 1 | F306: =R[-100]C -> 1 | G306: =R[-100]C -> 5 | H306: =VLOOKUP(INT(MOD(RC[-6],1000)/100),Sheet1!R2C1:R8C2,2,FALSE)*RC[-5] -> 25 | I306: =R[-100]C -> 0
A307: =R[-100]C+200 -> 1493 | B307: =R[-100]C+1000 -> 62101 | C307: =R[-100]C -> 5 | D307: =R[-100]C -> 1 | E307: =R[-100]C -> 1 | F307: =R[-100]C -> 1 | G307: =R[-100]C -> 5 | H307: =VLOOKUP(INT(MOD(RC[-6],1000)/100),Sheet1!R2C1:R8C2,2,FALSE)*RC[-5] -> 100 | I307: =R[-100]C -> 0
A308: =R[-100]C+200 -> 1494 | B308: =R[-100]C+1000 -> 62102 | C308: =R[-100]C -> 5 | D308: =R[-100]C -> 1 | E308: =R[-100]C -> 1 | F308: =R[-100]C -> 1 | G308: =R[-100]C -> 5 | H308: =VLOOKUP(INT(MOD(RC[-6],1000)/100),Sheet1!R2C1:R8C2,2,FALSE)*RC[-5] -> 100 | I308: =R[-100]C -> 0
A309: =R[-100]C+200 -> 1495 | B309: =R[-100]C+1000 -> 62201 | C309: =R[-100]C -> 5 | D309: =R[-100]C -> 1 | E309: =R[-100]C -> 55 | F309: =R[-100]C -> 1 | G309: =R[-100]C -> 5 | H309: =VLOOKUP(INT(MOD(RC[-6],1000)/100),Sheet1!R2C1:R8C2,2,FALSE)*RC[-5] -> 525 | I309: =R[-100]C -> 0
A310: =R[-100]C+200 -> 1496 | B310: =R[-100]C+1000 -> 62202 | C310: =R[-100]C -> 5 | D310: =R[-100]C -> 1 | E310: =R[-100]C -> 55 | F310: =R[-100]C -> 1 | G310: =R[-100]C -> 5 | H310: =VLOOKUP(INT(MOD(RC[-6],1000)/100),Sheet1!R2C1:R8C2,2,FALSE)*RC[-5] -> 525 | I310: =R[-100]C -> 0
A311: =R[-100]C+200 -> 1497 | B311: =R[-100]C+1000 -> 62301 | C311: =R[-100]C -> 5 | D311: =R[-100]C -> 1 | E311: =R[-100]C -> 60 | F311: =R[-100]C -> 1 | G311: =R[-100]C -> 5 | H311: =VLOOKUP(INT(MOD(RC[-6],1000)/100),Sheet1!R2C1:R8C2,2,FALSE)*RC[-5] -> 2600 | I311: =R[-100]C -> 0
A312: =R[-100]C+200 -> 1498 | B312: =R[-100]C+1000 -> 62302 | C312: =R[-100]C -> 5 | D312: =R[-100]C -> 1 | E312: =R[-100]C -> 60 | F312: =R[-100]C -> 1 | G312: =R[-100]C -> 5 | H312: =VLOOKUP(INT(MOD(RC[-6],1000)/100),Sheet1!R2C1:R8C2,2,FALSE)*RC[-5] -> 2600 | I312: =R[-100]C -> 0
A313: =R[-100]C+200 -> 1499 | B313: =R[-100]C+1000 -> 62401 | C313: =R[-100]C -> 5 | D313: =R[-100]C -> 1 | E313: =R[-100]C -> 70 | F313: =R[-100]C -> 1 | G313: =R[-100]C -> 5 | H313: =VLOOKUP(INT(MOD(RC[-6],1000)/100),Sheet1!R2C1:R8C2,2,FALSE)*RC[-5] -> 6775 | I313: =R[-100]C -> 1
A314: =R[-100]C+200 -> 1500 | B314: =R[-100]C+1000 -> 62402 | C314: =R[-100]C -> 5 | D314: =R[-100]C -> 1 | E314: =R[-100]C -> 70 | F314: =R[-100]C -> 1 | G314: =R[-100]C -> 5 | H314: =VLOOKUP(INT(MOD(RC[-6],1000)/100),Sheet1!R2C1:R8C2,2,FALSE)*RC[-5] -> 6775 | I314: =R[-100]C -> 1
A315: =R[-100]C+200 -> 1601 | B315: =R[-100]C+1000 -> 63001 | C315: =R[-100]C -> 1 | D315: =R[-100]C -> 1 | E315: =R[-100]C -> 1 | F315: =R[-100]C -> 1 | G315: =R[-100]C -> 17 | H315: =VLOOKUP(INT(MOD(RC[-6],1000)/100),Sheet1!R2C1:R8C2,2,FALSE)*RC[-5] -> 5 | I315: =R[-100]C -> 0
A316: =R[-100]C+200 -> 1602 | B316: =R[-100]C+1000 -> 63002 | C316: =R[-100]C -> 1 | D316: =R[-100]C -> 1 | E316: =R[-100]C -> 1 | F316: =R[-100]C -> 1 | G316: =R[-100]C -> 17 | H316: =VLOOKUP(INT(MOD(RC[-6],1000)/100),Sheet1!R2C1:R8C2,2,FALSE)*RC[-5] -> 5 | I316: =R[-100]C -> 0
A317: =R[-100]C+200 -> 1603 | B317: =R[-100]C+1000 -> 63101 | C317: =R[-100]C -> 1 | D317: =R[-100]C -> 1 | E317: =R[-100]C -> 1 | F317: =R[-100]C -> 1 | G317: =R[-100]C -> 17 | H317: =VLOOKUP(INT(MOD(RC[-6],1000)/100),Sheet1!R2C1:R8C2,2,FALSE)*RC[-5] -> 20 | I317: =R[-100]C -> 0
A318: =R[-100]C+200 -> 1604 | B318: =R[-100]C+1000 -> 63102 | C318: =R[-100]C -> 1 | D318: =R[-100]C -> 1 | E318: =R[-100]C -> 1 | F318: =R[-100]C -> 1 | G318: =R[-100]C -> 17 | H318: =VLOOKUP(INT(MOD(RC[-6],1000)/100),Sheet1!R2C1:R8C2,2,FALSE)*RC[-5] -> 20 | I318: =R[-100]C -> 0
A319: =R[-100]C+200 -> 1605 | B319: =R[-100]C+1000 -> 63201 | C319: =R[-100]C -> 1 | D319: =R[-100]C -> 1 | E319: =R[-100]C -> 55 | F319: =R[-100]C -> 1 | G319: =R[-100]C -> 17 | H319: =VLOOKUP(INT(MOD(RC[-6],1000)/100),Sheet1!R2C1:R8C2,2,FALSE)*RC[-5] -> 105 | I319: =R[-100]C -> 0
A320: =R[-100]C+200 -> 1606 | B320: =R[-100]C+1000 -> 63202 | C320: =R[-100]C -> 1 | D320: =R[-100]C -> 1 | E320: =R[-100]C -> 55 | F320: =R[-100]C -> 1 | G320: =R[-100]C -> 17 | H320: =VLOOKUP(INT(MOD(RC[-6],1000)/100),Sheet1!R2C1:R8C2,2,FALSE)*RC[-5] -> 105 | I320: =R[-100]C -> 0
A321: =R[-100]C+200 -> 1607 | B321: =R[-100]C+1000 -> 63301 | C321: =R[-100]C -> 1 | D321: =R[-100]C -> 1 | E321: =R[-100]C -> 60 | F321: =R[-100]C -> 1 | G321: =R[-100]C -> 17 | H321: =VLOOKUP(INT(MOD(RC[-6],1000)/100),Sheet1!R2C1:R8C2,2,FALSE)*RC[-5] -> 520 | I321: =R[-100]C -> 0
A322: =R[-100]C+200 -> 1608 | B322: =R[-100]C+1000 -> 63302 | C322: =R[-100]C -> 1 | D322: =R[-100]C -> 1 | E322: =R[-100]C -> 60 | F322: =R[-100]C -> 1 | G322: =R[-100]C -> 17 | H322: =VLOOKUP(INT(MOD(RC[-6],1000)/100),Sheet1!R2C1:R8C2,2,FALSE)*RC[-5] -> 520 | I322: =R[-100]C -> 0
A323: =R[-100]C+200 -> 1609 | B323: =R[-100]C+1000 -> 63401 | C323: =R[-100]C -> 1 | D323: =R[-100]C -> 1 | E323: =R[-100]C -> 70 | F323: =R[-100]C -> 1 | G323: =R[-100]C -> 17 | H323: =VLOOKUP(INT(MOD(RC[-6],1000)/100),Sheet1!R2C1:R8C2,2,FALSE)*RC[-5] -> 1355 | I323: =R[-100]C -> 1
A324: =R[-100]C+200 -> 1610 | B324: =R[-100]C+1000 -> 63402 | C324: =R[-100]C -> 1 | D324: =R[-100]C -> 1 | E324: =R[-100]C -> 70 | F324: =R[-100]C -> 1 | G324: =R[-100]C -> 17 | H324: =VLOOKUP(INT(MOD(RC[-6],1000)/100),Sheet1!R2C1:R8C2,2,FALSE)*RC[-5] -> 1355 | I324: =R[-100]C -> 1
A325: =R[-100]C+200 -> 1611 | B325: =R[-100]C+1000 -> 63001 | C325: =R[-100]C -> 2 | D325: =R[-100]C -> 1 | E325: =R[-100]C -> 1 | F325: =R[-100]C -> 1 | G325: =R[-100]C -> 17 | H325: =VLOOKUP(INT(MOD(RC[-6],1000)/100),Sheet1!R2C1:R8C2,2,FALSE)*RC[-5] -> 10 | I325: =R[-100]C -> 0
A326: =R[-100]C+200 -> 1612 | B326: =R[-100]C+1000 -> 63002 | C326: =R[-100]C -> 2 | D326: =R[-100]C -> 1 | E326: =R[-100]C -> 1 | F326: =R[-100]C -> 1 | G326: =R[-100]C -> 17 | H326: =VLOOKUP(INT(MOD(RC[-6],1000)/100),Sheet1!R2C1:R8C2,2,FALSE)*RC[-5] -> 10 | I326: =R[-100]C -> 0
A327: =R[-100]C+200 -> 1613 | B327: =R[-100]C+1000 -> 63101 | C327: =R[-100]C -> 2 | D327: =R[-100]C -> 1 | E327: =R[-100]C -> 1 | F327: =R[-100]C -> 1 | G327: =R[-100]C -> 17 | H327: =VLOOKUP(INT(MOD(RC[-6],1000)/100),Sheet1!R2C1:R8C2,2,FALSE)*RC[-5] -> 40 | I327: =R[-100]C -> 0
A328: =R[-100]C+200 -> 1614 | B328: =R[-100]C+1000 -> 63102 | C328: =R[-100]C -> 2 | D328: =R[-100]C -> 1 | E328: =R[-100]C -> 1 | F328: =R[-100]C -> 1 | G328: =R[-100]C -> 17 | H328: =VLOOKUP(INT(MOD(RC[-6],1000)/100),Sheet1!R2C1:R8C2,2,FALSE)*RC[-5] -> 40 | I328: =R[-100]C -> 0
A329: =R[-100]C+200 -> 1615 | B329: =R[-100]C+1000 -> 63201 | C329: =R[-100]C -> 2 | D329: =R[-100]C -> 1 | E329: =R[-100]C -> 55 | F329: =R[-100]C -> 1 | G329: =R[-100]C -> 17 | H329: =VLOOKUP(INT(MOD(RC[-6],1000)/100),Sheet1!R2C1:R8C2,2,FALSE)*RC[-5] -> 210 | I329: =R[-100]C -> 0
A330: =R[-100]C+200 -> 1616 | B330: =R[-100]C+1000 -> 63202 | C330: =R[-100]C -> 2 | D330: =R[-100]C -> 1 | E330: =R[-100]C -> 55 | F330: =R[-100]C -> 1 | G330: =R[-100]C -> 17 | H330: =VLOOKUP(INT(MOD(RC[-6],1000)/100),Sheet1!R2C1:R8C2,2,FALSE)*RC[-5] -> 210 | I330: =R[-100]C -> 0
A331: =R[-100]C+200 -> 1617 | B331: =R[-100]C+1000 -> 63301 | C331: =R[-100]C -> 2 | D331: =R[-100]C -> 1 | E331: =R[-100]C -> 60 | F331: =R[-100]C -> 1 | G331: =R[-100]C -> 17 | H331: =VLOOKUP(INT(MOD(RC[-6],1000)/100),Sheet1!R2C1:R8C2,2,FALSE)*RC[-5] -> 1040 | I331: =R[-100]C -> 0
A332: =R[-100]C+200 -> 1618 | B332: =R[-100]C+1000 -> 63302 | C332: =R[-100]C -> 2 | D332: =R[-100]C -> 1 | E332: =R[-100]C -> 60 | F332: =R[-100]C -> 1 | G332: =R[-100]C -> 17 | H332: =VLOOKUP(INT(MOD(RC[-6],1000)/100),Sheet1!R2C1:R8C2,2,FALSE)*RC[-5] -> 1040 | I332: =R[-100]C -> 0
A333: =R[-100]C+200 -> 1619 | B333: =R[-100]C+1000 -> 63401 | C333: =R[-100]C -> 2 | D333: =R[-100]C -> 1 | E333: =R[-100]C -> 70 | F333: =R[-100]C -> 1 | G333: =R[-100]C -> 17 | H333: =VLOOKUP(INT(MOD(RC[-6],1000)/100),Sheet1!R2C1:R8C2,2,FALSE)*RC[-5] -> 2710 | I333: =R[-100]C -> 1
A334: =R[-100]C+200 -> 1620 | B334: =R[-100]C+1000 -> 63402 | C334: =R[-100]C -> 2 | D334: =R[-100]C -> 1 | E334: =R[-100]C -> 70 | F334: =R[-100]C -> 1 | G334: =R[-100]C -> 17 | H334: =VLOOKUP(INT(MOD(RC[-6],1000)/100),Sheet1!R2C1:R8C2,2,FALSE)*RC[-5] -> 2710 | I334: =R[-100]C -> 1
A335: =R[-100]C+200 -> 1621 | B335: =R[-100]C+1000 -> 63001 | C335: =R[-100]C -> 3 | D335: =R[-100]C -> 1 | E335: =R[-100]C -> 1 | F335: =R[-100]C -> 1 | G335: =R[-100]C -> 17 | H335: =VLOOKUP(INT(MOD(RC[-6],1000)/100),Sheet1!R2C1:R8C2,2,FALSE)*RC[-5] -> 15 | I335: =R[-100]C -> 0
A336: =R[-100]C+200 -> 1622 | B336: =R[-100]C+1000 -> 63002 | C336: =R[-100]C -> 3 | D336: =R[-100]C -> 1 | E336: =R[-100]C -> 1 | F336: =R[-100]C -> 1 | G336: =R[-100]C -> 17 | H336: =VLOOKUP(INT(MOD(RC[-6],1000)/100),Sheet1!R2C1:R8C2,2,FALSE)*RC[-5] -> 15 | I336: =R[-100]C -> 0
A337: =R[-100]C+200 -> 1623 | B337: =R[-100]C+1000 -> 63101 | C337: =R[-100]C -> 3 | D337: =R[-100]C -> 1 | E337: =R[-100]C -> 1 | F337: =R[-100]C -> 1 | G337: =R[-100]C -> 17 | H337: =VLOOKUP(INT(MOD(RC[-6],1000)/100),Sheet1!R2C1:R8C2,2,FALSE)*RC[-5] -> 60 | I337: =R[-100]C -> 0
A338: =R[-100]C+200 -> 1624 | B338: =R[-100]C+1000 -> 63102 | C338: =R[-100]C -> 3 | D338: =R[-100]C -> 1 | E338: =R[-100]C -> 1 | F338: =R[-100]C -> 1 | G338: =R[-100]C -> 17 | H338: =VLOOKUP(INT(MOD(RC[-6],1000)/100),Sheet1!R2C1:R8C2,2,FALSE)*RC[-5] -> 60 | I338: =R[-100]C -> 0
A339: =R[-100]C+200 -> 1625 | B339: =R[-100]C+1000 -> 63201 | C339: =R[-100]C -> 3 | D339: =R[-100]C -> 1 | E339: =R[-100]C -> 55 | F339: =R[-100]C -> 1 | G339: =R[-100]C -> 17 | H339: =VLOOKUP(INT(MOD(RC[-6],1000)/100),Sheet1!R2C1:R8C2,2,FALSE)*RC[-5] -> 315 | I339: =R[-100]C -> 0
A340: =R[-100]C+200 -> 1626 | B340: =R[-100]C+1000 -> 63202 | C340: =R[-100]C -> 3 | D340: =R[-100]C -> 1 | E340: =R[-100]C -> 55 | F340: =R[-100]C -> 1 | G340: =R[-100]C -> 17 | H340: =VLOOKUP(INT(MOD(RC[-6],1000)/100),Sheet1!R2C1:R8C2,2,FALSE)*RC[-5] -> 315 | I340: =R[-100]C -> 0
A341: =R[-100]C+200 -> 1627 | B341: =R[-100]C+1000 -> 63301 | C341: =R[-100]C -> 3 | D341: =R[-100]C -> 1 | E341: =R[-100]C -> 60 | F341: =R[-100]C -> 1 | G341: =R[-100]C -> 17 | H341: =VLOOKUP(INT(MOD(RC[-6],1000)/100),Sheet1!R2C1:R8C2,2,FALSE)*RC[-5] -> 1560 | I341: =R[-100]C -> 0
A342: =R[-100]C+200 -> 1628 | B342: =R[-100]C+1000 -> 63302 | C342: =R[-100]C -> 3 | D342: =R[-100]C -> 1 | E342: =R[-100]C -> 60 | F342: =R[-100]C -> 1 | G342: =R[-100]C -> 17 | H342: =VLOOKUP(INT(MOD(RC[-6],1000)/100),Sheet1!R2C1:R8C2,2,FALSE)*RC[-5] -> 1560 | I342: =R[-100]C -> 0
A343: =R[-100]C+200 -> 1629 | B343: =R[-100]C+1000 -> 63401 | C343: =R[-100]C -> 3 | D343: =R[-100]C -> 1 | E343: =R[-100]C -> 70 | F343: =R[-100]C -> 1 | G343: =R[-100]C -> 17 | H343: =VLOOKUP(INT(MOD(RC[-6],1000)/100),Sheet1!R2C1:R8C2,2,FALSE)*RC[-5] -> 4065 | I343: =R[-100]C -> 1
A344: =R[-100]C+200 -> 1630 | B344: =R[-100]C+1000 -> 63402 | C344: =R[-100]C -> 3 | D344: =R[-100]C -> 1 | E344: =R[-100]C -> 70 | F344: =R[-100]C -> 1 | G344: =R[-100]C -> 17 | H344: =VLOOKUP(INT(MOD(RC[-6],1000)/100),Sheet1!R2C1:R8C2,2,FALSE)*RC[-5] -> 4065 | I344: =R[-100]C -> 1
A345: =R[-100]C+200 -> 1631 | B345: =R[-100]C+1000 -> 63001 | C345: =R[-100]C -> 4 | D345: =R[-100]C -> 1 | E345: =R[-100]C -> 1 | F345: =R[-100]C -> 1 | G345: =R[-100]C -> 17 | H345: =VLOOKUP(INT(MOD(RC[-6],1000)/100),Sheet1!R2C1:R8C2,2,FALSE)*RC[-5] -> 20 | I345: =R[-100]C -> 0
A346: =R[-100]C+200 -> 1632 | B346: =R[-100]C+1000 -> 63002 | C346: =R[-100]C -> 4 | D346: =R[-100]C -> 1 | E346: =R[-100]C -> 1 | F346: =R[-100]C -> 1 | G346: =R[-100]C -> 17 | H346: =VLOOKUP(INT(MOD(RC[-6],1000)/100),Sheet1!R2C1:R8C2,2,FALSE)*RC[-5] -> 20 | I346: =R[-100]C -> 0
A347: =R[-100]C+200 -> 1633 | B347: =R[-100]C+1000 -> 63101 | C347: =R[-100]C -> 4 | D347: =R[-100]C -> 1 | E347: =R[-100]C -> 1 | F347: =R[-100]C -> 1 | G347: =R[-100]C -> 17 | H347: =VLOOKUP(INT(MOD(RC[-6],1000)/100),Sheet1!R2C1:R8C2,2,FALSE)*RC[-5] -> 80 | I347: =R[-100]C -> 0
A348: =R[-100]C+200 -> 1634 | B348: =R[-100]C+1000 -> 63102 | C348: =R[-100]C -> 4 | D348: =R[-100]C -> 1 | E348: =R[-100]C -> 1 | F348: =R[-100]C -> 1 | G348: =R[-100]C -> 17 | H348: =VLOOKUP(INT(MOD(RC[-6],1000)/100),Sheet1!R2C1:R8C2,2,FALSE)*RC[-5] -> 80 | I348: =R[-100]C -> 0
A349: =R[-100]C+200 -> 1635 | B349: =R[-100]C+1000 -> 63201 | C349: =R[-100]C -> 4 | D349: =R[-100]C -> 1 | E349: =R[-100]C -> 55 | F349: =R[-100]C -> 1 | G349: =R[-100]C -> 17 | H349: =VLOOKUP(INT(MOD(RC[-6],1000)/100),Sheet1!R2C1:R8C2,2,FALSE)*RC[-5] -> 420 | I349: =R[-100]C -> 0
A350: =R[-100]C+200 -> 1636 | B350: =R[-100]C+1000 -> 63202 | C350: =R[-100]C -> 4 | D350: =R[-100]C -> 1 | E350: =R[-100]C -> 55 | F350: =R[-100]C -> 1 | G350: =R[-100]C -> 17 | H350: =VLOOKUP(INT(MOD(RC[-6],1000)/100),Sheet1!R2C1:R8C2,2,FALSE)*RC[-5] -> 420 | I350: =R[-100]C -> 0
A351: =R[-100]C+200 -> 1637 | B351: =R[-100]C+1000 -> 63301 | C351: =R[-100]C -> 4 | D351: =R[-100]C -> 1 | E351: =R[-100]C -> 60 | F351: =R[-100]C -> 1 | G351: =R[-100]C -> 17 | H351: =VLOOKUP(INT(MOD(RC[-6],1000)/100),Sheet1!R2C1:R8C2,2,FALSE)*RC[-5] -> 2080 | I351: =R[-100]C -> 0
A352: =R[-100]C+200 -> 1638 | B352: =R[-100]C+1000 -> 63302 | C352: =R[-100]C -> 4 | D352: =R[-100]C -> 1 | E352: =R[-100]C -> 60 | F352: =R[-100]C -> 1 | G352: =R[-100]C -> 17 | H352: =VLOOKUP(INT(MOD(RC[-6],1000)/100),Sheet1!R2C1:R8C2,2,FALSE)*RC[-5] -> 2080 | I352: =R[-100]C -> 0
A353: =R[-100]C+200 -> 1639 | B353: =R[-100]C+1000 -> 63401 | C353: =R[-100]C -> 4 | D353: =R[-100]C -> 1 | E353: =R[-100]C -> 70 | F353: =R[-100]C -> 1 | G353: =R[-100]C -> 17 | H353: =VLOOKUP(INT(MOD(RC[-6],1000)/100),Sheet1!R2C1:R8C2,2,FALSE)*RC[-5] -> 5420 | I353: =R[-100]C -> 1
A354: =R[-100]C+200 -> 1640 | B354: =R[-100]C+1000 -> 63402 | C354: =R[-100]C -> 4 | D354: =R[-100]C -> 1 | E354: =R[-100]C -> 70 | F354: =R[-100]C -> 1 | G354: =R[-100]C -> 17 | H354: =VLOOKUP(INT(MOD(RC[-6],1000)/100),Sheet1!R2C1:R8C2,2,FALSE)*RC[-5] -> 5420 | I354: =R[-100]C -> 1
A355: =R[-100]C+200 -> 1641 | B355: =R[-100]C+1000 -> 63001 | C355: =R[-100]C -> 5 | D355: =R[-100]C -> 1 | E355: =R[-100]C -> 1 | F355: =R[-100]C -> 1 | G355: =R[-100]C -> 17 | H355: =VLOOKUP(INT(MOD(RC[-6],1000)/100),Sheet1!R2C1:R8C2,2,FALSE)*RC[-5] -> 25 | I355: =R[-100]C -> 0
A356: =R[-100]C+200 -> 1642 | B356: =R[-100]C+1000 -> 63002 | C356: =R[-100]C -> 5 | D356: =R[-100]C -> 1 | E356: =R[-100]C -> 1 | F356: =R[-100]C -> 1 | G356: =R[-100]C -> 17 | H356: =VLOOKUP(INT(MOD(RC[-6],1000)/100),Sheet1!R2C1:R8C2,2,FALSE)*RC[-5] -> 25 | I356: =R[-100]C -> 0
A357: =R[-100]C+200 -> 1643 | B357: =R[-100]C+1000 -> 63101 | C357: =R[-100]C -> 5 | D357: =R[-100]C -> 1 | E357: =R[-100]C -> 1 | F357: =R[-100]C -> 1 | G357: =R[-100]C -> 17 | H357: =VLOOKUP(INT(MOD(RC[-6],1000)/100),Sheet1!R2C1:R8C2,2,FALSE)*RC[-5] -> 100 | I357: =R[-100]C -> 0
A358: =R[-100]C+200 -> 1644 | B358: =R[-100]C+1000 -> 63102 | C358: =R[-100]C -> 5 | D358: =R[-100]C -> 1 | E358: =R[-100]C -> 1 | F358: =R[-100]C -> 1 | G358: =R[-100]C -> 17 | H358: =VLOOKUP(INT(MOD(RC[-6],1000)/100),Sheet1!R2C1:R8C2,2,FALSE)*RC[-5] -> 100 | I358: =R[-100]C -> 0
A359: =R[-100]C+200 -> 1645 | B359: =R[-100]C+1000 -> 63201 | C359: =R[-100]C -> 5 | D359: =R[-100]C -> 1 | E359: =R[-100]C -> 55 | F359: =R[-100]C -> 1 | G359: =R[-100]C -> 17 | H359: =VLOOKUP(INT(MOD(RC[-6],1000)/100),Sheet1!R2C1:R8C2,2,FALSE)*RC[-5] -> 525 | I359: =R[-100]C -> 0
A360: =R[-100]C+200 -> 1646 | B360: =R[-100]C+1000 -> 63202 | C360: =R[-100]C -> 5 | D360: =R[-100]C -> 1 | E360: =R[-100]C -> 55 | F360: =R[-100]C -> 1 | G360: =R[-100]C -> 17 | H360: =VLOOKUP(INT(MOD(RC[-6],1000)/100),Sheet1!R2C1:R8C2,2,FALSE)*RC[-5] -> 525 | I360: =R[-100]C -> 0
A361: =R[-100]C+200 -> 1647 | B361: =R[-100]C+1000 -> 63301 | C361: =R[-100]C -> 5 | D361: =R[-100]C -> 1 | E361: =R[-100]C -> 60 | F361: =R[-100]C -> 1 | G361: =R[-100]C -> 17 | H361: =VLOOKUP(INT(MOD(RC[-6],1000)/100),Sheet1!R2C1:R8C2,2,FALSE)*RC[-5] -> 2600 | I361: =R[-100]C -> 0
A362: =R[-100]C+200 -> 1648 | B362: =R[-100]C+1000 -> 63302 | C362: =R[-100]C -> 5 | D362: =R[-100]C -> 1 | E362: =R[-100]C -> 60 | F362: =R[-100]C -> 1 | G362: =R[-100]C -> 17 | H362: =VLOOKUP(INT(MOD(RC[-6],1000)/100),Sheet1!R2C1:R8C2,2,FALSE)*RC[-5] -> 2600 | I362: =R[-100]C -> 0
A363: =R[-100]C+200 -> 1649 | B363: =R[-100]C+1000 -> 63401 | C363: =R[-100]C -> 5 | D363: =R[-100]C -> 1 | E363: =R[-100]C -> 70 | F363: =R[-100]C -> 1 | G363: =R[-100]C -> 17 | H363: =VLOOKUP(INT(MOD(RC[-6],1000)/100),Sheet1!R2C1:R8C2,2,FALSE)*RC[-5] -> 6775 | I363: =R[-100]C -> 1
A364: =R[-100]C+200 -> 1650 | B364: =R[-100]C+1000 -> 63402 | C364: =R[-100]C -> 5 | D364: =R[-100]C -> 1 | E364: =R[-100]C -> 70 | F364: =R[-100]C -> 1 | G364: =R[-100]C -> 17 | H364: =VLOOKUP(INT(MOD(RC[-6],1000)/100),Sheet1!R2C1:R8C2,2,FALSE)*RC[-5] -> 6775 | I364: =R[-100]C -> 1
A365: =R[-100]C+200 -> 1651 | B365: =R[-100]C+1000 -> 63001 | C365: =R[-100]C -> 1 | D365: =R[-100]C -> 1 | E365: =R[-100]C -> 1 | F365: =R[-100]C -> 1 | G365: =R[-100]C -> 5 | H365: =VLOOKUP(INT(MOD(RC[-6],1000)/100),Sheet1!R2C1:R8C2,2,FALSE)*RC[-5] -> 5 | I365: =R[-100]C -> 0
A366: =R[-100]C+200 -> 1652 | B366: =R[-100]C+1000 -> 63002 | C366: =R[-100]C -> 1 | D366: =R[-100]C -> 1 | E366: =R[-100]C -> 1 | F366: =R[-100]C -> 1 | G366: =R[-100]C -> 5 | H366: =VLOOKUP(INT(MOD(RC[-6],1000)/100),Sheet1!R2C1:R8C2,2,FALSE)*RC[-5] -> 5 | I366: =R[-100]C -> 0
A367: =R[-100]C+200 -> 1653 | B367: =R[-100]C+1000 -> 63101 | C367: =R[-100]C -> 1 | D367: =R[-100]C -> 1 | E367: =R[-100]C -> 1 | F367: =R[-100]C -> 1 | G367: =R[-100]C -> 5 | H367: =VLOOKUP(INT(MOD(RC[-6],1000)/100),Sheet1!R2C1:R8C2,2,FALSE)*RC[-5] -> 20 | I367: =R[-100]C -> 0
A368: =R[-100]C+200 -> 1654 | B368: =R[-100]C+1000 -> 63102 | C368: =R[-100]C -> 1 | D368: =R[-100]C -> 1 | E368: =R[-100]C -> 1 | F368: =R[-100]C -> 1 | G368: =R[-100]C -> 5 | H368: =VLOOKUP(INT(MOD(RC[-6],1000)/100),Sheet1!R2C1:R8C2,2,FALSE)*RC[-5] -> 20 | I368: =R[-100]C -> 0
A369: =R[-100]C+200 -> 1655 | B369: =R[-100]C+1000 -> 63201 | C369: =R[-100]C -> 1 | D369: =R[-100]C -> 1 | E369: =R[-100]C -> 55 | F369: =R[-100]C -> 1 | G369: =R[-100]C -> 5 | H369: =VLOOKUP(INT(MOD(RC[-6],1000)/100),Sheet1!R2C1:R8C2,2,FALSE)*RC[-5] -> 105 | I369: =R[-100]C -> 0
A370: =R[-100]C+200 -> 1656 | B370: =R[-100]C+1000 -> 63202 | C370: =R[-100]C -> 1 | D370: =R[-100]C -> 1 | E370: =R[-100]C -> 55 | F370: =R[-100]C -> 1 | G370: =R[-100]C -> 5 | H370: =VLOOKUP(INT(MOD(RC[-6],1000)/100),Sheet1!R2C1:R8C2,2,FALSE)*RC[-5] -> 105 | I370: =R[-100]C -> 0
A371: =R[-100]C+200 -> 1657 | B371: =R[-100]C+1000 -> 63301 | C371: =R[-100]C -> 1 | D371: =R[-100]C -> 1 | E371: =R[-100]C -> 60 | F371: =R[-100]C -> 1 | G371: =R[-100]C -> 5 | H371: =VLOOKUP(INT(MOD(RC[-6],1000)/100),Sheet1!R2C1:R8C2,2,FALSE)*RC[-5] -> 520 | I371: =R[-100]C -> 0
A372: =R[-100]C+200 -> 1658 | B372: =R[-100]C+1000 -> 63302 | C372: =R[-100]C -> 1 | D372: =R[-100]C -> 1 | E372: =R[-100]C -> 60 | F372: =R[-100]C -> 1 | G372: =R[-100]C -> 5 | H372: =VLOOKUP(INT(MOD(RC[-6],1000)/100),Sheet1!R2C1:R8C2,2,FALSE)*RC[-5] -> 520 | I372: =R[-100]C -> 0
A373: =R[-100]C+200 -> 1659 | B373: =R[-100]C+1000 -> 63401 | C373: =R[-100]C -> 1 | D373: =R[-100]C -> 1 | E373: =R[-100]C -> 70 | F373: =R[-100]C -> 1 | G373: =R[-100]C -> 5 | H373: =VLOOKUP(INT(MOD(RC[-6],1000)/100),Sheet1!R2C1:R8C2,2,FALSE)*RC[-5] -> 1355 | I373: =R[-100]C -> 1
A374: =R[-100]C+200 -> 1660 | B374: =R[-100]C+1000 -> 63402 | C374: =R[-100]C -> 1 | D374: =R[-100]C -> 1 | E374: =R[-100]C -> 70 | F374: =R[-100]C -> 1 | G374: =R[-100]C -> 5 | H374: =VLOOKUP(INT(MOD(RC[-6],1000)/100),Sheet1!R2C1:R8C2,2,FALSE)*RC[-5] -> 1355 | I374: =R[-100]C -> 1
A375: =R[-100]C+200 -> 1661 | B375: =R[-100]C+1000 -> 63001 | C375: =R[-100]C -> 2 | D375: =R[-100]C -> 1 | E375: =R[-100]C -> 1 | F375: =R[-100]C -> 1 | G375: =R[-100]C -> 5 | H375: =VLOOKUP(INT(MOD(RC[-6],1000)/100),Sheet1!R2C1:R8C2,2,FALSE)*RC[-5] -> 10 | I375: =R[-100]C -> 0
A376: =R[-100]C+200 -> 1662 | B376: =R[-100]C+1000 -> 63002 | C376: =R[-100]C -> 2 | D376: =R[-100]C -> 1 | E376: =R[-100]C -> 1 | F376: =R[-100]C -> 1 | G376: =R[-100]C -> 5 | H376: =VLOOKUP(INT(MOD(RC[-6],1000)/100),Sheet1!R2C1:R8C2,2,FALSE)*RC[-5] -> 10 | I376: =R[-100]C -> 0
A377: =R[-100]C+200 -> 1663 | B377: =R[-100]C+1000 -> 63101 | C377: =R[-100]C -> 2 | D377: =R[-100]C -> 1 | E377: =R[-100]C -> 1 | F377: =R[-100]C -> 1 | G377: =R[-100]C -> 5 | H377: =VLOOKUP(INT(MOD(RC[-6],1000)/100),Sheet1!R2C1:R8C2,2,FALSE)*RC[-5] -> 40 | I377: =R[-100]C -> 0
A378: =R[-100]C+200 -> 1664 | B378: =R[-100]C+1000 -> 63102 | C378: =R[-100]C -> 2 | D378: =R[-100]C -> 1 | E378: =R[-100]C -> 1 | F378: =R[-100]C -> 1 | G378: =R[-100]C -> 5 | H378: =VLOOKUP(INT(MOD(RC[-6],1000)/100),Sheet1!R2C1:R8C2,2,FALSE)*RC[-5] -> 40 | I378: =R[-100]C -> 0
A379: =R[-100]C+200 -> 1665 | B379: =R[-100]C+1000 -> 63201 | C379: =R[-100]C -> 2 | D379: =R[-100]C -> 1 | E379: =R[-100]C -> 55 | F379: =R[-100]C -> 1 | G379: =R[-100]C -> 5 | H379: =VLOOKUP(INT(MOD(RC[-6],1000)/100),Sheet1!R2C1:R8C2,2,FALSE)*RC[-5] -> 210 | I379: =R[-100]C -> 0
A380: =R[-100]C+200 -> 1666 | B380: =R[-100]C+1000 -> 63202 | C380: =R[-100]C -> 2 | D380: =R[-100]C -> 1 | E380: =R[-100]C -> 55 | F380: =R[-100]C -> 1 | G380: =R[-100]C -> 5 | H380: =VLOOKUP(INT(MOD(RC[-6],1000)/100),Sheet1!R2C1:R8C2,2,FALSE)*RC[-5] -> 210 | I380: =R[-100]C -> 0
A381: =R[-100]C+200 -> 1667 | B381: =R[-100]C+1000 -> 63301 | C381: =R[-100]C -> 2 | D381: =R[-100]C -> 1 | E381: =R[-100]C -> 60 | F381: =R[-100]C -> 1 | G381: =R[-100]C -> 5 | H381: =VLOOKUP(INT(MOD(RC[-6],1000)/100),Sheet1!R2C1:R8C2,2,FALSE)*RC[-5] -> 1040 | I381: =R[-100]C -> 0
A382: =R[-100]C+200 -> 1668 | B382: =R[-100]C+1000 -> 63302 | C382: =R[-100]C -> 2 | D382: =R[-100]C -> 1 | E382: =R[-100]C -> 60 | F382: =R[-100]C -> 1 | G382: =R[-100]C -> 5 | H382: =VLOOKUP(INT(MOD(RC[-6],1000)/100),Sheet1!R2C1:R8C2,2,FALSE)*RC[-5] -> 1040 | I382: =R[-100]C -> 0
A383: =R[-100]C+200 -> 1669 | B383: =R[-100]C+1000 -> 63401 | C383: =R[-100]C -> 2 | D383: =R[-100]C -> 1 | E383: =R[-100]C -> 70 | F383: =R[-100]C -> 1 | G383: =R[-100]C -> 5 | H383: =VLOOKUP(INT(MOD(RC[-6],1000)/100),Sheet1!R2C1:R8C2,2,FALSE)*RC[-5] -> 2710 | I383: =R[-100]C -> 1
A384: =R[-100]C+200 -> 1670 | B384: =R[-100]C+1000 -> 63402 | C384: =R[-100]C -> 2 | D384: =R[-100]C -> 1 | E384: =R[-100]C -> 70 | F384: =R[-100]C -> 1 | G384: =R[-100]C -> 5 | H384: =VLOOKUP(INT(MOD(RC[-6],1000)/100),Sheet1!R2C1:R8C2,2,FALSE)*RC[-5] -> 2710 | I384: =R[-100]C -> 1
A385: =R[-100]C+200 -> 1671 | B385: =R[-100]C+1000 -> 63001 | C385: =R[-100]C -> 3 | D385: =R[-100]C -> 1 | E385: =R[-100]C -> 1 | F385: =R[-100]C -> 1 | G385: =R[-100]C -> 5 | H385: =VLOOKUP(INT(MOD(RC[-6],1000)/100),Sheet1!R2C1:R8C2,2,FALSE)*RC[-5] -> 15 | I385: =R[-100]C -> 0
A386: =R[-100]C+200 -> 1672 | B386: =R[-100]C+1000 -> 63002 | C386: =R[-100]C -> 3 | D386: =R[-100]C -> 1 | E386: =R[-100]C -> 1 | F386: =R[-100]C -> 1 | G386: =R[-100]C -> 5 | H386: =VLOOKUP(INT(MOD(RC[-6],1000)/100),Sheet1!R2C1:R8C2,2,FALSE)*RC[-5] -> 15 | I386: =R[-100]C -> 0
A387: =R[-100]C+200 -> 1673 | B387: =R[-100]C+1000 -> 63101 | C387: =R[-100]C -> 3 | D387: =R[-100]C -> 1 | E387: =R[-100]C -> 1 | F387: =R[-100]C -> 1 | G387: =R[-100]C -> 5 | H387: =VLOOKUP(INT(MOD(RC[-6],1000)/100),Sheet1!R2C1:R8C2,2,FALSE)*RC[-5] -> 60 | I387: =R[-100]C -> 0
A388: =R[-100]C+200 -> 1674 | B388: =R[-100]C+1000 -> 63102 | C388: =R[-100]C -> 3 | D388: =R[-100]C -> 1 | E388: =R[-100]C -> 1 | F388: =R[-100]C -> 1 | G388: =R[-100]C -> 5 | H388: =VLOOKUP(INT(MOD(RC[-6],1000)/100),Sheet1!R2C1:R8C2,2,FALSE)*RC[-5] -> 60 | I388: =R[-100]C -> 0
A389: =R[-100]C+200 -> 1675 | B389: =R[-100]C+1000 -> 63201 | C389: =R[-100]C -> 3 | D389: =R[-100]C -> 1 | E389: =R[-100]C -> 55 | F389: =R[-100]C -> 1 | G389: =R[-100]C -> 5 | H389: =VLOOKUP(INT(MOD(RC[-6],1000)/100),Sheet1!R2C1:R8C2,2,FALSE)*RC[-5] -> 315 | I389: =R[-100]C -> 0
A390: =R[-100]C+200 -> 1676 | B390: =R[-100]C+1000 -> 63202 | C390: =R[-100]C -> 3 | D390: =R[-100]C -> 1 | E390: =R[-100]C -> 55 | F390: =R[-100]C -> 1 | G390: =R[-100]C -> 5 | H390: =VLOOKUP(INT(MOD(RC[-6],1000)/100),Sheet1!R2C1:R8C2,2,FALSE)*RC[-5] -> 315 | I390: =R[-100]C -> 0
A391: =R[-100]C+200 -> 1677 | B391: =R[-100]C+1000 -> 63301 | C391: =R[-100]C -> 3 | D391: =R[-100]C -> 1 | E391: =R[-100]C -> 60 | F391: =R[-100]C -> 1 | G391: =R[-100]C -> 5 | H391: =VLOOKUP(INT(MOD(RC[-6],1000)/100),Sheet1!R2C1:R8C2,2,FALSE)*RC[-5] -> 1560 | I391: =R[-100]C -> 0
A392: =R[-100]C+200 -> 1678 | B392: =R[-100]C+1000 -> 63302 | C392: =R[-100]C -> 3 | D392: =R[-100]C -> 1 | E392: =R[-100]C -> 60 | F392: =R[-100]C -> 1 | G392: =R[-100]C -> 5 | H392: =VLOOKUP(INT(MOD(RC[-6],1000)/100),Sheet1!R2C1:R8C2,2,FALSE)*RC[-5] -> 1560 | I392: =R[-100]C -> 0
A393: =R[-100]C+200 -> 1679 | B393: =R[-100]C+1000 -> 63401 | C393: =R[-100]C -> 3 | D393: =R[-100]C -> 1 | E393: =R[-100]C -> 70 | F393: =R[-100]C -> 1 | G393: =R[-100]C -> 5 | H393: =VLOOKUP(INT(MOD(RC[-6],1000)/100),Sheet1!R2C1:R8C2,2,FALSE)*RC[-5] -> 4065 | I393: =R[-100]C -> 1
A394: =R[-100]C+200 -> 1680 | B394: =R[-100]C+1000 -> 63402 | C394: =R[-100]C -> 3 | D394: =R[-100]C -> 1 | E394: =R[-100]C -> 70 | F394: =R[-100]C -> 1 | G394: =R[-100]C -> 5 | H394: =VLOOKUP(INT(MOD(RC[-6],1000)/100),Sheet1!R2C1:R8C2,2,FALSE)*RC[-5] -> 4065 | I394: =R[-100]C -> 1
A395: =R[-100]C+200 -> 1681 | B395: =R[-100]C+1000 -> 63001 | C395: =R[-100]C -> 4 | D395: =R[-100]C -> 1 | E395: =R[-100]C -> 1 | F395: =R[-100]C -> 1 | G395: =R[-100]C -> 5 | H395: =VLOOKUP(INT(MOD(RC[-6],1000)/100),Sheet1!R2C1:R8C2,2,FALSE)*RC[-5] -> 20 | I395: =R[-100]C -> 0
A396: =R[-100]C+200 -> 1682 | B396: =R[-100]C+1000 -> 63002 | C396: =R[-100]C -> 4 | D396: =R[-100]C -> 1 | E396: =R[-100]C -> 1 | F396: =R[-100]C -> 1 | G396: =R[-100]C -> 5 | H396: =VLOOKUP(INT(MOD(RC[-6],1000)/100),Sheet1!R2C1:R8C2,2,FALSE)*RC[-5] -> 20 | I396: =R[-100]C -> 0
A397: =R[-100]C+200 -> 1683 | B397: =R[-100]C+1000 -> 63101 | C397: =R[-100]C -> 4 | D397: =R[-100]C -> 1 | E397: =R[-100]C -> 1 | F397: =R[-100]C -> 1 | G397: =R[-100]C -> 5 | H397: =VLOOKUP(INT(MOD(RC[-6],1000)/100),Sheet1!R2C1:R8C2,2,FALSE)*RC[-5] -> 80 | I397: =R[-100]C -> 0
A398: =R[-100]C+200 -> 1684 | B398: =R[-100]C+1000 -> 63102 | C398: =R[-100]C -> 4 | D398: =R[-100]C -> 1 | E398: =R[-100]C -> 1 | F398: =R[-100]C -> 1 | G398: =R[-100]C -> 5 | H398: =VLOOKUP(INT(MOD(RC[-6],1000)/100),Sheet1!R2C1:R8C2,2,FALSE)*RC[-5] -> 80 | I398: =R[-100]C -> 0
A399: =R[-100]C+200 -> 1685 | B399: =R[-100]C+1000 -> 63201 | C399: =R[-100]C -> 4 | D399: =R[-100]C -> 1 | E399: =R[-100]C -> 55 | F399: =R[-100]C -> 1 | G399: =R[-100]C -> 5 | H399: =VLOOKUP(INT(MOD(RC[-6],1000)/100),Sheet1!R2C1:R8C2,2,FALSE)*RC[-5] -> 420 | I399: =R[-100]C -> 0
A400: =R[-100]C+200 -> 1686 | B400: =R[-100]C+1000 -> 63202 | C400: =R[-100]C -> 4 | D400: =R[-100]C -> 1 | E400: =R[-100]C -> 55 | F400: =R[-100]C -> 1 | G400: =R[-100]C -> 5 | H400: =VLOOKUP(INT(MOD(RC[-6],1000)/100),Sheet1!R2C1:R8C2,2,FALSE)*RC[-5] -> 420 | I400: =R[-100]C -> 0
A401: =R[-100]C+200 -> 1687 | B401: =R[-100]C+1000 -> 63301 | C401: =R[-100]C -> 4 | D401: =R[-100]C -> 1 | E401: =R[-100]C -> 60 | F401: =R[-100]C -> 1 | G401: =R[-100]C -> 5 | H401: =VLOOKUP(INT(MOD(RC[-6],1000)/100),Sheet1!R2C1:R8C2,2,FALSE)*RC[-5] -> 2080 | I401: =R[-100]C -> 0
A402: =R[-100]C+200 -> 1688 | B402: =R[-100]C+1000 -> 63302 | C402: =R[-100]C -> 4 | D402: =R[-100]C -> 1 | E402: =R[-100]C -> 60 | F402: =R[-100]C -> 1 | G402: =R[-100]C -> 5 | H402: =VLOOKUP(INT(MOD(RC[-6],1000)/100),Sheet1!R2C1:R8C2,2,FALSE)*RC[-5] -> 2080 | I402: =R[-100]C -> 0
A403: =R[-100]C+200 -> 1689 | B403: =R[-100]C+1000 -> 63401 | C403: =R[-100]C -> 4 | D403: =R[-100]C -> 1 | E403: =R[-100]C -> 70 | F403: =R[-100]C -> 1 | G403: =R[-100]C -> 5 | H403: =VLOOKUP(INT(MOD(RC[-6],1000)/100),Sheet1!R2C1:R8C2,2,FALSE)*RC[-5] -> 5420 | I403: =R[-100]C -> 1
A404: =R[-100]C+200 -> 1690 | B404: =R[-100]C+1000 -> 63402 | C404: =R[-100]C -> 4 | D404: =R[-100]C -> 1 | E404: =R[-100]C -> 70 | F404: =R[-100]C -> 1 | G404: =R[-100]C -> 5 | H404: =VLOOKUP(INT(MOD(RC[-6],1000)/100),Sheet1!R2C1:R8C2,2,FALSE)*RC[-5] -> 5420 | I404: =R[-100]C -> 1
A405: =R[-100]C+200 -> 1691 | B405: =R[-100]C+1000 -> 63001 | C405: =R[-100]C -> 5 | D405: =R[-100]C -> 1 | E405: =R[-100]C -> 1 | F405: =R[-100]C -> 1 | G405: =R[-100]C -> 5 | H405: =VLOOKUP(INT(MOD(RC[-6],1000)/100),Sheet1!R2C1:R8C2,2,FALSE)*RC[-5] -> 25 | I405: =R[-100]C -> 0
A406: =R[-100]C+200 -> 1692 | B406: =R[-100]C+1000 -> 63002 | C406: =R[-100]C -> 5 | D406: =R[-100]C -> 1 | E406: =R[-100]C -> 1 | F406: =R[-100]C -> 1 | G406: =R[-100]C -> 5 | H406: =VLOOKUP(INT(MOD(RC[-6],1000)/100),Sheet1!R2C1:R8C2,2,FALSE)*RC[-5] -> 25 | I406: =R[-100]C -> 0
A407: =R[-100]C+200 -> 1693 | B407: =R[-100]C+1000 -> 63101 | C407: =R[-100]C -> 5 | D407: =R[-100]C -> 1 | E407: =R[-100]C -> 1 | F407: =R[-100]C -> 1 | G407: =R[-100]C -> 5 | H407: =VLOOKUP(INT(MOD(RC[-6],1000)/100),Sheet1!R2C1:R8C2,2,FALSE)*RC[-5] -> 100 | I407: =R[-100]C -> 0
A408: =R[-100]C+200 -> 1694 | B408: =R[-100]C+1000 -> 63102 | C408: =R[-100]C -> 5 | D408: =R[-100]C -> 1 | E408: =R[-100]C -> 1 | F408: =R[-100]C -> 1 | G408: =R[-100]C -> 5 | H408: =VLOOKUP(INT(MOD(RC[-6],1000)/100),Sheet1!R2C1:R8C2,2,FALSE)*RC[-5] -> 100 | I408: =R[-100]C -> 0
A409: =R[-100]C+200 -> 1695 | B409: =R[-100]C+1000 -> 63201 | C409: =R[-100]C -> 5 | D409: =R[-100]C -> 1 | E409: =R[-100]C -> 55 | F409: =R[-100]C -> 1 | G409: =R[-100]C -> 5 | H409: =VLOOKUP(INT(MOD(RC[-6],1000)/100),Sheet1!R2C1:R8C2,2,FALSE)*RC[-5] -> 525 | I409: =R[-100]C -> 0
A410: =R[-100]C+200 -> 1696 | B410: =R[-100]C+1000 -> 63202 | C410: =R[-100]C -> 5 | D410: =R[-100]C -> 1 | E410: =R[-100]C -> 55 | F410: =R[-100]C -> 1 | G410: =R[-100]C -> 5 | H410: =VLOOKUP(INT(MOD(RC[-6],1000)/100),Sheet1!R2C1:R8C2,2,FALSE)*RC[-5] -> 525 | I410: =R[-100]C -> 0
A411: =R[-100]C+200 -> 1697 | B411: =R[-100]C+1000 -> 63301 | C411: =R[-100]C -> 5 | D411: =R[-100]C -> 1 | E411: =R[-100]C -> 60 | F411: =R[-100]C -> 1 | G411: =R[-100]C -> 5 | H411: =VLOOKUP(INT(MOD(RC[-6],1000)/100),Sheet1!R2C1:R8C2,2,FALSE)*RC[-5] -> 2600 | I411: =R[-100]C -> 0
A412: =R[-100]C+200 -> 1698 | B412: =R[-100]C+1000 -> 63302 | C412: =R[-100]C -> 5 | D412: =R[-100]C -> 1 | E412: =R[-100]C -> 60 | F412: =R[-100]C -> 1 | G412: =R[-100]C -> 5 | H412: =VLOOKUP(INT(MOD(RC[-6],1000)/100),Sheet1!R2C1:R8C2,2,FALSE)*RC[-5] -> 2600 | I412: =R[-100]C -> 0
A413: =R[-100]C+200 -> 1699 | B413: =R[-100]C+1000 -> 63401 | C413: =R[-100]C -> 5 | D413: =R[-100]C -> 1 | E413: =R[-100]C -> 70 | F413: =R[-100]C -> 1 | G413: =R[-100]C -> 5 | H413: =VLOOKUP(INT(MOD(RC[-6],1000)/100),Sheet1!R2C1:R8C2,2,FALSE)*RC[-5] -> 6775 | I413: =R[-100]C -> 1
A414: =R[-100]C+200 -> 1700 | B414: =R[-100]C+1000 -> 63402 | C414: =R[-100]C -> 5 | D414: =R[-100]C -> 1 | E414: =R[-100]C -> 70 | F414: =R[-100]C -> 1 | G414: =R[-100]C -> 5 | H414: =VLOOKUP(INT(MOD(RC[-6],1000)/100),Sheet1!R2C1:R8C2,2,FALSE)*RC[-5] -> 6775 | I414: =R[-100]C -> 1

Sheet: Sheet1
A2: 品质 | B2: 单价
A3: 0 | B3: 5
A4: 1 | B4: 20
A5: 2 | B5: 105
A6: 3 | B6: 520
A7: 4 | B7: 1355
A8: 5 | B8: 4270