Sheet: 配置
A1: 服务端文件名 | B1: 服务端对应工作表号 | C1: 客户端文件名 | D1: 客户端对应工作表号 | E1: erl头部 | F1: erl内容格式 | G1: erl尾部 | H1: 客户端特殊处理
A2: config_awakening_item.txt | B2: 1 | C2: config_awakening_item.cnf|AwakeningItem | D2: 1 | F2: get(id) -> #$ | H2: 2=>id

Sheet: 觉醒物品
A1: id|id | B1: name| | C1: des| | D1: res_id| | E1: quality|quality | F1: compose_item_id_list|compose_item_id_list | G1: compose_item_num_list|compose_item_num_list | H1: cost_money|cost_money | I1: god_soul|god_soul | J1: pro_type_list|pro_type_list | K1: pro_value_list|pro_value_list | L1: systemid|
A2: 不可空 | B2: 不可空 | C2: 不可空 | D2: 不可空 | E2: 不可空 | F2: 可空#不需字段 | G2: 可空#不需字段 | H2: 可空#不需字段 | I2: 不可空 | J2: 可空#不需字段 | K2: 可空#不需字段 | L2: 可空#不需字段
A3: 数字 | B3: 字符串 | C3: 字符串 | D3: 数字 | E3: 数字 | F3: 一维数组 | G3: 一维数组 | H3: 一维数组 | I3: 数字 | J3: 一维数组 | K3: 一维数组 | L3: 一维数组
F4: 不定长 | G4: 不定长 | H4: 不定长 | J4: 不定长 | K4: 不定长 | L4: 不定长
A6: 物品ID | B6: 物品名称 | C6: 物品描述 | D6: 资源ID | E6: 物品品质 | F6: 合成需要的物品Id列表 | G6: 合成需要的物品数量列表 | H6: 合成需要的货币 | I6: 分解后获得神魂 | J6: 影响的属性类型列表 | K6: 影响的属性值列表 | L6: 获取途径系统ID
A7: 60001 | B7: 风之页 | C7: <COLOR VALUE=FF00ff4e>记录了风之气息的书页</COLOR><BR>1级觉醒道具 | D7: 60001 | E7: =INT(MOD(RC[-4],1000)/100) -> 0 | I7: 5 | J7: 4|1|2|3 | K7: =VLOOKUP(MID(RC[-10],2,2),Sheet1!R2C3:R26C7,2,FALSE)&"|"&VLOOKUP(MID(RC[-10],2,2),Sheet1!R2C3:R26C7,3,FALSE)&"|"&VLOOKUP(MID(RC[-10],2,2),Sheet1!R2C3:R26C7,4,FALSE)&"|"&VLOOKUP(MID(RC[-10],2,2),Sheet1!R2C3:R26C7,5,FALSE) -> 60|3|3|3 | L7: 28|46
A8: 60002 | B8: 风之石 | C8: <COLOR VALUE=FF00ff4e>储存了风之气息的石头</COLOR><BR>1级觉醒道具 | D8: 60002 | E8: =INT(MOD(RC[-4],1000)/100) -> 0 | I8: 5 | J8: 4|1|2|3 | K8: =VLOOKUP(MID(RC[-10],2,2),Sheet1!R2C3:R26C7,2,FALSE)&"|"&VLOOKUP(MID(RC[-10],2,2),Sheet1!R2C3:R26C7,3,FALSE)&"|"&VLOOKUP(MID(RC[-10],2,2),Sheet1!R2C3:R26C7,4,FALSE)&"|"&VLOOKUP(MID(RC[-10],2,2),Sheet1!R2C3:R26C7,5,FALSE) -> 60|3|3|3 | L8: 28|46
A9: =R[-2]C+100 -> 60101 | B9: 疾风之页 | C9: <COLOR VALUE=FF00ff4e>记录了疾风气息的书页</COLOR><BR>2级觉醒道具 | D9: =R[-2]C+100 -> 60101 | E9: =INT(MOD(RC[-4],1000)/100) -> 1 | F9: =R[-2]C[-5]&"|"&R[-1]C[-5] -> 60001|60002 | G9: 2|2 | H9: 3|100 | I9: 20 | J9: 4|1|2|3 | K9: =VLOOKUP(MID(RC[-10],2,2),Sheet1!R2C3:R26C7,2,FALSE)&"|"&VLOOKUP(MID(RC[-10],2,2),Sheet1!R2C3:R26C7,3,FALSE)&"|"&VLOOKUP(MID(RC[-10],2,2),Sheet1!R2C3:R26C7,4,FALSE)&"|"&VLOOKUP(MID(RC[-10],2,2),Sheet1!R2C3:R26C7,5,FALSE) -> 160|8|8|8 | L9: 28|46
A10: =R[-2]C+100 -> 60102 | B10: 疾风之石 | C10: <COLOR VALUE=FF00ff4e>储存了疾风气息的石头</COLOR><BR>2级觉醒道具 | D10: =R[-2]C+100 -> 60102 | E10: =INT(MOD(RC[-4],1000)/100) -> 1 | F10: =R[-3]C[-5]&"|"&R[-2]C[-5] -> 60001|60002 | G10: 2|2 | H10: 3|100 | I10: 20 | J10: 4|1|2|3 | K10: =VLOOKUP(MID(RC[-10],2,2),Sheet1!R2C3:R26C7,2,FALSE)&"|"&VLOOKUP(MID(RC[-10],2,2),Sheet1!R2C3:R26C7,3,FALSE)&"|"&VLOOKUP(MID(RC[-10],2,2),Sheet1!R2C3:R26C7,4,FALSE)&"|"&VLOOKUP(MID(RC[-10],2,2),Sheet1!R2C3:R26C7,5,FALSE) -> 160|8|8|8 | L10: 28|46
A11: =R[-2]C+100 -> 60201 | B11: 烈风之书 | C11: <COLOR VALUE=FF00ff4e>记录了烈风气息的书籍</COLOR><BR>3级觉醒道具 | D11: =R[-2]C+100 -> 60201 | E11: =INT(MOD(RC[-4],1000)/100) -> 2 | F11: =R[-2]C[-5]&"|"&R[-1]C[-5]&"|"&R[-4]C[-5] -> 60101|60102|60001 | G11: 2|2|5 | H11: 3|100 | I11: 105 | J11: 4|1|2|3 | K11: =VLOOKUP(MID(RC[-10],2,2),Sheet1!R2C3:R26C7,2,FALSE)&"|"&VLOOKUP(MID(RC[-10],2,2),Sheet1!R2C3:R26C7,3,FALSE)&"|"&VLOOKUP(MID(RC[-10],2,2),Sheet1!R2C3:R26C7,4,FALSE)&"|"&VLOOKUP(MID(RC[-10],2,2),Sheet1!R2C3:R26C7,5,FALSE) -> 400|20|20|20 | L11: 28|46
A12: =R[-2]C+100 -> 60202 | B12: 烈风之晶 | C12: <COLOR VALUE=FF00ff4e>储存了烈风气息的晶石</COLOR><BR>3级觉醒道具 | D12: =R[-2]C+100 -> 60202 | E12: =INT(MOD(RC[-4],1000)/100) -> 2 | F12: =R[-3]C[-5]&"|"&R[-2]C[-5]&"|"&R[-4]C[-5] -> 60101|60102|60002 | G12: 2|2|5 | H12: 3|100 | I12: 105 | J12: 4|1|2|3 | K12: =VLOOKUP(MID(RC[-10],2,2),Sheet1!R2C3:R26C7,2,FALSE)&"|"&VLOOKUP(MID(RC[-10],2,2),Sheet1!R2C3:R26C7,3,FALSE)&"|"&VLOOKUP(MID(RC[-10],2,2),Sheet1!R2C3:R26C7,4,FALSE)&"|"&VLOOKUP(MID(RC[-10],2,2),Sheet1!R2C3:R26C7,5,FALSE) -> 400|20|20|20 | L12: 28|46
A13: =R[-2]C+100 -> 60301 | B13: 狂风之书 | C13: <COLOR VALUE=FF00ff4e>记录了狂风气息的书籍</COLOR><BR>4级觉醒道具 | D13: =R[-2]C+100 -> 60301 | E13: =INT(MOD(RC[-4],1000)/100) -> 3 | F13: =R[-2]C[-5]&"|"&R[-1]C[-5]&"|"&R[-4]C[-5] -> 60201|60202|60101 | G13: 2|2|5 | H13: 3|100 | I13: 520 | J13: 4|1|2|3 | K13: =VLOOKUP(MID(RC[-10],2,2),Sheet1!R2C3:R26C7,2,FALSE)&"|"&VLOOKUP(MID(RC[-10],2,2),Sheet1!R2C3:R26C7,3,FALSE)&"|"&VLOOKUP(MID(RC[-10],2,2),Sheet1!R2C3:R26C7,4,FALSE)&"|"&VLOOKUP(MID(RC[-10],2,2),Sheet1!R2C3:R26C7,5,FALSE) -> 900|45|45|45 | L13: 28|46
A14: =R[-2]C+100 -> 60302 | B14: 狂风之晶 | C14: <COLOR VALUE=FF00ff4e>储存了狂风气息的晶石</COLOR><BR>4级觉醒道具 | D14: =R[-2]C+100 -> 60302 | E14: =INT(MOD(RC[-4],1000)/100) -> 3 | F14: =R[-3]C[-5]&"|"&R[-2]C[-5]&"|"&R[-4]C[-5] -> 60201|60202|60102 | G14: 2|2|5 | H14: 3|100 | I14: 520 | J14: 4|1|2|3 | K14: =VLOOKUP(MID(RC[-10],2,2),Sheet1!R2C3:R26C7,2,FALSE)&"|"&VLOOKUP(MID(RC[-10],2,2),Sheet1!R2C3:R26C7,3,FALSE)&"|"&VLOOKUP(MID(RC[-10],2,2),Sheet1!R2C3:R26C7,4,FALSE)&"|"&VLOOKUP(MID(RC[-10],2,2),Sheet1!R2C3:R26C7,5,FALSE) -> 900|45|45|45 | L14: 28|46
A15: =R[-2]C+100 -> 60401 | B15: 暴风圣经 | C15: <COLOR VALUE=FF00ff4e>记录了暴风精髓的圣经</COLOR><BR>5级觉醒道具 | D15: =R[-2]C+100 -> 60401 | E15: =INT(MOD(RC[-4],1000)/100) -> 4 | F15: =R[-2]C[-5]&"|"&R[-1]C[-5]&"|"&R[-4]C[-5] -> 60301|60302|60201 | G15: 1|1|3 | H15: 3|100 | I15: 1355 | J15: 4|1|2|3 | K15: =VLOOKUP(MID(RC[-10],2,2),Sheet1!R2C3:R26C7,2,FALSE)&"|"&VLOOKUP(MID(RC[-10],2,2),Sheet1!R2C3:R26C7,3,FALSE)&"|"&VLOOKUP(MID(RC[-10],2,2),Sheet1!R2C3:R26C7,4,FALSE)&"|"&VLOOKUP(MID(RC[-10],2,2),Sheet1!R2C3:R26C7,5,FALSE) -> 2200|110|110|110 | L15: 28|46
A16: =R[-2]C+100 -> 60402 | B16: 暴风宝石 | C16: <COLOR VALUE=FF00ff4e>储存了暴风精髓的宝石</COLOR><BR>5级觉醒道具 | D16: =R[-2]C+100 -> 60402 | E16: =INT(MOD(RC[-4],1000)/100) -> 4 | F16: =R[-3]C[-5]&"|"&R[-2]C[-5]&"|"&R[-4]C[-5] -> 60301|60302|60202 | G16: 1|1|3 | H16: 3|100 | I16: 1355 | J16: 4|1|2|3 | K16: =VLOOKUP(MID(RC[-10],2,2),Sheet1!R2C3:R26C7,2,FALSE)&"|"&VLOOKUP(MID(RC[-10],2,2),Sheet1!R2C3:R26C7,3,FALSE)&"|"&VLOOKUP(MID(RC[-10],2,2),Sheet1!R2C3:R26C7,4,FALSE)&"|"&VLOOKUP(MID(RC[-10],2,2),Sheet1!R2C3:R26C7,5,FALSE) -> 2200|110|110|110 | L16: 28|46
A17: =R[-2]C+100 -> 60501 | B17: 飓风神典 | C17: <COLOR VALUE=FF00ff4e>记录了飓风法则的神典</COLOR><BR>6级觉醒道具 | D17: =R[-2]C+100 -> 60501 | E17: =INT(MOD(RC[-4],1000)/100) -> 5 | F17: =R[-2]C[-5]&"|"&R[-1]C[-5]&"|"&R[-4]C[-5] -> 60401|60402|60301 | G17: 1|1|3 | H17: 3|100 | I17: 4270 | J17: 4|1|2|3 | K17: =VLOOKUP(MID(RC[-10],2,2),Sheet1!R2C3:R26C7,2,FALSE)&"|"&VLOOKUP(MID(RC[-10],2,2),Sheet1!R2C3:R26C7,3,FALSE)&"|"&VLOOKUP(MID(RC[-10],2,2),Sheet1!R2C3:R26C7,4,FALSE)&"|"&VLOOKUP(MID(RC[-10],2,2),Sheet1!R2C3:R26C7,5,FALSE) -> 5200|260|260|260 | L17: 28|46
A18: =R[-2]C+100 -> 60502 | B18: 飓风神石 | C18: <COLOR VALUE=FF00ff4e>储存了飓风法则的神石</COLOR><BR>6级觉醒道具 | D18: =R[-2]C+100 -> 60502 | E18: =INT(MOD(RC[-4],1000)/100) -> 5 | F18: =R[-3]C[-5]&"|"&R[-2]C[-5]&"|"&R[-4]C[-5] -> 60401|60402|60302 | G18: 1|1|3 | H18: 3|100 | I18: 4270 | J18: 4|1|2|3 | K18: =VLOOKUP(MID(RC[-10],2,2),Sheet1!R2C3:R26C7,2,FALSE)&"|"&VLOOKUP(MID(RC[-10],2,2),Sheet1!R2C3:R26C7,3,FALSE)&"|"&VLOOKUP(MID(RC[-10],2,2),Sheet1!R2C3:R26C7,4,FALSE)&"|"&VLOOKUP(MID(RC[-10],2,2),Sheet1!R2C3:R26C7,5,FALSE) -> 5200|260|260|260 | L18: 28|46
A19: =R[-12]C+1000 -> 61001 | B19: 土之页 | C19: <COLOR VALUE=FFb3671d>记录了土之气息的书页</COLOR><BR>1级觉醒道具 | D19: =R[-12]C+1000 -> 61001 | E19: =INT(MOD(RC[-4],1000)/100) -> 0 | I19: 5 | J19: 4|1|2|3 | K19: =VLOOKUP(MID(RC[-10],2,2),Sheet1!R2C3:R26C7,2,FALSE)&"|"&VLOOKUP(MID(RC[-10],2,2),Sheet1!R2C3:R26C7,3,FALSE)&"|"&VLOOKUP(MID(RC[-10],2,2),Sheet1!R2C3:R26C7,4,FALSE)&"|"&VLOOKUP(MID(RC[-10],2,2),Sheet1!R2C3:R26C7,5,FALSE) -> 30|6|3|3 | L19: 28|46
A20: =R[-12]C+1000 -> 61002 | B20: 土之石 | C20: <COLOR VALUE=FFb3671d>储存了土之气息的石头</COLOR><BR>1级觉醒道具 | D20: =R[-12]C+1000 -> 61002 | E20: =INT(MOD(RC[-4],1000)/100) -> 0 | I20: 5 | J20: 4|1|2|3 | K20: =VLOOKUP(MID(RC[-10],2,2),Sheet1!R2C3:R26C7,2,FALSE)&"|"&VLOOKUP(MID(RC[-10],2,2),Sheet1!R2C3:R26C7,3,FALSE)&"|"&VLOOKUP(MID(RC[-10],2,2),Sheet1!R2C3:R26C7,4,FALSE)&"|"&VLOOKUP(MID(RC[-10],2,2),Sheet1!R2C3:R26C7,5,FALSE) -> 30|6|3|3 | L20: 28|46
A21: =R[-12]C+1000 -> 61101 | B21: 土壤之页 | C21: <COLOR VALUE=FFb3671d>记录了土壤气息的书页</COLOR><BR>2级觉醒道具 | D21: =R[-12]C+1000 -> 61101 | E21: =INT(MOD(RC[-4],1000)/100) -> 1 | F21: =R[-2]C[-5]&"|"&R[-1]C[-5] -> 61001|61002 | G21: 2|2 | H21: 3|100 | I21: 20 | J21: 4|1|2|3 | K21: =VLOOKUP(MID(RC[-10],2,2),Sheet1!R2C3:R26C7,2,FALSE)&"|"&VLOOKUP(MID(RC[-10],2,2),Sheet1!R2C3:R26C7,3,FALSE)&"|"&VLOOKUP(MID(RC[-10],2,2),Sheet1!R2C3:R26C7,4,FALSE)&"|"&VLOOKUP(MID(RC[-10],2,2),Sheet1!R2C3:R26C7,5,FALSE) -> 80|16|8|8 | L21: 28|46
A22: =R[-12]C+1000 -> 61102 | B22: 土壤之石 | C22: <COLOR VALUE=FFb3671d>储存了土壤气息的石头</COLOR><BR>2级觉醒道具 | D22: =R[-12]C+1000 -> 61102 | E22: =INT(MOD(RC[-4],1000)/100) -> 1 | F22: =R[-3]C[-5]&"|"&R[-2]C[-5] -> 61001|61002 | G22: 2|2 | H22: 3|100 | I22: 20 | J22: 4|1|2|3 | K22: =VLOOKUP(MID(RC[-10],2,2),Sheet1!R2C3:R26C7,2,FALSE)&"|"&VLOOKUP(MID(RC[-10],2,2),Sheet1!R2C3:R26C7,3,FALSE)&"|"&VLOOKUP(MID(RC[-10],2,2),Sheet1!R2C3:R26C7,4,FALSE)&"|"&VLOOKUP(MID(RC[-10],2,2),Sheet1!R2C3:R26C7,5,FALSE) -> 80|16|8|8 | L22: 28|46
A23: =R[-12]C+1000 -> 61201 | B23: 丘陵之书 | C23: <COLOR VALUE=FFb3671d>记录了丘陵气息的书籍</COLOR><BR>3级觉醒道具 | D23: =R[-12]C+1000 -> 61201 | E23: =INT(MOD(RC[-4],1000)/100) -> 2 | F23: =R[-2]C[-5]&"|"&R[-1]C[-5]&"|"&R[-4]C[-5] -> 61101|61102|61001 | G23: 2|2|5 | H23: 3|100 | I23: 105 | J23: 4|1|2|3 | K23: =VLOOKUP(MID(RC[-10],2,2),Sheet1!R2C3:R26C7,2,FALSE)&"|"&VLOOKUP(MID(RC[-10],2,2),Sheet1!R2C3:R26C7,3,FALSE)&"|"&VLOOKUP(MID(RC[-10],2,2),Sheet1!R2C3:R26C7,4,FALSE)&"|"&VLOOKUP(MID(RC[-10],2,2),Sheet1!R2C3:R26C7,5,FALSE) -> 200|40|20|20 | L23: 28|46
A24: =R[-12]C+1000 -> 61202 | B24: 丘陵之晶 | C24: <COLOR VALUE=FFb3671d>储存了丘陵气息的晶石</COLOR><BR>3级觉醒道具 | D24: =R[-12]C+1000 -> 61202 | E24: =INT(MOD(RC[-4],1000)/100) -> 2 | F24: =R[-3]C[-5]&"|"&R[-2]C[-5]&"|"&R[-4]C[-5] -> 61101|61102|61002 | G24: 2|2|5 | H24: 3|100 | I24: 105 | J24: 4|1|2|3 | K24: =VLOOKUP(MID(RC[-10],2,2),Sheet1!R2C3:R26C7,2,FALSE)&"|"&VLOOKUP(MID(RC[-10],2,2),Sheet1!R2C3:R26C7,3,FALSE)&"|"&VLOOKUP(MID(RC[-10],2,2),Sheet1!R2C3:R26C7,4,FALSE)&"|"&VLOOKUP(MID(RC[-10],2,2),Sheet1!R2C3:R26C7,5,FALSE) -> 200|40|20|20 | L24: 28|46
A25: =R[-12]C+1000 -> 61301 | B25: 高峰之书 | C25: <COLOR VALUE=FFb3671d>记录了高峰气息的书籍</COLOR><BR>4级觉醒道具 | D25: =R[-12]C+1000 -> 61301 | E25: =INT(MOD(RC[-4],1000)/100) -> 3 | F25: =R[-2]C[-5]&"|"&R[-1]C[-5]&"|"&R[-4]C[-5] -> 61201|61202|61101 | G25: 2|2|5 | H25: 3|100 | I25: 520 | J25: 4|1|2|3 | K25: =VLOOKUP(MID(RC[-10],2,2),Sheet1!R2C3:R26C7,2,FALSE)&"|"&VLOOKUP(MID(RC[-10],2,2),Sheet1!R2C3:R26C7,3,FALSE)&"|"&VLOOKUP(MID(RC[-10],2,2),Sheet1!R2C3:R26C7,4,FALSE)&"|"&VLOOKUP(MID(RC[-10],2,2),Sheet1!R2C3:R26C7,5,FALSE) -> 450|90|45|45 | L25: 28|46
A26: =R[-12]C+1000 -> 61302 | B26: 高峰之晶 | C26: <COLOR VALUE=FFb3671d>储存了高峰气息的晶石</COLOR><BR>4级觉醒道具 | D26: =R[-12]C+1000 -> 61302 | E26: =INT(MOD(RC[-4],1000)/100) -> 3 | F26: =R[-3]C[-5]&"|"&R[-2]C[-5]&"|"&R[-4]C[-5] -> 61201|61202|61102 | G26: 2|2|5 | H26: 3|100 | I26: 520 | J26: 4|1|2|3 | K26: =VLOOKUP(MID(RC[-10],2,2),Sheet1!R2C3:R26C7,2,FALSE)&"|"&VLOOKUP(MID(RC[-10],2,2),Sheet1!R2C3:R26C7,3,FALSE)&"|"&VLOOKUP(MID(RC[-10],2,2),Sheet1!R2C3:R26C7,4,FALSE)&"|"&VLOOKUP(MID(RC[-10],2,2),Sheet1!R2C3:R26C7,5,FALSE) -> 450|90|45|45 | L26: 28|46
A27: =R[-12]C+1000 -> 61401 | B27: 山脉圣经 | C27: <COLOR VALUE=FFb3671d>记录了山脉精髓的圣经</COLOR><BR>5级觉醒道具 | D27: =R[-12]C+1000 -> 61401 | E27: =INT(MOD(RC[-4],1000)/100) -> 4 | F27: =R[-2]C[-5]&"|"&R[-1]C[-5]&"|"&R[-4]C[-5] -> 61301|61302|61201 | G27: 1|1|3 | H27: 3|100 | I27: 1355 | J27: 4|1|2|3 | K27: =VLOOKUP(MID(RC[-10],2,2),Sheet1!R2C3:R26C7,2,FALSE)&"|"&VLOOKUP(MID(RC[-10],2,2),Sheet1!R2C3:R26C7,3,FALSE)&"|"&VLOOKUP(MID(RC[-10],2,2),Sheet1!R2C3:R26C7,4,FALSE)&"|"&VLOOKUP(MID(RC[-10],2,2),Sheet1!R2C3:R26C7,5,FALSE) -> 1100|220|110|110 | L27: 28|46
A28: =R[-12]C+1000 -> 61402 | B28: 山脉宝石 | C28: <COLOR VALUE=FFb3671d>储存了山脉精髓的宝石</COLOR><BR>5级觉醒道具 | D28: =R[-12]C+1000 -> 61402 | E28: =INT(MOD(RC[-4],1000)/100) -> 4 | F28: =R[-3]C[-5]&"|"&R[-2]C[-5]&"|"&R[-4]C[-5] -> 61301|61302|61202 | G28: 1|1|3 | H28: 3|100 | I28: 1355 | J28: 4|1|2|3 | K28: =VLOOKUP(MID(RC[-10],2,2),Sheet1!R2C3:R26C7,2,FALSE)&"|"&VLOOKUP(MID(RC[-10],2,2),Sheet1!R2C3:R26C7,3,FALSE)&"|"&VLOOKUP(MID(RC[-10],2,2),Sheet1!R2C3:R26C7,4,FALSE)&"|"&VLOOKUP(MID(RC[-10],2,2),Sheet1!R2C3:R26C7,5,FALSE) -> 1100|220|110|110 | L28: 28|46
A29: =R[-12]C+1000 -> 61501 | B29: 大陆神典 | C29: <COLOR VALUE=FFb3671d>记录了大陆法则的神典</COLOR><BR>6级觉醒道具 | D29: =R[-12]C+1000 -> 61501 | E29: =INT(MOD(RC[-4],1000)/100) -> 5 | F29: =R[-2]C[-5]&"|"&R[-1]C[-5]&"|"&R[-4]C[-5] -> 61401|61402|61301 | G29: 1|1|3 | H29: 3|100 | I29: 4270 | J29: 4|1|2|3 | K29: =VLOOKUP(MID(RC[-10],2,2),Sheet1!R2C3:R26C7,2,FALSE)&"|"&VLOOKUP(MID(RC[-10],2,2),Sheet1!R2C3:R26C7,3,FALSE)&"|"&VLOOKUP(MID(RC[-10],2,2),Sheet1!R2C3:R26C7,4,FALSE)&"|"&VLOOKUP(MID(RC[-10],2,2),Sheet1!R2C3:R26C7,5,FALSE) -> 2600|520|260|260 | L29: 28|46
A30: =R[-12]C+1000 -> 61502 | B30: 大陆神石 | C30: <COLOR VALUE=FFb3671d>储存了大陆法则的神石</COLOR><BR>6级觉醒道具 | D30: =R[-12]C+1000 -> 61502 | E30: =INT(MOD(RC[-4],1000)/100) -> 5 | F30: =R[-3]C[-5]&"|"&R[-2]C[-5]&"|"&R[-4]C[-5] -> 61401|61402|61302 | G30: 1|1|3 | H30: 3|100 | I30: 4270 | J30: 4|1|2|3 | K30: =VLOOKUP(MID(RC[-10],2,2),Sheet1!R2C3:R26C7,2,FALSE)&"|"&VLOOKUP(MID(RC[-10],2,2),Sheet1!R2C3:R26C7,3,FALSE)&"|"&VLOOKUP(MID(RC[-10],2,2),Sheet1!R2C3:R26C7,4,FALSE)&"|"&VLOOKUP(MID(RC[-10],2,2),Sheet1!R2C3:R26C7,5,FALSE) -> 2600|520|260|260 | L30: 28|46
A31: =R[-12]C+1000 -> 62001 | B31: 火之页 | C31: <COLOR VALUE=FFf23434>记录了火之气息的书页</COLOR><BR>1级觉醒道具 | D31: =R[-12]C+1000 -> 62001 | E31: =INT(MOD(RC[-4],1000)/100) -> 0 | I31: 5 | J31: 4|1|2|3 | K31: =VLOOKUP(MID(RC[-10],2,2),Sheet1!R2C3:R26C7,2,FALSE)&"|"&VLOOKUP(MID(RC[-10],2,2),Sheet1!R2C3:R26C7,3,FALSE)&"|"&VLOOKUP(MID(RC[-10],2,2),Sheet1!R2C3:R26C7,4,FALSE)&"|"&VLOOKUP(MID(RC[-10],2,2),Sheet1!R2C3:R26C7,5,FALSE) -> 30|3|6|3 | L31: 28|46
A32: =R[-12]C+1000 -> 62002 | B32: 火之石 | C32: <COLOR VALUE=FFf23434>储存了火之气息的石头</COLOR><BR>1级觉醒道具 | D32: =R[-12]C+1000 -> 62002 | E32: =INT(MOD(RC[-4],1000)/100) -> 0 | I32: 5 | J32: 4|1|2|3 | K32: =VLOOKUP(MID(RC[-10],2,2),Sheet1!R2C3:R26C7,2,FALSE)&"|"&VLOOKUP(MID(RC[-10],2,2),Sheet1!R2C3:R26C7,3,FALSE)&"|"&VLOOKUP(MID(RC[-10],2,2),Sheet1!R2C3:R26C7,4,FALSE)&"|"&VLOOKUP(MID(RC[-10],2,2),Sheet1!R2C3:R26C7,5,FALSE) -> 30|3|6|3 | L32: 28|46
A33: =R[-12]C+1000 -> 62101 | B33: 火焰之页 | C33: <COLOR VALUE=FFf23434>记录了火焰气息的书页</COLOR><BR>2级觉醒道具 | D33: =R[-12]C+1000 -> 62101 | E33: =INT(MOD(RC[-4],1000)/100) -> 1 | F33: =R[-2]C[-5]&"|"&R[-1]C[-5] -> 62001|62002 | G33: 2|2 | H33: 3|100 | I33: 20 | J33: 4|1|2|3 | K33: =VLOOKUP(MID(RC[-10],2,2),Sheet1!R2C3:R26C7,2,FALSE)&"|"&VLOOKUP(MID(RC[-10],2,2),Sheet1!R2C3:R26C7,3,FALSE)&"|"&VLOOKUP(MID(RC[-10],2,2),Sheet1!R2C3:R26C7,4,FALSE)&"|"&VLOOKUP(MID(RC[-10],2,2),Sheet1!R2C3:R26C7,5,FALSE) -> 80|8|16|8 | L33: 28|46
A34: =R[-12]C+1000 -> 62102 | B34: 火焰之石 | C34: <COLOR VALUE=FFf23434>储存了火焰气息的石头</COLOR><BR>2级觉醒道具 | D34: =R[-12]C+1000 -> 62102 | E34: =INT(MOD(RC[-4],1000)/100) -> 1 | F34: =R[-3]C[-5]&"|"&R[-2]C[-5] -> 62001|62002 | G34: 2|2 | H34: 3|100 | I34: 20 | J34: 4|1|2|3 | K34: =VLOOKUP(MID(RC[-10],2,2),Sheet1!R2C3:R26C7,2,FALSE)&"|"&VLOOKUP(MID(RC[-10],2,2),Sheet1!R2C3:R26C7,3,FALSE)&"|"&VLOOKUP(MID(RC[-10],2,2),Sheet1!R2C3:R26C7,4,FALSE)&"|"&VLOOKUP(MID(RC[-10],2,2),Sheet1!R2C3:R26C7,5,FALSE) -> 80|8|16|8 | L34: 28|46
A35: =R[-12]C+1000 -> 62201 | B35: 烈焰之书 | C35: <COLOR VALUE=FFf23434>记录了烈焰气息的书籍</COLOR><BR>3级觉醒道具 | D35: =R[-12]C+1000 -> 62201 | E35: =INT(MOD(RC[-4],1000)/100) -> 2 | F35: =R[-2]C[-5]&"|"&R[-1]C[-5]&"|"&R[-4]C[-5] -> 62101|62102|62001 | G35: 2|2|5 | H35: 3|100 | I35: 105 | J35: 4|1|2|3 | K35: =VLOOKUP(MID(RC[-10],2,2),Sheet1!R2C3:R26C7,2,FALSE)&"|"&VLOOKUP(MID(RC[-10],2,2),Sheet1!R2C3:R26C7,3,FALSE)&"|"&VLOOKUP(MID(RC[-10],2,2),Sheet1!R2C3:R26C7,4,FALSE)&"|"&VLOOKUP(MID(RC[-10],2,2),Sheet1!R2C3:R26C7,5,FALSE) -> 200|20|40|20 | L35: 28|46
A36: =R[-12]C+1000 -> 62202 | B36: 烈焰之晶 | C36: <COLOR VALUE=FFf23434>储存了烈焰气息的晶石</COLOR><BR>3级觉醒道具 | D36: =R[-12]C+1000 -> 62202 | E36: =INT(MOD(RC[-4],1000)/100) -> 2 | F36: =R[-3]C[-5]&"|"&R[-2]C[-5]&"|"&R[-4]C[-5] -> 62101|62102|62002 | G36: 2|2|5 | H36: 3|100 | I36: 105 | J36: 4|1|2|3 | K36: =VLOOKUP(MID(RC[-10],2,2),Sheet1!R2C3:R26C7,2,FALSE)&"|"&VLOOKUP(MID(RC[-10],2,2),Sheet1!R2C3:R26C7,3,FALSE)&"|"&VLOOKUP(MID(RC[-10],2,2),Sheet1!R2C3:R26C7,4,FALSE)&"|"&VLOOKUP(MID(RC[-10],2,2),Sheet1!R2C3:R26C7,5,FALSE) -> 200|20|40|20 | L36: 28|46
A37: =R[-12]C+1000 -> 62301 | B37: 火海之书 | C37: <COLOR VALUE=FFf23434>记录了火海气息的书籍</COLOR><BR>4级觉醒道具 | D37: =R[-12]C+1000 -> 62301 | E37: =INT(MOD(RC[-4],1000)/100) -> 3 | F37: =R[-2]C[-5]&"|"&R[-1]C[-5]&"|"&R[-4]C[-5] -> 62201|62202|62101 | G37: 2|2|5 | H37: 3|100 | I37: 520 | J37: 4|1|2|3 | K37: =VLOOKUP(MID(RC[-10],2,2),Sheet1!R2C3:R26C7,2,FALSE)&"|"&VLOOKUP(MID(RC[-10],2,2),Sheet1!R2C3:R26C7,3,FALSE)&"|"&VLOOKUP(MID(RC[-10],2,2),Sheet1!R2C3:R26C7,4,FALSE)&"|"&VLOOKUP(MID(RC[-10],2,2),Sheet1!R2C3:R26C7,5,FALSE) -> 450|45|90|45 | L37: 28|46
A38: =R[-12]C+1000 -> 62302 | B38: 火海之晶 | C38: <COLOR VALUE=FFf23434>储存了火海气息的晶石</COLOR><BR>4级觉醒道具 | D38: =R[-12]C+1000 -> 62302 | E38: =INT(MOD(RC[-4],1000)/100) -> 3 | F38: =R[-3]C[-5]&"|"&R[-2]C[-5]&"|"&R[-4]C[-5] -> 62201|62202|62102 | G38: 2|2|5 | H38: 3|100 | I38: 520 | J38: 4|1|2|3 | K38: =VLOOKUP(MID(RC[-10],2,2),Sheet1!R2C3:R26C7,2,FALSE)&"|"&VLOOKUP(MID(RC[-10],2,2),Sheet1!R2C3:R26C7,3,FALSE)&"|"&VLOOKUP(MID(RC[-10],2,2),Sheet1!R2C3:R26C7,4,FALSE)&"|"&VLOOKUP(MID(RC[-10],2,2),Sheet1!R2C3:R26C7,5,FALSE) -> 450|45|90|45 | L38: 28|46
A39: =R[-12]C+1000 -> 62401 | B39: 熔岩圣经 | C39: <COLOR VALUE=FFf23434>记录了熔岩精髓的圣经</COLOR><BR>5级觉醒道具 | D39: =R[-12]C+1000 -> 62401 | E39: =INT(MOD(RC[-4],1000)/100) -> 4 | F39: =R[-2]C[-5]&"|"&R[-1]C[-5]&"|"&R[-4]C[-5] -> 62301|62302|62201 | G39: 1|1|3 | H39: 3|100 | I39: 1355 | J39: 4|1|2|3 | K39: =VLOOKUP(MID(RC[-10],2,2),Sheet1!R2C3:R26C7,2,FALSE)&"|"&VLOOKUP(MID(RC[-10],2,2),Sheet1!R2C3:R26C7,3,FALSE)&"|"&VLOOKUP(MID(RC[-10],2,2),Sheet1!R2C3:R26C7,4,FALSE)&"|"&VLOOKUP(MID(RC[-10],2,2),Sheet1!R2C3:R26C7,5,FALSE) -> 1100|110|220|110 | L39: 28|46
A40: =R[-12]C+1000 -> 62402 | B40: 熔岩宝石 | C40: <COLOR VALUE=FFf23434>储存了熔岩精髓的宝石</COLOR><BR>5级觉醒道具 | D40: =R[-12]C+1000 -> 62402 | E40: =INT(MOD(RC[-4],1000)/100) -> 4 | F40: =R[-3]C[-5]&"|"&R[-2]C[-5]&"|"&R[-4]C[-5] -> 62301|62302|62202 | G40: 1|1|3 | H40: 3|100 | I40: 1355 | J40: 4|1|2|3 | K40: =VLOOKUP(MID(RC[-10],2,2),Sheet1!R2C3:R26C7,2,FALSE)&"|"&VLOOKUP(MID(RC[-10],2,2),Sheet1!R2C3:R26C7,3,FALSE)&"|"&VLOOKUP(MID(RC[-10],2,2),Sheet1!R2C3:R26C7,4,FALSE)&"|"&VLOOKUP(MID(RC[-10],2,2),Sheet1!R2C3:R26C7,5,FALSE) -> 1100|110|220|110 | L40: 28|46
A41: =R[-12]C+1000 -> 62501 | B41: 太阳神典 | C41: <COLOR VALUE=FFf23434>记录了太阳法则的神典</COLOR><BR>6级觉醒道具 | D41: =R[-12]C+1000 -> 62501 | E41: =INT(MOD(RC[-4],1000)/100) -> 5 | F41: =R[-2]C[-5]&"|"&R[-1]C[-5]&"|"&R[-4]C[-5] -> 62401|62402|62301 | G41: 1|1|3 | H41: 3|100 | I41: 4270 | J41: 4|1|2|3 | K41: =VLOOKUP(MID(RC[-10],2,2),Sheet1!R2C3:R26C7,2,FALSE)&"|"&VLOOKUP(MID(RC[-10],2,2),Sheet1!R2C3:R26C7,3,FALSE)&"|"&VLOOKUP(MID(RC[-10],2,2),Sheet1!R2C3:R26C7,4,FALSE)&"|"&VLOOKUP(MID(RC[-10],2,2),Sheet1!R2C3:R26C7,5,FALSE) -> 2600|260|520|260 | L41: 28|46
A42: =R[-12]C+1000 -> 62502 | B42: 太阳神石 | C42: <COLOR VALUE=FFf23434>储存了太阳法则的神石</COLOR><BR>6级觉醒道具 | D42: =R[-12]C+1000 -> 62502 | E42: =INT(MOD(RC[-4],1000)/100) -> 5 | F42: =R[-3]C[-5]&"|"&R[-2]C[-5]&"|"&R[-4]C[-5] -> 62401|62402|62302 | G42: 1|1|3 | H42: 3|100 | I42: 4270 | J42: 4|1|2|3 | K42: =VLOOKUP(MID(RC[-10],2,2),Sheet1!R2C3:R26C7,2,FALSE)&"|"&VLOOKUP(MID(RC[-10],2,2),Sheet1!R2C3:R26C7,3,FALSE)&"|"&VLOOKUP(MID(RC[-10],2,2),Sheet1!R2C3:R26C7,4,FALSE)&"|"&VLOOKUP(MID(RC[-10],2,2),Sheet1!R2C3:R26C7,5,FALSE) -> 2600|260|520|260 | L42: 28|46
A43: =R[-12]C+1000 -> 63001 | B43: 水之页 | C43: <COLOR VALUE=FF4c94ff>记录了水之气息的书页</COLOR><BR>1级觉醒道具 | D43: =R[-12]C+1000 -> 63001 | E43: =INT(MOD(RC[-4],1000)/100) -> 0 | I43: 5 | J43: 4|1|2|3 | K43: =VLOOKUP(MID(RC[-10],2,2),Sheet1!R2C3:R26C7,2,FALSE)&"|"&VLOOKUP(MID(RC[-10],2,2),Sheet1!R2C3:R26C7,3,FALSE)&"|"&VLOOKUP(MID(RC[-10],2,2),Sheet1!R2C3:R26C7,4,FALSE)&"|"&VLOOKUP(MID(RC[-10],2,2),Sheet1!R2C3:R26C7,5,FALSE) -> 30|3|3|6 | L43: 28|46
A44: =R[-12]C+1000 -> 63002 | B44: 水之石 | C44: <COLOR VALUE=FF4c94ff>储存了水之气息的石头</COLOR><BR>1级觉醒道具 | D44: =R[-12]C+1000 -> 63002 | E44: =INT(MOD(RC[-4],1000)/100) -> 0 | I44: 5 | J44: 4|1|2|3 | K44: =VLOOKUP(MID(RC[-10],2,2),Sheet1!R2C3:R26C7,2,FALSE)&"|"&VLOOKUP(MID(RC[-10],2,2),Sheet1!R2C3:R26C7,3,FALSE)&"|"&VLOOKUP(MID(RC[-10],2,2),Sheet1!R2C3:R26C7,4,FALSE)&"|"&VLOOKUP(MID(RC[-10],2,2),Sheet1!R2C3:R26C7,5,FALSE) -> 30|3|3|6 | L44: 28|46
A45: =R[-12]C+1000 -> 63101 | B45: 雨水之页 | C45: <COLOR VALUE=FF4c94ff>记录了雨水气息的书页</COLOR><BR>2级觉醒道具 | D45: =R[-12]C+1000 -> 63101 | E45: =INT(MOD(RC[-4],1000)/100) -> 1 | F45: =R[-2]C[-5]&"|"&R[-1]C[-5] -> 63001|63002 | G45: 2|2 | H45: 3|100 | I45: 20 | J45: 4|1|2|3 | K45: =VLOOKUP(MID(RC[-10],2,2),Sheet1!R2C3:R26C7,2,FALSE)&"|"&VLOOKUP(MID(RC[-10],2,2),Sheet1!R2C3:R26C7,3,FALSE)&"|"&VLOOKUP(MID(RC[-10],2,2),Sheet1!R2C3:R26C7,4,FALSE)&"|"&VLOOKUP(MID(RC[-10],2,2),Sheet1!R2C3:R26C7,5,FALSE) -> 80|8|8|16 | L45: 28|46
A46: =R[-12]C+1000 -> 63102 | B46: 雨水之石 | C46: <COLOR VALUE=FF4c94ff>储存了雨水气息的石头</COLOR><BR>2级觉醒道具 | D46: =R[-12]C+1000 -> 63102 | E46: =INT(MOD(RC[-4],1000)/100) -> 1 | F46: =R[-3]C[-5]&"|"&R[-2]C[-5] -> 63001|63002 | G46: 2|2 | H46: 3|100 | I46: 20 | J46: 4|1|2|3 | K46: =VLOOKUP(MID(RC[-10],2,2),Sheet1!R2C3:R26C7,2,FALSE)&"|"&VLOOKUP(MID(RC[-10],2,2),Sheet1!R2C3:R26C7,3,FALSE)&"|"&VLOOKUP(MID(RC[-10],2,2),Sheet1!R2C3:R26C7,4,FALSE)&"|"&VLOOKUP(MID(RC[-10],2,2),Sheet1!R2C3:R26C7,5,FALSE) -> 80|8|8|16 | L46: 28|46
A47: =R[-12]C+1000 -> 63201 | B47: 溪河之书 | C47: <COLOR VALUE=FF4c94ff>记录了溪河气息的书籍</COLOR><BR>3级觉醒道具 | D47: =R[-12]C+1000 -> 63201 | E47: =INT(MOD(RC[-4],1000)/100) -> 2 | F47: =R[-2]C[-5]&"|"&R[-1]C[-5]&"|"&R[-4]C[-5] -> 63101|63102|63001 | G47: 2|2|5 | H47: 3|100 | I47: 105 | J47: 4|1|2|3 | K47: =VLOOKUP(MID(RC[-10],2,2),Sheet1!R2C3:R26C7,2,FALSE)&"|"&VLOOKUP(MID(RC[-10],2,2),Sheet1!R2C3:R26C7,3,FALSE)&"|"&VLOOKUP(MID(RC[-10],2,2),Sheet1!R2C3:R26C7,4,FALSE)&"|"&VLOOKUP(MID(RC[-10],2,2),Sheet1!R2C3:R26C7,5,FALSE) -> 200|20|20|40 | L47: 28|46
A48: =R[-12]C+1000 -> 63202 | B48: 溪河之晶 | C48: <COLOR VALUE=FF4c94ff>储存了溪河气息的晶石</COLOR><BR>3级觉醒道具 | D48: =R[-12]C+1000 -> 63202 | E48: =INT(MOD(RC[-4],1000)/100) -> 2 | F48: =R[-3]C[-5]&"|"&R[-2]C[-5]&"|"&R[-4]C[-5] -> 63101|63102|63002 | G48: 2|2|5 | H48: 3|100 | I48: 105 | J48: 4|1|2|3 | K48: =VLOOKUP(MID(RC[-10],2,2),Sheet1!R2C3:R26C7,2,FALSE)&"|"&VLOOKUP(MID(RC[-10],2,2),Sheet1!R2C3:R26C7,3,FALSE)&"|"&VLOOKUP(MID(RC[-10],2,2),Sheet1!R2C3:R26C7,4,FALSE)&"|"&VLOOKUP(MID(RC[-10],2,2),Sheet1!R2C3:R26C7,5,FALSE) -> 200|20|20|40 | L48: 28|46
A49: =R[-12]C+1000 -> 63301 | B49: 江流之书 | C49: <COLOR VALUE=FF4c94ff>记录了江流气息的书籍</COLOR><BR>4级觉醒道具 | D49: =R[-12]C+1000 -> 63301 | E49: =INT(MOD(RC[-4],1000)/100) -> 3 | F49: =R[-2]C[-5]&"|"&R[-1]C[-5]&"|"&R[-4]C[-5] -> 63201|63202|63101 | G49: 2|2|5 | H49: 3|100 | I49: 520 | J49: 4|1|2|3 | K49: =VLOOKUP(MID(RC[-10],2,2),Sheet1!R2C3:R26C7,2,FALSE)&"|"&VLOOKUP(MID(RC[-10],2,2),Sheet1!R2C3:R26C7,3,FALSE)&"|"&VLOOKUP(MID(RC[-10],2,2),Sheet1!R2C3:R26C7,4,FALSE)&"|"&VLOOKUP(MID(RC[-10],2,2),Sheet1!R2C3:R26C7,5,FALSE) -> 450|45|45|90 | L49: 28|46
A50: =R[-12]C+1000 -> 63302 | B50: 江流之晶 | C50: <COLOR VALUE=FF4c94ff>储存了江流气息的晶石</COLOR><BR>4级觉醒道具 | D50: =R[-12]C+1000 -> 63302 | E50: =INT(MOD(RC[-4],1000)/100) -> 3 | F50: =R[-3]C[-5]&"|"&R[-2]C[-5]&"|"&R[-4]C[-5] -> 63201|63202|63102 | G50: 2|2|5 | H50: 3|100 | I50: 520 | J50: 4|1|2|3 | K50: =VLOOKUP(MID(RC[-10],2,2),Sheet1!R2C3:R26C7,2,FALSE)&"|"&VLOOKUP(MID(RC[-10],2,2),Sheet1!R2C3:R26C7,3,FALSE)&"|"&VLOOKUP(MID(RC[-10],2,2),Sheet1!R2C3:R26C7,4,FALSE)&"|"&VLOOKUP(MID(RC[-10],2,2),Sheet1!R2C3:R26C7,5,FALSE) -> 450|45|45|90 | L50: 28|46
A51: =R[-12]C+1000 -> 63401 | B51: 暴雨圣经 | C51: <COLOR VALUE=FF4c94ff>记录了暴雨精髓的圣经</COLOR><BR>5级觉醒道具 | D51: =R[-12]C+1000 -> 63401 | E51: =INT(MOD(RC[-4],1000)/100) -> 4 | F51: =R[-2]C[-5]&"|"&R[-1]C[-5]&"|"&R[-4]C[-5] -> 63301|63302|63201 | G51: 1|1|3 | H51: 3|100 | I51: 1355 | J51: 4|1|2|3 | K51: =VLOOKUP(MID(RC[-10],2,2),Sheet1!R2C3:R26C7,2,FALSE)&"|"&VLOOKUP(MID(RC[-10],2,2),Sheet1!R2C3:R26C7,3,FALSE)&"|"&VLOOKUP(MID(RC[-10],2,2),Sheet1!R2C3:R26C7,4,FALSE)&"|"&VLOOKUP(MID(RC[-10],2,2),Sheet1!R2C3:R26C7,5,FALSE) -> 1100|110|110|220 | L51: 28|46
A52: =R[-12]C+1000 -> 63402 | B52: 暴雨宝石 | C52: <COLOR VALUE=FF4c94ff>储存了暴雨精髓的宝石</COLOR><BR>5级觉醒道具 | D52: =R[-12]C+1000 -> 63402 | E52: =INT(MOD(RC[-4],1000)/100) -> 4 | F52: =R[-3]C[-5]&"|"&R[-2]C[-5]&"|"&R[-4]C[-5] -> 63301|63302|63202 | G52: 1|1|3 | H52: 3|100 | I52: 1355 | J52: 4|1|2|3 | K52: =VLOOKUP(MID(RC[-10],2,2),Sheet1!R2C3:R26C7,2,FALSE)&"|"&VLOOKUP(MID(RC[-10],2,2),Sheet1!R2C3:R26C7,3,FALSE)&"|"&VLOOKUP(MID(RC[-10],2,2),Sheet1!R2C3:R26C7,4,FALSE)&"|"&VLOOKUP(MID(RC[-10],2,2),Sheet1!R2C3:R26C7,5,FALSE) -> 1100|110|110|220 | L52: 28|46
A53: =R[-12]C+1000 -> 63501 | B53: 海洋神典 | C53: <COLOR VALUE=FF4c94ff>记录了海洋法则的神典</COLOR><BR>6级觉醒道具 | D53: =R[-12]C+1000 -> 63501 | E53: =INT(MOD(RC[-4],1000)/100) -> 5 | F53: =R[-2]C[-5]&"|"&R[-1]C[-5]&"|"&R[-4]C[-5] -> 63401|63402|63301 | G53: 1|1|3 | H53: 3|100 | I53: 4270 | J53: 4|1|2|3 | K53: =VLOOKUP(MID(RC[-10],2,2),Sheet1!R2C3:R26C7,2,FALSE)&"|"&VLOOKUP(MID(RC[-10],2,2),Sheet1!R2C3:R26C7,3,FALSE)&"|"&VLOOKUP(MID(RC[-10],2,2),Sheet1!R2C3:R26C7,4,FALSE)&"|"&VLOOKUP(MID(RC[-10],2,2),Sheet1!R2C3:R26C7,5,FALSE) -> 2600|260|260|520 | L53: 28|46
A54: =R[-12]C+1000 -> 63502 | B54: 海洋神石 | C54: <COLOR VALUE=FF4c94ff>储存了海洋法则的神石</COLOR><BR>6级觉醒道具 | D54: =R[-12]C+1000 -> 63502 | E54: =INT(MOD(RC[-4],1000)/100) -> 5 | F54: =R[-3]C[-5]&"|"&R[-2]C[-5]&"|"&R[-4]C[-5] -> 63401|63402|63302 | G54: 1|1|3 | H54: 3|100 | I54: 4270 | J54: 4|1|2|3 | K54: =VLOOKUP(MID(RC[-10],2,2),Sheet1!R2C3:R26C7,2,FALSE)&"|"&VLOOKUP(MID(RC[-10],2,2),Sheet1!R2C3:R26C7,3,FALSE)&"|"&VLOOKUP(MID(RC[-10],2,2),Sheet1!R2C3:R26C7,4,FALSE)&"|"&VLOOKUP(MID(RC[-10],2,2),Sheet1!R2C3:R26C7,5,FALSE) -> 2600|260|260|520 | L54: 28|46

Sheet: Sheet1
A2: 类型 | B2: 品质 | C2: 辅助计算 | D2: 生命 | E2: 攻击 | F2: 物防 | G2: 法防
A3: 0 | B3: 0 | C3: =RC[-2]&RC[-1] -> 00 | D3: 60 | E3: 3 | F3: 3 | G3: 3
A4: 0 | B4: 1 | C4: =RC[-2]&RC[-1] -> 01 | D4: 160 | E4: 8 | F4: 8 | G4: 8
A5: 0 | B5: 2 | C5: =RC[-2]&RC[-1] -> 02 | D5: 400 | E5: 20 | F5: 20 | G5: 20
A6: 0 | B6: 3 | C6: =RC[-2]&RC[-1] -> 03 | D6: 900 | E6: 45 | F6: 45 | G6: 45
A7: 0 | B7: 4 | C7: =RC[-2]&RC[-1] -> 04 | D7: 2200 | E7: 110 | F7: 110 | G7: 110
A8: 0 | B8: 5 | C8: =RC[-2]&RC[-1] -> 05 | D8: 5200 | E8: 260 | F8: 260 | G8: 260
A9: 1 | B9: 0 | C9: =RC[-2]&RC[-1] -> 10 | D9: 30 | E9: 6 | F9: 3 | G9: 3
A10: 1 | B10: 1 | C10: =RC[-2]&RC[-1] -> 11 | D10: 80 | E10: 16 | F10: 8 | G10: 8
A11: 1 | B11: 2 | C11: =RC[-2]&RC[-1] -> 12 | D11: 200 | E11: 40 | F11: 20 | G11: 20
A12: 1 | B12: 3 | C12: =RC[-2]&RC[-1] -> 13 | D12: 450 | E12: 90 | F12: 45 | G12: 45
A13: 1 | B13: 4 | C13: =RC[-2]&RC[-1] -> 14 | D13: 1100 | E13: 220 | F13: 110 | G13: 110
A14: 1 | B14: 5 | C14: =RC[-2]&RC[-1] -> 15 | D14: 2600 | E14: 520 | F14: 260 | G14: 260
A15: 2 | B15: 0 | C15: =RC[-2]&RC[-1] -> 20 | D15: 30 | E15: 3 | F15: 6 | G15: 3
A16: 2 | B16: 1 | C16: =RC[-2]&RC[-1] -> 21 | D16: 80 | E16: 8 | F16: 16 | G16: 8
A17: 2 | B17: 2 | C17: =RC[-2]&RC[-1] -> 22 | D17: 200 | E17: 20 | F17: 40 | G17: 20
A18: 2 | B18: 3 | C18: =RC[-2]&RC[-1] -> 23 | D18: 450 | E18: 45 | F18: 90 | G18: 45
A19: 2 | B19: 4 | C19: =RC[-2]&RC[-1] -> 24 | D19: 1100 | E19: 110 | F19: 220 | G19: 110
A20: 2 | B20: 5 | C20: =RC[-2]&RC[-1] -> 25 | D20: 2600 | E20: 260 | F20: 520 | G20: 260
A21: 3 | B21: 0 | C21: =RC[-2]&RC[-1] -> 30 | D21: 30 | E21: 3 | F21: 3 | G21: 6
A22: 3 | B22: 1 | C22: =RC[-2]&RC[-1] -> 31 | D22: 80 | E22: 8 | F22: 8 | G22: 16
A23: 3 | B23: 2 | C23: =RC[-2]&RC[-1] -> 32 | D23: 200 | E23: 20 | F23: 20 | G23: 40
A24: 3 | B24: 3 | C24: =RC[-2]&RC[-1] -> 33 | D24: 450 | E24: 45 | F24: 45 | G24: 90
A25: 3 | B25: 4 | C25: =RC[-2]&RC[-1] -> 34 | D25: 1100 | E25: 110 | F25: 110 | G25: 220
A26: 3 | B26: 5 | C26: =RC[-2]&RC[-1] -> 35 | D26: 2600 | E26: 260 | F26: 260 | G26: 520