Sheet: 配置
A1: 服务端文件名 | B1: 服务端对应工作表号 | C1: 客户端文件名 | D1: 客户端对应工作表号 | E1: erl头部 | F1: erl内容格式 | G1: erl尾部 | H1: 客户端特殊处理
A2: seven_day_rank_reward.txt | B2: 1 | C2: config_seven_day_rank_reward.cnf|SevenDayRankReward | D2: 1 | F2: get(id) -> #$ | H2: 2=>id

Sheet: 7天排名奖励
A1: rank_type|rank_type | B1: rank_min|rank_min | C1: rank_max|rank_max | D1: item_id_list|item_id_list | E1: item_num_list|item_num_list
A2: 不可空 | B2: 不可空 | C2: 不可空 | D2: 不可空 | E2: 不可空
A3: 数字 | B3: 数字 | C3: 数字 | D3: 一维数组 | E3: 一维数组
D4: 不定长 | E4: 不定长
A6: 排行榜类型 | B6: 排名下限 | C6: 排名上限 | D6: 奖励物品ID列表 | E6: 奖励物品数量列表 | G6: 排名 | H6: 奖励 | I6: 价值（钻）
A7: 1 | B7: 1 | C7: 1 | D7: 20402|13049|19103 | E7: 1|20|100 | F7: 战力榜 | G7: =IF(RC[-4]=RC[-5],"第"&RC[-5]&"名","第"&RC[-5]&"~"&RC[-4]&"名") -> 第1名 | H7: 20402*1、圣器碎片箱*20、金币*100W | I7: =50*80+200*20+10*100 -> 9000
A8: 1 | B8: 2 | C8: 2 | D8: 13307|13049|19103 | E8: 30|15|60 | G8: =IF(RC[-4]=RC[-5],"第"&RC[-5]&"名","第"&RC[-5]&"~"&RC[-4]&"名") -> 第2名 | H8: 13307*30、圣器碎片箱*15、金币*60W | I8: =50*60+200*15+10*60 -> 6600
A9: 1 | B9: 3 | C9: 3 | D9: 13307|13049|19103 | E9: 30|10|40 | G9: =IF(RC[-4]=RC[-5],"第"&RC[-5]&"名","第"&RC[-5]&"~"&RC[-4]&"名") -> 第3名 | H9: 13307*30、圣器碎片箱*10、金币*40W | I9: =50*40+200*10+10*40 -> 4400
A10: 1 | B10: 4 | C10: 10 | D10: 13003|13049|19103 | E10: 30|5|20 | G10: =IF(RC[-4]=RC[-5],"第"&RC[-5]&"名","第"&RC[-5]&"~"&RC[-4]&"名") -> 第4~10名 | H10: 13003*30、圣器碎片箱*5、金币*20W | I10: =50*30+200*5+10*20 -> 2700
A11: 1 | B11: 11 | C11: 20 | D11: 19012|13049|19103 | E11: 5000|3|15 | G11: =IF(RC[-4]=RC[-5],"第"&RC[-5]&"名","第"&RC[-5]&"~"&RC[-4]&"名") -> 第11~20名 | H11: 威名*5000、圣器碎片箱*3、金币*15W | I11: =0.1*5000+200*3+10*15 -> 1250
A12: 1 | B12: 21 | C12: 50 | D12: 19012|13049|19103 | E12: 2000|2|10 | G12: =IF(RC[-4]=RC[-5],"第"&RC[-5]&"名","第"&RC[-5]&"~"&RC[-4]&"名") -> 第21~50名 | H12: 威名*2000、圣器碎片箱*2、金币*10W | I12: =0.1*2000+200*2+10*10 -> 700
A13: 4 | B13: 1 | C13: 1 | D13: 21402|10003|19103 | E13: 1|500|100 | F13: 竞技榜 | G13: =IF(RC[-4]=RC[-5],"第"&RC[-5]&"名","第"&RC[-5]&"~"&RC[-4]&"名") -> 第1名 | H13: 21402*1、培养石*500、金币*100W | I13: =15*500+3*500+10*100 -> 10000
A14: 4 | B14: 2 | C14: 2 | D14: 13307|10003|19103 | E14: 30|400|60 | G14: =IF(RC[-4]=RC[-5],"第"&RC[-5]&"名","第"&RC[-5]&"~"&RC[-4]&"名") -> 第2名 | H14: 13307*30、培养石*400、金币*60W | I14: =15*400+3*400+10*60 -> 7800
A15: 4 | B15: 3 | C15: 3 | D15: 13307|10003|19103 | E15: 30|300|40 | G15: =IF(RC[-4]=RC[-5],"第"&RC[-5]&"名","第"&RC[-5]&"~"&RC[-4]&"名") -> 第3名 | H15: 13307*30、培养石*300、金币*40W | I15: =15*300+3*300+10*40 -> 5800
A16: 4 | B16: 4 | C16: 10 | D16: 13003|10003|19103 | E16: 30|200|20 | G16: =IF(RC[-4]=RC[-5],"第"&RC[-5]&"名","第"&RC[-5]&"~"&RC[-4]&"名") -> 第4~10名 | H16: 13003*30、培养石*200、金币*20W | I16: =15*200+3*200+10*20 -> 3800
A17: 4 | B17: 11 | C17: 20 | D17: 19013|10003|19103 | E17: 5000|150|15 | G17: =IF(RC[-4]=RC[-5],"第"&RC[-5]&"名","第"&RC[-5]&"~"&RC[-4]&"名") -> 第11~20名 | H17: 声望*5000、培养石*150、金币*15W | I17: =0.1*5000+3*150+10*15 -> 1100
A18: 4 | B18: 21 | C18: 50 | D18: 19013|10003|19103 | E18: 2000|100|10 | G18: =IF(RC[-4]=RC[-5],"第"&RC[-5]&"名","第"&RC[-5]&"~"&RC[-4]&"名") -> 第21~50名 | H18: 声望*2000、培养石*100、金币*10W | I18: =0.1*2000+3*100+10*10 -> 600
A19: 11 | B19: 1 | C19: 1 | D19: 22402|19006|19103 | E19: 1|2000|100 | F19: 副本榜 | G19: =IF(RC[-4]=RC[-5],"第"&RC[-5]&"名","第"&RC[-5]&"~"&RC[-4]&"名") -> 第1名 | H19: 22402*1、魂晶*2000、金币*100W | I19: =1*4000+3000+10*100 -> 8000
A20: 11 | B20: 2 | C20: 2 | D20: 13307|19006|19103 | E20: 30|1500|60 | G20: =IF(RC[-4]=RC[-5],"第"&RC[-5]&"名","第"&RC[-5]&"~"&RC[-4]&"名") -> 第2名 | H20: 13307*30、魂晶*1500、金币*60W | I20: =1*3000+2000+10*60 -> 5600
A21: 11 | B21: 3 | C21: 3 | D21: 13307|19006|19103 | E21: 30|1000|40 | G21: =IF(RC[-4]=RC[-5],"第"&RC[-5]&"名","第"&RC[-5]&"~"&RC[-4]&"名") -> 第3名 | H21: 13307*30、魂晶*1000、金币*40W | I21: =1*2000+1500+10*40 -> 3900
A22: 11 | B22: 4 | C22: 10 | D22: 13003|19006|19103 | E22: 30|800|20 | G22: =IF(RC[-4]=RC[-5],"第"&RC[-5]&"名","第"&RC[-5]&"~"&RC[-4]&"名") -> 第4~10名 | H22: 13003*30、魂晶*800、金币*20W | I22: =1*1000+1000+10*20 -> 2200
A23: 11 | B23: 11 | C23: 20 | D23: 19017|19006|19103 | E23: 500|600|15 | G23: =IF(RC[-4]=RC[-5],"第"&RC[-5]&"名","第"&RC[-5]&"~"&RC[-4]&"名") -> 第11~20名 | H23: 神魂*500、魂晶*600、金币*15W | I23: =1*500+600+10*15 -> 1250
A24: 11 | B24: 21 | C24: 50 | D24: 19017|19006|19103 | E24: 300|400|10 | G24: =IF(RC[-4]=RC[-5],"第"&RC[-5]&"名","第"&RC[-5]&"~"&RC[-4]&"名") -> 第21~50名 | H24: 神魂*300、魂晶*400、金币*10W | I24: =1*300+400+10*10 -> 800