Sheet: 配置
A1: 服务端文件名 | B1: 服务端对应工作表号 | C1: 客户端文件名 | D1: 客户端对应工作表号 | E1: erl头部 | F1: erl内容格式 | G1: erl尾部 | H1: 客户端特殊处理
A2: config_seven_day_activity.txt | B2: 1 | C2: config_seven_day_activity.cnf|SevenDayActivity | D2: 1 | F2: get(day) -> #$ | H2: 2=>day
A3: config_seven_day_target_data.txt | B3: 2 | C3: config_seven_day_target_data.cnf|SevenDayTargetData | D3: 2 | F3: get(id) -> #$ | H3: 2=>id
A4: config_seven_day_shop.txt | B4: 3 | C4: config_seven_day_shop.cnf|SevenDayShop | D4: 3 | F4: get(goods_id) -> #$ | H4: 2=>goods_id
A5: seven_day_target_completion_reward.txt | B5: 4 | C5: seven_day_target_completion_reward.cnf|SevenDayTargetCompletionReward | D5: 4 | F5: get(target_num) -> #$ | H5: 2=>target_num

Sheet: 活动
A1: day|day | B1: type| | C1: target_list|target_list | D1: login_preview| | E1: task_preview| | F1: sale_previw|
A2: 不可空 | B2: 不可空 | C2: 不可空 | D2: 不可空 | E2: 不可空 | F2: 不可空
A3: 数字 | B3: 数字 | C3: 一维数组 | D3: 一维数组 | E3: 一维数组 | F3: 数字
C4: 不定长 | D4: 不定长 | E4: 不定长 | F4: 不定长
A6: 天数 | B6: 类型 | C6: 目标列表 | D6: 登录奖励 | E6: 任务奖励 | F6: 半价贩售
A7: 1 | B7: 1 | C7: 1|8|15|22|23|24|25|26|27|28|29|30|31|32|33|34|35|36|37|38|39|40|41|42|148 | D7: 19005|10000 | E7: 19005|19103 | F7: 13601
A8: 2 | B8: 1 | C8: 2|9|16|43|44|45|46|47|48|49|50|51|52|53|54|55|56|57|58|59|149 | D8: 19005|10001 | E8: 13305|13306 | F8: 13316
A9: 3 | B9: 1 | C9: 3|10|17|60|61|62|63|64|65|66|67|68|69|70|71|72|73|74|75|76|77|78|79|80|81|82|150 | D9: 19005|10021 | E9: 19103|10003 | F9: 19006
A10: 4 | B10: 1 | C10: 4|11|18|162|163|164|165|166|167|168|169|170|171|172|173|174|175|176|177|178|179|180|181|151 | D10: 19005|19028 | E10: 19103|13646 | F10: 10022
A11: 5 | B11: 1 | C11: 5|12|19|83|84|85|86|87|88|89|90|91|92|93|94|95|96|152 | D11: 19005|10004 | E11: 19005|10000 | F11: 10004
A12: 6 | B12: 1 | C12: 6|13|20|112|113|114|115|116|117|118|119|120|121|122|123|124|125|126|127|153 | D12: 19005|13049 | E12: 19005|10000 | F12: 10010
A13: 7 | B13: 1 | C13: 7|14|21|128|129|130|131|132|133|134|135|136|137|138|139|140|154 | D13: 19005|13415 | E13: 19005|10000 | F13: 13416
A14: 8 | B14: 2 | C14: 1000|1001|1002|1010|1011|1012|1013|1014|1015|1020|1021|1022|1023|1030 | D14: 19005|10000 | E14: 19006|13012 | F14: 19006
A15: 9 | B15: 2 | C15: 1100|1101|1102|1110|1111|1112|1113|1114|1115|1120|1121|1122|1123|1130 | D15: 19005|10001 | E15: 19006|13012 | F15: 19103
A16: 10 | B16: 2 | C16: 1200|1201|1202|1210|1211|1212|1213|1214|1220|1221|1222|1223|1230 | D16: 19005|10001 | E16: 13049|10010 | F16: 13305
A17: 11 | B17: 2 | C17: 1300|1301|1302|1310|1311|1312|1313|1314|1320|1321|1322|1323|1330 | D17: 19005|10001 | E17: 13049|10010 | F17: 13306
A18: 12 | B18: 2 | C18: 1400|1401|1402|1410|1411|1412|1413|1420|1421|1422|1423|1430 | D18: 19005|10000 | E18: 19012|10012 | F18: 10035
A19: 13 | B19: 2 | C19: 1500|1501|1502|1510|1511|1512|1513|1520|1521|1522|1523|1530 | D19: 19005|10000 | E19: 19012|10014 | F19: 13646
A20: 14 | B20: 2 | C20: 1600|1601|1602|1610|1611|1612|1613|1614|1615|1620|1621|1622|1623|1630 | D20: 13417 | E20: 19013|10003 | F20: 19028

Sheet: 目标数据
A1: id|id | B1: logic_type|logic_type | C1: show_type| | D1: is_completion_target|is_completion_target | E1: name| | F1: is_asc|is_asc | G1: x|x | H1: y|y | I1: |is_the_same_day_valid | J1: |is_from_the_same_day_valid | K1: reward_item_id_list|reward_item_id_list | L1: reward_item_num_list|reward_item_num_list | M1: sale_text|
A2: 不可空 | B2: 不可空 | C2: 不可空 | D2: 不可空 | E2: 不可空 | F2: 可空#不需字段 | G2: 不可空 | H2: 不可空 | I2: 不可空 | J2: 不可空 | K2: 可空#不需字段 | L2: 可空#不需字段 | M2: 可空#不需字段
A3: 数字 | B3: 数字 | C3: 数字 | D3: 数字 | E3: 字符串 | F3: 数字 | G3: 数字 | H3: 数字 | I3: 数字 | J3: 数字 | K3: 一维数组 | L3: 一维数组 | M3: 字符串
K4: 不定长 | L4: 不定长 | M4: 不定长
A6: 目标ID | B6: 逻辑类型(服务器使用) | C6: 显示类型(客户端使用) | D6: 是否属于完成度目标 | E6: 名字类型(客户端使用) | F6: 是否升序 | G6: 需要的上下文值(x) | H6: 需要的上下文值(y) | I6: 是否只有当天有效 | J6: 是否从活动开启那天生效 | K6: 奖励的物品ID列表 | L6: 奖励的物品数量列表 | M6: 物品描述
A7: 1 | B7: 1 | C7: 1 | D7: 1 | E7: 开服第%s天登录（%s/%s）： | F7: 1 | G7: 1 | H7: 0 | I7: 0 | J7: 0 | K7: 19005|19003 | L7: 100|5000
A8: 2 | B8: 1 | C8: 1 | D8: 1 | E8: 开服第%s天登录（%s/%s）： | F8: 1 | G8: 2 | H8: 0 | I8: 0 | J8: 0 | K8: 19005|10001 | L8: 200|3
A9: 3 | B9: 1 | C9: 1 | D9: 1 | E9: 开服第%s天登录（%s/%s）： | F9: 1 | G9: 3 | H9: 0 | I9: 0 | J9: 0 | K9: 19005|10021 | L9: 300|10
A10: 4 | B10: 1 | C10: 1 | D10: 1 | E10: 开服第%s天登录（%s/%s）： | F10: 1 | G10: 4 | H10: 0 | I10: 0 | J10: 0 | K10: 19005|19028 | L10: 400|500
A11: 5 | B11: 1 | C11: 1 | D11: 1 | E11: 开服第%s天登录（%s/%s）： | F11: 1 | G11: 5 | H11: 0 | I11: 0 | J11: 0 | K11: 19005|10004 | L11: 500|20
A12: 6 | B12: 1 | C12: 1 | D12: 1 | E12: 开服第%s天登录（%s/%s）： | F12: 1 | G12: 6 | H12: 0 | I12: 0 | J12: 0 | K12: 19005|13049 | L12: 600|20
A13: 7 | B13: 1 | C13: 1 | D13: 1 | E13: 开服第%s天登录（%s/%s）： | F13: 1 | G13: 7 | H13: 0 | I13: 0 | J13: 0 | K13: 19005|13434 | L13: 700|1
A14: 8 | B14: 2 | C14: 1 | D14: 1 | E14: 队伍等级达到%s级（%s/%s级）： | F14: 1 | G14: 20 | H14: 0 | I14: 0 | J14: 0 | K14: 19005|19003 | L14: 10|50000
A15: 9 | B15: 2 | C15: 1 | D15: 1 | E15: 队伍等级达到%s级（%s/%s级）： | F15: 1 | G15: 24 | H15: 0 | I15: 0 | J15: 0 | K15: 19005|13049 | L15: 20|5
A16: 10 | B16: 2 | C16: 1 | D16: 1 | E16: 队伍等级达到%s级（%s/%s级）： | F16: 1 | G16: 27 | H16: 0 | I16: 0 | J16: 0 | K16: 19005|19006 | L16: 30|200
A17: 11 | B17: 2 | C17: 1 | D17: 1 | E17: 队伍等级达到%s级（%s/%s级）： | F17: 1 | G17: 30 | H17: 0 | I17: 0 | J17: 0 | K17: 19005|10004 | L17: 50|100
A18: 12 | B18: 2 | C18: 1 | D18: 1 | E18: 队伍等级达到%s级（%s/%s级）： | F18: 1 | G18: 33 | H18: 0 | I18: 0 | J18: 0 | K18: 19005|19012 | L18: 75|500
A19: 13 | B19: 2 | C19: 1 | D19: 1 | E19: 队伍等级达到%s级（%s/%s级）： | F19: 1 | G19: 36 | H19: 0 | I19: 0 | J19: 0 | K19: 19005|19014 | L19: 100|500
A20: 14 | B20: 2 | C20: 1 | D20: 1 | E20: 队伍等级达到%s级（%s/%s级）： | F20: 1 | G20: 39 | H20: 0 | I20: 0 | J20: 0 | K20: 19005|10010 | L20: 150|200
A21: 15 | B21: 3 | C21: 1 | D21: 1 | E21: 今日内累计充值%s元（%s/%s元）： | F21: 1 | G21: 6 | H21: 0 | I21: 1 | J21: 0 | K21: 10000|10001 | L21: 2|2
A22: 16 | B22: 3 | C22: 1 | D22: 1 | E22: 今日内累计充值%s元（%s/%s元）： | F22: 1 | G22: 6 | H22: 0 | I22: 1 | J22: 0 | K22: 13426 | L22: 1
A23: 17 | B23: 3 | C23: 1 | D23: 1 | E23: 今日内累计充值%s元（%s/%s元）： | F23: 1 | G23: 30 | H23: 0 | I23: 1 | J23: 0 | K23: 13306 | L23: 1
A24: 18 | B24: 3 | C24: 1 | D24: 1 | E24: 今日内累计充值%s元（%s/%s元）： | F24: 1 | G24: 60 | H24: 0 | I24: 1 | J24: 0 | K24: 13305|13306 | L24: 1|1
A25: 19 | B25: 3 | C25: 1 | D25: 1 | E25: 今日内累计充值%s元（%s/%s元）： | F25: 1 | G25: 60 | H25: 0 | I25: 1 | J25: 0 | K25: 13305|13306 | L25: 1|1
A26: 20 | B26: 3 | C26: 1 | D26: 1 | E26: 今日内累计充值%s元（%s/%s元）： | F26: 1 | G26: 90 | H26: 0 | I26: 1 | J26: 0 | K26: 13305|13306 | L26: 2|2
A27: 21 | B27: 3 | C27: 1 | D27: 1 | E27: 今日内累计充值%s元（%s/%s元）： | F27: 1 | G27: 90 | H27: 0 | I27: 1 | J27: 0 | K27: 13305|13306 | L27: 2|2
A28: 22 | B28: 4 | C28: 2 | D28: 1 | E28: 通关第%s章（%s/%s章）： | F28: 1 | G28: 10 | H28: 0 | I28: 0 | J28: 0 | K28: 19103|13049 | L28: 10|3
A29: 23 | B29: 4 | C29: 2 | D29: 1 | E29: 通关第%s章（%s/%s章）： | F29: 1 | G29: 12 | H29: 0 | I29: 0 | J29: 0 | K29: 19103|13049 | L29: 20|5
A30: 24 | B30: 4 | C30: 2 | D30: 1 | E30: 通关第%s章（%s/%s章）： | F30: 1 | G30: 14 | H30: 0 | I30: 0 | J30: 0 | K30: 19103|13049 | L30: 30|10
A31: 25 | B31: 4 | C31: 2 | D31: 1 | E31: 通关第%s章（%s/%s章）： | F31: 1 | G31: 16 | H31: 0 | I31: 0 | J31: 0 | K31: 19103|10003 | L31: 40|70
A32: 26 | B32: 4 | C32: 2 | D32: 1 | E32: 通关第%s章（%s/%s章）： | F32: 1 | G32: 18 | H32: 0 | I32: 0 | J32: 0 | K32: 19103|19012 | L32: 50|3000
A33: 27 | B33: 4 | C33: 2 | D33: 1 | E33: 通关第%s章（%s/%s章）： | F33: 1 | G33: 21 | H33: 0 | I33: 0 | J33: 0 | K33: 19103|19005 | L33: 60|400
A34: 28 | B34: 4 | C34: 2 | D34: 1 | E34: 通关第%s章（%s/%s章）： | F34: 1 | G34: 25 | H34: 0 | I34: 0 | J34: 0 | K34: 19103|19006 | L34: 70|500
A35: 29 | B35: 5 | C35: 3 | D35: 1 | E35: 至少%s件装备强化至%s级以上（%s/%s件）： | F35: 1 | G35: 1 | H35: 40 | I35: 0 | J35: 0 | K35: 19103 | L35: 5
A36: 30 | B36: 5 | C36: 3 | D36: 1 | E36: 至少%s件装备强化至%s级以上（%s/%s件）： | F36: 1 | G36: 1 | H36: 60 | I36: 0 | J36: 0 | K36: 19103 | L36: 10
A37: 31 | B37: 5 | C37: 3 | D37: 1 | E37: 至少%s件装备强化至%s级以上（%s/%s件）： | F37: 1 | G37: 1 | H37: 70 | I37: 0 | J37: 0 | K37: 19103 | L37: 20
A38: 32 | B38: 5 | C38: 3 | D38: 1 | E38: 至少%s件装备强化至%s级以上（%s/%s件）： | F38: 1 | G38: 1 | H38: 80 | I38: 0 | J38: 0 | K38: 19103 | L38: 30
A39: 33 | B39: 5 | C39: 3 | D39: 1 | E39: 至少%s件装备强化至%s级以上（%s/%s件）： | F39: 1 | G39: 1 | H39: 90 | I39: 0 | J39: 0 | K39: 19103 | L39: 40
A40: 34 | B40: 5 | C40: 3 | D40: 1 | E40: 至少%s件装备强化至%s级以上（%s/%s件）： | F40: 1 | G40: 1 | H40: 100 | I40: 0 | J40: 0 | K40: 19103 | L40: 50
A41: 35 | B41: 5 | C41: 3 | D41: 1 | E41: 至少%s件装备强化至%s级以上（%s/%s件）： | F41: 1 | G41: 4 | H41: 100 | I41: 0 | J41: 0 | K41: 19103 | L41: 60
A42: 36 | B42: 5 | C42: 3 | D42: 1 | E42: 至少%s件装备强化至%s级以上（%s/%s件）： | F42: 1 | G42: 8 | H42: 100 | I42: 0 | J42: 0 | K42: 19103 | L42: 80
A43: 37 | B43: 5 | C43: 3 | D43: 1 | E43: 至少%s件装备强化至%s级以上（%s/%s件）： | F43: 1 | G43: 12 | H43: 100 | I43: 0 | J43: 0 | K43: 19103 | L43: 100
A44: 38 | B44: 5 | C44: 3 | D44: 1 | E44: 至少%s件装备强化至%s级以上（%s/%s件）： | F44: 1 | G44: 16 | H44: 100 | I44: 0 | J44: 0 | K44: 19103 | L44: 120
A45: 39 | B45: 5 | C45: 3 | D45: 1 | E45: 至少%s件装备强化至%s级以上（%s/%s件）： | F45: 1 | G45: 20 | H45: 40 | I45: 0 | J45: 0 | K45: 19103 | L45: 20
A46: 40 | B46: 5 | C46: 3 | D46: 1 | E46: 至少%s件装备强化至%s级以上（%s/%s件）： | F46: 1 | G46: 20 | H46: 60 | I46: 0 | J46: 0 | K46: 19103 | L46: 40
A47: 41 | B47: 5 | C47: 3 | D47: 1 | E47: 至少%s件装备强化至%s级以上（%s/%s件）： | F47: 1 | G47: 20 | H47: 80 | I47: 0 | J47: 0 | K47: 19103 | L47: 80
A48: 42 | B48: 5 | C48: 3 | D48: 1 | E48: 至少%s件装备强化至%s级以上（%s/%s件）： | F48: 1 | G48: 20 | H48: 100 | I48: 0 | J48: 0 | K48: 19103 | L48: 160
A49: 43 | B49: 6 | C49: 4 | D49: 1 | E49: 竞技场排名达到%s名（%s/%s）： | F49: 0 | G49: 5000 | H49: 0 | I49: 0 | J49: 0 | K49: 19003 | L49: 50000
A50: 44 | B50: 6 | C50: 4 | D50: 1 | E50: 竞技场排名达到%s名（%s/%s）： | F50: 0 | G50: 4000 | H50: 0 | I50: 0 | J50: 0 | K50: 10003 | L50: 20
A51: 45 | B51: 6 | C51: 4 | D51: 1 | E51: 竞技场排名达到%s名（%s/%s）： | F51: 0 | G51: 3000 | H51: 0 | I51: 0 | J51: 0 | K51: 42201 | L51: 3
A52: 46 | B52: 6 | C52: 4 | D52: 1 | E52: 竞技场排名达到%s名（%s/%s）： | F52: 0 | G52: 2000 | H52: 0 | I52: 0 | J52: 0 | K52: 13049 | L52: 2
A53: 47 | B53: 6 | C53: 4 | D53: 1 | E53: 竞技场排名达到%s名（%s/%s）： | F53: 0 | G53: 1000 | H53: 0 | I53: 0 | J53: 0 | K53: 10003 | L53: 50
A54: 48 | B54: 6 | C54: 4 | D54: 1 | E54: 竞技场排名达到%s名（%s/%s）： | F54: 0 | G54: 500 | H54: 0 | I54: 0 | J54: 0 | K54: 42201 | L54: 10
A55: 49 | B55: 6 | C55: 4 | D55: 1 | E55: 竞技场排名达到%s名（%s/%s）： | F55: 0 | G55: 100 | H55: 0 | I55: 0 | J55: 0 | K55: 13049 | L55: 3
A56: 50 | B56: 6 | C56: 4 | D56: 1 | E56: 竞技场排名达到%s名（%s/%s）： | F56: 0 | G56: 50 | H56: 0 | I56: 0 | J56: 0 | K56: 10003 | L56: 100
A57: 51 | B57: 6 | C57: 4 | D57: 1 | E57: 竞技场排名达到%s名（%s/%s）： | F57: 0 | G57: 20 | H57: 0 | I57: 0 | J57: 0 | K57: 42301 | L57: 5
A58: 52 | B58: 6 | C58: 4 | D58: 1 | E58: 竞技场排名达到%s名（%s/%s）： | F58: 0 | G58: 10 | H58: 0 | I58: 0 | J58: 0 | K58: 13049 | L58: 5
A59: 53 | B59: 7 | C59: 5 | D59: 1 | E59: 累计得到%s个紫品圣器（%s/%s个）： | F59: 1 | G59: 5 | H59: 3 | I59: 0 | J59: 0 | K59: 10001 | L59: 2
A60: 54 | B60: 7 | C60: 5 | D60: 1 | E60: 累计得到%s个紫品圣器（%s/%s个）： | F60: 1 | G60: 10 | H60: 3 | I60: 0 | J60: 0 | K60: 42201 | L60: 5
A61: 55 | B61: 7 | C61: 5 | D61: 1 | E61: 累计得到%s个紫品圣器（%s/%s个）： | F61: 1 | G61: 20 | H61: 3 | I61: 0 | J61: 0 | K61: 13049 | L61: 5
A62: 56 | B62: 7 | C62: 5 | D62: 1 | E62: 累计得到%s个橙品圣器（%s/%s个）： | F62: 1 | G62: 1 | H62: 4 | I62: 0 | J62: 0 | K62: 13049 | L62: 2
A63: 57 | B63: 7 | C63: 5 | D63: 1 | E63: 累计得到%s个橙品圣器（%s/%s个）： | F63: 1 | G63: 2 | H63: 4 | I63: 0 | J63: 0 | K63: 42201 | L63: 5
A64: 58 | B64: 7 | C64: 5 | D64: 1 | E64: 累计得到%s个橙品圣器（%s/%s个）： | F64: 1 | G64: 4 | H64: 4 | I64: 0 | J64: 0 | K64: 10001 | L64: 3
A65: 59 | B65: 7 | C65: 5 | D65: 1 | E65: 累计得到%s个橙品圣器（%s/%s个）： | F65: 1 | G65: 10 | H65: 4 | I65: 0 | J65: 0 | K65: 42301 | L65: 5
A66: 60 | B66: 8 | C66: 6 | D66: 1 | E66: 累计刷新英雄商店%s次（%s/%s次）： | F66: 1 | G66: 20 | H66: 0 | I66: 0 | J66: 0 | K66: 10021 | L66: 5
A67: 61 | B67: 8 | C67: 6 | D67: 1 | E67: 累计刷新英雄商店%s次（%s/%s次）： | F67: 1 | G67: 40 | H67: 0 | I67: 0 | J67: 0 | K67: 19006 | L67: 500
A68: 62 | B68: 8 | C68: 6 | D68: 1 | E68: 累计刷新英雄商店%s次（%s/%s次）： | F68: 1 | G68: 60 | H68: 0 | I68: 0 | J68: 0 | K68: 10021 | L68: 10
A69: 63 | B69: 8 | C69: 6 | D69: 1 | E69: 累计刷新英雄商店%s次（%s/%s次）： | F69: 1 | G69: 80 | H69: 0 | I69: 0 | J69: 0 | K69: 19006 | L69: 750
A70: 64 | B70: 8 | C70: 6 | D70: 1 | E70: 累计刷新英雄商店%s次（%s/%s次）： | F70: 1 | G70: 100 | H70: 0 | I70: 0 | J70: 0 | K70: 10021 | L70: 15
A71: 65 | B71: 8 | C71: 6 | D71: 1 | E71: 累计刷新英雄商店%s次（%s/%s次）： | F71: 1 | G71: 150 | H71: 0 | I71: 0 | J71: 0 | K71: 19006 | L71: 1000
A72: 66 | B72: 8 | C72: 6 | D72: 1 | E72: 累计刷新英雄商店%s次（%s/%s次）： | F72: 1 | G72: 200 | H72: 0 | I72: 0 | J72: 0 | K72: 10021 | L72: 20
A73: 67 | B73: 9 | C73: 7 | D73: 1 | E73: %s个英雄的进阶等级达到%s级（%s/%s个）： | F73: 1 | G73: 1 | H73: 3 | I73: 0 | J73: 0 | K73: 19103|10021 | L73: 20|10
A74: 68 | B74: 9 | C74: 7 | D74: 1 | E74: %s个英雄的进阶等级达到%s级（%s/%s个）： | F74: 1 | G74: 1 | H74: 4 | I74: 0 | J74: 0 | K74: 19103|10021 | L74: 30|10
A75: 69 | B75: 9 | C75: 7 | D75: 1 | E75: %s个英雄的进阶等级达到%s级（%s/%s个）： | F75: 1 | G75: 1 | H75: 5 | I75: 0 | J75: 0 | K75: 19103|10021 | L75: 40|20
A76: 70 | B76: 9 | C76: 7 | D76: 1 | E76: %s个英雄的进阶等级达到%s级（%s/%s个）： | F76: 1 | G76: 1 | H76: 6 | I76: 0 | J76: 0 | K76: 19103|10021 | L76: 50|20
A77: 71 | B77: 9 | C77: 7 | D77: 1 | E77: %s个英雄的进阶等级达到%s级（%s/%s个）： | F77: 1 | G77: 3 | H77: 3 | I77: 0 | J77: 0 | K77: 19103|10003 | L77: 25|50
A78: 72 | B78: 9 | C78: 7 | D78: 1 | E78: %s个英雄的进阶等级达到%s级（%s/%s个）： | F78: 1 | G78: 3 | H78: 4 | I78: 0 | J78: 0 | K78: 19103|10003 | L78: 50|50
A79: 73 | B79: 9 | C79: 7 | D79: 1 | E79: %s个英雄的进阶等级达到%s级（%s/%s个）： | F79: 1 | G79: 3 | H79: 5 | I79: 0 | J79: 0 | K79: 19103|10003 | L79: 75|100
A80: 74 | B80: 9 | C80: 7 | D80: 1 | E80: %s个英雄的进阶等级达到%s级（%s/%s个）： | F80: 1 | G80: 3 | H80: 6 | I80: 0 | J80: 0 | K80: 19103|10003 | L80: 100|100
A81: 75 | B81: 9 | C81: 7 | D81: 1 | E81: %s个英雄的进阶等级达到%s级（%s/%s个）： | F81: 1 | G81: 4 | H81: 3 | I81: 0 | J81: 0 | K81: 19103|19006 | L81: 30|200
A82: 76 | B82: 9 | C82: 7 | D82: 1 | E82: %s个英雄的进阶等级达到%s级（%s/%s个）： | F82: 1 | G82: 4 | H82: 4 | I82: 0 | J82: 0 | K82: 19103|19006 | L82: 60|200
A83: 77 | B83: 9 | C83: 7 | D83: 1 | E83: %s个英雄的进阶等级达到%s级（%s/%s个）： | F83: 1 | G83: 4 | H83: 5 | I83: 0 | J83: 0 | K83: 19103|19006 | L83: 90|400
A84: 78 | B84: 9 | C84: 7 | D84: 1 | E84: %s个英雄的进阶等级达到%s级（%s/%s个）： | F84: 1 | G84: 4 | H84: 6 | I84: 0 | J84: 0 | K84: 19103|19006 | L84: 120|400
A85: 79 | B85: 9 | C85: 7 | D85: 1 | E85: %s个英雄的进阶等级达到%s级（%s/%s个）： | F85: 1 | G85: 5 | H85: 3 | I85: 0 | J85: 0 | K85: 19103|10004 | L85: 40|50
A86: 80 | B86: 9 | C86: 7 | D86: 1 | E86: %s个英雄的进阶等级达到%s级（%s/%s个）： | F86: 1 | G86: 5 | H86: 4 | I86: 0 | J86: 0 | K86: 19103|10004 | L86: 80|50
A87: 81 | B87: 9 | C87: 7 | D87: 1 | E87: %s个英雄的进阶等级达到%s级（%s/%s个）： | F87: 1 | G87: 5 | H87: 5 | I87: 0 | J87: 0 | K87: 19103|10004 | L87: 120|100
A88: 82 | B88: 9 | C88: 7 | D88: 1 | E88: %s个英雄的进阶等级达到%s级（%s/%s个）： | F88: 1 | G88: 5 | H88: 6 | I88: 0 | J88: 0 | K88: 19103|10004 | L88: 160|100
A89: 83 | B89: 10 | C89: 8 | D89: 1 | E89: 累计获得%s点功勋（%s/%s点）： | F89: 1 | G89: 10000 | H89: 0 | I89: 0 | J89: 1 | K89: 10004 | L89: 20
A90: 84 | B90: 10 | C90: 8 | D90: 1 | E90: 累计获得%s点功勋（%s/%s点）： | F90: 1 | G90: 20000 | H90: 0 | I90: 0 | J90: 1 | K90: 10004 | L90: 30
A91: 85 | B91: 10 | C91: 8 | D91: 1 | E91: 累计获得%s点功勋（%s/%s点）： | F91: 1 | G91: 50000 | H91: 0 | I91: 0 | J91: 1 | K91: 10004 | L91: 40
A92: 86 | B92: 10 | C92: 8 | D92: 1 | E92: 累计获得%s点功勋（%s/%s点）： | F92: 1 | G92: 100000 | H92: 0 | I92: 0 | J92: 1 | K92: 10004 | L92: 50
A93: 87 | B93: 10 | C93: 8 | D93: 1 | E93: 累计获得%s点功勋（%s/%s点）： | F93: 1 | G93: 200000 | H93: 0 | I93: 0 | J93: 1 | K93: 10004 | L93: 60
A94: 88 | B94: 10 | C94: 8 | D94: 1 | E94: 累计获得%s点功勋（%s/%s点）： | F94: 1 | G94: 400000 | H94: 0 | I94: 0 | J94: 1 | K94: 10004 | L94: 80
A95: 89 | B95: 10 | C95: 8 | D95: 1 | E95: 累计获得%s点功勋（%s/%s点）： | F95: 1 | G95: 600000 | H95: 0 | I95: 0 | J95: 1 | K95: 10004 | L95: 100
A96: 90 | B96: 11 | C96: 9 | D96: 1 | E96: %s个英雄的潜能等级达到%s级（%s/%s个）： | F96: 1 | G96: 1 | H96: 3 | I96: 0 | J96: 0 | K96: 10004 | L96: 50
A97: 91 | B97: 11 | C97: 9 | D97: 1 | E97: %s个英雄的潜能等级达到%s级（%s/%s个）： | F97: 1 | G97: 1 | H97: 4 | I97: 0 | J97: 0 | K97: 10004 | L97: 50
A98: 92 | B98: 11 | C98: 9 | D98: 1 | E98: %s个英雄的潜能等级达到%s级（%s/%s个）： | F98: 1 | G98: 1 | H98: 5 | I98: 0 | J98: 0 | K98: 10004 | L98: 75
A99: 93 | B99: 11 | C99: 9 | D99: 1 | E99: %s个英雄的潜能等级达到%s级（%s/%s个）： | F99: 1 | G99: 1 | H99: 6 | I99: 0 | J99: 0 | K99: 10004 | L99: 75
A100: 94 | B100: 11 | C100: 9 | D100: 1 | E100: %s个英雄的潜能等级达到%s级（%s/%s个）： | F100: 1 | G100: 2 | H100: 6 | I100: 0 | J100: 0 | K100: 10004 | L100: 100
A101: 95 | B101: 11 | C101: 9 | D101: 1 | E101: %s个英雄的潜能等级达到%s级（%s/%s个）： | F101: 1 | G101: 3 | H101: 6 | I101: 0 | J101: 0 | K101: 10004 | L101: 100
A102: 96 | B102: 11 | C102: 9 | D102: 1 | E102: %s个英雄的潜能等级达到%s级（%s/%s个）： | F102: 1 | G102: 4 | H102: 6 | I102: 0 | J102: 0 | K102: 10004 | L102: 100
A103: 97 | B103: 12 | C103: 10 | D103: 1 | E103: 勇者试炼累计获得%s星（%s/%s星）： | F103: 1 | G103: 50 | H103: 0 | I103: 0 | J103: 0 | K103: 19012 | L103: 200
A104: 98 | B104: 12 | C104: 10 | D104: 1 | E104: 勇者试炼累计获得%s星（%s/%s星）： | F104: 1 | G104: 100 | H104: 0 | I104: 0 | J104: 0 | K104: 19012 | L104: 400
A105: 99 | B105: 12 | C105: 10 | D105: 1 | E105: 勇者试炼累计获得%s星（%s/%s星）： | F105: 1 | G105: 160 | H105: 0 | I105: 0 | J105: 0 | K105: 19012 | L105: 600
A106: 100 | B106: 12 | C106: 10 | D106: 1 | E106: 勇者试炼累计获得%s星（%s/%s星）： | F106: 1 | G106: 230 | H106: 0 | I106: 0 | J106: 0 | K106: 19012 | L106: 800
A107: 101 | B107: 12 | C107: 10 | D107: 1 | E107: 勇者试炼累计获得%s星（%s/%s星）： | F107: 1 | G107: 310 | H107: 0 | I107: 0 | J107: 0 | K107: 19012 | L107: 1000
A108: 102 | B108: 12 | C108: 10 | D108: 1 | E108: 勇者试炼累计获得%s星（%s/%s星）： | F108: 1 | G108: 400 | H108: 0 | I108: 0 | J108: 0 | K108: 19012 | L108: 1500
A109: 103 | B109: 12 | C109: 10 | D109: 1 | E109: 勇者试炼累计获得%s星（%s/%s星）： | F109: 1 | G109: 500 | H109: 0 | I109: 0 | J109: 0 | K109: 19012 | L109: 2000
A110: 104 | B110: 13 | C110: 11 | D110: 1 | E110: 穿戴有%s件绿品以上品质的装备（%s/%s件）： | F110: 1 | G110: 20 | H110: 1 | I110: 0 | J110: 0 | K110: 19103|19012 | L110: 5|500
A111: 105 | B111: 13 | C111: 11 | D111: 1 | E111: 穿戴有%s件蓝品以上品质的装备（%s/%s件）： | F111: 1 | G111: 20 | H111: 2 | I111: 0 | J111: 0 | K111: 19103|19012 | L111: 10|1000
A112: 106 | B112: 13 | C112: 11 | D112: 1 | E112: 穿戴有%s件紫品以上品质的装备（%s/%s件）： | F112: 1 | G112: 4 | H112: 3 | I112: 0 | J112: 0 | K112: 19103|19012 | L112: 10|1000
A113: 107 | B113: 13 | C113: 11 | D113: 1 | E113: 穿戴有%s件紫品以上品质的装备（%s/%s件）： | F113: 1 | G113: 8 | H113: 3 | I113: 0 | J113: 0 | K113: 19103|19012 | L113: 20|1500
A114: 108 | B114: 13 | C114: 11 | D114: 1 | E114: 穿戴有%s件紫品以上品质的装备（%s/%s件）： | F114: 1 | G114: 12 | H114: 3 | I114: 0 | J114: 0 | K114: 19103|19012 | L114: 30|2000
A115: 109 | B115: 13 | C115: 11 | D115: 1 | E115: 穿戴有%s件紫品以上品质的装备（%s/%s件）： | F115: 1 | G115: 16 | H115: 3 | I115: 0 | J115: 0 | K115: 19103|19012 | L115: 40|2500
A116: 110 | B116: 13 | C116: 11 | D116: 1 | E116: 穿戴有%s件橙品以上品质的装备（%s/%s件）： | F116: 1 | G116: 1 | H116: 4 | I116: 0 | J116: 0 | K116: 19103|19012 | L116: 50|2000
A117: 111 | B117: 13 | C117: 11 | D117: 1 | E117: 穿戴有%s件橙品以上品质的装备（%s/%s件）： | F117: 1 | G117: 4 | H117: 4 | I117: 0 | J117: 0 | K117: 19103|19012 | L117: 100|5000
A118: 112 | B118: 14 | C118: 12 | D118: 1 | E118: 穿戴有%s件精炼等级达到%s级的装备（%s/%s件）： | F118: 1 | G118: 1 | H118: 10 | I118: 0 | J118: 0 | K118: 19012 | L118: 500
A119: 113 | B119: 14 | C119: 12 | D119: 1 | E119: 穿戴有%s件精炼等级达到%s级的装备（%s/%s件）： | F119: 1 | G119: 4 | H119: 5 | I119: 0 | J119: 0 | K119: 19012 | L119: 500
A120: 114 | B120: 14 | C120: 12 | D120: 1 | E120: 穿戴有%s件精炼等级达到%s级的装备（%s/%s件）： | F120: 1 | G120: 4 | H120: 10 | I120: 0 | J120: 0 | K120: 19012|10013 | L120: 1000|10
A121: 115 | B121: 14 | C121: 12 | D121: 1 | E121: 穿戴有%s件精炼等级达到%s级的装备（%s/%s件）： | F121: 1 | G121: 8 | H121: 10 | I121: 0 | J121: 0 | K121: 19012|10013 | L121: 1500|20
A122: 116 | B122: 14 | C122: 12 | D122: 1 | E122: 穿戴有%s件精炼等级达到%s级的装备（%s/%s件）： | F122: 1 | G122: 12 | H122: 10 | I122: 0 | J122: 0 | K122: 19012|10013 | L122: 2000|40
A123: 117 | B123: 14 | C123: 12 | D123: 1 | E123: 穿戴有%s件精炼等级达到%s级的装备（%s/%s件）： | F123: 1 | G123: 16 | H123: 10 | I123: 0 | J123: 0 | K123: 19012|10014 | L123: 2500|30
A124: 118 | B124: 14 | C124: 12 | D124: 1 | E124: 穿戴有%s件精炼等级达到%s级的装备（%s/%s件）： | F124: 1 | G124: 20 | H124: 10 | I124: 0 | J124: 0 | K124: 19012|10014 | L124: 3000|50
A125: 119 | B125: 15 | C125: 13 | D125: 1 | E125: 有%s个英雄所有属性培养等级都达到%s级以上（%s/%s个） | F125: 1 | G125: 1 | H125: 2 | I125: 0 | J125: 0 | K125: 10003 | L125: 20
A126: 120 | B126: 15 | C126: 13 | D126: 1 | E126: 有%s个英雄所有属性培养等级都达到%s级以上（%s/%s个） | F126: 1 | G126: 1 | H126: 3 | I126: 0 | J126: 0 | K126: 10003 | L126: 50
A127: 121 | B127: 15 | C127: 13 | D127: 1 | E127: 有%s个英雄所有属性培养等级都达到%s级以上（%s/%s个） | F127: 1 | G127: 1 | H127: 4 | I127: 0 | J127: 0 | K127: 10003 | L127: 75
A128: 122 | B128: 15 | C128: 13 | D128: 1 | E128: 有%s个英雄所有属性培养等级都达到%s级以上（%s/%s个） | F128: 1 | G128: 1 | H128: 5 | I128: 0 | J128: 0 | K128: 10003 | L128: 100
A129: 123 | B129: 15 | C129: 13 | D129: 1 | E129: 有%s个英雄所有属性培养等级都达到%s级以上（%s/%s个） | F129: 1 | G129: 1 | H129: 6 | I129: 0 | J129: 0 | K129: 10003 | L129: 150
A130: 124 | B130: 15 | C130: 13 | D130: 1 | E130: 有%s个英雄所有属性培养等级都达到%s级以上（%s/%s个） | F130: 1 | G130: 5 | H130: 3 | I130: 0 | J130: 0 | K130: 10003 | L130: 100
A131: 125 | B131: 15 | C131: 13 | D131: 1 | E131: 有%s个英雄所有属性培养等级都达到%s级以上（%s/%s个） | F131: 1 | G131: 5 | H131: 4 | I131: 0 | J131: 0 | K131: 10003 | L131: 200
A132: 126 | B132: 15 | C132: 13 | D132: 1 | E132: 有%s个英雄所有属性培养等级都达到%s级以上（%s/%s个） | F132: 1 | G132: 5 | H132: 5 | I132: 0 | J132: 0 | K132: 10003 | L132: 300
A133: 127 | B133: 15 | C133: 13 | D133: 1 | E133: 有%s个英雄所有属性培养等级都达到%s级以上（%s/%s个） | F133: 1 | G133: 5 | H133: 6 | I133: 0 | J133: 0 | K133: 10003 | L133: 400
A134: 128 | B134: 16 | C134: 14 | D134: 1 | E134: 队伍等级达到%s级（%s/%s级）： | F134: 1 | G134: 40 | H134: 0 | I134: 0 | J134: 0 | K134: 19005 | L134: 50
A135: 129 | B135: 16 | C135: 14 | D135: 1 | E135: 队伍等级达到%s级（%s/%s级）： | F135: 1 | G135: 41 | H135: 0 | I135: 0 | J135: 0 | K135: 19005 | L135: 100
A136: 130 | B136: 16 | C136: 14 | D136: 1 | E136: 队伍等级达到%s级（%s/%s级）： | F136: 1 | G136: 42 | H136: 0 | I136: 0 | J136: 0 | K136: 19005 | L136: 150
A137: 131 | B137: 16 | C137: 14 | D137: 1 | E137: 队伍等级达到%s级（%s/%s级）： | F137: 1 | G137: 43 | H137: 0 | I137: 0 | J137: 0 | K137: 19005 | L137: 200
A138: 132 | B138: 16 | C138: 14 | D138: 1 | E138: 队伍等级达到%s级（%s/%s级）： | F138: 1 | G138: 44 | H138: 0 | I138: 0 | J138: 0 | K138: 19005 | L138: 250
A139: 133 | B139: 16 | C139: 14 | D139: 1 | E139: 队伍等级达到%s级（%s/%s级）： | F139: 1 | G139: 45 | H139: 0 | I139: 0 | J139: 0 | K139: 19005 | L139: 300
A140: 134 | B140: 17 | C140: 15 | D140: 1 | E140: 拥有%s点以上的战力（%s/%s点）： | F140: 1 | G140: 200000 | H140: 0 | I140: 0 | J140: 0 | K140: 19005 | L140: 50
A141: 135 | B141: 17 | C141: 15 | D141: 1 | E141: 拥有%s点以上的战力（%s/%s点）： | F141: 1 | G141: 300000 | H141: 0 | I141: 0 | J141: 0 | K141: 19005 | L141: 100
A142: 136 | B142: 17 | C142: 15 | D142: 1 | E142: 拥有%s点以上的战力（%s/%s点）： | F142: 1 | G142: 400000 | H142: 0 | I142: 0 | J142: 0 | K142: 19005 | L142: 150
A143: 137 | B143: 17 | C143: 15 | D143: 1 | E143: 拥有%s点以上的战力（%s/%s点）： | F143: 1 | G143: 500000 | H143: 0 | I143: 0 | J143: 0 | K143: 19005 | L143: 200
A144: 138 | B144: 17 | C144: 15 | D144: 1 | E144: 拥有%s点以上的战力（%s/%s点）： | F144: 1 | G144: 600000 | H144: 0 | I144: 0 | J144: 0 | K144: 19005 | L144: 250
A145: 139 | B145: 17 | C145: 15 | D145: 1 | E145: 拥有%s点以上的战力（%s/%s点）： | F145: 1 | G145: 750000 | H145: 0 | I145: 0 | J145: 0 | K145: 19005 | L145: 300
A146: 140 | B146: 17 | C146: 15 | D146: 1 | E146: 拥有%s点以上的战力（%s/%s点）： | F146: 1 | G146: 900000 | H146: 0 | I146: 0 | J146: 0 | K146: 19005 | L146: 350
A147: 141 | B147: 18 | C147: 16 | D147: 0 | E147: 打折出售： | F147: 1 | G147: 1 | H147: 0 | I147: 0 | J147: 0
A148: 142 | B148: 18 | C148: 16 | D148: 0 | E148: 打折出售： | F148: 1 | G148: 2 | H148: 0 | I148: 0 | J148: 0
A149: 143 | B149: 18 | C149: 16 | D149: 0 | E149: 打折出售： | F149: 1 | G149: 3 | H149: 0 | I149: 0 | J149: 0
A150: 144 | B150: 18 | C150: 16 | D150: 0 | E150: 打折出售： | F150: 1 | G150: 4 | H150: 0 | I150: 0 | J150: 0
A151: 145 | B151: 18 | C151: 16 | D151: 0 | E151: 打折出售： | F151: 1 | G151: 5 | H151: 0 | I151: 0 | J151: 0
A152: 146 | B152: 18 | C152: 16 | D152: 0 | E152: 打折出售： | F152: 1 | G152: 6 | H152: 0 | I152: 0 | J152: 0
A153: 147 | B153: 18 | C153: 16 | D153: 0 | E153: 打折出售： | F153: 1 | G153: 7 | H153: 0 | I153: 0 | J153: 0
A154: 148 | B154: 19 | C154: 99 | D154: 0 | E154: 半价抢购： | F154: 1 | G154: 1 | H154: 0 | I154: 0 | J154: 0 | M154: 蓝色套装，主线推图无障碍！
A155: 149 | B155: 19 | C155: 99 | D155: 0 | E155: 半价抢购： | F155: 1 | G155: 2 | H155: 0 | I155: 0 | J155: 0 | M155: 先人一步获取极品圣器！
A156: 150 | B156: 19 | C156: 99 | D156: 0 | E156: 半价抢购： | F156: 1 | G156: 3 | H156: 0 | I156: 0 | J156: 0 | M156: 海量魂晶，英雄商店随意购
A157: 151 | B157: 19 | C157: 99 | D157: 0 | E157: 半价抢购： | F157: 1 | G157: 4 | H157: 0 | I157: 0 | J157: 0 | M157: 培养英雄潜能，战力疯狂飙升
A158: 152 | B158: 19 | C158: 99 | D158: 0 | E158: 半价抢购： | F158: 1 | G158: 5 | H158: 0 | I158: 0 | J158: 0 | M158: 海量威名，神装商店随意购
A159: 153 | B159: 19 | C159: 99 | D159: 0 | E159: 半价抢购： | F159: 1 | G159: 6 | H159: 0 | I159: 0 | J159: 0 | M159: 大幅提高圣器属性！
A160: 154 | B160: 19 | C160: 99 | D160: 0 | E160: 半价抢购： | F160: 1 | G160: 7 | H160: 0 | I160: 0 | J160: 0 | M160: 极品英雄三选一，战队实力更无敌！
A161: 155 | B161: 1 | C161: 1 | D161: 1 | E161: 测试期间第%s天登录（%s/%s）： | F161: 1 | G161: 1 | H161: 0 | I161: 0 | J161: 0 | K161: 19021|19005|19006|10019 | L161: 60|500|1000|5
A162: 156 | B162: 1 | C162: 1 | D162: 1 | E162: 测试期间第%s天登录（%s/%s）： | F162: 1 | G162: 2 | H162: 0 | I162: 0 | J162: 0 | K162: 19021|19012|10014|13003 | L162: 190|5000|100|40
A163: 157 | B163: 1 | C163: 1 | D163: 1 | E163: 测试期间第%s天登录（%s/%s）： | F163: 1 | G163: 3 | H163: 0 | I163: 0 | J163: 0 | K163: 19021|19012|10004|13009 | L163: 250|10000|500|3
A164: 158 | B164: 1 | C164: 1 | D164: 1 | E164: 测试期间第%s天登录（%s/%s）： | F164: 1 | G164: 4 | H164: 0 | I164: 0 | J164: 0 | K164: 19021|19006|33400|10003 | L164: 500|3000|10|500
A165: 159 | B165: 1 | C165: 1 | D165: 1 | E165: 测试期间第%s天登录（%s/%s）： | F165: 1 | G165: 5 | H165: 0 | I165: 0 | J165: 0 | K165: 19021|19006|13003|13009 | L165: 1000|3000|50|3
A166: 160 | B166: 1 | C166: 1 | D166: 1 | E166: 测试期间第%s天登录（%s/%s）： | F166: 1 | G166: 6 | H166: 0 | I166: 0 | J166: 0 | K166: 19021|19006|13003|10014 | L166: 2000|3000|80|100
A167: 161 | B167: 1 | C167: 1 | D167: 1 | E167: 测试期间第%s天登录（%s/%s）： | F167: 1 | G167: 7 | H167: 0 | I167: 0 | J167: 0 | K167: 19021|19006|10003|10004 | L167: 4000|5000|1000|1000
A168: 162 | B168: 24 | C168: 18 | D168: 1 | E168: 无尽深渊击杀%s只怪物（%s/%s）： | F168: 1 | G168: 200 | H168: 0 | I168: 0 | J168: 1 | K168: 19028 | L168: 50
A169: 163 | B169: 24 | C169: 18 | D169: 1 | E169: 无尽深渊击杀%s只怪物（%s/%s）： | F169: 1 | G169: 400 | H169: 0 | I169: 0 | J169: 1 | K169: 19028 | L169: 50
A170: 164 | B170: 24 | C170: 18 | D170: 1 | E170: 无尽深渊击杀%s只怪物（%s/%s）： | F170: 1 | G170: 600 | H170: 0 | I170: 0 | J170: 1 | K170: 19028 | L170: 100
A171: 165 | B171: 24 | C171: 18 | D171: 1 | E171: 无尽深渊击杀%s只怪物（%s/%s）： | F171: 1 | G171: 900 | H171: 0 | I171: 0 | J171: 1 | K171: 19028 | L171: 100
A172: 166 | B172: 24 | C172: 18 | D172: 1 | E172: 无尽深渊击杀%s只怪物（%s/%s）： | F172: 1 | G172: 1200 | H172: 0 | I172: 0 | J172: 1 | K172: 19028 | L172: 150
A173: 167 | B173: 24 | C173: 18 | D173: 1 | E173: 无尽深渊击杀%s只怪物（%s/%s）： | F173: 1 | G173: 1500 | H173: 0 | I173: 0 | J173: 1 | K173: 19028 | L173: 150
A174: 168 | B174: 24 | C174: 18 | D174: 1 | E174: 无尽深渊击杀%s只怪物（%s/%s）： | F174: 1 | G174: 2000 | H174: 0 | I174: 0 | J174: 1 | K174: 19028 | L174: 200
A175: 169 | B175: 24 | C175: 18 | D175: 1 | E175: 无尽深渊击杀%s只怪物（%s/%s）： | F175: 1 | G175: 2500 | H175: 0 | I175: 0 | J175: 1 | K175: 19028 | L175: 200
A176: 170 | B176: 24 | C176: 18 | D176: 1 | E176: 无尽深渊击杀%s只怪物（%s/%s）： | F176: 1 | G176: 3000 | H176: 0 | I176: 0 | J176: 1 | K176: 19028 | L176: 300
A177: 171 | B177: 25 | C177: 19 | D177: 1 | E177: 精灵强化等级达到%s级（%s/%s）： | F177: 1 | G177: 3 | H177: 0 | I177: 0 | J177: 0 | K177: 13646 | L177: 2
A178: 172 | B178: 25 | C178: 19 | D178: 1 | E178: 精灵强化等级达到%s级（%s/%s）： | F178: 1 | G178: 6 | H178: 0 | I178: 0 | J178: 0 | K178: 13646 | L178: 4
A179: 173 | B179: 25 | C179: 19 | D179: 1 | E179: 精灵强化等级达到%s级（%s/%s）： | F179: 1 | G179: 9 | H179: 0 | I179: 0 | J179: 0 | K179: 13646 | L179: 6
A180: 174 | B180: 25 | C180: 19 | D180: 1 | E180: 精灵强化等级达到%s级（%s/%s）： | F180: 1 | G180: 12 | H180: 0 | I180: 0 | J180: 0 | K180: 13646 | L180: 8
A181: 175 | B181: 25 | C181: 19 | D181: 1 | E181: 精灵强化等级达到%s级（%s/%s）： | F181: 1 | G181: 15 | H181: 0 | I181: 0 | J181: 0 | K181: 13646 | L181: 10
A182: 176 | B182: 25 | C182: 19 | D182: 1 | E182: 精灵强化等级达到%s级（%s/%s）： | F182: 1 | G182: 20 | H182: 0 | I182: 0 | J182: 0 | K182: 13646 | L182: 15
A183: 177 | B183: 26 | C183: 19 | D183: 1 | E183: 精灵升华达到第%s阶段（%s/%s）： | F183: 1 | G183: 2 | H183: 0 | I183: 0 | J183: 0 | K183: 10022 | L183: 5
A184: 178 | B184: 26 | C184: 19 | D184: 1 | E184: 精灵升华达到第%s阶段（%s/%s）： | F184: 1 | G184: 3 | H184: 0 | I184: 0 | J184: 0 | K184: 10022 | L184: 5
A185: 179 | B185: 26 | C185: 19 | D185: 1 | E185: 精灵升华达到第%s阶段（%s/%s）： | F185: 1 | G185: 4 | H185: 0 | I185: 0 | J185: 0 | K185: 10022 | L185: 7
A186: 180 | B186: 26 | C186: 19 | D186: 1 | E186: 精灵升华达到第%s阶段（%s/%s）： | F186: 1 | G186: 5 | H186: 0 | I186: 0 | J186: 0 | K186: 10022 | L186: 8
A187: 181 | B187: 26 | C187: 19 | D187: 1 | E187: 精灵升华达到第%s阶段（%s/%s）： | F187: 1 | G187: 6 | H187: 0 | I187: 0 | J187: 0 | K187: 10022 | L187: 10
A188: 1000 | B188: 1 | C188: 1 | D188: 1 | E188: 开服第%s天登录（%s/%s）： | F188: 1 | G188: 8 | H188: 0 | I188: 0 | J188: 0 | K188: 19005|10000 | L188: 200|2
A189: 1001 | B189: 3 | C189: 1 | D189: 1 | E189: 今日累计充值%s元（%s/%s元）： | F189: 1 | G189: 30 | H189: 0 | I189: 1 | J189: 0 | K189: 10000|19006 | L189: 5|600
A190: 1002 | B190: 3 | C190: 1 | D190: 1 | E190: 今日累计充值%s元（%s/%s元）： | F190: 1 | G190: 60 | H190: 0 | I190: 1 | J190: 0 | K190: 10001|13012 | L190: 5|1
A191: 1010 | B191: 20 | C191: 2 | D191: 1 | E191: 挑战主线副本%s次（%s/%s次）： | F191: 1 | G191: 10 | H191: 0 | I191: 0 | J191: 1 | K191: 19006 | L191: 20
A192: 1011 | B192: 20 | C192: 2 | D192: 1 | E192: 挑战主线副本%s次（%s/%s次）： | F192: 1 | G192: 20 | H192: 0 | I192: 0 | J192: 1 | K192: 19006 | L192: 30
A193: 1012 | B193: 20 | C193: 2 | D193: 1 | E193: 挑战主线副本%s次（%s/%s次）： | F193: 1 | G193: 40 | H193: 0 | I193: 0 | J193: 1 | K193: 19006 | L193: 50
A194: 1013 | B194: 20 | C194: 2 | D194: 1 | E194: 挑战主线副本%s次（%s/%s次）： | F194: 1 | G194: 60 | H194: 0 | I194: 0 | J194: 1 | K194: 19006 | L194: 50
A195: 1014 | B195: 20 | C195: 2 | D195: 1 | E195: 挑战主线副本%s次（%s/%s次）： | F195: 1 | G195: 80 | H195: 0 | I195: 0 | J195: 1 | K195: 19006 | L195: 50
A196: 1015 | B196: 20 | C196: 2 | D196: 1 | E196: 挑战主线副本%s次（%s/%s次）： | F196: 1 | G196: 100 | H196: 0 | I196: 0 | J196: 1 | K196: 19006 | L196: 50
A197: 1020 | B197: 18 | C197: 16 | D197: 0 | E197: 打折出售： | F197: 1 | G197: 10 | H197: 0 | I197: 0 | J197: 0
A198: 1021 | B198: 18 | C198: 16 | D198: 0 | E198: 打折出售： | F198: 1 | G198: 11 | H198: 0 | I198: 0 | J198: 0
A199: 1022 | B199: 18 | C199: 16 | D199: 0 | E199: 打折出售： | F199: 1 | G199: 12 | H199: 0 | I199: 0 | J199: 0
A200: 1023 | B200: 18 | C200: 16 | D200: 0 | E200: 打折出售： | F200: 1 | G200: 13 | H200: 0 | I200: 0 | J200: 0
A201: 1030 | B201: 19 | C201: 99 | D201: 0 | E201: 半价出售： | F201: 1 | G201: 19 | H201: 0 | I201: 0 | J201: 0
A202: 1100 | B202: 1 | C202: 1 | D202: 1 | E202: 开服第%s天登录（%s/%s）： | F202: 1 | G202: 9 | H202: 0 | I202: 0 | J202: 0 | K202: 19005|10001 | L202: 200|2
A203: 1101 | B203: 3 | C203: 1 | D203: 1 | E203: 今日累计充值%s元（%s/%s元）： | F203: 1 | G203: 30 | H203: 0 | I203: 1 | J203: 0 | K203: 10001|19006 | L203: 5|600
A204: 1102 | B204: 3 | C204: 1 | D204: 1 | E204: 今日累计充值%s元（%s/%s元）： | F204: 1 | G204: 60 | H204: 0 | I204: 1 | J204: 0 | K204: 10000|13012 | L204: 5|1
A205: 1110 | B205: 20 | C205: 2 | D205: 1 | E205: 挑战主线副本%s次（%s/%s次）： | F205: 1 | G205: 150 | H205: 0 | I205: 0 | J205: 1 | K205: 19006 | L205: 50
A206: 1111 | B206: 20 | C206: 2 | D206: 1 | E206: 挑战主线副本%s次（%s/%s次）： | F206: 1 | G206: 200 | H206: 0 | I206: 0 | J206: 1 | K206: 19006 | L206: 50
A207: 1112 | B207: 20 | C207: 2 | D207: 1 | E207: 挑战主线副本%s次（%s/%s次）： | F207: 1 | G207: 250 | H207: 0 | I207: 0 | J207: 1 | K207: 19006 | L207: 50
A208: 1113 | B208: 20 | C208: 2 | D208: 1 | E208: 挑战主线副本%s次（%s/%s次）： | F208: 1 | G208: 300 | H208: 0 | I208: 0 | J208: 1 | K208: 19006 | L208: 50
A209: 1114 | B209: 20 | C209: 2 | D209: 1 | E209: 挑战主线副本%s次（%s/%s次）： | F209: 1 | G209: 400 | H209: 0 | I209: 0 | J209: 1 | K209: 19006 | L209: 100
A210: 1115 | B210: 20 | C210: 2 | D210: 1 | E210: 挑战主线副本%s次（%s/%s次）： | F210: 1 | G210: 500 | H210: 0 | I210: 0 | J210: 1 | K210: 19006 | L210: 100
A211: 1120 | B211: 18 | C211: 16 | D211: 0 | E211: 打折出售： | F211: 1 | G211: 20 | H211: 0 | I211: 0 | J211: 0
A212: 1121 | B212: 18 | C212: 16 | D212: 0 | E212: 打折出售： | F212: 1 | G212: 21 | H212: 0 | I212: 0 | J212: 0
A213: 1122 | B213: 18 | C213: 16 | D213: 0 | E213: 打折出售： | F213: 1 | G213: 22 | H213: 0 | I213: 0 | J213: 0
A214: 1123 | B214: 18 | C214: 16 | D214: 0 | E214: 打折出售： | F214: 1 | G214: 23 | H214: 0 | I214: 0 | J214: 0
A215: 1130 | B215: 19 | C215: 99 | D215: 0 | E215: 半价出售： | F215: 1 | G215: 29 | H215: 0 | I215: 0 | J215: 0
A216: 1200 | B216: 1 | C216: 1 | D216: 1 | E216: 开服第%s天登录（%s/%s）： | F216: 1 | G216: 10 | H216: 0 | I216: 0 | J216: 0 | K216: 19005|10001 | L216: 200|2
A217: 1201 | B217: 3 | C217: 1 | D217: 1 | E217: 今日累计充值%s元（%s/%s元）： | F217: 1 | G217: 30 | H217: 0 | I217: 1 | J217: 0 | K217: 10001|13319 | L217: 5|2
A218: 1202 | B218: 3 | C218: 1 | D218: 1 | E218: 今日累计充值%s元（%s/%s元）： | F218: 1 | G218: 60 | H218: 0 | I218: 1 | J218: 0 | K218: 10001|13319 | L218: 5|2
A219: 1210 | B219: 21 | C219: 5 | D219: 1 | E219: 圣器争夺中挑战%s次（%s/%s次）： | F219: 1 | G219: 50 | H219: 0 | I219: 0 | J219: 1 | K219: 13049 | L219: 2
A220: 1211 | B220: 21 | C220: 5 | D220: 1 | E220: 圣器争夺中挑战%s次（%s/%s次）： | F220: 1 | G220: 100 | H220: 0 | I220: 0 | J220: 1 | K220: 13049 | L220: 3
A221: 1212 | B221: 7 | C221: 5 | D221: 1 | E221: 累计得到%s个蓝品圣器（%s/%s个）： | F221: 1 | G221: 10 | H221: 2 | I221: 0 | J221: 1 | K221: 10010 | L221: 20
A222: 1213 | B222: 7 | C222: 5 | D222: 1 | E222: 累计得到%s个紫品圣器（%s/%s个）： | F222: 1 | G222: 5 | H222: 3 | I222: 0 | J222: 1 | K222: 10010 | L222: 20
A223: 1214 | B223: 7 | C223: 5 | D223: 1 | E223: 累计得到%s个橙品圣器（%s/%s个）： | F223: 1 | G223: 5 | H223: 4 | I223: 0 | J223: 1 | K223: 10010 | L223: 40
A224: 1220 | B224: 18 | C224: 16 | D224: 0 | E224: 打折出售： | F224: 1 | G224: 30 | H224: 0 | I224: 0 | J224: 0
A225: 1221 | B225: 18 | C225: 16 | D225: 0 | E225: 打折出售： | F225: 1 | G225: 31 | H225: 0 | I225: 0 | J225: 0
A226: 1222 | B226: 18 | C226: 16 | D226: 0 | E226: 打折出售： | F226: 1 | G226: 32 | H226: 0 | I226: 0 | J226: 0
A227: 1223 | B227: 18 | C227: 16 | D227: 0 | E227: 打折出售： | F227: 1 | G227: 33 | H227: 0 | I227: 0 | J227: 0
A228: 1230 | B228: 19 | C228: 99 | D228: 0 | E228: 半价出售： | F228: 1 | G228: 39 | H228: 0 | I228: 0 | J228: 0
A229: 1300 | B229: 1 | C229: 1 | D229: 1 | E229: 开服第%s天登录（%s/%s）： | F229: 1 | G229: 11 | H229: 0 | I229: 0 | J229: 0 | K229: 19005|10001 | L229: 200|2
A230: 1301 | B230: 3 | C230: 1 | D230: 1 | E230: 今日累计充值%s元（%s/%s元）： | F230: 1 | G230: 30 | H230: 0 | I230: 1 | J230: 0 | K230: 10001|13319 | L230: 5|2
A231: 1302 | B231: 3 | C231: 1 | D231: 1 | E231: 今日累计充值%s元（%s/%s元）： | F231: 1 | G231: 60 | H231: 0 | I231: 1 | J231: 0 | K231: 10001|13319 | L231: 5|2
A232: 1310 | B232: 21 | C232: 5 | D232: 1 | E232: 圣器争夺中挑战%s次（%s/%s次）： | F232: 1 | G232: 150 | H232: 0 | I232: 0 | J232: 1 | K232: 13049 | L232: 4
A233: 1311 | B233: 21 | C233: 5 | D233: 1 | E233: 圣器争夺中挑战%s次（%s/%s次）： | F233: 1 | G233: 200 | H233: 0 | I233: 0 | J233: 1 | K233: 13049 | L233: 5
A234: 1312 | B234: 7 | C234: 5 | D234: 1 | E234: 累计得到%s个蓝品圣器（%s/%s个）： | F234: 1 | G234: 20 | H234: 2 | I234: 0 | J234: 1 | K234: 10010 | L234: 30
A235: 1313 | B235: 7 | C235: 5 | D235: 1 | E235: 累计得到%s个紫品圣器（%s/%s个）： | F235: 1 | G235: 10 | H235: 3 | I235: 0 | J235: 1 | K235: 10010 | L235: 30
A236: 1314 | B236: 7 | C236: 5 | D236: 1 | E236: 累计得到%s个橙品圣器（%s/%s个）： | F236: 1 | G236: 10 | H236: 4 | I236: 0 | J236: 1 | K236: 10010 | L236: 50
A237: 1320 | B237: 18 | C237: 16 | D237: 0 | E237: 打折出售： | F237: 1 | G237: 40 | H237: 0 | I237: 0 | J237: 0
A238: 1321 | B238: 18 | C238: 16 | D238: 0 | E238: 打折出售： | F238: 1 | G238: 41 | H238: 0 | I238: 0 | J238: 0
A239: 1322 | B239: 18 | C239: 16 | D239: 0 | E239: 打折出售： | F239: 1 | G239: 42 | H239: 0 | I239: 0 | J239: 0
A240: 1323 | B240: 18 | C240: 16 | D240: 0 | E240: 打折出售： | F240: 1 | G240: 43 | H240: 0 | I240: 0 | J240: 0
A241: 1330 | B241: 19 | C241: 99 | D241: 0 | E241: 半价出售： | F241: 1 | G241: 49 | H241: 0 | I241: 0 | J241: 0
A242: 1400 | B242: 1 | C242: 1 | D242: 1 | E242: 开服第%s天登录（%s/%s）： | F242: 1 | G242: 12 | H242: 0 | I242: 0 | J242: 0 | K242: 19005|10000 | L242: 200|2
A243: 1401 | B243: 3 | C243: 1 | D243: 1 | E243: 今日累计充值%s元（%s/%s元）： | F243: 1 | G243: 30 | H243: 0 | I243: 1 | J243: 0 | K243: 10000|19012 | L243: 5|6000
A244: 1402 | B244: 3 | C244: 1 | D244: 1 | E244: 今日累计充值%s元（%s/%s元）： | F244: 1 | G244: 60 | H244: 0 | I244: 1 | J244: 0 | K244: 10000|10014 | L244: 5|30
A245: 1410 | B245: 22 | C245: 10 | D245: 1 | E245: 勇者试炼重置%s次（%s/%s次）： | F245: 1 | G245: 1 | H245: 0 | I245: 0 | J245: 1 | K245: 10011 | L245: 50
A246: 1411 | B246: 22 | C246: 10 | D246: 1 | E246: 勇者试炼重置%s次（%s/%s次）： | F246: 1 | G246: 2 | H246: 0 | I246: 0 | J246: 1 | K246: 10012 | L246: 50
A247: 1412 | B247: 12 | C247: 10 | D247: 1 | E247: 勇者试炼累计获得%s星（%s/%s星）： | F247: 1 | G247: 100 | H247: 0 | I247: 0 | J247: 1 | K247: 19012 | L247: 1000
A248: 1413 | B248: 12 | C248: 10 | D248: 1 | E248: 勇者试炼累计获得%s星（%s/%s星）： | F248: 1 | G248: 150 | H248: 0 | I248: 0 | J248: 1 | K248: 19012 | L248: 1000
A249: 1420 | B249: 18 | C249: 16 | D249: 0 | E249: 打折出售： | F249: 1 | G249: 50 | H249: 0 | I249: 0 | J249: 0
A250: 1421 | B250: 18 | C250: 16 | D250: 0 | E250: 打折出售： | F250: 1 | G250: 51 | H250: 0 | I250: 0 | J250: 0
A251: 1422 | B251: 18 | C251: 16 | D251: 0 | E251: 打折出售： | F251: 1 | G251: 52 | H251: 0 | I251: 0 | J251: 0
A252: 1423 | B252: 18 | C252: 16 | D252: 0 | E252: 打折出售： | F252: 1 | G252: 53 | H252: 0 | I252: 0 | J252: 0
A253: 1430 | B253: 19 | C253: 99 | D253: 0 | E253: 半价出售： | F253: 1 | G253: 59 | H253: 0 | I253: 0 | J253: 0
A254: 1500 | B254: 1 | C254: 1 | D254: 1 | E254: 开服第%s天登录（%s/%s）： | F254: 1 | G254: 13 | H254: 0 | I254: 0 | J254: 0 | K254: 19005|10000 | L254: 200|2
A255: 1501 | B255: 3 | C255: 1 | D255: 1 | E255: 今日累计充值%s元（%s/%s元）： | F255: 1 | G255: 30 | H255: 0 | I255: 1 | J255: 0 | K255: 10000|19012 | L255: 5|6000
A256: 1502 | B256: 3 | C256: 1 | D256: 1 | E256: 今日累计充值%s元（%s/%s元）： | F256: 1 | G256: 60 | H256: 0 | I256: 1 | J256: 0 | K256: 10000|10014 | L256: 5|30
A257: 1510 | B257: 22 | C257: 10 | D257: 1 | E257: 勇者试炼重置%s次（%s/%s次）： | F257: 1 | G257: 7 | H257: 0 | I257: 0 | J257: 1 | K257: 10013 | L257: 50
A258: 1511 | B258: 22 | C258: 10 | D258: 1 | E258: 勇者试炼重置%s次（%s/%s次）： | F258: 1 | G258: 9 | H258: 0 | I258: 0 | J258: 1 | K258: 10014 | L258: 50
A259: 1512 | B259: 12 | C259: 10 | D259: 1 | E259: 勇者试炼累计获得%s星（%s/%s星）： | F259: 1 | G259: 200 | H259: 0 | I259: 0 | J259: 1 | K259: 19012 | L259: 2000
A260: 1513 | B260: 12 | C260: 10 | D260: 1 | E260: 勇者试炼累计获得%s星（%s/%s星）： | F260: 1 | G260: 250 | H260: 0 | I260: 0 | J260: 1 | K260: 19012 | L260: 2000
A261: 1520 | B261: 18 | C261: 16 | D261: 0 | E261: 打折出售： | F261: 1 | G261: 60 | H261: 0 | I261: 0 | J261: 0
A262: 1521 | B262: 18 | C262: 16 | D262: 0 | E262: 打折出售： | F262: 1 | G262: 61 | H262: 0 | I262: 0 | J262: 0
A263: 1522 | B263: 18 | C263: 16 | D263: 0 | E263: 打折出售： | F263: 1 | G263: 62 | H263: 0 | I263: 0 | J263: 0
A264: 1523 | B264: 18 | C264: 16 | D264: 0 | E264: 打折出售： | F264: 1 | G264: 63 | H264: 0 | I264: 0 | J264: 0
A265: 1530 | B265: 19 | C265: 99 | D265: 0 | E265: 半价出售： | F265: 1 | G265: 69 | H265: 0 | I265: 0 | J265: 0
A266: 1600 | B266: 1 | C266: 1 | D266: 1 | E266: 开服第%s天登录（%s/%s）： | F266: 1 | G266: 14 | H266: 0 | I266: 0 | J266: 0 | K266: 13417 | L266: 1
A267: 1601 | B267: 3 | C267: 1 | D267: 1 | E267: 今日累计充值%s元（%s/%s元）： | F267: 1 | G267: 30 | H267: 0 | I267: 1 | J267: 0 | K267: 19028 | L267: 750
A268: 1602 | B268: 3 | C268: 1 | D268: 1 | E268: 今日累计充值%s元（%s/%s元）： | F268: 1 | G268: 60 | H268: 0 | I268: 1 | J268: 0 | K268: 19028 | L268: 1500
A269: 1610 | B269: 23 | C269: 4 | D269: 1 | E269: 累计挑战竞技场%s次（%s/%s次）： | F269: 1 | G269: 10 | H269: 0 | I269: 0 | J269: 1 | K269: 19013 | L269: 1000
A270: 1611 | B270: 23 | C270: 4 | D270: 1 | E270: 累计挑战竞技场%s次（%s/%s次）： | F270: 1 | G270: 20 | H270: 0 | I270: 0 | J270: 1 | K270: 10003 | L270: 50
A271: 1612 | B271: 23 | C271: 4 | D271: 1 | E271: 累计挑战竞技场%s次（%s/%s次）： | F271: 1 | G271: 40 | H271: 0 | I271: 0 | J271: 1 | K271: 19013 | L271: 1500
A272: 1613 | B272: 23 | C272: 4 | D272: 1 | E272: 累计挑战竞技场%s次（%s/%s次）： | F272: 1 | G272: 60 | H272: 0 | I272: 0 | J272: 1 | K272: 10003 | L272: 50
A273: 1614 | B273: 23 | C273: 4 | D273: 1 | E273: 累计挑战竞技场%s次（%s/%s次）： | F273: 1 | G273: 80 | H273: 0 | I273: 0 | J273: 1 | K273: 19013 | L273: 2000
A274: 1615 | B274: 23 | C274: 4 | D274: 1 | E274: 累计挑战竞技场%s次（%s/%s次）： | F274: 1 | G274: 100 | H274: 0 | I274: 0 | J274: 1 | K274: 10003 | L274: 100
A275: 1620 | B275: 18 | C275: 16 | D275: 0 | E275: 打折出售： | F275: 1 | G275: 70 | H275: 0 | I275: 0 | J275: 0
A276: 1621 | B276: 18 | C276: 16 | D276: 0 | E276: 打折出售： | F276: 1 | G276: 71 | H276: 0 | I276: 0 | J276: 0
A277: 1622 | B277: 18 | C277: 16 | D277: 0 | E277: 打折出售： | F277: 1 | G277: 72 | H277: 0 | I277: 0 | J277: 0
A278: 1623 | B278: 18 | C278: 16 | D278: 0 | E278: 打折出售： | F278: 1 | G278: 73 | H278: 0 | I278: 0 | J278: 0
A279: 1630 | B279: 19 | C279: 99 | D279: 0 | E279: 半价出售： | F279: 1 | G279: 79 | H279: 0 | I279: 0 | J279: 0

Sheet: 7天商店
A1: goods_id|goods_id | B1: item_id|item_id | C1: item_num|item_num | D1: buy_num_max|buy_num_max | E1: cost_type_list|cost_type_list | F1: cost_value_list|cost_value_list | G1: | | H1: par|
A2: 不可空 | B2: 不可空 | C2: 不可空 | D2: 不可空 | E2: 可空#不需字段 | F2: 可空#不需字段 | G2: 可空#不需字段 | H2: 可空#不需字段
A3: 数字 | B3: 数字 | C3: 数字 | D3: 数字 | E3: 一维数组 | F3: 一维数组 | G3: 数字 | H3: 数字
E4: 不定长 | F4: 不定长
A6: 商品ID | B6: 物品ID | C6: 物品数量 | D6: 购买数量上限(0=表示无上限) | E6: 消耗类型列表 | F6: 消耗值列表 | G6: 折扣 | H6: 原价
A7: 1 | B7: 13601 | C7: 1 | D7: 1 | E7: 5 | F7: 480 | G7: 5 | H7: 960
A8: 2 | B8: 13316 | C8: 1 | D8: 1 | E8: 5 | F8: 500 | G8: 5 | H8: 1000
A9: 3 | B9: 19006 | C9: 1500 | D9: 1 | E9: 5 | F9: 750 | G9: 5 | H9: =ROUND(RC[-2]/RC[-1]*10,0) -> 1500
A10: 4 | B10: 10022 | C10: 50 | D10: 1 | E10: 5 | F10: 1250 | G10: 5 | H10: =ROUND(RC[-2]/RC[-1]*10,0) -> 2500
A11: 5 | B11: 10004 | C11: 200 | D11: 1 | E11: 5 | F11: 1500 | G11: 5 | H11: =ROUND(RC[-2]/RC[-1]*10,0) -> 3000
A12: 6 | B12: 10010 | C12: 200 | D12: 1 | E12: 5 | F12: 500 | G12: 5 | H12: =ROUND(RC[-2]/RC[-1]*10,0) -> 1000
A13: 7 | B13: 13435 | C13: 1 | D13: 1 | E13: 5 | F13: 1000 | G13: 5 | H13: =ROUND(RC[-2]/RC[-1]*10,0) -> 2000
A14: 10 | B14: 10004 | C14: 25 | D14: 1 | E14: 5 | F14: 150 | G14: 4 | H14: =ROUND(RC[-2]/RC[-1]*10,0) -> 375
A15: 11 | B15: 19103 | C15: 20 | D15: 1 | E15: 5 | F15: 140 | G15: 7 | H15: =ROUND(RC[-2]/RC[-1]*10,0) -> 200
A16: 12 | B16: 19006 | C16: 400 | D16: 1 | E16: 5 | F16: 320 | G16: 8 | H16: =ROUND(RC[-2]/RC[-1]*10,0) -> 400
A17: 13 | B17: 10000 | C17: 5 | D17: 1 | E17: 5 | F17: 125 | G17: 10 | H17: =ROUND(RC[-2]/RC[-1]*10,0) -> 125
A18: 19 | B18: 19006 | C18: 2000 | D18: 1 | E18: 5 | F18: 1000 | G18: 5 | H18: =ROUND(RC[-2]/RC[-1]*10,0) -> 2000
A19: 20 | B19: 10004 | C19: 25 | D19: 1 | E19: 5 | F19: 150 | G19: 4 | H19: =ROUND(RC[-2]/RC[-1]*10,0) -> 375
A20: 21 | B20: 19103 | C20: 20 | D20: 1 | E20: 5 | F20: 140 | G20: 7 | H20: =ROUND(RC[-2]/RC[-1]*10,0) -> 200
A21: 22 | B21: 19006 | C21: 400 | D21: 1 | E21: 5 | F21: 320 | G21: 8 | H21: =ROUND(RC[-2]/RC[-1]*10,0) -> 400
A22: 23 | B22: 10000 | C22: 5 | D22: 1 | E22: 5 | F22: 125 | G22: 10 | H22: =ROUND(RC[-2]/RC[-1]*10,0) -> 125
A23: 29 | B23: 19103 | C23: 200 | D23: 1 | E23: 5 | F23: 1000 | G23: 5 | H23: =ROUND(RC[-2]/RC[-1]*10,0) -> 2000
A24: 30 | B24: 13008 | C24: 5 | D24: 1 | E24: 5 | F24: 700 | G24: 7 | H24: =ROUND(RC[-2]/RC[-1]*10,0) -> 1000
A25: 31 | B25: 42301 | C25: 5 | D25: 1 | E25: 5 | F25: 375 | G25: 2 | H25: =ROUND(RC[-2]/RC[-1]*10,0) -> 1875
A26: 32 | B26: 10010 | C26: 100 | D26: 1 | E26: 5 | F26: 350 | G26: 7 | H26: =ROUND(RC[-2]/RC[-1]*10,0) -> 500
A27: 33 | B27: 10001 | C27: 5 | D27: 1 | E27: 5 | F27: 125 | G27: 10 | H27: =ROUND(RC[-2]/RC[-1]*10,0) -> 125
A28: 39 | B28: 13305 | C28: 3 | D28: 1 | E28: 5 | F28: 750 | G28: 5 | H28: =ROUND(RC[-2]/RC[-1]*10,0) -> 1500
A29: 40 | B29: 13008 | C29: 5 | D29: 1 | E29: 5 | F29: 700 | G29: 7 | H29: =ROUND(RC[-2]/RC[-1]*10,0) -> 1000
A30: 41 | B30: 42301 | C30: 5 | D30: 1 | E30: 5 | F30: 375 | G30: 2 | H30: =ROUND(RC[-2]/RC[-1]*10,0) -> 1875
A31: 42 | B31: 10010 | C31: 100 | D31: 1 | E31: 5 | F31: 350 | G31: 7 | H31: =ROUND(RC[-2]/RC[-1]*10,0) -> 500
A32: 43 | B32: 10001 | C32: 5 | D32: 1 | E32: 5 | F32: 125 | G32: 10 | H32: =ROUND(RC[-2]/RC[-1]*10,0) -> 125
A33: 49 | B33: 13306 | C33: 3 | D33: 1 | E33: 5 | F33: 750 | G33: 5 | H33: =ROUND(RC[-2]/RC[-1]*10,0) -> 1500
A34: 50 | B34: 19012 | C34: 3000 | D34: 1 | E34: 5 | F34: 210 | G34: 7 | H34: =ROUND(RC[-2]/RC[-1]*10,0) -> 300
A35: 51 | B35: 19103 | C35: 50 | D35: 1 | E35: 5 | F35: 350 | G35: 7 | H35: =ROUND(RC[-2]/RC[-1]*10,0) -> 500
A36: 52 | B36: 10022 | C36: 10 | D36: 1 | E36: 5 | F36: 400 | G36: 8 | H36: =ROUND(RC[-2]/RC[-1]*10,0) -> 500
A37: 53 | B37: 10000 | C37: 5 | D37: 1 | E37: 5 | F37: 125 | G37: 10 | H37: =ROUND(RC[-2]/RC[-1]*10,0) -> 125
A38: 59 | B38: 13324 | C38: 1 | D38: 1 | E38: 5 | F38: 1250 | G38: 5 | H38: =ROUND(RC[-2]/RC[-1]*10,0) -> 2500
A39: 60 | B39: 19012 | C39: 3000 | D39: 1 | E39: 5 | F39: 210 | G39: 7 | H39: =ROUND(RC[-2]/RC[-1]*10,0) -> 300
A40: 61 | B40: 19103 | C40: 50 | D40: 1 | E40: 5 | F40: 350 | G40: 7 | H40: =ROUND(RC[-2]/RC[-1]*10,0) -> 500
A41: 62 | B41: 10022 | C41: 10 | D41: 1 | E41: 5 | F41: 400 | G41: 8 | H41: =ROUND(RC[-2]/RC[-1]*10,0) -> 500
A42: 63 | B42: 10000 | C42: 5 | D42: 1 | E42: 5 | F42: 125 | G42: 10 | H42: =ROUND(RC[-2]/RC[-1]*10,0) -> 125
A43: 69 | B43: 13646 | C43: 50 | D43: 1 | E43: 5 | F43: 1000 | G43: 5 | H43: =ROUND(RC[-2]/RC[-1]*10,0) -> 2000
A44: 70 | B44: 10003 | C44: 200 | D44: 1 | E44: 5 | F44: 480 | G44: 8 | H44: =ROUND(RC[-2]/RC[-1]*10,0) -> 600
A45: 71 | B45: 13646 | C45: 20 | D45: 1 | E45: 5 | F45: 560 | G45: 7 | H45: =ROUND(RC[-2]/RC[-1]*10,0) -> 800
A46: 72 | B46: 10000 | C46: 5 | D46: 1 | E46: 5 | F46: 125 | G46: 10 | H46: =ROUND(RC[-2]/RC[-1]*10,0) -> 125
A47: 73 | B47: 10001 | C47: 5 | D47: 1 | E47: 5 | F47: 125 | G47: 10 | H47: =ROUND(RC[-2]/RC[-1]*10,0) -> 125
A48: 79 | B48: 19028 | C48: 2500 | D48: 1 | E48: 5 | F48: 1250 | G48: 5 | H48: =ROUND(RC[-2]/RC[-1]*10,0) -> 2500

Sheet: 7天目标完成度奖励(已砍掉)
A1: target_num|target_num | B1: reward_item_id_list|reward_item_id_list | C1: reward_item_num_list|reward_item_num_list
A2: 不可空 | B2: 可空#不需字段 | C2: 可空#不需字段
A3: 数字 | B3: 一维数组 | C3: 一维数组
B4: 不定长 | C4: 不定长
A6: 完成的目标数量 | B6: 奖励物品ID列表 | C6: 奖励物品数量列表
A7: 10 | B7: 10000|10001 | C7: 2|2
A8: 30 | B8: 19005 | C8: 500
A9: 50 | B9: 10000|10001 | C9: 6|6
A10: 75 | B10: 19005 | C10: 1000

Sheet: Sheet1
A2: 逻辑类型 | B2: 显示类型
A3: 1 | B3: 1 | C3: 从这一天到活动结束登陆，任意时间登录 | D3: 已处理
A4: 2 | B4: 1 | C4: 等级奖励 | D4: 已处理
A5: 3 | B5: 1 | C5: 累计充值 | D5: 已处理
A6: 4 | B6: 2 | C6: 主线副本通关进度 | D6: 已处理
A7: 5 | B7: 3 | C7: 装备强化 | D7: 已处理
A8: 6 | B8: 4 | C8: 竞技场 | D8: 已处理
A9: 7 | B9: 5 | C9: 圣器收集 | D9: 已处理
A10: 8 | B10: 6 | C10: 英雄商店刷新次数 | D10: 已处理
A11: 9 | B11: 7 | C11: 英雄突破 | D11: 已处理
A12: 10 | B12: 8 | C12: 异度入侵刷战功 | D12: 已处理
A13: 11 | B13: 9 | C13: 潜能提升等级 | D13: 已处理
A14: 12 | B14: 10 | C14: 爬塔星数累计 | D14: 已处理
A15: 13 | B15: 11 | C15: 穿戴装备 | D15: 已处理
A16: 14 | B16: 12 | C16: 装备精炼 | D16: 已处理
A17: 15 | B17: 13 | C17: 英雄培养 | D17: 已处理
A18: 16 | B18: 14 | C18: 等级突破 | D18: 已处理
A19: 17 | B19: 15 | C19: 战力突破 | D19: 已处理
A20: 18 | B20: 16 | C20: 打折销售 | D20: 已处理
A21: 19 | B21: 99 | C21: 半价抢购 | D21: 已处理
A22: 20 | B22: 2 | C22: 通关主线副本关卡（包括扫荡） | D22: 已处理
A23: 21 | B23: 5 | C23: 挑战夺宝（无论胜负）（包括战5次） | D23: 已处理
A24: 22 | B24: 10 | C24: 爬塔重置次数 | D24: 已处理
A25: 23 | B25: 4 | C25: 挑战竞技场（无论胜负） | D25: 已处理
A26: 24 | B26: 18 | C26: 无尽深渊击杀怪物数量 | D26: 已处理
A27: 25 | B27: 19 | C27: 精灵强化等级（只算最高的那一只） | D27: 已处理
A28: 26 | B28: 19 | C28: 精灵升华阶段（只算最高的那一只） | D28: 已处理