Sheet: 配置
A1: 服务端文件名 | B1: 服务端对应工作表号 | C1: 客户端文件名 | D1: 客户端对应工作表号 | E1: erl头部 | F1: erl内容格式 | G1: erl尾部 | H1: 客户端特殊处理
A2: config_daily_fb_damage_reward.txt | B2: 1 | C2: config_daily_fb_reward.cnf|DailyFBReward | D2: 1 | F2: get(id) -> #$ | H2: 1=>chapter_index,gamelevel_index,context

Sheet: 日常副本伤害奖励
A1: chapter_index|chapter | B1: gamelevel_index|map_idx | C1: context|context | D1: is_sweep_reward|is_sweep_reward | E1: item_id_list|item_id_list | F1: item_num_list|item_num_list
A2: 不可空 | B2: 不可空 | C2: 不可空 | D2: 不可空 | E2: 可空#不需字段 | F2: 可空#不需字段
A3: 数字 | B3: 数字 | C3: 数字 | D3: 数字 | E3: 一维数组 | F3: 一维数组
E4: 不定长 | F4: 不定长
A6: 章节(副本类型) | B6: 关卡索引(难度类型) | C6: 参数 | D6: 是否扫荡奖励 | E6: 奖励的物品ID | F6: 奖励的物品数量
A7: 1 | B7: 1 | C7: 100 | D7: 1 | E7: =HLOOKUP(RC[-4],Sheet1!R2C1:R26C7,RC[-3]+1,FALSE)&IF(RC[2]=0,"",IF(HLOOKUP(RC[-4],Sheet1!R2C9:R26C15,RC[-3]+1,FALSE)="","","|"&HLOOKUP(RC[-4],Sheet1!R2C9:R26C15,RC[-3]+1,FALSE))) -> 33200|33100 | F7: =IF(HLOOKUP(RC[-5],Sheet1!R2C9:R26C15,RC[-4]+1,FALSE)="",ROUND(HLOOKUP(RC[-5],Sheet1!R2C1:R26C7,RC[-4]+13,FALSE)+HLOOKUP(RC[-5],Sheet1!R2C9:R26C15,RC[-4]+13,FALSE)*RC[1],0),ROUND(HLOOKUP(RC[-5],Sheet1!R2C1:R26C7,RC[-4]+13,FALSE),0)&IF(RC[1]=0,"","|"&ROUND(HLOOKUP(RC[-5],Sheet1!R2C9:R26C15,RC[-4]+13,FALSE)*RC[1],0))) -> 5|10 | G7: 10 | H7: 1
A8: 1 | B8: 1 | C8: 90 | D8: 0 | E8: =HLOOKUP(RC[-4],Sheet1!R2C1:R26C7,RC[-3]+1,FALSE)&IF(RC[2]=0,"",IF(HLOOKUP(RC[-4],Sheet1!R2C9:R26C15,RC[-3]+1,FALSE)="","","|"&HLOOKUP(RC[-4],Sheet1!R2C9:R26C15,RC[-3]+1,FALSE))) -> 33200|33100 | F8: =IF(HLOOKUP(RC[-5],Sheet1!R2C9:R26C15,RC[-4]+1,FALSE)="",ROUND(HLOOKUP(RC[-5],Sheet1!R2C1:R26C7,RC[-4]+13,FALSE)+HLOOKUP(RC[-5],Sheet1!R2C9:R26C15,RC[-4]+13,FALSE)*RC[1],0),ROUND(HLOOKUP(RC[-5],Sheet1!R2C1:R26C7,RC[-4]+13,FALSE),0)&IF(RC[1]=0,"","|"&ROUND(HLOOKUP(RC[-5],Sheet1!R2C9:R26C15,RC[-4]+13,FALSE)*RC[1],0))) -> 5|9 | G8: 9 | H8: 0
A9: 1 | B9: 1 | C9: 80 | D9: 0 | E9: =HLOOKUP(RC[-4],Sheet1!R2C1:R26C7,RC[-3]+1,FALSE)&IF(RC[2]=0,"",IF(HLOOKUP(RC[-4],Sheet1!R2C9:R26C15,RC[-3]+1,FALSE)="","","|"&HLOOKUP(RC[-4],Sheet1!R2C9:R26C15,RC[-3]+1,FALSE))) -> 33200|33100 | F9: =IF(HLOOKUP(RC[-5],Sheet1!R2C9:R26C15,RC[-4]+1,FALSE)="",ROUND(HLOOKUP(RC[-5],Sheet1!R2C1:R26C7,RC[-4]+13,FALSE)+HLOOKUP(RC[-5],Sheet1!R2C9:R26C15,RC[-4]+13,FALSE)*RC[1],0),ROUND(HLOOKUP(RC[-5],Sheet1!R2C1:R26C7,RC[-4]+13,FALSE),0)&IF(RC[1]=0,"","|"&ROUND(HLOOKUP(RC[-5],Sheet1!R2C9:R26C15,RC[-4]+13,FALSE)*RC[1],0))) -> 5|8 | G9: 8 | H9: 0
A10: 1 | B10: 1 | C10: 70 | D10: 0 | E10: =HLOOKUP(RC[-4],Sheet1!R2C1:R26C7,RC[-3]+1,FALSE)&IF(RC[2]=0,"",IF(HLOOKUP(RC[-4],Sheet1!R2C9:R26C15,RC[-3]+1,FALSE)="","","|"&HLOOKUP(RC[-4],Sheet1!R2C9:R26C15,RC[-3]+1,FALSE))) -> 33200|33100 | F10: =IF(HLOOKUP(RC[-5],Sheet1!R2C9:R26C15,RC[-4]+1,FALSE)="",ROUND(HLOOKUP(RC[-5],Sheet1!R2C1:R26C7,RC[-4]+13,FALSE)+HLOOKUP(RC[-5],Sheet1!R2C9:R26C15,RC[-4]+13,FALSE)*RC[1],0),ROUND(HLOOKUP(RC[-5],Sheet1!R2C1:R26C7,RC[-4]+13,FALSE),0)&IF(RC[1]=0,"","|"&ROUND(HLOOKUP(RC[-5],Sheet1!R2C9:R26C15,RC[-4]+13,FALSE)*RC[1],0))) -> 5|7 | G10: 7 | H10: 0
A11: 1 | B11: 1 | C11: 60 | D11: 0 | E11: =HLOOKUP(RC[-4],Sheet1!R2C1:R26C7,RC[-3]+1,FALSE)&IF(RC[2]=0,"",IF(HLOOKUP(RC[-4],Sheet1!R2C9:R26C15,RC[-3]+1,FALSE)="","","|"&HLOOKUP(RC[-4],Sheet1!R2C9:R26C15,RC[-3]+1,FALSE))) -> 33200|33100 | F11: =IF(HLOOKUP(RC[-5],Sheet1!R2C9:R26C15,RC[-4]+1,FALSE)="",ROUND(HLOOKUP(RC[-5],Sheet1!R2C1:R26C7,RC[-4]+13,FALSE)+HLOOKUP(RC[-5],Sheet1!R2C9:R26C15,RC[-4]+13,FALSE)*RC[1],0),ROUND(HLOOKUP(RC[-5],Sheet1!R2C1:R26C7,RC[-4]+13,FALSE),0)&IF(RC[1]=0,"","|"&ROUND(HLOOKUP(RC[-5],Sheet1!R2C9:R26C15,RC[-4]+13,FALSE)*RC[1],0))) -> 5|6 | G11: 6 | H11: 0
A12: 1 | B12: 1 | C12: 50 | D12: 0 | E12: =HLOOKUP(RC[-4],Sheet1!R2C1:R26C7,RC[-3]+1,FALSE)&IF(RC[2]=0,"",IF(HLOOKUP(RC[-4],Sheet1!R2C9:R26C15,RC[-3]+1,FALSE)="","","|"&HLOOKUP(RC[-4],Sheet1!R2C9:R26C15,RC[-3]+1,FALSE))) -> 33200|33100 | F12: =IF(HLOOKUP(RC[-5],Sheet1!R2C9:R26C15,RC[-4]+1,FALSE)="",ROUND(HLOOKUP(RC[-5],Sheet1!R2C1:R26C7,RC[-4]+13,FALSE)+HLOOKUP(RC[-5],Sheet1!R2C9:R26C15,RC[-4]+13,FALSE)*RC[1],0),ROUND(HLOOKUP(RC[-5],Sheet1!R2C1:R26C7,RC[-4]+13,FALSE),0)&IF(RC[1]=0,"","|"&ROUND(HLOOKUP(RC[-5],Sheet1!R2C9:R26C15,RC[-4]+13,FALSE)*RC[1],0))) -> 5|5 | G12: 5 | H12: 0
A13: 1 | B13: 1 | C13: 40 | D13: 0 | E13: =HLOOKUP(RC[-4],Sheet1!R2C1:R26C7,RC[-3]+1,FALSE)&IF(RC[2]=0,"",IF(HLOOKUP(RC[-4],Sheet1!R2C9:R26C15,RC[-3]+1,FALSE)="","","|"&HLOOKUP(RC[-4],Sheet1!R2C9:R26C15,RC[-3]+1,FALSE))) -> 33200|33100 | F13: =IF(HLOOKUP(RC[-5],Sheet1!R2C9:R26C15,RC[-4]+1,FALSE)="",ROUND(HLOOKUP(RC[-5],Sheet1!R2C1:R26C7,RC[-4]+13,FALSE)+HLOOKUP(RC[-5],Sheet1!R2C9:R26C15,RC[-4]+13,FALSE)*RC[1],0),ROUND(HLOOKUP(RC[-5],Sheet1!R2C1:R26C7,RC[-4]+13,FALSE),0)&IF(RC[1]=0,"","|"&ROUND(HLOOKUP(RC[-5],Sheet1!R2C9:R26C15,RC[-4]+13,FALSE)*RC[1],0))) -> 5|4 | G13: 4 | H13: 0
A14: 1 | B14: 1 | C14: 30 | D14: 0 | E14: =HLOOKUP(RC[-4],Sheet1!R2C1:R26C7,RC[-3]+1,FALSE)&IF(RC[2]=0,"",IF(HLOOKUP(RC[-4],Sheet1!R2C9:R26C15,RC[-3]+1,FALSE)="","","|"&HLOOKUP(RC[-4],Sheet1!R2C9:R26C15,RC[-3]+1,FALSE))) -> 33200|33100 | F14: =IF(HLOOKUP(RC[-5],Sheet1!R2C9:R26C15,RC[-4]+1,FALSE)="",ROUND(HLOOKUP(RC[-5],Sheet1!R2C1:R26C7,RC[-4]+13,FALSE)+HLOOKUP(RC[-5],Sheet1!R2C9:R26C15,RC[-4]+13,FALSE)*RC[1],0),ROUND(HLOOKUP(RC[-5],Sheet1!R2C1:R26C7,RC[-4]+13,FALSE),0)&IF(RC[1]=0,"","|"&ROUND(HLOOKUP(RC[-5],Sheet1!R2C9:R26C15,RC[-4]+13,FALSE)*RC[1],0))) -> 5|3 | G14: 3 | H14: 0
A15: 1 | B15: 1 | C15: 20 | D15: 0 | E15: =HLOOKUP(RC[-4],Sheet1!R2C1:R26C7,RC[-3]+1,FALSE)&IF(RC[2]=0,"",IF(HLOOKUP(RC[-4],Sheet1!R2C9:R26C15,RC[-3]+1,FALSE)="","","|"&HLOOKUP(RC[-4],Sheet1!R2C9:R26C15,RC[-3]+1,FALSE))) -> 33200|33100 | F15: =IF(HLOOKUP(RC[-5],Sheet1!R2C9:R26C15,RC[-4]+1,FALSE)="",ROUND(HLOOKUP(RC[-5],Sheet1!R2C1:R26C7,RC[-4]+13,FALSE)+HLOOKUP(RC[-5],Sheet1!R2C9:R26C15,RC[-4]+13,FALSE)*RC[1],0),ROUND(HLOOKUP(RC[-5],Sheet1!R2C1:R26C7,RC[-4]+13,FALSE),0)&IF(RC[1]=0,"","|"&ROUND(HLOOKUP(RC[-5],Sheet1!R2C9:R26C15,RC[-4]+13,FALSE)*RC[1],0))) -> 5|2 | G15: 2 | H15: 0
A16: 1 | B16: 1 | C16: 10 | D16: 0 | E16: =HLOOKUP(RC[-4],Sheet1!R2C1:R26C7,RC[-3]+1,FALSE)&IF(RC[2]=0,"",IF(HLOOKUP(RC[-4],Sheet1!R2C9:R26C15,RC[-3]+1,FALSE)="","","|"&HLOOKUP(RC[-4],Sheet1!R2C9:R26C15,RC[-3]+1,FALSE))) -> 33200|33100 | F16: =IF(HLOOKUP(RC[-5],Sheet1!R2C9:R26C15,RC[-4]+1,FALSE)="",ROUND(HLOOKUP(RC[-5],Sheet1!R2C1:R26C7,RC[-4]+13,FALSE)+HLOOKUP(RC[-5],Sheet1!R2C9:R26C15,RC[-4]+13,FALSE)*RC[1],0),ROUND(HLOOKUP(RC[-5],Sheet1!R2C1:R26C7,RC[-4]+13,FALSE),0)&IF(RC[1]=0,"","|"&ROUND(HLOOKUP(RC[-5],Sheet1!R2C9:R26C15,RC[-4]+13,FALSE)*RC[1],0))) -> 5|1 | G16: 1 | H16: 0
A17: 1 | B17: 1 | C17: 0 | D17: 0 | E17: =HLOOKUP(RC[-4],Sheet1!R2C1:R26C7,RC[-3]+1,FALSE)&IF(RC[2]=0,"",IF(HLOOKUP(RC[-4],Sheet1!R2C9:R26C15,RC[-3]+1,FALSE)="","","|"&HLOOKUP(RC[-4],Sheet1!R2C9:R26C15,RC[-3]+1,FALSE))) -> 33200 | F17: =IF(HLOOKUP(RC[-5],Sheet1!R2C9:R26C15,RC[-4]+1,FALSE)="",ROUND(HLOOKUP(RC[-5],Sheet1!R2C1:R26C7,RC[-4]+13,FALSE)+HLOOKUP(RC[-5],Sheet1!R2C9:R26C15,RC[-4]+13,FALSE)*RC[1],0),ROUND(HLOOKUP(RC[-5],Sheet1!R2C1:R26C7,RC[-4]+13,FALSE),0)&IF(RC[1]=0,"","|"&ROUND(HLOOKUP(RC[-5],Sheet1!R2C9:R26C15,RC[-4]+13,FALSE)*RC[1],0))) -> 5 | G17: 0 | H17: 0
A18: 1 | B18: 2 | C18: 100 | D18: 1 | E18: =HLOOKUP(RC[-4],Sheet1!R2C1:R26C7,RC[-3]+1,FALSE)&IF(RC[2]=0,"",IF(HLOOKUP(RC[-4],Sheet1!R2C9:R26C15,RC[-3]+1,FALSE)="","","|"&HLOOKUP(RC[-4],Sheet1!R2C9:R26C15,RC[-3]+1,FALSE))) -> 33200|33100 | F18: =IF(HLOOKUP(RC[-5],Sheet1!R2C9:R26C15,RC[-4]+1,FALSE)="",ROUND(HLOOKUP(RC[-5],Sheet1!R2C1:R26C7,RC[-4]+13,FALSE)+HLOOKUP(RC[-5],Sheet1!R2C9:R26C15,RC[-4]+13,FALSE)*RC[1],0),ROUND(HLOOKUP(RC[-5],Sheet1!R2C1:R26C7,RC[-4]+13,FALSE),0)&IF(RC[1]=0,"","|"&ROUND(HLOOKUP(RC[-5],Sheet1!R2C9:R26C15,RC[-4]+13,FALSE)*RC[1],0))) -> 8|20 | G18: 10 | H18: 1
A19: 1 | B19: 2 | C19: 90 | D19: 0 | E19: =HLOOKUP(RC[-4],Sheet1!R2C1:R26C7,RC[-3]+1,FALSE)&IF(RC[2]=0,"",IF(HLOOKUP(RC[-4],Sheet1!R2C9:R26C15,RC[-3]+1,FALSE)="","","|"&HLOOKUP(RC[-4],Sheet1!R2C9:R26C15,RC[-3]+1,FALSE))) -> 33200|33100 | F19: =IF(HLOOKUP(RC[-5],Sheet1!R2C9:R26C15,RC[-4]+1,FALSE)="",ROUND(HLOOKUP(RC[-5],Sheet1!R2C1:R26C7,RC[-4]+13,FALSE)+HLOOKUP(RC[-5],Sheet1!R2C9:R26C15,RC[-4]+13,FALSE)*RC[1],0),ROUND(HLOOKUP(RC[-5],Sheet1!R2C1:R26C7,RC[-4]+13,FALSE),0)&IF(RC[1]=0,"","|"&ROUND(HLOOKUP(RC[-5],Sheet1!R2C9:R26C15,RC[-4]+13,FALSE)*RC[1],0))) -> 8|18 | G19: 9 | H19: 0
A20: 1 | B20: 2 | C20: 80 | D20: 0 | E20: =HLOOKUP(RC[-4],Sheet1!R2C1:R26C7,RC[-3]+1,FALSE)&IF(RC[2]=0,"",IF(HLOOKUP(RC[-4],Sheet1!R2C9:R26C15,RC[-3]+1,FALSE)="","","|"&HLOOKUP(RC[-4],Sheet1!R2C9:R26C15,RC[-3]+1,FALSE))) -> 33200|33100 | F20: =IF(HLOOKUP(RC[-5],Sheet1!R2C9:R26C15,RC[-4]+1,FALSE)="",ROUND(HLOOKUP(RC[-5],Sheet1!R2C1:R26C7,RC[-4]+13,FALSE)+HLOOKUP(RC[-5],Sheet1!R2C9:R26C15,RC[-4]+13,FALSE)*RC[1],0),ROUND(HLOOKUP(RC[-5],Sheet1!R2C1:R26C7,RC[-4]+13,FALSE),0)&IF(RC[1]=0,"","|"&ROUND(HLOOKUP(RC[-5],Sheet1!R2C9:R26C15,RC[-4]+13,FALSE)*RC[1],0))) -> 8|16 | G20: 8 | H20: 0
A21: 1 | B21: 2 | C21: 70 | D21: 0 | E21: =HLOOKUP(RC[-4],Sheet1!R2C1:R26C7,RC[-3]+1,FALSE)&IF(RC[2]=0,"",IF(HLOOKUP(RC[-4],Sheet1!R2C9:R26C15,RC[-3]+1,FALSE)="","","|"&HLOOKUP(RC[-4],Sheet1!R2C9:R26C15,RC[-3]+1,FALSE))) -> 33200|33100 | F21: =IF(HLOOKUP(RC[-5],Sheet1!R2C9:R26C15,RC[-4]+1,FALSE)="",ROUND(HLOOKUP(RC[-5],Sheet1!R2C1:R26C7,RC[-4]+13,FALSE)+HLOOKUP(RC[-5],Sheet1!R2C9:R26C15,RC[-4]+13,FALSE)*RC[1],0),ROUND(HLOOKUP(RC[-5],Sheet1!R2C1:R26C7,RC[-4]+13,FALSE),0)&IF(RC[1]=0,"","|"&ROUND(HLOOKUP(RC[-5],Sheet1!R2C9:R26C15,RC[-4]+13,FALSE)*RC[1],0))) -> 8|14 | G21: 7 | H21: 0
A22: 1 | B22: 2 | C22: 60 | D22: 0 | E22: =HLOOKUP(RC[-4],Sheet1!R2C1:R26C7,RC[-3]+1,FALSE)&IF(RC[2]=0,"",IF(HLOOKUP(RC[-4],Sheet1!R2C9:R26C15,RC[-3]+1,FALSE)="","","|"&HLOOKUP(RC[-4],Sheet1!R2C9:R26C15,RC[-3]+1,FALSE))) -> 33200|33100 | F22: =IF(HLOOKUP(RC[-5],Sheet1!R2C9:R26C15,RC[-4]+1,FALSE)="",ROUND(HLOOKUP(RC[-5],Sheet1!R2C1:R26C7,RC[-4]+13,FALSE)+HLOOKUP(RC[-5],Sheet1!R2C9:R26C15,RC[-4]+13,FALSE)*RC[1],0),ROUND(HLOOKUP(RC[-5],Sheet1!R2C1:R26C7,RC[-4]+13,FALSE),0)&IF(RC[1]=0,"","|"&ROUND(HLOOKUP(RC[-5],Sheet1!R2C9:R26C15,RC[-4]+13,FALSE)*RC[1],0))) -> 8|12 | G22: 6 | H22: 0
A23: 1 | B23: 2 | C23: 50 | D23: 0 | E23: =HLOOKUP(RC[-4],Sheet1!R2C1:R26C7,RC[-3]+1,FALSE)&IF(RC[2]=0,"",IF(HLOOKUP(RC[-4],Sheet1!R2C9:R26C15,RC[-3]+1,FALSE)="","","|"&HLOOKUP(RC[-4],Sheet1!R2C9:R26C15,RC[-3]+1,FALSE))) -> 33200|33100 | F23: =IF(HLOOKUP(RC[-5],Sheet1!R2C9:R26C15,RC[-4]+1,FALSE)="",ROUND(HLOOKUP(RC[-5],Sheet1!R2C1:R26C7,RC[-4]+13,FALSE)+HLOOKUP(RC[-5],Sheet1!R2C9:R26C15,RC[-4]+13,FALSE)*RC[1],0),ROUND(HLOOKUP(RC[-5],Sheet1!R2C1:R26C7,RC[-4]+13,FALSE),0)&IF(RC[1]=0,"","|"&ROUND(HLOOKUP(RC[-5],Sheet1!R2C9:R26C15,RC[-4]+13,FALSE)*RC[1],0))) -> 8|10 | G23: 5 | H23: 0
A24: 1 | B24: 2 | C24: 40 | D24: 0 | E24: =HLOOKUP(RC[-4],Sheet1!R2C1:R26C7,RC[-3]+1,FALSE)&IF(RC[2]=0,"",IF(HLOOKUP(RC[-4],Sheet1!R2C9:R26C15,RC[-3]+1,FALSE)="","","|"&HLOOKUP(RC[-4],Sheet1!R2C9:R26C15,RC[-3]+1,FALSE))) -> 33200|33100 | F24: =IF(HLOOKUP(RC[-5],Sheet1!R2C9:R26C15,RC[-4]+1,FALSE)="",ROUND(HLOOKUP(RC[-5],Sheet1!R2C1:R26C7,RC[-4]+13,FALSE)+HLOOKUP(RC[-5],Sheet1!R2C9:R26C15,RC[-4]+13,FALSE)*RC[1],0),ROUND(HLOOKUP(RC[-5],Sheet1!R2C1:R26C7,RC[-4]+13,FALSE),0)&IF(RC[1]=0,"","|"&ROUND(HLOOKUP(RC[-5],Sheet1!R2C9:R26C15,RC[-4]+13,FALSE)*RC[1],0))) -> 8|8 | G24: 4 | H24: 0
A25: 1 | B25: 2 | C25: 30 | D25: 0 | E25: =HLOOKUP(RC[-4],Sheet1!R2C1:R26C7,RC[-3]+1,FALSE)&IF(RC[2]=0,"",IF(HLOOKUP(RC[-4],Sheet1!R2C9:R26C15,RC[-3]+1,FALSE)="","","|"&HLOOKUP(RC[-4],Sheet1!R2C9:R26C15,RC[-3]+1,FALSE))) -> 33200|33100 | F25: =IF(HLOOKUP(RC[-5],Sheet1!R2C9:R26C15,RC[-4]+1,FALSE)="",ROUND(HLOOKUP(RC[-5],Sheet1!R2C1:R26C7,RC[-4]+13,FALSE)+HLOOKUP(RC[-5],Sheet1!R2C9:R26C15,RC[-4]+13,FALSE)*RC[1],0),ROUND(HLOOKUP(RC[-5],Sheet1!R2C1:R26C7,RC[-4]+13,FALSE),0)&IF(RC[1]=0,"","|"&ROUND(HLOOKUP(RC[-5],Sheet1!R2C9:R26C15,RC[-4]+13,FALSE)*RC[1],0))) -> 8|6 | G25: 3 | H25: 0
A26: 1 | B26: 2 | C26: 20 | D26: 0 | E26: =HLOOKUP(RC[-4],Sheet1!R2C1:R26C7,RC[-3]+1,FALSE)&IF(RC[2]=0,"",IF(HLOOKUP(RC[-4],Sheet1!R2C9:R26C15,RC[-3]+1,FALSE)="","","|"&HLOOKUP(RC[-4],Sheet1!R2C9:R26C15,RC[-3]+1,FALSE))) -> 33200|33100 | F26: =IF(HLOOKUP(RC[-5],Sheet1!R2C9:R26C15,RC[-4]+1,FALSE)="",ROUND(HLOOKUP(RC[-5],Sheet1!R2C1:R26C7,RC[-4]+13,FALSE)+HLOOKUP(RC[-5],Sheet1!R2C9:R26C15,RC[-4]+13,FALSE)*RC[1],0),ROUND(HLOOKUP(RC[-5],Sheet1!R2C1:R26C7,RC[-4]+13,FALSE),0)&IF(RC[1]=0,"","|"&ROUND(HLOOKUP(RC[-5],Sheet1!R2C9:R26C15,RC[-4]+13,FALSE)*RC[1],0))) -> 8|4 | G26: 2 | H26: 0
A27: 1 | B27: 2 | C27: 10 | D27: 0 | E27: =HLOOKUP(RC[-4],Sheet1!R2C1:R26C7,RC[-3]+1,FALSE)&IF(RC[2]=0,"",IF(HLOOKUP(RC[-4],Sheet1!R2C9:R26C15,RC[-3]+1,FALSE)="","","|"&HLOOKUP(RC[-4],Sheet1!R2C9:R26C15,RC[-3]+1,FALSE))) -> 33200|33100 | F27: =IF(HLOOKUP(RC[-5],Sheet1!R2C9:R26C15,RC[-4]+1,FALSE)="",ROUND(HLOOKUP(RC[-5],Sheet1!R2C1:R26C7,RC[-4]+13,FALSE)+HLOOKUP(RC[-5],Sheet1!R2C9:R26C15,RC[-4]+13,FALSE)*RC[1],0),ROUND(HLOOKUP(RC[-5],Sheet1!R2C1:R26C7,RC[-4]+13,FALSE),0)&IF(RC[1]=0,"","|"&ROUND(HLOOKUP(RC[-5],Sheet1!R2C9:R26C15,RC[-4]+13,FALSE)*RC[1],0))) -> 8|2 | G27: 1 | H27: 0
A28: 1 | B28: 2 | C28: 0 | D28: 0 | E28: =HLOOKUP(RC[-4],Sheet1!R2C1:R26C7,RC[-3]+1,FALSE)&IF(RC[2]=0,"",IF(HLOOKUP(RC[-4],Sheet1!R2C9:R26C15,RC[-3]+1,FALSE)="","","|"&HLOOKUP(RC[-4],Sheet1!R2C9:R26C15,RC[-3]+1,FALSE))) -> 33200 | F28: =IF(HLOOKUP(RC[-5],Sheet1!R2C9:R26C15,RC[-4]+1,FALSE)="",ROUND(HLOOKUP(RC[-5],Sheet1!R2C1:R26C7,RC[-4]+13,FALSE)+HLOOKUP(RC[-5],Sheet1!R2C9:R26C15,RC[-4]+13,FALSE)*RC[1],0),ROUND(HLOOKUP(RC[-5],Sheet1!R2C1:R26C7,RC[-4]+13,FALSE),0)&IF(RC[1]=0,"","|"&ROUND(HLOOKUP(RC[-5],Sheet1!R2C9:R26C15,RC[-4]+13,FALSE)*RC[1],0))) -> 8 | G28: 0 | H28: 0
A29: 1 | B29: 3 | C29: 100 | D29: 1 | E29: =HLOOKUP(RC[-4],Sheet1!R2C1:R26C7,RC[-3]+1,FALSE)&IF(RC[2]=0,"",IF(HLOOKUP(RC[-4],Sheet1!R2C9:R26C15,RC[-3]+1,FALSE)="","","|"&HLOOKUP(RC[-4],Sheet1!R2C9:R26C15,RC[-3]+1,FALSE))) -> 33300|33100 | F29: =IF(HLOOKUP(RC[-5],Sheet1!R2C9:R26C15,RC[-4]+1,FALSE)="",ROUND(HLOOKUP(RC[-5],Sheet1!R2C1:R26C7,RC[-4]+13,FALSE)+HLOOKUP(RC[-5],Sheet1!R2C9:R26C15,RC[-4]+13,FALSE)*RC[1],0),ROUND(HLOOKUP(RC[-5],Sheet1!R2C1:R26C7,RC[-4]+13,FALSE),0)&IF(RC[1]=0,"","|"&ROUND(HLOOKUP(RC[-5],Sheet1!R2C9:R26C15,RC[-4]+13,FALSE)*RC[1],0))) -> 6|20 | G29: 10 | H29: 1
A30: 1 | B30: 3 | C30: 90 | D30: 0 | E30: =HLOOKUP(RC[-4],Sheet1!R2C1:R26C7,RC[-3]+1,FALSE)&IF(RC[2]=0,"",IF(HLOOKUP(RC[-4],Sheet1!R2C9:R26C15,RC[-3]+1,FALSE)="","","|"&HLOOKUP(RC[-4],Sheet1!R2C9:R26C15,RC[-3]+1,FALSE))) -> 33300|33100 | F30: =IF(HLOOKUP(RC[-5],Sheet1!R2C9:R26C15,RC[-4]+1,FALSE)="",ROUND(HLOOKUP(RC[-5],Sheet1!R2C1:R26C7,RC[-4]+13,FALSE)+HLOOKUP(RC[-5],Sheet1!R2C9:R26C15,RC[-4]+13,FALSE)*RC[1],0),ROUND(HLOOKUP(RC[-5],Sheet1!R2C1:R26C7,RC[-4]+13,FALSE),0)&IF(RC[1]=0,"","|"&ROUND(HLOOKUP(RC[-5],Sheet1!R2C9:R26C15,RC[-4]+13,FALSE)*RC[1],0))) -> 6|18 | G30: 9 | H30: 0
A31: 1 | B31: 3 | C31: 80 | D31: 0 | E31: =HLOOKUP(RC[-4],Sheet1!R2C1:R26C7,RC[-3]+1,FALSE)&IF(RC[2]=0,"",IF(HLOOKUP(RC[-4],Sheet1!R2C9:R26C15,RC[-3]+1,FALSE)="","","|"&HLOOKUP(RC[-4],Sheet1!R2C9:R26C15,RC[-3]+1,FALSE))) -> 33300|33100 | F31: =IF(HLOOKUP(RC[-5],Sheet1!R2C9:R26C15,RC[-4]+1,FALSE)="",ROUND(HLOOKUP(RC[-5],Sheet1!R2C1:R26C7,RC[-4]+13,FALSE)+HLOOKUP(RC[-5],Sheet1!R2C9:R26C15,RC[-4]+13,FALSE)*RC[1],0),ROUND(HLOOKUP(RC[-5],Sheet1!R2C1:R26C7,RC[-4]+13,FALSE),0)&IF(RC[1]=0,"","|"&ROUND(HLOOKUP(RC[-5],Sheet1!R2C9:R26C15,RC[-4]+13,FALSE)*RC[1],0))) -> 6|16 | G31: 8 | H31: 0
A32: 1 | B32: 3 | C32: 70 | D32: 0 | E32: =HLOOKUP(RC[-4],Sheet1!R2C1:R26C7,RC[-3]+1,FALSE)&IF(RC[2]=0,"",IF(HLOOKUP(RC[-4],Sheet1!R2C9:R26C15,RC[-3]+1,FALSE)="","","|"&HLOOKUP(RC[-4],Sheet1!R2C9:R26C15,RC[-3]+1,FALSE))) -> 33300|33100 | F32: =IF(HLOOKUP(RC[-5],Sheet1!R2C9:R26C15,RC[-4]+1,FALSE)="",ROUND(HLOOKUP(RC[-5],Sheet1!R2C1:R26C7,RC[-4]+13,FALSE)+HLOOKUP(RC[-5],Sheet1!R2C9:R26C15,RC[-4]+13,FALSE)*RC[1],0),ROUND(HLOOKUP(RC[-5],Sheet1!R2C1:R26C7,RC[-4]+13,FALSE),0)&IF(RC[1]=0,"","|"&ROUND(HLOOKUP(RC[-5],Sheet1!R2C9:R26C15,RC[-4]+13,FALSE)*RC[1],0))) -> 6|14 | G32: 7 | H32: 0
A33: 1 | B33: 3 | C33: 60 | D33: 0 | E33: =HLOOKUP(RC[-4],Sheet1!R2C1:R26C7,RC[-3]+1,FALSE)&IF(RC[2]=0,"",IF(HLOOKUP(RC[-4],Sheet1!R2C9:R26C15,RC[-3]+1,FALSE)="","","|"&HLOOKUP(RC[-4],Sheet1!R2C9:R26C15,RC[-3]+1,FALSE))) -> 33300|33100 | F33: =IF(HLOOKUP(RC[-5],Sheet1!R2C9:R26C15,RC[-4]+1,FALSE)="",ROUND(HLOOKUP(RC[-5],Sheet1!R2C1:R26C7,RC[-4]+13,FALSE)+HLOOKUP(RC[-5],Sheet1!R2C9:R26C15,RC[-4]+13,FALSE)*RC[1],0),ROUND(HLOOKUP(RC[-5],Sheet1!R2C1:R26C7,RC[-4]+13,FALSE),0)&IF(RC[1]=0,"","|"&ROUND(HLOOKUP(RC[-5],Sheet1!R2C9:R26C15,RC[-4]+13,FALSE)*RC[1],0))) -> 6|12 | G33: 6 | H33: 0
A34: 1 | B34: 3 | C34: 50 | D34: 0 | E34: =HLOOKUP(RC[-4],Sheet1!R2C1:R26C7,RC[-3]+1,FALSE)&IF(RC[2]=0,"",IF(HLOOKUP(RC[-4],Sheet1!R2C9:R26C15,RC[-3]+1,FALSE)="","","|"&HLOOKUP(RC[-4],Sheet1!R2C9:R26C15,RC[-3]+1,FALSE))) -> 33300|33100 | F34: =IF(HLOOKUP(RC[-5],Sheet1!R2C9:R26C15,RC[-4]+1,FALSE)="",ROUND(HLOOKUP(RC[-5],Sheet1!R2C1:R26C7,RC[-4]+13,FALSE)+HLOOKUP(RC[-5],Sheet1!R2C9:R26C15,RC[-4]+13,FALSE)*RC[1],0),ROUND(HLOOKUP(RC[-5],Sheet1!R2C1:R26C7,RC[-4]+13,FALSE),0)&IF(RC[1]=0,"","|"&ROUND(HLOOKUP(RC[-5],Sheet1!R2C9:R26C15,RC[-4]+13,FALSE)*RC[1],0))) -> 6|10 | G34: 5 | H34: 0
A35: 1 | B35: 3 | C35: 40 | D35: 0 | E35: =HLOOKUP(RC[-4],Sheet1!R2C1:R26C7,RC[-3]+1,FALSE)&IF(RC[2]=0,"",IF(HLOOKUP(RC[-4],Sheet1!R2C9:R26C15,RC[-3]+1,FALSE)="","","|"&HLOOKUP(RC[-4],Sheet1!R2C9:R26C15,RC[-3]+1,FALSE))) -> 33300|33100 | F35: =IF(HLOOKUP(RC[-5],Sheet1!R2C9:R26C15,RC[-4]+1,FALSE)="",ROUND(HLOOKUP(RC[-5],Sheet1!R2C1:R26C7,RC[-4]+13,FALSE)+HLOOKUP(RC[-5],Sheet1!R2C9:R26C15,RC[-4]+13,FALSE)*RC[1],0),ROUND(HLOOKUP(RC[-5],Sheet1!R2C1:R26C7,RC[-4]+13,FALSE),0)&IF(RC[1]=0,"","|"&ROUND(HLOOKUP(RC[-5],Sheet1!R2C9:R26C15,RC[-4]+13,FALSE)*RC[1],0))) -> 6|8 | G35: 4 | H35: 0
A36: 1 | B36: 3 | C36: 30 | D36: 0 | E36: =HLOOKUP(RC[-4],Sheet1!R2C1:R26C7,RC[-3]+1,FALSE)&IF(RC[2]=0,"",IF(HLOOKUP(RC[-4],Sheet1!R2C9:R26C15,RC[-3]+1,FALSE)="","","|"&HLOOKUP(RC[-4],Sheet1!R2C9:R26C15,RC[-3]+1,FALSE))) -> 33300|33100 | F36: =IF(HLOOKUP(RC[-5],Sheet1!R2C9:R26C15,RC[-4]+1,FALSE)="",ROUND(HLOOKUP(RC[-5],Sheet1!R2C1:R26C7,RC[-4]+13,FALSE)+HLOOKUP(RC[-5],Sheet1!R2C9:R26C15,RC[-4]+13,FALSE)*RC[1],0),ROUND(HLOOKUP(RC[-5],Sheet1!R2C1:R26C7,RC[-4]+13,FALSE),0)&IF(RC[1]=0,"","|"&ROUND(HLOOKUP(RC[-5],Sheet1!R2C9:R26C15,RC[-4]+13,FALSE)*RC[1],0))) -> 6|6 | G36: 3 | H36: 0
A37: 1 | B37: 3 | C37: 20 | D37: 0 | E37: =HLOOKUP(RC[-4],Sheet1!R2C1:R26C7,RC[-3]+1,FALSE)&IF(RC[2]=0,"",IF(HLOOKUP(RC[-4],Sheet1!R2C9:R26C15,RC[-3]+1,FALSE)="","","|"&HLOOKUP(RC[-4],Sheet1!R2C9:R26C15,RC[-3]+1,FALSE))) -> 33300|33100 | F37: =IF(HLOOKUP(RC[-5],Sheet1!R2C9:R26C15,RC[-4]+1,FALSE)="",ROUND(HLOOKUP(RC[-5],Sheet1!R2C1:R26C7,RC[-4]+13,FALSE)+HLOOKUP(RC[-5],Sheet1!R2C9:R26C15,RC[-4]+13,FALSE)*RC[1],0),ROUND(HLOOKUP(RC[-5],Sheet1!R2C1:R26C7,RC[-4]+13,FALSE),0)&IF(RC[1]=0,"","|"&ROUND(HLOOKUP(RC[-5],Sheet1!R2C9:R26C15,RC[-4]+13,FALSE)*RC[1],0))) -> 6|4 | G37: 2 | H37: 0
A38: 1 | B38: 3 | C38: 10 | D38: 0 | E38: =HLOOKUP(RC[-4],Sheet1!R2C1:R26C7,RC[-3]+1,FALSE)&IF(RC[2]=0,"",IF(HLOOKUP(RC[-4],Sheet1!R2C9:R26C15,RC[-3]+1,FALSE)="","","|"&HLOOKUP(RC[-4],Sheet1!R2C9:R26C15,RC[-3]+1,FALSE))) -> 33300|33100 | F38: =IF(HLOOKUP(RC[-5],Sheet1!R2C9:R26C15,RC[-4]+1,FALSE)="",ROUND(HLOOKUP(RC[-5],Sheet1!R2C1:R26C7,RC[-4]+13,FALSE)+HLOOKUP(RC[-5],Sheet1!R2C9:R26C15,RC[-4]+13,FALSE)*RC[1],0),ROUND(HLOOKUP(RC[-5],Sheet1!R2C1:R26C7,RC[-4]+13,FALSE),0)&IF(RC[1]=0,"","|"&ROUND(HLOOKUP(RC[-5],Sheet1!R2C9:R26C15,RC[-4]+13,FALSE)*RC[1],0))) -> 6|2 | G38: 1 | H38: 0
A39: 1 | B39: 3 | C39: 0 | D39: 0 | E39: =HLOOKUP(RC[-4],Sheet1!R2C1:R26C7,RC[-3]+1,FALSE)&IF(RC[2]=0,"",IF(HLOOKUP(RC[-4],Sheet1!R2C9:R26C15,RC[-3]+1,FALSE)="","","|"&HLOOKUP(RC[-4],Sheet1!R2C9:R26C15,RC[-3]+1,FALSE))) -> 33300 | F39: =IF(HLOOKUP(RC[-5],Sheet1!R2C9:R26C15,RC[-4]+1,FALSE)="",ROUND(HLOOKUP(RC[-5],Sheet1!R2C1:R26C7,RC[-4]+13,FALSE)+HLOOKUP(RC[-5],Sheet1!R2C9:R26C15,RC[-4]+13,FALSE)*RC[1],0),ROUND(HLOOKUP(RC[-5],Sheet1!R2C1:R26C7,RC[-4]+13,FALSE),0)&IF(RC[1]=0,"","|"&ROUND(HLOOKUP(RC[-5],Sheet1!R2C9:R26C15,RC[-4]+13,FALSE)*RC[1],0))) -> 6 | G39: 0 | H39: 0
A40: 1 | B40: 4 | C40: 100 | D40: 1 | E40: =HLOOKUP(RC[-4],Sheet1!R2C1:R26C7,RC[-3]+1,FALSE)&IF(RC[2]=0,"",IF(HLOOKUP(RC[-4],Sheet1!R2C9:R26C15,RC[-3]+1,FALSE)="","","|"&HLOOKUP(RC[-4],Sheet1!R2C9:R26C15,RC[-3]+1,FALSE))) -> 33300|33100 | F40: =IF(HLOOKUP(RC[-5],Sheet1!R2C9:R26C15,RC[-4]+1,FALSE)="",ROUND(HLOOKUP(RC[-5],Sheet1!R2C1:R26C7,RC[-4]+13,FALSE)+HLOOKUP(RC[-5],Sheet1!R2C9:R26C15,RC[-4]+13,FALSE)*RC[1],0),ROUND(HLOOKUP(RC[-5],Sheet1!R2C1:R26C7,RC[-4]+13,FALSE),0)&IF(RC[1]=0,"","|"&ROUND(HLOOKUP(RC[-5],Sheet1!R2C9:R26C15,RC[-4]+13,FALSE)*RC[1],0))) -> 8|30 | G40: 10 | H40: 1
A41: 1 | B41: 4 | C41: 90 | D41: 0 | E41: =HLOOKUP(RC[-4],Sheet1!R2C1:R26C7,RC[-3]+1,FALSE)&IF(RC[2]=0,"",IF(HLOOKUP(RC[-4],Sheet1!R2C9:R26C15,RC[-3]+1,FALSE)="","","|"&HLOOKUP(RC[-4],Sheet1!R2C9:R26C15,RC[-3]+1,FALSE))) -> 33300|33100 | F41: =IF(HLOOKUP(RC[-5],Sheet1!R2C9:R26C15,RC[-4]+1,FALSE)="",ROUND(HLOOKUP(RC[-5],Sheet1!R2C1:R26C7,RC[-4]+13,FALSE)+HLOOKUP(RC[-5],Sheet1!R2C9:R26C15,RC[-4]+13,FALSE)*RC[1],0),ROUND(HLOOKUP(RC[-5],Sheet1!R2C1:R26C7,RC[-4]+13,FALSE),0)&IF(RC[1]=0,"","|"&ROUND(HLOOKUP(RC[-5],Sheet1!R2C9:R26C15,RC[-4]+13,FALSE)*RC[1],0))) -> 8|27 | G41: 9 | H41: 0
A42: 1 | B42: 4 | C42: 80 | D42: 0 | E42: =HLOOKUP(RC[-4],Sheet1!R2C1:R26C7,RC[-3]+1,FALSE)&IF(RC[2]=0,"",IF(HLOOKUP(RC[-4],Sheet1!R2C9:R26C15,RC[-3]+1,FALSE)="","","|"&HLOOKUP(RC[-4],Sheet1!R2C9:R26C15,RC[-3]+1,FALSE))) -> 33300|33100 | F42: =IF(HLOOKUP(RC[-5],Sheet1!R2C9:R26C15,RC[-4]+1,FALSE)="",ROUND(HLOOKUP(RC[-5],Sheet1!R2C1:R26C7,RC[-4]+13,FALSE)+HLOOKUP(RC[-5],Sheet1!R2C9:R26C15,RC[-4]+13,FALSE)*RC[1],0),ROUND(HLOOKUP(RC[-5],Sheet1!R2C1:R26C7,RC[-4]+13,FALSE),0)&IF(RC[1]=0,"","|"&ROUND(HLOOKUP(RC[-5],Sheet1!R2C9:R26C15,RC[-4]+13,FALSE)*RC[1],0))) -> 8|24 | G42: 8 | H42: 0
A43: 1 | B43: 4 | C43: 70 | D43: 0 | E43: =HLOOKUP(RC[-4],Sheet1!R2C1:R26C7,RC[-3]+1,FALSE)&IF(RC[2]=0,"",IF(HLOOKUP(RC[-4],Sheet1!R2C9:R26C15,RC[-3]+1,FALSE)="","","|"&HLOOKUP(RC[-4],Sheet1!R2C9:R26C15,RC[-3]+1,FALSE))) -> 33300|33100 | F43: =IF(HLOOKUP(RC[-5],Sheet1!R2C9:R26C15,RC[-4]+1,FALSE)="",ROUND(HLOOKUP(RC[-5],Sheet1!R2C1:R26C7,RC[-4]+13,FALSE)+HLOOKUP(RC[-5],Sheet1!R2C9:R26C15,RC[-4]+13,FALSE)*RC[1],0),ROUND(HLOOKUP(RC[-5],Sheet1!R2C1:R26C7,RC[-4]+13,FALSE),0)&IF(RC[1]=0,"","|"&ROUND(HLOOKUP(RC[-5],Sheet1!R2C9:R26C15,RC[-4]+13,FALSE)*RC[1],0))) -> 8|21 | G43: 7 | H43: 0
A44: 1 | B44: 4 | C44: 60 | D44: 0 | E44: =HLOOKUP(RC[-4],Sheet1!R2C1:R26C7,RC[-3]+1,FALSE)&IF(RC[2]=0,"",IF(HLOOKUP(RC[-4],Sheet1!R2C9:R26C15,RC[-3]+1,FALSE)="","","|"&HLOOKUP(RC[-4],Sheet1!R2C9:R26C15,RC[-3]+1,FALSE))) -> 33300|33100 | F44: =IF(HLOOKUP(RC[-5],Sheet1!R2C9:R26C15,RC[-4]+1,FALSE)="",ROUND(HLOOKUP(RC[-5],Sheet1!R2C1:R26C7,RC[-4]+13,FALSE)+HLOOKUP(RC[-5],Sheet1!R2C9:R26C15,RC[-4]+13,FALSE)*RC[1],0),ROUND(HLOOKUP(RC[-5],Sheet1!R2C1:R26C7,RC[-4]+13,FALSE),0)&IF(RC[1]=0,"","|"&ROUND(HLOOKUP(RC[-5],Sheet1!R2C9:R26C15,RC[-4]+13,FALSE)*RC[1],0))) -> 8|18 | G44: 6 | H44: 0
A45: 1 | B45: 4 | C45: 50 | D45: 0 | E45: =HLOOKUP(RC[-4],Sheet1!R2C1:R26C7,RC[-3]+1,FALSE)&IF(RC[2]=0,"",IF(HLOOKUP(RC[-4],Sheet1!R2C9:R26C15,RC[-3]+1,FALSE)="","","|"&HLOOKUP(RC[-4],Sheet1!R2C9:R26C15,RC[-3]+1,FALSE))) -> 33300|33100 | F45: =IF(HLOOKUP(RC[-5],Sheet1!R2C9:R26C15,RC[-4]+1,FALSE)="",ROUND(HLOOKUP(RC[-5],Sheet1!R2C1:R26C7,RC[-4]+13,FALSE)+HLOOKUP(RC[-5],Sheet1!R2C9:R26C15,RC[-4]+13,FALSE)*RC[1],0),ROUND(HLOOKUP(RC[-5],Sheet1!R2C1:R26C7,RC[-4]+13,FALSE),0)&IF(RC[1]=0,"","|"&ROUND(HLOOKUP(RC[-5],Sheet1!R2C9:R26C15,RC[-4]+13,FALSE)*RC[1],0))) -> 8|15 | G45: 5 | H45: 0
A46: 1 | B46: 4 | C46: 40 | D46: 0 | E46: =HLOOKUP(RC[-4],Sheet1!R2C1:R26C7,RC[-3]+1,FALSE)&IF(RC[2]=0,"",IF(HLOOKUP(RC[-4],Sheet1!R2C9:R26C15,RC[-3]+1,FALSE)="","","|"&HLOOKUP(RC[-4],Sheet1!R2C9:R26C15,RC[-3]+1,FALSE))) -> 33300|33100 | F46: =IF(HLOOKUP(RC[-5],Sheet1!R2C9:R26C15,RC[-4]+1,FALSE)="",ROUND(HLOOKUP(RC[-5],Sheet1!R2C1:R26C7,RC[-4]+13,FALSE)+HLOOKUP(RC[-5],Sheet1!R2C9:R26C15,RC[-4]+13,FALSE)*RC[1],0),ROUND(HLOOKUP(RC[-5],Sheet1!R2C1:R26C7,RC[-4]+13,FALSE),0)&IF(RC[1]=0,"","|"&ROUND(HLOOKUP(RC[-5],Sheet1!R2C9:R26C15,RC[-4]+13,FALSE)*RC[1],0))) -> 8|12 | G46: 4 | H46: 0
A47: 1 | B47: 4 | C47: 30 | D47: 0 | E47: =HLOOKUP(RC[-4],Sheet1!R2C1:R26C7,RC[-3]+1,FALSE)&IF(RC[2]=0,"",IF(HLOOKUP(RC[-4],Sheet1!R2C9:R26C15,RC[-3]+1,FALSE)="","","|"&HLOOKUP(RC[-4],Sheet1!R2C9:R26C15,RC[-3]+1,FALSE))) -> 33300|33100 | F47: =IF(HLOOKUP(RC[-5],Sheet1!R2C9:R26C15,RC[-4]+1,FALSE)="",ROUND(HLOOKUP(RC[-5],Sheet1!R2C1:R26C7,RC[-4]+13,FALSE)+HLOOKUP(RC[-5],Sheet1!R2C9:R26C15,RC[-4]+13,FALSE)*RC[1],0),ROUND(HLOOKUP(RC[-5],Sheet1!R2C1:R26C7,RC[-4]+13,FALSE),0)&IF(RC[1]=0,"","|"&ROUND(HLOOKUP(RC[-5],Sheet1!R2C9:R26C15,RC[-4]+13,FALSE)*RC[1],0))) -> 8|9 | G47: 3 | H47: 0
A48: 1 | B48: 4 | C48: 20 | D48: 0 | E48: =HLOOKUP(RC[-4],Sheet1!R2C1:R26C7,RC[-3]+1,FALSE)&IF(RC[2]=0,"",IF(HLOOKUP(RC[-4],Sheet1!R2C9:R26C15,RC[-3]+1,FALSE)="","","|"&HLOOKUP(RC[-4],Sheet1!R2C9:R26C15,RC[-3]+1,FALSE))) -> 33300|33100 | F48: =IF(HLOOKUP(RC[-5],Sheet1!R2C9:R26C15,RC[-4]+1,FALSE)="",ROUND(HLOOKUP(RC[-5],Sheet1!R2C1:R26C7,RC[-4]+13,FALSE)+HLOOKUP(RC[-5],Sheet1!R2C9:R26C15,RC[-4]+13,FALSE)*RC[1],0),ROUND(HLOOKUP(RC[-5],Sheet1!R2C1:R26C7,RC[-4]+13,FALSE),0)&IF(RC[1]=0,"","|"&ROUND(HLOOKUP(RC[-5],Sheet1!R2C9:R26C15,RC[-4]+13,FALSE)*RC[1],0))) -> 8|6 | G48: 2 | H48: 0
A49: 1 | B49: 4 | C49: 10 | D49: 0 | E49: =HLOOKUP(RC[-4],Sheet1!R2C1:R26C7,RC[-3]+1,FALSE)&IF(RC[2]=0,"",IF(HLOOKUP(RC[-4],Sheet1!R2C9:R26C15,RC[-3]+1,FALSE)="","","|"&HLOOKUP(RC[-4],Sheet1!R2C9:R26C15,RC[-3]+1,FALSE))) -> 33300|33100 | F49: =IF(HLOOKUP(RC[-5],Sheet1!R2C9:R26C15,RC[-4]+1,FALSE)="",ROUND(HLOOKUP(RC[-5],Sheet1!R2C1:R26C7,RC[-4]+13,FALSE)+HLOOKUP(RC[-5],Sheet1!R2C9:R26C15,RC[-4]+13,FALSE)*RC[1],0),ROUND(HLOOKUP(RC[-5],Sheet1!R2C1:R26C7,RC[-4]+13,FALSE),0)&IF(RC[1]=0,"","|"&ROUND(HLOOKUP(RC[-5],Sheet1!R2C9:R26C15,RC[-4]+13,FALSE)*RC[1],0))) -> 8|3 | G49: 1 | H49: 0
A50: 1 | B50: 4 | C50: 0 | D50: 0 | E50: =HLOOKUP(RC[-4],Sheet1!R2C1:R26C7,RC[-3]+1,FALSE)&IF(RC[2]=0,"",IF(HLOOKUP(RC[-4],Sheet1!R2C9:R26C15,RC[-3]+1,FALSE)="","","|"&HLOOKUP(RC[-4],Sheet1!R2C9:R26C15,RC[-3]+1,FALSE))) -> 33300 | F50: =IF(HLOOKUP(RC[-5],Sheet1!R2C9:R26C15,RC[-4]+1,FALSE)="",ROUND(HLOOKUP(RC[-5],Sheet1!R2C1:R26C7,RC[-4]+13,FALSE)+HLOOKUP(RC[-5],Sheet1!R2C9:R26C15,RC[-4]+13,FALSE)*RC[1],0),ROUND(HLOOKUP(RC[-5],Sheet1!R2C1:R26C7,RC[-4]+13,FALSE),0)&IF(RC[1]=0,"","|"&ROUND(HLOOKUP(RC[-5],Sheet1!R2C9:R26C15,RC[-4]+13,FALSE)*RC[1],0))) -> 8 | G50: 0 | H50: 0
A51: 1 | B51: 5 | C51: 100 | D51: 1 | E51: =HLOOKUP(RC[-4],Sheet1!R2C1:R26C7,RC[-3]+1,FALSE)&IF(RC[2]=0,"",IF(HLOOKUP(RC[-4],Sheet1!R2C9:R26C15,RC[-3]+1,FALSE)="","","|"&HLOOKUP(RC[-4],Sheet1!R2C9:R26C15,RC[-3]+1,FALSE))) -> 33400|33200 | F51: =IF(HLOOKUP(RC[-5],Sheet1!R2C9:R26C15,RC[-4]+1,FALSE)="",ROUND(HLOOKUP(RC[-5],Sheet1!R2C1:R26C7,RC[-4]+13,FALSE)+HLOOKUP(RC[-5],Sheet1!R2C9:R26C15,RC[-4]+13,FALSE)*RC[1],0),ROUND(HLOOKUP(RC[-5],Sheet1!R2C1:R26C7,RC[-4]+13,FALSE),0)&IF(RC[1]=0,"","|"&ROUND(HLOOKUP(RC[-5],Sheet1!R2C9:R26C15,RC[-4]+13,FALSE)*RC[1],0))) -> 5|10 | G51: 10 | H51: 1
A52: 1 | B52: 5 | C52: 90 | D52: 0 | E52: =HLOOKUP(RC[-4],Sheet1!R2C1:R26C7,RC[-3]+1,FALSE)&IF(RC[2]=0,"",IF(HLOOKUP(RC[-4],Sheet1!R2C9:R26C15,RC[-3]+1,FALSE)="","","|"&HLOOKUP(RC[-4],Sheet1!R2C9:R26C15,RC[-3]+1,FALSE))) -> 33400|33200 | F52: =IF(HLOOKUP(RC[-5],Sheet1!R2C9:R26C15,RC[-4]+1,FALSE)="",ROUND(HLOOKUP(RC[-5],Sheet1!R2C1:R26C7,RC[-4]+13,FALSE)+HLOOKUP(RC[-5],Sheet1!R2C9:R26C15,RC[-4]+13,FALSE)*RC[1],0),ROUND(HLOOKUP(RC[-5],Sheet1!R2C1:R26C7,RC[-4]+13,FALSE),0)&IF(RC[1]=0,"","|"&ROUND(HLOOKUP(RC[-5],Sheet1!R2C9:R26C15,RC[-4]+13,FALSE)*RC[1],0))) -> 5|9 | G52: 9 | H52: 0
A53: 1 | B53: 5 | C53: 80 | D53: 0 | E53: =HLOOKUP(RC[-4],Sheet1!R2C1:R26C7,RC[-3]+1,FALSE)&IF(RC[2]=0,"",IF(HLOOKUP(RC[-4],Sheet1!R2C9:R26C15,RC[-3]+1,FALSE)="","","|"&HLOOKUP(RC[-4],Sheet1!R2C9:R26C15,RC[-3]+1,FALSE))) -> 33400|33200 | F53: =IF(HLOOKUP(RC[-5],Sheet1!R2C9:R26C15,RC[-4]+1,FALSE)="",ROUND(HLOOKUP(RC[-5],Sheet1!R2C1:R26C7,RC[-4]+13,FALSE)+HLOOKUP(RC[-5],Sheet1!R2C9:R26C15,RC[-4]+13,FALSE)*RC[1],0),ROUND(HLOOKUP(RC[-5],Sheet1!R2C1:R26C7,RC[-4]+13,FALSE),0)&IF(RC[1]=0,"","|"&ROUND(HLOOKUP(RC[-5],Sheet1!R2C9:R26C15,RC[-4]+13,FALSE)*RC[1],0))) -> 5|8 | G53: 8 | H53: 0
A54: 1 | B54: 5 | C54: 70 | D54: 0 | E54: =HLOOKUP(RC[-4],Sheet1!R2C1:R26C7,RC[-3]+1,FALSE)&IF(RC[2]=0,"",IF(HLOOKUP(RC[-4],Sheet1!R2C9:R26C15,RC[-3]+1,FALSE)="","","|"&HLOOKUP(RC[-4],Sheet1!R2C9:R26C15,RC[-3]+1,FALSE))) -> 33400|33200 | F54: =IF(HLOOKUP(RC[-5],Sheet1!R2C9:R26C15,RC[-4]+1,FALSE)="",ROUND(HLOOKUP(RC[-5],Sheet1!R2C1:R26C7,RC[-4]+13,FALSE)+HLOOKUP(RC[-5],Sheet1!R2C9:R26C15,RC[-4]+13,FALSE)*RC[1],0),ROUND(HLOOKUP(RC[-5],Sheet1!R2C1:R26C7,RC[-4]+13,FALSE),0)&IF(RC[1]=0,"","|"&ROUND(HLOOKUP(RC[-5],Sheet1!R2C9:R26C15,RC[-4]+13,FALSE)*RC[1],0))) -> 5|7 | G54: 7 | H54: 0
A55: 1 | B55: 5 | C55: 60 | D55: 0 | E55: =HLOOKUP(RC[-4],Sheet1!R2C1:R26C7,RC[-3]+1,FALSE)&IF(RC[2]=0,"",IF(HLOOKUP(RC[-4],Sheet1!R2C9:R26C15,RC[-3]+1,FALSE)="","","|"&HLOOKUP(RC[-4],Sheet1!R2C9:R26C15,RC[-3]+1,FALSE))) -> 33400|33200 | F55: =IF(HLOOKUP(RC[-5],Sheet1!R2C9:R26C15,RC[-4]+1,FALSE)="",ROUND(HLOOKUP(RC[-5],Sheet1!R2C1:R26C7,RC[-4]+13,FALSE)+HLOOKUP(RC[-5],Sheet1!R2C9:R26C15,RC[-4]+13,FALSE)*RC[1],0),ROUND(HLOOKUP(RC[-5],Sheet1!R2C1:R26C7,RC[-4]+13,FALSE),0)&IF(RC[1]=0,"","|"&ROUND(HLOOKUP(RC[-5],Sheet1!R2C9:R26C15,RC[-4]+13,FALSE)*RC[1],0))) -> 5|6 | G55: 6 | H55: 0
A56: 1 | B56: 5 | C56: 50 | D56: 0 | E56: =HLOOKUP(RC[-4],Sheet1!R2C1:R26C7,RC[-3]+1,FALSE)&IF(RC[2]=0,"",IF(HLOOKUP(RC[-4],Sheet1!R2C9:R26C15,RC[-3]+1,FALSE)="","","|"&HLOOKUP(RC[-4],Sheet1!R2C9:R26C15,RC[-3]+1,FALSE))) -> 33400|33200 | F56: =IF(HLOOKUP(RC[-5],Sheet1!R2C9:R26C15,RC[-4]+1,FALSE)="",ROUND(HLOOKUP(RC[-5],Sheet1!R2C1:R26C7,RC[-4]+13,FALSE)+HLOOKUP(RC[-5],Sheet1!R2C9:R26C15,RC[-4]+13,FALSE)*RC[1],0),ROUND(HLOOKUP(RC[-5],Sheet1!R2C1:R26C7,RC[-4]+13,FALSE),0)&IF(RC[1]=0,"","|"&ROUND(HLOOKUP(RC[-5],Sheet1!R2C9:R26C15,RC[-4]+13,FALSE)*RC[1],0))) -> 5|5 | G56: 5 | H56: 0
A57: 1 | B57: 5 | C57: 40 | D57: 0 | E57: =HLOOKUP(RC[-4],Sheet1!R2C1:R26C7,RC[-3]+1,FALSE)&IF(RC[2]=0,"",IF(HLOOKUP(RC[-4],Sheet1!R2C9:R26C15,RC[-3]+1,FALSE)="","","|"&HLOOKUP(RC[-4],Sheet1!R2C9:R26C15,RC[-3]+1,FALSE))) -> 33400|33200 | F57: =IF(HLOOKUP(RC[-5],Sheet1!R2C9:R26C15,RC[-4]+1,FALSE)="",ROUND(HLOOKUP(RC[-5],Sheet1!R2C1:R26C7,RC[-4]+13,FALSE)+HLOOKUP(RC[-5],Sheet1!R2C9:R26C15,RC[-4]+13,FALSE)*RC[1],0),ROUND(HLOOKUP(RC[-5],Sheet1!R2C1:R26C7,RC[-4]+13,FALSE),0)&IF(RC[1]=0,"","|"&ROUND(HLOOKUP(RC[-5],Sheet1!R2C9:R26C15,RC[-4]+13,FALSE)*RC[1],0))) -> 5|4 | G57: 4 | H57: 0
A58: 1 | B58: 5 | C58: 30 | D58: 0 | E58: =HLOOKUP(RC[-4],Sheet1!R2C1:R26C7,RC[-3]+1,FALSE)&IF(RC[2]=0,"",IF(HLOOKUP(RC[-4],Sheet1!R2C9:R26C15,RC[-3]+1,FALSE)="","","|"&HLOOKUP(RC[-4],Sheet1!R2C9:R26C15,RC[-3]+1,FALSE))) -> 33400|33200 | F58: =IF(HLOOKUP(RC[-5],Sheet1!R2C9:R26C15,RC[-4]+1,FALSE)="",ROUND(HLOOKUP(RC[-5],Sheet1!R2C1:R26C7,RC[-4]+13,FALSE)+HLOOKUP(RC[-5],Sheet1!R2C9:R26C15,RC[-4]+13,FALSE)*RC[1],0),ROUND(HLOOKUP(RC[-5],Sheet1!R2C1:R26C7,RC[-4]+13,FALSE),0)&IF(RC[1]=0,"","|"&ROUND(HLOOKUP(RC[-5],Sheet1!R2C9:R26C15,RC[-4]+13,FALSE)*RC[1],0))) -> 5|3 | G58: 3 | H58: 0
A59: 1 | B59: 5 | C59: 20 | D59: 0 | E59: =HLOOKUP(RC[-4],Sheet1!R2C1:R26C7,RC[-3]+1,FALSE)&IF(RC[2]=0,"",IF(HLOOKUP(RC[-4],Sheet1!R2C9:R26C15,RC[-3]+1,FALSE)="","","|"&HLOOKUP(RC[-4],Sheet1!R2C9:R26C15,RC[-3]+1,FALSE))) -> 33400|33200 | F59: =IF(HLOOKUP(RC[-5],Sheet1!R2C9:R26C15,RC[-4]+1,FALSE)="",ROUND(HLOOKUP(RC[-5],Sheet1!R2C1:R26C7,RC[-4]+13,FALSE)+HLOOKUP(RC[-5],Sheet1!R2C9:R26C15,RC[-4]+13,FALSE)*RC[1],0),ROUND(HLOOKUP(RC[-5],Sheet1!R2C1:R26C7,RC[-4]+13,FALSE),0)&IF(RC[1]=0,"","|"&ROUND(HLOOKUP(RC[-5],Sheet1!R2C9:R26C15,RC[-4]+13,FALSE)*RC[1],0))) -> 5|2 | G59: 2 | H59: 0
A60: 1 | B60: 5 | C60: 10 | D60: 0 | E60: =HLOOKUP(RC[-4],Sheet1!R2C1:R26C7,RC[-3]+1,FALSE)&IF(RC[2]=0,"",IF(HLOOKUP(RC[-4],Sheet1!R2C9:R26C15,RC[-3]+1,FALSE)="","","|"&HLOOKUP(RC[-4],Sheet1!R2C9:R26C15,RC[-3]+1,FALSE))) -> 33400|33200 | F60: =IF(HLOOKUP(RC[-5],Sheet1!R2C9:R26C15,RC[-4]+1,FALSE)="",ROUND(HLOOKUP(RC[-5],Sheet1!R2C1:R26C7,RC[-4]+13,FALSE)+HLOOKUP(RC[-5],Sheet1!R2C9:R26C15,RC[-4]+13,FALSE)*RC[1],0),ROUND(HLOOKUP(RC[-5],Sheet1!R2C1:R26C7,RC[-4]+13,FALSE),0)&IF(RC[1]=0,"","|"&ROUND(HLOOKUP(RC[-5],Sheet1!R2C9:R26C15,RC[-4]+13,FALSE)*RC[1],0))) -> 5|1 | G60: 1 | H60: 0
A61: 1 | B61: 5 | C61: 0 | D61: 0 | E61: =HLOOKUP(RC[-4],Sheet1!R2C1:R26C7,RC[-3]+1,FALSE)&IF(RC[2]=0,"",IF(HLOOKUP(RC[-4],Sheet1!R2C9:R26C15,RC[-3]+1,FALSE)="","","|"&HLOOKUP(RC[-4],Sheet1!R2C9:R26C15,RC[-3]+1,FALSE))) -> 33400 | F61: =IF(HLOOKUP(RC[-5],Sheet1!R2C9:R26C15,RC[-4]+1,FALSE)="",ROUND(HLOOKUP(RC[-5],Sheet1!R2C1:R26C7,RC[-4]+13,FALSE)+HLOOKUP(RC[-5],Sheet1!R2C9:R26C15,RC[-4]+13,FALSE)*RC[1],0),ROUND(HLOOKUP(RC[-5],Sheet1!R2C1:R26C7,RC[-4]+13,FALSE),0)&IF(RC[1]=0,"","|"&ROUND(HLOOKUP(RC[-5],Sheet1!R2C9:R26C15,RC[-4]+13,FALSE)*RC[1],0))) -> 5 | G61: 0 | H61: 0
A62: 1 | B62: 6 | C62: 100 | D62: 1 | E62: =HLOOKUP(RC[-4],Sheet1!R2C1:R26C7,RC[-3]+1,FALSE)&IF(RC[2]=0,"",IF(HLOOKUP(RC[-4],Sheet1!R2C9:R26C15,RC[-3]+1,FALSE)="","","|"&HLOOKUP(RC[-4],Sheet1!R2C9:R26C15,RC[-3]+1,FALSE))) -> 33400|33200 | F62: =IF(HLOOKUP(RC[-5],Sheet1!R2C9:R26C15,RC[-4]+1,FALSE)="",ROUND(HLOOKUP(RC[-5],Sheet1!R2C1:R26C7,RC[-4]+13,FALSE)+HLOOKUP(RC[-5],Sheet1!R2C9:R26C15,RC[-4]+13,FALSE)*RC[1],0),ROUND(HLOOKUP(RC[-5],Sheet1!R2C1:R26C7,RC[-4]+13,FALSE),0)&IF(RC[1]=0,"","|"&ROUND(HLOOKUP(RC[-5],Sheet1!R2C9:R26C15,RC[-4]+13,FALSE)*RC[1],0))) -> 7|10 | G62: 10 | H62: 1
A63: 1 | B63: 6 | C63: 90 | D63: 0 | E63: =HLOOKUP(RC[-4],Sheet1!R2C1:R26C7,RC[-3]+1,FALSE)&IF(RC[2]=0,"",IF(HLOOKUP(RC[-4],Sheet1!R2C9:R26C15,RC[-3]+1,FALSE)="","","|"&HLOOKUP(RC[-4],Sheet1!R2C9:R26C15,RC[-3]+1,FALSE))) -> 33400|33200 | F63: =IF(HLOOKUP(RC[-5],Sheet1!R2C9:R26C15,RC[-4]+1,FALSE)="",ROUND(HLOOKUP(RC[-5],Sheet1!R2C1:R26C7,RC[-4]+13,FALSE)+HLOOKUP(RC[-5],Sheet1!R2C9:R26C15,RC[-4]+13,FALSE)*RC[1],0),ROUND(HLOOKUP(RC[-5],Sheet1!R2C1:R26C7,RC[-4]+13,FALSE),0)&IF(RC[1]=0,"","|"&ROUND(HLOOKUP(RC[-5],Sheet1!R2C9:R26C15,RC[-4]+13,FALSE)*RC[1],0))) -> 7|9 | G63: 9 | H63: 0
A64: 1 | B64: 6 | C64: 80 | D64: 0 | E64: =HLOOKUP(RC[-4],Sheet1!R2C1:R26C7,RC[-3]+1,FALSE)&IF(RC[2]=0,"",IF(HLOOKUP(RC[-4],Sheet1!R2C9:R26C15,RC[-3]+1,FALSE)="","","|"&HLOOKUP(RC[-4],Sheet1!R2C9:R26C15,RC[-3]+1,FALSE))) -> 33400|33200 | F64: =IF(HLOOKUP(RC[-5],Sheet1!R2C9:R26C15,RC[-4]+1,FALSE)="",ROUND(HLOOKUP(RC[-5],Sheet1!R2C1:R26C7,RC[-4]+13,FALSE)+HLOOKUP(RC[-5],Sheet1!R2C9:R26C15,RC[-4]+13,FALSE)*RC[1],0),ROUND(HLOOKUP(RC[-5],Sheet1!R2C1:R26C7,RC[-4]+13,FALSE),0)&IF(RC[1]=0,"","|"&ROUND(HLOOKUP(RC[-5],Sheet1!R2C9:R26C15,RC[-4]+13,FALSE)*RC[1],0))) -> 7|8 | G64: 8 | H64: 0
A65: 1 | B65: 6 | C65: 70 | D65: 0 | E65: =HLOOKUP(RC[-4],Sheet1!R2C1:R26C7,RC[-3]+1,FALSE)&IF(RC[2]=0,"",IF(HLOOKUP(RC[-4],Sheet1!R2C9:R26C15,RC[-3]+1,FALSE)="","","|"&HLOOKUP(RC[-4],Sheet1!R2C9:R26C15,RC[-3]+1,FALSE))) -> 33400|33200 | F65: =IF(HLOOKUP(RC[-5],Sheet1!R2C9:R26C15,RC[-4]+1,FALSE)="",ROUND(HLOOKUP(RC[-5],Sheet1!R2C1:R26C7,RC[-4]+13,FALSE)+HLOOKUP(RC[-5],Sheet1!R2C9:R26C15,RC[-4]+13,FALSE)*RC[1],0),ROUND(HLOOKUP(RC[-5],Sheet1!R2C1:R26C7,RC[-4]+13,FALSE),0)&IF(RC[1]=0,"","|"&ROUND(HLOOKUP(RC[-5],Sheet1!R2C9:R26C15,RC[-4]+13,FALSE)*RC[1],0))) -> 7|7 | G65: 7 | H65: 0
A66: 1 | B66: 6 | C66: 60 | D66: 0 | E66: =HLOOKUP(RC[-4],Sheet1!R2C1:R26C7,RC[-3]+1,FALSE)&IF(RC[2]=0,"",IF(HLOOKUP(RC[-4],Sheet1!R2C9:R26C15,RC[-3]+1,FALSE)="","","|"&HLOOKUP(RC[-4],Sheet1!R2C9:R26C15,RC[-3]+1,FALSE))) -> 33400|33200 | F66: =IF(HLOOKUP(RC[-5],Sheet1!R2C9:R26C15,RC[-4]+1,FALSE)="",ROUND(HLOOKUP(RC[-5],Sheet1!R2C1:R26C7,RC[-4]+13,FALSE)+HLOOKUP(RC[-5],Sheet1!R2C9:R26C15,RC[-4]+13,FALSE)*RC[1],0),ROUND(HLOOKUP(RC[-5],Sheet1!R2C1:R26C7,RC[-4]+13,FALSE),0)&IF(RC[1]=0,"","|"&ROUND(HLOOKUP(RC[-5],Sheet1!R2C9:R26C15,RC[-4]+13,FALSE)*RC[1],0))) -> 7|6 | G66: 6 | H66: 0
A67: 1 | B67: 6 | C67: 50 | D67: 0 | E67: =HLOOKUP(RC[-4],Sheet1!R2C1:R26C7,RC[-3]+1,FALSE)&IF(RC[2]=0,"",IF(HLOOKUP(RC[-4],Sheet1!R2C9:R26C15,RC[-3]+1,FALSE)="","","|"&HLOOKUP(RC[-4],Sheet1!R2C9:R26C15,RC[-3]+1,FALSE))) -> 33400|33200 | F67: =IF(HLOOKUP(RC[-5],Sheet1!R2C9:R26C15,RC[-4]+1,FALSE)="",ROUND(HLOOKUP(RC[-5],Sheet1!R2C1:R26C7,RC[-4]+13,FALSE)+HLOOKUP(RC[-5],Sheet1!R2C9:R26C15,RC[-4]+13,FALSE)*RC[1],0),ROUND(HLOOKUP(RC[-5],Sheet1!R2C1:R26C7,RC[-4]+13,FALSE),0)&IF(RC[1]=0,"","|"&ROUND(HLOOKUP(RC[-5],Sheet1!R2C9:R26C15,RC[-4]+13,FALSE)*RC[1],0))) -> 7|5 | G67: 5 | H67: 0
A68: 1 | B68: 6 | C68: 40 | D68: 0 | E68: =HLOOKUP(RC[-4],Sheet1!R2C1:R26C7,RC[-3]+1,FALSE)&IF(RC[2]=0,"",IF(HLOOKUP(RC[-4],Sheet1!R2C9:R26C15,RC[-3]+1,FALSE)="","","|"&HLOOKUP(RC[-4],Sheet1!R2C9:R26C15,RC[-3]+1,FALSE))) -> 33400|33200 | F68: =IF(HLOOKUP(RC[-5],Sheet1!R2C9:R26C15,RC[-4]+1,FALSE)="",ROUND(HLOOKUP(RC[-5],Sheet1!R2C1:R26C7,RC[-4]+13,FALSE)+HLOOKUP(RC[-5],Sheet1!R2C9:R26C15,RC[-4]+13,FALSE)*RC[1],0),ROUND(HLOOKUP(RC[-5],Sheet1!R2C1:R26C7,RC[-4]+13,FALSE),0)&IF(RC[1]=0,"","|"&ROUND(HLOOKUP(RC[-5],Sheet1!R2C9:R26C15,RC[-4]+13,FALSE)*RC[1],0))) -> 7|4 | G68: 4 | H68: 0
A69: 1 | B69: 6 | C69: 30 | D69: 0 | E69: =HLOOKUP(RC[-4],Sheet1!R2C1:R26C7,RC[-3]+1,FALSE)&IF(RC[2]=0,"",IF(HLOOKUP(RC[-4],Sheet1!R2C9:R26C15,RC[-3]+1,FALSE)="","","|"&HLOOKUP(RC[-4],Sheet1!R2C9:R26C15,RC[-3]+1,FALSE))) -> 33400|33200 | F69: =IF(HLOOKUP(RC[-5],Sheet1!R2C9:R26C15,RC[-4]+1,FALSE)="",ROUND(HLOOKUP(RC[-5],Sheet1!R2C1:R26C7,RC[-4]+13,FALSE)+HLOOKUP(RC[-5],Sheet1!R2C9:R26C15,RC[-4]+13,FALSE)*RC[1],0),ROUND(HLOOKUP(RC[-5],Sheet1!R2C1:R26C7,RC[-4]+13,FALSE),0)&IF(RC[1]=0,"","|"&ROUND(HLOOKUP(RC[-5],Sheet1!R2C9:R26C15,RC[-4]+13,FALSE)*RC[1],0))) -> 7|3 | G69: 3 | H69: 0
A70: 1 | B70: 6 | C70: 20 | D70: 0 | E70: =HLOOKUP(RC[-4],Sheet1!R2C1:R26C7,RC[-3]+1,FALSE)&IF(RC[2]=0,"",IF(HLOOKUP(RC[-4],Sheet1!R2C9:R26C15,RC[-3]+1,FALSE)="","","|"&HLOOKUP(RC[-4],Sheet1!R2C9:R26C15,RC[-3]+1,FALSE))) -> 33400|33200 | F70: =IF(HLOOKUP(RC[-5],Sheet1!R2C9:R26C15,RC[-4]+1,FALSE)="",ROUND(HLOOKUP(RC[-5],Sheet1!R2C1:R26C7,RC[-4]+13,FALSE)+HLOOKUP(RC[-5],Sheet1!R2C9:R26C15,RC[-4]+13,FALSE)*RC[1],0),ROUND(HLOOKUP(RC[-5],Sheet1!R2C1:R26C7,RC[-4]+13,FALSE),0)&IF(RC[1]=0,"","|"&ROUND(HLOOKUP(RC[-5],Sheet1!R2C9:R26C15,RC[-4]+13,FALSE)*RC[1],0))) -> 7|2 | G70: 2 | H70: 0
A71: 1 | B71: 6 | C71: 10 | D71: 0 | E71: =HLOOKUP(RC[-4],Sheet1!R2C1:R26C7,RC[-3]+1,FALSE)&IF(RC[2]=0,"",IF(HLOOKUP(RC[-4],Sheet1!R2C9:R26C15,RC[-3]+1,FALSE)="","","|"&HLOOKUP(RC[-4],Sheet1!R2C9:R26C15,RC[-3]+1,FALSE))) -> 33400|33200 | F71: =IF(HLOOKUP(RC[-5],Sheet1!R2C9:R26C15,RC[-4]+1,FALSE)="",ROUND(HLOOKUP(RC[-5],Sheet1!R2C1:R26C7,RC[-4]+13,FALSE)+HLOOKUP(RC[-5],Sheet1!R2C9:R26C15,RC[-4]+13,FALSE)*RC[1],0),ROUND(HLOOKUP(RC[-5],Sheet1!R2C1:R26C7,RC[-4]+13,FALSE),0)&IF(RC[1]=0,"","|"&ROUND(HLOOKUP(RC[-5],Sheet1!R2C9:R26C15,RC[-4]+13,FALSE)*RC[1],0))) -> 7|1 | G71: 1 | H71: 0
A72: 1 | B72: 6 | C72: 0 | D72: 0 | E72: =HLOOKUP(RC[-4],Sheet1!R2C1:R26C7,RC[-3]+1,FALSE)&IF(RC[2]=0,"",IF(HLOOKUP(RC[-4],Sheet1!R2C9:R26C15,RC[-3]+1,FALSE)="","","|"&HLOOKUP(RC[-4],Sheet1!R2C9:R26C15,RC[-3]+1,FALSE))) -> 33400 | F72: =IF(HLOOKUP(RC[-5],Sheet1!R2C9:R26C15,RC[-4]+1,FALSE)="",ROUND(HLOOKUP(RC[-5],Sheet1!R2C1:R26C7,RC[-4]+13,FALSE)+HLOOKUP(RC[-5],Sheet1!R2C9:R26C15,RC[-4]+13,FALSE)*RC[1],0),ROUND(HLOOKUP(RC[-5],Sheet1!R2C1:R26C7,RC[-4]+13,FALSE),0)&IF(RC[1]=0,"","|"&ROUND(HLOOKUP(RC[-5],Sheet1!R2C9:R26C15,RC[-4]+13,FALSE)*RC[1],0))) -> 7 | G72: 0 | H72: 0
A73: 1 | B73: 7 | C73: 100 | D73: 1 | E73: =HLOOKUP(RC[-4],Sheet1!R2C1:R26C7,RC[-3]+1,FALSE)&IF(RC[2]=0,"",IF(HLOOKUP(RC[-4],Sheet1!R2C9:R26C15,RC[-3]+1,FALSE)="","","|"&HLOOKUP(RC[-4],Sheet1!R2C9:R26C15,RC[-3]+1,FALSE))) -> 33400|33200 | F73: =IF(HLOOKUP(RC[-5],Sheet1!R2C9:R26C15,RC[-4]+1,FALSE)="",ROUND(HLOOKUP(RC[-5],Sheet1!R2C1:R26C7,RC[-4]+13,FALSE)+HLOOKUP(RC[-5],Sheet1!R2C9:R26C15,RC[-4]+13,FALSE)*RC[1],0),ROUND(HLOOKUP(RC[-5],Sheet1!R2C1:R26C7,RC[-4]+13,FALSE),0)&IF(RC[1]=0,"","|"&ROUND(HLOOKUP(RC[-5],Sheet1!R2C9:R26C15,RC[-4]+13,FALSE)*RC[1],0))) -> 8|20 | G73: 10 | H73: 1
A74: 1 | B74: 7 | C74: 90 | D74: 0 | E74: =HLOOKUP(RC[-4],Sheet1!R2C1:R26C7,RC[-3]+1,FALSE)&IF(RC[2]=0,"",IF(HLOOKUP(RC[-4],Sheet1!R2C9:R26C15,RC[-3]+1,FALSE)="","","|"&HLOOKUP(RC[-4],Sheet1!R2C9:R26C15,RC[-3]+1,FALSE))) -> 33400|33200 | F74: =IF(HLOOKUP(RC[-5],Sheet1!R2C9:R26C15,RC[-4]+1,FALSE)="",ROUND(HLOOKUP(RC[-5],Sheet1!R2C1:R26C7,RC[-4]+13,FALSE)+HLOOKUP(RC[-5],Sheet1!R2C9:R26C15,RC[-4]+13,FALSE)*RC[1],0),ROUND(HLOOKUP(RC[-5],Sheet1!R2C1:R26C7,RC[-4]+13,FALSE),0)&IF(RC[1]=0,"","|"&ROUND(HLOOKUP(RC[-5],Sheet1!R2C9:R26C15,RC[-4]+13,FALSE)*RC[1],0))) -> 8|18 | G74: 9 | H74: 0
A75: 1 | B75: 7 | C75: 80 | D75: 0 | E75: =HLOOKUP(RC[-4],Sheet1!R2C1:R26C7,RC[-3]+1,FALSE)&IF(RC[2]=0,"",IF(HLOOKUP(RC[-4],Sheet1!R2C9:R26C15,RC[-3]+1,FALSE)="","","|"&HLOOKUP(RC[-4],Sheet1!R2C9:R26C15,RC[-3]+1,FALSE))) -> 33400|33200 | F75: =IF(HLOOKUP(RC[-5],Sheet1!R2C9:R26C15,RC[-4]+1,FALSE)="",ROUND(HLOOKUP(RC[-5],Sheet1!R2C1:R26C7,RC[-4]+13,FALSE)+HLOOKUP(RC[-5],Sheet1!R2C9:R26C15,RC[-4]+13,FALSE)*RC[1],0),ROUND(HLOOKUP(RC[-5],Sheet1!R2C1:R26C7,RC[-4]+13,FALSE),0)&IF(RC[1]=0,"","|"&ROUND(HLOOKUP(RC[-5],Sheet1!R2C9:R26C15,RC[-4]+13,FALSE)*RC[1],0))) -> 8|16 | G75: 8 | H75: 0
A76: 1 | B76: 7 | C76: 70 | D76: 0 | E76: =HLOOKUP(RC[-4],Sheet1!R2C1:R26C7,RC[-3]+1,FALSE)&IF(RC[2]=0,"",IF(HLOOKUP(RC[-4],Sheet1!R2C9:R26C15,RC[-3]+1,FALSE)="","","|"&HLOOKUP(RC[-4],Sheet1!R2C9:R26C15,RC[-3]+1,FALSE))) -> 33400|33200 | F76: =IF(HLOOKUP(RC[-5],Sheet1!R2C9:R26C15,RC[-4]+1,FALSE)="",ROUND(HLOOKUP(RC[-5],Sheet1!R2C1:R26C7,RC[-4]+13,FALSE)+HLOOKUP(RC[-5],Sheet1!R2C9:R26C15,RC[-4]+13,FALSE)*RC[1],0),ROUND(HLOOKUP(RC[-5],Sheet1!R2C1:R26C7,RC[-4]+13,FALSE),0)&IF(RC[1]=0,"","|"&ROUND(HLOOKUP(RC[-5],Sheet1!R2C9:R26C15,RC[-4]+13,FALSE)*RC[1],0))) -> 8|14 | G76: 7 | H76: 0
A77: 1 | B77: 7 | C77: 60 | D77: 0 | E77: =HLOOKUP(RC[-4],Sheet1!R2C1:R26C7,RC[-3]+1,FALSE)&IF(RC[2]=0,"",IF(HLOOKUP(RC[-4],Sheet1!R2C9:R26C15,RC[-3]+1,FALSE)="","","|"&HLOOKUP(RC[-4],Sheet1!R2C9:R26C15,RC[-3]+1,FALSE))) -> 33400|33200 | F77: =IF(HLOOKUP(RC[-5],Sheet1!R2C9:R26C15,RC[-4]+1,FALSE)="",ROUND(HLOOKUP(RC[-5],Sheet1!R2C1:R26C7,RC[-4]+13,FALSE)+HLOOKUP(RC[-5],Sheet1!R2C9:R26C15,RC[-4]+13,FALSE)*RC[1],0),ROUND(HLOOKUP(RC[-5],Sheet1!R2C1:R26C7,RC[-4]+13,FALSE),0)&IF(RC[1]=0,"","|"&ROUND(HLOOKUP(RC[-5],Sheet1!R2C9:R26C15,RC[-4]+13,FALSE)*RC[1],0))) -> 8|12 | G77: 6 | H77: 0
A78: 1 | B78: 7 | C78: 50 | D78: 0 | E78: =HLOOKUP(RC[-4],Sheet1!R2C1:R26C7,RC[-3]+1,FALSE)&IF(RC[2]=0,"",IF(HLOOKUP(RC[-4],Sheet1!R2C9:R26C15,RC[-3]+1,FALSE)="","","|"&HLOOKUP(RC[-4],Sheet1!R2C9:R26C15,RC[-3]+1,FALSE))) -> 33400|33200 | F78: =IF(HLOOKUP(RC[-5],Sheet1!R2C9:R26C15,RC[-4]+1,FALSE)="",ROUND(HLOOKUP(RC[-5],Sheet1!R2C1:R26C7,RC[-4]+13,FALSE)+HLOOKUP(RC[-5],Sheet1!R2C9:R26C15,RC[-4]+13,FALSE)*RC[1],0),ROUND(HLOOKUP(RC[-5],Sheet1!R2C1:R26C7,RC[-4]+13,FALSE),0)&IF(RC[1]=0,"","|"&ROUND(HLOOKUP(RC[-5],Sheet1!R2C9:R26C15,RC[-4]+13,FALSE)*RC[1],0))) -> 8|10 | G78: 5 | H78: 0
A79: 1 | B79: 7 | C79: 40 | D79: 0 | E79: =HLOOKUP(RC[-4],Sheet1!R2C1:R26C7,RC[-3]+1,FALSE)&IF(RC[2]=0,"",IF(HLOOKUP(RC[-4],Sheet1!R2C9:R26C15,RC[-3]+1,FALSE)="","","|"&HLOOKUP(RC[-4],Sheet1!R2C9:R26C15,RC[-3]+1,FALSE))) -> 33400|33200 | F79: =IF(HLOOKUP(RC[-5],Sheet1!R2C9:R26C15,RC[-4]+1,FALSE)="",ROUND(HLOOKUP(RC[-5],Sheet1!R2C1:R26C7,RC[-4]+13,FALSE)+HLOOKUP(RC[-5],Sheet1!R2C9:R26C15,RC[-4]+13,FALSE)*RC[1],0),ROUND(HLOOKUP(RC[-5],Sheet1!R2C1:R26C7,RC[-4]+13,FALSE),0)&IF(RC[1]=0,"","|"&ROUND(HLOOKUP(RC[-5],Sheet1!R2C9:R26C15,RC[-4]+13,FALSE)*RC[1],0))) -> 8|8 | G79: 4 | H79: 0
A80: 1 | B80: 7 | C80: 30 | D80: 0 | E80: =HLOOKUP(RC[-4],Sheet1!R2C1:R26C7,RC[-3]+1,FALSE)&IF(RC[2]=0,"",IF(HLOOKUP(RC[-4],Sheet1!R2C9:R26C15,RC[-3]+1,FALSE)="","","|"&HLOOKUP(RC[-4],Sheet1!R2C9:R26C15,RC[-3]+1,FALSE))) -> 33400|33200 | F80: =IF(HLOOKUP(RC[-5],Sheet1!R2C9:R26C15,RC[-4]+1,FALSE)="",ROUND(HLOOKUP(RC[-5],Sheet1!R2C1:R26C7,RC[-4]+13,FALSE)+HLOOKUP(RC[-5],Sheet1!R2C9:R26C15,RC[-4]+13,FALSE)*RC[1],0),ROUND(HLOOKUP(RC[-5],Sheet1!R2C1:R26C7,RC[-4]+13,FALSE),0)&IF(RC[1]=0,"","|"&ROUND(HLOOKUP(RC[-5],Sheet1!R2C9:R26C15,RC[-4]+13,FALSE)*RC[1],0))) -> 8|6 | G80: 3 | H80: 0
A81: 1 | B81: 7 | C81: 20 | D81: 0 | E81: =HLOOKUP(RC[-4],Sheet1!R2C1:R26C7,RC[-3]+1,FALSE)&IF(RC[2]=0,"",IF(HLOOKUP(RC[-4],Sheet1!R2C9:R26C15,RC[-3]+1,FALSE)="","","|"&HLOOKUP(RC[-4],Sheet1!R2C9:R26C15,RC[-3]+1,FALSE))) -> 33400|33200 | F81: =IF(HLOOKUP(RC[-5],Sheet1!R2C9:R26C15,RC[-4]+1,FALSE)="",ROUND(HLOOKUP(RC[-5],Sheet1!R2C1:R26C7,RC[-4]+13,FALSE)+HLOOKUP(RC[-5],Sheet1!R2C9:R26C15,RC[-4]+13,FALSE)*RC[1],0),ROUND(HLOOKUP(RC[-5],Sheet1!R2C1:R26C7,RC[-4]+13,FALSE),0)&IF(RC[1]=0,"","|"&ROUND(HLOOKUP(RC[-5],Sheet1!R2C9:R26C15,RC[-4]+13,FALSE)*RC[1],0))) -> 8|4 | G81: 2 | H81: 0
A82: 1 | B82: 7 | C82: 10 | D82: 0 | E82: =HLOOKUP(RC[-4],Sheet1!R2C1:R26C7,RC[-3]+1,FALSE)&IF(RC[2]=0,"",IF(HLOOKUP(RC[-4],Sheet1!R2C9:R26C15,RC[-3]+1,FALSE)="","","|"&HLOOKUP(RC[-4],Sheet1!R2C9:R26C15,RC[-3]+1,FALSE))) -> 33400|33200 | F82: =IF(HLOOKUP(RC[-5],Sheet1!R2C9:R26C15,RC[-4]+1,FALSE)="",ROUND(HLOOKUP(RC[-5],Sheet1!R2C1:R26C7,RC[-4]+13,FALSE)+HLOOKUP(RC[-5],Sheet1!R2C9:R26C15,RC[-4]+13,FALSE)*RC[1],0),ROUND(HLOOKUP(RC[-5],Sheet1!R2C1:R26C7,RC[-4]+13,FALSE),0)&IF(RC[1]=0,"","|"&ROUND(HLOOKUP(RC[-5],Sheet1!R2C9:R26C15,RC[-4]+13,FALSE)*RC[1],0))) -> 8|2 | G82: 1 | H82: 0
A83: 1 | B83: 7 | C83: 0 | D83: 0 | E83: =HLOOKUP(RC[-4],Sheet1!R2C1:R26C7,RC[-3]+1,FALSE)&IF(RC[2]=0,"",IF(HLOOKUP(RC[-4],Sheet1!R2C9:R26C15,RC[-3]+1,FALSE)="","","|"&HLOOKUP(RC[-4],Sheet1!R2C9:R26C15,RC[-3]+1,FALSE))) -> 33400 | F83: =IF(HLOOKUP(RC[-5],Sheet1!R2C9:R26C15,RC[-4]+1,FALSE)="",ROUND(HLOOKUP(RC[-5],Sheet1!R2C1:R26C7,RC[-4]+13,FALSE)+HLOOKUP(RC[-5],Sheet1!R2C9:R26C15,RC[-4]+13,FALSE)*RC[1],0),ROUND(HLOOKUP(RC[-5],Sheet1!R2C1:R26C7,RC[-4]+13,FALSE),0)&IF(RC[1]=0,"","|"&ROUND(HLOOKUP(RC[-5],Sheet1!R2C9:R26C15,RC[-4]+13,FALSE)*RC[1],0))) -> 8 | G83: 0 | H83: 0
A84: 1 | B84: 8 | C84: 100 | D84: 1 | E84: =HLOOKUP(RC[-4],Sheet1!R2C1:R26C7,RC[-3]+1,FALSE)&IF(RC[2]=0,"",IF(HLOOKUP(RC[-4],Sheet1!R2C9:R26C15,RC[-3]+1,FALSE)="","","|"&HLOOKUP(RC[-4],Sheet1!R2C9:R26C15,RC[-3]+1,FALSE))) -> 33400|33200 | F84: =IF(HLOOKUP(RC[-5],Sheet1!R2C9:R26C15,RC[-4]+1,FALSE)="",ROUND(HLOOKUP(RC[-5],Sheet1!R2C1:R26C7,RC[-4]+13,FALSE)+HLOOKUP(RC[-5],Sheet1!R2C9:R26C15,RC[-4]+13,FALSE)*RC[1],0),ROUND(HLOOKUP(RC[-5],Sheet1!R2C1:R26C7,RC[-4]+13,FALSE),0)&IF(RC[1]=0,"","|"&ROUND(HLOOKUP(RC[-5],Sheet1!R2C9:R26C15,RC[-4]+13,FALSE)*RC[1],0))) -> 10|20 | G84: 10 | H84: 1
A85: 1 | B85: 8 | C85: 90 | D85: 0 | E85: =HLOOKUP(RC[-4],Sheet1!R2C1:R26C7,RC[-3]+1,FALSE)&IF(RC[2]=0,"",IF(HLOOKUP(RC[-4],Sheet1!R2C9:R26C15,RC[-3]+1,FALSE)="","","|"&HLOOKUP(RC[-4],Sheet1!R2C9:R26C15,RC[-3]+1,FALSE))) -> 33400|33200 | F85: =IF(HLOOKUP(RC[-5],Sheet1!R2C9:R26C15,RC[-4]+1,FALSE)="",ROUND(HLOOKUP(RC[-5],Sheet1!R2C1:R26C7,RC[-4]+13,FALSE)+HLOOKUP(RC[-5],Sheet1!R2C9:R26C15,RC[-4]+13,FALSE)*RC[1],0),ROUND(HLOOKUP(RC[-5],Sheet1!R2C1:R26C7,RC[-4]+13,FALSE),0)&IF(RC[1]=0,"","|"&ROUND(HLOOKUP(RC[-5],Sheet1!R2C9:R26C15,RC[-4]+13,FALSE)*RC[1],0))) -> 10|18 | G85: 9 | H85: 0
A86: 1 | B86: 8 | C86: 80 | D86: 0 | E86: =HLOOKUP(RC[-4],Sheet1!R2C1:R26C7,RC[-3]+1,FALSE)&IF(RC[2]=0,"",IF(HLOOKUP(RC[-4],Sheet1!R2C9:R26C15,RC[-3]+1,FALSE)="","","|"&HLOOKUP(RC[-4],Sheet1!R2C9:R26C15,RC[-3]+1,FALSE))) -> 33400|33200 | F86: =IF(HLOOKUP(RC[-5],Sheet1!R2C9:R26C15,RC[-4]+1,FALSE)="",ROUND(HLOOKUP(RC[-5],Sheet1!R2C1:R26C7,RC[-4]+13,FALSE)+HLOOKUP(RC[-5],Sheet1!R2C9:R26C15,RC[-4]+13,FALSE)*RC[1],0),ROUND(HLOOKUP(RC[-5],Sheet1!R2C1:R26C7,RC[-4]+13,FALSE),0)&IF(RC[1]=0,"","|"&ROUND(HLOOKUP(RC[-5],Sheet1!R2C9:R26C15,RC[-4]+13,FALSE)*RC[1],0))) -> 10|16 | G86: 8 | H86: 0
A87: 1 | B87: 8 | C87: 70 | D87: 0 | E87: =HLOOKUP(RC[-4],Sheet1!R2C1:R26C7,RC[-3]+1,FALSE)&IF(RC[2]=0,"",IF(HLOOKUP(RC[-4],Sheet1!R2C9:R26C15,RC[-3]+1,FALSE)="","","|"&HLOOKUP(RC[-4],Sheet1!R2C9:R26C15,RC[-3]+1,FALSE))) -> 33400|33200 | F87: =IF(HLOOKUP(RC[-5],Sheet1!R2C9:R26C15,RC[-4]+1,FALSE)="",ROUND(HLOOKUP(RC[-5],Sheet1!R2C1:R26C7,RC[-4]+13,FALSE)+HLOOKUP(RC[-5],Sheet1!R2C9:R26C15,RC[-4]+13,FALSE)*RC[1],0),ROUND(HLOOKUP(RC[-5],Sheet1!R2C1:R26C7,RC[-4]+13,FALSE),0)&IF(RC[1]=0,"","|"&ROUND(HLOOKUP(RC[-5],Sheet1!R2C9:R26C15,RC[-4]+13,FALSE)*RC[1],0))) -> 10|14 | G87: 7 | H87: 0
A88: 1 | B88: 8 | C88: 60 | D88: 0 | E88: =HLOOKUP(RC[-4],Sheet1!R2C1:R26C7,RC[-3]+1,FALSE)&IF(RC[2]=0,"",IF(HLOOKUP(RC[-4],Sheet1!R2C9:R26C15,RC[-3]+1,FALSE)="","","|"&HLOOKUP(RC[-4],Sheet1!R2C9:R26C15,RC[-3]+1,FALSE))) -> 33400|33200 | F88: =IF(HLOOKUP(RC[-5],Sheet1!R2C9:R26C15,RC[-4]+1,FALSE)="",ROUND(HLOOKUP(RC[-5],Sheet1!R2C1:R26C7,RC[-4]+13,FALSE)+HLOOKUP(RC[-5],Sheet1!R2C9:R26C15,RC[-4]+13,FALSE)*RC[1],0),ROUND(HLOOKUP(RC[-5],Sheet1!R2C1:R26C7,RC[-4]+13,FALSE),0)&IF(RC[1]=0,"","|"&ROUND(HLOOKUP(RC[-5],Sheet1!R2C9:R26C15,RC[-4]+13,FALSE)*RC[1],0))) -> 10|12 | G88: 6 | H88: 0
A89: 1 | B89: 8 | C89: 50 | D89: 0 | E89: =HLOOKUP(RC[-4],Sheet1!R2C1:R26C7,RC[-3]+1,FALSE)&IF(RC[2]=0,"",IF(HLOOKUP(RC[-4],Sheet1!R2C9:R26C15,RC[-3]+1,FALSE)="","","|"&HLOOKUP(RC[-4],Sheet1!R2C9:R26C15,RC[-3]+1,FALSE))) -> 33400|33200 | F89: =IF(HLOOKUP(RC[-5],Sheet1!R2C9:R26C15,RC[-4]+1,FALSE)="",ROUND(HLOOKUP(RC[-5],Sheet1!R2C1:R26C7,RC[-4]+13,FALSE)+HLOOKUP(RC[-5],Sheet1!R2C9:R26C15,RC[-4]+13,FALSE)*RC[1],0),ROUND(HLOOKUP(RC[-5],Sheet1!R2C1:R26C7,RC[-4]+13,FALSE),0)&IF(RC[1]=0,"","|"&ROUND(HLOOKUP(RC[-5],Sheet1!R2C9:R26C15,RC[-4]+13,FALSE)*RC[1],0))) -> 10|10 | G89: 5 | H89: 0
A90: 1 | B90: 8 | C90: 40 | D90: 0 | E90: =HLOOKUP(RC[-4],Sheet1!R2C1:R26C7,RC[-3]+1,FALSE)&IF(RC[2]=0,"",IF(HLOOKUP(RC[-4],Sheet1!R2C9:R26C15,RC[-3]+1,FALSE)="","","|"&HLOOKUP(RC[-4],Sheet1!R2C9:R26C15,RC[-3]+1,FALSE))) -> 33400|33200 | F90: =IF(HLOOKUP(RC[-5],Sheet1!R2C9:R26C15,RC[-4]+1,FALSE)="",ROUND(HLOOKUP(RC[-5],Sheet1!R2C1:R26C7,RC[-4]+13,FALSE)+HLOOKUP(RC[-5],Sheet1!R2C9:R26C15,RC[-4]+13,FALSE)*RC[1],0),ROUND(HLOOKUP(RC[-5],Sheet1!R2C1:R26C7,RC[-4]+13,FALSE),0)&IF(RC[1]=0,"","|"&ROUND(HLOOKUP(RC[-5],Sheet1!R2C9:R26C15,RC[-4]+13,FALSE)*RC[1],0))) -> 10|8 | G90: 4 | H90: 0
A91: 1 | B91: 8 | C91: 30 | D91: 0 | E91: =HLOOKUP(RC[-4],Sheet1!R2C1:R26C7,RC[-3]+1,FALSE)&IF(RC[2]=0,"",IF(HLOOKUP(RC[-4],Sheet1!R2C9:R26C15,RC[-3]+1,FALSE)="","","|"&HLOOKUP(RC[-4],Sheet1!R2C9:R26C15,RC[-3]+1,FALSE))) -> 33400|33200 | F91: =IF(HLOOKUP(RC[-5],Sheet1!R2C9:R26C15,RC[-4]+1,FALSE)="",ROUND(HLOOKUP(RC[-5],Sheet1!R2C1:R26C7,RC[-4]+13,FALSE)+HLOOKUP(RC[-5],Sheet1!R2C9:R26C15,RC[-4]+13,FALSE)*RC[1],0),ROUND(HLOOKUP(RC[-5],Sheet1!R2C1:R26C7,RC[-4]+13,FALSE),0)&IF(RC[1]=0,"","|"&ROUND(HLOOKUP(RC[-5],Sheet1!R2C9:R26C15,RC[-4]+13,FALSE)*RC[1],0))) -> 10|6 | G91: 3 | H91: 0
A92: 1 | B92: 8 | C92: 20 | D92: 0 | E92: =HLOOKUP(RC[-4],Sheet1!R2C1:R26C7,RC[-3]+1,FALSE)&IF(RC[2]=0,"",IF(HLOOKUP(RC[-4],Sheet1!R2C9:R26C15,RC[-3]+1,FALSE)="","","|"&HLOOKUP(RC[-4],Sheet1!R2C9:R26C15,RC[-3]+1,FALSE))) -> 33400|33200 | F92: =IF(HLOOKUP(RC[-5],Sheet1!R2C9:R26C15,RC[-4]+1,FALSE)="",ROUND(HLOOKUP(RC[-5],Sheet1!R2C1:R26C7,RC[-4]+13,FALSE)+HLOOKUP(RC[-5],Sheet1!R2C9:R26C15,RC[-4]+13,FALSE)*RC[1],0),ROUND(HLOOKUP(RC[-5],Sheet1!R2C1:R26C7,RC[-4]+13,FALSE),0)&IF(RC[1]=0,"","|"&ROUND(HLOOKUP(RC[-5],Sheet1!R2C9:R26C15,RC[-4]+13,FALSE)*RC[1],0))) -> 10|4 | G92: 2 | H92: 0
A93: 1 | B93: 8 | C93: 10 | D93: 0 | E93: =HLOOKUP(RC[-4],Sheet1!R2C1:R26C7,RC[-3]+1,FALSE)&IF(RC[2]=0,"",IF(HLOOKUP(RC[-4],Sheet1!R2C9:R26C15,RC[-3]+1,FALSE)="","","|"&HLOOKUP(RC[-4],Sheet1!R2C9:R26C15,RC[-3]+1,FALSE))) -> 33400|33200 | F93: =IF(HLOOKUP(RC[-5],Sheet1!R2C9:R26C15,RC[-4]+1,FALSE)="",ROUND(HLOOKUP(RC[-5],Sheet1!R2C1:R26C7,RC[-4]+13,FALSE)+HLOOKUP(RC[-5],Sheet1!R2C9:R26C15,RC[-4]+13,FALSE)*RC[1],0),ROUND(HLOOKUP(RC[-5],Sheet1!R2C1:R26C7,RC[-4]+13,FALSE),0)&IF(RC[1]=0,"","|"&ROUND(HLOOKUP(RC[-5],Sheet1!R2C9:R26C15,RC[-4]+13,FALSE)*RC[1],0))) -> 10|2 | G93: 1 | H93: 0
A94: 1 | B94: 8 | C94: 0 | D94: 0 | E94: =HLOOKUP(RC[-4],Sheet1!R2C1:R26C7,RC[-3]+1,FALSE)&IF(RC[2]=0,"",IF(HLOOKUP(RC[-4],Sheet1!R2C9:R26C15,RC[-3]+1,FALSE)="","","|"&HLOOKUP(RC[-4],Sheet1!R2C9:R26C15,RC[-3]+1,FALSE))) -> 33400 | F94: =IF(HLOOKUP(RC[-5],Sheet1!R2C9:R26C15,RC[-4]+1,FALSE)="",ROUND(HLOOKUP(RC[-5],Sheet1!R2C1:R26C7,RC[-4]+13,FALSE)+HLOOKUP(RC[-5],Sheet1!R2C9:R26C15,RC[-4]+13,FALSE)*RC[1],0),ROUND(HLOOKUP(RC[-5],Sheet1!R2C1:R26C7,RC[-4]+13,FALSE),0)&IF(RC[1]=0,"","|"&ROUND(HLOOKUP(RC[-5],Sheet1!R2C9:R26C15,RC[-4]+13,FALSE)*RC[1],0))) -> 10 | G94: 0 | H94: 0
A95: 1 | B95: 9 | C95: 100 | D95: 1 | E95: =HLOOKUP(RC[-4],Sheet1!R2C1:R26C7,RC[-3]+1,FALSE)&IF(RC[2]=0,"",IF(HLOOKUP(RC[-4],Sheet1!R2C9:R26C15,RC[-3]+1,FALSE)="","","|"&HLOOKUP(RC[-4],Sheet1!R2C9:R26C15,RC[-3]+1,FALSE))) -> 33400|33300 | F95: =IF(HLOOKUP(RC[-5],Sheet1!R2C9:R26C15,RC[-4]+1,FALSE)="",ROUND(HLOOKUP(RC[-5],Sheet1!R2C1:R26C7,RC[-4]+13,FALSE)+HLOOKUP(RC[-5],Sheet1!R2C9:R26C15,RC[-4]+13,FALSE)*RC[1],0),ROUND(HLOOKUP(RC[-5],Sheet1!R2C1:R26C7,RC[-4]+13,FALSE),0)&IF(RC[1]=0,"","|"&ROUND(HLOOKUP(RC[-5],Sheet1!R2C9:R26C15,RC[-4]+13,FALSE)*RC[1],0))) -> 12|10 | G95: 10 | H95: 1
A96: 1 | B96: 9 | C96: 90 | D96: 0 | E96: =HLOOKUP(RC[-4],Sheet1!R2C1:R26C7,RC[-3]+1,FALSE)&IF(RC[2]=0,"",IF(HLOOKUP(RC[-4],Sheet1!R2C9:R26C15,RC[-3]+1,FALSE)="","","|"&HLOOKUP(RC[-4],Sheet1!R2C9:R26C15,RC[-3]+1,FALSE))) -> 33400|33300 | F96: =IF(HLOOKUP(RC[-5],Sheet1!R2C9:R26C15,RC[-4]+1,FALSE)="",ROUND(HLOOKUP(RC[-5],Sheet1!R2C1:R26C7,RC[-4]+13,FALSE)+HLOOKUP(RC[-5],Sheet1!R2C9:R26C15,RC[-4]+13,FALSE)*RC[1],0),ROUND(HLOOKUP(RC[-5],Sheet1!R2C1:R26C7,RC[-4]+13,FALSE),0)&IF(RC[1]=0,"","|"&ROUND(HLOOKUP(RC[-5],Sheet1!R2C9:R26C15,RC[-4]+13,FALSE)*RC[1],0))) -> 12|9 | G96: 9 | H96: 0
A97: 1 | B97: 9 | C97: 80 | D97: 0 | E97: =HLOOKUP(RC[-4],Sheet1!R2C1:R26C7,RC[-3]+1,FALSE)&IF(RC[2]=0,"",IF(HLOOKUP(RC[-4],Sheet1!R2C9:R26C15,RC[-3]+1,FALSE)="","","|"&HLOOKUP(RC[-4],Sheet1!R2C9:R26C15,RC[-3]+1,FALSE))) -> 33400|33300 | F97: =IF(HLOOKUP(RC[-5],Sheet1!R2C9:R26C15,RC[-4]+1,FALSE)="",ROUND(HLOOKUP(RC[-5],Sheet1!R2C1:R26C7,RC[-4]+13,FALSE)+HLOOKUP(RC[-5],Sheet1!R2C9:R26C15,RC[-4]+13,FALSE)*RC[1],0),ROUND(HLOOKUP(RC[-5],Sheet1!R2C1:R26C7,RC[-4]+13,FALSE),0)&IF(RC[1]=0,"","|"&ROUND(HLOOKUP(RC[-5],Sheet1!R2C9:R26C15,RC[-4]+13,FALSE)*RC[1],0))) -> 12|8 | G97: 8 | H97: 0
A98: 1 | B98: 9 | C98: 70 | D98: 0 | E98: =HLOOKUP(RC[-4],Sheet1!R2C1:R26C7,RC[-3]+1,FALSE)&IF(RC[2]=0,"",IF(HLOOKUP(RC[-4],Sheet1!R2C9:R26C15,RC[-3]+1,FALSE)="","","|"&HLOOKUP(RC[-4],Sheet1!R2C9:R26C15,RC[-3]+1,FALSE))) -> 33400|33300 | F98: =IF(HLOOKUP(RC[-5],Sheet1!R2C9:R26C15,RC[-4]+1,FALSE)="",ROUND(HLOOKUP(RC[-5],Sheet1!R2C1:R26C7,RC[-4]+13,FALSE)+HLOOKUP(RC[-5],Sheet1!R2C9:R26C15,RC[-4]+13,FALSE)*RC[1],0),ROUND(HLOOKUP(RC[-5],Sheet1!R2C1:R26C7,RC[-4]+13,FALSE),0)&IF(RC[1]=0,"","|"&ROUND(HLOOKUP(RC[-5],Sheet1!R2C9:R26C15,RC[-4]+13,FALSE)*RC[1],0))) -> 12|7 | G98: 7 | H98: 0
A99: 1 | B99: 9 | C99: 60 | D99: 0 | E99: =HLOOKUP(RC[-4],Sheet1!R2C1:R26C7,RC[-3]+1,FALSE)&IF(RC[2]=0,"",IF(HLOOKUP(RC[-4],Sheet1!R2C9:R26C15,RC[-3]+1,FALSE)="","","|"&HLOOKUP(RC[-4],Sheet1!R2C9:R26C15,RC[-3]+1,FALSE))) -> 33400|33300 | F99: =IF(HLOOKUP(RC[-5],Sheet1!R2C9:R26C15,RC[-4]+1,FALSE)="",ROUND(HLOOKUP(RC[-5],Sheet1!R2C1:R26C7,RC[-4]+13,FALSE)+HLOOKUP(RC[-5],Sheet1!R2C9:R26C15,RC[-4]+13,FALSE)*RC[1],0),ROUND(HLOOKUP(RC[-5],Sheet1!R2C1:R26C7,RC[-4]+13,FALSE),0)&IF(RC[1]=0,"","|"&ROUND(HLOOKUP(RC[-5],Sheet1!R2C9:R26C15,RC[-4]+13,FALSE)*RC[1],0))) -> 12|6 | G99: 6 | H99: 0
A100: 1 | B100: 9 | C100: 50 | D100: 0 | E100: =HLOOKUP(RC[-4],Sheet1!R2C1:R26C7,RC[-3]+1,FALSE)&IF(RC[2]=0,"",IF(HLOOKUP(RC[-4],Sheet1!R2C9:R26C15,RC[-3]+1,FALSE)="","","|"&HLOOKUP(RC[-4],Sheet1!R2C9:R26C15,RC[-3]+1,FALSE))) -> 33400|33300 | F100: =IF(HLOOKUP(RC[-5],Sheet1!R2C9:R26C15,RC[-4]+1,FALSE)="",ROUND(HLOOKUP(RC[-5],Sheet1!R2C1:R26C7,RC[-4]+13,FALSE)+HLOOKUP(RC[-5],Sheet1!R2C9:R26C15,RC[-4]+13,FALSE)*RC[1],0),ROUND(HLOOKUP(RC[-5],Sheet1!R2C1:R26C7,RC[-4]+13,FALSE),0)&IF(RC[1]=0,"","|"&ROUND(HLOOKUP(RC[-5],Sheet1!R2C9:R26C15,RC[-4]+13,FALSE)*RC[1],0))) -> 12|5 | G100: 5 | H100: 0
A101: 1 | B101: 9 | C101: 40 | D101: 0 | E101: =HLOOKUP(RC[-4],Sheet1!R2C1:R26C7,RC[-3]+1,FALSE)&IF(RC[2]=0,"",IF(HLOOKUP(RC[-4],Sheet1!R2C9:R26C15,RC[-3]+1,FALSE)="","","|"&HLOOKUP(RC[-4],Sheet1!R2C9:R26C15,RC[-3]+1,FALSE))) -> 33400|33300 | F101: =IF(HLOOKUP(RC[-5],Sheet1!R2C9:R26C15,RC[-4]+1,FALSE)="",ROUND(HLOOKUP(RC[-5],Sheet1!R2C1:R26C7,RC[-4]+13,FALSE)+HLOOKUP(RC[-5],Sheet1!R2C9:R26C15,RC[-4]+13,FALSE)*RC[1],0),ROUND(HLOOKUP(RC[-5],Sheet1!R2C1:R26C7,RC[-4]+13,FALSE),0)&IF(RC[1]=0,"","|"&ROUND(HLOOKUP(RC[-5],Sheet1!R2C9:R26C15,RC[-4]+13,FALSE)*RC[1],0))) -> 12|4 | G101: 4 | H101: 0
A102: 1 | B102: 9 | C102: 30 | D102: 0 | E102: =HLOOKUP(RC[-4],Sheet1!R2C1:R26C7,RC[-3]+1,FALSE)&IF(RC[2]=0,"",IF(HLOOKUP(RC[-4],Sheet1!R2C9:R26C15,RC[-3]+1,FALSE)="","","|"&HLOOKUP(RC[-4],Sheet1!R2C9:R26C15,RC[-3]+1,FALSE))) -> 33400|33300 | F102: =IF(HLOOKUP(RC[-5],Sheet1!R2C9:R26C15,RC[-4]+1,FALSE)="",ROUND(HLOOKUP(RC[-5],Sheet1!R2C1:R26C7,RC[-4]+13,FALSE)+HLOOKUP(RC[-5],Sheet1!R2C9:R26C15,RC[-4]+13,FALSE)*RC[1],0),ROUND(HLOOKUP(RC[-5],Sheet1!R2C1:R26C7,RC[-4]+13,FALSE),0)&IF(RC[1]=0,"","|"&ROUND(HLOOKUP(RC[-5],Sheet1!R2C9:R26C15,RC[-4]+13,FALSE)*RC[1],0))) -> 12|3 | G102: 3 | H102: 0
A103: 1 | B103: 9 | C103: 20 | D103: 0 | E103: =HLOOKUP(RC[-4],Sheet1!R2C1:R26C7,RC[-3]+1,FALSE)&IF(RC[2]=0,"",IF(HLOOKUP(RC[-4],Sheet1!R2C9:R26C15,RC[-3]+1,FALSE)="","","|"&HLOOKUP(RC[-4],Sheet1!R2C9:R26C15,RC[-3]+1,FALSE))) -> 33400|33300 | F103: =IF(HLOOKUP(RC[-5],Sheet1!R2C9:R26C15,RC[-4]+1,FALSE)="",ROUND(HLOOKUP(RC[-5],Sheet1!R2C1:R26C7,RC[-4]+13,FALSE)+HLOOKUP(RC[-5],Sheet1!R2C9:R26C15,RC[-4]+13,FALSE)*RC[1],0),ROUND(HLOOKUP(RC[-5],Sheet1!R2C1:R26C7,RC[-4]+13,FALSE),0)&IF(RC[1]=0,"","|"&ROUND(HLOOKUP(RC[-5],Sheet1!R2C9:R26C15,RC[-4]+13,FALSE)*RC[1],0))) -> 12|2 | G103: 2 | H103: 0
A104: 1 | B104: 9 | C104: 10 | D104: 0 | E104: =HLOOKUP(RC[-4],Sheet1!R2C1:R26C7,RC[-3]+1,FALSE)&IF(RC[2]=0,"",IF(HLOOKUP(RC[-4],Sheet1!R2C9:R26C15,RC[-3]+1,FALSE)="","","|"&HLOOKUP(RC[-4],Sheet1!R2C9:R26C15,RC[-3]+1,FALSE))) -> 33400|33300 | F104: =IF(HLOOKUP(RC[-5],Sheet1!R2C9:R26C15,RC[-4]+1,FALSE)="",ROUND(HLOOKUP(RC[-5],Sheet1!R2C1:R26C7,RC[-4]+13,FALSE)+HLOOKUP(RC[-5],Sheet1!R2C9:R26C15,RC[-4]+13,FALSE)*RC[1],0),ROUND(HLOOKUP(RC[-5],Sheet1!R2C1:R26C7,RC[-4]+13,FALSE),0)&IF(RC[1]=0,"","|"&ROUND(HLOOKUP(RC[-5],Sheet1!R2C9:R26C15,RC[-4]+13,FALSE)*RC[1],0))) -> 12|1 | G104: 1 | H104: 0
A105: 1 | B105: 9 | C105: 0 | D105: 0 | E105: =HLOOKUP(RC[-4],Sheet1!R2C1:R26C7,RC[-3]+1,FALSE)&IF(RC[2]=0,"",IF(HLOOKUP(RC[-4],Sheet1!R2C9:R26C15,RC[-3]+1,FALSE)="","","|"&HLOOKUP(RC[-4],Sheet1!R2C9:R26C15,RC[-3]+1,FALSE))) -> 33400 | F105: =IF(HLOOKUP(RC[-5],Sheet1!R2C9:R26C15,RC[-4]+1,FALSE)="",ROUND(HLOOKUP(RC[-5],Sheet1!R2C1:R26C7,RC[-4]+13,FALSE)+HLOOKUP(RC[-5],Sheet1!R2C9:R26C15,RC[-4]+13,FALSE)*RC[1],0),ROUND(HLOOKUP(RC[-5],Sheet1!R2C1:R26C7,RC[-4]+13,FALSE),0)&IF(RC[1]=0,"","|"&ROUND(HLOOKUP(RC[-5],Sheet1!R2C9:R26C15,RC[-4]+13,FALSE)*RC[1],0))) -> 12 | G105: 0 | H105: 0
A106: 1 | B106: 10 | C106: 100 | D106: 1 | E106: =HLOOKUP(RC[-4],Sheet1!R2C1:R26C7,RC[-3]+1,FALSE)&IF(RC[2]=0,"",IF(HLOOKUP(RC[-4],Sheet1!R2C9:R26C15,RC[-3]+1,FALSE)="","","|"&HLOOKUP(RC[-4],Sheet1!R2C9:R26C15,RC[-3]+1,FALSE))) -> 33400|33300 | F106: =IF(HLOOKUP(RC[-5],Sheet1!R2C9:R26C15,RC[-4]+1,FALSE)="",ROUND(HLOOKUP(RC[-5],Sheet1!R2C1:R26C7,RC[-4]+13,FALSE)+HLOOKUP(RC[-5],Sheet1!R2C9:R26C15,RC[-4]+13,FALSE)*RC[1],0),ROUND(HLOOKUP(RC[-5],Sheet1!R2C1:R26C7,RC[-4]+13,FALSE),0)&IF(RC[1]=0,"","|"&ROUND(HLOOKUP(RC[-5],Sheet1!R2C9:R26C15,RC[-4]+13,FALSE)*RC[1],0))) -> 15|10 | G106: 10 | H106: 1
A107: 1 | B107: 10 | C107: 90 | D107: 0 | E107: =HLOOKUP(RC[-4],Sheet1!R2C1:R26C7,RC[-3]+1,FALSE)&IF(RC[2]=0,"",IF(HLOOKUP(RC[-4],Sheet1!R2C9:R26C15,RC[-3]+1,FALSE)="","","|"&HLOOKUP(RC[-4],Sheet1!R2C9:R26C15,RC[-3]+1,FALSE))) -> 33400|33300 | F107: =IF(HLOOKUP(RC[-5],Sheet1!R2C9:R26C15,RC[-4]+1,FALSE)="",ROUND(HLOOKUP(RC[-5],Sheet1!R2C1:R26C7,RC[-4]+13,FALSE)+HLOOKUP(RC[-5],Sheet1!R2C9:R26C15,RC[-4]+13,FALSE)*RC[1],0),ROUND(HLOOKUP(RC[-5],Sheet1!R2C1:R26C7,RC[-4]+13,FALSE),0)&IF(RC[1]=0,"","|"&ROUND(HLOOKUP(RC[-5],Sheet1!R2C9:R26C15,RC[-4]+13,FALSE)*RC[1],0))) -> 15|9 | G107: 9 | H107: 0
A108: 1 | B108: 10 | C108: 80 | D108: 0 | E108: =HLOOKUP(RC[-4],Sheet1!R2C1:R26C7,RC[-3]+1,FALSE)&IF(RC[2]=0,"",IF(HLOOKUP(RC[-4],Sheet1!R2C9:R26C15,RC[-3]+1,FALSE)="","","|"&HLOOKUP(RC[-4],Sheet1!R2C9:R26C15,RC[-3]+1,FALSE))) -> 33400|33300 | F108: =IF(HLOOKUP(RC[-5],Sheet1!R2C9:R26C15,RC[-4]+1,FALSE)="",ROUND(HLOOKUP(RC[-5],Sheet1!R2C1:R26C7,RC[-4]+13,FALSE)+HLOOKUP(RC[-5],Sheet1!R2C9:R26C15,RC[-4]+13,FALSE)*RC[1],0),ROUND(HLOOKUP(RC[-5],Sheet1!R2C1:R26C7,RC[-4]+13,FALSE),0)&IF(RC[1]=0,"","|"&ROUND(HLOOKUP(RC[-5],Sheet1!R2C9:R26C15,RC[-4]+13,FALSE)*RC[1],0))) -> 15|8 | G108: 8 | H108: 0
A109: 1 | B109: 10 | C109: 70 | D109: 0 | E109: =HLOOKUP(RC[-4],Sheet1!R2C1:R26C7,RC[-3]+1,FALSE)&IF(RC[2]=0,"",IF(HLOOKUP(RC[-4],Sheet1!R2C9:R26C15,RC[-3]+1,FALSE)="","","|"&HLOOKUP(RC[-4],Sheet1!R2C9:R26C15,RC[-3]+1,FALSE))) -> 33400|33300 | F109: =IF(HLOOKUP(RC[-5],Sheet1!R2C9:R26C15,RC[-4]+1,FALSE)="",ROUND(HLOOKUP(RC[-5],Sheet1!R2C1:R26C7,RC[-4]+13,FALSE)+HLOOKUP(RC[-5],Sheet1!R2C9:R26C15,RC[-4]+13,FALSE)*RC[1],0),ROUND(HLOOKUP(RC[-5],Sheet1!R2C1:R26C7,RC[-4]+13,FALSE),0)&IF(RC[1]=0,"","|"&ROUND(HLOOKUP(RC[-5],Sheet1!R2C9:R26C15,RC[-4]+13,FALSE)*RC[1],0))) -> 15|7 | G109: 7 | H109: 0
A110: 1 | B110: 10 | C110: 60 | D110: 0 | E110: =HLOOKUP(RC[-4],Sheet1!R2C1:R26C7,RC[-3]+1,FALSE)&IF(RC[2]=0,"",IF(HLOOKUP(RC[-4],Sheet1!R2C9:R26C15,RC[-3]+1,FALSE)="","","|"&HLOOKUP(RC[-4],Sheet1!R2C9:R26C15,RC[-3]+1,FALSE))) -> 33400|33300 | F110: =IF(HLOOKUP(RC[-5],Sheet1!R2C9:R26C15,RC[-4]+1,FALSE)="",ROUND(HLOOKUP(RC[-5],Sheet1!R2C1:R26C7,RC[-4]+13,FALSE)+HLOOKUP(RC[-5],Sheet1!R2C9:R26C15,RC[-4]+13,FALSE)*RC[1],0),ROUND(HLOOKUP(RC[-5],Sheet1!R2C1:R26C7,RC[-4]+13,FALSE),0)&IF(RC[1]=0,"","|"&ROUND(HLOOKUP(RC[-5],Sheet1!R2C9:R26C15,RC[-4]+13,FALSE)*RC[1],0))) -> 15|6 | G110: 6 | H110: 0
A111: 1 | B111: 10 | C111: 50 | D111: 0 | E111: =HLOOKUP(RC[-4],Sheet1!R2C1:R26C7,RC[-3]+1,FALSE)&IF(RC[2]=0,"",IF(HLOOKUP(RC[-4],Sheet1!R2C9:R26C15,RC[-3]+1,FALSE)="","","|"&HLOOKUP(RC[-4],Sheet1!R2C9:R26C15,RC[-3]+1,FALSE))) -> 33400|33300 | F111: =IF(HLOOKUP(RC[-5],Sheet1!R2C9:R26C15,RC[-4]+1,FALSE)="",ROUND(HLOOKUP(RC[-5],Sheet1!R2C1:R26C7,RC[-4]+13,FALSE)+HLOOKUP(RC[-5],Sheet1!R2C9:R26C15,RC[-4]+13,FALSE)*RC[1],0),ROUND(HLOOKUP(RC[-5],Sheet1!R2C1:R26C7,RC[-4]+13,FALSE),0)&IF(RC[1]=0,"","|"&ROUND(HLOOKUP(RC[-5],Sheet1!R2C9:R26C15,RC[-4]+13,FALSE)*RC[1],0))) -> 15|5 | G111: 5 | H111: 0
A112: 1 | B112: 10 | C112: 40 | D112: 0 | E112: =HLOOKUP(RC[-4],Sheet1!R2C1:R26C7,RC[-3]+1,FALSE)&IF(RC[2]=0,"",IF(HLOOKUP(RC[-4],Sheet1!R2C9:R26C15,RC[-3]+1,FALSE)="","","|"&HLOOKUP(RC[-4],Sheet1!R2C9:R26C15,RC[-3]+1,FALSE))) -> 33400|33300 | F112: =IF(HLOOKUP(RC[-5],Sheet1!R2C9:R26C15,RC[-4]+1,FALSE)="",ROUND(HLOOKUP(RC[-5],Sheet1!R2C1:R26C7,RC[-4]+13,FALSE)+HLOOKUP(RC[-5],Sheet1!R2C9:R26C15,RC[-4]+13,FALSE)*RC[1],0),ROUND(HLOOKUP(RC[-5],Sheet1!R2C1:R26C7,RC[-4]+13,FALSE),0)&IF(RC[1]=0,"","|"&ROUND(HLOOKUP(RC[-5],Sheet1!R2C9:R26C15,RC[-4]+13,FALSE)*RC[1],0))) -> 15|4 | G112: 4 | H112: 0
A113: 1 | B113: 10 | C113: 30 | D113: 0 | E113: =HLOOKUP(RC[-4],Sheet1!R2C1:R26C7,RC[-3]+1,FALSE)&IF(RC[2]=0,"",IF(HLOOKUP(RC[-4],Sheet1!R2C9:R26C15,RC[-3]+1,FALSE)="","","|"&HLOOKUP(RC[-4],Sheet1!R2C9:R26C15,RC[-3]+1,FALSE))) -> 33400|33300 | F113: =IF(HLOOKUP(RC[-5],Sheet1!R2C9:R26C15,RC[-4]+1,FALSE)="",ROUND(HLOOKUP(RC[-5],Sheet1!R2C1:R26C7,RC[-4]+13,FALSE)+HLOOKUP(RC[-5],Sheet1!R2C9:R26C15,RC[-4]+13,FALSE)*RC[1],0),ROUND(HLOOKUP(RC[-5],Sheet1!R2C1:R26C7,RC[-4]+13,FALSE),0)&IF(RC[1]=0,"","|"&ROUND(HLOOKUP(RC[-5],Sheet1!R2C9:R26C15,RC[-4]+13,FALSE)*RC[1],0))) -> 15|3 | G113: 3 | H113: 0
A114: 1 | B114: 10 | C114: 20 | D114: 0 | E114: =HLOOKUP(RC[-4],Sheet1!R2C1:R26C7,RC[-3]+1,FALSE)&IF(RC[2]=0,"",IF(HLOOKUP(RC[-4],Sheet1!R2C9:R26C15,RC[-3]+1,FALSE)="","","|"&HLOOKUP(RC[-4],Sheet1!R2C9:R26C15,RC[-3]+1,FALSE))) -> 33400|33300 | F114: =IF(HLOOKUP(RC[-5],Sheet1!R2C9:R26C15,RC[-4]+1,FALSE)="",ROUND(HLOOKUP(RC[-5],Sheet1!R2C1:R26C7,RC[-4]+13,FALSE)+HLOOKUP(RC[-5],Sheet1!R2C9:R26C15,RC[-4]+13,FALSE)*RC[1],0),ROUND(HLOOKUP(RC[-5],Sheet1!R2C1:R26C7,RC[-4]+13,FALSE),0)&IF(RC[1]=0,"","|"&ROUND(HLOOKUP(RC[-5],Sheet1!R2C9:R26C15,RC[-4]+13,FALSE)*RC[1],0))) -> 15|2 | G114: 2 | H114: 0
A115: 1 | B115: 10 | C115: 10 | D115: 0 | E115: =HLOOKUP(RC[-4],Sheet1!R2C1:R26C7,RC[-3]+1,FALSE)&IF(RC[2]=0,"",IF(HLOOKUP(RC[-4],Sheet1!R2C9:R26C15,RC[-3]+1,FALSE)="","","|"&HLOOKUP(RC[-4],Sheet1!R2C9:R26C15,RC[-3]+1,FALSE))) -> 33400|33300 | F115: =IF(HLOOKUP(RC[-5],Sheet1!R2C9:R26C15,RC[-4]+1,FALSE)="",ROUND(HLOOKUP(RC[-5],Sheet1!R2C1:R26C7,RC[-4]+13,FALSE)+HLOOKUP(RC[-5],Sheet1!R2C9:R26C15,RC[-4]+13,FALSE)*RC[1],0),ROUND(HLOOKUP(RC[-5],Sheet1!R2C1:R26C7,RC[-4]+13,FALSE),0)&IF(RC[1]=0,"","|"&ROUND(HLOOKUP(RC[-5],Sheet1!R2C9:R26C15,RC[-4]+13,FALSE)*RC[1],0))) -> 15|1 | G115: 1 | H115: 0
A116: 1 | B116: 10 | C116: 0 | D116: 0 | E116: =HLOOKUP(RC[-4],Sheet1!R2C1:R26C7,RC[-3]+1,FALSE)&IF(RC[2]=0,"",IF(HLOOKUP(RC[-4],Sheet1!R2C9:R26C15,RC[-3]+1,FALSE)="","","|"&HLOOKUP(RC[-4],Sheet1!R2C9:R26C15,RC[-3]+1,FALSE))) -> 33400 | F116: =IF(HLOOKUP(RC[-5],Sheet1!R2C9:R26C15,RC[-4]+1,FALSE)="",ROUND(HLOOKUP(RC[-5],Sheet1!R2C1:R26C7,RC[-4]+13,FALSE)+HLOOKUP(RC[-5],Sheet1!R2C9:R26C15,RC[-4]+13,FALSE)*RC[1],0),ROUND(HLOOKUP(RC[-5],Sheet1!R2C1:R26C7,RC[-4]+13,FALSE),0)&IF(RC[1]=0,"","|"&ROUND(HLOOKUP(RC[-5],Sheet1!R2C9:R26C15,RC[-4]+13,FALSE)*RC[1],0))) -> 15 | G116: 0 | H116: 0
A117: 1 | B117: 11 | C117: 100 | D117: 1 | E117: =HLOOKUP(RC[-4],Sheet1!R2C1:R26C7,RC[-3]+1,FALSE)&IF(RC[2]=0,"",IF(HLOOKUP(RC[-4],Sheet1!R2C9:R26C15,RC[-3]+1,FALSE)="","","|"&HLOOKUP(RC[-4],Sheet1!R2C9:R26C15,RC[-3]+1,FALSE))) -> 33400|33300 | F117: =IF(HLOOKUP(RC[-5],Sheet1!R2C9:R26C15,RC[-4]+1,FALSE)="",ROUND(HLOOKUP(RC[-5],Sheet1!R2C1:R26C7,RC[-4]+13,FALSE)+HLOOKUP(RC[-5],Sheet1!R2C9:R26C15,RC[-4]+13,FALSE)*RC[1],0),ROUND(HLOOKUP(RC[-5],Sheet1!R2C1:R26C7,RC[-4]+13,FALSE),0)&IF(RC[1]=0,"","|"&ROUND(HLOOKUP(RC[-5],Sheet1!R2C9:R26C15,RC[-4]+13,FALSE)*RC[1],0))) -> 19|20 | G117: 10 | H117: 1
A118: 1 | B118: 11 | C118: 90 | D118: 0 | E118: =HLOOKUP(RC[-4],Sheet1!R2C1:R26C7,RC[-3]+1,FALSE)&IF(RC[2]=0,"",IF(HLOOKUP(RC[-4],Sheet1!R2C9:R26C15,RC[-3]+1,FALSE)="","","|"&HLOOKUP(RC[-4],Sheet1!R2C9:R26C15,RC[-3]+1,FALSE))) -> 33400|33300 | F118: =IF(HLOOKUP(RC[-5],Sheet1!R2C9:R26C15,RC[-4]+1,FALSE)="",ROUND(HLOOKUP(RC[-5],Sheet1!R2C1:R26C7,RC[-4]+13,FALSE)+HLOOKUP(RC[-5],Sheet1!R2C9:R26C15,RC[-4]+13,FALSE)*RC[1],0),ROUND(HLOOKUP(RC[-5],Sheet1!R2C1:R26C7,RC[-4]+13,FALSE),0)&IF(RC[1]=0,"","|"&ROUND(HLOOKUP(RC[-5],Sheet1!R2C9:R26C15,RC[-4]+13,FALSE)*RC[1],0))) -> 19|18 | G118: 9 | H118: 0
A119: 1 | B119: 11 | C119: 80 | D119: 0 | E119: =HLOOKUP(RC[-4],Sheet1!R2C1:R26C7,RC[-3]+1,FALSE)&IF(RC[2]=0,"",IF(HLOOKUP(RC[-4],Sheet1!R2C9:R26C15,RC[-3]+1,FALSE)="","","|"&HLOOKUP(RC[-4],Sheet1!R2C9:R26C15,RC[-3]+1,FALSE))) -> 33400|33300 | F119: =IF(HLOOKUP(RC[-5],Sheet1!R2C9:R26C15,RC[-4]+1,FALSE)="",ROUND(HLOOKUP(RC[-5],Sheet1!R2C1:R26C7,RC[-4]+13,FALSE)+HLOOKUP(RC[-5],Sheet1!R2C9:R26C15,RC[-4]+13,FALSE)*RC[1],0),ROUND(HLOOKUP(RC[-5],Sheet1!R2C1:R26C7,RC[-4]+13,FALSE),0)&IF(RC[1]=0,"","|"&ROUND(HLOOKUP(RC[-5],Sheet1!R2C9:R26C15,RC[-4]+13,FALSE)*RC[1],0))) -> 19|16 | G119: 8 | H119: 0
A120: 1 | B120: 11 | C120: 70 | D120: 0 | E120: =HLOOKUP(RC[-4],Sheet1!R2C1:R26C7,RC[-3]+1,FALSE)&IF(RC[2]=0,"",IF(HLOOKUP(RC[-4],Sheet1!R2C9:R26C15,RC[-3]+1,FALSE)="","","|"&HLOOKUP(RC[-4],Sheet1!R2C9:R26C15,RC[-3]+1,FALSE))) -> 33400|33300 | F120: =IF(HLOOKUP(RC[-5],Sheet1!R2C9:R26C15,RC[-4]+1,FALSE)="",ROUND(HLOOKUP(RC[-5],Sheet1!R2C1:R26C7,RC[-4]+13,FALSE)+HLOOKUP(RC[-5],Sheet1!R2C9:R26C15,RC[-4]+13,FALSE)*RC[1],0),ROUND(HLOOKUP(RC[-5],Sheet1!R2C1:R26C7,RC[-4]+13,FALSE),0)&IF(RC[1]=0,"","|"&ROUND(HLOOKUP(RC[-5],Sheet1!R2C9:R26C15,RC[-4]+13,FALSE)*RC[1],0))) -> 19|14 | G120: 7 | H120: 0
A121: 1 | B121: 11 | C121: 60 | D121: 0 | E121: =HLOOKUP(RC[-4],Sheet1!R2C1:R26C7,RC[-3]+1,FALSE)&IF(RC[2]=0,"",IF(HLOOKUP(RC[-4],Sheet1!R2C9:R26C15,RC[-3]+1,FALSE)="","","|"&HLOOKUP(RC[-4],Sheet1!R2C9:R26C15,RC[-3]+1,FALSE))) -> 33400|33300 | F121: =IF(HLOOKUP(RC[-5],Sheet1!R2C9:R26C15,RC[-4]+1,FALSE)="",ROUND(HLOOKUP(RC[-5],Sheet1!R2C1:R26C7,RC[-4]+13,FALSE)+HLOOKUP(RC[-5],Sheet1!R2C9:R26C15,RC[-4]+13,FALSE)*RC[1],0),ROUND(HLOOKUP(RC[-5],Sheet1!R2C1:R26C7,RC[-4]+13,FALSE),0)&IF(RC[1]=0,"","|"&ROUND(HLOOKUP(RC[-5],Sheet1!R2C9:R26C15,RC[-4]+13,FALSE)*RC[1],0))) -> 19|12 | G121: 6 | H121: 0
A122: 1 | B122: 11 | C122: 50 | D122: 0 | E122: =HLOOKUP(RC[-4],Sheet1!R2C1:R26C7,RC[-3]+1,FALSE)&IF(RC[2]=0,"",IF(HLOOKUP(RC[-4],Sheet1!R2C9:R26C15,RC[-3]+1,FALSE)="","","|"&HLOOKUP(RC[-4],Sheet1!R2C9:R26C15,RC[-3]+1,FALSE))) -> 33400|33300 | F122: =IF(HLOOKUP(RC[-5],Sheet1!R2C9:R26C15,RC[-4]+1,FALSE)="",ROUND(HLOOKUP(RC[-5],Sheet1!R2C1:R26C7,RC[-4]+13,FALSE)+HLOOKUP(RC[-5],Sheet1!R2C9:R26C15,RC[-4]+13,FALSE)*RC[1],0),ROUND(HLOOKUP(RC[-5],Sheet1!R2C1:R26C7,RC[-4]+13,FALSE),0)&IF(RC[1]=0,"","|"&ROUND(HLOOKUP(RC[-5],Sheet1!R2C9:R26C15,RC[-4]+13,FALSE)*RC[1],0))) -> 19|10 | G122: 5 | H122: 0
A123: 1 | B123: 11 | C123: 40 | D123: 0 | E123: =HLOOKUP(RC[-4],Sheet1!R2C1:R26C7,RC[-3]+1,FALSE)&IF(RC[2]=0,"",IF(HLOOKUP(RC[-4],Sheet1!R2C9:R26C15,RC[-3]+1,FALSE)="","","|"&HLOOKUP(RC[-4],Sheet1!R2C9:R26C15,RC[-3]+1,FALSE))) -> 33400|33300 | F123: =IF(HLOOKUP(RC[-5],Sheet1!R2C9:R26C15,RC[-4]+1,FALSE)="",ROUND(HLOOKUP(RC[-5],Sheet1!R2C1:R26C7,RC[-4]+13,FALSE)+HLOOKUP(RC[-5],Sheet1!R2C9:R26C15,RC[-4]+13,FALSE)*RC[1],0),ROUND(HLOOKUP(RC[-5],Sheet1!R2C1:R26C7,RC[-4]+13,FALSE),0)&IF(RC[1]=0,"","|"&ROUND(HLOOKUP(RC[-5],Sheet1!R2C9:R26C15,RC[-4]+13,FALSE)*RC[1],0))) -> 19|8 | G123: 4 | H123: 0
A124: 1 | B124: 11 | C124: 30 | D124: 0 | E124: =HLOOKUP(RC[-4],Sheet1!R2C1:R26C7,RC[-3]+1,FALSE)&IF(RC[2]=0,"",IF(HLOOKUP(RC[-4],Sheet1!R2C9:R26C15,RC[-3]+1,FALSE)="","","|"&HLOOKUP(RC[-4],Sheet1!R2C9:R26C15,RC[-3]+1,FALSE))) -> 33400|33300 | F124: =IF(HLOOKUP(RC[-5],Sheet1!R2C9:R26C15,RC[-4]+1,FALSE)="",ROUND(HLOOKUP(RC[-5],Sheet1!R2C1:R26C7,RC[-4]+13,FALSE)+HLOOKUP(RC[-5],Sheet1!R2C9:R26C15,RC[-4]+13,FALSE)*RC[1],0),ROUND(HLOOKUP(RC[-5],Sheet1!R2C1:R26C7,RC[-4]+13,FALSE),0)&IF(RC[1]=0,"","|"&ROUND(HLOOKUP(RC[-5],Sheet1!R2C9:R26C15,RC[-4]+13,FALSE)*RC[1],0))) -> 19|6 | G124: 3 | H124: 0
A125: 1 | B125: 11 | C125: 20 | D125: 0 | E125: =HLOOKUP(RC[-4],Sheet1!R2C1:R26C7,RC[-3]+1,FALSE)&IF(RC[2]=0,"",IF(HLOOKUP(RC[-4],Sheet1!R2C9:R26C15,RC[-3]+1,FALSE)="","","|"&HLOOKUP(RC[-4],Sheet1!R2C9:R26C15,RC[-3]+1,FALSE))) -> 33400|33300 | F125: =IF(HLOOKUP(RC[-5],Sheet1!R2C9:R26C15,RC[-4]+1,FALSE)="",ROUND(HLOOKUP(RC[-5],Sheet1!R2C1:R26C7,RC[-4]+13,FALSE)+HLOOKUP(RC[-5],Sheet1!R2C9:R26C15,RC[-4]+13,FALSE)*RC[1],0),ROUND(HLOOKUP(RC[-5],Sheet1!R2C1:R26C7,RC[-4]+13,FALSE),0)&IF(RC[1]=0,"","|"&ROUND(HLOOKUP(RC[-5],Sheet1!R2C9:R26C15,RC[-4]+13,FALSE)*RC[1],0))) -> 19|4 | G125: 2 | H125: 0
A126: 1 | B126: 11 | C126: 10 | D126: 0 | E126: =HLOOKUP(RC[-4],Sheet1!R2C1:R26C7,RC[-3]+1,FALSE)&IF(RC[2]=0,"",IF(HLOOKUP(RC[-4],Sheet1!R2C9:R26C15,RC[-3]+1,FALSE)="","","|"&HLOOKUP(RC[-4],Sheet1!R2C9:R26C15,RC[-3]+1,FALSE))) -> 33400|33300 | F126: =IF(HLOOKUP(RC[-5],Sheet1!R2C9:R26C15,RC[-4]+1,FALSE)="",ROUND(HLOOKUP(RC[-5],Sheet1!R2C1:R26C7,RC[-4]+13,FALSE)+HLOOKUP(RC[-5],Sheet1!R2C9:R26C15,RC[-4]+13,FALSE)*RC[1],0),ROUND(HLOOKUP(RC[-5],Sheet1!R2C1:R26C7,RC[-4]+13,FALSE),0)&IF(RC[1]=0,"","|"&ROUND(HLOOKUP(RC[-5],Sheet1!R2C9:R26C15,RC[-4]+13,FALSE)*RC[1],0))) -> 19|2 | G126: 1 | H126: 0
A127: 1 | B127: 11 | C127: 0 | D127: 0 | E127: =HLOOKUP(RC[-4],Sheet1!R2C1:R26C7,RC[-3]+1,FALSE)&IF(RC[2]=0,"",IF(HLOOKUP(RC[-4],Sheet1!R2C9:R26C15,RC[-3]+1,FALSE)="","","|"&HLOOKUP(RC[-4],Sheet1!R2C9:R26C15,RC[-3]+1,FALSE))) -> 33400 | F127: =IF(HLOOKUP(RC[-5],Sheet1!R2C9:R26C15,RC[-4]+1,FALSE)="",ROUND(HLOOKUP(RC[-5],Sheet1!R2C1:R26C7,RC[-4]+13,FALSE)+HLOOKUP(RC[-5],Sheet1!R2C9:R26C15,RC[-4]+13,FALSE)*RC[1],0),ROUND(HLOOKUP(RC[-5],Sheet1!R2C1:R26C7,RC[-4]+13,FALSE),0)&IF(RC[1]=0,"","|"&ROUND(HLOOKUP(RC[-5],Sheet1!R2C9:R26C15,RC[-4]+13,FALSE)*RC[1],0))) -> 19 | G127: 0 | H127: 0
A128: 1 | B128: 12 | C128: 100 | D128: 1 | E128: =HLOOKUP(RC[-4],Sheet1!R2C1:R26C7,RC[-3]+1,FALSE)&IF(RC[2]=0,"",IF(HLOOKUP(RC[-4],Sheet1!R2C9:R26C15,RC[-3]+1,FALSE)="","","|"&HLOOKUP(RC[-4],Sheet1!R2C9:R26C15,RC[-3]+1,FALSE))) -> 33400|33300 | F128: =IF(HLOOKUP(RC[-5],Sheet1!R2C9:R26C15,RC[-4]+1,FALSE)="",ROUND(HLOOKUP(RC[-5],Sheet1!R2C1:R26C7,RC[-4]+13,FALSE)+HLOOKUP(RC[-5],Sheet1!R2C9:R26C15,RC[-4]+13,FALSE)*RC[1],0),ROUND(HLOOKUP(RC[-5],Sheet1!R2C1:R26C7,RC[-4]+13,FALSE),0)&IF(RC[1]=0,"","|"&ROUND(HLOOKUP(RC[-5],Sheet1!R2C9:R26C15,RC[-4]+13,FALSE)*RC[1],0))) -> 23|20 | G128: 10 | H128: 1
A129: 1 | B129: 12 | C129: 90 | D129: 0 | E129: =HLOOKUP(RC[-4],Sheet1!R2C1:R26C7,RC[-3]+1,FALSE)&IF(RC[2]=0,"",IF(HLOOKUP(RC[-4],Sheet1!R2C9:R26C15,RC[-3]+1,FALSE)="","","|"&HLOOKUP(RC[-4],Sheet1!R2C9:R26C15,RC[-3]+1,FALSE))) -> 33400|33300 | F129: =IF(HLOOKUP(RC[-5],Sheet1!R2C9:R26C15,RC[-4]+1,FALSE)="",ROUND(HLOOKUP(RC[-5],Sheet1!R2C1:R26C7,RC[-4]+13,FALSE)+HLOOKUP(RC[-5],Sheet1!R2C9:R26C15,RC[-4]+13,FALSE)*RC[1],0),ROUND(HLOOKUP(RC[-5],Sheet1!R2C1:R26C7,RC[-4]+13,FALSE),0)&IF(RC[1]=0,"","|"&ROUND(HLOOKUP(RC[-5],Sheet1!R2C9:R26C15,RC[-4]+13,FALSE)*RC[1],0))) -> 23|18 | G129: 9 | H129: 0
A130: 1 | B130: 12 | C130: 80 | D130: 0 | E130: =HLOOKUP(RC[-4],Sheet1!R2C1:R26C7,RC[-3]+1,FALSE)&IF(RC[2]=0,"",IF(HLOOKUP(RC[-4],Sheet1!R2C9:R26C15,RC[-3]+1,FALSE)="","","|"&HLOOKUP(RC[-4],Sheet1!R2C9:R26C15,RC[-3]+1,FALSE))) -> 33400|33300 | F130: =IF(HLOOKUP(RC[-5],Sheet1!R2C9:R26C15,RC[-4]+1,FALSE)="",ROUND(HLOOKUP(RC[-5],Sheet1!R2C1:R26C7,RC[-4]+13,FALSE)+HLOOKUP(RC[-5],Sheet1!R2C9:R26C15,RC[-4]+13,FALSE)*RC[1],0),ROUND(HLOOKUP(RC[-5],Sheet1!R2C1:R26C7,RC[-4]+13,FALSE),0)&IF(RC[1]=0,"","|"&ROUND(HLOOKUP(RC[-5],Sheet1!R2C9:R26C15,RC[-4]+13,FALSE)*RC[1],0))) -> 23|16 | G130: 8 | H130: 0
A131: 1 | B131: 12 | C131: 70 | D131: 0 | E131: =HLOOKUP(RC[-4],Sheet1!R2C1:R26C7,RC[-3]+1,FALSE)&IF(RC[2]=0,"",IF(HLOOKUP(RC[-4],Sheet1!R2C9:R26C15,RC[-3]+1,FALSE)="","","|"&HLOOKUP(RC[-4],Sheet1!R2C9:R26C15,RC[-3]+1,FALSE))) -> 33400|33300 | F131: =IF(HLOOKUP(RC[-5],Sheet1!R2C9:R26C15,RC[-4]+1,FALSE)="",ROUND(HLOOKUP(RC[-5],Sheet1!R2C1:R26C7,RC[-4]+13,FALSE)+HLOOKUP(RC[-5],Sheet1!R2C9:R26C15,RC[-4]+13,FALSE)*RC[1],0),ROUND(HLOOKUP(RC[-5],Sheet1!R2C1:R26C7,RC[-4]+13,FALSE),0)&IF(RC[1]=0,"","|"&ROUND(HLOOKUP(RC[-5],Sheet1!R2C9:R26C15,RC[-4]+13,FALSE)*RC[1],0))) -> 23|14 | G131: 7 | H131: 0
A132: 1 | B132: 12 | C132: 60 | D132: 0 | E132: =HLOOKUP(RC[-4],Sheet1!R2C1:R26C7,RC[-3]+1,FALSE)&IF(RC[2]=0,"",IF(HLOOKUP(RC[-4],Sheet1!R2C9:R26C15,RC[-3]+1,FALSE)="","","|"&HLOOKUP(RC[-4],Sheet1!R2C9:R26C15,RC[-3]+1,FALSE))) -> 33400|33300 | F132: =IF(HLOOKUP(RC[-5],Sheet1!R2C9:R26C15,RC[-4]+1,FALSE)="",ROUND(HLOOKUP(RC[-5],Sheet1!R2C1:R26C7,RC[-4]+13,FALSE)+HLOOKUP(RC[-5],Sheet1!R2C9:R26C15,RC[-4]+13,FALSE)*RC[1],0),ROUND(HLOOKUP(RC[-5],Sheet1!R2C1:R26C7,RC[-4]+13,FALSE),0)&IF(RC[1]=0,"","|"&ROUND(HLOOKUP(RC[-5],Sheet1!R2C9:R26C15,RC[-4]+13,FALSE)*RC[1],0))) -> 23|12 | G132: 6 | H132: 0
A133: 1 | B133: 12 | C133: 50 | D133: 0 | E133: =HLOOKUP(RC[-4],Sheet1!R2C1:R26C7,RC[-3]+1,FALSE)&IF(RC[2]=0,"",IF(HLOOKUP(RC[-4],Sheet1!R2C9:R26C15,RC[-3]+1,FALSE)="","","|"&HLOOKUP(RC[-4],Sheet1!R2C9:R26C15,RC[-3]+1,FALSE))) -> 33400|33300 | F133: =IF(HLOOKUP(RC[-5],Sheet1!R2C9:R26C15,RC[-4]+1,FALSE)="",ROUND(HLOOKUP(RC[-5],Sheet1!R2C1:R26C7,RC[-4]+13,FALSE)+HLOOKUP(RC[-5],Sheet1!R2C9:R26C15,RC[-4]+13,FALSE)*RC[1],0),ROUND(HLOOKUP(RC[-5],Sheet1!R2C1:R26C7,RC[-4]+13,FALSE),0)&IF(RC[1]=0,"","|"&ROUND(HLOOKUP(RC[-5],Sheet1!R2C9:R26C15,RC[-4]+13,FALSE)*RC[1],0))) -> 23|10 | G133: 5 | H133: 0
A134: 1 | B134: 12 | C134: 40 | D134: 0 | E134: =HLOOKUP(RC[-4],Sheet1!R2C1:R26C7,RC[-3]+1,FALSE)&IF(RC[2]=0,"",IF(HLOOKUP(RC[-4],Sheet1!R2C9:R26C15,RC[-3]+1,FALSE)="","","|"&HLOOKUP(RC[-4],Sheet1!R2C9:R26C15,RC[-3]+1,FALSE))) -> 33400|33300 | F134: =IF(HLOOKUP(RC[-5],Sheet1!R2C9:R26C15,RC[-4]+1,FALSE)="",ROUND(HLOOKUP(RC[-5],Sheet1!R2C1:R26C7,RC[-4]+13,FALSE)+HLOOKUP(RC[-5],Sheet1!R2C9:R26C15,RC[-4]+13,FALSE)*RC[1],0),ROUND(HLOOKUP(RC[-5],Sheet1!R2C1:R26C7,RC[-4]+13,FALSE),0)&IF(RC[1]=0,"","|"&ROUND(HLOOKUP(RC[-5],Sheet1!R2C9:R26C15,RC[-4]+13,FALSE)*RC[1],0))) -> 23|8 | G134: 4 | H134: 0
A135: 1 | B135: 12 | C135: 30 | D135: 0 | E135: =HLOOKUP(RC[-4],Sheet1!R2C1:R26C7,RC[-3]+1,FALSE)&IF(RC[2]=0,"",IF(HLOOKUP(RC[-4],Sheet1!R2C9:R26C15,RC[-3]+1,FALSE)="","","|"&HLOOKUP(RC[-4],Sheet1!R2C9:R26C15,RC[-3]+1,FALSE))) -> 33400|33300 | F135: =IF(HLOOKUP(RC[-5],Sheet1!R2C9:R26C15,RC[-4]+1,FALSE)="",ROUND(HLOOKUP(RC[-5],Sheet1!R2C1:R26C7,RC[-4]+13,FALSE)+HLOOKUP(RC[-5],Sheet1!R2C9:R26C15,RC[-4]+13,FALSE)*RC[1],0),ROUND(HLOOKUP(RC[-5],Sheet1!R2C1:R26C7,RC[-4]+13,FALSE),0)&IF(RC[1]=0,"","|"&ROUND(HLOOKUP(RC[-5],Sheet1!R2C9:R26C15,RC[-4]+13,FALSE)*RC[1],0))) -> 23|6 | G135: 3 | H135: 0
A136: 1 | B136: 12 | C136: 20 | D136: 0 | E136: =HLOOKUP(RC[-4],Sheet1!R2C1:R26C7,RC[-3]+1,FALSE)&IF(RC[2]=0,"",IF(HLOOKUP(RC[-4],Sheet1!R2C9:R26C15,RC[-3]+1,FALSE)="","","|"&HLOOKUP(RC[-4],Sheet1!R2C9:R26C15,RC[-3]+1,FALSE))) -> 33400|33300 | F136: =IF(HLOOKUP(RC[-5],Sheet1!R2C9:R26C15,RC[-4]+1,FALSE)="",ROUND(HLOOKUP(RC[-5],Sheet1!R2C1:R26C7,RC[-4]+13,FALSE)+HLOOKUP(RC[-5],Sheet1!R2C9:R26C15,RC[-4]+13,FALSE)*RC[1],0),ROUND(HLOOKUP(RC[-5],Sheet1!R2C1:R26C7,RC[-4]+13,FALSE),0)&IF(RC[1]=0,"","|"&ROUND(HLOOKUP(RC[-5],Sheet1!R2C9:R26C15,RC[-4]+13,FALSE)*RC[1],0))) -> 23|4 | G136: 2 | H136: 0
A137: 1 | B137: 12 | C137: 10 | D137: 0 | E137: =HLOOKUP(RC[-4],Sheet1!R2C1:R26C7,RC[-3]+1,FALSE)&IF(RC[2]=0,"",IF(HLOOKUP(RC[-4],Sheet1!R2C9:R26C15,RC[-3]+1,FALSE)="","","|"&HLOOKUP(RC[-4],Sheet1!R2C9:R26C15,RC[-3]+1,FALSE))) -> 33400|33300 | F137: =IF(HLOOKUP(RC[-5],Sheet1!R2C9:R26C15,RC[-4]+1,FALSE)="",ROUND(HLOOKUP(RC[-5],Sheet1!R2C1:R26C7,RC[-4]+13,FALSE)+HLOOKUP(RC[-5],Sheet1!R2C9:R26C15,RC[-4]+13,FALSE)*RC[1],0),ROUND(HLOOKUP(RC[-5],Sheet1!R2C1:R26C7,RC[-4]+13,FALSE),0)&IF(RC[1]=0,"","|"&ROUND(HLOOKUP(RC[-5],Sheet1!R2C9:R26C15,RC[-4]+13,FALSE)*RC[1],0))) -> 23|2 | G137: 1 | H137: 0
A138: 1 | B138: 12 | C138: 0 | D138: 0 | E138: =HLOOKUP(RC[-4],Sheet1!R2C1:R26C7,RC[-3]+1,FALSE)&IF(RC[2]=0,"",IF(HLOOKUP(RC[-4],Sheet1!R2C9:R26C15,RC[-3]+1,FALSE)="","","|"&HLOOKUP(RC[-4],Sheet1!R2C9:R26C15,RC[-3]+1,FALSE))) -> 33400 | F138: =IF(HLOOKUP(RC[-5],Sheet1!R2C9:R26C15,RC[-4]+1,FALSE)="",ROUND(HLOOKUP(RC[-5],Sheet1!R2C1:R26C7,RC[-4]+13,FALSE)+HLOOKUP(RC[-5],Sheet1!R2C9:R26C15,RC[-4]+13,FALSE)*RC[1],0),ROUND(HLOOKUP(RC[-5],Sheet1!R2C1:R26C7,RC[-4]+13,FALSE),0)&IF(RC[1]=0,"","|"&ROUND(HLOOKUP(RC[-5],Sheet1!R2C9:R26C15,RC[-4]+13,FALSE)*RC[1],0))) -> 23 | G138: 0 | H138: 0
A139: 2 | B139: 1 | C139: 100 | D139: 1 | E139: =HLOOKUP(RC[-4],Sheet1!R2C1:R26C7,RC[-3]+1,FALSE)&IF(RC[2]=0,"",IF(HLOOKUP(RC[-4],Sheet1!R2C9:R26C15,RC[-3]+1,FALSE)="","","|"&HLOOKUP(RC[-4],Sheet1!R2C9:R26C15,RC[-3]+1,FALSE))) -> 19003 | F139: =IF(HLOOKUP(RC[-5],Sheet1!R2C9:R26C15,RC[-4]+1,FALSE)="",ROUND(HLOOKUP(RC[-5],Sheet1!R2C1:R26C7,RC[-4]+13,FALSE)+HLOOKUP(RC[-5],Sheet1!R2C9:R26C15,RC[-4]+13,FALSE)*RC[1],0),ROUND(HLOOKUP(RC[-5],Sheet1!R2C1:R26C7,RC[-4]+13,FALSE),0)&IF(RC[1]=0,"","|"&ROUND(HLOOKUP(RC[-5],Sheet1!R2C9:R26C15,RC[-4]+13,FALSE)*RC[1],0))) -> 141000 | G139: 10 | H139: 1
A140: 2 | B140: 1 | C140: 90 | D140: 0 | E140: =HLOOKUP(RC[-4],Sheet1!R2C1:R26C7,RC[-3]+1,FALSE)&IF(RC[2]=0,"",IF(HLOOKUP(RC[-4],Sheet1!R2C9:R26C15,RC[-3]+1,FALSE)="","","|"&HLOOKUP(RC[-4],Sheet1!R2C9:R26C15,RC[-3]+1,FALSE))) -> 19003 | F140: =IF(HLOOKUP(RC[-5],Sheet1!R2C9:R26C15,RC[-4]+1,FALSE)="",ROUND(HLOOKUP(RC[-5],Sheet1!R2C1:R26C7,RC[-4]+13,FALSE)+HLOOKUP(RC[-5],Sheet1!R2C9:R26C15,RC[-4]+13,FALSE)*RC[1],0),ROUND(HLOOKUP(RC[-5],Sheet1!R2C1:R26C7,RC[-4]+13,FALSE),0)&IF(RC[1]=0,"","|"&ROUND(HLOOKUP(RC[-5],Sheet1!R2C9:R26C15,RC[-4]+13,FALSE)*RC[1],0))) -> 138650 | G140: 9 | H140: 0
A141: 2 | B141: 1 | C141: 80 | D141: 0 | E141: =HLOOKUP(RC[-4],Sheet1!R2C1:R26C7,RC[-3]+1,FALSE)&IF(RC[2]=0,"",IF(HLOOKUP(RC[-4],Sheet1!R2C9:R26C15,RC[-3]+1,FALSE)="","","|"&HLOOKUP(RC[-4],Sheet1!R2C9:R26C15,RC[-3]+1,FALSE))) -> 19003 | F141: =IF(HLOOKUP(RC[-5],Sheet1!R2C9:R26C15,RC[-4]+1,FALSE)="",ROUND(HLOOKUP(RC[-5],Sheet1!R2C1:R26C7,RC[-4]+13,FALSE)+HLOOKUP(RC[-5],Sheet1!R2C9:R26C15,RC[-4]+13,FALSE)*RC[1],0),ROUND(HLOOKUP(RC[-5],Sheet1!R2C1:R26C7,RC[-4]+13,FALSE),0)&IF(RC[1]=0,"","|"&ROUND(HLOOKUP(RC[-5],Sheet1!R2C9:R26C15,RC[-4]+13,FALSE)*RC[1],0))) -> 136300 | G141: 8 | H141: 0
A142: 2 | B142: 1 | C142: 70 | D142: 0 | E142: =HLOOKUP(RC[-4],Sheet1!R2C1:R26C7,RC[-3]+1,FALSE)&IF(RC[2]=0,"",IF(HLOOKUP(RC[-4],Sheet1!R2C9:R26C15,RC[-3]+1,FALSE)="","","|"&HLOOKUP(RC[-4],Sheet1!R2C9:R26C15,RC[-3]+1,FALSE))) -> 19003 | F142: =IF(HLOOKUP(RC[-5],Sheet1!R2C9:R26C15,RC[-4]+1,FALSE)="",ROUND(HLOOKUP(RC[-5],Sheet1!R2C1:R26C7,RC[-4]+13,FALSE)+HLOOKUP(RC[-5],Sheet1!R2C9:R26C15,RC[-4]+13,FALSE)*RC[1],0),ROUND(HLOOKUP(RC[-5],Sheet1!R2C1:R26C7,RC[-4]+13,FALSE),0)&IF(RC[1]=0,"","|"&ROUND(HLOOKUP(RC[-5],Sheet1!R2C9:R26C15,RC[-4]+13,FALSE)*RC[1],0))) -> 133950 | G142: 7 | H142: 0
A143: 2 | B143: 1 | C143: 60 | D143: 0 | E143: =HLOOKUP(RC[-4],Sheet1!R2C1:R26C7,RC[-3]+1,FALSE)&IF(RC[2]=0,"",IF(HLOOKUP(RC[-4],Sheet1!R2C9:R26C15,RC[-3]+1,FALSE)="","","|"&HLOOKUP(RC[-4],Sheet1!R2C9:R26C15,RC[-3]+1,FALSE))) -> 19003 | F143: =IF(HLOOKUP(RC[-5],Sheet1!R2C9:R26C15,RC[-4]+1,FALSE)="",ROUND(HLOOKUP(RC[-5],Sheet1!R2C1:R26C7,RC[-4]+13,FALSE)+HLOOKUP(RC[-5],Sheet1!R2C9:R26C15,RC[-4]+13,FALSE)*RC[1],0),ROUND(HLOOKUP(RC[-5],Sheet1!R2C1:R26C7,RC[-4]+13,FALSE),0)&IF(RC[1]=0,"","|"&ROUND(HLOOKUP(RC[-5],Sheet1!R2C9:R26C15,RC[-4]+13,FALSE)*RC[1],0))) -> 131600 | G143: 6 | H143: 0
A144: 2 | B144: 1 | C144: 50 | D144: 0 | E144: =HLOOKUP(RC[-4],Sheet1!R2C1:R26C7,RC[-3]+1,FALSE)&IF(RC[2]=0,"",IF(HLOOKUP(RC[-4],Sheet1!R2C9:R26C15,RC[-3]+1,FALSE)="","","|"&HLOOKUP(RC[-4],Sheet1!R2C9:R26C15,RC[-3]+1,FALSE))) -> 19003 | F144: =IF(HLOOKUP(RC[-5],Sheet1!R2C9:R26C15,RC[-4]+1,FALSE)="",ROUND(HLOOKUP(RC[-5],Sheet1!R2C1:R26C7,RC[-4]+13,FALSE)+HLOOKUP(RC[-5],Sheet1!R2C9:R26C15,RC[-4]+13,FALSE)*RC[1],0),ROUND(HLOOKUP(RC[-5],Sheet1!R2C1:R26C7,RC[-4]+13,FALSE),0)&IF(RC[1]=0,"","|"&ROUND(HLOOKUP(RC[-5],Sheet1!R2C9:R26C15,RC[-4]+13,FALSE)*RC[1],0))) -> 129250 | G144: 5 | H144: 0
A145: 2 | B145: 1 | C145: 40 | D145: 0 | E145: =HLOOKUP(RC[-4],Sheet1!R2C1:R26C7,RC[-3]+1,FALSE)&IF(RC[2]=0,"",IF(HLOOKUP(RC[-4],Sheet1!R2C9:R26C15,RC[-3]+1,FALSE)="","","|"&HLOOKUP(RC[-4],Sheet1!R2C9:R26C15,RC[-3]+1,FALSE))) -> 19003 | F145: =IF(HLOOKUP(RC[-5],Sheet1!R2C9:R26C15,RC[-4]+1,FALSE)="",ROUND(HLOOKUP(RC[-5],Sheet1!R2C1:R26C7,RC[-4]+13,FALSE)+HLOOKUP(RC[-5],Sheet1!R2C9:R26C15,RC[-4]+13,FALSE)*RC[1],0),ROUND(HLOOKUP(RC[-5],Sheet1!R2C1:R26C7,RC[-4]+13,FALSE),0)&IF(RC[1]=0,"","|"&ROUND(HLOOKUP(RC[-5],Sheet1!R2C9:R26C15,RC[-4]+13,FALSE)*RC[1],0))) -> 126900 | G145: 4 | H145: 0
A146: 2 | B146: 1 | C146: 30 | D146: 0 | E146: =HLOOKUP(RC[-4],Sheet1!R2C1:R26C7,RC[-3]+1,FALSE)&IF(RC[2]=0,"",IF(HLOOKUP(RC[-4],Sheet1!R2C9:R26C15,RC[-3]+1,FALSE)="","","|"&HLOOKUP(RC[-4],Sheet1!R2C9:R26C15,RC[-3]+1,FALSE))) -> 19003 | F146: =IF(HLOOKUP(RC[-5],Sheet1!R2C9:R26C15,RC[-4]+1,FALSE)="",ROUND(HLOOKUP(RC[-5],Sheet1!R2C1:R26C7,RC[-4]+13,FALSE)+HLOOKUP(RC[-5],Sheet1!R2C9:R26C15,RC[-4]+13,FALSE)*RC[1],0),ROUND(HLOOKUP(RC[-5],Sheet1!R2C1:R26C7,RC[-4]+13,FALSE),0)&IF(RC[1]=0,"","|"&ROUND(HLOOKUP(RC[-5],Sheet1!R2C9:R26C15,RC[-4]+13,FALSE)*RC[1],0))) -> 124550 | G146: 3 | H146: 0
A147: 2 | B147: 1 | C147: 20 | D147: 0 | E147: =HLOOKUP(RC[-4],Sheet1!R2C1:R26C7,RC[-3]+1,FALSE)&IF(RC[2]=0,"",IF(HLOOKUP(RC[-4],Sheet1!R2C9:R26C15,RC[-3]+1,FALSE)="","","|"&HLOOKUP(RC[-4],Sheet1!R2C9:R26C15,RC[-3]+1,FALSE))) -> 19003 | F147: =IF(HLOOKUP(RC[-5],Sheet1!R2C9:R26C15,RC[-4]+1,FALSE)="",ROUND(HLOOKUP(RC[-5],Sheet1!R2C1:R26C7,RC[-4]+13,FALSE)+HLOOKUP(RC[-5],Sheet1!R2C9:R26C15,RC[-4]+13,FALSE)*RC[1],0),ROUND(HLOOKUP(RC[-5],Sheet1!R2C1:R26C7,RC[-4]+13,FALSE),0)&IF(RC[1]=0,"","|"&ROUND(HLOOKUP(RC[-5],Sheet1!R2C9:R26C15,RC[-4]+13,FALSE)*RC[1],0))) -> 122200 | G147: 2 | H147: 0
A148: 2 | B148: 1 | C148: 10 | D148: 0 | E148: =HLOOKUP(RC[-4],Sheet1!R2C1:R26C7,RC[-3]+1,FALSE)&IF(RC[2]=0,"",IF(HLOOKUP(RC[-4],Sheet1!R2C9:R26C15,RC[-3]+1,FALSE)="","","|"&HLOOKUP(RC[-4],Sheet1!R2C9:R26C15,RC[-3]+1,FALSE))) -> 19003 | F148: =IF(HLOOKUP(RC[-5],Sheet1!R2C9:R26C15,RC[-4]+1,FALSE)="",ROUND(HLOOKUP(RC[-5],Sheet1!R2C1:R26C7,RC[-4]+13,FALSE)+HLOOKUP(RC[-5],Sheet1!R2C9:R26C15,RC[-4]+13,FALSE)*RC[1],0),ROUND(HLOOKUP(RC[-5],Sheet1!R2C1:R26C7,RC[-4]+13,FALSE),0)&IF(RC[1]=0,"","|"&ROUND(HLOOKUP(RC[-5],Sheet1!R2C9:R26C15,RC[-4]+13,FALSE)*RC[1],0))) -> 119850 | G148: 1 | H148: 0
A149: 2 | B149: 1 | C149: 0 | D149: 0 | E149: =HLOOKUP(RC[-4],Sheet1!R2C1:R26C7,RC[-3]+1,FALSE)&IF(RC[2]=0,"",IF(HLOOKUP(RC[-4],Sheet1!R2C9:R26C15,RC[-3]+1,FALSE)="","","|"&HLOOKUP(RC[-4],Sheet1!R2C9:R26C15,RC[-3]+1,FALSE))) -> 19003 | F149: =IF(HLOOKUP(RC[-5],Sheet1!R2C9:R26C15,RC[-4]+1,FALSE)="",ROUND(HLOOKUP(RC[-5],Sheet1!R2C1:R26C7,RC[-4]+13,FALSE)+HLOOKUP(RC[-5],Sheet1!R2C9:R26C15,RC[-4]+13,FALSE)*RC[1],0),ROUND(HLOOKUP(RC[-5],Sheet1!R2C1:R26C7,RC[-4]+13,FALSE),0)&IF(RC[1]=0,"","|"&ROUND(HLOOKUP(RC[-5],Sheet1!R2C9:R26C15,RC[-4]+13,FALSE)*RC[1],0))) -> 117500 | G149: 0 | H149: 0
A150: 2 | B150: 2 | C150: 100 | D150: 1 | E150: =HLOOKUP(RC[-4],Sheet1!R2C1:R26C7,RC[-3]+1,FALSE)&IF(RC[2]=0,"",IF(HLOOKUP(RC[-4],Sheet1!R2C9:R26C15,RC[-3]+1,FALSE)="","","|"&HLOOKUP(RC[-4],Sheet1!R2C9:R26C15,RC[-3]+1,FALSE))) -> 19003 | F150: =IF(HLOOKUP(RC[-5],Sheet1!R2C9:R26C15,RC[-4]+1,FALSE)="",ROUND(HLOOKUP(RC[-5],Sheet1!R2C1:R26C7,RC[-4]+13,FALSE)+HLOOKUP(RC[-5],Sheet1!R2C9:R26C15,RC[-4]+13,FALSE)*RC[1],0),ROUND(HLOOKUP(RC[-5],Sheet1!R2C1:R26C7,RC[-4]+13,FALSE),0)&IF(RC[1]=0,"","|"&ROUND(HLOOKUP(RC[-5],Sheet1!R2C9:R26C15,RC[-4]+13,FALSE)*RC[1],0))) -> 238500 | G150: 10 | H150: 1
A151: 2 | B151: 2 | C151: 90 | D151: 0 | E151: =HLOOKUP(RC[-4],Sheet1!R2C1:R26C7,RC[-3]+1,FALSE)&IF(RC[2]=0,"",IF(HLOOKUP(RC[-4],Sheet1!R2C9:R26C15,RC[-3]+1,FALSE)="","","|"&HLOOKUP(RC[-4],Sheet1!R2C9:R26C15,RC[-3]+1,FALSE))) -> 19003 | F151: =IF(HLOOKUP(RC[-5],Sheet1!R2C9:R26C15,RC[-4]+1,FALSE)="",ROUND(HLOOKUP(RC[-5],Sheet1!R2C1:R26C7,RC[-4]+13,FALSE)+HLOOKUP(RC[-5],Sheet1!R2C9:R26C15,RC[-4]+13,FALSE)*RC[1],0),ROUND(HLOOKUP(RC[-5],Sheet1!R2C1:R26C7,RC[-4]+13,FALSE),0)&IF(RC[1]=0,"","|"&ROUND(HLOOKUP(RC[-5],Sheet1!R2C9:R26C15,RC[-4]+13,FALSE)*RC[1],0))) -> 234525 | G151: 9 | H151: 0
A152: 2 | B152: 2 | C152: 80 | D152: 0 | E152: =HLOOKUP(RC[-4],Sheet1!R2C1:R26C7,RC[-3]+1,FALSE)&IF(RC[2]=0,"",IF(HLOOKUP(RC[-4],Sheet1!R2C9:R26C15,RC[-3]+1,FALSE)="","","|"&HLOOKUP(RC[-4],Sheet1!R2C9:R26C15,RC[-3]+1,FALSE))) -> 19003 | F152: =IF(HLOOKUP(RC[-5],Sheet1!R2C9:R26C15,RC[-4]+1,FALSE)="",ROUND(HLOOKUP(RC[-5],Sheet1!R2C1:R26C7,RC[-4]+13,FALSE)+HLOOKUP(RC[-5],Sheet1!R2C9:R26C15,RC[-4]+13,FALSE)*RC[1],0),ROUND(HLOOKUP(RC[-5],Sheet1!R2C1:R26C7,RC[-4]+13,FALSE),0)&IF(RC[1]=0,"","|"&ROUND(HLOOKUP(RC[-5],Sheet1!R2C9:R26C15,RC[-4]+13,FALSE)*RC[1],0))) -> 230550 | G152: 8 | H152: 0
A153: 2 | B153: 2 | C153: 70 | D153: 0 | E153: =HLOOKUP(RC[-4],Sheet1!R2C1:R26C7,RC[-3]+1,FALSE)&IF(RC[2]=0,"",IF(HLOOKUP(RC[-4],Sheet1!R2C9:R26C15,RC[-3]+1,FALSE)="","","|"&HLOOKUP(RC[-4],Sheet1!R2C9:R26C15,RC[-3]+1,FALSE))) -> 19003 | F153: =IF(HLOOKUP(RC[-5],Sheet1!R2C9:R26C15,RC[-4]+1,FALSE)="",ROUND(HLOOKUP(RC[-5],Sheet1!R2C1:R26C7,RC[-4]+13,FALSE)+HLOOKUP(RC[-5],Sheet1!R2C9:R26C15,RC[-4]+13,FALSE)*RC[1],0),ROUND(HLOOKUP(RC[-5],Sheet1!R2C1:R26C7,RC[-4]+13,FALSE),0)&IF(RC[1]=0,"","|"&ROUND(HLOOKUP(RC[-5],Sheet1!R2C9:R26C15,RC[-4]+13,FALSE)*RC[1],0))) -> 226575 | G153: 7 | H153: 0
A154: 2 | B154: 2 | C154: 60 | D154: 0 | E154: =HLOOKUP(RC[-4],Sheet1!R2C1:R26C7,RC[-3]+1,FALSE)&IF(RC[2]=0,"",IF(HLOOKUP(RC[-4],Sheet1!R2C9:R26C15,RC[-3]+1,FALSE)="","","|"&HLOOKUP(RC[-4],Sheet1!R2C9:R26C15,RC[-3]+1,FALSE))) -> 19003 | F154: =IF(HLOOKUP(RC[-5],Sheet1!R2C9:R26C15,RC[-4]+1,FALSE)="",ROUND(HLOOKUP(RC[-5],Sheet1!R2C1:R26C7,RC[-4]+13,FALSE)+HLOOKUP(RC[-5],Sheet1!R2C9:R26C15,RC[-4]+13,FALSE)*RC[1],0),ROUND(HLOOKUP(RC[-5],Sheet1!R2C1:R26C7,RC[-4]+13,FALSE),0)&IF(RC[1]=0,"","|"&ROUND(HLOOKUP(RC[-5],Sheet1!R2C9:R26C15,RC[-4]+13,FALSE)*RC[1],0))) -> 222600 | G154: 6 | H154: 0
A155: 2 | B155: 2 | C155: 50 | D155: 0 | E155: =HLOOKUP(RC[-4],Sheet1!R2C1:R26C7,RC[-3]+1,FALSE)&IF(RC[2]=0,"",IF(HLOOKUP(RC[-4],Sheet1!R2C9:R26C15,RC[-3]+1,FALSE)="","","|"&HLOOKUP(RC[-4],Sheet1!R2C9:R26C15,RC[-3]+1,FALSE))) -> 19003 | F155: =IF(HLOOKUP(RC[-5],Sheet1!R2C9:R26C15,RC[-4]+1,FALSE)="",ROUND(HLOOKUP(RC[-5],Sheet1!R2C1:R26C7,RC[-4]+13,FALSE)+HLOOKUP(RC[-5],Sheet1!R2C9:R26C15,RC[-4]+13,FALSE)*RC[1],0),ROUND(HLOOKUP(RC[-5],Sheet1!R2C1:R26C7,RC[-4]+13,FALSE),0)&IF(RC[1]=0,"","|"&ROUND(HLOOKUP(RC[-5],Sheet1!R2C9:R26C15,RC[-4]+13,FALSE)*RC[1],0))) -> 218625 | G155: 5 | H155: 0
A156: 2 | B156: 2 | C156: 40 | D156: 0 | E156: =HLOOKUP(RC[-4],Sheet1!R2C1:R26C7,RC[-3]+1,FALSE)&IF(RC[2]=0,"",IF(HLOOKUP(RC[-4],Sheet1!R2C9:R26C15,RC[-3]+1,FALSE)="","","|"&HLOOKUP(RC[-4],Sheet1!R2C9:R26C15,RC[-3]+1,FALSE))) -> 19003 | F156: =IF(HLOOKUP(RC[-5],Sheet1!R2C9:R26C15,RC[-4]+1,FALSE)="",ROUND(HLOOKUP(RC[-5],Sheet1!R2C1:R26C7,RC[-4]+13,FALSE)+HLOOKUP(RC[-5],Sheet1!R2C9:R26C15,RC[-4]+13,FALSE)*RC[1],0),ROUND(HLOOKUP(RC[-5],Sheet1!R2C1:R26C7,RC[-4]+13,FALSE),0)&IF(RC[1]=0,"","|"&ROUND(HLOOKUP(RC[-5],Sheet1!R2C9:R26C15,RC[-4]+13,FALSE)*RC[1],0))) -> 214650 | G156: 4 | H156: 0
A157: 2 | B157: 2 | C157: 30 | D157: 0 | E157: =HLOOKUP(RC[-4],Sheet1!R2C1:R26C7,RC[-3]+1,FALSE)&IF(RC[2]=0,"",IF(HLOOKUP(RC[-4],Sheet1!R2C9:R26C15,RC[-3]+1,FALSE)="","","|"&HLOOKUP(RC[-4],Sheet1!R2C9:R26C15,RC[-3]+1,FALSE))) -> 19003 | F157: =IF(HLOOKUP(RC[-5],Sheet1!R2C9:R26C15,RC[-4]+1,FALSE)="",ROUND(HLOOKUP(RC[-5],Sheet1!R2C1:R26C7,RC[-4]+13,FALSE)+HLOOKUP(RC[-5],Sheet1!R2C9:R26C15,RC[-4]+13,FALSE)*RC[1],0),ROUND(HLOOKUP(RC[-5],Sheet1!R2C1:R26C7,RC[-4]+13,FALSE),0)&IF(RC[1]=0,"","|"&ROUND(HLOOKUP(RC[-5],Sheet1!R2C9:R26C15,RC[-4]+13,FALSE)*RC[1],0))) -> 210675 | G157: 3 | H157: 0
A158: 2 | B158: 2 | C158: 20 | D158: 0 | E158: =HLOOKUP(RC[-4],Sheet1!R2C1:R26C7,RC[-3]+1,FALSE)&IF(RC[2]=0,"",IF(HLOOKUP(RC[-4],Sheet1!R2C9:R26C15,RC[-3]+1,FALSE)="","","|"&HLOOKUP(RC[-4],Sheet1!R2C9:R26C15,RC[-3]+1,FALSE))) -> 19003 | F158: =IF(HLOOKUP(RC[-5],Sheet1!R2C9:R26C15,RC[-4]+1,FALSE)="",ROUND(HLOOKUP(RC[-5],Sheet1!R2C1:R26C7,RC[-4]+13,FALSE)+HLOOKUP(RC[-5],Sheet1!R2C9:R26C15,RC[-4]+13,FALSE)*RC[1],0),ROUND(HLOOKUP(RC[-5],Sheet1!R2C1:R26C7,RC[-4]+13,FALSE),0)&IF(RC[1]=0,"","|"&ROUND(HLOOKUP(RC[-5],Sheet1!R2C9:R26C15,RC[-4]+13,FALSE)*RC[1],0))) -> 206700 | G158: 2 | H158: 0
A159: 2 | B159: 2 | C159: 10 | D159: 0 | E159: =HLOOKUP(RC[-4],Sheet1!R2C1:R26C7,RC[-3]+1,FALSE)&IF(RC[2]=0,"",IF(HLOOKUP(RC[-4],Sheet1!R2C9:R26C15,RC[-3]+1,FALSE)="","","|"&HLOOKUP(RC[-4],Sheet1!R2C9:R26C15,RC[-3]+1,FALSE))) -> 19003 | F159: =IF(HLOOKUP(RC[-5],Sheet1!R2C9:R26C15,RC[-4]+1,FALSE)="",ROUND(HLOOKUP(RC[-5],Sheet1!R2C1:R26C7,RC[-4]+13,FALSE)+HLOOKUP(RC[-5],Sheet1!R2C9:R26C15,RC[-4]+13,FALSE)*RC[1],0),ROUND(HLOOKUP(RC[-5],Sheet1!R2C1:R26C7,RC[-4]+13,FALSE),0)&IF(RC[1]=0,"","|"&ROUND(HLOOKUP(RC[-5],Sheet1!R2C9:R26C15,RC[-4]+13,FALSE)*RC[1],0))) -> 202725 | G159: 1 | H159: 0
A160: 2 | B160: 2 | C160: 0 | D160: 0 | E160: =HLOOKUP(RC[-4],Sheet1!R2C1:R26C7,RC[-3]+1,FALSE)&IF(RC[2]=0,"",IF(HLOOKUP(RC[-4],Sheet1!R2C9:R26C15,RC[-3]+1,FALSE)="","","|"&HLOOKUP(RC[-4],Sheet1!R2C9:R26C15,RC[-3]+1,FALSE))) -> 19003 | F160: =IF(HLOOKUP(RC[-5],Sheet1!R2C9:R26C15,RC[-4]+1,FALSE)="",ROUND(HLOOKUP(RC[-5],Sheet1!R2C1:R26C7,RC[-4]+13,FALSE)+HLOOKUP(RC[-5],Sheet1!R2C9:R26C15,RC[-4]+13,FALSE)*RC[1],0),ROUND(HLOOKUP(RC[-5],Sheet1!R2C1:R26C7,RC[-4]+13,FALSE),0)&IF(RC[1]=0,"","|"&ROUND(HLOOKUP(RC[-5],Sheet1!R2C9:R26C15,RC[-4]+13,FALSE)*RC[1],0))) -> 198750 | G160: 0 | H160: 0
A161: 2 | B161: 3 | C161: 100 | D161: 1 | E161: =HLOOKUP(RC[-4],Sheet1!R2C1:R26C7,RC[-3]+1,FALSE)&IF(RC[2]=0,"",IF(HLOOKUP(RC[-4],Sheet1!R2C9:R26C15,RC[-3]+1,FALSE)="","","|"&HLOOKUP(RC[-4],Sheet1!R2C9:R26C15,RC[-3]+1,FALSE))) -> 19003 | F161: =IF(HLOOKUP(RC[-5],Sheet1!R2C9:R26C15,RC[-4]+1,FALSE)="",ROUND(HLOOKUP(RC[-5],Sheet1!R2C1:R26C7,RC[-4]+13,FALSE)+HLOOKUP(RC[-5],Sheet1!R2C9:R26C15,RC[-4]+13,FALSE)*RC[1],0),ROUND(HLOOKUP(RC[-5],Sheet1!R2C1:R26C7,RC[-4]+13,FALSE),0)&IF(RC[1]=0,"","|"&ROUND(HLOOKUP(RC[-5],Sheet1!R2C9:R26C15,RC[-4]+13,FALSE)*RC[1],0))) -> 354000 | G161: 10 | H161: 1
A162: 2 | B162: 3 | C162: 90 | D162: 0 | E162: =HLOOKUP(RC[-4],Sheet1!R2C1:R26C7,RC[-3]+1,FALSE)&IF(RC[2]=0,"",IF(HLOOKUP(RC[-4],Sheet1!R2C9:R26C15,RC[-3]+1,FALSE)="","","|"&HLOOKUP(RC[-4],Sheet1!R2C9:R26C15,RC[-3]+1,FALSE))) -> 19003 | F162: =IF(HLOOKUP(RC[-5],Sheet1!R2C9:R26C15,RC[-4]+1,FALSE)="",ROUND(HLOOKUP(RC[-5],Sheet1!R2C1:R26C7,RC[-4]+13,FALSE)+HLOOKUP(RC[-5],Sheet1!R2C9:R26C15,RC[-4]+13,FALSE)*RC[1],0),ROUND(HLOOKUP(RC[-5],Sheet1!R2C1:R26C7,RC[-4]+13,FALSE),0)&IF(RC[1]=0,"","|"&ROUND(HLOOKUP(RC[-5],Sheet1!R2C9:R26C15,RC[-4]+13,FALSE)*RC[1],0))) -> 348100 | G162: 9 | H162: 0
A163: 2 | B163: 3 | C163: 80 | D163: 0 | E163: =HLOOKUP(RC[-4],Sheet1!R2C1:R26C7,RC[-3]+1,FALSE)&IF(RC[2]=0,"",IF(HLOOKUP(RC[-4],Sheet1!R2C9:R26C15,RC[-3]+1,FALSE)="","","|"&HLOOKUP(RC[-4],Sheet1!R2C9:R26C15,RC[-3]+1,FALSE))) -> 19003 | F163: =IF(HLOOKUP(RC[-5],Sheet1!R2C9:R26C15,RC[-4]+1,FALSE)="",ROUND(HLOOKUP(RC[-5],Sheet1!R2C1:R26C7,RC[-4]+13,FALSE)+HLOOKUP(RC[-5],Sheet1!R2C9:R26C15,RC[-4]+13,FALSE)*RC[1],0),ROUND(HLOOKUP(RC[-5],Sheet1!R2C1:R26C7,RC[-4]+13,FALSE),0)&IF(RC[1]=0,"","|"&ROUND(HLOOKUP(RC[-5],Sheet1!R2C9:R26C15,RC[-4]+13,FALSE)*RC[1],0))) -> 342200 | G163: 8 | H163: 0
A164: 2 | B164: 3 | C164: 70 | D164: 0 | E164: =HLOOKUP(RC[-4],Sheet1!R2C1:R26C7,RC[-3]+1,FALSE)&IF(RC[2]=0,"",IF(HLOOKUP(RC[-4],Sheet1!R2C9:R26C15,RC[-3]+1,FALSE)="","","|"&HLOOKUP(RC[-4],Sheet1!R2C9:R26C15,RC[-3]+1,FALSE))) -> 19003 | F164: =IF(HLOOKUP(RC[-5],Sheet1!R2C9:R26C15,RC[-4]+1,FALSE)="",ROUND(HLOOKUP(RC[-5],Sheet1!R2C1:R26C7,RC[-4]+13,FALSE)+HLOOKUP(RC[-5],Sheet1!R2C9:R26C15,RC[-4]+13,FALSE)*RC[1],0),ROUND(HLOOKUP(RC[-5],Sheet1!R2C1:R26C7,RC[-4]+13,FALSE),0)&IF(RC[1]=0,"","|"&ROUND(HLOOKUP(RC[-5],Sheet1!R2C9:R26C15,RC[-4]+13,FALSE)*RC[1],0))) -> 336300 | G164: 7 | H164: 0
A165: 2 | B165: 3 | C165: 60 | D165: 0 | E165: =HLOOKUP(RC[-4],Sheet1!R2C1:R26C7,RC[-3]+1,FALSE)&IF(RC[2]=0,"",IF(HLOOKUP(RC[-4],Sheet1!R2C9:R26C15,RC[-3]+1,FALSE)="","","|"&HLOOKUP(RC[-4],Sheet1!R2C9:R26C15,RC[-3]+1,FALSE))) -> 19003 | F165: =IF(HLOOKUP(RC[-5],Sheet1!R2C9:R26C15,RC[-4]+1,FALSE)="",ROUND(HLOOKUP(RC[-5],Sheet1!R2C1:R26C7,RC[-4]+13,FALSE)+HLOOKUP(RC[-5],Sheet1!R2C9:R26C15,RC[-4]+13,FALSE)*RC[1],0),ROUND(HLOOKUP(RC[-5],Sheet1!R2C1:R26C7,RC[-4]+13,FALSE),0)&IF(RC[1]=0,"","|"&ROUND(HLOOKUP(RC[-5],Sheet1!R2C9:R26C15,RC[-4]+13,FALSE)*RC[1],0))) -> 330400 | G165: 6 | H165: 0
A166: 2 | B166: 3 | C166: 50 | D166: 0 | E166: =HLOOKUP(RC[-4],Sheet1!R2C1:R26C7,RC[-3]+1,FALSE)&IF(RC[2]=0,"",IF(HLOOKUP(RC[-4],Sheet1!R2C9:R26C15,RC[-3]+1,FALSE)="","","|"&HLOOKUP(RC[-4],Sheet1!R2C9:R26C15,RC[-3]+1,FALSE))) -> 19003 | F166: =IF(HLOOKUP(RC[-5],Sheet1!R2C9:R26C15,RC[-4]+1,FALSE)="",ROUND(HLOOKUP(RC[-5],Sheet1!R2C1:R26C7,RC[-4]+13,FALSE)+HLOOKUP(RC[-5],Sheet1!R2C9:R26C15,RC[-4]+13,FALSE)*RC[1],0),ROUND(HLOOKUP(RC[-5],Sheet1!R2C1:R26C7,RC[-4]+13,FALSE),0)&IF(RC[1]=0,"","|"&ROUND(HLOOKUP(RC[-5],Sheet1!R2C9:R26C15,RC[-4]+13,FALSE)*RC[1],0))) -> 324500 | G166: 5 | H166: 0
A167: 2 | B167: 3 | C167: 40 | D167: 0 | E167: =HLOOKUP(RC[-4],Sheet1!R2C1:R26C7,RC[-3]+1,FALSE)&IF(RC[2]=0,"",IF(HLOOKUP(RC[-4],Sheet1!R2C9:R26C15,RC[-3]+1,FALSE)="","","|"&HLOOKUP(RC[-4],Sheet1!R2C9:R26C15,RC[-3]+1,FALSE))) -> 19003 | F167: =IF(HLOOKUP(RC[-5],Sheet1!R2C9:R26C15,RC[-4]+1,FALSE)="",ROUND(HLOOKUP(RC[-5],Sheet1!R2C1:R26C7,RC[-4]+13,FALSE)+HLOOKUP(RC[-5],Sheet1!R2C9:R26C15,RC[-4]+13,FALSE)*RC[1],0),ROUND(HLOOKUP(RC[-5],Sheet1!R2C1:R26C7,RC[-4]+13,FALSE),0)&IF(RC[1]=0,"","|"&ROUND(HLOOKUP(RC[-5],Sheet1!R2C9:R26C15,RC[-4]+13,FALSE)*RC[1],0))) -> 318600 | G167: 4 | H167: 0
A168: 2 | B168: 3 | C168: 30 | D168: 0 | E168: =HLOOKUP(RC[-4],Sheet1!R2C1:R26C7,RC[-3]+1,FALSE)&IF(RC[2]=0,"",IF(HLOOKUP(RC[-4],Sheet1!R2C9:R26C15,RC[-3]+1,FALSE)="","","|"&HLOOKUP(RC[-4],Sheet1!R2C9:R26C15,RC[-3]+1,FALSE))) -> 19003 | F168: =IF(HLOOKUP(RC[-5],Sheet1!R2C9:R26C15,RC[-4]+1,FALSE)="",ROUND(HLOOKUP(RC[-5],Sheet1!R2C1:R26C7,RC[-4]+13,FALSE)+HLOOKUP(RC[-5],Sheet1!R2C9:R26C15,RC[-4]+13,FALSE)*RC[1],0),ROUND(HLOOKUP(RC[-5],Sheet1!R2C1:R26C7,RC[-4]+13,FALSE),0)&IF(RC[1]=0,"","|"&ROUND(HLOOKUP(RC[-5],Sheet1!R2C9:R26C15,RC[-4]+13,FALSE)*RC[1],0))) -> 312700 | G168: 3 | H168: 0
A169: 2 | B169: 3 | C169: 20 | D169: 0 | E169: =HLOOKUP(RC[-4],Sheet1!R2C1:R26C7,RC[-3]+1,FALSE)&IF(RC[2]=0,"",IF(HLOOKUP(RC[-4],Sheet1!R2C9:R26C15,RC[-3]+1,FALSE)="","","|"&HLOOKUP(RC[-4],Sheet1!R2C9:R26C15,RC[-3]+1,FALSE))) -> 19003 | F169: =IF(HLOOKUP(RC[-5],Sheet1!R2C9:R26C15,RC[-4]+1,FALSE)="",ROUND(HLOOKUP(RC[-5],Sheet1!R2C1:R26C7,RC[-4]+13,FALSE)+HLOOKUP(RC[-5],Sheet1!R2C9:R26C15,RC[-4]+13,FALSE)*RC[1],0),ROUND(HLOOKUP(RC[-5],Sheet1!R2C1:R26C7,RC[-4]+13,FALSE),0)&IF(RC[1]=0,"","|"&ROUND(HLOOKUP(RC[-5],Sheet1!R2C9:R26C15,RC[-4]+13,FALSE)*RC[1],0))) -> 306800 | G169: 2 | H169: 0
A170: 2 | B170: 3 | C170: 10 | D170: 0 | E170: =HLOOKUP(RC[-4],Sheet1!R2C1:R26C7,RC[-3]+1,FALSE)&IF(RC[2]=0,"",IF(HLOOKUP(RC[-4],Sheet1!R2C9:R26C15,RC[-3]+1,FALSE)="","","|"&HLOOKUP(RC[-4],Sheet1!R2C9:R26C15,RC[-3]+1,FALSE))) -> 19003 | F170: =IF(HLOOKUP(RC[-5],Sheet1!R2C9:R26C15,RC[-4]+1,FALSE)="",ROUND(HLOOKUP(RC[-5],Sheet1!R2C1:R26C7,RC[-4]+13,FALSE)+HLOOKUP(RC[-5],Sheet1!R2C9:R26C15,RC[-4]+13,FALSE)*RC[1],0),ROUND(HLOOKUP(RC[-5],Sheet1!R2C1:R26C7,RC[-4]+13,FALSE),0)&IF(RC[1]=0,"","|"&ROUND(HLOOKUP(RC[-5],Sheet1!R2C9:R26C15,RC[-4]+13,FALSE)*RC[1],0))) -> 300900 | G170: 1 | H170: 0
A171: 2 | B171: 3 | C171: 0 | D171: 0 | E171: =HLOOKUP(RC[-4],Sheet1!R2C1:R26C7,RC[-3]+1,FALSE)&IF(RC[2]=0,"",IF(HLOOKUP(RC[-4],Sheet1!R2C9:R26C15,RC[-3]+1,FALSE)="","","|"&HLOOKUP(RC[-4],Sheet1!R2C9:R26C15,RC[-3]+1,FALSE))) -> 19003 | F171: =IF(HLOOKUP(RC[-5],Sheet1!R2C9:R26C15,RC[-4]+1,FALSE)="",ROUND(HLOOKUP(RC[-5],Sheet1!R2C1:R26C7,RC[-4]+13,FALSE)+HLOOKUP(RC[-5],Sheet1!R2C9:R26C15,RC[-4]+13,FALSE)*RC[1],0),ROUND(HLOOKUP(RC[-5],Sheet1!R2C1:R26C7,RC[-4]+13,FALSE),0)&IF(RC[1]=0,"","|"&ROUND(HLOOKUP(RC[-5],Sheet1!R2C9:R26C15,RC[-4]+13,FALSE)*RC[1],0))) -> 295000 | G171: 0 | H171: 0
A172: 2 | B172: 4 | C172: 100 | D172: 1 | E172: =HLOOKUP(RC[-4],Sheet1!R2C1:R26C7,RC[-3]+1,FALSE)&IF(RC[2]=0,"",IF(HLOOKUP(RC[-4],Sheet1!R2C9:R26C15,RC[-3]+1,FALSE)="","","|"&HLOOKUP(RC[-4],Sheet1!R2C9:R26C15,RC[-3]+1,FALSE))) -> 19003 | F172: =IF(HLOOKUP(RC[-5],Sheet1!R2C9:R26C15,RC[-4]+1,FALSE)="",ROUND(HLOOKUP(RC[-5],Sheet1!R2C1:R26C7,RC[-4]+13,FALSE)+HLOOKUP(RC[-5],Sheet1!R2C9:R26C15,RC[-4]+13,FALSE)*RC[1],0),ROUND(HLOOKUP(RC[-5],Sheet1!R2C1:R26C7,RC[-4]+13,FALSE),0)&IF(RC[1]=0,"","|"&ROUND(HLOOKUP(RC[-5],Sheet1!R2C9:R26C15,RC[-4]+13,FALSE)*RC[1],0))) -> 487500 | G172: 10 | H172: 1
A173: 2 | B173: 4 | C173: 90 | D173: 0 | E173: =HLOOKUP(RC[-4],Sheet1!R2C1:R26C7,RC[-3]+1,FALSE)&IF(RC[2]=0,"",IF(HLOOKUP(RC[-4],Sheet1!R2C9:R26C15,RC[-3]+1,FALSE)="","","|"&HLOOKUP(RC[-4],Sheet1!R2C9:R26C15,RC[-3]+1,FALSE))) -> 19003 | F173: =IF(HLOOKUP(RC[-5],Sheet1!R2C9:R26C15,RC[-4]+1,FALSE)="",ROUND(HLOOKUP(RC[-5],Sheet1!R2C1:R26C7,RC[-4]+13,FALSE)+HLOOKUP(RC[-5],Sheet1!R2C9:R26C15,RC[-4]+13,FALSE)*RC[1],0),ROUND(HLOOKUP(RC[-5],Sheet1!R2C1:R26C7,RC[-4]+13,FALSE),0)&IF(RC[1]=0,"","|"&ROUND(HLOOKUP(RC[-5],Sheet1!R2C9:R26C15,RC[-4]+13,FALSE)*RC[1],0))) -> 479375 | G173: 9 | H173: 0
A174: 2 | B174: 4 | C174: 80 | D174: 0 | E174: =HLOOKUP(RC[-4],Sheet1!R2C1:R26C7,RC[-3]+1,FALSE)&IF(RC[2]=0,"",IF(HLOOKUP(RC[-4],Sheet1!R2C9:R26C15,RC[-3]+1,FALSE)="","","|"&HLOOKUP(RC[-4],Sheet1!R2C9:R26C15,RC[-3]+1,FALSE))) -> 19003 | F174: =IF(HLOOKUP(RC[-5],Sheet1!R2C9:R26C15,RC[-4]+1,FALSE)="",ROUND(HLOOKUP(RC[-5],Sheet1!R2C1:R26C7,RC[-4]+13,FALSE)+HLOOKUP(RC[-5],Sheet1!R2C9:R26C15,RC[-4]+13,FALSE)*RC[1],0),ROUND(HLOOKUP(RC[-5],Sheet1!R2C1:R26C7,RC[-4]+13,FALSE),0)&IF(RC[1]=0,"","|"&ROUND(HLOOKUP(RC[-5],Sheet1!R2C9:R26C15,RC[-4]+13,FALSE)*RC[1],0))) -> 471250 | G174: 8 | H174: 0
A175: 2 | B175: 4 | C175: 70 | D175: 0 | E175: =HLOOKUP(RC[-4],Sheet1!R2C1:R26C7,RC[-3]+1,FALSE)&IF(RC[2]=0,"",IF(HLOOKUP(RC[-4],Sheet1!R2C9:R26C15,RC[-3]+1,FALSE)="","","|"&HLOOKUP(RC[-4],Sheet1!R2C9:R26C15,RC[-3]+1,FALSE))) -> 19003 | F175: =IF(HLOOKUP(RC[-5],Sheet1!R2C9:R26C15,RC[-4]+1,FALSE)="",ROUND(HLOOKUP(RC[-5],Sheet1!R2C1:R26C7,RC[-4]+13,FALSE)+HLOOKUP(RC[-5],Sheet1!R2C9:R26C15,RC[-4]+13,FALSE)*RC[1],0),ROUND(HLOOKUP(RC[-5],Sheet1!R2C1:R26C7,RC[-4]+13,FALSE),0)&IF(RC[1]=0,"","|"&ROUND(HLOOKUP(RC[-5],Sheet1!R2C9:R26C15,RC[-4]+13,FALSE)*RC[1],0))) -> 463125 | G175: 7 | H175: 0
A176: 2 | B176: 4 | C176: 60 | D176: 0 | E176: =HLOOKUP(RC[-4],Sheet1!R2C1:R26C7,RC[-3]+1,FALSE)&IF(RC[2]=0,"",IF(HLOOKUP(RC[-4],Sheet1!R2C9:R26C15,RC[-3]+1,FALSE)="","","|"&HLOOKUP(RC[-4],Sheet1!R2C9:R26C15,RC[-3]+1,FALSE))) -> 19003 | F176: =IF(HLOOKUP(RC[-5],Sheet1!R2C9:R26C15,RC[-4]+1,FALSE)="",ROUND(HLOOKUP(RC[-5],Sheet1!R2C1:R26C7,RC[-4]+13,FALSE)+HLOOKUP(RC[-5],Sheet1!R2C9:R26C15,RC[-4]+13,FALSE)*RC[1],0),ROUND(HLOOKUP(RC[-5],Sheet1!R2C1:R26C7,RC[-4]+13,FALSE),0)&IF(RC[1]=0,"","|"&ROUND(HLOOKUP(RC[-5],Sheet1!R2C9:R26C15,RC[-4]+13,FALSE)*RC[1],0))) -> 455000 | G176: 6 | H176: 0
A177: 2 | B177: 4 | C177: 50 | D177: 0 | E177: =HLOOKUP(RC[-4],Sheet1!R2C1:R26C7,RC[-3]+1,FALSE)&IF(RC[2]=0,"",IF(HLOOKUP(RC[-4],Sheet1!R2C9:R26C15,RC[-3]+1,FALSE)="","","|"&HLOOKUP(RC[-4],Sheet1!R2C9:R26C15,RC[-3]+1,FALSE))) -> 19003 | F177: =IF(HLOOKUP(RC[-5],Sheet1!R2C9:R26C15,RC[-4]+1,FALSE)="",ROUND(HLOOKUP(RC[-5],Sheet1!R2C1:R26C7,RC[-4]+13,FALSE)+HLOOKUP(RC[-5],Sheet1!R2C9:R26C15,RC[-4]+13,FALSE)*RC[1],0),ROUND(HLOOKUP(RC[-5],Sheet1!R2C1:R26C7,RC[-4]+13,FALSE),0)&IF(RC[1]=0,"","|"&ROUND(HLOOKUP(RC[-5],Sheet1!R2C9:R26C15,RC[-4]+13,FALSE)*RC[1],0))) -> 446875 | G177: 5 | H177: 0
A178: 2 | B178: 4 | C178: 40 | D178: 0 | E178: =HLOOKUP(RC[-4],Sheet1!R2C1:R26C7,RC[-3]+1,FALSE)&IF(RC[2]=0,"",IF(HLOOKUP(RC[-4],Sheet1!R2C9:R26C15,RC[-3]+1,FALSE)="","","|"&HLOOKUP(RC[-4],Sheet1!R2C9:R26C15,RC[-3]+1,FALSE))) -> 19003 | F178: =IF(HLOOKUP(RC[-5],Sheet1!R2C9:R26C15,RC[-4]+1,FALSE)="",ROUND(HLOOKUP(RC[-5],Sheet1!R2C1:R26C7,RC[-4]+13,FALSE)+HLOOKUP(RC[-5],Sheet1!R2C9:R26C15,RC[-4]+13,FALSE)*RC[1],0),ROUND(HLOOKUP(RC[-5],Sheet1!R2C1:R26C7,RC[-4]+13,FALSE),0)&IF(RC[1]=0,"","|"&ROUND(HLOOKUP(RC[-5],Sheet1!R2C9:R26C15,RC[-4]+13,FALSE)*RC[1],0))) -> 438750 | G178: 4 | H178: 0
A179: 2 | B179: 4 | C179: 30 | D179: 0 | E179: =HLOOKUP(RC[-4],Sheet1!R2C1:R26C7,RC[-3]+1,FALSE)&IF(RC[2]=0,"",IF(HLOOKUP(RC[-4],Sheet1!R2C9:R26C15,RC[-3]+1,FALSE)="","","|"&HLOOKUP(RC[-4],Sheet1!R2C9:R26C15,RC[-3]+1,FALSE))) -> 19003 | F179: =IF(HLOOKUP(RC[-5],Sheet1!R2C9:R26C15,RC[-4]+1,FALSE)="",ROUND(HLOOKUP(RC[-5],Sheet1!R2C1:R26C7,RC[-4]+13,FALSE)+HLOOKUP(RC[-5],Sheet1!R2C9:R26C15,RC[-4]+13,FALSE)*RC[1],0),ROUND(HLOOKUP(RC[-5],Sheet1!R2C1:R26C7,RC[-4]+13,FALSE),0)&IF(RC[1]=0,"","|"&ROUND(HLOOKUP(RC[-5],Sheet1!R2C9:R26C15,RC[-4]+13,FALSE)*RC[1],0))) -> 430625 | G179: 3 | H179: 0
A180: 2 | B180: 4 | C180: 20 | D180: 0 | E180: =HLOOKUP(RC[-4],Sheet1!R2C1:R26C7,RC[-3]+1,FALSE)&IF(RC[2]=0,"",IF(HLOOKUP(RC[-4],Sheet1!R2C9:R26C15,RC[-3]+1,FALSE)="","","|"&HLOOKUP(RC[-4],Sheet1!R2C9:R26C15,RC[-3]+1,FALSE))) -> 19003 | F180: =IF(HLOOKUP(RC[-5],Sheet1!R2C9:R26C15,RC[-4]+1,FALSE)="",ROUND(HLOOKUP(RC[-5],Sheet1!R2C1:R26C7,RC[-4]+13,FALSE)+HLOOKUP(RC[-5],Sheet1!R2C9:R26C15,RC[-4]+13,FALSE)*RC[1],0),ROUND(HLOOKUP(RC[-5],Sheet1!R2C1:R26C7,RC[-4]+13,FALSE),0)&IF(RC[1]=0,"","|"&ROUND(HLOOKUP(RC[-5],Sheet1!R2C9:R26C15,RC[-4]+13,FALSE)*RC[1],0))) -> 422500 | G180: 2 | H180: 0
A181: 2 | B181: 4 | C181: 10 | D181: 0 | E181: =HLOOKUP(RC[-4],Sheet1!R2C1:R26C7,RC[-3]+1,FALSE)&IF(RC[2]=0,"",IF(HLOOKUP(RC[-4],Sheet1!R2C9:R26C15,RC[-3]+1,FALSE)="","","|"&HLOOKUP(RC[-4],Sheet1!R2C9:R26C15,RC[-3]+1,FALSE))) -> 19003 | F181: =IF(HLOOKUP(RC[-5],Sheet1!R2C9:R26C15,RC[-4]+1,FALSE)="",ROUND(HLOOKUP(RC[-5],Sheet1!R2C1:R26C7,RC[-4]+13,FALSE)+HLOOKUP(RC[-5],Sheet1!R2C9:R26C15,RC[-4]+13,FALSE)*RC[1],0),ROUND(HLOOKUP(RC[-5],Sheet1!R2C1:R26C7,RC[-4]+13,FALSE),0)&IF(RC[1]=0,"","|"&ROUND(HLOOKUP(RC[-5],Sheet1!R2C9:R26C15,RC[-4]+13,FALSE)*RC[1],0))) -> 414375 | G181: 1 | H181: 0
A182: 2 | B182: 4 | C182: 0 | D182: 0 | E182: =HLOOKUP(RC[-4],Sheet1!R2C1:R26C7,RC[-3]+1,FALSE)&IF(RC[2]=0,"",IF(HLOOKUP(RC[-4],Sheet1!R2C9:R26C15,RC[-3]+1,FALSE)="","","|"&HLOOKUP(RC[-4],Sheet1!R2C9:R26C15,RC[-3]+1,FALSE))) -> 19003 | F182: =IF(HLOOKUP(RC[-5],Sheet1!R2C9:R26C15,RC[-4]+1,FALSE)="",ROUND(HLOOKUP(RC[-5],Sheet1!R2C1:R26C7,RC[-4]+13,FALSE)+HLOOKUP(RC[-5],Sheet1!R2C9:R26C15,RC[-4]+13,FALSE)*RC[1],0),ROUND(HLOOKUP(RC[-5],Sheet1!R2C1:R26C7,RC[-4]+13,FALSE),0)&IF(RC[1]=0,"","|"&ROUND(HLOOKUP(RC[-5],Sheet1!R2C9:R26C15,RC[-4]+13,FALSE)*RC[1],0))) -> 406250 | G182: 0 | H182: 0
A183: 2 | B183: 5 | C183: 100 | D183: 1 | E183: =HLOOKUP(RC[-4],Sheet1!R2C1:R26C7,RC[-3]+1,FALSE)&IF(RC[2]=0,"",IF(HLOOKUP(RC[-4],Sheet1!R2C9:R26C15,RC[-3]+1,FALSE)="","","|"&HLOOKUP(RC[-4],Sheet1!R2C9:R26C15,RC[-3]+1,FALSE))) -> 19003 | F183: =IF(HLOOKUP(RC[-5],Sheet1!R2C9:R26C15,RC[-4]+1,FALSE)="",ROUND(HLOOKUP(RC[-5],Sheet1!R2C1:R26C7,RC[-4]+13,FALSE)+HLOOKUP(RC[-5],Sheet1!R2C9:R26C15,RC[-4]+13,FALSE)*RC[1],0),ROUND(HLOOKUP(RC[-5],Sheet1!R2C1:R26C7,RC[-4]+13,FALSE),0)&IF(RC[1]=0,"","|"&ROUND(HLOOKUP(RC[-5],Sheet1!R2C9:R26C15,RC[-4]+13,FALSE)*RC[1],0))) -> 639000 | G183: 10 | H183: 1
A184: 2 | B184: 5 | C184: 90 | D184: 0 | E184: =HLOOKUP(RC[-4],Sheet1!R2C1:R26C7,RC[-3]+1,FALSE)&IF(RC[2]=0,"",IF(HLOOKUP(RC[-4],Sheet1!R2C9:R26C15,RC[-3]+1,FALSE)="","","|"&HLOOKUP(RC[-4],Sheet1!R2C9:R26C15,RC[-3]+1,FALSE))) -> 19003 | F184: =IF(HLOOKUP(RC[-5],Sheet1!R2C9:R26C15,RC[-4]+1,FALSE)="",ROUND(HLOOKUP(RC[-5],Sheet1!R2C1:R26C7,RC[-4]+13,FALSE)+HLOOKUP(RC[-5],Sheet1!R2C9:R26C15,RC[-4]+13,FALSE)*RC[1],0),ROUND(HLOOKUP(RC[-5],Sheet1!R2C1:R26C7,RC[-4]+13,FALSE),0)&IF(RC[1]=0,"","|"&ROUND(HLOOKUP(RC[-5],Sheet1!R2C9:R26C15,RC[-4]+13,FALSE)*RC[1],0))) -> 628350 | G184: 9 | H184: 0
A185: 2 | B185: 5 | C185: 80 | D185: 0 | E185: =HLOOKUP(RC[-4],Sheet1!R2C1:R26C7,RC[-3]+1,FALSE)&IF(RC[2]=0,"",IF(HLOOKUP(RC[-4],Sheet1!R2C9:R26C15,RC[-3]+1,FALSE)="","","|"&HLOOKUP(RC[-4],Sheet1!R2C9:R26C15,RC[-3]+1,FALSE))) -> 19003 | F185: =IF(HLOOKUP(RC[-5],Sheet1!R2C9:R26C15,RC[-4]+1,FALSE)="",ROUND(HLOOKUP(RC[-5],Sheet1!R2C1:R26C7,RC[-4]+13,FALSE)+HLOOKUP(RC[-5],Sheet1!R2C9:R26C15,RC[-4]+13,FALSE)*RC[1],0),ROUND(HLOOKUP(RC[-5],Sheet1!R2C1:R26C7,RC[-4]+13,FALSE),0)&IF(RC[1]=0,"","|"&ROUND(HLOOKUP(RC[-5],Sheet1!R2C9:R26C15,RC[-4]+13,FALSE)*RC[1],0))) -> 617700 | G185: 8 | H185: 0
A186: 2 | B186: 5 | C186: 70 | D186: 0 | E186: =HLOOKUP(RC[-4],Sheet1!R2C1:R26C7,RC[-3]+1,FALSE)&IF(RC[2]=0,"",IF(HLOOKUP(RC[-4],Sheet1!R2C9:R26C15,RC[-3]+1,FALSE)="","","|"&HLOOKUP(RC[-4],Sheet1!R2C9:R26C15,RC[-3]+1,FALSE))) -> 19003 | F186: =IF(HLOOKUP(RC[-5],Sheet1!R2C9:R26C15,RC[-4]+1,FALSE)="",ROUND(HLOOKUP(RC[-5],Sheet1!R2C1:R26C7,RC[-4]+13,FALSE)+HLOOKUP(RC[-5],Sheet1!R2C9:R26C15,RC[-4]+13,FALSE)*RC[1],0),ROUND(HLOOKUP(RC[-5],Sheet1!R2C1:R26C7,RC[-4]+13,FALSE),0)&IF(RC[1]=0,"","|"&ROUND(HLOOKUP(RC[-5],Sheet1!R2C9:R26C15,RC[-4]+13,FALSE)*RC[1],0))) -> 607050 | G186: 7 | H186: 0
A187: 2 | B187: 5 | C187: 60 | D187: 0 | E187: =HLOOKUP(RC[-4],Sheet1!R2C1:R26C7,RC[-3]+1,FALSE)&IF(RC[2]=0,"",IF(HLOOKUP(RC[-4],Sheet1!R2C9:R26C15,RC[-3]+1,FALSE)="","","|"&HLOOKUP(RC[-4],Sheet1!R2C9:R26C15,RC[-3]+1,FALSE))) -> 19003 | F187: =IF(HLOOKUP(RC[-5],Sheet1!R2C9:R26C15,RC[-4]+1,FALSE)="",ROUND(HLOOKUP(RC[-5],Sheet1!R2C1:R26C7,RC[-4]+13,FALSE)+HLOOKUP(RC[-5],Sheet1!R2C9:R26C15,RC[-4]+13,FALSE)*RC[1],0),ROUND(HLOOKUP(RC[-5],Sheet1!R2C1:R26C7,RC[-4]+13,FALSE),0)&IF(RC[1]=0,"","|"&ROUND(HLOOKUP(RC[-5],Sheet1!R2C9:R26C15,RC[-4]+13,FALSE)*RC[1],0))) -> 596400 | G187: 6 | H187: 0
A188: 2 | B188: 5 | C188: 50 | D188: 0 | E188: =HLOOKUP(RC[-4],Sheet1!R2C1:R26C7,RC[-3]+1,FALSE)&IF(RC[2]=0,"",IF(HLOOKUP(RC[-4],Sheet1!R2C9:R26C15,RC[-3]+1,FALSE)="","","|"&HLOOKUP(RC[-4],Sheet1!R2C9:R26C15,RC[-3]+1,FALSE))) -> 19003 | F188: =IF(HLOOKUP(RC[-5],Sheet1!R2C9:R26C15,RC[-4]+1,FALSE)="",ROUND(HLOOKUP(RC[-5],Sheet1!R2C1:R26C7,RC[-4]+13,FALSE)+HLOOKUP(RC[-5],Sheet1!R2C9:R26C15,RC[-4]+13,FALSE)*RC[1],0),ROUND(HLOOKUP(RC[-5],Sheet1!R2C1:R26C7,RC[-4]+13,FALSE),0)&IF(RC[1]=0,"","|"&ROUND(HLOOKUP(RC[-5],Sheet1!R2C9:R26C15,RC[-4]+13,FALSE)*RC[1],0))) -> 585750 | G188: 5 | H188: 0
A189: 2 | B189: 5 | C189: 40 | D189: 0 | E189: =HLOOKUP(RC[-4],Sheet1!R2C1:R26C7,RC[-3]+1,FALSE)&IF(RC[2]=0,"",IF(HLOOKUP(RC[-4],Sheet1!R2C9:R26C15,RC[-3]+1,FALSE)="","","|"&HLOOKUP(RC[-4],Sheet1!R2C9:R26C15,RC[-3]+1,FALSE))) -> 19003 | F189: =IF(HLOOKUP(RC[-5],Sheet1!R2C9:R26C15,RC[-4]+1,FALSE)="",ROUND(HLOOKUP(RC[-5],Sheet1!R2C1:R26C7,RC[-4]+13,FALSE)+HLOOKUP(RC[-5],Sheet1!R2C9:R26C15,RC[-4]+13,FALSE)*RC[1],0),ROUND(HLOOKUP(RC[-5],Sheet1!R2C1:R26C7,RC[-4]+13,FALSE),0)&IF(RC[1]=0,"","|"&ROUND(HLOOKUP(RC[-5],Sheet1!R2C9:R26C15,RC[-4]+13,FALSE)*RC[1],0))) -> 575100 | G189: 4 | H189: 0
A190: 2 | B190: 5 | C190: 30 | D190: 0 | E190: =HLOOKUP(RC[-4],Sheet1!R2C1:R26C7,RC[-3]+1,FALSE)&IF(RC[2]=0,"",IF(HLOOKUP(RC[-4],Sheet1!R2C9:R26C15,RC[-3]+1,FALSE)="","","|"&HLOOKUP(RC[-4],Sheet1!R2C9:R26C15,RC[-3]+1,FALSE))) -> 19003 | F190: =IF(HLOOKUP(RC[-5],Sheet1!R2C9:R26C15,RC[-4]+1,FALSE)="",ROUND(HLOOKUP(RC[-5],Sheet1!R2C1:R26C7,RC[-4]+13,FALSE)+HLOOKUP(RC[-5],Sheet1!R2C9:R26C15,RC[-4]+13,FALSE)*RC[1],0),ROUND(HLOOKUP(RC[-5],Sheet1!R2C1:R26C7,RC[-4]+13,FALSE),0)&IF(RC[1]=0,"","|"&ROUND(HLOOKUP(RC[-5],Sheet1!R2C9:R26C15,RC[-4]+13,FALSE)*RC[1],0))) -> 564450 | G190: 3 | H190: 0
A191: 2 | B191: 5 | C191: 20 | D191: 0 | E191: =HLOOKUP(RC[-4],Sheet1!R2C1:R26C7,RC[-3]+1,FALSE)&IF(RC[2]=0,"",IF(HLOOKUP(RC[-4],Sheet1!R2C9:R26C15,RC[-3]+1,FALSE)="","","|"&HLOOKUP(RC[-4],Sheet1!R2C9:R26C15,RC[-3]+1,FALSE))) -> 19003 | F191: =IF(HLOOKUP(RC[-5],Sheet1!R2C9:R26C15,RC[-4]+1,FALSE)="",ROUND(HLOOKUP(RC[-5],Sheet1!R2C1:R26C7,RC[-4]+13,FALSE)+HLOOKUP(RC[-5],Sheet1!R2C9:R26C15,RC[-4]+13,FALSE)*RC[1],0),ROUND(HLOOKUP(RC[-5],Sheet1!R2C1:R26C7,RC[-4]+13,FALSE),0)&IF(RC[1]=0,"","|"&ROUND(HLOOKUP(RC[-5],Sheet1!R2C9:R26C15,RC[-4]+13,FALSE)*RC[1],0))) -> 553800 | G191: 2 | H191: 0
A192: 2 | B192: 5 | C192: 10 | D192: 0 | E192: =HLOOKUP(RC[-4],Sheet1!R2C1:R26C7,RC[-3]+1,FALSE)&IF(RC[2]=0,"",IF(HLOOKUP(RC[-4],Sheet1!R2C9:R26C15,RC[-3]+1,FALSE)="","","|"&HLOOKUP(RC[-4],Sheet1!R2C9:R26C15,RC[-3]+1,FALSE))) -> 19003 | F192: =IF(HLOOKUP(RC[-5],Sheet1!R2C9:R26C15,RC[-4]+1,FALSE)="",ROUND(HLOOKUP(RC[-5],Sheet1!R2C1:R26C7,RC[-4]+13,FALSE)+HLOOKUP(RC[-5],Sheet1!R2C9:R26C15,RC[-4]+13,FALSE)*RC[1],0),ROUND(HLOOKUP(RC[-5],Sheet1!R2C1:R26C7,RC[-4]+13,FALSE),0)&IF(RC[1]=0,"","|"&ROUND(HLOOKUP(RC[-5],Sheet1!R2C9:R26C15,RC[-4]+13,FALSE)*RC[1],0))) -> 543150 | G192: 1 | H192: 0
A193: 2 | B193: 5 | C193: 0 | D193: 0 | E193: =HLOOKUP(RC[-4],Sheet1!R2C1:R26C7,RC[-3]+1,FALSE)&IF(RC[2]=0,"",IF(HLOOKUP(RC[-4],Sheet1!R2C9:R26C15,RC[-3]+1,FALSE)="","","|"&HLOOKUP(RC[-4],Sheet1!R2C9:R26C15,RC[-3]+1,FALSE))) -> 19003 | F193: =IF(HLOOKUP(RC[-5],Sheet1!R2C9:R26C15,RC[-4]+1,FALSE)="",ROUND(HLOOKUP(RC[-5],Sheet1!R2C1:R26C7,RC[-4]+13,FALSE)+HLOOKUP(RC[-5],Sheet1!R2C9:R26C15,RC[-4]+13,FALSE)*RC[1],0),ROUND(HLOOKUP(RC[-5],Sheet1!R2C1:R26C7,RC[-4]+13,FALSE),0)&IF(RC[1]=0,"","|"&ROUND(HLOOKUP(RC[-5],Sheet1!R2C9:R26C15,RC[-4]+13,FALSE)*RC[1],0))) -> 532500 | G193: 0 | H193: 0
A194: 2 | B194: 6 | C194: 100 | D194: 1 | E194: =HLOOKUP(RC[-4],Sheet1!R2C1:R26C7,RC[-3]+1,FALSE)&IF(RC[2]=0,"",IF(HLOOKUP(RC[-4],Sheet1!R2C9:R26C15,RC[-3]+1,FALSE)="","","|"&HLOOKUP(RC[-4],Sheet1!R2C9:R26C15,RC[-3]+1,FALSE))) -> 19003 | F194: =IF(HLOOKUP(RC[-5],Sheet1!R2C9:R26C15,RC[-4]+1,FALSE)="",ROUND(HLOOKUP(RC[-5],Sheet1!R2C1:R26C7,RC[-4]+13,FALSE)+HLOOKUP(RC[-5],Sheet1!R2C9:R26C15,RC[-4]+13,FALSE)*RC[1],0),ROUND(HLOOKUP(RC[-5],Sheet1!R2C1:R26C7,RC[-4]+13,FALSE),0)&IF(RC[1]=0,"","|"&ROUND(HLOOKUP(RC[-5],Sheet1!R2C9:R26C15,RC[-4]+13,FALSE)*RC[1],0))) -> 808500 | G194: 10 | H194: 1
A195: 2 | B195: 6 | C195: 90 | D195: 0 | E195: =HLOOKUP(RC[-4],Sheet1!R2C1:R26C7,RC[-3]+1,FALSE)&IF(RC[2]=0,"",IF(HLOOKUP(RC[-4],Sheet1!R2C9:R26C15,RC[-3]+1,FALSE)="","","|"&HLOOKUP(RC[-4],Sheet1!R2C9:R26C15,RC[-3]+1,FALSE))) -> 19003 | F195: =IF(HLOOKUP(RC[-5],Sheet1!R2C9:R26C15,RC[-4]+1,FALSE)="",ROUND(HLOOKUP(RC[-5],Sheet1!R2C1:R26C7,RC[-4]+13,FALSE)+HLOOKUP(RC[-5],Sheet1!R2C9:R26C15,RC[-4]+13,FALSE)*RC[1],0),ROUND(HLOOKUP(RC[-5],Sheet1!R2C1:R26C7,RC[-4]+13,FALSE),0)&IF(RC[1]=0,"","|"&ROUND(HLOOKUP(RC[-5],Sheet1!R2C9:R26C15,RC[-4]+13,FALSE)*RC[1],0))) -> 795025 | G195: 9 | H195: 0
A196: 2 | B196: 6 | C196: 80 | D196: 0 | E196: =HLOOKUP(RC[-4],Sheet1!R2C1:R26C7,RC[-3]+1,FALSE)&IF(RC[2]=0,"",IF(HLOOKUP(RC[-4],Sheet1!R2C9:R26C15,RC[-3]+1,FALSE)="","","|"&HLOOKUP(RC[-4],Sheet1!R2C9:R26C15,RC[-3]+1,FALSE))) -> 19003 | F196: =IF(HLOOKUP(RC[-5],Sheet1!R2C9:R26C15,RC[-4]+1,FALSE)="",ROUND(HLOOKUP(RC[-5],Sheet1!R2C1:R26C7,RC[-4]+13,FALSE)+HLOOKUP(RC[-5],Sheet1!R2C9:R26C15,RC[-4]+13,FALSE)*RC[1],0),ROUND(HLOOKUP(RC[-5],Sheet1!R2C1:R26C7,RC[-4]+13,FALSE),0)&IF(RC[1]=0,"","|"&ROUND(HLOOKUP(RC[-5],Sheet1!R2C9:R26C15,RC[-4]+13,FALSE)*RC[1],0))) -> 781550 | G196: 8 | H196: 0
A197: 2 | B197: 6 | C197: 70 | D197: 0 | E197: =HLOOKUP(RC[-4],Sheet1!R2C1:R26C7,RC[-3]+1,FALSE)&IF(RC[2]=0,"",IF(HLOOKUP(RC[-4],Sheet1!R2C9:R26C15,RC[-3]+1,FALSE)="","","|"&HLOOKUP(RC[-4],Sheet1!R2C9:R26C15,RC[-3]+1,FALSE))) -> 19003 | F197: =IF(HLOOKUP(RC[-5],Sheet1!R2C9:R26C15,RC[-4]+1,FALSE)="",ROUND(HLOOKUP(RC[-5],Sheet1!R2C1:R26C7,RC[-4]+13,FALSE)+HLOOKUP(RC[-5],Sheet1!R2C9:R26C15,RC[-4]+13,FALSE)*RC[1],0),ROUND(HLOOKUP(RC[-5],Sheet1!R2C1:R26C7,RC[-4]+13,FALSE),0)&IF(RC[1]=0,"","|"&ROUND(HLOOKUP(RC[-5],Sheet1!R2C9:R26C15,RC[-4]+13,FALSE)*RC[1],0))) -> 768075 | G197: 7 | H197: 0
A198: 2 | B198: 6 | C198: 60 | D198: 0 | E198: =HLOOKUP(RC[-4],Sheet1!R2C1:R26C7,RC[-3]+1,FALSE)&IF(RC[2]=0,"",IF(HLOOKUP(RC[-4],Sheet1!R2C9:R26C15,RC[-3]+1,FALSE)="","","|"&HLOOKUP(RC[-4],Sheet1!R2C9:R26C15,RC[-3]+1,FALSE))) -> 19003 | F198: =IF(HLOOKUP(RC[-5],Sheet1!R2C9:R26C15,RC[-4]+1,FALSE)="",ROUND(HLOOKUP(RC[-5],Sheet1!R2C1:R26C7,RC[-4]+13,FALSE)+HLOOKUP(RC[-5],Sheet1!R2C9:R26C15,RC[-4]+13,FALSE)*RC[1],0),ROUND(HLOOKUP(RC[-5],Sheet1!R2C1:R26C7,RC[-4]+13,FALSE),0)&IF(RC[1]=0,"","|"&ROUND(HLOOKUP(RC[-5],Sheet1!R2C9:R26C15,RC[-4]+13,FALSE)*RC[1],0))) -> 754600 | G198: 6 | H198: 0
A199: 2 | B199: 6 | C199: 50 | D199: 0 | E199: =HLOOKUP(RC[-4],Sheet1!R2C1:R26C7,RC[-3]+1,FALSE)&IF(RC[2]=0,"",IF(HLOOKUP(RC[-4],Sheet1!R2C9:R26C15,RC[-3]+1,FALSE)="","","|"&HLOOKUP(RC[-4],Sheet1!R2C9:R26C15,RC[-3]+1,FALSE))) -> 19003 | F199: =IF(HLOOKUP(RC[-5],Sheet1!R2C9:R26C15,RC[-4]+1,FALSE)="",ROUND(HLOOKUP(RC[-5],Sheet1!R2C1:R26C7,RC[-4]+13,FALSE)+HLOOKUP(RC[-5],Sheet1!R2C9:R26C15,RC[-4]+13,FALSE)*RC[1],0),ROUND(HLOOKUP(RC[-5],Sheet1!R2C1:R26C7,RC[-4]+13,FALSE),0)&IF(RC[1]=0,"","|"&ROUND(HLOOKUP(RC[-5],Sheet1!R2C9:R26C15,RC[-4]+13,FALSE)*RC[1],0))) -> 741125 | G199: 5 | H199: 0
A200: 2 | B200: 6 | C200: 40 | D200: 0 | E200: =HLOOKUP(RC[-4],Sheet1!R2C1:R26C7,RC[-3]+1,FALSE)&IF(RC[2]=0,"",IF(HLOOKUP(RC[-4],Sheet1!R2C9:R26C15,RC[-3]+1,FALSE)="","","|"&HLOOKUP(RC[-4],Sheet1!R2C9:R26C15,RC[-3]+1,FALSE))) -> 19003 | F200: =IF(HLOOKUP(RC[-5],Sheet1!R2C9:R26C15,RC[-4]+1,FALSE)="",ROUND(HLOOKUP(RC[-5],Sheet1!R2C1:R26C7,RC[-4]+13,FALSE)+HLOOKUP(RC[-5],Sheet1!R2C9:R26C15,RC[-4]+13,FALSE)*RC[1],0),ROUND(HLOOKUP(RC[-5],Sheet1!R2C1:R26C7,RC[-4]+13,FALSE),0)&IF(RC[1]=0,"","|"&ROUND(HLOOKUP(RC[-5],Sheet1!R2C9:R26C15,RC[-4]+13,FALSE)*RC[1],0))) -> 727650 | G200: 4 | H200: 0
A201: 2 | B201: 6 | C201: 30 | D201: 0 | E201: =HLOOKUP(RC[-4],Sheet1!R2C1:R26C7,RC[-3]+1,FALSE)&IF(RC[2]=0,"",IF(HLOOKUP(RC[-4],Sheet1!R2C9:R26C15,RC[-3]+1,FALSE)="","","|"&HLOOKUP(RC[-4],Sheet1!R2C9:R26C15,RC[-3]+1,FALSE))) -> 19003 | F201: =IF(HLOOKUP(RC[-5],Sheet1!R2C9:R26C15,RC[-4]+1,FALSE)="",ROUND(HLOOKUP(RC[-5],Sheet1!R2C1:R26C7,RC[-4]+13,FALSE)+HLOOKUP(RC[-5],Sheet1!R2C9:R26C15,RC[-4]+13,FALSE)*RC[1],0),ROUND(HLOOKUP(RC[-5],Sheet1!R2C1:R26C7,RC[-4]+13,FALSE),0)&IF(RC[1]=0,"","|"&ROUND(HLOOKUP(RC[-5],Sheet1!R2C9:R26C15,RC[-4]+13,FALSE)*RC[1],0))) -> 714175 | G201: 3 | H201: 0
A202: 2 | B202: 6 | C202: 20 | D202: 0 | E202: =HLOOKUP(RC[-4],Sheet1!R2C1:R26C7,RC[-3]+1,FALSE)&IF(RC[2]=0,"",IF(HLOOKUP(RC[-4],Sheet1!R2C9:R26C15,RC[-3]+1,FALSE)="","","|"&HLOOKUP(RC[-4],Sheet1!R2C9:R26C15,RC[-3]+1,FALSE))) -> 19003 | F202: =IF(HLOOKUP(RC[-5],Sheet1!R2C9:R26C15,RC[-4]+1,FALSE)="",ROUND(HLOOKUP(RC[-5],Sheet1!R2C1:R26C7,RC[-4]+13,FALSE)+HLOOKUP(RC[-5],Sheet1!R2C9:R26C15,RC[-4]+13,FALSE)*RC[1],0),ROUND(HLOOKUP(RC[-5],Sheet1!R2C1:R26C7,RC[-4]+13,FALSE),0)&IF(RC[1]=0,"","|"&ROUND(HLOOKUP(RC[-5],Sheet1!R2C9:R26C15,RC[-4]+13,FALSE)*RC[1],0))) -> 700700 | G202: 2 | H202: 0
A203: 2 | B203: 6 | C203: 10 | D203: 0 | E203: =HLOOKUP(RC[-4],Sheet1!R2C1:R26C7,RC[-3]+1,FALSE)&IF(RC[2]=0,"",IF(HLOOKUP(RC[-4],Sheet1!R2C9:R26C15,RC[-3]+1,FALSE)="","","|"&HLOOKUP(RC[-4],Sheet1!R2C9:R26C15,RC[-3]+1,FALSE))) -> 19003 | F203: =IF(HLOOKUP(RC[-5],Sheet1!R2C9:R26C15,RC[-4]+1,FALSE)="",ROUND(HLOOKUP(RC[-5],Sheet1!R2C1:R26C7,RC[-4]+13,FALSE)+HLOOKUP(RC[-5],Sheet1!R2C9:R26C15,RC[-4]+13,FALSE)*RC[1],0),ROUND(HLOOKUP(RC[-5],Sheet1!R2C1:R26C7,RC[-4]+13,FALSE),0)&IF(RC[1]=0,"","|"&ROUND(HLOOKUP(RC[-5],Sheet1!R2C9:R26C15,RC[-4]+13,FALSE)*RC[1],0))) -> 687225 | G203: 1 | H203: 0
A204: 2 | B204: 6 | C204: 0 | D204: 0 | E204: =HLOOKUP(RC[-4],Sheet1!R2C1:R26C7,RC[-3]+1,FALSE)&IF(RC[2]=0,"",IF(HLOOKUP(RC[-4],Sheet1!R2C9:R26C15,RC[-3]+1,FALSE)="","","|"&HLOOKUP(RC[-4],Sheet1!R2C9:R26C15,RC[-3]+1,FALSE))) -> 19003 | F204: =IF(HLOOKUP(RC[-5],Sheet1!R2C9:R26C15,RC[-4]+1,FALSE)="",ROUND(HLOOKUP(RC[-5],Sheet1!R2C1:R26C7,RC[-4]+13,FALSE)+HLOOKUP(RC[-5],Sheet1!R2C9:R26C15,RC[-4]+13,FALSE)*RC[1],0),ROUND(HLOOKUP(RC[-5],Sheet1!R2C1:R26C7,RC[-4]+13,FALSE),0)&IF(RC[1]=0,"","|"&ROUND(HLOOKUP(RC[-5],Sheet1!R2C9:R26C15,RC[-4]+13,FALSE)*RC[1],0))) -> 673750 | G204: 0 | H204: 0
A205: 2 | B205: 7 | C205: 100 | D205: 1 | E205: =HLOOKUP(RC[-4],Sheet1!R2C1:R26C7,RC[-3]+1,FALSE)&IF(RC[2]=0,"",IF(HLOOKUP(RC[-4],Sheet1!R2C9:R26C15,RC[-3]+1,FALSE)="","","|"&HLOOKUP(RC[-4],Sheet1!R2C9:R26C15,RC[-3]+1,FALSE))) -> 19003 | F205: =IF(HLOOKUP(RC[-5],Sheet1!R2C9:R26C15,RC[-4]+1,FALSE)="",ROUND(HLOOKUP(RC[-5],Sheet1!R2C1:R26C7,RC[-4]+13,FALSE)+HLOOKUP(RC[-5],Sheet1!R2C9:R26C15,RC[-4]+13,FALSE)*RC[1],0),ROUND(HLOOKUP(RC[-5],Sheet1!R2C1:R26C7,RC[-4]+13,FALSE),0)&IF(RC[1]=0,"","|"&ROUND(HLOOKUP(RC[-5],Sheet1!R2C9:R26C15,RC[-4]+13,FALSE)*RC[1],0))) -> 996000 | G205: 10 | H205: 1
A206: 2 | B206: 7 | C206: 90 | D206: 0 | E206: =HLOOKUP(RC[-4],Sheet1!R2C1:R26C7,RC[-3]+1,FALSE)&IF(RC[2]=0,"",IF(HLOOKUP(RC[-4],Sheet1!R2C9:R26C15,RC[-3]+1,FALSE)="","","|"&HLOOKUP(RC[-4],Sheet1!R2C9:R26C15,RC[-3]+1,FALSE))) -> 19003 | F206: =IF(HLOOKUP(RC[-5],Sheet1!R2C9:R26C15,RC[-4]+1,FALSE)="",ROUND(HLOOKUP(RC[-5],Sheet1!R2C1:R26C7,RC[-4]+13,FALSE)+HLOOKUP(RC[-5],Sheet1!R2C9:R26C15,RC[-4]+13,FALSE)*RC[1],0),ROUND(HLOOKUP(RC[-5],Sheet1!R2C1:R26C7,RC[-4]+13,FALSE),0)&IF(RC[1]=0,"","|"&ROUND(HLOOKUP(RC[-5],Sheet1!R2C9:R26C15,RC[-4]+13,FALSE)*RC[1],0))) -> 979400 | G206: 9 | H206: 0
A207: 2 | B207: 7 | C207: 80 | D207: 0 | E207: =HLOOKUP(RC[-4],Sheet1!R2C1:R26C7,RC[-3]+1,FALSE)&IF(RC[2]=0,"",IF(HLOOKUP(RC[-4],Sheet1!R2C9:R26C15,RC[-3]+1,FALSE)="","","|"&HLOOKUP(RC[-4],Sheet1!R2C9:R26C15,RC[-3]+1,FALSE))) -> 19003 | F207: =IF(HLOOKUP(RC[-5],Sheet1!R2C9:R26C15,RC[-4]+1,FALSE)="",ROUND(HLOOKUP(RC[-5],Sheet1!R2C1:R26C7,RC[-4]+13,FALSE)+HLOOKUP(RC[-5],Sheet1!R2C9:R26C15,RC[-4]+13,FALSE)*RC[1],0),ROUND(HLOOKUP(RC[-5],Sheet1!R2C1:R26C7,RC[-4]+13,FALSE),0)&IF(RC[1]=0,"","|"&ROUND(HLOOKUP(RC[-5],Sheet1!R2C9:R26C15,RC[-4]+13,FALSE)*RC[1],0))) -> 962800 | G207: 8 | H207: 0
A208: 2 | B208: 7 | C208: 70 | D208: 0 | E208: =HLOOKUP(RC[-4],Sheet1!R2C1:R26C7,RC[-3]+1,FALSE)&IF(RC[2]=0,"",IF(HLOOKUP(RC[-4],Sheet1!R2C9:R26C15,RC[-3]+1,FALSE)="","","|"&HLOOKUP(RC[-4],Sheet1!R2C9:R26C15,RC[-3]+1,FALSE))) -> 19003 | F208: =IF(HLOOKUP(RC[-5],Sheet1!R2C9:R26C15,RC[-4]+1,FALSE)="",ROUND(HLOOKUP(RC[-5],Sheet1!R2C1:R26C7,RC[-4]+13,FALSE)+HLOOKUP(RC[-5],Sheet1!R2C9:R26C15,RC[-4]+13,FALSE)*RC[1],0),ROUND(HLOOKUP(RC[-5],Sheet1!R2C1:R26C7,RC[-4]+13,FALSE),0)&IF(RC[1]=0,"","|"&ROUND(HLOOKUP(RC[-5],Sheet1!R2C9:R26C15,RC[-4]+13,FALSE)*RC[1],0))) -> 946200 | G208: 7 | H208: 0
A209: 2 | B209: 7 | C209: 60 | D209: 0 | E209: =HLOOKUP(RC[-4],Sheet1!R2C1:R26C7,RC[-3]+1,FALSE)&IF(RC[2]=0,"",IF(HLOOKUP(RC[-4],Sheet1!R2C9:R26C15,RC[-3]+1,FALSE)="","","|"&HLOOKUP(RC[-4],Sheet1!R2C9:R26C15,RC[-3]+1,FALSE))) -> 19003 | F209: =IF(HLOOKUP(RC[-5],Sheet1!R2C9:R26C15,RC[-4]+1,FALSE)="",ROUND(HLOOKUP(RC[-5],Sheet1!R2C1:R26C7,RC[-4]+13,FALSE)+HLOOKUP(RC[-5],Sheet1!R2C9:R26C15,RC[-4]+13,FALSE)*RC[1],0),ROUND(HLOOKUP(RC[-5],Sheet1!R2C1:R26C7,RC[-4]+13,FALSE),0)&IF(RC[1]=0,"","|"&ROUND(HLOOKUP(RC[-5],Sheet1!R2C9:R26C15,RC[-4]+13,FALSE)*RC[1],0))) -> 929600 | G209: 6 | H209: 0
A210: 2 | B210: 7 | C210: 50 | D210: 0 | E210: =HLOOKUP(RC[-4],Sheet1!R2C1:R26C7,RC[-3]+1,FALSE)&IF(RC[2]=0,"",IF(HLOOKUP(RC[-4],Sheet1!R2C9:R26C15,RC[-3]+1,FALSE)="","","|"&HLOOKUP(RC[-4],Sheet1!R2C9:R26C15,RC[-3]+1,FALSE))) -> 19003 | F210: =IF(HLOOKUP(RC[-5],Sheet1!R2C9:R26C15,RC[-4]+1,FALSE)="",ROUND(HLOOKUP(RC[-5],Sheet1!R2C1:R26C7,RC[-4]+13,FALSE)+HLOOKUP(RC[-5],Sheet1!R2C9:R26C15,RC[-4]+13,FALSE)*RC[1],0),ROUND(HLOOKUP(RC[-5],Sheet1!R2C1:R26C7,RC[-4]+13,FALSE),0)&IF(RC[1]=0,"","|"&ROUND(HLOOKUP(RC[-5],Sheet1!R2C9:R26C15,RC[-4]+13,FALSE)*RC[1],0))) -> 913000 | G210: 5 | H210: 0
A211: 2 | B211: 7 | C211: 40 | D211: 0 | E211: =HLOOKUP(RC[-4],Sheet1!R2C1:R26C7,RC[-3]+1,FALSE)&IF(RC[2]=0,"",IF(HLOOKUP(RC[-4],Sheet1!R2C9:R26C15,RC[-3]+1,FALSE)="","","|"&HLOOKUP(RC[-4],Sheet1!R2C9:R26C15,RC[-3]+1,FALSE))) -> 19003 | F211: =IF(HLOOKUP(RC[-5],Sheet1!R2C9:R26C15,RC[-4]+1,FALSE)="",ROUND(HLOOKUP(RC[-5],Sheet1!R2C1:R26C7,RC[-4]+13,FALSE)+HLOOKUP(RC[-5],Sheet1!R2C9:R26C15,RC[-4]+13,FALSE)*RC[1],0),ROUND(HLOOKUP(RC[-5],Sheet1!R2C1:R26C7,RC[-4]+13,FALSE),0)&IF(RC[1]=0,"","|"&ROUND(HLOOKUP(RC[-5],Sheet1!R2C9:R26C15,RC[-4]+13,FALSE)*RC[1],0))) -> 896400 | G211: 4 | H211: 0
A212: 2 | B212: 7 | C212: 30 | D212: 0 | E212: =HLOOKUP(RC[-4],Sheet1!R2C1:R26C7,RC[-3]+1,FALSE)&IF(RC[2]=0,"",IF(HLOOKUP(RC[-4],Sheet1!R2C9:R26C15,RC[-3]+1,FALSE)="","","|"&HLOOKUP(RC[-4],Sheet1!R2C9:R26C15,RC[-3]+1,FALSE))) -> 19003 | F212: =IF(HLOOKUP(RC[-5],Sheet1!R2C9:R26C15,RC[-4]+1,FALSE)="",ROUND(HLOOKUP(RC[-5],Sheet1!R2C1:R26C7,RC[-4]+13,FALSE)+HLOOKUP(RC[-5],Sheet1!R2C9:R26C15,RC[-4]+13,FALSE)*RC[1],0),ROUND(HLOOKUP(RC[-5],Sheet1!R2C1:R26C7,RC[-4]+13,FALSE),0)&IF(RC[1]=0,"","|"&ROUND(HLOOKUP(RC[-5],Sheet1!R2C9:R26C15,RC[-4]+13,FALSE)*RC[1],0))) -> 879800 | G212: 3 | H212: 0
A213: 2 | B213: 7 | C213: 20 | D213: 0 | E213: =HLOOKUP(RC[-4],Sheet1!R2C1:R26C7,RC[-3]+1,FALSE)&IF(RC[2]=0,"",IF(HLOOKUP(RC[-4],Sheet1!R2C9:R26C15,RC[-3]+1,FALSE)="","","|"&HLOOKUP(RC[-4],Sheet1!R2C9:R26C15,RC[-3]+1,FALSE))) -> 19003 | F213: =IF(HLOOKUP(RC[-5],Sheet1!R2C9:R26C15,RC[-4]+1,FALSE)="",ROUND(HLOOKUP(RC[-5],Sheet1!R2C1:R26C7,RC[-4]+13,FALSE)+HLOOKUP(RC[-5],Sheet1!R2C9:R26C15,RC[-4]+13,FALSE)*RC[1],0),ROUND(HLOOKUP(RC[-5],Sheet1!R2C1:R26C7,RC[-4]+13,FALSE),0)&IF(RC[1]=0,"","|"&ROUND(HLOOKUP(RC[-5],Sheet1!R2C9:R26C15,RC[-4]+13,FALSE)*RC[1],0))) -> 863200 | G213: 2 | H213: 0
A214: 2 | B214: 7 | C214: 10 | D214: 0 | E214: =HLOOKUP(RC[-4],Sheet1!R2C1:R26C7,RC[-3]+1,FALSE)&IF(RC[2]=0,"",IF(HLOOKUP(RC[-4],Sheet1!R2C9:R26C15,RC[-3]+1,FALSE)="","","|"&HLOOKUP(RC[-4],Sheet1!R2C9:R26C15,RC[-3]+1,FALSE))) -> 19003 | F214: =IF(HLOOKUP(RC[-5],Sheet1!R2C9:R26C15,RC[-4]+1,FALSE)="",ROUND(HLOOKUP(RC[-5],Sheet1!R2C1:R26C7,RC[-4]+13,FALSE)+HLOOKUP(RC[-5],Sheet1!R2C9:R26C15,RC[-4]+13,FALSE)*RC[1],0),ROUND(HLOOKUP(RC[-5],Sheet1!R2C1:R26C7,RC[-4]+13,FALSE),0)&IF(RC[1]=0,"","|"&ROUND(HLOOKUP(RC[-5],Sheet1!R2C9:R26C15,RC[-4]+13,FALSE)*RC[1],0))) -> 846600 | G214: 1 | H214: 0
A215: 2 | B215: 7 | C215: 0 | D215: 0 | E215: =HLOOKUP(RC[-4],Sheet1!R2C1:R26C7,RC[-3]+1,FALSE)&IF(RC[2]=0,"",IF(HLOOKUP(RC[-4],Sheet1!R2C9:R26C15,RC[-3]+1,FALSE)="","","|"&HLOOKUP(RC[-4],Sheet1!R2C9:R26C15,RC[-3]+1,FALSE))) -> 19003 | F215: =IF(HLOOKUP(RC[-5],Sheet1!R2C9:R26C15,RC[-4]+1,FALSE)="",ROUND(HLOOKUP(RC[-5],Sheet1!R2C1:R26C7,RC[-4]+13,FALSE)+HLOOKUP(RC[-5],Sheet1!R2C9:R26C15,RC[-4]+13,FALSE)*RC[1],0),ROUND(HLOOKUP(RC[-5],Sheet1!R2C1:R26C7,RC[-4]+13,FALSE),0)&IF(RC[1]=0,"","|"&ROUND(HLOOKUP(RC[-5],Sheet1!R2C9:R26C15,RC[-4]+13,FALSE)*RC[1],0))) -> 830000 | G215: 0 | H215: 0
A216: 2 | B216: =R[-11]C+1 -> 8 | C216: 100 | D216: 1 | E216: =HLOOKUP(RC[-4],Sheet1!R2C1:R26C7,RC[-3]+1,FALSE)&IF(RC[2]=0,"",IF(HLOOKUP(RC[-4],Sheet1!R2C9:R26C15,RC[-3]+1,FALSE)="","","|"&HLOOKUP(RC[-4],Sheet1!R2C9:R26C15,RC[-3]+1,FALSE))) -> 19003 | F216: =IF(HLOOKUP(RC[-5],Sheet1!R2C9:R26C15,RC[-4]+1,FALSE)="",ROUND(HLOOKUP(RC[-5],Sheet1!R2C1:R26C7,RC[-4]+13,FALSE)+HLOOKUP(RC[-5],Sheet1!R2C9:R26C15,RC[-4]+13,FALSE)*RC[1],0),ROUND(HLOOKUP(RC[-5],Sheet1!R2C1:R26C7,RC[-4]+13,FALSE),0)&IF(RC[1]=0,"","|"&ROUND(HLOOKUP(RC[-5],Sheet1!R2C9:R26C15,RC[-4]+13,FALSE)*RC[1],0))) -> 1201500 | G216: 10 | H216: 1
A217: 2 | B217: =R[-11]C+1 -> 8 | C217: 90 | D217: 0 | E217: =HLOOKUP(RC[-4],Sheet1!R2C1:R26C7,RC[-3]+1,FALSE)&IF(RC[2]=0,"",IF(HLOOKUP(RC[-4],Sheet1!R2C9:R26C15,RC[-3]+1,FALSE)="","","|"&HLOOKUP(RC[-4],Sheet1!R2C9:R26C15,RC[-3]+1,FALSE))) -> 19003 | F217: =IF(HLOOKUP(RC[-5],Sheet1!R2C9:R26C15,RC[-4]+1,FALSE)="",ROUND(HLOOKUP(RC[-5],Sheet1!R2C1:R26C7,RC[-4]+13,FALSE)+HLOOKUP(RC[-5],Sheet1!R2C9:R26C15,RC[-4]+13,FALSE)*RC[1],0),ROUND(HLOOKUP(RC[-5],Sheet1!R2C1:R26C7,RC[-4]+13,FALSE),0)&IF(RC[1]=0,"","|"&ROUND(HLOOKUP(RC[-5],Sheet1!R2C9:R26C15,RC[-4]+13,FALSE)*RC[1],0))) -> 1181475 | G217: 9 | H217: 0
A218: 2 | B218: =R[-11]C+1 -> 8 | C218: 80 | D218: 0 | E218: =HLOOKUP(RC[-4],Sheet1!R2C1:R26C7,RC[-3]+1,FALSE)&IF(RC[2]=0,"",IF(HLOOKUP(RC[-4],Sheet1!R2C9:R26C15,RC[-3]+1,FALSE)="","","|"&HLOOKUP(RC[-4],Sheet1!R2C9:R26C15,RC[-3]+1,FALSE))) -> 19003 | F218: =IF(HLOOKUP(RC[-5],Sheet1!R2C9:R26C15,RC[-4]+1,FALSE)="",ROUND(HLOOKUP(RC[-5],Sheet1!R2C1:R26C7,RC[-4]+13,FALSE)+HLOOKUP(RC[-5],Sheet1!R2C9:R26C15,RC[-4]+13,FALSE)*RC[1],0),ROUND(HLOOKUP(RC[-5],Sheet1!R2C1:R26C7,RC[-4]+13,FALSE),0)&IF(RC[1]=0,"","|"&ROUND(HLOOKUP(RC[-5],Sheet1!R2C9:R26C15,RC[-4]+13,FALSE)*RC[1],0))) -> 1161450 | G218: 8 | H218: 0
A219: 2 | B219: =R[-11]C+1 -> 8 | C219: 70 | D219: 0 | E219: =HLOOKUP(RC[-4],Sheet1!R2C1:R26C7,RC[-3]+1,FALSE)&IF(RC[2]=0,"",IF(HLOOKUP(RC[-4],Sheet1!R2C9:R26C15,RC[-3]+1,FALSE)="","","|"&HLOOKUP(RC[-4],Sheet1!R2C9:R26C15,RC[-3]+1,FALSE))) -> 19003 | F219: =IF(HLOOKUP(RC[-5],Sheet1!R2C9:R26C15,RC[-4]+1,FALSE)="",ROUND(HLOOKUP(RC[-5],Sheet1!R2C1:R26C7,RC[-4]+13,FALSE)+HLOOKUP(RC[-5],Sheet1!R2C9:R26C15,RC[-4]+13,FALSE)*RC[1],0),ROUND(HLOOKUP(RC[-5],Sheet1!R2C1:R26C7,RC[-4]+13,FALSE),0)&IF(RC[1]=0,"","|"&ROUND(HLOOKUP(RC[-5],Sheet1!R2C9:R26C15,RC[-4]+13,FALSE)*RC[1],0))) -> 1141425 | G219: 7 | H219: 0
A220: 2 | B220: =R[-11]C+1 -> 8 | C220: 60 | D220: 0 | E220: =HLOOKUP(RC[-4],Sheet1!R2C1:R26C7,RC[-3]+1,FALSE)&IF(RC[2]=0,"",IF(HLOOKUP(RC[-4],Sheet1!R2C9:R26C15,RC[-3]+1,FALSE)="","","|"&HLOOKUP(RC[-4],Sheet1!R2C9:R26C15,RC[-3]+1,FALSE))) -> 19003 | F220: =IF(HLOOKUP(RC[-5],Sheet1!R2C9:R26C15,RC[-4]+1,FALSE)="",ROUND(HLOOKUP(RC[-5],Sheet1!R2C1:R26C7,RC[-4]+13,FALSE)+HLOOKUP(RC[-5],Sheet1!R2C9:R26C15,RC[-4]+13,FALSE)*RC[1],0),ROUND(HLOOKUP(RC[-5],Sheet1!R2C1:R26C7,RC[-4]+13,FALSE),0)&IF(RC[1]=0,"","|"&ROUND(HLOOKUP(RC[-5],Sheet1!R2C9:R26C15,RC[-4]+13,FALSE)*RC[1],0))) -> 1121400 | G220: 6 | H220: 0
A221: 2 | B221: =R[-11]C+1 -> 8 | C221: 50 | D221: 0 | E221: =HLOOKUP(RC[-4],Sheet1!R2C1:R26C7,RC[-3]+1,FALSE)&IF(RC[2]=0,"",IF(HLOOKUP(RC[-4],Sheet1!R2C9:R26C15,RC[-3]+1,FALSE)="","","|"&HLOOKUP(RC[-4],Sheet1!R2C9:R26C15,RC[-3]+1,FALSE))) -> 19003 | F221: =IF(HLOOKUP(RC[-5],Sheet1!R2C9:R26C15,RC[-4]+1,FALSE)="",ROUND(HLOOKUP(RC[-5],Sheet1!R2C1:R26C7,RC[-4]+13,FALSE)+HLOOKUP(RC[-5],Sheet1!R2C9:R26C15,RC[-4]+13,FALSE)*RC[1],0),ROUND(HLOOKUP(RC[-5],Sheet1!R2C1:R26C7,RC[-4]+13,FALSE),0)&IF(RC[1]=0,"","|"&ROUND(HLOOKUP(RC[-5],Sheet1!R2C9:R26C15,RC[-4]+13,FALSE)*RC[1],0))) -> 1101375 | G221: 5 | H221: 0
A222: 2 | B222: =R[-11]C+1 -> 8 | C222: 40 | D222: 0 | E222: =HLOOKUP(RC[-4],Sheet1!R2C1:R26C7,RC[-3]+1,FALSE)&IF(RC[2]=0,"",IF(HLOOKUP(RC[-4],Sheet1!R2C9:R26C15,RC[-3]+1,FALSE)="","","|"&HLOOKUP(RC[-4],Sheet1!R2C9:R26C15,RC[-3]+1,FALSE))) -> 19003 | F222: =IF(HLOOKUP(RC[-5],Sheet1!R2C9:R26C15,RC[-4]+1,FALSE)="",ROUND(HLOOKUP(RC[-5],Sheet1!R2C1:R26C7,RC[-4]+13,FALSE)+HLOOKUP(RC[-5],Sheet1!R2C9:R26C15,RC[-4]+13,FALSE)*RC[1],0),ROUND(HLOOKUP(RC[-5],Sheet1!R2C1:R26C7,RC[-4]+13,FALSE),0)&IF(RC[1]=0,"","|"&ROUND(HLOOKUP(RC[-5],Sheet1!R2C9:R26C15,RC[-4]+13,FALSE)*RC[1],0))) -> 1081350 | G222: 4 | H222: 0
A223: 2 | B223: =R[-11]C+1 -> 8 | C223: 30 | D223: 0 | E223: =HLOOKUP(RC[-4],Sheet1!R2C1:R26C7,RC[-3]+1,FALSE)&IF(RC[2]=0,"",IF(HLOOKUP(RC[-4],Sheet1!R2C9:R26C15,RC[-3]+1,FALSE)="","","|"&HLOOKUP(RC[-4],Sheet1!R2C9:R26C15,RC[-3]+1,FALSE))) -> 19003 | F223: =IF(HLOOKUP(RC[-5],Sheet1!R2C9:R26C15,RC[-4]+1,FALSE)="",ROUND(HLOOKUP(RC[-5],Sheet1!R2C1:R26C7,RC[-4]+13,FALSE)+HLOOKUP(RC[-5],Sheet1!R2C9:R26C15,RC[-4]+13,FALSE)*RC[1],0),ROUND(HLOOKUP(RC[-5],Sheet1!R2C1:R26C7,RC[-4]+13,FALSE),0)&IF(RC[1]=0,"","|"&ROUND(HLOOKUP(RC[-5],Sheet1!R2C9:R26C15,RC[-4]+13,FALSE)*RC[1],0))) -> 1061325 | G223: 3 | H223: 0
A224: 2 | B224: =R[-11]C+1 -> 8 | C224: 20 | D224: 0 | E224: =HLOOKUP(RC[-4],Sheet1!R2C1:R26C7,RC[-3]+1,FALSE)&IF(RC[2]=0,"",IF(HLOOKUP(RC[-4],Sheet1!R2C9:R26C15,RC[-3]+1,FALSE)="","","|"&HLOOKUP(RC[-4],Sheet1!R2C9:R26C15,RC[-3]+1,FALSE))) -> 19003 | F224: =IF(HLOOKUP(RC[-5],Sheet1!R2C9:R26C15,RC[-4]+1,FALSE)="",ROUND(HLOOKUP(RC[-5],Sheet1!R2C1:R26C7,RC[-4]+13,FALSE)+HLOOKUP(RC[-5],Sheet1!R2C9:R26C15,RC[-4]+13,FALSE)*RC[1],0),ROUND(HLOOKUP(RC[-5],Sheet1!R2C1:R26C7,RC[-4]+13,FALSE),0)&IF(RC[1]=0,"","|"&ROUND(HLOOKUP(RC[-5],Sheet1!R2C9:R26C15,RC[-4]+13,FALSE)*RC[1],0))) -> 1041300 | G224: 2 | H224: 0
A225: 2 | B225: =R[-11]C+1 -> 8 | C225: 10 | D225: 0 | E225: =HLOOKUP(RC[-4],Sheet1!R2C1:R26C7,RC[-3]+1,FALSE)&IF(RC[2]=0,"",IF(HLOOKUP(RC[-4],Sheet1!R2C9:R26C15,RC[-3]+1,FALSE)="","","|"&HLOOKUP(RC[-4],Sheet1!R2C9:R26C15,RC[-3]+1,FALSE))) -> 19003 | F225: =IF(HLOOKUP(RC[-5],Sheet1!R2C9:R26C15,RC[-4]+1,FALSE)="",ROUND(HLOOKUP(RC[-5],Sheet1!R2C1:R26C7,RC[-4]+13,FALSE)+HLOOKUP(RC[-5],Sheet1!R2C9:R26C15,RC[-4]+13,FALSE)*RC[1],0),ROUND(HLOOKUP(RC[-5],Sheet1!R2C1:R26C7,RC[-4]+13,FALSE),0)&IF(RC[1]=0,"","|"&ROUND(HLOOKUP(RC[-5],Sheet1!R2C9:R26C15,RC[-4]+13,FALSE)*RC[1],0))) -> 1021275 | G225: 1 | H225: 0
A226: 2 | B226: =R[-11]C+1 -> 8 | C226: 0 | D226: 0 | E226: =HLOOKUP(RC[-4],Sheet1!R2C1:R26C7,RC[-3]+1,FALSE)&IF(RC[2]=0,"",IF(HLOOKUP(RC[-4],Sheet1!R2C9:R26C15,RC[-3]+1,FALSE)="","","|"&HLOOKUP(RC[-4],Sheet1!R2C9:R26C15,RC[-3]+1,FALSE))) -> 19003 | F226: =IF(HLOOKUP(RC[-5],Sheet1!R2C9:R26C15,RC[-4]+1,FALSE)="",ROUND(HLOOKUP(RC[-5],Sheet1!R2C1:R26C7,RC[-4]+13,FALSE)+HLOOKUP(RC[-5],Sheet1!R2C9:R26C15,RC[-4]+13,FALSE)*RC[1],0),ROUND(HLOOKUP(RC[-5],Sheet1!R2C1:R26C7,RC[-4]+13,FALSE),0)&IF(RC[1]=0,"","|"&ROUND(HLOOKUP(RC[-5],Sheet1!R2C9:R26C15,RC[-4]+13,FALSE)*RC[1],0))) -> 1001250 | G226: 0 | H226: 0
A227: 2 | B227: =R[-11]C+1 -> 9 | C227: 100 | D227: 1 | E227: =HLOOKUP(RC[-4],Sheet1!R2C1:R26C7,RC[-3]+1,FALSE)&IF(RC[2]=0,"",IF(HLOOKUP(RC[-4],Sheet1!R2C9:R26C15,RC[-3]+1,FALSE)="","","|"&HLOOKUP(RC[-4],Sheet1!R2C9:R26C15,RC[-3]+1,FALSE))) -> 19003 | F227: =IF(HLOOKUP(RC[-5],Sheet1!R2C9:R26C15,RC[-4]+1,FALSE)="",ROUND(HLOOKUP(RC[-5],Sheet1!R2C1:R26C7,RC[-4]+13,FALSE)+HLOOKUP(RC[-5],Sheet1!R2C9:R26C15,RC[-4]+13,FALSE)*RC[1],0),ROUND(HLOOKUP(RC[-5],Sheet1!R2C1:R26C7,RC[-4]+13,FALSE),0)&IF(RC[1]=0,"","|"&ROUND(HLOOKUP(RC[-5],Sheet1!R2C9:R26C15,RC[-4]+13,FALSE)*RC[1],0))) -> 1425000 | G227: 10 | H227: 1
A228: 2 | B228: =R[-11]C+1 -> 9 | C228: 90 | D228: 0 | E228: =HLOOKUP(RC[-4],Sheet1!R2C1:R26C7,RC[-3]+1,FALSE)&IF(RC[2]=0,"",IF(HLOOKUP(RC[-4],Sheet1!R2C9:R26C15,RC[-3]+1,FALSE)="","","|"&HLOOKUP(RC[-4],Sheet1!R2C9:R26C15,RC[-3]+1,FALSE))) -> 19003 | F228: =IF(HLOOKUP(RC[-5],Sheet1!R2C9:R26C15,RC[-4]+1,FALSE)="",ROUND(HLOOKUP(RC[-5],Sheet1!R2C1:R26C7,RC[-4]+13,FALSE)+HLOOKUP(RC[-5],Sheet1!R2C9:R26C15,RC[-4]+13,FALSE)*RC[1],0),ROUND(HLOOKUP(RC[-5],Sheet1!R2C1:R26C7,RC[-4]+13,FALSE),0)&IF(RC[1]=0,"","|"&ROUND(HLOOKUP(RC[-5],Sheet1!R2C9:R26C15,RC[-4]+13,FALSE)*RC[1],0))) -> 1401250 | G228: 9 | H228: 0
A229: 2 | B229: =R[-11]C+1 -> 9 | C229: 80 | D229: 0 | E229: =HLOOKUP(RC[-4],Sheet1!R2C1:R26C7,RC[-3]+1,FALSE)&IF(RC[2]=0,"",IF(HLOOKUP(RC[-4],Sheet1!R2C9:R26C15,RC[-3]+1,FALSE)="","","|"&HLOOKUP(RC[-4],Sheet1!R2C9:R26C15,RC[-3]+1,FALSE))) -> 19003 | F229: =IF(HLOOKUP(RC[-5],Sheet1!R2C9:R26C15,RC[-4]+1,FALSE)="",ROUND(HLOOKUP(RC[-5],Sheet1!R2C1:R26C7,RC[-4]+13,FALSE)+HLOOKUP(RC[-5],Sheet1!R2C9:R26C15,RC[-4]+13,FALSE)*RC[1],0),ROUND(HLOOKUP(RC[-5],Sheet1!R2C1:R26C7,RC[-4]+13,FALSE),0)&IF(RC[1]=0,"","|"&ROUND(HLOOKUP(RC[-5],Sheet1!R2C9:R26C15,RC[-4]+13,FALSE)*RC[1],0))) -> 1377500 | G229: 8 | H229: 0
A230: 2 | B230: =R[-11]C+1 -> 9 | C230: 70 | D230: 0 | E230: =HLOOKUP(RC[-4],Sheet1!R2C1:R26C7,RC[-3]+1,FALSE)&IF(RC[2]=0,"",IF(HLOOKUP(RC[-4],Sheet1!R2C9:R26C15,RC[-3]+1,FALSE)="","","|"&HLOOKUP(RC[-4],Sheet1!R2C9:R26C15,RC[-3]+1,FALSE))) -> 19003 | F230: =IF(HLOOKUP(RC[-5],Sheet1!R2C9:R26C15,RC[-4]+1,FALSE)="",ROUND(HLOOKUP(RC[-5],Sheet1!R2C1:R26C7,RC[-4]+13,FALSE)+HLOOKUP(RC[-5],Sheet1!R2C9:R26C15,RC[-4]+13,FALSE)*RC[1],0),ROUND(HLOOKUP(RC[-5],Sheet1!R2C1:R26C7,RC[-4]+13,FALSE),0)&IF(RC[1]=0,"","|"&ROUND(HLOOKUP(RC[-5],Sheet1!R2C9:R26C15,RC[-4]+13,FALSE)*RC[1],0))) -> 1353750 | G230: 7 | H230: 0
A231: 2 | B231: =R[-11]C+1 -> 9 | C231: 60 | D231: 0 | E231: =HLOOKUP(RC[-4],Sheet1!R2C1:R26C7,RC[-3]+1,FALSE)&IF(RC[2]=0,"",IF(HLOOKUP(RC[-4],Sheet1!R2C9:R26C15,RC[-3]+1,FALSE)="","","|"&HLOOKUP(RC[-4],Sheet1!R2C9:R26C15,RC[-3]+1,FALSE))) -> 19003 | F231: =IF(HLOOKUP(RC[-5],Sheet1!R2C9:R26C15,RC[-4]+1,FALSE)="",ROUND(HLOOKUP(RC[-5],Sheet1!R2C1:R26C7,RC[-4]+13,FALSE)+HLOOKUP(RC[-5],Sheet1!R2C9:R26C15,RC[-4]+13,FALSE)*RC[1],0),ROUND(HLOOKUP(RC[-5],Sheet1!R2C1:R26C7,RC[-4]+13,FALSE),0)&IF(RC[1]=0,"","|"&ROUND(HLOOKUP(RC[-5],Sheet1!R2C9:R26C15,RC[-4]+13,FALSE)*RC[1],0))) -> 1330000 | G231: 6 | H231: 0
A232: 2 | B232: =R[-11]C+1 -> 9 | C232: 50 | D232: 0 | E232: =HLOOKUP(RC[-4],Sheet1!R2C1:R26C7,RC[-3]+1,FALSE)&IF(RC[2]=0,"",IF(HLOOKUP(RC[-4],Sheet1!R2C9:R26C15,RC[-3]+1,FALSE)="","","|"&HLOOKUP(RC[-4],Sheet1!R2C9:R26C15,RC[-3]+1,FALSE))) -> 19003 | F232: =IF(HLOOKUP(RC[-5],Sheet1!R2C9:R26C15,RC[-4]+1,FALSE)="",ROUND(HLOOKUP(RC[-5],Sheet1!R2C1:R26C7,RC[-4]+13,FALSE)+HLOOKUP(RC[-5],Sheet1!R2C9:R26C15,RC[-4]+13,FALSE)*RC[1],0),ROUND(HLOOKUP(RC[-5],Sheet1!R2C1:R26C7,RC[-4]+13,FALSE),0)&IF(RC[1]=0,"","|"&ROUND(HLOOKUP(RC[-5],Sheet1!R2C9:R26C15,RC[-4]+13,FALSE)*RC[1],0))) -> 1306250 | G232: 5 | H232: 0
A233: 2 | B233: =R[-11]C+1 -> 9 | C233: 40 | D233: 0 | E233: =HLOOKUP(RC[-4],Sheet1!R2C1:R26C7,RC[-3]+1,FALSE)&IF(RC[2]=0,"",IF(HLOOKUP(RC[-4],Sheet1!R2C9:R26C15,RC[-3]+1,FALSE)="","","|"&HLOOKUP(RC[-4],Sheet1!R2C9:R26C15,RC[-3]+1,FALSE))) -> 19003 | F233: =IF(HLOOKUP(RC[-5],Sheet1!R2C9:R26C15,RC[-4]+1,FALSE)="",ROUND(HLOOKUP(RC[-5],Sheet1!R2C1:R26C7,RC[-4]+13,FALSE)+HLOOKUP(RC[-5],Sheet1!R2C9:R26C15,RC[-4]+13,FALSE)*RC[1],0),ROUND(HLOOKUP(RC[-5],Sheet1!R2C1:R26C7,RC[-4]+13,FALSE),0)&IF(RC[1]=0,"","|"&ROUND(HLOOKUP(RC[-5],Sheet1!R2C9:R26C15,RC[-4]+13,FALSE)*RC[1],0))) -> 1282500 | G233: 4 | H233: 0
A234: 2 | B234: =R[-11]C+1 -> 9 | C234: 30 | D234: 0 | E234: =HLOOKUP(RC[-4],Sheet1!R2C1:R26C7,RC[-3]+1,FALSE)&IF(RC[2]=0,"",IF(HLOOKUP(RC[-4],Sheet1!R2C9:R26C15,RC[-3]+1,FALSE)="","","|"&HLOOKUP(RC[-4],Sheet1!R2C9:R26C15,RC[-3]+1,FALSE))) -> 19003 | F234: =IF(HLOOKUP(RC[-5],Sheet1!R2C9:R26C15,RC[-4]+1,FALSE)="",ROUND(HLOOKUP(RC[-5],Sheet1!R2C1:R26C7,RC[-4]+13,FALSE)+HLOOKUP(RC[-5],Sheet1!R2C9:R26C15,RC[-4]+13,FALSE)*RC[1],0),ROUND(HLOOKUP(RC[-5],Sheet1!R2C1:R26C7,RC[-4]+13,FALSE),0)&IF(RC[1]=0,"","|"&ROUND(HLOOKUP(RC[-5],Sheet1!R2C9:R26C15,RC[-4]+13,FALSE)*RC[1],0))) -> 1258750 | G234: 3 | H234: 0
A235: 2 | B235: =R[-11]C+1 -> 9 | C235: 20 | D235: 0 | E235: =HLOOKUP(RC[-4],Sheet1!R2C1:R26C7,RC[-3]+1,FALSE)&IF(RC[2]=0,"",IF(HLOOKUP(RC[-4],Sheet1!R2C9:R26C15,RC[-3]+1,FALSE)="","","|"&HLOOKUP(RC[-4],Sheet1!R2C9:R26C15,RC[-3]+1,FALSE))) -> 19003 | F235: =IF(HLOOKUP(RC[-5],Sheet1!R2C9:R26C15,RC[-4]+1,FALSE)="",ROUND(HLOOKUP(RC[-5],Sheet1!R2C1:R26C7,RC[-4]+13,FALSE)+HLOOKUP(RC[-5],Sheet1!R2C9:R26C15,RC[-4]+13,FALSE)*RC[1],0),ROUND(HLOOKUP(RC[-5],Sheet1!R2C1:R26C7,RC[-4]+13,FALSE),0)&IF(RC[1]=0,"","|"&ROUND(HLOOKUP(RC[-5],Sheet1!R2C9:R26C15,RC[-4]+13,FALSE)*RC[1],0))) -> 1235000 | G235: 2 | H235: 0
A236: 2 | B236: =R[-11]C+1 -> 9 | C236: 10 | D236: 0 | E236: =HLOOKUP(RC[-4],Sheet1!R2C1:R26C7,RC[-3]+1,FALSE)&IF(RC[2]=0,"",IF(HLOOKUP(RC[-4],Sheet1!R2C9:R26C15,RC[-3]+1,FALSE)="","","|"&HLOOKUP(RC[-4],Sheet1!R2C9:R26C15,RC[-3]+1,FALSE))) -> 19003 | F236: =IF(HLOOKUP(RC[-5],Sheet1!R2C9:R26C15,RC[-4]+1,FALSE)="",ROUND(HLOOKUP(RC[-5],Sheet1!R2C1:R26C7,RC[-4]+13,FALSE)+HLOOKUP(RC[-5],Sheet1!R2C9:R26C15,RC[-4]+13,FALSE)*RC[1],0),ROUND(HLOOKUP(RC[-5],Sheet1!R2C1:R26C7,RC[-4]+13,FALSE),0)&IF(RC[1]=0,"","|"&ROUND(HLOOKUP(RC[-5],Sheet1!R2C9:R26C15,RC[-4]+13,FALSE)*RC[1],0))) -> 1211250 | G236: 1 | H236: 0
A237: 2 | B237: =R[-11]C+1 -> 9 | C237: 0 | D237: 0 | E237: =HLOOKUP(RC[-4],Sheet1!R2C1:R26C7,RC[-3]+1,FALSE)&IF(RC[2]=0,"",IF(HLOOKUP(RC[-4],Sheet1!R2C9:R26C15,RC[-3]+1,FALSE)="","","|"&HLOOKUP(RC[-4],Sheet1!R2C9:R26C15,RC[-3]+1,FALSE))) -> 19003 | F237: =IF(HLOOKUP(RC[-5],Sheet1!R2C9:R26C15,RC[-4]+1,FALSE)="",ROUND(HLOOKUP(RC[-5],Sheet1!R2C1:R26C7,RC[-4]+13,FALSE)+HLOOKUP(RC[-5],Sheet1!R2C9:R26C15,RC[-4]+13,FALSE)*RC[1],0),ROUND(HLOOKUP(RC[-5],Sheet1!R2C1:R26C7,RC[-4]+13,FALSE),0)&IF(RC[1]=0,"","|"&ROUND(HLOOKUP(RC[-5],Sheet1!R2C9:R26C15,RC[-4]+13,FALSE)*RC[1],0))) -> 1187500 | G237: 0 | H237: 0
A238: 2 | B238: =R[-11]C+1 -> 10 | C238: 100 | D238: 1 | E238: =HLOOKUP(RC[-4],Sheet1!R2C1:R26C7,RC[-3]+1,FALSE)&IF(RC[2]=0,"",IF(HLOOKUP(RC[-4],Sheet1!R2C9:R26C15,RC[-3]+1,FALSE)="","","|"&HLOOKUP(RC[-4],Sheet1!R2C9:R26C15,RC[-3]+1,FALSE))) -> 19003 | F238: =IF(HLOOKUP(RC[-5],Sheet1!R2C9:R26C15,RC[-4]+1,FALSE)="",ROUND(HLOOKUP(RC[-5],Sheet1!R2C1:R26C7,RC[-4]+13,FALSE)+HLOOKUP(RC[-5],Sheet1!R2C9:R26C15,RC[-4]+13,FALSE)*RC[1],0),ROUND(HLOOKUP(RC[-5],Sheet1!R2C1:R26C7,RC[-4]+13,FALSE),0)&IF(RC[1]=0,"","|"&ROUND(HLOOKUP(RC[-5],Sheet1!R2C9:R26C15,RC[-4]+13,FALSE)*RC[1],0))) -> 1818000 | G238: 10 | H238: 1
A239: 2 | B239: =R[-11]C+1 -> 10 | C239: 90 | D239: 0 | E239: =HLOOKUP(RC[-4],Sheet1!R2C1:R26C7,RC[-3]+1,FALSE)&IF(RC[2]=0,"",IF(HLOOKUP(RC[-4],Sheet1!R2C9:R26C15,RC[-3]+1,FALSE)="","","|"&HLOOKUP(RC[-4],Sheet1!R2C9:R26C15,RC[-3]+1,FALSE))) -> 19003 | F239: =IF(HLOOKUP(RC[-5],Sheet1!R2C9:R26C15,RC[-4]+1,FALSE)="",ROUND(HLOOKUP(RC[-5],Sheet1!R2C1:R26C7,RC[-4]+13,FALSE)+HLOOKUP(RC[-5],Sheet1!R2C9:R26C15,RC[-4]+13,FALSE)*RC[1],0),ROUND(HLOOKUP(RC[-5],Sheet1!R2C1:R26C7,RC[-4]+13,FALSE),0)&IF(RC[1]=0,"","|"&ROUND(HLOOKUP(RC[-5],Sheet1!R2C9:R26C15,RC[-4]+13,FALSE)*RC[1],0))) -> 1787700 | G239: 9 | H239: 0
A240: 2 | B240: =R[-11]C+1 -> 10 | C240: 80 | D240: 0 | E240: =HLOOKUP(RC[-4],Sheet1!R2C1:R26C7,RC[-3]+1,FALSE)&IF(RC[2]=0,"",IF(HLOOKUP(RC[-4],Sheet1!R2C9:R26C15,RC[-3]+1,FALSE)="","","|"&HLOOKUP(RC[-4],Sheet1!R2C9:R26C15,RC[-3]+1,FALSE))) -> 19003 | F240: =IF(HLOOKUP(RC[-5],Sheet1!R2C9:R26C15,RC[-4]+1,FALSE)="",ROUND(HLOOKUP(RC[-5],Sheet1!R2C1:R26C7,RC[-4]+13,FALSE)+HLOOKUP(RC[-5],Sheet1!R2C9:R26C15,RC[-4]+13,FALSE)*RC[1],0),ROUND(HLOOKUP(RC[-5],Sheet1!R2C1:R26C7,RC[-4]+13,FALSE),0)&IF(RC[1]=0,"","|"&ROUND(HLOOKUP(RC[-5],Sheet1!R2C9:R26C15,RC[-4]+13,FALSE)*RC[1],0))) -> 1757400 | G240: 8 | H240: 0
A241: 2 | B241: =R[-11]C+1 -> 10 | C241: 70 | D241: 0 | E241: =HLOOKUP(RC[-4],Sheet1!R2C1:R26C7,RC[-3]+1,FALSE)&IF(RC[2]=0,"",IF(HLOOKUP(RC[-4],Sheet1!R2C9:R26C15,RC[-3]+1,FALSE)="","","|"&HLOOKUP(RC[-4],Sheet1!R2C9:R26C15,RC[-3]+1,FALSE))) -> 19003 | F241: =IF(HLOOKUP(RC[-5],Sheet1!R2C9:R26C15,RC[-4]+1,FALSE)="",ROUND(HLOOKUP(RC[-5],Sheet1!R2C1:R26C7,RC[-4]+13,FALSE)+HLOOKUP(RC[-5],Sheet1!R2C9:R26C15,RC[-4]+13,FALSE)*RC[1],0),ROUND(HLOOKUP(RC[-5],Sheet1!R2C1:R26C7,RC[-4]+13,FALSE),0)&IF(RC[1]=0,"","|"&ROUND(HLOOKUP(RC[-5],Sheet1!R2C9:R26C15,RC[-4]+13,FALSE)*RC[1],0))) -> 1727100 | G241: 7 | H241: 0
A242: 2 | B242: =R[-11]C+1 -> 10 | C242: 60 | D242: 0 | E242: =HLOOKUP(RC[-4],Sheet1!R2C1:R26C7,RC[-3]+1,FALSE)&IF(RC[2]=0,"",IF(HLOOKUP(RC[-4],Sheet1!R2C9:R26C15,RC[-3]+1,FALSE)="","","|"&HLOOKUP(RC[-4],Sheet1!R2C9:R26C15,RC[-3]+1,FALSE))) -> 19003 | F242: =IF(HLOOKUP(RC[-5],Sheet1!R2C9:R26C15,RC[-4]+1,FALSE)="",ROUND(HLOOKUP(RC[-5],Sheet1!R2C1:R26C7,RC[-4]+13,FALSE)+HLOOKUP(RC[-5],Sheet1!R2C9:R26C15,RC[-4]+13,FALSE)*RC[1],0),ROUND(HLOOKUP(RC[-5],Sheet1!R2C1:R26C7,RC[-4]+13,FALSE),0)&IF(RC[1]=0,"","|"&ROUND(HLOOKUP(RC[-5],Sheet1!R2C9:R26C15,RC[-4]+13,FALSE)*RC[1],0))) -> 1696800 | G242: 6 | H242: 0
A243: 2 | B243: =R[-11]C+1 -> 10 | C243: 50 | D243: 0 | E243: =HLOOKUP(RC[-4],Sheet1!R2C1:R26C7,RC[-3]+1,FALSE)&IF(RC[2]=0,"",IF(HLOOKUP(RC[-4],Sheet1!R2C9:R26C15,RC[-3]+1,FALSE)="","","|"&HLOOKUP(RC[-4],Sheet1!R2C9:R26C15,RC[-3]+1,FALSE))) -> 19003 | F243: =IF(HLOOKUP(RC[-5],Sheet1!R2C9:R26C15,RC[-4]+1,FALSE)="",ROUND(HLOOKUP(RC[-5],Sheet1!R2C1:R26C7,RC[-4]+13,FALSE)+HLOOKUP(RC[-5],Sheet1!R2C9:R26C15,RC[-4]+13,FALSE)*RC[1],0),ROUND(HLOOKUP(RC[-5],Sheet1!R2C1:R26C7,RC[-4]+13,FALSE),0)&IF(RC[1]=0,"","|"&ROUND(HLOOKUP(RC[-5],Sheet1!R2C9:R26C15,RC[-4]+13,FALSE)*RC[1],0))) -> 1666500 | G243: 5 | H243: 0
A244: 2 | B244: =R[-11]C+1 -> 10 | C244: 40 | D244: 0 | E244: =HLOOKUP(RC[-4],Sheet1!R2C1:R26C7,RC[-3]+1,FALSE)&IF(RC[2]=0,"",IF(HLOOKUP(RC[-4],Sheet1!R2C9:R26C15,RC[-3]+1,FALSE)="","","|"&HLOOKUP(RC[-4],Sheet1!R2C9:R26C15,RC[-3]+1,FALSE))) -> 19003 | F244: =IF(HLOOKUP(RC[-5],Sheet1!R2C9:R26C15,RC[-4]+1,FALSE)="",ROUND(HLOOKUP(RC[-5],Sheet1!R2C1:R26C7,RC[-4]+13,FALSE)+HLOOKUP(RC[-5],Sheet1!R2C9:R26C15,RC[-4]+13,FALSE)*RC[1],0),ROUND(HLOOKUP(RC[-5],Sheet1!R2C1:R26C7,RC[-4]+13,FALSE),0)&IF(RC[1]=0,"","|"&ROUND(HLOOKUP(RC[-5],Sheet1!R2C9:R26C15,RC[-4]+13,FALSE)*RC[1],0))) -> 1636200 | G244: 4 | H244: 0
A245: 2 | B245: =R[-11]C+1 -> 10 | C245: 30 | D245: 0 | E245: =HLOOKUP(RC[-4],Sheet1!R2C1:R26C7,RC[-3]+1,FALSE)&IF(RC[2]=0,"",IF(HLOOKUP(RC[-4],Sheet1!R2C9:R26C15,RC[-3]+1,FALSE)="","","|"&HLOOKUP(RC[-4],Sheet1!R2C9:R26C15,RC[-3]+1,FALSE))) -> 19003 | F245: =IF(HLOOKUP(RC[-5],Sheet1!R2C9:R26C15,RC[-4]+1,FALSE)="",ROUND(HLOOKUP(RC[-5],Sheet1!R2C1:R26C7,RC[-4]+13,FALSE)+HLOOKUP(RC[-5],Sheet1!R2C9:R26C15,RC[-4]+13,FALSE)*RC[1],0),ROUND(HLOOKUP(RC[-5],Sheet1!R2C1:R26C7,RC[-4]+13,FALSE),0)&IF(RC[1]=0,"","|"&ROUND(HLOOKUP(RC[-5],Sheet1!R2C9:R26C15,RC[-4]+13,FALSE)*RC[1],0))) -> 1605900 | G245: 3 | H245: 0
A246: 2 | B246: =R[-11]C+1 -> 10 | C246: 20 | D246: 0 | E246: =HLOOKUP(RC[-4],Sheet1!R2C1:R26C7,RC[-3]+1,FALSE)&IF(RC[2]=0,"",IF(HLOOKUP(RC[-4],Sheet1!R2C9:R26C15,RC[-3]+1,FALSE)="","","|"&HLOOKUP(RC[-4],Sheet1!R2C9:R26C15,RC[-3]+1,FALSE))) -> 19003 | F246: =IF(HLOOKUP(RC[-5],Sheet1!R2C9:R26C15,RC[-4]+1,FALSE)="",ROUND(HLOOKUP(RC[-5],Sheet1!R2C1:R26C7,RC[-4]+13,FALSE)+HLOOKUP(RC[-5],Sheet1!R2C9:R26C15,RC[-4]+13,FALSE)*RC[1],0),ROUND(HLOOKUP(RC[-5],Sheet1!R2C1:R26C7,RC[-4]+13,FALSE),0)&IF(RC[1]=0,"","|"&ROUND(HLOOKUP(RC[-5],Sheet1!R2C9:R26C15,RC[-4]+13,FALSE)*RC[1],0))) -> 1575600 | G246: 2 | H246: 0
A247: 2 | B247: =R[-11]C+1 -> 10 | C247: 10 | D247: 0 | E247: =HLOOKUP(RC[-4],Sheet1!R2C1:R26C7,RC[-3]+1,FALSE)&IF(RC[2]=0,"",IF(HLOOKUP(RC[-4],Sheet1!R2C9:R26C15,RC[-3]+1,FALSE)="","","|"&HLOOKUP(RC[-4],Sheet1!R2C9:R26C15,RC[-3]+1,FALSE))) -> 19003 | F247: =IF(HLOOKUP(RC[-5],Sheet1!R2C9:R26C15,RC[-4]+1,FALSE)="",ROUND(HLOOKUP(RC[-5],Sheet1!R2C1:R26C7,RC[-4]+13,FALSE)+HLOOKUP(RC[-5],Sheet1!R2C9:R26C15,RC[-4]+13,FALSE)*RC[1],0),ROUND(HLOOKUP(RC[-5],Sheet1!R2C1:R26C7,RC[-4]+13,FALSE),0)&IF(RC[1]=0,"","|"&ROUND(HLOOKUP(RC[-5],Sheet1!R2C9:R26C15,RC[-4]+13,FALSE)*RC[1],0))) -> 1545300 | G247: 1 | H247: 0
A248: 2 | B248: =R[-11]C+1 -> 10 | C248: 0 | D248: 0 | E248: =HLOOKUP(RC[-4],Sheet1!R2C1:R26C7,RC[-3]+1,FALSE)&IF(RC[2]=0,"",IF(HLOOKUP(RC[-4],Sheet1!R2C9:R26C15,RC[-3]+1,FALSE)="","","|"&HLOOKUP(RC[-4],Sheet1!R2C9:R26C15,RC[-3]+1,FALSE))) -> 19003 | F248: =IF(HLOOKUP(RC[-5],Sheet1!R2C9:R26C15,RC[-4]+1,FALSE)="",ROUND(HLOOKUP(RC[-5],Sheet1!R2C1:R26C7,RC[-4]+13,FALSE)+HLOOKUP(RC[-5],Sheet1!R2C9:R26C15,RC[-4]+13,FALSE)*RC[1],0),ROUND(HLOOKUP(RC[-5],Sheet1!R2C1:R26C7,RC[-4]+13,FALSE),0)&IF(RC[1]=0,"","|"&ROUND(HLOOKUP(RC[-5],Sheet1!R2C9:R26C15,RC[-4]+13,FALSE)*RC[1],0))) -> 1515000 | G248: 0 | H248: 0
A249: 2 | B249: =R[-11]C+1 -> 11 | C249: 100 | D249: 1 | E249: =HLOOKUP(RC[-4],Sheet1!R2C1:R26C7,RC[-3]+1,FALSE)&IF(RC[2]=0,"",IF(HLOOKUP(RC[-4],Sheet1!R2C9:R26C15,RC[-3]+1,FALSE)="","","|"&HLOOKUP(RC[-4],Sheet1!R2C9:R26C15,RC[-3]+1,FALSE))) -> 19003 | F249: =IF(HLOOKUP(RC[-5],Sheet1!R2C9:R26C15,RC[-4]+1,FALSE)="",ROUND(HLOOKUP(RC[-5],Sheet1!R2C1:R26C7,RC[-4]+13,FALSE)+HLOOKUP(RC[-5],Sheet1!R2C9:R26C15,RC[-4]+13,FALSE)*RC[1],0),ROUND(HLOOKUP(RC[-5],Sheet1!R2C1:R26C7,RC[-4]+13,FALSE),0)&IF(RC[1]=0,"","|"&ROUND(HLOOKUP(RC[-5],Sheet1!R2C9:R26C15,RC[-4]+13,FALSE)*RC[1],0))) -> 2247000 | G249: 10 | H249: 1
A250: 2 | B250: =R[-11]C+1 -> 11 | C250: 90 | D250: 0 | E250: =HLOOKUP(RC[-4],Sheet1!R2C1:R26C7,RC[-3]+1,FALSE)&IF(RC[2]=0,"",IF(HLOOKUP(RC[-4],Sheet1!R2C9:R26C15,RC[-3]+1,FALSE)="","","|"&HLOOKUP(RC[-4],Sheet1!R2C9:R26C15,RC[-3]+1,FALSE))) -> 19003 | F250: =IF(HLOOKUP(RC[-5],Sheet1!R2C9:R26C15,RC[-4]+1,FALSE)="",ROUND(HLOOKUP(RC[-5],Sheet1!R2C1:R26C7,RC[-4]+13,FALSE)+HLOOKUP(RC[-5],Sheet1!R2C9:R26C15,RC[-4]+13,FALSE)*RC[1],0),ROUND(HLOOKUP(RC[-5],Sheet1!R2C1:R26C7,RC[-4]+13,FALSE),0)&IF(RC[1]=0,"","|"&ROUND(HLOOKUP(RC[-5],Sheet1!R2C9:R26C15,RC[-4]+13,FALSE)*RC[1],0))) -> 2209550 | G250: 9 | H250: 0
A251: 2 | B251: =R[-11]C+1 -> 11 | C251: 80 | D251: 0 | E251: =HLOOKUP(RC[-4],Sheet1!R2C1:R26C7,RC[-3]+1,FALSE)&IF(RC[2]=0,"",IF(HLOOKUP(RC[-4],Sheet1!R2C9:R26C15,RC[-3]+1,FALSE)="","","|"&HLOOKUP(RC[-4],Sheet1!R2C9:R26C15,RC[-3]+1,FALSE))) -> 19003 | F251: =IF(HLOOKUP(RC[-5],Sheet1!R2C9:R26C15,RC[-4]+1,FALSE)="",ROUND(HLOOKUP(RC[-5],Sheet1!R2C1:R26C7,RC[-4]+13,FALSE)+HLOOKUP(RC[-5],Sheet1!R2C9:R26C15,RC[-4]+13,FALSE)*RC[1],0),ROUND(HLOOKUP(RC[-5],Sheet1!R2C1:R26C7,RC[-4]+13,FALSE),0)&IF(RC[1]=0,"","|"&ROUND(HLOOKUP(RC[-5],Sheet1!R2C9:R26C15,RC[-4]+13,FALSE)*RC[1],0))) -> 2172100 | G251: 8 | H251: 0
A252: 2 | B252: =R[-11]C+1 -> 11 | C252: 70 | D252: 0 | E252: =HLOOKUP(RC[-4],Sheet1!R2C1:R26C7,RC[-3]+1,FALSE)&IF(RC[2]=0,"",IF(HLOOKUP(RC[-4],Sheet1!R2C9:R26C15,RC[-3]+1,FALSE)="","","|"&HLOOKUP(RC[-4],Sheet1!R2C9:R26C15,RC[-3]+1,FALSE))) -> 19003 | F252: =IF(HLOOKUP(RC[-5],Sheet1!R2C9:R26C15,RC[-4]+1,FALSE)="",ROUND(HLOOKUP(RC[-5],Sheet1!R2C1:R26C7,RC[-4]+13,FALSE)+HLOOKUP(RC[-5],Sheet1!R2C9:R26C15,RC[-4]+13,FALSE)*RC[1],0),ROUND(HLOOKUP(RC[-5],Sheet1!R2C1:R26C7,RC[-4]+13,FALSE),0)&IF(RC[1]=0,"","|"&ROUND(HLOOKUP(RC[-5],Sheet1!R2C9:R26C15,RC[-4]+13,FALSE)*RC[1],0))) -> 2134650 | G252: 7 | H252: 0
A253: 2 | B253: =R[-11]C+1 -> 11 | C253: 60 | D253: 0 | E253: =HLOOKUP(RC[-4],Sheet1!R2C1:R26C7,RC[-3]+1,FALSE)&IF(RC[2]=0,"",IF(HLOOKUP(RC[-4],Sheet1!R2C9:R26C15,RC[-3]+1,FALSE)="","","|"&HLOOKUP(RC[-4],Sheet1!R2C9:R26C15,RC[-3]+1,FALSE))) -> 19003 | F253: =IF(HLOOKUP(RC[-5],Sheet1!R2C9:R26C15,RC[-4]+1,FALSE)="",ROUND(HLOOKUP(RC[-5],Sheet1!R2C1:R26C7,RC[-4]+13,FALSE)+HLOOKUP(RC[-5],Sheet1!R2C9:R26C15,RC[-4]+13,FALSE)*RC[1],0),ROUND(HLOOKUP(RC[-5],Sheet1!R2C1:R26C7,RC[-4]+13,FALSE),0)&IF(RC[1]=0,"","|"&ROUND(HLOOKUP(RC[-5],Sheet1!R2C9:R26C15,RC[-4]+13,FALSE)*RC[1],0))) -> 2097200 | G253: 6 | H253: 0
A254: 2 | B254: =R[-11]C+1 -> 11 | C254: 50 | D254: 0 | E254: =HLOOKUP(RC[-4],Sheet1!R2C1:R26C7,RC[-3]+1,FALSE)&IF(RC[2]=0,"",IF(HLOOKUP(RC[-4],Sheet1!R2C9:R26C15,RC[-3]+1,FALSE)="","","|"&HLOOKUP(RC[-4],Sheet1!R2C9:R26C15,RC[-3]+1,FALSE))) -> 19003 | F254: =IF(HLOOKUP(RC[-5],Sheet1!R2C9:R26C15,RC[-4]+1,FALSE)="",ROUND(HLOOKUP(RC[-5],Sheet1!R2C1:R26C7,RC[-4]+13,FALSE)+HLOOKUP(RC[-5],Sheet1!R2C9:R26C15,RC[-4]+13,FALSE)*RC[1],0),ROUND(HLOOKUP(RC[-5],Sheet1!R2C1:R26C7,RC[-4]+13,FALSE),0)&IF(RC[1]=0,"","|"&ROUND(HLOOKUP(RC[-5],Sheet1!R2C9:R26C15,RC[-4]+13,FALSE)*RC[1],0))) -> 2059750 | G254: 5 | H254: 0
A255: 2 | B255: =R[-11]C+1 -> 11 | C255: 40 | D255: 0 | E255: =HLOOKUP(RC[-4],Sheet1!R2C1:R26C7,RC[-3]+1,FALSE)&IF(RC[2]=0,"",IF(HLOOKUP(RC[-4],Sheet1!R2C9:R26C15,RC[-3]+1,FALSE)="","","|"&HLOOKUP(RC[-4],Sheet1!R2C9:R26C15,RC[-3]+1,FALSE))) -> 19003 | F255: =IF(HLOOKUP(RC[-5],Sheet1!R2C9:R26C15,RC[-4]+1,FALSE)="",ROUND(HLOOKUP(RC[-5],Sheet1!R2C1:R26C7,RC[-4]+13,FALSE)+HLOOKUP(RC[-5],Sheet1!R2C9:R26C15,RC[-4]+13,FALSE)*RC[1],0),ROUND(HLOOKUP(RC[-5],Sheet1!R2C1:R26C7,RC[-4]+13,FALSE),0)&IF(RC[1]=0,"","|"&ROUND(HLOOKUP(RC[-5],Sheet1!R2C9:R26C15,RC[-4]+13,FALSE)*RC[1],0))) -> 2022300 | G255: 4 | H255: 0
A256: 2 | B256: =R[-11]C+1 -> 11 | C256: 30 | D256: 0 | E256: =HLOOKUP(RC[-4],Sheet1!R2C1:R26C7,RC[-3]+1,FALSE)&IF(RC[2]=0,"",IF(HLOOKUP(RC[-4],Sheet1!R2C9:R26C15,RC[-3]+1,FALSE)="","","|"&HLOOKUP(RC[-4],Sheet1!R2C9:R26C15,RC[-3]+1,FALSE))) -> 19003 | F256: =IF(HLOOKUP(RC[-5],Sheet1!R2C9:R26C15,RC[-4]+1,FALSE)="",ROUND(HLOOKUP(RC[-5],Sheet1!R2C1:R26C7,RC[-4]+13,FALSE)+HLOOKUP(RC[-5],Sheet1!R2C9:R26C15,RC[-4]+13,FALSE)*RC[1],0),ROUND(HLOOKUP(RC[-5],Sheet1!R2C1:R26C7,RC[-4]+13,FALSE),0)&IF(RC[1]=0,"","|"&ROUND(HLOOKUP(RC[-5],Sheet1!R2C9:R26C15,RC[-4]+13,FALSE)*RC[1],0))) -> 1984850 | G256: 3 | H256: 0
A257: 2 | B257: =R[-11]C+1 -> 11 | C257: 20 | D257: 0 | E257: =HLOOKUP(RC[-4],Sheet1!R2C1:R26C7,RC[-3]+1,FALSE)&IF(RC[2]=0,"",IF(HLOOKUP(RC[-4],Sheet1!R2C9:R26C15,RC[-3]+1,FALSE)="","","|"&HLOOKUP(RC[-4],Sheet1!R2C9:R26C15,RC[-3]+1,FALSE))) -> 19003 | F257: =IF(HLOOKUP(RC[-5],Sheet1!R2C9:R26C15,RC[-4]+1,FALSE)="",ROUND(HLOOKUP(RC[-5],Sheet1!R2C1:R26C7,RC[-4]+13,FALSE)+HLOOKUP(RC[-5],Sheet1!R2C9:R26C15,RC[-4]+13,FALSE)*RC[1],0),ROUND(HLOOKUP(RC[-5],Sheet1!R2C1:R26C7,RC[-4]+13,FALSE),0)&IF(RC[1]=0,"","|"&ROUND(HLOOKUP(RC[-5],Sheet1!R2C9:R26C15,RC[-4]+13,FALSE)*RC[1],0))) -> 1947400 | G257: 2 | H257: 0
A258: 2 | B258: =R[-11]C+1 -> 11 | C258: 10 | D258: 0 | E258: =HLOOKUP(RC[-4],Sheet1!R2C1:R26C7,RC[-3]+1,FALSE)&IF(RC[2]=0,"",IF(HLOOKUP(RC[-4],Sheet1!R2C9:R26C15,RC[-3]+1,FALSE)="","","|"&HLOOKUP(RC[-4],Sheet1!R2C9:R26C15,RC[-3]+1,FALSE))) -> 19003 | F258: =IF(HLOOKUP(RC[-5],Sheet1!R2C9:R26C15,RC[-4]+1,FALSE)="",ROUND(HLOOKUP(RC[-5],Sheet1!R2C1:R26C7,RC[-4]+13,FALSE)+HLOOKUP(RC[-5],Sheet1!R2C9:R26C15,RC[-4]+13,FALSE)*RC[1],0),ROUND(HLOOKUP(RC[-5],Sheet1!R2C1:R26C7,RC[-4]+13,FALSE),0)&IF(RC[1]=0,"","|"&ROUND(HLOOKUP(RC[-5],Sheet1!R2C9:R26C15,RC[-4]+13,FALSE)*RC[1],0))) -> 1909950 | G258: 1 | H258: 0
A259: 2 | B259: =R[-11]C+1 -> 11 | C259: 0 | D259: 0 | E259: =HLOOKUP(RC[-4],Sheet1!R2C1:R26C7,RC[-3]+1,FALSE)&IF(RC[2]=0,"",IF(HLOOKUP(RC[-4],Sheet1!R2C9:R26C15,RC[-3]+1,FALSE)="","","|"&HLOOKUP(RC[-4],Sheet1!R2C9:R26C15,RC[-3]+1,FALSE))) -> 19003 | F259: =IF(HLOOKUP(RC[-5],Sheet1!R2C9:R26C15,RC[-4]+1,FALSE)="",ROUND(HLOOKUP(RC[-5],Sheet1!R2C1:R26C7,RC[-4]+13,FALSE)+HLOOKUP(RC[-5],Sheet1!R2C9:R26C15,RC[-4]+13,FALSE)*RC[1],0),ROUND(HLOOKUP(RC[-5],Sheet1!R2C1:R26C7,RC[-4]+13,FALSE),0)&IF(RC[1]=0,"","|"&ROUND(HLOOKUP(RC[-5],Sheet1!R2C9:R26C15,RC[-4]+13,FALSE)*RC[1],0))) -> 1872500 | G259: 0 | H259: 0
A260: 2 | B260: =R[-11]C+1 -> 12 | C260: 100 | D260: 1 | E260: =HLOOKUP(RC[-4],Sheet1!R2C1:R26C7,RC[-3]+1,FALSE)&IF(RC[2]=0,"",IF(HLOOKUP(RC[-4],Sheet1!R2C9:R26C15,RC[-3]+1,FALSE)="","","|"&HLOOKUP(RC[-4],Sheet1!R2C9:R26C15,RC[-3]+1,FALSE))) -> 19003 | F260: =IF(HLOOKUP(RC[-5],Sheet1!R2C9:R26C15,RC[-4]+1,FALSE)="",ROUND(HLOOKUP(RC[-5],Sheet1!R2C1:R26C7,RC[-4]+13,FALSE)+HLOOKUP(RC[-5],Sheet1!R2C9:R26C15,RC[-4]+13,FALSE)*RC[1],0),ROUND(HLOOKUP(RC[-5],Sheet1!R2C1:R26C7,RC[-4]+13,FALSE),0)&IF(RC[1]=0,"","|"&ROUND(HLOOKUP(RC[-5],Sheet1!R2C9:R26C15,RC[-4]+13,FALSE)*RC[1],0))) -> 2712000 | G260: 10 | H260: 1
A261: 2 | B261: =R[-11]C+1 -> 12 | C261: 90 | D261: 0 | E261: =HLOOKUP(RC[-4],Sheet1!R2C1:R26C7,RC[-3]+1,FALSE)&IF(RC[2]=0,"",IF(HLOOKUP(RC[-4],Sheet1!R2C9:R26C15,RC[-3]+1,FALSE)="","","|"&HLOOKUP(RC[-4],Sheet1!R2C9:R26C15,RC[-3]+1,FALSE))) -> 19003 | F261: =IF(HLOOKUP(RC[-5],Sheet1!R2C9:R26C15,RC[-4]+1,FALSE)="",ROUND(HLOOKUP(RC[-5],Sheet1!R2C1:R26C7,RC[-4]+13,FALSE)+HLOOKUP(RC[-5],Sheet1!R2C9:R26C15,RC[-4]+13,FALSE)*RC[1],0),ROUND(HLOOKUP(RC[-5],Sheet1!R2C1:R26C7,RC[-4]+13,FALSE),0)&IF(RC[1]=0,"","|"&ROUND(HLOOKUP(RC[-5],Sheet1!R2C9:R26C15,RC[-4]+13,FALSE)*RC[1],0))) -> 2666800 | G261: 9 | H261: 0
A262: 2 | B262: =R[-11]C+1 -> 12 | C262: 80 | D262: 0 | E262: =HLOOKUP(RC[-4],Sheet1!R2C1:R26C7,RC[-3]+1,FALSE)&IF(RC[2]=0,"",IF(HLOOKUP(RC[-4],Sheet1!R2C9:R26C15,RC[-3]+1,FALSE)="","","|"&HLOOKUP(RC[-4],Sheet1!R2C9:R26C15,RC[-3]+1,FALSE))) -> 19003 | F262: =IF(HLOOKUP(RC[-5],Sheet1!R2C9:R26C15,RC[-4]+1,FALSE)="",ROUND(HLOOKUP(RC[-5],Sheet1!R2C1:R26C7,RC[-4]+13,FALSE)+HLOOKUP(RC[-5],Sheet1!R2C9:R26C15,RC[-4]+13,FALSE)*RC[1],0),ROUND(HLOOKUP(RC[-5],Sheet1!R2C1:R26C7,RC[-4]+13,FALSE),0)&IF(RC[1]=0,"","|"&ROUND(HLOOKUP(RC[-5],Sheet1!R2C9:R26C15,RC[-4]+13,FALSE)*RC[1],0))) -> 2621600 | G262: 8 | H262: 0
A263: 2 | B263: =R[-11]C+1 -> 12 | C263: 70 | D263: 0 | E263: =HLOOKUP(RC[-4],Sheet1!R2C1:R26C7,RC[-3]+1,FALSE)&IF(RC[2]=0,"",IF(HLOOKUP(RC[-4],Sheet1!R2C9:R26C15,RC[-3]+1,FALSE)="","","|"&HLOOKUP(RC[-4],Sheet1!R2C9:R26C15,RC[-3]+1,FALSE))) -> 19003 | F263: =IF(HLOOKUP(RC[-5],Sheet1!R2C9:R26C15,RC[-4]+1,FALSE)="",ROUND(HLOOKUP(RC[-5],Sheet1!R2C1:R26C7,RC[-4]+13,FALSE)+HLOOKUP(RC[-5],Sheet1!R2C9:R26C15,RC[-4]+13,FALSE)*RC[1],0),ROUND(HLOOKUP(RC[-5],Sheet1!R2C1:R26C7,RC[-4]+13,FALSE),0)&IF(RC[1]=0,"","|"&ROUND(HLOOKUP(RC[-5],Sheet1!R2C9:R26C15,RC[-4]+13,FALSE)*RC[1],0))) -> 2576400 | G263: 7 | H263: 0
A264: 2 | B264: =R[-11]C+1 -> 12 | C264: 60 | D264: 0 | E264: =HLOOKUP(RC[-4],Sheet1!R2C1:R26C7,RC[-3]+1,FALSE)&IF(RC[2]=0,"",IF(HLOOKUP(RC[-4],Sheet1!R2C9:R26C15,RC[-3]+1,FALSE)="","","|"&HLOOKUP(RC[-4],Sheet1!R2C9:R26C15,RC[-3]+1,FALSE))) -> 19003 | F264: =IF(HLOOKUP(RC[-5],Sheet1!R2C9:R26C15,RC[-4]+1,FALSE)="",ROUND(HLOOKUP(RC[-5],Sheet1!R2C1:R26C7,RC[-4]+13,FALSE)+HLOOKUP(RC[-5],Sheet1!R2C9:R26C15,RC[-4]+13,FALSE)*RC[1],0),ROUND(HLOOKUP(RC[-5],Sheet1!R2C1:R26C7,RC[-4]+13,FALSE),0)&IF(RC[1]=0,"","|"&ROUND(HLOOKUP(RC[-5],Sheet1!R2C9:R26C15,RC[-4]+13,FALSE)*RC[1],0))) -> 2531200 | G264: 6 | H264: 0
A265: 2 | B265: =R[-11]C+1 -> 12 | C265: 50 | D265: 0 | E265: =HLOOKUP(RC[-4],Sheet1!R2C1:R26C7,RC[-3]+1,FALSE)&IF(RC[2]=0,"",IF(HLOOKUP(RC[-4],Sheet1!R2C9:R26C15,RC[-3]+1,FALSE)="","","|"&HLOOKUP(RC[-4],Sheet1!R2C9:R26C15,RC[-3]+1,FALSE))) -> 19003 | F265: =IF(HLOOKUP(RC[-5],Sheet1!R2C9:R26C15,RC[-4]+1,FALSE)="",ROUND(HLOOKUP(RC[-5],Sheet1!R2C1:R26C7,RC[-4]+13,FALSE)+HLOOKUP(RC[-5],Sheet1!R2C9:R26C15,RC[-4]+13,FALSE)*RC[1],0),ROUND(HLOOKUP(RC[-5],Sheet1!R2C1:R26C7,RC[-4]+13,FALSE),0)&IF(RC[1]=0,"","|"&ROUND(HLOOKUP(RC[-5],Sheet1!R2C9:R26C15,RC[-4]+13,FALSE)*RC[1],0))) -> 2486000 | G265: 5 | H265: 0
A266: 2 | B266: =R[-11]C+1 -> 12 | C266: 40 | D266: 0 | E266: =HLOOKUP(RC[-4],Sheet1!R2C1:R26C7,RC[-3]+1,FALSE)&IF(RC[2]=0,"",IF(HLOOKUP(RC[-4],Sheet1!R2C9:R26C15,RC[-3]+1,FALSE)="","","|"&HLOOKUP(RC[-4],Sheet1!R2C9:R26C15,RC[-3]+1,FALSE))) -> 19003 | F266: =IF(HLOOKUP(RC[-5],Sheet1!R2C9:R26C15,RC[-4]+1,FALSE)="",ROUND(HLOOKUP(RC[-5],Sheet1!R2C1:R26C7,RC[-4]+13,FALSE)+HLOOKUP(RC[-5],Sheet1!R2C9:R26C15,RC[-4]+13,FALSE)*RC[1],0),ROUND(HLOOKUP(RC[-5],Sheet1!R2C1:R26C7,RC[-4]+13,FALSE),0)&IF(RC[1]=0,"","|"&ROUND(HLOOKUP(RC[-5],Sheet1!R2C9:R26C15,RC[-4]+13,FALSE)*RC[1],0))) -> 2440800 | G266: 4 | H266: 0
A267: 2 | B267: =R[-11]C+1 -> 12 | C267: 30 | D267: 0 | E267: =HLOOKUP(RC[-4],Sheet1!R2C1:R26C7,RC[-3]+1,FALSE)&IF(RC[2]=0,"",IF(HLOOKUP(RC[-4],Sheet1!R2C9:R26C15,RC[-3]+1,FALSE)="","","|"&HLOOKUP(RC[-4],Sheet1!R2C9:R26C15,RC[-3]+1,FALSE))) -> 19003 | F267: =IF(HLOOKUP(RC[-5],Sheet1!R2C9:R26C15,RC[-4]+1,FALSE)="",ROUND(HLOOKUP(RC[-5],Sheet1!R2C1:R26C7,RC[-4]+13,FALSE)+HLOOKUP(RC[-5],Sheet1!R2C9:R26C15,RC[-4]+13,FALSE)*RC[1],0),ROUND(HLOOKUP(RC[-5],Sheet1!R2C1:R26C7,RC[-4]+13,FALSE),0)&IF(RC[1]=0,"","|"&ROUND(HLOOKUP(RC[-5],Sheet1!R2C9:R26C15,RC[-4]+13,FALSE)*RC[1],0))) -> 2395600 | G267: 3 | H267: 0
A268: 2 | B268: =R[-11]C+1 -> 12 | C268: 20 | D268: 0 | E268: =HLOOKUP(RC[-4],Sheet1!R2C1:R26C7,RC[-3]+1,FALSE)&IF(RC[2]=0,"",IF(HLOOKUP(RC[-4],Sheet1!R2C9:R26C15,RC[-3]+1,FALSE)="","","|"&HLOOKUP(RC[-4],Sheet1!R2C9:R26C15,RC[-3]+1,FALSE))) -> 19003 | F268: =IF(HLOOKUP(RC[-5],Sheet1!R2C9:R26C15,RC[-4]+1,FALSE)="",ROUND(HLOOKUP(RC[-5],Sheet1!R2C1:R26C7,RC[-4]+13,FALSE)+HLOOKUP(RC[-5],Sheet1!R2C9:R26C15,RC[-4]+13,FALSE)*RC[1],0),ROUND(HLOOKUP(RC[-5],Sheet1!R2C1:R26C7,RC[-4]+13,FALSE),0)&IF(RC[1]=0,"","|"&ROUND(HLOOKUP(RC[-5],Sheet1!R2C9:R26C15,RC[-4]+13,FALSE)*RC[1],0))) -> 2350400 | G268: 2 | H268: 0
A269: 2 | B269: =R[-11]C+1 -> 12 | C269: 10 | D269: 0 | E269: =HLOOKUP(RC[-4],Sheet1!R2C1:R26C7,RC[-3]+1,FALSE)&IF(RC[2]=0,"",IF(HLOOKUP(RC[-4],Sheet1!R2C9:R26C15,RC[-3]+1,FALSE)="","","|"&HLOOKUP(RC[-4],Sheet1!R2C9:R26C15,RC[-3]+1,FALSE))) -> 19003 | F269: =IF(HLOOKUP(RC[-5],Sheet1!R2C9:R26C15,RC[-4]+1,FALSE)="",ROUND(HLOOKUP(RC[-5],Sheet1!R2C1:R26C7,RC[-4]+13,FALSE)+HLOOKUP(RC[-5],Sheet1!R2C9:R26C15,RC[-4]+13,FALSE)*RC[1],0),ROUND(HLOOKUP(RC[-5],Sheet1!R2C1:R26C7,RC[-4]+13,FALSE),0)&IF(RC[1]=0,"","|"&ROUND(HLOOKUP(RC[-5],Sheet1!R2C9:R26C15,RC[-4]+13,FALSE)*RC[1],0))) -> 2305200 | G269: 1 | H269: 0
A270: 2 | B270: =R[-11]C+1 -> 12 | C270: 0 | D270: 0 | E270: =HLOOKUP(RC[-4],Sheet1!R2C1:R26C7,RC[-3]+1,FALSE)&IF(RC[2]=0,"",IF(HLOOKUP(RC[-4],Sheet1!R2C9:R26C15,RC[-3]+1,FALSE)="","","|"&HLOOKUP(RC[-4],Sheet1!R2C9:R26C15,RC[-3]+1,FALSE))) -> 19003 | F270: =IF(HLOOKUP(RC[-5],Sheet1!R2C9:R26C15,RC[-4]+1,FALSE)="",ROUND(HLOOKUP(RC[-5],Sheet1!R2C1:R26C7,RC[-4]+13,FALSE)+HLOOKUP(RC[-5],Sheet1!R2C9:R26C15,RC[-4]+13,FALSE)*RC[1],0),ROUND(HLOOKUP(RC[-5],Sheet1!R2C1:R26C7,RC[-4]+13,FALSE),0)&IF(RC[1]=0,"","|"&ROUND(HLOOKUP(RC[-5],Sheet1!R2C9:R26C15,RC[-4]+13,FALSE)*RC[1],0))) -> 2260000 | G270: 0 | H270: 0
A271: 3 | B271: 1 | C271: 20 | D271: 1 | E271: =HLOOKUP(RC[-4],Sheet1!R2C1:R26C7,RC[-3]+1,FALSE)&IF(RC[2]=0,"",IF(HLOOKUP(RC[-4],Sheet1!R2C9:R26C15,RC[-3]+1,FALSE)="","","|"&HLOOKUP(RC[-4],Sheet1!R2C9:R26C15,RC[-3]+1,FALSE))) -> 10012|10011 | F271: =IF(HLOOKUP(RC[-5],Sheet1!R2C9:R26C15,RC[-4]+1,FALSE)="",ROUND(HLOOKUP(RC[-5],Sheet1!R2C1:R26C7,RC[-4]+13,FALSE)+HLOOKUP(RC[-5],Sheet1!R2C9:R26C15,RC[-4]+13,FALSE)*RC[1],0),ROUND(HLOOKUP(RC[-5],Sheet1!R2C1:R26C7,RC[-4]+13,FALSE),0)&IF(RC[1]=0,"","|"&ROUND(HLOOKUP(RC[-5],Sheet1!R2C9:R26C15,RC[-4]+13,FALSE)*RC[1],0))) -> 60|10 | G271: 10 | H271: 1
A272: 3 | B272: 1 | C272: 25 | D272: 0 | E272: =HLOOKUP(RC[-4],Sheet1!R2C1:R26C7,RC[-3]+1,FALSE)&IF(RC[2]=0,"",IF(HLOOKUP(RC[-4],Sheet1!R2C9:R26C15,RC[-3]+1,FALSE)="","","|"&HLOOKUP(RC[-4],Sheet1!R2C9:R26C15,RC[-3]+1,FALSE))) -> 10012|10011 | F272: =IF(HLOOKUP(RC[-5],Sheet1!R2C9:R26C15,RC[-4]+1,FALSE)="",ROUND(HLOOKUP(RC[-5],Sheet1!R2C1:R26C7,RC[-4]+13,FALSE)+HLOOKUP(RC[-5],Sheet1!R2C9:R26C15,RC[-4]+13,FALSE)*RC[1],0),ROUND(HLOOKUP(RC[-5],Sheet1!R2C1:R26C7,RC[-4]+13,FALSE),0)&IF(RC[1]=0,"","|"&ROUND(HLOOKUP(RC[-5],Sheet1!R2C9:R26C15,RC[-4]+13,FALSE)*RC[1],0))) -> 60|9 | G272: 9 | H272: 0
A273: 3 | B273: 1 | C273: 30 | D273: 0 | E273: =HLOOKUP(RC[-4],Sheet1!R2C1:R26C7,RC[-3]+1,FALSE)&IF(RC[2]=0,"",IF(HLOOKUP(RC[-4],Sheet1!R2C9:R26C15,RC[-3]+1,FALSE)="","","|"&HLOOKUP(RC[-4],Sheet1!R2C9:R26C15,RC[-3]+1,FALSE))) -> 10012|10011 | F273: =IF(HLOOKUP(RC[-5],Sheet1!R2C9:R26C15,RC[-4]+1,FALSE)="",ROUND(HLOOKUP(RC[-5],Sheet1!R2C1:R26C7,RC[-4]+13,FALSE)+HLOOKUP(RC[-5],Sheet1!R2C9:R26C15,RC[-4]+13,FALSE)*RC[1],0),ROUND(HLOOKUP(RC[-5],Sheet1!R2C1:R26C7,RC[-4]+13,FALSE),0)&IF(RC[1]=0,"","|"&ROUND(HLOOKUP(RC[-5],Sheet1!R2C9:R26C15,RC[-4]+13,FALSE)*RC[1],0))) -> 60|8 | G273: 8 | H273: 0
A274: 3 | B274: 1 | C274: 35 | D274: 0 | E274: =HLOOKUP(RC[-4],Sheet1!R2C1:R26C7,RC[-3]+1,FALSE)&IF(RC[2]=0,"",IF(HLOOKUP(RC[-4],Sheet1!R2C9:R26C15,RC[-3]+1,FALSE)="","","|"&HLOOKUP(RC[-4],Sheet1!R2C9:R26C15,RC[-3]+1,FALSE))) -> 10012|10011 | F274: =IF(HLOOKUP(RC[-5],Sheet1!R2C9:R26C15,RC[-4]+1,FALSE)="",ROUND(HLOOKUP(RC[-5],Sheet1!R2C1:R26C7,RC[-4]+13,FALSE)+HLOOKUP(RC[-5],Sheet1!R2C9:R26C15,RC[-4]+13,FALSE)*RC[1],0),ROUND(HLOOKUP(RC[-5],Sheet1!R2C1:R26C7,RC[-4]+13,FALSE),0)&IF(RC[1]=0,"","|"&ROUND(HLOOKUP(RC[-5],Sheet1!R2C9:R26C15,RC[-4]+13,FALSE)*RC[1],0))) -> 60|7 | G274: 7 | H274: 0
A275: 3 | B275: 1 | C275: 40 | D275: 0 | E275: =HLOOKUP(RC[-4],Sheet1!R2C1:R26C7,RC[-3]+1,FALSE)&IF(RC[2]=0,"",IF(HLOOKUP(RC[-4],Sheet1!R2C9:R26C15,RC[-3]+1,FALSE)="","","|"&HLOOKUP(RC[-4],Sheet1!R2C9:R26C15,RC[-3]+1,FALSE))) -> 10012|10011 | F275: =IF(HLOOKUP(RC[-5],Sheet1!R2C9:R26C15,RC[-4]+1,FALSE)="",ROUND(HLOOKUP(RC[-5],Sheet1!R2C1:R26C7,RC[-4]+13,FALSE)+HLOOKUP(RC[-5],Sheet1!R2C9:R26C15,RC[-4]+13,FALSE)*RC[1],0),ROUND(HLOOKUP(RC[-5],Sheet1!R2C1:R26C7,RC[-4]+13,FALSE),0)&IF(RC[1]=0,"","|"&ROUND(HLOOKUP(RC[-5],Sheet1!R2C9:R26C15,RC[-4]+13,FALSE)*RC[1],0))) -> 60|6 | G275: 6 | H275: 0
A276: 3 | B276: 1 | C276: 45 | D276: 0 | E276: =HLOOKUP(RC[-4],Sheet1!R2C1:R26C7,RC[-3]+1,FALSE)&IF(RC[2]=0,"",IF(HLOOKUP(RC[-4],Sheet1!R2C9:R26C15,RC[-3]+1,FALSE)="","","|"&HLOOKUP(RC[-4],Sheet1!R2C9:R26C15,RC[-3]+1,FALSE))) -> 10012|10011 | F276: =IF(HLOOKUP(RC[-5],Sheet1!R2C9:R26C15,RC[-4]+1,FALSE)="",ROUND(HLOOKUP(RC[-5],Sheet1!R2C1:R26C7,RC[-4]+13,FALSE)+HLOOKUP(RC[-5],Sheet1!R2C9:R26C15,RC[-4]+13,FALSE)*RC[1],0),ROUND(HLOOKUP(RC[-5],Sheet1!R2C1:R26C7,RC[-4]+13,FALSE),0)&IF(RC[1]=0,"","|"&ROUND(HLOOKUP(RC[-5],Sheet1!R2C9:R26C15,RC[-4]+13,FALSE)*RC[1],0))) -> 60|5 | G276: 5 | H276: 0
A277: 3 | B277: 1 | C277: 50 | D277: 0 | E277: =HLOOKUP(RC[-4],Sheet1!R2C1:R26C7,RC[-3]+1,FALSE)&IF(RC[2]=0,"",IF(HLOOKUP(RC[-4],Sheet1!R2C9:R26C15,RC[-3]+1,FALSE)="","","|"&HLOOKUP(RC[-4],Sheet1!R2C9:R26C15,RC[-3]+1,FALSE))) -> 10012|10011 | F277: =IF(HLOOKUP(RC[-5],Sheet1!R2C9:R26C15,RC[-4]+1,FALSE)="",ROUND(HLOOKUP(RC[-5],Sheet1!R2C1:R26C7,RC[-4]+13,FALSE)+HLOOKUP(RC[-5],Sheet1!R2C9:R26C15,RC[-4]+13,FALSE)*RC[1],0),ROUND(HLOOKUP(RC[-5],Sheet1!R2C1:R26C7,RC[-4]+13,FALSE),0)&IF(RC[1]=0,"","|"&ROUND(HLOOKUP(RC[-5],Sheet1!R2C9:R26C15,RC[-4]+13,FALSE)*RC[1],0))) -> 60|4 | G277: 4 | H277: 0
A278: 3 | B278: 1 | C278: 55 | D278: 0 | E278: =HLOOKUP(RC[-4],Sheet1!R2C1:R26C7,RC[-3]+1,FALSE)&IF(RC[2]=0,"",IF(HLOOKUP(RC[-4],Sheet1!R2C9:R26C15,RC[-3]+1,FALSE)="","","|"&HLOOKUP(RC[-4],Sheet1!R2C9:R26C15,RC[-3]+1,FALSE))) -> 10012|10011 | F278: =IF(HLOOKUP(RC[-5],Sheet1!R2C9:R26C15,RC[-4]+1,FALSE)="",ROUND(HLOOKUP(RC[-5],Sheet1!R2C1:R26C7,RC[-4]+13,FALSE)+HLOOKUP(RC[-5],Sheet1!R2C9:R26C15,RC[-4]+13,FALSE)*RC[1],0),ROUND(HLOOKUP(RC[-5],Sheet1!R2C1:R26C7,RC[-4]+13,FALSE),0)&IF(RC[1]=0,"","|"&ROUND(HLOOKUP(RC[-5],Sheet1!R2C9:R26C15,RC[-4]+13,FALSE)*RC[1],0))) -> 60|3 | G278: 3 | H278: 0
A279: 3 | B279: 1 | C279: 60 | D279: 0 | E279: =HLOOKUP(RC[-4],Sheet1!R2C1:R26C7,RC[-3]+1,FALSE)&IF(RC[2]=0,"",IF(HLOOKUP(RC[-4],Sheet1!R2C9:R26C15,RC[-3]+1,FALSE)="","","|"&HLOOKUP(RC[-4],Sheet1!R2C9:R26C15,RC[-3]+1,FALSE))) -> 10012|10011 | F279: =IF(HLOOKUP(RC[-5],Sheet1!R2C9:R26C15,RC[-4]+1,FALSE)="",ROUND(HLOOKUP(RC[-5],Sheet1!R2C1:R26C7,RC[-4]+13,FALSE)+HLOOKUP(RC[-5],Sheet1!R2C9:R26C15,RC[-4]+13,FALSE)*RC[1],0),ROUND(HLOOKUP(RC[-5],Sheet1!R2C1:R26C7,RC[-4]+13,FALSE),0)&IF(RC[1]=0,"","|"&ROUND(HLOOKUP(RC[-5],Sheet1!R2C9:R26C15,RC[-4]+13,FALSE)*RC[1],0))) -> 60|2 | G279: 2 | H279: 0
A280: 3 | B280: 1 | C280: 65 | D280: 0 | E280: =HLOOKUP(RC[-4],Sheet1!R2C1:R26C7,RC[-3]+1,FALSE)&IF(RC[2]=0,"",IF(HLOOKUP(RC[-4],Sheet1!R2C9:R26C15,RC[-3]+1,FALSE)="","","|"&HLOOKUP(RC[-4],Sheet1!R2C9:R26C15,RC[-3]+1,FALSE))) -> 10012|10011 | F280: =IF(HLOOKUP(RC[-5],Sheet1!R2C9:R26C15,RC[-4]+1,FALSE)="",ROUND(HLOOKUP(RC[-5],Sheet1!R2C1:R26C7,RC[-4]+13,FALSE)+HLOOKUP(RC[-5],Sheet1!R2C9:R26C15,RC[-4]+13,FALSE)*RC[1],0),ROUND(HLOOKUP(RC[-5],Sheet1!R2C1:R26C7,RC[-4]+13,FALSE),0)&IF(RC[1]=0,"","|"&ROUND(HLOOKUP(RC[-5],Sheet1!R2C9:R26C15,RC[-4]+13,FALSE)*RC[1],0))) -> 60|1 | G280: 1 | H280: 0
A281: 3 | B281: 1 | C281: 120 | D281: 0 | E281: =HLOOKUP(RC[-4],Sheet1!R2C1:R26C7,RC[-3]+1,FALSE)&IF(RC[2]=0,"",IF(HLOOKUP(RC[-4],Sheet1!R2C9:R26C15,RC[-3]+1,FALSE)="","","|"&HLOOKUP(RC[-4],Sheet1!R2C9:R26C15,RC[-3]+1,FALSE))) -> 10012 | F281: =IF(HLOOKUP(RC[-5],Sheet1!R2C9:R26C15,RC[-4]+1,FALSE)="",ROUND(HLOOKUP(RC[-5],Sheet1!R2C1:R26C7,RC[-4]+13,FALSE)+HLOOKUP(RC[-5],Sheet1!R2C9:R26C15,RC[-4]+13,FALSE)*RC[1],0),ROUND(HLOOKUP(RC[-5],Sheet1!R2C1:R26C7,RC[-4]+13,FALSE),0)&IF(RC[1]=0,"","|"&ROUND(HLOOKUP(RC[-5],Sheet1!R2C9:R26C15,RC[-4]+13,FALSE)*RC[1],0))) -> 60 | G281: 0 | H281: 0
A282: 3 | B282: 2 | C282: 20 | D282: 1 | E282: =HLOOKUP(RC[-4],Sheet1!R2C1:R26C7,RC[-3]+1,FALSE)&IF(RC[2]=0,"",IF(HLOOKUP(RC[-4],Sheet1!R2C9:R26C15,RC[-3]+1,FALSE)="","","|"&HLOOKUP(RC[-4],Sheet1!R2C9:R26C15,RC[-3]+1,FALSE))) -> 10012|10011 | F282: =IF(HLOOKUP(RC[-5],Sheet1!R2C9:R26C15,RC[-4]+1,FALSE)="",ROUND(HLOOKUP(RC[-5],Sheet1!R2C1:R26C7,RC[-4]+13,FALSE)+HLOOKUP(RC[-5],Sheet1!R2C9:R26C15,RC[-4]+13,FALSE)*RC[1],0),ROUND(HLOOKUP(RC[-5],Sheet1!R2C1:R26C7,RC[-4]+13,FALSE),0)&IF(RC[1]=0,"","|"&ROUND(HLOOKUP(RC[-5],Sheet1!R2C9:R26C15,RC[-4]+13,FALSE)*RC[1],0))) -> 102|20 | G282: 10 | H282: 1
A283: 3 | B283: 2 | C283: 25 | D283: 0 | E283: =HLOOKUP(RC[-4],Sheet1!R2C1:R26C7,RC[-3]+1,FALSE)&IF(RC[2]=0,"",IF(HLOOKUP(RC[-4],Sheet1!R2C9:R26C15,RC[-3]+1,FALSE)="","","|"&HLOOKUP(RC[-4],Sheet1!R2C9:R26C15,RC[-3]+1,FALSE))) -> 10012|10011 | F283: =IF(HLOOKUP(RC[-5],Sheet1!R2C9:R26C15,RC[-4]+1,FALSE)="",ROUND(HLOOKUP(RC[-5],Sheet1!R2C1:R26C7,RC[-4]+13,FALSE)+HLOOKUP(RC[-5],Sheet1!R2C9:R26C15,RC[-4]+13,FALSE)*RC[1],0),ROUND(HLOOKUP(RC[-5],Sheet1!R2C1:R26C7,RC[-4]+13,FALSE),0)&IF(RC[1]=0,"","|"&ROUND(HLOOKUP(RC[-5],Sheet1!R2C9:R26C15,RC[-4]+13,FALSE)*RC[1],0))) -> 102|18 | G283: 9 | H283: 0
A284: 3 | B284: 2 | C284: 30 | D284: 0 | E284: =HLOOKUP(RC[-4],Sheet1!R2C1:R26C7,RC[-3]+1,FALSE)&IF(RC[2]=0,"",IF(HLOOKUP(RC[-4],Sheet1!R2C9:R26C15,RC[-3]+1,FALSE)="","","|"&HLOOKUP(RC[-4],Sheet1!R2C9:R26C15,RC[-3]+1,FALSE))) -> 10012|10011 | F284: =IF(HLOOKUP(RC[-5],Sheet1!R2C9:R26C15,RC[-4]+1,FALSE)="",ROUND(HLOOKUP(RC[-5],Sheet1!R2C1:R26C7,RC[-4]+13,FALSE)+HLOOKUP(RC[-5],Sheet1!R2C9:R26C15,RC[-4]+13,FALSE)*RC[1],0),ROUND(HLOOKUP(RC[-5],Sheet1!R2C1:R26C7,RC[-4]+13,FALSE),0)&IF(RC[1]=0,"","|"&ROUND(HLOOKUP(RC[-5],Sheet1!R2C9:R26C15,RC[-4]+13,FALSE)*RC[1],0))) -> 102|16 | G284: 8 | H284: 0
A285: 3 | B285: 2 | C285: 35 | D285: 0 | E285: =HLOOKUP(RC[-4],Sheet1!R2C1:R26C7,RC[-3]+1,FALSE)&IF(RC[2]=0,"",IF(HLOOKUP(RC[-4],Sheet1!R2C9:R26C15,RC[-3]+1,FALSE)="","","|"&HLOOKUP(RC[-4],Sheet1!R2C9:R26C15,RC[-3]+1,FALSE))) -> 10012|10011 | F285: =IF(HLOOKUP(RC[-5],Sheet1!R2C9:R26C15,RC[-4]+1,FALSE)="",ROUND(HLOOKUP(RC[-5],Sheet1!R2C1:R26C7,RC[-4]+13,FALSE)+HLOOKUP(RC[-5],Sheet1!R2C9:R26C15,RC[-4]+13,FALSE)*RC[1],0),ROUND(HLOOKUP(RC[-5],Sheet1!R2C1:R26C7,RC[-4]+13,FALSE),0)&IF(RC[1]=0,"","|"&ROUND(HLOOKUP(RC[-5],Sheet1!R2C9:R26C15,RC[-4]+13,FALSE)*RC[1],0))) -> 102|14 | G285: 7 | H285: 0
A286: 3 | B286: 2 | C286: 40 | D286: 0 | E286: =HLOOKUP(RC[-4],Sheet1!R2C1:R26C7,RC[-3]+1,FALSE)&IF(RC[2]=0,"",IF(HLOOKUP(RC[-4],Sheet1!R2C9:R26C15,RC[-3]+1,FALSE)="","","|"&HLOOKUP(RC[-4],Sheet1!R2C9:R26C15,RC[-3]+1,FALSE))) -> 10012|10011 | F286: =IF(HLOOKUP(RC[-5],Sheet1!R2C9:R26C15,RC[-4]+1,FALSE)="",ROUND(HLOOKUP(RC[-5],Sheet1!R2C1:R26C7,RC[-4]+13,FALSE)+HLOOKUP(RC[-5],Sheet1!R2C9:R26C15,RC[-4]+13,FALSE)*RC[1],0),ROUND(HLOOKUP(RC[-5],Sheet1!R2C1:R26C7,RC[-4]+13,FALSE),0)&IF(RC[1]=0,"","|"&ROUND(HLOOKUP(RC[-5],Sheet1!R2C9:R26C15,RC[-4]+13,FALSE)*RC[1],0))) -> 102|12 | G286: 6 | H286: 0
A287: 3 | B287: 2 | C287: 45 | D287: 0 | E287: =HLOOKUP(RC[-4],Sheet1!R2C1:R26C7,RC[-3]+1,FALSE)&IF(RC[2]=0,"",IF(HLOOKUP(RC[-4],Sheet1!R2C9:R26C15,RC[-3]+1,FALSE)="","","|"&HLOOKUP(RC[-4],Sheet1!R2C9:R26C15,RC[-3]+1,FALSE))) -> 10012|10011 | F287: =IF(HLOOKUP(RC[-5],Sheet1!R2C9:R26C15,RC[-4]+1,FALSE)="",ROUND(HLOOKUP(RC[-5],Sheet1!R2C1:R26C7,RC[-4]+13,FALSE)+HLOOKUP(RC[-5],Sheet1!R2C9:R26C15,RC[-4]+13,FALSE)*RC[1],0),ROUND(HLOOKUP(RC[-5],Sheet1!R2C1:R26C7,RC[-4]+13,FALSE),0)&IF(RC[1]=0,"","|"&ROUND(HLOOKUP(RC[-5],Sheet1!R2C9:R26C15,RC[-4]+13,FALSE)*RC[1],0))) -> 102|10 | G287: 5 | H287: 0
A288: 3 | B288: 2 | C288: 50 | D288: 0 | E288: =HLOOKUP(RC[-4],Sheet1!R2C1:R26C7,RC[-3]+1,FALSE)&IF(RC[2]=0,"",IF(HLOOKUP(RC[-4],Sheet1!R2C9:R26C15,RC[-3]+1,FALSE)="","","|"&HLOOKUP(RC[-4],Sheet1!R2C9:R26C15,RC[-3]+1,FALSE))) -> 10012|10011 | F288: =IF(HLOOKUP(RC[-5],Sheet1!R2C9:R26C15,RC[-4]+1,FALSE)="",ROUND(HLOOKUP(RC[-5],Sheet1!R2C1:R26C7,RC[-4]+13,FALSE)+HLOOKUP(RC[-5],Sheet1!R2C9:R26C15,RC[-4]+13,FALSE)*RC[1],0),ROUND(HLOOKUP(RC[-5],Sheet1!R2C1:R26C7,RC[-4]+13,FALSE),0)&IF(RC[1]=0,"","|"&ROUND(HLOOKUP(RC[-5],Sheet1!R2C9:R26C15,RC[-4]+13,FALSE)*RC[1],0))) -> 102|8 | G288: 4 | H288: 0
A289: 3 | B289: 2 | C289: 55 | D289: 0 | E289: =HLOOKUP(RC[-4],Sheet1!R2C1:R26C7,RC[-3]+1,FALSE)&IF(RC[2]=0,"",IF(HLOOKUP(RC[-4],Sheet1!R2C9:R26C15,RC[-3]+1,FALSE)="","","|"&HLOOKUP(RC[-4],Sheet1!R2C9:R26C15,RC[-3]+1,FALSE))) -> 10012|10011 | F289: =IF(HLOOKUP(RC[-5],Sheet1!R2C9:R26C15,RC[-4]+1,FALSE)="",ROUND(HLOOKUP(RC[-5],Sheet1!R2C1:R26C7,RC[-4]+13,FALSE)+HLOOKUP(RC[-5],Sheet1!R2C9:R26C15,RC[-4]+13,FALSE)*RC[1],0),ROUND(HLOOKUP(RC[-5],Sheet1!R2C1:R26C7,RC[-4]+13,FALSE),0)&IF(RC[1]=0,"","|"&ROUND(HLOOKUP(RC[-5],Sheet1!R2C9:R26C15,RC[-4]+13,FALSE)*RC[1],0))) -> 102|6 | G289: 3 | H289: 0
A290: 3 | B290: 2 | C290: 60 | D290: 0 | E290: =HLOOKUP(RC[-4],Sheet1!R2C1:R26C7,RC[-3]+1,FALSE)&IF(RC[2]=0,"",IF(HLOOKUP(RC[-4],Sheet1!R2C9:R26C15,RC[-3]+1,FALSE)="","","|"&HLOOKUP(RC[-4],Sheet1!R2C9:R26C15,RC[-3]+1,FALSE))) -> 10012|10011 | F290: =IF(HLOOKUP(RC[-5],Sheet1!R2C9:R26C15,RC[-4]+1,FALSE)="",ROUND(HLOOKUP(RC[-5],Sheet1!R2C1:R26C7,RC[-4]+13,FALSE)+HLOOKUP(RC[-5],Sheet1!R2C9:R26C15,RC[-4]+13,FALSE)*RC[1],0),ROUND(HLOOKUP(RC[-5],Sheet1!R2C1:R26C7,RC[-4]+13,FALSE),0)&IF(RC[1]=0,"","|"&ROUND(HLOOKUP(RC[-5],Sheet1!R2C9:R26C15,RC[-4]+13,FALSE)*RC[1],0))) -> 102|4 | G290: 2 | H290: 0
A291: 3 | B291: 2 | C291: 65 | D291: 0 | E291: =HLOOKUP(RC[-4],Sheet1!R2C1:R26C7,RC[-3]+1,FALSE)&IF(RC[2]=0,"",IF(HLOOKUP(RC[-4],Sheet1!R2C9:R26C15,RC[-3]+1,FALSE)="","","|"&HLOOKUP(RC[-4],Sheet1!R2C9:R26C15,RC[-3]+1,FALSE))) -> 10012|10011 | F291: =IF(HLOOKUP(RC[-5],Sheet1!R2C9:R26C15,RC[-4]+1,FALSE)="",ROUND(HLOOKUP(RC[-5],Sheet1!R2C1:R26C7,RC[-4]+13,FALSE)+HLOOKUP(RC[-5],Sheet1!R2C9:R26C15,RC[-4]+13,FALSE)*RC[1],0),ROUND(HLOOKUP(RC[-5],Sheet1!R2C1:R26C7,RC[-4]+13,FALSE),0)&IF(RC[1]=0,"","|"&ROUND(HLOOKUP(RC[-5],Sheet1!R2C9:R26C15,RC[-4]+13,FALSE)*RC[1],0))) -> 102|2 | G291: 1 | H291: 0
A292: 3 | B292: 2 | C292: 120 | D292: 0 | E292: =HLOOKUP(RC[-4],Sheet1!R2C1:R26C7,RC[-3]+1,FALSE)&IF(RC[2]=0,"",IF(HLOOKUP(RC[-4],Sheet1!R2C9:R26C15,RC[-3]+1,FALSE)="","","|"&HLOOKUP(RC[-4],Sheet1!R2C9:R26C15,RC[-3]+1,FALSE))) -> 10012 | F292: =IF(HLOOKUP(RC[-5],Sheet1!R2C9:R26C15,RC[-4]+1,FALSE)="",ROUND(HLOOKUP(RC[-5],Sheet1!R2C1:R26C7,RC[-4]+13,FALSE)+HLOOKUP(RC[-5],Sheet1!R2C9:R26C15,RC[-4]+13,FALSE)*RC[1],0),ROUND(HLOOKUP(RC[-5],Sheet1!R2C1:R26C7,RC[-4]+13,FALSE),0)&IF(RC[1]=0,"","|"&ROUND(HLOOKUP(RC[-5],Sheet1!R2C9:R26C15,RC[-4]+13,FALSE)*RC[1],0))) -> 102 | G292: 0 | H292: 0
A293: 3 | B293: 3 | C293: 20 | D293: 1 | E293: =HLOOKUP(RC[-4],Sheet1!R2C1:R26C7,RC[-3]+1,FALSE)&IF(RC[2]=0,"",IF(HLOOKUP(RC[-4],Sheet1!R2C9:R26C15,RC[-3]+1,FALSE)="","","|"&HLOOKUP(RC[-4],Sheet1!R2C9:R26C15,RC[-3]+1,FALSE))) -> 10012|10011 | F293: =IF(HLOOKUP(RC[-5],Sheet1!R2C9:R26C15,RC[-4]+1,FALSE)="",ROUND(HLOOKUP(RC[-5],Sheet1!R2C1:R26C7,RC[-4]+13,FALSE)+HLOOKUP(RC[-5],Sheet1!R2C9:R26C15,RC[-4]+13,FALSE)*RC[1],0),ROUND(HLOOKUP(RC[-5],Sheet1!R2C1:R26C7,RC[-4]+13,FALSE),0)&IF(RC[1]=0,"","|"&ROUND(HLOOKUP(RC[-5],Sheet1!R2C9:R26C15,RC[-4]+13,FALSE)*RC[1],0))) -> 150|30 | G293: 10 | H293: 1
A294: 3 | B294: 3 | C294: 25 | D294: 0 | E294: =HLOOKUP(RC[-4],Sheet1!R2C1:R26C7,RC[-3]+1,FALSE)&IF(RC[2]=0,"",IF(HLOOKUP(RC[-4],Sheet1!R2C9:R26C15,RC[-3]+1,FALSE)="","","|"&HLOOKUP(RC[-4],Sheet1!R2C9:R26C15,RC[-3]+1,FALSE))) -> 10012|10011 | F294: =IF(HLOOKUP(RC[-5],Sheet1!R2C9:R26C15,RC[-4]+1,FALSE)="",ROUND(HLOOKUP(RC[-5],Sheet1!R2C1:R26C7,RC[-4]+13,FALSE)+HLOOKUP(RC[-5],Sheet1!R2C9:R26C15,RC[-4]+13,FALSE)*RC[1],0),ROUND(HLOOKUP(RC[-5],Sheet1!R2C1:R26C7,RC[-4]+13,FALSE),0)&IF(RC[1]=0,"","|"&ROUND(HLOOKUP(RC[-5],Sheet1!R2C9:R26C15,RC[-4]+13,FALSE)*RC[1],0))) -> 150|27 | G294: 9 | H294: 0
A295: 3 | B295: 3 | C295: 30 | D295: 0 | E295: =HLOOKUP(RC[-4],Sheet1!R2C1:R26C7,RC[-3]+1,FALSE)&IF(RC[2]=0,"",IF(HLOOKUP(RC[-4],Sheet1!R2C9:R26C15,RC[-3]+1,FALSE)="","","|"&HLOOKUP(RC[-4],Sheet1!R2C9:R26C15,RC[-3]+1,FALSE))) -> 10012|10011 | F295: =IF(HLOOKUP(RC[-5],Sheet1!R2C9:R26C15,RC[-4]+1,FALSE)="",ROUND(HLOOKUP(RC[-5],Sheet1!R2C1:R26C7,RC[-4]+13,FALSE)+HLOOKUP(RC[-5],Sheet1!R2C9:R26C15,RC[-4]+13,FALSE)*RC[1],0),ROUND(HLOOKUP(RC[-5],Sheet1!R2C1:R26C7,RC[-4]+13,FALSE),0)&IF(RC[1]=0,"","|"&ROUND(HLOOKUP(RC[-5],Sheet1!R2C9:R26C15,RC[-4]+13,FALSE)*RC[1],0))) -> 150|24 | G295: 8 | H295: 0
A296: 3 | B296: 3 | C296: 35 | D296: 0 | E296: =HLOOKUP(RC[-4],Sheet1!R2C1:R26C7,RC[-3]+1,FALSE)&IF(RC[2]=0,"",IF(HLOOKUP(RC[-4],Sheet1!R2C9:R26C15,RC[-3]+1,FALSE)="","","|"&HLOOKUP(RC[-4],Sheet1!R2C9:R26C15,RC[-3]+1,FALSE))) -> 10012|10011 | F296: =IF(HLOOKUP(RC[-5],Sheet1!R2C9:R26C15,RC[-4]+1,FALSE)="",ROUND(HLOOKUP(RC[-5],Sheet1!R2C1:R26C7,RC[-4]+13,FALSE)+HLOOKUP(RC[-5],Sheet1!R2C9:R26C15,RC[-4]+13,FALSE)*RC[1],0),ROUND(HLOOKUP(RC[-5],Sheet1!R2C1:R26C7,RC[-4]+13,FALSE),0)&IF(RC[1]=0,"","|"&ROUND(HLOOKUP(RC[-5],Sheet1!R2C9:R26C15,RC[-4]+13,FALSE)*RC[1],0))) -> 150|21 | G296: 7 | H296: 0
A297: 3 | B297: 3 | C297: 40 | D297: 0 | E297: =HLOOKUP(RC[-4],Sheet1!R2C1:R26C7,RC[-3]+1,FALSE)&IF(RC[2]=0,"",IF(HLOOKUP(RC[-4],Sheet1!R2C9:R26C15,RC[-3]+1,FALSE)="","","|"&HLOOKUP(RC[-4],Sheet1!R2C9:R26C15,RC[-3]+1,FALSE))) -> 10012|10011 | F297: =IF(HLOOKUP(RC[-5],Sheet1!R2C9:R26C15,RC[-4]+1,FALSE)="",ROUND(HLOOKUP(RC[-5],Sheet1!R2C1:R26C7,RC[-4]+13,FALSE)+HLOOKUP(RC[-5],Sheet1!R2C9:R26C15,RC[-4]+13,FALSE)*RC[1],0),ROUND(HLOOKUP(RC[-5],Sheet1!R2C1:R26C7,RC[-4]+13,FALSE),0)&IF(RC[1]=0,"","|"&ROUND(HLOOKUP(RC[-5],Sheet1!R2C9:R26C15,RC[-4]+13,FALSE)*RC[1],0))) -> 150|18 | G297: 6 | H297: 0
A298: 3 | B298: 3 | C298: 45 | D298: 0 | E298: =HLOOKUP(RC[-4],Sheet1!R2C1:R26C7,RC[-3]+1,FALSE)&IF(RC[2]=0,"",IF(HLOOKUP(RC[-4],Sheet1!R2C9:R26C15,RC[-3]+1,FALSE)="","","|"&HLOOKUP(RC[-4],Sheet1!R2C9:R26C15,RC[-3]+1,FALSE))) -> 10012|10011 | F298: =IF(HLOOKUP(RC[-5],Sheet1!R2C9:R26C15,RC[-4]+1,FALSE)="",ROUND(HLOOKUP(RC[-5],Sheet1!R2C1:R26C7,RC[-4]+13,FALSE)+HLOOKUP(RC[-5],Sheet1!R2C9:R26C15,RC[-4]+13,FALSE)*RC[1],0),ROUND(HLOOKUP(RC[-5],Sheet1!R2C1:R26C7,RC[-4]+13,FALSE),0)&IF(RC[1]=0,"","|"&ROUND(HLOOKUP(RC[-5],Sheet1!R2C9:R26C15,RC[-4]+13,FALSE)*RC[1],0))) -> 150|15 | G298: 5 | H298: 0
A299: 3 | B299: 3 | C299: 50 | D299: 0 | E299: =HLOOKUP(RC[-4],Sheet1!R2C1:R26C7,RC[-3]+1,FALSE)&IF(RC[2]=0,"",IF(HLOOKUP(RC[-4],Sheet1!R2C9:R26C15,RC[-3]+1,FALSE)="","","|"&HLOOKUP(RC[-4],Sheet1!R2C9:R26C15,RC[-3]+1,FALSE))) -> 10012|10011 | F299: =IF(HLOOKUP(RC[-5],Sheet1!R2C9:R26C15,RC[-4]+1,FALSE)="",ROUND(HLOOKUP(RC[-5],Sheet1!R2C1:R26C7,RC[-4]+13,FALSE)+HLOOKUP(RC[-5],Sheet1!R2C9:R26C15,RC[-4]+13,FALSE)*RC[1],0),ROUND(HLOOKUP(RC[-5],Sheet1!R2C1:R26C7,RC[-4]+13,FALSE),0)&IF(RC[1]=0,"","|"&ROUND(HLOOKUP(RC[-5],Sheet1!R2C9:R26C15,RC[-4]+13,FALSE)*RC[1],0))) -> 150|12 | G299: 4 | H299: 0
A300: 3 | B300: 3 | C300: 55 | D300: 0 | E300: =HLOOKUP(RC[-4],Sheet1!R2C1:R26C7,RC[-3]+1,FALSE)&IF(RC[2]=0,"",IF(HLOOKUP(RC[-4],Sheet1!R2C9:R26C15,RC[-3]+1,FALSE)="","","|"&HLOOKUP(RC[-4],Sheet1!R2C9:R26C15,RC[-3]+1,FALSE))) -> 10012|10011 | F300: =IF(HLOOKUP(RC[-5],Sheet1!R2C9:R26C15,RC[-4]+1,FALSE)="",ROUND(HLOOKUP(RC[-5],Sheet1!R2C1:R26C7,RC[-4]+13,FALSE)+HLOOKUP(RC[-5],Sheet1!R2C9:R26C15,RC[-4]+13,FALSE)*RC[1],0),ROUND(HLOOKUP(RC[-5],Sheet1!R2C1:R26C7,RC[-4]+13,FALSE),0)&IF(RC[1]=0,"","|"&ROUND(HLOOKUP(RC[-5],Sheet1!R2C9:R26C15,RC[-4]+13,FALSE)*RC[1],0))) -> 150|9 | G300: 3 | H300: 0
A301: 3 | B301: 3 | C301: 60 | D301: 0 | E301: =HLOOKUP(RC[-4],Sheet1!R2C1:R26C7,RC[-3]+1,FALSE)&IF(RC[2]=0,"",IF(HLOOKUP(RC[-4],Sheet1!R2C9:R26C15,RC[-3]+1,FALSE)="","","|"&HLOOKUP(RC[-4],Sheet1!R2C9:R26C15,RC[-3]+1,FALSE))) -> 10012|10011 | F301: =IF(HLOOKUP(RC[-5],Sheet1!R2C9:R26C15,RC[-4]+1,FALSE)="",ROUND(HLOOKUP(RC[-5],Sheet1!R2C1:R26C7,RC[-4]+13,FALSE)+HLOOKUP(RC[-5],Sheet1!R2C9:R26C15,RC[-4]+13,FALSE)*RC[1],0),ROUND(HLOOKUP(RC[-5],Sheet1!R2C1:R26C7,RC[-4]+13,FALSE),0)&IF(RC[1]=0,"","|"&ROUND(HLOOKUP(RC[-5],Sheet1!R2C9:R26C15,RC[-4]+13,FALSE)*RC[1],0))) -> 150|6 | G301: 2 | H301: 0
A302: 3 | B302: 3 | C302: 65 | D302: 0 | E302: =HLOOKUP(RC[-4],Sheet1!R2C1:R26C7,RC[-3]+1,FALSE)&IF(RC[2]=0,"",IF(HLOOKUP(RC[-4],Sheet1!R2C9:R26C15,RC[-3]+1,FALSE)="","","|"&HLOOKUP(RC[-4],Sheet1!R2C9:R26C15,RC[-3]+1,FALSE))) -> 10012|10011 | F302: =IF(HLOOKUP(RC[-5],Sheet1!R2C9:R26C15,RC[-4]+1,FALSE)="",ROUND(HLOOKUP(RC[-5],Sheet1!R2C1:R26C7,RC[-4]+13,FALSE)+HLOOKUP(RC[-5],Sheet1!R2C9:R26C15,RC[-4]+13,FALSE)*RC[1],0),ROUND(HLOOKUP(RC[-5],Sheet1!R2C1:R26C7,RC[-4]+13,FALSE),0)&IF(RC[1]=0,"","|"&ROUND(HLOOKUP(RC[-5],Sheet1!R2C9:R26C15,RC[-4]+13,FALSE)*RC[1],0))) -> 150|3 | G302: 1 | H302: 0
A303: 3 | B303: 3 | C303: 120 | D303: 0 | E303: =HLOOKUP(RC[-4],Sheet1!R2C1:R26C7,RC[-3]+1,FALSE)&IF(RC[2]=0,"",IF(HLOOKUP(RC[-4],Sheet1!R2C9:R26C15,RC[-3]+1,FALSE)="","","|"&HLOOKUP(RC[-4],Sheet1!R2C9:R26C15,RC[-3]+1,FALSE))) -> 10012 | F303: =IF(HLOOKUP(RC[-5],Sheet1!R2C9:R26C15,RC[-4]+1,FALSE)="",ROUND(HLOOKUP(RC[-5],Sheet1!R2C1:R26C7,RC[-4]+13,FALSE)+HLOOKUP(RC[-5],Sheet1!R2C9:R26C15,RC[-4]+13,FALSE)*RC[1],0),ROUND(HLOOKUP(RC[-5],Sheet1!R2C1:R26C7,RC[-4]+13,FALSE),0)&IF(RC[1]=0,"","|"&ROUND(HLOOKUP(RC[-5],Sheet1!R2C9:R26C15,RC[-4]+13,FALSE)*RC[1],0))) -> 150 | G303: 0 | H303: 0
A304: 3 | B304: 4 | C304: 20 | D304: 1 | E304: =HLOOKUP(RC[-4],Sheet1!R2C1:R26C7,RC[-3]+1,FALSE)&IF(RC[2]=0,"",IF(HLOOKUP(RC[-4],Sheet1!R2C9:R26C15,RC[-3]+1,FALSE)="","","|"&HLOOKUP(RC[-4],Sheet1!R2C9:R26C15,RC[-3]+1,FALSE))) -> 10013|10012 | F304: =IF(HLOOKUP(RC[-5],Sheet1!R2C9:R26C15,RC[-4]+1,FALSE)="",ROUND(HLOOKUP(RC[-5],Sheet1!R2C1:R26C7,RC[-4]+13,FALSE)+HLOOKUP(RC[-5],Sheet1!R2C9:R26C15,RC[-4]+13,FALSE)*RC[1],0),ROUND(HLOOKUP(RC[-5],Sheet1!R2C1:R26C7,RC[-4]+13,FALSE),0)&IF(RC[1]=0,"","|"&ROUND(HLOOKUP(RC[-5],Sheet1!R2C9:R26C15,RC[-4]+13,FALSE)*RC[1],0))) -> 83|20 | G304: 10 | H304: 1
A305: 3 | B305: 4 | C305: 25 | D305: 0 | E305: =HLOOKUP(RC[-4],Sheet1!R2C1:R26C7,RC[-3]+1,FALSE)&IF(RC[2]=0,"",IF(HLOOKUP(RC[-4],Sheet1!R2C9:R26C15,RC[-3]+1,FALSE)="","","|"&HLOOKUP(RC[-4],Sheet1!R2C9:R26C15,RC[-3]+1,FALSE))) -> 10013|10012 | F305: =IF(HLOOKUP(RC[-5],Sheet1!R2C9:R26C15,RC[-4]+1,FALSE)="",ROUND(HLOOKUP(RC[-5],Sheet1!R2C1:R26C7,RC[-4]+13,FALSE)+HLOOKUP(RC[-5],Sheet1!R2C9:R26C15,RC[-4]+13,FALSE)*RC[1],0),ROUND(HLOOKUP(RC[-5],Sheet1!R2C1:R26C7,RC[-4]+13,FALSE),0)&IF(RC[1]=0,"","|"&ROUND(HLOOKUP(RC[-5],Sheet1!R2C9:R26C15,RC[-4]+13,FALSE)*RC[1],0))) -> 83|18 | G305: 9 | H305: 0
A306: 3 | B306: 4 | C306: 30 | D306: 0 | E306: =HLOOKUP(RC[-4],Sheet1!R2C1:R26C7,RC[-3]+1,FALSE)&IF(RC[2]=0,"",IF(HLOOKUP(RC[-4],Sheet1!R2C9:R26C15,RC[-3]+1,FALSE)="","","|"&HLOOKUP(RC[-4],Sheet1!R2C9:R26C15,RC[-3]+1,FALSE))) -> 10013|10012 | F306: =IF(HLOOKUP(RC[-5],Sheet1!R2C9:R26C15,RC[-4]+1,FALSE)="",ROUND(HLOOKUP(RC[-5],Sheet1!R2C1:R26C7,RC[-4]+13,FALSE)+HLOOKUP(RC[-5],Sheet1!R2C9:R26C15,RC[-4]+13,FALSE)*RC[1],0),ROUND(HLOOKUP(RC[-5],Sheet1!R2C1:R26C7,RC[-4]+13,FALSE),0)&IF(RC[1]=0,"","|"&ROUND(HLOOKUP(RC[-5],Sheet1!R2C9:R26C15,RC[-4]+13,FALSE)*RC[1],0))) -> 83|16 | G306: 8 | H306: 0
A307: 3 | B307: 4 | C307: 35 | D307: 0 | E307: =HLOOKUP(RC[-4],Sheet1!R2C1:R26C7,RC[-3]+1,FALSE)&IF(RC[2]=0,"",IF(HLOOKUP(RC[-4],Sheet1!R2C9:R26C15,RC[-3]+1,FALSE)="","","|"&HLOOKUP(RC[-4],Sheet1!R2C9:R26C15,RC[-3]+1,FALSE))) -> 10013|10012 | F307: =IF(HLOOKUP(RC[-5],Sheet1!R2C9:R26C15,RC[-4]+1,FALSE)="",ROUND(HLOOKUP(RC[-5],Sheet1!R2C1:R26C7,RC[-4]+13,FALSE)+HLOOKUP(RC[-5],Sheet1!R2C9:R26C15,RC[-4]+13,FALSE)*RC[1],0),ROUND(HLOOKUP(RC[-5],Sheet1!R2C1:R26C7,RC[-4]+13,FALSE),0)&IF(RC[1]=0,"","|"&ROUND(HLOOKUP(RC[-5],Sheet1!R2C9:R26C15,RC[-4]+13,FALSE)*RC[1],0))) -> 83|14 | G307: 7 | H307: 0
A308: 3 | B308: 4 | C308: 40 | D308: 0 | E308: =HLOOKUP(RC[-4],Sheet1!R2C1:R26C7,RC[-3]+1,FALSE)&IF(RC[2]=0,"",IF(HLOOKUP(RC[-4],Sheet1!R2C9:R26C15,RC[-3]+1,FALSE)="","","|"&HLOOKUP(RC[-4],Sheet1!R2C9:R26C15,RC[-3]+1,FALSE))) -> 10013|10012 | F308: =IF(HLOOKUP(RC[-5],Sheet1!R2C9:R26C15,RC[-4]+1,FALSE)="",ROUND(HLOOKUP(RC[-5],Sheet1!R2C1:R26C7,RC[-4]+13,FALSE)+HLOOKUP(RC[-5],Sheet1!R2C9:R26C15,RC[-4]+13,FALSE)*RC[1],0),ROUND(HLOOKUP(RC[-5],Sheet1!R2C1:R26C7,RC[-4]+13,FALSE),0)&IF(RC[1]=0,"","|"&ROUND(HLOOKUP(RC[-5],Sheet1!R2C9:R26C15,RC[-4]+13,FALSE)*RC[1],0))) -> 83|12 | G308: 6 | H308: 0
A309: 3 | B309: 4 | C309: 45 | D309: 0 | E309: =HLOOKUP(RC[-4],Sheet1!R2C1:R26C7,RC[-3]+1,FALSE)&IF(RC[2]=0,"",IF(HLOOKUP(RC[-4],Sheet1!R2C9:R26C15,RC[-3]+1,FALSE)="","","|"&HLOOKUP(RC[-4],Sheet1!R2C9:R26C15,RC[-3]+1,FALSE))) -> 10013|10012 | F309: =IF(HLOOKUP(RC[-5],Sheet1!R2C9:R26C15,RC[-4]+1,FALSE)="",ROUND(HLOOKUP(RC[-5],Sheet1!R2C1:R26C7,RC[-4]+13,FALSE)+HLOOKUP(RC[-5],Sheet1!R2C9:R26C15,RC[-4]+13,FALSE)*RC[1],0),ROUND(HLOOKUP(RC[-5],Sheet1!R2C1:R26C7,RC[-4]+13,FALSE),0)&IF(RC[1]=0,"","|"&ROUND(HLOOKUP(RC[-5],Sheet1!R2C9:R26C15,RC[-4]+13,FALSE)*RC[1],0))) -> 83|10 | G309: 5 | H309: 0
A310: 3 | B310: 4 | C310: 50 | D310: 0 | E310: =HLOOKUP(RC[-4],Sheet1!R2C1:R26C7,RC[-3]+1,FALSE)&IF(RC[2]=0,"",IF(HLOOKUP(RC[-4],Sheet1!R2C9:R26C15,RC[-3]+1,FALSE)="","","|"&HLOOKUP(RC[-4],Sheet1!R2C9:R26C15,RC[-3]+1,FALSE))) -> 10013|10012 | F310: =IF(HLOOKUP(RC[-5],Sheet1!R2C9:R26C15,RC[-4]+1,FALSE)="",ROUND(HLOOKUP(RC[-5],Sheet1!R2C1:R26C7,RC[-4]+13,FALSE)+HLOOKUP(RC[-5],Sheet1!R2C9:R26C15,RC[-4]+13,FALSE)*RC[1],0),ROUND(HLOOKUP(RC[-5],Sheet1!R2C1:R26C7,RC[-4]+13,FALSE),0)&IF(RC[1]=0,"","|"&ROUND(HLOOKUP(RC[-5],Sheet1!R2C9:R26C15,RC[-4]+13,FALSE)*RC[1],0))) -> 83|8 | G310: 4 | H310: 0
A311: 3 | B311: 4 | C311: 55 | D311: 0 | E311: =HLOOKUP(RC[-4],Sheet1!R2C1:R26C7,RC[-3]+1,FALSE)&IF(RC[2]=0,"",IF(HLOOKUP(RC[-4],Sheet1!R2C9:R26C15,RC[-3]+1,FALSE)="","","|"&HLOOKUP(RC[-4],Sheet1!R2C9:R26C15,RC[-3]+1,FALSE))) -> 10013|10012 | F311: =IF(HLOOKUP(RC[-5],Sheet1!R2C9:R26C15,RC[-4]+1,FALSE)="",ROUND(HLOOKUP(RC[-5],Sheet1!R2C1:R26C7,RC[-4]+13,FALSE)+HLOOKUP(RC[-5],Sheet1!R2C9:R26C15,RC[-4]+13,FALSE)*RC[1],0),ROUND(HLOOKUP(RC[-5],Sheet1!R2C1:R26C7,RC[-4]+13,FALSE),0)&IF(RC[1]=0,"","|"&ROUND(HLOOKUP(RC[-5],Sheet1!R2C9:R26C15,RC[-4]+13,FALSE)*RC[1],0))) -> 83|6 | G311: 3 | H311: 0
A312: 3 | B312: 4 | C312: 60 | D312: 0 | E312: =HLOOKUP(RC[-4],Sheet1!R2C1:R26C7,RC[-3]+1,FALSE)&IF(RC[2]=0,"",IF(HLOOKUP(RC[-4],Sheet1!R2C9:R26C15,RC[-3]+1,FALSE)="","","|"&HLOOKUP(RC[-4],Sheet1!R2C9:R26C15,RC[-3]+1,FALSE))) -> 10013|10012 | F312: =IF(HLOOKUP(RC[-5],Sheet1!R2C9:R26C15,RC[-4]+1,FALSE)="",ROUND(HLOOKUP(RC[-5],Sheet1!R2C1:R26C7,RC[-4]+13,FALSE)+HLOOKUP(RC[-5],Sheet1!R2C9:R26C15,RC[-4]+13,FALSE)*RC[1],0),ROUND(HLOOKUP(RC[-5],Sheet1!R2C1:R26C7,RC[-4]+13,FALSE),0)&IF(RC[1]=0,"","|"&ROUND(HLOOKUP(RC[-5],Sheet1!R2C9:R26C15,RC[-4]+13,FALSE)*RC[1],0))) -> 83|4 | G312: 2 | H312: 0
A313: 3 | B313: 4 | C313: 65 | D313: 0 | E313: =HLOOKUP(RC[-4],Sheet1!R2C1:R26C7,RC[-3]+1,FALSE)&IF(RC[2]=0,"",IF(HLOOKUP(RC[-4],Sheet1!R2C9:R26C15,RC[-3]+1,FALSE)="","","|"&HLOOKUP(RC[-4],Sheet1!R2C9:R26C15,RC[-3]+1,FALSE))) -> 10013|10012 | F313: =IF(HLOOKUP(RC[-5],Sheet1!R2C9:R26C15,RC[-4]+1,FALSE)="",ROUND(HLOOKUP(RC[-5],Sheet1!R2C1:R26C7,RC[-4]+13,FALSE)+HLOOKUP(RC[-5],Sheet1!R2C9:R26C15,RC[-4]+13,FALSE)*RC[1],0),ROUND(HLOOKUP(RC[-5],Sheet1!R2C1:R26C7,RC[-4]+13,FALSE),0)&IF(RC[1]=0,"","|"&ROUND(HLOOKUP(RC[-5],Sheet1!R2C9:R26C15,RC[-4]+13,FALSE)*RC[1],0))) -> 83|2 | G313: 1 | H313: 0
A314: 3 | B314: 4 | C314: 120 | D314: 0 | E314: =HLOOKUP(RC[-4],Sheet1!R2C1:R26C7,RC[-3]+1,FALSE)&IF(RC[2]=0,"",IF(HLOOKUP(RC[-4],Sheet1!R2C9:R26C15,RC[-3]+1,FALSE)="","","|"&HLOOKUP(RC[-4],Sheet1!R2C9:R26C15,RC[-3]+1,FALSE))) -> 10013 | F314: =IF(HLOOKUP(RC[-5],Sheet1!R2C9:R26C15,RC[-4]+1,FALSE)="",ROUND(HLOOKUP(RC[-5],Sheet1!R2C1:R26C7,RC[-4]+13,FALSE)+HLOOKUP(RC[-5],Sheet1!R2C9:R26C15,RC[-4]+13,FALSE)*RC[1],0),ROUND(HLOOKUP(RC[-5],Sheet1!R2C1:R26C7,RC[-4]+13,FALSE),0)&IF(RC[1]=0,"","|"&ROUND(HLOOKUP(RC[-5],Sheet1!R2C9:R26C15,RC[-4]+13,FALSE)*RC[1],0))) -> 83 | G314: 0 | H314: 0
A315: 3 | B315: 5 | C315: 20 | D315: 1 | E315: =HLOOKUP(RC[-4],Sheet1!R2C1:R26C7,RC[-3]+1,FALSE)&IF(RC[2]=0,"",IF(HLOOKUP(RC[-4],Sheet1!R2C9:R26C15,RC[-3]+1,FALSE)="","","|"&HLOOKUP(RC[-4],Sheet1!R2C9:R26C15,RC[-3]+1,FALSE))) -> 10013|10012 | F315: =IF(HLOOKUP(RC[-5],Sheet1!R2C9:R26C15,RC[-4]+1,FALSE)="",ROUND(HLOOKUP(RC[-5],Sheet1!R2C1:R26C7,RC[-4]+13,FALSE)+HLOOKUP(RC[-5],Sheet1!R2C9:R26C15,RC[-4]+13,FALSE)*RC[1],0),ROUND(HLOOKUP(RC[-5],Sheet1!R2C1:R26C7,RC[-4]+13,FALSE),0)&IF(RC[1]=0,"","|"&ROUND(HLOOKUP(RC[-5],Sheet1!R2C9:R26C15,RC[-4]+13,FALSE)*RC[1],0))) -> 108|30 | G315: 10 | H315: 1
A316: 3 | B316: 5 | C316: 25 | D316: 0 | E316: =HLOOKUP(RC[-4],Sheet1!R2C1:R26C7,RC[-3]+1,FALSE)&IF(RC[2]=0,"",IF(HLOOKUP(RC[-4],Sheet1!R2C9:R26C15,RC[-3]+1,FALSE)="","","|"&HLOOKUP(RC[-4],Sheet1!R2C9:R26C15,RC[-3]+1,FALSE))) -> 10013|10012 | F316: =IF(HLOOKUP(RC[-5],Sheet1!R2C9:R26C15,RC[-4]+1,FALSE)="",ROUND(HLOOKUP(RC[-5],Sheet1!R2C1:R26C7,RC[-4]+13,FALSE)+HLOOKUP(RC[-5],Sheet1!R2C9:R26C15,RC[-4]+13,FALSE)*RC[1],0),ROUND(HLOOKUP(RC[-5],Sheet1!R2C1:R26C7,RC[-4]+13,FALSE),0)&IF(RC[1]=0,"","|"&ROUND(HLOOKUP(RC[-5],Sheet1!R2C9:R26C15,RC[-4]+13,FALSE)*RC[1],0))) -> 108|27 | G316: 9 | H316: 0
A317: 3 | B317: 5 | C317: 30 | D317: 0 | E317: =HLOOKUP(RC[-4],Sheet1!R2C1:R26C7,RC[-3]+1,FALSE)&IF(RC[2]=0,"",IF(HLOOKUP(RC[-4],Sheet1!R2C9:R26C15,RC[-3]+1,FALSE)="","","|"&HLOOKUP(RC[-4],Sheet1!R2C9:R26C15,RC[-3]+1,FALSE))) -> 10013|10012 | F317: =IF(HLOOKUP(RC[-5],Sheet1!R2C9:R26C15,RC[-4]+1,FALSE)="",ROUND(HLOOKUP(RC[-5],Sheet1!R2C1:R26C7,RC[-4]+13,FALSE)+HLOOKUP(RC[-5],Sheet1!R2C9:R26C15,RC[-4]+13,FALSE)*RC[1],0),ROUND(HLOOKUP(RC[-5],Sheet1!R2C1:R26C7,RC[-4]+13,FALSE),0)&IF(RC[1]=0,"","|"&ROUND(HLOOKUP(RC[-5],Sheet1!R2C9:R26C15,RC[-4]+13,FALSE)*RC[1],0))) -> 108|24 | G317: 8 | H317: 0
A318: 3 | B318: 5 | C318: 35 | D318: 0 | E318: =HLOOKUP(RC[-4],Sheet1!R2C1:R26C7,RC[-3]+1,FALSE)&IF(RC[2]=0,"",IF(HLOOKUP(RC[-4],Sheet1!R2C9:R26C15,RC[-3]+1,FALSE)="","","|"&HLOOKUP(RC[-4],Sheet1!R2C9:R26C15,RC[-3]+1,FALSE))) -> 10013|10012 | F318: =IF(HLOOKUP(RC[-5],Sheet1!R2C9:R26C15,RC[-4]+1,FALSE)="",ROUND(HLOOKUP(RC[-5],Sheet1!R2C1:R26C7,RC[-4]+13,FALSE)+HLOOKUP(RC[-5],Sheet1!R2C9:R26C15,RC[-4]+13,FALSE)*RC[1],0),ROUND(HLOOKUP(RC[-5],Sheet1!R2C1:R26C7,RC[-4]+13,FALSE),0)&IF(RC[1]=0,"","|"&ROUND(HLOOKUP(RC[-5],Sheet1!R2C9:R26C15,RC[-4]+13,FALSE)*RC[1],0))) -> 108|21 | G318: 7 | H318: 0
A319: 3 | B319: 5 | C319: 40 | D319: 0 | E319: =HLOOKUP(RC[-4],Sheet1!R2C1:R26C7,RC[-3]+1,FALSE)&IF(RC[2]=0,"",IF(HLOOKUP(RC[-4],Sheet1!R2C9:R26C15,RC[-3]+1,FALSE)="","","|"&HLOOKUP(RC[-4],Sheet1!R2C9:R26C15,RC[-3]+1,FALSE))) -> 10013|10012 | F319: =IF(HLOOKUP(RC[-5],Sheet1!R2C9:R26C15,RC[-4]+1,FALSE)="",ROUND(HLOOKUP(RC[-5],Sheet1!R2C1:R26C7,RC[-4]+13,FALSE)+HLOOKUP(RC[-5],Sheet1!R2C9:R26C15,RC[-4]+13,FALSE)*RC[1],0),ROUND(HLOOKUP(RC[-5],Sheet1!R2C1:R26C7,RC[-4]+13,FALSE),0)&IF(RC[1]=0,"","|"&ROUND(HLOOKUP(RC[-5],Sheet1!R2C9:R26C15,RC[-4]+13,FALSE)*RC[1],0))) -> 108|18 | G319: 6 | H319: 0
A320: 3 | B320: 5 | C320: 45 | D320: 0 | E320: =HLOOKUP(RC[-4],Sheet1!R2C1:R26C7,RC[-3]+1,FALSE)&IF(RC[2]=0,"",IF(HLOOKUP(RC[-4],Sheet1!R2C9:R26C15,RC[-3]+1,FALSE)="","","|"&HLOOKUP(RC[-4],Sheet1!R2C9:R26C15,RC[-3]+1,FALSE))) -> 10013|10012 | F320: =IF(HLOOKUP(RC[-5],Sheet1!R2C9:R26C15,RC[-4]+1,FALSE)="",ROUND(HLOOKUP(RC[-5],Sheet1!R2C1:R26C7,RC[-4]+13,FALSE)+HLOOKUP(RC[-5],Sheet1!R2C9:R26C15,RC[-4]+13,FALSE)*RC[1],0),ROUND(HLOOKUP(RC[-5],Sheet1!R2C1:R26C7,RC[-4]+13,FALSE),0)&IF(RC[1]=0,"","|"&ROUND(HLOOKUP(RC[-5],Sheet1!R2C9:R26C15,RC[-4]+13,FALSE)*RC[1],0))) -> 108|15 | G320: 5 | H320: 0
A321: 3 | B321: 5 | C321: 50 | D321: 0 | E321: =HLOOKUP(RC[-4],Sheet1!R2C1:R26C7,RC[-3]+1,FALSE)&IF(RC[2]=0,"",IF(HLOOKUP(RC[-4],Sheet1!R2C9:R26C15,RC[-3]+1,FALSE)="","","|"&HLOOKUP(RC[-4],Sheet1!R2C9:R26C15,RC[-3]+1,FALSE))) -> 10013|10012 | F321: =IF(HLOOKUP(RC[-5],Sheet1!R2C9:R26C15,RC[-4]+1,FALSE)="",ROUND(HLOOKUP(RC[-5],Sheet1!R2C1:R26C7,RC[-4]+13,FALSE)+HLOOKUP(RC[-5],Sheet1!R2C9:R26C15,RC[-4]+13,FALSE)*RC[1],0),ROUND(HLOOKUP(RC[-5],Sheet1!R2C1:R26C7,RC[-4]+13,FALSE),0)&IF(RC[1]=0,"","|"&ROUND(HLOOKUP(RC[-5],Sheet1!R2C9:R26C15,RC[-4]+13,FALSE)*RC[1],0))) -> 108|12 | G321: 4 | H321: 0
A322: 3 | B322: 5 | C322: 55 | D322: 0 | E322: =HLOOKUP(RC[-4],Sheet1!R2C1:R26C7,RC[-3]+1,FALSE)&IF(RC[2]=0,"",IF(HLOOKUP(RC[-4],Sheet1!R2C9:R26C15,RC[-3]+1,FALSE)="","","|"&HLOOKUP(RC[-4],Sheet1!R2C9:R26C15,RC[-3]+1,FALSE))) -> 10013|10012 | F322: =IF(HLOOKUP(RC[-5],Sheet1!R2C9:R26C15,RC[-4]+1,FALSE)="",ROUND(HLOOKUP(RC[-5],Sheet1!R2C1:R26C7,RC[-4]+13,FALSE)+HLOOKUP(RC[-5],Sheet1!R2C9:R26C15,RC[-4]+13,FALSE)*RC[1],0),ROUND(HLOOKUP(RC[-5],Sheet1!R2C1:R26C7,RC[-4]+13,FALSE),0)&IF(RC[1]=0,"","|"&ROUND(HLOOKUP(RC[-5],Sheet1!R2C9:R26C15,RC[-4]+13,FALSE)*RC[1],0))) -> 108|9 | G322: 3 | H322: 0
A323: 3 | B323: 5 | C323: 60 | D323: 0 | E323: =HLOOKUP(RC[-4],Sheet1!R2C1:R26C7,RC[-3]+1,FALSE)&IF(RC[2]=0,"",IF(HLOOKUP(RC[-4],Sheet1!R2C9:R26C15,RC[-3]+1,FALSE)="","","|"&HLOOKUP(RC[-4],Sheet1!R2C9:R26C15,RC[-3]+1,FALSE))) -> 10013|10012 | F323: =IF(HLOOKUP(RC[-5],Sheet1!R2C9:R26C15,RC[-4]+1,FALSE)="",ROUND(HLOOKUP(RC[-5],Sheet1!R2C1:R26C7,RC[-4]+13,FALSE)+HLOOKUP(RC[-5],Sheet1!R2C9:R26C15,RC[-4]+13,FALSE)*RC[1],0),ROUND(HLOOKUP(RC[-5],Sheet1!R2C1:R26C7,RC[-4]+13,FALSE),0)&IF(RC[1]=0,"","|"&ROUND(HLOOKUP(RC[-5],Sheet1!R2C9:R26C15,RC[-4]+13,FALSE)*RC[1],0))) -> 108|6 | G323: 2 | H323: 0
A324: 3 | B324: 5 | C324: 65 | D324: 0 | E324: =HLOOKUP(RC[-4],Sheet1!R2C1:R26C7,RC[-3]+1,FALSE)&IF(RC[2]=0,"",IF(HLOOKUP(RC[-4],Sheet1!R2C9:R26C15,RC[-3]+1,FALSE)="","","|"&HLOOKUP(RC[-4],Sheet1!R2C9:R26C15,RC[-3]+1,FALSE))) -> 10013|10012 | F324: =IF(HLOOKUP(RC[-5],Sheet1!R2C9:R26C15,RC[-4]+1,FALSE)="",ROUND(HLOOKUP(RC[-5],Sheet1!R2C1:R26C7,RC[-4]+13,FALSE)+HLOOKUP(RC[-5],Sheet1!R2C9:R26C15,RC[-4]+13,FALSE)*RC[1],0),ROUND(HLOOKUP(RC[-5],Sheet1!R2C1:R26C7,RC[-4]+13,FALSE),0)&IF(RC[1]=0,"","|"&ROUND(HLOOKUP(RC[-5],Sheet1!R2C9:R26C15,RC[-4]+13,FALSE)*RC[1],0))) -> 108|3 | G324: 1 | H324: 0
A325: 3 | B325: 5 | C325: 120 | D325: 0 | E325: =HLOOKUP(RC[-4],Sheet1!R2C1:R26C7,RC[-3]+1,FALSE)&IF(RC[2]=0,"",IF(HLOOKUP(RC[-4],Sheet1!R2C9:R26C15,RC[-3]+1,FALSE)="","","|"&HLOOKUP(RC[-4],Sheet1!R2C9:R26C15,RC[-3]+1,FALSE))) -> 10013 | F325: =IF(HLOOKUP(RC[-5],Sheet1!R2C9:R26C15,RC[-4]+1,FALSE)="",ROUND(HLOOKUP(RC[-5],Sheet1!R2C1:R26C7,RC[-4]+13,FALSE)+HLOOKUP(RC[-5],Sheet1!R2C9:R26C15,RC[-4]+13,FALSE)*RC[1],0),ROUND(HLOOKUP(RC[-5],Sheet1!R2C1:R26C7,RC[-4]+13,FALSE),0)&IF(RC[1]=0,"","|"&ROUND(HLOOKUP(RC[-5],Sheet1!R2C9:R26C15,RC[-4]+13,FALSE)*RC[1],0))) -> 108 | G325: 0 | H325: 0
A326: 3 | B326: 6 | C326: 20 | D326: 1 | E326: =HLOOKUP(RC[-4],Sheet1!R2C1:R26C7,RC[-3]+1,FALSE)&IF(RC[2]=0,"",IF(HLOOKUP(RC[-4],Sheet1!R2C9:R26C15,RC[-3]+1,FALSE)="","","|"&HLOOKUP(RC[-4],Sheet1!R2C9:R26C15,RC[-3]+1,FALSE))) -> 10013|10012 | F326: =IF(HLOOKUP(RC[-5],Sheet1!R2C9:R26C15,RC[-4]+1,FALSE)="",ROUND(HLOOKUP(RC[-5],Sheet1!R2C1:R26C7,RC[-4]+13,FALSE)+HLOOKUP(RC[-5],Sheet1!R2C9:R26C15,RC[-4]+13,FALSE)*RC[1],0),ROUND(HLOOKUP(RC[-5],Sheet1!R2C1:R26C7,RC[-4]+13,FALSE),0)&IF(RC[1]=0,"","|"&ROUND(HLOOKUP(RC[-5],Sheet1!R2C9:R26C15,RC[-4]+13,FALSE)*RC[1],0))) -> 137|40 | G326: 10 | H326: 1
A327: 3 | B327: 6 | C327: 25 | D327: 0 | E327: =HLOOKUP(RC[-4],Sheet1!R2C1:R26C7,RC[-3]+1,FALSE)&IF(RC[2]=0,"",IF(HLOOKUP(RC[-4],Sheet1!R2C9:R26C15,RC[-3]+1,FALSE)="","","|"&HLOOKUP(RC[-4],Sheet1!R2C9:R26C15,RC[-3]+1,FALSE))) -> 10013|10012 | F327: =IF(HLOOKUP(RC[-5],Sheet1!R2C9:R26C15,RC[-4]+1,FALSE)="",ROUND(HLOOKUP(RC[-5],Sheet1!R2C1:R26C7,RC[-4]+13,FALSE)+HLOOKUP(RC[-5],Sheet1!R2C9:R26C15,RC[-4]+13,FALSE)*RC[1],0),ROUND(HLOOKUP(RC[-5],Sheet1!R2C1:R26C7,RC[-4]+13,FALSE),0)&IF(RC[1]=0,"","|"&ROUND(HLOOKUP(RC[-5],Sheet1!R2C9:R26C15,RC[-4]+13,FALSE)*RC[1],0))) -> 137|36 | G327: 9 | H327: 0
A328: 3 | B328: 6 | C328: 30 | D328: 0 | E328: =HLOOKUP(RC[-4],Sheet1!R2C1:R26C7,RC[-3]+1,FALSE)&IF(RC[2]=0,"",IF(HLOOKUP(RC[-4],Sheet1!R2C9:R26C15,RC[-3]+1,FALSE)="","","|"&HLOOKUP(RC[-4],Sheet1!R2C9:R26C15,RC[-3]+1,FALSE))) -> 10013|10012 | F328: =IF(HLOOKUP(RC[-5],Sheet1!R2C9:R26C15,RC[-4]+1,FALSE)="",ROUND(HLOOKUP(RC[-5],Sheet1!R2C1:R26C7,RC[-4]+13,FALSE)+HLOOKUP(RC[-5],Sheet1!R2C9:R26C15,RC[-4]+13,FALSE)*RC[1],0),ROUND(HLOOKUP(RC[-5],Sheet1!R2C1:R26C7,RC[-4]+13,FALSE),0)&IF(RC[1]=0,"","|"&ROUND(HLOOKUP(RC[-5],Sheet1!R2C9:R26C15,RC[-4]+13,FALSE)*RC[1],0))) -> 137|32 | G328: 8 | H328: 0
A329: 3 | B329: 6 | C329: 35 | D329: 0 | E329: =HLOOKUP(RC[-4],Sheet1!R2C1:R26C7,RC[-3]+1,FALSE)&IF(RC[2]=0,"",IF(HLOOKUP(RC[-4],Sheet1!R2C9:R26C15,RC[-3]+1,FALSE)="","","|"&HLOOKUP(RC[-4],Sheet1!R2C9:R26C15,RC[-3]+1,FALSE))) -> 10013|10012 | F329: =IF(HLOOKUP(RC[-5],Sheet1!R2C9:R26C15,RC[-4]+1,FALSE)="",ROUND(HLOOKUP(RC[-5],Sheet1!R2C1:R26C7,RC[-4]+13,FALSE)+HLOOKUP(RC[-5],Sheet1!R2C9:R26C15,RC[-4]+13,FALSE)*RC[1],0),ROUND(HLOOKUP(RC[-5],Sheet1!R2C1:R26C7,RC[-4]+13,FALSE),0)&IF(RC[1]=0,"","|"&ROUND(HLOOKUP(RC[-5],Sheet1!R2C9:R26C15,RC[-4]+13,FALSE)*RC[1],0))) -> 137|28 | G329: 7 | H329: 0
A330: 3 | B330: 6 | C330: 40 | D330: 0 | E330: =HLOOKUP(RC[-4],Sheet1!R2C1:R26C7,RC[-3]+1,FALSE)&IF(RC[2]=0,"",IF(HLOOKUP(RC[-4],Sheet1!R2C9:R26C15,RC[-3]+1,FALSE)="","","|"&HLOOKUP(RC[-4],Sheet1!R2C9:R26C15,RC[-3]+1,FALSE))) -> 10013|10012 | F330: =IF(HLOOKUP(RC[-5],Sheet1!R2C9:R26C15,RC[-4]+1,FALSE)="",ROUND(HLOOKUP(RC[-5],Sheet1!R2C1:R26C7,RC[-4]+13,FALSE)+HLOOKUP(RC[-5],Sheet1!R2C9:R26C15,RC[-4]+13,FALSE)*RC[1],0),ROUND(HLOOKUP(RC[-5],Sheet1!R2C1:R26C7,RC[-4]+13,FALSE),0)&IF(RC[1]=0,"","|"&ROUND(HLOOKUP(RC[-5],Sheet1!R2C9:R26C15,RC[-4]+13,FALSE)*RC[1],0))) -> 137|24 | G330: 6 | H330: 0
A331: 3 | B331: 6 | C331: 45 | D331: 0 | E331: =HLOOKUP(RC[-4],Sheet1!R2C1:R26C7,RC[-3]+1,FALSE)&IF(RC[2]=0,"",IF(HLOOKUP(RC[-4],Sheet1!R2C9:R26C15,RC[-3]+1,FALSE)="","","|"&HLOOKUP(RC[-4],Sheet1!R2C9:R26C15,RC[-3]+1,FALSE))) -> 10013|10012 | F331: =IF(HLOOKUP(RC[-5],Sheet1!R2C9:R26C15,RC[-4]+1,FALSE)="",ROUND(HLOOKUP(RC[-5],Sheet1!R2C1:R26C7,RC[-4]+13,FALSE)+HLOOKUP(RC[-5],Sheet1!R2C9:R26C15,RC[-4]+13,FALSE)*RC[1],0),ROUND(HLOOKUP(RC[-5],Sheet1!R2C1:R26C7,RC[-4]+13,FALSE),0)&IF(RC[1]=0,"","|"&ROUND(HLOOKUP(RC[-5],Sheet1!R2C9:R26C15,RC[-4]+13,FALSE)*RC[1],0))) -> 137|20 | G331: 5 | H331: 0
A332: 3 | B332: 6 | C332: 50 | D332: 0 | E332: =HLOOKUP(RC[-4],Sheet1!R2C1:R26C7,RC[-3]+1,FALSE)&IF(RC[2]=0,"",IF(HLOOKUP(RC[-4],Sheet1!R2C9:R26C15,RC[-3]+1,FALSE)="","","|"&HLOOKUP(RC[-4],Sheet1!R2C9:R26C15,RC[-3]+1,FALSE))) -> 10013|10012 | F332: =IF(HLOOKUP(RC[-5],Sheet1!R2C9:R26C15,RC[-4]+1,FALSE)="",ROUND(HLOOKUP(RC[-5],Sheet1!R2C1:R26C7,RC[-4]+13,FALSE)+HLOOKUP(RC[-5],Sheet1!R2C9:R26C15,RC[-4]+13,FALSE)*RC[1],0),ROUND(HLOOKUP(RC[-5],Sheet1!R2C1:R26C7,RC[-4]+13,FALSE),0)&IF(RC[1]=0,"","|"&ROUND(HLOOKUP(RC[-5],Sheet1!R2C9:R26C15,RC[-4]+13,FALSE)*RC[1],0))) -> 137|16 | G332: 4 | H332: 0
A333: 3 | B333: 6 | C333: 55 | D333: 0 | E333: =HLOOKUP(RC[-4],Sheet1!R2C1:R26C7,RC[-3]+1,FALSE)&IF(RC[2]=0,"",IF(HLOOKUP(RC[-4],Sheet1!R2C9:R26C15,RC[-3]+1,FALSE)="","","|"&HLOOKUP(RC[-4],Sheet1!R2C9:R26C15,RC[-3]+1,FALSE))) -> 10013|10012 | F333: =IF(HLOOKUP(RC[-5],Sheet1!R2C9:R26C15,RC[-4]+1,FALSE)="",ROUND(HLOOKUP(RC[-5],Sheet1!R2C1:R26C7,RC[-4]+13,FALSE)+HLOOKUP(RC[-5],Sheet1!R2C9:R26C15,RC[-4]+13,FALSE)*RC[1],0),ROUND(HLOOKUP(RC[-5],Sheet1!R2C1:R26C7,RC[-4]+13,FALSE),0)&IF(RC[1]=0,"","|"&ROUND(HLOOKUP(RC[-5],Sheet1!R2C9:R26C15,RC[-4]+13,FALSE)*RC[1],0))) -> 137|12 | G333: 3 | H333: 0
A334: 3 | B334: 6 | C334: 60 | D334: 0 | E334: =HLOOKUP(RC[-4],Sheet1!R2C1:R26C7,RC[-3]+1,FALSE)&IF(RC[2]=0,"",IF(HLOOKUP(RC[-4],Sheet1!R2C9:R26C15,RC[-3]+1,FALSE)="","","|"&HLOOKUP(RC[-4],Sheet1!R2C9:R26C15,RC[-3]+1,FALSE))) -> 10013|10012 | F334: =IF(HLOOKUP(RC[-5],Sheet1!R2C9:R26C15,RC[-4]+1,FALSE)="",ROUND(HLOOKUP(RC[-5],Sheet1!R2C1:R26C7,RC[-4]+13,FALSE)+HLOOKUP(RC[-5],Sheet1!R2C9:R26C15,RC[-4]+13,FALSE)*RC[1],0),ROUND(HLOOKUP(RC[-5],Sheet1!R2C1:R26C7,RC[-4]+13,FALSE),0)&IF(RC[1]=0,"","|"&ROUND(HLOOKUP(RC[-5],Sheet1!R2C9:R26C15,RC[-4]+13,FALSE)*RC[1],0))) -> 137|8 | G334: 2 | H334: 0
A335: 3 | B335: 6 | C335: 65 | D335: 0 | E335: =HLOOKUP(RC[-4],Sheet1!R2C1:R26C7,RC[-3]+1,FALSE)&IF(RC[2]=0,"",IF(HLOOKUP(RC[-4],Sheet1!R2C9:R26C15,RC[-3]+1,FALSE)="","","|"&HLOOKUP(RC[-4],Sheet1!R2C9:R26C15,RC[-3]+1,FALSE))) -> 10013|10012 | F335: =IF(HLOOKUP(RC[-5],Sheet1!R2C9:R26C15,RC[-4]+1,FALSE)="",ROUND(HLOOKUP(RC[-5],Sheet1!R2C1:R26C7,RC[-4]+13,FALSE)+HLOOKUP(RC[-5],Sheet1!R2C9:R26C15,RC[-4]+13,FALSE)*RC[1],0),ROUND(HLOOKUP(RC[-5],Sheet1!R2C1:R26C7,RC[-4]+13,FALSE),0)&IF(RC[1]=0,"","|"&ROUND(HLOOKUP(RC[-5],Sheet1!R2C9:R26C15,RC[-4]+13,FALSE)*RC[1],0))) -> 137|4 | G335: 1 | H335: 0
A336: 3 | B336: 6 | C336: 120 | D336: 0 | E336: =HLOOKUP(RC[-4],Sheet1!R2C1:R26C7,RC[-3]+1,FALSE)&IF(RC[2]=0,"",IF(HLOOKUP(RC[-4],Sheet1!R2C9:R26C15,RC[-3]+1,FALSE)="","","|"&HLOOKUP(RC[-4],Sheet1!R2C9:R26C15,RC[-3]+1,FALSE))) -> 10013 | F336: =IF(HLOOKUP(RC[-5],Sheet1!R2C9:R26C15,RC[-4]+1,FALSE)="",ROUND(HLOOKUP(RC[-5],Sheet1!R2C1:R26C7,RC[-4]+13,FALSE)+HLOOKUP(RC[-5],Sheet1!R2C9:R26C15,RC[-4]+13,FALSE)*RC[1],0),ROUND(HLOOKUP(RC[-5],Sheet1!R2C1:R26C7,RC[-4]+13,FALSE),0)&IF(RC[1]=0,"","|"&ROUND(HLOOKUP(RC[-5],Sheet1!R2C9:R26C15,RC[-4]+13,FALSE)*RC[1],0))) -> 137 | G336: 0 | H336: 0
A337: 3 | B337: 7 | C337: 20 | D337: 1 | E337: =HLOOKUP(RC[-4],Sheet1!R2C1:R26C7,RC[-3]+1,FALSE)&IF(RC[2]=0,"",IF(HLOOKUP(RC[-4],Sheet1!R2C9:R26C15,RC[-3]+1,FALSE)="","","|"&HLOOKUP(RC[-4],Sheet1!R2C9:R26C15,RC[-3]+1,FALSE))) -> 10014|10013 | F337: =IF(HLOOKUP(RC[-5],Sheet1!R2C9:R26C15,RC[-4]+1,FALSE)="",ROUND(HLOOKUP(RC[-5],Sheet1!R2C1:R26C7,RC[-4]+13,FALSE)+HLOOKUP(RC[-5],Sheet1!R2C9:R26C15,RC[-4]+13,FALSE)*RC[1],0),ROUND(HLOOKUP(RC[-5],Sheet1!R2C1:R26C7,RC[-4]+13,FALSE),0)&IF(RC[1]=0,"","|"&ROUND(HLOOKUP(RC[-5],Sheet1!R2C9:R26C15,RC[-4]+13,FALSE)*RC[1],0))) -> 84|20 | G337: 10 | H337: 1
A338: 3 | B338: 7 | C338: 25 | D338: 0 | E338: =HLOOKUP(RC[-4],Sheet1!R2C1:R26C7,RC[-3]+1,FALSE)&IF(RC[2]=0,"",IF(HLOOKUP(RC[-4],Sheet1!R2C9:R26C15,RC[-3]+1,FALSE)="","","|"&HLOOKUP(RC[-4],Sheet1!R2C9:R26C15,RC[-3]+1,FALSE))) -> 10014|10013 | F338: =IF(HLOOKUP(RC[-5],Sheet1!R2C9:R26C15,RC[-4]+1,FALSE)="",ROUND(HLOOKUP(RC[-5],Sheet1!R2C1:R26C7,RC[-4]+13,FALSE)+HLOOKUP(RC[-5],Sheet1!R2C9:R26C15,RC[-4]+13,FALSE)*RC[1],0),ROUND(HLOOKUP(RC[-5],Sheet1!R2C1:R26C7,RC[-4]+13,FALSE),0)&IF(RC[1]=0,"","|"&ROUND(HLOOKUP(RC[-5],Sheet1!R2C9:R26C15,RC[-4]+13,FALSE)*RC[1],0))) -> 84|18 | G338: 9 | H338: 0
A339: 3 | B339: 7 | C339: 30 | D339: 0 | E339: =HLOOKUP(RC[-4],Sheet1!R2C1:R26C7,RC[-3]+1,FALSE)&IF(RC[2]=0,"",IF(HLOOKUP(RC[-4],Sheet1!R2C9:R26C15,RC[-3]+1,FALSE)="","","|"&HLOOKUP(RC[-4],Sheet1!R2C9:R26C15,RC[-3]+1,FALSE))) -> 10014|10013 | F339: =IF(HLOOKUP(RC[-5],Sheet1!R2C9:R26C15,RC[-4]+1,FALSE)="",ROUND(HLOOKUP(RC[-5],Sheet1!R2C1:R26C7,RC[-4]+13,FALSE)+HLOOKUP(RC[-5],Sheet1!R2C9:R26C15,RC[-4]+13,FALSE)*RC[1],0),ROUND(HLOOKUP(RC[-5],Sheet1!R2C1:R26C7,RC[-4]+13,FALSE),0)&IF(RC[1]=0,"","|"&ROUND(HLOOKUP(RC[-5],Sheet1!R2C9:R26C15,RC[-4]+13,FALSE)*RC[1],0))) -> 84|16 | G339: 8 | H339: 0
A340: 3 | B340: 7 | C340: 35 | D340: 0 | E340: =HLOOKUP(RC[-4],Sheet1!R2C1:R26C7,RC[-3]+1,FALSE)&IF(RC[2]=0,"",IF(HLOOKUP(RC[-4],Sheet1!R2C9:R26C15,RC[-3]+1,FALSE)="","","|"&HLOOKUP(RC[-4],Sheet1!R2C9:R26C15,RC[-3]+1,FALSE))) -> 10014|10013 | F340: =IF(HLOOKUP(RC[-5],Sheet1!R2C9:R26C15,RC[-4]+1,FALSE)="",ROUND(HLOOKUP(RC[-5],Sheet1!R2C1:R26C7,RC[-4]+13,FALSE)+HLOOKUP(RC[-5],Sheet1!R2C9:R26C15,RC[-4]+13,FALSE)*RC[1],0),ROUND(HLOOKUP(RC[-5],Sheet1!R2C1:R26C7,RC[-4]+13,FALSE),0)&IF(RC[1]=0,"","|"&ROUND(HLOOKUP(RC[-5],Sheet1!R2C9:R26C15,RC[-4]+13,FALSE)*RC[1],0))) -> 84|14 | G340: 7 | H340: 0
A341: 3 | B341: 7 | C341: 40 | D341: 0 | E341: =HLOOKUP(RC[-4],Sheet1!R2C1:R26C7,RC[-3]+1,FALSE)&IF(RC[2]=0,"",IF(HLOOKUP(RC[-4],Sheet1!R2C9:R26C15,RC[-3]+1,FALSE)="","","|"&HLOOKUP(RC[-4],Sheet1!R2C9:R26C15,RC[-3]+1,FALSE))) -> 10014|10013 | F341: =IF(HLOOKUP(RC[-5],Sheet1!R2C9:R26C15,RC[-4]+1,FALSE)="",ROUND(HLOOKUP(RC[-5],Sheet1!R2C1:R26C7,RC[-4]+13,FALSE)+HLOOKUP(RC[-5],Sheet1!R2C9:R26C15,RC[-4]+13,FALSE)*RC[1],0),ROUND(HLOOKUP(RC[-5],Sheet1!R2C1:R26C7,RC[-4]+13,FALSE),0)&IF(RC[1]=0,"","|"&ROUND(HLOOKUP(RC[-5],Sheet1!R2C9:R26C15,RC[-4]+13,FALSE)*RC[1],0))) -> 84|12 | G341: 6 | H341: 0
A342: 3 | B342: 7 | C342: 45 | D342: 0 | E342: =HLOOKUP(RC[-4],Sheet1!R2C1:R26C7,RC[-3]+1,FALSE)&IF(RC[2]=0,"",IF(HLOOKUP(RC[-4],Sheet1!R2C9:R26C15,RC[-3]+1,FALSE)="","","|"&HLOOKUP(RC[-4],Sheet1!R2C9:R26C15,RC[-3]+1,FALSE))) -> 10014|10013 | F342: =IF(HLOOKUP(RC[-5],Sheet1!R2C9:R26C15,RC[-4]+1,FALSE)="",ROUND(HLOOKUP(RC[-5],Sheet1!R2C1:R26C7,RC[-4]+13,FALSE)+HLOOKUP(RC[-5],Sheet1!R2C9:R26C15,RC[-4]+13,FALSE)*RC[1],0),ROUND(HLOOKUP(RC[-5],Sheet1!R2C1:R26C7,RC[-4]+13,FALSE),0)&IF(RC[1]=0,"","|"&ROUND(HLOOKUP(RC[-5],Sheet1!R2C9:R26C15,RC[-4]+13,FALSE)*RC[1],0))) -> 84|10 | G342: 5 | H342: 0
A343: 3 | B343: 7 | C343: 50 | D343: 0 | E343: =HLOOKUP(RC[-4],Sheet1!R2C1:R26C7,RC[-3]+1,FALSE)&IF(RC[2]=0,"",IF(HLOOKUP(RC[-4],Sheet1!R2C9:R26C15,RC[-3]+1,FALSE)="","","|"&HLOOKUP(RC[-4],Sheet1!R2C9:R26C15,RC[-3]+1,FALSE))) -> 10014|10013 | F343: =IF(HLOOKUP(RC[-5],Sheet1!R2C9:R26C15,RC[-4]+1,FALSE)="",ROUND(HLOOKUP(RC[-5],Sheet1!R2C1:R26C7,RC[-4]+13,FALSE)+HLOOKUP(RC[-5],Sheet1!R2C9:R26C15,RC[-4]+13,FALSE)*RC[1],0),ROUND(HLOOKUP(RC[-5],Sheet1!R2C1:R26C7,RC[-4]+13,FALSE),0)&IF(RC[1]=0,"","|"&ROUND(HLOOKUP(RC[-5],Sheet1!R2C9:R26C15,RC[-4]+13,FALSE)*RC[1],0))) -> 84|8 | G343: 4 | H343: 0
A344: 3 | B344: 7 | C344: 55 | D344: 0 | E344: =HLOOKUP(RC[-4],Sheet1!R2C1:R26C7,RC[-3]+1,FALSE)&IF(RC[2]=0,"",IF(HLOOKUP(RC[-4],Sheet1!R2C9:R26C15,RC[-3]+1,FALSE)="","","|"&HLOOKUP(RC[-4],Sheet1!R2C9:R26C15,RC[-3]+1,FALSE))) -> 10014|10013 | F344: =IF(HLOOKUP(RC[-5],Sheet1!R2C9:R26C15,RC[-4]+1,FALSE)="",ROUND(HLOOKUP(RC[-5],Sheet1!R2C1:R26C7,RC[-4]+13,FALSE)+HLOOKUP(RC[-5],Sheet1!R2C9:R26C15,RC[-4]+13,FALSE)*RC[1],0),ROUND(HLOOKUP(RC[-5],Sheet1!R2C1:R26C7,RC[-4]+13,FALSE),0)&IF(RC[1]=0,"","|"&ROUND(HLOOKUP(RC[-5],Sheet1!R2C9:R26C15,RC[-4]+13,FALSE)*RC[1],0))) -> 84|6 | G344: 3 | H344: 0
A345: 3 | B345: 7 | C345: 60 | D345: 0 | E345: =HLOOKUP(RC[-4],Sheet1!R2C1:R26C7,RC[-3]+1,FALSE)&IF(RC[2]=0,"",IF(HLOOKUP(RC[-4],Sheet1!R2C9:R26C15,RC[-3]+1,FALSE)="","","|"&HLOOKUP(RC[-4],Sheet1!R2C9:R26C15,RC[-3]+1,FALSE))) -> 10014|10013 | F345: =IF(HLOOKUP(RC[-5],Sheet1!R2C9:R26C15,RC[-4]+1,FALSE)="",ROUND(HLOOKUP(RC[-5],Sheet1!R2C1:R26C7,RC[-4]+13,FALSE)+HLOOKUP(RC[-5],Sheet1!R2C9:R26C15,RC[-4]+13,FALSE)*RC[1],0),ROUND(HLOOKUP(RC[-5],Sheet1!R2C1:R26C7,RC[-4]+13,FALSE),0)&IF(RC[1]=0,"","|"&ROUND(HLOOKUP(RC[-5],Sheet1!R2C9:R26C15,RC[-4]+13,FALSE)*RC[1],0))) -> 84|4 | G345: 2 | H345: 0
A346: 3 | B346: 7 | C346: 65 | D346: 0 | E346: =HLOOKUP(RC[-4],Sheet1!R2C1:R26C7,RC[-3]+1,FALSE)&IF(RC[2]=0,"",IF(HLOOKUP(RC[-4],Sheet1!R2C9:R26C15,RC[-3]+1,FALSE)="","","|"&HLOOKUP(RC[-4],Sheet1!R2C9:R26C15,RC[-3]+1,FALSE))) -> 10014|10013 | F346: =IF(HLOOKUP(RC[-5],Sheet1!R2C9:R26C15,RC[-4]+1,FALSE)="",ROUND(HLOOKUP(RC[-5],Sheet1!R2C1:R26C7,RC[-4]+13,FALSE)+HLOOKUP(RC[-5],Sheet1!R2C9:R26C15,RC[-4]+13,FALSE)*RC[1],0),ROUND(HLOOKUP(RC[-5],Sheet1!R2C1:R26C7,RC[-4]+13,FALSE),0)&IF(RC[1]=0,"","|"&ROUND(HLOOKUP(RC[-5],Sheet1!R2C9:R26C15,RC[-4]+13,FALSE)*RC[1],0))) -> 84|2 | G346: 1 | H346: 0
A347: 3 | B347: 7 | C347: 120 | D347: 0 | E347: =HLOOKUP(RC[-4],Sheet1!R2C1:R26C7,RC[-3]+1,FALSE)&IF(RC[2]=0,"",IF(HLOOKUP(RC[-4],Sheet1!R2C9:R26C15,RC[-3]+1,FALSE)="","","|"&HLOOKUP(RC[-4],Sheet1!R2C9:R26C15,RC[-3]+1,FALSE))) -> 10014 | F347: =IF(HLOOKUP(RC[-5],Sheet1!R2C9:R26C15,RC[-4]+1,FALSE)="",ROUND(HLOOKUP(RC[-5],Sheet1!R2C1:R26C7,RC[-4]+13,FALSE)+HLOOKUP(RC[-5],Sheet1!R2C9:R26C15,RC[-4]+13,FALSE)*RC[1],0),ROUND(HLOOKUP(RC[-5],Sheet1!R2C1:R26C7,RC[-4]+13,FALSE),0)&IF(RC[1]=0,"","|"&ROUND(HLOOKUP(RC[-5],Sheet1!R2C9:R26C15,RC[-4]+13,FALSE)*RC[1],0))) -> 84 | G347: 0 | H347: 0
A348: 3 | B348: =R[-11]C+1 -> 8 | C348: 20 | D348: 1 | E348: =HLOOKUP(RC[-4],Sheet1!R2C1:R26C7,RC[-3]+1,FALSE)&IF(RC[2]=0,"",IF(HLOOKUP(RC[-4],Sheet1!R2C9:R26C15,RC[-3]+1,FALSE)="","","|"&HLOOKUP(RC[-4],Sheet1!R2C9:R26C15,RC[-3]+1,FALSE))) -> 10014|10013 | F348: =IF(HLOOKUP(RC[-5],Sheet1!R2C9:R26C15,RC[-4]+1,FALSE)="",ROUND(HLOOKUP(RC[-5],Sheet1!R2C1:R26C7,RC[-4]+13,FALSE)+HLOOKUP(RC[-5],Sheet1!R2C9:R26C15,RC[-4]+13,FALSE)*RC[1],0),ROUND(HLOOKUP(RC[-5],Sheet1!R2C1:R26C7,RC[-4]+13,FALSE),0)&IF(RC[1]=0,"","|"&ROUND(HLOOKUP(RC[-5],Sheet1!R2C9:R26C15,RC[-4]+13,FALSE)*RC[1],0))) -> 101|20 | G348: 10 | H348: 1
A349: 3 | B349: =R[-11]C+1 -> 8 | C349: 25 | D349: 0 | E349: =HLOOKUP(RC[-4],Sheet1!R2C1:R26C7,RC[-3]+1,FALSE)&IF(RC[2]=0,"",IF(HLOOKUP(RC[-4],Sheet1!R2C9:R26C15,RC[-3]+1,FALSE)="","","|"&HLOOKUP(RC[-4],Sheet1!R2C9:R26C15,RC[-3]+1,FALSE))) -> 10014|10013 | F349: =IF(HLOOKUP(RC[-5],Sheet1!R2C9:R26C15,RC[-4]+1,FALSE)="",ROUND(HLOOKUP(RC[-5],Sheet1!R2C1:R26C7,RC[-4]+13,FALSE)+HLOOKUP(RC[-5],Sheet1!R2C9:R26C15,RC[-4]+13,FALSE)*RC[1],0),ROUND(HLOOKUP(RC[-5],Sheet1!R2C1:R26C7,RC[-4]+13,FALSE),0)&IF(RC[1]=0,"","|"&ROUND(HLOOKUP(RC[-5],Sheet1!R2C9:R26C15,RC[-4]+13,FALSE)*RC[1],0))) -> 101|18 | G349: 9 | H349: 0
A350: 3 | B350: =R[-11]C+1 -> 8 | C350: 30 | D350: 0 | E350: =HLOOKUP(RC[-4],Sheet1!R2C1:R26C7,RC[-3]+1,FALSE)&IF(RC[2]=0,"",IF(HLOOKUP(RC[-4],Sheet1!R2C9:R26C15,RC[-3]+1,FALSE)="","","|"&HLOOKUP(RC[-4],Sheet1!R2C9:R26C15,RC[-3]+1,FALSE))) -> 10014|10013 | F350: =IF(HLOOKUP(RC[-5],Sheet1!R2C9:R26C15,RC[-4]+1,FALSE)="",ROUND(HLOOKUP(RC[-5],Sheet1!R2C1:R26C7,RC[-4]+13,FALSE)+HLOOKUP(RC[-5],Sheet1!R2C9:R26C15,RC[-4]+13,FALSE)*RC[1],0),ROUND(HLOOKUP(RC[-5],Sheet1!R2C1:R26C7,RC[-4]+13,FALSE),0)&IF(RC[1]=0,"","|"&ROUND(HLOOKUP(RC[-5],Sheet1!R2C9:R26C15,RC[-4]+13,FALSE)*RC[1],0))) -> 101|16 | G350: 8 | H350: 0
A351: 3 | B351: =R[-11]C+1 -> 8 | C351: 35 | D351: 0 | E351: =HLOOKUP(RC[-4],Sheet1!R2C1:R26C7,RC[-3]+1,FALSE)&IF(RC[2]=0,"",IF(HLOOKUP(RC[-4],Sheet1!R2C9:R26C15,RC[-3]+1,FALSE)="","","|"&HLOOKUP(RC[-4],Sheet1!R2C9:R26C15,RC[-3]+1,FALSE))) -> 10014|10013 | F351: =IF(HLOOKUP(RC[-5],Sheet1!R2C9:R26C15,RC[-4]+1,FALSE)="",ROUND(HLOOKUP(RC[-5],Sheet1!R2C1:R26C7,RC[-4]+13,FALSE)+HLOOKUP(RC[-5],Sheet1!R2C9:R26C15,RC[-4]+13,FALSE)*RC[1],0),ROUND(HLOOKUP(RC[-5],Sheet1!R2C1:R26C7,RC[-4]+13,FALSE),0)&IF(RC[1]=0,"","|"&ROUND(HLOOKUP(RC[-5],Sheet1!R2C9:R26C15,RC[-4]+13,FALSE)*RC[1],0))) -> 101|14 | G351: 7 | H351: 0
A352: 3 | B352: =R[-11]C+1 -> 8 | C352: 40 | D352: 0 | E352: =HLOOKUP(RC[-4],Sheet1!R2C1:R26C7,RC[-3]+1,FALSE)&IF(RC[2]=0,"",IF(HLOOKUP(RC[-4],Sheet1!R2C9:R26C15,RC[-3]+1,FALSE)="","","|"&HLOOKUP(RC[-4],Sheet1!R2C9:R26C15,RC[-3]+1,FALSE))) -> 10014|10013 | F352: =IF(HLOOKUP(RC[-5],Sheet1!R2C9:R26C15,RC[-4]+1,FALSE)="",ROUND(HLOOKUP(RC[-5],Sheet1!R2C1:R26C7,RC[-4]+13,FALSE)+HLOOKUP(RC[-5],Sheet1!R2C9:R26C15,RC[-4]+13,FALSE)*RC[1],0),ROUND(HLOOKUP(RC[-5],Sheet1!R2C1:R26C7,RC[-4]+13,FALSE),0)&IF(RC[1]=0,"","|"&ROUND(HLOOKUP(RC[-5],Sheet1!R2C9:R26C15,RC[-4]+13,FALSE)*RC[1],0))) -> 101|12 | G352: 6 | H352: 0
A353: 3 | B353: =R[-11]C+1 -> 8 | C353: 45 | D353: 0 | E353: =HLOOKUP(RC[-4],Sheet1!R2C1:R26C7,RC[-3]+1,FALSE)&IF(RC[2]=0,"",IF(HLOOKUP(RC[-4],Sheet1!R2C9:R26C15,RC[-3]+1,FALSE)="","","|"&HLOOKUP(RC[-4],Sheet1!R2C9:R26C15,RC[-3]+1,FALSE))) -> 10014|10013 | F353: =IF(HLOOKUP(RC[-5],Sheet1!R2C9:R26C15,RC[-4]+1,FALSE)="",ROUND(HLOOKUP(RC[-5],Sheet1!R2C1:R26C7,RC[-4]+13,FALSE)+HLOOKUP(RC[-5],Sheet1!R2C9:R26C15,RC[-4]+13,FALSE)*RC[1],0),ROUND(HLOOKUP(RC[-5],Sheet1!R2C1:R26C7,RC[-4]+13,FALSE),0)&IF(RC[1]=0,"","|"&ROUND(HLOOKUP(RC[-5],Sheet1!R2C9:R26C15,RC[-4]+13,FALSE)*RC[1],0))) -> 101|10 | G353: 5 | H353: 0
A354: 3 | B354: =R[-11]C+1 -> 8 | C354: 50 | D354: 0 | E354: =HLOOKUP(RC[-4],Sheet1!R2C1:R26C7,RC[-3]+1,FALSE)&IF(RC[2]=0,"",IF(HLOOKUP(RC[-4],Sheet1!R2C9:R26C15,RC[-3]+1,FALSE)="","","|"&HLOOKUP(RC[-4],Sheet1!R2C9:R26C15,RC[-3]+1,FALSE))) -> 10014|10013 | F354: =IF(HLOOKUP(RC[-5],Sheet1!R2C9:R26C15,RC[-4]+1,FALSE)="",ROUND(HLOOKUP(RC[-5],Sheet1!R2C1:R26C7,RC[-4]+13,FALSE)+HLOOKUP(RC[-5],Sheet1!R2C9:R26C15,RC[-4]+13,FALSE)*RC[1],0),ROUND(HLOOKUP(RC[-5],Sheet1!R2C1:R26C7,RC[-4]+13,FALSE),0)&IF(RC[1]=0,"","|"&ROUND(HLOOKUP(RC[-5],Sheet1!R2C9:R26C15,RC[-4]+13,FALSE)*RC[1],0))) -> 101|8 | G354: 4 | H354: 0
A355: 3 | B355: =R[-11]C+1 -> 8 | C355: 55 | D355: 0 | E355: =HLOOKUP(RC[-4],Sheet1!R2C1:R26C7,RC[-3]+1,FALSE)&IF(RC[2]=0,"",IF(HLOOKUP(RC[-4],Sheet1!R2C9:R26C15,RC[-3]+1,FALSE)="","","|"&HLOOKUP(RC[-4],Sheet1!R2C9:R26C15,RC[-3]+1,FALSE))) -> 10014|10013 | F355: =IF(HLOOKUP(RC[-5],Sheet1!R2C9:R26C15,RC[-4]+1,FALSE)="",ROUND(HLOOKUP(RC[-5],Sheet1!R2C1:R26C7,RC[-4]+13,FALSE)+HLOOKUP(RC[-5],Sheet1!R2C9:R26C15,RC[-4]+13,FALSE)*RC[1],0),ROUND(HLOOKUP(RC[-5],Sheet1!R2C1:R26C7,RC[-4]+13,FALSE),0)&IF(RC[1]=0,"","|"&ROUND(HLOOKUP(RC[-5],Sheet1!R2C9:R26C15,RC[-4]+13,FALSE)*RC[1],0))) -> 101|6 | G355: 3 | H355: 0
A356: 3 | B356: =R[-11]C+1 -> 8 | C356: 60 | D356: 0 | E356: =HLOOKUP(RC[-4],Sheet1!R2C1:R26C7,RC[-3]+1,FALSE)&IF(RC[2]=0,"",IF(HLOOKUP(RC[-4],Sheet1!R2C9:R26C15,RC[-3]+1,FALSE)="","","|"&HLOOKUP(RC[-4],Sheet1!R2C9:R26C15,RC[-3]+1,FALSE))) -> 10014|10013 | F356: =IF(HLOOKUP(RC[-5],Sheet1!R2C9:R26C15,RC[-4]+1,FALSE)="",ROUND(HLOOKUP(RC[-5],Sheet1!R2C1:R26C7,RC[-4]+13,FALSE)+HLOOKUP(RC[-5],Sheet1!R2C9:R26C15,RC[-4]+13,FALSE)*RC[1],0),ROUND(HLOOKUP(RC[-5],Sheet1!R2C1:R26C7,RC[-4]+13,FALSE),0)&IF(RC[1]=0,"","|"&ROUND(HLOOKUP(RC[-5],Sheet1!R2C9:R26C15,RC[-4]+13,FALSE)*RC[1],0))) -> 101|4 | G356: 2 | H356: 0
A357: 3 | B357: =R[-11]C+1 -> 8 | C357: 65 | D357: 0 | E357: =HLOOKUP(RC[-4],Sheet1!R2C1:R26C7,RC[-3]+1,FALSE)&IF(RC[2]=0,"",IF(HLOOKUP(RC[-4],Sheet1!R2C9:R26C15,RC[-3]+1,FALSE)="","","|"&HLOOKUP(RC[-4],Sheet1!R2C9:R26C15,RC[-3]+1,FALSE))) -> 10014|10013 | F357: =IF(HLOOKUP(RC[-5],Sheet1!R2C9:R26C15,RC[-4]+1,FALSE)="",ROUND(HLOOKUP(RC[-5],Sheet1!R2C1:R26C7,RC[-4]+13,FALSE)+HLOOKUP(RC[-5],Sheet1!R2C9:R26C15,RC[-4]+13,FALSE)*RC[1],0),ROUND(HLOOKUP(RC[-5],Sheet1!R2C1:R26C7,RC[-4]+13,FALSE),0)&IF(RC[1]=0,"","|"&ROUND(HLOOKUP(RC[-5],Sheet1!R2C9:R26C15,RC[-4]+13,FALSE)*RC[1],0))) -> 101|2 | G357: 1 | H357: 0
A358: 3 | B358: =R[-11]C+1 -> 8 | C358: 120 | D358: 0 | E358: =HLOOKUP(RC[-4],Sheet1!R2C1:R26C7,RC[-3]+1,FALSE)&IF(RC[2]=0,"",IF(HLOOKUP(RC[-4],Sheet1!R2C9:R26C15,RC[-3]+1,FALSE)="","","|"&HLOOKUP(RC[-4],Sheet1!R2C9:R26C15,RC[-3]+1,FALSE))) -> 10014 | F358: =IF(HLOOKUP(RC[-5],Sheet1!R2C9:R26C15,RC[-4]+1,FALSE)="",ROUND(HLOOKUP(RC[-5],Sheet1!R2C1:R26C7,RC[-4]+13,FALSE)+HLOOKUP(RC[-5],Sheet1!R2C9:R26C15,RC[-4]+13,FALSE)*RC[1],0),ROUND(HLOOKUP(RC[-5],Sheet1!R2C1:R26C7,RC[-4]+13,FALSE),0)&IF(RC[1]=0,"","|"&ROUND(HLOOKUP(RC[-5],Sheet1!R2C9:R26C15,RC[-4]+13,FALSE)*RC[1],0))) -> 101 | G358: 0 | H358: 0
A359: 3 | B359: =R[-11]C+1 -> 9 | C359: 20 | D359: 1 | E359: =HLOOKUP(RC[-4],Sheet1!R2C1:R26C7,RC[-3]+1,FALSE)&IF(RC[2]=0,"",IF(HLOOKUP(RC[-4],Sheet1!R2C9:R26C15,RC[-3]+1,FALSE)="","","|"&HLOOKUP(RC[-4],Sheet1!R2C9:R26C15,RC[-3]+1,FALSE))) -> 10014|10013 | F359: =IF(HLOOKUP(RC[-5],Sheet1!R2C9:R26C15,RC[-4]+1,FALSE)="",ROUND(HLOOKUP(RC[-5],Sheet1!R2C1:R26C7,RC[-4]+13,FALSE)+HLOOKUP(RC[-5],Sheet1!R2C9:R26C15,RC[-4]+13,FALSE)*RC[1],0),ROUND(HLOOKUP(RC[-5],Sheet1!R2C1:R26C7,RC[-4]+13,FALSE),0)&IF(RC[1]=0,"","|"&ROUND(HLOOKUP(RC[-5],Sheet1!R2C9:R26C15,RC[-4]+13,FALSE)*RC[1],0))) -> 120|30 | G359: 10 | H359: 1
A360: 3 | B360: =R[-11]C+1 -> 9 | C360: 25 | D360: 0 | E360: =HLOOKUP(RC[-4],Sheet1!R2C1:R26C7,RC[-3]+1,FALSE)&IF(RC[2]=0,"",IF(HLOOKUP(RC[-4],Sheet1!R2C9:R26C15,RC[-3]+1,FALSE)="","","|"&HLOOKUP(RC[-4],Sheet1!R2C9:R26C15,RC[-3]+1,FALSE))) -> 10014|10013 | F360: =IF(HLOOKUP(RC[-5],Sheet1!R2C9:R26C15,RC[-4]+1,FALSE)="",ROUND(HLOOKUP(RC[-5],Sheet1!R2C1:R26C7,RC[-4]+13,FALSE)+HLOOKUP(RC[-5],Sheet1!R2C9:R26C15,RC[-4]+13,FALSE)*RC[1],0),ROUND(HLOOKUP(RC[-5],Sheet1!R2C1:R26C7,RC[-4]+13,FALSE),0)&IF(RC[1]=0,"","|"&ROUND(HLOOKUP(RC[-5],Sheet1!R2C9:R26C15,RC[-4]+13,FALSE)*RC[1],0))) -> 120|27 | G360: 9 | H360: 0
A361: 3 | B361: =R[-11]C+1 -> 9 | C361: 30 | D361: 0 | E361: =HLOOKUP(RC[-4],Sheet1!R2C1:R26C7,RC[-3]+1,FALSE)&IF(RC[2]=0,"",IF(HLOOKUP(RC[-4],Sheet1!R2C9:R26C15,RC[-3]+1,FALSE)="","","|"&HLOOKUP(RC[-4],Sheet1!R2C9:R26C15,RC[-3]+1,FALSE))) -> 10014|10013 | F361: =IF(HLOOKUP(RC[-5],Sheet1!R2C9:R26C15,RC[-4]+1,FALSE)="",ROUND(HLOOKUP(RC[-5],Sheet1!R2C1:R26C7,RC[-4]+13,FALSE)+HLOOKUP(RC[-5],Sheet1!R2C9:R26C15,RC[-4]+13,FALSE)*RC[1],0),ROUND(HLOOKUP(RC[-5],Sheet1!R2C1:R26C7,RC[-4]+13,FALSE),0)&IF(RC[1]=0,"","|"&ROUND(HLOOKUP(RC[-5],Sheet1!R2C9:R26C15,RC[-4]+13,FALSE)*RC[1],0))) -> 120|24 | G361: 8 | H361: 0
A362: 3 | B362: =R[-11]C+1 -> 9 | C362: 35 | D362: 0 | E362: =HLOOKUP(RC[-4],Sheet1!R2C1:R26C7,RC[-3]+1,FALSE)&IF(RC[2]=0,"",IF(HLOOKUP(RC[-4],Sheet1!R2C9:R26C15,RC[-3]+1,FALSE)="","","|"&HLOOKUP(RC[-4],Sheet1!R2C9:R26C15,RC[-3]+1,FALSE))) -> 10014|10013 | F362: =IF(HLOOKUP(RC[-5],Sheet1!R2C9:R26C15,RC[-4]+1,FALSE)="",ROUND(HLOOKUP(RC[-5],Sheet1!R2C1:R26C7,RC[-4]+13,FALSE)+HLOOKUP(RC[-5],Sheet1!R2C9:R26C15,RC[-4]+13,FALSE)*RC[1],0),ROUND(HLOOKUP(RC[-5],Sheet1!R2C1:R26C7,RC[-4]+13,FALSE),0)&IF(RC[1]=0,"","|"&ROUND(HLOOKUP(RC[-5],Sheet1!R2C9:R26C15,RC[-4]+13,FALSE)*RC[1],0))) -> 120|21 | G362: 7 | H362: 0
A363: 3 | B363: =R[-11]C+1 -> 9 | C363: 40 | D363: 0 | E363: =HLOOKUP(RC[-4],Sheet1!R2C1:R26C7,RC[-3]+1,FALSE)&IF(RC[2]=0,"",IF(HLOOKUP(RC[-4],Sheet1!R2C9:R26C15,RC[-3]+1,FALSE)="","","|"&HLOOKUP(RC[-4],Sheet1!R2C9:R26C15,RC[-3]+1,FALSE))) -> 10014|10013 | F363: =IF(HLOOKUP(RC[-5],Sheet1!R2C9:R26C15,RC[-4]+1,FALSE)="",ROUND(HLOOKUP(RC[-5],Sheet1!R2C1:R26C7,RC[-4]+13,FALSE)+HLOOKUP(RC[-5],Sheet1!R2C9:R26C15,RC[-4]+13,FALSE)*RC[1],0),ROUND(HLOOKUP(RC[-5],Sheet1!R2C1:R26C7,RC[-4]+13,FALSE),0)&IF(RC[1]=0,"","|"&ROUND(HLOOKUP(RC[-5],Sheet1!R2C9:R26C15,RC[-4]+13,FALSE)*RC[1],0))) -> 120|18 | G363: 6 | H363: 0
A364: 3 | B364: =R[-11]C+1 -> 9 | C364: 45 | D364: 0 | E364: =HLOOKUP(RC[-4],Sheet1!R2C1:R26C7,RC[-3]+1,FALSE)&IF(RC[2]=0,"",IF(HLOOKUP(RC[-4],Sheet1!R2C9:R26C15,RC[-3]+1,FALSE)="","","|"&HLOOKUP(RC[-4],Sheet1!R2C9:R26C15,RC[-3]+1,FALSE))) -> 10014|10013 | F364: =IF(HLOOKUP(RC[-5],Sheet1!R2C9:R26C15,RC[-4]+1,FALSE)="",ROUND(HLOOKUP(RC[-5],Sheet1!R2C1:R26C7,RC[-4]+13,FALSE)+HLOOKUP(RC[-5],Sheet1!R2C9:R26C15,RC[-4]+13,FALSE)*RC[1],0),ROUND(HLOOKUP(RC[-5],Sheet1!R2C1:R26C7,RC[-4]+13,FALSE),0)&IF(RC[1]=0,"","|"&ROUND(HLOOKUP(RC[-5],Sheet1!R2C9:R26C15,RC[-4]+13,FALSE)*RC[1],0))) -> 120|15 | G364: 5 | H364: 0
A365: 3 | B365: =R[-11]C+1 -> 9 | C365: 50 | D365: 0 | E365: =HLOOKUP(RC[-4],Sheet1!R2C1:R26C7,RC[-3]+1,FALSE)&IF(RC[2]=0,"",IF(HLOOKUP(RC[-4],Sheet1!R2C9:R26C15,RC[-3]+1,FALSE)="","","|"&HLOOKUP(RC[-4],Sheet1!R2C9:R26C15,RC[-3]+1,FALSE))) -> 10014|10013 | F365: =IF(HLOOKUP(RC[-5],Sheet1!R2C9:R26C15,RC[-4]+1,FALSE)="",ROUND(HLOOKUP(RC[-5],Sheet1!R2C1:R26C7,RC[-4]+13,FALSE)+HLOOKUP(RC[-5],Sheet1!R2C9:R26C15,RC[-4]+13,FALSE)*RC[1],0),ROUND(HLOOKUP(RC[-5],Sheet1!R2C1:R26C7,RC[-4]+13,FALSE),0)&IF(RC[1]=0,"","|"&ROUND(HLOOKUP(RC[-5],Sheet1!R2C9:R26C15,RC[-4]+13,FALSE)*RC[1],0))) -> 120|12 | G365: 4 | H365: 0
A366: 3 | B366: =R[-11]C+1 -> 9 | C366: 55 | D366: 0 | E366: =HLOOKUP(RC[-4],Sheet1!R2C1:R26C7,RC[-3]+1,FALSE)&IF(RC[2]=0,"",IF(HLOOKUP(RC[-4],Sheet1!R2C9:R26C15,RC[-3]+1,FALSE)="","","|"&HLOOKUP(RC[-4],Sheet1!R2C9:R26C15,RC[-3]+1,FALSE))) -> 10014|10013 | F366: =IF(HLOOKUP(RC[-5],Sheet1!R2C9:R26C15,RC[-4]+1,FALSE)="",ROUND(HLOOKUP(RC[-5],Sheet1!R2C1:R26C7,RC[-4]+13,FALSE)+HLOOKUP(RC[-5],Sheet1!R2C9:R26C15,RC[-4]+13,FALSE)*RC[1],0),ROUND(HLOOKUP(RC[-5],Sheet1!R2C1:R26C7,RC[-4]+13,FALSE),0)&IF(RC[1]=0,"","|"&ROUND(HLOOKUP(RC[-5],Sheet1!R2C9:R26C15,RC[-4]+13,FALSE)*RC[1],0))) -> 120|9 | G366: 3 | H366: 0
A367: 3 | B367: =R[-11]C+1 -> 9 | C367: 60 | D367: 0 | E367: =HLOOKUP(RC[-4],Sheet1!R2C1:R26C7,RC[-3]+1,FALSE)&IF(RC[2]=0,"",IF(HLOOKUP(RC[-4],Sheet1!R2C9:R26C15,RC[-3]+1,FALSE)="","","|"&HLOOKUP(RC[-4],Sheet1!R2C9:R26C15,RC[-3]+1,FALSE))) -> 10014|10013 | F367: =IF(HLOOKUP(RC[-5],Sheet1!R2C9:R26C15,RC[-4]+1,FALSE)="",ROUND(HLOOKUP(RC[-5],Sheet1!R2C1:R26C7,RC[-4]+13,FALSE)+HLOOKUP(RC[-5],Sheet1!R2C9:R26C15,RC[-4]+13,FALSE)*RC[1],0),ROUND(HLOOKUP(RC[-5],Sheet1!R2C1:R26C7,RC[-4]+13,FALSE),0)&IF(RC[1]=0,"","|"&ROUND(HLOOKUP(RC[-5],Sheet1!R2C9:R26C15,RC[-4]+13,FALSE)*RC[1],0))) -> 120|6 | G367: 2 | H367: 0
A368: 3 | B368: =R[-11]C+1 -> 9 | C368: 65 | D368: 0 | E368: =HLOOKUP(RC[-4],Sheet1!R2C1:R26C7,RC[-3]+1,FALSE)&IF(RC[2]=0,"",IF(HLOOKUP(RC[-4],Sheet1!R2C9:R26C15,RC[-3]+1,FALSE)="","","|"&HLOOKUP(RC[-4],Sheet1!R2C9:R26C15,RC[-3]+1,FALSE))) -> 10014|10013 | F368: =IF(HLOOKUP(RC[-5],Sheet1!R2C9:R26C15,RC[-4]+1,FALSE)="",ROUND(HLOOKUP(RC[-5],Sheet1!R2C1:R26C7,RC[-4]+13,FALSE)+HLOOKUP(RC[-5],Sheet1!R2C9:R26C15,RC[-4]+13,FALSE)*RC[1],0),ROUND(HLOOKUP(RC[-5],Sheet1!R2C1:R26C7,RC[-4]+13,FALSE),0)&IF(RC[1]=0,"","|"&ROUND(HLOOKUP(RC[-5],Sheet1!R2C9:R26C15,RC[-4]+13,FALSE)*RC[1],0))) -> 120|3 | G368: 1 | H368: 0
A369: 3 | B369: =R[-11]C+1 -> 9 | C369: 120 | D369: 0 | E369: =HLOOKUP(RC[-4],Sheet1!R2C1:R26C7,RC[-3]+1,FALSE)&IF(RC[2]=0,"",IF(HLOOKUP(RC[-4],Sheet1!R2C9:R26C15,RC[-3]+1,FALSE)="","","|"&HLOOKUP(RC[-4],Sheet1!R2C9:R26C15,RC[-3]+1,FALSE))) -> 10014 | F369: =IF(HLOOKUP(RC[-5],Sheet1!R2C9:R26C15,RC[-4]+1,FALSE)="",ROUND(HLOOKUP(RC[-5],Sheet1!R2C1:R26C7,RC[-4]+13,FALSE)+HLOOKUP(RC[-5],Sheet1!R2C9:R26C15,RC[-4]+13,FALSE)*RC[1],0),ROUND(HLOOKUP(RC[-5],Sheet1!R2C1:R26C7,RC[-4]+13,FALSE),0)&IF(RC[1]=0,"","|"&ROUND(HLOOKUP(RC[-5],Sheet1!R2C9:R26C15,RC[-4]+13,FALSE)*RC[1],0))) -> 120 | G369: 0 | H369: 0
A370: 3 | B370: =R[-11]C+1 -> 10 | C370: 20 | D370: 1 | E370: =HLOOKUP(RC[-4],Sheet1!R2C1:R26C7,RC[-3]+1,FALSE)&IF(RC[2]=0,"",IF(HLOOKUP(RC[-4],Sheet1!R2C9:R26C15,RC[-3]+1,FALSE)="","","|"&HLOOKUP(RC[-4],Sheet1!R2C9:R26C15,RC[-3]+1,FALSE))) -> 10014|10013 | F370: =IF(HLOOKUP(RC[-5],Sheet1!R2C9:R26C15,RC[-4]+1,FALSE)="",ROUND(HLOOKUP(RC[-5],Sheet1!R2C1:R26C7,RC[-4]+13,FALSE)+HLOOKUP(RC[-5],Sheet1!R2C9:R26C15,RC[-4]+13,FALSE)*RC[1],0),ROUND(HLOOKUP(RC[-5],Sheet1!R2C1:R26C7,RC[-4]+13,FALSE),0)&IF(RC[1]=0,"","|"&ROUND(HLOOKUP(RC[-5],Sheet1!R2C9:R26C15,RC[-4]+13,FALSE)*RC[1],0))) -> 153|30 | G370: 10 | H370: 1
A371: 3 | B371: =R[-11]C+1 -> 10 | C371: 25 | D371: 0 | E371: =HLOOKUP(RC[-4],Sheet1!R2C1:R26C7,RC[-3]+1,FALSE)&IF(RC[2]=0,"",IF(HLOOKUP(RC[-4],Sheet1!R2C9:R26C15,RC[-3]+1,FALSE)="","","|"&HLOOKUP(RC[-4],Sheet1!R2C9:R26C15,RC[-3]+1,FALSE))) -> 10014|10013 | F371: =IF(HLOOKUP(RC[-5],Sheet1!R2C9:R26C15,RC[-4]+1,FALSE)="",ROUND(HLOOKUP(RC[-5],Sheet1!R2C1:R26C7,RC[-4]+13,FALSE)+HLOOKUP(RC[-5],Sheet1!R2C9:R26C15,RC[-4]+13,FALSE)*RC[1],0),ROUND(HLOOKUP(RC[-5],Sheet1!R2C1:R26C7,RC[-4]+13,FALSE),0)&IF(RC[1]=0,"","|"&ROUND(HLOOKUP(RC[-5],Sheet1!R2C9:R26C15,RC[-4]+13,FALSE)*RC[1],0))) -> 153|27 | G371: 9 | H371: 0
A372: 3 | B372: =R[-11]C+1 -> 10 | C372: 30 | D372: 0 | E372: =HLOOKUP(RC[-4],Sheet1!R2C1:R26C7,RC[-3]+1,FALSE)&IF(RC[2]=0,"",IF(HLOOKUP(RC[-4],Sheet1!R2C9:R26C15,RC[-3]+1,FALSE)="","","|"&HLOOKUP(RC[-4],Sheet1!R2C9:R26C15,RC[-3]+1,FALSE))) -> 10014|10013 | F372: =IF(HLOOKUP(RC[-5],Sheet1!R2C9:R26C15,RC[-4]+1,FALSE)="",ROUND(HLOOKUP(RC[-5],Sheet1!R2C1:R26C7,RC[-4]+13,FALSE)+HLOOKUP(RC[-5],Sheet1!R2C9:R26C15,RC[-4]+13,FALSE)*RC[1],0),ROUND(HLOOKUP(RC[-5],Sheet1!R2C1:R26C7,RC[-4]+13,FALSE),0)&IF(RC[1]=0,"","|"&ROUND(HLOOKUP(RC[-5],Sheet1!R2C9:R26C15,RC[-4]+13,FALSE)*RC[1],0))) -> 153|24 | G372: 8 | H372: 0
A373: 3 | B373: =R[-11]C+1 -> 10 | C373: 35 | D373: 0 | E373: =HLOOKUP(RC[-4],Sheet1!R2C1:R26C7,RC[-3]+1,FALSE)&IF(RC[2]=0,"",IF(HLOOKUP(RC[-4],Sheet1!R2C9:R26C15,RC[-3]+1,FALSE)="","","|"&HLOOKUP(RC[-4],Sheet1!R2C9:R26C15,RC[-3]+1,FALSE))) -> 10014|10013 | F373: =IF(HLOOKUP(RC[-5],Sheet1!R2C9:R26C15,RC[-4]+1,FALSE)="",ROUND(HLOOKUP(RC[-5],Sheet1!R2C1:R26C7,RC[-4]+13,FALSE)+HLOOKUP(RC[-5],Sheet1!R2C9:R26C15,RC[-4]+13,FALSE)*RC[1],0),ROUND(HLOOKUP(RC[-5],Sheet1!R2C1:R26C7,RC[-4]+13,FALSE),0)&IF(RC[1]=0,"","|"&ROUND(HLOOKUP(RC[-5],Sheet1!R2C9:R26C15,RC[-4]+13,FALSE)*RC[1],0))) -> 153|21 | G373: 7 | H373: 0
A374: 3 | B374: =R[-11]C+1 -> 10 | C374: 40 | D374: 0 | E374: =HLOOKUP(RC[-4],Sheet1!R2C1:R26C7,RC[-3]+1,FALSE)&IF(RC[2]=0,"",IF(HLOOKUP(RC[-4],Sheet1!R2C9:R26C15,RC[-3]+1,FALSE)="","","|"&HLOOKUP(RC[-4],Sheet1!R2C9:R26C15,RC[-3]+1,FALSE))) -> 10014|10013 | F374: =IF(HLOOKUP(RC[-5],Sheet1!R2C9:R26C15,RC[-4]+1,FALSE)="",ROUND(HLOOKUP(RC[-5],Sheet1!R2C1:R26C7,RC[-4]+13,FALSE)+HLOOKUP(RC[-5],Sheet1!R2C9:R26C15,RC[-4]+13,FALSE)*RC[1],0),ROUND(HLOOKUP(RC[-5],Sheet1!R2C1:R26C7,RC[-4]+13,FALSE),0)&IF(RC[1]=0,"","|"&ROUND(HLOOKUP(RC[-5],Sheet1!R2C9:R26C15,RC[-4]+13,FALSE)*RC[1],0))) -> 153|18 | G374: 6 | H374: 0
A375: 3 | B375: =R[-11]C+1 -> 10 | C375: 45 | D375: 0 | E375: =HLOOKUP(RC[-4],Sheet1!R2C1:R26C7,RC[-3]+1,FALSE)&IF(RC[2]=0,"",IF(HLOOKUP(RC[-4],Sheet1!R2C9:R26C15,RC[-3]+1,FALSE)="","","|"&HLOOKUP(RC[-4],Sheet1!R2C9:R26C15,RC[-3]+1,FALSE))) -> 10014|10013 | F375: =IF(HLOOKUP(RC[-5],Sheet1!R2C9:R26C15,RC[-4]+1,FALSE)="",ROUND(HLOOKUP(RC[-5],Sheet1!R2C1:R26C7,RC[-4]+13,FALSE)+HLOOKUP(RC[-5],Sheet1!R2C9:R26C15,RC[-4]+13,FALSE)*RC[1],0),ROUND(HLOOKUP(RC[-5],Sheet1!R2C1:R26C7,RC[-4]+13,FALSE),0)&IF(RC[1]=0,"","|"&ROUND(HLOOKUP(RC[-5],Sheet1!R2C9:R26C15,RC[-4]+13,FALSE)*RC[1],0))) -> 153|15 | G375: 5 | H375: 0
A376: 3 | B376: =R[-11]C+1 -> 10 | C376: 50 | D376: 0 | E376: =HLOOKUP(RC[-4],Sheet1!R2C1:R26C7,RC[-3]+1,FALSE)&IF(RC[2]=0,"",IF(HLOOKUP(RC[-4],Sheet1!R2C9:R26C15,RC[-3]+1,FALSE)="","","|"&HLOOKUP(RC[-4],Sheet1!R2C9:R26C15,RC[-3]+1,FALSE))) -> 10014|10013 | F376: =IF(HLOOKUP(RC[-5],Sheet1!R2C9:R26C15,RC[-4]+1,FALSE)="",ROUND(HLOOKUP(RC[-5],Sheet1!R2C1:R26C7,RC[-4]+13,FALSE)+HLOOKUP(RC[-5],Sheet1!R2C9:R26C15,RC[-4]+13,FALSE)*RC[1],0),ROUND(HLOOKUP(RC[-5],Sheet1!R2C1:R26C7,RC[-4]+13,FALSE),0)&IF(RC[1]=0,"","|"&ROUND(HLOOKUP(RC[-5],Sheet1!R2C9:R26C15,RC[-4]+13,FALSE)*RC[1],0))) -> 153|12 | G376: 4 | H376: 0
A377: 3 | B377: =R[-11]C+1 -> 10 | C377: 55 | D377: 0 | E377: =HLOOKUP(RC[-4],Sheet1!R2C1:R26C7,RC[-3]+1,FALSE)&IF(RC[2]=0,"",IF(HLOOKUP(RC[-4],Sheet1!R2C9:R26C15,RC[-3]+1,FALSE)="","","|"&HLOOKUP(RC[-4],Sheet1!R2C9:R26C15,RC[-3]+1,FALSE))) -> 10014|10013 | F377: =IF(HLOOKUP(RC[-5],Sheet1!R2C9:R26C15,RC[-4]+1,FALSE)="",ROUND(HLOOKUP(RC[-5],Sheet1!R2C1:R26C7,RC[-4]+13,FALSE)+HLOOKUP(RC[-5],Sheet1!R2C9:R26C15,RC[-4]+13,FALSE)*RC[1],0),ROUND(HLOOKUP(RC[-5],Sheet1!R2C1:R26C7,RC[-4]+13,FALSE),0)&IF(RC[1]=0,"","|"&ROUND(HLOOKUP(RC[-5],Sheet1!R2C9:R26C15,RC[-4]+13,FALSE)*RC[1],0))) -> 153|9 | G377: 3 | H377: 0
A378: 3 | B378: =R[-11]C+1 -> 10 | C378: 60 | D378: 0 | E378: =HLOOKUP(RC[-4],Sheet1!R2C1:R26C7,RC[-3]+1,FALSE)&IF(RC[2]=0,"",IF(HLOOKUP(RC[-4],Sheet1!R2C9:R26C15,RC[-3]+1,FALSE)="","","|"&HLOOKUP(RC[-4],Sheet1!R2C9:R26C15,RC[-3]+1,FALSE))) -> 10014|10013 | F378: =IF(HLOOKUP(RC[-5],Sheet1!R2C9:R26C15,RC[-4]+1,FALSE)="",ROUND(HLOOKUP(RC[-5],Sheet1!R2C1:R26C7,RC[-4]+13,FALSE)+HLOOKUP(RC[-5],Sheet1!R2C9:R26C15,RC[-4]+13,FALSE)*RC[1],0),ROUND(HLOOKUP(RC[-5],Sheet1!R2C1:R26C7,RC[-4]+13,FALSE),0)&IF(RC[1]=0,"","|"&ROUND(HLOOKUP(RC[-5],Sheet1!R2C9:R26C15,RC[-4]+13,FALSE)*RC[1],0))) -> 153|6 | G378: 2 | H378: 0
A379: 3 | B379: =R[-11]C+1 -> 10 | C379: 65 | D379: 0 | E379: =HLOOKUP(RC[-4],Sheet1!R2C1:R26C7,RC[-3]+1,FALSE)&IF(RC[2]=0,"",IF(HLOOKUP(RC[-4],Sheet1!R2C9:R26C15,RC[-3]+1,FALSE)="","","|"&HLOOKUP(RC[-4],Sheet1!R2C9:R26C15,RC[-3]+1,FALSE))) -> 10014|10013 | F379: =IF(HLOOKUP(RC[-5],Sheet1!R2C9:R26C15,RC[-4]+1,FALSE)="",ROUND(HLOOKUP(RC[-5],Sheet1!R2C1:R26C7,RC[-4]+13,FALSE)+HLOOKUP(RC[-5],Sheet1!R2C9:R26C15,RC[-4]+13,FALSE)*RC[1],0),ROUND(HLOOKUP(RC[-5],Sheet1!R2C1:R26C7,RC[-4]+13,FALSE),0)&IF(RC[1]=0,"","|"&ROUND(HLOOKUP(RC[-5],Sheet1!R2C9:R26C15,RC[-4]+13,FALSE)*RC[1],0))) -> 153|3 | G379: 1 | H379: 0
A380: 3 | B380: =R[-11]C+1 -> 10 | C380: 120 | D380: 0 | E380: =HLOOKUP(RC[-4],Sheet1!R2C1:R26C7,RC[-3]+1,FALSE)&IF(RC[2]=0,"",IF(HLOOKUP(RC[-4],Sheet1!R2C9:R26C15,RC[-3]+1,FALSE)="","","|"&HLOOKUP(RC[-4],Sheet1!R2C9:R26C15,RC[-3]+1,FALSE))) -> 10014 | F380: =IF(HLOOKUP(RC[-5],Sheet1!R2C9:R26C15,RC[-4]+1,FALSE)="",ROUND(HLOOKUP(RC[-5],Sheet1!R2C1:R26C7,RC[-4]+13,FALSE)+HLOOKUP(RC[-5],Sheet1!R2C9:R26C15,RC[-4]+13,FALSE)*RC[1],0),ROUND(HLOOKUP(RC[-5],Sheet1!R2C1:R26C7,RC[-4]+13,FALSE),0)&IF(RC[1]=0,"","|"&ROUND(HLOOKUP(RC[-5],Sheet1!R2C9:R26C15,RC[-4]+13,FALSE)*RC[1],0))) -> 153 | G380: 0 | H380: 0
A381: 3 | B381: =R[-11]C+1 -> 11 | C381: 20 | D381: 1 | E381: =HLOOKUP(RC[-4],Sheet1!R2C1:R26C7,RC[-3]+1,FALSE)&IF(RC[2]=0,"",IF(HLOOKUP(RC[-4],Sheet1!R2C9:R26C15,RC[-3]+1,FALSE)="","","|"&HLOOKUP(RC[-4],Sheet1!R2C9:R26C15,RC[-3]+1,FALSE))) -> 10014|10013 | F381: =IF(HLOOKUP(RC[-5],Sheet1!R2C9:R26C15,RC[-4]+1,FALSE)="",ROUND(HLOOKUP(RC[-5],Sheet1!R2C1:R26C7,RC[-4]+13,FALSE)+HLOOKUP(RC[-5],Sheet1!R2C9:R26C15,RC[-4]+13,FALSE)*RC[1],0),ROUND(HLOOKUP(RC[-5],Sheet1!R2C1:R26C7,RC[-4]+13,FALSE),0)&IF(RC[1]=0,"","|"&ROUND(HLOOKUP(RC[-5],Sheet1!R2C9:R26C15,RC[-4]+13,FALSE)*RC[1],0))) -> 189|40 | G381: 10 | H381: 1
A382: 3 | B382: =R[-11]C+1 -> 11 | C382: 25 | D382: 0 | E382: =HLOOKUP(RC[-4],Sheet1!R2C1:R26C7,RC[-3]+1,FALSE)&IF(RC[2]=0,"",IF(HLOOKUP(RC[-4],Sheet1!R2C9:R26C15,RC[-3]+1,FALSE)="","","|"&HLOOKUP(RC[-4],Sheet1!R2C9:R26C15,RC[-3]+1,FALSE))) -> 10014|10013 | F382: =IF(HLOOKUP(RC[-5],Sheet1!R2C9:R26C15,RC[-4]+1,FALSE)="",ROUND(HLOOKUP(RC[-5],Sheet1!R2C1:R26C7,RC[-4]+13,FALSE)+HLOOKUP(RC[-5],Sheet1!R2C9:R26C15,RC[-4]+13,FALSE)*RC[1],0),ROUND(HLOOKUP(RC[-5],Sheet1!R2C1:R26C7,RC[-4]+13,FALSE),0)&IF(RC[1]=0,"","|"&ROUND(HLOOKUP(RC[-5],Sheet1!R2C9:R26C15,RC[-4]+13,FALSE)*RC[1],0))) -> 189|36 | G382: 9 | H382: 0
A383: 3 | B383: =R[-11]C+1 -> 11 | C383: 30 | D383: 0 | E383: =HLOOKUP(RC[-4],Sheet1!R2C1:R26C7,RC[-3]+1,FALSE)&IF(RC[2]=0,"",IF(HLOOKUP(RC[-4],Sheet1!R2C9:R26C15,RC[-3]+1,FALSE)="","","|"&HLOOKUP(RC[-4],Sheet1!R2C9:R26C15,RC[-3]+1,FALSE))) -> 10014|10013 | F383: =IF(HLOOKUP(RC[-5],Sheet1!R2C9:R26C15,RC[-4]+1,FALSE)="",ROUND(HLOOKUP(RC[-5],Sheet1!R2C1:R26C7,RC[-4]+13,FALSE)+HLOOKUP(RC[-5],Sheet1!R2C9:R26C15,RC[-4]+13,FALSE)*RC[1],0),ROUND(HLOOKUP(RC[-5],Sheet1!R2C1:R26C7,RC[-4]+13,FALSE),0)&IF(RC[1]=0,"","|"&ROUND(HLOOKUP(RC[-5],Sheet1!R2C9:R26C15,RC[-4]+13,FALSE)*RC[1],0))) -> 189|32 | G383: 8 | H383: 0
A384: 3 | B384: =R[-11]C+1 -> 11 | C384: 35 | D384: 0 | E384: =HLOOKUP(RC[-4],Sheet1!R2C1:R26C7,RC[-3]+1,FALSE)&IF(RC[2]=0,"",IF(HLOOKUP(RC[-4],Sheet1!R2C9:R26C15,RC[-3]+1,FALSE)="","","|"&HLOOKUP(RC[-4],Sheet1!R2C9:R26C15,RC[-3]+1,FALSE))) -> 10014|10013 | F384: =IF(HLOOKUP(RC[-5],Sheet1!R2C9:R26C15,RC[-4]+1,FALSE)="",ROUND(HLOOKUP(RC[-5],Sheet1!R2C1:R26C7,RC[-4]+13,FALSE)+HLOOKUP(RC[-5],Sheet1!R2C9:R26C15,RC[-4]+13,FALSE)*RC[1],0),ROUND(HLOOKUP(RC[-5],Sheet1!R2C1:R26C7,RC[-4]+13,FALSE),0)&IF(RC[1]=0,"","|"&ROUND(HLOOKUP(RC[-5],Sheet1!R2C9:R26C15,RC[-4]+13,FALSE)*RC[1],0))) -> 189|28 | G384: 7 | H384: 0
A385: 3 | B385: =R[-11]C+1 -> 11 | C385: 40 | D385: 0 | E385: =HLOOKUP(RC[-4],Sheet1!R2C1:R26C7,RC[-3]+1,FALSE)&IF(RC[2]=0,"",IF(HLOOKUP(RC[-4],Sheet1!R2C9:R26C15,RC[-3]+1,FALSE)="","","|"&HLOOKUP(RC[-4],Sheet1!R2C9:R26C15,RC[-3]+1,FALSE))) -> 10014|10013 | F385: =IF(HLOOKUP(RC[-5],Sheet1!R2C9:R26C15,RC[-4]+1,FALSE)="",ROUND(HLOOKUP(RC[-5],Sheet1!R2C1:R26C7,RC[-4]+13,FALSE)+HLOOKUP(RC[-5],Sheet1!R2C9:R26C15,RC[-4]+13,FALSE)*RC[1],0),ROUND(HLOOKUP(RC[-5],Sheet1!R2C1:R26C7,RC[-4]+13,FALSE),0)&IF(RC[1]=0,"","|"&ROUND(HLOOKUP(RC[-5],Sheet1!R2C9:R26C15,RC[-4]+13,FALSE)*RC[1],0))) -> 189|24 | G385: 6 | H385: 0
A386: 3 | B386: =R[-11]C+1 -> 11 | C386: 45 | D386: 0 | E386: =HLOOKUP(RC[-4],Sheet1!R2C1:R26C7,RC[-3]+1,FALSE)&IF(RC[2]=0,"",IF(HLOOKUP(RC[-4],Sheet1!R2C9:R26C15,RC[-3]+1,FALSE)="","","|"&HLOOKUP(RC[-4],Sheet1!R2C9:R26C15,RC[-3]+1,FALSE))) -> 10014|10013 | F386: =IF(HLOOKUP(RC[-5],Sheet1!R2C9:R26C15,RC[-4]+1,FALSE)="",ROUND(HLOOKUP(RC[-5],Sheet1!R2C1:R26C7,RC[-4]+13,FALSE)+HLOOKUP(RC[-5],Sheet1!R2C9:R26C15,RC[-4]+13,FALSE)*RC[1],0),ROUND(HLOOKUP(RC[-5],Sheet1!R2C1:R26C7,RC[-4]+13,FALSE),0)&IF(RC[1]=0,"","|"&ROUND(HLOOKUP(RC[-5],Sheet1!R2C9:R26C15,RC[-4]+13,FALSE)*RC[1],0))) -> 189|20 | G386: 5 | H386: 0
A387: 3 | B387: =R[-11]C+1 -> 11 | C387: 50 | D387: 0 | E387: =HLOOKUP(RC[-4],Sheet1!R2C1:R26C7,RC[-3]+1,FALSE)&IF(RC[2]=0,"",IF(HLOOKUP(RC[-4],Sheet1!R2C9:R26C15,RC[-3]+1,FALSE)="","","|"&HLOOKUP(RC[-4],Sheet1!R2C9:R26C15,RC[-3]+1,FALSE))) -> 10014|10013 | F387: =IF(HLOOKUP(RC[-5],Sheet1!R2C9:R26C15,RC[-4]+1,FALSE)="",ROUND(HLOOKUP(RC[-5],Sheet1!R2C1:R26C7,RC[-4]+13,FALSE)+HLOOKUP(RC[-5],Sheet1!R2C9:R26C15,RC[-4]+13,FALSE)*RC[1],0),ROUND(HLOOKUP(RC[-5],Sheet1!R2C1:R26C7,RC[-4]+13,FALSE),0)&IF(RC[1]=0,"","|"&ROUND(HLOOKUP(RC[-5],Sheet1!R2C9:R26C15,RC[-4]+13,FALSE)*RC[1],0))) -> 189|16 | G387: 4 | H387: 0
A388: 3 | B388: =R[-11]C+1 -> 11 | C388: 55 | D388: 0 | E388: =HLOOKUP(RC[-4],Sheet1!R2C1:R26C7,RC[-3]+1,FALSE)&IF(RC[2]=0,"",IF(HLOOKUP(RC[-4],Sheet1!R2C9:R26C15,RC[-3]+1,FALSE)="","","|"&HLOOKUP(RC[-4],Sheet1!R2C9:R26C15,RC[-3]+1,FALSE))) -> 10014|10013 | F388: =IF(HLOOKUP(RC[-5],Sheet1!R2C9:R26C15,RC[-4]+1,FALSE)="",ROUND(HLOOKUP(RC[-5],Sheet1!R2C1:R26C7,RC[-4]+13,FALSE)+HLOOKUP(RC[-5],Sheet1!R2C9:R26C15,RC[-4]+13,FALSE)*RC[1],0),ROUND(HLOOKUP(RC[-5],Sheet1!R2C1:R26C7,RC[-4]+13,FALSE),0)&IF(RC[1]=0,"","|"&ROUND(HLOOKUP(RC[-5],Sheet1!R2C9:R26C15,RC[-4]+13,FALSE)*RC[1],0))) -> 189|12 | G388: 3 | H388: 0
A389: 3 | B389: =R[-11]C+1 -> 11 | C389: 60 | D389: 0 | E389: =HLOOKUP(RC[-4],Sheet1!R2C1:R26C7,RC[-3]+1,FALSE)&IF(RC[2]=0,"",IF(HLOOKUP(RC[-4],Sheet1!R2C9:R26C15,RC[-3]+1,FALSE)="","","|"&HLOOKUP(RC[-4],Sheet1!R2C9:R26C15,RC[-3]+1,FALSE))) -> 10014|10013 | F389: =IF(HLOOKUP(RC[-5],Sheet1!R2C9:R26C15,RC[-4]+1,FALSE)="",ROUND(HLOOKUP(RC[-5],Sheet1!R2C1:R26C7,RC[-4]+13,FALSE)+HLOOKUP(RC[-5],Sheet1!R2C9:R26C15,RC[-4]+13,FALSE)*RC[1],0),ROUND(HLOOKUP(RC[-5],Sheet1!R2C1:R26C7,RC[-4]+13,FALSE),0)&IF(RC[1]=0,"","|"&ROUND(HLOOKUP(RC[-5],Sheet1!R2C9:R26C15,RC[-4]+13,FALSE)*RC[1],0))) -> 189|8 | G389: 2 | H389: 0
A390: 3 | B390: =R[-11]C+1 -> 11 | C390: 65 | D390: 0 | E390: =HLOOKUP(RC[-4],Sheet1!R2C1:R26C7,RC[-3]+1,FALSE)&IF(RC[2]=0,"",IF(HLOOKUP(RC[-4],Sheet1!R2C9:R26C15,RC[-3]+1,FALSE)="","","|"&HLOOKUP(RC[-4],Sheet1!R2C9:R26C15,RC[-3]+1,FALSE))) -> 10014|10013 | F390: =IF(HLOOKUP(RC[-5],Sheet1!R2C9:R26C15,RC[-4]+1,FALSE)="",ROUND(HLOOKUP(RC[-5],Sheet1!R2C1:R26C7,RC[-4]+13,FALSE)+HLOOKUP(RC[-5],Sheet1!R2C9:R26C15,RC[-4]+13,FALSE)*RC[1],0),ROUND(HLOOKUP(RC[-5],Sheet1!R2C1:R26C7,RC[-4]+13,FALSE),0)&IF(RC[1]=0,"","|"&ROUND(HLOOKUP(RC[-5],Sheet1!R2C9:R26C15,RC[-4]+13,FALSE)*RC[1],0))) -> 189|4 | G390: 1 | H390: 0
A391: 3 | B391: =R[-11]C+1 -> 11 | C391: 120 | D391: 0 | E391: =HLOOKUP(RC[-4],Sheet1!R2C1:R26C7,RC[-3]+1,FALSE)&IF(RC[2]=0,"",IF(HLOOKUP(RC[-4],Sheet1!R2C9:R26C15,RC[-3]+1,FALSE)="","","|"&HLOOKUP(RC[-4],Sheet1!R2C9:R26C15,RC[-3]+1,FALSE))) -> 10014 | F391: =IF(HLOOKUP(RC[-5],Sheet1!R2C9:R26C15,RC[-4]+1,FALSE)="",ROUND(HLOOKUP(RC[-5],Sheet1!R2C1:R26C7,RC[-4]+13,FALSE)+HLOOKUP(RC[-5],Sheet1!R2C9:R26C15,RC[-4]+13,FALSE)*RC[1],0),ROUND(HLOOKUP(RC[-5],Sheet1!R2C1:R26C7,RC[-4]+13,FALSE),0)&IF(RC[1]=0,"","|"&ROUND(HLOOKUP(RC[-5],Sheet1!R2C9:R26C15,RC[-4]+13,FALSE)*RC[1],0))) -> 189 | G391: 0 | H391: 0
A392: 3 | B392: =R[-11]C+1 -> 12 | C392: 20 | D392: 1 | E392: =HLOOKUP(RC[-4],Sheet1!R2C1:R26C7,RC[-3]+1,FALSE)&IF(RC[2]=0,"",IF(HLOOKUP(RC[-4],Sheet1!R2C9:R26C15,RC[-3]+1,FALSE)="","","|"&HLOOKUP(RC[-4],Sheet1!R2C9:R26C15,RC[-3]+1,FALSE))) -> 10014|10013 | F392: =IF(HLOOKUP(RC[-5],Sheet1!R2C9:R26C15,RC[-4]+1,FALSE)="",ROUND(HLOOKUP(RC[-5],Sheet1!R2C1:R26C7,RC[-4]+13,FALSE)+HLOOKUP(RC[-5],Sheet1!R2C9:R26C15,RC[-4]+13,FALSE)*RC[1],0),ROUND(HLOOKUP(RC[-5],Sheet1!R2C1:R26C7,RC[-4]+13,FALSE),0)&IF(RC[1]=0,"","|"&ROUND(HLOOKUP(RC[-5],Sheet1!R2C9:R26C15,RC[-4]+13,FALSE)*RC[1],0))) -> 228|40 | G392: 10 | H392: 1
A393: 3 | B393: =R[-11]C+1 -> 12 | C393: 25 | D393: 0 | E393: =HLOOKUP(RC[-4],Sheet1!R2C1:R26C7,RC[-3]+1,FALSE)&IF(RC[2]=0,"",IF(HLOOKUP(RC[-4],Sheet1!R2C9:R26C15,RC[-3]+1,FALSE)="","","|"&HLOOKUP(RC[-4],Sheet1!R2C9:R26C15,RC[-3]+1,FALSE))) -> 10014|10013 | F393: =IF(HLOOKUP(RC[-5],Sheet1!R2C9:R26C15,RC[-4]+1,FALSE)="",ROUND(HLOOKUP(RC[-5],Sheet1!R2C1:R26C7,RC[-4]+13,FALSE)+HLOOKUP(RC[-5],Sheet1!R2C9:R26C15,RC[-4]+13,FALSE)*RC[1],0),ROUND(HLOOKUP(RC[-5],Sheet1!R2C1:R26C7,RC[-4]+13,FALSE),0)&IF(RC[1]=0,"","|"&ROUND(HLOOKUP(RC[-5],Sheet1!R2C9:R26C15,RC[-4]+13,FALSE)*RC[1],0))) -> 228|36 | G393: 9 | H393: 0
A394: 3 | B394: =R[-11]C+1 -> 12 | C394: 30 | D394: 0 | E394: =HLOOKUP(RC[-4],Sheet1!R2C1:R26C7,RC[-3]+1,FALSE)&IF(RC[2]=0,"",IF(HLOOKUP(RC[-4],Sheet1!R2C9:R26C15,RC[-3]+1,FALSE)="","","|"&HLOOKUP(RC[-4],Sheet1!R2C9:R26C15,RC[-3]+1,FALSE))) -> 10014|10013 | F394: =IF(HLOOKUP(RC[-5],Sheet1!R2C9:R26C15,RC[-4]+1,FALSE)="",ROUND(HLOOKUP(RC[-5],Sheet1!R2C1:R26C7,RC[-4]+13,FALSE)+HLOOKUP(RC[-5],Sheet1!R2C9:R26C15,RC[-4]+13,FALSE)*RC[1],0),ROUND(HLOOKUP(RC[-5],Sheet1!R2C1:R26C7,RC[-4]+13,FALSE),0)&IF(RC[1]=0,"","|"&ROUND(HLOOKUP(RC[-5],Sheet1!R2C9:R26C15,RC[-4]+13,FALSE)*RC[1],0))) -> 228|32 | G394: 8 | H394: 0
A395: 3 | B395: =R[-11]C+1 -> 12 | C395: 35 | D395: 0 | E395: =HLOOKUP(RC[-4],Sheet1!R2C1:R26C7,RC[-3]+1,FALSE)&IF(RC[2]=0,"",IF(HLOOKUP(RC[-4],Sheet1!R2C9:R26C15,RC[-3]+1,FALSE)="","","|"&HLOOKUP(RC[-4],Sheet1!R2C9:R26C15,RC[-3]+1,FALSE))) -> 10014|10013 | F395: =IF(HLOOKUP(RC[-5],Sheet1!R2C9:R26C15,RC[-4]+1,FALSE)="",ROUND(HLOOKUP(RC[-5],Sheet1!R2C1:R26C7,RC[-4]+13,FALSE)+HLOOKUP(RC[-5],Sheet1!R2C9:R26C15,RC[-4]+13,FALSE)*RC[1],0),ROUND(HLOOKUP(RC[-5],Sheet1!R2C1:R26C7,RC[-4]+13,FALSE),0)&IF(RC[1]=0,"","|"&ROUND(HLOOKUP(RC[-5],Sheet1!R2C9:R26C15,RC[-4]+13,FALSE)*RC[1],0))) -> 228|28 | G395: 7 | H395: 0
A396: 3 | B396: =R[-11]C+1 -> 12 | C396: 40 | D396: 0 | E396: =HLOOKUP(RC[-4],Sheet1!R2C1:R26C7,RC[-3]+1,FALSE)&IF(RC[2]=0,"",IF(HLOOKUP(RC[-4],Sheet1!R2C9:R26C15,RC[-3]+1,FALSE)="","","|"&HLOOKUP(RC[-4],Sheet1!R2C9:R26C15,RC[-3]+1,FALSE))) -> 10014|10013 | F396: =IF(HLOOKUP(RC[-5],Sheet1!R2C9:R26C15,RC[-4]+1,FALSE)="",ROUND(HLOOKUP(RC[-5],Sheet1!R2C1:R26C7,RC[-4]+13,FALSE)+HLOOKUP(RC[-5],Sheet1!R2C9:R26C15,RC[-4]+13,FALSE)*RC[1],0),ROUND(HLOOKUP(RC[-5],Sheet1!R2C1:R26C7,RC[-4]+13,FALSE),0)&IF(RC[1]=0,"","|"&ROUND(HLOOKUP(RC[-5],Sheet1!R2C9:R26C15,RC[-4]+13,FALSE)*RC[1],0))) -> 228|24 | G396: 6 | H396: 0
A397: 3 | B397: =R[-11]C+1 -> 12 | C397: 45 | D397: 0 | E397: =HLOOKUP(RC[-4],Sheet1!R2C1:R26C7,RC[-3]+1,FALSE)&IF(RC[2]=0,"",IF(HLOOKUP(RC[-4],Sheet1!R2C9:R26C15,RC[-3]+1,FALSE)="","","|"&HLOOKUP(RC[-4],Sheet1!R2C9:R26C15,RC[-3]+1,FALSE))) -> 10014|10013 | F397: =IF(HLOOKUP(RC[-5],Sheet1!R2C9:R26C15,RC[-4]+1,FALSE)="",ROUND(HLOOKUP(RC[-5],Sheet1!R2C1:R26C7,RC[-4]+13,FALSE)+HLOOKUP(RC[-5],Sheet1!R2C9:R26C15,RC[-4]+13,FALSE)*RC[1],0),ROUND(HLOOKUP(RC[-5],Sheet1!R2C1:R26C7,RC[-4]+13,FALSE),0)&IF(RC[1]=0,"","|"&ROUND(HLOOKUP(RC[-5],Sheet1!R2C9:R26C15,RC[-4]+13,FALSE)*RC[1],0))) -> 228|20 | G397: 5 | H397: 0
A398: 3 | B398: =R[-11]C+1 -> 12 | C398: 50 | D398: 0 | E398: =HLOOKUP(RC[-4],Sheet1!R2C1:R26C7,RC[-3]+1,FALSE)&IF(RC[2]=0,"",IF(HLOOKUP(RC[-4],Sheet1!R2C9:R26C15,RC[-3]+1,FALSE)="","","|"&HLOOKUP(RC[-4],Sheet1!R2C9:R26C15,RC[-3]+1,FALSE))) -> 10014|10013 | F398: =IF(HLOOKUP(RC[-5],Sheet1!R2C9:R26C15,RC[-4]+1,FALSE)="",ROUND(HLOOKUP(RC[-5],Sheet1!R2C1:R26C7,RC[-4]+13,FALSE)+HLOOKUP(RC[-5],Sheet1!R2C9:R26C15,RC[-4]+13,FALSE)*RC[1],0),ROUND(HLOOKUP(RC[-5],Sheet1!R2C1:R26C7,RC[-4]+13,FALSE),0)&IF(RC[1]=0,"","|"&ROUND(HLOOKUP(RC[-5],Sheet1!R2C9:R26C15,RC[-4]+13,FALSE)*RC[1],0))) -> 228|16 | G398: 4 | H398: 0
A399: 3 | B399: =R[-11]C+1 -> 12 | C399: 55 | D399: 0 | E399: =HLOOKUP(RC[-4],Sheet1!R2C1:R26C7,RC[-3]+1,FALSE)&IF(RC[2]=0,"",IF(HLOOKUP(RC[-4],Sheet1!R2C9:R26C15,RC[-3]+1,FALSE)="","","|"&HLOOKUP(RC[-4],Sheet1!R2C9:R26C15,RC[-3]+1,FALSE))) -> 10014|10013 | F399: =IF(HLOOKUP(RC[-5],Sheet1!R2C9:R26C15,RC[-4]+1,FALSE)="",ROUND(HLOOKUP(RC[-5],Sheet1!R2C1:R26C7,RC[-4]+13,FALSE)+HLOOKUP(RC[-5],Sheet1!R2C9:R26C15,RC[-4]+13,FALSE)*RC[1],0),ROUND(HLOOKUP(RC[-5],Sheet1!R2C1:R26C7,RC[-4]+13,FALSE),0)&IF(RC[1]=0,"","|"&ROUND(HLOOKUP(RC[-5],Sheet1!R2C9:R26C15,RC[-4]+13,FALSE)*RC[1],0))) -> 228|12 | G399: 3 | H399: 0
A400: 3 | B400: =R[-11]C+1 -> 12 | C400: 60 | D400: 0 | E400: =HLOOKUP(RC[-4],Sheet1!R2C1:R26C7,RC[-3]+1,FALSE)&IF(RC[2]=0,"",IF(HLOOKUP(RC[-4],Sheet1!R2C9:R26C15,RC[-3]+1,FALSE)="","","|"&HLOOKUP(RC[-4],Sheet1!R2C9:R26C15,RC[-3]+1,FALSE))) -> 10014|10013 | F400: =IF(HLOOKUP(RC[-5],Sheet1!R2C9:R26C15,RC[-4]+1,FALSE)="",ROUND(HLOOKUP(RC[-5],Sheet1!R2C1:R26C7,RC[-4]+13,FALSE)+HLOOKUP(RC[-5],Sheet1!R2C9:R26C15,RC[-4]+13,FALSE)*RC[1],0),ROUND(HLOOKUP(RC[-5],Sheet1!R2C1:R26C7,RC[-4]+13,FALSE),0)&IF(RC[1]=0,"","|"&ROUND(HLOOKUP(RC[-5],Sheet1!R2C9:R26C15,RC[-4]+13,FALSE)*RC[1],0))) -> 228|8 | G400: 2 | H400: 0
A401: 3 | B401: =R[-11]C+1 -> 12 | C401: 65 | D401: 0 | E401: =HLOOKUP(RC[-4],Sheet1!R2C1:R26C7,RC[-3]+1,FALSE)&IF(RC[2]=0,"",IF(HLOOKUP(RC[-4],Sheet1!R2C9:R26C15,RC[-3]+1,FALSE)="","","|"&HLOOKUP(RC[-4],Sheet1!R2C9:R26C15,RC[-3]+1,FALSE))) -> 10014|10013 | F401: =IF(HLOOKUP(RC[-5],Sheet1!R2C9:R26C15,RC[-4]+1,FALSE)="",ROUND(HLOOKUP(RC[-5],Sheet1!R2C1:R26C7,RC[-4]+13,FALSE)+HLOOKUP(RC[-5],Sheet1!R2C9:R26C15,RC[-4]+13,FALSE)*RC[1],0),ROUND(HLOOKUP(RC[-5],Sheet1!R2C1:R26C7,RC[-4]+13,FALSE),0)&IF(RC[1]=0,"","|"&ROUND(HLOOKUP(RC[-5],Sheet1!R2C9:R26C15,RC[-4]+13,FALSE)*RC[1],0))) -> 228|4 | G401: 1 | H401: 0
A402: 3 | B402: =R[-11]C+1 -> 12 | C402: 120 | D402: 0 | E402: =HLOOKUP(RC[-4],Sheet1!R2C1:R26C7,RC[-3]+1,FALSE)&IF(RC[2]=0,"",IF(HLOOKUP(RC[-4],Sheet1!R2C9:R26C15,RC[-3]+1,FALSE)="","","|"&HLOOKUP(RC[-4],Sheet1!R2C9:R26C15,RC[-3]+1,FALSE))) -> 10014 | F402: =IF(HLOOKUP(RC[-5],Sheet1!R2C9:R26C15,RC[-4]+1,FALSE)="",ROUND(HLOOKUP(RC[-5],Sheet1!R2C1:R26C7,RC[-4]+13,FALSE)+HLOOKUP(RC[-5],Sheet1!R2C9:R26C15,RC[-4]+13,FALSE)*RC[1],0),ROUND(HLOOKUP(RC[-5],Sheet1!R2C1:R26C7,RC[-4]+13,FALSE),0)&IF(RC[1]=0,"","|"&ROUND(HLOOKUP(RC[-5],Sheet1!R2C9:R26C15,RC[-4]+13,FALSE)*RC[1],0))) -> 228 | G402: 0 | H402: 0
A403: 4 | B403: 1 | C403: 0 | D403: 1 | E403: =HLOOKUP(RC[-4],Sheet1!R2C1:R26C7,RC[-3]+1,FALSE)&IF(RC[2]=0,"",IF(HLOOKUP(RC[-4],Sheet1!R2C9:R26C15,RC[-3]+1,FALSE)="","","|"&HLOOKUP(RC[-4],Sheet1!R2C9:R26C15,RC[-3]+1,FALSE))) -> 10002 | F403: =IF(HLOOKUP(RC[-5],Sheet1!R2C9:R26C15,RC[-4]+1,FALSE)="",ROUND(HLOOKUP(RC[-5],Sheet1!R2C1:R26C7,RC[-4]+13,FALSE)+HLOOKUP(RC[-5],Sheet1!R2C9:R26C15,RC[-4]+13,FALSE)*RC[1],0),ROUND(HLOOKUP(RC[-5],Sheet1!R2C1:R26C7,RC[-4]+13,FALSE),0)&IF(RC[1]=0,"","|"&ROUND(HLOOKUP(RC[-5],Sheet1!R2C9:R26C15,RC[-4]+13,FALSE)*RC[1],0))) -> 75 | G403: 0 | H403: 1
A404: 4 | B404: 2 | C404: 0 | D404: 1 | E404: =HLOOKUP(RC[-4],Sheet1!R2C1:R26C7,RC[-3]+1,FALSE)&IF(RC[2]=0,"",IF(HLOOKUP(RC[-4],Sheet1!R2C9:R26C15,RC[-3]+1,FALSE)="","","|"&HLOOKUP(RC[-4],Sheet1!R2C9:R26C15,RC[-3]+1,FALSE))) -> 10002 | F404: =IF(HLOOKUP(RC[-5],Sheet1!R2C9:R26C15,RC[-4]+1,FALSE)="",ROUND(HLOOKUP(RC[-5],Sheet1!R2C1:R26C7,RC[-4]+13,FALSE)+HLOOKUP(RC[-5],Sheet1!R2C9:R26C15,RC[-4]+13,FALSE)*RC[1],0),ROUND(HLOOKUP(RC[-5],Sheet1!R2C1:R26C7,RC[-4]+13,FALSE),0)&IF(RC[1]=0,"","|"&ROUND(HLOOKUP(RC[-5],Sheet1!R2C9:R26C15,RC[-4]+13,FALSE)*RC[1],0))) -> 110 | G404: 0 | H404: 0
A405: 4 | B405: 3 | C405: 0 | D405: 1 | E405: =HLOOKUP(RC[-4],Sheet1!R2C1:R26C7,RC[-3]+1,FALSE)&IF(RC[2]=0,"",IF(HLOOKUP(RC[-4],Sheet1!R2C9:R26C15,RC[-3]+1,FALSE)="","","|"&HLOOKUP(RC[-4],Sheet1!R2C9:R26C15,RC[-3]+1,FALSE))) -> 10002 | F405: =IF(HLOOKUP(RC[-5],Sheet1!R2C9:R26C15,RC[-4]+1,FALSE)="",ROUND(HLOOKUP(RC[-5],Sheet1!R2C1:R26C7,RC[-4]+13,FALSE)+HLOOKUP(RC[-5],Sheet1!R2C9:R26C15,RC[-4]+13,FALSE)*RC[1],0),ROUND(HLOOKUP(RC[-5],Sheet1!R2C1:R26C7,RC[-4]+13,FALSE),0)&IF(RC[1]=0,"","|"&ROUND(HLOOKUP(RC[-5],Sheet1!R2C9:R26C15,RC[-4]+13,FALSE)*RC[1],0))) -> 155 | G405: 0 | H405: 0
A406: 4 | B406: 4 | C406: 0 | D406: 1 | E406: =HLOOKUP(RC[-4],Sheet1!R2C1:R26C7,RC[-3]+1,FALSE)&IF(RC[2]=0,"",IF(HLOOKUP(RC[-4],Sheet1!R2C9:R26C15,RC[-3]+1,FALSE)="","","|"&HLOOKUP(RC[-4],Sheet1!R2C9:R26C15,RC[-3]+1,FALSE))) -> 10002 | F406: =IF(HLOOKUP(RC[-5],Sheet1!R2C9:R26C15,RC[-4]+1,FALSE)="",ROUND(HLOOKUP(RC[-5],Sheet1!R2C1:R26C7,RC[-4]+13,FALSE)+HLOOKUP(RC[-5],Sheet1!R2C9:R26C15,RC[-4]+13,FALSE)*RC[1],0),ROUND(HLOOKUP(RC[-5],Sheet1!R2C1:R26C7,RC[-4]+13,FALSE),0)&IF(RC[1]=0,"","|"&ROUND(HLOOKUP(RC[-5],Sheet1!R2C9:R26C15,RC[-4]+13,FALSE)*RC[1],0))) -> 205 | G406: 0 | H406: 0
A407: 4 | B407: 5 | C407: 0 | D407: 1 | E407: =HLOOKUP(RC[-4],Sheet1!R2C1:R26C7,RC[-3]+1,FALSE)&IF(RC[2]=0,"",IF(HLOOKUP(RC[-4],Sheet1!R2C9:R26C15,RC[-3]+1,FALSE)="","","|"&HLOOKUP(RC[-4],Sheet1!R2C9:R26C15,RC[-3]+1,FALSE))) -> 10002 | F407: =IF(HLOOKUP(RC[-5],Sheet1!R2C9:R26C15,RC[-4]+1,FALSE)="",ROUND(HLOOKUP(RC[-5],Sheet1!R2C1:R26C7,RC[-4]+13,FALSE)+HLOOKUP(RC[-5],Sheet1!R2C9:R26C15,RC[-4]+13,FALSE)*RC[1],0),ROUND(HLOOKUP(RC[-5],Sheet1!R2C1:R26C7,RC[-4]+13,FALSE),0)&IF(RC[1]=0,"","|"&ROUND(HLOOKUP(RC[-5],Sheet1!R2C9:R26C15,RC[-4]+13,FALSE)*RC[1],0))) -> 260 | G407: 0 | H407: 0
A408: 4 | B408: 6 | C408: 0 | D408: 1 | E408: =HLOOKUP(RC[-4],Sheet1!R2C1:R26C7,RC[-3]+1,FALSE)&IF(RC[2]=0,"",IF(HLOOKUP(RC[-4],Sheet1!R2C9:R26C15,RC[-3]+1,FALSE)="","","|"&HLOOKUP(RC[-4],Sheet1!R2C9:R26C15,RC[-3]+1,FALSE))) -> 10002 | F408: =IF(HLOOKUP(RC[-5],Sheet1!R2C9:R26C15,RC[-4]+1,FALSE)="",ROUND(HLOOKUP(RC[-5],Sheet1!R2C1:R26C7,RC[-4]+13,FALSE)+HLOOKUP(RC[-5],Sheet1!R2C9:R26C15,RC[-4]+13,FALSE)*RC[1],0),ROUND(HLOOKUP(RC[-5],Sheet1!R2C1:R26C7,RC[-4]+13,FALSE),0)&IF(RC[1]=0,"","|"&ROUND(HLOOKUP(RC[-5],Sheet1!R2C9:R26C15,RC[-4]+13,FALSE)*RC[1],0))) -> 320 | G408: 0 | H408: 0
A409: 4 | B409: 7 | C409: 0 | D409: 1 | E409: =HLOOKUP(RC[-4],Sheet1!R2C1:R26C7,RC[-3]+1,FALSE)&IF(RC[2]=0,"",IF(HLOOKUP(RC[-4],Sheet1!R2C9:R26C15,RC[-3]+1,FALSE)="","","|"&HLOOKUP(RC[-4],Sheet1!R2C9:R26C15,RC[-3]+1,FALSE))) -> 10002 | F409: =IF(HLOOKUP(RC[-5],Sheet1!R2C9:R26C15,RC[-4]+1,FALSE)="",ROUND(HLOOKUP(RC[-5],Sheet1!R2C1:R26C7,RC[-4]+13,FALSE)+HLOOKUP(RC[-5],Sheet1!R2C9:R26C15,RC[-4]+13,FALSE)*RC[1],0),ROUND(HLOOKUP(RC[-5],Sheet1!R2C1:R26C7,RC[-4]+13,FALSE),0)&IF(RC[1]=0,"","|"&ROUND(HLOOKUP(RC[-5],Sheet1!R2C9:R26C15,RC[-4]+13,FALSE)*RC[1],0))) -> 385 | G409: 0 | H409: 0
A410: 4 | B410: 8 | C410: 0 | D410: 1 | E410: =HLOOKUP(RC[-4],Sheet1!R2C1:R26C7,RC[-3]+1,FALSE)&IF(RC[2]=0,"",IF(HLOOKUP(RC[-4],Sheet1!R2C9:R26C15,RC[-3]+1,FALSE)="","","|"&HLOOKUP(RC[-4],Sheet1!R2C9:R26C15,RC[-3]+1,FALSE))) -> 10002 | F410: =IF(HLOOKUP(RC[-5],Sheet1!R2C9:R26C15,RC[-4]+1,FALSE)="",ROUND(HLOOKUP(RC[-5],Sheet1!R2C1:R26C7,RC[-4]+13,FALSE)+HLOOKUP(RC[-5],Sheet1!R2C9:R26C15,RC[-4]+13,FALSE)*RC[1],0),ROUND(HLOOKUP(RC[-5],Sheet1!R2C1:R26C7,RC[-4]+13,FALSE),0)&IF(RC[1]=0,"","|"&ROUND(HLOOKUP(RC[-5],Sheet1!R2C9:R26C15,RC[-4]+13,FALSE)*RC[1],0))) -> 455 | G410: 0 | H410: 0
A411: 4 | B411: 9 | C411: 0 | D411: 1 | E411: =HLOOKUP(RC[-4],Sheet1!R2C1:R26C7,RC[-3]+1,FALSE)&IF(RC[2]=0,"",IF(HLOOKUP(RC[-4],Sheet1!R2C9:R26C15,RC[-3]+1,FALSE)="","","|"&HLOOKUP(RC[-4],Sheet1!R2C9:R26C15,RC[-3]+1,FALSE))) -> 10002 | F411: =IF(HLOOKUP(RC[-5],Sheet1!R2C9:R26C15,RC[-4]+1,FALSE)="",ROUND(HLOOKUP(RC[-5],Sheet1!R2C1:R26C7,RC[-4]+13,FALSE)+HLOOKUP(RC[-5],Sheet1!R2C9:R26C15,RC[-4]+13,FALSE)*RC[1],0),ROUND(HLOOKUP(RC[-5],Sheet1!R2C1:R26C7,RC[-4]+13,FALSE),0)&IF(RC[1]=0,"","|"&ROUND(HLOOKUP(RC[-5],Sheet1!R2C9:R26C15,RC[-4]+13,FALSE)*RC[1],0))) -> 585 | G411: 0 | H411: 0
A412: 4 | B412: 10 | C412: 0 | D412: 1 | E412: =HLOOKUP(RC[-4],Sheet1!R2C1:R26C7,RC[-3]+1,FALSE)&IF(RC[2]=0,"",IF(HLOOKUP(RC[-4],Sheet1!R2C9:R26C15,RC[-3]+1,FALSE)="","","|"&HLOOKUP(RC[-4],Sheet1!R2C9:R26C15,RC[-3]+1,FALSE))) -> 10002 | F412: =IF(HLOOKUP(RC[-5],Sheet1!R2C9:R26C15,RC[-4]+1,FALSE)="",ROUND(HLOOKUP(RC[-5],Sheet1!R2C1:R26C7,RC[-4]+13,FALSE)+HLOOKUP(RC[-5],Sheet1!R2C9:R26C15,RC[-4]+13,FALSE)*RC[1],0),ROUND(HLOOKUP(RC[-5],Sheet1!R2C1:R26C7,RC[-4]+13,FALSE),0)&IF(RC[1]=0,"","|"&ROUND(HLOOKUP(RC[-5],Sheet1!R2C9:R26C15,RC[-4]+13,FALSE)*RC[1],0))) -> 725 | G412: 0 | H412: 0
A413: 4 | B413: 11 | C413: 0 | D413: 1 | E413: =HLOOKUP(RC[-4],Sheet1!R2C1:R26C7,RC[-3]+1,FALSE)&IF(RC[2]=0,"",IF(HLOOKUP(RC[-4],Sheet1!R2C9:R26C15,RC[-3]+1,FALSE)="","","|"&HLOOKUP(RC[-4],Sheet1!R2C9:R26C15,RC[-3]+1,FALSE))) -> 10002 | F413: =IF(HLOOKUP(RC[-5],Sheet1!R2C9:R26C15,RC[-4]+1,FALSE)="",ROUND(HLOOKUP(RC[-5],Sheet1!R2C1:R26C7,RC[-4]+13,FALSE)+HLOOKUP(RC[-5],Sheet1!R2C9:R26C15,RC[-4]+13,FALSE)*RC[1],0),ROUND(HLOOKUP(RC[-5],Sheet1!R2C1:R26C7,RC[-4]+13,FALSE),0)&IF(RC[1]=0,"","|"&ROUND(HLOOKUP(RC[-5],Sheet1!R2C9:R26C15,RC[-4]+13,FALSE)*RC[1],0))) -> 875 | G413: 0 | H413: 0
A414: 4 | B414: 12 | C414: 0 | D414: 1 | E414: =HLOOKUP(RC[-4],Sheet1!R2C1:R26C7,RC[-3]+1,FALSE)&IF(RC[2]=0,"",IF(HLOOKUP(RC[-4],Sheet1!R2C9:R26C15,RC[-3]+1,FALSE)="","","|"&HLOOKUP(RC[-4],Sheet1!R2C9:R26C15,RC[-3]+1,FALSE))) -> 10002 | F414: =IF(HLOOKUP(RC[-5],Sheet1!R2C9:R26C15,RC[-4]+1,FALSE)="",ROUND(HLOOKUP(RC[-5],Sheet1!R2C1:R26C7,RC[-4]+13,FALSE)+HLOOKUP(RC[-5],Sheet1!R2C9:R26C15,RC[-4]+13,FALSE)*RC[1],0),ROUND(HLOOKUP(RC[-5],Sheet1!R2C1:R26C7,RC[-4]+13,FALSE),0)&IF(RC[1]=0,"","|"&ROUND(HLOOKUP(RC[-5],Sheet1!R2C9:R26C15,RC[-4]+13,FALSE)*RC[1],0))) -> 1035 | G414: 0 | H414: 1
A415: 5 | B415: 1 | C415: 80 | D415: 1 | E415: =HLOOKUP(RC[-4],Sheet1!R2C1:R26C7,RC[-3]+1,FALSE)&IF(RC[2]=0,"",IF(HLOOKUP(RC[-4],Sheet1!R2C9:R26C15,RC[-3]+1,FALSE)="","","|"&HLOOKUP(RC[-4],Sheet1!R2C9:R26C15,RC[-3]+1,FALSE))) -> 42201 | F415: =IF(HLOOKUP(RC[-5],Sheet1!R2C9:R26C15,RC[-4]+1,FALSE)="",ROUND(HLOOKUP(RC[-5],Sheet1!R2C1:R26C7,RC[-4]+13,FALSE)+HLOOKUP(RC[-5],Sheet1!R2C9:R26C15,RC[-4]+13,FALSE)*RC[1],0),ROUND(HLOOKUP(RC[-5],Sheet1!R2C1:R26C7,RC[-4]+13,FALSE),0)&IF(RC[1]=0,"","|"&ROUND(HLOOKUP(RC[-5],Sheet1!R2C9:R26C15,RC[-4]+13,FALSE)*RC[1],0))) -> 9 | G415: 10 | H415: 0
A416: 5 | B416: 1 | C416: 75 | D416: 0 | E416: =HLOOKUP(RC[-4],Sheet1!R2C1:R26C7,RC[-3]+1,FALSE)&IF(RC[2]=0,"",IF(HLOOKUP(RC[-4],Sheet1!R2C9:R26C15,RC[-3]+1,FALSE)="","","|"&HLOOKUP(RC[-4],Sheet1!R2C9:R26C15,RC[-3]+1,FALSE))) -> 42201 | F416: =IF(HLOOKUP(RC[-5],Sheet1!R2C9:R26C15,RC[-4]+1,FALSE)="",ROUND(HLOOKUP(RC[-5],Sheet1!R2C1:R26C7,RC[-4]+13,FALSE)+HLOOKUP(RC[-5],Sheet1!R2C9:R26C15,RC[-4]+13,FALSE)*RC[1],0),ROUND(HLOOKUP(RC[-5],Sheet1!R2C1:R26C7,RC[-4]+13,FALSE),0)&IF(RC[1]=0,"","|"&ROUND(HLOOKUP(RC[-5],Sheet1!R2C9:R26C15,RC[-4]+13,FALSE)*RC[1],0))) -> 9 | G416: 9 | H416: 0
A417: 5 | B417: 1 | C417: 70 | D417: 0 | E417: =HLOOKUP(RC[-4],Sheet1!R2C1:R26C7,RC[-3]+1,FALSE)&IF(RC[2]=0,"",IF(HLOOKUP(RC[-4],Sheet1!R2C9:R26C15,RC[-3]+1,FALSE)="","","|"&HLOOKUP(RC[-4],Sheet1!R2C9:R26C15,RC[-3]+1,FALSE))) -> 42201 | F417: =IF(HLOOKUP(RC[-5],Sheet1!R2C9:R26C15,RC[-4]+1,FALSE)="",ROUND(HLOOKUP(RC[-5],Sheet1!R2C1:R26C7,RC[-4]+13,FALSE)+HLOOKUP(RC[-5],Sheet1!R2C9:R26C15,RC[-4]+13,FALSE)*RC[1],0),ROUND(HLOOKUP(RC[-5],Sheet1!R2C1:R26C7,RC[-4]+13,FALSE),0)&IF(RC[1]=0,"","|"&ROUND(HLOOKUP(RC[-5],Sheet1!R2C9:R26C15,RC[-4]+13,FALSE)*RC[1],0))) -> 8 | G417: 8 | H417: 0
A418: 5 | B418: 1 | C418: 65 | D418: 0 | E418: =HLOOKUP(RC[-4],Sheet1!R2C1:R26C7,RC[-3]+1,FALSE)&IF(RC[2]=0,"",IF(HLOOKUP(RC[-4],Sheet1!R2C9:R26C15,RC[-3]+1,FALSE)="","","|"&HLOOKUP(RC[-4],Sheet1!R2C9:R26C15,RC[-3]+1,FALSE))) -> 42201 | F418: =IF(HLOOKUP(RC[-5],Sheet1!R2C9:R26C15,RC[-4]+1,FALSE)="",ROUND(HLOOKUP(RC[-5],Sheet1!R2C1:R26C7,RC[-4]+13,FALSE)+HLOOKUP(RC[-5],Sheet1!R2C9:R26C15,RC[-4]+13,FALSE)*RC[1],0),ROUND(HLOOKUP(RC[-5],Sheet1!R2C1:R26C7,RC[-4]+13,FALSE),0)&IF(RC[1]=0,"","|"&ROUND(HLOOKUP(RC[-5],Sheet1!R2C9:R26C15,RC[-4]+13,FALSE)*RC[1],0))) -> 8 | G418: 7 | H418: 0
A419: 5 | B419: 1 | C419: 60 | D419: 0 | E419: =HLOOKUP(RC[-4],Sheet1!R2C1:R26C7,RC[-3]+1,FALSE)&IF(RC[2]=0,"",IF(HLOOKUP(RC[-4],Sheet1!R2C9:R26C15,RC[-3]+1,FALSE)="","","|"&HLOOKUP(RC[-4],Sheet1!R2C9:R26C15,RC[-3]+1,FALSE))) -> 42201 | F419: =IF(HLOOKUP(RC[-5],Sheet1!R2C9:R26C15,RC[-4]+1,FALSE)="",ROUND(HLOOKUP(RC[-5],Sheet1!R2C1:R26C7,RC[-4]+13,FALSE)+HLOOKUP(RC[-5],Sheet1!R2C9:R26C15,RC[-4]+13,FALSE)*RC[1],0),ROUND(HLOOKUP(RC[-5],Sheet1!R2C1:R26C7,RC[-4]+13,FALSE),0)&IF(RC[1]=0,"","|"&ROUND(HLOOKUP(RC[-5],Sheet1!R2C9:R26C15,RC[-4]+13,FALSE)*RC[1],0))) -> 7 | G419: 6 | H419: 0
A420: 5 | B420: 1 | C420: 55 | D420: 0 | E420: =HLOOKUP(RC[-4],Sheet1!R2C1:R26C7,RC[-3]+1,FALSE)&IF(RC[2]=0,"",IF(HLOOKUP(RC[-4],Sheet1!R2C9:R26C15,RC[-3]+1,FALSE)="","","|"&HLOOKUP(RC[-4],Sheet1!R2C9:R26C15,RC[-3]+1,FALSE))) -> 42201 | F420: =IF(HLOOKUP(RC[-5],Sheet1!R2C9:R26C15,RC[-4]+1,FALSE)="",ROUND(HLOOKUP(RC[-5],Sheet1!R2C1:R26C7,RC[-4]+13,FALSE)+HLOOKUP(RC[-5],Sheet1!R2C9:R26C15,RC[-4]+13,FALSE)*RC[1],0),ROUND(HLOOKUP(RC[-5],Sheet1!R2C1:R26C7,RC[-4]+13,FALSE),0)&IF(RC[1]=0,"","|"&ROUND(HLOOKUP(RC[-5],Sheet1!R2C9:R26C15,RC[-4]+13,FALSE)*RC[1],0))) -> 7 | G420: 5 | H420: 0
A421: 5 | B421: 1 | C421: 50 | D421: 0 | E421: =HLOOKUP(RC[-4],Sheet1!R2C1:R26C7,RC[-3]+1,FALSE)&IF(RC[2]=0,"",IF(HLOOKUP(RC[-4],Sheet1!R2C9:R26C15,RC[-3]+1,FALSE)="","","|"&HLOOKUP(RC[-4],Sheet1!R2C9:R26C15,RC[-3]+1,FALSE))) -> 42201 | F421: =IF(HLOOKUP(RC[-5],Sheet1!R2C9:R26C15,RC[-4]+1,FALSE)="",ROUND(HLOOKUP(RC[-5],Sheet1!R2C1:R26C7,RC[-4]+13,FALSE)+HLOOKUP(RC[-5],Sheet1!R2C9:R26C15,RC[-4]+13,FALSE)*RC[1],0),ROUND(HLOOKUP(RC[-5],Sheet1!R2C1:R26C7,RC[-4]+13,FALSE),0)&IF(RC[1]=0,"","|"&ROUND(HLOOKUP(RC[-5],Sheet1!R2C9:R26C15,RC[-4]+13,FALSE)*RC[1],0))) -> 6 | G421: 4 | H421: 0
A422: 5 | B422: 1 | C422: 45 | D422: 0 | E422: =HLOOKUP(RC[-4],Sheet1!R2C1:R26C7,RC[-3]+1,FALSE)&IF(RC[2]=0,"",IF(HLOOKUP(RC[-4],Sheet1!R2C9:R26C15,RC[-3]+1,FALSE)="","","|"&HLOOKUP(RC[-4],Sheet1!R2C9:R26C15,RC[-3]+1,FALSE))) -> 42201 | F422: =IF(HLOOKUP(RC[-5],Sheet1!R2C9:R26C15,RC[-4]+1,FALSE)="",ROUND(HLOOKUP(RC[-5],Sheet1!R2C1:R26C7,RC[-4]+13,FALSE)+HLOOKUP(RC[-5],Sheet1!R2C9:R26C15,RC[-4]+13,FALSE)*RC[1],0),ROUND(HLOOKUP(RC[-5],Sheet1!R2C1:R26C7,RC[-4]+13,FALSE),0)&IF(RC[1]=0,"","|"&ROUND(HLOOKUP(RC[-5],Sheet1!R2C9:R26C15,RC[-4]+13,FALSE)*RC[1],0))) -> 6 | G422: 3 | H422: 0
A423: 5 | B423: 1 | C423: 40 | D423: 0 | E423: =HLOOKUP(RC[-4],Sheet1!R2C1:R26C7,RC[-3]+1,FALSE)&IF(RC[2]=0,"",IF(HLOOKUP(RC[-4],Sheet1!R2C9:R26C15,RC[-3]+1,FALSE)="","","|"&HLOOKUP(RC[-4],Sheet1!R2C9:R26C15,RC[-3]+1,FALSE))) -> 42201 | F423: =IF(HLOOKUP(RC[-5],Sheet1!R2C9:R26C15,RC[-4]+1,FALSE)="",ROUND(HLOOKUP(RC[-5],Sheet1!R2C1:R26C7,RC[-4]+13,FALSE)+HLOOKUP(RC[-5],Sheet1!R2C9:R26C15,RC[-4]+13,FALSE)*RC[1],0),ROUND(HLOOKUP(RC[-5],Sheet1!R2C1:R26C7,RC[-4]+13,FALSE),0)&IF(RC[1]=0,"","|"&ROUND(HLOOKUP(RC[-5],Sheet1!R2C9:R26C15,RC[-4]+13,FALSE)*RC[1],0))) -> 5 | G423: 2 | H423: 0
A424: 5 | B424: 1 | C424: 35 | D424: 0 | E424: =HLOOKUP(RC[-4],Sheet1!R2C1:R26C7,RC[-3]+1,FALSE)&IF(RC[2]=0,"",IF(HLOOKUP(RC[-4],Sheet1!R2C9:R26C15,RC[-3]+1,FALSE)="","","|"&HLOOKUP(RC[-4],Sheet1!R2C9:R26C15,RC[-3]+1,FALSE))) -> 42201 | F424: =IF(HLOOKUP(RC[-5],Sheet1!R2C9:R26C15,RC[-4]+1,FALSE)="",ROUND(HLOOKUP(RC[-5],Sheet1!R2C1:R26C7,RC[-4]+13,FALSE)+HLOOKUP(RC[-5],Sheet1!R2C9:R26C15,RC[-4]+13,FALSE)*RC[1],0),ROUND(HLOOKUP(RC[-5],Sheet1!R2C1:R26C7,RC[-4]+13,FALSE),0)&IF(RC[1]=0,"","|"&ROUND(HLOOKUP(RC[-5],Sheet1!R2C9:R26C15,RC[-4]+13,FALSE)*RC[1],0))) -> 5 | G424: 1 | H424: 0
A425: 5 | B425: 1 | C425: 1 | D425: 0 | E425: =HLOOKUP(RC[-4],Sheet1!R2C1:R26C7,RC[-3]+1,FALSE)&IF(RC[2]=0,"",IF(HLOOKUP(RC[-4],Sheet1!R2C9:R26C15,RC[-3]+1,FALSE)="","","|"&HLOOKUP(RC[-4],Sheet1!R2C9:R26C15,RC[-3]+1,FALSE))) -> 42201 | F425: =IF(HLOOKUP(RC[-5],Sheet1!R2C9:R26C15,RC[-4]+1,FALSE)="",ROUND(HLOOKUP(RC[-5],Sheet1!R2C1:R26C7,RC[-4]+13,FALSE)+HLOOKUP(RC[-5],Sheet1!R2C9:R26C15,RC[-4]+13,FALSE)*RC[1],0),ROUND(HLOOKUP(RC[-5],Sheet1!R2C1:R26C7,RC[-4]+13,FALSE),0)&IF(RC[1]=0,"","|"&ROUND(HLOOKUP(RC[-5],Sheet1!R2C9:R26C15,RC[-4]+13,FALSE)*RC[1],0))) -> 4 | G425: 0 | H425: 1
A426: 5 | B426: 2 | C426: 80 | D426: 1 | E426: =HLOOKUP(RC[-4],Sheet1!R2C1:R26C7,RC[-3]+1,FALSE)&IF(RC[2]=0,"",IF(HLOOKUP(RC[-4],Sheet1!R2C9:R26C15,RC[-3]+1,FALSE)="","","|"&HLOOKUP(RC[-4],Sheet1!R2C9:R26C15,RC[-3]+1,FALSE))) -> 42201 | F426: =IF(HLOOKUP(RC[-5],Sheet1!R2C9:R26C15,RC[-4]+1,FALSE)="",ROUND(HLOOKUP(RC[-5],Sheet1!R2C1:R26C7,RC[-4]+13,FALSE)+HLOOKUP(RC[-5],Sheet1!R2C9:R26C15,RC[-4]+13,FALSE)*RC[1],0),ROUND(HLOOKUP(RC[-5],Sheet1!R2C1:R26C7,RC[-4]+13,FALSE),0)&IF(RC[1]=0,"","|"&ROUND(HLOOKUP(RC[-5],Sheet1!R2C9:R26C15,RC[-4]+13,FALSE)*RC[1],0))) -> 11 | G426: 10 | H426: 0
A427: 5 | B427: 2 | C427: 75 | D427: 0 | E427: =HLOOKUP(RC[-4],Sheet1!R2C1:R26C7,RC[-3]+1,FALSE)&IF(RC[2]=0,"",IF(HLOOKUP(RC[-4],Sheet1!R2C9:R26C15,RC[-3]+1,FALSE)="","","|"&HLOOKUP(RC[-4],Sheet1!R2C9:R26C15,RC[-3]+1,FALSE))) -> 42201 | F427: =IF(HLOOKUP(RC[-5],Sheet1!R2C9:R26C15,RC[-4]+1,FALSE)="",ROUND(HLOOKUP(RC[-5],Sheet1!R2C1:R26C7,RC[-4]+13,FALSE)+HLOOKUP(RC[-5],Sheet1!R2C9:R26C15,RC[-4]+13,FALSE)*RC[1],0),ROUND(HLOOKUP(RC[-5],Sheet1!R2C1:R26C7,RC[-4]+13,FALSE),0)&IF(RC[1]=0,"","|"&ROUND(HLOOKUP(RC[-5],Sheet1!R2C9:R26C15,RC[-4]+13,FALSE)*RC[1],0))) -> 11 | G427: 9 | H427: 0
A428: 5 | B428: 2 | C428: 70 | D428: 0 | E428: =HLOOKUP(RC[-4],Sheet1!R2C1:R26C7,RC[-3]+1,FALSE)&IF(RC[2]=0,"",IF(HLOOKUP(RC[-4],Sheet1!R2C9:R26C15,RC[-3]+1,FALSE)="","","|"&HLOOKUP(RC[-4],Sheet1!R2C9:R26C15,RC[-3]+1,FALSE))) -> 42201 | F428: =IF(HLOOKUP(RC[-5],Sheet1!R2C9:R26C15,RC[-4]+1,FALSE)="",ROUND(HLOOKUP(RC[-5],Sheet1!R2C1:R26C7,RC[-4]+13,FALSE)+HLOOKUP(RC[-5],Sheet1!R2C9:R26C15,RC[-4]+13,FALSE)*RC[1],0),ROUND(HLOOKUP(RC[-5],Sheet1!R2C1:R26C7,RC[-4]+13,FALSE),0)&IF(RC[1]=0,"","|"&ROUND(HLOOKUP(RC[-5],Sheet1!R2C9:R26C15,RC[-4]+13,FALSE)*RC[1],0))) -> 10 | G428: 8 | H428: 0
A429: 5 | B429: 2 | C429: 65 | D429: 0 | E429: =HLOOKUP(RC[-4],Sheet1!R2C1:R26C7,RC[-3]+1,FALSE)&IF(RC[2]=0,"",IF(HLOOKUP(RC[-4],Sheet1!R2C9:R26C15,RC[-3]+1,FALSE)="","","|"&HLOOKUP(RC[-4],Sheet1!R2C9:R26C15,RC[-3]+1,FALSE))) -> 42201 | F429: =IF(HLOOKUP(RC[-5],Sheet1!R2C9:R26C15,RC[-4]+1,FALSE)="",ROUND(HLOOKUP(RC[-5],Sheet1!R2C1:R26C7,RC[-4]+13,FALSE)+HLOOKUP(RC[-5],Sheet1!R2C9:R26C15,RC[-4]+13,FALSE)*RC[1],0),ROUND(HLOOKUP(RC[-5],Sheet1!R2C1:R26C7,RC[-4]+13,FALSE),0)&IF(RC[1]=0,"","|"&ROUND(HLOOKUP(RC[-5],Sheet1!R2C9:R26C15,RC[-4]+13,FALSE)*RC[1],0))) -> 10 | G429: 7 | H429: 0
A430: 5 | B430: 2 | C430: 60 | D430: 0 | E430: =HLOOKUP(RC[-4],Sheet1!R2C1:R26C7,RC[-3]+1,FALSE)&IF(RC[2]=0,"",IF(HLOOKUP(RC[-4],Sheet1!R2C9:R26C15,RC[-3]+1,FALSE)="","","|"&HLOOKUP(RC[-4],Sheet1!R2C9:R26C15,RC[-3]+1,FALSE))) -> 42201 | F430: =IF(HLOOKUP(RC[-5],Sheet1!R2C9:R26C15,RC[-4]+1,FALSE)="",ROUND(HLOOKUP(RC[-5],Sheet1!R2C1:R26C7,RC[-4]+13,FALSE)+HLOOKUP(RC[-5],Sheet1!R2C9:R26C15,RC[-4]+13,FALSE)*RC[1],0),ROUND(HLOOKUP(RC[-5],Sheet1!R2C1:R26C7,RC[-4]+13,FALSE),0)&IF(RC[1]=0,"","|"&ROUND(HLOOKUP(RC[-5],Sheet1!R2C9:R26C15,RC[-4]+13,FALSE)*RC[1],0))) -> 9 | G430: 6 | H430: 0
A431: 5 | B431: 2 | C431: 55 | D431: 0 | E431: =HLOOKUP(RC[-4],Sheet1!R2C1:R26C7,RC[-3]+1,FALSE)&IF(RC[2]=0,"",IF(HLOOKUP(RC[-4],Sheet1!R2C9:R26C15,RC[-3]+1,FALSE)="","","|"&HLOOKUP(RC[-4],Sheet1!R2C9:R26C15,RC[-3]+1,FALSE))) -> 42201 | F431: =IF(HLOOKUP(RC[-5],Sheet1!R2C9:R26C15,RC[-4]+1,FALSE)="",ROUND(HLOOKUP(RC[-5],Sheet1!R2C1:R26C7,RC[-4]+13,FALSE)+HLOOKUP(RC[-5],Sheet1!R2C9:R26C15,RC[-4]+13,FALSE)*RC[1],0),ROUND(HLOOKUP(RC[-5],Sheet1!R2C1:R26C7,RC[-4]+13,FALSE),0)&IF(RC[1]=0,"","|"&ROUND(HLOOKUP(RC[-5],Sheet1!R2C9:R26C15,RC[-4]+13,FALSE)*RC[1],0))) -> 9 | G431: 5 | H431: 0
A432: 5 | B432: 2 | C432: 50 | D432: 0 | E432: =HLOOKUP(RC[-4],Sheet1!R2C1:R26C7,RC[-3]+1,FALSE)&IF(RC[2]=0,"",IF(HLOOKUP(RC[-4],Sheet1!R2C9:R26C15,RC[-3]+1,FALSE)="","","|"&HLOOKUP(RC[-4],Sheet1!R2C9:R26C15,RC[-3]+1,FALSE))) -> 42201 | F432: =IF(HLOOKUP(RC[-5],Sheet1!R2C9:R26C15,RC[-4]+1,FALSE)="",ROUND(HLOOKUP(RC[-5],Sheet1!R2C1:R26C7,RC[-4]+13,FALSE)+HLOOKUP(RC[-5],Sheet1!R2C9:R26C15,RC[-4]+13,FALSE)*RC[1],0),ROUND(HLOOKUP(RC[-5],Sheet1!R2C1:R26C7,RC[-4]+13,FALSE),0)&IF(RC[1]=0,"","|"&ROUND(HLOOKUP(RC[-5],Sheet1!R2C9:R26C15,RC[-4]+13,FALSE)*RC[1],0))) -> 8 | G432: 4 | H432: 0
A433: 5 | B433: 2 | C433: 45 | D433: 0 | E433: =HLOOKUP(RC[-4],Sheet1!R2C1:R26C7,RC[-3]+1,FALSE)&IF(RC[2]=0,"",IF(HLOOKUP(RC[-4],Sheet1!R2C9:R26C15,RC[-3]+1,FALSE)="","","|"&HLOOKUP(RC[-4],Sheet1!R2C9:R26C15,RC[-3]+1,FALSE))) -> 42201 | F433: =IF(HLOOKUP(RC[-5],Sheet1!R2C9:R26C15,RC[-4]+1,FALSE)="",ROUND(HLOOKUP(RC[-5],Sheet1!R2C1:R26C7,RC[-4]+13,FALSE)+HLOOKUP(RC[-5],Sheet1!R2C9:R26C15,RC[-4]+13,FALSE)*RC[1],0),ROUND(HLOOKUP(RC[-5],Sheet1!R2C1:R26C7,RC[-4]+13,FALSE),0)&IF(RC[1]=0,"","|"&ROUND(HLOOKUP(RC[-5],Sheet1!R2C9:R26C15,RC[-4]+13,FALSE)*RC[1],0))) -> 8 | G433: 3 | H433: 0
A434: 5 | B434: 2 | C434: 40 | D434: 0 | E434: =HLOOKUP(RC[-4],Sheet1!R2C1:R26C7,RC[-3]+1,FALSE)&IF(RC[2]=0,"",IF(HLOOKUP(RC[-4],Sheet1!R2C9:R26C15,RC[-3]+1,FALSE)="","","|"&HLOOKUP(RC[-4],Sheet1!R2C9:R26C15,RC[-3]+1,FALSE))) -> 42201 | F434: =IF(HLOOKUP(RC[-5],Sheet1!R2C9:R26C15,RC[-4]+1,FALSE)="",ROUND(HLOOKUP(RC[-5],Sheet1!R2C1:R26C7,RC[-4]+13,FALSE)+HLOOKUP(RC[-5],Sheet1!R2C9:R26C15,RC[-4]+13,FALSE)*RC[1],0),ROUND(HLOOKUP(RC[-5],Sheet1!R2C1:R26C7,RC[-4]+13,FALSE),0)&IF(RC[1]=0,"","|"&ROUND(HLOOKUP(RC[-5],Sheet1!R2C9:R26C15,RC[-4]+13,FALSE)*RC[1],0))) -> 7 | G434: 2 | H434: 0
A435: 5 | B435: 2 | C435: 35 | D435: 0 | E435: =HLOOKUP(RC[-4],Sheet1!R2C1:R26C7,RC[-3]+1,FALSE)&IF(RC[2]=0,"",IF(HLOOKUP(RC[-4],Sheet1!R2C9:R26C15,RC[-3]+1,FALSE)="","","|"&HLOOKUP(RC[-4],Sheet1!R2C9:R26C15,RC[-3]+1,FALSE))) -> 42201 | F435: =IF(HLOOKUP(RC[-5],Sheet1!R2C9:R26C15,RC[-4]+1,FALSE)="",ROUND(HLOOKUP(RC[-5],Sheet1!R2C1:R26C7,RC[-4]+13,FALSE)+HLOOKUP(RC[-5],Sheet1!R2C9:R26C15,RC[-4]+13,FALSE)*RC[1],0),ROUND(HLOOKUP(RC[-5],Sheet1!R2C1:R26C7,RC[-4]+13,FALSE),0)&IF(RC[1]=0,"","|"&ROUND(HLOOKUP(RC[-5],Sheet1!R2C9:R26C15,RC[-4]+13,FALSE)*RC[1],0))) -> 7 | G435: 1 | H435: 0
A436: 5 | B436: 2 | C436: 1 | D436: 0 | E436: =HLOOKUP(RC[-4],Sheet1!R2C1:R26C7,RC[-3]+1,FALSE)&IF(RC[2]=0,"",IF(HLOOKUP(RC[-4],Sheet1!R2C9:R26C15,RC[-3]+1,FALSE)="","","|"&HLOOKUP(RC[-4],Sheet1!R2C9:R26C15,RC[-3]+1,FALSE))) -> 42201 | F436: =IF(HLOOKUP(RC[-5],Sheet1!R2C9:R26C15,RC[-4]+1,FALSE)="",ROUND(HLOOKUP(RC[-5],Sheet1!R2C1:R26C7,RC[-4]+13,FALSE)+HLOOKUP(RC[-5],Sheet1!R2C9:R26C15,RC[-4]+13,FALSE)*RC[1],0),ROUND(HLOOKUP(RC[-5],Sheet1!R2C1:R26C7,RC[-4]+13,FALSE),0)&IF(RC[1]=0,"","|"&ROUND(HLOOKUP(RC[-5],Sheet1!R2C9:R26C15,RC[-4]+13,FALSE)*RC[1],0))) -> 6 | G436: 0 | H436: 1
A437: 5 | B437: 3 | C437: 80 | D437: 1 | E437: =HLOOKUP(RC[-4],Sheet1!R2C1:R26C7,RC[-3]+1,FALSE)&IF(RC[2]=0,"",IF(HLOOKUP(RC[-4],Sheet1!R2C9:R26C15,RC[-3]+1,FALSE)="","","|"&HLOOKUP(RC[-4],Sheet1!R2C9:R26C15,RC[-3]+1,FALSE))) -> 42301|42201 | F437: =IF(HLOOKUP(RC[-5],Sheet1!R2C9:R26C15,RC[-4]+1,FALSE)="",ROUND(HLOOKUP(RC[-5],Sheet1!R2C1:R26C7,RC[-4]+13,FALSE)+HLOOKUP(RC[-5],Sheet1!R2C9:R26C15,RC[-4]+13,FALSE)*RC[1],0),ROUND(HLOOKUP(RC[-5],Sheet1!R2C1:R26C7,RC[-4]+13,FALSE),0)&IF(RC[1]=0,"","|"&ROUND(HLOOKUP(RC[-5],Sheet1!R2C9:R26C15,RC[-4]+13,FALSE)*RC[1],0))) -> 1|5 | G437: 10 | H437: 0
A438: 5 | B438: 3 | C438: 75 | D438: 0 | E438: =HLOOKUP(RC[-4],Sheet1!R2C1:R26C7,RC[-3]+1,FALSE)&IF(RC[2]=0,"",IF(HLOOKUP(RC[-4],Sheet1!R2C9:R26C15,RC[-3]+1,FALSE)="","","|"&HLOOKUP(RC[-4],Sheet1!R2C9:R26C15,RC[-3]+1,FALSE))) -> 42301|42201 | F438: =IF(HLOOKUP(RC[-5],Sheet1!R2C9:R26C15,RC[-4]+1,FALSE)="",ROUND(HLOOKUP(RC[-5],Sheet1!R2C1:R26C7,RC[-4]+13,FALSE)+HLOOKUP(RC[-5],Sheet1!R2C9:R26C15,RC[-4]+13,FALSE)*RC[1],0),ROUND(HLOOKUP(RC[-5],Sheet1!R2C1:R26C7,RC[-4]+13,FALSE),0)&IF(RC[1]=0,"","|"&ROUND(HLOOKUP(RC[-5],Sheet1!R2C9:R26C15,RC[-4]+13,FALSE)*RC[1],0))) -> 1|5 | G438: 9 | H438: 0
A439: 5 | B439: 3 | C439: 70 | D439: 0 | E439: =HLOOKUP(RC[-4],Sheet1!R2C1:R26C7,RC[-3]+1,FALSE)&IF(RC[2]=0,"",IF(HLOOKUP(RC[-4],Sheet1!R2C9:R26C15,RC[-3]+1,FALSE)="","","|"&HLOOKUP(RC[-4],Sheet1!R2C9:R26C15,RC[-3]+1,FALSE))) -> 42301|42201 | F439: =IF(HLOOKUP(RC[-5],Sheet1!R2C9:R26C15,RC[-4]+1,FALSE)="",ROUND(HLOOKUP(RC[-5],Sheet1!R2C1:R26C7,RC[-4]+13,FALSE)+HLOOKUP(RC[-5],Sheet1!R2C9:R26C15,RC[-4]+13,FALSE)*RC[1],0),ROUND(HLOOKUP(RC[-5],Sheet1!R2C1:R26C7,RC[-4]+13,FALSE),0)&IF(RC[1]=0,"","|"&ROUND(HLOOKUP(RC[-5],Sheet1!R2C9:R26C15,RC[-4]+13,FALSE)*RC[1],0))) -> 1|4 | G439: 8 | H439: 0
A440: 5 | B440: 3 | C440: 65 | D440: 0 | E440: =HLOOKUP(RC[-4],Sheet1!R2C1:R26C7,RC[-3]+1,FALSE)&IF(RC[2]=0,"",IF(HLOOKUP(RC[-4],Sheet1!R2C9:R26C15,RC[-3]+1,FALSE)="","","|"&HLOOKUP(RC[-4],Sheet1!R2C9:R26C15,RC[-3]+1,FALSE))) -> 42301|42201 | F440: =IF(HLOOKUP(RC[-5],Sheet1!R2C9:R26C15,RC[-4]+1,FALSE)="",ROUND(HLOOKUP(RC[-5],Sheet1!R2C1:R26C7,RC[-4]+13,FALSE)+HLOOKUP(RC[-5],Sheet1!R2C9:R26C15,RC[-4]+13,FALSE)*RC[1],0),ROUND(HLOOKUP(RC[-5],Sheet1!R2C1:R26C7,RC[-4]+13,FALSE),0)&IF(RC[1]=0,"","|"&ROUND(HLOOKUP(RC[-5],Sheet1!R2C9:R26C15,RC[-4]+13,FALSE)*RC[1],0))) -> 1|4 | G440: 7 | H440: 0
A441: 5 | B441: 3 | C441: 60 | D441: 0 | E441: =HLOOKUP(RC[-4],Sheet1!R2C1:R26C7,RC[-3]+1,FALSE)&IF(RC[2]=0,"",IF(HLOOKUP(RC[-4],Sheet1!R2C9:R26C15,RC[-3]+1,FALSE)="","","|"&HLOOKUP(RC[-4],Sheet1!R2C9:R26C15,RC[-3]+1,FALSE))) -> 42301|42201 | F441: =IF(HLOOKUP(RC[-5],Sheet1!R2C9:R26C15,RC[-4]+1,FALSE)="",ROUND(HLOOKUP(RC[-5],Sheet1!R2C1:R26C7,RC[-4]+13,FALSE)+HLOOKUP(RC[-5],Sheet1!R2C9:R26C15,RC[-4]+13,FALSE)*RC[1],0),ROUND(HLOOKUP(RC[-5],Sheet1!R2C1:R26C7,RC[-4]+13,FALSE),0)&IF(RC[1]=0,"","|"&ROUND(HLOOKUP(RC[-5],Sheet1!R2C9:R26C15,RC[-4]+13,FALSE)*RC[1],0))) -> 1|3 | G441: 6 | H441: 0
A442: 5 | B442: 3 | C442: 55 | D442: 0 | E442: =HLOOKUP(RC[-4],Sheet1!R2C1:R26C7,RC[-3]+1,FALSE)&IF(RC[2]=0,"",IF(HLOOKUP(RC[-4],Sheet1!R2C9:R26C15,RC[-3]+1,FALSE)="","","|"&HLOOKUP(RC[-4],Sheet1!R2C9:R26C15,RC[-3]+1,FALSE))) -> 42301|42201 | F442: =IF(HLOOKUP(RC[-5],Sheet1!R2C9:R26C15,RC[-4]+1,FALSE)="",ROUND(HLOOKUP(RC[-5],Sheet1!R2C1:R26C7,RC[-4]+13,FALSE)+HLOOKUP(RC[-5],Sheet1!R2C9:R26C15,RC[-4]+13,FALSE)*RC[1],0),ROUND(HLOOKUP(RC[-5],Sheet1!R2C1:R26C7,RC[-4]+13,FALSE),0)&IF(RC[1]=0,"","|"&ROUND(HLOOKUP(RC[-5],Sheet1!R2C9:R26C15,RC[-4]+13,FALSE)*RC[1],0))) -> 1|3 | G442: 5 | H442: 0
A443: 5 | B443: 3 | C443: 50 | D443: 0 | E443: =HLOOKUP(RC[-4],Sheet1!R2C1:R26C7,RC[-3]+1,FALSE)&IF(RC[2]=0,"",IF(HLOOKUP(RC[-4],Sheet1!R2C9:R26C15,RC[-3]+1,FALSE)="","","|"&HLOOKUP(RC[-4],Sheet1!R2C9:R26C15,RC[-3]+1,FALSE))) -> 42301|42201 | F443: =IF(HLOOKUP(RC[-5],Sheet1!R2C9:R26C15,RC[-4]+1,FALSE)="",ROUND(HLOOKUP(RC[-5],Sheet1!R2C1:R26C7,RC[-4]+13,FALSE)+HLOOKUP(RC[-5],Sheet1!R2C9:R26C15,RC[-4]+13,FALSE)*RC[1],0),ROUND(HLOOKUP(RC[-5],Sheet1!R2C1:R26C7,RC[-4]+13,FALSE),0)&IF(RC[1]=0,"","|"&ROUND(HLOOKUP(RC[-5],Sheet1!R2C9:R26C15,RC[-4]+13,FALSE)*RC[1],0))) -> 1|2 | G443: 4 | H443: 0
A444: 5 | B444: 3 | C444: 45 | D444: 0 | E444: =HLOOKUP(RC[-4],Sheet1!R2C1:R26C7,RC[-3]+1,FALSE)&IF(RC[2]=0,"",IF(HLOOKUP(RC[-4],Sheet1!R2C9:R26C15,RC[-3]+1,FALSE)="","","|"&HLOOKUP(RC[-4],Sheet1!R2C9:R26C15,RC[-3]+1,FALSE))) -> 42301|42201 | F444: =IF(HLOOKUP(RC[-5],Sheet1!R2C9:R26C15,RC[-4]+1,FALSE)="",ROUND(HLOOKUP(RC[-5],Sheet1!R2C1:R26C7,RC[-4]+13,FALSE)+HLOOKUP(RC[-5],Sheet1!R2C9:R26C15,RC[-4]+13,FALSE)*RC[1],0),ROUND(HLOOKUP(RC[-5],Sheet1!R2C1:R26C7,RC[-4]+13,FALSE),0)&IF(RC[1]=0,"","|"&ROUND(HLOOKUP(RC[-5],Sheet1!R2C9:R26C15,RC[-4]+13,FALSE)*RC[1],0))) -> 1|2 | G444: 3 | H444: 0
A445: 5 | B445: 3 | C445: 40 | D445: 0 | E445: =HLOOKUP(RC[-4],Sheet1!R2C1:R26C7,RC[-3]+1,FALSE)&IF(RC[2]=0,"",IF(HLOOKUP(RC[-4],Sheet1!R2C9:R26C15,RC[-3]+1,FALSE)="","","|"&HLOOKUP(RC[-4],Sheet1!R2C9:R26C15,RC[-3]+1,FALSE))) -> 42301|42201 | F445: =IF(HLOOKUP(RC[-5],Sheet1!R2C9:R26C15,RC[-4]+1,FALSE)="",ROUND(HLOOKUP(RC[-5],Sheet1!R2C1:R26C7,RC[-4]+13,FALSE)+HLOOKUP(RC[-5],Sheet1!R2C9:R26C15,RC[-4]+13,FALSE)*RC[1],0),ROUND(HLOOKUP(RC[-5],Sheet1!R2C1:R26C7,RC[-4]+13,FALSE),0)&IF(RC[1]=0,"","|"&ROUND(HLOOKUP(RC[-5],Sheet1!R2C9:R26C15,RC[-4]+13,FALSE)*RC[1],0))) -> 1|1 | G445: 2 | H445: 0
A446: 5 | B446: 3 | C446: 35 | D446: 0 | E446: =HLOOKUP(RC[-4],Sheet1!R2C1:R26C7,RC[-3]+1,FALSE)&IF(RC[2]=0,"",IF(HLOOKUP(RC[-4],Sheet1!R2C9:R26C15,RC[-3]+1,FALSE)="","","|"&HLOOKUP(RC[-4],Sheet1!R2C9:R26C15,RC[-3]+1,FALSE))) -> 42301|42201 | F446: =IF(HLOOKUP(RC[-5],Sheet1!R2C9:R26C15,RC[-4]+1,FALSE)="",ROUND(HLOOKUP(RC[-5],Sheet1!R2C1:R26C7,RC[-4]+13,FALSE)+HLOOKUP(RC[-5],Sheet1!R2C9:R26C15,RC[-4]+13,FALSE)*RC[1],0),ROUND(HLOOKUP(RC[-5],Sheet1!R2C1:R26C7,RC[-4]+13,FALSE),0)&IF(RC[1]=0,"","|"&ROUND(HLOOKUP(RC[-5],Sheet1!R2C9:R26C15,RC[-4]+13,FALSE)*RC[1],0))) -> 1|1 | G446: 1 | H446: 0
A447: 5 | B447: 3 | C447: 1 | D447: 0 | E447: =HLOOKUP(RC[-4],Sheet1!R2C1:R26C7,RC[-3]+1,FALSE)&IF(RC[2]=0,"",IF(HLOOKUP(RC[-4],Sheet1!R2C9:R26C15,RC[-3]+1,FALSE)="","","|"&HLOOKUP(RC[-4],Sheet1!R2C9:R26C15,RC[-3]+1,FALSE))) -> 42301 | F447: =IF(HLOOKUP(RC[-5],Sheet1!R2C9:R26C15,RC[-4]+1,FALSE)="",ROUND(HLOOKUP(RC[-5],Sheet1!R2C1:R26C7,RC[-4]+13,FALSE)+HLOOKUP(RC[-5],Sheet1!R2C9:R26C15,RC[-4]+13,FALSE)*RC[1],0),ROUND(HLOOKUP(RC[-5],Sheet1!R2C1:R26C7,RC[-4]+13,FALSE),0)&IF(RC[1]=0,"","|"&ROUND(HLOOKUP(RC[-5],Sheet1!R2C9:R26C15,RC[-4]+13,FALSE)*RC[1],0))) -> 1 | G447: 0 | H447: 1
A448: 5 | B448: 4 | C448: 80 | D448: 1 | E448: =HLOOKUP(RC[-4],Sheet1!R2C1:R26C7,RC[-3]+1,FALSE)&IF(RC[2]=0,"",IF(HLOOKUP(RC[-4],Sheet1!R2C9:R26C15,RC[-3]+1,FALSE)="","","|"&HLOOKUP(RC[-4],Sheet1!R2C9:R26C15,RC[-3]+1,FALSE))) -> 42301|42201 | F448: =IF(HLOOKUP(RC[-5],Sheet1!R2C9:R26C15,RC[-4]+1,FALSE)="",ROUND(HLOOKUP(RC[-5],Sheet1!R2C1:R26C7,RC[-4]+13,FALSE)+HLOOKUP(RC[-5],Sheet1!R2C9:R26C15,RC[-4]+13,FALSE)*RC[1],0),ROUND(HLOOKUP(RC[-5],Sheet1!R2C1:R26C7,RC[-4]+13,FALSE),0)&IF(RC[1]=0,"","|"&ROUND(HLOOKUP(RC[-5],Sheet1!R2C9:R26C15,RC[-4]+13,FALSE)*RC[1],0))) -> 2|5 | G448: 10 | H448: 0
A449: 5 | B449: 4 | C449: 75 | D449: 0 | E449: =HLOOKUP(RC[-4],Sheet1!R2C1:R26C7,RC[-3]+1,FALSE)&IF(RC[2]=0,"",IF(HLOOKUP(RC[-4],Sheet1!R2C9:R26C15,RC[-3]+1,FALSE)="","","|"&HLOOKUP(RC[-4],Sheet1!R2C9:R26C15,RC[-3]+1,FALSE))) -> 42301|42201 | F449: =IF(HLOOKUP(RC[-5],Sheet1!R2C9:R26C15,RC[-4]+1,FALSE)="",ROUND(HLOOKUP(RC[-5],Sheet1!R2C1:R26C7,RC[-4]+13,FALSE)+HLOOKUP(RC[-5],Sheet1!R2C9:R26C15,RC[-4]+13,FALSE)*RC[1],0),ROUND(HLOOKUP(RC[-5],Sheet1!R2C1:R26C7,RC[-4]+13,FALSE),0)&IF(RC[1]=0,"","|"&ROUND(HLOOKUP(RC[-5],Sheet1!R2C9:R26C15,RC[-4]+13,FALSE)*RC[1],0))) -> 2|5 | G449: 9 | H449: 0
A450: 5 | B450: 4 | C450: 70 | D450: 0 | E450: =HLOOKUP(RC[-4],Sheet1!R2C1:R26C7,RC[-3]+1,FALSE)&IF(RC[2]=0,"",IF(HLOOKUP(RC[-4],Sheet1!R2C9:R26C15,RC[-3]+1,FALSE)="","","|"&HLOOKUP(RC[-4],Sheet1!R2C9:R26C15,RC[-3]+1,FALSE))) -> 42301|42201 | F450: =IF(HLOOKUP(RC[-5],Sheet1!R2C9:R26C15,RC[-4]+1,FALSE)="",ROUND(HLOOKUP(RC[-5],Sheet1!R2C1:R26C7,RC[-4]+13,FALSE)+HLOOKUP(RC[-5],Sheet1!R2C9:R26C15,RC[-4]+13,FALSE)*RC[1],0),ROUND(HLOOKUP(RC[-5],Sheet1!R2C1:R26C7,RC[-4]+13,FALSE),0)&IF(RC[1]=0,"","|"&ROUND(HLOOKUP(RC[-5],Sheet1!R2C9:R26C15,RC[-4]+13,FALSE)*RC[1],0))) -> 2|4 | G450: 8 | H450: 0
A451: 5 | B451: 4 | C451: 65 | D451: 0 | E451: =HLOOKUP(RC[-4],Sheet1!R2C1:R26C7,RC[-3]+1,FALSE)&IF(RC[2]=0,"",IF(HLOOKUP(RC[-4],Sheet1!R2C9:R26C15,RC[-3]+1,FALSE)="","","|"&HLOOKUP(RC[-4],Sheet1!R2C9:R26C15,RC[-3]+1,FALSE))) -> 42301|42201 | F451: =IF(HLOOKUP(RC[-5],Sheet1!R2C9:R26C15,RC[-4]+1,FALSE)="",ROUND(HLOOKUP(RC[-5],Sheet1!R2C1:R26C7,RC[-4]+13,FALSE)+HLOOKUP(RC[-5],Sheet1!R2C9:R26C15,RC[-4]+13,FALSE)*RC[1],0),ROUND(HLOOKUP(RC[-5],Sheet1!R2C1:R26C7,RC[-4]+13,FALSE),0)&IF(RC[1]=0,"","|"&ROUND(HLOOKUP(RC[-5],Sheet1!R2C9:R26C15,RC[-4]+13,FALSE)*RC[1],0))) -> 2|4 | G451: 7 | H451: 0
A452: 5 | B452: 4 | C452: 60 | D452: 0 | E452: =HLOOKUP(RC[-4],Sheet1!R2C1:R26C7,RC[-3]+1,FALSE)&IF(RC[2]=0,"",IF(HLOOKUP(RC[-4],Sheet1!R2C9:R26C15,RC[-3]+1,FALSE)="","","|"&HLOOKUP(RC[-4],Sheet1!R2C9:R26C15,RC[-3]+1,FALSE))) -> 42301|42201 | F452: =IF(HLOOKUP(RC[-5],Sheet1!R2C9:R26C15,RC[-4]+1,FALSE)="",ROUND(HLOOKUP(RC[-5],Sheet1!R2C1:R26C7,RC[-4]+13,FALSE)+HLOOKUP(RC[-5],Sheet1!R2C9:R26C15,RC[-4]+13,FALSE)*RC[1],0),ROUND(HLOOKUP(RC[-5],Sheet1!R2C1:R26C7,RC[-4]+13,FALSE),0)&IF(RC[1]=0,"","|"&ROUND(HLOOKUP(RC[-5],Sheet1!R2C9:R26C15,RC[-4]+13,FALSE)*RC[1],0))) -> 2|3 | G452: 6 | H452: 0
A453: 5 | B453: 4 | C453: 55 | D453: 0 | E453: =HLOOKUP(RC[-4],Sheet1!R2C1:R26C7,RC[-3]+1,FALSE)&IF(RC[2]=0,"",IF(HLOOKUP(RC[-4],Sheet1!R2C9:R26C15,RC[-3]+1,FALSE)="","","|"&HLOOKUP(RC[-4],Sheet1!R2C9:R26C15,RC[-3]+1,FALSE))) -> 42301|42201 | F453: =IF(HLOOKUP(RC[-5],Sheet1!R2C9:R26C15,RC[-4]+1,FALSE)="",ROUND(HLOOKUP(RC[-5],Sheet1!R2C1:R26C7,RC[-4]+13,FALSE)+HLOOKUP(RC[-5],Sheet1!R2C9:R26C15,RC[-4]+13,FALSE)*RC[1],0),ROUND(HLOOKUP(RC[-5],Sheet1!R2C1:R26C7,RC[-4]+13,FALSE),0)&IF(RC[1]=0,"","|"&ROUND(HLOOKUP(RC[-5],Sheet1!R2C9:R26C15,RC[-4]+13,FALSE)*RC[1],0))) -> 2|3 | G453: 5 | H453: 0
A454: 5 | B454: 4 | C454: 50 | D454: 0 | E454: =HLOOKUP(RC[-4],Sheet1!R2C1:R26C7,RC[-3]+1,FALSE)&IF(RC[2]=0,"",IF(HLOOKUP(RC[-4],Sheet1!R2C9:R26C15,RC[-3]+1,FALSE)="","","|"&HLOOKUP(RC[-4],Sheet1!R2C9:R26C15,RC[-3]+1,FALSE))) -> 42301|42201 | F454: =IF(HLOOKUP(RC[-5],Sheet1!R2C9:R26C15,RC[-4]+1,FALSE)="",ROUND(HLOOKUP(RC[-5],Sheet1!R2C1:R26C7,RC[-4]+13,FALSE)+HLOOKUP(RC[-5],Sheet1!R2C9:R26C15,RC[-4]+13,FALSE)*RC[1],0),ROUND(HLOOKUP(RC[-5],Sheet1!R2C1:R26C7,RC[-4]+13,FALSE),0)&IF(RC[1]=0,"","|"&ROUND(HLOOKUP(RC[-5],Sheet1!R2C9:R26C15,RC[-4]+13,FALSE)*RC[1],0))) -> 2|2 | G454: 4 | H454: 0
A455: 5 | B455: 4 | C455: 45 | D455: 0 | E455: =HLOOKUP(RC[-4],Sheet1!R2C1:R26C7,RC[-3]+1,FALSE)&IF(RC[2]=0,"",IF(HLOOKUP(RC[-4],Sheet1!R2C9:R26C15,RC[-3]+1,FALSE)="","","|"&HLOOKUP(RC[-4],Sheet1!R2C9:R26C15,RC[-3]+1,FALSE))) -> 42301|42201 | F455: =IF(HLOOKUP(RC[-5],Sheet1!R2C9:R26C15,RC[-4]+1,FALSE)="",ROUND(HLOOKUP(RC[-5],Sheet1!R2C1:R26C7,RC[-4]+13,FALSE)+HLOOKUP(RC[-5],Sheet1!R2C9:R26C15,RC[-4]+13,FALSE)*RC[1],0),ROUND(HLOOKUP(RC[-5],Sheet1!R2C1:R26C7,RC[-4]+13,FALSE),0)&IF(RC[1]=0,"","|"&ROUND(HLOOKUP(RC[-5],Sheet1!R2C9:R26C15,RC[-4]+13,FALSE)*RC[1],0))) -> 2|2 | G455: 3 | H455: 0
A456: 5 | B456: 4 | C456: 40 | D456: 0 | E456: =HLOOKUP(RC[-4],Sheet1!R2C1:R26C7,RC[-3]+1,FALSE)&IF(RC[2]=0,"",IF(HLOOKUP(RC[-4],Sheet1!R2C9:R26C15,RC[-3]+1,FALSE)="","","|"&HLOOKUP(RC[-4],Sheet1!R2C9:R26C15,RC[-3]+1,FALSE))) -> 42301|42201 | F456: =IF(HLOOKUP(RC[-5],Sheet1!R2C9:R26C15,RC[-4]+1,FALSE)="",ROUND(HLOOKUP(RC[-5],Sheet1!R2C1:R26C7,RC[-4]+13,FALSE)+HLOOKUP(RC[-5],Sheet1!R2C9:R26C15,RC[-4]+13,FALSE)*RC[1],0),ROUND(HLOOKUP(RC[-5],Sheet1!R2C1:R26C7,RC[-4]+13,FALSE),0)&IF(RC[1]=0,"","|"&ROUND(HLOOKUP(RC[-5],Sheet1!R2C9:R26C15,RC[-4]+13,FALSE)*RC[1],0))) -> 2|1 | G456: 2 | H456: 0
A457: 5 | B457: 4 | C457: 35 | D457: 0 | E457: =HLOOKUP(RC[-4],Sheet1!R2C1:R26C7,RC[-3]+1,FALSE)&IF(RC[2]=0,"",IF(HLOOKUP(RC[-4],Sheet1!R2C9:R26C15,RC[-3]+1,FALSE)="","","|"&HLOOKUP(RC[-4],Sheet1!R2C9:R26C15,RC[-3]+1,FALSE))) -> 42301|42201 | F457: =IF(HLOOKUP(RC[-5],Sheet1!R2C9:R26C15,RC[-4]+1,FALSE)="",ROUND(HLOOKUP(RC[-5],Sheet1!R2C1:R26C7,RC[-4]+13,FALSE)+HLOOKUP(RC[-5],Sheet1!R2C9:R26C15,RC[-4]+13,FALSE)*RC[1],0),ROUND(HLOOKUP(RC[-5],Sheet1!R2C1:R26C7,RC[-4]+13,FALSE),0)&IF(RC[1]=0,"","|"&ROUND(HLOOKUP(RC[-5],Sheet1!R2C9:R26C15,RC[-4]+13,FALSE)*RC[1],0))) -> 2|1 | G457: 1 | H457: 0
A458: 5 | B458: 4 | C458: 1 | D458: 0 | E458: =HLOOKUP(RC[-4],Sheet1!R2C1:R26C7,RC[-3]+1,FALSE)&IF(RC[2]=0,"",IF(HLOOKUP(RC[-4],Sheet1!R2C9:R26C15,RC[-3]+1,FALSE)="","","|"&HLOOKUP(RC[-4],Sheet1!R2C9:R26C15,RC[-3]+1,FALSE))) -> 42301 | F458: =IF(HLOOKUP(RC[-5],Sheet1!R2C9:R26C15,RC[-4]+1,FALSE)="",ROUND(HLOOKUP(RC[-5],Sheet1!R2C1:R26C7,RC[-4]+13,FALSE)+HLOOKUP(RC[-5],Sheet1!R2C9:R26C15,RC[-4]+13,FALSE)*RC[1],0),ROUND(HLOOKUP(RC[-5],Sheet1!R2C1:R26C7,RC[-4]+13,FALSE),0)&IF(RC[1]=0,"","|"&ROUND(HLOOKUP(RC[-5],Sheet1!R2C9:R26C15,RC[-4]+13,FALSE)*RC[1],0))) -> 2 | G458: 0 | H458: 1
A459: 5 | B459: 5 | C459: 80 | D459: 1 | E459: =HLOOKUP(RC[-4],Sheet1!R2C1:R26C7,RC[-3]+1,FALSE)&IF(RC[2]=0,"",IF(HLOOKUP(RC[-4],Sheet1!R2C9:R26C15,RC[-3]+1,FALSE)="","","|"&HLOOKUP(RC[-4],Sheet1!R2C9:R26C15,RC[-3]+1,FALSE))) -> 42301|42201 | F459: =IF(HLOOKUP(RC[-5],Sheet1!R2C9:R26C15,RC[-4]+1,FALSE)="",ROUND(HLOOKUP(RC[-5],Sheet1!R2C1:R26C7,RC[-4]+13,FALSE)+HLOOKUP(RC[-5],Sheet1!R2C9:R26C15,RC[-4]+13,FALSE)*RC[1],0),ROUND(HLOOKUP(RC[-5],Sheet1!R2C1:R26C7,RC[-4]+13,FALSE),0)&IF(RC[1]=0,"","|"&ROUND(HLOOKUP(RC[-5],Sheet1!R2C9:R26C15,RC[-4]+13,FALSE)*RC[1],0))) -> 3|5 | G459: 10 | H459: 0
A460: 5 | B460: 5 | C460: 75 | D460: 0 | E460: =HLOOKUP(RC[-4],Sheet1!R2C1:R26C7,RC[-3]+1,FALSE)&IF(RC[2]=0,"",IF(HLOOKUP(RC[-4],Sheet1!R2C9:R26C15,RC[-3]+1,FALSE)="","","|"&HLOOKUP(RC[-4],Sheet1!R2C9:R26C15,RC[-3]+1,FALSE))) -> 42301|42201 | F460: =IF(HLOOKUP(RC[-5],Sheet1!R2C9:R26C15,RC[-4]+1,FALSE)="",ROUND(HLOOKUP(RC[-5],Sheet1!R2C1:R26C7,RC[-4]+13,FALSE)+HLOOKUP(RC[-5],Sheet1!R2C9:R26C15,RC[-4]+13,FALSE)*RC[1],0),ROUND(HLOOKUP(RC[-5],Sheet1!R2C1:R26C7,RC[-4]+13,FALSE),0)&IF(RC[1]=0,"","|"&ROUND(HLOOKUP(RC[-5],Sheet1!R2C9:R26C15,RC[-4]+13,FALSE)*RC[1],0))) -> 3|5 | G460: 9 | H460: 0
A461: 5 | B461: 5 | C461: 70 | D461: 0 | E461: =HLOOKUP(RC[-4],Sheet1!R2C1:R26C7,RC[-3]+1,FALSE)&IF(RC[2]=0,"",IF(HLOOKUP(RC[-4],Sheet1!R2C9:R26C15,RC[-3]+1,FALSE)="","","|"&HLOOKUP(RC[-4],Sheet1!R2C9:R26C15,RC[-3]+1,FALSE))) -> 42301|42201 | F461: =IF(HLOOKUP(RC[-5],Sheet1!R2C9:R26C15,RC[-4]+1,FALSE)="",ROUND(HLOOKUP(RC[-5],Sheet1!R2C1:R26C7,RC[-4]+13,FALSE)+HLOOKUP(RC[-5],Sheet1!R2C9:R26C15,RC[-4]+13,FALSE)*RC[1],0),ROUND(HLOOKUP(RC[-5],Sheet1!R2C1:R26C7,RC[-4]+13,FALSE),0)&IF(RC[1]=0,"","|"&ROUND(HLOOKUP(RC[-5],Sheet1!R2C9:R26C15,RC[-4]+13,FALSE)*RC[1],0))) -> 3|4 | G461: 8 | H461: 0
A462: 5 | B462: 5 | C462: 65 | D462: 0 | E462: =HLOOKUP(RC[-4],Sheet1!R2C1:R26C7,RC[-3]+1,FALSE)&IF(RC[2]=0,"",IF(HLOOKUP(RC[-4],Sheet1!R2C9:R26C15,RC[-3]+1,FALSE)="","","|"&HLOOKUP(RC[-4],Sheet1!R2C9:R26C15,RC[-3]+1,FALSE))) -> 42301|42201 | F462: =IF(HLOOKUP(RC[-5],Sheet1!R2C9:R26C15,RC[-4]+1,FALSE)="",ROUND(HLOOKUP(RC[-5],Sheet1!R2C1:R26C7,RC[-4]+13,FALSE)+HLOOKUP(RC[-5],Sheet1!R2C9:R26C15,RC[-4]+13,FALSE)*RC[1],0),ROUND(HLOOKUP(RC[-5],Sheet1!R2C1:R26C7,RC[-4]+13,FALSE),0)&IF(RC[1]=0,"","|"&ROUND(HLOOKUP(RC[-5],Sheet1!R2C9:R26C15,RC[-4]+13,FALSE)*RC[1],0))) -> 3|4 | G462: 7 | H462: 0
A463: 5 | B463: 5 | C463: 60 | D463: 0 | E463: =HLOOKUP(RC[-4],Sheet1!R2C1:R26C7,RC[-3]+1,FALSE)&IF(RC[2]=0,"",IF(HLOOKUP(RC[-4],Sheet1!R2C9:R26C15,RC[-3]+1,FALSE)="","","|"&HLOOKUP(RC[-4],Sheet1!R2C9:R26C15,RC[-3]+1,FALSE))) -> 42301|42201 | F463: =IF(HLOOKUP(RC[-5],Sheet1!R2C9:R26C15,RC[-4]+1,FALSE)="",ROUND(HLOOKUP(RC[-5],Sheet1!R2C1:R26C7,RC[-4]+13,FALSE)+HLOOKUP(RC[-5],Sheet1!R2C9:R26C15,RC[-4]+13,FALSE)*RC[1],0),ROUND(HLOOKUP(RC[-5],Sheet1!R2C1:R26C7,RC[-4]+13,FALSE),0)&IF(RC[1]=0,"","|"&ROUND(HLOOKUP(RC[-5],Sheet1!R2C9:R26C15,RC[-4]+13,FALSE)*RC[1],0))) -> 3|3 | G463: 6 | H463: 0
A464: 5 | B464: 5 | C464: 55 | D464: 0 | E464: =HLOOKUP(RC[-4],Sheet1!R2C1:R26C7,RC[-3]+1,FALSE)&IF(RC[2]=0,"",IF(HLOOKUP(RC[-4],Sheet1!R2C9:R26C15,RC[-3]+1,FALSE)="","","|"&HLOOKUP(RC[-4],Sheet1!R2C9:R26C15,RC[-3]+1,FALSE))) -> 42301|42201 | F464: =IF(HLOOKUP(RC[-5],Sheet1!R2C9:R26C15,RC[-4]+1,FALSE)="",ROUND(HLOOKUP(RC[-5],Sheet1!R2C1:R26C7,RC[-4]+13,FALSE)+HLOOKUP(RC[-5],Sheet1!R2C9:R26C15,RC[-4]+13,FALSE)*RC[1],0),ROUND(HLOOKUP(RC[-5],Sheet1!R2C1:R26C7,RC[-4]+13,FALSE),0)&IF(RC[1]=0,"","|"&ROUND(HLOOKUP(RC[-5],Sheet1!R2C9:R26C15,RC[-4]+13,FALSE)*RC[1],0))) -> 3|3 | G464: 5 | H464: 0
A465: 5 | B465: 5 | C465: 50 | D465: 0 | E465: =HLOOKUP(RC[-4],Sheet1!R2C1:R26C7,RC[-3]+1,FALSE)&IF(RC[2]=0,"",IF(HLOOKUP(RC[-4],Sheet1!R2C9:R26C15,RC[-3]+1,FALSE)="","","|"&HLOOKUP(RC[-4],Sheet1!R2C9:R26C15,RC[-3]+1,FALSE))) -> 42301|42201 | F465: =IF(HLOOKUP(RC[-5],Sheet1!R2C9:R26C15,RC[-4]+1,FALSE)="",ROUND(HLOOKUP(RC[-5],Sheet1!R2C1:R26C7,RC[-4]+13,FALSE)+HLOOKUP(RC[-5],Sheet1!R2C9:R26C15,RC[-4]+13,FALSE)*RC[1],0),ROUND(HLOOKUP(RC[-5],Sheet1!R2C1:R26C7,RC[-4]+13,FALSE),0)&IF(RC[1]=0,"","|"&ROUND(HLOOKUP(RC[-5],Sheet1!R2C9:R26C15,RC[-4]+13,FALSE)*RC[1],0))) -> 3|2 | G465: 4 | H465: 0
A466: 5 | B466: 5 | C466: 45 | D466: 0 | E466: =HLOOKUP(RC[-4],Sheet1!R2C1:R26C7,RC[-3]+1,FALSE)&IF(RC[2]=0,"",IF(HLOOKUP(RC[-4],Sheet1!R2C9:R26C15,RC[-3]+1,FALSE)="","","|"&HLOOKUP(RC[-4],Sheet1!R2C9:R26C15,RC[-3]+1,FALSE))) -> 42301|42201 | F466: =IF(HLOOKUP(RC[-5],Sheet1!R2C9:R26C15,RC[-4]+1,FALSE)="",ROUND(HLOOKUP(RC[-5],Sheet1!R2C1:R26C7,RC[-4]+13,FALSE)+HLOOKUP(RC[-5],Sheet1!R2C9:R26C15,RC[-4]+13,FALSE)*RC[1],0),ROUND(HLOOKUP(RC[-5],Sheet1!R2C1:R26C7,RC[-4]+13,FALSE),0)&IF(RC[1]=0,"","|"&ROUND(HLOOKUP(RC[-5],Sheet1!R2C9:R26C15,RC[-4]+13,FALSE)*RC[1],0))) -> 3|2 | G466: 3 | H466: 0
A467: 5 | B467: 5 | C467: 40 | D467: 0 | E467: =HLOOKUP(RC[-4],Sheet1!R2C1:R26C7,RC[-3]+1,FALSE)&IF(RC[2]=0,"",IF(HLOOKUP(RC[-4],Sheet1!R2C9:R26C15,RC[-3]+1,FALSE)="","","|"&HLOOKUP(RC[-4],Sheet1!R2C9:R26C15,RC[-3]+1,FALSE))) -> 42301|42201 | F467: =IF(HLOOKUP(RC[-5],Sheet1!R2C9:R26C15,RC[-4]+1,FALSE)="",ROUND(HLOOKUP(RC[-5],Sheet1!R2C1:R26C7,RC[-4]+13,FALSE)+HLOOKUP(RC[-5],Sheet1!R2C9:R26C15,RC[-4]+13,FALSE)*RC[1],0),ROUND(HLOOKUP(RC[-5],Sheet1!R2C1:R26C7,RC[-4]+13,FALSE),0)&IF(RC[1]=0,"","|"&ROUND(HLOOKUP(RC[-5],Sheet1!R2C9:R26C15,RC[-4]+13,FALSE)*RC[1],0))) -> 3|1 | G467: 2 | H467: 0
A468: 5 | B468: 5 | C468: 35 | D468: 0 | E468: =HLOOKUP(RC[-4],Sheet1!R2C1:R26C7,RC[-3]+1,FALSE)&IF(RC[2]=0,"",IF(HLOOKUP(RC[-4],Sheet1!R2C9:R26C15,RC[-3]+1,FALSE)="","","|"&HLOOKUP(RC[-4],Sheet1!R2C9:R26C15,RC[-3]+1,FALSE))) -> 42301|42201 | F468: =IF(HLOOKUP(RC[-5],Sheet1!R2C9:R26C15,RC[-4]+1,FALSE)="",ROUND(HLOOKUP(RC[-5],Sheet1!R2C1:R26C7,RC[-4]+13,FALSE)+HLOOKUP(RC[-5],Sheet1!R2C9:R26C15,RC[-4]+13,FALSE)*RC[1],0),ROUND(HLOOKUP(RC[-5],Sheet1!R2C1:R26C7,RC[-4]+13,FALSE),0)&IF(RC[1]=0,"","|"&ROUND(HLOOKUP(RC[-5],Sheet1!R2C9:R26C15,RC[-4]+13,FALSE)*RC[1],0))) -> 3|1 | G468: 1 | H468: 0
A469: 5 | B469: 5 | C469: 1 | D469: 0 | E469: =HLOOKUP(RC[-4],Sheet1!R2C1:R26C7,RC[-3]+1,FALSE)&IF(RC[2]=0,"",IF(HLOOKUP(RC[-4],Sheet1!R2C9:R26C15,RC[-3]+1,FALSE)="","","|"&HLOOKUP(RC[-4],Sheet1!R2C9:R26C15,RC[-3]+1,FALSE))) -> 42301 | F469: =IF(HLOOKUP(RC[-5],Sheet1!R2C9:R26C15,RC[-4]+1,FALSE)="",ROUND(HLOOKUP(RC[-5],Sheet1!R2C1:R26C7,RC[-4]+13,FALSE)+HLOOKUP(RC[-5],Sheet1!R2C9:R26C15,RC[-4]+13,FALSE)*RC[1],0),ROUND(HLOOKUP(RC[-5],Sheet1!R2C1:R26C7,RC[-4]+13,FALSE),0)&IF(RC[1]=0,"","|"&ROUND(HLOOKUP(RC[-5],Sheet1!R2C9:R26C15,RC[-4]+13,FALSE)*RC[1],0))) -> 3 | G469: 0 | H469: 1
A470: 5 | B470: 6 | C470: 80 | D470: 1 | E470: =HLOOKUP(RC[-4],Sheet1!R2C1:R26C7,RC[-3]+1,FALSE)&IF(RC[2]=0,"",IF(HLOOKUP(RC[-4],Sheet1!R2C9:R26C15,RC[-3]+1,FALSE)="","","|"&HLOOKUP(RC[-4],Sheet1!R2C9:R26C15,RC[-3]+1,FALSE))) -> 42301|42201 | F470: =IF(HLOOKUP(RC[-5],Sheet1!R2C9:R26C15,RC[-4]+1,FALSE)="",ROUND(HLOOKUP(RC[-5],Sheet1!R2C1:R26C7,RC[-4]+13,FALSE)+HLOOKUP(RC[-5],Sheet1!R2C9:R26C15,RC[-4]+13,FALSE)*RC[1],0),ROUND(HLOOKUP(RC[-5],Sheet1!R2C1:R26C7,RC[-4]+13,FALSE),0)&IF(RC[1]=0,"","|"&ROUND(HLOOKUP(RC[-5],Sheet1!R2C9:R26C15,RC[-4]+13,FALSE)*RC[1],0))) -> 4|10 | G470: 10 | H470: 0
A471: 5 | B471: 6 | C471: 75 | D471: 0 | E471: =HLOOKUP(RC[-4],Sheet1!R2C1:R26C7,RC[-3]+1,FALSE)&IF(RC[2]=0,"",IF(HLOOKUP(RC[-4],Sheet1!R2C9:R26C15,RC[-3]+1,FALSE)="","","|"&HLOOKUP(RC[-4],Sheet1!R2C9:R26C15,RC[-3]+1,FALSE))) -> 42301|42201 | F471: =IF(HLOOKUP(RC[-5],Sheet1!R2C9:R26C15,RC[-4]+1,FALSE)="",ROUND(HLOOKUP(RC[-5],Sheet1!R2C1:R26C7,RC[-4]+13,FALSE)+HLOOKUP(RC[-5],Sheet1!R2C9:R26C15,RC[-4]+13,FALSE)*RC[1],0),ROUND(HLOOKUP(RC[-5],Sheet1!R2C1:R26C7,RC[-4]+13,FALSE),0)&IF(RC[1]=0,"","|"&ROUND(HLOOKUP(RC[-5],Sheet1!R2C9:R26C15,RC[-4]+13,FALSE)*RC[1],0))) -> 4|9 | G471: 9 | H471: 0
A472: 5 | B472: 6 | C472: 70 | D472: 0 | E472: =HLOOKUP(RC[-4],Sheet1!R2C1:R26C7,RC[-3]+1,FALSE)&IF(RC[2]=0,"",IF(HLOOKUP(RC[-4],Sheet1!R2C9:R26C15,RC[-3]+1,FALSE)="","","|"&HLOOKUP(RC[-4],Sheet1!R2C9:R26C15,RC[-3]+1,FALSE))) -> 42301|42201 | F472: =IF(HLOOKUP(RC[-5],Sheet1!R2C9:R26C15,RC[-4]+1,FALSE)="",ROUND(HLOOKUP(RC[-5],Sheet1!R2C1:R26C7,RC[-4]+13,FALSE)+HLOOKUP(RC[-5],Sheet1!R2C9:R26C15,RC[-4]+13,FALSE)*RC[1],0),ROUND(HLOOKUP(RC[-5],Sheet1!R2C1:R26C7,RC[-4]+13,FALSE),0)&IF(RC[1]=0,"","|"&ROUND(HLOOKUP(RC[-5],Sheet1!R2C9:R26C15,RC[-4]+13,FALSE)*RC[1],0))) -> 4|8 | G472: 8 | H472: 0
A473: 5 | B473: 6 | C473: 65 | D473: 0 | E473: =HLOOKUP(RC[-4],Sheet1!R2C1:R26C7,RC[-3]+1,FALSE)&IF(RC[2]=0,"",IF(HLOOKUP(RC[-4],Sheet1!R2C9:R26C15,RC[-3]+1,FALSE)="","","|"&HLOOKUP(RC[-4],Sheet1!R2C9:R26C15,RC[-3]+1,FALSE))) -> 42301|42201 | F473: =IF(HLOOKUP(RC[-5],Sheet1!R2C9:R26C15,RC[-4]+1,FALSE)="",ROUND(HLOOKUP(RC[-5],Sheet1!R2C1:R26C7,RC[-4]+13,FALSE)+HLOOKUP(RC[-5],Sheet1!R2C9:R26C15,RC[-4]+13,FALSE)*RC[1],0),ROUND(HLOOKUP(RC[-5],Sheet1!R2C1:R26C7,RC[-4]+13,FALSE),0)&IF(RC[1]=0,"","|"&ROUND(HLOOKUP(RC[-5],Sheet1!R2C9:R26C15,RC[-4]+13,FALSE)*RC[1],0))) -> 4|7 | G473: 7 | H473: 0
A474: 5 | B474: 6 | C474: 60 | D474: 0 | E474: =HLOOKUP(RC[-4],Sheet1!R2C1:R26C7,RC[-3]+1,FALSE)&IF(RC[2]=0,"",IF(HLOOKUP(RC[-4],Sheet1!R2C9:R26C15,RC[-3]+1,FALSE)="","","|"&HLOOKUP(RC[-4],Sheet1!R2C9:R26C15,RC[-3]+1,FALSE))) -> 42301|42201 | F474: =IF(HLOOKUP(RC[-5],Sheet1!R2C9:R26C15,RC[-4]+1,FALSE)="",ROUND(HLOOKUP(RC[-5],Sheet1!R2C1:R26C7,RC[-4]+13,FALSE)+HLOOKUP(RC[-5],Sheet1!R2C9:R26C15,RC[-4]+13,FALSE)*RC[1],0),ROUND(HLOOKUP(RC[-5],Sheet1!R2C1:R26C7,RC[-4]+13,FALSE),0)&IF(RC[1]=0,"","|"&ROUND(HLOOKUP(RC[-5],Sheet1!R2C9:R26C15,RC[-4]+13,FALSE)*RC[1],0))) -> 4|6 | G474: 6 | H474: 0
A475: 5 | B475: 6 | C475: 55 | D475: 0 | E475: =HLOOKUP(RC[-4],Sheet1!R2C1:R26C7,RC[-3]+1,FALSE)&IF(RC[2]=0,"",IF(HLOOKUP(RC[-4],Sheet1!R2C9:R26C15,RC[-3]+1,FALSE)="","","|"&HLOOKUP(RC[-4],Sheet1!R2C9:R26C15,RC[-3]+1,FALSE))) -> 42301|42201 | F475: =IF(HLOOKUP(RC[-5],Sheet1!R2C9:R26C15,RC[-4]+1,FALSE)="",ROUND(HLOOKUP(RC[-5],Sheet1!R2C1:R26C7,RC[-4]+13,FALSE)+HLOOKUP(RC[-5],Sheet1!R2C9:R26C15,RC[-4]+13,FALSE)*RC[1],0),ROUND(HLOOKUP(RC[-5],Sheet1!R2C1:R26C7,RC[-4]+13,FALSE),0)&IF(RC[1]=0,"","|"&ROUND(HLOOKUP(RC[-5],Sheet1!R2C9:R26C15,RC[-4]+13,FALSE)*RC[1],0))) -> 4|5 | G475: 5 | H475: 0
A476: 5 | B476: 6 | C476: 50 | D476: 0 | E476: =HLOOKUP(RC[-4],Sheet1!R2C1:R26C7,RC[-3]+1,FALSE)&IF(RC[2]=0,"",IF(HLOOKUP(RC[-4],Sheet1!R2C9:R26C15,RC[-3]+1,FALSE)="","","|"&HLOOKUP(RC[-4],Sheet1!R2C9:R26C15,RC[-3]+1,FALSE))) -> 42301|42201 | F476: =IF(HLOOKUP(RC[-5],Sheet1!R2C9:R26C15,RC[-4]+1,FALSE)="",ROUND(HLOOKUP(RC[-5],Sheet1!R2C1:R26C7,RC[-4]+13,FALSE)+HLOOKUP(RC[-5],Sheet1!R2C9:R26C15,RC[-4]+13,FALSE)*RC[1],0),ROUND(HLOOKUP(RC[-5],Sheet1!R2C1:R26C7,RC[-4]+13,FALSE),0)&IF(RC[1]=0,"","|"&ROUND(HLOOKUP(RC[-5],Sheet1!R2C9:R26C15,RC[-4]+13,FALSE)*RC[1],0))) -> 4|4 | G476: 4 | H476: 0
A477: 5 | B477: 6 | C477: 45 | D477: 0 | E477: =HLOOKUP(RC[-4],Sheet1!R2C1:R26C7,RC[-3]+1,FALSE)&IF(RC[2]=0,"",IF(HLOOKUP(RC[-4],Sheet1!R2C9:R26C15,RC[-3]+1,FALSE)="","","|"&HLOOKUP(RC[-4],Sheet1!R2C9:R26C15,RC[-3]+1,FALSE))) -> 42301|42201 | F477: =IF(HLOOKUP(RC[-5],Sheet1!R2C9:R26C15,RC[-4]+1,FALSE)="",ROUND(HLOOKUP(RC[-5],Sheet1!R2C1:R26C7,RC[-4]+13,FALSE)+HLOOKUP(RC[-5],Sheet1!R2C9:R26C15,RC[-4]+13,FALSE)*RC[1],0),ROUND(HLOOKUP(RC[-5],Sheet1!R2C1:R26C7,RC[-4]+13,FALSE),0)&IF(RC[1]=0,"","|"&ROUND(HLOOKUP(RC[-5],Sheet1!R2C9:R26C15,RC[-4]+13,FALSE)*RC[1],0))) -> 4|3 | G477: 3 | H477: 0
A478: 5 | B478: 6 | C478: 40 | D478: 0 | E478: =HLOOKUP(RC[-4],Sheet1!R2C1:R26C7,RC[-3]+1,FALSE)&IF(RC[2]=0,"",IF(HLOOKUP(RC[-4],Sheet1!R2C9:R26C15,RC[-3]+1,FALSE)="","","|"&HLOOKUP(RC[-4],Sheet1!R2C9:R26C15,RC[-3]+1,FALSE))) -> 42301|42201 | F478: =IF(HLOOKUP(RC[-5],Sheet1!R2C9:R26C15,RC[-4]+1,FALSE)="",ROUND(HLOOKUP(RC[-5],Sheet1!R2C1:R26C7,RC[-4]+13,FALSE)+HLOOKUP(RC[-5],Sheet1!R2C9:R26C15,RC[-4]+13,FALSE)*RC[1],0),ROUND(HLOOKUP(RC[-5],Sheet1!R2C1:R26C7,RC[-4]+13,FALSE),0)&IF(RC[1]=0,"","|"&ROUND(HLOOKUP(RC[-5],Sheet1!R2C9:R26C15,RC[-4]+13,FALSE)*RC[1],0))) -> 4|2 | G478: 2 | H478: 0
A479: 5 | B479: 6 | C479: 35 | D479: 0 | E479: =HLOOKUP(RC[-4],Sheet1!R2C1:R26C7,RC[-3]+1,FALSE)&IF(RC[2]=0,"",IF(HLOOKUP(RC[-4],Sheet1!R2C9:R26C15,RC[-3]+1,FALSE)="","","|"&HLOOKUP(RC[-4],Sheet1!R2C9:R26C15,RC[-3]+1,FALSE))) -> 42301|42201 | F479: =IF(HLOOKUP(RC[-5],Sheet1!R2C9:R26C15,RC[-4]+1,FALSE)="",ROUND(HLOOKUP(RC[-5],Sheet1!R2C1:R26C7,RC[-4]+13,FALSE)+HLOOKUP(RC[-5],Sheet1!R2C9:R26C15,RC[-4]+13,FALSE)*RC[1],0),ROUND(HLOOKUP(RC[-5],Sheet1!R2C1:R26C7,RC[-4]+13,FALSE),0)&IF(RC[1]=0,"","|"&ROUND(HLOOKUP(RC[-5],Sheet1!R2C9:R26C15,RC[-4]+13,FALSE)*RC[1],0))) -> 4|1 | G479: 1 | H479: 0
A480: 5 | B480: 6 | C480: 1 | D480: 0 | E480: =HLOOKUP(RC[-4],Sheet1!R2C1:R26C7,RC[-3]+1,FALSE)&IF(RC[2]=0,"",IF(HLOOKUP(RC[-4],Sheet1!R2C9:R26C15,RC[-3]+1,FALSE)="","","|"&HLOOKUP(RC[-4],Sheet1!R2C9:R26C15,RC[-3]+1,FALSE))) -> 42301 | F480: =IF(HLOOKUP(RC[-5],Sheet1!R2C9:R26C15,RC[-4]+1,FALSE)="",ROUND(HLOOKUP(RC[-5],Sheet1!R2C1:R26C7,RC[-4]+13,FALSE)+HLOOKUP(RC[-5],Sheet1!R2C9:R26C15,RC[-4]+13,FALSE)*RC[1],0),ROUND(HLOOKUP(RC[-5],Sheet1!R2C1:R26C7,RC[-4]+13,FALSE),0)&IF(RC[1]=0,"","|"&ROUND(HLOOKUP(RC[-5],Sheet1!R2C9:R26C15,RC[-4]+13,FALSE)*RC[1],0))) -> 4 | G480: 0 | H480: 1
A481: 5 | B481: 7 | C481: 80 | D481: 1 | E481: =HLOOKUP(RC[-4],Sheet1!R2C1:R26C7,RC[-3]+1,FALSE)&IF(RC[2]=0,"",IF(HLOOKUP(RC[-4],Sheet1!R2C9:R26C15,RC[-3]+1,FALSE)="","","|"&HLOOKUP(RC[-4],Sheet1!R2C9:R26C15,RC[-3]+1,FALSE))) -> 42301|42201 | F481: =IF(HLOOKUP(RC[-5],Sheet1!R2C9:R26C15,RC[-4]+1,FALSE)="",ROUND(HLOOKUP(RC[-5],Sheet1!R2C1:R26C7,RC[-4]+13,FALSE)+HLOOKUP(RC[-5],Sheet1!R2C9:R26C15,RC[-4]+13,FALSE)*RC[1],0),ROUND(HLOOKUP(RC[-5],Sheet1!R2C1:R26C7,RC[-4]+13,FALSE),0)&IF(RC[1]=0,"","|"&ROUND(HLOOKUP(RC[-5],Sheet1!R2C9:R26C15,RC[-4]+13,FALSE)*RC[1],0))) -> 5|10 | G481: 10 | H481: 0
A482: 5 | B482: 7 | C482: 75 | D482: 0 | E482: =HLOOKUP(RC[-4],Sheet1!R2C1:R26C7,RC[-3]+1,FALSE)&IF(RC[2]=0,"",IF(HLOOKUP(RC[-4],Sheet1!R2C9:R26C15,RC[-3]+1,FALSE)="","","|"&HLOOKUP(RC[-4],Sheet1!R2C9:R26C15,RC[-3]+1,FALSE))) -> 42301|42201 | F482: =IF(HLOOKUP(RC[-5],Sheet1!R2C9:R26C15,RC[-4]+1,FALSE)="",ROUND(HLOOKUP(RC[-5],Sheet1!R2C1:R26C7,RC[-4]+13,FALSE)+HLOOKUP(RC[-5],Sheet1!R2C9:R26C15,RC[-4]+13,FALSE)*RC[1],0),ROUND(HLOOKUP(RC[-5],Sheet1!R2C1:R26C7,RC[-4]+13,FALSE),0)&IF(RC[1]=0,"","|"&ROUND(HLOOKUP(RC[-5],Sheet1!R2C9:R26C15,RC[-4]+13,FALSE)*RC[1],0))) -> 5|9 | G482: 9 | H482: 0
A483: 5 | B483: 7 | C483: 70 | D483: 0 | E483: =HLOOKUP(RC[-4],Sheet1!R2C1:R26C7,RC[-3]+1,FALSE)&IF(RC[2]=0,"",IF(HLOOKUP(RC[-4],Sheet1!R2C9:R26C15,RC[-3]+1,FALSE)="","","|"&HLOOKUP(RC[-4],Sheet1!R2C9:R26C15,RC[-3]+1,FALSE))) -> 42301|42201 | F483: =IF(HLOOKUP(RC[-5],Sheet1!R2C9:R26C15,RC[-4]+1,FALSE)="",ROUND(HLOOKUP(RC[-5],Sheet1!R2C1:R26C7,RC[-4]+13,FALSE)+HLOOKUP(RC[-5],Sheet1!R2C9:R26C15,RC[-4]+13,FALSE)*RC[1],0),ROUND(HLOOKUP(RC[-5],Sheet1!R2C1:R26C7,RC[-4]+13,FALSE),0)&IF(RC[1]=0,"","|"&ROUND(HLOOKUP(RC[-5],Sheet1!R2C9:R26C15,RC[-4]+13,FALSE)*RC[1],0))) -> 5|8 | G483: 8 | H483: 0
A484: 5 | B484: 7 | C484: 65 | D484: 0 | E484: =HLOOKUP(RC[-4],Sheet1!R2C1:R26C7,RC[-3]+1,FALSE)&IF(RC[2]=0,"",IF(HLOOKUP(RC[-4],Sheet1!R2C9:R26C15,RC[-3]+1,FALSE)="","","|"&HLOOKUP(RC[-4],Sheet1!R2C9:R26C15,RC[-3]+1,FALSE))) -> 42301|42201 | F484: =IF(HLOOKUP(RC[-5],Sheet1!R2C9:R26C15,RC[-4]+1,FALSE)="",ROUND(HLOOKUP(RC[-5],Sheet1!R2C1:R26C7,RC[-4]+13,FALSE)+HLOOKUP(RC[-5],Sheet1!R2C9:R26C15,RC[-4]+13,FALSE)*RC[1],0),ROUND(HLOOKUP(RC[-5],Sheet1!R2C1:R26C7,RC[-4]+13,FALSE),0)&IF(RC[1]=0,"","|"&ROUND(HLOOKUP(RC[-5],Sheet1!R2C9:R26C15,RC[-4]+13,FALSE)*RC[1],0))) -> 5|7 | G484: 7 | H484: 0
A485: 5 | B485: 7 | C485: 60 | D485: 0 | E485: =HLOOKUP(RC[-4],Sheet1!R2C1:R26C7,RC[-3]+1,FALSE)&IF(RC[2]=0,"",IF(HLOOKUP(RC[-4],Sheet1!R2C9:R26C15,RC[-3]+1,FALSE)="","","|"&HLOOKUP(RC[-4],Sheet1!R2C9:R26C15,RC[-3]+1,FALSE))) -> 42301|42201 | F485: =IF(HLOOKUP(RC[-5],Sheet1!R2C9:R26C15,RC[-4]+1,FALSE)="",ROUND(HLOOKUP(RC[-5],Sheet1!R2C1:R26C7,RC[-4]+13,FALSE)+HLOOKUP(RC[-5],Sheet1!R2C9:R26C15,RC[-4]+13,FALSE)*RC[1],0),ROUND(HLOOKUP(RC[-5],Sheet1!R2C1:R26C7,RC[-4]+13,FALSE),0)&IF(RC[1]=0,"","|"&ROUND(HLOOKUP(RC[-5],Sheet1!R2C9:R26C15,RC[-4]+13,FALSE)*RC[1],0))) -> 5|6 | G485: 6 | H485: 0
A486: 5 | B486: 7 | C486: 55 | D486: 0 | E486: =HLOOKUP(RC[-4],Sheet1!R2C1:R26C7,RC[-3]+1,FALSE)&IF(RC[2]=0,"",IF(HLOOKUP(RC[-4],Sheet1!R2C9:R26C15,RC[-3]+1,FALSE)="","","|"&HLOOKUP(RC[-4],Sheet1!R2C9:R26C15,RC[-3]+1,FALSE))) -> 42301|42201 | F486: =IF(HLOOKUP(RC[-5],Sheet1!R2C9:R26C15,RC[-4]+1,FALSE)="",ROUND(HLOOKUP(RC[-5],Sheet1!R2C1:R26C7,RC[-4]+13,FALSE)+HLOOKUP(RC[-5],Sheet1!R2C9:R26C15,RC[-4]+13,FALSE)*RC[1],0),ROUND(HLOOKUP(RC[-5],Sheet1!R2C1:R26C7,RC[-4]+13,FALSE),0)&IF(RC[1]=0,"","|"&ROUND(HLOOKUP(RC[-5],Sheet1!R2C9:R26C15,RC[-4]+13,FALSE)*RC[1],0))) -> 5|5 | G486: 5 | H486: 0
A487: 5 | B487: 7 | C487: 50 | D487: 0 | E487: =HLOOKUP(RC[-4],Sheet1!R2C1:R26C7,RC[-3]+1,FALSE)&IF(RC[2]=0,"",IF(HLOOKUP(RC[-4],Sheet1!R2C9:R26C15,RC[-3]+1,FALSE)="","","|"&HLOOKUP(RC[-4],Sheet1!R2C9:R26C15,RC[-3]+1,FALSE))) -> 42301|42201 | F487: =IF(HLOOKUP(RC[-5],Sheet1!R2C9:R26C15,RC[-4]+1,FALSE)="",ROUND(HLOOKUP(RC[-5],Sheet1!R2C1:R26C7,RC[-4]+13,FALSE)+HLOOKUP(RC[-5],Sheet1!R2C9:R26C15,RC[-4]+13,FALSE)*RC[1],0),ROUND(HLOOKUP(RC[-5],Sheet1!R2C1:R26C7,RC[-4]+13,FALSE),0)&IF(RC[1]=0,"","|"&ROUND(HLOOKUP(RC[-5],Sheet1!R2C9:R26C15,RC[-4]+13,FALSE)*RC[1],0))) -> 5|4 | G487: 4 | H487: 0
A488: 5 | B488: 7 | C488: 45 | D488: 0 | E488: =HLOOKUP(RC[-4],Sheet1!R2C1:R26C7,RC[-3]+1,FALSE)&IF(RC[2]=0,"",IF(HLOOKUP(RC[-4],Sheet1!R2C9:R26C15,RC[-3]+1,FALSE)="","","|"&HLOOKUP(RC[-4],Sheet1!R2C9:R26C15,RC[-3]+1,FALSE))) -> 42301|42201 | F488: =IF(HLOOKUP(RC[-5],Sheet1!R2C9:R26C15,RC[-4]+1,FALSE)="",ROUND(HLOOKUP(RC[-5],Sheet1!R2C1:R26C7,RC[-4]+13,FALSE)+HLOOKUP(RC[-5],Sheet1!R2C9:R26C15,RC[-4]+13,FALSE)*RC[1],0),ROUND(HLOOKUP(RC[-5],Sheet1!R2C1:R26C7,RC[-4]+13,FALSE),0)&IF(RC[1]=0,"","|"&ROUND(HLOOKUP(RC[-5],Sheet1!R2C9:R26C15,RC[-4]+13,FALSE)*RC[1],0))) -> 5|3 | G488: 3 | H488: 0
A489: 5 | B489: 7 | C489: 40 | D489: 0 | E489: =HLOOKUP(RC[-4],Sheet1!R2C1:R26C7,RC[-3]+1,FALSE)&IF(RC[2]=0,"",IF(HLOOKUP(RC[-4],Sheet1!R2C9:R26C15,RC[-3]+1,FALSE)="","","|"&HLOOKUP(RC[-4],Sheet1!R2C9:R26C15,RC[-3]+1,FALSE))) -> 42301|42201 | F489: =IF(HLOOKUP(RC[-5],Sheet1!R2C9:R26C15,RC[-4]+1,FALSE)="",ROUND(HLOOKUP(RC[-5],Sheet1!R2C1:R26C7,RC[-4]+13,FALSE)+HLOOKUP(RC[-5],Sheet1!R2C9:R26C15,RC[-4]+13,FALSE)*RC[1],0),ROUND(HLOOKUP(RC[-5],Sheet1!R2C1:R26C7,RC[-4]+13,FALSE),0)&IF(RC[1]=0,"","|"&ROUND(HLOOKUP(RC[-5],Sheet1!R2C9:R26C15,RC[-4]+13,FALSE)*RC[1],0))) -> 5|2 | G489: 2 | H489: 0
A490: 5 | B490: 7 | C490: 35 | D490: 0 | E490: =HLOOKUP(RC[-4],Sheet1!R2C1:R26C7,RC[-3]+1,FALSE)&IF(RC[2]=0,"",IF(HLOOKUP(RC[-4],Sheet1!R2C9:R26C15,RC[-3]+1,FALSE)="","","|"&HLOOKUP(RC[-4],Sheet1!R2C9:R26C15,RC[-3]+1,FALSE))) -> 42301|42201 | F490: =IF(HLOOKUP(RC[-5],Sheet1!R2C9:R26C15,RC[-4]+1,FALSE)="",ROUND(HLOOKUP(RC[-5],Sheet1!R2C1:R26C7,RC[-4]+13,FALSE)+HLOOKUP(RC[-5],Sheet1!R2C9:R26C15,RC[-4]+13,FALSE)*RC[1],0),ROUND(HLOOKUP(RC[-5],Sheet1!R2C1:R26C7,RC[-4]+13,FALSE),0)&IF(RC[1]=0,"","|"&ROUND(HLOOKUP(RC[-5],Sheet1!R2C9:R26C15,RC[-4]+13,FALSE)*RC[1],0))) -> 5|1 | G490: 1 | H490: 0
A491: 5 | B491: 7 | C491: 1 | D491: 0 | E491: =HLOOKUP(RC[-4],Sheet1!R2C1:R26C7,RC[-3]+1,FALSE)&IF(RC[2]=0,"",IF(HLOOKUP(RC[-4],Sheet1!R2C9:R26C15,RC[-3]+1,FALSE)="","","|"&HLOOKUP(RC[-4],Sheet1!R2C9:R26C15,RC[-3]+1,FALSE))) -> 42301 | F491: =IF(HLOOKUP(RC[-5],Sheet1!R2C9:R26C15,RC[-4]+1,FALSE)="",ROUND(HLOOKUP(RC[-5],Sheet1!R2C1:R26C7,RC[-4]+13,FALSE)+HLOOKUP(RC[-5],Sheet1!R2C9:R26C15,RC[-4]+13,FALSE)*RC[1],0),ROUND(HLOOKUP(RC[-5],Sheet1!R2C1:R26C7,RC[-4]+13,FALSE),0)&IF(RC[1]=0,"","|"&ROUND(HLOOKUP(RC[-5],Sheet1!R2C9:R26C15,RC[-4]+13,FALSE)*RC[1],0))) -> 5 | G491: 0 | H491: 1
A492: 5 | B492: =R[-11]C+1 -> 8 | C492: 80 | D492: 1 | E492: =HLOOKUP(RC[-4],Sheet1!R2C1:R26C7,RC[-3]+1,FALSE)&IF(RC[2]=0,"",IF(HLOOKUP(RC[-4],Sheet1!R2C9:R26C15,RC[-3]+1,FALSE)="","","|"&HLOOKUP(RC[-4],Sheet1!R2C9:R26C15,RC[-3]+1,FALSE))) -> 42301|42201 | F492: =IF(HLOOKUP(RC[-5],Sheet1!R2C9:R26C15,RC[-4]+1,FALSE)="",ROUND(HLOOKUP(RC[-5],Sheet1!R2C1:R26C7,RC[-4]+13,FALSE)+HLOOKUP(RC[-5],Sheet1!R2C9:R26C15,RC[-4]+13,FALSE)*RC[1],0),ROUND(HLOOKUP(RC[-5],Sheet1!R2C1:R26C7,RC[-4]+13,FALSE),0)&IF(RC[1]=0,"","|"&ROUND(HLOOKUP(RC[-5],Sheet1!R2C9:R26C15,RC[-4]+13,FALSE)*RC[1],0))) -> 6|10 | G492: 10 | H492: 0
A493: 5 | B493: =R[-11]C+1 -> 8 | C493: 75 | D493: 0 | E493: =HLOOKUP(RC[-4],Sheet1!R2C1:R26C7,RC[-3]+1,FALSE)&IF(RC[2]=0,"",IF(HLOOKUP(RC[-4],Sheet1!R2C9:R26C15,RC[-3]+1,FALSE)="","","|"&HLOOKUP(RC[-4],Sheet1!R2C9:R26C15,RC[-3]+1,FALSE))) -> 42301|42201 | F493: =IF(HLOOKUP(RC[-5],Sheet1!R2C9:R26C15,RC[-4]+1,FALSE)="",ROUND(HLOOKUP(RC[-5],Sheet1!R2C1:R26C7,RC[-4]+13,FALSE)+HLOOKUP(RC[-5],Sheet1!R2C9:R26C15,RC[-4]+13,FALSE)*RC[1],0),ROUND(HLOOKUP(RC[-5],Sheet1!R2C1:R26C7,RC[-4]+13,FALSE),0)&IF(RC[1]=0,"","|"&ROUND(HLOOKUP(RC[-5],Sheet1!R2C9:R26C15,RC[-4]+13,FALSE)*RC[1],0))) -> 6|9 | G493: 9 | H493: 0
A494: 5 | B494: =R[-11]C+1 -> 8 | C494: 70 | D494: 0 | E494: =HLOOKUP(RC[-4],Sheet1!R2C1:R26C7,RC[-3]+1,FALSE)&IF(RC[2]=0,"",IF(HLOOKUP(RC[-4],Sheet1!R2C9:R26C15,RC[-3]+1,FALSE)="","","|"&HLOOKUP(RC[-4],Sheet1!R2C9:R26C15,RC[-3]+1,FALSE))) -> 42301|42201 | F494: =IF(HLOOKUP(RC[-5],Sheet1!R2C9:R26C15,RC[-4]+1,FALSE)="",ROUND(HLOOKUP(RC[-5],Sheet1!R2C1:R26C7,RC[-4]+13,FALSE)+HLOOKUP(RC[-5],Sheet1!R2C9:R26C15,RC[-4]+13,FALSE)*RC[1],0),ROUND(HLOOKUP(RC[-5],Sheet1!R2C1:R26C7,RC[-4]+13,FALSE),0)&IF(RC[1]=0,"","|"&ROUND(HLOOKUP(RC[-5],Sheet1!R2C9:R26C15,RC[-4]+13,FALSE)*RC[1],0))) -> 6|8 | G494: 8 | H494: 0
A495: 5 | B495: =R[-11]C+1 -> 8 | C495: 65 | D495: 0 | E495: =HLOOKUP(RC[-4],Sheet1!R2C1:R26C7,RC[-3]+1,FALSE)&IF(RC[2]=0,"",IF(HLOOKUP(RC[-4],Sheet1!R2C9:R26C15,RC[-3]+1,FALSE)="","","|"&HLOOKUP(RC[-4],Sheet1!R2C9:R26C15,RC[-3]+1,FALSE))) -> 42301|42201 | F495: =IF(HLOOKUP(RC[-5],Sheet1!R2C9:R26C15,RC[-4]+1,FALSE)="",ROUND(HLOOKUP(RC[-5],Sheet1!R2C1:R26C7,RC[-4]+13,FALSE)+HLOOKUP(RC[-5],Sheet1!R2C9:R26C15,RC[-4]+13,FALSE)*RC[1],0),ROUND(HLOOKUP(RC[-5],Sheet1!R2C1:R26C7,RC[-4]+13,FALSE),0)&IF(RC[1]=0,"","|"&ROUND(HLOOKUP(RC[-5],Sheet1!R2C9:R26C15,RC[-4]+13,FALSE)*RC[1],0))) -> 6|7 | G495: 7 | H495: 0
A496: 5 | B496: =R[-11]C+1 -> 8 | C496: 60 | D496: 0 | E496: =HLOOKUP(RC[-4],Sheet1!R2C1:R26C7,RC[-3]+1,FALSE)&IF(RC[2]=0,"",IF(HLOOKUP(RC[-4],Sheet1!R2C9:R26C15,RC[-3]+1,FALSE)="","","|"&HLOOKUP(RC[-4],Sheet1!R2C9:R26C15,RC[-3]+1,FALSE))) -> 42301|42201 | F496: =IF(HLOOKUP(RC[-5],Sheet1!R2C9:R26C15,RC[-4]+1,FALSE)="",ROUND(HLOOKUP(RC[-5],Sheet1!R2C1:R26C7,RC[-4]+13,FALSE)+HLOOKUP(RC[-5],Sheet1!R2C9:R26C15,RC[-4]+13,FALSE)*RC[1],0),ROUND(HLOOKUP(RC[-5],Sheet1!R2C1:R26C7,RC[-4]+13,FALSE),0)&IF(RC[1]=0,"","|"&ROUND(HLOOKUP(RC[-5],Sheet1!R2C9:R26C15,RC[-4]+13,FALSE)*RC[1],0))) -> 6|6 | G496: 6 | H496: 0
A497: 5 | B497: =R[-11]C+1 -> 8 | C497: 55 | D497: 0 | E497: =HLOOKUP(RC[-4],Sheet1!R2C1:R26C7,RC[-3]+1,FALSE)&IF(RC[2]=0,"",IF(HLOOKUP(RC[-4],Sheet1!R2C9:R26C15,RC[-3]+1,FALSE)="","","|"&HLOOKUP(RC[-4],Sheet1!R2C9:R26C15,RC[-3]+1,FALSE))) -> 42301|42201 | F497: =IF(HLOOKUP(RC[-5],Sheet1!R2C9:R26C15,RC[-4]+1,FALSE)="",ROUND(HLOOKUP(RC[-5],Sheet1!R2C1:R26C7,RC[-4]+13,FALSE)+HLOOKUP(RC[-5],Sheet1!R2C9:R26C15,RC[-4]+13,FALSE)*RC[1],0),ROUND(HLOOKUP(RC[-5],Sheet1!R2C1:R26C7,RC[-4]+13,FALSE),0)&IF(RC[1]=0,"","|"&ROUND(HLOOKUP(RC[-5],Sheet1!R2C9:R26C15,RC[-4]+13,FALSE)*RC[1],0))) -> 6|5 | G497: 5 | H497: 0
A498: 5 | B498: =R[-11]C+1 -> 8 | C498: 50 | D498: 0 | E498: =HLOOKUP(RC[-4],Sheet1!R2C1:R26C7,RC[-3]+1,FALSE)&IF(RC[2]=0,"",IF(HLOOKUP(RC[-4],Sheet1!R2C9:R26C15,RC[-3]+1,FALSE)="","","|"&HLOOKUP(RC[-4],Sheet1!R2C9:R26C15,RC[-3]+1,FALSE))) -> 42301|42201 | F498: =IF(HLOOKUP(RC[-5],Sheet1!R2C9:R26C15,RC[-4]+1,FALSE)="",ROUND(HLOOKUP(RC[-5],Sheet1!R2C1:R26C7,RC[-4]+13,FALSE)+HLOOKUP(RC[-5],Sheet1!R2C9:R26C15,RC[-4]+13,FALSE)*RC[1],0),ROUND(HLOOKUP(RC[-5],Sheet1!R2C1:R26C7,RC[-4]+13,FALSE),0)&IF(RC[1]=0,"","|"&ROUND(HLOOKUP(RC[-5],Sheet1!R2C9:R26C15,RC[-4]+13,FALSE)*RC[1],0))) -> 6|4 | G498: 4 | H498: 0
A499: 5 | B499: =R[-11]C+1 -> 8 | C499: 45 | D499: 0 | E499: =HLOOKUP(RC[-4],Sheet1!R2C1:R26C7,RC[-3]+1,FALSE)&IF(RC[2]=0,"",IF(HLOOKUP(RC[-4],Sheet1!R2C9:R26C15,RC[-3]+1,FALSE)="","","|"&HLOOKUP(RC[-4],Sheet1!R2C9:R26C15,RC[-3]+1,FALSE))) -> 42301|42201 | F499: =IF(HLOOKUP(RC[-5],Sheet1!R2C9:R26C15,RC[-4]+1,FALSE)="",ROUND(HLOOKUP(RC[-5],Sheet1!R2C1:R26C7,RC[-4]+13,FALSE)+HLOOKUP(RC[-5],Sheet1!R2C9:R26C15,RC[-4]+13,FALSE)*RC[1],0),ROUND(HLOOKUP(RC[-5],Sheet1!R2C1:R26C7,RC[-4]+13,FALSE),0)&IF(RC[1]=0,"","|"&ROUND(HLOOKUP(RC[-5],Sheet1!R2C9:R26C15,RC[-4]+13,FALSE)*RC[1],0))) -> 6|3 | G499: 3 | H499: 0
A500: 5 | B500: =R[-11]C+1 -> 8 | C500: 40 | D500: 0 | E500: =HLOOKUP(RC[-4],Sheet1!R2C1:R26C7,RC[-3]+1,FALSE)&IF(RC[2]=0,"",IF(HLOOKUP(RC[-4],Sheet1!R2C9:R26C15,RC[-3]+1,FALSE)="","","|"&HLOOKUP(RC[-4],Sheet1!R2C9:R26C15,RC[-3]+1,FALSE))) -> 42301|42201 | F500: =IF(HLOOKUP(RC[-5],Sheet1!R2C9:R26C15,RC[-4]+1,FALSE)="",ROUND(HLOOKUP(RC[-5],Sheet1!R2C1:R26C7,RC[-4]+13,FALSE)+HLOOKUP(RC[-5],Sheet1!R2C9:R26C15,RC[-4]+13,FALSE)*RC[1],0),ROUND(HLOOKUP(RC[-5],Sheet1!R2C1:R26C7,RC[-4]+13,FALSE),0)&IF(RC[1]=0,"","|"&ROUND(HLOOKUP(RC[-5],Sheet1!R2C9:R26C15,RC[-4]+13,FALSE)*RC[1],0))) -> 6|2 | G500: 2 | H500: 0
A501: 5 | B501: =R[-11]C+1 -> 8 | C501: 35 | D501: 0 | E501: =HLOOKUP(RC[-4],Sheet1!R2C1:R26C7,RC[-3]+1,FALSE)&IF(RC[2]=0,"",IF(HLOOKUP(RC[-4],Sheet1!R2C9:R26C15,RC[-3]+1,FALSE)="","","|"&HLOOKUP(RC[-4],Sheet1!R2C9:R26C15,RC[-3]+1,FALSE))) -> 42301|42201 | F501: =IF(HLOOKUP(RC[-5],Sheet1!R2C9:R26C15,RC[-4]+1,FALSE)="",ROUND(HLOOKUP(RC[-5],Sheet1!R2C1:R26C7,RC[-4]+13,FALSE)+HLOOKUP(RC[-5],Sheet1!R2C9:R26C15,RC[-4]+13,FALSE)*RC[1],0),ROUND(HLOOKUP(RC[-5],Sheet1!R2C1:R26C7,RC[-4]+13,FALSE),0)&IF(RC[1]=0,"","|"&ROUND(HLOOKUP(RC[-5],Sheet1!R2C9:R26C15,RC[-4]+13,FALSE)*RC[1],0))) -> 6|1 | G501: 1 | H501: 0
A502: 5 | B502: =R[-11]C+1 -> 8 | C502: 1 | D502: 0 | E502: =HLOOKUP(RC[-4],Sheet1!R2C1:R26C7,RC[-3]+1,FALSE)&IF(RC[2]=0,"",IF(HLOOKUP(RC[-4],Sheet1!R2C9:R26C15,RC[-3]+1,FALSE)="","","|"&HLOOKUP(RC[-4],Sheet1!R2C9:R26C15,RC[-3]+1,FALSE))) -> 42301 | F502: =IF(HLOOKUP(RC[-5],Sheet1!R2C9:R26C15,RC[-4]+1,FALSE)="",ROUND(HLOOKUP(RC[-5],Sheet1!R2C1:R26C7,RC[-4]+13,FALSE)+HLOOKUP(RC[-5],Sheet1!R2C9:R26C15,RC[-4]+13,FALSE)*RC[1],0),ROUND(HLOOKUP(RC[-5],Sheet1!R2C1:R26C7,RC[-4]+13,FALSE),0)&IF(RC[1]=0,"","|"&ROUND(HLOOKUP(RC[-5],Sheet1!R2C9:R26C15,RC[-4]+13,FALSE)*RC[1],0))) -> 6 | G502: 0 | H502: 1
A503: 5 | B503: =R[-11]C+1 -> 9 | C503: 80 | D503: 1 | E503: =HLOOKUP(RC[-4],Sheet1!R2C1:R26C7,RC[-3]+1,FALSE)&IF(RC[2]=0,"",IF(HLOOKUP(RC[-4],Sheet1!R2C9:R26C15,RC[-3]+1,FALSE)="","","|"&HLOOKUP(RC[-4],Sheet1!R2C9:R26C15,RC[-3]+1,FALSE))) -> 42301|42201 | F503: =IF(HLOOKUP(RC[-5],Sheet1!R2C9:R26C15,RC[-4]+1,FALSE)="",ROUND(HLOOKUP(RC[-5],Sheet1!R2C1:R26C7,RC[-4]+13,FALSE)+HLOOKUP(RC[-5],Sheet1!R2C9:R26C15,RC[-4]+13,FALSE)*RC[1],0),ROUND(HLOOKUP(RC[-5],Sheet1!R2C1:R26C7,RC[-4]+13,FALSE),0)&IF(RC[1]=0,"","|"&ROUND(HLOOKUP(RC[-5],Sheet1!R2C9:R26C15,RC[-4]+13,FALSE)*RC[1],0))) -> 8|10 | G503: 10 | H503: 0
A504: 5 | B504: =R[-11]C+1 -> 9 | C504: 75 | D504: 0 | E504: =HLOOKUP(RC[-4],Sheet1!R2C1:R26C7,RC[-3]+1,FALSE)&IF(RC[2]=0,"",IF(HLOOKUP(RC[-4],Sheet1!R2C9:R26C15,RC[-3]+1,FALSE)="","","|"&HLOOKUP(RC[-4],Sheet1!R2C9:R26C15,RC[-3]+1,FALSE))) -> 42301|42201 | F504: =IF(HLOOKUP(RC[-5],Sheet1!R2C9:R26C15,RC[-4]+1,FALSE)="",ROUND(HLOOKUP(RC[-5],Sheet1!R2C1:R26C7,RC[-4]+13,FALSE)+HLOOKUP(RC[-5],Sheet1!R2C9:R26C15,RC[-4]+13,FALSE)*RC[1],0),ROUND(HLOOKUP(RC[-5],Sheet1!R2C1:R26C7,RC[-4]+13,FALSE),0)&IF(RC[1]=0,"","|"&ROUND(HLOOKUP(RC[-5],Sheet1!R2C9:R26C15,RC[-4]+13,FALSE)*RC[1],0))) -> 8|9 | G504: 9 | H504: 0
A505: 5 | B505: =R[-11]C+1 -> 9 | C505: 70 | D505: 0 | E505: =HLOOKUP(RC[-4],Sheet1!R2C1:R26C7,RC[-3]+1,FALSE)&IF(RC[2]=0,"",IF(HLOOKUP(RC[-4],Sheet1!R2C9:R26C15,RC[-3]+1,FALSE)="","","|"&HLOOKUP(RC[-4],Sheet1!R2C9:R26C15,RC[-3]+1,FALSE))) -> 42301|42201 | F505: =IF(HLOOKUP(RC[-5],Sheet1!R2C9:R26C15,RC[-4]+1,FALSE)="",ROUND(HLOOKUP(RC[-5],Sheet1!R2C1:R26C7,RC[-4]+13,FALSE)+HLOOKUP(RC[-5],Sheet1!R2C9:R26C15,RC[-4]+13,FALSE)*RC[1],0),ROUND(HLOOKUP(RC[-5],Sheet1!R2C1:R26C7,RC[-4]+13,FALSE),0)&IF(RC[1]=0,"","|"&ROUND(HLOOKUP(RC[-5],Sheet1!R2C9:R26C15,RC[-4]+13,FALSE)*RC[1],0))) -> 8|8 | G505: 8 | H505: 0
A506: 5 | B506: =R[-11]C+1 -> 9 | C506: 65 | D506: 0 | E506: =HLOOKUP(RC[-4],Sheet1!R2C1:R26C7,RC[-3]+1,FALSE)&IF(RC[2]=0,"",IF(HLOOKUP(RC[-4],Sheet1!R2C9:R26C15,RC[-3]+1,FALSE)="","","|"&HLOOKUP(RC[-4],Sheet1!R2C9:R26C15,RC[-3]+1,FALSE))) -> 42301|42201 | F506: =IF(HLOOKUP(RC[-5],Sheet1!R2C9:R26C15,RC[-4]+1,FALSE)="",ROUND(HLOOKUP(RC[-5],Sheet1!R2C1:R26C7,RC[-4]+13,FALSE)+HLOOKUP(RC[-5],Sheet1!R2C9:R26C15,RC[-4]+13,FALSE)*RC[1],0),ROUND(HLOOKUP(RC[-5],Sheet1!R2C1:R26C7,RC[-4]+13,FALSE),0)&IF(RC[1]=0,"","|"&ROUND(HLOOKUP(RC[-5],Sheet1!R2C9:R26C15,RC[-4]+13,FALSE)*RC[1],0))) -> 8|7 | G506: 7 | H506: 0
A507: 5 | B507: =R[-11]C+1 -> 9 | C507: 60 | D507: 0 | E507: =HLOOKUP(RC[-4],Sheet1!R2C1:R26C7,RC[-3]+1,FALSE)&IF(RC[2]=0,"",IF(HLOOKUP(RC[-4],Sheet1!R2C9:R26C15,RC[-3]+1,FALSE)="","","|"&HLOOKUP(RC[-4],Sheet1!R2C9:R26C15,RC[-3]+1,FALSE))) -> 42301|42201 | F507: =IF(HLOOKUP(RC[-5],Sheet1!R2C9:R26C15,RC[-4]+1,FALSE)="",ROUND(HLOOKUP(RC[-5],Sheet1!R2C1:R26C7,RC[-4]+13,FALSE)+HLOOKUP(RC[-5],Sheet1!R2C9:R26C15,RC[-4]+13,FALSE)*RC[1],0),ROUND(HLOOKUP(RC[-5],Sheet1!R2C1:R26C7,RC[-4]+13,FALSE),0)&IF(RC[1]=0,"","|"&ROUND(HLOOKUP(RC[-5],Sheet1!R2C9:R26C15,RC[-4]+13,FALSE)*RC[1],0))) -> 8|6 | G507: 6 | H507: 0
A508: 5 | B508: =R[-11]C+1 -> 9 | C508: 55 | D508: 0 | E508: =HLOOKUP(RC[-4],Sheet1!R2C1:R26C7,RC[-3]+1,FALSE)&IF(RC[2]=0,"",IF(HLOOKUP(RC[-4],Sheet1!R2C9:R26C15,RC[-3]+1,FALSE)="","","|"&HLOOKUP(RC[-4],Sheet1!R2C9:R26C15,RC[-3]+1,FALSE))) -> 42301|42201 | F508: =IF(HLOOKUP(RC[-5],Sheet1!R2C9:R26C15,RC[-4]+1,FALSE)="",ROUND(HLOOKUP(RC[-5],Sheet1!R2C1:R26C7,RC[-4]+13,FALSE)+HLOOKUP(RC[-5],Sheet1!R2C9:R26C15,RC[-4]+13,FALSE)*RC[1],0),ROUND(HLOOKUP(RC[-5],Sheet1!R2C1:R26C7,RC[-4]+13,FALSE),0)&IF(RC[1]=0,"","|"&ROUND(HLOOKUP(RC[-5],Sheet1!R2C9:R26C15,RC[-4]+13,FALSE)*RC[1],0))) -> 8|5 | G508: 5 | H508: 0
A509: 5 | B509: =R[-11]C+1 -> 9 | C509: 50 | D509: 0 | E509: =HLOOKUP(RC[-4],Sheet1!R2C1:R26C7,RC[-3]+1,FALSE)&IF(RC[2]=0,"",IF(HLOOKUP(RC[-4],Sheet1!R2C9:R26C15,RC[-3]+1,FALSE)="","","|"&HLOOKUP(RC[-4],Sheet1!R2C9:R26C15,RC[-3]+1,FALSE))) -> 42301|42201 | F509: =IF(HLOOKUP(RC[-5],Sheet1!R2C9:R26C15,RC[-4]+1,FALSE)="",ROUND(HLOOKUP(RC[-5],Sheet1!R2C1:R26C7,RC[-4]+13,FALSE)+HLOOKUP(RC[-5],Sheet1!R2C9:R26C15,RC[-4]+13,FALSE)*RC[1],0),ROUND(HLOOKUP(RC[-5],Sheet1!R2C1:R26C7,RC[-4]+13,FALSE),0)&IF(RC[1]=0,"","|"&ROUND(HLOOKUP(RC[-5],Sheet1!R2C9:R26C15,RC[-4]+13,FALSE)*RC[1],0))) -> 8|4 | G509: 4 | H509: 0
A510: 5 | B510: =R[-11]C+1 -> 9 | C510: 45 | D510: 0 | E510: =HLOOKUP(RC[-4],Sheet1!R2C1:R26C7,RC[-3]+1,FALSE)&IF(RC[2]=0,"",IF(HLOOKUP(RC[-4],Sheet1!R2C9:R26C15,RC[-3]+1,FALSE)="","","|"&HLOOKUP(RC[-4],Sheet1!R2C9:R26C15,RC[-3]+1,FALSE))) -> 42301|42201 | F510: =IF(HLOOKUP(RC[-5],Sheet1!R2C9:R26C15,RC[-4]+1,FALSE)="",ROUND(HLOOKUP(RC[-5],Sheet1!R2C1:R26C7,RC[-4]+13,FALSE)+HLOOKUP(RC[-5],Sheet1!R2C9:R26C15,RC[-4]+13,FALSE)*RC[1],0),ROUND(HLOOKUP(RC[-5],Sheet1!R2C1:R26C7,RC[-4]+13,FALSE),0)&IF(RC[1]=0,"","|"&ROUND(HLOOKUP(RC[-5],Sheet1!R2C9:R26C15,RC[-4]+13,FALSE)*RC[1],0))) -> 8|3 | G510: 3 | H510: 0
A511: 5 | B511: =R[-11]C+1 -> 9 | C511: 40 | D511: 0 | E511: =HLOOKUP(RC[-4],Sheet1!R2C1:R26C7,RC[-3]+1,FALSE)&IF(RC[2]=0,"",IF(HLOOKUP(RC[-4],Sheet1!R2C9:R26C15,RC[-3]+1,FALSE)="","","|"&HLOOKUP(RC[-4],Sheet1!R2C9:R26C15,RC[-3]+1,FALSE))) -> 42301|42201 | F511: =IF(HLOOKUP(RC[-5],Sheet1!R2C9:R26C15,RC[-4]+1,FALSE)="",ROUND(HLOOKUP(RC[-5],Sheet1!R2C1:R26C7,RC[-4]+13,FALSE)+HLOOKUP(RC[-5],Sheet1!R2C9:R26C15,RC[-4]+13,FALSE)*RC[1],0),ROUND(HLOOKUP(RC[-5],Sheet1!R2C1:R26C7,RC[-4]+13,FALSE),0)&IF(RC[1]=0,"","|"&ROUND(HLOOKUP(RC[-5],Sheet1!R2C9:R26C15,RC[-4]+13,FALSE)*RC[1],0))) -> 8|2 | G511: 2 | H511: 0
A512: 5 | B512: =R[-11]C+1 -> 9 | C512: 35 | D512: 0 | E512: =HLOOKUP(RC[-4],Sheet1!R2C1:R26C7,RC[-3]+1,FALSE)&IF(RC[2]=0,"",IF(HLOOKUP(RC[-4],Sheet1!R2C9:R26C15,RC[-3]+1,FALSE)="","","|"&HLOOKUP(RC[-4],Sheet1!R2C9:R26C15,RC[-3]+1,FALSE))) -> 42301|42201 | F512: =IF(HLOOKUP(RC[-5],Sheet1!R2C9:R26C15,RC[-4]+1,FALSE)="",ROUND(HLOOKUP(RC[-5],Sheet1!R2C1:R26C7,RC[-4]+13,FALSE)+HLOOKUP(RC[-5],Sheet1!R2C9:R26C15,RC[-4]+13,FALSE)*RC[1],0),ROUND(HLOOKUP(RC[-5],Sheet1!R2C1:R26C7,RC[-4]+13,FALSE),0)&IF(RC[1]=0,"","|"&ROUND(HLOOKUP(RC[-5],Sheet1!R2C9:R26C15,RC[-4]+13,FALSE)*RC[1],0))) -> 8|1 | G512: 1 | H512: 0
A513: 5 | B513: =R[-11]C+1 -> 9 | C513: 1 | D513: 0 | E513: =HLOOKUP(RC[-4],Sheet1!R2C1:R26C7,RC[-3]+1,FALSE)&IF(RC[2]=0,"",IF(HLOOKUP(RC[-4],Sheet1!R2C9:R26C15,RC[-3]+1,FALSE)="","","|"&HLOOKUP(RC[-4],Sheet1!R2C9:R26C15,RC[-3]+1,FALSE))) -> 42301 | F513: =IF(HLOOKUP(RC[-5],Sheet1!R2C9:R26C15,RC[-4]+1,FALSE)="",ROUND(HLOOKUP(RC[-5],Sheet1!R2C1:R26C7,RC[-4]+13,FALSE)+HLOOKUP(RC[-5],Sheet1!R2C9:R26C15,RC[-4]+13,FALSE)*RC[1],0),ROUND(HLOOKUP(RC[-5],Sheet1!R2C1:R26C7,RC[-4]+13,FALSE),0)&IF(RC[1]=0,"","|"&ROUND(HLOOKUP(RC[-5],Sheet1!R2C9:R26C15,RC[-4]+13,FALSE)*RC[1],0))) -> 8 | G513: 0 | H513: 1
A514: 5 | B514: =R[-11]C+1 -> 10 | C514: 80 | D514: 1 | E514: =HLOOKUP(RC[-4],Sheet1!R2C1:R26C7,RC[-3]+1,FALSE)&IF(RC[2]=0,"",IF(HLOOKUP(RC[-4],Sheet1!R2C9:R26C15,RC[-3]+1,FALSE)="","","|"&HLOOKUP(RC[-4],Sheet1!R2C9:R26C15,RC[-3]+1,FALSE))) -> 42301|42201 | F514: =IF(HLOOKUP(RC[-5],Sheet1!R2C9:R26C15,RC[-4]+1,FALSE)="",ROUND(HLOOKUP(RC[-5],Sheet1!R2C1:R26C7,RC[-4]+13,FALSE)+HLOOKUP(RC[-5],Sheet1!R2C9:R26C15,RC[-4]+13,FALSE)*RC[1],0),ROUND(HLOOKUP(RC[-5],Sheet1!R2C1:R26C7,RC[-4]+13,FALSE),0)&IF(RC[1]=0,"","|"&ROUND(HLOOKUP(RC[-5],Sheet1!R2C9:R26C15,RC[-4]+13,FALSE)*RC[1],0))) -> 10|10 | G514: 10 | H514: 0
A515: 5 | B515: =R[-11]C+1 -> 10 | C515: 75 | D515: 0 | E515: =HLOOKUP(RC[-4],Sheet1!R2C1:R26C7,RC[-3]+1,FALSE)&IF(RC[2]=0,"",IF(HLOOKUP(RC[-4],Sheet1!R2C9:R26C15,RC[-3]+1,FALSE)="","","|"&HLOOKUP(RC[-4],Sheet1!R2C9:R26C15,RC[-3]+1,FALSE))) -> 42301|42201 | F515: =IF(HLOOKUP(RC[-5],Sheet1!R2C9:R26C15,RC[-4]+1,FALSE)="",ROUND(HLOOKUP(RC[-5],Sheet1!R2C1:R26C7,RC[-4]+13,FALSE)+HLOOKUP(RC[-5],Sheet1!R2C9:R26C15,RC[-4]+13,FALSE)*RC[1],0),ROUND(HLOOKUP(RC[-5],Sheet1!R2C1:R26C7,RC[-4]+13,FALSE),0)&IF(RC[1]=0,"","|"&ROUND(HLOOKUP(RC[-5],Sheet1!R2C9:R26C15,RC[-4]+13,FALSE)*RC[1],0))) -> 10|9 | G515: 9 | H515: 0
A516: 5 | B516: =R[-11]C+1 -> 10 | C516: 70 | D516: 0 | E516: =HLOOKUP(RC[-4],Sheet1!R2C1:R26C7,RC[-3]+1,FALSE)&IF(RC[2]=0,"",IF(HLOOKUP(RC[-4],Sheet1!R2C9:R26C15,RC[-3]+1,FALSE)="","","|"&HLOOKUP(RC[-4],Sheet1!R2C9:R26C15,RC[-3]+1,FALSE))) -> 42301|42201 | F516: =IF(HLOOKUP(RC[-5],Sheet1!R2C9:R26C15,RC[-4]+1,FALSE)="",ROUND(HLOOKUP(RC[-5],Sheet1!R2C1:R26C7,RC[-4]+13,FALSE)+HLOOKUP(RC[-5],Sheet1!R2C9:R26C15,RC[-4]+13,FALSE)*RC[1],0),ROUND(HLOOKUP(RC[-5],Sheet1!R2C1:R26C7,RC[-4]+13,FALSE),0)&IF(RC[1]=0,"","|"&ROUND(HLOOKUP(RC[-5],Sheet1!R2C9:R26C15,RC[-4]+13,FALSE)*RC[1],0))) -> 10|8 | G516: 8 | H516: 0
A517: 5 | B517: =R[-11]C+1 -> 10 | C517: 65 | D517: 0 | E517: =HLOOKUP(RC[-4],Sheet1!R2C1:R26C7,RC[-3]+1,FALSE)&IF(RC[2]=0,"",IF(HLOOKUP(RC[-4],Sheet1!R2C9:R26C15,RC[-3]+1,FALSE)="","","|"&HLOOKUP(RC[-4],Sheet1!R2C9:R26C15,RC[-3]+1,FALSE))) -> 42301|42201 | F517: =IF(HLOOKUP(RC[-5],Sheet1!R2C9:R26C15,RC[-4]+1,FALSE)="",ROUND(HLOOKUP(RC[-5],Sheet1!R2C1:R26C7,RC[-4]+13,FALSE)+HLOOKUP(RC[-5],Sheet1!R2C9:R26C15,RC[-4]+13,FALSE)*RC[1],0),ROUND(HLOOKUP(RC[-5],Sheet1!R2C1:R26C7,RC[-4]+13,FALSE),0)&IF(RC[1]=0,"","|"&ROUND(HLOOKUP(RC[-5],Sheet1!R2C9:R26C15,RC[-4]+13,FALSE)*RC[1],0))) -> 10|7 | G517: 7 | H517: 0
A518: 5 | B518: =R[-11]C+1 -> 10 | C518: 60 | D518: 0 | E518: =HLOOKUP(RC[-4],Sheet1!R2C1:R26C7,RC[-3]+1,FALSE)&IF(RC[2]=0,"",IF(HLOOKUP(RC[-4],Sheet1!R2C9:R26C15,RC[-3]+1,FALSE)="","","|"&HLOOKUP(RC[-4],Sheet1!R2C9:R26C15,RC[-3]+1,FALSE))) -> 42301|42201 | F518: =IF(HLOOKUP(RC[-5],Sheet1!R2C9:R26C15,RC[-4]+1,FALSE)="",ROUND(HLOOKUP(RC[-5],Sheet1!R2C1:R26C7,RC[-4]+13,FALSE)+HLOOKUP(RC[-5],Sheet1!R2C9:R26C15,RC[-4]+13,FALSE)*RC[1],0),ROUND(HLOOKUP(RC[-5],Sheet1!R2C1:R26C7,RC[-4]+13,FALSE),0)&IF(RC[1]=0,"","|"&ROUND(HLOOKUP(RC[-5],Sheet1!R2C9:R26C15,RC[-4]+13,FALSE)*RC[1],0))) -> 10|6 | G518: 6 | H518: 0
A519: 5 | B519: =R[-11]C+1 -> 10 | C519: 55 | D519: 0 | E519: =HLOOKUP(RC[-4],Sheet1!R2C1:R26C7,RC[-3]+1,FALSE)&IF(RC[2]=0,"",IF(HLOOKUP(RC[-4],Sheet1!R2C9:R26C15,RC[-3]+1,FALSE)="","","|"&HLOOKUP(RC[-4],Sheet1!R2C9:R26C15,RC[-3]+1,FALSE))) -> 42301|42201 | F519: =IF(HLOOKUP(RC[-5],Sheet1!R2C9:R26C15,RC[-4]+1,FALSE)="",ROUND(HLOOKUP(RC[-5],Sheet1!R2C1:R26C7,RC[-4]+13,FALSE)+HLOOKUP(RC[-5],Sheet1!R2C9:R26C15,RC[-4]+13,FALSE)*RC[1],0),ROUND(HLOOKUP(RC[-5],Sheet1!R2C1:R26C7,RC[-4]+13,FALSE),0)&IF(RC[1]=0,"","|"&ROUND(HLOOKUP(RC[-5],Sheet1!R2C9:R26C15,RC[-4]+13,FALSE)*RC[1],0))) -> 10|5 | G519: 5 | H519: 0
A520: 5 | B520: =R[-11]C+1 -> 10 | C520: 50 | D520: 0 | E520: =HLOOKUP(RC[-4],Sheet1!R2C1:R26C7,RC[-3]+1,FALSE)&IF(RC[2]=0,"",IF(HLOOKUP(RC[-4],Sheet1!R2C9:R26C15,RC[-3]+1,FALSE)="","","|"&HLOOKUP(RC[-4],Sheet1!R2C9:R26C15,RC[-3]+1,FALSE))) -> 42301|42201 | F520: =IF(HLOOKUP(RC[-5],Sheet1!R2C9:R26C15,RC[-4]+1,FALSE)="",ROUND(HLOOKUP(RC[-5],Sheet1!R2C1:R26C7,RC[-4]+13,FALSE)+HLOOKUP(RC[-5],Sheet1!R2C9:R26C15,RC[-4]+13,FALSE)*RC[1],0),ROUND(HLOOKUP(RC[-5],Sheet1!R2C1:R26C7,RC[-4]+13,FALSE),0)&IF(RC[1]=0,"","|"&ROUND(HLOOKUP(RC[-5],Sheet1!R2C9:R26C15,RC[-4]+13,FALSE)*RC[1],0))) -> 10|4 | G520: 4 | H520: 0
A521: 5 | B521: =R[-11]C+1 -> 10 | C521: 45 | D521: 0 | E521: =HLOOKUP(RC[-4],Sheet1!R2C1:R26C7,RC[-3]+1,FALSE)&IF(RC[2]=0,"",IF(HLOOKUP(RC[-4],Sheet1!R2C9:R26C15,RC[-3]+1,FALSE)="","","|"&HLOOKUP(RC[-4],Sheet1!R2C9:R26C15,RC[-3]+1,FALSE))) -> 42301|42201 | F521: =IF(HLOOKUP(RC[-5],Sheet1!R2C9:R26C15,RC[-4]+1,FALSE)="",ROUND(HLOOKUP(RC[-5],Sheet1!R2C1:R26C7,RC[-4]+13,FALSE)+HLOOKUP(RC[-5],Sheet1!R2C9:R26C15,RC[-4]+13,FALSE)*RC[1],0),ROUND(HLOOKUP(RC[-5],Sheet1!R2C1:R26C7,RC[-4]+13,FALSE),0)&IF(RC[1]=0,"","|"&ROUND(HLOOKUP(RC[-5],Sheet1!R2C9:R26C15,RC[-4]+13,FALSE)*RC[1],0))) -> 10|3 | G521: 3 | H521: 0
A522: 5 | B522: =R[-11]C+1 -> 10 | C522: 40 | D522: 0 | E522: =HLOOKUP(RC[-4],Sheet1!R2C1:R26C7,RC[-3]+1,FALSE)&IF(RC[2]=0,"",IF(HLOOKUP(RC[-4],Sheet1!R2C9:R26C15,RC[-3]+1,FALSE)="","","|"&HLOOKUP(RC[-4],Sheet1!R2C9:R26C15,RC[-3]+1,FALSE))) -> 42301|42201 | F522: =IF(HLOOKUP(RC[-5],Sheet1!R2C9:R26C15,RC[-4]+1,FALSE)="",ROUND(HLOOKUP(RC[-5],Sheet1!R2C1:R26C7,RC[-4]+13,FALSE)+HLOOKUP(RC[-5],Sheet1!R2C9:R26C15,RC[-4]+13,FALSE)*RC[1],0),ROUND(HLOOKUP(RC[-5],Sheet1!R2C1:R26C7,RC[-4]+13,FALSE),0)&IF(RC[1]=0,"","|"&ROUND(HLOOKUP(RC[-5],Sheet1!R2C9:R26C15,RC[-4]+13,FALSE)*RC[1],0))) -> 10|2 | G522: 2 | H522: 0
A523: 5 | B523: =R[-11]C+1 -> 10 | C523: 35 | D523: 0 | E523: =HLOOKUP(RC[-4],Sheet1!R2C1:R26C7,RC[-3]+1,FALSE)&IF(RC[2]=0,"",IF(HLOOKUP(RC[-4],Sheet1!R2C9:R26C15,RC[-3]+1,FALSE)="","","|"&HLOOKUP(RC[-4],Sheet1!R2C9:R26C15,RC[-3]+1,FALSE))) -> 42301|42201 | F523: =IF(HLOOKUP(RC[-5],Sheet1!R2C9:R26C15,RC[-4]+1,FALSE)="",ROUND(HLOOKUP(RC[-5],Sheet1!R2C1:R26C7,RC[-4]+13,FALSE)+HLOOKUP(RC[-5],Sheet1!R2C9:R26C15,RC[-4]+13,FALSE)*RC[1],0),ROUND(HLOOKUP(RC[-5],Sheet1!R2C1:R26C7,RC[-4]+13,FALSE),0)&IF(RC[1]=0,"","|"&ROUND(HLOOKUP(RC[-5],Sheet1!R2C9:R26C15,RC[-4]+13,FALSE)*RC[1],0))) -> 10|1 | G523: 1 | H523: 0
A524: 5 | B524: =R[-11]C+1 -> 10 | C524: 1 | D524: 0 | E524: =HLOOKUP(RC[-4],Sheet1!R2C1:R26C7,RC[-3]+1,FALSE)&IF(RC[2]=0,"",IF(HLOOKUP(RC[-4],Sheet1!R2C9:R26C15,RC[-3]+1,FALSE)="","","|"&HLOOKUP(RC[-4],Sheet1!R2C9:R26C15,RC[-3]+1,FALSE))) -> 42301 | F524: =IF(HLOOKUP(RC[-5],Sheet1!R2C9:R26C15,RC[-4]+1,FALSE)="",ROUND(HLOOKUP(RC[-5],Sheet1!R2C1:R26C7,RC[-4]+13,FALSE)+HLOOKUP(RC[-5],Sheet1!R2C9:R26C15,RC[-4]+13,FALSE)*RC[1],0),ROUND(HLOOKUP(RC[-5],Sheet1!R2C1:R26C7,RC[-4]+13,FALSE),0)&IF(RC[1]=0,"","|"&ROUND(HLOOKUP(RC[-5],Sheet1!R2C9:R26C15,RC[-4]+13,FALSE)*RC[1],0))) -> 10 | G524: 0 | H524: 1
A525: 5 | B525: =R[-11]C+1 -> 11 | C525: 80 | D525: 1 | E525: =HLOOKUP(RC[-4],Sheet1!R2C1:R26C7,RC[-3]+1,FALSE)&IF(RC[2]=0,"",IF(HLOOKUP(RC[-4],Sheet1!R2C9:R26C15,RC[-3]+1,FALSE)="","","|"&HLOOKUP(RC[-4],Sheet1!R2C9:R26C15,RC[-3]+1,FALSE))) -> 42301|42201 | F525: =IF(HLOOKUP(RC[-5],Sheet1!R2C9:R26C15,RC[-4]+1,FALSE)="",ROUND(HLOOKUP(RC[-5],Sheet1!R2C1:R26C7,RC[-4]+13,FALSE)+HLOOKUP(RC[-5],Sheet1!R2C9:R26C15,RC[-4]+13,FALSE)*RC[1],0),ROUND(HLOOKUP(RC[-5],Sheet1!R2C1:R26C7,RC[-4]+13,FALSE),0)&IF(RC[1]=0,"","|"&ROUND(HLOOKUP(RC[-5],Sheet1!R2C9:R26C15,RC[-4]+13,FALSE)*RC[1],0))) -> 12|10 | G525: 10 | H525: 0
A526: 5 | B526: =R[-11]C+1 -> 11 | C526: 75 | D526: 0 | E526: =HLOOKUP(RC[-4],Sheet1!R2C1:R26C7,RC[-3]+1,FALSE)&IF(RC[2]=0,"",IF(HLOOKUP(RC[-4],Sheet1!R2C9:R26C15,RC[-3]+1,FALSE)="","","|"&HLOOKUP(RC[-4],Sheet1!R2C9:R26C15,RC[-3]+1,FALSE))) -> 42301|42201 | F526: =IF(HLOOKUP(RC[-5],Sheet1!R2C9:R26C15,RC[-4]+1,FALSE)="",ROUND(HLOOKUP(RC[-5],Sheet1!R2C1:R26C7,RC[-4]+13,FALSE)+HLOOKUP(RC[-5],Sheet1!R2C9:R26C15,RC[-4]+13,FALSE)*RC[1],0),ROUND(HLOOKUP(RC[-5],Sheet1!R2C1:R26C7,RC[-4]+13,FALSE),0)&IF(RC[1]=0,"","|"&ROUND(HLOOKUP(RC[-5],Sheet1!R2C9:R26C15,RC[-4]+13,FALSE)*RC[1],0))) -> 12|9 | G526: 9 | H526: 0
A527: 5 | B527: =R[-11]C+1 -> 11 | C527: 70 | D527: 0 | E527: =HLOOKUP(RC[-4],Sheet1!R2C1:R26C7,RC[-3]+1,FALSE)&IF(RC[2]=0,"",IF(HLOOKUP(RC[-4],Sheet1!R2C9:R26C15,RC[-3]+1,FALSE)="","","|"&HLOOKUP(RC[-4],Sheet1!R2C9:R26C15,RC[-3]+1,FALSE))) -> 42301|42201 | F527: =IF(HLOOKUP(RC[-5],Sheet1!R2C9:R26C15,RC[-4]+1,FALSE)="",ROUND(HLOOKUP(RC[-5],Sheet1!R2C1:R26C7,RC[-4]+13,FALSE)+HLOOKUP(RC[-5],Sheet1!R2C9:R26C15,RC[-4]+13,FALSE)*RC[1],0),ROUND(HLOOKUP(RC[-5],Sheet1!R2C1:R26C7,RC[-4]+13,FALSE),0)&IF(RC[1]=0,"","|"&ROUND(HLOOKUP(RC[-5],Sheet1!R2C9:R26C15,RC[-4]+13,FALSE)*RC[1],0))) -> 12|8 | G527: 8 | H527: 0
A528: 5 | B528: =R[-11]C+1 -> 11 | C528: 65 | D528: 0 | E528: =HLOOKUP(RC[-4],Sheet1!R2C1:R26C7,RC[-3]+1,FALSE)&IF(RC[2]=0,"",IF(HLOOKUP(RC[-4],Sheet1!R2C9:R26C15,RC[-3]+1,FALSE)="","","|"&HLOOKUP(RC[-4],Sheet1!R2C9:R26C15,RC[-3]+1,FALSE))) -> 42301|42201 | F528: =IF(HLOOKUP(RC[-5],Sheet1!R2C9:R26C15,RC[-4]+1,FALSE)="",ROUND(HLOOKUP(RC[-5],Sheet1!R2C1:R26C7,RC[-4]+13,FALSE)+HLOOKUP(RC[-5],Sheet1!R2C9:R26C15,RC[-4]+13,FALSE)*RC[1],0),ROUND(HLOOKUP(RC[-5],Sheet1!R2C1:R26C7,RC[-4]+13,FALSE),0)&IF(RC[1]=0,"","|"&ROUND(HLOOKUP(RC[-5],Sheet1!R2C9:R26C15,RC[-4]+13,FALSE)*RC[1],0))) -> 12|7 | G528: 7 | H528: 0
A529: 5 | B529: =R[-11]C+1 -> 11 | C529: 60 | D529: 0 | E529: =HLOOKUP(RC[-4],Sheet1!R2C1:R26C7,RC[-3]+1,FALSE)&IF(RC[2]=0,"",IF(HLOOKUP(RC[-4],Sheet1!R2C9:R26C15,RC[-3]+1,FALSE)="","","|"&HLOOKUP(RC[-4],Sheet1!R2C9:R26C15,RC[-3]+1,FALSE))) -> 42301|42201 | F529: =IF(HLOOKUP(RC[-5],Sheet1!R2C9:R26C15,RC[-4]+1,FALSE)="",ROUND(HLOOKUP(RC[-5],Sheet1!R2C1:R26C7,RC[-4]+13,FALSE)+HLOOKUP(RC[-5],Sheet1!R2C9:R26C15,RC[-4]+13,FALSE)*RC[1],0),ROUND(HLOOKUP(RC[-5],Sheet1!R2C1:R26C7,RC[-4]+13,FALSE),0)&IF(RC[1]=0,"","|"&ROUND(HLOOKUP(RC[-5],Sheet1!R2C9:R26C15,RC[-4]+13,FALSE)*RC[1],0))) -> 12|6 | G529: 6 | H529: 0
A530: 5 | B530: =R[-11]C+1 -> 11 | C530: 55 | D530: 0 | E530: =HLOOKUP(RC[-4],Sheet1!R2C1:R26C7,RC[-3]+1,FALSE)&IF(RC[2]=0,"",IF(HLOOKUP(RC[-4],Sheet1!R2C9:R26C15,RC[-3]+1,FALSE)="","","|"&HLOOKUP(RC[-4],Sheet1!R2C9:R26C15,RC[-3]+1,FALSE))) -> 42301|42201 | F530: =IF(HLOOKUP(RC[-5],Sheet1!R2C9:R26C15,RC[-4]+1,FALSE)="",ROUND(HLOOKUP(RC[-5],Sheet1!R2C1:R26C7,RC[-4]+13,FALSE)+HLOOKUP(RC[-5],Sheet1!R2C9:R26C15,RC[-4]+13,FALSE)*RC[1],0),ROUND(HLOOKUP(RC[-5],Sheet1!R2C1:R26C7,RC[-4]+13,FALSE),0)&IF(RC[1]=0,"","|"&ROUND(HLOOKUP(RC[-5],Sheet1!R2C9:R26C15,RC[-4]+13,FALSE)*RC[1],0))) -> 12|5 | G530: 5 | H530: 0
A531: 5 | B531: =R[-11]C+1 -> 11 | C531: 50 | D531: 0 | E531: =HLOOKUP(RC[-4],Sheet1!R2C1:R26C7,RC[-3]+1,FALSE)&IF(RC[2]=0,"",IF(HLOOKUP(RC[-4],Sheet1!R2C9:R26C15,RC[-3]+1,FALSE)="","","|"&HLOOKUP(RC[-4],Sheet1!R2C9:R26C15,RC[-3]+1,FALSE))) -> 42301|42201 | F531: =IF(HLOOKUP(RC[-5],Sheet1!R2C9:R26C15,RC[-4]+1,FALSE)="",ROUND(HLOOKUP(RC[-5],Sheet1!R2C1:R26C7,RC[-4]+13,FALSE)+HLOOKUP(RC[-5],Sheet1!R2C9:R26C15,RC[-4]+13,FALSE)*RC[1],0),ROUND(HLOOKUP(RC[-5],Sheet1!R2C1:R26C7,RC[-4]+13,FALSE),0)&IF(RC[1]=0,"","|"&ROUND(HLOOKUP(RC[-5],Sheet1!R2C9:R26C15,RC[-4]+13,FALSE)*RC[1],0))) -> 12|4 | G531: 4 | H531: 0
A532: 5 | B532: =R[-11]C+1 -> 11 | C532: 45 | D532: 0 | E532: =HLOOKUP(RC[-4],Sheet1!R2C1:R26C7,RC[-3]+1,FALSE)&IF(RC[2]=0,"",IF(HLOOKUP(RC[-4],Sheet1!R2C9:R26C15,RC[-3]+1,FALSE)="","","|"&HLOOKUP(RC[-4],Sheet1!R2C9:R26C15,RC[-3]+1,FALSE))) -> 42301|42201 | F532: =IF(HLOOKUP(RC[-5],Sheet1!R2C9:R26C15,RC[-4]+1,FALSE)="",ROUND(HLOOKUP(RC[-5],Sheet1!R2C1:R26C7,RC[-4]+13,FALSE)+HLOOKUP(RC[-5],Sheet1!R2C9:R26C15,RC[-4]+13,FALSE)*RC[1],0),ROUND(HLOOKUP(RC[-5],Sheet1!R2C1:R26C7,RC[-4]+13,FALSE),0)&IF(RC[1]=0,"","|"&ROUND(HLOOKUP(RC[-5],Sheet1!R2C9:R26C15,RC[-4]+13,FALSE)*RC[1],0))) -> 12|3 | G532: 3 | H532: 0
A533: 5 | B533: =R[-11]C+1 -> 11 | C533: 40 | D533: 0 | E533: =HLOOKUP(RC[-4],Sheet1!R2C1:R26C7,RC[-3]+1,FALSE)&IF(RC[2]=0,"",IF(HLOOKUP(RC[-4],Sheet1!R2C9:R26C15,RC[-3]+1,FALSE)="","","|"&HLOOKUP(RC[-4],Sheet1!R2C9:R26C15,RC[-3]+1,FALSE))) -> 42301|42201 | F533: =IF(HLOOKUP(RC[-5],Sheet1!R2C9:R26C15,RC[-4]+1,FALSE)="",ROUND(HLOOKUP(RC[-5],Sheet1!R2C1:R26C7,RC[-4]+13,FALSE)+HLOOKUP(RC[-5],Sheet1!R2C9:R26C15,RC[-4]+13,FALSE)*RC[1],0),ROUND(HLOOKUP(RC[-5],Sheet1!R2C1:R26C7,RC[-4]+13,FALSE),0)&IF(RC[1]=0,"","|"&ROUND(HLOOKUP(RC[-5],Sheet1!R2C9:R26C15,RC[-4]+13,FALSE)*RC[1],0))) -> 12|2 | G533: 2 | H533: 0
A534: 5 | B534: =R[-11]C+1 -> 11 | C534: 35 | D534: 0 | E534: =HLOOKUP(RC[-4],Sheet1!R2C1:R26C7,RC[-3]+1,FALSE)&IF(RC[2]=0,"",IF(HLOOKUP(RC[-4],Sheet1!R2C9:R26C15,RC[-3]+1,FALSE)="","","|"&HLOOKUP(RC[-4],Sheet1!R2C9:R26C15,RC[-3]+1,FALSE))) -> 42301|42201 | F534: =IF(HLOOKUP(RC[-5],Sheet1!R2C9:R26C15,RC[-4]+1,FALSE)="",ROUND(HLOOKUP(RC[-5],Sheet1!R2C1:R26C7,RC[-4]+13,FALSE)+HLOOKUP(RC[-5],Sheet1!R2C9:R26C15,RC[-4]+13,FALSE)*RC[1],0),ROUND(HLOOKUP(RC[-5],Sheet1!R2C1:R26C7,RC[-4]+13,FALSE),0)&IF(RC[1]=0,"","|"&ROUND(HLOOKUP(RC[-5],Sheet1!R2C9:R26C15,RC[-4]+13,FALSE)*RC[1],0))) -> 12|1 | G534: 1 | H534: 0
A535: 5 | B535: =R[-11]C+1 -> 11 | C535: 1 | D535: 0 | E535: =HLOOKUP(RC[-4],Sheet1!R2C1:R26C7,RC[-3]+1,FALSE)&IF(RC[2]=0,"",IF(HLOOKUP(RC[-4],Sheet1!R2C9:R26C15,RC[-3]+1,FALSE)="","","|"&HLOOKUP(RC[-4],Sheet1!R2C9:R26C15,RC[-3]+1,FALSE))) -> 42301 | F535: =IF(HLOOKUP(RC[-5],Sheet1!R2C9:R26C15,RC[-4]+1,FALSE)="",ROUND(HLOOKUP(RC[-5],Sheet1!R2C1:R26C7,RC[-4]+13,FALSE)+HLOOKUP(RC[-5],Sheet1!R2C9:R26C15,RC[-4]+13,FALSE)*RC[1],0),ROUND(HLOOKUP(RC[-5],Sheet1!R2C1:R26C7,RC[-4]+13,FALSE),0)&IF(RC[1]=0,"","|"&ROUND(HLOOKUP(RC[-5],Sheet1!R2C9:R26C15,RC[-4]+13,FALSE)*RC[1],0))) -> 12 | G535: 0 | H535: 1
A536: 5 | B536: =R[-11]C+1 -> 12 | C536: 80 | D536: 1 | E536: =HLOOKUP(RC[-4],Sheet1!R2C1:R26C7,RC[-3]+1,FALSE)&IF(RC[2]=0,"",IF(HLOOKUP(RC[-4],Sheet1!R2C9:R26C15,RC[-3]+1,FALSE)="","","|"&HLOOKUP(RC[-4],Sheet1!R2C9:R26C15,RC[-3]+1,FALSE))) -> 42301|42201 | F536: =IF(HLOOKUP(RC[-5],Sheet1!R2C9:R26C15,RC[-4]+1,FALSE)="",ROUND(HLOOKUP(RC[-5],Sheet1!R2C1:R26C7,RC[-4]+13,FALSE)+HLOOKUP(RC[-5],Sheet1!R2C9:R26C15,RC[-4]+13,FALSE)*RC[1],0),ROUND(HLOOKUP(RC[-5],Sheet1!R2C1:R26C7,RC[-4]+13,FALSE),0)&IF(RC[1]=0,"","|"&ROUND(HLOOKUP(RC[-5],Sheet1!R2C9:R26C15,RC[-4]+13,FALSE)*RC[1],0))) -> 14|10 | G536: 10 | H536: 0
A537: 5 | B537: =R[-11]C+1 -> 12 | C537: 75 | D537: 0 | E537: =HLOOKUP(RC[-4],Sheet1!R2C1:R26C7,RC[-3]+1,FALSE)&IF(RC[2]=0,"",IF(HLOOKUP(RC[-4],Sheet1!R2C9:R26C15,RC[-3]+1,FALSE)="","","|"&HLOOKUP(RC[-4],Sheet1!R2C9:R26C15,RC[-3]+1,FALSE))) -> 42301|42201 | F537: =IF(HLOOKUP(RC[-5],Sheet1!R2C9:R26C15,RC[-4]+1,FALSE)="",ROUND(HLOOKUP(RC[-5],Sheet1!R2C1:R26C7,RC[-4]+13,FALSE)+HLOOKUP(RC[-5],Sheet1!R2C9:R26C15,RC[-4]+13,FALSE)*RC[1],0),ROUND(HLOOKUP(RC[-5],Sheet1!R2C1:R26C7,RC[-4]+13,FALSE),0)&IF(RC[1]=0,"","|"&ROUND(HLOOKUP(RC[-5],Sheet1!R2C9:R26C15,RC[-4]+13,FALSE)*RC[1],0))) -> 14|9 | G537: 9 | H537: 0
A538: 5 | B538: =R[-11]C+1 -> 12 | C538: 70 | D538: 0 | E538: =HLOOKUP(RC[-4],Sheet1!R2C1:R26C7,RC[-3]+1,FALSE)&IF(RC[2]=0,"",IF(HLOOKUP(RC[-4],Sheet1!R2C9:R26C15,RC[-3]+1,FALSE)="","","|"&HLOOKUP(RC[-4],Sheet1!R2C9:R26C15,RC[-3]+1,FALSE))) -> 42301|42201 | F538: =IF(HLOOKUP(RC[-5],Sheet1!R2C9:R26C15,RC[-4]+1,FALSE)="",ROUND(HLOOKUP(RC[-5],Sheet1!R2C1:R26C7,RC[-4]+13,FALSE)+HLOOKUP(RC[-5],Sheet1!R2C9:R26C15,RC[-4]+13,FALSE)*RC[1],0),ROUND(HLOOKUP(RC[-5],Sheet1!R2C1:R26C7,RC[-4]+13,FALSE),0)&IF(RC[1]=0,"","|"&ROUND(HLOOKUP(RC[-5],Sheet1!R2C9:R26C15,RC[-4]+13,FALSE)*RC[1],0))) -> 14|8 | G538: 8 | H538: 0
A539: 5 | B539: =R[-11]C+1 -> 12 | C539: 65 | D539: 0 | E539: =HLOOKUP(RC[-4],Sheet1!R2C1:R26C7,RC[-3]+1,FALSE)&IF(RC[2]=0,"",IF(HLOOKUP(RC[-4],Sheet1!R2C9:R26C15,RC[-3]+1,FALSE)="","","|"&HLOOKUP(RC[-4],Sheet1!R2C9:R26C15,RC[-3]+1,FALSE))) -> 42301|42201 | F539: =IF(HLOOKUP(RC[-5],Sheet1!R2C9:R26C15,RC[-4]+1,FALSE)="",ROUND(HLOOKUP(RC[-5],Sheet1!R2C1:R26C7,RC[-4]+13,FALSE)+HLOOKUP(RC[-5],Sheet1!R2C9:R26C15,RC[-4]+13,FALSE)*RC[1],0),ROUND(HLOOKUP(RC[-5],Sheet1!R2C1:R26C7,RC[-4]+13,FALSE),0)&IF(RC[1]=0,"","|"&ROUND(HLOOKUP(RC[-5],Sheet1!R2C9:R26C15,RC[-4]+13,FALSE)*RC[1],0))) -> 14|7 | G539: 7 | H539: 0
A540: 5 | B540: =R[-11]C+1 -> 12 | C540: 60 | D540: 0 | E540: =HLOOKUP(RC[-4],Sheet1!R2C1:R26C7,RC[-3]+1,FALSE)&IF(RC[2]=0,"",IF(HLOOKUP(RC[-4],Sheet1!R2C9:R26C15,RC[-3]+1,FALSE)="","","|"&HLOOKUP(RC[-4],Sheet1!R2C9:R26C15,RC[-3]+1,FALSE))) -> 42301|42201 | F540: =IF(HLOOKUP(RC[-5],Sheet1!R2C9:R26C15,RC[-4]+1,FALSE)="",ROUND(HLOOKUP(RC[-5],Sheet1!R2C1:R26C7,RC[-4]+13,FALSE)+HLOOKUP(RC[-5],Sheet1!R2C9:R26C15,RC[-4]+13,FALSE)*RC[1],0),ROUND(HLOOKUP(RC[-5],Sheet1!R2C1:R26C7,RC[-4]+13,FALSE),0)&IF(RC[1]=0,"","|"&ROUND(HLOOKUP(RC[-5],Sheet1!R2C9:R26C15,RC[-4]+13,FALSE)*RC[1],0))) -> 14|6 | G540: 6 | H540: 0
A541: 5 | B541: =R[-11]C+1 -> 12 | C541: 55 | D541: 0 | E541: =HLOOKUP(RC[-4],Sheet1!R2C1:R26C7,RC[-3]+1,FALSE)&IF(RC[2]=0,"",IF(HLOOKUP(RC[-4],Sheet1!R2C9:R26C15,RC[-3]+1,FALSE)="","","|"&HLOOKUP(RC[-4],Sheet1!R2C9:R26C15,RC[-3]+1,FALSE))) -> 42301|42201 | F541: =IF(HLOOKUP(RC[-5],Sheet1!R2C9:R26C15,RC[-4]+1,FALSE)="",ROUND(HLOOKUP(RC[-5],Sheet1!R2C1:R26C7,RC[-4]+13,FALSE)+HLOOKUP(RC[-5],Sheet1!R2C9:R26C15,RC[-4]+13,FALSE)*RC[1],0),ROUND(HLOOKUP(RC[-5],Sheet1!R2C1:R26C7,RC[-4]+13,FALSE),0)&IF(RC[1]=0,"","|"&ROUND(HLOOKUP(RC[-5],Sheet1!R2C9:R26C15,RC[-4]+13,FALSE)*RC[1],0))) -> 14|5 | G541: 5 | H541: 0
A542: 5 | B542: =R[-11]C+1 -> 12 | C542: 50 | D542: 0 | E542: =HLOOKUP(RC[-4],Sheet1!R2C1:R26C7,RC[-3]+1,FALSE)&IF(RC[2]=0,"",IF(HLOOKUP(RC[-4],Sheet1!R2C9:R26C15,RC[-3]+1,FALSE)="","","|"&HLOOKUP(RC[-4],Sheet1!R2C9:R26C15,RC[-3]+1,FALSE))) -> 42301|42201 | F542: =IF(HLOOKUP(RC[-5],Sheet1!R2C9:R26C15,RC[-4]+1,FALSE)="",ROUND(HLOOKUP(RC[-5],Sheet1!R2C1:R26C7,RC[-4]+13,FALSE)+HLOOKUP(RC[-5],Sheet1!R2C9:R26C15,RC[-4]+13,FALSE)*RC[1],0),ROUND(HLOOKUP(RC[-5],Sheet1!R2C1:R26C7,RC[-4]+13,FALSE),0)&IF(RC[1]=0,"","|"&ROUND(HLOOKUP(RC[-5],Sheet1!R2C9:R26C15,RC[-4]+13,FALSE)*RC[1],0))) -> 14|4 | G542: 4 | H542: 0
A543: 5 | B543: =R[-11]C+1 -> 12 | C543: 45 | D543: 0 | E543: =HLOOKUP(RC[-4],Sheet1!R2C1:R26C7,RC[-3]+1,FALSE)&IF(RC[2]=0,"",IF(HLOOKUP(RC[-4],Sheet1!R2C9:R26C15,RC[-3]+1,FALSE)="","","|"&HLOOKUP(RC[-4],Sheet1!R2C9:R26C15,RC[-3]+1,FALSE))) -> 42301|42201 | F543: =IF(HLOOKUP(RC[-5],Sheet1!R2C9:R26C15,RC[-4]+1,FALSE)="",ROUND(HLOOKUP(RC[-5],Sheet1!R2C1:R26C7,RC[-4]+13,FALSE)+HLOOKUP(RC[-5],Sheet1!R2C9:R26C15,RC[-4]+13,FALSE)*RC[1],0),ROUND(HLOOKUP(RC[-5],Sheet1!R2C1:R26C7,RC[-4]+13,FALSE),0)&IF(RC[1]=0,"","|"&ROUND(HLOOKUP(RC[-5],Sheet1!R2C9:R26C15,RC[-4]+13,FALSE)*RC[1],0))) -> 14|3 | G543: 3 | H543: 0
A544: 5 | B544: =R[-11]C+1 -> 12 | C544: 40 | D544: 0 | E544: =HLOOKUP(RC[-4],Sheet1!R2C1:R26C7,RC[-3]+1,FALSE)&IF(RC[2]=0,"",IF(HLOOKUP(RC[-4],Sheet1!R2C9:R26C15,RC[-3]+1,FALSE)="","","|"&HLOOKUP(RC[-4],Sheet1!R2C9:R26C15,RC[-3]+1,FALSE))) -> 42301|42201 | F544: =IF(HLOOKUP(RC[-5],Sheet1!R2C9:R26C15,RC[-4]+1,FALSE)="",ROUND(HLOOKUP(RC[-5],Sheet1!R2C1:R26C7,RC[-4]+13,FALSE)+HLOOKUP(RC[-5],Sheet1!R2C9:R26C15,RC[-4]+13,FALSE)*RC[1],0),ROUND(HLOOKUP(RC[-5],Sheet1!R2C1:R26C7,RC[-4]+13,FALSE),0)&IF(RC[1]=0,"","|"&ROUND(HLOOKUP(RC[-5],Sheet1!R2C9:R26C15,RC[-4]+13,FALSE)*RC[1],0))) -> 14|2 | G544: 2 | H544: 0
A545: 5 | B545: =R[-11]C+1 -> 12 | C545: 35 | D545: 0 | E545: =HLOOKUP(RC[-4],Sheet1!R2C1:R26C7,RC[-3]+1,FALSE)&IF(RC[2]=0,"",IF(HLOOKUP(RC[-4],Sheet1!R2C9:R26C15,RC[-3]+1,FALSE)="","","|"&HLOOKUP(RC[-4],Sheet1!R2C9:R26C15,RC[-3]+1,FALSE))) -> 42301|42201 | F545: =IF(HLOOKUP(RC[-5],Sheet1!R2C9:R26C15,RC[-4]+1,FALSE)="",ROUND(HLOOKUP(RC[-5],Sheet1!R2C1:R26C7,RC[-4]+13,FALSE)+HLOOKUP(RC[-5],Sheet1!R2C9:R26C15,RC[-4]+13,FALSE)*RC[1],0),ROUND(HLOOKUP(RC[-5],Sheet1!R2C1:R26C7,RC[-4]+13,FALSE),0)&IF(RC[1]=0,"","|"&ROUND(HLOOKUP(RC[-5],Sheet1!R2C9:R26C15,RC[-4]+13,FALSE)*RC[1],0))) -> 14|1 | G545: 1 | H545: 0
A546: 5 | B546: =R[-11]C+1 -> 12 | C546: 1 | D546: 0 | E546: =HLOOKUP(RC[-4],Sheet1!R2C1:R26C7,RC[-3]+1,FALSE)&IF(RC[2]=0,"",IF(HLOOKUP(RC[-4],Sheet1!R2C9:R26C15,RC[-3]+1,FALSE)="","","|"&HLOOKUP(RC[-4],Sheet1!R2C9:R26C15,RC[-3]+1,FALSE))) -> 42301 | F546: =IF(HLOOKUP(RC[-5],Sheet1!R2C9:R26C15,RC[-4]+1,FALSE)="",ROUND(HLOOKUP(RC[-5],Sheet1!R2C1:R26C7,RC[-4]+13,FALSE)+HLOOKUP(RC[-5],Sheet1!R2C9:R26C15,RC[-4]+13,FALSE)*RC[1],0),ROUND(HLOOKUP(RC[-5],Sheet1!R2C1:R26C7,RC[-4]+13,FALSE),0)&IF(RC[1]=0,"","|"&ROUND(HLOOKUP(RC[-5],Sheet1!R2C9:R26C15,RC[-4]+13,FALSE)*RC[1],0))) -> 14 | G546: 0 | H546: 1
A547: 6 | B547: 1 | C547: 0 | D547: 1 | E547: =HLOOKUP(RC[-4],Sheet1!R2C1:R26C7,RC[-3]+1,FALSE)&IF(RC[2]=0,"",IF(HLOOKUP(RC[-4],Sheet1!R2C9:R26C15,RC[-3]+1,FALSE)="","","|"&HLOOKUP(RC[-4],Sheet1!R2C9:R26C15,RC[-3]+1,FALSE))) -> 10010 | F547: =IF(HLOOKUP(RC[-5],Sheet1!R2C9:R26C15,RC[-4]+1,FALSE)="",ROUND(HLOOKUP(RC[-5],Sheet1!R2C1:R26C7,RC[-4]+13,FALSE)+HLOOKUP(RC[-5],Sheet1!R2C9:R26C15,RC[-4]+13,FALSE)*RC[1],0),ROUND(HLOOKUP(RC[-5],Sheet1!R2C1:R26C7,RC[-4]+13,FALSE),0)&IF(RC[1]=0,"","|"&ROUND(HLOOKUP(RC[-5],Sheet1!R2C9:R26C15,RC[-4]+13,FALSE)*RC[1],0))) -> 20 | G547: 0 | H547: 0
A548: 6 | B548: 2 | C548: 0 | D548: 1 | E548: =HLOOKUP(RC[-4],Sheet1!R2C1:R26C7,RC[-3]+1,FALSE)&IF(RC[2]=0,"",IF(HLOOKUP(RC[-4],Sheet1!R2C9:R26C15,RC[-3]+1,FALSE)="","","|"&HLOOKUP(RC[-4],Sheet1!R2C9:R26C15,RC[-3]+1,FALSE))) -> 10010 | F548: =IF(HLOOKUP(RC[-5],Sheet1!R2C9:R26C15,RC[-4]+1,FALSE)="",ROUND(HLOOKUP(RC[-5],Sheet1!R2C1:R26C7,RC[-4]+13,FALSE)+HLOOKUP(RC[-5],Sheet1!R2C9:R26C15,RC[-4]+13,FALSE)*RC[1],0),ROUND(HLOOKUP(RC[-5],Sheet1!R2C1:R26C7,RC[-4]+13,FALSE),0)&IF(RC[1]=0,"","|"&ROUND(HLOOKUP(RC[-5],Sheet1!R2C9:R26C15,RC[-4]+13,FALSE)*RC[1],0))) -> 29 | G548: 0 | H548: 0
A549: 6 | B549: 3 | C549: 0 | D549: 1 | E549: =HLOOKUP(RC[-4],Sheet1!R2C1:R26C7,RC[-3]+1,FALSE)&IF(RC[2]=0,"",IF(HLOOKUP(RC[-4],Sheet1!R2C9:R26C15,RC[-3]+1,FALSE)="","","|"&HLOOKUP(RC[-4],Sheet1!R2C9:R26C15,RC[-3]+1,FALSE))) -> 10010 | F549: =IF(HLOOKUP(RC[-5],Sheet1!R2C9:R26C15,RC[-4]+1,FALSE)="",ROUND(HLOOKUP(RC[-5],Sheet1!R2C1:R26C7,RC[-4]+13,FALSE)+HLOOKUP(RC[-5],Sheet1!R2C9:R26C15,RC[-4]+13,FALSE)*RC[1],0),ROUND(HLOOKUP(RC[-5],Sheet1!R2C1:R26C7,RC[-4]+13,FALSE),0)&IF(RC[1]=0,"","|"&ROUND(HLOOKUP(RC[-5],Sheet1!R2C9:R26C15,RC[-4]+13,FALSE)*RC[1],0))) -> 40 | G549: 0 | H549: 0
A550: 6 | B550: 4 | C550: 0 | D550: 1 | E550: =HLOOKUP(RC[-4],Sheet1!R2C1:R26C7,RC[-3]+1,FALSE)&IF(RC[2]=0,"",IF(HLOOKUP(RC[-4],Sheet1!R2C9:R26C15,RC[-3]+1,FALSE)="","","|"&HLOOKUP(RC[-4],Sheet1!R2C9:R26C15,RC[-3]+1,FALSE))) -> 10010 | F550: =IF(HLOOKUP(RC[-5],Sheet1!R2C9:R26C15,RC[-4]+1,FALSE)="",ROUND(HLOOKUP(RC[-5],Sheet1!R2C1:R26C7,RC[-4]+13,FALSE)+HLOOKUP(RC[-5],Sheet1!R2C9:R26C15,RC[-4]+13,FALSE)*RC[1],0),ROUND(HLOOKUP(RC[-5],Sheet1!R2C1:R26C7,RC[-4]+13,FALSE),0)&IF(RC[1]=0,"","|"&ROUND(HLOOKUP(RC[-5],Sheet1!R2C9:R26C15,RC[-4]+13,FALSE)*RC[1],0))) -> 52 | G550: 0 | H550: 0
A551: 6 | B551: 5 | C551: 0 | D551: 1 | E551: =HLOOKUP(RC[-4],Sheet1!R2C1:R26C7,RC[-3]+1,FALSE)&IF(RC[2]=0,"",IF(HLOOKUP(RC[-4],Sheet1!R2C9:R26C15,RC[-3]+1,FALSE)="","","|"&HLOOKUP(RC[-4],Sheet1!R2C9:R26C15,RC[-3]+1,FALSE))) -> 10010 | F551: =IF(HLOOKUP(RC[-5],Sheet1!R2C9:R26C15,RC[-4]+1,FALSE)="",ROUND(HLOOKUP(RC[-5],Sheet1!R2C1:R26C7,RC[-4]+13,FALSE)+HLOOKUP(RC[-5],Sheet1!R2C9:R26C15,RC[-4]+13,FALSE)*RC[1],0),ROUND(HLOOKUP(RC[-5],Sheet1!R2C1:R26C7,RC[-4]+13,FALSE),0)&IF(RC[1]=0,"","|"&ROUND(HLOOKUP(RC[-5],Sheet1!R2C9:R26C15,RC[-4]+13,FALSE)*RC[1],0))) -> 66 | G551: 0 | H551: 0
A552: 6 | B552: 6 | C552: 0 | D552: 1 | E552: =HLOOKUP(RC[-4],Sheet1!R2C1:R26C7,RC[-3]+1,FALSE)&IF(RC[2]=0,"",IF(HLOOKUP(RC[-4],Sheet1!R2C9:R26C15,RC[-3]+1,FALSE)="","","|"&HLOOKUP(RC[-4],Sheet1!R2C9:R26C15,RC[-3]+1,FALSE))) -> 10010 | F552: =IF(HLOOKUP(RC[-5],Sheet1!R2C9:R26C15,RC[-4]+1,FALSE)="",ROUND(HLOOKUP(RC[-5],Sheet1!R2C1:R26C7,RC[-4]+13,FALSE)+HLOOKUP(RC[-5],Sheet1!R2C9:R26C15,RC[-4]+13,FALSE)*RC[1],0),ROUND(HLOOKUP(RC[-5],Sheet1!R2C1:R26C7,RC[-4]+13,FALSE),0)&IF(RC[1]=0,"","|"&ROUND(HLOOKUP(RC[-5],Sheet1!R2C9:R26C15,RC[-4]+13,FALSE)*RC[1],0))) -> 81 | G552: 0 | H552: 0
A553: 6 | B553: 7 | C553: 0 | D553: 1 | E553: =HLOOKUP(RC[-4],Sheet1!R2C1:R26C7,RC[-3]+1,FALSE)&IF(RC[2]=0,"",IF(HLOOKUP(RC[-4],Sheet1!R2C9:R26C15,RC[-3]+1,FALSE)="","","|"&HLOOKUP(RC[-4],Sheet1!R2C9:R26C15,RC[-3]+1,FALSE))) -> 10010 | F553: =IF(HLOOKUP(RC[-5],Sheet1!R2C9:R26C15,RC[-4]+1,FALSE)="",ROUND(HLOOKUP(RC[-5],Sheet1!R2C1:R26C7,RC[-4]+13,FALSE)+HLOOKUP(RC[-5],Sheet1!R2C9:R26C15,RC[-4]+13,FALSE)*RC[1],0),ROUND(HLOOKUP(RC[-5],Sheet1!R2C1:R26C7,RC[-4]+13,FALSE),0)&IF(RC[1]=0,"","|"&ROUND(HLOOKUP(RC[-5],Sheet1!R2C9:R26C15,RC[-4]+13,FALSE)*RC[1],0))) -> 98 | G553: 0 | H553: 0
A554: 6 | B554: 8 | C554: 0 | D554: 1 | E554: =HLOOKUP(RC[-4],Sheet1!R2C1:R26C7,RC[-3]+1,FALSE)&IF(RC[2]=0,"",IF(HLOOKUP(RC[-4],Sheet1!R2C9:R26C15,RC[-3]+1,FALSE)="","","|"&HLOOKUP(RC[-4],Sheet1!R2C9:R26C15,RC[-3]+1,FALSE))) -> 10010 | F554: =IF(HLOOKUP(RC[-5],Sheet1!R2C9:R26C15,RC[-4]+1,FALSE)="",ROUND(HLOOKUP(RC[-5],Sheet1!R2C1:R26C7,RC[-4]+13,FALSE)+HLOOKUP(RC[-5],Sheet1!R2C9:R26C15,RC[-4]+13,FALSE)*RC[1],0),ROUND(HLOOKUP(RC[-5],Sheet1!R2C1:R26C7,RC[-4]+13,FALSE),0)&IF(RC[1]=0,"","|"&ROUND(HLOOKUP(RC[-5],Sheet1!R2C9:R26C15,RC[-4]+13,FALSE)*RC[1],0))) -> 117 | G554: 0 | H554: 0
A555: 6 | B555: 9 | C555: 0 | D555: 1 | E555: =HLOOKUP(RC[-4],Sheet1!R2C1:R26C7,RC[-3]+1,FALSE)&IF(RC[2]=0,"",IF(HLOOKUP(RC[-4],Sheet1!R2C9:R26C15,RC[-3]+1,FALSE)="","","|"&HLOOKUP(RC[-4],Sheet1!R2C9:R26C15,RC[-3]+1,FALSE))) -> 10010 | F555: =IF(HLOOKUP(RC[-5],Sheet1!R2C9:R26C15,RC[-4]+1,FALSE)="",ROUND(HLOOKUP(RC[-5],Sheet1!R2C1:R26C7,RC[-4]+13,FALSE)+HLOOKUP(RC[-5],Sheet1!R2C9:R26C15,RC[-4]+13,FALSE)*RC[1],0),ROUND(HLOOKUP(RC[-5],Sheet1!R2C1:R26C7,RC[-4]+13,FALSE),0)&IF(RC[1]=0,"","|"&ROUND(HLOOKUP(RC[-5],Sheet1!R2C9:R26C15,RC[-4]+13,FALSE)*RC[1],0))) -> 137 | G555: 0 | H555: 0
A556: 6 | B556: 10 | C556: 0 | D556: 1 | E556: =HLOOKUP(RC[-4],Sheet1!R2C1:R26C7,RC[-3]+1,FALSE)&IF(RC[2]=0,"",IF(HLOOKUP(RC[-4],Sheet1!R2C9:R26C15,RC[-3]+1,FALSE)="","","|"&HLOOKUP(RC[-4],Sheet1!R2C9:R26C15,RC[-3]+1,FALSE))) -> 10010 | F556: =IF(HLOOKUP(RC[-5],Sheet1!R2C9:R26C15,RC[-4]+1,FALSE)="",ROUND(HLOOKUP(RC[-5],Sheet1!R2C1:R26C7,RC[-4]+13,FALSE)+HLOOKUP(RC[-5],Sheet1!R2C9:R26C15,RC[-4]+13,FALSE)*RC[1],0),ROUND(HLOOKUP(RC[-5],Sheet1!R2C1:R26C7,RC[-4]+13,FALSE),0)&IF(RC[1]=0,"","|"&ROUND(HLOOKUP(RC[-5],Sheet1!R2C9:R26C15,RC[-4]+13,FALSE)*RC[1],0))) -> 158 | G556: 0 | H556: 0
A557: 6 | B557: 11 | C557: 0 | D557: 1 | E557: =HLOOKUP(RC[-4],Sheet1!R2C1:R26C7,RC[-3]+1,FALSE)&IF(RC[2]=0,"",IF(HLOOKUP(RC[-4],Sheet1!R2C9:R26C15,RC[-3]+1,FALSE)="","","|"&HLOOKUP(RC[-4],Sheet1!R2C9:R26C15,RC[-3]+1,FALSE))) -> 10010 | F557: =IF(HLOOKUP(RC[-5],Sheet1!R2C9:R26C15,RC[-4]+1,FALSE)="",ROUND(HLOOKUP(RC[-5],Sheet1!R2C1:R26C7,RC[-4]+13,FALSE)+HLOOKUP(RC[-5],Sheet1!R2C9:R26C15,RC[-4]+13,FALSE)*RC[1],0),ROUND(HLOOKUP(RC[-5],Sheet1!R2C1:R26C7,RC[-4]+13,FALSE),0)&IF(RC[1]=0,"","|"&ROUND(HLOOKUP(RC[-5],Sheet1!R2C9:R26C15,RC[-4]+13,FALSE)*RC[1],0))) -> 181 | G557: 0 | H557: 1
A558: 6 | B558: 12 | C558: 0 | D558: 1 | E558: =HLOOKUP(RC[-4],Sheet1!R2C1:R26C7,RC[-3]+1,FALSE)&IF(RC[2]=0,"",IF(HLOOKUP(RC[-4],Sheet1!R2C9:R26C15,RC[-3]+1,FALSE)="","","|"&HLOOKUP(RC[-4],Sheet1!R2C9:R26C15,RC[-3]+1,FALSE))) -> 10010 | F558: =IF(HLOOKUP(RC[-5],Sheet1!R2C9:R26C15,RC[-4]+1,FALSE)="",ROUND(HLOOKUP(RC[-5],Sheet1!R2C1:R26C7,RC[-4]+13,FALSE)+HLOOKUP(RC[-5],Sheet1!R2C9:R26C15,RC[-4]+13,FALSE)*RC[1],0),ROUND(HLOOKUP(RC[-5],Sheet1!R2C1:R26C7,RC[-4]+13,FALSE),0)&IF(RC[1]=0,"","|"&ROUND(HLOOKUP(RC[-5],Sheet1!R2C9:R26C15,RC[-4]+13,FALSE)*RC[1],0))) -> 205 | G558: 0 | H558: 0

Sheet: Sheet1
A2: 保底产出 | B2: 1 | C2: 2 | D2: 3 | E2: 4 | F2: 5 | G2: 6 | I2: 额外产出 | J2: 1 | K2: 2 | L2: 3 | M2: 4 | N2: 5 | O2: 6
B3: 33200 | C3: 19003 | D3: 10012 | E3: 10002 | F3: 42201 | G3: 10010 | J3: 33100 | L3: 10011
B4: 33200 | C4: 19003 | D4: 10012 | E4: 10002 | F4: 42201 | G4: 10010 | J4: 33100 | L4: 10011
B5: 33300 | C5: 19003 | D5: 10012 | E5: 10002 | F5: 42301 | G5: 10010 | J5: 33100 | L5: 10011 | N5: 42201
B6: 33300 | C6: 19003 | D6: 10013 | E6: 10002 | F6: 42301 | G6: 10010 | J6: 33100 | L6: 10012 | N6: 42201
B7: 33400 | C7: 19003 | D7: 10013 | E7: 10002 | F7: 42301 | G7: 10010 | J7: 33200 | L7: 10012 | N7: 42201
B8: 33400 | C8: 19003 | D8: 10013 | E8: 10002 | F8: 42301 | G8: 10010 | J8: 33200 | L8: 10012 | N8: 42201
B9: 33400 | C9: 19003 | D9: 10014 | E9: 10002 | F9: 42301 | G9: 10010 | J9: 33200 | L9: 10013 | N9: 42201
B10: 33400 | C10: 19003 | D10: 10014 | E10: 10002 | F10: 42301 | G10: 10010 | J10: 33200 | L10: 10013 | N10: 42201
B11: 33400 | C11: 19003 | D11: 10014 | E11: 10002 | F11: 42301 | G11: 10010 | J11: 33300 | L11: 10013 | N11: 42201
B12: 33400 | C12: 19003 | D12: 10014 | E12: 10002 | F12: 42301 | G12: 10010 | J12: 33300 | L12: 10013 | N12: 42201
B13: 33400 | C13: 19003 | D13: 10014 | E13: 10002 | F13: 42301 | G13: 10010 | J13: 33300 | L13: 10013 | N13: 42201
B14: 33400 | C14: 19003 | D14: 10014 | E14: 10002 | F14: 42301 | G14: 10010 | J14: 33300 | L14: 10013 | N14: 42201
A15: 保底数量 | B15: 5 | C15: 117500 | D15: 60 | E15: 75 | F15: 4 | G15: 20 | H15: =R[1]C[-3]-RC[-3] -> 35 | I15: 额外数量 | J15: 1 | K15: =RC[-8]*0.02 -> 2350 | L15: 1 | N15: 0.5
B16: 8 | C16: 198750 | D16: 102 | E16: 110 | F16: 6 | G16: 29 | H16: =R[1]C[-3]-RC[-3] -> 45 | J16: 2 | K16: =RC[-8]*0.02 -> 3975 | L16: 2 | N16: 0.5
B17: 6 | C17: 295000 | D17: 150 | E17: 155 | F17: 1 | G17: 40 | H17: =R[1]C[-3]-RC[-3] -> 50 | J17: 2 | K17: =RC[-8]*0.02 -> 5900 | L17: 3 | N17: 0.5
B18: 8 | C18: 406250 | D18: 83 | E18: 205 | F18: 2 | G18: 52 | H18: =R[1]C[-3]-RC[-3] -> 55 | J18: 3 | K18: =RC[-8]*0.02 -> 8125 | L18: 2 | N18: 0.5
B19: 5 | C19: 532500 | D19: 108 | E19: 260 | F19: 3 | G19: 66 | H19: =R[1]C[-3]-RC[-3] -> 60 | J19: 1 | K19: =RC[-8]*0.02 -> 10650 | L19: 3 | N19: 0.5
B20: 7 | C20: 673750 | D20: 137 | E20: 320 | F20: 4 | G20: 81 | H20: =R[1]C[-3]-RC[-3] -> 65 | J20: 1 | K20: =RC[-8]*0.02 -> 13475 | L20: 4 | N20: 1
B21: 8 | C21: 830000 | D21: 84 | E21: 385 | F21: 5 | G21: 98 | H21: =R[1]C[-3]-RC[-3] -> 70 | J21: 2 | K21: =RC[-8]*0.02 -> 16600 | L21: 2 | N21: 1
B22: 10 | C22: 1001250 | D22: 101 | E22: 455 | F22: 6 | G22: 117 | H22: =R[1]C[-3]-RC[-3] -> 130 | J22: 2 | K22: =RC[-8]*0.02 -> 20025 | L22: 2 | N22: 1
B23: 12 | C23: 1187500 | D23: 120 | E23: 585 | F23: 8 | G23: 137 | H23: =R[1]C[-3]-RC[-3] -> 140 | J23: 1 | K23: =RC[-8]*0.02 -> 23750 | L23: 3 | N23: 1
B24: 15 | C24: 1515000 | D24: 153 | E24: 725 | F24: 10 | G24: 158 | H24: =R[1]C[-3]-RC[-3] -> 150 | J24: 1 | K24: =RC[-8]*0.02 -> 30300 | L24: 3 | N24: 1
B25: 19 | C25: 1872500 | D25: 189 | E25: 875 | F25: 12 | G25: 181 | H25: =R[1]C[-3]-RC[-3] -> 160 | J25: 2 | K25: =RC[-8]*0.02 -> 37450 | L25: 4 | N25: 1
B26: 23 | C26: 2260000 | D26: 228 | E26: 1035 | F26: 14 | G26: 205 | H26: =R[1]C[-3]-RC[-3] -> -1035 | J26: 2 | K26: =RC[-8]*0.02 -> 45200 | L26: 4 | N26: 1