Sheet: 配置
A1: 服务端文件名 | B1: 服务端对应工作表号 | C1: 客户端文件名 | D1: 客户端对应工作表号 | E1: erl头部 | F1: erl内容格式 | G1: erl尾部 | H1: 客户端特殊处理
A2: hot_sale_goods.txt | B2: 1 | C2: hot_sale_goods.cnf|HotSaleGoods | D2: 1 | F2: get(data_id) -> #$ | H2: 1=>data_id,goods_id|goods_list

Sheet: 商品
A1: data_id|data_id | B1: goods_id|goods_id | C1: sort| | D1: item_id_list|item_id_list | E1: item_num_list|item_num_list | F1: buy_num_max_list|buy_num_max_list | G1: need_level_list|need_level_list | H1: reset_day_list|reset_day_list | I1: recharge_id_list|recharge_id_list | J1: recharge_discount| | K1: cost_type_list|cost_type_list | L1: cost_value_list|cost_value_list | M1: diamond_discount|
A2: 不可空 | B2: 不可空 | C2: 不可空 | D2: 不可空 | E2: 不可空 | F2: 不可空 | G2: 不可空 | H2: 可空#不需字段 | I2: 可空#不需字段 | J2: 可空#不需字段 | K2: 可空#不需字段 | L2: 可空#不需字段 | M2: 可空#不需字段
A3: 数字 | B3: 数字 | C3: 数字 | D3: 一维数组 | E3: 一维数组 | F3: 一维数组 | G3: 一维数组 | H3: 一维数组 | I3: 一维数组 | J3: 一维数组 | K3: 一维数组 | L3: 一维数组 | M3: 一维数组
D4: 不定长 | E4: 不定长 | F4: 不定长 | G4: 不定长 | H4: 不定长 | I4: 不定长 | J4: 不定长 | K4: 不定长 | L4: 不定长 | M4: 不定长
A6: 活动数据id | B6: 商品ID | C6: 顺序 | D6: 物品ID列表 | E6: 物品数量列表 | F6: 购买数量上限列表(0=表示无上限) | G6: 等级限制列表 | H6: 重置天列表（不填表示不重置） | I6: 充值ID列表 | J6: 充值折扣 | K6: 消耗类型列表 | L6: 消耗值列表 | M6: 钻石折扣
A7: 100 | B7: =IF(RC[-1]=R[-1]C[-1],R[-1]C+1,RC[-1]*100+1) -> 10001 | C7: =IF(RC[-2]=R[-1]C[-2],R[-1]C+1,1) -> 1 | D7: 13885 | E7: 1 | F7: 4 | G7: 1 | I7: 2004 | J7: 8
A8: 100 | B8: =IF(RC[-1]=R[-1]C[-1],R[-1]C+1,RC[-1]*100+1) -> 10002 | C8: =IF(RC[-2]=R[-1]C[-2],R[-1]C+1,1) -> 2 | D8: 13435 | E8: 1 | F8: 1 | G8: 1 | I8: 2002 | J8: 9
A9: 100 | B9: =IF(RC[-1]=R[-1]C[-1],R[-1]C+1,RC[-1]*100+1) -> 10003 | C9: =IF(RC[-2]=R[-1]C[-2],R[-1]C+1,1) -> 3 | D9: 13881 | E9: 1 | F9: 1 | G9: 1 | I9: 2003 | J9: 8
A10: 100 | B10: =IF(RC[-1]=R[-1]C[-1],R[-1]C+1,RC[-1]*100+1) -> 10004 | C10: =IF(RC[-2]=R[-1]C[-2],R[-1]C+1,1) -> 4 | D10: 13882 | E10: 1 | F10: 1 | G10: 1 | I10: 2003 | J10: 8
A11: 100 | B11: =IF(RC[-1]=R[-1]C[-1],R[-1]C+1,RC[-1]*100+1) -> 10005 | C11: =IF(RC[-2]=R[-1]C[-2],R[-1]C+1,1) -> 5 | D11: 13883 | E11: 1 | F11: 1 | G11: 1 | I11: 2003 | J11: 8
A12: 100 | B12: =IF(RC[-1]=R[-1]C[-1],R[-1]C+1,RC[-1]*100+1) -> 10006 | C12: =IF(RC[-2]=R[-1]C[-2],R[-1]C+1,1) -> 6 | D12: 13884 | E12: 1 | F12: 1 | G12: 1 | I12: 2003 | J12: 8
A13: 101 | B13: =IF(RC[-1]=R[-1]C[-1],R[-1]C+1,RC[-1]*100+1) -> 10101 | C13: =IF(RC[-2]=R[-1]C[-2],R[-1]C+1,1) -> 1 | D13: 13724 | E13: 1 | F13: 99 | G13: 1 | I13: 2001 | J13: 8
A14: 101 | B14: =IF(RC[-1]=R[-1]C[-1],R[-1]C+1,RC[-1]*100+1) -> 10102 | C14: =IF(RC[-2]=R[-1]C[-2],R[-1]C+1,1) -> 2 | D14: 13725 | E14: 1 | F14: 50 | G14: 1 | I14: 2002 | J14: 8
A15: 101 | B15: =IF(RC[-1]=R[-1]C[-1],R[-1]C+1,RC[-1]*100+1) -> 10103 | C15: =IF(RC[-2]=R[-1]C[-2],R[-1]C+1,1) -> 3 | D15: 13726 | E15: 1 | F15: 50 | G15: 1 | I15: 2003 | J15: 8
A16: 101 | B16: =IF(RC[-1]=R[-1]C[-1],R[-1]C+1,RC[-1]*100+1) -> 10104 | C16: =IF(RC[-2]=R[-1]C[-2],R[-1]C+1,1) -> 4 | D16: 13727 | E16: 1 | F16: 50 | G16: 1 | I16: 2004 | J16: 8
A17: 101 | B17: =IF(RC[-1]=R[-1]C[-1],R[-1]C+1,RC[-1]*100+1) -> 10105 | C17: =IF(RC[-2]=R[-1]C[-2],R[-1]C+1,1) -> 5 | D17: 13728 | E17: 1 | F17: 30 | G17: 1 | I17: 2005 | J17: 8
A18: 101 | B18: =IF(RC[-1]=R[-1]C[-1],R[-1]C+1,RC[-1]*100+1) -> 10106 | C18: =IF(RC[-2]=R[-1]C[-2],R[-1]C+1,1) -> 6 | D18: 13729 | E18: 1 | F18: 30 | G18: 1 | I18: 2006 | J18: 8
A19: 101 | B19: =IF(RC[-1]=R[-1]C[-1],R[-1]C+1,RC[-1]*100+1) -> 10107 | C19: =IF(RC[-2]=R[-1]C[-2],R[-1]C+1,1) -> 7 | D19: 13730 | E19: 1 | F19: 30 | G19: 1 | I19: 2007 | J19: 8
A20: 101 | B20: =IF(RC[-1]=R[-1]C[-1],R[-1]C+1,RC[-1]*100+1) -> 10108 | C20: =IF(RC[-2]=R[-1]C[-2],R[-1]C+1,1) -> 8 | D20: 13731 | E20: 1 | F20: 30 | G20: 1 | I20: 2008 | J20: 8
A21: 102 | B21: =IF(RC[-1]=R[-1]C[-1],R[-1]C+1,RC[-1]*100+1) -> 10201 | C21: =IF(RC[-2]=R[-1]C[-2],R[-1]C+1,1) -> 1 | D21: 13893 | E21: 1 | F21: 2 | G21: 1 | I21: 2004 | J21: 8
A22: 102 | B22: =IF(RC[-1]=R[-1]C[-1],R[-1]C+1,RC[-1]*100+1) -> 10202 | C22: =IF(RC[-2]=R[-1]C[-2],R[-1]C+1,1) -> 2 | D22: 13380 | E22: 1 | F22: 1 | G22: 1 | I22: 2001 | J22: 9
A23: 102 | B23: =IF(RC[-1]=R[-1]C[-1],R[-1]C+1,RC[-1]*100+1) -> 10203 | C23: =IF(RC[-2]=R[-1]C[-2],R[-1]C+1,1) -> 3 | D23: 13886 | E23: 1 | F23: 1 | G23: 1 | I23: 2001 | J23: 9
A24: 102 | B24: =IF(RC[-1]=R[-1]C[-1],R[-1]C+1,RC[-1]*100+1) -> 10204 | C24: =IF(RC[-2]=R[-1]C[-2],R[-1]C+1,1) -> 4 | D24: 13887 | E24: 1 | F24: 1 | G24: 1 | I24: 2001 | J24: 9
A25: 102 | B25: =IF(RC[-1]=R[-1]C[-1],R[-1]C+1,RC[-1]*100+1) -> 10205 | C25: =IF(RC[-2]=R[-1]C[-2],R[-1]C+1,1) -> 5 | D25: 13892 | E25: 1 | F25: 1 | G25: 1 | I25: 2002 | J25: 9
A26: 102 | B26: =IF(RC[-1]=R[-1]C[-1],R[-1]C+1,RC[-1]*100+1) -> 10206 | C26: =IF(RC[-2]=R[-1]C[-2],R[-1]C+1,1) -> 6 | D26: 13890 | E26: 1 | F26: 1 | G26: 1 | I26: 2002 | J26: 9
A27: 102 | B27: =IF(RC[-1]=R[-1]C[-1],R[-1]C+1,RC[-1]*100+1) -> 10207 | C27: =IF(RC[-2]=R[-1]C[-2],R[-1]C+1,1) -> 7 | D27: 13888 | E27: 1 | F27: 1 | G27: 1 | I27: 2002 | J27: 9
A28: 102 | B28: =IF(RC[-1]=R[-1]C[-1],R[-1]C+1,RC[-1]*100+1) -> 10208 | C28: =IF(RC[-2]=R[-1]C[-2],R[-1]C+1,1) -> 8 | D28: 13891 | E28: 1 | F28: 1 | G28: 1 | I28: 2002 | J28: 8
A29: 102 | B29: =IF(RC[-1]=R[-1]C[-1],R[-1]C+1,RC[-1]*100+1) -> 10209 | C29: =IF(RC[-2]=R[-1]C[-2],R[-1]C+1,1) -> 9 | D29: 10003 | E29: 500 | F29: 1 | G29: 1 | I29: 2002 | J29: 8
A30: 103 | B30: =IF(RC[-1]=R[-1]C[-1],R[-1]C+1,RC[-1]*100+1) -> 10301 | C30: =IF(RC[-2]=R[-1]C[-2],R[-1]C+1,1) -> 1 | D30: 13906 | E30: 1 | F30: 1 | G30: 1 | I30: 2004 | J30: 8
A31: 103 | B31: =IF(RC[-1]=R[-1]C[-1],R[-1]C+1,RC[-1]*100+1) -> 10302 | C31: =IF(RC[-2]=R[-1]C[-2],R[-1]C+1,1) -> 2 | D31: 13380 | E31: 1 | F31: 1 | G31: 1 | I31: 2001 | J31: 9
A32: 103 | B32: =IF(RC[-1]=R[-1]C[-1],R[-1]C+1,RC[-1]*100+1) -> 10303 | C32: =IF(RC[-2]=R[-1]C[-2],R[-1]C+1,1) -> 3 | D32: 10008 | E32: 300 | F32: 1 | G32: 1 | I32: 2001 | J32: 9
A33: 103 | B33: =IF(RC[-1]=R[-1]C[-1],R[-1]C+1,RC[-1]*100+1) -> 10304 | C33: =IF(RC[-2]=R[-1]C[-2],R[-1]C+1,1) -> 4 | D33: 13892 | E33: 1 | F33: 1 | G33: 1 | I33: 2002 | J33: 9
A34: 103 | B34: =IF(RC[-1]=R[-1]C[-1],R[-1]C+1,RC[-1]*100+1) -> 10305 | C34: =IF(RC[-2]=R[-1]C[-2],R[-1]C+1,1) -> 5 | D34: 13903 | E34: 1 | F34: 1 | G34: 1 | I34: 2002 | J34: 9
A35: 103 | B35: =IF(RC[-1]=R[-1]C[-1],R[-1]C+1,RC[-1]*100+1) -> 10306 | C35: =IF(RC[-2]=R[-1]C[-2],R[-1]C+1,1) -> 6 | D35: 13359 | E35: 30 | F35: 1 | G35: 1 | I35: 2002 | J35: 9
A36: 103 | B36: =IF(RC[-1]=R[-1]C[-1],R[-1]C+1,RC[-1]*100+1) -> 10307 | C36: =IF(RC[-2]=R[-1]C[-2],R[-1]C+1,1) -> 7 | D36: 13888 | E36: 1 | F36: 1 | G36: 1 | I36: 2002 | J36: 9
A37: 103 | B37: =IF(RC[-1]=R[-1]C[-1],R[-1]C+1,RC[-1]*100+1) -> 10308 | C37: =IF(RC[-2]=R[-1]C[-2],R[-1]C+1,1) -> 8 | D37: 13891 | E37: 1 | F37: 1 | G37: 1 | I37: 2002 | J37: 8
A38: 104 | B38: =IF(RC[-1]=R[-1]C[-1],R[-1]C+1,RC[-1]*100+1) -> 10401 | C38: =IF(RC[-2]=R[-1]C[-2],R[-1]C+1,1) -> 1 | D38: 10008 | E38: 250 | F38: 1 | G38: 1 | I38: 2001 | J38: 9
A39: 104 | B39: =IF(RC[-1]=R[-1]C[-1],R[-1]C+1,RC[-1]*100+1) -> 10402 | C39: =IF(RC[-2]=R[-1]C[-2],R[-1]C+1,1) -> 2 | D39: 10003 | E39: 100 | F39: 1 | G39: 1 | I39: 2001 | J39: 9
A40: 104 | B40: =IF(RC[-1]=R[-1]C[-1],R[-1]C+1,RC[-1]*100+1) -> 10403 | C40: =IF(RC[-2]=R[-1]C[-2],R[-1]C+1,1) -> 3 | D40: 13887 | E40: 1 | F40: 1 | G40: 1 | I40: 2001 | J40: 9
A41: 104 | B41: =IF(RC[-1]=R[-1]C[-1],R[-1]C+1,RC[-1]*100+1) -> 10404 | C41: =IF(RC[-2]=R[-1]C[-2],R[-1]C+1,1) -> 4 | D41: 13886 | E41: 1 | F41: 1 | G41: 1 | I41: 2001 | J41: 9
A42: 104 | B42: =IF(RC[-1]=R[-1]C[-1],R[-1]C+1,RC[-1]*100+1) -> 10405 | C42: =IF(RC[-2]=R[-1]C[-2],R[-1]C+1,1) -> 5 | D42: 13915 | E42: 1 | F42: 1 | G42: 1 | I42: 2002 | J42: 9
A43: 104 | B43: =IF(RC[-1]=R[-1]C[-1],R[-1]C+1,RC[-1]*100+1) -> 10406 | C43: =IF(RC[-2]=R[-1]C[-2],R[-1]C+1,1) -> 6 | D43: 13359 | E43: 30 | F43: 1 | G43: 1 | I43: 2002 | J43: 9
A44: 104 | B44: =IF(RC[-1]=R[-1]C[-1],R[-1]C+1,RC[-1]*100+1) -> 10407 | C44: =IF(RC[-2]=R[-1]C[-2],R[-1]C+1,1) -> 7 | D44: 13889 | E44: 1 | F44: 1 | G44: 1 | I44: 2002 | J44: 9
A45: 104 | B45: =IF(RC[-1]=R[-1]C[-1],R[-1]C+1,RC[-1]*100+1) -> 10408 | C45: =IF(RC[-2]=R[-1]C[-2],R[-1]C+1,1) -> 8 | D45: 13904 | E45: 1 | F45: 1 | G45: 1 | I45: 2002 | J45: 9
A46: 105 | B46: =IF(RC[-1]=R[-1]C[-1],R[-1]C+1,RC[-1]*100+1) -> 10501 | C46: =IF(RC[-2]=R[-1]C[-2],R[-1]C+1,1) -> 1 | D46: 10008 | E46: 250 | F46: 1 | G46: 1 | I46: 2001 | J46: 9
A47: 105 | B47: =IF(RC[-1]=R[-1]C[-1],R[-1]C+1,RC[-1]*100+1) -> 10502 | C47: =IF(RC[-2]=R[-1]C[-2],R[-1]C+1,1) -> 2 | D47: 10003 | E47: 100 | F47: 1 | G47: 1 | I47: 2001 | J47: 9
A48: 105 | B48: =IF(RC[-1]=R[-1]C[-1],R[-1]C+1,RC[-1]*100+1) -> 10503 | C48: =IF(RC[-2]=R[-1]C[-2],R[-1]C+1,1) -> 3 | D48: 13887 | E48: 1 | F48: 1 | G48: 1 | I48: 2001 | J48: 9
A49: 105 | B49: =IF(RC[-1]=R[-1]C[-1],R[-1]C+1,RC[-1]*100+1) -> 10504 | C49: =IF(RC[-2]=R[-1]C[-2],R[-1]C+1,1) -> 4 | D49: 13886 | E49: 1 | F49: 1 | G49: 1 | I49: 2001 | J49: 9
A50: 105 | B50: =IF(RC[-1]=R[-1]C[-1],R[-1]C+1,RC[-1]*100+1) -> 10505 | C50: =IF(RC[-2]=R[-1]C[-2],R[-1]C+1,1) -> 5 | D50: 13915 | E50: 1 | F50: 1 | G50: 1 | I50: 2002 | J50: 9
A51: 105 | B51: =IF(RC[-1]=R[-1]C[-1],R[-1]C+1,RC[-1]*100+1) -> 10506 | C51: =IF(RC[-2]=R[-1]C[-2],R[-1]C+1,1) -> 6 | D51: 13359 | E51: 30 | F51: 1 | G51: 1 | I51: 2002 | J51: 9
A52: 105 | B52: =IF(RC[-1]=R[-1]C[-1],R[-1]C+1,RC[-1]*100+1) -> 10507 | C52: =IF(RC[-2]=R[-1]C[-2],R[-1]C+1,1) -> 7 | D52: 13889 | E52: 1 | F52: 1 | G52: 1 | I52: 2002 | J52: 9
A53: 105 | B53: =IF(RC[-1]=R[-1]C[-1],R[-1]C+1,RC[-1]*100+1) -> 10508 | C53: =IF(RC[-2]=R[-1]C[-2],R[-1]C+1,1) -> 8 | D53: 13904 | E53: 1 | F53: 1 | G53: 1 | I53: 2002 | J53: 9
A54: 106 | B54: =IF(RC[-1]=R[-1]C[-1],R[-1]C+1,RC[-1]*100+1) -> 10601 | C54: =IF(RC[-2]=R[-1]C[-2],R[-1]C+1,1) -> 1 | D54: 19017 | E54: 1600 | F54: 3 | G54: 1 | I54: 2004 | J54: 9
A55: 106 | B55: =IF(RC[-1]=R[-1]C[-1],R[-1]C+1,RC[-1]*100+1) -> 10602 | C55: =IF(RC[-2]=R[-1]C[-2],R[-1]C+1,1) -> 2 | D55: 19032 | E55: 1600 | F55: 3 | G55: 1 | I55: 2004 | J55: 9
A56: 106 | B56: =IF(RC[-1]=R[-1]C[-1],R[-1]C+1,RC[-1]*100+1) -> 10603 | C56: =IF(RC[-2]=R[-1]C[-2],R[-1]C+1,1) -> 3 | D56: 10100 | E56: 4 | F56: 4 | G56: 1 | I56: 2004 | J56: 9
A57: 106 | B57: =IF(RC[-1]=R[-1]C[-1],R[-1]C+1,RC[-1]*100+1) -> 10604 | C57: =IF(RC[-2]=R[-1]C[-2],R[-1]C+1,1) -> 4 | D57: 19031 | E57: 1600 | F57: 3 | G57: 1 | I57: 2004 | J57: 9
A58: 106 | B58: =IF(RC[-1]=R[-1]C[-1],R[-1]C+1,RC[-1]*100+1) -> 10605 | C58: =IF(RC[-2]=R[-1]C[-2],R[-1]C+1,1) -> 5 | D58: 10003 | E58: 500 | F58: 4 | G58: 1 | I58: 2004 | J58: 9
A59: 106 | B59: =IF(RC[-1]=R[-1]C[-1],R[-1]C+1,RC[-1]*100+1) -> 10606 | C59: =IF(RC[-2]=R[-1]C[-2],R[-1]C+1,1) -> 6 | D59: 13942 | E59: 1 | F59: 1 | G59: 1 | I59: 2009 | J59: 9
A60: 106 | B60: =IF(RC[-1]=R[-1]C[-1],R[-1]C+1,RC[-1]*100+1) -> 10607 | C60: =IF(RC[-2]=R[-1]C[-2],R[-1]C+1,1) -> 7 | D60: 13943 | E60: 1 | F60: 1 | G60: 1 | I60: 2009 | J60: 9
A61: 106 | B61: =IF(RC[-1]=R[-1]C[-1],R[-1]C+1,RC[-1]*100+1) -> 10608 | C61: =IF(RC[-2]=R[-1]C[-2],R[-1]C+1,1) -> 8 | D61: 13959 | E61: 1 | F61: 1 | G61: 1 | I61: 2009 | J61: 9
A62: 106 | B62: =IF(RC[-1]=R[-1]C[-1],R[-1]C+1,RC[-1]*100+1) -> 10609 | C62: =IF(RC[-2]=R[-1]C[-2],R[-1]C+1,1) -> 9 | D62: 13946 | E62: 1 | F62: 1 | G62: 1 | I62: 2008 | J62: 9
A63: 106 | B63: =IF(RC[-1]=R[-1]C[-1],R[-1]C+1,RC[-1]*100+1) -> 10610 | C63: =IF(RC[-2]=R[-1]C[-2],R[-1]C+1,1) -> 10 | D63: 13947 | E63: 1 | F63: 1 | G63: 1 | I63: 2008 | J63: 9
A64: 107 | B64: =IF(RC[-1]=R[-1]C[-1],R[-1]C+1,RC[-1]*100+1) -> 10701 | C64: =IF(RC[-2]=R[-1]C[-2],R[-1]C+1,1) -> 1 | D64: 19017 | E64: 1600 | F64: 3 | G64: 1 | I64: 2004 | J64: 9
A65: 107 | B65: =IF(RC[-1]=R[-1]C[-1],R[-1]C+1,RC[-1]*100+1) -> 10702 | C65: =IF(RC[-2]=R[-1]C[-2],R[-1]C+1,1) -> 2 | D65: 19032 | E65: 1600 | F65: 3 | G65: 1 | I65: 2004 | J65: 9
A66: 107 | B66: =IF(RC[-1]=R[-1]C[-1],R[-1]C+1,RC[-1]*100+1) -> 10703 | C66: =IF(RC[-2]=R[-1]C[-2],R[-1]C+1,1) -> 3 | D66: 10100 | E66: 4 | F66: 4 | G66: 1 | I66: 2004 | J66: 9
A67: 107 | B67: =IF(RC[-1]=R[-1]C[-1],R[-1]C+1,RC[-1]*100+1) -> 10704 | C67: =IF(RC[-2]=R[-1]C[-2],R[-1]C+1,1) -> 4 | D67: 19031 | E67: 1600 | F67: 3 | G67: 1 | I67: 2004 | J67: 9
A68: 107 | B68: =IF(RC[-1]=R[-1]C[-1],R[-1]C+1,RC[-1]*100+1) -> 10705 | C68: =IF(RC[-2]=R[-1]C[-2],R[-1]C+1,1) -> 5 | D68: 10003 | E68: 500 | F68: 4 | G68: 1 | I68: 2004 | J68: 9
A69: 107 | B69: =IF(RC[-1]=R[-1]C[-1],R[-1]C+1,RC[-1]*100+1) -> 10706 | C69: =IF(RC[-2]=R[-1]C[-2],R[-1]C+1,1) -> 6 | D69: 13942 | E69: 1 | F69: 1 | G69: 1 | I69: 2009 | J69: 9
A70: 107 | B70: =IF(RC[-1]=R[-1]C[-1],R[-1]C+1,RC[-1]*100+1) -> 10707 | C70: =IF(RC[-2]=R[-1]C[-2],R[-1]C+1,1) -> 7 | D70: 13943 | E70: 1 | F70: 1 | G70: 1 | I70: 2009 | J70: 9
A71: 107 | B71: =IF(RC[-1]=R[-1]C[-1],R[-1]C+1,RC[-1]*100+1) -> 10708 | C71: =IF(RC[-2]=R[-1]C[-2],R[-1]C+1,1) -> 8 | D71: 13944 | E71: 1 | F71: 1 | G71: 1 | I71: 2008 | J71: 9
A72: 107 | B72: =IF(RC[-1]=R[-1]C[-1],R[-1]C+1,RC[-1]*100+1) -> 10709 | C72: =IF(RC[-2]=R[-1]C[-2],R[-1]C+1,1) -> 9 | D72: 13946 | E72: 1 | F72: 1 | G72: 1 | I72: 2008 | J72: 9
A73: 107 | B73: =IF(RC[-1]=R[-1]C[-1],R[-1]C+1,RC[-1]*100+1) -> 10710 | C73: =IF(RC[-2]=R[-1]C[-2],R[-1]C+1,1) -> 10 | D73: 13947 | E73: 1 | F73: 1 | G73: 1 | I73: 2008 | J73: 9
A74: 108 | B74: =IF(RC[-1]=R[-1]C[-1],R[-1]C+1,RC[-1]*100+1) -> 10801 | C74: =IF(RC[-2]=R[-1]C[-2],R[-1]C+1,1) -> 1 | D74: 19017 | E74: 1600 | F74: 3 | G74: 1 | I74: 2004 | J74: 9
A75: 108 | B75: =IF(RC[-1]=R[-1]C[-1],R[-1]C+1,RC[-1]*100+1) -> 10802 | C75: =IF(RC[-2]=R[-1]C[-2],R[-1]C+1,1) -> 2 | D75: 19032 | E75: 1600 | F75: 3 | G75: 1 | I75: 2004 | J75: 9
A76: 108 | B76: =IF(RC[-1]=R[-1]C[-1],R[-1]C+1,RC[-1]*100+1) -> 10803 | C76: =IF(RC[-2]=R[-1]C[-2],R[-1]C+1,1) -> 3 | D76: 10100 | E76: 3 | F76: 4 | G76: 1 | I76: 2004 | J76: 9
A77: 108 | B77: =IF(RC[-1]=R[-1]C[-1],R[-1]C+1,RC[-1]*100+1) -> 10804 | C77: =IF(RC[-2]=R[-1]C[-2],R[-1]C+1,1) -> 4 | D77: 19031 | E77: 1600 | F77: 3 | G77: 1 | I77: 2004 | J77: 9
A78: 108 | B78: =IF(RC[-1]=R[-1]C[-1],R[-1]C+1,RC[-1]*100+1) -> 10805 | C78: =IF(RC[-2]=R[-1]C[-2],R[-1]C+1,1) -> 5 | D78: 10003 | E78: 500 | F78: 4 | G78: 1 | I78: 2004 | J78: 9
A79: 108 | B79: =IF(RC[-1]=R[-1]C[-1],R[-1]C+1,RC[-1]*100+1) -> 10806 | C79: =IF(RC[-2]=R[-1]C[-2],R[-1]C+1,1) -> 6 | D79: 13942 | E79: 1 | F79: 1 | G79: 1 | I79: 2009 | J79: 9
A80: 108 | B80: =IF(RC[-1]=R[-1]C[-1],R[-1]C+1,RC[-1]*100+1) -> 10807 | C80: =IF(RC[-2]=R[-1]C[-2],R[-1]C+1,1) -> 7 | D80: 13943 | E80: 1 | F80: 1 | G80: 1 | I80: 2009 | J80: 9
A81: 108 | B81: =IF(RC[-1]=R[-1]C[-1],R[-1]C+1,RC[-1]*100+1) -> 10808 | C81: =IF(RC[-2]=R[-1]C[-2],R[-1]C+1,1) -> 8 | D81: 13944 | E81: 1 | F81: 1 | G81: 1 | I81: 2008 | J81: 9