Sheet: 配置
A1: 服务端文件名 | B1: 服务端对应工作表号 | C1: 客户端文件名 | D1: 客户端对应工作表号 | E1: erl头部 | F1: erl内容格式 | G1: erl尾部 | H1: 客户端特殊处理
A2: world_task_level.txt | B2: 1 | C2: config_world_task_level.cnf|WorldTaskLevel | D2: 1 | F2: get(days) -> #$ | H2: 2=>days
A3: world_level_task_id_list.txt | B3: 2 | C3: config_world_level_task_id_list.cnf|WorldLevelTaskIdList | D3: 2 | F3: get(task_level) -> #$ | H3: 2=>task_level
A4: world_level_task_event.txt | B4: 3 | C4: config_world_level_task_event.cnf|WorldLevelTaskEvent | D4: 3 | F4: get(task_id) -> #$ | H4: 2=>task_id

Sheet: 世界任务等级
A1: days|days | B1: world_level|world_level | C1: reward_level_section|reward_level_section | D1: reward_id_list|reward_id_list | E1: reward_num_list|reward_num_list
A2: 不可空 | B2: 不可空 | C2: 可空#不需字段 | D2: 可空#不需字段 | E2: 可空#不需字段
A3: 数字 | B3: 数字 | C3: 一维数组 | D3: 二维数组 | E3: 二维数组
C4: 不定长 | D4: 不定长 | E4: 不定长
A6: 开服天数 | B6: 世界等级 | C6: 最终奖励等级区间 | D6: 最终奖励ID列表 | E6: 最终奖励数量列表
A7: 1 | B7: 0 | C7: 0 | D7: 0 | E7: 0
A8: 2 | B8: 27 | C8: =RC[3]&IF(RC[4]="","|200","|"&RC[4]&IF(RC[5]="","|200","|"&RC[5]&IF(RC[6]="","|200","|"&RC[6]&IF(RC[7]="","|200","|"&RC[7]&"|200")))) -> 24|200 | D8: =RC[7]&IF(RC[8]="","","#"&RC[8]&IF(RC[9]="","","#"&RC[9]&IF(RC[10]="","","#"&RC[10]&IF(RC[11]="","","#"&RC[11])))) -> 13426#19006 | E8: =RC[11]&IF(RC[12]="","","#"&RC[12]&IF(RC[13]="","","#"&RC[13]&IF(RC[14]="","","#"&RC[14]&IF(RC[15]="","","#"&RC[15])))) -> 1#1000 | F8: 24 | K8: 13426 | L8: 19006 | P8: 1 | Q8: 1000 | U8: 24以下：橙品英雄3选1（野蛮巨人、德古拉伯爵、火女）；25以上：魂晶
A9: 3 | B9: 31 | C9: =RC[3]&IF(RC[4]="","|200","|"&RC[4]&IF(RC[5]="","|200","|"&RC[5]&IF(RC[6]="","|200","|"&RC[6]&IF(RC[7]="","|200","|"&RC[7]&"|200")))) -> 24|28|200 | D9: =RC[7]&IF(RC[8]="","","#"&RC[8]&IF(RC[9]="","","#"&RC[9]&IF(RC[10]="","","#"&RC[10]&IF(RC[11]="","","#"&RC[11])))) -> 13426#19006#10014 | E9: =RC[11]&IF(RC[12]="","","#"&RC[12]&IF(RC[13]="","","#"&RC[13]&IF(RC[14]="","","#"&RC[14]&IF(RC[15]="","","#"&RC[15])))) -> 1#1000#50 | F9: 24 | G9: 28 | K9: =R[-1]C -> 13426 | L9: =R[-1]C -> 19006 | M9: 10014 | P9: 1 | Q9: 1000 | R9: 50 | U9: 24以下：橙品英雄3选1；25~28：魂晶；29以上：装备精炼石
A10: 4 | B10: 33 | C10: =RC[3]&IF(RC[4]="","|200","|"&RC[4]&IF(RC[5]="","|200","|"&RC[5]&IF(RC[6]="","|200","|"&RC[6]&IF(RC[7]="","|200","|"&RC[7]&"|200")))) -> 24|28|34|200 | D10: =RC[7]&IF(RC[8]="","","#"&RC[8]&IF(RC[9]="","","#"&RC[9]&IF(RC[10]="","","#"&RC[10]&IF(RC[11]="","","#"&RC[11])))) -> 13426#19006#10014#10004 | E10: =RC[11]&IF(RC[12]="","","#"&RC[12]&IF(RC[13]="","","#"&RC[13]&IF(RC[14]="","","#"&RC[14]&IF(RC[15]="","","#"&RC[15])))) -> 1#1000#50#100 | F10: 24 | G10: 28 | H10: 34 | K10: =R[-1]C -> 13426 | L10: =R[-1]C -> 19006 | M10: =R[-1]C -> 10014 | N10: 10004 | P10: 1 | Q10: 1000 | R10: 50 | S10: 100 | U10: 24以下：橙品英雄3选1；25~28：魂晶；29~34：装备精炼石；35以上：潜能合剂
A11: 5 | B11: 35 | C11: =RC[3]&IF(RC[4]="","|200","|"&RC[4]&IF(RC[5]="","|200","|"&RC[5]&IF(RC[6]="","|200","|"&RC[6]&IF(RC[7]="","|200","|"&RC[7]&"|200")))) -> 28|34|36|200 | D11: =RC[7]&IF(RC[8]="","","#"&RC[8]&IF(RC[9]="","","#"&RC[9]&IF(RC[10]="","","#"&RC[10]&IF(RC[11]="","","#"&RC[11])))) -> 13438#10014#10004#13324 | E11: =RC[11]&IF(RC[12]="","","#"&RC[12]&IF(RC[13]="","","#"&RC[13]&IF(RC[14]="","","#"&RC[14]&IF(RC[15]="","","#"&RC[15])))) -> 1#50#100#1 | F11: 28 | G11: 34 | H11: 36 | K11: 13438 | L11: 10014 | M11: 10004 | N11: 13324 | P11: 1 | Q11: 50 | R11: 100 | S11: 1 | U11: 28以下：任选橙品合击组合（20资合击一对）；29~34：装备精炼石；35~36：潜能合剂；37以上：任选精灵升华道具
A12: 6 | B12: 36 | C12: =RC[3]&IF(RC[4]="","|200","|"&RC[4]&IF(RC[5]="","|200","|"&RC[5]&IF(RC[6]="","|200","|"&RC[6]&IF(RC[7]="","|200","|"&RC[7]&"|200")))) -> 28|34|36|38|200 | D12: =RC[7]&IF(RC[8]="","","#"&RC[8]&IF(RC[9]="","","#"&RC[9]&IF(RC[10]="","","#"&RC[10]&IF(RC[11]="","","#"&RC[11])))) -> 13438#10014#10004#13324#10010 | E12: =RC[11]&IF(RC[12]="","","#"&RC[12]&IF(RC[13]="","","#"&RC[13]&IF(RC[14]="","","#"&RC[14]&IF(RC[15]="","","#"&RC[15])))) -> 1#50#100#1#150 | F12: 28 | G12: 34 | H12: 36 | I12: 38 | K12: =R[-1]C -> 13438 | L12: =R[-1]C -> 10014 | M12: =R[-1]C -> 10004 | N12: =R[-1]C -> 13324 | O12: 10010 | P12: 1 | Q12: 50 | R12: 100 | S12: 1 | T12: 150 | U12: 28以下：任选橙品合击组合；29~34：装备精炼石；35~36：潜能合剂；37~38：任选精灵升华道具；39以上：圣器精炼石
A13: 7 | B13: 38 | C13: =RC[3]&IF(RC[4]="","|200","|"&RC[4]&IF(RC[5]="","|200","|"&RC[5]&IF(RC[6]="","|200","|"&RC[6]&IF(RC[7]="","|200","|"&RC[7]&"|200")))) -> 28|34|36|38|200 | D13: =RC[7]&IF(RC[8]="","","#"&RC[8]&IF(RC[9]="","","#"&RC[9]&IF(RC[10]="","","#"&RC[10]&IF(RC[11]="","","#"&RC[11])))) -> 13439#10014#10004#13324#10010 | E13: =RC[11]&IF(RC[12]="","","#"&RC[12]&IF(RC[13]="","","#"&RC[13]&IF(RC[14]="","","#"&RC[14]&IF(RC[15]="","","#"&RC[15])))) -> 1#50#100#1#150 | F13: 28 | G13: 34 | H13: 36 | I13: 38 | K13: 13439 | L13: =R[-1]C -> 10014 | M13: =R[-1]C -> 10004 | N13: =R[-1]C -> 13324 | O13: =R[-1]C -> 10010 | P13: 1 | Q13: 50 | R13: 100 | S13: 1 | T13: 150 | U13: 28以下：最强橙品合击组合（25+20资合击一对）；29~34：装备精炼石；35~36：潜能合剂；37~38：任选精灵升华道具；39以上：圣器精炼石
A14: 8 | B14: 39 | C14: =RC[3]&IF(RC[4]="","|200","|"&RC[4]&IF(RC[5]="","|200","|"&RC[5]&IF(RC[6]="","|200","|"&RC[6]&IF(RC[7]="","|200","|"&RC[7]&"|200")))) -> 28|34|38|200 | D14: =RC[7]&IF(RC[8]="","","#"&RC[8]&IF(RC[9]="","","#"&RC[9]&IF(RC[10]="","","#"&RC[10]&IF(RC[11]="","","#"&RC[11])))) -> 13439#10014#10004#10010 | E14: =RC[11]&IF(RC[12]="","","#"&RC[12]&IF(RC[13]="","","#"&RC[13]&IF(RC[14]="","","#"&RC[14]&IF(RC[15]="","","#"&RC[15])))) -> 1#50#100#150 | F14: 28 | G14: 34 | H14: 38 | K14: =R[-1]C -> 13439 | L14: =R[-1]C -> 10014 | M14: =R[-1]C -> 10004 | N14: 10010 | P14: 1 | Q14: 50 | R14: 100 | S14: 150 | U14: 28以下：最强橙品合击组合；29~34：装备精炼石；35~38：潜能合剂；39以上：圣器精炼石
A15: 9 | B15: 40 | C15: =RC[3]&IF(RC[4]="","|200","|"&RC[4]&IF(RC[5]="","|200","|"&RC[5]&IF(RC[6]="","|200","|"&RC[6]&IF(RC[7]="","|200","|"&RC[7]&"|200")))) -> 28|34|38|200 | D15: =RC[7]&IF(RC[8]="","","#"&RC[8]&IF(RC[9]="","","#"&RC[9]&IF(RC[10]="","","#"&RC[10]&IF(RC[11]="","","#"&RC[11])))) -> 13439#10014#10004#10010 | E15: =RC[11]&IF(RC[12]="","","#"&RC[12]&IF(RC[13]="","","#"&RC[13]&IF(RC[14]="","","#"&RC[14]&IF(RC[15]="","","#"&RC[15])))) -> 1#50#100#150 | F15: 28 | G15: 34 | H15: 38 | K15: =R[-1]C -> 13439 | L15: =R[-1]C -> 10014 | M15: =R[-1]C -> 10004 | N15: =R[-1]C -> 10010 | P15: =R[-1]C -> 1 | Q15: =R[-1]C -> 50 | R15: =R[-1]C -> 100 | S15: =R[-1]C -> 150 | U15: 同上
A16: 10 | B16: 41 | C16: =RC[3]&IF(RC[4]="","|200","|"&RC[4]&IF(RC[5]="","|200","|"&RC[5]&IF(RC[6]="","|200","|"&RC[6]&IF(RC[7]="","|200","|"&RC[7]&"|200")))) -> 28|34|38|200 | D16: =RC[7]&IF(RC[8]="","","#"&RC[8]&IF(RC[9]="","","#"&RC[9]&IF(RC[10]="","","#"&RC[10]&IF(RC[11]="","","#"&RC[11])))) -> 13439#10014#10004#10010 | E16: =RC[11]&IF(RC[12]="","","#"&RC[12]&IF(RC[13]="","","#"&RC[13]&IF(RC[14]="","","#"&RC[14]&IF(RC[15]="","","#"&RC[15])))) -> 1#50#100#150 | F16: 28 | G16: 34 | H16: 38 | K16: =R[-1]C -> 13439 | L16: =R[-1]C -> 10014 | M16: =R[-1]C -> 10004 | N16: =R[-1]C -> 10010 | P16: =R[-1]C -> 1 | Q16: =R[-1]C -> 50 | R16: =R[-1]C -> 100 | S16: =R[-1]C -> 150 | U16: 同上
A17: 11 | B17: 42 | C17: =RC[3]&IF(RC[4]="","|200","|"&RC[4]&IF(RC[5]="","|200","|"&RC[5]&IF(RC[6]="","|200","|"&RC[6]&IF(RC[7]="","|200","|"&RC[7]&"|200")))) -> 28|34|38|44|200 | D17: =RC[7]&IF(RC[8]="","","#"&RC[8]&IF(RC[9]="","","#"&RC[9]&IF(RC[10]="","","#"&RC[10]&IF(RC[11]="","","#"&RC[11])))) -> 13439#10014#10004#10010#10008 | E17: =RC[11]&IF(RC[12]="","","#"&RC[12]&IF(RC[13]="","","#"&RC[13]&IF(RC[14]="","","#"&RC[14]&IF(RC[15]="","","#"&RC[15])))) -> 1#50#100#150#200 | F17: 28 | G17: 34 | H17: 38 | I17: 44 | K17: =R[-1]C -> 13439 | L17: =R[-1]C -> 10014 | M17: =R[-1]C -> 10004 | N17: =R[-1]C -> 10010 | O17: 10008 | P17: 1 | Q17: 50 | R17: 100 | S17: 150 | T17: 200 | U17: 28以下：最强橙品合击组合；29~34：装备精炼石；35~38：潜能合剂；39~44：圣器精炼石；45以上：觉醒水晶
A18: 12 | B18: 42 | C18: =RC[3]&IF(RC[4]="","|200","|"&RC[4]&IF(RC[5]="","|200","|"&RC[5]&IF(RC[6]="","|200","|"&RC[6]&IF(RC[7]="","|200","|"&RC[7]&"|200")))) -> 28|34|38|44|200 | D18: =RC[7]&IF(RC[8]="","","#"&RC[8]&IF(RC[9]="","","#"&RC[9]&IF(RC[10]="","","#"&RC[10]&IF(RC[11]="","","#"&RC[11])))) -> 13439#10014#10004#10010#10008 | E18: =RC[11]&IF(RC[12]="","","#"&RC[12]&IF(RC[13]="","","#"&RC[13]&IF(RC[14]="","","#"&RC[14]&IF(RC[15]="","","#"&RC[15])))) -> 1#50#100#150#200 | F18: 28 | G18: 34 | H18: 38 | I18: 44 | K18: =R[-1]C -> 13439 | L18: =R[-1]C -> 10014 | M18: =R[-1]C -> 10004 | N18: =R[-1]C -> 10010 | O18: =R[-1]C -> 10008 | P18: =R[-1]C -> 1 | Q18: =R[-1]C -> 50 | R18: =R[-1]C -> 100 | S18: =R[-1]C -> 150 | T18: =R[-1]C -> 200 | U18: 同上
A19: 13 | B19: 43 | C19: =RC[3]&IF(RC[4]="","|200","|"&RC[4]&IF(RC[5]="","|200","|"&RC[5]&IF(RC[6]="","|200","|"&RC[6]&IF(RC[7]="","|200","|"&RC[7]&"|200")))) -> 28|34|38|44|200 | D19: =RC[7]&IF(RC[8]="","","#"&RC[8]&IF(RC[9]="","","#"&RC[9]&IF(RC[10]="","","#"&RC[10]&IF(RC[11]="","","#"&RC[11])))) -> 13439#10014#10004#10010#10008 | E19: =RC[11]&IF(RC[12]="","","#"&RC[12]&IF(RC[13]="","","#"&RC[13]&IF(RC[14]="","","#"&RC[14]&IF(RC[15]="","","#"&RC[15])))) -> 1#50#100#150#200 | F19: 28 | G19: 34 | H19: 38 | I19: 44 | K19: =R[-1]C -> 13439 | L19: =R[-1]C -> 10014 | M19: =R[-1]C -> 10004 | N19: =R[-1]C -> 10010 | O19: =R[-1]C -> 10008 | P19: =R[-1]C -> 1 | Q19: =R[-1]C -> 50 | R19: =R[-1]C -> 100 | S19: =R[-1]C -> 150 | T19: =R[-1]C -> 200 | U19: 同上
A20: 14 | B20: 44 | C20: =RC[3]&IF(RC[4]="","|200","|"&RC[4]&IF(RC[5]="","|200","|"&RC[5]&IF(RC[6]="","|200","|"&RC[6]&IF(RC[7]="","|200","|"&RC[7]&"|200")))) -> 28|34|38|44|200 | D20: =RC[7]&IF(RC[8]="","","#"&RC[8]&IF(RC[9]="","","#"&RC[9]&IF(RC[10]="","","#"&RC[10]&IF(RC[11]="","","#"&RC[11])))) -> 13439#10014#10004#10010#10008 | E20: =RC[11]&IF(RC[12]="","","#"&RC[12]&IF(RC[13]="","","#"&RC[13]&IF(RC[14]="","","#"&RC[14]&IF(RC[15]="","","#"&RC[15])))) -> 1#50#100#150#200 | F20: 28 | G20: 34 | H20: 38 | I20: 44 | K20: =R[-1]C -> 13439 | L20: =R[-1]C -> 10014 | M20: =R[-1]C -> 10004 | N20: =R[-1]C -> 10010 | O20: =R[-1]C -> 10008 | P20: =R[-1]C -> 1 | Q20: =R[-1]C -> 50 | R20: =R[-1]C -> 100 | S20: =R[-1]C -> 150 | T20: =R[-1]C -> 200 | U20: 同上
A21: 15 | B21: 45 | C21: =RC[3]&IF(RC[4]="","|200","|"&RC[4]&IF(RC[5]="","|200","|"&RC[5]&IF(RC[6]="","|200","|"&RC[6]&IF(RC[7]="","|200","|"&RC[7]&"|200")))) -> 28|34|38|44|200 | D21: =RC[7]&IF(RC[8]="","","#"&RC[8]&IF(RC[9]="","","#"&RC[9]&IF(RC[10]="","","#"&RC[10]&IF(RC[11]="","","#"&RC[11])))) -> 13439#10014#10004#10010#10008 | E21: =RC[11]&IF(RC[12]="","","#"&RC[12]&IF(RC[13]="","","#"&RC[13]&IF(RC[14]="","","#"&RC[14]&IF(RC[15]="","","#"&RC[15])))) -> 1#50#100#150#200 | F21: 28 | G21: 34 | H21: 38 | I21: 44 | K21: =R[-1]C -> 13439 | L21: =R[-1]C -> 10014 | M21: =R[-1]C -> 10004 | N21: =R[-1]C -> 10010 | O21: =R[-1]C -> 10008 | P21: =R[-1]C -> 1 | Q21: =R[-1]C -> 50 | R21: =R[-1]C -> 100 | S21: =R[-1]C -> 150 | T21: =R[-1]C -> 200 | U21: 同上
A22: 16 | B22: 45 | C22: =RC[3]&IF(RC[4]="","|200","|"&RC[4]&IF(RC[5]="","|200","|"&RC[5]&IF(RC[6]="","|200","|"&RC[6]&IF(RC[7]="","|200","|"&RC[7]&"|200")))) -> 28|34|38|44|200 | D22: =RC[7]&IF(RC[8]="","","#"&RC[8]&IF(RC[9]="","","#"&RC[9]&IF(RC[10]="","","#"&RC[10]&IF(RC[11]="","","#"&RC[11])))) -> 13439#10014#10004#10010#10008 | E22: =RC[11]&IF(RC[12]="","","#"&RC[12]&IF(RC[13]="","","#"&RC[13]&IF(RC[14]="","","#"&RC[14]&IF(RC[15]="","","#"&RC[15])))) -> 1#50#100#150#200 | F22: 28 | G22: 34 | H22: 38 | I22: 44 | K22: =R[-1]C -> 13439 | L22: =R[-1]C -> 10014 | M22: =R[-1]C -> 10004 | N22: =R[-1]C -> 10010 | O22: =R[-1]C -> 10008 | P22: =R[-1]C -> 1 | Q22: =R[-1]C -> 50 | R22: =R[-1]C -> 100 | S22: =R[-1]C -> 150 | T22: =R[-1]C -> 200 | U22: 同上
A23: 17 | B23: 46 | C23: =RC[3]&IF(RC[4]="","|200","|"&RC[4]&IF(RC[5]="","|200","|"&RC[5]&IF(RC[6]="","|200","|"&RC[6]&IF(RC[7]="","|200","|"&RC[7]&"|200")))) -> 28|34|38|44|200 | D23: =RC[7]&IF(RC[8]="","","#"&RC[8]&IF(RC[9]="","","#"&RC[9]&IF(RC[10]="","","#"&RC[10]&IF(RC[11]="","","#"&RC[11])))) -> 13439#10014#10004#10010#10008 | E23: =RC[11]&IF(RC[12]="","","#"&RC[12]&IF(RC[13]="","","#"&RC[13]&IF(RC[14]="","","#"&RC[14]&IF(RC[15]="","","#"&RC[15])))) -> 1#50#100#150#200 | F23: 28 | G23: 34 | H23: 38 | I23: 44 | K23: =R[-1]C -> 13439 | L23: =R[-1]C -> 10014 | M23: =R[-1]C -> 10004 | N23: =R[-1]C -> 10010 | O23: =R[-1]C -> 10008 | P23: =R[-1]C -> 1 | Q23: =R[-1]C -> 50 | R23: =R[-1]C -> 100 | S23: =R[-1]C -> 150 | T23: =R[-1]C -> 200 | U23: 同上
A24: 18 | B24: 46 | C24: =RC[3]&IF(RC[4]="","|200","|"&RC[4]&IF(RC[5]="","|200","|"&RC[5]&IF(RC[6]="","|200","|"&RC[6]&IF(RC[7]="","|200","|"&RC[7]&"|200")))) -> 28|34|38|44|200 | D24: =RC[7]&IF(RC[8]="","","#"&RC[8]&IF(RC[9]="","","#"&RC[9]&IF(RC[10]="","","#"&RC[10]&IF(RC[11]="","","#"&RC[11])))) -> 13439#10014#10004#10010#10008 | E24: =RC[11]&IF(RC[12]="","","#"&RC[12]&IF(RC[13]="","","#"&RC[13]&IF(RC[14]="","","#"&RC[14]&IF(RC[15]="","","#"&RC[15])))) -> 1#50#100#150#200 | F24: 28 | G24: 34 | H24: 38 | I24: 44 | K24: =R[-1]C -> 13439 | L24: =R[-1]C -> 10014 | M24: =R[-1]C -> 10004 | N24: =R[-1]C -> 10010 | O24: =R[-1]C -> 10008 | P24: =R[-1]C -> 1 | Q24: =R[-1]C -> 50 | R24: =R[-1]C -> 100 | S24: =R[-1]C -> 150 | T24: =R[-1]C -> 200 | U24: 同上
A25: 19 | B25: 47 | C25: =RC[3]&IF(RC[4]="","|200","|"&RC[4]&IF(RC[5]="","|200","|"&RC[5]&IF(RC[6]="","|200","|"&RC[6]&IF(RC[7]="","|200","|"&RC[7]&"|200")))) -> 28|34|38|44|200 | D25: =RC[7]&IF(RC[8]="","","#"&RC[8]&IF(RC[9]="","","#"&RC[9]&IF(RC[10]="","","#"&RC[10]&IF(RC[11]="","","#"&RC[11])))) -> 13439#10014#10004#10010#10008 | E25: =RC[11]&IF(RC[12]="","","#"&RC[12]&IF(RC[13]="","","#"&RC[13]&IF(RC[14]="","","#"&RC[14]&IF(RC[15]="","","#"&RC[15])))) -> 1#50#100#150#200 | F25: 28 | G25: 34 | H25: 38 | I25: 44 | K25: =R[-1]C -> 13439 | L25: =R[-1]C -> 10014 | M25: =R[-1]C -> 10004 | N25: =R[-1]C -> 10010 | O25: =R[-1]C -> 10008 | P25: =R[-1]C -> 1 | Q25: =R[-1]C -> 50 | R25: =R[-1]C -> 100 | S25: =R[-1]C -> 150 | T25: =R[-1]C -> 200 | U25: 同上
A26: 20 | B26: 47 | C26: =RC[3]&IF(RC[4]="","|200","|"&RC[4]&IF(RC[5]="","|200","|"&RC[5]&IF(RC[6]="","|200","|"&RC[6]&IF(RC[7]="","|200","|"&RC[7]&"|200")))) -> 28|34|38|44|200 | D26: =RC[7]&IF(RC[8]="","","#"&RC[8]&IF(RC[9]="","","#"&RC[9]&IF(RC[10]="","","#"&RC[10]&IF(RC[11]="","","#"&RC[11])))) -> 13439#10014#10004#10010#10008 | E26: =RC[11]&IF(RC[12]="","","#"&RC[12]&IF(RC[13]="","","#"&RC[13]&IF(RC[14]="","","#"&RC[14]&IF(RC[15]="","","#"&RC[15])))) -> 1#50#100#150#200 | F26: 28 | G26: 34 | H26: 38 | I26: 44 | K26: =R[-1]C -> 13439 | L26: =R[-1]C -> 10014 | M26: =R[-1]C -> 10004 | N26: =R[-1]C -> 10010 | O26: =R[-1]C -> 10008 | P26: =R[-1]C -> 1 | Q26: =R[-1]C -> 50 | R26: =R[-1]C -> 100 | S26: =R[-1]C -> 150 | T26: =R[-1]C -> 200 | U26: 同上
A27: 21 | B27: 48 | C27: =RC[3]&IF(RC[4]="","|200","|"&RC[4]&IF(RC[5]="","|200","|"&RC[5]&IF(RC[6]="","|200","|"&RC[6]&IF(RC[7]="","|200","|"&RC[7]&"|200")))) -> 28|34|38|44|200 | D27: =RC[7]&IF(RC[8]="","","#"&RC[8]&IF(RC[9]="","","#"&RC[9]&IF(RC[10]="","","#"&RC[10]&IF(RC[11]="","","#"&RC[11])))) -> 13439#10014#10004#10010#10008 | E27: =RC[11]&IF(RC[12]="","","#"&RC[12]&IF(RC[13]="","","#"&RC[13]&IF(RC[14]="","","#"&RC[14]&IF(RC[15]="","","#"&RC[15])))) -> 1#50#100#150#200 | F27: 28 | G27: 34 | H27: 38 | I27: 44 | K27: =R[-1]C -> 13439 | L27: =R[-1]C -> 10014 | M27: =R[-1]C -> 10004 | N27: =R[-1]C -> 10010 | O27: =R[-1]C -> 10008 | P27: =R[-1]C -> 1 | Q27: =R[-1]C -> 50 | R27: =R[-1]C -> 100 | S27: =R[-1]C -> 150 | T27: =R[-1]C -> 200 | U27: 同上
A28: 22 | B28: 48 | C28: =RC[3]&IF(RC[4]="","|200","|"&RC[4]&IF(RC[5]="","|200","|"&RC[5]&IF(RC[6]="","|200","|"&RC[6]&IF(RC[7]="","|200","|"&RC[7]&"|200")))) -> 28|34|38|44|200 | D28: =RC[7]&IF(RC[8]="","","#"&RC[8]&IF(RC[9]="","","#"&RC[9]&IF(RC[10]="","","#"&RC[10]&IF(RC[11]="","","#"&RC[11])))) -> 13439#10014#10004#10010#10008 | E28: =RC[11]&IF(RC[12]="","","#"&RC[12]&IF(RC[13]="","","#"&RC[13]&IF(RC[14]="","","#"&RC[14]&IF(RC[15]="","","#"&RC[15])))) -> 1#50#100#150#200 | F28: 28 | G28: 34 | H28: 38 | I28: 44 | K28: =R[-1]C -> 13439 | L28: =R[-1]C -> 10014 | M28: =R[-1]C -> 10004 | N28: =R[-1]C -> 10010 | O28: =R[-1]C -> 10008 | P28: =R[-1]C -> 1 | Q28: =R[-1]C -> 50 | R28: =R[-1]C -> 100 | S28: =R[-1]C -> 150 | T28: =R[-1]C -> 200 | U28: 同上
A29: 23 | B29: 49 | C29: =RC[3]&IF(RC[4]="","|200","|"&RC[4]&IF(RC[5]="","|200","|"&RC[5]&IF(RC[6]="","|200","|"&RC[6]&IF(RC[7]="","|200","|"&RC[7]&"|200")))) -> 28|34|38|44|200 | D29: =RC[7]&IF(RC[8]="","","#"&RC[8]&IF(RC[9]="","","#"&RC[9]&IF(RC[10]="","","#"&RC[10]&IF(RC[11]="","","#"&RC[11])))) -> 13439#10014#10004#10010#10008 | E29: =RC[11]&IF(RC[12]="","","#"&RC[12]&IF(RC[13]="","","#"&RC[13]&IF(RC[14]="","","#"&RC[14]&IF(RC[15]="","","#"&RC[15])))) -> 1#50#100#150#200 | F29: 28 | G29: 34 | H29: 38 | I29: 44 | K29: =R[-1]C -> 13439 | L29: =R[-1]C -> 10014 | M29: =R[-1]C -> 10004 | N29: =R[-1]C -> 10010 | O29: =R[-1]C -> 10008 | P29: =R[-1]C -> 1 | Q29: =R[-1]C -> 50 | R29: =R[-1]C -> 100 | S29: =R[-1]C -> 150 | T29: =R[-1]C -> 200 | U29: 同上
A30: 24 | B30: 49 | C30: =RC[3]&IF(RC[4]="","|200","|"&RC[4]&IF(RC[5]="","|200","|"&RC[5]&IF(RC[6]="","|200","|"&RC[6]&IF(RC[7]="","|200","|"&RC[7]&"|200")))) -> 28|34|38|44|200 | D30: =RC[7]&IF(RC[8]="","","#"&RC[8]&IF(RC[9]="","","#"&RC[9]&IF(RC[10]="","","#"&RC[10]&IF(RC[11]="","","#"&RC[11])))) -> 13439#10014#10004#10010#10008 | E30: =RC[11]&IF(RC[12]="","","#"&RC[12]&IF(RC[13]="","","#"&RC[13]&IF(RC[14]="","","#"&RC[14]&IF(RC[15]="","","#"&RC[15])))) -> 1#50#100#150#200 | F30: 28 | G30: 34 | H30: 38 | I30: 44 | K30: =R[-1]C -> 13439 | L30: =R[-1]C -> 10014 | M30: =R[-1]C -> 10004 | N30: =R[-1]C -> 10010 | O30: =R[-1]C -> 10008 | P30: =R[-1]C -> 1 | Q30: =R[-1]C -> 50 | R30: =R[-1]C -> 100 | S30: =R[-1]C -> 150 | T30: =R[-1]C -> 200 | U30: 同上
A31: 25 | B31: 49 | C31: =RC[3]&IF(RC[4]="","|200","|"&RC[4]&IF(RC[5]="","|200","|"&RC[5]&IF(RC[6]="","|200","|"&RC[6]&IF(RC[7]="","|200","|"&RC[7]&"|200")))) -> 28|34|38|44|200 | D31: =RC[7]&IF(RC[8]="","","#"&RC[8]&IF(RC[9]="","","#"&RC[9]&IF(RC[10]="","","#"&RC[10]&IF(RC[11]="","","#"&RC[11])))) -> 13439#10014#10004#10010#10008 | E31: =RC[11]&IF(RC[12]="","","#"&RC[12]&IF(RC[13]="","","#"&RC[13]&IF(RC[14]="","","#"&RC[14]&IF(RC[15]="","","#"&RC[15])))) -> 1#50#100#150#200 | F31: 28 | G31: 34 | H31: 38 | I31: 44 | K31: =R[-1]C -> 13439 | L31: =R[-1]C -> 10014 | M31: =R[-1]C -> 10004 | N31: =R[-1]C -> 10010 | O31: =R[-1]C -> 10008 | P31: =R[-1]C -> 1 | Q31: =R[-1]C -> 50 | R31: =R[-1]C -> 100 | S31: =R[-1]C -> 150 | T31: =R[-1]C -> 200 | U31: 同上
A32: 26 | B32: 50 | C32: =RC[3]&IF(RC[4]="","|200","|"&RC[4]&IF(RC[5]="","|200","|"&RC[5]&IF(RC[6]="","|200","|"&RC[6]&IF(RC[7]="","|200","|"&RC[7]&"|200")))) -> 28|34|38|44|200 | D32: =RC[7]&IF(RC[8]="","","#"&RC[8]&IF(RC[9]="","","#"&RC[9]&IF(RC[10]="","","#"&RC[10]&IF(RC[11]="","","#"&RC[11])))) -> 13439#10014#10004#10010#10008 | E32: =RC[11]&IF(RC[12]="","","#"&RC[12]&IF(RC[13]="","","#"&RC[13]&IF(RC[14]="","","#"&RC[14]&IF(RC[15]="","","#"&RC[15])))) -> 1#50#100#150#200 | F32: 28 | G32: 34 | H32: 38 | I32: 44 | K32: =R[-1]C -> 13439 | L32: =R[-1]C -> 10014 | M32: =R[-1]C -> 10004 | N32: =R[-1]C -> 10010 | O32: =R[-1]C -> 10008 | P32: =R[-1]C -> 1 | Q32: =R[-1]C -> 50 | R32: =R[-1]C -> 100 | S32: =R[-1]C -> 150 | T32: =R[-1]C -> 200 | U32: 同上
A33: 27 | B33: 50 | C33: =RC[3]&IF(RC[4]="","|200","|"&RC[4]&IF(RC[5]="","|200","|"&RC[5]&IF(RC[6]="","|200","|"&RC[6]&IF(RC[7]="","|200","|"&RC[7]&"|200")))) -> 28|34|38|44|200 | D33: =RC[7]&IF(RC[8]="","","#"&RC[8]&IF(RC[9]="","","#"&RC[9]&IF(RC[10]="","","#"&RC[10]&IF(RC[11]="","","#"&RC[11])))) -> 13439#10014#10004#10010#10008 | E33: =RC[11]&IF(RC[12]="","","#"&RC[12]&IF(RC[13]="","","#"&RC[13]&IF(RC[14]="","","#"&RC[14]&IF(RC[15]="","","#"&RC[15])))) -> 1#50#100#150#200 | F33: 28 | G33: 34 | H33: 38 | I33: 44 | K33: =R[-1]C -> 13439 | L33: =R[-1]C -> 10014 | M33: =R[-1]C -> 10004 | N33: =R[-1]C -> 10010 | O33: =R[-1]C -> 10008 | P33: =R[-1]C -> 1 | Q33: =R[-1]C -> 50 | R33: =R[-1]C -> 100 | S33: =R[-1]C -> 150 | T33: =R[-1]C -> 200 | U33: 同上
A34: 28 | B34: 50 | C34: =RC[3]&IF(RC[4]="","|200","|"&RC[4]&IF(RC[5]="","|200","|"&RC[5]&IF(RC[6]="","|200","|"&RC[6]&IF(RC[7]="","|200","|"&RC[7]&"|200")))) -> 28|34|38|44|200 | D34: =RC[7]&IF(RC[8]="","","#"&RC[8]&IF(RC[9]="","","#"&RC[9]&IF(RC[10]="","","#"&RC[10]&IF(RC[11]="","","#"&RC[11])))) -> 13439#10014#10004#10010#10008 | E34: =RC[11]&IF(RC[12]="","","#"&RC[12]&IF(RC[13]="","","#"&RC[13]&IF(RC[14]="","","#"&RC[14]&IF(RC[15]="","","#"&RC[15])))) -> 1#50#100#150#200 | F34: 28 | G34: 34 | H34: 38 | I34: 44 | K34: =R[-1]C -> 13439 | L34: =R[-1]C -> 10014 | M34: =R[-1]C -> 10004 | N34: =R[-1]C -> 10010 | O34: =R[-1]C -> 10008 | P34: =R[-1]C -> 1 | Q34: =R[-1]C -> 50 | R34: =R[-1]C -> 100 | S34: =R[-1]C -> 150 | T34: =R[-1]C -> 200 | U34: 同上
A35: 29 | B35: 50 | C35: =RC[3]&IF(RC[4]="","|200","|"&RC[4]&IF(RC[5]="","|200","|"&RC[5]&IF(RC[6]="","|200","|"&RC[6]&IF(RC[7]="","|200","|"&RC[7]&"|200")))) -> 28|34|38|44|200 | D35: =RC[7]&IF(RC[8]="","","#"&RC[8]&IF(RC[9]="","","#"&RC[9]&IF(RC[10]="","","#"&RC[10]&IF(RC[11]="","","#"&RC[11])))) -> 13439#10014#10004#10010#10008 | E35: =RC[11]&IF(RC[12]="","","#"&RC[12]&IF(RC[13]="","","#"&RC[13]&IF(RC[14]="","","#"&RC[14]&IF(RC[15]="","","#"&RC[15])))) -> 1#50#100#150#200 | F35: 28 | G35: 34 | H35: 38 | I35: 44 | K35: =R[-1]C -> 13439 | L35: =R[-1]C -> 10014 | M35: =R[-1]C -> 10004 | N35: =R[-1]C -> 10010 | O35: =R[-1]C -> 10008 | P35: =R[-1]C -> 1 | Q35: =R[-1]C -> 50 | R35: =R[-1]C -> 100 | S35: =R[-1]C -> 150 | T35: =R[-1]C -> 200 | U35: 同上
A36: 30 | B36: 50 | C36: =RC[3]&IF(RC[4]="","|200","|"&RC[4]&IF(RC[5]="","|200","|"&RC[5]&IF(RC[6]="","|200","|"&RC[6]&IF(RC[7]="","|200","|"&RC[7]&"|200")))) -> 28|34|38|44|200 | D36: =RC[7]&IF(RC[8]="","","#"&RC[8]&IF(RC[9]="","","#"&RC[9]&IF(RC[10]="","","#"&RC[10]&IF(RC[11]="","","#"&RC[11])))) -> 13439#10014#10004#10010#10008 | E36: =RC[11]&IF(RC[12]="","","#"&RC[12]&IF(RC[13]="","","#"&RC[13]&IF(RC[14]="","","#"&RC[14]&IF(RC[15]="","","#"&RC[15])))) -> 1#50#100#150#200 | F36: 28 | G36: 34 | H36: 38 | I36: 44 | K36: =R[-1]C -> 13439 | L36: =R[-1]C -> 10014 | M36: =R[-1]C -> 10004 | N36: =R[-1]C -> 10010 | O36: =R[-1]C -> 10008 | P36: =R[-1]C -> 1 | Q36: =R[-1]C -> 50 | R36: =R[-1]C -> 100 | S36: =R[-1]C -> 150 | T36: =R[-1]C -> 200 | U36: 同上
A37: 31 | B37: 50 | C37: =RC[3]&IF(RC[4]="","|200","|"&RC[4]&IF(RC[5]="","|200","|"&RC[5]&IF(RC[6]="","|200","|"&RC[6]&IF(RC[7]="","|200","|"&RC[7]&"|200")))) -> 28|34|38|44|200 | D37: =RC[7]&IF(RC[8]="","","#"&RC[8]&IF(RC[9]="","","#"&RC[9]&IF(RC[10]="","","#"&RC[10]&IF(RC[11]="","","#"&RC[11])))) -> 13439#10014#10004#10010#10008 | E37: =RC[11]&IF(RC[12]="","","#"&RC[12]&IF(RC[13]="","","#"&RC[13]&IF(RC[14]="","","#"&RC[14]&IF(RC[15]="","","#"&RC[15])))) -> 1#50#100#150#200 | F37: 28 | G37: 34 | H37: 38 | I37: 44 | K37: =R[-1]C -> 13439 | L37: =R[-1]C -> 10014 | M37: =R[-1]C -> 10004 | N37: =R[-1]C -> 10010 | O37: =R[-1]C -> 10008 | P37: =R[-1]C -> 1 | Q37: =R[-1]C -> 50 | R37: =R[-1]C -> 100 | S37: =R[-1]C -> 150 | T37: =R[-1]C -> 200 | U37: 同上
A38: 32 | B38: 50 | C38: =RC[3]&IF(RC[4]="","|200","|"&RC[4]&IF(RC[5]="","|200","|"&RC[5]&IF(RC[6]="","|200","|"&RC[6]&IF(RC[7]="","|200","|"&RC[7]&"|200")))) -> 28|34|38|44|200 | D38: =RC[7]&IF(RC[8]="","","#"&RC[8]&IF(RC[9]="","","#"&RC[9]&IF(RC[10]="","","#"&RC[10]&IF(RC[11]="","","#"&RC[11])))) -> 13439#10014#10004#10010#10008 | E38: =RC[11]&IF(RC[12]="","","#"&RC[12]&IF(RC[13]="","","#"&RC[13]&IF(RC[14]="","","#"&RC[14]&IF(RC[15]="","","#"&RC[15])))) -> 1#50#100#150#200 | F38: 28 | G38: 34 | H38: 38 | I38: 44 | K38: =R[-1]C -> 13439 | L38: =R[-1]C -> 10014 | M38: =R[-1]C -> 10004 | N38: =R[-1]C -> 10010 | O38: =R[-1]C -> 10008 | P38: =R[-1]C -> 1 | Q38: =R[-1]C -> 50 | R38: =R[-1]C -> 100 | S38: =R[-1]C -> 150 | T38: =R[-1]C -> 200 | U38: 同上
A39: 33 | B39: 50 | C39: =RC[3]&IF(RC[4]="","|200","|"&RC[4]&IF(RC[5]="","|200","|"&RC[5]&IF(RC[6]="","|200","|"&RC[6]&IF(RC[7]="","|200","|"&RC[7]&"|200")))) -> 28|34|38|44|200 | D39: =RC[7]&IF(RC[8]="","","#"&RC[8]&IF(RC[9]="","","#"&RC[9]&IF(RC[10]="","","#"&RC[10]&IF(RC[11]="","","#"&RC[11])))) -> 13439#10014#10004#10010#10008 | E39: =RC[11]&IF(RC[12]="","","#"&RC[12]&IF(RC[13]="","","#"&RC[13]&IF(RC[14]="","","#"&RC[14]&IF(RC[15]="","","#"&RC[15])))) -> 1#50#100#150#200 | F39: 28 | G39: 34 | H39: 38 | I39: 44 | K39: =R[-1]C -> 13439 | L39: =R[-1]C -> 10014 | M39: =R[-1]C -> 10004 | N39: =R[-1]C -> 10010 | O39: =R[-1]C -> 10008 | P39: =R[-1]C -> 1 | Q39: =R[-1]C -> 50 | R39: =R[-1]C -> 100 | S39: =R[-1]C -> 150 | T39: =R[-1]C -> 200 | U39: 同上
A40: 34 | B40: 50 | C40: =RC[3]&IF(RC[4]="","|200","|"&RC[4]&IF(RC[5]="","|200","|"&RC[5]&IF(RC[6]="","|200","|"&RC[6]&IF(RC[7]="","|200","|"&RC[7]&"|200")))) -> 28|34|38|44|200 | D40: =RC[7]&IF(RC[8]="","","#"&RC[8]&IF(RC[9]="","","#"&RC[9]&IF(RC[10]="","","#"&RC[10]&IF(RC[11]="","","#"&RC[11])))) -> 13439#10014#10004#10010#10008 | E40: =RC[11]&IF(RC[12]="","","#"&RC[12]&IF(RC[13]="","","#"&RC[13]&IF(RC[14]="","","#"&RC[14]&IF(RC[15]="","","#"&RC[15])))) -> 1#50#100#150#200 | F40: 28 | G40: 34 | H40: 38 | I40: 44 | K40: =R[-1]C -> 13439 | L40: =R[-1]C -> 10014 | M40: =R[-1]C -> 10004 | N40: =R[-1]C -> 10010 | O40: =R[-1]C -> 10008 | P40: =R[-1]C -> 1 | Q40: =R[-1]C -> 50 | R40: =R[-1]C -> 100 | S40: =R[-1]C -> 150 | T40: =R[-1]C -> 200 | U40: 同上
A41: 35 | B41: 50 | C41: =RC[3]&IF(RC[4]="","|200","|"&RC[4]&IF(RC[5]="","|200","|"&RC[5]&IF(RC[6]="","|200","|"&RC[6]&IF(RC[7]="","|200","|"&RC[7]&"|200")))) -> 28|34|38|44|200 | D41: =RC[7]&IF(RC[8]="","","#"&RC[8]&IF(RC[9]="","","#"&RC[9]&IF(RC[10]="","","#"&RC[10]&IF(RC[11]="","","#"&RC[11])))) -> 13439#10014#10004#10010#10008 | E41: =RC[11]&IF(RC[12]="","","#"&RC[12]&IF(RC[13]="","","#"&RC[13]&IF(RC[14]="","","#"&RC[14]&IF(RC[15]="","","#"&RC[15])))) -> 1#50#100#150#200 | F41: 28 | G41: 34 | H41: 38 | I41: 44 | K41: =R[-1]C -> 13439 | L41: =R[-1]C -> 10014 | M41: =R[-1]C -> 10004 | N41: =R[-1]C -> 10010 | O41: =R[-1]C -> 10008 | P41: =R[-1]C -> 1 | Q41: =R[-1]C -> 50 | R41: =R[-1]C -> 100 | S41: =R[-1]C -> 150 | T41: =R[-1]C -> 200 | U41: 同上
A42: 36 | B42: 50 | C42: =RC[3]&IF(RC[4]="","|200","|"&RC[4]&IF(RC[5]="","|200","|"&RC[5]&IF(RC[6]="","|200","|"&RC[6]&IF(RC[7]="","|200","|"&RC[7]&"|200")))) -> 28|34|38|44|200 | D42: =RC[7]&IF(RC[8]="","","#"&RC[8]&IF(RC[9]="","","#"&RC[9]&IF(RC[10]="","","#"&RC[10]&IF(RC[11]="","","#"&RC[11])))) -> 13439#10014#10004#10010#10008 | E42: =RC[11]&IF(RC[12]="","","#"&RC[12]&IF(RC[13]="","","#"&RC[13]&IF(RC[14]="","","#"&RC[14]&IF(RC[15]="","","#"&RC[15])))) -> 1#50#100#150#200 | F42: 28 | G42: 34 | H42: 38 | I42: 44 | K42: =R[-1]C -> 13439 | L42: =R[-1]C -> 10014 | M42: =R[-1]C -> 10004 | N42: =R[-1]C -> 10010 | O42: =R[-1]C -> 10008 | P42: =R[-1]C -> 1 | Q42: =R[-1]C -> 50 | R42: =R[-1]C -> 100 | S42: =R[-1]C -> 150 | T42: =R[-1]C -> 200 | U42: 同上
A43: 37 | B43: 50 | C43: =RC[3]&IF(RC[4]="","|200","|"&RC[4]&IF(RC[5]="","|200","|"&RC[5]&IF(RC[6]="","|200","|"&RC[6]&IF(RC[7]="","|200","|"&RC[7]&"|200")))) -> 28|34|38|44|200 | D43: =RC[7]&IF(RC[8]="","","#"&RC[8]&IF(RC[9]="","","#"&RC[9]&IF(RC[10]="","","#"&RC[10]&IF(RC[11]="","","#"&RC[11])))) -> 13439#10014#10004#10010#10008 | E43: =RC[11]&IF(RC[12]="","","#"&RC[12]&IF(RC[13]="","","#"&RC[13]&IF(RC[14]="","","#"&RC[14]&IF(RC[15]="","","#"&RC[15])))) -> 1#50#100#150#200 | F43: 28 | G43: 34 | H43: 38 | I43: 44 | K43: =R[-1]C -> 13439 | L43: =R[-1]C -> 10014 | M43: =R[-1]C -> 10004 | N43: =R[-1]C -> 10010 | O43: =R[-1]C -> 10008 | P43: =R[-1]C -> 1 | Q43: =R[-1]C -> 50 | R43: =R[-1]C -> 100 | S43: =R[-1]C -> 150 | T43: =R[-1]C -> 200 | U43: 同上
A44: 38 | B44: 50 | C44: =RC[3]&IF(RC[4]="","|200","|"&RC[4]&IF(RC[5]="","|200","|"&RC[5]&IF(RC[6]="","|200","|"&RC[6]&IF(RC[7]="","|200","|"&RC[7]&"|200")))) -> 28|34|38|44|200 | D44: =RC[7]&IF(RC[8]="","","#"&RC[8]&IF(RC[9]="","","#"&RC[9]&IF(RC[10]="","","#"&RC[10]&IF(RC[11]="","","#"&RC[11])))) -> 13439#10014#10004#10010#10008 | E44: =RC[11]&IF(RC[12]="","","#"&RC[12]&IF(RC[13]="","","#"&RC[13]&IF(RC[14]="","","#"&RC[14]&IF(RC[15]="","","#"&RC[15])))) -> 1#50#100#150#200 | F44: 28 | G44: 34 | H44: 38 | I44: 44 | K44: =R[-1]C -> 13439 | L44: =R[-1]C -> 10014 | M44: =R[-1]C -> 10004 | N44: =R[-1]C -> 10010 | O44: =R[-1]C -> 10008 | P44: =R[-1]C -> 1 | Q44: =R[-1]C -> 50 | R44: =R[-1]C -> 100 | S44: =R[-1]C -> 150 | T44: =R[-1]C -> 200 | U44: 同上
A45: 39 | B45: 50 | C45: =RC[3]&IF(RC[4]="","|200","|"&RC[4]&IF(RC[5]="","|200","|"&RC[5]&IF(RC[6]="","|200","|"&RC[6]&IF(RC[7]="","|200","|"&RC[7]&"|200")))) -> 28|34|38|44|200 | D45: =RC[7]&IF(RC[8]="","","#"&RC[8]&IF(RC[9]="","","#"&RC[9]&IF(RC[10]="","","#"&RC[10]&IF(RC[11]="","","#"&RC[11])))) -> 13439#10014#10004#10010#10008 | E45: =RC[11]&IF(RC[12]="","","#"&RC[12]&IF(RC[13]="","","#"&RC[13]&IF(RC[14]="","","#"&RC[14]&IF(RC[15]="","","#"&RC[15])))) -> 1#50#100#150#200 | F45: 28 | G45: 34 | H45: 38 | I45: 44 | K45: =R[-1]C -> 13439 | L45: =R[-1]C -> 10014 | M45: =R[-1]C -> 10004 | N45: =R[-1]C -> 10010 | O45: =R[-1]C -> 10008 | P45: =R[-1]C -> 1 | Q45: =R[-1]C -> 50 | R45: =R[-1]C -> 100 | S45: =R[-1]C -> 150 | T45: =R[-1]C -> 200 | U45: 同上
A46: 40 | B46: 50 | C46: =RC[3]&IF(RC[4]="","|200","|"&RC[4]&IF(RC[5]="","|200","|"&RC[5]&IF(RC[6]="","|200","|"&RC[6]&IF(RC[7]="","|200","|"&RC[7]&"|200")))) -> 28|34|38|44|200 | D46: =RC[7]&IF(RC[8]="","","#"&RC[8]&IF(RC[9]="","","#"&RC[9]&IF(RC[10]="","","#"&RC[10]&IF(RC[11]="","","#"&RC[11])))) -> 13439#10014#10004#10010#10008 | E46: =RC[11]&IF(RC[12]="","","#"&RC[12]&IF(RC[13]="","","#"&RC[13]&IF(RC[14]="","","#"&RC[14]&IF(RC[15]="","","#"&RC[15])))) -> 1#50#100#150#200 | F46: 28 | G46: 34 | H46: 38 | I46: 44 | K46: =R[-1]C -> 13439 | L46: =R[-1]C -> 10014 | M46: =R[-1]C -> 10004 | N46: =R[-1]C -> 10010 | O46: =R[-1]C -> 10008 | P46: =R[-1]C -> 1 | Q46: =R[-1]C -> 50 | R46: =R[-1]C -> 100 | S46: =R[-1]C -> 150 | T46: =R[-1]C -> 200 | U46: 同上
A47: 41 | B47: 50 | C47: =RC[3]&IF(RC[4]="","|200","|"&RC[4]&IF(RC[5]="","|200","|"&RC[5]&IF(RC[6]="","|200","|"&RC[6]&IF(RC[7]="","|200","|"&RC[7]&"|200")))) -> 28|34|38|44|200 | D47: =RC[7]&IF(RC[8]="","","#"&RC[8]&IF(RC[9]="","","#"&RC[9]&IF(RC[10]="","","#"&RC[10]&IF(RC[11]="","","#"&RC[11])))) -> 13439#10014#10004#10010#10008 | E47: =RC[11]&IF(RC[12]="","","#"&RC[12]&IF(RC[13]="","","#"&RC[13]&IF(RC[14]="","","#"&RC[14]&IF(RC[15]="","","#"&RC[15])))) -> 1#50#100#150#200 | F47: 28 | G47: 34 | H47: 38 | I47: 44 | K47: =R[-1]C -> 13439 | L47: =R[-1]C -> 10014 | M47: =R[-1]C -> 10004 | N47: =R[-1]C -> 10010 | O47: =R[-1]C -> 10008 | P47: =R[-1]C -> 1 | Q47: =R[-1]C -> 50 | R47: =R[-1]C -> 100 | S47: =R[-1]C -> 150 | T47: =R[-1]C -> 200 | U47: 同上
A48: 42 | B48: 50 | C48: =RC[3]&IF(RC[4]="","|200","|"&RC[4]&IF(RC[5]="","|200","|"&RC[5]&IF(RC[6]="","|200","|"&RC[6]&IF(RC[7]="","|200","|"&RC[7]&"|200")))) -> 28|34|38|44|200 | D48: =RC[7]&IF(RC[8]="","","#"&RC[8]&IF(RC[9]="","","#"&RC[9]&IF(RC[10]="","","#"&RC[10]&IF(RC[11]="","","#"&RC[11])))) -> 13439#10014#10004#10010#10008 | E48: =RC[11]&IF(RC[12]="","","#"&RC[12]&IF(RC[13]="","","#"&RC[13]&IF(RC[14]="","","#"&RC[14]&IF(RC[15]="","","#"&RC[15])))) -> 1#50#100#150#200 | F48: 28 | G48: 34 | H48: 38 | I48: 44 | K48: =R[-1]C -> 13439 | L48: =R[-1]C -> 10014 | M48: =R[-1]C -> 10004 | N48: =R[-1]C -> 10010 | O48: =R[-1]C -> 10008 | P48: =R[-1]C -> 1 | Q48: =R[-1]C -> 50 | R48: =R[-1]C -> 100 | S48: =R[-1]C -> 150 | T48: =R[-1]C -> 200 | U48: 同上
A49: 43 | B49: 50 | C49: =RC[3]&IF(RC[4]="","|200","|"&RC[4]&IF(RC[5]="","|200","|"&RC[5]&IF(RC[6]="","|200","|"&RC[6]&IF(RC[7]="","|200","|"&RC[7]&"|200")))) -> 28|34|38|44|200 | D49: =RC[7]&IF(RC[8]="","","#"&RC[8]&IF(RC[9]="","","#"&RC[9]&IF(RC[10]="","","#"&RC[10]&IF(RC[11]="","","#"&RC[11])))) -> 13439#10014#10004#10010#10008 | E49: =RC[11]&IF(RC[12]="","","#"&RC[12]&IF(RC[13]="","","#"&RC[13]&IF(RC[14]="","","#"&RC[14]&IF(RC[15]="","","#"&RC[15])))) -> 1#50#100#150#200 | F49: 28 | G49: 34 | H49: 38 | I49: 44 | K49: =R[-1]C -> 13439 | L49: =R[-1]C -> 10014 | M49: =R[-1]C -> 10004 | N49: =R[-1]C -> 10010 | O49: =R[-1]C -> 10008 | P49: =R[-1]C -> 1 | Q49: =R[-1]C -> 50 | R49: =R[-1]C -> 100 | S49: =R[-1]C -> 150 | T49: =R[-1]C -> 200 | U49: 同上
A50: 44 | B50: 50 | C50: =RC[3]&IF(RC[4]="","|200","|"&RC[4]&IF(RC[5]="","|200","|"&RC[5]&IF(RC[6]="","|200","|"&RC[6]&IF(RC[7]="","|200","|"&RC[7]&"|200")))) -> 28|34|38|44|200 | D50: =RC[7]&IF(RC[8]="","","#"&RC[8]&IF(RC[9]="","","#"&RC[9]&IF(RC[10]="","","#"&RC[10]&IF(RC[11]="","","#"&RC[11])))) -> 13439#10014#10004#10010#10008 | E50: =RC[11]&IF(RC[12]="","","#"&RC[12]&IF(RC[13]="","","#"&RC[13]&IF(RC[14]="","","#"&RC[14]&IF(RC[15]="","","#"&RC[15])))) -> 1#50#100#150#200 | F50: 28 | G50: 34 | H50: 38 | I50: 44 | K50: =R[-1]C -> 13439 | L50: =R[-1]C -> 10014 | M50: =R[-1]C -> 10004 | N50: =R[-1]C -> 10010 | O50: =R[-1]C -> 10008 | P50: =R[-1]C -> 1 | Q50: =R[-1]C -> 50 | R50: =R[-1]C -> 100 | S50: =R[-1]C -> 150 | T50: =R[-1]C -> 200 | U50: 同上
A51: 45 | B51: 50 | C51: =RC[3]&IF(RC[4]="","|200","|"&RC[4]&IF(RC[5]="","|200","|"&RC[5]&IF(RC[6]="","|200","|"&RC[6]&IF(RC[7]="","|200","|"&RC[7]&"|200")))) -> 28|34|38|44|200 | D51: =RC[7]&IF(RC[8]="","","#"&RC[8]&IF(RC[9]="","","#"&RC[9]&IF(RC[10]="","","#"&RC[10]&IF(RC[11]="","","#"&RC[11])))) -> 13439#10014#10004#10010#10008 | E51: =RC[11]&IF(RC[12]="","","#"&RC[12]&IF(RC[13]="","","#"&RC[13]&IF(RC[14]="","","#"&RC[14]&IF(RC[15]="","","#"&RC[15])))) -> 1#50#100#150#200 | F51: 28 | G51: 34 | H51: 38 | I51: 44 | K51: =R[-1]C -> 13439 | L51: =R[-1]C -> 10014 | M51: =R[-1]C -> 10004 | N51: =R[-1]C -> 10010 | O51: =R[-1]C -> 10008 | P51: =R[-1]C -> 1 | Q51: =R[-1]C -> 50 | R51: =R[-1]C -> 100 | S51: =R[-1]C -> 150 | T51: =R[-1]C -> 200 | U51: 同上
A52: 46 | B52: 50 | C52: =RC[3]&IF(RC[4]="","|200","|"&RC[4]&IF(RC[5]="","|200","|"&RC[5]&IF(RC[6]="","|200","|"&RC[6]&IF(RC[7]="","|200","|"&RC[7]&"|200")))) -> 28|34|38|44|200 | D52: =RC[7]&IF(RC[8]="","","#"&RC[8]&IF(RC[9]="","","#"&RC[9]&IF(RC[10]="","","#"&RC[10]&IF(RC[11]="","","#"&RC[11])))) -> 13439#10014#10004#10010#10008 | E52: =RC[11]&IF(RC[12]="","","#"&RC[12]&IF(RC[13]="","","#"&RC[13]&IF(RC[14]="","","#"&RC[14]&IF(RC[15]="","","#"&RC[15])))) -> 1#50#100#150#200 | F52: 28 | G52: 34 | H52: 38 | I52: 44 | K52: =R[-1]C -> 13439 | L52: =R[-1]C -> 10014 | M52: =R[-1]C -> 10004 | N52: =R[-1]C -> 10010 | O52: =R[-1]C -> 10008 | P52: =R[-1]C -> 1 | Q52: =R[-1]C -> 50 | R52: =R[-1]C -> 100 | S52: =R[-1]C -> 150 | T52: =R[-1]C -> 200 | U52: 同上
A53: 47 | B53: 50 | C53: =RC[3]&IF(RC[4]="","|200","|"&RC[4]&IF(RC[5]="","|200","|"&RC[5]&IF(RC[6]="","|200","|"&RC[6]&IF(RC[7]="","|200","|"&RC[7]&"|200")))) -> 28|34|38|44|200 | D53: =RC[7]&IF(RC[8]="","","#"&RC[8]&IF(RC[9]="","","#"&RC[9]&IF(RC[10]="","","#"&RC[10]&IF(RC[11]="","","#"&RC[11])))) -> 13439#10014#10004#10010#10008 | E53: =RC[11]&IF(RC[12]="","","#"&RC[12]&IF(RC[13]="","","#"&RC[13]&IF(RC[14]="","","#"&RC[14]&IF(RC[15]="","","#"&RC[15])))) -> 1#50#100#150#200 | F53: 28 | G53: 34 | H53: 38 | I53: 44 | K53: =R[-1]C -> 13439 | L53: =R[-1]C -> 10014 | M53: =R[-1]C -> 10004 | N53: =R[-1]C -> 10010 | O53: =R[-1]C -> 10008 | P53: =R[-1]C -> 1 | Q53: =R[-1]C -> 50 | R53: =R[-1]C -> 100 | S53: =R[-1]C -> 150 | T53: =R[-1]C -> 200 | U53: 同上
A54: 48 | B54: 50 | C54: =RC[3]&IF(RC[4]="","|200","|"&RC[4]&IF(RC[5]="","|200","|"&RC[5]&IF(RC[6]="","|200","|"&RC[6]&IF(RC[7]="","|200","|"&RC[7]&"|200")))) -> 28|34|38|44|200 | D54: =RC[7]&IF(RC[8]="","","#"&RC[8]&IF(RC[9]="","","#"&RC[9]&IF(RC[10]="","","#"&RC[10]&IF(RC[11]="","","#"&RC[11])))) -> 13439#10014#10004#10010#10008 | E54: =RC[11]&IF(RC[12]="","","#"&RC[12]&IF(RC[13]="","","#"&RC[13]&IF(RC[14]="","","#"&RC[14]&IF(RC[15]="","","#"&RC[15])))) -> 1#50#100#150#200 | F54: 28 | G54: 34 | H54: 38 | I54: 44 | K54: =R[-1]C -> 13439 | L54: =R[-1]C -> 10014 | M54: =R[-1]C -> 10004 | N54: =R[-1]C -> 10010 | O54: =R[-1]C -> 10008 | P54: =R[-1]C -> 1 | Q54: =R[-1]C -> 50 | R54: =R[-1]C -> 100 | S54: =R[-1]C -> 150 | T54: =R[-1]C -> 200 | U54: 同上
A55: 49 | B55: 50 | C55: =RC[3]&IF(RC[4]="","|200","|"&RC[4]&IF(RC[5]="","|200","|"&RC[5]&IF(RC[6]="","|200","|"&RC[6]&IF(RC[7]="","|200","|"&RC[7]&"|200")))) -> 28|34|38|44|200 | D55: =RC[7]&IF(RC[8]="","","#"&RC[8]&IF(RC[9]="","","#"&RC[9]&IF(RC[10]="","","#"&RC[10]&IF(RC[11]="","","#"&RC[11])))) -> 13439#10014#10004#10010#10008 | E55: =RC[11]&IF(RC[12]="","","#"&RC[12]&IF(RC[13]="","","#"&RC[13]&IF(RC[14]="","","#"&RC[14]&IF(RC[15]="","","#"&RC[15])))) -> 1#50#100#150#200 | F55: 28 | G55: 34 | H55: 38 | I55: 44 | K55: =R[-1]C -> 13439 | L55: =R[-1]C -> 10014 | M55: =R[-1]C -> 10004 | N55: =R[-1]C -> 10010 | O55: =R[-1]C -> 10008 | P55: =R[-1]C -> 1 | Q55: =R[-1]C -> 50 | R55: =R[-1]C -> 100 | S55: =R[-1]C -> 150 | T55: =R[-1]C -> 200 | U55: 同上
A56: 50 | B56: 50 | C56: =RC[3]&IF(RC[4]="","|200","|"&RC[4]&IF(RC[5]="","|200","|"&RC[5]&IF(RC[6]="","|200","|"&RC[6]&IF(RC[7]="","|200","|"&RC[7]&"|200")))) -> 28|34|38|44|200 | D56: =RC[7]&IF(RC[8]="","","#"&RC[8]&IF(RC[9]="","","#"&RC[9]&IF(RC[10]="","","#"&RC[10]&IF(RC[11]="","","#"&RC[11])))) -> 13439#10014#10004#10010#10008 | E56: =RC[11]&IF(RC[12]="","","#"&RC[12]&IF(RC[13]="","","#"&RC[13]&IF(RC[14]="","","#"&RC[14]&IF(RC[15]="","","#"&RC[15])))) -> 1#50#100#150#200 | F56: 28 | G56: 34 | H56: 38 | I56: 44 | K56: =R[-1]C -> 13439 | L56: =R[-1]C -> 10014 | M56: =R[-1]C -> 10004 | N56: =R[-1]C -> 10010 | O56: =R[-1]C -> 10008 | P56: =R[-1]C -> 1 | Q56: =R[-1]C -> 50 | R56: =R[-1]C -> 100 | S56: =R[-1]C -> 150 | T56: =R[-1]C -> 200 | U56: 同上
A57: 51 | B57: 50 | C57: =RC[3]&IF(RC[4]="","|200","|"&RC[4]&IF(RC[5]="","|200","|"&RC[5]&IF(RC[6]="","|200","|"&RC[6]&IF(RC[7]="","|200","|"&RC[7]&"|200")))) -> 28|34|38|44|200 | D57: =RC[7]&IF(RC[8]="","","#"&RC[8]&IF(RC[9]="","","#"&RC[9]&IF(RC[10]="","","#"&RC[10]&IF(RC[11]="","","#"&RC[11])))) -> 13439#10014#10004#10010#10008 | E57: =RC[11]&IF(RC[12]="","","#"&RC[12]&IF(RC[13]="","","#"&RC[13]&IF(RC[14]="","","#"&RC[14]&IF(RC[15]="","","#"&RC[15])))) -> 1#50#100#150#200 | F57: 28 | G57: 34 | H57: 38 | I57: 44 | K57: =R[-1]C -> 13439 | L57: =R[-1]C -> 10014 | M57: =R[-1]C -> 10004 | N57: =R[-1]C -> 10010 | O57: =R[-1]C -> 10008 | P57: =R[-1]C -> 1 | Q57: =R[-1]C -> 50 | R57: =R[-1]C -> 100 | S57: =R[-1]C -> 150 | T57: =R[-1]C -> 200 | U57: 同上
A58: 52 | B58: 50 | C58: =RC[3]&IF(RC[4]="","|200","|"&RC[4]&IF(RC[5]="","|200","|"&RC[5]&IF(RC[6]="","|200","|"&RC[6]&IF(RC[7]="","|200","|"&RC[7]&"|200")))) -> 28|34|38|44|200 | D58: =RC[7]&IF(RC[8]="","","#"&RC[8]&IF(RC[9]="","","#"&RC[9]&IF(RC[10]="","","#"&RC[10]&IF(RC[11]="","","#"&RC[11])))) -> 13439#10014#10004#10010#10008 | E58: =RC[11]&IF(RC[12]="","","#"&RC[12]&IF(RC[13]="","","#"&RC[13]&IF(RC[14]="","","#"&RC[14]&IF(RC[15]="","","#"&RC[15])))) -> 1#50#100#150#200 | F58: 28 | G58: 34 | H58: 38 | I58: 44 | K58: =R[-1]C -> 13439 | L58: =R[-1]C -> 10014 | M58: =R[-1]C -> 10004 | N58: =R[-1]C -> 10010 | O58: =R[-1]C -> 10008 | P58: =R[-1]C -> 1 | Q58: =R[-1]C -> 50 | R58: =R[-1]C -> 100 | S58: =R[-1]C -> 150 | T58: =R[-1]C -> 200 | U58: 同上
A59: 53 | B59: 50 | C59: =RC[3]&IF(RC[4]="","|200","|"&RC[4]&IF(RC[5]="","|200","|"&RC[5]&IF(RC[6]="","|200","|"&RC[6]&IF(RC[7]="","|200","|"&RC[7]&"|200")))) -> 28|34|38|44|200 | D59: =RC[7]&IF(RC[8]="","","#"&RC[8]&IF(RC[9]="","","#"&RC[9]&IF(RC[10]="","","#"&RC[10]&IF(RC[11]="","","#"&RC[11])))) -> 13439#10014#10004#10010#10008 | E59: =RC[11]&IF(RC[12]="","","#"&RC[12]&IF(RC[13]="","","#"&RC[13]&IF(RC[14]="","","#"&RC[14]&IF(RC[15]="","","#"&RC[15])))) -> 1#50#100#150#200 | F59: 28 | G59: 34 | H59: 38 | I59: 44 | K59: =R[-1]C -> 13439 | L59: =R[-1]C -> 10014 | M59: =R[-1]C -> 10004 | N59: =R[-1]C -> 10010 | O59: =R[-1]C -> 10008 | P59: =R[-1]C -> 1 | Q59: =R[-1]C -> 50 | R59: =R[-1]C -> 100 | S59: =R[-1]C -> 150 | T59: =R[-1]C -> 200 | U59: 同上
A60: 54 | B60: 50 | C60: =RC[3]&IF(RC[4]="","|200","|"&RC[4]&IF(RC[5]="","|200","|"&RC[5]&IF(RC[6]="","|200","|"&RC[6]&IF(RC[7]="","|200","|"&RC[7]&"|200")))) -> 28|34|38|44|200 | D60: =RC[7]&IF(RC[8]="","","#"&RC[8]&IF(RC[9]="","","#"&RC[9]&IF(RC[10]="","","#"&RC[10]&IF(RC[11]="","","#"&RC[11])))) -> 13439#10014#10004#10010#10008 | E60: =RC[11]&IF(RC[12]="","","#"&RC[12]&IF(RC[13]="","","#"&RC[13]&IF(RC[14]="","","#"&RC[14]&IF(RC[15]="","","#"&RC[15])))) -> 1#50#100#150#200 | F60: 28 | G60: 34 | H60: 38 | I60: 44 | K60: =R[-1]C -> 13439 | L60: =R[-1]C -> 10014 | M60: =R[-1]C -> 10004 | N60: =R[-1]C -> 10010 | O60: =R[-1]C -> 10008 | P60: =R[-1]C -> 1 | Q60: =R[-1]C -> 50 | R60: =R[-1]C -> 100 | S60: =R[-1]C -> 150 | T60: =R[-1]C -> 200 | U60: 同上
A61: 55 | B61: 50 | C61: =RC[3]&IF(RC[4]="","|200","|"&RC[4]&IF(RC[5]="","|200","|"&RC[5]&IF(RC[6]="","|200","|"&RC[6]&IF(RC[7]="","|200","|"&RC[7]&"|200")))) -> 28|34|38|44|200 | D61: =RC[7]&IF(RC[8]="","","#"&RC[8]&IF(RC[9]="","","#"&RC[9]&IF(RC[10]="","","#"&RC[10]&IF(RC[11]="","","#"&RC[11])))) -> 13439#10014#10004#10010#10008 | E61: =RC[11]&IF(RC[12]="","","#"&RC[12]&IF(RC[13]="","","#"&RC[13]&IF(RC[14]="","","#"&RC[14]&IF(RC[15]="","","#"&RC[15])))) -> 1#50#100#150#200 | F61: 28 | G61: 34 | H61: 38 | I61: 44 | K61: =R[-1]C -> 13439 | L61: =R[-1]C -> 10014 | M61: =R[-1]C -> 10004 | N61: =R[-1]C -> 10010 | O61: =R[-1]C -> 10008 | P61: =R[-1]C -> 1 | Q61: =R[-1]C -> 50 | R61: =R[-1]C -> 100 | S61: =R[-1]C -> 150 | T61: =R[-1]C -> 200 | U61: 同上
A62: 56 | B62: 50 | C62: =RC[3]&IF(RC[4]="","|200","|"&RC[4]&IF(RC[5]="","|200","|"&RC[5]&IF(RC[6]="","|200","|"&RC[6]&IF(RC[7]="","|200","|"&RC[7]&"|200")))) -> 28|34|38|44|200 | D62: =RC[7]&IF(RC[8]="","","#"&RC[8]&IF(RC[9]="","","#"&RC[9]&IF(RC[10]="","","#"&RC[10]&IF(RC[11]="","","#"&RC[11])))) -> 13439#10014#10004#10010#10008 | E62: =RC[11]&IF(RC[12]="","","#"&RC[12]&IF(RC[13]="","","#"&RC[13]&IF(RC[14]="","","#"&RC[14]&IF(RC[15]="","","#"&RC[15])))) -> 1#50#100#150#200 | F62: 28 | G62: 34 | H62: 38 | I62: 44 | K62: =R[-1]C -> 13439 | L62: =R[-1]C -> 10014 | M62: =R[-1]C -> 10004 | N62: =R[-1]C -> 10010 | O62: =R[-1]C -> 10008 | P62: =R[-1]C -> 1 | Q62: =R[-1]C -> 50 | R62: =R[-1]C -> 100 | S62: =R[-1]C -> 150 | T62: =R[-1]C -> 200 | U62: 同上
A63: 57 | B63: 50 | C63: =RC[3]&IF(RC[4]="","|200","|"&RC[4]&IF(RC[5]="","|200","|"&RC[5]&IF(RC[6]="","|200","|"&RC[6]&IF(RC[7]="","|200","|"&RC[7]&"|200")))) -> 28|34|38|44|200 | D63: =RC[7]&IF(RC[8]="","","#"&RC[8]&IF(RC[9]="","","#"&RC[9]&IF(RC[10]="","","#"&RC[10]&IF(RC[11]="","","#"&RC[11])))) -> 13439#10014#10004#10010#10008 | E63: =RC[11]&IF(RC[12]="","","#"&RC[12]&IF(RC[13]="","","#"&RC[13]&IF(RC[14]="","","#"&RC[14]&IF(RC[15]="","","#"&RC[15])))) -> 1#50#100#150#200 | F63: 28 | G63: 34 | H63: 38 | I63: 44 | K63: =R[-1]C -> 13439 | L63: =R[-1]C -> 10014 | M63: =R[-1]C -> 10004 | N63: =R[-1]C -> 10010 | O63: =R[-1]C -> 10008 | P63: =R[-1]C -> 1 | Q63: =R[-1]C -> 50 | R63: =R[-1]C -> 100 | S63: =R[-1]C -> 150 | T63: =R[-1]C -> 200 | U63: 同上
A64: 58 | B64: 50 | C64: =RC[3]&IF(RC[4]="","|200","|"&RC[4]&IF(RC[5]="","|200","|"&RC[5]&IF(RC[6]="","|200","|"&RC[6]&IF(RC[7]="","|200","|"&RC[7]&"|200")))) -> 28|34|38|44|200 | D64: =RC[7]&IF(RC[8]="","","#"&RC[8]&IF(RC[9]="","","#"&RC[9]&IF(RC[10]="","","#"&RC[10]&IF(RC[11]="","","#"&RC[11])))) -> 13439#10014#10004#10010#10008 | E64: =RC[11]&IF(RC[12]="","","#"&RC[12]&IF(RC[13]="","","#"&RC[13]&IF(RC[14]="","","#"&RC[14]&IF(RC[15]="","","#"&RC[15])))) -> 1#50#100#150#200 | F64: 28 | G64: 34 | H64: 38 | I64: 44 | K64: =R[-1]C -> 13439 | L64: =R[-1]C -> 10014 | M64: =R[-1]C -> 10004 | N64: =R[-1]C -> 10010 | O64: =R[-1]C -> 10008 | P64: =R[-1]C -> 1 | Q64: =R[-1]C -> 50 | R64: =R[-1]C -> 100 | S64: =R[-1]C -> 150 | T64: =R[-1]C -> 200 | U64: 同上
A65: 59 | B65: 50 | C65: =RC[3]&IF(RC[4]="","|200","|"&RC[4]&IF(RC[5]="","|200","|"&RC[5]&IF(RC[6]="","|200","|"&RC[6]&IF(RC[7]="","|200","|"&RC[7]&"|200")))) -> 28|34|38|44|200 | D65: =RC[7]&IF(RC[8]="","","#"&RC[8]&IF(RC[9]="","","#"&RC[9]&IF(RC[10]="","","#"&RC[10]&IF(RC[11]="","","#"&RC[11])))) -> 13439#10014#10004#10010#10008 | E65: =RC[11]&IF(RC[12]="","","#"&RC[12]&IF(RC[13]="","","#"&RC[13]&IF(RC[14]="","","#"&RC[14]&IF(RC[15]="","","#"&RC[15])))) -> 1#50#100#150#200 | F65: 28 | G65: 34 | H65: 38 | I65: 44 | K65: =R[-1]C -> 13439 | L65: =R[-1]C -> 10014 | M65: =R[-1]C -> 10004 | N65: =R[-1]C -> 10010 | O65: =R[-1]C -> 10008 | P65: =R[-1]C -> 1 | Q65: =R[-1]C -> 50 | R65: =R[-1]C -> 100 | S65: =R[-1]C -> 150 | T65: =R[-1]C -> 200 | U65: 同上
A66: 60 | B66: 50 | C66: =RC[3]&IF(RC[4]="","|200","|"&RC[4]&IF(RC[5]="","|200","|"&RC[5]&IF(RC[6]="","|200","|"&RC[6]&IF(RC[7]="","|200","|"&RC[7]&"|200")))) -> 28|34|38|44|200 | D66: =RC[7]&IF(RC[8]="","","#"&RC[8]&IF(RC[9]="","","#"&RC[9]&IF(RC[10]="","","#"&RC[10]&IF(RC[11]="","","#"&RC[11])))) -> 13439#10014#10004#10010#10008 | E66: =RC[11]&IF(RC[12]="","","#"&RC[12]&IF(RC[13]="","","#"&RC[13]&IF(RC[14]="","","#"&RC[14]&IF(RC[15]="","","#"&RC[15])))) -> 1#50#100#150#200 | F66: 28 | G66: 34 | H66: 38 | I66: 44 | K66: =R[-1]C -> 13439 | L66: =R[-1]C -> 10014 | M66: =R[-1]C -> 10004 | N66: =R[-1]C -> 10010 | O66: =R[-1]C -> 10008 | P66: =R[-1]C -> 1 | Q66: =R[-1]C -> 50 | R66: =R[-1]C -> 100 | S66: =R[-1]C -> 150 | T66: =R[-1]C -> 200 | U66: 同上
A67: 61 | B67: 50 | C67: =RC[3]&IF(RC[4]="","|200","|"&RC[4]&IF(RC[5]="","|200","|"&RC[5]&IF(RC[6]="","|200","|"&RC[6]&IF(RC[7]="","|200","|"&RC[7]&"|200")))) -> 28|34|38|44|200 | D67: =RC[7]&IF(RC[8]="","","#"&RC[8]&IF(RC[9]="","","#"&RC[9]&IF(RC[10]="","","#"&RC[10]&IF(RC[11]="","","#"&RC[11])))) -> 13439#10014#10004#10010#10008 | E67: =RC[11]&IF(RC[12]="","","#"&RC[12]&IF(RC[13]="","","#"&RC[13]&IF(RC[14]="","","#"&RC[14]&IF(RC[15]="","","#"&RC[15])))) -> 1#50#100#150#200 | F67: 28 | G67: 34 | H67: 38 | I67: 44 | K67: =R[-1]C -> 13439 | L67: =R[-1]C -> 10014 | M67: =R[-1]C -> 10004 | N67: =R[-1]C -> 10010 | O67: =R[-1]C -> 10008 | P67: =R[-1]C -> 1 | Q67: =R[-1]C -> 50 | R67: =R[-1]C -> 100 | S67: =R[-1]C -> 150 | T67: =R[-1]C -> 200 | U67: 同上
A68: 62 | B68: 50 | C68: =RC[3]&IF(RC[4]="","|200","|"&RC[4]&IF(RC[5]="","|200","|"&RC[5]&IF(RC[6]="","|200","|"&RC[6]&IF(RC[7]="","|200","|"&RC[7]&"|200")))) -> 28|34|38|44|200 | D68: =RC[7]&IF(RC[8]="","","#"&RC[8]&IF(RC[9]="","","#"&RC[9]&IF(RC[10]="","","#"&RC[10]&IF(RC[11]="","","#"&RC[11])))) -> 13439#10014#10004#10010#10008 | E68: =RC[11]&IF(RC[12]="","","#"&RC[12]&IF(RC[13]="","","#"&RC[13]&IF(RC[14]="","","#"&RC[14]&IF(RC[15]="","","#"&RC[15])))) -> 1#50#100#150#200 | F68: 28 | G68: 34 | H68: 38 | I68: 44 | K68: =R[-1]C -> 13439 | L68: =R[-1]C -> 10014 | M68: =R[-1]C -> 10004 | N68: =R[-1]C -> 10010 | O68: =R[-1]C -> 10008 | P68: =R[-1]C -> 1 | Q68: =R[-1]C -> 50 | R68: =R[-1]C -> 100 | S68: =R[-1]C -> 150 | T68: =R[-1]C -> 200 | U68: 同上
A69: 63 | B69: 50 | C69: =RC[3]&IF(RC[4]="","|200","|"&RC[4]&IF(RC[5]="","|200","|"&RC[5]&IF(RC[6]="","|200","|"&RC[6]&IF(RC[7]="","|200","|"&RC[7]&"|200")))) -> 28|34|38|44|200 | D69: =RC[7]&IF(RC[8]="","","#"&RC[8]&IF(RC[9]="","","#"&RC[9]&IF(RC[10]="","","#"&RC[10]&IF(RC[11]="","","#"&RC[11])))) -> 13439#10014#10004#10010#10008 | E69: =RC[11]&IF(RC[12]="","","#"&RC[12]&IF(RC[13]="","","#"&RC[13]&IF(RC[14]="","","#"&RC[14]&IF(RC[15]="","","#"&RC[15])))) -> 1#50#100#150#200 | F69: 28 | G69: 34 | H69: 38 | I69: 44 | K69: =R[-1]C -> 13439 | L69: =R[-1]C -> 10014 | M69: =R[-1]C -> 10004 | N69: =R[-1]C -> 10010 | O69: =R[-1]C -> 10008 | P69: =R[-1]C -> 1 | Q69: =R[-1]C -> 50 | R69: =R[-1]C -> 100 | S69: =R[-1]C -> 150 | T69: =R[-1]C -> 200 | U69: 同上
A70: 64 | B70: 50 | C70: =RC[3]&IF(RC[4]="","|200","|"&RC[4]&IF(RC[5]="","|200","|"&RC[5]&IF(RC[6]="","|200","|"&RC[6]&IF(RC[7]="","|200","|"&RC[7]&"|200")))) -> 28|34|38|44|200 | D70: =RC[7]&IF(RC[8]="","","#"&RC[8]&IF(RC[9]="","","#"&RC[9]&IF(RC[10]="","","#"&RC[10]&IF(RC[11]="","","#"&RC[11])))) -> 13439#10014#10004#10010#10008 | E70: =RC[11]&IF(RC[12]="","","#"&RC[12]&IF(RC[13]="","","#"&RC[13]&IF(RC[14]="","","#"&RC[14]&IF(RC[15]="","","#"&RC[15])))) -> 1#50#100#150#200 | F70: 28 | G70: 34 | H70: 38 | I70: 44 | K70: =R[-1]C -> 13439 | L70: =R[-1]C -> 10014 | M70: =R[-1]C -> 10004 | N70: =R[-1]C -> 10010 | O70: =R[-1]C -> 10008 | P70: =R[-1]C -> 1 | Q70: =R[-1]C -> 50 | R70: =R[-1]C -> 100 | S70: =R[-1]C -> 150 | T70: =R[-1]C -> 200 | U70: 同上
A71: 65 | B71: 50 | C71: =RC[3]&IF(RC[4]="","|200","|"&RC[4]&IF(RC[5]="","|200","|"&RC[5]&IF(RC[6]="","|200","|"&RC[6]&IF(RC[7]="","|200","|"&RC[7]&"|200")))) -> 28|34|38|44|200 | D71: =RC[7]&IF(RC[8]="","","#"&RC[8]&IF(RC[9]="","","#"&RC[9]&IF(RC[10]="","","#"&RC[10]&IF(RC[11]="","","#"&RC[11])))) -> 13439#10014#10004#10010#10008 | E71: =RC[11]&IF(RC[12]="","","#"&RC[12]&IF(RC[13]="","","#"&RC[13]&IF(RC[14]="","","#"&RC[14]&IF(RC[15]="","","#"&RC[15])))) -> 1#50#100#150#200 | F71: 28 | G71: 34 | H71: 38 | I71: 44 | K71: =R[-1]C -> 13439 | L71: =R[-1]C -> 10014 | M71: =R[-1]C -> 10004 | N71: =R[-1]C -> 10010 | O71: =R[-1]C -> 10008 | P71: =R[-1]C -> 1 | Q71: =R[-1]C -> 50 | R71: =R[-1]C -> 100 | S71: =R[-1]C -> 150 | T71: =R[-1]C -> 200 | U71: 同上
A72: 66 | B72: 50 | C72: =RC[3]&IF(RC[4]="","|200","|"&RC[4]&IF(RC[5]="","|200","|"&RC[5]&IF(RC[6]="","|200","|"&RC[6]&IF(RC[7]="","|200","|"&RC[7]&"|200")))) -> 28|34|38|44|200 | D72: =RC[7]&IF(RC[8]="","","#"&RC[8]&IF(RC[9]="","","#"&RC[9]&IF(RC[10]="","","#"&RC[10]&IF(RC[11]="","","#"&RC[11])))) -> 13439#10014#10004#10010#10008 | E72: =RC[11]&IF(RC[12]="","","#"&RC[12]&IF(RC[13]="","","#"&RC[13]&IF(RC[14]="","","#"&RC[14]&IF(RC[15]="","","#"&RC[15])))) -> 1#50#100#150#200 | F72: 28 | G72: 34 | H72: 38 | I72: 44 | K72: =R[-1]C -> 13439 | L72: =R[-1]C -> 10014 | M72: =R[-1]C -> 10004 | N72: =R[-1]C -> 10010 | O72: =R[-1]C -> 10008 | P72: =R[-1]C -> 1 | Q72: =R[-1]C -> 50 | R72: =R[-1]C -> 100 | S72: =R[-1]C -> 150 | T72: =R[-1]C -> 200 | U72: 同上
A73: 67 | B73: 50 | C73: =RC[3]&IF(RC[4]="","|200","|"&RC[4]&IF(RC[5]="","|200","|"&RC[5]&IF(RC[6]="","|200","|"&RC[6]&IF(RC[7]="","|200","|"&RC[7]&"|200")))) -> 28|34|38|44|200 | D73: =RC[7]&IF(RC[8]="","","#"&RC[8]&IF(RC[9]="","","#"&RC[9]&IF(RC[10]="","","#"&RC[10]&IF(RC[11]="","","#"&RC[11])))) -> 13439#10014#10004#10010#10008 | E73: =RC[11]&IF(RC[12]="","","#"&RC[12]&IF(RC[13]="","","#"&RC[13]&IF(RC[14]="","","#"&RC[14]&IF(RC[15]="","","#"&RC[15])))) -> 1#50#100#150#200 | F73: 28 | G73: 34 | H73: 38 | I73: 44 | K73: =R[-1]C -> 13439 | L73: =R[-1]C -> 10014 | M73: =R[-1]C -> 10004 | N73: =R[-1]C -> 10010 | O73: =R[-1]C -> 10008 | P73: =R[-1]C -> 1 | Q73: =R[-1]C -> 50 | R73: =R[-1]C -> 100 | S73: =R[-1]C -> 150 | T73: =R[-1]C -> 200 | U73: 同上
A74: 68 | B74: 50 | C74: =RC[3]&IF(RC[4]="","|200","|"&RC[4]&IF(RC[5]="","|200","|"&RC[5]&IF(RC[6]="","|200","|"&RC[6]&IF(RC[7]="","|200","|"&RC[7]&"|200")))) -> 28|34|38|44|200 | D74: =RC[7]&IF(RC[8]="","","#"&RC[8]&IF(RC[9]="","","#"&RC[9]&IF(RC[10]="","","#"&RC[10]&IF(RC[11]="","","#"&RC[11])))) -> 13439#10014#10004#10010#10008 | E74: =RC[11]&IF(RC[12]="","","#"&RC[12]&IF(RC[13]="","","#"&RC[13]&IF(RC[14]="","","#"&RC[14]&IF(RC[15]="","","#"&RC[15])))) -> 1#50#100#150#200 | F74: 28 | G74: 34 | H74: 38 | I74: 44 | K74: =R[-1]C -> 13439 | L74: =R[-1]C -> 10014 | M74: =R[-1]C -> 10004 | N74: =R[-1]C -> 10010 | O74: =R[-1]C -> 10008 | P74: =R[-1]C -> 1 | Q74: =R[-1]C -> 50 | R74: =R[-1]C -> 100 | S74: =R[-1]C -> 150 | T74: =R[-1]C -> 200 | U74: 同上
A75: 69 | B75: 50 | C75: =RC[3]&IF(RC[4]="","|200","|"&RC[4]&IF(RC[5]="","|200","|"&RC[5]&IF(RC[6]="","|200","|"&RC[6]&IF(RC[7]="","|200","|"&RC[7]&"|200")))) -> 28|34|38|44|200 | D75: =RC[7]&IF(RC[8]="","","#"&RC[8]&IF(RC[9]="","","#"&RC[9]&IF(RC[10]="","","#"&RC[10]&IF(RC[11]="","","#"&RC[11])))) -> 13439#10014#10004#10010#10008 | E75: =RC[11]&IF(RC[12]="","","#"&RC[12]&IF(RC[13]="","","#"&RC[13]&IF(RC[14]="","","#"&RC[14]&IF(RC[15]="","","#"&RC[15])))) -> 1#50#100#150#200 | F75: 28 | G75: 34 | H75: 38 | I75: 44 | K75: =R[-1]C -> 13439 | L75: =R[-1]C -> 10014 | M75: =R[-1]C -> 10004 | N75: =R[-1]C -> 10010 | O75: =R[-1]C -> 10008 | P75: =R[-1]C -> 1 | Q75: =R[-1]C -> 50 | R75: =R[-1]C -> 100 | S75: =R[-1]C -> 150 | T75: =R[-1]C -> 200 | U75: 同上
A76: 70 | B76: 50 | C76: =RC[3]&IF(RC[4]="","|200","|"&RC[4]&IF(RC[5]="","|200","|"&RC[5]&IF(RC[6]="","|200","|"&RC[6]&IF(RC[7]="","|200","|"&RC[7]&"|200")))) -> 28|34|38|44|200 | D76: =RC[7]&IF(RC[8]="","","#"&RC[8]&IF(RC[9]="","","#"&RC[9]&IF(RC[10]="","","#"&RC[10]&IF(RC[11]="","","#"&RC[11])))) -> 13439#10014#10004#10010#10008 | E76: =RC[11]&IF(RC[12]="","","#"&RC[12]&IF(RC[13]="","","#"&RC[13]&IF(RC[14]="","","#"&RC[14]&IF(RC[15]="","","#"&RC[15])))) -> 1#50#100#150#200 | F76: 28 | G76: 34 | H76: 38 | I76: 44 | K76: =R[-1]C -> 13439 | L76: =R[-1]C -> 10014 | M76: =R[-1]C -> 10004 | N76: =R[-1]C -> 10010 | O76: =R[-1]C -> 10008 | P76: =R[-1]C -> 1 | Q76: =R[-1]C -> 50 | R76: =R[-1]C -> 100 | S76: =R[-1]C -> 150 | T76: =R[-1]C -> 200 | U76: 同上
A77: 71 | B77: 50 | C77: =RC[3]&IF(RC[4]="","|200","|"&RC[4]&IF(RC[5]="","|200","|"&RC[5]&IF(RC[6]="","|200","|"&RC[6]&IF(RC[7]="","|200","|"&RC[7]&"|200")))) -> 28|34|38|44|200 | D77: =RC[7]&IF(RC[8]="","","#"&RC[8]&IF(RC[9]="","","#"&RC[9]&IF(RC[10]="","","#"&RC[10]&IF(RC[11]="","","#"&RC[11])))) -> 13439#10014#10004#10010#10008 | E77: =RC[11]&IF(RC[12]="","","#"&RC[12]&IF(RC[13]="","","#"&RC[13]&IF(RC[14]="","","#"&RC[14]&IF(RC[15]="","","#"&RC[15])))) -> 1#50#100#150#200 | F77: 28 | G77: 34 | H77: 38 | I77: 44 | K77: =R[-1]C -> 13439 | L77: =R[-1]C -> 10014 | M77: =R[-1]C -> 10004 | N77: =R[-1]C -> 10010 | O77: =R[-1]C -> 10008 | P77: =R[-1]C -> 1 | Q77: =R[-1]C -> 50 | R77: =R[-1]C -> 100 | S77: =R[-1]C -> 150 | T77: =R[-1]C -> 200 | U77: 同上
A78: 72 | B78: 50 | C78: =RC[3]&IF(RC[4]="","|200","|"&RC[4]&IF(RC[5]="","|200","|"&RC[5]&IF(RC[6]="","|200","|"&RC[6]&IF(RC[7]="","|200","|"&RC[7]&"|200")))) -> 28|34|38|44|200 | D78: =RC[7]&IF(RC[8]="","","#"&RC[8]&IF(RC[9]="","","#"&RC[9]&IF(RC[10]="","","#"&RC[10]&IF(RC[11]="","","#"&RC[11])))) -> 13439#10014#10004#10010#10008 | E78: =RC[11]&IF(RC[12]="","","#"&RC[12]&IF(RC[13]="","","#"&RC[13]&IF(RC[14]="","","#"&RC[14]&IF(RC[15]="","","#"&RC[15])))) -> 1#50#100#150#200 | F78: 28 | G78: 34 | H78: 38 | I78: 44 | K78: =R[-1]C -> 13439 | L78: =R[-1]C -> 10014 | M78: =R[-1]C -> 10004 | N78: =R[-1]C -> 10010 | O78: =R[-1]C -> 10008 | P78: =R[-1]C -> 1 | Q78: =R[-1]C -> 50 | R78: =R[-1]C -> 100 | S78: =R[-1]C -> 150 | T78: =R[-1]C -> 200 | U78: 同上
A79: 73 | B79: 50 | C79: =RC[3]&IF(RC[4]="","|200","|"&RC[4]&IF(RC[5]="","|200","|"&RC[5]&IF(RC[6]="","|200","|"&RC[6]&IF(RC[7]="","|200","|"&RC[7]&"|200")))) -> 28|34|38|44|200 | D79: =RC[7]&IF(RC[8]="","","#"&RC[8]&IF(RC[9]="","","#"&RC[9]&IF(RC[10]="","","#"&RC[10]&IF(RC[11]="","","#"&RC[11])))) -> 13439#10014#10004#10010#10008 | E79: =RC[11]&IF(RC[12]="","","#"&RC[12]&IF(RC[13]="","","#"&RC[13]&IF(RC[14]="","","#"&RC[14]&IF(RC[15]="","","#"&RC[15])))) -> 1#50#100#150#200 | F79: 28 | G79: 34 | H79: 38 | I79: 44 | K79: =R[-1]C -> 13439 | L79: =R[-1]C -> 10014 | M79: =R[-1]C -> 10004 | N79: =R[-1]C -> 10010 | O79: =R[-1]C -> 10008 | P79: =R[-1]C -> 1 | Q79: =R[-1]C -> 50 | R79: =R[-1]C -> 100 | S79: =R[-1]C -> 150 | T79: =R[-1]C -> 200 | U79: 同上
A80: 74 | B80: 50 | C80: =RC[3]&IF(RC[4]="","|200","|"&RC[4]&IF(RC[5]="","|200","|"&RC[5]&IF(RC[6]="","|200","|"&RC[6]&IF(RC[7]="","|200","|"&RC[7]&"|200")))) -> 28|34|38|44|200 | D80: =RC[7]&IF(RC[8]="","","#"&RC[8]&IF(RC[9]="","","#"&RC[9]&IF(RC[10]="","","#"&RC[10]&IF(RC[11]="","","#"&RC[11])))) -> 13439#10014#10004#10010#10008 | E80: =RC[11]&IF(RC[12]="","","#"&RC[12]&IF(RC[13]="","","#"&RC[13]&IF(RC[14]="","","#"&RC[14]&IF(RC[15]="","","#"&RC[15])))) -> 1#50#100#150#200 | F80: 28 | G80: 34 | H80: 38 | I80: 44 | K80: =R[-1]C -> 13439 | L80: =R[-1]C -> 10014 | M80: =R[-1]C -> 10004 | N80: =R[-1]C -> 10010 | O80: =R[-1]C -> 10008 | P80: =R[-1]C -> 1 | Q80: =R[-1]C -> 50 | R80: =R[-1]C -> 100 | S80: =R[-1]C -> 150 | T80: =R[-1]C -> 200 | U80: 同上
A81: 75 | B81: 50 | C81: =RC[3]&IF(RC[4]="","|200","|"&RC[4]&IF(RC[5]="","|200","|"&RC[5]&IF(RC[6]="","|200","|"&RC[6]&IF(RC[7]="","|200","|"&RC[7]&"|200")))) -> 28|34|38|44|200 | D81: =RC[7]&IF(RC[8]="","","#"&RC[8]&IF(RC[9]="","","#"&RC[9]&IF(RC[10]="","","#"&RC[10]&IF(RC[11]="","","#"&RC[11])))) -> 13439#10014#10004#10010#10008 | E81: =RC[11]&IF(RC[12]="","","#"&RC[12]&IF(RC[13]="","","#"&RC[13]&IF(RC[14]="","","#"&RC[14]&IF(RC[15]="","","#"&RC[15])))) -> 1#50#100#150#200 | F81: 28 | G81: 34 | H81: 38 | I81: 44 | K81: =R[-1]C -> 13439 | L81: =R[-1]C -> 10014 | M81: =R[-1]C -> 10004 | N81: =R[-1]C -> 10010 | O81: =R[-1]C -> 10008 | P81: =R[-1]C -> 1 | Q81: =R[-1]C -> 50 | R81: =R[-1]C -> 100 | S81: =R[-1]C -> 150 | T81: =R[-1]C -> 200 | U81: 同上
A82: 76 | B82: 50 | C82: =RC[3]&IF(RC[4]="","|200","|"&RC[4]&IF(RC[5]="","|200","|"&RC[5]&IF(RC[6]="","|200","|"&RC[6]&IF(RC[7]="","|200","|"&RC[7]&"|200")))) -> 28|34|38|44|200 | D82: =RC[7]&IF(RC[8]="","","#"&RC[8]&IF(RC[9]="","","#"&RC[9]&IF(RC[10]="","","#"&RC[10]&IF(RC[11]="","","#"&RC[11])))) -> 13439#10014#10004#10010#10008 | E82: =RC[11]&IF(RC[12]="","","#"&RC[12]&IF(RC[13]="","","#"&RC[13]&IF(RC[14]="","","#"&RC[14]&IF(RC[15]="","","#"&RC[15])))) -> 1#50#100#150#200 | F82: 28 | G82: 34 | H82: 38 | I82: 44 | K82: =R[-1]C -> 13439 | L82: =R[-1]C -> 10014 | M82: =R[-1]C -> 10004 | N82: =R[-1]C -> 10010 | O82: =R[-1]C -> 10008 | P82: =R[-1]C -> 1 | Q82: =R[-1]C -> 50 | R82: =R[-1]C -> 100 | S82: =R[-1]C -> 150 | T82: =R[-1]C -> 200 | U82: 同上
A83: 77 | B83: 50 | C83: =RC[3]&IF(RC[4]="","|200","|"&RC[4]&IF(RC[5]="","|200","|"&RC[5]&IF(RC[6]="","|200","|"&RC[6]&IF(RC[7]="","|200","|"&RC[7]&"|200")))) -> 28|34|38|44|200 | D83: =RC[7]&IF(RC[8]="","","#"&RC[8]&IF(RC[9]="","","#"&RC[9]&IF(RC[10]="","","#"&RC[10]&IF(RC[11]="","","#"&RC[11])))) -> 13439#10014#10004#10010#10008 | E83: =RC[11]&IF(RC[12]="","","#"&RC[12]&IF(RC[13]="","","#"&RC[13]&IF(RC[14]="","","#"&RC[14]&IF(RC[15]="","","#"&RC[15])))) -> 1#50#100#150#200 | F83: 28 | G83: 34 | H83: 38 | I83: 44 | K83: =R[-1]C -> 13439 | L83: =R[-1]C -> 10014 | M83: =R[-1]C -> 10004 | N83: =R[-1]C -> 10010 | O83: =R[-1]C -> 10008 | P83: =R[-1]C -> 1 | Q83: =R[-1]C -> 50 | R83: =R[-1]C -> 100 | S83: =R[-1]C -> 150 | T83: =R[-1]C -> 200 | U83: 同上
A84: 78 | B84: 50 | C84: =RC[3]&IF(RC[4]="","|200","|"&RC[4]&IF(RC[5]="","|200","|"&RC[5]&IF(RC[6]="","|200","|"&RC[6]&IF(RC[7]="","|200","|"&RC[7]&"|200")))) -> 28|34|38|44|200 | D84: =RC[7]&IF(RC[8]="","","#"&RC[8]&IF(RC[9]="","","#"&RC[9]&IF(RC[10]="","","#"&RC[10]&IF(RC[11]="","","#"&RC[11])))) -> 13439#10014#10004#10010#10008 | E84: =RC[11]&IF(RC[12]="","","#"&RC[12]&IF(RC[13]="","","#"&RC[13]&IF(RC[14]="","","#"&RC[14]&IF(RC[15]="","","#"&RC[15])))) -> 1#50#100#150#200 | F84: 28 | G84: 34 | H84: 38 | I84: 44 | K84: =R[-1]C -> 13439 | L84: =R[-1]C -> 10014 | M84: =R[-1]C -> 10004 | N84: =R[-1]C -> 10010 | O84: =R[-1]C -> 10008 | P84: =R[-1]C -> 1 | Q84: =R[-1]C -> 50 | R84: =R[-1]C -> 100 | S84: =R[-1]C -> 150 | T84: =R[-1]C -> 200 | U84: 同上
A85: 79 | B85: 50 | C85: =RC[3]&IF(RC[4]="","|200","|"&RC[4]&IF(RC[5]="","|200","|"&RC[5]&IF(RC[6]="","|200","|"&RC[6]&IF(RC[7]="","|200","|"&RC[7]&"|200")))) -> 28|34|38|44|200 | D85: =RC[7]&IF(RC[8]="","","#"&RC[8]&IF(RC[9]="","","#"&RC[9]&IF(RC[10]="","","#"&RC[10]&IF(RC[11]="","","#"&RC[11])))) -> 13439#10014#10004#10010#10008 | E85: =RC[11]&IF(RC[12]="","","#"&RC[12]&IF(RC[13]="","","#"&RC[13]&IF(RC[14]="","","#"&RC[14]&IF(RC[15]="","","#"&RC[15])))) -> 1#50#100#150#200 | F85: 28 | G85: 34 | H85: 38 | I85: 44 | K85: =R[-1]C -> 13439 | L85: =R[-1]C -> 10014 | M85: =R[-1]C -> 10004 | N85: =R[-1]C -> 10010 | O85: =R[-1]C -> 10008 | P85: =R[-1]C -> 1 | Q85: =R[-1]C -> 50 | R85: =R[-1]C -> 100 | S85: =R[-1]C -> 150 | T85: =R[-1]C -> 200 | U85: 同上
A86: 80 | B86: 50 | C86: =RC[3]&IF(RC[4]="","|200","|"&RC[4]&IF(RC[5]="","|200","|"&RC[5]&IF(RC[6]="","|200","|"&RC[6]&IF(RC[7]="","|200","|"&RC[7]&"|200")))) -> 28|34|38|44|200 | D86: =RC[7]&IF(RC[8]="","","#"&RC[8]&IF(RC[9]="","","#"&RC[9]&IF(RC[10]="","","#"&RC[10]&IF(RC[11]="","","#"&RC[11])))) -> 13439#10014#10004#10010#10008 | E86: =RC[11]&IF(RC[12]="","","#"&RC[12]&IF(RC[13]="","","#"&RC[13]&IF(RC[14]="","","#"&RC[14]&IF(RC[15]="","","#"&RC[15])))) -> 1#50#100#150#200 | F86: 28 | G86: 34 | H86: 38 | I86: 44 | K86: =R[-1]C -> 13439 | L86: =R[-1]C -> 10014 | M86: =R[-1]C -> 10004 | N86: =R[-1]C -> 10010 | O86: =R[-1]C -> 10008 | P86: =R[-1]C -> 1 | Q86: =R[-1]C -> 50 | R86: =R[-1]C -> 100 | S86: =R[-1]C -> 150 | T86: =R[-1]C -> 200 | U86: 同上
A87: 81 | B87: 50 | C87: =RC[3]&IF(RC[4]="","|200","|"&RC[4]&IF(RC[5]="","|200","|"&RC[5]&IF(RC[6]="","|200","|"&RC[6]&IF(RC[7]="","|200","|"&RC[7]&"|200")))) -> 28|34|38|44|200 | D87: =RC[7]&IF(RC[8]="","","#"&RC[8]&IF(RC[9]="","","#"&RC[9]&IF(RC[10]="","","#"&RC[10]&IF(RC[11]="","","#"&RC[11])))) -> 13439#10014#10004#10010#10008 | E87: =RC[11]&IF(RC[12]="","","#"&RC[12]&IF(RC[13]="","","#"&RC[13]&IF(RC[14]="","","#"&RC[14]&IF(RC[15]="","","#"&RC[15])))) -> 1#50#100#150#200 | F87: 28 | G87: 34 | H87: 38 | I87: 44 | K87: =R[-1]C -> 13439 | L87: =R[-1]C -> 10014 | M87: =R[-1]C -> 10004 | N87: =R[-1]C -> 10010 | O87: =R[-1]C -> 10008 | P87: =R[-1]C -> 1 | Q87: =R[-1]C -> 50 | R87: =R[-1]C -> 100 | S87: =R[-1]C -> 150 | T87: =R[-1]C -> 200 | U87: 同上
A88: 82 | B88: 50 | C88: =RC[3]&IF(RC[4]="","|200","|"&RC[4]&IF(RC[5]="","|200","|"&RC[5]&IF(RC[6]="","|200","|"&RC[6]&IF(RC[7]="","|200","|"&RC[7]&"|200")))) -> 28|34|38|44|200 | D88: =RC[7]&IF(RC[8]="","","#"&RC[8]&IF(RC[9]="","","#"&RC[9]&IF(RC[10]="","","#"&RC[10]&IF(RC[11]="","","#"&RC[11])))) -> 13439#10014#10004#10010#10008 | E88: =RC[11]&IF(RC[12]="","","#"&RC[12]&IF(RC[13]="","","#"&RC[13]&IF(RC[14]="","","#"&RC[14]&IF(RC[15]="","","#"&RC[15])))) -> 1#50#100#150#200 | F88: 28 | G88: 34 | H88: 38 | I88: 44 | K88: =R[-1]C -> 13439 | L88: =R[-1]C -> 10014 | M88: =R[-1]C -> 10004 | N88: =R[-1]C -> 10010 | O88: =R[-1]C -> 10008 | P88: =R[-1]C -> 1 | Q88: =R[-1]C -> 50 | R88: =R[-1]C -> 100 | S88: =R[-1]C -> 150 | T88: =R[-1]C -> 200 | U88: 同上
A89: 83 | B89: 50 | C89: =RC[3]&IF(RC[4]="","|200","|"&RC[4]&IF(RC[5]="","|200","|"&RC[5]&IF(RC[6]="","|200","|"&RC[6]&IF(RC[7]="","|200","|"&RC[7]&"|200")))) -> 28|34|38|44|200 | D89: =RC[7]&IF(RC[8]="","","#"&RC[8]&IF(RC[9]="","","#"&RC[9]&IF(RC[10]="","","#"&RC[10]&IF(RC[11]="","","#"&RC[11])))) -> 13439#10014#10004#10010#10008 | E89: =RC[11]&IF(RC[12]="","","#"&RC[12]&IF(RC[13]="","","#"&RC[13]&IF(RC[14]="","","#"&RC[14]&IF(RC[15]="","","#"&RC[15])))) -> 1#50#100#150#200 | F89: 28 | G89: 34 | H89: 38 | I89: 44 | K89: =R[-1]C -> 13439 | L89: =R[-1]C -> 10014 | M89: =R[-1]C -> 10004 | N89: =R[-1]C -> 10010 | O89: =R[-1]C -> 10008 | P89: =R[-1]C -> 1 | Q89: =R[-1]C -> 50 | R89: =R[-1]C -> 100 | S89: =R[-1]C -> 150 | T89: =R[-1]C -> 200 | U89: 同上
A90: 84 | B90: 50 | C90: =RC[3]&IF(RC[4]="","|200","|"&RC[4]&IF(RC[5]="","|200","|"&RC[5]&IF(RC[6]="","|200","|"&RC[6]&IF(RC[7]="","|200","|"&RC[7]&"|200")))) -> 28|34|38|44|200 | D90: =RC[7]&IF(RC[8]="","","#"&RC[8]&IF(RC[9]="","","#"&RC[9]&IF(RC[10]="","","#"&RC[10]&IF(RC[11]="","","#"&RC[11])))) -> 13439#10014#10004#10010#10008 | E90: =RC[11]&IF(RC[12]="","","#"&RC[12]&IF(RC[13]="","","#"&RC[13]&IF(RC[14]="","","#"&RC[14]&IF(RC[15]="","","#"&RC[15])))) -> 1#50#100#150#200 | F90: 28 | G90: 34 | H90: 38 | I90: 44 | K90: =R[-1]C -> 13439 | L90: =R[-1]C -> 10014 | M90: =R[-1]C -> 10004 | N90: =R[-1]C -> 10010 | O90: =R[-1]C -> 10008 | P90: =R[-1]C -> 1 | Q90: =R[-1]C -> 50 | R90: =R[-1]C -> 100 | S90: =R[-1]C -> 150 | T90: =R[-1]C -> 200 | U90: 同上
A91: 85 | B91: 50 | C91: =RC[3]&IF(RC[4]="","|200","|"&RC[4]&IF(RC[5]="","|200","|"&RC[5]&IF(RC[6]="","|200","|"&RC[6]&IF(RC[7]="","|200","|"&RC[7]&"|200")))) -> 28|34|38|44|200 | D91: =RC[7]&IF(RC[8]="","","#"&RC[8]&IF(RC[9]="","","#"&RC[9]&IF(RC[10]="","","#"&RC[10]&IF(RC[11]="","","#"&RC[11])))) -> 13439#10014#10004#10010#10008 | E91: =RC[11]&IF(RC[12]="","","#"&RC[12]&IF(RC[13]="","","#"&RC[13]&IF(RC[14]="","","#"&RC[14]&IF(RC[15]="","","#"&RC[15])))) -> 1#50#100#150#200 | F91: 28 | G91: 34 | H91: 38 | I91: 44 | K91: =R[-1]C -> 13439 | L91: =R[-1]C -> 10014 | M91: =R[-1]C -> 10004 | N91: =R[-1]C -> 10010 | O91: =R[-1]C -> 10008 | P91: =R[-1]C -> 1 | Q91: =R[-1]C -> 50 | R91: =R[-1]C -> 100 | S91: =R[-1]C -> 150 | T91: =R[-1]C -> 200 | U91: 同上
A92: 86 | B92: 50 | C92: =RC[3]&IF(RC[4]="","|200","|"&RC[4]&IF(RC[5]="","|200","|"&RC[5]&IF(RC[6]="","|200","|"&RC[6]&IF(RC[7]="","|200","|"&RC[7]&"|200")))) -> 28|34|38|44|200 | D92: =RC[7]&IF(RC[8]="","","#"&RC[8]&IF(RC[9]="","","#"&RC[9]&IF(RC[10]="","","#"&RC[10]&IF(RC[11]="","","#"&RC[11])))) -> 13439#10014#10004#10010#10008 | E92: =RC[11]&IF(RC[12]="","","#"&RC[12]&IF(RC[13]="","","#"&RC[13]&IF(RC[14]="","","#"&RC[14]&IF(RC[15]="","","#"&RC[15])))) -> 1#50#100#150#200 | F92: 28 | G92: 34 | H92: 38 | I92: 44 | K92: =R[-1]C -> 13439 | L92: =R[-1]C -> 10014 | M92: =R[-1]C -> 10004 | N92: =R[-1]C -> 10010 | O92: =R[-1]C -> 10008 | P92: =R[-1]C -> 1 | Q92: =R[-1]C -> 50 | R92: =R[-1]C -> 100 | S92: =R[-1]C -> 150 | T92: =R[-1]C -> 200 | U92: 同上
A93: 87 | B93: 50 | C93: =RC[3]&IF(RC[4]="","|200","|"&RC[4]&IF(RC[5]="","|200","|"&RC[5]&IF(RC[6]="","|200","|"&RC[6]&IF(RC[7]="","|200","|"&RC[7]&"|200")))) -> 28|34|38|44|200 | D93: =RC[7]&IF(RC[8]="","","#"&RC[8]&IF(RC[9]="","","#"&RC[9]&IF(RC[10]="","","#"&RC[10]&IF(RC[11]="","","#"&RC[11])))) -> 13439#10014#10004#10010#10008 | E93: =RC[11]&IF(RC[12]="","","#"&RC[12]&IF(RC[13]="","","#"&RC[13]&IF(RC[14]="","","#"&RC[14]&IF(RC[15]="","","#"&RC[15])))) -> 1#50#100#150#200 | F93: 28 | G93: 34 | H93: 38 | I93: 44 | K93: =R[-1]C -> 13439 | L93: =R[-1]C -> 10014 | M93: =R[-1]C -> 10004 | N93: =R[-1]C -> 10010 | O93: =R[-1]C -> 10008 | P93: =R[-1]C -> 1 | Q93: =R[-1]C -> 50 | R93: =R[-1]C -> 100 | S93: =R[-1]C -> 150 | T93: =R[-1]C -> 200 | U93: 同上
A94: 88 | B94: 50 | C94: =RC[3]&IF(RC[4]="","|200","|"&RC[4]&IF(RC[5]="","|200","|"&RC[5]&IF(RC[6]="","|200","|"&RC[6]&IF(RC[7]="","|200","|"&RC[7]&"|200")))) -> 28|34|38|44|200 | D94: =RC[7]&IF(RC[8]="","","#"&RC[8]&IF(RC[9]="","","#"&RC[9]&IF(RC[10]="","","#"&RC[10]&IF(RC[11]="","","#"&RC[11])))) -> 13439#10014#10004#10010#10008 | E94: =RC[11]&IF(RC[12]="","","#"&RC[12]&IF(RC[13]="","","#"&RC[13]&IF(RC[14]="","","#"&RC[14]&IF(RC[15]="","","#"&RC[15])))) -> 1#50#100#150#200 | F94: 28 | G94: 34 | H94: 38 | I94: 44 | K94: =R[-1]C -> 13439 | L94: =R[-1]C -> 10014 | M94: =R[-1]C -> 10004 | N94: =R[-1]C -> 10010 | O94: =R[-1]C -> 10008 | P94: =R[-1]C -> 1 | Q94: =R[-1]C -> 50 | R94: =R[-1]C -> 100 | S94: =R[-1]C -> 150 | T94: =R[-1]C -> 200 | U94: 同上
A95: 89 | B95: 50 | C95: =RC[3]&IF(RC[4]="","|200","|"&RC[4]&IF(RC[5]="","|200","|"&RC[5]&IF(RC[6]="","|200","|"&RC[6]&IF(RC[7]="","|200","|"&RC[7]&"|200")))) -> 28|34|38|44|200 | D95: =RC[7]&IF(RC[8]="","","#"&RC[8]&IF(RC[9]="","","#"&RC[9]&IF(RC[10]="","","#"&RC[10]&IF(RC[11]="","","#"&RC[11])))) -> 13439#10014#10004#10010#10008 | E95: =RC[11]&IF(RC[12]="","","#"&RC[12]&IF(RC[13]="","","#"&RC[13]&IF(RC[14]="","","#"&RC[14]&IF(RC[15]="","","#"&RC[15])))) -> 1#50#100#150#200 | F95: 28 | G95: 34 | H95: 38 | I95: 44 | K95: =R[-1]C -> 13439 | L95: =R[-1]C -> 10014 | M95: =R[-1]C -> 10004 | N95: =R[-1]C -> 10010 | O95: =R[-1]C -> 10008 | P95: =R[-1]C -> 1 | Q95: =R[-1]C -> 50 | R95: =R[-1]C -> 100 | S95: =R[-1]C -> 150 | T95: =R[-1]C -> 200 | U95: 同上
A96: 90 | B96: 50 | C96: =RC[3]&IF(RC[4]="","|200","|"&RC[4]&IF(RC[5]="","|200","|"&RC[5]&IF(RC[6]="","|200","|"&RC[6]&IF(RC[7]="","|200","|"&RC[7]&"|200")))) -> 28|34|38|44|200 | D96: =RC[7]&IF(RC[8]="","","#"&RC[8]&IF(RC[9]="","","#"&RC[9]&IF(RC[10]="","","#"&RC[10]&IF(RC[11]="","","#"&RC[11])))) -> 13439#10014#10004#10010#10008 | E96: =RC[11]&IF(RC[12]="","","#"&RC[12]&IF(RC[13]="","","#"&RC[13]&IF(RC[14]="","","#"&RC[14]&IF(RC[15]="","","#"&RC[15])))) -> 1#50#100#150#200 | F96: 28 | G96: 34 | H96: 38 | I96: 44 | K96: =R[-1]C -> 13439 | L96: =R[-1]C -> 10014 | M96: =R[-1]C -> 10004 | N96: =R[-1]C -> 10010 | O96: =R[-1]C -> 10008 | P96: =R[-1]C -> 1 | Q96: =R[-1]C -> 50 | R96: =R[-1]C -> 100 | S96: =R[-1]C -> 150 | T96: =R[-1]C -> 200 | U96: 同上
A97: 91 | B97: 50 | C97: =RC[3]&IF(RC[4]="","|200","|"&RC[4]&IF(RC[5]="","|200","|"&RC[5]&IF(RC[6]="","|200","|"&RC[6]&IF(RC[7]="","|200","|"&RC[7]&"|200")))) -> 28|34|38|44|200 | D97: =RC[7]&IF(RC[8]="","","#"&RC[8]&IF(RC[9]="","","#"&RC[9]&IF(RC[10]="","","#"&RC[10]&IF(RC[11]="","","#"&RC[11])))) -> 13439#10014#10004#10010#10008 | E97: =RC[11]&IF(RC[12]="","","#"&RC[12]&IF(RC[13]="","","#"&RC[13]&IF(RC[14]="","","#"&RC[14]&IF(RC[15]="","","#"&RC[15])))) -> 1#50#100#150#200 | F97: 28 | G97: 34 | H97: 38 | I97: 44 | K97: =R[-1]C -> 13439 | L97: =R[-1]C -> 10014 | M97: =R[-1]C -> 10004 | N97: =R[-1]C -> 10010 | O97: =R[-1]C -> 10008 | P97: =R[-1]C -> 1 | Q97: =R[-1]C -> 50 | R97: =R[-1]C -> 100 | S97: =R[-1]C -> 150 | T97: =R[-1]C -> 200 | U97: 同上
A98: 92 | B98: 50 | C98: =RC[3]&IF(RC[4]="","|200","|"&RC[4]&IF(RC[5]="","|200","|"&RC[5]&IF(RC[6]="","|200","|"&RC[6]&IF(RC[7]="","|200","|"&RC[7]&"|200")))) -> 28|34|38|44|200 | D98: =RC[7]&IF(RC[8]="","","#"&RC[8]&IF(RC[9]="","","#"&RC[9]&IF(RC[10]="","","#"&RC[10]&IF(RC[11]="","","#"&RC[11])))) -> 13439#10014#10004#10010#10008 | E98: =RC[11]&IF(RC[12]="","","#"&RC[12]&IF(RC[13]="","","#"&RC[13]&IF(RC[14]="","","#"&RC[14]&IF(RC[15]="","","#"&RC[15])))) -> 1#50#100#150#200 | F98: 28 | G98: 34 | H98: 38 | I98: 44 | K98: =R[-1]C -> 13439 | L98: =R[-1]C -> 10014 | M98: =R[-1]C -> 10004 | N98: =R[-1]C -> 10010 | O98: =R[-1]C -> 10008 | P98: =R[-1]C -> 1 | Q98: =R[-1]C -> 50 | R98: =R[-1]C -> 100 | S98: =R[-1]C -> 150 | T98: =R[-1]C -> 200 | U98: 同上
A99: 93 | B99: 50 | C99: =RC[3]&IF(RC[4]="","|200","|"&RC[4]&IF(RC[5]="","|200","|"&RC[5]&IF(RC[6]="","|200","|"&RC[6]&IF(RC[7]="","|200","|"&RC[7]&"|200")))) -> 28|34|38|44|200 | D99: =RC[7]&IF(RC[8]="","","#"&RC[8]&IF(RC[9]="","","#"&RC[9]&IF(RC[10]="","","#"&RC[10]&IF(RC[11]="","","#"&RC[11])))) -> 13439#10014#10004#10010#10008 | E99: =RC[11]&IF(RC[12]="","","#"&RC[12]&IF(RC[13]="","","#"&RC[13]&IF(RC[14]="","","#"&RC[14]&IF(RC[15]="","","#"&RC[15])))) -> 1#50#100#150#200 | F99: 28 | G99: 34 | H99: 38 | I99: 44 | K99: =R[-1]C -> 13439 | L99: =R[-1]C -> 10014 | M99: =R[-1]C -> 10004 | N99: =R[-1]C -> 10010 | O99: =R[-1]C -> 10008 | P99: =R[-1]C -> 1 | Q99: =R[-1]C -> 50 | R99: =R[-1]C -> 100 | S99: =R[-1]C -> 150 | T99: =R[-1]C -> 200 | U99: 同上
A100: 94 | B100: 50 | C100: =RC[3]&IF(RC[4]="","|200","|"&RC[4]&IF(RC[5]="","|200","|"&RC[5]&IF(RC[6]="","|200","|"&RC[6]&IF(RC[7]="","|200","|"&RC[7]&"|200")))) -> 28|34|38|44|200 | D100: =RC[7]&IF(RC[8]="","","#"&RC[8]&IF(RC[9]="","","#"&RC[9]&IF(RC[10]="","","#"&RC[10]&IF(RC[11]="","","#"&RC[11])))) -> 13439#10014#10004#10010#10008 | E100: =RC[11]&IF(RC[12]="","","#"&RC[12]&IF(RC[13]="","","#"&RC[13]&IF(RC[14]="","","#"&RC[14]&IF(RC[15]="","","#"&RC[15])))) -> 1#50#100#150#200 | F100: 28 | G100: 34 | H100: 38 | I100: 44 | K100: =R[-1]C -> 13439 | L100: =R[-1]C -> 10014 | M100: =R[-1]C -> 10004 | N100: =R[-1]C -> 10010 | O100: =R[-1]C -> 10008 | P100: =R[-1]C -> 1 | Q100: =R[-1]C -> 50 | R100: =R[-1]C -> 100 | S100: =R[-1]C -> 150 | T100: =R[-1]C -> 200 | U100: 同上
A101: 95 | B101: 50 | C101: =RC[3]&IF(RC[4]="","|200","|"&RC[4]&IF(RC[5]="","|200","|"&RC[5]&IF(RC[6]="","|200","|"&RC[6]&IF(RC[7]="","|200","|"&RC[7]&"|200")))) -> 28|34|38|44|200 | D101: =RC[7]&IF(RC[8]="","","#"&RC[8]&IF(RC[9]="","","#"&RC[9]&IF(RC[10]="","","#"&RC[10]&IF(RC[11]="","","#"&RC[11])))) -> 13439#10014#10004#10010#10008 | E101: =RC[11]&IF(RC[12]="","","#"&RC[12]&IF(RC[13]="","","#"&RC[13]&IF(RC[14]="","","#"&RC[14]&IF(RC[15]="","","#"&RC[15])))) -> 1#50#100#150#200 | F101: 28 | G101: 34 | H101: 38 | I101: 44 | K101: =R[-1]C -> 13439 | L101: =R[-1]C -> 10014 | M101: =R[-1]C -> 10004 | N101: =R[-1]C -> 10010 | O101: =R[-1]C -> 10008 | P101: =R[-1]C -> 1 | Q101: =R[-1]C -> 50 | R101: =R[-1]C -> 100 | S101: =R[-1]C -> 150 | T101: =R[-1]C -> 200 | U101: 同上
A102: 96 | B102: 50 | C102: =RC[3]&IF(RC[4]="","|200","|"&RC[4]&IF(RC[5]="","|200","|"&RC[5]&IF(RC[6]="","|200","|"&RC[6]&IF(RC[7]="","|200","|"&RC[7]&"|200")))) -> 28|34|38|44|200 | D102: =RC[7]&IF(RC[8]="","","#"&RC[8]&IF(RC[9]="","","#"&RC[9]&IF(RC[10]="","","#"&RC[10]&IF(RC[11]="","","#"&RC[11])))) -> 13439#10014#10004#10010#10008 | E102: =RC[11]&IF(RC[12]="","","#"&RC[12]&IF(RC[13]="","","#"&RC[13]&IF(RC[14]="","","#"&RC[14]&IF(RC[15]="","","#"&RC[15])))) -> 1#50#100#150#200 | F102: 28 | G102: 34 | H102: 38 | I102: 44 | K102: =R[-1]C -> 13439 | L102: =R[-1]C -> 10014 | M102: =R[-1]C -> 10004 | N102: =R[-1]C -> 10010 | O102: =R[-1]C -> 10008 | P102: =R[-1]C -> 1 | Q102: =R[-1]C -> 50 | R102: =R[-1]C -> 100 | S102: =R[-1]C -> 150 | T102: =R[-1]C -> 200 | U102: 同上
A103: 97 | B103: 50 | C103: =RC[3]&IF(RC[4]="","|200","|"&RC[4]&IF(RC[5]="","|200","|"&RC[5]&IF(RC[6]="","|200","|"&RC[6]&IF(RC[7]="","|200","|"&RC[7]&"|200")))) -> 28|34|38|44|200 | D103: =RC[7]&IF(RC[8]="","","#"&RC[8]&IF(RC[9]="","","#"&RC[9]&IF(RC[10]="","","#"&RC[10]&IF(RC[11]="","","#"&RC[11])))) -> 13439#10014#10004#10010#10008 | E103: =RC[11]&IF(RC[12]="","","#"&RC[12]&IF(RC[13]="","","#"&RC[13]&IF(RC[14]="","","#"&RC[14]&IF(RC[15]="","","#"&RC[15])))) -> 1#50#100#150#200 | F103: 28 | G103: 34 | H103: 38 | I103: 44 | K103: =R[-1]C -> 13439 | L103: =R[-1]C -> 10014 | M103: =R[-1]C -> 10004 | N103: =R[-1]C -> 10010 | O103: =R[-1]C -> 10008 | P103: =R[-1]C -> 1 | Q103: =R[-1]C -> 50 | R103: =R[-1]C -> 100 | S103: =R[-1]C -> 150 | T103: =R[-1]C -> 200 | U103: 同上
A104: 98 | B104: 50 | C104: =RC[3]&IF(RC[4]="","|200","|"&RC[4]&IF(RC[5]="","|200","|"&RC[5]&IF(RC[6]="","|200","|"&RC[6]&IF(RC[7]="","|200","|"&RC[7]&"|200")))) -> 28|34|38|44|200 | D104: =RC[7]&IF(RC[8]="","","#"&RC[8]&IF(RC[9]="","","#"&RC[9]&IF(RC[10]="","","#"&RC[10]&IF(RC[11]="","","#"&RC[11])))) -> 13439#10014#10004#10010#10008 | E104: =RC[11]&IF(RC[12]="","","#"&RC[12]&IF(RC[13]="","","#"&RC[13]&IF(RC[14]="","","#"&RC[14]&IF(RC[15]="","","#"&RC[15])))) -> 1#50#100#150#200 | F104: 28 | G104: 34 | H104: 38 | I104: 44 | K104: =R[-1]C -> 13439 | L104: =R[-1]C -> 10014 | M104: =R[-1]C -> 10004 | N104: =R[-1]C -> 10010 | O104: =R[-1]C -> 10008 | P104: =R[-1]C -> 1 | Q104: =R[-1]C -> 50 | R104: =R[-1]C -> 100 | S104: =R[-1]C -> 150 | T104: =R[-1]C -> 200 | U104: 同上
A105: 99 | B105: 50 | C105: =RC[3]&IF(RC[4]="","|200","|"&RC[4]&IF(RC[5]="","|200","|"&RC[5]&IF(RC[6]="","|200","|"&RC[6]&IF(RC[7]="","|200","|"&RC[7]&"|200")))) -> 28|34|38|44|200 | D105: =RC[7]&IF(RC[8]="","","#"&RC[8]&IF(RC[9]="","","#"&RC[9]&IF(RC[10]="","","#"&RC[10]&IF(RC[11]="","","#"&RC[11])))) -> 13439#10014#10004#10010#10008 | E105: =RC[11]&IF(RC[12]="","","#"&RC[12]&IF(RC[13]="","","#"&RC[13]&IF(RC[14]="","","#"&RC[14]&IF(RC[15]="","","#"&RC[15])))) -> 1#50#100#150#200 | F105: 28 | G105: 34 | H105: 38 | I105: 44 | K105: =R[-1]C -> 13439 | L105: =R[-1]C -> 10014 | M105: =R[-1]C -> 10004 | N105: =R[-1]C -> 10010 | O105: =R[-1]C -> 10008 | P105: =R[-1]C -> 1 | Q105: =R[-1]C -> 50 | R105: =R[-1]C -> 100 | S105: =R[-1]C -> 150 | T105: =R[-1]C -> 200 | U105: 同上
A106: 100 | B106: 50 | C106: =RC[3]&IF(RC[4]="","|200","|"&RC[4]&IF(RC[5]="","|200","|"&RC[5]&IF(RC[6]="","|200","|"&RC[6]&IF(RC[7]="","|200","|"&RC[7]&"|200")))) -> 28|34|38|44|200 | D106: =RC[7]&IF(RC[8]="","","#"&RC[8]&IF(RC[9]="","","#"&RC[9]&IF(RC[10]="","","#"&RC[10]&IF(RC[11]="","","#"&RC[11])))) -> 13439#10014#10004#10010#10008 | E106: =RC[11]&IF(RC[12]="","","#"&RC[12]&IF(RC[13]="","","#"&RC[13]&IF(RC[14]="","","#"&RC[14]&IF(RC[15]="","","#"&RC[15])))) -> 1#50#100#150#200 | F106: 28 | G106: 34 | H106: 38 | I106: 44 | K106: =R[-1]C -> 13439 | L106: =R[-1]C -> 10014 | M106: =R[-1]C -> 10004 | N106: =R[-1]C -> 10010 | O106: =R[-1]C -> 10008 | P106: =R[-1]C -> 1 | Q106: =R[-1]C -> 50 | R106: =R[-1]C -> 100 | S106: =R[-1]C -> 150 | T106: =R[-1]C -> 200 | U106: 同上
A107: 101 | B107: 50 | C107: =RC[3]&IF(RC[4]="","|200","|"&RC[4]&IF(RC[5]="","|200","|"&RC[5]&IF(RC[6]="","|200","|"&RC[6]&IF(RC[7]="","|200","|"&RC[7]&"|200")))) -> 28|34|38|44|200 | D107: =RC[7]&IF(RC[8]="","","#"&RC[8]&IF(RC[9]="","","#"&RC[9]&IF(RC[10]="","","#"&RC[10]&IF(RC[11]="","","#"&RC[11])))) -> 13439#10014#10004#10010#10008 | E107: =RC[11]&IF(RC[12]="","","#"&RC[12]&IF(RC[13]="","","#"&RC[13]&IF(RC[14]="","","#"&RC[14]&IF(RC[15]="","","#"&RC[15])))) -> 1#50#100#150#200 | F107: 28 | G107: 34 | H107: 38 | I107: 44 | K107: =R[-1]C -> 13439 | L107: =R[-1]C -> 10014 | M107: =R[-1]C -> 10004 | N107: =R[-1]C -> 10010 | O107: =R[-1]C -> 10008 | P107: =R[-1]C -> 1 | Q107: =R[-1]C -> 50 | R107: =R[-1]C -> 100 | S107: =R[-1]C -> 150 | T107: =R[-1]C -> 200 | U107: 同上
A108: 102 | B108: 50 | C108: =RC[3]&IF(RC[4]="","|200","|"&RC[4]&IF(RC[5]="","|200","|"&RC[5]&IF(RC[6]="","|200","|"&RC[6]&IF(RC[7]="","|200","|"&RC[7]&"|200")))) -> 28|34|38|44|200 | D108: =RC[7]&IF(RC[8]="","","#"&RC[8]&IF(RC[9]="","","#"&RC[9]&IF(RC[10]="","","#"&RC[10]&IF(RC[11]="","","#"&RC[11])))) -> 13439#10014#10004#10010#10008 | E108: =RC[11]&IF(RC[12]="","","#"&RC[12]&IF(RC[13]="","","#"&RC[13]&IF(RC[14]="","","#"&RC[14]&IF(RC[15]="","","#"&RC[15])))) -> 1#50#100#150#200 | F108: 28 | G108: 34 | H108: 38 | I108: 44 | K108: =R[-1]C -> 13439 | L108: =R[-1]C -> 10014 | M108: =R[-1]C -> 10004 | N108: =R[-1]C -> 10010 | O108: =R[-1]C -> 10008 | P108: =R[-1]C -> 1 | Q108: =R[-1]C -> 50 | R108: =R[-1]C -> 100 | S108: =R[-1]C -> 150 | T108: =R[-1]C -> 200 | U108: 同上
A109: 103 | B109: 50 | C109: =RC[3]&IF(RC[4]="","|200","|"&RC[4]&IF(RC[5]="","|200","|"&RC[5]&IF(RC[6]="","|200","|"&RC[6]&IF(RC[7]="","|200","|"&RC[7]&"|200")))) -> 28|34|38|44|200 | D109: =RC[7]&IF(RC[8]="","","#"&RC[8]&IF(RC[9]="","","#"&RC[9]&IF(RC[10]="","","#"&RC[10]&IF(RC[11]="","","#"&RC[11])))) -> 13439#10014#10004#10010#10008 | E109: =RC[11]&IF(RC[12]="","","#"&RC[12]&IF(RC[13]="","","#"&RC[13]&IF(RC[14]="","","#"&RC[14]&IF(RC[15]="","","#"&RC[15])))) -> 1#50#100#150#200 | F109: 28 | G109: 34 | H109: 38 | I109: 44 | K109: =R[-1]C -> 13439 | L109: =R[-1]C -> 10014 | M109: =R[-1]C -> 10004 | N109: =R[-1]C -> 10010 | O109: =R[-1]C -> 10008 | P109: =R[-1]C -> 1 | Q109: =R[-1]C -> 50 | R109: =R[-1]C -> 100 | S109: =R[-1]C -> 150 | T109: =R[-1]C -> 200 | U109: 同上
A110: 104 | B110: 50 | C110: =RC[3]&IF(RC[4]="","|200","|"&RC[4]&IF(RC[5]="","|200","|"&RC[5]&IF(RC[6]="","|200","|"&RC[6]&IF(RC[7]="","|200","|"&RC[7]&"|200")))) -> 28|34|38|44|200 | D110: =RC[7]&IF(RC[8]="","","#"&RC[8]&IF(RC[9]="","","#"&RC[9]&IF(RC[10]="","","#"&RC[10]&IF(RC[11]="","","#"&RC[11])))) -> 13439#10014#10004#10010#10008 | E110: =RC[11]&IF(RC[12]="","","#"&RC[12]&IF(RC[13]="","","#"&RC[13]&IF(RC[14]="","","#"&RC[14]&IF(RC[15]="","","#"&RC[15])))) -> 1#50#100#150#200 | F110: 28 | G110: 34 | H110: 38 | I110: 44 | K110: =R[-1]C -> 13439 | L110: =R[-1]C -> 10014 | M110: =R[-1]C -> 10004 | N110: =R[-1]C -> 10010 | O110: =R[-1]C -> 10008 | P110: =R[-1]C -> 1 | Q110: =R[-1]C -> 50 | R110: =R[-1]C -> 100 | S110: =R[-1]C -> 150 | T110: =R[-1]C -> 200 | U110: 同上
A111: 105 | B111: 50 | C111: =RC[3]&IF(RC[4]="","|200","|"&RC[4]&IF(RC[5]="","|200","|"&RC[5]&IF(RC[6]="","|200","|"&RC[6]&IF(RC[7]="","|200","|"&RC[7]&"|200")))) -> 28|34|38|44|200 | D111: =RC[7]&IF(RC[8]="","","#"&RC[8]&IF(RC[9]="","","#"&RC[9]&IF(RC[10]="","","#"&RC[10]&IF(RC[11]="","","#"&RC[11])))) -> 13439#10014#10004#10010#10008 | E111: =RC[11]&IF(RC[12]="","","#"&RC[12]&IF(RC[13]="","","#"&RC[13]&IF(RC[14]="","","#"&RC[14]&IF(RC[15]="","","#"&RC[15])))) -> 1#50#100#150#200 | F111: 28 | G111: 34 | H111: 38 | I111: 44 | K111: =R[-1]C -> 13439 | L111: =R[-1]C -> 10014 | M111: =R[-1]C -> 10004 | N111: =R[-1]C -> 10010 | O111: =R[-1]C -> 10008 | P111: =R[-1]C -> 1 | Q111: =R[-1]C -> 50 | R111: =R[-1]C -> 100 | S111: =R[-1]C -> 150 | T111: =R[-1]C -> 200 | U111: 同上
A112: 106 | B112: 50 | C112: =RC[3]&IF(RC[4]="","|200","|"&RC[4]&IF(RC[5]="","|200","|"&RC[5]&IF(RC[6]="","|200","|"&RC[6]&IF(RC[7]="","|200","|"&RC[7]&"|200")))) -> 28|34|38|44|200 | D112: =RC[7]&IF(RC[8]="","","#"&RC[8]&IF(RC[9]="","","#"&RC[9]&IF(RC[10]="","","#"&RC[10]&IF(RC[11]="","","#"&RC[11])))) -> 13439#10014#10004#10010#10008 | E112: =RC[11]&IF(RC[12]="","","#"&RC[12]&IF(RC[13]="","","#"&RC[13]&IF(RC[14]="","","#"&RC[14]&IF(RC[15]="","","#"&RC[15])))) -> 1#50#100#150#200 | F112: 28 | G112: 34 | H112: 38 | I112: 44 | K112: =R[-1]C -> 13439 | L112: =R[-1]C -> 10014 | M112: =R[-1]C -> 10004 | N112: =R[-1]C -> 10010 | O112: =R[-1]C -> 10008 | P112: =R[-1]C -> 1 | Q112: =R[-1]C -> 50 | R112: =R[-1]C -> 100 | S112: =R[-1]C -> 150 | T112: =R[-1]C -> 200 | U112: 同上
A113: 107 | B113: 50 | C113: =RC[3]&IF(RC[4]="","|200","|"&RC[4]&IF(RC[5]="","|200","|"&RC[5]&IF(RC[6]="","|200","|"&RC[6]&IF(RC[7]="","|200","|"&RC[7]&"|200")))) -> 28|34|38|44|200 | D113: =RC[7]&IF(RC[8]="","","#"&RC[8]&IF(RC[9]="","","#"&RC[9]&IF(RC[10]="","","#"&RC[10]&IF(RC[11]="","","#"&RC[11])))) -> 13439#10014#10004#10010#10008 | E113: =RC[11]&IF(RC[12]="","","#"&RC[12]&IF(RC[13]="","","#"&RC[13]&IF(RC[14]="","","#"&RC[14]&IF(RC[15]="","","#"&RC[15])))) -> 1#50#100#150#200 | F113: 28 | G113: 34 | H113: 38 | I113: 44 | K113: =R[-1]C -> 13439 | L113: =R[-1]C -> 10014 | M113: =R[-1]C -> 10004 | N113: =R[-1]C -> 10010 | O113: =R[-1]C -> 10008 | P113: =R[-1]C -> 1 | Q113: =R[-1]C -> 50 | R113: =R[-1]C -> 100 | S113: =R[-1]C -> 150 | T113: =R[-1]C -> 200 | U113: 同上
A114: 108 | B114: 50 | C114: =RC[3]&IF(RC[4]="","|200","|"&RC[4]&IF(RC[5]="","|200","|"&RC[5]&IF(RC[6]="","|200","|"&RC[6]&IF(RC[7]="","|200","|"&RC[7]&"|200")))) -> 28|34|38|44|200 | D114: =RC[7]&IF(RC[8]="","","#"&RC[8]&IF(RC[9]="","","#"&RC[9]&IF(RC[10]="","","#"&RC[10]&IF(RC[11]="","","#"&RC[11])))) -> 13439#10014#10004#10010#10008 | E114: =RC[11]&IF(RC[12]="","","#"&RC[12]&IF(RC[13]="","","#"&RC[13]&IF(RC[14]="","","#"&RC[14]&IF(RC[15]="","","#"&RC[15])))) -> 1#50#100#150#200 | F114: 28 | G114: 34 | H114: 38 | I114: 44 | K114: =R[-1]C -> 13439 | L114: =R[-1]C -> 10014 | M114: =R[-1]C -> 10004 | N114: =R[-1]C -> 10010 | O114: =R[-1]C -> 10008 | P114: =R[-1]C -> 1 | Q114: =R[-1]C -> 50 | R114: =R[-1]C -> 100 | S114: =R[-1]C -> 150 | T114: =R[-1]C -> 200 | U114: 同上
A115: 109 | B115: 50 | C115: =RC[3]&IF(RC[4]="","|200","|"&RC[4]&IF(RC[5]="","|200","|"&RC[5]&IF(RC[6]="","|200","|"&RC[6]&IF(RC[7]="","|200","|"&RC[7]&"|200")))) -> 28|34|38|44|200 | D115: =RC[7]&IF(RC[8]="","","#"&RC[8]&IF(RC[9]="","","#"&RC[9]&IF(RC[10]="","","#"&RC[10]&IF(RC[11]="","","#"&RC[11])))) -> 13439#10014#10004#10010#10008 | E115: =RC[11]&IF(RC[12]="","","#"&RC[12]&IF(RC[13]="","","#"&RC[13]&IF(RC[14]="","","#"&RC[14]&IF(RC[15]="","","#"&RC[15])))) -> 1#50#100#150#200 | F115: 28 | G115: 34 | H115: 38 | I115: 44 | K115: =R[-1]C -> 13439 | L115: =R[-1]C -> 10014 | M115: =R[-1]C -> 10004 | N115: =R[-1]C -> 10010 | O115: =R[-1]C -> 10008 | P115: =R[-1]C -> 1 | Q115: =R[-1]C -> 50 | R115: =R[-1]C -> 100 | S115: =R[-1]C -> 150 | T115: =R[-1]C -> 200 | U115: 同上
A116: 110 | B116: 50 | C116: =RC[3]&IF(RC[4]="","|200","|"&RC[4]&IF(RC[5]="","|200","|"&RC[5]&IF(RC[6]="","|200","|"&RC[6]&IF(RC[7]="","|200","|"&RC[7]&"|200")))) -> 28|34|38|44|200 | D116: =RC[7]&IF(RC[8]="","","#"&RC[8]&IF(RC[9]="","","#"&RC[9]&IF(RC[10]="","","#"&RC[10]&IF(RC[11]="","","#"&RC[11])))) -> 13439#10014#10004#10010#10008 | E116: =RC[11]&IF(RC[12]="","","#"&RC[12]&IF(RC[13]="","","#"&RC[13]&IF(RC[14]="","","#"&RC[14]&IF(RC[15]="","","#"&RC[15])))) -> 1#50#100#150#200 | F116: 28 | G116: 34 | H116: 38 | I116: 44 | K116: =R[-1]C -> 13439 | L116: =R[-1]C -> 10014 | M116: =R[-1]C -> 10004 | N116: =R[-1]C -> 10010 | O116: =R[-1]C -> 10008 | P116: =R[-1]C -> 1 | Q116: =R[-1]C -> 50 | R116: =R[-1]C -> 100 | S116: =R[-1]C -> 150 | T116: =R[-1]C -> 200 | U116: 同上
A117: 111 | B117: 50 | C117: =RC[3]&IF(RC[4]="","|200","|"&RC[4]&IF(RC[5]="","|200","|"&RC[5]&IF(RC[6]="","|200","|"&RC[6]&IF(RC[7]="","|200","|"&RC[7]&"|200")))) -> 28|34|38|44|200 | D117: =RC[7]&IF(RC[8]="","","#"&RC[8]&IF(RC[9]="","","#"&RC[9]&IF(RC[10]="","","#"&RC[10]&IF(RC[11]="","","#"&RC[11])))) -> 13439#10014#10004#10010#10008 | E117: =RC[11]&IF(RC[12]="","","#"&RC[12]&IF(RC[13]="","","#"&RC[13]&IF(RC[14]="","","#"&RC[14]&IF(RC[15]="","","#"&RC[15])))) -> 1#50#100#150#200 | F117: 28 | G117: 34 | H117: 38 | I117: 44 | K117: =R[-1]C -> 13439 | L117: =R[-1]C -> 10014 | M117: =R[-1]C -> 10004 | N117: =R[-1]C -> 10010 | O117: =R[-1]C -> 10008 | P117: =R[-1]C -> 1 | Q117: =R[-1]C -> 50 | R117: =R[-1]C -> 100 | S117: =R[-1]C -> 150 | T117: =R[-1]C -> 200 | U117: 同上
A118: 112 | B118: 50 | C118: =RC[3]&IF(RC[4]="","|200","|"&RC[4]&IF(RC[5]="","|200","|"&RC[5]&IF(RC[6]="","|200","|"&RC[6]&IF(RC[7]="","|200","|"&RC[7]&"|200")))) -> 28|34|38|44|200 | D118: =RC[7]&IF(RC[8]="","","#"&RC[8]&IF(RC[9]="","","#"&RC[9]&IF(RC[10]="","","#"&RC[10]&IF(RC[11]="","","#"&RC[11])))) -> 13439#10014#10004#10010#10008 | E118: =RC[11]&IF(RC[12]="","","#"&RC[12]&IF(RC[13]="","","#"&RC[13]&IF(RC[14]="","","#"&RC[14]&IF(RC[15]="","","#"&RC[15])))) -> 1#50#100#150#200 | F118: 28 | G118: 34 | H118: 38 | I118: 44 | K118: =R[-1]C -> 13439 | L118: =R[-1]C -> 10014 | M118: =R[-1]C -> 10004 | N118: =R[-1]C -> 10010 | O118: =R[-1]C -> 10008 | P118: =R[-1]C -> 1 | Q118: =R[-1]C -> 50 | R118: =R[-1]C -> 100 | S118: =R[-1]C -> 150 | T118: =R[-1]C -> 200 | U118: 同上
A119: 113 | B119: 50 | C119: =RC[3]&IF(RC[4]="","|200","|"&RC[4]&IF(RC[5]="","|200","|"&RC[5]&IF(RC[6]="","|200","|"&RC[6]&IF(RC[7]="","|200","|"&RC[7]&"|200")))) -> 28|34|38|44|200 | D119: =RC[7]&IF(RC[8]="","","#"&RC[8]&IF(RC[9]="","","#"&RC[9]&IF(RC[10]="","","#"&RC[10]&IF(RC[11]="","","#"&RC[11])))) -> 13439#10014#10004#10010#10008 | E119: =RC[11]&IF(RC[12]="","","#"&RC[12]&IF(RC[13]="","","#"&RC[13]&IF(RC[14]="","","#"&RC[14]&IF(RC[15]="","","#"&RC[15])))) -> 1#50#100#150#200 | F119: 28 | G119: 34 | H119: 38 | I119: 44 | K119: =R[-1]C -> 13439 | L119: =R[-1]C -> 10014 | M119: =R[-1]C -> 10004 | N119: =R[-1]C -> 10010 | O119: =R[-1]C -> 10008 | P119: =R[-1]C -> 1 | Q119: =R[-1]C -> 50 | R119: =R[-1]C -> 100 | S119: =R[-1]C -> 150 | T119: =R[-1]C -> 200 | U119: 同上
A120: 114 | B120: 50 | C120: =RC[3]&IF(RC[4]="","|200","|"&RC[4]&IF(RC[5]="","|200","|"&RC[5]&IF(RC[6]="","|200","|"&RC[6]&IF(RC[7]="","|200","|"&RC[7]&"|200")))) -> 28|34|38|44|200 | D120: =RC[7]&IF(RC[8]="","","#"&RC[8]&IF(RC[9]="","","#"&RC[9]&IF(RC[10]="","","#"&RC[10]&IF(RC[11]="","","#"&RC[11])))) -> 13439#10014#10004#10010#10008 | E120: =RC[11]&IF(RC[12]="","","#"&RC[12]&IF(RC[13]="","","#"&RC[13]&IF(RC[14]="","","#"&RC[14]&IF(RC[15]="","","#"&RC[15])))) -> 1#50#100#150#200 | F120: 28 | G120: 34 | H120: 38 | I120: 44 | K120: =R[-1]C -> 13439 | L120: =R[-1]C -> 10014 | M120: =R[-1]C -> 10004 | N120: =R[-1]C -> 10010 | O120: =R[-1]C -> 10008 | P120: =R[-1]C -> 1 | Q120: =R[-1]C -> 50 | R120: =R[-1]C -> 100 | S120: =R[-1]C -> 150 | T120: =R[-1]C -> 200 | U120: 同上
A121: 115 | B121: 50 | C121: =RC[3]&IF(RC[4]="","|200","|"&RC[4]&IF(RC[5]="","|200","|"&RC[5]&IF(RC[6]="","|200","|"&RC[6]&IF(RC[7]="","|200","|"&RC[7]&"|200")))) -> 28|34|38|44|200 | D121: =RC[7]&IF(RC[8]="","","#"&RC[8]&IF(RC[9]="","","#"&RC[9]&IF(RC[10]="","","#"&RC[10]&IF(RC[11]="","","#"&RC[11])))) -> 13439#10014#10004#10010#10008 | E121: =RC[11]&IF(RC[12]="","","#"&RC[12]&IF(RC[13]="","","#"&RC[13]&IF(RC[14]="","","#"&RC[14]&IF(RC[15]="","","#"&RC[15])))) -> 1#50#100#150#200 | F121: 28 | G121: 34 | H121: 38 | I121: 44 | K121: =R[-1]C -> 13439 | L121: =R[-1]C -> 10014 | M121: =R[-1]C -> 10004 | N121: =R[-1]C -> 10010 | O121: =R[-1]C -> 10008 | P121: =R[-1]C -> 1 | Q121: =R[-1]C -> 50 | R121: =R[-1]C -> 100 | S121: =R[-1]C -> 150 | T121: =R[-1]C -> 200 | U121: 同上
A122: 116 | B122: 50 | C122: =RC[3]&IF(RC[4]="","|200","|"&RC[4]&IF(RC[5]="","|200","|"&RC[5]&IF(RC[6]="","|200","|"&RC[6]&IF(RC[7]="","|200","|"&RC[7]&"|200")))) -> 28|34|38|44|200 | D122: =RC[7]&IF(RC[8]="","","#"&RC[8]&IF(RC[9]="","","#"&RC[9]&IF(RC[10]="","","#"&RC[10]&IF(RC[11]="","","#"&RC[11])))) -> 13439#10014#10004#10010#10008 | E122: =RC[11]&IF(RC[12]="","","#"&RC[12]&IF(RC[13]="","","#"&RC[13]&IF(RC[14]="","","#"&RC[14]&IF(RC[15]="","","#"&RC[15])))) -> 1#50#100#150#200 | F122: 28 | G122: 34 | H122: 38 | I122: 44 | K122: =R[-1]C -> 13439 | L122: =R[-1]C -> 10014 | M122: =R[-1]C -> 10004 | N122: =R[-1]C -> 10010 | O122: =R[-1]C -> 10008 | P122: =R[-1]C -> 1 | Q122: =R[-1]C -> 50 | R122: =R[-1]C -> 100 | S122: =R[-1]C -> 150 | T122: =R[-1]C -> 200 | U122: 同上
A123: 117 | B123: 50 | C123: =RC[3]&IF(RC[4]="","|200","|"&RC[4]&IF(RC[5]="","|200","|"&RC[5]&IF(RC[6]="","|200","|"&RC[6]&IF(RC[7]="","|200","|"&RC[7]&"|200")))) -> 28|34|38|44|200 | D123: =RC[7]&IF(RC[8]="","","#"&RC[8]&IF(RC[9]="","","#"&RC[9]&IF(RC[10]="","","#"&RC[10]&IF(RC[11]="","","#"&RC[11])))) -> 13439#10014#10004#10010#10008 | E123: =RC[11]&IF(RC[12]="","","#"&RC[12]&IF(RC[13]="","","#"&RC[13]&IF(RC[14]="","","#"&RC[14]&IF(RC[15]="","","#"&RC[15])))) -> 1#50#100#150#200 | F123: 28 | G123: 34 | H123: 38 | I123: 44 | K123: =R[-1]C -> 13439 | L123: =R[-1]C -> 10014 | M123: =R[-1]C -> 10004 | N123: =R[-1]C -> 10010 | O123: =R[-1]C -> 10008 | P123: =R[-1]C -> 1 | Q123: =R[-1]C -> 50 | R123: =R[-1]C -> 100 | S123: =R[-1]C -> 150 | T123: =R[-1]C -> 200 | U123: 同上
A124: 118 | B124: 50 | C124: =RC[3]&IF(RC[4]="","|200","|"&RC[4]&IF(RC[5]="","|200","|"&RC[5]&IF(RC[6]="","|200","|"&RC[6]&IF(RC[7]="","|200","|"&RC[7]&"|200")))) -> 28|34|38|44|200 | D124: =RC[7]&IF(RC[8]="","","#"&RC[8]&IF(RC[9]="","","#"&RC[9]&IF(RC[10]="","","#"&RC[10]&IF(RC[11]="","","#"&RC[11])))) -> 13439#10014#10004#10010#10008 | E124: =RC[11]&IF(RC[12]="","","#"&RC[12]&IF(RC[13]="","","#"&RC[13]&IF(RC[14]="","","#"&RC[14]&IF(RC[15]="","","#"&RC[15])))) -> 1#50#100#150#200 | F124: 28 | G124: 34 | H124: 38 | I124: 44 | K124: =R[-1]C -> 13439 | L124: =R[-1]C -> 10014 | M124: =R[-1]C -> 10004 | N124: =R[-1]C -> 10010 | O124: =R[-1]C -> 10008 | P124: =R[-1]C -> 1 | Q124: =R[-1]C -> 50 | R124: =R[-1]C -> 100 | S124: =R[-1]C -> 150 | T124: =R[-1]C -> 200 | U124: 同上
A125: 119 | B125: 50 | C125: =RC[3]&IF(RC[4]="","|200","|"&RC[4]&IF(RC[5]="","|200","|"&RC[5]&IF(RC[6]="","|200","|"&RC[6]&IF(RC[7]="","|200","|"&RC[7]&"|200")))) -> 28|34|38|44|200 | D125: =RC[7]&IF(RC[8]="","","#"&RC[8]&IF(RC[9]="","","#"&RC[9]&IF(RC[10]="","","#"&RC[10]&IF(RC[11]="","","#"&RC[11])))) -> 13439#10014#10004#10010#10008 | E125: =RC[11]&IF(RC[12]="","","#"&RC[12]&IF(RC[13]="","","#"&RC[13]&IF(RC[14]="","","#"&RC[14]&IF(RC[15]="","","#"&RC[15])))) -> 1#50#100#150#200 | F125: 28 | G125: 34 | H125: 38 | I125: 44 | K125: =R[-1]C -> 13439 | L125: =R[-1]C -> 10014 | M125: =R[-1]C -> 10004 | N125: =R[-1]C -> 10010 | O125: =R[-1]C -> 10008 | P125: =R[-1]C -> 1 | Q125: =R[-1]C -> 50 | R125: =R[-1]C -> 100 | S125: =R[-1]C -> 150 | T125: =R[-1]C -> 200 | U125: 同上
A126: 120 | B126: 50 | C126: =RC[3]&IF(RC[4]="","|200","|"&RC[4]&IF(RC[5]="","|200","|"&RC[5]&IF(RC[6]="","|200","|"&RC[6]&IF(RC[7]="","|200","|"&RC[7]&"|200")))) -> 28|34|38|44|200 | D126: =RC[7]&IF(RC[8]="","","#"&RC[8]&IF(RC[9]="","","#"&RC[9]&IF(RC[10]="","","#"&RC[10]&IF(RC[11]="","","#"&RC[11])))) -> 13439#10014#10004#10010#10008 | E126: =RC[11]&IF(RC[12]="","","#"&RC[12]&IF(RC[13]="","","#"&RC[13]&IF(RC[14]="","","#"&RC[14]&IF(RC[15]="","","#"&RC[15])))) -> 1#50#100#150#200 | F126: 28 | G126: 34 | H126: 38 | I126: 44 | K126: =R[-1]C -> 13439 | L126: =R[-1]C -> 10014 | M126: =R[-1]C -> 10004 | N126: =R[-1]C -> 10010 | O126: =R[-1]C -> 10008 | P126: =R[-1]C -> 1 | Q126: =R[-1]C -> 50 | R126: =R[-1]C -> 100 | S126: =R[-1]C -> 150 | T126: =R[-1]C -> 200 | U126: 同上
A127: 121 | B127: 50 | C127: =RC[3]&IF(RC[4]="","|200","|"&RC[4]&IF(RC[5]="","|200","|"&RC[5]&IF(RC[6]="","|200","|"&RC[6]&IF(RC[7]="","|200","|"&RC[7]&"|200")))) -> 28|34|38|44|200 | D127: =RC[7]&IF(RC[8]="","","#"&RC[8]&IF(RC[9]="","","#"&RC[9]&IF(RC[10]="","","#"&RC[10]&IF(RC[11]="","","#"&RC[11])))) -> 13439#10014#10004#10010#10008 | E127: =RC[11]&IF(RC[12]="","","#"&RC[12]&IF(RC[13]="","","#"&RC[13]&IF(RC[14]="","","#"&RC[14]&IF(RC[15]="","","#"&RC[15])))) -> 1#50#100#150#200 | F127: 28 | G127: 34 | H127: 38 | I127: 44 | K127: =R[-1]C -> 13439 | L127: =R[-1]C -> 10014 | M127: =R[-1]C -> 10004 | N127: =R[-1]C -> 10010 | O127: =R[-1]C -> 10008 | P127: =R[-1]C -> 1 | Q127: =R[-1]C -> 50 | R127: =R[-1]C -> 100 | S127: =R[-1]C -> 150 | T127: =R[-1]C -> 200 | U127: 同上
A128: 122 | B128: 50 | C128: =RC[3]&IF(RC[4]="","|200","|"&RC[4]&IF(RC[5]="","|200","|"&RC[5]&IF(RC[6]="","|200","|"&RC[6]&IF(RC[7]="","|200","|"&RC[7]&"|200")))) -> 28|34|38|44|200 | D128: =RC[7]&IF(RC[8]="","","#"&RC[8]&IF(RC[9]="","","#"&RC[9]&IF(RC[10]="","","#"&RC[10]&IF(RC[11]="","","#"&RC[11])))) -> 13439#10014#10004#10010#10008 | E128: =RC[11]&IF(RC[12]="","","#"&RC[12]&IF(RC[13]="","","#"&RC[13]&IF(RC[14]="","","#"&RC[14]&IF(RC[15]="","","#"&RC[15])))) -> 1#50#100#150#200 | F128: 28 | G128: 34 | H128: 38 | I128: 44 | K128: =R[-1]C -> 13439 | L128: =R[-1]C -> 10014 | M128: =R[-1]C -> 10004 | N128: =R[-1]C -> 10010 | O128: =R[-1]C -> 10008 | P128: =R[-1]C -> 1 | Q128: =R[-1]C -> 50 | R128: =R[-1]C -> 100 | S128: =R[-1]C -> 150 | T128: =R[-1]C -> 200 | U128: 同上
A129: 123 | B129: 50 | C129: =RC[3]&IF(RC[4]="","|200","|"&RC[4]&IF(RC[5]="","|200","|"&RC[5]&IF(RC[6]="","|200","|"&RC[6]&IF(RC[7]="","|200","|"&RC[7]&"|200")))) -> 28|34|38|44|200 | D129: =RC[7]&IF(RC[8]="","","#"&RC[8]&IF(RC[9]="","","#"&RC[9]&IF(RC[10]="","","#"&RC[10]&IF(RC[11]="","","#"&RC[11])))) -> 13439#10014#10004#10010#10008 | E129: =RC[11]&IF(RC[12]="","","#"&RC[12]&IF(RC[13]="","","#"&RC[13]&IF(RC[14]="","","#"&RC[14]&IF(RC[15]="","","#"&RC[15])))) -> 1#50#100#150#200 | F129: 28 | G129: 34 | H129: 38 | I129: 44 | K129: =R[-1]C -> 13439 | L129: =R[-1]C -> 10014 | M129: =R[-1]C -> 10004 | N129: =R[-1]C -> 10010 | O129: =R[-1]C -> 10008 | P129: =R[-1]C -> 1 | Q129: =R[-1]C -> 50 | R129: =R[-1]C -> 100 | S129: =R[-1]C -> 150 | T129: =R[-1]C -> 200 | U129: 同上
A130: 124 | B130: 50 | C130: =RC[3]&IF(RC[4]="","|200","|"&RC[4]&IF(RC[5]="","|200","|"&RC[5]&IF(RC[6]="","|200","|"&RC[6]&IF(RC[7]="","|200","|"&RC[7]&"|200")))) -> 28|34|38|44|200 | D130: =RC[7]&IF(RC[8]="","","#"&RC[8]&IF(RC[9]="","","#"&RC[9]&IF(RC[10]="","","#"&RC[10]&IF(RC[11]="","","#"&RC[11])))) -> 13439#10014#10004#10010#10008 | E130: =RC[11]&IF(RC[12]="","","#"&RC[12]&IF(RC[13]="","","#"&RC[13]&IF(RC[14]="","","#"&RC[14]&IF(RC[15]="","","#"&RC[15])))) -> 1#50#100#150#200 | F130: 28 | G130: 34 | H130: 38 | I130: 44 | K130: =R[-1]C -> 13439 | L130: =R[-1]C -> 10014 | M130: =R[-1]C -> 10004 | N130: =R[-1]C -> 10010 | O130: =R[-1]C -> 10008 | P130: =R[-1]C -> 1 | Q130: =R[-1]C -> 50 | R130: =R[-1]C -> 100 | S130: =R[-1]C -> 150 | T130: =R[-1]C -> 200 | U130: 同上
A131: 125 | B131: 50 | C131: =RC[3]&IF(RC[4]="","|200","|"&RC[4]&IF(RC[5]="","|200","|"&RC[5]&IF(RC[6]="","|200","|"&RC[6]&IF(RC[7]="","|200","|"&RC[7]&"|200")))) -> 28|34|38|44|200 | D131: =RC[7]&IF(RC[8]="","","#"&RC[8]&IF(RC[9]="","","#"&RC[9]&IF(RC[10]="","","#"&RC[10]&IF(RC[11]="","","#"&RC[11])))) -> 13439#10014#10004#10010#10008 | E131: =RC[11]&IF(RC[12]="","","#"&RC[12]&IF(RC[13]="","","#"&RC[13]&IF(RC[14]="","","#"&RC[14]&IF(RC[15]="","","#"&RC[15])))) -> 1#50#100#150#200 | F131: 28 | G131: 34 | H131: 38 | I131: 44 | K131: =R[-1]C -> 13439 | L131: =R[-1]C -> 10014 | M131: =R[-1]C -> 10004 | N131: =R[-1]C -> 10010 | O131: =R[-1]C -> 10008 | P131: =R[-1]C -> 1 | Q131: =R[-1]C -> 50 | R131: =R[-1]C -> 100 | S131: =R[-1]C -> 150 | T131: =R[-1]C -> 200 | U131: 同上
A132: 126 | B132: 50 | C132: =RC[3]&IF(RC[4]="","|200","|"&RC[4]&IF(RC[5]="","|200","|"&RC[5]&IF(RC[6]="","|200","|"&RC[6]&IF(RC[7]="","|200","|"&RC[7]&"|200")))) -> 28|34|38|44|200 | D132: =RC[7]&IF(RC[8]="","","#"&RC[8]&IF(RC[9]="","","#"&RC[9]&IF(RC[10]="","","#"&RC[10]&IF(RC[11]="","","#"&RC[11])))) -> 13439#10014#10004#10010#10008 | E132: =RC[11]&IF(RC[12]="","","#"&RC[12]&IF(RC[13]="","","#"&RC[13]&IF(RC[14]="","","#"&RC[14]&IF(RC[15]="","","#"&RC[15])))) -> 1#50#100#150#200 | F132: 28 | G132: 34 | H132: 38 | I132: 44 | K132: =R[-1]C -> 13439 | L132: =R[-1]C -> 10014 | M132: =R[-1]C -> 10004 | N132: =R[-1]C -> 10010 | O132: =R[-1]C -> 10008 | P132: =R[-1]C -> 1 | Q132: =R[-1]C -> 50 | R132: =R[-1]C -> 100 | S132: =R[-1]C -> 150 | T132: =R[-1]C -> 200 | U132: 同上
A133: 127 | B133: 50 | C133: =RC[3]&IF(RC[4]="","|200","|"&RC[4]&IF(RC[5]="","|200","|"&RC[5]&IF(RC[6]="","|200","|"&RC[6]&IF(RC[7]="","|200","|"&RC[7]&"|200")))) -> 28|34|38|44|200 | D133: =RC[7]&IF(RC[8]="","","#"&RC[8]&IF(RC[9]="","","#"&RC[9]&IF(RC[10]="","","#"&RC[10]&IF(RC[11]="","","#"&RC[11])))) -> 13439#10014#10004#10010#10008 | E133: =RC[11]&IF(RC[12]="","","#"&RC[12]&IF(RC[13]="","","#"&RC[13]&IF(RC[14]="","","#"&RC[14]&IF(RC[15]="","","#"&RC[15])))) -> 1#50#100#150#200 | F133: 28 | G133: 34 | H133: 38 | I133: 44 | K133: =R[-1]C -> 13439 | L133: =R[-1]C -> 10014 | M133: =R[-1]C -> 10004 | N133: =R[-1]C -> 10010 | O133: =R[-1]C -> 10008 | P133: =R[-1]C -> 1 | Q133: =R[-1]C -> 50 | R133: =R[-1]C -> 100 | S133: =R[-1]C -> 150 | T133: =R[-1]C -> 200 | U133: 同上
A134: 128 | B134: 50 | C134: =RC[3]&IF(RC[4]="","|200","|"&RC[4]&IF(RC[5]="","|200","|"&RC[5]&IF(RC[6]="","|200","|"&RC[6]&IF(RC[7]="","|200","|"&RC[7]&"|200")))) -> 28|34|38|44|200 | D134: =RC[7]&IF(RC[8]="","","#"&RC[8]&IF(RC[9]="","","#"&RC[9]&IF(RC[10]="","","#"&RC[10]&IF(RC[11]="","","#"&RC[11])))) -> 13439#10014#10004#10010#10008 | E134: =RC[11]&IF(RC[12]="","","#"&RC[12]&IF(RC[13]="","","#"&RC[13]&IF(RC[14]="","","#"&RC[14]&IF(RC[15]="","","#"&RC[15])))) -> 1#50#100#150#200 | F134: 28 | G134: 34 | H134: 38 | I134: 44 | K134: =R[-1]C -> 13439 | L134: =R[-1]C -> 10014 | M134: =R[-1]C -> 10004 | N134: =R[-1]C -> 10010 | O134: =R[-1]C -> 10008 | P134: =R[-1]C -> 1 | Q134: =R[-1]C -> 50 | R134: =R[-1]C -> 100 | S134: =R[-1]C -> 150 | T134: =R[-1]C -> 200 | U134: 同上
A135: 129 | B135: 50 | C135: =RC[3]&IF(RC[4]="","|200","|"&RC[4]&IF(RC[5]="","|200","|"&RC[5]&IF(RC[6]="","|200","|"&RC[6]&IF(RC[7]="","|200","|"&RC[7]&"|200")))) -> 28|34|38|44|200 | D135: =RC[7]&IF(RC[8]="","","#"&RC[8]&IF(RC[9]="","","#"&RC[9]&IF(RC[10]="","","#"&RC[10]&IF(RC[11]="","","#"&RC[11])))) -> 13439#10014#10004#10010#10008 | E135: =RC[11]&IF(RC[12]="","","#"&RC[12]&IF(RC[13]="","","#"&RC[13]&IF(RC[14]="","","#"&RC[14]&IF(RC[15]="","","#"&RC[15])))) -> 1#50#100#150#200 | F135: 28 | G135: 34 | H135: 38 | I135: 44 | K135: =R[-1]C -> 13439 | L135: =R[-1]C -> 10014 | M135: =R[-1]C -> 10004 | N135: =R[-1]C -> 10010 | O135: =R[-1]C -> 10008 | P135: =R[-1]C -> 1 | Q135: =R[-1]C -> 50 | R135: =R[-1]C -> 100 | S135: =R[-1]C -> 150 | T135: =R[-1]C -> 200 | U135: 同上
A136: 130 | B136: 50 | C136: =RC[3]&IF(RC[4]="","|200","|"&RC[4]&IF(RC[5]="","|200","|"&RC[5]&IF(RC[6]="","|200","|"&RC[6]&IF(RC[7]="","|200","|"&RC[7]&"|200")))) -> 28|34|38|44|200 | D136: =RC[7]&IF(RC[8]="","","#"&RC[8]&IF(RC[9]="","","#"&RC[9]&IF(RC[10]="","","#"&RC[10]&IF(RC[11]="","","#"&RC[11])))) -> 13439#10014#10004#10010#10008 | E136: =RC[11]&IF(RC[12]="","","#"&RC[12]&IF(RC[13]="","","#"&RC[13]&IF(RC[14]="","","#"&RC[14]&IF(RC[15]="","","#"&RC[15])))) -> 1#50#100#150#200 | F136: 28 | G136: 34 | H136: 38 | I136: 44 | K136: =R[-1]C -> 13439 | L136: =R[-1]C -> 10014 | M136: =R[-1]C -> 10004 | N136: =R[-1]C -> 10010 | O136: =R[-1]C -> 10008 | P136: =R[-1]C -> 1 | Q136: =R[-1]C -> 50 | R136: =R[-1]C -> 100 | S136: =R[-1]C -> 150 | T136: =R[-1]C -> 200 | U136: 同上
A137: 131 | B137: 50 | C137: =RC[3]&IF(RC[4]="","|200","|"&RC[4]&IF(RC[5]="","|200","|"&RC[5]&IF(RC[6]="","|200","|"&RC[6]&IF(RC[7]="","|200","|"&RC[7]&"|200")))) -> 28|34|38|44|200 | D137: =RC[7]&IF(RC[8]="","","#"&RC[8]&IF(RC[9]="","","#"&RC[9]&IF(RC[10]="","","#"&RC[10]&IF(RC[11]="","","#"&RC[11])))) -> 13439#10014#10004#10010#10008 | E137: =RC[11]&IF(RC[12]="","","#"&RC[12]&IF(RC[13]="","","#"&RC[13]&IF(RC[14]="","","#"&RC[14]&IF(RC[15]="","","#"&RC[15])))) -> 1#50#100#150#200 | F137: 28 | G137: 34 | H137: 38 | I137: 44 | K137: =R[-1]C -> 13439 | L137: =R[-1]C -> 10014 | M137: =R[-1]C -> 10004 | N137: =R[-1]C -> 10010 | O137: =R[-1]C -> 10008 | P137: =R[-1]C -> 1 | Q137: =R[-1]C -> 50 | R137: =R[-1]C -> 100 | S137: =R[-1]C -> 150 | T137: =R[-1]C -> 200 | U137: 同上
A138: 132 | B138: 50 | C138: =RC[3]&IF(RC[4]="","|200","|"&RC[4]&IF(RC[5]="","|200","|"&RC[5]&IF(RC[6]="","|200","|"&RC[6]&IF(RC[7]="","|200","|"&RC[7]&"|200")))) -> 28|34|38|44|200 | D138: =RC[7]&IF(RC[8]="","","#"&RC[8]&IF(RC[9]="","","#"&RC[9]&IF(RC[10]="","","#"&RC[10]&IF(RC[11]="","","#"&RC[11])))) -> 13439#10014#10004#10010#10008 | E138: =RC[11]&IF(RC[12]="","","#"&RC[12]&IF(RC[13]="","","#"&RC[13]&IF(RC[14]="","","#"&RC[14]&IF(RC[15]="","","#"&RC[15])))) -> 1#50#100#150#200 | F138: 28 | G138: 34 | H138: 38 | I138: 44 | K138: =R[-1]C -> 13439 | L138: =R[-1]C -> 10014 | M138: =R[-1]C -> 10004 | N138: =R[-1]C -> 10010 | O138: =R[-1]C -> 10008 | P138: =R[-1]C -> 1 | Q138: =R[-1]C -> 50 | R138: =R[-1]C -> 100 | S138: =R[-1]C -> 150 | T138: =R[-1]C -> 200 | U138: 同上
A139: 133 | B139: 50 | C139: =RC[3]&IF(RC[4]="","|200","|"&RC[4]&IF(RC[5]="","|200","|"&RC[5]&IF(RC[6]="","|200","|"&RC[6]&IF(RC[7]="","|200","|"&RC[7]&"|200")))) -> 28|34|38|44|200 | D139: =RC[7]&IF(RC[8]="","","#"&RC[8]&IF(RC[9]="","","#"&RC[9]&IF(RC[10]="","","#"&RC[10]&IF(RC[11]="","","#"&RC[11])))) -> 13439#10014#10004#10010#10008 | E139: =RC[11]&IF(RC[12]="","","#"&RC[12]&IF(RC[13]="","","#"&RC[13]&IF(RC[14]="","","#"&RC[14]&IF(RC[15]="","","#"&RC[15])))) -> 1#50#100#150#200 | F139: 28 | G139: 34 | H139: 38 | I139: 44 | K139: =R[-1]C -> 13439 | L139: =R[-1]C -> 10014 | M139: =R[-1]C -> 10004 | N139: =R[-1]C -> 10010 | O139: =R[-1]C -> 10008 | P139: =R[-1]C -> 1 | Q139: =R[-1]C -> 50 | R139: =R[-1]C -> 100 | S139: =R[-1]C -> 150 | T139: =R[-1]C -> 200 | U139: 同上
A140: 134 | B140: 50 | C140: =RC[3]&IF(RC[4]="","|200","|"&RC[4]&IF(RC[5]="","|200","|"&RC[5]&IF(RC[6]="","|200","|"&RC[6]&IF(RC[7]="","|200","|"&RC[7]&"|200")))) -> 28|34|38|44|200 | D140: =RC[7]&IF(RC[8]="","","#"&RC[8]&IF(RC[9]="","","#"&RC[9]&IF(RC[10]="","","#"&RC[10]&IF(RC[11]="","","#"&RC[11])))) -> 13439#10014#10004#10010#10008 | E140: =RC[11]&IF(RC[12]="","","#"&RC[12]&IF(RC[13]="","","#"&RC[13]&IF(RC[14]="","","#"&RC[14]&IF(RC[15]="","","#"&RC[15])))) -> 1#50#100#150#200 | F140: 28 | G140: 34 | H140: 38 | I140: 44 | K140: =R[-1]C -> 13439 | L140: =R[-1]C -> 10014 | M140: =R[-1]C -> 10004 | N140: =R[-1]C -> 10010 | O140: =R[-1]C -> 10008 | P140: =R[-1]C -> 1 | Q140: =R[-1]C -> 50 | R140: =R[-1]C -> 100 | S140: =R[-1]C -> 150 | T140: =R[-1]C -> 200 | U140: 同上
A141: 135 | B141: 50 | C141: =RC[3]&IF(RC[4]="","|200","|"&RC[4]&IF(RC[5]="","|200","|"&RC[5]&IF(RC[6]="","|200","|"&RC[6]&IF(RC[7]="","|200","|"&RC[7]&"|200")))) -> 28|34|38|44|200 | D141: =RC[7]&IF(RC[8]="","","#"&RC[8]&IF(RC[9]="","","#"&RC[9]&IF(RC[10]="","","#"&RC[10]&IF(RC[11]="","","#"&RC[11])))) -> 13439#10014#10004#10010#10008 | E141: =RC[11]&IF(RC[12]="","","#"&RC[12]&IF(RC[13]="","","#"&RC[13]&IF(RC[14]="","","#"&RC[14]&IF(RC[15]="","","#"&RC[15])))) -> 1#50#100#150#200 | F141: 28 | G141: 34 | H141: 38 | I141: 44 | K141: =R[-1]C -> 13439 | L141: =R[-1]C -> 10014 | M141: =R[-1]C -> 10004 | N141: =R[-1]C -> 10010 | O141: =R[-1]C -> 10008 | P141: =R[-1]C -> 1 | Q141: =R[-1]C -> 50 | R141: =R[-1]C -> 100 | S141: =R[-1]C -> 150 | T141: =R[-1]C -> 200 | U141: 同上
A142: 136 | B142: 50 | C142: =RC[3]&IF(RC[4]="","|200","|"&RC[4]&IF(RC[5]="","|200","|"&RC[5]&IF(RC[6]="","|200","|"&RC[6]&IF(RC[7]="","|200","|"&RC[7]&"|200")))) -> 28|34|38|44|200 | D142: =RC[7]&IF(RC[8]="","","#"&RC[8]&IF(RC[9]="","","#"&RC[9]&IF(RC[10]="","","#"&RC[10]&IF(RC[11]="","","#"&RC[11])))) -> 13439#10014#10004#10010#10008 | E142: =RC[11]&IF(RC[12]="","","#"&RC[12]&IF(RC[13]="","","#"&RC[13]&IF(RC[14]="","","#"&RC[14]&IF(RC[15]="","","#"&RC[15])))) -> 1#50#100#150#200 | F142: 28 | G142: 34 | H142: 38 | I142: 44 | K142: =R[-1]C -> 13439 | L142: =R[-1]C -> 10014 | M142: =R[-1]C -> 10004 | N142: =R[-1]C -> 10010 | O142: =R[-1]C -> 10008 | P142: =R[-1]C -> 1 | Q142: =R[-1]C -> 50 | R142: =R[-1]C -> 100 | S142: =R[-1]C -> 150 | T142: =R[-1]C -> 200 | U142: 同上
A143: 137 | B143: 50 | C143: =RC[3]&IF(RC[4]="","|200","|"&RC[4]&IF(RC[5]="","|200","|"&RC[5]&IF(RC[6]="","|200","|"&RC[6]&IF(RC[7]="","|200","|"&RC[7]&"|200")))) -> 28|34|38|44|200 | D143: =RC[7]&IF(RC[8]="","","#"&RC[8]&IF(RC[9]="","","#"&RC[9]&IF(RC[10]="","","#"&RC[10]&IF(RC[11]="","","#"&RC[11])))) -> 13439#10014#10004#10010#10008 | E143: =RC[11]&IF(RC[12]="","","#"&RC[12]&IF(RC[13]="","","#"&RC[13]&IF(RC[14]="","","#"&RC[14]&IF(RC[15]="","","#"&RC[15])))) -> 1#50#100#150#200 | F143: 28 | G143: 34 | H143: 38 | I143: 44 | K143: =R[-1]C -> 13439 | L143: =R[-1]C -> 10014 | M143: =R[-1]C -> 10004 | N143: =R[-1]C -> 10010 | O143: =R[-1]C -> 10008 | P143: =R[-1]C -> 1 | Q143: =R[-1]C -> 50 | R143: =R[-1]C -> 100 | S143: =R[-1]C -> 150 | T143: =R[-1]C -> 200 | U143: 同上
A144: 138 | B144: 50 | C144: =RC[3]&IF(RC[4]="","|200","|"&RC[4]&IF(RC[5]="","|200","|"&RC[5]&IF(RC[6]="","|200","|"&RC[6]&IF(RC[7]="","|200","|"&RC[7]&"|200")))) -> 28|34|38|44|200 | D144: =RC[7]&IF(RC[8]="","","#"&RC[8]&IF(RC[9]="","","#"&RC[9]&IF(RC[10]="","","#"&RC[10]&IF(RC[11]="","","#"&RC[11])))) -> 13439#10014#10004#10010#10008 | E144: =RC[11]&IF(RC[12]="","","#"&RC[12]&IF(RC[13]="","","#"&RC[13]&IF(RC[14]="","","#"&RC[14]&IF(RC[15]="","","#"&RC[15])))) -> 1#50#100#150#200 | F144: 28 | G144: 34 | H144: 38 | I144: 44 | K144: =R[-1]C -> 13439 | L144: =R[-1]C -> 10014 | M144: =R[-1]C -> 10004 | N144: =R[-1]C -> 10010 | O144: =R[-1]C -> 10008 | P144: =R[-1]C -> 1 | Q144: =R[-1]C -> 50 | R144: =R[-1]C -> 100 | S144: =R[-1]C -> 150 | T144: =R[-1]C -> 200 | U144: 同上
A145: 139 | B145: 50 | C145: =RC[3]&IF(RC[4]="","|200","|"&RC[4]&IF(RC[5]="","|200","|"&RC[5]&IF(RC[6]="","|200","|"&RC[6]&IF(RC[7]="","|200","|"&RC[7]&"|200")))) -> 28|34|38|44|200 | D145: =RC[7]&IF(RC[8]="","","#"&RC[8]&IF(RC[9]="","","#"&RC[9]&IF(RC[10]="","","#"&RC[10]&IF(RC[11]="","","#"&RC[11])))) -> 13439#10014#10004#10010#10008 | E145: =RC[11]&IF(RC[12]="","","#"&RC[12]&IF(RC[13]="","","#"&RC[13]&IF(RC[14]="","","#"&RC[14]&IF(RC[15]="","","#"&RC[15])))) -> 1#50#100#150#200 | F145: 28 | G145: 34 | H145: 38 | I145: 44 | K145: =R[-1]C -> 13439 | L145: =R[-1]C -> 10014 | M145: =R[-1]C -> 10004 | N145: =R[-1]C -> 10010 | O145: =R[-1]C -> 10008 | P145: =R[-1]C -> 1 | Q145: =R[-1]C -> 50 | R145: =R[-1]C -> 100 | S145: =R[-1]C -> 150 | T145: =R[-1]C -> 200 | U145: 同上
A146: 140 | B146: 50 | C146: =RC[3]&IF(RC[4]="","|200","|"&RC[4]&IF(RC[5]="","|200","|"&RC[5]&IF(RC[6]="","|200","|"&RC[6]&IF(RC[7]="","|200","|"&RC[7]&"|200")))) -> 28|34|38|44|200 | D146: =RC[7]&IF(RC[8]="","","#"&RC[8]&IF(RC[9]="","","#"&RC[9]&IF(RC[10]="","","#"&RC[10]&IF(RC[11]="","","#"&RC[11])))) -> 13439#10014#10004#10010#10008 | E146: =RC[11]&IF(RC[12]="","","#"&RC[12]&IF(RC[13]="","","#"&RC[13]&IF(RC[14]="","","#"&RC[14]&IF(RC[15]="","","#"&RC[15])))) -> 1#50#100#150#200 | F146: 28 | G146: 34 | H146: 38 | I146: 44 | K146: =R[-1]C -> 13439 | L146: =R[-1]C -> 10014 | M146: =R[-1]C -> 10004 | N146: =R[-1]C -> 10010 | O146: =R[-1]C -> 10008 | P146: =R[-1]C -> 1 | Q146: =R[-1]C -> 50 | R146: =R[-1]C -> 100 | S146: =R[-1]C -> 150 | T146: =R[-1]C -> 200 | U146: 同上
A147: 141 | B147: 50 | C147: =RC[3]&IF(RC[4]="","|200","|"&RC[4]&IF(RC[5]="","|200","|"&RC[5]&IF(RC[6]="","|200","|"&RC[6]&IF(RC[7]="","|200","|"&RC[7]&"|200")))) -> 28|34|38|44|200 | D147: =RC[7]&IF(RC[8]="","","#"&RC[8]&IF(RC[9]="","","#"&RC[9]&IF(RC[10]="","","#"&RC[10]&IF(RC[11]="","","#"&RC[11])))) -> 13439#10014#10004#10010#10008 | E147: =RC[11]&IF(RC[12]="","","#"&RC[12]&IF(RC[13]="","","#"&RC[13]&IF(RC[14]="","","#"&RC[14]&IF(RC[15]="","","#"&RC[15])))) -> 1#50#100#150#200 | F147: 28 | G147: 34 | H147: 38 | I147: 44 | K147: =R[-1]C -> 13439 | L147: =R[-1]C -> 10014 | M147: =R[-1]C -> 10004 | N147: =R[-1]C -> 10010 | O147: =R[-1]C -> 10008 | P147: =R[-1]C -> 1 | Q147: =R[-1]C -> 50 | R147: =R[-1]C -> 100 | S147: =R[-1]C -> 150 | T147: =R[-1]C -> 200 | U147: 同上
A148: 142 | B148: 50 | C148: =RC[3]&IF(RC[4]="","|200","|"&RC[4]&IF(RC[5]="","|200","|"&RC[5]&IF(RC[6]="","|200","|"&RC[6]&IF(RC[7]="","|200","|"&RC[7]&"|200")))) -> 28|34|38|44|200 | D148: =RC[7]&IF(RC[8]="","","#"&RC[8]&IF(RC[9]="","","#"&RC[9]&IF(RC[10]="","","#"&RC[10]&IF(RC[11]="","","#"&RC[11])))) -> 13439#10014#10004#10010#10008 | E148: =RC[11]&IF(RC[12]="","","#"&RC[12]&IF(RC[13]="","","#"&RC[13]&IF(RC[14]="","","#"&RC[14]&IF(RC[15]="","","#"&RC[15])))) -> 1#50#100#150#200 | F148: 28 | G148: 34 | H148: 38 | I148: 44 | K148: =R[-1]C -> 13439 | L148: =R[-1]C -> 10014 | M148: =R[-1]C -> 10004 | N148: =R[-1]C -> 10010 | O148: =R[-1]C -> 10008 | P148: =R[-1]C -> 1 | Q148: =R[-1]C -> 50 | R148: =R[-1]C -> 100 | S148: =R[-1]C -> 150 | T148: =R[-1]C -> 200 | U148: 同上
A149: 143 | B149: 50 | C149: =RC[3]&IF(RC[4]="","|200","|"&RC[4]&IF(RC[5]="","|200","|"&RC[5]&IF(RC[6]="","|200","|"&RC[6]&IF(RC[7]="","|200","|"&RC[7]&"|200")))) -> 28|34|38|44|200 | D149: =RC[7]&IF(RC[8]="","","#"&RC[8]&IF(RC[9]="","","#"&RC[9]&IF(RC[10]="","","#"&RC[10]&IF(RC[11]="","","#"&RC[11])))) -> 13439#10014#10004#10010#10008 | E149: =RC[11]&IF(RC[12]="","","#"&RC[12]&IF(RC[13]="","","#"&RC[13]&IF(RC[14]="","","#"&RC[14]&IF(RC[15]="","","#"&RC[15])))) -> 1#50#100#150#200 | F149: 28 | G149: 34 | H149: 38 | I149: 44 | K149: =R[-1]C -> 13439 | L149: =R[-1]C -> 10014 | M149: =R[-1]C -> 10004 | N149: =R[-1]C -> 10010 | O149: =R[-1]C -> 10008 | P149: =R[-1]C -> 1 | Q149: =R[-1]C -> 50 | R149: =R[-1]C -> 100 | S149: =R[-1]C -> 150 | T149: =R[-1]C -> 200 | U149: 同上
A150: 144 | B150: 50 | C150: =RC[3]&IF(RC[4]="","|200","|"&RC[4]&IF(RC[5]="","|200","|"&RC[5]&IF(RC[6]="","|200","|"&RC[6]&IF(RC[7]="","|200","|"&RC[7]&"|200")))) -> 28|34|38|44|200 | D150: =RC[7]&IF(RC[8]="","","#"&RC[8]&IF(RC[9]="","","#"&RC[9]&IF(RC[10]="","","#"&RC[10]&IF(RC[11]="","","#"&RC[11])))) -> 13439#10014#10004#10010#10008 | E150: =RC[11]&IF(RC[12]="","","#"&RC[12]&IF(RC[13]="","","#"&RC[13]&IF(RC[14]="","","#"&RC[14]&IF(RC[15]="","","#"&RC[15])))) -> 1#50#100#150#200 | F150: 28 | G150: 34 | H150: 38 | I150: 44 | K150: =R[-1]C -> 13439 | L150: =R[-1]C -> 10014 | M150: =R[-1]C -> 10004 | N150: =R[-1]C -> 10010 | O150: =R[-1]C -> 10008 | P150: =R[-1]C -> 1 | Q150: =R[-1]C -> 50 | R150: =R[-1]C -> 100 | S150: =R[-1]C -> 150 | T150: =R[-1]C -> 200 | U150: 同上
A151: 145 | B151: 50 | C151: =RC[3]&IF(RC[4]="","|200","|"&RC[4]&IF(RC[5]="","|200","|"&RC[5]&IF(RC[6]="","|200","|"&RC[6]&IF(RC[7]="","|200","|"&RC[7]&"|200")))) -> 28|34|38|44|200 | D151: =RC[7]&IF(RC[8]="","","#"&RC[8]&IF(RC[9]="","","#"&RC[9]&IF(RC[10]="","","#"&RC[10]&IF(RC[11]="","","#"&RC[11])))) -> 13439#10014#10004#10010#10008 | E151: =RC[11]&IF(RC[12]="","","#"&RC[12]&IF(RC[13]="","","#"&RC[13]&IF(RC[14]="","","#"&RC[14]&IF(RC[15]="","","#"&RC[15])))) -> 1#50#100#150#200 | F151: 28 | G151: 34 | H151: 38 | I151: 44 | K151: =R[-1]C -> 13439 | L151: =R[-1]C -> 10014 | M151: =R[-1]C -> 10004 | N151: =R[-1]C -> 10010 | O151: =R[-1]C -> 10008 | P151: =R[-1]C -> 1 | Q151: =R[-1]C -> 50 | R151: =R[-1]C -> 100 | S151: =R[-1]C -> 150 | T151: =R[-1]C -> 200 | U151: 同上
A152: 146 | B152: 50 | C152: =RC[3]&IF(RC[4]="","|200","|"&RC[4]&IF(RC[5]="","|200","|"&RC[5]&IF(RC[6]="","|200","|"&RC[6]&IF(RC[7]="","|200","|"&RC[7]&"|200")))) -> 28|34|38|44|200 | D152: =RC[7]&IF(RC[8]="","","#"&RC[8]&IF(RC[9]="","","#"&RC[9]&IF(RC[10]="","","#"&RC[10]&IF(RC[11]="","","#"&RC[11])))) -> 13439#10014#10004#10010#10008 | E152: =RC[11]&IF(RC[12]="","","#"&RC[12]&IF(RC[13]="","","#"&RC[13]&IF(RC[14]="","","#"&RC[14]&IF(RC[15]="","","#"&RC[15])))) -> 1#50#100#150#200 | F152: 28 | G152: 34 | H152: 38 | I152: 44 | K152: =R[-1]C -> 13439 | L152: =R[-1]C -> 10014 | M152: =R[-1]C -> 10004 | N152: =R[-1]C -> 10010 | O152: =R[-1]C -> 10008 | P152: =R[-1]C -> 1 | Q152: =R[-1]C -> 50 | R152: =R[-1]C -> 100 | S152: =R[-1]C -> 150 | T152: =R[-1]C -> 200 | U152: 同上
A153: 147 | B153: 50 | C153: =RC[3]&IF(RC[4]="","|200","|"&RC[4]&IF(RC[5]="","|200","|"&RC[5]&IF(RC[6]="","|200","|"&RC[6]&IF(RC[7]="","|200","|"&RC[7]&"|200")))) -> 28|34|38|44|200 | D153: =RC[7]&IF(RC[8]="","","#"&RC[8]&IF(RC[9]="","","#"&RC[9]&IF(RC[10]="","","#"&RC[10]&IF(RC[11]="","","#"&RC[11])))) -> 13439#10014#10004#10010#10008 | E153: =RC[11]&IF(RC[12]="","","#"&RC[12]&IF(RC[13]="","","#"&RC[13]&IF(RC[14]="","","#"&RC[14]&IF(RC[15]="","","#"&RC[15])))) -> 1#50#100#150#200 | F153: 28 | G153: 34 | H153: 38 | I153: 44 | K153: =R[-1]C -> 13439 | L153: =R[-1]C -> 10014 | M153: =R[-1]C -> 10004 | N153: =R[-1]C -> 10010 | O153: =R[-1]C -> 10008 | P153: =R[-1]C -> 1 | Q153: =R[-1]C -> 50 | R153: =R[-1]C -> 100 | S153: =R[-1]C -> 150 | T153: =R[-1]C -> 200 | U153: 同上
A154: 148 | B154: 50 | C154: =RC[3]&IF(RC[4]="","|200","|"&RC[4]&IF(RC[5]="","|200","|"&RC[5]&IF(RC[6]="","|200","|"&RC[6]&IF(RC[7]="","|200","|"&RC[7]&"|200")))) -> 28|34|38|44|200 | D154: =RC[7]&IF(RC[8]="","","#"&RC[8]&IF(RC[9]="","","#"&RC[9]&IF(RC[10]="","","#"&RC[10]&IF(RC[11]="","","#"&RC[11])))) -> 13439#10014#10004#10010#10008 | E154: =RC[11]&IF(RC[12]="","","#"&RC[12]&IF(RC[13]="","","#"&RC[13]&IF(RC[14]="","","#"&RC[14]&IF(RC[15]="","","#"&RC[15])))) -> 1#50#100#150#200 | F154: 28 | G154: 34 | H154: 38 | I154: 44 | K154: =R[-1]C -> 13439 | L154: =R[-1]C -> 10014 | M154: =R[-1]C -> 10004 | N154: =R[-1]C -> 10010 | O154: =R[-1]C -> 10008 | P154: =R[-1]C -> 1 | Q154: =R[-1]C -> 50 | R154: =R[-1]C -> 100 | S154: =R[-1]C -> 150 | T154: =R[-1]C -> 200 | U154: 同上
A155: 149 | B155: 50 | C155: =RC[3]&IF(RC[4]="","|200","|"&RC[4]&IF(RC[5]="","|200","|"&RC[5]&IF(RC[6]="","|200","|"&RC[6]&IF(RC[7]="","|200","|"&RC[7]&"|200")))) -> 28|34|38|44|200 | D155: =RC[7]&IF(RC[8]="","","#"&RC[8]&IF(RC[9]="","","#"&RC[9]&IF(RC[10]="","","#"&RC[10]&IF(RC[11]="","","#"&RC[11])))) -> 13439#10014#10004#10010#10008 | E155: =RC[11]&IF(RC[12]="","","#"&RC[12]&IF(RC[13]="","","#"&RC[13]&IF(RC[14]="","","#"&RC[14]&IF(RC[15]="","","#"&RC[15])))) -> 1#50#100#150#200 | F155: 28 | G155: 34 | H155: 38 | I155: 44 | K155: =R[-1]C -> 13439 | L155: =R[-1]C -> 10014 | M155: =R[-1]C -> 10004 | N155: =R[-1]C -> 10010 | O155: =R[-1]C -> 10008 | P155: =R[-1]C -> 1 | Q155: =R[-1]C -> 50 | R155: =R[-1]C -> 100 | S155: =R[-1]C -> 150 | T155: =R[-1]C -> 200 | U155: 同上
A156: 150 | B156: 50 | C156: =RC[3]&IF(RC[4]="","|200","|"&RC[4]&IF(RC[5]="","|200","|"&RC[5]&IF(RC[6]="","|200","|"&RC[6]&IF(RC[7]="","|200","|"&RC[7]&"|200")))) -> 28|34|38|44|200 | D156: =RC[7]&IF(RC[8]="","","#"&RC[8]&IF(RC[9]="","","#"&RC[9]&IF(RC[10]="","","#"&RC[10]&IF(RC[11]="","","#"&RC[11])))) -> 13439#10014#10004#10010#10008 | E156: =RC[11]&IF(RC[12]="","","#"&RC[12]&IF(RC[13]="","","#"&RC[13]&IF(RC[14]="","","#"&RC[14]&IF(RC[15]="","","#"&RC[15])))) -> 1#50#100#150#200 | F156: 28 | G156: 34 | H156: 38 | I156: 44 | K156: =R[-1]C -> 13439 | L156: =R[-1]C -> 10014 | M156: =R[-1]C -> 10004 | N156: =R[-1]C -> 10010 | O156: =R[-1]C -> 10008 | P156: =R[-1]C -> 1 | Q156: =R[-1]C -> 50 | R156: =R[-1]C -> 100 | S156: =R[-1]C -> 150 | T156: =R[-1]C -> 200 | U156: 同上
A157: 151 | B157: 50 | C157: =RC[3]&IF(RC[4]="","|200","|"&RC[4]&IF(RC[5]="","|200","|"&RC[5]&IF(RC[6]="","|200","|"&RC[6]&IF(RC[7]="","|200","|"&RC[7]&"|200")))) -> 28|34|38|44|200 | D157: =RC[7]&IF(RC[8]="","","#"&RC[8]&IF(RC[9]="","","#"&RC[9]&IF(RC[10]="","","#"&RC[10]&IF(RC[11]="","","#"&RC[11])))) -> 13439#10014#10004#10010#10008 | E157: =RC[11]&IF(RC[12]="","","#"&RC[12]&IF(RC[13]="","","#"&RC[13]&IF(RC[14]="","","#"&RC[14]&IF(RC[15]="","","#"&RC[15])))) -> 1#50#100#150#200 | F157: 28 | G157: 34 | H157: 38 | I157: 44 | K157: =R[-1]C -> 13439 | L157: =R[-1]C -> 10014 | M157: =R[-1]C -> 10004 | N157: =R[-1]C -> 10010 | O157: =R[-1]C -> 10008 | P157: =R[-1]C -> 1 | Q157: =R[-1]C -> 50 | R157: =R[-1]C -> 100 | S157: =R[-1]C -> 150 | T157: =R[-1]C -> 200 | U157: 同上
A158: 152 | B158: 50 | C158: =RC[3]&IF(RC[4]="","|200","|"&RC[4]&IF(RC[5]="","|200","|"&RC[5]&IF(RC[6]="","|200","|"&RC[6]&IF(RC[7]="","|200","|"&RC[7]&"|200")))) -> 28|34|38|44|200 | D158: =RC[7]&IF(RC[8]="","","#"&RC[8]&IF(RC[9]="","","#"&RC[9]&IF(RC[10]="","","#"&RC[10]&IF(RC[11]="","","#"&RC[11])))) -> 13439#10014#10004#10010#10008 | E158: =RC[11]&IF(RC[12]="","","#"&RC[12]&IF(RC[13]="","","#"&RC[13]&IF(RC[14]="","","#"&RC[14]&IF(RC[15]="","","#"&RC[15])))) -> 1#50#100#150#200 | F158: 28 | G158: 34 | H158: 38 | I158: 44 | K158: =R[-1]C -> 13439 | L158: =R[-1]C -> 10014 | M158: =R[-1]C -> 10004 | N158: =R[-1]C -> 10010 | O158: =R[-1]C -> 10008 | P158: =R[-1]C -> 1 | Q158: =R[-1]C -> 50 | R158: =R[-1]C -> 100 | S158: =R[-1]C -> 150 | T158: =R[-1]C -> 200 | U158: 同上
A159: 153 | B159: 50 | C159: =RC[3]&IF(RC[4]="","|200","|"&RC[4]&IF(RC[5]="","|200","|"&RC[5]&IF(RC[6]="","|200","|"&RC[6]&IF(RC[7]="","|200","|"&RC[7]&"|200")))) -> 28|34|38|44|200 | D159: =RC[7]&IF(RC[8]="","","#"&RC[8]&IF(RC[9]="","","#"&RC[9]&IF(RC[10]="","","#"&RC[10]&IF(RC[11]="","","#"&RC[11])))) -> 13439#10014#10004#10010#10008 | E159: =RC[11]&IF(RC[12]="","","#"&RC[12]&IF(RC[13]="","","#"&RC[13]&IF(RC[14]="","","#"&RC[14]&IF(RC[15]="","","#"&RC[15])))) -> 1#50#100#150#200 | F159: 28 | G159: 34 | H159: 38 | I159: 44 | K159: =R[-1]C -> 13439 | L159: =R[-1]C -> 10014 | M159: =R[-1]C -> 10004 | N159: =R[-1]C -> 10010 | O159: =R[-1]C -> 10008 | P159: =R[-1]C -> 1 | Q159: =R[-1]C -> 50 | R159: =R[-1]C -> 100 | S159: =R[-1]C -> 150 | T159: =R[-1]C -> 200 | U159: 同上
A160: 154 | B160: 50 | C160: =RC[3]&IF(RC[4]="","|200","|"&RC[4]&IF(RC[5]="","|200","|"&RC[5]&IF(RC[6]="","|200","|"&RC[6]&IF(RC[7]="","|200","|"&RC[7]&"|200")))) -> 28|34|38|44|200 | D160: =RC[7]&IF(RC[8]="","","#"&RC[8]&IF(RC[9]="","","#"&RC[9]&IF(RC[10]="","","#"&RC[10]&IF(RC[11]="","","#"&RC[11])))) -> 13439#10014#10004#10010#10008 | E160: =RC[11]&IF(RC[12]="","","#"&RC[12]&IF(RC[13]="","","#"&RC[13]&IF(RC[14]="","","#"&RC[14]&IF(RC[15]="","","#"&RC[15])))) -> 1#50#100#150#200 | F160: 28 | G160: 34 | H160: 38 | I160: 44 | K160: =R[-1]C -> 13439 | L160: =R[-1]C -> 10014 | M160: =R[-1]C -> 10004 | N160: =R[-1]C -> 10010 | O160: =R[-1]C -> 10008 | P160: =R[-1]C -> 1 | Q160: =R[-1]C -> 50 | R160: =R[-1]C -> 100 | S160: =R[-1]C -> 150 | T160: =R[-1]C -> 200 | U160: 同上
A161: 155 | B161: 50 | C161: =RC[3]&IF(RC[4]="","|200","|"&RC[4]&IF(RC[5]="","|200","|"&RC[5]&IF(RC[6]="","|200","|"&RC[6]&IF(RC[7]="","|200","|"&RC[7]&"|200")))) -> 28|34|38|44|200 | D161: =RC[7]&IF(RC[8]="","","#"&RC[8]&IF(RC[9]="","","#"&RC[9]&IF(RC[10]="","","#"&RC[10]&IF(RC[11]="","","#"&RC[11])))) -> 13439#10014#10004#10010#10008 | E161: =RC[11]&IF(RC[12]="","","#"&RC[12]&IF(RC[13]="","","#"&RC[13]&IF(RC[14]="","","#"&RC[14]&IF(RC[15]="","","#"&RC[15])))) -> 1#50#100#150#200 | F161: 28 | G161: 34 | H161: 38 | I161: 44 | K161: =R[-1]C -> 13439 | L161: =R[-1]C -> 10014 | M161: =R[-1]C -> 10004 | N161: =R[-1]C -> 10010 | O161: =R[-1]C -> 10008 | P161: =R[-1]C -> 1 | Q161: =R[-1]C -> 50 | R161: =R[-1]C -> 100 | S161: =R[-1]C -> 150 | T161: =R[-1]C -> 200 | U161: 同上
A162: 156 | B162: 50 | C162: =RC[3]&IF(RC[4]="","|200","|"&RC[4]&IF(RC[5]="","|200","|"&RC[5]&IF(RC[6]="","|200","|"&RC[6]&IF(RC[7]="","|200","|"&RC[7]&"|200")))) -> 28|34|38|44|200 | D162: =RC[7]&IF(RC[8]="","","#"&RC[8]&IF(RC[9]="","","#"&RC[9]&IF(RC[10]="","","#"&RC[10]&IF(RC[11]="","","#"&RC[11])))) -> 13439#10014#10004#10010#10008 | E162: =RC[11]&IF(RC[12]="","","#"&RC[12]&IF(RC[13]="","","#"&RC[13]&IF(RC[14]="","","#"&RC[14]&IF(RC[15]="","","#"&RC[15])))) -> 1#50#100#150#200 | F162: 28 | G162: 34 | H162: 38 | I162: 44 | K162: =R[-1]C -> 13439 | L162: =R[-1]C -> 10014 | M162: =R[-1]C -> 10004 | N162: =R[-1]C -> 10010 | O162: =R[-1]C -> 10008 | P162: =R[-1]C -> 1 | Q162: =R[-1]C -> 50 | R162: =R[-1]C -> 100 | S162: =R[-1]C -> 150 | T162: =R[-1]C -> 200 | U162: 同上
A163: 157 | B163: 50 | C163: =RC[3]&IF(RC[4]="","|200","|"&RC[4]&IF(RC[5]="","|200","|"&RC[5]&IF(RC[6]="","|200","|"&RC[6]&IF(RC[7]="","|200","|"&RC[7]&"|200")))) -> 28|34|38|44|200 | D163: =RC[7]&IF(RC[8]="","","#"&RC[8]&IF(RC[9]="","","#"&RC[9]&IF(RC[10]="","","#"&RC[10]&IF(RC[11]="","","#"&RC[11])))) -> 13439#10014#10004#10010#10008 | E163: =RC[11]&IF(RC[12]="","","#"&RC[12]&IF(RC[13]="","","#"&RC[13]&IF(RC[14]="","","#"&RC[14]&IF(RC[15]="","","#"&RC[15])))) -> 1#50#100#150#200 | F163: 28 | G163: 34 | H163: 38 | I163: 44 | K163: =R[-1]C -> 13439 | L163: =R[-1]C -> 10014 | M163: =R[-1]C -> 10004 | N163: =R[-1]C -> 10010 | O163: =R[-1]C -> 10008 | P163: =R[-1]C -> 1 | Q163: =R[-1]C -> 50 | R163: =R[-1]C -> 100 | S163: =R[-1]C -> 150 | T163: =R[-1]C -> 200 | U163: 同上
A164: 158 | B164: 50 | C164: =RC[3]&IF(RC[4]="","|200","|"&RC[4]&IF(RC[5]="","|200","|"&RC[5]&IF(RC[6]="","|200","|"&RC[6]&IF(RC[7]="","|200","|"&RC[7]&"|200")))) -> 28|34|38|44|200 | D164: =RC[7]&IF(RC[8]="","","#"&RC[8]&IF(RC[9]="","","#"&RC[9]&IF(RC[10]="","","#"&RC[10]&IF(RC[11]="","","#"&RC[11])))) -> 13439#10014#10004#10010#10008 | E164: =RC[11]&IF(RC[12]="","","#"&RC[12]&IF(RC[13]="","","#"&RC[13]&IF(RC[14]="","","#"&RC[14]&IF(RC[15]="","","#"&RC[15])))) -> 1#50#100#150#200 | F164: 28 | G164: 34 | H164: 38 | I164: 44 | K164: =R[-1]C -> 13439 | L164: =R[-1]C -> 10014 | M164: =R[-1]C -> 10004 | N164: =R[-1]C -> 10010 | O164: =R[-1]C -> 10008 | P164: =R[-1]C -> 1 | Q164: =R[-1]C -> 50 | R164: =R[-1]C -> 100 | S164: =R[-1]C -> 150 | T164: =R[-1]C -> 200 | U164: 同上
A165: 159 | B165: 50 | C165: =RC[3]&IF(RC[4]="","|200","|"&RC[4]&IF(RC[5]="","|200","|"&RC[5]&IF(RC[6]="","|200","|"&RC[6]&IF(RC[7]="","|200","|"&RC[7]&"|200")))) -> 28|34|38|44|200 | D165: =RC[7]&IF(RC[8]="","","#"&RC[8]&IF(RC[9]="","","#"&RC[9]&IF(RC[10]="","","#"&RC[10]&IF(RC[11]="","","#"&RC[11])))) -> 13439#10014#10004#10010#10008 | E165: =RC[11]&IF(RC[12]="","","#"&RC[12]&IF(RC[13]="","","#"&RC[13]&IF(RC[14]="","","#"&RC[14]&IF(RC[15]="","","#"&RC[15])))) -> 1#50#100#150#200 | F165: 28 | G165: 34 | H165: 38 | I165: 44 | K165: =R[-1]C -> 13439 | L165: =R[-1]C -> 10014 | M165: =R[-1]C -> 10004 | N165: =R[-1]C -> 10010 | O165: =R[-1]C -> 10008 | P165: =R[-1]C -> 1 | Q165: =R[-1]C -> 50 | R165: =R[-1]C -> 100 | S165: =R[-1]C -> 150 | T165: =R[-1]C -> 200 | U165: 同上
A166: 160 | B166: 50 | C166: =RC[3]&IF(RC[4]="","|200","|"&RC[4]&IF(RC[5]="","|200","|"&RC[5]&IF(RC[6]="","|200","|"&RC[6]&IF(RC[7]="","|200","|"&RC[7]&"|200")))) -> 28|34|38|44|200 | D166: =RC[7]&IF(RC[8]="","","#"&RC[8]&IF(RC[9]="","","#"&RC[9]&IF(RC[10]="","","#"&RC[10]&IF(RC[11]="","","#"&RC[11])))) -> 13439#10014#10004#10010#10008 | E166: =RC[11]&IF(RC[12]="","","#"&RC[12]&IF(RC[13]="","","#"&RC[13]&IF(RC[14]="","","#"&RC[14]&IF(RC[15]="","","#"&RC[15])))) -> 1#50#100#150#200 | F166: 28 | G166: 34 | H166: 38 | I166: 44 | K166: =R[-1]C -> 13439 | L166: =R[-1]C -> 10014 | M166: =R[-1]C -> 10004 | N166: =R[-1]C -> 10010 | O166: =R[-1]C -> 10008 | P166: =R[-1]C -> 1 | Q166: =R[-1]C -> 50 | R166: =R[-1]C -> 100 | S166: =R[-1]C -> 150 | T166: =R[-1]C -> 200 | U166: 同上
A167: 161 | B167: 50 | C167: =RC[3]&IF(RC[4]="","|200","|"&RC[4]&IF(RC[5]="","|200","|"&RC[5]&IF(RC[6]="","|200","|"&RC[6]&IF(RC[7]="","|200","|"&RC[7]&"|200")))) -> 28|34|38|44|200 | D167: =RC[7]&IF(RC[8]="","","#"&RC[8]&IF(RC[9]="","","#"&RC[9]&IF(RC[10]="","","#"&RC[10]&IF(RC[11]="","","#"&RC[11])))) -> 13439#10014#10004#10010#10008 | E167: =RC[11]&IF(RC[12]="","","#"&RC[12]&IF(RC[13]="","","#"&RC[13]&IF(RC[14]="","","#"&RC[14]&IF(RC[15]="","","#"&RC[15])))) -> 1#50#100#150#200 | F167: 28 | G167: 34 | H167: 38 | I167: 44 | K167: =R[-1]C -> 13439 | L167: =R[-1]C -> 10014 | M167: =R[-1]C -> 10004 | N167: =R[-1]C -> 10010 | O167: =R[-1]C -> 10008 | P167: =R[-1]C -> 1 | Q167: =R[-1]C -> 50 | R167: =R[-1]C -> 100 | S167: =R[-1]C -> 150 | T167: =R[-1]C -> 200 | U167: 同上
A168: 162 | B168: 50 | C168: =RC[3]&IF(RC[4]="","|200","|"&RC[4]&IF(RC[5]="","|200","|"&RC[5]&IF(RC[6]="","|200","|"&RC[6]&IF(RC[7]="","|200","|"&RC[7]&"|200")))) -> 28|34|38|44|200 | D168: =RC[7]&IF(RC[8]="","","#"&RC[8]&IF(RC[9]="","","#"&RC[9]&IF(RC[10]="","","#"&RC[10]&IF(RC[11]="","","#"&RC[11])))) -> 13439#10014#10004#10010#10008 | E168: =RC[11]&IF(RC[12]="","","#"&RC[12]&IF(RC[13]="","","#"&RC[13]&IF(RC[14]="","","#"&RC[14]&IF(RC[15]="","","#"&RC[15])))) -> 1#50#100#150#200 | F168: 28 | G168: 34 | H168: 38 | I168: 44 | K168: =R[-1]C -> 13439 | L168: =R[-1]C -> 10014 | M168: =R[-1]C -> 10004 | N168: =R[-1]C -> 10010 | O168: =R[-1]C -> 10008 | P168: =R[-1]C -> 1 | Q168: =R[-1]C -> 50 | R168: =R[-1]C -> 100 | S168: =R[-1]C -> 150 | T168: =R[-1]C -> 200 | U168: 同上
A169: 163 | B169: 50 | C169: =RC[3]&IF(RC[4]="","|200","|"&RC[4]&IF(RC[5]="","|200","|"&RC[5]&IF(RC[6]="","|200","|"&RC[6]&IF(RC[7]="","|200","|"&RC[7]&"|200")))) -> 28|34|38|44|200 | D169: =RC[7]&IF(RC[8]="","","#"&RC[8]&IF(RC[9]="","","#"&RC[9]&IF(RC[10]="","","#"&RC[10]&IF(RC[11]="","","#"&RC[11])))) -> 13439#10014#10004#10010#10008 | E169: =RC[11]&IF(RC[12]="","","#"&RC[12]&IF(RC[13]="","","#"&RC[13]&IF(RC[14]="","","#"&RC[14]&IF(RC[15]="","","#"&RC[15])))) -> 1#50#100#150#200 | F169: 28 | G169: 34 | H169: 38 | I169: 44 | K169: =R[-1]C -> 13439 | L169: =R[-1]C -> 10014 | M169: =R[-1]C -> 10004 | N169: =R[-1]C -> 10010 | O169: =R[-1]C -> 10008 | P169: =R[-1]C -> 1 | Q169: =R[-1]C -> 50 | R169: =R[-1]C -> 100 | S169: =R[-1]C -> 150 | T169: =R[-1]C -> 200 | U169: 同上
A170: 164 | B170: 50 | C170: =RC[3]&IF(RC[4]="","|200","|"&RC[4]&IF(RC[5]="","|200","|"&RC[5]&IF(RC[6]="","|200","|"&RC[6]&IF(RC[7]="","|200","|"&RC[7]&"|200")))) -> 28|34|38|44|200 | D170: =RC[7]&IF(RC[8]="","","#"&RC[8]&IF(RC[9]="","","#"&RC[9]&IF(RC[10]="","","#"&RC[10]&IF(RC[11]="","","#"&RC[11])))) -> 13439#10014#10004#10010#10008 | E170: =RC[11]&IF(RC[12]="","","#"&RC[12]&IF(RC[13]="","","#"&RC[13]&IF(RC[14]="","","#"&RC[14]&IF(RC[15]="","","#"&RC[15])))) -> 1#50#100#150#200 | F170: 28 | G170: 34 | H170: 38 | I170: 44 | K170: =R[-1]C -> 13439 | L170: =R[-1]C -> 10014 | M170: =R[-1]C -> 10004 | N170: =R[-1]C -> 10010 | O170: =R[-1]C -> 10008 | P170: =R[-1]C -> 1 | Q170: =R[-1]C -> 50 | R170: =R[-1]C -> 100 | S170: =R[-1]C -> 150 | T170: =R[-1]C -> 200 | U170: 同上
A171: 165 | B171: 50 | C171: =RC[3]&IF(RC[4]="","|200","|"&RC[4]&IF(RC[5]="","|200","|"&RC[5]&IF(RC[6]="","|200","|"&RC[6]&IF(RC[7]="","|200","|"&RC[7]&"|200")))) -> 28|34|38|44|200 | D171: =RC[7]&IF(RC[8]="","","#"&RC[8]&IF(RC[9]="","","#"&RC[9]&IF(RC[10]="","","#"&RC[10]&IF(RC[11]="","","#"&RC[11])))) -> 13439#10014#10004#10010#10008 | E171: =RC[11]&IF(RC[12]="","","#"&RC[12]&IF(RC[13]="","","#"&RC[13]&IF(RC[14]="","","#"&RC[14]&IF(RC[15]="","","#"&RC[15])))) -> 1#50#100#150#200 | F171: 28 | G171: 34 | H171: 38 | I171: 44 | K171: =R[-1]C -> 13439 | L171: =R[-1]C -> 10014 | M171: =R[-1]C -> 10004 | N171: =R[-1]C -> 10010 | O171: =R[-1]C -> 10008 | P171: =R[-1]C -> 1 | Q171: =R[-1]C -> 50 | R171: =R[-1]C -> 100 | S171: =R[-1]C -> 150 | T171: =R[-1]C -> 200 | U171: 同上
A172: 166 | B172: 50 | C172: =RC[3]&IF(RC[4]="","|200","|"&RC[4]&IF(RC[5]="","|200","|"&RC[5]&IF(RC[6]="","|200","|"&RC[6]&IF(RC[7]="","|200","|"&RC[7]&"|200")))) -> 28|34|38|44|200 | D172: =RC[7]&IF(RC[8]="","","#"&RC[8]&IF(RC[9]="","","#"&RC[9]&IF(RC[10]="","","#"&RC[10]&IF(RC[11]="","","#"&RC[11])))) -> 13439#10014#10004#10010#10008 | E172: =RC[11]&IF(RC[12]="","","#"&RC[12]&IF(RC[13]="","","#"&RC[13]&IF(RC[14]="","","#"&RC[14]&IF(RC[15]="","","#"&RC[15])))) -> 1#50#100#150#200 | F172: 28 | G172: 34 | H172: 38 | I172: 44 | K172: =R[-1]C -> 13439 | L172: =R[-1]C -> 10014 | M172: =R[-1]C -> 10004 | N172: =R[-1]C -> 10010 | O172: =R[-1]C -> 10008 | P172: =R[-1]C -> 1 | Q172: =R[-1]C -> 50 | R172: =R[-1]C -> 100 | S172: =R[-1]C -> 150 | T172: =R[-1]C -> 200 | U172: 同上
A173: 167 | B173: 50 | C173: =RC[3]&IF(RC[4]="","|200","|"&RC[4]&IF(RC[5]="","|200","|"&RC[5]&IF(RC[6]="","|200","|"&RC[6]&IF(RC[7]="","|200","|"&RC[7]&"|200")))) -> 28|34|38|44|200 | D173: =RC[7]&IF(RC[8]="","","#"&RC[8]&IF(RC[9]="","","#"&RC[9]&IF(RC[10]="","","#"&RC[10]&IF(RC[11]="","","#"&RC[11])))) -> 13439#10014#10004#10010#10008 | E173: =RC[11]&IF(RC[12]="","","#"&RC[12]&IF(RC[13]="","","#"&RC[13]&IF(RC[14]="","","#"&RC[14]&IF(RC[15]="","","#"&RC[15])))) -> 1#50#100#150#200 | F173: 28 | G173: 34 | H173: 38 | I173: 44 | K173: =R[-1]C -> 13439 | L173: =R[-1]C -> 10014 | M173: =R[-1]C -> 10004 | N173: =R[-1]C -> 10010 | O173: =R[-1]C -> 10008 | P173: =R[-1]C -> 1 | Q173: =R[-1]C -> 50 | R173: =R[-1]C -> 100 | S173: =R[-1]C -> 150 | T173: =R[-1]C -> 200 | U173: 同上
A174: 168 | B174: 50 | C174: =RC[3]&IF(RC[4]="","|200","|"&RC[4]&IF(RC[5]="","|200","|"&RC[5]&IF(RC[6]="","|200","|"&RC[6]&IF(RC[7]="","|200","|"&RC[7]&"|200")))) -> 28|34|38|44|200 | D174: =RC[7]&IF(RC[8]="","","#"&RC[8]&IF(RC[9]="","","#"&RC[9]&IF(RC[10]="","","#"&RC[10]&IF(RC[11]="","","#"&RC[11])))) -> 13439#10014#10004#10010#10008 | E174: =RC[11]&IF(RC[12]="","","#"&RC[12]&IF(RC[13]="","","#"&RC[13]&IF(RC[14]="","","#"&RC[14]&IF(RC[15]="","","#"&RC[15])))) -> 1#50#100#150#200 | F174: 28 | G174: 34 | H174: 38 | I174: 44 | K174: =R[-1]C -> 13439 | L174: =R[-1]C -> 10014 | M174: =R[-1]C -> 10004 | N174: =R[-1]C -> 10010 | O174: =R[-1]C -> 10008 | P174: =R[-1]C -> 1 | Q174: =R[-1]C -> 50 | R174: =R[-1]C -> 100 | S174: =R[-1]C -> 150 | T174: =R[-1]C -> 200 | U174: 同上
A175: 169 | B175: 50 | C175: =RC[3]&IF(RC[4]="","|200","|"&RC[4]&IF(RC[5]="","|200","|"&RC[5]&IF(RC[6]="","|200","|"&RC[6]&IF(RC[7]="","|200","|"&RC[7]&"|200")))) -> 28|34|38|44|200 | D175: =RC[7]&IF(RC[8]="","","#"&RC[8]&IF(RC[9]="","","#"&RC[9]&IF(RC[10]="","","#"&RC[10]&IF(RC[11]="","","#"&RC[11])))) -> 13439#10014#10004#10010#10008 | E175: =RC[11]&IF(RC[12]="","","#"&RC[12]&IF(RC[13]="","","#"&RC[13]&IF(RC[14]="","","#"&RC[14]&IF(RC[15]="","","#"&RC[15])))) -> 1#50#100#150#200 | F175: 28 | G175: 34 | H175: 38 | I175: 44 | K175: =R[-1]C -> 13439 | L175: =R[-1]C -> 10014 | M175: =R[-1]C -> 10004 | N175: =R[-1]C -> 10010 | O175: =R[-1]C -> 10008 | P175: =R[-1]C -> 1 | Q175: =R[-1]C -> 50 | R175: =R[-1]C -> 100 | S175: =R[-1]C -> 150 | T175: =R[-1]C -> 200 | U175: 同上
A176: 170 | B176: 50 | C176: =RC[3]&IF(RC[4]="","|200","|"&RC[4]&IF(RC[5]="","|200","|"&RC[5]&IF(RC[6]="","|200","|"&RC[6]&IF(RC[7]="","|200","|"&RC[7]&"|200")))) -> 28|34|38|44|200 | D176: =RC[7]&IF(RC[8]="","","#"&RC[8]&IF(RC[9]="","","#"&RC[9]&IF(RC[10]="","","#"&RC[10]&IF(RC[11]="","","#"&RC[11])))) -> 13439#10014#10004#10010#10008 | E176: =RC[11]&IF(RC[12]="","","#"&RC[12]&IF(RC[13]="","","#"&RC[13]&IF(RC[14]="","","#"&RC[14]&IF(RC[15]="","","#"&RC[15])))) -> 1#50#100#150#200 | F176: 28 | G176: 34 | H176: 38 | I176: 44 | K176: =R[-1]C -> 13439 | L176: =R[-1]C -> 10014 | M176: =R[-1]C -> 10004 | N176: =R[-1]C -> 10010 | O176: =R[-1]C -> 10008 | P176: =R[-1]C -> 1 | Q176: =R[-1]C -> 50 | R176: =R[-1]C -> 100 | S176: =R[-1]C -> 150 | T176: =R[-1]C -> 200 | U176: 同上
A177: 171 | B177: 50 | C177: =RC[3]&IF(RC[4]="","|200","|"&RC[4]&IF(RC[5]="","|200","|"&RC[5]&IF(RC[6]="","|200","|"&RC[6]&IF(RC[7]="","|200","|"&RC[7]&"|200")))) -> 28|34|38|44|200 | D177: =RC[7]&IF(RC[8]="","","#"&RC[8]&IF(RC[9]="","","#"&RC[9]&IF(RC[10]="","","#"&RC[10]&IF(RC[11]="","","#"&RC[11])))) -> 13439#10014#10004#10010#10008 | E177: =RC[11]&IF(RC[12]="","","#"&RC[12]&IF(RC[13]="","","#"&RC[13]&IF(RC[14]="","","#"&RC[14]&IF(RC[15]="","","#"&RC[15])))) -> 1#50#100#150#200 | F177: 28 | G177: 34 | H177: 38 | I177: 44 | K177: =R[-1]C -> 13439 | L177: =R[-1]C -> 10014 | M177: =R[-1]C -> 10004 | N177: =R[-1]C -> 10010 | O177: =R[-1]C -> 10008 | P177: =R[-1]C -> 1 | Q177: =R[-1]C -> 50 | R177: =R[-1]C -> 100 | S177: =R[-1]C -> 150 | T177: =R[-1]C -> 200 | U177: 同上
A178: 172 | B178: 50 | C178: =RC[3]&IF(RC[4]="","|200","|"&RC[4]&IF(RC[5]="","|200","|"&RC[5]&IF(RC[6]="","|200","|"&RC[6]&IF(RC[7]="","|200","|"&RC[7]&"|200")))) -> 28|34|38|44|200 | D178: =RC[7]&IF(RC[8]="","","#"&RC[8]&IF(RC[9]="","","#"&RC[9]&IF(RC[10]="","","#"&RC[10]&IF(RC[11]="","","#"&RC[11])))) -> 13439#10014#10004#10010#10008 | E178: =RC[11]&IF(RC[12]="","","#"&RC[12]&IF(RC[13]="","","#"&RC[13]&IF(RC[14]="","","#"&RC[14]&IF(RC[15]="","","#"&RC[15])))) -> 1#50#100#150#200 | F178: 28 | G178: 34 | H178: 38 | I178: 44 | K178: =R[-1]C -> 13439 | L178: =R[-1]C -> 10014 | M178: =R[-1]C -> 10004 | N178: =R[-1]C -> 10010 | O178: =R[-1]C -> 10008 | P178: =R[-1]C -> 1 | Q178: =R[-1]C -> 50 | R178: =R[-1]C -> 100 | S178: =R[-1]C -> 150 | T178: =R[-1]C -> 200 | U178: 同上
A179: 173 | B179: 50 | C179: =RC[3]&IF(RC[4]="","|200","|"&RC[4]&IF(RC[5]="","|200","|"&RC[5]&IF(RC[6]="","|200","|"&RC[6]&IF(RC[7]="","|200","|"&RC[7]&"|200")))) -> 28|34|38|44|200 | D179: =RC[7]&IF(RC[8]="","","#"&RC[8]&IF(RC[9]="","","#"&RC[9]&IF(RC[10]="","","#"&RC[10]&IF(RC[11]="","","#"&RC[11])))) -> 13439#10014#10004#10010#10008 | E179: =RC[11]&IF(RC[12]="","","#"&RC[12]&IF(RC[13]="","","#"&RC[13]&IF(RC[14]="","","#"&RC[14]&IF(RC[15]="","","#"&RC[15])))) -> 1#50#100#150#200 | F179: 28 | G179: 34 | H179: 38 | I179: 44 | K179: =R[-1]C -> 13439 | L179: =R[-1]C -> 10014 | M179: =R[-1]C -> 10004 | N179: =R[-1]C -> 10010 | O179: =R[-1]C -> 10008 | P179: =R[-1]C -> 1 | Q179: =R[-1]C -> 50 | R179: =R[-1]C -> 100 | S179: =R[-1]C -> 150 | T179: =R[-1]C -> 200 | U179: 同上
A180: 174 | B180: 50 | C180: =RC[3]&IF(RC[4]="","|200","|"&RC[4]&IF(RC[5]="","|200","|"&RC[5]&IF(RC[6]="","|200","|"&RC[6]&IF(RC[7]="","|200","|"&RC[7]&"|200")))) -> 28|34|38|44|200 | D180: =RC[7]&IF(RC[8]="","","#"&RC[8]&IF(RC[9]="","","#"&RC[9]&IF(RC[10]="","","#"&RC[10]&IF(RC[11]="","","#"&RC[11])))) -> 13439#10014#10004#10010#10008 | E180: =RC[11]&IF(RC[12]="","","#"&RC[12]&IF(RC[13]="","","#"&RC[13]&IF(RC[14]="","","#"&RC[14]&IF(RC[15]="","","#"&RC[15])))) -> 1#50#100#150#200 | F180: 28 | G180: 34 | H180: 38 | I180: 44 | K180: =R[-1]C -> 13439 | L180: =R[-1]C -> 10014 | M180: =R[-1]C -> 10004 | N180: =R[-1]C -> 10010 | O180: =R[-1]C -> 10008 | P180: =R[-1]C -> 1 | Q180: =R[-1]C -> 50 | R180: =R[-1]C -> 100 | S180: =R[-1]C -> 150 | T180: =R[-1]C -> 200 | U180: 同上
A181: 175 | B181: 50 | C181: =RC[3]&IF(RC[4]="","|200","|"&RC[4]&IF(RC[5]="","|200","|"&RC[5]&IF(RC[6]="","|200","|"&RC[6]&IF(RC[7]="","|200","|"&RC[7]&"|200")))) -> 28|34|38|44|200 | D181: =RC[7]&IF(RC[8]="","","#"&RC[8]&IF(RC[9]="","","#"&RC[9]&IF(RC[10]="","","#"&RC[10]&IF(RC[11]="","","#"&RC[11])))) -> 13439#10014#10004#10010#10008 | E181: =RC[11]&IF(RC[12]="","","#"&RC[12]&IF(RC[13]="","","#"&RC[13]&IF(RC[14]="","","#"&RC[14]&IF(RC[15]="","","#"&RC[15])))) -> 1#50#100#150#200 | F181: 28 | G181: 34 | H181: 38 | I181: 44 | K181: =R[-1]C -> 13439 | L181: =R[-1]C -> 10014 | M181: =R[-1]C -> 10004 | N181: =R[-1]C -> 10010 | O181: =R[-1]C -> 10008 | P181: =R[-1]C -> 1 | Q181: =R[-1]C -> 50 | R181: =R[-1]C -> 100 | S181: =R[-1]C -> 150 | T181: =R[-1]C -> 200 | U181: 同上
A182: 176 | B182: 50 | C182: =RC[3]&IF(RC[4]="","|200","|"&RC[4]&IF(RC[5]="","|200","|"&RC[5]&IF(RC[6]="","|200","|"&RC[6]&IF(RC[7]="","|200","|"&RC[7]&"|200")))) -> 28|34|38|44|200 | D182: =RC[7]&IF(RC[8]="","","#"&RC[8]&IF(RC[9]="","","#"&RC[9]&IF(RC[10]="","","#"&RC[10]&IF(RC[11]="","","#"&RC[11])))) -> 13439#10014#10004#10010#10008 | E182: =RC[11]&IF(RC[12]="","","#"&RC[12]&IF(RC[13]="","","#"&RC[13]&IF(RC[14]="","","#"&RC[14]&IF(RC[15]="","","#"&RC[15])))) -> 1#50#100#150#200 | F182: 28 | G182: 34 | H182: 38 | I182: 44 | K182: =R[-1]C -> 13439 | L182: =R[-1]C -> 10014 | M182: =R[-1]C -> 10004 | N182: =R[-1]C -> 10010 | O182: =R[-1]C -> 10008 | P182: =R[-1]C -> 1 | Q182: =R[-1]C -> 50 | R182: =R[-1]C -> 100 | S182: =R[-1]C -> 150 | T182: =R[-1]C -> 200 | U182: 同上
A183: 177 | B183: 50 | C183: =RC[3]&IF(RC[4]="","|200","|"&RC[4]&IF(RC[5]="","|200","|"&RC[5]&IF(RC[6]="","|200","|"&RC[6]&IF(RC[7]="","|200","|"&RC[7]&"|200")))) -> 28|34|38|44|200 | D183: =RC[7]&IF(RC[8]="","","#"&RC[8]&IF(RC[9]="","","#"&RC[9]&IF(RC[10]="","","#"&RC[10]&IF(RC[11]="","","#"&RC[11])))) -> 13439#10014#10004#10010#10008 | E183: =RC[11]&IF(RC[12]="","","#"&RC[12]&IF(RC[13]="","","#"&RC[13]&IF(RC[14]="","","#"&RC[14]&IF(RC[15]="","","#"&RC[15])))) -> 1#50#100#150#200 | F183: 28 | G183: 34 | H183: 38 | I183: 44 | K183: =R[-1]C -> 13439 | L183: =R[-1]C -> 10014 | M183: =R[-1]C -> 10004 | N183: =R[-1]C -> 10010 | O183: =R[-1]C -> 10008 | P183: =R[-1]C -> 1 | Q183: =R[-1]C -> 50 | R183: =R[-1]C -> 100 | S183: =R[-1]C -> 150 | T183: =R[-1]C -> 200 | U183: 同上
A184: 178 | B184: 50 | C184: =RC[3]&IF(RC[4]="","|200","|"&RC[4]&IF(RC[5]="","|200","|"&RC[5]&IF(RC[6]="","|200","|"&RC[6]&IF(RC[7]="","|200","|"&RC[7]&"|200")))) -> 28|34|38|44|200 | D184: =RC[7]&IF(RC[8]="","","#"&RC[8]&IF(RC[9]="","","#"&RC[9]&IF(RC[10]="","","#"&RC[10]&IF(RC[11]="","","#"&RC[11])))) -> 13439#10014#10004#10010#10008 | E184: =RC[11]&IF(RC[12]="","","#"&RC[12]&IF(RC[13]="","","#"&RC[13]&IF(RC[14]="","","#"&RC[14]&IF(RC[15]="","","#"&RC[15])))) -> 1#50#100#150#200 | F184: 28 | G184: 34 | H184: 38 | I184: 44 | K184: =R[-1]C -> 13439 | L184: =R[-1]C -> 10014 | M184: =R[-1]C -> 10004 | N184: =R[-1]C -> 10010 | O184: =R[-1]C -> 10008 | P184: =R[-1]C -> 1 | Q184: =R[-1]C -> 50 | R184: =R[-1]C -> 100 | S184: =R[-1]C -> 150 | T184: =R[-1]C -> 200 | U184: 同上
A185: 179 | B185: 50 | C185: =RC[3]&IF(RC[4]="","|200","|"&RC[4]&IF(RC[5]="","|200","|"&RC[5]&IF(RC[6]="","|200","|"&RC[6]&IF(RC[7]="","|200","|"&RC[7]&"|200")))) -> 28|34|38|44|200 | D185: =RC[7]&IF(RC[8]="","","#"&RC[8]&IF(RC[9]="","","#"&RC[9]&IF(RC[10]="","","#"&RC[10]&IF(RC[11]="","","#"&RC[11])))) -> 13439#10014#10004#10010#10008 | E185: =RC[11]&IF(RC[12]="","","#"&RC[12]&IF(RC[13]="","","#"&RC[13]&IF(RC[14]="","","#"&RC[14]&IF(RC[15]="","","#"&RC[15])))) -> 1#50#100#150#200 | F185: 28 | G185: 34 | H185: 38 | I185: 44 | K185: =R[-1]C -> 13439 | L185: =R[-1]C -> 10014 | M185: =R[-1]C -> 10004 | N185: =R[-1]C -> 10010 | O185: =R[-1]C -> 10008 | P185: =R[-1]C -> 1 | Q185: =R[-1]C -> 50 | R185: =R[-1]C -> 100 | S185: =R[-1]C -> 150 | T185: =R[-1]C -> 200 | U185: 同上
A186: 180 | B186: 50 | C186: =RC[3]&IF(RC[4]="","|200","|"&RC[4]&IF(RC[5]="","|200","|"&RC[5]&IF(RC[6]="","|200","|"&RC[6]&IF(RC[7]="","|200","|"&RC[7]&"|200")))) -> 28|34|38|44|200 | D186: =RC[7]&IF(RC[8]="","","#"&RC[8]&IF(RC[9]="","","#"&RC[9]&IF(RC[10]="","","#"&RC[10]&IF(RC[11]="","","#"&RC[11])))) -> 13439#10014#10004#10010#10008 | E186: =RC[11]&IF(RC[12]="","","#"&RC[12]&IF(RC[13]="","","#"&RC[13]&IF(RC[14]="","","#"&RC[14]&IF(RC[15]="","","#"&RC[15])))) -> 1#50#100#150#200 | F186: 28 | G186: 34 | H186: 38 | I186: 44 | K186: =R[-1]C -> 13439 | L186: =R[-1]C -> 10014 | M186: =R[-1]C -> 10004 | N186: =R[-1]C -> 10010 | O186: =R[-1]C -> 10008 | P186: =R[-1]C -> 1 | Q186: =R[-1]C -> 50 | R186: =R[-1]C -> 100 | S186: =R[-1]C -> 150 | T186: =R[-1]C -> 200 | U186: 同上
A187: 181 | B187: 50 | C187: =RC[3]&IF(RC[4]="","|200","|"&RC[4]&IF(RC[5]="","|200","|"&RC[5]&IF(RC[6]="","|200","|"&RC[6]&IF(RC[7]="","|200","|"&RC[7]&"|200")))) -> 28|34|38|44|200 | D187: =RC[7]&IF(RC[8]="","","#"&RC[8]&IF(RC[9]="","","#"&RC[9]&IF(RC[10]="","","#"&RC[10]&IF(RC[11]="","","#"&RC[11])))) -> 13439#10014#10004#10010#10008 | E187: =RC[11]&IF(RC[12]="","","#"&RC[12]&IF(RC[13]="","","#"&RC[13]&IF(RC[14]="","","#"&RC[14]&IF(RC[15]="","","#"&RC[15])))) -> 1#50#100#150#200 | F187: 28 | G187: 34 | H187: 38 | I187: 44 | K187: =R[-1]C -> 13439 | L187: =R[-1]C -> 10014 | M187: =R[-1]C -> 10004 | N187: =R[-1]C -> 10010 | O187: =R[-1]C -> 10008 | P187: =R[-1]C -> 1 | Q187: =R[-1]C -> 50 | R187: =R[-1]C -> 100 | S187: =R[-1]C -> 150 | T187: =R[-1]C -> 200 | U187: 同上
A188: 182 | B188: 50 | C188: =RC[3]&IF(RC[4]="","|200","|"&RC[4]&IF(RC[5]="","|200","|"&RC[5]&IF(RC[6]="","|200","|"&RC[6]&IF(RC[7]="","|200","|"&RC[7]&"|200")))) -> 28|34|38|44|200 | D188: =RC[7]&IF(RC[8]="","","#"&RC[8]&IF(RC[9]="","","#"&RC[9]&IF(RC[10]="","","#"&RC[10]&IF(RC[11]="","","#"&RC[11])))) -> 13439#10014#10004#10010#10008 | E188: =RC[11]&IF(RC[12]="","","#"&RC[12]&IF(RC[13]="","","#"&RC[13]&IF(RC[14]="","","#"&RC[14]&IF(RC[15]="","","#"&RC[15])))) -> 1#50#100#150#200 | F188: 28 | G188: 34 | H188: 38 | I188: 44 | K188: =R[-1]C -> 13439 | L188: =R[-1]C -> 10014 | M188: =R[-1]C -> 10004 | N188: =R[-1]C -> 10010 | O188: =R[-1]C -> 10008 | P188: =R[-1]C -> 1 | Q188: =R[-1]C -> 50 | R188: =R[-1]C -> 100 | S188: =R[-1]C -> 150 | T188: =R[-1]C -> 200 | U188: 同上
A189: 183 | B189: 50 | C189: =RC[3]&IF(RC[4]="","|200","|"&RC[4]&IF(RC[5]="","|200","|"&RC[5]&IF(RC[6]="","|200","|"&RC[6]&IF(RC[7]="","|200","|"&RC[7]&"|200")))) -> 28|34|38|44|200 | D189: =RC[7]&IF(RC[8]="","","#"&RC[8]&IF(RC[9]="","","#"&RC[9]&IF(RC[10]="","","#"&RC[10]&IF(RC[11]="","","#"&RC[11])))) -> 13439#10014#10004#10010#10008 | E189: =RC[11]&IF(RC[12]="","","#"&RC[12]&IF(RC[13]="","","#"&RC[13]&IF(RC[14]="","","#"&RC[14]&IF(RC[15]="","","#"&RC[15])))) -> 1#50#100#150#200 | F189: 28 | G189: 34 | H189: 38 | I189: 44 | K189: =R[-1]C -> 13439 | L189: =R[-1]C -> 10014 | M189: =R[-1]C -> 10004 | N189: =R[-1]C -> 10010 | O189: =R[-1]C -> 10008 | P189: =R[-1]C -> 1 | Q189: =R[-1]C -> 50 | R189: =R[-1]C -> 100 | S189: =R[-1]C -> 150 | T189: =R[-1]C -> 200 | U189: 同上
A190: 184 | B190: 50 | C190: =RC[3]&IF(RC[4]="","|200","|"&RC[4]&IF(RC[5]="","|200","|"&RC[5]&IF(RC[6]="","|200","|"&RC[6]&IF(RC[7]="","|200","|"&RC[7]&"|200")))) -> 28|34|38|44|200 | D190: =RC[7]&IF(RC[8]="","","#"&RC[8]&IF(RC[9]="","","#"&RC[9]&IF(RC[10]="","","#"&RC[10]&IF(RC[11]="","","#"&RC[11])))) -> 13439#10014#10004#10010#10008 | E190: =RC[11]&IF(RC[12]="","","#"&RC[12]&IF(RC[13]="","","#"&RC[13]&IF(RC[14]="","","#"&RC[14]&IF(RC[15]="","","#"&RC[15])))) -> 1#50#100#150#200 | F190: 28 | G190: 34 | H190: 38 | I190: 44 | K190: =R[-1]C -> 13439 | L190: =R[-1]C -> 10014 | M190: =R[-1]C -> 10004 | N190: =R[-1]C -> 10010 | O190: =R[-1]C -> 10008 | P190: =R[-1]C -> 1 | Q190: =R[-1]C -> 50 | R190: =R[-1]C -> 100 | S190: =R[-1]C -> 150 | T190: =R[-1]C -> 200 | U190: 同上
A191: 185 | B191: 50 | C191: =RC[3]&IF(RC[4]="","|200","|"&RC[4]&IF(RC[5]="","|200","|"&RC[5]&IF(RC[6]="","|200","|"&RC[6]&IF(RC[7]="","|200","|"&RC[7]&"|200")))) -> 28|34|38|44|200 | D191: =RC[7]&IF(RC[8]="","","#"&RC[8]&IF(RC[9]="","","#"&RC[9]&IF(RC[10]="","","#"&RC[10]&IF(RC[11]="","","#"&RC[11])))) -> 13439#10014#10004#10010#10008 | E191: =RC[11]&IF(RC[12]="","","#"&RC[12]&IF(RC[13]="","","#"&RC[13]&IF(RC[14]="","","#"&RC[14]&IF(RC[15]="","","#"&RC[15])))) -> 1#50#100#150#200 | F191: 28 | G191: 34 | H191: 38 | I191: 44 | K191: =R[-1]C -> 13439 | L191: =R[-1]C -> 10014 | M191: =R[-1]C -> 10004 | N191: =R[-1]C -> 10010 | O191: =R[-1]C -> 10008 | P191: =R[-1]C -> 1 | Q191: =R[-1]C -> 50 | R191: =R[-1]C -> 100 | S191: =R[-1]C -> 150 | T191: =R[-1]C -> 200 | U191: 同上
A192: 186 | B192: 50 | C192: =RC[3]&IF(RC[4]="","|200","|"&RC[4]&IF(RC[5]="","|200","|"&RC[5]&IF(RC[6]="","|200","|"&RC[6]&IF(RC[7]="","|200","|"&RC[7]&"|200")))) -> 28|34|38|44|200 | D192: =RC[7]&IF(RC[8]="","","#"&RC[8]&IF(RC[9]="","","#"&RC[9]&IF(RC[10]="","","#"&RC[10]&IF(RC[11]="","","#"&RC[11])))) -> 13439#10014#10004#10010#10008 | E192: =RC[11]&IF(RC[12]="","","#"&RC[12]&IF(RC[13]="","","#"&RC[13]&IF(RC[14]="","","#"&RC[14]&IF(RC[15]="","","#"&RC[15])))) -> 1#50#100#150#200 | F192: 28 | G192: 34 | H192: 38 | I192: 44 | K192: =R[-1]C -> 13439 | L192: =R[-1]C -> 10014 | M192: =R[-1]C -> 10004 | N192: =R[-1]C -> 10010 | O192: =R[-1]C -> 10008 | P192: =R[-1]C -> 1 | Q192: =R[-1]C -> 50 | R192: =R[-1]C -> 100 | S192: =R[-1]C -> 150 | T192: =R[-1]C -> 200 | U192: 同上
A193: 187 | B193: 50 | C193: =RC[3]&IF(RC[4]="","|200","|"&RC[4]&IF(RC[5]="","|200","|"&RC[5]&IF(RC[6]="","|200","|"&RC[6]&IF(RC[7]="","|200","|"&RC[7]&"|200")))) -> 28|34|38|44|200 | D193: =RC[7]&IF(RC[8]="","","#"&RC[8]&IF(RC[9]="","","#"&RC[9]&IF(RC[10]="","","#"&RC[10]&IF(RC[11]="","","#"&RC[11])))) -> 13439#10014#10004#10010#10008 | E193: =RC[11]&IF(RC[12]="","","#"&RC[12]&IF(RC[13]="","","#"&RC[13]&IF(RC[14]="","","#"&RC[14]&IF(RC[15]="","","#"&RC[15])))) -> 1#50#100#150#200 | F193: 28 | G193: 34 | H193: 38 | I193: 44 | K193: =R[-1]C -> 13439 | L193: =R[-1]C -> 10014 | M193: =R[-1]C -> 10004 | N193: =R[-1]C -> 10010 | O193: =R[-1]C -> 10008 | P193: =R[-1]C -> 1 | Q193: =R[-1]C -> 50 | R193: =R[-1]C -> 100 | S193: =R[-1]C -> 150 | T193: =R[-1]C -> 200 | U193: 同上
A194: 188 | B194: 50 | C194: =RC[3]&IF(RC[4]="","|200","|"&RC[4]&IF(RC[5]="","|200","|"&RC[5]&IF(RC[6]="","|200","|"&RC[6]&IF(RC[7]="","|200","|"&RC[7]&"|200")))) -> 28|34|38|44|200 | D194: =RC[7]&IF(RC[8]="","","#"&RC[8]&IF(RC[9]="","","#"&RC[9]&IF(RC[10]="","","#"&RC[10]&IF(RC[11]="","","#"&RC[11])))) -> 13439#10014#10004#10010#10008 | E194: =RC[11]&IF(RC[12]="","","#"&RC[12]&IF(RC[13]="","","#"&RC[13]&IF(RC[14]="","","#"&RC[14]&IF(RC[15]="","","#"&RC[15])))) -> 1#50#100#150#200 | F194: 28 | G194: 34 | H194: 38 | I194: 44 | K194: =R[-1]C -> 13439 | L194: =R[-1]C -> 10014 | M194: =R[-1]C -> 10004 | N194: =R[-1]C -> 10010 | O194: =R[-1]C -> 10008 | P194: =R[-1]C -> 1 | Q194: =R[-1]C -> 50 | R194: =R[-1]C -> 100 | S194: =R[-1]C -> 150 | T194: =R[-1]C -> 200 | U194: 同上
A195: 189 | B195: 50 | C195: =RC[3]&IF(RC[4]="","|200","|"&RC[4]&IF(RC[5]="","|200","|"&RC[5]&IF(RC[6]="","|200","|"&RC[6]&IF(RC[7]="","|200","|"&RC[7]&"|200")))) -> 28|34|38|44|200 | D195: =RC[7]&IF(RC[8]="","","#"&RC[8]&IF(RC[9]="","","#"&RC[9]&IF(RC[10]="","","#"&RC[10]&IF(RC[11]="","","#"&RC[11])))) -> 13439#10014#10004#10010#10008 | E195: =RC[11]&IF(RC[12]="","","#"&RC[12]&IF(RC[13]="","","#"&RC[13]&IF(RC[14]="","","#"&RC[14]&IF(RC[15]="","","#"&RC[15])))) -> 1#50#100#150#200 | F195: 28 | G195: 34 | H195: 38 | I195: 44 | K195: =R[-1]C -> 13439 | L195: =R[-1]C -> 10014 | M195: =R[-1]C -> 10004 | N195: =R[-1]C -> 10010 | O195: =R[-1]C -> 10008 | P195: =R[-1]C -> 1 | Q195: =R[-1]C -> 50 | R195: =R[-1]C -> 100 | S195: =R[-1]C -> 150 | T195: =R[-1]C -> 200 | U195: 同上
A196: 190 | B196: 50 | C196: =RC[3]&IF(RC[4]="","|200","|"&RC[4]&IF(RC[5]="","|200","|"&RC[5]&IF(RC[6]="","|200","|"&RC[6]&IF(RC[7]="","|200","|"&RC[7]&"|200")))) -> 28|34|38|44|200 | D196: =RC[7]&IF(RC[8]="","","#"&RC[8]&IF(RC[9]="","","#"&RC[9]&IF(RC[10]="","","#"&RC[10]&IF(RC[11]="","","#"&RC[11])))) -> 13439#10014#10004#10010#10008 | E196: =RC[11]&IF(RC[12]="","","#"&RC[12]&IF(RC[13]="","","#"&RC[13]&IF(RC[14]="","","#"&RC[14]&IF(RC[15]="","","#"&RC[15])))) -> 1#50#100#150#200 | F196: 28 | G196: 34 | H196: 38 | I196: 44 | K196: =R[-1]C -> 13439 | L196: =R[-1]C -> 10014 | M196: =R[-1]C -> 10004 | N196: =R[-1]C -> 10010 | O196: =R[-1]C -> 10008 | P196: =R[-1]C -> 1 | Q196: =R[-1]C -> 50 | R196: =R[-1]C -> 100 | S196: =R[-1]C -> 150 | T196: =R[-1]C -> 200 | U196: 同上
A197: 191 | B197: 50 | C197: =RC[3]&IF(RC[4]="","|200","|"&RC[4]&IF(RC[5]="","|200","|"&RC[5]&IF(RC[6]="","|200","|"&RC[6]&IF(RC[7]="","|200","|"&RC[7]&"|200")))) -> 28|34|38|44|200 | D197: =RC[7]&IF(RC[8]="","","#"&RC[8]&IF(RC[9]="","","#"&RC[9]&IF(RC[10]="","","#"&RC[10]&IF(RC[11]="","","#"&RC[11])))) -> 13439#10014#10004#10010#10008 | E197: =RC[11]&IF(RC[12]="","","#"&RC[12]&IF(RC[13]="","","#"&RC[13]&IF(RC[14]="","","#"&RC[14]&IF(RC[15]="","","#"&RC[15])))) -> 1#50#100#150#200 | F197: 28 | G197: 34 | H197: 38 | I197: 44 | K197: =R[-1]C -> 13439 | L197: =R[-1]C -> 10014 | M197: =R[-1]C -> 10004 | N197: =R[-1]C -> 10010 | O197: =R[-1]C -> 10008 | P197: =R[-1]C -> 1 | Q197: =R[-1]C -> 50 | R197: =R[-1]C -> 100 | S197: =R[-1]C -> 150 | T197: =R[-1]C -> 200 | U197: 同上
A198: 192 | B198: 50 | C198: =RC[3]&IF(RC[4]="","|200","|"&RC[4]&IF(RC[5]="","|200","|"&RC[5]&IF(RC[6]="","|200","|"&RC[6]&IF(RC[7]="","|200","|"&RC[7]&"|200")))) -> 28|34|38|44|200 | D198: =RC[7]&IF(RC[8]="","","#"&RC[8]&IF(RC[9]="","","#"&RC[9]&IF(RC[10]="","","#"&RC[10]&IF(RC[11]="","","#"&RC[11])))) -> 13439#10014#10004#10010#10008 | E198: =RC[11]&IF(RC[12]="","","#"&RC[12]&IF(RC[13]="","","#"&RC[13]&IF(RC[14]="","","#"&RC[14]&IF(RC[15]="","","#"&RC[15])))) -> 1#50#100#150#200 | F198: 28 | G198: 34 | H198: 38 | I198: 44 | K198: =R[-1]C -> 13439 | L198: =R[-1]C -> 10014 | M198: =R[-1]C -> 10004 | N198: =R[-1]C -> 10010 | O198: =R[-1]C -> 10008 | P198: =R[-1]C -> 1 | Q198: =R[-1]C -> 50 | R198: =R[-1]C -> 100 | S198: =R[-1]C -> 150 | T198: =R[-1]C -> 200 | U198: 同上
A199: 193 | B199: 50 | C199: =RC[3]&IF(RC[4]="","|200","|"&RC[4]&IF(RC[5]="","|200","|"&RC[5]&IF(RC[6]="","|200","|"&RC[6]&IF(RC[7]="","|200","|"&RC[7]&"|200")))) -> 28|34|38|44|200 | D199: =RC[7]&IF(RC[8]="","","#"&RC[8]&IF(RC[9]="","","#"&RC[9]&IF(RC[10]="","","#"&RC[10]&IF(RC[11]="","","#"&RC[11])))) -> 13439#10014#10004#10010#10008 | E199: =RC[11]&IF(RC[12]="","","#"&RC[12]&IF(RC[13]="","","#"&RC[13]&IF(RC[14]="","","#"&RC[14]&IF(RC[15]="","","#"&RC[15])))) -> 1#50#100#150#200 | F199: 28 | G199: 34 | H199: 38 | I199: 44 | K199: =R[-1]C -> 13439 | L199: =R[-1]C -> 10014 | M199: =R[-1]C -> 10004 | N199: =R[-1]C -> 10010 | O199: =R[-1]C -> 10008 | P199: =R[-1]C -> 1 | Q199: =R[-1]C -> 50 | R199: =R[-1]C -> 100 | S199: =R[-1]C -> 150 | T199: =R[-1]C -> 200 | U199: 同上
A200: 194 | B200: 50 | C200: =RC[3]&IF(RC[4]="","|200","|"&RC[4]&IF(RC[5]="","|200","|"&RC[5]&IF(RC[6]="","|200","|"&RC[6]&IF(RC[7]="","|200","|"&RC[7]&"|200")))) -> 28|34|38|44|200 | D200: =RC[7]&IF(RC[8]="","","#"&RC[8]&IF(RC[9]="","","#"&RC[9]&IF(RC[10]="","","#"&RC[10]&IF(RC[11]="","","#"&RC[11])))) -> 13439#10014#10004#10010#10008 | E200: =RC[11]&IF(RC[12]="","","#"&RC[12]&IF(RC[13]="","","#"&RC[13]&IF(RC[14]="","","#"&RC[14]&IF(RC[15]="","","#"&RC[15])))) -> 1#50#100#150#200 | F200: 28 | G200: 34 | H200: 38 | I200: 44 | K200: =R[-1]C -> 13439 | L200: =R[-1]C -> 10014 | M200: =R[-1]C -> 10004 | N200: =R[-1]C -> 10010 | O200: =R[-1]C -> 10008 | P200: =R[-1]C -> 1 | Q200: =R[-1]C -> 50 | R200: =R[-1]C -> 100 | S200: =R[-1]C -> 150 | T200: =R[-1]C -> 200 | U200: 同上
A201: 195 | B201: 50 | C201: =RC[3]&IF(RC[4]="","|200","|"&RC[4]&IF(RC[5]="","|200","|"&RC[5]&IF(RC[6]="","|200","|"&RC[6]&IF(RC[7]="","|200","|"&RC[7]&"|200")))) -> 28|34|38|44|200 | D201: =RC[7]&IF(RC[8]="","","#"&RC[8]&IF(RC[9]="","","#"&RC[9]&IF(RC[10]="","","#"&RC[10]&IF(RC[11]="","","#"&RC[11])))) -> 13439#10014#10004#10010#10008 | E201: =RC[11]&IF(RC[12]="","","#"&RC[12]&IF(RC[13]="","","#"&RC[13]&IF(RC[14]="","","#"&RC[14]&IF(RC[15]="","","#"&RC[15])))) -> 1#50#100#150#200 | F201: 28 | G201: 34 | H201: 38 | I201: 44 | K201: =R[-1]C -> 13439 | L201: =R[-1]C -> 10014 | M201: =R[-1]C -> 10004 | N201: =R[-1]C -> 10010 | O201: =R[-1]C -> 10008 | P201: =R[-1]C -> 1 | Q201: =R[-1]C -> 50 | R201: =R[-1]C -> 100 | S201: =R[-1]C -> 150 | T201: =R[-1]C -> 200 | U201: 同上
A202: 196 | B202: 50 | C202: =RC[3]&IF(RC[4]="","|200","|"&RC[4]&IF(RC[5]="","|200","|"&RC[5]&IF(RC[6]="","|200","|"&RC[6]&IF(RC[7]="","|200","|"&RC[7]&"|200")))) -> 28|34|38|44|200 | D202: =RC[7]&IF(RC[8]="","","#"&RC[8]&IF(RC[9]="","","#"&RC[9]&IF(RC[10]="","","#"&RC[10]&IF(RC[11]="","","#"&RC[11])))) -> 13439#10014#10004#10010#10008 | E202: =RC[11]&IF(RC[12]="","","#"&RC[12]&IF(RC[13]="","","#"&RC[13]&IF(RC[14]="","","#"&RC[14]&IF(RC[15]="","","#"&RC[15])))) -> 1#50#100#150#200 | F202: 28 | G202: 34 | H202: 38 | I202: 44 | K202: =R[-1]C -> 13439 | L202: =R[-1]C -> 10014 | M202: =R[-1]C -> 10004 | N202: =R[-1]C -> 10010 | O202: =R[-1]C -> 10008 | P202: =R[-1]C -> 1 | Q202: =R[-1]C -> 50 | R202: =R[-1]C -> 100 | S202: =R[-1]C -> 150 | T202: =R[-1]C -> 200 | U202: 同上
A203: 197 | B203: 50 | C203: =RC[3]&IF(RC[4]="","|200","|"&RC[4]&IF(RC[5]="","|200","|"&RC[5]&IF(RC[6]="","|200","|"&RC[6]&IF(RC[7]="","|200","|"&RC[7]&"|200")))) -> 28|34|38|44|200 | D203: =RC[7]&IF(RC[8]="","","#"&RC[8]&IF(RC[9]="","","#"&RC[9]&IF(RC[10]="","","#"&RC[10]&IF(RC[11]="","","#"&RC[11])))) -> 13439#10014#10004#10010#10008 | E203: =RC[11]&IF(RC[12]="","","#"&RC[12]&IF(RC[13]="","","#"&RC[13]&IF(RC[14]="","","#"&RC[14]&IF(RC[15]="","","#"&RC[15])))) -> 1#50#100#150#200 | F203: 28 | G203: 34 | H203: 38 | I203: 44 | K203: =R[-1]C -> 13439 | L203: =R[-1]C -> 10014 | M203: =R[-1]C -> 10004 | N203: =R[-1]C -> 10010 | O203: =R[-1]C -> 10008 | P203: =R[-1]C -> 1 | Q203: =R[-1]C -> 50 | R203: =R[-1]C -> 100 | S203: =R[-1]C -> 150 | T203: =R[-1]C -> 200 | U203: 同上
A204: 198 | B204: 50 | C204: =RC[3]&IF(RC[4]="","|200","|"&RC[4]&IF(RC[5]="","|200","|"&RC[5]&IF(RC[6]="","|200","|"&RC[6]&IF(RC[7]="","|200","|"&RC[7]&"|200")))) -> 28|34|38|44|200 | D204: =RC[7]&IF(RC[8]="","","#"&RC[8]&IF(RC[9]="","","#"&RC[9]&IF(RC[10]="","","#"&RC[10]&IF(RC[11]="","","#"&RC[11])))) -> 13439#10014#10004#10010#10008 | E204: =RC[11]&IF(RC[12]="","","#"&RC[12]&IF(RC[13]="","","#"&RC[13]&IF(RC[14]="","","#"&RC[14]&IF(RC[15]="","","#"&RC[15])))) -> 1#50#100#150#200 | F204: 28 | G204: 34 | H204: 38 | I204: 44 | K204: =R[-1]C -> 13439 | L204: =R[-1]C -> 10014 | M204: =R[-1]C -> 10004 | N204: =R[-1]C -> 10010 | O204: =R[-1]C -> 10008 | P204: =R[-1]C -> 1 | Q204: =R[-1]C -> 50 | R204: =R[-1]C -> 100 | S204: =R[-1]C -> 150 | T204: =R[-1]C -> 200 | U204: 同上
A205: 199 | B205: 50 | C205: =RC[3]&IF(RC[4]="","|200","|"&RC[4]&IF(RC[5]="","|200","|"&RC[5]&IF(RC[6]="","|200","|"&RC[6]&IF(RC[7]="","|200","|"&RC[7]&"|200")))) -> 28|34|38|44|200 | D205: =RC[7]&IF(RC[8]="","","#"&RC[8]&IF(RC[9]="","","#"&RC[9]&IF(RC[10]="","","#"&RC[10]&IF(RC[11]="","","#"&RC[11])))) -> 13439#10014#10004#10010#10008 | E205: =RC[11]&IF(RC[12]="","","#"&RC[12]&IF(RC[13]="","","#"&RC[13]&IF(RC[14]="","","#"&RC[14]&IF(RC[15]="","","#"&RC[15])))) -> 1#50#100#150#200 | F205: 28 | G205: 34 | H205: 38 | I205: 44 | K205: =R[-1]C -> 13439 | L205: =R[-1]C -> 10014 | M205: =R[-1]C -> 10004 | N205: =R[-1]C -> 10010 | O205: =R[-1]C -> 10008 | P205: =R[-1]C -> 1 | Q205: =R[-1]C -> 50 | R205: =R[-1]C -> 100 | S205: =R[-1]C -> 150 | T205: =R[-1]C -> 200 | U205: 同上
A206: 200 | B206: 50 | C206: =RC[3]&IF(RC[4]="","|200","|"&RC[4]&IF(RC[5]="","|200","|"&RC[5]&IF(RC[6]="","|200","|"&RC[6]&IF(RC[7]="","|200","|"&RC[7]&"|200")))) -> 28|34|38|44|200 | D206: =RC[7]&IF(RC[8]="","","#"&RC[8]&IF(RC[9]="","","#"&RC[9]&IF(RC[10]="","","#"&RC[10]&IF(RC[11]="","","#"&RC[11])))) -> 13439#10014#10004#10010#10008 | E206: =RC[11]&IF(RC[12]="","","#"&RC[12]&IF(RC[13]="","","#"&RC[13]&IF(RC[14]="","","#"&RC[14]&IF(RC[15]="","","#"&RC[15])))) -> 1#50#100#150#200 | F206: 28 | G206: 34 | H206: 38 | I206: 44 | K206: =R[-1]C -> 13439 | L206: =R[-1]C -> 10014 | M206: =R[-1]C -> 10004 | N206: =R[-1]C -> 10010 | O206: =R[-1]C -> 10008 | P206: =R[-1]C -> 1 | Q206: =R[-1]C -> 50 | R206: =R[-1]C -> 100 | S206: =R[-1]C -> 150 | T206: =R[-1]C -> 200 | U206: 同上
A207: 201 | B207: 50 | C207: =RC[3]&IF(RC[4]="","|200","|"&RC[4]&IF(RC[5]="","|200","|"&RC[5]&IF(RC[6]="","|200","|"&RC[6]&IF(RC[7]="","|200","|"&RC[7]&"|200")))) -> 28|34|38|44|200 | D207: =RC[7]&IF(RC[8]="","","#"&RC[8]&IF(RC[9]="","","#"&RC[9]&IF(RC[10]="","","#"&RC[10]&IF(RC[11]="","","#"&RC[11])))) -> 13439#10014#10004#10010#10008 | E207: =RC[11]&IF(RC[12]="","","#"&RC[12]&IF(RC[13]="","","#"&RC[13]&IF(RC[14]="","","#"&RC[14]&IF(RC[15]="","","#"&RC[15])))) -> 1#50#100#150#200 | F207: 28 | G207: 34 | H207: 38 | I207: 44 | K207: =R[-1]C -> 13439 | L207: =R[-1]C -> 10014 | M207: =R[-1]C -> 10004 | N207: =R[-1]C -> 10010 | O207: =R[-1]C -> 10008 | P207: =R[-1]C -> 1 | Q207: =R[-1]C -> 50 | R207: =R[-1]C -> 100 | S207: =R[-1]C -> 150 | T207: =R[-1]C -> 200 | U207: 同上
A208: 202 | B208: 50 | C208: =RC[3]&IF(RC[4]="","|200","|"&RC[4]&IF(RC[5]="","|200","|"&RC[5]&IF(RC[6]="","|200","|"&RC[6]&IF(RC[7]="","|200","|"&RC[7]&"|200")))) -> 28|34|38|44|200 | D208: =RC[7]&IF(RC[8]="","","#"&RC[8]&IF(RC[9]="","","#"&RC[9]&IF(RC[10]="","","#"&RC[10]&IF(RC[11]="","","#"&RC[11])))) -> 13439#10014#10004#10010#10008 | E208: =RC[11]&IF(RC[12]="","","#"&RC[12]&IF(RC[13]="","","#"&RC[13]&IF(RC[14]="","","#"&RC[14]&IF(RC[15]="","","#"&RC[15])))) -> 1#50#100#150#200 | F208: 28 | G208: 34 | H208: 38 | I208: 44 | K208: =R[-1]C -> 13439 | L208: =R[-1]C -> 10014 | M208: =R[-1]C -> 10004 | N208: =R[-1]C -> 10010 | O208: =R[-1]C -> 10008 | P208: =R[-1]C -> 1 | Q208: =R[-1]C -> 50 | R208: =R[-1]C -> 100 | S208: =R[-1]C -> 150 | T208: =R[-1]C -> 200 | U208: 同上
A209: 203 | B209: 50 | C209: =RC[3]&IF(RC[4]="","|200","|"&RC[4]&IF(RC[5]="","|200","|"&RC[5]&IF(RC[6]="","|200","|"&RC[6]&IF(RC[7]="","|200","|"&RC[7]&"|200")))) -> 28|34|38|44|200 | D209: =RC[7]&IF(RC[8]="","","#"&RC[8]&IF(RC[9]="","","#"&RC[9]&IF(RC[10]="","","#"&RC[10]&IF(RC[11]="","","#"&RC[11])))) -> 13439#10014#10004#10010#10008 | E209: =RC[11]&IF(RC[12]="","","#"&RC[12]&IF(RC[13]="","","#"&RC[13]&IF(RC[14]="","","#"&RC[14]&IF(RC[15]="","","#"&RC[15])))) -> 1#50#100#150#200 | F209: 28 | G209: 34 | H209: 38 | I209: 44 | K209: =R[-1]C -> 13439 | L209: =R[-1]C -> 10014 | M209: =R[-1]C -> 10004 | N209: =R[-1]C -> 10010 | O209: =R[-1]C -> 10008 | P209: =R[-1]C -> 1 | Q209: =R[-1]C -> 50 | R209: =R[-1]C -> 100 | S209: =R[-1]C -> 150 | T209: =R[-1]C -> 200 | U209: 同上
A210: 204 | B210: 50 | C210: =RC[3]&IF(RC[4]="","|200","|"&RC[4]&IF(RC[5]="","|200","|"&RC[5]&IF(RC[6]="","|200","|"&RC[6]&IF(RC[7]="","|200","|"&RC[7]&"|200")))) -> 28|34|38|44|200 | D210: =RC[7]&IF(RC[8]="","","#"&RC[8]&IF(RC[9]="","","#"&RC[9]&IF(RC[10]="","","#"&RC[10]&IF(RC[11]="","","#"&RC[11])))) -> 13439#10014#10004#10010#10008 | E210: =RC[11]&IF(RC[12]="","","#"&RC[12]&IF(RC[13]="","","#"&RC[13]&IF(RC[14]="","","#"&RC[14]&IF(RC[15]="","","#"&RC[15])))) -> 1#50#100#150#200 | F210: 28 | G210: 34 | H210: 38 | I210: 44 | K210: =R[-1]C -> 13439 | L210: =R[-1]C -> 10014 | M210: =R[-1]C -> 10004 | N210: =R[-1]C -> 10010 | O210: =R[-1]C -> 10008 | P210: =R[-1]C -> 1 | Q210: =R[-1]C -> 50 | R210: =R[-1]C -> 100 | S210: =R[-1]C -> 150 | T210: =R[-1]C -> 200 | U210: 同上
A211: 205 | B211: 50 | C211: =RC[3]&IF(RC[4]="","|200","|"&RC[4]&IF(RC[5]="","|200","|"&RC[5]&IF(RC[6]="","|200","|"&RC[6]&IF(RC[7]="","|200","|"&RC[7]&"|200")))) -> 28|34|38|44|200 | D211: =RC[7]&IF(RC[8]="","","#"&RC[8]&IF(RC[9]="","","#"&RC[9]&IF(RC[10]="","","#"&RC[10]&IF(RC[11]="","","#"&RC[11])))) -> 13439#10014#10004#10010#10008 | E211: =RC[11]&IF(RC[12]="","","#"&RC[12]&IF(RC[13]="","","#"&RC[13]&IF(RC[14]="","","#"&RC[14]&IF(RC[15]="","","#"&RC[15])))) -> 1#50#100#150#200 | F211: 28 | G211: 34 | H211: 38 | I211: 44 | K211: =R[-1]C -> 13439 | L211: =R[-1]C -> 10014 | M211: =R[-1]C -> 10004 | N211: =R[-1]C -> 10010 | O211: =R[-1]C -> 10008 | P211: =R[-1]C -> 1 | Q211: =R[-1]C -> 50 | R211: =R[-1]C -> 100 | S211: =R[-1]C -> 150 | T211: =R[-1]C -> 200 | U211: 同上
A212: 206 | B212: 50 | C212: =RC[3]&IF(RC[4]="","|200","|"&RC[4]&IF(RC[5]="","|200","|"&RC[5]&IF(RC[6]="","|200","|"&RC[6]&IF(RC[7]="","|200","|"&RC[7]&"|200")))) -> 28|34|38|44|200 | D212: =RC[7]&IF(RC[8]="","","#"&RC[8]&IF(RC[9]="","","#"&RC[9]&IF(RC[10]="","","#"&RC[10]&IF(RC[11]="","","#"&RC[11])))) -> 13439#10014#10004#10010#10008 | E212: =RC[11]&IF(RC[12]="","","#"&RC[12]&IF(RC[13]="","","#"&RC[13]&IF(RC[14]="","","#"&RC[14]&IF(RC[15]="","","#"&RC[15])))) -> 1#50#100#150#200 | F212: 28 | G212: 34 | H212: 38 | I212: 44 | K212: =R[-1]C -> 13439 | L212: =R[-1]C -> 10014 | M212: =R[-1]C -> 10004 | N212: =R[-1]C -> 10010 | O212: =R[-1]C -> 10008 | P212: =R[-1]C -> 1 | Q212: =R[-1]C -> 50 | R212: =R[-1]C -> 100 | S212: =R[-1]C -> 150 | T212: =R[-1]C -> 200 | U212: 同上
A213: 207 | B213: 50 | C213: =RC[3]&IF(RC[4]="","|200","|"&RC[4]&IF(RC[5]="","|200","|"&RC[5]&IF(RC[6]="","|200","|"&RC[6]&IF(RC[7]="","|200","|"&RC[7]&"|200")))) -> 28|34|38|44|200 | D213: =RC[7]&IF(RC[8]="","","#"&RC[8]&IF(RC[9]="","","#"&RC[9]&IF(RC[10]="","","#"&RC[10]&IF(RC[11]="","","#"&RC[11])))) -> 13439#10014#10004#10010#10008 | E213: =RC[11]&IF(RC[12]="","","#"&RC[12]&IF(RC[13]="","","#"&RC[13]&IF(RC[14]="","","#"&RC[14]&IF(RC[15]="","","#"&RC[15])))) -> 1#50#100#150#200 | F213: 28 | G213: 34 | H213: 38 | I213: 44 | K213: =R[-1]C -> 13439 | L213: =R[-1]C -> 10014 | M213: =R[-1]C -> 10004 | N213: =R[-1]C -> 10010 | O213: =R[-1]C -> 10008 | P213: =R[-1]C -> 1 | Q213: =R[-1]C -> 50 | R213: =R[-1]C -> 100 | S213: =R[-1]C -> 150 | T213: =R[-1]C -> 200 | U213: 同上
A214: 208 | B214: 50 | C214: =RC[3]&IF(RC[4]="","|200","|"&RC[4]&IF(RC[5]="","|200","|"&RC[5]&IF(RC[6]="","|200","|"&RC[6]&IF(RC[7]="","|200","|"&RC[7]&"|200")))) -> 28|34|38|44|200 | D214: =RC[7]&IF(RC[8]="","","#"&RC[8]&IF(RC[9]="","","#"&RC[9]&IF(RC[10]="","","#"&RC[10]&IF(RC[11]="","","#"&RC[11])))) -> 13439#10014#10004#10010#10008 | E214: =RC[11]&IF(RC[12]="","","#"&RC[12]&IF(RC[13]="","","#"&RC[13]&IF(RC[14]="","","#"&RC[14]&IF(RC[15]="","","#"&RC[15])))) -> 1#50#100#150#200 | F214: 28 | G214: 34 | H214: 38 | I214: 44 | K214: =R[-1]C -> 13439 | L214: =R[-1]C -> 10014 | M214: =R[-1]C -> 10004 | N214: =R[-1]C -> 10010 | O214: =R[-1]C -> 10008 | P214: =R[-1]C -> 1 | Q214: =R[-1]C -> 50 | R214: =R[-1]C -> 100 | S214: =R[-1]C -> 150 | T214: =R[-1]C -> 200 | U214: 同上
A215: 209 | B215: 50 | C215: =RC[3]&IF(RC[4]="","|200","|"&RC[4]&IF(RC[5]="","|200","|"&RC[5]&IF(RC[6]="","|200","|"&RC[6]&IF(RC[7]="","|200","|"&RC[7]&"|200")))) -> 28|34|38|44|200 | D215: =RC[7]&IF(RC[8]="","","#"&RC[8]&IF(RC[9]="","","#"&RC[9]&IF(RC[10]="","","#"&RC[10]&IF(RC[11]="","","#"&RC[11])))) -> 13439#10014#10004#10010#10008 | E215: =RC[11]&IF(RC[12]="","","#"&RC[12]&IF(RC[13]="","","#"&RC[13]&IF(RC[14]="","","#"&RC[14]&IF(RC[15]="","","#"&RC[15])))) -> 1#50#100#150#200 | F215: 28 | G215: 34 | H215: 38 | I215: 44 | K215: =R[-1]C -> 13439 | L215: =R[-1]C -> 10014 | M215: =R[-1]C -> 10004 | N215: =R[-1]C -> 10010 | O215: =R[-1]C -> 10008 | P215: =R[-1]C -> 1 | Q215: =R[-1]C -> 50 | R215: =R[-1]C -> 100 | S215: =R[-1]C -> 150 | T215: =R[-1]C -> 200 | U215: 同上
A216: 210 | B216: 50 | C216: =RC[3]&IF(RC[4]="","|200","|"&RC[4]&IF(RC[5]="","|200","|"&RC[5]&IF(RC[6]="","|200","|"&RC[6]&IF(RC[7]="","|200","|"&RC[7]&"|200")))) -> 28|34|38|44|200 | D216: =RC[7]&IF(RC[8]="","","#"&RC[8]&IF(RC[9]="","","#"&RC[9]&IF(RC[10]="","","#"&RC[10]&IF(RC[11]="","","#"&RC[11])))) -> 13439#10014#10004#10010#10008 | E216: =RC[11]&IF(RC[12]="","","#"&RC[12]&IF(RC[13]="","","#"&RC[13]&IF(RC[14]="","","#"&RC[14]&IF(RC[15]="","","#"&RC[15])))) -> 1#50#100#150#200 | F216: 28 | G216: 34 | H216: 38 | I216: 44 | K216: =R[-1]C -> 13439 | L216: =R[-1]C -> 10014 | M216: =R[-1]C -> 10004 | N216: =R[-1]C -> 10010 | O216: =R[-1]C -> 10008 | P216: =R[-1]C -> 1 | Q216: =R[-1]C -> 50 | R216: =R[-1]C -> 100 | S216: =R[-1]C -> 150 | T216: =R[-1]C -> 200 | U216: 同上
A217: 211 | B217: 50 | C217: =RC[3]&IF(RC[4]="","|200","|"&RC[4]&IF(RC[5]="","|200","|"&RC[5]&IF(RC[6]="","|200","|"&RC[6]&IF(RC[7]="","|200","|"&RC[7]&"|200")))) -> 28|34|38|44|200 | D217: =RC[7]&IF(RC[8]="","","#"&RC[8]&IF(RC[9]="","","#"&RC[9]&IF(RC[10]="","","#"&RC[10]&IF(RC[11]="","","#"&RC[11])))) -> 13439#10014#10004#10010#10008 | E217: =RC[11]&IF(RC[12]="","","#"&RC[12]&IF(RC[13]="","","#"&RC[13]&IF(RC[14]="","","#"&RC[14]&IF(RC[15]="","","#"&RC[15])))) -> 1#50#100#150#200 | F217: 28 | G217: 34 | H217: 38 | I217: 44 | K217: =R[-1]C -> 13439 | L217: =R[-1]C -> 10014 | M217: =R[-1]C -> 10004 | N217: =R[-1]C -> 10010 | O217: =R[-1]C -> 10008 | P217: =R[-1]C -> 1 | Q217: =R[-1]C -> 50 | R217: =R[-1]C -> 100 | S217: =R[-1]C -> 150 | T217: =R[-1]C -> 200 | U217: 同上
A218: 212 | B218: 50 | C218: =RC[3]&IF(RC[4]="","|200","|"&RC[4]&IF(RC[5]="","|200","|"&RC[5]&IF(RC[6]="","|200","|"&RC[6]&IF(RC[7]="","|200","|"&RC[7]&"|200")))) -> 28|34|38|44|200 | D218: =RC[7]&IF(RC[8]="","","#"&RC[8]&IF(RC[9]="","","#"&RC[9]&IF(RC[10]="","","#"&RC[10]&IF(RC[11]="","","#"&RC[11])))) -> 13439#10014#10004#10010#10008 | E218: =RC[11]&IF(RC[12]="","","#"&RC[12]&IF(RC[13]="","","#"&RC[13]&IF(RC[14]="","","#"&RC[14]&IF(RC[15]="","","#"&RC[15])))) -> 1#50#100#150#200 | F218: 28 | G218: 34 | H218: 38 | I218: 44 | K218: =R[-1]C -> 13439 | L218: =R[-1]C -> 10014 | M218: =R[-1]C -> 10004 | N218: =R[-1]C -> 10010 | O218: =R[-1]C -> 10008 | P218: =R[-1]C -> 1 | Q218: =R[-1]C -> 50 | R218: =R[-1]C -> 100 | S218: =R[-1]C -> 150 | T218: =R[-1]C -> 200 | U218: 同上
A219: 213 | B219: 50 | C219: =RC[3]&IF(RC[4]="","|200","|"&RC[4]&IF(RC[5]="","|200","|"&RC[5]&IF(RC[6]="","|200","|"&RC[6]&IF(RC[7]="","|200","|"&RC[7]&"|200")))) -> 28|34|38|44|200 | D219: =RC[7]&IF(RC[8]="","","#"&RC[8]&IF(RC[9]="","","#"&RC[9]&IF(RC[10]="","","#"&RC[10]&IF(RC[11]="","","#"&RC[11])))) -> 13439#10014#10004#10010#10008 | E219: =RC[11]&IF(RC[12]="","","#"&RC[12]&IF(RC[13]="","","#"&RC[13]&IF(RC[14]="","","#"&RC[14]&IF(RC[15]="","","#"&RC[15])))) -> 1#50#100#150#200 | F219: 28 | G219: 34 | H219: 38 | I219: 44 | K219: =R[-1]C -> 13439 | L219: =R[-1]C -> 10014 | M219: =R[-1]C -> 10004 | N219: =R[-1]C -> 10010 | O219: =R[-1]C -> 10008 | P219: =R[-1]C -> 1 | Q219: =R[-1]C -> 50 | R219: =R[-1]C -> 100 | S219: =R[-1]C -> 150 | T219: =R[-1]C -> 200 | U219: 同上
A220: 214 | B220: 50 | C220: =RC[3]&IF(RC[4]="","|200","|"&RC[4]&IF(RC[5]="","|200","|"&RC[5]&IF(RC[6]="","|200","|"&RC[6]&IF(RC[7]="","|200","|"&RC[7]&"|200")))) -> 28|34|38|44|200 | D220: =RC[7]&IF(RC[8]="","","#"&RC[8]&IF(RC[9]="","","#"&RC[9]&IF(RC[10]="","","#"&RC[10]&IF(RC[11]="","","#"&RC[11])))) -> 13439#10014#10004#10010#10008 | E220: =RC[11]&IF(RC[12]="","","#"&RC[12]&IF(RC[13]="","","#"&RC[13]&IF(RC[14]="","","#"&RC[14]&IF(RC[15]="","","#"&RC[15])))) -> 1#50#100#150#200 | F220: 28 | G220: 34 | H220: 38 | I220: 44 | K220: =R[-1]C -> 13439 | L220: =R[-1]C -> 10014 | M220: =R[-1]C -> 10004 | N220: =R[-1]C -> 10010 | O220: =R[-1]C -> 10008 | P220: =R[-1]C -> 1 | Q220: =R[-1]C -> 50 | R220: =R[-1]C -> 100 | S220: =R[-1]C -> 150 | T220: =R[-1]C -> 200 | U220: 同上
A221: 215 | B221: 50 | C221: =RC[3]&IF(RC[4]="","|200","|"&RC[4]&IF(RC[5]="","|200","|"&RC[5]&IF(RC[6]="","|200","|"&RC[6]&IF(RC[7]="","|200","|"&RC[7]&"|200")))) -> 28|34|38|44|200 | D221: =RC[7]&IF(RC[8]="","","#"&RC[8]&IF(RC[9]="","","#"&RC[9]&IF(RC[10]="","","#"&RC[10]&IF(RC[11]="","","#"&RC[11])))) -> 13439#10014#10004#10010#10008 | E221: =RC[11]&IF(RC[12]="","","#"&RC[12]&IF(RC[13]="","","#"&RC[13]&IF(RC[14]="","","#"&RC[14]&IF(RC[15]="","","#"&RC[15])))) -> 1#50#100#150#200 | F221: 28 | G221: 34 | H221: 38 | I221: 44 | K221: =R[-1]C -> 13439 | L221: =R[-1]C -> 10014 | M221: =R[-1]C -> 10004 | N221: =R[-1]C -> 10010 | O221: =R[-1]C -> 10008 | P221: =R[-1]C -> 1 | Q221: =R[-1]C -> 50 | R221: =R[-1]C -> 100 | S221: =R[-1]C -> 150 | T221: =R[-1]C -> 200 | U221: 同上
A222: 216 | B222: 50 | C222: =RC[3]&IF(RC[4]="","|200","|"&RC[4]&IF(RC[5]="","|200","|"&RC[5]&IF(RC[6]="","|200","|"&RC[6]&IF(RC[7]="","|200","|"&RC[7]&"|200")))) -> 28|34|38|44|200 | D222: =RC[7]&IF(RC[8]="","","#"&RC[8]&IF(RC[9]="","","#"&RC[9]&IF(RC[10]="","","#"&RC[10]&IF(RC[11]="","","#"&RC[11])))) -> 13439#10014#10004#10010#10008 | E222: =RC[11]&IF(RC[12]="","","#"&RC[12]&IF(RC[13]="","","#"&RC[13]&IF(RC[14]="","","#"&RC[14]&IF(RC[15]="","","#"&RC[15])))) -> 1#50#100#150#200 | F222: 28 | G222: 34 | H222: 38 | I222: 44 | K222: =R[-1]C -> 13439 | L222: =R[-1]C -> 10014 | M222: =R[-1]C -> 10004 | N222: =R[-1]C -> 10010 | O222: =R[-1]C -> 10008 | P222: =R[-1]C -> 1 | Q222: =R[-1]C -> 50 | R222: =R[-1]C -> 100 | S222: =R[-1]C -> 150 | T222: =R[-1]C -> 200 | U222: 同上
A223: 217 | B223: 50 | C223: =RC[3]&IF(RC[4]="","|200","|"&RC[4]&IF(RC[5]="","|200","|"&RC[5]&IF(RC[6]="","|200","|"&RC[6]&IF(RC[7]="","|200","|"&RC[7]&"|200")))) -> 28|34|38|44|200 | D223: =RC[7]&IF(RC[8]="","","#"&RC[8]&IF(RC[9]="","","#"&RC[9]&IF(RC[10]="","","#"&RC[10]&IF(RC[11]="","","#"&RC[11])))) -> 13439#10014#10004#10010#10008 | E223: =RC[11]&IF(RC[12]="","","#"&RC[12]&IF(RC[13]="","","#"&RC[13]&IF(RC[14]="","","#"&RC[14]&IF(RC[15]="","","#"&RC[15])))) -> 1#50#100#150#200 | F223: 28 | G223: 34 | H223: 38 | I223: 44 | K223: =R[-1]C -> 13439 | L223: =R[-1]C -> 10014 | M223: =R[-1]C -> 10004 | N223: =R[-1]C -> 10010 | O223: =R[-1]C -> 10008 | P223: =R[-1]C -> 1 | Q223: =R[-1]C -> 50 | R223: =R[-1]C -> 100 | S223: =R[-1]C -> 150 | T223: =R[-1]C -> 200 | U223: 同上
A224: 218 | B224: 50 | C224: =RC[3]&IF(RC[4]="","|200","|"&RC[4]&IF(RC[5]="","|200","|"&RC[5]&IF(RC[6]="","|200","|"&RC[6]&IF(RC[7]="","|200","|"&RC[7]&"|200")))) -> 28|34|38|44|200 | D224: =RC[7]&IF(RC[8]="","","#"&RC[8]&IF(RC[9]="","","#"&RC[9]&IF(RC[10]="","","#"&RC[10]&IF(RC[11]="","","#"&RC[11])))) -> 13439#10014#10004#10010#10008 | E224: =RC[11]&IF(RC[12]="","","#"&RC[12]&IF(RC[13]="","","#"&RC[13]&IF(RC[14]="","","#"&RC[14]&IF(RC[15]="","","#"&RC[15])))) -> 1#50#100#150#200 | F224: 28 | G224: 34 | H224: 38 | I224: 44 | K224: =R[-1]C -> 13439 | L224: =R[-1]C -> 10014 | M224: =R[-1]C -> 10004 | N224: =R[-1]C -> 10010 | O224: =R[-1]C -> 10008 | P224: =R[-1]C -> 1 | Q224: =R[-1]C -> 50 | R224: =R[-1]C -> 100 | S224: =R[-1]C -> 150 | T224: =R[-1]C -> 200 | U224: 同上
A225: 219 | B225: 50 | C225: =RC[3]&IF(RC[4]="","|200","|"&RC[4]&IF(RC[5]="","|200","|"&RC[5]&IF(RC[6]="","|200","|"&RC[6]&IF(RC[7]="","|200","|"&RC[7]&"|200")))) -> 28|34|38|44|200 | D225: =RC[7]&IF(RC[8]="","","#"&RC[8]&IF(RC[9]="","","#"&RC[9]&IF(RC[10]="","","#"&RC[10]&IF(RC[11]="","","#"&RC[11])))) -> 13439#10014#10004#10010#10008 | E225: =RC[11]&IF(RC[12]="","","#"&RC[12]&IF(RC[13]="","","#"&RC[13]&IF(RC[14]="","","#"&RC[14]&IF(RC[15]="","","#"&RC[15])))) -> 1#50#100#150#200 | F225: 28 | G225: 34 | H225: 38 | I225: 44 | K225: =R[-1]C -> 13439 | L225: =R[-1]C -> 10014 | M225: =R[-1]C -> 10004 | N225: =R[-1]C -> 10010 | O225: =R[-1]C -> 10008 | P225: =R[-1]C -> 1 | Q225: =R[-1]C -> 50 | R225: =R[-1]C -> 100 | S225: =R[-1]C -> 150 | T225: =R[-1]C -> 200 | U225: 同上
A226: 220 | B226: 50 | C226: =RC[3]&IF(RC[4]="","|200","|"&RC[4]&IF(RC[5]="","|200","|"&RC[5]&IF(RC[6]="","|200","|"&RC[6]&IF(RC[7]="","|200","|"&RC[7]&"|200")))) -> 28|34|38|44|200 | D226: =RC[7]&IF(RC[8]="","","#"&RC[8]&IF(RC[9]="","","#"&RC[9]&IF(RC[10]="","","#"&RC[10]&IF(RC[11]="","","#"&RC[11])))) -> 13439#10014#10004#10010#10008 | E226: =RC[11]&IF(RC[12]="","","#"&RC[12]&IF(RC[13]="","","#"&RC[13]&IF(RC[14]="","","#"&RC[14]&IF(RC[15]="","","#"&RC[15])))) -> 1#50#100#150#200 | F226: 28 | G226: 34 | H226: 38 | I226: 44 | K226: =R[-1]C -> 13439 | L226: =R[-1]C -> 10014 | M226: =R[-1]C -> 10004 | N226: =R[-1]C -> 10010 | O226: =R[-1]C -> 10008 | P226: =R[-1]C -> 1 | Q226: =R[-1]C -> 50 | R226: =R[-1]C -> 100 | S226: =R[-1]C -> 150 | T226: =R[-1]C -> 200 | U226: 同上
A227: 221 | B227: 50 | C227: =RC[3]&IF(RC[4]="","|200","|"&RC[4]&IF(RC[5]="","|200","|"&RC[5]&IF(RC[6]="","|200","|"&RC[6]&IF(RC[7]="","|200","|"&RC[7]&"|200")))) -> 28|34|38|44|200 | D227: =RC[7]&IF(RC[8]="","","#"&RC[8]&IF(RC[9]="","","#"&RC[9]&IF(RC[10]="","","#"&RC[10]&IF(RC[11]="","","#"&RC[11])))) -> 13439#10014#10004#10010#10008 | E227: =RC[11]&IF(RC[12]="","","#"&RC[12]&IF(RC[13]="","","#"&RC[13]&IF(RC[14]="","","#"&RC[14]&IF(RC[15]="","","#"&RC[15])))) -> 1#50#100#150#200 | F227: 28 | G227: 34 | H227: 38 | I227: 44 | K227: =R[-1]C -> 13439 | L227: =R[-1]C -> 10014 | M227: =R[-1]C -> 10004 | N227: =R[-1]C -> 10010 | O227: =R[-1]C -> 10008 | P227: =R[-1]C -> 1 | Q227: =R[-1]C -> 50 | R227: =R[-1]C -> 100 | S227: =R[-1]C -> 150 | T227: =R[-1]C -> 200 | U227: 同上
A228: 222 | B228: 50 | C228: =RC[3]&IF(RC[4]="","|200","|"&RC[4]&IF(RC[5]="","|200","|"&RC[5]&IF(RC[6]="","|200","|"&RC[6]&IF(RC[7]="","|200","|"&RC[7]&"|200")))) -> 28|34|38|44|200 | D228: =RC[7]&IF(RC[8]="","","#"&RC[8]&IF(RC[9]="","","#"&RC[9]&IF(RC[10]="","","#"&RC[10]&IF(RC[11]="","","#"&RC[11])))) -> 13439#10014#10004#10010#10008 | E228: =RC[11]&IF(RC[12]="","","#"&RC[12]&IF(RC[13]="","","#"&RC[13]&IF(RC[14]="","","#"&RC[14]&IF(RC[15]="","","#"&RC[15])))) -> 1#50#100#150#200 | F228: 28 | G228: 34 | H228: 38 | I228: 44 | K228: =R[-1]C -> 13439 | L228: =R[-1]C -> 10014 | M228: =R[-1]C -> 10004 | N228: =R[-1]C -> 10010 | O228: =R[-1]C -> 10008 | P228: =R[-1]C -> 1 | Q228: =R[-1]C -> 50 | R228: =R[-1]C -> 100 | S228: =R[-1]C -> 150 | T228: =R[-1]C -> 200 | U228: 同上
A229: 223 | B229: 50 | C229: =RC[3]&IF(RC[4]="","|200","|"&RC[4]&IF(RC[5]="","|200","|"&RC[5]&IF(RC[6]="","|200","|"&RC[6]&IF(RC[7]="","|200","|"&RC[7]&"|200")))) -> 28|34|38|44|200 | D229: =RC[7]&IF(RC[8]="","","#"&RC[8]&IF(RC[9]="","","#"&RC[9]&IF(RC[10]="","","#"&RC[10]&IF(RC[11]="","","#"&RC[11])))) -> 13439#10014#10004#10010#10008 | E229: =RC[11]&IF(RC[12]="","","#"&RC[12]&IF(RC[13]="","","#"&RC[13]&IF(RC[14]="","","#"&RC[14]&IF(RC[15]="","","#"&RC[15])))) -> 1#50#100#150#200 | F229: 28 | G229: 34 | H229: 38 | I229: 44 | K229: =R[-1]C -> 13439 | L229: =R[-1]C -> 10014 | M229: =R[-1]C -> 10004 | N229: =R[-1]C -> 10010 | O229: =R[-1]C -> 10008 | P229: =R[-1]C -> 1 | Q229: =R[-1]C -> 50 | R229: =R[-1]C -> 100 | S229: =R[-1]C -> 150 | T229: =R[-1]C -> 200 | U229: 同上
A230: 224 | B230: 50 | C230: =RC[3]&IF(RC[4]="","|200","|"&RC[4]&IF(RC[5]="","|200","|"&RC[5]&IF(RC[6]="","|200","|"&RC[6]&IF(RC[7]="","|200","|"&RC[7]&"|200")))) -> 28|34|38|44|200 | D230: =RC[7]&IF(RC[8]="","","#"&RC[8]&IF(RC[9]="","","#"&RC[9]&IF(RC[10]="","","#"&RC[10]&IF(RC[11]="","","#"&RC[11])))) -> 13439#10014#10004#10010#10008 | E230: =RC[11]&IF(RC[12]="","","#"&RC[12]&IF(RC[13]="","","#"&RC[13]&IF(RC[14]="","","#"&RC[14]&IF(RC[15]="","","#"&RC[15])))) -> 1#50#100#150#200 | F230: 28 | G230: 34 | H230: 38 | I230: 44 | K230: =R[-1]C -> 13439 | L230: =R[-1]C -> 10014 | M230: =R[-1]C -> 10004 | N230: =R[-1]C -> 10010 | O230: =R[-1]C -> 10008 | P230: =R[-1]C -> 1 | Q230: =R[-1]C -> 50 | R230: =R[-1]C -> 100 | S230: =R[-1]C -> 150 | T230: =R[-1]C -> 200 | U230: 同上
A231: 225 | B231: 50 | C231: =RC[3]&IF(RC[4]="","|200","|"&RC[4]&IF(RC[5]="","|200","|"&RC[5]&IF(RC[6]="","|200","|"&RC[6]&IF(RC[7]="","|200","|"&RC[7]&"|200")))) -> 28|34|38|44|200 | D231: =RC[7]&IF(RC[8]="","","#"&RC[8]&IF(RC[9]="","","#"&RC[9]&IF(RC[10]="","","#"&RC[10]&IF(RC[11]="","","#"&RC[11])))) -> 13439#10014#10004#10010#10008 | E231: =RC[11]&IF(RC[12]="","","#"&RC[12]&IF(RC[13]="","","#"&RC[13]&IF(RC[14]="","","#"&RC[14]&IF(RC[15]="","","#"&RC[15])))) -> 1#50#100#150#200 | F231: 28 | G231: 34 | H231: 38 | I231: 44 | K231: =R[-1]C -> 13439 | L231: =R[-1]C -> 10014 | M231: =R[-1]C -> 10004 | N231: =R[-1]C -> 10010 | O231: =R[-1]C -> 10008 | P231: =R[-1]C -> 1 | Q231: =R[-1]C -> 50 | R231: =R[-1]C -> 100 | S231: =R[-1]C -> 150 | T231: =R[-1]C -> 200 | U231: 同上
A232: 226 | B232: 50 | C232: =RC[3]&IF(RC[4]="","|200","|"&RC[4]&IF(RC[5]="","|200","|"&RC[5]&IF(RC[6]="","|200","|"&RC[6]&IF(RC[7]="","|200","|"&RC[7]&"|200")))) -> 28|34|38|44|200 | D232: =RC[7]&IF(RC[8]="","","#"&RC[8]&IF(RC[9]="","","#"&RC[9]&IF(RC[10]="","","#"&RC[10]&IF(RC[11]="","","#"&RC[11])))) -> 13439#10014#10004#10010#10008 | E232: =RC[11]&IF(RC[12]="","","#"&RC[12]&IF(RC[13]="","","#"&RC[13]&IF(RC[14]="","","#"&RC[14]&IF(RC[15]="","","#"&RC[15])))) -> 1#50#100#150#200 | F232: 28 | G232: 34 | H232: 38 | I232: 44 | K232: =R[-1]C -> 13439 | L232: =R[-1]C -> 10014 | M232: =R[-1]C -> 10004 | N232: =R[-1]C -> 10010 | O232: =R[-1]C -> 10008 | P232: =R[-1]C -> 1 | Q232: =R[-1]C -> 50 | R232: =R[-1]C -> 100 | S232: =R[-1]C -> 150 | T232: =R[-1]C -> 200 | U232: 同上
A233: 227 | B233: 50 | C233: =RC[3]&IF(RC[4]="","|200","|"&RC[4]&IF(RC[5]="","|200","|"&RC[5]&IF(RC[6]="","|200","|"&RC[6]&IF(RC[7]="","|200","|"&RC[7]&"|200")))) -> 28|34|38|44|200 | D233: =RC[7]&IF(RC[8]="","","#"&RC[8]&IF(RC[9]="","","#"&RC[9]&IF(RC[10]="","","#"&RC[10]&IF(RC[11]="","","#"&RC[11])))) -> 13439#10014#10004#10010#10008 | E233: =RC[11]&IF(RC[12]="","","#"&RC[12]&IF(RC[13]="","","#"&RC[13]&IF(RC[14]="","","#"&RC[14]&IF(RC[15]="","","#"&RC[15])))) -> 1#50#100#150#200 | F233: 28 | G233: 34 | H233: 38 | I233: 44 | K233: =R[-1]C -> 13439 | L233: =R[-1]C -> 10014 | M233: =R[-1]C -> 10004 | N233: =R[-1]C -> 10010 | O233: =R[-1]C -> 10008 | P233: =R[-1]C -> 1 | Q233: =R[-1]C -> 50 | R233: =R[-1]C -> 100 | S233: =R[-1]C -> 150 | T233: =R[-1]C -> 200 | U233: 同上
A234: 228 | B234: 50 | C234: =RC[3]&IF(RC[4]="","|200","|"&RC[4]&IF(RC[5]="","|200","|"&RC[5]&IF(RC[6]="","|200","|"&RC[6]&IF(RC[7]="","|200","|"&RC[7]&"|200")))) -> 28|34|38|44|200 | D234: =RC[7]&IF(RC[8]="","","#"&RC[8]&IF(RC[9]="","","#"&RC[9]&IF(RC[10]="","","#"&RC[10]&IF(RC[11]="","","#"&RC[11])))) -> 13439#10014#10004#10010#10008 | E234: =RC[11]&IF(RC[12]="","","#"&RC[12]&IF(RC[13]="","","#"&RC[13]&IF(RC[14]="","","#"&RC[14]&IF(RC[15]="","","#"&RC[15])))) -> 1#50#100#150#200 | F234: 28 | G234: 34 | H234: 38 | I234: 44 | K234: =R[-1]C -> 13439 | L234: =R[-1]C -> 10014 | M234: =R[-1]C -> 10004 | N234: =R[-1]C -> 10010 | O234: =R[-1]C -> 10008 | P234: =R[-1]C -> 1 | Q234: =R[-1]C -> 50 | R234: =R[-1]C -> 100 | S234: =R[-1]C -> 150 | T234: =R[-1]C -> 200 | U234: 同上
A235: 229 | B235: 50 | C235: =RC[3]&IF(RC[4]="","|200","|"&RC[4]&IF(RC[5]="","|200","|"&RC[5]&IF(RC[6]="","|200","|"&RC[6]&IF(RC[7]="","|200","|"&RC[7]&"|200")))) -> 28|34|38|44|200 | D235: =RC[7]&IF(RC[8]="","","#"&RC[8]&IF(RC[9]="","","#"&RC[9]&IF(RC[10]="","","#"&RC[10]&IF(RC[11]="","","#"&RC[11])))) -> 13439#10014#10004#10010#10008 | E235: =RC[11]&IF(RC[12]="","","#"&RC[12]&IF(RC[13]="","","#"&RC[13]&IF(RC[14]="","","#"&RC[14]&IF(RC[15]="","","#"&RC[15])))) -> 1#50#100#150#200 | F235: 28 | G235: 34 | H235: 38 | I235: 44 | K235: =R[-1]C -> 13439 | L235: =R[-1]C -> 10014 | M235: =R[-1]C -> 10004 | N235: =R[-1]C -> 10010 | O235: =R[-1]C -> 10008 | P235: =R[-1]C -> 1 | Q235: =R[-1]C -> 50 | R235: =R[-1]C -> 100 | S235: =R[-1]C -> 150 | T235: =R[-1]C -> 200 | U235: 同上
A236: 230 | B236: 50 | C236: =RC[3]&IF(RC[4]="","|200","|"&RC[4]&IF(RC[5]="","|200","|"&RC[5]&IF(RC[6]="","|200","|"&RC[6]&IF(RC[7]="","|200","|"&RC[7]&"|200")))) -> 28|34|38|44|200 | D236: =RC[7]&IF(RC[8]="","","#"&RC[8]&IF(RC[9]="","","#"&RC[9]&IF(RC[10]="","","#"&RC[10]&IF(RC[11]="","","#"&RC[11])))) -> 13439#10014#10004#10010#10008 | E236: =RC[11]&IF(RC[12]="","","#"&RC[12]&IF(RC[13]="","","#"&RC[13]&IF(RC[14]="","","#"&RC[14]&IF(RC[15]="","","#"&RC[15])))) -> 1#50#100#150#200 | F236: 28 | G236: 34 | H236: 38 | I236: 44 | K236: =R[-1]C -> 13439 | L236: =R[-1]C -> 10014 | M236: =R[-1]C -> 10004 | N236: =R[-1]C -> 10010 | O236: =R[-1]C -> 10008 | P236: =R[-1]C -> 1 | Q236: =R[-1]C -> 50 | R236: =R[-1]C -> 100 | S236: =R[-1]C -> 150 | T236: =R[-1]C -> 200 | U236: 同上
A237: 231 | B237: 50 | C237: =RC[3]&IF(RC[4]="","|200","|"&RC[4]&IF(RC[5]="","|200","|"&RC[5]&IF(RC[6]="","|200","|"&RC[6]&IF(RC[7]="","|200","|"&RC[7]&"|200")))) -> 28|34|38|44|200 | D237: =RC[7]&IF(RC[8]="","","#"&RC[8]&IF(RC[9]="","","#"&RC[9]&IF(RC[10]="","","#"&RC[10]&IF(RC[11]="","","#"&RC[11])))) -> 13439#10014#10004#10010#10008 | E237: =RC[11]&IF(RC[12]="","","#"&RC[12]&IF(RC[13]="","","#"&RC[13]&IF(RC[14]="","","#"&RC[14]&IF(RC[15]="","","#"&RC[15])))) -> 1#50#100#150#200 | F237: 28 | G237: 34 | H237: 38 | I237: 44 | K237: =R[-1]C -> 13439 | L237: =R[-1]C -> 10014 | M237: =R[-1]C -> 10004 | N237: =R[-1]C -> 10010 | O237: =R[-1]C -> 10008 | P237: =R[-1]C -> 1 | Q237: =R[-1]C -> 50 | R237: =R[-1]C -> 100 | S237: =R[-1]C -> 150 | T237: =R[-1]C -> 200 | U237: 同上
A238: 232 | B238: 50 | C238: =RC[3]&IF(RC[4]="","|200","|"&RC[4]&IF(RC[5]="","|200","|"&RC[5]&IF(RC[6]="","|200","|"&RC[6]&IF(RC[7]="","|200","|"&RC[7]&"|200")))) -> 28|34|38|44|200 | D238: =RC[7]&IF(RC[8]="","","#"&RC[8]&IF(RC[9]="","","#"&RC[9]&IF(RC[10]="","","#"&RC[10]&IF(RC[11]="","","#"&RC[11])))) -> 13439#10014#10004#10010#10008 | E238: =RC[11]&IF(RC[12]="","","#"&RC[12]&IF(RC[13]="","","#"&RC[13]&IF(RC[14]="","","#"&RC[14]&IF(RC[15]="","","#"&RC[15])))) -> 1#50#100#150#200 | F238: 28 | G238: 34 | H238: 38 | I238: 44 | K238: =R[-1]C -> 13439 | L238: =R[-1]C -> 10014 | M238: =R[-1]C -> 10004 | N238: =R[-1]C -> 10010 | O238: =R[-1]C -> 10008 | P238: =R[-1]C -> 1 | Q238: =R[-1]C -> 50 | R238: =R[-1]C -> 100 | S238: =R[-1]C -> 150 | T238: =R[-1]C -> 200 | U238: 同上
A239: 233 | B239: 50 | C239: =RC[3]&IF(RC[4]="","|200","|"&RC[4]&IF(RC[5]="","|200","|"&RC[5]&IF(RC[6]="","|200","|"&RC[6]&IF(RC[7]="","|200","|"&RC[7]&"|200")))) -> 28|34|38|44|200 | D239: =RC[7]&IF(RC[8]="","","#"&RC[8]&IF(RC[9]="","","#"&RC[9]&IF(RC[10]="","","#"&RC[10]&IF(RC[11]="","","#"&RC[11])))) -> 13439#10014#10004#10010#10008 | E239: =RC[11]&IF(RC[12]="","","#"&RC[12]&IF(RC[13]="","","#"&RC[13]&IF(RC[14]="","","#"&RC[14]&IF(RC[15]="","","#"&RC[15])))) -> 1#50#100#150#200 | F239: 28 | G239: 34 | H239: 38 | I239: 44 | K239: =R[-1]C -> 13439 | L239: =R[-1]C -> 10014 | M239: =R[-1]C -> 10004 | N239: =R[-1]C -> 10010 | O239: =R[-1]C -> 10008 | P239: =R[-1]C -> 1 | Q239: =R[-1]C -> 50 | R239: =R[-1]C -> 100 | S239: =R[-1]C -> 150 | T239: =R[-1]C -> 200 | U239: 同上
A240: 234 | B240: 50 | C240: =RC[3]&IF(RC[4]="","|200","|"&RC[4]&IF(RC[5]="","|200","|"&RC[5]&IF(RC[6]="","|200","|"&RC[6]&IF(RC[7]="","|200","|"&RC[7]&"|200")))) -> 28|34|38|44|200 | D240: =RC[7]&IF(RC[8]="","","#"&RC[8]&IF(RC[9]="","","#"&RC[9]&IF(RC[10]="","","#"&RC[10]&IF(RC[11]="","","#"&RC[11])))) -> 13439#10014#10004#10010#10008 | E240: =RC[11]&IF(RC[12]="","","#"&RC[12]&IF(RC[13]="","","#"&RC[13]&IF(RC[14]="","","#"&RC[14]&IF(RC[15]="","","#"&RC[15])))) -> 1#50#100#150#200 | F240: 28 | G240: 34 | H240: 38 | I240: 44 | K240: =R[-1]C -> 13439 | L240: =R[-1]C -> 10014 | M240: =R[-1]C -> 10004 | N240: =R[-1]C -> 10010 | O240: =R[-1]C -> 10008 | P240: =R[-1]C -> 1 | Q240: =R[-1]C -> 50 | R240: =R[-1]C -> 100 | S240: =R[-1]C -> 150 | T240: =R[-1]C -> 200 | U240: 同上
A241: 235 | B241: 50 | C241: =RC[3]&IF(RC[4]="","|200","|"&RC[4]&IF(RC[5]="","|200","|"&RC[5]&IF(RC[6]="","|200","|"&RC[6]&IF(RC[7]="","|200","|"&RC[7]&"|200")))) -> 28|34|38|44|200 | D241: =RC[7]&IF(RC[8]="","","#"&RC[8]&IF(RC[9]="","","#"&RC[9]&IF(RC[10]="","","#"&RC[10]&IF(RC[11]="","","#"&RC[11])))) -> 13439#10014#10004#10010#10008 | E241: =RC[11]&IF(RC[12]="","","#"&RC[12]&IF(RC[13]="","","#"&RC[13]&IF(RC[14]="","","#"&RC[14]&IF(RC[15]="","","#"&RC[15])))) -> 1#50#100#150#200 | F241: 28 | G241: 34 | H241: 38 | I241: 44 | K241: =R[-1]C -> 13439 | L241: =R[-1]C -> 10014 | M241: =R[-1]C -> 10004 | N241: =R[-1]C -> 10010 | O241: =R[-1]C -> 10008 | P241: =R[-1]C -> 1 | Q241: =R[-1]C -> 50 | R241: =R[-1]C -> 100 | S241: =R[-1]C -> 150 | T241: =R[-1]C -> 200 | U241: 同上
A242: 236 | B242: 50 | C242: =RC[3]&IF(RC[4]="","|200","|"&RC[4]&IF(RC[5]="","|200","|"&RC[5]&IF(RC[6]="","|200","|"&RC[6]&IF(RC[7]="","|200","|"&RC[7]&"|200")))) -> 28|34|38|44|200 | D242: =RC[7]&IF(RC[8]="","","#"&RC[8]&IF(RC[9]="","","#"&RC[9]&IF(RC[10]="","","#"&RC[10]&IF(RC[11]="","","#"&RC[11])))) -> 13439#10014#10004#10010#10008 | E242: =RC[11]&IF(RC[12]="","","#"&RC[12]&IF(RC[13]="","","#"&RC[13]&IF(RC[14]="","","#"&RC[14]&IF(RC[15]="","","#"&RC[15])))) -> 1#50#100#150#200 | F242: 28 | G242: 34 | H242: 38 | I242: 44 | K242: =R[-1]C -> 13439 | L242: =R[-1]C -> 10014 | M242: =R[-1]C -> 10004 | N242: =R[-1]C -> 10010 | O242: =R[-1]C -> 10008 | P242: =R[-1]C -> 1 | Q242: =R[-1]C -> 50 | R242: =R[-1]C -> 100 | S242: =R[-1]C -> 150 | T242: =R[-1]C -> 200 | U242: 同上
A243: 237 | B243: 50 | C243: =RC[3]&IF(RC[4]="","|200","|"&RC[4]&IF(RC[5]="","|200","|"&RC[5]&IF(RC[6]="","|200","|"&RC[6]&IF(RC[7]="","|200","|"&RC[7]&"|200")))) -> 28|34|38|44|200 | D243: =RC[7]&IF(RC[8]="","","#"&RC[8]&IF(RC[9]="","","#"&RC[9]&IF(RC[10]="","","#"&RC[10]&IF(RC[11]="","","#"&RC[11])))) -> 13439#10014#10004#10010#10008 | E243: =RC[11]&IF(RC[12]="","","#"&RC[12]&IF(RC[13]="","","#"&RC[13]&IF(RC[14]="","","#"&RC[14]&IF(RC[15]="","","#"&RC[15])))) -> 1#50#100#150#200 | F243: 28 | G243: 34 | H243: 38 | I243: 44 | K243: =R[-1]C -> 13439 | L243: =R[-1]C -> 10014 | M243: =R[-1]C -> 10004 | N243: =R[-1]C -> 10010 | O243: =R[-1]C -> 10008 | P243: =R[-1]C -> 1 | Q243: =R[-1]C -> 50 | R243: =R[-1]C -> 100 | S243: =R[-1]C -> 150 | T243: =R[-1]C -> 200 | U243: 同上
A244: 238 | B244: 50 | C244: =RC[3]&IF(RC[4]="","|200","|"&RC[4]&IF(RC[5]="","|200","|"&RC[5]&IF(RC[6]="","|200","|"&RC[6]&IF(RC[7]="","|200","|"&RC[7]&"|200")))) -> 28|34|38|44|200 | D244: =RC[7]&IF(RC[8]="","","#"&RC[8]&IF(RC[9]="","","#"&RC[9]&IF(RC[10]="","","#"&RC[10]&IF(RC[11]="","","#"&RC[11])))) -> 13439#10014#10004#10010#10008 | E244: =RC[11]&IF(RC[12]="","","#"&RC[12]&IF(RC[13]="","","#"&RC[13]&IF(RC[14]="","","#"&RC[14]&IF(RC[15]="","","#"&RC[15])))) -> 1#50#100#150#200 | F244: 28 | G244: 34 | H244: 38 | I244: 44 | K244: =R[-1]C -> 13439 | L244: =R[-1]C -> 10014 | M244: =R[-1]C -> 10004 | N244: =R[-1]C -> 10010 | O244: =R[-1]C -> 10008 | P244: =R[-1]C -> 1 | Q244: =R[-1]C -> 50 | R244: =R[-1]C -> 100 | S244: =R[-1]C -> 150 | T244: =R[-1]C -> 200 | U244: 同上
A245: 239 | B245: 50 | C245: =RC[3]&IF(RC[4]="","|200","|"&RC[4]&IF(RC[5]="","|200","|"&RC[5]&IF(RC[6]="","|200","|"&RC[6]&IF(RC[7]="","|200","|"&RC[7]&"|200")))) -> 28|34|38|44|200 | D245: =RC[7]&IF(RC[8]="","","#"&RC[8]&IF(RC[9]="","","#"&RC[9]&IF(RC[10]="","","#"&RC[10]&IF(RC[11]="","","#"&RC[11])))) -> 13439#10014#10004#10010#10008 | E245: =RC[11]&IF(RC[12]="","","#"&RC[12]&IF(RC[13]="","","#"&RC[13]&IF(RC[14]="","","#"&RC[14]&IF(RC[15]="","","#"&RC[15])))) -> 1#50#100#150#200 | F245: 28 | G245: 34 | H245: 38 | I245: 44 | K245: =R[-1]C -> 13439 | L245: =R[-1]C -> 10014 | M245: =R[-1]C -> 10004 | N245: =R[-1]C -> 10010 | O245: =R[-1]C -> 10008 | P245: =R[-1]C -> 1 | Q245: =R[-1]C -> 50 | R245: =R[-1]C -> 100 | S245: =R[-1]C -> 150 | T245: =R[-1]C -> 200 | U245: 同上
A246: 240 | B246: 50 | C246: =RC[3]&IF(RC[4]="","|200","|"&RC[4]&IF(RC[5]="","|200","|"&RC[5]&IF(RC[6]="","|200","|"&RC[6]&IF(RC[7]="","|200","|"&RC[7]&"|200")))) -> 28|34|38|44|200 | D246: =RC[7]&IF(RC[8]="","","#"&RC[8]&IF(RC[9]="","","#"&RC[9]&IF(RC[10]="","","#"&RC[10]&IF(RC[11]="","","#"&RC[11])))) -> 13439#10014#10004#10010#10008 | E246: =RC[11]&IF(RC[12]="","","#"&RC[12]&IF(RC[13]="","","#"&RC[13]&IF(RC[14]="","","#"&RC[14]&IF(RC[15]="","","#"&RC[15])))) -> 1#50#100#150#200 | F246: 28 | G246: 34 | H246: 38 | I246: 44 | K246: =R[-1]C -> 13439 | L246: =R[-1]C -> 10014 | M246: =R[-1]C -> 10004 | N246: =R[-1]C -> 10010 | O246: =R[-1]C -> 10008 | P246: =R[-1]C -> 1 | Q246: =R[-1]C -> 50 | R246: =R[-1]C -> 100 | S246: =R[-1]C -> 150 | T246: =R[-1]C -> 200 | U246: 同上
A247: 241 | B247: 50 | C247: =RC[3]&IF(RC[4]="","|200","|"&RC[4]&IF(RC[5]="","|200","|"&RC[5]&IF(RC[6]="","|200","|"&RC[6]&IF(RC[7]="","|200","|"&RC[7]&"|200")))) -> 28|34|38|44|200 | D247: =RC[7]&IF(RC[8]="","","#"&RC[8]&IF(RC[9]="","","#"&RC[9]&IF(RC[10]="","","#"&RC[10]&IF(RC[11]="","","#"&RC[11])))) -> 13439#10014#10004#10010#10008 | E247: =RC[11]&IF(RC[12]="","","#"&RC[12]&IF(RC[13]="","","#"&RC[13]&IF(RC[14]="","","#"&RC[14]&IF(RC[15]="","","#"&RC[15])))) -> 1#50#100#150#200 | F247: 28 | G247: 34 | H247: 38 | I247: 44 | K247: =R[-1]C -> 13439 | L247: =R[-1]C -> 10014 | M247: =R[-1]C -> 10004 | N247: =R[-1]C -> 10010 | O247: =R[-1]C -> 10008 | P247: =R[-1]C -> 1 | Q247: =R[-1]C -> 50 | R247: =R[-1]C -> 100 | S247: =R[-1]C -> 150 | T247: =R[-1]C -> 200 | U247: 同上
A248: 242 | B248: 50 | C248: =RC[3]&IF(RC[4]="","|200","|"&RC[4]&IF(RC[5]="","|200","|"&RC[5]&IF(RC[6]="","|200","|"&RC[6]&IF(RC[7]="","|200","|"&RC[7]&"|200")))) -> 28|34|38|44|200 | D248: =RC[7]&IF(RC[8]="","","#"&RC[8]&IF(RC[9]="","","#"&RC[9]&IF(RC[10]="","","#"&RC[10]&IF(RC[11]="","","#"&RC[11])))) -> 13439#10014#10004#10010#10008 | E248: =RC[11]&IF(RC[12]="","","#"&RC[12]&IF(RC[13]="","","#"&RC[13]&IF(RC[14]="","","#"&RC[14]&IF(RC[15]="","","#"&RC[15])))) -> 1#50#100#150#200 | F248: 28 | G248: 34 | H248: 38 | I248: 44 | K248: =R[-1]C -> 13439 | L248: =R[-1]C -> 10014 | M248: =R[-1]C -> 10004 | N248: =R[-1]C -> 10010 | O248: =R[-1]C -> 10008 | P248: =R[-1]C -> 1 | Q248: =R[-1]C -> 50 | R248: =R[-1]C -> 100 | S248: =R[-1]C -> 150 | T248: =R[-1]C -> 200 | U248: 同上
A249: 243 | B249: 50 | C249: =RC[3]&IF(RC[4]="","|200","|"&RC[4]&IF(RC[5]="","|200","|"&RC[5]&IF(RC[6]="","|200","|"&RC[6]&IF(RC[7]="","|200","|"&RC[7]&"|200")))) -> 28|34|38|44|200 | D249: =RC[7]&IF(RC[8]="","","#"&RC[8]&IF(RC[9]="","","#"&RC[9]&IF(RC[10]="","","#"&RC[10]&IF(RC[11]="","","#"&RC[11])))) -> 13439#10014#10004#10010#10008 | E249: =RC[11]&IF(RC[12]="","","#"&RC[12]&IF(RC[13]="","","#"&RC[13]&IF(RC[14]="","","#"&RC[14]&IF(RC[15]="","","#"&RC[15])))) -> 1#50#100#150#200 | F249: 28 | G249: 34 | H249: 38 | I249: 44 | K249: =R[-1]C -> 13439 | L249: =R[-1]C -> 10014 | M249: =R[-1]C -> 10004 | N249: =R[-1]C -> 10010 | O249: =R[-1]C -> 10008 | P249: =R[-1]C -> 1 | Q249: =R[-1]C -> 50 | R249: =R[-1]C -> 100 | S249: =R[-1]C -> 150 | T249: =R[-1]C -> 200 | U249: 同上
A250: 244 | B250: 50 | C250: =RC[3]&IF(RC[4]="","|200","|"&RC[4]&IF(RC[5]="","|200","|"&RC[5]&IF(RC[6]="","|200","|"&RC[6]&IF(RC[7]="","|200","|"&RC[7]&"|200")))) -> 28|34|38|44|200 | D250: =RC[7]&IF(RC[8]="","","#"&RC[8]&IF(RC[9]="","","#"&RC[9]&IF(RC[10]="","","#"&RC[10]&IF(RC[11]="","","#"&RC[11])))) -> 13439#10014#10004#10010#10008 | E250: =RC[11]&IF(RC[12]="","","#"&RC[12]&IF(RC[13]="","","#"&RC[13]&IF(RC[14]="","","#"&RC[14]&IF(RC[15]="","","#"&RC[15])))) -> 1#50#100#150#200 | F250: 28 | G250: 34 | H250: 38 | I250: 44 | K250: =R[-1]C -> 13439 | L250: =R[-1]C -> 10014 | M250: =R[-1]C -> 10004 | N250: =R[-1]C -> 10010 | O250: =R[-1]C -> 10008 | P250: =R[-1]C -> 1 | Q250: =R[-1]C -> 50 | R250: =R[-1]C -> 100 | S250: =R[-1]C -> 150 | T250: =R[-1]C -> 200 | U250: 同上
A251: 245 | B251: 50 | C251: =RC[3]&IF(RC[4]="","|200","|"&RC[4]&IF(RC[5]="","|200","|"&RC[5]&IF(RC[6]="","|200","|"&RC[6]&IF(RC[7]="","|200","|"&RC[7]&"|200")))) -> 28|34|38|44|200 | D251: =RC[7]&IF(RC[8]="","","#"&RC[8]&IF(RC[9]="","","#"&RC[9]&IF(RC[10]="","","#"&RC[10]&IF(RC[11]="","","#"&RC[11])))) -> 13439#10014#10004#10010#10008 | E251: =RC[11]&IF(RC[12]="","","#"&RC[12]&IF(RC[13]="","","#"&RC[13]&IF(RC[14]="","","#"&RC[14]&IF(RC[15]="","","#"&RC[15])))) -> 1#50#100#150#200 | F251: 28 | G251: 34 | H251: 38 | I251: 44 | K251: =R[-1]C -> 13439 | L251: =R[-1]C -> 10014 | M251: =R[-1]C -> 10004 | N251: =R[-1]C -> 10010 | O251: =R[-1]C -> 10008 | P251: =R[-1]C -> 1 | Q251: =R[-1]C -> 50 | R251: =R[-1]C -> 100 | S251: =R[-1]C -> 150 | T251: =R[-1]C -> 200 | U251: 同上
A252: 246 | B252: 50 | C252: =RC[3]&IF(RC[4]="","|200","|"&RC[4]&IF(RC[5]="","|200","|"&RC[5]&IF(RC[6]="","|200","|"&RC[6]&IF(RC[7]="","|200","|"&RC[7]&"|200")))) -> 28|34|38|44|200 | D252: =RC[7]&IF(RC[8]="","","#"&RC[8]&IF(RC[9]="","","#"&RC[9]&IF(RC[10]="","","#"&RC[10]&IF(RC[11]="","","#"&RC[11])))) -> 13439#10014#10004#10010#10008 | E252: =RC[11]&IF(RC[12]="","","#"&RC[12]&IF(RC[13]="","","#"&RC[13]&IF(RC[14]="","","#"&RC[14]&IF(RC[15]="","","#"&RC[15])))) -> 1#50#100#150#200 | F252: 28 | G252: 34 | H252: 38 | I252: 44 | K252: =R[-1]C -> 13439 | L252: =R[-1]C -> 10014 | M252: =R[-1]C -> 10004 | N252: =R[-1]C -> 10010 | O252: =R[-1]C -> 10008 | P252: =R[-1]C -> 1 | Q252: =R[-1]C -> 50 | R252: =R[-1]C -> 100 | S252: =R[-1]C -> 150 | T252: =R[-1]C -> 200 | U252: 同上
A253: 247 | B253: 50 | C253: =RC[3]&IF(RC[4]="","|200","|"&RC[4]&IF(RC[5]="","|200","|"&RC[5]&IF(RC[6]="","|200","|"&RC[6]&IF(RC[7]="","|200","|"&RC[7]&"|200")))) -> 28|34|38|44|200 | D253: =RC[7]&IF(RC[8]="","","#"&RC[8]&IF(RC[9]="","","#"&RC[9]&IF(RC[10]="","","#"&RC[10]&IF(RC[11]="","","#"&RC[11])))) -> 13439#10014#10004#10010#10008 | E253: =RC[11]&IF(RC[12]="","","#"&RC[12]&IF(RC[13]="","","#"&RC[13]&IF(RC[14]="","","#"&RC[14]&IF(RC[15]="","","#"&RC[15])))) -> 1#50#100#150#200 | F253: 28 | G253: 34 | H253: 38 | I253: 44 | K253: =R[-1]C -> 13439 | L253: =R[-1]C -> 10014 | M253: =R[-1]C -> 10004 | N253: =R[-1]C -> 10010 | O253: =R[-1]C -> 10008 | P253: =R[-1]C -> 1 | Q253: =R[-1]C -> 50 | R253: =R[-1]C -> 100 | S253: =R[-1]C -> 150 | T253: =R[-1]C -> 200 | U253: 同上
A254: 248 | B254: 50 | C254: =RC[3]&IF(RC[4]="","|200","|"&RC[4]&IF(RC[5]="","|200","|"&RC[5]&IF(RC[6]="","|200","|"&RC[6]&IF(RC[7]="","|200","|"&RC[7]&"|200")))) -> 28|34|38|44|200 | D254: =RC[7]&IF(RC[8]="","","#"&RC[8]&IF(RC[9]="","","#"&RC[9]&IF(RC[10]="","","#"&RC[10]&IF(RC[11]="","","#"&RC[11])))) -> 13439#10014#10004#10010#10008 | E254: =RC[11]&IF(RC[12]="","","#"&RC[12]&IF(RC[13]="","","#"&RC[13]&IF(RC[14]="","","#"&RC[14]&IF(RC[15]="","","#"&RC[15])))) -> 1#50#100#150#200 | F254: 28 | G254: 34 | H254: 38 | I254: 44 | K254: =R[-1]C -> 13439 | L254: =R[-1]C -> 10014 | M254: =R[-1]C -> 10004 | N254: =R[-1]C -> 10010 | O254: =R[-1]C -> 10008 | P254: =R[-1]C -> 1 | Q254: =R[-1]C -> 50 | R254: =R[-1]C -> 100 | S254: =R[-1]C -> 150 | T254: =R[-1]C -> 200 | U254: 同上
A255: 249 | B255: 50 | C255: =RC[3]&IF(RC[4]="","|200","|"&RC[4]&IF(RC[5]="","|200","|"&RC[5]&IF(RC[6]="","|200","|"&RC[6]&IF(RC[7]="","|200","|"&RC[7]&"|200")))) -> 28|34|38|44|200 | D255: =RC[7]&IF(RC[8]="","","#"&RC[8]&IF(RC[9]="","","#"&RC[9]&IF(RC[10]="","","#"&RC[10]&IF(RC[11]="","","#"&RC[11])))) -> 13439#10014#10004#10010#10008 | E255: =RC[11]&IF(RC[12]="","","#"&RC[12]&IF(RC[13]="","","#"&RC[13]&IF(RC[14]="","","#"&RC[14]&IF(RC[15]="","","#"&RC[15])))) -> 1#50#100#150#200 | F255: 28 | G255: 34 | H255: 38 | I255: 44 | K255: =R[-1]C -> 13439 | L255: =R[-1]C -> 10014 | M255: =R[-1]C -> 10004 | N255: =R[-1]C -> 10010 | O255: =R[-1]C -> 10008 | P255: =R[-1]C -> 1 | Q255: =R[-1]C -> 50 | R255: =R[-1]C -> 100 | S255: =R[-1]C -> 150 | T255: =R[-1]C -> 200 | U255: 同上
A256: 250 | B256: 50 | C256: =RC[3]&IF(RC[4]="","|200","|"&RC[4]&IF(RC[5]="","|200","|"&RC[5]&IF(RC[6]="","|200","|"&RC[6]&IF(RC[7]="","|200","|"&RC[7]&"|200")))) -> 28|34|38|44|200 | D256: =RC[7]&IF(RC[8]="","","#"&RC[8]&IF(RC[9]="","","#"&RC[9]&IF(RC[10]="","","#"&RC[10]&IF(RC[11]="","","#"&RC[11])))) -> 13439#10014#10004#10010#10008 | E256: =RC[11]&IF(RC[12]="","","#"&RC[12]&IF(RC[13]="","","#"&RC[13]&IF(RC[14]="","","#"&RC[14]&IF(RC[15]="","","#"&RC[15])))) -> 1#50#100#150#200 | F256: 28 | G256: 34 | H256: 38 | I256: 44 | K256: =R[-1]C -> 13439 | L256: =R[-1]C -> 10014 | M256: =R[-1]C -> 10004 | N256: =R[-1]C -> 10010 | O256: =R[-1]C -> 10008 | P256: =R[-1]C -> 1 | Q256: =R[-1]C -> 50 | R256: =R[-1]C -> 100 | S256: =R[-1]C -> 150 | T256: =R[-1]C -> 200 | U256: 同上
A257: 251 | B257: 50 | C257: =RC[3]&IF(RC[4]="","|200","|"&RC[4]&IF(RC[5]="","|200","|"&RC[5]&IF(RC[6]="","|200","|"&RC[6]&IF(RC[7]="","|200","|"&RC[7]&"|200")))) -> 28|34|38|44|200 | D257: =RC[7]&IF(RC[8]="","","#"&RC[8]&IF(RC[9]="","","#"&RC[9]&IF(RC[10]="","","#"&RC[10]&IF(RC[11]="","","#"&RC[11])))) -> 13439#10014#10004#10010#10008 | E257: =RC[11]&IF(RC[12]="","","#"&RC[12]&IF(RC[13]="","","#"&RC[13]&IF(RC[14]="","","#"&RC[14]&IF(RC[15]="","","#"&RC[15])))) -> 1#50#100#150#200 | F257: 28 | G257: 34 | H257: 38 | I257: 44 | K257: =R[-1]C -> 13439 | L257: =R[-1]C -> 10014 | M257: =R[-1]C -> 10004 | N257: =R[-1]C -> 10010 | O257: =R[-1]C -> 10008 | P257: =R[-1]C -> 1 | Q257: =R[-1]C -> 50 | R257: =R[-1]C -> 100 | S257: =R[-1]C -> 150 | T257: =R[-1]C -> 200 | U257: 同上
A258: 252 | B258: 50 | C258: =RC[3]&IF(RC[4]="","|200","|"&RC[4]&IF(RC[5]="","|200","|"&RC[5]&IF(RC[6]="","|200","|"&RC[6]&IF(RC[7]="","|200","|"&RC[7]&"|200")))) -> 28|34|38|44|200 | D258: =RC[7]&IF(RC[8]="","","#"&RC[8]&IF(RC[9]="","","#"&RC[9]&IF(RC[10]="","","#"&RC[10]&IF(RC[11]="","","#"&RC[11])))) -> 13439#10014#10004#10010#10008 | E258: =RC[11]&IF(RC[12]="","","#"&RC[12]&IF(RC[13]="","","#"&RC[13]&IF(RC[14]="","","#"&RC[14]&IF(RC[15]="","","#"&RC[15])))) -> 1#50#100#150#200 | F258: 28 | G258: 34 | H258: 38 | I258: 44 | K258: =R[-1]C -> 13439 | L258: =R[-1]C -> 10014 | M258: =R[-1]C -> 10004 | N258: =R[-1]C -> 10010 | O258: =R[-1]C -> 10008 | P258: =R[-1]C -> 1 | Q258: =R[-1]C -> 50 | R258: =R[-1]C -> 100 | S258: =R[-1]C -> 150 | T258: =R[-1]C -> 200 | U258: 同上
A259: 253 | B259: 50 | C259: =RC[3]&IF(RC[4]="","|200","|"&RC[4]&IF(RC[5]="","|200","|"&RC[5]&IF(RC[6]="","|200","|"&RC[6]&IF(RC[7]="","|200","|"&RC[7]&"|200")))) -> 28|34|38|44|200 | D259: =RC[7]&IF(RC[8]="","","#"&RC[8]&IF(RC[9]="","","#"&RC[9]&IF(RC[10]="","","#"&RC[10]&IF(RC[11]="","","#"&RC[11])))) -> 13439#10014#10004#10010#10008 | E259: =RC[11]&IF(RC[12]="","","#"&RC[12]&IF(RC[13]="","","#"&RC[13]&IF(RC[14]="","","#"&RC[14]&IF(RC[15]="","","#"&RC[15])))) -> 1#50#100#150#200 | F259: 28 | G259: 34 | H259: 38 | I259: 44 | K259: =R[-1]C -> 13439 | L259: =R[-1]C -> 10014 | M259: =R[-1]C -> 10004 | N259: =R[-1]C -> 10010 | O259: =R[-1]C -> 10008 | P259: =R[-1]C -> 1 | Q259: =R[-1]C -> 50 | R259: =R[-1]C -> 100 | S259: =R[-1]C -> 150 | T259: =R[-1]C -> 200 | U259: 同上
A260: 254 | B260: 50 | C260: =RC[3]&IF(RC[4]="","|200","|"&RC[4]&IF(RC[5]="","|200","|"&RC[5]&IF(RC[6]="","|200","|"&RC[6]&IF(RC[7]="","|200","|"&RC[7]&"|200")))) -> 28|34|38|44|200 | D260: =RC[7]&IF(RC[8]="","","#"&RC[8]&IF(RC[9]="","","#"&RC[9]&IF(RC[10]="","","#"&RC[10]&IF(RC[11]="","","#"&RC[11])))) -> 13439#10014#10004#10010#10008 | E260: =RC[11]&IF(RC[12]="","","#"&RC[12]&IF(RC[13]="","","#"&RC[13]&IF(RC[14]="","","#"&RC[14]&IF(RC[15]="","","#"&RC[15])))) -> 1#50#100#150#200 | F260: 28 | G260: 34 | H260: 38 | I260: 44 | K260: =R[-1]C -> 13439 | L260: =R[-1]C -> 10014 | M260: =R[-1]C -> 10004 | N260: =R[-1]C -> 10010 | O260: =R[-1]C -> 10008 | P260: =R[-1]C -> 1 | Q260: =R[-1]C -> 50 | R260: =R[-1]C -> 100 | S260: =R[-1]C -> 150 | T260: =R[-1]C -> 200 | U260: 同上
A261: 255 | B261: 50 | C261: =RC[3]&IF(RC[4]="","|200","|"&RC[4]&IF(RC[5]="","|200","|"&RC[5]&IF(RC[6]="","|200","|"&RC[6]&IF(RC[7]="","|200","|"&RC[7]&"|200")))) -> 28|34|38|44|200 | D261: =RC[7]&IF(RC[8]="","","#"&RC[8]&IF(RC[9]="","","#"&RC[9]&IF(RC[10]="","","#"&RC[10]&IF(RC[11]="","","#"&RC[11])))) -> 13439#10014#10004#10010#10008 | E261: =RC[11]&IF(RC[12]="","","#"&RC[12]&IF(RC[13]="","","#"&RC[13]&IF(RC[14]="","","#"&RC[14]&IF(RC[15]="","","#"&RC[15])))) -> 1#50#100#150#200 | F261: 28 | G261: 34 | H261: 38 | I261: 44 | K261: =R[-1]C -> 13439 | L261: =R[-1]C -> 10014 | M261: =R[-1]C -> 10004 | N261: =R[-1]C -> 10010 | O261: =R[-1]C -> 10008 | P261: =R[-1]C -> 1 | Q261: =R[-1]C -> 50 | R261: =R[-1]C -> 100 | S261: =R[-1]C -> 150 | T261: =R[-1]C -> 200 | U261: 同上
A262: 256 | B262: 50 | C262: =RC[3]&IF(RC[4]="","|200","|"&RC[4]&IF(RC[5]="","|200","|"&RC[5]&IF(RC[6]="","|200","|"&RC[6]&IF(RC[7]="","|200","|"&RC[7]&"|200")))) -> 28|34|38|44|200 | D262: =RC[7]&IF(RC[8]="","","#"&RC[8]&IF(RC[9]="","","#"&RC[9]&IF(RC[10]="","","#"&RC[10]&IF(RC[11]="","","#"&RC[11])))) -> 13439#10014#10004#10010#10008 | E262: =RC[11]&IF(RC[12]="","","#"&RC[12]&IF(RC[13]="","","#"&RC[13]&IF(RC[14]="","","#"&RC[14]&IF(RC[15]="","","#"&RC[15])))) -> 1#50#100#150#200 | F262: 28 | G262: 34 | H262: 38 | I262: 44 | K262: =R[-1]C -> 13439 | L262: =R[-1]C -> 10014 | M262: =R[-1]C -> 10004 | N262: =R[-1]C -> 10010 | O262: =R[-1]C -> 10008 | P262: =R[-1]C -> 1 | Q262: =R[-1]C -> 50 | R262: =R[-1]C -> 100 | S262: =R[-1]C -> 150 | T262: =R[-1]C -> 200 | U262: 同上
A263: 257 | B263: 50 | C263: =RC[3]&IF(RC[4]="","|200","|"&RC[4]&IF(RC[5]="","|200","|"&RC[5]&IF(RC[6]="","|200","|"&RC[6]&IF(RC[7]="","|200","|"&RC[7]&"|200")))) -> 28|34|38|44|200 | D263: =RC[7]&IF(RC[8]="","","#"&RC[8]&IF(RC[9]="","","#"&RC[9]&IF(RC[10]="","","#"&RC[10]&IF(RC[11]="","","#"&RC[11])))) -> 13439#10014#10004#10010#10008 | E263: =RC[11]&IF(RC[12]="","","#"&RC[12]&IF(RC[13]="","","#"&RC[13]&IF(RC[14]="","","#"&RC[14]&IF(RC[15]="","","#"&RC[15])))) -> 1#50#100#150#200 | F263: 28 | G263: 34 | H263: 38 | I263: 44 | K263: =R[-1]C -> 13439 | L263: =R[-1]C -> 10014 | M263: =R[-1]C -> 10004 | N263: =R[-1]C -> 10010 | O263: =R[-1]C -> 10008 | P263: =R[-1]C -> 1 | Q263: =R[-1]C -> 50 | R263: =R[-1]C -> 100 | S263: =R[-1]C -> 150 | T263: =R[-1]C -> 200 | U263: 同上
A264: 258 | B264: 50 | C264: =RC[3]&IF(RC[4]="","|200","|"&RC[4]&IF(RC[5]="","|200","|"&RC[5]&IF(RC[6]="","|200","|"&RC[6]&IF(RC[7]="","|200","|"&RC[7]&"|200")))) -> 28|34|38|44|200 | D264: =RC[7]&IF(RC[8]="","","#"&RC[8]&IF(RC[9]="","","#"&RC[9]&IF(RC[10]="","","#"&RC[10]&IF(RC[11]="","","#"&RC[11])))) -> 13439#10014#10004#10010#10008 | E264: =RC[11]&IF(RC[12]="","","#"&RC[12]&IF(RC[13]="","","#"&RC[13]&IF(RC[14]="","","#"&RC[14]&IF(RC[15]="","","#"&RC[15])))) -> 1#50#100#150#200 | F264: 28 | G264: 34 | H264: 38 | I264: 44 | K264: =R[-1]C -> 13439 | L264: =R[-1]C -> 10014 | M264: =R[-1]C -> 10004 | N264: =R[-1]C -> 10010 | O264: =R[-1]C -> 10008 | P264: =R[-1]C -> 1 | Q264: =R[-1]C -> 50 | R264: =R[-1]C -> 100 | S264: =R[-1]C -> 150 | T264: =R[-1]C -> 200 | U264: 同上
A265: 259 | B265: 50 | C265: =RC[3]&IF(RC[4]="","|200","|"&RC[4]&IF(RC[5]="","|200","|"&RC[5]&IF(RC[6]="","|200","|"&RC[6]&IF(RC[7]="","|200","|"&RC[7]&"|200")))) -> 28|34|38|44|200 | D265: =RC[7]&IF(RC[8]="","","#"&RC[8]&IF(RC[9]="","","#"&RC[9]&IF(RC[10]="","","#"&RC[10]&IF(RC[11]="","","#"&RC[11])))) -> 13439#10014#10004#10010#10008 | E265: =RC[11]&IF(RC[12]="","","#"&RC[12]&IF(RC[13]="","","#"&RC[13]&IF(RC[14]="","","#"&RC[14]&IF(RC[15]="","","#"&RC[15])))) -> 1#50#100#150#200 | F265: 28 | G265: 34 | H265: 38 | I265: 44 | K265: =R[-1]C -> 13439 | L265: =R[-1]C -> 10014 | M265: =R[-1]C -> 10004 | N265: =R[-1]C -> 10010 | O265: =R[-1]C -> 10008 | P265: =R[-1]C -> 1 | Q265: =R[-1]C -> 50 | R265: =R[-1]C -> 100 | S265: =R[-1]C -> 150 | T265: =R[-1]C -> 200 | U265: 同上
A266: 260 | B266: 50 | C266: =RC[3]&IF(RC[4]="","|200","|"&RC[4]&IF(RC[5]="","|200","|"&RC[5]&IF(RC[6]="","|200","|"&RC[6]&IF(RC[7]="","|200","|"&RC[7]&"|200")))) -> 28|34|38|44|200 | D266: =RC[7]&IF(RC[8]="","","#"&RC[8]&IF(RC[9]="","","#"&RC[9]&IF(RC[10]="","","#"&RC[10]&IF(RC[11]="","","#"&RC[11])))) -> 13439#10014#10004#10010#10008 | E266: =RC[11]&IF(RC[12]="","","#"&RC[12]&IF(RC[13]="","","#"&RC[13]&IF(RC[14]="","","#"&RC[14]&IF(RC[15]="","","#"&RC[15])))) -> 1#50#100#150#200 | F266: 28 | G266: 34 | H266: 38 | I266: 44 | K266: =R[-1]C -> 13439 | L266: =R[-1]C -> 10014 | M266: =R[-1]C -> 10004 | N266: =R[-1]C -> 10010 | O266: =R[-1]C -> 10008 | P266: =R[-1]C -> 1 | Q266: =R[-1]C -> 50 | R266: =R[-1]C -> 100 | S266: =R[-1]C -> 150 | T266: =R[-1]C -> 200 | U266: 同上
A267: 261 | B267: 50 | C267: =RC[3]&IF(RC[4]="","|200","|"&RC[4]&IF(RC[5]="","|200","|"&RC[5]&IF(RC[6]="","|200","|"&RC[6]&IF(RC[7]="","|200","|"&RC[7]&"|200")))) -> 28|34|38|44|200 | D267: =RC[7]&IF(RC[8]="","","#"&RC[8]&IF(RC[9]="","","#"&RC[9]&IF(RC[10]="","","#"&RC[10]&IF(RC[11]="","","#"&RC[11])))) -> 13439#10014#10004#10010#10008 | E267: =RC[11]&IF(RC[12]="","","#"&RC[12]&IF(RC[13]="","","#"&RC[13]&IF(RC[14]="","","#"&RC[14]&IF(RC[15]="","","#"&RC[15])))) -> 1#50#100#150#200 | F267: 28 | G267: 34 | H267: 38 | I267: 44 | K267: =R[-1]C -> 13439 | L267: =R[-1]C -> 10014 | M267: =R[-1]C -> 10004 | N267: =R[-1]C -> 10010 | O267: =R[-1]C -> 10008 | P267: =R[-1]C -> 1 | Q267: =R[-1]C -> 50 | R267: =R[-1]C -> 100 | S267: =R[-1]C -> 150 | T267: =R[-1]C -> 200 | U267: 同上
A268: 262 | B268: 50 | C268: =RC[3]&IF(RC[4]="","|200","|"&RC[4]&IF(RC[5]="","|200","|"&RC[5]&IF(RC[6]="","|200","|"&RC[6]&IF(RC[7]="","|200","|"&RC[7]&"|200")))) -> 28|34|38|44|200 | D268: =RC[7]&IF(RC[8]="","","#"&RC[8]&IF(RC[9]="","","#"&RC[9]&IF(RC[10]="","","#"&RC[10]&IF(RC[11]="","","#"&RC[11])))) -> 13439#10014#10004#10010#10008 | E268: =RC[11]&IF(RC[12]="","","#"&RC[12]&IF(RC[13]="","","#"&RC[13]&IF(RC[14]="","","#"&RC[14]&IF(RC[15]="","","#"&RC[15])))) -> 1#50#100#150#200 | F268: 28 | G268: 34 | H268: 38 | I268: 44 | K268: =R[-1]C -> 13439 | L268: =R[-1]C -> 10014 | M268: =R[-1]C -> 10004 | N268: =R[-1]C -> 10010 | O268: =R[-1]C -> 10008 | P268: =R[-1]C -> 1 | Q268: =R[-1]C -> 50 | R268: =R[-1]C -> 100 | S268: =R[-1]C -> 150 | T268: =R[-1]C -> 200 | U268: 同上
A269: 263 | B269: 50 | C269: =RC[3]&IF(RC[4]="","|200","|"&RC[4]&IF(RC[5]="","|200","|"&RC[5]&IF(RC[6]="","|200","|"&RC[6]&IF(RC[7]="","|200","|"&RC[7]&"|200")))) -> 28|34|38|44|200 | D269: =RC[7]&IF(RC[8]="","","#"&RC[8]&IF(RC[9]="","","#"&RC[9]&IF(RC[10]="","","#"&RC[10]&IF(RC[11]="","","#"&RC[11])))) -> 13439#10014#10004#10010#10008 | E269: =RC[11]&IF(RC[12]="","","#"&RC[12]&IF(RC[13]="","","#"&RC[13]&IF(RC[14]="","","#"&RC[14]&IF(RC[15]="","","#"&RC[15])))) -> 1#50#100#150#200 | F269: 28 | G269: 34 | H269: 38 | I269: 44 | K269: =R[-1]C -> 13439 | L269: =R[-1]C -> 10014 | M269: =R[-1]C -> 10004 | N269: =R[-1]C -> 10010 | O269: =R[-1]C -> 10008 | P269: =R[-1]C -> 1 | Q269: =R[-1]C -> 50 | R269: =R[-1]C -> 100 | S269: =R[-1]C -> 150 | T269: =R[-1]C -> 200 | U269: 同上
A270: 264 | B270: 50 | C270: =RC[3]&IF(RC[4]="","|200","|"&RC[4]&IF(RC[5]="","|200","|"&RC[5]&IF(RC[6]="","|200","|"&RC[6]&IF(RC[7]="","|200","|"&RC[7]&"|200")))) -> 28|34|38|44|200 | D270: =RC[7]&IF(RC[8]="","","#"&RC[8]&IF(RC[9]="","","#"&RC[9]&IF(RC[10]="","","#"&RC[10]&IF(RC[11]="","","#"&RC[11])))) -> 13439#10014#10004#10010#10008 | E270: =RC[11]&IF(RC[12]="","","#"&RC[12]&IF(RC[13]="","","#"&RC[13]&IF(RC[14]="","","#"&RC[14]&IF(RC[15]="","","#"&RC[15])))) -> 1#50#100#150#200 | F270: 28 | G270: 34 | H270: 38 | I270: 44 | K270: =R[-1]C -> 13439 | L270: =R[-1]C -> 10014 | M270: =R[-1]C -> 10004 | N270: =R[-1]C -> 10010 | O270: =R[-1]C -> 10008 | P270: =R[-1]C -> 1 | Q270: =R[-1]C -> 50 | R270: =R[-1]C -> 100 | S270: =R[-1]C -> 150 | T270: =R[-1]C -> 200 | U270: 同上
A271: 265 | B271: 50 | C271: =RC[3]&IF(RC[4]="","|200","|"&RC[4]&IF(RC[5]="","|200","|"&RC[5]&IF(RC[6]="","|200","|"&RC[6]&IF(RC[7]="","|200","|"&RC[7]&"|200")))) -> 28|34|38|44|200 | D271: =RC[7]&IF(RC[8]="","","#"&RC[8]&IF(RC[9]="","","#"&RC[9]&IF(RC[10]="","","#"&RC[10]&IF(RC[11]="","","#"&RC[11])))) -> 13439#10014#10004#10010#10008 | E271: =RC[11]&IF(RC[12]="","","#"&RC[12]&IF(RC[13]="","","#"&RC[13]&IF(RC[14]="","","#"&RC[14]&IF(RC[15]="","","#"&RC[15])))) -> 1#50#100#150#200 | F271: 28 | G271: 34 | H271: 38 | I271: 44 | K271: =R[-1]C -> 13439 | L271: =R[-1]C -> 10014 | M271: =R[-1]C -> 10004 | N271: =R[-1]C -> 10010 | O271: =R[-1]C -> 10008 | P271: =R[-1]C -> 1 | Q271: =R[-1]C -> 50 | R271: =R[-1]C -> 100 | S271: =R[-1]C -> 150 | T271: =R[-1]C -> 200 | U271: 同上
A272: 266 | B272: 50 | C272: =RC[3]&IF(RC[4]="","|200","|"&RC[4]&IF(RC[5]="","|200","|"&RC[5]&IF(RC[6]="","|200","|"&RC[6]&IF(RC[7]="","|200","|"&RC[7]&"|200")))) -> 28|34|38|44|200 | D272: =RC[7]&IF(RC[8]="","","#"&RC[8]&IF(RC[9]="","","#"&RC[9]&IF(RC[10]="","","#"&RC[10]&IF(RC[11]="","","#"&RC[11])))) -> 13439#10014#10004#10010#10008 | E272: =RC[11]&IF(RC[12]="","","#"&RC[12]&IF(RC[13]="","","#"&RC[13]&IF(RC[14]="","","#"&RC[14]&IF(RC[15]="","","#"&RC[15])))) -> 1#50#100#150#200 | F272: 28 | G272: 34 | H272: 38 | I272: 44 | K272: =R[-1]C -> 13439 | L272: =R[-1]C -> 10014 | M272: =R[-1]C -> 10004 | N272: =R[-1]C -> 10010 | O272: =R[-1]C -> 10008 | P272: =R[-1]C -> 1 | Q272: =R[-1]C -> 50 | R272: =R[-1]C -> 100 | S272: =R[-1]C -> 150 | T272: =R[-1]C -> 200 | U272: 同上
A273: 267 | B273: 50 | C273: =RC[3]&IF(RC[4]="","|200","|"&RC[4]&IF(RC[5]="","|200","|"&RC[5]&IF(RC[6]="","|200","|"&RC[6]&IF(RC[7]="","|200","|"&RC[7]&"|200")))) -> 28|34|38|44|200 | D273: =RC[7]&IF(RC[8]="","","#"&RC[8]&IF(RC[9]="","","#"&RC[9]&IF(RC[10]="","","#"&RC[10]&IF(RC[11]="","","#"&RC[11])))) -> 13439#10014#10004#10010#10008 | E273: =RC[11]&IF(RC[12]="","","#"&RC[12]&IF(RC[13]="","","#"&RC[13]&IF(RC[14]="","","#"&RC[14]&IF(RC[15]="","","#"&RC[15])))) -> 1#50#100#150#200 | F273: 28 | G273: 34 | H273: 38 | I273: 44 | K273: =R[-1]C -> 13439 | L273: =R[-1]C -> 10014 | M273: =R[-1]C -> 10004 | N273: =R[-1]C -> 10010 | O273: =R[-1]C -> 10008 | P273: =R[-1]C -> 1 | Q273: =R[-1]C -> 50 | R273: =R[-1]C -> 100 | S273: =R[-1]C -> 150 | T273: =R[-1]C -> 200 | U273: 同上
A274: 268 | B274: 50 | C274: =RC[3]&IF(RC[4]="","|200","|"&RC[4]&IF(RC[5]="","|200","|"&RC[5]&IF(RC[6]="","|200","|"&RC[6]&IF(RC[7]="","|200","|"&RC[7]&"|200")))) -> 28|34|38|44|200 | D274: =RC[7]&IF(RC[8]="","","#"&RC[8]&IF(RC[9]="","","#"&RC[9]&IF(RC[10]="","","#"&RC[10]&IF(RC[11]="","","#"&RC[11])))) -> 13439#10014#10004#10010#10008 | E274: =RC[11]&IF(RC[12]="","","#"&RC[12]&IF(RC[13]="","","#"&RC[13]&IF(RC[14]="","","#"&RC[14]&IF(RC[15]="","","#"&RC[15])))) -> 1#50#100#150#200 | F274: 28 | G274: 34 | H274: 38 | I274: 44 | K274: =R[-1]C -> 13439 | L274: =R[-1]C -> 10014 | M274: =R[-1]C -> 10004 | N274: =R[-1]C -> 10010 | O274: =R[-1]C -> 10008 | P274: =R[-1]C -> 1 | Q274: =R[-1]C -> 50 | R274: =R[-1]C -> 100 | S274: =R[-1]C -> 150 | T274: =R[-1]C -> 200 | U274: 同上
A275: 269 | B275: 50 | C275: =RC[3]&IF(RC[4]="","|200","|"&RC[4]&IF(RC[5]="","|200","|"&RC[5]&IF(RC[6]="","|200","|"&RC[6]&IF(RC[7]="","|200","|"&RC[7]&"|200")))) -> 28|34|38|44|200 | D275: =RC[7]&IF(RC[8]="","","#"&RC[8]&IF(RC[9]="","","#"&RC[9]&IF(RC[10]="","","#"&RC[10]&IF(RC[11]="","","#"&RC[11])))) -> 13439#10014#10004#10010#10008 | E275: =RC[11]&IF(RC[12]="","","#"&RC[12]&IF(RC[13]="","","#"&RC[13]&IF(RC[14]="","","#"&RC[14]&IF(RC[15]="","","#"&RC[15])))) -> 1#50#100#150#200 | F275: 28 | G275: 34 | H275: 38 | I275: 44 | K275: =R[-1]C -> 13439 | L275: =R[-1]C -> 10014 | M275: =R[-1]C -> 10004 | N275: =R[-1]C -> 10010 | O275: =R[-1]C -> 10008 | P275: =R[-1]C -> 1 | Q275: =R[-1]C -> 50 | R275: =R[-1]C -> 100 | S275: =R[-1]C -> 150 | T275: =R[-1]C -> 200 | U275: 同上
A276: 270 | B276: 50 | C276: =RC[3]&IF(RC[4]="","|200","|"&RC[4]&IF(RC[5]="","|200","|"&RC[5]&IF(RC[6]="","|200","|"&RC[6]&IF(RC[7]="","|200","|"&RC[7]&"|200")))) -> 28|34|38|44|200 | D276: =RC[7]&IF(RC[8]="","","#"&RC[8]&IF(RC[9]="","","#"&RC[9]&IF(RC[10]="","","#"&RC[10]&IF(RC[11]="","","#"&RC[11])))) -> 13439#10014#10004#10010#10008 | E276: =RC[11]&IF(RC[12]="","","#"&RC[12]&IF(RC[13]="","","#"&RC[13]&IF(RC[14]="","","#"&RC[14]&IF(RC[15]="","","#"&RC[15])))) -> 1#50#100#150#200 | F276: 28 | G276: 34 | H276: 38 | I276: 44 | K276: =R[-1]C -> 13439 | L276: =R[-1]C -> 10014 | M276: =R[-1]C -> 10004 | N276: =R[-1]C -> 10010 | O276: =R[-1]C -> 10008 | P276: =R[-1]C -> 1 | Q276: =R[-1]C -> 50 | R276: =R[-1]C -> 100 | S276: =R[-1]C -> 150 | T276: =R[-1]C -> 200 | U276: 同上
A277: 271 | B277: 50 | C277: =RC[3]&IF(RC[4]="","|200","|"&RC[4]&IF(RC[5]="","|200","|"&RC[5]&IF(RC[6]="","|200","|"&RC[6]&IF(RC[7]="","|200","|"&RC[7]&"|200")))) -> 28|34|38|44|200 | D277: =RC[7]&IF(RC[8]="","","#"&RC[8]&IF(RC[9]="","","#"&RC[9]&IF(RC[10]="","","#"&RC[10]&IF(RC[11]="","","#"&RC[11])))) -> 13439#10014#10004#10010#10008 | E277: =RC[11]&IF(RC[12]="","","#"&RC[12]&IF(RC[13]="","","#"&RC[13]&IF(RC[14]="","","#"&RC[14]&IF(RC[15]="","","#"&RC[15])))) -> 1#50#100#150#200 | F277: 28 | G277: 34 | H277: 38 | I277: 44 | K277: =R[-1]C -> 13439 | L277: =R[-1]C -> 10014 | M277: =R[-1]C -> 10004 | N277: =R[-1]C -> 10010 | O277: =R[-1]C -> 10008 | P277: =R[-1]C -> 1 | Q277: =R[-1]C -> 50 | R277: =R[-1]C -> 100 | S277: =R[-1]C -> 150 | T277: =R[-1]C -> 200 | U277: 同上
A278: 272 | B278: 50 | C278: =RC[3]&IF(RC[4]="","|200","|"&RC[4]&IF(RC[5]="","|200","|"&RC[5]&IF(RC[6]="","|200","|"&RC[6]&IF(RC[7]="","|200","|"&RC[7]&"|200")))) -> 28|34|38|44|200 | D278: =RC[7]&IF(RC[8]="","","#"&RC[8]&IF(RC[9]="","","#"&RC[9]&IF(RC[10]="","","#"&RC[10]&IF(RC[11]="","","#"&RC[11])))) -> 13439#10014#10004#10010#10008 | E278: =RC[11]&IF(RC[12]="","","#"&RC[12]&IF(RC[13]="","","#"&RC[13]&IF(RC[14]="","","#"&RC[14]&IF(RC[15]="","","#"&RC[15])))) -> 1#50#100#150#200 | F278: 28 | G278: 34 | H278: 38 | I278: 44 | K278: =R[-1]C -> 13439 | L278: =R[-1]C -> 10014 | M278: =R[-1]C -> 10004 | N278: =R[-1]C -> 10010 | O278: =R[-1]C -> 10008 | P278: =R[-1]C -> 1 | Q278: =R[-1]C -> 50 | R278: =R[-1]C -> 100 | S278: =R[-1]C -> 150 | T278: =R[-1]C -> 200 | U278: 同上
A279: 273 | B279: 50 | C279: =RC[3]&IF(RC[4]="","|200","|"&RC[4]&IF(RC[5]="","|200","|"&RC[5]&IF(RC[6]="","|200","|"&RC[6]&IF(RC[7]="","|200","|"&RC[7]&"|200")))) -> 28|34|38|44|200 | D279: =RC[7]&IF(RC[8]="","","#"&RC[8]&IF(RC[9]="","","#"&RC[9]&IF(RC[10]="","","#"&RC[10]&IF(RC[11]="","","#"&RC[11])))) -> 13439#10014#10004#10010#10008 | E279: =RC[11]&IF(RC[12]="","","#"&RC[12]&IF(RC[13]="","","#"&RC[13]&IF(RC[14]="","","#"&RC[14]&IF(RC[15]="","","#"&RC[15])))) -> 1#50#100#150#200 | F279: 28 | G279: 34 | H279: 38 | I279: 44 | K279: =R[-1]C -> 13439 | L279: =R[-1]C -> 10014 | M279: =R[-1]C -> 10004 | N279: =R[-1]C -> 10010 | O279: =R[-1]C -> 10008 | P279: =R[-1]C -> 1 | Q279: =R[-1]C -> 50 | R279: =R[-1]C -> 100 | S279: =R[-1]C -> 150 | T279: =R[-1]C -> 200 | U279: 同上
A280: 274 | B280: 50 | C280: =RC[3]&IF(RC[4]="","|200","|"&RC[4]&IF(RC[5]="","|200","|"&RC[5]&IF(RC[6]="","|200","|"&RC[6]&IF(RC[7]="","|200","|"&RC[7]&"|200")))) -> 28|34|38|44|200 | D280: =RC[7]&IF(RC[8]="","","#"&RC[8]&IF(RC[9]="","","#"&RC[9]&IF(RC[10]="","","#"&RC[10]&IF(RC[11]="","","#"&RC[11])))) -> 13439#10014#10004#10010#10008 | E280: =RC[11]&IF(RC[12]="","","#"&RC[12]&IF(RC[13]="","","#"&RC[13]&IF(RC[14]="","","#"&RC[14]&IF(RC[15]="","","#"&RC[15])))) -> 1#50#100#150#200 | F280: 28 | G280: 34 | H280: 38 | I280: 44 | K280: =R[-1]C -> 13439 | L280: =R[-1]C -> 10014 | M280: =R[-1]C -> 10004 | N280: =R[-1]C -> 10010 | O280: =R[-1]C -> 10008 | P280: =R[-1]C -> 1 | Q280: =R[-1]C -> 50 | R280: =R[-1]C -> 100 | S280: =R[-1]C -> 150 | T280: =R[-1]C -> 200 | U280: 同上
A281: 275 | B281: 50 | C281: =RC[3]&IF(RC[4]="","|200","|"&RC[4]&IF(RC[5]="","|200","|"&RC[5]&IF(RC[6]="","|200","|"&RC[6]&IF(RC[7]="","|200","|"&RC[7]&"|200")))) -> 28|34|38|44|200 | D281: =RC[7]&IF(RC[8]="","","#"&RC[8]&IF(RC[9]="","","#"&RC[9]&IF(RC[10]="","","#"&RC[10]&IF(RC[11]="","","#"&RC[11])))) -> 13439#10014#10004#10010#10008 | E281: =RC[11]&IF(RC[12]="","","#"&RC[12]&IF(RC[13]="","","#"&RC[13]&IF(RC[14]="","","#"&RC[14]&IF(RC[15]="","","#"&RC[15])))) -> 1#50#100#150#200 | F281: 28 | G281: 34 | H281: 38 | I281: 44 | K281: =R[-1]C -> 13439 | L281: =R[-1]C -> 10014 | M281: =R[-1]C -> 10004 | N281: =R[-1]C -> 10010 | O281: =R[-1]C -> 10008 | P281: =R[-1]C -> 1 | Q281: =R[-1]C -> 50 | R281: =R[-1]C -> 100 | S281: =R[-1]C -> 150 | T281: =R[-1]C -> 200 | U281: 同上
A282: 276 | B282: 50 | C282: =RC[3]&IF(RC[4]="","|200","|"&RC[4]&IF(RC[5]="","|200","|"&RC[5]&IF(RC[6]="","|200","|"&RC[6]&IF(RC[7]="","|200","|"&RC[7]&"|200")))) -> 28|34|38|44|200 | D282: =RC[7]&IF(RC[8]="","","#"&RC[8]&IF(RC[9]="","","#"&RC[9]&IF(RC[10]="","","#"&RC[10]&IF(RC[11]="","","#"&RC[11])))) -> 13439#10014#10004#10010#10008 | E282: =RC[11]&IF(RC[12]="","","#"&RC[12]&IF(RC[13]="","","#"&RC[13]&IF(RC[14]="","","#"&RC[14]&IF(RC[15]="","","#"&RC[15])))) -> 1#50#100#150#200 | F282: 28 | G282: 34 | H282: 38 | I282: 44 | K282: =R[-1]C -> 13439 | L282: =R[-1]C -> 10014 | M282: =R[-1]C -> 10004 | N282: =R[-1]C -> 10010 | O282: =R[-1]C -> 10008 | P282: =R[-1]C -> 1 | Q282: =R[-1]C -> 50 | R282: =R[-1]C -> 100 | S282: =R[-1]C -> 150 | T282: =R[-1]C -> 200 | U282: 同上
A283: 277 | B283: 50 | C283: =RC[3]&IF(RC[4]="","|200","|"&RC[4]&IF(RC[5]="","|200","|"&RC[5]&IF(RC[6]="","|200","|"&RC[6]&IF(RC[7]="","|200","|"&RC[7]&"|200")))) -> 28|34|38|44|200 | D283: =RC[7]&IF(RC[8]="","","#"&RC[8]&IF(RC[9]="","","#"&RC[9]&IF(RC[10]="","","#"&RC[10]&IF(RC[11]="","","#"&RC[11])))) -> 13439#10014#10004#10010#10008 | E283: =RC[11]&IF(RC[12]="","","#"&RC[12]&IF(RC[13]="","","#"&RC[13]&IF(RC[14]="","","#"&RC[14]&IF(RC[15]="","","#"&RC[15])))) -> 1#50#100#150#200 | F283: 28 | G283: 34 | H283: 38 | I283: 44 | K283: =R[-1]C -> 13439 | L283: =R[-1]C -> 10014 | M283: =R[-1]C -> 10004 | N283: =R[-1]C -> 10010 | O283: =R[-1]C -> 10008 | P283: =R[-1]C -> 1 | Q283: =R[-1]C -> 50 | R283: =R[-1]C -> 100 | S283: =R[-1]C -> 150 | T283: =R[-1]C -> 200 | U283: 同上
A284: 278 | B284: 50 | C284: =RC[3]&IF(RC[4]="","|200","|"&RC[4]&IF(RC[5]="","|200","|"&RC[5]&IF(RC[6]="","|200","|"&RC[6]&IF(RC[7]="","|200","|"&RC[7]&"|200")))) -> 28|34|38|44|200 | D284: =RC[7]&IF(RC[8]="","","#"&RC[8]&IF(RC[9]="","","#"&RC[9]&IF(RC[10]="","","#"&RC[10]&IF(RC[11]="","","#"&RC[11])))) -> 13439#10014#10004#10010#10008 | E284: =RC[11]&IF(RC[12]="","","#"&RC[12]&IF(RC[13]="","","#"&RC[13]&IF(RC[14]="","","#"&RC[14]&IF(RC[15]="","","#"&RC[15])))) -> 1#50#100#150#200 | F284: 28 | G284: 34 | H284: 38 | I284: 44 | K284: =R[-1]C -> 13439 | L284: =R[-1]C -> 10014 | M284: =R[-1]C -> 10004 | N284: =R[-1]C -> 10010 | O284: =R[-1]C -> 10008 | P284: =R[-1]C -> 1 | Q284: =R[-1]C -> 50 | R284: =R[-1]C -> 100 | S284: =R[-1]C -> 150 | T284: =R[-1]C -> 200 | U284: 同上
A285: 279 | B285: 50 | C285: =RC[3]&IF(RC[4]="","|200","|"&RC[4]&IF(RC[5]="","|200","|"&RC[5]&IF(RC[6]="","|200","|"&RC[6]&IF(RC[7]="","|200","|"&RC[7]&"|200")))) -> 28|34|38|44|200 | D285: =RC[7]&IF(RC[8]="","","#"&RC[8]&IF(RC[9]="","","#"&RC[9]&IF(RC[10]="","","#"&RC[10]&IF(RC[11]="","","#"&RC[11])))) -> 13439#10014#10004#10010#10008 | E285: =RC[11]&IF(RC[12]="","","#"&RC[12]&IF(RC[13]="","","#"&RC[13]&IF(RC[14]="","","#"&RC[14]&IF(RC[15]="","","#"&RC[15])))) -> 1#50#100#150#200 | F285: 28 | G285: 34 | H285: 38 | I285: 44 | K285: =R[-1]C -> 13439 | L285: =R[-1]C -> 10014 | M285: =R[-1]C -> 10004 | N285: =R[-1]C -> 10010 | O285: =R[-1]C -> 10008 | P285: =R[-1]C -> 1 | Q285: =R[-1]C -> 50 | R285: =R[-1]C -> 100 | S285: =R[-1]C -> 150 | T285: =R[-1]C -> 200 | U285: 同上
A286: 280 | B286: 50 | C286: =RC[3]&IF(RC[4]="","|200","|"&RC[4]&IF(RC[5]="","|200","|"&RC[5]&IF(RC[6]="","|200","|"&RC[6]&IF(RC[7]="","|200","|"&RC[7]&"|200")))) -> 28|34|38|44|200 | D286: =RC[7]&IF(RC[8]="","","#"&RC[8]&IF(RC[9]="","","#"&RC[9]&IF(RC[10]="","","#"&RC[10]&IF(RC[11]="","","#"&RC[11])))) -> 13439#10014#10004#10010#10008 | E286: =RC[11]&IF(RC[12]="","","#"&RC[12]&IF(RC[13]="","","#"&RC[13]&IF(RC[14]="","","#"&RC[14]&IF(RC[15]="","","#"&RC[15])))) -> 1#50#100#150#200 | F286: 28 | G286: 34 | H286: 38 | I286: 44 | K286: =R[-1]C -> 13439 | L286: =R[-1]C -> 10014 | M286: =R[-1]C -> 10004 | N286: =R[-1]C -> 10010 | O286: =R[-1]C -> 10008 | P286: =R[-1]C -> 1 | Q286: =R[-1]C -> 50 | R286: =R[-1]C -> 100 | S286: =R[-1]C -> 150 | T286: =R[-1]C -> 200 | U286: 同上
A287: 281 | B287: 50 | C287: =RC[3]&IF(RC[4]="","|200","|"&RC[4]&IF(RC[5]="","|200","|"&RC[5]&IF(RC[6]="","|200","|"&RC[6]&IF(RC[7]="","|200","|"&RC[7]&"|200")))) -> 28|34|38|44|200 | D287: =RC[7]&IF(RC[8]="","","#"&RC[8]&IF(RC[9]="","","#"&RC[9]&IF(RC[10]="","","#"&RC[10]&IF(RC[11]="","","#"&RC[11])))) -> 13439#10014#10004#10010#10008 | E287: =RC[11]&IF(RC[12]="","","#"&RC[12]&IF(RC[13]="","","#"&RC[13]&IF(RC[14]="","","#"&RC[14]&IF(RC[15]="","","#"&RC[15])))) -> 1#50#100#150#200 | F287: 28 | G287: 34 | H287: 38 | I287: 44 | K287: =R[-1]C -> 13439 | L287: =R[-1]C -> 10014 | M287: =R[-1]C -> 10004 | N287: =R[-1]C -> 10010 | O287: =R[-1]C -> 10008 | P287: =R[-1]C -> 1 | Q287: =R[-1]C -> 50 | R287: =R[-1]C -> 100 | S287: =R[-1]C -> 150 | T287: =R[-1]C -> 200 | U287: 同上
A288: 282 | B288: 50 | C288: =RC[3]&IF(RC[4]="","|200","|"&RC[4]&IF(RC[5]="","|200","|"&RC[5]&IF(RC[6]="","|200","|"&RC[6]&IF(RC[7]="","|200","|"&RC[7]&"|200")))) -> 28|34|38|44|200 | D288: =RC[7]&IF(RC[8]="","","#"&RC[8]&IF(RC[9]="","","#"&RC[9]&IF(RC[10]="","","#"&RC[10]&IF(RC[11]="","","#"&RC[11])))) -> 13439#10014#10004#10010#10008 | E288: =RC[11]&IF(RC[12]="","","#"&RC[12]&IF(RC[13]="","","#"&RC[13]&IF(RC[14]="","","#"&RC[14]&IF(RC[15]="","","#"&RC[15])))) -> 1#50#100#150#200 | F288: 28 | G288: 34 | H288: 38 | I288: 44 | K288: =R[-1]C -> 13439 | L288: =R[-1]C -> 10014 | M288: =R[-1]C -> 10004 | N288: =R[-1]C -> 10010 | O288: =R[-1]C -> 10008 | P288: =R[-1]C -> 1 | Q288: =R[-1]C -> 50 | R288: =R[-1]C -> 100 | S288: =R[-1]C -> 150 | T288: =R[-1]C -> 200 | U288: 同上
A289: 283 | B289: 50 | C289: =RC[3]&IF(RC[4]="","|200","|"&RC[4]&IF(RC[5]="","|200","|"&RC[5]&IF(RC[6]="","|200","|"&RC[6]&IF(RC[7]="","|200","|"&RC[7]&"|200")))) -> 28|34|38|44|200 | D289: =RC[7]&IF(RC[8]="","","#"&RC[8]&IF(RC[9]="","","#"&RC[9]&IF(RC[10]="","","#"&RC[10]&IF(RC[11]="","","#"&RC[11])))) -> 13439#10014#10004#10010#10008 | E289: =RC[11]&IF(RC[12]="","","#"&RC[12]&IF(RC[13]="","","#"&RC[13]&IF(RC[14]="","","#"&RC[14]&IF(RC[15]="","","#"&RC[15])))) -> 1#50#100#150#200 | F289: 28 | G289: 34 | H289: 38 | I289: 44 | K289: =R[-1]C -> 13439 | L289: =R[-1]C -> 10014 | M289: =R[-1]C -> 10004 | N289: =R[-1]C -> 10010 | O289: =R[-1]C -> 10008 | P289: =R[-1]C -> 1 | Q289: =R[-1]C -> 50 | R289: =R[-1]C -> 100 | S289: =R[-1]C -> 150 | T289: =R[-1]C -> 200 | U289: 同上
A290: 284 | B290: 50 | C290: =RC[3]&IF(RC[4]="","|200","|"&RC[4]&IF(RC[5]="","|200","|"&RC[5]&IF(RC[6]="","|200","|"&RC[6]&IF(RC[7]="","|200","|"&RC[7]&"|200")))) -> 28|34|38|44|200 | D290: =RC[7]&IF(RC[8]="","","#"&RC[8]&IF(RC[9]="","","#"&RC[9]&IF(RC[10]="","","#"&RC[10]&IF(RC[11]="","","#"&RC[11])))) -> 13439#10014#10004#10010#10008 | E290: =RC[11]&IF(RC[12]="","","#"&RC[12]&IF(RC[13]="","","#"&RC[13]&IF(RC[14]="","","#"&RC[14]&IF(RC[15]="","","#"&RC[15])))) -> 1#50#100#150#200 | F290: 28 | G290: 34 | H290: 38 | I290: 44 | K290: =R[-1]C -> 13439 | L290: =R[-1]C -> 10014 | M290: =R[-1]C -> 10004 | N290: =R[-1]C -> 10010 | O290: =R[-1]C -> 10008 | P290: =R[-1]C -> 1 | Q290: =R[-1]C -> 50 | R290: =R[-1]C -> 100 | S290: =R[-1]C -> 150 | T290: =R[-1]C -> 200 | U290: 同上
A291: 285 | B291: 50 | C291: =RC[3]&IF(RC[4]="","|200","|"&RC[4]&IF(RC[5]="","|200","|"&RC[5]&IF(RC[6]="","|200","|"&RC[6]&IF(RC[7]="","|200","|"&RC[7]&"|200")))) -> 28|34|38|44|200 | D291: =RC[7]&IF(RC[8]="","","#"&RC[8]&IF(RC[9]="","","#"&RC[9]&IF(RC[10]="","","#"&RC[10]&IF(RC[11]="","","#"&RC[11])))) -> 13439#10014#10004#10010#10008 | E291: =RC[11]&IF(RC[12]="","","#"&RC[12]&IF(RC[13]="","","#"&RC[13]&IF(RC[14]="","","#"&RC[14]&IF(RC[15]="","","#"&RC[15])))) -> 1#50#100#150#200 | F291: 28 | G291: 34 | H291: 38 | I291: 44 | K291: =R[-1]C -> 13439 | L291: =R[-1]C -> 10014 | M291: =R[-1]C -> 10004 | N291: =R[-1]C -> 10010 | O291: =R[-1]C -> 10008 | P291: =R[-1]C -> 1 | Q291: =R[-1]C -> 50 | R291: =R[-1]C -> 100 | S291: =R[-1]C -> 150 | T291: =R[-1]C -> 200 | U291: 同上
A292: 286 | B292: 50 | C292: =RC[3]&IF(RC[4]="","|200","|"&RC[4]&IF(RC[5]="","|200","|"&RC[5]&IF(RC[6]="","|200","|"&RC[6]&IF(RC[7]="","|200","|"&RC[7]&"|200")))) -> 28|34|38|44|200 | D292: =RC[7]&IF(RC[8]="","","#"&RC[8]&IF(RC[9]="","","#"&RC[9]&IF(RC[10]="","","#"&RC[10]&IF(RC[11]="","","#"&RC[11])))) -> 13439#10014#10004#10010#10008 | E292: =RC[11]&IF(RC[12]="","","#"&RC[12]&IF(RC[13]="","","#"&RC[13]&IF(RC[14]="","","#"&RC[14]&IF(RC[15]="","","#"&RC[15])))) -> 1#50#100#150#200 | F292: 28 | G292: 34 | H292: 38 | I292: 44 | K292: =R[-1]C -> 13439 | L292: =R[-1]C -> 10014 | M292: =R[-1]C -> 10004 | N292: =R[-1]C -> 10010 | O292: =R[-1]C -> 10008 | P292: =R[-1]C -> 1 | Q292: =R[-1]C -> 50 | R292: =R[-1]C -> 100 | S292: =R[-1]C -> 150 | T292: =R[-1]C -> 200 | U292: 同上
A293: 287 | B293: 50 | C293: =RC[3]&IF(RC[4]="","|200","|"&RC[4]&IF(RC[5]="","|200","|"&RC[5]&IF(RC[6]="","|200","|"&RC[6]&IF(RC[7]="","|200","|"&RC[7]&"|200")))) -> 28|34|38|44|200 | D293: =RC[7]&IF(RC[8]="","","#"&RC[8]&IF(RC[9]="","","#"&RC[9]&IF(RC[10]="","","#"&RC[10]&IF(RC[11]="","","#"&RC[11])))) -> 13439#10014#10004#10010#10008 | E293: =RC[11]&IF(RC[12]="","","#"&RC[12]&IF(RC[13]="","","#"&RC[13]&IF(RC[14]="","","#"&RC[14]&IF(RC[15]="","","#"&RC[15])))) -> 1#50#100#150#200 | F293: 28 | G293: 34 | H293: 38 | I293: 44 | K293: =R[-1]C -> 13439 | L293: =R[-1]C -> 10014 | M293: =R[-1]C -> 10004 | N293: =R[-1]C -> 10010 | O293: =R[-1]C -> 10008 | P293: =R[-1]C -> 1 | Q293: =R[-1]C -> 50 | R293: =R[-1]C -> 100 | S293: =R[-1]C -> 150 | T293: =R[-1]C -> 200 | U293: 同上
A294: 288 | B294: 50 | C294: =RC[3]&IF(RC[4]="","|200","|"&RC[4]&IF(RC[5]="","|200","|"&RC[5]&IF(RC[6]="","|200","|"&RC[6]&IF(RC[7]="","|200","|"&RC[7]&"|200")))) -> 28|34|38|44|200 | D294: =RC[7]&IF(RC[8]="","","#"&RC[8]&IF(RC[9]="","","#"&RC[9]&IF(RC[10]="","","#"&RC[10]&IF(RC[11]="","","#"&RC[11])))) -> 13439#10014#10004#10010#10008 | E294: =RC[11]&IF(RC[12]="","","#"&RC[12]&IF(RC[13]="","","#"&RC[13]&IF(RC[14]="","","#"&RC[14]&IF(RC[15]="","","#"&RC[15])))) -> 1#50#100#150#200 | F294: 28 | G294: 34 | H294: 38 | I294: 44 | K294: =R[-1]C -> 13439 | L294: =R[-1]C -> 10014 | M294: =R[-1]C -> 10004 | N294: =R[-1]C -> 10010 | O294: =R[-1]C -> 10008 | P294: =R[-1]C -> 1 | Q294: =R[-1]C -> 50 | R294: =R[-1]C -> 100 | S294: =R[-1]C -> 150 | T294: =R[-1]C -> 200 | U294: 同上
A295: 289 | B295: 50 | C295: =RC[3]&IF(RC[4]="","|200","|"&RC[4]&IF(RC[5]="","|200","|"&RC[5]&IF(RC[6]="","|200","|"&RC[6]&IF(RC[7]="","|200","|"&RC[7]&"|200")))) -> 28|34|38|44|200 | D295: =RC[7]&IF(RC[8]="","","#"&RC[8]&IF(RC[9]="","","#"&RC[9]&IF(RC[10]="","","#"&RC[10]&IF(RC[11]="","","#"&RC[11])))) -> 13439#10014#10004#10010#10008 | E295: =RC[11]&IF(RC[12]="","","#"&RC[12]&IF(RC[13]="","","#"&RC[13]&IF(RC[14]="","","#"&RC[14]&IF(RC[15]="","","#"&RC[15])))) -> 1#50#100#150#200 | F295: 28 | G295: 34 | H295: 38 | I295: 44 | K295: =R[-1]C -> 13439 | L295: =R[-1]C -> 10014 | M295: =R[-1]C -> 10004 | N295: =R[-1]C -> 10010 | O295: =R[-1]C -> 10008 | P295: =R[-1]C -> 1 | Q295: =R[-1]C -> 50 | R295: =R[-1]C -> 100 | S295: =R[-1]C -> 150 | T295: =R[-1]C -> 200 | U295: 同上
A296: 290 | B296: 50 | C296: =RC[3]&IF(RC[4]="","|200","|"&RC[4]&IF(RC[5]="","|200","|"&RC[5]&IF(RC[6]="","|200","|"&RC[6]&IF(RC[7]="","|200","|"&RC[7]&"|200")))) -> 28|34|38|44|200 | D296: =RC[7]&IF(RC[8]="","","#"&RC[8]&IF(RC[9]="","","#"&RC[9]&IF(RC[10]="","","#"&RC[10]&IF(RC[11]="","","#"&RC[11])))) -> 13439#10014#10004#10010#10008 | E296: =RC[11]&IF(RC[12]="","","#"&RC[12]&IF(RC[13]="","","#"&RC[13]&IF(RC[14]="","","#"&RC[14]&IF(RC[15]="","","#"&RC[15])))) -> 1#50#100#150#200 | F296: 28 | G296: 34 | H296: 38 | I296: 44 | K296: =R[-1]C -> 13439 | L296: =R[-1]C -> 10014 | M296: =R[-1]C -> 10004 | N296: =R[-1]C -> 10010 | O296: =R[-1]C -> 10008 | P296: =R[-1]C -> 1 | Q296: =R[-1]C -> 50 | R296: =R[-1]C -> 100 | S296: =R[-1]C -> 150 | T296: =R[-1]C -> 200 | U296: 同上
A297: 291 | B297: 50 | C297: =RC[3]&IF(RC[4]="","|200","|"&RC[4]&IF(RC[5]="","|200","|"&RC[5]&IF(RC[6]="","|200","|"&RC[6]&IF(RC[7]="","|200","|"&RC[7]&"|200")))) -> 28|34|38|44|200 | D297: =RC[7]&IF(RC[8]="","","#"&RC[8]&IF(RC[9]="","","#"&RC[9]&IF(RC[10]="","","#"&RC[10]&IF(RC[11]="","","#"&RC[11])))) -> 13439#10014#10004#10010#10008 | E297: =RC[11]&IF(RC[12]="","","#"&RC[12]&IF(RC[13]="","","#"&RC[13]&IF(RC[14]="","","#"&RC[14]&IF(RC[15]="","","#"&RC[15])))) -> 1#50#100#150#200 | F297: 28 | G297: 34 | H297: 38 | I297: 44 | K297: =R[-1]C -> 13439 | L297: =R[-1]C -> 10014 | M297: =R[-1]C -> 10004 | N297: =R[-1]C -> 10010 | O297: =R[-1]C -> 10008 | P297: =R[-1]C -> 1 | Q297: =R[-1]C -> 50 | R297: =R[-1]C -> 100 | S297: =R[-1]C -> 150 | T297: =R[-1]C -> 200 | U297: 同上
A298: 292 | B298: 50 | C298: =RC[3]&IF(RC[4]="","|200","|"&RC[4]&IF(RC[5]="","|200","|"&RC[5]&IF(RC[6]="","|200","|"&RC[6]&IF(RC[7]="","|200","|"&RC[7]&"|200")))) -> 28|34|38|44|200 | D298: =RC[7]&IF(RC[8]="","","#"&RC[8]&IF(RC[9]="","","#"&RC[9]&IF(RC[10]="","","#"&RC[10]&IF(RC[11]="","","#"&RC[11])))) -> 13439#10014#10004#10010#10008 | E298: =RC[11]&IF(RC[12]="","","#"&RC[12]&IF(RC[13]="","","#"&RC[13]&IF(RC[14]="","","#"&RC[14]&IF(RC[15]="","","#"&RC[15])))) -> 1#50#100#150#200 | F298: 28 | G298: 34 | H298: 38 | I298: 44 | K298: =R[-1]C -> 13439 | L298: =R[-1]C -> 10014 | M298: =R[-1]C -> 10004 | N298: =R[-1]C -> 10010 | O298: =R[-1]C -> 10008 | P298: =R[-1]C -> 1 | Q298: =R[-1]C -> 50 | R298: =R[-1]C -> 100 | S298: =R[-1]C -> 150 | T298: =R[-1]C -> 200 | U298: 同上
A299: 293 | B299: 50 | C299: =RC[3]&IF(RC[4]="","|200","|"&RC[4]&IF(RC[5]="","|200","|"&RC[5]&IF(RC[6]="","|200","|"&RC[6]&IF(RC[7]="","|200","|"&RC[7]&"|200")))) -> 28|34|38|44|200 | D299: =RC[7]&IF(RC[8]="","","#"&RC[8]&IF(RC[9]="","","#"&RC[9]&IF(RC[10]="","","#"&RC[10]&IF(RC[11]="","","#"&RC[11])))) -> 13439#10014#10004#10010#10008 | E299: =RC[11]&IF(RC[12]="","","#"&RC[12]&IF(RC[13]="","","#"&RC[13]&IF(RC[14]="","","#"&RC[14]&IF(RC[15]="","","#"&RC[15])))) -> 1#50#100#150#200 | F299: 28 | G299: 34 | H299: 38 | I299: 44 | K299: =R[-1]C -> 13439 | L299: =R[-1]C -> 10014 | M299: =R[-1]C -> 10004 | N299: =R[-1]C -> 10010 | O299: =R[-1]C -> 10008 | P299: =R[-1]C -> 1 | Q299: =R[-1]C -> 50 | R299: =R[-1]C -> 100 | S299: =R[-1]C -> 150 | T299: =R[-1]C -> 200 | U299: 同上
A300: 294 | B300: 50 | C300: =RC[3]&IF(RC[4]="","|200","|"&RC[4]&IF(RC[5]="","|200","|"&RC[5]&IF(RC[6]="","|200","|"&RC[6]&IF(RC[7]="","|200","|"&RC[7]&"|200")))) -> 28|34|38|44|200 | D300: =RC[7]&IF(RC[8]="","","#"&RC[8]&IF(RC[9]="","","#"&RC[9]&IF(RC[10]="","","#"&RC[10]&IF(RC[11]="","","#"&RC[11])))) -> 13439#10014#10004#10010#10008 | E300: =RC[11]&IF(RC[12]="","","#"&RC[12]&IF(RC[13]="","","#"&RC[13]&IF(RC[14]="","","#"&RC[14]&IF(RC[15]="","","#"&RC[15])))) -> 1#50#100#150#200 | F300: 28 | G300: 34 | H300: 38 | I300: 44 | K300: =R[-1]C -> 13439 | L300: =R[-1]C -> 10014 | M300: =R[-1]C -> 10004 | N300: =R[-1]C -> 10010 | O300: =R[-1]C -> 10008 | P300: =R[-1]C -> 1 | Q300: =R[-1]C -> 50 | R300: =R[-1]C -> 100 | S300: =R[-1]C -> 150 | T300: =R[-1]C -> 200 | U300: 同上
A301: 295 | B301: 50 | C301: =RC[3]&IF(RC[4]="","|200","|"&RC[4]&IF(RC[5]="","|200","|"&RC[5]&IF(RC[6]="","|200","|"&RC[6]&IF(RC[7]="","|200","|"&RC[7]&"|200")))) -> 28|34|38|44|200 | D301: =RC[7]&IF(RC[8]="","","#"&RC[8]&IF(RC[9]="","","#"&RC[9]&IF(RC[10]="","","#"&RC[10]&IF(RC[11]="","","#"&RC[11])))) -> 13439#10014#10004#10010#10008 | E301: =RC[11]&IF(RC[12]="","","#"&RC[12]&IF(RC[13]="","","#"&RC[13]&IF(RC[14]="","","#"&RC[14]&IF(RC[15]="","","#"&RC[15])))) -> 1#50#100#150#200 | F301: 28 | G301: 34 | H301: 38 | I301: 44 | K301: =R[-1]C -> 13439 | L301: =R[-1]C -> 10014 | M301: =R[-1]C -> 10004 | N301: =R[-1]C -> 10010 | O301: =R[-1]C -> 10008 | P301: =R[-1]C -> 1 | Q301: =R[-1]C -> 50 | R301: =R[-1]C -> 100 | S301: =R[-1]C -> 150 | T301: =R[-1]C -> 200 | U301: 同上
A302: 296 | B302: 50 | C302: =RC[3]&IF(RC[4]="","|200","|"&RC[4]&IF(RC[5]="","|200","|"&RC[5]&IF(RC[6]="","|200","|"&RC[6]&IF(RC[7]="","|200","|"&RC[7]&"|200")))) -> 28|34|38|44|200 | D302: =RC[7]&IF(RC[8]="","","#"&RC[8]&IF(RC[9]="","","#"&RC[9]&IF(RC[10]="","","#"&RC[10]&IF(RC[11]="","","#"&RC[11])))) -> 13439#10014#10004#10010#10008 | E302: =RC[11]&IF(RC[12]="","","#"&RC[12]&IF(RC[13]="","","#"&RC[13]&IF(RC[14]="","","#"&RC[14]&IF(RC[15]="","","#"&RC[15])))) -> 1#50#100#150#200 | F302: 28 | G302: 34 | H302: 38 | I302: 44 | K302: =R[-1]C -> 13439 | L302: =R[-1]C -> 10014 | M302: =R[-1]C -> 10004 | N302: =R[-1]C -> 10010 | O302: =R[-1]C -> 10008 | P302: =R[-1]C -> 1 | Q302: =R[-1]C -> 50 | R302: =R[-1]C -> 100 | S302: =R[-1]C -> 150 | T302: =R[-1]C -> 200 | U302: 同上
A303: 297 | B303: 50 | C303: =RC[3]&IF(RC[4]="","|200","|"&RC[4]&IF(RC[5]="","|200","|"&RC[5]&IF(RC[6]="","|200","|"&RC[6]&IF(RC[7]="","|200","|"&RC[7]&"|200")))) -> 28|34|38|44|200 | D303: =RC[7]&IF(RC[8]="","","#"&RC[8]&IF(RC[9]="","","#"&RC[9]&IF(RC[10]="","","#"&RC[10]&IF(RC[11]="","","#"&RC[11])))) -> 13439#10014#10004#10010#10008 | E303: =RC[11]&IF(RC[12]="","","#"&RC[12]&IF(RC[13]="","","#"&RC[13]&IF(RC[14]="","","#"&RC[14]&IF(RC[15]="","","#"&RC[15])))) -> 1#50#100#150#200 | F303: 28 | G303: 34 | H303: 38 | I303: 44 | K303: =R[-1]C -> 13439 | L303: =R[-1]C -> 10014 | M303: =R[-1]C -> 10004 | N303: =R[-1]C -> 10010 | O303: =R[-1]C -> 10008 | P303: =R[-1]C -> 1 | Q303: =R[-1]C -> 50 | R303: =R[-1]C -> 100 | S303: =R[-1]C -> 150 | T303: =R[-1]C -> 200 | U303: 同上
A304: 298 | B304: 50 | C304: =RC[3]&IF(RC[4]="","|200","|"&RC[4]&IF(RC[5]="","|200","|"&RC[5]&IF(RC[6]="","|200","|"&RC[6]&IF(RC[7]="","|200","|"&RC[7]&"|200")))) -> 28|34|38|44|200 | D304: =RC[7]&IF(RC[8]="","","#"&RC[8]&IF(RC[9]="","","#"&RC[9]&IF(RC[10]="","","#"&RC[10]&IF(RC[11]="","","#"&RC[11])))) -> 13439#10014#10004#10010#10008 | E304: =RC[11]&IF(RC[12]="","","#"&RC[12]&IF(RC[13]="","","#"&RC[13]&IF(RC[14]="","","#"&RC[14]&IF(RC[15]="","","#"&RC[15])))) -> 1#50#100#150#200 | F304: 28 | G304: 34 | H304: 38 | I304: 44 | K304: =R[-1]C -> 13439 | L304: =R[-1]C -> 10014 | M304: =R[-1]C -> 10004 | N304: =R[-1]C -> 10010 | O304: =R[-1]C -> 10008 | P304: =R[-1]C -> 1 | Q304: =R[-1]C -> 50 | R304: =R[-1]C -> 100 | S304: =R[-1]C -> 150 | T304: =R[-1]C -> 200 | U304: 同上
A305: 299 | B305: 50 | C305: =RC[3]&IF(RC[4]="","|200","|"&RC[4]&IF(RC[5]="","|200","|"&RC[5]&IF(RC[6]="","|200","|"&RC[6]&IF(RC[7]="","|200","|"&RC[7]&"|200")))) -> 28|34|38|44|200 | D305: =RC[7]&IF(RC[8]="","","#"&RC[8]&IF(RC[9]="","","#"&RC[9]&IF(RC[10]="","","#"&RC[10]&IF(RC[11]="","","#"&RC[11])))) -> 13439#10014#10004#10010#10008 | E305: =RC[11]&IF(RC[12]="","","#"&RC[12]&IF(RC[13]="","","#"&RC[13]&IF(RC[14]="","","#"&RC[14]&IF(RC[15]="","","#"&RC[15])))) -> 1#50#100#150#200 | F305: 28 | G305: 34 | H305: 38 | I305: 44 | K305: =R[-1]C -> 13439 | L305: =R[-1]C -> 10014 | M305: =R[-1]C -> 10004 | N305: =R[-1]C -> 10010 | O305: =R[-1]C -> 10008 | P305: =R[-1]C -> 1 | Q305: =R[-1]C -> 50 | R305: =R[-1]C -> 100 | S305: =R[-1]C -> 150 | T305: =R[-1]C -> 200 | U305: 同上
A306: 300 | B306: 50 | C306: =RC[3]&IF(RC[4]="","|200","|"&RC[4]&IF(RC[5]="","|200","|"&RC[5]&IF(RC[6]="","|200","|"&RC[6]&IF(RC[7]="","|200","|"&RC[7]&"|200")))) -> 28|34|38|44|200 | D306: =RC[7]&IF(RC[8]="","","#"&RC[8]&IF(RC[9]="","","#"&RC[9]&IF(RC[10]="","","#"&RC[10]&IF(RC[11]="","","#"&RC[11])))) -> 13439#10014#10004#10010#10008 | E306: =RC[11]&IF(RC[12]="","","#"&RC[12]&IF(RC[13]="","","#"&RC[13]&IF(RC[14]="","","#"&RC[14]&IF(RC[15]="","","#"&RC[15])))) -> 1#50#100#150#200 | F306: 28 | G306: 34 | H306: 38 | I306: 44 | K306: =R[-1]C -> 13439 | L306: =R[-1]C -> 10014 | M306: =R[-1]C -> 10004 | N306: =R[-1]C -> 10010 | O306: =R[-1]C -> 10008 | P306: =R[-1]C -> 1 | Q306: =R[-1]C -> 50 | R306: =R[-1]C -> 100 | S306: =R[-1]C -> 150 | T306: =R[-1]C -> 200 | U306: 同上

Sheet: 世界等级任务ID列表
A1: task_level|task_level | B1: exp|exp | C1: |task_id_list
A2: 不可空 | B2: 不可空 | C2: 可空#不需字段
A3: 数字 | B3: 数字 | C3: 一维数组
C4: 不定长
A6: 等级 | B6: 经验 | C6: 随机任务ID列表 | D6: 升级经验
A7: 1 | B7: =MIN(ROUND(RC[2]*RC[3]/5,0)*5,10000000) -> 50 | C7: =VLOOKUP(RC[-2]*10+10001,世界等级任务事件!C[-2],1,FALSE)&IFERROR("|"&VLOOKUP(RC[-2]*10+10002,世界等级任务事件!C[-2],1,FALSE)&IFERROR("|"&VLOOKUP(RC[-2]*10+10003,世界等级任务事件!C[-2],1,FALSE)&IFERROR("|"&VLOOKUP(RC[-2]*10+10004,世界等级任务事件!C[-2],1,FALSE)&IFERROR("|"&VLOOKUP(RC[-2]*10+10005,世界等级任务事件!C[-2],1,FALSE),""),""),""),"") -> 10011 | D7: 10 | E7: 5 | F7: =ROUND(RC[-4]/RC[-2]*100,2)&"%" -> 500%
A8: 2 | B8: =MIN(ROUND(RC[2]*RC[3]/5,0)*5,10000000) -> 50 | C8: =VLOOKUP(RC[-2]*10+10001,世界等级任务事件!C[-2],1,FALSE)&IFERROR("|"&VLOOKUP(RC[-2]*10+10002,世界等级任务事件!C[-2],1,FALSE)&IFERROR("|"&VLOOKUP(RC[-2]*10+10003,世界等级任务事件!C[-2],1,FALSE)&IFERROR("|"&VLOOKUP(RC[-2]*10+10004,世界等级任务事件!C[-2],1,FALSE)&IFERROR("|"&VLOOKUP(RC[-2]*10+10005,世界等级任务事件!C[-2],1,FALSE),""),""),""),"") -> 10021 | D8: 20 | E8: 2.5 | F8: =ROUND(RC[-4]/RC[-2]*100,2)&"%" -> 250%
A9: 3 | B9: =MIN(ROUND(RC[2]*RC[3]/5,0)*5,10000000) -> 60 | C9: =VLOOKUP(RC[-2]*10+10001,世界等级任务事件!C[-2],1,FALSE)&IFERROR("|"&VLOOKUP(RC[-2]*10+10002,世界等级任务事件!C[-2],1,FALSE)&IFERROR("|"&VLOOKUP(RC[-2]*10+10003,世界等级任务事件!C[-2],1,FALSE)&IFERROR("|"&VLOOKUP(RC[-2]*10+10004,世界等级任务事件!C[-2],1,FALSE)&IFERROR("|"&VLOOKUP(RC[-2]*10+10005,世界等级任务事件!C[-2],1,FALSE),""),""),""),"") -> 10031 | D9: 30 | E9: 2 | F9: =ROUND(RC[-4]/RC[-2]*100,2)&"%" -> 200%
A10: 4 | B10: =MIN(ROUND(RC[2]*RC[3]/5,0)*5,10000000) -> 60 | C10: =VLOOKUP(RC[-2]*10+10001,世界等级任务事件!C[-2],1,FALSE)&IFERROR("|"&VLOOKUP(RC[-2]*10+10002,世界等级任务事件!C[-2],1,FALSE)&IFERROR("|"&VLOOKUP(RC[-2]*10+10003,世界等级任务事件!C[-2],1,FALSE)&IFERROR("|"&VLOOKUP(RC[-2]*10+10004,世界等级任务事件!C[-2],1,FALSE)&IFERROR("|"&VLOOKUP(RC[-2]*10+10005,世界等级任务事件!C[-2],1,FALSE),""),""),""),"") -> 10041 | D10: 40 | E10: 1.5 | F10: =ROUND(RC[-4]/RC[-2]*100,2)&"%" -> 150%
A11: 5 | B11: =MIN(ROUND(RC[2]*RC[3]/5,0)*5,10000000) -> 60 | C11: =VLOOKUP(RC[-2]*10+10001,世界等级任务事件!C[-2],1,FALSE)&IFERROR("|"&VLOOKUP(RC[-2]*10+10002,世界等级任务事件!C[-2],1,FALSE)&IFERROR("|"&VLOOKUP(RC[-2]*10+10003,世界等级任务事件!C[-2],1,FALSE)&IFERROR("|"&VLOOKUP(RC[-2]*10+10004,世界等级任务事件!C[-2],1,FALSE)&IFERROR("|"&VLOOKUP(RC[-2]*10+10005,世界等级任务事件!C[-2],1,FALSE),""),""),""),"") -> 10051 | D11: 60 | E11: 1 | F11: =ROUND(RC[-4]/RC[-2]*100,2)&"%" -> 100%
A12: 6 | B12: =MIN(ROUND(RC[2]*RC[3]/5,0)*5,10000000) -> 70 | C12: =VLOOKUP(RC[-2]*10+10001,世界等级任务事件!C[-2],1,FALSE)&IFERROR("|"&VLOOKUP(RC[-2]*10+10002,世界等级任务事件!C[-2],1,FALSE)&IFERROR("|"&VLOOKUP(RC[-2]*10+10003,世界等级任务事件!C[-2],1,FALSE)&IFERROR("|"&VLOOKUP(RC[-2]*10+10004,世界等级任务事件!C[-2],1,FALSE)&IFERROR("|"&VLOOKUP(RC[-2]*10+10005,世界等级任务事件!C[-2],1,FALSE),""),""),""),"") -> 10061 | D12: 70 | E12: 1 | F12: =ROUND(RC[-4]/RC[-2]*100,2)&"%" -> 100%
A13: 7 | B13: =MIN(ROUND(RC[2]*RC[3]/5,0)*5,10000000) -> 80 | C13: =VLOOKUP(RC[-2]*10+10001,世界等级任务事件!C[-2],1,FALSE)&IFERROR("|"&VLOOKUP(RC[-2]*10+10002,世界等级任务事件!C[-2],1,FALSE)&IFERROR("|"&VLOOKUP(RC[-2]*10+10003,世界等级任务事件!C[-2],1,FALSE)&IFERROR("|"&VLOOKUP(RC[-2]*10+10004,世界等级任务事件!C[-2],1,FALSE)&IFERROR("|"&VLOOKUP(RC[-2]*10+10005,世界等级任务事件!C[-2],1,FALSE),""),""),""),"") -> 10071 | D13: 80 | E13: 1 | F13: =ROUND(RC[-4]/RC[-2]*100,2)&"%" -> 100%
A14: 8 | B14: =MIN(ROUND(RC[2]*RC[3]/5,0)*5,10000000) -> 90 | C14: =VLOOKUP(RC[-2]*10+10001,世界等级任务事件!C[-2],1,FALSE)&IFERROR("|"&VLOOKUP(RC[-2]*10+10002,世界等级任务事件!C[-2],1,FALSE)&IFERROR("|"&VLOOKUP(RC[-2]*10+10003,世界等级任务事件!C[-2],1,FALSE)&IFERROR("|"&VLOOKUP(RC[-2]*10+10004,世界等级任务事件!C[-2],1,FALSE)&IFERROR("|"&VLOOKUP(RC[-2]*10+10005,世界等级任务事件!C[-2],1,FALSE),""),""),""),"") -> 10081 | D14: 90 | E14: 1 | F14: =ROUND(RC[-4]/RC[-2]*100,2)&"%" -> 100%
A15: 9 | B15: =MIN(ROUND(RC[2]*RC[3]/5,0)*5,10000000) -> 100 | C15: =VLOOKUP(RC[-2]*10+10001,世界等级任务事件!C[-2],1,FALSE)&IFERROR("|"&VLOOKUP(RC[-2]*10+10002,世界等级任务事件!C[-2],1,FALSE)&IFERROR("|"&VLOOKUP(RC[-2]*10+10003,世界等级任务事件!C[-2],1,FALSE)&IFERROR("|"&VLOOKUP(RC[-2]*10+10004,世界等级任务事件!C[-2],1,FALSE)&IFERROR("|"&VLOOKUP(RC[-2]*10+10005,世界等级任务事件!C[-2],1,FALSE),""),""),""),"") -> 10091 | D15: 100 | E15: 1 | F15: =ROUND(RC[-4]/RC[-2]*100,2)&"%" -> 100%
A16: 10 | B16: =MIN(ROUND(RC[2]*RC[3]/5,0)*5,10000000) -> 160 | C16: =VLOOKUP(RC[-2]*10+10001,世界等级任务事件!C[-2],1,FALSE)&IFERROR("|"&VLOOKUP(RC[-2]*10+10002,世界等级任务事件!C[-2],1,FALSE)&IFERROR("|"&VLOOKUP(RC[-2]*10+10003,世界等级任务事件!C[-2],1,FALSE)&IFERROR("|"&VLOOKUP(RC[-2]*10+10004,世界等级任务事件!C[-2],1,FALSE)&IFERROR("|"&VLOOKUP(RC[-2]*10+10005,世界等级任务事件!C[-2],1,FALSE),""),""),""),"") -> 10101 | D16: 160 | E16: 1 | F16: =ROUND(RC[-4]/RC[-2]*100,2)&"%" -> 100%
A17: 11 | B17: =MIN(ROUND(RC[2]*RC[3]/5,0)*5,10000000) -> 330 | C17: =VLOOKUP(RC[-2]*10+10001,世界等级任务事件!C[-2],1,FALSE)&IFERROR("|"&VLOOKUP(RC[-2]*10+10002,世界等级任务事件!C[-2],1,FALSE)&IFERROR("|"&VLOOKUP(RC[-2]*10+10003,世界等级任务事件!C[-2],1,FALSE)&IFERROR("|"&VLOOKUP(RC[-2]*10+10004,世界等级任务事件!C[-2],1,FALSE)&IFERROR("|"&VLOOKUP(RC[-2]*10+10005,世界等级任务事件!C[-2],1,FALSE),""),""),""),"") -> 10111 | D17: 330 | E17: 1 | F17: =ROUND(RC[-4]/RC[-2]*100,2)&"%" -> 100%
A18: 12 | B18: =MIN(ROUND(RC[2]*RC[3]/5,0)*5,10000000) -> 465 | C18: =VLOOKUP(RC[-2]*10+10001,世界等级任务事件!C[-2],1,FALSE)&IFERROR("|"&VLOOKUP(RC[-2]*10+10002,世界等级任务事件!C[-2],1,FALSE)&IFERROR("|"&VLOOKUP(RC[-2]*10+10003,世界等级任务事件!C[-2],1,FALSE)&IFERROR("|"&VLOOKUP(RC[-2]*10+10004,世界等级任务事件!C[-2],1,FALSE)&IFERROR("|"&VLOOKUP(RC[-2]*10+10005,世界等级任务事件!C[-2],1,FALSE),""),""),""),"") -> 10121 | D18: 465 | E18: 1 | F18: =ROUND(RC[-4]/RC[-2]*100,2)&"%" -> 100%
A19: 13 | B19: =MIN(ROUND(RC[2]*RC[3]/5,0)*5,10000000) -> 505 | C19: =VLOOKUP(RC[-2]*10+10001,世界等级任务事件!C[-2],1,FALSE)&IFERROR("|"&VLOOKUP(RC[-2]*10+10002,世界等级任务事件!C[-2],1,FALSE)&IFERROR("|"&VLOOKUP(RC[-2]*10+10003,世界等级任务事件!C[-2],1,FALSE)&IFERROR("|"&VLOOKUP(RC[-2]*10+10004,世界等级任务事件!C[-2],1,FALSE)&IFERROR("|"&VLOOKUP(RC[-2]*10+10005,世界等级任务事件!C[-2],1,FALSE),""),""),""),"") -> 10131|10132|10133 | D19: 505 | E19: 1 | F19: =ROUND(RC[-4]/RC[-2]*100,2)&"%" -> 100%
A20: 14 | B20: =MIN(ROUND(RC[2]*RC[3]/5,0)*5,10000000) -> 540 | C20: =VLOOKUP(RC[-2]*10+10001,世界等级任务事件!C[-2],1,FALSE)&IFERROR("|"&VLOOKUP(RC[-2]*10+10002,世界等级任务事件!C[-2],1,FALSE)&IFERROR("|"&VLOOKUP(RC[-2]*10+10003,世界等级任务事件!C[-2],1,FALSE)&IFERROR("|"&VLOOKUP(RC[-2]*10+10004,世界等级任务事件!C[-2],1,FALSE)&IFERROR("|"&VLOOKUP(RC[-2]*10+10005,世界等级任务事件!C[-2],1,FALSE),""),""),""),"") -> 10141 | D20: 540 | E20: 1 | F20: =ROUND(RC[-4]/RC[-2]*100,2)&"%" -> 100%
A21: 15 | B21: =MIN(ROUND(RC[2]*RC[3]/5,0)*5,10000000) -> 820 | C21: =VLOOKUP(RC[-2]*10+10001,世界等级任务事件!C[-2],1,FALSE)&IFERROR("|"&VLOOKUP(RC[-2]*10+10002,世界等级任务事件!C[-2],1,FALSE)&IFERROR("|"&VLOOKUP(RC[-2]*10+10003,世界等级任务事件!C[-2],1,FALSE)&IFERROR("|"&VLOOKUP(RC[-2]*10+10004,世界等级任务事件!C[-2],1,FALSE)&IFERROR("|"&VLOOKUP(RC[-2]*10+10005,世界等级任务事件!C[-2],1,FALSE),""),""),""),"") -> 10151 | D21: 820 | E21: 1 | F21: =ROUND(RC[-4]/RC[-2]*100,2)&"%" -> 100%
A22: 16 | B22: =MIN(ROUND(RC[2]*RC[3]/5,0)*5,10000000) -> 830 | C22: =VLOOKUP(RC[-2]*10+10001,世界等级任务事件!C[-2],1,FALSE)&IFERROR("|"&VLOOKUP(RC[-2]*10+10002,世界等级任务事件!C[-2],1,FALSE)&IFERROR("|"&VLOOKUP(RC[-2]*10+10003,世界等级任务事件!C[-2],1,FALSE)&IFERROR("|"&VLOOKUP(RC[-2]*10+10004,世界等级任务事件!C[-2],1,FALSE)&IFERROR("|"&VLOOKUP(RC[-2]*10+10005,世界等级任务事件!C[-2],1,FALSE),""),""),""),"") -> 10161|10162 | D22: 875 | E22: 0.95 | F22: =ROUND(RC[-4]/RC[-2]*100,2)&"%" -> 94.86%
A23: 17 | B23: =MIN(ROUND(RC[2]*RC[3]/5,0)*5,10000000) -> 1075 | C23: =VLOOKUP(RC[-2]*10+10001,世界等级任务事件!C[-2],1,FALSE)&IFERROR("|"&VLOOKUP(RC[-2]*10+10002,世界等级任务事件!C[-2],1,FALSE)&IFERROR("|"&VLOOKUP(RC[-2]*10+10003,世界等级任务事件!C[-2],1,FALSE)&IFERROR("|"&VLOOKUP(RC[-2]*10+10004,世界等级任务事件!C[-2],1,FALSE)&IFERROR("|"&VLOOKUP(RC[-2]*10+10005,世界等级任务事件!C[-2],1,FALSE),""),""),""),"") -> 10171 | D23: 1195 | E23: 0.9 | F23: =ROUND(RC[-4]/RC[-2]*100,2)&"%" -> 89.96%
A24: 18 | B24: =MIN(ROUND(RC[2]*RC[3]/5,0)*5,10000000) -> 1075 | C24: =VLOOKUP(RC[-2]*10+10001,世界等级任务事件!C[-2],1,FALSE)&IFERROR("|"&VLOOKUP(RC[-2]*10+10002,世界等级任务事件!C[-2],1,FALSE)&IFERROR("|"&VLOOKUP(RC[-2]*10+10003,世界等级任务事件!C[-2],1,FALSE)&IFERROR("|"&VLOOKUP(RC[-2]*10+10004,世界等级任务事件!C[-2],1,FALSE)&IFERROR("|"&VLOOKUP(RC[-2]*10+10005,世界等级任务事件!C[-2],1,FALSE),""),""),""),"") -> 10181 | D24: 1265 | E24: 0.85 | F24: =ROUND(RC[-4]/RC[-2]*100,2)&"%" -> 84.98%
A25: 19 | B25: =MIN(ROUND(RC[2]*RC[3]/5,0)*5,10000000) -> 1310 | C25: =VLOOKUP(RC[-2]*10+10001,世界等级任务事件!C[-2],1,FALSE)&IFERROR("|"&VLOOKUP(RC[-2]*10+10002,世界等级任务事件!C[-2],1,FALSE)&IFERROR("|"&VLOOKUP(RC[-2]*10+10003,世界等级任务事件!C[-2],1,FALSE)&IFERROR("|"&VLOOKUP(RC[-2]*10+10004,世界等级任务事件!C[-2],1,FALSE)&IFERROR("|"&VLOOKUP(RC[-2]*10+10005,世界等级任务事件!C[-2],1,FALSE),""),""),""),"") -> 10191 | D25: 1635 | E25: 0.8 | F25: =ROUND(RC[-4]/RC[-2]*100,2)&"%" -> 80.12%
A26: 20 | B26: =MIN(ROUND(RC[2]*RC[3]/5,0)*5,10000000) -> 1325 | C26: =VLOOKUP(RC[-2]*10+10001,世界等级任务事件!C[-2],1,FALSE)&IFERROR("|"&VLOOKUP(RC[-2]*10+10002,世界等级任务事件!C[-2],1,FALSE)&IFERROR("|"&VLOOKUP(RC[-2]*10+10003,世界等级任务事件!C[-2],1,FALSE)&IFERROR("|"&VLOOKUP(RC[-2]*10+10004,世界等级任务事件!C[-2],1,FALSE)&IFERROR("|"&VLOOKUP(RC[-2]*10+10005,世界等级任务事件!C[-2],1,FALSE),""),""),""),"") -> 10201 | D26: 1765 | E26: 0.75 | F26: =ROUND(RC[-4]/RC[-2]*100,2)&"%" -> 75.07%
A27: 21 | B27: =MIN(ROUND(RC[2]*RC[3]/5,0)*5,10000000) -> 1440 | C27: =VLOOKUP(RC[-2]*10+10001,世界等级任务事件!C[-2],1,FALSE)&IFERROR("|"&VLOOKUP(RC[-2]*10+10002,世界等级任务事件!C[-2],1,FALSE)&IFERROR("|"&VLOOKUP(RC[-2]*10+10003,世界等级任务事件!C[-2],1,FALSE)&IFERROR("|"&VLOOKUP(RC[-2]*10+10004,世界等级任务事件!C[-2],1,FALSE)&IFERROR("|"&VLOOKUP(RC[-2]*10+10005,世界等级任务事件!C[-2],1,FALSE),""),""),""),"") -> 10211 | D27: 2060 | E27: 0.7 | F27: =ROUND(RC[-4]/RC[-2]*100,2)&"%" -> 69.9%
A28: 22 | B28: =MIN(ROUND(RC[2]*RC[3]/5,0)*5,10000000) -> 1765 | C28: =VLOOKUP(RC[-2]*10+10001,世界等级任务事件!C[-2],1,FALSE)&IFERROR("|"&VLOOKUP(RC[-2]*10+10002,世界等级任务事件!C[-2],1,FALSE)&IFERROR("|"&VLOOKUP(RC[-2]*10+10003,世界等级任务事件!C[-2],1,FALSE)&IFERROR("|"&VLOOKUP(RC[-2]*10+10004,世界等级任务事件!C[-2],1,FALSE)&IFERROR("|"&VLOOKUP(RC[-2]*10+10005,世界等级任务事件!C[-2],1,FALSE),""),""),""),"") -> 10221 | D28: 2520 | E28: 0.7 | F28: =ROUND(RC[-4]/RC[-2]*100,2)&"%" -> 70.04%
A29: 23 | B29: =MIN(ROUND(RC[2]*RC[3]/5,0)*5,10000000) -> 1840 | C29: =VLOOKUP(RC[-2]*10+10001,世界等级任务事件!C[-2],1,FALSE)&IFERROR("|"&VLOOKUP(RC[-2]*10+10002,世界等级任务事件!C[-2],1,FALSE)&IFERROR("|"&VLOOKUP(RC[-2]*10+10003,世界等级任务事件!C[-2],1,FALSE)&IFERROR("|"&VLOOKUP(RC[-2]*10+10004,世界等级任务事件!C[-2],1,FALSE)&IFERROR("|"&VLOOKUP(RC[-2]*10+10005,世界等级任务事件!C[-2],1,FALSE),""),""),""),"") -> 10231 | D29: 2630 | E29: 0.7 | F29: =ROUND(RC[-4]/RC[-2]*100,2)&"%" -> 69.96%
A30: 24 | B30: =MIN(ROUND(RC[2]*RC[3]/5,0)*5,10000000) -> 2245 | C30: =VLOOKUP(RC[-2]*10+10001,世界等级任务事件!C[-2],1,FALSE)&IFERROR("|"&VLOOKUP(RC[-2]*10+10002,世界等级任务事件!C[-2],1,FALSE)&IFERROR("|"&VLOOKUP(RC[-2]*10+10003,世界等级任务事件!C[-2],1,FALSE)&IFERROR("|"&VLOOKUP(RC[-2]*10+10004,世界等级任务事件!C[-2],1,FALSE)&IFERROR("|"&VLOOKUP(RC[-2]*10+10005,世界等级任务事件!C[-2],1,FALSE),""),""),""),"") -> 10241 | D30: 3205 | E30: 0.7 | F30: =ROUND(RC[-4]/RC[-2]*100,2)&"%" -> 70.05%
A31: 25 | B31: =MIN(ROUND(RC[2]*RC[3]/5,0)*5,10000000) -> 2925 | C31: =VLOOKUP(RC[-2]*10+10001,世界等级任务事件!C[-2],1,FALSE)&IFERROR("|"&VLOOKUP(RC[-2]*10+10002,世界等级任务事件!C[-2],1,FALSE)&IFERROR("|"&VLOOKUP(RC[-2]*10+10003,世界等级任务事件!C[-2],1,FALSE)&IFERROR("|"&VLOOKUP(RC[-2]*10+10004,世界等级任务事件!C[-2],1,FALSE)&IFERROR("|"&VLOOKUP(RC[-2]*10+10005,世界等级任务事件!C[-2],1,FALSE),""),""),""),"") -> 10251 | D31: 4175 | E31: 0.7 | F31: =ROUND(RC[-4]/RC[-2]*100,2)&"%" -> 70.06%
A32: 26 | B32: =MIN(ROUND(RC[2]*RC[3]/5,0)*5,10000000) -> 3385 | C32: =VLOOKUP(RC[-2]*10+10001,世界等级任务事件!C[-2],1,FALSE)&IFERROR("|"&VLOOKUP(RC[-2]*10+10002,世界等级任务事件!C[-2],1,FALSE)&IFERROR("|"&VLOOKUP(RC[-2]*10+10003,世界等级任务事件!C[-2],1,FALSE)&IFERROR("|"&VLOOKUP(RC[-2]*10+10004,世界等级任务事件!C[-2],1,FALSE)&IFERROR("|"&VLOOKUP(RC[-2]*10+10005,世界等级任务事件!C[-2],1,FALSE),""),""),""),"") -> 10261 | D32: 5645 | E32: 0.6 | F32: =ROUND(RC[-4]/RC[-2]*100,2)&"%" -> 59.96%
A33: 27 | B33: =MIN(ROUND(RC[2]*RC[3]/5,0)*5,10000000) -> 4435 | C33: =VLOOKUP(RC[-2]*10+10001,世界等级任务事件!C[-2],1,FALSE)&IFERROR("|"&VLOOKUP(RC[-2]*10+10002,世界等级任务事件!C[-2],1,FALSE)&IFERROR("|"&VLOOKUP(RC[-2]*10+10003,世界等级任务事件!C[-2],1,FALSE)&IFERROR("|"&VLOOKUP(RC[-2]*10+10004,世界等级任务事件!C[-2],1,FALSE)&IFERROR("|"&VLOOKUP(RC[-2]*10+10005,世界等级任务事件!C[-2],1,FALSE),""),""),""),"") -> 10271 | D33: 7390 | E33: 0.6 | F33: =ROUND(RC[-4]/RC[-2]*100,2)&"%" -> 60.01%
A34: 28 | B34: =MIN(ROUND(RC[2]*RC[3]/5,0)*5,10000000) -> 5465 | C34: =VLOOKUP(RC[-2]*10+10001,世界等级任务事件!C[-2],1,FALSE)&IFERROR("|"&VLOOKUP(RC[-2]*10+10002,世界等级任务事件!C[-2],1,FALSE)&IFERROR("|"&VLOOKUP(RC[-2]*10+10003,世界等级任务事件!C[-2],1,FALSE)&IFERROR("|"&VLOOKUP(RC[-2]*10+10004,世界等级任务事件!C[-2],1,FALSE)&IFERROR("|"&VLOOKUP(RC[-2]*10+10005,世界等级任务事件!C[-2],1,FALSE),""),""),""),"") -> 10281|10282 | D34: 9105 | E34: 0.6 | F34: =ROUND(RC[-4]/RC[-2]*100,2)&"%" -> 60.02%
A35: 29 | B35: =MIN(ROUND(RC[2]*RC[3]/5,0)*5,10000000) -> 6555 | C35: =VLOOKUP(RC[-2]*10+10001,世界等级任务事件!C[-2],1,FALSE)&IFERROR("|"&VLOOKUP(RC[-2]*10+10002,世界等级任务事件!C[-2],1,FALSE)&IFERROR("|"&VLOOKUP(RC[-2]*10+10003,世界等级任务事件!C[-2],1,FALSE)&IFERROR("|"&VLOOKUP(RC[-2]*10+10004,世界等级任务事件!C[-2],1,FALSE)&IFERROR("|"&VLOOKUP(RC[-2]*10+10005,世界等级任务事件!C[-2],1,FALSE),""),""),""),"") -> 10291 | D35: 10925 | E35: 0.6 | F35: =ROUND(RC[-4]/RC[-2]*100,2)&"%" -> 60%
A36: 30 | B36: =MIN(ROUND(RC[2]*RC[3]/5,0)*5,10000000) -> 8015 | C36: =VLOOKUP(RC[-2]*10+10001,世界等级任务事件!C[-2],1,FALSE)&IFERROR("|"&VLOOKUP(RC[-2]*10+10002,世界等级任务事件!C[-2],1,FALSE)&IFERROR("|"&VLOOKUP(RC[-2]*10+10003,世界等级任务事件!C[-2],1,FALSE)&IFERROR("|"&VLOOKUP(RC[-2]*10+10004,世界等级任务事件!C[-2],1,FALSE)&IFERROR("|"&VLOOKUP(RC[-2]*10+10005,世界等级任务事件!C[-2],1,FALSE),""),""),""),"") -> 10301 | D36: 13360 | E36: 0.6 | F36: =ROUND(RC[-4]/RC[-2]*100,2)&"%" -> 59.99%
A37: 31 | B37: =MIN(ROUND(RC[2]*RC[3]/5,0)*5,10000000) -> 8180 | C37: =VLOOKUP(RC[-2]*10+10001,世界等级任务事件!C[-2],1,FALSE)&IFERROR("|"&VLOOKUP(RC[-2]*10+10002,世界等级任务事件!C[-2],1,FALSE)&IFERROR("|"&VLOOKUP(RC[-2]*10+10003,世界等级任务事件!C[-2],1,FALSE)&IFERROR("|"&VLOOKUP(RC[-2]*10+10004,世界等级任务事件!C[-2],1,FALSE)&IFERROR("|"&VLOOKUP(RC[-2]*10+10005,世界等级任务事件!C[-2],1,FALSE),""),""),""),"") -> 10311|10312 | D37: 16355 | E37: 0.5 | F37: =ROUND(RC[-4]/RC[-2]*100,2)&"%" -> 50.02%
A38: 32 | B38: =MIN(ROUND(RC[2]*RC[3]/5,0)*5,10000000) -> 9815 | C38: =VLOOKUP(RC[-2]*10+10001,世界等级任务事件!C[-2],1,FALSE)&IFERROR("|"&VLOOKUP(RC[-2]*10+10002,世界等级任务事件!C[-2],1,FALSE)&IFERROR("|"&VLOOKUP(RC[-2]*10+10003,世界等级任务事件!C[-2],1,FALSE)&IFERROR("|"&VLOOKUP(RC[-2]*10+10004,世界等级任务事件!C[-2],1,FALSE)&IFERROR("|"&VLOOKUP(RC[-2]*10+10005,世界等级任务事件!C[-2],1,FALSE),""),""),""),"") -> 10321|10322 | D38: 19625 | E38: 0.5 | F38: =ROUND(RC[-4]/RC[-2]*100,2)&"%" -> 50.01%
A39: 33 | B39: =MIN(ROUND(RC[2]*RC[3]/5,0)*5,10000000) -> 12110 | C39: =VLOOKUP(RC[-2]*10+10001,世界等级任务事件!C[-2],1,FALSE)&IFERROR("|"&VLOOKUP(RC[-2]*10+10002,世界等级任务事件!C[-2],1,FALSE)&IFERROR("|"&VLOOKUP(RC[-2]*10+10003,世界等级任务事件!C[-2],1,FALSE)&IFERROR("|"&VLOOKUP(RC[-2]*10+10004,世界等级任务事件!C[-2],1,FALSE)&IFERROR("|"&VLOOKUP(RC[-2]*10+10005,世界等级任务事件!C[-2],1,FALSE),""),""),""),"") -> 10331 | D39: 24220 | E39: 0.5 | F39: =ROUND(RC[-4]/RC[-2]*100,2)&"%" -> 50%
A40: 34 | B40: =MIN(ROUND(RC[2]*RC[3]/5,0)*5,10000000) -> 14015 | C40: =VLOOKUP(RC[-2]*10+10001,世界等级任务事件!C[-2],1,FALSE)&IFERROR("|"&VLOOKUP(RC[-2]*10+10002,世界等级任务事件!C[-2],1,FALSE)&IFERROR("|"&VLOOKUP(RC[-2]*10+10003,世界等级任务事件!C[-2],1,FALSE)&IFERROR("|"&VLOOKUP(RC[-2]*10+10004,世界等级任务事件!C[-2],1,FALSE)&IFERROR("|"&VLOOKUP(RC[-2]*10+10005,世界等级任务事件!C[-2],1,FALSE),""),""),""),"") -> 10341 | D40: 28025 | E40: 0.5 | F40: =ROUND(RC[-4]/RC[-2]*100,2)&"%" -> 50.01%
A41: 35 | B41: =MIN(ROUND(RC[2]*RC[3]/5,0)*5,10000000) -> 17155 | C41: =VLOOKUP(RC[-2]*10+10001,世界等级任务事件!C[-2],1,FALSE)&IFERROR("|"&VLOOKUP(RC[-2]*10+10002,世界等级任务事件!C[-2],1,FALSE)&IFERROR("|"&VLOOKUP(RC[-2]*10+10003,世界等级任务事件!C[-2],1,FALSE)&IFERROR("|"&VLOOKUP(RC[-2]*10+10004,世界等级任务事件!C[-2],1,FALSE)&IFERROR("|"&VLOOKUP(RC[-2]*10+10005,世界等级任务事件!C[-2],1,FALSE),""),""),""),"") -> 10351|10352 | D41: 34305 | E41: 0.5 | F41: =ROUND(RC[-4]/RC[-2]*100,2)&"%" -> 50.01%
A42: 36 | B42: =MIN(ROUND(RC[2]*RC[3]/5,0)*5,10000000) -> 18080 | C42: =VLOOKUP(RC[-2]*10+10001,世界等级任务事件!C[-2],1,FALSE)&IFERROR("|"&VLOOKUP(RC[-2]*10+10002,世界等级任务事件!C[-2],1,FALSE)&IFERROR("|"&VLOOKUP(RC[-2]*10+10003,世界等级任务事件!C[-2],1,FALSE)&IFERROR("|"&VLOOKUP(RC[-2]*10+10004,世界等级任务事件!C[-2],1,FALSE)&IFERROR("|"&VLOOKUP(RC[-2]*10+10005,世界等级任务事件!C[-2],1,FALSE),""),""),""),"") -> 10361|10362 | D42: 40175 | E42: 0.45 | F42: =ROUND(RC[-4]/RC[-2]*100,2)&"%" -> 45%
A43: 37 | B43: =MIN(ROUND(RC[2]*RC[3]/5,0)*5,10000000) -> 21310 | C43: =VLOOKUP(RC[-2]*10+10001,世界等级任务事件!C[-2],1,FALSE)&IFERROR("|"&VLOOKUP(RC[-2]*10+10002,世界等级任务事件!C[-2],1,FALSE)&IFERROR("|"&VLOOKUP(RC[-2]*10+10003,世界等级任务事件!C[-2],1,FALSE)&IFERROR("|"&VLOOKUP(RC[-2]*10+10004,世界等级任务事件!C[-2],1,FALSE)&IFERROR("|"&VLOOKUP(RC[-2]*10+10005,世界等级任务事件!C[-2],1,FALSE),""),""),""),"") -> 10371|10372 | D43: 47355 | E43: 0.45 | F43: =ROUND(RC[-4]/RC[-2]*100,2)&"%" -> 45%
A44: 38 | B44: =MIN(ROUND(RC[2]*RC[3]/5,0)*5,10000000) -> 24260 | C44: =VLOOKUP(RC[-2]*10+10001,世界等级任务事件!C[-2],1,FALSE)&IFERROR("|"&VLOOKUP(RC[-2]*10+10002,世界等级任务事件!C[-2],1,FALSE)&IFERROR("|"&VLOOKUP(RC[-2]*10+10003,世界等级任务事件!C[-2],1,FALSE)&IFERROR("|"&VLOOKUP(RC[-2]*10+10004,世界等级任务事件!C[-2],1,FALSE)&IFERROR("|"&VLOOKUP(RC[-2]*10+10005,世界等级任务事件!C[-2],1,FALSE),""),""),""),"") -> 10381|10382|10383|10384 | D44: 53910 | E44: 0.45 | F44: =ROUND(RC[-4]/RC[-2]*100,2)&"%" -> 45%
A45: 39 | B45: =MIN(ROUND(RC[2]*RC[3]/5,0)*5,10000000) -> 27335 | C45: =VLOOKUP(RC[-2]*10+10001,世界等级任务事件!C[-2],1,FALSE)&IFERROR("|"&VLOOKUP(RC[-2]*10+10002,世界等级任务事件!C[-2],1,FALSE)&IFERROR("|"&VLOOKUP(RC[-2]*10+10003,世界等级任务事件!C[-2],1,FALSE)&IFERROR("|"&VLOOKUP(RC[-2]*10+10004,世界等级任务事件!C[-2],1,FALSE)&IFERROR("|"&VLOOKUP(RC[-2]*10+10005,世界等级任务事件!C[-2],1,FALSE),""),""),""),"") -> 10391|10392|10393 | D45: 60745 | E45: 0.45 | F45: =ROUND(RC[-4]/RC[-2]*100,2)&"%" -> 45%
A46: 40 | B46: =MIN(ROUND(RC[2]*RC[3]/5,0)*5,10000000) -> 30535 | C46: =VLOOKUP(RC[-2]*10+10001,世界等级任务事件!C[-2],1,FALSE)&IFERROR("|"&VLOOKUP(RC[-2]*10+10002,世界等级任务事件!C[-2],1,FALSE)&IFERROR("|"&VLOOKUP(RC[-2]*10+10003,世界等级任务事件!C[-2],1,FALSE)&IFERROR("|"&VLOOKUP(RC[-2]*10+10004,世界等级任务事件!C[-2],1,FALSE)&IFERROR("|"&VLOOKUP(RC[-2]*10+10005,世界等级任务事件!C[-2],1,FALSE),""),""),""),"") -> 10401|10402 | D46: 67860 | E46: 0.45 | F46: =ROUND(RC[-4]/RC[-2]*100,2)&"%" -> 45%
A47: 41 | B47: =MIN(ROUND(RC[2]*RC[3]/5,0)*5,10000000) -> 30995 | C47: =VLOOKUP(RC[-2]*10+10001,世界等级任务事件!C[-2],1,FALSE)&IFERROR("|"&VLOOKUP(RC[-2]*10+10002,世界等级任务事件!C[-2],1,FALSE)&IFERROR("|"&VLOOKUP(RC[-2]*10+10003,世界等级任务事件!C[-2],1,FALSE)&IFERROR("|"&VLOOKUP(RC[-2]*10+10004,世界等级任务事件!C[-2],1,FALSE)&IFERROR("|"&VLOOKUP(RC[-2]*10+10005,世界等级任务事件!C[-2],1,FALSE),""),""),""),"") -> 10411|10412 | D47: 77490 | E47: 0.4 | F47: =ROUND(RC[-4]/RC[-2]*100,2)&"%" -> 40%
A48: 42 | B48: =MIN(ROUND(RC[2]*RC[3]/5,0)*5,10000000) -> 35085 | C48: =VLOOKUP(RC[-2]*10+10001,世界等级任务事件!C[-2],1,FALSE)&IFERROR("|"&VLOOKUP(RC[-2]*10+10002,世界等级任务事件!C[-2],1,FALSE)&IFERROR("|"&VLOOKUP(RC[-2]*10+10003,世界等级任务事件!C[-2],1,FALSE)&IFERROR("|"&VLOOKUP(RC[-2]*10+10004,世界等级任务事件!C[-2],1,FALSE)&IFERROR("|"&VLOOKUP(RC[-2]*10+10005,世界等级任务事件!C[-2],1,FALSE),""),""),""),"") -> 10421|10422 | D48: 87710 | E48: 0.4 | F48: =ROUND(RC[-4]/RC[-2]*100,2)&"%" -> 40%
A49: 43 | B49: =MIN(ROUND(RC[2]*RC[3]/5,0)*5,10000000) -> 39330 | C49: =VLOOKUP(RC[-2]*10+10001,世界等级任务事件!C[-2],1,FALSE)&IFERROR("|"&VLOOKUP(RC[-2]*10+10002,世界等级任务事件!C[-2],1,FALSE)&IFERROR("|"&VLOOKUP(RC[-2]*10+10003,世界等级任务事件!C[-2],1,FALSE)&IFERROR("|"&VLOOKUP(RC[-2]*10+10004,世界等级任务事件!C[-2],1,FALSE)&IFERROR("|"&VLOOKUP(RC[-2]*10+10005,世界等级任务事件!C[-2],1,FALSE),""),""),""),"") -> 10431|10432|10433 | D49: 98330 | E49: 0.4 | F49: =ROUND(RC[-4]/RC[-2]*100,2)&"%" -> 40%
A50: 44 | B50: =MIN(ROUND(RC[2]*RC[3]/5,0)*5,10000000) -> 43740 | C50: =VLOOKUP(RC[-2]*10+10001,世界等级任务事件!C[-2],1,FALSE)&IFERROR("|"&VLOOKUP(RC[-2]*10+10002,世界等级任务事件!C[-2],1,FALSE)&IFERROR("|"&VLOOKUP(RC[-2]*10+10003,世界等级任务事件!C[-2],1,FALSE)&IFERROR("|"&VLOOKUP(RC[-2]*10+10004,世界等级任务事件!C[-2],1,FALSE)&IFERROR("|"&VLOOKUP(RC[-2]*10+10005,世界等级任务事件!C[-2],1,FALSE),""),""),""),"") -> 10441|10442 | D50: 109345 | E50: 0.4 | F50: =ROUND(RC[-4]/RC[-2]*100,2)&"%" -> 40%
A51: 45 | B51: =MIN(ROUND(RC[2]*RC[3]/5,0)*5,10000000) -> 50450 | C51: =VLOOKUP(RC[-2]*10+10001,世界等级任务事件!C[-2],1,FALSE)&IFERROR("|"&VLOOKUP(RC[-2]*10+10002,世界等级任务事件!C[-2],1,FALSE)&IFERROR("|"&VLOOKUP(RC[-2]*10+10003,世界等级任务事件!C[-2],1,FALSE)&IFERROR("|"&VLOOKUP(RC[-2]*10+10004,世界等级任务事件!C[-2],1,FALSE)&IFERROR("|"&VLOOKUP(RC[-2]*10+10005,世界等级任务事件!C[-2],1,FALSE),""),""),""),"") -> 10451|10452 | D51: 126130 | E51: 0.4 | F51: =ROUND(RC[-4]/RC[-2]*100,2)&"%" -> 40%
A52: 46 | B52: =MIN(ROUND(RC[2]*RC[3]/5,0)*5,10000000) -> 54430 | C52: =VLOOKUP(RC[-2]*10+10001,世界等级任务事件!C[-2],1,FALSE)&IFERROR("|"&VLOOKUP(RC[-2]*10+10002,世界等级任务事件!C[-2],1,FALSE)&IFERROR("|"&VLOOKUP(RC[-2]*10+10003,世界等级任务事件!C[-2],1,FALSE)&IFERROR("|"&VLOOKUP(RC[-2]*10+10004,世界等级任务事件!C[-2],1,FALSE)&IFERROR("|"&VLOOKUP(RC[-2]*10+10005,世界等级任务事件!C[-2],1,FALSE),""),""),""),"") -> 10461|10462 | D52: 143240 | E52: 0.38 | F52: =ROUND(RC[-4]/RC[-2]*100,2)&"%" -> 38%
A53: 47 | B53: =MIN(ROUND(RC[2]*RC[3]/5,0)*5,10000000) -> 57950 | C53: =VLOOKUP(RC[-2]*10+10001,世界等级任务事件!C[-2],1,FALSE)&IFERROR("|"&VLOOKUP(RC[-2]*10+10002,世界等级任务事件!C[-2],1,FALSE)&IFERROR("|"&VLOOKUP(RC[-2]*10+10003,世界等级任务事件!C[-2],1,FALSE)&IFERROR("|"&VLOOKUP(RC[-2]*10+10004,世界等级任务事件!C[-2],1,FALSE)&IFERROR("|"&VLOOKUP(RC[-2]*10+10005,世界等级任务事件!C[-2],1,FALSE),""),""),""),"") -> 10471|10472 | D53: 160970 | E53: 0.36 | F53: =ROUND(RC[-4]/RC[-2]*100,2)&"%" -> 36%
A54: 48 | B54: =MIN(ROUND(RC[2]*RC[3]/5,0)*5,10000000) -> 60970 | C54: =VLOOKUP(RC[-2]*10+10001,世界等级任务事件!C[-2],1,FALSE)&IFERROR("|"&VLOOKUP(RC[-2]*10+10002,世界等级任务事件!C[-2],1,FALSE)&IFERROR("|"&VLOOKUP(RC[-2]*10+10003,世界等级任务事件!C[-2],1,FALSE)&IFERROR("|"&VLOOKUP(RC[-2]*10+10004,世界等级任务事件!C[-2],1,FALSE)&IFERROR("|"&VLOOKUP(RC[-2]*10+10005,世界等级任务事件!C[-2],1,FALSE),""),""),""),"") -> 10481|10482|10483 | D54: 179325 | E54: 0.34 | F54: =ROUND(RC[-4]/RC[-2]*100,2)&"%" -> 34%
A55: 49 | B55: =MIN(ROUND(RC[2]*RC[3]/5,0)*5,10000000) -> 63455 | C55: =VLOOKUP(RC[-2]*10+10001,世界等级任务事件!C[-2],1,FALSE)&IFERROR("|"&VLOOKUP(RC[-2]*10+10002,世界等级任务事件!C[-2],1,FALSE)&IFERROR("|"&VLOOKUP(RC[-2]*10+10003,世界等级任务事件!C[-2],1,FALSE)&IFERROR("|"&VLOOKUP(RC[-2]*10+10004,世界等级任务事件!C[-2],1,FALSE)&IFERROR("|"&VLOOKUP(RC[-2]*10+10005,世界等级任务事件!C[-2],1,FALSE),""),""),""),"") -> 10491|10492 | D55: 198300 | E55: 0.32 | F55: =ROUND(RC[-4]/RC[-2]*100,2)&"%" -> 32%
A56: 50 | B56: =MIN(ROUND(RC[2]*RC[3]/5,0)*5,10000000) -> 66770 | C56: =VLOOKUP(RC[-2]*10+10001,世界等级任务事件!C[-2],1,FALSE)&IFERROR("|"&VLOOKUP(RC[-2]*10+10002,世界等级任务事件!C[-2],1,FALSE)&IFERROR("|"&VLOOKUP(RC[-2]*10+10003,世界等级任务事件!C[-2],1,FALSE)&IFERROR("|"&VLOOKUP(RC[-2]*10+10004,世界等级任务事件!C[-2],1,FALSE)&IFERROR("|"&VLOOKUP(RC[-2]*10+10005,世界等级任务事件!C[-2],1,FALSE),""),""),""),"") -> 10501|10502 | D56: 222560 | E56: 0.3 | F56: =ROUND(RC[-4]/RC[-2]*100,2)&"%" -> 30%
A57: 51 | B57: =MIN(ROUND(RC[2]*RC[3]/5,0)*5,10000000) -> 72015 | C57: =VLOOKUP(RC[-2]*10+10001,世界等级任务事件!C[-2],1,FALSE)&IFERROR("|"&VLOOKUP(RC[-2]*10+10002,世界等级任务事件!C[-2],1,FALSE)&IFERROR("|"&VLOOKUP(RC[-2]*10+10003,世界等级任务事件!C[-2],1,FALSE)&IFERROR("|"&VLOOKUP(RC[-2]*10+10004,世界等级任务事件!C[-2],1,FALSE)&IFERROR("|"&VLOOKUP(RC[-2]*10+10005,世界等级任务事件!C[-2],1,FALSE),""),""),""),"") -> 10511|10512 | D57: 248330 | E57: 0.29 | F57: =ROUND(RC[-4]/RC[-2]*100,2)&"%" -> 29%
A58: 52 | B58: =MIN(ROUND(RC[2]*RC[3]/5,0)*5,10000000) -> 77065 | C58: =VLOOKUP(RC[-2]*10+10001,世界等级任务事件!C[-2],1,FALSE)&IFERROR("|"&VLOOKUP(RC[-2]*10+10002,世界等级任务事件!C[-2],1,FALSE)&IFERROR("|"&VLOOKUP(RC[-2]*10+10003,世界等级任务事件!C[-2],1,FALSE)&IFERROR("|"&VLOOKUP(RC[-2]*10+10004,世界等级任务事件!C[-2],1,FALSE)&IFERROR("|"&VLOOKUP(RC[-2]*10+10005,世界等级任务事件!C[-2],1,FALSE),""),""),""),"") -> 10521|10522 | D58: 275225 | E58: 0.28 | F58: =ROUND(RC[-4]/RC[-2]*100,2)&"%" -> 28%
A59: 53 | B59: =MIN(ROUND(RC[2]*RC[3]/5,0)*5,10000000) -> 81800 | C59: =VLOOKUP(RC[-2]*10+10001,世界等级任务事件!C[-2],1,FALSE)&IFERROR("|"&VLOOKUP(RC[-2]*10+10002,世界等级任务事件!C[-2],1,FALSE)&IFERROR("|"&VLOOKUP(RC[-2]*10+10003,世界等级任务事件!C[-2],1,FALSE)&IFERROR("|"&VLOOKUP(RC[-2]*10+10004,世界等级任务事件!C[-2],1,FALSE)&IFERROR("|"&VLOOKUP(RC[-2]*10+10005,世界等级任务事件!C[-2],1,FALSE),""),""),""),"") -> 10531|10532|10533 | D59: 302970 | E59: 0.27 | F59: =ROUND(RC[-4]/RC[-2]*100,2)&"%" -> 27%
A60: 54 | B60: =MIN(ROUND(RC[2]*RC[3]/5,0)*5,10000000) -> 86205 | C60: =VLOOKUP(RC[-2]*10+10001,世界等级任务事件!C[-2],1,FALSE)&IFERROR("|"&VLOOKUP(RC[-2]*10+10002,世界等级任务事件!C[-2],1,FALSE)&IFERROR("|"&VLOOKUP(RC[-2]*10+10003,世界等级任务事件!C[-2],1,FALSE)&IFERROR("|"&VLOOKUP(RC[-2]*10+10004,世界等级任务事件!C[-2],1,FALSE)&IFERROR("|"&VLOOKUP(RC[-2]*10+10005,世界等级任务事件!C[-2],1,FALSE),""),""),""),"") -> 10541|10542|10543 | D60: 331560 | E60: 0.26 | F60: =ROUND(RC[-4]/RC[-2]*100,2)&"%" -> 26%
A61: 55 | B61: =MIN(ROUND(RC[2]*RC[3]/5,0)*5,10000000) -> 90250 | C61: =VLOOKUP(RC[-2]*10+10001,世界等级任务事件!C[-2],1,FALSE)&IFERROR("|"&VLOOKUP(RC[-2]*10+10002,世界等级任务事件!C[-2],1,FALSE)&IFERROR("|"&VLOOKUP(RC[-2]*10+10003,世界等级任务事件!C[-2],1,FALSE)&IFERROR("|"&VLOOKUP(RC[-2]*10+10004,世界等级任务事件!C[-2],1,FALSE)&IFERROR("|"&VLOOKUP(RC[-2]*10+10005,世界等级任务事件!C[-2],1,FALSE),""),""),""),"") -> 10551|10552|10553 | D61: 361000 | E61: 0.25 | F61: =ROUND(RC[-4]/RC[-2]*100,2)&"%" -> 25%
A62: 56 | B62: =MIN(ROUND(RC[2]*RC[3]/5,0)*5,10000000) -> 96755 | C62: =VLOOKUP(RC[-2]*10+10001,世界等级任务事件!C[-2],1,FALSE)&IFERROR("|"&VLOOKUP(RC[-2]*10+10002,世界等级任务事件!C[-2],1,FALSE)&IFERROR("|"&VLOOKUP(RC[-2]*10+10003,世界等级任务事件!C[-2],1,FALSE)&IFERROR("|"&VLOOKUP(RC[-2]*10+10004,世界等级任务事件!C[-2],1,FALSE)&IFERROR("|"&VLOOKUP(RC[-2]*10+10005,世界等级任务事件!C[-2],1,FALSE),""),""),""),"") -> 10561|10562|10563 | D62: 403150 | E62: 0.24 | F62: =ROUND(RC[-4]/RC[-2]*100,2)&"%" -> 24%
A63: 57 | B63: =MIN(ROUND(RC[2]*RC[3]/5,0)*5,10000000) -> 102710 | C63: =VLOOKUP(RC[-2]*10+10001,世界等级任务事件!C[-2],1,FALSE)&IFERROR("|"&VLOOKUP(RC[-2]*10+10002,世界等级任务事件!C[-2],1,FALSE)&IFERROR("|"&VLOOKUP(RC[-2]*10+10003,世界等级任务事件!C[-2],1,FALSE)&IFERROR("|"&VLOOKUP(RC[-2]*10+10004,世界等级任务事件!C[-2],1,FALSE)&IFERROR("|"&VLOOKUP(RC[-2]*10+10005,世界等级任务事件!C[-2],1,FALSE),""),""),""),"") -> 10571|10572|10573 | D63: 446565 | E63: 0.23 | F63: =ROUND(RC[-4]/RC[-2]*100,2)&"%" -> 23%
A64: 58 | B64: =MIN(ROUND(RC[2]*RC[3]/5,0)*5,10000000) -> 108075 | C64: =VLOOKUP(RC[-2]*10+10001,世界等级任务事件!C[-2],1,FALSE)&IFERROR("|"&VLOOKUP(RC[-2]*10+10002,世界等级任务事件!C[-2],1,FALSE)&IFERROR("|"&VLOOKUP(RC[-2]*10+10003,世界等级任务事件!C[-2],1,FALSE)&IFERROR("|"&VLOOKUP(RC[-2]*10+10004,世界等级任务事件!C[-2],1,FALSE)&IFERROR("|"&VLOOKUP(RC[-2]*10+10005,世界等级任务事件!C[-2],1,FALSE),""),""),""),"") -> 10581|10582|10583|10584 | D64: 491255 | E64: 0.22 | F64: =ROUND(RC[-4]/RC[-2]*100,2)&"%" -> 22%
A65: 59 | B65: =MIN(ROUND(RC[2]*RC[3]/5,0)*5,10000000) -> 112815 | C65: =VLOOKUP(RC[-2]*10+10001,世界等级任务事件!C[-2],1,FALSE)&IFERROR("|"&VLOOKUP(RC[-2]*10+10002,世界等级任务事件!C[-2],1,FALSE)&IFERROR("|"&VLOOKUP(RC[-2]*10+10003,世界等级任务事件!C[-2],1,FALSE)&IFERROR("|"&VLOOKUP(RC[-2]*10+10004,世界等级任务事件!C[-2],1,FALSE)&IFERROR("|"&VLOOKUP(RC[-2]*10+10005,世界等级任务事件!C[-2],1,FALSE),""),""),""),"") -> 10591|10592|10593 | D65: 537215 | E65: 0.21 | F65: =ROUND(RC[-4]/RC[-2]*100,2)&"%" -> 21%
A66: 60 | B66: =MIN(ROUND(RC[2]*RC[3]/5,0)*5,10000000) -> 116890 | C66: =VLOOKUP(RC[-2]*10+10001,世界等级任务事件!C[-2],1,FALSE)&IFERROR("|"&VLOOKUP(RC[-2]*10+10002,世界等级任务事件!C[-2],1,FALSE)&IFERROR("|"&VLOOKUP(RC[-2]*10+10003,世界等级任务事件!C[-2],1,FALSE)&IFERROR("|"&VLOOKUP(RC[-2]*10+10004,世界等级任务事件!C[-2],1,FALSE)&IFERROR("|"&VLOOKUP(RC[-2]*10+10005,世界等级任务事件!C[-2],1,FALSE),""),""),""),"") -> 10601|10602|10603|10604 | D66: 584445 | E66: 0.2 | F66: =ROUND(RC[-4]/RC[-2]*100,2)&"%" -> 20%
A67: 61 | B67: =MIN(ROUND(RC[2]*RC[3]/5,0)*5,10000000) -> 125875 | C67: =VLOOKUP(RC[-2]*10+10001,世界等级任务事件!C[-2],1,FALSE)&IFERROR("|"&VLOOKUP(RC[-2]*10+10002,世界等级任务事件!C[-2],1,FALSE)&IFERROR("|"&VLOOKUP(RC[-2]*10+10003,世界等级任务事件!C[-2],1,FALSE)&IFERROR("|"&VLOOKUP(RC[-2]*10+10004,世界等级任务事件!C[-2],1,FALSE)&IFERROR("|"&VLOOKUP(RC[-2]*10+10005,世界等级任务事件!C[-2],1,FALSE),""),""),""),"") -> 10611|10612|10613 | D67: 645525 | E67: 0.195 | F67: =ROUND(RC[-4]/RC[-2]*100,2)&"%" -> 19.5%
A68: 62 | B68: =MIN(ROUND(RC[2]*RC[3]/5,0)*5,10000000) -> 134640 | C68: =VLOOKUP(RC[-2]*10+10001,世界等级任务事件!C[-2],1,FALSE)&IFERROR("|"&VLOOKUP(RC[-2]*10+10002,世界等级任务事件!C[-2],1,FALSE)&IFERROR("|"&VLOOKUP(RC[-2]*10+10003,世界等级任务事件!C[-2],1,FALSE)&IFERROR("|"&VLOOKUP(RC[-2]*10+10004,世界等级任务事件!C[-2],1,FALSE)&IFERROR("|"&VLOOKUP(RC[-2]*10+10005,世界等级任务事件!C[-2],1,FALSE),""),""),""),"") -> 10621|10622|10623 | D68: 708635 | E68: 0.19 | F68: =ROUND(RC[-4]/RC[-2]*100,2)&"%" -> 19%
A69: 63 | B69: =MIN(ROUND(RC[2]*RC[3]/5,0)*5,10000000) -> 143085 | C69: =VLOOKUP(RC[-2]*10+10001,世界等级任务事件!C[-2],1,FALSE)&IFERROR("|"&VLOOKUP(RC[-2]*10+10002,世界等级任务事件!C[-2],1,FALSE)&IFERROR("|"&VLOOKUP(RC[-2]*10+10003,世界等级任务事件!C[-2],1,FALSE)&IFERROR("|"&VLOOKUP(RC[-2]*10+10004,世界等级任务事件!C[-2],1,FALSE)&IFERROR("|"&VLOOKUP(RC[-2]*10+10005,世界等级任务事件!C[-2],1,FALSE),""),""),""),"") -> 10631|10632|10633 | D69: 773440 | E69: 0.185 | F69: =ROUND(RC[-4]/RC[-2]*100,2)&"%" -> 18.5%
A70: 64 | B70: =MIN(ROUND(RC[2]*RC[3]/5,0)*5,10000000) -> 151190 | C70: =VLOOKUP(RC[-2]*10+10001,世界等级任务事件!C[-2],1,FALSE)&IFERROR("|"&VLOOKUP(RC[-2]*10+10002,世界等级任务事件!C[-2],1,FALSE)&IFERROR("|"&VLOOKUP(RC[-2]*10+10003,世界等级任务事件!C[-2],1,FALSE)&IFERROR("|"&VLOOKUP(RC[-2]*10+10004,世界等级任务事件!C[-2],1,FALSE)&IFERROR("|"&VLOOKUP(RC[-2]*10+10005,世界等级任务事件!C[-2],1,FALSE),""),""),""),"") -> 10641|10642|10643 | D70: 839940 | E70: 0.18 | F70: =ROUND(RC[-4]/RC[-2]*100,2)&"%" -> 18%
A71: 65 | B71: =MIN(ROUND(RC[2]*RC[3]/5,0)*5,10000000) -> 158925 | C71: =VLOOKUP(RC[-2]*10+10001,世界等级任务事件!C[-2],1,FALSE)&IFERROR("|"&VLOOKUP(RC[-2]*10+10002,世界等级任务事件!C[-2],1,FALSE)&IFERROR("|"&VLOOKUP(RC[-2]*10+10003,世界等级任务事件!C[-2],1,FALSE)&IFERROR("|"&VLOOKUP(RC[-2]*10+10004,世界等级任务事件!C[-2],1,FALSE)&IFERROR("|"&VLOOKUP(RC[-2]*10+10005,世界等级任务事件!C[-2],1,FALSE),""),""),""),"") -> 10651|10652|10653 | D71: 908135 | E71: 0.175 | F71: =ROUND(RC[-4]/RC[-2]*100,2)&"%" -> 17.5%
A72: 66 | B72: =MIN(ROUND(RC[2]*RC[3]/5,0)*5,10000000) -> 171015 | C72: =VLOOKUP(RC[-2]*10+10001,世界等级任务事件!C[-2],1,FALSE)&IFERROR("|"&VLOOKUP(RC[-2]*10+10002,世界等级任务事件!C[-2],1,FALSE)&IFERROR("|"&VLOOKUP(RC[-2]*10+10003,世界等级任务事件!C[-2],1,FALSE)&IFERROR("|"&VLOOKUP(RC[-2]*10+10004,世界等级任务事件!C[-2],1,FALSE)&IFERROR("|"&VLOOKUP(RC[-2]*10+10005,世界等级任务事件!C[-2],1,FALSE),""),""),""),"") -> 10661|10662|10663|10664 | D72: 1005980 | E72: 0.170000000000001 | F72: =ROUND(RC[-4]/RC[-2]*100,2)&"%" -> 17%
A73: 67 | B73: =MIN(ROUND(RC[2]*RC[3]/5,0)*5,10000000) -> 182550 | C73: =VLOOKUP(RC[-2]*10+10001,世界等级任务事件!C[-2],1,FALSE)&IFERROR("|"&VLOOKUP(RC[-2]*10+10002,世界等级任务事件!C[-2],1,FALSE)&IFERROR("|"&VLOOKUP(RC[-2]*10+10003,世界等级任务事件!C[-2],1,FALSE)&IFERROR("|"&VLOOKUP(RC[-2]*10+10004,世界等级任务事件!C[-2],1,FALSE)&IFERROR("|"&VLOOKUP(RC[-2]*10+10005,世界等级任务事件!C[-2],1,FALSE),""),""),""),"") -> 10671|10672|10673 | D73: 1106370 | E73: 0.165000000000001 | F73: =ROUND(RC[-4]/RC[-2]*100,2)&"%" -> 16.5%
A74: 68 | B74: =MIN(ROUND(RC[2]*RC[3]/5,0)*5,10000000) -> 193490 | C74: =VLOOKUP(RC[-2]*10+10001,世界等级任务事件!C[-2],1,FALSE)&IFERROR("|"&VLOOKUP(RC[-2]*10+10002,世界等级任务事件!C[-2],1,FALSE)&IFERROR("|"&VLOOKUP(RC[-2]*10+10003,世界等级任务事件!C[-2],1,FALSE)&IFERROR("|"&VLOOKUP(RC[-2]*10+10004,世界等级任务事件!C[-2],1,FALSE)&IFERROR("|"&VLOOKUP(RC[-2]*10+10005,世界等级任务事件!C[-2],1,FALSE),""),""),""),"") -> 10681|10682|10683|10684 | D74: 1209300 | E74: 0.160000000000001 | F74: =ROUND(RC[-4]/RC[-2]*100,2)&"%" -> 16%
A75: 69 | B75: =MIN(ROUND(RC[2]*RC[3]/5,0)*5,10000000) -> 203790 | C75: =VLOOKUP(RC[-2]*10+10001,世界等级任务事件!C[-2],1,FALSE)&IFERROR("|"&VLOOKUP(RC[-2]*10+10002,世界等级任务事件!C[-2],1,FALSE)&IFERROR("|"&VLOOKUP(RC[-2]*10+10003,世界等级任务事件!C[-2],1,FALSE)&IFERROR("|"&VLOOKUP(RC[-2]*10+10004,世界等级任务事件!C[-2],1,FALSE)&IFERROR("|"&VLOOKUP(RC[-2]*10+10005,世界等级任务事件!C[-2],1,FALSE),""),""),""),"") -> 10691|10692|10693 | D75: 1314770 | E75: 0.155000000000001 | F75: =ROUND(RC[-4]/RC[-2]*100,2)&"%" -> 15.5%
A76: 70 | B76: =MIN(ROUND(RC[2]*RC[3]/5,0)*5,10000000) -> 213420 | C76: =VLOOKUP(RC[-2]*10+10001,世界等级任务事件!C[-2],1,FALSE)&IFERROR("|"&VLOOKUP(RC[-2]*10+10002,世界等级任务事件!C[-2],1,FALSE)&IFERROR("|"&VLOOKUP(RC[-2]*10+10003,世界等级任务事件!C[-2],1,FALSE)&IFERROR("|"&VLOOKUP(RC[-2]*10+10004,世界等级任务事件!C[-2],1,FALSE)&IFERROR("|"&VLOOKUP(RC[-2]*10+10005,世界等级任务事件!C[-2],1,FALSE),""),""),""),"") -> 10701|10702|10703 | D76: 1422785 | E76: 0.150000000000001 | F76: =ROUND(RC[-4]/RC[-2]*100,2)&"%" -> 15%
A77: 71 | B77: =MIN(ROUND(RC[2]*RC[3]/5,0)*5,10000000) -> 226640 | C77: =VLOOKUP(RC[-2]*10+10001,世界等级任务事件!C[-2],1,FALSE)&IFERROR("|"&VLOOKUP(RC[-2]*10+10002,世界等级任务事件!C[-2],1,FALSE)&IFERROR("|"&VLOOKUP(RC[-2]*10+10003,世界等级任务事件!C[-2],1,FALSE)&IFERROR("|"&VLOOKUP(RC[-2]*10+10004,世界等级任务事件!C[-2],1,FALSE)&IFERROR("|"&VLOOKUP(RC[-2]*10+10005,世界等级任务事件!C[-2],1,FALSE),""),""),""),"") -> 10711|10712|10713 | D77: 1563020 | E77: 0.145000000000001 | F77: =ROUND(RC[-4]/RC[-2]*100,2)&"%" -> 14.5%
A78: 72 | B78: =MIN(ROUND(RC[2]*RC[3]/5,0)*5,10000000) -> 238985 | C78: =VLOOKUP(RC[-2]*10+10001,世界等级任务事件!C[-2],1,FALSE)&IFERROR("|"&VLOOKUP(RC[-2]*10+10002,世界等级任务事件!C[-2],1,FALSE)&IFERROR("|"&VLOOKUP(RC[-2]*10+10003,世界等级任务事件!C[-2],1,FALSE)&IFERROR("|"&VLOOKUP(RC[-2]*10+10004,世界等级任务事件!C[-2],1,FALSE)&IFERROR("|"&VLOOKUP(RC[-2]*10+10005,世界等级任务事件!C[-2],1,FALSE),""),""),""),"") -> 10721|10722|10723 | D78: 1707035 | E78: 0.140000000000001 | F78: =ROUND(RC[-4]/RC[-2]*100,2)&"%" -> 14%
A79: 73 | B79: =MIN(ROUND(RC[2]*RC[3]/5,0)*5,10000000) -> 250350 | C79: =VLOOKUP(RC[-2]*10+10001,世界等级任务事件!C[-2],1,FALSE)&IFERROR("|"&VLOOKUP(RC[-2]*10+10002,世界等级任务事件!C[-2],1,FALSE)&IFERROR("|"&VLOOKUP(RC[-2]*10+10003,世界等级任务事件!C[-2],1,FALSE)&IFERROR("|"&VLOOKUP(RC[-2]*10+10004,世界等级任务事件!C[-2],1,FALSE)&IFERROR("|"&VLOOKUP(RC[-2]*10+10005,世界等级任务事件!C[-2],1,FALSE),""),""),""),"") -> 10731|10732|10733 | D79: 1854440 | E79: 0.135000000000001 | F79: =ROUND(RC[-4]/RC[-2]*100,2)&"%" -> 13.5%
A80: 74 | B80: =MIN(ROUND(RC[2]*RC[3]/5,0)*5,10000000) -> 260680 | C80: =VLOOKUP(RC[-2]*10+10001,世界等级任务事件!C[-2],1,FALSE)&IFERROR("|"&VLOOKUP(RC[-2]*10+10002,世界等级任务事件!C[-2],1,FALSE)&IFERROR("|"&VLOOKUP(RC[-2]*10+10003,世界等级任务事件!C[-2],1,FALSE)&IFERROR("|"&VLOOKUP(RC[-2]*10+10004,世界等级任务事件!C[-2],1,FALSE)&IFERROR("|"&VLOOKUP(RC[-2]*10+10005,世界等级任务事件!C[-2],1,FALSE),""),""),""),"") -> 10741|10742|10743|10744 | D80: 2005230 | E80: 0.130000000000001 | F80: =ROUND(RC[-4]/RC[-2]*100,2)&"%" -> 13%
A81: 75 | B81: =MIN(ROUND(RC[2]*RC[3]/5,0)*5,10000000) -> 269925 | C81: =VLOOKUP(RC[-2]*10+10001,世界等级任务事件!C[-2],1,FALSE)&IFERROR("|"&VLOOKUP(RC[-2]*10+10002,世界等级任务事件!C[-2],1,FALSE)&IFERROR("|"&VLOOKUP(RC[-2]*10+10003,世界等级任务事件!C[-2],1,FALSE)&IFERROR("|"&VLOOKUP(RC[-2]*10+10004,世界等级任务事件!C[-2],1,FALSE)&IFERROR("|"&VLOOKUP(RC[-2]*10+10005,世界等级任务事件!C[-2],1,FALSE),""),""),""),"") -> 10751|10752|10753 | D81: 2159415 | E81: 0.125000000000001 | F81: =ROUND(RC[-4]/RC[-2]*100,2)&"%" -> 12.5%
A82: 76 | B82: =MIN(ROUND(RC[2]*RC[3]/5,0)*5,10000000) -> 281900 | C82: =VLOOKUP(RC[-2]*10+10001,世界等级任务事件!C[-2],1,FALSE)&IFERROR("|"&VLOOKUP(RC[-2]*10+10002,世界等级任务事件!C[-2],1,FALSE)&IFERROR("|"&VLOOKUP(RC[-2]*10+10003,世界等级任务事件!C[-2],1,FALSE)&IFERROR("|"&VLOOKUP(RC[-2]*10+10004,世界等级任务事件!C[-2],1,FALSE)&IFERROR("|"&VLOOKUP(RC[-2]*10+10005,世界等级任务事件!C[-2],1,FALSE),""),""),""),"") -> 10761|10762|10763|10764 | D82: 2349180 | E82: 0.120000000000002 | F82: =ROUND(RC[-4]/RC[-2]*100,2)&"%" -> 12%
A83: 77 | B83: =MIN(ROUND(RC[2]*RC[3]/5,0)*5,10000000) -> 292465 | C83: =VLOOKUP(RC[-2]*10+10001,世界等级任务事件!C[-2],1,FALSE)&IFERROR("|"&VLOOKUP(RC[-2]*10+10002,世界等级任务事件!C[-2],1,FALSE)&IFERROR("|"&VLOOKUP(RC[-2]*10+10003,世界等级任务事件!C[-2],1,FALSE)&IFERROR("|"&VLOOKUP(RC[-2]*10+10004,世界等级任务事件!C[-2],1,FALSE)&IFERROR("|"&VLOOKUP(RC[-2]*10+10005,世界等级任务事件!C[-2],1,FALSE),""),""),""),"") -> 10771|10772|10773 | D83: 2543180 | E83: 0.115000000000002 | F83: =ROUND(RC[-4]/RC[-2]*100,2)&"%" -> 11.5%
A84: 78 | B84: =MIN(ROUND(RC[2]*RC[3]/5,0)*5,10000000) -> 301555 | C84: =VLOOKUP(RC[-2]*10+10001,世界等级任务事件!C[-2],1,FALSE)&IFERROR("|"&VLOOKUP(RC[-2]*10+10002,世界等级任务事件!C[-2],1,FALSE)&IFERROR("|"&VLOOKUP(RC[-2]*10+10003,世界等级任务事件!C[-2],1,FALSE)&IFERROR("|"&VLOOKUP(RC[-2]*10+10004,世界等级任务事件!C[-2],1,FALSE)&IFERROR("|"&VLOOKUP(RC[-2]*10+10005,世界等级任务事件!C[-2],1,FALSE),""),""),""),"") -> 10781|10782|10783 | D84: 2741420 | E84: 0.110000000000002 | F84: =ROUND(RC[-4]/RC[-2]*100,2)&"%" -> 11%
A85: 79 | B85: =MIN(ROUND(RC[2]*RC[3]/5,0)*5,10000000) -> 309110 | C85: =VLOOKUP(RC[-2]*10+10001,世界等级任务事件!C[-2],1,FALSE)&IFERROR("|"&VLOOKUP(RC[-2]*10+10002,世界等级任务事件!C[-2],1,FALSE)&IFERROR("|"&VLOOKUP(RC[-2]*10+10003,世界等级任务事件!C[-2],1,FALSE)&IFERROR("|"&VLOOKUP(RC[-2]*10+10004,世界等级任务事件!C[-2],1,FALSE)&IFERROR("|"&VLOOKUP(RC[-2]*10+10005,世界等级任务事件!C[-2],1,FALSE),""),""),""),"") -> 10791|10792|10793 | D85: 2943890 | E85: 0.105000000000002 | F85: =ROUND(RC[-4]/RC[-2]*100,2)&"%" -> 10.5%
A86: 80 | B86: =MIN(ROUND(RC[2]*RC[3]/5,0)*5,10000000) -> 315060 | C86: =VLOOKUP(RC[-2]*10+10001,世界等级任务事件!C[-2],1,FALSE)&IFERROR("|"&VLOOKUP(RC[-2]*10+10002,世界等级任务事件!C[-2],1,FALSE)&IFERROR("|"&VLOOKUP(RC[-2]*10+10003,世界等级任务事件!C[-2],1,FALSE)&IFERROR("|"&VLOOKUP(RC[-2]*10+10004,世界等级任务事件!C[-2],1,FALSE)&IFERROR("|"&VLOOKUP(RC[-2]*10+10005,世界等级任务事件!C[-2],1,FALSE),""),""),""),"") -> 10801|10802|10803 | D86: 3150600 | E86: 0.100000000000002 | F86: =ROUND(RC[-4]/RC[-2]*100,2)&"%" -> 10%
A87: 81 | B87: =MIN(ROUND(RC[2]*RC[3]/5,0)*5,10000000) -> 344690 | C87: =VLOOKUP(RC[-2]*10+10001,世界等级任务事件!C[-2],1,FALSE)&IFERROR("|"&VLOOKUP(RC[-2]*10+10002,世界等级任务事件!C[-2],1,FALSE)&IFERROR("|"&VLOOKUP(RC[-2]*10+10003,世界等级任务事件!C[-2],1,FALSE)&IFERROR("|"&VLOOKUP(RC[-2]*10+10004,世界等级任务事件!C[-2],1,FALSE)&IFERROR("|"&VLOOKUP(RC[-2]*10+10005,世界等级任务事件!C[-2],1,FALSE),""),""),""),"") -> 10811|10812|10813 | D87: 3446875 | E87: 0.100000000000002 | F87: =ROUND(RC[-4]/RC[-2]*100,2)&"%" -> 10%
A88: 82 | B88: =MIN(ROUND(RC[2]*RC[3]/5,0)*5,10000000) -> 374995 | C88: =VLOOKUP(RC[-2]*10+10001,世界等级任务事件!C[-2],1,FALSE)&IFERROR("|"&VLOOKUP(RC[-2]*10+10002,世界等级任务事件!C[-2],1,FALSE)&IFERROR("|"&VLOOKUP(RC[-2]*10+10003,世界等级任务事件!C[-2],1,FALSE)&IFERROR("|"&VLOOKUP(RC[-2]*10+10004,世界等级任务事件!C[-2],1,FALSE)&IFERROR("|"&VLOOKUP(RC[-2]*10+10005,世界等级任务事件!C[-2],1,FALSE),""),""),""),"") -> 10821|10822|10823|10824 | D88: 3749955 | E88: 0.100000000000002 | F88: =ROUND(RC[-4]/RC[-2]*100,2)&"%" -> 10%
A89: 83 | B89: =MIN(ROUND(RC[2]*RC[3]/5,0)*5,10000000) -> 405940 | C89: =VLOOKUP(RC[-2]*10+10001,世界等级任务事件!C[-2],1,FALSE)&IFERROR("|"&VLOOKUP(RC[-2]*10+10002,世界等级任务事件!C[-2],1,FALSE)&IFERROR("|"&VLOOKUP(RC[-2]*10+10003,世界等级任务事件!C[-2],1,FALSE)&IFERROR("|"&VLOOKUP(RC[-2]*10+10004,世界等级任务事件!C[-2],1,FALSE)&IFERROR("|"&VLOOKUP(RC[-2]*10+10005,世界等级任务事件!C[-2],1,FALSE),""),""),""),"") -> 10831|10832|10833 | D89: 4059385 | E89: 0.100000000000002 | F89: =ROUND(RC[-4]/RC[-2]*100,2)&"%" -> 10%
A90: 84 | B90: =MIN(ROUND(RC[2]*RC[3]/5,0)*5,10000000) -> 437515 | C90: =VLOOKUP(RC[-2]*10+10001,世界等级任务事件!C[-2],1,FALSE)&IFERROR("|"&VLOOKUP(RC[-2]*10+10002,世界等级任务事件!C[-2],1,FALSE)&IFERROR("|"&VLOOKUP(RC[-2]*10+10003,世界等级任务事件!C[-2],1,FALSE)&IFERROR("|"&VLOOKUP(RC[-2]*10+10004,世界等级任务事件!C[-2],1,FALSE)&IFERROR("|"&VLOOKUP(RC[-2]*10+10005,世界等级任务事件!C[-2],1,FALSE),""),""),""),"") -> 10841|10842|10843|10844 | D90: 4375170 | E90: 0.100000000000002 | F90: =ROUND(RC[-4]/RC[-2]*100,2)&"%" -> 10%
A91: 85 | B91: =MIN(ROUND(RC[2]*RC[3]/5,0)*5,10000000) -> 469730 | C91: =VLOOKUP(RC[-2]*10+10001,世界等级任务事件!C[-2],1,FALSE)&IFERROR("|"&VLOOKUP(RC[-2]*10+10002,世界等级任务事件!C[-2],1,FALSE)&IFERROR("|"&VLOOKUP(RC[-2]*10+10003,世界等级任务事件!C[-2],1,FALSE)&IFERROR("|"&VLOOKUP(RC[-2]*10+10004,世界等级任务事件!C[-2],1,FALSE)&IFERROR("|"&VLOOKUP(RC[-2]*10+10005,世界等级任务事件!C[-2],1,FALSE),""),""),""),"") -> 10851|10852|10853 | D91: 4697310 | E91: 0.100000000000002 | F91: =ROUND(RC[-4]/RC[-2]*100,2)&"%" -> 10%
A92: 86 | B92: =MIN(ROUND(RC[2]*RC[3]/5,0)*5,10000000) -> 511690 | C92: =VLOOKUP(RC[-2]*10+10001,世界等级任务事件!C[-2],1,FALSE)&IFERROR("|"&VLOOKUP(RC[-2]*10+10002,世界等级任务事件!C[-2],1,FALSE)&IFERROR("|"&VLOOKUP(RC[-2]*10+10003,世界等级任务事件!C[-2],1,FALSE)&IFERROR("|"&VLOOKUP(RC[-2]*10+10004,世界等级任务事件!C[-2],1,FALSE)&IFERROR("|"&VLOOKUP(RC[-2]*10+10005,世界等级任务事件!C[-2],1,FALSE),""),""),""),"") -> 10861|10862|10863 | D92: 5116880 | E92: 0.100000000000002 | F92: =ROUND(RC[-4]/RC[-2]*100,2)&"%" -> 10%
A93: 87 | B93: =MIN(ROUND(RC[2]*RC[3]/5,0)*5,10000000) -> 554490 | C93: =VLOOKUP(RC[-2]*10+10001,世界等级任务事件!C[-2],1,FALSE)&IFERROR("|"&VLOOKUP(RC[-2]*10+10002,世界等级任务事件!C[-2],1,FALSE)&IFERROR("|"&VLOOKUP(RC[-2]*10+10003,世界等级任务事件!C[-2],1,FALSE)&IFERROR("|"&VLOOKUP(RC[-2]*10+10004,世界等级任务事件!C[-2],1,FALSE)&IFERROR("|"&VLOOKUP(RC[-2]*10+10005,世界等级任务事件!C[-2],1,FALSE),""),""),""),"") -> 10871|10872|10873 | D93: 5544920 | E93: 0.100000000000002 | F93: =ROUND(RC[-4]/RC[-2]*100,2)&"%" -> 10%
A94: 88 | B94: =MIN(ROUND(RC[2]*RC[3]/5,0)*5,10000000) -> 598145 | C94: =VLOOKUP(RC[-2]*10+10001,世界等级任务事件!C[-2],1,FALSE)&IFERROR("|"&VLOOKUP(RC[-2]*10+10002,世界等级任务事件!C[-2],1,FALSE)&IFERROR("|"&VLOOKUP(RC[-2]*10+10003,世界等级任务事件!C[-2],1,FALSE)&IFERROR("|"&VLOOKUP(RC[-2]*10+10004,世界等级任务事件!C[-2],1,FALSE)&IFERROR("|"&VLOOKUP(RC[-2]*10+10005,世界等级任务事件!C[-2],1,FALSE),""),""),""),"") -> 10881|10882|10883 | D94: 5981435 | E94: 0.100000000000002 | F94: =ROUND(RC[-4]/RC[-2]*100,2)&"%" -> 10%
A95: 89 | B95: =MIN(ROUND(RC[2]*RC[3]/5,0)*5,10000000) -> 642640 | C95: =VLOOKUP(RC[-2]*10+10001,世界等级任务事件!C[-2],1,FALSE)&IFERROR("|"&VLOOKUP(RC[-2]*10+10002,世界等级任务事件!C[-2],1,FALSE)&IFERROR("|"&VLOOKUP(RC[-2]*10+10003,世界等级任务事件!C[-2],1,FALSE)&IFERROR("|"&VLOOKUP(RC[-2]*10+10004,世界等级任务事件!C[-2],1,FALSE)&IFERROR("|"&VLOOKUP(RC[-2]*10+10005,世界等级任务事件!C[-2],1,FALSE),""),""),""),"") -> 10891|10892|10893 | D95: 6426420 | E95: 0.100000000000002 | F95: =ROUND(RC[-4]/RC[-2]*100,2)&"%" -> 10%
A96: 90 | B96: =MIN(ROUND(RC[2]*RC[3]/5,0)*5,10000000) -> 687990 | C96: =VLOOKUP(RC[-2]*10+10001,世界等级任务事件!C[-2],1,FALSE)&IFERROR("|"&VLOOKUP(RC[-2]*10+10002,世界等级任务事件!C[-2],1,FALSE)&IFERROR("|"&VLOOKUP(RC[-2]*10+10003,世界等级任务事件!C[-2],1,FALSE)&IFERROR("|"&VLOOKUP(RC[-2]*10+10004,世界等级任务事件!C[-2],1,FALSE)&IFERROR("|"&VLOOKUP(RC[-2]*10+10005,世界等级任务事件!C[-2],1,FALSE),""),""),""),"") -> 10901|10902|10903|10904 | D96: 6879880 | E96: 0.100000000000002 | F96: =ROUND(RC[-4]/RC[-2]*100,2)&"%" -> 10%
A97: 91 | B97: =MIN(ROUND(RC[2]*RC[3]/5,0)*5,10000000) -> 753405 | C97: =VLOOKUP(RC[-2]*10+10001,世界等级任务事件!C[-2],1,FALSE)&IFERROR("|"&VLOOKUP(RC[-2]*10+10002,世界等级任务事件!C[-2],1,FALSE)&IFERROR("|"&VLOOKUP(RC[-2]*10+10003,世界等级任务事件!C[-2],1,FALSE)&IFERROR("|"&VLOOKUP(RC[-2]*10+10004,世界等级任务事件!C[-2],1,FALSE)&IFERROR("|"&VLOOKUP(RC[-2]*10+10005,世界等级任务事件!C[-2],1,FALSE),""),""),""),"") -> 10911|10912|10913 | D97: 7534050 | E97: 0.100000000000002 | F97: =ROUND(RC[-4]/RC[-2]*100,2)&"%" -> 10%
A98: 92 | B98: =MIN(ROUND(RC[2]*RC[3]/5,0)*5,10000000) -> 820145 | C98: =VLOOKUP(RC[-2]*10+10001,世界等级任务事件!C[-2],1,FALSE)&IFERROR("|"&VLOOKUP(RC[-2]*10+10002,世界等级任务事件!C[-2],1,FALSE)&IFERROR("|"&VLOOKUP(RC[-2]*10+10003,世界等级任务事件!C[-2],1,FALSE)&IFERROR("|"&VLOOKUP(RC[-2]*10+10004,世界等级任务事件!C[-2],1,FALSE)&IFERROR("|"&VLOOKUP(RC[-2]*10+10005,世界等级任务事件!C[-2],1,FALSE),""),""),""),"") -> 10921|10922|10923|10924 | D98: 8201425 | E98: 0.100000000000002 | F98: =ROUND(RC[-4]/RC[-2]*100,2)&"%" -> 10%
A99: 93 | B99: =MIN(ROUND(RC[2]*RC[3]/5,0)*5,10000000) -> 888150 | C99: =VLOOKUP(RC[-2]*10+10001,世界等级任务事件!C[-2],1,FALSE)&IFERROR("|"&VLOOKUP(RC[-2]*10+10002,世界等级任务事件!C[-2],1,FALSE)&IFERROR("|"&VLOOKUP(RC[-2]*10+10003,世界等级任务事件!C[-2],1,FALSE)&IFERROR("|"&VLOOKUP(RC[-2]*10+10004,世界等级任务事件!C[-2],1,FALSE)&IFERROR("|"&VLOOKUP(RC[-2]*10+10005,世界等级任务事件!C[-2],1,FALSE),""),""),""),"") -> 10931|10932|10933 | D99: 8881515 | E99: 0.100000000000002 | F99: =ROUND(RC[-4]/RC[-2]*100,2)&"%" -> 10%
A100: 94 | B100: =MIN(ROUND(RC[2]*RC[3]/5,0)*5,10000000) -> 957430 | C100: =VLOOKUP(RC[-2]*10+10001,世界等级任务事件!C[-2],1,FALSE)&IFERROR("|"&VLOOKUP(RC[-2]*10+10002,世界等级任务事件!C[-2],1,FALSE)&IFERROR("|"&VLOOKUP(RC[-2]*10+10003,世界等级任务事件!C[-2],1,FALSE)&IFERROR("|"&VLOOKUP(RC[-2]*10+10004,世界等级任务事件!C[-2],1,FALSE)&IFERROR("|"&VLOOKUP(RC[-2]*10+10005,世界等级任务事件!C[-2],1,FALSE),""),""),""),"") -> 10941|10942|10943 | D100: 9574310 | E100: 0.100000000000002 | F100: =ROUND(RC[-4]/RC[-2]*100,2)&"%" -> 10%
A101: 95 | B101: =MIN(ROUND(RC[2]*RC[3]/5,0)*5,10000000) -> 1027980 | C101: =VLOOKUP(RC[-2]*10+10001,世界等级任务事件!C[-2],1,FALSE)&IFERROR("|"&VLOOKUP(RC[-2]*10+10002,世界等级任务事件!C[-2],1,FALSE)&IFERROR("|"&VLOOKUP(RC[-2]*10+10003,世界等级任务事件!C[-2],1,FALSE)&IFERROR("|"&VLOOKUP(RC[-2]*10+10004,世界等级任务事件!C[-2],1,FALSE)&IFERROR("|"&VLOOKUP(RC[-2]*10+10005,世界等级任务事件!C[-2],1,FALSE),""),""),""),"") -> 10951|10952|10953 | D101: 10279810 | E101: 0.100000000000002 | F101: =ROUND(RC[-4]/RC[-2]*100,2)&"%" -> 10%
A102: 96 | B102: =MIN(ROUND(RC[2]*RC[3]/5,0)*5,10000000) -> 1120135 | C102: =VLOOKUP(RC[-2]*10+10001,世界等级任务事件!C[-2],1,FALSE)&IFERROR("|"&VLOOKUP(RC[-2]*10+10002,世界等级任务事件!C[-2],1,FALSE)&IFERROR("|"&VLOOKUP(RC[-2]*10+10003,世界等级任务事件!C[-2],1,FALSE)&IFERROR("|"&VLOOKUP(RC[-2]*10+10004,世界等级任务事件!C[-2],1,FALSE)&IFERROR("|"&VLOOKUP(RC[-2]*10+10005,世界等级任务事件!C[-2],1,FALSE),""),""),""),"") -> 10961|10962|10963 | D102: 11201360 | E102: 0.100000000000002 | F102: =ROUND(RC[-4]/RC[-2]*100,2)&"%" -> 10%
A103: 97 | B103: =MIN(ROUND(RC[2]*RC[3]/5,0)*5,10000000) -> 1213985 | C103: =VLOOKUP(RC[-2]*10+10001,世界等级任务事件!C[-2],1,FALSE)&IFERROR("|"&VLOOKUP(RC[-2]*10+10002,世界等级任务事件!C[-2],1,FALSE)&IFERROR("|"&VLOOKUP(RC[-2]*10+10003,世界等级任务事件!C[-2],1,FALSE)&IFERROR("|"&VLOOKUP(RC[-2]*10+10004,世界等级任务事件!C[-2],1,FALSE)&IFERROR("|"&VLOOKUP(RC[-2]*10+10005,世界等级任务事件!C[-2],1,FALSE),""),""),""),"") -> 10971|10972|10973 | D103: 12139850 | E103: 0.100000000000002 | F103: =ROUND(RC[-4]/RC[-2]*100,2)&"%" -> 10%
A104: 98 | B104: =MIN(ROUND(RC[2]*RC[3]/5,0)*5,10000000) -> 1309530 | C104: =VLOOKUP(RC[-2]*10+10001,世界等级任务事件!C[-2],1,FALSE)&IFERROR("|"&VLOOKUP(RC[-2]*10+10002,世界等级任务事件!C[-2],1,FALSE)&IFERROR("|"&VLOOKUP(RC[-2]*10+10003,世界等级任务事件!C[-2],1,FALSE)&IFERROR("|"&VLOOKUP(RC[-2]*10+10004,世界等级任务事件!C[-2],1,FALSE)&IFERROR("|"&VLOOKUP(RC[-2]*10+10005,世界等级任务事件!C[-2],1,FALSE),""),""),""),"") -> 10981|10982|10983|10984 | D104: 13095285 | E104: 0.100000000000002 | F104: =ROUND(RC[-4]/RC[-2]*100,2)&"%" -> 10%
A105: 99 | B105: =MIN(ROUND(RC[2]*RC[3]/5,0)*5,10000000) -> 1406765 | C105: =VLOOKUP(RC[-2]*10+10001,世界等级任务事件!C[-2],1,FALSE)&IFERROR("|"&VLOOKUP(RC[-2]*10+10002,世界等级任务事件!C[-2],1,FALSE)&IFERROR("|"&VLOOKUP(RC[-2]*10+10003,世界等级任务事件!C[-2],1,FALSE)&IFERROR("|"&VLOOKUP(RC[-2]*10+10004,世界等级任务事件!C[-2],1,FALSE)&IFERROR("|"&VLOOKUP(RC[-2]*10+10005,世界等级任务事件!C[-2],1,FALSE),""),""),""),"") -> 10991|10992|10993 | D105: 14067665 | E105: 0.100000000000002 | F105: =ROUND(RC[-4]/RC[-2]*100,2)&"%" -> 10%
A106: 100 | B106: =MIN(ROUND(RC[2]*RC[3]/5,0)*5,10000000) -> 1505700 | C106: =VLOOKUP(RC[-2]*10+10001,世界等级任务事件!C[-2],1,FALSE)&IFERROR("|"&VLOOKUP(RC[-2]*10+10002,世界等级任务事件!C[-2],1,FALSE)&IFERROR("|"&VLOOKUP(RC[-2]*10+10003,世界等级任务事件!C[-2],1,FALSE)&IFERROR("|"&VLOOKUP(RC[-2]*10+10004,世界等级任务事件!C[-2],1,FALSE)&IFERROR("|"&VLOOKUP(RC[-2]*10+10005,世界等级任务事件!C[-2],1,FALSE),""),""),""),"") -> 11001|11002|11003|11004 | D106: 15056990 | E106: 0.100000000000002 | F106: =ROUND(RC[-4]/RC[-2]*100,2)&"%" -> 10%
A107: 101 | B107: =MIN(ROUND(RC[2]*RC[3]/5,0)*5,10000000) -> 1627720 | C107: =VLOOKUP(RC[-2]*10+10001,世界等级任务事件!C[-2],1,FALSE)&IFERROR("|"&VLOOKUP(RC[-2]*10+10002,世界等级任务事件!C[-2],1,FALSE)&IFERROR("|"&VLOOKUP(RC[-2]*10+10003,世界等级任务事件!C[-2],1,FALSE)&IFERROR("|"&VLOOKUP(RC[-2]*10+10004,世界等级任务事件!C[-2],1,FALSE)&IFERROR("|"&VLOOKUP(RC[-2]*10+10005,世界等级任务事件!C[-2],1,FALSE),""),""),""),"") -> 11011|11012|11013 | D107: 16277185 | E107: 0.100000000000002 | F107: =ROUND(RC[-4]/RC[-2]*100,2)&"%" -> 10%
A108: 102 | B108: =MIN(ROUND(RC[2]*RC[3]/5,0)*5,10000000) -> 1751855 | C108: =VLOOKUP(RC[-2]*10+10001,世界等级任务事件!C[-2],1,FALSE)&IFERROR("|"&VLOOKUP(RC[-2]*10+10002,世界等级任务事件!C[-2],1,FALSE)&IFERROR("|"&VLOOKUP(RC[-2]*10+10003,世界等级任务事件!C[-2],1,FALSE)&IFERROR("|"&VLOOKUP(RC[-2]*10+10004,世界等级任务事件!C[-2],1,FALSE)&IFERROR("|"&VLOOKUP(RC[-2]*10+10005,世界等级任务事件!C[-2],1,FALSE),""),""),""),"") -> 11021|11022|11023 | D108: 17518560 | E108: 0.100000000000002 | F108: =ROUND(RC[-4]/RC[-2]*100,2)&"%" -> 10%
A109: 103 | B109: =MIN(ROUND(RC[2]*RC[3]/5,0)*5,10000000) -> 1878110 | C109: =VLOOKUP(RC[-2]*10+10001,世界等级任务事件!C[-2],1,FALSE)&IFERROR("|"&VLOOKUP(RC[-2]*10+10002,世界等级任务事件!C[-2],1,FALSE)&IFERROR("|"&VLOOKUP(RC[-2]*10+10003,世界等级任务事件!C[-2],1,FALSE)&IFERROR("|"&VLOOKUP(RC[-2]*10+10004,世界等级任务事件!C[-2],1,FALSE)&IFERROR("|"&VLOOKUP(RC[-2]*10+10005,世界等级任务事件!C[-2],1,FALSE),""),""),""),"") -> 11031|11032|11033 | D109: 18781115 | E109: 0.100000000000002 | F109: =ROUND(RC[-4]/RC[-2]*100,2)&"%" -> 10%
A110: 104 | B110: =MIN(ROUND(RC[2]*RC[3]/5,0)*5,10000000) -> 2006485 | C110: =VLOOKUP(RC[-2]*10+10001,世界等级任务事件!C[-2],1,FALSE)&IFERROR("|"&VLOOKUP(RC[-2]*10+10002,世界等级任务事件!C[-2],1,FALSE)&IFERROR("|"&VLOOKUP(RC[-2]*10+10003,世界等级任务事件!C[-2],1,FALSE)&IFERROR("|"&VLOOKUP(RC[-2]*10+10004,世界等级任务事件!C[-2],1,FALSE)&IFERROR("|"&VLOOKUP(RC[-2]*10+10005,世界等级任务事件!C[-2],1,FALSE),""),""),""),"") -> 11041|11042|11043 | D110: 20064850 | E110: 0.100000000000002 | F110: =ROUND(RC[-4]/RC[-2]*100,2)&"%" -> 10%
A111: 105 | B111: =MIN(ROUND(RC[2]*RC[3]/5,0)*5,10000000) -> 2136975 | C111: =VLOOKUP(RC[-2]*10+10001,世界等级任务事件!C[-2],1,FALSE)&IFERROR("|"&VLOOKUP(RC[-2]*10+10002,世界等级任务事件!C[-2],1,FALSE)&IFERROR("|"&VLOOKUP(RC[-2]*10+10003,世界等级任务事件!C[-2],1,FALSE)&IFERROR("|"&VLOOKUP(RC[-2]*10+10004,世界等级任务事件!C[-2],1,FALSE)&IFERROR("|"&VLOOKUP(RC[-2]*10+10005,世界等级任务事件!C[-2],1,FALSE),""),""),""),"") -> 11051|11052|11053 | D111: 21369770 | E111: 0.100000000000002 | F111: =ROUND(RC[-4]/RC[-2]*100,2)&"%" -> 10%
A112: 106 | B112: =MIN(ROUND(RC[2]*RC[3]/5,0)*5,10000000) -> 2292040 | C112: =VLOOKUP(RC[-2]*10+10001,世界等级任务事件!C[-2],1,FALSE)&IFERROR("|"&VLOOKUP(RC[-2]*10+10002,世界等级任务事件!C[-2],1,FALSE)&IFERROR("|"&VLOOKUP(RC[-2]*10+10003,世界等级任务事件!C[-2],1,FALSE)&IFERROR("|"&VLOOKUP(RC[-2]*10+10004,世界等级任务事件!C[-2],1,FALSE)&IFERROR("|"&VLOOKUP(RC[-2]*10+10005,世界等级任务事件!C[-2],1,FALSE),""),""),""),"") -> 11061|11062|11063|11064 | D112: 22920380 | E112: 0.100000000000002 | F112: =ROUND(RC[-4]/RC[-2]*100,2)&"%" -> 10%
A113: 107 | B113: =MIN(ROUND(RC[2]*RC[3]/5,0)*5,10000000) -> 2449640 | C113: =VLOOKUP(RC[-2]*10+10001,世界等级任务事件!C[-2],1,FALSE)&IFERROR("|"&VLOOKUP(RC[-2]*10+10002,世界等级任务事件!C[-2],1,FALSE)&IFERROR("|"&VLOOKUP(RC[-2]*10+10003,世界等级任务事件!C[-2],1,FALSE)&IFERROR("|"&VLOOKUP(RC[-2]*10+10004,世界等级任务事件!C[-2],1,FALSE)&IFERROR("|"&VLOOKUP(RC[-2]*10+10005,世界等级任务事件!C[-2],1,FALSE),""),""),""),"") -> 11071|11072|11073 | D113: 24496410 | E113: 0.100000000000002 | F113: =ROUND(RC[-4]/RC[-2]*100,2)&"%" -> 10%
A114: 108 | B114: =MIN(ROUND(RC[2]*RC[3]/5,0)*5,10000000) -> 2609785 | C114: =VLOOKUP(RC[-2]*10+10001,世界等级任务事件!C[-2],1,FALSE)&IFERROR("|"&VLOOKUP(RC[-2]*10+10002,世界等级任务事件!C[-2],1,FALSE)&IFERROR("|"&VLOOKUP(RC[-2]*10+10003,世界等级任务事件!C[-2],1,FALSE)&IFERROR("|"&VLOOKUP(RC[-2]*10+10004,世界等级任务事件!C[-2],1,FALSE)&IFERROR("|"&VLOOKUP(RC[-2]*10+10005,世界等级任务事件!C[-2],1,FALSE),""),""),""),"") -> 11081|11082|11083|11084 | D114: 26097860 | E114: 0.100000000000002 | F114: =ROUND(RC[-4]/RC[-2]*100,2)&"%" -> 10%
A115: 109 | B115: =MIN(ROUND(RC[2]*RC[3]/5,0)*5,10000000) -> 2772470 | C115: =VLOOKUP(RC[-2]*10+10001,世界等级任务事件!C[-2],1,FALSE)&IFERROR("|"&VLOOKUP(RC[-2]*10+10002,世界等级任务事件!C[-2],1,FALSE)&IFERROR("|"&VLOOKUP(RC[-2]*10+10003,世界等级任务事件!C[-2],1,FALSE)&IFERROR("|"&VLOOKUP(RC[-2]*10+10004,世界等级任务事件!C[-2],1,FALSE)&IFERROR("|"&VLOOKUP(RC[-2]*10+10005,世界等级任务事件!C[-2],1,FALSE),""),""),""),"") -> 11091|11092|11093 | D115: 27724720 | E115: 0.100000000000002 | F115: =ROUND(RC[-4]/RC[-2]*100,2)&"%" -> 10%
A116: 110 | B116: =MIN(ROUND(RC[2]*RC[3]/5,0)*5,10000000) -> 2937700 | C116: =VLOOKUP(RC[-2]*10+10001,世界等级任务事件!C[-2],1,FALSE)&IFERROR("|"&VLOOKUP(RC[-2]*10+10002,世界等级任务事件!C[-2],1,FALSE)&IFERROR("|"&VLOOKUP(RC[-2]*10+10003,世界等级任务事件!C[-2],1,FALSE)&IFERROR("|"&VLOOKUP(RC[-2]*10+10004,世界等级任务事件!C[-2],1,FALSE)&IFERROR("|"&VLOOKUP(RC[-2]*10+10005,世界等级任务事件!C[-2],1,FALSE),""),""),""),"") -> 11101|11102|11103 | D116: 29377000 | E116: 0.100000000000002 | F116: =ROUND(RC[-4]/RC[-2]*100,2)&"%" -> 10%
A117: 111 | B117: =MIN(ROUND(RC[2]*RC[3]/5,0)*5,10000000) -> 3128980 | C117: =VLOOKUP(RC[-2]*10+10001,世界等级任务事件!C[-2],1,FALSE)&IFERROR("|"&VLOOKUP(RC[-2]*10+10002,世界等级任务事件!C[-2],1,FALSE)&IFERROR("|"&VLOOKUP(RC[-2]*10+10003,世界等级任务事件!C[-2],1,FALSE)&IFERROR("|"&VLOOKUP(RC[-2]*10+10004,世界等级任务事件!C[-2],1,FALSE)&IFERROR("|"&VLOOKUP(RC[-2]*10+10005,世界等级任务事件!C[-2],1,FALSE),""),""),""),"") -> 11111|11112|11113 | D117: 31289805 | E117: 0.100000000000002 | F117: =ROUND(RC[-4]/RC[-2]*100,2)&"%" -> 10%
A118: 112 | B118: =MIN(ROUND(RC[2]*RC[3]/5,0)*5,10000000) -> 3323225 | C118: =VLOOKUP(RC[-2]*10+10001,世界等级任务事件!C[-2],1,FALSE)&IFERROR("|"&VLOOKUP(RC[-2]*10+10002,世界等级任务事件!C[-2],1,FALSE)&IFERROR("|"&VLOOKUP(RC[-2]*10+10003,世界等级任务事件!C[-2],1,FALSE)&IFERROR("|"&VLOOKUP(RC[-2]*10+10004,世界等级任务事件!C[-2],1,FALSE)&IFERROR("|"&VLOOKUP(RC[-2]*10+10005,世界等级任务事件!C[-2],1,FALSE),""),""),""),"") -> 11121|11122|11123 | D118: 33232260 | E118: 0.100000000000002 | F118: =ROUND(RC[-4]/RC[-2]*100,2)&"%" -> 10%
A119: 113 | B119: =MIN(ROUND(RC[2]*RC[3]/5,0)*5,10000000) -> 3520435 | C119: =VLOOKUP(RC[-2]*10+10001,世界等级任务事件!C[-2],1,FALSE)&IFERROR("|"&VLOOKUP(RC[-2]*10+10002,世界等级任务事件!C[-2],1,FALSE)&IFERROR("|"&VLOOKUP(RC[-2]*10+10003,世界等级任务事件!C[-2],1,FALSE)&IFERROR("|"&VLOOKUP(RC[-2]*10+10004,世界等级任务事件!C[-2],1,FALSE)&IFERROR("|"&VLOOKUP(RC[-2]*10+10005,世界等级任务事件!C[-2],1,FALSE),""),""),""),"") -> 11131|11132|11133 | D119: 35204370 | E119: 0.100000000000002 | F119: =ROUND(RC[-4]/RC[-2]*100,2)&"%" -> 10%
A120: 114 | B120: =MIN(ROUND(RC[2]*RC[3]/5,0)*5,10000000) -> 3720615 | C120: =VLOOKUP(RC[-2]*10+10001,世界等级任务事件!C[-2],1,FALSE)&IFERROR("|"&VLOOKUP(RC[-2]*10+10002,世界等级任务事件!C[-2],1,FALSE)&IFERROR("|"&VLOOKUP(RC[-2]*10+10003,世界等级任务事件!C[-2],1,FALSE)&IFERROR("|"&VLOOKUP(RC[-2]*10+10004,世界等级任务事件!C[-2],1,FALSE)&IFERROR("|"&VLOOKUP(RC[-2]*10+10005,世界等级任务事件!C[-2],1,FALSE),""),""),""),"") -> 11141|11142|11143|11144 | D120: 37206130 | E120: 0.100000000000002 | F120: =ROUND(RC[-4]/RC[-2]*100,2)&"%" -> 10%
A121: 115 | B121: =MIN(ROUND(RC[2]*RC[3]/5,0)*5,10000000) -> 3923755 | C121: =VLOOKUP(RC[-2]*10+10001,世界等级任务事件!C[-2],1,FALSE)&IFERROR("|"&VLOOKUP(RC[-2]*10+10002,世界等级任务事件!C[-2],1,FALSE)&IFERROR("|"&VLOOKUP(RC[-2]*10+10003,世界等级任务事件!C[-2],1,FALSE)&IFERROR("|"&VLOOKUP(RC[-2]*10+10004,世界等级任务事件!C[-2],1,FALSE)&IFERROR("|"&VLOOKUP(RC[-2]*10+10005,世界等级任务事件!C[-2],1,FALSE),""),""),""),"") -> 11151|11152|11153 | D121: 39237545 | E121: 0.100000000000002 | F121: =ROUND(RC[-4]/RC[-2]*100,2)&"%" -> 10%
A122: 116 | B122: =MIN(ROUND(RC[2]*RC[3]/5,0)*5,10000000) -> 4154430 | C122: =VLOOKUP(RC[-2]*10+10001,世界等级任务事件!C[-2],1,FALSE)&IFERROR("|"&VLOOKUP(RC[-2]*10+10002,世界等级任务事件!C[-2],1,FALSE)&IFERROR("|"&VLOOKUP(RC[-2]*10+10003,世界等级任务事件!C[-2],1,FALSE)&IFERROR("|"&VLOOKUP(RC[-2]*10+10004,世界等级任务事件!C[-2],1,FALSE)&IFERROR("|"&VLOOKUP(RC[-2]*10+10005,世界等级任务事件!C[-2],1,FALSE),""),""),""),"") -> 11161|11162|11163|11164 | D122: 41544305 | E122: 0.100000000000002 | F122: =ROUND(RC[-4]/RC[-2]*100,2)&"%" -> 10%
A123: 117 | B123: =MIN(ROUND(RC[2]*RC[3]/5,0)*5,10000000) -> 4388495 | C123: =VLOOKUP(RC[-2]*10+10001,世界等级任务事件!C[-2],1,FALSE)&IFERROR("|"&VLOOKUP(RC[-2]*10+10002,世界等级任务事件!C[-2],1,FALSE)&IFERROR("|"&VLOOKUP(RC[-2]*10+10003,世界等级任务事件!C[-2],1,FALSE)&IFERROR("|"&VLOOKUP(RC[-2]*10+10004,世界等级任务事件!C[-2],1,FALSE)&IFERROR("|"&VLOOKUP(RC[-2]*10+10005,世界等级任务事件!C[-2],1,FALSE),""),""),""),"") -> 11171|11172|11173 | D123: 43884960 | E123: 0.100000000000002 | F123: =ROUND(RC[-4]/RC[-2]*100,2)&"%" -> 10%
A124: 118 | B124: =MIN(ROUND(RC[2]*RC[3]/5,0)*5,10000000) -> 4625950 | C124: =VLOOKUP(RC[-2]*10+10001,世界等级任务事件!C[-2],1,FALSE)&IFERROR("|"&VLOOKUP(RC[-2]*10+10002,世界等级任务事件!C[-2],1,FALSE)&IFERROR("|"&VLOOKUP(RC[-2]*10+10003,世界等级任务事件!C[-2],1,FALSE)&IFERROR("|"&VLOOKUP(RC[-2]*10+10004,世界等级任务事件!C[-2],1,FALSE)&IFERROR("|"&VLOOKUP(RC[-2]*10+10005,世界等级任务事件!C[-2],1,FALSE),""),""),""),"") -> 11181|11182|11183 | D124: 46259500 | E124: 0.100000000000002 | F124: =ROUND(RC[-4]/RC[-2]*100,2)&"%" -> 10%
A125: 119 | B125: =MIN(ROUND(RC[2]*RC[3]/5,0)*5,10000000) -> 4866795 | C125: =VLOOKUP(RC[-2]*10+10001,世界等级任务事件!C[-2],1,FALSE)&IFERROR("|"&VLOOKUP(RC[-2]*10+10002,世界等级任务事件!C[-2],1,FALSE)&IFERROR("|"&VLOOKUP(RC[-2]*10+10003,世界等级任务事件!C[-2],1,FALSE)&IFERROR("|"&VLOOKUP(RC[-2]*10+10004,世界等级任务事件!C[-2],1,FALSE)&IFERROR("|"&VLOOKUP(RC[-2]*10+10005,世界等级任务事件!C[-2],1,FALSE),""),""),""),"") -> 11191|11192|11193 | D125: 48667930 | E125: 0.100000000000002 | F125: =ROUND(RC[-4]/RC[-2]*100,2)&"%" -> 10%
A126: 120 | B126: =MIN(ROUND(RC[2]*RC[3]/5,0)*5,10000000) -> 5111025 | C126: =VLOOKUP(RC[-2]*10+10001,世界等级任务事件!C[-2],1,FALSE)&IFERROR("|"&VLOOKUP(RC[-2]*10+10002,世界等级任务事件!C[-2],1,FALSE)&IFERROR("|"&VLOOKUP(RC[-2]*10+10003,世界等级任务事件!C[-2],1,FALSE)&IFERROR("|"&VLOOKUP(RC[-2]*10+10004,世界等级任务事件!C[-2],1,FALSE)&IFERROR("|"&VLOOKUP(RC[-2]*10+10005,世界等级任务事件!C[-2],1,FALSE),""),""),""),"") -> 11201|11202|11203 | D126: 51110250 | E126: 0.100000000000002 | F126: =ROUND(RC[-4]/RC[-2]*100,2)&"%" -> 10%
A127: 121 | B127: =MIN(ROUND(RC[2]*RC[3]/5,0)*5,10000000) -> 5384275 | C127: =VLOOKUP(RC[-2]*10+10001,世界等级任务事件!C[-2],1,FALSE)&IFERROR("|"&VLOOKUP(RC[-2]*10+10002,世界等级任务事件!C[-2],1,FALSE)&IFERROR("|"&VLOOKUP(RC[-2]*10+10003,世界等级任务事件!C[-2],1,FALSE)&IFERROR("|"&VLOOKUP(RC[-2]*10+10004,世界等级任务事件!C[-2],1,FALSE)&IFERROR("|"&VLOOKUP(RC[-2]*10+10005,世界等级任务事件!C[-2],1,FALSE),""),""),""),"") -> 11211|11212|11213 | D127: 53842745 | E127: 0.100000000000002 | F127: =ROUND(RC[-4]/RC[-2]*100,2)&"%" -> 10%
A128: 122 | B128: =MIN(ROUND(RC[2]*RC[3]/5,0)*5,10000000) -> 5661335 | C128: =VLOOKUP(RC[-2]*10+10001,世界等级任务事件!C[-2],1,FALSE)&IFERROR("|"&VLOOKUP(RC[-2]*10+10002,世界等级任务事件!C[-2],1,FALSE)&IFERROR("|"&VLOOKUP(RC[-2]*10+10003,世界等级任务事件!C[-2],1,FALSE)&IFERROR("|"&VLOOKUP(RC[-2]*10+10004,世界等级任务事件!C[-2],1,FALSE)&IFERROR("|"&VLOOKUP(RC[-2]*10+10005,世界等级任务事件!C[-2],1,FALSE),""),""),""),"") -> 11221|11222|11223|11224 | D128: 56613365 | E128: 0.100000000000002 | F128: =ROUND(RC[-4]/RC[-2]*100,2)&"%" -> 10%
A129: 123 | B129: =MIN(ROUND(RC[2]*RC[3]/5,0)*5,10000000) -> 5942210 | C129: =VLOOKUP(RC[-2]*10+10001,世界等级任务事件!C[-2],1,FALSE)&IFERROR("|"&VLOOKUP(RC[-2]*10+10002,世界等级任务事件!C[-2],1,FALSE)&IFERROR("|"&VLOOKUP(RC[-2]*10+10003,世界等级任务事件!C[-2],1,FALSE)&IFERROR("|"&VLOOKUP(RC[-2]*10+10004,世界等级任务事件!C[-2],1,FALSE)&IFERROR("|"&VLOOKUP(RC[-2]*10+10005,世界等级任务事件!C[-2],1,FALSE),""),""),""),"") -> 11231|11232|11233 | D129: 59422110 | E129: 0.100000000000002 | F129: =ROUND(RC[-4]/RC[-2]*100,2)&"%" -> 10%
A130: 124 | B130: =MIN(ROUND(RC[2]*RC[3]/5,0)*5,10000000) -> 6226900 | C130: =VLOOKUP(RC[-2]*10+10001,世界等级任务事件!C[-2],1,FALSE)&IFERROR("|"&VLOOKUP(RC[-2]*10+10002,世界等级任务事件!C[-2],1,FALSE)&IFERROR("|"&VLOOKUP(RC[-2]*10+10003,世界等级任务事件!C[-2],1,FALSE)&IFERROR("|"&VLOOKUP(RC[-2]*10+10004,世界等级任务事件!C[-2],1,FALSE)&IFERROR("|"&VLOOKUP(RC[-2]*10+10005,世界等级任务事件!C[-2],1,FALSE),""),""),""),"") -> 11241|11242|11243|11244 | D130: 62268980 | E130: 0.100000000000002 | F130: =ROUND(RC[-4]/RC[-2]*100,2)&"%" -> 10%
A131: 125 | B131: =MIN(ROUND(RC[2]*RC[3]/5,0)*5,10000000) -> 6515400 | C131: =VLOOKUP(RC[-2]*10+10001,世界等级任务事件!C[-2],1,FALSE)&IFERROR("|"&VLOOKUP(RC[-2]*10+10002,世界等级任务事件!C[-2],1,FALSE)&IFERROR("|"&VLOOKUP(RC[-2]*10+10003,世界等级任务事件!C[-2],1,FALSE)&IFERROR("|"&VLOOKUP(RC[-2]*10+10004,世界等级任务事件!C[-2],1,FALSE)&IFERROR("|"&VLOOKUP(RC[-2]*10+10005,世界等级任务事件!C[-2],1,FALSE),""),""),""),"") -> 11251|11252|11253 | D131: 65153975 | E131: 0.100000000000002 | F131: =ROUND(RC[-4]/RC[-2]*100,2)&"%" -> 10%
A132: 126 | B132: =MIN(ROUND(RC[2]*RC[3]/5,0)*5,10000000) -> 6834400 | C132: =VLOOKUP(RC[-2]*10+10001,世界等级任务事件!C[-2],1,FALSE)&IFERROR("|"&VLOOKUP(RC[-2]*10+10002,世界等级任务事件!C[-2],1,FALSE)&IFERROR("|"&VLOOKUP(RC[-2]*10+10003,世界等级任务事件!C[-2],1,FALSE)&IFERROR("|"&VLOOKUP(RC[-2]*10+10004,世界等级任务事件!C[-2],1,FALSE)&IFERROR("|"&VLOOKUP(RC[-2]*10+10005,世界等级任务事件!C[-2],1,FALSE),""),""),""),"") -> 11261|11262|11263 | D132: 68343975 | E132: 0.100000000000002 | F132: =ROUND(RC[-4]/RC[-2]*100,2)&"%" -> 10%
A133: 127 | B133: =MIN(ROUND(RC[2]*RC[3]/5,0)*5,10000000) -> 7157635 | C133: =VLOOKUP(RC[-2]*10+10001,世界等级任务事件!C[-2],1,FALSE)&IFERROR("|"&VLOOKUP(RC[-2]*10+10002,世界等级任务事件!C[-2],1,FALSE)&IFERROR("|"&VLOOKUP(RC[-2]*10+10003,世界等级任务事件!C[-2],1,FALSE)&IFERROR("|"&VLOOKUP(RC[-2]*10+10004,世界等级任务事件!C[-2],1,FALSE)&IFERROR("|"&VLOOKUP(RC[-2]*10+10005,世界等级任务事件!C[-2],1,FALSE),""),""),""),"") -> 11271|11272|11273 | D133: 71576330 | E133: 0.100000000000002 | F133: =ROUND(RC[-4]/RC[-2]*100,2)&"%" -> 10%
A134: 128 | B134: =MIN(ROUND(RC[2]*RC[3]/5,0)*5,10000000) -> 7485105 | C134: =VLOOKUP(RC[-2]*10+10001,世界等级任务事件!C[-2],1,FALSE)&IFERROR("|"&VLOOKUP(RC[-2]*10+10002,世界等级任务事件!C[-2],1,FALSE)&IFERROR("|"&VLOOKUP(RC[-2]*10+10003,世界等级任务事件!C[-2],1,FALSE)&IFERROR("|"&VLOOKUP(RC[-2]*10+10004,世界等级任务事件!C[-2],1,FALSE)&IFERROR("|"&VLOOKUP(RC[-2]*10+10005,世界等级任务事件!C[-2],1,FALSE),""),""),""),"") -> 11281|11282|11283 | D134: 74851050 | E134: 0.100000000000002 | F134: =ROUND(RC[-4]/RC[-2]*100,2)&"%" -> 10%
A135: 129 | B135: =MIN(ROUND(RC[2]*RC[3]/5,0)*5,10000000) -> 7816815 | C135: =VLOOKUP(RC[-2]*10+10001,世界等级任务事件!C[-2],1,FALSE)&IFERROR("|"&VLOOKUP(RC[-2]*10+10002,世界等级任务事件!C[-2],1,FALSE)&IFERROR("|"&VLOOKUP(RC[-2]*10+10003,世界等级任务事件!C[-2],1,FALSE)&IFERROR("|"&VLOOKUP(RC[-2]*10+10004,世界等级任务事件!C[-2],1,FALSE)&IFERROR("|"&VLOOKUP(RC[-2]*10+10005,世界等级任务事件!C[-2],1,FALSE),""),""),""),"") -> 11291|11292|11293 | D135: 78168135 | E135: 0.100000000000002 | F135: =ROUND(RC[-4]/RC[-2]*100,2)&"%" -> 10%
A136: 130 | B136: =MIN(ROUND(RC[2]*RC[3]/5,0)*5,10000000) -> 8152760 | C136: =VLOOKUP(RC[-2]*10+10001,世界等级任务事件!C[-2],1,FALSE)&IFERROR("|"&VLOOKUP(RC[-2]*10+10002,世界等级任务事件!C[-2],1,FALSE)&IFERROR("|"&VLOOKUP(RC[-2]*10+10003,世界等级任务事件!C[-2],1,FALSE)&IFERROR("|"&VLOOKUP(RC[-2]*10+10004,世界等级任务事件!C[-2],1,FALSE)&IFERROR("|"&VLOOKUP(RC[-2]*10+10005,世界等级任务事件!C[-2],1,FALSE),""),""),""),"") -> 11301|11302|11303|11304 | D136: 81527575 | E136: 0.100000000000002 | F136: =ROUND(RC[-4]/RC[-2]*100,2)&"%" -> 10%
A137: 131 | B137: =MIN(ROUND(RC[2]*RC[3]/5,0)*5,10000000) -> 8520685 | C137: =VLOOKUP(RC[-2]*10+10001,世界等级任务事件!C[-2],1,FALSE)&IFERROR("|"&VLOOKUP(RC[-2]*10+10002,世界等级任务事件!C[-2],1,FALSE)&IFERROR("|"&VLOOKUP(RC[-2]*10+10003,世界等级任务事件!C[-2],1,FALSE)&IFERROR("|"&VLOOKUP(RC[-2]*10+10004,世界等级任务事件!C[-2],1,FALSE)&IFERROR("|"&VLOOKUP(RC[-2]*10+10005,世界等级任务事件!C[-2],1,FALSE),""),""),""),"") -> 11311|11312|11313 | D137: 85206850 | E137: 0.100000000000002 | F137: =ROUND(RC[-4]/RC[-2]*100,2)&"%" -> 10%
A138: 132 | B138: =MIN(ROUND(RC[2]*RC[3]/5,0)*5,10000000) -> 8893270 | C138: =VLOOKUP(RC[-2]*10+10001,世界等级任务事件!C[-2],1,FALSE)&IFERROR("|"&VLOOKUP(RC[-2]*10+10002,世界等级任务事件!C[-2],1,FALSE)&IFERROR("|"&VLOOKUP(RC[-2]*10+10003,世界等级任务事件!C[-2],1,FALSE)&IFERROR("|"&VLOOKUP(RC[-2]*10+10004,世界等级任务事件!C[-2],1,FALSE)&IFERROR("|"&VLOOKUP(RC[-2]*10+10005,世界等级任务事件!C[-2],1,FALSE),""),""),""),"") -> 11321|11322|11323|11324 | D138: 88932715 | E138: 0.100000000000002 | F138: =ROUND(RC[-4]/RC[-2]*100,2)&"%" -> 10%
A139: 133 | B139: =MIN(ROUND(RC[2]*RC[3]/5,0)*5,10000000) -> 9270520 | C139: =VLOOKUP(RC[-2]*10+10001,世界等级任务事件!C[-2],1,FALSE)&IFERROR("|"&VLOOKUP(RC[-2]*10+10002,世界等级任务事件!C[-2],1,FALSE)&IFERROR("|"&VLOOKUP(RC[-2]*10+10003,世界等级任务事件!C[-2],1,FALSE)&IFERROR("|"&VLOOKUP(RC[-2]*10+10004,世界等级任务事件!C[-2],1,FALSE)&IFERROR("|"&VLOOKUP(RC[-2]*10+10005,世界等级任务事件!C[-2],1,FALSE),""),""),""),"") -> 11331|11332|11333 | D139: 92705185 | E139: 0.100000000000002 | F139: =ROUND(RC[-4]/RC[-2]*100,2)&"%" -> 10%
A140: 134 | B140: =MIN(ROUND(RC[2]*RC[3]/5,0)*5,10000000) -> 9652425 | C140: =VLOOKUP(RC[-2]*10+10001,世界等级任务事件!C[-2],1,FALSE)&IFERROR("|"&VLOOKUP(RC[-2]*10+10002,世界等级任务事件!C[-2],1,FALSE)&IFERROR("|"&VLOOKUP(RC[-2]*10+10003,世界等级任务事件!C[-2],1,FALSE)&IFERROR("|"&VLOOKUP(RC[-2]*10+10004,世界等级任务事件!C[-2],1,FALSE)&IFERROR("|"&VLOOKUP(RC[-2]*10+10005,世界等级任务事件!C[-2],1,FALSE),""),""),""),"") -> 11341|11342|11343 | D140: 96524245 | E140: 0.100000000000002 | F140: =ROUND(RC[-4]/RC[-2]*100,2)&"%" -> 10%
A141: 135 | B141: =MIN(ROUND(RC[2]*RC[3]/5,0)*5,10000000) -> 10000000 | C141: =VLOOKUP(RC[-2]*10+10001,世界等级任务事件!C[-2],1,FALSE)&IFERROR("|"&VLOOKUP(RC[-2]*10+10002,世界等级任务事件!C[-2],1,FALSE)&IFERROR("|"&VLOOKUP(RC[-2]*10+10003,世界等级任务事件!C[-2],1,FALSE)&IFERROR("|"&VLOOKUP(RC[-2]*10+10004,世界等级任务事件!C[-2],1,FALSE)&IFERROR("|"&VLOOKUP(RC[-2]*10+10005,世界等级任务事件!C[-2],1,FALSE),""),""),""),"") -> 11351|11352|11353 | D141: 100389910 | E141: 0.100000000000002 | F141: =ROUND(RC[-4]/RC[-2]*100,2)&"%" -> 9.96%
A142: 136 | B142: =MIN(ROUND(RC[2]*RC[3]/5,0)*5,10000000) -> 10000000 | C142: =VLOOKUP(RC[-2]*10+10001,世界等级任务事件!C[-2],1,FALSE)&IFERROR("|"&VLOOKUP(RC[-2]*10+10002,世界等级任务事件!C[-2],1,FALSE)&IFERROR("|"&VLOOKUP(RC[-2]*10+10003,世界等级任务事件!C[-2],1,FALSE)&IFERROR("|"&VLOOKUP(RC[-2]*10+10004,世界等级任务事件!C[-2],1,FALSE)&IFERROR("|"&VLOOKUP(RC[-2]*10+10005,世界等级任务事件!C[-2],1,FALSE),""),""),""),"") -> 11361|11362|11363 | D142: 104590225 | E142: 0.100000000000002 | F142: =ROUND(RC[-4]/RC[-2]*100,2)&"%" -> 9.56%
A143: 137 | B143: =MIN(ROUND(RC[2]*RC[3]/5,0)*5,10000000) -> 10000000 | C143: =VLOOKUP(RC[-2]*10+10001,世界等级任务事件!C[-2],1,FALSE)&IFERROR("|"&VLOOKUP(RC[-2]*10+10002,世界等级任务事件!C[-2],1,FALSE)&IFERROR("|"&VLOOKUP(RC[-2]*10+10003,世界等级任务事件!C[-2],1,FALSE)&IFERROR("|"&VLOOKUP(RC[-2]*10+10004,世界等级任务事件!C[-2],1,FALSE)&IFERROR("|"&VLOOKUP(RC[-2]*10+10005,世界等级任务事件!C[-2],1,FALSE),""),""),""),"") -> 11371|11372|11373 | D143: 108841375 | E143: 0.100000000000002 | F143: =ROUND(RC[-4]/RC[-2]*100,2)&"%" -> 9.19%
A144: 138 | B144: =MIN(ROUND(RC[2]*RC[3]/5,0)*5,10000000) -> 10000000 | C144: =VLOOKUP(RC[-2]*10+10001,世界等级任务事件!C[-2],1,FALSE)&IFERROR("|"&VLOOKUP(RC[-2]*10+10002,世界等级任务事件!C[-2],1,FALSE)&IFERROR("|"&VLOOKUP(RC[-2]*10+10003,世界等级任务事件!C[-2],1,FALSE)&IFERROR("|"&VLOOKUP(RC[-2]*10+10004,世界等级任务事件!C[-2],1,FALSE)&IFERROR("|"&VLOOKUP(RC[-2]*10+10005,世界等级任务事件!C[-2],1,FALSE),""),""),""),"") -> 11381|11382|11383|11384 | D144: 113143355 | E144: 0.100000000000002 | F144: =ROUND(RC[-4]/RC[-2]*100,2)&"%" -> 8.84%
A145: 139 | B145: =MIN(ROUND(RC[2]*RC[3]/5,0)*5,10000000) -> 10000000 | C145: =VLOOKUP(RC[-2]*10+10001,世界等级任务事件!C[-2],1,FALSE)&IFERROR("|"&VLOOKUP(RC[-2]*10+10002,世界等级任务事件!C[-2],1,FALSE)&IFERROR("|"&VLOOKUP(RC[-2]*10+10003,世界等级任务事件!C[-2],1,FALSE)&IFERROR("|"&VLOOKUP(RC[-2]*10+10004,世界等级任务事件!C[-2],1,FALSE)&IFERROR("|"&VLOOKUP(RC[-2]*10+10005,世界等级任务事件!C[-2],1,FALSE),""),""),""),"") -> 11391|11392|11393 | D145: 117496175 | E145: 0.100000000000002 | F145: =ROUND(RC[-4]/RC[-2]*100,2)&"%" -> 8.51%
A146: 140 | B146: =MIN(ROUND(RC[2]*RC[3]/5,0)*5,10000000) -> 10000000 | C146: =VLOOKUP(RC[-2]*10+10001,世界等级任务事件!C[-2],1,FALSE)&IFERROR("|"&VLOOKUP(RC[-2]*10+10002,世界等级任务事件!C[-2],1,FALSE)&IFERROR("|"&VLOOKUP(RC[-2]*10+10003,世界等级任务事件!C[-2],1,FALSE)&IFERROR("|"&VLOOKUP(RC[-2]*10+10004,世界等级任务事件!C[-2],1,FALSE)&IFERROR("|"&VLOOKUP(RC[-2]*10+10005,世界等级任务事件!C[-2],1,FALSE),""),""),""),"") -> 11401|11402|11403|11404 | D146: 121899825 | E146: 0.100000000000002 | F146: =ROUND(RC[-4]/RC[-2]*100,2)&"%" -> 8.2%
A147: 141 | B147: =MIN(ROUND(RC[2]*RC[3]/5,0)*5,10000000) -> 10000000 | C147: =VLOOKUP(RC[-2]*10+10001,世界等级任务事件!C[-2],1,FALSE)&IFERROR("|"&VLOOKUP(RC[-2]*10+10002,世界等级任务事件!C[-2],1,FALSE)&IFERROR("|"&VLOOKUP(RC[-2]*10+10003,世界等级任务事件!C[-2],1,FALSE)&IFERROR("|"&VLOOKUP(RC[-2]*10+10004,世界等级任务事件!C[-2],1,FALSE)&IFERROR("|"&VLOOKUP(RC[-2]*10+10005,世界等级任务事件!C[-2],1,FALSE),""),""),""),"") -> 11411|11412|11413 | D147: 126652955 | E147: 0.100000000000002 | F147: =ROUND(RC[-4]/RC[-2]*100,2)&"%" -> 7.9%
A148: 142 | B148: =MIN(ROUND(RC[2]*RC[3]/5,0)*5,10000000) -> 10000000 | C148: =VLOOKUP(RC[-2]*10+10001,世界等级任务事件!C[-2],1,FALSE)&IFERROR("|"&VLOOKUP(RC[-2]*10+10002,世界等级任务事件!C[-2],1,FALSE)&IFERROR("|"&VLOOKUP(RC[-2]*10+10003,世界等级任务事件!C[-2],1,FALSE)&IFERROR("|"&VLOOKUP(RC[-2]*10+10004,世界等级任务事件!C[-2],1,FALSE)&IFERROR("|"&VLOOKUP(RC[-2]*10+10005,世界等级任务事件!C[-2],1,FALSE),""),""),""),"") -> 11421|11422|11423 | D148: 131461155 | E148: 0.100000000000002 | F148: =ROUND(RC[-4]/RC[-2]*100,2)&"%" -> 7.61%
A149: 143 | B149: =MIN(ROUND(RC[2]*RC[3]/5,0)*5,10000000) -> 10000000 | C149: =VLOOKUP(RC[-2]*10+10001,世界等级任务事件!C[-2],1,FALSE)&IFERROR("|"&VLOOKUP(RC[-2]*10+10002,世界等级任务事件!C[-2],1,FALSE)&IFERROR("|"&VLOOKUP(RC[-2]*10+10003,世界等级任务事件!C[-2],1,FALSE)&IFERROR("|"&VLOOKUP(RC[-2]*10+10004,世界等级任务事件!C[-2],1,FALSE)&IFERROR("|"&VLOOKUP(RC[-2]*10+10005,世界等级任务事件!C[-2],1,FALSE),""),""),""),"") -> 11431|11432|11433 | D149: 136324425 | E149: 0.100000000000002 | F149: =ROUND(RC[-4]/RC[-2]*100,2)&"%" -> 7.34%
A150: 144 | B150: =MIN(ROUND(RC[2]*RC[3]/5,0)*5,10000000) -> 10000000 | C150: =VLOOKUP(RC[-2]*10+10001,世界等级任务事件!C[-2],1,FALSE)&IFERROR("|"&VLOOKUP(RC[-2]*10+10002,世界等级任务事件!C[-2],1,FALSE)&IFERROR("|"&VLOOKUP(RC[-2]*10+10003,世界等级任务事件!C[-2],1,FALSE)&IFERROR("|"&VLOOKUP(RC[-2]*10+10004,世界等级任务事件!C[-2],1,FALSE)&IFERROR("|"&VLOOKUP(RC[-2]*10+10005,世界等级任务事件!C[-2],1,FALSE),""),""),""),"") -> 11441|11442|11443 | D150: 141242770 | E150: 0.100000000000002 | F150: =ROUND(RC[-4]/RC[-2]*100,2)&"%" -> 7.08%
A151: 145 | B151: =MIN(ROUND(RC[2]*RC[3]/5,0)*5,10000000) -> 10000000 | C151: =VLOOKUP(RC[-2]*10+10001,世界等级任务事件!C[-2],1,FALSE)&IFERROR("|"&VLOOKUP(RC[-2]*10+10002,世界等级任务事件!C[-2],1,FALSE)&IFERROR("|"&VLOOKUP(RC[-2]*10+10003,世界等级任务事件!C[-2],1,FALSE)&IFERROR("|"&VLOOKUP(RC[-2]*10+10004,世界等级任务事件!C[-2],1,FALSE)&IFERROR("|"&VLOOKUP(RC[-2]*10+10005,世界等级任务事件!C[-2],1,FALSE),""),""),""),"") -> 11451|11452|11453 | D151: 146216180 | E151: 0.100000000000002 | F151: =ROUND(RC[-4]/RC[-2]*100,2)&"%" -> 6.84%
A152: 146 | B152: =MIN(ROUND(RC[2]*RC[3]/5,0)*5,10000000) -> 10000000 | C152: =VLOOKUP(RC[-2]*10+10001,世界等级任务事件!C[-2],1,FALSE)&IFERROR("|"&VLOOKUP(RC[-2]*10+10002,世界等级任务事件!C[-2],1,FALSE)&IFERROR("|"&VLOOKUP(RC[-2]*10+10003,世界等级任务事件!C[-2],1,FALSE)&IFERROR("|"&VLOOKUP(RC[-2]*10+10004,世界等级任务事件!C[-2],1,FALSE)&IFERROR("|"&VLOOKUP(RC[-2]*10+10005,世界等级任务事件!C[-2],1,FALSE),""),""),""),"") -> 11461|11462|11463|11464 | D152: 151553895 | E152: 0.100000000000002 | F152: =ROUND(RC[-4]/RC[-2]*100,2)&"%" -> 6.6%
A153: 147 | B153: =MIN(ROUND(RC[2]*RC[3]/5,0)*5,10000000) -> 10000000 | C153: =VLOOKUP(RC[-2]*10+10001,世界等级任务事件!C[-2],1,FALSE)&IFERROR("|"&VLOOKUP(RC[-2]*10+10002,世界等级任务事件!C[-2],1,FALSE)&IFERROR("|"&VLOOKUP(RC[-2]*10+10003,世界等级任务事件!C[-2],1,FALSE)&IFERROR("|"&VLOOKUP(RC[-2]*10+10004,世界等级任务事件!C[-2],1,FALSE)&IFERROR("|"&VLOOKUP(RC[-2]*10+10005,世界等级任务事件!C[-2],1,FALSE),""),""),""),"") -> 11471|11472|11473 | D153: 156950920 | E153: 0.100000000000002 | F153: =ROUND(RC[-4]/RC[-2]*100,2)&"%" -> 6.37%
A154: 148 | B154: =MIN(ROUND(RC[2]*RC[3]/5,0)*5,10000000) -> 10000000 | C154: =VLOOKUP(RC[-2]*10+10001,世界等级任务事件!C[-2],1,FALSE)&IFERROR("|"&VLOOKUP(RC[-2]*10+10002,世界等级任务事件!C[-2],1,FALSE)&IFERROR("|"&VLOOKUP(RC[-2]*10+10003,世界等级任务事件!C[-2],1,FALSE)&IFERROR("|"&VLOOKUP(RC[-2]*10+10004,世界等级任务事件!C[-2],1,FALSE)&IFERROR("|"&VLOOKUP(RC[-2]*10+10005,世界等级任务事件!C[-2],1,FALSE),""),""),""),"") -> 11481|11482|11483|11484 | D154: 162407250 | E154: 0.100000000000002 | F154: =ROUND(RC[-4]/RC[-2]*100,2)&"%" -> 6.16%
A155: 149 | B155: =MIN(ROUND(RC[2]*RC[3]/5,0)*5,10000000) -> 10000000 | C155: =VLOOKUP(RC[-2]*10+10001,世界等级任务事件!C[-2],1,FALSE)&IFERROR("|"&VLOOKUP(RC[-2]*10+10002,世界等级任务事件!C[-2],1,FALSE)&IFERROR("|"&VLOOKUP(RC[-2]*10+10003,世界等级任务事件!C[-2],1,FALSE)&IFERROR("|"&VLOOKUP(RC[-2]*10+10004,世界等级任务事件!C[-2],1,FALSE)&IFERROR("|"&VLOOKUP(RC[-2]*10+10005,世界等级任务事件!C[-2],1,FALSE),""),""),""),"") -> 11491|11492|11493 | D155: 167922890 | E155: 0.100000000000002 | F155: =ROUND(RC[-4]/RC[-2]*100,2)&"%" -> 5.96%
A156: 150 | B156: =MIN(ROUND(RC[2]*RC[3]/5,0)*5,10000000) -> 10000000 | C156: =VLOOKUP(RC[-2]*10+10001,世界等级任务事件!C[-2],1,FALSE)&IFERROR("|"&VLOOKUP(RC[-2]*10+10002,世界等级任务事件!C[-2],1,FALSE)&IFERROR("|"&VLOOKUP(RC[-2]*10+10003,世界等级任务事件!C[-2],1,FALSE)&IFERROR("|"&VLOOKUP(RC[-2]*10+10004,世界等级任务事件!C[-2],1,FALSE)&IFERROR("|"&VLOOKUP(RC[-2]*10+10005,世界等级任务事件!C[-2],1,FALSE),""),""),""),"") -> 11501|11502|11503 | D156: 173497830 | E156: 0.100000000000002 | F156: =ROUND(RC[-4]/RC[-2]*100,2)&"%" -> 5.76%
A157: 151 | B157: =MIN(ROUND(RC[2]*RC[3]/5,0)*5,10000000) -> 10000000 | C157: =VLOOKUP(RC[-2]*10+10001,世界等级任务事件!C[-2],1,FALSE)&IFERROR("|"&VLOOKUP(RC[-2]*10+10002,世界等级任务事件!C[-2],1,FALSE)&IFERROR("|"&VLOOKUP(RC[-2]*10+10003,世界等级任务事件!C[-2],1,FALSE)&IFERROR("|"&VLOOKUP(RC[-2]*10+10004,世界等级任务事件!C[-2],1,FALSE)&IFERROR("|"&VLOOKUP(RC[-2]*10+10005,世界等级任务事件!C[-2],1,FALSE),""),""),""),"") -> 11511|11512|11513 | D157: 179451905 | E157: 0.100000000000002 | F157: =ROUND(RC[-4]/RC[-2]*100,2)&"%" -> 5.57%
A158: 152 | B158: =MIN(ROUND(RC[2]*RC[3]/5,0)*5,10000000) -> 10000000 | C158: =VLOOKUP(RC[-2]*10+10001,世界等级任务事件!C[-2],1,FALSE)&IFERROR("|"&VLOOKUP(RC[-2]*10+10002,世界等级任务事件!C[-2],1,FALSE)&IFERROR("|"&VLOOKUP(RC[-2]*10+10003,世界等级任务事件!C[-2],1,FALSE)&IFERROR("|"&VLOOKUP(RC[-2]*10+10004,世界等级任务事件!C[-2],1,FALSE)&IFERROR("|"&VLOOKUP(RC[-2]*10+10005,世界等级任务事件!C[-2],1,FALSE),""),""),""),"") -> 11521|11522|11523 | D158: 185469525 | E158: 0.100000000000002 | F158: =ROUND(RC[-4]/RC[-2]*100,2)&"%" -> 5.39%
A159: 153 | B159: =MIN(ROUND(RC[2]*RC[3]/5,0)*5,10000000) -> 10000000 | C159: =VLOOKUP(RC[-2]*10+10001,世界等级任务事件!C[-2],1,FALSE)&IFERROR("|"&VLOOKUP(RC[-2]*10+10002,世界等级任务事件!C[-2],1,FALSE)&IFERROR("|"&VLOOKUP(RC[-2]*10+10003,世界等级任务事件!C[-2],1,FALSE)&IFERROR("|"&VLOOKUP(RC[-2]*10+10004,世界等级任务事件!C[-2],1,FALSE)&IFERROR("|"&VLOOKUP(RC[-2]*10+10005,世界等级任务事件!C[-2],1,FALSE),""),""),""),"") -> 11531|11532|11533 | D159: 191550685 | E159: 0.100000000000002 | F159: =ROUND(RC[-4]/RC[-2]*100,2)&"%" -> 5.22%
A160: 154 | B160: =MIN(ROUND(RC[2]*RC[3]/5,0)*5,10000000) -> 10000000 | C160: =VLOOKUP(RC[-2]*10+10001,世界等级任务事件!C[-2],1,FALSE)&IFERROR("|"&VLOOKUP(RC[-2]*10+10002,世界等级任务事件!C[-2],1,FALSE)&IFERROR("|"&VLOOKUP(RC[-2]*10+10003,世界等级任务事件!C[-2],1,FALSE)&IFERROR("|"&VLOOKUP(RC[-2]*10+10004,世界等级任务事件!C[-2],1,FALSE)&IFERROR("|"&VLOOKUP(RC[-2]*10+10005,世界等级任务事件!C[-2],1,FALSE),""),""),""),"") -> 11541|11542|11543|11544 | D160: 197695385 | E160: 0.100000000000002 | F160: =ROUND(RC[-4]/RC[-2]*100,2)&"%" -> 5.06%
A161: 155 | B161: =MIN(ROUND(RC[2]*RC[3]/5,0)*5,10000000) -> 10000000 | C161: =VLOOKUP(RC[-2]*10+10001,世界等级任务事件!C[-2],1,FALSE)&IFERROR("|"&VLOOKUP(RC[-2]*10+10002,世界等级任务事件!C[-2],1,FALSE)&IFERROR("|"&VLOOKUP(RC[-2]*10+10003,世界等级任务事件!C[-2],1,FALSE)&IFERROR("|"&VLOOKUP(RC[-2]*10+10004,世界等级任务事件!C[-2],1,FALSE)&IFERROR("|"&VLOOKUP(RC[-2]*10+10005,世界等级任务事件!C[-2],1,FALSE),""),""),""),"") -> 11551|11552|11553 | D161: 203903630 | E161: 0.100000000000002 | F161: =ROUND(RC[-4]/RC[-2]*100,2)&"%" -> 4.9%
A162: 156 | B162: =MIN(ROUND(RC[2]*RC[3]/5,0)*5,10000000) -> 10000000 | C162: =VLOOKUP(RC[-2]*10+10001,世界等级任务事件!C[-2],1,FALSE)&IFERROR("|"&VLOOKUP(RC[-2]*10+10002,世界等级任务事件!C[-2],1,FALSE)&IFERROR("|"&VLOOKUP(RC[-2]*10+10003,世界等级任务事件!C[-2],1,FALSE)&IFERROR("|"&VLOOKUP(RC[-2]*10+10004,世界等级任务事件!C[-2],1,FALSE)&IFERROR("|"&VLOOKUP(RC[-2]*10+10005,世界等级任务事件!C[-2],1,FALSE),""),""),""),"") -> 11561|11562|11563|11564 | D162: 210505835 | E162: 0.100000000000002 | F162: =ROUND(RC[-4]/RC[-2]*100,2)&"%" -> 4.75%
A163: 157 | B163: =MIN(ROUND(RC[2]*RC[3]/5,0)*5,10000000) -> 10000000 | C163: =VLOOKUP(RC[-2]*10+10001,世界等级任务事件!C[-2],1,FALSE)&IFERROR("|"&VLOOKUP(RC[-2]*10+10002,世界等级任务事件!C[-2],1,FALSE)&IFERROR("|"&VLOOKUP(RC[-2]*10+10003,世界等级任务事件!C[-2],1,FALSE)&IFERROR("|"&VLOOKUP(RC[-2]*10+10004,世界等级任务事件!C[-2],1,FALSE)&IFERROR("|"&VLOOKUP(RC[-2]*10+10005,世界等级任务事件!C[-2],1,FALSE),""),""),""),"") -> 11571|11572|11573 | D163: 217175820 | E163: 0.100000000000002 | F163: =ROUND(RC[-4]/RC[-2]*100,2)&"%" -> 4.6%
A164: 158 | B164: =MIN(ROUND(RC[2]*RC[3]/5,0)*5,10000000) -> 10000000 | C164: =VLOOKUP(RC[-2]*10+10001,世界等级任务事件!C[-2],1,FALSE)&IFERROR("|"&VLOOKUP(RC[-2]*10+10002,世界等级任务事件!C[-2],1,FALSE)&IFERROR("|"&VLOOKUP(RC[-2]*10+10003,世界等级任务事件!C[-2],1,FALSE)&IFERROR("|"&VLOOKUP(RC[-2]*10+10004,世界等级任务事件!C[-2],1,FALSE)&IFERROR("|"&VLOOKUP(RC[-2]*10+10005,世界等级任务事件!C[-2],1,FALSE),""),""),""),"") -> 11581|11582|11583 | D164: 223913580 | E164: 0.100000000000002 | F164: =ROUND(RC[-4]/RC[-2]*100,2)&"%" -> 4.47%
A165: 159 | B165: =MIN(ROUND(RC[2]*RC[3]/5,0)*5,10000000) -> 10000000 | C165: =VLOOKUP(RC[-2]*10+10001,世界等级任务事件!C[-2],1,FALSE)&IFERROR("|"&VLOOKUP(RC[-2]*10+10002,世界等级任务事件!C[-2],1,FALSE)&IFERROR("|"&VLOOKUP(RC[-2]*10+10003,世界等级任务事件!C[-2],1,FALSE)&IFERROR("|"&VLOOKUP(RC[-2]*10+10004,世界等级任务事件!C[-2],1,FALSE)&IFERROR("|"&VLOOKUP(RC[-2]*10+10005,世界等级任务事件!C[-2],1,FALSE),""),""),""),"") -> 11591|11592|11593 | D165: 230719120 | E165: 0.100000000000002 | F165: =ROUND(RC[-4]/RC[-2]*100,2)&"%" -> 4.33%
A166: 160 | B166: =MIN(ROUND(RC[2]*RC[3]/5,0)*5,10000000) -> 10000000 | C166: =VLOOKUP(RC[-2]*10+10001,世界等级任务事件!C[-2],1,FALSE)&IFERROR("|"&VLOOKUP(RC[-2]*10+10002,世界等级任务事件!C[-2],1,FALSE)&IFERROR("|"&VLOOKUP(RC[-2]*10+10003,世界等级任务事件!C[-2],1,FALSE)&IFERROR("|"&VLOOKUP(RC[-2]*10+10004,世界等级任务事件!C[-2],1,FALSE)&IFERROR("|"&VLOOKUP(RC[-2]*10+10005,世界等级任务事件!C[-2],1,FALSE),""),""),""),"") -> 11601|11602|11603 | D166: 237592440 | E166: 0.100000000000002 | F166: =ROUND(RC[-4]/RC[-2]*100,2)&"%" -> 4.21%
A167: 161 | B167: =MIN(ROUND(RC[2]*RC[3]/5,0)*5,10000000) -> 10000000 | C167: =VLOOKUP(RC[-2]*10+10001,世界等级任务事件!C[-2],1,FALSE)&IFERROR("|"&VLOOKUP(RC[-2]*10+10002,世界等级任务事件!C[-2],1,FALSE)&IFERROR("|"&VLOOKUP(RC[-2]*10+10003,世界等级任务事件!C[-2],1,FALSE)&IFERROR("|"&VLOOKUP(RC[-2]*10+10004,世界等级任务事件!C[-2],1,FALSE)&IFERROR("|"&VLOOKUP(RC[-2]*10+10005,世界等级任务事件!C[-2],1,FALSE),""),""),""),"") -> 11611|11612|11613 | D167: 244874545 | E167: 0.100000000000002 | F167: =ROUND(RC[-4]/RC[-2]*100,2)&"%" -> 4.08%
A168: 162 | B168: =MIN(ROUND(RC[2]*RC[3]/5,0)*5,10000000) -> 10000000 | C168: =VLOOKUP(RC[-2]*10+10001,世界等级任务事件!C[-2],1,FALSE)&IFERROR("|"&VLOOKUP(RC[-2]*10+10002,世界等级任务事件!C[-2],1,FALSE)&IFERROR("|"&VLOOKUP(RC[-2]*10+10003,世界等级任务事件!C[-2],1,FALSE)&IFERROR("|"&VLOOKUP(RC[-2]*10+10004,世界等级任务事件!C[-2],1,FALSE)&IFERROR("|"&VLOOKUP(RC[-2]*10+10005,世界等级任务事件!C[-2],1,FALSE),""),""),""),"") -> 11621|11622|11623|11624 | D168: 252228660 | E168: 0.100000000000002 | F168: =ROUND(RC[-4]/RC[-2]*100,2)&"%" -> 3.96%
A169: 163 | B169: =MIN(ROUND(RC[2]*RC[3]/5,0)*5,10000000) -> 10000000 | C169: =VLOOKUP(RC[-2]*10+10001,世界等级任务事件!C[-2],1,FALSE)&IFERROR("|"&VLOOKUP(RC[-2]*10+10002,世界等级任务事件!C[-2],1,FALSE)&IFERROR("|"&VLOOKUP(RC[-2]*10+10003,世界等级任务事件!C[-2],1,FALSE)&IFERROR("|"&VLOOKUP(RC[-2]*10+10004,世界等级任务事件!C[-2],1,FALSE)&IFERROR("|"&VLOOKUP(RC[-2]*10+10005,世界等级任务事件!C[-2],1,FALSE),""),""),""),"") -> 11631|11632|11633 | D169: 259654795 | E169: 0.100000000000002 | F169: =ROUND(RC[-4]/RC[-2]*100,2)&"%" -> 3.85%
A170: 164 | B170: =MIN(ROUND(RC[2]*RC[3]/5,0)*5,10000000) -> 10000000 | C170: =VLOOKUP(RC[-2]*10+10001,世界等级任务事件!C[-2],1,FALSE)&IFERROR("|"&VLOOKUP(RC[-2]*10+10002,世界等级任务事件!C[-2],1,FALSE)&IFERROR("|"&VLOOKUP(RC[-2]*10+10003,世界等级任务事件!C[-2],1,FALSE)&IFERROR("|"&VLOOKUP(RC[-2]*10+10004,世界等级任务事件!C[-2],1,FALSE)&IFERROR("|"&VLOOKUP(RC[-2]*10+10005,世界等级任务事件!C[-2],1,FALSE),""),""),""),"") -> 11641|11642|11643|11644 | D170: 267152945 | E170: 0.100000000000002 | F170: =ROUND(RC[-4]/RC[-2]*100,2)&"%" -> 3.74%
A171: 165 | B171: =MIN(ROUND(RC[2]*RC[3]/5,0)*5,10000000) -> 10000000 | C171: =VLOOKUP(RC[-2]*10+10001,世界等级任务事件!C[-2],1,FALSE)&IFERROR("|"&VLOOKUP(RC[-2]*10+10002,世界等级任务事件!C[-2],1,FALSE)&IFERROR("|"&VLOOKUP(RC[-2]*10+10003,世界等级任务事件!C[-2],1,FALSE)&IFERROR("|"&VLOOKUP(RC[-2]*10+10004,世界等级任务事件!C[-2],1,FALSE)&IFERROR("|"&VLOOKUP(RC[-2]*10+10005,世界等级任务事件!C[-2],1,FALSE),""),""),""),"") -> 11651|11652|11653 | D171: 274723105 | E171: 0.100000000000002 | F171: =ROUND(RC[-4]/RC[-2]*100,2)&"%" -> 3.64%
A172: 166 | B172: =MIN(ROUND(RC[2]*RC[3]/5,0)*5,10000000) -> 10000000 | C172: =VLOOKUP(RC[-2]*10+10001,世界等级任务事件!C[-2],1,FALSE)&IFERROR("|"&VLOOKUP(RC[-2]*10+10002,世界等级任务事件!C[-2],1,FALSE)&IFERROR("|"&VLOOKUP(RC[-2]*10+10003,世界等级任务事件!C[-2],1,FALSE)&IFERROR("|"&VLOOKUP(RC[-2]*10+10004,世界等级任务事件!C[-2],1,FALSE)&IFERROR("|"&VLOOKUP(RC[-2]*10+10005,世界等级任务事件!C[-2],1,FALSE),""),""),""),"") -> 11661|11662|11663 | D172: 282716880 | E172: 0.100000000000002 | F172: =ROUND(RC[-4]/RC[-2]*100,2)&"%" -> 3.54%
A173: 167 | B173: =MIN(ROUND(RC[2]*RC[3]/5,0)*5,10000000) -> 10000000 | C173: =VLOOKUP(RC[-2]*10+10001,世界等级任务事件!C[-2],1,FALSE)&IFERROR("|"&VLOOKUP(RC[-2]*10+10002,世界等级任务事件!C[-2],1,FALSE)&IFERROR("|"&VLOOKUP(RC[-2]*10+10003,世界等级任务事件!C[-2],1,FALSE)&IFERROR("|"&VLOOKUP(RC[-2]*10+10004,世界等级任务事件!C[-2],1,FALSE)&IFERROR("|"&VLOOKUP(RC[-2]*10+10005,世界等级任务事件!C[-2],1,FALSE),""),""),""),"") -> 11671|11672|11673 | D173: 290786905 | E173: 0.100000000000002 | F173: =ROUND(RC[-4]/RC[-2]*100,2)&"%" -> 3.44%
A174: 168 | B174: =MIN(ROUND(RC[2]*RC[3]/5,0)*5,10000000) -> 10000000 | C174: =VLOOKUP(RC[-2]*10+10001,世界等级任务事件!C[-2],1,FALSE)&IFERROR("|"&VLOOKUP(RC[-2]*10+10002,世界等级任务事件!C[-2],1,FALSE)&IFERROR("|"&VLOOKUP(RC[-2]*10+10003,世界等级任务事件!C[-2],1,FALSE)&IFERROR("|"&VLOOKUP(RC[-2]*10+10004,世界等级任务事件!C[-2],1,FALSE)&IFERROR("|"&VLOOKUP(RC[-2]*10+10005,世界等级任务事件!C[-2],1,FALSE),""),""),""),"") -> 11681|11682|11683 | D174: 298933185 | E174: 0.100000000000002 | F174: =ROUND(RC[-4]/RC[-2]*100,2)&"%" -> 3.35%
A175: 169 | B175: =MIN(ROUND(RC[2]*RC[3]/5,0)*5,10000000) -> 10000000 | C175: =VLOOKUP(RC[-2]*10+10001,世界等级任务事件!C[-2],1,FALSE)&IFERROR("|"&VLOOKUP(RC[-2]*10+10002,世界等级任务事件!C[-2],1,FALSE)&IFERROR("|"&VLOOKUP(RC[-2]*10+10003,世界等级任务事件!C[-2],1,FALSE)&IFERROR("|"&VLOOKUP(RC[-2]*10+10004,世界等级任务事件!C[-2],1,FALSE)&IFERROR("|"&VLOOKUP(RC[-2]*10+10005,世界等级任务事件!C[-2],1,FALSE),""),""),""),"") -> 11691|11692|11693 | D175: 307155710 | E175: 0.100000000000002 | F175: =ROUND(RC[-4]/RC[-2]*100,2)&"%" -> 3.26%
A176: 170 | B176: =MIN(ROUND(RC[2]*RC[3]/5,0)*5,10000000) -> 10000000 | C176: =VLOOKUP(RC[-2]*10+10001,世界等级任务事件!C[-2],1,FALSE)&IFERROR("|"&VLOOKUP(RC[-2]*10+10002,世界等级任务事件!C[-2],1,FALSE)&IFERROR("|"&VLOOKUP(RC[-2]*10+10003,世界等级任务事件!C[-2],1,FALSE)&IFERROR("|"&VLOOKUP(RC[-2]*10+10004,世界等级任务事件!C[-2],1,FALSE)&IFERROR("|"&VLOOKUP(RC[-2]*10+10005,世界等级任务事件!C[-2],1,FALSE),""),""),""),"") -> 11701|11702|11703|11704 | D176: 315454490 | E176: 0.100000000000002 | F176: =ROUND(RC[-4]/RC[-2]*100,2)&"%" -> 3.17%
A177: 171 | B177: =MIN(ROUND(RC[2]*RC[3]/5,0)*5,10000000) -> 10000000 | C177: =VLOOKUP(RC[-2]*10+10001,世界等级任务事件!C[-2],1,FALSE)&IFERROR("|"&VLOOKUP(RC[-2]*10+10002,世界等级任务事件!C[-2],1,FALSE)&IFERROR("|"&VLOOKUP(RC[-2]*10+10003,世界等级任务事件!C[-2],1,FALSE)&IFERROR("|"&VLOOKUP(RC[-2]*10+10004,世界等级任务事件!C[-2],1,FALSE)&IFERROR("|"&VLOOKUP(RC[-2]*10+10005,世界等级任务事件!C[-2],1,FALSE),""),""),""),"") -> 11711|11712|11713 | D177: 324191705 | E177: 0.100000000000002 | F177: =ROUND(RC[-4]/RC[-2]*100,2)&"%" -> 3.08%
A178: 172 | B178: =MIN(ROUND(RC[2]*RC[3]/5,0)*5,10000000) -> 10000000 | C178: =VLOOKUP(RC[-2]*10+10001,世界等级任务事件!C[-2],1,FALSE)&IFERROR("|"&VLOOKUP(RC[-2]*10+10002,世界等级任务事件!C[-2],1,FALSE)&IFERROR("|"&VLOOKUP(RC[-2]*10+10003,世界等级任务事件!C[-2],1,FALSE)&IFERROR("|"&VLOOKUP(RC[-2]*10+10004,世界等级任务事件!C[-2],1,FALSE)&IFERROR("|"&VLOOKUP(RC[-2]*10+10005,世界等级任务事件!C[-2],1,FALSE),""),""),""),"") -> 11721|11722|11723|11724 | D178: 333009410 | E178: 0.100000000000002 | F178: =ROUND(RC[-4]/RC[-2]*100,2)&"%" -> 3%
A179: 173 | B179: =MIN(ROUND(RC[2]*RC[3]/5,0)*5,10000000) -> 10000000 | C179: =VLOOKUP(RC[-2]*10+10001,世界等级任务事件!C[-2],1,FALSE)&IFERROR("|"&VLOOKUP(RC[-2]*10+10002,世界等级任务事件!C[-2],1,FALSE)&IFERROR("|"&VLOOKUP(RC[-2]*10+10003,世界等级任务事件!C[-2],1,FALSE)&IFERROR("|"&VLOOKUP(RC[-2]*10+10004,世界等级任务事件!C[-2],1,FALSE)&IFERROR("|"&VLOOKUP(RC[-2]*10+10005,世界等级任务事件!C[-2],1,FALSE),""),""),""),"") -> 11731|11732|11733 | D179: 341907600 | E179: 0.100000000000002 | F179: =ROUND(RC[-4]/RC[-2]*100,2)&"%" -> 2.92%
A180: 174 | B180: =MIN(ROUND(RC[2]*RC[3]/5,0)*5,10000000) -> 10000000 | C180: =VLOOKUP(RC[-2]*10+10001,世界等级任务事件!C[-2],1,FALSE)&IFERROR("|"&VLOOKUP(RC[-2]*10+10002,世界等级任务事件!C[-2],1,FALSE)&IFERROR("|"&VLOOKUP(RC[-2]*10+10003,世界等级任务事件!C[-2],1,FALSE)&IFERROR("|"&VLOOKUP(RC[-2]*10+10004,世界等级任务事件!C[-2],1,FALSE)&IFERROR("|"&VLOOKUP(RC[-2]*10+10005,世界等级任务事件!C[-2],1,FALSE),""),""),""),"") -> 11741|11742|11743 | D180: 350886275 | E180: 0.100000000000002 | F180: =ROUND(RC[-4]/RC[-2]*100,2)&"%" -> 2.85%
A181: 175 | B181: =MIN(ROUND(RC[2]*RC[3]/5,0)*5,10000000) -> 10000000 | C181: =VLOOKUP(RC[-2]*10+10001,世界等级任务事件!C[-2],1,FALSE)&IFERROR("|"&VLOOKUP(RC[-2]*10+10002,世界等级任务事件!C[-2],1,FALSE)&IFERROR("|"&VLOOKUP(RC[-2]*10+10003,世界等级任务事件!C[-2],1,FALSE)&IFERROR("|"&VLOOKUP(RC[-2]*10+10004,世界等级任务事件!C[-2],1,FALSE)&IFERROR("|"&VLOOKUP(RC[-2]*10+10005,世界等级任务事件!C[-2],1,FALSE),""),""),""),"") -> 11751|11752|11753 | D181: 359945440 | E181: 0.100000000000002 | F181: =ROUND(RC[-4]/RC[-2]*100,2)&"%" -> 2.78%
A182: 176 | B182: =MIN(ROUND(RC[2]*RC[3]/5,0)*5,10000000) -> 10000000 | C182: =VLOOKUP(RC[-2]*10+10001,世界等级任务事件!C[-2],1,FALSE)&IFERROR("|"&VLOOKUP(RC[-2]*10+10002,世界等级任务事件!C[-2],1,FALSE)&IFERROR("|"&VLOOKUP(RC[-2]*10+10003,世界等级任务事件!C[-2],1,FALSE)&IFERROR("|"&VLOOKUP(RC[-2]*10+10004,世界等级任务事件!C[-2],1,FALSE)&IFERROR("|"&VLOOKUP(RC[-2]*10+10005,世界等级任务事件!C[-2],1,FALSE),""),""),""),"") -> 11761|11762|11763 | D182: 369457870 | E182: 0.100000000000002 | F182: =ROUND(RC[-4]/RC[-2]*100,2)&"%" -> 2.71%
A183: 177 | B183: =MIN(ROUND(RC[2]*RC[3]/5,0)*5,10000000) -> 10000000 | C183: =VLOOKUP(RC[-2]*10+10001,世界等级任务事件!C[-2],1,FALSE)&IFERROR("|"&VLOOKUP(RC[-2]*10+10002,世界等级任务事件!C[-2],1,FALSE)&IFERROR("|"&VLOOKUP(RC[-2]*10+10003,世界等级任务事件!C[-2],1,FALSE)&IFERROR("|"&VLOOKUP(RC[-2]*10+10004,世界等级任务事件!C[-2],1,FALSE)&IFERROR("|"&VLOOKUP(RC[-2]*10+10005,世界等级任务事件!C[-2],1,FALSE),""),""),""),"") -> 11771|11772|11773 | D183: 379055025 | E183: 0.100000000000002 | F183: =ROUND(RC[-4]/RC[-2]*100,2)&"%" -> 2.64%
A184: 178 | B184: =MIN(ROUND(RC[2]*RC[3]/5,0)*5,10000000) -> 10000000 | C184: =VLOOKUP(RC[-2]*10+10001,世界等级任务事件!C[-2],1,FALSE)&IFERROR("|"&VLOOKUP(RC[-2]*10+10002,世界等级任务事件!C[-2],1,FALSE)&IFERROR("|"&VLOOKUP(RC[-2]*10+10003,世界等级任务事件!C[-2],1,FALSE)&IFERROR("|"&VLOOKUP(RC[-2]*10+10004,世界等级任务事件!C[-2],1,FALSE)&IFERROR("|"&VLOOKUP(RC[-2]*10+10005,世界等级任务事件!C[-2],1,FALSE),""),""),""),"") -> 11781|11782|11783|11784 | D184: 388736900 | E184: 0.100000000000002 | F184: =ROUND(RC[-4]/RC[-2]*100,2)&"%" -> 2.57%
A185: 179 | B185: =MIN(ROUND(RC[2]*RC[3]/5,0)*5,10000000) -> 10000000 | C185: =VLOOKUP(RC[-2]*10+10001,世界等级任务事件!C[-2],1,FALSE)&IFERROR("|"&VLOOKUP(RC[-2]*10+10002,世界等级任务事件!C[-2],1,FALSE)&IFERROR("|"&VLOOKUP(RC[-2]*10+10003,世界等级任务事件!C[-2],1,FALSE)&IFERROR("|"&VLOOKUP(RC[-2]*10+10004,世界等级任务事件!C[-2],1,FALSE)&IFERROR("|"&VLOOKUP(RC[-2]*10+10005,世界等级任务事件!C[-2],1,FALSE),""),""),""),"") -> 11791|11792|11793 | D185: 398503500 | E185: 0.100000000000002 | F185: =ROUND(RC[-4]/RC[-2]*100,2)&"%" -> 2.51%
A186: 180 | B186: =MIN(ROUND(RC[2]*RC[3]/5,0)*5,10000000) -> 10000000 | C186: =VLOOKUP(RC[-2]*10+10001,世界等级任务事件!C[-2],1,FALSE)&IFERROR("|"&VLOOKUP(RC[-2]*10+10002,世界等级任务事件!C[-2],1,FALSE)&IFERROR("|"&VLOOKUP(RC[-2]*10+10003,世界等级任务事件!C[-2],1,FALSE)&IFERROR("|"&VLOOKUP(RC[-2]*10+10004,世界等级任务事件!C[-2],1,FALSE)&IFERROR("|"&VLOOKUP(RC[-2]*10+10005,世界等级任务事件!C[-2],1,FALSE),""),""),""),"") -> 11801|11802|11803|11804 | D186: 408354820 | E186: 0.100000000000002 | F186: =ROUND(RC[-4]/RC[-2]*100,2)&"%" -> 2.45%
A187: 181 | B187: =MIN(ROUND(RC[2]*RC[3]/5,0)*5,10000000) -> 10000000 | C187: =VLOOKUP(RC[-2]*10+10001,世界等级任务事件!C[-2],1,FALSE)&IFERROR("|"&VLOOKUP(RC[-2]*10+10002,世界等级任务事件!C[-2],1,FALSE)&IFERROR("|"&VLOOKUP(RC[-2]*10+10003,世界等级任务事件!C[-2],1,FALSE)&IFERROR("|"&VLOOKUP(RC[-2]*10+10004,世界等级任务事件!C[-2],1,FALSE)&IFERROR("|"&VLOOKUP(RC[-2]*10+10005,世界等级任务事件!C[-2],1,FALSE),""),""),""),"") -> 11811|11812|11813 | D187: 418674235 | E187: 0.100000000000002 | F187: =ROUND(RC[-4]/RC[-2]*100,2)&"%" -> 2.39%
A188: 182 | B188: =MIN(ROUND(RC[2]*RC[3]/5,0)*5,10000000) -> 10000000 | C188: =VLOOKUP(RC[-2]*10+10001,世界等级任务事件!C[-2],1,FALSE)&IFERROR("|"&VLOOKUP(RC[-2]*10+10002,世界等级任务事件!C[-2],1,FALSE)&IFERROR("|"&VLOOKUP(RC[-2]*10+10003,世界等级任务事件!C[-2],1,FALSE)&IFERROR("|"&VLOOKUP(RC[-2]*10+10004,世界等级任务事件!C[-2],1,FALSE)&IFERROR("|"&VLOOKUP(RC[-2]*10+10005,世界等级任务事件!C[-2],1,FALSE),""),""),""),"") -> 11821|11822|11823 | D188: 429082605 | E188: 0.100000000000002 | F188: =ROUND(RC[-4]/RC[-2]*100,2)&"%" -> 2.33%
A189: 183 | B189: =MIN(ROUND(RC[2]*RC[3]/5,0)*5,10000000) -> 10000000 | C189: =VLOOKUP(RC[-2]*10+10001,世界等级任务事件!C[-2],1,FALSE)&IFERROR("|"&VLOOKUP(RC[-2]*10+10002,世界等级任务事件!C[-2],1,FALSE)&IFERROR("|"&VLOOKUP(RC[-2]*10+10003,世界等级任务事件!C[-2],1,FALSE)&IFERROR("|"&VLOOKUP(RC[-2]*10+10004,世界等级任务事件!C[-2],1,FALSE)&IFERROR("|"&VLOOKUP(RC[-2]*10+10005,世界等级任务事件!C[-2],1,FALSE),""),""),""),"") -> 11831|11832|11833 | D189: 439579940 | E189: 0.100000000000002 | F189: =ROUND(RC[-4]/RC[-2]*100,2)&"%" -> 2.27%
A190: 184 | B190: =MIN(ROUND(RC[2]*RC[3]/5,0)*5,10000000) -> 10000000 | C190: =VLOOKUP(RC[-2]*10+10001,世界等级任务事件!C[-2],1,FALSE)&IFERROR("|"&VLOOKUP(RC[-2]*10+10002,世界等级任务事件!C[-2],1,FALSE)&IFERROR("|"&VLOOKUP(RC[-2]*10+10003,世界等级任务事件!C[-2],1,FALSE)&IFERROR("|"&VLOOKUP(RC[-2]*10+10004,世界等级任务事件!C[-2],1,FALSE)&IFERROR("|"&VLOOKUP(RC[-2]*10+10005,世界等级任务事件!C[-2],1,FALSE),""),""),""),"") -> 11841|11842|11843 | D190: 450166230 | E190: 0.100000000000002 | F190: =ROUND(RC[-4]/RC[-2]*100,2)&"%" -> 2.22%
A191: 185 | B191: =MIN(ROUND(RC[2]*RC[3]/5,0)*5,10000000) -> 10000000 | C191: =VLOOKUP(RC[-2]*10+10001,世界等级任务事件!C[-2],1,FALSE)&IFERROR("|"&VLOOKUP(RC[-2]*10+10002,世界等级任务事件!C[-2],1,FALSE)&IFERROR("|"&VLOOKUP(RC[-2]*10+10003,世界等级任务事件!C[-2],1,FALSE)&IFERROR("|"&VLOOKUP(RC[-2]*10+10004,世界等级任务事件!C[-2],1,FALSE)&IFERROR("|"&VLOOKUP(RC[-2]*10+10005,世界等级任务事件!C[-2],1,FALSE),""),""),""),"") -> 11851|11852|11853 | D191: 460841480 | E191: 0.100000000000002 | F191: =ROUND(RC[-4]/RC[-2]*100,2)&"%" -> 2.17%
A192: 186 | B192: =MIN(ROUND(RC[2]*RC[3]/5,0)*5,10000000) -> 10000000 | C192: =VLOOKUP(RC[-2]*10+10001,世界等级任务事件!C[-2],1,FALSE)&IFERROR("|"&VLOOKUP(RC[-2]*10+10002,世界等级任务事件!C[-2],1,FALSE)&IFERROR("|"&VLOOKUP(RC[-2]*10+10003,世界等级任务事件!C[-2],1,FALSE)&IFERROR("|"&VLOOKUP(RC[-2]*10+10004,世界等级任务事件!C[-2],1,FALSE)&IFERROR("|"&VLOOKUP(RC[-2]*10+10005,世界等级任务事件!C[-2],1,FALSE),""),""),""),"") -> 11861|11862|11863|11864 | D192: 471999650 | E192: 0.100000000000002 | F192: =ROUND(RC[-4]/RC[-2]*100,2)&"%" -> 2.12%
A193: 187 | B193: =MIN(ROUND(RC[2]*RC[3]/5,0)*5,10000000) -> 10000000 | C193: =VLOOKUP(RC[-2]*10+10001,世界等级任务事件!C[-2],1,FALSE)&IFERROR("|"&VLOOKUP(RC[-2]*10+10002,世界等级任务事件!C[-2],1,FALSE)&IFERROR("|"&VLOOKUP(RC[-2]*10+10003,世界等级任务事件!C[-2],1,FALSE)&IFERROR("|"&VLOOKUP(RC[-2]*10+10004,世界等级任务事件!C[-2],1,FALSE)&IFERROR("|"&VLOOKUP(RC[-2]*10+10005,世界等级任务事件!C[-2],1,FALSE),""),""),""),"") -> 11871|11872|11873 | D193: 483251015 | E193: 0.100000000000002 | F193: =ROUND(RC[-4]/RC[-2]*100,2)&"%" -> 2.07%
A194: 188 | B194: =MIN(ROUND(RC[2]*RC[3]/5,0)*5,10000000) -> 10000000 | C194: =VLOOKUP(RC[-2]*10+10001,世界等级任务事件!C[-2],1,FALSE)&IFERROR("|"&VLOOKUP(RC[-2]*10+10002,世界等级任务事件!C[-2],1,FALSE)&IFERROR("|"&VLOOKUP(RC[-2]*10+10003,世界等级任务事件!C[-2],1,FALSE)&IFERROR("|"&VLOOKUP(RC[-2]*10+10004,世界等级任务事件!C[-2],1,FALSE)&IFERROR("|"&VLOOKUP(RC[-2]*10+10005,世界等级任务事件!C[-2],1,FALSE),""),""),""),"") -> 11881|11882|11883|11884 | D194: 494595575 | E194: 0.100000000000002 | F194: =ROUND(RC[-4]/RC[-2]*100,2)&"%" -> 2.02%
A195: 189 | B195: =MIN(ROUND(RC[2]*RC[3]/5,0)*5,10000000) -> 10000000 | C195: =VLOOKUP(RC[-2]*10+10001,世界等级任务事件!C[-2],1,FALSE)&IFERROR("|"&VLOOKUP(RC[-2]*10+10002,世界等级任务事件!C[-2],1,FALSE)&IFERROR("|"&VLOOKUP(RC[-2]*10+10003,世界等级任务事件!C[-2],1,FALSE)&IFERROR("|"&VLOOKUP(RC[-2]*10+10004,世界等级任务事件!C[-2],1,FALSE)&IFERROR("|"&VLOOKUP(RC[-2]*10+10005,世界等级任务事件!C[-2],1,FALSE),""),""),""),"") -> 11891|11892|11893 | D195: 506033325 | E195: 0.100000000000002 | F195: =ROUND(RC[-4]/RC[-2]*100,2)&"%" -> 1.98%
A196: 190 | B196: =MIN(ROUND(RC[2]*RC[3]/5,0)*5,10000000) -> 10000000 | C196: =VLOOKUP(RC[-2]*10+10001,世界等级任务事件!C[-2],1,FALSE)&IFERROR("|"&VLOOKUP(RC[-2]*10+10002,世界等级任务事件!C[-2],1,FALSE)&IFERROR("|"&VLOOKUP(RC[-2]*10+10003,世界等级任务事件!C[-2],1,FALSE)&IFERROR("|"&VLOOKUP(RC[-2]*10+10004,世界等级任务事件!C[-2],1,FALSE)&IFERROR("|"&VLOOKUP(RC[-2]*10+10005,世界等级任务事件!C[-2],1,FALSE),""),""),""),"") -> 11901|11902|11903 | D196: 517564275 | E196: 0.100000000000002 | F196: =ROUND(RC[-4]/RC[-2]*100,2)&"%" -> 1.93%
A197: 191 | B197: =MIN(ROUND(RC[2]*RC[3]/5,0)*5,10000000) -> 10000000 | C197: =VLOOKUP(RC[-2]*10+10001,世界等级任务事件!C[-2],1,FALSE)&IFERROR("|"&VLOOKUP(RC[-2]*10+10002,世界等级任务事件!C[-2],1,FALSE)&IFERROR("|"&VLOOKUP(RC[-2]*10+10003,世界等级任务事件!C[-2],1,FALSE)&IFERROR("|"&VLOOKUP(RC[-2]*10+10004,世界等级任务事件!C[-2],1,FALSE)&IFERROR("|"&VLOOKUP(RC[-2]*10+10005,世界等级任务事件!C[-2],1,FALSE),""),""),""),"") -> 11911|11912|11913 | D197: 529592970 | E197: 0.100000000000002 | F197: =ROUND(RC[-4]/RC[-2]*100,2)&"%" -> 1.89%
A198: 192 | B198: =MIN(ROUND(RC[2]*RC[3]/5,0)*5,10000000) -> 10000000 | C198: =VLOOKUP(RC[-2]*10+10001,世界等级任务事件!C[-2],1,FALSE)&IFERROR("|"&VLOOKUP(RC[-2]*10+10002,世界等级任务事件!C[-2],1,FALSE)&IFERROR("|"&VLOOKUP(RC[-2]*10+10003,世界等级任务事件!C[-2],1,FALSE)&IFERROR("|"&VLOOKUP(RC[-2]*10+10004,世界等级任务事件!C[-2],1,FALSE)&IFERROR("|"&VLOOKUP(RC[-2]*10+10005,世界等级任务事件!C[-2],1,FALSE),""),""),""),"") -> 11921|11922|11923 | D198: 541719095 | E198: 0.100000000000002 | F198: =ROUND(RC[-4]/RC[-2]*100,2)&"%" -> 1.85%
A199: 193 | B199: =MIN(ROUND(RC[2]*RC[3]/5,0)*5,10000000) -> 10000000 | C199: =VLOOKUP(RC[-2]*10+10001,世界等级任务事件!C[-2],1,FALSE)&IFERROR("|"&VLOOKUP(RC[-2]*10+10002,世界等级任务事件!C[-2],1,FALSE)&IFERROR("|"&VLOOKUP(RC[-2]*10+10003,世界等级任务事件!C[-2],1,FALSE)&IFERROR("|"&VLOOKUP(RC[-2]*10+10004,世界等级任务事件!C[-2],1,FALSE)&IFERROR("|"&VLOOKUP(RC[-2]*10+10005,世界等级任务事件!C[-2],1,FALSE),""),""),""),"") -> 11931|11932|11933 | D199: 553942655 | E199: 0.100000000000002 | F199: =ROUND(RC[-4]/RC[-2]*100,2)&"%" -> 1.81%
A200: 194 | B200: =MIN(ROUND(RC[2]*RC[3]/5,0)*5,10000000) -> 10000000 | C200: =VLOOKUP(RC[-2]*10+10001,世界等级任务事件!C[-2],1,FALSE)&IFERROR("|"&VLOOKUP(RC[-2]*10+10002,世界等级任务事件!C[-2],1,FALSE)&IFERROR("|"&VLOOKUP(RC[-2]*10+10003,世界等级任务事件!C[-2],1,FALSE)&IFERROR("|"&VLOOKUP(RC[-2]*10+10004,世界等级任务事件!C[-2],1,FALSE)&IFERROR("|"&VLOOKUP(RC[-2]*10+10005,世界等级任务事件!C[-2],1,FALSE),""),""),""),"") -> 11941|11942|11943|11944 | D200: 566263645 | E200: 0.100000000000002 | F200: =ROUND(RC[-4]/RC[-2]*100,2)&"%" -> 1.77%
A201: 195 | B201: =MIN(ROUND(RC[2]*RC[3]/5,0)*5,10000000) -> 10000000 | C201: =VLOOKUP(RC[-2]*10+10001,世界等级任务事件!C[-2],1,FALSE)&IFERROR("|"&VLOOKUP(RC[-2]*10+10002,世界等级任务事件!C[-2],1,FALSE)&IFERROR("|"&VLOOKUP(RC[-2]*10+10003,世界等级任务事件!C[-2],1,FALSE)&IFERROR("|"&VLOOKUP(RC[-2]*10+10004,世界等级任务事件!C[-2],1,FALSE)&IFERROR("|"&VLOOKUP(RC[-2]*10+10005,世界等级任务事件!C[-2],1,FALSE),""),""),""),"") -> 11951|11952|11953 | D201: 578682065 | E201: 0.100000000000002 | F201: =ROUND(RC[-4]/RC[-2]*100,2)&"%" -> 1.73%
A202: 196 | B202: =MIN(ROUND(RC[2]*RC[3]/5,0)*5,10000000) -> 10000000 | C202: =VLOOKUP(RC[-2]*10+10001,世界等级任务事件!C[-2],1,FALSE)&IFERROR("|"&VLOOKUP(RC[-2]*10+10002,世界等级任务事件!C[-2],1,FALSE)&IFERROR("|"&VLOOKUP(RC[-2]*10+10003,世界等级任务事件!C[-2],1,FALSE)&IFERROR("|"&VLOOKUP(RC[-2]*10+10004,世界等级任务事件!C[-2],1,FALSE)&IFERROR("|"&VLOOKUP(RC[-2]*10+10005,世界等级任务事件!C[-2],1,FALSE),""),""),""),"") -> 11961|11962|11963|11964 | D202: 591613055 | E202: 0.100000000000002 | F202: =ROUND(RC[-4]/RC[-2]*100,2)&"%" -> 1.69%
A203: 197 | B203: =MIN(ROUND(RC[2]*RC[3]/5,0)*5,10000000) -> 10000000 | C203: =VLOOKUP(RC[-2]*10+10001,世界等级任务事件!C[-2],1,FALSE)&IFERROR("|"&VLOOKUP(RC[-2]*10+10002,世界等级任务事件!C[-2],1,FALSE)&IFERROR("|"&VLOOKUP(RC[-2]*10+10003,世界等级任务事件!C[-2],1,FALSE)&IFERROR("|"&VLOOKUP(RC[-2]*10+10004,世界等级任务事件!C[-2],1,FALSE)&IFERROR("|"&VLOOKUP(RC[-2]*10+10005,世界等级任务事件!C[-2],1,FALSE),""),""),""),"") -> 11971|11972|11973 | D203: 604645715 | E203: 0.100000000000002 | F203: =ROUND(RC[-4]/RC[-2]*100,2)&"%" -> 1.65%
A204: 198 | B204: =MIN(ROUND(RC[2]*RC[3]/5,0)*5,10000000) -> 10000000 | C204: =VLOOKUP(RC[-2]*10+10001,世界等级任务事件!C[-2],1,FALSE)&IFERROR("|"&VLOOKUP(RC[-2]*10+10002,世界等级任务事件!C[-2],1,FALSE)&IFERROR("|"&VLOOKUP(RC[-2]*10+10003,世界等级任务事件!C[-2],1,FALSE)&IFERROR("|"&VLOOKUP(RC[-2]*10+10004,世界等级任务事件!C[-2],1,FALSE)&IFERROR("|"&VLOOKUP(RC[-2]*10+10005,世界等级任务事件!C[-2],1,FALSE),""),""),""),"") -> 11981|11982|11983 | D204: 617780040 | E204: 0.100000000000002 | F204: =ROUND(RC[-4]/RC[-2]*100,2)&"%" -> 1.62%
A205: 199 | B205: =MIN(ROUND(RC[2]*RC[3]/5,0)*5,10000000) -> 10000000 | C205: =VLOOKUP(RC[-2]*10+10001,世界等级任务事件!C[-2],1,FALSE)&IFERROR("|"&VLOOKUP(RC[-2]*10+10002,世界等级任务事件!C[-2],1,FALSE)&IFERROR("|"&VLOOKUP(RC[-2]*10+10003,世界等级任务事件!C[-2],1,FALSE)&IFERROR("|"&VLOOKUP(RC[-2]*10+10004,世界等级任务事件!C[-2],1,FALSE)&IFERROR("|"&VLOOKUP(RC[-2]*10+10005,世界等级任务事件!C[-2],1,FALSE),""),""),""),"") -> 11991|11992|11993 | D205: 631016035 | E205: 0.100000000000002 | F205: =ROUND(RC[-4]/RC[-2]*100,2)&"%" -> 1.58%
A206: 200 | B206: =MIN(ROUND(RC[2]*RC[3]/5,0)*5,10000000) -> 10000000 | C206: =VLOOKUP(RC[-2]*10+10001,世界等级任务事件!C[-2],1,FALSE)&IFERROR("|"&VLOOKUP(RC[-2]*10+10002,世界等级任务事件!C[-2],1,FALSE)&IFERROR("|"&VLOOKUP(RC[-2]*10+10003,世界等级任务事件!C[-2],1,FALSE)&IFERROR("|"&VLOOKUP(RC[-2]*10+10004,世界等级任务事件!C[-2],1,FALSE)&IFERROR("|"&VLOOKUP(RC[-2]*10+10005,世界等级任务事件!C[-2],1,FALSE),""),""),""),"") -> 12001|12002|12003 | D206: 644353695 | E206: 0.100000000000002 | F206: =ROUND(RC[-4]/RC[-2]*100,2)&"%" -> 1.55%

Sheet: 世界等级任务事件
A1: task_id|task_id | B1: desc| | C1: task_type|task_type | D1: x|param_x | E1: y|param_y | F1: reward_item_id_list|reward_item_id_list | G1: reward_item_num_list|reward_item_num_list | H1: system_id|
A2: 不可空 | B2: 不可空 | C2: 不可空 | D2: 不可空 | E2: 不可空 | F2: 可空#不需字段 | G2: 可空#不需字段 | H2: 不可空
A3: 数字 | B3: 字符串 | C3: 数字 | D3: 数字 | E3: 数字 | F3: 一维数组 | G3: 一维数组 | H3: 数字
F4: 不定长 | G4: 不定长
A6: 任务ID | B6: 任务描述 | C6: 任务类型 | D6: 任务参数X | E6: 任务参数Y | F6: 奖励的物品ID列表 | G6: 奖励的物品数量列表 | H6: 前往的系统Id
A7: 11 | B7: =VLOOKUP(RC[1],Sheet4!C[-1]:C[2],2,FALSE)&VLOOKUP(RC[1],Sheet4!C[-1]:C[2],3,FALSE)&RC[2]&VLOOKUP(RC[1],Sheet4!C[-1]:C[2],4,FALSE)&"（%s/"&RC[2]&"）" -> 主线副本挑战3次（%s/3） | C7: 1 | D7: 3 | E7: 0 | F7: 19003 | G7: 5000 | H7: =VLOOKUP(RC[-5],Sheet4!C[-7]:C[-2],5,FALSE) -> 26
A8: 21 | B8: =VLOOKUP(RC[1],Sheet4!C[-1]:C[2],2,FALSE)&VLOOKUP(RC[1],Sheet4!C[-1]:C[2],3,FALSE)&RC[2]&VLOOKUP(RC[1],Sheet4!C[-1]:C[2],4,FALSE)&"（%s/"&RC[2]&"）" -> 主线副本挑战6次（%s/6） | C8: 1 | D8: 6 | E8: 0 | F8: 19005 | G8: 20 | H8: =VLOOKUP(RC[-5],Sheet4!C[-7]:C[-2],5,FALSE) -> 26
A9: 31 | B9: =VLOOKUP(RC[1],Sheet4!C[-1]:C[2],2,FALSE)&VLOOKUP(RC[1],Sheet4!C[-1]:C[2],3,FALSE)&RC[2]&VLOOKUP(RC[1],Sheet4!C[-1]:C[2],4,FALSE)&"（%s/"&RC[2]&"）" -> 进行召唤3次（%s/3） | C9: 8 | D9: 3 | E9: 0 | F9: 10019 | G9: 1 | H9: =VLOOKUP(RC[-5],Sheet4!C[-7]:C[-2],5,FALSE) -> 9
A10: 41 | B10: =VLOOKUP(RC[1],Sheet4!C[-1]:C[2],2,FALSE)&VLOOKUP(RC[1],Sheet4!C[-1]:C[2],3,FALSE)&RC[2]&VLOOKUP(RC[1],Sheet4!C[-1]:C[2],4,FALSE)&"（%s/"&RC[2]&"）" -> 赠送好友精力1次（%s/1） | C10: 4 | D10: 1 | E10: 0 | F10: 19005 | G10: 20 | H10: =VLOOKUP(RC[-5],Sheet4!C[-7]:C[-2],5,FALSE) -> 15
A11: 51 | B11: =VLOOKUP(RC[1],Sheet4!C[-1]:C[2],2,FALSE)&VLOOKUP(RC[1],Sheet4!C[-1]:C[2],3,FALSE)&RC[2]&VLOOKUP(RC[1],Sheet4!C[-1]:C[2],4,FALSE)&"（%s/"&RC[2]&"）" -> 购买体力1次（%s/1） | C11: 6 | D11: 1 | E11: 0 | F11: 19005 | G11: 20 | H11: =VLOOKUP(RC[-5],Sheet4!C[-7]:C[-2],5,FALSE) -> 12
A12: 61 | B12: =VLOOKUP(RC[1],Sheet4!C[-1]:C[2],2,FALSE)&VLOOKUP(RC[1],Sheet4!C[-1]:C[2],3,FALSE)&RC[2]&VLOOKUP(RC[1],Sheet4!C[-1]:C[2],4,FALSE)&"（%s/"&RC[2]&"）" -> 购买精力1次（%s/1） | C12: 7 | D12: 1 | E12: 0 | F12: 19005 | G12: 20 | H12: =VLOOKUP(RC[-5],Sheet4!C[-7]:C[-2],5,FALSE) -> 12
A13: 71 | B13: =VLOOKUP(RC[1],Sheet4!C[-1]:C[2],2,FALSE)&VLOOKUP(RC[1],Sheet4!C[-1]:C[2],3,FALSE)&RC[2]&VLOOKUP(RC[1],Sheet4!C[-1]:C[2],4,FALSE)&"（%s/"&RC[2]&"）" -> 进行高级召唤1次（%s/1） | C13: 9 | D13: 1 | E13: 0 | F13: 10019 | G13: 1 | H13: =VLOOKUP(RC[-5],Sheet4!C[-7]:C[-2],5,FALSE) -> 9
A14: 81 | B14: =VLOOKUP(RC[1],Sheet4!C[-1]:C[2],2,FALSE)&VLOOKUP(RC[1],Sheet4!C[-1]:C[2],3,FALSE)&RC[2]&VLOOKUP(RC[1],Sheet4!C[-1]:C[2],4,FALSE)&"（%s/"&RC[2]&"）" -> 装备强化10次（%s/10） | C14: 21 | D14: 10 | E14: 0 | F14: 19003 | G14: 10000 | H14: =VLOOKUP(RC[-5],Sheet4!C[-7]:C[-2],5,FALSE) -> 8
A15: 91 | B15: =VLOOKUP(RC[1],Sheet4!C[-1]:C[2],2,FALSE)&VLOOKUP(RC[1],Sheet4!C[-1]:C[2],3,FALSE)&RC[2]&VLOOKUP(RC[1],Sheet4!C[-1]:C[2],4,FALSE)&"（%s/"&RC[2]&"）" -> 英雄培养5次（%s/5） | C15: 3 | D15: 5 | E15: 0 | F15: 10003 | G15: 10 | H15: =VLOOKUP(RC[-5],Sheet4!C[-7]:C[-2],5,FALSE) -> 8
A16: 101 | B16: =VLOOKUP(RC[1],Sheet4!C[-1]:C[2],2,FALSE)&VLOOKUP(RC[1],Sheet4!C[-1]:C[2],3,FALSE)&RC[2]&VLOOKUP(RC[1],Sheet4!C[-1]:C[2],4,FALSE)&"（%s/"&RC[2]&"）" -> 竞技场战斗3次（%s/3） | C16: 10 | D16: 3 | E16: 0 | F16: 19013 | G16: 100 | H16: =VLOOKUP(RC[-5],Sheet4!C[-7]:C[-2],5,FALSE) -> 21
A17: 111 | B17: =VLOOKUP(RC[1],Sheet4!C[-1]:C[2],2,FALSE)&VLOOKUP(RC[1],Sheet4!C[-1]:C[2],3,FALSE)&RC[2]&VLOOKUP(RC[1],Sheet4!C[-1]:C[2],4,FALSE)&"（%s/"&RC[2]&"）" -> 英雄商店购买1次（%s/1） | C17: 5 | D17: 1 | E17: 0 | F17: 19006 | G17: 30 | H17: =VLOOKUP(RC[-5],Sheet4!C[-7]:C[-2],5,FALSE) -> 11
A18: 121 | B18: =VLOOKUP(RC[1],Sheet4!C[-1]:C[2],2,FALSE)&VLOOKUP(RC[1],Sheet4!C[-1]:C[2],3,FALSE)&RC[2]&VLOOKUP(RC[1],Sheet4!C[-1]:C[2],4,FALSE)&"（%s/"&RC[2]&"）" -> 主线副本挑战3次（%s/3） | C18: 1 | D18: 3 | E18: 0 | F18: 19003 | G18: 10000 | H18: =VLOOKUP(RC[-5],Sheet4!C[-7]:C[-2],5,FALSE) -> 26
A19: 131 | B19: =VLOOKUP(RC[1],Sheet4!C[-1]:C[2],2,FALSE)&VLOOKUP(RC[1],Sheet4!C[-1]:C[2],3,FALSE)&RC[2]&VLOOKUP(RC[1],Sheet4!C[-1]:C[2],4,FALSE)&"（%s/"&RC[2]&"）" -> 圣器争夺2次（%s/2） | C19: 11 | D19: 2 | E19: 0 | F19: 13049 | G19: 3 | H19: =VLOOKUP(RC[-5],Sheet4!C[-7]:C[-2],5,FALSE) -> 19
A20: 132 | B20: =VLOOKUP(RC[1],Sheet4!C[-1]:C[2],2,FALSE)&VLOOKUP(RC[1],Sheet4!C[-1]:C[2],3,FALSE)&RC[2]&VLOOKUP(RC[1],Sheet4!C[-1]:C[2],4,FALSE)&"（%s/"&RC[2]&"）" -> 圣器合成2次（%s/2） | C20: 22 | D20: 2 | E20: 0 | F20: 13049 | G20: 3 | H20: =VLOOKUP(RC[-5],Sheet4!C[-7]:C[-2],5,FALSE) -> 19
A21: 133 | B21: =VLOOKUP(RC[1],Sheet4!C[-1]:C[2],2,FALSE)&VLOOKUP(RC[1],Sheet4!C[-1]:C[2],3,FALSE)&RC[2]&VLOOKUP(RC[1],Sheet4!C[-1]:C[2],4,FALSE)&"（%s/"&RC[2]&"）" -> 圣器强化2次（%s/2） | C21: 2 | D21: 2 | E21: 0 | F21: 13049 | G21: 3 | H21: =VLOOKUP(RC[-5],Sheet4!C[-7]:C[-2],5,FALSE) -> 8
A22: 141 | B22: =VLOOKUP(RC[1],Sheet4!C[-1]:C[2],2,FALSE)&VLOOKUP(RC[1],Sheet4!C[-1]:C[2],3,FALSE)&RC[2]&VLOOKUP(RC[1],Sheet4!C[-1]:C[2],4,FALSE)&"（%s/"&RC[2]&"）" -> 赠送好友精力1次（%s/1） | C22: 4 | D22: 1 | E22: 0 | F22: 19005 | G22: 20 | H22: =VLOOKUP(RC[-5],Sheet4!C[-7]:C[-2],5,FALSE) -> 15
A23: 151 | B23: =VLOOKUP(RC[1],Sheet4!C[-1]:C[2],2,FALSE)&VLOOKUP(RC[1],Sheet4!C[-1]:C[2],3,FALSE)&RC[2]&VLOOKUP(RC[1],Sheet4!C[-1]:C[2],4,FALSE)&"（%s/"&RC[2]&"）" -> 进行召唤3次（%s/3） | C23: 8 | D23: 3 | E23: 0 | F23: 10019 | G23: 1 | H23: =VLOOKUP(RC[-5],Sheet4!C[-7]:C[-2],5,FALSE) -> 9
A24: 161 | B24: =VLOOKUP(RC[1],Sheet4!C[-1]:C[2],2,FALSE)&VLOOKUP(RC[1],Sheet4!C[-1]:C[2],3,FALSE)&RC[2]&VLOOKUP(RC[1],Sheet4!C[-1]:C[2],4,FALSE)&"（%s/"&RC[2]&"）" -> 购买体力1次（%s/1） | C24: 6 | D24: 1 | E24: 0 | F24: 19005 | G24: 20 | H24: =VLOOKUP(RC[-5],Sheet4!C[-7]:C[-2],5,FALSE) -> 12
A25: 162 | B25: =VLOOKUP(RC[1],Sheet4!C[-1]:C[2],2,FALSE)&VLOOKUP(RC[1],Sheet4!C[-1]:C[2],3,FALSE)&RC[2]&VLOOKUP(RC[1],Sheet4!C[-1]:C[2],4,FALSE)&"（%s/"&RC[2]&"）" -> 购买精力1次（%s/1） | C25: 7 | D25: 1 | E25: 0 | F25: 19005 | G25: 20 | H25: =VLOOKUP(RC[-5],Sheet4!C[-7]:C[-2],5,FALSE) -> 12
A26: 171 | B26: =VLOOKUP(RC[1],Sheet4!C[-1]:C[2],2,FALSE)&VLOOKUP(RC[1],Sheet4!C[-1]:C[2],3,FALSE)&RC[2]&VLOOKUP(RC[1],Sheet4!C[-1]:C[2],4,FALSE)&"（%s/"&RC[2]&"）" -> 进行高级召唤1次（%s/1） | C26: 9 | D26: 1 | E26: 0 | F26: 10019 | G26: 1 | H26: =VLOOKUP(RC[-5],Sheet4!C[-7]:C[-2],5,FALSE) -> 9
A27: 181 | B27: =VLOOKUP(RC[1],Sheet4!C[-1]:C[2],2,FALSE)&VLOOKUP(RC[1],Sheet4!C[-1]:C[2],3,FALSE)&RC[2]&VLOOKUP(RC[1],Sheet4!C[-1]:C[2],4,FALSE)&"（%s/"&RC[2]&"）" -> 装备强化10次（%s/10） | C27: 21 | D27: 10 | E27: 0 | F27: 19003 | G27: 20000 | H27: =VLOOKUP(RC[-5],Sheet4!C[-7]:C[-2],5,FALSE) -> 8
A28: 191 | B28: =VLOOKUP(RC[1],Sheet4!C[-1]:C[2],2,FALSE)&VLOOKUP(RC[1],Sheet4!C[-1]:C[2],3,FALSE)&RC[2]&VLOOKUP(RC[1],Sheet4!C[-1]:C[2],4,FALSE)&"（%s/"&RC[2]&"）" -> 英雄培养5次（%s/5） | C28: 3 | D28: 5 | E28: 0 | F28: 10003 | G28: 15 | H28: =VLOOKUP(RC[-5],Sheet4!C[-7]:C[-2],5,FALSE) -> 8
A29: 201 | B29: =VLOOKUP(RC[1],Sheet4!C[-1]:C[2],2,FALSE)&VLOOKUP(RC[1],Sheet4!C[-1]:C[2],3,FALSE)&RC[2]&VLOOKUP(RC[1],Sheet4!C[-1]:C[2],4,FALSE)&"（%s/"&RC[2]&"）" -> 进入勇者试练战斗3次（%s/3） | C29: 12 | D29: 3 | E29: 0 | F29: 19012 | G29: 300 | H29: =VLOOKUP(RC[-5],Sheet4!C[-7]:C[-2],5,FALSE) -> 17
A30: 211 | B30: =VLOOKUP(RC[1],Sheet4!C[-1]:C[2],2,FALSE)&VLOOKUP(RC[1],Sheet4!C[-1]:C[2],3,FALSE)&RC[2]&VLOOKUP(RC[1],Sheet4!C[-1]:C[2],4,FALSE)&"（%s/"&RC[2]&"）" -> 竞技场战斗3次（%s/3） | C30: 10 | D30: 3 | E30: 0 | F30: 19013 | G30: 150 | H30: =VLOOKUP(RC[-5],Sheet4!C[-7]:C[-2],5,FALSE) -> 21
A31: 221 | B31: =VLOOKUP(RC[1],Sheet4!C[-1]:C[2],2,FALSE)&VLOOKUP(RC[1],Sheet4!C[-1]:C[2],3,FALSE)&RC[2]&VLOOKUP(RC[1],Sheet4!C[-1]:C[2],4,FALSE)&"（%s/"&RC[2]&"）" -> 英雄商店购买1次（%s/1） | C31: 5 | D31: 1 | E31: 0 | F31: 19006 | G31: 50 | H31: =VLOOKUP(RC[-5],Sheet4!C[-7]:C[-2],5,FALSE) -> 11
A32: 231 | B32: =VLOOKUP(RC[1],Sheet4!C[-1]:C[2],2,FALSE)&VLOOKUP(RC[1],Sheet4!C[-1]:C[2],3,FALSE)&RC[2]&VLOOKUP(RC[1],Sheet4!C[-1]:C[2],4,FALSE)&"（%s/"&RC[2]&"）" -> 主线副本挑战3次（%s/3） | C32: 1 | D32: 3 | E32: 0 | F32: 19003 | G32: 20000 | H32: =VLOOKUP(RC[-5],Sheet4!C[-7]:C[-2],5,FALSE) -> 26
A33: 241 | B33: =VLOOKUP(RC[1],Sheet4!C[-1]:C[2],2,FALSE)&VLOOKUP(RC[1],Sheet4!C[-1]:C[2],3,FALSE)&RC[2]&VLOOKUP(RC[1],Sheet4!C[-1]:C[2],4,FALSE)&"（%s/"&RC[2]&"）" -> 日常副本战斗2次（%s/2） | C33: 13 | D33: 2 | E33: 0 | F33: 19005 | G33: 20 | H33: =VLOOKUP(RC[-5],Sheet4!C[-7]:C[-2],5,FALSE) -> 2
A34: 251 | B34: =VLOOKUP(RC[1],Sheet4!C[-1]:C[2],2,FALSE)&VLOOKUP(RC[1],Sheet4!C[-1]:C[2],3,FALSE)&RC[2]&VLOOKUP(RC[1],Sheet4!C[-1]:C[2],4,FALSE)&"（%s/"&RC[2]&"）" -> 遗迹探索1小时（%s/1） | C34: 19 | D34: 1 | E34: 0 | F34: 19003 | G34: 25000 | H34: =VLOOKUP(RC[-5],Sheet4!C[-7]:C[-2],5,FALSE) -> 20
A35: 261 | B35: =VLOOKUP(RC[1],Sheet4!C[-1]:C[2],2,FALSE)&VLOOKUP(RC[1],Sheet4!C[-1]:C[2],3,FALSE)&RC[2]&VLOOKUP(RC[1],Sheet4!C[-1]:C[2],4,FALSE)&"（%s/"&RC[2]&"）" -> 击杀遗迹破坏者1次（%s/1） | C35: 16 | D35: 1 | E35: 0 | F35: 19005 | G35: 20 | H35: =VLOOKUP(RC[-5],Sheet4!C[-7]:C[-2],5,FALSE) -> 20
A36: 271 | B36: =VLOOKUP(RC[1],Sheet4!C[-1]:C[2],2,FALSE)&VLOOKUP(RC[1],Sheet4!C[-1]:C[2],3,FALSE)&RC[2]&VLOOKUP(RC[1],Sheet4!C[-1]:C[2],4,FALSE)&"（%s/"&RC[2]&"）" -> 英雄副本战斗1次（%s/1） | C36: 14 | D36: 1 | E36: 0 | F36: 19006 | G36: 50 | H36: =VLOOKUP(RC[-5],Sheet4!C[-7]:C[-2],5,FALSE) -> 27
A37: 281 | B37: =VLOOKUP(RC[1],Sheet4!C[-1]:C[2],2,FALSE)&VLOOKUP(RC[1],Sheet4!C[-1]:C[2],3,FALSE)&RC[2]&VLOOKUP(RC[1],Sheet4!C[-1]:C[2],4,FALSE)&"（%s/"&RC[2]&"）" -> 圣器争夺3次（%s/3） | C37: 11 | D37: 3 | E37: 0 | F37: 13049 | G37: 5 | H37: =VLOOKUP(RC[-5],Sheet4!C[-7]:C[-2],5,FALSE) -> 19
A38: 282 | B38: =VLOOKUP(RC[1],Sheet4!C[-1]:C[2],2,FALSE)&VLOOKUP(RC[1],Sheet4!C[-1]:C[2],3,FALSE)&RC[2]&VLOOKUP(RC[1],Sheet4!C[-1]:C[2],4,FALSE)&"（%s/"&RC[2]&"）" -> 圣器合成2次（%s/2） | C38: 22 | D38: 2 | E38: 0 | F38: 13049 | G38: 5 | H38: =VLOOKUP(RC[-5],Sheet4!C[-7]:C[-2],5,FALSE) -> 19
A39: 291 | B39: =VLOOKUP(RC[1],Sheet4!C[-1]:C[2],2,FALSE)&VLOOKUP(RC[1],Sheet4!C[-1]:C[2],3,FALSE)&RC[2]&VLOOKUP(RC[1],Sheet4!C[-1]:C[2],4,FALSE)&"（%s/"&RC[2]&"）" -> 圣器强化3次（%s/3） | C39: 2 | D39: 3 | E39: 0 | F39: 13049 | G39: 5 | H39: =VLOOKUP(RC[-5],Sheet4!C[-7]:C[-2],5,FALSE) -> 8
A40: 301 | B40: =VLOOKUP(RC[1],Sheet4!C[-1]:C[2],2,FALSE)&VLOOKUP(RC[1],Sheet4!C[-1]:C[2],3,FALSE)&RC[2]&VLOOKUP(RC[1],Sheet4!C[-1]:C[2],4,FALSE)&"（%s/"&RC[2]&"）" -> 赠送好友精力3次（%s/3） | C40: 4 | D40: 3 | E40: 0 | F40: 19005 | G40: 30 | H40: =VLOOKUP(RC[-5],Sheet4!C[-7]:C[-2],5,FALSE) -> 15
A41: 311 | B41: =VLOOKUP(RC[1],Sheet4!C[-1]:C[2],2,FALSE)&VLOOKUP(RC[1],Sheet4!C[-1]:C[2],3,FALSE)&RC[2]&VLOOKUP(RC[1],Sheet4!C[-1]:C[2],4,FALSE)&"（%s/"&RC[2]&"）" -> 进行召唤5次（%s/5） | C41: 8 | D41: 5 | E41: 0 | F41: 19006 | G41: 60 | H41: =VLOOKUP(RC[-5],Sheet4!C[-7]:C[-2],5,FALSE) -> 9
A42: 312 | B42: =VLOOKUP(RC[1],Sheet4!C[-1]:C[2],2,FALSE)&VLOOKUP(RC[1],Sheet4!C[-1]:C[2],3,FALSE)&RC[2]&VLOOKUP(RC[1],Sheet4!C[-1]:C[2],4,FALSE)&"（%s/"&RC[2]&"）" -> 进行高级召唤2次（%s/2） | C42: 9 | D42: 2 | E42: 0 | F42: 19006 | G42: 80 | H42: =VLOOKUP(RC[-5],Sheet4!C[-7]:C[-2],5,FALSE) -> 9
A43: 321 | B43: =VLOOKUP(RC[1],Sheet4!C[-1]:C[2],2,FALSE)&VLOOKUP(RC[1],Sheet4!C[-1]:C[2],3,FALSE)&RC[2]&VLOOKUP(RC[1],Sheet4!C[-1]:C[2],4,FALSE)&"（%s/"&RC[2]&"）" -> 购买体力2次（%s/2） | C43: 6 | D43: 2 | E43: 0 | F43: 19005 | G43: 30 | H43: =VLOOKUP(RC[-5],Sheet4!C[-7]:C[-2],5,FALSE) -> 12
A44: 322 | B44: =VLOOKUP(RC[1],Sheet4!C[-1]:C[2],2,FALSE)&VLOOKUP(RC[1],Sheet4!C[-1]:C[2],3,FALSE)&RC[2]&VLOOKUP(RC[1],Sheet4!C[-1]:C[2],4,FALSE)&"（%s/"&RC[2]&"）" -> 购买精力2次（%s/2） | C44: 7 | D44: 2 | E44: 0 | F44: 19005 | G44: 30 | H44: =VLOOKUP(RC[-5],Sheet4!C[-7]:C[-2],5,FALSE) -> 12
A45: 331 | B45: =VLOOKUP(RC[1],Sheet4!C[-1]:C[2],2,FALSE)&VLOOKUP(RC[1],Sheet4!C[-1]:C[2],3,FALSE)&RC[2]&VLOOKUP(RC[1],Sheet4!C[-1]:C[2],4,FALSE)&"（%s/"&RC[2]&"）" -> 英雄培养10次（%s/10） | C45: 3 | D45: 10 | E45: 0 | F45: 10003 | G45: 20 | H45: =VLOOKUP(RC[-5],Sheet4!C[-7]:C[-2],5,FALSE) -> 8
A46: 341 | B46: =VLOOKUP(RC[1],Sheet4!C[-1]:C[2],2,FALSE)&VLOOKUP(RC[1],Sheet4!C[-1]:C[2],3,FALSE)&RC[2]&VLOOKUP(RC[1],Sheet4!C[-1]:C[2],4,FALSE)&"（%s/"&RC[2]&"）" -> 进入勇者试练战斗3次（%s/3） | C46: 12 | D46: 3 | E46: 0 | F46: 19012 | G46: 400 | H46: =VLOOKUP(RC[-5],Sheet4!C[-7]:C[-2],5,FALSE) -> 17
A47: 351 | B47: =VLOOKUP(RC[1],Sheet4!C[-1]:C[2],2,FALSE)&VLOOKUP(RC[1],Sheet4!C[-1]:C[2],3,FALSE)&RC[2]&VLOOKUP(RC[1],Sheet4!C[-1]:C[2],4,FALSE)&"（%s/"&RC[2]&"）" -> 异度入侵分享2次（%s/2） | C47: 17 | D47: 2 | E47: 0 | F47: 19014 | G47: 400 | H47: =VLOOKUP(RC[-5],Sheet4!C[-7]:C[-2],5,FALSE) -> 16
A48: 352 | B48: =VLOOKUP(RC[1],Sheet4!C[-1]:C[2],2,FALSE)&VLOOKUP(RC[1],Sheet4!C[-1]:C[2],3,FALSE)&RC[2]&VLOOKUP(RC[1],Sheet4!C[-1]:C[2],4,FALSE)&"（%s/"&RC[2]&"）" -> 讨伐异度入侵者2次（%s/2） | C48: 18 | D48: 2 | E48: 0 | F48: 19014 | G48: 400 | H48: =VLOOKUP(RC[-5],Sheet4!C[-7]:C[-2],5,FALSE) -> 16
A49: 361 | B49: =VLOOKUP(RC[1],Sheet4!C[-1]:C[2],2,FALSE)&VLOOKUP(RC[1],Sheet4!C[-1]:C[2],3,FALSE)&RC[2]&VLOOKUP(RC[1],Sheet4!C[-1]:C[2],4,FALSE)&"（%s/"&RC[2]&"）" -> 竞技场战斗5次（%s/5） | C49: 10 | D49: 5 | E49: 0 | F49: 19013 | G49: 200 | H49: =VLOOKUP(RC[-5],Sheet4!C[-7]:C[-2],5,FALSE) -> 21
A50: 362 | B50: =VLOOKUP(RC[1],Sheet4!C[-1]:C[2],2,FALSE)&VLOOKUP(RC[1],Sheet4!C[-1]:C[2],3,FALSE)&RC[2]&VLOOKUP(RC[1],Sheet4!C[-1]:C[2],4,FALSE)&"（%s/"&RC[2]&"）" -> 主线副本挑战5次（%s/5） | C50: 1 | D50: 5 | E50: 0 | F50: 19003 | G50: 30000 | H50: =VLOOKUP(RC[-5],Sheet4!C[-7]:C[-2],5,FALSE) -> 26
A51: 371 | B51: =VLOOKUP(RC[1],Sheet4!C[-1]:C[2],2,FALSE)&VLOOKUP(RC[1],Sheet4!C[-1]:C[2],3,FALSE)&RC[2]&VLOOKUP(RC[1],Sheet4!C[-1]:C[2],4,FALSE)&"（%s/"&RC[2]&"）" -> 无尽深渊战斗1次（%s/1） | C51: 23 | D51: 1 | E51: 0 | F51: 19028 | G51: 50 | H51: =VLOOKUP(RC[-5],Sheet4!C[-7]:C[-2],5,FALSE) -> 88
A52: 381 | B52: =VLOOKUP(RC[1],Sheet4!C[-1]:C[2],2,FALSE)&VLOOKUP(RC[1],Sheet4!C[-1]:C[2],3,FALSE)&RC[2]&VLOOKUP(RC[1],Sheet4!C[-1]:C[2],4,FALSE)&"（%s/"&RC[2]&"）" -> 英雄商店购买1次（%s/1） | C52: 5 | D52: 1 | E52: 0 | F52: 19006 | G52: 60 | H52: =VLOOKUP(RC[-5],Sheet4!C[-7]:C[-2],5,FALSE) -> 11
A53: 382 | B53: =VLOOKUP(RC[1],Sheet4!C[-1]:C[2],2,FALSE)&VLOOKUP(RC[1],Sheet4!C[-1]:C[2],3,FALSE)&RC[2]&VLOOKUP(RC[1],Sheet4!C[-1]:C[2],4,FALSE)&"（%s/"&RC[2]&"）" -> 日常副本战斗4次（%s/4） | C53: 13 | D53: 4 | E53: 0 | F53: 19005 | G53: 30 | H53: =VLOOKUP(RC[-5],Sheet4!C[-7]:C[-2],5,FALSE) -> 2
A54: 391 | B54: =VLOOKUP(RC[1],Sheet4!C[-1]:C[2],2,FALSE)&VLOOKUP(RC[1],Sheet4!C[-1]:C[2],3,FALSE)&RC[2]&VLOOKUP(RC[1],Sheet4!C[-1]:C[2],4,FALSE)&"（%s/"&RC[2]&"）" -> 遗迹探索4小时（%s/4） | C54: 19 | D54: 4 | E54: 0 | F54: 19003 | G54: 30000 | H54: =VLOOKUP(RC[-5],Sheet4!C[-7]:C[-2],5,FALSE) -> 20
A55: 392 | B55: =VLOOKUP(RC[1],Sheet4!C[-1]:C[2],2,FALSE)&VLOOKUP(RC[1],Sheet4!C[-1]:C[2],3,FALSE)&RC[2]&VLOOKUP(RC[1],Sheet4!C[-1]:C[2],4,FALSE)&"（%s/"&RC[2]&"）" -> 击杀遗迹破坏者3次（%s/3） | C55: 16 | D55: 3 | E55: 0 | F55: 19005 | G55: 30 | H55: =VLOOKUP(RC[-5],Sheet4!C[-7]:C[-2],5,FALSE) -> 20
A56: 401 | B56: =VLOOKUP(RC[1],Sheet4!C[-1]:C[2],2,FALSE)&VLOOKUP(RC[1],Sheet4!C[-1]:C[2],3,FALSE)&RC[2]&VLOOKUP(RC[1],Sheet4!C[-1]:C[2],4,FALSE)&"（%s/"&RC[2]&"）" -> 英雄副本战斗1次（%s/1） | C56: 14 | D56: 1 | E56: 0 | F56: 19006 | G56: 60 | H56: =VLOOKUP(RC[-5],Sheet4!C[-7]:C[-2],5,FALSE) -> 27
A57: 411 | B57: =VLOOKUP(RC[1],Sheet4!C[-1]:C[2],2,FALSE)&VLOOKUP(RC[1],Sheet4!C[-1]:C[2],3,FALSE)&RC[2]&VLOOKUP(RC[1],Sheet4!C[-1]:C[2],4,FALSE)&"（%s/"&RC[2]&"）" -> 圣器争夺5次（%s/5） | C57: 11 | D57: 5 | E57: 0 | F57: 13049 | G57: 5 | H57: =VLOOKUP(RC[-5],Sheet4!C[-7]:C[-2],5,FALSE) -> 19
A58: 412 | B58: =VLOOKUP(RC[1],Sheet4!C[-1]:C[2],2,FALSE)&VLOOKUP(RC[1],Sheet4!C[-1]:C[2],3,FALSE)&RC[2]&VLOOKUP(RC[1],Sheet4!C[-1]:C[2],4,FALSE)&"（%s/"&RC[2]&"）" -> 圣器合成3次（%s/3） | C58: 22 | D58: 3 | E58: 0 | F58: 13049 | G58: 5 | H58: =VLOOKUP(RC[-5],Sheet4!C[-7]:C[-2],5,FALSE) -> 19
A59: 413 | B59: =VLOOKUP(RC[1],Sheet4!C[-1]:C[2],2,FALSE)&VLOOKUP(RC[1],Sheet4!C[-1]:C[2],3,FALSE)&RC[2]&VLOOKUP(RC[1],Sheet4!C[-1]:C[2],4,FALSE)&"（%s/"&RC[2]&"）" -> 圣器强化5次（%s/5） | C59: 2 | D59: 5 | E59: 0 | F59: 13049 | G59: 5 | H59: =VLOOKUP(RC[-5],Sheet4!C[-7]:C[-2],5,FALSE) -> 8
A60: 421 | B60: =VLOOKUP(RC[1],Sheet4!C[-1]:C[2],2,FALSE)&VLOOKUP(RC[1],Sheet4!C[-1]:C[2],3,FALSE)&RC[2]&VLOOKUP(RC[1],Sheet4!C[-1]:C[2],4,FALSE)&"（%s/"&RC[2]&"）" -> 赠送好友精力3次（%s/3） | C60: 4 | D60: 3 | E60: 0 | F60: 19005 | G60: 40 | H60: =VLOOKUP(RC[-5],Sheet4!C[-7]:C[-2],5,FALSE) -> 15
A61: 422 | B61: =VLOOKUP(RC[1],Sheet4!C[-1]:C[2],2,FALSE)&VLOOKUP(RC[1],Sheet4!C[-1]:C[2],3,FALSE)&RC[2]&VLOOKUP(RC[1],Sheet4!C[-1]:C[2],4,FALSE)&"（%s/"&RC[2]&"）" -> 进行召唤5次（%s/5） | C61: 8 | D61: 5 | E61: 0 | F61: 19006 | G61: 60 | H61: =VLOOKUP(RC[-5],Sheet4!C[-7]:C[-2],5,FALSE) -> 9
A62: 423 | B62: =VLOOKUP(RC[1],Sheet4!C[-1]:C[2],2,FALSE)&VLOOKUP(RC[1],Sheet4!C[-1]:C[2],3,FALSE)&RC[2]&VLOOKUP(RC[1],Sheet4!C[-1]:C[2],4,FALSE)&"（%s/"&RC[2]&"）" -> 进行高级召唤2次（%s/2） | C62: 9 | D62: 2 | E62: 0 | F62: 19006 | G62: 80 | H62: =VLOOKUP(RC[-5],Sheet4!C[-7]:C[-2],5,FALSE) -> 9
A63: 431 | B63: =VLOOKUP(RC[1],Sheet4!C[-1]:C[2],2,FALSE)&VLOOKUP(RC[1],Sheet4!C[-1]:C[2],3,FALSE)&RC[2]&VLOOKUP(RC[1],Sheet4!C[-1]:C[2],4,FALSE)&"（%s/"&RC[2]&"）" -> 购买体力2次（%s/2） | C63: 6 | D63: 2 | E63: 0 | F63: 19005 | G63: 40 | H63: =VLOOKUP(RC[-5],Sheet4!C[-7]:C[-2],5,FALSE) -> 12
A64: 432 | B64: =VLOOKUP(RC[1],Sheet4!C[-1]:C[2],2,FALSE)&VLOOKUP(RC[1],Sheet4!C[-1]:C[2],3,FALSE)&RC[2]&VLOOKUP(RC[1],Sheet4!C[-1]:C[2],4,FALSE)&"（%s/"&RC[2]&"）" -> 购买精力2次（%s/2） | C64: 7 | D64: 2 | E64: 0 | F64: 19005 | G64: 40 | H64: =VLOOKUP(RC[-5],Sheet4!C[-7]:C[-2],5,FALSE) -> 12
A65: 441 | B65: =VLOOKUP(RC[1],Sheet4!C[-1]:C[2],2,FALSE)&VLOOKUP(RC[1],Sheet4!C[-1]:C[2],3,FALSE)&RC[2]&VLOOKUP(RC[1],Sheet4!C[-1]:C[2],4,FALSE)&"（%s/"&RC[2]&"）" -> 英雄培养15次（%s/15） | C65: 3 | D65: 15 | E65: 0 | F65: 10003 | G65: 30 | H65: =VLOOKUP(RC[-5],Sheet4!C[-7]:C[-2],5,FALSE) -> 8
A66: 442 | B66: =VLOOKUP(RC[1],Sheet4!C[-1]:C[2],2,FALSE)&VLOOKUP(RC[1],Sheet4!C[-1]:C[2],3,FALSE)&RC[2]&VLOOKUP(RC[1],Sheet4!C[-1]:C[2],4,FALSE)&"（%s/"&RC[2]&"）" -> 进入勇者试练战斗10次（%s/10） | C66: 12 | D66: 10 | E66: 0 | F66: 19012 | G66: 500 | H66: =VLOOKUP(RC[-5],Sheet4!C[-7]:C[-2],5,FALSE) -> 17
A67: 451 | B67: =VLOOKUP(RC[1],Sheet4!C[-1]:C[2],2,FALSE)&VLOOKUP(RC[1],Sheet4!C[-1]:C[2],3,FALSE)&RC[2]&VLOOKUP(RC[1],Sheet4!C[-1]:C[2],4,FALSE)&"（%s/"&RC[2]&"）" -> 精英副本战斗1次（%s/1） | C67: 15 | D67: 1 | E67: 0 | F67: 10008 | G67: 20 | H67: =VLOOKUP(RC[-5],Sheet4!C[-7]:C[-2],5,FALSE) -> 28
A68: 461 | B68: =VLOOKUP(RC[1],Sheet4!C[-1]:C[2],2,FALSE)&VLOOKUP(RC[1],Sheet4!C[-1]:C[2],3,FALSE)&RC[2]&VLOOKUP(RC[1],Sheet4!C[-1]:C[2],4,FALSE)&"（%s/"&RC[2]&"）" -> 异度入侵分享2次（%s/2） | C68: 17 | D68: 2 | E68: 0 | F68: 19014 | G68: 500 | H68: =VLOOKUP(RC[-5],Sheet4!C[-7]:C[-2],5,FALSE) -> 16
A69: 462 | B69: =VLOOKUP(RC[1],Sheet4!C[-1]:C[2],2,FALSE)&VLOOKUP(RC[1],Sheet4!C[-1]:C[2],3,FALSE)&RC[2]&VLOOKUP(RC[1],Sheet4!C[-1]:C[2],4,FALSE)&"（%s/"&RC[2]&"）" -> 讨伐异度入侵者2次（%s/2） | C69: 18 | D69: 2 | E69: 0 | F69: 19014 | G69: 500 | H69: =VLOOKUP(RC[-5],Sheet4!C[-7]:C[-2],5,FALSE) -> 16
A70: 471 | B70: =VLOOKUP(RC[1],Sheet4!C[-1]:C[2],2,FALSE)&VLOOKUP(RC[1],Sheet4!C[-1]:C[2],3,FALSE)&RC[2]&VLOOKUP(RC[1],Sheet4!C[-1]:C[2],4,FALSE)&"（%s/"&RC[2]&"）" -> 竞技场战斗5次（%s/5） | C70: 10 | D70: 5 | E70: 0 | F70: 19013 | G70: 500 | H70: =VLOOKUP(RC[-5],Sheet4!C[-7]:C[-2],5,FALSE) -> 21
A71: 472 | B71: =VLOOKUP(RC[1],Sheet4!C[-1]:C[2],2,FALSE)&VLOOKUP(RC[1],Sheet4!C[-1]:C[2],3,FALSE)&RC[2]&VLOOKUP(RC[1],Sheet4!C[-1]:C[2],4,FALSE)&"（%s/"&RC[2]&"）" -> 主线副本挑战5次（%s/5） | C71: 1 | D71: 5 | E71: 0 | F71: 19003 | G71: 30000 | H71: =VLOOKUP(RC[-5],Sheet4!C[-7]:C[-2],5,FALSE) -> 26
A72: 481 | B72: =VLOOKUP(RC[1],Sheet4!C[-1]:C[2],2,FALSE)&VLOOKUP(RC[1],Sheet4!C[-1]:C[2],3,FALSE)&RC[2]&VLOOKUP(RC[1],Sheet4!C[-1]:C[2],4,FALSE)&"（%s/"&RC[2]&"）" -> 无尽深渊战斗1次（%s/1） | C72: 23 | D72: 1 | E72: 0 | F72: 19028 | G72: 50 | H72: =VLOOKUP(RC[-5],Sheet4!C[-7]:C[-2],5,FALSE) -> 88
A73: 482 | B73: =VLOOKUP(RC[1],Sheet4!C[-1]:C[2],2,FALSE)&VLOOKUP(RC[1],Sheet4!C[-1]:C[2],3,FALSE)&RC[2]&VLOOKUP(RC[1],Sheet4!C[-1]:C[2],4,FALSE)&"（%s/"&RC[2]&"）" -> 日常副本战斗4次（%s/4） | C73: 13 | D73: 4 | E73: 0 | F73: 19005 | G73: 50 | H73: =VLOOKUP(RC[-5],Sheet4!C[-7]:C[-2],5,FALSE) -> 2
A74: 491 | B74: =VLOOKUP(RC[1],Sheet4!C[-1]:C[2],2,FALSE)&VLOOKUP(RC[1],Sheet4!C[-1]:C[2],3,FALSE)&RC[2]&VLOOKUP(RC[1],Sheet4!C[-1]:C[2],4,FALSE)&"（%s/"&RC[2]&"）" -> 英雄商店购买1次（%s/1） | C74: 5 | D74: 1 | E74: 0 | F74: 19006 | G74: 80 | H74: =VLOOKUP(RC[-5],Sheet4!C[-7]:C[-2],5,FALSE) -> 11
A75: 492 | B75: =VLOOKUP(RC[1],Sheet4!C[-1]:C[2],2,FALSE)&VLOOKUP(RC[1],Sheet4!C[-1]:C[2],3,FALSE)&RC[2]&VLOOKUP(RC[1],Sheet4!C[-1]:C[2],4,FALSE)&"（%s/"&RC[2]&"）" -> 遗迹探索4小时（%s/4） | C75: 19 | D75: 4 | E75: 0 | F75: 19005 | G75: 50 | H75: =VLOOKUP(RC[-5],Sheet4!C[-7]:C[-2],5,FALSE) -> 20
A76: 493 | B76: =VLOOKUP(RC[1],Sheet4!C[-1]:C[2],2,FALSE)&VLOOKUP(RC[1],Sheet4!C[-1]:C[2],3,FALSE)&RC[2]&VLOOKUP(RC[1],Sheet4!C[-1]:C[2],4,FALSE)&"（%s/"&RC[2]&"）" -> 击杀遗迹破坏者3次（%s/3） | C76: 16 | D76: 3 | E76: 0 | F76: 19005 | G76: 50 | H76: =VLOOKUP(RC[-5],Sheet4!C[-7]:C[-2],5,FALSE) -> 20
A77: 501 | B77: =VLOOKUP(RC[1],Sheet4!C[-1]:C[2],2,FALSE)&VLOOKUP(RC[1],Sheet4!C[-1]:C[2],3,FALSE)&RC[2]&VLOOKUP(RC[1],Sheet4!C[-1]:C[2],4,FALSE)&"（%s/"&RC[2]&"）" -> 占卜翻牌5次（%s/5） | C77: 25 | D77: 5 | E77: 0 | F77: 10096 | G77: 1 | H77: =VLOOKUP(RC[-5],Sheet4!C[-7]:C[-2],5,FALSE) -> 113
A78: 511 | B78: =VLOOKUP(RC[1],Sheet4!C[-1]:C[2],2,FALSE)&VLOOKUP(RC[1],Sheet4!C[-1]:C[2],3,FALSE)&RC[2]&VLOOKUP(RC[1],Sheet4!C[-1]:C[2],4,FALSE)&"（%s/"&RC[2]&"）" -> 英雄副本战斗1次（%s/1） | C78: 14 | D78: 1 | E78: 0 | F78: 19006 | G78: 80 | H78: =VLOOKUP(RC[-5],Sheet4!C[-7]:C[-2],5,FALSE) -> 27
A79: 512 | B79: =VLOOKUP(RC[1],Sheet4!C[-1]:C[2],2,FALSE)&VLOOKUP(RC[1],Sheet4!C[-1]:C[2],3,FALSE)&RC[2]&VLOOKUP(RC[1],Sheet4!C[-1]:C[2],4,FALSE)&"（%s/"&RC[2]&"）" -> 圣器争夺5次（%s/5） | C79: 11 | D79: 5 | E79: 0 | F79: 13049 | G79: 5 | H79: =VLOOKUP(RC[-5],Sheet4!C[-7]:C[-2],5,FALSE) -> 19
A80: 513 | B80: =VLOOKUP(RC[1],Sheet4!C[-1]:C[2],2,FALSE)&VLOOKUP(RC[1],Sheet4!C[-1]:C[2],3,FALSE)&RC[2]&VLOOKUP(RC[1],Sheet4!C[-1]:C[2],4,FALSE)&"（%s/"&RC[2]&"）" -> 圣器合成3次（%s/3） | C80: 22 | D80: 3 | E80: 0 | F80: 13049 | G80: 5 | H80: =VLOOKUP(RC[-5],Sheet4!C[-7]:C[-2],5,FALSE) -> 19
A81: 514 | B81: =VLOOKUP(RC[1],Sheet4!C[-1]:C[2],2,FALSE)&VLOOKUP(RC[1],Sheet4!C[-1]:C[2],3,FALSE)&RC[2]&VLOOKUP(RC[1],Sheet4!C[-1]:C[2],4,FALSE)&"（%s/"&RC[2]&"）" -> 圣器强化5次（%s/5） | C81: 2 | D81: 5 | E81: 0 | F81: 13049 | G81: 5 | H81: =VLOOKUP(RC[-5],Sheet4!C[-7]:C[-2],5,FALSE) -> 8
A82: =R[-4]C+10 -> 521 | B82: =VLOOKUP(RC[1],Sheet4!C[-1]:C[2],2,FALSE)&VLOOKUP(RC[1],Sheet4!C[-1]:C[2],3,FALSE)&RC[2]&VLOOKUP(RC[1],Sheet4!C[-1]:C[2],4,FALSE)&"（%s/"&RC[2]&"）" -> 进行召唤5次（%s/5） | C82: 8 | D82: 5 | E82: 0 | F82: 19006 | G82: 80 | H82: =VLOOKUP(RC[-5],Sheet4!C[-7]:C[-2],5,FALSE) -> 9
A83: =R[-4]C+10 -> 522 | B83: =VLOOKUP(RC[1],Sheet4!C[-1]:C[2],2,FALSE)&VLOOKUP(RC[1],Sheet4!C[-1]:C[2],3,FALSE)&RC[2]&VLOOKUP(RC[1],Sheet4!C[-1]:C[2],4,FALSE)&"（%s/"&RC[2]&"）" -> 进行高级召唤2次（%s/2） | C83: 9 | D83: 2 | E83: 0 | F83: 19006 | G83: 100 | H83: =VLOOKUP(RC[-5],Sheet4!C[-7]:C[-2],5,FALSE) -> 9
A84: =R[-4]C+10 -> 523 | B84: =VLOOKUP(RC[1],Sheet4!C[-1]:C[2],2,FALSE)&VLOOKUP(RC[1],Sheet4!C[-1]:C[2],3,FALSE)&RC[2]&VLOOKUP(RC[1],Sheet4!C[-1]:C[2],4,FALSE)&"（%s/"&RC[2]&"）" -> 购买体力2次（%s/2） | C84: 6 | D84: 2 | E84: 0 | F84: 19005 | G84: 50 | H84: =VLOOKUP(RC[-5],Sheet4!C[-7]:C[-2],5,FALSE) -> 12
A85: =R[-4]C+10 -> 524 | B85: =VLOOKUP(RC[1],Sheet4!C[-1]:C[2],2,FALSE)&VLOOKUP(RC[1],Sheet4!C[-1]:C[2],3,FALSE)&RC[2]&VLOOKUP(RC[1],Sheet4!C[-1]:C[2],4,FALSE)&"（%s/"&RC[2]&"）" -> 购买精力2次（%s/2） | C85: 7 | D85: 2 | E85: 0 | F85: 19005 | G85: 50 | H85: =VLOOKUP(RC[-5],Sheet4!C[-7]:C[-2],5,FALSE) -> 12
A86: =R[-4]C+10 -> 531 | B86: =VLOOKUP(RC[1],Sheet4!C[-1]:C[2],2,FALSE)&VLOOKUP(RC[1],Sheet4!C[-1]:C[2],3,FALSE)&RC[2]&VLOOKUP(RC[1],Sheet4!C[-1]:C[2],4,FALSE)&"（%s/"&RC[2]&"）" -> 进入勇者试练战斗10次（%s/10） | C86: 12 | D86: 10 | E86: 0 | F86: 19012 | G86: 500 | H86: =VLOOKUP(RC[-5],Sheet4!C[-7]:C[-2],5,FALSE) -> 17
A87: =R[-4]C+10 -> 532 | B87: =VLOOKUP(RC[1],Sheet4!C[-1]:C[2],2,FALSE)&VLOOKUP(RC[1],Sheet4!C[-1]:C[2],3,FALSE)&RC[2]&VLOOKUP(RC[1],Sheet4!C[-1]:C[2],4,FALSE)&"（%s/"&RC[2]&"）" -> 竞技场战斗5次（%s/5） | C87: 10 | D87: 5 | E87: 0 | F87: 19013 | G87: 500 | H87: =VLOOKUP(RC[-5],Sheet4!C[-7]:C[-2],5,FALSE) -> 21
A88: =R[-4]C+10 -> 533 | B88: =VLOOKUP(RC[1],Sheet4!C[-1]:C[2],2,FALSE)&VLOOKUP(RC[1],Sheet4!C[-1]:C[2],3,FALSE)&RC[2]&VLOOKUP(RC[1],Sheet4!C[-1]:C[2],4,FALSE)&"（%s/"&RC[2]&"）" -> 主线副本挑战5次（%s/5） | C88: 1 | D88: 5 | E88: 0 | F88: 19003 | G88: 30000 | H88: =VLOOKUP(RC[-5],Sheet4!C[-7]:C[-2],5,FALSE) -> 26
A89: =R[-4]C+10 -> 534 | B89: =VLOOKUP(RC[1],Sheet4!C[-1]:C[2],2,FALSE)&VLOOKUP(RC[1],Sheet4!C[-1]:C[2],3,FALSE)&RC[2]&VLOOKUP(RC[1],Sheet4!C[-1]:C[2],4,FALSE)&"（%s/"&RC[2]&"）" -> 日常副本战斗4次（%s/4） | C89: 13 | D89: 4 | E89: 0 | F89: 19005 | G89: 50 | H89: =VLOOKUP(RC[-5],Sheet4!C[-7]:C[-2],5,FALSE) -> 2
A90: =R[-4]C+10 -> 541 | B90: =VLOOKUP(RC[1],Sheet4!C[-1]:C[2],2,FALSE)&VLOOKUP(RC[1],Sheet4!C[-1]:C[2],3,FALSE)&RC[2]&VLOOKUP(RC[1],Sheet4!C[-1]:C[2],4,FALSE)&"（%s/"&RC[2]&"）" -> 赠送好友精力3次（%s/3） | C90: 4 | D90: 3 | E90: 0 | F90: 19005 | G90: 50 | H90: =VLOOKUP(RC[-5],Sheet4!C[-7]:C[-2],5,FALSE) -> 15
A91: =R[-4]C+10 -> 542 | B91: =VLOOKUP(RC[1],Sheet4!C[-1]:C[2],2,FALSE)&VLOOKUP(RC[1],Sheet4!C[-1]:C[2],3,FALSE)&RC[2]&VLOOKUP(RC[1],Sheet4!C[-1]:C[2],4,FALSE)&"（%s/"&RC[2]&"）" -> 英雄培养15次（%s/15） | C91: 3 | D91: 15 | E91: 0 | F91: 10003 | G91: 30 | H91: =VLOOKUP(RC[-5],Sheet4!C[-7]:C[-2],5,FALSE) -> 8
A92: =R[-4]C+10 -> 543 | B92: =VLOOKUP(RC[1],Sheet4!C[-1]:C[2],2,FALSE)&VLOOKUP(RC[1],Sheet4!C[-1]:C[2],3,FALSE)&RC[2]&VLOOKUP(RC[1],Sheet4!C[-1]:C[2],4,FALSE)&"（%s/"&RC[2]&"）" -> 英雄商店购买1次（%s/1） | C92: 5 | D92: 1 | E92: 0 | F92: 19006 | G92: 80 | H92: =VLOOKUP(RC[-5],Sheet4!C[-7]:C[-2],5,FALSE) -> 11
A93: =R[-4]C+10 -> 544 | B93: =VLOOKUP(RC[1],Sheet4!C[-1]:C[2],2,FALSE)&VLOOKUP(RC[1],Sheet4!C[-1]:C[2],3,FALSE)&RC[2]&VLOOKUP(RC[1],Sheet4!C[-1]:C[2],4,FALSE)&"（%s/"&RC[2]&"）" -> 遗迹探索4小时（%s/4） | C93: 19 | D93: 4 | E93: 0 | F93: 19005 | G93: 50 | H93: =VLOOKUP(RC[-5],Sheet4!C[-7]:C[-2],5,FALSE) -> 20
A94: =R[-4]C+10 -> 551 | B94: =VLOOKUP(RC[1],Sheet4!C[-1]:C[2],2,FALSE)&VLOOKUP(RC[1],Sheet4!C[-1]:C[2],3,FALSE)&RC[2]&VLOOKUP(RC[1],Sheet4!C[-1]:C[2],4,FALSE)&"（%s/"&RC[2]&"）" -> 精英副本战斗1次（%s/1） | C94: 15 | D94: 1 | E94: 0 | F94: 10008 | G94: 30 | H94: =VLOOKUP(RC[-5],Sheet4!C[-7]:C[-2],5,FALSE) -> 28
A95: =R[-4]C+10 -> 552 | B95: =VLOOKUP(RC[1],Sheet4!C[-1]:C[2],2,FALSE)&VLOOKUP(RC[1],Sheet4!C[-1]:C[2],3,FALSE)&RC[2]&VLOOKUP(RC[1],Sheet4!C[-1]:C[2],4,FALSE)&"（%s/"&RC[2]&"）" -> 异度入侵分享2次（%s/2） | C95: 17 | D95: 2 | E95: 0 | F95: 19014 | G95: 500 | H95: =VLOOKUP(RC[-5],Sheet4!C[-7]:C[-2],5,FALSE) -> 16
A96: =R[-4]C+10 -> 553 | B96: =VLOOKUP(RC[1],Sheet4!C[-1]:C[2],2,FALSE)&VLOOKUP(RC[1],Sheet4!C[-1]:C[2],3,FALSE)&RC[2]&VLOOKUP(RC[1],Sheet4!C[-1]:C[2],4,FALSE)&"（%s/"&RC[2]&"）" -> 讨伐异度入侵者2次（%s/2） | C96: 18 | D96: 2 | E96: 0 | F96: 19014 | G96: 500 | H96: =VLOOKUP(RC[-5],Sheet4!C[-7]:C[-2],5,FALSE) -> 16
A97: =R[-4]C+10 -> 554 | B97: =VLOOKUP(RC[1],Sheet4!C[-1]:C[2],2,FALSE)&VLOOKUP(RC[1],Sheet4!C[-1]:C[2],3,FALSE)&RC[2]&VLOOKUP(RC[1],Sheet4!C[-1]:C[2],4,FALSE)&"（%s/"&RC[2]&"）" -> 无尽深渊战斗1次（%s/1） | C97: 23 | D97: 1 | E97: 0 | F97: 19028 | G97: 50 | H97: =VLOOKUP(RC[-5],Sheet4!C[-7]:C[-2],5,FALSE) -> 88
A98: =R[-4]C+10 -> 561 | B98: =VLOOKUP(RC[1],Sheet4!C[-1]:C[2],2,FALSE)&VLOOKUP(RC[1],Sheet4!C[-1]:C[2],3,FALSE)&RC[2]&VLOOKUP(RC[1],Sheet4!C[-1]:C[2],4,FALSE)&"（%s/"&RC[2]&"）" -> 击杀遗迹破坏者3次（%s/3） | C98: 16 | D98: 3 | E98: 0 | F98: 19005 | G98: 50 | H98: =VLOOKUP(RC[-5],Sheet4!C[-7]:C[-2],5,FALSE) -> 20
A99: =R[-4]C+10 -> 562 | B99: =VLOOKUP(RC[1],Sheet4!C[-1]:C[2],2,FALSE)&VLOOKUP(RC[1],Sheet4!C[-1]:C[2],3,FALSE)&RC[2]&VLOOKUP(RC[1],Sheet4!C[-1]:C[2],4,FALSE)&"（%s/"&RC[2]&"）" -> 占卜翻牌5次（%s/5） | C99: 25 | D99: 5 | E99: 0 | F99: 10096 | G99: 1 | H99: =VLOOKUP(RC[-5],Sheet4!C[-7]:C[-2],5,FALSE) -> 113
A100: =R[-4]C+10 -> 563 | B100: =VLOOKUP(RC[1],Sheet4!C[-1]:C[2],2,FALSE)&VLOOKUP(RC[1],Sheet4!C[-1]:C[2],3,FALSE)&RC[2]&VLOOKUP(RC[1],Sheet4!C[-1]:C[2],4,FALSE)&"（%s/"&RC[2]&"）" -> 英雄副本战斗1次（%s/1） | C100: 14 | D100: 1 | E100: 0 | F100: 19006 | G100: 80 | H100: =VLOOKUP(RC[-5],Sheet4!C[-7]:C[-2],5,FALSE) -> 27
A101: 571 | B101: =VLOOKUP(RC[1],Sheet4!C[-1]:C[2],2,FALSE)&VLOOKUP(RC[1],Sheet4!C[-1]:C[2],3,FALSE)&RC[2]&VLOOKUP(RC[1],Sheet4!C[-1]:C[2],4,FALSE)&"（%s/"&RC[2]&"）" -> 圣器争夺5次（%s/5） | C101: 11 | D101: 5 | E101: 0 | F101: 13049 | G101: 5 | H101: =VLOOKUP(RC[-5],Sheet4!C[-7]:C[-2],5,FALSE) -> 19
A102: 572 | B102: =VLOOKUP(RC[1],Sheet4!C[-1]:C[2],2,FALSE)&VLOOKUP(RC[1],Sheet4!C[-1]:C[2],3,FALSE)&RC[2]&VLOOKUP(RC[1],Sheet4!C[-1]:C[2],4,FALSE)&"（%s/"&RC[2]&"）" -> 圣器合成3次（%s/3） | C102: 22 | D102: 3 | E102: 0 | F102: 13049 | G102: 5 | H102: =VLOOKUP(RC[-5],Sheet4!C[-7]:C[-2],5,FALSE) -> 19
A103: 573 | B103: =VLOOKUP(RC[1],Sheet4!C[-1]:C[2],2,FALSE)&VLOOKUP(RC[1],Sheet4!C[-1]:C[2],3,FALSE)&RC[2]&VLOOKUP(RC[1],Sheet4!C[-1]:C[2],4,FALSE)&"（%s/"&RC[2]&"）" -> 圣器强化5次（%s/5） | C103: 2 | D103: 5 | E103: 0 | F103: 13049 | G103: 5 | H103: =VLOOKUP(RC[-5],Sheet4!C[-7]:C[-2],5,FALSE) -> 8
A104: =R[-22]C+60 -> 581 | B104: =VLOOKUP(RC[1],Sheet4!C[-1]:C[2],2,FALSE)&VLOOKUP(RC[1],Sheet4!C[-1]:C[2],3,FALSE)&RC[2]&VLOOKUP(RC[1],Sheet4!C[-1]:C[2],4,FALSE)&"（%s/"&RC[2]&"）" -> 进行召唤5次（%s/5） | C104: =R[-22]C -> 8 | D104: =R[-22]C -> 5 | E104: 0 | F104: =R[-22]C -> 19006 | G104: =R[-22]C -> 80 | H104: =VLOOKUP(RC[-5],Sheet4!C[-7]:C[-2],5,FALSE) -> 9
A105: =R[-22]C+60 -> 582 | B105: =VLOOKUP(RC[1],Sheet4!C[-1]:C[2],2,FALSE)&VLOOKUP(RC[1],Sheet4!C[-1]:C[2],3,FALSE)&RC[2]&VLOOKUP(RC[1],Sheet4!C[-1]:C[2],4,FALSE)&"（%s/"&RC[2]&"）" -> 进行高级召唤2次（%s/2） | C105: =R[-22]C -> 9 | D105: =R[-22]C -> 2 | E105: 0 | F105: =R[-22]C -> 19006 | G105: =R[-22]C -> 100 | H105: =VLOOKUP(RC[-5],Sheet4!C[-7]:C[-2],5,FALSE) -> 9
A106: =R[-22]C+60 -> 583 | B106: =VLOOKUP(RC[1],Sheet4!C[-1]:C[2],2,FALSE)&VLOOKUP(RC[1],Sheet4!C[-1]:C[2],3,FALSE)&RC[2]&VLOOKUP(RC[1],Sheet4!C[-1]:C[2],4,FALSE)&"（%s/"&RC[2]&"）" -> 购买体力2次（%s/2） | C106: =R[-22]C -> 6 | D106: =R[-22]C -> 2 | E106: 0 | F106: =R[-22]C -> 19005 | G106: =R[-22]C -> 50 | H106: =VLOOKUP(RC[-5],Sheet4!C[-7]:C[-2],5,FALSE) -> 12
A107: =R[-22]C+60 -> 584 | B107: =VLOOKUP(RC[1],Sheet4!C[-1]:C[2],2,FALSE)&VLOOKUP(RC[1],Sheet4!C[-1]:C[2],3,FALSE)&RC[2]&VLOOKUP(RC[1],Sheet4!C[-1]:C[2],4,FALSE)&"（%s/"&RC[2]&"）" -> 购买精力2次（%s/2） | C107: =R[-22]C -> 7 | D107: =R[-22]C -> 2 | E107: 0 | F107: =R[-22]C -> 19005 | G107: =R[-22]C -> 50 | H107: =VLOOKUP(RC[-5],Sheet4!C[-7]:C[-2],5,FALSE) -> 12
A108: =R[-22]C+60 -> 591 | B108: =VLOOKUP(RC[1],Sheet4!C[-1]:C[2],2,FALSE)&VLOOKUP(RC[1],Sheet4!C[-1]:C[2],3,FALSE)&RC[2]&VLOOKUP(RC[1],Sheet4!C[-1]:C[2],4,FALSE)&"（%s/"&RC[2]&"）" -> 进入勇者试练战斗10次（%s/10） | C108: =R[-22]C -> 12 | D108: =R[-22]C -> 10 | E108: 0 | F108: =R[-22]C -> 19012 | G108: =R[-22]C -> 500 | H108: =VLOOKUP(RC[-5],Sheet4!C[-7]:C[-2],5,FALSE) -> 17
A109: =R[-22]C+60 -> 592 | B109: =VLOOKUP(RC[1],Sheet4!C[-1]:C[2],2,FALSE)&VLOOKUP(RC[1],Sheet4!C[-1]:C[2],3,FALSE)&RC[2]&VLOOKUP(RC[1],Sheet4!C[-1]:C[2],4,FALSE)&"（%s/"&RC[2]&"）" -> 竞技场战斗5次（%s/5） | C109: =R[-22]C -> 10 | D109: =R[-22]C -> 5 | E109: 0 | F109: =R[-22]C -> 19013 | G109: =R[-22]C -> 500 | H109: =VLOOKUP(RC[-5],Sheet4!C[-7]:C[-2],5,FALSE) -> 21
A110: =R[-22]C+60 -> 593 | B110: =VLOOKUP(RC[1],Sheet4!C[-1]:C[2],2,FALSE)&VLOOKUP(RC[1],Sheet4!C[-1]:C[2],3,FALSE)&RC[2]&VLOOKUP(RC[1],Sheet4!C[-1]:C[2],4,FALSE)&"（%s/"&RC[2]&"）" -> 主线副本挑战5次（%s/5） | C110: =R[-22]C -> 1 | D110: =R[-22]C -> 5 | E110: 0 | F110: =R[-22]C -> 19003 | G110: =R[-22]C -> 30000 | H110: =VLOOKUP(RC[-5],Sheet4!C[-7]:C[-2],5,FALSE) -> 26
A111: =R[-22]C+60 -> 594 | B111: =VLOOKUP(RC[1],Sheet4!C[-1]:C[2],2,FALSE)&VLOOKUP(RC[1],Sheet4!C[-1]:C[2],3,FALSE)&RC[2]&VLOOKUP(RC[1],Sheet4!C[-1]:C[2],4,FALSE)&"（%s/"&RC[2]&"）" -> 日常副本战斗4次（%s/4） | C111: =R[-22]C -> 13 | D111: =R[-22]C -> 4 | E111: 0 | F111: =R[-22]C -> 19005 | G111: =R[-22]C -> 50 | H111: =VLOOKUP(RC[-5],Sheet4!C[-7]:C[-2],5,FALSE) -> 2
A112: =R[-22]C+60 -> 601 | B112: =VLOOKUP(RC[1],Sheet4!C[-1]:C[2],2,FALSE)&VLOOKUP(RC[1],Sheet4!C[-1]:C[2],3,FALSE)&RC[2]&VLOOKUP(RC[1],Sheet4!C[-1]:C[2],4,FALSE)&"（%s/"&RC[2]&"）" -> 赠送好友精力3次（%s/3） | C112: =R[-22]C -> 4 | D112: =R[-22]C -> 3 | E112: 0 | F112: =R[-22]C -> 19005 | G112: =R[-22]C -> 50 | H112: =VLOOKUP(RC[-5],Sheet4!C[-7]:C[-2],5,FALSE) -> 15
A113: =R[-22]C+60 -> 602 | B113: =VLOOKUP(RC[1],Sheet4!C[-1]:C[2],2,FALSE)&VLOOKUP(RC[1],Sheet4!C[-1]:C[2],3,FALSE)&RC[2]&VLOOKUP(RC[1],Sheet4!C[-1]:C[2],4,FALSE)&"（%s/"&RC[2]&"）" -> 英雄培养15次（%s/15） | C113: =R[-22]C -> 3 | D113: =R[-22]C -> 15 | E113: 0 | F113: =R[-22]C -> 10003 | G113: =R[-22]C -> 30 | H113: =VLOOKUP(RC[-5],Sheet4!C[-7]:C[-2],5,FALSE) -> 8
A114: =R[-22]C+60 -> 603 | B114: =VLOOKUP(RC[1],Sheet4!C[-1]:C[2],2,FALSE)&VLOOKUP(RC[1],Sheet4!C[-1]:C[2],3,FALSE)&RC[2]&VLOOKUP(RC[1],Sheet4!C[-1]:C[2],4,FALSE)&"（%s/"&RC[2]&"）" -> 英雄商店购买1次（%s/1） | C114: =R[-22]C -> 5 | D114: =R[-22]C -> 1 | E114: 0 | F114: =R[-22]C -> 19006 | G114: =R[-22]C -> 80 | H114: =VLOOKUP(RC[-5],Sheet4!C[-7]:C[-2],5,FALSE) -> 11
A115: =R[-22]C+60 -> 604 | B115: =VLOOKUP(RC[1],Sheet4!C[-1]:C[2],2,FALSE)&VLOOKUP(RC[1],Sheet4!C[-1]:C[2],3,FALSE)&RC[2]&VLOOKUP(RC[1],Sheet4!C[-1]:C[2],4,FALSE)&"（%s/"&RC[2]&"）" -> 遗迹探索4小时（%s/4） | C115: =R[-22]C -> 19 | D115: =R[-22]C -> 4 | E115: 0 | F115: =R[-22]C -> 19005 | G115: =R[-22]C -> 50 | H115: =VLOOKUP(RC[-5],Sheet4!C[-7]:C[-2],5,FALSE) -> 20
A116: =R[-22]C+60 -> 611 | B116: =VLOOKUP(RC[1],Sheet4!C[-1]:C[2],2,FALSE)&VLOOKUP(RC[1],Sheet4!C[-1]:C[2],3,FALSE)&RC[2]&VLOOKUP(RC[1],Sheet4!C[-1]:C[2],4,FALSE)&"（%s/"&RC[2]&"）" -> 精英副本战斗1次（%s/1） | C116: =R[-22]C -> 15 | D116: =R[-22]C -> 1 | E116: 0 | F116: =R[-22]C -> 10008 | G116: =R[-22]C -> 30 | H116: =VLOOKUP(RC[-5],Sheet4!C[-7]:C[-2],5,FALSE) -> 28
A117: =R[-22]C+60 -> 612 | B117: =VLOOKUP(RC[1],Sheet4!C[-1]:C[2],2,FALSE)&VLOOKUP(RC[1],Sheet4!C[-1]:C[2],3,FALSE)&RC[2]&VLOOKUP(RC[1],Sheet4!C[-1]:C[2],4,FALSE)&"（%s/"&RC[2]&"）" -> 异度入侵分享2次（%s/2） | C117: =R[-22]C -> 17 | D117: =R[-22]C -> 2 | E117: 0 | F117: =R[-22]C -> 19014 | G117: =R[-22]C -> 500 | H117: =VLOOKUP(RC[-5],Sheet4!C[-7]:C[-2],5,FALSE) -> 16
A118: =R[-22]C+60 -> 613 | B118: =VLOOKUP(RC[1],Sheet4!C[-1]:C[2],2,FALSE)&VLOOKUP(RC[1],Sheet4!C[-1]:C[2],3,FALSE)&RC[2]&VLOOKUP(RC[1],Sheet4!C[-1]:C[2],4,FALSE)&"（%s/"&RC[2]&"）" -> 讨伐异度入侵者2次（%s/2） | C118: =R[-22]C -> 18 | D118: =R[-22]C -> 2 | E118: 0 | F118: =R[-22]C -> 19014 | G118: =R[-22]C -> 500 | H118: =VLOOKUP(RC[-5],Sheet4!C[-7]:C[-2],5,FALSE) -> 16
A119: =R[-22]C+60 -> 614 | B119: =VLOOKUP(RC[1],Sheet4!C[-1]:C[2],2,FALSE)&VLOOKUP(RC[1],Sheet4!C[-1]:C[2],3,FALSE)&RC[2]&VLOOKUP(RC[1],Sheet4!C[-1]:C[2],4,FALSE)&"（%s/"&RC[2]&"）" -> 无尽深渊战斗1次（%s/1） | C119: =R[-22]C -> 23 | D119: =R[-22]C -> 1 | E119: 0 | F119: =R[-22]C -> 19028 | G119: =R[-22]C -> 50 | H119: =VLOOKUP(RC[-5],Sheet4!C[-7]:C[-2],5,FALSE) -> 88
A120: =R[-22]C+60 -> 621 | B120: =VLOOKUP(RC[1],Sheet4!C[-1]:C[2],2,FALSE)&VLOOKUP(RC[1],Sheet4!C[-1]:C[2],3,FALSE)&RC[2]&VLOOKUP(RC[1],Sheet4!C[-1]:C[2],4,FALSE)&"（%s/"&RC[2]&"）" -> 击杀遗迹破坏者3次（%s/3） | C120: =R[-22]C -> 16 | D120: =R[-22]C -> 3 | E120: 0 | F120: =R[-22]C -> 19005 | G120: =R[-22]C -> 50 | H120: =VLOOKUP(RC[-5],Sheet4!C[-7]:C[-2],5,FALSE) -> 20
A121: =R[-22]C+60 -> 622 | B121: =VLOOKUP(RC[1],Sheet4!C[-1]:C[2],2,FALSE)&VLOOKUP(RC[1],Sheet4!C[-1]:C[2],3,FALSE)&RC[2]&VLOOKUP(RC[1],Sheet4!C[-1]:C[2],4,FALSE)&"（%s/"&RC[2]&"）" -> 占卜翻牌5次（%s/5） | C121: =R[-22]C -> 25 | D121: =R[-22]C -> 5 | E121: 0 | F121: =R[-22]C -> 10096 | G121: =R[-22]C -> 1 | H121: =VLOOKUP(RC[-5],Sheet4!C[-7]:C[-2],5,FALSE) -> 113
A122: =R[-22]C+60 -> 623 | B122: =VLOOKUP(RC[1],Sheet4!C[-1]:C[2],2,FALSE)&VLOOKUP(RC[1],Sheet4!C[-1]:C[2],3,FALSE)&RC[2]&VLOOKUP(RC[1],Sheet4!C[-1]:C[2],4,FALSE)&"（%s/"&RC[2]&"）" -> 英雄副本战斗1次（%s/1） | C122: =R[-22]C -> 14 | D122: =R[-22]C -> 1 | E122: 0 | F122: =R[-22]C -> 19006 | G122: =R[-22]C -> 80 | H122: =VLOOKUP(RC[-5],Sheet4!C[-7]:C[-2],5,FALSE) -> 27
A123: =R[-22]C+60 -> 631 | B123: =VLOOKUP(RC[1],Sheet4!C[-1]:C[2],2,FALSE)&VLOOKUP(RC[1],Sheet4!C[-1]:C[2],3,FALSE)&RC[2]&VLOOKUP(RC[1],Sheet4!C[-1]:C[2],4,FALSE)&"（%s/"&RC[2]&"）" -> 圣器争夺5次（%s/5） | C123: =R[-22]C -> 11 | D123: =R[-22]C -> 5 | E123: 0 | F123: =R[-22]C -> 13049 | G123: =R[-22]C -> 5 | H123: =VLOOKUP(RC[-5],Sheet4!C[-7]:C[-2],5,FALSE) -> 19
A124: =R[-22]C+60 -> 632 | B124: =VLOOKUP(RC[1],Sheet4!C[-1]:C[2],2,FALSE)&VLOOKUP(RC[1],Sheet4!C[-1]:C[2],3,FALSE)&RC[2]&VLOOKUP(RC[1],Sheet4!C[-1]:C[2],4,FALSE)&"（%s/"&RC[2]&"）" -> 圣器合成3次（%s/3） | C124: =R[-22]C -> 22 | D124: =R[-22]C -> 3 | E124: 0 | F124: =R[-22]C -> 13049 | G124: =R[-22]C -> 5 | H124: =VLOOKUP(RC[-5],Sheet4!C[-7]:C[-2],5,FALSE) -> 19
A125: =R[-22]C+60 -> 633 | B125: =VLOOKUP(RC[1],Sheet4!C[-1]:C[2],2,FALSE)&VLOOKUP(RC[1],Sheet4!C[-1]:C[2],3,FALSE)&RC[2]&VLOOKUP(RC[1],Sheet4!C[-1]:C[2],4,FALSE)&"（%s/"&RC[2]&"）" -> 圣器强化5次（%s/5） | C125: =R[-22]C -> 2 | D125: =R[-22]C -> 5 | E125: 0 | F125: =R[-22]C -> 13049 | G125: =R[-22]C -> 5 | H125: =VLOOKUP(RC[-5],Sheet4!C[-7]:C[-2],5,FALSE) -> 8
A126: =R[-22]C+60 -> 641 | B126: =VLOOKUP(RC[1],Sheet4!C[-1]:C[2],2,FALSE)&VLOOKUP(RC[1],Sheet4!C[-1]:C[2],3,FALSE)&RC[2]&VLOOKUP(RC[1],Sheet4!C[-1]:C[2],4,FALSE)&"（%s/"&RC[2]&"）" -> 进行召唤5次（%s/5） | C126: =R[-22]C -> 8 | D126: =R[-22]C -> 5 | E126: 0 | F126: =R[-22]C -> 19006 | G126: =R[-22]C -> 80 | H126: =VLOOKUP(RC[-5],Sheet4!C[-7]:C[-2],5,FALSE) -> 9
A127: =R[-22]C+60 -> 642 | B127: =VLOOKUP(RC[1],Sheet4!C[-1]:C[2],2,FALSE)&VLOOKUP(RC[1],Sheet4!C[-1]:C[2],3,FALSE)&RC[2]&VLOOKUP(RC[1],Sheet4!C[-1]:C[2],4,FALSE)&"（%s/"&RC[2]&"）" -> 进行高级召唤2次（%s/2） | C127: =R[-22]C -> 9 | D127: =R[-22]C -> 2 | E127: 0 | F127: =R[-22]C -> 19006 | G127: =R[-22]C -> 100 | H127: =VLOOKUP(RC[-5],Sheet4!C[-7]:C[-2],5,FALSE) -> 9
A128: =R[-22]C+60 -> 643 | B128: =VLOOKUP(RC[1],Sheet4!C[-1]:C[2],2,FALSE)&VLOOKUP(RC[1],Sheet4!C[-1]:C[2],3,FALSE)&RC[2]&VLOOKUP(RC[1],Sheet4!C[-1]:C[2],4,FALSE)&"（%s/"&RC[2]&"）" -> 购买体力2次（%s/2） | C128: =R[-22]C -> 6 | D128: =R[-22]C -> 2 | E128: 0 | F128: =R[-22]C -> 19005 | G128: =R[-22]C -> 50 | H128: =VLOOKUP(RC[-5],Sheet4!C[-7]:C[-2],5,FALSE) -> 12
A129: =R[-22]C+60 -> 644 | B129: =VLOOKUP(RC[1],Sheet4!C[-1]:C[2],2,FALSE)&VLOOKUP(RC[1],Sheet4!C[-1]:C[2],3,FALSE)&RC[2]&VLOOKUP(RC[1],Sheet4!C[-1]:C[2],4,FALSE)&"（%s/"&RC[2]&"）" -> 购买精力2次（%s/2） | C129: =R[-22]C -> 7 | D129: =R[-22]C -> 2 | E129: 0 | F129: =R[-22]C -> 19005 | G129: =R[-22]C -> 50 | H129: =VLOOKUP(RC[-5],Sheet4!C[-7]:C[-2],5,FALSE) -> 12
A130: =R[-22]C+60 -> 651 | B130: =VLOOKUP(RC[1],Sheet4!C[-1]:C[2],2,FALSE)&VLOOKUP(RC[1],Sheet4!C[-1]:C[2],3,FALSE)&RC[2]&VLOOKUP(RC[1],Sheet4!C[-1]:C[2],4,FALSE)&"（%s/"&RC[2]&"）" -> 进入勇者试练战斗10次（%s/10） | C130: =R[-22]C -> 12 | D130: =R[-22]C -> 10 | E130: 0 | F130: =R[-22]C -> 19012 | G130: =R[-22]C -> 500 | H130: =VLOOKUP(RC[-5],Sheet4!C[-7]:C[-2],5,FALSE) -> 17
A131: =R[-22]C+60 -> 652 | B131: =VLOOKUP(RC[1],Sheet4!C[-1]:C[2],2,FALSE)&VLOOKUP(RC[1],Sheet4!C[-1]:C[2],3,FALSE)&RC[2]&VLOOKUP(RC[1],Sheet4!C[-1]:C[2],4,FALSE)&"（%s/"&RC[2]&"）" -> 竞技场战斗5次（%s/5） | C131: =R[-22]C -> 10 | D131: =R[-22]C -> 5 | E131: 0 | F131: =R[-22]C -> 19013 | G131: =R[-22]C -> 500 | H131: =VLOOKUP(RC[-5],Sheet4!C[-7]:C[-2],5,FALSE) -> 21
A132: =R[-22]C+60 -> 653 | B132: =VLOOKUP(RC[1],Sheet4!C[-1]:C[2],2,FALSE)&VLOOKUP(RC[1],Sheet4!C[-1]:C[2],3,FALSE)&RC[2]&VLOOKUP(RC[1],Sheet4!C[-1]:C[2],4,FALSE)&"（%s/"&RC[2]&"）" -> 主线副本挑战5次（%s/5） | C132: =R[-22]C -> 1 | D132: =R[-22]C -> 5 | E132: 0 | F132: =R[-22]C -> 19003 | G132: =R[-22]C -> 30000 | H132: =VLOOKUP(RC[-5],Sheet4!C[-7]:C[-2],5,FALSE) -> 26
A133: =R[-22]C+60 -> 654 | B133: =VLOOKUP(RC[1],Sheet4!C[-1]:C[2],2,FALSE)&VLOOKUP(RC[1],Sheet4!C[-1]:C[2],3,FALSE)&RC[2]&VLOOKUP(RC[1],Sheet4!C[-1]:C[2],4,FALSE)&"（%s/"&RC[2]&"）" -> 日常副本战斗4次（%s/4） | C133: =R[-22]C -> 13 | D133: =R[-22]C -> 4 | E133: 0 | F133: =R[-22]C -> 19005 | G133: =R[-22]C -> 50 | H133: =VLOOKUP(RC[-5],Sheet4!C[-7]:C[-2],5,FALSE) -> 2
A134: =R[-22]C+60 -> 661 | B134: =VLOOKUP(RC[1],Sheet4!C[-1]:C[2],2,FALSE)&VLOOKUP(RC[1],Sheet4!C[-1]:C[2],3,FALSE)&RC[2]&VLOOKUP(RC[1],Sheet4!C[-1]:C[2],4,FALSE)&"（%s/"&RC[2]&"）" -> 赠送好友精力3次（%s/3） | C134: =R[-22]C -> 4 | D134: =R[-22]C -> 3 | E134: 0 | F134: =R[-22]C -> 19005 | G134: =R[-22]C -> 50 | H134: =VLOOKUP(RC[-5],Sheet4!C[-7]:C[-2],5,FALSE) -> 15
A135: =R[-22]C+60 -> 662 | B135: =VLOOKUP(RC[1],Sheet4!C[-1]:C[2],2,FALSE)&VLOOKUP(RC[1],Sheet4!C[-1]:C[2],3,FALSE)&RC[2]&VLOOKUP(RC[1],Sheet4!C[-1]:C[2],4,FALSE)&"（%s/"&RC[2]&"）" -> 英雄培养15次（%s/15） | C135: =R[-22]C -> 3 | D135: =R[-22]C -> 15 | E135: 0 | F135: =R[-22]C -> 10003 | G135: =R[-22]C -> 30 | H135: =VLOOKUP(RC[-5],Sheet4!C[-7]:C[-2],5,FALSE) -> 8
A136: =R[-22]C+60 -> 663 | B136: =VLOOKUP(RC[1],Sheet4!C[-1]:C[2],2,FALSE)&VLOOKUP(RC[1],Sheet4!C[-1]:C[2],3,FALSE)&RC[2]&VLOOKUP(RC[1],Sheet4!C[-1]:C[2],4,FALSE)&"（%s/"&RC[2]&"）" -> 英雄商店购买1次（%s/1） | C136: =R[-22]C -> 5 | D136: =R[-22]C -> 1 | E136: 0 | F136: =R[-22]C -> 19006 | G136: =R[-22]C -> 80 | H136: =VLOOKUP(RC[-5],Sheet4!C[-7]:C[-2],5,FALSE) -> 11
A137: =R[-22]C+60 -> 664 | B137: =VLOOKUP(RC[1],Sheet4!C[-1]:C[2],2,FALSE)&VLOOKUP(RC[1],Sheet4!C[-1]:C[2],3,FALSE)&RC[2]&VLOOKUP(RC[1],Sheet4!C[-1]:C[2],4,FALSE)&"（%s/"&RC[2]&"）" -> 遗迹探索4小时（%s/4） | C137: =R[-22]C -> 19 | D137: =R[-22]C -> 4 | E137: 0 | F137: =R[-22]C -> 19005 | G137: =R[-22]C -> 50 | H137: =VLOOKUP(RC[-5],Sheet4!C[-7]:C[-2],5,FALSE) -> 20
A138: =R[-22]C+60 -> 671 | B138: =VLOOKUP(RC[1],Sheet4!C[-1]:C[2],2,FALSE)&VLOOKUP(RC[1],Sheet4!C[-1]:C[2],3,FALSE)&RC[2]&VLOOKUP(RC[1],Sheet4!C[-1]:C[2],4,FALSE)&"（%s/"&RC[2]&"）" -> 精英副本战斗1次（%s/1） | C138: =R[-22]C -> 15 | D138: =R[-22]C -> 1 | E138: 0 | F138: =R[-22]C -> 10008 | G138: =R[-22]C -> 30 | H138: =VLOOKUP(RC[-5],Sheet4!C[-7]:C[-2],5,FALSE) -> 28
A139: =R[-22]C+60 -> 672 | B139: =VLOOKUP(RC[1],Sheet4!C[-1]:C[2],2,FALSE)&VLOOKUP(RC[1],Sheet4!C[-1]:C[2],3,FALSE)&RC[2]&VLOOKUP(RC[1],Sheet4!C[-1]:C[2],4,FALSE)&"（%s/"&RC[2]&"）" -> 异度入侵分享2次（%s/2） | C139: =R[-22]C -> 17 | D139: =R[-22]C -> 2 | E139: 0 | F139: =R[-22]C -> 19014 | G139: =R[-22]C -> 500 | H139: =VLOOKUP(RC[-5],Sheet4!C[-7]:C[-2],5,FALSE) -> 16
A140: =R[-22]C+60 -> 673 | B140: =VLOOKUP(RC[1],Sheet4!C[-1]:C[2],2,FALSE)&VLOOKUP(RC[1],Sheet4!C[-1]:C[2],3,FALSE)&RC[2]&VLOOKUP(RC[1],Sheet4!C[-1]:C[2],4,FALSE)&"（%s/"&RC[2]&"）" -> 讨伐异度入侵者2次（%s/2） | C140: =R[-22]C -> 18 | D140: =R[-22]C -> 2 | E140: 0 | F140: =R[-22]C -> 19014 | G140: =R[-22]C -> 500 | H140: =VLOOKUP(RC[-5],Sheet4!C[-7]:C[-2],5,FALSE) -> 16
A141: =R[-22]C+60 -> 674 | B141: =VLOOKUP(RC[1],Sheet4!C[-1]:C[2],2,FALSE)&VLOOKUP(RC[1],Sheet4!C[-1]:C[2],3,FALSE)&RC[2]&VLOOKUP(RC[1],Sheet4!C[-1]:C[2],4,FALSE)&"（%s/"&RC[2]&"）" -> 无尽深渊战斗1次（%s/1） | C141: =R[-22]C -> 23 | D141: =R[-22]C -> 1 | E141: 0 | F141: =R[-22]C -> 19028 | G141: =R[-22]C -> 50 | H141: =VLOOKUP(RC[-5],Sheet4!C[-7]:C[-2],5,FALSE) -> 88
A142: =R[-22]C+60 -> 681 | B142: =VLOOKUP(RC[1],Sheet4!C[-1]:C[2],2,FALSE)&VLOOKUP(RC[1],Sheet4!C[-1]:C[2],3,FALSE)&RC[2]&VLOOKUP(RC[1],Sheet4!C[-1]:C[2],4,FALSE)&"（%s/"&RC[2]&"）" -> 击杀遗迹破坏者3次（%s/3） | C142: =R[-22]C -> 16 | D142: =R[-22]C -> 3 | E142: 0 | F142: =R[-22]C -> 19005 | G142: =R[-22]C -> 50 | H142: =VLOOKUP(RC[-5],Sheet4!C[-7]:C[-2],5,FALSE) -> 20
A143: =R[-22]C+60 -> 682 | B143: =VLOOKUP(RC[1],Sheet4!C[-1]:C[2],2,FALSE)&VLOOKUP(RC[1],Sheet4!C[-1]:C[2],3,FALSE)&RC[2]&VLOOKUP(RC[1],Sheet4!C[-1]:C[2],4,FALSE)&"（%s/"&RC[2]&"）" -> 占卜翻牌5次（%s/5） | C143: =R[-22]C -> 25 | D143: =R[-22]C -> 5 | E143: 0 | F143: =R[-22]C -> 10096 | G143: =R[-22]C -> 1 | H143: =VLOOKUP(RC[-5],Sheet4!C[-7]:C[-2],5,FALSE) -> 113
A144: =R[-22]C+60 -> 683 | B144: =VLOOKUP(RC[1],Sheet4!C[-1]:C[2],2,FALSE)&VLOOKUP(RC[1],Sheet4!C[-1]:C[2],3,FALSE)&RC[2]&VLOOKUP(RC[1],Sheet4!C[-1]:C[2],4,FALSE)&"（%s/"&RC[2]&"）" -> 英雄副本战斗1次（%s/1） | C144: =R[-22]C -> 14 | D144: =R[-22]C -> 1 | E144: 0 | F144: =R[-22]C -> 19006 | G144: =R[-22]C -> 80 | H144: =VLOOKUP(RC[-5],Sheet4!C[-7]:C[-2],5,FALSE) -> 27
A145: =R[-22]C+60 -> 691 | B145: =VLOOKUP(RC[1],Sheet4!C[-1]:C[2],2,FALSE)&VLOOKUP(RC[1],Sheet4!C[-1]:C[2],3,FALSE)&RC[2]&VLOOKUP(RC[1],Sheet4!C[-1]:C[2],4,FALSE)&"（%s/"&RC[2]&"）" -> 圣器争夺5次（%s/5） | C145: =R[-22]C -> 11 | D145: =R[-22]C -> 5 | E145: 0 | F145: =R[-22]C -> 13049 | G145: =R[-22]C -> 5 | H145: =VLOOKUP(RC[-5],Sheet4!C[-7]:C[-2],5,FALSE) -> 19
A146: =R[-22]C+60 -> 692 | B146: =VLOOKUP(RC[1],Sheet4!C[-1]:C[2],2,FALSE)&VLOOKUP(RC[1],Sheet4!C[-1]:C[2],3,FALSE)&RC[2]&VLOOKUP(RC[1],Sheet4!C[-1]:C[2],4,FALSE)&"（%s/"&RC[2]&"）" -> 圣器合成3次（%s/3） | C146: =R[-22]C -> 22 | D146: =R[-22]C -> 3 | E146: 0 | F146: =R[-22]C -> 13049 | G146: =R[-22]C -> 5 | H146: =VLOOKUP(RC[-5],Sheet4!C[-7]:C[-2],5,FALSE) -> 19
A147: =R[-22]C+60 -> 693 | B147: =VLOOKUP(RC[1],Sheet4!C[-1]:C[2],2,FALSE)&VLOOKUP(RC[1],Sheet4!C[-1]:C[2],3,FALSE)&RC[2]&VLOOKUP(RC[1],Sheet4!C[-1]:C[2],4,FALSE)&"（%s/"&RC[2]&"）" -> 圣器强化5次（%s/5） | C147: =R[-22]C -> 2 | D147: =R[-22]C -> 5 | E147: 0 | F147: =R[-22]C -> 13049 | G147: =R[-22]C -> 5 | H147: =VLOOKUP(RC[-5],Sheet4!C[-7]:C[-2],5,FALSE) -> 8
A148: =R[-22]C+60 -> 701 | B148: =VLOOKUP(RC[1],Sheet4!C[-1]:C[2],2,FALSE)&VLOOKUP(RC[1],Sheet4!C[-1]:C[2],3,FALSE)&RC[2]&VLOOKUP(RC[1],Sheet4!C[-1]:C[2],4,FALSE)&"（%s/"&RC[2]&"）" -> 进行召唤5次（%s/5） | C148: =R[-22]C -> 8 | D148: =R[-22]C -> 5 | E148: 0 | F148: =R[-22]C -> 19006 | G148: =R[-22]C -> 80 | H148: =VLOOKUP(RC[-5],Sheet4!C[-7]:C[-2],5,FALSE) -> 9
A149: =R[-22]C+60 -> 702 | B149: =VLOOKUP(RC[1],Sheet4!C[-1]:C[2],2,FALSE)&VLOOKUP(RC[1],Sheet4!C[-1]:C[2],3,FALSE)&RC[2]&VLOOKUP(RC[1],Sheet4!C[-1]:C[2],4,FALSE)&"（%s/"&RC[2]&"）" -> 进行高级召唤2次（%s/2） | C149: =R[-22]C -> 9 | D149: =R[-22]C -> 2 | E149: 0 | F149: =R[-22]C -> 19006 | G149: =R[-22]C -> 100 | H149: =VLOOKUP(RC[-5],Sheet4!C[-7]:C[-2],5,FALSE) -> 9
A150: =R[-22]C+60 -> 703 | B150: =VLOOKUP(RC[1],Sheet4!C[-1]:C[2],2,FALSE)&VLOOKUP(RC[1],Sheet4!C[-1]:C[2],3,FALSE)&RC[2]&VLOOKUP(RC[1],Sheet4!C[-1]:C[2],4,FALSE)&"（%s/"&RC[2]&"）" -> 购买体力2次（%s/2） | C150: =R[-22]C -> 6 | D150: =R[-22]C -> 2 | E150: 0 | F150: =R[-22]C -> 19005 | G150: =R[-22]C -> 50 | H150: =VLOOKUP(RC[-5],Sheet4!C[-7]:C[-2],5,FALSE) -> 12
A151: =R[-22]C+60 -> 704 | B151: =VLOOKUP(RC[1],Sheet4!C[-1]:C[2],2,FALSE)&VLOOKUP(RC[1],Sheet4!C[-1]:C[2],3,FALSE)&RC[2]&VLOOKUP(RC[1],Sheet4!C[-1]:C[2],4,FALSE)&"（%s/"&RC[2]&"）" -> 购买精力2次（%s/2） | C151: =R[-22]C -> 7 | D151: =R[-22]C -> 2 | E151: 0 | F151: =R[-22]C -> 19005 | G151: =R[-22]C -> 50 | H151: =VLOOKUP(RC[-5],Sheet4!C[-7]:C[-2],5,FALSE) -> 12
A152: =R[-22]C+60 -> 711 | B152: =VLOOKUP(RC[1],Sheet4!C[-1]:C[2],2,FALSE)&VLOOKUP(RC[1],Sheet4!C[-1]:C[2],3,FALSE)&RC[2]&VLOOKUP(RC[1],Sheet4!C[-1]:C[2],4,FALSE)&"（%s/"&RC[2]&"）" -> 进入勇者试练战斗10次（%s/10） | C152: =R[-22]C -> 12 | D152: =R[-22]C -> 10 | E152: 0 | F152: =R[-22]C -> 19012 | G152: =R[-22]C -> 500 | H152: =VLOOKUP(RC[-5],Sheet4!C[-7]:C[-2],5,FALSE) -> 17
A153: =R[-22]C+60 -> 712 | B153: =VLOOKUP(RC[1],Sheet4!C[-1]:C[2],2,FALSE)&VLOOKUP(RC[1],Sheet4!C[-1]:C[2],3,FALSE)&RC[2]&VLOOKUP(RC[1],Sheet4!C[-1]:C[2],4,FALSE)&"（%s/"&RC[2]&"）" -> 竞技场战斗5次（%s/5） | C153: =R[-22]C -> 10 | D153: =R[-22]C -> 5 | E153: 0 | F153: =R[-22]C -> 19013 | G153: =R[-22]C -> 500 | H153: =VLOOKUP(RC[-5],Sheet4!C[-7]:C[-2],5,FALSE) -> 21
A154: =R[-22]C+60 -> 713 | B154: =VLOOKUP(RC[1],Sheet4!C[-1]:C[2],2,FALSE)&VLOOKUP(RC[1],Sheet4!C[-1]:C[2],3,FALSE)&RC[2]&VLOOKUP(RC[1],Sheet4!C[-1]:C[2],4,FALSE)&"（%s/"&RC[2]&"）" -> 主线副本挑战5次（%s/5） | C154: =R[-22]C -> 1 | D154: =R[-22]C -> 5 | E154: 0 | F154: =R[-22]C -> 19003 | G154: =R[-22]C -> 30000 | H154: =VLOOKUP(RC[-5],Sheet4!C[-7]:C[-2],5,FALSE) -> 26
A155: =R[-22]C+60 -> 714 | B155: =VLOOKUP(RC[1],Sheet4!C[-1]:C[2],2,FALSE)&VLOOKUP(RC[1],Sheet4!C[-1]:C[2],3,FALSE)&RC[2]&VLOOKUP(RC[1],Sheet4!C[-1]:C[2],4,FALSE)&"（%s/"&RC[2]&"）" -> 日常副本战斗4次（%s/4） | C155: =R[-22]C -> 13 | D155: =R[-22]C -> 4 | E155: 0 | F155: =R[-22]C -> 19005 | G155: =R[-22]C -> 50 | H155: =VLOOKUP(RC[-5],Sheet4!C[-7]:C[-2],5,FALSE) -> 2
A156: =R[-22]C+60 -> 721 | B156: =VLOOKUP(RC[1],Sheet4!C[-1]:C[2],2,FALSE)&VLOOKUP(RC[1],Sheet4!C[-1]:C[2],3,FALSE)&RC[2]&VLOOKUP(RC[1],Sheet4!C[-1]:C[2],4,FALSE)&"（%s/"&RC[2]&"）" -> 赠送好友精力3次（%s/3） | C156: =R[-22]C -> 4 | D156: =R[-22]C -> 3 | E156: 0 | F156: =R[-22]C -> 19005 | G156: =R[-22]C -> 50 | H156: =VLOOKUP(RC[-5],Sheet4!C[-7]:C[-2],5,FALSE) -> 15
A157: =R[-22]C+60 -> 722 | B157: =VLOOKUP(RC[1],Sheet4!C[-1]:C[2],2,FALSE)&VLOOKUP(RC[1],Sheet4!C[-1]:C[2],3,FALSE)&RC[2]&VLOOKUP(RC[1],Sheet4!C[-1]:C[2],4,FALSE)&"（%s/"&RC[2]&"）" -> 英雄培养15次（%s/15） | C157: =R[-22]C -> 3 | D157: =R[-22]C -> 15 | E157: 0 | F157: =R[-22]C -> 10003 | G157: =R[-22]C -> 30 | H157: =VLOOKUP(RC[-5],Sheet4!C[-7]:C[-2],5,FALSE) -> 8
A158: =R[-22]C+60 -> 723 | B158: =VLOOKUP(RC[1],Sheet4!C[-1]:C[2],2,FALSE)&VLOOKUP(RC[1],Sheet4!C[-1]:C[2],3,FALSE)&RC[2]&VLOOKUP(RC[1],Sheet4!C[-1]:C[2],4,FALSE)&"（%s/"&RC[2]&"）" -> 英雄商店购买1次（%s/1） | C158: =R[-22]C -> 5 | D158: =R[-22]C -> 1 | E158: 0 | F158: =R[-22]C -> 19006 | G158: =R[-22]C -> 80 | H158: =VLOOKUP(RC[-5],Sheet4!C[-7]:C[-2],5,FALSE) -> 11
A159: =R[-22]C+60 -> 724 | B159: =VLOOKUP(RC[1],Sheet4!C[-1]:C[2],2,FALSE)&VLOOKUP(RC[1],Sheet4!C[-1]:C[2],3,FALSE)&RC[2]&VLOOKUP(RC[1],Sheet4!C[-1]:C[2],4,FALSE)&"（%s/"&RC[2]&"）" -> 遗迹探索4小时（%s/4） | C159: =R[-22]C -> 19 | D159: =R[-22]C -> 4 | E159: 0 | F159: =R[-22]C -> 19005 | G159: =R[-22]C -> 50 | H159: =VLOOKUP(RC[-5],Sheet4!C[-7]:C[-2],5,FALSE) -> 20
A160: =R[-22]C+60 -> 731 | B160: =VLOOKUP(RC[1],Sheet4!C[-1]:C[2],2,FALSE)&VLOOKUP(RC[1],Sheet4!C[-1]:C[2],3,FALSE)&RC[2]&VLOOKUP(RC[1],Sheet4!C[-1]:C[2],4,FALSE)&"（%s/"&RC[2]&"）" -> 精英副本战斗1次（%s/1） | C160: =R[-22]C -> 15 | D160: =R[-22]C -> 1 | E160: 0 | F160: =R[-22]C -> 10008 | G160: =R[-22]C -> 30 | H160: =VLOOKUP(RC[-5],Sheet4!C[-7]:C[-2],5,FALSE) -> 28
A161: =R[-22]C+60 -> 732 | B161: =VLOOKUP(RC[1],Sheet4!C[-1]:C[2],2,FALSE)&VLOOKUP(RC[1],Sheet4!C[-1]:C[2],3,FALSE)&RC[2]&VLOOKUP(RC[1],Sheet4!C[-1]:C[2],4,FALSE)&"（%s/"&RC[2]&"）" -> 异度入侵分享2次（%s/2） | C161: =R[-22]C -> 17 | D161: =R[-22]C -> 2 | E161: 0 | F161: =R[-22]C -> 19014 | G161: =R[-22]C -> 500 | H161: =VLOOKUP(RC[-5],Sheet4!C[-7]:C[-2],5,FALSE) -> 16
A162: =R[-22]C+60 -> 733 | B162: =VLOOKUP(RC[1],Sheet4!C[-1]:C[2],2,FALSE)&VLOOKUP(RC[1],Sheet4!C[-1]:C[2],3,FALSE)&RC[2]&VLOOKUP(RC[1],Sheet4!C[-1]:C[2],4,FALSE)&"（%s/"&RC[2]&"）" -> 讨伐异度入侵者2次（%s/2） | C162: =R[-22]C -> 18 | D162: =R[-22]C -> 2 | E162: 0 | F162: =R[-22]C -> 19014 | G162: =R[-22]C -> 500 | H162: =VLOOKUP(RC[-5],Sheet4!C[-7]:C[-2],5,FALSE) -> 16
A163: =R[-22]C+60 -> 734 | B163: =VLOOKUP(RC[1],Sheet4!C[-1]:C[2],2,FALSE)&VLOOKUP(RC[1],Sheet4!C[-1]:C[2],3,FALSE)&RC[2]&VLOOKUP(RC[1],Sheet4!C[-1]:C[2],4,FALSE)&"（%s/"&RC[2]&"）" -> 无尽深渊战斗1次（%s/1） | C163: =R[-22]C -> 23 | D163: =R[-22]C -> 1 | E163: 0 | F163: =R[-22]C -> 19028 | G163: =R[-22]C -> 50 | H163: =VLOOKUP(RC[-5],Sheet4!C[-7]:C[-2],5,FALSE) -> 88
A164: =R[-22]C+60 -> 741 | B164: =VLOOKUP(RC[1],Sheet4!C[-1]:C[2],2,FALSE)&VLOOKUP(RC[1],Sheet4!C[-1]:C[2],3,FALSE)&RC[2]&VLOOKUP(RC[1],Sheet4!C[-1]:C[2],4,FALSE)&"（%s/"&RC[2]&"）" -> 击杀遗迹破坏者3次（%s/3） | C164: =R[-22]C -> 16 | D164: =R[-22]C -> 3 | E164: 0 | F164: =R[-22]C -> 19005 | G164: =R[-22]C -> 50 | H164: =VLOOKUP(RC[-5],Sheet4!C[-7]:C[-2],5,FALSE) -> 20
A165: =R[-22]C+60 -> 742 | B165: =VLOOKUP(RC[1],Sheet4!C[-1]:C[2],2,FALSE)&VLOOKUP(RC[1],Sheet4!C[-1]:C[2],3,FALSE)&RC[2]&VLOOKUP(RC[1],Sheet4!C[-1]:C[2],4,FALSE)&"（%s/"&RC[2]&"）" -> 占卜翻牌5次（%s/5） | C165: =R[-22]C -> 25 | D165: =R[-22]C -> 5 | E165: 0 | F165: =R[-22]C -> 10096 | G165: =R[-22]C -> 1 | H165: =VLOOKUP(RC[-5],Sheet4!C[-7]:C[-2],5,FALSE) -> 113
A166: =R[-22]C+60 -> 743 | B166: =VLOOKUP(RC[1],Sheet4!C[-1]:C[2],2,FALSE)&VLOOKUP(RC[1],Sheet4!C[-1]:C[2],3,FALSE)&RC[2]&VLOOKUP(RC[1],Sheet4!C[-1]:C[2],4,FALSE)&"（%s/"&RC[2]&"）" -> 英雄副本战斗1次（%s/1） | C166: =R[-22]C -> 14 | D166: =R[-22]C -> 1 | E166: 0 | F166: =R[-22]C -> 19006 | G166: =R[-22]C -> 80 | H166: =VLOOKUP(RC[-5],Sheet4!C[-7]:C[-2],5,FALSE) -> 27
A167: =R[-22]C+60 -> 751 | B167: =VLOOKUP(RC[1],Sheet4!C[-1]:C[2],2,FALSE)&VLOOKUP(RC[1],Sheet4!C[-1]:C[2],3,FALSE)&RC[2]&VLOOKUP(RC[1],Sheet4!C[-1]:C[2],4,FALSE)&"（%s/"&RC[2]&"）" -> 圣器争夺5次（%s/5） | C167: =R[-22]C -> 11 | D167: =R[-22]C -> 5 | E167: 0 | F167: =R[-22]C -> 13049 | G167: =R[-22]C -> 5 | H167: =VLOOKUP(RC[-5],Sheet4!C[-7]:C[-2],5,FALSE) -> 19
A168: =R[-22]C+60 -> 752 | B168: =VLOOKUP(RC[1],Sheet4!C[-1]:C[2],2,FALSE)&VLOOKUP(RC[1],Sheet4!C[-1]:C[2],3,FALSE)&RC[2]&VLOOKUP(RC[1],Sheet4!C[-1]:C[2],4,FALSE)&"（%s/"&RC[2]&"）" -> 圣器合成3次（%s/3） | C168: =R[-22]C -> 22 | D168: =R[-22]C -> 3 | E168: 0 | F168: =R[-22]C -> 13049 | G168: =R[-22]C -> 5 | H168: =VLOOKUP(RC[-5],Sheet4!C[-7]:C[-2],5,FALSE) -> 19
A169: =R[-22]C+60 -> 753 | B169: =VLOOKUP(RC[1],Sheet4!C[-1]:C[2],2,FALSE)&VLOOKUP(RC[1],Sheet4!C[-1]:C[2],3,FALSE)&RC[2]&VLOOKUP(RC[1],Sheet4!C[-1]:C[2],4,FALSE)&"（%s/"&RC[2]&"）" -> 圣器强化5次（%s/5） | C169: =R[-22]C -> 2 | D169: =R[-22]C -> 5 | E169: 0 | F169: =R[-22]C -> 13049 | G169: =R[-22]C -> 5 | H169: =VLOOKUP(RC[-5],Sheet4!C[-7]:C[-2],5,FALSE) -> 8
A170: =R[-22]C+60 -> 761 | B170: =VLOOKUP(RC[1],Sheet4!C[-1]:C[2],2,FALSE)&VLOOKUP(RC[1],Sheet4!C[-1]:C[2],3,FALSE)&RC[2]&VLOOKUP(RC[1],Sheet4!C[-1]:C[2],4,FALSE)&"（%s/"&RC[2]&"）" -> 进行召唤5次（%s/5） | C170: =R[-22]C -> 8 | D170: =R[-22]C -> 5 | E170: 0 | F170: =R[-22]C -> 19006 | G170: =R[-22]C -> 80 | H170: =VLOOKUP(RC[-5],Sheet4!C[-7]:C[-2],5,FALSE) -> 9
A171: =R[-22]C+60 -> 762 | B171: =VLOOKUP(RC[1],Sheet4!C[-1]:C[2],2,FALSE)&VLOOKUP(RC[1],Sheet4!C[-1]:C[2],3,FALSE)&RC[2]&VLOOKUP(RC[1],Sheet4!C[-1]:C[2],4,FALSE)&"（%s/"&RC[2]&"）" -> 进行高级召唤2次（%s/2） | C171: =R[-22]C -> 9 | D171: =R[-22]C -> 2 | E171: 0 | F171: =R[-22]C -> 19006 | G171: =R[-22]C -> 100 | H171: =VLOOKUP(RC[-5],Sheet4!C[-7]:C[-2],5,FALSE) -> 9
A172: =R[-22]C+60 -> 763 | B172: =VLOOKUP(RC[1],Sheet4!C[-1]:C[2],2,FALSE)&VLOOKUP(RC[1],Sheet4!C[-1]:C[2],3,FALSE)&RC[2]&VLOOKUP(RC[1],Sheet4!C[-1]:C[2],4,FALSE)&"（%s/"&RC[2]&"）" -> 购买体力2次（%s/2） | C172: =R[-22]C -> 6 | D172: =R[-22]C -> 2 | E172: 0 | F172: =R[-22]C -> 19005 | G172: =R[-22]C -> 50 | H172: =VLOOKUP(RC[-5],Sheet4!C[-7]:C[-2],5,FALSE) -> 12
A173: =R[-22]C+60 -> 764 | B173: =VLOOKUP(RC[1],Sheet4!C[-1]:C[2],2,FALSE)&VLOOKUP(RC[1],Sheet4!C[-1]:C[2],3,FALSE)&RC[2]&VLOOKUP(RC[1],Sheet4!C[-1]:C[2],4,FALSE)&"（%s/"&RC[2]&"）" -> 购买精力2次（%s/2） | C173: =R[-22]C -> 7 | D173: =R[-22]C -> 2 | E173: 0 | F173: =R[-22]C -> 19005 | G173: =R[-22]C -> 50 | H173: =VLOOKUP(RC[-5],Sheet4!C[-7]:C[-2],5,FALSE) -> 12
A174: =R[-22]C+60 -> 771 | B174: =VLOOKUP(RC[1],Sheet4!C[-1]:C[2],2,FALSE)&VLOOKUP(RC[1],Sheet4!C[-1]:C[2],3,FALSE)&RC[2]&VLOOKUP(RC[1],Sheet4!C[-1]:C[2],4,FALSE)&"（%s/"&RC[2]&"）" -> 进入勇者试练战斗10次（%s/10） | C174: =R[-22]C -> 12 | D174: =R[-22]C -> 10 | E174: 0 | F174: =R[-22]C -> 19012 | G174: =R[-22]C -> 500 | H174: =VLOOKUP(RC[-5],Sheet4!C[-7]:C[-2],5,FALSE) -> 17
A175: =R[-22]C+60 -> 772 | B175: =VLOOKUP(RC[1],Sheet4!C[-1]:C[2],2,FALSE)&VLOOKUP(RC[1],Sheet4!C[-1]:C[2],3,FALSE)&RC[2]&VLOOKUP(RC[1],Sheet4!C[-1]:C[2],4,FALSE)&"（%s/"&RC[2]&"）" -> 竞技场战斗5次（%s/5） | C175: =R[-22]C -> 10 | D175: =R[-22]C -> 5 | E175: 0 | F175: =R[-22]C -> 19013 | G175: =R[-22]C -> 500 | H175: =VLOOKUP(RC[-5],Sheet4!C[-7]:C[-2],5,FALSE) -> 21
A176: =R[-22]C+60 -> 773 | B176: =VLOOKUP(RC[1],Sheet4!C[-1]:C[2],2,FALSE)&VLOOKUP(RC[1],Sheet4!C[-1]:C[2],3,FALSE)&RC[2]&VLOOKUP(RC[1],Sheet4!C[-1]:C[2],4,FALSE)&"（%s/"&RC[2]&"）" -> 主线副本挑战5次（%s/5） | C176: =R[-22]C -> 1 | D176: =R[-22]C -> 5 | E176: 0 | F176: =R[-22]C -> 19003 | G176: =R[-22]C -> 30000 | H176: =VLOOKUP(RC[-5],Sheet4!C[-7]:C[-2],5,FALSE) -> 26
A177: =R[-22]C+60 -> 774 | B177: =VLOOKUP(RC[1],Sheet4!C[-1]:C[2],2,FALSE)&VLOOKUP(RC[1],Sheet4!C[-1]:C[2],3,FALSE)&RC[2]&VLOOKUP(RC[1],Sheet4!C[-1]:C[2],4,FALSE)&"（%s/"&RC[2]&"）" -> 日常副本战斗4次（%s/4） | C177: =R[-22]C -> 13 | D177: =R[-22]C -> 4 | E177: 0 | F177: =R[-22]C -> 19005 | G177: =R[-22]C -> 50 | H177: =VLOOKUP(RC[-5],Sheet4!C[-7]:C[-2],5,FALSE) -> 2
A178: =R[-22]C+60 -> 781 | B178: =VLOOKUP(RC[1],Sheet4!C[-1]:C[2],2,FALSE)&VLOOKUP(RC[1],Sheet4!C[-1]:C[2],3,FALSE)&RC[2]&VLOOKUP(RC[1],Sheet4!C[-1]:C[2],4,FALSE)&"（%s/"&RC[2]&"）" -> 赠送好友精力3次（%s/3） | C178: =R[-22]C -> 4 | D178: =R[-22]C -> 3 | E178: 0 | F178: =R[-22]C -> 19005 | G178: =R[-22]C -> 50 | H178: =VLOOKUP(RC[-5],Sheet4!C[-7]:C[-2],5,FALSE) -> 15
A179: =R[-22]C+60 -> 782 | B179: =VLOOKUP(RC[1],Sheet4!C[-1]:C[2],2,FALSE)&VLOOKUP(RC[1],Sheet4!C[-1]:C[2],3,FALSE)&RC[2]&VLOOKUP(RC[1],Sheet4!C[-1]:C[2],4,FALSE)&"（%s/"&RC[2]&"）" -> 英雄培养15次（%s/15） | C179: =R[-22]C -> 3 | D179: =R[-22]C -> 15 | E179: 0 | F179: =R[-22]C -> 10003 | G179: =R[-22]C -> 30 | H179: =VLOOKUP(RC[-5],Sheet4!C[-7]:C[-2],5,FALSE) -> 8
A180: =R[-22]C+60 -> 783 | B180: =VLOOKUP(RC[1],Sheet4!C[-1]:C[2],2,FALSE)&VLOOKUP(RC[1],Sheet4!C[-1]:C[2],3,FALSE)&RC[2]&VLOOKUP(RC[1],Sheet4!C[-1]:C[2],4,FALSE)&"（%s/"&RC[2]&"）" -> 英雄商店购买1次（%s/1） | C180: =R[-22]C -> 5 | D180: =R[-22]C -> 1 | E180: 0 | F180: =R[-22]C -> 19006 | G180: =R[-22]C -> 80 | H180: =VLOOKUP(RC[-5],Sheet4!C[-7]:C[-2],5,FALSE) -> 11
A181: =R[-22]C+60 -> 784 | B181: =VLOOKUP(RC[1],Sheet4!C[-1]:C[2],2,FALSE)&VLOOKUP(RC[1],Sheet4!C[-1]:C[2],3,FALSE)&RC[2]&VLOOKUP(RC[1],Sheet4!C[-1]:C[2],4,FALSE)&"（%s/"&RC[2]&"）" -> 遗迹探索4小时（%s/4） | C181: =R[-22]C -> 19 | D181: =R[-22]C -> 4 | E181: 0 | F181: =R[-22]C -> 19005 | G181: =R[-22]C -> 50 | H181: =VLOOKUP(RC[-5],Sheet4!C[-7]:C[-2],5,FALSE) -> 20
A182: =R[-22]C+60 -> 791 | B182: =VLOOKUP(RC[1],Sheet4!C[-1]:C[2],2,FALSE)&VLOOKUP(RC[1],Sheet4!C[-1]:C[2],3,FALSE)&RC[2]&VLOOKUP(RC[1],Sheet4!C[-1]:C[2],4,FALSE)&"（%s/"&RC[2]&"）" -> 精英副本战斗1次（%s/1） | C182: =R[-22]C -> 15 | D182: =R[-22]C -> 1 | E182: 0 | F182: =R[-22]C -> 10008 | G182: =R[-22]C -> 30 | H182: =VLOOKUP(RC[-5],Sheet4!C[-7]:C[-2],5,FALSE) -> 28
A183: =R[-22]C+60 -> 792 | B183: =VLOOKUP(RC[1],Sheet4!C[-1]:C[2],2,FALSE)&VLOOKUP(RC[1],Sheet4!C[-1]:C[2],3,FALSE)&RC[2]&VLOOKUP(RC[1],Sheet4!C[-1]:C[2],4,FALSE)&"（%s/"&RC[2]&"）" -> 异度入侵分享2次（%s/2） | C183: =R[-22]C -> 17 | D183: =R[-22]C -> 2 | E183: 0 | F183: =R[-22]C -> 19014 | G183: =R[-22]C -> 500 | H183: =VLOOKUP(RC[-5],Sheet4!C[-7]:C[-2],5,FALSE) -> 16
A184: =R[-22]C+60 -> 793 | B184: =VLOOKUP(RC[1],Sheet4!C[-1]:C[2],2,FALSE)&VLOOKUP(RC[1],Sheet4!C[-1]:C[2],3,FALSE)&RC[2]&VLOOKUP(RC[1],Sheet4!C[-1]:C[2],4,FALSE)&"（%s/"&RC[2]&"）" -> 讨伐异度入侵者2次（%s/2） | C184: =R[-22]C -> 18 | D184: =R[-22]C -> 2 | E184: 0 | F184: =R[-22]C -> 19014 | G184: =R[-22]C -> 500 | H184: =VLOOKUP(RC[-5],Sheet4!C[-7]:C[-2],5,FALSE) -> 16
A185: =R[-22]C+60 -> 794 | B185: =VLOOKUP(RC[1],Sheet4!C[-1]:C[2],2,FALSE)&VLOOKUP(RC[1],Sheet4!C[-1]:C[2],3,FALSE)&RC[2]&VLOOKUP(RC[1],Sheet4!C[-1]:C[2],4,FALSE)&"（%s/"&RC[2]&"）" -> 无尽深渊战斗1次（%s/1） | C185: =R[-22]C -> 23 | D185: =R[-22]C -> 1 | E185: 0 | F185: =R[-22]C -> 19028 | G185: =R[-22]C -> 50 | H185: =VLOOKUP(RC[-5],Sheet4!C[-7]:C[-2],5,FALSE) -> 88
A186: =R[-22]C+60 -> 801 | B186: =VLOOKUP(RC[1],Sheet4!C[-1]:C[2],2,FALSE)&VLOOKUP(RC[1],Sheet4!C[-1]:C[2],3,FALSE)&RC[2]&VLOOKUP(RC[1],Sheet4!C[-1]:C[2],4,FALSE)&"（%s/"&RC[2]&"）" -> 击杀遗迹破坏者3次（%s/3） | C186: =R[-22]C -> 16 | D186: =R[-22]C -> 3 | E186: 0 | F186: =R[-22]C -> 19005 | G186: =R[-22]C -> 50 | H186: =VLOOKUP(RC[-5],Sheet4!C[-7]:C[-2],5,FALSE) -> 20
A187: =R[-22]C+60 -> 802 | B187: =VLOOKUP(RC[1],Sheet4!C[-1]:C[2],2,FALSE)&VLOOKUP(RC[1],Sheet4!C[-1]:C[2],3,FALSE)&RC[2]&VLOOKUP(RC[1],Sheet4!C[-1]:C[2],4,FALSE)&"（%s/"&RC[2]&"）" -> 占卜翻牌5次（%s/5） | C187: =R[-22]C -> 25 | D187: =R[-22]C -> 5 | E187: 0 | F187: =R[-22]C -> 10096 | G187: =R[-22]C -> 1 | H187: =VLOOKUP(RC[-5],Sheet4!C[-7]:C[-2],5,FALSE) -> 113
A188: =R[-22]C+60 -> 803 | B188: =VLOOKUP(RC[1],Sheet4!C[-1]:C[2],2,FALSE)&VLOOKUP(RC[1],Sheet4!C[-1]:C[2],3,FALSE)&RC[2]&VLOOKUP(RC[1],Sheet4!C[-1]:C[2],4,FALSE)&"（%s/"&RC[2]&"）" -> 英雄副本战斗1次（%s/1） | C188: =R[-22]C -> 14 | D188: =R[-22]C -> 1 | E188: 0 | F188: =R[-22]C -> 19006 | G188: =R[-22]C -> 80 | H188: =VLOOKUP(RC[-5],Sheet4!C[-7]:C[-2],5,FALSE) -> 27
A189: =R[-22]C+60 -> 811 | B189: =VLOOKUP(RC[1],Sheet4!C[-1]:C[2],2,FALSE)&VLOOKUP(RC[1],Sheet4!C[-1]:C[2],3,FALSE)&RC[2]&VLOOKUP(RC[1],Sheet4!C[-1]:C[2],4,FALSE)&"（%s/"&RC[2]&"）" -> 圣器争夺5次（%s/5） | C189: =R[-22]C -> 11 | D189: =R[-22]C -> 5 | E189: 0 | F189: =R[-22]C -> 13049 | G189: =R[-22]C -> 5 | H189: =VLOOKUP(RC[-5],Sheet4!C[-7]:C[-2],5,FALSE) -> 19
A190: =R[-22]C+60 -> 812 | B190: =VLOOKUP(RC[1],Sheet4!C[-1]:C[2],2,FALSE)&VLOOKUP(RC[1],Sheet4!C[-1]:C[2],3,FALSE)&RC[2]&VLOOKUP(RC[1],Sheet4!C[-1]:C[2],4,FALSE)&"（%s/"&RC[2]&"）" -> 圣器合成3次（%s/3） | C190: =R[-22]C -> 22 | D190: =R[-22]C -> 3 | E190: 0 | F190: =R[-22]C -> 13049 | G190: =R[-22]C -> 5 | H190: =VLOOKUP(RC[-5],Sheet4!C[-7]:C[-2],5,FALSE) -> 19
A191: =R[-22]C+60 -> 813 | B191: =VLOOKUP(RC[1],Sheet4!C[-1]:C[2],2,FALSE)&VLOOKUP(RC[1],Sheet4!C[-1]:C[2],3,FALSE)&RC[2]&VLOOKUP(RC[1],Sheet4!C[-1]:C[2],4,FALSE)&"（%s/"&RC[2]&"）" -> 圣器强化5次（%s/5） | C191: =R[-22]C -> 2 | D191: =R[-22]C -> 5 | E191: 0 | F191: =R[-22]C -> 13049 | G191: =R[-22]C -> 5 | H191: =VLOOKUP(RC[-5],Sheet4!C[-7]:C[-2],5,FALSE) -> 8
A192: =R[-22]C+60 -> 821 | B192: =VLOOKUP(RC[1],Sheet4!C[-1]:C[2],2,FALSE)&VLOOKUP(RC[1],Sheet4!C[-1]:C[2],3,FALSE)&RC[2]&VLOOKUP(RC[1],Sheet4!C[-1]:C[2],4,FALSE)&"（%s/"&RC[2]&"）" -> 进行召唤5次（%s/5） | C192: =R[-22]C -> 8 | D192: =R[-22]C -> 5 | E192: 0 | F192: =R[-22]C -> 19006 | G192: =R[-22]C -> 80 | H192: =VLOOKUP(RC[-5],Sheet4!C[-7]:C[-2],5,FALSE) -> 9
A193: =R[-22]C+60 -> 822 | B193: =VLOOKUP(RC[1],Sheet4!C[-1]:C[2],2,FALSE)&VLOOKUP(RC[1],Sheet4!C[-1]:C[2],3,FALSE)&RC[2]&VLOOKUP(RC[1],Sheet4!C[-1]:C[2],4,FALSE)&"（%s/"&RC[2]&"）" -> 进行高级召唤2次（%s/2） | C193: =R[-22]C -> 9 | D193: =R[-22]C -> 2 | E193: 0 | F193: =R[-22]C -> 19006 | G193: =R[-22]C -> 100 | H193: =VLOOKUP(RC[-5],Sheet4!C[-7]:C[-2],5,FALSE) -> 9
A194: =R[-22]C+60 -> 823 | B194: =VLOOKUP(RC[1],Sheet4!C[-1]:C[2],2,FALSE)&VLOOKUP(RC[1],Sheet4!C[-1]:C[2],3,FALSE)&RC[2]&VLOOKUP(RC[1],Sheet4!C[-1]:C[2],4,FALSE)&"（%s/"&RC[2]&"）" -> 购买体力2次（%s/2） | C194: =R[-22]C -> 6 | D194: =R[-22]C -> 2 | E194: 0 | F194: =R[-22]C -> 19005 | G194: =R[-22]C -> 50 | H194: =VLOOKUP(RC[-5],Sheet4!C[-7]:C[-2],5,FALSE) -> 12
A195: =R[-22]C+60 -> 824 | B195: =VLOOKUP(RC[1],Sheet4!C[-1]:C[2],2,FALSE)&VLOOKUP(RC[1],Sheet4!C[-1]:C[2],3,FALSE)&RC[2]&VLOOKUP(RC[1],Sheet4!C[-1]:C[2],4,FALSE)&"（%s/"&RC[2]&"）" -> 购买精力2次（%s/2） | C195: =R[-22]C -> 7 | D195: =R[-22]C -> 2 | E195: 0 | F195: =R[-22]C -> 19005 | G195: =R[-22]C -> 50 | H195: =VLOOKUP(RC[-5],Sheet4!C[-7]:C[-2],5,FALSE) -> 12
A196: =R[-22]C+60 -> 831 | B196: =VLOOKUP(RC[1],Sheet4!C[-1]:C[2],2,FALSE)&VLOOKUP(RC[1],Sheet4!C[-1]:C[2],3,FALSE)&RC[2]&VLOOKUP(RC[1],Sheet4!C[-1]:C[2],4,FALSE)&"（%s/"&RC[2]&"）" -> 进入勇者试练战斗10次（%s/10） | C196: =R[-22]C -> 12 | D196: =R[-22]C -> 10 | E196: 0 | F196: =R[-22]C -> 19012 | G196: =R[-22]C -> 500 | H196: =VLOOKUP(RC[-5],Sheet4!C[-7]:C[-2],5,FALSE) -> 17
A197: =R[-22]C+60 -> 832 | B197: =VLOOKUP(RC[1],Sheet4!C[-1]:C[2],2,FALSE)&VLOOKUP(RC[1],Sheet4!C[-1]:C[2],3,FALSE)&RC[2]&VLOOKUP(RC[1],Sheet4!C[-1]:C[2],4,FALSE)&"（%s/"&RC[2]&"）" -> 竞技场战斗5次（%s/5） | C197: =R[-22]C -> 10 | D197: =R[-22]C -> 5 | E197: 0 | F197: =R[-22]C -> 19013 | G197: =R[-22]C -> 500 | H197: =VLOOKUP(RC[-5],Sheet4!C[-7]:C[-2],5,FALSE) -> 21
A198: =R[-22]C+60 -> 833 | B198: =VLOOKUP(RC[1],Sheet4!C[-1]:C[2],2,FALSE)&VLOOKUP(RC[1],Sheet4!C[-1]:C[2],3,FALSE)&RC[2]&VLOOKUP(RC[1],Sheet4!C[-1]:C[2],4,FALSE)&"（%s/"&RC[2]&"）" -> 主线副本挑战5次（%s/5） | C198: =R[-22]C -> 1 | D198: =R[-22]C -> 5 | E198: 0 | F198: =R[-22]C -> 19003 | G198: =R[-22]C -> 30000 | H198: =VLOOKUP(RC[-5],Sheet4!C[-7]:C[-2],5,FALSE) -> 26
A199: =R[-22]C+60 -> 834 | B199: =VLOOKUP(RC[1],Sheet4!C[-1]:C[2],2,FALSE)&VLOOKUP(RC[1],Sheet4!C[-1]:C[2],3,FALSE)&RC[2]&VLOOKUP(RC[1],Sheet4!C[-1]:C[2],4,FALSE)&"（%s/"&RC[2]&"）" -> 日常副本战斗4次（%s/4） | C199: =R[-22]C -> 13 | D199: =R[-22]C -> 4 | E199: 0 | F199: =R[-22]C -> 19005 | G199: =R[-22]C -> 50 | H199: =VLOOKUP(RC[-5],Sheet4!C[-7]:C[-2],5,FALSE) -> 2
A200: =R[-22]C+60 -> 841 | B200: =VLOOKUP(RC[1],Sheet4!C[-1]:C[2],2,FALSE)&VLOOKUP(RC[1],Sheet4!C[-1]:C[2],3,FALSE)&RC[2]&VLOOKUP(RC[1],Sheet4!C[-1]:C[2],4,FALSE)&"（%s/"&RC[2]&"）" -> 赠送好友精力3次（%s/3） | C200: =R[-22]C -> 4 | D200: =R[-22]C -> 3 | E200: 0 | F200: =R[-22]C -> 19005 | G200: =R[-22]C -> 50 | H200: =VLOOKUP(RC[-5],Sheet4!C[-7]:C[-2],5,FALSE) -> 15
A201: =R[-22]C+60 -> 842 | B201: =VLOOKUP(RC[1],Sheet4!C[-1]:C[2],2,FALSE)&VLOOKUP(RC[1],Sheet4!C[-1]:C[2],3,FALSE)&RC[2]&VLOOKUP(RC[1],Sheet4!C[-1]:C[2],4,FALSE)&"（%s/"&RC[2]&"）" -> 英雄培养15次（%s/15） | C201: =R[-22]C -> 3 | D201: =R[-22]C -> 15 | E201: 0 | F201: =R[-22]C -> 10003 | G201: =R[-22]C -> 30 | H201: =VLOOKUP(RC[-5],Sheet4!C[-7]:C[-2],5,FALSE) -> 8
A202: =R[-22]C+60 -> 843 | B202: =VLOOKUP(RC[1],Sheet4!C[-1]:C[2],2,FALSE)&VLOOKUP(RC[1],Sheet4!C[-1]:C[2],3,FALSE)&RC[2]&VLOOKUP(RC[1],Sheet4!C[-1]:C[2],4,FALSE)&"（%s/"&RC[2]&"）" -> 英雄商店购买1次（%s/1） | C202: =R[-22]C -> 5 | D202: =R[-22]C -> 1 | E202: 0 | F202: =R[-22]C -> 19006 | G202: =R[-22]C -> 80 | H202: =VLOOKUP(RC[-5],Sheet4!C[-7]:C[-2],5,FALSE) -> 11
A203: =R[-22]C+60 -> 844 | B203: =VLOOKUP(RC[1],Sheet4!C[-1]:C[2],2,FALSE)&VLOOKUP(RC[1],Sheet4!C[-1]:C[2],3,FALSE)&RC[2]&VLOOKUP(RC[1],Sheet4!C[-1]:C[2],4,FALSE)&"（%s/"&RC[2]&"）" -> 遗迹探索4小时（%s/4） | C203: =R[-22]C -> 19 | D203: =R[-22]C -> 4 | E203: 0 | F203: =R[-22]C -> 19005 | G203: =R[-22]C -> 50 | H203: =VLOOKUP(RC[-5],Sheet4!C[-7]:C[-2],5,FALSE) -> 20
A204: =R[-22]C+60 -> 851 | B204: =VLOOKUP(RC[1],Sheet4!C[-1]:C[2],2,FALSE)&VLOOKUP(RC[1],Sheet4!C[-1]:C[2],3,FALSE)&RC[2]&VLOOKUP(RC[1],Sheet4!C[-1]:C[2],4,FALSE)&"（%s/"&RC[2]&"）" -> 精英副本战斗1次（%s/1） | C204: =R[-22]C -> 15 | D204: =R[-22]C -> 1 | E204: 0 | F204: =R[-22]C -> 10008 | G204: =R[-22]C -> 30 | H204: =VLOOKUP(RC[-5],Sheet4!C[-7]:C[-2],5,FALSE) -> 28
A205: =R[-22]C+60 -> 852 | B205: =VLOOKUP(RC[1],Sheet4!C[-1]:C[2],2,FALSE)&VLOOKUP(RC[1],Sheet4!C[-1]:C[2],3,FALSE)&RC[2]&VLOOKUP(RC[1],Sheet4!C[-1]:C[2],4,FALSE)&"（%s/"&RC[2]&"）" -> 异度入侵分享2次（%s/2） | C205: =R[-22]C -> 17 | D205: =R[-22]C -> 2 | E205: 0 | F205: =R[-22]C -> 19014 | G205: =R[-22]C -> 500 | H205: =VLOOKUP(RC[-5],Sheet4!C[-7]:C[-2],5,FALSE) -> 16
A206: =R[-22]C+60 -> 853 | B206: =VLOOKUP(RC[1],Sheet4!C[-1]:C[2],2,FALSE)&VLOOKUP(RC[1],Sheet4!C[-1]:C[2],3,FALSE)&RC[2]&VLOOKUP(RC[1],Sheet4!C[-1]:C[2],4,FALSE)&"（%s/"&RC[2]&"）" -> 讨伐异度入侵者2次（%s/2） | C206: =R[-22]C -> 18 | D206: =R[-22]C -> 2 | E206: 0 | F206: =R[-22]C -> 19014 | G206: =R[-22]C -> 500 | H206: =VLOOKUP(RC[-5],Sheet4!C[-7]:C[-2],5,FALSE) -> 16
A207: =R[-22]C+60 -> 854 | B207: =VLOOKUP(RC[1],Sheet4!C[-1]:C[2],2,FALSE)&VLOOKUP(RC[1],Sheet4!C[-1]:C[2],3,FALSE)&RC[2]&VLOOKUP(RC[1],Sheet4!C[-1]:C[2],4,FALSE)&"（%s/"&RC[2]&"）" -> 无尽深渊战斗1次（%s/1） | C207: =R[-22]C -> 23 | D207: =R[-22]C -> 1 | E207: 0 | F207: =R[-22]C -> 19028 | G207: =R[-22]C -> 50 | H207: =VLOOKUP(RC[-5],Sheet4!C[-7]:C[-2],5,FALSE) -> 88
A208: =R[-22]C+60 -> 861 | B208: =VLOOKUP(RC[1],Sheet4!C[-1]:C[2],2,FALSE)&VLOOKUP(RC[1],Sheet4!C[-1]:C[2],3,FALSE)&RC[2]&VLOOKUP(RC[1],Sheet4!C[-1]:C[2],4,FALSE)&"（%s/"&RC[2]&"）" -> 击杀遗迹破坏者3次（%s/3） | C208: =R[-22]C -> 16 | D208: =R[-22]C -> 3 | E208: 0 | F208: =R[-22]C -> 19005 | G208: =R[-22]C -> 50 | H208: =VLOOKUP(RC[-5],Sheet4!C[-7]:C[-2],5,FALSE) -> 20
A209: =R[-22]C+60 -> 862 | B209: =VLOOKUP(RC[1],Sheet4!C[-1]:C[2],2,FALSE)&VLOOKUP(RC[1],Sheet4!C[-1]:C[2],3,FALSE)&RC[2]&VLOOKUP(RC[1],Sheet4!C[-1]:C[2],4,FALSE)&"（%s/"&RC[2]&"）" -> 占卜翻牌5次（%s/5） | C209: =R[-22]C -> 25 | D209: =R[-22]C -> 5 | E209: 0 | F209: =R[-22]C -> 10096 | G209: =R[-22]C -> 1 | H209: =VLOOKUP(RC[-5],Sheet4!C[-7]:C[-2],5,FALSE) -> 113
A210: =R[-22]C+60 -> 863 | B210: =VLOOKUP(RC[1],Sheet4!C[-1]:C[2],2,FALSE)&VLOOKUP(RC[1],Sheet4!C[-1]:C[2],3,FALSE)&RC[2]&VLOOKUP(RC[1],Sheet4!C[-1]:C[2],4,FALSE)&"（%s/"&RC[2]&"）" -> 英雄副本战斗1次（%s/1） | C210: =R[-22]C -> 14 | D210: =R[-22]C -> 1 | E210: 0 | F210: =R[-22]C -> 19006 | G210: =R[-22]C -> 80 | H210: =VLOOKUP(RC[-5],Sheet4!C[-7]:C[-2],5,FALSE) -> 27
A211: =R[-22]C+60 -> 871 | B211: =VLOOKUP(RC[1],Sheet4!C[-1]:C[2],2,FALSE)&VLOOKUP(RC[1],Sheet4!C[-1]:C[2],3,FALSE)&RC[2]&VLOOKUP(RC[1],Sheet4!C[-1]:C[2],4,FALSE)&"（%s/"&RC[2]&"）" -> 圣器争夺5次（%s/5） | C211: =R[-22]C -> 11 | D211: =R[-22]C -> 5 | E211: 0 | F211: =R[-22]C -> 13049 | G211: =R[-22]C -> 5 | H211: =VLOOKUP(RC[-5],Sheet4!C[-7]:C[-2],5,FALSE) -> 19
A212: =R[-22]C+60 -> 872 | B212: =VLOOKUP(RC[1],Sheet4!C[-1]:C[2],2,FALSE)&VLOOKUP(RC[1],Sheet4!C[-1]:C[2],3,FALSE)&RC[2]&VLOOKUP(RC[1],Sheet4!C[-1]:C[2],4,FALSE)&"（%s/"&RC[2]&"）" -> 圣器合成3次（%s/3） | C212: =R[-22]C -> 22 | D212: =R[-22]C -> 3 | E212: 0 | F212: =R[-22]C -> 13049 | G212: =R[-22]C -> 5 | H212: =VLOOKUP(RC[-5],Sheet4!C[-7]:C[-2],5,FALSE) -> 19
A213: =R[-22]C+60 -> 873 | B213: =VLOOKUP(RC[1],Sheet4!C[-1]:C[2],2,FALSE)&VLOOKUP(RC[1],Sheet4!C[-1]:C[2],3,FALSE)&RC[2]&VLOOKUP(RC[1],Sheet4!C[-1]:C[2],4,FALSE)&"（%s/"&RC[2]&"）" -> 圣器强化5次（%s/5） | C213: =R[-22]C -> 2 | D213: =R[-22]C -> 5 | E213: 0 | F213: =R[-22]C -> 13049 | G213: =R[-22]C -> 5 | H213: =VLOOKUP(RC[-5],Sheet4!C[-7]:C[-2],5,FALSE) -> 8
A214: =R[-22]C+60 -> 881 | B214: =VLOOKUP(RC[1],Sheet4!C[-1]:C[2],2,FALSE)&VLOOKUP(RC[1],Sheet4!C[-1]:C[2],3,FALSE)&RC[2]&VLOOKUP(RC[1],Sheet4!C[-1]:C[2],4,FALSE)&"（%s/"&RC[2]&"）" -> 进行召唤5次（%s/5） | C214: =R[-22]C -> 8 | D214: =R[-22]C -> 5 | E214: 0 | F214: =R[-22]C -> 19006 | G214: =R[-22]C -> 80 | H214: =VLOOKUP(RC[-5],Sheet4!C[-7]:C[-2],5,FALSE) -> 9
A215: =R[-22]C+60 -> 882 | B215: =VLOOKUP(RC[1],Sheet4!C[-1]:C[2],2,FALSE)&VLOOKUP(RC[1],Sheet4!C[-1]:C[2],3,FALSE)&RC[2]&VLOOKUP(RC[1],Sheet4!C[-1]:C[2],4,FALSE)&"（%s/"&RC[2]&"）" -> 进行高级召唤2次（%s/2） | C215: =R[-22]C -> 9 | D215: =R[-22]C -> 2 | E215: 0 | F215: =R[-22]C -> 19006 | G215: =R[-22]C -> 100 | H215: =VLOOKUP(RC[-5],Sheet4!C[-7]:C[-2],5,FALSE) -> 9
A216: =R[-22]C+60 -> 883 | B216: =VLOOKUP(RC[1],Sheet4!C[-1]:C[2],2,FALSE)&VLOOKUP(RC[1],Sheet4!C[-1]:C[2],3,FALSE)&RC[2]&VLOOKUP(RC[1],Sheet4!C[-1]:C[2],4,FALSE)&"（%s/"&RC[2]&"）" -> 购买体力2次（%s/2） | C216: =R[-22]C -> 6 | D216: =R[-22]C -> 2 | E216: 0 | F216: =R[-22]C -> 19005 | G216: =R[-22]C -> 50 | H216: =VLOOKUP(RC[-5],Sheet4!C[-7]:C[-2],5,FALSE) -> 12
A217: =R[-22]C+60 -> 884 | B217: =VLOOKUP(RC[1],Sheet4!C[-1]:C[2],2,FALSE)&VLOOKUP(RC[1],Sheet4!C[-1]:C[2],3,FALSE)&RC[2]&VLOOKUP(RC[1],Sheet4!C[-1]:C[2],4,FALSE)&"（%s/"&RC[2]&"）" -> 购买精力2次（%s/2） | C217: =R[-22]C -> 7 | D217: =R[-22]C -> 2 | E217: 0 | F217: =R[-22]C -> 19005 | G217: =R[-22]C -> 50 | H217: =VLOOKUP(RC[-5],Sheet4!C[-7]:C[-2],5,FALSE) -> 12
A218: =R[-22]C+60 -> 891 | B218: =VLOOKUP(RC[1],Sheet4!C[-1]:C[2],2,FALSE)&VLOOKUP(RC[1],Sheet4!C[-1]:C[2],3,FALSE)&RC[2]&VLOOKUP(RC[1],Sheet4!C[-1]:C[2],4,FALSE)&"（%s/"&RC[2]&"）" -> 进入勇者试练战斗10次（%s/10） | C218: =R[-22]C -> 12 | D218: =R[-22]C -> 10 | E218: 0 | F218: =R[-22]C -> 19012 | G218: =R[-22]C -> 500 | H218: =VLOOKUP(RC[-5],Sheet4!C[-7]:C[-2],5,FALSE) -> 17
A219: =R[-22]C+60 -> 892 | B219: =VLOOKUP(RC[1],Sheet4!C[-1]:C[2],2,FALSE)&VLOOKUP(RC[1],Sheet4!C[-1]:C[2],3,FALSE)&RC[2]&VLOOKUP(RC[1],Sheet4!C[-1]:C[2],4,FALSE)&"（%s/"&RC[2]&"）" -> 竞技场战斗5次（%s/5） | C219: =R[-22]C -> 10 | D219: =R[-22]C -> 5 | E219: 0 | F219: =R[-22]C -> 19013 | G219: =R[-22]C -> 500 | H219: =VLOOKUP(RC[-5],Sheet4!C[-7]:C[-2],5,FALSE) -> 21
A220: =R[-22]C+60 -> 893 | B220: =VLOOKUP(RC[1],Sheet4!C[-1]:C[2],2,FALSE)&VLOOKUP(RC[1],Sheet4!C[-1]:C[2],3,FALSE)&RC[2]&VLOOKUP(RC[1],Sheet4!C[-1]:C[2],4,FALSE)&"（%s/"&RC[2]&"）" -> 主线副本挑战5次（%s/5） | C220: =R[-22]C -> 1 | D220: =R[-22]C -> 5 | E220: 0 | F220: =R[-22]C -> 19003 | G220: =R[-22]C -> 30000 | H220: =VLOOKUP(RC[-5],Sheet4!C[-7]:C[-2],5,FALSE) -> 26
A221: =R[-22]C+60 -> 894 | B221: =VLOOKUP(RC[1],Sheet4!C[-1]:C[2],2,FALSE)&VLOOKUP(RC[1],Sheet4!C[-1]:C[2],3,FALSE)&RC[2]&VLOOKUP(RC[1],Sheet4!C[-1]:C[2],4,FALSE)&"（%s/"&RC[2]&"）" -> 日常副本战斗4次（%s/4） | C221: =R[-22]C -> 13 | D221: =R[-22]C -> 4 | E221: 0 | F221: =R[-22]C -> 19005 | G221: =R[-22]C -> 50 | H221: =VLOOKUP(RC[-5],Sheet4!C[-7]:C[-2],5,FALSE) -> 2
A222: =R[-22]C+60 -> 901 | B222: =VLOOKUP(RC[1],Sheet4!C[-1]:C[2],2,FALSE)&VLOOKUP(RC[1],Sheet4!C[-1]:C[2],3,FALSE)&RC[2]&VLOOKUP(RC[1],Sheet4!C[-1]:C[2],4,FALSE)&"（%s/"&RC[2]&"）" -> 赠送好友精力3次（%s/3） | C222: =R[-22]C -> 4 | D222: =R[-22]C -> 3 | E222: 0 | F222: =R[-22]C -> 19005 | G222: =R[-22]C -> 50 | H222: =VLOOKUP(RC[-5],Sheet4!C[-7]:C[-2],5,FALSE) -> 15
A223: =R[-22]C+60 -> 902 | B223: =VLOOKUP(RC[1],Sheet4!C[-1]:C[2],2,FALSE)&VLOOKUP(RC[1],Sheet4!C[-1]:C[2],3,FALSE)&RC[2]&VLOOKUP(RC[1],Sheet4!C[-1]:C[2],4,FALSE)&"（%s/"&RC[2]&"）" -> 英雄培养15次（%s/15） | C223: =R[-22]C -> 3 | D223: =R[-22]C -> 15 | E223: 0 | F223: =R[-22]C -> 10003 | G223: =R[-22]C -> 30 | H223: =VLOOKUP(RC[-5],Sheet4!C[-7]:C[-2],5,FALSE) -> 8
A224: =R[-22]C+60 -> 903 | B224: =VLOOKUP(RC[1],Sheet4!C[-1]:C[2],2,FALSE)&VLOOKUP(RC[1],Sheet4!C[-1]:C[2],3,FALSE)&RC[2]&VLOOKUP(RC[1],Sheet4!C[-1]:C[2],4,FALSE)&"（%s/"&RC[2]&"）" -> 英雄商店购买1次（%s/1） | C224: =R[-22]C -> 5 | D224: =R[-22]C -> 1 | E224: 0 | F224: =R[-22]C -> 19006 | G224: =R[-22]C -> 80 | H224: =VLOOKUP(RC[-5],Sheet4!C[-7]:C[-2],5,FALSE) -> 11
A225: =R[-22]C+60 -> 904 | B225: =VLOOKUP(RC[1],Sheet4!C[-1]:C[2],2,FALSE)&VLOOKUP(RC[1],Sheet4!C[-1]:C[2],3,FALSE)&RC[2]&VLOOKUP(RC[1],Sheet4!C[-1]:C[2],4,FALSE)&"（%s/"&RC[2]&"）" -> 遗迹探索4小时（%s/4） | C225: =R[-22]C -> 19 | D225: =R[-22]C -> 4 | E225: 0 | F225: =R[-22]C -> 19005 | G225: =R[-22]C -> 50 | H225: =VLOOKUP(RC[-5],Sheet4!C[-7]:C[-2],5,FALSE) -> 20
A226: =R[-22]C+60 -> 911 | B226: =VLOOKUP(RC[1],Sheet4!C[-1]:C[2],2,FALSE)&VLOOKUP(RC[1],Sheet4!C[-1]:C[2],3,FALSE)&RC[2]&VLOOKUP(RC[1],Sheet4!C[-1]:C[2],4,FALSE)&"（%s/"&RC[2]&"）" -> 精英副本战斗1次（%s/1） | C226: =R[-22]C -> 15 | D226: =R[-22]C -> 1 | E226: 0 | F226: =R[-22]C -> 10008 | G226: =R[-22]C -> 30 | H226: =VLOOKUP(RC[-5],Sheet4!C[-7]:C[-2],5,FALSE) -> 28
A227: =R[-22]C+60 -> 912 | B227: =VLOOKUP(RC[1],Sheet4!C[-1]:C[2],2,FALSE)&VLOOKUP(RC[1],Sheet4!C[-1]:C[2],3,FALSE)&RC[2]&VLOOKUP(RC[1],Sheet4!C[-1]:C[2],4,FALSE)&"（%s/"&RC[2]&"）" -> 异度入侵分享2次（%s/2） | C227: =R[-22]C -> 17 | D227: =R[-22]C -> 2 | E227: 0 | F227: =R[-22]C -> 19014 | G227: =R[-22]C -> 500 | H227: =VLOOKUP(RC[-5],Sheet4!C[-7]:C[-2],5,FALSE) -> 16
A228: =R[-22]C+60 -> 913 | B228: =VLOOKUP(RC[1],Sheet4!C[-1]:C[2],2,FALSE)&VLOOKUP(RC[1],Sheet4!C[-1]:C[2],3,FALSE)&RC[2]&VLOOKUP(RC[1],Sheet4!C[-1]:C[2],4,FALSE)&"（%s/"&RC[2]&"）" -> 讨伐异度入侵者2次（%s/2） | C228: =R[-22]C -> 18 | D228: =R[-22]C -> 2 | E228: 0 | F228: =R[-22]C -> 19014 | G228: =R[-22]C -> 500 | H228: =VLOOKUP(RC[-5],Sheet4!C[-7]:C[-2],5,FALSE) -> 16
A229: =R[-22]C+60 -> 914 | B229: =VLOOKUP(RC[1],Sheet4!C[-1]:C[2],2,FALSE)&VLOOKUP(RC[1],Sheet4!C[-1]:C[2],3,FALSE)&RC[2]&VLOOKUP(RC[1],Sheet4!C[-1]:C[2],4,FALSE)&"（%s/"&RC[2]&"）" -> 无尽深渊战斗1次（%s/1） | C229: =R[-22]C -> 23 | D229: =R[-22]C -> 1 | E229: 0 | F229: =R[-22]C -> 19028 | G229: =R[-22]C -> 50 | H229: =VLOOKUP(RC[-5],Sheet4!C[-7]:C[-2],5,FALSE) -> 88
A230: =R[-22]C+60 -> 921 | B230: =VLOOKUP(RC[1],Sheet4!C[-1]:C[2],2,FALSE)&VLOOKUP(RC[1],Sheet4!C[-1]:C[2],3,FALSE)&RC[2]&VLOOKUP(RC[1],Sheet4!C[-1]:C[2],4,FALSE)&"（%s/"&RC[2]&"）" -> 击杀遗迹破坏者3次（%s/3） | C230: =R[-22]C -> 16 | D230: =R[-22]C -> 3 | E230: 0 | F230: =R[-22]C -> 19005 | G230: =R[-22]C -> 50 | H230: =VLOOKUP(RC[-5],Sheet4!C[-7]:C[-2],5,FALSE) -> 20
A231: =R[-22]C+60 -> 922 | B231: =VLOOKUP(RC[1],Sheet4!C[-1]:C[2],2,FALSE)&VLOOKUP(RC[1],Sheet4!C[-1]:C[2],3,FALSE)&RC[2]&VLOOKUP(RC[1],Sheet4!C[-1]:C[2],4,FALSE)&"（%s/"&RC[2]&"）" -> 占卜翻牌5次（%s/5） | C231: =R[-22]C -> 25 | D231: =R[-22]C -> 5 | E231: 0 | F231: =R[-22]C -> 10096 | G231: =R[-22]C -> 1 | H231: =VLOOKUP(RC[-5],Sheet4!C[-7]:C[-2],5,FALSE) -> 113
A232: =R[-22]C+60 -> 923 | B232: =VLOOKUP(RC[1],Sheet4!C[-1]:C[2],2,FALSE)&VLOOKUP(RC[1],Sheet4!C[-1]:C[2],3,FALSE)&RC[2]&VLOOKUP(RC[1],Sheet4!C[-1]:C[2],4,FALSE)&"（%s/"&RC[2]&"）" -> 英雄副本战斗1次（%s/1） | C232: =R[-22]C -> 14 | D232: =R[-22]C -> 1 | E232: 0 | F232: =R[-22]C -> 19006 | G232: =R[-22]C -> 80 | H232: =VLOOKUP(RC[-5],Sheet4!C[-7]:C[-2],5,FALSE) -> 27
A233: =R[-22]C+60 -> 931 | B233: =VLOOKUP(RC[1],Sheet4!C[-1]:C[2],2,FALSE)&VLOOKUP(RC[1],Sheet4!C[-1]:C[2],3,FALSE)&RC[2]&VLOOKUP(RC[1],Sheet4!C[-1]:C[2],4,FALSE)&"（%s/"&RC[2]&"）" -> 圣器争夺5次（%s/5） | C233: =R[-22]C -> 11 | D233: =R[-22]C -> 5 | E233: 0 | F233: =R[-22]C -> 13049 | G233: =R[-22]C -> 5 | H233: =VLOOKUP(RC[-5],Sheet4!C[-7]:C[-2],5,FALSE) -> 19
A234: =R[-22]C+60 -> 932 | B234: =VLOOKUP(RC[1],Sheet4!C[-1]:C[2],2,FALSE)&VLOOKUP(RC[1],Sheet4!C[-1]:C[2],3,FALSE)&RC[2]&VLOOKUP(RC[1],Sheet4!C[-1]:C[2],4,FALSE)&"（%s/"&RC[2]&"）" -> 圣器合成3次（%s/3） | C234: =R[-22]C -> 22 | D234: =R[-22]C -> 3 | E234: 0 | F234: =R[-22]C -> 13049 | G234: =R[-22]C -> 5 | H234: =VLOOKUP(RC[-5],Sheet4!C[-7]:C[-2],5,FALSE) -> 19
A235: =R[-22]C+60 -> 933 | B235: =VLOOKUP(RC[1],Sheet4!C[-1]:C[2],2,FALSE)&VLOOKUP(RC[1],Sheet4!C[-1]:C[2],3,FALSE)&RC[2]&VLOOKUP(RC[1],Sheet4!C[-1]:C[2],4,FALSE)&"（%s/"&RC[2]&"）" -> 圣器强化5次（%s/5） | C235: =R[-22]C -> 2 | D235: =R[-22]C -> 5 | E235: 0 | F235: =R[-22]C -> 13049 | G235: =R[-22]C -> 5 | H235: =VLOOKUP(RC[-5],Sheet4!C[-7]:C[-2],5,FALSE) -> 8
A236: =R[-22]C+60 -> 941 | B236: =VLOOKUP(RC[1],Sheet4!C[-1]:C[2],2,FALSE)&VLOOKUP(RC[1],Sheet4!C[-1]:C[2],3,FALSE)&RC[2]&VLOOKUP(RC[1],Sheet4!C[-1]:C[2],4,FALSE)&"（%s/"&RC[2]&"）" -> 进行召唤5次（%s/5） | C236: =R[-22]C -> 8 | D236: =R[-22]C -> 5 | E236: 0 | F236: =R[-22]C -> 19006 | G236: =R[-22]C -> 80 | H236: =VLOOKUP(RC[-5],Sheet4!C[-7]:C[-2],5,FALSE) -> 9
A237: =R[-22]C+60 -> 942 | B237: =VLOOKUP(RC[1],Sheet4!C[-1]:C[2],2,FALSE)&VLOOKUP(RC[1],Sheet4!C[-1]:C[2],3,FALSE)&RC[2]&VLOOKUP(RC[1],Sheet4!C[-1]:C[2],4,FALSE)&"（%s/"&RC[2]&"）" -> 进行高级召唤2次（%s/2） | C237: =R[-22]C -> 9 | D237: =R[-22]C -> 2 | E237: 0 | F237: =R[-22]C -> 19006 | G237: =R[-22]C -> 100 | H237: =VLOOKUP(RC[-5],Sheet4!C[-7]:C[-2],5,FALSE) -> 9
A238: =R[-22]C+60 -> 943 | B238: =VLOOKUP(RC[1],Sheet4!C[-1]:C[2],2,FALSE)&VLOOKUP(RC[1],Sheet4!C[-1]:C[2],3,FALSE)&RC[2]&VLOOKUP(RC[1],Sheet4!C[-1]:C[2],4,FALSE)&"（%s/"&RC[2]&"）" -> 购买体力2次（%s/2） | C238: =R[-22]C -> 6 | D238: =R[-22]C -> 2 | E238: 0 | F238: =R[-22]C -> 19005 | G238: =R[-22]C -> 50 | H238: =VLOOKUP(RC[-5],Sheet4!C[-7]:C[-2],5,FALSE) -> 12
A239: =R[-22]C+60 -> 944 | B239: =VLOOKUP(RC[1],Sheet4!C[-1]:C[2],2,FALSE)&VLOOKUP(RC[1],Sheet4!C[-1]:C[2],3,FALSE)&RC[2]&VLOOKUP(RC[1],Sheet4!C[-1]:C[2],4,FALSE)&"（%s/"&RC[2]&"）" -> 购买精力2次（%s/2） | C239: =R[-22]C -> 7 | D239: =R[-22]C -> 2 | E239: 0 | F239: =R[-22]C -> 19005 | G239: =R[-22]C -> 50 | H239: =VLOOKUP(RC[-5],Sheet4!C[-7]:C[-2],5,FALSE) -> 12
A240: =R[-22]C+60 -> 951 | B240: =VLOOKUP(RC[1],Sheet4!C[-1]:C[2],2,FALSE)&VLOOKUP(RC[1],Sheet4!C[-1]:C[2],3,FALSE)&RC[2]&VLOOKUP(RC[1],Sheet4!C[-1]:C[2],4,FALSE)&"（%s/"&RC[2]&"）" -> 进入勇者试练战斗10次（%s/10） | C240: =R[-22]C -> 12 | D240: =R[-22]C -> 10 | E240: 0 | F240: =R[-22]C -> 19012 | G240: =R[-22]C -> 500 | H240: =VLOOKUP(RC[-5],Sheet4!C[-7]:C[-2],5,FALSE) -> 17
A241: =R[-22]C+60 -> 952 | B241: =VLOOKUP(RC[1],Sheet4!C[-1]:C[2],2,FALSE)&VLOOKUP(RC[1],Sheet4!C[-1]:C[2],3,FALSE)&RC[2]&VLOOKUP(RC[1],Sheet4!C[-1]:C[2],4,FALSE)&"（%s/"&RC[2]&"）" -> 竞技场战斗5次（%s/5） | C241: =R[-22]C -> 10 | D241: =R[-22]C -> 5 | E241: 0 | F241: =R[-22]C -> 19013 | G241: =R[-22]C -> 500 | H241: =VLOOKUP(RC[-5],Sheet4!C[-7]:C[-2],5,FALSE) -> 21
A242: =R[-22]C+60 -> 953 | B242: =VLOOKUP(RC[1],Sheet4!C[-1]:C[2],2,FALSE)&VLOOKUP(RC[1],Sheet4!C[-1]:C[2],3,FALSE)&RC[2]&VLOOKUP(RC[1],Sheet4!C[-1]:C[2],4,FALSE)&"（%s/"&RC[2]&"）" -> 主线副本挑战5次（%s/5） | C242: =R[-22]C -> 1 | D242: =R[-22]C -> 5 | E242: 0 | F242: =R[-22]C -> 19003 | G242: =R[-22]C -> 30000 | H242: =VLOOKUP(RC[-5],Sheet4!C[-7]:C[-2],5,FALSE) -> 26
A243: =R[-22]C+60 -> 954 | B243: =VLOOKUP(RC[1],Sheet4!C[-1]:C[2],2,FALSE)&VLOOKUP(RC[1],Sheet4!C[-1]:C[2],3,FALSE)&RC[2]&VLOOKUP(RC[1],Sheet4!C[-1]:C[2],4,FALSE)&"（%s/"&RC[2]&"）" -> 日常副本战斗4次（%s/4） | C243: =R[-22]C -> 13 | D243: =R[-22]C -> 4 | E243: 0 | F243: =R[-22]C -> 19005 | G243: =R[-22]C -> 50 | H243: =VLOOKUP(RC[-5],Sheet4!C[-7]:C[-2],5,FALSE) -> 2
A244: =R[-22]C+60 -> 961 | B244: =VLOOKUP(RC[1],Sheet4!C[-1]:C[2],2,FALSE)&VLOOKUP(RC[1],Sheet4!C[-1]:C[2],3,FALSE)&RC[2]&VLOOKUP(RC[1],Sheet4!C[-1]:C[2],4,FALSE)&"（%s/"&RC[2]&"）" -> 赠送好友精力3次（%s/3） | C244: =R[-22]C -> 4 | D244: =R[-22]C -> 3 | E244: 0 | F244: =R[-22]C -> 19005 | G244: =R[-22]C -> 50 | H244: =VLOOKUP(RC[-5],Sheet4!C[-7]:C[-2],5,FALSE) -> 15
A245: =R[-22]C+60 -> 962 | B245: =VLOOKUP(RC[1],Sheet4!C[-1]:C[2],2,FALSE)&VLOOKUP(RC[1],Sheet4!C[-1]:C[2],3,FALSE)&RC[2]&VLOOKUP(RC[1],Sheet4!C[-1]:C[2],4,FALSE)&"（%s/"&RC[2]&"）" -> 英雄培养15次（%s/15） | C245: =R[-22]C -> 3 | D245: =R[-22]C -> 15 | E245: 0 | F245: =R[-22]C -> 10003 | G245: =R[-22]C -> 30 | H245: =VLOOKUP(RC[-5],Sheet4!C[-7]:C[-2],5,FALSE) -> 8
A246: =R[-22]C+60 -> 963 | B246: =VLOOKUP(RC[1],Sheet4!C[-1]:C[2],2,FALSE)&VLOOKUP(RC[1],Sheet4!C[-1]:C[2],3,FALSE)&RC[2]&VLOOKUP(RC[1],Sheet4!C[-1]:C[2],4,FALSE)&"（%s/"&RC[2]&"）" -> 英雄商店购买1次（%s/1） | C246: =R[-22]C -> 5 | D246: =R[-22]C -> 1 | E246: 0 | F246: =R[-22]C -> 19006 | G246: =R[-22]C -> 80 | H246: =VLOOKUP(RC[-5],Sheet4!C[-7]:C[-2],5,FALSE) -> 11
A247: =R[-22]C+60 -> 964 | B247: =VLOOKUP(RC[1],Sheet4!C[-1]:C[2],2,FALSE)&VLOOKUP(RC[1],Sheet4!C[-1]:C[2],3,FALSE)&RC[2]&VLOOKUP(RC[1],Sheet4!C[-1]:C[2],4,FALSE)&"（%s/"&RC[2]&"）" -> 遗迹探索4小时（%s/4） | C247: =R[-22]C -> 19 | D247: =R[-22]C -> 4 | E247: 0 | F247: =R[-22]C -> 19005 | G247: =R[-22]C -> 50 | H247: =VLOOKUP(RC[-5],Sheet4!C[-7]:C[-2],5,FALSE) -> 20
A248: =R[-22]C+60 -> 971 | B248: =VLOOKUP(RC[1],Sheet4!C[-1]:C[2],2,FALSE)&VLOOKUP(RC[1],Sheet4!C[-1]:C[2],3,FALSE)&RC[2]&VLOOKUP(RC[1],Sheet4!C[-1]:C[2],4,FALSE)&"（%s/"&RC[2]&"）" -> 精英副本战斗1次（%s/1） | C248: =R[-22]C -> 15 | D248: =R[-22]C -> 1 | E248: 0 | F248: =R[-22]C -> 10008 | G248: =R[-22]C -> 30 | H248: =VLOOKUP(RC[-5],Sheet4!C[-7]:C[-2],5,FALSE) -> 28
A249: =R[-22]C+60 -> 972 | B249: =VLOOKUP(RC[1],Sheet4!C[-1]:C[2],2,FALSE)&VLOOKUP(RC[1],Sheet4!C[-1]:C[2],3,FALSE)&RC[2]&VLOOKUP(RC[1],Sheet4!C[-1]:C[2],4,FALSE)&"（%s/"&RC[2]&"）" -> 异度入侵分享2次（%s/2） | C249: =R[-22]C -> 17 | D249: =R[-22]C -> 2 | E249: 0 | F249: =R[-22]C -> 19014 | G249: =R[-22]C -> 500 | H249: =VLOOKUP(RC[-5],Sheet4!C[-7]:C[-2],5,FALSE) -> 16
A250: =R[-22]C+60 -> 973 | B250: =VLOOKUP(RC[1],Sheet4!C[-1]:C[2],2,FALSE)&VLOOKUP(RC[1],Sheet4!C[-1]:C[2],3,FALSE)&RC[2]&VLOOKUP(RC[1],Sheet4!C[-1]:C[2],4,FALSE)&"（%s/"&RC[2]&"）" -> 讨伐异度入侵者2次（%s/2） | C250: =R[-22]C -> 18 | D250: =R[-22]C -> 2 | E250: 0 | F250: =R[-22]C -> 19014 | G250: =R[-22]C -> 500 | H250: =VLOOKUP(RC[-5],Sheet4!C[-7]:C[-2],5,FALSE) -> 16
A251: =R[-22]C+60 -> 974 | B251: =VLOOKUP(RC[1],Sheet4!C[-1]:C[2],2,FALSE)&VLOOKUP(RC[1],Sheet4!C[-1]:C[2],3,FALSE)&RC[2]&VLOOKUP(RC[1],Sheet4!C[-1]:C[2],4,FALSE)&"（%s/"&RC[2]&"）" -> 无尽深渊战斗1次（%s/1） | C251: =R[-22]C -> 23 | D251: =R[-22]C -> 1 | E251: 0 | F251: =R[-22]C -> 19028 | G251: =R[-22]C -> 50 | H251: =VLOOKUP(RC[-5],Sheet4!C[-7]:C[-2],5,FALSE) -> 88
A252: =R[-22]C+60 -> 981 | B252: =VLOOKUP(RC[1],Sheet4!C[-1]:C[2],2,FALSE)&VLOOKUP(RC[1],Sheet4!C[-1]:C[2],3,FALSE)&RC[2]&VLOOKUP(RC[1],Sheet4!C[-1]:C[2],4,FALSE)&"（%s/"&RC[2]&"）" -> 击杀遗迹破坏者3次（%s/3） | C252: =R[-22]C -> 16 | D252: =R[-22]C -> 3 | E252: 0 | F252: =R[-22]C -> 19005 | G252: =R[-22]C -> 50 | H252: =VLOOKUP(RC[-5],Sheet4!C[-7]:C[-2],5,FALSE) -> 20
A253: =R[-22]C+60 -> 982 | B253: =VLOOKUP(RC[1],Sheet4!C[-1]:C[2],2,FALSE)&VLOOKUP(RC[1],Sheet4!C[-1]:C[2],3,FALSE)&RC[2]&VLOOKUP(RC[1],Sheet4!C[-1]:C[2],4,FALSE)&"（%s/"&RC[2]&"）" -> 占卜翻牌5次（%s/5） | C253: =R[-22]C -> 25 | D253: =R[-22]C -> 5 | E253: 0 | F253: =R[-22]C -> 10096 | G253: =R[-22]C -> 1 | H253: =VLOOKUP(RC[-5],Sheet4!C[-7]:C[-2],5,FALSE) -> 113
A254: =R[-22]C+60 -> 983 | B254: =VLOOKUP(RC[1],Sheet4!C[-1]:C[2],2,FALSE)&VLOOKUP(RC[1],Sheet4!C[-1]:C[2],3,FALSE)&RC[2]&VLOOKUP(RC[1],Sheet4!C[-1]:C[2],4,FALSE)&"（%s/"&RC[2]&"）" -> 英雄副本战斗1次（%s/1） | C254: =R[-22]C -> 14 | D254: =R[-22]C -> 1 | E254: 0 | F254: =R[-22]C -> 19006 | G254: =R[-22]C -> 80 | H254: =VLOOKUP(RC[-5],Sheet4!C[-7]:C[-2],5,FALSE) -> 27
A255: =R[-22]C+60 -> 991 | B255: =VLOOKUP(RC[1],Sheet4!C[-1]:C[2],2,FALSE)&VLOOKUP(RC[1],Sheet4!C[-1]:C[2],3,FALSE)&RC[2]&VLOOKUP(RC[1],Sheet4!C[-1]:C[2],4,FALSE)&"（%s/"&RC[2]&"）" -> 圣器争夺5次（%s/5） | C255: =R[-22]C -> 11 | D255: =R[-22]C -> 5 | E255: 0 | F255: =R[-22]C -> 13049 | G255: =R[-22]C -> 5 | H255: =VLOOKUP(RC[-5],Sheet4!C[-7]:C[-2],5,FALSE) -> 19
A256: =R[-22]C+60 -> 992 | B256: =VLOOKUP(RC[1],Sheet4!C[-1]:C[2],2,FALSE)&VLOOKUP(RC[1],Sheet4!C[-1]:C[2],3,FALSE)&RC[2]&VLOOKUP(RC[1],Sheet4!C[-1]:C[2],4,FALSE)&"（%s/"&RC[2]&"）" -> 圣器合成3次（%s/3） | C256: =R[-22]C -> 22 | D256: =R[-22]C -> 3 | E256: 0 | F256: =R[-22]C -> 13049 | G256: =R[-22]C -> 5 | H256: =VLOOKUP(RC[-5],Sheet4!C[-7]:C[-2],5,FALSE) -> 19
A257: =R[-22]C+60 -> 993 | B257: =VLOOKUP(RC[1],Sheet4!C[-1]:C[2],2,FALSE)&VLOOKUP(RC[1],Sheet4!C[-1]:C[2],3,FALSE)&RC[2]&VLOOKUP(RC[1],Sheet4!C[-1]:C[2],4,FALSE)&"（%s/"&RC[2]&"）" -> 圣器强化5次（%s/5） | C257: =R[-22]C -> 2 | D257: =R[-22]C -> 5 | E257: 0 | F257: =R[-22]C -> 13049 | G257: =R[-22]C -> 5 | H257: =VLOOKUP(RC[-5],Sheet4!C[-7]:C[-2],5,FALSE) -> 8
A258: =R[-22]C+60 -> 1001 | B258: =VLOOKUP(RC[1],Sheet4!C[-1]:C[2],2,FALSE)&VLOOKUP(RC[1],Sheet4!C[-1]:C[2],3,FALSE)&RC[2]&VLOOKUP(RC[1],Sheet4!C[-1]:C[2],4,FALSE)&"（%s/"&RC[2]&"）" -> 进行召唤5次（%s/5） | C258: =R[-22]C -> 8 | D258: =R[-22]C -> 5 | E258: 0 | F258: =R[-22]C -> 19006 | G258: =R[-22]C -> 80 | H258: =VLOOKUP(RC[-5],Sheet4!C[-7]:C[-2],5,FALSE) -> 9
A259: =R[-22]C+60 -> 1002 | B259: =VLOOKUP(RC[1],Sheet4!C[-1]:C[2],2,FALSE)&VLOOKUP(RC[1],Sheet4!C[-1]:C[2],3,FALSE)&RC[2]&VLOOKUP(RC[1],Sheet4!C[-1]:C[2],4,FALSE)&"（%s/"&RC[2]&"）" -> 进行高级召唤2次（%s/2） | C259: =R[-22]C -> 9 | D259: =R[-22]C -> 2 | E259: 0 | F259: =R[-22]C -> 19006 | G259: =R[-22]C -> 100 | H259: =VLOOKUP(RC[-5],Sheet4!C[-7]:C[-2],5,FALSE) -> 9
A260: =R[-22]C+60 -> 1003 | B260: =VLOOKUP(RC[1],Sheet4!C[-1]:C[2],2,FALSE)&VLOOKUP(RC[1],Sheet4!C[-1]:C[2],3,FALSE)&RC[2]&VLOOKUP(RC[1],Sheet4!C[-1]:C[2],4,FALSE)&"（%s/"&RC[2]&"）" -> 购买体力2次（%s/2） | C260: =R[-22]C -> 6 | D260: =R[-22]C -> 2 | E260: 0 | F260: =R[-22]C -> 19005 | G260: =R[-22]C -> 50 | H260: =VLOOKUP(RC[-5],Sheet4!C[-7]:C[-2],5,FALSE) -> 12
A261: =R[-22]C+60 -> 1004 | B261: =VLOOKUP(RC[1],Sheet4!C[-1]:C[2],2,FALSE)&VLOOKUP(RC[1],Sheet4!C[-1]:C[2],3,FALSE)&RC[2]&VLOOKUP(RC[1],Sheet4!C[-1]:C[2],4,FALSE)&"（%s/"&RC[2]&"）" -> 购买精力2次（%s/2） | C261: =R[-22]C -> 7 | D261: =R[-22]C -> 2 | E261: 0 | F261: =R[-22]C -> 19005 | G261: =R[-22]C -> 50 | H261: =VLOOKUP(RC[-5],Sheet4!C[-7]:C[-2],5,FALSE) -> 12
A262: =R[-22]C+60 -> 1011 | B262: =VLOOKUP(RC[1],Sheet4!C[-1]:C[2],2,FALSE)&VLOOKUP(RC[1],Sheet4!C[-1]:C[2],3,FALSE)&RC[2]&VLOOKUP(RC[1],Sheet4!C[-1]:C[2],4,FALSE)&"（%s/"&RC[2]&"）" -> 进入勇者试练战斗10次（%s/10） | C262: =R[-22]C -> 12 | D262: =R[-22]C -> 10 | E262: 0 | F262: =R[-22]C -> 19012 | G262: =R[-22]C -> 500 | H262: =VLOOKUP(RC[-5],Sheet4!C[-7]:C[-2],5,FALSE) -> 17
A263: =R[-22]C+60 -> 1012 | B263: =VLOOKUP(RC[1],Sheet4!C[-1]:C[2],2,FALSE)&VLOOKUP(RC[1],Sheet4!C[-1]:C[2],3,FALSE)&RC[2]&VLOOKUP(RC[1],Sheet4!C[-1]:C[2],4,FALSE)&"（%s/"&RC[2]&"）" -> 竞技场战斗5次（%s/5） | C263: =R[-22]C -> 10 | D263: =R[-22]C -> 5 | E263: 0 | F263: =R[-22]C -> 19013 | G263: =R[-22]C -> 500 | H263: =VLOOKUP(RC[-5],Sheet4!C[-7]:C[-2],5,FALSE) -> 21
A264: =R[-22]C+60 -> 1013 | B264: =VLOOKUP(RC[1],Sheet4!C[-1]:C[2],2,FALSE)&VLOOKUP(RC[1],Sheet4!C[-1]:C[2],3,FALSE)&RC[2]&VLOOKUP(RC[1],Sheet4!C[-1]:C[2],4,FALSE)&"（%s/"&RC[2]&"）" -> 主线副本挑战5次（%s/5） | C264: =R[-22]C -> 1 | D264: =R[-22]C -> 5 | E264: 0 | F264: =R[-22]C -> 19003 | G264: =R[-22]C -> 30000 | H264: =VLOOKUP(RC[-5],Sheet4!C[-7]:C[-2],5,FALSE) -> 26
A265: =R[-22]C+60 -> 1014 | B265: =VLOOKUP(RC[1],Sheet4!C[-1]:C[2],2,FALSE)&VLOOKUP(RC[1],Sheet4!C[-1]:C[2],3,FALSE)&RC[2]&VLOOKUP(RC[1],Sheet4!C[-1]:C[2],4,FALSE)&"（%s/"&RC[2]&"）" -> 日常副本战斗4次（%s/4） | C265: =R[-22]C -> 13 | D265: =R[-22]C -> 4 | E265: 0 | F265: =R[-22]C -> 19005 | G265: =R[-22]C -> 50 | H265: =VLOOKUP(RC[-5],Sheet4!C[-7]:C[-2],5,FALSE) -> 2
A266: =R[-22]C+60 -> 1021 | B266: =VLOOKUP(RC[1],Sheet4!C[-1]:C[2],2,FALSE)&VLOOKUP(RC[1],Sheet4!C[-1]:C[2],3,FALSE)&RC[2]&VLOOKUP(RC[1],Sheet4!C[-1]:C[2],4,FALSE)&"（%s/"&RC[2]&"）" -> 赠送好友精力3次（%s/3） | C266: =R[-22]C -> 4 | D266: =R[-22]C -> 3 | E266: 0 | F266: =R[-22]C -> 19005 | G266: =R[-22]C -> 50 | H266: =VLOOKUP(RC[-5],Sheet4!C[-7]:C[-2],5,FALSE) -> 15
A267: =R[-22]C+60 -> 1022 | B267: =VLOOKUP(RC[1],Sheet4!C[-1]:C[2],2,FALSE)&VLOOKUP(RC[1],Sheet4!C[-1]:C[2],3,FALSE)&RC[2]&VLOOKUP(RC[1],Sheet4!C[-1]:C[2],4,FALSE)&"（%s/"&RC[2]&"）" -> 英雄培养15次（%s/15） | C267: =R[-22]C -> 3 | D267: =R[-22]C -> 15 | E267: 0 | F267: =R[-22]C -> 10003 | G267: =R[-22]C -> 30 | H267: =VLOOKUP(RC[-5],Sheet4!C[-7]:C[-2],5,FALSE) -> 8
A268: =R[-22]C+60 -> 1023 | B268: =VLOOKUP(RC[1],Sheet4!C[-1]:C[2],2,FALSE)&VLOOKUP(RC[1],Sheet4!C[-1]:C[2],3,FALSE)&RC[2]&VLOOKUP(RC[1],Sheet4!C[-1]:C[2],4,FALSE)&"（%s/"&RC[2]&"）" -> 英雄商店购买1次（%s/1） | C268: =R[-22]C -> 5 | D268: =R[-22]C -> 1 | E268: 0 | F268: =R[-22]C -> 19006 | G268: =R[-22]C -> 80 | H268: =VLOOKUP(RC[-5],Sheet4!C[-7]:C[-2],5,FALSE) -> 11
A269: =R[-22]C+60 -> 1024 | B269: =VLOOKUP(RC[1],Sheet4!C[-1]:C[2],2,FALSE)&VLOOKUP(RC[1],Sheet4!C[-1]:C[2],3,FALSE)&RC[2]&VLOOKUP(RC[1],Sheet4!C[-1]:C[2],4,FALSE)&"（%s/"&RC[2]&"）" -> 遗迹探索4小时（%s/4） | C269: =R[-22]C -> 19 | D269: =R[-22]C -> 4 | E269: 0 | F269: =R[-22]C -> 19005 | G269: =R[-22]C -> 50 | H269: =VLOOKUP(RC[-5],Sheet4!C[-7]:C[-2],5,FALSE) -> 20
A270: =R[-22]C+60 -> 1031 | B270: =VLOOKUP(RC[1],Sheet4!C[-1]:C[2],2,FALSE)&VLOOKUP(RC[1],Sheet4!C[-1]:C[2],3,FALSE)&RC[2]&VLOOKUP(RC[1],Sheet4!C[-1]:C[2],4,FALSE)&"（%s/"&RC[2]&"）" -> 精英副本战斗1次（%s/1） | C270: =R[-22]C -> 15 | D270: =R[-22]C -> 1 | E270: 0 | F270: =R[-22]C -> 10008 | G270: =R[-22]C -> 30 | H270: =VLOOKUP(RC[-5],Sheet4!C[-7]:C[-2],5,FALSE) -> 28
A271: =R[-22]C+60 -> 1032 | B271: =VLOOKUP(RC[1],Sheet4!C[-1]:C[2],2,FALSE)&VLOOKUP(RC[1],Sheet4!C[-1]:C[2],3,FALSE)&RC[2]&VLOOKUP(RC[1],Sheet4!C[-1]:C[2],4,FALSE)&"（%s/"&RC[2]&"）" -> 异度入侵分享2次（%s/2） | C271: =R[-22]C -> 17 | D271: =R[-22]C -> 2 | E271: 0 | F271: =R[-22]C -> 19014 | G271: =R[-22]C -> 500 | H271: =VLOOKUP(RC[-5],Sheet4!C[-7]:C[-2],5,FALSE) -> 16
A272: =R[-22]C+60 -> 1033 | B272: =VLOOKUP(RC[1],Sheet4!C[-1]:C[2],2,FALSE)&VLOOKUP(RC[1],Sheet4!C[-1]:C[2],3,FALSE)&RC[2]&VLOOKUP(RC[1],Sheet4!C[-1]:C[2],4,FALSE)&"（%s/"&RC[2]&"）" -> 讨伐异度入侵者2次（%s/2） | C272: =R[-22]C -> 18 | D272: =R[-22]C -> 2 | E272: 0 | F272: =R[-22]C -> 19014 | G272: =R[-22]C -> 500 | H272: =VLOOKUP(RC[-5],Sheet4!C[-7]:C[-2],5,FALSE) -> 16
A273: =R[-22]C+60 -> 1034 | B273: =VLOOKUP(RC[1],Sheet4!C[-1]:C[2],2,FALSE)&VLOOKUP(RC[1],Sheet4!C[-1]:C[2],3,FALSE)&RC[2]&VLOOKUP(RC[1],Sheet4!C[-1]:C[2],4,FALSE)&"（%s/"&RC[2]&"）" -> 无尽深渊战斗1次（%s/1） | C273: =R[-22]C -> 23 | D273: =R[-22]C -> 1 | E273: 0 | F273: =R[-22]C -> 19028 | G273: =R[-22]C -> 50 | H273: =VLOOKUP(RC[-5],Sheet4!C[-7]:C[-2],5,FALSE) -> 88
A274: =R[-22]C+60 -> 1041 | B274: =VLOOKUP(RC[1],Sheet4!C[-1]:C[2],2,FALSE)&VLOOKUP(RC[1],Sheet4!C[-1]:C[2],3,FALSE)&RC[2]&VLOOKUP(RC[1],Sheet4!C[-1]:C[2],4,FALSE)&"（%s/"&RC[2]&"）" -> 击杀遗迹破坏者3次（%s/3） | C274: =R[-22]C -> 16 | D274: =R[-22]C -> 3 | E274: 0 | F274: =R[-22]C -> 19005 | G274: =R[-22]C -> 50 | H274: =VLOOKUP(RC[-5],Sheet4!C[-7]:C[-2],5,FALSE) -> 20
A275: =R[-22]C+60 -> 1042 | B275: =VLOOKUP(RC[1],Sheet4!C[-1]:C[2],2,FALSE)&VLOOKUP(RC[1],Sheet4!C[-1]:C[2],3,FALSE)&RC[2]&VLOOKUP(RC[1],Sheet4!C[-1]:C[2],4,FALSE)&"（%s/"&RC[2]&"）" -> 占卜翻牌5次（%s/5） | C275: =R[-22]C -> 25 | D275: =R[-22]C -> 5 | E275: 0 | F275: =R[-22]C -> 10096 | G275: =R[-22]C -> 1 | H275: =VLOOKUP(RC[-5],Sheet4!C[-7]:C[-2],5,FALSE) -> 113
A276: =R[-22]C+60 -> 1043 | B276: =VLOOKUP(RC[1],Sheet4!C[-1]:C[2],2,FALSE)&VLOOKUP(RC[1],Sheet4!C[-1]:C[2],3,FALSE)&RC[2]&VLOOKUP(RC[1],Sheet4!C[-1]:C[2],4,FALSE)&"（%s/"&RC[2]&"）" -> 英雄副本战斗1次（%s/1） | C276: =R[-22]C -> 14 | D276: =R[-22]C -> 1 | E276: 0 | F276: =R[-22]C -> 19006 | G276: =R[-22]C -> 80 | H276: =VLOOKUP(RC[-5],Sheet4!C[-7]:C[-2],5,FALSE) -> 27
A277: =R[-22]C+60 -> 1051 | B277: =VLOOKUP(RC[1],Sheet4!C[-1]:C[2],2,FALSE)&VLOOKUP(RC[1],Sheet4!C[-1]:C[2],3,FALSE)&RC[2]&VLOOKUP(RC[1],Sheet4!C[-1]:C[2],4,FALSE)&"（%s/"&RC[2]&"）" -> 圣器争夺5次（%s/5） | C277: =R[-22]C -> 11 | D277: =R[-22]C -> 5 | E277: 0 | F277: =R[-22]C -> 13049 | G277: =R[-22]C -> 5 | H277: =VLOOKUP(RC[-5],Sheet4!C[-7]:C[-2],5,FALSE) -> 19
A278: =R[-22]C+60 -> 1052 | B278: =VLOOKUP(RC[1],Sheet4!C[-1]:C[2],2,FALSE)&VLOOKUP(RC[1],Sheet4!C[-1]:C[2],3,FALSE)&RC[2]&VLOOKUP(RC[1],Sheet4!C[-1]:C[2],4,FALSE)&"（%s/"&RC[2]&"）" -> 圣器合成3次（%s/3） | C278: =R[-22]C -> 22 | D278: =R[-22]C -> 3 | E278: 0 | F278: =R[-22]C -> 13049 | G278: =R[-22]C -> 5 | H278: =VLOOKUP(RC[-5],Sheet4!C[-7]:C[-2],5,FALSE) -> 19
A279: =R[-22]C+60 -> 1053 | B279: =VLOOKUP(RC[1],Sheet4!C[-1]:C[2],2,FALSE)&VLOOKUP(RC[1],Sheet4!C[-1]:C[2],3,FALSE)&RC[2]&VLOOKUP(RC[1],Sheet4!C[-1]:C[2],4,FALSE)&"（%s/"&RC[2]&"）" -> 圣器强化5次（%s/5） | C279: =R[-22]C -> 2 | D279: =R[-22]C -> 5 | E279: 0 | F279: =R[-22]C -> 13049 | G279: =R[-22]C -> 5 | H279: =VLOOKUP(RC[-5],Sheet4!C[-7]:C[-2],5,FALSE) -> 8
A280: =R[-22]C+60 -> 1061 | B280: =VLOOKUP(RC[1],Sheet4!C[-1]:C[2],2,FALSE)&VLOOKUP(RC[1],Sheet4!C[-1]:C[2],3,FALSE)&RC[2]&VLOOKUP(RC[1],Sheet4!C[-1]:C[2],4,FALSE)&"（%s/"&RC[2]&"）" -> 进行召唤5次（%s/5） | C280: =R[-22]C -> 8 | D280: =R[-22]C -> 5 | E280: 0 | F280: =R[-22]C -> 19006 | G280: =R[-22]C -> 80 | H280: =VLOOKUP(RC[-5],Sheet4!C[-7]:C[-2],5,FALSE) -> 9
A281: =R[-22]C+60 -> 1062 | B281: =VLOOKUP(RC[1],Sheet4!C[-1]:C[2],2,FALSE)&VLOOKUP(RC[1],Sheet4!C[-1]:C[2],3,FALSE)&RC[2]&VLOOKUP(RC[1],Sheet4!C[-1]:C[2],4,FALSE)&"（%s/"&RC[2]&"）" -> 进行高级召唤2次（%s/2） | C281: =R[-22]C -> 9 | D281: =R[-22]C -> 2 | E281: 0 | F281: =R[-22]C -> 19006 | G281: =R[-22]C -> 100 | H281: =VLOOKUP(RC[-5],Sheet4!C[-7]:C[-2],5,FALSE) -> 9
A282: =R[-22]C+60 -> 1063 | B282: =VLOOKUP(RC[1],Sheet4!C[-1]:C[2],2,FALSE)&VLOOKUP(RC[1],Sheet4!C[-1]:C[2],3,FALSE)&RC[2]&VLOOKUP(RC[1],Sheet4!C[-1]:C[2],4,FALSE)&"（%s/"&RC[2]&"）" -> 购买体力2次（%s/2） | C282: =R[-22]C -> 6 | D282: =R[-22]C -> 2 | E282: 0 | F282: =R[-22]C -> 19005 | G282: =R[-22]C -> 50 | H282: =VLOOKUP(RC[-5],Sheet4!C[-7]:C[-2],5,FALSE) -> 12
A283: =R[-22]C+60 -> 1064 | B283: =VLOOKUP(RC[1],Sheet4!C[-1]:C[2],2,FALSE)&VLOOKUP(RC[1],Sheet4!C[-1]:C[2],3,FALSE)&RC[2]&VLOOKUP(RC[1],Sheet4!C[-1]:C[2],4,FALSE)&"（%s/"&RC[2]&"）" -> 购买精力2次（%s/2） | C283: =R[-22]C -> 7 | D283: =R[-22]C -> 2 | E283: 0 | F283: =R[-22]C -> 19005 | G283: =R[-22]C -> 50 | H283: =VLOOKUP(RC[-5],Sheet4!C[-7]:C[-2],5,FALSE) -> 12
A284: =R[-22]C+60 -> 1071 | B284: =VLOOKUP(RC[1],Sheet4!C[-1]:C[2],2,FALSE)&VLOOKUP(RC[1],Sheet4!C[-1]:C[2],3,FALSE)&RC[2]&VLOOKUP(RC[1],Sheet4!C[-1]:C[2],4,FALSE)&"（%s/"&RC[2]&"）" -> 进入勇者试练战斗10次（%s/10） | C284: =R[-22]C -> 12 | D284: =R[-22]C -> 10 | E284: 0 | F284: =R[-22]C -> 19012 | G284: =R[-22]C -> 500 | H284: =VLOOKUP(RC[-5],Sheet4!C[-7]:C[-2],5,FALSE) -> 17
A285: =R[-22]C+60 -> 1072 | B285: =VLOOKUP(RC[1],Sheet4!C[-1]:C[2],2,FALSE)&VLOOKUP(RC[1],Sheet4!C[-1]:C[2],3,FALSE)&RC[2]&VLOOKUP(RC[1],Sheet4!C[-1]:C[2],4,FALSE)&"（%s/"&RC[2]&"）" -> 竞技场战斗5次（%s/5） | C285: =R[-22]C -> 10 | D285: =R[-22]C -> 5 | E285: 0 | F285: =R[-22]C -> 19013 | G285: =R[-22]C -> 500 | H285: =VLOOKUP(RC[-5],Sheet4!C[-7]:C[-2],5,FALSE) -> 21
A286: =R[-22]C+60 -> 1073 | B286: =VLOOKUP(RC[1],Sheet4!C[-1]:C[2],2,FALSE)&VLOOKUP(RC[1],Sheet4!C[-1]:C[2],3,FALSE)&RC[2]&VLOOKUP(RC[1],Sheet4!C[-1]:C[2],4,FALSE)&"（%s/"&RC[2]&"）" -> 主线副本挑战5次（%s/5） | C286: =R[-22]C -> 1 | D286: =R[-22]C -> 5 | E286: 0 | F286: =R[-22]C -> 19003 | G286: =R[-22]C -> 30000 | H286: =VLOOKUP(RC[-5],Sheet4!C[-7]:C[-2],5,FALSE) -> 26
A287: =R[-22]C+60 -> 1074 | B287: =VLOOKUP(RC[1],Sheet4!C[-1]:C[2],2,FALSE)&VLOOKUP(RC[1],Sheet4!C[-1]:C[2],3,FALSE)&RC[2]&VLOOKUP(RC[1],Sheet4!C[-1]:C[2],4,FALSE)&"（%s/"&RC[2]&"）" -> 日常副本战斗4次（%s/4） | C287: =R[-22]C -> 13 | D287: =R[-22]C -> 4 | E287: 0 | F287: =R[-22]C -> 19005 | G287: =R[-22]C -> 50 | H287: =VLOOKUP(RC[-5],Sheet4!C[-7]:C[-2],5,FALSE) -> 2
A288: =R[-22]C+60 -> 1081 | B288: =VLOOKUP(RC[1],Sheet4!C[-1]:C[2],2,FALSE)&VLOOKUP(RC[1],Sheet4!C[-1]:C[2],3,FALSE)&RC[2]&VLOOKUP(RC[1],Sheet4!C[-1]:C[2],4,FALSE)&"（%s/"&RC[2]&"）" -> 赠送好友精力3次（%s/3） | C288: =R[-22]C -> 4 | D288: =R[-22]C -> 3 | E288: 0 | F288: =R[-22]C -> 19005 | G288: =R[-22]C -> 50 | H288: =VLOOKUP(RC[-5],Sheet4!C[-7]:C[-2],5,FALSE) -> 15
A289: =R[-22]C+60 -> 1082 | B289: =VLOOKUP(RC[1],Sheet4!C[-1]:C[2],2,FALSE)&VLOOKUP(RC[1],Sheet4!C[-1]:C[2],3,FALSE)&RC[2]&VLOOKUP(RC[1],Sheet4!C[-1]:C[2],4,FALSE)&"（%s/"&RC[2]&"）" -> 英雄培养15次（%s/15） | C289: =R[-22]C -> 3 | D289: =R[-22]C -> 15 | E289: 0 | F289: =R[-22]C -> 10003 | G289: =R[-22]C -> 30 | H289: =VLOOKUP(RC[-5],Sheet4!C[-7]:C[-2],5,FALSE) -> 8
A290: =R[-22]C+60 -> 1083 | B290: =VLOOKUP(RC[1],Sheet4!C[-1]:C[2],2,FALSE)&VLOOKUP(RC[1],Sheet4!C[-1]:C[2],3,FALSE)&RC[2]&VLOOKUP(RC[1],Sheet4!C[-1]:C[2],4,FALSE)&"（%s/"&RC[2]&"）" -> 英雄商店购买1次（%s/1） | C290: =R[-22]C -> 5 | D290: =R[-22]C -> 1 | E290: 0 | F290: =R[-22]C -> 19006 | G290: =R[-22]C -> 80 | H290: =VLOOKUP(RC[-5],Sheet4!C[-7]:C[-2],5,FALSE) -> 11
A291: =R[-22]C+60 -> 1084 | B291: =VLOOKUP(RC[1],Sheet4!C[-1]:C[2],2,FALSE)&VLOOKUP(RC[1],Sheet4!C[-1]:C[2],3,FALSE)&RC[2]&VLOOKUP(RC[1],Sheet4!C[-1]:C[2],4,FALSE)&"（%s/"&RC[2]&"）" -> 遗迹探索4小时（%s/4） | C291: =R[-22]C -> 19 | D291: =R[-22]C -> 4 | E291: 0 | F291: =R[-22]C -> 19005 | G291: =R[-22]C -> 50 | H291: =VLOOKUP(RC[-5],Sheet4!C[-7]:C[-2],5,FALSE) -> 20
A292: =R[-22]C+60 -> 1091 | B292: =VLOOKUP(RC[1],Sheet4!C[-1]:C[2],2,FALSE)&VLOOKUP(RC[1],Sheet4!C[-1]:C[2],3,FALSE)&RC[2]&VLOOKUP(RC[1],Sheet4!C[-1]:C[2],4,FALSE)&"（%s/"&RC[2]&"）" -> 精英副本战斗1次（%s/1） | C292: =R[-22]C -> 15 | D292: =R[-22]C -> 1 | E292: 0 | F292: =R[-22]C -> 10008 | G292: =R[-22]C -> 30 | H292: =VLOOKUP(RC[-5],Sheet4!C[-7]:C[-2],5,FALSE) -> 28
A293: =R[-22]C+60 -> 1092 | B293: =VLOOKUP(RC[1],Sheet4!C[-1]:C[2],2,FALSE)&VLOOKUP(RC[1],Sheet4!C[-1]:C[2],3,FALSE)&RC[2]&VLOOKUP(RC[1],Sheet4!C[-1]:C[2],4,FALSE)&"（%s/"&RC[2]&"）" -> 异度入侵分享2次（%s/2） | C293: =R[-22]C -> 17 | D293: =R[-22]C -> 2 | E293: 0 | F293: =R[-22]C -> 19014 | G293: =R[-22]C -> 500 | H293: =VLOOKUP(RC[-5],Sheet4!C[-7]:C[-2],5,FALSE) -> 16
A294: =R[-22]C+60 -> 1093 | B294: =VLOOKUP(RC[1],Sheet4!C[-1]:C[2],2,FALSE)&VLOOKUP(RC[1],Sheet4!C[-1]:C[2],3,FALSE)&RC[2]&VLOOKUP(RC[1],Sheet4!C[-1]:C[2],4,FALSE)&"（%s/"&RC[2]&"）" -> 讨伐异度入侵者2次（%s/2） | C294: =R[-22]C -> 18 | D294: =R[-22]C -> 2 | E294: 0 | F294: =R[-22]C -> 19014 | G294: =R[-22]C -> 500 | H294: =VLOOKUP(RC[-5],Sheet4!C[-7]:C[-2],5,FALSE) -> 16
A295: =R[-22]C+60 -> 1094 | B295: =VLOOKUP(RC[1],Sheet4!C[-1]:C[2],2,FALSE)&VLOOKUP(RC[1],Sheet4!C[-1]:C[2],3,FALSE)&RC[2]&VLOOKUP(RC[1],Sheet4!C[-1]:C[2],4,FALSE)&"（%s/"&RC[2]&"）" -> 无尽深渊战斗1次（%s/1） | C295: =R[-22]C -> 23 | D295: =R[-22]C -> 1 | E295: 0 | F295: =R[-22]C -> 19028 | G295: =R[-22]C -> 50 | H295: =VLOOKUP(RC[-5],Sheet4!C[-7]:C[-2],5,FALSE) -> 88
A296: =R[-22]C+60 -> 1101 | B296: =VLOOKUP(RC[1],Sheet4!C[-1]:C[2],2,FALSE)&VLOOKUP(RC[1],Sheet4!C[-1]:C[2],3,FALSE)&RC[2]&VLOOKUP(RC[1],Sheet4!C[-1]:C[2],4,FALSE)&"（%s/"&RC[2]&"）" -> 击杀遗迹破坏者3次（%s/3） | C296: =R[-22]C -> 16 | D296: =R[-22]C -> 3 | E296: 0 | F296: =R[-22]C -> 19005 | G296: =R[-22]C -> 50 | H296: =VLOOKUP(RC[-5],Sheet4!C[-7]:C[-2],5,FALSE) -> 20
A297: =R[-22]C+60 -> 1102 | B297: =VLOOKUP(RC[1],Sheet4!C[-1]:C[2],2,FALSE)&VLOOKUP(RC[1],Sheet4!C[-1]:C[2],3,FALSE)&RC[2]&VLOOKUP(RC[1],Sheet4!C[-1]:C[2],4,FALSE)&"（%s/"&RC[2]&"）" -> 占卜翻牌5次（%s/5） | C297: =R[-22]C -> 25 | D297: =R[-22]C -> 5 | E297: 0 | F297: =R[-22]C -> 10096 | G297: =R[-22]C -> 1 | H297: =VLOOKUP(RC[-5],Sheet4!C[-7]:C[-2],5,FALSE) -> 113
A298: =R[-22]C+60 -> 1103 | B298: =VLOOKUP(RC[1],Sheet4!C[-1]:C[2],2,FALSE)&VLOOKUP(RC[1],Sheet4!C[-1]:C[2],3,FALSE)&RC[2]&VLOOKUP(RC[1],Sheet4!C[-1]:C[2],4,FALSE)&"（%s/"&RC[2]&"）" -> 英雄副本战斗1次（%s/1） | C298: =R[-22]C -> 14 | D298: =R[-22]C -> 1 | E298: 0 | F298: =R[-22]C -> 19006 | G298: =R[-22]C -> 80 | H298: =VLOOKUP(RC[-5],Sheet4!C[-7]:C[-2],5,FALSE) -> 27
A299: =R[-22]C+60 -> 1111 | B299: =VLOOKUP(RC[1],Sheet4!C[-1]:C[2],2,FALSE)&VLOOKUP(RC[1],Sheet4!C[-1]:C[2],3,FALSE)&RC[2]&VLOOKUP(RC[1],Sheet4!C[-1]:C[2],4,FALSE)&"（%s/"&RC[2]&"）" -> 圣器争夺5次（%s/5） | C299: =R[-22]C -> 11 | D299: =R[-22]C -> 5 | E299: 0 | F299: =R[-22]C -> 13049 | G299: =R[-22]C -> 5 | H299: =VLOOKUP(RC[-5],Sheet4!C[-7]:C[-2],5,FALSE) -> 19
A300: =R[-22]C+60 -> 1112 | B300: =VLOOKUP(RC[1],Sheet4!C[-1]:C[2],2,FALSE)&VLOOKUP(RC[1],Sheet4!C[-1]:C[2],3,FALSE)&RC[2]&VLOOKUP(RC[1],Sheet4!C[-1]:C[2],4,FALSE)&"（%s/"&RC[2]&"）" -> 圣器合成3次（%s/3） | C300: =R[-22]C -> 22 | D300: =R[-22]C -> 3 | E300: 0 | F300: =R[-22]C -> 13049 | G300: =R[-22]C -> 5 | H300: =VLOOKUP(RC[-5],Sheet4!C[-7]:C[-2],5,FALSE) -> 19
A301: =R[-22]C+60 -> 1113 | B301: =VLOOKUP(RC[1],Sheet4!C[-1]:C[2],2,FALSE)&VLOOKUP(RC[1],Sheet4!C[-1]:C[2],3,FALSE)&RC[2]&VLOOKUP(RC[1],Sheet4!C[-1]:C[2],4,FALSE)&"（%s/"&RC[2]&"）" -> 圣器强化5次（%s/5） | C301: =R[-22]C -> 2 | D301: =R[-22]C -> 5 | E301: 0 | F301: =R[-22]C -> 13049 | G301: =R[-22]C -> 5 | H301: =VLOOKUP(RC[-5],Sheet4!C[-7]:C[-2],5,FALSE) -> 8
A302: =R[-22]C+60 -> 1121 | B302: =VLOOKUP(RC[1],Sheet4!C[-1]:C[2],2,FALSE)&VLOOKUP(RC[1],Sheet4!C[-1]:C[2],3,FALSE)&RC[2]&VLOOKUP(RC[1],Sheet4!C[-1]:C[2],4,FALSE)&"（%s/"&RC[2]&"）" -> 进行召唤5次（%s/5） | C302: =R[-22]C -> 8 | D302: =R[-22]C -> 5 | E302: 0 | F302: =R[-22]C -> 19006 | G302: =R[-22]C -> 80 | H302: =VLOOKUP(RC[-5],Sheet4!C[-7]:C[-2],5,FALSE) -> 9
A303: =R[-22]C+60 -> 1122 | B303: =VLOOKUP(RC[1],Sheet4!C[-1]:C[2],2,FALSE)&VLOOKUP(RC[1],Sheet4!C[-1]:C[2],3,FALSE)&RC[2]&VLOOKUP(RC[1],Sheet4!C[-1]:C[2],4,FALSE)&"（%s/"&RC[2]&"）" -> 进行高级召唤2次（%s/2） | C303: =R[-22]C -> 9 | D303: =R[-22]C -> 2 | E303: 0 | F303: =R[-22]C -> 19006 | G303: =R[-22]C -> 100 | H303: =VLOOKUP(RC[-5],Sheet4!C[-7]:C[-2],5,FALSE) -> 9
A304: =R[-22]C+60 -> 1123 | B304: =VLOOKUP(RC[1],Sheet4!C[-1]:C[2],2,FALSE)&VLOOKUP(RC[1],Sheet4!C[-1]:C[2],3,FALSE)&RC[2]&VLOOKUP(RC[1],Sheet4!C[-1]:C[2],4,FALSE)&"（%s/"&RC[2]&"）" -> 购买体力2次（%s/2） | C304: =R[-22]C -> 6 | D304: =R[-22]C -> 2 | E304: 0 | F304: =R[-22]C -> 19005 | G304: =R[-22]C -> 50 | H304: =VLOOKUP(RC[-5],Sheet4!C[-7]:C[-2],5,FALSE) -> 12
A305: =R[-22]C+60 -> 1124 | B305: =VLOOKUP(RC[1],Sheet4!C[-1]:C[2],2,FALSE)&VLOOKUP(RC[1],Sheet4!C[-1]:C[2],3,FALSE)&RC[2]&VLOOKUP(RC[1],Sheet4!C[-1]:C[2],4,FALSE)&"（%s/"&RC[2]&"）" -> 购买精力2次（%s/2） | C305: =R[-22]C -> 7 | D305: =R[-22]C -> 2 | E305: 0 | F305: =R[-22]C -> 19005 | G305: =R[-22]C -> 50 | H305: =VLOOKUP(RC[-5],Sheet4!C[-7]:C[-2],5,FALSE) -> 12
A306: =R[-22]C+60 -> 1131 | B306: =VLOOKUP(RC[1],Sheet4!C[-1]:C[2],2,FALSE)&VLOOKUP(RC[1],Sheet4!C[-1]:C[2],3,FALSE)&RC[2]&VLOOKUP(RC[1],Sheet4!C[-1]:C[2],4,FALSE)&"（%s/"&RC[2]&"）" -> 进入勇者试练战斗10次（%s/10） | C306: =R[-22]C -> 12 | D306: =R[-22]C -> 10 | E306: 0 | F306: =R[-22]C -> 19012 | G306: =R[-22]C -> 500 | H306: =VLOOKUP(RC[-5],Sheet4!C[-7]:C[-2],5,FALSE) -> 17
A307: =R[-22]C+60 -> 1132 | B307: =VLOOKUP(RC[1],Sheet4!C[-1]:C[2],2,FALSE)&VLOOKUP(RC[1],Sheet4!C[-1]:C[2],3,FALSE)&RC[2]&VLOOKUP(RC[1],Sheet4!C[-1]:C[2],4,FALSE)&"（%s/"&RC[2]&"）" -> 竞技场战斗5次（%s/5） | C307: =R[-22]C -> 10 | D307: =R[-22]C -> 5 | E307: 0 | F307: =R[-22]C -> 19013 | G307: =R[-22]C -> 500 | H307: =VLOOKUP(RC[-5],Sheet4!C[-7]:C[-2],5,FALSE) -> 21
A308: =R[-22]C+60 -> 1133 | B308: =VLOOKUP(RC[1],Sheet4!C[-1]:C[2],2,FALSE)&VLOOKUP(RC[1],Sheet4!C[-1]:C[2],3,FALSE)&RC[2]&VLOOKUP(RC[1],Sheet4!C[-1]:C[2],4,FALSE)&"（%s/"&RC[2]&"）" -> 主线副本挑战5次（%s/5） | C308: =R[-22]C -> 1 | D308: =R[-22]C -> 5 | E308: 0 | F308: =R[-22]C -> 19003 | G308: =R[-22]C -> 30000 | H308: =VLOOKUP(RC[-5],Sheet4!C[-7]:C[-2],5,FALSE) -> 26
A309: =R[-22]C+60 -> 1134 | B309: =VLOOKUP(RC[1],Sheet4!C[-1]:C[2],2,FALSE)&VLOOKUP(RC[1],Sheet4!C[-1]:C[2],3,FALSE)&RC[2]&VLOOKUP(RC[1],Sheet4!C[-1]:C[2],4,FALSE)&"（%s/"&RC[2]&"）" -> 日常副本战斗4次（%s/4） | C309: =R[-22]C -> 13 | D309: =R[-22]C -> 4 | E309: 0 | F309: =R[-22]C -> 19005 | G309: =R[-22]C -> 50 | H309: =VLOOKUP(RC[-5],Sheet4!C[-7]:C[-2],5,FALSE) -> 2
A310: =R[-22]C+60 -> 1141 | B310: =VLOOKUP(RC[1],Sheet4!C[-1]:C[2],2,FALSE)&VLOOKUP(RC[1],Sheet4!C[-1]:C[2],3,FALSE)&RC[2]&VLOOKUP(RC[1],Sheet4!C[-1]:C[2],4,FALSE)&"（%s/"&RC[2]&"）" -> 赠送好友精力3次（%s/3） | C310: =R[-22]C -> 4 | D310: =R[-22]C -> 3 | E310: 0 | F310: =R[-22]C -> 19005 | G310: =R[-22]C -> 50 | H310: =VLOOKUP(RC[-5],Sheet4!C[-7]:C[-2],5,FALSE) -> 15
A311: =R[-22]C+60 -> 1142 | B311: =VLOOKUP(RC[1],Sheet4!C[-1]:C[2],2,FALSE)&VLOOKUP(RC[1],Sheet4!C[-1]:C[2],3,FALSE)&RC[2]&VLOOKUP(RC[1],Sheet4!C[-1]:C[2],4,FALSE)&"（%s/"&RC[2]&"）" -> 英雄培养15次（%s/15） | C311: =R[-22]C -> 3 | D311: =R[-22]C -> 15 | E311: 0 | F311: =R[-22]C -> 10003 | G311: =R[-22]C -> 30 | H311: =VLOOKUP(RC[-5],Sheet4!C[-7]:C[-2],5,FALSE) -> 8
A312: =R[-22]C+60 -> 1143 | B312: =VLOOKUP(RC[1],Sheet4!C[-1]:C[2],2,FALSE)&VLOOKUP(RC[1],Sheet4!C[-1]:C[2],3,FALSE)&RC[2]&VLOOKUP(RC[1],Sheet4!C[-1]:C[2],4,FALSE)&"（%s/"&RC[2]&"）" -> 英雄商店购买1次（%s/1） | C312: =R[-22]C -> 5 | D312: =R[-22]C -> 1 | E312: 0 | F312: =R[-22]C -> 19006 | G312: =R[-22]C -> 80 | H312: =VLOOKUP(RC[-5],Sheet4!C[-7]:C[-2],5,FALSE) -> 11
A313: =R[-22]C+60 -> 1144 | B313: =VLOOKUP(RC[1],Sheet4!C[-1]:C[2],2,FALSE)&VLOOKUP(RC[1],Sheet4!C[-1]:C[2],3,FALSE)&RC[2]&VLOOKUP(RC[1],Sheet4!C[-1]:C[2],4,FALSE)&"（%s/"&RC[2]&"）" -> 遗迹探索4小时（%s/4） | C313: =R[-22]C -> 19 | D313: =R[-22]C -> 4 | E313: 0 | F313: =R[-22]C -> 19005 | G313: =R[-22]C -> 50 | H313: =VLOOKUP(RC[-5],Sheet4!C[-7]:C[-2],5,FALSE) -> 20
A314: =R[-22]C+60 -> 1151 | B314: =VLOOKUP(RC[1],Sheet4!C[-1]:C[2],2,FALSE)&VLOOKUP(RC[1],Sheet4!C[-1]:C[2],3,FALSE)&RC[2]&VLOOKUP(RC[1],Sheet4!C[-1]:C[2],4,FALSE)&"（%s/"&RC[2]&"）" -> 精英副本战斗1次（%s/1） | C314: =R[-22]C -> 15 | D314: =R[-22]C -> 1 | E314: 0 | F314: =R[-22]C -> 10008 | G314: =R[-22]C -> 30 | H314: =VLOOKUP(RC[-5],Sheet4!C[-7]:C[-2],5,FALSE) -> 28
A315: =R[-22]C+60 -> 1152 | B315: =VLOOKUP(RC[1],Sheet4!C[-1]:C[2],2,FALSE)&VLOOKUP(RC[1],Sheet4!C[-1]:C[2],3,FALSE)&RC[2]&VLOOKUP(RC[1],Sheet4!C[-1]:C[2],4,FALSE)&"（%s/"&RC[2]&"）" -> 异度入侵分享2次（%s/2） | C315: =R[-22]C -> 17 | D315: =R[-22]C -> 2 | E315: 0 | F315: =R[-22]C -> 19014 | G315: =R[-22]C -> 500 | H315: =VLOOKUP(RC[-5],Sheet4!C[-7]:C[-2],5,FALSE) -> 16
A316: =R[-22]C+60 -> 1153 | B316: =VLOOKUP(RC[1],Sheet4!C[-1]:C[2],2,FALSE)&VLOOKUP(RC[1],Sheet4!C[-1]:C[2],3,FALSE)&RC[2]&VLOOKUP(RC[1],Sheet4!C[-1]:C[2],4,FALSE)&"（%s/"&RC[2]&"）" -> 讨伐异度入侵者2次（%s/2） | C316: =R[-22]C -> 18 | D316: =R[-22]C -> 2 | E316: 0 | F316: =R[-22]C -> 19014 | G316: =R[-22]C -> 500 | H316: =VLOOKUP(RC[-5],Sheet4!C[-7]:C[-2],5,FALSE) -> 16
A317: =R[-22]C+60 -> 1154 | B317: =VLOOKUP(RC[1],Sheet4!C[-1]:C[2],2,FALSE)&VLOOKUP(RC[1],Sheet4!C[-1]:C[2],3,FALSE)&RC[2]&VLOOKUP(RC[1],Sheet4!C[-1]:C[2],4,FALSE)&"（%s/"&RC[2]&"）" -> 无尽深渊战斗1次（%s/1） | C317: =R[-22]C -> 23 | D317: =R[-22]C -> 1 | E317: 0 | F317: =R[-22]C -> 19028 | G317: =R[-22]C -> 50 | H317: =VLOOKUP(RC[-5],Sheet4!C[-7]:C[-2],5,FALSE) -> 88
A318: =R[-22]C+60 -> 1161 | B318: =VLOOKUP(RC[1],Sheet4!C[-1]:C[2],2,FALSE)&VLOOKUP(RC[1],Sheet4!C[-1]:C[2],3,FALSE)&RC[2]&VLOOKUP(RC[1],Sheet4!C[-1]:C[2],4,FALSE)&"（%s/"&RC[2]&"）" -> 击杀遗迹破坏者3次（%s/3） | C318: =R[-22]C -> 16 | D318: =R[-22]C -> 3 | E318: 0 | F318: =R[-22]C -> 19005 | G318: =R[-22]C -> 50 | H318: =VLOOKUP(RC[-5],Sheet4!C[-7]:C[-2],5,FALSE) -> 20
A319: =R[-22]C+60 -> 1162 | B319: =VLOOKUP(RC[1],Sheet4!C[-1]:C[2],2,FALSE)&VLOOKUP(RC[1],Sheet4!C[-1]:C[2],3,FALSE)&RC[2]&VLOOKUP(RC[1],Sheet4!C[-1]:C[2],4,FALSE)&"（%s/"&RC[2]&"）" -> 占卜翻牌5次（%s/5） | C319: =R[-22]C -> 25 | D319: =R[-22]C -> 5 | E319: 0 | F319: =R[-22]C -> 10096 | G319: =R[-22]C -> 1 | H319: =VLOOKUP(RC[-5],Sheet4!C[-7]:C[-2],5,FALSE) -> 113
A320: =R[-22]C+60 -> 1163 | B320: =VLOOKUP(RC[1],Sheet4!C[-1]:C[2],2,FALSE)&VLOOKUP(RC[1],Sheet4!C[-1]:C[2],3,FALSE)&RC[2]&VLOOKUP(RC[1],Sheet4!C[-1]:C[2],4,FALSE)&"（%s/"&RC[2]&"）" -> 英雄副本战斗1次（%s/1） | C320: =R[-22]C -> 14 | D320: =R[-22]C -> 1 | E320: 0 | F320: =R[-22]C -> 19006 | G320: =R[-22]C -> 80 | H320: =VLOOKUP(RC[-5],Sheet4!C[-7]:C[-2],5,FALSE) -> 27
A321: =R[-22]C+60 -> 1171 | B321: =VLOOKUP(RC[1],Sheet4!C[-1]:C[2],2,FALSE)&VLOOKUP(RC[1],Sheet4!C[-1]:C[2],3,FALSE)&RC[2]&VLOOKUP(RC[1],Sheet4!C[-1]:C[2],4,FALSE)&"（%s/"&RC[2]&"）" -> 圣器争夺5次（%s/5） | C321: =R[-22]C -> 11 | D321: =R[-22]C -> 5 | E321: 0 | F321: =R[-22]C -> 13049 | G321: =R[-22]C -> 5 | H321: =VLOOKUP(RC[-5],Sheet4!C[-7]:C[-2],5,FALSE) -> 19
A322: =R[-22]C+60 -> 1172 | B322: =VLOOKUP(RC[1],Sheet4!C[-1]:C[2],2,FALSE)&VLOOKUP(RC[1],Sheet4!C[-1]:C[2],3,FALSE)&RC[2]&VLOOKUP(RC[1],Sheet4!C[-1]:C[2],4,FALSE)&"（%s/"&RC[2]&"）" -> 圣器合成3次（%s/3） | C322: =R[-22]C -> 22 | D322: =R[-22]C -> 3 | E322: 0 | F322: =R[-22]C -> 13049 | G322: =R[-22]C -> 5 | H322: =VLOOKUP(RC[-5],Sheet4!C[-7]:C[-2],5,FALSE) -> 19
A323: =R[-22]C+60 -> 1173 | B323: =VLOOKUP(RC[1],Sheet4!C[-1]:C[2],2,FALSE)&VLOOKUP(RC[1],Sheet4!C[-1]:C[2],3,FALSE)&RC[2]&VLOOKUP(RC[1],Sheet4!C[-1]:C[2],4,FALSE)&"（%s/"&RC[2]&"）" -> 圣器强化5次（%s/5） | C323: =R[-22]C -> 2 | D323: =R[-22]C -> 5 | E323: 0 | F323: =R[-22]C -> 13049 | G323: =R[-22]C -> 5 | H323: =VLOOKUP(RC[-5],Sheet4!C[-7]:C[-2],5,FALSE) -> 8
A324: =R[-22]C+60 -> 1181 | B324: =VLOOKUP(RC[1],Sheet4!C[-1]:C[2],2,FALSE)&VLOOKUP(RC[1],Sheet4!C[-1]:C[2],3,FALSE)&RC[2]&VLOOKUP(RC[1],Sheet4!C[-1]:C[2],4,FALSE)&"（%s/"&RC[2]&"）" -> 进行召唤5次（%s/5） | C324: =R[-22]C -> 8 | D324: =R[-22]C -> 5 | E324: 0 | F324: =R[-22]C -> 19006 | G324: =R[-22]C -> 80 | H324: =VLOOKUP(RC[-5],Sheet4!C[-7]:C[-2],5,FALSE) -> 9
A325: =R[-22]C+60 -> 1182 | B325: =VLOOKUP(RC[1],Sheet4!C[-1]:C[2],2,FALSE)&VLOOKUP(RC[1],Sheet4!C[-1]:C[2],3,FALSE)&RC[2]&VLOOKUP(RC[1],Sheet4!C[-1]:C[2],4,FALSE)&"（%s/"&RC[2]&"）" -> 进行高级召唤2次（%s/2） | C325: =R[-22]C -> 9 | D325: =R[-22]C -> 2 | E325: 0 | F325: =R[-22]C -> 19006 | G325: =R[-22]C -> 100 | H325: =VLOOKUP(RC[-5],Sheet4!C[-7]:C[-2],5,FALSE) -> 9
A326: =R[-22]C+60 -> 1183 | B326: =VLOOKUP(RC[1],Sheet4!C[-1]:C[2],2,FALSE)&VLOOKUP(RC[1],Sheet4!C[-1]:C[2],3,FALSE)&RC[2]&VLOOKUP(RC[1],Sheet4!C[-1]:C[2],4,FALSE)&"（%s/"&RC[2]&"）" -> 购买体力2次（%s/2） | C326: =R[-22]C -> 6 | D326: =R[-22]C -> 2 | E326: 0 | F326: =R[-22]C -> 19005 | G326: =R[-22]C -> 50 | H326: =VLOOKUP(RC[-5],Sheet4!C[-7]:C[-2],5,FALSE) -> 12
A327: =R[-22]C+60 -> 1184 | B327: =VLOOKUP(RC[1],Sheet4!C[-1]:C[2],2,FALSE)&VLOOKUP(RC[1],Sheet4!C[-1]:C[2],3,FALSE)&RC[2]&VLOOKUP(RC[1],Sheet4!C[-1]:C[2],4,FALSE)&"（%s/"&RC[2]&"）" -> 购买精力2次（%s/2） | C327: =R[-22]C -> 7 | D327: =R[-22]C -> 2 | E327: 0 | F327: =R[-22]C -> 19005 | G327: =R[-22]C -> 50 | H327: =VLOOKUP(RC[-5],Sheet4!C[-7]:C[-2],5,FALSE) -> 12
A328: =R[-22]C+60 -> 1191 | B328: =VLOOKUP(RC[1],Sheet4!C[-1]:C[2],2,FALSE)&VLOOKUP(RC[1],Sheet4!C[-1]:C[2],3,FALSE)&RC[2]&VLOOKUP(RC[1],Sheet4!C[-1]:C[2],4,FALSE)&"（%s/"&RC[2]&"）" -> 进入勇者试练战斗10次（%s/10） | C328: =R[-22]C -> 12 | D328: =R[-22]C -> 10 | E328: 0 | F328: =R[-22]C -> 19012 | G328: =R[-22]C -> 500 | H328: =VLOOKUP(RC[-5],Sheet4!C[-7]:C[-2],5,FALSE) -> 17
A329: =R[-22]C+60 -> 1192 | B329: =VLOOKUP(RC[1],Sheet4!C[-1]:C[2],2,FALSE)&VLOOKUP(RC[1],Sheet4!C[-1]:C[2],3,FALSE)&RC[2]&VLOOKUP(RC[1],Sheet4!C[-1]:C[2],4,FALSE)&"（%s/"&RC[2]&"）" -> 竞技场战斗5次（%s/5） | C329: =R[-22]C -> 10 | D329: =R[-22]C -> 5 | E329: 0 | F329: =R[-22]C -> 19013 | G329: =R[-22]C -> 500 | H329: =VLOOKUP(RC[-5],Sheet4!C[-7]:C[-2],5,FALSE) -> 21
A330: =R[-22]C+60 -> 1193 | B330: =VLOOKUP(RC[1],Sheet4!C[-1]:C[2],2,FALSE)&VLOOKUP(RC[1],Sheet4!C[-1]:C[2],3,FALSE)&RC[2]&VLOOKUP(RC[1],Sheet4!C[-1]:C[2],4,FALSE)&"（%s/"&RC[2]&"）" -> 主线副本挑战5次（%s/5） | C330: =R[-22]C -> 1 | D330: =R[-22]C -> 5 | E330: 0 | F330: =R[-22]C -> 19003 | G330: =R[-22]C -> 30000 | H330: =VLOOKUP(RC[-5],Sheet4!C[-7]:C[-2],5,FALSE) -> 26
A331: =R[-22]C+60 -> 1194 | B331: =VLOOKUP(RC[1],Sheet4!C[-1]:C[2],2,FALSE)&VLOOKUP(RC[1],Sheet4!C[-1]:C[2],3,FALSE)&RC[2]&VLOOKUP(RC[1],Sheet4!C[-1]:C[2],4,FALSE)&"（%s/"&RC[2]&"）" -> 日常副本战斗4次（%s/4） | C331: =R[-22]C -> 13 | D331: =R[-22]C -> 4 | E331: 0 | F331: =R[-22]C -> 19005 | G331: =R[-22]C -> 50 | H331: =VLOOKUP(RC[-5],Sheet4!C[-7]:C[-2],5,FALSE) -> 2
A332: =R[-22]C+60 -> 1201 | B332: =VLOOKUP(RC[1],Sheet4!C[-1]:C[2],2,FALSE)&VLOOKUP(RC[1],Sheet4!C[-1]:C[2],3,FALSE)&RC[2]&VLOOKUP(RC[1],Sheet4!C[-1]:C[2],4,FALSE)&"（%s/"&RC[2]&"）" -> 赠送好友精力3次（%s/3） | C332: =R[-22]C -> 4 | D332: =R[-22]C -> 3 | E332: 0 | F332: =R[-22]C -> 19005 | G332: =R[-22]C -> 50 | H332: =VLOOKUP(RC[-5],Sheet4!C[-7]:C[-2],5,FALSE) -> 15
A333: =R[-22]C+60 -> 1202 | B333: =VLOOKUP(RC[1],Sheet4!C[-1]:C[2],2,FALSE)&VLOOKUP(RC[1],Sheet4!C[-1]:C[2],3,FALSE)&RC[2]&VLOOKUP(RC[1],Sheet4!C[-1]:C[2],4,FALSE)&"（%s/"&RC[2]&"）" -> 英雄培养15次（%s/15） | C333: =R[-22]C -> 3 | D333: =R[-22]C -> 15 | E333: 0 | F333: =R[-22]C -> 10003 | G333: =R[-22]C -> 30 | H333: =VLOOKUP(RC[-5],Sheet4!C[-7]:C[-2],5,FALSE) -> 8
A334: =R[-22]C+60 -> 1203 | B334: =VLOOKUP(RC[1],Sheet4!C[-1]:C[2],2,FALSE)&VLOOKUP(RC[1],Sheet4!C[-1]:C[2],3,FALSE)&RC[2]&VLOOKUP(RC[1],Sheet4!C[-1]:C[2],4,FALSE)&"（%s/"&RC[2]&"）" -> 英雄商店购买1次（%s/1） | C334: =R[-22]C -> 5 | D334: =R[-22]C -> 1 | E334: 0 | F334: =R[-22]C -> 19006 | G334: =R[-22]C -> 80 | H334: =VLOOKUP(RC[-5],Sheet4!C[-7]:C[-2],5,FALSE) -> 11
A335: =R[-22]C+60 -> 1204 | B335: =VLOOKUP(RC[1],Sheet4!C[-1]:C[2],2,FALSE)&VLOOKUP(RC[1],Sheet4!C[-1]:C[2],3,FALSE)&RC[2]&VLOOKUP(RC[1],Sheet4!C[-1]:C[2],4,FALSE)&"（%s/"&RC[2]&"）" -> 遗迹探索4小时（%s/4） | C335: =R[-22]C -> 19 | D335: =R[-22]C -> 4 | E335: 0 | F335: =R[-22]C -> 19005 | G335: =R[-22]C -> 50 | H335: =VLOOKUP(RC[-5],Sheet4!C[-7]:C[-2],5,FALSE) -> 20
A336: =R[-22]C+60 -> 1211 | B336: =VLOOKUP(RC[1],Sheet4!C[-1]:C[2],2,FALSE)&VLOOKUP(RC[1],Sheet4!C[-1]:C[2],3,FALSE)&RC[2]&VLOOKUP(RC[1],Sheet4!C[-1]:C[2],4,FALSE)&"（%s/"&RC[2]&"）" -> 精英副本战斗1次（%s/1） | C336: =R[-22]C -> 15 | D336: =R[-22]C -> 1 | E336: 0 | F336: =R[-22]C -> 10008 | G336: =R[-22]C -> 30 | H336: =VLOOKUP(RC[-5],Sheet4!C[-7]:C[-2],5,FALSE) -> 28
A337: =R[-22]C+60 -> 1212 | B337: =VLOOKUP(RC[1],Sheet4!C[-1]:C[2],2,FALSE)&VLOOKUP(RC[1],Sheet4!C[-1]:C[2],3,FALSE)&RC[2]&VLOOKUP(RC[1],Sheet4!C[-1]:C[2],4,FALSE)&"（%s/"&RC[2]&"）" -> 异度入侵分享2次（%s/2） | C337: =R[-22]C -> 17 | D337: =R[-22]C -> 2 | E337: 0 | F337: =R[-22]C -> 19014 | G337: =R[-22]C -> 500 | H337: =VLOOKUP(RC[-5],Sheet4!C[-7]:C[-2],5,FALSE) -> 16
A338: =R[-22]C+60 -> 1213 | B338: =VLOOKUP(RC[1],Sheet4!C[-1]:C[2],2,FALSE)&VLOOKUP(RC[1],Sheet4!C[-1]:C[2],3,FALSE)&RC[2]&VLOOKUP(RC[1],Sheet4!C[-1]:C[2],4,FALSE)&"（%s/"&RC[2]&"）" -> 讨伐异度入侵者2次（%s/2） | C338: =R[-22]C -> 18 | D338: =R[-22]C -> 2 | E338: 0 | F338: =R[-22]C -> 19014 | G338: =R[-22]C -> 500 | H338: =VLOOKUP(RC[-5],Sheet4!C[-7]:C[-2],5,FALSE) -> 16
A339: =R[-22]C+60 -> 1214 | B339: =VLOOKUP(RC[1],Sheet4!C[-1]:C[2],2,FALSE)&VLOOKUP(RC[1],Sheet4!C[-1]:C[2],3,FALSE)&RC[2]&VLOOKUP(RC[1],Sheet4!C[-1]:C[2],4,FALSE)&"（%s/"&RC[2]&"）" -> 无尽深渊战斗1次（%s/1） | C339: =R[-22]C -> 23 | D339: =R[-22]C -> 1 | E339: 0 | F339: =R[-22]C -> 19028 | G339: =R[-22]C -> 50 | H339: =VLOOKUP(RC[-5],Sheet4!C[-7]:C[-2],5,FALSE) -> 88
A340: =R[-22]C+60 -> 1221 | B340: =VLOOKUP(RC[1],Sheet4!C[-1]:C[2],2,FALSE)&VLOOKUP(RC[1],Sheet4!C[-1]:C[2],3,FALSE)&RC[2]&VLOOKUP(RC[1],Sheet4!C[-1]:C[2],4,FALSE)&"（%s/"&RC[2]&"）" -> 击杀遗迹破坏者3次（%s/3） | C340: =R[-22]C -> 16 | D340: =R[-22]C -> 3 | E340: 0 | F340: =R[-22]C -> 19005 | G340: =R[-22]C -> 50 | H340: =VLOOKUP(RC[-5],Sheet4!C[-7]:C[-2],5,FALSE) -> 20
A341: =R[-22]C+60 -> 1222 | B341: =VLOOKUP(RC[1],Sheet4!C[-1]:C[2],2,FALSE)&VLOOKUP(RC[1],Sheet4!C[-1]:C[2],3,FALSE)&RC[2]&VLOOKUP(RC[1],Sheet4!C[-1]:C[2],4,FALSE)&"（%s/"&RC[2]&"）" -> 占卜翻牌5次（%s/5） | C341: =R[-22]C -> 25 | D341: =R[-22]C -> 5 | E341: 0 | F341: =R[-22]C -> 10096 | G341: =R[-22]C -> 1 | H341: =VLOOKUP(RC[-5],Sheet4!C[-7]:C[-2],5,FALSE) -> 113
A342: =R[-22]C+60 -> 1223 | B342: =VLOOKUP(RC[1],Sheet4!C[-1]:C[2],2,FALSE)&VLOOKUP(RC[1],Sheet4!C[-1]:C[2],3,FALSE)&RC[2]&VLOOKUP(RC[1],Sheet4!C[-1]:C[2],4,FALSE)&"（%s/"&RC[2]&"）" -> 英雄副本战斗1次（%s/1） | C342: =R[-22]C -> 14 | D342: =R[-22]C -> 1 | E342: 0 | F342: =R[-22]C -> 19006 | G342: =R[-22]C -> 80 | H342: =VLOOKUP(RC[-5],Sheet4!C[-7]:C[-2],5,FALSE) -> 27
A343: =R[-22]C+60 -> 1231 | B343: =VLOOKUP(RC[1],Sheet4!C[-1]:C[2],2,FALSE)&VLOOKUP(RC[1],Sheet4!C[-1]:C[2],3,FALSE)&RC[2]&VLOOKUP(RC[1],Sheet4!C[-1]:C[2],4,FALSE)&"（%s/"&RC[2]&"）" -> 圣器争夺5次（%s/5） | C343: =R[-22]C -> 11 | D343: =R[-22]C -> 5 | E343: 0 | F343: =R[-22]C -> 13049 | G343: =R[-22]C -> 5 | H343: =VLOOKUP(RC[-5],Sheet4!C[-7]:C[-2],5,FALSE) -> 19
A344: =R[-22]C+60 -> 1232 | B344: =VLOOKUP(RC[1],Sheet4!C[-1]:C[2],2,FALSE)&VLOOKUP(RC[1],Sheet4!C[-1]:C[2],3,FALSE)&RC[2]&VLOOKUP(RC[1],Sheet4!C[-1]:C[2],4,FALSE)&"（%s/"&RC[2]&"）" -> 圣器合成3次（%s/3） | C344: =R[-22]C -> 22 | D344: =R[-22]C -> 3 | E344: 0 | F344: =R[-22]C -> 13049 | G344: =R[-22]C -> 5 | H344: =VLOOKUP(RC[-5],Sheet4!C[-7]:C[-2],5,FALSE) -> 19
A345: =R[-22]C+60 -> 1233 | B345: =VLOOKUP(RC[1],Sheet4!C[-1]:C[2],2,FALSE)&VLOOKUP(RC[1],Sheet4!C[-1]:C[2],3,FALSE)&RC[2]&VLOOKUP(RC[1],Sheet4!C[-1]:C[2],4,FALSE)&"（%s/"&RC[2]&"）" -> 圣器强化5次（%s/5） | C345: =R[-22]C -> 2 | D345: =R[-22]C -> 5 | E345: 0 | F345: =R[-22]C -> 13049 | G345: =R[-22]C -> 5 | H345: =VLOOKUP(RC[-5],Sheet4!C[-7]:C[-2],5,FALSE) -> 8
A346: =R[-22]C+60 -> 1241 | B346: =VLOOKUP(RC[1],Sheet4!C[-1]:C[2],2,FALSE)&VLOOKUP(RC[1],Sheet4!C[-1]:C[2],3,FALSE)&RC[2]&VLOOKUP(RC[1],Sheet4!C[-1]:C[2],4,FALSE)&"（%s/"&RC[2]&"）" -> 进行召唤5次（%s/5） | C346: =R[-22]C -> 8 | D346: =R[-22]C -> 5 | E346: 0 | F346: =R[-22]C -> 19006 | G346: =R[-22]C -> 80 | H346: =VLOOKUP(RC[-5],Sheet4!C[-7]:C[-2],5,FALSE) -> 9
A347: =R[-22]C+60 -> 1242 | B347: =VLOOKUP(RC[1],Sheet4!C[-1]:C[2],2,FALSE)&VLOOKUP(RC[1],Sheet4!C[-1]:C[2],3,FALSE)&RC[2]&VLOOKUP(RC[1],Sheet4!C[-1]:C[2],4,FALSE)&"（%s/"&RC[2]&"）" -> 进行高级召唤2次（%s/2） | C347: =R[-22]C -> 9 | D347: =R[-22]C -> 2 | E347: 0 | F347: =R[-22]C -> 19006 | G347: =R[-22]C -> 100 | H347: =VLOOKUP(RC[-5],Sheet4!C[-7]:C[-2],5,FALSE) -> 9
A348: =R[-22]C+60 -> 1243 | B348: =VLOOKUP(RC[1],Sheet4!C[-1]:C[2],2,FALSE)&VLOOKUP(RC[1],Sheet4!C[-1]:C[2],3,FALSE)&RC[2]&VLOOKUP(RC[1],Sheet4!C[-1]:C[2],4,FALSE)&"（%s/"&RC[2]&"）" -> 购买体力2次（%s/2） | C348: =R[-22]C -> 6 | D348: =R[-22]C -> 2 | E348: 0 | F348: =R[-22]C -> 19005 | G348: =R[-22]C -> 50 | H348: =VLOOKUP(RC[-5],Sheet4!C[-7]:C[-2],5,FALSE) -> 12
A349: =R[-22]C+60 -> 1244 | B349: =VLOOKUP(RC[1],Sheet4!C[-1]:C[2],2,FALSE)&VLOOKUP(RC[1],Sheet4!C[-1]:C[2],3,FALSE)&RC[2]&VLOOKUP(RC[1],Sheet4!C[-1]:C[2],4,FALSE)&"（%s/"&RC[2]&"）" -> 购买精力2次（%s/2） | C349: =R[-22]C -> 7 | D349: =R[-22]C -> 2 | E349: 0 | F349: =R[-22]C -> 19005 | G349: =R[-22]C -> 50 | H349: =VLOOKUP(RC[-5],Sheet4!C[-7]:C[-2],5,FALSE) -> 12
A350: =R[-22]C+60 -> 1251 | B350: =VLOOKUP(RC[1],Sheet4!C[-1]:C[2],2,FALSE)&VLOOKUP(RC[1],Sheet4!C[-1]:C[2],3,FALSE)&RC[2]&VLOOKUP(RC[1],Sheet4!C[-1]:C[2],4,FALSE)&"（%s/"&RC[2]&"）" -> 进入勇者试练战斗10次（%s/10） | C350: =R[-22]C -> 12 | D350: =R[-22]C -> 10 | E350: 0 | F350: =R[-22]C -> 19012 | G350: =R[-22]C -> 500 | H350: =VLOOKUP(RC[-5],Sheet4!C[-7]:C[-2],5,FALSE) -> 17
A351: =R[-22]C+60 -> 1252 | B351: =VLOOKUP(RC[1],Sheet4!C[-1]:C[2],2,FALSE)&VLOOKUP(RC[1],Sheet4!C[-1]:C[2],3,FALSE)&RC[2]&VLOOKUP(RC[1],Sheet4!C[-1]:C[2],4,FALSE)&"（%s/"&RC[2]&"）" -> 竞技场战斗5次（%s/5） | C351: =R[-22]C -> 10 | D351: =R[-22]C -> 5 | E351: 0 | F351: =R[-22]C -> 19013 | G351: =R[-22]C -> 500 | H351: =VLOOKUP(RC[-5],Sheet4!C[-7]:C[-2],5,FALSE) -> 21
A352: =R[-22]C+60 -> 1253 | B352: =VLOOKUP(RC[1],Sheet4!C[-1]:C[2],2,FALSE)&VLOOKUP(RC[1],Sheet4!C[-1]:C[2],3,FALSE)&RC[2]&VLOOKUP(RC[1],Sheet4!C[-1]:C[2],4,FALSE)&"（%s/"&RC[2]&"）" -> 主线副本挑战5次（%s/5） | C352: =R[-22]C -> 1 | D352: =R[-22]C -> 5 | E352: 0 | F352: =R[-22]C -> 19003 | G352: =R[-22]C -> 30000 | H352: =VLOOKUP(RC[-5],Sheet4!C[-7]:C[-2],5,FALSE) -> 26
A353: =R[-22]C+60 -> 1254 | B353: =VLOOKUP(RC[1],Sheet4!C[-1]:C[2],2,FALSE)&VLOOKUP(RC[1],Sheet4!C[-1]:C[2],3,FALSE)&RC[2]&VLOOKUP(RC[1],Sheet4!C[-1]:C[2],4,FALSE)&"（%s/"&RC[2]&"）" -> 日常副本战斗4次（%s/4） | C353: =R[-22]C -> 13 | D353: =R[-22]C -> 4 | E353: 0 | F353: =R[-22]C -> 19005 | G353: =R[-22]C -> 50 | H353: =VLOOKUP(RC[-5],Sheet4!C[-7]:C[-2],5,FALSE) -> 2
A354: =R[-22]C+60 -> 1261 | B354: =VLOOKUP(RC[1],Sheet4!C[-1]:C[2],2,FALSE)&VLOOKUP(RC[1],Sheet4!C[-1]:C[2],3,FALSE)&RC[2]&VLOOKUP(RC[1],Sheet4!C[-1]:C[2],4,FALSE)&"（%s/"&RC[2]&"）" -> 赠送好友精力3次（%s/3） | C354: =R[-22]C -> 4 | D354: =R[-22]C -> 3 | E354: 0 | F354: =R[-22]C -> 19005 | G354: =R[-22]C -> 50 | H354: =VLOOKUP(RC[-5],Sheet4!C[-7]:C[-2],5,FALSE) -> 15
A355: =R[-22]C+60 -> 1262 | B355: =VLOOKUP(RC[1],Sheet4!C[-1]:C[2],2,FALSE)&VLOOKUP(RC[1],Sheet4!C[-1]:C[2],3,FALSE)&RC[2]&VLOOKUP(RC[1],Sheet4!C[-1]:C[2],4,FALSE)&"（%s/"&RC[2]&"）" -> 英雄培养15次（%s/15） | C355: =R[-22]C -> 3 | D355: =R[-22]C -> 15 | E355: 0 | F355: =R[-22]C -> 10003 | G355: =R[-22]C -> 30 | H355: =VLOOKUP(RC[-5],Sheet4!C[-7]:C[-2],5,FALSE) -> 8
A356: =R[-22]C+60 -> 1263 | B356: =VLOOKUP(RC[1],Sheet4!C[-1]:C[2],2,FALSE)&VLOOKUP(RC[1],Sheet4!C[-1]:C[2],3,FALSE)&RC[2]&VLOOKUP(RC[1],Sheet4!C[-1]:C[2],4,FALSE)&"（%s/"&RC[2]&"）" -> 英雄商店购买1次（%s/1） | C356: =R[-22]C -> 5 | D356: =R[-22]C -> 1 | E356: 0 | F356: =R[-22]C -> 19006 | G356: =R[-22]C -> 80 | H356: =VLOOKUP(RC[-5],Sheet4!C[-7]:C[-2],5,FALSE) -> 11
A357: =R[-22]C+60 -> 1264 | B357: =VLOOKUP(RC[1],Sheet4!C[-1]:C[2],2,FALSE)&VLOOKUP(RC[1],Sheet4!C[-1]:C[2],3,FALSE)&RC[2]&VLOOKUP(RC[1],Sheet4!C[-1]:C[2],4,FALSE)&"（%s/"&RC[2]&"）" -> 遗迹探索4小时（%s/4） | C357: =R[-22]C -> 19 | D357: =R[-22]C -> 4 | E357: 0 | F357: =R[-22]C -> 19005 | G357: =R[-22]C -> 50 | H357: =VLOOKUP(RC[-5],Sheet4!C[-7]:C[-2],5,FALSE) -> 20
A358: =R[-22]C+60 -> 1271 | B358: =VLOOKUP(RC[1],Sheet4!C[-1]:C[2],2,FALSE)&VLOOKUP(RC[1],Sheet4!C[-1]:C[2],3,FALSE)&RC[2]&VLOOKUP(RC[1],Sheet4!C[-1]:C[2],4,FALSE)&"（%s/"&RC[2]&"）" -> 精英副本战斗1次（%s/1） | C358: =R[-22]C -> 15 | D358: =R[-22]C -> 1 | E358: 0 | F358: =R[-22]C -> 10008 | G358: =R[-22]C -> 30 | H358: =VLOOKUP(RC[-5],Sheet4!C[-7]:C[-2],5,FALSE) -> 28
A359: =R[-22]C+60 -> 1272 | B359: =VLOOKUP(RC[1],Sheet4!C[-1]:C[2],2,FALSE)&VLOOKUP(RC[1],Sheet4!C[-1]:C[2],3,FALSE)&RC[2]&VLOOKUP(RC[1],Sheet4!C[-1]:C[2],4,FALSE)&"（%s/"&RC[2]&"）" -> 异度入侵分享2次（%s/2） | C359: =R[-22]C -> 17 | D359: =R[-22]C -> 2 | E359: 0 | F359: =R[-22]C -> 19014 | G359: =R[-22]C -> 500 | H359: =VLOOKUP(RC[-5],Sheet4!C[-7]:C[-2],5,FALSE) -> 16
A360: =R[-22]C+60 -> 1273 | B360: =VLOOKUP(RC[1],Sheet4!C[-1]:C[2],2,FALSE)&VLOOKUP(RC[1],Sheet4!C[-1]:C[2],3,FALSE)&RC[2]&VLOOKUP(RC[1],Sheet4!C[-1]:C[2],4,FALSE)&"（%s/"&RC[2]&"）" -> 讨伐异度入侵者2次（%s/2） | C360: =R[-22]C -> 18 | D360: =R[-22]C -> 2 | E360: 0 | F360: =R[-22]C -> 19014 | G360: =R[-22]C -> 500 | H360: =VLOOKUP(RC[-5],Sheet4!C[-7]:C[-2],5,FALSE) -> 16
A361: =R[-22]C+60 -> 1274 | B361: =VLOOKUP(RC[1],Sheet4!C[-1]:C[2],2,FALSE)&VLOOKUP(RC[1],Sheet4!C[-1]:C[2],3,FALSE)&RC[2]&VLOOKUP(RC[1],Sheet4!C[-1]:C[2],4,FALSE)&"（%s/"&RC[2]&"）" -> 无尽深渊战斗1次（%s/1） | C361: =R[-22]C -> 23 | D361: =R[-22]C -> 1 | E361: 0 | F361: =R[-22]C -> 19028 | G361: =R[-22]C -> 50 | H361: =VLOOKUP(RC[-5],Sheet4!C[-7]:C[-2],5,FALSE) -> 88
A362: =R[-22]C+60 -> 1281 | B362: =VLOOKUP(RC[1],Sheet4!C[-1]:C[2],2,FALSE)&VLOOKUP(RC[1],Sheet4!C[-1]:C[2],3,FALSE)&RC[2]&VLOOKUP(RC[1],Sheet4!C[-1]:C[2],4,FALSE)&"（%s/"&RC[2]&"）" -> 击杀遗迹破坏者3次（%s/3） | C362: =R[-22]C -> 16 | D362: =R[-22]C -> 3 | E362: 0 | F362: =R[-22]C -> 19005 | G362: =R[-22]C -> 50 | H362: =VLOOKUP(RC[-5],Sheet4!C[-7]:C[-2],5,FALSE) -> 20
A363: =R[-22]C+60 -> 1282 | B363: =VLOOKUP(RC[1],Sheet4!C[-1]:C[2],2,FALSE)&VLOOKUP(RC[1],Sheet4!C[-1]:C[2],3,FALSE)&RC[2]&VLOOKUP(RC[1],Sheet4!C[-1]:C[2],4,FALSE)&"（%s/"&RC[2]&"）" -> 占卜翻牌5次（%s/5） | C363: =R[-22]C -> 25 | D363: =R[-22]C -> 5 | E363: 0 | F363: =R[-22]C -> 10096 | G363: =R[-22]C -> 1 | H363: =VLOOKUP(RC[-5],Sheet4!C[-7]:C[-2],5,FALSE) -> 113
A364: =R[-22]C+60 -> 1283 | B364: =VLOOKUP(RC[1],Sheet4!C[-1]:C[2],2,FALSE)&VLOOKUP(RC[1],Sheet4!C[-1]:C[2],3,FALSE)&RC[2]&VLOOKUP(RC[1],Sheet4!C[-1]:C[2],4,FALSE)&"（%s/"&RC[2]&"）" -> 英雄副本战斗1次（%s/1） | C364: =R[-22]C -> 14 | D364: =R[-22]C -> 1 | E364: 0 | F364: =R[-22]C -> 19006 | G364: =R[-22]C -> 80 | H364: =VLOOKUP(RC[-5],Sheet4!C[-7]:C[-2],5,FALSE) -> 27
A365: =R[-22]C+60 -> 1291 | B365: =VLOOKUP(RC[1],Sheet4!C[-1]:C[2],2,FALSE)&VLOOKUP(RC[1],Sheet4!C[-1]:C[2],3,FALSE)&RC[2]&VLOOKUP(RC[1],Sheet4!C[-1]:C[2],4,FALSE)&"（%s/"&RC[2]&"）" -> 圣器争夺5次（%s/5） | C365: =R[-22]C -> 11 | D365: =R[-22]C -> 5 | E365: 0 | F365: =R[-22]C -> 13049 | G365: =R[-22]C -> 5 | H365: =VLOOKUP(RC[-5],Sheet4!C[-7]:C[-2],5,FALSE) -> 19
A366: =R[-22]C+60 -> 1292 | B366: =VLOOKUP(RC[1],Sheet4!C[-1]:C[2],2,FALSE)&VLOOKUP(RC[1],Sheet4!C[-1]:C[2],3,FALSE)&RC[2]&VLOOKUP(RC[1],Sheet4!C[-1]:C[2],4,FALSE)&"（%s/"&RC[2]&"）" -> 圣器合成3次（%s/3） | C366: =R[-22]C -> 22 | D366: =R[-22]C -> 3 | E366: 0 | F366: =R[-22]C -> 13049 | G366: =R[-22]C -> 5 | H366: =VLOOKUP(RC[-5],Sheet4!C[-7]:C[-2],5,FALSE) -> 19
A367: =R[-22]C+60 -> 1293 | B367: =VLOOKUP(RC[1],Sheet4!C[-1]:C[2],2,FALSE)&VLOOKUP(RC[1],Sheet4!C[-1]:C[2],3,FALSE)&RC[2]&VLOOKUP(RC[1],Sheet4!C[-1]:C[2],4,FALSE)&"（%s/"&RC[2]&"）" -> 圣器强化5次（%s/5） | C367: =R[-22]C -> 2 | D367: =R[-22]C -> 5 | E367: 0 | F367: =R[-22]C -> 13049 | G367: =R[-22]C -> 5 | H367: =VLOOKUP(RC[-5],Sheet4!C[-7]:C[-2],5,FALSE) -> 8
A368: =R[-22]C+60 -> 1301 | B368: =VLOOKUP(RC[1],Sheet4!C[-1]:C[2],2,FALSE)&VLOOKUP(RC[1],Sheet4!C[-1]:C[2],3,FALSE)&RC[2]&VLOOKUP(RC[1],Sheet4!C[-1]:C[2],4,FALSE)&"（%s/"&RC[2]&"）" -> 进行召唤5次（%s/5） | C368: =R[-22]C -> 8 | D368: =R[-22]C -> 5 | E368: 0 | F368: =R[-22]C -> 19006 | G368: =R[-22]C -> 80 | H368: =VLOOKUP(RC[-5],Sheet4!C[-7]:C[-2],5,FALSE) -> 9
A369: =R[-22]C+60 -> 1302 | B369: =VLOOKUP(RC[1],Sheet4!C[-1]:C[2],2,FALSE)&VLOOKUP(RC[1],Sheet4!C[-1]:C[2],3,FALSE)&RC[2]&VLOOKUP(RC[1],Sheet4!C[-1]:C[2],4,FALSE)&"（%s/"&RC[2]&"）" -> 进行高级召唤2次（%s/2） | C369: =R[-22]C -> 9 | D369: =R[-22]C -> 2 | E369: 0 | F369: =R[-22]C -> 19006 | G369: =R[-22]C -> 100 | H369: =VLOOKUP(RC[-5],Sheet4!C[-7]:C[-2],5,FALSE) -> 9
A370: =R[-22]C+60 -> 1303 | B370: =VLOOKUP(RC[1],Sheet4!C[-1]:C[2],2,FALSE)&VLOOKUP(RC[1],Sheet4!C[-1]:C[2],3,FALSE)&RC[2]&VLOOKUP(RC[1],Sheet4!C[-1]:C[2],4,FALSE)&"（%s/"&RC[2]&"）" -> 购买体力2次（%s/2） | C370: =R[-22]C -> 6 | D370: =R[-22]C -> 2 | E370: 0 | F370: =R[-22]C -> 19005 | G370: =R[-22]C -> 50 | H370: =VLOOKUP(RC[-5],Sheet4!C[-7]:C[-2],5,FALSE) -> 12
A371: =R[-22]C+60 -> 1304 | B371: =VLOOKUP(RC[1],Sheet4!C[-1]:C[2],2,FALSE)&VLOOKUP(RC[1],Sheet4!C[-1]:C[2],3,FALSE)&RC[2]&VLOOKUP(RC[1],Sheet4!C[-1]:C[2],4,FALSE)&"（%s/"&RC[2]&"）" -> 购买精力2次（%s/2） | C371: =R[-22]C -> 7 | D371: =R[-22]C -> 2 | E371: 0 | F371: =R[-22]C -> 19005 | G371: =R[-22]C -> 50 | H371: =VLOOKUP(RC[-5],Sheet4!C[-7]:C[-2],5,FALSE) -> 12
A372: =R[-22]C+60 -> 1311 | B372: =VLOOKUP(RC[1],Sheet4!C[-1]:C[2],2,FALSE)&VLOOKUP(RC[1],Sheet4!C[-1]:C[2],3,FALSE)&RC[2]&VLOOKUP(RC[1],Sheet4!C[-1]:C[2],4,FALSE)&"（%s/"&RC[2]&"）" -> 进入勇者试练战斗10次（%s/10） | C372: =R[-22]C -> 12 | D372: =R[-22]C -> 10 | E372: 0 | F372: =R[-22]C -> 19012 | G372: =R[-22]C -> 500 | H372: =VLOOKUP(RC[-5],Sheet4!C[-7]:C[-2],5,FALSE) -> 17
A373: =R[-22]C+60 -> 1312 | B373: =VLOOKUP(RC[1],Sheet4!C[-1]:C[2],2,FALSE)&VLOOKUP(RC[1],Sheet4!C[-1]:C[2],3,FALSE)&RC[2]&VLOOKUP(RC[1],Sheet4!C[-1]:C[2],4,FALSE)&"（%s/"&RC[2]&"）" -> 竞技场战斗5次（%s/5） | C373: =R[-22]C -> 10 | D373: =R[-22]C -> 5 | E373: 0 | F373: =R[-22]C -> 19013 | G373: =R[-22]C -> 500 | H373: =VLOOKUP(RC[-5],Sheet4!C[-7]:C[-2],5,FALSE) -> 21
A374: =R[-22]C+60 -> 1313 | B374: =VLOOKUP(RC[1],Sheet4!C[-1]:C[2],2,FALSE)&VLOOKUP(RC[1],Sheet4!C[-1]:C[2],3,FALSE)&RC[2]&VLOOKUP(RC[1],Sheet4!C[-1]:C[2],4,FALSE)&"（%s/"&RC[2]&"）" -> 主线副本挑战5次（%s/5） | C374: =R[-22]C -> 1 | D374: =R[-22]C -> 5 | E374: 0 | F374: =R[-22]C -> 19003 | G374: =R[-22]C -> 30000 | H374: =VLOOKUP(RC[-5],Sheet4!C[-7]:C[-2],5,FALSE) -> 26
A375: =R[-22]C+60 -> 1314 | B375: =VLOOKUP(RC[1],Sheet4!C[-1]:C[2],2,FALSE)&VLOOKUP(RC[1],Sheet4!C[-1]:C[2],3,FALSE)&RC[2]&VLOOKUP(RC[1],Sheet4!C[-1]:C[2],4,FALSE)&"（%s/"&RC[2]&"）" -> 日常副本战斗4次（%s/4） | C375: =R[-22]C -> 13 | D375: =R[-22]C -> 4 | E375: 0 | F375: =R[-22]C -> 19005 | G375: =R[-22]C -> 50 | H375: =VLOOKUP(RC[-5],Sheet4!C[-7]:C[-2],5,FALSE) -> 2
A376: =R[-22]C+60 -> 1321 | B376: =VLOOKUP(RC[1],Sheet4!C[-1]:C[2],2,FALSE)&VLOOKUP(RC[1],Sheet4!C[-1]:C[2],3,FALSE)&RC[2]&VLOOKUP(RC[1],Sheet4!C[-1]:C[2],4,FALSE)&"（%s/"&RC[2]&"）" -> 赠送好友精力3次（%s/3） | C376: =R[-22]C -> 4 | D376: =R[-22]C -> 3 | E376: 0 | F376: =R[-22]C -> 19005 | G376: =R[-22]C -> 50 | H376: =VLOOKUP(RC[-5],Sheet4!C[-7]:C[-2],5,FALSE) -> 15
A377: =R[-22]C+60 -> 1322 | B377: =VLOOKUP(RC[1],Sheet4!C[-1]:C[2],2,FALSE)&VLOOKUP(RC[1],Sheet4!C[-1]:C[2],3,FALSE)&RC[2]&VLOOKUP(RC[1],Sheet4!C[-1]:C[2],4,FALSE)&"（%s/"&RC[2]&"）" -> 英雄培养15次（%s/15） | C377: =R[-22]C -> 3 | D377: =R[-22]C -> 15 | E377: 0 | F377: =R[-22]C -> 10003 | G377: =R[-22]C -> 30 | H377: =VLOOKUP(RC[-5],Sheet4!C[-7]:C[-2],5,FALSE) -> 8
A378: =R[-22]C+60 -> 1323 | B378: =VLOOKUP(RC[1],Sheet4!C[-1]:C[2],2,FALSE)&VLOOKUP(RC[1],Sheet4!C[-1]:C[2],3,FALSE)&RC[2]&VLOOKUP(RC[1],Sheet4!C[-1]:C[2],4,FALSE)&"（%s/"&RC[2]&"）" -> 英雄商店购买1次（%s/1） | C378: =R[-22]C -> 5 | D378: =R[-22]C -> 1 | E378: 0 | F378: =R[-22]C -> 19006 | G378: =R[-22]C -> 80 | H378: =VLOOKUP(RC[-5],Sheet4!C[-7]:C[-2],5,FALSE) -> 11
A379: =R[-22]C+60 -> 1324 | B379: =VLOOKUP(RC[1],Sheet4!C[-1]:C[2],2,FALSE)&VLOOKUP(RC[1],Sheet4!C[-1]:C[2],3,FALSE)&RC[2]&VLOOKUP(RC[1],Sheet4!C[-1]:C[2],4,FALSE)&"（%s/"&RC[2]&"）" -> 遗迹探索4小时（%s/4） | C379: =R[-22]C -> 19 | D379: =R[-22]C -> 4 | E379: 0 | F379: =R[-22]C -> 19005 | G379: =R[-22]C -> 50 | H379: =VLOOKUP(RC[-5],Sheet4!C[-7]:C[-2],5,FALSE) -> 20
A380: =R[-22]C+60 -> 1331 | B380: =VLOOKUP(RC[1],Sheet4!C[-1]:C[2],2,FALSE)&VLOOKUP(RC[1],Sheet4!C[-1]:C[2],3,FALSE)&RC[2]&VLOOKUP(RC[1],Sheet4!C[-1]:C[2],4,FALSE)&"（%s/"&RC[2]&"）" -> 精英副本战斗1次（%s/1） | C380: =R[-22]C -> 15 | D380: =R[-22]C -> 1 | E380: 0 | F380: =R[-22]C -> 10008 | G380: =R[-22]C -> 30 | H380: =VLOOKUP(RC[-5],Sheet4!C[-7]:C[-2],5,FALSE) -> 28
A381: =R[-22]C+60 -> 1332 | B381: =VLOOKUP(RC[1],Sheet4!C[-1]:C[2],2,FALSE)&VLOOKUP(RC[1],Sheet4!C[-1]:C[2],3,FALSE)&RC[2]&VLOOKUP(RC[1],Sheet4!C[-1]:C[2],4,FALSE)&"（%s/"&RC[2]&"）" -> 异度入侵分享2次（%s/2） | C381: =R[-22]C -> 17 | D381: =R[-22]C -> 2 | E381: 0 | F381: =R[-22]C -> 19014 | G381: =R[-22]C -> 500 | H381: =VLOOKUP(RC[-5],Sheet4!C[-7]:C[-2],5,FALSE) -> 16
A382: =R[-22]C+60 -> 1333 | B382: =VLOOKUP(RC[1],Sheet4!C[-1]:C[2],2,FALSE)&VLOOKUP(RC[1],Sheet4!C[-1]:C[2],3,FALSE)&RC[2]&VLOOKUP(RC[1],Sheet4!C[-1]:C[2],4,FALSE)&"（%s/"&RC[2]&"）" -> 讨伐异度入侵者2次（%s/2） | C382: =R[-22]C -> 18 | D382: =R[-22]C -> 2 | E382: 0 | F382: =R[-22]C -> 19014 | G382: =R[-22]C -> 500 | H382: =VLOOKUP(RC[-5],Sheet4!C[-7]:C[-2],5,FALSE) -> 16
A383: =R[-22]C+60 -> 1334 | B383: =VLOOKUP(RC[1],Sheet4!C[-1]:C[2],2,FALSE)&VLOOKUP(RC[1],Sheet4!C[-1]:C[2],3,FALSE)&RC[2]&VLOOKUP(RC[1],Sheet4!C[-1]:C[2],4,FALSE)&"（%s/"&RC[2]&"）" -> 无尽深渊战斗1次（%s/1） | C383: =R[-22]C -> 23 | D383: =R[-22]C -> 1 | E383: 0 | F383: =R[-22]C -> 19028 | G383: =R[-22]C -> 50 | H383: =VLOOKUP(RC[-5],Sheet4!C[-7]:C[-2],5,FALSE) -> 88
A384: =R[-22]C+60 -> 1341 | B384: =VLOOKUP(RC[1],Sheet4!C[-1]:C[2],2,FALSE)&VLOOKUP(RC[1],Sheet4!C[-1]:C[2],3,FALSE)&RC[2]&VLOOKUP(RC[1],Sheet4!C[-1]:C[2],4,FALSE)&"（%s/"&RC[2]&"）" -> 击杀遗迹破坏者3次（%s/3） | C384: =R[-22]C -> 16 | D384: =R[-22]C -> 3 | E384: 0 | F384: =R[-22]C -> 19005 | G384: =R[-22]C -> 50 | H384: =VLOOKUP(RC[-5],Sheet4!C[-7]:C[-2],5,FALSE) -> 20
A385: =R[-22]C+60 -> 1342 | B385: =VLOOKUP(RC[1],Sheet4!C[-1]:C[2],2,FALSE)&VLOOKUP(RC[1],Sheet4!C[-1]:C[2],3,FALSE)&RC[2]&VLOOKUP(RC[1],Sheet4!C[-1]:C[2],4,FALSE)&"（%s/"&RC[2]&"）" -> 占卜翻牌5次（%s/5） | C385: =R[-22]C -> 25 | D385: =R[-22]C -> 5 | E385: 0 | F385: =R[-22]C -> 10096 | G385: =R[-22]C -> 1 | H385: =VLOOKUP(RC[-5],Sheet4!C[-7]:C[-2],5,FALSE) -> 113
A386: =R[-22]C+60 -> 1343 | B386: =VLOOKUP(RC[1],Sheet4!C[-1]:C[2],2,FALSE)&VLOOKUP(RC[1],Sheet4!C[-1]:C[2],3,FALSE)&RC[2]&VLOOKUP(RC[1],Sheet4!C[-1]:C[2],4,FALSE)&"（%s/"&RC[2]&"）" -> 英雄副本战斗1次（%s/1） | C386: =R[-22]C -> 14 | D386: =R[-22]C -> 1 | E386: 0 | F386: =R[-22]C -> 19006 | G386: =R[-22]C -> 80 | H386: =VLOOKUP(RC[-5],Sheet4!C[-7]:C[-2],5,FALSE) -> 27
A387: =R[-22]C+60 -> 1351 | B387: =VLOOKUP(RC[1],Sheet4!C[-1]:C[2],2,FALSE)&VLOOKUP(RC[1],Sheet4!C[-1]:C[2],3,FALSE)&RC[2]&VLOOKUP(RC[1],Sheet4!C[-1]:C[2],4,FALSE)&"（%s/"&RC[2]&"）" -> 圣器争夺5次（%s/5） | C387: =R[-22]C -> 11 | D387: =R[-22]C -> 5 | E387: 0 | F387: =R[-22]C -> 13049 | G387: =R[-22]C -> 5 | H387: =VLOOKUP(RC[-5],Sheet4!C[-7]:C[-2],5,FALSE) -> 19
A388: =R[-22]C+60 -> 1352 | B388: =VLOOKUP(RC[1],Sheet4!C[-1]:C[2],2,FALSE)&VLOOKUP(RC[1],Sheet4!C[-1]:C[2],3,FALSE)&RC[2]&VLOOKUP(RC[1],Sheet4!C[-1]:C[2],4,FALSE)&"（%s/"&RC[2]&"）" -> 圣器合成3次（%s/3） | C388: =R[-22]C -> 22 | D388: =R[-22]C -> 3 | E388: 0 | F388: =R[-22]C -> 13049 | G388: =R[-22]C -> 5 | H388: =VLOOKUP(RC[-5],Sheet4!C[-7]:C[-2],5,FALSE) -> 19
A389: =R[-22]C+60 -> 1353 | B389: =VLOOKUP(RC[1],Sheet4!C[-1]:C[2],2,FALSE)&VLOOKUP(RC[1],Sheet4!C[-1]:C[2],3,FALSE)&RC[2]&VLOOKUP(RC[1],Sheet4!C[-1]:C[2],4,FALSE)&"（%s/"&RC[2]&"）" -> 圣器强化5次（%s/5） | C389: =R[-22]C -> 2 | D389: =R[-22]C -> 5 | E389: 0 | F389: =R[-22]C -> 13049 | G389: =R[-22]C -> 5 | H389: =VLOOKUP(RC[-5],Sheet4!C[-7]:C[-2],5,FALSE) -> 8
A390: =R[-22]C+60 -> 1361 | B390: =VLOOKUP(RC[1],Sheet4!C[-1]:C[2],2,FALSE)&VLOOKUP(RC[1],Sheet4!C[-1]:C[2],3,FALSE)&RC[2]&VLOOKUP(RC[1],Sheet4!C[-1]:C[2],4,FALSE)&"（%s/"&RC[2]&"）" -> 进行召唤5次（%s/5） | C390: =R[-22]C -> 8 | D390: =R[-22]C -> 5 | E390: 0 | F390: =R[-22]C -> 19006 | G390: =R[-22]C -> 80 | H390: =VLOOKUP(RC[-5],Sheet4!C[-7]:C[-2],5,FALSE) -> 9
A391: =R[-22]C+60 -> 1362 | B391: =VLOOKUP(RC[1],Sheet4!C[-1]:C[2],2,FALSE)&VLOOKUP(RC[1],Sheet4!C[-1]:C[2],3,FALSE)&RC[2]&VLOOKUP(RC[1],Sheet4!C[-1]:C[2],4,FALSE)&"（%s/"&RC[2]&"）" -> 进行高级召唤2次（%s/2） | C391: =R[-22]C -> 9 | D391: =R[-22]C -> 2 | E391: 0 | F391: =R[-22]C -> 19006 | G391: =R[-22]C -> 100 | H391: =VLOOKUP(RC[-5],Sheet4!C[-7]:C[-2],5,FALSE) -> 9
A392: =R[-22]C+60 -> 1363 | B392: =VLOOKUP(RC[1],Sheet4!C[-1]:C[2],2,FALSE)&VLOOKUP(RC[1],Sheet4!C[-1]:C[2],3,FALSE)&RC[2]&VLOOKUP(RC[1],Sheet4!C[-1]:C[2],4,FALSE)&"（%s/"&RC[2]&"）" -> 购买体力2次（%s/2） | C392: =R[-22]C -> 6 | D392: =R[-22]C -> 2 | E392: 0 | F392: =R[-22]C -> 19005 | G392: =R[-22]C -> 50 | H392: =VLOOKUP(RC[-5],Sheet4!C[-7]:C[-2],5,FALSE) -> 12
A393: =R[-22]C+60 -> 1364 | B393: =VLOOKUP(RC[1],Sheet4!C[-1]:C[2],2,FALSE)&VLOOKUP(RC[1],Sheet4!C[-1]:C[2],3,FALSE)&RC[2]&VLOOKUP(RC[1],Sheet4!C[-1]:C[2],4,FALSE)&"（%s/"&RC[2]&"）" -> 购买精力2次（%s/2） | C393: =R[-22]C -> 7 | D393: =R[-22]C -> 2 | E393: 0 | F393: =R[-22]C -> 19005 | G393: =R[-22]C -> 50 | H393: =VLOOKUP(RC[-5],Sheet4!C[-7]:C[-2],5,FALSE) -> 12
A394: =R[-22]C+60 -> 1371 | B394: =VLOOKUP(RC[1],Sheet4!C[-1]:C[2],2,FALSE)&VLOOKUP(RC[1],Sheet4!C[-1]:C[2],3,FALSE)&RC[2]&VLOOKUP(RC[1],Sheet4!C[-1]:C[2],4,FALSE)&"（%s/"&RC[2]&"）" -> 进入勇者试练战斗10次（%s/10） | C394: =R[-22]C -> 12 | D394: =R[-22]C -> 10 | E394: 0 | F394: =R[-22]C -> 19012 | G394: =R[-22]C -> 500 | H394: =VLOOKUP(RC[-5],Sheet4!C[-7]:C[-2],5,FALSE) -> 17
A395: =R[-22]C+60 -> 1372 | B395: =VLOOKUP(RC[1],Sheet4!C[-1]:C[2],2,FALSE)&VLOOKUP(RC[1],Sheet4!C[-1]:C[2],3,FALSE)&RC[2]&VLOOKUP(RC[1],Sheet4!C[-1]:C[2],4,FALSE)&"（%s/"&RC[2]&"）" -> 竞技场战斗5次（%s/5） | C395: =R[-22]C -> 10 | D395: =R[-22]C -> 5 | E395: 0 | F395: =R[-22]C -> 19013 | G395: =R[-22]C -> 500 | H395: =VLOOKUP(RC[-5],Sheet4!C[-7]:C[-2],5,FALSE) -> 21
A396: =R[-22]C+60 -> 1373 | B396: =VLOOKUP(RC[1],Sheet4!C[-1]:C[2],2,FALSE)&VLOOKUP(RC[1],Sheet4!C[-1]:C[2],3,FALSE)&RC[2]&VLOOKUP(RC[1],Sheet4!C[-1]:C[2],4,FALSE)&"（%s/"&RC[2]&"）" -> 主线副本挑战5次（%s/5） | C396: =R[-22]C -> 1 | D396: =R[-22]C -> 5 | E396: 0 | F396: =R[-22]C -> 19003 | G396: =R[-22]C -> 30000 | H396: =VLOOKUP(RC[-5],Sheet4!C[-7]:C[-2],5,FALSE) -> 26
A397: =R[-22]C+60 -> 1374 | B397: =VLOOKUP(RC[1],Sheet4!C[-1]:C[2],2,FALSE)&VLOOKUP(RC[1],Sheet4!C[-1]:C[2],3,FALSE)&RC[2]&VLOOKUP(RC[1],Sheet4!C[-1]:C[2],4,FALSE)&"（%s/"&RC[2]&"）" -> 日常副本战斗4次（%s/4） | C397: =R[-22]C -> 13 | D397: =R[-22]C -> 4 | E397: 0 | F397: =R[-22]C -> 19005 | G397: =R[-22]C -> 50 | H397: =VLOOKUP(RC[-5],Sheet4!C[-7]:C[-2],5,FALSE) -> 2
A398: =R[-22]C+60 -> 1381 | B398: =VLOOKUP(RC[1],Sheet4!C[-1]:C[2],2,FALSE)&VLOOKUP(RC[1],Sheet4!C[-1]:C[2],3,FALSE)&RC[2]&VLOOKUP(RC[1],Sheet4!C[-1]:C[2],4,FALSE)&"（%s/"&RC[2]&"）" -> 赠送好友精力3次（%s/3） | C398: =R[-22]C -> 4 | D398: =R[-22]C -> 3 | E398: 0 | F398: =R[-22]C -> 19005 | G398: =R[-22]C -> 50 | H398: =VLOOKUP(RC[-5],Sheet4!C[-7]:C[-2],5,FALSE) -> 15
A399: =R[-22]C+60 -> 1382 | B399: =VLOOKUP(RC[1],Sheet4!C[-1]:C[2],2,FALSE)&VLOOKUP(RC[1],Sheet4!C[-1]:C[2],3,FALSE)&RC[2]&VLOOKUP(RC[1],Sheet4!C[-1]:C[2],4,FALSE)&"（%s/"&RC[2]&"）" -> 英雄培养15次（%s/15） | C399: =R[-22]C -> 3 | D399: =R[-22]C -> 15 | E399: 0 | F399: =R[-22]C -> 10003 | G399: =R[-22]C -> 30 | H399: =VLOOKUP(RC[-5],Sheet4!C[-7]:C[-2],5,FALSE) -> 8
A400: =R[-22]C+60 -> 1383 | B400: =VLOOKUP(RC[1],Sheet4!C[-1]:C[2],2,FALSE)&VLOOKUP(RC[1],Sheet4!C[-1]:C[2],3,FALSE)&RC[2]&VLOOKUP(RC[1],Sheet4!C[-1]:C[2],4,FALSE)&"（%s/"&RC[2]&"）" -> 英雄商店购买1次（%s/1） | C400: =R[-22]C -> 5 | D400: =R[-22]C -> 1 | E400: 0 | F400: =R[-22]C -> 19006 | G400: =R[-22]C -> 80 | H400: =VLOOKUP(RC[-5],Sheet4!C[-7]:C[-2],5,FALSE) -> 11
A401: =R[-22]C+60 -> 1384 | B401: =VLOOKUP(RC[1],Sheet4!C[-1]:C[2],2,FALSE)&VLOOKUP(RC[1],Sheet4!C[-1]:C[2],3,FALSE)&RC[2]&VLOOKUP(RC[1],Sheet4!C[-1]:C[2],4,FALSE)&"（%s/"&RC[2]&"）" -> 遗迹探索4小时（%s/4） | C401: =R[-22]C -> 19 | D401: =R[-22]C -> 4 | E401: 0 | F401: =R[-22]C -> 19005 | G401: =R[-22]C -> 50 | H401: =VLOOKUP(RC[-5],Sheet4!C[-7]:C[-2],5,FALSE) -> 20
A402: =R[-22]C+60 -> 1391 | B402: =VLOOKUP(RC[1],Sheet4!C[-1]:C[2],2,FALSE)&VLOOKUP(RC[1],Sheet4!C[-1]:C[2],3,FALSE)&RC[2]&VLOOKUP(RC[1],Sheet4!C[-1]:C[2],4,FALSE)&"（%s/"&RC[2]&"）" -> 精英副本战斗1次（%s/1） | C402: =R[-22]C -> 15 | D402: =R[-22]C -> 1 | E402: 0 | F402: =R[-22]C -> 10008 | G402: =R[-22]C -> 30 | H402: =VLOOKUP(RC[-5],Sheet4!C[-7]:C[-2],5,FALSE) -> 28
A403: =R[-22]C+60 -> 1392 | B403: =VLOOKUP(RC[1],Sheet4!C[-1]:C[2],2,FALSE)&VLOOKUP(RC[1],Sheet4!C[-1]:C[2],3,FALSE)&RC[2]&VLOOKUP(RC[1],Sheet4!C[-1]:C[2],4,FALSE)&"（%s/"&RC[2]&"）" -> 异度入侵分享2次（%s/2） | C403: =R[-22]C -> 17 | D403: =R[-22]C -> 2 | E403: 0 | F403: =R[-22]C -> 19014 | G403: =R[-22]C -> 500 | H403: =VLOOKUP(RC[-5],Sheet4!C[-7]:C[-2],5,FALSE) -> 16
A404: =R[-22]C+60 -> 1393 | B404: =VLOOKUP(RC[1],Sheet4!C[-1]:C[2],2,FALSE)&VLOOKUP(RC[1],Sheet4!C[-1]:C[2],3,FALSE)&RC[2]&VLOOKUP(RC[1],Sheet4!C[-1]:C[2],4,FALSE)&"（%s/"&RC[2]&"）" -> 讨伐异度入侵者2次（%s/2） | C404: =R[-22]C -> 18 | D404: =R[-22]C -> 2 | E404: 0 | F404: =R[-22]C -> 19014 | G404: =R[-22]C -> 500 | H404: =VLOOKUP(RC[-5],Sheet4!C[-7]:C[-2],5,FALSE) -> 16
A405: =R[-22]C+60 -> 1394 | B405: =VLOOKUP(RC[1],Sheet4!C[-1]:C[2],2,FALSE)&VLOOKUP(RC[1],Sheet4!C[-1]:C[2],3,FALSE)&RC[2]&VLOOKUP(RC[1],Sheet4!C[-1]:C[2],4,FALSE)&"（%s/"&RC[2]&"）" -> 无尽深渊战斗1次（%s/1） | C405: =R[-22]C -> 23 | D405: =R[-22]C -> 1 | E405: 0 | F405: =R[-22]C -> 19028 | G405: =R[-22]C -> 50 | H405: =VLOOKUP(RC[-5],Sheet4!C[-7]:C[-2],5,FALSE) -> 88
A406: =R[-22]C+60 -> 1401 | B406: =VLOOKUP(RC[1],Sheet4!C[-1]:C[2],2,FALSE)&VLOOKUP(RC[1],Sheet4!C[-1]:C[2],3,FALSE)&RC[2]&VLOOKUP(RC[1],Sheet4!C[-1]:C[2],4,FALSE)&"（%s/"&RC[2]&"）" -> 击杀遗迹破坏者3次（%s/3） | C406: =R[-22]C -> 16 | D406: =R[-22]C -> 3 | E406: 0 | F406: =R[-22]C -> 19005 | G406: =R[-22]C -> 50 | H406: =VLOOKUP(RC[-5],Sheet4!C[-7]:C[-2],5,FALSE) -> 20
A407: =R[-22]C+60 -> 1402 | B407: =VLOOKUP(RC[1],Sheet4!C[-1]:C[2],2,FALSE)&VLOOKUP(RC[1],Sheet4!C[-1]:C[2],3,FALSE)&RC[2]&VLOOKUP(RC[1],Sheet4!C[-1]:C[2],4,FALSE)&"（%s/"&RC[2]&"）" -> 占卜翻牌5次（%s/5） | C407: =R[-22]C -> 25 | D407: =R[-22]C -> 5 | E407: 0 | F407: =R[-22]C -> 10096 | G407: =R[-22]C -> 1 | H407: =VLOOKUP(RC[-5],Sheet4!C[-7]:C[-2],5,FALSE) -> 113
A408: =R[-22]C+60 -> 1403 | B408: =VLOOKUP(RC[1],Sheet4!C[-1]:C[2],2,FALSE)&VLOOKUP(RC[1],Sheet4!C[-1]:C[2],3,FALSE)&RC[2]&VLOOKUP(RC[1],Sheet4!C[-1]:C[2],4,FALSE)&"（%s/"&RC[2]&"）" -> 英雄副本战斗1次（%s/1） | C408: =R[-22]C -> 14 | D408: =R[-22]C -> 1 | E408: 0 | F408: =R[-22]C -> 19006 | G408: =R[-22]C -> 80 | H408: =VLOOKUP(RC[-5],Sheet4!C[-7]:C[-2],5,FALSE) -> 27
A409: =R[-22]C+60 -> 1411 | B409: =VLOOKUP(RC[1],Sheet4!C[-1]:C[2],2,FALSE)&VLOOKUP(RC[1],Sheet4!C[-1]:C[2],3,FALSE)&RC[2]&VLOOKUP(RC[1],Sheet4!C[-1]:C[2],4,FALSE)&"（%s/"&RC[2]&"）" -> 圣器争夺5次（%s/5） | C409: =R[-22]C -> 11 | D409: =R[-22]C -> 5 | E409: 0 | F409: =R[-22]C -> 13049 | G409: =R[-22]C -> 5 | H409: =VLOOKUP(RC[-5],Sheet4!C[-7]:C[-2],5,FALSE) -> 19
A410: =R[-22]C+60 -> 1412 | B410: =VLOOKUP(RC[1],Sheet4!C[-1]:C[2],2,FALSE)&VLOOKUP(RC[1],Sheet4!C[-1]:C[2],3,FALSE)&RC[2]&VLOOKUP(RC[1],Sheet4!C[-1]:C[2],4,FALSE)&"（%s/"&RC[2]&"）" -> 圣器合成3次（%s/3） | C410: =R[-22]C -> 22 | D410: =R[-22]C -> 3 | E410: 0 | F410: =R[-22]C -> 13049 | G410: =R[-22]C -> 5 | H410: =VLOOKUP(RC[-5],Sheet4!C[-7]:C[-2],5,FALSE) -> 19
A411: =R[-22]C+60 -> 1413 | B411: =VLOOKUP(RC[1],Sheet4!C[-1]:C[2],2,FALSE)&VLOOKUP(RC[1],Sheet4!C[-1]:C[2],3,FALSE)&RC[2]&VLOOKUP(RC[1],Sheet4!C[-1]:C[2],4,FALSE)&"（%s/"&RC[2]&"）" -> 圣器强化5次（%s/5） | C411: =R[-22]C -> 2 | D411: =R[-22]C -> 5 | E411: 0 | F411: =R[-22]C -> 13049 | G411: =R[-22]C -> 5 | H411: =VLOOKUP(RC[-5],Sheet4!C[-7]:C[-2],5,FALSE) -> 8
A412: =R[-22]C+60 -> 1421 | B412: =VLOOKUP(RC[1],Sheet4!C[-1]:C[2],2,FALSE)&VLOOKUP(RC[1],Sheet4!C[-1]:C[2],3,FALSE)&RC[2]&VLOOKUP(RC[1],Sheet4!C[-1]:C[2],4,FALSE)&"（%s/"&RC[2]&"）" -> 进行召唤5次（%s/5） | C412: =R[-22]C -> 8 | D412: =R[-22]C -> 5 | E412: 0 | F412: =R[-22]C -> 19006 | G412: =R[-22]C -> 80 | H412: =VLOOKUP(RC[-5],Sheet4!C[-7]:C[-2],5,FALSE) -> 9
A413: =R[-22]C+60 -> 1422 | B413: =VLOOKUP(RC[1],Sheet4!C[-1]:C[2],2,FALSE)&VLOOKUP(RC[1],Sheet4!C[-1]:C[2],3,FALSE)&RC[2]&VLOOKUP(RC[1],Sheet4!C[-1]:C[2],4,FALSE)&"（%s/"&RC[2]&"）" -> 进行高级召唤2次（%s/2） | C413: =R[-22]C -> 9 | D413: =R[-22]C -> 2 | E413: 0 | F413: =R[-22]C -> 19006 | G413: =R[-22]C -> 100 | H413: =VLOOKUP(RC[-5],Sheet4!C[-7]:C[-2],5,FALSE) -> 9
A414: =R[-22]C+60 -> 1423 | B414: =VLOOKUP(RC[1],Sheet4!C[-1]:C[2],2,FALSE)&VLOOKUP(RC[1],Sheet4!C[-1]:C[2],3,FALSE)&RC[2]&VLOOKUP(RC[1],Sheet4!C[-1]:C[2],4,FALSE)&"（%s/"&RC[2]&"）" -> 购买体力2次（%s/2） | C414: =R[-22]C -> 6 | D414: =R[-22]C -> 2 | E414: 0 | F414: =R[-22]C -> 19005 | G414: =R[-22]C -> 50 | H414: =VLOOKUP(RC[-5],Sheet4!C[-7]:C[-2],5,FALSE) -> 12
A415: =R[-22]C+60 -> 1424 | B415: =VLOOKUP(RC[1],Sheet4!C[-1]:C[2],2,FALSE)&VLOOKUP(RC[1],Sheet4!C[-1]:C[2],3,FALSE)&RC[2]&VLOOKUP(RC[1],Sheet4!C[-1]:C[2],4,FALSE)&"（%s/"&RC[2]&"）" -> 购买精力2次（%s/2） | C415: =R[-22]C -> 7 | D415: =R[-22]C -> 2 | E415: 0 | F415: =R[-22]C -> 19005 | G415: =R[-22]C -> 50 | H415: =VLOOKUP(RC[-5],Sheet4!C[-7]:C[-2],5,FALSE) -> 12
A416: =R[-22]C+60 -> 1431 | B416: =VLOOKUP(RC[1],Sheet4!C[-1]:C[2],2,FALSE)&VLOOKUP(RC[1],Sheet4!C[-1]:C[2],3,FALSE)&RC[2]&VLOOKUP(RC[1],Sheet4!C[-1]:C[2],4,FALSE)&"（%s/"&RC[2]&"）" -> 进入勇者试练战斗10次（%s/10） | C416: =R[-22]C -> 12 | D416: =R[-22]C -> 10 | E416: 0 | F416: =R[-22]C -> 19012 | G416: =R[-22]C -> 500 | H416: =VLOOKUP(RC[-5],Sheet4!C[-7]:C[-2],5,FALSE) -> 17
A417: =R[-22]C+60 -> 1432 | B417: =VLOOKUP(RC[1],Sheet4!C[-1]:C[2],2,FALSE)&VLOOKUP(RC[1],Sheet4!C[-1]:C[2],3,FALSE)&RC[2]&VLOOKUP(RC[1],Sheet4!C[-1]:C[2],4,FALSE)&"（%s/"&RC[2]&"）" -> 竞技场战斗5次（%s/5） | C417: =R[-22]C -> 10 | D417: =R[-22]C -> 5 | E417: 0 | F417: =R[-22]C -> 19013 | G417: =R[-22]C -> 500 | H417: =VLOOKUP(RC[-5],Sheet4!C[-7]:C[-2],5,FALSE) -> 21
A418: =R[-22]C+60 -> 1433 | B418: =VLOOKUP(RC[1],Sheet4!C[-1]:C[2],2,FALSE)&VLOOKUP(RC[1],Sheet4!C[-1]:C[2],3,FALSE)&RC[2]&VLOOKUP(RC[1],Sheet4!C[-1]:C[2],4,FALSE)&"（%s/"&RC[2]&"）" -> 主线副本挑战5次（%s/5） | C418: =R[-22]C -> 1 | D418: =R[-22]C -> 5 | E418: 0 | F418: =R[-22]C -> 19003 | G418: =R[-22]C -> 30000 | H418: =VLOOKUP(RC[-5],Sheet4!C[-7]:C[-2],5,FALSE) -> 26
A419: =R[-22]C+60 -> 1434 | B419: =VLOOKUP(RC[1],Sheet4!C[-1]:C[2],2,FALSE)&VLOOKUP(RC[1],Sheet4!C[-1]:C[2],3,FALSE)&RC[2]&VLOOKUP(RC[1],Sheet4!C[-1]:C[2],4,FALSE)&"（%s/"&RC[2]&"）" -> 日常副本战斗4次（%s/4） | C419: =R[-22]C -> 13 | D419: =R[-22]C -> 4 | E419: 0 | F419: =R[-22]C -> 19005 | G419: =R[-22]C -> 50 | H419: =VLOOKUP(RC[-5],Sheet4!C[-7]:C[-2],5,FALSE) -> 2
A420: =R[-22]C+60 -> 1441 | B420: =VLOOKUP(RC[1],Sheet4!C[-1]:C[2],2,FALSE)&VLOOKUP(RC[1],Sheet4!C[-1]:C[2],3,FALSE)&RC[2]&VLOOKUP(RC[1],Sheet4!C[-1]:C[2],4,FALSE)&"（%s/"&RC[2]&"）" -> 赠送好友精力3次（%s/3） | C420: =R[-22]C -> 4 | D420: =R[-22]C -> 3 | E420: 0 | F420: =R[-22]C -> 19005 | G420: =R[-22]C -> 50 | H420: =VLOOKUP(RC[-5],Sheet4!C[-7]:C[-2],5,FALSE) -> 15
A421: =R[-22]C+60 -> 1442 | B421: =VLOOKUP(RC[1],Sheet4!C[-1]:C[2],2,FALSE)&VLOOKUP(RC[1],Sheet4!C[-1]:C[2],3,FALSE)&RC[2]&VLOOKUP(RC[1],Sheet4!C[-1]:C[2],4,FALSE)&"（%s/"&RC[2]&"）" -> 英雄培养15次（%s/15） | C421: =R[-22]C -> 3 | D421: =R[-22]C -> 15 | E421: 0 | F421: =R[-22]C -> 10003 | G421: =R[-22]C -> 30 | H421: =VLOOKUP(RC[-5],Sheet4!C[-7]:C[-2],5,FALSE) -> 8
A422: =R[-22]C+60 -> 1443 | B422: =VLOOKUP(RC[1],Sheet4!C[-1]:C[2],2,FALSE)&VLOOKUP(RC[1],Sheet4!C[-1]:C[2],3,FALSE)&RC[2]&VLOOKUP(RC[1],Sheet4!C[-1]:C[2],4,FALSE)&"（%s/"&RC[2]&"）" -> 英雄商店购买1次（%s/1） | C422: =R[-22]C -> 5 | D422: =R[-22]C -> 1 | E422: 0 | F422: =R[-22]C -> 19006 | G422: =R[-22]C -> 80 | H422: =VLOOKUP(RC[-5],Sheet4!C[-7]:C[-2],5,FALSE) -> 11
A423: =R[-22]C+60 -> 1444 | B423: =VLOOKUP(RC[1],Sheet4!C[-1]:C[2],2,FALSE)&VLOOKUP(RC[1],Sheet4!C[-1]:C[2],3,FALSE)&RC[2]&VLOOKUP(RC[1],Sheet4!C[-1]:C[2],4,FALSE)&"（%s/"&RC[2]&"）" -> 遗迹探索4小时（%s/4） | C423: =R[-22]C -> 19 | D423: =R[-22]C -> 4 | E423: 0 | F423: =R[-22]C -> 19005 | G423: =R[-22]C -> 50 | H423: =VLOOKUP(RC[-5],Sheet4!C[-7]:C[-2],5,FALSE) -> 20
A424: =R[-22]C+60 -> 1451 | B424: =VLOOKUP(RC[1],Sheet4!C[-1]:C[2],2,FALSE)&VLOOKUP(RC[1],Sheet4!C[-1]:C[2],3,FALSE)&RC[2]&VLOOKUP(RC[1],Sheet4!C[-1]:C[2],4,FALSE)&"（%s/"&RC[2]&"）" -> 精英副本战斗1次（%s/1） | C424: =R[-22]C -> 15 | D424: =R[-22]C -> 1 | E424: 0 | F424: =R[-22]C -> 10008 | G424: =R[-22]C -> 30 | H424: =VLOOKUP(RC[-5],Sheet4!C[-7]:C[-2],5,FALSE) -> 28
A425: =R[-22]C+60 -> 1452 | B425: =VLOOKUP(RC[1],Sheet4!C[-1]:C[2],2,FALSE)&VLOOKUP(RC[1],Sheet4!C[-1]:C[2],3,FALSE)&RC[2]&VLOOKUP(RC[1],Sheet4!C[-1]:C[2],4,FALSE)&"（%s/"&RC[2]&"）" -> 异度入侵分享2次（%s/2） | C425: =R[-22]C -> 17 | D425: =R[-22]C -> 2 | E425: 0 | F425: =R[-22]C -> 19014 | G425: =R[-22]C -> 500 | H425: =VLOOKUP(RC[-5],Sheet4!C[-7]:C[-2],5,FALSE) -> 16
A426: =R[-22]C+60 -> 1453 | B426: =VLOOKUP(RC[1],Sheet4!C[-1]:C[2],2,FALSE)&VLOOKUP(RC[1],Sheet4!C[-1]:C[2],3,FALSE)&RC[2]&VLOOKUP(RC[1],Sheet4!C[-1]:C[2],4,FALSE)&"（%s/"&RC[2]&"）" -> 讨伐异度入侵者2次（%s/2） | C426: =R[-22]C -> 18 | D426: =R[-22]C -> 2 | E426: 0 | F426: =R[-22]C -> 19014 | G426: =R[-22]C -> 500 | H426: =VLOOKUP(RC[-5],Sheet4!C[-7]:C[-2],5,FALSE) -> 16
A427: =R[-22]C+60 -> 1454 | B427: =VLOOKUP(RC[1],Sheet4!C[-1]:C[2],2,FALSE)&VLOOKUP(RC[1],Sheet4!C[-1]:C[2],3,FALSE)&RC[2]&VLOOKUP(RC[1],Sheet4!C[-1]:C[2],4,FALSE)&"（%s/"&RC[2]&"）" -> 无尽深渊战斗1次（%s/1） | C427: =R[-22]C -> 23 | D427: =R[-22]C -> 1 | E427: 0 | F427: =R[-22]C -> 19028 | G427: =R[-22]C -> 50 | H427: =VLOOKUP(RC[-5],Sheet4!C[-7]:C[-2],5,FALSE) -> 88
A428: =R[-22]C+60 -> 1461 | B428: =VLOOKUP(RC[1],Sheet4!C[-1]:C[2],2,FALSE)&VLOOKUP(RC[1],Sheet4!C[-1]:C[2],3,FALSE)&RC[2]&VLOOKUP(RC[1],Sheet4!C[-1]:C[2],4,FALSE)&"（%s/"&RC[2]&"）" -> 击杀遗迹破坏者3次（%s/3） | C428: =R[-22]C -> 16 | D428: =R[-22]C -> 3 | E428: 0 | F428: =R[-22]C -> 19005 | G428: =R[-22]C -> 50 | H428: =VLOOKUP(RC[-5],Sheet4!C[-7]:C[-2],5,FALSE) -> 20
A429: =R[-22]C+60 -> 1462 | B429: =VLOOKUP(RC[1],Sheet4!C[-1]:C[2],2,FALSE)&VLOOKUP(RC[1],Sheet4!C[-1]:C[2],3,FALSE)&RC[2]&VLOOKUP(RC[1],Sheet4!C[-1]:C[2],4,FALSE)&"（%s/"&RC[2]&"）" -> 占卜翻牌5次（%s/5） | C429: =R[-22]C -> 25 | D429: =R[-22]C -> 5 | E429: 0 | F429: =R[-22]C -> 10096 | G429: =R[-22]C -> 1 | H429: =VLOOKUP(RC[-5],Sheet4!C[-7]:C[-2],5,FALSE) -> 113
A430: =R[-22]C+60 -> 1463 | B430: =VLOOKUP(RC[1],Sheet4!C[-1]:C[2],2,FALSE)&VLOOKUP(RC[1],Sheet4!C[-1]:C[2],3,FALSE)&RC[2]&VLOOKUP(RC[1],Sheet4!C[-1]:C[2],4,FALSE)&"（%s/"&RC[2]&"）" -> 英雄副本战斗1次（%s/1） | C430: =R[-22]C -> 14 | D430: =R[-22]C -> 1 | E430: 0 | F430: =R[-22]C -> 19006 | G430: =R[-22]C -> 80 | H430: =VLOOKUP(RC[-5],Sheet4!C[-7]:C[-2],5,FALSE) -> 27
A431: =R[-22]C+60 -> 1471 | B431: =VLOOKUP(RC[1],Sheet4!C[-1]:C[2],2,FALSE)&VLOOKUP(RC[1],Sheet4!C[-1]:C[2],3,FALSE)&RC[2]&VLOOKUP(RC[1],Sheet4!C[-1]:C[2],4,FALSE)&"（%s/"&RC[2]&"）" -> 圣器争夺5次（%s/5） | C431: =R[-22]C -> 11 | D431: =R[-22]C -> 5 | E431: 0 | F431: =R[-22]C -> 13049 | G431: =R[-22]C -> 5 | H431: =VLOOKUP(RC[-5],Sheet4!C[-7]:C[-2],5,FALSE) -> 19
A432: =R[-22]C+60 -> 1472 | B432: =VLOOKUP(RC[1],Sheet4!C[-1]:C[2],2,FALSE)&VLOOKUP(RC[1],Sheet4!C[-1]:C[2],3,FALSE)&RC[2]&VLOOKUP(RC[1],Sheet4!C[-1]:C[2],4,FALSE)&"（%s/"&RC[2]&"）" -> 圣器合成3次（%s/3） | C432: =R[-22]C -> 22 | D432: =R[-22]C -> 3 | E432: 0 | F432: =R[-22]C -> 13049 | G432: =R[-22]C -> 5 | H432: =VLOOKUP(RC[-5],Sheet4!C[-7]:C[-2],5,FALSE) -> 19
A433: =R[-22]C+60 -> 1473 | B433: =VLOOKUP(RC[1],Sheet4!C[-1]:C[2],2,FALSE)&VLOOKUP(RC[1],Sheet4!C[-1]:C[2],3,FALSE)&RC[2]&VLOOKUP(RC[1],Sheet4!C[-1]:C[2],4,FALSE)&"（%s/"&RC[2]&"）" -> 圣器强化5次（%s/5） | C433: =R[-22]C -> 2 | D433: =R[-22]C -> 5 | E433: 0 | F433: =R[-22]C -> 13049 | G433: =R[-22]C -> 5 | H433: =VLOOKUP(RC[-5],Sheet4!C[-7]:C[-2],5,FALSE) -> 8
A434: =R[-22]C+60 -> 1481 | B434: =VLOOKUP(RC[1],Sheet4!C[-1]:C[2],2,FALSE)&VLOOKUP(RC[1],Sheet4!C[-1]:C[2],3,FALSE)&RC[2]&VLOOKUP(RC[1],Sheet4!C[-1]:C[2],4,FALSE)&"（%s/"&RC[2]&"）" -> 进行召唤5次（%s/5） | C434: =R[-22]C -> 8 | D434: =R[-22]C -> 5 | E434: 0 | F434: =R[-22]C -> 19006 | G434: =R[-22]C -> 80 | H434: =VLOOKUP(RC[-5],Sheet4!C[-7]:C[-2],5,FALSE) -> 9
A435: =R[-22]C+60 -> 1482 | B435: =VLOOKUP(RC[1],Sheet4!C[-1]:C[2],2,FALSE)&VLOOKUP(RC[1],Sheet4!C[-1]:C[2],3,FALSE)&RC[2]&VLOOKUP(RC[1],Sheet4!C[-1]:C[2],4,FALSE)&"（%s/"&RC[2]&"）" -> 进行高级召唤2次（%s/2） | C435: =R[-22]C -> 9 | D435: =R[-22]C -> 2 | E435: 0 | F435: =R[-22]C -> 19006 | G435: =R[-22]C -> 100 | H435: =VLOOKUP(RC[-5],Sheet4!C[-7]:C[-2],5,FALSE) -> 9
A436: =R[-22]C+60 -> 1483 | B436: =VLOOKUP(RC[1],Sheet4!C[-1]:C[2],2,FALSE)&VLOOKUP(RC[1],Sheet4!C[-1]:C[2],3,FALSE)&RC[2]&VLOOKUP(RC[1],Sheet4!C[-1]:C[2],4,FALSE)&"（%s/"&RC[2]&"）" -> 购买体力2次（%s/2） | C436: =R[-22]C -> 6 | D436: =R[-22]C -> 2 | E436: 0 | F436: =R[-22]C -> 19005 | G436: =R[-22]C -> 50 | H436: =VLOOKUP(RC[-5],Sheet4!C[-7]:C[-2],5,FALSE) -> 12
A437: =R[-22]C+60 -> 1484 | B437: =VLOOKUP(RC[1],Sheet4!C[-1]:C[2],2,FALSE)&VLOOKUP(RC[1],Sheet4!C[-1]:C[2],3,FALSE)&RC[2]&VLOOKUP(RC[1],Sheet4!C[-1]:C[2],4,FALSE)&"（%s/"&RC[2]&"）" -> 购买精力2次（%s/2） | C437: =R[-22]C -> 7 | D437: =R[-22]C -> 2 | E437: 0 | F437: =R[-22]C -> 19005 | G437: =R[-22]C -> 50 | H437: =VLOOKUP(RC[-5],Sheet4!C[-7]:C[-2],5,FALSE) -> 12
A438: =R[-22]C+60 -> 1491 | B438: =VLOOKUP(RC[1],Sheet4!C[-1]:C[2],2,FALSE)&VLOOKUP(RC[1],Sheet4!C[-1]:C[2],3,FALSE)&RC[2]&VLOOKUP(RC[1],Sheet4!C[-1]:C[2],4,FALSE)&"（%s/"&RC[2]&"）" -> 进入勇者试练战斗10次（%s/10） | C438: =R[-22]C -> 12 | D438: =R[-22]C -> 10 | E438: 0 | F438: =R[-22]C -> 19012 | G438: =R[-22]C -> 500 | H438: =VLOOKUP(RC[-5],Sheet4!C[-7]:C[-2],5,FALSE) -> 17
A439: =R[-22]C+60 -> 1492 | B439: =VLOOKUP(RC[1],Sheet4!C[-1]:C[2],2,FALSE)&VLOOKUP(RC[1],Sheet4!C[-1]:C[2],3,FALSE)&RC[2]&VLOOKUP(RC[1],Sheet4!C[-1]:C[2],4,FALSE)&"（%s/"&RC[2]&"）" -> 竞技场战斗5次（%s/5） | C439: =R[-22]C -> 10 | D439: =R[-22]C -> 5 | E439: 0 | F439: =R[-22]C -> 19013 | G439: =R[-22]C -> 500 | H439: =VLOOKUP(RC[-5],Sheet4!C[-7]:C[-2],5,FALSE) -> 21
A440: =R[-22]C+60 -> 1493 | B440: =VLOOKUP(RC[1],Sheet4!C[-1]:C[2],2,FALSE)&VLOOKUP(RC[1],Sheet4!C[-1]:C[2],3,FALSE)&RC[2]&VLOOKUP(RC[1],Sheet4!C[-1]:C[2],4,FALSE)&"（%s/"&RC[2]&"）" -> 主线副本挑战5次（%s/5） | C440: =R[-22]C -> 1 | D440: =R[-22]C -> 5 | E440: 0 | F440: =R[-22]C -> 19003 | G440: =R[-22]C -> 30000 | H440: =VLOOKUP(RC[-5],Sheet4!C[-7]:C[-2],5,FALSE) -> 26
A441: =R[-22]C+60 -> 1494 | B441: =VLOOKUP(RC[1],Sheet4!C[-1]:C[2],2,FALSE)&VLOOKUP(RC[1],Sheet4!C[-1]:C[2],3,FALSE)&RC[2]&VLOOKUP(RC[1],Sheet4!C[-1]:C[2],4,FALSE)&"（%s/"&RC[2]&"）" -> 日常副本战斗4次（%s/4） | C441: =R[-22]C -> 13 | D441: =R[-22]C -> 4 | E441: 0 | F441: =R[-22]C -> 19005 | G441: =R[-22]C -> 50 | H441: =VLOOKUP(RC[-5],Sheet4!C[-7]:C[-2],5,FALSE) -> 2
A442: =R[-22]C+60 -> 1501 | B442: =VLOOKUP(RC[1],Sheet4!C[-1]:C[2],2,FALSE)&VLOOKUP(RC[1],Sheet4!C[-1]:C[2],3,FALSE)&RC[2]&VLOOKUP(RC[1],Sheet4!C[-1]:C[2],4,FALSE)&"（%s/"&RC[2]&"）" -> 赠送好友精力3次（%s/3） | C442: =R[-22]C -> 4 | D442: =R[-22]C -> 3 | E442: 0 | F442: =R[-22]C -> 19005 | G442: =R[-22]C -> 50 | H442: =VLOOKUP(RC[-5],Sheet4!C[-7]:C[-2],5,FALSE) -> 15
A443: =R[-22]C+60 -> 1502 | B443: =VLOOKUP(RC[1],Sheet4!C[-1]:C[2],2,FALSE)&VLOOKUP(RC[1],Sheet4!C[-1]:C[2],3,FALSE)&RC[2]&VLOOKUP(RC[1],Sheet4!C[-1]:C[2],4,FALSE)&"（%s/"&RC[2]&"）" -> 英雄培养15次（%s/15） | C443: =R[-22]C -> 3 | D443: =R[-22]C -> 15 | E443: 0 | F443: =R[-22]C -> 10003 | G443: =R[-22]C -> 30 | H443: =VLOOKUP(RC[-5],Sheet4!C[-7]:C[-2],5,FALSE) -> 8
A444: =R[-22]C+60 -> 1503 | B444: =VLOOKUP(RC[1],Sheet4!C[-1]:C[2],2,FALSE)&VLOOKUP(RC[1],Sheet4!C[-1]:C[2],3,FALSE)&RC[2]&VLOOKUP(RC[1],Sheet4!C[-1]:C[2],4,FALSE)&"（%s/"&RC[2]&"）" -> 英雄商店购买1次（%s/1） | C444: =R[-22]C -> 5 | D444: =R[-22]C -> 1 | E444: 0 | F444: =R[-22]C -> 19006 | G444: =R[-22]C -> 80 | H444: =VLOOKUP(RC[-5],Sheet4!C[-7]:C[-2],5,FALSE) -> 11
A445: =R[-22]C+60 -> 1504 | B445: =VLOOKUP(RC[1],Sheet4!C[-1]:C[2],2,FALSE)&VLOOKUP(RC[1],Sheet4!C[-1]:C[2],3,FALSE)&RC[2]&VLOOKUP(RC[1],Sheet4!C[-1]:C[2],4,FALSE)&"（%s/"&RC[2]&"）" -> 遗迹探索4小时（%s/4） | C445: =R[-22]C -> 19 | D445: =R[-22]C -> 4 | E445: 0 | F445: =R[-22]C -> 19005 | G445: =R[-22]C -> 50 | H445: =VLOOKUP(RC[-5],Sheet4!C[-7]:C[-2],5,FALSE) -> 20
A446: =R[-22]C+60 -> 1511 | B446: =VLOOKUP(RC[1],Sheet4!C[-1]:C[2],2,FALSE)&VLOOKUP(RC[1],Sheet4!C[-1]:C[2],3,FALSE)&RC[2]&VLOOKUP(RC[1],Sheet4!C[-1]:C[2],4,FALSE)&"（%s/"&RC[2]&"）" -> 精英副本战斗1次（%s/1） | C446: =R[-22]C -> 15 | D446: =R[-22]C -> 1 | E446: 0 | F446: =R[-22]C -> 10008 | G446: =R[-22]C -> 30 | H446: =VLOOKUP(RC[-5],Sheet4!C[-7]:C[-2],5,FALSE) -> 28
A447: =R[-22]C+60 -> 1512 | B447: =VLOOKUP(RC[1],Sheet4!C[-1]:C[2],2,FALSE)&VLOOKUP(RC[1],Sheet4!C[-1]:C[2],3,FALSE)&RC[2]&VLOOKUP(RC[1],Sheet4!C[-1]:C[2],4,FALSE)&"（%s/"&RC[2]&"）" -> 异度入侵分享2次（%s/2） | C447: =R[-22]C -> 17 | D447: =R[-22]C -> 2 | E447: 0 | F447: =R[-22]C -> 19014 | G447: =R[-22]C -> 500 | H447: =VLOOKUP(RC[-5],Sheet4!C[-7]:C[-2],5,FALSE) -> 16
A448: =R[-22]C+60 -> 1513 | B448: =VLOOKUP(RC[1],Sheet4!C[-1]:C[2],2,FALSE)&VLOOKUP(RC[1],Sheet4!C[-1]:C[2],3,FALSE)&RC[2]&VLOOKUP(RC[1],Sheet4!C[-1]:C[2],4,FALSE)&"（%s/"&RC[2]&"）" -> 讨伐异度入侵者2次（%s/2） | C448: =R[-22]C -> 18 | D448: =R[-22]C -> 2 | E448: 0 | F448: =R[-22]C -> 19014 | G448: =R[-22]C -> 500 | H448: =VLOOKUP(RC[-5],Sheet4!C[-7]:C[-2],5,FALSE) -> 16
A449: =R[-22]C+60 -> 1514 | B449: =VLOOKUP(RC[1],Sheet4!C[-1]:C[2],2,FALSE)&VLOOKUP(RC[1],Sheet4!C[-1]:C[2],3,FALSE)&RC[2]&VLOOKUP(RC[1],Sheet4!C[-1]:C[2],4,FALSE)&"（%s/"&RC[2]&"）" -> 无尽深渊战斗1次（%s/1） | C449: =R[-22]C -> 23 | D449: =R[-22]C -> 1 | E449: 0 | F449: =R[-22]C -> 19028 | G449: =R[-22]C -> 50 | H449: =VLOOKUP(RC[-5],Sheet4!C[-7]:C[-2],5,FALSE) -> 88
A450: =R[-22]C+60 -> 1521 | B450: =VLOOKUP(RC[1],Sheet4!C[-1]:C[2],2,FALSE)&VLOOKUP(RC[1],Sheet4!C[-1]:C[2],3,FALSE)&RC[2]&VLOOKUP(RC[1],Sheet4!C[-1]:C[2],4,FALSE)&"（%s/"&RC[2]&"）" -> 击杀遗迹破坏者3次（%s/3） | C450: =R[-22]C -> 16 | D450: =R[-22]C -> 3 | E450: 0 | F450: =R[-22]C -> 19005 | G450: =R[-22]C -> 50 | H450: =VLOOKUP(RC[-5],Sheet4!C[-7]:C[-2],5,FALSE) -> 20
A451: =R[-22]C+60 -> 1522 | B451: =VLOOKUP(RC[1],Sheet4!C[-1]:C[2],2,FALSE)&VLOOKUP(RC[1],Sheet4!C[-1]:C[2],3,FALSE)&RC[2]&VLOOKUP(RC[1],Sheet4!C[-1]:C[2],4,FALSE)&"（%s/"&RC[2]&"）" -> 占卜翻牌5次（%s/5） | C451: =R[-22]C -> 25 | D451: =R[-22]C -> 5 | E451: 0 | F451: =R[-22]C -> 10096 | G451: =R[-22]C -> 1 | H451: =VLOOKUP(RC[-5],Sheet4!C[-7]:C[-2],5,FALSE) -> 113
A452: =R[-22]C+60 -> 1523 | B452: =VLOOKUP(RC[1],Sheet4!C[-1]:C[2],2,FALSE)&VLOOKUP(RC[1],Sheet4!C[-1]:C[2],3,FALSE)&RC[2]&VLOOKUP(RC[1],Sheet4!C[-1]:C[2],4,FALSE)&"（%s/"&RC[2]&"）" -> 英雄副本战斗1次（%s/1） | C452: =R[-22]C -> 14 | D452: =R[-22]C -> 1 | E452: 0 | F452: =R[-22]C -> 19006 | G452: =R[-22]C -> 80 | H452: =VLOOKUP(RC[-5],Sheet4!C[-7]:C[-2],5,FALSE) -> 27
A453: =R[-22]C+60 -> 1531 | B453: =VLOOKUP(RC[1],Sheet4!C[-1]:C[2],2,FALSE)&VLOOKUP(RC[1],Sheet4!C[-1]:C[2],3,FALSE)&RC[2]&VLOOKUP(RC[1],Sheet4!C[-1]:C[2],4,FALSE)&"（%s/"&RC[2]&"）" -> 圣器争夺5次（%s/5） | C453: =R[-22]C -> 11 | D453: =R[-22]C -> 5 | E453: 0 | F453: =R[-22]C -> 13049 | G453: =R[-22]C -> 5 | H453: =VLOOKUP(RC[-5],Sheet4!C[-7]:C[-2],5,FALSE) -> 19
A454: =R[-22]C+60 -> 1532 | B454: =VLOOKUP(RC[1],Sheet4!C[-1]:C[2],2,FALSE)&VLOOKUP(RC[1],Sheet4!C[-1]:C[2],3,FALSE)&RC[2]&VLOOKUP(RC[1],Sheet4!C[-1]:C[2],4,FALSE)&"（%s/"&RC[2]&"）" -> 圣器合成3次（%s/3） | C454: =R[-22]C -> 22 | D454: =R[-22]C -> 3 | E454: 0 | F454: =R[-22]C -> 13049 | G454: =R[-22]C -> 5 | H454: =VLOOKUP(RC[-5],Sheet4!C[-7]:C[-2],5,FALSE) -> 19
A455: =R[-22]C+60 -> 1533 | B455: =VLOOKUP(RC[1],Sheet4!C[-1]:C[2],2,FALSE)&VLOOKUP(RC[1],Sheet4!C[-1]:C[2],3,FALSE)&RC[2]&VLOOKUP(RC[1],Sheet4!C[-1]:C[2],4,FALSE)&"（%s/"&RC[2]&"）" -> 圣器强化5次（%s/5） | C455: =R[-22]C -> 2 | D455: =R[-22]C -> 5 | E455: 0 | F455: =R[-22]C -> 13049 | G455: =R[-22]C -> 5 | H455: =VLOOKUP(RC[-5],Sheet4!C[-7]:C[-2],5,FALSE) -> 8
A456: =R[-22]C+60 -> 1541 | B456: =VLOOKUP(RC[1],Sheet4!C[-1]:C[2],2,FALSE)&VLOOKUP(RC[1],Sheet4!C[-1]:C[2],3,FALSE)&RC[2]&VLOOKUP(RC[1],Sheet4!C[-1]:C[2],4,FALSE)&"（%s/"&RC[2]&"）" -> 进行召唤5次（%s/5） | C456: =R[-22]C -> 8 | D456: =R[-22]C -> 5 | E456: 0 | F456: =R[-22]C -> 19006 | G456: =R[-22]C -> 80 | H456: =VLOOKUP(RC[-5],Sheet4!C[-7]:C[-2],5,FALSE) -> 9
A457: =R[-22]C+60 -> 1542 | B457: =VLOOKUP(RC[1],Sheet4!C[-1]:C[2],2,FALSE)&VLOOKUP(RC[1],Sheet4!C[-1]:C[2],3,FALSE)&RC[2]&VLOOKUP(RC[1],Sheet4!C[-1]:C[2],4,FALSE)&"（%s/"&RC[2]&"）" -> 进行高级召唤2次（%s/2） | C457: =R[-22]C -> 9 | D457: =R[-22]C -> 2 | E457: 0 | F457: =R[-22]C -> 19006 | G457: =R[-22]C -> 100 | H457: =VLOOKUP(RC[-5],Sheet4!C[-7]:C[-2],5,FALSE) -> 9
A458: =R[-22]C+60 -> 1543 | B458: =VLOOKUP(RC[1],Sheet4!C[-1]:C[2],2,FALSE)&VLOOKUP(RC[1],Sheet4!C[-1]:C[2],3,FALSE)&RC[2]&VLOOKUP(RC[1],Sheet4!C[-1]:C[2],4,FALSE)&"（%s/"&RC[2]&"）" -> 购买体力2次（%s/2） | C458: =R[-22]C -> 6 | D458: =R[-22]C -> 2 | E458: 0 | F458: =R[-22]C -> 19005 | G458: =R[-22]C -> 50 | H458: =VLOOKUP(RC[-5],Sheet4!C[-7]:C[-2],5,FALSE) -> 12
A459: =R[-22]C+60 -> 1544 | B459: =VLOOKUP(RC[1],Sheet4!C[-1]:C[2],2,FALSE)&VLOOKUP(RC[1],Sheet4!C[-1]:C[2],3,FALSE)&RC[2]&VLOOKUP(RC[1],Sheet4!C[-1]:C[2],4,FALSE)&"（%s/"&RC[2]&"）" -> 购买精力2次（%s/2） | C459: =R[-22]C -> 7 | D459: =R[-22]C -> 2 | E459: 0 | F459: =R[-22]C -> 19005 | G459: =R[-22]C -> 50 | H459: =VLOOKUP(RC[-5],Sheet4!C[-7]:C[-2],5,FALSE) -> 12
A460: =R[-22]C+60 -> 1551 | B460: =VLOOKUP(RC[1],Sheet4!C[-1]:C[2],2,FALSE)&VLOOKUP(RC[1],Sheet4!C[-1]:C[2],3,FALSE)&RC[2]&VLOOKUP(RC[1],Sheet4!C[-1]:C[2],4,FALSE)&"（%s/"&RC[2]&"）" -> 进入勇者试练战斗10次（%s/10） | C460: =R[-22]C -> 12 | D460: =R[-22]C -> 10 | E460: 0 | F460: =R[-22]C -> 19012 | G460: =R[-22]C -> 500 | H460: =VLOOKUP(RC[-5],Sheet4!C[-7]:C[-2],5,FALSE) -> 17
A461: =R[-22]C+60 -> 1552 | B461: =VLOOKUP(RC[1],Sheet4!C[-1]:C[2],2,FALSE)&VLOOKUP(RC[1],Sheet4!C[-1]:C[2],3,FALSE)&RC[2]&VLOOKUP(RC[1],Sheet4!C[-1]:C[2],4,FALSE)&"（%s/"&RC[2]&"）" -> 竞技场战斗5次（%s/5） | C461: =R[-22]C -> 10 | D461: =R[-22]C -> 5 | E461: 0 | F461: =R[-22]C -> 19013 | G461: =R[-22]C -> 500 | H461: =VLOOKUP(RC[-5],Sheet4!C[-7]:C[-2],5,FALSE) -> 21
A462: =R[-22]C+60 -> 1553 | B462: =VLOOKUP(RC[1],Sheet4!C[-1]:C[2],2,FALSE)&VLOOKUP(RC[1],Sheet4!C[-1]:C[2],3,FALSE)&RC[2]&VLOOKUP(RC[1],Sheet4!C[-1]:C[2],4,FALSE)&"（%s/"&RC[2]&"）" -> 主线副本挑战5次（%s/5） | C462: =R[-22]C -> 1 | D462: =R[-22]C -> 5 | E462: 0 | F462: =R[-22]C -> 19003 | G462: =R[-22]C -> 30000 | H462: =VLOOKUP(RC[-5],Sheet4!C[-7]:C[-2],5,FALSE) -> 26
A463: =R[-22]C+60 -> 1554 | B463: =VLOOKUP(RC[1],Sheet4!C[-1]:C[2],2,FALSE)&VLOOKUP(RC[1],Sheet4!C[-1]:C[2],3,FALSE)&RC[2]&VLOOKUP(RC[1],Sheet4!C[-1]:C[2],4,FALSE)&"（%s/"&RC[2]&"）" -> 日常副本战斗4次（%s/4） | C463: =R[-22]C -> 13 | D463: =R[-22]C -> 4 | E463: 0 | F463: =R[-22]C -> 19005 | G463: =R[-22]C -> 50 | H463: =VLOOKUP(RC[-5],Sheet4!C[-7]:C[-2],5,FALSE) -> 2
A464: =R[-22]C+60 -> 1561 | B464: =VLOOKUP(RC[1],Sheet4!C[-1]:C[2],2,FALSE)&VLOOKUP(RC[1],Sheet4!C[-1]:C[2],3,FALSE)&RC[2]&VLOOKUP(RC[1],Sheet4!C[-1]:C[2],4,FALSE)&"（%s/"&RC[2]&"）" -> 赠送好友精力3次（%s/3） | C464: =R[-22]C -> 4 | D464: =R[-22]C -> 3 | E464: 0 | F464: =R[-22]C -> 19005 | G464: =R[-22]C -> 50 | H464: =VLOOKUP(RC[-5],Sheet4!C[-7]:C[-2],5,FALSE) -> 15
A465: =R[-22]C+60 -> 1562 | B465: =VLOOKUP(RC[1],Sheet4!C[-1]:C[2],2,FALSE)&VLOOKUP(RC[1],Sheet4!C[-1]:C[2],3,FALSE)&RC[2]&VLOOKUP(RC[1],Sheet4!C[-1]:C[2],4,FALSE)&"（%s/"&RC[2]&"）" -> 英雄培养15次（%s/15） | C465: =R[-22]C -> 3 | D465: =R[-22]C -> 15 | E465: 0 | F465: =R[-22]C -> 10003 | G465: =R[-22]C -> 30 | H465: =VLOOKUP(RC[-5],Sheet4!C[-7]:C[-2],5,FALSE) -> 8
A466: =R[-22]C+60 -> 1563 | B466: =VLOOKUP(RC[1],Sheet4!C[-1]:C[2],2,FALSE)&VLOOKUP(RC[1],Sheet4!C[-1]:C[2],3,FALSE)&RC[2]&VLOOKUP(RC[1],Sheet4!C[-1]:C[2],4,FALSE)&"（%s/"&RC[2]&"）" -> 英雄商店购买1次（%s/1） | C466: =R[-22]C -> 5 | D466: =R[-22]C -> 1 | E466: 0 | F466: =R[-22]C -> 19006 | G466: =R[-22]C -> 80 | H466: =VLOOKUP(RC[-5],Sheet4!C[-7]:C[-2],5,FALSE) -> 11
A467: =R[-22]C+60 -> 1564 | B467: =VLOOKUP(RC[1],Sheet4!C[-1]:C[2],2,FALSE)&VLOOKUP(RC[1],Sheet4!C[-1]:C[2],3,FALSE)&RC[2]&VLOOKUP(RC[1],Sheet4!C[-1]:C[2],4,FALSE)&"（%s/"&RC[2]&"）" -> 遗迹探索4小时（%s/4） | C467: =R[-22]C -> 19 | D467: =R[-22]C -> 4 | E467: 0 | F467: =R[-22]C -> 19005 | G467: =R[-22]C -> 50 | H467: =VLOOKUP(RC[-5],Sheet4!C[-7]:C[-2],5,FALSE) -> 20
A468: =R[-22]C+60 -> 1571 | B468: =VLOOKUP(RC[1],Sheet4!C[-1]:C[2],2,FALSE)&VLOOKUP(RC[1],Sheet4!C[-1]:C[2],3,FALSE)&RC[2]&VLOOKUP(RC[1],Sheet4!C[-1]:C[2],4,FALSE)&"（%s/"&RC[2]&"）" -> 精英副本战斗1次（%s/1） | C468: =R[-22]C -> 15 | D468: =R[-22]C -> 1 | E468: 0 | F468: =R[-22]C -> 10008 | G468: =R[-22]C -> 30 | H468: =VLOOKUP(RC[-5],Sheet4!C[-7]:C[-2],5,FALSE) -> 28
A469: =R[-22]C+60 -> 1572 | B469: =VLOOKUP(RC[1],Sheet4!C[-1]:C[2],2,FALSE)&VLOOKUP(RC[1],Sheet4!C[-1]:C[2],3,FALSE)&RC[2]&VLOOKUP(RC[1],Sheet4!C[-1]:C[2],4,FALSE)&"（%s/"&RC[2]&"）" -> 异度入侵分享2次（%s/2） | C469: =R[-22]C -> 17 | D469: =R[-22]C -> 2 | E469: 0 | F469: =R[-22]C -> 19014 | G469: =R[-22]C -> 500 | H469: =VLOOKUP(RC[-5],Sheet4!C[-7]:C[-2],5,FALSE) -> 16
A470: =R[-22]C+60 -> 1573 | B470: =VLOOKUP(RC[1],Sheet4!C[-1]:C[2],2,FALSE)&VLOOKUP(RC[1],Sheet4!C[-1]:C[2],3,FALSE)&RC[2]&VLOOKUP(RC[1],Sheet4!C[-1]:C[2],4,FALSE)&"（%s/"&RC[2]&"）" -> 讨伐异度入侵者2次（%s/2） | C470: =R[-22]C -> 18 | D470: =R[-22]C -> 2 | E470: 0 | F470: =R[-22]C -> 19014 | G470: =R[-22]C -> 500 | H470: =VLOOKUP(RC[-5],Sheet4!C[-7]:C[-2],5,FALSE) -> 16
A471: =R[-22]C+60 -> 1574 | B471: =VLOOKUP(RC[1],Sheet4!C[-1]:C[2],2,FALSE)&VLOOKUP(RC[1],Sheet4!C[-1]:C[2],3,FALSE)&RC[2]&VLOOKUP(RC[1],Sheet4!C[-1]:C[2],4,FALSE)&"（%s/"&RC[2]&"）" -> 无尽深渊战斗1次（%s/1） | C471: =R[-22]C -> 23 | D471: =R[-22]C -> 1 | E471: 0 | F471: =R[-22]C -> 19028 | G471: =R[-22]C -> 50 | H471: =VLOOKUP(RC[-5],Sheet4!C[-7]:C[-2],5,FALSE) -> 88
A472: =R[-22]C+60 -> 1581 | B472: =VLOOKUP(RC[1],Sheet4!C[-1]:C[2],2,FALSE)&VLOOKUP(RC[1],Sheet4!C[-1]:C[2],3,FALSE)&RC[2]&VLOOKUP(RC[1],Sheet4!C[-1]:C[2],4,FALSE)&"（%s/"&RC[2]&"）" -> 击杀遗迹破坏者3次（%s/3） | C472: =R[-22]C -> 16 | D472: =R[-22]C -> 3 | E472: 0 | F472: =R[-22]C -> 19005 | G472: =R[-22]C -> 50 | H472: =VLOOKUP(RC[-5],Sheet4!C[-7]:C[-2],5,FALSE) -> 20
A473: =R[-22]C+60 -> 1582 | B473: =VLOOKUP(RC[1],Sheet4!C[-1]:C[2],2,FALSE)&VLOOKUP(RC[1],Sheet4!C[-1]:C[2],3,FALSE)&RC[2]&VLOOKUP(RC[1],Sheet4!C[-1]:C[2],4,FALSE)&"（%s/"&RC[2]&"）" -> 占卜翻牌5次（%s/5） | C473: =R[-22]C -> 25 | D473: =R[-22]C -> 5 | E473: 0 | F473: =R[-22]C -> 10096 | G473: =R[-22]C -> 1 | H473: =VLOOKUP(RC[-5],Sheet4!C[-7]:C[-2],5,FALSE) -> 113
A474: =R[-22]C+60 -> 1583 | B474: =VLOOKUP(RC[1],Sheet4!C[-1]:C[2],2,FALSE)&VLOOKUP(RC[1],Sheet4!C[-1]:C[2],3,FALSE)&RC[2]&VLOOKUP(RC[1],Sheet4!C[-1]:C[2],4,FALSE)&"（%s/"&RC[2]&"）" -> 英雄副本战斗1次（%s/1） | C474: =R[-22]C -> 14 | D474: =R[-22]C -> 1 | E474: 0 | F474: =R[-22]C -> 19006 | G474: =R[-22]C -> 80 | H474: =VLOOKUP(RC[-5],Sheet4!C[-7]:C[-2],5,FALSE) -> 27
A475: =R[-22]C+60 -> 1591 | B475: =VLOOKUP(RC[1],Sheet4!C[-1]:C[2],2,FALSE)&VLOOKUP(RC[1],Sheet4!C[-1]:C[2],3,FALSE)&RC[2]&VLOOKUP(RC[1],Sheet4!C[-1]:C[2],4,FALSE)&"（%s/"&RC[2]&"）" -> 圣器争夺5次（%s/5） | C475: =R[-22]C -> 11 | D475: =R[-22]C -> 5 | E475: 0 | F475: =R[-22]C -> 13049 | G475: =R[-22]C -> 5 | H475: =VLOOKUP(RC[-5],Sheet4!C[-7]:C[-2],5,FALSE) -> 19
A476: =R[-22]C+60 -> 1592 | B476: =VLOOKUP(RC[1],Sheet4!C[-1]:C[2],2,FALSE)&VLOOKUP(RC[1],Sheet4!C[-1]:C[2],3,FALSE)&RC[2]&VLOOKUP(RC[1],Sheet4!C[-1]:C[2],4,FALSE)&"（%s/"&RC[2]&"）" -> 圣器合成3次（%s/3） | C476: =R[-22]C -> 22 | D476: =R[-22]C -> 3 | E476: 0 | F476: =R[-22]C -> 13049 | G476: =R[-22]C -> 5 | H476: =VLOOKUP(RC[-5],Sheet4!C[-7]:C[-2],5,FALSE) -> 19
A477: =R[-22]C+60 -> 1593 | B477: =VLOOKUP(RC[1],Sheet4!C[-1]:C[2],2,FALSE)&VLOOKUP(RC[1],Sheet4!C[-1]:C[2],3,FALSE)&RC[2]&VLOOKUP(RC[1],Sheet4!C[-1]:C[2],4,FALSE)&"（%s/"&RC[2]&"）" -> 圣器强化5次（%s/5） | C477: =R[-22]C -> 2 | D477: =R[-22]C -> 5 | E477: 0 | F477: =R[-22]C -> 13049 | G477: =R[-22]C -> 5 | H477: =VLOOKUP(RC[-5],Sheet4!C[-7]:C[-2],5,FALSE) -> 8
A478: =R[-22]C+60 -> 1601 | B478: =VLOOKUP(RC[1],Sheet4!C[-1]:C[2],2,FALSE)&VLOOKUP(RC[1],Sheet4!C[-1]:C[2],3,FALSE)&RC[2]&VLOOKUP(RC[1],Sheet4!C[-1]:C[2],4,FALSE)&"（%s/"&RC[2]&"）" -> 进行召唤5次（%s/5） | C478: =R[-22]C -> 8 | D478: =R[-22]C -> 5 | E478: 0 | F478: =R[-22]C -> 19006 | G478: =R[-22]C -> 80 | H478: =VLOOKUP(RC[-5],Sheet4!C[-7]:C[-2],5,FALSE) -> 9
A479: =R[-22]C+60 -> 1602 | B479: =VLOOKUP(RC[1],Sheet4!C[-1]:C[2],2,FALSE)&VLOOKUP(RC[1],Sheet4!C[-1]:C[2],3,FALSE)&RC[2]&VLOOKUP(RC[1],Sheet4!C[-1]:C[2],4,FALSE)&"（%s/"&RC[2]&"）" -> 进行高级召唤2次（%s/2） | C479: =R[-22]C -> 9 | D479: =R[-22]C -> 2 | E479: 0 | F479: =R[-22]C -> 19006 | G479: =R[-22]C -> 100 | H479: =VLOOKUP(RC[-5],Sheet4!C[-7]:C[-2],5,FALSE) -> 9
A480: =R[-22]C+60 -> 1603 | B480: =VLOOKUP(RC[1],Sheet4!C[-1]:C[2],2,FALSE)&VLOOKUP(RC[1],Sheet4!C[-1]:C[2],3,FALSE)&RC[2]&VLOOKUP(RC[1],Sheet4!C[-1]:C[2],4,FALSE)&"（%s/"&RC[2]&"）" -> 购买体力2次（%s/2） | C480: =R[-22]C -> 6 | D480: =R[-22]C -> 2 | E480: 0 | F480: =R[-22]C -> 19005 | G480: =R[-22]C -> 50 | H480: =VLOOKUP(RC[-5],Sheet4!C[-7]:C[-2],5,FALSE) -> 12
A481: =R[-22]C+60 -> 1604 | B481: =VLOOKUP(RC[1],Sheet4!C[-1]:C[2],2,FALSE)&VLOOKUP(RC[1],Sheet4!C[-1]:C[2],3,FALSE)&RC[2]&VLOOKUP(RC[1],Sheet4!C[-1]:C[2],4,FALSE)&"（%s/"&RC[2]&"）" -> 购买精力2次（%s/2） | C481: =R[-22]C -> 7 | D481: =R[-22]C -> 2 | E481: 0 | F481: =R[-22]C -> 19005 | G481: =R[-22]C -> 50 | H481: =VLOOKUP(RC[-5],Sheet4!C[-7]:C[-2],5,FALSE) -> 12
A482: =R[-22]C+60 -> 1611 | B482: =VLOOKUP(RC[1],Sheet4!C[-1]:C[2],2,FALSE)&VLOOKUP(RC[1],Sheet4!C[-1]:C[2],3,FALSE)&RC[2]&VLOOKUP(RC[1],Sheet4!C[-1]:C[2],4,FALSE)&"（%s/"&RC[2]&"）" -> 进入勇者试练战斗10次（%s/10） | C482: =R[-22]C -> 12 | D482: =R[-22]C -> 10 | E482: 0 | F482: =R[-22]C -> 19012 | G482: =R[-22]C -> 500 | H482: =VLOOKUP(RC[-5],Sheet4!C[-7]:C[-2],5,FALSE) -> 17
A483: =R[-22]C+60 -> 1612 | B483: =VLOOKUP(RC[1],Sheet4!C[-1]:C[2],2,FALSE)&VLOOKUP(RC[1],Sheet4!C[-1]:C[2],3,FALSE)&RC[2]&VLOOKUP(RC[1],Sheet4!C[-1]:C[2],4,FALSE)&"（%s/"&RC[2]&"）" -> 竞技场战斗5次（%s/5） | C483: =R[-22]C -> 10 | D483: =R[-22]C -> 5 | E483: 0 | F483: =R[-22]C -> 19013 | G483: =R[-22]C -> 500 | H483: =VLOOKUP(RC[-5],Sheet4!C[-7]:C[-2],5,FALSE) -> 21
A484: =R[-22]C+60 -> 1613 | B484: =VLOOKUP(RC[1],Sheet4!C[-1]:C[2],2,FALSE)&VLOOKUP(RC[1],Sheet4!C[-1]:C[2],3,FALSE)&RC[2]&VLOOKUP(RC[1],Sheet4!C[-1]:C[2],4,FALSE)&"（%s/"&RC[2]&"）" -> 主线副本挑战5次（%s/5） | C484: =R[-22]C -> 1 | D484: =R[-22]C -> 5 | E484: 0 | F484: =R[-22]C -> 19003 | G484: =R[-22]C -> 30000 | H484: =VLOOKUP(RC[-5],Sheet4!C[-7]:C[-2],5,FALSE) -> 26
A485: =R[-22]C+60 -> 1614 | B485: =VLOOKUP(RC[1],Sheet4!C[-1]:C[2],2,FALSE)&VLOOKUP(RC[1],Sheet4!C[-1]:C[2],3,FALSE)&RC[2]&VLOOKUP(RC[1],Sheet4!C[-1]:C[2],4,FALSE)&"（%s/"&RC[2]&"）" -> 日常副本战斗4次（%s/4） | C485: =R[-22]C -> 13 | D485: =R[-22]C -> 4 | E485: 0 | F485: =R[-22]C -> 19005 | G485: =R[-22]C -> 50 | H485: =VLOOKUP(RC[-5],Sheet4!C[-7]:C[-2],5,FALSE) -> 2
A486: =R[-22]C+60 -> 1621 | B486: =VLOOKUP(RC[1],Sheet4!C[-1]:C[2],2,FALSE)&VLOOKUP(RC[1],Sheet4!C[-1]:C[2],3,FALSE)&RC[2]&VLOOKUP(RC[1],Sheet4!C[-1]:C[2],4,FALSE)&"（%s/"&RC[2]&"）" -> 赠送好友精力3次（%s/3） | C486: =R[-22]C -> 4 | D486: =R[-22]C -> 3 | E486: 0 | F486: =R[-22]C -> 19005 | G486: =R[-22]C -> 50 | H486: =VLOOKUP(RC[-5],Sheet4!C[-7]:C[-2],5,FALSE) -> 15
A487: =R[-22]C+60 -> 1622 | B487: =VLOOKUP(RC[1],Sheet4!C[-1]:C[2],2,FALSE)&VLOOKUP(RC[1],Sheet4!C[-1]:C[2],3,FALSE)&RC[2]&VLOOKUP(RC[1],Sheet4!C[-1]:C[2],4,FALSE)&"（%s/"&RC[2]&"）" -> 英雄培养15次（%s/15） | C487: =R[-22]C -> 3 | D487: =R[-22]C -> 15 | E487: 0 | F487: =R[-22]C -> 10003 | G487: =R[-22]C -> 30 | H487: =VLOOKUP(RC[-5],Sheet4!C[-7]:C[-2],5,FALSE) -> 8
A488: =R[-22]C+60 -> 1623 | B488: =VLOOKUP(RC[1],Sheet4!C[-1]:C[2],2,FALSE)&VLOOKUP(RC[1],Sheet4!C[-1]:C[2],3,FALSE)&RC[2]&VLOOKUP(RC[1],Sheet4!C[-1]:C[2],4,FALSE)&"（%s/"&RC[2]&"）" -> 英雄商店购买1次（%s/1） | C488: =R[-22]C -> 5 | D488: =R[-22]C -> 1 | E488: 0 | F488: =R[-22]C -> 19006 | G488: =R[-22]C -> 80 | H488: =VLOOKUP(RC[-5],Sheet4!C[-7]:C[-2],5,FALSE) -> 11
A489: =R[-22]C+60 -> 1624 | B489: =VLOOKUP(RC[1],Sheet4!C[-1]:C[2],2,FALSE)&VLOOKUP(RC[1],Sheet4!C[-1]:C[2],3,FALSE)&RC[2]&VLOOKUP(RC[1],Sheet4!C[-1]:C[2],4,FALSE)&"（%s/"&RC[2]&"）" -> 遗迹探索4小时（%s/4） | C489: =R[-22]C -> 19 | D489: =R[-22]C -> 4 | E489: 0 | F489: =R[-22]C -> 19005 | G489: =R[-22]C -> 50 | H489: =VLOOKUP(RC[-5],Sheet4!C[-7]:C[-2],5,FALSE) -> 20
A490: =R[-22]C+60 -> 1631 | B490: =VLOOKUP(RC[1],Sheet4!C[-1]:C[2],2,FALSE)&VLOOKUP(RC[1],Sheet4!C[-1]:C[2],3,FALSE)&RC[2]&VLOOKUP(RC[1],Sheet4!C[-1]:C[2],4,FALSE)&"（%s/"&RC[2]&"）" -> 精英副本战斗1次（%s/1） | C490: =R[-22]C -> 15 | D490: =R[-22]C -> 1 | E490: 0 | F490: =R[-22]C -> 10008 | G490: =R[-22]C -> 30 | H490: =VLOOKUP(RC[-5],Sheet4!C[-7]:C[-2],5,FALSE) -> 28
A491: =R[-22]C+60 -> 1632 | B491: =VLOOKUP(RC[1],Sheet4!C[-1]:C[2],2,FALSE)&VLOOKUP(RC[1],Sheet4!C[-1]:C[2],3,FALSE)&RC[2]&VLOOKUP(RC[1],Sheet4!C[-1]:C[2],4,FALSE)&"（%s/"&RC[2]&"）" -> 异度入侵分享2次（%s/2） | C491: =R[-22]C -> 17 | D491: =R[-22]C -> 2 | E491: 0 | F491: =R[-22]C -> 19014 | G491: =R[-22]C -> 500 | H491: =VLOOKUP(RC[-5],Sheet4!C[-7]:C[-2],5,FALSE) -> 16
A492: =R[-22]C+60 -> 1633 | B492: =VLOOKUP(RC[1],Sheet4!C[-1]:C[2],2,FALSE)&VLOOKUP(RC[1],Sheet4!C[-1]:C[2],3,FALSE)&RC[2]&VLOOKUP(RC[1],Sheet4!C[-1]:C[2],4,FALSE)&"（%s/"&RC[2]&"）" -> 讨伐异度入侵者2次（%s/2） | C492: =R[-22]C -> 18 | D492: =R[-22]C -> 2 | E492: 0 | F492: =R[-22]C -> 19014 | G492: =R[-22]C -> 500 | H492: =VLOOKUP(RC[-5],Sheet4!C[-7]:C[-2],5,FALSE) -> 16
A493: =R[-22]C+60 -> 1634 | B493: =VLOOKUP(RC[1],Sheet4!C[-1]:C[2],2,FALSE)&VLOOKUP(RC[1],Sheet4!C[-1]:C[2],3,FALSE)&RC[2]&VLOOKUP(RC[1],Sheet4!C[-1]:C[2],4,FALSE)&"（%s/"&RC[2]&"）" -> 无尽深渊战斗1次（%s/1） | C493: =R[-22]C -> 23 | D493: =R[-22]C -> 1 | E493: 0 | F493: =R[-22]C -> 19028 | G493: =R[-22]C -> 50 | H493: =VLOOKUP(RC[-5],Sheet4!C[-7]:C[-2],5,FALSE) -> 88
A494: =R[-22]C+60 -> 1641 | B494: =VLOOKUP(RC[1],Sheet4!C[-1]:C[2],2,FALSE)&VLOOKUP(RC[1],Sheet4!C[-1]:C[2],3,FALSE)&RC[2]&VLOOKUP(RC[1],Sheet4!C[-1]:C[2],4,FALSE)&"（%s/"&RC[2]&"）" -> 击杀遗迹破坏者3次（%s/3） | C494: =R[-22]C -> 16 | D494: =R[-22]C -> 3 | E494: 0 | F494: =R[-22]C -> 19005 | G494: =R[-22]C -> 50 | H494: =VLOOKUP(RC[-5],Sheet4!C[-7]:C[-2],5,FALSE) -> 20
A495: =R[-22]C+60 -> 1642 | B495: =VLOOKUP(RC[1],Sheet4!C[-1]:C[2],2,FALSE)&VLOOKUP(RC[1],Sheet4!C[-1]:C[2],3,FALSE)&RC[2]&VLOOKUP(RC[1],Sheet4!C[-1]:C[2],4,FALSE)&"（%s/"&RC[2]&"）" -> 占卜翻牌5次（%s/5） | C495: =R[-22]C -> 25 | D495: =R[-22]C -> 5 | E495: 0 | F495: =R[-22]C -> 10096 | G495: =R[-22]C -> 1 | H495: =VLOOKUP(RC[-5],Sheet4!C[-7]:C[-2],5,FALSE) -> 113
A496: =R[-22]C+60 -> 1643 | B496: =VLOOKUP(RC[1],Sheet4!C[-1]:C[2],2,FALSE)&VLOOKUP(RC[1],Sheet4!C[-1]:C[2],3,FALSE)&RC[2]&VLOOKUP(RC[1],Sheet4!C[-1]:C[2],4,FALSE)&"（%s/"&RC[2]&"）" -> 英雄副本战斗1次（%s/1） | C496: =R[-22]C -> 14 | D496: =R[-22]C -> 1 | E496: 0 | F496: =R[-22]C -> 19006 | G496: =R[-22]C -> 80 | H496: =VLOOKUP(RC[-5],Sheet4!C[-7]:C[-2],5,FALSE) -> 27
A497: =R[-22]C+60 -> 1651 | B497: =VLOOKUP(RC[1],Sheet4!C[-1]:C[2],2,FALSE)&VLOOKUP(RC[1],Sheet4!C[-1]:C[2],3,FALSE)&RC[2]&VLOOKUP(RC[1],Sheet4!C[-1]:C[2],4,FALSE)&"（%s/"&RC[2]&"）" -> 圣器争夺5次（%s/5） | C497: =R[-22]C -> 11 | D497: =R[-22]C -> 5 | E497: 0 | F497: =R[-22]C -> 13049 | G497: =R[-22]C -> 5 | H497: =VLOOKUP(RC[-5],Sheet4!C[-7]:C[-2],5,FALSE) -> 19
A498: =R[-22]C+60 -> 1652 | B498: =VLOOKUP(RC[1],Sheet4!C[-1]:C[2],2,FALSE)&VLOOKUP(RC[1],Sheet4!C[-1]:C[2],3,FALSE)&RC[2]&VLOOKUP(RC[1],Sheet4!C[-1]:C[2],4,FALSE)&"（%s/"&RC[2]&"）" -> 圣器合成3次（%s/3） | C498: =R[-22]C -> 22 | D498: =R[-22]C -> 3 | E498: 0 | F498: =R[-22]C -> 13049 | G498: =R[-22]C -> 5 | H498: =VLOOKUP(RC[-5],Sheet4!C[-7]:C[-2],5,FALSE) -> 19
A499: =R[-22]C+60 -> 1653 | B499: =VLOOKUP(RC[1],Sheet4!C[-1]:C[2],2,FALSE)&VLOOKUP(RC[1],Sheet4!C[-1]:C[2],3,FALSE)&RC[2]&VLOOKUP(RC[1],Sheet4!C[-1]:C[2],4,FALSE)&"（%s/"&RC[2]&"）" -> 圣器强化5次（%s/5） | C499: =R[-22]C -> 2 | D499: =R[-22]C -> 5 | E499: 0 | F499: =R[-22]C -> 13049 | G499: =R[-22]C -> 5 | H499: =VLOOKUP(RC[-5],Sheet4!C[-7]:C[-2],5,FALSE) -> 8
A500: =R[-22]C+60 -> 1661 | B500: =VLOOKUP(RC[1],Sheet4!C[-1]:C[2],2,FALSE)&VLOOKUP(RC[1],Sheet4!C[-1]:C[2],3,FALSE)&RC[2]&VLOOKUP(RC[1],Sheet4!C[-1]:C[2],4,FALSE)&"（%s/"&RC[2]&"）" -> 进行召唤5次（%s/5） | C500: =R[-22]C -> 8 | D500: =R[-22]C -> 5 | E500: 0 | F500: =R[-22]C -> 19006 | G500: =R[-22]C -> 80 | H500: =VLOOKUP(RC[-5],Sheet4!C[-7]:C[-2],5,FALSE) -> 9
A501: =R[-22]C+60 -> 1662 | B501: =VLOOKUP(RC[1],Sheet4!C[-1]:C[2],2,FALSE)&VLOOKUP(RC[1],Sheet4!C[-1]:C[2],3,FALSE)&RC[2]&VLOOKUP(RC[1],Sheet4!C[-1]:C[2],4,FALSE)&"（%s/"&RC[2]&"）" -> 进行高级召唤2次（%s/2） | C501: =R[-22]C -> 9 | D501: =R[-22]C -> 2 | E501: 0 | F501: =R[-22]C -> 19006 | G501: =R[-22]C -> 100 | H501: =VLOOKUP(RC[-5],Sheet4!C[-7]:C[-2],5,FALSE) -> 9
A502: =R[-22]C+60 -> 1663 | B502: =VLOOKUP(RC[1],Sheet4!C[-1]:C[2],2,FALSE)&VLOOKUP(RC[1],Sheet4!C[-1]:C[2],3,FALSE)&RC[2]&VLOOKUP(RC[1],Sheet4!C[-1]:C[2],4,FALSE)&"（%s/"&RC[2]&"）" -> 购买体力2次（%s/2） | C502: =R[-22]C -> 6 | D502: =R[-22]C -> 2 | E502: 0 | F502: =R[-22]C -> 19005 | G502: =R[-22]C -> 50 | H502: =VLOOKUP(RC[-5],Sheet4!C[-7]:C[-2],5,FALSE) -> 12
A503: =R[-22]C+60 -> 1664 | B503: =VLOOKUP(RC[1],Sheet4!C[-1]:C[2],2,FALSE)&VLOOKUP(RC[1],Sheet4!C[-1]:C[2],3,FALSE)&RC[2]&VLOOKUP(RC[1],Sheet4!C[-1]:C[2],4,FALSE)&"（%s/"&RC[2]&"）" -> 购买精力2次（%s/2） | C503: =R[-22]C -> 7 | D503: =R[-22]C -> 2 | E503: 0 | F503: =R[-22]C -> 19005 | G503: =R[-22]C -> 50 | H503: =VLOOKUP(RC[-5],Sheet4!C[-7]:C[-2],5,FALSE) -> 12
A504: =R[-22]C+60 -> 1671 | B504: =VLOOKUP(RC[1],Sheet4!C[-1]:C[2],2,FALSE)&VLOOKUP(RC[1],Sheet4!C[-1]:C[2],3,FALSE)&RC[2]&VLOOKUP(RC[1],Sheet4!C[-1]:C[2],4,FALSE)&"（%s/"&RC[2]&"）" -> 进入勇者试练战斗10次（%s/10） | C504: =R[-22]C -> 12 | D504: =R[-22]C -> 10 | E504: 0 | F504: =R[-22]C -> 19012 | G504: =R[-22]C -> 500 | H504: =VLOOKUP(RC[-5],Sheet4!C[-7]:C[-2],5,FALSE) -> 17
A505: =R[-22]C+60 -> 1672 | B505: =VLOOKUP(RC[1],Sheet4!C[-1]:C[2],2,FALSE)&VLOOKUP(RC[1],Sheet4!C[-1]:C[2],3,FALSE)&RC[2]&VLOOKUP(RC[1],Sheet4!C[-1]:C[2],4,FALSE)&"（%s/"&RC[2]&"）" -> 竞技场战斗5次（%s/5） | C505: =R[-22]C -> 10 | D505: =R[-22]C -> 5 | E505: 0 | F505: =R[-22]C -> 19013 | G505: =R[-22]C -> 500 | H505: =VLOOKUP(RC[-5],Sheet4!C[-7]:C[-2],5,FALSE) -> 21
A506: =R[-22]C+60 -> 1673 | B506: =VLOOKUP(RC[1],Sheet4!C[-1]:C[2],2,FALSE)&VLOOKUP(RC[1],Sheet4!C[-1]:C[2],3,FALSE)&RC[2]&VLOOKUP(RC[1],Sheet4!C[-1]:C[2],4,FALSE)&"（%s/"&RC[2]&"）" -> 主线副本挑战5次（%s/5） | C506: =R[-22]C -> 1 | D506: =R[-22]C -> 5 | E506: 0 | F506: =R[-22]C -> 19003 | G506: =R[-22]C -> 30000 | H506: =VLOOKUP(RC[-5],Sheet4!C[-7]:C[-2],5,FALSE) -> 26
A507: =R[-22]C+60 -> 1674 | B507: =VLOOKUP(RC[1],Sheet4!C[-1]:C[2],2,FALSE)&VLOOKUP(RC[1],Sheet4!C[-1]:C[2],3,FALSE)&RC[2]&VLOOKUP(RC[1],Sheet4!C[-1]:C[2],4,FALSE)&"（%s/"&RC[2]&"）" -> 日常副本战斗4次（%s/4） | C507: =R[-22]C -> 13 | D507: =R[-22]C -> 4 | E507: 0 | F507: =R[-22]C -> 19005 | G507: =R[-22]C -> 50 | H507: =VLOOKUP(RC[-5],Sheet4!C[-7]:C[-2],5,FALSE) -> 2
A508: =R[-22]C+60 -> 1681 | B508: =VLOOKUP(RC[1],Sheet4!C[-1]:C[2],2,FALSE)&VLOOKUP(RC[1],Sheet4!C[-1]:C[2],3,FALSE)&RC[2]&VLOOKUP(RC[1],Sheet4!C[-1]:C[2],4,FALSE)&"（%s/"&RC[2]&"）" -> 赠送好友精力3次（%s/3） | C508: =R[-22]C -> 4 | D508: =R[-22]C -> 3 | E508: 0 | F508: =R[-22]C -> 19005 | G508: =R[-22]C -> 50 | H508: =VLOOKUP(RC[-5],Sheet4!C[-7]:C[-2],5,FALSE) -> 15
A509: =R[-22]C+60 -> 1682 | B509: =VLOOKUP(RC[1],Sheet4!C[-1]:C[2],2,FALSE)&VLOOKUP(RC[1],Sheet4!C[-1]:C[2],3,FALSE)&RC[2]&VLOOKUP(RC[1],Sheet4!C[-1]:C[2],4,FALSE)&"（%s/"&RC[2]&"）" -> 英雄培养15次（%s/15） | C509: =R[-22]C -> 3 | D509: =R[-22]C -> 15 | E509: 0 | F509: =R[-22]C -> 10003 | G509: =R[-22]C -> 30 | H509: =VLOOKUP(RC[-5],Sheet4!C[-7]:C[-2],5,FALSE) -> 8
A510: =R[-22]C+60 -> 1683 | B510: =VLOOKUP(RC[1],Sheet4!C[-1]:C[2],2,FALSE)&VLOOKUP(RC[1],Sheet4!C[-1]:C[2],3,FALSE)&RC[2]&VLOOKUP(RC[1],Sheet4!C[-1]:C[2],4,FALSE)&"（%s/"&RC[2]&"）" -> 英雄商店购买1次（%s/1） | C510: =R[-22]C -> 5 | D510: =R[-22]C -> 1 | E510: 0 | F510: =R[-22]C -> 19006 | G510: =R[-22]C -> 80 | H510: =VLOOKUP(RC[-5],Sheet4!C[-7]:C[-2],5,FALSE) -> 11
A511: =R[-22]C+60 -> 1684 | B511: =VLOOKUP(RC[1],Sheet4!C[-1]:C[2],2,FALSE)&VLOOKUP(RC[1],Sheet4!C[-1]:C[2],3,FALSE)&RC[2]&VLOOKUP(RC[1],Sheet4!C[-1]:C[2],4,FALSE)&"（%s/"&RC[2]&"）" -> 遗迹探索4小时（%s/4） | C511: =R[-22]C -> 19 | D511: =R[-22]C -> 4 | E511: 0 | F511: =R[-22]C -> 19005 | G511: =R[-22]C -> 50 | H511: =VLOOKUP(RC[-5],Sheet4!C[-7]:C[-2],5,FALSE) -> 20
A512: =R[-22]C+60 -> 1691 | B512: =VLOOKUP(RC[1],Sheet4!C[-1]:C[2],2,FALSE)&VLOOKUP(RC[1],Sheet4!C[-1]:C[2],3,FALSE)&RC[2]&VLOOKUP(RC[1],Sheet4!C[-1]:C[2],4,FALSE)&"（%s/"&RC[2]&"）" -> 精英副本战斗1次（%s/1） | C512: =R[-22]C -> 15 | D512: =R[-22]C -> 1 | E512: 0 | F512: =R[-22]C -> 10008 | G512: =R[-22]C -> 30 | H512: =VLOOKUP(RC[-5],Sheet4!C[-7]:C[-2],5,FALSE) -> 28
A513: =R[-22]C+60 -> 1692 | B513: =VLOOKUP(RC[1],Sheet4!C[-1]:C[2],2,FALSE)&VLOOKUP(RC[1],Sheet4!C[-1]:C[2],3,FALSE)&RC[2]&VLOOKUP(RC[1],Sheet4!C[-1]:C[2],4,FALSE)&"（%s/"&RC[2]&"）" -> 异度入侵分享2次（%s/2） | C513: =R[-22]C -> 17 | D513: =R[-22]C -> 2 | E513: 0 | F513: =R[-22]C -> 19014 | G513: =R[-22]C -> 500 | H513: =VLOOKUP(RC[-5],Sheet4!C[-7]:C[-2],5,FALSE) -> 16
A514: =R[-22]C+60 -> 1693 | B514: =VLOOKUP(RC[1],Sheet4!C[-1]:C[2],2,FALSE)&VLOOKUP(RC[1],Sheet4!C[-1]:C[2],3,FALSE)&RC[2]&VLOOKUP(RC[1],Sheet4!C[-1]:C[2],4,FALSE)&"（%s/"&RC[2]&"）" -> 讨伐异度入侵者2次（%s/2） | C514: =R[-22]C -> 18 | D514: =R[-22]C -> 2 | E514: 0 | F514: =R[-22]C -> 19014 | G514: =R[-22]C -> 500 | H514: =VLOOKUP(RC[-5],Sheet4!C[-7]:C[-2],5,FALSE) -> 16
A515: =R[-22]C+60 -> 1694 | B515: =VLOOKUP(RC[1],Sheet4!C[-1]:C[2],2,FALSE)&VLOOKUP(RC[1],Sheet4!C[-1]:C[2],3,FALSE)&RC[2]&VLOOKUP(RC[1],Sheet4!C[-1]:C[2],4,FALSE)&"（%s/"&RC[2]&"）" -> 无尽深渊战斗1次（%s/1） | C515: =R[-22]C -> 23 | D515: =R[-22]C -> 1 | E515: 0 | F515: =R[-22]C -> 19028 | G515: =R[-22]C -> 50 | H515: =VLOOKUP(RC[-5],Sheet4!C[-7]:C[-2],5,FALSE) -> 88
A516: =R[-22]C+60 -> 1701 | B516: =VLOOKUP(RC[1],Sheet4!C[-1]:C[2],2,FALSE)&VLOOKUP(RC[1],Sheet4!C[-1]:C[2],3,FALSE)&RC[2]&VLOOKUP(RC[1],Sheet4!C[-1]:C[2],4,FALSE)&"（%s/"&RC[2]&"）" -> 击杀遗迹破坏者3次（%s/3） | C516: =R[-22]C -> 16 | D516: =R[-22]C -> 3 | E516: 0 | F516: =R[-22]C -> 19005 | G516: =R[-22]C -> 50 | H516: =VLOOKUP(RC[-5],Sheet4!C[-7]:C[-2],5,FALSE) -> 20
A517: =R[-22]C+60 -> 1702 | B517: =VLOOKUP(RC[1],Sheet4!C[-1]:C[2],2,FALSE)&VLOOKUP(RC[1],Sheet4!C[-1]:C[2],3,FALSE)&RC[2]&VLOOKUP(RC[1],Sheet4!C[-1]:C[2],4,FALSE)&"（%s/"&RC[2]&"）" -> 占卜翻牌5次（%s/5） | C517: =R[-22]C -> 25 | D517: =R[-22]C -> 5 | E517: 0 | F517: =R[-22]C -> 10096 | G517: =R[-22]C -> 1 | H517: =VLOOKUP(RC[-5],Sheet4!C[-7]:C[-2],5,FALSE) -> 113
A518: =R[-22]C+60 -> 1703 | B518: =VLOOKUP(RC[1],Sheet4!C[-1]:C[2],2,FALSE)&VLOOKUP(RC[1],Sheet4!C[-1]:C[2],3,FALSE)&RC[2]&VLOOKUP(RC[1],Sheet4!C[-1]:C[2],4,FALSE)&"（%s/"&RC[2]&"）" -> 英雄副本战斗1次（%s/1） | C518: =R[-22]C -> 14 | D518: =R[-22]C -> 1 | E518: 0 | F518: =R[-22]C -> 19006 | G518: =R[-22]C -> 80 | H518: =VLOOKUP(RC[-5],Sheet4!C[-7]:C[-2],5,FALSE) -> 27
A519: =R[-22]C+60 -> 1711 | B519: =VLOOKUP(RC[1],Sheet4!C[-1]:C[2],2,FALSE)&VLOOKUP(RC[1],Sheet4!C[-1]:C[2],3,FALSE)&RC[2]&VLOOKUP(RC[1],Sheet4!C[-1]:C[2],4,FALSE)&"（%s/"&RC[2]&"）" -> 圣器争夺5次（%s/5） | C519: =R[-22]C -> 11 | D519: =R[-22]C -> 5 | E519: 0 | F519: =R[-22]C -> 13049 | G519: =R[-22]C -> 5 | H519: =VLOOKUP(RC[-5],Sheet4!C[-7]:C[-2],5,FALSE) -> 19
A520: =R[-22]C+60 -> 1712 | B520: =VLOOKUP(RC[1],Sheet4!C[-1]:C[2],2,FALSE)&VLOOKUP(RC[1],Sheet4!C[-1]:C[2],3,FALSE)&RC[2]&VLOOKUP(RC[1],Sheet4!C[-1]:C[2],4,FALSE)&"（%s/"&RC[2]&"）" -> 圣器合成3次（%s/3） | C520: =R[-22]C -> 22 | D520: =R[-22]C -> 3 | E520: 0 | F520: =R[-22]C -> 13049 | G520: =R[-22]C -> 5 | H520: =VLOOKUP(RC[-5],Sheet4!C[-7]:C[-2],5,FALSE) -> 19
A521: =R[-22]C+60 -> 1713 | B521: =VLOOKUP(RC[1],Sheet4!C[-1]:C[2],2,FALSE)&VLOOKUP(RC[1],Sheet4!C[-1]:C[2],3,FALSE)&RC[2]&VLOOKUP(RC[1],Sheet4!C[-1]:C[2],4,FALSE)&"（%s/"&RC[2]&"）" -> 圣器强化5次（%s/5） | C521: =R[-22]C -> 2 | D521: =R[-22]C -> 5 | E521: 0 | F521: =R[-22]C -> 13049 | G521: =R[-22]C -> 5 | H521: =VLOOKUP(RC[-5],Sheet4!C[-7]:C[-2],5,FALSE) -> 8
A522: =R[-22]C+60 -> 1721 | B522: =VLOOKUP(RC[1],Sheet4!C[-1]:C[2],2,FALSE)&VLOOKUP(RC[1],Sheet4!C[-1]:C[2],3,FALSE)&RC[2]&VLOOKUP(RC[1],Sheet4!C[-1]:C[2],4,FALSE)&"（%s/"&RC[2]&"）" -> 进行召唤5次（%s/5） | C522: =R[-22]C -> 8 | D522: =R[-22]C -> 5 | E522: 0 | F522: =R[-22]C -> 19006 | G522: =R[-22]C -> 80 | H522: =VLOOKUP(RC[-5],Sheet4!C[-7]:C[-2],5,FALSE) -> 9
A523: =R[-22]C+60 -> 1722 | B523: =VLOOKUP(RC[1],Sheet4!C[-1]:C[2],2,FALSE)&VLOOKUP(RC[1],Sheet4!C[-1]:C[2],3,FALSE)&RC[2]&VLOOKUP(RC[1],Sheet4!C[-1]:C[2],4,FALSE)&"（%s/"&RC[2]&"）" -> 进行高级召唤2次（%s/2） | C523: =R[-22]C -> 9 | D523: =R[-22]C -> 2 | E523: 0 | F523: =R[-22]C -> 19006 | G523: =R[-22]C -> 100 | H523: =VLOOKUP(RC[-5],Sheet4!C[-7]:C[-2],5,FALSE) -> 9
A524: =R[-22]C+60 -> 1723 | B524: =VLOOKUP(RC[1],Sheet4!C[-1]:C[2],2,FALSE)&VLOOKUP(RC[1],Sheet4!C[-1]:C[2],3,FALSE)&RC[2]&VLOOKUP(RC[1],Sheet4!C[-1]:C[2],4,FALSE)&"（%s/"&RC[2]&"）" -> 购买体力2次（%s/2） | C524: =R[-22]C -> 6 | D524: =R[-22]C -> 2 | E524: 0 | F524: =R[-22]C -> 19005 | G524: =R[-22]C -> 50 | H524: =VLOOKUP(RC[-5],Sheet4!C[-7]:C[-2],5,FALSE) -> 12
A525: =R[-22]C+60 -> 1724 | B525: =VLOOKUP(RC[1],Sheet4!C[-1]:C[2],2,FALSE)&VLOOKUP(RC[1],Sheet4!C[-1]:C[2],3,FALSE)&RC[2]&VLOOKUP(RC[1],Sheet4!C[-1]:C[2],4,FALSE)&"（%s/"&RC[2]&"）" -> 购买精力2次（%s/2） | C525: =R[-22]C -> 7 | D525: =R[-22]C -> 2 | E525: 0 | F525: =R[-22]C -> 19005 | G525: =R[-22]C -> 50 | H525: =VLOOKUP(RC[-5],Sheet4!C[-7]:C[-2],5,FALSE) -> 12
A526: =R[-22]C+60 -> 1731 | B526: =VLOOKUP(RC[1],Sheet4!C[-1]:C[2],2,FALSE)&VLOOKUP(RC[1],Sheet4!C[-1]:C[2],3,FALSE)&RC[2]&VLOOKUP(RC[1],Sheet4!C[-1]:C[2],4,FALSE)&"（%s/"&RC[2]&"）" -> 进入勇者试练战斗10次（%s/10） | C526: =R[-22]C -> 12 | D526: =R[-22]C -> 10 | E526: 0 | F526: =R[-22]C -> 19012 | G526: =R[-22]C -> 500 | H526: =VLOOKUP(RC[-5],Sheet4!C[-7]:C[-2],5,FALSE) -> 17
A527: =R[-22]C+60 -> 1732 | B527: =VLOOKUP(RC[1],Sheet4!C[-1]:C[2],2,FALSE)&VLOOKUP(RC[1],Sheet4!C[-1]:C[2],3,FALSE)&RC[2]&VLOOKUP(RC[1],Sheet4!C[-1]:C[2],4,FALSE)&"（%s/"&RC[2]&"）" -> 竞技场战斗5次（%s/5） | C527: =R[-22]C -> 10 | D527: =R[-22]C -> 5 | E527: 0 | F527: =R[-22]C -> 19013 | G527: =R[-22]C -> 500 | H527: =VLOOKUP(RC[-5],Sheet4!C[-7]:C[-2],5,FALSE) -> 21
A528: =R[-22]C+60 -> 1733 | B528: =VLOOKUP(RC[1],Sheet4!C[-1]:C[2],2,FALSE)&VLOOKUP(RC[1],Sheet4!C[-1]:C[2],3,FALSE)&RC[2]&VLOOKUP(RC[1],Sheet4!C[-1]:C[2],4,FALSE)&"（%s/"&RC[2]&"）" -> 主线副本挑战5次（%s/5） | C528: =R[-22]C -> 1 | D528: =R[-22]C -> 5 | E528: 0 | F528: =R[-22]C -> 19003 | G528: =R[-22]C -> 30000 | H528: =VLOOKUP(RC[-5],Sheet4!C[-7]:C[-2],5,FALSE) -> 26
A529: =R[-22]C+60 -> 1734 | B529: =VLOOKUP(RC[1],Sheet4!C[-1]:C[2],2,FALSE)&VLOOKUP(RC[1],Sheet4!C[-1]:C[2],3,FALSE)&RC[2]&VLOOKUP(RC[1],Sheet4!C[-1]:C[2],4,FALSE)&"（%s/"&RC[2]&"）" -> 日常副本战斗4次（%s/4） | C529: =R[-22]C -> 13 | D529: =R[-22]C -> 4 | E529: 0 | F529: =R[-22]C -> 19005 | G529: =R[-22]C -> 50 | H529: =VLOOKUP(RC[-5],Sheet4!C[-7]:C[-2],5,FALSE) -> 2
A530: =R[-22]C+60 -> 1741 | B530: =VLOOKUP(RC[1],Sheet4!C[-1]:C[2],2,FALSE)&VLOOKUP(RC[1],Sheet4!C[-1]:C[2],3,FALSE)&RC[2]&VLOOKUP(RC[1],Sheet4!C[-1]:C[2],4,FALSE)&"（%s/"&RC[2]&"）" -> 赠送好友精力3次（%s/3） | C530: =R[-22]C -> 4 | D530: =R[-22]C -> 3 | E530: 0 | F530: =R[-22]C -> 19005 | G530: =R[-22]C -> 50 | H530: =VLOOKUP(RC[-5],Sheet4!C[-7]:C[-2],5,FALSE) -> 15
A531: =R[-22]C+60 -> 1742 | B531: =VLOOKUP(RC[1],Sheet4!C[-1]:C[2],2,FALSE)&VLOOKUP(RC[1],Sheet4!C[-1]:C[2],3,FALSE)&RC[2]&VLOOKUP(RC[1],Sheet4!C[-1]:C[2],4,FALSE)&"（%s/"&RC[2]&"）" -> 英雄培养15次（%s/15） | C531: =R[-22]C -> 3 | D531: =R[-22]C -> 15 | E531: 0 | F531: =R[-22]C -> 10003 | G531: =R[-22]C -> 30 | H531: =VLOOKUP(RC[-5],Sheet4!C[-7]:C[-2],5,FALSE) -> 8
A532: =R[-22]C+60 -> 1743 | B532: =VLOOKUP(RC[1],Sheet4!C[-1]:C[2],2,FALSE)&VLOOKUP(RC[1],Sheet4!C[-1]:C[2],3,FALSE)&RC[2]&VLOOKUP(RC[1],Sheet4!C[-1]:C[2],4,FALSE)&"（%s/"&RC[2]&"）" -> 英雄商店购买1次（%s/1） | C532: =R[-22]C -> 5 | D532: =R[-22]C -> 1 | E532: 0 | F532: =R[-22]C -> 19006 | G532: =R[-22]C -> 80 | H532: =VLOOKUP(RC[-5],Sheet4!C[-7]:C[-2],5,FALSE) -> 11
A533: =R[-22]C+60 -> 1744 | B533: =VLOOKUP(RC[1],Sheet4!C[-1]:C[2],2,FALSE)&VLOOKUP(RC[1],Sheet4!C[-1]:C[2],3,FALSE)&RC[2]&VLOOKUP(RC[1],Sheet4!C[-1]:C[2],4,FALSE)&"（%s/"&RC[2]&"）" -> 遗迹探索4小时（%s/4） | C533: =R[-22]C -> 19 | D533: =R[-22]C -> 4 | E533: 0 | F533: =R[-22]C -> 19005 | G533: =R[-22]C -> 50 | H533: =VLOOKUP(RC[-5],Sheet4!C[-7]:C[-2],5,FALSE) -> 20
A534: =R[-22]C+60 -> 1751 | B534: =VLOOKUP(RC[1],Sheet4!C[-1]:C[2],2,FALSE)&VLOOKUP(RC[1],Sheet4!C[-1]:C[2],3,FALSE)&RC[2]&VLOOKUP(RC[1],Sheet4!C[-1]:C[2],4,FALSE)&"（%s/"&RC[2]&"）" -> 精英副本战斗1次（%s/1） | C534: =R[-22]C -> 15 | D534: =R[-22]C -> 1 | E534: 0 | F534: =R[-22]C -> 10008 | G534: =R[-22]C -> 30 | H534: =VLOOKUP(RC[-5],Sheet4!C[-7]:C[-2],5,FALSE) -> 28
A535: =R[-22]C+60 -> 1752 | B535: =VLOOKUP(RC[1],Sheet4!C[-1]:C[2],2,FALSE)&VLOOKUP(RC[1],Sheet4!C[-1]:C[2],3,FALSE)&RC[2]&VLOOKUP(RC[1],Sheet4!C[-1]:C[2],4,FALSE)&"（%s/"&RC[2]&"）" -> 异度入侵分享2次（%s/2） | C535: =R[-22]C -> 17 | D535: =R[-22]C -> 2 | E535: 0 | F535: =R[-22]C -> 19014 | G535: =R[-22]C -> 500 | H535: =VLOOKUP(RC[-5],Sheet4!C[-7]:C[-2],5,FALSE) -> 16
A536: =R[-22]C+60 -> 1753 | B536: =VLOOKUP(RC[1],Sheet4!C[-1]:C[2],2,FALSE)&VLOOKUP(RC[1],Sheet4!C[-1]:C[2],3,FALSE)&RC[2]&VLOOKUP(RC[1],Sheet4!C[-1]:C[2],4,FALSE)&"（%s/"&RC[2]&"）" -> 讨伐异度入侵者2次（%s/2） | C536: =R[-22]C -> 18 | D536: =R[-22]C -> 2 | E536: 0 | F536: =R[-22]C -> 19014 | G536: =R[-22]C -> 500 | H536: =VLOOKUP(RC[-5],Sheet4!C[-7]:C[-2],5,FALSE) -> 16
A537: =R[-22]C+60 -> 1754 | B537: =VLOOKUP(RC[1],Sheet4!C[-1]:C[2],2,FALSE)&VLOOKUP(RC[1],Sheet4!C[-1]:C[2],3,FALSE)&RC[2]&VLOOKUP(RC[1],Sheet4!C[-1]:C[2],4,FALSE)&"（%s/"&RC[2]&"）" -> 无尽深渊战斗1次（%s/1） | C537: =R[-22]C -> 23 | D537: =R[-22]C -> 1 | E537: 0 | F537: =R[-22]C -> 19028 | G537: =R[-22]C -> 50 | H537: =VLOOKUP(RC[-5],Sheet4!C[-7]:C[-2],5,FALSE) -> 88
A538: =R[-22]C+60 -> 1761 | B538: =VLOOKUP(RC[1],Sheet4!C[-1]:C[2],2,FALSE)&VLOOKUP(RC[1],Sheet4!C[-1]:C[2],3,FALSE)&RC[2]&VLOOKUP(RC[1],Sheet4!C[-1]:C[2],4,FALSE)&"（%s/"&RC[2]&"）" -> 击杀遗迹破坏者3次（%s/3） | C538: =R[-22]C -> 16 | D538: =R[-22]C -> 3 | E538: 0 | F538: =R[-22]C -> 19005 | G538: =R[-22]C -> 50 | H538: =VLOOKUP(RC[-5],Sheet4!C[-7]:C[-2],5,FALSE) -> 20
A539: =R[-22]C+60 -> 1762 | B539: =VLOOKUP(RC[1],Sheet4!C[-1]:C[2],2,FALSE)&VLOOKUP(RC[1],Sheet4!C[-1]:C[2],3,FALSE)&RC[2]&VLOOKUP(RC[1],Sheet4!C[-1]:C[2],4,FALSE)&"（%s/"&RC[2]&"）" -> 占卜翻牌5次（%s/5） | C539: =R[-22]C -> 25 | D539: =R[-22]C -> 5 | E539: 0 | F539: =R[-22]C -> 10096 | G539: =R[-22]C -> 1 | H539: =VLOOKUP(RC[-5],Sheet4!C[-7]:C[-2],5,FALSE) -> 113
A540: =R[-22]C+60 -> 1763 | B540: =VLOOKUP(RC[1],Sheet4!C[-1]:C[2],2,FALSE)&VLOOKUP(RC[1],Sheet4!C[-1]:C[2],3,FALSE)&RC[2]&VLOOKUP(RC[1],Sheet4!C[-1]:C[2],4,FALSE)&"（%s/"&RC[2]&"）" -> 英雄副本战斗1次（%s/1） | C540: =R[-22]C -> 14 | D540: =R[-22]C -> 1 | E540: 0 | F540: =R[-22]C -> 19006 | G540: =R[-22]C -> 80 | H540: =VLOOKUP(RC[-5],Sheet4!C[-7]:C[-2],5,FALSE) -> 27
A541: =R[-22]C+60 -> 1771 | B541: =VLOOKUP(RC[1],Sheet4!C[-1]:C[2],2,FALSE)&VLOOKUP(RC[1],Sheet4!C[-1]:C[2],3,FALSE)&RC[2]&VLOOKUP(RC[1],Sheet4!C[-1]:C[2],4,FALSE)&"（%s/"&RC[2]&"）" -> 圣器争夺5次（%s/5） | C541: =R[-22]C -> 11 | D541: =R[-22]C -> 5 | E541: 0 | F541: =R[-22]C -> 13049 | G541: =R[-22]C -> 5 | H541: =VLOOKUP(RC[-5],Sheet4!C[-7]:C[-2],5,FALSE) -> 19
A542: =R[-22]C+60 -> 1772 | B542: =VLOOKUP(RC[1],Sheet4!C[-1]:C[2],2,FALSE)&VLOOKUP(RC[1],Sheet4!C[-1]:C[2],3,FALSE)&RC[2]&VLOOKUP(RC[1],Sheet4!C[-1]:C[2],4,FALSE)&"（%s/"&RC[2]&"）" -> 圣器合成3次（%s/3） | C542: =R[-22]C -> 22 | D542: =R[-22]C -> 3 | E542: 0 | F542: =R[-22]C -> 13049 | G542: =R[-22]C -> 5 | H542: =VLOOKUP(RC[-5],Sheet4!C[-7]:C[-2],5,FALSE) -> 19
A543: =R[-22]C+60 -> 1773 | B543: =VLOOKUP(RC[1],Sheet4!C[-1]:C[2],2,FALSE)&VLOOKUP(RC[1],Sheet4!C[-1]:C[2],3,FALSE)&RC[2]&VLOOKUP(RC[1],Sheet4!C[-1]:C[2],4,FALSE)&"（%s/"&RC[2]&"）" -> 圣器强化5次（%s/5） | C543: =R[-22]C -> 2 | D543: =R[-22]C -> 5 | E543: 0 | F543: =R[-22]C -> 13049 | G543: =R[-22]C -> 5 | H543: =VLOOKUP(RC[-5],Sheet4!C[-7]:C[-2],5,FALSE) -> 8
A544: =R[-22]C+60 -> 1781 | B544: =VLOOKUP(RC[1],Sheet4!C[-1]:C[2],2,FALSE)&VLOOKUP(RC[1],Sheet4!C[-1]:C[2],3,FALSE)&RC[2]&VLOOKUP(RC[1],Sheet4!C[-1]:C[2],4,FALSE)&"（%s/"&RC[2]&"）" -> 进行召唤5次（%s/5） | C544: =R[-22]C -> 8 | D544: =R[-22]C -> 5 | E544: 0 | F544: =R[-22]C -> 19006 | G544: =R[-22]C -> 80 | H544: =VLOOKUP(RC[-5],Sheet4!C[-7]:C[-2],5,FALSE) -> 9
A545: =R[-22]C+60 -> 1782 | B545: =VLOOKUP(RC[1],Sheet4!C[-1]:C[2],2,FALSE)&VLOOKUP(RC[1],Sheet4!C[-1]:C[2],3,FALSE)&RC[2]&VLOOKUP(RC[1],Sheet4!C[-1]:C[2],4,FALSE)&"（%s/"&RC[2]&"）" -> 进行高级召唤2次（%s/2） | C545: =R[-22]C -> 9 | D545: =R[-22]C -> 2 | E545: 0 | F545: =R[-22]C -> 19006 | G545: =R[-22]C -> 100 | H545: =VLOOKUP(RC[-5],Sheet4!C[-7]:C[-2],5,FALSE) -> 9
A546: =R[-22]C+60 -> 1783 | B546: =VLOOKUP(RC[1],Sheet4!C[-1]:C[2],2,FALSE)&VLOOKUP(RC[1],Sheet4!C[-1]:C[2],3,FALSE)&RC[2]&VLOOKUP(RC[1],Sheet4!C[-1]:C[2],4,FALSE)&"（%s/"&RC[2]&"）" -> 购买体力2次（%s/2） | C546: =R[-22]C -> 6 | D546: =R[-22]C -> 2 | E546: 0 | F546: =R[-22]C -> 19005 | G546: =R[-22]C -> 50 | H546: =VLOOKUP(RC[-5],Sheet4!C[-7]:C[-2],5,FALSE) -> 12
A547: =R[-22]C+60 -> 1784 | B547: =VLOOKUP(RC[1],Sheet4!C[-1]:C[2],2,FALSE)&VLOOKUP(RC[1],Sheet4!C[-1]:C[2],3,FALSE)&RC[2]&VLOOKUP(RC[1],Sheet4!C[-1]:C[2],4,FALSE)&"（%s/"&RC[2]&"）" -> 购买精力2次（%s/2） | C547: =R[-22]C -> 7 | D547: =R[-22]C -> 2 | E547: 0 | F547: =R[-22]C -> 19005 | G547: =R[-22]C -> 50 | H547: =VLOOKUP(RC[-5],Sheet4!C[-7]:C[-2],5,FALSE) -> 12
A548: =R[-22]C+60 -> 1791 | B548: =VLOOKUP(RC[1],Sheet4!C[-1]:C[2],2,FALSE)&VLOOKUP(RC[1],Sheet4!C[-1]:C[2],3,FALSE)&RC[2]&VLOOKUP(RC[1],Sheet4!C[-1]:C[2],4,FALSE)&"（%s/"&RC[2]&"）" -> 进入勇者试练战斗10次（%s/10） | C548: =R[-22]C -> 12 | D548: =R[-22]C -> 10 | E548: 0 | F548: =R[-22]C -> 19012 | G548: =R[-22]C -> 500 | H548: =VLOOKUP(RC[-5],Sheet4!C[-7]:C[-2],5,FALSE) -> 17
A549: =R[-22]C+60 -> 1792 | B549: =VLOOKUP(RC[1],Sheet4!C[-1]:C[2],2,FALSE)&VLOOKUP(RC[1],Sheet4!C[-1]:C[2],3,FALSE)&RC[2]&VLOOKUP(RC[1],Sheet4!C[-1]:C[2],4,FALSE)&"（%s/"&RC[2]&"）" -> 竞技场战斗5次（%s/5） | C549: =R[-22]C -> 10 | D549: =R[-22]C -> 5 | E549: 0 | F549: =R[-22]C -> 19013 | G549: =R[-22]C -> 500 | H549: =VLOOKUP(RC[-5],Sheet4!C[-7]:C[-2],5,FALSE) -> 21
A550: =R[-22]C+60 -> 1793 | B550: =VLOOKUP(RC[1],Sheet4!C[-1]:C[2],2,FALSE)&VLOOKUP(RC[1],Sheet4!C[-1]:C[2],3,FALSE)&RC[2]&VLOOKUP(RC[1],Sheet4!C[-1]:C[2],4,FALSE)&"（%s/"&RC[2]&"）" -> 主线副本挑战5次（%s/5） | C550: =R[-22]C -> 1 | D550: =R[-22]C -> 5 | E550: 0 | F550: =R[-22]C -> 19003 | G550: =R[-22]C -> 30000 | H550: =VLOOKUP(RC[-5],Sheet4!C[-7]:C[-2],5,FALSE) -> 26
A551: =R[-22]C+60 -> 1794 | B551: =VLOOKUP(RC[1],Sheet4!C[-1]:C[2],2,FALSE)&VLOOKUP(RC[1],Sheet4!C[-1]:C[2],3,FALSE)&RC[2]&VLOOKUP(RC[1],Sheet4!C[-1]:C[2],4,FALSE)&"（%s/"&RC[2]&"）" -> 日常副本战斗4次（%s/4） | C551: =R[-22]C -> 13 | D551: =R[-22]C -> 4 | E551: 0 | F551: =R[-22]C -> 19005 | G551: =R[-22]C -> 50 | H551: =VLOOKUP(RC[-5],Sheet4!C[-7]:C[-2],5,FALSE) -> 2
A552: =R[-22]C+60 -> 1801 | B552: =VLOOKUP(RC[1],Sheet4!C[-1]:C[2],2,FALSE)&VLOOKUP(RC[1],Sheet4!C[-1]:C[2],3,FALSE)&RC[2]&VLOOKUP(RC[1],Sheet4!C[-1]:C[2],4,FALSE)&"（%s/"&RC[2]&"）" -> 赠送好友精力3次（%s/3） | C552: =R[-22]C -> 4 | D552: =R[-22]C -> 3 | E552: 0 | F552: =R[-22]C -> 19005 | G552: =R[-22]C -> 50 | H552: =VLOOKUP(RC[-5],Sheet4!C[-7]:C[-2],5,FALSE) -> 15
A553: =R[-22]C+60 -> 1802 | B553: =VLOOKUP(RC[1],Sheet4!C[-1]:C[2],2,FALSE)&VLOOKUP(RC[1],Sheet4!C[-1]:C[2],3,FALSE)&RC[2]&VLOOKUP(RC[1],Sheet4!C[-1]:C[2],4,FALSE)&"（%s/"&RC[2]&"）" -> 英雄培养15次（%s/15） | C553: =R[-22]C -> 3 | D553: =R[-22]C -> 15 | E553: 0 | F553: =R[-22]C -> 10003 | G553: =R[-22]C -> 30 | H553: =VLOOKUP(RC[-5],Sheet4!C[-7]:C[-2],5,FALSE) -> 8
A554: =R[-22]C+60 -> 1803 | B554: =VLOOKUP(RC[1],Sheet4!C[-1]:C[2],2,FALSE)&VLOOKUP(RC[1],Sheet4!C[-1]:C[2],3,FALSE)&RC[2]&VLOOKUP(RC[1],Sheet4!C[-1]:C[2],4,FALSE)&"（%s/"&RC[2]&"）" -> 英雄商店购买1次（%s/1） | C554: =R[-22]C -> 5 | D554: =R[-22]C -> 1 | E554: 0 | F554: =R[-22]C -> 19006 | G554: =R[-22]C -> 80 | H554: =VLOOKUP(RC[-5],Sheet4!C[-7]:C[-2],5,FALSE) -> 11
A555: =R[-22]C+60 -> 1804 | B555: =VLOOKUP(RC[1],Sheet4!C[-1]:C[2],2,FALSE)&VLOOKUP(RC[1],Sheet4!C[-1]:C[2],3,FALSE)&RC[2]&VLOOKUP(RC[1],Sheet4!C[-1]:C[2],4,FALSE)&"（%s/"&RC[2]&"）" -> 遗迹探索4小时（%s/4） | C555: =R[-22]C -> 19 | D555: =R[-22]C -> 4 | E555: 0 | F555: =R[-22]C -> 19005 | G555: =R[-22]C -> 50 | H555: =VLOOKUP(RC[-5],Sheet4!C[-7]:C[-2],5,FALSE) -> 20
A556: =R[-22]C+60 -> 1811 | B556: =VLOOKUP(RC[1],Sheet4!C[-1]:C[2],2,FALSE)&VLOOKUP(RC[1],Sheet4!C[-1]:C[2],3,FALSE)&RC[2]&VLOOKUP(RC[1],Sheet4!C[-1]:C[2],4,FALSE)&"（%s/"&RC[2]&"）" -> 精英副本战斗1次（%s/1） | C556: =R[-22]C -> 15 | D556: =R[-22]C -> 1 | E556: 0 | F556: =R[-22]C -> 10008 | G556: =R[-22]C -> 30 | H556: =VLOOKUP(RC[-5],Sheet4!C[-7]:C[-2],5,FALSE) -> 28
A557: =R[-22]C+60 -> 1812 | B557: =VLOOKUP(RC[1],Sheet4!C[-1]:C[2],2,FALSE)&VLOOKUP(RC[1],Sheet4!C[-1]:C[2],3,FALSE)&RC[2]&VLOOKUP(RC[1],Sheet4!C[-1]:C[2],4,FALSE)&"（%s/"&RC[2]&"）" -> 异度入侵分享2次（%s/2） | C557: =R[-22]C -> 17 | D557: =R[-22]C -> 2 | E557: 0 | F557: =R[-22]C -> 19014 | G557: =R[-22]C -> 500 | H557: =VLOOKUP(RC[-5],Sheet4!C[-7]:C[-2],5,FALSE) -> 16
A558: =R[-22]C+60 -> 1813 | B558: =VLOOKUP(RC[1],Sheet4!C[-1]:C[2],2,FALSE)&VLOOKUP(RC[1],Sheet4!C[-1]:C[2],3,FALSE)&RC[2]&VLOOKUP(RC[1],Sheet4!C[-1]:C[2],4,FALSE)&"（%s/"&RC[2]&"）" -> 讨伐异度入侵者2次（%s/2） | C558: =R[-22]C -> 18 | D558: =R[-22]C -> 2 | E558: 0 | F558: =R[-22]C -> 19014 | G558: =R[-22]C -> 500 | H558: =VLOOKUP(RC[-5],Sheet4!C[-7]:C[-2],5,FALSE) -> 16
A559: =R[-22]C+60 -> 1814 | B559: =VLOOKUP(RC[1],Sheet4!C[-1]:C[2],2,FALSE)&VLOOKUP(RC[1],Sheet4!C[-1]:C[2],3,FALSE)&RC[2]&VLOOKUP(RC[1],Sheet4!C[-1]:C[2],4,FALSE)&"（%s/"&RC[2]&"）" -> 无尽深渊战斗1次（%s/1） | C559: =R[-22]C -> 23 | D559: =R[-22]C -> 1 | E559: 0 | F559: =R[-22]C -> 19028 | G559: =R[-22]C -> 50 | H559: =VLOOKUP(RC[-5],Sheet4!C[-7]:C[-2],5,FALSE) -> 88
A560: =R[-22]C+60 -> 1821 | B560: =VLOOKUP(RC[1],Sheet4!C[-1]:C[2],2,FALSE)&VLOOKUP(RC[1],Sheet4!C[-1]:C[2],3,FALSE)&RC[2]&VLOOKUP(RC[1],Sheet4!C[-1]:C[2],4,FALSE)&"（%s/"&RC[2]&"）" -> 击杀遗迹破坏者3次（%s/3） | C560: =R[-22]C -> 16 | D560: =R[-22]C -> 3 | E560: 0 | F560: =R[-22]C -> 19005 | G560: =R[-22]C -> 50 | H560: =VLOOKUP(RC[-5],Sheet4!C[-7]:C[-2],5,FALSE) -> 20
A561: =R[-22]C+60 -> 1822 | B561: =VLOOKUP(RC[1],Sheet4!C[-1]:C[2],2,FALSE)&VLOOKUP(RC[1],Sheet4!C[-1]:C[2],3,FALSE)&RC[2]&VLOOKUP(RC[1],Sheet4!C[-1]:C[2],4,FALSE)&"（%s/"&RC[2]&"）" -> 占卜翻牌5次（%s/5） | C561: =R[-22]C -> 25 | D561: =R[-22]C -> 5 | E561: 0 | F561: =R[-22]C -> 10096 | G561: =R[-22]C -> 1 | H561: =VLOOKUP(RC[-5],Sheet4!C[-7]:C[-2],5,FALSE) -> 113
A562: =R[-22]C+60 -> 1823 | B562: =VLOOKUP(RC[1],Sheet4!C[-1]:C[2],2,FALSE)&VLOOKUP(RC[1],Sheet4!C[-1]:C[2],3,FALSE)&RC[2]&VLOOKUP(RC[1],Sheet4!C[-1]:C[2],4,FALSE)&"（%s/"&RC[2]&"）" -> 英雄副本战斗1次（%s/1） | C562: =R[-22]C -> 14 | D562: =R[-22]C -> 1 | E562: 0 | F562: =R[-22]C -> 19006 | G562: =R[-22]C -> 80 | H562: =VLOOKUP(RC[-5],Sheet4!C[-7]:C[-2],5,FALSE) -> 27
A563: =R[-22]C+60 -> 1831 | B563: =VLOOKUP(RC[1],Sheet4!C[-1]:C[2],2,FALSE)&VLOOKUP(RC[1],Sheet4!C[-1]:C[2],3,FALSE)&RC[2]&VLOOKUP(RC[1],Sheet4!C[-1]:C[2],4,FALSE)&"（%s/"&RC[2]&"）" -> 圣器争夺5次（%s/5） | C563: =R[-22]C -> 11 | D563: =R[-22]C -> 5 | E563: 0 | F563: =R[-22]C -> 13049 | G563: =R[-22]C -> 5 | H563: =VLOOKUP(RC[-5],Sheet4!C[-7]:C[-2],5,FALSE) -> 19
A564: =R[-22]C+60 -> 1832 | B564: =VLOOKUP(RC[1],Sheet4!C[-1]:C[2],2,FALSE)&VLOOKUP(RC[1],Sheet4!C[-1]:C[2],3,FALSE)&RC[2]&VLOOKUP(RC[1],Sheet4!C[-1]:C[2],4,FALSE)&"（%s/"&RC[2]&"）" -> 圣器合成3次（%s/3） | C564: =R[-22]C -> 22 | D564: =R[-22]C -> 3 | E564: 0 | F564: =R[-22]C -> 13049 | G564: =R[-22]C -> 5 | H564: =VLOOKUP(RC[-5],Sheet4!C[-7]:C[-2],5,FALSE) -> 19
A565: =R[-22]C+60 -> 1833 | B565: =VLOOKUP(RC[1],Sheet4!C[-1]:C[2],2,FALSE)&VLOOKUP(RC[1],Sheet4!C[-1]:C[2],3,FALSE)&RC[2]&VLOOKUP(RC[1],Sheet4!C[-1]:C[2],4,FALSE)&"（%s/"&RC[2]&"）" -> 圣器强化5次（%s/5） | C565: =R[-22]C -> 2 | D565: =R[-22]C -> 5 | E565: 0 | F565: =R[-22]C -> 13049 | G565: =R[-22]C -> 5 | H565: =VLOOKUP(RC[-5],Sheet4!C[-7]:C[-2],5,FALSE) -> 8
A566: =R[-22]C+60 -> 1841 | B566: =VLOOKUP(RC[1],Sheet4!C[-1]:C[2],2,FALSE)&VLOOKUP(RC[1],Sheet4!C[-1]:C[2],3,FALSE)&RC[2]&VLOOKUP(RC[1],Sheet4!C[-1]:C[2],4,FALSE)&"（%s/"&RC[2]&"）" -> 进行召唤5次（%s/5） | C566: =R[-22]C -> 8 | D566: =R[-22]C -> 5 | E566: 0 | F566: =R[-22]C -> 19006 | G566: =R[-22]C -> 80 | H566: =VLOOKUP(RC[-5],Sheet4!C[-7]:C[-2],5,FALSE) -> 9
A567: =R[-22]C+60 -> 1842 | B567: =VLOOKUP(RC[1],Sheet4!C[-1]:C[2],2,FALSE)&VLOOKUP(RC[1],Sheet4!C[-1]:C[2],3,FALSE)&RC[2]&VLOOKUP(RC[1],Sheet4!C[-1]:C[2],4,FALSE)&"（%s/"&RC[2]&"）" -> 进行高级召唤2次（%s/2） | C567: =R[-22]C -> 9 | D567: =R[-22]C -> 2 | E567: 0 | F567: =R[-22]C -> 19006 | G567: =R[-22]C -> 100 | H567: =VLOOKUP(RC[-5],Sheet4!C[-7]:C[-2],5,FALSE) -> 9
A568: =R[-22]C+60 -> 1843 | B568: =VLOOKUP(RC[1],Sheet4!C[-1]:C[2],2,FALSE)&VLOOKUP(RC[1],Sheet4!C[-1]:C[2],3,FALSE)&RC[2]&VLOOKUP(RC[1],Sheet4!C[-1]:C[2],4,FALSE)&"（%s/"&RC[2]&"）" -> 购买体力2次（%s/2） | C568: =R[-22]C -> 6 | D568: =R[-22]C -> 2 | E568: 0 | F568: =R[-22]C -> 19005 | G568: =R[-22]C -> 50 | H568: =VLOOKUP(RC[-5],Sheet4!C[-7]:C[-2],5,FALSE) -> 12
A569: =R[-22]C+60 -> 1844 | B569: =VLOOKUP(RC[1],Sheet4!C[-1]:C[2],2,FALSE)&VLOOKUP(RC[1],Sheet4!C[-1]:C[2],3,FALSE)&RC[2]&VLOOKUP(RC[1],Sheet4!C[-1]:C[2],4,FALSE)&"（%s/"&RC[2]&"）" -> 购买精力2次（%s/2） | C569: =R[-22]C -> 7 | D569: =R[-22]C -> 2 | E569: 0 | F569: =R[-22]C -> 19005 | G569: =R[-22]C -> 50 | H569: =VLOOKUP(RC[-5],Sheet4!C[-7]:C[-2],5,FALSE) -> 12
A570: =R[-22]C+60 -> 1851 | B570: =VLOOKUP(RC[1],Sheet4!C[-1]:C[2],2,FALSE)&VLOOKUP(RC[1],Sheet4!C[-1]:C[2],3,FALSE)&RC[2]&VLOOKUP(RC[1],Sheet4!C[-1]:C[2],4,FALSE)&"（%s/"&RC[2]&"）" -> 进入勇者试练战斗10次（%s/10） | C570: =R[-22]C -> 12 | D570: =R[-22]C -> 10 | E570: 0 | F570: =R[-22]C -> 19012 | G570: =R[-22]C -> 500 | H570: =VLOOKUP(RC[-5],Sheet4!C[-7]:C[-2],5,FALSE) -> 17
A571: =R[-22]C+60 -> 1852 | B571: =VLOOKUP(RC[1],Sheet4!C[-1]:C[2],2,FALSE)&VLOOKUP(RC[1],Sheet4!C[-1]:C[2],3,FALSE)&RC[2]&VLOOKUP(RC[1],Sheet4!C[-1]:C[2],4,FALSE)&"（%s/"&RC[2]&"）" -> 竞技场战斗5次（%s/5） | C571: =R[-22]C -> 10 | D571: =R[-22]C -> 5 | E571: 0 | F571: =R[-22]C -> 19013 | G571: =R[-22]C -> 500 | H571: =VLOOKUP(RC[-5],Sheet4!C[-7]:C[-2],5,FALSE) -> 21
A572: =R[-22]C+60 -> 1853 | B572: =VLOOKUP(RC[1],Sheet4!C[-1]:C[2],2,FALSE)&VLOOKUP(RC[1],Sheet4!C[-1]:C[2],3,FALSE)&RC[2]&VLOOKUP(RC[1],Sheet4!C[-1]:C[2],4,FALSE)&"（%s/"&RC[2]&"）" -> 主线副本挑战5次（%s/5） | C572: =R[-22]C -> 1 | D572: =R[-22]C -> 5 | E572: 0 | F572: =R[-22]C -> 19003 | G572: =R[-22]C -> 30000 | H572: =VLOOKUP(RC[-5],Sheet4!C[-7]:C[-2],5,FALSE) -> 26
A573: =R[-22]C+60 -> 1854 | B573: =VLOOKUP(RC[1],Sheet4!C[-1]:C[2],2,FALSE)&VLOOKUP(RC[1],Sheet4!C[-1]:C[2],3,FALSE)&RC[2]&VLOOKUP(RC[1],Sheet4!C[-1]:C[2],4,FALSE)&"（%s/"&RC[2]&"）" -> 日常副本战斗4次（%s/4） | C573: =R[-22]C -> 13 | D573: =R[-22]C -> 4 | E573: 0 | F573: =R[-22]C -> 19005 | G573: =R[-22]C -> 50 | H573: =VLOOKUP(RC[-5],Sheet4!C[-7]:C[-2],5,FALSE) -> 2
A574: =R[-22]C+60 -> 1861 | B574: =VLOOKUP(RC[1],Sheet4!C[-1]:C[2],2,FALSE)&VLOOKUP(RC[1],Sheet4!C[-1]:C[2],3,FALSE)&RC[2]&VLOOKUP(RC[1],Sheet4!C[-1]:C[2],4,FALSE)&"（%s/"&RC[2]&"）" -> 赠送好友精力3次（%s/3） | C574: =R[-22]C -> 4 | D574: =R[-22]C -> 3 | E574: 0 | F574: =R[-22]C -> 19005 | G574: =R[-22]C -> 50 | H574: =VLOOKUP(RC[-5],Sheet4!C[-7]:C[-2],5,FALSE) -> 15
A575: =R[-22]C+60 -> 1862 | B575: =VLOOKUP(RC[1],Sheet4!C[-1]:C[2],2,FALSE)&VLOOKUP(RC[1],Sheet4!C[-1]:C[2],3,FALSE)&RC[2]&VLOOKUP(RC[1],Sheet4!C[-1]:C[2],4,FALSE)&"（%s/"&RC[2]&"）" -> 英雄培养15次（%s/15） | C575: =R[-22]C -> 3 | D575: =R[-22]C -> 15 | E575: 0 | F575: =R[-22]C -> 10003 | G575: =R[-22]C -> 30 | H575: =VLOOKUP(RC[-5],Sheet4!C[-7]:C[-2],5,FALSE) -> 8
A576: =R[-22]C+60 -> 1863 | B576: =VLOOKUP(RC[1],Sheet4!C[-1]:C[2],2,FALSE)&VLOOKUP(RC[1],Sheet4!C[-1]:C[2],3,FALSE)&RC[2]&VLOOKUP(RC[1],Sheet4!C[-1]:C[2],4,FALSE)&"（%s/"&RC[2]&"）" -> 英雄商店购买1次（%s/1） | C576: =R[-22]C -> 5 | D576: =R[-22]C -> 1 | E576: 0 | F576: =R[-22]C -> 19006 | G576: =R[-22]C -> 80 | H576: =VLOOKUP(RC[-5],Sheet4!C[-7]:C[-2],5,FALSE) -> 11
A577: =R[-22]C+60 -> 1864 | B577: =VLOOKUP(RC[1],Sheet4!C[-1]:C[2],2,FALSE)&VLOOKUP(RC[1],Sheet4!C[-1]:C[2],3,FALSE)&RC[2]&VLOOKUP(RC[1],Sheet4!C[-1]:C[2],4,FALSE)&"（%s/"&RC[2]&"）" -> 遗迹探索4小时（%s/4） | C577: =R[-22]C -> 19 | D577: =R[-22]C -> 4 | E577: 0 | F577: =R[-22]C -> 19005 | G577: =R[-22]C -> 50 | H577: =VLOOKUP(RC[-5],Sheet4!C[-7]:C[-2],5,FALSE) -> 20
A578: =R[-22]C+60 -> 1871 | B578: =VLOOKUP(RC[1],Sheet4!C[-1]:C[2],2,FALSE)&VLOOKUP(RC[1],Sheet4!C[-1]:C[2],3,FALSE)&RC[2]&VLOOKUP(RC[1],Sheet4!C[-1]:C[2],4,FALSE)&"（%s/"&RC[2]&"）" -> 精英副本战斗1次（%s/1） | C578: =R[-22]C -> 15 | D578: =R[-22]C -> 1 | E578: 0 | F578: =R[-22]C -> 10008 | G578: =R[-22]C -> 30 | H578: =VLOOKUP(RC[-5],Sheet4!C[-7]:C[-2],5,FALSE) -> 28
A579: =R[-22]C+60 -> 1872 | B579: =VLOOKUP(RC[1],Sheet4!C[-1]:C[2],2,FALSE)&VLOOKUP(RC[1],Sheet4!C[-1]:C[2],3,FALSE)&RC[2]&VLOOKUP(RC[1],Sheet4!C[-1]:C[2],4,FALSE)&"（%s/"&RC[2]&"）" -> 异度入侵分享2次（%s/2） | C579: =R[-22]C -> 17 | D579: =R[-22]C -> 2 | E579: 0 | F579: =R[-22]C -> 19014 | G579: =R[-22]C -> 500 | H579: =VLOOKUP(RC[-5],Sheet4!C[-7]:C[-2],5,FALSE) -> 16
A580: =R[-22]C+60 -> 1873 | B580: =VLOOKUP(RC[1],Sheet4!C[-1]:C[2],2,FALSE)&VLOOKUP(RC[1],Sheet4!C[-1]:C[2],3,FALSE)&RC[2]&VLOOKUP(RC[1],Sheet4!C[-1]:C[2],4,FALSE)&"（%s/"&RC[2]&"）" -> 讨伐异度入侵者2次（%s/2） | C580: =R[-22]C -> 18 | D580: =R[-22]C -> 2 | E580: 0 | F580: =R[-22]C -> 19014 | G580: =R[-22]C -> 500 | H580: =VLOOKUP(RC[-5],Sheet4!C[-7]:C[-2],5,FALSE) -> 16
A581: =R[-22]C+60 -> 1874 | B581: =VLOOKUP(RC[1],Sheet4!C[-1]:C[2],2,FALSE)&VLOOKUP(RC[1],Sheet4!C[-1]:C[2],3,FALSE)&RC[2]&VLOOKUP(RC[1],Sheet4!C[-1]:C[2],4,FALSE)&"（%s/"&RC[2]&"）" -> 无尽深渊战斗1次（%s/1） | C581: =R[-22]C -> 23 | D581: =R[-22]C -> 1 | E581: 0 | F581: =R[-22]C -> 19028 | G581: =R[-22]C -> 50 | H581: =VLOOKUP(RC[-5],Sheet4!C[-7]:C[-2],5,FALSE) -> 88
A582: =R[-22]C+60 -> 1881 | B582: =VLOOKUP(RC[1],Sheet4!C[-1]:C[2],2,FALSE)&VLOOKUP(RC[1],Sheet4!C[-1]:C[2],3,FALSE)&RC[2]&VLOOKUP(RC[1],Sheet4!C[-1]:C[2],4,FALSE)&"（%s/"&RC[2]&"）" -> 击杀遗迹破坏者3次（%s/3） | C582: =R[-22]C -> 16 | D582: =R[-22]C -> 3 | E582: 0 | F582: =R[-22]C -> 19005 | G582: =R[-22]C -> 50 | H582: =VLOOKUP(RC[-5],Sheet4!C[-7]:C[-2],5,FALSE) -> 20
A583: =R[-22]C+60 -> 1882 | B583: =VLOOKUP(RC[1],Sheet4!C[-1]:C[2],2,FALSE)&VLOOKUP(RC[1],Sheet4!C[-1]:C[2],3,FALSE)&RC[2]&VLOOKUP(RC[1],Sheet4!C[-1]:C[2],4,FALSE)&"（%s/"&RC[2]&"）" -> 占卜翻牌5次（%s/5） | C583: =R[-22]C -> 25 | D583: =R[-22]C -> 5 | E583: 0 | F583: =R[-22]C -> 10096 | G583: =R[-22]C -> 1 | H583: =VLOOKUP(RC[-5],Sheet4!C[-7]:C[-2],5,FALSE) -> 113
A584: =R[-22]C+60 -> 1883 | B584: =VLOOKUP(RC[1],Sheet4!C[-1]:C[2],2,FALSE)&VLOOKUP(RC[1],Sheet4!C[-1]:C[2],3,FALSE)&RC[2]&VLOOKUP(RC[1],Sheet4!C[-1]:C[2],4,FALSE)&"（%s/"&RC[2]&"）" -> 英雄副本战斗1次（%s/1） | C584: =R[-22]C -> 14 | D584: =R[-22]C -> 1 | E584: 0 | F584: =R[-22]C -> 19006 | G584: =R[-22]C -> 80 | H584: =VLOOKUP(RC[-5],Sheet4!C[-7]:C[-2],5,FALSE) -> 27
A585: =R[-22]C+60 -> 1891 | B585: =VLOOKUP(RC[1],Sheet4!C[-1]:C[2],2,FALSE)&VLOOKUP(RC[1],Sheet4!C[-1]:C[2],3,FALSE)&RC[2]&VLOOKUP(RC[1],Sheet4!C[-1]:C[2],4,FALSE)&"（%s/"&RC[2]&"）" -> 圣器争夺5次（%s/5） | C585: =R[-22]C -> 11 | D585: =R[-22]C -> 5 | E585: 0 | F585: =R[-22]C -> 13049 | G585: =R[-22]C -> 5 | H585: =VLOOKUP(RC[-5],Sheet4!C[-7]:C[-2],5,FALSE) -> 19
A586: =R[-22]C+60 -> 1892 | B586: =VLOOKUP(RC[1],Sheet4!C[-1]:C[2],2,FALSE)&VLOOKUP(RC[1],Sheet4!C[-1]:C[2],3,FALSE)&RC[2]&VLOOKUP(RC[1],Sheet4!C[-1]:C[2],4,FALSE)&"（%s/"&RC[2]&"）" -> 圣器合成3次（%s/3） | C586: =R[-22]C -> 22 | D586: =R[-22]C -> 3 | E586: 0 | F586: =R[-22]C -> 13049 | G586: =R[-22]C -> 5 | H586: =VLOOKUP(RC[-5],Sheet4!C[-7]:C[-2],5,FALSE) -> 19
A587: =R[-22]C+60 -> 1893 | B587: =VLOOKUP(RC[1],Sheet4!C[-1]:C[2],2,FALSE)&VLOOKUP(RC[1],Sheet4!C[-1]:C[2],3,FALSE)&RC[2]&VLOOKUP(RC[1],Sheet4!C[-1]:C[2],4,FALSE)&"（%s/"&RC[2]&"）" -> 圣器强化5次（%s/5） | C587: =R[-22]C -> 2 | D587: =R[-22]C -> 5 | E587: 0 | F587: =R[-22]C -> 13049 | G587: =R[-22]C -> 5 | H587: =VLOOKUP(RC[-5],Sheet4!C[-7]:C[-2],5,FALSE) -> 8
A588: =R[-22]C+60 -> 1901 | B588: =VLOOKUP(RC[1],Sheet4!C[-1]:C[2],2,FALSE)&VLOOKUP(RC[1],Sheet4!C[-1]:C[2],3,FALSE)&RC[2]&VLOOKUP(RC[1],Sheet4!C[-1]:C[2],4,FALSE)&"（%s/"&RC[2]&"）" -> 进行召唤5次（%s/5） | C588: =R[-22]C -> 8 | D588: =R[-22]C -> 5 | E588: 0 | F588: =R[-22]C -> 19006 | G588: =R[-22]C -> 80 | H588: =VLOOKUP(RC[-5],Sheet4!C[-7]:C[-2],5,FALSE) -> 9
A589: =R[-22]C+60 -> 1902 | B589: =VLOOKUP(RC[1],Sheet4!C[-1]:C[2],2,FALSE)&VLOOKUP(RC[1],Sheet4!C[-1]:C[2],3,FALSE)&RC[2]&VLOOKUP(RC[1],Sheet4!C[-1]:C[2],4,FALSE)&"（%s/"&RC[2]&"）" -> 进行高级召唤2次（%s/2） | C589: =R[-22]C -> 9 | D589: =R[-22]C -> 2 | E589: 0 | F589: =R[-22]C -> 19006 | G589: =R[-22]C -> 100 | H589: =VLOOKUP(RC[-5],Sheet4!C[-7]:C[-2],5,FALSE) -> 9
A590: =R[-22]C+60 -> 1903 | B590: =VLOOKUP(RC[1],Sheet4!C[-1]:C[2],2,FALSE)&VLOOKUP(RC[1],Sheet4!C[-1]:C[2],3,FALSE)&RC[2]&VLOOKUP(RC[1],Sheet4!C[-1]:C[2],4,FALSE)&"（%s/"&RC[2]&"）" -> 购买体力2次（%s/2） | C590: =R[-22]C -> 6 | D590: =R[-22]C -> 2 | E590: 0 | F590: =R[-22]C -> 19005 | G590: =R[-22]C -> 50 | H590: =VLOOKUP(RC[-5],Sheet4!C[-7]:C[-2],5,FALSE) -> 12
A591: =R[-22]C+60 -> 1904 | B591: =VLOOKUP(RC[1],Sheet4!C[-1]:C[2],2,FALSE)&VLOOKUP(RC[1],Sheet4!C[-1]:C[2],3,FALSE)&RC[2]&VLOOKUP(RC[1],Sheet4!C[-1]:C[2],4,FALSE)&"（%s/"&RC[2]&"）" -> 购买精力2次（%s/2） | C591: =R[-22]C -> 7 | D591: =R[-22]C -> 2 | E591: 0 | F591: =R[-22]C -> 19005 | G591: =R[-22]C -> 50 | H591: =VLOOKUP(RC[-5],Sheet4!C[-7]:C[-2],5,FALSE) -> 12
A592: =R[-22]C+60 -> 1911 | B592: =VLOOKUP(RC[1],Sheet4!C[-1]:C[2],2,FALSE)&VLOOKUP(RC[1],Sheet4!C[-1]:C[2],3,FALSE)&RC[2]&VLOOKUP(RC[1],Sheet4!C[-1]:C[2],4,FALSE)&"（%s/"&RC[2]&"）" -> 进入勇者试练战斗10次（%s/10） | C592: =R[-22]C -> 12 | D592: =R[-22]C -> 10 | E592: 0 | F592: =R[-22]C -> 19012 | G592: =R[-22]C -> 500 | H592: =VLOOKUP(RC[-5],Sheet4!C[-7]:C[-2],5,FALSE) -> 17
A593: =R[-22]C+60 -> 1912 | B593: =VLOOKUP(RC[1],Sheet4!C[-1]:C[2],2,FALSE)&VLOOKUP(RC[1],Sheet4!C[-1]:C[2],3,FALSE)&RC[2]&VLOOKUP(RC[1],Sheet4!C[-1]:C[2],4,FALSE)&"（%s/"&RC[2]&"）" -> 竞技场战斗5次（%s/5） | C593: =R[-22]C -> 10 | D593: =R[-22]C -> 5 | E593: 0 | F593: =R[-22]C -> 19013 | G593: =R[-22]C -> 500 | H593: =VLOOKUP(RC[-5],Sheet4!C[-7]:C[-2],5,FALSE) -> 21
A594: =R[-22]C+60 -> 1913 | B594: =VLOOKUP(RC[1],Sheet4!C[-1]:C[2],2,FALSE)&VLOOKUP(RC[1],Sheet4!C[-1]:C[2],3,FALSE)&RC[2]&VLOOKUP(RC[1],Sheet4!C[-1]:C[2],4,FALSE)&"（%s/"&RC[2]&"）" -> 主线副本挑战5次（%s/5） | C594: =R[-22]C -> 1 | D594: =R[-22]C -> 5 | E594: 0 | F594: =R[-22]C -> 19003 | G594: =R[-22]C -> 30000 | H594: =VLOOKUP(RC[-5],Sheet4!C[-7]:C[-2],5,FALSE) -> 26
A595: =R[-22]C+60 -> 1914 | B595: =VLOOKUP(RC[1],Sheet4!C[-1]:C[2],2,FALSE)&VLOOKUP(RC[1],Sheet4!C[-1]:C[2],3,FALSE)&RC[2]&VLOOKUP(RC[1],Sheet4!C[-1]:C[2],4,FALSE)&"（%s/"&RC[2]&"）" -> 日常副本战斗4次（%s/4） | C595: =R[-22]C -> 13 | D595: =R[-22]C -> 4 | E595: 0 | F595: =R[-22]C -> 19005 | G595: =R[-22]C -> 50 | H595: =VLOOKUP(RC[-5],Sheet4!C[-7]:C[-2],5,FALSE) -> 2
A596: =R[-22]C+60 -> 1921 | B596: =VLOOKUP(RC[1],Sheet4!C[-1]:C[2],2,FALSE)&VLOOKUP(RC[1],Sheet4!C[-1]:C[2],3,FALSE)&RC[2]&VLOOKUP(RC[1],Sheet4!C[-1]:C[2],4,FALSE)&"（%s/"&RC[2]&"）" -> 赠送好友精力3次（%s/3） | C596: =R[-22]C -> 4 | D596: =R[-22]C -> 3 | E596: 0 | F596: =R[-22]C -> 19005 | G596: =R[-22]C -> 50 | H596: =VLOOKUP(RC[-5],Sheet4!C[-7]:C[-2],5,FALSE) -> 15
A597: =R[-22]C+60 -> 1922 | B597: =VLOOKUP(RC[1],Sheet4!C[-1]:C[2],2,FALSE)&VLOOKUP(RC[1],Sheet4!C[-1]:C[2],3,FALSE)&RC[2]&VLOOKUP(RC[1],Sheet4!C[-1]:C[2],4,FALSE)&"（%s/"&RC[2]&"）" -> 英雄培养15次（%s/15） | C597: =R[-22]C -> 3 | D597: =R[-22]C -> 15 | E597: 0 | F597: =R[-22]C -> 10003 | G597: =R[-22]C -> 30 | H597: =VLOOKUP(RC[-5],Sheet4!C[-7]:C[-2],5,FALSE) -> 8
A598: =R[-22]C+60 -> 1923 | B598: =VLOOKUP(RC[1],Sheet4!C[-1]:C[2],2,FALSE)&VLOOKUP(RC[1],Sheet4!C[-1]:C[2],3,FALSE)&RC[2]&VLOOKUP(RC[1],Sheet4!C[-1]:C[2],4,FALSE)&"（%s/"&RC[2]&"）" -> 英雄商店购买1次（%s/1） | C598: =R[-22]C -> 5 | D598: =R[-22]C -> 1 | E598: 0 | F598: =R[-22]C -> 19006 | G598: =R[-22]C -> 80 | H598: =VLOOKUP(RC[-5],Sheet4!C[-7]:C[-2],5,FALSE) -> 11
A599: =R[-22]C+60 -> 1924 | B599: =VLOOKUP(RC[1],Sheet4!C[-1]:C[2],2,FALSE)&VLOOKUP(RC[1],Sheet4!C[-1]:C[2],3,FALSE)&RC[2]&VLOOKUP(RC[1],Sheet4!C[-1]:C[2],4,FALSE)&"（%s/"&RC[2]&"）" -> 遗迹探索4小时（%s/4） | C599: =R[-22]C -> 19 | D599: =R[-22]C -> 4 | E599: 0 | F599: =R[-22]C -> 19005 | G599: =R[-22]C -> 50 | H599: =VLOOKUP(RC[-5],Sheet4!C[-7]:C[-2],5,FALSE) -> 20
A600: =R[-22]C+60 -> 1931 | B600: =VLOOKUP(RC[1],Sheet4!C[-1]:C[2],2,FALSE)&VLOOKUP(RC[1],Sheet4!C[-1]:C[2],3,FALSE)&RC[2]&VLOOKUP(RC[1],Sheet4!C[-1]:C[2],4,FALSE)&"（%s/"&RC[2]&"）" -> 精英副本战斗1次（%s/1） | C600: =R[-22]C -> 15 | D600: =R[-22]C -> 1 | E600: 0 | F600: =R[-22]C -> 10008 | G600: =R[-22]C -> 30 | H600: =VLOOKUP(RC[-5],Sheet4!C[-7]:C[-2],5,FALSE) -> 28
A601: =R[-22]C+60 -> 1932 | B601: =VLOOKUP(RC[1],Sheet4!C[-1]:C[2],2,FALSE)&VLOOKUP(RC[1],Sheet4!C[-1]:C[2],3,FALSE)&RC[2]&VLOOKUP(RC[1],Sheet4!C[-1]:C[2],4,FALSE)&"（%s/"&RC[2]&"）" -> 异度入侵分享2次（%s/2） | C601: =R[-22]C -> 17 | D601: =R[-22]C -> 2 | E601: 0 | F601: =R[-22]C -> 19014 | G601: =R[-22]C -> 500 | H601: =VLOOKUP(RC[-5],Sheet4!C[-7]:C[-2],5,FALSE) -> 16
A602: =R[-22]C+60 -> 1933 | B602: =VLOOKUP(RC[1],Sheet4!C[-1]:C[2],2,FALSE)&VLOOKUP(RC[1],Sheet4!C[-1]:C[2],3,FALSE)&RC[2]&VLOOKUP(RC[1],Sheet4!C[-1]:C[2],4,FALSE)&"（%s/"&RC[2]&"）" -> 讨伐异度入侵者2次（%s/2） | C602: =R[-22]C -> 18 | D602: =R[-22]C -> 2 | E602: 0 | F602: =R[-22]C -> 19014 | G602: =R[-22]C -> 500 | H602: =VLOOKUP(RC[-5],Sheet4!C[-7]:C[-2],5,FALSE) -> 16
A603: =R[-22]C+60 -> 1934 | B603: =VLOOKUP(RC[1],Sheet4!C[-1]:C[2],2,FALSE)&VLOOKUP(RC[1],Sheet4!C[-1]:C[2],3,FALSE)&RC[2]&VLOOKUP(RC[1],Sheet4!C[-1]:C[2],4,FALSE)&"（%s/"&RC[2]&"）" -> 无尽深渊战斗1次（%s/1） | C603: =R[-22]C -> 23 | D603: =R[-22]C -> 1 | E603: 0 | F603: =R[-22]C -> 19028 | G603: =R[-22]C -> 50 | H603: =VLOOKUP(RC[-5],Sheet4!C[-7]:C[-2],5,FALSE) -> 88
A604: =R[-22]C+60 -> 1941 | B604: =VLOOKUP(RC[1],Sheet4!C[-1]:C[2],2,FALSE)&VLOOKUP(RC[1],Sheet4!C[-1]:C[2],3,FALSE)&RC[2]&VLOOKUP(RC[1],Sheet4!C[-1]:C[2],4,FALSE)&"（%s/"&RC[2]&"）" -> 击杀遗迹破坏者3次（%s/3） | C604: =R[-22]C -> 16 | D604: =R[-22]C -> 3 | E604: 0 | F604: =R[-22]C -> 19005 | G604: =R[-22]C -> 50 | H604: =VLOOKUP(RC[-5],Sheet4!C[-7]:C[-2],5,FALSE) -> 20
A605: =R[-22]C+60 -> 1942 | B605: =VLOOKUP(RC[1],Sheet4!C[-1]:C[2],2,FALSE)&VLOOKUP(RC[1],Sheet4!C[-1]:C[2],3,FALSE)&RC[2]&VLOOKUP(RC[1],Sheet4!C[-1]:C[2],4,FALSE)&"（%s/"&RC[2]&"）" -> 占卜翻牌5次（%s/5） | C605: =R[-22]C -> 25 | D605: =R[-22]C -> 5 | E605: 0 | F605: =R[-22]C -> 10096 | G605: =R[-22]C -> 1 | H605: =VLOOKUP(RC[-5],Sheet4!C[-7]:C[-2],5,FALSE) -> 113
A606: =R[-22]C+60 -> 1943 | B606: =VLOOKUP(RC[1],Sheet4!C[-1]:C[2],2,FALSE)&VLOOKUP(RC[1],Sheet4!C[-1]:C[2],3,FALSE)&RC[2]&VLOOKUP(RC[1],Sheet4!C[-1]:C[2],4,FALSE)&"（%s/"&RC[2]&"）" -> 英雄副本战斗1次（%s/1） | C606: =R[-22]C -> 14 | D606: =R[-22]C -> 1 | E606: 0 | F606: =R[-22]C -> 19006 | G606: =R[-22]C -> 80 | H606: =VLOOKUP(RC[-5],Sheet4!C[-7]:C[-2],5,FALSE) -> 27
A607: =R[-22]C+60 -> 1951 | B607: =VLOOKUP(RC[1],Sheet4!C[-1]:C[2],2,FALSE)&VLOOKUP(RC[1],Sheet4!C[-1]:C[2],3,FALSE)&RC[2]&VLOOKUP(RC[1],Sheet4!C[-1]:C[2],4,FALSE)&"（%s/"&RC[2]&"）" -> 圣器争夺5次（%s/5） | C607: =R[-22]C -> 11 | D607: =R[-22]C -> 5 | E607: 0 | F607: =R[-22]C -> 13049 | G607: =R[-22]C -> 5 | H607: =VLOOKUP(RC[-5],Sheet4!C[-7]:C[-2],5,FALSE) -> 19
A608: =R[-22]C+60 -> 1952 | B608: =VLOOKUP(RC[1],Sheet4!C[-1]:C[2],2,FALSE)&VLOOKUP(RC[1],Sheet4!C[-1]:C[2],3,FALSE)&RC[2]&VLOOKUP(RC[1],Sheet4!C[-1]:C[2],4,FALSE)&"（%s/"&RC[2]&"）" -> 圣器合成3次（%s/3） | C608: =R[-22]C -> 22 | D608: =R[-22]C -> 3 | E608: 0 | F608: =R[-22]C -> 13049 | G608: =R[-22]C -> 5 | H608: =VLOOKUP(RC[-5],Sheet4!C[-7]:C[-2],5,FALSE) -> 19
A609: =R[-22]C+60 -> 1953 | B609: =VLOOKUP(RC[1],Sheet4!C[-1]:C[2],2,FALSE)&VLOOKUP(RC[1],Sheet4!C[-1]:C[2],3,FALSE)&RC[2]&VLOOKUP(RC[1],Sheet4!C[-1]:C[2],4,FALSE)&"（%s/"&RC[2]&"）" -> 圣器强化5次（%s/5） | C609: =R[-22]C -> 2 | D609: =R[-22]C -> 5 | E609: 0 | F609: =R[-22]C -> 13049 | G609: =R[-22]C -> 5 | H609: =VLOOKUP(RC[-5],Sheet4!C[-7]:C[-2],5,FALSE) -> 8
A610: =R[-22]C+60 -> 1961 | B610: =VLOOKUP(RC[1],Sheet4!C[-1]:C[2],2,FALSE)&VLOOKUP(RC[1],Sheet4!C[-1]:C[2],3,FALSE)&RC[2]&VLOOKUP(RC[1],Sheet4!C[-1]:C[2],4,FALSE)&"（%s/"&RC[2]&"）" -> 进行召唤5次（%s/5） | C610: =R[-22]C -> 8 | D610: =R[-22]C -> 5 | E610: 0 | F610: =R[-22]C -> 19006 | G610: =R[-22]C -> 80 | H610: =VLOOKUP(RC[-5],Sheet4!C[-7]:C[-2],5,FALSE) -> 9
A611: =R[-22]C+60 -> 1962 | B611: =VLOOKUP(RC[1],Sheet4!C[-1]:C[2],2,FALSE)&VLOOKUP(RC[1],Sheet4!C[-1]:C[2],3,FALSE)&RC[2]&VLOOKUP(RC[1],Sheet4!C[-1]:C[2],4,FALSE)&"（%s/"&RC[2]&"）" -> 进行高级召唤2次（%s/2） | C611: =R[-22]C -> 9 | D611: =R[-22]C -> 2 | E611: 0 | F611: =R[-22]C -> 19006 | G611: =R[-22]C -> 100 | H611: =VLOOKUP(RC[-5],Sheet4!C[-7]:C[-2],5,FALSE) -> 9
A612: =R[-22]C+60 -> 1963 | B612: =VLOOKUP(RC[1],Sheet4!C[-1]:C[2],2,FALSE)&VLOOKUP(RC[1],Sheet4!C[-1]:C[2],3,FALSE)&RC[2]&VLOOKUP(RC[1],Sheet4!C[-1]:C[2],4,FALSE)&"（%s/"&RC[2]&"）" -> 购买体力2次（%s/2） | C612: =R[-22]C -> 6 | D612: =R[-22]C -> 2 | E612: 0 | F612: =R[-22]C -> 19005 | G612: =R[-22]C -> 50 | H612: =VLOOKUP(RC[-5],Sheet4!C[-7]:C[-2],5,FALSE) -> 12
A613: =R[-22]C+60 -> 1964 | B613: =VLOOKUP(RC[1],Sheet4!C[-1]:C[2],2,FALSE)&VLOOKUP(RC[1],Sheet4!C[-1]:C[2],3,FALSE)&RC[2]&VLOOKUP(RC[1],Sheet4!C[-1]:C[2],4,FALSE)&"（%s/"&RC[2]&"）" -> 购买精力2次（%s/2） | C613: =R[-22]C -> 7 | D613: =R[-22]C -> 2 | E613: 0 | F613: =R[-22]C -> 19005 | G613: =R[-22]C -> 50 | H613: =VLOOKUP(RC[-5],Sheet4!C[-7]:C[-2],5,FALSE) -> 12
A614: =R[-22]C+60 -> 1971 | B614: =VLOOKUP(RC[1],Sheet4!C[-1]:C[2],2,FALSE)&VLOOKUP(RC[1],Sheet4!C[-1]:C[2],3,FALSE)&RC[2]&VLOOKUP(RC[1],Sheet4!C[-1]:C[2],4,FALSE)&"（%s/"&RC[2]&"）" -> 进入勇者试练战斗10次（%s/10） | C614: =R[-22]C -> 12 | D614: =R[-22]C -> 10 | E614: 0 | F614: =R[-22]C -> 19012 | G614: =R[-22]C -> 500 | H614: =VLOOKUP(RC[-5],Sheet4!C[-7]:C[-2],5,FALSE) -> 17
A615: =R[-22]C+60 -> 1972 | B615: =VLOOKUP(RC[1],Sheet4!C[-1]:C[2],2,FALSE)&VLOOKUP(RC[1],Sheet4!C[-1]:C[2],3,FALSE)&RC[2]&VLOOKUP(RC[1],Sheet4!C[-1]:C[2],4,FALSE)&"（%s/"&RC[2]&"）" -> 竞技场战斗5次（%s/5） | C615: =R[-22]C -> 10 | D615: =R[-22]C -> 5 | E615: 0 | F615: =R[-22]C -> 19013 | G615: =R[-22]C -> 500 | H615: =VLOOKUP(RC[-5],Sheet4!C[-7]:C[-2],5,FALSE) -> 21
A616: =R[-22]C+60 -> 1973 | B616: =VLOOKUP(RC[1],Sheet4!C[-1]:C[2],2,FALSE)&VLOOKUP(RC[1],Sheet4!C[-1]:C[2],3,FALSE)&RC[2]&VLOOKUP(RC[1],Sheet4!C[-1]:C[2],4,FALSE)&"（%s/"&RC[2]&"）" -> 主线副本挑战5次（%s/5） | C616: =R[-22]C -> 1 | D616: =R[-22]C -> 5 | E616: 0 | F616: =R[-22]C -> 19003 | G616: =R[-22]C -> 30000 | H616: =VLOOKUP(RC[-5],Sheet4!C[-7]:C[-2],5,FALSE) -> 26
A617: =R[-22]C+60 -> 1974 | B617: =VLOOKUP(RC[1],Sheet4!C[-1]:C[2],2,FALSE)&VLOOKUP(RC[1],Sheet4!C[-1]:C[2],3,FALSE)&RC[2]&VLOOKUP(RC[1],Sheet4!C[-1]:C[2],4,FALSE)&"（%s/"&RC[2]&"）" -> 日常副本战斗4次（%s/4） | C617: =R[-22]C -> 13 | D617: =R[-22]C -> 4 | E617: 0 | F617: =R[-22]C -> 19005 | G617: =R[-22]C -> 50 | H617: =VLOOKUP(RC[-5],Sheet4!C[-7]:C[-2],5,FALSE) -> 2
A618: =R[-22]C+60 -> 1981 | B618: =VLOOKUP(RC[1],Sheet4!C[-1]:C[2],2,FALSE)&VLOOKUP(RC[1],Sheet4!C[-1]:C[2],3,FALSE)&RC[2]&VLOOKUP(RC[1],Sheet4!C[-1]:C[2],4,FALSE)&"（%s/"&RC[2]&"）" -> 赠送好友精力3次（%s/3） | C618: =R[-22]C -> 4 | D618: =R[-22]C -> 3 | E618: 0 | F618: =R[-22]C -> 19005 | G618: =R[-22]C -> 50 | H618: =VLOOKUP(RC[-5],Sheet4!C[-7]:C[-2],5,FALSE) -> 15
A619: =R[-22]C+60 -> 1982 | B619: =VLOOKUP(RC[1],Sheet4!C[-1]:C[2],2,FALSE)&VLOOKUP(RC[1],Sheet4!C[-1]:C[2],3,FALSE)&RC[2]&VLOOKUP(RC[1],Sheet4!C[-1]:C[2],4,FALSE)&"（%s/"&RC[2]&"）" -> 英雄培养15次（%s/15） | C619: =R[-22]C -> 3 | D619: =R[-22]C -> 15 | E619: 0 | F619: =R[-22]C -> 10003 | G619: =R[-22]C -> 30 | H619: =VLOOKUP(RC[-5],Sheet4!C[-7]:C[-2],5,FALSE) -> 8
A620: =R[-22]C+60 -> 1983 | B620: =VLOOKUP(RC[1],Sheet4!C[-1]:C[2],2,FALSE)&VLOOKUP(RC[1],Sheet4!C[-1]:C[2],3,FALSE)&RC[2]&VLOOKUP(RC[1],Sheet4!C[-1]:C[2],4,FALSE)&"（%s/"&RC[2]&"）" -> 英雄商店购买1次（%s/1） | C620: =R[-22]C -> 5 | D620: =R[-22]C -> 1 | E620: 0 | F620: =R[-22]C -> 19006 | G620: =R[-22]C -> 80 | H620: =VLOOKUP(RC[-5],Sheet4!C[-7]:C[-2],5,FALSE) -> 11
A621: =R[-22]C+60 -> 1984 | B621: =VLOOKUP(RC[1],Sheet4!C[-1]:C[2],2,FALSE)&VLOOKUP(RC[1],Sheet4!C[-1]:C[2],3,FALSE)&RC[2]&VLOOKUP(RC[1],Sheet4!C[-1]:C[2],4,FALSE)&"（%s/"&RC[2]&"）" -> 遗迹探索4小时（%s/4） | C621: =R[-22]C -> 19 | D621: =R[-22]C -> 4 | E621: 0 | F621: =R[-22]C -> 19005 | G621: =R[-22]C -> 50 | H621: =VLOOKUP(RC[-5],Sheet4!C[-7]:C[-2],5,FALSE) -> 20
A622: =R[-22]C+60 -> 1991 | B622: =VLOOKUP(RC[1],Sheet4!C[-1]:C[2],2,FALSE)&VLOOKUP(RC[1],Sheet4!C[-1]:C[2],3,FALSE)&RC[2]&VLOOKUP(RC[1],Sheet4!C[-1]:C[2],4,FALSE)&"（%s/"&RC[2]&"）" -> 精英副本战斗1次（%s/1） | C622: =R[-22]C -> 15 | D622: =R[-22]C -> 1 | E622: 0 | F622: =R[-22]C -> 10008 | G622: =R[-22]C -> 30 | H622: =VLOOKUP(RC[-5],Sheet4!C[-7]:C[-2],5,FALSE) -> 28
A623: =R[-22]C+60 -> 1992 | B623: =VLOOKUP(RC[1],Sheet4!C[-1]:C[2],2,FALSE)&VLOOKUP(RC[1],Sheet4!C[-1]:C[2],3,FALSE)&RC[2]&VLOOKUP(RC[1],Sheet4!C[-1]:C[2],4,FALSE)&"（%s/"&RC[2]&"）" -> 异度入侵分享2次（%s/2） | C623: =R[-22]C -> 17 | D623: =R[-22]C -> 2 | E623: 0 | F623: =R[-22]C -> 19014 | G623: =R[-22]C -> 500 | H623: =VLOOKUP(RC[-5],Sheet4!C[-7]:C[-2],5,FALSE) -> 16
A624: =R[-22]C+60 -> 1993 | B624: =VLOOKUP(RC[1],Sheet4!C[-1]:C[2],2,FALSE)&VLOOKUP(RC[1],Sheet4!C[-1]:C[2],3,FALSE)&RC[2]&VLOOKUP(RC[1],Sheet4!C[-1]:C[2],4,FALSE)&"（%s/"&RC[2]&"）" -> 讨伐异度入侵者2次（%s/2） | C624: =R[-22]C -> 18 | D624: =R[-22]C -> 2 | E624: 0 | F624: =R[-22]C -> 19014 | G624: =R[-22]C -> 500 | H624: =VLOOKUP(RC[-5],Sheet4!C[-7]:C[-2],5,FALSE) -> 16
A625: =R[-22]C+60 -> 1994 | B625: =VLOOKUP(RC[1],Sheet4!C[-1]:C[2],2,FALSE)&VLOOKUP(RC[1],Sheet4!C[-1]:C[2],3,FALSE)&RC[2]&VLOOKUP(RC[1],Sheet4!C[-1]:C[2],4,FALSE)&"（%s/"&RC[2]&"）" -> 无尽深渊战斗1次（%s/1） | C625: =R[-22]C -> 23 | D625: =R[-22]C -> 1 | E625: 0 | F625: =R[-22]C -> 19028 | G625: =R[-22]C -> 50 | H625: =VLOOKUP(RC[-5],Sheet4!C[-7]:C[-2],5,FALSE) -> 88
A626: =R[-22]C+60 -> 2001 | B626: =VLOOKUP(RC[1],Sheet4!C[-1]:C[2],2,FALSE)&VLOOKUP(RC[1],Sheet4!C[-1]:C[2],3,FALSE)&RC[2]&VLOOKUP(RC[1],Sheet4!C[-1]:C[2],4,FALSE)&"（%s/"&RC[2]&"）" -> 击杀遗迹破坏者3次（%s/3） | C626: =R[-22]C -> 16 | D626: =R[-22]C -> 3 | E626: 0 | F626: =R[-22]C -> 19005 | G626: =R[-22]C -> 50 | H626: =VLOOKUP(RC[-5],Sheet4!C[-7]:C[-2],5,FALSE) -> 20
A627: =R[-22]C+60 -> 2002 | B627: =VLOOKUP(RC[1],Sheet4!C[-1]:C[2],2,FALSE)&VLOOKUP(RC[1],Sheet4!C[-1]:C[2],3,FALSE)&RC[2]&VLOOKUP(RC[1],Sheet4!C[-1]:C[2],4,FALSE)&"（%s/"&RC[2]&"）" -> 占卜翻牌5次（%s/5） | C627: =R[-22]C -> 25 | D627: =R[-22]C -> 5 | E627: 0 | F627: =R[-22]C -> 10096 | G627: =R[-22]C -> 1 | H627: =VLOOKUP(RC[-5],Sheet4!C[-7]:C[-2],5,FALSE) -> 113
A628: =R[-22]C+60 -> 2003 | B628: =VLOOKUP(RC[1],Sheet4!C[-1]:C[2],2,FALSE)&VLOOKUP(RC[1],Sheet4!C[-1]:C[2],3,FALSE)&RC[2]&VLOOKUP(RC[1],Sheet4!C[-1]:C[2],4,FALSE)&"（%s/"&RC[2]&"）" -> 英雄副本战斗1次（%s/1） | C628: =R[-22]C -> 14 | D628: =R[-22]C -> 1 | E628: 0 | F628: =R[-22]C -> 19006 | G628: =R[-22]C -> 80 | H628: =VLOOKUP(RC[-5],Sheet4!C[-7]:C[-2],5,FALSE) -> 27
A629: 10011 | B629: =VLOOKUP(RC[1],Sheet4!C[-1]:C[2],2,FALSE)&VLOOKUP(RC[1],Sheet4!C[-1]:C[2],3,FALSE)&RC[2]&VLOOKUP(RC[1],Sheet4!C[-1]:C[2],4,FALSE)&"（%s/"&RC[2]&"）" -> 主线副本挑战3次（%s/3） | C629: 1 | D629: 3 | E629: 0 | F629: 19003 | G629: 5000 | H629: =VLOOKUP(RC[-5],Sheet4!C[-7]:C[-2],5,FALSE) -> 26 | I629: 1
A630: 10021 | B630: =VLOOKUP(RC[1],Sheet4!C[-1]:C[2],2,FALSE)&VLOOKUP(RC[1],Sheet4!C[-1]:C[2],3,FALSE)&RC[2]&VLOOKUP(RC[1],Sheet4!C[-1]:C[2],4,FALSE)&"（%s/"&RC[2]&"）" -> 主线副本挑战6次（%s/6） | C630: 1 | D630: 6 | E630: 0 | F630: 19005 | G630: 20 | H630: =VLOOKUP(RC[-5],Sheet4!C[-7]:C[-2],5,FALSE) -> 26
A631: 10031 | B631: =VLOOKUP(RC[1],Sheet4!C[-1]:C[2],2,FALSE)&VLOOKUP(RC[1],Sheet4!C[-1]:C[2],3,FALSE)&RC[2]&VLOOKUP(RC[1],Sheet4!C[-1]:C[2],4,FALSE)&"（%s/"&RC[2]&"）" -> 进行召唤3次（%s/3） | C631: 8 | D631: 3 | E631: 0 | F631: 10019 | G631: 1 | H631: =VLOOKUP(RC[-5],Sheet4!C[-7]:C[-2],5,FALSE) -> 9
A632: 10041 | B632: =VLOOKUP(RC[1],Sheet4!C[-1]:C[2],2,FALSE)&VLOOKUP(RC[1],Sheet4!C[-1]:C[2],3,FALSE)&RC[2]&VLOOKUP(RC[1],Sheet4!C[-1]:C[2],4,FALSE)&"（%s/"&RC[2]&"）" -> 赠送好友精力1次（%s/1） | C632: 4 | D632: 1 | E632: 0 | F632: 19005 | G632: 20 | H632: =VLOOKUP(RC[-5],Sheet4!C[-7]:C[-2],5,FALSE) -> 15
A633: 10051 | B633: =VLOOKUP(RC[1],Sheet4!C[-1]:C[2],2,FALSE)&VLOOKUP(RC[1],Sheet4!C[-1]:C[2],3,FALSE)&RC[2]&VLOOKUP(RC[1],Sheet4!C[-1]:C[2],4,FALSE)&"（%s/"&RC[2]&"）" -> 购买体力1次（%s/1） | C633: 6 | D633: 1 | E633: 0 | F633: 19005 | G633: 20 | H633: =VLOOKUP(RC[-5],Sheet4!C[-7]:C[-2],5,FALSE) -> 12
A634: 10061 | B634: =VLOOKUP(RC[1],Sheet4!C[-1]:C[2],2,FALSE)&VLOOKUP(RC[1],Sheet4!C[-1]:C[2],3,FALSE)&RC[2]&VLOOKUP(RC[1],Sheet4!C[-1]:C[2],4,FALSE)&"（%s/"&RC[2]&"）" -> 购买精力1次（%s/1） | C634: 7 | D634: 1 | E634: 0 | F634: 19005 | G634: 20 | H634: =VLOOKUP(RC[-5],Sheet4!C[-7]:C[-2],5,FALSE) -> 12
A635: 10071 | B635: =VLOOKUP(RC[1],Sheet4!C[-1]:C[2],2,FALSE)&VLOOKUP(RC[1],Sheet4!C[-1]:C[2],3,FALSE)&RC[2]&VLOOKUP(RC[1],Sheet4!C[-1]:C[2],4,FALSE)&"（%s/"&RC[2]&"）" -> 进行高级召唤1次（%s/1） | C635: 9 | D635: 1 | E635: 0 | F635: 10019 | G635: 1 | H635: =VLOOKUP(RC[-5],Sheet4!C[-7]:C[-2],5,FALSE) -> 9
A636: 10081 | B636: =VLOOKUP(RC[1],Sheet4!C[-1]:C[2],2,FALSE)&VLOOKUP(RC[1],Sheet4!C[-1]:C[2],3,FALSE)&RC[2]&VLOOKUP(RC[1],Sheet4!C[-1]:C[2],4,FALSE)&"（%s/"&RC[2]&"）" -> 装备强化10次（%s/10） | C636: 21 | D636: 10 | E636: 0 | F636: 19003 | G636: 10000 | H636: =VLOOKUP(RC[-5],Sheet4!C[-7]:C[-2],5,FALSE) -> 8
A637: 10091 | B637: =VLOOKUP(RC[1],Sheet4!C[-1]:C[2],2,FALSE)&VLOOKUP(RC[1],Sheet4!C[-1]:C[2],3,FALSE)&RC[2]&VLOOKUP(RC[1],Sheet4!C[-1]:C[2],4,FALSE)&"（%s/"&RC[2]&"）" -> 英雄培养5次（%s/5） | C637: 3 | D637: 5 | E637: 0 | F637: 10003 | G637: 10 | H637: =VLOOKUP(RC[-5],Sheet4!C[-7]:C[-2],5,FALSE) -> 8
A638: 10101 | B638: =VLOOKUP(RC[1],Sheet4!C[-1]:C[2],2,FALSE)&VLOOKUP(RC[1],Sheet4!C[-1]:C[2],3,FALSE)&RC[2]&VLOOKUP(RC[1],Sheet4!C[-1]:C[2],4,FALSE)&"（%s/"&RC[2]&"）" -> 竞技场战斗3次（%s/3） | C638: 10 | D638: 3 | E638: 0 | F638: 19013 | G638: 100 | H638: =VLOOKUP(RC[-5],Sheet4!C[-7]:C[-2],5,FALSE) -> 21
A639: 10111 | B639: =VLOOKUP(RC[1],Sheet4!C[-1]:C[2],2,FALSE)&VLOOKUP(RC[1],Sheet4!C[-1]:C[2],3,FALSE)&RC[2]&VLOOKUP(RC[1],Sheet4!C[-1]:C[2],4,FALSE)&"（%s/"&RC[2]&"）" -> 英雄商店购买1次（%s/1） | C639: 5 | D639: 1 | E639: 0 | F639: 19006 | G639: 30 | H639: =VLOOKUP(RC[-5],Sheet4!C[-7]:C[-2],5,FALSE) -> 11
A640: 10121 | B640: =VLOOKUP(RC[1],Sheet4!C[-1]:C[2],2,FALSE)&VLOOKUP(RC[1],Sheet4!C[-1]:C[2],3,FALSE)&RC[2]&VLOOKUP(RC[1],Sheet4!C[-1]:C[2],4,FALSE)&"（%s/"&RC[2]&"）" -> 主线副本挑战3次（%s/3） | C640: 1 | D640: 3 | E640: 0 | F640: 19003 | G640: 10000 | H640: =VLOOKUP(RC[-5],Sheet4!C[-7]:C[-2],5,FALSE) -> 26
A641: 10131 | B641: =VLOOKUP(RC[1],Sheet4!C[-1]:C[2],2,FALSE)&VLOOKUP(RC[1],Sheet4!C[-1]:C[2],3,FALSE)&RC[2]&VLOOKUP(RC[1],Sheet4!C[-1]:C[2],4,FALSE)&"（%s/"&RC[2]&"）" -> 圣器争夺2次（%s/2） | C641: 11 | D641: 2 | E641: 0 | F641: 13049 | G641: 3 | H641: =VLOOKUP(RC[-5],Sheet4!C[-7]:C[-2],5,FALSE) -> 19
A642: 10132 | B642: =VLOOKUP(RC[1],Sheet4!C[-1]:C[2],2,FALSE)&VLOOKUP(RC[1],Sheet4!C[-1]:C[2],3,FALSE)&RC[2]&VLOOKUP(RC[1],Sheet4!C[-1]:C[2],4,FALSE)&"（%s/"&RC[2]&"）" -> 圣器合成2次（%s/2） | C642: 22 | D642: 2 | E642: 0 | F642: 13049 | G642: 3 | H642: =VLOOKUP(RC[-5],Sheet4!C[-7]:C[-2],5,FALSE) -> 19
A643: 10133 | B643: =VLOOKUP(RC[1],Sheet4!C[-1]:C[2],2,FALSE)&VLOOKUP(RC[1],Sheet4!C[-1]:C[2],3,FALSE)&RC[2]&VLOOKUP(RC[1],Sheet4!C[-1]:C[2],4,FALSE)&"（%s/"&RC[2]&"）" -> 圣器强化2次（%s/2） | C643: 2 | D643: 2 | E643: 0 | F643: 13049 | G643: 3 | H643: =VLOOKUP(RC[-5],Sheet4!C[-7]:C[-2],5,FALSE) -> 8
A644: 10141 | B644: =VLOOKUP(RC[1],Sheet4!C[-1]:C[2],2,FALSE)&VLOOKUP(RC[1],Sheet4!C[-1]:C[2],3,FALSE)&RC[2]&VLOOKUP(RC[1],Sheet4!C[-1]:C[2],4,FALSE)&"（%s/"&RC[2]&"）" -> 赠送好友精力1次（%s/1） | C644: 4 | D644: 1 | E644: 0 | F644: 19005 | G644: 20 | H644: =VLOOKUP(RC[-5],Sheet4!C[-7]:C[-2],5,FALSE) -> 15
A645: 10151 | B645: =VLOOKUP(RC[1],Sheet4!C[-1]:C[2],2,FALSE)&VLOOKUP(RC[1],Sheet4!C[-1]:C[2],3,FALSE)&RC[2]&VLOOKUP(RC[1],Sheet4!C[-1]:C[2],4,FALSE)&"（%s/"&RC[2]&"）" -> 进行召唤3次（%s/3） | C645: 8 | D645: 3 | E645: 0 | F645: 10019 | G645: 1 | H645: =VLOOKUP(RC[-5],Sheet4!C[-7]:C[-2],5,FALSE) -> 9
A646: 10161 | B646: =VLOOKUP(RC[1],Sheet4!C[-1]:C[2],2,FALSE)&VLOOKUP(RC[1],Sheet4!C[-1]:C[2],3,FALSE)&RC[2]&VLOOKUP(RC[1],Sheet4!C[-1]:C[2],4,FALSE)&"（%s/"&RC[2]&"）" -> 购买体力1次（%s/1） | C646: 6 | D646: 1 | E646: 0 | F646: 19005 | G646: 20 | H646: =VLOOKUP(RC[-5],Sheet4!C[-7]:C[-2],5,FALSE) -> 12
A647: 10162 | B647: =VLOOKUP(RC[1],Sheet4!C[-1]:C[2],2,FALSE)&VLOOKUP(RC[1],Sheet4!C[-1]:C[2],3,FALSE)&RC[2]&VLOOKUP(RC[1],Sheet4!C[-1]:C[2],4,FALSE)&"（%s/"&RC[2]&"）" -> 购买精力1次（%s/1） | C647: 7 | D647: 1 | E647: 0 | F647: 19005 | G647: 20 | H647: =VLOOKUP(RC[-5],Sheet4!C[-7]:C[-2],5,FALSE) -> 12
A648: 10171 | B648: =VLOOKUP(RC[1],Sheet4!C[-1]:C[2],2,FALSE)&VLOOKUP(RC[1],Sheet4!C[-1]:C[2],3,FALSE)&RC[2]&VLOOKUP(RC[1],Sheet4!C[-1]:C[2],4,FALSE)&"（%s/"&RC[2]&"）" -> 进行高级召唤1次（%s/1） | C648: 9 | D648: 1 | E648: 0 | F648: 10019 | G648: 1 | H648: =VLOOKUP(RC[-5],Sheet4!C[-7]:C[-2],5,FALSE) -> 9
A649: 10181 | B649: =VLOOKUP(RC[1],Sheet4!C[-1]:C[2],2,FALSE)&VLOOKUP(RC[1],Sheet4!C[-1]:C[2],3,FALSE)&RC[2]&VLOOKUP(RC[1],Sheet4!C[-1]:C[2],4,FALSE)&"（%s/"&RC[2]&"）" -> 装备强化10次（%s/10） | C649: 21 | D649: 10 | E649: 0 | F649: 19003 | G649: 20000 | H649: =VLOOKUP(RC[-5],Sheet4!C[-7]:C[-2],5,FALSE) -> 8
A650: 10191 | B650: =VLOOKUP(RC[1],Sheet4!C[-1]:C[2],2,FALSE)&VLOOKUP(RC[1],Sheet4!C[-1]:C[2],3,FALSE)&RC[2]&VLOOKUP(RC[1],Sheet4!C[-1]:C[2],4,FALSE)&"（%s/"&RC[2]&"）" -> 英雄培养5次（%s/5） | C650: 3 | D650: 5 | E650: 0 | F650: 10003 | G650: 15 | H650: =VLOOKUP(RC[-5],Sheet4!C[-7]:C[-2],5,FALSE) -> 8
A651: 10201 | B651: =VLOOKUP(RC[1],Sheet4!C[-1]:C[2],2,FALSE)&VLOOKUP(RC[1],Sheet4!C[-1]:C[2],3,FALSE)&RC[2]&VLOOKUP(RC[1],Sheet4!C[-1]:C[2],4,FALSE)&"（%s/"&RC[2]&"）" -> 进入勇者试练战斗3次（%s/3） | C651: 12 | D651: 3 | E651: 0 | F651: 19012 | G651: 300 | H651: =VLOOKUP(RC[-5],Sheet4!C[-7]:C[-2],5,FALSE) -> 17
A652: 10211 | B652: =VLOOKUP(RC[1],Sheet4!C[-1]:C[2],2,FALSE)&VLOOKUP(RC[1],Sheet4!C[-1]:C[2],3,FALSE)&RC[2]&VLOOKUP(RC[1],Sheet4!C[-1]:C[2],4,FALSE)&"（%s/"&RC[2]&"）" -> 竞技场战斗3次（%s/3） | C652: 10 | D652: 3 | E652: 0 | F652: 19013 | G652: 150 | H652: =VLOOKUP(RC[-5],Sheet4!C[-7]:C[-2],5,FALSE) -> 21
A653: 10221 | B653: =VLOOKUP(RC[1],Sheet4!C[-1]:C[2],2,FALSE)&VLOOKUP(RC[1],Sheet4!C[-1]:C[2],3,FALSE)&RC[2]&VLOOKUP(RC[1],Sheet4!C[-1]:C[2],4,FALSE)&"（%s/"&RC[2]&"）" -> 英雄商店购买1次（%s/1） | C653: 5 | D653: 1 | E653: 0 | F653: 19006 | G653: 50 | H653: =VLOOKUP(RC[-5],Sheet4!C[-7]:C[-2],5,FALSE) -> 11
A654: 10231 | B654: =VLOOKUP(RC[1],Sheet4!C[-1]:C[2],2,FALSE)&VLOOKUP(RC[1],Sheet4!C[-1]:C[2],3,FALSE)&RC[2]&VLOOKUP(RC[1],Sheet4!C[-1]:C[2],4,FALSE)&"（%s/"&RC[2]&"）" -> 主线副本挑战3次（%s/3） | C654: 1 | D654: 3 | E654: 0 | F654: 19003 | G654: 20000 | H654: =VLOOKUP(RC[-5],Sheet4!C[-7]:C[-2],5,FALSE) -> 26
A655: 10241 | B655: =VLOOKUP(RC[1],Sheet4!C[-1]:C[2],2,FALSE)&VLOOKUP(RC[1],Sheet4!C[-1]:C[2],3,FALSE)&RC[2]&VLOOKUP(RC[1],Sheet4!C[-1]:C[2],4,FALSE)&"（%s/"&RC[2]&"）" -> 日常副本战斗2次（%s/2） | C655: 13 | D655: 2 | E655: 0 | F655: 19005 | G655: 20 | H655: =VLOOKUP(RC[-5],Sheet4!C[-7]:C[-2],5,FALSE) -> 2
A656: 10251 | B656: =VLOOKUP(RC[1],Sheet4!C[-1]:C[2],2,FALSE)&VLOOKUP(RC[1],Sheet4!C[-1]:C[2],3,FALSE)&RC[2]&VLOOKUP(RC[1],Sheet4!C[-1]:C[2],4,FALSE)&"（%s/"&RC[2]&"）" -> 遗迹探索1小时（%s/1） | C656: 19 | D656: 1 | E656: 0 | F656: 19003 | G656: 25000 | H656: =VLOOKUP(RC[-5],Sheet4!C[-7]:C[-2],5,FALSE) -> 20
A657: 10261 | B657: =VLOOKUP(RC[1],Sheet4!C[-1]:C[2],2,FALSE)&VLOOKUP(RC[1],Sheet4!C[-1]:C[2],3,FALSE)&RC[2]&VLOOKUP(RC[1],Sheet4!C[-1]:C[2],4,FALSE)&"（%s/"&RC[2]&"）" -> 击杀遗迹破坏者1次（%s/1） | C657: 16 | D657: 1 | E657: 0 | F657: 19005 | G657: 20 | H657: =VLOOKUP(RC[-5],Sheet4!C[-7]:C[-2],5,FALSE) -> 20
A658: 10271 | B658: =VLOOKUP(RC[1],Sheet4!C[-1]:C[2],2,FALSE)&VLOOKUP(RC[1],Sheet4!C[-1]:C[2],3,FALSE)&RC[2]&VLOOKUP(RC[1],Sheet4!C[-1]:C[2],4,FALSE)&"（%s/"&RC[2]&"）" -> 英雄副本战斗1次（%s/1） | C658: 14 | D658: 1 | E658: 0 | F658: 19006 | G658: 50 | H658: =VLOOKUP(RC[-5],Sheet4!C[-7]:C[-2],5,FALSE) -> 27
A659: 10281 | B659: =VLOOKUP(RC[1],Sheet4!C[-1]:C[2],2,FALSE)&VLOOKUP(RC[1],Sheet4!C[-1]:C[2],3,FALSE)&RC[2]&VLOOKUP(RC[1],Sheet4!C[-1]:C[2],4,FALSE)&"（%s/"&RC[2]&"）" -> 圣器争夺3次（%s/3） | C659: 11 | D659: 3 | E659: 0 | F659: 13049 | G659: 5 | H659: =VLOOKUP(RC[-5],Sheet4!C[-7]:C[-2],5,FALSE) -> 19
A660: 10282 | B660: =VLOOKUP(RC[1],Sheet4!C[-1]:C[2],2,FALSE)&VLOOKUP(RC[1],Sheet4!C[-1]:C[2],3,FALSE)&RC[2]&VLOOKUP(RC[1],Sheet4!C[-1]:C[2],4,FALSE)&"（%s/"&RC[2]&"）" -> 圣器合成2次（%s/2） | C660: 22 | D660: 2 | E660: 0 | F660: 13049 | G660: 5 | H660: =VLOOKUP(RC[-5],Sheet4!C[-7]:C[-2],5,FALSE) -> 19
A661: 10291 | B661: =VLOOKUP(RC[1],Sheet4!C[-1]:C[2],2,FALSE)&VLOOKUP(RC[1],Sheet4!C[-1]:C[2],3,FALSE)&RC[2]&VLOOKUP(RC[1],Sheet4!C[-1]:C[2],4,FALSE)&"（%s/"&RC[2]&"）" -> 圣器强化3次（%s/3） | C661: 2 | D661: 3 | E661: 0 | F661: 13049 | G661: 5 | H661: =VLOOKUP(RC[-5],Sheet4!C[-7]:C[-2],5,FALSE) -> 8
A662: 10301 | B662: =VLOOKUP(RC[1],Sheet4!C[-1]:C[2],2,FALSE)&VLOOKUP(RC[1],Sheet4!C[-1]:C[2],3,FALSE)&RC[2]&VLOOKUP(RC[1],Sheet4!C[-1]:C[2],4,FALSE)&"（%s/"&RC[2]&"）" -> 赠送好友精力3次（%s/3） | C662: 4 | D662: 3 | E662: 0 | F662: 19005 | G662: 30 | H662: =VLOOKUP(RC[-5],Sheet4!C[-7]:C[-2],5,FALSE) -> 15
A663: 10311 | B663: =VLOOKUP(RC[1],Sheet4!C[-1]:C[2],2,FALSE)&VLOOKUP(RC[1],Sheet4!C[-1]:C[2],3,FALSE)&RC[2]&VLOOKUP(RC[1],Sheet4!C[-1]:C[2],4,FALSE)&"（%s/"&RC[2]&"）" -> 进行召唤5次（%s/5） | C663: 8 | D663: 5 | E663: 0 | F663: 19006 | G663: 60 | H663: =VLOOKUP(RC[-5],Sheet4!C[-7]:C[-2],5,FALSE) -> 9
A664: 10312 | B664: =VLOOKUP(RC[1],Sheet4!C[-1]:C[2],2,FALSE)&VLOOKUP(RC[1],Sheet4!C[-1]:C[2],3,FALSE)&RC[2]&VLOOKUP(RC[1],Sheet4!C[-1]:C[2],4,FALSE)&"（%s/"&RC[2]&"）" -> 进行高级召唤2次（%s/2） | C664: 9 | D664: 2 | E664: 0 | F664: 19006 | G664: 80 | H664: =VLOOKUP(RC[-5],Sheet4!C[-7]:C[-2],5,FALSE) -> 9
A665: 10321 | B665: =VLOOKUP(RC[1],Sheet4!C[-1]:C[2],2,FALSE)&VLOOKUP(RC[1],Sheet4!C[-1]:C[2],3,FALSE)&RC[2]&VLOOKUP(RC[1],Sheet4!C[-1]:C[2],4,FALSE)&"（%s/"&RC[2]&"）" -> 购买体力2次（%s/2） | C665: 6 | D665: 2 | E665: 0 | F665: 19005 | G665: 30 | H665: =VLOOKUP(RC[-5],Sheet4!C[-7]:C[-2],5,FALSE) -> 12
A666: 10322 | B666: =VLOOKUP(RC[1],Sheet4!C[-1]:C[2],2,FALSE)&VLOOKUP(RC[1],Sheet4!C[-1]:C[2],3,FALSE)&RC[2]&VLOOKUP(RC[1],Sheet4!C[-1]:C[2],4,FALSE)&"（%s/"&RC[2]&"）" -> 购买精力2次（%s/2） | C666: 7 | D666: 2 | E666: 0 | F666: 19005 | G666: 30 | H666: =VLOOKUP(RC[-5],Sheet4!C[-7]:C[-2],5,FALSE) -> 12
A667: 10331 | B667: =VLOOKUP(RC[1],Sheet4!C[-1]:C[2],2,FALSE)&VLOOKUP(RC[1],Sheet4!C[-1]:C[2],3,FALSE)&RC[2]&VLOOKUP(RC[1],Sheet4!C[-1]:C[2],4,FALSE)&"（%s/"&RC[2]&"）" -> 英雄培养10次（%s/10） | C667: 3 | D667: 10 | E667: 0 | F667: 10003 | G667: 20 | H667: =VLOOKUP(RC[-5],Sheet4!C[-7]:C[-2],5,FALSE) -> 8
A668: 10341 | B668: =VLOOKUP(RC[1],Sheet4!C[-1]:C[2],2,FALSE)&VLOOKUP(RC[1],Sheet4!C[-1]:C[2],3,FALSE)&RC[2]&VLOOKUP(RC[1],Sheet4!C[-1]:C[2],4,FALSE)&"（%s/"&RC[2]&"）" -> 进入勇者试练战斗3次（%s/3） | C668: 12 | D668: 3 | E668: 0 | F668: 19012 | G668: 400 | H668: =VLOOKUP(RC[-5],Sheet4!C[-7]:C[-2],5,FALSE) -> 17
A669: 10351 | B669: =VLOOKUP(RC[1],Sheet4!C[-1]:C[2],2,FALSE)&VLOOKUP(RC[1],Sheet4!C[-1]:C[2],3,FALSE)&RC[2]&VLOOKUP(RC[1],Sheet4!C[-1]:C[2],4,FALSE)&"（%s/"&RC[2]&"）" -> 竞技场战斗5次（%s/5） | C669: 10 | D669: 5 | E669: 0 | F669: 19013 | G669: 200 | H669: =VLOOKUP(RC[-5],Sheet4!C[-7]:C[-2],5,FALSE) -> 21
A670: 10352 | B670: =VLOOKUP(RC[1],Sheet4!C[-1]:C[2],2,FALSE)&VLOOKUP(RC[1],Sheet4!C[-1]:C[2],3,FALSE)&RC[2]&VLOOKUP(RC[1],Sheet4!C[-1]:C[2],4,FALSE)&"（%s/"&RC[2]&"）" -> 主线副本挑战5次（%s/5） | C670: 1 | D670: 5 | E670: 0 | F670: 19003 | G670: 30000 | H670: =VLOOKUP(RC[-5],Sheet4!C[-7]:C[-2],5,FALSE) -> 26
A671: 10361 | B671: =VLOOKUP(RC[1],Sheet4!C[-1]:C[2],2,FALSE)&VLOOKUP(RC[1],Sheet4!C[-1]:C[2],3,FALSE)&RC[2]&VLOOKUP(RC[1],Sheet4!C[-1]:C[2],4,FALSE)&"（%s/"&RC[2]&"）" -> 英雄商店购买1次（%s/1） | C671: 5 | D671: 1 | E671: 0 | F671: 19006 | G671: 60 | H671: =VLOOKUP(RC[-5],Sheet4!C[-7]:C[-2],5,FALSE) -> 11
A672: 10362 | B672: =VLOOKUP(RC[1],Sheet4!C[-1]:C[2],2,FALSE)&VLOOKUP(RC[1],Sheet4!C[-1]:C[2],3,FALSE)&RC[2]&VLOOKUP(RC[1],Sheet4!C[-1]:C[2],4,FALSE)&"（%s/"&RC[2]&"）" -> 日常副本战斗4次（%s/4） | C672: 13 | D672: 4 | E672: 0 | F672: 19005 | G672: 30 | H672: =VLOOKUP(RC[-5],Sheet4!C[-7]:C[-2],5,FALSE) -> 2
A673: 10371 | B673: =VLOOKUP(RC[1],Sheet4!C[-1]:C[2],2,FALSE)&VLOOKUP(RC[1],Sheet4!C[-1]:C[2],3,FALSE)&RC[2]&VLOOKUP(RC[1],Sheet4!C[-1]:C[2],4,FALSE)&"（%s/"&RC[2]&"）" -> 遗迹探索4小时（%s/4） | C673: 19 | D673: 4 | E673: 0 | F673: 19003 | G673: 30000 | H673: =VLOOKUP(RC[-5],Sheet4!C[-7]:C[-2],5,FALSE) -> 20
A674: 10372 | B674: =VLOOKUP(RC[1],Sheet4!C[-1]:C[2],2,FALSE)&VLOOKUP(RC[1],Sheet4!C[-1]:C[2],3,FALSE)&RC[2]&VLOOKUP(RC[1],Sheet4!C[-1]:C[2],4,FALSE)&"（%s/"&RC[2]&"）" -> 击杀遗迹破坏者3次（%s/3） | C674: 16 | D674: 3 | E674: 0 | F674: 19005 | G674: 30 | H674: =VLOOKUP(RC[-5],Sheet4!C[-7]:C[-2],5,FALSE) -> 20
A675: 10381 | B675: =VLOOKUP(RC[1],Sheet4!C[-1]:C[2],2,FALSE)&VLOOKUP(RC[1],Sheet4!C[-1]:C[2],3,FALSE)&RC[2]&VLOOKUP(RC[1],Sheet4!C[-1]:C[2],4,FALSE)&"（%s/"&RC[2]&"）" -> 英雄副本战斗1次（%s/1） | C675: 14 | D675: 1 | E675: 0 | F675: 19006 | G675: 60 | H675: =VLOOKUP(RC[-5],Sheet4!C[-7]:C[-2],5,FALSE) -> 27
A676: 10382 | B676: =VLOOKUP(RC[1],Sheet4!C[-1]:C[2],2,FALSE)&VLOOKUP(RC[1],Sheet4!C[-1]:C[2],3,FALSE)&RC[2]&VLOOKUP(RC[1],Sheet4!C[-1]:C[2],4,FALSE)&"（%s/"&RC[2]&"）" -> 圣器争夺5次（%s/5） | C676: 11 | D676: 5 | E676: 0 | F676: 13049 | G676: 5 | H676: =VLOOKUP(RC[-5],Sheet4!C[-7]:C[-2],5,FALSE) -> 19
A677: 10383 | B677: =VLOOKUP(RC[1],Sheet4!C[-1]:C[2],2,FALSE)&VLOOKUP(RC[1],Sheet4!C[-1]:C[2],3,FALSE)&RC[2]&VLOOKUP(RC[1],Sheet4!C[-1]:C[2],4,FALSE)&"（%s/"&RC[2]&"）" -> 圣器合成3次（%s/3） | C677: 22 | D677: 3 | E677: 0 | F677: 13049 | G677: 5 | H677: =VLOOKUP(RC[-5],Sheet4!C[-7]:C[-2],5,FALSE) -> 19
A678: 10384 | B678: =VLOOKUP(RC[1],Sheet4!C[-1]:C[2],2,FALSE)&VLOOKUP(RC[1],Sheet4!C[-1]:C[2],3,FALSE)&RC[2]&VLOOKUP(RC[1],Sheet4!C[-1]:C[2],4,FALSE)&"（%s/"&RC[2]&"）" -> 圣器强化5次（%s/5） | C678: 2 | D678: 5 | E678: 0 | F678: 13049 | G678: 5 | H678: =VLOOKUP(RC[-5],Sheet4!C[-7]:C[-2],5,FALSE) -> 8
A679: 10391 | B679: =VLOOKUP(RC[1],Sheet4!C[-1]:C[2],2,FALSE)&VLOOKUP(RC[1],Sheet4!C[-1]:C[2],3,FALSE)&RC[2]&VLOOKUP(RC[1],Sheet4!C[-1]:C[2],4,FALSE)&"（%s/"&RC[2]&"）" -> 赠送好友精力3次（%s/3） | C679: 4 | D679: 3 | E679: 0 | F679: 19005 | G679: 40 | H679: =VLOOKUP(RC[-5],Sheet4!C[-7]:C[-2],5,FALSE) -> 15
A680: 10392 | B680: =VLOOKUP(RC[1],Sheet4!C[-1]:C[2],2,FALSE)&VLOOKUP(RC[1],Sheet4!C[-1]:C[2],3,FALSE)&RC[2]&VLOOKUP(RC[1],Sheet4!C[-1]:C[2],4,FALSE)&"（%s/"&RC[2]&"）" -> 进行召唤5次（%s/5） | C680: 8 | D680: 5 | E680: 0 | F680: 19006 | G680: 60 | H680: =VLOOKUP(RC[-5],Sheet4!C[-7]:C[-2],5,FALSE) -> 9
A681: 10393 | B681: =VLOOKUP(RC[1],Sheet4!C[-1]:C[2],2,FALSE)&VLOOKUP(RC[1],Sheet4!C[-1]:C[2],3,FALSE)&RC[2]&VLOOKUP(RC[1],Sheet4!C[-1]:C[2],4,FALSE)&"（%s/"&RC[2]&"）" -> 进行高级召唤2次（%s/2） | C681: 9 | D681: 2 | E681: 0 | F681: 19006 | G681: 80 | H681: =VLOOKUP(RC[-5],Sheet4!C[-7]:C[-2],5,FALSE) -> 9
A682: 10401 | B682: =VLOOKUP(RC[1],Sheet4!C[-1]:C[2],2,FALSE)&VLOOKUP(RC[1],Sheet4!C[-1]:C[2],3,FALSE)&RC[2]&VLOOKUP(RC[1],Sheet4!C[-1]:C[2],4,FALSE)&"（%s/"&RC[2]&"）" -> 异度入侵分享2次（%s/2） | C682: 17 | D682: 2 | E682: 0 | F682: 19014 | G682: 400 | H682: =VLOOKUP(RC[-5],Sheet4!C[-7]:C[-2],5,FALSE) -> 16
A683: 10402 | B683: =VLOOKUP(RC[1],Sheet4!C[-1]:C[2],2,FALSE)&VLOOKUP(RC[1],Sheet4!C[-1]:C[2],3,FALSE)&RC[2]&VLOOKUP(RC[1],Sheet4!C[-1]:C[2],4,FALSE)&"（%s/"&RC[2]&"）" -> 讨伐异度入侵者2次（%s/2） | C683: 18 | D683: 2 | E683: 0 | F683: 19014 | G683: 400 | H683: =VLOOKUP(RC[-5],Sheet4!C[-7]:C[-2],5,FALSE) -> 16
A684: 10411 | B684: =VLOOKUP(RC[1],Sheet4!C[-1]:C[2],2,FALSE)&VLOOKUP(RC[1],Sheet4!C[-1]:C[2],3,FALSE)&RC[2]&VLOOKUP(RC[1],Sheet4!C[-1]:C[2],4,FALSE)&"（%s/"&RC[2]&"）" -> 购买体力2次（%s/2） | C684: 6 | D684: 2 | E684: 0 | F684: 19005 | G684: 40 | H684: =VLOOKUP(RC[-5],Sheet4!C[-7]:C[-2],5,FALSE) -> 12
A685: 10412 | B685: =VLOOKUP(RC[1],Sheet4!C[-1]:C[2],2,FALSE)&VLOOKUP(RC[1],Sheet4!C[-1]:C[2],3,FALSE)&RC[2]&VLOOKUP(RC[1],Sheet4!C[-1]:C[2],4,FALSE)&"（%s/"&RC[2]&"）" -> 购买精力2次（%s/2） | C685: 7 | D685: 2 | E685: 0 | F685: 19005 | G685: 40 | H685: =VLOOKUP(RC[-5],Sheet4!C[-7]:C[-2],5,FALSE) -> 12
A686: 10421 | B686: =VLOOKUP(RC[1],Sheet4!C[-1]:C[2],2,FALSE)&VLOOKUP(RC[1],Sheet4!C[-1]:C[2],3,FALSE)&RC[2]&VLOOKUP(RC[1],Sheet4!C[-1]:C[2],4,FALSE)&"（%s/"&RC[2]&"）" -> 无尽深渊战斗1次（%s/1） | C686: 23 | D686: 1 | E686: 0 | F686: 19028 | G686: 50 | H686: =VLOOKUP(RC[-5],Sheet4!C[-7]:C[-2],5,FALSE) -> 88
A687: 10422 | B687: =VLOOKUP(RC[1],Sheet4!C[-1]:C[2],2,FALSE)&VLOOKUP(RC[1],Sheet4!C[-1]:C[2],3,FALSE)&RC[2]&VLOOKUP(RC[1],Sheet4!C[-1]:C[2],4,FALSE)&"（%s/"&RC[2]&"）" -> 英雄培养15次（%s/15） | C687: 3 | D687: 15 | E687: 0 | F687: 10003 | G687: 30 | H687: =VLOOKUP(RC[-5],Sheet4!C[-7]:C[-2],5,FALSE) -> 8
A688: 10431 | B688: =VLOOKUP(RC[1],Sheet4!C[-1]:C[2],2,FALSE)&VLOOKUP(RC[1],Sheet4!C[-1]:C[2],3,FALSE)&RC[2]&VLOOKUP(RC[1],Sheet4!C[-1]:C[2],4,FALSE)&"（%s/"&RC[2]&"）" -> 进入勇者试练战斗10次（%s/10） | C688: 12 | D688: 10 | E688: 0 | F688: 19012 | G688: 500 | H688: =VLOOKUP(RC[-5],Sheet4!C[-7]:C[-2],5,FALSE) -> 17
A689: 10432 | B689: =VLOOKUP(RC[1],Sheet4!C[-1]:C[2],2,FALSE)&VLOOKUP(RC[1],Sheet4!C[-1]:C[2],3,FALSE)&RC[2]&VLOOKUP(RC[1],Sheet4!C[-1]:C[2],4,FALSE)&"（%s/"&RC[2]&"）" -> 竞技场战斗5次（%s/5） | C689: 10 | D689: 5 | E689: 0 | F689: 19013 | G689: 500 | H689: =VLOOKUP(RC[-5],Sheet4!C[-7]:C[-2],5,FALSE) -> 21
A690: 10433 | B690: =VLOOKUP(RC[1],Sheet4!C[-1]:C[2],2,FALSE)&VLOOKUP(RC[1],Sheet4!C[-1]:C[2],3,FALSE)&RC[2]&VLOOKUP(RC[1],Sheet4!C[-1]:C[2],4,FALSE)&"（%s/"&RC[2]&"）" -> 主线副本挑战5次（%s/5） | C690: 1 | D690: 5 | E690: 0 | F690: 19003 | G690: 40000 | H690: =VLOOKUP(RC[-5],Sheet4!C[-7]:C[-2],5,FALSE) -> 26
A691: 10441 | B691: =VLOOKUP(RC[1],Sheet4!C[-1]:C[2],2,FALSE)&VLOOKUP(RC[1],Sheet4!C[-1]:C[2],3,FALSE)&RC[2]&VLOOKUP(RC[1],Sheet4!C[-1]:C[2],4,FALSE)&"（%s/"&RC[2]&"）" -> 英雄商店购买1次（%s/1） | C691: 5 | D691: 1 | E691: 0 | F691: 19006 | G691: 60 | H691: =VLOOKUP(RC[-5],Sheet4!C[-7]:C[-2],5,FALSE) -> 11
A692: 10442 | B692: =VLOOKUP(RC[1],Sheet4!C[-1]:C[2],2,FALSE)&VLOOKUP(RC[1],Sheet4!C[-1]:C[2],3,FALSE)&RC[2]&VLOOKUP(RC[1],Sheet4!C[-1]:C[2],4,FALSE)&"（%s/"&RC[2]&"）" -> 日常副本战斗4次（%s/4） | C692: 13 | D692: 4 | E692: 0 | F692: 19005 | G692: 30 | H692: =VLOOKUP(RC[-5],Sheet4!C[-7]:C[-2],5,FALSE) -> 2
A693: 10451 | B693: =VLOOKUP(RC[1],Sheet4!C[-1]:C[2],2,FALSE)&VLOOKUP(RC[1],Sheet4!C[-1]:C[2],3,FALSE)&RC[2]&VLOOKUP(RC[1],Sheet4!C[-1]:C[2],4,FALSE)&"（%s/"&RC[2]&"）" -> 遗迹探索4小时（%s/4） | C693: 19 | D693: 4 | E693: 0 | F693: 19003 | G693: 40000 | H693: =VLOOKUP(RC[-5],Sheet4!C[-7]:C[-2],5,FALSE) -> 20
A694: 10452 | B694: =VLOOKUP(RC[1],Sheet4!C[-1]:C[2],2,FALSE)&VLOOKUP(RC[1],Sheet4!C[-1]:C[2],3,FALSE)&RC[2]&VLOOKUP(RC[1],Sheet4!C[-1]:C[2],4,FALSE)&"（%s/"&RC[2]&"）" -> 击杀遗迹破坏者3次（%s/3） | C694: 16 | D694: 3 | E694: 0 | F694: 19005 | G694: 30 | H694: =VLOOKUP(RC[-5],Sheet4!C[-7]:C[-2],5,FALSE) -> 20
A695: 10461 | B695: =VLOOKUP(RC[1],Sheet4!C[-1]:C[2],2,FALSE)&VLOOKUP(RC[1],Sheet4!C[-1]:C[2],3,FALSE)&RC[2]&VLOOKUP(RC[1],Sheet4!C[-1]:C[2],4,FALSE)&"（%s/"&RC[2]&"）" -> 英雄副本战斗1次（%s/1） | C695: 14 | D695: 1 | E695: 0 | F695: 19006 | G695: 60 | H695: =VLOOKUP(RC[-5],Sheet4!C[-7]:C[-2],5,FALSE) -> 27
A696: 10462 | B696: =VLOOKUP(RC[1],Sheet4!C[-1]:C[2],2,FALSE)&VLOOKUP(RC[1],Sheet4!C[-1]:C[2],3,FALSE)&RC[2]&VLOOKUP(RC[1],Sheet4!C[-1]:C[2],4,FALSE)&"（%s/"&RC[2]&"）" -> 圣器强化5次（%s/5） | C696: 2 | D696: 5 | E696: 0 | F696: 13049 | G696: 5 | H696: =VLOOKUP(RC[-5],Sheet4!C[-7]:C[-2],5,FALSE) -> 8
A697: 10471 | B697: =VLOOKUP(RC[1],Sheet4!C[-1]:C[2],2,FALSE)&VLOOKUP(RC[1],Sheet4!C[-1]:C[2],3,FALSE)&RC[2]&VLOOKUP(RC[1],Sheet4!C[-1]:C[2],4,FALSE)&"（%s/"&RC[2]&"）" -> 圣器争夺5次（%s/5） | C697: 11 | D697: 5 | E697: 0 | F697: 13049 | G697: 5 | H697: =VLOOKUP(RC[-5],Sheet4!C[-7]:C[-2],5,FALSE) -> 19
A698: 10472 | B698: =VLOOKUP(RC[1],Sheet4!C[-1]:C[2],2,FALSE)&VLOOKUP(RC[1],Sheet4!C[-1]:C[2],3,FALSE)&RC[2]&VLOOKUP(RC[1],Sheet4!C[-1]:C[2],4,FALSE)&"（%s/"&RC[2]&"）" -> 圣器合成3次（%s/3） | C698: 22 | D698: 3 | E698: 0 | F698: 13049 | G698: 5 | H698: =VLOOKUP(RC[-5],Sheet4!C[-7]:C[-2],5,FALSE) -> 19
A699: 10481 | B699: =VLOOKUP(RC[1],Sheet4!C[-1]:C[2],2,FALSE)&VLOOKUP(RC[1],Sheet4!C[-1]:C[2],3,FALSE)&RC[2]&VLOOKUP(RC[1],Sheet4!C[-1]:C[2],4,FALSE)&"（%s/"&RC[2]&"）" -> 赠送好友精力3次（%s/3） | C699: 4 | D699: 3 | E699: 0 | F699: 19005 | G699: 40 | H699: =VLOOKUP(RC[-5],Sheet4!C[-7]:C[-2],5,FALSE) -> 15
A700: 10482 | B700: =VLOOKUP(RC[1],Sheet4!C[-1]:C[2],2,FALSE)&VLOOKUP(RC[1],Sheet4!C[-1]:C[2],3,FALSE)&RC[2]&VLOOKUP(RC[1],Sheet4!C[-1]:C[2],4,FALSE)&"（%s/"&RC[2]&"）" -> 进行召唤5次（%s/5） | C700: 8 | D700: 5 | E700: 0 | F700: 19006 | G700: 60 | H700: =VLOOKUP(RC[-5],Sheet4!C[-7]:C[-2],5,FALSE) -> 9
A701: 10483 | B701: =VLOOKUP(RC[1],Sheet4!C[-1]:C[2],2,FALSE)&VLOOKUP(RC[1],Sheet4!C[-1]:C[2],3,FALSE)&RC[2]&VLOOKUP(RC[1],Sheet4!C[-1]:C[2],4,FALSE)&"（%s/"&RC[2]&"）" -> 进行高级召唤2次（%s/2） | C701: 9 | D701: 2 | E701: 0 | F701: 19006 | G701: 80 | H701: =VLOOKUP(RC[-5],Sheet4!C[-7]:C[-2],5,FALSE) -> 9
A702: 10491 | B702: =VLOOKUP(RC[1],Sheet4!C[-1]:C[2],2,FALSE)&VLOOKUP(RC[1],Sheet4!C[-1]:C[2],3,FALSE)&RC[2]&VLOOKUP(RC[1],Sheet4!C[-1]:C[2],4,FALSE)&"（%s/"&RC[2]&"）" -> 异度入侵分享2次（%s/2） | C702: 17 | D702: 2 | E702: 0 | F702: 19014 | G702: 500 | H702: =VLOOKUP(RC[-5],Sheet4!C[-7]:C[-2],5,FALSE) -> 16
A703: 10492 | B703: =VLOOKUP(RC[1],Sheet4!C[-1]:C[2],2,FALSE)&VLOOKUP(RC[1],Sheet4!C[-1]:C[2],3,FALSE)&RC[2]&VLOOKUP(RC[1],Sheet4!C[-1]:C[2],4,FALSE)&"（%s/"&RC[2]&"）" -> 讨伐异度入侵者2次（%s/2） | C703: 18 | D703: 2 | E703: 0 | F703: 19014 | G703: 500 | H703: =VLOOKUP(RC[-5],Sheet4!C[-7]:C[-2],5,FALSE) -> 16
A704: 10501 | B704: =VLOOKUP(RC[1],Sheet4!C[-1]:C[2],2,FALSE)&VLOOKUP(RC[1],Sheet4!C[-1]:C[2],3,FALSE)&RC[2]&VLOOKUP(RC[1],Sheet4!C[-1]:C[2],4,FALSE)&"（%s/"&RC[2]&"）" -> 精英副本战斗3次（%s/3） | C704: 15 | D704: 3 | E704: 0 | F704: 10008 | G704: 30 | H704: =VLOOKUP(RC[-5],Sheet4!C[-7]:C[-2],5,FALSE) -> 28
A705: 10502 | B705: =VLOOKUP(RC[1],Sheet4!C[-1]:C[2],2,FALSE)&VLOOKUP(RC[1],Sheet4!C[-1]:C[2],3,FALSE)&RC[2]&VLOOKUP(RC[1],Sheet4!C[-1]:C[2],4,FALSE)&"（%s/"&RC[2]&"）" -> 击杀精英外敌1个（%s/1） | C705: 20 | D705: 1 | E705: 0 | F705: 10008 | G705: 40 | H705: =VLOOKUP(RC[-5],Sheet4!C[-7]:C[-2],5,FALSE) -> 28
A706: 10511 | B706: =VLOOKUP(RC[1],Sheet4!C[-1]:C[2],2,FALSE)&VLOOKUP(RC[1],Sheet4!C[-1]:C[2],3,FALSE)&RC[2]&VLOOKUP(RC[1],Sheet4!C[-1]:C[2],4,FALSE)&"（%s/"&RC[2]&"）" -> 购买体力2次（%s/2） | C706: 6 | D706: 2 | E706: 0 | F706: 19005 | G706: 50 | H706: =VLOOKUP(RC[-5],Sheet4!C[-7]:C[-2],5,FALSE) -> 12
A707: 10512 | B707: =VLOOKUP(RC[1],Sheet4!C[-1]:C[2],2,FALSE)&VLOOKUP(RC[1],Sheet4!C[-1]:C[2],3,FALSE)&RC[2]&VLOOKUP(RC[1],Sheet4!C[-1]:C[2],4,FALSE)&"（%s/"&RC[2]&"）" -> 购买精力2次（%s/2） | C707: 7 | D707: 2 | E707: 0 | F707: 19005 | G707: 50 | H707: =VLOOKUP(RC[-5],Sheet4!C[-7]:C[-2],5,FALSE) -> 12
A708: 10521 | B708: =VLOOKUP(RC[1],Sheet4!C[-1]:C[2],2,FALSE)&VLOOKUP(RC[1],Sheet4!C[-1]:C[2],3,FALSE)&RC[2]&VLOOKUP(RC[1],Sheet4!C[-1]:C[2],4,FALSE)&"（%s/"&RC[2]&"）" -> 无尽深渊战斗1次（%s/1） | C708: 23 | D708: 1 | E708: 0 | F708: 19028 | G708: 50 | H708: =VLOOKUP(RC[-5],Sheet4!C[-7]:C[-2],5,FALSE) -> 88
A709: 10522 | B709: =VLOOKUP(RC[1],Sheet4!C[-1]:C[2],2,FALSE)&VLOOKUP(RC[1],Sheet4!C[-1]:C[2],3,FALSE)&RC[2]&VLOOKUP(RC[1],Sheet4!C[-1]:C[2],4,FALSE)&"（%s/"&RC[2]&"）" -> 英雄培养15次（%s/15） | C709: 3 | D709: 15 | E709: 0 | F709: 10003 | G709: 30 | H709: =VLOOKUP(RC[-5],Sheet4!C[-7]:C[-2],5,FALSE) -> 8
A710: 10531 | B710: =VLOOKUP(RC[1],Sheet4!C[-1]:C[2],2,FALSE)&VLOOKUP(RC[1],Sheet4!C[-1]:C[2],3,FALSE)&RC[2]&VLOOKUP(RC[1],Sheet4!C[-1]:C[2],4,FALSE)&"（%s/"&RC[2]&"）" -> 进入勇者试练战斗10次（%s/10） | C710: 12 | D710: 10 | E710: 0 | F710: 19012 | G710: 500 | H710: =VLOOKUP(RC[-5],Sheet4!C[-7]:C[-2],5,FALSE) -> 17
A711: 10532 | B711: =VLOOKUP(RC[1],Sheet4!C[-1]:C[2],2,FALSE)&VLOOKUP(RC[1],Sheet4!C[-1]:C[2],3,FALSE)&RC[2]&VLOOKUP(RC[1],Sheet4!C[-1]:C[2],4,FALSE)&"（%s/"&RC[2]&"）" -> 竞技场战斗5次（%s/5） | C711: 10 | D711: 5 | E711: 0 | F711: 19013 | G711: 500 | H711: =VLOOKUP(RC[-5],Sheet4!C[-7]:C[-2],5,FALSE) -> 21
A712: 10533 | B712: =VLOOKUP(RC[1],Sheet4!C[-1]:C[2],2,FALSE)&VLOOKUP(RC[1],Sheet4!C[-1]:C[2],3,FALSE)&RC[2]&VLOOKUP(RC[1],Sheet4!C[-1]:C[2],4,FALSE)&"（%s/"&RC[2]&"）" -> 主线副本挑战5次（%s/5） | C712: 1 | D712: 5 | E712: 0 | F712: 19003 | G712: 50000 | H712: =VLOOKUP(RC[-5],Sheet4!C[-7]:C[-2],5,FALSE) -> 26
A713: 10541 | B713: =VLOOKUP(RC[1],Sheet4!C[-1]:C[2],2,FALSE)&VLOOKUP(RC[1],Sheet4!C[-1]:C[2],3,FALSE)&RC[2]&VLOOKUP(RC[1],Sheet4!C[-1]:C[2],4,FALSE)&"（%s/"&RC[2]&"）" -> 占卜翻牌5次（%s/5） | C713: 25 | D713: 5 | E713: 0 | F713: 10096 | G713: 1 | H713: =VLOOKUP(RC[-5],Sheet4!C[-7]:C[-2],5,FALSE) -> 113
A714: 10542 | B714: =VLOOKUP(RC[1],Sheet4!C[-1]:C[2],2,FALSE)&VLOOKUP(RC[1],Sheet4!C[-1]:C[2],3,FALSE)&RC[2]&VLOOKUP(RC[1],Sheet4!C[-1]:C[2],4,FALSE)&"（%s/"&RC[2]&"）" -> 英雄商店购买1次（%s/1） | C714: 5 | D714: 1 | E714: 0 | F714: 19006 | G714: 60 | H714: =VLOOKUP(RC[-5],Sheet4!C[-7]:C[-2],5,FALSE) -> 11
A715: 10543 | B715: =VLOOKUP(RC[1],Sheet4!C[-1]:C[2],2,FALSE)&VLOOKUP(RC[1],Sheet4!C[-1]:C[2],3,FALSE)&RC[2]&VLOOKUP(RC[1],Sheet4!C[-1]:C[2],4,FALSE)&"（%s/"&RC[2]&"）" -> 日常副本战斗4次（%s/4） | C715: 13 | D715: 4 | E715: 0 | F715: 19005 | G715: 50 | H715: =VLOOKUP(RC[-5],Sheet4!C[-7]:C[-2],5,FALSE) -> 2
A716: 10551 | B716: =VLOOKUP(RC[1],Sheet4!C[-1]:C[2],2,FALSE)&VLOOKUP(RC[1],Sheet4!C[-1]:C[2],3,FALSE)&RC[2]&VLOOKUP(RC[1],Sheet4!C[-1]:C[2],4,FALSE)&"（%s/"&RC[2]&"）" -> 遗迹探索4小时（%s/4） | C716: 19 | D716: 4 | E716: 0 | F716: 19003 | G716: 50000 | H716: =VLOOKUP(RC[-5],Sheet4!C[-7]:C[-2],5,FALSE) -> 20
A717: 10552 | B717: =VLOOKUP(RC[1],Sheet4!C[-1]:C[2],2,FALSE)&VLOOKUP(RC[1],Sheet4!C[-1]:C[2],3,FALSE)&RC[2]&VLOOKUP(RC[1],Sheet4!C[-1]:C[2],4,FALSE)&"（%s/"&RC[2]&"）" -> 击杀遗迹破坏者3次（%s/3） | C717: 16 | D717: 3 | E717: 0 | F717: 19005 | G717: 50 | H717: =VLOOKUP(RC[-5],Sheet4!C[-7]:C[-2],5,FALSE) -> 20
A718: 10553 | B718: =VLOOKUP(RC[1],Sheet4!C[-1]:C[2],2,FALSE)&VLOOKUP(RC[1],Sheet4!C[-1]:C[2],3,FALSE)&RC[2]&VLOOKUP(RC[1],Sheet4!C[-1]:C[2],4,FALSE)&"（%s/"&RC[2]&"）" -> 英雄副本战斗1次（%s/1） | C718: 14 | D718: 1 | E718: 0 | F718: 19006 | G718: 60 | H718: =VLOOKUP(RC[-5],Sheet4!C[-7]:C[-2],5,FALSE) -> 27
A719: 10561 | B719: =VLOOKUP(RC[1],Sheet4!C[-1]:C[2],2,FALSE)&VLOOKUP(RC[1],Sheet4!C[-1]:C[2],3,FALSE)&RC[2]&VLOOKUP(RC[1],Sheet4!C[-1]:C[2],4,FALSE)&"（%s/"&RC[2]&"）" -> 圣器强化5次（%s/5） | C719: 2 | D719: 5 | E719: 0 | F719: 13049 | G719: 5 | H719: =VLOOKUP(RC[-5],Sheet4!C[-7]:C[-2],5,FALSE) -> 8
A720: 10562 | B720: =VLOOKUP(RC[1],Sheet4!C[-1]:C[2],2,FALSE)&VLOOKUP(RC[1],Sheet4!C[-1]:C[2],3,FALSE)&RC[2]&VLOOKUP(RC[1],Sheet4!C[-1]:C[2],4,FALSE)&"（%s/"&RC[2]&"）" -> 圣器争夺5次（%s/5） | C720: 11 | D720: 5 | E720: 0 | F720: 13049 | G720: 5 | H720: =VLOOKUP(RC[-5],Sheet4!C[-7]:C[-2],5,FALSE) -> 19
A721: 10563 | B721: =VLOOKUP(RC[1],Sheet4!C[-1]:C[2],2,FALSE)&VLOOKUP(RC[1],Sheet4!C[-1]:C[2],3,FALSE)&RC[2]&VLOOKUP(RC[1],Sheet4!C[-1]:C[2],4,FALSE)&"（%s/"&RC[2]&"）" -> 圣器合成3次（%s/3） | C721: 22 | D721: 3 | E721: 0 | F721: 13049 | G721: 5 | H721: =VLOOKUP(RC[-5],Sheet4!C[-7]:C[-2],5,FALSE) -> 19
A722: 10571 | B722: =VLOOKUP(RC[1],Sheet4!C[-1]:C[2],2,FALSE)&VLOOKUP(RC[1],Sheet4!C[-1]:C[2],3,FALSE)&RC[2]&VLOOKUP(RC[1],Sheet4!C[-1]:C[2],4,FALSE)&"（%s/"&RC[2]&"）" -> 赠送好友精力3次（%s/3） | C722: 4 | D722: 3 | E722: 0 | F722: 19005 | G722: 40 | H722: =VLOOKUP(RC[-5],Sheet4!C[-7]:C[-2],5,FALSE) -> 15
A723: 10572 | B723: =VLOOKUP(RC[1],Sheet4!C[-1]:C[2],2,FALSE)&VLOOKUP(RC[1],Sheet4!C[-1]:C[2],3,FALSE)&RC[2]&VLOOKUP(RC[1],Sheet4!C[-1]:C[2],4,FALSE)&"（%s/"&RC[2]&"）" -> 进行召唤5次（%s/5） | C723: 8 | D723: 5 | E723: 0 | F723: 19006 | G723: 60 | H723: =VLOOKUP(RC[-5],Sheet4!C[-7]:C[-2],5,FALSE) -> 9
A724: 10573 | B724: =VLOOKUP(RC[1],Sheet4!C[-1]:C[2],2,FALSE)&VLOOKUP(RC[1],Sheet4!C[-1]:C[2],3,FALSE)&RC[2]&VLOOKUP(RC[1],Sheet4!C[-1]:C[2],4,FALSE)&"（%s/"&RC[2]&"）" -> 进行高级召唤2次（%s/2） | C724: 9 | D724: 2 | E724: 0 | F724: 19006 | G724: 80 | H724: =VLOOKUP(RC[-5],Sheet4!C[-7]:C[-2],5,FALSE) -> 9
A725: 10581 | B725: =VLOOKUP(RC[1],Sheet4!C[-1]:C[2],2,FALSE)&VLOOKUP(RC[1],Sheet4!C[-1]:C[2],3,FALSE)&RC[2]&VLOOKUP(RC[1],Sheet4!C[-1]:C[2],4,FALSE)&"（%s/"&RC[2]&"）" -> 异度入侵分享2次（%s/2） | C725: 17 | D725: 2 | E725: 0 | F725: 19014 | G725: 500 | H725: =VLOOKUP(RC[-5],Sheet4!C[-7]:C[-2],5,FALSE) -> 16
A726: 10582 | B726: =VLOOKUP(RC[1],Sheet4!C[-1]:C[2],2,FALSE)&VLOOKUP(RC[1],Sheet4!C[-1]:C[2],3,FALSE)&RC[2]&VLOOKUP(RC[1],Sheet4!C[-1]:C[2],4,FALSE)&"（%s/"&RC[2]&"）" -> 讨伐异度入侵者2次（%s/2） | C726: 18 | D726: 2 | E726: 0 | F726: 19014 | G726: 500 | H726: =VLOOKUP(RC[-5],Sheet4!C[-7]:C[-2],5,FALSE) -> 16
A727: 10583 | B727: =VLOOKUP(RC[1],Sheet4!C[-1]:C[2],2,FALSE)&VLOOKUP(RC[1],Sheet4!C[-1]:C[2],3,FALSE)&RC[2]&VLOOKUP(RC[1],Sheet4!C[-1]:C[2],4,FALSE)&"（%s/"&RC[2]&"）" -> 精英副本战斗3次（%s/3） | C727: 15 | D727: 3 | E727: 0 | F727: 10008 | G727: 30 | H727: =VLOOKUP(RC[-5],Sheet4!C[-7]:C[-2],5,FALSE) -> 28
A728: 10584 | B728: =VLOOKUP(RC[1],Sheet4!C[-1]:C[2],2,FALSE)&VLOOKUP(RC[1],Sheet4!C[-1]:C[2],3,FALSE)&RC[2]&VLOOKUP(RC[1],Sheet4!C[-1]:C[2],4,FALSE)&"（%s/"&RC[2]&"）" -> 击杀精英外敌1个（%s/1） | C728: 20 | D728: 1 | E728: 0 | F728: 10008 | G728: 40 | H728: =VLOOKUP(RC[-5],Sheet4!C[-7]:C[-2],5,FALSE) -> 28
A729: 10591 | B729: =VLOOKUP(RC[1],Sheet4!C[-1]:C[2],2,FALSE)&VLOOKUP(RC[1],Sheet4!C[-1]:C[2],3,FALSE)&RC[2]&VLOOKUP(RC[1],Sheet4!C[-1]:C[2],4,FALSE)&"（%s/"&RC[2]&"）" -> 购买体力2次（%s/2） | C729: 6 | D729: 2 | E729: 0 | F729: 19005 | G729: 50 | H729: =VLOOKUP(RC[-5],Sheet4!C[-7]:C[-2],5,FALSE) -> 12
A730: 10592 | B730: =VLOOKUP(RC[1],Sheet4!C[-1]:C[2],2,FALSE)&VLOOKUP(RC[1],Sheet4!C[-1]:C[2],3,FALSE)&RC[2]&VLOOKUP(RC[1],Sheet4!C[-1]:C[2],4,FALSE)&"（%s/"&RC[2]&"）" -> 购买精力2次（%s/2） | C730: 7 | D730: 2 | E730: 0 | F730: 19005 | G730: 50 | H730: =VLOOKUP(RC[-5],Sheet4!C[-7]:C[-2],5,FALSE) -> 12
A731: 10593 | B731: =VLOOKUP(RC[1],Sheet4!C[-1]:C[2],2,FALSE)&VLOOKUP(RC[1],Sheet4!C[-1]:C[2],3,FALSE)&RC[2]&VLOOKUP(RC[1],Sheet4!C[-1]:C[2],4,FALSE)&"（%s/"&RC[2]&"）" -> 英雄培养20次（%s/20） | C731: 3 | D731: 20 | E731: 0 | F731: 10003 | G731: 30 | H731: =VLOOKUP(RC[-5],Sheet4!C[-7]:C[-2],5,FALSE) -> 8
A732: 10601 | B732: =VLOOKUP(RC[1],Sheet4!C[-1]:C[2],2,FALSE)&VLOOKUP(RC[1],Sheet4!C[-1]:C[2],3,FALSE)&RC[2]&VLOOKUP(RC[1],Sheet4!C[-1]:C[2],4,FALSE)&"（%s/"&RC[2]&"）" -> 无尽深渊战斗1次（%s/1） | C732: 23 | D732: 1 | E732: 0 | F732: 19028 | G732: 50 | H732: =VLOOKUP(RC[-5],Sheet4!C[-7]:C[-2],5,FALSE) -> 88
A733: 10602 | B733: =VLOOKUP(RC[1],Sheet4!C[-1]:C[2],2,FALSE)&VLOOKUP(RC[1],Sheet4!C[-1]:C[2],3,FALSE)&RC[2]&VLOOKUP(RC[1],Sheet4!C[-1]:C[2],4,FALSE)&"（%s/"&RC[2]&"）" -> 进入勇者试练战斗10次（%s/10） | C733: 12 | D733: 10 | E733: 0 | F733: 19012 | G733: 500 | H733: =VLOOKUP(RC[-5],Sheet4!C[-7]:C[-2],5,FALSE) -> 17
A734: 10603 | B734: =VLOOKUP(RC[1],Sheet4!C[-1]:C[2],2,FALSE)&VLOOKUP(RC[1],Sheet4!C[-1]:C[2],3,FALSE)&RC[2]&VLOOKUP(RC[1],Sheet4!C[-1]:C[2],4,FALSE)&"（%s/"&RC[2]&"）" -> 竞技场战斗5次（%s/5） | C734: 10 | D734: 5 | E734: 0 | F734: 19013 | G734: 500 | H734: =VLOOKUP(RC[-5],Sheet4!C[-7]:C[-2],5,FALSE) -> 21
A735: 10604 | B735: =VLOOKUP(RC[1],Sheet4!C[-1]:C[2],2,FALSE)&VLOOKUP(RC[1],Sheet4!C[-1]:C[2],3,FALSE)&RC[2]&VLOOKUP(RC[1],Sheet4!C[-1]:C[2],4,FALSE)&"（%s/"&RC[2]&"）" -> 主线副本挑战5次（%s/5） | C735: 1 | D735: 5 | E735: 0 | F735: 19003 | G735: 50000 | H735: =VLOOKUP(RC[-5],Sheet4!C[-7]:C[-2],5,FALSE) -> 26
A736: 10611 | B736: =VLOOKUP(RC[1],Sheet4!C[-1]:C[2],2,FALSE)&VLOOKUP(RC[1],Sheet4!C[-1]:C[2],3,FALSE)&RC[2]&VLOOKUP(RC[1],Sheet4!C[-1]:C[2],4,FALSE)&"（%s/"&RC[2]&"）" -> 占卜翻牌5次（%s/5） | C736: 25 | D736: 5 | E736: 0 | F736: 10096 | G736: 1 | H736: =VLOOKUP(RC[-5],Sheet4!C[-7]:C[-2],5,FALSE) -> 113
A737: 10612 | B737: =VLOOKUP(RC[1],Sheet4!C[-1]:C[2],2,FALSE)&VLOOKUP(RC[1],Sheet4!C[-1]:C[2],3,FALSE)&RC[2]&VLOOKUP(RC[1],Sheet4!C[-1]:C[2],4,FALSE)&"（%s/"&RC[2]&"）" -> 英雄商店购买1次（%s/1） | C737: 5 | D737: 1 | E737: 0 | F737: 19006 | G737: 60 | H737: =VLOOKUP(RC[-5],Sheet4!C[-7]:C[-2],5,FALSE) -> 11
A738: 10613 | B738: =VLOOKUP(RC[1],Sheet4!C[-1]:C[2],2,FALSE)&VLOOKUP(RC[1],Sheet4!C[-1]:C[2],3,FALSE)&RC[2]&VLOOKUP(RC[1],Sheet4!C[-1]:C[2],4,FALSE)&"（%s/"&RC[2]&"）" -> 日常副本战斗4次（%s/4） | C738: 13 | D738: 4 | E738: 0 | F738: 19005 | G738: 50 | H738: =VLOOKUP(RC[-5],Sheet4!C[-7]:C[-2],5,FALSE) -> 2
A739: 10621 | B739: =VLOOKUP(RC[1],Sheet4!C[-1]:C[2],2,FALSE)&VLOOKUP(RC[1],Sheet4!C[-1]:C[2],3,FALSE)&RC[2]&VLOOKUP(RC[1],Sheet4!C[-1]:C[2],4,FALSE)&"（%s/"&RC[2]&"）" -> 遗迹探索4小时（%s/4） | C739: 19 | D739: 4 | E739: 0 | F739: 19003 | G739: 50000 | H739: =VLOOKUP(RC[-5],Sheet4!C[-7]:C[-2],5,FALSE) -> 20
A740: 10622 | B740: =VLOOKUP(RC[1],Sheet4!C[-1]:C[2],2,FALSE)&VLOOKUP(RC[1],Sheet4!C[-1]:C[2],3,FALSE)&RC[2]&VLOOKUP(RC[1],Sheet4!C[-1]:C[2],4,FALSE)&"（%s/"&RC[2]&"）" -> 击杀遗迹破坏者3次（%s/3） | C740: 16 | D740: 3 | E740: 0 | F740: 19005 | G740: 50 | H740: =VLOOKUP(RC[-5],Sheet4!C[-7]:C[-2],5,FALSE) -> 20
A741: 10623 | B741: =VLOOKUP(RC[1],Sheet4!C[-1]:C[2],2,FALSE)&VLOOKUP(RC[1],Sheet4!C[-1]:C[2],3,FALSE)&RC[2]&VLOOKUP(RC[1],Sheet4!C[-1]:C[2],4,FALSE)&"（%s/"&RC[2]&"）" -> 英雄副本战斗1次（%s/1） | C741: 14 | D741: 1 | E741: 0 | F741: 19006 | G741: 60 | H741: =VLOOKUP(RC[-5],Sheet4!C[-7]:C[-2],5,FALSE) -> 27
A742: =R[-26]C+80 -> 10631 | B742: =VLOOKUP(RC[1],Sheet4!C[-1]:C[2],2,FALSE)&VLOOKUP(RC[1],Sheet4!C[-1]:C[2],3,FALSE)&RC[2]&VLOOKUP(RC[1],Sheet4!C[-1]:C[2],4,FALSE)&"（%s/"&RC[2]&"）" -> 遗迹探索4小时（%s/4） | C742: =R[-26]C -> 19 | D742: =R[-26]C -> 4 | E742: =R[-26]C -> 0 | F742: =R[-26]C -> 19003 | G742: =R[-26]C -> 50000 | H742: =VLOOKUP(RC[-5],Sheet4!C[-7]:C[-2],5,FALSE) -> 20
A743: =R[-26]C+80 -> 10632 | B743: =VLOOKUP(RC[1],Sheet4!C[-1]:C[2],2,FALSE)&VLOOKUP(RC[1],Sheet4!C[-1]:C[2],3,FALSE)&RC[2]&VLOOKUP(RC[1],Sheet4!C[-1]:C[2],4,FALSE)&"（%s/"&RC[2]&"）" -> 击杀遗迹破坏者3次（%s/3） | C743: =R[-26]C -> 16 | D743: =R[-26]C -> 3 | E743: =R[-26]C -> 0 | F743: =R[-26]C -> 19005 | G743: =R[-26]C -> 50 | H743: =VLOOKUP(RC[-5],Sheet4!C[-7]:C[-2],5,FALSE) -> 20
A744: =R[-26]C+80 -> 10633 | B744: =VLOOKUP(RC[1],Sheet4!C[-1]:C[2],2,FALSE)&VLOOKUP(RC[1],Sheet4!C[-1]:C[2],3,FALSE)&RC[2]&VLOOKUP(RC[1],Sheet4!C[-1]:C[2],4,FALSE)&"（%s/"&RC[2]&"）" -> 英雄副本战斗1次（%s/1） | C744: =R[-26]C -> 14 | D744: =R[-26]C -> 1 | E744: =R[-26]C -> 0 | F744: =R[-26]C -> 19006 | G744: =R[-26]C -> 60 | H744: =VLOOKUP(RC[-5],Sheet4!C[-7]:C[-2],5,FALSE) -> 27
A745: =R[-26]C+80 -> 10641 | B745: =VLOOKUP(RC[1],Sheet4!C[-1]:C[2],2,FALSE)&VLOOKUP(RC[1],Sheet4!C[-1]:C[2],3,FALSE)&RC[2]&VLOOKUP(RC[1],Sheet4!C[-1]:C[2],4,FALSE)&"（%s/"&RC[2]&"）" -> 圣器强化5次（%s/5） | C745: =R[-26]C -> 2 | D745: =R[-26]C -> 5 | E745: =R[-26]C -> 0 | F745: =R[-26]C -> 13049 | G745: =R[-26]C -> 5 | H745: =VLOOKUP(RC[-5],Sheet4!C[-7]:C[-2],5,FALSE) -> 8
A746: =R[-26]C+80 -> 10642 | B746: =VLOOKUP(RC[1],Sheet4!C[-1]:C[2],2,FALSE)&VLOOKUP(RC[1],Sheet4!C[-1]:C[2],3,FALSE)&RC[2]&VLOOKUP(RC[1],Sheet4!C[-1]:C[2],4,FALSE)&"（%s/"&RC[2]&"）" -> 圣器争夺5次（%s/5） | C746: =R[-26]C -> 11 | D746: =R[-26]C -> 5 | E746: =R[-26]C -> 0 | F746: =R[-26]C -> 13049 | G746: =R[-26]C -> 5 | H746: =VLOOKUP(RC[-5],Sheet4!C[-7]:C[-2],5,FALSE) -> 19
A747: =R[-26]C+80 -> 10643 | B747: =VLOOKUP(RC[1],Sheet4!C[-1]:C[2],2,FALSE)&VLOOKUP(RC[1],Sheet4!C[-1]:C[2],3,FALSE)&RC[2]&VLOOKUP(RC[1],Sheet4!C[-1]:C[2],4,FALSE)&"（%s/"&RC[2]&"）" -> 圣器合成3次（%s/3） | C747: =R[-26]C -> 22 | D747: =R[-26]C -> 3 | E747: =R[-26]C -> 0 | F747: =R[-26]C -> 13049 | G747: =R[-26]C -> 5 | H747: =VLOOKUP(RC[-5],Sheet4!C[-7]:C[-2],5,FALSE) -> 19
A748: =R[-26]C+80 -> 10651 | B748: =VLOOKUP(RC[1],Sheet4!C[-1]:C[2],2,FALSE)&VLOOKUP(RC[1],Sheet4!C[-1]:C[2],3,FALSE)&RC[2]&VLOOKUP(RC[1],Sheet4!C[-1]:C[2],4,FALSE)&"（%s/"&RC[2]&"）" -> 赠送好友精力3次（%s/3） | C748: =R[-26]C -> 4 | D748: =R[-26]C -> 3 | E748: =R[-26]C -> 0 | F748: =R[-26]C -> 19005 | G748: =R[-26]C -> 40 | H748: =VLOOKUP(RC[-5],Sheet4!C[-7]:C[-2],5,FALSE) -> 15
A749: =R[-26]C+80 -> 10652 | B749: =VLOOKUP(RC[1],Sheet4!C[-1]:C[2],2,FALSE)&VLOOKUP(RC[1],Sheet4!C[-1]:C[2],3,FALSE)&RC[2]&VLOOKUP(RC[1],Sheet4!C[-1]:C[2],4,FALSE)&"（%s/"&RC[2]&"）" -> 进行召唤5次（%s/5） | C749: =R[-26]C -> 8 | D749: =R[-26]C -> 5 | E749: =R[-26]C -> 0 | F749: =R[-26]C -> 19006 | G749: =R[-26]C -> 60 | H749: =VLOOKUP(RC[-5],Sheet4!C[-7]:C[-2],5,FALSE) -> 9
A750: =R[-26]C+80 -> 10653 | B750: =VLOOKUP(RC[1],Sheet4!C[-1]:C[2],2,FALSE)&VLOOKUP(RC[1],Sheet4!C[-1]:C[2],3,FALSE)&RC[2]&VLOOKUP(RC[1],Sheet4!C[-1]:C[2],4,FALSE)&"（%s/"&RC[2]&"）" -> 进行高级召唤2次（%s/2） | C750: =R[-26]C -> 9 | D750: =R[-26]C -> 2 | E750: =R[-26]C -> 0 | F750: =R[-26]C -> 19006 | G750: =R[-26]C -> 80 | H750: =VLOOKUP(RC[-5],Sheet4!C[-7]:C[-2],5,FALSE) -> 9
A751: =R[-26]C+80 -> 10661 | B751: =VLOOKUP(RC[1],Sheet4!C[-1]:C[2],2,FALSE)&VLOOKUP(RC[1],Sheet4!C[-1]:C[2],3,FALSE)&RC[2]&VLOOKUP(RC[1],Sheet4!C[-1]:C[2],4,FALSE)&"（%s/"&RC[2]&"）" -> 异度入侵分享2次（%s/2） | C751: =R[-26]C -> 17 | D751: =R[-26]C -> 2 | E751: =R[-26]C -> 0 | F751: =R[-26]C -> 19014 | G751: =R[-26]C -> 500 | H751: =VLOOKUP(RC[-5],Sheet4!C[-7]:C[-2],5,FALSE) -> 16
A752: =R[-26]C+80 -> 10662 | B752: =VLOOKUP(RC[1],Sheet4!C[-1]:C[2],2,FALSE)&VLOOKUP(RC[1],Sheet4!C[-1]:C[2],3,FALSE)&RC[2]&VLOOKUP(RC[1],Sheet4!C[-1]:C[2],4,FALSE)&"（%s/"&RC[2]&"）" -> 讨伐异度入侵者2次（%s/2） | C752: =R[-26]C -> 18 | D752: =R[-26]C -> 2 | E752: =R[-26]C -> 0 | F752: =R[-26]C -> 19014 | G752: =R[-26]C -> 500 | H752: =VLOOKUP(RC[-5],Sheet4!C[-7]:C[-2],5,FALSE) -> 16
A753: =R[-26]C+80 -> 10663 | B753: =VLOOKUP(RC[1],Sheet4!C[-1]:C[2],2,FALSE)&VLOOKUP(RC[1],Sheet4!C[-1]:C[2],3,FALSE)&RC[2]&VLOOKUP(RC[1],Sheet4!C[-1]:C[2],4,FALSE)&"（%s/"&RC[2]&"）" -> 精英副本战斗3次（%s/3） | C753: =R[-26]C -> 15 | D753: =R[-26]C -> 3 | E753: =R[-26]C -> 0 | F753: =R[-26]C -> 10008 | G753: =R[-26]C -> 30 | H753: =VLOOKUP(RC[-5],Sheet4!C[-7]:C[-2],5,FALSE) -> 28
A754: =R[-26]C+80 -> 10664 | B754: =VLOOKUP(RC[1],Sheet4!C[-1]:C[2],2,FALSE)&VLOOKUP(RC[1],Sheet4!C[-1]:C[2],3,FALSE)&RC[2]&VLOOKUP(RC[1],Sheet4!C[-1]:C[2],4,FALSE)&"（%s/"&RC[2]&"）" -> 击杀精英外敌1个（%s/1） | C754: =R[-26]C -> 20 | D754: =R[-26]C -> 1 | E754: =R[-26]C -> 0 | F754: =R[-26]C -> 10008 | G754: =R[-26]C -> 40 | H754: =VLOOKUP(RC[-5],Sheet4!C[-7]:C[-2],5,FALSE) -> 28
A755: =R[-26]C+80 -> 10671 | B755: =VLOOKUP(RC[1],Sheet4!C[-1]:C[2],2,FALSE)&VLOOKUP(RC[1],Sheet4!C[-1]:C[2],3,FALSE)&RC[2]&VLOOKUP(RC[1],Sheet4!C[-1]:C[2],4,FALSE)&"（%s/"&RC[2]&"）" -> 购买体力2次（%s/2） | C755: =R[-26]C -> 6 | D755: =R[-26]C -> 2 | E755: =R[-26]C -> 0 | F755: =R[-26]C -> 19005 | G755: =R[-26]C -> 50 | H755: =VLOOKUP(RC[-5],Sheet4!C[-7]:C[-2],5,FALSE) -> 12
A756: =R[-26]C+80 -> 10672 | B756: =VLOOKUP(RC[1],Sheet4!C[-1]:C[2],2,FALSE)&VLOOKUP(RC[1],Sheet4!C[-1]:C[2],3,FALSE)&RC[2]&VLOOKUP(RC[1],Sheet4!C[-1]:C[2],4,FALSE)&"（%s/"&RC[2]&"）" -> 购买精力2次（%s/2） | C756: =R[-26]C -> 7 | D756: =R[-26]C -> 2 | E756: =R[-26]C -> 0 | F756: =R[-26]C -> 19005 | G756: =R[-26]C -> 50 | H756: =VLOOKUP(RC[-5],Sheet4!C[-7]:C[-2],5,FALSE) -> 12
A757: =R[-26]C+80 -> 10673 | B757: =VLOOKUP(RC[1],Sheet4!C[-1]:C[2],2,FALSE)&VLOOKUP(RC[1],Sheet4!C[-1]:C[2],3,FALSE)&RC[2]&VLOOKUP(RC[1],Sheet4!C[-1]:C[2],4,FALSE)&"（%s/"&RC[2]&"）" -> 英雄培养20次（%s/20） | C757: =R[-26]C -> 3 | D757: =R[-26]C -> 20 | E757: =R[-26]C -> 0 | F757: =R[-26]C -> 10003 | G757: =R[-26]C -> 30 | H757: =VLOOKUP(RC[-5],Sheet4!C[-7]:C[-2],5,FALSE) -> 8
A758: =R[-26]C+80 -> 10681 | B758: =VLOOKUP(RC[1],Sheet4!C[-1]:C[2],2,FALSE)&VLOOKUP(RC[1],Sheet4!C[-1]:C[2],3,FALSE)&RC[2]&VLOOKUP(RC[1],Sheet4!C[-1]:C[2],4,FALSE)&"（%s/"&RC[2]&"）" -> 无尽深渊战斗1次（%s/1） | C758: =R[-26]C -> 23 | D758: =R[-26]C -> 1 | E758: =R[-26]C -> 0 | F758: =R[-26]C -> 19028 | G758: =R[-26]C -> 50 | H758: =VLOOKUP(RC[-5],Sheet4!C[-7]:C[-2],5,FALSE) -> 88
A759: =R[-26]C+80 -> 10682 | B759: =VLOOKUP(RC[1],Sheet4!C[-1]:C[2],2,FALSE)&VLOOKUP(RC[1],Sheet4!C[-1]:C[2],3,FALSE)&RC[2]&VLOOKUP(RC[1],Sheet4!C[-1]:C[2],4,FALSE)&"（%s/"&RC[2]&"）" -> 进入勇者试练战斗10次（%s/10） | C759: =R[-26]C -> 12 | D759: =R[-26]C -> 10 | E759: =R[-26]C -> 0 | F759: =R[-26]C -> 19012 | G759: =R[-26]C -> 500 | H759: =VLOOKUP(RC[-5],Sheet4!C[-7]:C[-2],5,FALSE) -> 17
A760: =R[-26]C+80 -> 10683 | B760: =VLOOKUP(RC[1],Sheet4!C[-1]:C[2],2,FALSE)&VLOOKUP(RC[1],Sheet4!C[-1]:C[2],3,FALSE)&RC[2]&VLOOKUP(RC[1],Sheet4!C[-1]:C[2],4,FALSE)&"（%s/"&RC[2]&"）" -> 竞技场战斗5次（%s/5） | C760: =R[-26]C -> 10 | D760: =R[-26]C -> 5 | E760: =R[-26]C -> 0 | F760: =R[-26]C -> 19013 | G760: =R[-26]C -> 500 | H760: =VLOOKUP(RC[-5],Sheet4!C[-7]:C[-2],5,FALSE) -> 21
A761: =R[-26]C+80 -> 10684 | B761: =VLOOKUP(RC[1],Sheet4!C[-1]:C[2],2,FALSE)&VLOOKUP(RC[1],Sheet4!C[-1]:C[2],3,FALSE)&RC[2]&VLOOKUP(RC[1],Sheet4!C[-1]:C[2],4,FALSE)&"（%s/"&RC[2]&"）" -> 主线副本挑战5次（%s/5） | C761: =R[-26]C -> 1 | D761: =R[-26]C -> 5 | E761: =R[-26]C -> 0 | F761: =R[-26]C -> 19003 | G761: =R[-26]C -> 50000 | H761: =VLOOKUP(RC[-5],Sheet4!C[-7]:C[-2],5,FALSE) -> 26
A762: =R[-26]C+80 -> 10691 | B762: =VLOOKUP(RC[1],Sheet4!C[-1]:C[2],2,FALSE)&VLOOKUP(RC[1],Sheet4!C[-1]:C[2],3,FALSE)&RC[2]&VLOOKUP(RC[1],Sheet4!C[-1]:C[2],4,FALSE)&"（%s/"&RC[2]&"）" -> 占卜翻牌5次（%s/5） | C762: =R[-26]C -> 25 | D762: =R[-26]C -> 5 | E762: =R[-26]C -> 0 | F762: =R[-26]C -> 10096 | G762: =R[-26]C -> 1 | H762: =VLOOKUP(RC[-5],Sheet4!C[-7]:C[-2],5,FALSE) -> 113
A763: =R[-26]C+80 -> 10692 | B763: =VLOOKUP(RC[1],Sheet4!C[-1]:C[2],2,FALSE)&VLOOKUP(RC[1],Sheet4!C[-1]:C[2],3,FALSE)&RC[2]&VLOOKUP(RC[1],Sheet4!C[-1]:C[2],4,FALSE)&"（%s/"&RC[2]&"）" -> 英雄商店购买1次（%s/1） | C763: =R[-26]C -> 5 | D763: =R[-26]C -> 1 | E763: =R[-26]C -> 0 | F763: =R[-26]C -> 19006 | G763: =R[-26]C -> 60 | H763: =VLOOKUP(RC[-5],Sheet4!C[-7]:C[-2],5,FALSE) -> 11
A764: =R[-26]C+80 -> 10693 | B764: =VLOOKUP(RC[1],Sheet4!C[-1]:C[2],2,FALSE)&VLOOKUP(RC[1],Sheet4!C[-1]:C[2],3,FALSE)&RC[2]&VLOOKUP(RC[1],Sheet4!C[-1]:C[2],4,FALSE)&"（%s/"&RC[2]&"）" -> 日常副本战斗4次（%s/4） | C764: =R[-26]C -> 13 | D764: =R[-26]C -> 4 | E764: =R[-26]C -> 0 | F764: =R[-26]C -> 19005 | G764: =R[-26]C -> 50 | H764: =VLOOKUP(RC[-5],Sheet4!C[-7]:C[-2],5,FALSE) -> 2
A765: =R[-26]C+80 -> 10701 | B765: =VLOOKUP(RC[1],Sheet4!C[-1]:C[2],2,FALSE)&VLOOKUP(RC[1],Sheet4!C[-1]:C[2],3,FALSE)&RC[2]&VLOOKUP(RC[1],Sheet4!C[-1]:C[2],4,FALSE)&"（%s/"&RC[2]&"）" -> 遗迹探索4小时（%s/4） | C765: =R[-26]C -> 19 | D765: =R[-26]C -> 4 | E765: =R[-26]C -> 0 | F765: =R[-26]C -> 19003 | G765: =R[-26]C -> 50000 | H765: =VLOOKUP(RC[-5],Sheet4!C[-7]:C[-2],5,FALSE) -> 20
A766: =R[-26]C+80 -> 10702 | B766: =VLOOKUP(RC[1],Sheet4!C[-1]:C[2],2,FALSE)&VLOOKUP(RC[1],Sheet4!C[-1]:C[2],3,FALSE)&RC[2]&VLOOKUP(RC[1],Sheet4!C[-1]:C[2],4,FALSE)&"（%s/"&RC[2]&"）" -> 击杀遗迹破坏者3次（%s/3） | C766: =R[-26]C -> 16 | D766: =R[-26]C -> 3 | E766: =R[-26]C -> 0 | F766: =R[-26]C -> 19005 | G766: =R[-26]C -> 50 | H766: =VLOOKUP(RC[-5],Sheet4!C[-7]:C[-2],5,FALSE) -> 20
A767: =R[-26]C+80 -> 10703 | B767: =VLOOKUP(RC[1],Sheet4!C[-1]:C[2],2,FALSE)&VLOOKUP(RC[1],Sheet4!C[-1]:C[2],3,FALSE)&RC[2]&VLOOKUP(RC[1],Sheet4!C[-1]:C[2],4,FALSE)&"（%s/"&RC[2]&"）" -> 英雄副本战斗1次（%s/1） | C767: =R[-26]C -> 14 | D767: =R[-26]C -> 1 | E767: =R[-26]C -> 0 | F767: =R[-26]C -> 19006 | G767: =R[-26]C -> 60 | H767: =VLOOKUP(RC[-5],Sheet4!C[-7]:C[-2],5,FALSE) -> 27
A768: =R[-26]C+80 -> 10711 | B768: =VLOOKUP(RC[1],Sheet4!C[-1]:C[2],2,FALSE)&VLOOKUP(RC[1],Sheet4!C[-1]:C[2],3,FALSE)&RC[2]&VLOOKUP(RC[1],Sheet4!C[-1]:C[2],4,FALSE)&"（%s/"&RC[2]&"）" -> 遗迹探索4小时（%s/4） | C768: =R[-26]C -> 19 | D768: =R[-26]C -> 4 | E768: =R[-26]C -> 0 | F768: =R[-26]C -> 19003 | G768: =R[-26]C -> 50000 | H768: =VLOOKUP(RC[-5],Sheet4!C[-7]:C[-2],5,FALSE) -> 20
A769: =R[-26]C+80 -> 10712 | B769: =VLOOKUP(RC[1],Sheet4!C[-1]:C[2],2,FALSE)&VLOOKUP(RC[1],Sheet4!C[-1]:C[2],3,FALSE)&RC[2]&VLOOKUP(RC[1],Sheet4!C[-1]:C[2],4,FALSE)&"（%s/"&RC[2]&"）" -> 击杀遗迹破坏者3次（%s/3） | C769: =R[-26]C -> 16 | D769: =R[-26]C -> 3 | E769: =R[-26]C -> 0 | F769: =R[-26]C -> 19005 | G769: =R[-26]C -> 50 | H769: =VLOOKUP(RC[-5],Sheet4!C[-7]:C[-2],5,FALSE) -> 20
A770: =R[-26]C+80 -> 10713 | B770: =VLOOKUP(RC[1],Sheet4!C[-1]:C[2],2,FALSE)&VLOOKUP(RC[1],Sheet4!C[-1]:C[2],3,FALSE)&RC[2]&VLOOKUP(RC[1],Sheet4!C[-1]:C[2],4,FALSE)&"（%s/"&RC[2]&"）" -> 英雄副本战斗1次（%s/1） | C770: =R[-26]C -> 14 | D770: =R[-26]C -> 1 | E770: =R[-26]C -> 0 | F770: =R[-26]C -> 19006 | G770: =R[-26]C -> 60 | H770: =VLOOKUP(RC[-5],Sheet4!C[-7]:C[-2],5,FALSE) -> 27
A771: =R[-26]C+80 -> 10721 | B771: =VLOOKUP(RC[1],Sheet4!C[-1]:C[2],2,FALSE)&VLOOKUP(RC[1],Sheet4!C[-1]:C[2],3,FALSE)&RC[2]&VLOOKUP(RC[1],Sheet4!C[-1]:C[2],4,FALSE)&"（%s/"&RC[2]&"）" -> 圣器强化5次（%s/5） | C771: =R[-26]C -> 2 | D771: =R[-26]C -> 5 | E771: =R[-26]C -> 0 | F771: =R[-26]C -> 13049 | G771: =R[-26]C -> 5 | H771: =VLOOKUP(RC[-5],Sheet4!C[-7]:C[-2],5,FALSE) -> 8
A772: =R[-26]C+80 -> 10722 | B772: =VLOOKUP(RC[1],Sheet4!C[-1]:C[2],2,FALSE)&VLOOKUP(RC[1],Sheet4!C[-1]:C[2],3,FALSE)&RC[2]&VLOOKUP(RC[1],Sheet4!C[-1]:C[2],4,FALSE)&"（%s/"&RC[2]&"）" -> 圣器争夺5次（%s/5） | C772: =R[-26]C -> 11 | D772: =R[-26]C -> 5 | E772: =R[-26]C -> 0 | F772: =R[-26]C -> 13049 | G772: =R[-26]C -> 5 | H772: =VLOOKUP(RC[-5],Sheet4!C[-7]:C[-2],5,FALSE) -> 19
A773: =R[-26]C+80 -> 10723 | B773: =VLOOKUP(RC[1],Sheet4!C[-1]:C[2],2,FALSE)&VLOOKUP(RC[1],Sheet4!C[-1]:C[2],3,FALSE)&RC[2]&VLOOKUP(RC[1],Sheet4!C[-1]:C[2],4,FALSE)&"（%s/"&RC[2]&"）" -> 圣器合成3次（%s/3） | C773: =R[-26]C -> 22 | D773: =R[-26]C -> 3 | E773: =R[-26]C -> 0 | F773: =R[-26]C -> 13049 | G773: =R[-26]C -> 5 | H773: =VLOOKUP(RC[-5],Sheet4!C[-7]:C[-2],5,FALSE) -> 19
A774: =R[-26]C+80 -> 10731 | B774: =VLOOKUP(RC[1],Sheet4!C[-1]:C[2],2,FALSE)&VLOOKUP(RC[1],Sheet4!C[-1]:C[2],3,FALSE)&RC[2]&VLOOKUP(RC[1],Sheet4!C[-1]:C[2],4,FALSE)&"（%s/"&RC[2]&"）" -> 赠送好友精力3次（%s/3） | C774: =R[-26]C -> 4 | D774: =R[-26]C -> 3 | E774: =R[-26]C -> 0 | F774: =R[-26]C -> 19005 | G774: =R[-26]C -> 40 | H774: =VLOOKUP(RC[-5],Sheet4!C[-7]:C[-2],5,FALSE) -> 15
A775: =R[-26]C+80 -> 10732 | B775: =VLOOKUP(RC[1],Sheet4!C[-1]:C[2],2,FALSE)&VLOOKUP(RC[1],Sheet4!C[-1]:C[2],3,FALSE)&RC[2]&VLOOKUP(RC[1],Sheet4!C[-1]:C[2],4,FALSE)&"（%s/"&RC[2]&"）" -> 进行召唤5次（%s/5） | C775: =R[-26]C -> 8 | D775: =R[-26]C -> 5 | E775: =R[-26]C -> 0 | F775: =R[-26]C -> 19006 | G775: =R[-26]C -> 60 | H775: =VLOOKUP(RC[-5],Sheet4!C[-7]:C[-2],5,FALSE) -> 9
A776: =R[-26]C+80 -> 10733 | B776: =VLOOKUP(RC[1],Sheet4!C[-1]:C[2],2,FALSE)&VLOOKUP(RC[1],Sheet4!C[-1]:C[2],3,FALSE)&RC[2]&VLOOKUP(RC[1],Sheet4!C[-1]:C[2],4,FALSE)&"（%s/"&RC[2]&"）" -> 进行高级召唤2次（%s/2） | C776: =R[-26]C -> 9 | D776: =R[-26]C -> 2 | E776: =R[-26]C -> 0 | F776: =R[-26]C -> 19006 | G776: =R[-26]C -> 80 | H776: =VLOOKUP(RC[-5],Sheet4!C[-7]:C[-2],5,FALSE) -> 9
A777: =R[-26]C+80 -> 10741 | B777: =VLOOKUP(RC[1],Sheet4!C[-1]:C[2],2,FALSE)&VLOOKUP(RC[1],Sheet4!C[-1]:C[2],3,FALSE)&RC[2]&VLOOKUP(RC[1],Sheet4!C[-1]:C[2],4,FALSE)&"（%s/"&RC[2]&"）" -> 异度入侵分享2次（%s/2） | C777: =R[-26]C -> 17 | D777: =R[-26]C -> 2 | E777: =R[-26]C -> 0 | F777: =R[-26]C -> 19014 | G777: =R[-26]C -> 500 | H777: =VLOOKUP(RC[-5],Sheet4!C[-7]:C[-2],5,FALSE) -> 16
A778: =R[-26]C+80 -> 10742 | B778: =VLOOKUP(RC[1],Sheet4!C[-1]:C[2],2,FALSE)&VLOOKUP(RC[1],Sheet4!C[-1]:C[2],3,FALSE)&RC[2]&VLOOKUP(RC[1],Sheet4!C[-1]:C[2],4,FALSE)&"（%s/"&RC[2]&"）" -> 讨伐异度入侵者2次（%s/2） | C778: =R[-26]C -> 18 | D778: =R[-26]C -> 2 | E778: =R[-26]C -> 0 | F778: =R[-26]C -> 19014 | G778: =R[-26]C -> 500 | H778: =VLOOKUP(RC[-5],Sheet4!C[-7]:C[-2],5,FALSE) -> 16
A779: =R[-26]C+80 -> 10743 | B779: =VLOOKUP(RC[1],Sheet4!C[-1]:C[2],2,FALSE)&VLOOKUP(RC[1],Sheet4!C[-1]:C[2],3,FALSE)&RC[2]&VLOOKUP(RC[1],Sheet4!C[-1]:C[2],4,FALSE)&"（%s/"&RC[2]&"）" -> 精英副本战斗3次（%s/3） | C779: =R[-26]C -> 15 | D779: =R[-26]C -> 3 | E779: =R[-26]C -> 0 | F779: =R[-26]C -> 10008 | G779: =R[-26]C -> 30 | H779: =VLOOKUP(RC[-5],Sheet4!C[-7]:C[-2],5,FALSE) -> 28
A780: =R[-26]C+80 -> 10744 | B780: =VLOOKUP(RC[1],Sheet4!C[-1]:C[2],2,FALSE)&VLOOKUP(RC[1],Sheet4!C[-1]:C[2],3,FALSE)&RC[2]&VLOOKUP(RC[1],Sheet4!C[-1]:C[2],4,FALSE)&"（%s/"&RC[2]&"）" -> 击杀精英外敌1个（%s/1） | C780: =R[-26]C -> 20 | D780: =R[-26]C -> 1 | E780: =R[-26]C -> 0 | F780: =R[-26]C -> 10008 | G780: =R[-26]C -> 40 | H780: =VLOOKUP(RC[-5],Sheet4!C[-7]:C[-2],5,FALSE) -> 28
A781: =R[-26]C+80 -> 10751 | B781: =VLOOKUP(RC[1],Sheet4!C[-1]:C[2],2,FALSE)&VLOOKUP(RC[1],Sheet4!C[-1]:C[2],3,FALSE)&RC[2]&VLOOKUP(RC[1],Sheet4!C[-1]:C[2],4,FALSE)&"（%s/"&RC[2]&"）" -> 购买体力2次（%s/2） | C781: =R[-26]C -> 6 | D781: =R[-26]C -> 2 | E781: =R[-26]C -> 0 | F781: =R[-26]C -> 19005 | G781: =R[-26]C -> 50 | H781: =VLOOKUP(RC[-5],Sheet4!C[-7]:C[-2],5,FALSE) -> 12
A782: =R[-26]C+80 -> 10752 | B782: =VLOOKUP(RC[1],Sheet4!C[-1]:C[2],2,FALSE)&VLOOKUP(RC[1],Sheet4!C[-1]:C[2],3,FALSE)&RC[2]&VLOOKUP(RC[1],Sheet4!C[-1]:C[2],4,FALSE)&"（%s/"&RC[2]&"）" -> 购买精力2次（%s/2） | C782: =R[-26]C -> 7 | D782: =R[-26]C -> 2 | E782: =R[-26]C -> 0 | F782: =R[-26]C -> 19005 | G782: =R[-26]C -> 50 | H782: =VLOOKUP(RC[-5],Sheet4!C[-7]:C[-2],5,FALSE) -> 12
A783: =R[-26]C+80 -> 10753 | B783: =VLOOKUP(RC[1],Sheet4!C[-1]:C[2],2,FALSE)&VLOOKUP(RC[1],Sheet4!C[-1]:C[2],3,FALSE)&RC[2]&VLOOKUP(RC[1],Sheet4!C[-1]:C[2],4,FALSE)&"（%s/"&RC[2]&"）" -> 英雄培养20次（%s/20） | C783: =R[-26]C -> 3 | D783: =R[-26]C -> 20 | E783: =R[-26]C -> 0 | F783: =R[-26]C -> 10003 | G783: =R[-26]C -> 30 | H783: =VLOOKUP(RC[-5],Sheet4!C[-7]:C[-2],5,FALSE) -> 8
A784: =R[-26]C+80 -> 10761 | B784: =VLOOKUP(RC[1],Sheet4!C[-1]:C[2],2,FALSE)&VLOOKUP(RC[1],Sheet4!C[-1]:C[2],3,FALSE)&RC[2]&VLOOKUP(RC[1],Sheet4!C[-1]:C[2],4,FALSE)&"（%s/"&RC[2]&"）" -> 无尽深渊战斗1次（%s/1） | C784: =R[-26]C -> 23 | D784: =R[-26]C -> 1 | E784: =R[-26]C -> 0 | F784: =R[-26]C -> 19028 | G784: =R[-26]C -> 50 | H784: =VLOOKUP(RC[-5],Sheet4!C[-7]:C[-2],5,FALSE) -> 88
A785: =R[-26]C+80 -> 10762 | B785: =VLOOKUP(RC[1],Sheet4!C[-1]:C[2],2,FALSE)&VLOOKUP(RC[1],Sheet4!C[-1]:C[2],3,FALSE)&RC[2]&VLOOKUP(RC[1],Sheet4!C[-1]:C[2],4,FALSE)&"（%s/"&RC[2]&"）" -> 进入勇者试练战斗10次（%s/10） | C785: =R[-26]C -> 12 | D785: =R[-26]C -> 10 | E785: =R[-26]C -> 0 | F785: =R[-26]C -> 19012 | G785: =R[-26]C -> 500 | H785: =VLOOKUP(RC[-5],Sheet4!C[-7]:C[-2],5,FALSE) -> 17
A786: =R[-26]C+80 -> 10763 | B786: =VLOOKUP(RC[1],Sheet4!C[-1]:C[2],2,FALSE)&VLOOKUP(RC[1],Sheet4!C[-1]:C[2],3,FALSE)&RC[2]&VLOOKUP(RC[1],Sheet4!C[-1]:C[2],4,FALSE)&"（%s/"&RC[2]&"）" -> 竞技场战斗5次（%s/5） | C786: =R[-26]C -> 10 | D786: =R[-26]C -> 5 | E786: =R[-26]C -> 0 | F786: =R[-26]C -> 19013 | G786: =R[-26]C -> 500 | H786: =VLOOKUP(RC[-5],Sheet4!C[-7]:C[-2],5,FALSE) -> 21
A787: =R[-26]C+80 -> 10764 | B787: =VLOOKUP(RC[1],Sheet4!C[-1]:C[2],2,FALSE)&VLOOKUP(RC[1],Sheet4!C[-1]:C[2],3,FALSE)&RC[2]&VLOOKUP(RC[1],Sheet4!C[-1]:C[2],4,FALSE)&"（%s/"&RC[2]&"）" -> 主线副本挑战5次（%s/5） | C787: =R[-26]C -> 1 | D787: =R[-26]C -> 5 | E787: =R[-26]C -> 0 | F787: =R[-26]C -> 19003 | G787: =R[-26]C -> 50000 | H787: =VLOOKUP(RC[-5],Sheet4!C[-7]:C[-2],5,FALSE) -> 26
A788: =R[-26]C+80 -> 10771 | B788: =VLOOKUP(RC[1],Sheet4!C[-1]:C[2],2,FALSE)&VLOOKUP(RC[1],Sheet4!C[-1]:C[2],3,FALSE)&RC[2]&VLOOKUP(RC[1],Sheet4!C[-1]:C[2],4,FALSE)&"（%s/"&RC[2]&"）" -> 占卜翻牌5次（%s/5） | C788: =R[-26]C -> 25 | D788: =R[-26]C -> 5 | E788: =R[-26]C -> 0 | F788: =R[-26]C -> 10096 | G788: =R[-26]C -> 1 | H788: =VLOOKUP(RC[-5],Sheet4!C[-7]:C[-2],5,FALSE) -> 113
A789: =R[-26]C+80 -> 10772 | B789: =VLOOKUP(RC[1],Sheet4!C[-1]:C[2],2,FALSE)&VLOOKUP(RC[1],Sheet4!C[-1]:C[2],3,FALSE)&RC[2]&VLOOKUP(RC[1],Sheet4!C[-1]:C[2],4,FALSE)&"（%s/"&RC[2]&"）" -> 英雄商店购买1次（%s/1） | C789: =R[-26]C -> 5 | D789: =R[-26]C -> 1 | E789: =R[-26]C -> 0 | F789: =R[-26]C -> 19006 | G789: =R[-26]C -> 60 | H789: =VLOOKUP(RC[-5],Sheet4!C[-7]:C[-2],5,FALSE) -> 11
A790: =R[-26]C+80 -> 10773 | B790: =VLOOKUP(RC[1],Sheet4!C[-1]:C[2],2,FALSE)&VLOOKUP(RC[1],Sheet4!C[-1]:C[2],3,FALSE)&RC[2]&VLOOKUP(RC[1],Sheet4!C[-1]:C[2],4,FALSE)&"（%s/"&RC[2]&"）" -> 日常副本战斗4次（%s/4） | C790: =R[-26]C -> 13 | D790: =R[-26]C -> 4 | E790: =R[-26]C -> 0 | F790: =R[-26]C -> 19005 | G790: =R[-26]C -> 50 | H790: =VLOOKUP(RC[-5],Sheet4!C[-7]:C[-2],5,FALSE) -> 2
A791: =R[-26]C+80 -> 10781 | B791: =VLOOKUP(RC[1],Sheet4!C[-1]:C[2],2,FALSE)&VLOOKUP(RC[1],Sheet4!C[-1]:C[2],3,FALSE)&RC[2]&VLOOKUP(RC[1],Sheet4!C[-1]:C[2],4,FALSE)&"（%s/"&RC[2]&"）" -> 遗迹探索4小时（%s/4） | C791: =R[-26]C -> 19 | D791: =R[-26]C -> 4 | E791: =R[-26]C -> 0 | F791: =R[-26]C -> 19003 | G791: =R[-26]C -> 50000 | H791: =VLOOKUP(RC[-5],Sheet4!C[-7]:C[-2],5,FALSE) -> 20
A792: =R[-26]C+80 -> 10782 | B792: =VLOOKUP(RC[1],Sheet4!C[-1]:C[2],2,FALSE)&VLOOKUP(RC[1],Sheet4!C[-1]:C[2],3,FALSE)&RC[2]&VLOOKUP(RC[1],Sheet4!C[-1]:C[2],4,FALSE)&"（%s/"&RC[2]&"）" -> 击杀遗迹破坏者3次（%s/3） | C792: =R[-26]C -> 16 | D792: =R[-26]C -> 3 | E792: =R[-26]C -> 0 | F792: =R[-26]C -> 19005 | G792: =R[-26]C -> 50 | H792: =VLOOKUP(RC[-5],Sheet4!C[-7]:C[-2],5,FALSE) -> 20
A793: =R[-26]C+80 -> 10783 | B793: =VLOOKUP(RC[1],Sheet4!C[-1]:C[2],2,FALSE)&VLOOKUP(RC[1],Sheet4!C[-1]:C[2],3,FALSE)&RC[2]&VLOOKUP(RC[1],Sheet4!C[-1]:C[2],4,FALSE)&"（%s/"&RC[2]&"）" -> 英雄副本战斗1次（%s/1） | C793: =R[-26]C -> 14 | D793: =R[-26]C -> 1 | E793: =R[-26]C -> 0 | F793: =R[-26]C -> 19006 | G793: =R[-26]C -> 60 | H793: =VLOOKUP(RC[-5],Sheet4!C[-7]:C[-2],5,FALSE) -> 27
A794: =R[-26]C+80 -> 10791 | B794: =VLOOKUP(RC[1],Sheet4!C[-1]:C[2],2,FALSE)&VLOOKUP(RC[1],Sheet4!C[-1]:C[2],3,FALSE)&RC[2]&VLOOKUP(RC[1],Sheet4!C[-1]:C[2],4,FALSE)&"（%s/"&RC[2]&"）" -> 遗迹探索4小时（%s/4） | C794: =R[-26]C -> 19 | D794: =R[-26]C -> 4 | E794: =R[-26]C -> 0 | F794: =R[-26]C -> 19003 | G794: =R[-26]C -> 50000 | H794: =VLOOKUP(RC[-5],Sheet4!C[-7]:C[-2],5,FALSE) -> 20
A795: =R[-26]C+80 -> 10792 | B795: =VLOOKUP(RC[1],Sheet4!C[-1]:C[2],2,FALSE)&VLOOKUP(RC[1],Sheet4!C[-1]:C[2],3,FALSE)&RC[2]&VLOOKUP(RC[1],Sheet4!C[-1]:C[2],4,FALSE)&"（%s/"&RC[2]&"）" -> 击杀遗迹破坏者3次（%s/3） | C795: =R[-26]C -> 16 | D795: =R[-26]C -> 3 | E795: =R[-26]C -> 0 | F795: =R[-26]C -> 19005 | G795: =R[-26]C -> 50 | H795: =VLOOKUP(RC[-5],Sheet4!C[-7]:C[-2],5,FALSE) -> 20
A796: =R[-26]C+80 -> 10793 | B796: =VLOOKUP(RC[1],Sheet4!C[-1]:C[2],2,FALSE)&VLOOKUP(RC[1],Sheet4!C[-1]:C[2],3,FALSE)&RC[2]&VLOOKUP(RC[1],Sheet4!C[-1]:C[2],4,FALSE)&"（%s/"&RC[2]&"）" -> 英雄副本战斗1次（%s/1） | C796: =R[-26]C -> 14 | D796: =R[-26]C -> 1 | E796: =R[-26]C -> 0 | F796: =R[-26]C -> 19006 | G796: =R[-26]C -> 60 | H796: =VLOOKUP(RC[-5],Sheet4!C[-7]:C[-2],5,FALSE) -> 27
A797: =R[-26]C+80 -> 10801 | B797: =VLOOKUP(RC[1],Sheet4!C[-1]:C[2],2,FALSE)&VLOOKUP(RC[1],Sheet4!C[-1]:C[2],3,FALSE)&RC[2]&VLOOKUP(RC[1],Sheet4!C[-1]:C[2],4,FALSE)&"（%s/"&RC[2]&"）" -> 圣器强化5次（%s/5） | C797: =R[-26]C -> 2 | D797: =R[-26]C -> 5 | E797: =R[-26]C -> 0 | F797: =R[-26]C -> 13049 | G797: =R[-26]C -> 5 | H797: =VLOOKUP(RC[-5],Sheet4!C[-7]:C[-2],5,FALSE) -> 8
A798: =R[-26]C+80 -> 10802 | B798: =VLOOKUP(RC[1],Sheet4!C[-1]:C[2],2,FALSE)&VLOOKUP(RC[1],Sheet4!C[-1]:C[2],3,FALSE)&RC[2]&VLOOKUP(RC[1],Sheet4!C[-1]:C[2],4,FALSE)&"（%s/"&RC[2]&"）" -> 圣器争夺5次（%s/5） | C798: =R[-26]C -> 11 | D798: =R[-26]C -> 5 | E798: =R[-26]C -> 0 | F798: =R[-26]C -> 13049 | G798: =R[-26]C -> 5 | H798: =VLOOKUP(RC[-5],Sheet4!C[-7]:C[-2],5,FALSE) -> 19
A799: =R[-26]C+80 -> 10803 | B799: =VLOOKUP(RC[1],Sheet4!C[-1]:C[2],2,FALSE)&VLOOKUP(RC[1],Sheet4!C[-1]:C[2],3,FALSE)&RC[2]&VLOOKUP(RC[1],Sheet4!C[-1]:C[2],4,FALSE)&"（%s/"&RC[2]&"）" -> 圣器合成3次（%s/3） | C799: =R[-26]C -> 22 | D799: =R[-26]C -> 3 | E799: =R[-26]C -> 0 | F799: =R[-26]C -> 13049 | G799: =R[-26]C -> 5 | H799: =VLOOKUP(RC[-5],Sheet4!C[-7]:C[-2],5,FALSE) -> 19
A800: =R[-26]C+80 -> 10811 | B800: =VLOOKUP(RC[1],Sheet4!C[-1]:C[2],2,FALSE)&VLOOKUP(RC[1],Sheet4!C[-1]:C[2],3,FALSE)&RC[2]&VLOOKUP(RC[1],Sheet4!C[-1]:C[2],4,FALSE)&"（%s/"&RC[2]&"）" -> 赠送好友精力3次（%s/3） | C800: =R[-26]C -> 4 | D800: =R[-26]C -> 3 | E800: =R[-26]C -> 0 | F800: =R[-26]C -> 19005 | G800: =R[-26]C -> 40 | H800: =VLOOKUP(RC[-5],Sheet4!C[-7]:C[-2],5,FALSE) -> 15
A801: =R[-26]C+80 -> 10812 | B801: =VLOOKUP(RC[1],Sheet4!C[-1]:C[2],2,FALSE)&VLOOKUP(RC[1],Sheet4!C[-1]:C[2],3,FALSE)&RC[2]&VLOOKUP(RC[1],Sheet4!C[-1]:C[2],4,FALSE)&"（%s/"&RC[2]&"）" -> 进行召唤5次（%s/5） | C801: =R[-26]C -> 8 | D801: =R[-26]C -> 5 | E801: =R[-26]C -> 0 | F801: =R[-26]C -> 19006 | G801: =R[-26]C -> 60 | H801: =VLOOKUP(RC[-5],Sheet4!C[-7]:C[-2],5,FALSE) -> 9
A802: =R[-26]C+80 -> 10813 | B802: =VLOOKUP(RC[1],Sheet4!C[-1]:C[2],2,FALSE)&VLOOKUP(RC[1],Sheet4!C[-1]:C[2],3,FALSE)&RC[2]&VLOOKUP(RC[1],Sheet4!C[-1]:C[2],4,FALSE)&"（%s/"&RC[2]&"）" -> 进行高级召唤2次（%s/2） | C802: =R[-26]C -> 9 | D802: =R[-26]C -> 2 | E802: =R[-26]C -> 0 | F802: =R[-26]C -> 19006 | G802: =R[-26]C -> 80 | H802: =VLOOKUP(RC[-5],Sheet4!C[-7]:C[-2],5,FALSE) -> 9
A803: =R[-26]C+80 -> 10821 | B803: =VLOOKUP(RC[1],Sheet4!C[-1]:C[2],2,FALSE)&VLOOKUP(RC[1],Sheet4!C[-1]:C[2],3,FALSE)&RC[2]&VLOOKUP(RC[1],Sheet4!C[-1]:C[2],4,FALSE)&"（%s/"&RC[2]&"）" -> 异度入侵分享2次（%s/2） | C803: =R[-26]C -> 17 | D803: =R[-26]C -> 2 | E803: =R[-26]C -> 0 | F803: =R[-26]C -> 19014 | G803: =R[-26]C -> 500 | H803: =VLOOKUP(RC[-5],Sheet4!C[-7]:C[-2],5,FALSE) -> 16
A804: =R[-26]C+80 -> 10822 | B804: =VLOOKUP(RC[1],Sheet4!C[-1]:C[2],2,FALSE)&VLOOKUP(RC[1],Sheet4!C[-1]:C[2],3,FALSE)&RC[2]&VLOOKUP(RC[1],Sheet4!C[-1]:C[2],4,FALSE)&"（%s/"&RC[2]&"）" -> 讨伐异度入侵者2次（%s/2） | C804: =R[-26]C -> 18 | D804: =R[-26]C -> 2 | E804: =R[-26]C -> 0 | F804: =R[-26]C -> 19014 | G804: =R[-26]C -> 500 | H804: =VLOOKUP(RC[-5],Sheet4!C[-7]:C[-2],5,FALSE) -> 16
A805: =R[-26]C+80 -> 10823 | B805: =VLOOKUP(RC[1],Sheet4!C[-1]:C[2],2,FALSE)&VLOOKUP(RC[1],Sheet4!C[-1]:C[2],3,FALSE)&RC[2]&VLOOKUP(RC[1],Sheet4!C[-1]:C[2],4,FALSE)&"（%s/"&RC[2]&"）" -> 精英副本战斗3次（%s/3） | C805: =R[-26]C -> 15 | D805: =R[-26]C -> 3 | E805: =R[-26]C -> 0 | F805: =R[-26]C -> 10008 | G805: =R[-26]C -> 30 | H805: =VLOOKUP(RC[-5],Sheet4!C[-7]:C[-2],5,FALSE) -> 28
A806: =R[-26]C+80 -> 10824 | B806: =VLOOKUP(RC[1],Sheet4!C[-1]:C[2],2,FALSE)&VLOOKUP(RC[1],Sheet4!C[-1]:C[2],3,FALSE)&RC[2]&VLOOKUP(RC[1],Sheet4!C[-1]:C[2],4,FALSE)&"（%s/"&RC[2]&"）" -> 击杀精英外敌1个（%s/1） | C806: =R[-26]C -> 20 | D806: =R[-26]C -> 1 | E806: =R[-26]C -> 0 | F806: =R[-26]C -> 10008 | G806: =R[-26]C -> 40 | H806: =VLOOKUP(RC[-5],Sheet4!C[-7]:C[-2],5,FALSE) -> 28
A807: =R[-26]C+80 -> 10831 | B807: =VLOOKUP(RC[1],Sheet4!C[-1]:C[2],2,FALSE)&VLOOKUP(RC[1],Sheet4!C[-1]:C[2],3,FALSE)&RC[2]&VLOOKUP(RC[1],Sheet4!C[-1]:C[2],4,FALSE)&"（%s/"&RC[2]&"）" -> 购买体力2次（%s/2） | C807: =R[-26]C -> 6 | D807: =R[-26]C -> 2 | E807: =R[-26]C -> 0 | F807: =R[-26]C -> 19005 | G807: =R[-26]C -> 50 | H807: =VLOOKUP(RC[-5],Sheet4!C[-7]:C[-2],5,FALSE) -> 12
A808: =R[-26]C+80 -> 10832 | B808: =VLOOKUP(RC[1],Sheet4!C[-1]:C[2],2,FALSE)&VLOOKUP(RC[1],Sheet4!C[-1]:C[2],3,FALSE)&RC[2]&VLOOKUP(RC[1],Sheet4!C[-1]:C[2],4,FALSE)&"（%s/"&RC[2]&"）" -> 购买精力2次（%s/2） | C808: =R[-26]C -> 7 | D808: =R[-26]C -> 2 | E808: =R[-26]C -> 0 | F808: =R[-26]C -> 19005 | G808: =R[-26]C -> 50 | H808: =VLOOKUP(RC[-5],Sheet4!C[-7]:C[-2],5,FALSE) -> 12
A809: =R[-26]C+80 -> 10833 | B809: =VLOOKUP(RC[1],Sheet4!C[-1]:C[2],2,FALSE)&VLOOKUP(RC[1],Sheet4!C[-1]:C[2],3,FALSE)&RC[2]&VLOOKUP(RC[1],Sheet4!C[-1]:C[2],4,FALSE)&"（%s/"&RC[2]&"）" -> 英雄培养20次（%s/20） | C809: =R[-26]C -> 3 | D809: =R[-26]C -> 20 | E809: =R[-26]C -> 0 | F809: =R[-26]C -> 10003 | G809: =R[-26]C -> 30 | H809: =VLOOKUP(RC[-5],Sheet4!C[-7]:C[-2],5,FALSE) -> 8
A810: =R[-26]C+80 -> 10841 | B810: =VLOOKUP(RC[1],Sheet4!C[-1]:C[2],2,FALSE)&VLOOKUP(RC[1],Sheet4!C[-1]:C[2],3,FALSE)&RC[2]&VLOOKUP(RC[1],Sheet4!C[-1]:C[2],4,FALSE)&"（%s/"&RC[2]&"）" -> 无尽深渊战斗1次（%s/1） | C810: =R[-26]C -> 23 | D810: =R[-26]C -> 1 | E810: =R[-26]C -> 0 | F810: =R[-26]C -> 19028 | G810: =R[-26]C -> 50 | H810: =VLOOKUP(RC[-5],Sheet4!C[-7]:C[-2],5,FALSE) -> 88
A811: =R[-26]C+80 -> 10842 | B811: =VLOOKUP(RC[1],Sheet4!C[-1]:C[2],2,FALSE)&VLOOKUP(RC[1],Sheet4!C[-1]:C[2],3,FALSE)&RC[2]&VLOOKUP(RC[1],Sheet4!C[-1]:C[2],4,FALSE)&"（%s/"&RC[2]&"）" -> 进入勇者试练战斗10次（%s/10） | C811: =R[-26]C -> 12 | D811: =R[-26]C -> 10 | E811: =R[-26]C -> 0 | F811: =R[-26]C -> 19012 | G811: =R[-26]C -> 500 | H811: =VLOOKUP(RC[-5],Sheet4!C[-7]:C[-2],5,FALSE) -> 17
A812: =R[-26]C+80 -> 10843 | B812: =VLOOKUP(RC[1],Sheet4!C[-1]:C[2],2,FALSE)&VLOOKUP(RC[1],Sheet4!C[-1]:C[2],3,FALSE)&RC[2]&VLOOKUP(RC[1],Sheet4!C[-1]:C[2],4,FALSE)&"（%s/"&RC[2]&"）" -> 竞技场战斗5次（%s/5） | C812: =R[-26]C -> 10 | D812: =R[-26]C -> 5 | E812: =R[-26]C -> 0 | F812: =R[-26]C -> 19013 | G812: =R[-26]C -> 500 | H812: =VLOOKUP(RC[-5],Sheet4!C[-7]:C[-2],5,FALSE) -> 21
A813: =R[-26]C+80 -> 10844 | B813: =VLOOKUP(RC[1],Sheet4!C[-1]:C[2],2,FALSE)&VLOOKUP(RC[1],Sheet4!C[-1]:C[2],3,FALSE)&RC[2]&VLOOKUP(RC[1],Sheet4!C[-1]:C[2],4,FALSE)&"（%s/"&RC[2]&"）" -> 主线副本挑战5次（%s/5） | C813: =R[-26]C -> 1 | D813: =R[-26]C -> 5 | E813: =R[-26]C -> 0 | F813: =R[-26]C -> 19003 | G813: =R[-26]C -> 50000 | H813: =VLOOKUP(RC[-5],Sheet4!C[-7]:C[-2],5,FALSE) -> 26
A814: =R[-26]C+80 -> 10851 | B814: =VLOOKUP(RC[1],Sheet4!C[-1]:C[2],2,FALSE)&VLOOKUP(RC[1],Sheet4!C[-1]:C[2],3,FALSE)&RC[2]&VLOOKUP(RC[1],Sheet4!C[-1]:C[2],4,FALSE)&"（%s/"&RC[2]&"）" -> 占卜翻牌5次（%s/5） | C814: =R[-26]C -> 25 | D814: =R[-26]C -> 5 | E814: =R[-26]C -> 0 | F814: =R[-26]C -> 10096 | G814: =R[-26]C -> 1 | H814: =VLOOKUP(RC[-5],Sheet4!C[-7]:C[-2],5,FALSE) -> 113
A815: =R[-26]C+80 -> 10852 | B815: =VLOOKUP(RC[1],Sheet4!C[-1]:C[2],2,FALSE)&VLOOKUP(RC[1],Sheet4!C[-1]:C[2],3,FALSE)&RC[2]&VLOOKUP(RC[1],Sheet4!C[-1]:C[2],4,FALSE)&"（%s/"&RC[2]&"）" -> 英雄商店购买1次（%s/1） | C815: =R[-26]C -> 5 | D815: =R[-26]C -> 1 | E815: =R[-26]C -> 0 | F815: =R[-26]C -> 19006 | G815: =R[-26]C -> 60 | H815: =VLOOKUP(RC[-5],Sheet4!C[-7]:C[-2],5,FALSE) -> 11
A816: =R[-26]C+80 -> 10853 | B816: =VLOOKUP(RC[1],Sheet4!C[-1]:C[2],2,FALSE)&VLOOKUP(RC[1],Sheet4!C[-1]:C[2],3,FALSE)&RC[2]&VLOOKUP(RC[1],Sheet4!C[-1]:C[2],4,FALSE)&"（%s/"&RC[2]&"）" -> 日常副本战斗4次（%s/4） | C816: =R[-26]C -> 13 | D816: =R[-26]C -> 4 | E816: =R[-26]C -> 0 | F816: =R[-26]C -> 19005 | G816: =R[-26]C -> 50 | H816: =VLOOKUP(RC[-5],Sheet4!C[-7]:C[-2],5,FALSE) -> 2
A817: =R[-26]C+80 -> 10861 | B817: =VLOOKUP(RC[1],Sheet4!C[-1]:C[2],2,FALSE)&VLOOKUP(RC[1],Sheet4!C[-1]:C[2],3,FALSE)&RC[2]&VLOOKUP(RC[1],Sheet4!C[-1]:C[2],4,FALSE)&"（%s/"&RC[2]&"）" -> 遗迹探索4小时（%s/4） | C817: =R[-26]C -> 19 | D817: =R[-26]C -> 4 | E817: =R[-26]C -> 0 | F817: =R[-26]C -> 19003 | G817: =R[-26]C -> 50000 | H817: =VLOOKUP(RC[-5],Sheet4!C[-7]:C[-2],5,FALSE) -> 20
A818: =R[-26]C+80 -> 10862 | B818: =VLOOKUP(RC[1],Sheet4!C[-1]:C[2],2,FALSE)&VLOOKUP(RC[1],Sheet4!C[-1]:C[2],3,FALSE)&RC[2]&VLOOKUP(RC[1],Sheet4!C[-1]:C[2],4,FALSE)&"（%s/"&RC[2]&"）" -> 击杀遗迹破坏者3次（%s/3） | C818: =R[-26]C -> 16 | D818: =R[-26]C -> 3 | E818: =R[-26]C -> 0 | F818: =R[-26]C -> 19005 | G818: =R[-26]C -> 50 | H818: =VLOOKUP(RC[-5],Sheet4!C[-7]:C[-2],5,FALSE) -> 20
A819: =R[-26]C+80 -> 10863 | B819: =VLOOKUP(RC[1],Sheet4!C[-1]:C[2],2,FALSE)&VLOOKUP(RC[1],Sheet4!C[-1]:C[2],3,FALSE)&RC[2]&VLOOKUP(RC[1],Sheet4!C[-1]:C[2],4,FALSE)&"（%s/"&RC[2]&"）" -> 英雄副本战斗1次（%s/1） | C819: =R[-26]C -> 14 | D819: =R[-26]C -> 1 | E819: =R[-26]C -> 0 | F819: =R[-26]C -> 19006 | G819: =R[-26]C -> 60 | H819: =VLOOKUP(RC[-5],Sheet4!C[-7]:C[-2],5,FALSE) -> 27
A820: =R[-26]C+80 -> 10871 | B820: =VLOOKUP(RC[1],Sheet4!C[-1]:C[2],2,FALSE)&VLOOKUP(RC[1],Sheet4!C[-1]:C[2],3,FALSE)&RC[2]&VLOOKUP(RC[1],Sheet4!C[-1]:C[2],4,FALSE)&"（%s/"&RC[2]&"）" -> 遗迹探索4小时（%s/4） | C820: =R[-26]C -> 19 | D820: =R[-26]C -> 4 | E820: =R[-26]C -> 0 | F820: =R[-26]C -> 19003 | G820: =R[-26]C -> 50000 | H820: =VLOOKUP(RC[-5],Sheet4!C[-7]:C[-2],5,FALSE) -> 20
A821: =R[-26]C+80 -> 10872 | B821: =VLOOKUP(RC[1],Sheet4!C[-1]:C[2],2,FALSE)&VLOOKUP(RC[1],Sheet4!C[-1]:C[2],3,FALSE)&RC[2]&VLOOKUP(RC[1],Sheet4!C[-1]:C[2],4,FALSE)&"（%s/"&RC[2]&"）" -> 击杀遗迹破坏者3次（%s/3） | C821: =R[-26]C -> 16 | D821: =R[-26]C -> 3 | E821: =R[-26]C -> 0 | F821: =R[-26]C -> 19005 | G821: =R[-26]C -> 50 | H821: =VLOOKUP(RC[-5],Sheet4!C[-7]:C[-2],5,FALSE) -> 20
A822: =R[-26]C+80 -> 10873 | B822: =VLOOKUP(RC[1],Sheet4!C[-1]:C[2],2,FALSE)&VLOOKUP(RC[1],Sheet4!C[-1]:C[2],3,FALSE)&RC[2]&VLOOKUP(RC[1],Sheet4!C[-1]:C[2],4,FALSE)&"（%s/"&RC[2]&"）" -> 英雄副本战斗1次（%s/1） | C822: =R[-26]C -> 14 | D822: =R[-26]C -> 1 | E822: =R[-26]C -> 0 | F822: =R[-26]C -> 19006 | G822: =R[-26]C -> 60 | H822: =VLOOKUP(RC[-5],Sheet4!C[-7]:C[-2],5,FALSE) -> 27
A823: =R[-26]C+80 -> 10881 | B823: =VLOOKUP(RC[1],Sheet4!C[-1]:C[2],2,FALSE)&VLOOKUP(RC[1],Sheet4!C[-1]:C[2],3,FALSE)&RC[2]&VLOOKUP(RC[1],Sheet4!C[-1]:C[2],4,FALSE)&"（%s/"&RC[2]&"）" -> 圣器强化5次（%s/5） | C823: =R[-26]C -> 2 | D823: =R[-26]C -> 5 | E823: =R[-26]C -> 0 | F823: =R[-26]C -> 13049 | G823: =R[-26]C -> 5 | H823: =VLOOKUP(RC[-5],Sheet4!C[-7]:C[-2],5,FALSE) -> 8
A824: =R[-26]C+80 -> 10882 | B824: =VLOOKUP(RC[1],Sheet4!C[-1]:C[2],2,FALSE)&VLOOKUP(RC[1],Sheet4!C[-1]:C[2],3,FALSE)&RC[2]&VLOOKUP(RC[1],Sheet4!C[-1]:C[2],4,FALSE)&"（%s/"&RC[2]&"）" -> 圣器争夺5次（%s/5） | C824: =R[-26]C -> 11 | D824: =R[-26]C -> 5 | E824: =R[-26]C -> 0 | F824: =R[-26]C -> 13049 | G824: =R[-26]C -> 5 | H824: =VLOOKUP(RC[-5],Sheet4!C[-7]:C[-2],5,FALSE) -> 19
A825: =R[-26]C+80 -> 10883 | B825: =VLOOKUP(RC[1],Sheet4!C[-1]:C[2],2,FALSE)&VLOOKUP(RC[1],Sheet4!C[-1]:C[2],3,FALSE)&RC[2]&VLOOKUP(RC[1],Sheet4!C[-1]:C[2],4,FALSE)&"（%s/"&RC[2]&"）" -> 圣器合成3次（%s/3） | C825: =R[-26]C -> 22 | D825: =R[-26]C -> 3 | E825: =R[-26]C -> 0 | F825: =R[-26]C -> 13049 | G825: =R[-26]C -> 5 | H825: =VLOOKUP(RC[-5],Sheet4!C[-7]:C[-2],5,FALSE) -> 19
A826: =R[-26]C+80 -> 10891 | B826: =VLOOKUP(RC[1],Sheet4!C[-1]:C[2],2,FALSE)&VLOOKUP(RC[1],Sheet4!C[-1]:C[2],3,FALSE)&RC[2]&VLOOKUP(RC[1],Sheet4!C[-1]:C[2],4,FALSE)&"（%s/"&RC[2]&"）" -> 赠送好友精力3次（%s/3） | C826: =R[-26]C -> 4 | D826: =R[-26]C -> 3 | E826: =R[-26]C -> 0 | F826: =R[-26]C -> 19005 | G826: =R[-26]C -> 40 | H826: =VLOOKUP(RC[-5],Sheet4!C[-7]:C[-2],5,FALSE) -> 15
A827: =R[-26]C+80 -> 10892 | B827: =VLOOKUP(RC[1],Sheet4!C[-1]:C[2],2,FALSE)&VLOOKUP(RC[1],Sheet4!C[-1]:C[2],3,FALSE)&RC[2]&VLOOKUP(RC[1],Sheet4!C[-1]:C[2],4,FALSE)&"（%s/"&RC[2]&"）" -> 进行召唤5次（%s/5） | C827: =R[-26]C -> 8 | D827: =R[-26]C -> 5 | E827: =R[-26]C -> 0 | F827: =R[-26]C -> 19006 | G827: =R[-26]C -> 60 | H827: =VLOOKUP(RC[-5],Sheet4!C[-7]:C[-2],5,FALSE) -> 9
A828: =R[-26]C+80 -> 10893 | B828: =VLOOKUP(RC[1],Sheet4!C[-1]:C[2],2,FALSE)&VLOOKUP(RC[1],Sheet4!C[-1]:C[2],3,FALSE)&RC[2]&VLOOKUP(RC[1],Sheet4!C[-1]:C[2],4,FALSE)&"（%s/"&RC[2]&"）" -> 进行高级召唤2次（%s/2） | C828: =R[-26]C -> 9 | D828: =R[-26]C -> 2 | E828: =R[-26]C -> 0 | F828: =R[-26]C -> 19006 | G828: =R[-26]C -> 80 | H828: =VLOOKUP(RC[-5],Sheet4!C[-7]:C[-2],5,FALSE) -> 9
A829: =R[-26]C+80 -> 10901 | B829: =VLOOKUP(RC[1],Sheet4!C[-1]:C[2],2,FALSE)&VLOOKUP(RC[1],Sheet4!C[-1]:C[2],3,FALSE)&RC[2]&VLOOKUP(RC[1],Sheet4!C[-1]:C[2],4,FALSE)&"（%s/"&RC[2]&"）" -> 异度入侵分享2次（%s/2） | C829: =R[-26]C -> 17 | D829: =R[-26]C -> 2 | E829: =R[-26]C -> 0 | F829: =R[-26]C -> 19014 | G829: =R[-26]C -> 500 | H829: =VLOOKUP(RC[-5],Sheet4!C[-7]:C[-2],5,FALSE) -> 16
A830: =R[-26]C+80 -> 10902 | B830: =VLOOKUP(RC[1],Sheet4!C[-1]:C[2],2,FALSE)&VLOOKUP(RC[1],Sheet4!C[-1]:C[2],3,FALSE)&RC[2]&VLOOKUP(RC[1],Sheet4!C[-1]:C[2],4,FALSE)&"（%s/"&RC[2]&"）" -> 讨伐异度入侵者2次（%s/2） | C830: =R[-26]C -> 18 | D830: =R[-26]C -> 2 | E830: =R[-26]C -> 0 | F830: =R[-26]C -> 19014 | G830: =R[-26]C -> 500 | H830: =VLOOKUP(RC[-5],Sheet4!C[-7]:C[-2],5,FALSE) -> 16
A831: =R[-26]C+80 -> 10903 | B831: =VLOOKUP(RC[1],Sheet4!C[-1]:C[2],2,FALSE)&VLOOKUP(RC[1],Sheet4!C[-1]:C[2],3,FALSE)&RC[2]&VLOOKUP(RC[1],Sheet4!C[-1]:C[2],4,FALSE)&"（%s/"&RC[2]&"）" -> 精英副本战斗3次（%s/3） | C831: =R[-26]C -> 15 | D831: =R[-26]C -> 3 | E831: =R[-26]C -> 0 | F831: =R[-26]C -> 10008 | G831: =R[-26]C -> 30 | H831: =VLOOKUP(RC[-5],Sheet4!C[-7]:C[-2],5,FALSE) -> 28
A832: =R[-26]C+80 -> 10904 | B832: =VLOOKUP(RC[1],Sheet4!C[-1]:C[2],2,FALSE)&VLOOKUP(RC[1],Sheet4!C[-1]:C[2],3,FALSE)&RC[2]&VLOOKUP(RC[1],Sheet4!C[-1]:C[2],4,FALSE)&"（%s/"&RC[2]&"）" -> 击杀精英外敌1个（%s/1） | C832: =R[-26]C -> 20 | D832: =R[-26]C -> 1 | E832: =R[-26]C -> 0 | F832: =R[-26]C -> 10008 | G832: =R[-26]C -> 40 | H832: =VLOOKUP(RC[-5],Sheet4!C[-7]:C[-2],5,FALSE) -> 28
A833: =R[-26]C+80 -> 10911 | B833: =VLOOKUP(RC[1],Sheet4!C[-1]:C[2],2,FALSE)&VLOOKUP(RC[1],Sheet4!C[-1]:C[2],3,FALSE)&RC[2]&VLOOKUP(RC[1],Sheet4!C[-1]:C[2],4,FALSE)&"（%s/"&RC[2]&"）" -> 购买体力2次（%s/2） | C833: =R[-26]C -> 6 | D833: =R[-26]C -> 2 | E833: =R[-26]C -> 0 | F833: =R[-26]C -> 19005 | G833: =R[-26]C -> 50 | H833: =VLOOKUP(RC[-5],Sheet4!C[-7]:C[-2],5,FALSE) -> 12
A834: =R[-26]C+80 -> 10912 | B834: =VLOOKUP(RC[1],Sheet4!C[-1]:C[2],2,FALSE)&VLOOKUP(RC[1],Sheet4!C[-1]:C[2],3,FALSE)&RC[2]&VLOOKUP(RC[1],Sheet4!C[-1]:C[2],4,FALSE)&"（%s/"&RC[2]&"）" -> 购买精力2次（%s/2） | C834: =R[-26]C -> 7 | D834: =R[-26]C -> 2 | E834: =R[-26]C -> 0 | F834: =R[-26]C -> 19005 | G834: =R[-26]C -> 50 | H834: =VLOOKUP(RC[-5],Sheet4!C[-7]:C[-2],5,FALSE) -> 12
A835: =R[-26]C+80 -> 10913 | B835: =VLOOKUP(RC[1],Sheet4!C[-1]:C[2],2,FALSE)&VLOOKUP(RC[1],Sheet4!C[-1]:C[2],3,FALSE)&RC[2]&VLOOKUP(RC[1],Sheet4!C[-1]:C[2],4,FALSE)&"（%s/"&RC[2]&"）" -> 英雄培养20次（%s/20） | C835: =R[-26]C -> 3 | D835: =R[-26]C -> 20 | E835: =R[-26]C -> 0 | F835: =R[-26]C -> 10003 | G835: =R[-26]C -> 30 | H835: =VLOOKUP(RC[-5],Sheet4!C[-7]:C[-2],5,FALSE) -> 8
A836: =R[-26]C+80 -> 10921 | B836: =VLOOKUP(RC[1],Sheet4!C[-1]:C[2],2,FALSE)&VLOOKUP(RC[1],Sheet4!C[-1]:C[2],3,FALSE)&RC[2]&VLOOKUP(RC[1],Sheet4!C[-1]:C[2],4,FALSE)&"（%s/"&RC[2]&"）" -> 无尽深渊战斗1次（%s/1） | C836: =R[-26]C -> 23 | D836: =R[-26]C -> 1 | E836: =R[-26]C -> 0 | F836: =R[-26]C -> 19028 | G836: =R[-26]C -> 50 | H836: =VLOOKUP(RC[-5],Sheet4!C[-7]:C[-2],5,FALSE) -> 88
A837: =R[-26]C+80 -> 10922 | B837: =VLOOKUP(RC[1],Sheet4!C[-1]:C[2],2,FALSE)&VLOOKUP(RC[1],Sheet4!C[-1]:C[2],3,FALSE)&RC[2]&VLOOKUP(RC[1],Sheet4!C[-1]:C[2],4,FALSE)&"（%s/"&RC[2]&"）" -> 进入勇者试练战斗10次（%s/10） | C837: =R[-26]C -> 12 | D837: =R[-26]C -> 10 | E837: =R[-26]C -> 0 | F837: =R[-26]C -> 19012 | G837: =R[-26]C -> 500 | H837: =VLOOKUP(RC[-5],Sheet4!C[-7]:C[-2],5,FALSE) -> 17
A838: =R[-26]C+80 -> 10923 | B838: =VLOOKUP(RC[1],Sheet4!C[-1]:C[2],2,FALSE)&VLOOKUP(RC[1],Sheet4!C[-1]:C[2],3,FALSE)&RC[2]&VLOOKUP(RC[1],Sheet4!C[-1]:C[2],4,FALSE)&"（%s/"&RC[2]&"）" -> 竞技场战斗5次（%s/5） | C838: =R[-26]C -> 10 | D838: =R[-26]C -> 5 | E838: =R[-26]C -> 0 | F838: =R[-26]C -> 19013 | G838: =R[-26]C -> 500 | H838: =VLOOKUP(RC[-5],Sheet4!C[-7]:C[-2],5,FALSE) -> 21
A839: =R[-26]C+80 -> 10924 | B839: =VLOOKUP(RC[1],Sheet4!C[-1]:C[2],2,FALSE)&VLOOKUP(RC[1],Sheet4!C[-1]:C[2],3,FALSE)&RC[2]&VLOOKUP(RC[1],Sheet4!C[-1]:C[2],4,FALSE)&"（%s/"&RC[2]&"）" -> 主线副本挑战5次（%s/5） | C839: =R[-26]C -> 1 | D839: =R[-26]C -> 5 | E839: =R[-26]C -> 0 | F839: =R[-26]C -> 19003 | G839: =R[-26]C -> 50000 | H839: =VLOOKUP(RC[-5],Sheet4!C[-7]:C[-2],5,FALSE) -> 26
A840: =R[-26]C+80 -> 10931 | B840: =VLOOKUP(RC[1],Sheet4!C[-1]:C[2],2,FALSE)&VLOOKUP(RC[1],Sheet4!C[-1]:C[2],3,FALSE)&RC[2]&VLOOKUP(RC[1],Sheet4!C[-1]:C[2],4,FALSE)&"（%s/"&RC[2]&"）" -> 占卜翻牌5次（%s/5） | C840: =R[-26]C -> 25 | D840: =R[-26]C -> 5 | E840: =R[-26]C -> 0 | F840: =R[-26]C -> 10096 | G840: =R[-26]C -> 1 | H840: =VLOOKUP(RC[-5],Sheet4!C[-7]:C[-2],5,FALSE) -> 113
A841: =R[-26]C+80 -> 10932 | B841: =VLOOKUP(RC[1],Sheet4!C[-1]:C[2],2,FALSE)&VLOOKUP(RC[1],Sheet4!C[-1]:C[2],3,FALSE)&RC[2]&VLOOKUP(RC[1],Sheet4!C[-1]:C[2],4,FALSE)&"（%s/"&RC[2]&"）" -> 英雄商店购买1次（%s/1） | C841: =R[-26]C -> 5 | D841: =R[-26]C -> 1 | E841: =R[-26]C -> 0 | F841: =R[-26]C -> 19006 | G841: =R[-26]C -> 60 | H841: =VLOOKUP(RC[-5],Sheet4!C[-7]:C[-2],5,FALSE) -> 11
A842: =R[-26]C+80 -> 10933 | B842: =VLOOKUP(RC[1],Sheet4!C[-1]:C[2],2,FALSE)&VLOOKUP(RC[1],Sheet4!C[-1]:C[2],3,FALSE)&RC[2]&VLOOKUP(RC[1],Sheet4!C[-1]:C[2],4,FALSE)&"（%s/"&RC[2]&"）" -> 日常副本战斗4次（%s/4） | C842: =R[-26]C -> 13 | D842: =R[-26]C -> 4 | E842: =R[-26]C -> 0 | F842: =R[-26]C -> 19005 | G842: =R[-26]C -> 50 | H842: =VLOOKUP(RC[-5],Sheet4!C[-7]:C[-2],5,FALSE) -> 2
A843: =R[-26]C+80 -> 10941 | B843: =VLOOKUP(RC[1],Sheet4!C[-1]:C[2],2,FALSE)&VLOOKUP(RC[1],Sheet4!C[-1]:C[2],3,FALSE)&RC[2]&VLOOKUP(RC[1],Sheet4!C[-1]:C[2],4,FALSE)&"（%s/"&RC[2]&"）" -> 遗迹探索4小时（%s/4） | C843: =R[-26]C -> 19 | D843: =R[-26]C -> 4 | E843: =R[-26]C -> 0 | F843: =R[-26]C -> 19003 | G843: =R[-26]C -> 50000 | H843: =VLOOKUP(RC[-5],Sheet4!C[-7]:C[-2],5,FALSE) -> 20
A844: =R[-26]C+80 -> 10942 | B844: =VLOOKUP(RC[1],Sheet4!C[-1]:C[2],2,FALSE)&VLOOKUP(RC[1],Sheet4!C[-1]:C[2],3,FALSE)&RC[2]&VLOOKUP(RC[1],Sheet4!C[-1]:C[2],4,FALSE)&"（%s/"&RC[2]&"）" -> 击杀遗迹破坏者3次（%s/3） | C844: =R[-26]C -> 16 | D844: =R[-26]C -> 3 | E844: =R[-26]C -> 0 | F844: =R[-26]C -> 19005 | G844: =R[-26]C -> 50 | H844: =VLOOKUP(RC[-5],Sheet4!C[-7]:C[-2],5,FALSE) -> 20
A845: =R[-26]C+80 -> 10943 | B845: =VLOOKUP(RC[1],Sheet4!C[-1]:C[2],2,FALSE)&VLOOKUP(RC[1],Sheet4!C[-1]:C[2],3,FALSE)&RC[2]&VLOOKUP(RC[1],Sheet4!C[-1]:C[2],4,FALSE)&"（%s/"&RC[2]&"）" -> 英雄副本战斗1次（%s/1） | C845: =R[-26]C -> 14 | D845: =R[-26]C -> 1 | E845: =R[-26]C -> 0 | F845: =R[-26]C -> 19006 | G845: =R[-26]C -> 60 | H845: =VLOOKUP(RC[-5],Sheet4!C[-7]:C[-2],5,FALSE) -> 27
A846: =R[-26]C+80 -> 10951 | B846: =VLOOKUP(RC[1],Sheet4!C[-1]:C[2],2,FALSE)&VLOOKUP(RC[1],Sheet4!C[-1]:C[2],3,FALSE)&RC[2]&VLOOKUP(RC[1],Sheet4!C[-1]:C[2],4,FALSE)&"（%s/"&RC[2]&"）" -> 遗迹探索4小时（%s/4） | C846: =R[-26]C -> 19 | D846: =R[-26]C -> 4 | E846: =R[-26]C -> 0 | F846: =R[-26]C -> 19003 | G846: =R[-26]C -> 50000 | H846: =VLOOKUP(RC[-5],Sheet4!C[-7]:C[-2],5,FALSE) -> 20
A847: =R[-26]C+80 -> 10952 | B847: =VLOOKUP(RC[1],Sheet4!C[-1]:C[2],2,FALSE)&VLOOKUP(RC[1],Sheet4!C[-1]:C[2],3,FALSE)&RC[2]&VLOOKUP(RC[1],Sheet4!C[-1]:C[2],4,FALSE)&"（%s/"&RC[2]&"）" -> 击杀遗迹破坏者3次（%s/3） | C847: =R[-26]C -> 16 | D847: =R[-26]C -> 3 | E847: =R[-26]C -> 0 | F847: =R[-26]C -> 19005 | G847: =R[-26]C -> 50 | H847: =VLOOKUP(RC[-5],Sheet4!C[-7]:C[-2],5,FALSE) -> 20
A848: =R[-26]C+80 -> 10953 | B848: =VLOOKUP(RC[1],Sheet4!C[-1]:C[2],2,FALSE)&VLOOKUP(RC[1],Sheet4!C[-1]:C[2],3,FALSE)&RC[2]&VLOOKUP(RC[1],Sheet4!C[-1]:C[2],4,FALSE)&"（%s/"&RC[2]&"）" -> 英雄副本战斗1次（%s/1） | C848: =R[-26]C -> 14 | D848: =R[-26]C -> 1 | E848: =R[-26]C -> 0 | F848: =R[-26]C -> 19006 | G848: =R[-26]C -> 60 | H848: =VLOOKUP(RC[-5],Sheet4!C[-7]:C[-2],5,FALSE) -> 27
A849: =R[-26]C+80 -> 10961 | B849: =VLOOKUP(RC[1],Sheet4!C[-1]:C[2],2,FALSE)&VLOOKUP(RC[1],Sheet4!C[-1]:C[2],3,FALSE)&RC[2]&VLOOKUP(RC[1],Sheet4!C[-1]:C[2],4,FALSE)&"（%s/"&RC[2]&"）" -> 圣器强化5次（%s/5） | C849: =R[-26]C -> 2 | D849: =R[-26]C -> 5 | E849: =R[-26]C -> 0 | F849: =R[-26]C -> 13049 | G849: =R[-26]C -> 5 | H849: =VLOOKUP(RC[-5],Sheet4!C[-7]:C[-2],5,FALSE) -> 8
A850: =R[-26]C+80 -> 10962 | B850: =VLOOKUP(RC[1],Sheet4!C[-1]:C[2],2,FALSE)&VLOOKUP(RC[1],Sheet4!C[-1]:C[2],3,FALSE)&RC[2]&VLOOKUP(RC[1],Sheet4!C[-1]:C[2],4,FALSE)&"（%s/"&RC[2]&"）" -> 圣器争夺5次（%s/5） | C850: =R[-26]C -> 11 | D850: =R[-26]C -> 5 | E850: =R[-26]C -> 0 | F850: =R[-26]C -> 13049 | G850: =R[-26]C -> 5 | H850: =VLOOKUP(RC[-5],Sheet4!C[-7]:C[-2],5,FALSE) -> 19
A851: =R[-26]C+80 -> 10963 | B851: =VLOOKUP(RC[1],Sheet4!C[-1]:C[2],2,FALSE)&VLOOKUP(RC[1],Sheet4!C[-1]:C[2],3,FALSE)&RC[2]&VLOOKUP(RC[1],Sheet4!C[-1]:C[2],4,FALSE)&"（%s/"&RC[2]&"）" -> 圣器合成3次（%s/3） | C851: =R[-26]C -> 22 | D851: =R[-26]C -> 3 | E851: =R[-26]C -> 0 | F851: =R[-26]C -> 13049 | G851: =R[-26]C -> 5 | H851: =VLOOKUP(RC[-5],Sheet4!C[-7]:C[-2],5,FALSE) -> 19
A852: =R[-26]C+80 -> 10971 | B852: =VLOOKUP(RC[1],Sheet4!C[-1]:C[2],2,FALSE)&VLOOKUP(RC[1],Sheet4!C[-1]:C[2],3,FALSE)&RC[2]&VLOOKUP(RC[1],Sheet4!C[-1]:C[2],4,FALSE)&"（%s/"&RC[2]&"）" -> 赠送好友精力3次（%s/3） | C852: =R[-26]C -> 4 | D852: =R[-26]C -> 3 | E852: =R[-26]C -> 0 | F852: =R[-26]C -> 19005 | G852: =R[-26]C -> 40 | H852: =VLOOKUP(RC[-5],Sheet4!C[-7]:C[-2],5,FALSE) -> 15
A853: =R[-26]C+80 -> 10972 | B853: =VLOOKUP(RC[1],Sheet4!C[-1]:C[2],2,FALSE)&VLOOKUP(RC[1],Sheet4!C[-1]:C[2],3,FALSE)&RC[2]&VLOOKUP(RC[1],Sheet4!C[-1]:C[2],4,FALSE)&"（%s/"&RC[2]&"）" -> 进行召唤5次（%s/5） | C853: =R[-26]C -> 8 | D853: =R[-26]C -> 5 | E853: =R[-26]C -> 0 | F853: =R[-26]C -> 19006 | G853: =R[-26]C -> 60 | H853: =VLOOKUP(RC[-5],Sheet4!C[-7]:C[-2],5,FALSE) -> 9
A854: =R[-26]C+80 -> 10973 | B854: =VLOOKUP(RC[1],Sheet4!C[-1]:C[2],2,FALSE)&VLOOKUP(RC[1],Sheet4!C[-1]:C[2],3,FALSE)&RC[2]&VLOOKUP(RC[1],Sheet4!C[-1]:C[2],4,FALSE)&"（%s/"&RC[2]&"）" -> 进行高级召唤2次（%s/2） | C854: =R[-26]C -> 9 | D854: =R[-26]C -> 2 | E854: =R[-26]C -> 0 | F854: =R[-26]C -> 19006 | G854: =R[-26]C -> 80 | H854: =VLOOKUP(RC[-5],Sheet4!C[-7]:C[-2],5,FALSE) -> 9
A855: =R[-26]C+80 -> 10981 | B855: =VLOOKUP(RC[1],Sheet4!C[-1]:C[2],2,FALSE)&VLOOKUP(RC[1],Sheet4!C[-1]:C[2],3,FALSE)&RC[2]&VLOOKUP(RC[1],Sheet4!C[-1]:C[2],4,FALSE)&"（%s/"&RC[2]&"）" -> 异度入侵分享2次（%s/2） | C855: =R[-26]C -> 17 | D855: =R[-26]C -> 2 | E855: =R[-26]C -> 0 | F855: =R[-26]C -> 19014 | G855: =R[-26]C -> 500 | H855: =VLOOKUP(RC[-5],Sheet4!C[-7]:C[-2],5,FALSE) -> 16
A856: =R[-26]C+80 -> 10982 | B856: =VLOOKUP(RC[1],Sheet4!C[-1]:C[2],2,FALSE)&VLOOKUP(RC[1],Sheet4!C[-1]:C[2],3,FALSE)&RC[2]&VLOOKUP(RC[1],Sheet4!C[-1]:C[2],4,FALSE)&"（%s/"&RC[2]&"）" -> 讨伐异度入侵者2次（%s/2） | C856: =R[-26]C -> 18 | D856: =R[-26]C -> 2 | E856: =R[-26]C -> 0 | F856: =R[-26]C -> 19014 | G856: =R[-26]C -> 500 | H856: =VLOOKUP(RC[-5],Sheet4!C[-7]:C[-2],5,FALSE) -> 16
A857: =R[-26]C+80 -> 10983 | B857: =VLOOKUP(RC[1],Sheet4!C[-1]:C[2],2,FALSE)&VLOOKUP(RC[1],Sheet4!C[-1]:C[2],3,FALSE)&RC[2]&VLOOKUP(RC[1],Sheet4!C[-1]:C[2],4,FALSE)&"（%s/"&RC[2]&"）" -> 精英副本战斗3次（%s/3） | C857: =R[-26]C -> 15 | D857: =R[-26]C -> 3 | E857: =R[-26]C -> 0 | F857: =R[-26]C -> 10008 | G857: =R[-26]C -> 30 | H857: =VLOOKUP(RC[-5],Sheet4!C[-7]:C[-2],5,FALSE) -> 28
A858: =R[-26]C+80 -> 10984 | B858: =VLOOKUP(RC[1],Sheet4!C[-1]:C[2],2,FALSE)&VLOOKUP(RC[1],Sheet4!C[-1]:C[2],3,FALSE)&RC[2]&VLOOKUP(RC[1],Sheet4!C[-1]:C[2],4,FALSE)&"（%s/"&RC[2]&"）" -> 击杀精英外敌1个（%s/1） | C858: =R[-26]C -> 20 | D858: =R[-26]C -> 1 | E858: =R[-26]C -> 0 | F858: =R[-26]C -> 10008 | G858: =R[-26]C -> 40 | H858: =VLOOKUP(RC[-5],Sheet4!C[-7]:C[-2],5,FALSE) -> 28
A859: =R[-26]C+80 -> 10991 | B859: =VLOOKUP(RC[1],Sheet4!C[-1]:C[2],2,FALSE)&VLOOKUP(RC[1],Sheet4!C[-1]:C[2],3,FALSE)&RC[2]&VLOOKUP(RC[1],Sheet4!C[-1]:C[2],4,FALSE)&"（%s/"&RC[2]&"）" -> 购买体力2次（%s/2） | C859: =R[-26]C -> 6 | D859: =R[-26]C -> 2 | E859: =R[-26]C -> 0 | F859: =R[-26]C -> 19005 | G859: =R[-26]C -> 50 | H859: =VLOOKUP(RC[-5],Sheet4!C[-7]:C[-2],5,FALSE) -> 12
A860: =R[-26]C+80 -> 10992 | B860: =VLOOKUP(RC[1],Sheet4!C[-1]:C[2],2,FALSE)&VLOOKUP(RC[1],Sheet4!C[-1]:C[2],3,FALSE)&RC[2]&VLOOKUP(RC[1],Sheet4!C[-1]:C[2],4,FALSE)&"（%s/"&RC[2]&"）" -> 购买精力2次（%s/2） | C860: =R[-26]C -> 7 | D860: =R[-26]C -> 2 | E860: =R[-26]C -> 0 | F860: =R[-26]C -> 19005 | G860: =R[-26]C -> 50 | H860: =VLOOKUP(RC[-5],Sheet4!C[-7]:C[-2],5,FALSE) -> 12
A861: =R[-26]C+80 -> 10993 | B861: =VLOOKUP(RC[1],Sheet4!C[-1]:C[2],2,FALSE)&VLOOKUP(RC[1],Sheet4!C[-1]:C[2],3,FALSE)&RC[2]&VLOOKUP(RC[1],Sheet4!C[-1]:C[2],4,FALSE)&"（%s/"&RC[2]&"）" -> 英雄培养20次（%s/20） | C861: =R[-26]C -> 3 | D861: =R[-26]C -> 20 | E861: =R[-26]C -> 0 | F861: =R[-26]C -> 10003 | G861: =R[-26]C -> 30 | H861: =VLOOKUP(RC[-5],Sheet4!C[-7]:C[-2],5,FALSE) -> 8
A862: =R[-26]C+80 -> 11001 | B862: =VLOOKUP(RC[1],Sheet4!C[-1]:C[2],2,FALSE)&VLOOKUP(RC[1],Sheet4!C[-1]:C[2],3,FALSE)&RC[2]&VLOOKUP(RC[1],Sheet4!C[-1]:C[2],4,FALSE)&"（%s/"&RC[2]&"）" -> 无尽深渊战斗1次（%s/1） | C862: =R[-26]C -> 23 | D862: =R[-26]C -> 1 | E862: =R[-26]C -> 0 | F862: =R[-26]C -> 19028 | G862: =R[-26]C -> 50 | H862: =VLOOKUP(RC[-5],Sheet4!C[-7]:C[-2],5,FALSE) -> 88
A863: =R[-26]C+80 -> 11002 | B863: =VLOOKUP(RC[1],Sheet4!C[-1]:C[2],2,FALSE)&VLOOKUP(RC[1],Sheet4!C[-1]:C[2],3,FALSE)&RC[2]&VLOOKUP(RC[1],Sheet4!C[-1]:C[2],4,FALSE)&"（%s/"&RC[2]&"）" -> 进入勇者试练战斗10次（%s/10） | C863: =R[-26]C -> 12 | D863: =R[-26]C -> 10 | E863: =R[-26]C -> 0 | F863: =R[-26]C -> 19012 | G863: =R[-26]C -> 500 | H863: =VLOOKUP(RC[-5],Sheet4!C[-7]:C[-2],5,FALSE) -> 17
A864: =R[-26]C+80 -> 11003 | B864: =VLOOKUP(RC[1],Sheet4!C[-1]:C[2],2,FALSE)&VLOOKUP(RC[1],Sheet4!C[-1]:C[2],3,FALSE)&RC[2]&VLOOKUP(RC[1],Sheet4!C[-1]:C[2],4,FALSE)&"（%s/"&RC[2]&"）" -> 竞技场战斗5次（%s/5） | C864: =R[-26]C -> 10 | D864: =R[-26]C -> 5 | E864: =R[-26]C -> 0 | F864: =R[-26]C -> 19013 | G864: =R[-26]C -> 500 | H864: =VLOOKUP(RC[-5],Sheet4!C[-7]:C[-2],5,FALSE) -> 21
A865: =R[-26]C+80 -> 11004 | B865: =VLOOKUP(RC[1],Sheet4!C[-1]:C[2],2,FALSE)&VLOOKUP(RC[1],Sheet4!C[-1]:C[2],3,FALSE)&RC[2]&VLOOKUP(RC[1],Sheet4!C[-1]:C[2],4,FALSE)&"（%s/"&RC[2]&"）" -> 主线副本挑战5次（%s/5） | C865: =R[-26]C -> 1 | D865: =R[-26]C -> 5 | E865: =R[-26]C -> 0 | F865: =R[-26]C -> 19003 | G865: =R[-26]C -> 50000 | H865: =VLOOKUP(RC[-5],Sheet4!C[-7]:C[-2],5,FALSE) -> 26
A866: =R[-26]C+80 -> 11011 | B866: =VLOOKUP(RC[1],Sheet4!C[-1]:C[2],2,FALSE)&VLOOKUP(RC[1],Sheet4!C[-1]:C[2],3,FALSE)&RC[2]&VLOOKUP(RC[1],Sheet4!C[-1]:C[2],4,FALSE)&"（%s/"&RC[2]&"）" -> 占卜翻牌5次（%s/5） | C866: =R[-26]C -> 25 | D866: =R[-26]C -> 5 | E866: =R[-26]C -> 0 | F866: =R[-26]C -> 10096 | G866: =R[-26]C -> 1 | H866: =VLOOKUP(RC[-5],Sheet4!C[-7]:C[-2],5,FALSE) -> 113
A867: =R[-26]C+80 -> 11012 | B867: =VLOOKUP(RC[1],Sheet4!C[-1]:C[2],2,FALSE)&VLOOKUP(RC[1],Sheet4!C[-1]:C[2],3,FALSE)&RC[2]&VLOOKUP(RC[1],Sheet4!C[-1]:C[2],4,FALSE)&"（%s/"&RC[2]&"）" -> 英雄商店购买1次（%s/1） | C867: =R[-26]C -> 5 | D867: =R[-26]C -> 1 | E867: =R[-26]C -> 0 | F867: =R[-26]C -> 19006 | G867: =R[-26]C -> 60 | H867: =VLOOKUP(RC[-5],Sheet4!C[-7]:C[-2],5,FALSE) -> 11
A868: =R[-26]C+80 -> 11013 | B868: =VLOOKUP(RC[1],Sheet4!C[-1]:C[2],2,FALSE)&VLOOKUP(RC[1],Sheet4!C[-1]:C[2],3,FALSE)&RC[2]&VLOOKUP(RC[1],Sheet4!C[-1]:C[2],4,FALSE)&"（%s/"&RC[2]&"）" -> 日常副本战斗4次（%s/4） | C868: =R[-26]C -> 13 | D868: =R[-26]C -> 4 | E868: =R[-26]C -> 0 | F868: =R[-26]C -> 19005 | G868: =R[-26]C -> 50 | H868: =VLOOKUP(RC[-5],Sheet4!C[-7]:C[-2],5,FALSE) -> 2
A869: =R[-26]C+80 -> 11021 | B869: =VLOOKUP(RC[1],Sheet4!C[-1]:C[2],2,FALSE)&VLOOKUP(RC[1],Sheet4!C[-1]:C[2],3,FALSE)&RC[2]&VLOOKUP(RC[1],Sheet4!C[-1]:C[2],4,FALSE)&"（%s/"&RC[2]&"）" -> 遗迹探索4小时（%s/4） | C869: =R[-26]C -> 19 | D869: =R[-26]C -> 4 | E869: =R[-26]C -> 0 | F869: =R[-26]C -> 19003 | G869: =R[-26]C -> 50000 | H869: =VLOOKUP(RC[-5],Sheet4!C[-7]:C[-2],5,FALSE) -> 20
A870: =R[-26]C+80 -> 11022 | B870: =VLOOKUP(RC[1],Sheet4!C[-1]:C[2],2,FALSE)&VLOOKUP(RC[1],Sheet4!C[-1]:C[2],3,FALSE)&RC[2]&VLOOKUP(RC[1],Sheet4!C[-1]:C[2],4,FALSE)&"（%s/"&RC[2]&"）" -> 击杀遗迹破坏者3次（%s/3） | C870: =R[-26]C -> 16 | D870: =R[-26]C -> 3 | E870: =R[-26]C -> 0 | F870: =R[-26]C -> 19005 | G870: =R[-26]C -> 50 | H870: =VLOOKUP(RC[-5],Sheet4!C[-7]:C[-2],5,FALSE) -> 20
A871: =R[-26]C+80 -> 11023 | B871: =VLOOKUP(RC[1],Sheet4!C[-1]:C[2],2,FALSE)&VLOOKUP(RC[1],Sheet4!C[-1]:C[2],3,FALSE)&RC[2]&VLOOKUP(RC[1],Sheet4!C[-1]:C[2],4,FALSE)&"（%s/"&RC[2]&"）" -> 英雄副本战斗1次（%s/1） | C871: =R[-26]C -> 14 | D871: =R[-26]C -> 1 | E871: =R[-26]C -> 0 | F871: =R[-26]C -> 19006 | G871: =R[-26]C -> 60 | H871: =VLOOKUP(RC[-5],Sheet4!C[-7]:C[-2],5,FALSE) -> 27
A872: =R[-26]C+80 -> 11031 | B872: =VLOOKUP(RC[1],Sheet4!C[-1]:C[2],2,FALSE)&VLOOKUP(RC[1],Sheet4!C[-1]:C[2],3,FALSE)&RC[2]&VLOOKUP(RC[1],Sheet4!C[-1]:C[2],4,FALSE)&"（%s/"&RC[2]&"）" -> 遗迹探索4小时（%s/4） | C872: =R[-26]C -> 19 | D872: =R[-26]C -> 4 | E872: =R[-26]C -> 0 | F872: =R[-26]C -> 19003 | G872: =R[-26]C -> 50000 | H872: =VLOOKUP(RC[-5],Sheet4!C[-7]:C[-2],5,FALSE) -> 20
A873: =R[-26]C+80 -> 11032 | B873: =VLOOKUP(RC[1],Sheet4!C[-1]:C[2],2,FALSE)&VLOOKUP(RC[1],Sheet4!C[-1]:C[2],3,FALSE)&RC[2]&VLOOKUP(RC[1],Sheet4!C[-1]:C[2],4,FALSE)&"（%s/"&RC[2]&"）" -> 击杀遗迹破坏者3次（%s/3） | C873: =R[-26]C -> 16 | D873: =R[-26]C -> 3 | E873: =R[-26]C -> 0 | F873: =R[-26]C -> 19005 | G873: =R[-26]C -> 50 | H873: =VLOOKUP(RC[-5],Sheet4!C[-7]:C[-2],5,FALSE) -> 20
A874: =R[-26]C+80 -> 11033 | B874: =VLOOKUP(RC[1],Sheet4!C[-1]:C[2],2,FALSE)&VLOOKUP(RC[1],Sheet4!C[-1]:C[2],3,FALSE)&RC[2]&VLOOKUP(RC[1],Sheet4!C[-1]:C[2],4,FALSE)&"（%s/"&RC[2]&"）" -> 英雄副本战斗1次（%s/1） | C874: =R[-26]C -> 14 | D874: =R[-26]C -> 1 | E874: =R[-26]C -> 0 | F874: =R[-26]C -> 19006 | G874: =R[-26]C -> 60 | H874: =VLOOKUP(RC[-5],Sheet4!C[-7]:C[-2],5,FALSE) -> 27
A875: =R[-26]C+80 -> 11041 | B875: =VLOOKUP(RC[1],Sheet4!C[-1]:C[2],2,FALSE)&VLOOKUP(RC[1],Sheet4!C[-1]:C[2],3,FALSE)&RC[2]&VLOOKUP(RC[1],Sheet4!C[-1]:C[2],4,FALSE)&"（%s/"&RC[2]&"）" -> 圣器强化5次（%s/5） | C875: =R[-26]C -> 2 | D875: =R[-26]C -> 5 | E875: =R[-26]C -> 0 | F875: =R[-26]C -> 13049 | G875: =R[-26]C -> 5 | H875: =VLOOKUP(RC[-5],Sheet4!C[-7]:C[-2],5,FALSE) -> 8
A876: =R[-26]C+80 -> 11042 | B876: =VLOOKUP(RC[1],Sheet4!C[-1]:C[2],2,FALSE)&VLOOKUP(RC[1],Sheet4!C[-1]:C[2],3,FALSE)&RC[2]&VLOOKUP(RC[1],Sheet4!C[-1]:C[2],4,FALSE)&"（%s/"&RC[2]&"）" -> 圣器争夺5次（%s/5） | C876: =R[-26]C -> 11 | D876: =R[-26]C -> 5 | E876: =R[-26]C -> 0 | F876: =R[-26]C -> 13049 | G876: =R[-26]C -> 5 | H876: =VLOOKUP(RC[-5],Sheet4!C[-7]:C[-2],5,FALSE) -> 19
A877: =R[-26]C+80 -> 11043 | B877: =VLOOKUP(RC[1],Sheet4!C[-1]:C[2],2,FALSE)&VLOOKUP(RC[1],Sheet4!C[-1]:C[2],3,FALSE)&RC[2]&VLOOKUP(RC[1],Sheet4!C[-1]:C[2],4,FALSE)&"（%s/"&RC[2]&"）" -> 圣器合成3次（%s/3） | C877: =R[-26]C -> 22 | D877: =R[-26]C -> 3 | E877: =R[-26]C -> 0 | F877: =R[-26]C -> 13049 | G877: =R[-26]C -> 5 | H877: =VLOOKUP(RC[-5],Sheet4!C[-7]:C[-2],5,FALSE) -> 19
A878: =R[-26]C+80 -> 11051 | B878: =VLOOKUP(RC[1],Sheet4!C[-1]:C[2],2,FALSE)&VLOOKUP(RC[1],Sheet4!C[-1]:C[2],3,FALSE)&RC[2]&VLOOKUP(RC[1],Sheet4!C[-1]:C[2],4,FALSE)&"（%s/"&RC[2]&"）" -> 赠送好友精力3次（%s/3） | C878: =R[-26]C -> 4 | D878: =R[-26]C -> 3 | E878: =R[-26]C -> 0 | F878: =R[-26]C -> 19005 | G878: =R[-26]C -> 40 | H878: =VLOOKUP(RC[-5],Sheet4!C[-7]:C[-2],5,FALSE) -> 15
A879: =R[-26]C+80 -> 11052 | B879: =VLOOKUP(RC[1],Sheet4!C[-1]:C[2],2,FALSE)&VLOOKUP(RC[1],Sheet4!C[-1]:C[2],3,FALSE)&RC[2]&VLOOKUP(RC[1],Sheet4!C[-1]:C[2],4,FALSE)&"（%s/"&RC[2]&"）" -> 进行召唤5次（%s/5） | C879: =R[-26]C -> 8 | D879: =R[-26]C -> 5 | E879: =R[-26]C -> 0 | F879: =R[-26]C -> 19006 | G879: =R[-26]C -> 60 | H879: =VLOOKUP(RC[-5],Sheet4!C[-7]:C[-2],5,FALSE) -> 9
A880: =R[-26]C+80 -> 11053 | B880: =VLOOKUP(RC[1],Sheet4!C[-1]:C[2],2,FALSE)&VLOOKUP(RC[1],Sheet4!C[-1]:C[2],3,FALSE)&RC[2]&VLOOKUP(RC[1],Sheet4!C[-1]:C[2],4,FALSE)&"（%s/"&RC[2]&"）" -> 进行高级召唤2次（%s/2） | C880: =R[-26]C -> 9 | D880: =R[-26]C -> 2 | E880: =R[-26]C -> 0 | F880: =R[-26]C -> 19006 | G880: =R[-26]C -> 80 | H880: =VLOOKUP(RC[-5],Sheet4!C[-7]:C[-2],5,FALSE) -> 9
A881: =R[-26]C+80 -> 11061 | B881: =VLOOKUP(RC[1],Sheet4!C[-1]:C[2],2,FALSE)&VLOOKUP(RC[1],Sheet4!C[-1]:C[2],3,FALSE)&RC[2]&VLOOKUP(RC[1],Sheet4!C[-1]:C[2],4,FALSE)&"（%s/"&RC[2]&"）" -> 异度入侵分享2次（%s/2） | C881: =R[-26]C -> 17 | D881: =R[-26]C -> 2 | E881: =R[-26]C -> 0 | F881: =R[-26]C -> 19014 | G881: =R[-26]C -> 500 | H881: =VLOOKUP(RC[-5],Sheet4!C[-7]:C[-2],5,FALSE) -> 16
A882: =R[-26]C+80 -> 11062 | B882: =VLOOKUP(RC[1],Sheet4!C[-1]:C[2],2,FALSE)&VLOOKUP(RC[1],Sheet4!C[-1]:C[2],3,FALSE)&RC[2]&VLOOKUP(RC[1],Sheet4!C[-1]:C[2],4,FALSE)&"（%s/"&RC[2]&"）" -> 讨伐异度入侵者2次（%s/2） | C882: =R[-26]C -> 18 | D882: =R[-26]C -> 2 | E882: =R[-26]C -> 0 | F882: =R[-26]C -> 19014 | G882: =R[-26]C -> 500 | H882: =VLOOKUP(RC[-5],Sheet4!C[-7]:C[-2],5,FALSE) -> 16
A883: =R[-26]C+80 -> 11063 | B883: =VLOOKUP(RC[1],Sheet4!C[-1]:C[2],2,FALSE)&VLOOKUP(RC[1],Sheet4!C[-1]:C[2],3,FALSE)&RC[2]&VLOOKUP(RC[1],Sheet4!C[-1]:C[2],4,FALSE)&"（%s/"&RC[2]&"）" -> 精英副本战斗3次（%s/3） | C883: =R[-26]C -> 15 | D883: =R[-26]C -> 3 | E883: =R[-26]C -> 0 | F883: =R[-26]C -> 10008 | G883: =R[-26]C -> 30 | H883: =VLOOKUP(RC[-5],Sheet4!C[-7]:C[-2],5,FALSE) -> 28
A884: =R[-26]C+80 -> 11064 | B884: =VLOOKUP(RC[1],Sheet4!C[-1]:C[2],2,FALSE)&VLOOKUP(RC[1],Sheet4!C[-1]:C[2],3,FALSE)&RC[2]&VLOOKUP(RC[1],Sheet4!C[-1]:C[2],4,FALSE)&"（%s/"&RC[2]&"）" -> 击杀精英外敌1个（%s/1） | C884: =R[-26]C -> 20 | D884: =R[-26]C -> 1 | E884: =R[-26]C -> 0 | F884: =R[-26]C -> 10008 | G884: =R[-26]C -> 40 | H884: =VLOOKUP(RC[-5],Sheet4!C[-7]:C[-2],5,FALSE) -> 28
A885: =R[-26]C+80 -> 11071 | B885: =VLOOKUP(RC[1],Sheet4!C[-1]:C[2],2,FALSE)&VLOOKUP(RC[1],Sheet4!C[-1]:C[2],3,FALSE)&RC[2]&VLOOKUP(RC[1],Sheet4!C[-1]:C[2],4,FALSE)&"（%s/"&RC[2]&"）" -> 购买体力2次（%s/2） | C885: =R[-26]C -> 6 | D885: =R[-26]C -> 2 | E885: =R[-26]C -> 0 | F885: =R[-26]C -> 19005 | G885: =R[-26]C -> 50 | H885: =VLOOKUP(RC[-5],Sheet4!C[-7]:C[-2],5,FALSE) -> 12
A886: =R[-26]C+80 -> 11072 | B886: =VLOOKUP(RC[1],Sheet4!C[-1]:C[2],2,FALSE)&VLOOKUP(RC[1],Sheet4!C[-1]:C[2],3,FALSE)&RC[2]&VLOOKUP(RC[1],Sheet4!C[-1]:C[2],4,FALSE)&"（%s/"&RC[2]&"）" -> 购买精力2次（%s/2） | C886: =R[-26]C -> 7 | D886: =R[-26]C -> 2 | E886: =R[-26]C -> 0 | F886: =R[-26]C -> 19005 | G886: =R[-26]C -> 50 | H886: =VLOOKUP(RC[-5],Sheet4!C[-7]:C[-2],5,FALSE) -> 12
A887: =R[-26]C+80 -> 11073 | B887: =VLOOKUP(RC[1],Sheet4!C[-1]:C[2],2,FALSE)&VLOOKUP(RC[1],Sheet4!C[-1]:C[2],3,FALSE)&RC[2]&VLOOKUP(RC[1],Sheet4!C[-1]:C[2],4,FALSE)&"（%s/"&RC[2]&"）" -> 英雄培养20次（%s/20） | C887: =R[-26]C -> 3 | D887: =R[-26]C -> 20 | E887: =R[-26]C -> 0 | F887: =R[-26]C -> 10003 | G887: =R[-26]C -> 30 | H887: =VLOOKUP(RC[-5],Sheet4!C[-7]:C[-2],5,FALSE) -> 8
A888: =R[-26]C+80 -> 11081 | B888: =VLOOKUP(RC[1],Sheet4!C[-1]:C[2],2,FALSE)&VLOOKUP(RC[1],Sheet4!C[-1]:C[2],3,FALSE)&RC[2]&VLOOKUP(RC[1],Sheet4!C[-1]:C[2],4,FALSE)&"（%s/"&RC[2]&"）" -> 无尽深渊战斗1次（%s/1） | C888: =R[-26]C -> 23 | D888: =R[-26]C -> 1 | E888: =R[-26]C -> 0 | F888: =R[-26]C -> 19028 | G888: =R[-26]C -> 50 | H888: =VLOOKUP(RC[-5],Sheet4!C[-7]:C[-2],5,FALSE) -> 88
A889: =R[-26]C+80 -> 11082 | B889: =VLOOKUP(RC[1],Sheet4!C[-1]:C[2],2,FALSE)&VLOOKUP(RC[1],Sheet4!C[-1]:C[2],3,FALSE)&RC[2]&VLOOKUP(RC[1],Sheet4!C[-1]:C[2],4,FALSE)&"（%s/"&RC[2]&"）" -> 进入勇者试练战斗10次（%s/10） | C889: =R[-26]C -> 12 | D889: =R[-26]C -> 10 | E889: =R[-26]C -> 0 | F889: =R[-26]C -> 19012 | G889: =R[-26]C -> 500 | H889: =VLOOKUP(RC[-5],Sheet4!C[-7]:C[-2],5,FALSE) -> 17
A890: =R[-26]C+80 -> 11083 | B890: =VLOOKUP(RC[1],Sheet4!C[-1]:C[2],2,FALSE)&VLOOKUP(RC[1],Sheet4!C[-1]:C[2],3,FALSE)&RC[2]&VLOOKUP(RC[1],Sheet4!C[-1]:C[2],4,FALSE)&"（%s/"&RC[2]&"）" -> 竞技场战斗5次（%s/5） | C890: =R[-26]C -> 10 | D890: =R[-26]C -> 5 | E890: =R[-26]C -> 0 | F890: =R[-26]C -> 19013 | G890: =R[-26]C -> 500 | H890: =VLOOKUP(RC[-5],Sheet4!C[-7]:C[-2],5,FALSE) -> 21
A891: =R[-26]C+80 -> 11084 | B891: =VLOOKUP(RC[1],Sheet4!C[-1]:C[2],2,FALSE)&VLOOKUP(RC[1],Sheet4!C[-1]:C[2],3,FALSE)&RC[2]&VLOOKUP(RC[1],Sheet4!C[-1]:C[2],4,FALSE)&"（%s/"&RC[2]&"）" -> 主线副本挑战5次（%s/5） | C891: =R[-26]C -> 1 | D891: =R[-26]C -> 5 | E891: =R[-26]C -> 0 | F891: =R[-26]C -> 19003 | G891: =R[-26]C -> 50000 | H891: =VLOOKUP(RC[-5],Sheet4!C[-7]:C[-2],5,FALSE) -> 26
A892: =R[-26]C+80 -> 11091 | B892: =VLOOKUP(RC[1],Sheet4!C[-1]:C[2],2,FALSE)&VLOOKUP(RC[1],Sheet4!C[-1]:C[2],3,FALSE)&RC[2]&VLOOKUP(RC[1],Sheet4!C[-1]:C[2],4,FALSE)&"（%s/"&RC[2]&"）" -> 占卜翻牌5次（%s/5） | C892: =R[-26]C -> 25 | D892: =R[-26]C -> 5 | E892: =R[-26]C -> 0 | F892: =R[-26]C -> 10096 | G892: =R[-26]C -> 1 | H892: =VLOOKUP(RC[-5],Sheet4!C[-7]:C[-2],5,FALSE) -> 113
A893: =R[-26]C+80 -> 11092 | B893: =VLOOKUP(RC[1],Sheet4!C[-1]:C[2],2,FALSE)&VLOOKUP(RC[1],Sheet4!C[-1]:C[2],3,FALSE)&RC[2]&VLOOKUP(RC[1],Sheet4!C[-1]:C[2],4,FALSE)&"（%s/"&RC[2]&"）" -> 英雄商店购买1次（%s/1） | C893: =R[-26]C -> 5 | D893: =R[-26]C -> 1 | E893: =R[-26]C -> 0 | F893: =R[-26]C -> 19006 | G893: =R[-26]C -> 60 | H893: =VLOOKUP(RC[-5],Sheet4!C[-7]:C[-2],5,FALSE) -> 11
A894: =R[-26]C+80 -> 11093 | B894: =VLOOKUP(RC[1],Sheet4!C[-1]:C[2],2,FALSE)&VLOOKUP(RC[1],Sheet4!C[-1]:C[2],3,FALSE)&RC[2]&VLOOKUP(RC[1],Sheet4!C[-1]:C[2],4,FALSE)&"（%s/"&RC[2]&"）" -> 日常副本战斗4次（%s/4） | C894: =R[-26]C -> 13 | D894: =R[-26]C -> 4 | E894: =R[-26]C -> 0 | F894: =R[-26]C -> 19005 | G894: =R[-26]C -> 50 | H894: =VLOOKUP(RC[-5],Sheet4!C[-7]:C[-2],5,FALSE) -> 2
A895: =R[-26]C+80 -> 11101 | B895: =VLOOKUP(RC[1],Sheet4!C[-1]:C[2],2,FALSE)&VLOOKUP(RC[1],Sheet4!C[-1]:C[2],3,FALSE)&RC[2]&VLOOKUP(RC[1],Sheet4!C[-1]:C[2],4,FALSE)&"（%s/"&RC[2]&"）" -> 遗迹探索4小时（%s/4） | C895: =R[-26]C -> 19 | D895: =R[-26]C -> 4 | E895: =R[-26]C -> 0 | F895: =R[-26]C -> 19003 | G895: =R[-26]C -> 50000 | H895: =VLOOKUP(RC[-5],Sheet4!C[-7]:C[-2],5,FALSE) -> 20
A896: =R[-26]C+80 -> 11102 | B896: =VLOOKUP(RC[1],Sheet4!C[-1]:C[2],2,FALSE)&VLOOKUP(RC[1],Sheet4!C[-1]:C[2],3,FALSE)&RC[2]&VLOOKUP(RC[1],Sheet4!C[-1]:C[2],4,FALSE)&"（%s/"&RC[2]&"）" -> 击杀遗迹破坏者3次（%s/3） | C896: =R[-26]C -> 16 | D896: =R[-26]C -> 3 | E896: =R[-26]C -> 0 | F896: =R[-26]C -> 19005 | G896: =R[-26]C -> 50 | H896: =VLOOKUP(RC[-5],Sheet4!C[-7]:C[-2],5,FALSE) -> 20
A897: =R[-26]C+80 -> 11103 | B897: =VLOOKUP(RC[1],Sheet4!C[-1]:C[2],2,FALSE)&VLOOKUP(RC[1],Sheet4!C[-1]:C[2],3,FALSE)&RC[2]&VLOOKUP(RC[1],Sheet4!C[-1]:C[2],4,FALSE)&"（%s/"&RC[2]&"）" -> 英雄副本战斗1次（%s/1） | C897: =R[-26]C -> 14 | D897: =R[-26]C -> 1 | E897: =R[-26]C -> 0 | F897: =R[-26]C -> 19006 | G897: =R[-26]C -> 60 | H897: =VLOOKUP(RC[-5],Sheet4!C[-7]:C[-2],5,FALSE) -> 27
A898: =R[-26]C+80 -> 11111 | B898: =VLOOKUP(RC[1],Sheet4!C[-1]:C[2],2,FALSE)&VLOOKUP(RC[1],Sheet4!C[-1]:C[2],3,FALSE)&RC[2]&VLOOKUP(RC[1],Sheet4!C[-1]:C[2],4,FALSE)&"（%s/"&RC[2]&"）" -> 遗迹探索4小时（%s/4） | C898: =R[-26]C -> 19 | D898: =R[-26]C -> 4 | E898: =R[-26]C -> 0 | F898: =R[-26]C -> 19003 | G898: =R[-26]C -> 50000 | H898: =VLOOKUP(RC[-5],Sheet4!C[-7]:C[-2],5,FALSE) -> 20
A899: =R[-26]C+80 -> 11112 | B899: =VLOOKUP(RC[1],Sheet4!C[-1]:C[2],2,FALSE)&VLOOKUP(RC[1],Sheet4!C[-1]:C[2],3,FALSE)&RC[2]&VLOOKUP(RC[1],Sheet4!C[-1]:C[2],4,FALSE)&"（%s/"&RC[2]&"）" -> 击杀遗迹破坏者3次（%s/3） | C899: =R[-26]C -> 16 | D899: =R[-26]C -> 3 | E899: =R[-26]C -> 0 | F899: =R[-26]C -> 19005 | G899: =R[-26]C -> 50 | H899: =VLOOKUP(RC[-5],Sheet4!C[-7]:C[-2],5,FALSE) -> 20
A900: =R[-26]C+80 -> 11113 | B900: =VLOOKUP(RC[1],Sheet4!C[-1]:C[2],2,FALSE)&VLOOKUP(RC[1],Sheet4!C[-1]:C[2],3,FALSE)&RC[2]&VLOOKUP(RC[1],Sheet4!C[-1]:C[2],4,FALSE)&"（%s/"&RC[2]&"）" -> 英雄副本战斗1次（%s/1） | C900: =R[-26]C -> 14 | D900: =R[-26]C -> 1 | E900: =R[-26]C -> 0 | F900: =R[-26]C -> 19006 | G900: =R[-26]C -> 60 | H900: =VLOOKUP(RC[-5],Sheet4!C[-7]:C[-2],5,FALSE) -> 27
A901: =R[-26]C+80 -> 11121 | B901: =VLOOKUP(RC[1],Sheet4!C[-1]:C[2],2,FALSE)&VLOOKUP(RC[1],Sheet4!C[-1]:C[2],3,FALSE)&RC[2]&VLOOKUP(RC[1],Sheet4!C[-1]:C[2],4,FALSE)&"（%s/"&RC[2]&"）" -> 圣器强化5次（%s/5） | C901: =R[-26]C -> 2 | D901: =R[-26]C -> 5 | E901: =R[-26]C -> 0 | F901: =R[-26]C -> 13049 | G901: =R[-26]C -> 5 | H901: =VLOOKUP(RC[-5],Sheet4!C[-7]:C[-2],5,FALSE) -> 8
A902: =R[-26]C+80 -> 11122 | B902: =VLOOKUP(RC[1],Sheet4!C[-1]:C[2],2,FALSE)&VLOOKUP(RC[1],Sheet4!C[-1]:C[2],3,FALSE)&RC[2]&VLOOKUP(RC[1],Sheet4!C[-1]:C[2],4,FALSE)&"（%s/"&RC[2]&"）" -> 圣器争夺5次（%s/5） | C902: =R[-26]C -> 11 | D902: =R[-26]C -> 5 | E902: =R[-26]C -> 0 | F902: =R[-26]C -> 13049 | G902: =R[-26]C -> 5 | H902: =VLOOKUP(RC[-5],Sheet4!C[-7]:C[-2],5,FALSE) -> 19
A903: =R[-26]C+80 -> 11123 | B903: =VLOOKUP(RC[1],Sheet4!C[-1]:C[2],2,FALSE)&VLOOKUP(RC[1],Sheet4!C[-1]:C[2],3,FALSE)&RC[2]&VLOOKUP(RC[1],Sheet4!C[-1]:C[2],4,FALSE)&"（%s/"&RC[2]&"）" -> 圣器合成3次（%s/3） | C903: =R[-26]C -> 22 | D903: =R[-26]C -> 3 | E903: =R[-26]C -> 0 | F903: =R[-26]C -> 13049 | G903: =R[-26]C -> 5 | H903: =VLOOKUP(RC[-5],Sheet4!C[-7]:C[-2],5,FALSE) -> 19
A904: =R[-26]C+80 -> 11131 | B904: =VLOOKUP(RC[1],Sheet4!C[-1]:C[2],2,FALSE)&VLOOKUP(RC[1],Sheet4!C[-1]:C[2],3,FALSE)&RC[2]&VLOOKUP(RC[1],Sheet4!C[-1]:C[2],4,FALSE)&"（%s/"&RC[2]&"）" -> 赠送好友精力3次（%s/3） | C904: =R[-26]C -> 4 | D904: =R[-26]C -> 3 | E904: =R[-26]C -> 0 | F904: =R[-26]C -> 19005 | G904: =R[-26]C -> 40 | H904: =VLOOKUP(RC[-5],Sheet4!C[-7]:C[-2],5,FALSE) -> 15
A905: =R[-26]C+80 -> 11132 | B905: =VLOOKUP(RC[1],Sheet4!C[-1]:C[2],2,FALSE)&VLOOKUP(RC[1],Sheet4!C[-1]:C[2],3,FALSE)&RC[2]&VLOOKUP(RC[1],Sheet4!C[-1]:C[2],4,FALSE)&"（%s/"&RC[2]&"）" -> 进行召唤5次（%s/5） | C905: =R[-26]C -> 8 | D905: =R[-26]C -> 5 | E905: =R[-26]C -> 0 | F905: =R[-26]C -> 19006 | G905: =R[-26]C -> 60 | H905: =VLOOKUP(RC[-5],Sheet4!C[-7]:C[-2],5,FALSE) -> 9
A906: =R[-26]C+80 -> 11133 | B906: =VLOOKUP(RC[1],Sheet4!C[-1]:C[2],2,FALSE)&VLOOKUP(RC[1],Sheet4!C[-1]:C[2],3,FALSE)&RC[2]&VLOOKUP(RC[1],Sheet4!C[-1]:C[2],4,FALSE)&"（%s/"&RC[2]&"）" -> 进行高级召唤2次（%s/2） | C906: =R[-26]C -> 9 | D906: =R[-26]C -> 2 | E906: =R[-26]C -> 0 | F906: =R[-26]C -> 19006 | G906: =R[-26]C -> 80 | H906: =VLOOKUP(RC[-5],Sheet4!C[-7]:C[-2],5,FALSE) -> 9
A907: =R[-26]C+80 -> 11141 | B907: =VLOOKUP(RC[1],Sheet4!C[-1]:C[2],2,FALSE)&VLOOKUP(RC[1],Sheet4!C[-1]:C[2],3,FALSE)&RC[2]&VLOOKUP(RC[1],Sheet4!C[-1]:C[2],4,FALSE)&"（%s/"&RC[2]&"）" -> 异度入侵分享2次（%s/2） | C907: =R[-26]C -> 17 | D907: =R[-26]C -> 2 | E907: =R[-26]C -> 0 | F907: =R[-26]C -> 19014 | G907: =R[-26]C -> 500 | H907: =VLOOKUP(RC[-5],Sheet4!C[-7]:C[-2],5,FALSE) -> 16
A908: =R[-26]C+80 -> 11142 | B908: =VLOOKUP(RC[1],Sheet4!C[-1]:C[2],2,FALSE)&VLOOKUP(RC[1],Sheet4!C[-1]:C[2],3,FALSE)&RC[2]&VLOOKUP(RC[1],Sheet4!C[-1]:C[2],4,FALSE)&"（%s/"&RC[2]&"）" -> 讨伐异度入侵者2次（%s/2） | C908: =R[-26]C -> 18 | D908: =R[-26]C -> 2 | E908: =R[-26]C -> 0 | F908: =R[-26]C -> 19014 | G908: =R[-26]C -> 500 | H908: =VLOOKUP(RC[-5],Sheet4!C[-7]:C[-2],5,FALSE) -> 16
A909: =R[-26]C+80 -> 11143 | B909: =VLOOKUP(RC[1],Sheet4!C[-1]:C[2],2,FALSE)&VLOOKUP(RC[1],Sheet4!C[-1]:C[2],3,FALSE)&RC[2]&VLOOKUP(RC[1],Sheet4!C[-1]:C[2],4,FALSE)&"（%s/"&RC[2]&"）" -> 精英副本战斗3次（%s/3） | C909: =R[-26]C -> 15 | D909: =R[-26]C -> 3 | E909: =R[-26]C -> 0 | F909: =R[-26]C -> 10008 | G909: =R[-26]C -> 30 | H909: =VLOOKUP(RC[-5],Sheet4!C[-7]:C[-2],5,FALSE) -> 28
A910: =R[-26]C+80 -> 11144 | B910: =VLOOKUP(RC[1],Sheet4!C[-1]:C[2],2,FALSE)&VLOOKUP(RC[1],Sheet4!C[-1]:C[2],3,FALSE)&RC[2]&VLOOKUP(RC[1],Sheet4!C[-1]:C[2],4,FALSE)&"（%s/"&RC[2]&"）" -> 击杀精英外敌1个（%s/1） | C910: =R[-26]C -> 20 | D910: =R[-26]C -> 1 | E910: =R[-26]C -> 0 | F910: =R[-26]C -> 10008 | G910: =R[-26]C -> 40 | H910: =VLOOKUP(RC[-5],Sheet4!C[-7]:C[-2],5,FALSE) -> 28
A911: =R[-26]C+80 -> 11151 | B911: =VLOOKUP(RC[1],Sheet4!C[-1]:C[2],2,FALSE)&VLOOKUP(RC[1],Sheet4!C[-1]:C[2],3,FALSE)&RC[2]&VLOOKUP(RC[1],Sheet4!C[-1]:C[2],4,FALSE)&"（%s/"&RC[2]&"）" -> 购买体力2次（%s/2） | C911: =R[-26]C -> 6 | D911: =R[-26]C -> 2 | E911: =R[-26]C -> 0 | F911: =R[-26]C -> 19005 | G911: =R[-26]C -> 50 | H911: =VLOOKUP(RC[-5],Sheet4!C[-7]:C[-2],5,FALSE) -> 12
A912: =R[-26]C+80 -> 11152 | B912: =VLOOKUP(RC[1],Sheet4!C[-1]:C[2],2,FALSE)&VLOOKUP(RC[1],Sheet4!C[-1]:C[2],3,FALSE)&RC[2]&VLOOKUP(RC[1],Sheet4!C[-1]:C[2],4,FALSE)&"（%s/"&RC[2]&"）" -> 购买精力2次（%s/2） | C912: =R[-26]C -> 7 | D912: =R[-26]C -> 2 | E912: =R[-26]C -> 0 | F912: =R[-26]C -> 19005 | G912: =R[-26]C -> 50 | H912: =VLOOKUP(RC[-5],Sheet4!C[-7]:C[-2],5,FALSE) -> 12
A913: =R[-26]C+80 -> 11153 | B913: =VLOOKUP(RC[1],Sheet4!C[-1]:C[2],2,FALSE)&VLOOKUP(RC[1],Sheet4!C[-1]:C[2],3,FALSE)&RC[2]&VLOOKUP(RC[1],Sheet4!C[-1]:C[2],4,FALSE)&"（%s/"&RC[2]&"）" -> 英雄培养20次（%s/20） | C913: =R[-26]C -> 3 | D913: =R[-26]C -> 20 | E913: =R[-26]C -> 0 | F913: =R[-26]C -> 10003 | G913: =R[-26]C -> 30 | H913: =VLOOKUP(RC[-5],Sheet4!C[-7]:C[-2],5,FALSE) -> 8
A914: =R[-26]C+80 -> 11161 | B914: =VLOOKUP(RC[1],Sheet4!C[-1]:C[2],2,FALSE)&VLOOKUP(RC[1],Sheet4!C[-1]:C[2],3,FALSE)&RC[2]&VLOOKUP(RC[1],Sheet4!C[-1]:C[2],4,FALSE)&"（%s/"&RC[2]&"）" -> 无尽深渊战斗1次（%s/1） | C914: =R[-26]C -> 23 | D914: =R[-26]C -> 1 | E914: =R[-26]C -> 0 | F914: =R[-26]C -> 19028 | G914: =R[-26]C -> 50 | H914: =VLOOKUP(RC[-5],Sheet4!C[-7]:C[-2],5,FALSE) -> 88
A915: =R[-26]C+80 -> 11162 | B915: =VLOOKUP(RC[1],Sheet4!C[-1]:C[2],2,FALSE)&VLOOKUP(RC[1],Sheet4!C[-1]:C[2],3,FALSE)&RC[2]&VLOOKUP(RC[1],Sheet4!C[-1]:C[2],4,FALSE)&"（%s/"&RC[2]&"）" -> 进入勇者试练战斗10次（%s/10） | C915: =R[-26]C -> 12 | D915: =R[-26]C -> 10 | E915: =R[-26]C -> 0 | F915: =R[-26]C -> 19012 | G915: =R[-26]C -> 500 | H915: =VLOOKUP(RC[-5],Sheet4!C[-7]:C[-2],5,FALSE) -> 17
A916: =R[-26]C+80 -> 11163 | B916: =VLOOKUP(RC[1],Sheet4!C[-1]:C[2],2,FALSE)&VLOOKUP(RC[1],Sheet4!C[-1]:C[2],3,FALSE)&RC[2]&VLOOKUP(RC[1],Sheet4!C[-1]:C[2],4,FALSE)&"（%s/"&RC[2]&"）" -> 竞技场战斗5次（%s/5） | C916: =R[-26]C -> 10 | D916: =R[-26]C -> 5 | E916: =R[-26]C -> 0 | F916: =R[-26]C -> 19013 | G916: =R[-26]C -> 500 | H916: =VLOOKUP(RC[-5],Sheet4!C[-7]:C[-2],5,FALSE) -> 21
A917: =R[-26]C+80 -> 11164 | B917: =VLOOKUP(RC[1],Sheet4!C[-1]:C[2],2,FALSE)&VLOOKUP(RC[1],Sheet4!C[-1]:C[2],3,FALSE)&RC[2]&VLOOKUP(RC[1],Sheet4!C[-1]:C[2],4,FALSE)&"（%s/"&RC[2]&"）" -> 主线副本挑战5次（%s/5） | C917: =R[-26]C -> 1 | D917: =R[-26]C -> 5 | E917: =R[-26]C -> 0 | F917: =R[-26]C -> 19003 | G917: =R[-26]C -> 50000 | H917: =VLOOKUP(RC[-5],Sheet4!C[-7]:C[-2],5,FALSE) -> 26
A918: =R[-26]C+80 -> 11171 | B918: =VLOOKUP(RC[1],Sheet4!C[-1]:C[2],2,FALSE)&VLOOKUP(RC[1],Sheet4!C[-1]:C[2],3,FALSE)&RC[2]&VLOOKUP(RC[1],Sheet4!C[-1]:C[2],4,FALSE)&"（%s/"&RC[2]&"）" -> 占卜翻牌5次（%s/5） | C918: =R[-26]C -> 25 | D918: =R[-26]C -> 5 | E918: =R[-26]C -> 0 | F918: =R[-26]C -> 10096 | G918: =R[-26]C -> 1 | H918: =VLOOKUP(RC[-5],Sheet4!C[-7]:C[-2],5,FALSE) -> 113
A919: =R[-26]C+80 -> 11172 | B919: =VLOOKUP(RC[1],Sheet4!C[-1]:C[2],2,FALSE)&VLOOKUP(RC[1],Sheet4!C[-1]:C[2],3,FALSE)&RC[2]&VLOOKUP(RC[1],Sheet4!C[-1]:C[2],4,FALSE)&"（%s/"&RC[2]&"）" -> 英雄商店购买1次（%s/1） | C919: =R[-26]C -> 5 | D919: =R[-26]C -> 1 | E919: =R[-26]C -> 0 | F919: =R[-26]C -> 19006 | G919: =R[-26]C -> 60 | H919: =VLOOKUP(RC[-5],Sheet4!C[-7]:C[-2],5,FALSE) -> 11
A920: =R[-26]C+80 -> 11173 | B920: =VLOOKUP(RC[1],Sheet4!C[-1]:C[2],2,FALSE)&VLOOKUP(RC[1],Sheet4!C[-1]:C[2],3,FALSE)&RC[2]&VLOOKUP(RC[1],Sheet4!C[-1]:C[2],4,FALSE)&"（%s/"&RC[2]&"）" -> 日常副本战斗4次（%s/4） | C920: =R[-26]C -> 13 | D920: =R[-26]C -> 4 | E920: =R[-26]C -> 0 | F920: =R[-26]C -> 19005 | G920: =R[-26]C -> 50 | H920: =VLOOKUP(RC[-5],Sheet4!C[-7]:C[-2],5,FALSE) -> 2
A921: =R[-26]C+80 -> 11181 | B921: =VLOOKUP(RC[1],Sheet4!C[-1]:C[2],2,FALSE)&VLOOKUP(RC[1],Sheet4!C[-1]:C[2],3,FALSE)&RC[2]&VLOOKUP(RC[1],Sheet4!C[-1]:C[2],4,FALSE)&"（%s/"&RC[2]&"）" -> 遗迹探索4小时（%s/4） | C921: =R[-26]C -> 19 | D921: =R[-26]C -> 4 | E921: =R[-26]C -> 0 | F921: =R[-26]C -> 19003 | G921: =R[-26]C -> 50000 | H921: =VLOOKUP(RC[-5],Sheet4!C[-7]:C[-2],5,FALSE) -> 20
A922: =R[-26]C+80 -> 11182 | B922: =VLOOKUP(RC[1],Sheet4!C[-1]:C[2],2,FALSE)&VLOOKUP(RC[1],Sheet4!C[-1]:C[2],3,FALSE)&RC[2]&VLOOKUP(RC[1],Sheet4!C[-1]:C[2],4,FALSE)&"（%s/"&RC[2]&"）" -> 击杀遗迹破坏者3次（%s/3） | C922: =R[-26]C -> 16 | D922: =R[-26]C -> 3 | E922: =R[-26]C -> 0 | F922: =R[-26]C -> 19005 | G922: =R[-26]C -> 50 | H922: =VLOOKUP(RC[-5],Sheet4!C[-7]:C[-2],5,FALSE) -> 20
A923: =R[-26]C+80 -> 11183 | B923: =VLOOKUP(RC[1],Sheet4!C[-1]:C[2],2,FALSE)&VLOOKUP(RC[1],Sheet4!C[-1]:C[2],3,FALSE)&RC[2]&VLOOKUP(RC[1],Sheet4!C[-1]:C[2],4,FALSE)&"（%s/"&RC[2]&"）" -> 英雄副本战斗1次（%s/1） | C923: =R[-26]C -> 14 | D923: =R[-26]C -> 1 | E923: =R[-26]C -> 0 | F923: =R[-26]C -> 19006 | G923: =R[-26]C -> 60 | H923: =VLOOKUP(RC[-5],Sheet4!C[-7]:C[-2],5,FALSE) -> 27
A924: =R[-26]C+80 -> 11191 | B924: =VLOOKUP(RC[1],Sheet4!C[-1]:C[2],2,FALSE)&VLOOKUP(RC[1],Sheet4!C[-1]:C[2],3,FALSE)&RC[2]&VLOOKUP(RC[1],Sheet4!C[-1]:C[2],4,FALSE)&"（%s/"&RC[2]&"）" -> 遗迹探索4小时（%s/4） | C924: =R[-26]C -> 19 | D924: =R[-26]C -> 4 | E924: =R[-26]C -> 0 | F924: =R[-26]C -> 19003 | G924: =R[-26]C -> 50000 | H924: =VLOOKUP(RC[-5],Sheet4!C[-7]:C[-2],5,FALSE) -> 20
A925: =R[-26]C+80 -> 11192 | B925: =VLOOKUP(RC[1],Sheet4!C[-1]:C[2],2,FALSE)&VLOOKUP(RC[1],Sheet4!C[-1]:C[2],3,FALSE)&RC[2]&VLOOKUP(RC[1],Sheet4!C[-1]:C[2],4,FALSE)&"（%s/"&RC[2]&"）" -> 击杀遗迹破坏者3次（%s/3） | C925: =R[-26]C -> 16 | D925: =R[-26]C -> 3 | E925: =R[-26]C -> 0 | F925: =R[-26]C -> 19005 | G925: =R[-26]C -> 50 | H925: =VLOOKUP(RC[-5],Sheet4!C[-7]:C[-2],5,FALSE) -> 20
A926: =R[-26]C+80 -> 11193 | B926: =VLOOKUP(RC[1],Sheet4!C[-1]:C[2],2,FALSE)&VLOOKUP(RC[1],Sheet4!C[-1]:C[2],3,FALSE)&RC[2]&VLOOKUP(RC[1],Sheet4!C[-1]:C[2],4,FALSE)&"（%s/"&RC[2]&"）" -> 英雄副本战斗1次（%s/1） | C926: =R[-26]C -> 14 | D926: =R[-26]C -> 1 | E926: =R[-26]C -> 0 | F926: =R[-26]C -> 19006 | G926: =R[-26]C -> 60 | H926: =VLOOKUP(RC[-5],Sheet4!C[-7]:C[-2],5,FALSE) -> 27
A927: =R[-26]C+80 -> 11201 | B927: =VLOOKUP(RC[1],Sheet4!C[-1]:C[2],2,FALSE)&VLOOKUP(RC[1],Sheet4!C[-1]:C[2],3,FALSE)&RC[2]&VLOOKUP(RC[1],Sheet4!C[-1]:C[2],4,FALSE)&"（%s/"&RC[2]&"）" -> 圣器强化5次（%s/5） | C927: =R[-26]C -> 2 | D927: =R[-26]C -> 5 | E927: =R[-26]C -> 0 | F927: =R[-26]C -> 13049 | G927: =R[-26]C -> 5 | H927: =VLOOKUP(RC[-5],Sheet4!C[-7]:C[-2],5,FALSE) -> 8
A928: =R[-26]C+80 -> 11202 | B928: =VLOOKUP(RC[1],Sheet4!C[-1]:C[2],2,FALSE)&VLOOKUP(RC[1],Sheet4!C[-1]:C[2],3,FALSE)&RC[2]&VLOOKUP(RC[1],Sheet4!C[-1]:C[2],4,FALSE)&"（%s/"&RC[2]&"）" -> 圣器争夺5次（%s/5） | C928: =R[-26]C -> 11 | D928: =R[-26]C -> 5 | E928: =R[-26]C -> 0 | F928: =R[-26]C -> 13049 | G928: =R[-26]C -> 5 | H928: =VLOOKUP(RC[-5],Sheet4!C[-7]:C[-2],5,FALSE) -> 19
A929: =R[-26]C+80 -> 11203 | B929: =VLOOKUP(RC[1],Sheet4!C[-1]:C[2],2,FALSE)&VLOOKUP(RC[1],Sheet4!C[-1]:C[2],3,FALSE)&RC[2]&VLOOKUP(RC[1],Sheet4!C[-1]:C[2],4,FALSE)&"（%s/"&RC[2]&"）" -> 圣器合成3次（%s/3） | C929: =R[-26]C -> 22 | D929: =R[-26]C -> 3 | E929: =R[-26]C -> 0 | F929: =R[-26]C -> 13049 | G929: =R[-26]C -> 5 | H929: =VLOOKUP(RC[-5],Sheet4!C[-7]:C[-2],5,FALSE) -> 19
A930: =R[-26]C+80 -> 11211 | B930: =VLOOKUP(RC[1],Sheet4!C[-1]:C[2],2,FALSE)&VLOOKUP(RC[1],Sheet4!C[-1]:C[2],3,FALSE)&RC[2]&VLOOKUP(RC[1],Sheet4!C[-1]:C[2],4,FALSE)&"（%s/"&RC[2]&"）" -> 赠送好友精力3次（%s/3） | C930: =R[-26]C -> 4 | D930: =R[-26]C -> 3 | E930: =R[-26]C -> 0 | F930: =R[-26]C -> 19005 | G930: =R[-26]C -> 40 | H930: =VLOOKUP(RC[-5],Sheet4!C[-7]:C[-2],5,FALSE) -> 15
A931: =R[-26]C+80 -> 11212 | B931: =VLOOKUP(RC[1],Sheet4!C[-1]:C[2],2,FALSE)&VLOOKUP(RC[1],Sheet4!C[-1]:C[2],3,FALSE)&RC[2]&VLOOKUP(RC[1],Sheet4!C[-1]:C[2],4,FALSE)&"（%s/"&RC[2]&"）" -> 进行召唤5次（%s/5） | C931: =R[-26]C -> 8 | D931: =R[-26]C -> 5 | E931: =R[-26]C -> 0 | F931: =R[-26]C -> 19006 | G931: =R[-26]C -> 60 | H931: =VLOOKUP(RC[-5],Sheet4!C[-7]:C[-2],5,FALSE) -> 9
A932: =R[-26]C+80 -> 11213 | B932: =VLOOKUP(RC[1],Sheet4!C[-1]:C[2],2,FALSE)&VLOOKUP(RC[1],Sheet4!C[-1]:C[2],3,FALSE)&RC[2]&VLOOKUP(RC[1],Sheet4!C[-1]:C[2],4,FALSE)&"（%s/"&RC[2]&"）" -> 进行高级召唤2次（%s/2） | C932: =R[-26]C -> 9 | D932: =R[-26]C -> 2 | E932: =R[-26]C -> 0 | F932: =R[-26]C -> 19006 | G932: =R[-26]C -> 80 | H932: =VLOOKUP(RC[-5],Sheet4!C[-7]:C[-2],5,FALSE) -> 9
A933: =R[-26]C+80 -> 11221 | B933: =VLOOKUP(RC[1],Sheet4!C[-1]:C[2],2,FALSE)&VLOOKUP(RC[1],Sheet4!C[-1]:C[2],3,FALSE)&RC[2]&VLOOKUP(RC[1],Sheet4!C[-1]:C[2],4,FALSE)&"（%s/"&RC[2]&"）" -> 异度入侵分享2次（%s/2） | C933: =R[-26]C -> 17 | D933: =R[-26]C -> 2 | E933: =R[-26]C -> 0 | F933: =R[-26]C -> 19014 | G933: =R[-26]C -> 500 | H933: =VLOOKUP(RC[-5],Sheet4!C[-7]:C[-2],5,FALSE) -> 16
A934: =R[-26]C+80 -> 11222 | B934: =VLOOKUP(RC[1],Sheet4!C[-1]:C[2],2,FALSE)&VLOOKUP(RC[1],Sheet4!C[-1]:C[2],3,FALSE)&RC[2]&VLOOKUP(RC[1],Sheet4!C[-1]:C[2],4,FALSE)&"（%s/"&RC[2]&"）" -> 讨伐异度入侵者2次（%s/2） | C934: =R[-26]C -> 18 | D934: =R[-26]C -> 2 | E934: =R[-26]C -> 0 | F934: =R[-26]C -> 19014 | G934: =R[-26]C -> 500 | H934: =VLOOKUP(RC[-5],Sheet4!C[-7]:C[-2],5,FALSE) -> 16
A935: =R[-26]C+80 -> 11223 | B935: =VLOOKUP(RC[1],Sheet4!C[-1]:C[2],2,FALSE)&VLOOKUP(RC[1],Sheet4!C[-1]:C[2],3,FALSE)&RC[2]&VLOOKUP(RC[1],Sheet4!C[-1]:C[2],4,FALSE)&"（%s/"&RC[2]&"）" -> 精英副本战斗3次（%s/3） | C935: =R[-26]C -> 15 | D935: =R[-26]C -> 3 | E935: =R[-26]C -> 0 | F935: =R[-26]C -> 10008 | G935: =R[-26]C -> 30 | H935: =VLOOKUP(RC[-5],Sheet4!C[-7]:C[-2],5,FALSE) -> 28
A936: =R[-26]C+80 -> 11224 | B936: =VLOOKUP(RC[1],Sheet4!C[-1]:C[2],2,FALSE)&VLOOKUP(RC[1],Sheet4!C[-1]:C[2],3,FALSE)&RC[2]&VLOOKUP(RC[1],Sheet4!C[-1]:C[2],4,FALSE)&"（%s/"&RC[2]&"）" -> 击杀精英外敌1个（%s/1） | C936: =R[-26]C -> 20 | D936: =R[-26]C -> 1 | E936: =R[-26]C -> 0 | F936: =R[-26]C -> 10008 | G936: =R[-26]C -> 40 | H936: =VLOOKUP(RC[-5],Sheet4!C[-7]:C[-2],5,FALSE) -> 28
A937: =R[-26]C+80 -> 11231 | B937: =VLOOKUP(RC[1],Sheet4!C[-1]:C[2],2,FALSE)&VLOOKUP(RC[1],Sheet4!C[-1]:C[2],3,FALSE)&RC[2]&VLOOKUP(RC[1],Sheet4!C[-1]:C[2],4,FALSE)&"（%s/"&RC[2]&"）" -> 购买体力2次（%s/2） | C937: =R[-26]C -> 6 | D937: =R[-26]C -> 2 | E937: =R[-26]C -> 0 | F937: =R[-26]C -> 19005 | G937: =R[-26]C -> 50 | H937: =VLOOKUP(RC[-5],Sheet4!C[-7]:C[-2],5,FALSE) -> 12
A938: =R[-26]C+80 -> 11232 | B938: =VLOOKUP(RC[1],Sheet4!C[-1]:C[2],2,FALSE)&VLOOKUP(RC[1],Sheet4!C[-1]:C[2],3,FALSE)&RC[2]&VLOOKUP(RC[1],Sheet4!C[-1]:C[2],4,FALSE)&"（%s/"&RC[2]&"）" -> 购买精力2次（%s/2） | C938: =R[-26]C -> 7 | D938: =R[-26]C -> 2 | E938: =R[-26]C -> 0 | F938: =R[-26]C -> 19005 | G938: =R[-26]C -> 50 | H938: =VLOOKUP(RC[-5],Sheet4!C[-7]:C[-2],5,FALSE) -> 12
A939: =R[-26]C+80 -> 11233 | B939: =VLOOKUP(RC[1],Sheet4!C[-1]:C[2],2,FALSE)&VLOOKUP(RC[1],Sheet4!C[-1]:C[2],3,FALSE)&RC[2]&VLOOKUP(RC[1],Sheet4!C[-1]:C[2],4,FALSE)&"（%s/"&RC[2]&"）" -> 英雄培养20次（%s/20） | C939: =R[-26]C -> 3 | D939: =R[-26]C -> 20 | E939: =R[-26]C -> 0 | F939: =R[-26]C -> 10003 | G939: =R[-26]C -> 30 | H939: =VLOOKUP(RC[-5],Sheet4!C[-7]:C[-2],5,FALSE) -> 8
A940: =R[-26]C+80 -> 11241 | B940: =VLOOKUP(RC[1],Sheet4!C[-1]:C[2],2,FALSE)&VLOOKUP(RC[1],Sheet4!C[-1]:C[2],3,FALSE)&RC[2]&VLOOKUP(RC[1],Sheet4!C[-1]:C[2],4,FALSE)&"（%s/"&RC[2]&"）" -> 无尽深渊战斗1次（%s/1） | C940: =R[-26]C -> 23 | D940: =R[-26]C -> 1 | E940: =R[-26]C -> 0 | F940: =R[-26]C -> 19028 | G940: =R[-26]C -> 50 | H940: =VLOOKUP(RC[-5],Sheet4!C[-7]:C[-2],5,FALSE) -> 88
A941: =R[-26]C+80 -> 11242 | B941: =VLOOKUP(RC[1],Sheet4!C[-1]:C[2],2,FALSE)&VLOOKUP(RC[1],Sheet4!C[-1]:C[2],3,FALSE)&RC[2]&VLOOKUP(RC[1],Sheet4!C[-1]:C[2],4,FALSE)&"（%s/"&RC[2]&"）" -> 进入勇者试练战斗10次（%s/10） | C941: =R[-26]C -> 12 | D941: =R[-26]C -> 10 | E941: =R[-26]C -> 0 | F941: =R[-26]C -> 19012 | G941: =R[-26]C -> 500 | H941: =VLOOKUP(RC[-5],Sheet4!C[-7]:C[-2],5,FALSE) -> 17
A942: =R[-26]C+80 -> 11243 | B942: =VLOOKUP(RC[1],Sheet4!C[-1]:C[2],2,FALSE)&VLOOKUP(RC[1],Sheet4!C[-1]:C[2],3,FALSE)&RC[2]&VLOOKUP(RC[1],Sheet4!C[-1]:C[2],4,FALSE)&"（%s/"&RC[2]&"）" -> 竞技场战斗5次（%s/5） | C942: =R[-26]C -> 10 | D942: =R[-26]C -> 5 | E942: =R[-26]C -> 0 | F942: =R[-26]C -> 19013 | G942: =R[-26]C -> 500 | H942: =VLOOKUP(RC[-5],Sheet4!C[-7]:C[-2],5,FALSE) -> 21
A943: =R[-26]C+80 -> 11244 | B943: =VLOOKUP(RC[1],Sheet4!C[-1]:C[2],2,FALSE)&VLOOKUP(RC[1],Sheet4!C[-1]:C[2],3,FALSE)&RC[2]&VLOOKUP(RC[1],Sheet4!C[-1]:C[2],4,FALSE)&"（%s/"&RC[2]&"）" -> 主线副本挑战5次（%s/5） | C943: =R[-26]C -> 1 | D943: =R[-26]C -> 5 | E943: =R[-26]C -> 0 | F943: =R[-26]C -> 19003 | G943: =R[-26]C -> 50000 | H943: =VLOOKUP(RC[-5],Sheet4!C[-7]:C[-2],5,FALSE) -> 26
A944: =R[-26]C+80 -> 11251 | B944: =VLOOKUP(RC[1],Sheet4!C[-1]:C[2],2,FALSE)&VLOOKUP(RC[1],Sheet4!C[-1]:C[2],3,FALSE)&RC[2]&VLOOKUP(RC[1],Sheet4!C[-1]:C[2],4,FALSE)&"（%s/"&RC[2]&"）" -> 占卜翻牌5次（%s/5） | C944: =R[-26]C -> 25 | D944: =R[-26]C -> 5 | E944: =R[-26]C -> 0 | F944: =R[-26]C -> 10096 | G944: =R[-26]C -> 1 | H944: =VLOOKUP(RC[-5],Sheet4!C[-7]:C[-2],5,FALSE) -> 113
A945: =R[-26]C+80 -> 11252 | B945: =VLOOKUP(RC[1],Sheet4!C[-1]:C[2],2,FALSE)&VLOOKUP(RC[1],Sheet4!C[-1]:C[2],3,FALSE)&RC[2]&VLOOKUP(RC[1],Sheet4!C[-1]:C[2],4,FALSE)&"（%s/"&RC[2]&"）" -> 英雄商店购买1次（%s/1） | C945: =R[-26]C -> 5 | D945: =R[-26]C -> 1 | E945: =R[-26]C -> 0 | F945: =R[-26]C -> 19006 | G945: =R[-26]C -> 60 | H945: =VLOOKUP(RC[-5],Sheet4!C[-7]:C[-2],5,FALSE) -> 11
A946: =R[-26]C+80 -> 11253 | B946: =VLOOKUP(RC[1],Sheet4!C[-1]:C[2],2,FALSE)&VLOOKUP(RC[1],Sheet4!C[-1]:C[2],3,FALSE)&RC[2]&VLOOKUP(RC[1],Sheet4!C[-1]:C[2],4,FALSE)&"（%s/"&RC[2]&"）" -> 日常副本战斗4次（%s/4） | C946: =R[-26]C -> 13 | D946: =R[-26]C -> 4 | E946: =R[-26]C -> 0 | F946: =R[-26]C -> 19005 | G946: =R[-26]C -> 50 | H946: =VLOOKUP(RC[-5],Sheet4!C[-7]:C[-2],5,FALSE) -> 2
A947: =R[-26]C+80 -> 11261 | B947: =VLOOKUP(RC[1],Sheet4!C[-1]:C[2],2,FALSE)&VLOOKUP(RC[1],Sheet4!C[-1]:C[2],3,FALSE)&RC[2]&VLOOKUP(RC[1],Sheet4!C[-1]:C[2],4,FALSE)&"（%s/"&RC[2]&"）" -> 遗迹探索4小时（%s/4） | C947: =R[-26]C -> 19 | D947: =R[-26]C -> 4 | E947: =R[-26]C -> 0 | F947: =R[-26]C -> 19003 | G947: =R[-26]C -> 50000 | H947: =VLOOKUP(RC[-5],Sheet4!C[-7]:C[-2],5,FALSE) -> 20
A948: =R[-26]C+80 -> 11262 | B948: =VLOOKUP(RC[1],Sheet4!C[-1]:C[2],2,FALSE)&VLOOKUP(RC[1],Sheet4!C[-1]:C[2],3,FALSE)&RC[2]&VLOOKUP(RC[1],Sheet4!C[-1]:C[2],4,FALSE)&"（%s/"&RC[2]&"）" -> 击杀遗迹破坏者3次（%s/3） | C948: =R[-26]C -> 16 | D948: =R[-26]C -> 3 | E948: =R[-26]C -> 0 | F948: =R[-26]C -> 19005 | G948: =R[-26]C -> 50 | H948: =VLOOKUP(RC[-5],Sheet4!C[-7]:C[-2],5,FALSE) -> 20
A949: =R[-26]C+80 -> 11263 | B949: =VLOOKUP(RC[1],Sheet4!C[-1]:C[2],2,FALSE)&VLOOKUP(RC[1],Sheet4!C[-1]:C[2],3,FALSE)&RC[2]&VLOOKUP(RC[1],Sheet4!C[-1]:C[2],4,FALSE)&"（%s/"&RC[2]&"）" -> 英雄副本战斗1次（%s/1） | C949: =R[-26]C -> 14 | D949: =R[-26]C -> 1 | E949: =R[-26]C -> 0 | F949: =R[-26]C -> 19006 | G949: =R[-26]C -> 60 | H949: =VLOOKUP(RC[-5],Sheet4!C[-7]:C[-2],5,FALSE) -> 27
A950: =R[-26]C+80 -> 11271 | B950: =VLOOKUP(RC[1],Sheet4!C[-1]:C[2],2,FALSE)&VLOOKUP(RC[1],Sheet4!C[-1]:C[2],3,FALSE)&RC[2]&VLOOKUP(RC[1],Sheet4!C[-1]:C[2],4,FALSE)&"（%s/"&RC[2]&"）" -> 遗迹探索4小时（%s/4） | C950: =R[-26]C -> 19 | D950: =R[-26]C -> 4 | E950: =R[-26]C -> 0 | F950: =R[-26]C -> 19003 | G950: =R[-26]C -> 50000 | H950: =VLOOKUP(RC[-5],Sheet4!C[-7]:C[-2],5,FALSE) -> 20
A951: =R[-26]C+80 -> 11272 | B951: =VLOOKUP(RC[1],Sheet4!C[-1]:C[2],2,FALSE)&VLOOKUP(RC[1],Sheet4!C[-1]:C[2],3,FALSE)&RC[2]&VLOOKUP(RC[1],Sheet4!C[-1]:C[2],4,FALSE)&"（%s/"&RC[2]&"）" -> 击杀遗迹破坏者3次（%s/3） | C951: =R[-26]C -> 16 | D951: =R[-26]C -> 3 | E951: =R[-26]C -> 0 | F951: =R[-26]C -> 19005 | G951: =R[-26]C -> 50 | H951: =VLOOKUP(RC[-5],Sheet4!C[-7]:C[-2],5,FALSE) -> 20
A952: =R[-26]C+80 -> 11273 | B952: =VLOOKUP(RC[1],Sheet4!C[-1]:C[2],2,FALSE)&VLOOKUP(RC[1],Sheet4!C[-1]:C[2],3,FALSE)&RC[2]&VLOOKUP(RC[1],Sheet4!C[-1]:C[2],4,FALSE)&"（%s/"&RC[2]&"）" -> 英雄副本战斗1次（%s/1） | C952: =R[-26]C -> 14 | D952: =R[-26]C -> 1 | E952: =R[-26]C -> 0 | F952: =R[-26]C -> 19006 | G952: =R[-26]C -> 60 | H952: =VLOOKUP(RC[-5],Sheet4!C[-7]:C[-2],5,FALSE) -> 27
A953: =R[-26]C+80 -> 11281 | B953: =VLOOKUP(RC[1],Sheet4!C[-1]:C[2],2,FALSE)&VLOOKUP(RC[1],Sheet4!C[-1]:C[2],3,FALSE)&RC[2]&VLOOKUP(RC[1],Sheet4!C[-1]:C[2],4,FALSE)&"（%s/"&RC[2]&"）" -> 圣器强化5次（%s/5） | C953: =R[-26]C -> 2 | D953: =R[-26]C -> 5 | E953: =R[-26]C -> 0 | F953: =R[-26]C -> 13049 | G953: =R[-26]C -> 5 | H953: =VLOOKUP(RC[-5],Sheet4!C[-7]:C[-2],5,FALSE) -> 8
A954: =R[-26]C+80 -> 11282 | B954: =VLOOKUP(RC[1],Sheet4!C[-1]:C[2],2,FALSE)&VLOOKUP(RC[1],Sheet4!C[-1]:C[2],3,FALSE)&RC[2]&VLOOKUP(RC[1],Sheet4!C[-1]:C[2],4,FALSE)&"（%s/"&RC[2]&"）" -> 圣器争夺5次（%s/5） | C954: =R[-26]C -> 11 | D954: =R[-26]C -> 5 | E954: =R[-26]C -> 0 | F954: =R[-26]C -> 13049 | G954: =R[-26]C -> 5 | H954: =VLOOKUP(RC[-5],Sheet4!C[-7]:C[-2],5,FALSE) -> 19
A955: =R[-26]C+80 -> 11283 | B955: =VLOOKUP(RC[1],Sheet4!C[-1]:C[2],2,FALSE)&VLOOKUP(RC[1],Sheet4!C[-1]:C[2],3,FALSE)&RC[2]&VLOOKUP(RC[1],Sheet4!C[-1]:C[2],4,FALSE)&"（%s/"&RC[2]&"）" -> 圣器合成3次（%s/3） | C955: =R[-26]C -> 22 | D955: =R[-26]C -> 3 | E955: =R[-26]C -> 0 | F955: =R[-26]C -> 13049 | G955: =R[-26]C -> 5 | H955: =VLOOKUP(RC[-5],Sheet4!C[-7]:C[-2],5,FALSE) -> 19
A956: =R[-26]C+80 -> 11291 | B956: =VLOOKUP(RC[1],Sheet4!C[-1]:C[2],2,FALSE)&VLOOKUP(RC[1],Sheet4!C[-1]:C[2],3,FALSE)&RC[2]&VLOOKUP(RC[1],Sheet4!C[-1]:C[2],4,FALSE)&"（%s/"&RC[2]&"）" -> 赠送好友精力3次（%s/3） | C956: =R[-26]C -> 4 | D956: =R[-26]C -> 3 | E956: =R[-26]C -> 0 | F956: =R[-26]C -> 19005 | G956: =R[-26]C -> 40 | H956: =VLOOKUP(RC[-5],Sheet4!C[-7]:C[-2],5,FALSE) -> 15
A957: =R[-26]C+80 -> 11292 | B957: =VLOOKUP(RC[1],Sheet4!C[-1]:C[2],2,FALSE)&VLOOKUP(RC[1],Sheet4!C[-1]:C[2],3,FALSE)&RC[2]&VLOOKUP(RC[1],Sheet4!C[-1]:C[2],4,FALSE)&"（%s/"&RC[2]&"）" -> 进行召唤5次（%s/5） | C957: =R[-26]C -> 8 | D957: =R[-26]C -> 5 | E957: =R[-26]C -> 0 | F957: =R[-26]C -> 19006 | G957: =R[-26]C -> 60 | H957: =VLOOKUP(RC[-5],Sheet4!C[-7]:C[-2],5,FALSE) -> 9
A958: =R[-26]C+80 -> 11293 | B958: =VLOOKUP(RC[1],Sheet4!C[-1]:C[2],2,FALSE)&VLOOKUP(RC[1],Sheet4!C[-1]:C[2],3,FALSE)&RC[2]&VLOOKUP(RC[1],Sheet4!C[-1]:C[2],4,FALSE)&"（%s/"&RC[2]&"）" -> 进行高级召唤2次（%s/2） | C958: =R[-26]C -> 9 | D958: =R[-26]C -> 2 | E958: =R[-26]C -> 0 | F958: =R[-26]C -> 19006 | G958: =R[-26]C -> 80 | H958: =VLOOKUP(RC[-5],Sheet4!C[-7]:C[-2],5,FALSE) -> 9
A959: =R[-26]C+80 -> 11301 | B959: =VLOOKUP(RC[1],Sheet4!C[-1]:C[2],2,FALSE)&VLOOKUP(RC[1],Sheet4!C[-1]:C[2],3,FALSE)&RC[2]&VLOOKUP(RC[1],Sheet4!C[-1]:C[2],4,FALSE)&"（%s/"&RC[2]&"）" -> 异度入侵分享2次（%s/2） | C959: =R[-26]C -> 17 | D959: =R[-26]C -> 2 | E959: =R[-26]C -> 0 | F959: =R[-26]C -> 19014 | G959: =R[-26]C -> 500 | H959: =VLOOKUP(RC[-5],Sheet4!C[-7]:C[-2],5,FALSE) -> 16
A960: =R[-26]C+80 -> 11302 | B960: =VLOOKUP(RC[1],Sheet4!C[-1]:C[2],2,FALSE)&VLOOKUP(RC[1],Sheet4!C[-1]:C[2],3,FALSE)&RC[2]&VLOOKUP(RC[1],Sheet4!C[-1]:C[2],4,FALSE)&"（%s/"&RC[2]&"）" -> 讨伐异度入侵者2次（%s/2） | C960: =R[-26]C -> 18 | D960: =R[-26]C -> 2 | E960: =R[-26]C -> 0 | F960: =R[-26]C -> 19014 | G960: =R[-26]C -> 500 | H960: =VLOOKUP(RC[-5],Sheet4!C[-7]:C[-2],5,FALSE) -> 16
A961: =R[-26]C+80 -> 11303 | B961: =VLOOKUP(RC[1],Sheet4!C[-1]:C[2],2,FALSE)&VLOOKUP(RC[1],Sheet4!C[-1]:C[2],3,FALSE)&RC[2]&VLOOKUP(RC[1],Sheet4!C[-1]:C[2],4,FALSE)&"（%s/"&RC[2]&"）" -> 精英副本战斗3次（%s/3） | C961: =R[-26]C -> 15 | D961: =R[-26]C -> 3 | E961: =R[-26]C -> 0 | F961: =R[-26]C -> 10008 | G961: =R[-26]C -> 30 | H961: =VLOOKUP(RC[-5],Sheet4!C[-7]:C[-2],5,FALSE) -> 28
A962: =R[-26]C+80 -> 11304 | B962: =VLOOKUP(RC[1],Sheet4!C[-1]:C[2],2,FALSE)&VLOOKUP(RC[1],Sheet4!C[-1]:C[2],3,FALSE)&RC[2]&VLOOKUP(RC[1],Sheet4!C[-1]:C[2],4,FALSE)&"（%s/"&RC[2]&"）" -> 击杀精英外敌1个（%s/1） | C962: =R[-26]C -> 20 | D962: =R[-26]C -> 1 | E962: =R[-26]C -> 0 | F962: =R[-26]C -> 10008 | G962: =R[-26]C -> 40 | H962: =VLOOKUP(RC[-5],Sheet4!C[-7]:C[-2],5,FALSE) -> 28
A963: =R[-26]C+80 -> 11311 | B963: =VLOOKUP(RC[1],Sheet4!C[-1]:C[2],2,FALSE)&VLOOKUP(RC[1],Sheet4!C[-1]:C[2],3,FALSE)&RC[2]&VLOOKUP(RC[1],Sheet4!C[-1]:C[2],4,FALSE)&"（%s/"&RC[2]&"）" -> 购买体力2次（%s/2） | C963: =R[-26]C -> 6 | D963: =R[-26]C -> 2 | E963: =R[-26]C -> 0 | F963: =R[-26]C -> 19005 | G963: =R[-26]C -> 50 | H963: =VLOOKUP(RC[-5],Sheet4!C[-7]:C[-2],5,FALSE) -> 12
A964: =R[-26]C+80 -> 11312 | B964: =VLOOKUP(RC[1],Sheet4!C[-1]:C[2],2,FALSE)&VLOOKUP(RC[1],Sheet4!C[-1]:C[2],3,FALSE)&RC[2]&VLOOKUP(RC[1],Sheet4!C[-1]:C[2],4,FALSE)&"（%s/"&RC[2]&"）" -> 购买精力2次（%s/2） | C964: =R[-26]C -> 7 | D964: =R[-26]C -> 2 | E964: =R[-26]C -> 0 | F964: =R[-26]C -> 19005 | G964: =R[-26]C -> 50 | H964: =VLOOKUP(RC[-5],Sheet4!C[-7]:C[-2],5,FALSE) -> 12
A965: =R[-26]C+80 -> 11313 | B965: =VLOOKUP(RC[1],Sheet4!C[-1]:C[2],2,FALSE)&VLOOKUP(RC[1],Sheet4!C[-1]:C[2],3,FALSE)&RC[2]&VLOOKUP(RC[1],Sheet4!C[-1]:C[2],4,FALSE)&"（%s/"&RC[2]&"）" -> 英雄培养20次（%s/20） | C965: =R[-26]C -> 3 | D965: =R[-26]C -> 20 | E965: =R[-26]C -> 0 | F965: =R[-26]C -> 10003 | G965: =R[-26]C -> 30 | H965: =VLOOKUP(RC[-5],Sheet4!C[-7]:C[-2],5,FALSE) -> 8
A966: =R[-26]C+80 -> 11321 | B966: =VLOOKUP(RC[1],Sheet4!C[-1]:C[2],2,FALSE)&VLOOKUP(RC[1],Sheet4!C[-1]:C[2],3,FALSE)&RC[2]&VLOOKUP(RC[1],Sheet4!C[-1]:C[2],4,FALSE)&"（%s/"&RC[2]&"）" -> 无尽深渊战斗1次（%s/1） | C966: =R[-26]C -> 23 | D966: =R[-26]C -> 1 | E966: =R[-26]C -> 0 | F966: =R[-26]C -> 19028 | G966: =R[-26]C -> 50 | H966: =VLOOKUP(RC[-5],Sheet4!C[-7]:C[-2],5,FALSE) -> 88
A967: =R[-26]C+80 -> 11322 | B967: =VLOOKUP(RC[1],Sheet4!C[-1]:C[2],2,FALSE)&VLOOKUP(RC[1],Sheet4!C[-1]:C[2],3,FALSE)&RC[2]&VLOOKUP(RC[1],Sheet4!C[-1]:C[2],4,FALSE)&"（%s/"&RC[2]&"）" -> 进入勇者试练战斗10次（%s/10） | C967: =R[-26]C -> 12 | D967: =R[-26]C -> 10 | E967: =R[-26]C -> 0 | F967: =R[-26]C -> 19012 | G967: =R[-26]C -> 500 | H967: =VLOOKUP(RC[-5],Sheet4!C[-7]:C[-2],5,FALSE) -> 17
A968: =R[-26]C+80 -> 11323 | B968: =VLOOKUP(RC[1],Sheet4!C[-1]:C[2],2,FALSE)&VLOOKUP(RC[1],Sheet4!C[-1]:C[2],3,FALSE)&RC[2]&VLOOKUP(RC[1],Sheet4!C[-1]:C[2],4,FALSE)&"（%s/"&RC[2]&"）" -> 竞技场战斗5次（%s/5） | C968: =R[-26]C -> 10 | D968: =R[-26]C -> 5 | E968: =R[-26]C -> 0 | F968: =R[-26]C -> 19013 | G968: =R[-26]C -> 500 | H968: =VLOOKUP(RC[-5],Sheet4!C[-7]:C[-2],5,FALSE) -> 21
A969: =R[-26]C+80 -> 11324 | B969: =VLOOKUP(RC[1],Sheet4!C[-1]:C[2],2,FALSE)&VLOOKUP(RC[1],Sheet4!C[-1]:C[2],3,FALSE)&RC[2]&VLOOKUP(RC[1],Sheet4!C[-1]:C[2],4,FALSE)&"（%s/"&RC[2]&"）" -> 主线副本挑战5次（%s/5） | C969: =R[-26]C -> 1 | D969: =R[-26]C -> 5 | E969: =R[-26]C -> 0 | F969: =R[-26]C -> 19003 | G969: =R[-26]C -> 50000 | H969: =VLOOKUP(RC[-5],Sheet4!C[-7]:C[-2],5,FALSE) -> 26
A970: =R[-26]C+80 -> 11331 | B970: =VLOOKUP(RC[1],Sheet4!C[-1]:C[2],2,FALSE)&VLOOKUP(RC[1],Sheet4!C[-1]:C[2],3,FALSE)&RC[2]&VLOOKUP(RC[1],Sheet4!C[-1]:C[2],4,FALSE)&"（%s/"&RC[2]&"）" -> 占卜翻牌5次（%s/5） | C970: =R[-26]C -> 25 | D970: =R[-26]C -> 5 | E970: =R[-26]C -> 0 | F970: =R[-26]C -> 10096 | G970: =R[-26]C -> 1 | H970: =VLOOKUP(RC[-5],Sheet4!C[-7]:C[-2],5,FALSE) -> 113
A971: =R[-26]C+80 -> 11332 | B971: =VLOOKUP(RC[1],Sheet4!C[-1]:C[2],2,FALSE)&VLOOKUP(RC[1],Sheet4!C[-1]:C[2],3,FALSE)&RC[2]&VLOOKUP(RC[1],Sheet4!C[-1]:C[2],4,FALSE)&"（%s/"&RC[2]&"）" -> 英雄商店购买1次（%s/1） | C971: =R[-26]C -> 5 | D971: =R[-26]C -> 1 | E971: =R[-26]C -> 0 | F971: =R[-26]C -> 19006 | G971: =R[-26]C -> 60 | H971: =VLOOKUP(RC[-5],Sheet4!C[-7]:C[-2],5,FALSE) -> 11
A972: =R[-26]C+80 -> 11333 | B972: =VLOOKUP(RC[1],Sheet4!C[-1]:C[2],2,FALSE)&VLOOKUP(RC[1],Sheet4!C[-1]:C[2],3,FALSE)&RC[2]&VLOOKUP(RC[1],Sheet4!C[-1]:C[2],4,FALSE)&"（%s/"&RC[2]&"）" -> 日常副本战斗4次（%s/4） | C972: =R[-26]C -> 13 | D972: =R[-26]C -> 4 | E972: =R[-26]C -> 0 | F972: =R[-26]C -> 19005 | G972: =R[-26]C -> 50 | H972: =VLOOKUP(RC[-5],Sheet4!C[-7]:C[-2],5,FALSE) -> 2
A973: =R[-26]C+80 -> 11341 | B973: =VLOOKUP(RC[1],Sheet4!C[-1]:C[2],2,FALSE)&VLOOKUP(RC[1],Sheet4!C[-1]:C[2],3,FALSE)&RC[2]&VLOOKUP(RC[1],Sheet4!C[-1]:C[2],4,FALSE)&"（%s/"&RC[2]&"）" -> 遗迹探索4小时（%s/4） | C973: =R[-26]C -> 19 | D973: =R[-26]C -> 4 | E973: =R[-26]C -> 0 | F973: =R[-26]C -> 19003 | G973: =R[-26]C -> 50000 | H973: =VLOOKUP(RC[-5],Sheet4!C[-7]:C[-2],5,FALSE) -> 20
A974: =R[-26]C+80 -> 11342 | B974: =VLOOKUP(RC[1],Sheet4!C[-1]:C[2],2,FALSE)&VLOOKUP(RC[1],Sheet4!C[-1]:C[2],3,FALSE)&RC[2]&VLOOKUP(RC[1],Sheet4!C[-1]:C[2],4,FALSE)&"（%s/"&RC[2]&"）" -> 击杀遗迹破坏者3次（%s/3） | C974: =R[-26]C -> 16 | D974: =R[-26]C -> 3 | E974: =R[-26]C -> 0 | F974: =R[-26]C -> 19005 | G974: =R[-26]C -> 50 | H974: =VLOOKUP(RC[-5],Sheet4!C[-7]:C[-2],5,FALSE) -> 20
A975: =R[-26]C+80 -> 11343 | B975: =VLOOKUP(RC[1],Sheet4!C[-1]:C[2],2,FALSE)&VLOOKUP(RC[1],Sheet4!C[-1]:C[2],3,FALSE)&RC[2]&VLOOKUP(RC[1],Sheet4!C[-1]:C[2],4,FALSE)&"（%s/"&RC[2]&"）" -> 英雄副本战斗1次（%s/1） | C975: =R[-26]C -> 14 | D975: =R[-26]C -> 1 | E975: =R[-26]C -> 0 | F975: =R[-26]C -> 19006 | G975: =R[-26]C -> 60 | H975: =VLOOKUP(RC[-5],Sheet4!C[-7]:C[-2],5,FALSE) -> 27
A976: =R[-26]C+80 -> 11351 | B976: =VLOOKUP(RC[1],Sheet4!C[-1]:C[2],2,FALSE)&VLOOKUP(RC[1],Sheet4!C[-1]:C[2],3,FALSE)&RC[2]&VLOOKUP(RC[1],Sheet4!C[-1]:C[2],4,FALSE)&"（%s/"&RC[2]&"）" -> 遗迹探索4小时（%s/4） | C976: =R[-26]C -> 19 | D976: =R[-26]C -> 4 | E976: =R[-26]C -> 0 | F976: =R[-26]C -> 19003 | G976: =R[-26]C -> 50000 | H976: =VLOOKUP(RC[-5],Sheet4!C[-7]:C[-2],5,FALSE) -> 20
A977: =R[-26]C+80 -> 11352 | B977: =VLOOKUP(RC[1],Sheet4!C[-1]:C[2],2,FALSE)&VLOOKUP(RC[1],Sheet4!C[-1]:C[2],3,FALSE)&RC[2]&VLOOKUP(RC[1],Sheet4!C[-1]:C[2],4,FALSE)&"（%s/"&RC[2]&"）" -> 击杀遗迹破坏者3次（%s/3） | C977: =R[-26]C -> 16 | D977: =R[-26]C -> 3 | E977: =R[-26]C -> 0 | F977: =R[-26]C -> 19005 | G977: =R[-26]C -> 50 | H977: =VLOOKUP(RC[-5],Sheet4!C[-7]:C[-2],5,FALSE) -> 20
A978: =R[-26]C+80 -> 11353 | B978: =VLOOKUP(RC[1],Sheet4!C[-1]:C[2],2,FALSE)&VLOOKUP(RC[1],Sheet4!C[-1]:C[2],3,FALSE)&RC[2]&VLOOKUP(RC[1],Sheet4!C[-1]:C[2],4,FALSE)&"（%s/"&RC[2]&"）" -> 英雄副本战斗1次（%s/1） | C978: =R[-26]C -> 14 | D978: =R[-26]C -> 1 | E978: =R[-26]C -> 0 | F978: =R[-26]C -> 19006 | G978: =R[-26]C -> 60 | H978: =VLOOKUP(RC[-5],Sheet4!C[-7]:C[-2],5,FALSE) -> 27
A979: =R[-26]C+80 -> 11361 | B979: =VLOOKUP(RC[1],Sheet4!C[-1]:C[2],2,FALSE)&VLOOKUP(RC[1],Sheet4!C[-1]:C[2],3,FALSE)&RC[2]&VLOOKUP(RC[1],Sheet4!C[-1]:C[2],4,FALSE)&"（%s/"&RC[2]&"）" -> 圣器强化5次（%s/5） | C979: =R[-26]C -> 2 | D979: =R[-26]C -> 5 | E979: =R[-26]C -> 0 | F979: =R[-26]C -> 13049 | G979: =R[-26]C -> 5 | H979: =VLOOKUP(RC[-5],Sheet4!C[-7]:C[-2],5,FALSE) -> 8
A980: =R[-26]C+80 -> 11362 | B980: =VLOOKUP(RC[1],Sheet4!C[-1]:C[2],2,FALSE)&VLOOKUP(RC[1],Sheet4!C[-1]:C[2],3,FALSE)&RC[2]&VLOOKUP(RC[1],Sheet4!C[-1]:C[2],4,FALSE)&"（%s/"&RC[2]&"）" -> 圣器争夺5次（%s/5） | C980: =R[-26]C -> 11 | D980: =R[-26]C -> 5 | E980: =R[-26]C -> 0 | F980: =R[-26]C -> 13049 | G980: =R[-26]C -> 5 | H980: =VLOOKUP(RC[-5],Sheet4!C[-7]:C[-2],5,FALSE) -> 19
A981: =R[-26]C+80 -> 11363 | B981: =VLOOKUP(RC[1],Sheet4!C[-1]:C[2],2,FALSE)&VLOOKUP(RC[1],Sheet4!C[-1]:C[2],3,FALSE)&RC[2]&VLOOKUP(RC[1],Sheet4!C[-1]:C[2],4,FALSE)&"（%s/"&RC[2]&"）" -> 圣器合成3次（%s/3） | C981: =R[-26]C -> 22 | D981: =R[-26]C -> 3 | E981: =R[-26]C -> 0 | F981: =R[-26]C -> 13049 | G981: =R[-26]C -> 5 | H981: =VLOOKUP(RC[-5],Sheet4!C[-7]:C[-2],5,FALSE) -> 19
A982: =R[-26]C+80 -> 11371 | B982: =VLOOKUP(RC[1],Sheet4!C[-1]:C[2],2,FALSE)&VLOOKUP(RC[1],Sheet4!C[-1]:C[2],3,FALSE)&RC[2]&VLOOKUP(RC[1],Sheet4!C[-1]:C[2],4,FALSE)&"（%s/"&RC[2]&"）" -> 赠送好友精力3次（%s/3） | C982: =R[-26]C -> 4 | D982: =R[-26]C -> 3 | E982: =R[-26]C -> 0 | F982: =R[-26]C -> 19005 | G982: =R[-26]C -> 40 | H982: =VLOOKUP(RC[-5],Sheet4!C[-7]:C[-2],5,FALSE) -> 15
A983: =R[-26]C+80 -> 11372 | B983: =VLOOKUP(RC[1],Sheet4!C[-1]:C[2],2,FALSE)&VLOOKUP(RC[1],Sheet4!C[-1]:C[2],3,FALSE)&RC[2]&VLOOKUP(RC[1],Sheet4!C[-1]:C[2],4,FALSE)&"（%s/"&RC[2]&"）" -> 进行召唤5次（%s/5） | C983: =R[-26]C -> 8 | D983: =R[-26]C -> 5 | E983: =R[-26]C -> 0 | F983: =R[-26]C -> 19006 | G983: =R[-26]C -> 60 | H983: =VLOOKUP(RC[-5],Sheet4!C[-7]:C[-2],5,FALSE) -> 9
A984: =R[-26]C+80 -> 11373 | B984: =VLOOKUP(RC[1],Sheet4!C[-1]:C[2],2,FALSE)&VLOOKUP(RC[1],Sheet4!C[-1]:C[2],3,FALSE)&RC[2]&VLOOKUP(RC[1],Sheet4!C[-1]:C[2],4,FALSE)&"（%s/"&RC[2]&"）" -> 进行高级召唤2次（%s/2） | C984: =R[-26]C -> 9 | D984: =R[-26]C -> 2 | E984: =R[-26]C -> 0 | F984: =R[-26]C -> 19006 | G984: =R[-26]C -> 80 | H984: =VLOOKUP(RC[-5],Sheet4!C[-7]:C[-2],5,FALSE) -> 9
A985: =R[-26]C+80 -> 11381 | B985: =VLOOKUP(RC[1],Sheet4!C[-1]:C[2],2,FALSE)&VLOOKUP(RC[1],Sheet4!C[-1]:C[2],3,FALSE)&RC[2]&VLOOKUP(RC[1],Sheet4!C[-1]:C[2],4,FALSE)&"（%s/"&RC[2]&"）" -> 异度入侵分享2次（%s/2） | C985: =R[-26]C -> 17 | D985: =R[-26]C -> 2 | E985: =R[-26]C -> 0 | F985: =R[-26]C -> 19014 | G985: =R[-26]C -> 500 | H985: =VLOOKUP(RC[-5],Sheet4!C[-7]:C[-2],5,FALSE) -> 16
A986: =R[-26]C+80 -> 11382 | B986: =VLOOKUP(RC[1],Sheet4!C[-1]:C[2],2,FALSE)&VLOOKUP(RC[1],Sheet4!C[-1]:C[2],3,FALSE)&RC[2]&VLOOKUP(RC[1],Sheet4!C[-1]:C[2],4,FALSE)&"（%s/"&RC[2]&"）" -> 讨伐异度入侵者2次（%s/2） | C986: =R[-26]C -> 18 | D986: =R[-26]C -> 2 | E986: =R[-26]C -> 0 | F986: =R[-26]C -> 19014 | G986: =R[-26]C -> 500 | H986: =VLOOKUP(RC[-5],Sheet4!C[-7]:C[-2],5,FALSE) -> 16
A987: =R[-26]C+80 -> 11383 | B987: =VLOOKUP(RC[1],Sheet4!C[-1]:C[2],2,FALSE)&VLOOKUP(RC[1],Sheet4!C[-1]:C[2],3,FALSE)&RC[2]&VLOOKUP(RC[1],Sheet4!C[-1]:C[2],4,FALSE)&"（%s/"&RC[2]&"）" -> 精英副本战斗3次（%s/3） | C987: =R[-26]C -> 15 | D987: =R[-26]C -> 3 | E987: =R[-26]C -> 0 | F987: =R[-26]C -> 10008 | G987: =R[-26]C -> 30 | H987: =VLOOKUP(RC[-5],Sheet4!C[-7]:C[-2],5,FALSE) -> 28
A988: =R[-26]C+80 -> 11384 | B988: =VLOOKUP(RC[1],Sheet4!C[-1]:C[2],2,FALSE)&VLOOKUP(RC[1],Sheet4!C[-1]:C[2],3,FALSE)&RC[2]&VLOOKUP(RC[1],Sheet4!C[-1]:C[2],4,FALSE)&"（%s/"&RC[2]&"）" -> 击杀精英外敌1个（%s/1） | C988: =R[-26]C -> 20 | D988: =R[-26]C -> 1 | E988: =R[-26]C -> 0 | F988: =R[-26]C -> 10008 | G988: =R[-26]C -> 40 | H988: =VLOOKUP(RC[-5],Sheet4!C[-7]:C[-2],5,FALSE) -> 28
A989: =R[-26]C+80 -> 11391 | B989: =VLOOKUP(RC[1],Sheet4!C[-1]:C[2],2,FALSE)&VLOOKUP(RC[1],Sheet4!C[-1]:C[2],3,FALSE)&RC[2]&VLOOKUP(RC[1],Sheet4!C[-1]:C[2],4,FALSE)&"（%s/"&RC[2]&"）" -> 购买体力2次（%s/2） | C989: =R[-26]C -> 6 | D989: =R[-26]C -> 2 | E989: =R[-26]C -> 0 | F989: =R[-26]C -> 19005 | G989: =R[-26]C -> 50 | H989: =VLOOKUP(RC[-5],Sheet4!C[-7]:C[-2],5,FALSE) -> 12
A990: =R[-26]C+80 -> 11392 | B990: =VLOOKUP(RC[1],Sheet4!C[-1]:C[2],2,FALSE)&VLOOKUP(RC[1],Sheet4!C[-1]:C[2],3,FALSE)&RC[2]&VLOOKUP(RC[1],Sheet4!C[-1]:C[2],4,FALSE)&"（%s/"&RC[2]&"）" -> 购买精力2次（%s/2） | C990: =R[-26]C -> 7 | D990: =R[-26]C -> 2 | E990: =R[-26]C -> 0 | F990: =R[-26]C -> 19005 | G990: =R[-26]C -> 50 | H990: =VLOOKUP(RC[-5],Sheet4!C[-7]:C[-2],5,FALSE) -> 12
A991: =R[-26]C+80 -> 11393 | B991: =VLOOKUP(RC[1],Sheet4!C[-1]:C[2],2,FALSE)&VLOOKUP(RC[1],Sheet4!C[-1]:C[2],3,FALSE)&RC[2]&VLOOKUP(RC[1],Sheet4!C[-1]:C[2],4,FALSE)&"（%s/"&RC[2]&"）" -> 英雄培养20次（%s/20） | C991: =R[-26]C -> 3 | D991: =R[-26]C -> 20 | E991: =R[-26]C -> 0 | F991: =R[-26]C -> 10003 | G991: =R[-26]C -> 30 | H991: =VLOOKUP(RC[-5],Sheet4!C[-7]:C[-2],5,FALSE) -> 8
A992: =R[-26]C+80 -> 11401 | B992: =VLOOKUP(RC[1],Sheet4!C[-1]:C[2],2,FALSE)&VLOOKUP(RC[1],Sheet4!C[-1]:C[2],3,FALSE)&RC[2]&VLOOKUP(RC[1],Sheet4!C[-1]:C[2],4,FALSE)&"（%s/"&RC[2]&"）" -> 无尽深渊战斗1次（%s/1） | C992: =R[-26]C -> 23 | D992: =R[-26]C -> 1 | E992: =R[-26]C -> 0 | F992: =R[-26]C -> 19028 | G992: =R[-26]C -> 50 | H992: =VLOOKUP(RC[-5],Sheet4!C[-7]:C[-2],5,FALSE) -> 88
A993: =R[-26]C+80 -> 11402 | B993: =VLOOKUP(RC[1],Sheet4!C[-1]:C[2],2,FALSE)&VLOOKUP(RC[1],Sheet4!C[-1]:C[2],3,FALSE)&RC[2]&VLOOKUP(RC[1],Sheet4!C[-1]:C[2],4,FALSE)&"（%s/"&RC[2]&"）" -> 进入勇者试练战斗10次（%s/10） | C993: =R[-26]C -> 12 | D993: =R[-26]C -> 10 | E993: =R[-26]C -> 0 | F993: =R[-26]C -> 19012 | G993: =R[-26]C -> 500 | H993: =VLOOKUP(RC[-5],Sheet4!C[-7]:C[-2],5,FALSE) -> 17
A994: =R[-26]C+80 -> 11403 | B994: =VLOOKUP(RC[1],Sheet4!C[-1]:C[2],2,FALSE)&VLOOKUP(RC[1],Sheet4!C[-1]:C[2],3,FALSE)&RC[2]&VLOOKUP(RC[1],Sheet4!C[-1]:C[2],4,FALSE)&"（%s/"&RC[2]&"）" -> 竞技场战斗5次（%s/5） | C994: =R[-26]C -> 10 | D994: =R[-26]C -> 5 | E994: =R[-26]C -> 0 | F994: =R[-26]C -> 19013 | G994: =R[-26]C -> 500 | H994: =VLOOKUP(RC[-5],Sheet4!C[-7]:C[-2],5,FALSE) -> 21
A995: =R[-26]C+80 -> 11404 | B995: =VLOOKUP(RC[1],Sheet4!C[-1]:C[2],2,FALSE)&VLOOKUP(RC[1],Sheet4!C[-1]:C[2],3,FALSE)&RC[2]&VLOOKUP(RC[1],Sheet4!C[-1]:C[2],4,FALSE)&"（%s/"&RC[2]&"）" -> 主线副本挑战5次（%s/5） | C995: =R[-26]C -> 1 | D995: =R[-26]C -> 5 | E995: =R[-26]C -> 0 | F995: =R[-26]C -> 19003 | G995: =R[-26]C -> 50000 | H995: =VLOOKUP(RC[-5],Sheet4!C[-7]:C[-2],5,FALSE) -> 26
A996: =R[-26]C+80 -> 11411 | B996: =VLOOKUP(RC[1],Sheet4!C[-1]:C[2],2,FALSE)&VLOOKUP(RC[1],Sheet4!C[-1]:C[2],3,FALSE)&RC[2]&VLOOKUP(RC[1],Sheet4!C[-1]:C[2],4,FALSE)&"（%s/"&RC[2]&"）" -> 占卜翻牌5次（%s/5） | C996: =R[-26]C -> 25 | D996: =R[-26]C -> 5 | E996: =R[-26]C -> 0 | F996: =R[-26]C -> 10096 | G996: =R[-26]C -> 1 | H996: =VLOOKUP(RC[-5],Sheet4!C[-7]:C[-2],5,FALSE) -> 113
A997: =R[-26]C+80 -> 11412 | B997: =VLOOKUP(RC[1],Sheet4!C[-1]:C[2],2,FALSE)&VLOOKUP(RC[1],Sheet4!C[-1]:C[2],3,FALSE)&RC[2]&VLOOKUP(RC[1],Sheet4!C[-1]:C[2],4,FALSE)&"（%s/"&RC[2]&"）" -> 英雄商店购买1次（%s/1） | C997: =R[-26]C -> 5 | D997: =R[-26]C -> 1 | E997: =R[-26]C -> 0 | F997: =R[-26]C -> 19006 | G997: =R[-26]C -> 60 | H997: =VLOOKUP(RC[-5],Sheet4!C[-7]:C[-2],5,FALSE) -> 11
A998: =R[-26]C+80 -> 11413 | B998: =VLOOKUP(RC[1],Sheet4!C[-1]:C[2],2,FALSE)&VLOOKUP(RC[1],Sheet4!C[-1]:C[2],3,FALSE)&RC[2]&VLOOKUP(RC[1],Sheet4!C[-1]:C[2],4,FALSE)&"（%s/"&RC[2]&"）" -> 日常副本战斗4次（%s/4） | C998: =R[-26]C -> 13 | D998: =R[-26]C -> 4 | E998: =R[-26]C -> 0 | F998: =R[-26]C -> 19005 | G998: =R[-26]C -> 50 | H998: =VLOOKUP(RC[-5],Sheet4!C[-7]:C[-2],5,FALSE) -> 2
A999: =R[-26]C+80 -> 11421 | B999: =VLOOKUP(RC[1],Sheet4!C[-1]:C[2],2,FALSE)&VLOOKUP(RC[1],Sheet4!C[-1]:C[2],3,FALSE)&RC[2]&VLOOKUP(RC[1],Sheet4!C[-1]:C[2],4,FALSE)&"（%s/"&RC[2]&"）" -> 遗迹探索4小时（%s/4） | C999: =R[-26]C -> 19 | D999: =R[-26]C -> 4 | E999: =R[-26]C -> 0 | F999: =R[-26]C -> 19003 | G999: =R[-26]C -> 50000 | H999: =VLOOKUP(RC[-5],Sheet4!C[-7]:C[-2],5,FALSE) -> 20
A1000: =R[-26]C+80 -> 11422 | B1000: =VLOOKUP(RC[1],Sheet4!C[-1]:C[2],2,FALSE)&VLOOKUP(RC[1],Sheet4!C[-1]:C[2],3,FALSE)&RC[2]&VLOOKUP(RC[1],Sheet4!C[-1]:C[2],4,FALSE)&"（%s/"&RC[2]&"）" -> 击杀遗迹破坏者3次（%s/3） | C1000: =R[-26]C -> 16 | D1000: =R[-26]C -> 3 | E1000: =R[-26]C -> 0 | F1000: =R[-26]C -> 19005 | G1000: =R[-26]C -> 50 | H1000: =VLOOKUP(RC[-5],Sheet4!C[-7]:C[-2],5,FALSE) -> 20
A1001: =R[-26]C+80 -> 11423 | B1001: =VLOOKUP(RC[1],Sheet4!C[-1]:C[2],2,FALSE)&VLOOKUP(RC[1],Sheet4!C[-1]:C[2],3,FALSE)&RC[2]&VLOOKUP(RC[1],Sheet4!C[-1]:C[2],4,FALSE)&"（%s/"&RC[2]&"）" -> 英雄副本战斗1次（%s/1） | C1001: =R[-26]C -> 14 | D1001: =R[-26]C -> 1 | E1001: =R[-26]C -> 0 | F1001: =R[-26]C -> 19006 | G1001: =R[-26]C -> 60 | H1001: =VLOOKUP(RC[-5],Sheet4!C[-7]:C[-2],5,FALSE) -> 27
A1002: =R[-26]C+80 -> 11431 | B1002: =VLOOKUP(RC[1],Sheet4!C[-1]:C[2],2,FALSE)&VLOOKUP(RC[1],Sheet4!C[-1]:C[2],3,FALSE)&RC[2]&VLOOKUP(RC[1],Sheet4!C[-1]:C[2],4,FALSE)&"（%s/"&RC[2]&"）" -> 遗迹探索4小时（%s/4） | C1002: =R[-26]C -> 19 | D1002: =R[-26]C -> 4 | E1002: =R[-26]C -> 0 | F1002: =R[-26]C -> 19003 | G1002: =R[-26]C -> 50000 | H1002: =VLOOKUP(RC[-5],Sheet4!C[-7]:C[-2],5,FALSE) -> 20
A1003: =R[-26]C+80 -> 11432 | B1003: =VLOOKUP(RC[1],Sheet4!C[-1]:C[2],2,FALSE)&VLOOKUP(RC[1],Sheet4!C[-1]:C[2],3,FALSE)&RC[2]&VLOOKUP(RC[1],Sheet4!C[-1]:C[2],4,FALSE)&"（%s/"&RC[2]&"）" -> 击杀遗迹破坏者3次（%s/3） | C1003: =R[-26]C -> 16 | D1003: =R[-26]C -> 3 | E1003: =R[-26]C -> 0 | F1003: =R[-26]C -> 19005 | G1003: =R[-26]C -> 50 | H1003: =VLOOKUP(RC[-5],Sheet4!C[-7]:C[-2],5,FALSE) -> 20
A1004: =R[-26]C+80 -> 11433 | B1004: =VLOOKUP(RC[1],Sheet4!C[-1]:C[2],2,FALSE)&VLOOKUP(RC[1],Sheet4!C[-1]:C[2],3,FALSE)&RC[2]&VLOOKUP(RC[1],Sheet4!C[-1]:C[2],4,FALSE)&"（%s/"&RC[2]&"）" -> 英雄副本战斗1次（%s/1） | C1004: =R[-26]C -> 14 | D1004: =R[-26]C -> 1 | E1004: =R[-26]C -> 0 | F1004: =R[-26]C -> 19006 | G1004: =R[-26]C -> 60 | H1004: =VLOOKUP(RC[-5],Sheet4!C[-7]:C[-2],5,FALSE) -> 27
A1005: =R[-26]C+80 -> 11441 | B1005: =VLOOKUP(RC[1],Sheet4!C[-1]:C[2],2,FALSE)&VLOOKUP(RC[1],Sheet4!C[-1]:C[2],3,FALSE)&RC[2]&VLOOKUP(RC[1],Sheet4!C[-1]:C[2],4,FALSE)&"（%s/"&RC[2]&"）" -> 圣器强化5次（%s/5） | C1005: =R[-26]C -> 2 | D1005: =R[-26]C -> 5 | E1005: =R[-26]C -> 0 | F1005: =R[-26]C -> 13049 | G1005: =R[-26]C -> 5 | H1005: =VLOOKUP(RC[-5],Sheet4!C[-7]:C[-2],5,FALSE) -> 8
A1006: =R[-26]C+80 -> 11442 | B1006: =VLOOKUP(RC[1],Sheet4!C[-1]:C[2],2,FALSE)&VLOOKUP(RC[1],Sheet4!C[-1]:C[2],3,FALSE)&RC[2]&VLOOKUP(RC[1],Sheet4!C[-1]:C[2],4,FALSE)&"（%s/"&RC[2]&"）" -> 圣器争夺5次（%s/5） | C1006: =R[-26]C -> 11 | D1006: =R[-26]C -> 5 | E1006: =R[-26]C -> 0 | F1006: =R[-26]C -> 13049 | G1006: =R[-26]C -> 5 | H1006: =VLOOKUP(RC[-5],Sheet4!C[-7]:C[-2],5,FALSE) -> 19
A1007: =R[-26]C+80 -> 11443 | B1007: =VLOOKUP(RC[1],Sheet4!C[-1]:C[2],2,FALSE)&VLOOKUP(RC[1],Sheet4!C[-1]:C[2],3,FALSE)&RC[2]&VLOOKUP(RC[1],Sheet4!C[-1]:C[2],4,FALSE)&"（%s/"&RC[2]&"）" -> 圣器合成3次（%s/3） | C1007: =R[-26]C -> 22 | D1007: =R[-26]C -> 3 | E1007: =R[-26]C -> 0 | F1007: =R[-26]C -> 13049 | G1007: =R[-26]C -> 5 | H1007: =VLOOKUP(RC[-5],Sheet4!C[-7]:C[-2],5,FALSE) -> 19
A1008: =R[-26]C+80 -> 11451 | B1008: =VLOOKUP(RC[1],Sheet4!C[-1]:C[2],2,FALSE)&VLOOKUP(RC[1],Sheet4!C[-1]:C[2],3,FALSE)&RC[2]&VLOOKUP(RC[1],Sheet4!C[-1]:C[2],4,FALSE)&"（%s/"&RC[2]&"）" -> 赠送好友精力3次（%s/3） | C1008: =R[-26]C -> 4 | D1008: =R[-26]C -> 3 | E1008: =R[-26]C -> 0 | F1008: =R[-26]C -> 19005 | G1008: =R[-26]C -> 40 | H1008: =VLOOKUP(RC[-5],Sheet4!C[-7]:C[-2],5,FALSE) -> 15
A1009: =R[-26]C+80 -> 11452 | B1009: =VLOOKUP(RC[1],Sheet4!C[-1]:C[2],2,FALSE)&VLOOKUP(RC[1],Sheet4!C[-1]:C[2],3,FALSE)&RC[2]&VLOOKUP(RC[1],Sheet4!C[-1]:C[2],4,FALSE)&"（%s/"&RC[2]&"）" -> 进行召唤5次（%s/5） | C1009: =R[-26]C -> 8 | D1009: =R[-26]C -> 5 | E1009: =R[-26]C -> 0 | F1009: =R[-26]C -> 19006 | G1009: =R[-26]C -> 60 | H1009: =VLOOKUP(RC[-5],Sheet4!C[-7]:C[-2],5,FALSE) -> 9
A1010: =R[-26]C+80 -> 11453 | B1010: =VLOOKUP(RC[1],Sheet4!C[-1]:C[2],2,FALSE)&VLOOKUP(RC[1],Sheet4!C[-1]:C[2],3,FALSE)&RC[2]&VLOOKUP(RC[1],Sheet4!C[-1]:C[2],4,FALSE)&"（%s/"&RC[2]&"）" -> 进行高级召唤2次（%s/2） | C1010: =R[-26]C -> 9 | D1010: =R[-26]C -> 2 | E1010: =R[-26]C -> 0 | F1010: =R[-26]C -> 19006 | G1010: =R[-26]C -> 80 | H1010: =VLOOKUP(RC[-5],Sheet4!C[-7]:C[-2],5,FALSE) -> 9
A1011: =R[-26]C+80 -> 11461 | B1011: =VLOOKUP(RC[1],Sheet4!C[-1]:C[2],2,FALSE)&VLOOKUP(RC[1],Sheet4!C[-1]:C[2],3,FALSE)&RC[2]&VLOOKUP(RC[1],Sheet4!C[-1]:C[2],4,FALSE)&"（%s/"&RC[2]&"）" -> 异度入侵分享2次（%s/2） | C1011: =R[-26]C -> 17 | D1011: =R[-26]C -> 2 | E1011: =R[-26]C -> 0 | F1011: =R[-26]C -> 19014 | G1011: =R[-26]C -> 500 | H1011: =VLOOKUP(RC[-5],Sheet4!C[-7]:C[-2],5,FALSE) -> 16
A1012: =R[-26]C+80 -> 11462 | B1012: =VLOOKUP(RC[1],Sheet4!C[-1]:C[2],2,FALSE)&VLOOKUP(RC[1],Sheet4!C[-1]:C[2],3,FALSE)&RC[2]&VLOOKUP(RC[1],Sheet4!C[-1]:C[2],4,FALSE)&"（%s/"&RC[2]&"）" -> 讨伐异度入侵者2次（%s/2） | C1012: =R[-26]C -> 18 | D1012: =R[-26]C -> 2 | E1012: =R[-26]C -> 0 | F1012: =R[-26]C -> 19014 | G1012: =R[-26]C -> 500 | H1012: =VLOOKUP(RC[-5],Sheet4!C[-7]:C[-2],5,FALSE) -> 16
A1013: =R[-26]C+80 -> 11463 | B1013: =VLOOKUP(RC[1],Sheet4!C[-1]:C[2],2,FALSE)&VLOOKUP(RC[1],Sheet4!C[-1]:C[2],3,FALSE)&RC[2]&VLOOKUP(RC[1],Sheet4!C[-1]:C[2],4,FALSE)&"（%s/"&RC[2]&"）" -> 精英副本战斗3次（%s/3） | C1013: =R[-26]C -> 15 | D1013: =R[-26]C -> 3 | E1013: =R[-26]C -> 0 | F1013: =R[-26]C -> 10008 | G1013: =R[-26]C -> 30 | H1013: =VLOOKUP(RC[-5],Sheet4!C[-7]:C[-2],5,FALSE) -> 28
A1014: =R[-26]C+80 -> 11464 | B1014: =VLOOKUP(RC[1],Sheet4!C[-1]:C[2],2,FALSE)&VLOOKUP(RC[1],Sheet4!C[-1]:C[2],3,FALSE)&RC[2]&VLOOKUP(RC[1],Sheet4!C[-1]:C[2],4,FALSE)&"（%s/"&RC[2]&"）" -> 击杀精英外敌1个（%s/1） | C1014: =R[-26]C -> 20 | D1014: =R[-26]C -> 1 | E1014: =R[-26]C -> 0 | F1014: =R[-26]C -> 10008 | G1014: =R[-26]C -> 40 | H1014: =VLOOKUP(RC[-5],Sheet4!C[-7]:C[-2],5,FALSE) -> 28
A1015: =R[-26]C+80 -> 11471 | B1015: =VLOOKUP(RC[1],Sheet4!C[-1]:C[2],2,FALSE)&VLOOKUP(RC[1],Sheet4!C[-1]:C[2],3,FALSE)&RC[2]&VLOOKUP(RC[1],Sheet4!C[-1]:C[2],4,FALSE)&"（%s/"&RC[2]&"）" -> 购买体力2次（%s/2） | C1015: =R[-26]C -> 6 | D1015: =R[-26]C -> 2 | E1015: =R[-26]C -> 0 | F1015: =R[-26]C -> 19005 | G1015: =R[-26]C -> 50 | H1015: =VLOOKUP(RC[-5],Sheet4!C[-7]:C[-2],5,FALSE) -> 12
A1016: =R[-26]C+80 -> 11472 | B1016: =VLOOKUP(RC[1],Sheet4!C[-1]:C[2],2,FALSE)&VLOOKUP(RC[1],Sheet4!C[-1]:C[2],3,FALSE)&RC[2]&VLOOKUP(RC[1],Sheet4!C[-1]:C[2],4,FALSE)&"（%s/"&RC[2]&"）" -> 购买精力2次（%s/2） | C1016: =R[-26]C -> 7 | D1016: =R[-26]C -> 2 | E1016: =R[-26]C -> 0 | F1016: =R[-26]C -> 19005 | G1016: =R[-26]C -> 50 | H1016: =VLOOKUP(RC[-5],Sheet4!C[-7]:C[-2],5,FALSE) -> 12
A1017: =R[-26]C+80 -> 11473 | B1017: =VLOOKUP(RC[1],Sheet4!C[-1]:C[2],2,FALSE)&VLOOKUP(RC[1],Sheet4!C[-1]:C[2],3,FALSE)&RC[2]&VLOOKUP(RC[1],Sheet4!C[-1]:C[2],4,FALSE)&"（%s/"&RC[2]&"）" -> 英雄培养20次（%s/20） | C1017: =R[-26]C -> 3 | D1017: =R[-26]C -> 20 | E1017: =R[-26]C -> 0 | F1017: =R[-26]C -> 10003 | G1017: =R[-26]C -> 30 | H1017: =VLOOKUP(RC[-5],Sheet4!C[-7]:C[-2],5,FALSE) -> 8
A1018: =R[-26]C+80 -> 11481 | B1018: =VLOOKUP(RC[1],Sheet4!C[-1]:C[2],2,FALSE)&VLOOKUP(RC[1],Sheet4!C[-1]:C[2],3,FALSE)&RC[2]&VLOOKUP(RC[1],Sheet4!C[-1]:C[2],4,FALSE)&"（%s/"&RC[2]&"）" -> 无尽深渊战斗1次（%s/1） | C1018: =R[-26]C -> 23 | D1018: =R[-26]C -> 1 | E1018: =R[-26]C -> 0 | F1018: =R[-26]C -> 19028 | G1018: =R[-26]C -> 50 | H1018: =VLOOKUP(RC[-5],Sheet4!C[-7]:C[-2],5,FALSE) -> 88
A1019: =R[-26]C+80 -> 11482 | B1019: =VLOOKUP(RC[1],Sheet4!C[-1]:C[2],2,FALSE)&VLOOKUP(RC[1],Sheet4!C[-1]:C[2],3,FALSE)&RC[2]&VLOOKUP(RC[1],Sheet4!C[-1]:C[2],4,FALSE)&"（%s/"&RC[2]&"）" -> 进入勇者试练战斗10次（%s/10） | C1019: =R[-26]C -> 12 | D1019: =R[-26]C -> 10 | E1019: =R[-26]C -> 0 | F1019: =R[-26]C -> 19012 | G1019: =R[-26]C -> 500 | H1019: =VLOOKUP(RC[-5],Sheet4!C[-7]:C[-2],5,FALSE) -> 17
A1020: =R[-26]C+80 -> 11483 | B1020: =VLOOKUP(RC[1],Sheet4!C[-1]:C[2],2,FALSE)&VLOOKUP(RC[1],Sheet4!C[-1]:C[2],3,FALSE)&RC[2]&VLOOKUP(RC[1],Sheet4!C[-1]:C[2],4,FALSE)&"（%s/"&RC[2]&"）" -> 竞技场战斗5次（%s/5） | C1020: =R[-26]C -> 10 | D1020: =R[-26]C -> 5 | E1020: =R[-26]C -> 0 | F1020: =R[-26]C -> 19013 | G1020: =R[-26]C -> 500 | H1020: =VLOOKUP(RC[-5],Sheet4!C[-7]:C[-2],5,FALSE) -> 21
A1021: =R[-26]C+80 -> 11484 | B1021: =VLOOKUP(RC[1],Sheet4!C[-1]:C[2],2,FALSE)&VLOOKUP(RC[1],Sheet4!C[-1]:C[2],3,FALSE)&RC[2]&VLOOKUP(RC[1],Sheet4!C[-1]:C[2],4,FALSE)&"（%s/"&RC[2]&"）" -> 主线副本挑战5次（%s/5） | C1021: =R[-26]C -> 1 | D1021: =R[-26]C -> 5 | E1021: =R[-26]C -> 0 | F1021: =R[-26]C -> 19003 | G1021: =R[-26]C -> 50000 | H1021: =VLOOKUP(RC[-5],Sheet4!C[-7]:C[-2],5,FALSE) -> 26
A1022: =R[-26]C+80 -> 11491 | B1022: =VLOOKUP(RC[1],Sheet4!C[-1]:C[2],2,FALSE)&VLOOKUP(RC[1],Sheet4!C[-1]:C[2],3,FALSE)&RC[2]&VLOOKUP(RC[1],Sheet4!C[-1]:C[2],4,FALSE)&"（%s/"&RC[2]&"）" -> 占卜翻牌5次（%s/5） | C1022: =R[-26]C -> 25 | D1022: =R[-26]C -> 5 | E1022: =R[-26]C -> 0 | F1022: =R[-26]C -> 10096 | G1022: =R[-26]C -> 1 | H1022: =VLOOKUP(RC[-5],Sheet4!C[-7]:C[-2],5,FALSE) -> 113
A1023: =R[-26]C+80 -> 11492 | B1023: =VLOOKUP(RC[1],Sheet4!C[-1]:C[2],2,FALSE)&VLOOKUP(RC[1],Sheet4!C[-1]:C[2],3,FALSE)&RC[2]&VLOOKUP(RC[1],Sheet4!C[-1]:C[2],4,FALSE)&"（%s/"&RC[2]&"）" -> 英雄商店购买1次（%s/1） | C1023: =R[-26]C -> 5 | D1023: =R[-26]C -> 1 | E1023: =R[-26]C -> 0 | F1023: =R[-26]C -> 19006 | G1023: =R[-26]C -> 60 | H1023: =VLOOKUP(RC[-5],Sheet4!C[-7]:C[-2],5,FALSE) -> 11
A1024: =R[-26]C+80 -> 11493 | B1024: =VLOOKUP(RC[1],Sheet4!C[-1]:C[2],2,FALSE)&VLOOKUP(RC[1],Sheet4!C[-1]:C[2],3,FALSE)&RC[2]&VLOOKUP(RC[1],Sheet4!C[-1]:C[2],4,FALSE)&"（%s/"&RC[2]&"）" -> 日常副本战斗4次（%s/4） | C1024: =R[-26]C -> 13 | D1024: =R[-26]C -> 4 | E1024: =R[-26]C -> 0 | F1024: =R[-26]C -> 19005 | G1024: =R[-26]C -> 50 | H1024: =VLOOKUP(RC[-5],Sheet4!C[-7]:C[-2],5,FALSE) -> 2
A1025: =R[-26]C+80 -> 11501 | B1025: =VLOOKUP(RC[1],Sheet4!C[-1]:C[2],2,FALSE)&VLOOKUP(RC[1],Sheet4!C[-1]:C[2],3,FALSE)&RC[2]&VLOOKUP(RC[1],Sheet4!C[-1]:C[2],4,FALSE)&"（%s/"&RC[2]&"）" -> 遗迹探索4小时（%s/4） | C1025: =R[-26]C -> 19 | D1025: =R[-26]C -> 4 | E1025: =R[-26]C -> 0 | F1025: =R[-26]C -> 19003 | G1025: =R[-26]C -> 50000 | H1025: =VLOOKUP(RC[-5],Sheet4!C[-7]:C[-2],5,FALSE) -> 20
A1026: =R[-26]C+80 -> 11502 | B1026: =VLOOKUP(RC[1],Sheet4!C[-1]:C[2],2,FALSE)&VLOOKUP(RC[1],Sheet4!C[-1]:C[2],3,FALSE)&RC[2]&VLOOKUP(RC[1],Sheet4!C[-1]:C[2],4,FALSE)&"（%s/"&RC[2]&"）" -> 击杀遗迹破坏者3次（%s/3） | C1026: =R[-26]C -> 16 | D1026: =R[-26]C -> 3 | E1026: =R[-26]C -> 0 | F1026: =R[-26]C -> 19005 | G1026: =R[-26]C -> 50 | H1026: =VLOOKUP(RC[-5],Sheet4!C[-7]:C[-2],5,FALSE) -> 20
A1027: =R[-26]C+80 -> 11503 | B1027: =VLOOKUP(RC[1],Sheet4!C[-1]:C[2],2,FALSE)&VLOOKUP(RC[1],Sheet4!C[-1]:C[2],3,FALSE)&RC[2]&VLOOKUP(RC[1],Sheet4!C[-1]:C[2],4,FALSE)&"（%s/"&RC[2]&"）" -> 英雄副本战斗1次（%s/1） | C1027: =R[-26]C -> 14 | D1027: =R[-26]C -> 1 | E1027: =R[-26]C -> 0 | F1027: =R[-26]C -> 19006 | G1027: =R[-26]C -> 60 | H1027: =VLOOKUP(RC[-5],Sheet4!C[-7]:C[-2],5,FALSE) -> 27
A1028: =R[-26]C+80 -> 11511 | B1028: =VLOOKUP(RC[1],Sheet4!C[-1]:C[2],2,FALSE)&VLOOKUP(RC[1],Sheet4!C[-1]:C[2],3,FALSE)&RC[2]&VLOOKUP(RC[1],Sheet4!C[-1]:C[2],4,FALSE)&"（%s/"&RC[2]&"）" -> 遗迹探索4小时（%s/4） | C1028: =R[-26]C -> 19 | D1028: =R[-26]C -> 4 | E1028: =R[-26]C -> 0 | F1028: =R[-26]C -> 19003 | G1028: =R[-26]C -> 50000 | H1028: =VLOOKUP(RC[-5],Sheet4!C[-7]:C[-2],5,FALSE) -> 20
A1029: =R[-26]C+80 -> 11512 | B1029: =VLOOKUP(RC[1],Sheet4!C[-1]:C[2],2,FALSE)&VLOOKUP(RC[1],Sheet4!C[-1]:C[2],3,FALSE)&RC[2]&VLOOKUP(RC[1],Sheet4!C[-1]:C[2],4,FALSE)&"（%s/"&RC[2]&"）" -> 击杀遗迹破坏者3次（%s/3） | C1029: =R[-26]C -> 16 | D1029: =R[-26]C -> 3 | E1029: =R[-26]C -> 0 | F1029: =R[-26]C -> 19005 | G1029: =R[-26]C -> 50 | H1029: =VLOOKUP(RC[-5],Sheet4!C[-7]:C[-2],5,FALSE) -> 20
A1030: =R[-26]C+80 -> 11513 | B1030: =VLOOKUP(RC[1],Sheet4!C[-1]:C[2],2,FALSE)&VLOOKUP(RC[1],Sheet4!C[-1]:C[2],3,FALSE)&RC[2]&VLOOKUP(RC[1],Sheet4!C[-1]:C[2],4,FALSE)&"（%s/"&RC[2]&"）" -> 英雄副本战斗1次（%s/1） | C1030: =R[-26]C -> 14 | D1030: =R[-26]C -> 1 | E1030: =R[-26]C -> 0 | F1030: =R[-26]C -> 19006 | G1030: =R[-26]C -> 60 | H1030: =VLOOKUP(RC[-5],Sheet4!C[-7]:C[-2],5,FALSE) -> 27
A1031: =R[-26]C+80 -> 11521 | B1031: =VLOOKUP(RC[1],Sheet4!C[-1]:C[2],2,FALSE)&VLOOKUP(RC[1],Sheet4!C[-1]:C[2],3,FALSE)&RC[2]&VLOOKUP(RC[1],Sheet4!C[-1]:C[2],4,FALSE)&"（%s/"&RC[2]&"）" -> 圣器强化5次（%s/5） | C1031: =R[-26]C -> 2 | D1031: =R[-26]C -> 5 | E1031: =R[-26]C -> 0 | F1031: =R[-26]C -> 13049 | G1031: =R[-26]C -> 5 | H1031: =VLOOKUP(RC[-5],Sheet4!C[-7]:C[-2],5,FALSE) -> 8
A1032: =R[-26]C+80 -> 11522 | B1032: =VLOOKUP(RC[1],Sheet4!C[-1]:C[2],2,FALSE)&VLOOKUP(RC[1],Sheet4!C[-1]:C[2],3,FALSE)&RC[2]&VLOOKUP(RC[1],Sheet4!C[-1]:C[2],4,FALSE)&"（%s/"&RC[2]&"）" -> 圣器争夺5次（%s/5） | C1032: =R[-26]C -> 11 | D1032: =R[-26]C -> 5 | E1032: =R[-26]C -> 0 | F1032: =R[-26]C -> 13049 | G1032: =R[-26]C -> 5 | H1032: =VLOOKUP(RC[-5],Sheet4!C[-7]:C[-2],5,FALSE) -> 19
A1033: =R[-26]C+80 -> 11523 | B1033: =VLOOKUP(RC[1],Sheet4!C[-1]:C[2],2,FALSE)&VLOOKUP(RC[1],Sheet4!C[-1]:C[2],3,FALSE)&RC[2]&VLOOKUP(RC[1],Sheet4!C[-1]:C[2],4,FALSE)&"（%s/"&RC[2]&"）" -> 圣器合成3次（%s/3） | C1033: =R[-26]C -> 22 | D1033: =R[-26]C -> 3 | E1033: =R[-26]C -> 0 | F1033: =R[-26]C -> 13049 | G1033: =R[-26]C -> 5 | H1033: =VLOOKUP(RC[-5],Sheet4!C[-7]:C[-2],5,FALSE) -> 19
A1034: =R[-26]C+80 -> 11531 | B1034: =VLOOKUP(RC[1],Sheet4!C[-1]:C[2],2,FALSE)&VLOOKUP(RC[1],Sheet4!C[-1]:C[2],3,FALSE)&RC[2]&VLOOKUP(RC[1],Sheet4!C[-1]:C[2],4,FALSE)&"（%s/"&RC[2]&"）" -> 赠送好友精力3次（%s/3） | C1034: =R[-26]C -> 4 | D1034: =R[-26]C -> 3 | E1034: =R[-26]C -> 0 | F1034: =R[-26]C -> 19005 | G1034: =R[-26]C -> 40 | H1034: =VLOOKUP(RC[-5],Sheet4!C[-7]:C[-2],5,FALSE) -> 15
A1035: =R[-26]C+80 -> 11532 | B1035: =VLOOKUP(RC[1],Sheet4!C[-1]:C[2],2,FALSE)&VLOOKUP(RC[1],Sheet4!C[-1]:C[2],3,FALSE)&RC[2]&VLOOKUP(RC[1],Sheet4!C[-1]:C[2],4,FALSE)&"（%s/"&RC[2]&"）" -> 进行召唤5次（%s/5） | C1035: =R[-26]C -> 8 | D1035: =R[-26]C -> 5 | E1035: =R[-26]C -> 0 | F1035: =R[-26]C -> 19006 | G1035: =R[-26]C -> 60 | H1035: =VLOOKUP(RC[-5],Sheet4!C[-7]:C[-2],5,FALSE) -> 9
A1036: =R[-26]C+80 -> 11533 | B1036: =VLOOKUP(RC[1],Sheet4!C[-1]:C[2],2,FALSE)&VLOOKUP(RC[1],Sheet4!C[-1]:C[2],3,FALSE)&RC[2]&VLOOKUP(RC[1],Sheet4!C[-1]:C[2],4,FALSE)&"（%s/"&RC[2]&"）" -> 进行高级召唤2次（%s/2） | C1036: =R[-26]C -> 9 | D1036: =R[-26]C -> 2 | E1036: =R[-26]C -> 0 | F1036: =R[-26]C -> 19006 | G1036: =R[-26]C -> 80 | H1036: =VLOOKUP(RC[-5],Sheet4!C[-7]:C[-2],5,FALSE) -> 9
A1037: =R[-26]C+80 -> 11541 | B1037: =VLOOKUP(RC[1],Sheet4!C[-1]:C[2],2,FALSE)&VLOOKUP(RC[1],Sheet4!C[-1]:C[2],3,FALSE)&RC[2]&VLOOKUP(RC[1],Sheet4!C[-1]:C[2],4,FALSE)&"（%s/"&RC[2]&"）" -> 异度入侵分享2次（%s/2） | C1037: =R[-26]C -> 17 | D1037: =R[-26]C -> 2 | E1037: =R[-26]C -> 0 | F1037: =R[-26]C -> 19014 | G1037: =R[-26]C -> 500 | H1037: =VLOOKUP(RC[-5],Sheet4!C[-7]:C[-2],5,FALSE) -> 16
A1038: =R[-26]C+80 -> 11542 | B1038: =VLOOKUP(RC[1],Sheet4!C[-1]:C[2],2,FALSE)&VLOOKUP(RC[1],Sheet4!C[-1]:C[2],3,FALSE)&RC[2]&VLOOKUP(RC[1],Sheet4!C[-1]:C[2],4,FALSE)&"（%s/"&RC[2]&"）" -> 讨伐异度入侵者2次（%s/2） | C1038: =R[-26]C -> 18 | D1038: =R[-26]C -> 2 | E1038: =R[-26]C -> 0 | F1038: =R[-26]C -> 19014 | G1038: =R[-26]C -> 500 | H1038: =VLOOKUP(RC[-5],Sheet4!C[-7]:C[-2],5,FALSE) -> 16
A1039: =R[-26]C+80 -> 11543 | B1039: =VLOOKUP(RC[1],Sheet4!C[-1]:C[2],2,FALSE)&VLOOKUP(RC[1],Sheet4!C[-1]:C[2],3,FALSE)&RC[2]&VLOOKUP(RC[1],Sheet4!C[-1]:C[2],4,FALSE)&"（%s/"&RC[2]&"）" -> 精英副本战斗3次（%s/3） | C1039: =R[-26]C -> 15 | D1039: =R[-26]C -> 3 | E1039: =R[-26]C -> 0 | F1039: =R[-26]C -> 10008 | G1039: =R[-26]C -> 30 | H1039: =VLOOKUP(RC[-5],Sheet4!C[-7]:C[-2],5,FALSE) -> 28
A1040: =R[-26]C+80 -> 11544 | B1040: =VLOOKUP(RC[1],Sheet4!C[-1]:C[2],2,FALSE)&VLOOKUP(RC[1],Sheet4!C[-1]:C[2],3,FALSE)&RC[2]&VLOOKUP(RC[1],Sheet4!C[-1]:C[2],4,FALSE)&"（%s/"&RC[2]&"）" -> 击杀精英外敌1个（%s/1） | C1040: =R[-26]C -> 20 | D1040: =R[-26]C -> 1 | E1040: =R[-26]C -> 0 | F1040: =R[-26]C -> 10008 | G1040: =R[-26]C -> 40 | H1040: =VLOOKUP(RC[-5],Sheet4!C[-7]:C[-2],5,FALSE) -> 28
A1041: =R[-26]C+80 -> 11551 | B1041: =VLOOKUP(RC[1],Sheet4!C[-1]:C[2],2,FALSE)&VLOOKUP(RC[1],Sheet4!C[-1]:C[2],3,FALSE)&RC[2]&VLOOKUP(RC[1],Sheet4!C[-1]:C[2],4,FALSE)&"（%s/"&RC[2]&"）" -> 购买体力2次（%s/2） | C1041: =R[-26]C -> 6 | D1041: =R[-26]C -> 2 | E1041: =R[-26]C -> 0 | F1041: =R[-26]C -> 19005 | G1041: =R[-26]C -> 50 | H1041: =VLOOKUP(RC[-5],Sheet4!C[-7]:C[-2],5,FALSE) -> 12
A1042: =R[-26]C+80 -> 11552 | B1042: =VLOOKUP(RC[1],Sheet4!C[-1]:C[2],2,FALSE)&VLOOKUP(RC[1],Sheet4!C[-1]:C[2],3,FALSE)&RC[2]&VLOOKUP(RC[1],Sheet4!C[-1]:C[2],4,FALSE)&"（%s/"&RC[2]&"）" -> 购买精力2次（%s/2） | C1042: =R[-26]C -> 7 | D1042: =R[-26]C -> 2 | E1042: =R[-26]C -> 0 | F1042: =R[-26]C -> 19005 | G1042: =R[-26]C -> 50 | H1042: =VLOOKUP(RC[-5],Sheet4!C[-7]:C[-2],5,FALSE) -> 12
A1043: =R[-26]C+80 -> 11553 | B1043: =VLOOKUP(RC[1],Sheet4!C[-1]:C[2],2,FALSE)&VLOOKUP(RC[1],Sheet4!C[-1]:C[2],3,FALSE)&RC[2]&VLOOKUP(RC[1],Sheet4!C[-1]:C[2],4,FALSE)&"（%s/"&RC[2]&"）" -> 英雄培养20次（%s/20） | C1043: =R[-26]C -> 3 | D1043: =R[-26]C -> 20 | E1043: =R[-26]C -> 0 | F1043: =R[-26]C -> 10003 | G1043: =R[-26]C -> 30 | H1043: =VLOOKUP(RC[-5],Sheet4!C[-7]:C[-2],5,FALSE) -> 8
A1044: =R[-26]C+80 -> 11561 | B1044: =VLOOKUP(RC[1],Sheet4!C[-1]:C[2],2,FALSE)&VLOOKUP(RC[1],Sheet4!C[-1]:C[2],3,FALSE)&RC[2]&VLOOKUP(RC[1],Sheet4!C[-1]:C[2],4,FALSE)&"（%s/"&RC[2]&"）" -> 无尽深渊战斗1次（%s/1） | C1044: =R[-26]C -> 23 | D1044: =R[-26]C -> 1 | E1044: =R[-26]C -> 0 | F1044: =R[-26]C -> 19028 | G1044: =R[-26]C -> 50 | H1044: =VLOOKUP(RC[-5],Sheet4!C[-7]:C[-2],5,FALSE) -> 88
A1045: =R[-26]C+80 -> 11562 | B1045: =VLOOKUP(RC[1],Sheet4!C[-1]:C[2],2,FALSE)&VLOOKUP(RC[1],Sheet4!C[-1]:C[2],3,FALSE)&RC[2]&VLOOKUP(RC[1],Sheet4!C[-1]:C[2],4,FALSE)&"（%s/"&RC[2]&"）" -> 进入勇者试练战斗10次（%s/10） | C1045: =R[-26]C -> 12 | D1045: =R[-26]C -> 10 | E1045: =R[-26]C -> 0 | F1045: =R[-26]C -> 19012 | G1045: =R[-26]C -> 500 | H1045: =VLOOKUP(RC[-5],Sheet4!C[-7]:C[-2],5,FALSE) -> 17
A1046: =R[-26]C+80 -> 11563 | B1046: =VLOOKUP(RC[1],Sheet4!C[-1]:C[2],2,FALSE)&VLOOKUP(RC[1],Sheet4!C[-1]:C[2],3,FALSE)&RC[2]&VLOOKUP(RC[1],Sheet4!C[-1]:C[2],4,FALSE)&"（%s/"&RC[2]&"）" -> 竞技场战斗5次（%s/5） | C1046: =R[-26]C -> 10 | D1046: =R[-26]C -> 5 | E1046: =R[-26]C -> 0 | F1046: =R[-26]C -> 19013 | G1046: =R[-26]C -> 500 | H1046: =VLOOKUP(RC[-5],Sheet4!C[-7]:C[-2],5,FALSE) -> 21
A1047: =R[-26]C+80 -> 11564 | B1047: =VLOOKUP(RC[1],Sheet4!C[-1]:C[2],2,FALSE)&VLOOKUP(RC[1],Sheet4!C[-1]:C[2],3,FALSE)&RC[2]&VLOOKUP(RC[1],Sheet4!C[-1]:C[2],4,FALSE)&"（%s/"&RC[2]&"）" -> 主线副本挑战5次（%s/5） | C1047: =R[-26]C -> 1 | D1047: =R[-26]C -> 5 | E1047: =R[-26]C -> 0 | F1047: =R[-26]C -> 19003 | G1047: =R[-26]C -> 50000 | H1047: =VLOOKUP(RC[-5],Sheet4!C[-7]:C[-2],5,FALSE) -> 26
A1048: =R[-26]C+80 -> 11571 | B1048: =VLOOKUP(RC[1],Sheet4!C[-1]:C[2],2,FALSE)&VLOOKUP(RC[1],Sheet4!C[-1]:C[2],3,FALSE)&RC[2]&VLOOKUP(RC[1],Sheet4!C[-1]:C[2],4,FALSE)&"（%s/"&RC[2]&"）" -> 占卜翻牌5次（%s/5） | C1048: =R[-26]C -> 25 | D1048: =R[-26]C -> 5 | E1048: =R[-26]C -> 0 | F1048: =R[-26]C -> 10096 | G1048: =R[-26]C -> 1 | H1048: =VLOOKUP(RC[-5],Sheet4!C[-7]:C[-2],5,FALSE) -> 113
A1049: =R[-26]C+80 -> 11572 | B1049: =VLOOKUP(RC[1],Sheet4!C[-1]:C[2],2,FALSE)&VLOOKUP(RC[1],Sheet4!C[-1]:C[2],3,FALSE)&RC[2]&VLOOKUP(RC[1],Sheet4!C[-1]:C[2],4,FALSE)&"（%s/"&RC[2]&"）" -> 英雄商店购买1次（%s/1） | C1049: =R[-26]C -> 5 | D1049: =R[-26]C -> 1 | E1049: =R[-26]C -> 0 | F1049: =R[-26]C -> 19006 | G1049: =R[-26]C -> 60 | H1049: =VLOOKUP(RC[-5],Sheet4!C[-7]:C[-2],5,FALSE) -> 11
A1050: =R[-26]C+80 -> 11573 | B1050: =VLOOKUP(RC[1],Sheet4!C[-1]:C[2],2,FALSE)&VLOOKUP(RC[1],Sheet4!C[-1]:C[2],3,FALSE)&RC[2]&VLOOKUP(RC[1],Sheet4!C[-1]:C[2],4,FALSE)&"（%s/"&RC[2]&"）" -> 日常副本战斗4次（%s/4） | C1050: =R[-26]C -> 13 | D1050: =R[-26]C -> 4 | E1050: =R[-26]C -> 0 | F1050: =R[-26]C -> 19005 | G1050: =R[-26]C -> 50 | H1050: =VLOOKUP(RC[-5],Sheet4!C[-7]:C[-2],5,FALSE) -> 2
A1051: =R[-26]C+80 -> 11581 | B1051: =VLOOKUP(RC[1],Sheet4!C[-1]:C[2],2,FALSE)&VLOOKUP(RC[1],Sheet4!C[-1]:C[2],3,FALSE)&RC[2]&VLOOKUP(RC[1],Sheet4!C[-1]:C[2],4,FALSE)&"（%s/"&RC[2]&"）" -> 遗迹探索4小时（%s/4） | C1051: =R[-26]C -> 19 | D1051: =R[-26]C -> 4 | E1051: =R[-26]C -> 0 | F1051: =R[-26]C -> 19003 | G1051: =R[-26]C -> 50000 | H1051: =VLOOKUP(RC[-5],Sheet4!C[-7]:C[-2],5,FALSE) -> 20
A1052: =R[-26]C+80 -> 11582 | B1052: =VLOOKUP(RC[1],Sheet4!C[-1]:C[2],2,FALSE)&VLOOKUP(RC[1],Sheet4!C[-1]:C[2],3,FALSE)&RC[2]&VLOOKUP(RC[1],Sheet4!C[-1]:C[2],4,FALSE)&"（%s/"&RC[2]&"）" -> 击杀遗迹破坏者3次（%s/3） | C1052: =R[-26]C -> 16 | D1052: =R[-26]C -> 3 | E1052: =R[-26]C -> 0 | F1052: =R[-26]C -> 19005 | G1052: =R[-26]C -> 50 | H1052: =VLOOKUP(RC[-5],Sheet4!C[-7]:C[-2],5,FALSE) -> 20
A1053: =R[-26]C+80 -> 11583 | B1053: =VLOOKUP(RC[1],Sheet4!C[-1]:C[2],2,FALSE)&VLOOKUP(RC[1],Sheet4!C[-1]:C[2],3,FALSE)&RC[2]&VLOOKUP(RC[1],Sheet4!C[-1]:C[2],4,FALSE)&"（%s/"&RC[2]&"）" -> 英雄副本战斗1次（%s/1） | C1053: =R[-26]C -> 14 | D1053: =R[-26]C -> 1 | E1053: =R[-26]C -> 0 | F1053: =R[-26]C -> 19006 | G1053: =R[-26]C -> 60 | H1053: =VLOOKUP(RC[-5],Sheet4!C[-7]:C[-2],5,FALSE) -> 27
A1054: =R[-26]C+80 -> 11591 | B1054: =VLOOKUP(RC[1],Sheet4!C[-1]:C[2],2,FALSE)&VLOOKUP(RC[1],Sheet4!C[-1]:C[2],3,FALSE)&RC[2]&VLOOKUP(RC[1],Sheet4!C[-1]:C[2],4,FALSE)&"（%s/"&RC[2]&"）" -> 遗迹探索4小时（%s/4） | C1054: =R[-26]C -> 19 | D1054: =R[-26]C -> 4 | E1054: =R[-26]C -> 0 | F1054: =R[-26]C -> 19003 | G1054: =R[-26]C -> 50000 | H1054: =VLOOKUP(RC[-5],Sheet4!C[-7]:C[-2],5,FALSE) -> 20
A1055: =R[-26]C+80 -> 11592 | B1055: =VLOOKUP(RC[1],Sheet4!C[-1]:C[2],2,FALSE)&VLOOKUP(RC[1],Sheet4!C[-1]:C[2],3,FALSE)&RC[2]&VLOOKUP(RC[1],Sheet4!C[-1]:C[2],4,FALSE)&"（%s/"&RC[2]&"）" -> 击杀遗迹破坏者3次（%s/3） | C1055: =R[-26]C -> 16 | D1055: =R[-26]C -> 3 | E1055: =R[-26]C -> 0 | F1055: =R[-26]C -> 19005 | G1055: =R[-26]C -> 50 | H1055: =VLOOKUP(RC[-5],Sheet4!C[-7]:C[-2],5,FALSE) -> 20
A1056: =R[-26]C+80 -> 11593 | B1056: =VLOOKUP(RC[1],Sheet4!C[-1]:C[2],2,FALSE)&VLOOKUP(RC[1],Sheet4!C[-1]:C[2],3,FALSE)&RC[2]&VLOOKUP(RC[1],Sheet4!C[-1]:C[2],4,FALSE)&"（%s/"&RC[2]&"）" -> 英雄副本战斗1次（%s/1） | C1056: =R[-26]C -> 14 | D1056: =R[-26]C -> 1 | E1056: =R[-26]C -> 0 | F1056: =R[-26]C -> 19006 | G1056: =R[-26]C -> 60 | H1056: =VLOOKUP(RC[-5],Sheet4!C[-7]:C[-2],5,FALSE) -> 27
A1057: =R[-26]C+80 -> 11601 | B1057: =VLOOKUP(RC[1],Sheet4!C[-1]:C[2],2,FALSE)&VLOOKUP(RC[1],Sheet4!C[-1]:C[2],3,FALSE)&RC[2]&VLOOKUP(RC[1],Sheet4!C[-1]:C[2],4,FALSE)&"（%s/"&RC[2]&"）" -> 圣器强化5次（%s/5） | C1057: =R[-26]C -> 2 | D1057: =R[-26]C -> 5 | E1057: =R[-26]C -> 0 | F1057: =R[-26]C -> 13049 | G1057: =R[-26]C -> 5 | H1057: =VLOOKUP(RC[-5],Sheet4!C[-7]:C[-2],5,FALSE) -> 8
A1058: =R[-26]C+80 -> 11602 | B1058: =VLOOKUP(RC[1],Sheet4!C[-1]:C[2],2,FALSE)&VLOOKUP(RC[1],Sheet4!C[-1]:C[2],3,FALSE)&RC[2]&VLOOKUP(RC[1],Sheet4!C[-1]:C[2],4,FALSE)&"（%s/"&RC[2]&"）" -> 圣器争夺5次（%s/5） | C1058: =R[-26]C -> 11 | D1058: =R[-26]C -> 5 | E1058: =R[-26]C -> 0 | F1058: =R[-26]C -> 13049 | G1058: =R[-26]C -> 5 | H1058: =VLOOKUP(RC[-5],Sheet4!C[-7]:C[-2],5,FALSE) -> 19
A1059: =R[-26]C+80 -> 11603 | B1059: =VLOOKUP(RC[1],Sheet4!C[-1]:C[2],2,FALSE)&VLOOKUP(RC[1],Sheet4!C[-1]:C[2],3,FALSE)&RC[2]&VLOOKUP(RC[1],Sheet4!C[-1]:C[2],4,FALSE)&"（%s/"&RC[2]&"）" -> 圣器合成3次（%s/3） | C1059: =R[-26]C -> 22 | D1059: =R[-26]C -> 3 | E1059: =R[-26]C -> 0 | F1059: =R[-26]C -> 13049 | G1059: =R[-26]C -> 5 | H1059: =VLOOKUP(RC[-5],Sheet4!C[-7]:C[-2],5,FALSE) -> 19
A1060: =R[-26]C+80 -> 11611 | B1060: =VLOOKUP(RC[1],Sheet4!C[-1]:C[2],2,FALSE)&VLOOKUP(RC[1],Sheet4!C[-1]:C[2],3,FALSE)&RC[2]&VLOOKUP(RC[1],Sheet4!C[-1]:C[2],4,FALSE)&"（%s/"&RC[2]&"）" -> 赠送好友精力3次（%s/3） | C1060: =R[-26]C -> 4 | D1060: =R[-26]C -> 3 | E1060: =R[-26]C -> 0 | F1060: =R[-26]C -> 19005 | G1060: =R[-26]C -> 40 | H1060: =VLOOKUP(RC[-5],Sheet4!C[-7]:C[-2],5,FALSE) -> 15
A1061: =R[-26]C+80 -> 11612 | B1061: =VLOOKUP(RC[1],Sheet4!C[-1]:C[2],2,FALSE)&VLOOKUP(RC[1],Sheet4!C[-1]:C[2],3,FALSE)&RC[2]&VLOOKUP(RC[1],Sheet4!C[-1]:C[2],4,FALSE)&"（%s/"&RC[2]&"）" -> 进行召唤5次（%s/5） | C1061: =R[-26]C -> 8 | D1061: =R[-26]C -> 5 | E1061: =R[-26]C -> 0 | F1061: =R[-26]C -> 19006 | G1061: =R[-26]C -> 60 | H1061: =VLOOKUP(RC[-5],Sheet4!C[-7]:C[-2],5,FALSE) -> 9
A1062: =R[-26]C+80 -> 11613 | B1062: =VLOOKUP(RC[1],Sheet4!C[-1]:C[2],2,FALSE)&VLOOKUP(RC[1],Sheet4!C[-1]:C[2],3,FALSE)&RC[2]&VLOOKUP(RC[1],Sheet4!C[-1]:C[2],4,FALSE)&"（%s/"&RC[2]&"）" -> 进行高级召唤2次（%s/2） | C1062: =R[-26]C -> 9 | D1062: =R[-26]C -> 2 | E1062: =R[-26]C -> 0 | F1062: =R[-26]C -> 19006 | G1062: =R[-26]C -> 80 | H1062: =VLOOKUP(RC[-5],Sheet4!C[-7]:C[-2],5,FALSE) -> 9
A1063: =R[-26]C+80 -> 11621 | B1063: =VLOOKUP(RC[1],Sheet4!C[-1]:C[2],2,FALSE)&VLOOKUP(RC[1],Sheet4!C[-1]:C[2],3,FALSE)&RC[2]&VLOOKUP(RC[1],Sheet4!C[-1]:C[2],4,FALSE)&"（%s/"&RC[2]&"）" -> 异度入侵分享2次（%s/2） | C1063: =R[-26]C -> 17 | D1063: =R[-26]C -> 2 | E1063: =R[-26]C -> 0 | F1063: =R[-26]C -> 19014 | G1063: =R[-26]C -> 500 | H1063: =VLOOKUP(RC[-5],Sheet4!C[-7]:C[-2],5,FALSE) -> 16
A1064: =R[-26]C+80 -> 11622 | B1064: =VLOOKUP(RC[1],Sheet4!C[-1]:C[2],2,FALSE)&VLOOKUP(RC[1],Sheet4!C[-1]:C[2],3,FALSE)&RC[2]&VLOOKUP(RC[1],Sheet4!C[-1]:C[2],4,FALSE)&"（%s/"&RC[2]&"）" -> 讨伐异度入侵者2次（%s/2） | C1064: =R[-26]C -> 18 | D1064: =R[-26]C -> 2 | E1064: =R[-26]C -> 0 | F1064: =R[-26]C -> 19014 | G1064: =R[-26]C -> 500 | H1064: =VLOOKUP(RC[-5],Sheet4!C[-7]:C[-2],5,FALSE) -> 16
A1065: =R[-26]C+80 -> 11623 | B1065: =VLOOKUP(RC[1],Sheet4!C[-1]:C[2],2,FALSE)&VLOOKUP(RC[1],Sheet4!C[-1]:C[2],3,FALSE)&RC[2]&VLOOKUP(RC[1],Sheet4!C[-1]:C[2],4,FALSE)&"（%s/"&RC[2]&"）" -> 精英副本战斗3次（%s/3） | C1065: =R[-26]C -> 15 | D1065: =R[-26]C -> 3 | E1065: =R[-26]C -> 0 | F1065: =R[-26]C -> 10008 | G1065: =R[-26]C -> 30 | H1065: =VLOOKUP(RC[-5],Sheet4!C[-7]:C[-2],5,FALSE) -> 28
A1066: =R[-26]C+80 -> 11624 | B1066: =VLOOKUP(RC[1],Sheet4!C[-1]:C[2],2,FALSE)&VLOOKUP(RC[1],Sheet4!C[-1]:C[2],3,FALSE)&RC[2]&VLOOKUP(RC[1],Sheet4!C[-1]:C[2],4,FALSE)&"（%s/"&RC[2]&"）" -> 击杀精英外敌1个（%s/1） | C1066: =R[-26]C -> 20 | D1066: =R[-26]C -> 1 | E1066: =R[-26]C -> 0 | F1066: =R[-26]C -> 10008 | G1066: =R[-26]C -> 40 | H1066: =VLOOKUP(RC[-5],Sheet4!C[-7]:C[-2],5,FALSE) -> 28
A1067: =R[-26]C+80 -> 11631 | B1067: =VLOOKUP(RC[1],Sheet4!C[-1]:C[2],2,FALSE)&VLOOKUP(RC[1],Sheet4!C[-1]:C[2],3,FALSE)&RC[2]&VLOOKUP(RC[1],Sheet4!C[-1]:C[2],4,FALSE)&"（%s/"&RC[2]&"）" -> 购买体力2次（%s/2） | C1067: =R[-26]C -> 6 | D1067: =R[-26]C -> 2 | E1067: =R[-26]C -> 0 | F1067: =R[-26]C -> 19005 | G1067: =R[-26]C -> 50 | H1067: =VLOOKUP(RC[-5],Sheet4!C[-7]:C[-2],5,FALSE) -> 12
A1068: =R[-26]C+80 -> 11632 | B1068: =VLOOKUP(RC[1],Sheet4!C[-1]:C[2],2,FALSE)&VLOOKUP(RC[1],Sheet4!C[-1]:C[2],3,FALSE)&RC[2]&VLOOKUP(RC[1],Sheet4!C[-1]:C[2],4,FALSE)&"（%s/"&RC[2]&"）" -> 购买精力2次（%s/2） | C1068: =R[-26]C -> 7 | D1068: =R[-26]C -> 2 | E1068: =R[-26]C -> 0 | F1068: =R[-26]C -> 19005 | G1068: =R[-26]C -> 50 | H1068: =VLOOKUP(RC[-5],Sheet4!C[-7]:C[-2],5,FALSE) -> 12
A1069: =R[-26]C+80 -> 11633 | B1069: =VLOOKUP(RC[1],Sheet4!C[-1]:C[2],2,FALSE)&VLOOKUP(RC[1],Sheet4!C[-1]:C[2],3,FALSE)&RC[2]&VLOOKUP(RC[1],Sheet4!C[-1]:C[2],4,FALSE)&"（%s/"&RC[2]&"）" -> 英雄培养20次（%s/20） | C1069: =R[-26]C -> 3 | D1069: =R[-26]C -> 20 | E1069: =R[-26]C -> 0 | F1069: =R[-26]C -> 10003 | G1069: =R[-26]C -> 30 | H1069: =VLOOKUP(RC[-5],Sheet4!C[-7]:C[-2],5,FALSE) -> 8
A1070: =R[-26]C+80 -> 11641 | B1070: =VLOOKUP(RC[1],Sheet4!C[-1]:C[2],2,FALSE)&VLOOKUP(RC[1],Sheet4!C[-1]:C[2],3,FALSE)&RC[2]&VLOOKUP(RC[1],Sheet4!C[-1]:C[2],4,FALSE)&"（%s/"&RC[2]&"）" -> 无尽深渊战斗1次（%s/1） | C1070: =R[-26]C -> 23 | D1070: =R[-26]C -> 1 | E1070: =R[-26]C -> 0 | F1070: =R[-26]C -> 19028 | G1070: =R[-26]C -> 50 | H1070: =VLOOKUP(RC[-5],Sheet4!C[-7]:C[-2],5,FALSE) -> 88
A1071: =R[-26]C+80 -> 11642 | B1071: =VLOOKUP(RC[1],Sheet4!C[-1]:C[2],2,FALSE)&VLOOKUP(RC[1],Sheet4!C[-1]:C[2],3,FALSE)&RC[2]&VLOOKUP(RC[1],Sheet4!C[-1]:C[2],4,FALSE)&"（%s/"&RC[2]&"）" -> 进入勇者试练战斗10次（%s/10） | C1071: =R[-26]C -> 12 | D1071: =R[-26]C -> 10 | E1071: =R[-26]C -> 0 | F1071: =R[-26]C -> 19012 | G1071: =R[-26]C -> 500 | H1071: =VLOOKUP(RC[-5],Sheet4!C[-7]:C[-2],5,FALSE) -> 17
A1072: =R[-26]C+80 -> 11643 | B1072: =VLOOKUP(RC[1],Sheet4!C[-1]:C[2],2,FALSE)&VLOOKUP(RC[1],Sheet4!C[-1]:C[2],3,FALSE)&RC[2]&VLOOKUP(RC[1],Sheet4!C[-1]:C[2],4,FALSE)&"（%s/"&RC[2]&"）" -> 竞技场战斗5次（%s/5） | C1072: =R[-26]C -> 10 | D1072: =R[-26]C -> 5 | E1072: =R[-26]C -> 0 | F1072: =R[-26]C -> 19013 | G1072: =R[-26]C -> 500 | H1072: =VLOOKUP(RC[-5],Sheet4!C[-7]:C[-2],5,FALSE) -> 21
A1073: =R[-26]C+80 -> 11644 | B1073: =VLOOKUP(RC[1],Sheet4!C[-1]:C[2],2,FALSE)&VLOOKUP(RC[1],Sheet4!C[-1]:C[2],3,FALSE)&RC[2]&VLOOKUP(RC[1],Sheet4!C[-1]:C[2],4,FALSE)&"（%s/"&RC[2]&"）" -> 主线副本挑战5次（%s/5） | C1073: =R[-26]C -> 1 | D1073: =R[-26]C -> 5 | E1073: =R[-26]C -> 0 | F1073: =R[-26]C -> 19003 | G1073: =R[-26]C -> 50000 | H1073: =VLOOKUP(RC[-5],Sheet4!C[-7]:C[-2],5,FALSE) -> 26
A1074: =R[-26]C+80 -> 11651 | B1074: =VLOOKUP(RC[1],Sheet4!C[-1]:C[2],2,FALSE)&VLOOKUP(RC[1],Sheet4!C[-1]:C[2],3,FALSE)&RC[2]&VLOOKUP(RC[1],Sheet4!C[-1]:C[2],4,FALSE)&"（%s/"&RC[2]&"）" -> 占卜翻牌5次（%s/5） | C1074: =R[-26]C -> 25 | D1074: =R[-26]C -> 5 | E1074: =R[-26]C -> 0 | F1074: =R[-26]C -> 10096 | G1074: =R[-26]C -> 1 | H1074: =VLOOKUP(RC[-5],Sheet4!C[-7]:C[-2],5,FALSE) -> 113
A1075: =R[-26]C+80 -> 11652 | B1075: =VLOOKUP(RC[1],Sheet4!C[-1]:C[2],2,FALSE)&VLOOKUP(RC[1],Sheet4!C[-1]:C[2],3,FALSE)&RC[2]&VLOOKUP(RC[1],Sheet4!C[-1]:C[2],4,FALSE)&"（%s/"&RC[2]&"）" -> 英雄商店购买1次（%s/1） | C1075: =R[-26]C -> 5 | D1075: =R[-26]C -> 1 | E1075: =R[-26]C -> 0 | F1075: =R[-26]C -> 19006 | G1075: =R[-26]C -> 60 | H1075: =VLOOKUP(RC[-5],Sheet4!C[-7]:C[-2],5,FALSE) -> 11
A1076: =R[-26]C+80 -> 11653 | B1076: =VLOOKUP(RC[1],Sheet4!C[-1]:C[2],2,FALSE)&VLOOKUP(RC[1],Sheet4!C[-1]:C[2],3,FALSE)&RC[2]&VLOOKUP(RC[1],Sheet4!C[-1]:C[2],4,FALSE)&"（%s/"&RC[2]&"）" -> 日常副本战斗4次（%s/4） | C1076: =R[-26]C -> 13 | D1076: =R[-26]C -> 4 | E1076: =R[-26]C -> 0 | F1076: =R[-26]C -> 19005 | G1076: =R[-26]C -> 50 | H1076: =VLOOKUP(RC[-5],Sheet4!C[-7]:C[-2],5,FALSE) -> 2
A1077: =R[-26]C+80 -> 11661 | B1077: =VLOOKUP(RC[1],Sheet4!C[-1]:C[2],2,FALSE)&VLOOKUP(RC[1],Sheet4!C[-1]:C[2],3,FALSE)&RC[2]&VLOOKUP(RC[1],Sheet4!C[-1]:C[2],4,FALSE)&"（%s/"&RC[2]&"）" -> 遗迹探索4小时（%s/4） | C1077: =R[-26]C -> 19 | D1077: =R[-26]C -> 4 | E1077: =R[-26]C -> 0 | F1077: =R[-26]C -> 19003 | G1077: =R[-26]C -> 50000 | H1077: =VLOOKUP(RC[-5],Sheet4!C[-7]:C[-2],5,FALSE) -> 20
A1078: =R[-26]C+80 -> 11662 | B1078: =VLOOKUP(RC[1],Sheet4!C[-1]:C[2],2,FALSE)&VLOOKUP(RC[1],Sheet4!C[-1]:C[2],3,FALSE)&RC[2]&VLOOKUP(RC[1],Sheet4!C[-1]:C[2],4,FALSE)&"（%s/"&RC[2]&"）" -> 击杀遗迹破坏者3次（%s/3） | C1078: =R[-26]C -> 16 | D1078: =R[-26]C -> 3 | E1078: =R[-26]C -> 0 | F1078: =R[-26]C -> 19005 | G1078: =R[-26]C -> 50 | H1078: =VLOOKUP(RC[-5],Sheet4!C[-7]:C[-2],5,FALSE) -> 20
A1079: =R[-26]C+80 -> 11663 | B1079: =VLOOKUP(RC[1],Sheet4!C[-1]:C[2],2,FALSE)&VLOOKUP(RC[1],Sheet4!C[-1]:C[2],3,FALSE)&RC[2]&VLOOKUP(RC[1],Sheet4!C[-1]:C[2],4,FALSE)&"（%s/"&RC[2]&"）" -> 英雄副本战斗1次（%s/1） | C1079: =R[-26]C -> 14 | D1079: =R[-26]C -> 1 | E1079: =R[-26]C -> 0 | F1079: =R[-26]C -> 19006 | G1079: =R[-26]C -> 60 | H1079: =VLOOKUP(RC[-5],Sheet4!C[-7]:C[-2],5,FALSE) -> 27
A1080: =R[-26]C+80 -> 11671 | B1080: =VLOOKUP(RC[1],Sheet4!C[-1]:C[2],2,FALSE)&VLOOKUP(RC[1],Sheet4!C[-1]:C[2],3,FALSE)&RC[2]&VLOOKUP(RC[1],Sheet4!C[-1]:C[2],4,FALSE)&"（%s/"&RC[2]&"）" -> 遗迹探索4小时（%s/4） | C1080: =R[-26]C -> 19 | D1080: =R[-26]C -> 4 | E1080: =R[-26]C -> 0 | F1080: =R[-26]C -> 19003 | G1080: =R[-26]C -> 50000 | H1080: =VLOOKUP(RC[-5],Sheet4!C[-7]:C[-2],5,FALSE) -> 20
A1081: =R[-26]C+80 -> 11672 | B1081: =VLOOKUP(RC[1],Sheet4!C[-1]:C[2],2,FALSE)&VLOOKUP(RC[1],Sheet4!C[-1]:C[2],3,FALSE)&RC[2]&VLOOKUP(RC[1],Sheet4!C[-1]:C[2],4,FALSE)&"（%s/"&RC[2]&"）" -> 击杀遗迹破坏者3次（%s/3） | C1081: =R[-26]C -> 16 | D1081: =R[-26]C -> 3 | E1081: =R[-26]C -> 0 | F1081: =R[-26]C -> 19005 | G1081: =R[-26]C -> 50 | H1081: =VLOOKUP(RC[-5],Sheet4!C[-7]:C[-2],5,FALSE) -> 20
A1082: =R[-26]C+80 -> 11673 | B1082: =VLOOKUP(RC[1],Sheet4!C[-1]:C[2],2,FALSE)&VLOOKUP(RC[1],Sheet4!C[-1]:C[2],3,FALSE)&RC[2]&VLOOKUP(RC[1],Sheet4!C[-1]:C[2],4,FALSE)&"（%s/"&RC[2]&"）" -> 英雄副本战斗1次（%s/1） | C1082: =R[-26]C -> 14 | D1082: =R[-26]C -> 1 | E1082: =R[-26]C -> 0 | F1082: =R[-26]C -> 19006 | G1082: =R[-26]C -> 60 | H1082: =VLOOKUP(RC[-5],Sheet4!C[-7]:C[-2],5,FALSE) -> 27
A1083: =R[-26]C+80 -> 11681 | B1083: =VLOOKUP(RC[1],Sheet4!C[-1]:C[2],2,FALSE)&VLOOKUP(RC[1],Sheet4!C[-1]:C[2],3,FALSE)&RC[2]&VLOOKUP(RC[1],Sheet4!C[-1]:C[2],4,FALSE)&"（%s/"&RC[2]&"）" -> 圣器强化5次（%s/5） | C1083: =R[-26]C -> 2 | D1083: =R[-26]C -> 5 | E1083: =R[-26]C -> 0 | F1083: =R[-26]C -> 13049 | G1083: =R[-26]C -> 5 | H1083: =VLOOKUP(RC[-5],Sheet4!C[-7]:C[-2],5,FALSE) -> 8
A1084: =R[-26]C+80 -> 11682 | B1084: =VLOOKUP(RC[1],Sheet4!C[-1]:C[2],2,FALSE)&VLOOKUP(RC[1],Sheet4!C[-1]:C[2],3,FALSE)&RC[2]&VLOOKUP(RC[1],Sheet4!C[-1]:C[2],4,FALSE)&"（%s/"&RC[2]&"）" -> 圣器争夺5次（%s/5） | C1084: =R[-26]C -> 11 | D1084: =R[-26]C -> 5 | E1084: =R[-26]C -> 0 | F1084: =R[-26]C -> 13049 | G1084: =R[-26]C -> 5 | H1084: =VLOOKUP(RC[-5],Sheet4!C[-7]:C[-2],5,FALSE) -> 19
A1085: =R[-26]C+80 -> 11683 | B1085: =VLOOKUP(RC[1],Sheet4!C[-1]:C[2],2,FALSE)&VLOOKUP(RC[1],Sheet4!C[-1]:C[2],3,FALSE)&RC[2]&VLOOKUP(RC[1],Sheet4!C[-1]:C[2],4,FALSE)&"（%s/"&RC[2]&"）" -> 圣器合成3次（%s/3） | C1085: =R[-26]C -> 22 | D1085: =R[-26]C -> 3 | E1085: =R[-26]C -> 0 | F1085: =R[-26]C -> 13049 | G1085: =R[-26]C -> 5 | H1085: =VLOOKUP(RC[-5],Sheet4!C[-7]:C[-2],5,FALSE) -> 19
A1086: =R[-26]C+80 -> 11691 | B1086: =VLOOKUP(RC[1],Sheet4!C[-1]:C[2],2,FALSE)&VLOOKUP(RC[1],Sheet4!C[-1]:C[2],3,FALSE)&RC[2]&VLOOKUP(RC[1],Sheet4!C[-1]:C[2],4,FALSE)&"（%s/"&RC[2]&"）" -> 赠送好友精力3次（%s/3） | C1086: =R[-26]C -> 4 | D1086: =R[-26]C -> 3 | E1086: =R[-26]C -> 0 | F1086: =R[-26]C -> 19005 | G1086: =R[-26]C -> 40 | H1086: =VLOOKUP(RC[-5],Sheet4!C[-7]:C[-2],5,FALSE) -> 15
A1087: =R[-26]C+80 -> 11692 | B1087: =VLOOKUP(RC[1],Sheet4!C[-1]:C[2],2,FALSE)&VLOOKUP(RC[1],Sheet4!C[-1]:C[2],3,FALSE)&RC[2]&VLOOKUP(RC[1],Sheet4!C[-1]:C[2],4,FALSE)&"（%s/"&RC[2]&"）" -> 进行召唤5次（%s/5） | C1087: =R[-26]C -> 8 | D1087: =R[-26]C -> 5 | E1087: =R[-26]C -> 0 | F1087: =R[-26]C -> 19006 | G1087: =R[-26]C -> 60 | H1087: =VLOOKUP(RC[-5],Sheet4!C[-7]:C[-2],5,FALSE) -> 9
A1088: =R[-26]C+80 -> 11693 | B1088: =VLOOKUP(RC[1],Sheet4!C[-1]:C[2],2,FALSE)&VLOOKUP(RC[1],Sheet4!C[-1]:C[2],3,FALSE)&RC[2]&VLOOKUP(RC[1],Sheet4!C[-1]:C[2],4,FALSE)&"（%s/"&RC[2]&"）" -> 进行高级召唤2次（%s/2） | C1088: =R[-26]C -> 9 | D1088: =R[-26]C -> 2 | E1088: =R[-26]C -> 0 | F1088: =R[-26]C -> 19006 | G1088: =R[-26]C -> 80 | H1088: =VLOOKUP(RC[-5],Sheet4!C[-7]:C[-2],5,FALSE) -> 9
A1089: =R[-26]C+80 -> 11701 | B1089: =VLOOKUP(RC[1],Sheet4!C[-1]:C[2],2,FALSE)&VLOOKUP(RC[1],Sheet4!C[-1]:C[2],3,FALSE)&RC[2]&VLOOKUP(RC[1],Sheet4!C[-1]:C[2],4,FALSE)&"（%s/"&RC[2]&"）" -> 异度入侵分享2次（%s/2） | C1089: =R[-26]C -> 17 | D1089: =R[-26]C -> 2 | E1089: =R[-26]C -> 0 | F1089: =R[-26]C -> 19014 | G1089: =R[-26]C -> 500 | H1089: =VLOOKUP(RC[-5],Sheet4!C[-7]:C[-2],5,FALSE) -> 16
A1090: =R[-26]C+80 -> 11702 | B1090: =VLOOKUP(RC[1],Sheet4!C[-1]:C[2],2,FALSE)&VLOOKUP(RC[1],Sheet4!C[-1]:C[2],3,FALSE)&RC[2]&VLOOKUP(RC[1],Sheet4!C[-1]:C[2],4,FALSE)&"（%s/"&RC[2]&"）" -> 讨伐异度入侵者2次（%s/2） | C1090: =R[-26]C -> 18 | D1090: =R[-26]C -> 2 | E1090: =R[-26]C -> 0 | F1090: =R[-26]C -> 19014 | G1090: =R[-26]C -> 500 | H1090: =VLOOKUP(RC[-5],Sheet4!C[-7]:C[-2],5,FALSE) -> 16
A1091: =R[-26]C+80 -> 11703 | B1091: =VLOOKUP(RC[1],Sheet4!C[-1]:C[2],2,FALSE)&VLOOKUP(RC[1],Sheet4!C[-1]:C[2],3,FALSE)&RC[2]&VLOOKUP(RC[1],Sheet4!C[-1]:C[2],4,FALSE)&"（%s/"&RC[2]&"）" -> 精英副本战斗3次（%s/3） | C1091: =R[-26]C -> 15 | D1091: =R[-26]C -> 3 | E1091: =R[-26]C -> 0 | F1091: =R[-26]C -> 10008 | G1091: =R[-26]C -> 30 | H1091: =VLOOKUP(RC[-5],Sheet4!C[-7]:C[-2],5,FALSE) -> 28
A1092: =R[-26]C+80 -> 11704 | B1092: =VLOOKUP(RC[1],Sheet4!C[-1]:C[2],2,FALSE)&VLOOKUP(RC[1],Sheet4!C[-1]:C[2],3,FALSE)&RC[2]&VLOOKUP(RC[1],Sheet4!C[-1]:C[2],4,FALSE)&"（%s/"&RC[2]&"）" -> 击杀精英外敌1个（%s/1） | C1092: =R[-26]C -> 20 | D1092: =R[-26]C -> 1 | E1092: =R[-26]C -> 0 | F1092: =R[-26]C -> 10008 | G1092: =R[-26]C -> 40 | H1092: =VLOOKUP(RC[-5],Sheet4!C[-7]:C[-2],5,FALSE) -> 28
A1093: =R[-26]C+80 -> 11711 | B1093: =VLOOKUP(RC[1],Sheet4!C[-1]:C[2],2,FALSE)&VLOOKUP(RC[1],Sheet4!C[-1]:C[2],3,FALSE)&RC[2]&VLOOKUP(RC[1],Sheet4!C[-1]:C[2],4,FALSE)&"（%s/"&RC[2]&"）" -> 购买体力2次（%s/2） | C1093: =R[-26]C -> 6 | D1093: =R[-26]C -> 2 | E1093: =R[-26]C -> 0 | F1093: =R[-26]C -> 19005 | G1093: =R[-26]C -> 50 | H1093: =VLOOKUP(RC[-5],Sheet4!C[-7]:C[-2],5,FALSE) -> 12
A1094: =R[-26]C+80 -> 11712 | B1094: =VLOOKUP(RC[1],Sheet4!C[-1]:C[2],2,FALSE)&VLOOKUP(RC[1],Sheet4!C[-1]:C[2],3,FALSE)&RC[2]&VLOOKUP(RC[1],Sheet4!C[-1]:C[2],4,FALSE)&"（%s/"&RC[2]&"）" -> 购买精力2次（%s/2） | C1094: =R[-26]C -> 7 | D1094: =R[-26]C -> 2 | E1094: =R[-26]C -> 0 | F1094: =R[-26]C -> 19005 | G1094: =R[-26]C -> 50 | H1094: =VLOOKUP(RC[-5],Sheet4!C[-7]:C[-2],5,FALSE) -> 12
A1095: =R[-26]C+80 -> 11713 | B1095: =VLOOKUP(RC[1],Sheet4!C[-1]:C[2],2,FALSE)&VLOOKUP(RC[1],Sheet4!C[-1]:C[2],3,FALSE)&RC[2]&VLOOKUP(RC[1],Sheet4!C[-1]:C[2],4,FALSE)&"（%s/"&RC[2]&"）" -> 英雄培养20次（%s/20） | C1095: =R[-26]C -> 3 | D1095: =R[-26]C -> 20 | E1095: =R[-26]C -> 0 | F1095: =R[-26]C -> 10003 | G1095: =R[-26]C -> 30 | H1095: =VLOOKUP(RC[-5],Sheet4!C[-7]:C[-2],5,FALSE) -> 8
A1096: =R[-26]C+80 -> 11721 | B1096: =VLOOKUP(RC[1],Sheet4!C[-1]:C[2],2,FALSE)&VLOOKUP(RC[1],Sheet4!C[-1]:C[2],3,FALSE)&RC[2]&VLOOKUP(RC[1],Sheet4!C[-1]:C[2],4,FALSE)&"（%s/"&RC[2]&"）" -> 无尽深渊战斗1次（%s/1） | C1096: =R[-26]C -> 23 | D1096: =R[-26]C -> 1 | E1096: =R[-26]C -> 0 | F1096: =R[-26]C -> 19028 | G1096: =R[-26]C -> 50 | H1096: =VLOOKUP(RC[-5],Sheet4!C[-7]:C[-2],5,FALSE) -> 88
A1097: =R[-26]C+80 -> 11722 | B1097: =VLOOKUP(RC[1],Sheet4!C[-1]:C[2],2,FALSE)&VLOOKUP(RC[1],Sheet4!C[-1]:C[2],3,FALSE)&RC[2]&VLOOKUP(RC[1],Sheet4!C[-1]:C[2],4,FALSE)&"（%s/"&RC[2]&"）" -> 进入勇者试练战斗10次（%s/10） | C1097: =R[-26]C -> 12 | D1097: =R[-26]C -> 10 | E1097: =R[-26]C -> 0 | F1097: =R[-26]C -> 19012 | G1097: =R[-26]C -> 500 | H1097: =VLOOKUP(RC[-5],Sheet4!C[-7]:C[-2],5,FALSE) -> 17
A1098: =R[-26]C+80 -> 11723 | B1098: =VLOOKUP(RC[1],Sheet4!C[-1]:C[2],2,FALSE)&VLOOKUP(RC[1],Sheet4!C[-1]:C[2],3,FALSE)&RC[2]&VLOOKUP(RC[1],Sheet4!C[-1]:C[2],4,FALSE)&"（%s/"&RC[2]&"）" -> 竞技场战斗5次（%s/5） | C1098: =R[-26]C -> 10 | D1098: =R[-26]C -> 5 | E1098: =R[-26]C -> 0 | F1098: =R[-26]C -> 19013 | G1098: =R[-26]C -> 500 | H1098: =VLOOKUP(RC[-5],Sheet4!C[-7]:C[-2],5,FALSE) -> 21
A1099: =R[-26]C+80 -> 11724 | B1099: =VLOOKUP(RC[1],Sheet4!C[-1]:C[2],2,FALSE)&VLOOKUP(RC[1],Sheet4!C[-1]:C[2],3,FALSE)&RC[2]&VLOOKUP(RC[1],Sheet4!C[-1]:C[2],4,FALSE)&"（%s/"&RC[2]&"）" -> 主线副本挑战5次（%s/5） | C1099: =R[-26]C -> 1 | D1099: =R[-26]C -> 5 | E1099: =R[-26]C -> 0 | F1099: =R[-26]C -> 19003 | G1099: =R[-26]C -> 50000 | H1099: =VLOOKUP(RC[-5],Sheet4!C[-7]:C[-2],5,FALSE) -> 26
A1100: =R[-26]C+80 -> 11731 | B1100: =VLOOKUP(RC[1],Sheet4!C[-1]:C[2],2,FALSE)&VLOOKUP(RC[1],Sheet4!C[-1]:C[2],3,FALSE)&RC[2]&VLOOKUP(RC[1],Sheet4!C[-1]:C[2],4,FALSE)&"（%s/"&RC[2]&"）" -> 占卜翻牌5次（%s/5） | C1100: =R[-26]C -> 25 | D1100: =R[-26]C -> 5 | E1100: =R[-26]C -> 0 | F1100: =R[-26]C -> 10096 | G1100: =R[-26]C -> 1 | H1100: =VLOOKUP(RC[-5],Sheet4!C[-7]:C[-2],5,FALSE) -> 113
A1101: =R[-26]C+80 -> 11732 | B1101: =VLOOKUP(RC[1],Sheet4!C[-1]:C[2],2,FALSE)&VLOOKUP(RC[1],Sheet4!C[-1]:C[2],3,FALSE)&RC[2]&VLOOKUP(RC[1],Sheet4!C[-1]:C[2],4,FALSE)&"（%s/"&RC[2]&"）" -> 英雄商店购买1次（%s/1） | C1101: =R[-26]C -> 5 | D1101: =R[-26]C -> 1 | E1101: =R[-26]C -> 0 | F1101: =R[-26]C -> 19006 | G1101: =R[-26]C -> 60 | H1101: =VLOOKUP(RC[-5],Sheet4!C[-7]:C[-2],5,FALSE) -> 11
A1102: =R[-26]C+80 -> 11733 | B1102: =VLOOKUP(RC[1],Sheet4!C[-1]:C[2],2,FALSE)&VLOOKUP(RC[1],Sheet4!C[-1]:C[2],3,FALSE)&RC[2]&VLOOKUP(RC[1],Sheet4!C[-1]:C[2],4,FALSE)&"（%s/"&RC[2]&"）" -> 日常副本战斗4次（%s/4） | C1102: =R[-26]C -> 13 | D1102: =R[-26]C -> 4 | E1102: =R[-26]C -> 0 | F1102: =R[-26]C -> 19005 | G1102: =R[-26]C -> 50 | H1102: =VLOOKUP(RC[-5],Sheet4!C[-7]:C[-2],5,FALSE) -> 2
A1103: =R[-26]C+80 -> 11741 | B1103: =VLOOKUP(RC[1],Sheet4!C[-1]:C[2],2,FALSE)&VLOOKUP(RC[1],Sheet4!C[-1]:C[2],3,FALSE)&RC[2]&VLOOKUP(RC[1],Sheet4!C[-1]:C[2],4,FALSE)&"（%s/"&RC[2]&"）" -> 遗迹探索4小时（%s/4） | C1103: =R[-26]C -> 19 | D1103: =R[-26]C -> 4 | E1103: =R[-26]C -> 0 | F1103: =R[-26]C -> 19003 | G1103: =R[-26]C -> 50000 | H1103: =VLOOKUP(RC[-5],Sheet4!C[-7]:C[-2],5,FALSE) -> 20
A1104: =R[-26]C+80 -> 11742 | B1104: =VLOOKUP(RC[1],Sheet4!C[-1]:C[2],2,FALSE)&VLOOKUP(RC[1],Sheet4!C[-1]:C[2],3,FALSE)&RC[2]&VLOOKUP(RC[1],Sheet4!C[-1]:C[2],4,FALSE)&"（%s/"&RC[2]&"）" -> 击杀遗迹破坏者3次（%s/3） | C1104: =R[-26]C -> 16 | D1104: =R[-26]C -> 3 | E1104: =R[-26]C -> 0 | F1104: =R[-26]C -> 19005 | G1104: =R[-26]C -> 50 | H1104: =VLOOKUP(RC[-5],Sheet4!C[-7]:C[-2],5,FALSE) -> 20
A1105: =R[-26]C+80 -> 11743 | B1105: =VLOOKUP(RC[1],Sheet4!C[-1]:C[2],2,FALSE)&VLOOKUP(RC[1],Sheet4!C[-1]:C[2],3,FALSE)&RC[2]&VLOOKUP(RC[1],Sheet4!C[-1]:C[2],4,FALSE)&"（%s/"&RC[2]&"）" -> 英雄副本战斗1次（%s/1） | C1105: =R[-26]C -> 14 | D1105: =R[-26]C -> 1 | E1105: =R[-26]C -> 0 | F1105: =R[-26]C -> 19006 | G1105: =R[-26]C -> 60 | H1105: =VLOOKUP(RC[-5],Sheet4!C[-7]:C[-2],5,FALSE) -> 27
A1106: =R[-26]C+80 -> 11751 | B1106: =VLOOKUP(RC[1],Sheet4!C[-1]:C[2],2,FALSE)&VLOOKUP(RC[1],Sheet4!C[-1]:C[2],3,FALSE)&RC[2]&VLOOKUP(RC[1],Sheet4!C[-1]:C[2],4,FALSE)&"（%s/"&RC[2]&"）" -> 遗迹探索4小时（%s/4） | C1106: =R[-26]C -> 19 | D1106: =R[-26]C -> 4 | E1106: =R[-26]C -> 0 | F1106: =R[-26]C -> 19003 | G1106: =R[-26]C -> 50000 | H1106: =VLOOKUP(RC[-5],Sheet4!C[-7]:C[-2],5,FALSE) -> 20
A1107: =R[-26]C+80 -> 11752 | B1107: =VLOOKUP(RC[1],Sheet4!C[-1]:C[2],2,FALSE)&VLOOKUP(RC[1],Sheet4!C[-1]:C[2],3,FALSE)&RC[2]&VLOOKUP(RC[1],Sheet4!C[-1]:C[2],4,FALSE)&"（%s/"&RC[2]&"）" -> 击杀遗迹破坏者3次（%s/3） | C1107: =R[-26]C -> 16 | D1107: =R[-26]C -> 3 | E1107: =R[-26]C -> 0 | F1107: =R[-26]C -> 19005 | G1107: =R[-26]C -> 50 | H1107: =VLOOKUP(RC[-5],Sheet4!C[-7]:C[-2],5,FALSE) -> 20
A1108: =R[-26]C+80 -> 11753 | B1108: =VLOOKUP(RC[1],Sheet4!C[-1]:C[2],2,FALSE)&VLOOKUP(RC[1],Sheet4!C[-1]:C[2],3,FALSE)&RC[2]&VLOOKUP(RC[1],Sheet4!C[-1]:C[2],4,FALSE)&"（%s/"&RC[2]&"）" -> 英雄副本战斗1次（%s/1） | C1108: =R[-26]C -> 14 | D1108: =R[-26]C -> 1 | E1108: =R[-26]C -> 0 | F1108: =R[-26]C -> 19006 | G1108: =R[-26]C -> 60 | H1108: =VLOOKUP(RC[-5],Sheet4!C[-7]:C[-2],5,FALSE) -> 27
A1109: =R[-26]C+80 -> 11761 | B1109: =VLOOKUP(RC[1],Sheet4!C[-1]:C[2],2,FALSE)&VLOOKUP(RC[1],Sheet4!C[-1]:C[2],3,FALSE)&RC[2]&VLOOKUP(RC[1],Sheet4!C[-1]:C[2],4,FALSE)&"（%s/"&RC[2]&"）" -> 圣器强化5次（%s/5） | C1109: =R[-26]C -> 2 | D1109: =R[-26]C -> 5 | E1109: =R[-26]C -> 0 | F1109: =R[-26]C -> 13049 | G1109: =R[-26]C -> 5 | H1109: =VLOOKUP(RC[-5],Sheet4!C[-7]:C[-2],5,FALSE) -> 8
A1110: =R[-26]C+80 -> 11762 | B1110: =VLOOKUP(RC[1],Sheet4!C[-1]:C[2],2,FALSE)&VLOOKUP(RC[1],Sheet4!C[-1]:C[2],3,FALSE)&RC[2]&VLOOKUP(RC[1],Sheet4!C[-1]:C[2],4,FALSE)&"（%s/"&RC[2]&"）" -> 圣器争夺5次（%s/5） | C1110: =R[-26]C -> 11 | D1110: =R[-26]C -> 5 | E1110: =R[-26]C -> 0 | F1110: =R[-26]C -> 13049 | G1110: =R[-26]C -> 5 | H1110: =VLOOKUP(RC[-5],Sheet4!C[-7]:C[-2],5,FALSE) -> 19
A1111: =R[-26]C+80 -> 11763 | B1111: =VLOOKUP(RC[1],Sheet4!C[-1]:C[2],2,FALSE)&VLOOKUP(RC[1],Sheet4!C[-1]:C[2],3,FALSE)&RC[2]&VLOOKUP(RC[1],Sheet4!C[-1]:C[2],4,FALSE)&"（%s/"&RC[2]&"）" -> 圣器合成3次（%s/3） | C1111: =R[-26]C -> 22 | D1111: =R[-26]C -> 3 | E1111: =R[-26]C -> 0 | F1111: =R[-26]C -> 13049 | G1111: =R[-26]C -> 5 | H1111: =VLOOKUP(RC[-5],Sheet4!C[-7]:C[-2],5,FALSE) -> 19
A1112: =R[-26]C+80 -> 11771 | B1112: =VLOOKUP(RC[1],Sheet4!C[-1]:C[2],2,FALSE)&VLOOKUP(RC[1],Sheet4!C[-1]:C[2],3,FALSE)&RC[2]&VLOOKUP(RC[1],Sheet4!C[-1]:C[2],4,FALSE)&"（%s/"&RC[2]&"）" -> 赠送好友精力3次（%s/3） | C1112: =R[-26]C -> 4 | D1112: =R[-26]C -> 3 | E1112: =R[-26]C -> 0 | F1112: =R[-26]C -> 19005 | G1112: =R[-26]C -> 40 | H1112: =VLOOKUP(RC[-5],Sheet4!C[-7]:C[-2],5,FALSE) -> 15
A1113: =R[-26]C+80 -> 11772 | B1113: =VLOOKUP(RC[1],Sheet4!C[-1]:C[2],2,FALSE)&VLOOKUP(RC[1],Sheet4!C[-1]:C[2],3,FALSE)&RC[2]&VLOOKUP(RC[1],Sheet4!C[-1]:C[2],4,FALSE)&"（%s/"&RC[2]&"）" -> 进行召唤5次（%s/5） | C1113: =R[-26]C -> 8 | D1113: =R[-26]C -> 5 | E1113: =R[-26]C -> 0 | F1113: =R[-26]C -> 19006 | G1113: =R[-26]C -> 60 | H1113: =VLOOKUP(RC[-5],Sheet4!C[-7]:C[-2],5,FALSE) -> 9
A1114: =R[-26]C+80 -> 11773 | B1114: =VLOOKUP(RC[1],Sheet4!C[-1]:C[2],2,FALSE)&VLOOKUP(RC[1],Sheet4!C[-1]:C[2],3,FALSE)&RC[2]&VLOOKUP(RC[1],Sheet4!C[-1]:C[2],4,FALSE)&"（%s/"&RC[2]&"）" -> 进行高级召唤2次（%s/2） | C1114: =R[-26]C -> 9 | D1114: =R[-26]C -> 2 | E1114: =R[-26]C -> 0 | F1114: =R[-26]C -> 19006 | G1114: =R[-26]C -> 80 | H1114: =VLOOKUP(RC[-5],Sheet4!C[-7]:C[-2],5,FALSE) -> 9
A1115: =R[-26]C+80 -> 11781 | B1115: =VLOOKUP(RC[1],Sheet4!C[-1]:C[2],2,FALSE)&VLOOKUP(RC[1],Sheet4!C[-1]:C[2],3,FALSE)&RC[2]&VLOOKUP(RC[1],Sheet4!C[-1]:C[2],4,FALSE)&"（%s/"&RC[2]&"）" -> 异度入侵分享2次（%s/2） | C1115: =R[-26]C -> 17 | D1115: =R[-26]C -> 2 | E1115: =R[-26]C -> 0 | F1115: =R[-26]C -> 19014 | G1115: =R[-26]C -> 500 | H1115: =VLOOKUP(RC[-5],Sheet4!C[-7]:C[-2],5,FALSE) -> 16
A1116: =R[-26]C+80 -> 11782 | B1116: =VLOOKUP(RC[1],Sheet4!C[-1]:C[2],2,FALSE)&VLOOKUP(RC[1],Sheet4!C[-1]:C[2],3,FALSE)&RC[2]&VLOOKUP(RC[1],Sheet4!C[-1]:C[2],4,FALSE)&"（%s/"&RC[2]&"）" -> 讨伐异度入侵者2次（%s/2） | C1116: =R[-26]C -> 18 | D1116: =R[-26]C -> 2 | E1116: =R[-26]C -> 0 | F1116: =R[-26]C -> 19014 | G1116: =R[-26]C -> 500 | H1116: =VLOOKUP(RC[-5],Sheet4!C[-7]:C[-2],5,FALSE) -> 16
A1117: =R[-26]C+80 -> 11783 | B1117: =VLOOKUP(RC[1],Sheet4!C[-1]:C[2],2,FALSE)&VLOOKUP(RC[1],Sheet4!C[-1]:C[2],3,FALSE)&RC[2]&VLOOKUP(RC[1],Sheet4!C[-1]:C[2],4,FALSE)&"（%s/"&RC[2]&"）" -> 精英副本战斗3次（%s/3） | C1117: =R[-26]C -> 15 | D1117: =R[-26]C -> 3 | E1117: =R[-26]C -> 0 | F1117: =R[-26]C -> 10008 | G1117: =R[-26]C -> 30 | H1117: =VLOOKUP(RC[-5],Sheet4!C[-7]:C[-2],5,FALSE) -> 28
A1118: =R[-26]C+80 -> 11784 | B1118: =VLOOKUP(RC[1],Sheet4!C[-1]:C[2],2,FALSE)&VLOOKUP(RC[1],Sheet4!C[-1]:C[2],3,FALSE)&RC[2]&VLOOKUP(RC[1],Sheet4!C[-1]:C[2],4,FALSE)&"（%s/"&RC[2]&"）" -> 击杀精英外敌1个（%s/1） | C1118: =R[-26]C -> 20 | D1118: =R[-26]C -> 1 | E1118: =R[-26]C -> 0 | F1118: =R[-26]C -> 10008 | G1118: =R[-26]C -> 40 | H1118: =VLOOKUP(RC[-5],Sheet4!C[-7]:C[-2],5,FALSE) -> 28
A1119: =R[-26]C+80 -> 11791 | B1119: =VLOOKUP(RC[1],Sheet4!C[-1]:C[2],2,FALSE)&VLOOKUP(RC[1],Sheet4!C[-1]:C[2],3,FALSE)&RC[2]&VLOOKUP(RC[1],Sheet4!C[-1]:C[2],4,FALSE)&"（%s/"&RC[2]&"）" -> 购买体力2次（%s/2） | C1119: =R[-26]C -> 6 | D1119: =R[-26]C -> 2 | E1119: =R[-26]C -> 0 | F1119: =R[-26]C -> 19005 | G1119: =R[-26]C -> 50 | H1119: =VLOOKUP(RC[-5],Sheet4!C[-7]:C[-2],5,FALSE) -> 12
A1120: =R[-26]C+80 -> 11792 | B1120: =VLOOKUP(RC[1],Sheet4!C[-1]:C[2],2,FALSE)&VLOOKUP(RC[1],Sheet4!C[-1]:C[2],3,FALSE)&RC[2]&VLOOKUP(RC[1],Sheet4!C[-1]:C[2],4,FALSE)&"（%s/"&RC[2]&"）" -> 购买精力2次（%s/2） | C1120: =R[-26]C -> 7 | D1120: =R[-26]C -> 2 | E1120: =R[-26]C -> 0 | F1120: =R[-26]C -> 19005 | G1120: =R[-26]C -> 50 | H1120: =VLOOKUP(RC[-5],Sheet4!C[-7]:C[-2],5,FALSE) -> 12
A1121: =R[-26]C+80 -> 11793 | B1121: =VLOOKUP(RC[1],Sheet4!C[-1]:C[2],2,FALSE)&VLOOKUP(RC[1],Sheet4!C[-1]:C[2],3,FALSE)&RC[2]&VLOOKUP(RC[1],Sheet4!C[-1]:C[2],4,FALSE)&"（%s/"&RC[2]&"）" -> 英雄培养20次（%s/20） | C1121: =R[-26]C -> 3 | D1121: =R[-26]C -> 20 | E1121: =R[-26]C -> 0 | F1121: =R[-26]C -> 10003 | G1121: =R[-26]C -> 30 | H1121: =VLOOKUP(RC[-5],Sheet4!C[-7]:C[-2],5,FALSE) -> 8
A1122: =R[-26]C+80 -> 11801 | B1122: =VLOOKUP(RC[1],Sheet4!C[-1]:C[2],2,FALSE)&VLOOKUP(RC[1],Sheet4!C[-1]:C[2],3,FALSE)&RC[2]&VLOOKUP(RC[1],Sheet4!C[-1]:C[2],4,FALSE)&"（%s/"&RC[2]&"）" -> 无尽深渊战斗1次（%s/1） | C1122: =R[-26]C -> 23 | D1122: =R[-26]C -> 1 | E1122: =R[-26]C -> 0 | F1122: =R[-26]C -> 19028 | G1122: =R[-26]C -> 50 | H1122: =VLOOKUP(RC[-5],Sheet4!C[-7]:C[-2],5,FALSE) -> 88
A1123: =R[-26]C+80 -> 11802 | B1123: =VLOOKUP(RC[1],Sheet4!C[-1]:C[2],2,FALSE)&VLOOKUP(RC[1],Sheet4!C[-1]:C[2],3,FALSE)&RC[2]&VLOOKUP(RC[1],Sheet4!C[-1]:C[2],4,FALSE)&"（%s/"&RC[2]&"）" -> 进入勇者试练战斗10次（%s/10） | C1123: =R[-26]C -> 12 | D1123: =R[-26]C -> 10 | E1123: =R[-26]C -> 0 | F1123: =R[-26]C -> 19012 | G1123: =R[-26]C -> 500 | H1123: =VLOOKUP(RC[-5],Sheet4!C[-7]:C[-2],5,FALSE) -> 17
A1124: =R[-26]C+80 -> 11803 | B1124: =VLOOKUP(RC[1],Sheet4!C[-1]:C[2],2,FALSE)&VLOOKUP(RC[1],Sheet4!C[-1]:C[2],3,FALSE)&RC[2]&VLOOKUP(RC[1],Sheet4!C[-1]:C[2],4,FALSE)&"（%s/"&RC[2]&"）" -> 竞技场战斗5次（%s/5） | C1124: =R[-26]C -> 10 | D1124: =R[-26]C -> 5 | E1124: =R[-26]C -> 0 | F1124: =R[-26]C -> 19013 | G1124: =R[-26]C -> 500 | H1124: =VLOOKUP(RC[-5],Sheet4!C[-7]:C[-2],5,FALSE) -> 21
A1125: =R[-26]C+80 -> 11804 | B1125: =VLOOKUP(RC[1],Sheet4!C[-1]:C[2],2,FALSE)&VLOOKUP(RC[1],Sheet4!C[-1]:C[2],3,FALSE)&RC[2]&VLOOKUP(RC[1],Sheet4!C[-1]:C[2],4,FALSE)&"（%s/"&RC[2]&"）" -> 主线副本挑战5次（%s/5） | C1125: =R[-26]C -> 1 | D1125: =R[-26]C -> 5 | E1125: =R[-26]C -> 0 | F1125: =R[-26]C -> 19003 | G1125: =R[-26]C -> 50000 | H1125: =VLOOKUP(RC[-5],Sheet4!C[-7]:C[-2],5,FALSE) -> 26
A1126: =R[-26]C+80 -> 11811 | B1126: =VLOOKUP(RC[1],Sheet4!C[-1]:C[2],2,FALSE)&VLOOKUP(RC[1],Sheet4!C[-1]:C[2],3,FALSE)&RC[2]&VLOOKUP(RC[1],Sheet4!C[-1]:C[2],4,FALSE)&"（%s/"&RC[2]&"）" -> 占卜翻牌5次（%s/5） | C1126: =R[-26]C -> 25 | D1126: =R[-26]C -> 5 | E1126: =R[-26]C -> 0 | F1126: =R[-26]C -> 10096 | G1126: =R[-26]C -> 1 | H1126: =VLOOKUP(RC[-5],Sheet4!C[-7]:C[-2],5,FALSE) -> 113
A1127: =R[-26]C+80 -> 11812 | B1127: =VLOOKUP(RC[1],Sheet4!C[-1]:C[2],2,FALSE)&VLOOKUP(RC[1],Sheet4!C[-1]:C[2],3,FALSE)&RC[2]&VLOOKUP(RC[1],Sheet4!C[-1]:C[2],4,FALSE)&"（%s/"&RC[2]&"）" -> 英雄商店购买1次（%s/1） | C1127: =R[-26]C -> 5 | D1127: =R[-26]C -> 1 | E1127: =R[-26]C -> 0 | F1127: =R[-26]C -> 19006 | G1127: =R[-26]C -> 60 | H1127: =VLOOKUP(RC[-5],Sheet4!C[-7]:C[-2],5,FALSE) -> 11
A1128: =R[-26]C+80 -> 11813 | B1128: =VLOOKUP(RC[1],Sheet4!C[-1]:C[2],2,FALSE)&VLOOKUP(RC[1],Sheet4!C[-1]:C[2],3,FALSE)&RC[2]&VLOOKUP(RC[1],Sheet4!C[-1]:C[2],4,FALSE)&"（%s/"&RC[2]&"）" -> 日常副本战斗4次（%s/4） | C1128: =R[-26]C -> 13 | D1128: =R[-26]C -> 4 | E1128: =R[-26]C -> 0 | F1128: =R[-26]C -> 19005 | G1128: =R[-26]C -> 50 | H1128: =VLOOKUP(RC[-5],Sheet4!C[-7]:C[-2],5,FALSE) -> 2
A1129: =R[-26]C+80 -> 11821 | B1129: =VLOOKUP(RC[1],Sheet4!C[-1]:C[2],2,FALSE)&VLOOKUP(RC[1],Sheet4!C[-1]:C[2],3,FALSE)&RC[2]&VLOOKUP(RC[1],Sheet4!C[-1]:C[2],4,FALSE)&"（%s/"&RC[2]&"）" -> 遗迹探索4小时（%s/4） | C1129: =R[-26]C -> 19 | D1129: =R[-26]C -> 4 | E1129: =R[-26]C -> 0 | F1129: =R[-26]C -> 19003 | G1129: =R[-26]C -> 50000 | H1129: =VLOOKUP(RC[-5],Sheet4!C[-7]:C[-2],5,FALSE) -> 20
A1130: =R[-26]C+80 -> 11822 | B1130: =VLOOKUP(RC[1],Sheet4!C[-1]:C[2],2,FALSE)&VLOOKUP(RC[1],Sheet4!C[-1]:C[2],3,FALSE)&RC[2]&VLOOKUP(RC[1],Sheet4!C[-1]:C[2],4,FALSE)&"（%s/"&RC[2]&"）" -> 击杀遗迹破坏者3次（%s/3） | C1130: =R[-26]C -> 16 | D1130: =R[-26]C -> 3 | E1130: =R[-26]C -> 0 | F1130: =R[-26]C -> 19005 | G1130: =R[-26]C -> 50 | H1130: =VLOOKUP(RC[-5],Sheet4!C[-7]:C[-2],5,FALSE) -> 20
A1131: =R[-26]C+80 -> 11823 | B1131: =VLOOKUP(RC[1],Sheet4!C[-1]:C[2],2,FALSE)&VLOOKUP(RC[1],Sheet4!C[-1]:C[2],3,FALSE)&RC[2]&VLOOKUP(RC[1],Sheet4!C[-1]:C[2],4,FALSE)&"（%s/"&RC[2]&"）" -> 英雄副本战斗1次（%s/1） | C1131: =R[-26]C -> 14 | D1131: =R[-26]C -> 1 | E1131: =R[-26]C -> 0 | F1131: =R[-26]C -> 19006 | G1131: =R[-26]C -> 60 | H1131: =VLOOKUP(RC[-5],Sheet4!C[-7]:C[-2],5,FALSE) -> 27
A1132: =R[-26]C+80 -> 11831 | B1132: =VLOOKUP(RC[1],Sheet4!C[-1]:C[2],2,FALSE)&VLOOKUP(RC[1],Sheet4!C[-1]:C[2],3,FALSE)&RC[2]&VLOOKUP(RC[1],Sheet4!C[-1]:C[2],4,FALSE)&"（%s/"&RC[2]&"）" -> 遗迹探索4小时（%s/4） | C1132: =R[-26]C -> 19 | D1132: =R[-26]C -> 4 | E1132: =R[-26]C -> 0 | F1132: =R[-26]C -> 19003 | G1132: =R[-26]C -> 50000 | H1132: =VLOOKUP(RC[-5],Sheet4!C[-7]:C[-2],5,FALSE) -> 20
A1133: =R[-26]C+80 -> 11832 | B1133: =VLOOKUP(RC[1],Sheet4!C[-1]:C[2],2,FALSE)&VLOOKUP(RC[1],Sheet4!C[-1]:C[2],3,FALSE)&RC[2]&VLOOKUP(RC[1],Sheet4!C[-1]:C[2],4,FALSE)&"（%s/"&RC[2]&"）" -> 击杀遗迹破坏者3次（%s/3） | C1133: =R[-26]C -> 16 | D1133: =R[-26]C -> 3 | E1133: =R[-26]C -> 0 | F1133: =R[-26]C -> 19005 | G1133: =R[-26]C -> 50 | H1133: =VLOOKUP(RC[-5],Sheet4!C[-7]:C[-2],5,FALSE) -> 20
A1134: =R[-26]C+80 -> 11833 | B1134: =VLOOKUP(RC[1],Sheet4!C[-1]:C[2],2,FALSE)&VLOOKUP(RC[1],Sheet4!C[-1]:C[2],3,FALSE)&RC[2]&VLOOKUP(RC[1],Sheet4!C[-1]:C[2],4,FALSE)&"（%s/"&RC[2]&"）" -> 英雄副本战斗1次（%s/1） | C1134: =R[-26]C -> 14 | D1134: =R[-26]C -> 1 | E1134: =R[-26]C -> 0 | F1134: =R[-26]C -> 19006 | G1134: =R[-26]C -> 60 | H1134: =VLOOKUP(RC[-5],Sheet4!C[-7]:C[-2],5,FALSE) -> 27
A1135: =R[-26]C+80 -> 11841 | B1135: =VLOOKUP(RC[1],Sheet4!C[-1]:C[2],2,FALSE)&VLOOKUP(RC[1],Sheet4!C[-1]:C[2],3,FALSE)&RC[2]&VLOOKUP(RC[1],Sheet4!C[-1]:C[2],4,FALSE)&"（%s/"&RC[2]&"）" -> 圣器强化5次（%s/5） | C1135: =R[-26]C -> 2 | D1135: =R[-26]C -> 5 | E1135: =R[-26]C -> 0 | F1135: =R[-26]C -> 13049 | G1135: =R[-26]C -> 5 | H1135: =VLOOKUP(RC[-5],Sheet4!C[-7]:C[-2],5,FALSE) -> 8
A1136: =R[-26]C+80 -> 11842 | B1136: =VLOOKUP(RC[1],Sheet4!C[-1]:C[2],2,FALSE)&VLOOKUP(RC[1],Sheet4!C[-1]:C[2],3,FALSE)&RC[2]&VLOOKUP(RC[1],Sheet4!C[-1]:C[2],4,FALSE)&"（%s/"&RC[2]&"）" -> 圣器争夺5次（%s/5） | C1136: =R[-26]C -> 11 | D1136: =R[-26]C -> 5 | E1136: =R[-26]C -> 0 | F1136: =R[-26]C -> 13049 | G1136: =R[-26]C -> 5 | H1136: =VLOOKUP(RC[-5],Sheet4!C[-7]:C[-2],5,FALSE) -> 19
A1137: =R[-26]C+80 -> 11843 | B1137: =VLOOKUP(RC[1],Sheet4!C[-1]:C[2],2,FALSE)&VLOOKUP(RC[1],Sheet4!C[-1]:C[2],3,FALSE)&RC[2]&VLOOKUP(RC[1],Sheet4!C[-1]:C[2],4,FALSE)&"（%s/"&RC[2]&"）" -> 圣器合成3次（%s/3） | C1137: =R[-26]C -> 22 | D1137: =R[-26]C -> 3 | E1137: =R[-26]C -> 0 | F1137: =R[-26]C -> 13049 | G1137: =R[-26]C -> 5 | H1137: =VLOOKUP(RC[-5],Sheet4!C[-7]:C[-2],5,FALSE) -> 19
A1138: =R[-26]C+80 -> 11851 | B1138: =VLOOKUP(RC[1],Sheet4!C[-1]:C[2],2,FALSE)&VLOOKUP(RC[1],Sheet4!C[-1]:C[2],3,FALSE)&RC[2]&VLOOKUP(RC[1],Sheet4!C[-1]:C[2],4,FALSE)&"（%s/"&RC[2]&"）" -> 赠送好友精力3次（%s/3） | C1138: =R[-26]C -> 4 | D1138: =R[-26]C -> 3 | E1138: =R[-26]C -> 0 | F1138: =R[-26]C -> 19005 | G1138: =R[-26]C -> 40 | H1138: =VLOOKUP(RC[-5],Sheet4!C[-7]:C[-2],5,FALSE) -> 15
A1139: =R[-26]C+80 -> 11852 | B1139: =VLOOKUP(RC[1],Sheet4!C[-1]:C[2],2,FALSE)&VLOOKUP(RC[1],Sheet4!C[-1]:C[2],3,FALSE)&RC[2]&VLOOKUP(RC[1],Sheet4!C[-1]:C[2],4,FALSE)&"（%s/"&RC[2]&"）" -> 进行召唤5次（%s/5） | C1139: =R[-26]C -> 8 | D1139: =R[-26]C -> 5 | E1139: =R[-26]C -> 0 | F1139: =R[-26]C -> 19006 | G1139: =R[-26]C -> 60 | H1139: =VLOOKUP(RC[-5],Sheet4!C[-7]:C[-2],5,FALSE) -> 9
A1140: =R[-26]C+80 -> 11853 | B1140: =VLOOKUP(RC[1],Sheet4!C[-1]:C[2],2,FALSE)&VLOOKUP(RC[1],Sheet4!C[-1]:C[2],3,FALSE)&RC[2]&VLOOKUP(RC[1],Sheet4!C[-1]:C[2],4,FALSE)&"（%s/"&RC[2]&"）" -> 进行高级召唤2次（%s/2） | C1140: =R[-26]C -> 9 | D1140: =R[-26]C -> 2 | E1140: =R[-26]C -> 0 | F1140: =R[-26]C -> 19006 | G1140: =R[-26]C -> 80 | H1140: =VLOOKUP(RC[-5],Sheet4!C[-7]:C[-2],5,FALSE) -> 9
A1141: =R[-26]C+80 -> 11861 | B1141: =VLOOKUP(RC[1],Sheet4!C[-1]:C[2],2,FALSE)&VLOOKUP(RC[1],Sheet4!C[-1]:C[2],3,FALSE)&RC[2]&VLOOKUP(RC[1],Sheet4!C[-1]:C[2],4,FALSE)&"（%s/"&RC[2]&"）" -> 异度入侵分享2次（%s/2） | C1141: =R[-26]C -> 17 | D1141: =R[-26]C -> 2 | E1141: =R[-26]C -> 0 | F1141: =R[-26]C -> 19014 | G1141: =R[-26]C -> 500 | H1141: =VLOOKUP(RC[-5],Sheet4!C[-7]:C[-2],5,FALSE) -> 16
A1142: =R[-26]C+80 -> 11862 | B1142: =VLOOKUP(RC[1],Sheet4!C[-1]:C[2],2,FALSE)&VLOOKUP(RC[1],Sheet4!C[-1]:C[2],3,FALSE)&RC[2]&VLOOKUP(RC[1],Sheet4!C[-1]:C[2],4,FALSE)&"（%s/"&RC[2]&"）" -> 讨伐异度入侵者2次（%s/2） | C1142: =R[-26]C -> 18 | D1142: =R[-26]C -> 2 | E1142: =R[-26]C -> 0 | F1142: =R[-26]C -> 19014 | G1142: =R[-26]C -> 500 | H1142: =VLOOKUP(RC[-5],Sheet4!C[-7]:C[-2],5,FALSE) -> 16
A1143: =R[-26]C+80 -> 11863 | B1143: =VLOOKUP(RC[1],Sheet4!C[-1]:C[2],2,FALSE)&VLOOKUP(RC[1],Sheet4!C[-1]:C[2],3,FALSE)&RC[2]&VLOOKUP(RC[1],Sheet4!C[-1]:C[2],4,FALSE)&"（%s/"&RC[2]&"）" -> 精英副本战斗3次（%s/3） | C1143: =R[-26]C -> 15 | D1143: =R[-26]C -> 3 | E1143: =R[-26]C -> 0 | F1143: =R[-26]C -> 10008 | G1143: =R[-26]C -> 30 | H1143: =VLOOKUP(RC[-5],Sheet4!C[-7]:C[-2],5,FALSE) -> 28
A1144: =R[-26]C+80 -> 11864 | B1144: =VLOOKUP(RC[1],Sheet4!C[-1]:C[2],2,FALSE)&VLOOKUP(RC[1],Sheet4!C[-1]:C[2],3,FALSE)&RC[2]&VLOOKUP(RC[1],Sheet4!C[-1]:C[2],4,FALSE)&"（%s/"&RC[2]&"）" -> 击杀精英外敌1个（%s/1） | C1144: =R[-26]C -> 20 | D1144: =R[-26]C -> 1 | E1144: =R[-26]C -> 0 | F1144: =R[-26]C -> 10008 | G1144: =R[-26]C -> 40 | H1144: =VLOOKUP(RC[-5],Sheet4!C[-7]:C[-2],5,FALSE) -> 28
A1145: =R[-26]C+80 -> 11871 | B1145: =VLOOKUP(RC[1],Sheet4!C[-1]:C[2],2,FALSE)&VLOOKUP(RC[1],Sheet4!C[-1]:C[2],3,FALSE)&RC[2]&VLOOKUP(RC[1],Sheet4!C[-1]:C[2],4,FALSE)&"（%s/"&RC[2]&"）" -> 购买体力2次（%s/2） | C1145: =R[-26]C -> 6 | D1145: =R[-26]C -> 2 | E1145: =R[-26]C -> 0 | F1145: =R[-26]C -> 19005 | G1145: =R[-26]C -> 50 | H1145: =VLOOKUP(RC[-5],Sheet4!C[-7]:C[-2],5,FALSE) -> 12
A1146: =R[-26]C+80 -> 11872 | B1146: =VLOOKUP(RC[1],Sheet4!C[-1]:C[2],2,FALSE)&VLOOKUP(RC[1],Sheet4!C[-1]:C[2],3,FALSE)&RC[2]&VLOOKUP(RC[1],Sheet4!C[-1]:C[2],4,FALSE)&"（%s/"&RC[2]&"）" -> 购买精力2次（%s/2） | C1146: =R[-26]C -> 7 | D1146: =R[-26]C -> 2 | E1146: =R[-26]C -> 0 | F1146: =R[-26]C -> 19005 | G1146: =R[-26]C -> 50 | H1146: =VLOOKUP(RC[-5],Sheet4!C[-7]:C[-2],5,FALSE) -> 12
A1147: =R[-26]C+80 -> 11873 | B1147: =VLOOKUP(RC[1],Sheet4!C[-1]:C[2],2,FALSE)&VLOOKUP(RC[1],Sheet4!C[-1]:C[2],3,FALSE)&RC[2]&VLOOKUP(RC[1],Sheet4!C[-1]:C[2],4,FALSE)&"（%s/"&RC[2]&"）" -> 英雄培养20次（%s/20） | C1147: =R[-26]C -> 3 | D1147: =R[-26]C -> 20 | E1147: =R[-26]C -> 0 | F1147: =R[-26]C -> 10003 | G1147: =R[-26]C -> 30 | H1147: =VLOOKUP(RC[-5],Sheet4!C[-7]:C[-2],5,FALSE) -> 8
A1148: =R[-26]C+80 -> 11881 | B1148: =VLOOKUP(RC[1],Sheet4!C[-1]:C[2],2,FALSE)&VLOOKUP(RC[1],Sheet4!C[-1]:C[2],3,FALSE)&RC[2]&VLOOKUP(RC[1],Sheet4!C[-1]:C[2],4,FALSE)&"（%s/"&RC[2]&"）" -> 无尽深渊战斗1次（%s/1） | C1148: =R[-26]C -> 23 | D1148: =R[-26]C -> 1 | E1148: =R[-26]C -> 0 | F1148: =R[-26]C -> 19028 | G1148: =R[-26]C -> 50 | H1148: =VLOOKUP(RC[-5],Sheet4!C[-7]:C[-2],5,FALSE) -> 88
A1149: =R[-26]C+80 -> 11882 | B1149: =VLOOKUP(RC[1],Sheet4!C[-1]:C[2],2,FALSE)&VLOOKUP(RC[1],Sheet4!C[-1]:C[2],3,FALSE)&RC[2]&VLOOKUP(RC[1],Sheet4!C[-1]:C[2],4,FALSE)&"（%s/"&RC[2]&"）" -> 进入勇者试练战斗10次（%s/10） | C1149: =R[-26]C -> 12 | D1149: =R[-26]C -> 10 | E1149: =R[-26]C -> 0 | F1149: =R[-26]C -> 19012 | G1149: =R[-26]C -> 500 | H1149: =VLOOKUP(RC[-5],Sheet4!C[-7]:C[-2],5,FALSE) -> 17
A1150: =R[-26]C+80 -> 11883 | B1150: =VLOOKUP(RC[1],Sheet4!C[-1]:C[2],2,FALSE)&VLOOKUP(RC[1],Sheet4!C[-1]:C[2],3,FALSE)&RC[2]&VLOOKUP(RC[1],Sheet4!C[-1]:C[2],4,FALSE)&"（%s/"&RC[2]&"）" -> 竞技场战斗5次（%s/5） | C1150: =R[-26]C -> 10 | D1150: =R[-26]C -> 5 | E1150: =R[-26]C -> 0 | F1150: =R[-26]C -> 19013 | G1150: =R[-26]C -> 500 | H1150: =VLOOKUP(RC[-5],Sheet4!C[-7]:C[-2],5,FALSE) -> 21
A1151: =R[-26]C+80 -> 11884 | B1151: =VLOOKUP(RC[1],Sheet4!C[-1]:C[2],2,FALSE)&VLOOKUP(RC[1],Sheet4!C[-1]:C[2],3,FALSE)&RC[2]&VLOOKUP(RC[1],Sheet4!C[-1]:C[2],4,FALSE)&"（%s/"&RC[2]&"）" -> 主线副本挑战5次（%s/5） | C1151: =R[-26]C -> 1 | D1151: =R[-26]C -> 5 | E1151: =R[-26]C -> 0 | F1151: =R[-26]C -> 19003 | G1151: =R[-26]C -> 50000 | H1151: =VLOOKUP(RC[-5],Sheet4!C[-7]:C[-2],5,FALSE) -> 26
A1152: =R[-26]C+80 -> 11891 | B1152: =VLOOKUP(RC[1],Sheet4!C[-1]:C[2],2,FALSE)&VLOOKUP(RC[1],Sheet4!C[-1]:C[2],3,FALSE)&RC[2]&VLOOKUP(RC[1],Sheet4!C[-1]:C[2],4,FALSE)&"（%s/"&RC[2]&"）" -> 占卜翻牌5次（%s/5） | C1152: =R[-26]C -> 25 | D1152: =R[-26]C -> 5 | E1152: =R[-26]C -> 0 | F1152: =R[-26]C -> 10096 | G1152: =R[-26]C -> 1 | H1152: =VLOOKUP(RC[-5],Sheet4!C[-7]:C[-2],5,FALSE) -> 113
A1153: =R[-26]C+80 -> 11892 | B1153: =VLOOKUP(RC[1],Sheet4!C[-1]:C[2],2,FALSE)&VLOOKUP(RC[1],Sheet4!C[-1]:C[2],3,FALSE)&RC[2]&VLOOKUP(RC[1],Sheet4!C[-1]:C[2],4,FALSE)&"（%s/"&RC[2]&"）" -> 英雄商店购买1次（%s/1） | C1153: =R[-26]C -> 5 | D1153: =R[-26]C -> 1 | E1153: =R[-26]C -> 0 | F1153: =R[-26]C -> 19006 | G1153: =R[-26]C -> 60 | H1153: =VLOOKUP(RC[-5],Sheet4!C[-7]:C[-2],5,FALSE) -> 11
A1154: =R[-26]C+80 -> 11893 | B1154: =VLOOKUP(RC[1],Sheet4!C[-1]:C[2],2,FALSE)&VLOOKUP(RC[1],Sheet4!C[-1]:C[2],3,FALSE)&RC[2]&VLOOKUP(RC[1],Sheet4!C[-1]:C[2],4,FALSE)&"（%s/"&RC[2]&"）" -> 日常副本战斗4次（%s/4） | C1154: =R[-26]C -> 13 | D1154: =R[-26]C -> 4 | E1154: =R[-26]C -> 0 | F1154: =R[-26]C -> 19005 | G1154: =R[-26]C -> 50 | H1154: =VLOOKUP(RC[-5],Sheet4!C[-7]:C[-2],5,FALSE) -> 2
A1155: =R[-26]C+80 -> 11901 | B1155: =VLOOKUP(RC[1],Sheet4!C[-1]:C[2],2,FALSE)&VLOOKUP(RC[1],Sheet4!C[-1]:C[2],3,FALSE)&RC[2]&VLOOKUP(RC[1],Sheet4!C[-1]:C[2],4,FALSE)&"（%s/"&RC[2]&"）" -> 遗迹探索4小时（%s/4） | C1155: =R[-26]C -> 19 | D1155: =R[-26]C -> 4 | E1155: =R[-26]C -> 0 | F1155: =R[-26]C -> 19003 | G1155: =R[-26]C -> 50000 | H1155: =VLOOKUP(RC[-5],Sheet4!C[-7]:C[-2],5,FALSE) -> 20
A1156: =R[-26]C+80 -> 11902 | B1156: =VLOOKUP(RC[1],Sheet4!C[-1]:C[2],2,FALSE)&VLOOKUP(RC[1],Sheet4!C[-1]:C[2],3,FALSE)&RC[2]&VLOOKUP(RC[1],Sheet4!C[-1]:C[2],4,FALSE)&"（%s/"&RC[2]&"）" -> 击杀遗迹破坏者3次（%s/3） | C1156: =R[-26]C -> 16 | D1156: =R[-26]C -> 3 | E1156: =R[-26]C -> 0 | F1156: =R[-26]C -> 19005 | G1156: =R[-26]C -> 50 | H1156: =VLOOKUP(RC[-5],Sheet4!C[-7]:C[-2],5,FALSE) -> 20
A1157: =R[-26]C+80 -> 11903 | B1157: =VLOOKUP(RC[1],Sheet4!C[-1]:C[2],2,FALSE)&VLOOKUP(RC[1],Sheet4!C[-1]:C[2],3,FALSE)&RC[2]&VLOOKUP(RC[1],Sheet4!C[-1]:C[2],4,FALSE)&"（%s/"&RC[2]&"）" -> 英雄副本战斗1次（%s/1） | C1157: =R[-26]C -> 14 | D1157: =R[-26]C -> 1 | E1157: =R[-26]C -> 0 | F1157: =R[-26]C -> 19006 | G1157: =R[-26]C -> 60 | H1157: =VLOOKUP(RC[-5],Sheet4!C[-7]:C[-2],5,FALSE) -> 27
A1158: =R[-26]C+80 -> 11911 | B1158: =VLOOKUP(RC[1],Sheet4!C[-1]:C[2],2,FALSE)&VLOOKUP(RC[1],Sheet4!C[-1]:C[2],3,FALSE)&RC[2]&VLOOKUP(RC[1],Sheet4!C[-1]:C[2],4,FALSE)&"（%s/"&RC[2]&"）" -> 遗迹探索4小时（%s/4） | C1158: =R[-26]C -> 19 | D1158: =R[-26]C -> 4 | E1158: =R[-26]C -> 0 | F1158: =R[-26]C -> 19003 | G1158: =R[-26]C -> 50000 | H1158: =VLOOKUP(RC[-5],Sheet4!C[-7]:C[-2],5,FALSE) -> 20
A1159: =R[-26]C+80 -> 11912 | B1159: =VLOOKUP(RC[1],Sheet4!C[-1]:C[2],2,FALSE)&VLOOKUP(RC[1],Sheet4!C[-1]:C[2],3,FALSE)&RC[2]&VLOOKUP(RC[1],Sheet4!C[-1]:C[2],4,FALSE)&"（%s/"&RC[2]&"）" -> 击杀遗迹破坏者3次（%s/3） | C1159: =R[-26]C -> 16 | D1159: =R[-26]C -> 3 | E1159: =R[-26]C -> 0 | F1159: =R[-26]C -> 19005 | G1159: =R[-26]C -> 50 | H1159: =VLOOKUP(RC[-5],Sheet4!C[-7]:C[-2],5,FALSE) -> 20
A1160: =R[-26]C+80 -> 11913 | B1160: =VLOOKUP(RC[1],Sheet4!C[-1]:C[2],2,FALSE)&VLOOKUP(RC[1],Sheet4!C[-1]:C[2],3,FALSE)&RC[2]&VLOOKUP(RC[1],Sheet4!C[-1]:C[2],4,FALSE)&"（%s/"&RC[2]&"）" -> 英雄副本战斗1次（%s/1） | C1160: =R[-26]C -> 14 | D1160: =R[-26]C -> 1 | E1160: =R[-26]C -> 0 | F1160: =R[-26]C -> 19006 | G1160: =R[-26]C -> 60 | H1160: =VLOOKUP(RC[-5],Sheet4!C[-7]:C[-2],5,FALSE) -> 27
A1161: =R[-26]C+80 -> 11921 | B1161: =VLOOKUP(RC[1],Sheet4!C[-1]:C[2],2,FALSE)&VLOOKUP(RC[1],Sheet4!C[-1]:C[2],3,FALSE)&RC[2]&VLOOKUP(RC[1],Sheet4!C[-1]:C[2],4,FALSE)&"（%s/"&RC[2]&"）" -> 圣器强化5次（%s/5） | C1161: =R[-26]C -> 2 | D1161: =R[-26]C -> 5 | E1161: =R[-26]C -> 0 | F1161: =R[-26]C -> 13049 | G1161: =R[-26]C -> 5 | H1161: =VLOOKUP(RC[-5],Sheet4!C[-7]:C[-2],5,FALSE) -> 8
A1162: =R[-26]C+80 -> 11922 | B1162: =VLOOKUP(RC[1],Sheet4!C[-1]:C[2],2,FALSE)&VLOOKUP(RC[1],Sheet4!C[-1]:C[2],3,FALSE)&RC[2]&VLOOKUP(RC[1],Sheet4!C[-1]:C[2],4,FALSE)&"（%s/"&RC[2]&"）" -> 圣器争夺5次（%s/5） | C1162: =R[-26]C -> 11 | D1162: =R[-26]C -> 5 | E1162: =R[-26]C -> 0 | F1162: =R[-26]C -> 13049 | G1162: =R[-26]C -> 5 | H1162: =VLOOKUP(RC[-5],Sheet4!C[-7]:C[-2],5,FALSE) -> 19
A1163: =R[-26]C+80 -> 11923 | B1163: =VLOOKUP(RC[1],Sheet4!C[-1]:C[2],2,FALSE)&VLOOKUP(RC[1],Sheet4!C[-1]:C[2],3,FALSE)&RC[2]&VLOOKUP(RC[1],Sheet4!C[-1]:C[2],4,FALSE)&"（%s/"&RC[2]&"）" -> 圣器合成3次（%s/3） | C1163: =R[-26]C -> 22 | D1163: =R[-26]C -> 3 | E1163: =R[-26]C -> 0 | F1163: =R[-26]C -> 13049 | G1163: =R[-26]C -> 5 | H1163: =VLOOKUP(RC[-5],Sheet4!C[-7]:C[-2],5,FALSE) -> 19
A1164: =R[-26]C+80 -> 11931 | B1164: =VLOOKUP(RC[1],Sheet4!C[-1]:C[2],2,FALSE)&VLOOKUP(RC[1],Sheet4!C[-1]:C[2],3,FALSE)&RC[2]&VLOOKUP(RC[1],Sheet4!C[-1]:C[2],4,FALSE)&"（%s/"&RC[2]&"）" -> 赠送好友精力3次（%s/3） | C1164: =R[-26]C -> 4 | D1164: =R[-26]C -> 3 | E1164: =R[-26]C -> 0 | F1164: =R[-26]C -> 19005 | G1164: =R[-26]C -> 40 | H1164: =VLOOKUP(RC[-5],Sheet4!C[-7]:C[-2],5,FALSE) -> 15
A1165: =R[-26]C+80 -> 11932 | B1165: =VLOOKUP(RC[1],Sheet4!C[-1]:C[2],2,FALSE)&VLOOKUP(RC[1],Sheet4!C[-1]:C[2],3,FALSE)&RC[2]&VLOOKUP(RC[1],Sheet4!C[-1]:C[2],4,FALSE)&"（%s/"&RC[2]&"）" -> 进行召唤5次（%s/5） | C1165: =R[-26]C -> 8 | D1165: =R[-26]C -> 5 | E1165: =R[-26]C -> 0 | F1165: =R[-26]C -> 19006 | G1165: =R[-26]C -> 60 | H1165: =VLOOKUP(RC[-5],Sheet4!C[-7]:C[-2],5,FALSE) -> 9
A1166: =R[-26]C+80 -> 11933 | B1166: =VLOOKUP(RC[1],Sheet4!C[-1]:C[2],2,FALSE)&VLOOKUP(RC[1],Sheet4!C[-1]:C[2],3,FALSE)&RC[2]&VLOOKUP(RC[1],Sheet4!C[-1]:C[2],4,FALSE)&"（%s/"&RC[2]&"）" -> 进行高级召唤2次（%s/2） | C1166: =R[-26]C -> 9 | D1166: =R[-26]C -> 2 | E1166: =R[-26]C -> 0 | F1166: =R[-26]C -> 19006 | G1166: =R[-26]C -> 80 | H1166: =VLOOKUP(RC[-5],Sheet4!C[-7]:C[-2],5,FALSE) -> 9
A1167: =R[-26]C+80 -> 11941 | B1167: =VLOOKUP(RC[1],Sheet4!C[-1]:C[2],2,FALSE)&VLOOKUP(RC[1],Sheet4!C[-1]:C[2],3,FALSE)&RC[2]&VLOOKUP(RC[1],Sheet4!C[-1]:C[2],4,FALSE)&"（%s/"&RC[2]&"）" -> 异度入侵分享2次（%s/2） | C1167: =R[-26]C -> 17 | D1167: =R[-26]C -> 2 | E1167: =R[-26]C -> 0 | F1167: =R[-26]C -> 19014 | G1167: =R[-26]C -> 500 | H1167: =VLOOKUP(RC[-5],Sheet4!C[-7]:C[-2],5,FALSE) -> 16
A1168: =R[-26]C+80 -> 11942 | B1168: =VLOOKUP(RC[1],Sheet4!C[-1]:C[2],2,FALSE)&VLOOKUP(RC[1],Sheet4!C[-1]:C[2],3,FALSE)&RC[2]&VLOOKUP(RC[1],Sheet4!C[-1]:C[2],4,FALSE)&"（%s/"&RC[2]&"）" -> 讨伐异度入侵者2次（%s/2） | C1168: =R[-26]C -> 18 | D1168: =R[-26]C -> 2 | E1168: =R[-26]C -> 0 | F1168: =R[-26]C -> 19014 | G1168: =R[-26]C -> 500 | H1168: =VLOOKUP(RC[-5],Sheet4!C[-7]:C[-2],5,FALSE) -> 16
A1169: =R[-26]C+80 -> 11943 | B1169: =VLOOKUP(RC[1],Sheet4!C[-1]:C[2],2,FALSE)&VLOOKUP(RC[1],Sheet4!C[-1]:C[2],3,FALSE)&RC[2]&VLOOKUP(RC[1],Sheet4!C[-1]:C[2],4,FALSE)&"（%s/"&RC[2]&"）" -> 精英副本战斗3次（%s/3） | C1169: =R[-26]C -> 15 | D1169: =R[-26]C -> 3 | E1169: =R[-26]C -> 0 | F1169: =R[-26]C -> 10008 | G1169: =R[-26]C -> 30 | H1169: =VLOOKUP(RC[-5],Sheet4!C[-7]:C[-2],5,FALSE) -> 28
A1170: =R[-26]C+80 -> 11944 | B1170: =VLOOKUP(RC[1],Sheet4!C[-1]:C[2],2,FALSE)&VLOOKUP(RC[1],Sheet4!C[-1]:C[2],3,FALSE)&RC[2]&VLOOKUP(RC[1],Sheet4!C[-1]:C[2],4,FALSE)&"（%s/"&RC[2]&"）" -> 击杀精英外敌1个（%s/1） | C1170: =R[-26]C -> 20 | D1170: =R[-26]C -> 1 | E1170: =R[-26]C -> 0 | F1170: =R[-26]C -> 10008 | G1170: =R[-26]C -> 40 | H1170: =VLOOKUP(RC[-5],Sheet4!C[-7]:C[-2],5,FALSE) -> 28
A1171: =R[-26]C+80 -> 11951 | B1171: =VLOOKUP(RC[1],Sheet4!C[-1]:C[2],2,FALSE)&VLOOKUP(RC[1],Sheet4!C[-1]:C[2],3,FALSE)&RC[2]&VLOOKUP(RC[1],Sheet4!C[-1]:C[2],4,FALSE)&"（%s/"&RC[2]&"）" -> 购买体力2次（%s/2） | C1171: =R[-26]C -> 6 | D1171: =R[-26]C -> 2 | E1171: =R[-26]C -> 0 | F1171: =R[-26]C -> 19005 | G1171: =R[-26]C -> 50 | H1171: =VLOOKUP(RC[-5],Sheet4!C[-7]:C[-2],5,FALSE) -> 12
A1172: =R[-26]C+80 -> 11952 | B1172: =VLOOKUP(RC[1],Sheet4!C[-1]:C[2],2,FALSE)&VLOOKUP(RC[1],Sheet4!C[-1]:C[2],3,FALSE)&RC[2]&VLOOKUP(RC[1],Sheet4!C[-1]:C[2],4,FALSE)&"（%s/"&RC[2]&"）" -> 购买精力2次（%s/2） | C1172: =R[-26]C -> 7 | D1172: =R[-26]C -> 2 | E1172: =R[-26]C -> 0 | F1172: =R[-26]C -> 19005 | G1172: =R[-26]C -> 50 | H1172: =VLOOKUP(RC[-5],Sheet4!C[-7]:C[-2],5,FALSE) -> 12
A1173: =R[-26]C+80 -> 11953 | B1173: =VLOOKUP(RC[1],Sheet4!C[-1]:C[2],2,FALSE)&VLOOKUP(RC[1],Sheet4!C[-1]:C[2],3,FALSE)&RC[2]&VLOOKUP(RC[1],Sheet4!C[-1]:C[2],4,FALSE)&"（%s/"&RC[2]&"）" -> 英雄培养20次（%s/20） | C1173: =R[-26]C -> 3 | D1173: =R[-26]C -> 20 | E1173: =R[-26]C -> 0 | F1173: =R[-26]C -> 10003 | G1173: =R[-26]C -> 30 | H1173: =VLOOKUP(RC[-5],Sheet4!C[-7]:C[-2],5,FALSE) -> 8
A1174: =R[-26]C+80 -> 11961 | B1174: =VLOOKUP(RC[1],Sheet4!C[-1]:C[2],2,FALSE)&VLOOKUP(RC[1],Sheet4!C[-1]:C[2],3,FALSE)&RC[2]&VLOOKUP(RC[1],Sheet4!C[-1]:C[2],4,FALSE)&"（%s/"&RC[2]&"）" -> 无尽深渊战斗1次（%s/1） | C1174: =R[-26]C -> 23 | D1174: =R[-26]C -> 1 | E1174: =R[-26]C -> 0 | F1174: =R[-26]C -> 19028 | G1174: =R[-26]C -> 50 | H1174: =VLOOKUP(RC[-5],Sheet4!C[-7]:C[-2],5,FALSE) -> 88
A1175: =R[-26]C+80 -> 11962 | B1175: =VLOOKUP(RC[1],Sheet4!C[-1]:C[2],2,FALSE)&VLOOKUP(RC[1],Sheet4!C[-1]:C[2],3,FALSE)&RC[2]&VLOOKUP(RC[1],Sheet4!C[-1]:C[2],4,FALSE)&"（%s/"&RC[2]&"）" -> 进入勇者试练战斗10次（%s/10） | C1175: =R[-26]C -> 12 | D1175: =R[-26]C -> 10 | E1175: =R[-26]C -> 0 | F1175: =R[-26]C -> 19012 | G1175: =R[-26]C -> 500 | H1175: =VLOOKUP(RC[-5],Sheet4!C[-7]:C[-2],5,FALSE) -> 17
A1176: =R[-26]C+80 -> 11963 | B1176: =VLOOKUP(RC[1],Sheet4!C[-1]:C[2],2,FALSE)&VLOOKUP(RC[1],Sheet4!C[-1]:C[2],3,FALSE)&RC[2]&VLOOKUP(RC[1],Sheet4!C[-1]:C[2],4,FALSE)&"（%s/"&RC[2]&"）" -> 竞技场战斗5次（%s/5） | C1176: =R[-26]C -> 10 | D1176: =R[-26]C -> 5 | E1176: =R[-26]C -> 0 | F1176: =R[-26]C -> 19013 | G1176: =R[-26]C -> 500 | H1176: =VLOOKUP(RC[-5],Sheet4!C[-7]:C[-2],5,FALSE) -> 21
A1177: =R[-26]C+80 -> 11964 | B1177: =VLOOKUP(RC[1],Sheet4!C[-1]:C[2],2,FALSE)&VLOOKUP(RC[1],Sheet4!C[-1]:C[2],3,FALSE)&RC[2]&VLOOKUP(RC[1],Sheet4!C[-1]:C[2],4,FALSE)&"（%s/"&RC[2]&"）" -> 主线副本挑战5次（%s/5） | C1177: =R[-26]C -> 1 | D1177: =R[-26]C -> 5 | E1177: =R[-26]C -> 0 | F1177: =R[-26]C -> 19003 | G1177: =R[-26]C -> 50000 | H1177: =VLOOKUP(RC[-5],Sheet4!C[-7]:C[-2],5,FALSE) -> 26
A1178: =R[-26]C+80 -> 11971 | B1178: =VLOOKUP(RC[1],Sheet4!C[-1]:C[2],2,FALSE)&VLOOKUP(RC[1],Sheet4!C[-1]:C[2],3,FALSE)&RC[2]&VLOOKUP(RC[1],Sheet4!C[-1]:C[2],4,FALSE)&"（%s/"&RC[2]&"）" -> 占卜翻牌5次（%s/5） | C1178: =R[-26]C -> 25 | D1178: =R[-26]C -> 5 | E1178: =R[-26]C -> 0 | F1178: =R[-26]C -> 10096 | G1178: =R[-26]C -> 1 | H1178: =VLOOKUP(RC[-5],Sheet4!C[-7]:C[-2],5,FALSE) -> 113
A1179: =R[-26]C+80 -> 11972 | B1179: =VLOOKUP(RC[1],Sheet4!C[-1]:C[2],2,FALSE)&VLOOKUP(RC[1],Sheet4!C[-1]:C[2],3,FALSE)&RC[2]&VLOOKUP(RC[1],Sheet4!C[-1]:C[2],4,FALSE)&"（%s/"&RC[2]&"）" -> 英雄商店购买1次（%s/1） | C1179: =R[-26]C -> 5 | D1179: =R[-26]C -> 1 | E1179: =R[-26]C -> 0 | F1179: =R[-26]C -> 19006 | G1179: =R[-26]C -> 60 | H1179: =VLOOKUP(RC[-5],Sheet4!C[-7]:C[-2],5,FALSE) -> 11
A1180: =R[-26]C+80 -> 11973 | B1180: =VLOOKUP(RC[1],Sheet4!C[-1]:C[2],2,FALSE)&VLOOKUP(RC[1],Sheet4!C[-1]:C[2],3,FALSE)&RC[2]&VLOOKUP(RC[1],Sheet4!C[-1]:C[2],4,FALSE)&"（%s/"&RC[2]&"）" -> 日常副本战斗4次（%s/4） | C1180: =R[-26]C -> 13 | D1180: =R[-26]C -> 4 | E1180: =R[-26]C -> 0 | F1180: =R[-26]C -> 19005 | G1180: =R[-26]C -> 50 | H1180: =VLOOKUP(RC[-5],Sheet4!C[-7]:C[-2],5,FALSE) -> 2
A1181: =R[-26]C+80 -> 11981 | B1181: =VLOOKUP(RC[1],Sheet4!C[-1]:C[2],2,FALSE)&VLOOKUP(RC[1],Sheet4!C[-1]:C[2],3,FALSE)&RC[2]&VLOOKUP(RC[1],Sheet4!C[-1]:C[2],4,FALSE)&"（%s/"&RC[2]&"）" -> 遗迹探索4小时（%s/4） | C1181: =R[-26]C -> 19 | D1181: =R[-26]C -> 4 | E1181: =R[-26]C -> 0 | F1181: =R[-26]C -> 19003 | G1181: =R[-26]C -> 50000 | H1181: =VLOOKUP(RC[-5],Sheet4!C[-7]:C[-2],5,FALSE) -> 20
A1182: =R[-26]C+80 -> 11982 | B1182: =VLOOKUP(RC[1],Sheet4!C[-1]:C[2],2,FALSE)&VLOOKUP(RC[1],Sheet4!C[-1]:C[2],3,FALSE)&RC[2]&VLOOKUP(RC[1],Sheet4!C[-1]:C[2],4,FALSE)&"（%s/"&RC[2]&"）" -> 击杀遗迹破坏者3次（%s/3） | C1182: =R[-26]C -> 16 | D1182: =R[-26]C -> 3 | E1182: =R[-26]C -> 0 | F1182: =R[-26]C -> 19005 | G1182: =R[-26]C -> 50 | H1182: =VLOOKUP(RC[-5],Sheet4!C[-7]:C[-2],5,FALSE) -> 20
A1183: =R[-26]C+80 -> 11983 | B1183: =VLOOKUP(RC[1],Sheet4!C[-1]:C[2],2,FALSE)&VLOOKUP(RC[1],Sheet4!C[-1]:C[2],3,FALSE)&RC[2]&VLOOKUP(RC[1],Sheet4!C[-1]:C[2],4,FALSE)&"（%s/"&RC[2]&"）" -> 英雄副本战斗1次（%s/1） | C1183: =R[-26]C -> 14 | D1183: =R[-26]C -> 1 | E1183: =R[-26]C -> 0 | F1183: =R[-26]C -> 19006 | G1183: =R[-26]C -> 60 | H1183: =VLOOKUP(RC[-5],Sheet4!C[-7]:C[-2],5,FALSE) -> 27
A1184: =R[-26]C+80 -> 11991 | B1184: =VLOOKUP(RC[1],Sheet4!C[-1]:C[2],2,FALSE)&VLOOKUP(RC[1],Sheet4!C[-1]:C[2],3,FALSE)&RC[2]&VLOOKUP(RC[1],Sheet4!C[-1]:C[2],4,FALSE)&"（%s/"&RC[2]&"）" -> 遗迹探索4小时（%s/4） | C1184: =R[-26]C -> 19 | D1184: =R[-26]C -> 4 | E1184: =R[-26]C -> 0 | F1184: =R[-26]C -> 19003 | G1184: =R[-26]C -> 50000 | H1184: =VLOOKUP(RC[-5],Sheet4!C[-7]:C[-2],5,FALSE) -> 20
A1185: =R[-26]C+80 -> 11992 | B1185: =VLOOKUP(RC[1],Sheet4!C[-1]:C[2],2,FALSE)&VLOOKUP(RC[1],Sheet4!C[-1]:C[2],3,FALSE)&RC[2]&VLOOKUP(RC[1],Sheet4!C[-1]:C[2],4,FALSE)&"（%s/"&RC[2]&"）" -> 击杀遗迹破坏者3次（%s/3） | C1185: =R[-26]C -> 16 | D1185: =R[-26]C -> 3 | E1185: =R[-26]C -> 0 | F1185: =R[-26]C -> 19005 | G1185: =R[-26]C -> 50 | H1185: =VLOOKUP(RC[-5],Sheet4!C[-7]:C[-2],5,FALSE) -> 20
A1186: =R[-26]C+80 -> 11993 | B1186: =VLOOKUP(RC[1],Sheet4!C[-1]:C[2],2,FALSE)&VLOOKUP(RC[1],Sheet4!C[-1]:C[2],3,FALSE)&RC[2]&VLOOKUP(RC[1],Sheet4!C[-1]:C[2],4,FALSE)&"（%s/"&RC[2]&"）" -> 英雄副本战斗1次（%s/1） | C1186: =R[-26]C -> 14 | D1186: =R[-26]C -> 1 | E1186: =R[-26]C -> 0 | F1186: =R[-26]C -> 19006 | G1186: =R[-26]C -> 60 | H1186: =VLOOKUP(RC[-5],Sheet4!C[-7]:C[-2],5,FALSE) -> 27
A1187: =R[-26]C+80 -> 12001 | B1187: =VLOOKUP(RC[1],Sheet4!C[-1]:C[2],2,FALSE)&VLOOKUP(RC[1],Sheet4!C[-1]:C[2],3,FALSE)&RC[2]&VLOOKUP(RC[1],Sheet4!C[-1]:C[2],4,FALSE)&"（%s/"&RC[2]&"）" -> 圣器强化5次（%s/5） | C1187: =R[-26]C -> 2 | D1187: =R[-26]C -> 5 | E1187: =R[-26]C -> 0 | F1187: =R[-26]C -> 13049 | G1187: =R[-26]C -> 5 | H1187: =VLOOKUP(RC[-5],Sheet4!C[-7]:C[-2],5,FALSE) -> 8
A1188: =R[-26]C+80 -> 12002 | B1188: =VLOOKUP(RC[1],Sheet4!C[-1]:C[2],2,FALSE)&VLOOKUP(RC[1],Sheet4!C[-1]:C[2],3,FALSE)&RC[2]&VLOOKUP(RC[1],Sheet4!C[-1]:C[2],4,FALSE)&"（%s/"&RC[2]&"）" -> 圣器争夺5次（%s/5） | C1188: =R[-26]C -> 11 | D1188: =R[-26]C -> 5 | E1188: =R[-26]C -> 0 | F1188: =R[-26]C -> 13049 | G1188: =R[-26]C -> 5 | H1188: =VLOOKUP(RC[-5],Sheet4!C[-7]:C[-2],5,FALSE) -> 19
A1189: =R[-26]C+80 -> 12003 | B1189: =VLOOKUP(RC[1],Sheet4!C[-1]:C[2],2,FALSE)&VLOOKUP(RC[1],Sheet4!C[-1]:C[2],3,FALSE)&RC[2]&VLOOKUP(RC[1],Sheet4!C[-1]:C[2],4,FALSE)&"（%s/"&RC[2]&"）" -> 圣器合成3次（%s/3） | C1189: =R[-26]C -> 22 | D1189: =R[-26]C -> 3 | E1189: =R[-26]C -> 0 | F1189: =R[-26]C -> 13049 | G1189: =R[-26]C -> 5 | H1189: =VLOOKUP(RC[-5],Sheet4!C[-7]:C[-2],5,FALSE) -> 19

Sheet: Sheet4
A2: ID | B2: 类型 | C2: 描述1 | D2: 描述2 | E2: 跳转 | F2: 开放等级 | H2: 等级 | I2: 功能数量
A3: 1 | B3: 主线副本 | C3: 挑战 | D3: 次 | E3: 26 | F3: 1 | H3: 1 | I3: =COUNTIF(C[-3],"<="&RC[-1]) -> 4
A4: 2 | B4: 圣器强化 | D4: 次 | E4: 8 | F4: 13 | H4: 2 | I4: =COUNTIF(C[-3],"<="&RC[-1]) -> 6
A5: 3 | B5: 英雄培养 | D5: 次 | E5: 8 | F5: 9 | H5: 3 | I5: =COUNTIF(C[-3],"<="&RC[-1]) -> 6
A6: 4 | B6: 赠送好友精力 | D6: 次 | E6: 15 | F6: 1 | H6: 4 | I6: =COUNTIF(C[-3],"<="&RC[-1]) -> 6
A7: 5 | B7: 英雄商店购买 | D7: 次 | E7: 11 | F7: 11 | H7: 5 | I7: =COUNTIF(C[-3],"<="&RC[-1]) -> 6
A8: 6 | B8: 购买体力 | D8: 次 | E8: 12 | F8: 1 | H8: 6 | I8: =COUNTIF(C[-3],"<="&RC[-1]) -> 6
A9: 7 | B9: 购买精力 | D9: 次 | E9: 12 | F9: 1 | H9: 7 | I9: =COUNTIF(C[-3],"<="&RC[-1]) -> 7
A10: 8 | B10: 进行召唤 | D10: 次 | E10: 9 | F10: 2 | H10: 8 | I10: =COUNTIF(C[-3],"<="&RC[-1]) -> 7
A11: 9 | B11: 进行高级召唤 | D11: 次 | E11: 9 | F11: 2 | H11: 9 | I11: =COUNTIF(C[-3],"<="&RC[-1]) -> 8
A12: 10 | B12: 竞技场战斗 | D12: 次 | E12: 21 | F12: 10 | H12: 10 | I12: =COUNTIF(C[-3],"<="&RC[-1]) -> 9
A13: 11 | B13: 圣器争夺 | D13: 次 | E13: 19 | F13: 13 | H13: 11 | I13: =COUNTIF(C[-3],"<="&RC[-1]) -> 10
A14: 12 | B14: 进入勇者试练 | C14: 战斗 | D14: 次 | E14: 17 | F14: 20 | H14: 12 | I14: =COUNTIF(C[-3],"<="&RC[-1]) -> 10
A15: 13 | B15: 日常副本 | C15: 战斗 | D15: 次 | E15: 2 | F15: 24 | H15: 13 | I15: =COUNTIF(C[-3],"<="&RC[-1]) -> 13
A16: 14 | B16: 英雄副本 | C16: 战斗 | D16: 次 | E16: 27 | F16: 27 | H16: 14 | I16: =COUNTIF(C[-3],"<="&RC[-1]) -> 13
A17: 15 | B17: 精英副本 | C17: 战斗 | D17: 次 | E17: 28 | F17: 45 | H17: 15 | I17: =COUNTIF(C[-3],"<="&RC[-1]) -> 13
A18: 16 | B18: 击杀遗迹破坏者 | D18: 次 | E18: 20 | F18: 25 | H18: 16 | I18: =COUNTIF(C[-3],"<="&RC[-1]) -> 13
A19: 17 | B19: 异度入侵分享 | D19: 次 | E19: 16 | F19: 35 | H19: 17 | I19: =COUNTIF(C[-3],"<="&RC[-1]) -> 13
A20: 18 | B20: 讨伐异度入侵者 | D20: 次 | E20: 16 | F20: 35 | H20: 18 | I20: =COUNTIF(C[-3],"<="&RC[-1]) -> 13
A21: 19 | B21: 遗迹探索 | D21: 小时 | E21: 20 | F21: 25 | H21: 19 | I21: =COUNTIF(C[-3],"<="&RC[-1]) -> 13
A22: 20 | B22: 击杀精英外敌 | D22: 个 | E22: 28 | F22: 45 | H22: 20 | I22: =COUNTIF(C[-3],"<="&RC[-1]) -> 15
A23: 21 | B23: 装备强化 | D23: 次 | E23: 8 | F23: 7 | H23: 21 | I23: =COUNTIF(C[-3],"<="&RC[-1]) -> 15
A24: 22 | B24: 圣器合成 | D24: 次 | E24: 19 | F24: 13 | H24: 22 | I24: =COUNTIF(C[-3],"<="&RC[-1]) -> 15
A25: 23 | B25: 无尽深渊 | C25: 战斗 | D25: 次 | E25: 88 | F25: 37 | H25: 23 | I25: =COUNTIF(C[-3],"<="&RC[-1]) -> 15
A26: 24 | B26: 跨服对决 | C26: 战斗 | D26: 次 | E26: 72 | F26: 20 | H26: 24 | I26: =COUNTIF(C[-3],"<="&RC[-1]) -> 16
A27: 25 | B27: 占卜 | C27: 翻牌 | D27: 次 | E27: 113 | F27: 50 | H27: 25 | I27: =COUNTIF(C[-3],"<="&RC[-1]) -> 18
H28: 26 | I28: =COUNTIF(C[-3],"<="&RC[-1]) -> 18
H29: 27 | I29: =COUNTIF(C[-3],"<="&RC[-1]) -> 19
H30: 28 | I30: =COUNTIF(C[-3],"<="&RC[-1]) -> 19
H31: 29 | I31: =COUNTIF(C[-3],"<="&RC[-1]) -> 19
H32: 30 | I32: =COUNTIF(C[-3],"<="&RC[-1]) -> 19
H33: 31 | I33: =COUNTIF(C[-3],"<="&RC[-1]) -> 19
H34: 32 | I34: =COUNTIF(C[-3],"<="&RC[-1]) -> 19
H35: 33 | I35: =COUNTIF(C[-3],"<="&RC[-1]) -> 19
H36: 34 | I36: =COUNTIF(C[-3],"<="&RC[-1]) -> 19
H37: 35 | I37: =COUNTIF(C[-3],"<="&RC[-1]) -> 21
H38: 36 | I38: =COUNTIF(C[-3],"<="&RC[-1]) -> 21
H39: 37 | I39: =COUNTIF(C[-3],"<="&RC[-1]) -> 22
H40: 38 | I40: =COUNTIF(C[-3],"<="&RC[-1]) -> 22
H41: 39 | I41: =COUNTIF(C[-3],"<="&RC[-1]) -> 22
H42: 40 | I42: =COUNTIF(C[-3],"<="&RC[-1]) -> 22
H43: 41 | I43: =COUNTIF(C[-3],"<="&RC[-1]) -> 22
H44: 42 | I44: =COUNTIF(C[-3],"<="&RC[-1]) -> 22
H45: 43 | I45: =COUNTIF(C[-3],"<="&RC[-1]) -> 22
H46: 44 | I46: =COUNTIF(C[-3],"<="&RC[-1]) -> 22
H47: 45 | I47: =COUNTIF(C[-3],"<="&RC[-1]) -> 24
H48: 46 | I48: =COUNTIF(C[-3],"<="&RC[-1]) -> 24
H49: 47 | I49: =COUNTIF(C[-3],"<="&RC[-1]) -> 24
H50: 48 | I50: =COUNTIF(C[-3],"<="&RC[-1]) -> 24
H51: 49 | I51: =COUNTIF(C[-3],"<="&RC[-1]) -> 24
H52: 50 | I52: =COUNTIF(C[-3],"<="&RC[-1]) -> 25

Sheet: Sheet1
B2: 天数 | C2: 目的 | D2: 世界等级 | E2: 最终奖励 | F2: 备注
B3: 1
B4: 2 | C4: 留住第一天试完到25级以下的玩家，拉高3留 | D4: 27 | E4: 24以下：橙品英雄3选1（野蛮巨人、德古拉伯爵、火女） 25以上：魂晶 | F4: 与第二天登陆赠送的3选1英雄达成合击，吸引玩家完成任务
B5: 3 | C5: 加速落后玩家升级，拉高7留 | D5: 31 | E5: 24以下：橙品英雄3选1 25~28：魂晶 29以上：装备精炼石
B6: 4 | D6: 33 | E6: 24以下：橙品英雄3选1 25~28：魂晶 29~34：装备精炼石 35以上：潜能合剂
B7: 5 | D7: 35 | E7: 28以下：任选橙品合击组合（20资合击一对） 29~34：装备精炼石 35~36：潜能合剂 37以上：任选精灵升华道具
B8: 6 | D8: 36 | E8: 28以下：任选橙品合击组合 29~34：装备精炼石 35~36：潜能合剂 37~38：任选精灵升华道具 39以上：圣器精炼石
B9: 7 | D9: 38 | E9: 28以下：最强橙品合击组合（25+20资合击一对） 29~34：装备精炼石 35~36：潜能合剂 37~38：任选精灵升华道具 39以上：圣器精炼石
B10: 8 | D10: 39 | E10: 28以下：最强橙品合击组合 29~34：装备精炼石 35~38：潜能合剂 39以上：圣器精炼石
B11: 9 | D11: 40 | E11: 同上
B12: 10 | D12: 41 | E12: 同上
B13: 11 | D13: 42 | E13: 28以下：最强橙品合击组合 29~34：装备精炼石 35~38：潜能合剂 39~44：圣器精炼石 45以上：觉醒水晶
B14: 12 | D14: 42 | E14: 同上