Sheet: 配置
A1: 服务端文件名 | B1: 服务端对应工作表号 | C1: 客户端文件名 | D1: 客户端对应工作表号 | E1: erl头部 | F1: erl内容格式 | G1: erl尾部 | H1: 客户端特殊处理
A2: config_world_boss_open_time.txt | B2: 1 | C2: config_world_boss_open_time.cnf|WorldBossOpenTime | D2: 1 | F2: get(id) -> #$ | H2: 2=>week_day
A3: config_world_boss.txt | B3: 2 | C3: config_world_boss.cnf|WorldBoss | D3: 2 | F3: get(id) -> #$ | H3: 2=>level
A4: config_world_boss_rank_reward.txt | B4: 3 | C4: config_world_boss_rank_reward.cnf|WorldBossRankReward | D4: 3 | F4: get(id) -> #$ | H4: 2=>rank
A5: config_world_boss_honor_reward.txt | B5: 4 | C5: config_world_boss_nonor_reward.cnf|WorldBossNonorReward | D5: 4 | F5: get(id) -> #$ | H5: 2=>id
A6: config_world_boss_kill_reward.txt | B6: 5 | C6: config_world_boss_kill_reward.cnf|WorldBossKillReward | D6: 5 | F6: get(id) -> #$ | H6: 2=>id
C7: config_world_boss_rule.cnf|WorldBossRule | D7: 6 | F7: get(id) -> #$ | H7: 2=>id

Sheet: 世界BOSS开放时间
A1: week_day|week_day | B1: start_time|start_time | C1: over_time|over_time | D1: reward_time|reward_time
A2: 不可空 | B2: 不可空 | C2: 不可空 | D2: 不可空
A3: 数字 | B3: 数字 | C3: 数字 | D3: 数字
A6: 星期几开放 | B6: 开始时间[小时:分钟] | C6: 结束时间[小时:分钟] | D6: 奖励时间[小时:分钟]
A7: 1 | B7: 1900 | C7: 2000 | D7: 2005
A8: 3 | B8: 1900 | C8: 2000 | D8: 2005
A9: 5 | B9: 1900 | C9: 2000 | D9: 2005

Sheet: 世界BOSS战役及奖励
A1: level|level | B1: map_id|map_id | C1: luck_reward_rate|luck_reward_rate | D1: luck_reward_item_id|luck_reward_item_id | E1: luck_reward_item_num|luck_reward_item_num | F1: killer_reward_id|kill_reward_item_id | G1: killer_reward_num|kill_reward_item_num | H1: icon|
A2: 不可空 | B2: 不可空 | C2: 不可空 | D2: 不可空 | E2: 不可空 | F2: 不可空 | G2: 不可空 | H2: 不可空
A3: 数字 | B3: 数字 | C3: 数字 | D3: 数字 | E3: 数字 | F3: 数字 | G3: 数字 | H3: 字符串
A6: BOSS等级 | B6: 关卡ID | C6: 幸运奖励几率 | D6: 幸运奖励物品ID | E6: 幸运奖励物品数量 | F6: 最终一击奖励ID | G6: 最终一击奖励数量 | H6: 图标
A7: 1 | B7: 40001 | C7: 1000 | D7: 19005 | E7: 100 | F7: 19014 | G7: 1000 | H7: monster_bg
A8: 2 | B8: 40002 | C8: 1000 | D8: 19005 | E8: 100 | F8: 19014 | G8: 1000 | H8: monster_bg
A9: 3 | B9: 40003 | C9: 1000 | D9: 19005 | E9: 100 | F9: 19014 | G9: 1000 | H9: monster_bg
A10: 4 | B10: 40004 | C10: 1000 | D10: 19005 | E10: 100 | F10: 19014 | G10: 1000 | H10: monster_bg
A11: 5 | B11: 40005 | C11: 1000 | D11: 19005 | E11: 100 | F11: 19014 | G11: 1000 | H11: monster_bg
A12: 6 | B12: 40006 | C12: 1000 | D12: 19005 | E12: 100 | F12: 19014 | G12: 1000 | H12: monster_bg
A13: 7 | B13: 40007 | C13: 1000 | D13: 19005 | E13: 100 | F13: 19014 | G13: 1000 | H13: monster_bg
A14: 8 | B14: 40008 | C14: 1000 | D14: 19005 | E14: 100 | F14: 19014 | G14: 1000 | H14: monster_bg
A15: 9 | B15: 40009 | C15: 1000 | D15: 19005 | E15: 100 | F15: 19014 | G15: 1000 | H15: monster_bg
A16: 10 | B16: 40010 | C16: 1000 | D16: 19005 | E16: 100 | F16: 19014 | G16: 1000 | H16: monster_bg
A17: 11 | B17: 40011 | C17: 1000 | D17: 19005 | E17: 100 | F17: 19014 | G17: =R[-10]C+100 -> 1100 | H17: monster_bg
A18: 12 | B18: 40012 | C18: 1000 | D18: 19005 | E18: 100 | F18: 19014 | G18: =R[-10]C+100 -> 1100 | H18: monster_bg
A19: 13 | B19: 40013 | C19: 1000 | D19: 19005 | E19: 100 | F19: 19014 | G19: =R[-10]C+100 -> 1100 | H19: monster_bg
A20: 14 | B20: 40014 | C20: 1000 | D20: 19005 | E20: 100 | F20: 19014 | G20: =R[-10]C+100 -> 1100 | H20: monster_bg
A21: 15 | B21: 40015 | C21: 1000 | D21: 19005 | E21: 100 | F21: 19014 | G21: =R[-10]C+100 -> 1100 | H21: monster_bg
A22: 16 | B22: 40016 | C22: 1000 | D22: 19005 | E22: 100 | F22: 19014 | G22: =R[-10]C+100 -> 1100 | H22: monster_bg
A23: 17 | B23: 40017 | C23: 1000 | D23: 19005 | E23: 100 | F23: 19014 | G23: =R[-10]C+100 -> 1100 | H23: monster_bg
A24: 18 | B24: 40018 | C24: 1000 | D24: 19005 | E24: 100 | F24: 19014 | G24: =R[-10]C+100 -> 1100 | H24: monster_bg
A25: 19 | B25: 40019 | C25: 1000 | D25: 19005 | E25: 100 | F25: 19014 | G25: =R[-10]C+100 -> 1100 | H25: monster_bg
A26: 20 | B26: 40020 | C26: 1000 | D26: 19005 | E26: 100 | F26: 19014 | G26: =R[-10]C+100 -> 1100 | H26: monster_bg
A27: 21 | B27: 40021 | C27: 1000 | D27: 19005 | E27: 100 | F27: 19014 | G27: =R[-10]C+100 -> 1200 | H27: monster_bg
A28: 22 | B28: 40022 | C28: 1000 | D28: 19005 | E28: 100 | F28: 19014 | G28: =R[-10]C+100 -> 1200 | H28: monster_bg
A29: 23 | B29: 40023 | C29: 1000 | D29: 19005 | E29: 100 | F29: 19014 | G29: =R[-10]C+100 -> 1200 | H29: monster_bg
A30: 24 | B30: 40024 | C30: 1000 | D30: 19005 | E30: 100 | F30: 19014 | G30: =R[-10]C+100 -> 1200 | H30: monster_bg
A31: 25 | B31: 40025 | C31: 1000 | D31: 19005 | E31: 100 | F31: 19014 | G31: =R[-10]C+100 -> 1200 | H31: monster_bg
A32: 26 | B32: 40026 | C32: 1000 | D32: 19005 | E32: 100 | F32: 19014 | G32: =R[-10]C+100 -> 1200 | H32: monster_bg
A33: 27 | B33: 40027 | C33: 1000 | D33: 19005 | E33: 100 | F33: 19014 | G33: =R[-10]C+100 -> 1200 | H33: monster_bg
A34: 28 | B34: 40028 | C34: 1000 | D34: 19005 | E34: 100 | F34: 19014 | G34: =R[-10]C+100 -> 1200 | H34: monster_bg
A35: 29 | B35: 40029 | C35: 1000 | D35: 19005 | E35: 100 | F35: 19014 | G35: =R[-10]C+100 -> 1200 | H35: monster_bg
A36: 30 | B36: 40030 | C36: 1000 | D36: 19005 | E36: 100 | F36: 19014 | G36: =R[-10]C+100 -> 1200 | H36: monster_bg
A37: 31 | B37: 40031 | C37: 1000 | D37: 19005 | E37: 100 | F37: 19014 | G37: =R[-10]C+100 -> 1300 | H37: monster_bg
A38: 32 | B38: 40032 | C38: 1000 | D38: 19005 | E38: 100 | F38: 19014 | G38: =R[-10]C+100 -> 1300 | H38: monster_bg
A39: 33 | B39: 40033 | C39: 1000 | D39: 19005 | E39: 100 | F39: 19014 | G39: =R[-10]C+100 -> 1300 | H39: monster_bg
A40: 34 | B40: 40034 | C40: 1000 | D40: 19005 | E40: 100 | F40: 19014 | G40: =R[-10]C+100 -> 1300 | H40: monster_bg
A41: 35 | B41: 40035 | C41: 1000 | D41: 19005 | E41: 100 | F41: 19014 | G41: =R[-10]C+100 -> 1300 | H41: monster_bg
A42: 36 | B42: 40036 | C42: 1000 | D42: 19005 | E42: 100 | F42: 19014 | G42: =R[-10]C+100 -> 1300 | H42: monster_bg
A43: 37 | B43: 40037 | C43: 1000 | D43: 19005 | E43: 100 | F43: 19014 | G43: =R[-10]C+100 -> 1300 | H43: monster_bg
A44: 38 | B44: 40038 | C44: 1000 | D44: 19005 | E44: 100 | F44: 19014 | G44: =R[-10]C+100 -> 1300 | H44: monster_bg
A45: 39 | B45: 40039 | C45: 1000 | D45: 19005 | E45: 100 | F45: 19014 | G45: =R[-10]C+100 -> 1300 | H45: monster_bg
A46: 40 | B46: 40040 | C46: 1000 | D46: 19005 | E46: 100 | F46: 19014 | G46: =R[-10]C+100 -> 1300 | H46: monster_bg
A47: 41 | B47: 40041 | C47: 1000 | D47: 19005 | E47: 100 | F47: 19014 | G47: =R[-10]C+100 -> 1400 | H47: monster_bg
A48: 42 | B48: 40042 | C48: 1000 | D48: 19005 | E48: 100 | F48: 19014 | G48: =R[-10]C+100 -> 1400 | H48: monster_bg
A49: 43 | B49: 40043 | C49: 1000 | D49: 19005 | E49: 100 | F49: 19014 | G49: =R[-10]C+100 -> 1400 | H49: monster_bg
A50: 44 | B50: 40044 | C50: 1000 | D50: 19005 | E50: 100 | F50: 19014 | G50: =R[-10]C+100 -> 1400 | H50: monster_bg
A51: 45 | B51: 40045 | C51: 1000 | D51: 19005 | E51: 100 | F51: 19014 | G51: =R[-10]C+100 -> 1400 | H51: monster_bg
A52: 46 | B52: 40046 | C52: 1000 | D52: 19005 | E52: 100 | F52: 19014 | G52: =R[-10]C+100 -> 1400 | H52: monster_bg
A53: 47 | B53: 40047 | C53: 1000 | D53: 19005 | E53: 100 | F53: 19014 | G53: =R[-10]C+100 -> 1400 | H53: monster_bg
A54: 48 | B54: 40048 | C54: 1000 | D54: 19005 | E54: 100 | F54: 19014 | G54: =R[-10]C+100 -> 1400 | H54: monster_bg
A55: 49 | B55: 40049 | C55: 1000 | D55: 19005 | E55: 100 | F55: 19014 | G55: =R[-10]C+100 -> 1400 | H55: monster_bg
A56: 50 | B56: 40050 | C56: 1000 | D56: 19005 | E56: 100 | F56: 19014 | G56: =R[-10]C+100 -> 1400 | H56: monster_bg
A57: 51 | B57: 40051 | C57: 1000 | D57: 19005 | E57: 100 | F57: 19014 | G57: =R[-10]C+100 -> 1500 | H57: monster_bg
A58: 52 | B58: 40052 | C58: 1000 | D58: 19005 | E58: 100 | F58: 19014 | G58: =R[-10]C+100 -> 1500 | H58: monster_bg
A59: 53 | B59: 40053 | C59: 1000 | D59: 19005 | E59: 100 | F59: 19014 | G59: =R[-10]C+100 -> 1500 | H59: monster_bg
A60: 54 | B60: 40054 | C60: 1000 | D60: 19005 | E60: 100 | F60: 19014 | G60: =R[-10]C+100 -> 1500 | H60: monster_bg
A61: 55 | B61: 40055 | C61: 1000 | D61: 19005 | E61: 100 | F61: 19014 | G61: =R[-10]C+100 -> 1500 | H61: monster_bg
A62: 56 | B62: 40056 | C62: 1000 | D62: 19005 | E62: 100 | F62: 19014 | G62: =R[-10]C+100 -> 1500 | H62: monster_bg
A63: 57 | B63: 40057 | C63: 1000 | D63: 19005 | E63: 100 | F63: 19014 | G63: =R[-10]C+100 -> 1500 | H63: monster_bg
A64: 58 | B64: 40058 | C64: 1000 | D64: 19005 | E64: 100 | F64: 19014 | G64: =R[-10]C+100 -> 1500 | H64: monster_bg
A65: 59 | B65: 40059 | C65: 1000 | D65: 19005 | E65: 100 | F65: 19014 | G65: =R[-10]C+100 -> 1500 | H65: monster_bg
A66: 60 | B66: 40060 | C66: 1000 | D66: 19005 | E66: 100 | F66: 19014 | G66: =R[-10]C+100 -> 1500 | H66: monster_bg
A67: 61 | B67: 40061 | C67: 1000 | D67: 19005 | E67: 100 | F67: 19014 | G67: =R[-10]C+100 -> 1600 | H67: monster_bg
A68: 62 | B68: 40062 | C68: 1000 | D68: 19005 | E68: 100 | F68: 19014 | G68: =R[-10]C+100 -> 1600 | H68: monster_bg
A69: 63 | B69: 40063 | C69: 1000 | D69: 19005 | E69: 100 | F69: 19014 | G69: =R[-10]C+100 -> 1600 | H69: monster_bg
A70: 64 | B70: 40064 | C70: 1000 | D70: 19005 | E70: 100 | F70: 19014 | G70: =R[-10]C+100 -> 1600 | H70: monster_bg
A71: 65 | B71: 40065 | C71: 1000 | D71: 19005 | E71: 100 | F71: 19014 | G71: =R[-10]C+100 -> 1600 | H71: monster_bg
A72: 66 | B72: 40066 | C72: 1000 | D72: 19005 | E72: 100 | F72: 19014 | G72: =R[-10]C+100 -> 1600 | H72: monster_bg
A73: 67 | B73: 40067 | C73: 1000 | D73: 19005 | E73: 100 | F73: 19014 | G73: =R[-10]C+100 -> 1600 | H73: monster_bg
A74: 68 | B74: 40068 | C74: 1000 | D74: 19005 | E74: 100 | F74: 19014 | G74: =R[-10]C+100 -> 1600 | H74: monster_bg
A75: 69 | B75: 40069 | C75: 1000 | D75: 19005 | E75: 100 | F75: 19014 | G75: =R[-10]C+100 -> 1600 | H75: monster_bg
A76: 70 | B76: 40070 | C76: 1000 | D76: 19005 | E76: 100 | F76: 19014 | G76: =R[-10]C+100 -> 1600 | H76: monster_bg
A77: 71 | B77: 40071 | C77: 1000 | D77: 19005 | E77: 100 | F77: 19014 | G77: =R[-10]C+100 -> 1700 | H77: monster_bg
A78: 72 | B78: 40072 | C78: 1000 | D78: 19005 | E78: 100 | F78: 19014 | G78: =R[-10]C+100 -> 1700 | H78: monster_bg
A79: 73 | B79: 40073 | C79: 1000 | D79: 19005 | E79: 100 | F79: 19014 | G79: =R[-10]C+100 -> 1700 | H79: monster_bg
A80: 74 | B80: 40074 | C80: 1000 | D80: 19005 | E80: 100 | F80: 19014 | G80: =R[-10]C+100 -> 1700 | H80: monster_bg
A81: 75 | B81: 40075 | C81: 1000 | D81: 19005 | E81: 100 | F81: 19014 | G81: =R[-10]C+100 -> 1700 | H81: monster_bg
A82: 76 | B82: 40076 | C82: 1000 | D82: 19005 | E82: 100 | F82: 19014 | G82: =R[-10]C+100 -> 1700 | H82: monster_bg
A83: 77 | B83: 40077 | C83: 1000 | D83: 19005 | E83: 100 | F83: 19014 | G83: =R[-10]C+100 -> 1700 | H83: monster_bg
A84: 78 | B84: 40078 | C84: 1000 | D84: 19005 | E84: 100 | F84: 19014 | G84: =R[-10]C+100 -> 1700 | H84: monster_bg
A85: 79 | B85: 40079 | C85: 1000 | D85: 19005 | E85: 100 | F85: 19014 | G85: =R[-10]C+100 -> 1700 | H85: monster_bg
A86: 80 | B86: 40080 | C86: 1000 | D86: 19005 | E86: 100 | F86: 19014 | G86: =R[-10]C+100 -> 1700 | H86: monster_bg
A87: 81 | B87: 40081 | C87: 1000 | D87: 19005 | E87: 100 | F87: 19014 | G87: =R[-10]C+100 -> 1800 | H87: monster_bg
A88: 82 | B88: 40082 | C88: 1000 | D88: 19005 | E88: 100 | F88: 19014 | G88: =R[-10]C+100 -> 1800 | H88: monster_bg
A89: 83 | B89: 40083 | C89: 1000 | D89: 19005 | E89: 100 | F89: 19014 | G89: =R[-10]C+100 -> 1800 | H89: monster_bg
A90: 84 | B90: 40084 | C90: 1000 | D90: 19005 | E90: 100 | F90: 19014 | G90: =R[-10]C+100 -> 1800 | H90: monster_bg
A91: 85 | B91: 40085 | C91: 1000 | D91: 19005 | E91: 100 | F91: 19014 | G91: =R[-10]C+100 -> 1800 | H91: monster_bg
A92: 86 | B92: 40086 | C92: 1000 | D92: 19005 | E92: 100 | F92: 19014 | G92: =R[-10]C+100 -> 1800 | H92: monster_bg
A93: 87 | B93: 40087 | C93: 1000 | D93: 19005 | E93: 100 | F93: 19014 | G93: =R[-10]C+100 -> 1800 | H93: monster_bg
A94: 88 | B94: 40088 | C94: 1000 | D94: 19005 | E94: 100 | F94: 19014 | G94: =R[-10]C+100 -> 1800 | H94: monster_bg
A95: 89 | B95: 40089 | C95: 1000 | D95: 19005 | E95: 100 | F95: 19014 | G95: =R[-10]C+100 -> 1800 | H95: monster_bg
A96: 90 | B96: 40090 | C96: 1000 | D96: 19005 | E96: 100 | F96: 19014 | G96: =R[-10]C+100 -> 1800 | H96: monster_bg
A97: 91 | B97: 40091 | C97: 1000 | D97: 19005 | E97: 100 | F97: 19014 | G97: =R[-10]C+100 -> 1900 | H97: monster_bg
A98: 92 | B98: 40092 | C98: 1000 | D98: 19005 | E98: 100 | F98: 19014 | G98: =R[-10]C+100 -> 1900 | H98: monster_bg
A99: 93 | B99: 40093 | C99: 1000 | D99: 19005 | E99: 100 | F99: 19014 | G99: =R[-10]C+100 -> 1900 | H99: monster_bg
A100: 94 | B100: 40094 | C100: 1000 | D100: 19005 | E100: 100 | F100: 19014 | G100: =R[-10]C+100 -> 1900 | H100: monster_bg
A101: 95 | B101: 40095 | C101: 1000 | D101: 19005 | E101: 100 | F101: 19014 | G101: =R[-10]C+100 -> 1900 | H101: monster_bg
A102: 96 | B102: 40096 | C102: 1000 | D102: 19005 | E102: 100 | F102: 19014 | G102: =R[-10]C+100 -> 1900 | H102: monster_bg
A103: 97 | B103: 40097 | C103: 1000 | D103: 19005 | E103: 100 | F103: 19014 | G103: =R[-10]C+100 -> 1900 | H103: monster_bg
A104: 98 | B104: 40098 | C104: 1000 | D104: 19005 | E104: 100 | F104: 19014 | G104: =R[-10]C+100 -> 1900 | H104: monster_bg
A105: 99 | B105: 40099 | C105: 1000 | D105: 19005 | E105: 100 | F105: 19014 | G105: =R[-10]C+100 -> 1900 | H105: monster_bg
A106: 100 | B106: 40100 | C106: 1000 | D106: 19005 | E106: 100 | F106: 19014 | G106: =R[-10]C+100 -> 1900 | H106: monster_bg
A107: 101 | B107: 40101 | C107: 1000 | D107: 19005 | E107: 100 | F107: 19014 | G107: =R[-10]C+100 -> 2000 | H107: monster_bg
A108: 102 | B108: 40102 | C108: 1000 | D108: 19005 | E108: 100 | F108: 19014 | G108: =R[-10]C+100 -> 2000 | H108: monster_bg
A109: 103 | B109: 40103 | C109: 1000 | D109: 19005 | E109: 100 | F109: 19014 | G109: =R[-10]C+100 -> 2000 | H109: monster_bg
A110: 104 | B110: 40104 | C110: 1000 | D110: 19005 | E110: 100 | F110: 19014 | G110: =R[-10]C+100 -> 2000 | H110: monster_bg
A111: 105 | B111: 40105 | C111: 1000 | D111: 19005 | E111: 100 | F111: 19014 | G111: =R[-10]C+100 -> 2000 | H111: monster_bg
A112: 106 | B112: 40106 | C112: 1000 | D112: 19005 | E112: 100 | F112: 19014 | G112: =R[-10]C+100 -> 2000 | H112: monster_bg
A113: 107 | B113: 40107 | C113: 1000 | D113: 19005 | E113: 100 | F113: 19014 | G113: =R[-10]C+100 -> 2000 | H113: monster_bg
A114: 108 | B114: 40108 | C114: 1000 | D114: 19005 | E114: 100 | F114: 19014 | G114: =R[-10]C+100 -> 2000 | H114: monster_bg
A115: 109 | B115: 40109 | C115: 1000 | D115: 19005 | E115: 100 | F115: 19014 | G115: =R[-10]C+100 -> 2000 | H115: monster_bg
A116: 110 | B116: 40110 | C116: 1000 | D116: 19005 | E116: 100 | F116: 19014 | G116: =R[-10]C+100 -> 2000 | H116: monster_bg
A117: 111 | B117: 40111 | C117: 1000 | D117: 19005 | E117: 100 | F117: 19014 | G117: =R[-10]C+100 -> 2100 | H117: monster_bg
A118: 112 | B118: 40112 | C118: 1000 | D118: 19005 | E118: 100 | F118: 19014 | G118: =R[-10]C+100 -> 2100 | H118: monster_bg
A119: 113 | B119: 40113 | C119: 1000 | D119: 19005 | E119: 100 | F119: 19014 | G119: =R[-10]C+100 -> 2100 | H119: monster_bg
A120: 114 | B120: 40114 | C120: 1000 | D120: 19005 | E120: 100 | F120: 19014 | G120: =R[-10]C+100 -> 2100 | H120: monster_bg
A121: 115 | B121: 40115 | C121: 1000 | D121: 19005 | E121: 100 | F121: 19014 | G121: =R[-10]C+100 -> 2100 | H121: monster_bg
A122: 116 | B122: 40116 | C122: 1000 | D122: 19005 | E122: 100 | F122: 19014 | G122: =R[-10]C+100 -> 2100 | H122: monster_bg
A123: 117 | B123: 40117 | C123: 1000 | D123: 19005 | E123: 100 | F123: 19014 | G123: =R[-10]C+100 -> 2100 | H123: monster_bg
A124: 118 | B124: 40118 | C124: 1000 | D124: 19005 | E124: 100 | F124: 19014 | G124: =R[-10]C+100 -> 2100 | H124: monster_bg
A125: 119 | B125: 40119 | C125: 1000 | D125: 19005 | E125: 100 | F125: 19014 | G125: =R[-10]C+100 -> 2100 | H125: monster_bg
A126: 120 | B126: 40120 | C126: 1000 | D126: 19005 | E126: 100 | F126: 19014 | G126: =R[-10]C+100 -> 2100 | H126: monster_bg
A127: 121 | B127: 40121 | C127: 1000 | D127: 19005 | E127: 100 | F127: 19014 | G127: =R[-10]C+100 -> 2200 | H127: monster_bg
A128: 122 | B128: 40122 | C128: 1000 | D128: 19005 | E128: 100 | F128: 19014 | G128: =R[-10]C+100 -> 2200 | H128: monster_bg
A129: 123 | B129: 40123 | C129: 1000 | D129: 19005 | E129: 100 | F129: 19014 | G129: =R[-10]C+100 -> 2200 | H129: monster_bg
A130: 124 | B130: 40124 | C130: 1000 | D130: 19005 | E130: 100 | F130: 19014 | G130: =R[-10]C+100 -> 2200 | H130: monster_bg
A131: 125 | B131: 40125 | C131: 1000 | D131: 19005 | E131: 100 | F131: 19014 | G131: =R[-10]C+100 -> 2200 | H131: monster_bg
A132: 126 | B132: 40126 | C132: 1000 | D132: 19005 | E132: 100 | F132: 19014 | G132: =R[-10]C+100 -> 2200 | H132: monster_bg
A133: 127 | B133: 40127 | C133: 1000 | D133: 19005 | E133: 100 | F133: 19014 | G133: =R[-10]C+100 -> 2200 | H133: monster_bg
A134: 128 | B134: 40128 | C134: 1000 | D134: 19005 | E134: 100 | F134: 19014 | G134: =R[-10]C+100 -> 2200 | H134: monster_bg
A135: 129 | B135: 40129 | C135: 1000 | D135: 19005 | E135: 100 | F135: 19014 | G135: =R[-10]C+100 -> 2200 | H135: monster_bg
A136: 130 | B136: 40130 | C136: 1000 | D136: 19005 | E136: 100 | F136: 19014 | G136: =R[-10]C+100 -> 2200 | H136: monster_bg
A137: 131 | B137: 40131 | C137: 1000 | D137: 19005 | E137: 100 | F137: 19014 | G137: =R[-10]C+100 -> 2300 | H137: monster_bg
A138: 132 | B138: 40132 | C138: 1000 | D138: 19005 | E138: 100 | F138: 19014 | G138: =R[-10]C+100 -> 2300 | H138: monster_bg
A139: 133 | B139: 40133 | C139: 1000 | D139: 19005 | E139: 100 | F139: 19014 | G139: =R[-10]C+100 -> 2300 | H139: monster_bg
A140: 134 | B140: 40134 | C140: 1000 | D140: 19005 | E140: 100 | F140: 19014 | G140: =R[-10]C+100 -> 2300 | H140: monster_bg
A141: 135 | B141: 40135 | C141: 1000 | D141: 19005 | E141: 100 | F141: 19014 | G141: =R[-10]C+100 -> 2300 | H141: monster_bg
A142: 136 | B142: 40136 | C142: 1000 | D142: 19005 | E142: 100 | F142: 19014 | G142: =R[-10]C+100 -> 2300 | H142: monster_bg
A143: 137 | B143: 40137 | C143: 1000 | D143: 19005 | E143: 100 | F143: 19014 | G143: =R[-10]C+100 -> 2300 | H143: monster_bg
A144: 138 | B144: 40138 | C144: 1000 | D144: 19005 | E144: 100 | F144: 19014 | G144: =R[-10]C+100 -> 2300 | H144: monster_bg
A145: 139 | B145: 40139 | C145: 1000 | D145: 19005 | E145: 100 | F145: 19014 | G145: =R[-10]C+100 -> 2300 | H145: monster_bg
A146: 140 | B146: 40140 | C146: 1000 | D146: 19005 | E146: 100 | F146: 19014 | G146: =R[-10]C+100 -> 2300 | H146: monster_bg
A147: 141 | B147: 40141 | C147: 1000 | D147: 19005 | E147: 100 | F147: 19014 | G147: =R[-10]C+100 -> 2400 | H147: monster_bg
A148: 142 | B148: 40142 | C148: 1000 | D148: 19005 | E148: 100 | F148: 19014 | G148: =R[-10]C+100 -> 2400 | H148: monster_bg
A149: 143 | B149: 40143 | C149: 1000 | D149: 19005 | E149: 100 | F149: 19014 | G149: =R[-10]C+100 -> 2400 | H149: monster_bg
A150: 144 | B150: 40144 | C150: 1000 | D150: 19005 | E150: 100 | F150: 19014 | G150: =R[-10]C+100 -> 2400 | H150: monster_bg
A151: 145 | B151: 40145 | C151: 1000 | D151: 19005 | E151: 100 | F151: 19014 | G151: =R[-10]C+100 -> 2400 | H151: monster_bg
A152: 146 | B152: 40146 | C152: 1000 | D152: 19005 | E152: 100 | F152: 19014 | G152: =R[-10]C+100 -> 2400 | H152: monster_bg
A153: 147 | B153: 40147 | C153: 1000 | D153: 19005 | E153: 100 | F153: 19014 | G153: =R[-10]C+100 -> 2400 | H153: monster_bg
A154: 148 | B154: 40148 | C154: 1000 | D154: 19005 | E154: 100 | F154: 19014 | G154: =R[-10]C+100 -> 2400 | H154: monster_bg
A155: 149 | B155: 40149 | C155: 1000 | D155: 19005 | E155: 100 | F155: 19014 | G155: =R[-10]C+100 -> 2400 | H155: monster_bg
A156: 150 | B156: 40150 | C156: 1000 | D156: 19005 | E156: 100 | F156: 19014 | G156: =R[-10]C+100 -> 2400 | H156: monster_bg
A157: 151 | B157: 40151 | C157: 1000 | D157: 19005 | E157: 100 | F157: 19014 | G157: =R[-10]C+100 -> 2500 | H157: monster_bg
A158: 152 | B158: 40152 | C158: 1000 | D158: 19005 | E158: 100 | F158: 19014 | G158: =R[-10]C+100 -> 2500 | H158: monster_bg
A159: 153 | B159: 40153 | C159: 1000 | D159: 19005 | E159: 100 | F159: 19014 | G159: =R[-10]C+100 -> 2500 | H159: monster_bg
A160: 154 | B160: 40154 | C160: 1000 | D160: 19005 | E160: 100 | F160: 19014 | G160: =R[-10]C+100 -> 2500 | H160: monster_bg
A161: 155 | B161: 40155 | C161: 1000 | D161: 19005 | E161: 100 | F161: 19014 | G161: =R[-10]C+100 -> 2500 | H161: monster_bg
A162: 156 | B162: 40156 | C162: 1000 | D162: 19005 | E162: 100 | F162: 19014 | G162: =R[-10]C+100 -> 2500 | H162: monster_bg
A163: 157 | B163: 40157 | C163: 1000 | D163: 19005 | E163: 100 | F163: 19014 | G163: =R[-10]C+100 -> 2500 | H163: monster_bg
A164: 158 | B164: 40158 | C164: 1000 | D164: 19005 | E164: 100 | F164: 19014 | G164: =R[-10]C+100 -> 2500 | H164: monster_bg
A165: 159 | B165: 40159 | C165: 1000 | D165: 19005 | E165: 100 | F165: 19014 | G165: =R[-10]C+100 -> 2500 | H165: monster_bg
A166: 160 | B166: 40160 | C166: 1000 | D166: 19005 | E166: 100 | F166: 19014 | G166: =R[-10]C+100 -> 2500 | H166: monster_bg
A167: 161 | B167: 40161 | C167: 1000 | D167: 19005 | E167: 100 | F167: 19014 | G167: =R[-10]C+100 -> 2600 | H167: monster_bg
A168: 162 | B168: 40162 | C168: 1000 | D168: 19005 | E168: 100 | F168: 19014 | G168: =R[-10]C+100 -> 2600 | H168: monster_bg
A169: 163 | B169: 40163 | C169: 1000 | D169: 19005 | E169: 100 | F169: 19014 | G169: =R[-10]C+100 -> 2600 | H169: monster_bg
A170: 164 | B170: 40164 | C170: 1000 | D170: 19005 | E170: 100 | F170: 19014 | G170: =R[-10]C+100 -> 2600 | H170: monster_bg
A171: 165 | B171: 40165 | C171: 1000 | D171: 19005 | E171: 100 | F171: 19014 | G171: =R[-10]C+100 -> 2600 | H171: monster_bg
A172: 166 | B172: 40166 | C172: 1000 | D172: 19005 | E172: 100 | F172: 19014 | G172: =R[-10]C+100 -> 2600 | H172: monster_bg
A173: 167 | B173: 40167 | C173: 1000 | D173: 19005 | E173: 100 | F173: 19014 | G173: =R[-10]C+100 -> 2600 | H173: monster_bg
A174: 168 | B174: 40168 | C174: 1000 | D174: 19005 | E174: 100 | F174: 19014 | G174: =R[-10]C+100 -> 2600 | H174: monster_bg
A175: 169 | B175: 40169 | C175: 1000 | D175: 19005 | E175: 100 | F175: 19014 | G175: =R[-10]C+100 -> 2600 | H175: monster_bg
A176: 170 | B176: 40170 | C176: 1000 | D176: 19005 | E176: 100 | F176: 19014 | G176: =R[-10]C+100 -> 2600 | H176: monster_bg
A177: 171 | B177: 40171 | C177: 1000 | D177: 19005 | E177: 100 | F177: 19014 | G177: =R[-10]C+100 -> 2700 | H177: monster_bg
A178: 172 | B178: 40172 | C178: 1000 | D178: 19005 | E178: 100 | F178: 19014 | G178: =R[-10]C+100 -> 2700 | H178: monster_bg
A179: 173 | B179: 40173 | C179: 1000 | D179: 19005 | E179: 100 | F179: 19014 | G179: =R[-10]C+100 -> 2700 | H179: monster_bg
A180: 174 | B180: 40174 | C180: 1000 | D180: 19005 | E180: 100 | F180: 19014 | G180: =R[-10]C+100 -> 2700 | H180: monster_bg
A181: 175 | B181: 40175 | C181: 1000 | D181: 19005 | E181: 100 | F181: 19014 | G181: =R[-10]C+100 -> 2700 | H181: monster_bg
A182: 176 | B182: 40176 | C182: 1000 | D182: 19005 | E182: 100 | F182: 19014 | G182: =R[-10]C+100 -> 2700 | H182: monster_bg
A183: 177 | B183: 40177 | C183: 1000 | D183: 19005 | E183: 100 | F183: 19014 | G183: =R[-10]C+100 -> 2700 | H183: monster_bg
A184: 178 | B184: 40178 | C184: 1000 | D184: 19005 | E184: 100 | F184: 19014 | G184: =R[-10]C+100 -> 2700 | H184: monster_bg
A185: 179 | B185: 40179 | C185: 1000 | D185: 19005 | E185: 100 | F185: 19014 | G185: =R[-10]C+100 -> 2700 | H185: monster_bg
A186: 180 | B186: 40180 | C186: 1000 | D186: 19005 | E186: 100 | F186: 19014 | G186: =R[-10]C+100 -> 2700 | H186: monster_bg
A187: 181 | B187: 40181 | C187: 1000 | D187: 19005 | E187: 100 | F187: 19014 | G187: =R[-10]C+100 -> 2800 | H187: monster_bg
A188: 182 | B188: 40182 | C188: 1000 | D188: 19005 | E188: 100 | F188: 19014 | G188: =R[-10]C+100 -> 2800 | H188: monster_bg
A189: 183 | B189: 40183 | C189: 1000 | D189: 19005 | E189: 100 | F189: 19014 | G189: =R[-10]C+100 -> 2800 | H189: monster_bg
A190: 184 | B190: 40184 | C190: 1000 | D190: 19005 | E190: 100 | F190: 19014 | G190: =R[-10]C+100 -> 2800 | H190: monster_bg
A191: 185 | B191: 40185 | C191: 1000 | D191: 19005 | E191: 100 | F191: 19014 | G191: =R[-10]C+100 -> 2800 | H191: monster_bg
A192: 186 | B192: 40186 | C192: 1000 | D192: 19005 | E192: 100 | F192: 19014 | G192: =R[-10]C+100 -> 2800 | H192: monster_bg
A193: 187 | B193: 40187 | C193: 1000 | D193: 19005 | E193: 100 | F193: 19014 | G193: =R[-10]C+100 -> 2800 | H193: monster_bg
A194: 188 | B194: 40188 | C194: 1000 | D194: 19005 | E194: 100 | F194: 19014 | G194: =R[-10]C+100 -> 2800 | H194: monster_bg
A195: 189 | B195: 40189 | C195: 1000 | D195: 19005 | E195: 100 | F195: 19014 | G195: =R[-10]C+100 -> 2800 | H195: monster_bg
A196: 190 | B196: 40190 | C196: 1000 | D196: 19005 | E196: 100 | F196: 19014 | G196: =R[-10]C+100 -> 2800 | H196: monster_bg
A197: 191 | B197: 40191 | C197: 1000 | D197: 19005 | E197: 100 | F197: 19014 | G197: =R[-10]C+100 -> 2900 | H197: monster_bg
A198: 192 | B198: 40192 | C198: 1000 | D198: 19005 | E198: 100 | F198: 19014 | G198: =R[-10]C+100 -> 2900 | H198: monster_bg
A199: 193 | B199: 40193 | C199: 1000 | D199: 19005 | E199: 100 | F199: 19014 | G199: =R[-10]C+100 -> 2900 | H199: monster_bg
A200: 194 | B200: 40194 | C200: 1000 | D200: 19005 | E200: 100 | F200: 19014 | G200: =R[-10]C+100 -> 2900 | H200: monster_bg
A201: 195 | B201: 40195 | C201: 1000 | D201: 19005 | E201: 100 | F201: 19014 | G201: =R[-10]C+100 -> 2900 | H201: monster_bg
A202: 196 | B202: 40196 | C202: 1000 | D202: 19005 | E202: 100 | F202: 19014 | G202: =R[-10]C+100 -> 2900 | H202: monster_bg
A203: 197 | B203: 40197 | C203: 1000 | D203: 19005 | E203: 100 | F203: 19014 | G203: =R[-10]C+100 -> 2900 | H203: monster_bg
A204: 198 | B204: 40198 | C204: 1000 | D204: 19005 | E204: 100 | F204: 19014 | G204: =R[-10]C+100 -> 2900 | H204: monster_bg
A205: 199 | B205: 40199 | C205: 1000 | D205: 19005 | E205: 100 | F205: 19014 | G205: =R[-10]C+100 -> 2900 | H205: monster_bg
A206: 200 | B206: 40200 | C206: 1000 | D206: 19005 | E206: 100 | F206: 19014 | G206: =R[-10]C+100 -> 2900 | H206: monster_bg

Sheet:  排行奖励
A1: rank|rank | B1: nonor_reward_id_list|nonor_reward_id_list | C1: nonor_reward_num_list|nonor_reward_num_list | D1: damage_reward_id_list|damage_reward_id_list | E1: damage_reward_num_list|damage_reward_num_list
A2: 不可空 | B2: 不可空 | C2: 不可空 | D2: 不可空 | E2: 不可空
A3: 数字 | B3: 一维数组 | C3: 一维数组 | D3: 一维数组 | E3: 一维数组
B4: 不定长 | C4: 不定长 | D4: 不定长 | E4: 不定长
A6: 排名 | B6: 荣誉排行奖励物品Id列表 | C6: 荣誉排行奖励物品数量列表 | D6: 伤害排行奖励物品Id列表 | E6: 伤害排行奖励物品数量列表
A7: 1 | B7: 10004|19014 | C7: 300|10000 | D7: 10004|19014 | E7: 100|10000
A8: 2 | B8: 10004|19014 | C8: 200|9000 | D8: 10004|19014 | E8: 90|9000
A9: 3 | B9: 10004|19014 | C9: 100|8000 | D9: 10004|19014 | E9: 80|8000
A10: 4 | B10: 10004|19014 | C10: 50|5000 | D10: 10004|19014 | E10: 50|5000
A11: 5 | B11: 10004|19014 | C11: 50|5000 | D11: 10004|19014 | E11: 50|5000
A12: 6 | B12: 10004|19014 | C12: 50|5000 | D12: 10004|19014 | E12: 50|5000
A13: 7 | B13: 10004|19014 | C13: 50|5000 | D13: 10004|19014 | E13: 50|5000
A14: 8 | B14: 10004|19014 | C14: 50|5000 | D14: 10004|19014 | E14: 50|5000
A15: 9 | B15: 10004|19014 | C15: 50|5000 | D15: 10004|19014 | E15: 50|5000
A16: 10 | B16: 10004|19014 | C16: 50|5000 | D16: 10004|19014 | E16: 50|5000
A17: 11 | B17: 10004|19014 | C17: 20|2500 | D17: 10004|19014 | E17: 20|2500
A18: 12 | B18: 10004|19014 | C18: 20|2500 | D18: 10004|19014 | E18: 20|2500
A19: 13 | B19: 10004|19014 | C19: 20|2500 | D19: 10004|19014 | E19: 20|2500
A20: 14 | B20: 10004|19014 | C20: 20|2500 | D20: 10004|19014 | E20: 20|2500
A21: 15 | B21: 10004|19014 | C21: 20|2500 | D21: 10004|19014 | E21: 20|2500
A22: 16 | B22: 10004|19014 | C22: 20|2500 | D22: 10004|19014 | E22: 20|2500
A23: 17 | B23: 10004|19014 | C23: 20|2500 | D23: 10004|19014 | E23: 20|2500
A24: 18 | B24: 10004|19014 | C24: 20|2500 | D24: 10004|19014 | E24: 20|2500
A25: 19 | B25: 10004|19014 | C25: 20|2500 | D25: 10004|19014 | E25: 20|2500
A26: 20 | B26: 10004|19014 | C26: 20|2500 | D26: 10004|19014 | E26: 20|2500

Sheet: 个人荣誉奖励
A1: id|id | B1: need_honor|need_honor | C1: reward_item_id|reward_item_id | D1: reward_item_num|reward_item_num
A2: 不可空 | B2: 不可空 | C2: 不可空 | D2: 不可空
A3: 数字 | B3: 数字 | C3: 数字 | D3: 数字
A6: 奖励ID | B6: 需要的荣誉值 | C6: 奖励物品ID | D6: 奖励物品数量
A7: 1 | B7: 20 | C7: 19103 | D7: 1
A8: 2 | B8: 50 | C8: 10004 | D8: 5
A9: 3 | B9: 100 | C9: 10014 | D9: 5
A10: 4 | B10: 200 | C10: 19103 | D10: =R[-3]C+1 -> 2
A11: 5 | B11: 300 | C11: 10004 | D11: =R[-3]C+5 -> 10
A12: 6 | B12: 400 | C12: 10014 | D12: =R[-3]C+5 -> 10
A13: 7 | B13: 500 | C13: 19103 | D13: =R[-3]C+1 -> 3
A14: 8 | B14: 600 | C14: 10004 | D14: =R[-3]C+5 -> 15
A15: 9 | B15: 700 | C15: 10014 | D15: =R[-3]C+5 -> 15
A16: 10 | B16: 800 | C16: 19103 | D16: =R[-3]C+1 -> 4
A17: 11 | B17: 900 | C17: 10004 | D17: =R[-3]C+5 -> 20
A18: 12 | B18: 1000 | C18: 10014 | D18: =R[-3]C+5 -> 20
A19: 13 | B19: 1500 | C19: 19103 | D19: =R[-3]C+1 -> 5
A20: 14 | B20: 2000 | C20: 10004 | D20: =R[-3]C+5 -> 25
A21: 15 | B21: 2500 | C21: 10014 | D21: =R[-3]C+5 -> 25
A22: 16 | B22: 3000 | C22: 19103 | D22: =R[-3]C+1 -> 6
A23: 17 | B23: 3500 | C23: 10004 | D23: =R[-3]C+5 -> 30
A24: 18 | B24: 4000 | C24: 10014 | D24: =R[-3]C+5 -> 30
A25: 19 | B25: 4500 | C25: 19103 | D25: =R[-3]C+1 -> 7
A26: 20 | B26: 5000 | C26: 10004 | D26: =R[-3]C+5 -> 35
A27: 21 | B27: 6000 | C27: 10014 | D27: =R[-3]C+5 -> 35
A28: 22 | B28: 7000 | C28: 19103 | D28: =R[-3]C+1 -> 8
A29: 23 | B29: 8000 | C29: 10004 | D29: =R[-3]C+5 -> 40
A30: 24 | B30: 9000 | C30: 10014 | D30: =R[-3]C+5 -> 40
A31: 25 | B31: 10000 | C31: 19103 | D31: =R[-3]C+1 -> 9
A32: 26 | B32: 12000 | C32: 10004 | D32: =R[-3]C+5 -> 45
A33: 27 | B33: 14000 | C33: 10014 | D33: =R[-3]C+5 -> 45
A34: 28 | B34: 16000 | C34: 19103 | D34: =R[-3]C+1 -> 10
A35: 29 | B35: 18000 | C35: 10004 | D35: =R[-3]C+5 -> 50
A36: 30 | B36: 20000 | C36: 10014 | D36: =R[-3]C+5 -> 50
A37: 31 | B37: 25000 | C37: 19103 | D37: =R[-3]C+1 -> 11
A38: 32 | B38: 30000 | C38: 10004 | D38: =R[-3]C+5 -> 55
A39: 33 | B39: 35000 | C39: 10014 | D39: =R[-3]C+5 -> 55
A40: 34 | B40: 40000 | C40: 19103 | D40: =R[-3]C+1 -> 12
A41: 35 | B41: 45000 | C41: 10004 | D41: =R[-3]C+5 -> 60
A42: 36 | B42: 50000 | C42: 10014 | D42: =R[-3]C+5 -> 60
A43: 37 | B43: 60000 | C43: 19103 | D43: =R[-3]C+1 -> 13
A44: 38 | B44: 70000 | C44: 10004 | D44: =R[-3]C+5 -> 65
A45: 39 | B45: 80000 | C45: 10014 | D45: =R[-3]C+5 -> 65
A46: 40 | B46: 90000 | C46: 19103 | D46: =R[-3]C+1 -> 14

Sheet: 击杀全服奖励
A1: id|id | B1: need_boss_lv|need_boss_lv | C1: reward_item_id|reward_item_id | D1: reward_item_num|reward_item_num
A2: 不可空 | B2: 不可空 | C2: 不可空 | D2: 不可空
A3: 数字 | B3: 数字 | C3: 数字 | D3: 数字
A6: 奖励ID | B6: 需要的BOSS等级 | C6: 奖励物品ID | D6: 奖励物品数量
A7: 1 | B7: 5 | C7: 10004 | D7: 5
A8: 2 | B8: 10 | C8: 10004 | D8: 5
A9: 3 | B9: 15 | C9: 10004 | D9: 5
A10: 4 | B10: 20 | C10: 10004 | D10: 5
A11: 5 | B11: 25 | C11: 10004 | D11: 5
A12: 6 | B12: 30 | C12: 10004 | D12: 10
A13: 7 | B13: 35 | C13: 10004 | D13: 10
A14: 8 | B14: 40 | C14: 10004 | D14: 10
A15: 9 | B15: 45 | C15: 10004 | D15: 10
A16: 10 | B16: 50 | C16: 10004 | D16: 10
A17: 11 | B17: 55 | C17: 10004 | D17: 20
A18: 12 | B18: 60 | C18: 10004 | D18: 20
A19: 13 | B19: 65 | C19: 10004 | D19: 20
A20: 14 | B20: 70 | C20: 10004 | D20: 20
A21: 15 | B21: 75 | C21: 10004 | D21: 20
A22: 16 | B22: 80 | C22: 10004 | D22: 30
A23: 17 | B23: 85 | C23: 10004 | D23: 30
A24: 18 | B24: 90 | C24: 10004 | D24: 30
A25: 19 | B25: 95 | C25: 10004 | D25: 30
A26: 20 | B26: 100 | C26: 10004 | D26: 30
A27: 21 | B27: 105 | C27: 10004 | D27: 40
A28: 22 | B28: 110 | C28: 10004 | D28: 40
A29: 23 | B29: 115 | C29: 10004 | D29: 40
A30: 24 | B30: 120 | C30: 10004 | D30: 40
A31: 25 | B31: 125 | C31: 10004 | D31: 40
A32: 26 | B32: 130 | C32: 10004 | D32: 50
A33: 27 | B33: 135 | C33: 10004 | D33: 50
A34: 28 | B34: 140 | C34: 10004 | D34: 50
A35: 29 | B35: 145 | C35: 10004 | D35: 50
A36: 30 | B36: 150 | C36: 10004 | D36: 50
A37: 31 | B37: 155 | C37: 10004 | D37: 60
A38: 32 | B38: 160 | C38: 10004 | D38: 60
A39: 33 | B39: 165 | C39: 10004 | D39: 60
A40: 34 | B40: 170 | C40: 10004 | D40: 60
A41: 35 | B41: 175 | C41: 10004 | D41: 60
A42: 36 | B42: 180 | C42: 10004 | D42: 70
A43: 37 | B43: 185 | C43: 10004 | D43: 70
A44: 38 | B44: 190 | C44: 10004 | D44: 70
A45: 39 | B45: 195 | C45: 10004 | D45: 70
A46: 40 | B46: 200 | C46: 10004 | D46: 70

Sheet: Sheet7
A1: id| | B1: title| | C1: describe|
A2: 不可空 | B2: 不可空 | C2: 不可空
A3: 数字 | B3: 字符串 | C3: 字符串
A6: id | B6: 标题 | C6: 描述
A7: 1 | B7: 世界BOSS | C7: 1.英雄商店每日刷新次数<COLOR VALUE=FFFF4C34>+5</COLOR>（<COLOR VALUE=FFFF4C34>35</COLOR>次）<GH>2.精力药剂每日购买次数<COLOR VALUE=FFFF4C34>+3</COLOR>（<COLOR VALUE=FFFF4C34>8</COLOR>次）<GH>3.体力药剂每日购买次数<COLOR VALUE=FFFF4C34>+3</COLOR>（<COLOR VALUE=FFFF4C34>8</COLOR>次）<GH>4.传承核心每日购买次数<COLOR VALUE=FFFF4C34>+2</COLOR>（<COLOR VALUE=FFFF4C34>7</COLOR>次）<GH>5.炼金术每日使用次数<COLOR VALUE=FFFF4C34>+5</COLOR>（<COLOR VALUE=FFFF4C34>10次</COLOR>）<GH>6.橙品装备箱每日
A8: 2 | B8: 服务器BOSS | C8: 1.英雄商店每日刷新次数<COLOR VALUE=FFFF4C34>+5</COLOR>（<COLOR VALUE=FFFF4C34>35</COLOR>次）<GH>2.精力药剂每日购买次数<COLOR VALUE=FFFF4C34>+3</COLOR>（<COLOR VALUE=FFFF4C34>8</COLOR>次）<GH>3.体力药剂每日购买次数<COLOR VALUE=FFFF4C34>+3</COLOR>（<COLOR VALUE=FFFF4C34>8</COLOR>次）<GH>4.传承核心每日购买次数<COLOR VALUE=FFFF4C34>+2</COLOR>（<COLOR VALUE=FFFF4C34>7</COLOR>次）<GH>5.炼金术每日使用次数<COLOR VALUE=FFFF4C34>+5</COLOR>（<COLOR VALUE=FFFF4C34>10次</COLOR>）<GH>6.橙品装备箱每日