Sheet: 配置
A1: 服务端文件名 | B1: 服务端对应工作表号 | C1: 客户端文件名 | D1: 客户端对应工作表号 | E1: erl头部 | F1: erl内容格式 | G1: erl尾部 | H1: 客户端特殊处理
A2: config_treasure.txt | B2: 1 | C2: config_treasure.cnf|Treasure | D2: 1 | F2: get(id) -> #$ | H2: 2=>id
A3: config_treasure_strengthen.txt | B3: 2 | C3: config_treasure_strengthen.cnf|TreasureStrengthen | D3: 2 | F3: get(quality) -> #$ | H3: 1=>quality,strengthen_level|level_list
A4: config_treasure_refine.txt | B4: 3 | C4: config_treasure_refine.cnf|TreasureRefine | D4: 3 | F4: get(quality) -> #$ | H4: 1=>quality,refine_level|level_list
A5: config_treasure_compose.txt | B5: 4 | C5: config_treasure_compose.cnf|TreasureCompose | D5: 4 | F5: get(id) -> #$ | H5: 2=>id
A6: config_treasure_strengthen_forge.txt | B6: 5 | C6: config_treasure_strengthen_forge.cnf|TreasureStrengthenForge | D6: 5 | F6: get(id) -> #$ | H6: 2=>strengthen_level
A7: config_treasure_refine_forge.txt | B7: 6 | C7: config_treasure_refine_forging.cnf|TreasureRefineForge | D7: 6 | F7: get(id) -> #$ | H7: 2=>refine_level
A8: config_treasure_smelt.txt | B8: 7 | C8: config_treasure_smelt.cnf|TreasureSmelt | D8: 7 | F8: get(id) -> #$ | H8: 2=>id
A9: config_treasure_quality_up_cost.txt | B9: 8 | C9: config_treasure_quality_up_cost.cnf|TreasureQualityUpCost | D9: 8 | F9: get(refine_level) -> #$ | H9: 2=>refine_level

Sheet: 宝物
A1: id|id | B1: name| | C1: quality|quality | D1: type|type | E1: next_quality_treasure_id|next_quality_treasure_id | F1: quality_up_cost_item_id|quality_up_cost_item_id | G1: strengthen_level_max|strengthen_level_max | H1: refine_level_max|refine_level_max | I1: as_exp|as_exp | J1: price|price | K1: reset_cost_diamond|reset_cost_diamond | L1: res_id| | M1: description| | N1: strengthen_init_pro_list|strengthen_init_pro_list | O1: strengthen_add_pro_list|strengthen_add_pro_list | P1: refine_pro_type_list|refine_pro_type_list | Q1: refine_pro_value_list|refine_pro_value_list | R1: systemid| | S1: treasure| | T1: new|
A2: 不可空 | B2: 不可空 | C2: 不可空 | D2: 不可空 | E2: 不可空 | F2: 可空#不需字段 | G2: 不可空 | H2: 不可空 | I2: 不可空 | J2: 不可空 | K2: 不可空 | L2: 不可空 | M2: 不可空 | N2: 可空#不需字段 | O2: 可空#不需字段 | P2: 可空#不需字段 | Q2: 可空#不需字段 | R2: 可空#不需字段 | S2: 可空#不需字段 | T2: 可空#不需字段
A3: 数字 | B3: 字符串 | C3: 数字 | D3: 数字 | E3: 数字 | F3: 数字 | G3: 数字 | H3: 数字 | I3: 数字 | J3: 数字 | K3: 数字 | L3: 数字 | M3: 字符串 | N3: 二维数组 | O3: 二维数组 | P3: 一维数组 | Q3: 一维数组 | R3: 一维数组 | S3: 字符串 | T3: 数字
N4: 不定长 | O4: 不定长 | P4: 不定长 | Q4: 不定长 | R4: 不定长
A6: 宝物ID | B6: 宝物名称 | C6: 宝物品质 | D6: 宝物类型 | E6: 升品后的宝物ID(0表示不可升) | F6: 宝物升品消耗的道具 | G6: 强化等级上限 | H6: 精炼等级上限 | I6: 被吞噬经验 | J6: 出售金币 | K6: 重生消耗钻石 | L6: 资源id | M6: 描述 | N6: 装备初始属性 | O6: 强化每级增加属性 | P6: 精炼属性类型列表 | Q6: 精炼属性值列表 | R6: 整装获取途径 | S6: 圣器特效名 | T6: 是否显示new（填1显示
A7: 40201 | B7: 激励符文 | C7: =MOD(INT(RC[-2]/100),10) -> 2 | D7: 0 | E7: 0 | G7: 80 | H7: 20 | I7: 1200 | J7: 1200 | K7: 50 | L7: 40201 | M7: 具有激励效果的符文。 | N7: =IF(RC4=2,0,VLOOKUP(RC4,Sheet1!R2C1:R5C6,2,FALSE)&"|"&VLOOKUP(RC3,Sheet1!R2C9:R6C12,MID(RC1,2,1)+2,FALSE)&"#"&VLOOKUP(RC4,Sheet1!R2C1:R5C6,MOD(RC1,10)+2,FALSE)&"|"&VLOOKUP(RC3,Sheet1!R2C9:R6C12,4,FALSE)) -> 1|180#11|150 | O7: =IF(RC4=2,0,VLOOKUP(RC4,Sheet1!R2C1:R5C6,2,FALSE)&"|"&VLOOKUP(RC3,Sheet1!R8C9:R12C12,MID(RC1,2,1)+2,FALSE)&"#"&VLOOKUP(RC4,Sheet1!R2C1:R5C6,MOD(RC1,10)+2,FALSE)&"|"&VLOOKUP(RC3,Sheet1!R8C9:R12C12,4,FALSE)) -> 1|10#11|15 | P7: =IF(RC4=2,0,VLOOKUP(RC4,Sheet1!R2C1:R5C6,2,FALSE)&"|"&VLOOKUP(RC4,Sheet1!R2C1:R5C6,7-MOD(RC1,10),FALSE)) -> 1|13 | Q7: =IF(RC4=2,0,VLOOKUP(RC3,Sheet1!R14C9:R18C12,MID(RC1,2,1)+2,FALSE)&"|"&VLOOKUP(RC3,Sheet1!R14C9:R18C12,4,FALSE)) -> 60|75 | R7: 19|12 | T7: 1
A8: 40301 | B8: 英勇符文 | C8: =MOD(INT(RC[-2]/100),10) -> 3 | D8: 0 | E8: 0 | G8: 80 | H8: 20 | I8: 10000 | J8: 10000 | K8: 50 | L8: 40301 | M8: 英勇无双，一往直前。 | N8: =IF(RC4=2,0,VLOOKUP(RC4,Sheet1!R2C1:R5C6,2,FALSE)&"|"&VLOOKUP(RC3,Sheet1!R2C9:R6C12,MID(RC1,2,1)+2,FALSE)&"#"&VLOOKUP(RC4,Sheet1!R2C1:R5C6,MOD(RC1,10)+2,FALSE)&"|"&VLOOKUP(RC3,Sheet1!R2C9:R6C12,4,FALSE)) -> 1|300#11|250 | O8: =IF(RC4=2,0,VLOOKUP(RC4,Sheet1!R2C1:R5C6,2,FALSE)&"|"&VLOOKUP(RC3,Sheet1!R8C9:R12C12,MID(RC1,2,1)+2,FALSE)&"#"&VLOOKUP(RC4,Sheet1!R2C1:R5C6,MOD(RC1,10)+2,FALSE)&"|"&VLOOKUP(RC3,Sheet1!R8C9:R12C12,4,FALSE)) -> 1|20#11|25 | P8: =IF(RC4=2,0,VLOOKUP(RC4,Sheet1!R2C1:R5C6,2,FALSE)&"|"&VLOOKUP(RC4,Sheet1!R2C1:R5C6,7-MOD(RC1,10),FALSE)) -> 1|13 | Q8: =IF(RC4=2,0,VLOOKUP(RC3,Sheet1!R14C9:R18C12,MID(RC1,2,1)+2,FALSE)&"|"&VLOOKUP(RC3,Sheet1!R14C9:R18C12,4,FALSE)) -> 100|125 | R8: 19|12 | T8: 1
A9: 40302 | B9: 愤怒符文 | C9: =MOD(INT(RC[-2]/100),10) -> 3 | D9: 0 | E9: 0 | G9: 80 | H9: 20 | I9: 10000 | J9: 10000 | K9: 50 | L9: 40302 | M9: 怒火中烧，奋起一战。 | N9: =IF(RC4=2,0,VLOOKUP(RC4,Sheet1!R2C1:R5C6,2,FALSE)&"|"&VLOOKUP(RC3,Sheet1!R2C9:R6C12,MID(RC1,2,1)+2,FALSE)&"#"&VLOOKUP(RC4,Sheet1!R2C1:R5C6,MOD(RC1,10)+2,FALSE)&"|"&VLOOKUP(RC3,Sheet1!R2C9:R6C12,4,FALSE)) -> 1|300#13|250 | O9: =IF(RC4=2,0,VLOOKUP(RC4,Sheet1!R2C1:R5C6,2,FALSE)&"|"&VLOOKUP(RC3,Sheet1!R8C9:R12C12,MID(RC1,2,1)+2,FALSE)&"#"&VLOOKUP(RC4,Sheet1!R2C1:R5C6,MOD(RC1,10)+2,FALSE)&"|"&VLOOKUP(RC3,Sheet1!R8C9:R12C12,4,FALSE)) -> 1|20#13|25 | P9: =IF(RC4=2,0,VLOOKUP(RC4,Sheet1!R2C1:R5C6,2,FALSE)&"|"&VLOOKUP(RC4,Sheet1!R2C1:R5C6,7-MOD(RC1,10),FALSE)) -> 1|11 | Q9: =IF(RC4=2,0,VLOOKUP(RC3,Sheet1!R14C9:R18C12,MID(RC1,2,1)+2,FALSE)&"|"&VLOOKUP(RC3,Sheet1!R14C9:R18C12,4,FALSE)) -> 100|125 | R9: 19|12 | T9: 1
A10: 40303 | B10: 宁静符文 | C10: 3 | D10: 0 | E10: 0 | G10: 80 | H10: 20 | I10: 10000 | J10: 10000 | K10: 50 | L10: 40303 | M10: 心绪宁静，思虑千里。 | N10: =IF(RC4=2,0,VLOOKUP(RC4,Sheet1!R2C1:R5C6,2,FALSE)&"|"&VLOOKUP(RC3,Sheet1!R2C9:R6C12,MID(RC1,2,1)+2,FALSE)&"#"&VLOOKUP(RC4,Sheet1!R2C1:R5C6,MOD(RC1,10)+2,FALSE)&"|"&VLOOKUP(RC3,Sheet1!R2C9:R6C12,4,FALSE)) -> 1|300#11|250 | O10: =IF(RC4=2,0,VLOOKUP(RC4,Sheet1!R2C1:R5C6,2,FALSE)&"|"&VLOOKUP(RC3,Sheet1!R8C9:R12C12,MID(RC1,2,1)+2,FALSE)&"#"&VLOOKUP(RC4,Sheet1!R2C1:R5C6,MOD(RC1,10)+2,FALSE)&"|"&VLOOKUP(RC3,Sheet1!R8C9:R12C12,4,FALSE)) -> 1|20#11|25 | P10: =IF(RC4=2,0,VLOOKUP(RC4,Sheet1!R2C1:R5C6,2,FALSE)&"|"&VLOOKUP(RC4,Sheet1!R2C1:R5C6,7-MOD(RC1,10),FALSE)) -> 1|13 | Q10: =IF(RC4=2,0,VLOOKUP(RC3,Sheet1!R14C9:R18C12,MID(RC1,2,1)+2,FALSE)&"|"&VLOOKUP(RC3,Sheet1!R14C9:R18C12,4,FALSE)) -> 100|125 | R10: 19|12 | T10: 1
A11: 40304 | B11: 暴躁符文 | C11: 3 | D11: 0 | E11: 0 | G11: 80 | H11: 20 | I11: 10000 | J11: 10000 | K11: 50 | L11: 40304 | M11: 一言不合，暴起杀人。 | N11: =IF(RC4=2,0,VLOOKUP(RC4,Sheet1!R2C1:R5C6,2,FALSE)&"|"&VLOOKUP(RC3,Sheet1!R2C9:R6C12,MID(RC1,2,1)+2,FALSE)&"#"&VLOOKUP(RC4,Sheet1!R2C1:R5C6,MOD(RC1,10)+2,FALSE)&"|"&VLOOKUP(RC3,Sheet1!R2C9:R6C12,4,FALSE)) -> 1|300#13|250 | O11: =IF(RC4=2,0,VLOOKUP(RC4,Sheet1!R2C1:R5C6,2,FALSE)&"|"&VLOOKUP(RC3,Sheet1!R8C9:R12C12,MID(RC1,2,1)+2,FALSE)&"#"&VLOOKUP(RC4,Sheet1!R2C1:R5C6,MOD(RC1,10)+2,FALSE)&"|"&VLOOKUP(RC3,Sheet1!R8C9:R12C12,4,FALSE)) -> 1|20#13|25 | P11: =IF(RC4=2,0,VLOOKUP(RC4,Sheet1!R2C1:R5C6,2,FALSE)&"|"&VLOOKUP(RC4,Sheet1!R2C1:R5C6,7-MOD(RC1,10),FALSE)) -> 1|11 | Q11: =IF(RC4=2,0,VLOOKUP(RC3,Sheet1!R14C9:R18C12,MID(RC1,2,1)+2,FALSE)&"|"&VLOOKUP(RC3,Sheet1!R14C9:R18C12,4,FALSE)) -> 100|125 | R11: 19|12 | T11: 1
A12: 40401 | B12: 统帅符文 | C12: =MOD(INT(RC[-2]/100),10) -> 4 | D12: 0 | E12: 40501 | F12: 10113 | G12: 80 | H12: 20 | I12: 20000 | J12: 20000 | K12: 50 | L12: 40401 | M12: 统帅者之证，胜利者之证。 | N12: =IF(RC4=2,0,VLOOKUP(RC4,Sheet1!R2C1:R5C6,2,FALSE)&"|"&VLOOKUP(RC3,Sheet1!R2C9:R6C12,MID(RC1,2,1)+2,FALSE)&"#"&VLOOKUP(RC4,Sheet1!R2C1:R5C6,MOD(RC1,10)+2,FALSE)&"|"&VLOOKUP(RC3,Sheet1!R2C9:R6C12,4,FALSE)) -> 1|480#11|400 | O12: =IF(RC4=2,0,VLOOKUP(RC4,Sheet1!R2C1:R5C6,2,FALSE)&"|"&VLOOKUP(RC3,Sheet1!R8C9:R12C12,MID(RC1,2,1)+2,FALSE)&"#"&VLOOKUP(RC4,Sheet1!R2C1:R5C6,MOD(RC1,10)+2,FALSE)&"|"&VLOOKUP(RC3,Sheet1!R8C9:R12C12,4,FALSE)) -> 1|35#11|40 | P12: =IF(RC4=2,0,VLOOKUP(RC4,Sheet1!R2C1:R5C6,2,FALSE)&"|"&VLOOKUP(RC4,Sheet1!R2C1:R5C6,7-MOD(RC1,10),FALSE)) -> 1|13 | Q12: =IF(RC4=2,0,VLOOKUP(RC3,Sheet1!R14C9:R18C12,MID(RC1,2,1)+2,FALSE)&"|"&VLOOKUP(RC3,Sheet1!R14C9:R18C12,4,FALSE)) -> 180|200 | R12: 19|12 | T12: 1
A13: 40402 | B13: 屠戮符文 | C13: =MOD(INT(RC[-2]/100),10) -> 4 | D13: 0 | E13: 40502 | F13: 10113 | G13: 80 | H13: 20 | I13: 20000 | J13: 20000 | K13: 50 | L13: 40402 | M13: 屠戮者之证，存活者之证。 | N13: =IF(RC4=2,0,VLOOKUP(RC4,Sheet1!R2C1:R5C6,2,FALSE)&"|"&VLOOKUP(RC3,Sheet1!R2C9:R6C12,MID(RC1,2,1)+2,FALSE)&"#"&VLOOKUP(RC4,Sheet1!R2C1:R5C6,MOD(RC1,10)+2,FALSE)&"|"&VLOOKUP(RC3,Sheet1!R2C9:R6C12,4,FALSE)) -> 1|480#13|400 | O13: =IF(RC4=2,0,VLOOKUP(RC4,Sheet1!R2C1:R5C6,2,FALSE)&"|"&VLOOKUP(RC3,Sheet1!R8C9:R12C12,MID(RC1,2,1)+2,FALSE)&"#"&VLOOKUP(RC4,Sheet1!R2C1:R5C6,MOD(RC1,10)+2,FALSE)&"|"&VLOOKUP(RC3,Sheet1!R8C9:R12C12,4,FALSE)) -> 1|35#13|40 | P13: =IF(RC4=2,0,VLOOKUP(RC4,Sheet1!R2C1:R5C6,2,FALSE)&"|"&VLOOKUP(RC4,Sheet1!R2C1:R5C6,7-MOD(RC1,10),FALSE)) -> 1|11 | Q13: =IF(RC4=2,0,VLOOKUP(RC3,Sheet1!R14C9:R18C12,MID(RC1,2,1)+2,FALSE)&"|"&VLOOKUP(RC3,Sheet1!R14C9:R18C12,4,FALSE)) -> 180|200 | R13: 19|12 | T13: 1
A14: 40403 | B14: 沉眠符文 | C14: 4 | D14: 0 | E14: 40503 | F14: 10113 | G14: 80 | H14: 20 | I14: 20000 | J14: 20000 | K14: 50 | L14: 40403 | M14: 沉眠者之证，见证者之证。 | N14: =IF(RC4=2,0,VLOOKUP(RC4,Sheet1!R2C1:R5C6,2,FALSE)&"|"&VLOOKUP(RC3,Sheet1!R2C9:R6C12,MID(RC1,2,1)+2,FALSE)&"#"&VLOOKUP(RC4,Sheet1!R2C1:R5C6,MOD(RC1,10)+2,FALSE)&"|"&VLOOKUP(RC3,Sheet1!R2C9:R6C12,4,FALSE)) -> 1|480#11|400 | O14: =IF(RC4=2,0,VLOOKUP(RC4,Sheet1!R2C1:R5C6,2,FALSE)&"|"&VLOOKUP(RC3,Sheet1!R8C9:R12C12,MID(RC1,2,1)+2,FALSE)&"#"&VLOOKUP(RC4,Sheet1!R2C1:R5C6,MOD(RC1,10)+2,FALSE)&"|"&VLOOKUP(RC3,Sheet1!R8C9:R12C12,4,FALSE)) -> 1|35#11|40 | P14: =IF(RC4=2,0,VLOOKUP(RC4,Sheet1!R2C1:R5C6,2,FALSE)&"|"&VLOOKUP(RC4,Sheet1!R2C1:R5C6,7-MOD(RC1,10),FALSE)) -> 1|13 | Q14: =IF(RC4=2,0,VLOOKUP(RC3,Sheet1!R14C9:R18C12,MID(RC1,2,1)+2,FALSE)&"|"&VLOOKUP(RC3,Sheet1!R14C9:R18C12,4,FALSE)) -> 180|200 | R14: 19|12 | T14: 1
A15: 40404 | B15: 狂野符文 | C15: 4 | D15: 0 | E15: 40504 | F15: 10113 | G15: 80 | H15: 20 | I15: 20000 | J15: 20000 | K15: 50 | L15: 40404 | M15: 狂野者之证，发起者之证。 | N15: =IF(RC4=2,0,VLOOKUP(RC4,Sheet1!R2C1:R5C6,2,FALSE)&"|"&VLOOKUP(RC3,Sheet1!R2C9:R6C12,MID(RC1,2,1)+2,FALSE)&"#"&VLOOKUP(RC4,Sheet1!R2C1:R5C6,MOD(RC1,10)+2,FALSE)&"|"&VLOOKUP(RC3,Sheet1!R2C9:R6C12,4,FALSE)) -> 1|480#13|400 | O15: =IF(RC4=2,0,VLOOKUP(RC4,Sheet1!R2C1:R5C6,2,FALSE)&"|"&VLOOKUP(RC3,Sheet1!R8C9:R12C12,MID(RC1,2,1)+2,FALSE)&"#"&VLOOKUP(RC4,Sheet1!R2C1:R5C6,MOD(RC1,10)+2,FALSE)&"|"&VLOOKUP(RC3,Sheet1!R8C9:R12C12,4,FALSE)) -> 1|35#13|40 | P15: =IF(RC4=2,0,VLOOKUP(RC4,Sheet1!R2C1:R5C6,2,FALSE)&"|"&VLOOKUP(RC4,Sheet1!R2C1:R5C6,7-MOD(RC1,10),FALSE)) -> 1|11 | Q15: =IF(RC4=2,0,VLOOKUP(RC3,Sheet1!R14C9:R18C12,MID(RC1,2,1)+2,FALSE)&"|"&VLOOKUP(RC3,Sheet1!R14C9:R18C12,4,FALSE)) -> 180|200 | R15: 19|12 | T15: 1
A16: 40501 | B16: 王者符文 | C16: =MOD(INT(RC[-2]/100),10) -> 5 | D16: 0 | E16: 0 | G16: 80 | H16: 20 | I16: 50000 | J16: 50000 | K16: 50 | L16: 40501 | M16: 造就胜利者，造就历史者，造就天下者，即众生之王。 | N16: =IF(RC4=2,0,VLOOKUP(RC4,Sheet1!R2C1:R5C6,2,FALSE)&"|"&VLOOKUP(RC3,Sheet1!R2C9:R6C12,MID(RC1,2,1)+2,FALSE)&"#"&VLOOKUP(RC4,Sheet1!R2C1:R5C6,MOD(RC1,10)+2,FALSE)&"|"&VLOOKUP(RC3,Sheet1!R2C9:R6C12,4,FALSE)) -> 1|720#11|600 | O16: =IF(RC4=2,0,VLOOKUP(RC4,Sheet1!R2C1:R5C6,2,FALSE)&"|"&VLOOKUP(RC3,Sheet1!R8C9:R12C12,MID(RC1,2,1)+2,FALSE)&"#"&VLOOKUP(RC4,Sheet1!R2C1:R5C6,MOD(RC1,10)+2,FALSE)&"|"&VLOOKUP(RC3,Sheet1!R8C9:R12C12,4,FALSE)) -> 1|60#11|60 | P16: =IF(RC4=2,0,VLOOKUP(RC4,Sheet1!R2C1:R5C6,2,FALSE)&"|"&VLOOKUP(RC4,Sheet1!R2C1:R5C6,7-MOD(RC1,10),FALSE)) -> 1|13 | Q16: =IF(RC4=2,0,VLOOKUP(RC3,Sheet1!R14C9:R18C12,MID(RC1,2,1)+2,FALSE)&"|"&VLOOKUP(RC3,Sheet1!R14C9:R18C12,4,FALSE)) -> 300|300 | R16: 19|12 | T16: 1
A17: 40502 | B17: 毁灭符文 | C17: =MOD(INT(RC[-2]/100),10) -> 5 | D17: 0 | E17: 0 | G17: 80 | H17: 20 | I17: 50000 | J17: 50000 | K17: 50 | L17: 40502 | M17: 破灭希望者，破灭生命者，破灭世界者，即毁灭之主。 | N17: =IF(RC4=2,0,VLOOKUP(RC4,Sheet1!R2C1:R5C6,2,FALSE)&"|"&VLOOKUP(RC3,Sheet1!R2C9:R6C12,MID(RC1,2,1)+2,FALSE)&"#"&VLOOKUP(RC4,Sheet1!R2C1:R5C6,MOD(RC1,10)+2,FALSE)&"|"&VLOOKUP(RC3,Sheet1!R2C9:R6C12,4,FALSE)) -> 1|720#13|600 | O17: =IF(RC4=2,0,VLOOKUP(RC4,Sheet1!R2C1:R5C6,2,FALSE)&"|"&VLOOKUP(RC3,Sheet1!R8C9:R12C12,MID(RC1,2,1)+2,FALSE)&"#"&VLOOKUP(RC4,Sheet1!R2C1:R5C6,MOD(RC1,10)+2,FALSE)&"|"&VLOOKUP(RC3,Sheet1!R8C9:R12C12,4,FALSE)) -> 1|60#13|60 | P17: =IF(RC4=2,0,VLOOKUP(RC4,Sheet1!R2C1:R5C6,2,FALSE)&"|"&VLOOKUP(RC4,Sheet1!R2C1:R5C6,7-MOD(RC1,10),FALSE)) -> 1|11 | Q17: =IF(RC4=2,0,VLOOKUP(RC3,Sheet1!R14C9:R18C12,MID(RC1,2,1)+2,FALSE)&"|"&VLOOKUP(RC3,Sheet1!R14C9:R18C12,4,FALSE)) -> 300|300 | R17: 19|12 | T17: 1
A18: 40503 | B18: 永寂符文 | C18: 5 | D18: 0 | E18: 0 | G18: 80 | H18: 20 | I18: 50000 | J18: 50000 | K18: 50 | L18: 40503 | M18: 寂于深海者，寂于虚无者，寂于永恒者，即永寂之主。 | N18: =IF(RC4=2,0,VLOOKUP(RC4,Sheet1!R2C1:R5C6,2,FALSE)&"|"&VLOOKUP(RC3,Sheet1!R2C9:R6C12,MID(RC1,2,1)+2,FALSE)&"#"&VLOOKUP(RC4,Sheet1!R2C1:R5C6,MOD(RC1,10)+2,FALSE)&"|"&VLOOKUP(RC3,Sheet1!R2C9:R6C12,4,FALSE)) -> 1|720#11|600 | O18: =IF(RC4=2,0,VLOOKUP(RC4,Sheet1!R2C1:R5C6,2,FALSE)&"|"&VLOOKUP(RC3,Sheet1!R8C9:R12C12,MID(RC1,2,1)+2,FALSE)&"#"&VLOOKUP(RC4,Sheet1!R2C1:R5C6,MOD(RC1,10)+2,FALSE)&"|"&VLOOKUP(RC3,Sheet1!R8C9:R12C12,4,FALSE)) -> 1|60#11|60 | P18: =IF(RC4=2,0,VLOOKUP(RC4,Sheet1!R2C1:R5C6,2,FALSE)&"|"&VLOOKUP(RC4,Sheet1!R2C1:R5C6,7-MOD(RC1,10),FALSE)) -> 1|13 | Q18: =IF(RC4=2,0,VLOOKUP(RC3,Sheet1!R14C9:R18C12,MID(RC1,2,1)+2,FALSE)&"|"&VLOOKUP(RC3,Sheet1!R14C9:R18C12,4,FALSE)) -> 300|300 | R18: 19|12 | T18: 1
A19: 40504 | B19: 疯狂符文 | C19: 5 | D19: 0 | E19: 0 | G19: 80 | H19: 20 | I19: 50000 | J19: 50000 | K19: 50 | L19: 40504 | M19: 沉浸血腥者，沉浸杀戮者，沉浸死亡者，即疯狂之王。 | N19: =IF(RC4=2,0,VLOOKUP(RC4,Sheet1!R2C1:R5C6,2,FALSE)&"|"&VLOOKUP(RC3,Sheet1!R2C9:R6C12,MID(RC1,2,1)+2,FALSE)&"#"&VLOOKUP(RC4,Sheet1!R2C1:R5C6,MOD(RC1,10)+2,FALSE)&"|"&VLOOKUP(RC3,Sheet1!R2C9:R6C12,4,FALSE)) -> 1|720#13|600 | O19: =IF(RC4=2,0,VLOOKUP(RC4,Sheet1!R2C1:R5C6,2,FALSE)&"|"&VLOOKUP(RC3,Sheet1!R8C9:R12C12,MID(RC1,2,1)+2,FALSE)&"#"&VLOOKUP(RC4,Sheet1!R2C1:R5C6,MOD(RC1,10)+2,FALSE)&"|"&VLOOKUP(RC3,Sheet1!R8C9:R12C12,4,FALSE)) -> 1|60#13|60 | P19: =IF(RC4=2,0,VLOOKUP(RC4,Sheet1!R2C1:R5C6,2,FALSE)&"|"&VLOOKUP(RC4,Sheet1!R2C1:R5C6,7-MOD(RC1,10),FALSE)) -> 1|11 | Q19: =IF(RC4=2,0,VLOOKUP(RC3,Sheet1!R14C9:R18C12,MID(RC1,2,1)+2,FALSE)&"|"&VLOOKUP(RC3,Sheet1!R14C9:R18C12,4,FALSE)) -> 300|300 | R19: 19|12 | T19: 1
A20: 41201 | B20: 沙尘徽章 | C20: =MOD(INT(RC[-2]/100),10) -> 2 | D20: 1 | E20: 0 | G20: 80 | H20: 20 | I20: 1200 | J20: 1200 | K20: 50 | L20: 41201 | M20: 像沙尘一样微不足道。 | N20: =IF(RC4=2,0,VLOOKUP(RC4,Sheet1!R2C1:R5C6,2,FALSE)&"|"&VLOOKUP(RC3,Sheet1!R2C9:R6C12,MID(RC1,2,1)+2,FALSE)&"#"&VLOOKUP(RC4,Sheet1!R2C1:R5C6,MOD(RC1,10)+2,FALSE)&"|"&VLOOKUP(RC3,Sheet1!R2C9:R6C12,4,FALSE)) -> 4|1800#12|150 | O20: =IF(RC4=2,0,VLOOKUP(RC4,Sheet1!R2C1:R5C6,2,FALSE)&"|"&VLOOKUP(RC3,Sheet1!R8C9:R12C12,MID(RC1,2,1)+2,FALSE)&"#"&VLOOKUP(RC4,Sheet1!R2C1:R5C6,MOD(RC1,10)+2,FALSE)&"|"&VLOOKUP(RC3,Sheet1!R8C9:R12C12,4,FALSE)) -> 4|100#12|15 | P20: =IF(RC4=2,0,VLOOKUP(RC4,Sheet1!R2C1:R5C6,2,FALSE)&"|"&VLOOKUP(RC4,Sheet1!R2C1:R5C6,7-MOD(RC1,10),FALSE)) -> 4|14 | Q20: =IF(RC4=2,0,VLOOKUP(RC3,Sheet1!R14C9:R18C12,MID(RC1,2,1)+2,FALSE)&"|"&VLOOKUP(RC3,Sheet1!R14C9:R18C12,4,FALSE)) -> 600|75 | R20: 19|12 | T20: 1
A21: 41301 | B21: 荆棘徽章 | C21: =MOD(INT(RC[-2]/100),10) -> 3 | D21: 1 | E21: 0 | G21: 80 | H21: 20 | I21: 10000 | J21: 10000 | K21: 50 | L21: 41301 | M21: 荆棘将环绕并刺穿这一切。 | N21: =IF(RC4=2,0,VLOOKUP(RC4,Sheet1!R2C1:R5C6,2,FALSE)&"|"&VLOOKUP(RC3,Sheet1!R2C9:R6C12,MID(RC1,2,1)+2,FALSE)&"#"&VLOOKUP(RC4,Sheet1!R2C1:R5C6,MOD(RC1,10)+2,FALSE)&"|"&VLOOKUP(RC3,Sheet1!R2C9:R6C12,4,FALSE)) -> 4|3000#12|250 | O21: =IF(RC4=2,0,VLOOKUP(RC4,Sheet1!R2C1:R5C6,2,FALSE)&"|"&VLOOKUP(RC3,Sheet1!R8C9:R12C12,MID(RC1,2,1)+2,FALSE)&"#"&VLOOKUP(RC4,Sheet1!R2C1:R5C6,MOD(RC1,10)+2,FALSE)&"|"&VLOOKUP(RC3,Sheet1!R8C9:R12C12,4,FALSE)) -> 4|200#12|25 | P21: =IF(RC4=2,0,VLOOKUP(RC4,Sheet1!R2C1:R5C6,2,FALSE)&"|"&VLOOKUP(RC4,Sheet1!R2C1:R5C6,7-MOD(RC1,10),FALSE)) -> 4|14 | Q21: =IF(RC4=2,0,VLOOKUP(RC3,Sheet1!R14C9:R18C12,MID(RC1,2,1)+2,FALSE)&"|"&VLOOKUP(RC3,Sheet1!R14C9:R18C12,4,FALSE)) -> 1000|125 | R21: 19|12 | T21: 1
A22: 41302 | B22: 恶狼徽章 | C22: =MOD(INT(RC[-2]/100),10) -> 3 | D22: 1 | E22: 0 | G22: 80 | H22: 20 | I22: 10000 | J22: 10000 | K22: 50 | L22: 41302 | M22: 恶狼将猎杀并啃食这一切。 | N22: =IF(RC4=2,0,VLOOKUP(RC4,Sheet1!R2C1:R5C6,2,FALSE)&"|"&VLOOKUP(RC3,Sheet1!R2C9:R6C12,MID(RC1,2,1)+2,FALSE)&"#"&VLOOKUP(RC4,Sheet1!R2C1:R5C6,MOD(RC1,10)+2,FALSE)&"|"&VLOOKUP(RC3,Sheet1!R2C9:R6C12,4,FALSE)) -> 4|3000#14|250 | O22: =IF(RC4=2,0,VLOOKUP(RC4,Sheet1!R2C1:R5C6,2,FALSE)&"|"&VLOOKUP(RC3,Sheet1!R8C9:R12C12,MID(RC1,2,1)+2,FALSE)&"#"&VLOOKUP(RC4,Sheet1!R2C1:R5C6,MOD(RC1,10)+2,FALSE)&"|"&VLOOKUP(RC3,Sheet1!R8C9:R12C12,4,FALSE)) -> 4|200#14|25 | P22: =IF(RC4=2,0,VLOOKUP(RC4,Sheet1!R2C1:R5C6,2,FALSE)&"|"&VLOOKUP(RC4,Sheet1!R2C1:R5C6,7-MOD(RC1,10),FALSE)) -> 4|12 | Q22: =IF(RC4=2,0,VLOOKUP(RC3,Sheet1!R14C9:R18C12,MID(RC1,2,1)+2,FALSE)&"|"&VLOOKUP(RC3,Sheet1!R14C9:R18C12,4,FALSE)) -> 1000|125 | R22: 19|12 | T22: 1
A23: 41303 | B23: 飞鸟徽章 | C23: 3 | D23: 1 | E23: 0 | G23: 80 | H23: 20 | I23: 10000 | J23: 10000 | K23: 50 | L23: 41303 | M23: 飞鸟将展翅并远离这一切。 | N23: =IF(RC4=2,0,VLOOKUP(RC4,Sheet1!R2C1:R5C6,2,FALSE)&"|"&VLOOKUP(RC3,Sheet1!R2C9:R6C12,MID(RC1,2,1)+2,FALSE)&"#"&VLOOKUP(RC4,Sheet1!R2C1:R5C6,MOD(RC1,10)+2,FALSE)&"|"&VLOOKUP(RC3,Sheet1!R2C9:R6C12,4,FALSE)) -> 4|3000#12|250 | O23: =IF(RC4=2,0,VLOOKUP(RC4,Sheet1!R2C1:R5C6,2,FALSE)&"|"&VLOOKUP(RC3,Sheet1!R8C9:R12C12,MID(RC1,2,1)+2,FALSE)&"#"&VLOOKUP(RC4,Sheet1!R2C1:R5C6,MOD(RC1,10)+2,FALSE)&"|"&VLOOKUP(RC3,Sheet1!R8C9:R12C12,4,FALSE)) -> 4|200#12|25 | P23: =IF(RC4=2,0,VLOOKUP(RC4,Sheet1!R2C1:R5C6,2,FALSE)&"|"&VLOOKUP(RC4,Sheet1!R2C1:R5C6,7-MOD(RC1,10),FALSE)) -> 4|14 | Q23: =IF(RC4=2,0,VLOOKUP(RC3,Sheet1!R14C9:R18C12,MID(RC1,2,1)+2,FALSE)&"|"&VLOOKUP(RC3,Sheet1!R14C9:R18C12,4,FALSE)) -> 1000|125 | R23: 19|12 | T23: 1
A24: 41304 | B24: 绿叶徽章 | C24: 3 | D24: 1 | E24: 0 | G24: 80 | H24: 20 | I24: 10000 | J24: 10000 | K24: 50 | L24: 41304 | M24: 绿叶将伸展并承担这一切。 | N24: =IF(RC4=2,0,VLOOKUP(RC4,Sheet1!R2C1:R5C6,2,FALSE)&"|"&VLOOKUP(RC3,Sheet1!R2C9:R6C12,MID(RC1,2,1)+2,FALSE)&"#"&VLOOKUP(RC4,Sheet1!R2C1:R5C6,MOD(RC1,10)+2,FALSE)&"|"&VLOOKUP(RC3,Sheet1!R2C9:R6C12,4,FALSE)) -> 4|3000#14|250 | O24: =IF(RC4=2,0,VLOOKUP(RC4,Sheet1!R2C1:R5C6,2,FALSE)&"|"&VLOOKUP(RC3,Sheet1!R8C9:R12C12,MID(RC1,2,1)+2,FALSE)&"#"&VLOOKUP(RC4,Sheet1!R2C1:R5C6,MOD(RC1,10)+2,FALSE)&"|"&VLOOKUP(RC3,Sheet1!R8C9:R12C12,4,FALSE)) -> 4|200#14|25 | P24: =IF(RC4=2,0,VLOOKUP(RC4,Sheet1!R2C1:R5C6,2,FALSE)&"|"&VLOOKUP(RC4,Sheet1!R2C1:R5C6,7-MOD(RC1,10),FALSE)) -> 4|12 | Q24: =IF(RC4=2,0,VLOOKUP(RC3,Sheet1!R14C9:R18C12,MID(RC1,2,1)+2,FALSE)&"|"&VLOOKUP(RC3,Sheet1!R14C9:R18C12,4,FALSE)) -> 1000|125 | R24: 19|12 | T24: 1
A25: 41401 | B25: 高山徽章 | C25: =MOD(INT(RC[-2]/100),10) -> 4 | D25: 1 | E25: 41501 | F25: 10114 | G25: 80 | H25: 20 | I25: 20000 | J25: 20000 | K25: 50 | L25: 41401 | M25: 如同高峰一样屹立，无所畏惧。 | N25: =IF(RC4=2,0,VLOOKUP(RC4,Sheet1!R2C1:R5C6,2,FALSE)&"|"&VLOOKUP(RC3,Sheet1!R2C9:R6C12,MID(RC1,2,1)+2,FALSE)&"#"&VLOOKUP(RC4,Sheet1!R2C1:R5C6,MOD(RC1,10)+2,FALSE)&"|"&VLOOKUP(RC3,Sheet1!R2C9:R6C12,4,FALSE)) -> 4|4800#12|400 | O25: =IF(RC4=2,0,VLOOKUP(RC4,Sheet1!R2C1:R5C6,2,FALSE)&"|"&VLOOKUP(RC3,Sheet1!R8C9:R12C12,MID(RC1,2,1)+2,FALSE)&"#"&VLOOKUP(RC4,Sheet1!R2C1:R5C6,MOD(RC1,10)+2,FALSE)&"|"&VLOOKUP(RC3,Sheet1!R8C9:R12C12,4,FALSE)) -> 4|350#12|40 | P25: =IF(RC4=2,0,VLOOKUP(RC4,Sheet1!R2C1:R5C6,2,FALSE)&"|"&VLOOKUP(RC4,Sheet1!R2C1:R5C6,7-MOD(RC1,10),FALSE)) -> 4|14 | Q25: =IF(RC4=2,0,VLOOKUP(RC3,Sheet1!R14C9:R18C12,MID(RC1,2,1)+2,FALSE)&"|"&VLOOKUP(RC3,Sheet1!R14C9:R18C12,4,FALSE)) -> 1800|200 | R25: 19|12 | T25: 1
A26: 41402 | B26: 狮王徽章 | C26: =MOD(INT(RC[-2]/100),10) -> 4 | D26: 1 | E26: 41502 | F26: 10114 | G26: 80 | H26: 20 | I26: 20000 | J26: 20000 | K26: 50 | L26: 41402 | M26: 如同狮王一样征服，无可抵挡。 | N26: =IF(RC4=2,0,VLOOKUP(RC4,Sheet1!R2C1:R5C6,2,FALSE)&"|"&VLOOKUP(RC3,Sheet1!R2C9:R6C12,MID(RC1,2,1)+2,FALSE)&"#"&VLOOKUP(RC4,Sheet1!R2C1:R5C6,MOD(RC1,10)+2,FALSE)&"|"&VLOOKUP(RC3,Sheet1!R2C9:R6C12,4,FALSE)) -> 4|4800#14|400 | O26: =IF(RC4=2,0,VLOOKUP(RC4,Sheet1!R2C1:R5C6,2,FALSE)&"|"&VLOOKUP(RC3,Sheet1!R8C9:R12C12,MID(RC1,2,1)+2,FALSE)&"#"&VLOOKUP(RC4,Sheet1!R2C1:R5C6,MOD(RC1,10)+2,FALSE)&"|"&VLOOKUP(RC3,Sheet1!R8C9:R12C12,4,FALSE)) -> 4|350#14|40 | P26: =IF(RC4=2,0,VLOOKUP(RC4,Sheet1!R2C1:R5C6,2,FALSE)&"|"&VLOOKUP(RC4,Sheet1!R2C1:R5C6,7-MOD(RC1,10),FALSE)) -> 4|12 | Q26: =IF(RC4=2,0,VLOOKUP(RC3,Sheet1!R14C9:R18C12,MID(RC1,2,1)+2,FALSE)&"|"&VLOOKUP(RC3,Sheet1!R14C9:R18C12,4,FALSE)) -> 1800|200 | R26: 19|12 | T26: 1
A27: 41403 | B27: 孔雀徽章 | C27: 4 | D27: 1 | E27: 41503 | F27: 10114 | G27: 80 | H27: 20 | I27: 20000 | J27: 20000 | K27: 50 | L27: 41403 | M27: 如同孔雀一样绽放，举世无双。 | N27: =IF(RC4=2,0,VLOOKUP(RC4,Sheet1!R2C1:R5C6,2,FALSE)&"|"&VLOOKUP(RC3,Sheet1!R2C9:R6C12,MID(RC1,2,1)+2,FALSE)&"#"&VLOOKUP(RC4,Sheet1!R2C1:R5C6,MOD(RC1,10)+2,FALSE)&"|"&VLOOKUP(RC3,Sheet1!R2C9:R6C12,4,FALSE)) -> 4|4800#12|400 | O27: =IF(RC4=2,0,VLOOKUP(RC4,Sheet1!R2C1:R5C6,2,FALSE)&"|"&VLOOKUP(RC3,Sheet1!R8C9:R12C12,MID(RC1,2,1)+2,FALSE)&"#"&VLOOKUP(RC4,Sheet1!R2C1:R5C6,MOD(RC1,10)+2,FALSE)&"|"&VLOOKUP(RC3,Sheet1!R8C9:R12C12,4,FALSE)) -> 4|350#12|40 | P27: =IF(RC4=2,0,VLOOKUP(RC4,Sheet1!R2C1:R5C6,2,FALSE)&"|"&VLOOKUP(RC4,Sheet1!R2C1:R5C6,7-MOD(RC1,10),FALSE)) -> 4|14 | Q27: =IF(RC4=2,0,VLOOKUP(RC3,Sheet1!R14C9:R18C12,MID(RC1,2,1)+2,FALSE)&"|"&VLOOKUP(RC3,Sheet1!R14C9:R18C12,4,FALSE)) -> 1800|200 | R27: 19|12 | T27: 1
A28: 41404 | B28: 巨木徽章 | C28: 4 | D28: 1 | E28: 41504 | F28: 10114 | G28: 80 | H28: 20 | I28: 20000 | J28: 20000 | K28: 50 | L28: 41404 | M28: 如同巨木一样生根，风雨无惧。 | N28: =IF(RC4=2,0,VLOOKUP(RC4,Sheet1!R2C1:R5C6,2,FALSE)&"|"&VLOOKUP(RC3,Sheet1!R2C9:R6C12,MID(RC1,2,1)+2,FALSE)&"#"&VLOOKUP(RC4,Sheet1!R2C1:R5C6,MOD(RC1,10)+2,FALSE)&"|"&VLOOKUP(RC3,Sheet1!R2C9:R6C12,4,FALSE)) -> 4|4800#14|400 | O28: =IF(RC4=2,0,VLOOKUP(RC4,Sheet1!R2C1:R5C6,2,FALSE)&"|"&VLOOKUP(RC3,Sheet1!R8C9:R12C12,MID(RC1,2,1)+2,FALSE)&"#"&VLOOKUP(RC4,Sheet1!R2C1:R5C6,MOD(RC1,10)+2,FALSE)&"|"&VLOOKUP(RC3,Sheet1!R8C9:R12C12,4,FALSE)) -> 4|350#14|40 | P28: =IF(RC4=2,0,VLOOKUP(RC4,Sheet1!R2C1:R5C6,2,FALSE)&"|"&VLOOKUP(RC4,Sheet1!R2C1:R5C6,7-MOD(RC1,10),FALSE)) -> 4|12 | Q28: =IF(RC4=2,0,VLOOKUP(RC3,Sheet1!R14C9:R18C12,MID(RC1,2,1)+2,FALSE)&"|"&VLOOKUP(RC3,Sheet1!R14C9:R18C12,4,FALSE)) -> 1800|200 | R28: 19|12 | T28: 1
A29: 41501 | B29: 恒阳徽章 | C29: =MOD(INT(RC[-2]/100),10) -> 5 | D29: 1 | E29: 0 | G29: 80 | H29: 20 | I29: 50000 | J29: 50000 | K29: 50 | L29: 41501 | M29: 炎阳悬挂于天外，如这世界一般的永恒。 | N29: =IF(RC4=2,0,VLOOKUP(RC4,Sheet1!R2C1:R5C6,2,FALSE)&"|"&VLOOKUP(RC3,Sheet1!R2C9:R6C12,MID(RC1,2,1)+2,FALSE)&"#"&VLOOKUP(RC4,Sheet1!R2C1:R5C6,MOD(RC1,10)+2,FALSE)&"|"&VLOOKUP(RC3,Sheet1!R2C9:R6C12,4,FALSE)) -> 4|7200#12|600 | O29: =IF(RC4=2,0,VLOOKUP(RC4,Sheet1!R2C1:R5C6,2,FALSE)&"|"&VLOOKUP(RC3,Sheet1!R8C9:R12C12,MID(RC1,2,1)+2,FALSE)&"#"&VLOOKUP(RC4,Sheet1!R2C1:R5C6,MOD(RC1,10)+2,FALSE)&"|"&VLOOKUP(RC3,Sheet1!R8C9:R12C12,4,FALSE)) -> 4|600#12|60 | P29: =IF(RC4=2,0,VLOOKUP(RC4,Sheet1!R2C1:R5C6,2,FALSE)&"|"&VLOOKUP(RC4,Sheet1!R2C1:R5C6,7-MOD(RC1,10),FALSE)) -> 4|14 | Q29: =IF(RC4=2,0,VLOOKUP(RC3,Sheet1!R14C9:R18C12,MID(RC1,2,1)+2,FALSE)&"|"&VLOOKUP(RC3,Sheet1!R14C9:R18C12,4,FALSE)) -> 3000|300 | R29: 19|12 | T29: 1
A30: 41502 | B30: 巨龙徽章 | C30: =MOD(INT(RC[-2]/100),10) -> 5 | D30: 1 | E30: 0 | G30: 80 | H30: 20 | I30: 50000 | J30: 50000 | K30: 50 | L30: 41502 | M30: 巨龙站立于顶端，无人可以撼动的强大。 | N30: =IF(RC4=2,0,VLOOKUP(RC4,Sheet1!R2C1:R5C6,2,FALSE)&"|"&VLOOKUP(RC3,Sheet1!R2C9:R6C12,MID(RC1,2,1)+2,FALSE)&"#"&VLOOKUP(RC4,Sheet1!R2C1:R5C6,MOD(RC1,10)+2,FALSE)&"|"&VLOOKUP(RC3,Sheet1!R2C9:R6C12,4,FALSE)) -> 4|7200#14|600 | O30: =IF(RC4=2,0,VLOOKUP(RC4,Sheet1!R2C1:R5C6,2,FALSE)&"|"&VLOOKUP(RC3,Sheet1!R8C9:R12C12,MID(RC1,2,1)+2,FALSE)&"#"&VLOOKUP(RC4,Sheet1!R2C1:R5C6,MOD(RC1,10)+2,FALSE)&"|"&VLOOKUP(RC3,Sheet1!R8C9:R12C12,4,FALSE)) -> 4|600#14|60 | P30: =IF(RC4=2,0,VLOOKUP(RC4,Sheet1!R2C1:R5C6,2,FALSE)&"|"&VLOOKUP(RC4,Sheet1!R2C1:R5C6,7-MOD(RC1,10),FALSE)) -> 4|12 | Q30: =IF(RC4=2,0,VLOOKUP(RC3,Sheet1!R14C9:R18C12,MID(RC1,2,1)+2,FALSE)&"|"&VLOOKUP(RC3,Sheet1!R14C9:R18C12,4,FALSE)) -> 3000|300 | R30: 19|12 | T30: 1
A31: 41503 | B31: 凤凰徽章 | C31: 5 | D31: 1 | E31: 0 | G31: 80 | H31: 20 | I31: 50000 | J31: 50000 | K31: 50 | L31: 41503 | M31: 凤凰展翼于梧桐，拥有焚毁一切的强大。 | N31: =IF(RC4=2,0,VLOOKUP(RC4,Sheet1!R2C1:R5C6,2,FALSE)&"|"&VLOOKUP(RC3,Sheet1!R2C9:R6C12,MID(RC1,2,1)+2,FALSE)&"#"&VLOOKUP(RC4,Sheet1!R2C1:R5C6,MOD(RC1,10)+2,FALSE)&"|"&VLOOKUP(RC3,Sheet1!R2C9:R6C12,4,FALSE)) -> 4|7200#12|600 | O31: =IF(RC4=2,0,VLOOKUP(RC4,Sheet1!R2C1:R5C6,2,FALSE)&"|"&VLOOKUP(RC3,Sheet1!R8C9:R12C12,MID(RC1,2,1)+2,FALSE)&"#"&VLOOKUP(RC4,Sheet1!R2C1:R5C6,MOD(RC1,10)+2,FALSE)&"|"&VLOOKUP(RC3,Sheet1!R8C9:R12C12,4,FALSE)) -> 4|600#12|60 | P31: =IF(RC4=2,0,VLOOKUP(RC4,Sheet1!R2C1:R5C6,2,FALSE)&"|"&VLOOKUP(RC4,Sheet1!R2C1:R5C6,7-MOD(RC1,10),FALSE)) -> 4|14 | Q31: =IF(RC4=2,0,VLOOKUP(RC3,Sheet1!R14C9:R18C12,MID(RC1,2,1)+2,FALSE)&"|"&VLOOKUP(RC3,Sheet1!R14C9:R18C12,4,FALSE)) -> 3000|300 | R31: 19|12 | T31: 1
A32: 41504 | B32: 神树徽章 | C32: 5 | D32: 1 | E32: 0 | G32: 80 | H32: 20 | I32: 50000 | J32: 50000 | K32: 50 | L32: 41504 | M32: 神树承载于虚空，比世间万物更加永恒。 | N32: =IF(RC4=2,0,VLOOKUP(RC4,Sheet1!R2C1:R5C6,2,FALSE)&"|"&VLOOKUP(RC3,Sheet1!R2C9:R6C12,MID(RC1,2,1)+2,FALSE)&"#"&VLOOKUP(RC4,Sheet1!R2C1:R5C6,MOD(RC1,10)+2,FALSE)&"|"&VLOOKUP(RC3,Sheet1!R2C9:R6C12,4,FALSE)) -> 4|7200#14|600 | O32: =IF(RC4=2,0,VLOOKUP(RC4,Sheet1!R2C1:R5C6,2,FALSE)&"|"&VLOOKUP(RC3,Sheet1!R8C9:R12C12,MID(RC1,2,1)+2,FALSE)&"#"&VLOOKUP(RC4,Sheet1!R2C1:R5C6,MOD(RC1,10)+2,FALSE)&"|"&VLOOKUP(RC3,Sheet1!R8C9:R12C12,4,FALSE)) -> 4|600#14|60 | P32: =IF(RC4=2,0,VLOOKUP(RC4,Sheet1!R2C1:R5C6,2,FALSE)&"|"&VLOOKUP(RC4,Sheet1!R2C1:R5C6,7-MOD(RC1,10),FALSE)) -> 4|12 | Q32: =IF(RC4=2,0,VLOOKUP(RC3,Sheet1!R14C9:R18C12,MID(RC1,2,1)+2,FALSE)&"|"&VLOOKUP(RC3,Sheet1!R14C9:R18C12,4,FALSE)) -> 3000|300 | R32: 19|12 | T32: 1
A33: 42201 | B33: 蓝水晶 | C33: =MOD(INT(RC[-2]/100),10) -> 2 | D33: 2 | E33: 0 | G33: 0 | H33: 0 | I33: 2000 | J33: 2000 | K33: 50 | L33: 42201 | M33: 蓝水晶，为圣器提供微量能量。 | N33: 4|1 | R33: 19|12 | T33: 1
A34: 42301 | B34: 紫水晶 | C34: =MOD(INT(RC[-2]/100),10) -> 3 | D34: 2 | E34: 0 | G34: 0 | H34: 0 | I34: 15000 | J34: 15000 | K34: 50 | L34: 42301 | M34: 紫水晶，为圣器提供少量能量。 | N34: 4|1 | R34: 19|12 | T34: 1
A35: 42401 | B35: 橙水晶 | C35: =MOD(INT(RC[-2]/100),10) -> 4 | D35: 2 | E35: 0 | G35: 0 | H35: 0 | I35: 1000000 | J35: 1000000 | K35: 50 | L35: 42301 | M35: 橙水晶，为圣器提供大量能量。 | N35: 4|1 | R35: 19|12 | T35: 1
A36: 42501 | B36: 红水晶 | C36: =MOD(INT(RC[-2]/100),10) -> 5 | D36: 2 | E36: 0 | G36: 0 | H36: 0 | I36: 10000000 | J36: 10000000 | K36: 50 | L36: 42301 | M36: 红水晶，为圣器提供巨量能量。 | N36: 4|1 | R36: 19|12 | T36: 1

Sheet: 宝物强化信息
A1: quality|quality | B1: strengthen_level|strengthen_level | C1: exp|exp | D1: total_exp|total_exp | E1: cost_type_list|cost_type_list | F1: cost_value_list|cost_value_list | G1: need_level|
A2: 不可空 | B2: 不可空 | C2: 不可空 | D2: 不可空 | E2: 可空#不需字段 | F2: 可空#不需字段 | G2: 不可空
A3: 数字 | B3: 数字 | C3: 数字 | D3: 数字 | E3: 一维数组 | F3: 一维数组 | G3: 数字
E4: 不定长 | F4: 不定长
A6: 宝物品质 | B6: 强化等级 | C6: 需要的经验 | D6: 总经验 | E6: 消耗类型列表 | F6: 消耗值列表 | G6: 需要战队等级
A7: 2 | B7: 1 | C7: 1200 | D7: =IF(RC[-2]=1,0,R[-1]C+R[-1]C[-1]) -> 0 | E7: 3 | F7: =IF(RC[-4]=1,0,R[-1]C[-3]) -> 0 | G7: 10
A8: 2 | B8: 2 | C8: 3568 | D8: =IF(RC[-2]=1,0,R[-1]C+R[-1]C[-1]) -> 1200 | E8: 3 | F8: =IF(RC[-4]=1,0,R[-1]C[-3]) -> 1200 | G8: 10
A9: 2 | B9: 3 | C9: 7232 | D9: =IF(RC[-2]=1,0,R[-1]C+R[-1]C[-1]) -> 4768 | E9: 3 | F9: =IF(RC[-4]=1,0,R[-1]C[-3]) -> 3568 | G9: 10
A10: 2 | B10: 4 | C10: 12320 | D10: =IF(RC[-2]=1,0,R[-1]C+R[-1]C[-1]) -> 12000 | E10: 3 | F10: =IF(RC[-4]=1,0,R[-1]C[-3]) -> 7232 | G10: 10
A11: 2 | B11: 5 | C11: 18960 | D11: =IF(RC[-2]=1,0,R[-1]C+R[-1]C[-1]) -> 24320 | E11: 3 | F11: =IF(RC[-4]=1,0,R[-1]C[-3]) -> 12320 | G11: 10
A12: 2 | B12: 6 | C12: 27280 | D12: =IF(RC[-2]=1,0,R[-1]C+R[-1]C[-1]) -> 43280 | E12: 3 | F12: =IF(RC[-4]=1,0,R[-1]C[-3]) -> 18960 | G12: 10
A13: 2 | B13: 7 | C13: 37408 | D13: =IF(RC[-2]=1,0,R[-1]C+R[-1]C[-1]) -> 70560 | E13: 3 | F13: =IF(RC[-4]=1,0,R[-1]C[-3]) -> 27280 | G13: 10
A14: 2 | B14: 8 | C14: 49472 | D14: =IF(RC[-2]=1,0,R[-1]C+R[-1]C[-1]) -> 107968 | E14: 3 | F14: =IF(RC[-4]=1,0,R[-1]C[-3]) -> 37408 | G14: 10
A15: 2 | B15: 9 | C15: 63600 | D15: =IF(RC[-2]=1,0,R[-1]C+R[-1]C[-1]) -> 157440 | E15: 3 | F15: =IF(RC[-4]=1,0,R[-1]C[-3]) -> 49472 | G15: 10
A16: 2 | B16: 10 | C16: 79920 | D16: =IF(RC[-2]=1,0,R[-1]C+R[-1]C[-1]) -> 221040 | E16: 3 | F16: =IF(RC[-4]=1,0,R[-1]C[-3]) -> 63600 | G16: 20
A17: 2 | B17: 11 | C17: 98560 | D17: =IF(RC[-2]=1,0,R[-1]C+R[-1]C[-1]) -> 300960 | E17: 3 | F17: =IF(RC[-4]=1,0,R[-1]C[-3]) -> 79920 | G17: 20
A18: 2 | B18: 12 | C18: 119648 | D18: =IF(RC[-2]=1,0,R[-1]C+R[-1]C[-1]) -> 399520 | E18: 3 | F18: =IF(RC[-4]=1,0,R[-1]C[-3]) -> 98560 | G18: 20
A19: 2 | B19: 13 | C19: 143312 | D19: =IF(RC[-2]=1,0,R[-1]C+R[-1]C[-1]) -> 519168 | E19: 3 | F19: =IF(RC[-4]=1,0,R[-1]C[-3]) -> 119648 | G19: 20
A20: 2 | B20: 14 | C20: 169680 | D20: =IF(RC[-2]=1,0,R[-1]C+R[-1]C[-1]) -> 662480 | E20: 3 | F20: =IF(RC[-4]=1,0,R[-1]C[-3]) -> 143312 | G20: 20
A21: 2 | B21: 15 | C21: 198880 | D21: =IF(RC[-2]=1,0,R[-1]C+R[-1]C[-1]) -> 832160 | E21: 3 | F21: =IF(RC[-4]=1,0,R[-1]C[-3]) -> 169680 | G21: 20
A22: 2 | B22: 16 | C22: 231040 | D22: =IF(RC[-2]=1,0,R[-1]C+R[-1]C[-1]) -> 1031040 | E22: 3 | F22: =IF(RC[-4]=1,0,R[-1]C[-3]) -> 198880 | G22: 20
A23: 2 | B23: 17 | C23: 266288 | D23: =IF(RC[-2]=1,0,R[-1]C+R[-1]C[-1]) -> 1262080 | E23: 3 | F23: =IF(RC[-4]=1,0,R[-1]C[-3]) -> 231040 | G23: 20
A24: 2 | B24: 18 | C24: 304752 | D24: =IF(RC[-2]=1,0,R[-1]C+R[-1]C[-1]) -> 1528368 | E24: 3 | F24: =IF(RC[-4]=1,0,R[-1]C[-3]) -> 266288 | G24: 20
A25: 2 | B25: 19 | C25: 346560 | D25: =IF(RC[-2]=1,0,R[-1]C+R[-1]C[-1]) -> 1833120 | E25: 3 | F25: =IF(RC[-4]=1,0,R[-1]C[-3]) -> 304752 | G25: 20
A26: 2 | B26: 20 | C26: 391840 | D26: =IF(RC[-2]=1,0,R[-1]C+R[-1]C[-1]) -> 2179680 | E26: 3 | F26: =IF(RC[-4]=1,0,R[-1]C[-3]) -> 346560 | G26: 30
A27: 2 | B27: 21 | C27: 440720 | D27: =IF(RC[-2]=1,0,R[-1]C+R[-1]C[-1]) -> 2571520 | E27: 3 | F27: =IF(RC[-4]=1,0,R[-1]C[-3]) -> 391840 | G27: 30
A28: 2 | B28: 22 | C28: 493328 | D28: =IF(RC[-2]=1,0,R[-1]C+R[-1]C[-1]) -> 3012240 | E28: 3 | F28: =IF(RC[-4]=1,0,R[-1]C[-3]) -> 440720 | G28: 30
A29: 2 | B29: 23 | C29: 549792 | D29: =IF(RC[-2]=1,0,R[-1]C+R[-1]C[-1]) -> 3505568 | E29: 3 | F29: =IF(RC[-4]=1,0,R[-1]C[-3]) -> 493328 | G29: 30
A30: 2 | B30: 24 | C30: 610240 | D30: =IF(RC[-2]=1,0,R[-1]C+R[-1]C[-1]) -> 4055360 | E30: 3 | F30: =IF(RC[-4]=1,0,R[-1]C[-3]) -> 549792 | G30: 30
A31: 2 | B31: 25 | C31: 674800 | D31: =IF(RC[-2]=1,0,R[-1]C+R[-1]C[-1]) -> 4665600 | E31: 3 | F31: =IF(RC[-4]=1,0,R[-1]C[-3]) -> 610240 | G31: 30
A32: 2 | B32: 26 | C32: 743600 | D32: =IF(RC[-2]=1,0,R[-1]C+R[-1]C[-1]) -> 5340400 | E32: 3 | F32: =IF(RC[-4]=1,0,R[-1]C[-3]) -> 674800 | G32: 30
A33: 2 | B33: 27 | C33: 816768 | D33: =IF(RC[-2]=1,0,R[-1]C+R[-1]C[-1]) -> 6084000 | E33: 3 | F33: =IF(RC[-4]=1,0,R[-1]C[-3]) -> 743600 | G33: 30
A34: 2 | B34: 28 | C34: 894432 | D34: =IF(RC[-2]=1,0,R[-1]C+R[-1]C[-1]) -> 6900768 | E34: 3 | F34: =IF(RC[-4]=1,0,R[-1]C[-3]) -> 816768 | G34: 30
A35: 2 | B35: 29 | C35: 976720 | D35: =IF(RC[-2]=1,0,R[-1]C+R[-1]C[-1]) -> 7795200 | E35: 3 | F35: =IF(RC[-4]=1,0,R[-1]C[-3]) -> 894432 | G35: 30
A36: 2 | B36: 30 | C36: 1063760 | D36: =IF(RC[-2]=1,0,R[-1]C+R[-1]C[-1]) -> 8771920 | E36: 3 | F36: =IF(RC[-4]=1,0,R[-1]C[-3]) -> 976720 | G36: 40
A37: 2 | B37: 31 | C37: 1155680 | D37: =IF(RC[-2]=1,0,R[-1]C+R[-1]C[-1]) -> 9835680 | E37: 3 | F37: =IF(RC[-4]=1,0,R[-1]C[-3]) -> 1063760 | G37: 40
A38: 2 | B38: 32 | C38: 1252608 | D38: =IF(RC[-2]=1,0,R[-1]C+R[-1]C[-1]) -> 10991360 | E38: 3 | F38: =IF(RC[-4]=1,0,R[-1]C[-3]) -> 1155680 | G38: 40
A39: 2 | B39: 33 | C39: 1354672 | D39: =IF(RC[-2]=1,0,R[-1]C+R[-1]C[-1]) -> 12243968 | E39: 3 | F39: =IF(RC[-4]=1,0,R[-1]C[-3]) -> 1252608 | G39: 40
A40: 2 | B40: 34 | C40: 1462000 | D40: =IF(RC[-2]=1,0,R[-1]C+R[-1]C[-1]) -> 13598640 | E40: 3 | F40: =IF(RC[-4]=1,0,R[-1]C[-3]) -> 1354672 | G40: 40
A41: 2 | B41: 35 | C41: 1574720 | D41: =IF(RC[-2]=1,0,R[-1]C+R[-1]C[-1]) -> 15060640 | E41: 3 | F41: =IF(RC[-4]=1,0,R[-1]C[-3]) -> 1462000 | G41: 40
A42: 2 | B42: 36 | C42: 1692960 | D42: =IF(RC[-2]=1,0,R[-1]C+R[-1]C[-1]) -> 16635360 | E42: 3 | F42: =IF(RC[-4]=1,0,R[-1]C[-3]) -> 1574720 | G42: 40
A43: 2 | B43: 37 | C43: 1816848 | D43: =IF(RC[-2]=1,0,R[-1]C+R[-1]C[-1]) -> 18328320 | E43: 3 | F43: =IF(RC[-4]=1,0,R[-1]C[-3]) -> 1692960 | G43: 40
A44: 2 | B44: 38 | C44: 1946512 | D44: =IF(RC[-2]=1,0,R[-1]C+R[-1]C[-1]) -> 20145168 | E44: 3 | F44: =IF(RC[-4]=1,0,R[-1]C[-3]) -> 1816848 | G44: 40
A45: 2 | B45: 39 | C45: 2082080 | D45: =IF(RC[-2]=1,0,R[-1]C+R[-1]C[-1]) -> 22091680 | E45: 3 | F45: =IF(RC[-4]=1,0,R[-1]C[-3]) -> 1946512 | G45: 40
A46: 2 | B46: 40 | C46: 2223680 | D46: =IF(RC[-2]=1,0,R[-1]C+R[-1]C[-1]) -> 24173760 | E46: 3 | F46: =IF(RC[-4]=1,0,R[-1]C[-3]) -> 2082080 | G46: 50
A47: 2 | B47: 41 | C47: 2371440 | D47: =IF(RC[-2]=1,0,R[-1]C+R[-1]C[-1]) -> 26397440 | E47: 3 | F47: =IF(RC[-4]=1,0,R[-1]C[-3]) -> 2223680 | G47: 50
A48: 2 | B48: 42 | C48: 2525488 | D48: =IF(RC[-2]=1,0,R[-1]C+R[-1]C[-1]) -> 28768880 | E48: 3 | F48: =IF(RC[-4]=1,0,R[-1]C[-3]) -> 2371440 | G48: 50
A49: 2 | B49: 43 | C49: 2685952 | D49: =IF(RC[-2]=1,0,R[-1]C+R[-1]C[-1]) -> 31294368 | E49: 3 | F49: =IF(RC[-4]=1,0,R[-1]C[-3]) -> 2525488 | G49: 50
A50: 2 | B50: 44 | C50: 2852960 | D50: =IF(RC[-2]=1,0,R[-1]C+R[-1]C[-1]) -> 33980320 | E50: 3 | F50: =IF(RC[-4]=1,0,R[-1]C[-3]) -> 2685952 | G50: 50
A51: 2 | B51: 45 | C51: 3026640 | D51: =IF(RC[-2]=1,0,R[-1]C+R[-1]C[-1]) -> 36833280 | E51: 3 | F51: =IF(RC[-4]=1,0,R[-1]C[-3]) -> 2852960 | G51: 50
A52: 2 | B52: 46 | C52: 3207120 | D52: =IF(RC[-2]=1,0,R[-1]C+R[-1]C[-1]) -> 39859920 | E52: 3 | F52: =IF(RC[-4]=1,0,R[-1]C[-3]) -> 3026640 | G52: 50
A53: 2 | B53: 47 | C53: 3394528 | D53: =IF(RC[-2]=1,0,R[-1]C+R[-1]C[-1]) -> 43067040 | E53: 3 | F53: =IF(RC[-4]=1,0,R[-1]C[-3]) -> 3207120 | G53: 50
A54: 2 | B54: 48 | C54: 3588992 | D54: =IF(RC[-2]=1,0,R[-1]C+R[-1]C[-1]) -> 46461568 | E54: 3 | F54: =IF(RC[-4]=1,0,R[-1]C[-3]) -> 3394528 | G54: 50
A55: 2 | B55: 49 | C55: 3790640 | D55: =IF(RC[-2]=1,0,R[-1]C+R[-1]C[-1]) -> 50050560 | E55: 3 | F55: =IF(RC[-4]=1,0,R[-1]C[-3]) -> 3588992 | G55: 50
A56: 2 | B56: 50 | C56: 3999600 | D56: =IF(RC[-2]=1,0,R[-1]C+R[-1]C[-1]) -> 53841200 | E56: 3 | F56: =IF(RC[-4]=1,0,R[-1]C[-3]) -> 3790640 | G56: 60
A57: 2 | B57: 51 | C57: 4216000 | D57: =IF(RC[-2]=1,0,R[-1]C+R[-1]C[-1]) -> 57840800 | E57: 3 | F57: =IF(RC[-4]=1,0,R[-1]C[-3]) -> 3999600 | G57: 60
A58: 2 | B58: 52 | C58: 4439968 | D58: =IF(RC[-2]=1,0,R[-1]C+R[-1]C[-1]) -> 62056800 | E58: 3 | F58: =IF(RC[-4]=1,0,R[-1]C[-3]) -> 4216000 | G58: 60
A59: 2 | B59: 53 | C59: 4671632 | D59: =IF(RC[-2]=1,0,R[-1]C+R[-1]C[-1]) -> 66496768 | E59: 3 | F59: =IF(RC[-4]=1,0,R[-1]C[-3]) -> 4439968 | G59: 60
A60: 2 | B60: 54 | C60: 4911120 | D60: =IF(RC[-2]=1,0,R[-1]C+R[-1]C[-1]) -> 71168400 | E60: 3 | F60: =IF(RC[-4]=1,0,R[-1]C[-3]) -> 4671632 | G60: 60
A61: 2 | B61: 55 | C61: 5158560 | D61: =IF(RC[-2]=1,0,R[-1]C+R[-1]C[-1]) -> 76079520 | E61: 3 | F61: =IF(RC[-4]=1,0,R[-1]C[-3]) -> 4911120 | G61: 60
A62: 2 | B62: 56 | C62: 5414080 | D62: =IF(RC[-2]=1,0,R[-1]C+R[-1]C[-1]) -> 81238080 | E62: 3 | F62: =IF(RC[-4]=1,0,R[-1]C[-3]) -> 5158560 | G62: 60
A63: 2 | B63: 57 | C63: 5677808 | D63: =IF(RC[-2]=1,0,R[-1]C+R[-1]C[-1]) -> 86652160 | E63: 3 | F63: =IF(RC[-4]=1,0,R[-1]C[-3]) -> 5414080 | G63: 60
A64: 2 | B64: 58 | C64: 5949872 | D64: =IF(RC[-2]=1,0,R[-1]C+R[-1]C[-1]) -> 92329968 | E64: 3 | F64: =IF(RC[-4]=1,0,R[-1]C[-3]) -> 5677808 | G64: 60
A65: 2 | B65: 59 | C65: 6230400 | D65: =IF(RC[-2]=1,0,R[-1]C+R[-1]C[-1]) -> 98279840 | E65: 3 | F65: =IF(RC[-4]=1,0,R[-1]C[-3]) -> 5949872 | G65: 60
A66: 2 | B66: 60 | C66: 6519520 | D66: =IF(RC[-2]=1,0,R[-1]C+R[-1]C[-1]) -> 104510240 | E66: 3 | F66: =IF(RC[-4]=1,0,R[-1]C[-3]) -> 6230400 | G66: 70
A67: 2 | B67: 61 | C67: 6817360 | D67: =IF(RC[-2]=1,0,R[-1]C+R[-1]C[-1]) -> 111029760 | E67: 3 | F67: =IF(RC[-4]=1,0,R[-1]C[-3]) -> 6519520 | G67: 70
A68: 2 | B68: 62 | C68: 7124048 | D68: =IF(RC[-2]=1,0,R[-1]C+R[-1]C[-1]) -> 117847120 | E68: 3 | F68: =IF(RC[-4]=1,0,R[-1]C[-3]) -> 6817360 | G68: 70
A69: 2 | B69: 63 | C69: 7439712 | D69: =IF(RC[-2]=1,0,R[-1]C+R[-1]C[-1]) -> 124971168 | E69: 3 | F69: =IF(RC[-4]=1,0,R[-1]C[-3]) -> 7124048 | G69: 70
A70: 2 | B70: 64 | C70: 7764480 | D70: =IF(RC[-2]=1,0,R[-1]C+R[-1]C[-1]) -> 132410880 | E70: 3 | F70: =IF(RC[-4]=1,0,R[-1]C[-3]) -> 7439712 | G70: 70
A71: 2 | B71: 65 | C71: 8098480 | D71: =IF(RC[-2]=1,0,R[-1]C+R[-1]C[-1]) -> 140175360 | E71: 3 | F71: =IF(RC[-4]=1,0,R[-1]C[-3]) -> 7764480 | G71: 70
A72: 2 | B72: 66 | C72: 8441840 | D72: =IF(RC[-2]=1,0,R[-1]C+R[-1]C[-1]) -> 148273840 | E72: 3 | F72: =IF(RC[-4]=1,0,R[-1]C[-3]) -> 8098480 | G72: 70
A73: 2 | B73: 67 | C73: 8794688 | D73: =IF(RC[-2]=1,0,R[-1]C+R[-1]C[-1]) -> 156715680 | E73: 3 | F73: =IF(RC[-4]=1,0,R[-1]C[-3]) -> 8441840 | G73: 70
A74: 2 | B74: 68 | C74: 9157152 | D74: =IF(RC[-2]=1,0,R[-1]C+R[-1]C[-1]) -> 165510368 | E74: 3 | F74: =IF(RC[-4]=1,0,R[-1]C[-3]) -> 8794688 | G74: 70
A75: 2 | B75: 69 | C75: 9529360 | D75: =IF(RC[-2]=1,0,R[-1]C+R[-1]C[-1]) -> 174667520 | E75: 3 | F75: =IF(RC[-4]=1,0,R[-1]C[-3]) -> 9157152 | G75: 70
A76: 2 | B76: 70 | C76: 9911440 | D76: =IF(RC[-2]=1,0,R[-1]C+R[-1]C[-1]) -> 184196880 | E76: 3 | F76: =IF(RC[-4]=1,0,R[-1]C[-3]) -> 9529360 | G76: 80
A77: 2 | B77: 71 | C77: 10303520 | D77: =IF(RC[-2]=1,0,R[-1]C+R[-1]C[-1]) -> 194108320 | E77: 3 | F77: =IF(RC[-4]=1,0,R[-1]C[-3]) -> 9911440 | G77: 80
A78: 2 | B78: 72 | C78: 10705728 | D78: =IF(RC[-2]=1,0,R[-1]C+R[-1]C[-1]) -> 204411840 | E78: 3 | F78: =IF(RC[-4]=1,0,R[-1]C[-3]) -> 10303520 | G78: 80
A79: 2 | B79: 73 | C79: 11118192 | D79: =IF(RC[-2]=1,0,R[-1]C+R[-1]C[-1]) -> 215117568 | E79: 3 | F79: =IF(RC[-4]=1,0,R[-1]C[-3]) -> 10705728 | G79: 80
A80: 2 | B80: 74 | C80: 11541040 | D80: =IF(RC[-2]=1,0,R[-1]C+R[-1]C[-1]) -> 226235760 | E80: 3 | F80: =IF(RC[-4]=1,0,R[-1]C[-3]) -> 11118192 | G80: 80
A81: 2 | B81: 75 | C81: 11974400 | D81: =IF(RC[-2]=1,0,R[-1]C+R[-1]C[-1]) -> 237776800 | E81: 3 | F81: =IF(RC[-4]=1,0,R[-1]C[-3]) -> 11541040 | G81: 80
A82: 2 | B82: 76 | C82: 12418400 | D82: =IF(RC[-2]=1,0,R[-1]C+R[-1]C[-1]) -> 249751200 | E82: 3 | F82: =IF(RC[-4]=1,0,R[-1]C[-3]) -> 11974400 | G82: 80
A83: 2 | B83: 77 | C83: 12873168 | D83: =IF(RC[-2]=1,0,R[-1]C+R[-1]C[-1]) -> 262169600 | E83: 3 | F83: =IF(RC[-4]=1,0,R[-1]C[-3]) -> 12418400 | G83: 80
A84: 2 | B84: 78 | C84: 13338832 | D84: =IF(RC[-2]=1,0,R[-1]C+R[-1]C[-1]) -> 275042768 | E84: 3 | F84: =IF(RC[-4]=1,0,R[-1]C[-3]) -> 12873168 | G84: 80
A85: 2 | B85: 79 | C85: 13815520 | D85: =IF(RC[-2]=1,0,R[-1]C+R[-1]C[-1]) -> 288381600 | E85: 3 | F85: =IF(RC[-4]=1,0,R[-1]C[-3]) -> 13338832 | G85: 80
A86: 2 | B86: 80 | C86: 14303360 | D86: =IF(RC[-2]=1,0,R[-1]C+R[-1]C[-1]) -> 302197120 | E86: 3 | F86: =IF(RC[-4]=1,0,R[-1]C[-3]) -> 13815520 | G86: 80
A87: =R[-80]C+1 -> 3 | B87: =R[-80]C -> 1 | C87: 1500 | D87: =IF(RC[-2]=1,0,R[-1]C+R[-1]C[-1]) -> 0 | E87: 3 | F87: =IF(RC[-4]=1,0,R[-1]C[-3]) -> 0 | G87: 10
A88: =R[-80]C+1 -> 3 | B88: =R[-80]C -> 2 | C88: 4460 | D88: =IF(RC[-2]=1,0,R[-1]C+R[-1]C[-1]) -> 1500 | E88: 3 | F88: =IF(RC[-4]=1,0,R[-1]C[-3]) -> 1500 | G88: 10
A89: =R[-80]C+1 -> 3 | B89: =R[-80]C -> 3 | C89: 9040 | D89: =IF(RC[-2]=1,0,R[-1]C+R[-1]C[-1]) -> 5960 | E89: 3 | F89: =IF(RC[-4]=1,0,R[-1]C[-3]) -> 4460 | G89: 10
A90: =R[-80]C+1 -> 3 | B90: =R[-80]C -> 4 | C90: 15400 | D90: =IF(RC[-2]=1,0,R[-1]C+R[-1]C[-1]) -> 15000 | E90: 3 | F90: =IF(RC[-4]=1,0,R[-1]C[-3]) -> 9040 | G90: 10
A91: =R[-80]C+1 -> 3 | B91: =R[-80]C -> 5 | C91: 23700 | D91: =IF(RC[-2]=1,0,R[-1]C+R[-1]C[-1]) -> 30400 | E91: 3 | F91: =IF(RC[-4]=1,0,R[-1]C[-3]) -> 15400 | G91: 10
A92: =R[-80]C+1 -> 3 | B92: =R[-80]C -> 6 | C92: 34100 | D92: =IF(RC[-2]=1,0,R[-1]C+R[-1]C[-1]) -> 54100 | E92: 3 | F92: =IF(RC[-4]=1,0,R[-1]C[-3]) -> 23700 | G92: 10
A93: =R[-80]C+1 -> 3 | B93: =R[-80]C -> 7 | C93: 46760 | D93: =IF(RC[-2]=1,0,R[-1]C+R[-1]C[-1]) -> 88200 | E93: 3 | F93: =IF(RC[-4]=1,0,R[-1]C[-3]) -> 34100 | G93: 10
A94: =R[-80]C+1 -> 3 | B94: =R[-80]C -> 8 | C94: 61840 | D94: =IF(RC[-2]=1,0,R[-1]C+R[-1]C[-1]) -> 134960 | E94: 3 | F94: =IF(RC[-4]=1,0,R[-1]C[-3]) -> 46760 | G94: 10
A95: =R[-80]C+1 -> 3 | B95: =R[-80]C -> 9 | C95: 79500 | D95: =IF(RC[-2]=1,0,R[-1]C+R[-1]C[-1]) -> 196800 | E95: 3 | F95: =IF(RC[-4]=1,0,R[-1]C[-3]) -> 61840 | G95: 10
A96: =R[-80]C+1 -> 3 | B96: =R[-80]C -> 10 | C96: 99900 | D96: =IF(RC[-2]=1,0,R[-1]C+R[-1]C[-1]) -> 276300 | E96: 3 | F96: =IF(RC[-4]=1,0,R[-1]C[-3]) -> 79500 | G96: 20
A97: =R[-80]C+1 -> 3 | B97: =R[-80]C -> 11 | C97: 123200 | D97: =IF(RC[-2]=1,0,R[-1]C+R[-1]C[-1]) -> 376200 | E97: 3 | F97: =IF(RC[-4]=1,0,R[-1]C[-3]) -> 99900 | G97: 20
A98: =R[-80]C+1 -> 3 | B98: =R[-80]C -> 12 | C98: 149560 | D98: =IF(RC[-2]=1,0,R[-1]C+R[-1]C[-1]) -> 499400 | E98: 3 | F98: =IF(RC[-4]=1,0,R[-1]C[-3]) -> 123200 | G98: 20
A99: =R[-80]C+1 -> 3 | B99: =R[-80]C -> 13 | C99: 179140 | D99: =IF(RC[-2]=1,0,R[-1]C+R[-1]C[-1]) -> 648960 | E99: 3 | F99: =IF(RC[-4]=1,0,R[-1]C[-3]) -> 149560 | G99: 20
A100: =R[-80]C+1 -> 3 | B100: =R[-80]C -> 14 | C100: 212100 | D100: =IF(RC[-2]=1,0,R[-1]C+R[-1]C[-1]) -> 828100 | E100: 3 | F100: =IF(RC[-4]=1,0,R[-1]C[-3]) -> 179140 | G100: 20
A101: =R[-80]C+1 -> 3 | B101: =R[-80]C -> 15 | C101: 248600 | D101: =IF(RC[-2]=1,0,R[-1]C+R[-1]C[-1]) -> 1040200 | E101: 3 | F101: =IF(RC[-4]=1,0,R[-1]C[-3]) -> 212100 | G101: 20
A102: =R[-80]C+1 -> 3 | B102: =R[-80]C -> 16 | C102: 288800 | D102: =IF(RC[-2]=1,0,R[-1]C+R[-1]C[-1]) -> 1288800 | E102: 3 | F102: =IF(RC[-4]=1,0,R[-1]C[-3]) -> 248600 | G102: 20
A103: =R[-80]C+1 -> 3 | B103: =R[-80]C -> 17 | C103: 332860 | D103: =IF(RC[-2]=1,0,R[-1]C+R[-1]C[-1]) -> 1577600 | E103: 3 | F103: =IF(RC[-4]=1,0,R[-1]C[-3]) -> 288800 | G103: 20
A104: =R[-80]C+1 -> 3 | B104: =R[-80]C -> 18 | C104: 380940 | D104: =IF(RC[-2]=1,0,R[-1]C+R[-1]C[-1]) -> 1910460 | E104: 3 | F104: =IF(RC[-4]=1,0,R[-1]C[-3]) -> 332860 | G104: 20
A105: =R[-80]C+1 -> 3 | B105: =R[-80]C -> 19 | C105: 433200 | D105: =IF(RC[-2]=1,0,R[-1]C+R[-1]C[-1]) -> 2291400 | E105: 3 | F105: =IF(RC[-4]=1,0,R[-1]C[-3]) -> 380940 | G105: 20
A106: =R[-80]C+1 -> 3 | B106: =R[-80]C -> 20 | C106: 489800 | D106: =IF(RC[-2]=1,0,R[-1]C+R[-1]C[-1]) -> 2724600 | E106: 3 | F106: =IF(RC[-4]=1,0,R[-1]C[-3]) -> 433200 | G106: 30
A107: =R[-80]C+1 -> 3 | B107: =R[-80]C -> 21 | C107: 550900 | D107: =IF(RC[-2]=1,0,R[-1]C+R[-1]C[-1]) -> 3214400 | E107: 3 | F107: =IF(RC[-4]=1,0,R[-1]C[-3]) -> 489800 | G107: 30
A108: =R[-80]C+1 -> 3 | B108: =R[-80]C -> 22 | C108: 616660 | D108: =IF(RC[-2]=1,0,R[-1]C+R[-1]C[-1]) -> 3765300 | E108: 3 | F108: =IF(RC[-4]=1,0,R[-1]C[-3]) -> 550900 | G108: 30
A109: =R[-80]C+1 -> 3 | B109: =R[-80]C -> 23 | C109: 687240 | D109: =IF(RC[-2]=1,0,R[-1]C+R[-1]C[-1]) -> 4381960 | E109: 3 | F109: =IF(RC[-4]=1,0,R[-1]C[-3]) -> 616660 | G109: 30
A110: =R[-80]C+1 -> 3 | B110: =R[-80]C -> 24 | C110: 762800 | D110: =IF(RC[-2]=1,0,R[-1]C+R[-1]C[-1]) -> 5069200 | E110: 3 | F110: =IF(RC[-4]=1,0,R[-1]C[-3]) -> 687240 | G110: 30
A111: =R[-80]C+1 -> 3 | B111: =R[-80]C -> 25 | C111: 843500 | D111: =IF(RC[-2]=1,0,R[-1]C+R[-1]C[-1]) -> 5832000 | E111: 3 | F111: =IF(RC[-4]=1,0,R[-1]C[-3]) -> 762800 | G111: 30
A112: =R[-80]C+1 -> 3 | B112: =R[-80]C -> 26 | C112: 929500 | D112: =IF(RC[-2]=1,0,R[-1]C+R[-1]C[-1]) -> 6675500 | E112: 3 | F112: =IF(RC[-4]=1,0,R[-1]C[-3]) -> 843500 | G112: 30
A113: =R[-80]C+1 -> 3 | B113: =R[-80]C -> 27 | C113: 1020960 | D113: =IF(RC[-2]=1,0,R[-1]C+R[-1]C[-1]) -> 7605000 | E113: 3 | F113: =IF(RC[-4]=1,0,R[-1]C[-3]) -> 929500 | G113: 30
A114: =R[-80]C+1 -> 3 | B114: =R[-80]C -> 28 | C114: 1118040 | D114: =IF(RC[-2]=1,0,R[-1]C+R[-1]C[-1]) -> 8625960 | E114: 3 | F114: =IF(RC[-4]=1,0,R[-1]C[-3]) -> 1020960 | G114: 30
A115: =R[-80]C+1 -> 3 | B115: =R[-80]C -> 29 | C115: 1220900 | D115: =IF(RC[-2]=1,0,R[-1]C+R[-1]C[-1]) -> 9744000 | E115: 3 | F115: =IF(RC[-4]=1,0,R[-1]C[-3]) -> 1118040 | G115: 30
A116: =R[-80]C+1 -> 3 | B116: =R[-80]C -> 30 | C116: 1329700 | D116: =IF(RC[-2]=1,0,R[-1]C+R[-1]C[-1]) -> 10964900 | E116: 3 | F116: =IF(RC[-4]=1,0,R[-1]C[-3]) -> 1220900 | G116: 40
A117: =R[-80]C+1 -> 3 | B117: =R[-80]C -> 31 | C117: 1444600 | D117: =IF(RC[-2]=1,0,R[-1]C+R[-1]C[-1]) -> 12294600 | E117: 3 | F117: =IF(RC[-4]=1,0,R[-1]C[-3]) -> 1329700 | G117: 40
A118: =R[-80]C+1 -> 3 | B118: =R[-80]C -> 32 | C118: 1565760 | D118: =IF(RC[-2]=1,0,R[-1]C+R[-1]C[-1]) -> 13739200 | E118: 3 | F118: =IF(RC[-4]=1,0,R[-1]C[-3]) -> 1444600 | G118: 40
A119: =R[-80]C+1 -> 3 | B119: =R[-80]C -> 33 | C119: 1693340 | D119: =IF(RC[-2]=1,0,R[-1]C+R[-1]C[-1]) -> 15304960 | E119: 3 | F119: =IF(RC[-4]=1,0,R[-1]C[-3]) -> 1565760 | G119: 40
A120: =R[-80]C+1 -> 3 | B120: =R[-80]C -> 34 | C120: 1827500 | D120: =IF(RC[-2]=1,0,R[-1]C+R[-1]C[-1]) -> 16998300 | E120: 3 | F120: =IF(RC[-4]=1,0,R[-1]C[-3]) -> 1693340 | G120: 40
A121: =R[-80]C+1 -> 3 | B121: =R[-80]C -> 35 | C121: 1968400 | D121: =IF(RC[-2]=1,0,R[-1]C+R[-1]C[-1]) -> 18825800 | E121: 3 | F121: =IF(RC[-4]=1,0,R[-1]C[-3]) -> 1827500 | G121: 40
A122: =R[-80]C+1 -> 3 | B122: =R[-80]C -> 36 | C122: 2116200 | D122: =IF(RC[-2]=1,0,R[-1]C+R[-1]C[-1]) -> 20794200 | E122: 3 | F122: =IF(RC[-4]=1,0,R[-1]C[-3]) -> 1968400 | G122: 40
A123: =R[-80]C+1 -> 3 | B123: =R[-80]C -> 37 | C123: 2271060 | D123: =IF(RC[-2]=1,0,R[-1]C+R[-1]C[-1]) -> 22910400 | E123: 3 | F123: =IF(RC[-4]=1,0,R[-1]C[-3]) -> 2116200 | G123: 40
A124: =R[-80]C+1 -> 3 | B124: =R[-80]C -> 38 | C124: 2433140 | D124: =IF(RC[-2]=1,0,R[-1]C+R[-1]C[-1]) -> 25181460 | E124: 3 | F124: =IF(RC[-4]=1,0,R[-1]C[-3]) -> 2271060 | G124: 40
A125: =R[-80]C+1 -> 3 | B125: =R[-80]C -> 39 | C125: 2602600 | D125: =IF(RC[-2]=1,0,R[-1]C+R[-1]C[-1]) -> 27614600 | E125: 3 | F125: =IF(RC[-4]=1,0,R[-1]C[-3]) -> 2433140 | G125: 40
A126: =R[-80]C+1 -> 3 | B126: =R[-80]C -> 40 | C126: 2779600 | D126: =IF(RC[-2]=1,0,R[-1]C+R[-1]C[-1]) -> 30217200 | E126: 3 | F126: =IF(RC[-4]=1,0,R[-1]C[-3]) -> 2602600 | G126: 50
A127: =R[-80]C+1 -> 3 | B127: =R[-80]C -> 41 | C127: 2964300 | D127: =IF(RC[-2]=1,0,R[-1]C+R[-1]C[-1]) -> 32996800 | E127: 3 | F127: =IF(RC[-4]=1,0,R[-1]C[-3]) -> 2779600 | G127: 50
A128: =R[-80]C+1 -> 3 | B128: =R[-80]C -> 42 | C128: 3156860 | D128: =IF(RC[-2]=1,0,R[-1]C+R[-1]C[-1]) -> 35961100 | E128: 3 | F128: =IF(RC[-4]=1,0,R[-1]C[-3]) -> 2964300 | G128: 50
A129: =R[-80]C+1 -> 3 | B129: =R[-80]C -> 43 | C129: 3357440 | D129: =IF(RC[-2]=1,0,R[-1]C+R[-1]C[-1]) -> 39117960 | E129: 3 | F129: =IF(RC[-4]=1,0,R[-1]C[-3]) -> 3156860 | G129: 50
A130: =R[-80]C+1 -> 3 | B130: =R[-80]C -> 44 | C130: 3566200 | D130: =IF(RC[-2]=1,0,R[-1]C+R[-1]C[-1]) -> 42475400 | E130: 3 | F130: =IF(RC[-4]=1,0,R[-1]C[-3]) -> 3357440 | G130: 50
A131: =R[-80]C+1 -> 3 | B131: =R[-80]C -> 45 | C131: 3783300 | D131: =IF(RC[-2]=1,0,R[-1]C+R[-1]C[-1]) -> 46041600 | E131: 3 | F131: =IF(RC[-4]=1,0,R[-1]C[-3]) -> 3566200 | G131: 50
A132: =R[-80]C+1 -> 3 | B132: =R[-80]C -> 46 | C132: 4008900 | D132: =IF(RC[-2]=1,0,R[-1]C+R[-1]C[-1]) -> 49824900 | E132: 3 | F132: =IF(RC[-4]=1,0,R[-1]C[-3]) -> 3783300 | G132: 50
A133: =R[-80]C+1 -> 3 | B133: =R[-80]C -> 47 | C133: 4243160 | D133: =IF(RC[-2]=1,0,R[-1]C+R[-1]C[-1]) -> 53833800 | E133: 3 | F133: =IF(RC[-4]=1,0,R[-1]C[-3]) -> 4008900 | G133: 50
A134: =R[-80]C+1 -> 3 | B134: =R[-80]C -> 48 | C134: 4486240 | D134: =IF(RC[-2]=1,0,R[-1]C+R[-1]C[-1]) -> 58076960 | E134: 3 | F134: =IF(RC[-4]=1,0,R[-1]C[-3]) -> 4243160 | G134: 50
A135: =R[-80]C+1 -> 3 | B135: =R[-80]C -> 49 | C135: 4738300 | D135: =IF(RC[-2]=1,0,R[-1]C+R[-1]C[-1]) -> 62563200 | E135: 3 | F135: =IF(RC[-4]=1,0,R[-1]C[-3]) -> 4486240 | G135: 50
A136: =R[-80]C+1 -> 3 | B136: =R[-80]C -> 50 | C136: 4999500 | D136: =IF(RC[-2]=1,0,R[-1]C+R[-1]C[-1]) -> 67301500 | E136: 3 | F136: =IF(RC[-4]=1,0,R[-1]C[-3]) -> 4738300 | G136: 60
A137: =R[-80]C+1 -> 3 | B137: =R[-80]C -> 51 | C137: 5270000 | D137: =IF(RC[-2]=1,0,R[-1]C+R[-1]C[-1]) -> 72301000 | E137: 3 | F137: =IF(RC[-4]=1,0,R[-1]C[-3]) -> 4999500 | G137: 60
A138: =R[-80]C+1 -> 3 | B138: =R[-80]C -> 52 | C138: 5549960 | D138: =IF(RC[-2]=1,0,R[-1]C+R[-1]C[-1]) -> 77571000 | E138: 3 | F138: =IF(RC[-4]=1,0,R[-1]C[-3]) -> 5270000 | G138: 60
A139: =R[-80]C+1 -> 3 | B139: =R[-80]C -> 53 | C139: 5839540 | D139: =IF(RC[-2]=1,0,R[-1]C+R[-1]C[-1]) -> 83120960 | E139: 3 | F139: =IF(RC[-4]=1,0,R[-1]C[-3]) -> 5549960 | G139: 60
A140: =R[-80]C+1 -> 3 | B140: =R[-80]C -> 54 | C140: 6138900 | D140: =IF(RC[-2]=1,0,R[-1]C+R[-1]C[-1]) -> 88960500 | E140: 3 | F140: =IF(RC[-4]=1,0,R[-1]C[-3]) -> 5839540 | G140: 60
A141: =R[-80]C+1 -> 3 | B141: =R[-80]C -> 55 | C141: 6448200 | D141: =IF(RC[-2]=1,0,R[-1]C+R[-1]C[-1]) -> 95099400 | E141: 3 | F141: =IF(RC[-4]=1,0,R[-1]C[-3]) -> 6138900 | G141: 60
A142: =R[-80]C+1 -> 3 | B142: =R[-80]C -> 56 | C142: 6767600 | D142: =IF(RC[-2]=1,0,R[-1]C+R[-1]C[-1]) -> 101547600 | E142: 3 | F142: =IF(RC[-4]=1,0,R[-1]C[-3]) -> 6448200 | G142: 60
A143: =R[-80]C+1 -> 3 | B143: =R[-80]C -> 57 | C143: 7097260 | D143: =IF(RC[-2]=1,0,R[-1]C+R[-1]C[-1]) -> 108315200 | E143: 3 | F143: =IF(RC[-4]=1,0,R[-1]C[-3]) -> 6767600 | G143: 60
A144: =R[-80]C+1 -> 3 | B144: =R[-80]C -> 58 | C144: 7437340 | D144: =IF(RC[-2]=1,0,R[-1]C+R[-1]C[-1]) -> 115412460 | E144: 3 | F144: =IF(RC[-4]=1,0,R[-1]C[-3]) -> 7097260 | G144: 60
A145: =R[-80]C+1 -> 3 | B145: =R[-80]C -> 59 | C145: 7788000 | D145: =IF(RC[-2]=1,0,R[-1]C+R[-1]C[-1]) -> 122849800 | E145: 3 | F145: =IF(RC[-4]=1,0,R[-1]C[-3]) -> 7437340 | G145: 60
A146: =R[-80]C+1 -> 3 | B146: =R[-80]C -> 60 | C146: 8149400 | D146: =IF(RC[-2]=1,0,R[-1]C+R[-1]C[-1]) -> 130637800 | E146: 3 | F146: =IF(RC[-4]=1,0,R[-1]C[-3]) -> 7788000 | G146: 70
A147: =R[-80]C+1 -> 3 | B147: =R[-80]C -> 61 | C147: 8521700 | D147: =IF(RC[-2]=1,0,R[-1]C+R[-1]C[-1]) -> 138787200 | E147: 3 | F147: =IF(RC[-4]=1,0,R[-1]C[-3]) -> 8149400 | G147: 70
A148: =R[-80]C+1 -> 3 | B148: =R[-80]C -> 62 | C148: 8905060 | D148: =IF(RC[-2]=1,0,R[-1]C+R[-1]C[-1]) -> 147308900 | E148: 3 | F148: =IF(RC[-4]=1,0,R[-1]C[-3]) -> 8521700 | G148: 70
A149: =R[-80]C+1 -> 3 | B149: =R[-80]C -> 63 | C149: 9299640 | D149: =IF(RC[-2]=1,0,R[-1]C+R[-1]C[-1]) -> 156213960 | E149: 3 | F149: =IF(RC[-4]=1,0,R[-1]C[-3]) -> 8905060 | G149: 70
A150: =R[-80]C+1 -> 3 | B150: =R[-80]C -> 64 | C150: 9705600 | D150: =IF(RC[-2]=1,0,R[-1]C+R[-1]C[-1]) -> 165513600 | E150: 3 | F150: =IF(RC[-4]=1,0,R[-1]C[-3]) -> 9299640 | G150: 70
A151: =R[-80]C+1 -> 3 | B151: =R[-80]C -> 65 | C151: 10123100 | D151: =IF(RC[-2]=1,0,R[-1]C+R[-1]C[-1]) -> 175219200 | E151: 3 | F151: =IF(RC[-4]=1,0,R[-1]C[-3]) -> 9705600 | G151: 70
A152: =R[-80]C+1 -> 3 | B152: =R[-80]C -> 66 | C152: 10552300 | D152: =IF(RC[-2]=1,0,R[-1]C+R[-1]C[-1]) -> 185342300 | E152: 3 | F152: =IF(RC[-4]=1,0,R[-1]C[-3]) -> 10123100 | G152: 70
A153: =R[-80]C+1 -> 3 | B153: =R[-80]C -> 67 | C153: 10993360 | D153: =IF(RC[-2]=1,0,R[-1]C+R[-1]C[-1]) -> 195894600 | E153: 3 | F153: =IF(RC[-4]=1,0,R[-1]C[-3]) -> 10552300 | G153: 70
A154: =R[-80]C+1 -> 3 | B154: =R[-80]C -> 68 | C154: 11446440 | D154: =IF(RC[-2]=1,0,R[-1]C+R[-1]C[-1]) -> 206887960 | E154: 3 | F154: =IF(RC[-4]=1,0,R[-1]C[-3]) -> 10993360 | G154: 70
A155: =R[-80]C+1 -> 3 | B155: =R[-80]C -> 69 | C155: 11911700 | D155: =IF(RC[-2]=1,0,R[-1]C+R[-1]C[-1]) -> 218334400 | E155: 3 | F155: =IF(RC[-4]=1,0,R[-1]C[-3]) -> 11446440 | G155: 70
A156: =R[-80]C+1 -> 3 | B156: =R[-80]C -> 70 | C156: 12389300 | D156: =IF(RC[-2]=1,0,R[-1]C+R[-1]C[-1]) -> 230246100 | E156: 3 | F156: =IF(RC[-4]=1,0,R[-1]C[-3]) -> 11911700 | G156: 80
A157: =R[-80]C+1 -> 3 | B157: =R[-80]C -> 71 | C157: 12879400 | D157: =IF(RC[-2]=1,0,R[-1]C+R[-1]C[-1]) -> 242635400 | E157: 3 | F157: =IF(RC[-4]=1,0,R[-1]C[-3]) -> 12389300 | G157: 80
A158: =R[-80]C+1 -> 3 | B158: =R[-80]C -> 72 | C158: 13382160 | D158: =IF(RC[-2]=1,0,R[-1]C+R[-1]C[-1]) -> 255514800 | E158: 3 | F158: =IF(RC[-4]=1,0,R[-1]C[-3]) -> 12879400 | G158: 80
A159: =R[-80]C+1 -> 3 | B159: =R[-80]C -> 73 | C159: 13897740 | D159: =IF(RC[-2]=1,0,R[-1]C+R[-1]C[-1]) -> 268896960 | E159: 3 | F159: =IF(RC[-4]=1,0,R[-1]C[-3]) -> 13382160 | G159: 80
A160: =R[-80]C+1 -> 3 | B160: =R[-80]C -> 74 | C160: 14426300 | D160: =IF(RC[-2]=1,0,R[-1]C+R[-1]C[-1]) -> 282794700 | E160: 3 | F160: =IF(RC[-4]=1,0,R[-1]C[-3]) -> 13897740 | G160: 80
A161: =R[-80]C+1 -> 3 | B161: =R[-80]C -> 75 | C161: 14968000 | D161: =IF(RC[-2]=1,0,R[-1]C+R[-1]C[-1]) -> 297221000 | E161: 3 | F161: =IF(RC[-4]=1,0,R[-1]C[-3]) -> 14426300 | G161: 80
A162: =R[-80]C+1 -> 3 | B162: =R[-80]C -> 76 | C162: 15523000 | D162: =IF(RC[-2]=1,0,R[-1]C+R[-1]C[-1]) -> 312189000 | E162: 3 | F162: =IF(RC[-4]=1,0,R[-1]C[-3]) -> 14968000 | G162: 80
A163: =R[-80]C+1 -> 3 | B163: =R[-80]C -> 77 | C163: 16091460 | D163: =IF(RC[-2]=1,0,R[-1]C+R[-1]C[-1]) -> 327712000 | E163: 3 | F163: =IF(RC[-4]=1,0,R[-1]C[-3]) -> 15523000 | G163: 80
A164: =R[-80]C+1 -> 3 | B164: =R[-80]C -> 78 | C164: 16673540 | D164: =IF(RC[-2]=1,0,R[-1]C+R[-1]C[-1]) -> 343803460 | E164: 3 | F164: =IF(RC[-4]=1,0,R[-1]C[-3]) -> 16091460 | G164: 80
A165: =R[-80]C+1 -> 3 | B165: =R[-80]C -> 79 | C165: 17269400 | D165: =IF(RC[-2]=1,0,R[-1]C+R[-1]C[-1]) -> 360477000 | E165: 3 | F165: =IF(RC[-4]=1,0,R[-1]C[-3]) -> 16673540 | G165: 80
A166: =R[-80]C+1 -> 3 | B166: =R[-80]C -> 80 | C166: 17879200 | D166: =IF(RC[-2]=1,0,R[-1]C+R[-1]C[-1]) -> 377746400 | E166: 3 | F166: =IF(RC[-4]=1,0,R[-1]C[-3]) -> 17269400 | G166: 80
A167: =R[-80]C+1 -> 4 | B167: =R[-80]C -> 1 | C167: 2250 | D167: =IF(RC[-2]=1,0,R[-1]C+R[-1]C[-1]) -> 0 | E167: 3 | F167: =IF(RC[-4]=1,0,R[-1]C[-3]) -> 0 | G167: 10
A168: =R[-80]C+1 -> 4 | B168: =R[-80]C -> 2 | C168: 6690 | D168: =IF(RC[-2]=1,0,R[-1]C+R[-1]C[-1]) -> 2250 | E168: 3 | F168: =IF(RC[-4]=1,0,R[-1]C[-3]) -> 2250 | G168: 10
A169: =R[-80]C+1 -> 4 | B169: =R[-80]C -> 3 | C169: 13560 | D169: =IF(RC[-2]=1,0,R[-1]C+R[-1]C[-1]) -> 8940 | E169: 3 | F169: =IF(RC[-4]=1,0,R[-1]C[-3]) -> 6690 | G169: 10
A170: =R[-80]C+1 -> 4 | B170: =R[-80]C -> 4 | C170: 23100 | D170: =IF(RC[-2]=1,0,R[-1]C+R[-1]C[-1]) -> 22500 | E170: 3 | F170: =IF(RC[-4]=1,0,R[-1]C[-3]) -> 13560 | G170: 10
A171: =R[-80]C+1 -> 4 | B171: =R[-80]C -> 5 | C171: 35550 | D171: =IF(RC[-2]=1,0,R[-1]C+R[-1]C[-1]) -> 45600 | E171: 3 | F171: =IF(RC[-4]=1,0,R[-1]C[-3]) -> 23100 | G171: 10
A172: =R[-80]C+1 -> 4 | B172: =R[-80]C -> 6 | C172: 51150 | D172: =IF(RC[-2]=1,0,R[-1]C+R[-1]C[-1]) -> 81150 | E172: 3 | F172: =IF(RC[-4]=1,0,R[-1]C[-3]) -> 35550 | G172: 10
A173: =R[-80]C+1 -> 4 | B173: =R[-80]C -> 7 | C173: 70140 | D173: =IF(RC[-2]=1,0,R[-1]C+R[-1]C[-1]) -> 132300 | E173: 3 | F173: =IF(RC[-4]=1,0,R[-1]C[-3]) -> 51150 | G173: 10
A174: =R[-80]C+1 -> 4 | B174: =R[-80]C -> 8 | C174: 92760 | D174: =IF(RC[-2]=1,0,R[-1]C+R[-1]C[-1]) -> 202440 | E174: 3 | F174: =IF(RC[-4]=1,0,R[-1]C[-3]) -> 70140 | G174: 10
A175: =R[-80]C+1 -> 4 | B175: =R[-80]C -> 9 | C175: 119250 | D175: =IF(RC[-2]=1,0,R[-1]C+R[-1]C[-1]) -> 295200 | E175: 3 | F175: =IF(RC[-4]=1,0,R[-1]C[-3]) -> 92760 | G175: 10
A176: =R[-80]C+1 -> 4 | B176: =R[-80]C -> 10 | C176: 149850 | D176: =IF(RC[-2]=1,0,R[-1]C+R[-1]C[-1]) -> 414450 | E176: 3 | F176: =IF(RC[-4]=1,0,R[-1]C[-3]) -> 119250 | G176: 20
A177: =R[-80]C+1 -> 4 | B177: =R[-80]C -> 11 | C177: 184800 | D177: =IF(RC[-2]=1,0,R[-1]C+R[-1]C[-1]) -> 564300 | E177: 3 | F177: =IF(RC[-4]=1,0,R[-1]C[-3]) -> 149850 | G177: 20
A178: =R[-80]C+1 -> 4 | B178: =R[-80]C -> 12 | C178: 224340 | D178: =IF(RC[-2]=1,0,R[-1]C+R[-1]C[-1]) -> 749100 | E178: 3 | F178: =IF(RC[-4]=1,0,R[-1]C[-3]) -> 184800 | G178: 20
A179: =R[-80]C+1 -> 4 | B179: =R[-80]C -> 13 | C179: 268710 | D179: =IF(RC[-2]=1,0,R[-1]C+R[-1]C[-1]) -> 973440 | E179: 3 | F179: =IF(RC[-4]=1,0,R[-1]C[-3]) -> 224340 | G179: 20
A180: =R[-80]C+1 -> 4 | B180: =R[-80]C -> 14 | C180: 318150 | D180: =IF(RC[-2]=1,0,R[-1]C+R[-1]C[-1]) -> 1242150 | E180: 3 | F180: =IF(RC[-4]=1,0,R[-1]C[-3]) -> 268710 | G180: 20
A181: =R[-80]C+1 -> 4 | B181: =R[-80]C -> 15 | C181: 372900 | D181: =IF(RC[-2]=1,0,R[-1]C+R[-1]C[-1]) -> 1560300 | E181: 3 | F181: =IF(RC[-4]=1,0,R[-1]C[-3]) -> 318150 | G181: 20
A182: =R[-80]C+1 -> 4 | B182: =R[-80]C -> 16 | C182: 433200 | D182: =IF(RC[-2]=1,0,R[-1]C+R[-1]C[-1]) -> 1933200 | E182: 3 | F182: =IF(RC[-4]=1,0,R[-1]C[-3]) -> 372900 | G182: 20
A183: =R[-80]C+1 -> 4 | B183: =R[-80]C -> 17 | C183: 499290 | D183: =IF(RC[-2]=1,0,R[-1]C+R[-1]C[-1]) -> 2366400 | E183: 3 | F183: =IF(RC[-4]=1,0,R[-1]C[-3]) -> 433200 | G183: 20
A184: =R[-80]C+1 -> 4 | B184: =R[-80]C -> 18 | C184: 571410 | D184: =IF(RC[-2]=1,0,R[-1]C+R[-1]C[-1]) -> 2865690 | E184: 3 | F184: =IF(RC[-4]=1,0,R[-1]C[-3]) -> 499290 | G184: 20
A185: =R[-80]C+1 -> 4 | B185: =R[-80]C -> 19 | C185: 649800 | D185: =IF(RC[-2]=1,0,R[-1]C+R[-1]C[-1]) -> 3437100 | E185: 3 | F185: =IF(RC[-4]=1,0,R[-1]C[-3]) -> 571410 | G185: 20
A186: =R[-80]C+1 -> 4 | B186: =R[-80]C -> 20 | C186: 734700 | D186: =IF(RC[-2]=1,0,R[-1]C+R[-1]C[-1]) -> 4086900 | E186: 3 | F186: =IF(RC[-4]=1,0,R[-1]C[-3]) -> 649800 | G186: 30
A187: =R[-80]C+1 -> 4 | B187: =R[-80]C -> 21 | C187: 826350 | D187: =IF(RC[-2]=1,0,R[-1]C+R[-1]C[-1]) -> 4821600 | E187: 3 | F187: =IF(RC[-4]=1,0,R[-1]C[-3]) -> 734700 | G187: 30
A188: =R[-80]C+1 -> 4 | B188: =R[-80]C -> 22 | C188: 924990 | D188: =IF(RC[-2]=1,0,R[-1]C+R[-1]C[-1]) -> 5647950 | E188: 3 | F188: =IF(RC[-4]=1,0,R[-1]C[-3]) -> 826350 | G188: 30
A189: =R[-80]C+1 -> 4 | B189: =R[-80]C -> 23 | C189: 1030860 | D189: =IF(RC[-2]=1,0,R[-1]C+R[-1]C[-1]) -> 6572940 | E189: 3 | F189: =IF(RC[-4]=1,0,R[-1]C[-3]) -> 924990 | G189: 30
A190: =R[-80]C+1 -> 4 | B190: =R[-80]C -> 24 | C190: 1144200 | D190: =IF(RC[-2]=1,0,R[-1]C+R[-1]C[-1]) -> 7603800 | E190: 3 | F190: =IF(RC[-4]=1,0,R[-1]C[-3]) -> 1030860 | G190: 30
A191: =R[-80]C+1 -> 4 | B191: =R[-80]C -> 25 | C191: 1265250 | D191: =IF(RC[-2]=1,0,R[-1]C+R[-1]C[-1]) -> 8748000 | E191: 3 | F191: =IF(RC[-4]=1,0,R[-1]C[-3]) -> 1144200 | G191: 30
A192: =R[-80]C+1 -> 4 | B192: =R[-80]C -> 26 | C192: 1394250 | D192: =IF(RC[-2]=1,0,R[-1]C+R[-1]C[-1]) -> 10013250 | E192: 3 | F192: =IF(RC[-4]=1,0,R[-1]C[-3]) -> 1265250 | G192: 30
A193: =R[-80]C+1 -> 4 | B193: =R[-80]C -> 27 | C193: 1531440 | D193: =IF(RC[-2]=1,0,R[-1]C+R[-1]C[-1]) -> 11407500 | E193: 3 | F193: =IF(RC[-4]=1,0,R[-1]C[-3]) -> 1394250 | G193: 30
A194: =R[-80]C+1 -> 4 | B194: =R[-80]C -> 28 | C194: 1677060 | D194: =IF(RC[-2]=1,0,R[-1]C+R[-1]C[-1]) -> 12938940 | E194: 3 | F194: =IF(RC[-4]=1,0,R[-1]C[-3]) -> 1531440 | G194: 30
A195: =R[-80]C+1 -> 4 | B195: =R[-80]C -> 29 | C195: 1831350 | D195: =IF(RC[-2]=1,0,R[-1]C+R[-1]C[-1]) -> 14616000 | E195: 3 | F195: =IF(RC[-4]=1,0,R[-1]C[-3]) -> 1677060 | G195: 30
A196: =R[-80]C+1 -> 4 | B196: =R[-80]C -> 30 | C196: 1994550 | D196: =IF(RC[-2]=1,0,R[-1]C+R[-1]C[-1]) -> 16447350 | E196: 3 | F196: =IF(RC[-4]=1,0,R[-1]C[-3]) -> 1831350 | G196: 40
A197: =R[-80]C+1 -> 4 | B197: =R[-80]C -> 31 | C197: 2166900 | D197: =IF(RC[-2]=1,0,R[-1]C+R[-1]C[-1]) -> 18441900 | E197: 3 | F197: =IF(RC[-4]=1,0,R[-1]C[-3]) -> 1994550 | G197: 40
A198: =R[-80]C+1 -> 4 | B198: =R[-80]C -> 32 | C198: 2348640 | D198: =IF(RC[-2]=1,0,R[-1]C+R[-1]C[-1]) -> 20608800 | E198: 3 | F198: =IF(RC[-4]=1,0,R[-1]C[-3]) -> 2166900 | G198: 40
A199: =R[-80]C+1 -> 4 | B199: =R[-80]C -> 33 | C199: 2540010 | D199: =IF(RC[-2]=1,0,R[-1]C+R[-1]C[-1]) -> 22957440 | E199: 3 | F199: =IF(RC[-4]=1,0,R[-1]C[-3]) -> 2348640 | G199: 40
A200: =R[-80]C+1 -> 4 | B200: =R[-80]C -> 34 | C200: 2741250 | D200: =IF(RC[-2]=1,0,R[-1]C+R[-1]C[-1]) -> 25497450 | E200: 3 | F200: =IF(RC[-4]=1,0,R[-1]C[-3]) -> 2540010 | G200: 40
A201: =R[-80]C+1 -> 4 | B201: =R[-80]C -> 35 | C201: 2952600 | D201: =IF(RC[-2]=1,0,R[-1]C+R[-1]C[-1]) -> 28238700 | E201: 3 | F201: =IF(RC[-4]=1,0,R[-1]C[-3]) -> 2741250 | G201: 40
A202: =R[-80]C+1 -> 4 | B202: =R[-80]C -> 36 | C202: 3174300 | D202: =IF(RC[-2]=1,0,R[-1]C+R[-1]C[-1]) -> 31191300 | E202: 3 | F202: =IF(RC[-4]=1,0,R[-1]C[-3]) -> 2952600 | G202: 40
A203: =R[-80]C+1 -> 4 | B203: =R[-80]C -> 37 | C203: 3406590 | D203: =IF(RC[-2]=1,0,R[-1]C+R[-1]C[-1]) -> 34365600 | E203: 3 | F203: =IF(RC[-4]=1,0,R[-1]C[-3]) -> 3174300 | G203: 40
A204: =R[-80]C+1 -> 4 | B204: =R[-80]C -> 38 | C204: 3649710 | D204: =IF(RC[-2]=1,0,R[-1]C+R[-1]C[-1]) -> 37772190 | E204: 3 | F204: =IF(RC[-4]=1,0,R[-1]C[-3]) -> 3406590 | G204: 40
A205: =R[-80]C+1 -> 4 | B205: =R[-80]C -> 39 | C205: 3903900 | D205: =IF(RC[-2]=1,0,R[-1]C+R[-1]C[-1]) -> 41421900 | E205: 3 | F205: =IF(RC[-4]=1,0,R[-1]C[-3]) -> 3649710 | G205: 40
A206: =R[-80]C+1 -> 4 | B206: =R[-80]C -> 40 | C206: 4169400 | D206: =IF(RC[-2]=1,0,R[-1]C+R[-1]C[-1]) -> 45325800 | E206: 3 | F206: =IF(RC[-4]=1,0,R[-1]C[-3]) -> 3903900 | G206: 50
A207: =R[-80]C+1 -> 4 | B207: =R[-80]C -> 41 | C207: 4446450 | D207: =IF(RC[-2]=1,0,R[-1]C+R[-1]C[-1]) -> 49495200 | E207: 3 | F207: =IF(RC[-4]=1,0,R[-1]C[-3]) -> 4169400 | G207: 50
A208: =R[-80]C+1 -> 4 | B208: =R[-80]C -> 42 | C208: 4735290 | D208: =IF(RC[-2]=1,0,R[-1]C+R[-1]C[-1]) -> 53941650 | E208: 3 | F208: =IF(RC[-4]=1,0,R[-1]C[-3]) -> 4446450 | G208: 50
A209: =R[-80]C+1 -> 4 | B209: =R[-80]C -> 43 | C209: 5036160 | D209: =IF(RC[-2]=1,0,R[-1]C+R[-1]C[-1]) -> 58676940 | E209: 3 | F209: =IF(RC[-4]=1,0,R[-1]C[-3]) -> 4735290 | G209: 50
A210: =R[-80]C+1 -> 4 | B210: =R[-80]C -> 44 | C210: 5349300 | D210: =IF(RC[-2]=1,0,R[-1]C+R[-1]C[-1]) -> 63713100 | E210: 3 | F210: =IF(RC[-4]=1,0,R[-1]C[-3]) -> 5036160 | G210: 50
A211: =R[-80]C+1 -> 4 | B211: =R[-80]C -> 45 | C211: 5674950 | D211: =IF(RC[-2]=1,0,R[-1]C+R[-1]C[-1]) -> 69062400 | E211: 3 | F211: =IF(RC[-4]=1,0,R[-1]C[-3]) -> 5349300 | G211: 50
A212: =R[-80]C+1 -> 4 | B212: =R[-80]C -> 46 | C212: 6013350 | D212: =IF(RC[-2]=1,0,R[-1]C+R[-1]C[-1]) -> 74737350 | E212: 3 | F212: =IF(RC[-4]=1,0,R[-1]C[-3]) -> 5674950 | G212: 50
A213: =R[-80]C+1 -> 4 | B213: =R[-80]C -> 47 | C213: 6364740 | D213: =IF(RC[-2]=1,0,R[-1]C+R[-1]C[-1]) -> 80750700 | E213: 3 | F213: =IF(RC[-4]=1,0,R[-1]C[-3]) -> 6013350 | G213: 50
A214: =R[-80]C+1 -> 4 | B214: =R[-80]C -> 48 | C214: 6729360 | D214: =IF(RC[-2]=1,0,R[-1]C+R[-1]C[-1]) -> 87115440 | E214: 3 | F214: =IF(RC[-4]=1,0,R[-1]C[-3]) -> 6364740 | G214: 50
A215: =R[-80]C+1 -> 4 | B215: =R[-80]C -> 49 | C215: 7107450 | D215: =IF(RC[-2]=1,0,R[-1]C+R[-1]C[-1]) -> 93844800 | E215: 3 | F215: =IF(RC[-4]=1,0,R[-1]C[-3]) -> 6729360 | G215: 50
A216: =R[-80]C+1 -> 4 | B216: =R[-80]C -> 50 | C216: 7499250 | D216: =IF(RC[-2]=1,0,R[-1]C+R[-1]C[-1]) -> 100952250 | E216: 3 | F216: =IF(RC[-4]=1,0,R[-1]C[-3]) -> 7107450 | G216: 60
A217: =R[-80]C+1 -> 4 | B217: =R[-80]C -> 51 | C217: 7905000 | D217: =IF(RC[-2]=1,0,R[-1]C+R[-1]C[-1]) -> 108451500 | E217: 3 | F217: =IF(RC[-4]=1,0,R[-1]C[-3]) -> 7499250 | G217: 60
A218: =R[-80]C+1 -> 4 | B218: =R[-80]C -> 52 | C218: 8324940 | D218: =IF(RC[-2]=1,0,R[-1]C+R[-1]C[-1]) -> 116356500 | E218: 3 | F218: =IF(RC[-4]=1,0,R[-1]C[-3]) -> 7905000 | G218: 60
A219: =R[-80]C+1 -> 4 | B219: =R[-80]C -> 53 | C219: 8759310 | D219: =IF(RC[-2]=1,0,R[-1]C+R[-1]C[-1]) -> 124681440 | E219: 3 | F219: =IF(RC[-4]=1,0,R[-1]C[-3]) -> 8324940 | G219: 60
A220: =R[-80]C+1 -> 4 | B220: =R[-80]C -> 54 | C220: 9208350 | D220: =IF(RC[-2]=1,0,R[-1]C+R[-1]C[-1]) -> 133440750 | E220: 3 | F220: =IF(RC[-4]=1,0,R[-1]C[-3]) -> 8759310 | G220: 60
A221: =R[-80]C+1 -> 4 | B221: =R[-80]C -> 55 | C221: 9672300 | D221: =IF(RC[-2]=1,0,R[-1]C+R[-1]C[-1]) -> 142649100 | E221: 3 | F221: =IF(RC[-4]=1,0,R[-1]C[-3]) -> 9208350 | G221: 60
A222: =R[-80]C+1 -> 4 | B222: =R[-80]C -> 56 | C222: 10151400 | D222: =IF(RC[-2]=1,0,R[-1]C+R[-1]C[-1]) -> 152321400 | E222: 3 | F222: =IF(RC[-4]=1,0,R[-1]C[-3]) -> 9672300 | G222: 60
A223: =R[-80]C+1 -> 4 | B223: =R[-80]C -> 57 | C223: 10645890 | D223: =IF(RC[-2]=1,0,R[-1]C+R[-1]C[-1]) -> 162472800 | E223: 3 | F223: =IF(RC[-4]=1,0,R[-1]C[-3]) -> 10151400 | G223: 60
A224: =R[-80]C+1 -> 4 | B224: =R[-80]C -> 58 | C224: 11156010 | D224: =IF(RC[-2]=1,0,R[-1]C+R[-1]C[-1]) -> 173118690 | E224: 3 | F224: =IF(RC[-4]=1,0,R[-1]C[-3]) -> 10645890 | G224: 60
A225: =R[-80]C+1 -> 4 | B225: =R[-80]C -> 59 | C225: 11682000 | D225: =IF(RC[-2]=1,0,R[-1]C+R[-1]C[-1]) -> 184274700 | E225: 3 | F225: =IF(RC[-4]=1,0,R[-1]C[-3]) -> 11156010 | G225: 60
A226: =R[-80]C+1 -> 4 | B226: =R[-80]C -> 60 | C226: 12224100 | D226: =IF(RC[-2]=1,0,R[-1]C+R[-1]C[-1]) -> 195956700 | E226: 3 | F226: =IF(RC[-4]=1,0,R[-1]C[-3]) -> 11682000 | G226: 70
A227: =R[-80]C+1 -> 4 | B227: =R[-80]C -> 61 | C227: 12782550 | D227: =IF(RC[-2]=1,0,R[-1]C+R[-1]C[-1]) -> 208180800 | E227: 3 | F227: =IF(RC[-4]=1,0,R[-1]C[-3]) -> 12224100 | G227: 70
A228: =R[-80]C+1 -> 4 | B228: =R[-80]C -> 62 | C228: 13357590 | D228: =IF(RC[-2]=1,0,R[-1]C+R[-1]C[-1]) -> 220963350 | E228: 3 | F228: =IF(RC[-4]=1,0,R[-1]C[-3]) -> 12782550 | G228: 70
A229: =R[-80]C+1 -> 4 | B229: =R[-80]C -> 63 | C229: 13949460 | D229: =IF(RC[-2]=1,0,R[-1]C+R[-1]C[-1]) -> 234320940 | E229: 3 | F229: =IF(RC[-4]=1,0,R[-1]C[-3]) -> 13357590 | G229: 70
A230: =R[-80]C+1 -> 4 | B230: =R[-80]C -> 64 | C230: 14558400 | D230: =IF(RC[-2]=1,0,R[-1]C+R[-1]C[-1]) -> 248270400 | E230: 3 | F230: =IF(RC[-4]=1,0,R[-1]C[-3]) -> 13949460 | G230: 70
A231: =R[-80]C+1 -> 4 | B231: =R[-80]C -> 65 | C231: 15184650 | D231: =IF(RC[-2]=1,0,R[-1]C+R[-1]C[-1]) -> 262828800 | E231: 3 | F231: =IF(RC[-4]=1,0,R[-1]C[-3]) -> 14558400 | G231: 70
A232: =R[-80]C+1 -> 4 | B232: =R[-80]C -> 66 | C232: 15828450 | D232: =IF(RC[-2]=1,0,R[-1]C+R[-1]C[-1]) -> 278013450 | E232: 3 | F232: =IF(RC[-4]=1,0,R[-1]C[-3]) -> 15184650 | G232: 70
A233: =R[-80]C+1 -> 4 | B233: =R[-80]C -> 67 | C233: 16490040 | D233: =IF(RC[-2]=1,0,R[-1]C+R[-1]C[-1]) -> 293841900 | E233: 3 | F233: =IF(RC[-4]=1,0,R[-1]C[-3]) -> 15828450 | G233: 70
A234: =R[-80]C+1 -> 4 | B234: =R[-80]C -> 68 | C234: 17169660 | D234: =IF(RC[-2]=1,0,R[-1]C+R[-1]C[-1]) -> 310331940 | E234: 3 | F234: =IF(RC[-4]=1,0,R[-1]C[-3]) -> 16490040 | G234: 70
A235: =R[-80]C+1 -> 4 | B235: =R[-80]C -> 69 | C235: 17867550 | D235: =IF(RC[-2]=1,0,R[-1]C+R[-1]C[-1]) -> 327501600 | E235: 3 | F235: =IF(RC[-4]=1,0,R[-1]C[-3]) -> 17169660 | G235: 70
A236: =R[-80]C+1 -> 4 | B236: =R[-80]C -> 70 | C236: 18583950 | D236: =IF(RC[-2]=1,0,R[-1]C+R[-1]C[-1]) -> 345369150 | E236: 3 | F236: =IF(RC[-4]=1,0,R[-1]C[-3]) -> 17867550 | G236: 80
A237: =R[-80]C+1 -> 4 | B237: =R[-80]C -> 71 | C237: 19319100 | D237: =IF(RC[-2]=1,0,R[-1]C+R[-1]C[-1]) -> 363953100 | E237: 3 | F237: =IF(RC[-4]=1,0,R[-1]C[-3]) -> 18583950 | G237: 80
A238: =R[-80]C+1 -> 4 | B238: =R[-80]C -> 72 | C238: 20073240 | D238: =IF(RC[-2]=1,0,R[-1]C+R[-1]C[-1]) -> 383272200 | E238: 3 | F238: =IF(RC[-4]=1,0,R[-1]C[-3]) -> 19319100 | G238: 80
A239: =R[-80]C+1 -> 4 | B239: =R[-80]C -> 73 | C239: 20846610 | D239: =IF(RC[-2]=1,0,R[-1]C+R[-1]C[-1]) -> 403345440 | E239: 3 | F239: =IF(RC[-4]=1,0,R[-1]C[-3]) -> 20073240 | G239: 80
A240: =R[-80]C+1 -> 4 | B240: =R[-80]C -> 74 | C240: 21639450 | D240: =IF(RC[-2]=1,0,R[-1]C+R[-1]C[-1]) -> 424192050 | E240: 3 | F240: =IF(RC[-4]=1,0,R[-1]C[-3]) -> 20846610 | G240: 80
A241: =R[-80]C+1 -> 4 | B241: =R[-80]C -> 75 | C241: 22452000 | D241: =IF(RC[-2]=1,0,R[-1]C+R[-1]C[-1]) -> 445831500 | E241: 3 | F241: =IF(RC[-4]=1,0,R[-1]C[-3]) -> 21639450 | G241: 80
A242: =R[-80]C+1 -> 4 | B242: =R[-80]C -> 76 | C242: 23284500 | D242: =IF(RC[-2]=1,0,R[-1]C+R[-1]C[-1]) -> 468283500 | E242: 3 | F242: =IF(RC[-4]=1,0,R[-1]C[-3]) -> 22452000 | G242: 80
A243: =R[-80]C+1 -> 4 | B243: =R[-80]C -> 77 | C243: 24137190 | D243: =IF(RC[-2]=1,0,R[-1]C+R[-1]C[-1]) -> 491568000 | E243: 3 | F243: =IF(RC[-4]=1,0,R[-1]C[-3]) -> 23284500 | G243: 80
A244: =R[-80]C+1 -> 4 | B244: =R[-80]C -> 78 | C244: 25010310 | D244: =IF(RC[-2]=1,0,R[-1]C+R[-1]C[-1]) -> 515705190 | E244: 3 | F244: =IF(RC[-4]=1,0,R[-1]C[-3]) -> 24137190 | G244: 80
A245: =R[-80]C+1 -> 4 | B245: =R[-80]C -> 79 | C245: 25904100 | D245: =IF(RC[-2]=1,0,R[-1]C+R[-1]C[-1]) -> 540715500 | E245: 3 | F245: =IF(RC[-4]=1,0,R[-1]C[-3]) -> 25010310 | G245: 80
A246: =R[-80]C+1 -> 4 | B246: =R[-80]C -> 80 | C246: 26818800 | D246: =IF(RC[-2]=1,0,R[-1]C+R[-1]C[-1]) -> 566619600 | E246: 3 | F246: =IF(RC[-4]=1,0,R[-1]C[-3]) -> 25904100 | G246: 80
A247: =R[-80]C+1 -> 5 | B247: =R[-80]C -> 1 | C247: 3750 | D247: =IF(RC[-2]=1,0,R[-1]C+R[-1]C[-1]) -> 0 | E247: 3 | F247: =IF(RC[-4]=1,0,R[-1]C[-3]) -> 0 | G247: 10
A248: =R[-80]C+1 -> 5 | B248: =R[-80]C -> 2 | C248: 11150 | D248: =IF(RC[-2]=1,0,R[-1]C+R[-1]C[-1]) -> 3750 | E248: 3 | F248: =IF(RC[-4]=1,0,R[-1]C[-3]) -> 3750 | G248: 10
A249: =R[-80]C+1 -> 5 | B249: =R[-80]C -> 3 | C249: 22600 | D249: =IF(RC[-2]=1,0,R[-1]C+R[-1]C[-1]) -> 14900 | E249: 3 | F249: =IF(RC[-4]=1,0,R[-1]C[-3]) -> 11150 | G249: 10
A250: =R[-80]C+1 -> 5 | B250: =R[-80]C -> 4 | C250: 38500 | D250: =IF(RC[-2]=1,0,R[-1]C+R[-1]C[-1]) -> 37500 | E250: 3 | F250: =IF(RC[-4]=1,0,R[-1]C[-3]) -> 22600 | G250: 10
A251: =R[-80]C+1 -> 5 | B251: =R[-80]C -> 5 | C251: 59250 | D251: =IF(RC[-2]=1,0,R[-1]C+R[-1]C[-1]) -> 76000 | E251: 3 | F251: =IF(RC[-4]=1,0,R[-1]C[-3]) -> 38500 | G251: 10
A252: =R[-80]C+1 -> 5 | B252: =R[-80]C -> 6 | C252: 85250 | D252: =IF(RC[-2]=1,0,R[-1]C+R[-1]C[-1]) -> 135250 | E252: 3 | F252: =IF(RC[-4]=1,0,R[-1]C[-3]) -> 59250 | G252: 10
A253: =R[-80]C+1 -> 5 | B253: =R[-80]C -> 7 | C253: 116900 | D253: =IF(RC[-2]=1,0,R[-1]C+R[-1]C[-1]) -> 220500 | E253: 3 | F253: =IF(RC[-4]=1,0,R[-1]C[-3]) -> 85250 | G253: 10
A254: =R[-80]C+1 -> 5 | B254: =R[-80]C -> 8 | C254: 154600 | D254: =IF(RC[-2]=1,0,R[-1]C+R[-1]C[-1]) -> 337400 | E254: 3 | F254: =IF(RC[-4]=1,0,R[-1]C[-3]) -> 116900 | G254: 10
A255: =R[-80]C+1 -> 5 | B255: =R[-80]C -> 9 | C255: 198750 | D255: =IF(RC[-2]=1,0,R[-1]C+R[-1]C[-1]) -> 492000 | E255: 3 | F255: =IF(RC[-4]=1,0,R[-1]C[-3]) -> 154600 | G255: 10
A256: =R[-80]C+1 -> 5 | B256: =R[-80]C -> 10 | C256: 249750 | D256: =IF(RC[-2]=1,0,R[-1]C+R[-1]C[-1]) -> 690750 | E256: 3 | F256: =IF(RC[-4]=1,0,R[-1]C[-3]) -> 198750 | G256: 20
A257: =R[-80]C+1 -> 5 | B257: =R[-80]C -> 11 | C257: 308000 | D257: =IF(RC[-2]=1,0,R[-1]C+R[-1]C[-1]) -> 940500 | E257: 3 | F257: =IF(RC[-4]=1,0,R[-1]C[-3]) -> 249750 | G257: 20
A258: =R[-80]C+1 -> 5 | B258: =R[-80]C -> 12 | C258: 373900 | D258: =IF(RC[-2]=1,0,R[-1]C+R[-1]C[-1]) -> 1248500 | E258: 3 | F258: =IF(RC[-4]=1,0,R[-1]C[-3]) -> 308000 | G258: 20
A259: =R[-80]C+1 -> 5 | B259: =R[-80]C -> 13 | C259: 447850 | D259: =IF(RC[-2]=1,0,R[-1]C+R[-1]C[-1]) -> 1622400 | E259: 3 | F259: =IF(RC[-4]=1,0,R[-1]C[-3]) -> 373900 | G259: 20
A260: =R[-80]C+1 -> 5 | B260: =R[-80]C -> 14 | C260: 530250 | D260: =IF(RC[-2]=1,0,R[-1]C+R[-1]C[-1]) -> 2070250 | E260: 3 | F260: =IF(RC[-4]=1,0,R[-1]C[-3]) -> 447850 | G260: 20
A261: =R[-80]C+1 -> 5 | B261: =R[-80]C -> 15 | C261: 621500 | D261: =IF(RC[-2]=1,0,R[-1]C+R[-1]C[-1]) -> 2600500 | E261: 3 | F261: =IF(RC[-4]=1,0,R[-1]C[-3]) -> 530250 | G261: 20
A262: =R[-80]C+1 -> 5 | B262: =R[-80]C -> 16 | C262: 722000 | D262: =IF(RC[-2]=1,0,R[-1]C+R[-1]C[-1]) -> 3222000 | E262: 3 | F262: =IF(RC[-4]=1,0,R[-1]C[-3]) -> 621500 | G262: 20
A263: =R[-80]C+1 -> 5 | B263: =R[-80]C -> 17 | C263: 832150 | D263: =IF(RC[-2]=1,0,R[-1]C+R[-1]C[-1]) -> 3944000 | E263: 3 | F263: =IF(RC[-4]=1,0,R[-1]C[-3]) -> 722000 | G263: 20
A264: =R[-80]C+1 -> 5 | B264: =R[-80]C -> 18 | C264: 952350 | D264: =IF(RC[-2]=1,0,R[-1]C+R[-1]C[-1]) -> 4776150 | E264: 3 | F264: =IF(RC[-4]=1,0,R[-1]C[-3]) -> 832150 | G264: 20
A265: =R[-80]C+1 -> 5 | B265: =R[-80]C -> 19 | C265: 1083000 | D265: =IF(RC[-2]=1,0,R[-1]C+R[-1]C[-1]) -> 5728500 | E265: 3 | F265: =IF(RC[-4]=1,0,R[-1]C[-3]) -> 952350 | G265: 20
A266: =R[-80]C+1 -> 5 | B266: =R[-80]C -> 20 | C266: 1224500 | D266: =IF(RC[-2]=1,0,R[-1]C+R[-1]C[-1]) -> 6811500 | E266: 3 | F266: =IF(RC[-4]=1,0,R[-1]C[-3]) -> 1083000 | G266: 30
A267: =R[-80]C+1 -> 5 | B267: =R[-80]C -> 21 | C267: 1377250 | D267: =IF(RC[-2]=1,0,R[-1]C+R[-1]C[-1]) -> 8036000 | E267: 3 | F267: =IF(RC[-4]=1,0,R[-1]C[-3]) -> 1224500 | G267: 30
A268: =R[-80]C+1 -> 5 | B268: =R[-80]C -> 22 | C268: 1541650 | D268: =IF(RC[-2]=1,0,R[-1]C+R[-1]C[-1]) -> 9413250 | E268: 3 | F268: =IF(RC[-4]=1,0,R[-1]C[-3]) -> 1377250 | G268: 30
A269: =R[-80]C+1 -> 5 | B269: =R[-80]C -> 23 | C269: 1718100 | D269: =IF(RC[-2]=1,0,R[-1]C+R[-1]C[-1]) -> 10954900 | E269: 3 | F269: =IF(RC[-4]=1,0,R[-1]C[-3]) -> 1541650 | G269: 30
A270: =R[-80]C+1 -> 5 | B270: =R[-80]C -> 24 | C270: 1907000 | D270: =IF(RC[-2]=1,0,R[-1]C+R[-1]C[-1]) -> 12673000 | E270: 3 | F270: =IF(RC[-4]=1,0,R[-1]C[-3]) -> 1718100 | G270: 30
A271: =R[-80]C+1 -> 5 | B271: =R[-80]C -> 25 | C271: 2108750 | D271: =IF(RC[-2]=1,0,R[-1]C+R[-1]C[-1]) -> 14580000 | E271: 3 | F271: =IF(RC[-4]=1,0,R[-1]C[-3]) -> 1907000 | G271: 30
A272: =R[-80]C+1 -> 5 | B272: =R[-80]C -> 26 | C272: 2323750 | D272: =IF(RC[-2]=1,0,R[-1]C+R[-1]C[-1]) -> 16688750 | E272: 3 | F272: =IF(RC[-4]=1,0,R[-1]C[-3]) -> 2108750 | G272: 30
A273: =R[-80]C+1 -> 5 | B273: =R[-80]C -> 27 | C273: 2552400 | D273: =IF(RC[-2]=1,0,R[-1]C+R[-1]C[-1]) -> 19012500 | E273: 3 | F273: =IF(RC[-4]=1,0,R[-1]C[-3]) -> 2323750 | G273: 30
A274: =R[-80]C+1 -> 5 | B274: =R[-80]C -> 28 | C274: 2795100 | D274: =IF(RC[-2]=1,0,R[-1]C+R[-1]C[-1]) -> 21564900 | E274: 3 | F274: =IF(RC[-4]=1,0,R[-1]C[-3]) -> 2552400 | G274: 30
A275: =R[-80]C+1 -> 5 | B275: =R[-80]C -> 29 | C275: 3052250 | D275: =IF(RC[-2]=1,0,R[-1]C+R[-1]C[-1]) -> 24360000 | E275: 3 | F275: =IF(RC[-4]=1,0,R[-1]C[-3]) -> 2795100 | G275: 30
A276: =R[-80]C+1 -> 5 | B276: =R[-80]C -> 30 | C276: 3324250 | D276: =IF(RC[-2]=1,0,R[-1]C+R[-1]C[-1]) -> 27412250 | E276: 3 | F276: =IF(RC[-4]=1,0,R[-1]C[-3]) -> 3052250 | G276: 40
A277: =R[-80]C+1 -> 5 | B277: =R[-80]C -> 31 | C277: 3611500 | D277: =IF(RC[-2]=1,0,R[-1]C+R[-1]C[-1]) -> 30736500 | E277: 3 | F277: =IF(RC[-4]=1,0,R[-1]C[-3]) -> 3324250 | G277: 40
A278: =R[-80]C+1 -> 5 | B278: =R[-80]C -> 32 | C278: 3914400 | D278: =IF(RC[-2]=1,0,R[-1]C+R[-1]C[-1]) -> 34348000 | E278: 3 | F278: =IF(RC[-4]=1,0,R[-1]C[-3]) -> 3611500 | G278: 40
A279: =R[-80]C+1 -> 5 | B279: =R[-80]C -> 33 | C279: 4233350 | D279: =IF(RC[-2]=1,0,R[-1]C+R[-1]C[-1]) -> 38262400 | E279: 3 | F279: =IF(RC[-4]=1,0,R[-1]C[-3]) -> 3914400 | G279: 40
A280: =R[-80]C+1 -> 5 | B280: =R[-80]C -> 34 | C280: 4568750 | D280: =IF(RC[-2]=1,0,R[-1]C+R[-1]C[-1]) -> 42495750 | E280: 3 | F280: =IF(RC[-4]=1,0,R[-1]C[-3]) -> 4233350 | G280: 40
A281: =R[-80]C+1 -> 5 | B281: =R[-80]C -> 35 | C281: 4921000 | D281: =IF(RC[-2]=1,0,R[-1]C+R[-1]C[-1]) -> 47064500 | E281: 3 | F281: =IF(RC[-4]=1,0,R[-1]C[-3]) -> 4568750 | G281: 40
A282: =R[-80]C+1 -> 5 | B282: =R[-80]C -> 36 | C282: 5290500 | D282: =IF(RC[-2]=1,0,R[-1]C+R[-1]C[-1]) -> 51985500 | E282: 3 | F282: =IF(RC[-4]=1,0,R[-1]C[-3]) -> 4921000 | G282: 40
A283: =R[-80]C+1 -> 5 | B283: =R[-80]C -> 37 | C283: 5677650 | D283: =IF(RC[-2]=1,0,R[-1]C+R[-1]C[-1]) -> 57276000 | E283: 3 | F283: =IF(RC[-4]=1,0,R[-1]C[-3]) -> 5290500 | G283: 40
A284: =R[-80]C+1 -> 5 | B284: =R[-80]C -> 38 | C284: 6082850 | D284: =IF(RC[-2]=1,0,R[-1]C+R[-1]C[-1]) -> 62953650 | E284: 3 | F284: =IF(RC[-4]=1,0,R[-1]C[-3]) -> 5677650 | G284: 40
A285: =R[-80]C+1 -> 5 | B285: =R[-80]C -> 39 | C285: 6506500 | D285: =IF(RC[-2]=1,0,R[-1]C+R[-1]C[-1]) -> 69036500 | E285: 3 | F285: =IF(RC[-4]=1,0,R[-1]C[-3]) -> 6082850 | G285: 40
A286: =R[-80]C+1 -> 5 | B286: =R[-80]C -> 40 | C286: 6949000 | D286: =IF(RC[-2]=1,0,R[-1]C+R[-1]C[-1]) -> 75543000 | E286: 3 | F286: =IF(RC[-4]=1,0,R[-1]C[-3]) -> 6506500 | G286: 50
A287: =R[-80]C+1 -> 5 | B287: =R[-80]C -> 41 | C287: 7410750 | D287: =IF(RC[-2]=1,0,R[-1]C+R[-1]C[-1]) -> 82492000 | E287: 3 | F287: =IF(RC[-4]=1,0,R[-1]C[-3]) -> 6949000 | G287: 50
A288: =R[-80]C+1 -> 5 | B288: =R[-80]C -> 42 | C288: 7892150 | D288: =IF(RC[-2]=1,0,R[-1]C+R[-1]C[-1]) -> 89902750 | E288: 3 | F288: =IF(RC[-4]=1,0,R[-1]C[-3]) -> 7410750 | G288: 50
A289: =R[-80]C+1 -> 5 | B289: =R[-80]C -> 43 | C289: 8393600 | D289: =IF(RC[-2]=1,0,R[-1]C+R[-1]C[-1]) -> 97794900 | E289: 3 | F289: =IF(RC[-4]=1,0,R[-1]C[-3]) -> 7892150 | G289: 50
A290: =R[-80]C+1 -> 5 | B290: =R[-80]C -> 44 | C290: 8915500 | D290: =IF(RC[-2]=1,0,R[-1]C+R[-1]C[-1]) -> 106188500 | E290: 3 | F290: =IF(RC[-4]=1,0,R[-1]C[-3]) -> 8393600 | G290: 50
A291: =R[-80]C+1 -> 5 | B291: =R[-80]C -> 45 | C291: 9458250 | D291: =IF(RC[-2]=1,0,R[-1]C+R[-1]C[-1]) -> 115104000 | E291: 3 | F291: =IF(RC[-4]=1,0,R[-1]C[-3]) -> 8915500 | G291: 50
A292: =R[-80]C+1 -> 5 | B292: =R[-80]C -> 46 | C292: 10022250 | D292: =IF(RC[-2]=1,0,R[-1]C+R[-1]C[-1]) -> 124562250 | E292: 3 | F292: =IF(RC[-4]=1,0,R[-1]C[-3]) -> 9458250 | G292: 50
A293: =R[-80]C+1 -> 5 | B293: =R[-80]C -> 47 | C293: 10607900 | D293: =IF(RC[-2]=1,0,R[-1]C+R[-1]C[-1]) -> 134584500 | E293: 3 | F293: =IF(RC[-4]=1,0,R[-1]C[-3]) -> 10022250 | G293: 50
A294: =R[-80]C+1 -> 5 | B294: =R[-80]C -> 48 | C294: 11215600 | D294: =IF(RC[-2]=1,0,R[-1]C+R[-1]C[-1]) -> 145192400 | E294: 3 | F294: =IF(RC[-4]=1,0,R[-1]C[-3]) -> 10607900 | G294: 50
A295: =R[-80]C+1 -> 5 | B295: =R[-80]C -> 49 | C295: 11845750 | D295: =IF(RC[-2]=1,0,R[-1]C+R[-1]C[-1]) -> 156408000 | E295: 3 | F295: =IF(RC[-4]=1,0,R[-1]C[-3]) -> 11215600 | G295: 50
A296: =R[-80]C+1 -> 5 | B296: =R[-80]C -> 50 | C296: 12498750 | D296: =IF(RC[-2]=1,0,R[-1]C+R[-1]C[-1]) -> 168253750 | E296: 3 | F296: =IF(RC[-4]=1,0,R[-1]C[-3]) -> 11845750 | G296: 60
A297: =R[-80]C+1 -> 5 | B297: =R[-80]C -> 51 | C297: 13175000 | D297: =IF(RC[-2]=1,0,R[-1]C+R[-1]C[-1]) -> 180752500 | E297: 3 | F297: =IF(RC[-4]=1,0,R[-1]C[-3]) -> 12498750 | G297: 60
A298: =R[-80]C+1 -> 5 | B298: =R[-80]C -> 52 | C298: 13874900 | D298: =IF(RC[-2]=1,0,R[-1]C+R[-1]C[-1]) -> 193927500 | E298: 3 | F298: =IF(RC[-4]=1,0,R[-1]C[-3]) -> 13175000 | G298: 60
A299: =R[-80]C+1 -> 5 | B299: =R[-80]C -> 53 | C299: 14598850 | D299: =IF(RC[-2]=1,0,R[-1]C+R[-1]C[-1]) -> 207802400 | E299: 3 | F299: =IF(RC[-4]=1,0,R[-1]C[-3]) -> 13874900 | G299: 60
A300: =R[-80]C+1 -> 5 | B300: =R[-80]C -> 54 | C300: 15347250 | D300: =IF(RC[-2]=1,0,R[-1]C+R[-1]C[-1]) -> 222401250 | E300: 3 | F300: =IF(RC[-4]=1,0,R[-1]C[-3]) -> 14598850 | G300: 60
A301: =R[-80]C+1 -> 5 | B301: =R[-80]C -> 55 | C301: 16120500 | D301: =IF(RC[-2]=1,0,R[-1]C+R[-1]C[-1]) -> 237748500 | E301: 3 | F301: =IF(RC[-4]=1,0,R[-1]C[-3]) -> 15347250 | G301: 60
A302: =R[-80]C+1 -> 5 | B302: =R[-80]C -> 56 | C302: 16919000 | D302: =IF(RC[-2]=1,0,R[-1]C+R[-1]C[-1]) -> 253869000 | E302: 3 | F302: =IF(RC[-4]=1,0,R[-1]C[-3]) -> 16120500 | G302: 60
A303: =R[-80]C+1 -> 5 | B303: =R[-80]C -> 57 | C303: 17743150 | D303: =IF(RC[-2]=1,0,R[-1]C+R[-1]C[-1]) -> 270788000 | E303: 3 | F303: =IF(RC[-4]=1,0,R[-1]C[-3]) -> 16919000 | G303: 60
A304: =R[-80]C+1 -> 5 | B304: =R[-80]C -> 58 | C304: 18593350 | D304: =IF(RC[-2]=1,0,R[-1]C+R[-1]C[-1]) -> 288531150 | E304: 3 | F304: =IF(RC[-4]=1,0,R[-1]C[-3]) -> 17743150 | G304: 60
A305: =R[-80]C+1 -> 5 | B305: =R[-80]C -> 59 | C305: 19470000 | D305: =IF(RC[-2]=1,0,R[-1]C+R[-1]C[-1]) -> 307124500 | E305: 3 | F305: =IF(RC[-4]=1,0,R[-1]C[-3]) -> 18593350 | G305: 60
A306: =R[-80]C+1 -> 5 | B306: =R[-80]C -> 60 | C306: 20373500 | D306: =IF(RC[-2]=1,0,R[-1]C+R[-1]C[-1]) -> 326594500 | E306: 3 | F306: =IF(RC[-4]=1,0,R[-1]C[-3]) -> 19470000 | G306: 70
A307: =R[-80]C+1 -> 5 | B307: =R[-80]C -> 61 | C307: 21304250 | D307: =IF(RC[-2]=1,0,R[-1]C+R[-1]C[-1]) -> 346968000 | E307: 3 | F307: =IF(RC[-4]=1,0,R[-1]C[-3]) -> 20373500 | G307: 70
A308: =R[-80]C+1 -> 5 | B308: =R[-80]C -> 62 | C308: 22262650 | D308: =IF(RC[-2]=1,0,R[-1]C+R[-1]C[-1]) -> 368272250 | E308: 3 | F308: =IF(RC[-4]=1,0,R[-1]C[-3]) -> 21304250 | G308: 70
A309: =R[-80]C+1 -> 5 | B309: =R[-80]C -> 63 | C309: 23249100 | D309: =IF(RC[-2]=1,0,R[-1]C+R[-1]C[-1]) -> 390534900 | E309: 3 | F309: =IF(RC[-4]=1,0,R[-1]C[-3]) -> 22262650 | G309: 70
A310: =R[-80]C+1 -> 5 | B310: =R[-80]C -> 64 | C310: 24264000 | D310: =IF(RC[-2]=1,0,R[-1]C+R[-1]C[-1]) -> 413784000 | E310: 3 | F310: =IF(RC[-4]=1,0,R[-1]C[-3]) -> 23249100 | G310: 70
A311: =R[-80]C+1 -> 5 | B311: =R[-80]C -> 65 | C311: 25307750 | D311: =IF(RC[-2]=1,0,R[-1]C+R[-1]C[-1]) -> 438048000 | E311: 3 | F311: =IF(RC[-4]=1,0,R[-1]C[-3]) -> 24264000 | G311: 70
A312: =R[-80]C+1 -> 5 | B312: =R[-80]C -> 66 | C312: 26380750 | D312: =IF(RC[-2]=1,0,R[-1]C+R[-1]C[-1]) -> 463355750 | E312: 3 | F312: =IF(RC[-4]=1,0,R[-1]C[-3]) -> 25307750 | G312: 70
A313: =R[-80]C+1 -> 5 | B313: =R[-80]C -> 67 | C313: 27483400 | D313: =IF(RC[-2]=1,0,R[-1]C+R[-1]C[-1]) -> 489736500 | E313: 3 | F313: =IF(RC[-4]=1,0,R[-1]C[-3]) -> 26380750 | G313: 70
A314: =R[-80]C+1 -> 5 | B314: =R[-80]C -> 68 | C314: 28616100 | D314: =IF(RC[-2]=1,0,R[-1]C+R[-1]C[-1]) -> 517219900 | E314: 3 | F314: =IF(RC[-4]=1,0,R[-1]C[-3]) -> 27483400 | G314: 70
A315: =R[-80]C+1 -> 5 | B315: =R[-80]C -> 69 | C315: 29779250 | D315: =IF(RC[-2]=1,0,R[-1]C+R[-1]C[-1]) -> 545836000 | E315: 3 | F315: =IF(RC[-4]=1,0,R[-1]C[-3]) -> 28616100 | G315: 70
A316: =R[-80]C+1 -> 5 | B316: =R[-80]C -> 70 | C316: 30973250 | D316: =IF(RC[-2]=1,0,R[-1]C+R[-1]C[-1]) -> 575615250 | E316: 3 | F316: =IF(RC[-4]=1,0,R[-1]C[-3]) -> 29779250 | G316: 80
A317: =R[-80]C+1 -> 5 | B317: =R[-80]C -> 71 | C317: 32198500 | D317: =IF(RC[-2]=1,0,R[-1]C+R[-1]C[-1]) -> 606588500 | E317: 3 | F317: =IF(RC[-4]=1,0,R[-1]C[-3]) -> 30973250 | G317: 80
A318: =R[-80]C+1 -> 5 | B318: =R[-80]C -> 72 | C318: 33455400 | D318: =IF(RC[-2]=1,0,R[-1]C+R[-1]C[-1]) -> 638787000 | E318: 3 | F318: =IF(RC[-4]=1,0,R[-1]C[-3]) -> 32198500 | G318: 80
A319: =R[-80]C+1 -> 5 | B319: =R[-80]C -> 73 | C319: 34744350 | D319: =IF(RC[-2]=1,0,R[-1]C+R[-1]C[-1]) -> 672242400 | E319: 3 | F319: =IF(RC[-4]=1,0,R[-1]C[-3]) -> 33455400 | G319: 80
A320: =R[-80]C+1 -> 5 | B320: =R[-80]C -> 74 | C320: 36065750 | D320: =IF(RC[-2]=1,0,R[-1]C+R[-1]C[-1]) -> 706986750 | E320: 3 | F320: =IF(RC[-4]=1,0,R[-1]C[-3]) -> 34744350 | G320: 80
A321: =R[-80]C+1 -> 5 | B321: =R[-80]C -> 75 | C321: 37420000 | D321: =IF(RC[-2]=1,0,R[-1]C+R[-1]C[-1]) -> 743052500 | E321: 3 | F321: =IF(RC[-4]=1,0,R[-1]C[-3]) -> 36065750 | G321: 80
A322: =R[-80]C+1 -> 5 | B322: =R[-80]C -> 76 | C322: 38807500 | D322: =IF(RC[-2]=1,0,R[-1]C+R[-1]C[-1]) -> 780472500 | E322: 3 | F322: =IF(RC[-4]=1,0,R[-1]C[-3]) -> 37420000 | G322: 80
A323: =R[-80]C+1 -> 5 | B323: =R[-80]C -> 77 | C323: 40228650 | D323: =IF(RC[-2]=1,0,R[-1]C+R[-1]C[-1]) -> 819280000 | E323: 3 | F323: =IF(RC[-4]=1,0,R[-1]C[-3]) -> 38807500 | G323: 80
A324: =R[-80]C+1 -> 5 | B324: =R[-80]C -> 78 | C324: 41683850 | D324: =IF(RC[-2]=1,0,R[-1]C+R[-1]C[-1]) -> 859508650 | E324: 3 | F324: =IF(RC[-4]=1,0,R[-1]C[-3]) -> 40228650 | G324: 80
A325: =R[-80]C+1 -> 5 | B325: =R[-80]C -> 79 | C325: 43173500 | D325: =IF(RC[-2]=1,0,R[-1]C+R[-1]C[-1]) -> 901192500 | E325: 3 | F325: =IF(RC[-4]=1,0,R[-1]C[-3]) -> 41683850 | G325: 80
A326: =R[-80]C+1 -> 5 | B326: =R[-80]C -> 80 | C326: 44698000 | D326: =IF(RC[-2]=1,0,R[-1]C+R[-1]C[-1]) -> 944366000 | E326: 3 | F326: =IF(RC[-4]=1,0,R[-1]C[-3]) -> 43173500 | G326: 80

Sheet: 宝物精炼信息
A1: quality|quality | B1: refine_level|refine_level | C1: cost_treasure_num|cost_treasure_num | D1: cost_item_id|cost_item_id | E1: cost_item_num|cost_item_num | F1: cost_type_list|cost_type_list | G1: cost_value_list|cost_value_list | H1: need_level|
A2: 不可空 | B2: 不可空 | C2: 不可空 | D2: 不可空 | E2: 不可空 | F2: 可空#不需字段 | G2: 可空#不需字段 | H2: 不可空
A3: 数字 | B3: 数字 | C3: 数字 | D3: 数字 | E3: 数字 | F3: 一维数组 | G3: 一维数组 | H3: 数字
F4: 不定长 | G4: 不定长
A6: 宝物品质 | B6: 精炼等级 | C6: 消耗同名宝物的数量 | D6: 消耗的物品Id | E6: 消耗的物品数量 | F6: 消耗的类型 | G6: 消耗的金币 | H6: 需要战队等级
A7: 2 | B7: 0 | C7: 0 | D7: 10010 | E7: 30 | F7: 3 | G7: 30000 | H7: 39
A8: 2 | B8: 1 | C8: 0 | D8: 10010 | E8: 100 | F8: 3 | G8: 100000 | H8: 39
A9: 2 | B9: 2 | C9: 1 | D9: 10010 | E9: 250 | F9: 3 | G9: 150000 | H9: 39
A10: 2 | B10: 3 | C10: 1 | D10: 10010 | E10: 500 | F10: 3 | G10: 200000 | H10: 39
A11: 2 | B11: 4 | C11: 2 | D11: 10010 | E11: 800 | F11: 3 | G11: 300000 | H11: 39
A12: 2 | B12: 5 | C12: 2 | D12: 10010 | E12: 1200 | F12: 3 | G12: 400000 | H12: 50
A13: 2 | B13: 6 | C13: 3 | D13: 10010 | E13: 1700 | F13: 3 | G13: 500000 | H13: 50
A14: 2 | B14: 7 | C14: 3 | D14: 10010 | E14: 2300 | F14: 3 | G14: 600000 | H14: 50
A15: 2 | B15: 8 | C15: 4 | D15: 10010 | E15: 3000 | F15: 3 | G15: 700000 | H15: 50
A16: 2 | B16: 9 | C16: 4 | D16: 10010 | E16: 4000 | F16: 3 | G16: 800000 | H16: 50
A17: 2 | B17: 10 | C17: 5 | D17: 10010 | E17: 5000 | F17: 3 | G17: 900000 | H17: 60
A18: 2 | B18: 11 | C18: 5 | D18: 10010 | E18: 6000 | F18: 3 | G18: 1000000 | H18: 60
A19: 2 | B19: 12 | C19: 6 | D19: 10010 | E19: 7000 | F19: 3 | G19: 1200000 | H19: 60
A20: 2 | B20: 13 | C20: 6 | D20: 10010 | E20: 8000 | F20: 3 | G20: 1400000 | H20: 60
A21: 2 | B21: 14 | C21: 7 | D21: 10010 | E21: 9000 | F21: 3 | G21: 1600000 | H21: 60
A22: 2 | B22: 15 | C22: 7 | D22: 10010 | E22: 10000 | F22: 3 | G22: 1800000 | H22: 70
A23: 2 | B23: 16 | C23: 8 | D23: 10010 | E23: 11000 | F23: 3 | G23: 2000000 | H23: 70
A24: 2 | B24: 17 | C24: 8 | D24: 10010 | E24: 12000 | F24: 3 | G24: 2500000 | H24: 70
A25: 2 | B25: 18 | C25: 9 | D25: 10010 | E25: 13500 | F25: 3 | G25: 3000000 | H25: 70
A26: 2 | B26: 19 | C26: 9 | D26: 10010 | E26: 15000 | F26: 3 | G26: 4000000 | H26: 70
A27: 2 | B27: 20 | C27: 0 | D27: 10010 | E27: 0 | F27: 3 | G27: 0 | H27: 70
A28: =R[-21]C+1 -> 3 | B28: =R[-21]C -> 0 | C28: =R[-21]C -> 0 | D28: =R[-21]C -> 10010 | E28: =R[-21]C -> 30 | F28: 3 | G28: =R[-21]C -> 30000 | H28: 39
A29: =R[-21]C+1 -> 3 | B29: =R[-21]C -> 1 | C29: =R[-21]C -> 0 | D29: =R[-21]C -> 10010 | E29: =R[-21]C -> 100 | F29: 3 | G29: =R[-21]C -> 100000 | H29: 39
A30: =R[-21]C+1 -> 3 | B30: =R[-21]C -> 2 | C30: =R[-21]C -> 1 | D30: =R[-21]C -> 10010 | E30: =R[-21]C -> 250 | F30: 3 | G30: =R[-21]C -> 150000 | H30: 39
A31: =R[-21]C+1 -> 3 | B31: =R[-21]C -> 3 | C31: =R[-21]C -> 1 | D31: =R[-21]C -> 10010 | E31: =R[-21]C -> 500 | F31: 3 | G31: =R[-21]C -> 200000 | H31: 39
A32: =R[-21]C+1 -> 3 | B32: =R[-21]C -> 4 | C32: =R[-21]C -> 2 | D32: =R[-21]C -> 10010 | E32: =R[-21]C -> 800 | F32: 3 | G32: =R[-21]C -> 300000 | H32: 39
A33: =R[-21]C+1 -> 3 | B33: =R[-21]C -> 5 | C33: =R[-21]C -> 2 | D33: =R[-21]C -> 10010 | E33: =R[-21]C -> 1200 | F33: 3 | G33: =R[-21]C -> 400000 | H33: 50
A34: =R[-21]C+1 -> 3 | B34: =R[-21]C -> 6 | C34: =R[-21]C -> 3 | D34: =R[-21]C -> 10010 | E34: =R[-21]C -> 1700 | F34: 3 | G34: =R[-21]C -> 500000 | H34: 50
A35: =R[-21]C+1 -> 3 | B35: =R[-21]C -> 7 | C35: =R[-21]C -> 3 | D35: =R[-21]C -> 10010 | E35: =R[-21]C -> 2300 | F35: 3 | G35: =R[-21]C -> 600000 | H35: 50
A36: =R[-21]C+1 -> 3 | B36: =R[-21]C -> 8 | C36: =R[-21]C -> 4 | D36: =R[-21]C -> 10010 | E36: =R[-21]C -> 3000 | F36: 3 | G36: =R[-21]C -> 700000 | H36: 50
A37: =R[-21]C+1 -> 3 | B37: =R[-21]C -> 9 | C37: =R[-21]C -> 4 | D37: =R[-21]C -> 10010 | E37: =R[-21]C -> 4000 | F37: 3 | G37: =R[-21]C -> 800000 | H37: 50
A38: =R[-21]C+1 -> 3 | B38: =R[-21]C -> 10 | C38: =R[-21]C -> 5 | D38: =R[-21]C -> 10010 | E38: =R[-21]C -> 5000 | F38: 3 | G38: =R[-21]C -> 900000 | H38: 60
A39: =R[-21]C+1 -> 3 | B39: =R[-21]C -> 11 | C39: =R[-21]C -> 5 | D39: =R[-21]C -> 10010 | E39: =R[-21]C -> 6000 | F39: 3 | G39: =R[-21]C -> 1000000 | H39: 60
A40: =R[-21]C+1 -> 3 | B40: =R[-21]C -> 12 | C40: =R[-21]C -> 6 | D40: =R[-21]C -> 10010 | E40: =R[-21]C -> 7000 | F40: 3 | G40: =R[-21]C -> 1200000 | H40: 60
A41: =R[-21]C+1 -> 3 | B41: =R[-21]C -> 13 | C41: =R[-21]C -> 6 | D41: =R[-21]C -> 10010 | E41: =R[-21]C -> 8000 | F41: 3 | G41: =R[-21]C -> 1400000 | H41: 60
A42: =R[-21]C+1 -> 3 | B42: =R[-21]C -> 14 | C42: =R[-21]C -> 7 | D42: =R[-21]C -> 10010 | E42: =R[-21]C -> 9000 | F42: 3 | G42: =R[-21]C -> 1600000 | H42: 60
A43: =R[-21]C+1 -> 3 | B43: =R[-21]C -> 15 | C43: =R[-21]C -> 7 | D43: =R[-21]C -> 10010 | E43: =R[-21]C -> 10000 | F43: 3 | G43: =R[-21]C -> 1800000 | H43: 70
A44: =R[-21]C+1 -> 3 | B44: =R[-21]C -> 16 | C44: =R[-21]C -> 8 | D44: =R[-21]C -> 10010 | E44: =R[-21]C -> 11000 | F44: 3 | G44: =R[-21]C -> 2000000 | H44: 70
A45: =R[-21]C+1 -> 3 | B45: =R[-21]C -> 17 | C45: =R[-21]C -> 8 | D45: =R[-21]C -> 10010 | E45: =R[-21]C -> 12000 | F45: 3 | G45: =R[-21]C -> 2500000 | H45: 70
A46: =R[-21]C+1 -> 3 | B46: =R[-21]C -> 18 | C46: =R[-21]C -> 9 | D46: =R[-21]C -> 10010 | E46: =R[-21]C -> 13500 | F46: 3 | G46: =R[-21]C -> 3000000 | H46: 70
A47: =R[-21]C+1 -> 3 | B47: =R[-21]C -> 19 | C47: =R[-21]C -> 9 | D47: =R[-21]C -> 10010 | E47: =R[-21]C -> 15000 | F47: 3 | G47: =R[-21]C -> 4000000 | H47: 70
A48: =R[-21]C+1 -> 3 | B48: =R[-21]C -> 20 | C48: =R[-21]C -> 0 | D48: =R[-21]C -> 10010 | E48: =R[-21]C -> 0 | F48: 3 | G48: =R[-21]C -> 0 | H48: 70
A49: =R[-21]C+1 -> 4 | B49: =R[-21]C -> 0 | C49: =R[-21]C -> 0 | D49: =R[-21]C -> 10010 | E49: =R[-21]C -> 30 | F49: 3 | G49: =R[-21]C -> 30000 | H49: 39
A50: =R[-21]C+1 -> 4 | B50: =R[-21]C -> 1 | C50: =R[-21]C -> 0 | D50: =R[-21]C -> 10010 | E50: =R[-21]C -> 100 | F50: 3 | G50: =R[-21]C -> 100000 | H50: 39
A51: =R[-21]C+1 -> 4 | B51: =R[-21]C -> 2 | C51: =R[-21]C -> 1 | D51: =R[-21]C -> 10010 | E51: =R[-21]C -> 250 | F51: 3 | G51: =R[-21]C -> 150000 | H51: 39
A52: =R[-21]C+1 -> 4 | B52: =R[-21]C -> 3 | C52: =R[-21]C -> 1 | D52: =R[-21]C -> 10010 | E52: =R[-21]C -> 500 | F52: 3 | G52: =R[-21]C -> 200000 | H52: 39
A53: =R[-21]C+1 -> 4 | B53: =R[-21]C -> 4 | C53: =R[-21]C -> 2 | D53: =R[-21]C -> 10010 | E53: =R[-21]C -> 800 | F53: 3 | G53: =R[-21]C -> 300000 | H53: 39
A54: =R[-21]C+1 -> 4 | B54: =R[-21]C -> 5 | C54: =R[-21]C -> 2 | D54: =R[-21]C -> 10010 | E54: =R[-21]C -> 1200 | F54: 3 | G54: =R[-21]C -> 400000 | H54: 50
A55: =R[-21]C+1 -> 4 | B55: =R[-21]C -> 6 | C55: =R[-21]C -> 3 | D55: =R[-21]C -> 10010 | E55: =R[-21]C -> 1700 | F55: 3 | G55: =R[-21]C -> 500000 | H55: 50
A56: =R[-21]C+1 -> 4 | B56: =R[-21]C -> 7 | C56: =R[-21]C -> 3 | D56: =R[-21]C -> 10010 | E56: =R[-21]C -> 2300 | F56: 3 | G56: =R[-21]C -> 600000 | H56: 50
A57: =R[-21]C+1 -> 4 | B57: =R[-21]C -> 8 | C57: =R[-21]C -> 4 | D57: =R[-21]C -> 10010 | E57: =R[-21]C -> 3000 | F57: 3 | G57: =R[-21]C -> 700000 | H57: 50
A58: =R[-21]C+1 -> 4 | B58: =R[-21]C -> 9 | C58: =R[-21]C -> 4 | D58: =R[-21]C -> 10010 | E58: =R[-21]C -> 4000 | F58: 3 | G58: =R[-21]C -> 800000 | H58: 50
A59: =R[-21]C+1 -> 4 | B59: =R[-21]C -> 10 | C59: =R[-21]C -> 5 | D59: =R[-21]C -> 10010 | E59: =R[-21]C -> 5000 | F59: 3 | G59: =R[-21]C -> 900000 | H59: 60
A60: =R[-21]C+1 -> 4 | B60: =R[-21]C -> 11 | C60: =R[-21]C -> 5 | D60: =R[-21]C -> 10010 | E60: =R[-21]C -> 6000 | F60: 3 | G60: =R[-21]C -> 1000000 | H60: 60
A61: =R[-21]C+1 -> 4 | B61: =R[-21]C -> 12 | C61: =R[-21]C -> 6 | D61: =R[-21]C -> 10010 | E61: =R[-21]C -> 7000 | F61: 3 | G61: =R[-21]C -> 1200000 | H61: 60
A62: =R[-21]C+1 -> 4 | B62: =R[-21]C -> 13 | C62: =R[-21]C -> 6 | D62: =R[-21]C -> 10010 | E62: =R[-21]C -> 8000 | F62: 3 | G62: =R[-21]C -> 1400000 | H62: 60
A63: =R[-21]C+1 -> 4 | B63: =R[-21]C -> 14 | C63: =R[-21]C -> 7 | D63: =R[-21]C -> 10010 | E63: =R[-21]C -> 9000 | F63: 3 | G63: =R[-21]C -> 1600000 | H63: 60
A64: =R[-21]C+1 -> 4 | B64: =R[-21]C -> 15 | C64: =R[-21]C -> 7 | D64: =R[-21]C -> 10010 | E64: =R[-21]C -> 10000 | F64: 3 | G64: =R[-21]C -> 1800000 | H64: 70
A65: =R[-21]C+1 -> 4 | B65: =R[-21]C -> 16 | C65: =R[-21]C -> 8 | D65: =R[-21]C -> 10010 | E65: =R[-21]C -> 11000 | F65: 3 | G65: =R[-21]C -> 2000000 | H65: 70
A66: =R[-21]C+1 -> 4 | B66: =R[-21]C -> 17 | C66: =R[-21]C -> 8 | D66: =R[-21]C -> 10010 | E66: =R[-21]C -> 12000 | F66: 3 | G66: =R[-21]C -> 2500000 | H66: 70
A67: =R[-21]C+1 -> 4 | B67: =R[-21]C -> 18 | C67: =R[-21]C -> 9 | D67: =R[-21]C -> 10010 | E67: =R[-21]C -> 13500 | F67: 3 | G67: =R[-21]C -> 3000000 | H67: 70
A68: =R[-21]C+1 -> 4 | B68: =R[-21]C -> 19 | C68: =R[-21]C -> 9 | D68: =R[-21]C -> 10010 | E68: =R[-21]C -> 15000 | F68: 3 | G68: =R[-21]C -> 4000000 | H68: 70
A69: =R[-21]C+1 -> 4 | B69: =R[-21]C -> 20 | C69: =R[-21]C -> 0 | D69: =R[-21]C -> 10010 | E69: =R[-21]C -> 0 | F69: 3 | G69: =R[-21]C -> 0 | H69: 70
A70: =R[-21]C+1 -> 5 | B70: =R[-21]C -> 0 | C70: =R[-21]C -> 0 | D70: =R[-21]C -> 10010 | E70: =R[-21]C -> 30 | F70: 3 | G70: =R[-21]C -> 30000 | H70: 39
A71: =R[-21]C+1 -> 5 | B71: =R[-21]C -> 1 | C71: =R[-21]C -> 0 | D71: =R[-21]C -> 10010 | E71: =R[-21]C -> 100 | F71: 3 | G71: =R[-21]C -> 100000 | H71: 39
A72: =R[-21]C+1 -> 5 | B72: =R[-21]C -> 2 | C72: =R[-21]C -> 1 | D72: =R[-21]C -> 10010 | E72: =R[-21]C -> 250 | F72: 3 | G72: =R[-21]C -> 150000 | H72: 39
A73: =R[-21]C+1 -> 5 | B73: =R[-21]C -> 3 | C73: =R[-21]C -> 1 | D73: =R[-21]C -> 10010 | E73: =R[-21]C -> 500 | F73: 3 | G73: =R[-21]C -> 200000 | H73: 39
A74: =R[-21]C+1 -> 5 | B74: =R[-21]C -> 4 | C74: =R[-21]C -> 2 | D74: =R[-21]C -> 10010 | E74: =R[-21]C -> 800 | F74: 3 | G74: =R[-21]C -> 300000 | H74: 39
A75: =R[-21]C+1 -> 5 | B75: =R[-21]C -> 5 | C75: =R[-21]C -> 2 | D75: =R[-21]C -> 10010 | E75: =R[-21]C -> 1200 | F75: 3 | G75: =R[-21]C -> 400000 | H75: 50
A76: =R[-21]C+1 -> 5 | B76: =R[-21]C -> 6 | C76: =R[-21]C -> 3 | D76: =R[-21]C -> 10010 | E76: =R[-21]C -> 1700 | F76: 3 | G76: =R[-21]C -> 500000 | H76: 50
A77: =R[-21]C+1 -> 5 | B77: =R[-21]C -> 7 | C77: =R[-21]C -> 3 | D77: =R[-21]C -> 10010 | E77: =R[-21]C -> 2300 | F77: 3 | G77: =R[-21]C -> 600000 | H77: 50
A78: =R[-21]C+1 -> 5 | B78: =R[-21]C -> 8 | C78: =R[-21]C -> 4 | D78: =R[-21]C -> 10010 | E78: =R[-21]C -> 3000 | F78: 3 | G78: =R[-21]C -> 700000 | H78: 50
A79: =R[-21]C+1 -> 5 | B79: =R[-21]C -> 9 | C79: =R[-21]C -> 4 | D79: =R[-21]C -> 10010 | E79: =R[-21]C -> 4000 | F79: 3 | G79: =R[-21]C -> 800000 | H79: 50
A80: =R[-21]C+1 -> 5 | B80: =R[-21]C -> 10 | C80: =R[-21]C -> 5 | D80: =R[-21]C -> 10010 | E80: =R[-21]C -> 5000 | F80: 3 | G80: =R[-21]C -> 900000 | H80: 60
A81: =R[-21]C+1 -> 5 | B81: =R[-21]C -> 11 | C81: =R[-21]C -> 5 | D81: =R[-21]C -> 10010 | E81: =R[-21]C -> 6000 | F81: 3 | G81: =R[-21]C -> 1000000 | H81: 60
A82: =R[-21]C+1 -> 5 | B82: =R[-21]C -> 12 | C82: =R[-21]C -> 6 | D82: =R[-21]C -> 10010 | E82: =R[-21]C -> 7000 | F82: 3 | G82: =R[-21]C -> 1200000 | H82: 60
A83: =R[-21]C+1 -> 5 | B83: =R[-21]C -> 13 | C83: =R[-21]C -> 6 | D83: =R[-21]C -> 10010 | E83: =R[-21]C -> 8000 | F83: 3 | G83: =R[-21]C -> 1400000 | H83: 60
A84: =R[-21]C+1 -> 5 | B84: =R[-21]C -> 14 | C84: =R[-21]C -> 7 | D84: =R[-21]C -> 10010 | E84: =R[-21]C -> 9000 | F84: 3 | G84: =R[-21]C -> 1600000 | H84: 60
A85: =R[-21]C+1 -> 5 | B85: =R[-21]C -> 15 | C85: =R[-21]C -> 7 | D85: =R[-21]C -> 10010 | E85: =R[-21]C -> 10000 | F85: 3 | G85: =R[-21]C -> 1800000 | H85: 70
A86: =R[-21]C+1 -> 5 | B86: =R[-21]C -> 16 | C86: =R[-21]C -> 8 | D86: =R[-21]C -> 10010 | E86: =R[-21]C -> 11000 | F86: 3 | G86: =R[-21]C -> 2000000 | H86: 70
A87: =R[-21]C+1 -> 5 | B87: =R[-21]C -> 17 | C87: =R[-21]C -> 8 | D87: =R[-21]C -> 10010 | E87: =R[-21]C -> 12000 | F87: 3 | G87: =R[-21]C -> 2500000 | H87: 70
A88: =R[-21]C+1 -> 5 | B88: =R[-21]C -> 18 | C88: =R[-21]C -> 9 | D88: =R[-21]C -> 10010 | E88: =R[-21]C -> 13500 | F88: 3 | G88: =R[-21]C -> 3000000 | H88: 70
A89: =R[-21]C+1 -> 5 | B89: =R[-21]C -> 19 | C89: =R[-21]C -> 9 | D89: =R[-21]C -> 10010 | E89: =R[-21]C -> 15000 | F89: 3 | G89: =R[-21]C -> 4000000 | H89: 70
A90: =R[-21]C+1 -> 5 | B90: =R[-21]C -> 20 | C90: =R[-21]C -> 0 | D90: =R[-21]C -> 10010 | E90: =R[-21]C -> 0 | F90: 3 | G90: =R[-21]C -> 0 | H90: 70

Sheet: 宝物合成
A1: id|id | B1: cost_item_list|cost_item_list | C1: is_default_show|
A2: 不可空 | B2: 不可空 | C2: 不可空
A3: 数字 | B3: 一维数组 | C3: 数字
B4: 不定长
A6: 宝物ID | B6: 需要的物品ID | C6: 是否默认显示
A7: 40201 | B7: 14201|14202|14203 | C7: 1
A8: 40301 | B8: 14301|14302|14303|14304 | C8: 0
A9: 40302 | B9: 14305|14306|14307|14308 | C9: 0
A10: 40303 | B10: 14309|14310|14311|14312 | C10: 0
A11: 40304 | B11: 14313|14314|14315|14316 | C11: 0
A12: 40401 | B12: 14401|14402|14403|14404|14405 | C12: 0
A13: 40402 | B13: 14406|14407|14408|14409|14410 | C13: 0
A14: 40403 | B14: 14411|14412|14413|14414|14415 | C14: 0
A15: 40404 | B15: 14416|14417|14418|14419|14420 | C15: 0
A16: 40501 | B16: 14501|14502|14503|14504|14505|14506 | C16: 0
A17: 40502 | B17: 14507|14508|14509|14510|14511|14512 | C17: 0
A18: 40503 | B18: 14513|14514|14515|14516|14517|14518 | C18: 0
A19: 40504 | B19: 14519|14520|14521|14522|14523|14524 | C19: 0
A20: 41201 | B20: 14204|14205|14206 | C20: 1
A21: 41301 | B21: 14317|14318|14319|14320 | C21: 0
A22: 41302 | B22: 14321|14322|14323|14324 | C22: 0
A23: 41303 | B23: 14325|14326|14327|14328 | C23: 0
A24: 41304 | B24: 14329|14330|14331|14332 | C24: 0
A25: 41401 | B25: 14421|14422|14423|14424|14425 | C25: 0
A26: 41402 | B26: 14426|14427|14428|14429|14430 | C26: 0
A27: 41403 | B27: 14431|14432|14433|14434|14435 | C27: 0
A28: 41404 | B28: 14436|14437|14438|14439|14440 | C28: 0
A29: 41501 | B29: 14525|14526|14527|14528|14529|14530 | C29: 0
A30: 41502 | B30: 14531|14532|14533|14534|14535|14536 | C30: 0
A31: 41503 | B31: 14537|14538|14539|14540|14541|14542 | C31: 0
A32: 41504 | B32: 14543|14544|14545|14546|14547|14548 | C32: 0
A33: 42201 | B33: 14207|14208|14209 | C33: 0
A34: 42301 | B34: 14333|14334|14335|14336 | C34: 0
A35: 42401 | B35: 14441|14442|14443|14444|14445 | C35: 0
A36: 42501 | B36: 14549|14550|14551|14552|14553|14554 | C36: 0

Sheet: 强化锻造配置
A1: strengthen_level|strengthen_level | B1: pro_type_list|pro_type_list | C1: pro_value_list|pro_value_list | D1: lvname| | E1: showLv|
A2: 不可空 | B2: 不可空 | C2: 不可空 | D2: 不可空 | E2: 不可空
A3: 数字 | B3: 一维数组 | C3: 一维数组 | D3: 字符串 | E3: 字符串
B4: 不定长 | C4: 不定长 | D4: 不定长 | E4: 不定长
A6: 需要的强化等级 | B6: 影响的属性类型列表 | C6: 影响的属性值列表 | D6: 等级名称 | E6: 当前强化大师等级
A7: 0 | B7: 0 | C7: 0 | D7: 圣器强化共鸣0级 | E7: 0
A8: 5 | B8: 1 | C8: 100 | D8: 圣器强化共鸣1级 | E8: 1
A9: 10 | B9: 1|2|3 | C9: 200|100|100 | D9: 圣器强化共鸣2级 | E9: 2
A10: 15 | B10: 1|4|2|3 | C10: 300|1000|200|200 | D10: 圣器强化共鸣3级 | E10: 3
A11: 20 | B11: 1|4|2|3 | C11: 400|2000|300|300 | D11: 圣器强化共鸣4级 | E11: 4
A12: 25 | B12: 1|4|2|3 | C12: 500|3000|400|400 | D12: 圣器强化共鸣5级 | E12: 5
A13: 30 | B13: 1|4|2|3 | C13: 600|4000|500|500 | D13: 圣器强化共鸣6级 | E13: 6
A14: 35 | B14: 1|4|2|3 | C14: 700|5000|600|600 | D14: 圣器强化共鸣7级 | E14: 7
A15: 40 | B15: 1|4|2|3 | C15: 800|6000|700|700 | D15: 圣器强化共鸣8级 | E15: 8
A16: 45 | B16: 1|4|2|3 | C16: 900|7000|800|800 | D16: 圣器强化共鸣9级 | E16: 9
A17: 50 | B17: 1|4|2|3 | C17: 1000|8000|900|900 | D17: 圣器强化共鸣10级 | E17: 10
A18: 55 | B18: 1|4|2|3 | C18: 1100|9000|1000|1000 | D18: 圣器强化共鸣11级 | E18: 11
A19: 60 | B19: 1|4|2|3 | C19: 1200|10000|1100|1100 | D19: 圣器强化共鸣12级 | E19: 12
A20: 65 | B20: 1|4|2|3 | C20: 1300|11000|1200|1200 | D20: 圣器强化共鸣13级 | E20: 13
A21: 70 | B21: 1|4|2|3 | C21: 1400|12000|1300|1300 | D21: 圣器强化共鸣14级 | E21: 14
A22: 75 | B22: 1|4|2|3 | C22: 1500|13000|1400|1400 | D22: 圣器强化共鸣15级 | E22: 15
A23: 80 | B23: 1|4|2|3 | C23: 1600|14000|1500|1500 | D23: 圣器强化共鸣16级 | E23: 16

Sheet: 精炼锻造配置
A1: refine_level|refine_level | B1: pro_type_list|pro_type_list | C1: pro_value_list|pro_value_list | D1: lvname| | E1: showLv|
A2: 不可空 | B2: 不可空 | C2: 不可空 | D2: 不可空 | E2: 不可空
A3: 数字 | B3: 一维数组 | C3: 一维数组 | D3: 字符串 | E3: 数字
B4: 不定长 | C4: 不定长 | D4: 不定长 | E4: 不定长
A6: 需要的精炼等级 | B6: 影响的属性类型列表 | C6: 影响的属性值列表 | D6: 等级名称 | E6: 当前精炼大师等级
A7: 0 | B7: 0 | C7: 0 | D7: 圣器精炼共鸣0级 | E7: 0
A8: 2 | B8: 7|5 | C8: 300|300 | D8: 圣器精炼共鸣1级 | E8: 1
A9: 4 | B9: 7|5 | C9: 600|600 | D9: 圣器精炼共鸣2级 | E9: 2
A10: 6 | B10: 7|5 | C10: 900|900 | D10: 圣器精炼共鸣3级 | E10: 3
A11: 8 | B11: 7|5 | C11: 1200|1200 | D11: 圣器精炼共鸣4级 | E11: 4
A12: 10 | B12: 7|5 | C12: 1500|1500 | D12: 圣器精炼共鸣5级 | E12: 5
A13: 12 | B13: 7|5 | C13: 1800|1800 | D13: 圣器精炼共鸣6级 | E13: 6
A14: 14 | B14: 7|5 | C14: 2100|2100 | D14: 圣器精炼共鸣7级 | E14: 7
A15: 16 | B15: 7|5 | C15: 2400|2400 | D15: 圣器精炼共鸣8级 | E15: 8
A16: 18 | B16: 7|5 | C16: 2700|2700 | D16: 圣器精炼共鸣9级 | E16: 9
A17: 20 | B17: 7|5 | C17: 3000|3000 | D17: 圣器精炼共鸣10级 | E17: 10

Sheet: 宝物熔炼
A1: id|id | B1: cost_treasure_id|cost_treasure_id | C1: item_id|item_id
A2: 不可空 | B2: 不可空 | C2: 不可空
A3: 数字 | B3: 数字 | C3: 数字
A6: 宝物ID | B6: 消耗的宝物ID | C6: 熔炼获得的碎片Id
A7: 42201 | B7: 14207 | C7: 14207
A8: 42301 | B8: 14317 | C8: 14317
A9: 42401 | B9: 14421 | C9: 14421
A10: 42501 | B10: 14525 | C10: 14525

Sheet: 宝物升品消耗
A1: refine_level|refine_level | B1: cost_item_num|cost_item_num | C1: cost_currency_type_list|cost_currency_type_list | D1: cost_currency_value_list|cost_currency_value_list
A2: 不可空 | B2: 不可空 | C2: 可空#不需字段 | D2: 可空#不需字段
A3: 数字 | B3: 数字 | C3: 一维数组 | D3: 一维数组
C4: 不定长 | D4: 不定长
A6: 精炼等级 | B6: 消耗的道具数量 | C6: 消耗货币类型列表 | D6: 消耗货币值列表
A7: 0 | B7: =RC[4]*20 -> 20 | C7: 3 | D7: =200000*RC[2] -> 200000 | E7: 1 | F7: =SUM(R7C[-1]:RC[-1]) -> 1
A8: 1 | B8: =RC[4]*20 -> 20 | C8: 3 | D8: =200000*RC[2] -> 200000 | E8: 0 | F8: =SUM(R7C[-1]:RC[-1]) -> 1
A9: 2 | B9: =RC[4]*20 -> 20 | C9: 3 | D9: =200000*RC[2] -> 200000 | E9: 0 | F9: =SUM(R7C[-1]:RC[-1]) -> 1
A10: 3 | B10: =RC[4]*20 -> 40 | C10: 3 | D10: =200000*RC[2] -> 400000 | E10: 1 | F10: =SUM(R7C[-1]:RC[-1]) -> 2
A11: 4 | B11: =RC[4]*20 -> 60 | C11: 3 | D11: =200000*RC[2] -> 600000 | E11: 1 | F11: =SUM(R7C[-1]:RC[-1]) -> 3
A12: 5 | B12: =RC[4]*20 -> 100 | C12: 3 | D12: =200000*RC[2] -> 1000000 | E12: 2 | F12: =SUM(R7C[-1]:RC[-1]) -> 5
A13: 6 | B13: =RC[4]*20 -> 140 | C13: 3 | D13: =200000*RC[2] -> 1400000 | E13: 2 | F13: =SUM(R7C[-1]:RC[-1]) -> 7
A14: 7 | B14: =RC[4]*20 -> 200 | C14: 3 | D14: =200000*RC[2] -> 2000000 | E14: 3 | F14: =SUM(R7C[-1]:RC[-1]) -> 10
A15: 8 | B15: =RC[4]*20 -> 260 | C15: 3 | D15: =200000*RC[2] -> 2600000 | E15: 3 | F15: =SUM(R7C[-1]:RC[-1]) -> 13
A16: 9 | B16: =RC[4]*20 -> 340 | C16: 3 | D16: =200000*RC[2] -> 3400000 | E16: 4 | F16: =SUM(R7C[-1]:RC[-1]) -> 17
A17: 10 | B17: =RC[4]*20 -> 420 | C17: 3 | D17: =200000*RC[2] -> 4200000 | E17: 4 | F17: =SUM(R7C[-1]:RC[-1]) -> 21
A18: 11 | B18: =RC[4]*20 -> 520 | C18: 3 | D18: =200000*RC[2] -> 5200000 | E18: 5 | F18: =SUM(R7C[-1]:RC[-1]) -> 26
A19: 12 | B19: =RC[4]*20 -> 620 | C19: 3 | D19: =200000*RC[2] -> 6200000 | E19: 5 | F19: =SUM(R7C[-1]:RC[-1]) -> 31
A20: 13 | B20: =RC[4]*20 -> 740 | C20: 3 | D20: =200000*RC[2] -> 7400000 | E20: 6 | F20: =SUM(R7C[-1]:RC[-1]) -> 37
A21: 14 | B21: =RC[4]*20 -> 860 | C21: 3 | D21: =200000*RC[2] -> 8600000 | E21: 6 | F21: =SUM(R7C[-1]:RC[-1]) -> 43
A22: 15 | B22: =RC[4]*20 -> 1000 | C22: 3 | D22: =200000*RC[2] -> 10000000 | E22: 7 | F22: =SUM(R7C[-1]:RC[-1]) -> 50
A23: 16 | B23: =RC[4]*20 -> 1140 | C23: 3 | D23: =200000*RC[2] -> 11400000 | E23: 7 | F23: =SUM(R7C[-1]:RC[-1]) -> 57
A24: 17 | B24: =RC[4]*20 -> 1300 | C24: 3 | D24: =200000*RC[2] -> 13000000 | E24: 8 | F24: =SUM(R7C[-1]:RC[-1]) -> 65
A25: 18 | B25: =RC[4]*20 -> 1460 | C25: 3 | D25: =200000*RC[2] -> 14600000 | E25: 8 | F25: =SUM(R7C[-1]:RC[-1]) -> 73
A26: 19 | B26: =RC[4]*20 -> 1640 | C26: 3 | D26: =200000*RC[2] -> 16400000 | E26: 9 | F26: =SUM(R7C[-1]:RC[-1]) -> 82
A27: 20 | B27: =RC[4]*20 -> 1820 | C27: 3 | D27: =200000*RC[2] -> 18200000 | E27: 9 | F27: =SUM(R7C[-1]:RC[-1]) -> 91

Sheet: Sheet1
A2: 宝物类型 | B2: 属性类型 | C2: 几率属性1 | D2: 几率属性2 | E2: 几率属性3 | F2: 几率属性4 | H2: 基础 | I2: 品质 | J2: 攻击 | K2: 血量 | L2: 几率属性
A3: 0 | B3: 1 | C3: 11 | D3: 13 | E3: 11 | F3: 13 | I3: 2 | J3: 180 | K3: 1800 | L3: 150
A4: 1 | B4: 4 | C4: 12 | D4: 14 | E4: 12 | F4: 14 | I4: 3 | J4: 300 | K4: 3000 | L4: 250
I5: 4 | J5: 480 | K5: 4800 | L5: 400
I6: 5 | J6: 720 | K6: 7200 | L6: 600
H8: 强化 | I8: 品质 | J8: 攻击 | K8: 血量 | L8: 几率属性
I9: 2 | J9: 10 | K9: 100 | L9: 15
I10: 3 | J10: 20 | K10: 200 | L10: 25
I11: 4 | J11: 35 | K11: 350 | L11: 40
I12: 5 | J12: 60 | K12: 600 | L12: 60
H14: 精炼 | I14: 品质 | J14: 攻击 | K14: 血量 | L14: 几率属性
I15: 2 | J15: 60 | K15: 600 | L15: 75
I16: 3 | J16: 100 | K16: 1000 | L16: 125
I17: 4 | J17: 180 | K17: 1800 | L17: 200
I18: 5 | J18: 300 | K18: 3000 | L18: 300