Sheet: 配置
A1: 服务端文件名 | B1: 服务端对应工作表号 | C1: 客户端文件名 | D1: 客户端对应工作表号 | E1: erl头部 | F1: erl内容格式 | G1: erl尾部 | H1: 客户端特殊处理
A2: config_crystal_shop_slot.txt | B2: 1 | F2: get(id) -> #$
A3: config_crystal_shop.txt | B3: 2 | C3: config_crystal_shop.cnf|CrystalShop | D3: 2 | F3: get(goods_id) -> #$ | H3: 2=>goods_id

Sheet: 商店槽位配置
A1: |slot | B1: |goods_list
A2: 不可空 | B2: 不可空
A3: 数字 | B3: 一维数组
B4: 不定长
A6: 商店槽位 | B6: 商品随机列表
A7: 1 | B7: 1001|1002|1003|1004|1005|1006|1007|1008|1009|1010|1011|1012|1013|1014|1015|1016|1017|1018|1019|1020|1021|1022|1023|1024|1025|1026|1027|1028|1029|1030|1031|1032|1033|1034
A8: 2 | B8: 2001|2002|2003|2004|2005|2006|2007|2008|2009|2010|2011|2012|2013|2014|2015|2016|2017|2018|2019|2020|2021|2022|2023|2024|2025|2026|2027|2028|2029|2030|2031|2032|2033|2034
A9: 3 | B9: 3001|3002|3003|3004|3005|3006|3007|3008|3009|3010|3011|3012|3013|3014|3015|3016|3017|3018|3019|3020|3021|3022|3023|3024|3025|3026
A10: 4 | B10: 4001|4002|4003|4004|4005|4006|4007|4008|4009|4010|4011|4012|4013|4014|4015|4016|4017|4018|4019|4020|4021|4022|4023|4024|4025|4026
A11: 5 | B11: 5001|5002|5003|5004|5005|5006|5007|5008|5009|5010|5011|5012|5013|5014|5015|5016|5017
A12: 6 | B12: 6001|6002|6003|6004|6005|6006|6007|6008|6009|6010|6011|6012|6013|6014|6015|6016|6017

Sheet: 商品
A1: goods_id|goods_id | B1: item_id|item_id | C1: item_num|item_num | D1: buy_num_max|buy_num_max | E1: need_role_level|need_role_level | F1: rate|rate | G1: cost_type_list|cost_type_list | H1: cost_value_list|cost_value_list | I1: is_recommend|
A2: 不可空 | B2: 不可空 | C2: 不可空 | D2: 不可空 | E2: 不可空 | F2: 不可空 | G2: 可空#不需字段 | H2: 可空#不需字段 | I2: 不可空
A3: 数字 | B3: 数字 | C3: 数字 | D3: 数字 | E3: 数字 | F3: 数字 | G3: 一维数组 | H3: 一维数组 | I3: 数字
G4: 不定长 | H4: 不定长
A6: 商品ID | B6: 物品ID | C6: 物品数量 | D6: 购买数量上限(0=表示无上限) | E6: 等级限制 | F6: 刷出概率 | G6: 消耗类型列表 | H6: 消耗值列表 | I6: 是否推荐 | K6: 折扣 | L6: 单价
A7: 1001 | B7: 13305 | C7: 1 | D7: 1 | E7: 1 | F7: 4 | G7: 5|33 | H7: =ROUND(RC[4]*RC[-5]*RC[3]/10,0)&"|"&ROUND(RC[4]*RC[-5]*RC[3]/10/5,0) -> 200|40 | I7: 0 | J7: 任选橙品符文（4折） | K7: 4 | L7: 500 | M7: =RC[-12] -> 1001
A8: 1002 | B8: 13306 | C8: 1 | D8: 1 | E8: 1 | F8: 4 | G8: 5|33 | H8: =ROUND(RC[4]*RC[-5]*RC[3]/10,0)&"|"&ROUND(RC[4]*RC[-5]*RC[3]/10/5,0) -> 200|40 | I8: 0 | J8: 任选橙品徽章（4折） | K8: 4 | L8: 500 | M8: =IF(INT(RC[-12]/1000)=INT(R[-1]C[-12]/1000),R[-1]C&"|"&RC[-12],RC[-12]) -> 1001|1002
A9: 1003 | B9: 10014 | C9: 25 | D9: 1 | E9: 1 | F9: 1 | G9: 5|33 | H9: =ROUND(RC[4]*RC[-5]*RC[3]/10,0)&"|"&ROUND(RC[4]*RC[-5]*RC[3]/10/5,0) -> 225|45 | I9: 0 | J9: 橙品精炼石（4.5折） | K9: 4.5 | L9: 20 | M9: =IF(INT(RC[-12]/1000)=INT(R[-1]C[-12]/1000),R[-1]C&"|"&RC[-12],RC[-12]) -> 1001|1002|1003
A10: 1004 | B10: 10014 | C10: 50 | D10: 1 | E10: 1 | F10: 1 | G10: 5|33 | H10: =ROUND(RC[4]*RC[-5]*RC[3]/10,0)&"|"&ROUND(RC[4]*RC[-5]*RC[3]/10/5,0) -> 450|90 | I10: 0 | J10: 橙品精炼石（4.5折） | K10: 4.5 | L10: 20 | M10: =IF(INT(RC[-12]/1000)=INT(R[-1]C[-12]/1000),R[-1]C&"|"&RC[-12],RC[-12]) -> 1001|1002|1003|1004
A11: 1005 | B11: 10014 | C11: 75 | D11: 1 | E11: 1 | F11: 1 | G11: 5|33 | H11: =ROUND(RC[4]*RC[-5]*RC[3]/10,0)&"|"&ROUND(RC[4]*RC[-5]*RC[3]/10/5,0) -> 675|135 | I11: 0 | J11: 橙品精炼石（4.5折） | K11: 4.5 | L11: 20 | M11: =IF(INT(RC[-12]/1000)=INT(R[-1]C[-12]/1000),R[-1]C&"|"&RC[-12],RC[-12]) -> 1001|1002|1003|1004|1005
A12: 1006 | B12: 10014 | C12: 100 | D12: 1 | E12: 1 | F12: 1 | G12: 5|33 | H12: =ROUND(RC[4]*RC[-5]*RC[3]/10,0)&"|"&ROUND(RC[4]*RC[-5]*RC[3]/10/5,0) -> 900|180 | I12: 0 | J12: 橙品精炼石（4.5折） | K12: 4.5 | L12: 20 | M12: =IF(INT(RC[-12]/1000)=INT(R[-1]C[-12]/1000),R[-1]C&"|"&RC[-12],RC[-12]) -> 1001|1002|1003|1004|1005|1006
A13: 1007 | B13: 10101 | C13: 5 | D13: 1 | E13: 30 | F13: 2 | G13: 5|33 | H13: =ROUND(RC[4]*RC[-5]*RC[3]/10,0)&"|"&ROUND(RC[4]*RC[-5]*RC[3]/10/5,0) -> 450|90 | I13: 0 | J13: 扭蛋币（4.5折） | K13: 4.5 | L13: 200 | M13: =IF(INT(RC[-12]/1000)=INT(R[-1]C[-12]/1000),R[-1]C&"|"&RC[-12],RC[-12]) -> 1001|1002|1003|1004|1005|1006|1007
A14: 1008 | B14: 10101 | C14: 10 | D14: 1 | E14: 30 | F14: 2 | G14: 5|33 | H14: =ROUND(RC[4]*RC[-5]*RC[3]/10,0)&"|"&ROUND(RC[4]*RC[-5]*RC[3]/10/5,0) -> 900|180 | I14: 0 | J14: 扭蛋币（4.5折） | K14: 4.5 | L14: 200 | M14: =IF(INT(RC[-12]/1000)=INT(R[-1]C[-12]/1000),R[-1]C&"|"&RC[-12],RC[-12]) -> 1001|1002|1003|1004|1005|1006|1007|1008
A15: 1009 | B15: 10010 | C15: 100 | D15: 1 | E15: 30 | F15: 1 | G15: 5|33 | H15: =ROUND(RC[4]*RC[-5]*RC[3]/10,0)&"|"&ROUND(RC[4]*RC[-5]*RC[3]/10/5,0) -> 225|45 | I15: 0 | J15: 圣器精炼石（4.5折） | K15: 4.5 | L15: 5 | M15: =IF(INT(RC[-12]/1000)=INT(R[-1]C[-12]/1000),R[-1]C&"|"&RC[-12],RC[-12]) -> 1001|1002|1003|1004|1005|1006|1007|1008|1009
A16: 1010 | B16: 10010 | C16: 200 | D16: 1 | E16: 30 | F16: 1 | G16: 5|33 | H16: =ROUND(RC[4]*RC[-5]*RC[3]/10,0)&"|"&ROUND(RC[4]*RC[-5]*RC[3]/10/5,0) -> 450|90 | I16: 0 | J16: 圣器精炼石（4.5折） | K16: 4.5 | L16: 5 | M16: =IF(INT(RC[-12]/1000)=INT(R[-1]C[-12]/1000),R[-1]C&"|"&RC[-12],RC[-12]) -> 1001|1002|1003|1004|1005|1006|1007|1008|1009|1010
A17: 1011 | B17: 10010 | C17: 300 | D17: 1 | E17: 30 | F17: 1 | G17: 5|33 | H17: =ROUND(RC[4]*RC[-5]*RC[3]/10,0)&"|"&ROUND(RC[4]*RC[-5]*RC[3]/10/5,0) -> 675|135 | I17: 0 | J17: 圣器精炼石（4.5折） | K17: 4.5 | L17: 5 | M17: =IF(INT(RC[-12]/1000)=INT(R[-1]C[-12]/1000),R[-1]C&"|"&RC[-12],RC[-12]) -> 1001|1002|1003|1004|1005|1006|1007|1008|1009|1010|1011
A18: 1012 | B18: 10010 | C18: 400 | D18: 1 | E18: 30 | F18: 1 | G18: 5|33 | H18: =ROUND(RC[4]*RC[-5]*RC[3]/10,0)&"|"&ROUND(RC[4]*RC[-5]*RC[3]/10/5,0) -> 900|180 | I18: 0 | J18: 圣器精炼石（4.5折） | K18: 4.5 | L18: 5 | M18: =IF(INT(RC[-12]/1000)=INT(R[-1]C[-12]/1000),R[-1]C&"|"&RC[-12],RC[-12]) -> 1001|1002|1003|1004|1005|1006|1007|1008|1009|1010|1011|1012
A19: 1013 | B19: 10008 | C19: 200 | D19: 1 | E19: 45 | F19: 1 | G19: 5|33 | H19: =ROUND(RC[4]*RC[-5]*RC[3]/10,0)&"|"&ROUND(RC[4]*RC[-5]*RC[3]/10/5,0) -> 225|45 | I19: 0 | J19: 觉醒水晶（4.5折） | K19: 4.5 | L19: 2.5 | M19: =IF(INT(RC[-12]/1000)=INT(R[-1]C[-12]/1000),R[-1]C&"|"&RC[-12],RC[-12]) -> 1001|1002|1003|1004|1005|1006|1007|1008|1009|1010|1011|1012|1013
A20: 1014 | B20: 10008 | C20: 400 | D20: 1 | E20: 45 | F20: 1 | G20: 5|33 | H20: =ROUND(RC[4]*RC[-5]*RC[3]/10,0)&"|"&ROUND(RC[4]*RC[-5]*RC[3]/10/5,0) -> 450|90 | I20: 0 | J20: 觉醒水晶（4.5折） | K20: 4.5 | L20: 2.5 | M20: =IF(INT(RC[-12]/1000)=INT(R[-1]C[-12]/1000),R[-1]C&"|"&RC[-12],RC[-12]) -> 1001|1002|1003|1004|1005|1006|1007|1008|1009|1010|1011|1012|1013|1014
A21: 1015 | B21: 10008 | C21: 600 | D21: 1 | E21: 45 | F21: 1 | G21: 5|33 | H21: =ROUND(RC[4]*RC[-5]*RC[3]/10,0)&"|"&ROUND(RC[4]*RC[-5]*RC[3]/10/5,0) -> 675|135 | I21: 0 | J21: 觉醒水晶（4.5折） | K21: 4.5 | L21: 2.5 | M21: =IF(INT(RC[-12]/1000)=INT(R[-1]C[-12]/1000),R[-1]C&"|"&RC[-12],RC[-12]) -> 1001|1002|1003|1004|1005|1006|1007|1008|1009|1010|1011|1012|1013|1014|1015
A22: 1016 | B22: 10008 | C22: 800 | D22: 1 | E22: 45 | F22: 1 | G22: 5|33 | H22: =ROUND(RC[4]*RC[-5]*RC[3]/10,0)&"|"&ROUND(RC[4]*RC[-5]*RC[3]/10/5,0) -> 900|180 | I22: 0 | J22: 觉醒水晶（4.5折） | K22: 4.5 | L22: 2.5 | M22: =IF(INT(RC[-12]/1000)=INT(R[-1]C[-12]/1000),R[-1]C&"|"&RC[-12],RC[-12]) -> 1001|1002|1003|1004|1005|1006|1007|1008|1009|1010|1011|1012|1013|1014|1015|1016
A23: 1017 | B23: 13017 | C23: 3 | D23: 1 | E23: 45 | F23: 2 | G23: 5|33 | H23: =ROUND(RC[4]*RC[-5]*RC[3]/10,0)&"|"&ROUND(RC[4]*RC[-5]*RC[3]/10/5,0) -> 275|55 | I23: 0 | J23: 闪光的觉醒箱（4.5折） | K23: 4.5 | L23: 204 | M23: =IF(INT(RC[-12]/1000)=INT(R[-1]C[-12]/1000),R[-1]C&"|"&RC[-12],RC[-12]) -> 1001|1002|1003|1004|1005|1006|1007|1008|1009|1010|1011|1012|1013|1014|1015|1016|1017
A24: 1018 | B24: 13017 | C24: 5 | D24: 1 | E24: 45 | F24: 2 | G24: 5|33 | H24: =ROUND(RC[4]*RC[-5]*RC[3]/10,0)&"|"&ROUND(RC[4]*RC[-5]*RC[3]/10/5,0) -> 459|92 | I24: 0 | J24: 闪光的觉醒箱（4.5折） | K24: 4.5 | L24: 204 | M24: =IF(INT(RC[-12]/1000)=INT(R[-1]C[-12]/1000),R[-1]C&"|"&RC[-12],RC[-12]) -> 1001|1002|1003|1004|1005|1006|1007|1008|1009|1010|1011|1012|1013|1014|1015|1016|1017|1018
A25: 1019 | B25: 10096 | C25: 5 | D25: 1 | E25: 50 | F25: 2 | G25: 5|33 | H25: =ROUND(RC[4]*RC[-5]*RC[3]/10,0)&"|"&ROUND(RC[4]*RC[-5]*RC[3]/10/5,0) -> 450|90 | I25: 0 | J25: 占星水晶（4.5折） | K25: 4.5 | L25: 200 | M25: =IF(INT(RC[-12]/1000)=INT(R[-1]C[-12]/1000),R[-1]C&"|"&RC[-12],RC[-12]) -> 1001|1002|1003|1004|1005|1006|1007|1008|1009|1010|1011|1012|1013|1014|1015|1016|1017|1018|1019
A26: 1020 | B26: 10096 | C26: 10 | D26: 1 | E26: 50 | F26: 2 | G26: 5|33 | H26: =ROUND(RC[4]*RC[-5]*RC[3]/10,0)&"|"&ROUND(RC[4]*RC[-5]*RC[3]/10/5,0) -> 900|180 | I26: 0 | J26: 占星水晶（4.5折） | K26: 4.5 | L26: 200 | M26: =IF(INT(RC[-12]/1000)=INT(R[-1]C[-12]/1000),R[-1]C&"|"&RC[-12],RC[-12]) -> 1001|1002|1003|1004|1005|1006|1007|1008|1009|1010|1011|1012|1013|1014|1015|1016|1017|1018|1019|1020
A27: 1021 | B27: 10009 | C27: 10 | D27: 1 | E27: 50 | F27: 1 | G27: 5|33 | H27: =ROUND(RC[4]*RC[-5]*RC[3]/10,0)&"|"&ROUND(RC[4]*RC[-5]*RC[3]/10/5,0) -> 200|40 | I27: 0 | J27: 预言星徽（4折） | K27: 4 | L27: 50 | M27: =IF(INT(RC[-12]/1000)=INT(R[-1]C[-12]/1000),R[-1]C&"|"&RC[-12],RC[-12]) -> 1001|1002|1003|1004|1005|1006|1007|1008|1009|1010|1011|1012|1013|1014|1015|1016|1017|1018|1019|1020|1021
A28: 1022 | B28: 10009 | C28: 20 | D28: 1 | E28: 50 | F28: 1 | G28: 5|33 | H28: =ROUND(RC[4]*RC[-5]*RC[3]/10,0)&"|"&ROUND(RC[4]*RC[-5]*RC[3]/10/5,0) -> 400|80 | I28: 0 | J28: 预言星徽（4折） | K28: 4 | L28: 50 | M28: =IF(INT(RC[-12]/1000)=INT(R[-1]C[-12]/1000),R[-1]C&"|"&RC[-12],RC[-12]) -> 1001|1002|1003|1004|1005|1006|1007|1008|1009|1010|1011|1012|1013|1014|1015|1016|1017|1018|1019|1020|1021|1022
A29: 1023 | B29: 10009 | C29: 30 | D29: 1 | E29: 50 | F29: 1 | G29: 5|33 | H29: =ROUND(RC[4]*RC[-5]*RC[3]/10,0)&"|"&ROUND(RC[4]*RC[-5]*RC[3]/10/5,0) -> 600|120 | I29: 0 | J29: 预言星徽（4折） | K29: 4 | L29: 50 | M29: =IF(INT(RC[-12]/1000)=INT(R[-1]C[-12]/1000),R[-1]C&"|"&RC[-12],RC[-12]) -> 1001|1002|1003|1004|1005|1006|1007|1008|1009|1010|1011|1012|1013|1014|1015|1016|1017|1018|1019|1020|1021|1022|1023
A30: 1024 | B30: 10009 | C30: 40 | D30: 1 | E30: 50 | F30: 1 | G30: 5|33 | H30: =ROUND(RC[4]*RC[-5]*RC[3]/10,0)&"|"&ROUND(RC[4]*RC[-5]*RC[3]/10/5,0) -> 800|160 | I30: 0 | J30: 预言星徽（4折） | K30: 4 | L30: 50 | M30: =IF(INT(RC[-12]/1000)=INT(R[-1]C[-12]/1000),R[-1]C&"|"&RC[-12],RC[-12]) -> 1001|1002|1003|1004|1005|1006|1007|1008|1009|1010|1011|1012|1013|1014|1015|1016|1017|1018|1019|1020|1021|1022|1023|1024
A31: 1025 | B31: 10116 | C31: 20 | D31: 1 | E31: 48 | F31: 2 | G31: 5|33 | H31: =ROUND(RC[4]*RC[-5]*RC[3]/10,0)&"|"&ROUND(RC[4]*RC[-5]*RC[3]/10/5,0) -> 550|110 | I31: 0 | J31: 装备改造石（橙）（5折） | K31: 5 | L31: 55 | M31: =IF(INT(RC[-12]/1000)=INT(R[-1]C[-12]/1000),R[-1]C&"|"&RC[-12],RC[-12]) -> 1001|1002|1003|1004|1005|1006|1007|1008|1009|1010|1011|1012|1013|1014|1015|1016|1017|1018|1019|1020|1021|1022|1023|1024|1025
A32: 1026 | B32: 10116 | C32: 40 | D32: 1 | E32: 48 | F32: 2 | G32: 5|33 | H32: =ROUND(RC[4]*RC[-5]*RC[3]/10,0)&"|"&ROUND(RC[4]*RC[-5]*RC[3]/10/5,0) -> 1100|220 | I32: 0 | J32: 装备改造石（橙）（5折） | K32: 5 | L32: 55 | M32: =IF(INT(RC[-12]/1000)=INT(R[-1]C[-12]/1000),R[-1]C&"|"&RC[-12],RC[-12]) -> 1001|1002|1003|1004|1005|1006|1007|1008|1009|1010|1011|1012|1013|1014|1015|1016|1017|1018|1019|1020|1021|1022|1023|1024|1025|1026
A33: 1027 | B33: 10116 | C33: 60 | D33: 1 | E33: 48 | F33: 2 | G33: 5|33 | H33: =ROUND(RC[4]*RC[-5]*RC[3]/10,0)&"|"&ROUND(RC[4]*RC[-5]*RC[3]/10/5,0) -> 1650|330 | I33: 0 | J33: 装备改造石（橙）（5折） | K33: 5 | L33: 55 | M33: =IF(INT(RC[-12]/1000)=INT(R[-1]C[-12]/1000),R[-1]C&"|"&RC[-12],RC[-12]) -> 1001|1002|1003|1004|1005|1006|1007|1008|1009|1010|1011|1012|1013|1014|1015|1016|1017|1018|1019|1020|1021|1022|1023|1024|1025|1026|1027
A34: 1028 | B34: 10116 | C34: 80 | D34: 1 | E34: 48 | F34: 2 | G34: 5|33 | H34: =ROUND(RC[4]*RC[-5]*RC[3]/10,0)&"|"&ROUND(RC[4]*RC[-5]*RC[3]/10/5,0) -> 2200|440 | I34: 0 | J34: 装备改造石（橙）（5折） | K34: 5 | L34: 55 | M34: =IF(INT(RC[-12]/1000)=INT(R[-1]C[-12]/1000),R[-1]C&"|"&RC[-12],RC[-12]) -> 1001|1002|1003|1004|1005|1006|1007|1008|1009|1010|1011|1012|1013|1014|1015|1016|1017|1018|1019|1020|1021|1022|1023|1024|1025|1026|1027|1028
A35: 1029 | B35: 10116 | C35: 100 | D35: 1 | E35: 48 | F35: 2 | G35: 5|33 | H35: =ROUND(RC[4]*RC[-5]*RC[3]/10,0)&"|"&ROUND(RC[4]*RC[-5]*RC[3]/10/5,0) -> 2750|550 | I35: 0 | J35: 装备改造石（橙）（5折） | K35: 5 | L35: 55 | M35: =IF(INT(RC[-12]/1000)=INT(R[-1]C[-12]/1000),R[-1]C&"|"&RC[-12],RC[-12]) -> 1001|1002|1003|1004|1005|1006|1007|1008|1009|1010|1011|1012|1013|1014|1015|1016|1017|1018|1019|1020|1021|1022|1023|1024|1025|1026|1027|1028|1029
A36: 1030 | B36: 10117 | C36: 25 | D36: 1 | E36: 58 | F36: 2 | G36: 5|33 | H36: =ROUND(RC[4]*RC[-5]*RC[3]/10,0)&"|"&ROUND(RC[4]*RC[-5]*RC[3]/10/5,0) -> 938|188 | I36: 0 | J36: 装备改造石（红）（5折） | K36: 5 | L36: 75 | M36: =IF(INT(RC[-12]/1000)=INT(R[-1]C[-12]/1000),R[-1]C&"|"&RC[-12],RC[-12]) -> 1001|1002|1003|1004|1005|1006|1007|1008|1009|1010|1011|1012|1013|1014|1015|1016|1017|1018|1019|1020|1021|1022|1023|1024|1025|1026|1027|1028|1029|1030
A37: 1031 | B37: 10117 | C37: 50 | D37: 1 | E37: 58 | F37: 2 | G37: 5|33 | H37: =ROUND(RC[4]*RC[-5]*RC[3]/10,0)&"|"&ROUND(RC[4]*RC[-5]*RC[3]/10/5,0) -> 1875|375 | I37: 0 | J37: 装备改造石（红）（5折） | K37: 5 | L37: 75 | M37: =IF(INT(RC[-12]/1000)=INT(R[-1]C[-12]/1000),R[-1]C&"|"&RC[-12],RC[-12]) -> 1001|1002|1003|1004|1005|1006|1007|1008|1009|1010|1011|1012|1013|1014|1015|1016|1017|1018|1019|1020|1021|1022|1023|1024|1025|1026|1027|1028|1029|1030|1031
A38: 1032 | B38: 10117 | C38: 75 | D38: 1 | E38: 58 | F38: 2 | G38: 5|33 | H38: =ROUND(RC[4]*RC[-5]*RC[3]/10,0)&"|"&ROUND(RC[4]*RC[-5]*RC[3]/10/5,0) -> 2813|563 | I38: 0 | J38: 装备改造石（红）（5折） | K38: 5 | L38: 75 | M38: =IF(INT(RC[-12]/1000)=INT(R[-1]C[-12]/1000),R[-1]C&"|"&RC[-12],RC[-12]) -> 1001|1002|1003|1004|1005|1006|1007|1008|1009|1010|1011|1012|1013|1014|1015|1016|1017|1018|1019|1020|1021|1022|1023|1024|1025|1026|1027|1028|1029|1030|1031|1032
A39: 1033 | B39: 10117 | C39: 100 | D39: 1 | E39: 58 | F39: 2 | G39: 5|33 | H39: =ROUND(RC[4]*RC[-5]*RC[3]/10,0)&"|"&ROUND(RC[4]*RC[-5]*RC[3]/10/5,0) -> 3750|750 | I39: 0 | J39: 装备改造石（红）（5折） | K39: 5 | L39: 75 | M39: =IF(INT(RC[-12]/1000)=INT(R[-1]C[-12]/1000),R[-1]C&"|"&RC[-12],RC[-12]) -> 1001|1002|1003|1004|1005|1006|1007|1008|1009|1010|1011|1012|1013|1014|1015|1016|1017|1018|1019|1020|1021|1022|1023|1024|1025|1026|1027|1028|1029|1030|1031|1032|1033
A40: 1034 | B40: 10117 | C40: 125 | D40: 1 | E40: 58 | F40: 2 | G40: 5|33 | H40: =ROUND(RC[4]*RC[-5]*RC[3]/10,0)&"|"&ROUND(RC[4]*RC[-5]*RC[3]/10/5,0) -> 4688|938 | I40: 0 | J40: 装备改造石（红）（5折） | K40: 5 | L40: 75 | M40: =IF(INT(RC[-12]/1000)=INT(R[-1]C[-12]/1000),R[-1]C&"|"&RC[-12],RC[-12]) -> 1001|1002|1003|1004|1005|1006|1007|1008|1009|1010|1011|1012|1013|1014|1015|1016|1017|1018|1019|1020|1021|1022|1023|1024|1025|1026|1027|1028|1029|1030|1031|1032|1033|1034
A41: 2001 | B41: 13305 | C41: 1 | D41: 1 | E41: 1 | F41: 4 | G41: 5|33 | H41: =ROUND(RC[4]*RC[-5]*RC[3]/10,0)&"|"&ROUND(RC[4]*RC[-5]*RC[3]/10/5,0) -> 200|40 | I41: 0 | J41: 任选橙品符文（4折） | K41: 4 | L41: 500 | M41: =IF(INT(RC[-12]/1000)=INT(R[-11]C[-12]/1000),R[-11]C&"|"&RC[-12],RC[-12]) -> 2001
A42: 2002 | B42: 13306 | C42: 1 | D42: 1 | E42: 1 | F42: 4 | G42: 5|33 | H42: =ROUND(RC[4]*RC[-5]*RC[3]/10,0)&"|"&ROUND(RC[4]*RC[-5]*RC[3]/10/5,0) -> 200|40 | I42: 0 | J42: 任选橙品徽章（4折） | K42: 4 | L42: 500 | M42: =IF(INT(RC[-12]/1000)=INT(R[-1]C[-12]/1000),R[-1]C&"|"&RC[-12],RC[-12]) -> 2001|2002
A43: 2003 | B43: 10014 | C43: 25 | D43: 1 | E43: 1 | F43: 1 | G43: 5|33 | H43: =ROUND(RC[4]*RC[-5]*RC[3]/10,0)&"|"&ROUND(RC[4]*RC[-5]*RC[3]/10/5,0) -> 225|45 | I43: 0 | J43: 橙品精炼石（4.5折） | K43: 4.5 | L43: 20 | M43: =IF(INT(RC[-12]/1000)=INT(R[-1]C[-12]/1000),R[-1]C&"|"&RC[-12],RC[-12]) -> 2001|2002|2003
A44: 2004 | B44: 10014 | C44: 50 | D44: 1 | E44: 1 | F44: 1 | G44: 5|33 | H44: =ROUND(RC[4]*RC[-5]*RC[3]/10,0)&"|"&ROUND(RC[4]*RC[-5]*RC[3]/10/5,0) -> 450|90 | I44: 0 | J44: 橙品精炼石（4.5折） | K44: 4.5 | L44: 20 | M44: =IF(INT(RC[-12]/1000)=INT(R[-1]C[-12]/1000),R[-1]C&"|"&RC[-12],RC[-12]) -> 2001|2002|2003|2004
A45: 2005 | B45: 10014 | C45: 75 | D45: 1 | E45: 1 | F45: 1 | G45: 5|33 | H45: =ROUND(RC[4]*RC[-5]*RC[3]/10,0)&"|"&ROUND(RC[4]*RC[-5]*RC[3]/10/5,0) -> 675|135 | I45: 0 | J45: 橙品精炼石（4.5折） | K45: 4.5 | L45: 20 | M45: =IF(INT(RC[-12]/1000)=INT(R[-1]C[-12]/1000),R[-1]C&"|"&RC[-12],RC[-12]) -> 2001|2002|2003|2004|2005
A46: 2006 | B46: 10014 | C46: 100 | D46: 1 | E46: 1 | F46: 1 | G46: 5|33 | H46: =ROUND(RC[4]*RC[-5]*RC[3]/10,0)&"|"&ROUND(RC[4]*RC[-5]*RC[3]/10/5,0) -> 900|180 | I46: 0 | J46: 橙品精炼石（4.5折） | K46: 4.5 | L46: 20 | M46: =IF(INT(RC[-12]/1000)=INT(R[-1]C[-12]/1000),R[-1]C&"|"&RC[-12],RC[-12]) -> 2001|2002|2003|2004|2005|2006
A47: 2007 | B47: 10101 | C47: 5 | D47: 1 | E47: 30 | F47: 2 | G47: 5|33 | H47: =ROUND(RC[4]*RC[-5]*RC[3]/10,0)&"|"&ROUND(RC[4]*RC[-5]*RC[3]/10/5,0) -> 450|90 | I47: 0 | J47: 扭蛋币（4.5折） | K47: 4.5 | L47: 200 | M47: =IF(INT(RC[-12]/1000)=INT(R[-1]C[-12]/1000),R[-1]C&"|"&RC[-12],RC[-12]) -> 2001|2002|2003|2004|2005|2006|2007
A48: 2008 | B48: 10101 | C48: 10 | D48: 1 | E48: 30 | F48: 2 | G48: 5|33 | H48: =ROUND(RC[4]*RC[-5]*RC[3]/10,0)&"|"&ROUND(RC[4]*RC[-5]*RC[3]/10/5,0) -> 900|180 | I48: 0 | J48: 扭蛋币（4.5折） | K48: 4.5 | L48: 200 | M48: =IF(INT(RC[-12]/1000)=INT(R[-1]C[-12]/1000),R[-1]C&"|"&RC[-12],RC[-12]) -> 2001|2002|2003|2004|2005|2006|2007|2008
A49: 2009 | B49: 10010 | C49: 100 | D49: 1 | E49: 30 | F49: 1 | G49: 5|33 | H49: =ROUND(RC[4]*RC[-5]*RC[3]/10,0)&"|"&ROUND(RC[4]*RC[-5]*RC[3]/10/5,0) -> 225|45 | I49: 0 | J49: 圣器精炼石（4.5折） | K49: 4.5 | L49: 5 | M49: =IF(INT(RC[-12]/1000)=INT(R[-1]C[-12]/1000),R[-1]C&"|"&RC[-12],RC[-12]) -> 2001|2002|2003|2004|2005|2006|2007|2008|2009
A50: 2010 | B50: 10010 | C50: 200 | D50: 1 | E50: 30 | F50: 1 | G50: 5|33 | H50: =ROUND(RC[4]*RC[-5]*RC[3]/10,0)&"|"&ROUND(RC[4]*RC[-5]*RC[3]/10/5,0) -> 450|90 | I50: 0 | J50: 圣器精炼石（4.5折） | K50: 4.5 | L50: 5 | M50: =IF(INT(RC[-12]/1000)=INT(R[-1]C[-12]/1000),R[-1]C&"|"&RC[-12],RC[-12]) -> 2001|2002|2003|2004|2005|2006|2007|2008|2009|2010
A51: 2011 | B51: 10010 | C51: 300 | D51: 1 | E51: 30 | F51: 1 | G51: 5|33 | H51: =ROUND(RC[4]*RC[-5]*RC[3]/10,0)&"|"&ROUND(RC[4]*RC[-5]*RC[3]/10/5,0) -> 675|135 | I51: 0 | J51: 圣器精炼石（4.5折） | K51: 4.5 | L51: 5 | M51: =IF(INT(RC[-12]/1000)=INT(R[-1]C[-12]/1000),R[-1]C&"|"&RC[-12],RC[-12]) -> 2001|2002|2003|2004|2005|2006|2007|2008|2009|2010|2011
A52: 2012 | B52: 10010 | C52: 400 | D52: 1 | E52: 30 | F52: 1 | G52: 5|33 | H52: =ROUND(RC[4]*RC[-5]*RC[3]/10,0)&"|"&ROUND(RC[4]*RC[-5]*RC[3]/10/5,0) -> 900|180 | I52: 0 | J52: 圣器精炼石（4.5折） | K52: 4.5 | L52: 5 | M52: =IF(INT(RC[-12]/1000)=INT(R[-1]C[-12]/1000),R[-1]C&"|"&RC[-12],RC[-12]) -> 2001|2002|2003|2004|2005|2006|2007|2008|2009|2010|2011|2012
A53: 2013 | B53: 10008 | C53: 200 | D53: 1 | E53: 45 | F53: 1 | G53: 5|33 | H53: =ROUND(RC[4]*RC[-5]*RC[3]/10,0)&"|"&ROUND(RC[4]*RC[-5]*RC[3]/10/5,0) -> 225|45 | I53: 0 | J53: 觉醒水晶（4.5折） | K53: 4.5 | L53: 2.5 | M53: =IF(INT(RC[-12]/1000)=INT(R[-1]C[-12]/1000),R[-1]C&"|"&RC[-12],RC[-12]) -> 2001|2002|2003|2004|2005|2006|2007|2008|2009|2010|2011|2012|2013
A54: 2014 | B54: 10008 | C54: 400 | D54: 1 | E54: 45 | F54: 1 | G54: 5|33 | H54: =ROUND(RC[4]*RC[-5]*RC[3]/10,0)&"|"&ROUND(RC[4]*RC[-5]*RC[3]/10/5,0) -> 450|90 | I54: 0 | J54: 觉醒水晶（4.5折） | K54: 4.5 | L54: 2.5 | M54: =IF(INT(RC[-12]/1000)=INT(R[-1]C[-12]/1000),R[-1]C&"|"&RC[-12],RC[-12]) -> 2001|2002|2003|2004|2005|2006|2007|2008|2009|2010|2011|2012|2013|2014
A55: 2015 | B55: 10008 | C55: 600 | D55: 1 | E55: 45 | F55: 1 | G55: 5|33 | H55: =ROUND(RC[4]*RC[-5]*RC[3]/10,0)&"|"&ROUND(RC[4]*RC[-5]*RC[3]/10/5,0) -> 675|135 | I55: 0 | J55: 觉醒水晶（4.5折） | K55: 4.5 | L55: 2.5 | M55: =IF(INT(RC[-12]/1000)=INT(R[-1]C[-12]/1000),R[-1]C&"|"&RC[-12],RC[-12]) -> 2001|2002|2003|2004|2005|2006|2007|2008|2009|2010|2011|2012|2013|2014|2015
A56: 2016 | B56: 10008 | C56: 800 | D56: 1 | E56: 45 | F56: 1 | G56: 5|33 | H56: =ROUND(RC[4]*RC[-5]*RC[3]/10,0)&"|"&ROUND(RC[4]*RC[-5]*RC[3]/10/5,0) -> 900|180 | I56: 0 | J56: 觉醒水晶（4.5折） | K56: 4.5 | L56: 2.5 | M56: =IF(INT(RC[-12]/1000)=INT(R[-1]C[-12]/1000),R[-1]C&"|"&RC[-12],RC[-12]) -> 2001|2002|2003|2004|2005|2006|2007|2008|2009|2010|2011|2012|2013|2014|2015|2016
A57: 2017 | B57: 13017 | C57: 3 | D57: 1 | E57: 45 | F57: 2 | G57: 5|33 | H57: =ROUND(RC[4]*RC[-5]*RC[3]/10,0)&"|"&ROUND(RC[4]*RC[-5]*RC[3]/10/5,0) -> 275|55 | I57: 0 | J57: 闪光的觉醒箱（4.5折） | K57: 4.5 | L57: 204 | M57: =IF(INT(RC[-12]/1000)=INT(R[-1]C[-12]/1000),R[-1]C&"|"&RC[-12],RC[-12]) -> 2001|2002|2003|2004|2005|2006|2007|2008|2009|2010|2011|2012|2013|2014|2015|2016|2017
A58: 2018 | B58: 13017 | C58: 5 | D58: 1 | E58: 45 | F58: 2 | G58: 5|33 | H58: =ROUND(RC[4]*RC[-5]*RC[3]/10,0)&"|"&ROUND(RC[4]*RC[-5]*RC[3]/10/5,0) -> 459|92 | I58: 0 | J58: 闪光的觉醒箱（4.5折） | K58: 4.5 | L58: 204 | M58: =IF(INT(RC[-12]/1000)=INT(R[-1]C[-12]/1000),R[-1]C&"|"&RC[-12],RC[-12]) -> 2001|2002|2003|2004|2005|2006|2007|2008|2009|2010|2011|2012|2013|2014|2015|2016|2017|2018
A59: 2019 | B59: 10096 | C59: 5 | D59: 1 | E59: 50 | F59: 2 | G59: 5|33 | H59: =ROUND(RC[4]*RC[-5]*RC[3]/10,0)&"|"&ROUND(RC[4]*RC[-5]*RC[3]/10/5,0) -> 450|90 | I59: 0 | J59: 占星水晶（4.5折） | K59: 4.5 | L59: 200 | M59: =IF(INT(RC[-12]/1000)=INT(R[-1]C[-12]/1000),R[-1]C&"|"&RC[-12],RC[-12]) -> 2001|2002|2003|2004|2005|2006|2007|2008|2009|2010|2011|2012|2013|2014|2015|2016|2017|2018|2019
A60: 2020 | B60: 10096 | C60: 10 | D60: 1 | E60: 50 | F60: 2 | G60: 5|33 | H60: =ROUND(RC[4]*RC[-5]*RC[3]/10,0)&"|"&ROUND(RC[4]*RC[-5]*RC[3]/10/5,0) -> 900|180 | I60: 0 | J60: 占星水晶（4.5折） | K60: 4.5 | L60: 200 | M60: =IF(INT(RC[-12]/1000)=INT(R[-1]C[-12]/1000),R[-1]C&"|"&RC[-12],RC[-12]) -> 2001|2002|2003|2004|2005|2006|2007|2008|2009|2010|2011|2012|2013|2014|2015|2016|2017|2018|2019|2020
A61: 2021 | B61: 10009 | C61: 10 | D61: 1 | E61: 50 | F61: 1 | G61: 5|33 | H61: =ROUND(RC[4]*RC[-5]*RC[3]/10,0)&"|"&ROUND(RC[4]*RC[-5]*RC[3]/10/5,0) -> 200|40 | I61: 0 | J61: 预言星徽（4折） | K61: 4 | L61: 50 | M61: =IF(INT(RC[-12]/1000)=INT(R[-1]C[-12]/1000),R[-1]C&"|"&RC[-12],RC[-12]) -> 2001|2002|2003|2004|2005|2006|2007|2008|2009|2010|2011|2012|2013|2014|2015|2016|2017|2018|2019|2020|2021
A62: 2022 | B62: 10009 | C62: 20 | D62: 1 | E62: 50 | F62: 1 | G62: 5|33 | H62: =ROUND(RC[4]*RC[-5]*RC[3]/10,0)&"|"&ROUND(RC[4]*RC[-5]*RC[3]/10/5,0) -> 400|80 | I62: 0 | J62: 预言星徽（4折） | K62: 4 | L62: 50 | M62: =IF(INT(RC[-12]/1000)=INT(R[-1]C[-12]/1000),R[-1]C&"|"&RC[-12],RC[-12]) -> 2001|2002|2003|2004|2005|2006|2007|2008|2009|2010|2011|2012|2013|2014|2015|2016|2017|2018|2019|2020|2021|2022
A63: 2023 | B63: 10009 | C63: 30 | D63: 1 | E63: 50 | F63: 1 | G63: 5|33 | H63: =ROUND(RC[4]*RC[-5]*RC[3]/10,0)&"|"&ROUND(RC[4]*RC[-5]*RC[3]/10/5,0) -> 600|120 | I63: 0 | J63: 预言星徽（4折） | K63: 4 | L63: 50 | M63: =IF(INT(RC[-12]/1000)=INT(R[-1]C[-12]/1000),R[-1]C&"|"&RC[-12],RC[-12]) -> 2001|2002|2003|2004|2005|2006|2007|2008|2009|2010|2011|2012|2013|2014|2015|2016|2017|2018|2019|2020|2021|2022|2023
A64: 2024 | B64: 10009 | C64: 40 | D64: 1 | E64: 50 | F64: 1 | G64: 5|33 | H64: =ROUND(RC[4]*RC[-5]*RC[3]/10,0)&"|"&ROUND(RC[4]*RC[-5]*RC[3]/10/5,0) -> 800|160 | I64: 0 | J64: 预言星徽（4折） | K64: 4 | L64: 50 | M64: =IF(INT(RC[-12]/1000)=INT(R[-1]C[-12]/1000),R[-1]C&"|"&RC[-12],RC[-12]) -> 2001|2002|2003|2004|2005|2006|2007|2008|2009|2010|2011|2012|2013|2014|2015|2016|2017|2018|2019|2020|2021|2022|2023|2024
A65: 2025 | B65: 10116 | C65: 20 | D65: 1 | E65: 48 | F65: 2 | G65: 5|33 | H65: =ROUND(RC[4]*RC[-5]*RC[3]/10,0)&"|"&ROUND(RC[4]*RC[-5]*RC[3]/10/5,0) -> 550|110 | I65: 0 | J65: 装备改造石（橙）（5折） | K65: 5 | L65: 55 | M65: =IF(INT(RC[-12]/1000)=INT(R[-1]C[-12]/1000),R[-1]C&"|"&RC[-12],RC[-12]) -> 2001|2002|2003|2004|2005|2006|2007|2008|2009|2010|2011|2012|2013|2014|2015|2016|2017|2018|2019|2020|2021|2022|2023|2024|2025
A66: 2026 | B66: 10116 | C66: 40 | D66: 1 | E66: 48 | F66: 2 | G66: 5|33 | H66: =ROUND(RC[4]*RC[-5]*RC[3]/10,0)&"|"&ROUND(RC[4]*RC[-5]*RC[3]/10/5,0) -> 1100|220 | I66: 0 | J66: 装备改造石（橙）（5折） | K66: 5 | L66: 55 | M66: =IF(INT(RC[-12]/1000)=INT(R[-1]C[-12]/1000),R[-1]C&"|"&RC[-12],RC[-12]) -> 2001|2002|2003|2004|2005|2006|2007|2008|2009|2010|2011|2012|2013|2014|2015|2016|2017|2018|2019|2020|2021|2022|2023|2024|2025|2026
A67: 2027 | B67: 10116 | C67: 60 | D67: 1 | E67: 48 | F67: 2 | G67: 5|33 | H67: =ROUND(RC[4]*RC[-5]*RC[3]/10,0)&"|"&ROUND(RC[4]*RC[-5]*RC[3]/10/5,0) -> 1650|330 | I67: 0 | J67: 装备改造石（橙）（5折） | K67: 5 | L67: 55 | M67: =IF(INT(RC[-12]/1000)=INT(R[-1]C[-12]/1000),R[-1]C&"|"&RC[-12],RC[-12]) -> 2001|2002|2003|2004|2005|2006|2007|2008|2009|2010|2011|2012|2013|2014|2015|2016|2017|2018|2019|2020|2021|2022|2023|2024|2025|2026|2027
A68: 2028 | B68: 10116 | C68: 80 | D68: 1 | E68: 48 | F68: 2 | G68: 5|33 | H68: =ROUND(RC[4]*RC[-5]*RC[3]/10,0)&"|"&ROUND(RC[4]*RC[-5]*RC[3]/10/5,0) -> 2200|440 | I68: 0 | J68: 装备改造石（橙）（5折） | K68: 5 | L68: 55 | M68: =IF(INT(RC[-12]/1000)=INT(R[-1]C[-12]/1000),R[-1]C&"|"&RC[-12],RC[-12]) -> 2001|2002|2003|2004|2005|2006|2007|2008|2009|2010|2011|2012|2013|2014|2015|2016|2017|2018|2019|2020|2021|2022|2023|2024|2025|2026|2027|2028
A69: 2029 | B69: 10116 | C69: 100 | D69: 1 | E69: 48 | F69: 2 | G69: 5|33 | H69: =ROUND(RC[4]*RC[-5]*RC[3]/10,0)&"|"&ROUND(RC[4]*RC[-5]*RC[3]/10/5,0) -> 2750|550 | I69: 0 | J69: 装备改造石（橙）（5折） | K69: 5 | L69: 55 | M69: =IF(INT(RC[-12]/1000)=INT(R[-1]C[-12]/1000),R[-1]C&"|"&RC[-12],RC[-12]) -> 2001|2002|2003|2004|2005|2006|2007|2008|2009|2010|2011|2012|2013|2014|2015|2016|2017|2018|2019|2020|2021|2022|2023|2024|2025|2026|2027|2028|2029
A70: 2030 | B70: 10117 | C70: 25 | D70: 1 | E70: 58 | F70: 2 | G70: 5|33 | H70: =ROUND(RC[4]*RC[-5]*RC[3]/10,0)&"|"&ROUND(RC[4]*RC[-5]*RC[3]/10/5,0) -> 938|188 | I70: 0 | J70: 装备改造石（红）（5折） | K70: 5 | L70: 75 | M70: =IF(INT(RC[-12]/1000)=INT(R[-1]C[-12]/1000),R[-1]C&"|"&RC[-12],RC[-12]) -> 2001|2002|2003|2004|2005|2006|2007|2008|2009|2010|2011|2012|2013|2014|2015|2016|2017|2018|2019|2020|2021|2022|2023|2024|2025|2026|2027|2028|2029|2030
A71: 2031 | B71: 10117 | C71: 50 | D71: 1 | E71: 58 | F71: 2 | G71: 5|33 | H71: =ROUND(RC[4]*RC[-5]*RC[3]/10,0)&"|"&ROUND(RC[4]*RC[-5]*RC[3]/10/5,0) -> 1875|375 | I71: 0 | J71: 装备改造石（红）（5折） | K71: 5 | L71: 75 | M71: =IF(INT(RC[-12]/1000)=INT(R[-1]C[-12]/1000),R[-1]C&"|"&RC[-12],RC[-12]) -> 2001|2002|2003|2004|2005|2006|2007|2008|2009|2010|2011|2012|2013|2014|2015|2016|2017|2018|2019|2020|2021|2022|2023|2024|2025|2026|2027|2028|2029|2030|2031
A72: 2032 | B72: 10117 | C72: 75 | D72: 1 | E72: 58 | F72: 2 | G72: 5|33 | H72: =ROUND(RC[4]*RC[-5]*RC[3]/10,0)&"|"&ROUND(RC[4]*RC[-5]*RC[3]/10/5,0) -> 2813|563 | I72: 0 | J72: 装备改造石（红）（5折） | K72: 5 | L72: 75 | M72: =IF(INT(RC[-12]/1000)=INT(R[-1]C[-12]/1000),R[-1]C&"|"&RC[-12],RC[-12]) -> 2001|2002|2003|2004|2005|2006|2007|2008|2009|2010|2011|2012|2013|2014|2015|2016|2017|2018|2019|2020|2021|2022|2023|2024|2025|2026|2027|2028|2029|2030|2031|2032
A73: 2033 | B73: 10117 | C73: 100 | D73: 1 | E73: 58 | F73: 2 | G73: 5|33 | H73: =ROUND(RC[4]*RC[-5]*RC[3]/10,0)&"|"&ROUND(RC[4]*RC[-5]*RC[3]/10/5,0) -> 3750|750 | I73: 0 | J73: 装备改造石（红）（5折） | K73: 5 | L73: 75 | M73: =IF(INT(RC[-12]/1000)=INT(R[-1]C[-12]/1000),R[-1]C&"|"&RC[-12],RC[-12]) -> 2001|2002|2003|2004|2005|2006|2007|2008|2009|2010|2011|2012|2013|2014|2015|2016|2017|2018|2019|2020|2021|2022|2023|2024|2025|2026|2027|2028|2029|2030|2031|2032|2033
A74: 2034 | B74: 10117 | C74: 125 | D74: 1 | E74: 58 | F74: 2 | G74: 5|33 | H74: =ROUND(RC[4]*RC[-5]*RC[3]/10,0)&"|"&ROUND(RC[4]*RC[-5]*RC[3]/10/5,0) -> 4688|938 | I74: 0 | J74: 装备改造石（红）（5折） | K74: 5 | L74: 75 | M74: =IF(INT(RC[-12]/1000)=INT(R[-1]C[-12]/1000),R[-1]C&"|"&RC[-12],RC[-12]) -> 2001|2002|2003|2004|2005|2006|2007|2008|2009|2010|2011|2012|2013|2014|2015|2016|2017|2018|2019|2020|2021|2022|2023|2024|2025|2026|2027|2028|2029|2030|2031|2032|2033|2034
A75: 3001 | B75: 10003 | C75: 50 | D75: 1 | E75: 1 | F75: 3 | G75: 5|33 | H75: =ROUND(RC[4]*RC[-5]*RC[3]/10,0)&"|"&ROUND(RC[4]*RC[-5]*RC[3]/10/5,0) -> 60|12 | I75: 0 | J75: 培养石（4折） | K75: 4 | L75: 3 | M75: =IF(INT(RC[-12]/1000)=INT(R[-11]C[-12]/1000),R[-11]C&"|"&RC[-12],RC[-12]) -> 3001
A76: 3002 | B76: 10003 | C76: 100 | D76: 1 | E76: 1 | F76: 3 | G76: 5|33 | H76: =ROUND(RC[4]*RC[-5]*RC[3]/10,0)&"|"&ROUND(RC[4]*RC[-5]*RC[3]/10/5,0) -> 120|24 | I76: 0 | J76: 培养石（4折） | K76: 4 | L76: 3 | M76: =IF(INT(RC[-12]/1000)=INT(R[-1]C[-12]/1000),R[-1]C&"|"&RC[-12],RC[-12]) -> 3001|3002
A77: 3003 | B77: 10003 | C77: 150 | D77: 1 | E77: 1 | F77: 3 | G77: 5|33 | H77: =ROUND(RC[4]*RC[-5]*RC[3]/10,0)&"|"&ROUND(RC[4]*RC[-5]*RC[3]/10/5,0) -> 180|36 | I77: 0 | J77: 培养石（4折） | K77: 4 | L77: 3 | M77: =IF(INT(RC[-12]/1000)=INT(R[-1]C[-12]/1000),R[-1]C&"|"&RC[-12],RC[-12]) -> 3001|3002|3003
A78: 3004 | B78: 10003 | C78: 200 | D78: 1 | E78: 1 | F78: 3 | G78: 5|33 | H78: =ROUND(RC[4]*RC[-5]*RC[3]/10,0)&"|"&ROUND(RC[4]*RC[-5]*RC[3]/10/5,0) -> 240|48 | I78: 0 | J78: 培养石（4折） | K78: 4 | L78: 3 | M78: =IF(INT(RC[-12]/1000)=INT(R[-1]C[-12]/1000),R[-1]C&"|"&RC[-12],RC[-12]) -> 3001|3002|3003|3004
A79: 3005 | B79: 10004 | C79: 50 | D79: 1 | E79: 1 | F79: 3 | G79: 5|33 | H79: =ROUND(RC[4]*RC[-5]*RC[3]/10,0)&"|"&ROUND(RC[4]*RC[-5]*RC[3]/10/5,0) -> 225|45 | I79: 0 | J79: 潜能合剂（3折） | K79: 3 | L79: 15 | M79: =IF(INT(RC[-12]/1000)=INT(R[-1]C[-12]/1000),R[-1]C&"|"&RC[-12],RC[-12]) -> 3001|3002|3003|3004|3005
A80: 3006 | B80: 10004 | C80: 100 | D80: 1 | E80: 1 | F80: 3 | G80: 5|33 | H80: =ROUND(RC[4]*RC[-5]*RC[3]/10,0)&"|"&ROUND(RC[4]*RC[-5]*RC[3]/10/5,0) -> 450|90 | I80: 0 | J80: 潜能合剂（3折） | K80: 3 | L80: 15 | M80: =IF(INT(RC[-12]/1000)=INT(R[-1]C[-12]/1000),R[-1]C&"|"&RC[-12],RC[-12]) -> 3001|3002|3003|3004|3005|3006
A81: 3007 | B81: 10004 | C81: 150 | D81: 1 | E81: 1 | F81: 3 | G81: 5|33 | H81: =ROUND(RC[4]*RC[-5]*RC[3]/10,0)&"|"&ROUND(RC[4]*RC[-5]*RC[3]/10/5,0) -> 675|135 | I81: 0 | J81: 潜能合剂（3折） | K81: 3 | L81: 15 | M81: =IF(INT(RC[-12]/1000)=INT(R[-1]C[-12]/1000),R[-1]C&"|"&RC[-12],RC[-12]) -> 3001|3002|3003|3004|3005|3006|3007
A82: 3008 | B82: 10004 | C82: 200 | D82: 1 | E82: 1 | F82: 3 | G82: 5|33 | H82: =ROUND(RC[4]*RC[-5]*RC[3]/10,0)&"|"&ROUND(RC[4]*RC[-5]*RC[3]/10/5,0) -> 900|180 | I82: 0 | J82: 潜能合剂（3折） | K82: 3 | L82: 15 | M82: =IF(INT(RC[-12]/1000)=INT(R[-1]C[-12]/1000),R[-1]C&"|"&RC[-12],RC[-12]) -> 3001|3002|3003|3004|3005|3006|3007|3008
A83: 3009 | B83: 12408 | C83: 10 | D83: 1 | E83: 1 | F83: 2 | G83: 5|33 | H83: =ROUND(RC[4]*RC[-5]*RC[3]/10,0)&"|"&ROUND(RC[4]*RC[-5]*RC[3]/10/5,0) -> 180|36 | I83: 0 | J83: 铁人碎片（4.5折） | K83: 4.5 | L83: 40 | M83: =IF(INT(RC[-12]/1000)=INT(R[-1]C[-12]/1000),R[-1]C&"|"&RC[-12],RC[-12]) -> 3001|3002|3003|3004|3005|3006|3007|3008|3009
A84: 3010 | B84: 12410 | C84: 10 | D84: 1 | E84: 1 | F84: 2 | G84: 5|33 | H84: =ROUND(RC[4]*RC[-5]*RC[3]/10,0)&"|"&ROUND(RC[4]*RC[-5]*RC[3]/10/5,0) -> 180|36 | I84: 0 | J84: 奇异博士碎片（4.5折） | K84: 4.5 | L84: 40 | M84: =IF(INT(RC[-12]/1000)=INT(R[-1]C[-12]/1000),R[-1]C&"|"&RC[-12],RC[-12]) -> 3001|3002|3003|3004|3005|3006|3007|3008|3009|3010
A85: 3011 | B85: 12438 | C85: 10 | D85: 1 | E85: 1 | F85: 2 | G85: 5|33 | H85: =ROUND(RC[4]*RC[-5]*RC[3]/10,0)&"|"&ROUND(RC[4]*RC[-5]*RC[3]/10/5,0) -> 180|36 | I85: 0 | J85: 宙斯碎片（4.5折） | K85: 4.5 | L85: 40 | M85: =IF(INT(RC[-12]/1000)=INT(R[-1]C[-12]/1000),R[-1]C&"|"&RC[-12],RC[-12]) -> 3001|3002|3003|3004|3005|3006|3007|3008|3009|3010|3011
A86: 3012 | B86: 12440 | C86: 10 | D86: 1 | E86: 1 | F86: 2 | G86: 5|33 | H86: =ROUND(RC[4]*RC[-5]*RC[3]/10,0)&"|"&ROUND(RC[4]*RC[-5]*RC[3]/10/5,0) -> 180|36 | I86: 0 | J86: 阿努比斯碎片（4.5折） | K86: 4.5 | L86: 40 | M86: =IF(INT(RC[-12]/1000)=INT(R[-1]C[-12]/1000),R[-1]C&"|"&RC[-12],RC[-12]) -> 3001|3002|3003|3004|3005|3006|3007|3008|3009|3010|3011|3012
A87: 3013 | B87: 12468 | C87: 10 | D87: 1 | E87: 1 | F87: 2 | G87: 5|33 | H87: =ROUND(RC[4]*RC[-5]*RC[3]/10,0)&"|"&ROUND(RC[4]*RC[-5]*RC[3]/10/5,0) -> 180|36 | I87: 0 | J87: 小黑碎片（4.5折） | K87: 4.5 | L87: 40 | M87: =IF(INT(RC[-12]/1000)=INT(R[-1]C[-12]/1000),R[-1]C&"|"&RC[-12],RC[-12]) -> 3001|3002|3003|3004|3005|3006|3007|3008|3009|3010|3011|3012|3013
A88: 3014 | B88: 12470 | C88: 10 | D88: 1 | E88: 1 | F88: 2 | G88: 5|33 | H88: =ROUND(RC[4]*RC[-5]*RC[3]/10,0)&"|"&ROUND(RC[4]*RC[-5]*RC[3]/10/5,0) -> 180|36 | I88: 0 | J88: 血色指挥官碎片（4.5折） | K88: 4.5 | L88: 40 | M88: =IF(INT(RC[-12]/1000)=INT(R[-1]C[-12]/1000),R[-1]C&"|"&RC[-12],RC[-12]) -> 3001|3002|3003|3004|3005|3006|3007|3008|3009|3010|3011|3012|3013|3014
A89: 3015 | B89: 12408 | C89: 20 | D89: 1 | E89: 1 | F89: 2 | G89: 5|33 | H89: =ROUND(RC[4]*RC[-5]*RC[3]/10,0)&"|"&ROUND(RC[4]*RC[-5]*RC[3]/10/5,0) -> 360|72 | I89: 0 | J89: 铁人碎片（4.5折） | K89: 4.5 | L89: 40 | M89: =IF(INT(RC[-12]/1000)=INT(R[-1]C[-12]/1000),R[-1]C&"|"&RC[-12],RC[-12]) -> 3001|3002|3003|3004|3005|3006|3007|3008|3009|3010|3011|3012|3013|3014|3015
A90: 3016 | B90: 12410 | C90: 20 | D90: 1 | E90: 1 | F90: 2 | G90: 5|33 | H90: =ROUND(RC[4]*RC[-5]*RC[3]/10,0)&"|"&ROUND(RC[4]*RC[-5]*RC[3]/10/5,0) -> 360|72 | I90: 0 | J90: 奇异博士碎片（4.5折） | K90: 4.5 | L90: 40 | M90: =IF(INT(RC[-12]/1000)=INT(R[-1]C[-12]/1000),R[-1]C&"|"&RC[-12],RC[-12]) -> 3001|3002|3003|3004|3005|3006|3007|3008|3009|3010|3011|3012|3013|3014|3015|3016
A91: 3017 | B91: 12438 | C91: 20 | D91: 1 | E91: 1 | F91: 2 | G91: 5|33 | H91: =ROUND(RC[4]*RC[-5]*RC[3]/10,0)&"|"&ROUND(RC[4]*RC[-5]*RC[3]/10/5,0) -> 360|72 | I91: 0 | J91: 宙斯碎片（4.5折） | K91: 4.5 | L91: 40 | M91: =IF(INT(RC[-12]/1000)=INT(R[-1]C[-12]/1000),R[-1]C&"|"&RC[-12],RC[-12]) -> 3001|3002|3003|3004|3005|3006|3007|3008|3009|3010|3011|3012|3013|3014|3015|3016|3017
A92: 3018 | B92: 12440 | C92: 20 | D92: 1 | E92: 1 | F92: 2 | G92: 5|33 | H92: =ROUND(RC[4]*RC[-5]*RC[3]/10,0)&"|"&ROUND(RC[4]*RC[-5]*RC[3]/10/5,0) -> 360|72 | I92: 0 | J92: 阿努比斯碎片（4.5折） | K92: 4.5 | L92: 40 | M92: =IF(INT(RC[-12]/1000)=INT(R[-1]C[-12]/1000),R[-1]C&"|"&RC[-12],RC[-12]) -> 3001|3002|3003|3004|3005|3006|3007|3008|3009|3010|3011|3012|3013|3014|3015|3016|3017|3018
A93: 3019 | B93: 12468 | C93: 20 | D93: 1 | E93: 1 | F93: 2 | G93: 5|33 | H93: =ROUND(RC[4]*RC[-5]*RC[3]/10,0)&"|"&ROUND(RC[4]*RC[-5]*RC[3]/10/5,0) -> 360|72 | I93: 0 | J93: 小黑碎片（4.5折） | K93: 4.5 | L93: 40 | M93: =IF(INT(RC[-12]/1000)=INT(R[-1]C[-12]/1000),R[-1]C&"|"&RC[-12],RC[-12]) -> 3001|3002|3003|3004|3005|3006|3007|3008|3009|3010|3011|3012|3013|3014|3015|3016|3017|3018|3019
A94: 3020 | B94: 12470 | C94: 20 | D94: 1 | E94: 1 | F94: 2 | G94: 5|33 | H94: =ROUND(RC[4]*RC[-5]*RC[3]/10,0)&"|"&ROUND(RC[4]*RC[-5]*RC[3]/10/5,0) -> 360|72 | I94: 0 | J94: 血色指挥官碎片（4.5折） | K94: 4.5 | L94: 40 | M94: =IF(INT(RC[-12]/1000)=INT(R[-1]C[-12]/1000),R[-1]C&"|"&RC[-12],RC[-12]) -> 3001|3002|3003|3004|3005|3006|3007|3008|3009|3010|3011|3012|3013|3014|3015|3016|3017|3018|3019|3020
A95: 3021 | B95: 12500 | C95: 10 | D95: 1 | E95: 30 | F95: 4 | G95: 5|33 | H95: =ROUND(RC[4]*RC[-5]*RC[3]/10,0)&"|"&ROUND(RC[4]*RC[-5]*RC[3]/10/5,0) -> 250|50 | I95: 0 | J95: 黑暗骑士碎片（5折） | K95: 5 | L95: 50 | M95: =IF(INT(RC[-12]/1000)=INT(R[-1]C[-12]/1000),R[-1]C&"|"&RC[-12],RC[-12]) -> 3001|3002|3003|3004|3005|3006|3007|3008|3009|3010|3011|3012|3013|3014|3015|3016|3017|3018|3019|3020|3021
A96: 3022 | B96: 12531 | C96: 10 | D96: 1 | E96: 30 | F96: 4 | G96: 5|33 | H96: =ROUND(RC[4]*RC[-5]*RC[3]/10,0)&"|"&ROUND(RC[4]*RC[-5]*RC[3]/10/5,0) -> 250|50 | I96: 0 | J96: 奎爷碎片（5折） | K96: 5 | L96: 50 | M96: =IF(INT(RC[-12]/1000)=INT(R[-1]C[-12]/1000),R[-1]C&"|"&RC[-12],RC[-12]) -> 3001|3002|3003|3004|3005|3006|3007|3008|3009|3010|3011|3012|3013|3014|3015|3016|3017|3018|3019|3020|3021|3022
A97: 3023 | B97: 12561 | C97: 10 | D97: 1 | E97: 30 | F97: 4 | G97: 5|33 | H97: =ROUND(RC[4]*RC[-5]*RC[3]/10,0)&"|"&ROUND(RC[4]*RC[-5]*RC[3]/10/5,0) -> 250|50 | I97: 0 | J97: 钢铁酋长碎片（5折） | K97: 5 | L97: 50 | M97: =IF(INT(RC[-12]/1000)=INT(R[-1]C[-12]/1000),R[-1]C&"|"&RC[-12],RC[-12]) -> 3001|3002|3003|3004|3005|3006|3007|3008|3009|3010|3011|3012|3013|3014|3015|3016|3017|3018|3019|3020|3021|3022|3023
A98: 3024 | B98: 12500 | C98: 20 | D98: 1 | E98: 55 | F98: 4 | G98: 5|33 | H98: =ROUND(RC[4]*RC[-5]*RC[3]/10,0)&"|"&ROUND(RC[4]*RC[-5]*RC[3]/10/5,0) -> 500|100 | I98: 0 | J98: 黑暗骑士碎片（5折） | K98: 5 | L98: 50 | M98: =IF(INT(RC[-12]/1000)=INT(R[-1]C[-12]/1000),R[-1]C&"|"&RC[-12],RC[-12]) -> 3001|3002|3003|3004|3005|3006|3007|3008|3009|3010|3011|3012|3013|3014|3015|3016|3017|3018|3019|3020|3021|3022|3023|3024
A99: 3025 | B99: 12531 | C99: 20 | D99: 1 | E99: 55 | F99: 4 | G99: 5|33 | H99: =ROUND(RC[4]*RC[-5]*RC[3]/10,0)&"|"&ROUND(RC[4]*RC[-5]*RC[3]/10/5,0) -> 500|100 | I99: 0 | J99: 奎爷碎片（5折） | K99: 5 | L99: 50 | M99: =IF(INT(RC[-12]/1000)=INT(R[-1]C[-12]/1000),R[-1]C&"|"&RC[-12],RC[-12]) -> 3001|3002|3003|3004|3005|3006|3007|3008|3009|3010|3011|3012|3013|3014|3015|3016|3017|3018|3019|3020|3021|3022|3023|3024|3025
A100: 3026 | B100: 12561 | C100: 20 | D100: 1 | E100: 55 | F100: 4 | G100: 5|33 | H100: =ROUND(RC[4]*RC[-5]*RC[3]/10,0)&"|"&ROUND(RC[4]*RC[-5]*RC[3]/10/5,0) -> 500|100 | I100: 0 | J100: 钢铁酋长碎片（5折） | K100: 5 | L100: 50 | M100: =IF(INT(RC[-12]/1000)=INT(R[-1]C[-12]/1000),R[-1]C&"|"&RC[-12],RC[-12]) -> 3001|3002|3003|3004|3005|3006|3007|3008|3009|3010|3011|3012|3013|3014|3015|3016|3017|3018|3019|3020|3021|3022|3023|3024|3025|3026
A101: 4001 | B101: 10003 | C101: 50 | D101: 1 | E101: 1 | F101: 3 | G101: 5|33 | H101: =ROUND(RC[4]*RC[-5]*RC[3]/10,0)&"|"&ROUND(RC[4]*RC[-5]*RC[3]/10/5,0) -> 60|12 | I101: 0 | J101: 培养石（4折） | K101: 4 | L101: 3 | M101: =IF(INT(RC[-12]/1000)=INT(R[-1]C[-12]/1000),R[-1]C&"|"&RC[-12],RC[-12]) -> 4001
A102: 4002 | B102: 10003 | C102: 100 | D102: 1 | E102: 1 | F102: 3 | G102: 5|33 | H102: =ROUND(RC[4]*RC[-5]*RC[3]/10,0)&"|"&ROUND(RC[4]*RC[-5]*RC[3]/10/5,0) -> 120|24 | I102: 0 | J102: 培养石（4折） | K102: 4 | L102: 3 | M102: =IF(INT(RC[-12]/1000)=INT(R[-1]C[-12]/1000),R[-1]C&"|"&RC[-12],RC[-12]) -> 4001|4002
A103: 4003 | B103: 10003 | C103: 150 | D103: 1 | E103: 1 | F103: 3 | G103: 5|33 | H103: =ROUND(RC[4]*RC[-5]*RC[3]/10,0)&"|"&ROUND(RC[4]*RC[-5]*RC[3]/10/5,0) -> 180|36 | I103: 0 | J103: 培养石（4折） | K103: 4 | L103: 3 | M103: =IF(INT(RC[-12]/1000)=INT(R[-1]C[-12]/1000),R[-1]C&"|"&RC[-12],RC[-12]) -> 4001|4002|4003
A104: 4004 | B104: 10003 | C104: 200 | D104: 1 | E104: 1 | F104: 3 | G104: 5|33 | H104: =ROUND(RC[4]*RC[-5]*RC[3]/10,0)&"|"&ROUND(RC[4]*RC[-5]*RC[3]/10/5,0) -> 240|48 | I104: 0 | J104: 培养石（4折） | K104: 4 | L104: 3 | M104: =IF(INT(RC[-12]/1000)=INT(R[-1]C[-12]/1000),R[-1]C&"|"&RC[-12],RC[-12]) -> 4001|4002|4003|4004
A105: 4005 | B105: 10004 | C105: 50 | D105: 1 | E105: 1 | F105: 3 | G105: 5|33 | H105: =ROUND(RC[4]*RC[-5]*RC[3]/10,0)&"|"&ROUND(RC[4]*RC[-5]*RC[3]/10/5,0) -> 225|45 | I105: 0 | J105: 潜能合剂（3折） | K105: 3 | L105: 15 | M105: =IF(INT(RC[-12]/1000)=INT(R[-1]C[-12]/1000),R[-1]C&"|"&RC[-12],RC[-12]) -> 4001|4002|4003|4004|4005
A106: 4006 | B106: 10004 | C106: 100 | D106: 1 | E106: 1 | F106: 3 | G106: 5|33 | H106: =ROUND(RC[4]*RC[-5]*RC[3]/10,0)&"|"&ROUND(RC[4]*RC[-5]*RC[3]/10/5,0) -> 450|90 | I106: 0 | J106: 潜能合剂（3折） | K106: 3 | L106: 15 | M106: =IF(INT(RC[-12]/1000)=INT(R[-1]C[-12]/1000),R[-1]C&"|"&RC[-12],RC[-12]) -> 4001|4002|4003|4004|4005|4006
A107: 4007 | B107: 10004 | C107: 150 | D107: 1 | E107: 1 | F107: 3 | G107: 5|33 | H107: =ROUND(RC[4]*RC[-5]*RC[3]/10,0)&"|"&ROUND(RC[4]*RC[-5]*RC[3]/10/5,0) -> 675|135 | I107: 0 | J107: 潜能合剂（3折） | K107: 3 | L107: 15 | M107: =IF(INT(RC[-12]/1000)=INT(R[-1]C[-12]/1000),R[-1]C&"|"&RC[-12],RC[-12]) -> 4001|4002|4003|4004|4005|4006|4007
A108: 4008 | B108: 10004 | C108: 200 | D108: 1 | E108: 1 | F108: 3 | G108: 5|33 | H108: =ROUND(RC[4]*RC[-5]*RC[3]/10,0)&"|"&ROUND(RC[4]*RC[-5]*RC[3]/10/5,0) -> 900|180 | I108: 0 | J108: 潜能合剂（3折） | K108: 3 | L108: 15 | M108: =IF(INT(RC[-12]/1000)=INT(R[-1]C[-12]/1000),R[-1]C&"|"&RC[-12],RC[-12]) -> 4001|4002|4003|4004|4005|4006|4007|4008
A109: 4009 | B109: 12408 | C109: 10 | D109: 1 | E109: 1 | F109: 2 | G109: 5|33 | H109: =ROUND(RC[4]*RC[-5]*RC[3]/10,0)&"|"&ROUND(RC[4]*RC[-5]*RC[3]/10/5,0) -> 180|36 | I109: 0 | J109: 铁人碎片（4.5折） | K109: 4.5 | L109: 40 | M109: =IF(INT(RC[-12]/1000)=INT(R[-1]C[-12]/1000),R[-1]C&"|"&RC[-12],RC[-12]) -> 4001|4002|4003|4004|4005|4006|4007|4008|4009
A110: 4010 | B110: 12410 | C110: 10 | D110: 1 | E110: 1 | F110: 2 | G110: 5|33 | H110: =ROUND(RC[4]*RC[-5]*RC[3]/10,0)&"|"&ROUND(RC[4]*RC[-5]*RC[3]/10/5,0) -> 180|36 | I110: 0 | J110: 奇异博士碎片（4.5折） | K110: 4.5 | L110: 40 | M110: =IF(INT(RC[-12]/1000)=INT(R[-1]C[-12]/1000),R[-1]C&"|"&RC[-12],RC[-12]) -> 4001|4002|4003|4004|4005|4006|4007|4008|4009|4010
A111: 4011 | B111: 12438 | C111: 10 | D111: 1 | E111: 1 | F111: 2 | G111: 5|33 | H111: =ROUND(RC[4]*RC[-5]*RC[3]/10,0)&"|"&ROUND(RC[4]*RC[-5]*RC[3]/10/5,0) -> 180|36 | I111: 0 | J111: 宙斯碎片（4.5折） | K111: 4.5 | L111: 40 | M111: =IF(INT(RC[-12]/1000)=INT(R[-1]C[-12]/1000),R[-1]C&"|"&RC[-12],RC[-12]) -> 4001|4002|4003|4004|4005|4006|4007|4008|4009|4010|4011
A112: 4012 | B112: 12440 | C112: 10 | D112: 1 | E112: 1 | F112: 2 | G112: 5|33 | H112: =ROUND(RC[4]*RC[-5]*RC[3]/10,0)&"|"&ROUND(RC[4]*RC[-5]*RC[3]/10/5,0) -> 180|36 | I112: 0 | J112: 阿努比斯碎片（4.5折） | K112: 4.5 | L112: 40 | M112: =IF(INT(RC[-12]/1000)=INT(R[-1]C[-12]/1000),R[-1]C&"|"&RC[-12],RC[-12]) -> 4001|4002|4003|4004|4005|4006|4007|4008|4009|4010|4011|4012
A113: 4013 | B113: 12468 | C113: 10 | D113: 1 | E113: 1 | F113: 2 | G113: 5|33 | H113: =ROUND(RC[4]*RC[-5]*RC[3]/10,0)&"|"&ROUND(RC[4]*RC[-5]*RC[3]/10/5,0) -> 180|36 | I113: 0 | J113: 小黑碎片（4.5折） | K113: 4.5 | L113: 40 | M113: =IF(INT(RC[-12]/1000)=INT(R[-1]C[-12]/1000),R[-1]C&"|"&RC[-12],RC[-12]) -> 4001|4002|4003|4004|4005|4006|4007|4008|4009|4010|4011|4012|4013
A114: 4014 | B114: 12470 | C114: 10 | D114: 1 | E114: 1 | F114: 2 | G114: 5|33 | H114: =ROUND(RC[4]*RC[-5]*RC[3]/10,0)&"|"&ROUND(RC[4]*RC[-5]*RC[3]/10/5,0) -> 180|36 | I114: 0 | J114: 血色指挥官碎片（4.5折） | K114: 4.5 | L114: 40 | M114: =IF(INT(RC[-12]/1000)=INT(R[-1]C[-12]/1000),R[-1]C&"|"&RC[-12],RC[-12]) -> 4001|4002|4003|4004|4005|4006|4007|4008|4009|4010|4011|4012|4013|4014
A115: 4015 | B115: 12408 | C115: 20 | D115: 1 | E115: 1 | F115: 2 | G115: 5|33 | H115: =ROUND(RC[4]*RC[-5]*RC[3]/10,0)&"|"&ROUND(RC[4]*RC[-5]*RC[3]/10/5,0) -> 360|72 | I115: 0 | J115: 铁人碎片（4.5折） | K115: 4.5 | L115: 40 | M115: =IF(INT(RC[-12]/1000)=INT(R[-1]C[-12]/1000),R[-1]C&"|"&RC[-12],RC[-12]) -> 4001|4002|4003|4004|4005|4006|4007|4008|4009|4010|4011|4012|4013|4014|4015
A116: 4016 | B116: 12410 | C116: 20 | D116: 1 | E116: 1 | F116: 2 | G116: 5|33 | H116: =ROUND(RC[4]*RC[-5]*RC[3]/10,0)&"|"&ROUND(RC[4]*RC[-5]*RC[3]/10/5,0) -> 360|72 | I116: 0 | J116: 奇异博士碎片（4.5折） | K116: 4.5 | L116: 40 | M116: =IF(INT(RC[-12]/1000)=INT(R[-1]C[-12]/1000),R[-1]C&"|"&RC[-12],RC[-12]) -> 4001|4002|4003|4004|4005|4006|4007|4008|4009|4010|4011|4012|4013|4014|4015|4016
A117: 4017 | B117: 12438 | C117: 20 | D117: 1 | E117: 1 | F117: 2 | G117: 5|33 | H117: =ROUND(RC[4]*RC[-5]*RC[3]/10,0)&"|"&ROUND(RC[4]*RC[-5]*RC[3]/10/5,0) -> 360|72 | I117: 0 | J117: 宙斯碎片（4.5折） | K117: 4.5 | L117: 40 | M117: =IF(INT(RC[-12]/1000)=INT(R[-1]C[-12]/1000),R[-1]C&"|"&RC[-12],RC[-12]) -> 4001|4002|4003|4004|4005|4006|4007|4008|4009|4010|4011|4012|4013|4014|4015|4016|4017
A118: 4018 | B118: 12440 | C118: 20 | D118: 1 | E118: 1 | F118: 2 | G118: 5|33 | H118: =ROUND(RC[4]*RC[-5]*RC[3]/10,0)&"|"&ROUND(RC[4]*RC[-5]*RC[3]/10/5,0) -> 360|72 | I118: 0 | J118: 阿努比斯碎片（4.5折） | K118: 4.5 | L118: 40 | M118: =IF(INT(RC[-12]/1000)=INT(R[-1]C[-12]/1000),R[-1]C&"|"&RC[-12],RC[-12]) -> 4001|4002|4003|4004|4005|4006|4007|4008|4009|4010|4011|4012|4013|4014|4015|4016|4017|4018
A119: 4019 | B119: 12468 | C119: 20 | D119: 1 | E119: 1 | F119: 2 | G119: 5|33 | H119: =ROUND(RC[4]*RC[-5]*RC[3]/10,0)&"|"&ROUND(RC[4]*RC[-5]*RC[3]/10/5,0) -> 360|72 | I119: 0 | J119: 小黑碎片（4.5折） | K119: 4.5 | L119: 40 | M119: =IF(INT(RC[-12]/1000)=INT(R[-1]C[-12]/1000),R[-1]C&"|"&RC[-12],RC[-12]) -> 4001|4002|4003|4004|4005|4006|4007|4008|4009|4010|4011|4012|4013|4014|4015|4016|4017|4018|4019
A120: 4020 | B120: 12470 | C120: 20 | D120: 1 | E120: 1 | F120: 2 | G120: 5|33 | H120: =ROUND(RC[4]*RC[-5]*RC[3]/10,0)&"|"&ROUND(RC[4]*RC[-5]*RC[3]/10/5,0) -> 360|72 | I120: 0 | J120: 血色指挥官碎片（4.5折） | K120: 4.5 | L120: 40 | M120: =IF(INT(RC[-12]/1000)=INT(R[-1]C[-12]/1000),R[-1]C&"|"&RC[-12],RC[-12]) -> 4001|4002|4003|4004|4005|4006|4007|4008|4009|4010|4011|4012|4013|4014|4015|4016|4017|4018|4019|4020
A121: 4021 | B121: 12500 | C121: 10 | D121: 1 | E121: 30 | F121: 4 | G121: 5|33 | H121: =ROUND(RC[4]*RC[-5]*RC[3]/10,0)&"|"&ROUND(RC[4]*RC[-5]*RC[3]/10/5,0) -> 250|50 | I121: 0 | J121: 黑暗骑士碎片（5折） | K121: 5 | L121: 50 | M121: =IF(INT(RC[-12]/1000)=INT(R[-1]C[-12]/1000),R[-1]C&"|"&RC[-12],RC[-12]) -> 4001|4002|4003|4004|4005|4006|4007|4008|4009|4010|4011|4012|4013|4014|4015|4016|4017|4018|4019|4020|4021
A122: 4022 | B122: 12531 | C122: 10 | D122: 1 | E122: 30 | F122: 4 | G122: 5|33 | H122: =ROUND(RC[4]*RC[-5]*RC[3]/10,0)&"|"&ROUND(RC[4]*RC[-5]*RC[3]/10/5,0) -> 250|50 | I122: 0 | J122: 奎爷碎片（5折） | K122: 5 | L122: 50 | M122: =IF(INT(RC[-12]/1000)=INT(R[-1]C[-12]/1000),R[-1]C&"|"&RC[-12],RC[-12]) -> 4001|4002|4003|4004|4005|4006|4007|4008|4009|4010|4011|4012|4013|4014|4015|4016|4017|4018|4019|4020|4021|4022
A123: 4023 | B123: 12561 | C123: 10 | D123: 1 | E123: 30 | F123: 4 | G123: 5|33 | H123: =ROUND(RC[4]*RC[-5]*RC[3]/10,0)&"|"&ROUND(RC[4]*RC[-5]*RC[3]/10/5,0) -> 250|50 | I123: 0 | J123: 钢铁酋长碎片（5折） | K123: 5 | L123: 50 | M123: =IF(INT(RC[-12]/1000)=INT(R[-1]C[-12]/1000),R[-1]C&"|"&RC[-12],RC[-12]) -> 4001|4002|4003|4004|4005|4006|4007|4008|4009|4010|4011|4012|4013|4014|4015|4016|4017|4018|4019|4020|4021|4022|4023
A124: 4024 | B124: 12500 | C124: 20 | D124: 1 | E124: 55 | F124: 4 | G124: 5|33 | H124: =ROUND(RC[4]*RC[-5]*RC[3]/10,0)&"|"&ROUND(RC[4]*RC[-5]*RC[3]/10/5,0) -> 500|100 | I124: 0 | J124: 黑暗骑士碎片（5折） | K124: 5 | L124: 50 | M124: =IF(INT(RC[-12]/1000)=INT(R[-1]C[-12]/1000),R[-1]C&"|"&RC[-12],RC[-12]) -> 4001|4002|4003|4004|4005|4006|4007|4008|4009|4010|4011|4012|4013|4014|4015|4016|4017|4018|4019|4020|4021|4022|4023|4024
A125: 4025 | B125: 12531 | C125: 20 | D125: 1 | E125: 55 | F125: 4 | G125: 5|33 | H125: =ROUND(RC[4]*RC[-5]*RC[3]/10,0)&"|"&ROUND(RC[4]*RC[-5]*RC[3]/10/5,0) -> 500|100 | I125: 0 | J125: 奎爷碎片（5折） | K125: 5 | L125: 50 | M125: =IF(INT(RC[-12]/1000)=INT(R[-1]C[-12]/1000),R[-1]C&"|"&RC[-12],RC[-12]) -> 4001|4002|4003|4004|4005|4006|4007|4008|4009|4010|4011|4012|4013|4014|4015|4016|4017|4018|4019|4020|4021|4022|4023|4024|4025
A126: 4026 | B126: 12561 | C126: 20 | D126: 1 | E126: 55 | F126: 4 | G126: 5|33 | H126: =ROUND(RC[4]*RC[-5]*RC[3]/10,0)&"|"&ROUND(RC[4]*RC[-5]*RC[3]/10/5,0) -> 500|100 | I126: 0 | J126: 钢铁酋长碎片（5折） | K126: 5 | L126: 50 | M126: =IF(INT(RC[-12]/1000)=INT(R[-1]C[-12]/1000),R[-1]C&"|"&RC[-12],RC[-12]) -> 4001|4002|4003|4004|4005|4006|4007|4008|4009|4010|4011|4012|4013|4014|4015|4016|4017|4018|4019|4020|4021|4022|4023|4024|4025|4026
A127: 5001 | B127: 10022 | C127: 10 | D127: 1 | E127: 1 | F127: 10 | G127: 5|33 | H127: =ROUND(RC[4]*RC[-5]*RC[3]/10,0)&"|"&ROUND(RC[4]*RC[-5]*RC[3]/10/5,0) -> 225|45 | I127: 0 | J127: 灵性精粹（4.5折） | K127: 4.5 | L127: 50 | M127: =IF(INT(RC[-12]/1000)=INT(R[-1]C[-12]/1000),R[-1]C&"|"&RC[-12],RC[-12]) -> 5001
A128: 5002 | B128: 10022 | C128: 20 | D128: 1 | E128: 1 | F128: 10 | G128: 5|33 | H128: =ROUND(RC[4]*RC[-5]*RC[3]/10,0)&"|"&ROUND(RC[4]*RC[-5]*RC[3]/10/5,0) -> 450|90 | I128: 0 | J128: 灵性精粹（4.5折） | K128: 4.5 | L128: 50 | M128: =IF(INT(RC[-12]/1000)=INT(R[-1]C[-12]/1000),R[-1]C&"|"&RC[-12],RC[-12]) -> 5001|5002
A129: 5003 | B129: 10022 | C129: 30 | D129: 1 | E129: 1 | F129: 10 | G129: 5|33 | H129: =ROUND(RC[4]*RC[-5]*RC[3]/10,0)&"|"&ROUND(RC[4]*RC[-5]*RC[3]/10/5,0) -> 675|135 | I129: 0 | J129: 灵性精粹（4.5折） | K129: 4.5 | L129: 50 | M129: =IF(INT(RC[-12]/1000)=INT(R[-1]C[-12]/1000),R[-1]C&"|"&RC[-12],RC[-12]) -> 5001|5002|5003
A130: 5004 | B130: 10022 | C130: 40 | D130: 1 | E130: 1 | F130: 10 | G130: 5|33 | H130: =ROUND(RC[4]*RC[-5]*RC[3]/10,0)&"|"&ROUND(RC[4]*RC[-5]*RC[3]/10/5,0) -> 900|180 | I130: 0 | J130: 灵性精粹（4.5折） | K130: 4.5 | L130: 50 | M130: =IF(INT(RC[-12]/1000)=INT(R[-1]C[-12]/1000),R[-1]C&"|"&RC[-12],RC[-12]) -> 5001|5002|5003|5004
A131: 5005 | B131: 15011 | C131: 5 | D131: 1 | E131: 1 | F131: 5 | G131: 5|33 | H131: =ROUND(RC[4]*RC[-5]*RC[3]/10,0)&"|"&ROUND(RC[4]*RC[-5]*RC[3]/10/5,0) -> 200|40 | I131: 0 | J131: 炼狱灵龙碎片（5折） | K131: 5 | L131: 80 | M131: =IF(INT(RC[-12]/1000)=INT(R[-1]C[-12]/1000),R[-1]C&"|"&RC[-12],RC[-12]) -> 5001|5002|5003|5004|5005
A132: 5006 | B132: 15011 | C132: 10 | D132: 1 | E132: 1 | F132: 5 | G132: 5|33 | H132: =ROUND(RC[4]*RC[-5]*RC[3]/10,0)&"|"&ROUND(RC[4]*RC[-5]*RC[3]/10/5,0) -> 400|80 | I132: 0 | J132: 炼狱灵龙碎片（5折） | K132: 5 | L132: 80 | M132: =IF(INT(RC[-12]/1000)=INT(R[-1]C[-12]/1000),R[-1]C&"|"&RC[-12],RC[-12]) -> 5001|5002|5003|5004|5005|5006
A133: 5007 | B133: 15011 | C133: 15 | D133: 1 | E133: 1 | F133: 5 | G133: 5|33 | H133: =ROUND(RC[4]*RC[-5]*RC[3]/10,0)&"|"&ROUND(RC[4]*RC[-5]*RC[3]/10/5,0) -> 600|120 | I133: 0 | J133: 炼狱灵龙碎片（5折） | K133: 5 | L133: 80 | M133: =IF(INT(RC[-12]/1000)=INT(R[-1]C[-12]/1000),R[-1]C&"|"&RC[-12],RC[-12]) -> 5001|5002|5003|5004|5005|5006|5007
A134: 5008 | B134: 15011 | C134: 20 | D134: 1 | E134: 1 | F134: 5 | G134: 5|33 | H134: =ROUND(RC[4]*RC[-5]*RC[3]/10,0)&"|"&ROUND(RC[4]*RC[-5]*RC[3]/10/5,0) -> 800|160 | I134: 0 | J134: 炼狱灵龙碎片（5折） | K134: 5 | L134: 80 | M134: =IF(INT(RC[-12]/1000)=INT(R[-1]C[-12]/1000),R[-1]C&"|"&RC[-12],RC[-12]) -> 5001|5002|5003|5004|5005|5006|5007|5008
A135: 5009 | B135: 15031 | C135: 5 | D135: 1 | E135: 1 | F135: 5 | G135: 5|33 | H135: =ROUND(RC[4]*RC[-5]*RC[3]/10,0)&"|"&ROUND(RC[4]*RC[-5]*RC[3]/10/5,0) -> 150|30 | I135: 0 | J135: 花之妖精碎片（5折） | K135: 5 | L135: 60 | M135: =IF(INT(RC[-12]/1000)=INT(R[-1]C[-12]/1000),R[-1]C&"|"&RC[-12],RC[-12]) -> 5001|5002|5003|5004|5005|5006|5007|5008|5009
A136: 5010 | B136: 15031 | C136: 10 | D136: 1 | E136: 1 | F136: 5 | G136: 5|33 | H136: =ROUND(RC[4]*RC[-5]*RC[3]/10,0)&"|"&ROUND(RC[4]*RC[-5]*RC[3]/10/5,0) -> 300|60 | I136: 0 | J136: 花之妖精碎片（5折） | K136: 5 | L136: 60 | M136: =IF(INT(RC[-12]/1000)=INT(R[-1]C[-12]/1000),R[-1]C&"|"&RC[-12],RC[-12]) -> 5001|5002|5003|5004|5005|5006|5007|5008|5009|5010
A137: 5011 | B137: 15031 | C137: 15 | D137: 1 | E137: 1 | F137: 5 | G137: 5|33 | H137: =ROUND(RC[4]*RC[-5]*RC[3]/10,0)&"|"&ROUND(RC[4]*RC[-5]*RC[3]/10/5,0) -> 450|90 | I137: 0 | J137: 花之妖精碎片（5折） | K137: 5 | L137: 60 | M137: =IF(INT(RC[-12]/1000)=INT(R[-1]C[-12]/1000),R[-1]C&"|"&RC[-12],RC[-12]) -> 5001|5002|5003|5004|5005|5006|5007|5008|5009|5010|5011
A138: 5012 | B138: 15031 | C138: 20 | D138: 1 | E138: 1 | F138: 5 | G138: 5|33 | H138: =ROUND(RC[4]*RC[-5]*RC[3]/10,0)&"|"&ROUND(RC[4]*RC[-5]*RC[3]/10/5,0) -> 600|120 | I138: 0 | J138: 花之妖精碎片（5折） | K138: 5 | L138: 60 | M138: =IF(INT(RC[-12]/1000)=INT(R[-1]C[-12]/1000),R[-1]C&"|"&RC[-12],RC[-12]) -> 5001|5002|5003|5004|5005|5006|5007|5008|5009|5010|5011|5012
A139: 5013 | B139: 10034 | C139: 1 | D139: 1 | E139: 30 | F139: 8 | G139: 5|33 | H139: =ROUND(RC[4]*RC[-5]*RC[3]/10,0)&"|"&ROUND(RC[4]*RC[-5]*RC[3]/10/5,0) -> 1000|200 | I139: 0 | J139: 希望之心（4折） | K139: 4 | L139: 2500 | M139: =IF(INT(RC[-12]/1000)=INT(R[-1]C[-12]/1000),R[-1]C&"|"&RC[-12],RC[-12]) -> 5001|5002|5003|5004|5005|5006|5007|5008|5009|5010|5011|5012|5013
A140: 5014 | B140: 10035 | C140: 1 | D140: 1 | E140: 30 | F140: 8 | G140: 5|33 | H140: =ROUND(RC[4]*RC[-5]*RC[3]/10,0)&"|"&ROUND(RC[4]*RC[-5]*RC[3]/10/5,0) -> 1000|200 | I140: 0 | J140: 烈焰结晶（4折） | K140: 4 | L140: 2500 | M140: =IF(INT(RC[-12]/1000)=INT(R[-1]C[-12]/1000),R[-1]C&"|"&RC[-12],RC[-12]) -> 5001|5002|5003|5004|5005|5006|5007|5008|5009|5010|5011|5012|5013|5014
A141: 5015 | B141: 10036 | C141: 1 | D141: 1 | E141: 30 | F141: 8 | G141: 5|33 | H141: =ROUND(RC[4]*RC[-5]*RC[3]/10,0)&"|"&ROUND(RC[4]*RC[-5]*RC[3]/10/5,0) -> 1000|200 | I141: 0 | J141: 深海之泪（4折） | K141: 4 | L141: 2500 | M141: =IF(INT(RC[-12]/1000)=INT(R[-1]C[-12]/1000),R[-1]C&"|"&RC[-12],RC[-12]) -> 5001|5002|5003|5004|5005|5006|5007|5008|5009|5010|5011|5012|5013|5014|5015
A142: 5016 | B142: 10039 | C142: 1 | D142: 1 | E142: 30 | F142: 8 | G142: 5|33 | H142: =ROUND(RC[4]*RC[-5]*RC[3]/10,0)&"|"&ROUND(RC[4]*RC[-5]*RC[3]/10/5,0) -> 1000|200 | I142: 0 | J142: 大地核心（4折） | K142: 4 | L142: 2500 | M142: =IF(INT(RC[-12]/1000)=INT(R[-1]C[-12]/1000),R[-1]C&"|"&RC[-12],RC[-12]) -> 5001|5002|5003|5004|5005|5006|5007|5008|5009|5010|5011|5012|5013|5014|5015|5016
A143: 5017 | B143: 10040 | C143: 1 | D143: 1 | E143: 30 | F143: 8 | G143: 5|33 | H143: =ROUND(RC[4]*RC[-5]*RC[3]/10,0)&"|"&ROUND(RC[4]*RC[-5]*RC[3]/10/5,0) -> 1000|200 | I143: 0 | J143: 妖魅花种（4折） | K143: 4 | L143: 2500 | M143: =IF(INT(RC[-12]/1000)=INT(R[-1]C[-12]/1000),R[-1]C&"|"&RC[-12],RC[-12]) -> 5001|5002|5003|5004|5005|5006|5007|5008|5009|5010|5011|5012|5013|5014|5015|5016|5017
A144: 6001 | B144: 10022 | C144: 10 | D144: 1 | E144: 1 | F144: 10 | G144: 5|33 | H144: =ROUND(RC[4]*RC[-5]*RC[3]/10,0)&"|"&ROUND(RC[4]*RC[-5]*RC[3]/10/5,0) -> 225|45 | I144: 0 | J144: 灵性精粹（4.5折） | K144: 4.5 | L144: 50 | M144: =IF(INT(RC[-12]/1000)=INT(R[-1]C[-12]/1000),R[-1]C&"|"&RC[-12],RC[-12]) -> 6001
A145: 6002 | B145: 10022 | C145: 20 | D145: 1 | E145: 1 | F145: 10 | G145: 5|33 | H145: =ROUND(RC[4]*RC[-5]*RC[3]/10,0)&"|"&ROUND(RC[4]*RC[-5]*RC[3]/10/5,0) -> 450|90 | I145: 0 | J145: 灵性精粹（4.5折） | K145: 4.5 | L145: 50 | M145: =IF(INT(RC[-12]/1000)=INT(R[-1]C[-12]/1000),R[-1]C&"|"&RC[-12],RC[-12]) -> 6001|6002
A146: 6003 | B146: 10022 | C146: 30 | D146: 1 | E146: 1 | F146: 10 | G146: 5|33 | H146: =ROUND(RC[4]*RC[-5]*RC[3]/10,0)&"|"&ROUND(RC[4]*RC[-5]*RC[3]/10/5,0) -> 675|135 | I146: 0 | J146: 灵性精粹（4.5折） | K146: 4.5 | L146: 50 | M146: =IF(INT(RC[-12]/1000)=INT(R[-1]C[-12]/1000),R[-1]C&"|"&RC[-12],RC[-12]) -> 6001|6002|6003
A147: 6004 | B147: 10022 | C147: 40 | D147: 1 | E147: 1 | F147: 10 | G147: 5|33 | H147: =ROUND(RC[4]*RC[-5]*RC[3]/10,0)&"|"&ROUND(RC[4]*RC[-5]*RC[3]/10/5,0) -> 900|180 | I147: 0 | J147: 灵性精粹（4.5折） | K147: 4.5 | L147: 50 | M147: =IF(INT(RC[-12]/1000)=INT(R[-1]C[-12]/1000),R[-1]C&"|"&RC[-12],RC[-12]) -> 6001|6002|6003|6004
A148: 6005 | B148: 15011 | C148: 5 | D148: 1 | E148: 1 | F148: 5 | G148: 5|33 | H148: =ROUND(RC[4]*RC[-5]*RC[3]/10,0)&"|"&ROUND(RC[4]*RC[-5]*RC[3]/10/5,0) -> 200|40 | I148: 0 | J148: 炼狱灵龙碎片（5折） | K148: 5 | L148: 80 | M148: =IF(INT(RC[-12]/1000)=INT(R[-1]C[-12]/1000),R[-1]C&"|"&RC[-12],RC[-12]) -> 6001|6002|6003|6004|6005
A149: 6006 | B149: 15011 | C149: 10 | D149: 1 | E149: 1 | F149: 5 | G149: 5|33 | H149: =ROUND(RC[4]*RC[-5]*RC[3]/10,0)&"|"&ROUND(RC[4]*RC[-5]*RC[3]/10/5,0) -> 400|80 | I149: 0 | J149: 炼狱灵龙碎片（5折） | K149: 5 | L149: 80 | M149: =IF(INT(RC[-12]/1000)=INT(R[-1]C[-12]/1000),R[-1]C&"|"&RC[-12],RC[-12]) -> 6001|6002|6003|6004|6005|6006
A150: 6007 | B150: 15011 | C150: 15 | D150: 1 | E150: 1 | F150: 5 | G150: 5|33 | H150: =ROUND(RC[4]*RC[-5]*RC[3]/10,0)&"|"&ROUND(RC[4]*RC[-5]*RC[3]/10/5,0) -> 600|120 | I150: 0 | J150: 炼狱灵龙碎片（5折） | K150: 5 | L150: 80 | M150: =IF(INT(RC[-12]/1000)=INT(R[-1]C[-12]/1000),R[-1]C&"|"&RC[-12],RC[-12]) -> 6001|6002|6003|6004|6005|6006|6007
A151: 6008 | B151: 15011 | C151: 20 | D151: 1 | E151: 1 | F151: 5 | G151: 5|33 | H151: =ROUND(RC[4]*RC[-5]*RC[3]/10,0)&"|"&ROUND(RC[4]*RC[-5]*RC[3]/10/5,0) -> 800|160 | I151: 0 | J151: 炼狱灵龙碎片（5折） | K151: 5 | L151: 80 | M151: =IF(INT(RC[-12]/1000)=INT(R[-1]C[-12]/1000),R[-1]C&"|"&RC[-12],RC[-12]) -> 6001|6002|6003|6004|6005|6006|6007|6008
A152: 6009 | B152: 15031 | C152: 5 | D152: 1 | E152: 1 | F152: 5 | G152: 5|33 | H152: =ROUND(RC[4]*RC[-5]*RC[3]/10,0)&"|"&ROUND(RC[4]*RC[-5]*RC[3]/10/5,0) -> 150|30 | I152: 0 | J152: 花之妖精碎片（5折） | K152: 5 | L152: 60 | M152: =IF(INT(RC[-12]/1000)=INT(R[-1]C[-12]/1000),R[-1]C&"|"&RC[-12],RC[-12]) -> 6001|6002|6003|6004|6005|6006|6007|6008|6009
A153: 6010 | B153: 15031 | C153: 10 | D153: 1 | E153: 1 | F153: 5 | G153: 5|33 | H153: =ROUND(RC[4]*RC[-5]*RC[3]/10,0)&"|"&ROUND(RC[4]*RC[-5]*RC[3]/10/5,0) -> 300|60 | I153: 0 | J153: 花之妖精碎片（5折） | K153: 5 | L153: 60 | M153: =IF(INT(RC[-12]/1000)=INT(R[-1]C[-12]/1000),R[-1]C&"|"&RC[-12],RC[-12]) -> 6001|6002|6003|6004|6005|6006|6007|6008|6009|6010
A154: 6011 | B154: 15031 | C154: 15 | D154: 1 | E154: 1 | F154: 5 | G154: 5|33 | H154: =ROUND(RC[4]*RC[-5]*RC[3]/10,0)&"|"&ROUND(RC[4]*RC[-5]*RC[3]/10/5,0) -> 450|90 | I154: 0 | J154: 花之妖精碎片（5折） | K154: 5 | L154: 60 | M154: =IF(INT(RC[-12]/1000)=INT(R[-1]C[-12]/1000),R[-1]C&"|"&RC[-12],RC[-12]) -> 6001|6002|6003|6004|6005|6006|6007|6008|6009|6010|6011
A155: 6012 | B155: 15031 | C155: 20 | D155: 1 | E155: 1 | F155: 5 | G155: 5|33 | H155: =ROUND(RC[4]*RC[-5]*RC[3]/10,0)&"|"&ROUND(RC[4]*RC[-5]*RC[3]/10/5,0) -> 600|120 | I155: 0 | J155: 花之妖精碎片（5折） | K155: 5 | L155: 60 | M155: =IF(INT(RC[-12]/1000)=INT(R[-1]C[-12]/1000),R[-1]C&"|"&RC[-12],RC[-12]) -> 6001|6002|6003|6004|6005|6006|6007|6008|6009|6010|6011|6012
A156: 6013 | B156: 10034 | C156: 1 | D156: 1 | E156: 30 | F156: 8 | G156: 5|33 | H156: =ROUND(RC[4]*RC[-5]*RC[3]/10,0)&"|"&ROUND(RC[4]*RC[-5]*RC[3]/10/5,0) -> 1000|200 | I156: 0 | J156: 希望之心（4折） | K156: 4 | L156: 2500 | M156: =IF(INT(RC[-12]/1000)=INT(R[-1]C[-12]/1000),R[-1]C&"|"&RC[-12],RC[-12]) -> 6001|6002|6003|6004|6005|6006|6007|6008|6009|6010|6011|6012|6013
A157: 6014 | B157: 10035 | C157: 1 | D157: 1 | E157: 30 | F157: 8 | G157: 5|33 | H157: =ROUND(RC[4]*RC[-5]*RC[3]/10,0)&"|"&ROUND(RC[4]*RC[-5]*RC[3]/10/5,0) -> 1000|200 | I157: 0 | J157: 烈焰结晶（4折） | K157: 4 | L157: 2500 | M157: =IF(INT(RC[-12]/1000)=INT(R[-1]C[-12]/1000),R[-1]C&"|"&RC[-12],RC[-12]) -> 6001|6002|6003|6004|6005|6006|6007|6008|6009|6010|6011|6012|6013|6014
A158: 6015 | B158: 10036 | C158: 1 | D158: 1 | E158: 30 | F158: 8 | G158: 5|33 | H158: =ROUND(RC[4]*RC[-5]*RC[3]/10,0)&"|"&ROUND(RC[4]*RC[-5]*RC[3]/10/5,0) -> 1000|200 | I158: 0 | J158: 深海之泪（4折） | K158: 4 | L158: 2500 | M158: =IF(INT(RC[-12]/1000)=INT(R[-1]C[-12]/1000),R[-1]C&"|"&RC[-12],RC[-12]) -> 6001|6002|6003|6004|6005|6006|6007|6008|6009|6010|6011|6012|6013|6014|6015
A159: 6016 | B159: 10039 | C159: 1 | D159: 1 | E159: 30 | F159: 8 | G159: 5|33 | H159: =ROUND(RC[4]*RC[-5]*RC[3]/10,0)&"|"&ROUND(RC[4]*RC[-5]*RC[3]/10/5,0) -> 1000|200 | I159: 0 | J159: 大地核心（4折） | K159: 4 | L159: 2500 | M159: =IF(INT(RC[-12]/1000)=INT(R[-1]C[-12]/1000),R[-1]C&"|"&RC[-12],RC[-12]) -> 6001|6002|6003|6004|6005|6006|6007|6008|6009|6010|6011|6012|6013|6014|6015|6016
A160: 6017 | B160: 10040 | C160: 1 | D160: 1 | E160: 30 | F160: 8 | G160: 5|33 | H160: =ROUND(RC[4]*RC[-5]*RC[3]/10,0)&"|"&ROUND(RC[4]*RC[-5]*RC[3]/10/5,0) -> 1000|200 | I160: 0 | J160: 妖魅花种（4折） | K160: 4 | L160: 2500 | M160: =IF(INT(RC[-12]/1000)=INT(R[-1]C[-12]/1000),R[-1]C&"|"&RC[-12],RC[-12]) -> 6001|6002|6003|6004|6005|6006|6007|6008|6009|6010|6011|6012|6013|6014|6015|6016|6017

Sheet: Sheet1
B2: 只能用钻石购买 | C2: 钻石+水晶购买
B3: 格子左1 | C3: 格子右1
B4: 几率刷出： 1级：任选橙品符文（4折）、任选橙品徽章（4折）、橙品精炼石（4.5折） 30级：扭蛋币（4.5折）、圣器精炼石（4.5折） 45级：觉醒水晶（4.5折）、闪光的觉醒箱（4.5折） 50级：占星水晶（4.5折）、预言星徽（4折） | C4: 几率刷出： 1级：任选橙品符文（4折）、任选橙品徽章（4折）、橙品精炼石（4.5折） 30级：扭蛋币（4.5折）、圣器精炼石（4.5折） 45级：觉醒水晶（4.5折）、闪光的觉醒箱（4.5折） 50级：占星水晶（4.5折）、预言星徽（4折）
B5: 格子左2 | C5: 格子右2
B6: 几率刷出： 1级：培养石（4折）、潜能合剂（3折）、铁人碎片（4.5折）、奇异博士碎片（4.5折）、宙斯碎片（4.5折）、阿努比斯碎片（4.5折）、小黑碎片（4.5折）、血色指挥官碎片（4.5折） 30级：黑暗骑士碎片（5折）、奎爷碎片（5折）、钢铁酋长碎片（5折） | C6: 几率刷出： 1级：培养石（4折）、潜能合剂（3折）、铁人碎片（4.5折）、奇异博士碎片（4.5折）、宙斯碎片（4.5折）、阿努比斯碎片（4.5折）、小黑碎片（4.5折）、血色指挥官碎片（4.5折） 30级：黑暗骑士碎片（5折）、奎爷碎片（5折）、钢铁酋长碎片（5折） | D6: 注：定制版才有红品碎片刷出
B7: 格子左3 | C7: 格子右3
B8: 几率刷出： 灵性精粹（4.5折）、炼狱灵龙碎片（5折）、花之妖精碎片（5折）、希望之心（4折）、烈焰结晶（4折）、深海之泪（4折）、大地核心（4折）、妖魅花种（4折） | C8: 几率刷出： 灵性精粹（4.5折）、炼狱灵龙碎片（5折）、花之妖精碎片（5折）、希望之心（4折）、烈焰结晶（4折）、深海之泪（4折）、大地核心（4折）、妖魅花种（4折） | D8: 注：等后期精灵数量足够之后，灵性精粹折扣会下调