Sheet: 配置
A1: 服务端文件名 | B1: 服务端对应工作表号 | C1: 客户端文件名 | D1: 客户端对应工作表号 | E1: erl头部 | F1: erl内容格式 | G1: erl尾部 | H1: 客户端特殊处理
A2: king_match_stage.txt | B2: 1 | C2: config_ladder_ban.cnf|LadderDan | D2: 1 | F2: get(id) -> #$ | H2: 2=>id
A3: king_match_rank_reward.txt | B3: 2 | C3: config_ladder_king_award.cnf|LadderKingAward | D3: 2 | F3: get(id) -> #$ | H3: 2=>id
A4: king_match_season_task.txt | B4: 3 | C4: config_ladder_task.cnf|LadderTask | D4: 3 | F4: get(id) -> #$ | H4: 2=>task
A5: king_match_season_time.txt | B5: 4 | C5: config_ladder_competition_season.cnf|LadderCompetitionSeason | D5: 4 | F5: get(id) -> #$ | H5: 2=>id

Sheet: 段位配置
A1: id|stage_level | B1: name| | C1: icon| | D1: type| | E1: star| | F1: promotion_aequum|level_up_need_star | H1: |is_broadcast_leve_up | I1: is_loss|is_drop_star | J1: degrade|is_drop_stage | K1: is_the_last_stage|is_the_last_stage | L1: |matching_stage_level_list | M1: |matching_stage_rate_list | N1: promotion_award_id|promotion_reward_id_list | O1: promotion_award_num|promotion_reward_num_list | P1: first_award_id|daily_first_win_reward_id_list | Q1: first_award_num|daily_first_win_reward_num_list | R1: close_award_id|season_reward_id_list | S1: close_award_num|season_reward_num_list
A2: 不可空 | B2: 不可空 | C2: 不可空 | D2: 不可空 | E2: 可空#不需字段 | F2: 不可空 | H2: 不可空 | I2: 不可空 | J2: 不可空 | K2: 不可空 | L2: 不可空 | M2: 不可空 | N2: 可空#不需字段 | O2: 可空#不需字段 | P2: 不可空 | Q2: 不可空 | R2: 可空#不需字段 | S2: 可空#不需字段
A3: 数字 | B3: 字符串 | C3: 数字 | D3: 数字 | E3: 数字 | F3: 数字 | H3: 数字 | I3: 数字 | J3: 数字 | K3: 数字 | L3: 一维数组 | M3: 一维数组 | N3: 一维数组 | O3: 一维数组 | P3: 一维数组 | Q3: 一维数组 | R3: 一维数组 | S3: 一维数组
L4: 不定长 | M4: 不定长 | N4: 不定长 | O4: 不定长 | P4: 不定长 | Q4: 不定长 | R4: 不定长 | S4: 不定长
A6: 段位等级 | B6: 段位名 | C6: 大图标 | D6: 文字段位类型 | E6: 文字段位星级 | F6: 晋级所需星星 | H6: 是否广播升级 | I6: 失败是否掉星 | J6: 是否掉段 | K6: 是否是最后一个段位 | L6: 可匹配到段位列表 | M6: 匹配段位几率列表 | N6: 晋级奖励物品ID列表 | O6: 晋级奖励物品数量列表 | P6: 每日首胜额外奖励物品ID列表 | Q6: 每日首胜额外奖励物品数量列表 | R6: 赛季结算段位奖励物品ID列表 | S6: 赛季结算段位奖励物品数量列表
A7: 1 | B7: 青铜III | C7: 1 | D7: 1 | E7: 3 | F7: 3 | H7: 0 | I7: 0 | J7: 0 | K7: 0 | L7: 1|2 | M7: 6000|4000 | N7: 19005|10004|10003|19103 | O7: 50|30|50|10 | P7: 10004 | Q7: 30 | R7: 19005|10004|19103 | S7: 300|100|50 | T7: 钻石*300、潜能药剂*100、金币*50W
A8: 2 | B8: 青铜II | C8: 1 | D8: 1 | E8: 2 | F8: 3 | G8: =SUM(R7C[-1]:R[-1]C[-1]) -> 3 | H8: 0 | I8: 0 | J8: 0 | K8: 0 | L8: 1|2|3 | M8: 2000|6000|2000 | N8: 19005|10004|10003|19103 | O8: 50|30|50|10 | P8: 10004 | Q8: 30 | R8: 19005|10004|19103 | S8: 300|100|50 | T8: 钻石*300、潜能药剂*100、金币*50W
A9: 3 | B9: 青铜I | C9: 1 | D9: 1 | E9: 1 | F9: 3 | G9: =SUM(R7C[-1]:R[-1]C[-1]) -> 6 | H9: 0 | I9: 0 | J9: 0 | K9: 0 | L9: 2|3|4 | M9: 2000|6000|2000 | N9: 19005|10004|10003|19103 | O9: 75|40|60|15 | P9: 10004 | Q9: 30 | R9: 19005|10004|19103 | S9: 300|100|50 | T9: 钻石*300、潜能药剂*100、金币*50W
A10: 4 | B10: 白银III | C10: 2 | D10: 2 | E10: 3 | F10: 3 | G10: =SUM(R7C[-1]:R[-1]C[-1]) -> 9 | H10: 1 | I10: 1 | J10: 0 | K10: 0 | L10: 3|4|5 | M10: 2000|6000|2000 | N10: 19005|10004|10003|19103 | O10: 75|40|60|15 | P10: 10004 | Q10: 40 | R10: 19005|10004|19103 | S10: 350|120|100 | T10: 钻石*350、潜能药剂*120、金币*100W
A11: 5 | B11: 白银II | C11: 2 | D11: 2 | E11: 2 | F11: 3 | G11: =SUM(R7C[-1]:R[-1]C[-1]) -> 12 | H11: 0 | I11: 1 | J11: 0 | K11: 0 | L11: 4|5|6 | M11: 2000|6000|2000 | N11: 19005|10004|10003|19103 | O11: 75|40|60|15 | P11: 10004 | Q11: 40 | R11: 19005|10004|19103 | S11: 350|120|100 | T11: 钻石*350、潜能药剂*120、金币*100W
A12: 6 | B12: 白银I | C12: 2 | D12: 2 | E12: 1 | F12: 3 | G12: =SUM(R7C[-1]:R[-1]C[-1]) -> 15 | H12: 0 | I12: 1 | J12: 0 | K12: 0 | L12: 5|6|7 | M12: 2000|6000|2000 | N12: 19005|10004|10003|19103 | O12: 100|50|70|20 | P12: 10004 | Q12: 40 | R12: 19005|10004|19103 | S12: 350|120|100 | T12: 钻石*350、潜能药剂*120、金币*100W
A13: 7 | B13: 黄金III | C13: 3 | D13: 3 | E13: 3 | F13: 4 | G13: =SUM(R7C[-1]:R[-1]C[-1]) -> 18 | H13: 1 | I13: 1 | J13: 0 | K13: 0 | L13: 6|7|8 | M13: 3000|6000|1000 | N13: 19005|10004|10003|19103 | O13: 100|50|70|20 | P13: 10004 | Q13: 50 | R13: 19005|10004|19103 | S13: 400|150|150 | T13: 钻石*400、潜能药剂*150、金币*150W
A14: 8 | B14: 黄金II | C14: 3 | D14: 3 | E14: 2 | F14: 4 | G14: =SUM(R7C[-1]:R[-1]C[-1]) -> 22 | H14: 0 | I14: 1 | J14: 1 | K14: 0 | L14: 7|8|9 | M14: 3000|6000|1000 | N14: 19005|10004|10003|19103 | O14: 100|50|70|20 | P14: 10004 | Q14: 50 | R14: 19005|10004|19103 | S14: 400|150|150 | T14: 钻石*400、潜能药剂*150、金币*150W
A15: 9 | B15: 黄金I | C15: 3 | D15: 3 | E15: 1 | F15: 4 | G15: =SUM(R7C[-1]:R[-1]C[-1]) -> 26 | H15: 0 | I15: 1 | J15: 1 | K15: 0 | L15: 8|9|10 | M15: 3000|6000|1000 | N15: 19005|10004|10003|19103 | O15: 150|60|80|30 | P15: 10004 | Q15: 50 | R15: 19005|10004|19103 | S15: 400|150|150 | T15: 钻石*400、潜能药剂*150、金币*150W
A16: 10 | B16: 铂金V | C16: 4 | D16: 4 | E16: 5 | F16: 4 | G16: =SUM(R7C[-1]:R[-1]C[-1]) -> 30 | H16: 1 | I16: 1 | J16: 0 | K16: 0 | L16: 8|9|10|11 | M16: 1000|2000|6000|1000 | N16: 19005|10004|10003|19103 | O16: 150|60|80|30 | P16: 10004 | Q16: 60 | R16: 19005|10004|19103 | S16: 500|200|200 | T16: 钻石*500、潜能药剂*200、金币*200W
A17: 11 | B17: 铂金IV | C17: 4 | D17: 4 | E17: 4 | F17: 4 | G17: =SUM(R7C[-1]:R[-1]C[-1]) -> 34 | H17: 0 | I17: 1 | J17: 1 | K17: 0 | L17: 9|10|11|12 | M17: 1500|1500|6000|1000 | N17: 19005|10004|10003|19103 | O17: 150|60|80|30 | P17: 10004 | Q17: 60 | R17: 19005|10004|19103 | S17: 500|200|200 | T17: 钻石*500、潜能药剂*200、金币*200W
A18: 12 | B18: 铂金III | C18: 4 | D18: 4 | E18: 3 | F18: 4 | G18: =SUM(R7C[-1]:R[-1]C[-1]) -> 38 | H18: 0 | I18: 1 | J18: 1 | K18: 0 | L18: 10|11|12|13 | M18: 1500|1500|6000|1000 | N18: 19005|10004|10003|19103 | O18: 150|60|80|30 | P18: 10004 | Q18: 60 | R18: 19005|10004|19103 | S18: 500|200|200 | T18: 钻石*500、潜能药剂*200、金币*200W
A19: 13 | B19: 铂金II | C19: 4 | D19: 4 | E19: 2 | F19: 4 | G19: =SUM(R7C[-1]:R[-1]C[-1]) -> 42 | H19: 0 | I19: 1 | J19: 1 | K19: 0 | L19: 11|12|13|14 | M19: 1500|1500|6000|1000 | N19: 19005|10004|10003|19103 | O19: 150|60|80|30 | P19: 10004 | Q19: 60 | R19: 19005|10004|19103 | S19: 500|200|200 | T19: 钻石*500、潜能药剂*200、金币*200W
A20: 14 | B20: 铂金I | C20: 4 | D20: 4 | E20: 1 | F20: 4 | G20: =SUM(R7C[-1]:R[-1]C[-1]) -> 46 | H20: 0 | I20: 1 | J20: 1 | K20: 0 | L20: 12|13|14|15 | M20: 1500|1500|6000|1000 | N20: 19005|10004|10003|19103 | O20: 200|80|100|40 | P20: 10004 | Q20: 60 | R20: 19005|10004|19103 | S20: 500|200|200 | T20: 钻石*500、潜能药剂*200、金币*200W
A21: 15 | B21: 钻石V | C21: 5 | D21: 5 | E21: 5 | F21: 5 | G21: =SUM(R7C[-1]:R[-1]C[-1]) -> 50 | H21: 1 | I21: 1 | J21: 0 | K21: 0 | L21: 13|14|15|16 | M21: 1500|1500|6000|1000 | N21: 19005|10004|10003|19103 | O21: 200|80|100|40 | P21: 10004 | Q21: 70 | R21: 19005|10004|19103 | S21: 600|250|250 | T21: 钻石*600、潜能药剂*250、金币*250W
A22: 16 | B22: 钻石IV | C22: 5 | D22: 5 | E22: 4 | F22: 5 | G22: =SUM(R7C[-1]:R[-1]C[-1]) -> 55 | H22: 1 | I22: 1 | J22: 1 | K22: 0 | L22: 14|15|16|17 | M22: 1500|1500|6000|1000 | N22: 19005|10004|10003|19103 | O22: 200|80|100|40 | P22: 10004 | Q22: 70 | R22: 19005|10004|19103 | S22: 600|250|250 | T22: 钻石*600、潜能药剂*250、金币*250W
A23: 17 | B23: 钻石III | C23: 5 | D23: 5 | E23: 3 | F23: 5 | G23: =SUM(R7C[-1]:R[-1]C[-1]) -> 60 | H23: 1 | I23: 1 | J23: 1 | K23: 0 | L23: 15|16|17|18 | M23: 1500|1500|6000|1000 | N23: 19005|10004|10003|19103 | O23: 200|80|100|40 | P23: 10004 | Q23: 70 | R23: 19005|10004|19103 | S23: 600|250|250 | T23: 钻石*600、潜能药剂*250、金币*250W
A24: 18 | B24: 钻石II | C24: 5 | D24: 5 | E24: 2 | F24: 5 | G24: =SUM(R7C[-1]:R[-1]C[-1]) -> 65 | H24: 1 | I24: 1 | J24: 1 | K24: 0 | L24: 16|17|18|19 | M24: 1500|1500|6000|1000 | N24: 19005|10004|10003|19103 | O24: 200|80|100|40 | P24: 10004 | Q24: 70 | R24: 19005|10004|19103 | S24: 600|250|250 | T24: 钻石*600、潜能药剂*250、金币*250W
A25: 19 | B25: 钻石I | C25: 5 | D25: 5 | E25: 1 | F25: 5 | G25: =SUM(R7C[-1]:R[-1]C[-1]) -> 70 | H25: 1 | I25: 1 | J25: 1 | K25: 0 | L25: 17|18|19|20 | M25: 1500|1500|6000|1000 | N25: 19005|10004|10003|19103 | O25: 300|100|150|50 | P25: 10004 | Q25: 70 | R25: 19005|10004|19103 | S25: 600|250|250 | T25: 钻石*600、潜能药剂*250、金币*250W
A26: 20 | B26: 大师V | C26: 6 | D26: 6 | E26: 5 | F26: 5 | G26: =SUM(R7C[-1]:R[-1]C[-1]) -> 75 | H26: 1 | I26: 1 | J26: 0 | K26: 0 | L26: 18|19|20|21 | M26: 1500|1500|6000|1000 | N26: 19005|10004|10003|19103 | O26: 300|100|150|50 | P26: 10004 | Q26: 80 | R26: 19005|10004|19103 | S26: 800|300|300 | T26: 钻石*800、潜能药剂*300、金币*300W
A27: 21 | B27: 大师IV | C27: 6 | D27: 6 | E27: 4 | F27: 5 | G27: =SUM(R7C[-1]:R[-1]C[-1]) -> 80 | H27: 1 | I27: 1 | J27: 1 | K27: 0 | L27: 19|20|21|22 | M27: 1500|1500|6000|1000 | N27: 19005|10004|10003|19103 | O27: 300|100|150|50 | P27: 10004 | Q27: 80 | R27: 19005|10004|19103 | S27: 800|300|300 | T27: 钻石*800、潜能药剂*300、金币*300W
A28: 22 | B28: 大师III | C28: 6 | D28: 6 | E28: 3 | F28: 5 | G28: =SUM(R7C[-1]:R[-1]C[-1]) -> 85 | H28: 1 | I28: 1 | J28: 1 | K28: 0 | L28: 20|21|22|23 | M28: 1500|1500|6000|1000 | N28: 19005|10004|10003|19103 | O28: 300|100|150|50 | P28: 10004 | Q28: 80 | R28: 19005|10004|19103 | S28: 800|300|300 | T28: 钻石*800、潜能药剂*300、金币*300W
A29: 23 | B29: 大师II | C29: 6 | D29: 6 | E29: 2 | F29: 5 | G29: =SUM(R7C[-1]:R[-1]C[-1]) -> 90 | H29: 1 | I29: 1 | J29: 1 | K29: 0 | L29: 21|22|23|24 | M29: 1000|1000|6000|2000 | N29: 19005|10004|10003|19103 | O29: 300|100|150|50 | P29: 10004 | Q29: 80 | R29: 19005|10004|19103 | S29: 800|300|300 | T29: 钻石*800、潜能药剂*300、金币*300W
A30: 24 | B30: 大师I | C30: 6 | D30: 6 | E30: 1 | F30: 5 | G30: =SUM(R7C[-1]:R[-1]C[-1]) -> 95 | H30: 1 | I30: 1 | J30: 1 | K30: 0 | L30: 22|23|24 | M30: 2000|2000|6000 | N30: 19005|10004|10003|19103 | O30: 500|150|300|200 | P30: 10004 | Q30: 80 | R30: 19005|10004|19103 | S30: 800|300|300 | T30: 钻石*800、潜能药剂*300、金币*300W
A31: 25 | B31: 王者 | C31: 7 | D31: 7 | F31: 0 | G31: =SUM(R7C[-1]:R[-1]C[-1]) -> 100 | H31: 1 | I31: 1 | J31: 0 | K31: 1 | L31: 24|25 | M31: 1000|9000 | P31: 10004 | Q31: 100

Sheet: 王者组排名奖励
A1: rank_min|rank_min | B1: rank_max|rank_max | C1: award_id|reward_id_list | D1: award_num|reward_num_list | E1: title|title_id | F1: icon| | G1: icon_star|
A2: 不可空 | B2: 不可空 | C2: 不可空 | D2: 不可空 | E2: 可空#不需字段 | F2: 不可空 | G2: 不可空
A3: 数字 | B3: 数字 | C3: 一维数组 | D3: 一维数组 | E3: 数字 | F3: 数字 | G3: 数字
C4: 不定长 | D4: 不定长
A6: 排名下限 | B6: 排名上限 | C6: 排名奖励物品ID列表 | D6: 排名奖励物品数量列表 | E6: 赠送的称号 | F6: 该排名显示段位 | G6: 该排名显示星级 | H6: 排名 | I6: 奖励价值 | J6: 奖励
A7: 1 | B7: 1 | C7: 13324|10022|19005|10004|19103 | D7: 3|200|1000|1000|1000 | E7: 3000 | F7: 7 | G7: 3 | H7: =RC[-7]&IF(RC[-6]=RC[-7],"","~"&RC[-6]) -> 1 | I7: =2500*3+50*200+1*1000+15*1000+10*1000 -> 43500 | J7: 任选精灵升华材料*3、灵性精粹*200、钻石*1000、潜能药剂*1000、金币*1000W
A8: =R[-1]C[1]+1 -> 2 | B8: 2 | C8: 13324|10022|19005|10004|19103 | D8: 2|180|1000|900|800 | E8: 3001 | F8: 7 | G8: 3 | H8: =RC[-7]&IF(RC[-6]=RC[-7],"","~"&RC[-6]) -> 2 | I8: =2500*2+50*180+1*1000+15*900+10*800 -> 36500 | J8: 任选精灵升华材料*2、灵性精粹*180、钻石*1000、潜能药剂*900、金币*800W
A9: =R[-1]C[1]+1 -> 3 | B9: 3 | C9: 13324|10022|19005|10004|19103 | D9: 2|150|1000|800|600 | E9: 3002 | F9: 7 | G9: 3 | H9: =RC[-7]&IF(RC[-6]=RC[-7],"","~"&RC[-6]) -> 3 | I9: =2500*2+50*150+1*1000+15*800+10*600 -> 31500 | J9: 任选精灵升华材料*2、灵性精粹*150、钻石*1000、潜能药剂*800、金币*600W
A10: =R[-1]C[1]+1 -> 4 | B10: 10 | C10: 13324|10022|19005|10004|19103 | D10: 1|120|1000|750|500 | F10: 7 | G10: 3 | H10: =RC[-7]&IF(RC[-6]=RC[-7],"","~"&RC[-6]) -> 4~10 | I10: =2500*1+50*120+1*1000+15*750+10*500 -> 25750 | J10: 任选精灵升华材料*1、灵性精粹*120、钻石*1000、潜能药剂*750、金币*500W
A11: =R[-1]C[1]+1 -> 11 | B11: 20 | C11: 19028|10022|19005|10004|19103 | D11: 1000|100|1000|700|500 | F11: 7 | G11: 3 | H11: =RC[-7]&IF(RC[-6]=RC[-7],"","~"&RC[-6]) -> 11~20 | I11: =1*1000+50*100+1*1000+15*700+10*500 -> 22500 | J11: 无尽石*1000、灵性精粹*100、钻石*1000、潜能药剂*700、金币*500W
A12: =R[-1]C[1]+1 -> 21 | B12: 50 | C12: 19028|10022|19005|10004|19103 | D12: 700|90|1000|650|500 | F12: 7 | G12: 3 | H12: =RC[-7]&IF(RC[-6]=RC[-7],"","~"&RC[-6]) -> 21~50 | I12: =1*700+50*90+1*1000+15*650+10*500 -> 20950 | J12: 无尽石*700、灵性精粹*90、钻石*1000、潜能药剂*650、金币*500W
A13: =R[-1]C[1]+1 -> 51 | B13: 100 | C13: 19028|10022|19005|10004|19103 | D13: 400|80|1000|600|500 | F13: 7 | G13: 3 | H13: =RC[-7]&IF(RC[-6]=RC[-7],"","~"&RC[-6]) -> 51~100 | I13: =1*400+50*80+1*1000+15*600+10*500 -> 19400 | J13: 无尽石*400、灵性精粹*80、钻石*1000、潜能药剂*600、金币*500W
A14: =R[-1]C[1]+1 -> 101 | B14: 200 | C14: 10022|19005|10004|19103 | D14: 80|1000|550|400 | F14: 7 | G14: 3 | H14: =RC[-7]&IF(RC[-6]=RC[-7],"","~"&RC[-6]) -> 101~200 | I14: =50*80+1*1000+15*550+10*400 -> 17250 | J14: 灵性精粹*80、钻石*1000、潜能药剂*550、金币*400W

Sheet: 赛季任务奖励
A1: task|win_times | B1: award_id|reward_id_list | C1: award_num|reward_num_list
A2: 不可空 | B2: 不可空 | C2: 不可空
A3: 数字 | B3: 一维数组 | C3: 一维数组
B4: 不定长 | C4: 不定长
A6: 累计胜利场次 | B6: 奖励物品ID列表 | C6: 奖励物品数量列表
A7: 10 | B7: 19005|19103 | C7: 50|10
A8: 20 | B8: 19005|19103 | C8: 100|20
A9: 30 | B9: 19005|19103 | C9: 150|30
A10: 50 | B10: 19005|19103 | C10: 200|40
A11: 70 | B11: 19005|19103 | C11: 250|50
A12: 100 | B12: 19005|19103 | C12: 300|100

Sheet: 赛季配置
A1: index|index | B1: start_date|start_date | C1: start_time|start_time | D1: over_date|over_date | E1: over_time|over_time
A2: 不可空 | B2: 不可空 | C2: 不可空 | D2: 不可空 | E2: 不可空
A3: 数字 | B3: 数字 | C3: 数字 | D3: 数字 | E3: 数字
A6: 赛季索引 | B6: 开始日期 | C6: 开始时间 | D6: 结束日期 | E6: 结束时间 | F6: 开始年 | G6: 开始月 | H6: 开始日 | I6: 结束年 | J6: 结束月 | K6: 结束日
A7: 1 | B7: =MID(RC[4]*10000+RC[5]*100+RC[6],1,999) -> 20181204 | C7: 1000 | D7: =MID(RC[5]*10000+RC[6]*100+RC[7],1,999) -> 20181210 | E7: 2300 | F7: 2018 | G7: 12 | H7: 4 | I7: 2018 | J7: 12 | K7: 10
A8: 2 | B8: =MID(RC[4]*10000+RC[5]*100+RC[6],1,999) -> 20181218 | C8: 1000 | D8: =MID(RC[5]*10000+RC[6]*100+RC[7],1,999) -> 20181224 | E8: 2300 | F8: 2018 | G8: 12 | H8: 18 | I8: 2018 | J8: 12 | K8: 24
A9: 3 | B9: =MID(RC[4]*10000+RC[5]*100+RC[6],1,999) -> 20181225 | C9: 1000 | D9: =MID(RC[5]*10000+RC[6]*100+RC[7],1,999) -> 20181226 | E9: 2300 | F9: 2018 | G9: 12 | H9: 25 | I9: 2018 | J9: 12 | K9: 26
A10: 4 | B10: =MID(RC[4]*10000+RC[5]*100+RC[6],1,999) -> 20190101 | C10: 1000 | D10: =MID(RC[5]*10000+RC[6]*100+RC[7],1,999) -> 20190107 | E10: 2300 | F10: 2019 | G10: 1 | H10: 1 | I10: 2019 | J10: 1 | K10: 7
A11: 5 | B11: =MID(RC[4]*10000+RC[5]*100+RC[6],1,999) -> 20190115 | C11: 1000 | D11: =MID(RC[5]*10000+RC[6]*100+RC[7],1,999) -> 20190121 | E11: 2300 | F11: 2019 | G11: 1 | H11: 15 | I11: 2019 | J11: 1 | K11: 21
A12: 6 | B12: =MID(RC[4]*10000+RC[5]*100+RC[6],1,999) -> 20190129 | C12: 1000 | D12: =MID(RC[5]*10000+RC[6]*100+RC[7],1,999) -> 20190204 | E12: 2300 | F12: 2019 | G12: 1 | H12: 29 | I12: 2019 | J12: 2 | K12: 4
A13: 7 | B13: =MID(RC[4]*10000+RC[5]*100+RC[6],1,999) -> 20190212 | C13: 1000 | D13: =MID(RC[5]*10000+RC[6]*100+RC[7],1,999) -> 20190217 | E13: 2300 | F13: 2019 | G13: 2 | H13: 12 | I13: 2019 | J13: 2 | K13: 17
A14: 8 | B14: =MID(RC[4]*10000+RC[5]*100+RC[6],1,999) -> 20190225 | C14: 1000 | D14: =MID(RC[5]*10000+RC[6]*100+RC[7],1,999) -> 20190303 | E14: 2300 | F14: 2019 | G14: 2 | H14: 25 | I14: 2019 | J14: 3 | K14: 3
A15: 9 | B15: =MID(RC[4]*10000+RC[5]*100+RC[6],1,999) -> 20190311 | C15: 1000 | D15: =MID(RC[5]*10000+RC[6]*100+RC[7],1,999) -> 20190317 | E15: 2300 | F15: 2019 | G15: 3 | H15: 11 | I15: 2019 | J15: 3 | K15: 17
A16: 10 | B16: =MID(RC[4]*10000+RC[5]*100+RC[6],1,999) -> 20190325 | C16: 1000 | D16: =MID(RC[5]*10000+RC[6]*100+RC[7],1,999) -> 20190331 | E16: 2300 | F16: 2019 | G16: 3 | H16: 25 | I16: 2019 | J16: 3 | K16: 31
A17: 11 | B17: =MID(RC[4]*10000+RC[5]*100+RC[6],1,999) -> 20190408 | C17: 1000 | D17: =MID(RC[5]*10000+RC[6]*100+RC[7],1,999) -> 20190414 | E17: 2300 | F17: 2019 | G17: 4 | H17: 8 | I17: 2019 | J17: 4 | K17: 14
A18: 12 | B18: =MID(RC[4]*10000+RC[5]*100+RC[6],1,999) -> 20190422 | C18: 1000 | D18: =MID(RC[5]*10000+RC[6]*100+RC[7],1,999) -> 20190428 | E18: 2300 | F18: 2019 | G18: 4 | H18: 22 | I18: 2019 | J18: 4 | K18: 28
A19: 13 | B19: =MID(RC[4]*10000+RC[5]*100+RC[6],1,999) -> 20190506 | C19: 1000 | D19: =MID(RC[5]*10000+RC[6]*100+RC[7],1,999) -> 20190512 | E19: 2300 | F19: 2019 | G19: 5 | H19: 6 | I19: 2019 | J19: 5 | K19: 12