Sheet: 配置
A1: 服务端文件名 | B1: 服务端对应工作表号 | C1: 客户端文件名 | D1: 客户端对应工作表号 | E1: erl头部 | F1: erl内容格式 | G1: erl尾部 | H1: 客户端特殊处理
A2: login_reward.txt | B2: 1 | C2: config_login_reward.cnf|LoginReward | D2: 1 | F2: get(days) -> #$ | H2: 2=>days

Sheet: 登录奖励
A1: days|days | B1: reward_item_id|reward_item_id | C1: reward_item_num|reward_item_num | D1: extra|
A2: 不可空 | B2: 不可空 | C2: 不可空 | D2: 可空#不需字段
A3: 数字 | B3: 一维数组 | C3: 一维数组 | D3: 字符串
B4: 不定长 | C4: 不定长
A6: 登录天数 | B6: 奖励的物品ID | C6: 奖励的物品数量 | D6: 额外配置 | E6: 天数 | F6: 钻石 | G6: VIP经验 | H6: 总钻石 | I6: 总VIP | J6: VIP等级 | L6: VIP经验 | M6: VIP等级
A7: 1 | B7: 19005|19021 | C7: =RC[3]&"|"&RC[4] -> 100|5 | E7: 1 | F7: 100 | G7: 5 | H7: =SUM(R7C[-2]:RC[-2]) -> 100 | I7: =SUM(R7C[-2]:RC[-2]) -> 5 | L7: 0 | M7: V0 | N7: 5
A8: 2 | B8: 19005|19021 | C8: =RC[3]&"|"&RC[4] -> 200|5 | E8: 2 | F8: 200 | G8: 5 | H8: =SUM(R7C[-2]:RC[-2]) -> 300 | I8: =SUM(R7C[-2]:RC[-2]) -> 10 | J8: =IF(VLOOKUP(RC[-1],R7C12:R13C13,2,TRUE)=VLOOKUP(R[-1]C[-1],R7C12:R13C13,2,TRUE),"",VLOOKUP(RC[-1],R7C12:R13C13,2,TRUE)) ->  | L8: 60 | M8: V1 | N8: 5
A9: 3 | B9: 19005|19021 | C9: =RC[3]&"|"&RC[4] -> 300|10 | E9: 3 | F9: 300 | G9: 10 | H9: =SUM(R7C[-2]:RC[-2]) -> 600 | I9: =SUM(R7C[-2]:RC[-2]) -> 20 | J9: =IF(VLOOKUP(RC[-1],R7C12:R13C13,2,TRUE)=VLOOKUP(R[-1]C[-1],R7C12:R13C13,2,TRUE),"",VLOOKUP(RC[-1],R7C12:R13C13,2,TRUE)) ->  | L9: 300 | M9: V2 | N9: 5
A10: 4 | B10: 19005|19021 | C10: =RC[3]&"|"&RC[4] -> 400|10 | E10: 4 | F10: 400 | G10: 10 | H10: =SUM(R7C[-2]:RC[-2]) -> 1000 | I10: =SUM(R7C[-2]:RC[-2]) -> 30 | J10: =IF(VLOOKUP(RC[-1],R7C12:R13C13,2,TRUE)=VLOOKUP(R[-1]C[-1],R7C12:R13C13,2,TRUE),"",VLOOKUP(RC[-1],R7C12:R13C13,2,TRUE)) ->  | L10: 800 | M10: V3 | N10: 5
A11: 5 | B11: 19005|19021 | C11: =RC[3]&"|"&RC[4] -> 500|10 | E11: 5 | F11: 500 | G11: 10 | H11: =SUM(R7C[-2]:RC[-2]) -> 1500 | I11: =SUM(R7C[-2]:RC[-2]) -> 40 | J11: =IF(VLOOKUP(RC[-1],R7C12:R13C13,2,TRUE)=VLOOKUP(R[-1]C[-1],R7C12:R13C13,2,TRUE),"",VLOOKUP(RC[-1],R7C12:R13C13,2,TRUE)) ->  | L11: 1500 | M11: V4 | N11: 5
A12: 6 | B12: 19005|19021 | C12: =RC[3]&"|"&RC[4] -> 600|10 | E12: 6 | F12: 600 | G12: 10 | H12: =SUM(R7C[-2]:RC[-2]) -> 2100 | I12: =SUM(R7C[-2]:RC[-2]) -> 50 | J12: =IF(VLOOKUP(RC[-1],R7C12:R13C13,2,TRUE)=VLOOKUP(R[-1]C[-1],R7C12:R13C13,2,TRUE),"",VLOOKUP(RC[-1],R7C12:R13C13,2,TRUE)) ->  | L12: 3000 | M12: V5 | N12: 5
A13: 7 | B13: 19005|19021 | C13: =RC[3]&"|"&RC[4] -> 700|10 | D13: 可升级到贵宾1 | E13: 7 | F13: 700 | G13: 10 | H13: =SUM(R7C[-2]:RC[-2]) -> 2800 | I13: =SUM(R7C[-2]:RC[-2]) -> 60 | J13: =IF(VLOOKUP(RC[-1],R7C12:R13C13,2,TRUE)=VLOOKUP(R[-1]C[-1],R7C12:R13C13,2,TRUE),"",VLOOKUP(RC[-1],R7C12:R13C13,2,TRUE)) -> V1 | K13: 一周 | L13: 6000 | M13: V6 | N13: 10
A14: 9 | B14: 19005|19021 | C14: =RC[3]&"|"&RC[4] -> 800|20 | E14: 9 | F14: 800 | G14: 20 | H14: =SUM(R7C[-2]:RC[-2]) -> 3600 | I14: =SUM(R7C[-2]:RC[-2]) -> 80 | J14: =IF(VLOOKUP(RC[-1],R7C12:R13C13,2,TRUE)=VLOOKUP(R[-1]C[-1],R7C12:R13C13,2,TRUE),"",VLOOKUP(RC[-1],R7C12:R13C13,2,TRUE)) ->  | N14: 10
A15: 11 | B15: 19005|19021 | C15: =RC[3]&"|"&RC[4] -> 900|20 | E15: 11 | F15: 900 | G15: 20 | H15: =SUM(R7C[-2]:RC[-2]) -> 4500 | I15: =SUM(R7C[-2]:RC[-2]) -> 100 | J15: =IF(VLOOKUP(RC[-1],R7C12:R13C13,2,TRUE)=VLOOKUP(R[-1]C[-1],R7C12:R13C13,2,TRUE),"",VLOOKUP(RC[-1],R7C12:R13C13,2,TRUE)) ->  | N15: 10
A16: 14 | B16: 19005|19021 | C16: =RC[3]&"|"&RC[4] -> 1000|30 | E16: 14 | F16: 1000 | G16: 30 | H16: =SUM(R7C[-2]:RC[-2]) -> 5500 | I16: =SUM(R7C[-2]:RC[-2]) -> 130 | J16: =IF(VLOOKUP(RC[-1],R7C12:R13C13,2,TRUE)=VLOOKUP(R[-1]C[-1],R7C12:R13C13,2,TRUE),"",VLOOKUP(RC[-1],R7C12:R13C13,2,TRUE)) -> 
A17: 17 | B17: 19005|19021 | C17: =RC[3]&"|"&RC[4] -> 1100|30 | E17: 17 | F17: 1100 | G17: 30 | H17: =SUM(R7C[-2]:RC[-2]) -> 6600 | I17: =SUM(R7C[-2]:RC[-2]) -> 160 | J17: =IF(VLOOKUP(RC[-1],R7C12:R13C13,2,TRUE)=VLOOKUP(R[-1]C[-1],R7C12:R13C13,2,TRUE),"",VLOOKUP(RC[-1],R7C12:R13C13,2,TRUE)) -> 
A18: 21 | B18: 19005|19021 | C18: =RC[3]&"|"&RC[4] -> 1200|40 | E18: 21 | F18: 1200 | G18: 40 | H18: =SUM(R7C[-2]:RC[-2]) -> 7800 | I18: =SUM(R7C[-2]:RC[-2]) -> 200 | J18: =IF(VLOOKUP(RC[-1],R7C12:R13C13,2,TRUE)=VLOOKUP(R[-1]C[-1],R7C12:R13C13,2,TRUE),"",VLOOKUP(RC[-1],R7C12:R13C13,2,TRUE)) -> 
A19: 25 | B19: 19005|19021 | C19: =RC[3]&"|"&RC[4] -> 1300|40 | E19: 25 | F19: 1300 | G19: 40 | H19: =SUM(R7C[-2]:RC[-2]) -> 9100 | I19: =SUM(R7C[-2]:RC[-2]) -> 240 | J19: =IF(VLOOKUP(RC[-1],R7C12:R13C13,2,TRUE)=VLOOKUP(R[-1]C[-1],R7C12:R13C13,2,TRUE),"",VLOOKUP(RC[-1],R7C12:R13C13,2,TRUE)) ->  | N19: 12
A20: 30 | B20: 19005|19021 | C20: =RC[3]&"|"&RC[4] -> 1400|60 | D20: 可升级到贵宾2 | E20: 30 | F20: 1400 | G20: 60 | H20: =SUM(R7C[-2]:RC[-2]) -> 10500 | I20: =SUM(R7C[-2]:RC[-2]) -> 300 | J20: =IF(VLOOKUP(RC[-1],R7C12:R13C13,2,TRUE)=VLOOKUP(R[-1]C[-1],R7C12:R13C13,2,TRUE),"",VLOOKUP(RC[-1],R7C12:R13C13,2,TRUE)) -> V2 | K20: 一月 | N20: 12
A21: 35 | B21: 19005|19021 | C21: =RC[3]&"|"&RC[4] -> 1500|60 | E21: 35 | F21: 1500 | G21: 60 | H21: =SUM(R7C[-2]:RC[-2]) -> 12000 | I21: =SUM(R7C[-2]:RC[-2]) -> 360 | J21: =IF(VLOOKUP(RC[-1],R7C12:R13C13,2,TRUE)=VLOOKUP(R[-1]C[-1],R7C12:R13C13,2,TRUE),"",VLOOKUP(RC[-1],R7C12:R13C13,2,TRUE)) ->  | N21: 14
A22: 40 | B22: 19005|19021 | C22: =RC[3]&"|"&RC[4] -> 1600|80 | E22: 40 | F22: 1600 | G22: 80 | H22: =SUM(R7C[-2]:RC[-2]) -> 13600 | I22: =SUM(R7C[-2]:RC[-2]) -> 440 | J22: =IF(VLOOKUP(RC[-1],R7C12:R13C13,2,TRUE)=VLOOKUP(R[-1]C[-1],R7C12:R13C13,2,TRUE),"",VLOOKUP(RC[-1],R7C12:R13C13,2,TRUE)) ->  | N22: 14
A23: 45 | B23: 19005|19021 | C23: =RC[3]&"|"&RC[4] -> 1700|80 | E23: 45 | F23: 1700 | G23: 80 | H23: =SUM(R7C[-2]:RC[-2]) -> 15300 | I23: =SUM(R7C[-2]:RC[-2]) -> 520 | J23: =IF(VLOOKUP(RC[-1],R7C12:R13C13,2,TRUE)=VLOOKUP(R[-1]C[-1],R7C12:R13C13,2,TRUE),"",VLOOKUP(RC[-1],R7C12:R13C13,2,TRUE)) ->  | N23: 14
A24: 50 | B24: 19005|19021 | C24: =RC[3]&"|"&RC[4] -> 1800|90 | E24: 50 | F24: 1800 | G24: 90 | H24: =SUM(R7C[-2]:RC[-2]) -> 17100 | I24: =SUM(R7C[-2]:RC[-2]) -> 610 | J24: =IF(VLOOKUP(RC[-1],R7C12:R13C13,2,TRUE)=VLOOKUP(R[-1]C[-1],R7C12:R13C13,2,TRUE),"",VLOOKUP(RC[-1],R7C12:R13C13,2,TRUE)) ->  | N24: 16
A25: 55 | B25: 19005|19021 | C25: =RC[3]&"|"&RC[4] -> 1900|90 | E25: 55 | F25: 1900 | G25: 90 | H25: =SUM(R7C[-2]:RC[-2]) -> 19000 | I25: =SUM(R7C[-2]:RC[-2]) -> 700 | J25: =IF(VLOOKUP(RC[-1],R7C12:R13C13,2,TRUE)=VLOOKUP(R[-1]C[-1],R7C12:R13C13,2,TRUE),"",VLOOKUP(RC[-1],R7C12:R13C13,2,TRUE)) ->  | N25: 16
A26: 60 | B26: 19005|19021 | C26: =RC[3]&"|"&RC[4] -> 2000|100 | D26: 可升级到贵宾3 | E26: 60 | F26: 2000 | G26: 100 | H26: =SUM(R7C[-2]:RC[-2]) -> 21000 | I26: =SUM(R7C[-2]:RC[-2]) -> 800 | J26: =IF(VLOOKUP(RC[-1],R7C12:R13C13,2,TRUE)=VLOOKUP(R[-1]C[-1],R7C12:R13C13,2,TRUE),"",VLOOKUP(RC[-1],R7C12:R13C13,2,TRUE)) -> V3 | K26: 二月 | N26: 16
A27: 75 | B27: 19005|19021 | C27: =RC[3]&"|"&RC[4] -> 2100|150 | E27: 75 | F27: 2100 | G27: 150 | H27: =SUM(R7C[-2]:RC[-2]) -> 23100 | I27: =SUM(R7C[-2]:RC[-2]) -> 950 | J27: =IF(VLOOKUP(RC[-1],R7C12:R13C13,2,TRUE)=VLOOKUP(R[-1]C[-1],R7C12:R13C13,2,TRUE),"",VLOOKUP(RC[-1],R7C12:R13C13,2,TRUE)) ->  | N27: 18
A28: 90 | B28: 19005|19021 | C28: =RC[3]&"|"&RC[4] -> 2200|150 | E28: 90 | F28: 2200 | G28: 150 | H28: =SUM(R7C[-2]:RC[-2]) -> 25300 | I28: =SUM(R7C[-2]:RC[-2]) -> 1100 | J28: =IF(VLOOKUP(RC[-1],R7C12:R13C13,2,TRUE)=VLOOKUP(R[-1]C[-1],R7C12:R13C13,2,TRUE),"",VLOOKUP(RC[-1],R7C12:R13C13,2,TRUE)) ->  | N28: 18
A29: 105 | B29: 19005|19021 | C29: =RC[3]&"|"&RC[4] -> 2300|200 | E29: 105 | F29: 2300 | G29: 200 | H29: =SUM(R7C[-2]:RC[-2]) -> 27600 | I29: =SUM(R7C[-2]:RC[-2]) -> 1300 | J29: =IF(VLOOKUP(RC[-1],R7C12:R13C13,2,TRUE)=VLOOKUP(R[-1]C[-1],R7C12:R13C13,2,TRUE),"",VLOOKUP(RC[-1],R7C12:R13C13,2,TRUE)) ->  | N29: 18
A30: 120 | B30: 19005|19021 | C30: =RC[3]&"|"&RC[4] -> 2400|200 | D30: 可升级到贵宾4 | E30: 120 | F30: 2400 | G30: 200 | H30: =SUM(R7C[-2]:RC[-2]) -> 30000 | I30: =SUM(R7C[-2]:RC[-2]) -> 1500 | J30: =IF(VLOOKUP(RC[-1],R7C12:R13C13,2,TRUE)=VLOOKUP(R[-1]C[-1],R7C12:R13C13,2,TRUE),"",VLOOKUP(RC[-1],R7C12:R13C13,2,TRUE)) -> V4 | K30: 四月 | N30: 20
A31: 140 | B31: 19005|19021 | C31: =RC[3]&"|"&RC[4] -> 2500|400 | E31: 140 | F31: 2500 | G31: 400 | H31: =SUM(R7C[-2]:RC[-2]) -> 32500 | I31: =SUM(R7C[-2]:RC[-2]) -> 1900 | J31: =IF(VLOOKUP(RC[-1],R7C12:R13C13,2,TRUE)=VLOOKUP(R[-1]C[-1],R7C12:R13C13,2,TRUE),"",VLOOKUP(RC[-1],R7C12:R13C13,2,TRUE)) ->  | N31: 20
A32: 160 | B32: 19005|19021 | C32: =RC[3]&"|"&RC[4] -> 2600|500 | E32: 160 | F32: 2600 | G32: 500 | H32: =SUM(R7C[-2]:RC[-2]) -> 35100 | I32: =SUM(R7C[-2]:RC[-2]) -> 2400 | J32: =IF(VLOOKUP(RC[-1],R7C12:R13C13,2,TRUE)=VLOOKUP(R[-1]C[-1],R7C12:R13C13,2,TRUE),"",VLOOKUP(RC[-1],R7C12:R13C13,2,TRUE)) ->  | N32: 20
A33: 180 | B33: 19005|19021 | C33: =RC[3]&"|"&RC[4] -> 2700|600 | D33: 可升级到贵宾5 | E33: 180 | F33: 2700 | G33: 600 | H33: =SUM(R7C[-2]:RC[-2]) -> 37800 | I33: =SUM(R7C[-2]:RC[-2]) -> 3000 | J33: =IF(VLOOKUP(RC[-1],R7C12:R13C13,2,TRUE)=VLOOKUP(R[-1]C[-1],R7C12:R13C13,2,TRUE),"",VLOOKUP(RC[-1],R7C12:R13C13,2,TRUE)) -> V5 | K33: 六月 | N33: 20
A34: 200 | B34: 19005|19021 | C34: =RC[3]&"|"&RC[4] -> 2800|600 | E34: 200 | F34: 2800 | G34: 600 | H34: =SUM(R7C[-2]:RC[-2]) -> 40600 | I34: =SUM(R7C[-2]:RC[-2]) -> 3600 | J34: =IF(VLOOKUP(RC[-1],R7C12:R13C13,2,TRUE)=VLOOKUP(R[-1]C[-1],R7C12:R13C13,2,TRUE),"",VLOOKUP(RC[-1],R7C12:R13C13,2,TRUE)) ->  | N34: 20
A35: 230 | B35: 19005|19021 | C35: =RC[3]&"|"&RC[4] -> 2900|800 | E35: 230 | F35: 2900 | G35: 800 | H35: =SUM(R7C[-2]:RC[-2]) -> 43500 | I35: =SUM(R7C[-2]:RC[-2]) -> 4400 | J35: =IF(VLOOKUP(RC[-1],R7C12:R13C13,2,TRUE)=VLOOKUP(R[-1]C[-1],R7C12:R13C13,2,TRUE),"",VLOOKUP(RC[-1],R7C12:R13C13,2,TRUE)) ->  | N35: 20
A36: 260 | B36: 19005|19021 | C36: =RC[3]&"|"&RC[4] -> 3000|800 | E36: 260 | F36: 3000 | G36: 800 | H36: =SUM(R7C[-2]:RC[-2]) -> 46500 | I36: =SUM(R7C[-2]:RC[-2]) -> 5200 | J36: =IF(VLOOKUP(RC[-1],R7C12:R13C13,2,TRUE)=VLOOKUP(R[-1]C[-1],R7C12:R13C13,2,TRUE),"",VLOOKUP(RC[-1],R7C12:R13C13,2,TRUE)) ->  | N36: 20
A37: 300 | B37: 19005|19021 | C37: =RC[3]&"|"&RC[4] -> 3500|800 | D37: 可升级到贵宾6 | E37: 300 | F37: 3500 | G37: 800 | H37: =SUM(R7C[-2]:RC[-2]) -> 50000 | I37: =SUM(R7C[-2]:RC[-2]) -> 6000 | J37: =IF(VLOOKUP(RC[-1],R7C12:R13C13,2,TRUE)=VLOOKUP(R[-1]C[-1],R7C12:R13C13,2,TRUE),"",VLOOKUP(RC[-1],R7C12:R13C13,2,TRUE)) -> V6 | K37: 十月 | N37: 20