Sheet: 配置
A1: 服务端文件名 | B1: 服务端对应工作表号 | C1: 客户端文件名 | D1: 客户端对应工作表号 | E1: erl头部 | F1: erl内容格式 | G1: erl尾部 | H1: 客户端特殊处理
A2: endless_land_wave.txt | B2: 1 | C2: config_land_endless_wave.cnf|EndlessLandWave | D2: 1 | F2: get(wave) -> #$
A3: endless_land_rank_reward.txt | B3: 2 | C3: config_endless_land_rank_reward.cnf|EndlessLandRankReward | D3: 2 | F3: get(rank_min) -> #$
A4: endless_land_keep_kill_reward.txt | B4: 3 | C4: config_endless_land_keep_kill_reward.cnf|EndlessLandKeepKillReward | D4: 3 | F4: get(keep_kill_num) -> #$
A5: endless_land_shop.txt | B5: 4 | C5: config_endless_land_shop.cnf|EndlessLandShop | D5: 4 | F5: get(id) -> #$
A6: endless_land_collision.txt | B6: 5 | C6: config_endless_land_collision.cnf|EndlessLandCollision | D6: 5 | F6: get(id) -> #$
C7: config_endless_land_sweep.cnf|EndlessLandSweep | D7: 6 | F7: get(id) -> #$
C8: config_endless_land_tips.cnf|EndlessLandTips | D8: 7 | F8: get(id) -> #$
C9: config_endless_grade.cnf|EndlessGrade | D9: 8 | F9: get(id) -> #$
A10: endless_land_battle_cost.txt | B10: 9 | C10: config_endless_land_battle_cost.cnf|EndlessLandBattleCost | D10: 9 | F10: get(battle_times) -> #$ | H10: 2=>battle_times

Sheet: 波配置
A1: wave|wave | B1: init_wave|init_wave | C1: monster_num|monster_num | D1: endless_stone|endless_stone | E1: reward_hp_factor| | F1: monster_id_list|monster_id_list | G1: pos_1_monster_list| | H1: pos_2_monster_list| | I1: pos_3_monster_list| | J1: pos_4_monster_list| | K1: pos_5_monster_list| | L1: add_pro_type_list| | M1: add_pro_value_list| | N1: drop_item_id_list|drop_item_id_list | O1: drop_item_num_list|drop_item_num_list | P1: drop_item_rate_list|drop_item_rate_list | Q1: reward_item_id_list|reward_item_id_list | R1: reward_item_num_list|reward_item_num_list
A2: 不可空 | B2: 不可空 | C2: 不可空 | D2: 不可空 | E2: 可空#不需字段 | F2: 不可空 | G2: 可空#不需字段 | H2: 可空#不需字段 | I2: 可空#不需字段 | J2: 可空#不需字段 | K2: 可空#不需字段 | L2: 不可空 | M2: 不可空 | N2: 可空#不需字段 | O2: 可空#不需字段 | P2: 可空#不需字段 | Q2: 可空#不需字段 | R2: 可空#不需字段
A3: 数字 | B3: 数字 | C3: 数字 | D3: 数字 | E3: 数字 | F3: 一维数组 | G3: 一维数组 | H3: 一维数组 | I3: 一维数组 | J3: 一维数组 | K3: 一维数组 | L3: 一维数组 | M3: 一维数组 | N3: 一维数组 | O3: 一维数组 | P3: 一维数组 | Q3: 一维数组 | R3: 一维数组
F4: 不定长 | G4: 不定长 | H4: 不定长 | I4: 不定长 | J4: 不定长 | K4: 不定长 | L4: 不定长 | M4: 不定长 | N4: 不定长 | O4: 不定长 | P4: 不定长 | Q4: 不定长 | R4: 不定长
A6: 波 | B6: 开始时初始的波 | C6: 怪物数量 | D6: 通关获得的无尽石 | E6: 通关回复血量万分比 | F6: 怪物列表 | G6: 位置1怪物列表 | H6: 位置2怪物列表 | I6: 位置3怪物列表 | J6: 位置4怪物列表 | K6: 位置5怪物列表 | L6: 增加属性类型列表 | M6: 增加属性值列表 | N6: 掉落物品ID列表 | O6: 掉落物品数量列表 | P6: 掉落物品概率列表 | Q6: 通关奖励物品ID列表 | R6: 通关奖励物品数量列表
A7: 1 | B7: 1 | C7: 30 | D7: 20 | E7: 1000 | F7: =MOD(RC[-5]-1,3)*30+100&"|"&MOD(RC[-5]-1,3)*30+101&"|"&MOD(RC[-5]-1,3)*30+102&"|"&MOD(RC[-5]-1,3)*30+103&"|"&IF(MOD(RC[-5],4)=0,HLOOKUP(Sheet1!R2C10,Sheet1!R2C10:R7C10,MOD(RC[-5]/4-1,6)+1,FALSE),IF(MOD(RC[-5],2)=0,IF(RC[-5]>20,HLOOKUP(Sheet1!R2C7,Sheet1!R2C7:R43C7,MOD(RC[-5]/2-1,42)+1,FALSE),HLOOKUP(Sheet1!R2C4,Sheet1!R2C4:R7C4,MOD(RC[-5]-1,6)+1,FALSE)),MOD(RC[-5]-1,3)*30+104)) -> 100|101|102|103|104 | G7: =HLOOKUP(Sheet1!R2C1,Sheet1!R2C1:R16C1,MOD(RC1-1,2)+MOD(INT((RC1-1)/2),3)*5+1,FALSE)&"|"&HLOOKUP(Sheet1!R2C1,Sheet1!R2C1:R16C1,MOD(RC1,2)+MOD(INT((RC1)/2),3)*5+1,FALSE)&"|"&HLOOKUP(Sheet1!R2C1,Sheet1!R2C1:R16C1,MOD(RC1+1,2)+MOD(INT((RC1+1)/2),3)*5+1,FALSE)&"|"&HLOOKUP(Sheet1!R2C1,Sheet1!R2C1:R16C1,MOD(RC1+2,2)+MOD(INT((RC1+2)/2),3)*5+1,FALSE)&"|"&HLOOKUP(Sheet1!R2C1,Sheet1!R2C1:R16C1,MOD(RC1+3,2)+MOD(INT((RC1+3)/2),3)*5+1,FALSE) -> 100|101|130|131|160 | H7: =HLOOKUP(Sheet1!R2C1,Sheet1!R2C1:R16C1,MOD(RC1+2,2)+MOD(INT((RC1+2)/2),3)*5+1,FALSE)&"|"&HLOOKUP(Sheet1!R2C1,Sheet1!R2C1:R16C1,MOD(RC1+3,2)+MOD(INT((RC1+3)/2),3)*5+1,FALSE)&"|"&HLOOKUP(Sheet1!R2C1,Sheet1!R2C1:R16C1,MOD(RC1+4,2)+MOD(INT((RC1+4)/2),3)*5+1,FALSE)&"|"&HLOOKUP(Sheet1!R2C1,Sheet1!R2C1:R16C1,MOD(RC1+5,2)+MOD(INT((RC1+5)/2),3)*5+1,FALSE)&"|"&HLOOKUP(Sheet1!R2C1,Sheet1!R2C1:R16C1,MOD(RC1+6,2)+MOD(INT((RC1+6)/2),3)*5+1,FALSE) -> 131|160|161|100|101 | I7: =HLOOKUP(Sheet1!R2C1,Sheet1!R2C1:R16C1,MOD(RC1-1,3)+MOD(INT((RC1-1)/3),3)*5+3,FALSE)&"|"&HLOOKUP(Sheet1!R2C1,Sheet1!R2C1:R16C1,MOD(RC1,3)+MOD(INT((RC1)/3),3)*5+3,FALSE)&"|"&HLOOKUP(Sheet1!R2C1,Sheet1!R2C1:R16C1,MOD(RC1+1,3)+MOD(INT((RC1+1)/3),3)*5+3,FALSE)&"|"&HLOOKUP(Sheet1!R2C1,Sheet1!R2C1:R16C1,MOD(RC1+2,3)+MOD(INT((RC1+2)/3),3)*5+3,FALSE)&"|"&HLOOKUP(Sheet1!R2C1,Sheet1!R2C1:R16C1,MOD(RC1+3,3)+MOD(INT((RC1+3)/3),3)*5+3,FALSE) -> 102|103|104|132|133 | J7: =HLOOKUP(Sheet1!R2C1,Sheet1!R2C1:R16C1,MOD(RC1-1,3)+MOD(INT((RC1-1)/3),3)*5+3,FALSE)&"|"&HLOOKUP(Sheet1!R2C1,Sheet1!R2C1:R16C1,MOD(RC1,3)+MOD(INT((RC1)/3),3)*5+3,FALSE)&"|"&HLOOKUP(Sheet1!R2C1,Sheet1!R2C1:R16C1,MOD(RC1+1,3)+MOD(INT((RC1+1)/3),3)*5+3,FALSE)&"|"&HLOOKUP(Sheet1!R2C1,Sheet1!R2C1:R16C1,MOD(RC1+2,3)+MOD(INT((RC1+2)/3),3)*5+3,FALSE)&"|"&HLOOKUP(Sheet1!R2C1,Sheet1!R2C1:R16C1,MOD(RC1+3,3)+MOD(INT((RC1+3)/3),3)*5+3,FALSE) -> 102|103|104|132|133 | K7: =HLOOKUP(Sheet1!R2C1,Sheet1!R2C1:R16C1,MOD(RC1-1,3)+MOD(INT((RC1-1)/3),3)*5+3,FALSE)&"|"&HLOOKUP(Sheet1!R2C1,Sheet1!R2C1:R16C1,MOD(RC1,3)+MOD(INT((RC1)/3),3)*5+3,FALSE)&"|"&HLOOKUP(Sheet1!R2C1,Sheet1!R2C1:R16C1,MOD(RC1+1,3)+MOD(INT((RC1+1)/3),3)*5+3,FALSE)&"|"&HLOOKUP(Sheet1!R2C1,Sheet1!R2C1:R16C1,MOD(RC1+2,3)+MOD(INT((RC1+2)/3),3)*5+3,FALSE)&"|"&HLOOKUP(Sheet1!R2C1,Sheet1!R2C1:R16C1,MOD(RC1+3,3)+MOD(INT((RC1+3)/3),3)*5+3,FALSE) -> 102|103|104|132|133 | L7: 25|22|23|24 | M7: 0|0|0|0 | N7: 10030|10031|10032|10033 | O7: 1|1|1|1 | P7: 2500|2500|2500|2500
A8: 2 | B8: 1 | C8: 30 | D8: 20 | E8: 1000 | F8: =MOD(RC[-5]-1,3)*30+100&"|"&MOD(RC[-5]-1,3)*30+101&"|"&MOD(RC[-5]-1,3)*30+102&"|"&MOD(RC[-5]-1,3)*30+103&"|"&IF(MOD(RC[-5],4)=0,HLOOKUP(Sheet1!R2C10,Sheet1!R2C10:R7C10,MOD(RC[-5]/4-1,6)+1,FALSE),IF(MOD(RC[-5],2)=0,IF(RC[-5]>20,HLOOKUP(Sheet1!R2C7,Sheet1!R2C7:R43C7,MOD(RC[-5]/2-1,42)+1,FALSE),HLOOKUP(Sheet1!R2C4,Sheet1!R2C4:R7C4,MOD(RC[-5]-1,6)+1,FALSE)),MOD(RC[-5]-1,3)*30+104)) -> 130|131|132|133|111 | G8: =HLOOKUP(Sheet1!R2C1,Sheet1!R2C1:R16C1,MOD(RC1-1,2)+MOD(INT((RC1-1)/2),3)*5+1,FALSE)&"|"&HLOOKUP(Sheet1!R2C1,Sheet1!R2C1:R16C1,MOD(RC1,2)+MOD(INT((RC1)/2),3)*5+1,FALSE)&"|"&HLOOKUP(Sheet1!R2C1,Sheet1!R2C1:R16C1,MOD(RC1+1,2)+MOD(INT((RC1+1)/2),3)*5+1,FALSE)&"|"&HLOOKUP(Sheet1!R2C1,Sheet1!R2C1:R16C1,MOD(RC1+2,2)+MOD(INT((RC1+2)/2),3)*5+1,FALSE)&"|"&HLOOKUP(Sheet1!R2C1,Sheet1!R2C1:R16C1,MOD(RC1+3,2)+MOD(INT((RC1+3)/2),3)*5+1,FALSE) -> 101|130|131|160|161 | H8: =HLOOKUP(Sheet1!R2C1,Sheet1!R2C1:R16C1,MOD(RC1+2,2)+MOD(INT((RC1+2)/2),3)*5+1,FALSE)&"|"&HLOOKUP(Sheet1!R2C1,Sheet1!R2C1:R16C1,MOD(RC1+3,2)+MOD(INT((RC1+3)/2),3)*5+1,FALSE)&"|"&HLOOKUP(Sheet1!R2C1,Sheet1!R2C1:R16C1,MOD(RC1+4,2)+MOD(INT((RC1+4)/2),3)*5+1,FALSE)&"|"&HLOOKUP(Sheet1!R2C1,Sheet1!R2C1:R16C1,MOD(RC1+5,2)+MOD(INT((RC1+5)/2),3)*5+1,FALSE)&"|"&HLOOKUP(Sheet1!R2C1,Sheet1!R2C1:R16C1,MOD(RC1+6,2)+MOD(INT((RC1+6)/2),3)*5+1,FALSE) -> 160|161|100|101|130 | I8: =HLOOKUP(Sheet1!R2C1,Sheet1!R2C1:R16C1,MOD(RC1-1,3)+MOD(INT((RC1-1)/3),3)*5+3,FALSE)&"|"&HLOOKUP(Sheet1!R2C1,Sheet1!R2C1:R16C1,MOD(RC1,3)+MOD(INT((RC1)/3),3)*5+3,FALSE)&"|"&HLOOKUP(Sheet1!R2C1,Sheet1!R2C1:R16C1,MOD(RC1+1,3)+MOD(INT((RC1+1)/3),3)*5+3,FALSE)&"|"&HLOOKUP(Sheet1!R2C1,Sheet1!R2C1:R16C1,MOD(RC1+2,3)+MOD(INT((RC1+2)/3),3)*5+3,FALSE)&"|"&HLOOKUP(Sheet1!R2C1,Sheet1!R2C1:R16C1,MOD(RC1+3,3)+MOD(INT((RC1+3)/3),3)*5+3,FALSE) -> 103|104|132|133|134 | J8: =HLOOKUP(Sheet1!R2C1,Sheet1!R2C1:R16C1,MOD(RC1-1,3)+MOD(INT((RC1-1)/3),3)*5+3,FALSE)&"|"&HLOOKUP(Sheet1!R2C1,Sheet1!R2C1:R16C1,MOD(RC1,3)+MOD(INT((RC1)/3),3)*5+3,FALSE)&"|"&HLOOKUP(Sheet1!R2C1,Sheet1!R2C1:R16C1,MOD(RC1+1,3)+MOD(INT((RC1+1)/3),3)*5+3,FALSE)&"|"&HLOOKUP(Sheet1!R2C1,Sheet1!R2C1:R16C1,MOD(RC1+2,3)+MOD(INT((RC1+2)/3),3)*5+3,FALSE)&"|"&HLOOKUP(Sheet1!R2C1,Sheet1!R2C1:R16C1,MOD(RC1+3,3)+MOD(INT((RC1+3)/3),3)*5+3,FALSE) -> 103|104|132|133|134 | K8: =HLOOKUP(Sheet1!R2C1,Sheet1!R2C1:R16C1,MOD(RC1-1,3)+MOD(INT((RC1-1)/3),3)*5+3,FALSE)&"|"&HLOOKUP(Sheet1!R2C1,Sheet1!R2C1:R16C1,MOD(RC1,3)+MOD(INT((RC1)/3),3)*5+3,FALSE)&"|"&HLOOKUP(Sheet1!R2C1,Sheet1!R2C1:R16C1,MOD(RC1+1,3)+MOD(INT((RC1+1)/3),3)*5+3,FALSE)&"|"&HLOOKUP(Sheet1!R2C1,Sheet1!R2C1:R16C1,MOD(RC1+2,3)+MOD(INT((RC1+2)/3),3)*5+3,FALSE)&"|"&HLOOKUP(Sheet1!R2C1,Sheet1!R2C1:R16C1,MOD(RC1+3,3)+MOD(INT((RC1+3)/3),3)*5+3,FALSE) -> 103|104|132|133|134 | L8: 25|22|23|24 | M8: 1260|1260|1260|1260 | N8: 10030|10031|10032|10033 | O8: 1|1|1|1 | P8: 2500|2500|2500|2500
A9: 3 | B9: 1 | C9: 30 | D9: 20 | E9: 1000 | F9: =MOD(RC[-5]-1,3)*30+100&"|"&MOD(RC[-5]-1,3)*30+101&"|"&MOD(RC[-5]-1,3)*30+102&"|"&MOD(RC[-5]-1,3)*30+103&"|"&IF(MOD(RC[-5],4)=0,HLOOKUP(Sheet1!R2C10,Sheet1!R2C10:R7C10,MOD(RC[-5]/4-1,6)+1,FALSE),IF(MOD(RC[-5],2)=0,IF(RC[-5]>20,HLOOKUP(Sheet1!R2C7,Sheet1!R2C7:R43C7,MOD(RC[-5]/2-1,42)+1,FALSE),HLOOKUP(Sheet1!R2C4,Sheet1!R2C4:R7C4,MOD(RC[-5]-1,6)+1,FALSE)),MOD(RC[-5]-1,3)*30+104)) -> 160|161|162|163|164 | G9: =HLOOKUP(Sheet1!R2C1,Sheet1!R2C1:R16C1,MOD(RC1-1,2)+MOD(INT((RC1-1)/2),3)*5+1,FALSE)&"|"&HLOOKUP(Sheet1!R2C1,Sheet1!R2C1:R16C1,MOD(RC1,2)+MOD(INT((RC1)/2),3)*5+1,FALSE)&"|"&HLOOKUP(Sheet1!R2C1,Sheet1!R2C1:R16C1,MOD(RC1+1,2)+MOD(INT((RC1+1)/2),3)*5+1,FALSE)&"|"&HLOOKUP(Sheet1!R2C1,Sheet1!R2C1:R16C1,MOD(RC1+2,2)+MOD(INT((RC1+2)/2),3)*5+1,FALSE)&"|"&HLOOKUP(Sheet1!R2C1,Sheet1!R2C1:R16C1,MOD(RC1+3,2)+MOD(INT((RC1+3)/2),3)*5+1,FALSE) -> 130|131|160|161|100 | H9: =HLOOKUP(Sheet1!R2C1,Sheet1!R2C1:R16C1,MOD(RC1+2,2)+MOD(INT((RC1+2)/2),3)*5+1,FALSE)&"|"&HLOOKUP(Sheet1!R2C1,Sheet1!R2C1:R16C1,MOD(RC1+3,2)+MOD(INT((RC1+3)/2),3)*5+1,FALSE)&"|"&HLOOKUP(Sheet1!R2C1,Sheet1!R2C1:R16C1,MOD(RC1+4,2)+MOD(INT((RC1+4)/2),3)*5+1,FALSE)&"|"&HLOOKUP(Sheet1!R2C1,Sheet1!R2C1:R16C1,MOD(RC1+5,2)+MOD(INT((RC1+5)/2),3)*5+1,FALSE)&"|"&HLOOKUP(Sheet1!R2C1,Sheet1!R2C1:R16C1,MOD(RC1+6,2)+MOD(INT((RC1+6)/2),3)*5+1,FALSE) -> 161|100|101|130|131 | I9: =HLOOKUP(Sheet1!R2C1,Sheet1!R2C1:R16C1,MOD(RC1-1,3)+MOD(INT((RC1-1)/3),3)*5+3,FALSE)&"|"&HLOOKUP(Sheet1!R2C1,Sheet1!R2C1:R16C1,MOD(RC1,3)+MOD(INT((RC1)/3),3)*5+3,FALSE)&"|"&HLOOKUP(Sheet1!R2C1,Sheet1!R2C1:R16C1,MOD(RC1+1,3)+MOD(INT((RC1+1)/3),3)*5+3,FALSE)&"|"&HLOOKUP(Sheet1!R2C1,Sheet1!R2C1:R16C1,MOD(RC1+2,3)+MOD(INT((RC1+2)/3),3)*5+3,FALSE)&"|"&HLOOKUP(Sheet1!R2C1,Sheet1!R2C1:R16C1,MOD(RC1+3,3)+MOD(INT((RC1+3)/3),3)*5+3,FALSE) -> 104|132|133|134|162 | J9: =HLOOKUP(Sheet1!R2C1,Sheet1!R2C1:R16C1,MOD(RC1-1,3)+MOD(INT((RC1-1)/3),3)*5+3,FALSE)&"|"&HLOOKUP(Sheet1!R2C1,Sheet1!R2C1:R16C1,MOD(RC1,3)+MOD(INT((RC1)/3),3)*5+3,FALSE)&"|"&HLOOKUP(Sheet1!R2C1,Sheet1!R2C1:R16C1,MOD(RC1+1,3)+MOD(INT((RC1+1)/3),3)*5+3,FALSE)&"|"&HLOOKUP(Sheet1!R2C1,Sheet1!R2C1:R16C1,MOD(RC1+2,3)+MOD(INT((RC1+2)/3),3)*5+3,FALSE)&"|"&HLOOKUP(Sheet1!R2C1,Sheet1!R2C1:R16C1,MOD(RC1+3,3)+MOD(INT((RC1+3)/3),3)*5+3,FALSE) -> 104|132|133|134|162 | K9: =HLOOKUP(Sheet1!R2C1,Sheet1!R2C1:R16C1,MOD(RC1-1,3)+MOD(INT((RC1-1)/3),3)*5+3,FALSE)&"|"&HLOOKUP(Sheet1!R2C1,Sheet1!R2C1:R16C1,MOD(RC1,3)+MOD(INT((RC1)/3),3)*5+3,FALSE)&"|"&HLOOKUP(Sheet1!R2C1,Sheet1!R2C1:R16C1,MOD(RC1+1,3)+MOD(INT((RC1+1)/3),3)*5+3,FALSE)&"|"&HLOOKUP(Sheet1!R2C1,Sheet1!R2C1:R16C1,MOD(RC1+2,3)+MOD(INT((RC1+2)/3),3)*5+3,FALSE)&"|"&HLOOKUP(Sheet1!R2C1,Sheet1!R2C1:R16C1,MOD(RC1+3,3)+MOD(INT((RC1+3)/3),3)*5+3,FALSE) -> 104|132|133|134|162 | L9: 25|22|23|24 | M9: 1663|1663|1663|1663 | N9: 10030|10031|10032|10033 | O9: 1|1|1|1 | P9: 2500|2500|2500|2500
A10: 4 | B10: 2 | C10: 30 | D10: 20 | E10: 1000 | F10: =MOD(RC[-5]-1,3)*30+100&"|"&MOD(RC[-5]-1,3)*30+101&"|"&MOD(RC[-5]-1,3)*30+102&"|"&MOD(RC[-5]-1,3)*30+103&"|"&IF(MOD(RC[-5],4)=0,HLOOKUP(Sheet1!R2C10,Sheet1!R2C10:R7C10,MOD(RC[-5]/4-1,6)+1,FALSE),IF(MOD(RC[-5],2)=0,IF(RC[-5]>20,HLOOKUP(Sheet1!R2C7,Sheet1!R2C7:R43C7,MOD(RC[-5]/2-1,42)+1,FALSE),HLOOKUP(Sheet1!R2C4,Sheet1!R2C4:R7C4,MOD(RC[-5]-1,6)+1,FALSE)),MOD(RC[-5]-1,3)*30+104)) -> 100|101|102|103|190 | G10: =HLOOKUP(Sheet1!R2C1,Sheet1!R2C1:R16C1,MOD(RC1-1,2)+MOD(INT((RC1-1)/2),3)*5+1,FALSE)&"|"&HLOOKUP(Sheet1!R2C1,Sheet1!R2C1:R16C1,MOD(RC1,2)+MOD(INT((RC1)/2),3)*5+1,FALSE)&"|"&HLOOKUP(Sheet1!R2C1,Sheet1!R2C1:R16C1,MOD(RC1+1,2)+MOD(INT((RC1+1)/2),3)*5+1,FALSE)&"|"&HLOOKUP(Sheet1!R2C1,Sheet1!R2C1:R16C1,MOD(RC1+2,2)+MOD(INT((RC1+2)/2),3)*5+1,FALSE)&"|"&HLOOKUP(Sheet1!R2C1,Sheet1!R2C1:R16C1,MOD(RC1+3,2)+MOD(INT((RC1+3)/2),3)*5+1,FALSE) -> 131|160|161|100|101 | H10: =HLOOKUP(Sheet1!R2C1,Sheet1!R2C1:R16C1,MOD(RC1+2,2)+MOD(INT((RC1+2)/2),3)*5+1,FALSE)&"|"&HLOOKUP(Sheet1!R2C1,Sheet1!R2C1:R16C1,MOD(RC1+3,2)+MOD(INT((RC1+3)/2),3)*5+1,FALSE)&"|"&HLOOKUP(Sheet1!R2C1,Sheet1!R2C1:R16C1,MOD(RC1+4,2)+MOD(INT((RC1+4)/2),3)*5+1,FALSE)&"|"&HLOOKUP(Sheet1!R2C1,Sheet1!R2C1:R16C1,MOD(RC1+5,2)+MOD(INT((RC1+5)/2),3)*5+1,FALSE)&"|"&HLOOKUP(Sheet1!R2C1,Sheet1!R2C1:R16C1,MOD(RC1+6,2)+MOD(INT((RC1+6)/2),3)*5+1,FALSE) -> 100|101|130|131|160 | I10: =HLOOKUP(Sheet1!R2C1,Sheet1!R2C1:R16C1,MOD(RC1-1,3)+MOD(INT((RC1-1)/3),3)*5+3,FALSE)&"|"&HLOOKUP(Sheet1!R2C1,Sheet1!R2C1:R16C1,MOD(RC1,3)+MOD(INT((RC1)/3),3)*5+3,FALSE)&"|"&HLOOKUP(Sheet1!R2C1,Sheet1!R2C1:R16C1,MOD(RC1+1,3)+MOD(INT((RC1+1)/3),3)*5+3,FALSE)&"|"&HLOOKUP(Sheet1!R2C1,Sheet1!R2C1:R16C1,MOD(RC1+2,3)+MOD(INT((RC1+2)/3),3)*5+3,FALSE)&"|"&HLOOKUP(Sheet1!R2C1,Sheet1!R2C1:R16C1,MOD(RC1+3,3)+MOD(INT((RC1+3)/3),3)*5+3,FALSE) -> 132|133|134|162|163 | J10: =HLOOKUP(Sheet1!R2C1,Sheet1!R2C1:R16C1,MOD(RC1-1,3)+MOD(INT((RC1-1)/3),3)*5+3,FALSE)&"|"&HLOOKUP(Sheet1!R2C1,Sheet1!R2C1:R16C1,MOD(RC1,3)+MOD(INT((RC1)/3),3)*5+3,FALSE)&"|"&HLOOKUP(Sheet1!R2C1,Sheet1!R2C1:R16C1,MOD(RC1+1,3)+MOD(INT((RC1+1)/3),3)*5+3,FALSE)&"|"&HLOOKUP(Sheet1!R2C1,Sheet1!R2C1:R16C1,MOD(RC1+2,3)+MOD(INT((RC1+2)/3),3)*5+3,FALSE)&"|"&HLOOKUP(Sheet1!R2C1,Sheet1!R2C1:R16C1,MOD(RC1+3,3)+MOD(INT((RC1+3)/3),3)*5+3,FALSE) -> 132|133|134|162|163 | K10: =HLOOKUP(Sheet1!R2C1,Sheet1!R2C1:R16C1,MOD(RC1-1,3)+MOD(INT((RC1-1)/3),3)*5+3,FALSE)&"|"&HLOOKUP(Sheet1!R2C1,Sheet1!R2C1:R16C1,MOD(RC1,3)+MOD(INT((RC1)/3),3)*5+3,FALSE)&"|"&HLOOKUP(Sheet1!R2C1,Sheet1!R2C1:R16C1,MOD(RC1+1,3)+MOD(INT((RC1+1)/3),3)*5+3,FALSE)&"|"&HLOOKUP(Sheet1!R2C1,Sheet1!R2C1:R16C1,MOD(RC1+2,3)+MOD(INT((RC1+2)/3),3)*5+3,FALSE)&"|"&HLOOKUP(Sheet1!R2C1,Sheet1!R2C1:R16C1,MOD(RC1+3,3)+MOD(INT((RC1+3)/3),3)*5+3,FALSE) -> 132|133|134|162|163 | L10: 25|22|23|24 | M10: 2024|2024|2025|2025 | N10: 10030|10031|10032|10033 | O10: 1|1|1|1 | P10: 2500|2500|2500|2500
A11: 5 | B11: 3 | C11: 30 | D11: 20 | E11: 1000 | F11: =MOD(RC[-5]-1,3)*30+100&"|"&MOD(RC[-5]-1,3)*30+101&"|"&MOD(RC[-5]-1,3)*30+102&"|"&MOD(RC[-5]-1,3)*30+103&"|"&IF(MOD(RC[-5],4)=0,HLOOKUP(Sheet1!R2C10,Sheet1!R2C10:R7C10,MOD(RC[-5]/4-1,6)+1,FALSE),IF(MOD(RC[-5],2)=0,IF(RC[-5]>20,HLOOKUP(Sheet1!R2C7,Sheet1!R2C7:R43C7,MOD(RC[-5]/2-1,42)+1,FALSE),HLOOKUP(Sheet1!R2C4,Sheet1!R2C4:R7C4,MOD(RC[-5]-1,6)+1,FALSE)),MOD(RC[-5]-1,3)*30+104)) -> 130|131|132|133|134 | G11: =HLOOKUP(Sheet1!R2C1,Sheet1!R2C1:R16C1,MOD(RC1-1,2)+MOD(INT((RC1-1)/2),3)*5+1,FALSE)&"|"&HLOOKUP(Sheet1!R2C1,Sheet1!R2C1:R16C1,MOD(RC1,2)+MOD(INT((RC1)/2),3)*5+1,FALSE)&"|"&HLOOKUP(Sheet1!R2C1,Sheet1!R2C1:R16C1,MOD(RC1+1,2)+MOD(INT((RC1+1)/2),3)*5+1,FALSE)&"|"&HLOOKUP(Sheet1!R2C1,Sheet1!R2C1:R16C1,MOD(RC1+2,2)+MOD(INT((RC1+2)/2),3)*5+1,FALSE)&"|"&HLOOKUP(Sheet1!R2C1,Sheet1!R2C1:R16C1,MOD(RC1+3,2)+MOD(INT((RC1+3)/2),3)*5+1,FALSE) -> 160|161|100|101|130 | H11: =HLOOKUP(Sheet1!R2C1,Sheet1!R2C1:R16C1,MOD(RC1+2,2)+MOD(INT((RC1+2)/2),3)*5+1,FALSE)&"|"&HLOOKUP(Sheet1!R2C1,Sheet1!R2C1:R16C1,MOD(RC1+3,2)+MOD(INT((RC1+3)/2),3)*5+1,FALSE)&"|"&HLOOKUP(Sheet1!R2C1,Sheet1!R2C1:R16C1,MOD(RC1+4,2)+MOD(INT((RC1+4)/2),3)*5+1,FALSE)&"|"&HLOOKUP(Sheet1!R2C1,Sheet1!R2C1:R16C1,MOD(RC1+5,2)+MOD(INT((RC1+5)/2),3)*5+1,FALSE)&"|"&HLOOKUP(Sheet1!R2C1,Sheet1!R2C1:R16C1,MOD(RC1+6,2)+MOD(INT((RC1+6)/2),3)*5+1,FALSE) -> 101|130|131|160|161 | I11: =HLOOKUP(Sheet1!R2C1,Sheet1!R2C1:R16C1,MOD(RC1-1,3)+MOD(INT((RC1-1)/3),3)*5+3,FALSE)&"|"&HLOOKUP(Sheet1!R2C1,Sheet1!R2C1:R16C1,MOD(RC1,3)+MOD(INT((RC1)/3),3)*5+3,FALSE)&"|"&HLOOKUP(Sheet1!R2C1,Sheet1!R2C1:R16C1,MOD(RC1+1,3)+MOD(INT((RC1+1)/3),3)*5+3,FALSE)&"|"&HLOOKUP(Sheet1!R2C1,Sheet1!R2C1:R16C1,MOD(RC1+2,3)+MOD(INT((RC1+2)/3),3)*5+3,FALSE)&"|"&HLOOKUP(Sheet1!R2C1,Sheet1!R2C1:R16C1,MOD(RC1+3,3)+MOD(INT((RC1+3)/3),3)*5+3,FALSE) -> 133|134|162|163|164 | J11: =HLOOKUP(Sheet1!R2C1,Sheet1!R2C1:R16C1,MOD(RC1-1,3)+MOD(INT((RC1-1)/3),3)*5+3,FALSE)&"|"&HLOOKUP(Sheet1!R2C1,Sheet1!R2C1:R16C1,MOD(RC1,3)+MOD(INT((RC1)/3),3)*5+3,FALSE)&"|"&HLOOKUP(Sheet1!R2C1,Sheet1!R2C1:R16C1,MOD(RC1+1,3)+MOD(INT((RC1+1)/3),3)*5+3,FALSE)&"|"&HLOOKUP(Sheet1!R2C1,Sheet1!R2C1:R16C1,MOD(RC1+2,3)+MOD(INT((RC1+2)/3),3)*5+3,FALSE)&"|"&HLOOKUP(Sheet1!R2C1,Sheet1!R2C1:R16C1,MOD(RC1+3,3)+MOD(INT((RC1+3)/3),3)*5+3,FALSE) -> 133|134|162|163|164 | K11: =HLOOKUP(Sheet1!R2C1,Sheet1!R2C1:R16C1,MOD(RC1-1,3)+MOD(INT((RC1-1)/3),3)*5+3,FALSE)&"|"&HLOOKUP(Sheet1!R2C1,Sheet1!R2C1:R16C1,MOD(RC1,3)+MOD(INT((RC1)/3),3)*5+3,FALSE)&"|"&HLOOKUP(Sheet1!R2C1,Sheet1!R2C1:R16C1,MOD(RC1+1,3)+MOD(INT((RC1+1)/3),3)*5+3,FALSE)&"|"&HLOOKUP(Sheet1!R2C1,Sheet1!R2C1:R16C1,MOD(RC1+2,3)+MOD(INT((RC1+2)/3),3)*5+3,FALSE)&"|"&HLOOKUP(Sheet1!R2C1,Sheet1!R2C1:R16C1,MOD(RC1+3,3)+MOD(INT((RC1+3)/3),3)*5+3,FALSE) -> 133|134|162|163|164 | L11: 25|22|23|24 | M11: 2329|2329|2330|2330 | N11: 10030|10031|10032|10033|10030|10031|10032|10033|10030|10031|10032|10033|10030|10031|10032|10033|10030|10031|10032|10033|10030|10031|10032|10033|10030|10031|10032|10033|10030|10031|10032|10033|10030|10031|10032|10033|10030|10031|10032|10033 | O11: 1|1|1|1|1|1|1|1|1|1|1|1|1|1|1|1|1|1|1|1|1|1|1|1|1|1|1|1|1|1|1|1|1|1|1|1|1|1|1|1 | P11: 5000|5000|5000|5000|5000|5000|5000|5000|5000|5000|5000|5000|5000|5000|5000|5000|5000|5000|5000|5000|5000|5000|5000|5000|5000|5000|5000|5000|5000|5000|5000|5000|5000|5000|5000|5000|5000|5000|5000|5000
A12: 6 | B12: 4 | C12: 30 | D12: 20 | E12: 1000 | F12: =MOD(RC[-5]-1,3)*30+100&"|"&MOD(RC[-5]-1,3)*30+101&"|"&MOD(RC[-5]-1,3)*30+102&"|"&MOD(RC[-5]-1,3)*30+103&"|"&IF(MOD(RC[-5],4)=0,HLOOKUP(Sheet1!R2C10,Sheet1!R2C10:R7C10,MOD(RC[-5]/4-1,6)+1,FALSE),IF(MOD(RC[-5],2)=0,IF(RC[-5]>20,HLOOKUP(Sheet1!R2C7,Sheet1!R2C7:R43C7,MOD(RC[-5]/2-1,42)+1,FALSE),HLOOKUP(Sheet1!R2C4,Sheet1!R2C4:R7C4,MOD(RC[-5]-1,6)+1,FALSE)),MOD(RC[-5]-1,3)*30+104)) -> 160|161|162|163|171 | G12: =HLOOKUP(Sheet1!R2C1,Sheet1!R2C1:R16C1,MOD(RC1-1,2)+MOD(INT((RC1-1)/2),3)*5+1,FALSE)&"|"&HLOOKUP(Sheet1!R2C1,Sheet1!R2C1:R16C1,MOD(RC1,2)+MOD(INT((RC1)/2),3)*5+1,FALSE)&"|"&HLOOKUP(Sheet1!R2C1,Sheet1!R2C1:R16C1,MOD(RC1+1,2)+MOD(INT((RC1+1)/2),3)*5+1,FALSE)&"|"&HLOOKUP(Sheet1!R2C1,Sheet1!R2C1:R16C1,MOD(RC1+2,2)+MOD(INT((RC1+2)/2),3)*5+1,FALSE)&"|"&HLOOKUP(Sheet1!R2C1,Sheet1!R2C1:R16C1,MOD(RC1+3,2)+MOD(INT((RC1+3)/2),3)*5+1,FALSE) -> 161|100|101|130|131 | H12: =HLOOKUP(Sheet1!R2C1,Sheet1!R2C1:R16C1,MOD(RC1+2,2)+MOD(INT((RC1+2)/2),3)*5+1,FALSE)&"|"&HLOOKUP(Sheet1!R2C1,Sheet1!R2C1:R16C1,MOD(RC1+3,2)+MOD(INT((RC1+3)/2),3)*5+1,FALSE)&"|"&HLOOKUP(Sheet1!R2C1,Sheet1!R2C1:R16C1,MOD(RC1+4,2)+MOD(INT((RC1+4)/2),3)*5+1,FALSE)&"|"&HLOOKUP(Sheet1!R2C1,Sheet1!R2C1:R16C1,MOD(RC1+5,2)+MOD(INT((RC1+5)/2),3)*5+1,FALSE)&"|"&HLOOKUP(Sheet1!R2C1,Sheet1!R2C1:R16C1,MOD(RC1+6,2)+MOD(INT((RC1+6)/2),3)*5+1,FALSE) -> 130|131|160|161|100 | I12: =HLOOKUP(Sheet1!R2C1,Sheet1!R2C1:R16C1,MOD(RC1-1,3)+MOD(INT((RC1-1)/3),3)*5+3,FALSE)&"|"&HLOOKUP(Sheet1!R2C1,Sheet1!R2C1:R16C1,MOD(RC1,3)+MOD(INT((RC1)/3),3)*5+3,FALSE)&"|"&HLOOKUP(Sheet1!R2C1,Sheet1!R2C1:R16C1,MOD(RC1+1,3)+MOD(INT((RC1+1)/3),3)*5+3,FALSE)&"|"&HLOOKUP(Sheet1!R2C1,Sheet1!R2C1:R16C1,MOD(RC1+2,3)+MOD(INT((RC1+2)/3),3)*5+3,FALSE)&"|"&HLOOKUP(Sheet1!R2C1,Sheet1!R2C1:R16C1,MOD(RC1+3,3)+MOD(INT((RC1+3)/3),3)*5+3,FALSE) -> 134|162|163|164|102 | J12: =HLOOKUP(Sheet1!R2C1,Sheet1!R2C1:R16C1,MOD(RC1-1,3)+MOD(INT((RC1-1)/3),3)*5+3,FALSE)&"|"&HLOOKUP(Sheet1!R2C1,Sheet1!R2C1:R16C1,MOD(RC1,3)+MOD(INT((RC1)/3),3)*5+3,FALSE)&"|"&HLOOKUP(Sheet1!R2C1,Sheet1!R2C1:R16C1,MOD(RC1+1,3)+MOD(INT((RC1+1)/3),3)*5+3,FALSE)&"|"&HLOOKUP(Sheet1!R2C1,Sheet1!R2C1:R16C1,MOD(RC1+2,3)+MOD(INT((RC1+2)/3),3)*5+3,FALSE)&"|"&HLOOKUP(Sheet1!R2C1,Sheet1!R2C1:R16C1,MOD(RC1+3,3)+MOD(INT((RC1+3)/3),3)*5+3,FALSE) -> 134|162|163|164|102 | K12: =HLOOKUP(Sheet1!R2C1,Sheet1!R2C1:R16C1,MOD(RC1-1,3)+MOD(INT((RC1-1)/3),3)*5+3,FALSE)&"|"&HLOOKUP(Sheet1!R2C1,Sheet1!R2C1:R16C1,MOD(RC1,3)+MOD(INT((RC1)/3),3)*5+3,FALSE)&"|"&HLOOKUP(Sheet1!R2C1,Sheet1!R2C1:R16C1,MOD(RC1+1,3)+MOD(INT((RC1+1)/3),3)*5+3,FALSE)&"|"&HLOOKUP(Sheet1!R2C1,Sheet1!R2C1:R16C1,MOD(RC1+2,3)+MOD(INT((RC1+2)/3),3)*5+3,FALSE)&"|"&HLOOKUP(Sheet1!R2C1,Sheet1!R2C1:R16C1,MOD(RC1+3,3)+MOD(INT((RC1+3)/3),3)*5+3,FALSE) -> 134|162|163|164|102 | L12: 25|22|23|24 | M12: 2695|2695|2695|2695 | N12: 10030|10031|10032|10033 | O12: 1|1|1|1 | P12: 2500|2500|2500|2500
A13: 7 | B13: 5 | C13: 30 | D13: 20 | E13: 1000 | F13: =MOD(RC[-5]-1,3)*30+100&"|"&MOD(RC[-5]-1,3)*30+101&"|"&MOD(RC[-5]-1,3)*30+102&"|"&MOD(RC[-5]-1,3)*30+103&"|"&IF(MOD(RC[-5],4)=0,HLOOKUP(Sheet1!R2C10,Sheet1!R2C10:R7C10,MOD(RC[-5]/4-1,6)+1,FALSE),IF(MOD(RC[-5],2)=0,IF(RC[-5]>20,HLOOKUP(Sheet1!R2C7,Sheet1!R2C7:R43C7,MOD(RC[-5]/2-1,42)+1,FALSE),HLOOKUP(Sheet1!R2C4,Sheet1!R2C4:R7C4,MOD(RC[-5]-1,6)+1,FALSE)),MOD(RC[-5]-1,3)*30+104)) -> 100|101|102|103|104 | G13: =HLOOKUP(Sheet1!R2C1,Sheet1!R2C1:R16C1,MOD(RC1-1,2)+MOD(INT((RC1-1)/2),3)*5+1,FALSE)&"|"&HLOOKUP(Sheet1!R2C1,Sheet1!R2C1:R16C1,MOD(RC1,2)+MOD(INT((RC1)/2),3)*5+1,FALSE)&"|"&HLOOKUP(Sheet1!R2C1,Sheet1!R2C1:R16C1,MOD(RC1+1,2)+MOD(INT((RC1+1)/2),3)*5+1,FALSE)&"|"&HLOOKUP(Sheet1!R2C1,Sheet1!R2C1:R16C1,MOD(RC1+2,2)+MOD(INT((RC1+2)/2),3)*5+1,FALSE)&"|"&HLOOKUP(Sheet1!R2C1,Sheet1!R2C1:R16C1,MOD(RC1+3,2)+MOD(INT((RC1+3)/2),3)*5+1,FALSE) -> 100|101|130|131|160 | H13: =HLOOKUP(Sheet1!R2C1,Sheet1!R2C1:R16C1,MOD(RC1+2,2)+MOD(INT((RC1+2)/2),3)*5+1,FALSE)&"|"&HLOOKUP(Sheet1!R2C1,Sheet1!R2C1:R16C1,MOD(RC1+3,2)+MOD(INT((RC1+3)/2),3)*5+1,FALSE)&"|"&HLOOKUP(Sheet1!R2C1,Sheet1!R2C1:R16C1,MOD(RC1+4,2)+MOD(INT((RC1+4)/2),3)*5+1,FALSE)&"|"&HLOOKUP(Sheet1!R2C1,Sheet1!R2C1:R16C1,MOD(RC1+5,2)+MOD(INT((RC1+5)/2),3)*5+1,FALSE)&"|"&HLOOKUP(Sheet1!R2C1,Sheet1!R2C1:R16C1,MOD(RC1+6,2)+MOD(INT((RC1+6)/2),3)*5+1,FALSE) -> 131|160|161|100|101 | I13: =HLOOKUP(Sheet1!R2C1,Sheet1!R2C1:R16C1,MOD(RC1-1,3)+MOD(INT((RC1-1)/3),3)*5+3,FALSE)&"|"&HLOOKUP(Sheet1!R2C1,Sheet1!R2C1:R16C1,MOD(RC1,3)+MOD(INT((RC1)/3),3)*5+3,FALSE)&"|"&HLOOKUP(Sheet1!R2C1,Sheet1!R2C1:R16C1,MOD(RC1+1,3)+MOD(INT((RC1+1)/3),3)*5+3,FALSE)&"|"&HLOOKUP(Sheet1!R2C1,Sheet1!R2C1:R16C1,MOD(RC1+2,3)+MOD(INT((RC1+2)/3),3)*5+3,FALSE)&"|"&HLOOKUP(Sheet1!R2C1,Sheet1!R2C1:R16C1,MOD(RC1+3,3)+MOD(INT((RC1+3)/3),3)*5+3,FALSE) -> 162|163|164|102|103 | J13: =HLOOKUP(Sheet1!R2C1,Sheet1!R2C1:R16C1,MOD(RC1-1,3)+MOD(INT((RC1-1)/3),3)*5+3,FALSE)&"|"&HLOOKUP(Sheet1!R2C1,Sheet1!R2C1:R16C1,MOD(RC1,3)+MOD(INT((RC1)/3),3)*5+3,FALSE)&"|"&HLOOKUP(Sheet1!R2C1,Sheet1!R2C1:R16C1,MOD(RC1+1,3)+MOD(INT((RC1+1)/3),3)*5+3,FALSE)&"|"&HLOOKUP(Sheet1!R2C1,Sheet1!R2C1:R16C1,MOD(RC1+2,3)+MOD(INT((RC1+2)/3),3)*5+3,FALSE)&"|"&HLOOKUP(Sheet1!R2C1,Sheet1!R2C1:R16C1,MOD(RC1+3,3)+MOD(INT((RC1+3)/3),3)*5+3,FALSE) -> 162|163|164|102|103 | K13: =HLOOKUP(Sheet1!R2C1,Sheet1!R2C1:R16C1,MOD(RC1-1,3)+MOD(INT((RC1-1)/3),3)*5+3,FALSE)&"|"&HLOOKUP(Sheet1!R2C1,Sheet1!R2C1:R16C1,MOD(RC1,3)+MOD(INT((RC1)/3),3)*5+3,FALSE)&"|"&HLOOKUP(Sheet1!R2C1,Sheet1!R2C1:R16C1,MOD(RC1+1,3)+MOD(INT((RC1+1)/3),3)*5+3,FALSE)&"|"&HLOOKUP(Sheet1!R2C1,Sheet1!R2C1:R16C1,MOD(RC1+2,3)+MOD(INT((RC1+2)/3),3)*5+3,FALSE)&"|"&HLOOKUP(Sheet1!R2C1,Sheet1!R2C1:R16C1,MOD(RC1+3,3)+MOD(INT((RC1+3)/3),3)*5+3,FALSE) -> 162|163|164|102|103 | L13: 25|22|23|24 | M13: 3186|3186|3188|3188 | N13: 10030|10031|10032|10033 | O13: 1|1|1|1 | P13: 2500|2500|2500|2500
A14: 8 | B14: 6 | C14: 30 | D14: 20 | E14: 1000 | F14: =MOD(RC[-5]-1,3)*30+100&"|"&MOD(RC[-5]-1,3)*30+101&"|"&MOD(RC[-5]-1,3)*30+102&"|"&MOD(RC[-5]-1,3)*30+103&"|"&IF(MOD(RC[-5],4)=0,HLOOKUP(Sheet1!R2C10,Sheet1!R2C10:R7C10,MOD(RC[-5]/4-1,6)+1,FALSE),IF(MOD(RC[-5],2)=0,IF(RC[-5]>20,HLOOKUP(Sheet1!R2C7,Sheet1!R2C7:R43C7,MOD(RC[-5]/2-1,42)+1,FALSE),HLOOKUP(Sheet1!R2C4,Sheet1!R2C4:R7C4,MOD(RC[-5]-1,6)+1,FALSE)),MOD(RC[-5]-1,3)*30+104)) -> 130|131|132|133|191 | G14: =HLOOKUP(Sheet1!R2C1,Sheet1!R2C1:R16C1,MOD(RC1-1,2)+MOD(INT((RC1-1)/2),3)*5+1,FALSE)&"|"&HLOOKUP(Sheet1!R2C1,Sheet1!R2C1:R16C1,MOD(RC1,2)+MOD(INT((RC1)/2),3)*5+1,FALSE)&"|"&HLOOKUP(Sheet1!R2C1,Sheet1!R2C1:R16C1,MOD(RC1+1,2)+MOD(INT((RC1+1)/2),3)*5+1,FALSE)&"|"&HLOOKUP(Sheet1!R2C1,Sheet1!R2C1:R16C1,MOD(RC1+2,2)+MOD(INT((RC1+2)/2),3)*5+1,FALSE)&"|"&HLOOKUP(Sheet1!R2C1,Sheet1!R2C1:R16C1,MOD(RC1+3,2)+MOD(INT((RC1+3)/2),3)*5+1,FALSE) -> 101|130|131|160|161 | H14: =HLOOKUP(Sheet1!R2C1,Sheet1!R2C1:R16C1,MOD(RC1+2,2)+MOD(INT((RC1+2)/2),3)*5+1,FALSE)&"|"&HLOOKUP(Sheet1!R2C1,Sheet1!R2C1:R16C1,MOD(RC1+3,2)+MOD(INT((RC1+3)/2),3)*5+1,FALSE)&"|"&HLOOKUP(Sheet1!R2C1,Sheet1!R2C1:R16C1,MOD(RC1+4,2)+MOD(INT((RC1+4)/2),3)*5+1,FALSE)&"|"&HLOOKUP(Sheet1!R2C1,Sheet1!R2C1:R16C1,MOD(RC1+5,2)+MOD(INT((RC1+5)/2),3)*5+1,FALSE)&"|"&HLOOKUP(Sheet1!R2C1,Sheet1!R2C1:R16C1,MOD(RC1+6,2)+MOD(INT((RC1+6)/2),3)*5+1,FALSE) -> 160|161|100|101|130 | I14: =HLOOKUP(Sheet1!R2C1,Sheet1!R2C1:R16C1,MOD(RC1-1,3)+MOD(INT((RC1-1)/3),3)*5+3,FALSE)&"|"&HLOOKUP(Sheet1!R2C1,Sheet1!R2C1:R16C1,MOD(RC1,3)+MOD(INT((RC1)/3),3)*5+3,FALSE)&"|"&HLOOKUP(Sheet1!R2C1,Sheet1!R2C1:R16C1,MOD(RC1+1,3)+MOD(INT((RC1+1)/3),3)*5+3,FALSE)&"|"&HLOOKUP(Sheet1!R2C1,Sheet1!R2C1:R16C1,MOD(RC1+2,3)+MOD(INT((RC1+2)/3),3)*5+3,FALSE)&"|"&HLOOKUP(Sheet1!R2C1,Sheet1!R2C1:R16C1,MOD(RC1+3,3)+MOD(INT((RC1+3)/3),3)*5+3,FALSE) -> 163|164|102|103|104 | J14: =HLOOKUP(Sheet1!R2C1,Sheet1!R2C1:R16C1,MOD(RC1-1,3)+MOD(INT((RC1-1)/3),3)*5+3,FALSE)&"|"&HLOOKUP(Sheet1!R2C1,Sheet1!R2C1:R16C1,MOD(RC1,3)+MOD(INT((RC1)/3),3)*5+3,FALSE)&"|"&HLOOKUP(Sheet1!R2C1,Sheet1!R2C1:R16C1,MOD(RC1+1,3)+MOD(INT((RC1+1)/3),3)*5+3,FALSE)&"|"&HLOOKUP(Sheet1!R2C1,Sheet1!R2C1:R16C1,MOD(RC1+2,3)+MOD(INT((RC1+2)/3),3)*5+3,FALSE)&"|"&HLOOKUP(Sheet1!R2C1,Sheet1!R2C1:R16C1,MOD(RC1+3,3)+MOD(INT((RC1+3)/3),3)*5+3,FALSE) -> 163|164|102|103|104 | K14: =HLOOKUP(Sheet1!R2C1,Sheet1!R2C1:R16C1,MOD(RC1-1,3)+MOD(INT((RC1-1)/3),3)*5+3,FALSE)&"|"&HLOOKUP(Sheet1!R2C1,Sheet1!R2C1:R16C1,MOD(RC1,3)+MOD(INT((RC1)/3),3)*5+3,FALSE)&"|"&HLOOKUP(Sheet1!R2C1,Sheet1!R2C1:R16C1,MOD(RC1+1,3)+MOD(INT((RC1+1)/3),3)*5+3,FALSE)&"|"&HLOOKUP(Sheet1!R2C1,Sheet1!R2C1:R16C1,MOD(RC1+2,3)+MOD(INT((RC1+2)/3),3)*5+3,FALSE)&"|"&HLOOKUP(Sheet1!R2C1,Sheet1!R2C1:R16C1,MOD(RC1+3,3)+MOD(INT((RC1+3)/3),3)*5+3,FALSE) -> 163|164|102|103|104 | L14: 25|22|23|24 | M14: 3781|3781|3780|3780 | N14: 10030|10031|10032|10033 | O14: 1|1|1|1 | P14: 2500|2500|2500|2500
A15: 9 | B15: 7 | C15: 30 | D15: 20 | E15: 1000 | F15: =MOD(RC[-5]-1,3)*30+100&"|"&MOD(RC[-5]-1,3)*30+101&"|"&MOD(RC[-5]-1,3)*30+102&"|"&MOD(RC[-5]-1,3)*30+103&"|"&IF(MOD(RC[-5],4)=0,HLOOKUP(Sheet1!R2C10,Sheet1!R2C10:R7C10,MOD(RC[-5]/4-1,6)+1,FALSE),IF(MOD(RC[-5],2)=0,IF(RC[-5]>20,HLOOKUP(Sheet1!R2C7,Sheet1!R2C7:R43C7,MOD(RC[-5]/2-1,42)+1,FALSE),HLOOKUP(Sheet1!R2C4,Sheet1!R2C4:R7C4,MOD(RC[-5]-1,6)+1,FALSE)),MOD(RC[-5]-1,3)*30+104)) -> 160|161|162|163|164 | G15: =HLOOKUP(Sheet1!R2C1,Sheet1!R2C1:R16C1,MOD(RC1-1,2)+MOD(INT((RC1-1)/2),3)*5+1,FALSE)&"|"&HLOOKUP(Sheet1!R2C1,Sheet1!R2C1:R16C1,MOD(RC1,2)+MOD(INT((RC1)/2),3)*5+1,FALSE)&"|"&HLOOKUP(Sheet1!R2C1,Sheet1!R2C1:R16C1,MOD(RC1+1,2)+MOD(INT((RC1+1)/2),3)*5+1,FALSE)&"|"&HLOOKUP(Sheet1!R2C1,Sheet1!R2C1:R16C1,MOD(RC1+2,2)+MOD(INT((RC1+2)/2),3)*5+1,FALSE)&"|"&HLOOKUP(Sheet1!R2C1,Sheet1!R2C1:R16C1,MOD(RC1+3,2)+MOD(INT((RC1+3)/2),3)*5+1,FALSE) -> 130|131|160|161|100 | H15: =HLOOKUP(Sheet1!R2C1,Sheet1!R2C1:R16C1,MOD(RC1+2,2)+MOD(INT((RC1+2)/2),3)*5+1,FALSE)&"|"&HLOOKUP(Sheet1!R2C1,Sheet1!R2C1:R16C1,MOD(RC1+3,2)+MOD(INT((RC1+3)/2),3)*5+1,FALSE)&"|"&HLOOKUP(Sheet1!R2C1,Sheet1!R2C1:R16C1,MOD(RC1+4,2)+MOD(INT((RC1+4)/2),3)*5+1,FALSE)&"|"&HLOOKUP(Sheet1!R2C1,Sheet1!R2C1:R16C1,MOD(RC1+5,2)+MOD(INT((RC1+5)/2),3)*5+1,FALSE)&"|"&HLOOKUP(Sheet1!R2C1,Sheet1!R2C1:R16C1,MOD(RC1+6,2)+MOD(INT((RC1+6)/2),3)*5+1,FALSE) -> 161|100|101|130|131 | I15: =HLOOKUP(Sheet1!R2C1,Sheet1!R2C1:R16C1,MOD(RC1-1,3)+MOD(INT((RC1-1)/3),3)*5+3,FALSE)&"|"&HLOOKUP(Sheet1!R2C1,Sheet1!R2C1:R16C1,MOD(RC1,3)+MOD(INT((RC1)/3),3)*5+3,FALSE)&"|"&HLOOKUP(Sheet1!R2C1,Sheet1!R2C1:R16C1,MOD(RC1+1,3)+MOD(INT((RC1+1)/3),3)*5+3,FALSE)&"|"&HLOOKUP(Sheet1!R2C1,Sheet1!R2C1:R16C1,MOD(RC1+2,3)+MOD(INT((RC1+2)/3),3)*5+3,FALSE)&"|"&HLOOKUP(Sheet1!R2C1,Sheet1!R2C1:R16C1,MOD(RC1+3,3)+MOD(INT((RC1+3)/3),3)*5+3,FALSE) -> 164|102|103|104|132 | J15: =HLOOKUP(Sheet1!R2C1,Sheet1!R2C1:R16C1,MOD(RC1-1,3)+MOD(INT((RC1-1)/3),3)*5+3,FALSE)&"|"&HLOOKUP(Sheet1!R2C1,Sheet1!R2C1:R16C1,MOD(RC1,3)+MOD(INT((RC1)/3),3)*5+3,FALSE)&"|"&HLOOKUP(Sheet1!R2C1,Sheet1!R2C1:R16C1,MOD(RC1+1,3)+MOD(INT((RC1+1)/3),3)*5+3,FALSE)&"|"&HLOOKUP(Sheet1!R2C1,Sheet1!R2C1:R16C1,MOD(RC1+2,3)+MOD(INT((RC1+2)/3),3)*5+3,FALSE)&"|"&HLOOKUP(Sheet1!R2C1,Sheet1!R2C1:R16C1,MOD(RC1+3,3)+MOD(INT((RC1+3)/3),3)*5+3,FALSE) -> 164|102|103|104|132 | K15: =HLOOKUP(Sheet1!R2C1,Sheet1!R2C1:R16C1,MOD(RC1-1,3)+MOD(INT((RC1-1)/3),3)*5+3,FALSE)&"|"&HLOOKUP(Sheet1!R2C1,Sheet1!R2C1:R16C1,MOD(RC1,3)+MOD(INT((RC1)/3),3)*5+3,FALSE)&"|"&HLOOKUP(Sheet1!R2C1,Sheet1!R2C1:R16C1,MOD(RC1+1,3)+MOD(INT((RC1+1)/3),3)*5+3,FALSE)&"|"&HLOOKUP(Sheet1!R2C1,Sheet1!R2C1:R16C1,MOD(RC1+2,3)+MOD(INT((RC1+2)/3),3)*5+3,FALSE)&"|"&HLOOKUP(Sheet1!R2C1,Sheet1!R2C1:R16C1,MOD(RC1+3,3)+MOD(INT((RC1+3)/3),3)*5+3,FALSE) -> 164|102|103|104|132 | L15: 25|22|23|24 | M15: 4454|4454|4455|4455 | N15: 10030|10031|10032|10033 | O15: 1|1|1|1 | P15: 2500|2500|2500|2500
A16: 10 | B16: 8 | C16: 30 | D16: 20 | E16: 1000 | F16: =MOD(RC[-5]-1,3)*30+100&"|"&MOD(RC[-5]-1,3)*30+101&"|"&MOD(RC[-5]-1,3)*30+102&"|"&MOD(RC[-5]-1,3)*30+103&"|"&IF(MOD(RC[-5],4)=0,HLOOKUP(Sheet1!R2C10,Sheet1!R2C10:R7C10,MOD(RC[-5]/4-1,6)+1,FALSE),IF(MOD(RC[-5],2)=0,IF(RC[-5]>20,HLOOKUP(Sheet1!R2C7,Sheet1!R2C7:R43C7,MOD(RC[-5]/2-1,42)+1,FALSE),HLOOKUP(Sheet1!R2C4,Sheet1!R2C4:R7C4,MOD(RC[-5]-1,6)+1,FALSE)),MOD(RC[-5]-1,3)*30+104)) -> 100|101|102|103|141 | G16: =HLOOKUP(Sheet1!R2C1,Sheet1!R2C1:R16C1,MOD(RC1-1,2)+MOD(INT((RC1-1)/2),3)*5+1,FALSE)&"|"&HLOOKUP(Sheet1!R2C1,Sheet1!R2C1:R16C1,MOD(RC1,2)+MOD(INT((RC1)/2),3)*5+1,FALSE)&"|"&HLOOKUP(Sheet1!R2C1,Sheet1!R2C1:R16C1,MOD(RC1+1,2)+MOD(INT((RC1+1)/2),3)*5+1,FALSE)&"|"&HLOOKUP(Sheet1!R2C1,Sheet1!R2C1:R16C1,MOD(RC1+2,2)+MOD(INT((RC1+2)/2),3)*5+1,FALSE)&"|"&HLOOKUP(Sheet1!R2C1,Sheet1!R2C1:R16C1,MOD(RC1+3,2)+MOD(INT((RC1+3)/2),3)*5+1,FALSE) -> 131|160|161|100|101 | H16: =HLOOKUP(Sheet1!R2C1,Sheet1!R2C1:R16C1,MOD(RC1+2,2)+MOD(INT((RC1+2)/2),3)*5+1,FALSE)&"|"&HLOOKUP(Sheet1!R2C1,Sheet1!R2C1:R16C1,MOD(RC1+3,2)+MOD(INT((RC1+3)/2),3)*5+1,FALSE)&"|"&HLOOKUP(Sheet1!R2C1,Sheet1!R2C1:R16C1,MOD(RC1+4,2)+MOD(INT((RC1+4)/2),3)*5+1,FALSE)&"|"&HLOOKUP(Sheet1!R2C1,Sheet1!R2C1:R16C1,MOD(RC1+5,2)+MOD(INT((RC1+5)/2),3)*5+1,FALSE)&"|"&HLOOKUP(Sheet1!R2C1,Sheet1!R2C1:R16C1,MOD(RC1+6,2)+MOD(INT((RC1+6)/2),3)*5+1,FALSE) -> 100|101|130|131|160 | I16: =HLOOKUP(Sheet1!R2C1,Sheet1!R2C1:R16C1,MOD(RC1-1,3)+MOD(INT((RC1-1)/3),3)*5+3,FALSE)&"|"&HLOOKUP(Sheet1!R2C1,Sheet1!R2C1:R16C1,MOD(RC1,3)+MOD(INT((RC1)/3),3)*5+3,FALSE)&"|"&HLOOKUP(Sheet1!R2C1,Sheet1!R2C1:R16C1,MOD(RC1+1,3)+MOD(INT((RC1+1)/3),3)*5+3,FALSE)&"|"&HLOOKUP(Sheet1!R2C1,Sheet1!R2C1:R16C1,MOD(RC1+2,3)+MOD(INT((RC1+2)/3),3)*5+3,FALSE)&"|"&HLOOKUP(Sheet1!R2C1,Sheet1!R2C1:R16C1,MOD(RC1+3,3)+MOD(INT((RC1+3)/3),3)*5+3,FALSE) -> 102|103|104|132|133 | J16: =HLOOKUP(Sheet1!R2C1,Sheet1!R2C1:R16C1,MOD(RC1-1,3)+MOD(INT((RC1-1)/3),3)*5+3,FALSE)&"|"&HLOOKUP(Sheet1!R2C1,Sheet1!R2C1:R16C1,MOD(RC1,3)+MOD(INT((RC1)/3),3)*5+3,FALSE)&"|"&HLOOKUP(Sheet1!R2C1,Sheet1!R2C1:R16C1,MOD(RC1+1,3)+MOD(INT((RC1+1)/3),3)*5+3,FALSE)&"|"&HLOOKUP(Sheet1!R2C1,Sheet1!R2C1:R16C1,MOD(RC1+2,3)+MOD(INT((RC1+2)/3),3)*5+3,FALSE)&"|"&HLOOKUP(Sheet1!R2C1,Sheet1!R2C1:R16C1,MOD(RC1+3,3)+MOD(INT((RC1+3)/3),3)*5+3,FALSE) -> 102|103|104|132|133 | K16: =HLOOKUP(Sheet1!R2C1,Sheet1!R2C1:R16C1,MOD(RC1-1,3)+MOD(INT((RC1-1)/3),3)*5+3,FALSE)&"|"&HLOOKUP(Sheet1!R2C1,Sheet1!R2C1:R16C1,MOD(RC1,3)+MOD(INT((RC1)/3),3)*5+3,FALSE)&"|"&HLOOKUP(Sheet1!R2C1,Sheet1!R2C1:R16C1,MOD(RC1+1,3)+MOD(INT((RC1+1)/3),3)*5+3,FALSE)&"|"&HLOOKUP(Sheet1!R2C1,Sheet1!R2C1:R16C1,MOD(RC1+2,3)+MOD(INT((RC1+2)/3),3)*5+3,FALSE)&"|"&HLOOKUP(Sheet1!R2C1,Sheet1!R2C1:R16C1,MOD(RC1+3,3)+MOD(INT((RC1+3)/3),3)*5+3,FALSE) -> 102|103|104|132|133 | L16: 25|22|23|24 | M16: 5049|5049|5050|5050 | N16: 10030|10031|10032|10033|10030|10031|10032|10033|10030|10031|10032|10033|10030|10031|10032|10033|10030|10031|10032|10033|10030|10031|10032|10033|10030|10031|10032|10033|10030|10031|10032|10033|10030|10031|10032|10033|10030|10031|10032|10033 | O16: 1|1|1|1|1|1|1|1|1|1|1|1|1|1|1|1|1|1|1|1|1|1|1|1|1|1|1|1|1|1|1|1|1|1|1|1|1|1|1|1 | P16: 2500|2500|2500|2500|2500|2500|2500|2500|2500|2500|2500|2500|2500|2500|2500|2500|2500|2500|2500|2500|2500|2500|2500|2500|2500|2500|2500|2500|2500|2500|2500|2500|2500|2500|2500|2500|2500|2500|2500|2500
A17: 11 | B17: 9 | C17: 30 | D17: 20 | E17: 1000 | F17: =MOD(RC[-5]-1,3)*30+100&"|"&MOD(RC[-5]-1,3)*30+101&"|"&MOD(RC[-5]-1,3)*30+102&"|"&MOD(RC[-5]-1,3)*30+103&"|"&IF(MOD(RC[-5],4)=0,HLOOKUP(Sheet1!R2C10,Sheet1!R2C10:R7C10,MOD(RC[-5]/4-1,6)+1,FALSE),IF(MOD(RC[-5],2)=0,IF(RC[-5]>20,HLOOKUP(Sheet1!R2C7,Sheet1!R2C7:R43C7,MOD(RC[-5]/2-1,42)+1,FALSE),HLOOKUP(Sheet1!R2C4,Sheet1!R2C4:R7C4,MOD(RC[-5]-1,6)+1,FALSE)),MOD(RC[-5]-1,3)*30+104)) -> 130|131|132|133|134 | G17: =HLOOKUP(Sheet1!R2C1,Sheet1!R2C1:R16C1,MOD(RC1-1,2)+MOD(INT((RC1-1)/2),3)*5+1,FALSE)&"|"&HLOOKUP(Sheet1!R2C1,Sheet1!R2C1:R16C1,MOD(RC1,2)+MOD(INT((RC1)/2),3)*5+1,FALSE)&"|"&HLOOKUP(Sheet1!R2C1,Sheet1!R2C1:R16C1,MOD(RC1+1,2)+MOD(INT((RC1+1)/2),3)*5+1,FALSE)&"|"&HLOOKUP(Sheet1!R2C1,Sheet1!R2C1:R16C1,MOD(RC1+2,2)+MOD(INT((RC1+2)/2),3)*5+1,FALSE)&"|"&HLOOKUP(Sheet1!R2C1,Sheet1!R2C1:R16C1,MOD(RC1+3,2)+MOD(INT((RC1+3)/2),3)*5+1,FALSE) -> 160|161|100|101|130 | H17: =HLOOKUP(Sheet1!R2C1,Sheet1!R2C1:R16C1,MOD(RC1+2,2)+MOD(INT((RC1+2)/2),3)*5+1,FALSE)&"|"&HLOOKUP(Sheet1!R2C1,Sheet1!R2C1:R16C1,MOD(RC1+3,2)+MOD(INT((RC1+3)/2),3)*5+1,FALSE)&"|"&HLOOKUP(Sheet1!R2C1,Sheet1!R2C1:R16C1,MOD(RC1+4,2)+MOD(INT((RC1+4)/2),3)*5+1,FALSE)&"|"&HLOOKUP(Sheet1!R2C1,Sheet1!R2C1:R16C1,MOD(RC1+5,2)+MOD(INT((RC1+5)/2),3)*5+1,FALSE)&"|"&HLOOKUP(Sheet1!R2C1,Sheet1!R2C1:R16C1,MOD(RC1+6,2)+MOD(INT((RC1+6)/2),3)*5+1,FALSE) -> 101|130|131|160|161 | I17: =HLOOKUP(Sheet1!R2C1,Sheet1!R2C1:R16C1,MOD(RC1-1,3)+MOD(INT((RC1-1)/3),3)*5+3,FALSE)&"|"&HLOOKUP(Sheet1!R2C1,Sheet1!R2C1:R16C1,MOD(RC1,3)+MOD(INT((RC1)/3),3)*5+3,FALSE)&"|"&HLOOKUP(Sheet1!R2C1,Sheet1!R2C1:R16C1,MOD(RC1+1,3)+MOD(INT((RC1+1)/3),3)*5+3,FALSE)&"|"&HLOOKUP(Sheet1!R2C1,Sheet1!R2C1:R16C1,MOD(RC1+2,3)+MOD(INT((RC1+2)/3),3)*5+3,FALSE)&"|"&HLOOKUP(Sheet1!R2C1,Sheet1!R2C1:R16C1,MOD(RC1+3,3)+MOD(INT((RC1+3)/3),3)*5+3,FALSE) -> 103|104|132|133|134 | J17: =HLOOKUP(Sheet1!R2C1,Sheet1!R2C1:R16C1,MOD(RC1-1,3)+MOD(INT((RC1-1)/3),3)*5+3,FALSE)&"|"&HLOOKUP(Sheet1!R2C1,Sheet1!R2C1:R16C1,MOD(RC1,3)+MOD(INT((RC1)/3),3)*5+3,FALSE)&"|"&HLOOKUP(Sheet1!R2C1,Sheet1!R2C1:R16C1,MOD(RC1+1,3)+MOD(INT((RC1+1)/3),3)*5+3,FALSE)&"|"&HLOOKUP(Sheet1!R2C1,Sheet1!R2C1:R16C1,MOD(RC1+2,3)+MOD(INT((RC1+2)/3),3)*5+3,FALSE)&"|"&HLOOKUP(Sheet1!R2C1,Sheet1!R2C1:R16C1,MOD(RC1+3,3)+MOD(INT((RC1+3)/3),3)*5+3,FALSE) -> 103|104|132|133|134 | K17: =HLOOKUP(Sheet1!R2C1,Sheet1!R2C1:R16C1,MOD(RC1-1,3)+MOD(INT((RC1-1)/3),3)*5+3,FALSE)&"|"&HLOOKUP(Sheet1!R2C1,Sheet1!R2C1:R16C1,MOD(RC1,3)+MOD(INT((RC1)/3),3)*5+3,FALSE)&"|"&HLOOKUP(Sheet1!R2C1,Sheet1!R2C1:R16C1,MOD(RC1+1,3)+MOD(INT((RC1+1)/3),3)*5+3,FALSE)&"|"&HLOOKUP(Sheet1!R2C1,Sheet1!R2C1:R16C1,MOD(RC1+2,3)+MOD(INT((RC1+2)/3),3)*5+3,FALSE)&"|"&HLOOKUP(Sheet1!R2C1,Sheet1!R2C1:R16C1,MOD(RC1+3,3)+MOD(INT((RC1+3)/3),3)*5+3,FALSE) -> 103|104|132|133|134 | L17: 25|22|23|24 | M17: 5591|5591|5590|5590 | N17: 10030|10031|10032|10033 | O17: 1|1|1|1 | P17: 2500|2500|2500|2500
A18: 12 | B18: 10 | C18: 30 | D18: 20 | E18: 1000 | F18: =MOD(RC[-5]-1,3)*30+100&"|"&MOD(RC[-5]-1,3)*30+101&"|"&MOD(RC[-5]-1,3)*30+102&"|"&MOD(RC[-5]-1,3)*30+103&"|"&IF(MOD(RC[-5],4)=0,HLOOKUP(Sheet1!R2C10,Sheet1!R2C10:R7C10,MOD(RC[-5]/4-1,6)+1,FALSE),IF(MOD(RC[-5],2)=0,IF(RC[-5]>20,HLOOKUP(Sheet1!R2C7,Sheet1!R2C7:R43C7,MOD(RC[-5]/2-1,42)+1,FALSE),HLOOKUP(Sheet1!R2C4,Sheet1!R2C4:R7C4,MOD(RC[-5]-1,6)+1,FALSE)),MOD(RC[-5]-1,3)*30+104)) -> 160|161|162|163|192 | G18: =HLOOKUP(Sheet1!R2C1,Sheet1!R2C1:R16C1,MOD(RC1-1,2)+MOD(INT((RC1-1)/2),3)*5+1,FALSE)&"|"&HLOOKUP(Sheet1!R2C1,Sheet1!R2C1:R16C1,MOD(RC1,2)+MOD(INT((RC1)/2),3)*5+1,FALSE)&"|"&HLOOKUP(Sheet1!R2C1,Sheet1!R2C1:R16C1,MOD(RC1+1,2)+MOD(INT((RC1+1)/2),3)*5+1,FALSE)&"|"&HLOOKUP(Sheet1!R2C1,Sheet1!R2C1:R16C1,MOD(RC1+2,2)+MOD(INT((RC1+2)/2),3)*5+1,FALSE)&"|"&HLOOKUP(Sheet1!R2C1,Sheet1!R2C1:R16C1,MOD(RC1+3,2)+MOD(INT((RC1+3)/2),3)*5+1,FALSE) -> 161|100|101|130|131 | H18: =HLOOKUP(Sheet1!R2C1,Sheet1!R2C1:R16C1,MOD(RC1+2,2)+MOD(INT((RC1+2)/2),3)*5+1,FALSE)&"|"&HLOOKUP(Sheet1!R2C1,Sheet1!R2C1:R16C1,MOD(RC1+3,2)+MOD(INT((RC1+3)/2),3)*5+1,FALSE)&"|"&HLOOKUP(Sheet1!R2C1,Sheet1!R2C1:R16C1,MOD(RC1+4,2)+MOD(INT((RC1+4)/2),3)*5+1,FALSE)&"|"&HLOOKUP(Sheet1!R2C1,Sheet1!R2C1:R16C1,MOD(RC1+5,2)+MOD(INT((RC1+5)/2),3)*5+1,FALSE)&"|"&HLOOKUP(Sheet1!R2C1,Sheet1!R2C1:R16C1,MOD(RC1+6,2)+MOD(INT((RC1+6)/2),3)*5+1,FALSE) -> 130|131|160|161|100 | I18: =HLOOKUP(Sheet1!R2C1,Sheet1!R2C1:R16C1,MOD(RC1-1,3)+MOD(INT((RC1-1)/3),3)*5+3,FALSE)&"|"&HLOOKUP(Sheet1!R2C1,Sheet1!R2C1:R16C1,MOD(RC1,3)+MOD(INT((RC1)/3),3)*5+3,FALSE)&"|"&HLOOKUP(Sheet1!R2C1,Sheet1!R2C1:R16C1,MOD(RC1+1,3)+MOD(INT((RC1+1)/3),3)*5+3,FALSE)&"|"&HLOOKUP(Sheet1!R2C1,Sheet1!R2C1:R16C1,MOD(RC1+2,3)+MOD(INT((RC1+2)/3),3)*5+3,FALSE)&"|"&HLOOKUP(Sheet1!R2C1,Sheet1!R2C1:R16C1,MOD(RC1+3,3)+MOD(INT((RC1+3)/3),3)*5+3,FALSE) -> 104|132|133|134|162 | J18: =HLOOKUP(Sheet1!R2C1,Sheet1!R2C1:R16C1,MOD(RC1-1,3)+MOD(INT((RC1-1)/3),3)*5+3,FALSE)&"|"&HLOOKUP(Sheet1!R2C1,Sheet1!R2C1:R16C1,MOD(RC1,3)+MOD(INT((RC1)/3),3)*5+3,FALSE)&"|"&HLOOKUP(Sheet1!R2C1,Sheet1!R2C1:R16C1,MOD(RC1+1,3)+MOD(INT((RC1+1)/3),3)*5+3,FALSE)&"|"&HLOOKUP(Sheet1!R2C1,Sheet1!R2C1:R16C1,MOD(RC1+2,3)+MOD(INT((RC1+2)/3),3)*5+3,FALSE)&"|"&HLOOKUP(Sheet1!R2C1,Sheet1!R2C1:R16C1,MOD(RC1+3,3)+MOD(INT((RC1+3)/3),3)*5+3,FALSE) -> 104|132|133|134|162 | K18: =HLOOKUP(Sheet1!R2C1,Sheet1!R2C1:R16C1,MOD(RC1-1,3)+MOD(INT((RC1-1)/3),3)*5+3,FALSE)&"|"&HLOOKUP(Sheet1!R2C1,Sheet1!R2C1:R16C1,MOD(RC1,3)+MOD(INT((RC1)/3),3)*5+3,FALSE)&"|"&HLOOKUP(Sheet1!R2C1,Sheet1!R2C1:R16C1,MOD(RC1+1,3)+MOD(INT((RC1+1)/3),3)*5+3,FALSE)&"|"&HLOOKUP(Sheet1!R2C1,Sheet1!R2C1:R16C1,MOD(RC1+2,3)+MOD(INT((RC1+2)/3),3)*5+3,FALSE)&"|"&HLOOKUP(Sheet1!R2C1,Sheet1!R2C1:R16C1,MOD(RC1+3,3)+MOD(INT((RC1+3)/3),3)*5+3,FALSE) -> 104|132|133|134|162 | L18: 25|22|23|24 | M18: 6158|6159|6158|6158 | N18: 10030|10031|10032|10033 | O18: 1|1|1|1 | P18: 2500|2500|2500|2500
A19: 13 | B19: 11 | C19: 30 | D19: 20 | E19: 1000 | F19: =MOD(RC[-5]-1,3)*30+100&"|"&MOD(RC[-5]-1,3)*30+101&"|"&MOD(RC[-5]-1,3)*30+102&"|"&MOD(RC[-5]-1,3)*30+103&"|"&IF(MOD(RC[-5],4)=0,HLOOKUP(Sheet1!R2C10,Sheet1!R2C10:R7C10,MOD(RC[-5]/4-1,6)+1,FALSE),IF(MOD(RC[-5],2)=0,IF(RC[-5]>20,HLOOKUP(Sheet1!R2C7,Sheet1!R2C7:R43C7,MOD(RC[-5]/2-1,42)+1,FALSE),HLOOKUP(Sheet1!R2C4,Sheet1!R2C4:R7C4,MOD(RC[-5]-1,6)+1,FALSE)),MOD(RC[-5]-1,3)*30+104)) -> 100|101|102|103|104 | G19: =HLOOKUP(Sheet1!R2C1,Sheet1!R2C1:R16C1,MOD(RC1-1,2)+MOD(INT((RC1-1)/2),3)*5+1,FALSE)&"|"&HLOOKUP(Sheet1!R2C1,Sheet1!R2C1:R16C1,MOD(RC1,2)+MOD(INT((RC1)/2),3)*5+1,FALSE)&"|"&HLOOKUP(Sheet1!R2C1,Sheet1!R2C1:R16C1,MOD(RC1+1,2)+MOD(INT((RC1+1)/2),3)*5+1,FALSE)&"|"&HLOOKUP(Sheet1!R2C1,Sheet1!R2C1:R16C1,MOD(RC1+2,2)+MOD(INT((RC1+2)/2),3)*5+1,FALSE)&"|"&HLOOKUP(Sheet1!R2C1,Sheet1!R2C1:R16C1,MOD(RC1+3,2)+MOD(INT((RC1+3)/2),3)*5+1,FALSE) -> 100|101|130|131|160 | H19: =HLOOKUP(Sheet1!R2C1,Sheet1!R2C1:R16C1,MOD(RC1+2,2)+MOD(INT((RC1+2)/2),3)*5+1,FALSE)&"|"&HLOOKUP(Sheet1!R2C1,Sheet1!R2C1:R16C1,MOD(RC1+3,2)+MOD(INT((RC1+3)/2),3)*5+1,FALSE)&"|"&HLOOKUP(Sheet1!R2C1,Sheet1!R2C1:R16C1,MOD(RC1+4,2)+MOD(INT((RC1+4)/2),3)*5+1,FALSE)&"|"&HLOOKUP(Sheet1!R2C1,Sheet1!R2C1:R16C1,MOD(RC1+5,2)+MOD(INT((RC1+5)/2),3)*5+1,FALSE)&"|"&HLOOKUP(Sheet1!R2C1,Sheet1!R2C1:R16C1,MOD(RC1+6,2)+MOD(INT((RC1+6)/2),3)*5+1,FALSE) -> 131|160|161|100|101 | I19: =HLOOKUP(Sheet1!R2C1,Sheet1!R2C1:R16C1,MOD(RC1-1,3)+MOD(INT((RC1-1)/3),3)*5+3,FALSE)&"|"&HLOOKUP(Sheet1!R2C1,Sheet1!R2C1:R16C1,MOD(RC1,3)+MOD(INT((RC1)/3),3)*5+3,FALSE)&"|"&HLOOKUP(Sheet1!R2C1,Sheet1!R2C1:R16C1,MOD(RC1+1,3)+MOD(INT((RC1+1)/3),3)*5+3,FALSE)&"|"&HLOOKUP(Sheet1!R2C1,Sheet1!R2C1:R16C1,MOD(RC1+2,3)+MOD(INT((RC1+2)/3),3)*5+3,FALSE)&"|"&HLOOKUP(Sheet1!R2C1,Sheet1!R2C1:R16C1,MOD(RC1+3,3)+MOD(INT((RC1+3)/3),3)*5+3,FALSE) -> 132|133|134|162|163 | J19: =HLOOKUP(Sheet1!R2C1,Sheet1!R2C1:R16C1,MOD(RC1-1,3)+MOD(INT((RC1-1)/3),3)*5+3,FALSE)&"|"&HLOOKUP(Sheet1!R2C1,Sheet1!R2C1:R16C1,MOD(RC1,3)+MOD(INT((RC1)/3),3)*5+3,FALSE)&"|"&HLOOKUP(Sheet1!R2C1,Sheet1!R2C1:R16C1,MOD(RC1+1,3)+MOD(INT((RC1+1)/3),3)*5+3,FALSE)&"|"&HLOOKUP(Sheet1!R2C1,Sheet1!R2C1:R16C1,MOD(RC1+2,3)+MOD(INT((RC1+2)/3),3)*5+3,FALSE)&"|"&HLOOKUP(Sheet1!R2C1,Sheet1!R2C1:R16C1,MOD(RC1+3,3)+MOD(INT((RC1+3)/3),3)*5+3,FALSE) -> 132|133|134|162|163 | K19: =HLOOKUP(Sheet1!R2C1,Sheet1!R2C1:R16C1,MOD(RC1-1,3)+MOD(INT((RC1-1)/3),3)*5+3,FALSE)&"|"&HLOOKUP(Sheet1!R2C1,Sheet1!R2C1:R16C1,MOD(RC1,3)+MOD(INT((RC1)/3),3)*5+3,FALSE)&"|"&HLOOKUP(Sheet1!R2C1,Sheet1!R2C1:R16C1,MOD(RC1+1,3)+MOD(INT((RC1+1)/3),3)*5+3,FALSE)&"|"&HLOOKUP(Sheet1!R2C1,Sheet1!R2C1:R16C1,MOD(RC1+2,3)+MOD(INT((RC1+2)/3),3)*5+3,FALSE)&"|"&HLOOKUP(Sheet1!R2C1,Sheet1!R2C1:R16C1,MOD(RC1+3,3)+MOD(INT((RC1+3)/3),3)*5+3,FALSE) -> 132|133|134|162|163 | L19: 25|22|23|24 | M19: 6736|6736|6735|6735 | N19: 10030|10031|10032|10033 | O19: 1|1|1|1 | P19: 2500|2500|2500|2500
A20: 14 | B20: 12 | C20: 30 | D20: 20 | E20: 1000 | F20: =MOD(RC[-5]-1,3)*30+100&"|"&MOD(RC[-5]-1,3)*30+101&"|"&MOD(RC[-5]-1,3)*30+102&"|"&MOD(RC[-5]-1,3)*30+103&"|"&IF(MOD(RC[-5],4)=0,HLOOKUP(Sheet1!R2C10,Sheet1!R2C10:R7C10,MOD(RC[-5]/4-1,6)+1,FALSE),IF(MOD(RC[-5],2)=0,IF(RC[-5]>20,HLOOKUP(Sheet1!R2C7,Sheet1!R2C7:R43C7,MOD(RC[-5]/2-1,42)+1,FALSE),HLOOKUP(Sheet1!R2C4,Sheet1!R2C4:R7C4,MOD(RC[-5]-1,6)+1,FALSE)),MOD(RC[-5]-1,3)*30+104)) -> 130|131|132|133|111 | G20: =HLOOKUP(Sheet1!R2C1,Sheet1!R2C1:R16C1,MOD(RC1-1,2)+MOD(INT((RC1-1)/2),3)*5+1,FALSE)&"|"&HLOOKUP(Sheet1!R2C1,Sheet1!R2C1:R16C1,MOD(RC1,2)+MOD(INT((RC1)/2),3)*5+1,FALSE)&"|"&HLOOKUP(Sheet1!R2C1,Sheet1!R2C1:R16C1,MOD(RC1+1,2)+MOD(INT((RC1+1)/2),3)*5+1,FALSE)&"|"&HLOOKUP(Sheet1!R2C1,Sheet1!R2C1:R16C1,MOD(RC1+2,2)+MOD(INT((RC1+2)/2),3)*5+1,FALSE)&"|"&HLOOKUP(Sheet1!R2C1,Sheet1!R2C1:R16C1,MOD(RC1+3,2)+MOD(INT((RC1+3)/2),3)*5+1,FALSE) -> 101|130|131|160|161 | H20: =HLOOKUP(Sheet1!R2C1,Sheet1!R2C1:R16C1,MOD(RC1+2,2)+MOD(INT((RC1+2)/2),3)*5+1,FALSE)&"|"&HLOOKUP(Sheet1!R2C1,Sheet1!R2C1:R16C1,MOD(RC1+3,2)+MOD(INT((RC1+3)/2),3)*5+1,FALSE)&"|"&HLOOKUP(Sheet1!R2C1,Sheet1!R2C1:R16C1,MOD(RC1+4,2)+MOD(INT((RC1+4)/2),3)*5+1,FALSE)&"|"&HLOOKUP(Sheet1!R2C1,Sheet1!R2C1:R16C1,MOD(RC1+5,2)+MOD(INT((RC1+5)/2),3)*5+1,FALSE)&"|"&HLOOKUP(Sheet1!R2C1,Sheet1!R2C1:R16C1,MOD(RC1+6,2)+MOD(INT((RC1+6)/2),3)*5+1,FALSE) -> 160|161|100|101|130 | I20: =HLOOKUP(Sheet1!R2C1,Sheet1!R2C1:R16C1,MOD(RC1-1,3)+MOD(INT((RC1-1)/3),3)*5+3,FALSE)&"|"&HLOOKUP(Sheet1!R2C1,Sheet1!R2C1:R16C1,MOD(RC1,3)+MOD(INT((RC1)/3),3)*5+3,FALSE)&"|"&HLOOKUP(Sheet1!R2C1,Sheet1!R2C1:R16C1,MOD(RC1+1,3)+MOD(INT((RC1+1)/3),3)*5+3,FALSE)&"|"&HLOOKUP(Sheet1!R2C1,Sheet1!R2C1:R16C1,MOD(RC1+2,3)+MOD(INT((RC1+2)/3),3)*5+3,FALSE)&"|"&HLOOKUP(Sheet1!R2C1,Sheet1!R2C1:R16C1,MOD(RC1+3,3)+MOD(INT((RC1+3)/3),3)*5+3,FALSE) -> 133|134|162|163|164 | J20: =HLOOKUP(Sheet1!R2C1,Sheet1!R2C1:R16C1,MOD(RC1-1,3)+MOD(INT((RC1-1)/3),3)*5+3,FALSE)&"|"&HLOOKUP(Sheet1!R2C1,Sheet1!R2C1:R16C1,MOD(RC1,3)+MOD(INT((RC1)/3),3)*5+3,FALSE)&"|"&HLOOKUP(Sheet1!R2C1,Sheet1!R2C1:R16C1,MOD(RC1+1,3)+MOD(INT((RC1+1)/3),3)*5+3,FALSE)&"|"&HLOOKUP(Sheet1!R2C1,Sheet1!R2C1:R16C1,MOD(RC1+2,3)+MOD(INT((RC1+2)/3),3)*5+3,FALSE)&"|"&HLOOKUP(Sheet1!R2C1,Sheet1!R2C1:R16C1,MOD(RC1+3,3)+MOD(INT((RC1+3)/3),3)*5+3,FALSE) -> 133|134|162|163|164 | K20: =HLOOKUP(Sheet1!R2C1,Sheet1!R2C1:R16C1,MOD(RC1-1,3)+MOD(INT((RC1-1)/3),3)*5+3,FALSE)&"|"&HLOOKUP(Sheet1!R2C1,Sheet1!R2C1:R16C1,MOD(RC1,3)+MOD(INT((RC1)/3),3)*5+3,FALSE)&"|"&HLOOKUP(Sheet1!R2C1,Sheet1!R2C1:R16C1,MOD(RC1+1,3)+MOD(INT((RC1+1)/3),3)*5+3,FALSE)&"|"&HLOOKUP(Sheet1!R2C1,Sheet1!R2C1:R16C1,MOD(RC1+2,3)+MOD(INT((RC1+2)/3),3)*5+3,FALSE)&"|"&HLOOKUP(Sheet1!R2C1,Sheet1!R2C1:R16C1,MOD(RC1+3,3)+MOD(INT((RC1+3)/3),3)*5+3,FALSE) -> 133|134|162|163|164 | L20: 25|22|23|24 | M20: 7369|7369|7370|7370 | N20: 10030|10031|10032|10033 | O20: 1|1|1|1 | P20: 2500|2500|2500|2500
A21: 15 | B21: 13 | C21: 30 | D21: 20 | E21: 1000 | F21: =MOD(RC[-5]-1,3)*30+100&"|"&MOD(RC[-5]-1,3)*30+101&"|"&MOD(RC[-5]-1,3)*30+102&"|"&MOD(RC[-5]-1,3)*30+103&"|"&IF(MOD(RC[-5],4)=0,HLOOKUP(Sheet1!R2C10,Sheet1!R2C10:R7C10,MOD(RC[-5]/4-1,6)+1,FALSE),IF(MOD(RC[-5],2)=0,IF(RC[-5]>20,HLOOKUP(Sheet1!R2C7,Sheet1!R2C7:R43C7,MOD(RC[-5]/2-1,42)+1,FALSE),HLOOKUP(Sheet1!R2C4,Sheet1!R2C4:R7C4,MOD(RC[-5]-1,6)+1,FALSE)),MOD(RC[-5]-1,3)*30+104)) -> 160|161|162|163|164 | G21: =HLOOKUP(Sheet1!R2C1,Sheet1!R2C1:R16C1,MOD(RC1-1,2)+MOD(INT((RC1-1)/2),3)*5+1,FALSE)&"|"&HLOOKUP(Sheet1!R2C1,Sheet1!R2C1:R16C1,MOD(RC1,2)+MOD(INT((RC1)/2),3)*5+1,FALSE)&"|"&HLOOKUP(Sheet1!R2C1,Sheet1!R2C1:R16C1,MOD(RC1+1,2)+MOD(INT((RC1+1)/2),3)*5+1,FALSE)&"|"&HLOOKUP(Sheet1!R2C1,Sheet1!R2C1:R16C1,MOD(RC1+2,2)+MOD(INT((RC1+2)/2),3)*5+1,FALSE)&"|"&HLOOKUP(Sheet1!R2C1,Sheet1!R2C1:R16C1,MOD(RC1+3,2)+MOD(INT((RC1+3)/2),3)*5+1,FALSE) -> 130|131|160|161|100 | H21: =HLOOKUP(Sheet1!R2C1,Sheet1!R2C1:R16C1,MOD(RC1+2,2)+MOD(INT((RC1+2)/2),3)*5+1,FALSE)&"|"&HLOOKUP(Sheet1!R2C1,Sheet1!R2C1:R16C1,MOD(RC1+3,2)+MOD(INT((RC1+3)/2),3)*5+1,FALSE)&"|"&HLOOKUP(Sheet1!R2C1,Sheet1!R2C1:R16C1,MOD(RC1+4,2)+MOD(INT((RC1+4)/2),3)*5+1,FALSE)&"|"&HLOOKUP(Sheet1!R2C1,Sheet1!R2C1:R16C1,MOD(RC1+5,2)+MOD(INT((RC1+5)/2),3)*5+1,FALSE)&"|"&HLOOKUP(Sheet1!R2C1,Sheet1!R2C1:R16C1,MOD(RC1+6,2)+MOD(INT((RC1+6)/2),3)*5+1,FALSE) -> 161|100|101|130|131 | I21: =HLOOKUP(Sheet1!R2C1,Sheet1!R2C1:R16C1,MOD(RC1-1,3)+MOD(INT((RC1-1)/3),3)*5+3,FALSE)&"|"&HLOOKUP(Sheet1!R2C1,Sheet1!R2C1:R16C1,MOD(RC1,3)+MOD(INT((RC1)/3),3)*5+3,FALSE)&"|"&HLOOKUP(Sheet1!R2C1,Sheet1!R2C1:R16C1,MOD(RC1+1,3)+MOD(INT((RC1+1)/3),3)*5+3,FALSE)&"|"&HLOOKUP(Sheet1!R2C1,Sheet1!R2C1:R16C1,MOD(RC1+2,3)+MOD(INT((RC1+2)/3),3)*5+3,FALSE)&"|"&HLOOKUP(Sheet1!R2C1,Sheet1!R2C1:R16C1,MOD(RC1+3,3)+MOD(INT((RC1+3)/3),3)*5+3,FALSE) -> 134|162|163|164|102 | J21: =HLOOKUP(Sheet1!R2C1,Sheet1!R2C1:R16C1,MOD(RC1-1,3)+MOD(INT((RC1-1)/3),3)*5+3,FALSE)&"|"&HLOOKUP(Sheet1!R2C1,Sheet1!R2C1:R16C1,MOD(RC1,3)+MOD(INT((RC1)/3),3)*5+3,FALSE)&"|"&HLOOKUP(Sheet1!R2C1,Sheet1!R2C1:R16C1,MOD(RC1+1,3)+MOD(INT((RC1+1)/3),3)*5+3,FALSE)&"|"&HLOOKUP(Sheet1!R2C1,Sheet1!R2C1:R16C1,MOD(RC1+2,3)+MOD(INT((RC1+2)/3),3)*5+3,FALSE)&"|"&HLOOKUP(Sheet1!R2C1,Sheet1!R2C1:R16C1,MOD(RC1+3,3)+MOD(INT((RC1+3)/3),3)*5+3,FALSE) -> 134|162|163|164|102 | K21: =HLOOKUP(Sheet1!R2C1,Sheet1!R2C1:R16C1,MOD(RC1-1,3)+MOD(INT((RC1-1)/3),3)*5+3,FALSE)&"|"&HLOOKUP(Sheet1!R2C1,Sheet1!R2C1:R16C1,MOD(RC1,3)+MOD(INT((RC1)/3),3)*5+3,FALSE)&"|"&HLOOKUP(Sheet1!R2C1,Sheet1!R2C1:R16C1,MOD(RC1+1,3)+MOD(INT((RC1+1)/3),3)*5+3,FALSE)&"|"&HLOOKUP(Sheet1!R2C1,Sheet1!R2C1:R16C1,MOD(RC1+2,3)+MOD(INT((RC1+2)/3),3)*5+3,FALSE)&"|"&HLOOKUP(Sheet1!R2C1,Sheet1!R2C1:R16C1,MOD(RC1+3,3)+MOD(INT((RC1+3)/3),3)*5+3,FALSE) -> 134|162|163|164|102 | L21: 25|22|23|24 | M21: 8035|8035|8035|8035 | N21: 10030|10031|10032|10033|10030|10031|10032|10033|10030|10031|10032|10033|10030|10031|10032|10033|10030|10031|10032|10033|10030|10031|10032|10033|10030|10031|10032|10033|10030|10031|10032|10033|10030|10031|10032|10033|10030|10031|10032|10033 | O21: 1|1|1|1|1|1|1|1|1|1|1|1|1|1|1|1|1|1|1|1|1|1|1|1|1|1|1|1|1|1|1|1|1|1|1|1|1|1|1|1 | P21: 2500|2500|2500|2500|2500|2500|2500|2500|2500|2500|2500|2500|2500|2500|2500|2500|2500|2500|2500|2500|2500|2500|2500|2500|2500|2500|2500|2500|2500|2500|2500|2500|2500|2500|2500|2500|2500|2500|2500|2500
A22: 16 | B22: 14 | C22: 30 | D22: 20 | E22: 1000 | F22: =MOD(RC[-5]-1,3)*30+100&"|"&MOD(RC[-5]-1,3)*30+101&"|"&MOD(RC[-5]-1,3)*30+102&"|"&MOD(RC[-5]-1,3)*30+103&"|"&IF(MOD(RC[-5],4)=0,HLOOKUP(Sheet1!R2C10,Sheet1!R2C10:R7C10,MOD(RC[-5]/4-1,6)+1,FALSE),IF(MOD(RC[-5],2)=0,IF(RC[-5]>20,HLOOKUP(Sheet1!R2C7,Sheet1!R2C7:R43C7,MOD(RC[-5]/2-1,42)+1,FALSE),HLOOKUP(Sheet1!R2C4,Sheet1!R2C4:R7C4,MOD(RC[-5]-1,6)+1,FALSE)),MOD(RC[-5]-1,3)*30+104)) -> 100|101|102|103|193 | G22: =HLOOKUP(Sheet1!R2C1,Sheet1!R2C1:R16C1,MOD(RC1-1,2)+MOD(INT((RC1-1)/2),3)*5+1,FALSE)&"|"&HLOOKUP(Sheet1!R2C1,Sheet1!R2C1:R16C1,MOD(RC1,2)+MOD(INT((RC1)/2),3)*5+1,FALSE)&"|"&HLOOKUP(Sheet1!R2C1,Sheet1!R2C1:R16C1,MOD(RC1+1,2)+MOD(INT((RC1+1)/2),3)*5+1,FALSE)&"|"&HLOOKUP(Sheet1!R2C1,Sheet1!R2C1:R16C1,MOD(RC1+2,2)+MOD(INT((RC1+2)/2),3)*5+1,FALSE)&"|"&HLOOKUP(Sheet1!R2C1,Sheet1!R2C1:R16C1,MOD(RC1+3,2)+MOD(INT((RC1+3)/2),3)*5+1,FALSE) -> 131|160|161|100|101 | H22: =HLOOKUP(Sheet1!R2C1,Sheet1!R2C1:R16C1,MOD(RC1+2,2)+MOD(INT((RC1+2)/2),3)*5+1,FALSE)&"|"&HLOOKUP(Sheet1!R2C1,Sheet1!R2C1:R16C1,MOD(RC1+3,2)+MOD(INT((RC1+3)/2),3)*5+1,FALSE)&"|"&HLOOKUP(Sheet1!R2C1,Sheet1!R2C1:R16C1,MOD(RC1+4,2)+MOD(INT((RC1+4)/2),3)*5+1,FALSE)&"|"&HLOOKUP(Sheet1!R2C1,Sheet1!R2C1:R16C1,MOD(RC1+5,2)+MOD(INT((RC1+5)/2),3)*5+1,FALSE)&"|"&HLOOKUP(Sheet1!R2C1,Sheet1!R2C1:R16C1,MOD(RC1+6,2)+MOD(INT((RC1+6)/2),3)*5+1,FALSE) -> 100|101|130|131|160 | I22: =HLOOKUP(Sheet1!R2C1,Sheet1!R2C1:R16C1,MOD(RC1-1,3)+MOD(INT((RC1-1)/3),3)*5+3,FALSE)&"|"&HLOOKUP(Sheet1!R2C1,Sheet1!R2C1:R16C1,MOD(RC1,3)+MOD(INT((RC1)/3),3)*5+3,FALSE)&"|"&HLOOKUP(Sheet1!R2C1,Sheet1!R2C1:R16C1,MOD(RC1+1,3)+MOD(INT((RC1+1)/3),3)*5+3,FALSE)&"|"&HLOOKUP(Sheet1!R2C1,Sheet1!R2C1:R16C1,MOD(RC1+2,3)+MOD(INT((RC1+2)/3),3)*5+3,FALSE)&"|"&HLOOKUP(Sheet1!R2C1,Sheet1!R2C1:R16C1,MOD(RC1+3,3)+MOD(INT((RC1+3)/3),3)*5+3,FALSE) -> 162|163|164|102|103 | J22: =HLOOKUP(Sheet1!R2C1,Sheet1!R2C1:R16C1,MOD(RC1-1,3)+MOD(INT((RC1-1)/3),3)*5+3,FALSE)&"|"&HLOOKUP(Sheet1!R2C1,Sheet1!R2C1:R16C1,MOD(RC1,3)+MOD(INT((RC1)/3),3)*5+3,FALSE)&"|"&HLOOKUP(Sheet1!R2C1,Sheet1!R2C1:R16C1,MOD(RC1+1,3)+MOD(INT((RC1+1)/3),3)*5+3,FALSE)&"|"&HLOOKUP(Sheet1!R2C1,Sheet1!R2C1:R16C1,MOD(RC1+2,3)+MOD(INT((RC1+2)/3),3)*5+3,FALSE)&"|"&HLOOKUP(Sheet1!R2C1,Sheet1!R2C1:R16C1,MOD(RC1+3,3)+MOD(INT((RC1+3)/3),3)*5+3,FALSE) -> 162|163|164|102|103 | K22: =HLOOKUP(Sheet1!R2C1,Sheet1!R2C1:R16C1,MOD(RC1-1,3)+MOD(INT((RC1-1)/3),3)*5+3,FALSE)&"|"&HLOOKUP(Sheet1!R2C1,Sheet1!R2C1:R16C1,MOD(RC1,3)+MOD(INT((RC1)/3),3)*5+3,FALSE)&"|"&HLOOKUP(Sheet1!R2C1,Sheet1!R2C1:R16C1,MOD(RC1+1,3)+MOD(INT((RC1+1)/3),3)*5+3,FALSE)&"|"&HLOOKUP(Sheet1!R2C1,Sheet1!R2C1:R16C1,MOD(RC1+2,3)+MOD(INT((RC1+2)/3),3)*5+3,FALSE)&"|"&HLOOKUP(Sheet1!R2C1,Sheet1!R2C1:R16C1,MOD(RC1+3,3)+MOD(INT((RC1+3)/3),3)*5+3,FALSE) -> 162|163|164|102|103 | L22: 25|22|23|24 | M22: 8997|8998|8998|8998 | N22: 10030|10031|10032|10033 | O22: 1|1|1|1 | P22: 2500|2500|2500|2500
A23: 17 | B23: 15 | C23: 30 | D23: 20 | E23: 1000 | F23: =MOD(RC[-5]-1,3)*30+100&"|"&MOD(RC[-5]-1,3)*30+101&"|"&MOD(RC[-5]-1,3)*30+102&"|"&MOD(RC[-5]-1,3)*30+103&"|"&IF(MOD(RC[-5],4)=0,HLOOKUP(Sheet1!R2C10,Sheet1!R2C10:R7C10,MOD(RC[-5]/4-1,6)+1,FALSE),IF(MOD(RC[-5],2)=0,IF(RC[-5]>20,HLOOKUP(Sheet1!R2C7,Sheet1!R2C7:R43C7,MOD(RC[-5]/2-1,42)+1,FALSE),HLOOKUP(Sheet1!R2C4,Sheet1!R2C4:R7C4,MOD(RC[-5]-1,6)+1,FALSE)),MOD(RC[-5]-1,3)*30+104)) -> 130|131|132|133|134 | G23: =HLOOKUP(Sheet1!R2C1,Sheet1!R2C1:R16C1,MOD(RC1-1,2)+MOD(INT((RC1-1)/2),3)*5+1,FALSE)&"|"&HLOOKUP(Sheet1!R2C1,Sheet1!R2C1:R16C1,MOD(RC1,2)+MOD(INT((RC1)/2),3)*5+1,FALSE)&"|"&HLOOKUP(Sheet1!R2C1,Sheet1!R2C1:R16C1,MOD(RC1+1,2)+MOD(INT((RC1+1)/2),3)*5+1,FALSE)&"|"&HLOOKUP(Sheet1!R2C1,Sheet1!R2C1:R16C1,MOD(RC1+2,2)+MOD(INT((RC1+2)/2),3)*5+1,FALSE)&"|"&HLOOKUP(Sheet1!R2C1,Sheet1!R2C1:R16C1,MOD(RC1+3,2)+MOD(INT((RC1+3)/2),3)*5+1,FALSE) -> 160|161|100|101|130 | H23: =HLOOKUP(Sheet1!R2C1,Sheet1!R2C1:R16C1,MOD(RC1+2,2)+MOD(INT((RC1+2)/2),3)*5+1,FALSE)&"|"&HLOOKUP(Sheet1!R2C1,Sheet1!R2C1:R16C1,MOD(RC1+3,2)+MOD(INT((RC1+3)/2),3)*5+1,FALSE)&"|"&HLOOKUP(Sheet1!R2C1,Sheet1!R2C1:R16C1,MOD(RC1+4,2)+MOD(INT((RC1+4)/2),3)*5+1,FALSE)&"|"&HLOOKUP(Sheet1!R2C1,Sheet1!R2C1:R16C1,MOD(RC1+5,2)+MOD(INT((RC1+5)/2),3)*5+1,FALSE)&"|"&HLOOKUP(Sheet1!R2C1,Sheet1!R2C1:R16C1,MOD(RC1+6,2)+MOD(INT((RC1+6)/2),3)*5+1,FALSE) -> 101|130|131|160|161 | I23: =HLOOKUP(Sheet1!R2C1,Sheet1!R2C1:R16C1,MOD(RC1-1,3)+MOD(INT((RC1-1)/3),3)*5+3,FALSE)&"|"&HLOOKUP(Sheet1!R2C1,Sheet1!R2C1:R16C1,MOD(RC1,3)+MOD(INT((RC1)/3),3)*5+3,FALSE)&"|"&HLOOKUP(Sheet1!R2C1,Sheet1!R2C1:R16C1,MOD(RC1+1,3)+MOD(INT((RC1+1)/3),3)*5+3,FALSE)&"|"&HLOOKUP(Sheet1!R2C1,Sheet1!R2C1:R16C1,MOD(RC1+2,3)+MOD(INT((RC1+2)/3),3)*5+3,FALSE)&"|"&HLOOKUP(Sheet1!R2C1,Sheet1!R2C1:R16C1,MOD(RC1+3,3)+MOD(INT((RC1+3)/3),3)*5+3,FALSE) -> 163|164|102|103|104 | J23: =HLOOKUP(Sheet1!R2C1,Sheet1!R2C1:R16C1,MOD(RC1-1,3)+MOD(INT((RC1-1)/3),3)*5+3,FALSE)&"|"&HLOOKUP(Sheet1!R2C1,Sheet1!R2C1:R16C1,MOD(RC1,3)+MOD(INT((RC1)/3),3)*5+3,FALSE)&"|"&HLOOKUP(Sheet1!R2C1,Sheet1!R2C1:R16C1,MOD(RC1+1,3)+MOD(INT((RC1+1)/3),3)*5+3,FALSE)&"|"&HLOOKUP(Sheet1!R2C1,Sheet1!R2C1:R16C1,MOD(RC1+2,3)+MOD(INT((RC1+2)/3),3)*5+3,FALSE)&"|"&HLOOKUP(Sheet1!R2C1,Sheet1!R2C1:R16C1,MOD(RC1+3,3)+MOD(INT((RC1+3)/3),3)*5+3,FALSE) -> 163|164|102|103|104 | K23: =HLOOKUP(Sheet1!R2C1,Sheet1!R2C1:R16C1,MOD(RC1-1,3)+MOD(INT((RC1-1)/3),3)*5+3,FALSE)&"|"&HLOOKUP(Sheet1!R2C1,Sheet1!R2C1:R16C1,MOD(RC1,3)+MOD(INT((RC1)/3),3)*5+3,FALSE)&"|"&HLOOKUP(Sheet1!R2C1,Sheet1!R2C1:R16C1,MOD(RC1+1,3)+MOD(INT((RC1+1)/3),3)*5+3,FALSE)&"|"&HLOOKUP(Sheet1!R2C1,Sheet1!R2C1:R16C1,MOD(RC1+2,3)+MOD(INT((RC1+2)/3),3)*5+3,FALSE)&"|"&HLOOKUP(Sheet1!R2C1,Sheet1!R2C1:R16C1,MOD(RC1+3,3)+MOD(INT((RC1+3)/3),3)*5+3,FALSE) -> 163|164|102|103|104 | L23: 25|22|23|24 | M23: 10399|10399|10400|10400 | N23: 10030|10031|10032|10033 | O23: 1|1|1|1 | P23: 2500|2500|2500|2500
A24: 18 | B24: 16 | C24: 30 | D24: 20 | E24: 1000 | F24: =MOD(RC[-5]-1,3)*30+100&"|"&MOD(RC[-5]-1,3)*30+101&"|"&MOD(RC[-5]-1,3)*30+102&"|"&MOD(RC[-5]-1,3)*30+103&"|"&IF(MOD(RC[-5],4)=0,HLOOKUP(Sheet1!R2C10,Sheet1!R2C10:R7C10,MOD(RC[-5]/4-1,6)+1,FALSE),IF(MOD(RC[-5],2)=0,IF(RC[-5]>20,HLOOKUP(Sheet1!R2C7,Sheet1!R2C7:R43C7,MOD(RC[-5]/2-1,42)+1,FALSE),HLOOKUP(Sheet1!R2C4,Sheet1!R2C4:R7C4,MOD(RC[-5]-1,6)+1,FALSE)),MOD(RC[-5]-1,3)*30+104)) -> 160|161|162|163|171 | G24: =HLOOKUP(Sheet1!R2C1,Sheet1!R2C1:R16C1,MOD(RC1-1,2)+MOD(INT((RC1-1)/2),3)*5+1,FALSE)&"|"&HLOOKUP(Sheet1!R2C1,Sheet1!R2C1:R16C1,MOD(RC1,2)+MOD(INT((RC1)/2),3)*5+1,FALSE)&"|"&HLOOKUP(Sheet1!R2C1,Sheet1!R2C1:R16C1,MOD(RC1+1,2)+MOD(INT((RC1+1)/2),3)*5+1,FALSE)&"|"&HLOOKUP(Sheet1!R2C1,Sheet1!R2C1:R16C1,MOD(RC1+2,2)+MOD(INT((RC1+2)/2),3)*5+1,FALSE)&"|"&HLOOKUP(Sheet1!R2C1,Sheet1!R2C1:R16C1,MOD(RC1+3,2)+MOD(INT((RC1+3)/2),3)*5+1,FALSE) -> 161|100|101|130|131 | H24: =HLOOKUP(Sheet1!R2C1,Sheet1!R2C1:R16C1,MOD(RC1+2,2)+MOD(INT((RC1+2)/2),3)*5+1,FALSE)&"|"&HLOOKUP(Sheet1!R2C1,Sheet1!R2C1:R16C1,MOD(RC1+3,2)+MOD(INT((RC1+3)/2),3)*5+1,FALSE)&"|"&HLOOKUP(Sheet1!R2C1,Sheet1!R2C1:R16C1,MOD(RC1+4,2)+MOD(INT((RC1+4)/2),3)*5+1,FALSE)&"|"&HLOOKUP(Sheet1!R2C1,Sheet1!R2C1:R16C1,MOD(RC1+5,2)+MOD(INT((RC1+5)/2),3)*5+1,FALSE)&"|"&HLOOKUP(Sheet1!R2C1,Sheet1!R2C1:R16C1,MOD(RC1+6,2)+MOD(INT((RC1+6)/2),3)*5+1,FALSE) -> 130|131|160|161|100 | I24: =HLOOKUP(Sheet1!R2C1,Sheet1!R2C1:R16C1,MOD(RC1-1,3)+MOD(INT((RC1-1)/3),3)*5+3,FALSE)&"|"&HLOOKUP(Sheet1!R2C1,Sheet1!R2C1:R16C1,MOD(RC1,3)+MOD(INT((RC1)/3),3)*5+3,FALSE)&"|"&HLOOKUP(Sheet1!R2C1,Sheet1!R2C1:R16C1,MOD(RC1+1,3)+MOD(INT((RC1+1)/3),3)*5+3,FALSE)&"|"&HLOOKUP(Sheet1!R2C1,Sheet1!R2C1:R16C1,MOD(RC1+2,3)+MOD(INT((RC1+2)/3),3)*5+3,FALSE)&"|"&HLOOKUP(Sheet1!R2C1,Sheet1!R2C1:R16C1,MOD(RC1+3,3)+MOD(INT((RC1+3)/3),3)*5+3,FALSE) -> 164|102|103|104|132 | J24: =HLOOKUP(Sheet1!R2C1,Sheet1!R2C1:R16C1,MOD(RC1-1,3)+MOD(INT((RC1-1)/3),3)*5+3,FALSE)&"|"&HLOOKUP(Sheet1!R2C1,Sheet1!R2C1:R16C1,MOD(RC1,3)+MOD(INT((RC1)/3),3)*5+3,FALSE)&"|"&HLOOKUP(Sheet1!R2C1,Sheet1!R2C1:R16C1,MOD(RC1+1,3)+MOD(INT((RC1+1)/3),3)*5+3,FALSE)&"|"&HLOOKUP(Sheet1!R2C1,Sheet1!R2C1:R16C1,MOD(RC1+2,3)+MOD(INT((RC1+2)/3),3)*5+3,FALSE)&"|"&HLOOKUP(Sheet1!R2C1,Sheet1!R2C1:R16C1,MOD(RC1+3,3)+MOD(INT((RC1+3)/3),3)*5+3,FALSE) -> 164|102|103|104|132 | K24: =HLOOKUP(Sheet1!R2C1,Sheet1!R2C1:R16C1,MOD(RC1-1,3)+MOD(INT((RC1-1)/3),3)*5+3,FALSE)&"|"&HLOOKUP(Sheet1!R2C1,Sheet1!R2C1:R16C1,MOD(RC1,3)+MOD(INT((RC1)/3),3)*5+3,FALSE)&"|"&HLOOKUP(Sheet1!R2C1,Sheet1!R2C1:R16C1,MOD(RC1+1,3)+MOD(INT((RC1+1)/3),3)*5+3,FALSE)&"|"&HLOOKUP(Sheet1!R2C1,Sheet1!R2C1:R16C1,MOD(RC1+2,3)+MOD(INT((RC1+2)/3),3)*5+3,FALSE)&"|"&HLOOKUP(Sheet1!R2C1,Sheet1!R2C1:R16C1,MOD(RC1+3,3)+MOD(INT((RC1+3)/3),3)*5+3,FALSE) -> 164|102|103|104|132 | L24: 25|22|23|24 | M24: 11756|11756|11755|11755 | N24: 10030|10031|10032|10033 | O24: 1|1|1|1 | P24: 2500|2500|2500|2500
A25: 19 | B25: 17 | C25: 30 | D25: 20 | E25: 1000 | F25: =MOD(RC[-5]-1,3)*30+100&"|"&MOD(RC[-5]-1,3)*30+101&"|"&MOD(RC[-5]-1,3)*30+102&"|"&MOD(RC[-5]-1,3)*30+103&"|"&IF(MOD(RC[-5],4)=0,HLOOKUP(Sheet1!R2C10,Sheet1!R2C10:R7C10,MOD(RC[-5]/4-1,6)+1,FALSE),IF(MOD(RC[-5],2)=0,IF(RC[-5]>20,HLOOKUP(Sheet1!R2C7,Sheet1!R2C7:R43C7,MOD(RC[-5]/2-1,42)+1,FALSE),HLOOKUP(Sheet1!R2C4,Sheet1!R2C4:R7C4,MOD(RC[-5]-1,6)+1,FALSE)),MOD(RC[-5]-1,3)*30+104)) -> 100|101|102|103|104 | G25: =HLOOKUP(Sheet1!R2C1,Sheet1!R2C1:R16C1,MOD(RC1-1,2)+MOD(INT((RC1-1)/2),3)*5+1,FALSE)&"|"&HLOOKUP(Sheet1!R2C1,Sheet1!R2C1:R16C1,MOD(RC1,2)+MOD(INT((RC1)/2),3)*5+1,FALSE)&"|"&HLOOKUP(Sheet1!R2C1,Sheet1!R2C1:R16C1,MOD(RC1+1,2)+MOD(INT((RC1+1)/2),3)*5+1,FALSE)&"|"&HLOOKUP(Sheet1!R2C1,Sheet1!R2C1:R16C1,MOD(RC1+2,2)+MOD(INT((RC1+2)/2),3)*5+1,FALSE)&"|"&HLOOKUP(Sheet1!R2C1,Sheet1!R2C1:R16C1,MOD(RC1+3,2)+MOD(INT((RC1+3)/2),3)*5+1,FALSE) -> 100|101|130|131|160 | H25: =HLOOKUP(Sheet1!R2C1,Sheet1!R2C1:R16C1,MOD(RC1+2,2)+MOD(INT((RC1+2)/2),3)*5+1,FALSE)&"|"&HLOOKUP(Sheet1!R2C1,Sheet1!R2C1:R16C1,MOD(RC1+3,2)+MOD(INT((RC1+3)/2),3)*5+1,FALSE)&"|"&HLOOKUP(Sheet1!R2C1,Sheet1!R2C1:R16C1,MOD(RC1+4,2)+MOD(INT((RC1+4)/2),3)*5+1,FALSE)&"|"&HLOOKUP(Sheet1!R2C1,Sheet1!R2C1:R16C1,MOD(RC1+5,2)+MOD(INT((RC1+5)/2),3)*5+1,FALSE)&"|"&HLOOKUP(Sheet1!R2C1,Sheet1!R2C1:R16C1,MOD(RC1+6,2)+MOD(INT((RC1+6)/2),3)*5+1,FALSE) -> 131|160|161|100|101 | I25: =HLOOKUP(Sheet1!R2C1,Sheet1!R2C1:R16C1,MOD(RC1-1,3)+MOD(INT((RC1-1)/3),3)*5+3,FALSE)&"|"&HLOOKUP(Sheet1!R2C1,Sheet1!R2C1:R16C1,MOD(RC1,3)+MOD(INT((RC1)/3),3)*5+3,FALSE)&"|"&HLOOKUP(Sheet1!R2C1,Sheet1!R2C1:R16C1,MOD(RC1+1,3)+MOD(INT((RC1+1)/3),3)*5+3,FALSE)&"|"&HLOOKUP(Sheet1!R2C1,Sheet1!R2C1:R16C1,MOD(RC1+2,3)+MOD(INT((RC1+2)/3),3)*5+3,FALSE)&"|"&HLOOKUP(Sheet1!R2C1,Sheet1!R2C1:R16C1,MOD(RC1+3,3)+MOD(INT((RC1+3)/3),3)*5+3,FALSE) -> 102|103|104|132|133 | J25: =HLOOKUP(Sheet1!R2C1,Sheet1!R2C1:R16C1,MOD(RC1-1,3)+MOD(INT((RC1-1)/3),3)*5+3,FALSE)&"|"&HLOOKUP(Sheet1!R2C1,Sheet1!R2C1:R16C1,MOD(RC1,3)+MOD(INT((RC1)/3),3)*5+3,FALSE)&"|"&HLOOKUP(Sheet1!R2C1,Sheet1!R2C1:R16C1,MOD(RC1+1,3)+MOD(INT((RC1+1)/3),3)*5+3,FALSE)&"|"&HLOOKUP(Sheet1!R2C1,Sheet1!R2C1:R16C1,MOD(RC1+2,3)+MOD(INT((RC1+2)/3),3)*5+3,FALSE)&"|"&HLOOKUP(Sheet1!R2C1,Sheet1!R2C1:R16C1,MOD(RC1+3,3)+MOD(INT((RC1+3)/3),3)*5+3,FALSE) -> 102|103|104|132|133 | K25: =HLOOKUP(Sheet1!R2C1,Sheet1!R2C1:R16C1,MOD(RC1-1,3)+MOD(INT((RC1-1)/3),3)*5+3,FALSE)&"|"&HLOOKUP(Sheet1!R2C1,Sheet1!R2C1:R16C1,MOD(RC1,3)+MOD(INT((RC1)/3),3)*5+3,FALSE)&"|"&HLOOKUP(Sheet1!R2C1,Sheet1!R2C1:R16C1,MOD(RC1+1,3)+MOD(INT((RC1+1)/3),3)*5+3,FALSE)&"|"&HLOOKUP(Sheet1!R2C1,Sheet1!R2C1:R16C1,MOD(RC1+2,3)+MOD(INT((RC1+2)/3),3)*5+3,FALSE)&"|"&HLOOKUP(Sheet1!R2C1,Sheet1!R2C1:R16C1,MOD(RC1+3,3)+MOD(INT((RC1+3)/3),3)*5+3,FALSE) -> 102|103|104|132|133 | L25: 25|22|23|24 | M25: 13032|13031|13033|13033 | N25: 10030|10031|10032|10033 | O25: 1|1|1|1 | P25: 2500|2500|2500|2500
A26: 20 | B26: 18 | C26: 30 | D26: 20 | E26: 1000 | F26: =MOD(RC[-5]-1,3)*30+100&"|"&MOD(RC[-5]-1,3)*30+101&"|"&MOD(RC[-5]-1,3)*30+102&"|"&MOD(RC[-5]-1,3)*30+103&"|"&IF(MOD(RC[-5],4)=0,HLOOKUP(Sheet1!R2C10,Sheet1!R2C10:R7C10,MOD(RC[-5]/4-1,6)+1,FALSE),IF(MOD(RC[-5],2)=0,IF(RC[-5]>20,HLOOKUP(Sheet1!R2C7,Sheet1!R2C7:R43C7,MOD(RC[-5]/2-1,42)+1,FALSE),HLOOKUP(Sheet1!R2C4,Sheet1!R2C4:R7C4,MOD(RC[-5]-1,6)+1,FALSE)),MOD(RC[-5]-1,3)*30+104)) -> 130|131|132|133|194 | G26: =HLOOKUP(Sheet1!R2C1,Sheet1!R2C1:R16C1,MOD(RC1-1,2)+MOD(INT((RC1-1)/2),3)*5+1,FALSE)&"|"&HLOOKUP(Sheet1!R2C1,Sheet1!R2C1:R16C1,MOD(RC1,2)+MOD(INT((RC1)/2),3)*5+1,FALSE)&"|"&HLOOKUP(Sheet1!R2C1,Sheet1!R2C1:R16C1,MOD(RC1+1,2)+MOD(INT((RC1+1)/2),3)*5+1,FALSE)&"|"&HLOOKUP(Sheet1!R2C1,Sheet1!R2C1:R16C1,MOD(RC1+2,2)+MOD(INT((RC1+2)/2),3)*5+1,FALSE)&"|"&HLOOKUP(Sheet1!R2C1,Sheet1!R2C1:R16C1,MOD(RC1+3,2)+MOD(INT((RC1+3)/2),3)*5+1,FALSE) -> 101|130|131|160|161 | H26: =HLOOKUP(Sheet1!R2C1,Sheet1!R2C1:R16C1,MOD(RC1+2,2)+MOD(INT((RC1+2)/2),3)*5+1,FALSE)&"|"&HLOOKUP(Sheet1!R2C1,Sheet1!R2C1:R16C1,MOD(RC1+3,2)+MOD(INT((RC1+3)/2),3)*5+1,FALSE)&"|"&HLOOKUP(Sheet1!R2C1,Sheet1!R2C1:R16C1,MOD(RC1+4,2)+MOD(INT((RC1+4)/2),3)*5+1,FALSE)&"|"&HLOOKUP(Sheet1!R2C1,Sheet1!R2C1:R16C1,MOD(RC1+5,2)+MOD(INT((RC1+5)/2),3)*5+1,FALSE)&"|"&HLOOKUP(Sheet1!R2C1,Sheet1!R2C1:R16C1,MOD(RC1+6,2)+MOD(INT((RC1+6)/2),3)*5+1,FALSE) -> 160|161|100|101|130 | I26: =HLOOKUP(Sheet1!R2C1,Sheet1!R2C1:R16C1,MOD(RC1-1,3)+MOD(INT((RC1-1)/3),3)*5+3,FALSE)&"|"&HLOOKUP(Sheet1!R2C1,Sheet1!R2C1:R16C1,MOD(RC1,3)+MOD(INT((RC1)/3),3)*5+3,FALSE)&"|"&HLOOKUP(Sheet1!R2C1,Sheet1!R2C1:R16C1,MOD(RC1+1,3)+MOD(INT((RC1+1)/3),3)*5+3,FALSE)&"|"&HLOOKUP(Sheet1!R2C1,Sheet1!R2C1:R16C1,MOD(RC1+2,3)+MOD(INT((RC1+2)/3),3)*5+3,FALSE)&"|"&HLOOKUP(Sheet1!R2C1,Sheet1!R2C1:R16C1,MOD(RC1+3,3)+MOD(INT((RC1+3)/3),3)*5+3,FALSE) -> 103|104|132|133|134 | J26: =HLOOKUP(Sheet1!R2C1,Sheet1!R2C1:R16C1,MOD(RC1-1,3)+MOD(INT((RC1-1)/3),3)*5+3,FALSE)&"|"&HLOOKUP(Sheet1!R2C1,Sheet1!R2C1:R16C1,MOD(RC1,3)+MOD(INT((RC1)/3),3)*5+3,FALSE)&"|"&HLOOKUP(Sheet1!R2C1,Sheet1!R2C1:R16C1,MOD(RC1+1,3)+MOD(INT((RC1+1)/3),3)*5+3,FALSE)&"|"&HLOOKUP(Sheet1!R2C1,Sheet1!R2C1:R16C1,MOD(RC1+2,3)+MOD(INT((RC1+2)/3),3)*5+3,FALSE)&"|"&HLOOKUP(Sheet1!R2C1,Sheet1!R2C1:R16C1,MOD(RC1+3,3)+MOD(INT((RC1+3)/3),3)*5+3,FALSE) -> 103|104|132|133|134 | K26: =HLOOKUP(Sheet1!R2C1,Sheet1!R2C1:R16C1,MOD(RC1-1,3)+MOD(INT((RC1-1)/3),3)*5+3,FALSE)&"|"&HLOOKUP(Sheet1!R2C1,Sheet1!R2C1:R16C1,MOD(RC1,3)+MOD(INT((RC1)/3),3)*5+3,FALSE)&"|"&HLOOKUP(Sheet1!R2C1,Sheet1!R2C1:R16C1,MOD(RC1+1,3)+MOD(INT((RC1+1)/3),3)*5+3,FALSE)&"|"&HLOOKUP(Sheet1!R2C1,Sheet1!R2C1:R16C1,MOD(RC1+2,3)+MOD(INT((RC1+2)/3),3)*5+3,FALSE)&"|"&HLOOKUP(Sheet1!R2C1,Sheet1!R2C1:R16C1,MOD(RC1+3,3)+MOD(INT((RC1+3)/3),3)*5+3,FALSE) -> 103|104|132|133|134 | L26: 25|22|23|24 | M26: 14336|14336|14335|14335 | N26: 10030|10031|10032|10033|10030|10031|10032|10033|10030|10031|10032|10033|10030|10031|10032|10033|10030|10031|10032|10033|10030|10031|10032|10033|10030|10031|10032|10033|10030|10031|10032|10033|10030|10031|10032|10033|10030|10031|10032|10033 | O26: 1|1|1|1|1|1|1|1|1|1|1|1|1|1|1|1|1|1|1|1|1|1|1|1|1|1|1|1|1|1|1|1|1|1|1|1|1|1|1|1 | P26: 2500|2500|2500|2500|2500|2500|2500|2500|2500|2500|2500|2500|2500|2500|2500|2500|2500|2500|2500|2500|2500|2500|2500|2500|2500|2500|2500|2500|2500|2500|2500|2500|2500|2500|2500|2500|2500|2500|2500|2500
A27: 21 | B27: 19 | C27: 30 | D27: =R[-20]C+2 -> 22 | E27: 1000 | F27: =MOD(RC[-5]-1,3)*30+100&"|"&MOD(RC[-5]-1,3)*30+101&"|"&MOD(RC[-5]-1,3)*30+102&"|"&MOD(RC[-5]-1,3)*30+103&"|"&IF(MOD(RC[-5],4)=0,HLOOKUP(Sheet1!R2C10,Sheet1!R2C10:R7C10,MOD(RC[-5]/4-1,6)+1,FALSE),IF(MOD(RC[-5],2)=0,IF(RC[-5]>20,HLOOKUP(Sheet1!R2C7,Sheet1!R2C7:R43C7,MOD(RC[-5]/2-1,42)+1,FALSE),HLOOKUP(Sheet1!R2C4,Sheet1!R2C4:R7C4,MOD(RC[-5]-1,6)+1,FALSE)),MOD(RC[-5]-1,3)*30+104)) -> 160|161|162|163|164 | G27: =HLOOKUP(Sheet1!R2C1,Sheet1!R2C1:R16C1,MOD(RC1-1,2)+MOD(INT((RC1-1)/2),3)*5+1,FALSE)&"|"&HLOOKUP(Sheet1!R2C1,Sheet1!R2C1:R16C1,MOD(RC1,2)+MOD(INT((RC1)/2),3)*5+1,FALSE)&"|"&HLOOKUP(Sheet1!R2C1,Sheet1!R2C1:R16C1,MOD(RC1+1,2)+MOD(INT((RC1+1)/2),3)*5+1,FALSE)&"|"&HLOOKUP(Sheet1!R2C1,Sheet1!R2C1:R16C1,MOD(RC1+2,2)+MOD(INT((RC1+2)/2),3)*5+1,FALSE)&"|"&HLOOKUP(Sheet1!R2C1,Sheet1!R2C1:R16C1,MOD(RC1+3,2)+MOD(INT((RC1+3)/2),3)*5+1,FALSE) -> 130|131|160|161|100 | H27: =HLOOKUP(Sheet1!R2C1,Sheet1!R2C1:R16C1,MOD(RC1+2,2)+MOD(INT((RC1+2)/2),3)*5+1,FALSE)&"|"&HLOOKUP(Sheet1!R2C1,Sheet1!R2C1:R16C1,MOD(RC1+3,2)+MOD(INT((RC1+3)/2),3)*5+1,FALSE)&"|"&HLOOKUP(Sheet1!R2C1,Sheet1!R2C1:R16C1,MOD(RC1+4,2)+MOD(INT((RC1+4)/2),3)*5+1,FALSE)&"|"&HLOOKUP(Sheet1!R2C1,Sheet1!R2C1:R16C1,MOD(RC1+5,2)+MOD(INT((RC1+5)/2),3)*5+1,FALSE)&"|"&HLOOKUP(Sheet1!R2C1,Sheet1!R2C1:R16C1,MOD(RC1+6,2)+MOD(INT((RC1+6)/2),3)*5+1,FALSE) -> 161|100|101|130|131 | I27: =HLOOKUP(Sheet1!R2C1,Sheet1!R2C1:R16C1,MOD(RC1-1,3)+MOD(INT((RC1-1)/3),3)*5+3,FALSE)&"|"&HLOOKUP(Sheet1!R2C1,Sheet1!R2C1:R16C1,MOD(RC1,3)+MOD(INT((RC1)/3),3)*5+3,FALSE)&"|"&HLOOKUP(Sheet1!R2C1,Sheet1!R2C1:R16C1,MOD(RC1+1,3)+MOD(INT((RC1+1)/3),3)*5+3,FALSE)&"|"&HLOOKUP(Sheet1!R2C1,Sheet1!R2C1:R16C1,MOD(RC1+2,3)+MOD(INT((RC1+2)/3),3)*5+3,FALSE)&"|"&HLOOKUP(Sheet1!R2C1,Sheet1!R2C1:R16C1,MOD(RC1+3,3)+MOD(INT((RC1+3)/3),3)*5+3,FALSE) -> 104|132|133|134|162 | J27: =HLOOKUP(Sheet1!R2C1,Sheet1!R2C1:R16C1,MOD(RC1-1,3)+MOD(INT((RC1-1)/3),3)*5+3,FALSE)&"|"&HLOOKUP(Sheet1!R2C1,Sheet1!R2C1:R16C1,MOD(RC1,3)+MOD(INT((RC1)/3),3)*5+3,FALSE)&"|"&HLOOKUP(Sheet1!R2C1,Sheet1!R2C1:R16C1,MOD(RC1+1,3)+MOD(INT((RC1+1)/3),3)*5+3,FALSE)&"|"&HLOOKUP(Sheet1!R2C1,Sheet1!R2C1:R16C1,MOD(RC1+2,3)+MOD(INT((RC1+2)/3),3)*5+3,FALSE)&"|"&HLOOKUP(Sheet1!R2C1,Sheet1!R2C1:R16C1,MOD(RC1+3,3)+MOD(INT((RC1+3)/3),3)*5+3,FALSE) -> 104|132|133|134|162 | K27: =HLOOKUP(Sheet1!R2C1,Sheet1!R2C1:R16C1,MOD(RC1-1,3)+MOD(INT((RC1-1)/3),3)*5+3,FALSE)&"|"&HLOOKUP(Sheet1!R2C1,Sheet1!R2C1:R16C1,MOD(RC1,3)+MOD(INT((RC1)/3),3)*5+3,FALSE)&"|"&HLOOKUP(Sheet1!R2C1,Sheet1!R2C1:R16C1,MOD(RC1+1,3)+MOD(INT((RC1+1)/3),3)*5+3,FALSE)&"|"&HLOOKUP(Sheet1!R2C1,Sheet1!R2C1:R16C1,MOD(RC1+2,3)+MOD(INT((RC1+2)/3),3)*5+3,FALSE)&"|"&HLOOKUP(Sheet1!R2C1,Sheet1!R2C1:R16C1,MOD(RC1+3,3)+MOD(INT((RC1+3)/3),3)*5+3,FALSE) -> 104|132|133|134|162 | L27: 25|22|23|24 | M27: 17063|17063|17063|17063 | N27: 10030|10031|10032|10033 | O27: 1|1|1|1 | P27: 2500|2500|2500|2500
A28: 22 | B28: 20 | C28: 30 | D28: =R[-20]C+2 -> 22 | E28: 1000 | F28: =MOD(RC[-5]-1,3)*30+100&"|"&MOD(RC[-5]-1,3)*30+101&"|"&MOD(RC[-5]-1,3)*30+102&"|"&MOD(RC[-5]-1,3)*30+103&"|"&IF(MOD(RC[-5],4)=0,HLOOKUP(Sheet1!R2C10,Sheet1!R2C10:R7C10,MOD(RC[-5]/4-1,6)+1,FALSE),IF(MOD(RC[-5],2)=0,IF(RC[-5]>20,HLOOKUP(Sheet1!R2C7,Sheet1!R2C7:R43C7,MOD(RC[-5]/2-1,42)+1,FALSE),HLOOKUP(Sheet1!R2C4,Sheet1!R2C4:R7C4,MOD(RC[-5]-1,6)+1,FALSE)),MOD(RC[-5]-1,3)*30+104)) -> 100|101|102|103|122 | G28: =HLOOKUP(Sheet1!R2C1,Sheet1!R2C1:R16C1,MOD(RC1-1,2)+MOD(INT((RC1-1)/2),3)*5+1,FALSE)&"|"&HLOOKUP(Sheet1!R2C1,Sheet1!R2C1:R16C1,MOD(RC1,2)+MOD(INT((RC1)/2),3)*5+1,FALSE)&"|"&HLOOKUP(Sheet1!R2C1,Sheet1!R2C1:R16C1,MOD(RC1+1,2)+MOD(INT((RC1+1)/2),3)*5+1,FALSE)&"|"&HLOOKUP(Sheet1!R2C1,Sheet1!R2C1:R16C1,MOD(RC1+2,2)+MOD(INT((RC1+2)/2),3)*5+1,FALSE)&"|"&HLOOKUP(Sheet1!R2C1,Sheet1!R2C1:R16C1,MOD(RC1+3,2)+MOD(INT((RC1+3)/2),3)*5+1,FALSE) -> 131|160|161|100|101 | H28: =HLOOKUP(Sheet1!R2C1,Sheet1!R2C1:R16C1,MOD(RC1+2,2)+MOD(INT((RC1+2)/2),3)*5+1,FALSE)&"|"&HLOOKUP(Sheet1!R2C1,Sheet1!R2C1:R16C1,MOD(RC1+3,2)+MOD(INT((RC1+3)/2),3)*5+1,FALSE)&"|"&HLOOKUP(Sheet1!R2C1,Sheet1!R2C1:R16C1,MOD(RC1+4,2)+MOD(INT((RC1+4)/2),3)*5+1,FALSE)&"|"&HLOOKUP(Sheet1!R2C1,Sheet1!R2C1:R16C1,MOD(RC1+5,2)+MOD(INT((RC1+5)/2),3)*5+1,FALSE)&"|"&HLOOKUP(Sheet1!R2C1,Sheet1!R2C1:R16C1,MOD(RC1+6,2)+MOD(INT((RC1+6)/2),3)*5+1,FALSE) -> 100|101|130|131|160 | I28: =HLOOKUP(Sheet1!R2C1,Sheet1!R2C1:R16C1,MOD(RC1-1,3)+MOD(INT((RC1-1)/3),3)*5+3,FALSE)&"|"&HLOOKUP(Sheet1!R2C1,Sheet1!R2C1:R16C1,MOD(RC1,3)+MOD(INT((RC1)/3),3)*5+3,FALSE)&"|"&HLOOKUP(Sheet1!R2C1,Sheet1!R2C1:R16C1,MOD(RC1+1,3)+MOD(INT((RC1+1)/3),3)*5+3,FALSE)&"|"&HLOOKUP(Sheet1!R2C1,Sheet1!R2C1:R16C1,MOD(RC1+2,3)+MOD(INT((RC1+2)/3),3)*5+3,FALSE)&"|"&HLOOKUP(Sheet1!R2C1,Sheet1!R2C1:R16C1,MOD(RC1+3,3)+MOD(INT((RC1+3)/3),3)*5+3,FALSE) -> 132|133|134|162|163 | J28: =HLOOKUP(Sheet1!R2C1,Sheet1!R2C1:R16C1,MOD(RC1-1,3)+MOD(INT((RC1-1)/3),3)*5+3,FALSE)&"|"&HLOOKUP(Sheet1!R2C1,Sheet1!R2C1:R16C1,MOD(RC1,3)+MOD(INT((RC1)/3),3)*5+3,FALSE)&"|"&HLOOKUP(Sheet1!R2C1,Sheet1!R2C1:R16C1,MOD(RC1+1,3)+MOD(INT((RC1+1)/3),3)*5+3,FALSE)&"|"&HLOOKUP(Sheet1!R2C1,Sheet1!R2C1:R16C1,MOD(RC1+2,3)+MOD(INT((RC1+2)/3),3)*5+3,FALSE)&"|"&HLOOKUP(Sheet1!R2C1,Sheet1!R2C1:R16C1,MOD(RC1+3,3)+MOD(INT((RC1+3)/3),3)*5+3,FALSE) -> 132|133|134|162|163 | K28: =HLOOKUP(Sheet1!R2C1,Sheet1!R2C1:R16C1,MOD(RC1-1,3)+MOD(INT((RC1-1)/3),3)*5+3,FALSE)&"|"&HLOOKUP(Sheet1!R2C1,Sheet1!R2C1:R16C1,MOD(RC1,3)+MOD(INT((RC1)/3),3)*5+3,FALSE)&"|"&HLOOKUP(Sheet1!R2C1,Sheet1!R2C1:R16C1,MOD(RC1+1,3)+MOD(INT((RC1+1)/3),3)*5+3,FALSE)&"|"&HLOOKUP(Sheet1!R2C1,Sheet1!R2C1:R16C1,MOD(RC1+2,3)+MOD(INT((RC1+2)/3),3)*5+3,FALSE)&"|"&HLOOKUP(Sheet1!R2C1,Sheet1!R2C1:R16C1,MOD(RC1+3,3)+MOD(INT((RC1+3)/3),3)*5+3,FALSE) -> 132|133|134|162|163 | L28: 25|22|23|24 | M28: 19889|19889|19890|19890 | N28: 10030|10031|10032|10033 | O28: 1|1|1|1 | P28: 2500|2500|2500|2500
A29: 23 | B29: 21 | C29: 30 | D29: =R[-20]C+2 -> 22 | E29: 1000 | F29: =MOD(RC[-5]-1,3)*30+100&"|"&MOD(RC[-5]-1,3)*30+101&"|"&MOD(RC[-5]-1,3)*30+102&"|"&MOD(RC[-5]-1,3)*30+103&"|"&IF(MOD(RC[-5],4)=0,HLOOKUP(Sheet1!R2C10,Sheet1!R2C10:R7C10,MOD(RC[-5]/4-1,6)+1,FALSE),IF(MOD(RC[-5],2)=0,IF(RC[-5]>20,HLOOKUP(Sheet1!R2C7,Sheet1!R2C7:R43C7,MOD(RC[-5]/2-1,42)+1,FALSE),HLOOKUP(Sheet1!R2C4,Sheet1!R2C4:R7C4,MOD(RC[-5]-1,6)+1,FALSE)),MOD(RC[-5]-1,3)*30+104)) -> 130|131|132|133|134 | G29: =HLOOKUP(Sheet1!R2C1,Sheet1!R2C1:R16C1,MOD(RC1-1,2)+MOD(INT((RC1-1)/2),3)*5+1,FALSE)&"|"&HLOOKUP(Sheet1!R2C1,Sheet1!R2C1:R16C1,MOD(RC1,2)+MOD(INT((RC1)/2),3)*5+1,FALSE)&"|"&HLOOKUP(Sheet1!R2C1,Sheet1!R2C1:R16C1,MOD(RC1+1,2)+MOD(INT((RC1+1)/2),3)*5+1,FALSE)&"|"&HLOOKUP(Sheet1!R2C1,Sheet1!R2C1:R16C1,MOD(RC1+2,2)+MOD(INT((RC1+2)/2),3)*5+1,FALSE)&"|"&HLOOKUP(Sheet1!R2C1,Sheet1!R2C1:R16C1,MOD(RC1+3,2)+MOD(INT((RC1+3)/2),3)*5+1,FALSE) -> 160|161|100|101|130 | H29: =HLOOKUP(Sheet1!R2C1,Sheet1!R2C1:R16C1,MOD(RC1+2,2)+MOD(INT((RC1+2)/2),3)*5+1,FALSE)&"|"&HLOOKUP(Sheet1!R2C1,Sheet1!R2C1:R16C1,MOD(RC1+3,2)+MOD(INT((RC1+3)/2),3)*5+1,FALSE)&"|"&HLOOKUP(Sheet1!R2C1,Sheet1!R2C1:R16C1,MOD(RC1+4,2)+MOD(INT((RC1+4)/2),3)*5+1,FALSE)&"|"&HLOOKUP(Sheet1!R2C1,Sheet1!R2C1:R16C1,MOD(RC1+5,2)+MOD(INT((RC1+5)/2),3)*5+1,FALSE)&"|"&HLOOKUP(Sheet1!R2C1,Sheet1!R2C1:R16C1,MOD(RC1+6,2)+MOD(INT((RC1+6)/2),3)*5+1,FALSE) -> 101|130|131|160|161 | I29: =HLOOKUP(Sheet1!R2C1,Sheet1!R2C1:R16C1,MOD(RC1-1,3)+MOD(INT((RC1-1)/3),3)*5+3,FALSE)&"|"&HLOOKUP(Sheet1!R2C1,Sheet1!R2C1:R16C1,MOD(RC1,3)+MOD(INT((RC1)/3),3)*5+3,FALSE)&"|"&HLOOKUP(Sheet1!R2C1,Sheet1!R2C1:R16C1,MOD(RC1+1,3)+MOD(INT((RC1+1)/3),3)*5+3,FALSE)&"|"&HLOOKUP(Sheet1!R2C1,Sheet1!R2C1:R16C1,MOD(RC1+2,3)+MOD(INT((RC1+2)/3),3)*5+3,FALSE)&"|"&HLOOKUP(Sheet1!R2C1,Sheet1!R2C1:R16C1,MOD(RC1+3,3)+MOD(INT((RC1+3)/3),3)*5+3,FALSE) -> 133|134|162|163|164 | J29: =HLOOKUP(Sheet1!R2C1,Sheet1!R2C1:R16C1,MOD(RC1-1,3)+MOD(INT((RC1-1)/3),3)*5+3,FALSE)&"|"&HLOOKUP(Sheet1!R2C1,Sheet1!R2C1:R16C1,MOD(RC1,3)+MOD(INT((RC1)/3),3)*5+3,FALSE)&"|"&HLOOKUP(Sheet1!R2C1,Sheet1!R2C1:R16C1,MOD(RC1+1,3)+MOD(INT((RC1+1)/3),3)*5+3,FALSE)&"|"&HLOOKUP(Sheet1!R2C1,Sheet1!R2C1:R16C1,MOD(RC1+2,3)+MOD(INT((RC1+2)/3),3)*5+3,FALSE)&"|"&HLOOKUP(Sheet1!R2C1,Sheet1!R2C1:R16C1,MOD(RC1+3,3)+MOD(INT((RC1+3)/3),3)*5+3,FALSE) -> 133|134|162|163|164 | K29: =HLOOKUP(Sheet1!R2C1,Sheet1!R2C1:R16C1,MOD(RC1-1,3)+MOD(INT((RC1-1)/3),3)*5+3,FALSE)&"|"&HLOOKUP(Sheet1!R2C1,Sheet1!R2C1:R16C1,MOD(RC1,3)+MOD(INT((RC1)/3),3)*5+3,FALSE)&"|"&HLOOKUP(Sheet1!R2C1,Sheet1!R2C1:R16C1,MOD(RC1+1,3)+MOD(INT((RC1+1)/3),3)*5+3,FALSE)&"|"&HLOOKUP(Sheet1!R2C1,Sheet1!R2C1:R16C1,MOD(RC1+2,3)+MOD(INT((RC1+2)/3),3)*5+3,FALSE)&"|"&HLOOKUP(Sheet1!R2C1,Sheet1!R2C1:R16C1,MOD(RC1+3,3)+MOD(INT((RC1+3)/3),3)*5+3,FALSE) -> 133|134|162|163|164 | L29: 25|22|23|24 | M29: 21898|21898|21898|21898 | N29: 10030|10031|10032|10033 | O29: 1|1|1|1 | P29: 2500|2500|2500|2500
A30: 24 | B30: 22 | C30: 30 | D30: =R[-20]C+2 -> 22 | E30: 1000 | F30: =MOD(RC[-5]-1,3)*30+100&"|"&MOD(RC[-5]-1,3)*30+101&"|"&MOD(RC[-5]-1,3)*30+102&"|"&MOD(RC[-5]-1,3)*30+103&"|"&IF(MOD(RC[-5],4)=0,HLOOKUP(Sheet1!R2C10,Sheet1!R2C10:R7C10,MOD(RC[-5]/4-1,6)+1,FALSE),IF(MOD(RC[-5],2)=0,IF(RC[-5]>20,HLOOKUP(Sheet1!R2C7,Sheet1!R2C7:R43C7,MOD(RC[-5]/2-1,42)+1,FALSE),HLOOKUP(Sheet1!R2C4,Sheet1!R2C4:R7C4,MOD(RC[-5]-1,6)+1,FALSE)),MOD(RC[-5]-1,3)*30+104)) -> 160|161|162|163|195 | G30: =HLOOKUP(Sheet1!R2C1,Sheet1!R2C1:R16C1,MOD(RC1-1,2)+MOD(INT((RC1-1)/2),3)*5+1,FALSE)&"|"&HLOOKUP(Sheet1!R2C1,Sheet1!R2C1:R16C1,MOD(RC1,2)+MOD(INT((RC1)/2),3)*5+1,FALSE)&"|"&HLOOKUP(Sheet1!R2C1,Sheet1!R2C1:R16C1,MOD(RC1+1,2)+MOD(INT((RC1+1)/2),3)*5+1,FALSE)&"|"&HLOOKUP(Sheet1!R2C1,Sheet1!R2C1:R16C1,MOD(RC1+2,2)+MOD(INT((RC1+2)/2),3)*5+1,FALSE)&"|"&HLOOKUP(Sheet1!R2C1,Sheet1!R2C1:R16C1,MOD(RC1+3,2)+MOD(INT((RC1+3)/2),3)*5+1,FALSE) -> 161|100|101|130|131 | H30: =HLOOKUP(Sheet1!R2C1,Sheet1!R2C1:R16C1,MOD(RC1+2,2)+MOD(INT((RC1+2)/2),3)*5+1,FALSE)&"|"&HLOOKUP(Sheet1!R2C1,Sheet1!R2C1:R16C1,MOD(RC1+3,2)+MOD(INT((RC1+3)/2),3)*5+1,FALSE)&"|"&HLOOKUP(Sheet1!R2C1,Sheet1!R2C1:R16C1,MOD(RC1+4,2)+MOD(INT((RC1+4)/2),3)*5+1,FALSE)&"|"&HLOOKUP(Sheet1!R2C1,Sheet1!R2C1:R16C1,MOD(RC1+5,2)+MOD(INT((RC1+5)/2),3)*5+1,FALSE)&"|"&HLOOKUP(Sheet1!R2C1,Sheet1!R2C1:R16C1,MOD(RC1+6,2)+MOD(INT((RC1+6)/2),3)*5+1,FALSE) -> 130|131|160|161|100 | I30: =HLOOKUP(Sheet1!R2C1,Sheet1!R2C1:R16C1,MOD(RC1-1,3)+MOD(INT((RC1-1)/3),3)*5+3,FALSE)&"|"&HLOOKUP(Sheet1!R2C1,Sheet1!R2C1:R16C1,MOD(RC1,3)+MOD(INT((RC1)/3),3)*5+3,FALSE)&"|"&HLOOKUP(Sheet1!R2C1,Sheet1!R2C1:R16C1,MOD(RC1+1,3)+MOD(INT((RC1+1)/3),3)*5+3,FALSE)&"|"&HLOOKUP(Sheet1!R2C1,Sheet1!R2C1:R16C1,MOD(RC1+2,3)+MOD(INT((RC1+2)/3),3)*5+3,FALSE)&"|"&HLOOKUP(Sheet1!R2C1,Sheet1!R2C1:R16C1,MOD(RC1+3,3)+MOD(INT((RC1+3)/3),3)*5+3,FALSE) -> 134|162|163|164|102 | J30: =HLOOKUP(Sheet1!R2C1,Sheet1!R2C1:R16C1,MOD(RC1-1,3)+MOD(INT((RC1-1)/3),3)*5+3,FALSE)&"|"&HLOOKUP(Sheet1!R2C1,Sheet1!R2C1:R16C1,MOD(RC1,3)+MOD(INT((RC1)/3),3)*5+3,FALSE)&"|"&HLOOKUP(Sheet1!R2C1,Sheet1!R2C1:R16C1,MOD(RC1+1,3)+MOD(INT((RC1+1)/3),3)*5+3,FALSE)&"|"&HLOOKUP(Sheet1!R2C1,Sheet1!R2C1:R16C1,MOD(RC1+2,3)+MOD(INT((RC1+2)/3),3)*5+3,FALSE)&"|"&HLOOKUP(Sheet1!R2C1,Sheet1!R2C1:R16C1,MOD(RC1+3,3)+MOD(INT((RC1+3)/3),3)*5+3,FALSE) -> 134|162|163|164|102 | K30: =HLOOKUP(Sheet1!R2C1,Sheet1!R2C1:R16C1,MOD(RC1-1,3)+MOD(INT((RC1-1)/3),3)*5+3,FALSE)&"|"&HLOOKUP(Sheet1!R2C1,Sheet1!R2C1:R16C1,MOD(RC1,3)+MOD(INT((RC1)/3),3)*5+3,FALSE)&"|"&HLOOKUP(Sheet1!R2C1,Sheet1!R2C1:R16C1,MOD(RC1+1,3)+MOD(INT((RC1+1)/3),3)*5+3,FALSE)&"|"&HLOOKUP(Sheet1!R2C1,Sheet1!R2C1:R16C1,MOD(RC1+2,3)+MOD(INT((RC1+2)/3),3)*5+3,FALSE)&"|"&HLOOKUP(Sheet1!R2C1,Sheet1!R2C1:R16C1,MOD(RC1+3,3)+MOD(INT((RC1+3)/3),3)*5+3,FALSE) -> 134|162|163|164|102 | L30: 25|22|23|24 | M30: 23505|23505|23505|23505 | N30: 10030|10031|10032|10033 | O30: 1|1|1|1 | P30: 2500|2500|2500|2500
A31: 25 | B31: 23 | C31: 30 | D31: =R[-20]C+2 -> 22 | E31: 1000 | F31: =MOD(RC[-5]-1,3)*30+100&"|"&MOD(RC[-5]-1,3)*30+101&"|"&MOD(RC[-5]-1,3)*30+102&"|"&MOD(RC[-5]-1,3)*30+103&"|"&IF(MOD(RC[-5],4)=0,HLOOKUP(Sheet1!R2C10,Sheet1!R2C10:R7C10,MOD(RC[-5]/4-1,6)+1,FALSE),IF(MOD(RC[-5],2)=0,IF(RC[-5]>20,HLOOKUP(Sheet1!R2C7,Sheet1!R2C7:R43C7,MOD(RC[-5]/2-1,42)+1,FALSE),HLOOKUP(Sheet1!R2C4,Sheet1!R2C4:R7C4,MOD(RC[-5]-1,6)+1,FALSE)),MOD(RC[-5]-1,3)*30+104)) -> 100|101|102|103|104 | G31: =HLOOKUP(Sheet1!R2C1,Sheet1!R2C1:R16C1,MOD(RC1-1,2)+MOD(INT((RC1-1)/2),3)*5+1,FALSE)&"|"&HLOOKUP(Sheet1!R2C1,Sheet1!R2C1:R16C1,MOD(RC1,2)+MOD(INT((RC1)/2),3)*5+1,FALSE)&"|"&HLOOKUP(Sheet1!R2C1,Sheet1!R2C1:R16C1,MOD(RC1+1,2)+MOD(INT((RC1+1)/2),3)*5+1,FALSE)&"|"&HLOOKUP(Sheet1!R2C1,Sheet1!R2C1:R16C1,MOD(RC1+2,2)+MOD(INT((RC1+2)/2),3)*5+1,FALSE)&"|"&HLOOKUP(Sheet1!R2C1,Sheet1!R2C1:R16C1,MOD(RC1+3,2)+MOD(INT((RC1+3)/2),3)*5+1,FALSE) -> 100|101|130|131|160 | H31: =HLOOKUP(Sheet1!R2C1,Sheet1!R2C1:R16C1,MOD(RC1+2,2)+MOD(INT((RC1+2)/2),3)*5+1,FALSE)&"|"&HLOOKUP(Sheet1!R2C1,Sheet1!R2C1:R16C1,MOD(RC1+3,2)+MOD(INT((RC1+3)/2),3)*5+1,FALSE)&"|"&HLOOKUP(Sheet1!R2C1,Sheet1!R2C1:R16C1,MOD(RC1+4,2)+MOD(INT((RC1+4)/2),3)*5+1,FALSE)&"|"&HLOOKUP(Sheet1!R2C1,Sheet1!R2C1:R16C1,MOD(RC1+5,2)+MOD(INT((RC1+5)/2),3)*5+1,FALSE)&"|"&HLOOKUP(Sheet1!R2C1,Sheet1!R2C1:R16C1,MOD(RC1+6,2)+MOD(INT((RC1+6)/2),3)*5+1,FALSE) -> 131|160|161|100|101 | I31: =HLOOKUP(Sheet1!R2C1,Sheet1!R2C1:R16C1,MOD(RC1-1,3)+MOD(INT((RC1-1)/3),3)*5+3,FALSE)&"|"&HLOOKUP(Sheet1!R2C1,Sheet1!R2C1:R16C1,MOD(RC1,3)+MOD(INT((RC1)/3),3)*5+3,FALSE)&"|"&HLOOKUP(Sheet1!R2C1,Sheet1!R2C1:R16C1,MOD(RC1+1,3)+MOD(INT((RC1+1)/3),3)*5+3,FALSE)&"|"&HLOOKUP(Sheet1!R2C1,Sheet1!R2C1:R16C1,MOD(RC1+2,3)+MOD(INT((RC1+2)/3),3)*5+3,FALSE)&"|"&HLOOKUP(Sheet1!R2C1,Sheet1!R2C1:R16C1,MOD(RC1+3,3)+MOD(INT((RC1+3)/3),3)*5+3,FALSE) -> 162|163|164|102|103 | J31: =HLOOKUP(Sheet1!R2C1,Sheet1!R2C1:R16C1,MOD(RC1-1,3)+MOD(INT((RC1-1)/3),3)*5+3,FALSE)&"|"&HLOOKUP(Sheet1!R2C1,Sheet1!R2C1:R16C1,MOD(RC1,3)+MOD(INT((RC1)/3),3)*5+3,FALSE)&"|"&HLOOKUP(Sheet1!R2C1,Sheet1!R2C1:R16C1,MOD(RC1+1,3)+MOD(INT((RC1+1)/3),3)*5+3,FALSE)&"|"&HLOOKUP(Sheet1!R2C1,Sheet1!R2C1:R16C1,MOD(RC1+2,3)+MOD(INT((RC1+2)/3),3)*5+3,FALSE)&"|"&HLOOKUP(Sheet1!R2C1,Sheet1!R2C1:R16C1,MOD(RC1+3,3)+MOD(INT((RC1+3)/3),3)*5+3,FALSE) -> 162|163|164|102|103 | K31: =HLOOKUP(Sheet1!R2C1,Sheet1!R2C1:R16C1,MOD(RC1-1,3)+MOD(INT((RC1-1)/3),3)*5+3,FALSE)&"|"&HLOOKUP(Sheet1!R2C1,Sheet1!R2C1:R16C1,MOD(RC1,3)+MOD(INT((RC1)/3),3)*5+3,FALSE)&"|"&HLOOKUP(Sheet1!R2C1,Sheet1!R2C1:R16C1,MOD(RC1+1,3)+MOD(INT((RC1+1)/3),3)*5+3,FALSE)&"|"&HLOOKUP(Sheet1!R2C1,Sheet1!R2C1:R16C1,MOD(RC1+2,3)+MOD(INT((RC1+2)/3),3)*5+3,FALSE)&"|"&HLOOKUP(Sheet1!R2C1,Sheet1!R2C1:R16C1,MOD(RC1+3,3)+MOD(INT((RC1+3)/3),3)*5+3,FALSE) -> 162|163|164|102|103 | L31: 25|22|23|24 | M31: 24904|24904|24903|24903 | N31: 10030|10031|10032|10033|10030|10031|10032|10033|10030|10031|10032|10033|10030|10031|10032|10033|10030|10031|10032|10033|10030|10031|10032|10033|10030|10031|10032|10033|10030|10031|10032|10033|10030|10031|10032|10033|10030|10031|10032|10033 | O31: 1|1|1|1|1|1|1|1|1|1|1|1|1|1|1|1|1|1|1|1|1|1|1|1|1|1|1|1|1|1|1|1|1|1|1|1|1|1|1|1 | P31: 2500|2500|2500|2500|2500|2500|2500|2500|2500|2500|2500|2500|2500|2500|2500|2500|2500|2500|2500|2500|2500|2500|2500|2500|2500|2500|2500|2500|2500|2500|2500|2500|2500|2500|2500|2500|2500|2500|2500|2500
A32: 26 | B32: 24 | C32: 30 | D32: =R[-20]C+2 -> 22 | E32: 1000 | F32: =MOD(RC[-5]-1,3)*30+100&"|"&MOD(RC[-5]-1,3)*30+101&"|"&MOD(RC[-5]-1,3)*30+102&"|"&MOD(RC[-5]-1,3)*30+103&"|"&IF(MOD(RC[-5],4)=0,HLOOKUP(Sheet1!R2C10,Sheet1!R2C10:R7C10,MOD(RC[-5]/4-1,6)+1,FALSE),IF(MOD(RC[-5],2)=0,IF(RC[-5]>20,HLOOKUP(Sheet1!R2C7,Sheet1!R2C7:R43C7,MOD(RC[-5]/2-1,42)+1,FALSE),HLOOKUP(Sheet1!R2C4,Sheet1!R2C4:R7C4,MOD(RC[-5]-1,6)+1,FALSE)),MOD(RC[-5]-1,3)*30+104)) -> 130|131|132|133|124 | G32: =HLOOKUP(Sheet1!R2C1,Sheet1!R2C1:R16C1,MOD(RC1-1,2)+MOD(INT((RC1-1)/2),3)*5+1,FALSE)&"|"&HLOOKUP(Sheet1!R2C1,Sheet1!R2C1:R16C1,MOD(RC1,2)+MOD(INT((RC1)/2),3)*5+1,FALSE)&"|"&HLOOKUP(Sheet1!R2C1,Sheet1!R2C1:R16C1,MOD(RC1+1,2)+MOD(INT((RC1+1)/2),3)*5+1,FALSE)&"|"&HLOOKUP(Sheet1!R2C1,Sheet1!R2C1:R16C1,MOD(RC1+2,2)+MOD(INT((RC1+2)/2),3)*5+1,FALSE)&"|"&HLOOKUP(Sheet1!R2C1,Sheet1!R2C1:R16C1,MOD(RC1+3,2)+MOD(INT((RC1+3)/2),3)*5+1,FALSE) -> 101|130|131|160|161 | H32: =HLOOKUP(Sheet1!R2C1,Sheet1!R2C1:R16C1,MOD(RC1+2,2)+MOD(INT((RC1+2)/2),3)*5+1,FALSE)&"|"&HLOOKUP(Sheet1!R2C1,Sheet1!R2C1:R16C1,MOD(RC1+3,2)+MOD(INT((RC1+3)/2),3)*5+1,FALSE)&"|"&HLOOKUP(Sheet1!R2C1,Sheet1!R2C1:R16C1,MOD(RC1+4,2)+MOD(INT((RC1+4)/2),3)*5+1,FALSE)&"|"&HLOOKUP(Sheet1!R2C1,Sheet1!R2C1:R16C1,MOD(RC1+5,2)+MOD(INT((RC1+5)/2),3)*5+1,FALSE)&"|"&HLOOKUP(Sheet1!R2C1,Sheet1!R2C1:R16C1,MOD(RC1+6,2)+MOD(INT((RC1+6)/2),3)*5+1,FALSE) -> 160|161|100|101|130 | I32: =HLOOKUP(Sheet1!R2C1,Sheet1!R2C1:R16C1,MOD(RC1-1,3)+MOD(INT((RC1-1)/3),3)*5+3,FALSE)&"|"&HLOOKUP(Sheet1!R2C1,Sheet1!R2C1:R16C1,MOD(RC1,3)+MOD(INT((RC1)/3),3)*5+3,FALSE)&"|"&HLOOKUP(Sheet1!R2C1,Sheet1!R2C1:R16C1,MOD(RC1+1,3)+MOD(INT((RC1+1)/3),3)*5+3,FALSE)&"|"&HLOOKUP(Sheet1!R2C1,Sheet1!R2C1:R16C1,MOD(RC1+2,3)+MOD(INT((RC1+2)/3),3)*5+3,FALSE)&"|"&HLOOKUP(Sheet1!R2C1,Sheet1!R2C1:R16C1,MOD(RC1+3,3)+MOD(INT((RC1+3)/3),3)*5+3,FALSE) -> 163|164|102|103|104 | J32: =HLOOKUP(Sheet1!R2C1,Sheet1!R2C1:R16C1,MOD(RC1-1,3)+MOD(INT((RC1-1)/3),3)*5+3,FALSE)&"|"&HLOOKUP(Sheet1!R2C1,Sheet1!R2C1:R16C1,MOD(RC1,3)+MOD(INT((RC1)/3),3)*5+3,FALSE)&"|"&HLOOKUP(Sheet1!R2C1,Sheet1!R2C1:R16C1,MOD(RC1+1,3)+MOD(INT((RC1+1)/3),3)*5+3,FALSE)&"|"&HLOOKUP(Sheet1!R2C1,Sheet1!R2C1:R16C1,MOD(RC1+2,3)+MOD(INT((RC1+2)/3),3)*5+3,FALSE)&"|"&HLOOKUP(Sheet1!R2C1,Sheet1!R2C1:R16C1,MOD(RC1+3,3)+MOD(INT((RC1+3)/3),3)*5+3,FALSE) -> 163|164|102|103|104 | K32: =HLOOKUP(Sheet1!R2C1,Sheet1!R2C1:R16C1,MOD(RC1-1,3)+MOD(INT((RC1-1)/3),3)*5+3,FALSE)&"|"&HLOOKUP(Sheet1!R2C1,Sheet1!R2C1:R16C1,MOD(RC1,3)+MOD(INT((RC1)/3),3)*5+3,FALSE)&"|"&HLOOKUP(Sheet1!R2C1,Sheet1!R2C1:R16C1,MOD(RC1+1,3)+MOD(INT((RC1+1)/3),3)*5+3,FALSE)&"|"&HLOOKUP(Sheet1!R2C1,Sheet1!R2C1:R16C1,MOD(RC1+2,3)+MOD(INT((RC1+2)/3),3)*5+3,FALSE)&"|"&HLOOKUP(Sheet1!R2C1,Sheet1!R2C1:R16C1,MOD(RC1+3,3)+MOD(INT((RC1+3)/3),3)*5+3,FALSE) -> 163|164|102|103|104 | L32: 25|22|23|24 | M32: 25837|25836|25838|25838 | N32: 10030|10031|10032|10033 | O32: 1|1|1|1 | P32: 2500|2500|2500|2500
A33: 27 | B33: 25 | C33: 30 | D33: =R[-20]C+2 -> 22 | E33: 1000 | F33: =MOD(RC[-5]-1,3)*30+100&"|"&MOD(RC[-5]-1,3)*30+101&"|"&MOD(RC[-5]-1,3)*30+102&"|"&MOD(RC[-5]-1,3)*30+103&"|"&IF(MOD(RC[-5],4)=0,HLOOKUP(Sheet1!R2C10,Sheet1!R2C10:R7C10,MOD(RC[-5]/4-1,6)+1,FALSE),IF(MOD(RC[-5],2)=0,IF(RC[-5]>20,HLOOKUP(Sheet1!R2C7,Sheet1!R2C7:R43C7,MOD(RC[-5]/2-1,42)+1,FALSE),HLOOKUP(Sheet1!R2C4,Sheet1!R2C4:R7C4,MOD(RC[-5]-1,6)+1,FALSE)),MOD(RC[-5]-1,3)*30+104)) -> 160|161|162|163|164 | G33: =HLOOKUP(Sheet1!R2C1,Sheet1!R2C1:R16C1,MOD(RC1-1,2)+MOD(INT((RC1-1)/2),3)*5+1,FALSE)&"|"&HLOOKUP(Sheet1!R2C1,Sheet1!R2C1:R16C1,MOD(RC1,2)+MOD(INT((RC1)/2),3)*5+1,FALSE)&"|"&HLOOKUP(Sheet1!R2C1,Sheet1!R2C1:R16C1,MOD(RC1+1,2)+MOD(INT((RC1+1)/2),3)*5+1,FALSE)&"|"&HLOOKUP(Sheet1!R2C1,Sheet1!R2C1:R16C1,MOD(RC1+2,2)+MOD(INT((RC1+2)/2),3)*5+1,FALSE)&"|"&HLOOKUP(Sheet1!R2C1,Sheet1!R2C1:R16C1,MOD(RC1+3,2)+MOD(INT((RC1+3)/2),3)*5+1,FALSE) -> 130|131|160|161|100 | H33: =HLOOKUP(Sheet1!R2C1,Sheet1!R2C1:R16C1,MOD(RC1+2,2)+MOD(INT((RC1+2)/2),3)*5+1,FALSE)&"|"&HLOOKUP(Sheet1!R2C1,Sheet1!R2C1:R16C1,MOD(RC1+3,2)+MOD(INT((RC1+3)/2),3)*5+1,FALSE)&"|"&HLOOKUP(Sheet1!R2C1,Sheet1!R2C1:R16C1,MOD(RC1+4,2)+MOD(INT((RC1+4)/2),3)*5+1,FALSE)&"|"&HLOOKUP(Sheet1!R2C1,Sheet1!R2C1:R16C1,MOD(RC1+5,2)+MOD(INT((RC1+5)/2),3)*5+1,FALSE)&"|"&HLOOKUP(Sheet1!R2C1,Sheet1!R2C1:R16C1,MOD(RC1+6,2)+MOD(INT((RC1+6)/2),3)*5+1,FALSE) -> 161|100|101|130|131 | I33: =HLOOKUP(Sheet1!R2C1,Sheet1!R2C1:R16C1,MOD(RC1-1,3)+MOD(INT((RC1-1)/3),3)*5+3,FALSE)&"|"&HLOOKUP(Sheet1!R2C1,Sheet1!R2C1:R16C1,MOD(RC1,3)+MOD(INT((RC1)/3),3)*5+3,FALSE)&"|"&HLOOKUP(Sheet1!R2C1,Sheet1!R2C1:R16C1,MOD(RC1+1,3)+MOD(INT((RC1+1)/3),3)*5+3,FALSE)&"|"&HLOOKUP(Sheet1!R2C1,Sheet1!R2C1:R16C1,MOD(RC1+2,3)+MOD(INT((RC1+2)/3),3)*5+3,FALSE)&"|"&HLOOKUP(Sheet1!R2C1,Sheet1!R2C1:R16C1,MOD(RC1+3,3)+MOD(INT((RC1+3)/3),3)*5+3,FALSE) -> 164|102|103|104|132 | J33: =HLOOKUP(Sheet1!R2C1,Sheet1!R2C1:R16C1,MOD(RC1-1,3)+MOD(INT((RC1-1)/3),3)*5+3,FALSE)&"|"&HLOOKUP(Sheet1!R2C1,Sheet1!R2C1:R16C1,MOD(RC1,3)+MOD(INT((RC1)/3),3)*5+3,FALSE)&"|"&HLOOKUP(Sheet1!R2C1,Sheet1!R2C1:R16C1,MOD(RC1+1,3)+MOD(INT((RC1+1)/3),3)*5+3,FALSE)&"|"&HLOOKUP(Sheet1!R2C1,Sheet1!R2C1:R16C1,MOD(RC1+2,3)+MOD(INT((RC1+2)/3),3)*5+3,FALSE)&"|"&HLOOKUP(Sheet1!R2C1,Sheet1!R2C1:R16C1,MOD(RC1+3,3)+MOD(INT((RC1+3)/3),3)*5+3,FALSE) -> 164|102|103|104|132 | K33: =HLOOKUP(Sheet1!R2C1,Sheet1!R2C1:R16C1,MOD(RC1-1,3)+MOD(INT((RC1-1)/3),3)*5+3,FALSE)&"|"&HLOOKUP(Sheet1!R2C1,Sheet1!R2C1:R16C1,MOD(RC1,3)+MOD(INT((RC1)/3),3)*5+3,FALSE)&"|"&HLOOKUP(Sheet1!R2C1,Sheet1!R2C1:R16C1,MOD(RC1+1,3)+MOD(INT((RC1+1)/3),3)*5+3,FALSE)&"|"&HLOOKUP(Sheet1!R2C1,Sheet1!R2C1:R16C1,MOD(RC1+2,3)+MOD(INT((RC1+2)/3),3)*5+3,FALSE)&"|"&HLOOKUP(Sheet1!R2C1,Sheet1!R2C1:R16C1,MOD(RC1+3,3)+MOD(INT((RC1+3)/3),3)*5+3,FALSE) -> 164|102|103|104|132 | L33: 25|22|23|24 | M33: 26770|26770|26770|26770 | N33: 10030|10031|10032|10033 | O33: 1|1|1|1 | P33: 2500|2500|2500|2500
A34: 28 | B34: 26 | C34: 30 | D34: =R[-20]C+2 -> 22 | E34: 1000 | F34: =MOD(RC[-5]-1,3)*30+100&"|"&MOD(RC[-5]-1,3)*30+101&"|"&MOD(RC[-5]-1,3)*30+102&"|"&MOD(RC[-5]-1,3)*30+103&"|"&IF(MOD(RC[-5],4)=0,HLOOKUP(Sheet1!R2C10,Sheet1!R2C10:R7C10,MOD(RC[-5]/4-1,6)+1,FALSE),IF(MOD(RC[-5],2)=0,IF(RC[-5]>20,HLOOKUP(Sheet1!R2C7,Sheet1!R2C7:R43C7,MOD(RC[-5]/2-1,42)+1,FALSE),HLOOKUP(Sheet1!R2C4,Sheet1!R2C4:R7C4,MOD(RC[-5]-1,6)+1,FALSE)),MOD(RC[-5]-1,3)*30+104)) -> 100|101|102|103|190 | G34: =HLOOKUP(Sheet1!R2C1,Sheet1!R2C1:R16C1,MOD(RC1-1,2)+MOD(INT((RC1-1)/2),3)*5+1,FALSE)&"|"&HLOOKUP(Sheet1!R2C1,Sheet1!R2C1:R16C1,MOD(RC1,2)+MOD(INT((RC1)/2),3)*5+1,FALSE)&"|"&HLOOKUP(Sheet1!R2C1,Sheet1!R2C1:R16C1,MOD(RC1+1,2)+MOD(INT((RC1+1)/2),3)*5+1,FALSE)&"|"&HLOOKUP(Sheet1!R2C1,Sheet1!R2C1:R16C1,MOD(RC1+2,2)+MOD(INT((RC1+2)/2),3)*5+1,FALSE)&"|"&HLOOKUP(Sheet1!R2C1,Sheet1!R2C1:R16C1,MOD(RC1+3,2)+MOD(INT((RC1+3)/2),3)*5+1,FALSE) -> 131|160|161|100|101 | H34: =HLOOKUP(Sheet1!R2C1,Sheet1!R2C1:R16C1,MOD(RC1+2,2)+MOD(INT((RC1+2)/2),3)*5+1,FALSE)&"|"&HLOOKUP(Sheet1!R2C1,Sheet1!R2C1:R16C1,MOD(RC1+3,2)+MOD(INT((RC1+3)/2),3)*5+1,FALSE)&"|"&HLOOKUP(Sheet1!R2C1,Sheet1!R2C1:R16C1,MOD(RC1+4,2)+MOD(INT((RC1+4)/2),3)*5+1,FALSE)&"|"&HLOOKUP(Sheet1!R2C1,Sheet1!R2C1:R16C1,MOD(RC1+5,2)+MOD(INT((RC1+5)/2),3)*5+1,FALSE)&"|"&HLOOKUP(Sheet1!R2C1,Sheet1!R2C1:R16C1,MOD(RC1+6,2)+MOD(INT((RC1+6)/2),3)*5+1,FALSE) -> 100|101|130|131|160 | I34: =HLOOKUP(Sheet1!R2C1,Sheet1!R2C1:R16C1,MOD(RC1-1,3)+MOD(INT((RC1-1)/3),3)*5+3,FALSE)&"|"&HLOOKUP(Sheet1!R2C1,Sheet1!R2C1:R16C1,MOD(RC1,3)+MOD(INT((RC1)/3),3)*5+3,FALSE)&"|"&HLOOKUP(Sheet1!R2C1,Sheet1!R2C1:R16C1,MOD(RC1+1,3)+MOD(INT((RC1+1)/3),3)*5+3,FALSE)&"|"&HLOOKUP(Sheet1!R2C1,Sheet1!R2C1:R16C1,MOD(RC1+2,3)+MOD(INT((RC1+2)/3),3)*5+3,FALSE)&"|"&HLOOKUP(Sheet1!R2C1,Sheet1!R2C1:R16C1,MOD(RC1+3,3)+MOD(INT((RC1+3)/3),3)*5+3,FALSE) -> 102|103|104|132|133 | J34: =HLOOKUP(Sheet1!R2C1,Sheet1!R2C1:R16C1,MOD(RC1-1,3)+MOD(INT((RC1-1)/3),3)*5+3,FALSE)&"|"&HLOOKUP(Sheet1!R2C1,Sheet1!R2C1:R16C1,MOD(RC1,3)+MOD(INT((RC1)/3),3)*5+3,FALSE)&"|"&HLOOKUP(Sheet1!R2C1,Sheet1!R2C1:R16C1,MOD(RC1+1,3)+MOD(INT((RC1+1)/3),3)*5+3,FALSE)&"|"&HLOOKUP(Sheet1!R2C1,Sheet1!R2C1:R16C1,MOD(RC1+2,3)+MOD(INT((RC1+2)/3),3)*5+3,FALSE)&"|"&HLOOKUP(Sheet1!R2C1,Sheet1!R2C1:R16C1,MOD(RC1+3,3)+MOD(INT((RC1+3)/3),3)*5+3,FALSE) -> 102|103|104|132|133 | K34: =HLOOKUP(Sheet1!R2C1,Sheet1!R2C1:R16C1,MOD(RC1-1,3)+MOD(INT((RC1-1)/3),3)*5+3,FALSE)&"|"&HLOOKUP(Sheet1!R2C1,Sheet1!R2C1:R16C1,MOD(RC1,3)+MOD(INT((RC1)/3),3)*5+3,FALSE)&"|"&HLOOKUP(Sheet1!R2C1,Sheet1!R2C1:R16C1,MOD(RC1+1,3)+MOD(INT((RC1+1)/3),3)*5+3,FALSE)&"|"&HLOOKUP(Sheet1!R2C1,Sheet1!R2C1:R16C1,MOD(RC1+2,3)+MOD(INT((RC1+2)/3),3)*5+3,FALSE)&"|"&HLOOKUP(Sheet1!R2C1,Sheet1!R2C1:R16C1,MOD(RC1+3,3)+MOD(INT((RC1+3)/3),3)*5+3,FALSE) -> 102|103|104|132|133 | L34: 25|22|23|24 | M34: 27912|27911|27913|27913 | N34: 10030|10031|10032|10033 | O34: 1|1|1|1 | P34: 2500|2500|2500|2500
A35: 29 | B35: 27 | C35: 30 | D35: =R[-20]C+2 -> 22 | E35: 1000 | F35: =MOD(RC[-5]-1,3)*30+100&"|"&MOD(RC[-5]-1,3)*30+101&"|"&MOD(RC[-5]-1,3)*30+102&"|"&MOD(RC[-5]-1,3)*30+103&"|"&IF(MOD(RC[-5],4)=0,HLOOKUP(Sheet1!R2C10,Sheet1!R2C10:R7C10,MOD(RC[-5]/4-1,6)+1,FALSE),IF(MOD(RC[-5],2)=0,IF(RC[-5]>20,HLOOKUP(Sheet1!R2C7,Sheet1!R2C7:R43C7,MOD(RC[-5]/2-1,42)+1,FALSE),HLOOKUP(Sheet1!R2C4,Sheet1!R2C4:R7C4,MOD(RC[-5]-1,6)+1,FALSE)),MOD(RC[-5]-1,3)*30+104)) -> 130|131|132|133|134 | G35: =HLOOKUP(Sheet1!R2C1,Sheet1!R2C1:R16C1,MOD(RC1-1,2)+MOD(INT((RC1-1)/2),3)*5+1,FALSE)&"|"&HLOOKUP(Sheet1!R2C1,Sheet1!R2C1:R16C1,MOD(RC1,2)+MOD(INT((RC1)/2),3)*5+1,FALSE)&"|"&HLOOKUP(Sheet1!R2C1,Sheet1!R2C1:R16C1,MOD(RC1+1,2)+MOD(INT((RC1+1)/2),3)*5+1,FALSE)&"|"&HLOOKUP(Sheet1!R2C1,Sheet1!R2C1:R16C1,MOD(RC1+2,2)+MOD(INT((RC1+2)/2),3)*5+1,FALSE)&"|"&HLOOKUP(Sheet1!R2C1,Sheet1!R2C1:R16C1,MOD(RC1+3,2)+MOD(INT((RC1+3)/2),3)*5+1,FALSE) -> 160|161|100|101|130 | H35: =HLOOKUP(Sheet1!R2C1,Sheet1!R2C1:R16C1,MOD(RC1+2,2)+MOD(INT((RC1+2)/2),3)*5+1,FALSE)&"|"&HLOOKUP(Sheet1!R2C1,Sheet1!R2C1:R16C1,MOD(RC1+3,2)+MOD(INT((RC1+3)/2),3)*5+1,FALSE)&"|"&HLOOKUP(Sheet1!R2C1,Sheet1!R2C1:R16C1,MOD(RC1+4,2)+MOD(INT((RC1+4)/2),3)*5+1,FALSE)&"|"&HLOOKUP(Sheet1!R2C1,Sheet1!R2C1:R16C1,MOD(RC1+5,2)+MOD(INT((RC1+5)/2),3)*5+1,FALSE)&"|"&HLOOKUP(Sheet1!R2C1,Sheet1!R2C1:R16C1,MOD(RC1+6,2)+MOD(INT((RC1+6)/2),3)*5+1,FALSE) -> 101|130|131|160|161 | I35: =HLOOKUP(Sheet1!R2C1,Sheet1!R2C1:R16C1,MOD(RC1-1,3)+MOD(INT((RC1-1)/3),3)*5+3,FALSE)&"|"&HLOOKUP(Sheet1!R2C1,Sheet1!R2C1:R16C1,MOD(RC1,3)+MOD(INT((RC1)/3),3)*5+3,FALSE)&"|"&HLOOKUP(Sheet1!R2C1,Sheet1!R2C1:R16C1,MOD(RC1+1,3)+MOD(INT((RC1+1)/3),3)*5+3,FALSE)&"|"&HLOOKUP(Sheet1!R2C1,Sheet1!R2C1:R16C1,MOD(RC1+2,3)+MOD(INT((RC1+2)/3),3)*5+3,FALSE)&"|"&HLOOKUP(Sheet1!R2C1,Sheet1!R2C1:R16C1,MOD(RC1+3,3)+MOD(INT((RC1+3)/3),3)*5+3,FALSE) -> 103|104|132|133|134 | J35: =HLOOKUP(Sheet1!R2C1,Sheet1!R2C1:R16C1,MOD(RC1-1,3)+MOD(INT((RC1-1)/3),3)*5+3,FALSE)&"|"&HLOOKUP(Sheet1!R2C1,Sheet1!R2C1:R16C1,MOD(RC1,3)+MOD(INT((RC1)/3),3)*5+3,FALSE)&"|"&HLOOKUP(Sheet1!R2C1,Sheet1!R2C1:R16C1,MOD(RC1+1,3)+MOD(INT((RC1+1)/3),3)*5+3,FALSE)&"|"&HLOOKUP(Sheet1!R2C1,Sheet1!R2C1:R16C1,MOD(RC1+2,3)+MOD(INT((RC1+2)/3),3)*5+3,FALSE)&"|"&HLOOKUP(Sheet1!R2C1,Sheet1!R2C1:R16C1,MOD(RC1+3,3)+MOD(INT((RC1+3)/3),3)*5+3,FALSE) -> 103|104|132|133|134 | K35: =HLOOKUP(Sheet1!R2C1,Sheet1!R2C1:R16C1,MOD(RC1-1,3)+MOD(INT((RC1-1)/3),3)*5+3,FALSE)&"|"&HLOOKUP(Sheet1!R2C1,Sheet1!R2C1:R16C1,MOD(RC1,3)+MOD(INT((RC1)/3),3)*5+3,FALSE)&"|"&HLOOKUP(Sheet1!R2C1,Sheet1!R2C1:R16C1,MOD(RC1+1,3)+MOD(INT((RC1+1)/3),3)*5+3,FALSE)&"|"&HLOOKUP(Sheet1!R2C1,Sheet1!R2C1:R16C1,MOD(RC1+2,3)+MOD(INT((RC1+2)/3),3)*5+3,FALSE)&"|"&HLOOKUP(Sheet1!R2C1,Sheet1!R2C1:R16C1,MOD(RC1+3,3)+MOD(INT((RC1+3)/3),3)*5+3,FALSE) -> 103|104|132|133|134 | L35: 25|22|23|24 | M35: 29072|29073|29073|29073 | N35: 10030|10031|10032|10033 | O35: 1|1|1|1 | P35: 2500|2500|2500|2500
A36: 30 | B36: 28 | C36: 30 | D36: =R[-20]C+2 -> 22 | E36: 1000 | F36: =MOD(RC[-5]-1,3)*30+100&"|"&MOD(RC[-5]-1,3)*30+101&"|"&MOD(RC[-5]-1,3)*30+102&"|"&MOD(RC[-5]-1,3)*30+103&"|"&IF(MOD(RC[-5],4)=0,HLOOKUP(Sheet1!R2C10,Sheet1!R2C10:R7C10,MOD(RC[-5]/4-1,6)+1,FALSE),IF(MOD(RC[-5],2)=0,IF(RC[-5]>20,HLOOKUP(Sheet1!R2C7,Sheet1!R2C7:R43C7,MOD(RC[-5]/2-1,42)+1,FALSE),HLOOKUP(Sheet1!R2C4,Sheet1!R2C4:R7C4,MOD(RC[-5]-1,6)+1,FALSE)),MOD(RC[-5]-1,3)*30+104)) -> 160|161|162|163|142 | G36: =HLOOKUP(Sheet1!R2C1,Sheet1!R2C1:R16C1,MOD(RC1-1,2)+MOD(INT((RC1-1)/2),3)*5+1,FALSE)&"|"&HLOOKUP(Sheet1!R2C1,Sheet1!R2C1:R16C1,MOD(RC1,2)+MOD(INT((RC1)/2),3)*5+1,FALSE)&"|"&HLOOKUP(Sheet1!R2C1,Sheet1!R2C1:R16C1,MOD(RC1+1,2)+MOD(INT((RC1+1)/2),3)*5+1,FALSE)&"|"&HLOOKUP(Sheet1!R2C1,Sheet1!R2C1:R16C1,MOD(RC1+2,2)+MOD(INT((RC1+2)/2),3)*5+1,FALSE)&"|"&HLOOKUP(Sheet1!R2C1,Sheet1!R2C1:R16C1,MOD(RC1+3,2)+MOD(INT((RC1+3)/2),3)*5+1,FALSE) -> 161|100|101|130|131 | H36: =HLOOKUP(Sheet1!R2C1,Sheet1!R2C1:R16C1,MOD(RC1+2,2)+MOD(INT((RC1+2)/2),3)*5+1,FALSE)&"|"&HLOOKUP(Sheet1!R2C1,Sheet1!R2C1:R16C1,MOD(RC1+3,2)+MOD(INT((RC1+3)/2),3)*5+1,FALSE)&"|"&HLOOKUP(Sheet1!R2C1,Sheet1!R2C1:R16C1,MOD(RC1+4,2)+MOD(INT((RC1+4)/2),3)*5+1,FALSE)&"|"&HLOOKUP(Sheet1!R2C1,Sheet1!R2C1:R16C1,MOD(RC1+5,2)+MOD(INT((RC1+5)/2),3)*5+1,FALSE)&"|"&HLOOKUP(Sheet1!R2C1,Sheet1!R2C1:R16C1,MOD(RC1+6,2)+MOD(INT((RC1+6)/2),3)*5+1,FALSE) -> 130|131|160|161|100 | I36: =HLOOKUP(Sheet1!R2C1,Sheet1!R2C1:R16C1,MOD(RC1-1,3)+MOD(INT((RC1-1)/3),3)*5+3,FALSE)&"|"&HLOOKUP(Sheet1!R2C1,Sheet1!R2C1:R16C1,MOD(RC1,3)+MOD(INT((RC1)/3),3)*5+3,FALSE)&"|"&HLOOKUP(Sheet1!R2C1,Sheet1!R2C1:R16C1,MOD(RC1+1,3)+MOD(INT((RC1+1)/3),3)*5+3,FALSE)&"|"&HLOOKUP(Sheet1!R2C1,Sheet1!R2C1:R16C1,MOD(RC1+2,3)+MOD(INT((RC1+2)/3),3)*5+3,FALSE)&"|"&HLOOKUP(Sheet1!R2C1,Sheet1!R2C1:R16C1,MOD(RC1+3,3)+MOD(INT((RC1+3)/3),3)*5+3,FALSE) -> 104|132|133|134|162 | J36: =HLOOKUP(Sheet1!R2C1,Sheet1!R2C1:R16C1,MOD(RC1-1,3)+MOD(INT((RC1-1)/3),3)*5+3,FALSE)&"|"&HLOOKUP(Sheet1!R2C1,Sheet1!R2C1:R16C1,MOD(RC1,3)+MOD(INT((RC1)/3),3)*5+3,FALSE)&"|"&HLOOKUP(Sheet1!R2C1,Sheet1!R2C1:R16C1,MOD(RC1+1,3)+MOD(INT((RC1+1)/3),3)*5+3,FALSE)&"|"&HLOOKUP(Sheet1!R2C1,Sheet1!R2C1:R16C1,MOD(RC1+2,3)+MOD(INT((RC1+2)/3),3)*5+3,FALSE)&"|"&HLOOKUP(Sheet1!R2C1,Sheet1!R2C1:R16C1,MOD(RC1+3,3)+MOD(INT((RC1+3)/3),3)*5+3,FALSE) -> 104|132|133|134|162 | K36: =HLOOKUP(Sheet1!R2C1,Sheet1!R2C1:R16C1,MOD(RC1-1,3)+MOD(INT((RC1-1)/3),3)*5+3,FALSE)&"|"&HLOOKUP(Sheet1!R2C1,Sheet1!R2C1:R16C1,MOD(RC1,3)+MOD(INT((RC1)/3),3)*5+3,FALSE)&"|"&HLOOKUP(Sheet1!R2C1,Sheet1!R2C1:R16C1,MOD(RC1+1,3)+MOD(INT((RC1+1)/3),3)*5+3,FALSE)&"|"&HLOOKUP(Sheet1!R2C1,Sheet1!R2C1:R16C1,MOD(RC1+2,3)+MOD(INT((RC1+2)/3),3)*5+3,FALSE)&"|"&HLOOKUP(Sheet1!R2C1,Sheet1!R2C1:R16C1,MOD(RC1+3,3)+MOD(INT((RC1+3)/3),3)*5+3,FALSE) -> 104|132|133|134|162 | L36: 25|22|23|24 | M36: 30176|30176|30175|30175 | N36: 10030|10031|10032|10033|10030|10031|10032|10033|10030|10031|10032|10033|10030|10031|10032|10033|10030|10031|10032|10033|10030|10031|10032|10033|10030|10031|10032|10033|10030|10031|10032|10033|10030|10031|10032|10033|10030|10031|10032|10033 | O36: 1|1|1|1|1|1|1|1|1|1|1|1|1|1|1|1|1|1|1|1|1|1|1|1|1|1|1|1|1|1|1|1|1|1|1|1|1|1|1|1 | P36: 2500|2500|2500|2500|2500|2500|2500|2500|2500|2500|2500|2500|2500|2500|2500|2500|2500|2500|2500|2500|2500|2500|2500|2500|2500|2500|2500|2500|2500|2500|2500|2500|2500|2500|2500|2500|2500|2500|2500|2500
A37: 31 | B37: 29 | C37: 30 | D37: =R[-20]C+2 -> 22 | E37: 1000 | F37: =MOD(RC[-5]-1,3)*30+100&"|"&MOD(RC[-5]-1,3)*30+101&"|"&MOD(RC[-5]-1,3)*30+102&"|"&MOD(RC[-5]-1,3)*30+103&"|"&IF(MOD(RC[-5],4)=0,HLOOKUP(Sheet1!R2C10,Sheet1!R2C10:R7C10,MOD(RC[-5]/4-1,6)+1,FALSE),IF(MOD(RC[-5],2)=0,IF(RC[-5]>20,HLOOKUP(Sheet1!R2C7,Sheet1!R2C7:R43C7,MOD(RC[-5]/2-1,42)+1,FALSE),HLOOKUP(Sheet1!R2C4,Sheet1!R2C4:R7C4,MOD(RC[-5]-1,6)+1,FALSE)),MOD(RC[-5]-1,3)*30+104)) -> 100|101|102|103|104 | G37: =HLOOKUP(Sheet1!R2C1,Sheet1!R2C1:R16C1,MOD(RC1-1,2)+MOD(INT((RC1-1)/2),3)*5+1,FALSE)&"|"&HLOOKUP(Sheet1!R2C1,Sheet1!R2C1:R16C1,MOD(RC1,2)+MOD(INT((RC1)/2),3)*5+1,FALSE)&"|"&HLOOKUP(Sheet1!R2C1,Sheet1!R2C1:R16C1,MOD(RC1+1,2)+MOD(INT((RC1+1)/2),3)*5+1,FALSE)&"|"&HLOOKUP(Sheet1!R2C1,Sheet1!R2C1:R16C1,MOD(RC1+2,2)+MOD(INT((RC1+2)/2),3)*5+1,FALSE)&"|"&HLOOKUP(Sheet1!R2C1,Sheet1!R2C1:R16C1,MOD(RC1+3,2)+MOD(INT((RC1+3)/2),3)*5+1,FALSE) -> 100|101|130|131|160 | H37: =HLOOKUP(Sheet1!R2C1,Sheet1!R2C1:R16C1,MOD(RC1+2,2)+MOD(INT((RC1+2)/2),3)*5+1,FALSE)&"|"&HLOOKUP(Sheet1!R2C1,Sheet1!R2C1:R16C1,MOD(RC1+3,2)+MOD(INT((RC1+3)/2),3)*5+1,FALSE)&"|"&HLOOKUP(Sheet1!R2C1,Sheet1!R2C1:R16C1,MOD(RC1+4,2)+MOD(INT((RC1+4)/2),3)*5+1,FALSE)&"|"&HLOOKUP(Sheet1!R2C1,Sheet1!R2C1:R16C1,MOD(RC1+5,2)+MOD(INT((RC1+5)/2),3)*5+1,FALSE)&"|"&HLOOKUP(Sheet1!R2C1,Sheet1!R2C1:R16C1,MOD(RC1+6,2)+MOD(INT((RC1+6)/2),3)*5+1,FALSE) -> 131|160|161|100|101 | I37: =HLOOKUP(Sheet1!R2C1,Sheet1!R2C1:R16C1,MOD(RC1-1,3)+MOD(INT((RC1-1)/3),3)*5+3,FALSE)&"|"&HLOOKUP(Sheet1!R2C1,Sheet1!R2C1:R16C1,MOD(RC1,3)+MOD(INT((RC1)/3),3)*5+3,FALSE)&"|"&HLOOKUP(Sheet1!R2C1,Sheet1!R2C1:R16C1,MOD(RC1+1,3)+MOD(INT((RC1+1)/3),3)*5+3,FALSE)&"|"&HLOOKUP(Sheet1!R2C1,Sheet1!R2C1:R16C1,MOD(RC1+2,3)+MOD(INT((RC1+2)/3),3)*5+3,FALSE)&"|"&HLOOKUP(Sheet1!R2C1,Sheet1!R2C1:R16C1,MOD(RC1+3,3)+MOD(INT((RC1+3)/3),3)*5+3,FALSE) -> 132|133|134|162|163 | J37: =HLOOKUP(Sheet1!R2C1,Sheet1!R2C1:R16C1,MOD(RC1-1,3)+MOD(INT((RC1-1)/3),3)*5+3,FALSE)&"|"&HLOOKUP(Sheet1!R2C1,Sheet1!R2C1:R16C1,MOD(RC1,3)+MOD(INT((RC1)/3),3)*5+3,FALSE)&"|"&HLOOKUP(Sheet1!R2C1,Sheet1!R2C1:R16C1,MOD(RC1+1,3)+MOD(INT((RC1+1)/3),3)*5+3,FALSE)&"|"&HLOOKUP(Sheet1!R2C1,Sheet1!R2C1:R16C1,MOD(RC1+2,3)+MOD(INT((RC1+2)/3),3)*5+3,FALSE)&"|"&HLOOKUP(Sheet1!R2C1,Sheet1!R2C1:R16C1,MOD(RC1+3,3)+MOD(INT((RC1+3)/3),3)*5+3,FALSE) -> 132|133|134|162|163 | K37: =HLOOKUP(Sheet1!R2C1,Sheet1!R2C1:R16C1,MOD(RC1-1,3)+MOD(INT((RC1-1)/3),3)*5+3,FALSE)&"|"&HLOOKUP(Sheet1!R2C1,Sheet1!R2C1:R16C1,MOD(RC1,3)+MOD(INT((RC1)/3),3)*5+3,FALSE)&"|"&HLOOKUP(Sheet1!R2C1,Sheet1!R2C1:R16C1,MOD(RC1+1,3)+MOD(INT((RC1+1)/3),3)*5+3,FALSE)&"|"&HLOOKUP(Sheet1!R2C1,Sheet1!R2C1:R16C1,MOD(RC1+2,3)+MOD(INT((RC1+2)/3),3)*5+3,FALSE)&"|"&HLOOKUP(Sheet1!R2C1,Sheet1!R2C1:R16C1,MOD(RC1+3,3)+MOD(INT((RC1+3)/3),3)*5+3,FALSE) -> 132|133|134|162|163 | L37: 25|22|23|24 | M37: 31277|31276|31278|31278 | N37: 10030|10031|10032|10033 | O37: 1|1|1|1 | P37: 2500|2500|2500|2500
A38: 32 | B38: 30 | C38: 30 | D38: =R[-20]C+2 -> 22 | E38: 1000 | F38: =MOD(RC[-5]-1,3)*30+100&"|"&MOD(RC[-5]-1,3)*30+101&"|"&MOD(RC[-5]-1,3)*30+102&"|"&MOD(RC[-5]-1,3)*30+103&"|"&IF(MOD(RC[-5],4)=0,HLOOKUP(Sheet1!R2C10,Sheet1!R2C10:R7C10,MOD(RC[-5]/4-1,6)+1,FALSE),IF(MOD(RC[-5],2)=0,IF(RC[-5]>20,HLOOKUP(Sheet1!R2C7,Sheet1!R2C7:R43C7,MOD(RC[-5]/2-1,42)+1,FALSE),HLOOKUP(Sheet1!R2C4,Sheet1!R2C4:R7C4,MOD(RC[-5]-1,6)+1,FALSE)),MOD(RC[-5]-1,3)*30+104)) -> 130|131|132|133|191 | G38: =HLOOKUP(Sheet1!R2C1,Sheet1!R2C1:R16C1,MOD(RC1-1,2)+MOD(INT((RC1-1)/2),3)*5+1,FALSE)&"|"&HLOOKUP(Sheet1!R2C1,Sheet1!R2C1:R16C1,MOD(RC1,2)+MOD(INT((RC1)/2),3)*5+1,FALSE)&"|"&HLOOKUP(Sheet1!R2C1,Sheet1!R2C1:R16C1,MOD(RC1+1,2)+MOD(INT((RC1+1)/2),3)*5+1,FALSE)&"|"&HLOOKUP(Sheet1!R2C1,Sheet1!R2C1:R16C1,MOD(RC1+2,2)+MOD(INT((RC1+2)/2),3)*5+1,FALSE)&"|"&HLOOKUP(Sheet1!R2C1,Sheet1!R2C1:R16C1,MOD(RC1+3,2)+MOD(INT((RC1+3)/2),3)*5+1,FALSE) -> 101|130|131|160|161 | H38: =HLOOKUP(Sheet1!R2C1,Sheet1!R2C1:R16C1,MOD(RC1+2,2)+MOD(INT((RC1+2)/2),3)*5+1,FALSE)&"|"&HLOOKUP(Sheet1!R2C1,Sheet1!R2C1:R16C1,MOD(RC1+3,2)+MOD(INT((RC1+3)/2),3)*5+1,FALSE)&"|"&HLOOKUP(Sheet1!R2C1,Sheet1!R2C1:R16C1,MOD(RC1+4,2)+MOD(INT((RC1+4)/2),3)*5+1,FALSE)&"|"&HLOOKUP(Sheet1!R2C1,Sheet1!R2C1:R16C1,MOD(RC1+5,2)+MOD(INT((RC1+5)/2),3)*5+1,FALSE)&"|"&HLOOKUP(Sheet1!R2C1,Sheet1!R2C1:R16C1,MOD(RC1+6,2)+MOD(INT((RC1+6)/2),3)*5+1,FALSE) -> 160|161|100|101|130 | I38: =HLOOKUP(Sheet1!R2C1,Sheet1!R2C1:R16C1,MOD(RC1-1,3)+MOD(INT((RC1-1)/3),3)*5+3,FALSE)&"|"&HLOOKUP(Sheet1!R2C1,Sheet1!R2C1:R16C1,MOD(RC1,3)+MOD(INT((RC1)/3),3)*5+3,FALSE)&"|"&HLOOKUP(Sheet1!R2C1,Sheet1!R2C1:R16C1,MOD(RC1+1,3)+MOD(INT((RC1+1)/3),3)*5+3,FALSE)&"|"&HLOOKUP(Sheet1!R2C1,Sheet1!R2C1:R16C1,MOD(RC1+2,3)+MOD(INT((RC1+2)/3),3)*5+3,FALSE)&"|"&HLOOKUP(Sheet1!R2C1,Sheet1!R2C1:R16C1,MOD(RC1+3,3)+MOD(INT((RC1+3)/3),3)*5+3,FALSE) -> 133|134|162|163|164 | J38: =HLOOKUP(Sheet1!R2C1,Sheet1!R2C1:R16C1,MOD(RC1-1,3)+MOD(INT((RC1-1)/3),3)*5+3,FALSE)&"|"&HLOOKUP(Sheet1!R2C1,Sheet1!R2C1:R16C1,MOD(RC1,3)+MOD(INT((RC1)/3),3)*5+3,FALSE)&"|"&HLOOKUP(Sheet1!R2C1,Sheet1!R2C1:R16C1,MOD(RC1+1,3)+MOD(INT((RC1+1)/3),3)*5+3,FALSE)&"|"&HLOOKUP(Sheet1!R2C1,Sheet1!R2C1:R16C1,MOD(RC1+2,3)+MOD(INT((RC1+2)/3),3)*5+3,FALSE)&"|"&HLOOKUP(Sheet1!R2C1,Sheet1!R2C1:R16C1,MOD(RC1+3,3)+MOD(INT((RC1+3)/3),3)*5+3,FALSE) -> 133|134|162|163|164 | K38: =HLOOKUP(Sheet1!R2C1,Sheet1!R2C1:R16C1,MOD(RC1-1,3)+MOD(INT((RC1-1)/3),3)*5+3,FALSE)&"|"&HLOOKUP(Sheet1!R2C1,Sheet1!R2C1:R16C1,MOD(RC1,3)+MOD(INT((RC1)/3),3)*5+3,FALSE)&"|"&HLOOKUP(Sheet1!R2C1,Sheet1!R2C1:R16C1,MOD(RC1+1,3)+MOD(INT((RC1+1)/3),3)*5+3,FALSE)&"|"&HLOOKUP(Sheet1!R2C1,Sheet1!R2C1:R16C1,MOD(RC1+2,3)+MOD(INT((RC1+2)/3),3)*5+3,FALSE)&"|"&HLOOKUP(Sheet1!R2C1,Sheet1!R2C1:R16C1,MOD(RC1+3,3)+MOD(INT((RC1+3)/3),3)*5+3,FALSE) -> 133|134|162|163|164 | L38: 25|22|23|24 | M38: 32351|32350|32350|32350 | N38: 10030|10031|10032|10033 | O38: 1|1|1|1 | P38: 2500|2500|2500|2500
A39: 33 | B39: 31 | C39: 30 | D39: =R[-20]C+2 -> 22 | E39: 1000 | F39: =MOD(RC[-5]-1,3)*30+100&"|"&MOD(RC[-5]-1,3)*30+101&"|"&MOD(RC[-5]-1,3)*30+102&"|"&MOD(RC[-5]-1,3)*30+103&"|"&IF(MOD(RC[-5],4)=0,HLOOKUP(Sheet1!R2C10,Sheet1!R2C10:R7C10,MOD(RC[-5]/4-1,6)+1,FALSE),IF(MOD(RC[-5],2)=0,IF(RC[-5]>20,HLOOKUP(Sheet1!R2C7,Sheet1!R2C7:R43C7,MOD(RC[-5]/2-1,42)+1,FALSE),HLOOKUP(Sheet1!R2C4,Sheet1!R2C4:R7C4,MOD(RC[-5]-1,6)+1,FALSE)),MOD(RC[-5]-1,3)*30+104)) -> 160|161|162|163|164 | G39: =HLOOKUP(Sheet1!R2C1,Sheet1!R2C1:R16C1,MOD(RC1-1,2)+MOD(INT((RC1-1)/2),3)*5+1,FALSE)&"|"&HLOOKUP(Sheet1!R2C1,Sheet1!R2C1:R16C1,MOD(RC1,2)+MOD(INT((RC1)/2),3)*5+1,FALSE)&"|"&HLOOKUP(Sheet1!R2C1,Sheet1!R2C1:R16C1,MOD(RC1+1,2)+MOD(INT((RC1+1)/2),3)*5+1,FALSE)&"|"&HLOOKUP(Sheet1!R2C1,Sheet1!R2C1:R16C1,MOD(RC1+2,2)+MOD(INT((RC1+2)/2),3)*5+1,FALSE)&"|"&HLOOKUP(Sheet1!R2C1,Sheet1!R2C1:R16C1,MOD(RC1+3,2)+MOD(INT((RC1+3)/2),3)*5+1,FALSE) -> 130|131|160|161|100 | H39: =HLOOKUP(Sheet1!R2C1,Sheet1!R2C1:R16C1,MOD(RC1+2,2)+MOD(INT((RC1+2)/2),3)*5+1,FALSE)&"|"&HLOOKUP(Sheet1!R2C1,Sheet1!R2C1:R16C1,MOD(RC1+3,2)+MOD(INT((RC1+3)/2),3)*5+1,FALSE)&"|"&HLOOKUP(Sheet1!R2C1,Sheet1!R2C1:R16C1,MOD(RC1+4,2)+MOD(INT((RC1+4)/2),3)*5+1,FALSE)&"|"&HLOOKUP(Sheet1!R2C1,Sheet1!R2C1:R16C1,MOD(RC1+5,2)+MOD(INT((RC1+5)/2),3)*5+1,FALSE)&"|"&HLOOKUP(Sheet1!R2C1,Sheet1!R2C1:R16C1,MOD(RC1+6,2)+MOD(INT((RC1+6)/2),3)*5+1,FALSE) -> 161|100|101|130|131 | I39: =HLOOKUP(Sheet1!R2C1,Sheet1!R2C1:R16C1,MOD(RC1-1,3)+MOD(INT((RC1-1)/3),3)*5+3,FALSE)&"|"&HLOOKUP(Sheet1!R2C1,Sheet1!R2C1:R16C1,MOD(RC1,3)+MOD(INT((RC1)/3),3)*5+3,FALSE)&"|"&HLOOKUP(Sheet1!R2C1,Sheet1!R2C1:R16C1,MOD(RC1+1,3)+MOD(INT((RC1+1)/3),3)*5+3,FALSE)&"|"&HLOOKUP(Sheet1!R2C1,Sheet1!R2C1:R16C1,MOD(RC1+2,3)+MOD(INT((RC1+2)/3),3)*5+3,FALSE)&"|"&HLOOKUP(Sheet1!R2C1,Sheet1!R2C1:R16C1,MOD(RC1+3,3)+MOD(INT((RC1+3)/3),3)*5+3,FALSE) -> 134|162|163|164|102 | J39: =HLOOKUP(Sheet1!R2C1,Sheet1!R2C1:R16C1,MOD(RC1-1,3)+MOD(INT((RC1-1)/3),3)*5+3,FALSE)&"|"&HLOOKUP(Sheet1!R2C1,Sheet1!R2C1:R16C1,MOD(RC1,3)+MOD(INT((RC1)/3),3)*5+3,FALSE)&"|"&HLOOKUP(Sheet1!R2C1,Sheet1!R2C1:R16C1,MOD(RC1+1,3)+MOD(INT((RC1+1)/3),3)*5+3,FALSE)&"|"&HLOOKUP(Sheet1!R2C1,Sheet1!R2C1:R16C1,MOD(RC1+2,3)+MOD(INT((RC1+2)/3),3)*5+3,FALSE)&"|"&HLOOKUP(Sheet1!R2C1,Sheet1!R2C1:R16C1,MOD(RC1+3,3)+MOD(INT((RC1+3)/3),3)*5+3,FALSE) -> 134|162|163|164|102 | K39: =HLOOKUP(Sheet1!R2C1,Sheet1!R2C1:R16C1,MOD(RC1-1,3)+MOD(INT((RC1-1)/3),3)*5+3,FALSE)&"|"&HLOOKUP(Sheet1!R2C1,Sheet1!R2C1:R16C1,MOD(RC1,3)+MOD(INT((RC1)/3),3)*5+3,FALSE)&"|"&HLOOKUP(Sheet1!R2C1,Sheet1!R2C1:R16C1,MOD(RC1+1,3)+MOD(INT((RC1+1)/3),3)*5+3,FALSE)&"|"&HLOOKUP(Sheet1!R2C1,Sheet1!R2C1:R16C1,MOD(RC1+2,3)+MOD(INT((RC1+2)/3),3)*5+3,FALSE)&"|"&HLOOKUP(Sheet1!R2C1,Sheet1!R2C1:R16C1,MOD(RC1+3,3)+MOD(INT((RC1+3)/3),3)*5+3,FALSE) -> 134|162|163|164|102 | L39: 25|22|23|24 | M39: 33492|33493|33493|33493 | N39: 10030|10031|10032|10033 | O39: 1|1|1|1 | P39: 2500|2500|2500|2500
A40: 34 | B40: 32 | C40: 30 | D40: =R[-20]C+2 -> 22 | E40: 1000 | F40: =MOD(RC[-5]-1,3)*30+100&"|"&MOD(RC[-5]-1,3)*30+101&"|"&MOD(RC[-5]-1,3)*30+102&"|"&MOD(RC[-5]-1,3)*30+103&"|"&IF(MOD(RC[-5],4)=0,HLOOKUP(Sheet1!R2C10,Sheet1!R2C10:R7C10,MOD(RC[-5]/4-1,6)+1,FALSE),IF(MOD(RC[-5],2)=0,IF(RC[-5]>20,HLOOKUP(Sheet1!R2C7,Sheet1!R2C7:R43C7,MOD(RC[-5]/2-1,42)+1,FALSE),HLOOKUP(Sheet1!R2C4,Sheet1!R2C4:R7C4,MOD(RC[-5]-1,6)+1,FALSE)),MOD(RC[-5]-1,3)*30+104)) -> 100|101|102|103|144 | G40: =HLOOKUP(Sheet1!R2C1,Sheet1!R2C1:R16C1,MOD(RC1-1,2)+MOD(INT((RC1-1)/2),3)*5+1,FALSE)&"|"&HLOOKUP(Sheet1!R2C1,Sheet1!R2C1:R16C1,MOD(RC1,2)+MOD(INT((RC1)/2),3)*5+1,FALSE)&"|"&HLOOKUP(Sheet1!R2C1,Sheet1!R2C1:R16C1,MOD(RC1+1,2)+MOD(INT((RC1+1)/2),3)*5+1,FALSE)&"|"&HLOOKUP(Sheet1!R2C1,Sheet1!R2C1:R16C1,MOD(RC1+2,2)+MOD(INT((RC1+2)/2),3)*5+1,FALSE)&"|"&HLOOKUP(Sheet1!R2C1,Sheet1!R2C1:R16C1,MOD(RC1+3,2)+MOD(INT((RC1+3)/2),3)*5+1,FALSE) -> 131|160|161|100|101 | H40: =HLOOKUP(Sheet1!R2C1,Sheet1!R2C1:R16C1,MOD(RC1+2,2)+MOD(INT((RC1+2)/2),3)*5+1,FALSE)&"|"&HLOOKUP(Sheet1!R2C1,Sheet1!R2C1:R16C1,MOD(RC1+3,2)+MOD(INT((RC1+3)/2),3)*5+1,FALSE)&"|"&HLOOKUP(Sheet1!R2C1,Sheet1!R2C1:R16C1,MOD(RC1+4,2)+MOD(INT((RC1+4)/2),3)*5+1,FALSE)&"|"&HLOOKUP(Sheet1!R2C1,Sheet1!R2C1:R16C1,MOD(RC1+5,2)+MOD(INT((RC1+5)/2),3)*5+1,FALSE)&"|"&HLOOKUP(Sheet1!R2C1,Sheet1!R2C1:R16C1,MOD(RC1+6,2)+MOD(INT((RC1+6)/2),3)*5+1,FALSE) -> 100|101|130|131|160 | I40: =HLOOKUP(Sheet1!R2C1,Sheet1!R2C1:R16C1,MOD(RC1-1,3)+MOD(INT((RC1-1)/3),3)*5+3,FALSE)&"|"&HLOOKUP(Sheet1!R2C1,Sheet1!R2C1:R16C1,MOD(RC1,3)+MOD(INT((RC1)/3),3)*5+3,FALSE)&"|"&HLOOKUP(Sheet1!R2C1,Sheet1!R2C1:R16C1,MOD(RC1+1,3)+MOD(INT((RC1+1)/3),3)*5+3,FALSE)&"|"&HLOOKUP(Sheet1!R2C1,Sheet1!R2C1:R16C1,MOD(RC1+2,3)+MOD(INT((RC1+2)/3),3)*5+3,FALSE)&"|"&HLOOKUP(Sheet1!R2C1,Sheet1!R2C1:R16C1,MOD(RC1+3,3)+MOD(INT((RC1+3)/3),3)*5+3,FALSE) -> 162|163|164|102|103 | J40: =HLOOKUP(Sheet1!R2C1,Sheet1!R2C1:R16C1,MOD(RC1-1,3)+MOD(INT((RC1-1)/3),3)*5+3,FALSE)&"|"&HLOOKUP(Sheet1!R2C1,Sheet1!R2C1:R16C1,MOD(RC1,3)+MOD(INT((RC1)/3),3)*5+3,FALSE)&"|"&HLOOKUP(Sheet1!R2C1,Sheet1!R2C1:R16C1,MOD(RC1+1,3)+MOD(INT((RC1+1)/3),3)*5+3,FALSE)&"|"&HLOOKUP(Sheet1!R2C1,Sheet1!R2C1:R16C1,MOD(RC1+2,3)+MOD(INT((RC1+2)/3),3)*5+3,FALSE)&"|"&HLOOKUP(Sheet1!R2C1,Sheet1!R2C1:R16C1,MOD(RC1+3,3)+MOD(INT((RC1+3)/3),3)*5+3,FALSE) -> 162|163|164|102|103 | K40: =HLOOKUP(Sheet1!R2C1,Sheet1!R2C1:R16C1,MOD(RC1-1,3)+MOD(INT((RC1-1)/3),3)*5+3,FALSE)&"|"&HLOOKUP(Sheet1!R2C1,Sheet1!R2C1:R16C1,MOD(RC1,3)+MOD(INT((RC1)/3),3)*5+3,FALSE)&"|"&HLOOKUP(Sheet1!R2C1,Sheet1!R2C1:R16C1,MOD(RC1+1,3)+MOD(INT((RC1+1)/3),3)*5+3,FALSE)&"|"&HLOOKUP(Sheet1!R2C1,Sheet1!R2C1:R16C1,MOD(RC1+2,3)+MOD(INT((RC1+2)/3),3)*5+3,FALSE)&"|"&HLOOKUP(Sheet1!R2C1,Sheet1!R2C1:R16C1,MOD(RC1+3,3)+MOD(INT((RC1+3)/3),3)*5+3,FALSE) -> 162|163|164|102|103 | L40: 25|22|23|24 | M40: 34634|34634|34635|34635 | N40: 10030|10031|10032|10033 | O40: 1|1|1|1 | P40: 2500|2500|2500|2500
A41: 35 | B41: 33 | C41: 30 | D41: =R[-20]C+2 -> 22 | E41: 1000 | F41: =MOD(RC[-5]-1,3)*30+100&"|"&MOD(RC[-5]-1,3)*30+101&"|"&MOD(RC[-5]-1,3)*30+102&"|"&MOD(RC[-5]-1,3)*30+103&"|"&IF(MOD(RC[-5],4)=0,HLOOKUP(Sheet1!R2C10,Sheet1!R2C10:R7C10,MOD(RC[-5]/4-1,6)+1,FALSE),IF(MOD(RC[-5],2)=0,IF(RC[-5]>20,HLOOKUP(Sheet1!R2C7,Sheet1!R2C7:R43C7,MOD(RC[-5]/2-1,42)+1,FALSE),HLOOKUP(Sheet1!R2C4,Sheet1!R2C4:R7C4,MOD(RC[-5]-1,6)+1,FALSE)),MOD(RC[-5]-1,3)*30+104)) -> 130|131|132|133|134 | G41: =HLOOKUP(Sheet1!R2C1,Sheet1!R2C1:R16C1,MOD(RC1-1,2)+MOD(INT((RC1-1)/2),3)*5+1,FALSE)&"|"&HLOOKUP(Sheet1!R2C1,Sheet1!R2C1:R16C1,MOD(RC1,2)+MOD(INT((RC1)/2),3)*5+1,FALSE)&"|"&HLOOKUP(Sheet1!R2C1,Sheet1!R2C1:R16C1,MOD(RC1+1,2)+MOD(INT((RC1+1)/2),3)*5+1,FALSE)&"|"&HLOOKUP(Sheet1!R2C1,Sheet1!R2C1:R16C1,MOD(RC1+2,2)+MOD(INT((RC1+2)/2),3)*5+1,FALSE)&"|"&HLOOKUP(Sheet1!R2C1,Sheet1!R2C1:R16C1,MOD(RC1+3,2)+MOD(INT((RC1+3)/2),3)*5+1,FALSE) -> 160|161|100|101|130 | H41: =HLOOKUP(Sheet1!R2C1,Sheet1!R2C1:R16C1,MOD(RC1+2,2)+MOD(INT((RC1+2)/2),3)*5+1,FALSE)&"|"&HLOOKUP(Sheet1!R2C1,Sheet1!R2C1:R16C1,MOD(RC1+3,2)+MOD(INT((RC1+3)/2),3)*5+1,FALSE)&"|"&HLOOKUP(Sheet1!R2C1,Sheet1!R2C1:R16C1,MOD(RC1+4,2)+MOD(INT((RC1+4)/2),3)*5+1,FALSE)&"|"&HLOOKUP(Sheet1!R2C1,Sheet1!R2C1:R16C1,MOD(RC1+5,2)+MOD(INT((RC1+5)/2),3)*5+1,FALSE)&"|"&HLOOKUP(Sheet1!R2C1,Sheet1!R2C1:R16C1,MOD(RC1+6,2)+MOD(INT((RC1+6)/2),3)*5+1,FALSE) -> 101|130|131|160|161 | I41: =HLOOKUP(Sheet1!R2C1,Sheet1!R2C1:R16C1,MOD(RC1-1,3)+MOD(INT((RC1-1)/3),3)*5+3,FALSE)&"|"&HLOOKUP(Sheet1!R2C1,Sheet1!R2C1:R16C1,MOD(RC1,3)+MOD(INT((RC1)/3),3)*5+3,FALSE)&"|"&HLOOKUP(Sheet1!R2C1,Sheet1!R2C1:R16C1,MOD(RC1+1,3)+MOD(INT((RC1+1)/3),3)*5+3,FALSE)&"|"&HLOOKUP(Sheet1!R2C1,Sheet1!R2C1:R16C1,MOD(RC1+2,3)+MOD(INT((RC1+2)/3),3)*5+3,FALSE)&"|"&HLOOKUP(Sheet1!R2C1,Sheet1!R2C1:R16C1,MOD(RC1+3,3)+MOD(INT((RC1+3)/3),3)*5+3,FALSE) -> 163|164|102|103|104 | J41: =HLOOKUP(Sheet1!R2C1,Sheet1!R2C1:R16C1,MOD(RC1-1,3)+MOD(INT((RC1-1)/3),3)*5+3,FALSE)&"|"&HLOOKUP(Sheet1!R2C1,Sheet1!R2C1:R16C1,MOD(RC1,3)+MOD(INT((RC1)/3),3)*5+3,FALSE)&"|"&HLOOKUP(Sheet1!R2C1,Sheet1!R2C1:R16C1,MOD(RC1+1,3)+MOD(INT((RC1+1)/3),3)*5+3,FALSE)&"|"&HLOOKUP(Sheet1!R2C1,Sheet1!R2C1:R16C1,MOD(RC1+2,3)+MOD(INT((RC1+2)/3),3)*5+3,FALSE)&"|"&HLOOKUP(Sheet1!R2C1,Sheet1!R2C1:R16C1,MOD(RC1+3,3)+MOD(INT((RC1+3)/3),3)*5+3,FALSE) -> 163|164|102|103|104 | K41: =HLOOKUP(Sheet1!R2C1,Sheet1!R2C1:R16C1,MOD(RC1-1,3)+MOD(INT((RC1-1)/3),3)*5+3,FALSE)&"|"&HLOOKUP(Sheet1!R2C1,Sheet1!R2C1:R16C1,MOD(RC1,3)+MOD(INT((RC1)/3),3)*5+3,FALSE)&"|"&HLOOKUP(Sheet1!R2C1,Sheet1!R2C1:R16C1,MOD(RC1+1,3)+MOD(INT((RC1+1)/3),3)*5+3,FALSE)&"|"&HLOOKUP(Sheet1!R2C1,Sheet1!R2C1:R16C1,MOD(RC1+2,3)+MOD(INT((RC1+2)/3),3)*5+3,FALSE)&"|"&HLOOKUP(Sheet1!R2C1,Sheet1!R2C1:R16C1,MOD(RC1+3,3)+MOD(INT((RC1+3)/3),3)*5+3,FALSE) -> 163|164|102|103|104 | L41: 25|22|23|24 | M41: 35796|35796|35795|35795 | N41: 10030|10031|10032|10033|10030|10031|10032|10033|10030|10031|10032|10033|10030|10031|10032|10033|10030|10031|10032|10033|10030|10031|10032|10033|10030|10031|10032|10033|10030|10031|10032|10033|10030|10031|10032|10033|10030|10031|10032|10033 | O41: 1|1|1|1|1|1|1|1|1|1|1|1|1|1|1|1|1|1|1|1|1|1|1|1|1|1|1|1|1|1|1|1|1|1|1|1|1|1|1|1 | P41: 2500|2500|2500|2500|2500|2500|2500|2500|2500|2500|2500|2500|2500|2500|2500|2500|2500|2500|2500|2500|2500|2500|2500|2500|2500|2500|2500|2500|2500|2500|2500|2500|2500|2500|2500|2500|2500|2500|2500|2500
A42: 36 | B42: 34 | C42: 30 | D42: =R[-20]C+2 -> 22 | E42: 1000 | F42: =MOD(RC[-5]-1,3)*30+100&"|"&MOD(RC[-5]-1,3)*30+101&"|"&MOD(RC[-5]-1,3)*30+102&"|"&MOD(RC[-5]-1,3)*30+103&"|"&IF(MOD(RC[-5],4)=0,HLOOKUP(Sheet1!R2C10,Sheet1!R2C10:R7C10,MOD(RC[-5]/4-1,6)+1,FALSE),IF(MOD(RC[-5],2)=0,IF(RC[-5]>20,HLOOKUP(Sheet1!R2C7,Sheet1!R2C7:R43C7,MOD(RC[-5]/2-1,42)+1,FALSE),HLOOKUP(Sheet1!R2C4,Sheet1!R2C4:R7C4,MOD(RC[-5]-1,6)+1,FALSE)),MOD(RC[-5]-1,3)*30+104)) -> 160|161|162|163|192 | G42: =HLOOKUP(Sheet1!R2C1,Sheet1!R2C1:R16C1,MOD(RC1-1,2)+MOD(INT((RC1-1)/2),3)*5+1,FALSE)&"|"&HLOOKUP(Sheet1!R2C1,Sheet1!R2C1:R16C1,MOD(RC1,2)+MOD(INT((RC1)/2),3)*5+1,FALSE)&"|"&HLOOKUP(Sheet1!R2C1,Sheet1!R2C1:R16C1,MOD(RC1+1,2)+MOD(INT((RC1+1)/2),3)*5+1,FALSE)&"|"&HLOOKUP(Sheet1!R2C1,Sheet1!R2C1:R16C1,MOD(RC1+2,2)+MOD(INT((RC1+2)/2),3)*5+1,FALSE)&"|"&HLOOKUP(Sheet1!R2C1,Sheet1!R2C1:R16C1,MOD(RC1+3,2)+MOD(INT((RC1+3)/2),3)*5+1,FALSE) -> 161|100|101|130|131 | H42: =HLOOKUP(Sheet1!R2C1,Sheet1!R2C1:R16C1,MOD(RC1+2,2)+MOD(INT((RC1+2)/2),3)*5+1,FALSE)&"|"&HLOOKUP(Sheet1!R2C1,Sheet1!R2C1:R16C1,MOD(RC1+3,2)+MOD(INT((RC1+3)/2),3)*5+1,FALSE)&"|"&HLOOKUP(Sheet1!R2C1,Sheet1!R2C1:R16C1,MOD(RC1+4,2)+MOD(INT((RC1+4)/2),3)*5+1,FALSE)&"|"&HLOOKUP(Sheet1!R2C1,Sheet1!R2C1:R16C1,MOD(RC1+5,2)+MOD(INT((RC1+5)/2),3)*5+1,FALSE)&"|"&HLOOKUP(Sheet1!R2C1,Sheet1!R2C1:R16C1,MOD(RC1+6,2)+MOD(INT((RC1+6)/2),3)*5+1,FALSE) -> 130|131|160|161|100 | I42: =HLOOKUP(Sheet1!R2C1,Sheet1!R2C1:R16C1,MOD(RC1-1,3)+MOD(INT((RC1-1)/3),3)*5+3,FALSE)&"|"&HLOOKUP(Sheet1!R2C1,Sheet1!R2C1:R16C1,MOD(RC1,3)+MOD(INT((RC1)/3),3)*5+3,FALSE)&"|"&HLOOKUP(Sheet1!R2C1,Sheet1!R2C1:R16C1,MOD(RC1+1,3)+MOD(INT((RC1+1)/3),3)*5+3,FALSE)&"|"&HLOOKUP(Sheet1!R2C1,Sheet1!R2C1:R16C1,MOD(RC1+2,3)+MOD(INT((RC1+2)/3),3)*5+3,FALSE)&"|"&HLOOKUP(Sheet1!R2C1,Sheet1!R2C1:R16C1,MOD(RC1+3,3)+MOD(INT((RC1+3)/3),3)*5+3,FALSE) -> 164|102|103|104|132 | J42: =HLOOKUP(Sheet1!R2C1,Sheet1!R2C1:R16C1,MOD(RC1-1,3)+MOD(INT((RC1-1)/3),3)*5+3,FALSE)&"|"&HLOOKUP(Sheet1!R2C1,Sheet1!R2C1:R16C1,MOD(RC1,3)+MOD(INT((RC1)/3),3)*5+3,FALSE)&"|"&HLOOKUP(Sheet1!R2C1,Sheet1!R2C1:R16C1,MOD(RC1+1,3)+MOD(INT((RC1+1)/3),3)*5+3,FALSE)&"|"&HLOOKUP(Sheet1!R2C1,Sheet1!R2C1:R16C1,MOD(RC1+2,3)+MOD(INT((RC1+2)/3),3)*5+3,FALSE)&"|"&HLOOKUP(Sheet1!R2C1,Sheet1!R2C1:R16C1,MOD(RC1+3,3)+MOD(INT((RC1+3)/3),3)*5+3,FALSE) -> 164|102|103|104|132 | K42: =HLOOKUP(Sheet1!R2C1,Sheet1!R2C1:R16C1,MOD(RC1-1,3)+MOD(INT((RC1-1)/3),3)*5+3,FALSE)&"|"&HLOOKUP(Sheet1!R2C1,Sheet1!R2C1:R16C1,MOD(RC1,3)+MOD(INT((RC1)/3),3)*5+3,FALSE)&"|"&HLOOKUP(Sheet1!R2C1,Sheet1!R2C1:R16C1,MOD(RC1+1,3)+MOD(INT((RC1+1)/3),3)*5+3,FALSE)&"|"&HLOOKUP(Sheet1!R2C1,Sheet1!R2C1:R16C1,MOD(RC1+2,3)+MOD(INT((RC1+2)/3),3)*5+3,FALSE)&"|"&HLOOKUP(Sheet1!R2C1,Sheet1!R2C1:R16C1,MOD(RC1+3,3)+MOD(INT((RC1+3)/3),3)*5+3,FALSE) -> 164|102|103|104|132 | L42: 25|22|23|24 | M42: 37009|37009|37008|37008 | N42: 10030|10031|10032|10033 | O42: 1|1|1|1 | P42: 2500|2500|2500|2500
A43: 37 | B43: 35 | C43: 30 | D43: =R[-20]C+2 -> 22 | E43: 1000 | F43: =MOD(RC[-5]-1,3)*30+100&"|"&MOD(RC[-5]-1,3)*30+101&"|"&MOD(RC[-5]-1,3)*30+102&"|"&MOD(RC[-5]-1,3)*30+103&"|"&IF(MOD(RC[-5],4)=0,HLOOKUP(Sheet1!R2C10,Sheet1!R2C10:R7C10,MOD(RC[-5]/4-1,6)+1,FALSE),IF(MOD(RC[-5],2)=0,IF(RC[-5]>20,HLOOKUP(Sheet1!R2C7,Sheet1!R2C7:R43C7,MOD(RC[-5]/2-1,42)+1,FALSE),HLOOKUP(Sheet1!R2C4,Sheet1!R2C4:R7C4,MOD(RC[-5]-1,6)+1,FALSE)),MOD(RC[-5]-1,3)*30+104)) -> 100|101|102|103|104 | G43: =HLOOKUP(Sheet1!R2C1,Sheet1!R2C1:R16C1,MOD(RC1-1,2)+MOD(INT((RC1-1)/2),3)*5+1,FALSE)&"|"&HLOOKUP(Sheet1!R2C1,Sheet1!R2C1:R16C1,MOD(RC1,2)+MOD(INT((RC1)/2),3)*5+1,FALSE)&"|"&HLOOKUP(Sheet1!R2C1,Sheet1!R2C1:R16C1,MOD(RC1+1,2)+MOD(INT((RC1+1)/2),3)*5+1,FALSE)&"|"&HLOOKUP(Sheet1!R2C1,Sheet1!R2C1:R16C1,MOD(RC1+2,2)+MOD(INT((RC1+2)/2),3)*5+1,FALSE)&"|"&HLOOKUP(Sheet1!R2C1,Sheet1!R2C1:R16C1,MOD(RC1+3,2)+MOD(INT((RC1+3)/2),3)*5+1,FALSE) -> 100|101|130|131|160 | H43: =HLOOKUP(Sheet1!R2C1,Sheet1!R2C1:R16C1,MOD(RC1+2,2)+MOD(INT((RC1+2)/2),3)*5+1,FALSE)&"|"&HLOOKUP(Sheet1!R2C1,Sheet1!R2C1:R16C1,MOD(RC1+3,2)+MOD(INT((RC1+3)/2),3)*5+1,FALSE)&"|"&HLOOKUP(Sheet1!R2C1,Sheet1!R2C1:R16C1,MOD(RC1+4,2)+MOD(INT((RC1+4)/2),3)*5+1,FALSE)&"|"&HLOOKUP(Sheet1!R2C1,Sheet1!R2C1:R16C1,MOD(RC1+5,2)+MOD(INT((RC1+5)/2),3)*5+1,FALSE)&"|"&HLOOKUP(Sheet1!R2C1,Sheet1!R2C1:R16C1,MOD(RC1+6,2)+MOD(INT((RC1+6)/2),3)*5+1,FALSE) -> 131|160|161|100|101 | I43: =HLOOKUP(Sheet1!R2C1,Sheet1!R2C1:R16C1,MOD(RC1-1,3)+MOD(INT((RC1-1)/3),3)*5+3,FALSE)&"|"&HLOOKUP(Sheet1!R2C1,Sheet1!R2C1:R16C1,MOD(RC1,3)+MOD(INT((RC1)/3),3)*5+3,FALSE)&"|"&HLOOKUP(Sheet1!R2C1,Sheet1!R2C1:R16C1,MOD(RC1+1,3)+MOD(INT((RC1+1)/3),3)*5+3,FALSE)&"|"&HLOOKUP(Sheet1!R2C1,Sheet1!R2C1:R16C1,MOD(RC1+2,3)+MOD(INT((RC1+2)/3),3)*5+3,FALSE)&"|"&HLOOKUP(Sheet1!R2C1,Sheet1!R2C1:R16C1,MOD(RC1+3,3)+MOD(INT((RC1+3)/3),3)*5+3,FALSE) -> 102|103|104|132|133 | J43: =HLOOKUP(Sheet1!R2C1,Sheet1!R2C1:R16C1,MOD(RC1-1,3)+MOD(INT((RC1-1)/3),3)*5+3,FALSE)&"|"&HLOOKUP(Sheet1!R2C1,Sheet1!R2C1:R16C1,MOD(RC1,3)+MOD(INT((RC1)/3),3)*5+3,FALSE)&"|"&HLOOKUP(Sheet1!R2C1,Sheet1!R2C1:R16C1,MOD(RC1+1,3)+MOD(INT((RC1+1)/3),3)*5+3,FALSE)&"|"&HLOOKUP(Sheet1!R2C1,Sheet1!R2C1:R16C1,MOD(RC1+2,3)+MOD(INT((RC1+2)/3),3)*5+3,FALSE)&"|"&HLOOKUP(Sheet1!R2C1,Sheet1!R2C1:R16C1,MOD(RC1+3,3)+MOD(INT((RC1+3)/3),3)*5+3,FALSE) -> 102|103|104|132|133 | K43: =HLOOKUP(Sheet1!R2C1,Sheet1!R2C1:R16C1,MOD(RC1-1,3)+MOD(INT((RC1-1)/3),3)*5+3,FALSE)&"|"&HLOOKUP(Sheet1!R2C1,Sheet1!R2C1:R16C1,MOD(RC1,3)+MOD(INT((RC1)/3),3)*5+3,FALSE)&"|"&HLOOKUP(Sheet1!R2C1,Sheet1!R2C1:R16C1,MOD(RC1+1,3)+MOD(INT((RC1+1)/3),3)*5+3,FALSE)&"|"&HLOOKUP(Sheet1!R2C1,Sheet1!R2C1:R16C1,MOD(RC1+2,3)+MOD(INT((RC1+2)/3),3)*5+3,FALSE)&"|"&HLOOKUP(Sheet1!R2C1,Sheet1!R2C1:R16C1,MOD(RC1+3,3)+MOD(INT((RC1+3)/3),3)*5+3,FALSE) -> 102|103|104|132|133 | L43: 25|22|23|24 | M43: 38221|38221|38223|38223 | N43: 10030|10031|10032|10033 | O43: 1|1|1|1 | P43: 2500|2500|2500|2500
A44: 38 | B44: 36 | C44: 30 | D44: =R[-20]C+2 -> 22 | E44: 1000 | F44: =MOD(RC[-5]-1,3)*30+100&"|"&MOD(RC[-5]-1,3)*30+101&"|"&MOD(RC[-5]-1,3)*30+102&"|"&MOD(RC[-5]-1,3)*30+103&"|"&IF(MOD(RC[-5],4)=0,HLOOKUP(Sheet1!R2C10,Sheet1!R2C10:R7C10,MOD(RC[-5]/4-1,6)+1,FALSE),IF(MOD(RC[-5],2)=0,IF(RC[-5]>20,HLOOKUP(Sheet1!R2C7,Sheet1!R2C7:R43C7,MOD(RC[-5]/2-1,42)+1,FALSE),HLOOKUP(Sheet1!R2C4,Sheet1!R2C4:R7C4,MOD(RC[-5]-1,6)+1,FALSE)),MOD(RC[-5]-1,3)*30+104)) -> 130|131|132|133|146 | G44: =HLOOKUP(Sheet1!R2C1,Sheet1!R2C1:R16C1,MOD(RC1-1,2)+MOD(INT((RC1-1)/2),3)*5+1,FALSE)&"|"&HLOOKUP(Sheet1!R2C1,Sheet1!R2C1:R16C1,MOD(RC1,2)+MOD(INT((RC1)/2),3)*5+1,FALSE)&"|"&HLOOKUP(Sheet1!R2C1,Sheet1!R2C1:R16C1,MOD(RC1+1,2)+MOD(INT((RC1+1)/2),3)*5+1,FALSE)&"|"&HLOOKUP(Sheet1!R2C1,Sheet1!R2C1:R16C1,MOD(RC1+2,2)+MOD(INT((RC1+2)/2),3)*5+1,FALSE)&"|"&HLOOKUP(Sheet1!R2C1,Sheet1!R2C1:R16C1,MOD(RC1+3,2)+MOD(INT((RC1+3)/2),3)*5+1,FALSE) -> 101|130|131|160|161 | H44: =HLOOKUP(Sheet1!R2C1,Sheet1!R2C1:R16C1,MOD(RC1+2,2)+MOD(INT((RC1+2)/2),3)*5+1,FALSE)&"|"&HLOOKUP(Sheet1!R2C1,Sheet1!R2C1:R16C1,MOD(RC1+3,2)+MOD(INT((RC1+3)/2),3)*5+1,FALSE)&"|"&HLOOKUP(Sheet1!R2C1,Sheet1!R2C1:R16C1,MOD(RC1+4,2)+MOD(INT((RC1+4)/2),3)*5+1,FALSE)&"|"&HLOOKUP(Sheet1!R2C1,Sheet1!R2C1:R16C1,MOD(RC1+5,2)+MOD(INT((RC1+5)/2),3)*5+1,FALSE)&"|"&HLOOKUP(Sheet1!R2C1,Sheet1!R2C1:R16C1,MOD(RC1+6,2)+MOD(INT((RC1+6)/2),3)*5+1,FALSE) -> 160|161|100|101|130 | I44: =HLOOKUP(Sheet1!R2C1,Sheet1!R2C1:R16C1,MOD(RC1-1,3)+MOD(INT((RC1-1)/3),3)*5+3,FALSE)&"|"&HLOOKUP(Sheet1!R2C1,Sheet1!R2C1:R16C1,MOD(RC1,3)+MOD(INT((RC1)/3),3)*5+3,FALSE)&"|"&HLOOKUP(Sheet1!R2C1,Sheet1!R2C1:R16C1,MOD(RC1+1,3)+MOD(INT((RC1+1)/3),3)*5+3,FALSE)&"|"&HLOOKUP(Sheet1!R2C1,Sheet1!R2C1:R16C1,MOD(RC1+2,3)+MOD(INT((RC1+2)/3),3)*5+3,FALSE)&"|"&HLOOKUP(Sheet1!R2C1,Sheet1!R2C1:R16C1,MOD(RC1+3,3)+MOD(INT((RC1+3)/3),3)*5+3,FALSE) -> 103|104|132|133|134 | J44: =HLOOKUP(Sheet1!R2C1,Sheet1!R2C1:R16C1,MOD(RC1-1,3)+MOD(INT((RC1-1)/3),3)*5+3,FALSE)&"|"&HLOOKUP(Sheet1!R2C1,Sheet1!R2C1:R16C1,MOD(RC1,3)+MOD(INT((RC1)/3),3)*5+3,FALSE)&"|"&HLOOKUP(Sheet1!R2C1,Sheet1!R2C1:R16C1,MOD(RC1+1,3)+MOD(INT((RC1+1)/3),3)*5+3,FALSE)&"|"&HLOOKUP(Sheet1!R2C1,Sheet1!R2C1:R16C1,MOD(RC1+2,3)+MOD(INT((RC1+2)/3),3)*5+3,FALSE)&"|"&HLOOKUP(Sheet1!R2C1,Sheet1!R2C1:R16C1,MOD(RC1+3,3)+MOD(INT((RC1+3)/3),3)*5+3,FALSE) -> 103|104|132|133|134 | K44: =HLOOKUP(Sheet1!R2C1,Sheet1!R2C1:R16C1,MOD(RC1-1,3)+MOD(INT((RC1-1)/3),3)*5+3,FALSE)&"|"&HLOOKUP(Sheet1!R2C1,Sheet1!R2C1:R16C1,MOD(RC1,3)+MOD(INT((RC1)/3),3)*5+3,FALSE)&"|"&HLOOKUP(Sheet1!R2C1,Sheet1!R2C1:R16C1,MOD(RC1+1,3)+MOD(INT((RC1+1)/3),3)*5+3,FALSE)&"|"&HLOOKUP(Sheet1!R2C1,Sheet1!R2C1:R16C1,MOD(RC1+2,3)+MOD(INT((RC1+2)/3),3)*5+3,FALSE)&"|"&HLOOKUP(Sheet1!R2C1,Sheet1!R2C1:R16C1,MOD(RC1+3,3)+MOD(INT((RC1+3)/3),3)*5+3,FALSE) -> 103|104|132|133|134 | L44: 25|22|23|24 | M44: 39522|39521|39523|39523 | N44: 10030|10031|10032|10033 | O44: 1|1|1|1 | P44: 2500|2500|2500|2500
A45: 39 | B45: 37 | C45: 30 | D45: =R[-20]C+2 -> 22 | E45: 1000 | F45: =MOD(RC[-5]-1,3)*30+100&"|"&MOD(RC[-5]-1,3)*30+101&"|"&MOD(RC[-5]-1,3)*30+102&"|"&MOD(RC[-5]-1,3)*30+103&"|"&IF(MOD(RC[-5],4)=0,HLOOKUP(Sheet1!R2C10,Sheet1!R2C10:R7C10,MOD(RC[-5]/4-1,6)+1,FALSE),IF(MOD(RC[-5],2)=0,IF(RC[-5]>20,HLOOKUP(Sheet1!R2C7,Sheet1!R2C7:R43C7,MOD(RC[-5]/2-1,42)+1,FALSE),HLOOKUP(Sheet1!R2C4,Sheet1!R2C4:R7C4,MOD(RC[-5]-1,6)+1,FALSE)),MOD(RC[-5]-1,3)*30+104)) -> 160|161|162|163|164 | G45: =HLOOKUP(Sheet1!R2C1,Sheet1!R2C1:R16C1,MOD(RC1-1,2)+MOD(INT((RC1-1)/2),3)*5+1,FALSE)&"|"&HLOOKUP(Sheet1!R2C1,Sheet1!R2C1:R16C1,MOD(RC1,2)+MOD(INT((RC1)/2),3)*5+1,FALSE)&"|"&HLOOKUP(Sheet1!R2C1,Sheet1!R2C1:R16C1,MOD(RC1+1,2)+MOD(INT((RC1+1)/2),3)*5+1,FALSE)&"|"&HLOOKUP(Sheet1!R2C1,Sheet1!R2C1:R16C1,MOD(RC1+2,2)+MOD(INT((RC1+2)/2),3)*5+1,FALSE)&"|"&HLOOKUP(Sheet1!R2C1,Sheet1!R2C1:R16C1,MOD(RC1+3,2)+MOD(INT((RC1+3)/2),3)*5+1,FALSE) -> 130|131|160|161|100 | H45: =HLOOKUP(Sheet1!R2C1,Sheet1!R2C1:R16C1,MOD(RC1+2,2)+MOD(INT((RC1+2)/2),3)*5+1,FALSE)&"|"&HLOOKUP(Sheet1!R2C1,Sheet1!R2C1:R16C1,MOD(RC1+3,2)+MOD(INT((RC1+3)/2),3)*5+1,FALSE)&"|"&HLOOKUP(Sheet1!R2C1,Sheet1!R2C1:R16C1,MOD(RC1+4,2)+MOD(INT((RC1+4)/2),3)*5+1,FALSE)&"|"&HLOOKUP(Sheet1!R2C1,Sheet1!R2C1:R16C1,MOD(RC1+5,2)+MOD(INT((RC1+5)/2),3)*5+1,FALSE)&"|"&HLOOKUP(Sheet1!R2C1,Sheet1!R2C1:R16C1,MOD(RC1+6,2)+MOD(INT((RC1+6)/2),3)*5+1,FALSE) -> 161|100|101|130|131 | I45: =HLOOKUP(Sheet1!R2C1,Sheet1!R2C1:R16C1,MOD(RC1-1,3)+MOD(INT((RC1-1)/3),3)*5+3,FALSE)&"|"&HLOOKUP(Sheet1!R2C1,Sheet1!R2C1:R16C1,MOD(RC1,3)+MOD(INT((RC1)/3),3)*5+3,FALSE)&"|"&HLOOKUP(Sheet1!R2C1,Sheet1!R2C1:R16C1,MOD(RC1+1,3)+MOD(INT((RC1+1)/3),3)*5+3,FALSE)&"|"&HLOOKUP(Sheet1!R2C1,Sheet1!R2C1:R16C1,MOD(RC1+2,3)+MOD(INT((RC1+2)/3),3)*5+3,FALSE)&"|"&HLOOKUP(Sheet1!R2C1,Sheet1!R2C1:R16C1,MOD(RC1+3,3)+MOD(INT((RC1+3)/3),3)*5+3,FALSE) -> 104|132|133|134|162 | J45: =HLOOKUP(Sheet1!R2C1,Sheet1!R2C1:R16C1,MOD(RC1-1,3)+MOD(INT((RC1-1)/3),3)*5+3,FALSE)&"|"&HLOOKUP(Sheet1!R2C1,Sheet1!R2C1:R16C1,MOD(RC1,3)+MOD(INT((RC1)/3),3)*5+3,FALSE)&"|"&HLOOKUP(Sheet1!R2C1,Sheet1!R2C1:R16C1,MOD(RC1+1,3)+MOD(INT((RC1+1)/3),3)*5+3,FALSE)&"|"&HLOOKUP(Sheet1!R2C1,Sheet1!R2C1:R16C1,MOD(RC1+2,3)+MOD(INT((RC1+2)/3),3)*5+3,FALSE)&"|"&HLOOKUP(Sheet1!R2C1,Sheet1!R2C1:R16C1,MOD(RC1+3,3)+MOD(INT((RC1+3)/3),3)*5+3,FALSE) -> 104|132|133|134|162 | K45: =HLOOKUP(Sheet1!R2C1,Sheet1!R2C1:R16C1,MOD(RC1-1,3)+MOD(INT((RC1-1)/3),3)*5+3,FALSE)&"|"&HLOOKUP(Sheet1!R2C1,Sheet1!R2C1:R16C1,MOD(RC1,3)+MOD(INT((RC1)/3),3)*5+3,FALSE)&"|"&HLOOKUP(Sheet1!R2C1,Sheet1!R2C1:R16C1,MOD(RC1+1,3)+MOD(INT((RC1+1)/3),3)*5+3,FALSE)&"|"&HLOOKUP(Sheet1!R2C1,Sheet1!R2C1:R16C1,MOD(RC1+2,3)+MOD(INT((RC1+2)/3),3)*5+3,FALSE)&"|"&HLOOKUP(Sheet1!R2C1,Sheet1!R2C1:R16C1,MOD(RC1+3,3)+MOD(INT((RC1+3)/3),3)*5+3,FALSE) -> 104|132|133|134|162 | L45: 25|22|23|24 | M45: 40796|40796|40795|40795 | N45: 10030|10031|10032|10033 | O45: 1|1|1|1 | P45: 2500|2500|2500|2500
A46: 40 | B46: 38 | C46: 30 | D46: =R[-20]C+2 -> 22 | E46: 1000 | F46: =MOD(RC[-5]-1,3)*30+100&"|"&MOD(RC[-5]-1,3)*30+101&"|"&MOD(RC[-5]-1,3)*30+102&"|"&MOD(RC[-5]-1,3)*30+103&"|"&IF(MOD(RC[-5],4)=0,HLOOKUP(Sheet1!R2C10,Sheet1!R2C10:R7C10,MOD(RC[-5]/4-1,6)+1,FALSE),IF(MOD(RC[-5],2)=0,IF(RC[-5]>20,HLOOKUP(Sheet1!R2C7,Sheet1!R2C7:R43C7,MOD(RC[-5]/2-1,42)+1,FALSE),HLOOKUP(Sheet1!R2C4,Sheet1!R2C4:R7C4,MOD(RC[-5]-1,6)+1,FALSE)),MOD(RC[-5]-1,3)*30+104)) -> 100|101|102|103|193 | G46: =HLOOKUP(Sheet1!R2C1,Sheet1!R2C1:R16C1,MOD(RC1-1,2)+MOD(INT((RC1-1)/2),3)*5+1,FALSE)&"|"&HLOOKUP(Sheet1!R2C1,Sheet1!R2C1:R16C1,MOD(RC1,2)+MOD(INT((RC1)/2),3)*5+1,FALSE)&"|"&HLOOKUP(Sheet1!R2C1,Sheet1!R2C1:R16C1,MOD(RC1+1,2)+MOD(INT((RC1+1)/2),3)*5+1,FALSE)&"|"&HLOOKUP(Sheet1!R2C1,Sheet1!R2C1:R16C1,MOD(RC1+2,2)+MOD(INT((RC1+2)/2),3)*5+1,FALSE)&"|"&HLOOKUP(Sheet1!R2C1,Sheet1!R2C1:R16C1,MOD(RC1+3,2)+MOD(INT((RC1+3)/2),3)*5+1,FALSE) -> 131|160|161|100|101 | H46: =HLOOKUP(Sheet1!R2C1,Sheet1!R2C1:R16C1,MOD(RC1+2,2)+MOD(INT((RC1+2)/2),3)*5+1,FALSE)&"|"&HLOOKUP(Sheet1!R2C1,Sheet1!R2C1:R16C1,MOD(RC1+3,2)+MOD(INT((RC1+3)/2),3)*5+1,FALSE)&"|"&HLOOKUP(Sheet1!R2C1,Sheet1!R2C1:R16C1,MOD(RC1+4,2)+MOD(INT((RC1+4)/2),3)*5+1,FALSE)&"|"&HLOOKUP(Sheet1!R2C1,Sheet1!R2C1:R16C1,MOD(RC1+5,2)+MOD(INT((RC1+5)/2),3)*5+1,FALSE)&"|"&HLOOKUP(Sheet1!R2C1,Sheet1!R2C1:R16C1,MOD(RC1+6,2)+MOD(INT((RC1+6)/2),3)*5+1,FALSE) -> 100|101|130|131|160 | I46: =HLOOKUP(Sheet1!R2C1,Sheet1!R2C1:R16C1,MOD(RC1-1,3)+MOD(INT((RC1-1)/3),3)*5+3,FALSE)&"|"&HLOOKUP(Sheet1!R2C1,Sheet1!R2C1:R16C1,MOD(RC1,3)+MOD(INT((RC1)/3),3)*5+3,FALSE)&"|"&HLOOKUP(Sheet1!R2C1,Sheet1!R2C1:R16C1,MOD(RC1+1,3)+MOD(INT((RC1+1)/3),3)*5+3,FALSE)&"|"&HLOOKUP(Sheet1!R2C1,Sheet1!R2C1:R16C1,MOD(RC1+2,3)+MOD(INT((RC1+2)/3),3)*5+3,FALSE)&"|"&HLOOKUP(Sheet1!R2C1,Sheet1!R2C1:R16C1,MOD(RC1+3,3)+MOD(INT((RC1+3)/3),3)*5+3,FALSE) -> 132|133|134|162|163 | J46: =HLOOKUP(Sheet1!R2C1,Sheet1!R2C1:R16C1,MOD(RC1-1,3)+MOD(INT((RC1-1)/3),3)*5+3,FALSE)&"|"&HLOOKUP(Sheet1!R2C1,Sheet1!R2C1:R16C1,MOD(RC1,3)+MOD(INT((RC1)/3),3)*5+3,FALSE)&"|"&HLOOKUP(Sheet1!R2C1,Sheet1!R2C1:R16C1,MOD(RC1+1,3)+MOD(INT((RC1+1)/3),3)*5+3,FALSE)&"|"&HLOOKUP(Sheet1!R2C1,Sheet1!R2C1:R16C1,MOD(RC1+2,3)+MOD(INT((RC1+2)/3),3)*5+3,FALSE)&"|"&HLOOKUP(Sheet1!R2C1,Sheet1!R2C1:R16C1,MOD(RC1+3,3)+MOD(INT((RC1+3)/3),3)*5+3,FALSE) -> 132|133|134|162|163 | K46: =HLOOKUP(Sheet1!R2C1,Sheet1!R2C1:R16C1,MOD(RC1-1,3)+MOD(INT((RC1-1)/3),3)*5+3,FALSE)&"|"&HLOOKUP(Sheet1!R2C1,Sheet1!R2C1:R16C1,MOD(RC1,3)+MOD(INT((RC1)/3),3)*5+3,FALSE)&"|"&HLOOKUP(Sheet1!R2C1,Sheet1!R2C1:R16C1,MOD(RC1+1,3)+MOD(INT((RC1+1)/3),3)*5+3,FALSE)&"|"&HLOOKUP(Sheet1!R2C1,Sheet1!R2C1:R16C1,MOD(RC1+2,3)+MOD(INT((RC1+2)/3),3)*5+3,FALSE)&"|"&HLOOKUP(Sheet1!R2C1,Sheet1!R2C1:R16C1,MOD(RC1+3,3)+MOD(INT((RC1+3)/3),3)*5+3,FALSE) -> 132|133|134|162|163 | L46: 25|22|23|24 | M46: 42165|42165|42165|42165 | N46: 10030|10031|10032|10033|10030|10031|10032|10033|10030|10031|10032|10033|10030|10031|10032|10033|10030|10031|10032|10033|10030|10031|10032|10033|10030|10031|10032|10033|10030|10031|10032|10033|10030|10031|10032|10033|10030|10031|10032|10033 | O46: 1|1|1|1|1|1|1|1|1|1|1|1|1|1|1|1|1|1|1|1|1|1|1|1|1|1|1|1|1|1|1|1|1|1|1|1|1|1|1|1 | P46: 2500|2500|2500|2500|2500|2500|2500|2500|2500|2500|2500|2500|2500|2500|2500|2500|2500|2500|2500|2500|2500|2500|2500|2500|2500|2500|2500|2500|2500|2500|2500|2500|2500|2500|2500|2500|2500|2500|2500|2500
A47: 41 | B47: 39 | C47: 30 | D47: =R[-20]C+2 -> 24 | E47: 1000 | F47: =MOD(RC[-5]-1,3)*30+100&"|"&MOD(RC[-5]-1,3)*30+101&"|"&MOD(RC[-5]-1,3)*30+102&"|"&MOD(RC[-5]-1,3)*30+103&"|"&IF(MOD(RC[-5],4)=0,HLOOKUP(Sheet1!R2C10,Sheet1!R2C10:R7C10,MOD(RC[-5]/4-1,6)+1,FALSE),IF(MOD(RC[-5],2)=0,IF(RC[-5]>20,HLOOKUP(Sheet1!R2C7,Sheet1!R2C7:R43C7,MOD(RC[-5]/2-1,42)+1,FALSE),HLOOKUP(Sheet1!R2C4,Sheet1!R2C4:R7C4,MOD(RC[-5]-1,6)+1,FALSE)),MOD(RC[-5]-1,3)*30+104)) -> 130|131|132|133|134 | G47: =HLOOKUP(Sheet1!R2C1,Sheet1!R2C1:R16C1,MOD(RC1-1,2)+MOD(INT((RC1-1)/2),3)*5+1,FALSE)&"|"&HLOOKUP(Sheet1!R2C1,Sheet1!R2C1:R16C1,MOD(RC1,2)+MOD(INT((RC1)/2),3)*5+1,FALSE)&"|"&HLOOKUP(Sheet1!R2C1,Sheet1!R2C1:R16C1,MOD(RC1+1,2)+MOD(INT((RC1+1)/2),3)*5+1,FALSE)&"|"&HLOOKUP(Sheet1!R2C1,Sheet1!R2C1:R16C1,MOD(RC1+2,2)+MOD(INT((RC1+2)/2),3)*5+1,FALSE)&"|"&HLOOKUP(Sheet1!R2C1,Sheet1!R2C1:R16C1,MOD(RC1+3,2)+MOD(INT((RC1+3)/2),3)*5+1,FALSE) -> 160|161|100|101|130 | H47: =HLOOKUP(Sheet1!R2C1,Sheet1!R2C1:R16C1,MOD(RC1+2,2)+MOD(INT((RC1+2)/2),3)*5+1,FALSE)&"|"&HLOOKUP(Sheet1!R2C1,Sheet1!R2C1:R16C1,MOD(RC1+3,2)+MOD(INT((RC1+3)/2),3)*5+1,FALSE)&"|"&HLOOKUP(Sheet1!R2C1,Sheet1!R2C1:R16C1,MOD(RC1+4,2)+MOD(INT((RC1+4)/2),3)*5+1,FALSE)&"|"&HLOOKUP(Sheet1!R2C1,Sheet1!R2C1:R16C1,MOD(RC1+5,2)+MOD(INT((RC1+5)/2),3)*5+1,FALSE)&"|"&HLOOKUP(Sheet1!R2C1,Sheet1!R2C1:R16C1,MOD(RC1+6,2)+MOD(INT((RC1+6)/2),3)*5+1,FALSE) -> 101|130|131|160|161 | I47: =HLOOKUP(Sheet1!R2C1,Sheet1!R2C1:R16C1,MOD(RC1-1,3)+MOD(INT((RC1-1)/3),3)*5+3,FALSE)&"|"&HLOOKUP(Sheet1!R2C1,Sheet1!R2C1:R16C1,MOD(RC1,3)+MOD(INT((RC1)/3),3)*5+3,FALSE)&"|"&HLOOKUP(Sheet1!R2C1,Sheet1!R2C1:R16C1,MOD(RC1+1,3)+MOD(INT((RC1+1)/3),3)*5+3,FALSE)&"|"&HLOOKUP(Sheet1!R2C1,Sheet1!R2C1:R16C1,MOD(RC1+2,3)+MOD(INT((RC1+2)/3),3)*5+3,FALSE)&"|"&HLOOKUP(Sheet1!R2C1,Sheet1!R2C1:R16C1,MOD(RC1+3,3)+MOD(INT((RC1+3)/3),3)*5+3,FALSE) -> 133|134|162|163|164 | J47: =HLOOKUP(Sheet1!R2C1,Sheet1!R2C1:R16C1,MOD(RC1-1,3)+MOD(INT((RC1-1)/3),3)*5+3,FALSE)&"|"&HLOOKUP(Sheet1!R2C1,Sheet1!R2C1:R16C1,MOD(RC1,3)+MOD(INT((RC1)/3),3)*5+3,FALSE)&"|"&HLOOKUP(Sheet1!R2C1,Sheet1!R2C1:R16C1,MOD(RC1+1,3)+MOD(INT((RC1+1)/3),3)*5+3,FALSE)&"|"&HLOOKUP(Sheet1!R2C1,Sheet1!R2C1:R16C1,MOD(RC1+2,3)+MOD(INT((RC1+2)/3),3)*5+3,FALSE)&"|"&HLOOKUP(Sheet1!R2C1,Sheet1!R2C1:R16C1,MOD(RC1+3,3)+MOD(INT((RC1+3)/3),3)*5+3,FALSE) -> 133|134|162|163|164 | K47: =HLOOKUP(Sheet1!R2C1,Sheet1!R2C1:R16C1,MOD(RC1-1,3)+MOD(INT((RC1-1)/3),3)*5+3,FALSE)&"|"&HLOOKUP(Sheet1!R2C1,Sheet1!R2C1:R16C1,MOD(RC1,3)+MOD(INT((RC1)/3),3)*5+3,FALSE)&"|"&HLOOKUP(Sheet1!R2C1,Sheet1!R2C1:R16C1,MOD(RC1+1,3)+MOD(INT((RC1+1)/3),3)*5+3,FALSE)&"|"&HLOOKUP(Sheet1!R2C1,Sheet1!R2C1:R16C1,MOD(RC1+2,3)+MOD(INT((RC1+2)/3),3)*5+3,FALSE)&"|"&HLOOKUP(Sheet1!R2C1,Sheet1!R2C1:R16C1,MOD(RC1+3,3)+MOD(INT((RC1+3)/3),3)*5+3,FALSE) -> 133|134|162|163|164 | L47: 25|22|23|24 | M47: 43618|43618|43618|43618 | N47: 10030|10031|10032|10033 | O47: 1|1|1|1 | P47: 2500|2500|2500|2500
A48: 42 | B48: 40 | C48: 30 | D48: =R[-20]C+2 -> 24 | E48: 1000 | F48: =MOD(RC[-5]-1,3)*30+100&"|"&MOD(RC[-5]-1,3)*30+101&"|"&MOD(RC[-5]-1,3)*30+102&"|"&MOD(RC[-5]-1,3)*30+103&"|"&IF(MOD(RC[-5],4)=0,HLOOKUP(Sheet1!R2C10,Sheet1!R2C10:R7C10,MOD(RC[-5]/4-1,6)+1,FALSE),IF(MOD(RC[-5],2)=0,IF(RC[-5]>20,HLOOKUP(Sheet1!R2C7,Sheet1!R2C7:R43C7,MOD(RC[-5]/2-1,42)+1,FALSE),HLOOKUP(Sheet1!R2C4,Sheet1!R2C4:R7C4,MOD(RC[-5]-1,6)+1,FALSE)),MOD(RC[-5]-1,3)*30+104)) -> 160|161|162|163|148 | G48: =HLOOKUP(Sheet1!R2C1,Sheet1!R2C1:R16C1,MOD(RC1-1,2)+MOD(INT((RC1-1)/2),3)*5+1,FALSE)&"|"&HLOOKUP(Sheet1!R2C1,Sheet1!R2C1:R16C1,MOD(RC1,2)+MOD(INT((RC1)/2),3)*5+1,FALSE)&"|"&HLOOKUP(Sheet1!R2C1,Sheet1!R2C1:R16C1,MOD(RC1+1,2)+MOD(INT((RC1+1)/2),3)*5+1,FALSE)&"|"&HLOOKUP(Sheet1!R2C1,Sheet1!R2C1:R16C1,MOD(RC1+2,2)+MOD(INT((RC1+2)/2),3)*5+1,FALSE)&"|"&HLOOKUP(Sheet1!R2C1,Sheet1!R2C1:R16C1,MOD(RC1+3,2)+MOD(INT((RC1+3)/2),3)*5+1,FALSE) -> 161|100|101|130|131 | H48: =HLOOKUP(Sheet1!R2C1,Sheet1!R2C1:R16C1,MOD(RC1+2,2)+MOD(INT((RC1+2)/2),3)*5+1,FALSE)&"|"&HLOOKUP(Sheet1!R2C1,Sheet1!R2C1:R16C1,MOD(RC1+3,2)+MOD(INT((RC1+3)/2),3)*5+1,FALSE)&"|"&HLOOKUP(Sheet1!R2C1,Sheet1!R2C1:R16C1,MOD(RC1+4,2)+MOD(INT((RC1+4)/2),3)*5+1,FALSE)&"|"&HLOOKUP(Sheet1!R2C1,Sheet1!R2C1:R16C1,MOD(RC1+5,2)+MOD(INT((RC1+5)/2),3)*5+1,FALSE)&"|"&HLOOKUP(Sheet1!R2C1,Sheet1!R2C1:R16C1,MOD(RC1+6,2)+MOD(INT((RC1+6)/2),3)*5+1,FALSE) -> 130|131|160|161|100 | I48: =HLOOKUP(Sheet1!R2C1,Sheet1!R2C1:R16C1,MOD(RC1-1,3)+MOD(INT((RC1-1)/3),3)*5+3,FALSE)&"|"&HLOOKUP(Sheet1!R2C1,Sheet1!R2C1:R16C1,MOD(RC1,3)+MOD(INT((RC1)/3),3)*5+3,FALSE)&"|"&HLOOKUP(Sheet1!R2C1,Sheet1!R2C1:R16C1,MOD(RC1+1,3)+MOD(INT((RC1+1)/3),3)*5+3,FALSE)&"|"&HLOOKUP(Sheet1!R2C1,Sheet1!R2C1:R16C1,MOD(RC1+2,3)+MOD(INT((RC1+2)/3),3)*5+3,FALSE)&"|"&HLOOKUP(Sheet1!R2C1,Sheet1!R2C1:R16C1,MOD(RC1+3,3)+MOD(INT((RC1+3)/3),3)*5+3,FALSE) -> 134|162|163|164|102 | J48: =HLOOKUP(Sheet1!R2C1,Sheet1!R2C1:R16C1,MOD(RC1-1,3)+MOD(INT((RC1-1)/3),3)*5+3,FALSE)&"|"&HLOOKUP(Sheet1!R2C1,Sheet1!R2C1:R16C1,MOD(RC1,3)+MOD(INT((RC1)/3),3)*5+3,FALSE)&"|"&HLOOKUP(Sheet1!R2C1,Sheet1!R2C1:R16C1,MOD(RC1+1,3)+MOD(INT((RC1+1)/3),3)*5+3,FALSE)&"|"&HLOOKUP(Sheet1!R2C1,Sheet1!R2C1:R16C1,MOD(RC1+2,3)+MOD(INT((RC1+2)/3),3)*5+3,FALSE)&"|"&HLOOKUP(Sheet1!R2C1,Sheet1!R2C1:R16C1,MOD(RC1+3,3)+MOD(INT((RC1+3)/3),3)*5+3,FALSE) -> 134|162|163|164|102 | K48: =HLOOKUP(Sheet1!R2C1,Sheet1!R2C1:R16C1,MOD(RC1-1,3)+MOD(INT((RC1-1)/3),3)*5+3,FALSE)&"|"&HLOOKUP(Sheet1!R2C1,Sheet1!R2C1:R16C1,MOD(RC1,3)+MOD(INT((RC1)/3),3)*5+3,FALSE)&"|"&HLOOKUP(Sheet1!R2C1,Sheet1!R2C1:R16C1,MOD(RC1+1,3)+MOD(INT((RC1+1)/3),3)*5+3,FALSE)&"|"&HLOOKUP(Sheet1!R2C1,Sheet1!R2C1:R16C1,MOD(RC1+2,3)+MOD(INT((RC1+2)/3),3)*5+3,FALSE)&"|"&HLOOKUP(Sheet1!R2C1,Sheet1!R2C1:R16C1,MOD(RC1+3,3)+MOD(INT((RC1+3)/3),3)*5+3,FALSE) -> 134|162|163|164|102 | L48: 25|22|23|24 | M48: 45070|45070|45070|45070 | N48: 10030|10031|10032|10033 | O48: 1|1|1|1 | P48: 2500|2500|2500|2500
A49: 43 | B49: 41 | C49: 30 | D49: =R[-20]C+2 -> 24 | E49: 1000 | F49: =MOD(RC[-5]-1,3)*30+100&"|"&MOD(RC[-5]-1,3)*30+101&"|"&MOD(RC[-5]-1,3)*30+102&"|"&MOD(RC[-5]-1,3)*30+103&"|"&IF(MOD(RC[-5],4)=0,HLOOKUP(Sheet1!R2C10,Sheet1!R2C10:R7C10,MOD(RC[-5]/4-1,6)+1,FALSE),IF(MOD(RC[-5],2)=0,IF(RC[-5]>20,HLOOKUP(Sheet1!R2C7,Sheet1!R2C7:R43C7,MOD(RC[-5]/2-1,42)+1,FALSE),HLOOKUP(Sheet1!R2C4,Sheet1!R2C4:R7C4,MOD(RC[-5]-1,6)+1,FALSE)),MOD(RC[-5]-1,3)*30+104)) -> 100|101|102|103|104 | G49: =HLOOKUP(Sheet1!R2C1,Sheet1!R2C1:R16C1,MOD(RC1-1,2)+MOD(INT((RC1-1)/2),3)*5+1,FALSE)&"|"&HLOOKUP(Sheet1!R2C1,Sheet1!R2C1:R16C1,MOD(RC1,2)+MOD(INT((RC1)/2),3)*5+1,FALSE)&"|"&HLOOKUP(Sheet1!R2C1,Sheet1!R2C1:R16C1,MOD(RC1+1,2)+MOD(INT((RC1+1)/2),3)*5+1,FALSE)&"|"&HLOOKUP(Sheet1!R2C1,Sheet1!R2C1:R16C1,MOD(RC1+2,2)+MOD(INT((RC1+2)/2),3)*5+1,FALSE)&"|"&HLOOKUP(Sheet1!R2C1,Sheet1!R2C1:R16C1,MOD(RC1+3,2)+MOD(INT((RC1+3)/2),3)*5+1,FALSE) -> 100|101|130|131|160 | H49: =HLOOKUP(Sheet1!R2C1,Sheet1!R2C1:R16C1,MOD(RC1+2,2)+MOD(INT((RC1+2)/2),3)*5+1,FALSE)&"|"&HLOOKUP(Sheet1!R2C1,Sheet1!R2C1:R16C1,MOD(RC1+3,2)+MOD(INT((RC1+3)/2),3)*5+1,FALSE)&"|"&HLOOKUP(Sheet1!R2C1,Sheet1!R2C1:R16C1,MOD(RC1+4,2)+MOD(INT((RC1+4)/2),3)*5+1,FALSE)&"|"&HLOOKUP(Sheet1!R2C1,Sheet1!R2C1:R16C1,MOD(RC1+5,2)+MOD(INT((RC1+5)/2),3)*5+1,FALSE)&"|"&HLOOKUP(Sheet1!R2C1,Sheet1!R2C1:R16C1,MOD(RC1+6,2)+MOD(INT((RC1+6)/2),3)*5+1,FALSE) -> 131|160|161|100|101 | I49: =HLOOKUP(Sheet1!R2C1,Sheet1!R2C1:R16C1,MOD(RC1-1,3)+MOD(INT((RC1-1)/3),3)*5+3,FALSE)&"|"&HLOOKUP(Sheet1!R2C1,Sheet1!R2C1:R16C1,MOD(RC1,3)+MOD(INT((RC1)/3),3)*5+3,FALSE)&"|"&HLOOKUP(Sheet1!R2C1,Sheet1!R2C1:R16C1,MOD(RC1+1,3)+MOD(INT((RC1+1)/3),3)*5+3,FALSE)&"|"&HLOOKUP(Sheet1!R2C1,Sheet1!R2C1:R16C1,MOD(RC1+2,3)+MOD(INT((RC1+2)/3),3)*5+3,FALSE)&"|"&HLOOKUP(Sheet1!R2C1,Sheet1!R2C1:R16C1,MOD(RC1+3,3)+MOD(INT((RC1+3)/3),3)*5+3,FALSE) -> 162|163|164|102|103 | J49: =HLOOKUP(Sheet1!R2C1,Sheet1!R2C1:R16C1,MOD(RC1-1,3)+MOD(INT((RC1-1)/3),3)*5+3,FALSE)&"|"&HLOOKUP(Sheet1!R2C1,Sheet1!R2C1:R16C1,MOD(RC1,3)+MOD(INT((RC1)/3),3)*5+3,FALSE)&"|"&HLOOKUP(Sheet1!R2C1,Sheet1!R2C1:R16C1,MOD(RC1+1,3)+MOD(INT((RC1+1)/3),3)*5+3,FALSE)&"|"&HLOOKUP(Sheet1!R2C1,Sheet1!R2C1:R16C1,MOD(RC1+2,3)+MOD(INT((RC1+2)/3),3)*5+3,FALSE)&"|"&HLOOKUP(Sheet1!R2C1,Sheet1!R2C1:R16C1,MOD(RC1+3,3)+MOD(INT((RC1+3)/3),3)*5+3,FALSE) -> 162|163|164|102|103 | K49: =HLOOKUP(Sheet1!R2C1,Sheet1!R2C1:R16C1,MOD(RC1-1,3)+MOD(INT((RC1-1)/3),3)*5+3,FALSE)&"|"&HLOOKUP(Sheet1!R2C1,Sheet1!R2C1:R16C1,MOD(RC1,3)+MOD(INT((RC1)/3),3)*5+3,FALSE)&"|"&HLOOKUP(Sheet1!R2C1,Sheet1!R2C1:R16C1,MOD(RC1+1,3)+MOD(INT((RC1+1)/3),3)*5+3,FALSE)&"|"&HLOOKUP(Sheet1!R2C1,Sheet1!R2C1:R16C1,MOD(RC1+2,3)+MOD(INT((RC1+2)/3),3)*5+3,FALSE)&"|"&HLOOKUP(Sheet1!R2C1,Sheet1!R2C1:R16C1,MOD(RC1+3,3)+MOD(INT((RC1+3)/3),3)*5+3,FALSE) -> 162|163|164|102|103 | L49: 25|22|23|24 | M49: 46593|46594|46593|46593 | N49: 10030|10031|10032|10033 | O49: 1|1|1|1 | P49: 2500|2500|2500|2500
A50: 44 | B50: 42 | C50: 30 | D50: =R[-20]C+2 -> 24 | E50: 1000 | F50: =MOD(RC[-5]-1,3)*30+100&"|"&MOD(RC[-5]-1,3)*30+101&"|"&MOD(RC[-5]-1,3)*30+102&"|"&MOD(RC[-5]-1,3)*30+103&"|"&IF(MOD(RC[-5],4)=0,HLOOKUP(Sheet1!R2C10,Sheet1!R2C10:R7C10,MOD(RC[-5]/4-1,6)+1,FALSE),IF(MOD(RC[-5],2)=0,IF(RC[-5]>20,HLOOKUP(Sheet1!R2C7,Sheet1!R2C7:R43C7,MOD(RC[-5]/2-1,42)+1,FALSE),HLOOKUP(Sheet1!R2C4,Sheet1!R2C4:R7C4,MOD(RC[-5]-1,6)+1,FALSE)),MOD(RC[-5]-1,3)*30+104)) -> 130|131|132|133|194 | G50: =HLOOKUP(Sheet1!R2C1,Sheet1!R2C1:R16C1,MOD(RC1-1,2)+MOD(INT((RC1-1)/2),3)*5+1,FALSE)&"|"&HLOOKUP(Sheet1!R2C1,Sheet1!R2C1:R16C1,MOD(RC1,2)+MOD(INT((RC1)/2),3)*5+1,FALSE)&"|"&HLOOKUP(Sheet1!R2C1,Sheet1!R2C1:R16C1,MOD(RC1+1,2)+MOD(INT((RC1+1)/2),3)*5+1,FALSE)&"|"&HLOOKUP(Sheet1!R2C1,Sheet1!R2C1:R16C1,MOD(RC1+2,2)+MOD(INT((RC1+2)/2),3)*5+1,FALSE)&"|"&HLOOKUP(Sheet1!R2C1,Sheet1!R2C1:R16C1,MOD(RC1+3,2)+MOD(INT((RC1+3)/2),3)*5+1,FALSE) -> 101|130|131|160|161 | H50: =HLOOKUP(Sheet1!R2C1,Sheet1!R2C1:R16C1,MOD(RC1+2,2)+MOD(INT((RC1+2)/2),3)*5+1,FALSE)&"|"&HLOOKUP(Sheet1!R2C1,Sheet1!R2C1:R16C1,MOD(RC1+3,2)+MOD(INT((RC1+3)/2),3)*5+1,FALSE)&"|"&HLOOKUP(Sheet1!R2C1,Sheet1!R2C1:R16C1,MOD(RC1+4,2)+MOD(INT((RC1+4)/2),3)*5+1,FALSE)&"|"&HLOOKUP(Sheet1!R2C1,Sheet1!R2C1:R16C1,MOD(RC1+5,2)+MOD(INT((RC1+5)/2),3)*5+1,FALSE)&"|"&HLOOKUP(Sheet1!R2C1,Sheet1!R2C1:R16C1,MOD(RC1+6,2)+MOD(INT((RC1+6)/2),3)*5+1,FALSE) -> 160|161|100|101|130 | I50: =HLOOKUP(Sheet1!R2C1,Sheet1!R2C1:R16C1,MOD(RC1-1,3)+MOD(INT((RC1-1)/3),3)*5+3,FALSE)&"|"&HLOOKUP(Sheet1!R2C1,Sheet1!R2C1:R16C1,MOD(RC1,3)+MOD(INT((RC1)/3),3)*5+3,FALSE)&"|"&HLOOKUP(Sheet1!R2C1,Sheet1!R2C1:R16C1,MOD(RC1+1,3)+MOD(INT((RC1+1)/3),3)*5+3,FALSE)&"|"&HLOOKUP(Sheet1!R2C1,Sheet1!R2C1:R16C1,MOD(RC1+2,3)+MOD(INT((RC1+2)/3),3)*5+3,FALSE)&"|"&HLOOKUP(Sheet1!R2C1,Sheet1!R2C1:R16C1,MOD(RC1+3,3)+MOD(INT((RC1+3)/3),3)*5+3,FALSE) -> 163|164|102|103|104 | J50: =HLOOKUP(Sheet1!R2C1,Sheet1!R2C1:R16C1,MOD(RC1-1,3)+MOD(INT((RC1-1)/3),3)*5+3,FALSE)&"|"&HLOOKUP(Sheet1!R2C1,Sheet1!R2C1:R16C1,MOD(RC1,3)+MOD(INT((RC1)/3),3)*5+3,FALSE)&"|"&HLOOKUP(Sheet1!R2C1,Sheet1!R2C1:R16C1,MOD(RC1+1,3)+MOD(INT((RC1+1)/3),3)*5+3,FALSE)&"|"&HLOOKUP(Sheet1!R2C1,Sheet1!R2C1:R16C1,MOD(RC1+2,3)+MOD(INT((RC1+2)/3),3)*5+3,FALSE)&"|"&HLOOKUP(Sheet1!R2C1,Sheet1!R2C1:R16C1,MOD(RC1+3,3)+MOD(INT((RC1+3)/3),3)*5+3,FALSE) -> 163|164|102|103|104 | K50: =HLOOKUP(Sheet1!R2C1,Sheet1!R2C1:R16C1,MOD(RC1-1,3)+MOD(INT((RC1-1)/3),3)*5+3,FALSE)&"|"&HLOOKUP(Sheet1!R2C1,Sheet1!R2C1:R16C1,MOD(RC1,3)+MOD(INT((RC1)/3),3)*5+3,FALSE)&"|"&HLOOKUP(Sheet1!R2C1,Sheet1!R2C1:R16C1,MOD(RC1+1,3)+MOD(INT((RC1+1)/3),3)*5+3,FALSE)&"|"&HLOOKUP(Sheet1!R2C1,Sheet1!R2C1:R16C1,MOD(RC1+2,3)+MOD(INT((RC1+2)/3),3)*5+3,FALSE)&"|"&HLOOKUP(Sheet1!R2C1,Sheet1!R2C1:R16C1,MOD(RC1+3,3)+MOD(INT((RC1+3)/3),3)*5+3,FALSE) -> 163|164|102|103|104 | L50: 25|22|23|24 | M50: 48104|48104|48103|48103 | N50: 10030|10031|10032|10033 | O50: 1|1|1|1 | P50: 2500|2500|2500|2500
A51: 45 | B51: 43 | C51: 30 | D51: =R[-20]C+2 -> 24 | E51: 1000 | F51: =MOD(RC[-5]-1,3)*30+100&"|"&MOD(RC[-5]-1,3)*30+101&"|"&MOD(RC[-5]-1,3)*30+102&"|"&MOD(RC[-5]-1,3)*30+103&"|"&IF(MOD(RC[-5],4)=0,HLOOKUP(Sheet1!R2C10,Sheet1!R2C10:R7C10,MOD(RC[-5]/4-1,6)+1,FALSE),IF(MOD(RC[-5],2)=0,IF(RC[-5]>20,HLOOKUP(Sheet1!R2C7,Sheet1!R2C7:R43C7,MOD(RC[-5]/2-1,42)+1,FALSE),HLOOKUP(Sheet1!R2C4,Sheet1!R2C4:R7C4,MOD(RC[-5]-1,6)+1,FALSE)),MOD(RC[-5]-1,3)*30+104)) -> 160|161|162|163|164 | G51: =HLOOKUP(Sheet1!R2C1,Sheet1!R2C1:R16C1,MOD(RC1-1,2)+MOD(INT((RC1-1)/2),3)*5+1,FALSE)&"|"&HLOOKUP(Sheet1!R2C1,Sheet1!R2C1:R16C1,MOD(RC1,2)+MOD(INT((RC1)/2),3)*5+1,FALSE)&"|"&HLOOKUP(Sheet1!R2C1,Sheet1!R2C1:R16C1,MOD(RC1+1,2)+MOD(INT((RC1+1)/2),3)*5+1,FALSE)&"|"&HLOOKUP(Sheet1!R2C1,Sheet1!R2C1:R16C1,MOD(RC1+2,2)+MOD(INT((RC1+2)/2),3)*5+1,FALSE)&"|"&HLOOKUP(Sheet1!R2C1,Sheet1!R2C1:R16C1,MOD(RC1+3,2)+MOD(INT((RC1+3)/2),3)*5+1,FALSE) -> 130|131|160|161|100 | H51: =HLOOKUP(Sheet1!R2C1,Sheet1!R2C1:R16C1,MOD(RC1+2,2)+MOD(INT((RC1+2)/2),3)*5+1,FALSE)&"|"&HLOOKUP(Sheet1!R2C1,Sheet1!R2C1:R16C1,MOD(RC1+3,2)+MOD(INT((RC1+3)/2),3)*5+1,FALSE)&"|"&HLOOKUP(Sheet1!R2C1,Sheet1!R2C1:R16C1,MOD(RC1+4,2)+MOD(INT((RC1+4)/2),3)*5+1,FALSE)&"|"&HLOOKUP(Sheet1!R2C1,Sheet1!R2C1:R16C1,MOD(RC1+5,2)+MOD(INT((RC1+5)/2),3)*5+1,FALSE)&"|"&HLOOKUP(Sheet1!R2C1,Sheet1!R2C1:R16C1,MOD(RC1+6,2)+MOD(INT((RC1+6)/2),3)*5+1,FALSE) -> 161|100|101|130|131 | I51: =HLOOKUP(Sheet1!R2C1,Sheet1!R2C1:R16C1,MOD(RC1-1,3)+MOD(INT((RC1-1)/3),3)*5+3,FALSE)&"|"&HLOOKUP(Sheet1!R2C1,Sheet1!R2C1:R16C1,MOD(RC1,3)+MOD(INT((RC1)/3),3)*5+3,FALSE)&"|"&HLOOKUP(Sheet1!R2C1,Sheet1!R2C1:R16C1,MOD(RC1+1,3)+MOD(INT((RC1+1)/3),3)*5+3,FALSE)&"|"&HLOOKUP(Sheet1!R2C1,Sheet1!R2C1:R16C1,MOD(RC1+2,3)+MOD(INT((RC1+2)/3),3)*5+3,FALSE)&"|"&HLOOKUP(Sheet1!R2C1,Sheet1!R2C1:R16C1,MOD(RC1+3,3)+MOD(INT((RC1+3)/3),3)*5+3,FALSE) -> 164|102|103|104|132 | J51: =HLOOKUP(Sheet1!R2C1,Sheet1!R2C1:R16C1,MOD(RC1-1,3)+MOD(INT((RC1-1)/3),3)*5+3,FALSE)&"|"&HLOOKUP(Sheet1!R2C1,Sheet1!R2C1:R16C1,MOD(RC1,3)+MOD(INT((RC1)/3),3)*5+3,FALSE)&"|"&HLOOKUP(Sheet1!R2C1,Sheet1!R2C1:R16C1,MOD(RC1+1,3)+MOD(INT((RC1+1)/3),3)*5+3,FALSE)&"|"&HLOOKUP(Sheet1!R2C1,Sheet1!R2C1:R16C1,MOD(RC1+2,3)+MOD(INT((RC1+2)/3),3)*5+3,FALSE)&"|"&HLOOKUP(Sheet1!R2C1,Sheet1!R2C1:R16C1,MOD(RC1+3,3)+MOD(INT((RC1+3)/3),3)*5+3,FALSE) -> 164|102|103|104|132 | K51: =HLOOKUP(Sheet1!R2C1,Sheet1!R2C1:R16C1,MOD(RC1-1,3)+MOD(INT((RC1-1)/3),3)*5+3,FALSE)&"|"&HLOOKUP(Sheet1!R2C1,Sheet1!R2C1:R16C1,MOD(RC1,3)+MOD(INT((RC1)/3),3)*5+3,FALSE)&"|"&HLOOKUP(Sheet1!R2C1,Sheet1!R2C1:R16C1,MOD(RC1+1,3)+MOD(INT((RC1+1)/3),3)*5+3,FALSE)&"|"&HLOOKUP(Sheet1!R2C1,Sheet1!R2C1:R16C1,MOD(RC1+2,3)+MOD(INT((RC1+2)/3),3)*5+3,FALSE)&"|"&HLOOKUP(Sheet1!R2C1,Sheet1!R2C1:R16C1,MOD(RC1+3,3)+MOD(INT((RC1+3)/3),3)*5+3,FALSE) -> 164|102|103|104|132 | L51: 25|22|23|24 | M51: 49711|49711|49710|49710 | N51: 10030|10031|10032|10033|10030|10031|10032|10033|10030|10031|10032|10033|10030|10031|10032|10033|10030|10031|10032|10033|10030|10031|10032|10033|10030|10031|10032|10033|10030|10031|10032|10033|10030|10031|10032|10033|10030|10031|10032|10033 | O51: 1|1|1|1|1|1|1|1|1|1|1|1|1|1|1|1|1|1|1|1|1|1|1|1|1|1|1|1|1|1|1|1|1|1|1|1|1|1|1|1 | P51: 2500|2500|2500|2500|2500|2500|2500|2500|2500|2500|2500|2500|2500|2500|2500|2500|2500|2500|2500|2500|2500|2500|2500|2500|2500|2500|2500|2500|2500|2500|2500|2500|2500|2500|2500|2500|2500|2500|2500|2500
A52: 46 | B52: 44 | C52: 30 | D52: =R[-20]C+2 -> 24 | E52: 1000 | F52: =MOD(RC[-5]-1,3)*30+100&"|"&MOD(RC[-5]-1,3)*30+101&"|"&MOD(RC[-5]-1,3)*30+102&"|"&MOD(RC[-5]-1,3)*30+103&"|"&IF(MOD(RC[-5],4)=0,HLOOKUP(Sheet1!R2C10,Sheet1!R2C10:R7C10,MOD(RC[-5]/4-1,6)+1,FALSE),IF(MOD(RC[-5],2)=0,IF(RC[-5]>20,HLOOKUP(Sheet1!R2C7,Sheet1!R2C7:R43C7,MOD(RC[-5]/2-1,42)+1,FALSE),HLOOKUP(Sheet1!R2C4,Sheet1!R2C4:R7C4,MOD(RC[-5]-1,6)+1,FALSE)),MOD(RC[-5]-1,3)*30+104)) -> 100|101|102|103|150 | G52: =HLOOKUP(Sheet1!R2C1,Sheet1!R2C1:R16C1,MOD(RC1-1,2)+MOD(INT((RC1-1)/2),3)*5+1,FALSE)&"|"&HLOOKUP(Sheet1!R2C1,Sheet1!R2C1:R16C1,MOD(RC1,2)+MOD(INT((RC1)/2),3)*5+1,FALSE)&"|"&HLOOKUP(Sheet1!R2C1,Sheet1!R2C1:R16C1,MOD(RC1+1,2)+MOD(INT((RC1+1)/2),3)*5+1,FALSE)&"|"&HLOOKUP(Sheet1!R2C1,Sheet1!R2C1:R16C1,MOD(RC1+2,2)+MOD(INT((RC1+2)/2),3)*5+1,FALSE)&"|"&HLOOKUP(Sheet1!R2C1,Sheet1!R2C1:R16C1,MOD(RC1+3,2)+MOD(INT((RC1+3)/2),3)*5+1,FALSE) -> 131|160|161|100|101 | H52: =HLOOKUP(Sheet1!R2C1,Sheet1!R2C1:R16C1,MOD(RC1+2,2)+MOD(INT((RC1+2)/2),3)*5+1,FALSE)&"|"&HLOOKUP(Sheet1!R2C1,Sheet1!R2C1:R16C1,MOD(RC1+3,2)+MOD(INT((RC1+3)/2),3)*5+1,FALSE)&"|"&HLOOKUP(Sheet1!R2C1,Sheet1!R2C1:R16C1,MOD(RC1+4,2)+MOD(INT((RC1+4)/2),3)*5+1,FALSE)&"|"&HLOOKUP(Sheet1!R2C1,Sheet1!R2C1:R16C1,MOD(RC1+5,2)+MOD(INT((RC1+5)/2),3)*5+1,FALSE)&"|"&HLOOKUP(Sheet1!R2C1,Sheet1!R2C1:R16C1,MOD(RC1+6,2)+MOD(INT((RC1+6)/2),3)*5+1,FALSE) -> 100|101|130|131|160 | I52: =HLOOKUP(Sheet1!R2C1,Sheet1!R2C1:R16C1,MOD(RC1-1,3)+MOD(INT((RC1-1)/3),3)*5+3,FALSE)&"|"&HLOOKUP(Sheet1!R2C1,Sheet1!R2C1:R16C1,MOD(RC1,3)+MOD(INT((RC1)/3),3)*5+3,FALSE)&"|"&HLOOKUP(Sheet1!R2C1,Sheet1!R2C1:R16C1,MOD(RC1+1,3)+MOD(INT((RC1+1)/3),3)*5+3,FALSE)&"|"&HLOOKUP(Sheet1!R2C1,Sheet1!R2C1:R16C1,MOD(RC1+2,3)+MOD(INT((RC1+2)/3),3)*5+3,FALSE)&"|"&HLOOKUP(Sheet1!R2C1,Sheet1!R2C1:R16C1,MOD(RC1+3,3)+MOD(INT((RC1+3)/3),3)*5+3,FALSE) -> 102|103|104|132|133 | J52: =HLOOKUP(Sheet1!R2C1,Sheet1!R2C1:R16C1,MOD(RC1-1,3)+MOD(INT((RC1-1)/3),3)*5+3,FALSE)&"|"&HLOOKUP(Sheet1!R2C1,Sheet1!R2C1:R16C1,MOD(RC1,3)+MOD(INT((RC1)/3),3)*5+3,FALSE)&"|"&HLOOKUP(Sheet1!R2C1,Sheet1!R2C1:R16C1,MOD(RC1+1,3)+MOD(INT((RC1+1)/3),3)*5+3,FALSE)&"|"&HLOOKUP(Sheet1!R2C1,Sheet1!R2C1:R16C1,MOD(RC1+2,3)+MOD(INT((RC1+2)/3),3)*5+3,FALSE)&"|"&HLOOKUP(Sheet1!R2C1,Sheet1!R2C1:R16C1,MOD(RC1+3,3)+MOD(INT((RC1+3)/3),3)*5+3,FALSE) -> 102|103|104|132|133 | K52: =HLOOKUP(Sheet1!R2C1,Sheet1!R2C1:R16C1,MOD(RC1-1,3)+MOD(INT((RC1-1)/3),3)*5+3,FALSE)&"|"&HLOOKUP(Sheet1!R2C1,Sheet1!R2C1:R16C1,MOD(RC1,3)+MOD(INT((RC1)/3),3)*5+3,FALSE)&"|"&HLOOKUP(Sheet1!R2C1,Sheet1!R2C1:R16C1,MOD(RC1+1,3)+MOD(INT((RC1+1)/3),3)*5+3,FALSE)&"|"&HLOOKUP(Sheet1!R2C1,Sheet1!R2C1:R16C1,MOD(RC1+2,3)+MOD(INT((RC1+2)/3),3)*5+3,FALSE)&"|"&HLOOKUP(Sheet1!R2C1,Sheet1!R2C1:R16C1,MOD(RC1+3,3)+MOD(INT((RC1+3)/3),3)*5+3,FALSE) -> 102|103|104|132|133 | L52: 25|22|23|24 | M52: 52259|52259|52260|52260 | N52: 10030|10031|10032|10033 | O52: 1|1|1|1 | P52: 2500|2500|2500|2500
A53: 47 | B53: 45 | C53: 30 | D53: =R[-20]C+2 -> 24 | E53: 1000 | F53: =MOD(RC[-5]-1,3)*30+100&"|"&MOD(RC[-5]-1,3)*30+101&"|"&MOD(RC[-5]-1,3)*30+102&"|"&MOD(RC[-5]-1,3)*30+103&"|"&IF(MOD(RC[-5],4)=0,HLOOKUP(Sheet1!R2C10,Sheet1!R2C10:R7C10,MOD(RC[-5]/4-1,6)+1,FALSE),IF(MOD(RC[-5],2)=0,IF(RC[-5]>20,HLOOKUP(Sheet1!R2C7,Sheet1!R2C7:R43C7,MOD(RC[-5]/2-1,42)+1,FALSE),HLOOKUP(Sheet1!R2C4,Sheet1!R2C4:R7C4,MOD(RC[-5]-1,6)+1,FALSE)),MOD(RC[-5]-1,3)*30+104)) -> 130|131|132|133|134 | G53: =HLOOKUP(Sheet1!R2C1,Sheet1!R2C1:R16C1,MOD(RC1-1,2)+MOD(INT((RC1-1)/2),3)*5+1,FALSE)&"|"&HLOOKUP(Sheet1!R2C1,Sheet1!R2C1:R16C1,MOD(RC1,2)+MOD(INT((RC1)/2),3)*5+1,FALSE)&"|"&HLOOKUP(Sheet1!R2C1,Sheet1!R2C1:R16C1,MOD(RC1+1,2)+MOD(INT((RC1+1)/2),3)*5+1,FALSE)&"|"&HLOOKUP(Sheet1!R2C1,Sheet1!R2C1:R16C1,MOD(RC1+2,2)+MOD(INT((RC1+2)/2),3)*5+1,FALSE)&"|"&HLOOKUP(Sheet1!R2C1,Sheet1!R2C1:R16C1,MOD(RC1+3,2)+MOD(INT((RC1+3)/2),3)*5+1,FALSE) -> 160|161|100|101|130 | H53: =HLOOKUP(Sheet1!R2C1,Sheet1!R2C1:R16C1,MOD(RC1+2,2)+MOD(INT((RC1+2)/2),3)*5+1,FALSE)&"|"&HLOOKUP(Sheet1!R2C1,Sheet1!R2C1:R16C1,MOD(RC1+3,2)+MOD(INT((RC1+3)/2),3)*5+1,FALSE)&"|"&HLOOKUP(Sheet1!R2C1,Sheet1!R2C1:R16C1,MOD(RC1+4,2)+MOD(INT((RC1+4)/2),3)*5+1,FALSE)&"|"&HLOOKUP(Sheet1!R2C1,Sheet1!R2C1:R16C1,MOD(RC1+5,2)+MOD(INT((RC1+5)/2),3)*5+1,FALSE)&"|"&HLOOKUP(Sheet1!R2C1,Sheet1!R2C1:R16C1,MOD(RC1+6,2)+MOD(INT((RC1+6)/2),3)*5+1,FALSE) -> 101|130|131|160|161 | I53: =HLOOKUP(Sheet1!R2C1,Sheet1!R2C1:R16C1,MOD(RC1-1,3)+MOD(INT((RC1-1)/3),3)*5+3,FALSE)&"|"&HLOOKUP(Sheet1!R2C1,Sheet1!R2C1:R16C1,MOD(RC1,3)+MOD(INT((RC1)/3),3)*5+3,FALSE)&"|"&HLOOKUP(Sheet1!R2C1,Sheet1!R2C1:R16C1,MOD(RC1+1,3)+MOD(INT((RC1+1)/3),3)*5+3,FALSE)&"|"&HLOOKUP(Sheet1!R2C1,Sheet1!R2C1:R16C1,MOD(RC1+2,3)+MOD(INT((RC1+2)/3),3)*5+3,FALSE)&"|"&HLOOKUP(Sheet1!R2C1,Sheet1!R2C1:R16C1,MOD(RC1+3,3)+MOD(INT((RC1+3)/3),3)*5+3,FALSE) -> 103|104|132|133|134 | J53: =HLOOKUP(Sheet1!R2C1,Sheet1!R2C1:R16C1,MOD(RC1-1,3)+MOD(INT((RC1-1)/3),3)*5+3,FALSE)&"|"&HLOOKUP(Sheet1!R2C1,Sheet1!R2C1:R16C1,MOD(RC1,3)+MOD(INT((RC1)/3),3)*5+3,FALSE)&"|"&HLOOKUP(Sheet1!R2C1,Sheet1!R2C1:R16C1,MOD(RC1+1,3)+MOD(INT((RC1+1)/3),3)*5+3,FALSE)&"|"&HLOOKUP(Sheet1!R2C1,Sheet1!R2C1:R16C1,MOD(RC1+2,3)+MOD(INT((RC1+2)/3),3)*5+3,FALSE)&"|"&HLOOKUP(Sheet1!R2C1,Sheet1!R2C1:R16C1,MOD(RC1+3,3)+MOD(INT((RC1+3)/3),3)*5+3,FALSE) -> 103|104|132|133|134 | K53: =HLOOKUP(Sheet1!R2C1,Sheet1!R2C1:R16C1,MOD(RC1-1,3)+MOD(INT((RC1-1)/3),3)*5+3,FALSE)&"|"&HLOOKUP(Sheet1!R2C1,Sheet1!R2C1:R16C1,MOD(RC1,3)+MOD(INT((RC1)/3),3)*5+3,FALSE)&"|"&HLOOKUP(Sheet1!R2C1,Sheet1!R2C1:R16C1,MOD(RC1+1,3)+MOD(INT((RC1+1)/3),3)*5+3,FALSE)&"|"&HLOOKUP(Sheet1!R2C1,Sheet1!R2C1:R16C1,MOD(RC1+2,3)+MOD(INT((RC1+2)/3),3)*5+3,FALSE)&"|"&HLOOKUP(Sheet1!R2C1,Sheet1!R2C1:R16C1,MOD(RC1+3,3)+MOD(INT((RC1+3)/3),3)*5+3,FALSE) -> 103|104|132|133|134 | L53: 25|22|23|24 | M53: 54806|54806|54808|54808 | N53: 10030|10031|10032|10033 | O53: 1|1|1|1 | P53: 2500|2500|2500|2500
A54: 48 | B54: 46 | C54: 30 | D54: =R[-20]C+2 -> 24 | E54: 1000 | F54: =MOD(RC[-5]-1,3)*30+100&"|"&MOD(RC[-5]-1,3)*30+101&"|"&MOD(RC[-5]-1,3)*30+102&"|"&MOD(RC[-5]-1,3)*30+103&"|"&IF(MOD(RC[-5],4)=0,HLOOKUP(Sheet1!R2C10,Sheet1!R2C10:R7C10,MOD(RC[-5]/4-1,6)+1,FALSE),IF(MOD(RC[-5],2)=0,IF(RC[-5]>20,HLOOKUP(Sheet1!R2C7,Sheet1!R2C7:R43C7,MOD(RC[-5]/2-1,42)+1,FALSE),HLOOKUP(Sheet1!R2C4,Sheet1!R2C4:R7C4,MOD(RC[-5]-1,6)+1,FALSE)),MOD(RC[-5]-1,3)*30+104)) -> 160|161|162|163|195 | G54: =HLOOKUP(Sheet1!R2C1,Sheet1!R2C1:R16C1,MOD(RC1-1,2)+MOD(INT((RC1-1)/2),3)*5+1,FALSE)&"|"&HLOOKUP(Sheet1!R2C1,Sheet1!R2C1:R16C1,MOD(RC1,2)+MOD(INT((RC1)/2),3)*5+1,FALSE)&"|"&HLOOKUP(Sheet1!R2C1,Sheet1!R2C1:R16C1,MOD(RC1+1,2)+MOD(INT((RC1+1)/2),3)*5+1,FALSE)&"|"&HLOOKUP(Sheet1!R2C1,Sheet1!R2C1:R16C1,MOD(RC1+2,2)+MOD(INT((RC1+2)/2),3)*5+1,FALSE)&"|"&HLOOKUP(Sheet1!R2C1,Sheet1!R2C1:R16C1,MOD(RC1+3,2)+MOD(INT((RC1+3)/2),3)*5+1,FALSE) -> 161|100|101|130|131 | H54: =HLOOKUP(Sheet1!R2C1,Sheet1!R2C1:R16C1,MOD(RC1+2,2)+MOD(INT((RC1+2)/2),3)*5+1,FALSE)&"|"&HLOOKUP(Sheet1!R2C1,Sheet1!R2C1:R16C1,MOD(RC1+3,2)+MOD(INT((RC1+3)/2),3)*5+1,FALSE)&"|"&HLOOKUP(Sheet1!R2C1,Sheet1!R2C1:R16C1,MOD(RC1+4,2)+MOD(INT((RC1+4)/2),3)*5+1,FALSE)&"|"&HLOOKUP(Sheet1!R2C1,Sheet1!R2C1:R16C1,MOD(RC1+5,2)+MOD(INT((RC1+5)/2),3)*5+1,FALSE)&"|"&HLOOKUP(Sheet1!R2C1,Sheet1!R2C1:R16C1,MOD(RC1+6,2)+MOD(INT((RC1+6)/2),3)*5+1,FALSE) -> 130|131|160|161|100 | I54: =HLOOKUP(Sheet1!R2C1,Sheet1!R2C1:R16C1,MOD(RC1-1,3)+MOD(INT((RC1-1)/3),3)*5+3,FALSE)&"|"&HLOOKUP(Sheet1!R2C1,Sheet1!R2C1:R16C1,MOD(RC1,3)+MOD(INT((RC1)/3),3)*5+3,FALSE)&"|"&HLOOKUP(Sheet1!R2C1,Sheet1!R2C1:R16C1,MOD(RC1+1,3)+MOD(INT((RC1+1)/3),3)*5+3,FALSE)&"|"&HLOOKUP(Sheet1!R2C1,Sheet1!R2C1:R16C1,MOD(RC1+2,3)+MOD(INT((RC1+2)/3),3)*5+3,FALSE)&"|"&HLOOKUP(Sheet1!R2C1,Sheet1!R2C1:R16C1,MOD(RC1+3,3)+MOD(INT((RC1+3)/3),3)*5+3,FALSE) -> 104|132|133|134|162 | J54: =HLOOKUP(Sheet1!R2C1,Sheet1!R2C1:R16C1,MOD(RC1-1,3)+MOD(INT((RC1-1)/3),3)*5+3,FALSE)&"|"&HLOOKUP(Sheet1!R2C1,Sheet1!R2C1:R16C1,MOD(RC1,3)+MOD(INT((RC1)/3),3)*5+3,FALSE)&"|"&HLOOKUP(Sheet1!R2C1,Sheet1!R2C1:R16C1,MOD(RC1+1,3)+MOD(INT((RC1+1)/3),3)*5+3,FALSE)&"|"&HLOOKUP(Sheet1!R2C1,Sheet1!R2C1:R16C1,MOD(RC1+2,3)+MOD(INT((RC1+2)/3),3)*5+3,FALSE)&"|"&HLOOKUP(Sheet1!R2C1,Sheet1!R2C1:R16C1,MOD(RC1+3,3)+MOD(INT((RC1+3)/3),3)*5+3,FALSE) -> 104|132|133|134|162 | K54: =HLOOKUP(Sheet1!R2C1,Sheet1!R2C1:R16C1,MOD(RC1-1,3)+MOD(INT((RC1-1)/3),3)*5+3,FALSE)&"|"&HLOOKUP(Sheet1!R2C1,Sheet1!R2C1:R16C1,MOD(RC1,3)+MOD(INT((RC1)/3),3)*5+3,FALSE)&"|"&HLOOKUP(Sheet1!R2C1,Sheet1!R2C1:R16C1,MOD(RC1+1,3)+MOD(INT((RC1+1)/3),3)*5+3,FALSE)&"|"&HLOOKUP(Sheet1!R2C1,Sheet1!R2C1:R16C1,MOD(RC1+2,3)+MOD(INT((RC1+2)/3),3)*5+3,FALSE)&"|"&HLOOKUP(Sheet1!R2C1,Sheet1!R2C1:R16C1,MOD(RC1+3,3)+MOD(INT((RC1+3)/3),3)*5+3,FALSE) -> 104|132|133|134|162 | L54: 25|22|23|24 | M54: 57489|57489|57490|57490 | N54: 10030|10031|10032|10033 | O54: 1|1|1|1 | P54: 2500|2500|2500|2500
A55: 49 | B55: 47 | C55: 30 | D55: =R[-20]C+2 -> 24 | E55: 1000 | F55: =MOD(RC[-5]-1,3)*30+100&"|"&MOD(RC[-5]-1,3)*30+101&"|"&MOD(RC[-5]-1,3)*30+102&"|"&MOD(RC[-5]-1,3)*30+103&"|"&IF(MOD(RC[-5],4)=0,HLOOKUP(Sheet1!R2C10,Sheet1!R2C10:R7C10,MOD(RC[-5]/4-1,6)+1,FALSE),IF(MOD(RC[-5],2)=0,IF(RC[-5]>20,HLOOKUP(Sheet1!R2C7,Sheet1!R2C7:R43C7,MOD(RC[-5]/2-1,42)+1,FALSE),HLOOKUP(Sheet1!R2C4,Sheet1!R2C4:R7C4,MOD(RC[-5]-1,6)+1,FALSE)),MOD(RC[-5]-1,3)*30+104)) -> 100|101|102|103|104 | G55: =HLOOKUP(Sheet1!R2C1,Sheet1!R2C1:R16C1,MOD(RC1-1,2)+MOD(INT((RC1-1)/2),3)*5+1,FALSE)&"|"&HLOOKUP(Sheet1!R2C1,Sheet1!R2C1:R16C1,MOD(RC1,2)+MOD(INT((RC1)/2),3)*5+1,FALSE)&"|"&HLOOKUP(Sheet1!R2C1,Sheet1!R2C1:R16C1,MOD(RC1+1,2)+MOD(INT((RC1+1)/2),3)*5+1,FALSE)&"|"&HLOOKUP(Sheet1!R2C1,Sheet1!R2C1:R16C1,MOD(RC1+2,2)+MOD(INT((RC1+2)/2),3)*5+1,FALSE)&"|"&HLOOKUP(Sheet1!R2C1,Sheet1!R2C1:R16C1,MOD(RC1+3,2)+MOD(INT((RC1+3)/2),3)*5+1,FALSE) -> 100|101|130|131|160 | H55: =HLOOKUP(Sheet1!R2C1,Sheet1!R2C1:R16C1,MOD(RC1+2,2)+MOD(INT((RC1+2)/2),3)*5+1,FALSE)&"|"&HLOOKUP(Sheet1!R2C1,Sheet1!R2C1:R16C1,MOD(RC1+3,2)+MOD(INT((RC1+3)/2),3)*5+1,FALSE)&"|"&HLOOKUP(Sheet1!R2C1,Sheet1!R2C1:R16C1,MOD(RC1+4,2)+MOD(INT((RC1+4)/2),3)*5+1,FALSE)&"|"&HLOOKUP(Sheet1!R2C1,Sheet1!R2C1:R16C1,MOD(RC1+5,2)+MOD(INT((RC1+5)/2),3)*5+1,FALSE)&"|"&HLOOKUP(Sheet1!R2C1,Sheet1!R2C1:R16C1,MOD(RC1+6,2)+MOD(INT((RC1+6)/2),3)*5+1,FALSE) -> 131|160|161|100|101 | I55: =HLOOKUP(Sheet1!R2C1,Sheet1!R2C1:R16C1,MOD(RC1-1,3)+MOD(INT((RC1-1)/3),3)*5+3,FALSE)&"|"&HLOOKUP(Sheet1!R2C1,Sheet1!R2C1:R16C1,MOD(RC1,3)+MOD(INT((RC1)/3),3)*5+3,FALSE)&"|"&HLOOKUP(Sheet1!R2C1,Sheet1!R2C1:R16C1,MOD(RC1+1,3)+MOD(INT((RC1+1)/3),3)*5+3,FALSE)&"|"&HLOOKUP(Sheet1!R2C1,Sheet1!R2C1:R16C1,MOD(RC1+2,3)+MOD(INT((RC1+2)/3),3)*5+3,FALSE)&"|"&HLOOKUP(Sheet1!R2C1,Sheet1!R2C1:R16C1,MOD(RC1+3,3)+MOD(INT((RC1+3)/3),3)*5+3,FALSE) -> 132|133|134|162|163 | J55: =HLOOKUP(Sheet1!R2C1,Sheet1!R2C1:R16C1,MOD(RC1-1,3)+MOD(INT((RC1-1)/3),3)*5+3,FALSE)&"|"&HLOOKUP(Sheet1!R2C1,Sheet1!R2C1:R16C1,MOD(RC1,3)+MOD(INT((RC1)/3),3)*5+3,FALSE)&"|"&HLOOKUP(Sheet1!R2C1,Sheet1!R2C1:R16C1,MOD(RC1+1,3)+MOD(INT((RC1+1)/3),3)*5+3,FALSE)&"|"&HLOOKUP(Sheet1!R2C1,Sheet1!R2C1:R16C1,MOD(RC1+2,3)+MOD(INT((RC1+2)/3),3)*5+3,FALSE)&"|"&HLOOKUP(Sheet1!R2C1,Sheet1!R2C1:R16C1,MOD(RC1+3,3)+MOD(INT((RC1+3)/3),3)*5+3,FALSE) -> 132|133|134|162|163 | K55: =HLOOKUP(Sheet1!R2C1,Sheet1!R2C1:R16C1,MOD(RC1-1,3)+MOD(INT((RC1-1)/3),3)*5+3,FALSE)&"|"&HLOOKUP(Sheet1!R2C1,Sheet1!R2C1:R16C1,MOD(RC1,3)+MOD(INT((RC1)/3),3)*5+3,FALSE)&"|"&HLOOKUP(Sheet1!R2C1,Sheet1!R2C1:R16C1,MOD(RC1+1,3)+MOD(INT((RC1+1)/3),3)*5+3,FALSE)&"|"&HLOOKUP(Sheet1!R2C1,Sheet1!R2C1:R16C1,MOD(RC1+2,3)+MOD(INT((RC1+2)/3),3)*5+3,FALSE)&"|"&HLOOKUP(Sheet1!R2C1,Sheet1!R2C1:R16C1,MOD(RC1+3,3)+MOD(INT((RC1+3)/3),3)*5+3,FALSE) -> 132|133|134|162|163 | L55: 25|22|23|24 | M55: 60421|60421|60420|60420 | N55: 10030|10031|10032|10033 | O55: 1|1|1|1 | P55: 2500|2500|2500|2500
A56: 50 | B56: 48 | C56: 30 | D56: =R[-20]C+2 -> 24 | E56: 1000 | F56: =MOD(RC[-5]-1,3)*30+100&"|"&MOD(RC[-5]-1,3)*30+101&"|"&MOD(RC[-5]-1,3)*30+102&"|"&MOD(RC[-5]-1,3)*30+103&"|"&IF(MOD(RC[-5],4)=0,HLOOKUP(Sheet1!R2C10,Sheet1!R2C10:R7C10,MOD(RC[-5]/4-1,6)+1,FALSE),IF(MOD(RC[-5],2)=0,IF(RC[-5]>20,HLOOKUP(Sheet1!R2C7,Sheet1!R2C7:R43C7,MOD(RC[-5]/2-1,42)+1,FALSE),HLOOKUP(Sheet1!R2C4,Sheet1!R2C4:R7C4,MOD(RC[-5]-1,6)+1,FALSE)),MOD(RC[-5]-1,3)*30+104)) -> 130|131|132|133|152 | G56: =HLOOKUP(Sheet1!R2C1,Sheet1!R2C1:R16C1,MOD(RC1-1,2)+MOD(INT((RC1-1)/2),3)*5+1,FALSE)&"|"&HLOOKUP(Sheet1!R2C1,Sheet1!R2C1:R16C1,MOD(RC1,2)+MOD(INT((RC1)/2),3)*5+1,FALSE)&"|"&HLOOKUP(Sheet1!R2C1,Sheet1!R2C1:R16C1,MOD(RC1+1,2)+MOD(INT((RC1+1)/2),3)*5+1,FALSE)&"|"&HLOOKUP(Sheet1!R2C1,Sheet1!R2C1:R16C1,MOD(RC1+2,2)+MOD(INT((RC1+2)/2),3)*5+1,FALSE)&"|"&HLOOKUP(Sheet1!R2C1,Sheet1!R2C1:R16C1,MOD(RC1+3,2)+MOD(INT((RC1+3)/2),3)*5+1,FALSE) -> 101|130|131|160|161 | H56: =HLOOKUP(Sheet1!R2C1,Sheet1!R2C1:R16C1,MOD(RC1+2,2)+MOD(INT((RC1+2)/2),3)*5+1,FALSE)&"|"&HLOOKUP(Sheet1!R2C1,Sheet1!R2C1:R16C1,MOD(RC1+3,2)+MOD(INT((RC1+3)/2),3)*5+1,FALSE)&"|"&HLOOKUP(Sheet1!R2C1,Sheet1!R2C1:R16C1,MOD(RC1+4,2)+MOD(INT((RC1+4)/2),3)*5+1,FALSE)&"|"&HLOOKUP(Sheet1!R2C1,Sheet1!R2C1:R16C1,MOD(RC1+5,2)+MOD(INT((RC1+5)/2),3)*5+1,FALSE)&"|"&HLOOKUP(Sheet1!R2C1,Sheet1!R2C1:R16C1,MOD(RC1+6,2)+MOD(INT((RC1+6)/2),3)*5+1,FALSE) -> 160|161|100|101|130 | I56: =HLOOKUP(Sheet1!R2C1,Sheet1!R2C1:R16C1,MOD(RC1-1,3)+MOD(INT((RC1-1)/3),3)*5+3,FALSE)&"|"&HLOOKUP(Sheet1!R2C1,Sheet1!R2C1:R16C1,MOD(RC1,3)+MOD(INT((RC1)/3),3)*5+3,FALSE)&"|"&HLOOKUP(Sheet1!R2C1,Sheet1!R2C1:R16C1,MOD(RC1+1,3)+MOD(INT((RC1+1)/3),3)*5+3,FALSE)&"|"&HLOOKUP(Sheet1!R2C1,Sheet1!R2C1:R16C1,MOD(RC1+2,3)+MOD(INT((RC1+2)/3),3)*5+3,FALSE)&"|"&HLOOKUP(Sheet1!R2C1,Sheet1!R2C1:R16C1,MOD(RC1+3,3)+MOD(INT((RC1+3)/3),3)*5+3,FALSE) -> 133|134|162|163|164 | J56: =HLOOKUP(Sheet1!R2C1,Sheet1!R2C1:R16C1,MOD(RC1-1,3)+MOD(INT((RC1-1)/3),3)*5+3,FALSE)&"|"&HLOOKUP(Sheet1!R2C1,Sheet1!R2C1:R16C1,MOD(RC1,3)+MOD(INT((RC1)/3),3)*5+3,FALSE)&"|"&HLOOKUP(Sheet1!R2C1,Sheet1!R2C1:R16C1,MOD(RC1+1,3)+MOD(INT((RC1+1)/3),3)*5+3,FALSE)&"|"&HLOOKUP(Sheet1!R2C1,Sheet1!R2C1:R16C1,MOD(RC1+2,3)+MOD(INT((RC1+2)/3),3)*5+3,FALSE)&"|"&HLOOKUP(Sheet1!R2C1,Sheet1!R2C1:R16C1,MOD(RC1+3,3)+MOD(INT((RC1+3)/3),3)*5+3,FALSE) -> 133|134|162|163|164 | K56: =HLOOKUP(Sheet1!R2C1,Sheet1!R2C1:R16C1,MOD(RC1-1,3)+MOD(INT((RC1-1)/3),3)*5+3,FALSE)&"|"&HLOOKUP(Sheet1!R2C1,Sheet1!R2C1:R16C1,MOD(RC1,3)+MOD(INT((RC1)/3),3)*5+3,FALSE)&"|"&HLOOKUP(Sheet1!R2C1,Sheet1!R2C1:R16C1,MOD(RC1+1,3)+MOD(INT((RC1+1)/3),3)*5+3,FALSE)&"|"&HLOOKUP(Sheet1!R2C1,Sheet1!R2C1:R16C1,MOD(RC1+2,3)+MOD(INT((RC1+2)/3),3)*5+3,FALSE)&"|"&HLOOKUP(Sheet1!R2C1,Sheet1!R2C1:R16C1,MOD(RC1+3,3)+MOD(INT((RC1+3)/3),3)*5+3,FALSE) -> 133|134|162|163|164 | L56: 25|22|23|24 | M56: 63353|63353|63353|63353 | N56: 10030|10031|10032|10033|10030|10031|10032|10033|10030|10031|10032|10033|10030|10031|10032|10033|10030|10031|10032|10033|10030|10031|10032|10033|10030|10031|10032|10033|10030|10031|10032|10033|10030|10031|10032|10033|10030|10031|10032|10033 | O56: 1|1|1|1|1|1|1|1|1|1|1|1|1|1|1|1|1|1|1|1|1|1|1|1|1|1|1|1|1|1|1|1|1|1|1|1|1|1|1|1 | P56: 2500|2500|2500|2500|2500|2500|2500|2500|2500|2500|2500|2500|2500|2500|2500|2500|2500|2500|2500|2500|2500|2500|2500|2500|2500|2500|2500|2500|2500|2500|2500|2500|2500|2500|2500|2500|2500|2500|2500|2500
A57: 51 | B57: 49 | C57: 30 | D57: =R[-20]C+2 -> 24 | E57: 1000 | F57: =MOD(RC[-5]-1,3)*30+100&"|"&MOD(RC[-5]-1,3)*30+101&"|"&MOD(RC[-5]-1,3)*30+102&"|"&MOD(RC[-5]-1,3)*30+103&"|"&IF(MOD(RC[-5],4)=0,HLOOKUP(Sheet1!R2C10,Sheet1!R2C10:R7C10,MOD(RC[-5]/4-1,6)+1,FALSE),IF(MOD(RC[-5],2)=0,IF(RC[-5]>20,HLOOKUP(Sheet1!R2C7,Sheet1!R2C7:R43C7,MOD(RC[-5]/2-1,42)+1,FALSE),HLOOKUP(Sheet1!R2C4,Sheet1!R2C4:R7C4,MOD(RC[-5]-1,6)+1,FALSE)),MOD(RC[-5]-1,3)*30+104)) -> 160|161|162|163|164 | G57: =HLOOKUP(Sheet1!R2C1,Sheet1!R2C1:R16C1,MOD(RC1-1,2)+MOD(INT((RC1-1)/2),3)*5+1,FALSE)&"|"&HLOOKUP(Sheet1!R2C1,Sheet1!R2C1:R16C1,MOD(RC1,2)+MOD(INT((RC1)/2),3)*5+1,FALSE)&"|"&HLOOKUP(Sheet1!R2C1,Sheet1!R2C1:R16C1,MOD(RC1+1,2)+MOD(INT((RC1+1)/2),3)*5+1,FALSE)&"|"&HLOOKUP(Sheet1!R2C1,Sheet1!R2C1:R16C1,MOD(RC1+2,2)+MOD(INT((RC1+2)/2),3)*5+1,FALSE)&"|"&HLOOKUP(Sheet1!R2C1,Sheet1!R2C1:R16C1,MOD(RC1+3,2)+MOD(INT((RC1+3)/2),3)*5+1,FALSE) -> 130|131|160|161|100 | H57: =HLOOKUP(Sheet1!R2C1,Sheet1!R2C1:R16C1,MOD(RC1+2,2)+MOD(INT((RC1+2)/2),3)*5+1,FALSE)&"|"&HLOOKUP(Sheet1!R2C1,Sheet1!R2C1:R16C1,MOD(RC1+3,2)+MOD(INT((RC1+3)/2),3)*5+1,FALSE)&"|"&HLOOKUP(Sheet1!R2C1,Sheet1!R2C1:R16C1,MOD(RC1+4,2)+MOD(INT((RC1+4)/2),3)*5+1,FALSE)&"|"&HLOOKUP(Sheet1!R2C1,Sheet1!R2C1:R16C1,MOD(RC1+5,2)+MOD(INT((RC1+5)/2),3)*5+1,FALSE)&"|"&HLOOKUP(Sheet1!R2C1,Sheet1!R2C1:R16C1,MOD(RC1+6,2)+MOD(INT((RC1+6)/2),3)*5+1,FALSE) -> 161|100|101|130|131 | I57: =HLOOKUP(Sheet1!R2C1,Sheet1!R2C1:R16C1,MOD(RC1-1,3)+MOD(INT((RC1-1)/3),3)*5+3,FALSE)&"|"&HLOOKUP(Sheet1!R2C1,Sheet1!R2C1:R16C1,MOD(RC1,3)+MOD(INT((RC1)/3),3)*5+3,FALSE)&"|"&HLOOKUP(Sheet1!R2C1,Sheet1!R2C1:R16C1,MOD(RC1+1,3)+MOD(INT((RC1+1)/3),3)*5+3,FALSE)&"|"&HLOOKUP(Sheet1!R2C1,Sheet1!R2C1:R16C1,MOD(RC1+2,3)+MOD(INT((RC1+2)/3),3)*5+3,FALSE)&"|"&HLOOKUP(Sheet1!R2C1,Sheet1!R2C1:R16C1,MOD(RC1+3,3)+MOD(INT((RC1+3)/3),3)*5+3,FALSE) -> 134|162|163|164|102 | J57: =HLOOKUP(Sheet1!R2C1,Sheet1!R2C1:R16C1,MOD(RC1-1,3)+MOD(INT((RC1-1)/3),3)*5+3,FALSE)&"|"&HLOOKUP(Sheet1!R2C1,Sheet1!R2C1:R16C1,MOD(RC1,3)+MOD(INT((RC1)/3),3)*5+3,FALSE)&"|"&HLOOKUP(Sheet1!R2C1,Sheet1!R2C1:R16C1,MOD(RC1+1,3)+MOD(INT((RC1+1)/3),3)*5+3,FALSE)&"|"&HLOOKUP(Sheet1!R2C1,Sheet1!R2C1:R16C1,MOD(RC1+2,3)+MOD(INT((RC1+2)/3),3)*5+3,FALSE)&"|"&HLOOKUP(Sheet1!R2C1,Sheet1!R2C1:R16C1,MOD(RC1+3,3)+MOD(INT((RC1+3)/3),3)*5+3,FALSE) -> 134|162|163|164|102 | K57: =HLOOKUP(Sheet1!R2C1,Sheet1!R2C1:R16C1,MOD(RC1-1,3)+MOD(INT((RC1-1)/3),3)*5+3,FALSE)&"|"&HLOOKUP(Sheet1!R2C1,Sheet1!R2C1:R16C1,MOD(RC1,3)+MOD(INT((RC1)/3),3)*5+3,FALSE)&"|"&HLOOKUP(Sheet1!R2C1,Sheet1!R2C1:R16C1,MOD(RC1+1,3)+MOD(INT((RC1+1)/3),3)*5+3,FALSE)&"|"&HLOOKUP(Sheet1!R2C1,Sheet1!R2C1:R16C1,MOD(RC1+2,3)+MOD(INT((RC1+2)/3),3)*5+3,FALSE)&"|"&HLOOKUP(Sheet1!R2C1,Sheet1!R2C1:R16C1,MOD(RC1+3,3)+MOD(INT((RC1+3)/3),3)*5+3,FALSE) -> 134|162|163|164|102 | L57: 25|22|23|24 | M57: 66211|66211|66210|66210 | N57: 10030|10031|10032|10033 | O57: 1|1|1|1 | P57: 2500|2500|2500|2500
A58: 52 | B58: 50 | C58: 30 | D58: =R[-20]C+2 -> 24 | E58: 1000 | F58: =MOD(RC[-5]-1,3)*30+100&"|"&MOD(RC[-5]-1,3)*30+101&"|"&MOD(RC[-5]-1,3)*30+102&"|"&MOD(RC[-5]-1,3)*30+103&"|"&IF(MOD(RC[-5],4)=0,HLOOKUP(Sheet1!R2C10,Sheet1!R2C10:R7C10,MOD(RC[-5]/4-1,6)+1,FALSE),IF(MOD(RC[-5],2)=0,IF(RC[-5]>20,HLOOKUP(Sheet1!R2C7,Sheet1!R2C7:R43C7,MOD(RC[-5]/2-1,42)+1,FALSE),HLOOKUP(Sheet1!R2C4,Sheet1!R2C4:R7C4,MOD(RC[-5]-1,6)+1,FALSE)),MOD(RC[-5]-1,3)*30+104)) -> 100|101|102|103|190 | G58: =HLOOKUP(Sheet1!R2C1,Sheet1!R2C1:R16C1,MOD(RC1-1,2)+MOD(INT((RC1-1)/2),3)*5+1,FALSE)&"|"&HLOOKUP(Sheet1!R2C1,Sheet1!R2C1:R16C1,MOD(RC1,2)+MOD(INT((RC1)/2),3)*5+1,FALSE)&"|"&HLOOKUP(Sheet1!R2C1,Sheet1!R2C1:R16C1,MOD(RC1+1,2)+MOD(INT((RC1+1)/2),3)*5+1,FALSE)&"|"&HLOOKUP(Sheet1!R2C1,Sheet1!R2C1:R16C1,MOD(RC1+2,2)+MOD(INT((RC1+2)/2),3)*5+1,FALSE)&"|"&HLOOKUP(Sheet1!R2C1,Sheet1!R2C1:R16C1,MOD(RC1+3,2)+MOD(INT((RC1+3)/2),3)*5+1,FALSE) -> 131|160|161|100|101 | H58: =HLOOKUP(Sheet1!R2C1,Sheet1!R2C1:R16C1,MOD(RC1+2,2)+MOD(INT((RC1+2)/2),3)*5+1,FALSE)&"|"&HLOOKUP(Sheet1!R2C1,Sheet1!R2C1:R16C1,MOD(RC1+3,2)+MOD(INT((RC1+3)/2),3)*5+1,FALSE)&"|"&HLOOKUP(Sheet1!R2C1,Sheet1!R2C1:R16C1,MOD(RC1+4,2)+MOD(INT((RC1+4)/2),3)*5+1,FALSE)&"|"&HLOOKUP(Sheet1!R2C1,Sheet1!R2C1:R16C1,MOD(RC1+5,2)+MOD(INT((RC1+5)/2),3)*5+1,FALSE)&"|"&HLOOKUP(Sheet1!R2C1,Sheet1!R2C1:R16C1,MOD(RC1+6,2)+MOD(INT((RC1+6)/2),3)*5+1,FALSE) -> 100|101|130|131|160 | I58: =HLOOKUP(Sheet1!R2C1,Sheet1!R2C1:R16C1,MOD(RC1-1,3)+MOD(INT((RC1-1)/3),3)*5+3,FALSE)&"|"&HLOOKUP(Sheet1!R2C1,Sheet1!R2C1:R16C1,MOD(RC1,3)+MOD(INT((RC1)/3),3)*5+3,FALSE)&"|"&HLOOKUP(Sheet1!R2C1,Sheet1!R2C1:R16C1,MOD(RC1+1,3)+MOD(INT((RC1+1)/3),3)*5+3,FALSE)&"|"&HLOOKUP(Sheet1!R2C1,Sheet1!R2C1:R16C1,MOD(RC1+2,3)+MOD(INT((RC1+2)/3),3)*5+3,FALSE)&"|"&HLOOKUP(Sheet1!R2C1,Sheet1!R2C1:R16C1,MOD(RC1+3,3)+MOD(INT((RC1+3)/3),3)*5+3,FALSE) -> 162|163|164|102|103 | J58: =HLOOKUP(Sheet1!R2C1,Sheet1!R2C1:R16C1,MOD(RC1-1,3)+MOD(INT((RC1-1)/3),3)*5+3,FALSE)&"|"&HLOOKUP(Sheet1!R2C1,Sheet1!R2C1:R16C1,MOD(RC1,3)+MOD(INT((RC1)/3),3)*5+3,FALSE)&"|"&HLOOKUP(Sheet1!R2C1,Sheet1!R2C1:R16C1,MOD(RC1+1,3)+MOD(INT((RC1+1)/3),3)*5+3,FALSE)&"|"&HLOOKUP(Sheet1!R2C1,Sheet1!R2C1:R16C1,MOD(RC1+2,3)+MOD(INT((RC1+2)/3),3)*5+3,FALSE)&"|"&HLOOKUP(Sheet1!R2C1,Sheet1!R2C1:R16C1,MOD(RC1+3,3)+MOD(INT((RC1+3)/3),3)*5+3,FALSE) -> 162|163|164|102|103 | K58: =HLOOKUP(Sheet1!R2C1,Sheet1!R2C1:R16C1,MOD(RC1-1,3)+MOD(INT((RC1-1)/3),3)*5+3,FALSE)&"|"&HLOOKUP(Sheet1!R2C1,Sheet1!R2C1:R16C1,MOD(RC1,3)+MOD(INT((RC1)/3),3)*5+3,FALSE)&"|"&HLOOKUP(Sheet1!R2C1,Sheet1!R2C1:R16C1,MOD(RC1+1,3)+MOD(INT((RC1+1)/3),3)*5+3,FALSE)&"|"&HLOOKUP(Sheet1!R2C1,Sheet1!R2C1:R16C1,MOD(RC1+2,3)+MOD(INT((RC1+2)/3),3)*5+3,FALSE)&"|"&HLOOKUP(Sheet1!R2C1,Sheet1!R2C1:R16C1,MOD(RC1+3,3)+MOD(INT((RC1+3)/3),3)*5+3,FALSE) -> 162|163|164|102|103 | L58: 25|22|23|24 | M58: 69072|69071|69073|69073 | N58: 10030|10031|10032|10033 | O58: 1|1|1|1 | P58: 2500|2500|2500|2500
A59: 53 | B59: 51 | C59: 30 | D59: =R[-20]C+2 -> 24 | E59: 1000 | F59: =MOD(RC[-5]-1,3)*30+100&"|"&MOD(RC[-5]-1,3)*30+101&"|"&MOD(RC[-5]-1,3)*30+102&"|"&MOD(RC[-5]-1,3)*30+103&"|"&IF(MOD(RC[-5],4)=0,HLOOKUP(Sheet1!R2C10,Sheet1!R2C10:R7C10,MOD(RC[-5]/4-1,6)+1,FALSE),IF(MOD(RC[-5],2)=0,IF(RC[-5]>20,HLOOKUP(Sheet1!R2C7,Sheet1!R2C7:R43C7,MOD(RC[-5]/2-1,42)+1,FALSE),HLOOKUP(Sheet1!R2C4,Sheet1!R2C4:R7C4,MOD(RC[-5]-1,6)+1,FALSE)),MOD(RC[-5]-1,3)*30+104)) -> 130|131|132|133|134 | G59: =HLOOKUP(Sheet1!R2C1,Sheet1!R2C1:R16C1,MOD(RC1-1,2)+MOD(INT((RC1-1)/2),3)*5+1,FALSE)&"|"&HLOOKUP(Sheet1!R2C1,Sheet1!R2C1:R16C1,MOD(RC1,2)+MOD(INT((RC1)/2),3)*5+1,FALSE)&"|"&HLOOKUP(Sheet1!R2C1,Sheet1!R2C1:R16C1,MOD(RC1+1,2)+MOD(INT((RC1+1)/2),3)*5+1,FALSE)&"|"&HLOOKUP(Sheet1!R2C1,Sheet1!R2C1:R16C1,MOD(RC1+2,2)+MOD(INT((RC1+2)/2),3)*5+1,FALSE)&"|"&HLOOKUP(Sheet1!R2C1,Sheet1!R2C1:R16C1,MOD(RC1+3,2)+MOD(INT((RC1+3)/2),3)*5+1,FALSE) -> 160|161|100|101|130 | H59: =HLOOKUP(Sheet1!R2C1,Sheet1!R2C1:R16C1,MOD(RC1+2,2)+MOD(INT((RC1+2)/2),3)*5+1,FALSE)&"|"&HLOOKUP(Sheet1!R2C1,Sheet1!R2C1:R16C1,MOD(RC1+3,2)+MOD(INT((RC1+3)/2),3)*5+1,FALSE)&"|"&HLOOKUP(Sheet1!R2C1,Sheet1!R2C1:R16C1,MOD(RC1+4,2)+MOD(INT((RC1+4)/2),3)*5+1,FALSE)&"|"&HLOOKUP(Sheet1!R2C1,Sheet1!R2C1:R16C1,MOD(RC1+5,2)+MOD(INT((RC1+5)/2),3)*5+1,FALSE)&"|"&HLOOKUP(Sheet1!R2C1,Sheet1!R2C1:R16C1,MOD(RC1+6,2)+MOD(INT((RC1+6)/2),3)*5+1,FALSE) -> 101|130|131|160|161 | I59: =HLOOKUP(Sheet1!R2C1,Sheet1!R2C1:R16C1,MOD(RC1-1,3)+MOD(INT((RC1-1)/3),3)*5+3,FALSE)&"|"&HLOOKUP(Sheet1!R2C1,Sheet1!R2C1:R16C1,MOD(RC1,3)+MOD(INT((RC1)/3),3)*5+3,FALSE)&"|"&HLOOKUP(Sheet1!R2C1,Sheet1!R2C1:R16C1,MOD(RC1+1,3)+MOD(INT((RC1+1)/3),3)*5+3,FALSE)&"|"&HLOOKUP(Sheet1!R2C1,Sheet1!R2C1:R16C1,MOD(RC1+2,3)+MOD(INT((RC1+2)/3),3)*5+3,FALSE)&"|"&HLOOKUP(Sheet1!R2C1,Sheet1!R2C1:R16C1,MOD(RC1+3,3)+MOD(INT((RC1+3)/3),3)*5+3,FALSE) -> 163|164|102|103|104 | J59: =HLOOKUP(Sheet1!R2C1,Sheet1!R2C1:R16C1,MOD(RC1-1,3)+MOD(INT((RC1-1)/3),3)*5+3,FALSE)&"|"&HLOOKUP(Sheet1!R2C1,Sheet1!R2C1:R16C1,MOD(RC1,3)+MOD(INT((RC1)/3),3)*5+3,FALSE)&"|"&HLOOKUP(Sheet1!R2C1,Sheet1!R2C1:R16C1,MOD(RC1+1,3)+MOD(INT((RC1+1)/3),3)*5+3,FALSE)&"|"&HLOOKUP(Sheet1!R2C1,Sheet1!R2C1:R16C1,MOD(RC1+2,3)+MOD(INT((RC1+2)/3),3)*5+3,FALSE)&"|"&HLOOKUP(Sheet1!R2C1,Sheet1!R2C1:R16C1,MOD(RC1+3,3)+MOD(INT((RC1+3)/3),3)*5+3,FALSE) -> 163|164|102|103|104 | K59: =HLOOKUP(Sheet1!R2C1,Sheet1!R2C1:R16C1,MOD(RC1-1,3)+MOD(INT((RC1-1)/3),3)*5+3,FALSE)&"|"&HLOOKUP(Sheet1!R2C1,Sheet1!R2C1:R16C1,MOD(RC1,3)+MOD(INT((RC1)/3),3)*5+3,FALSE)&"|"&HLOOKUP(Sheet1!R2C1,Sheet1!R2C1:R16C1,MOD(RC1+1,3)+MOD(INT((RC1+1)/3),3)*5+3,FALSE)&"|"&HLOOKUP(Sheet1!R2C1,Sheet1!R2C1:R16C1,MOD(RC1+2,3)+MOD(INT((RC1+2)/3),3)*5+3,FALSE)&"|"&HLOOKUP(Sheet1!R2C1,Sheet1!R2C1:R16C1,MOD(RC1+3,3)+MOD(INT((RC1+3)/3),3)*5+3,FALSE) -> 163|164|102|103|104 | L59: 25|22|23|24 | M59: 72012|72013|72013|72013 | N59: 10030|10031|10032|10033 | O59: 1|1|1|1 | P59: 2500|2500|2500|2500
A60: 54 | B60: 52 | C60: 30 | D60: =R[-20]C+2 -> 24 | E60: 1000 | F60: =MOD(RC[-5]-1,3)*30+100&"|"&MOD(RC[-5]-1,3)*30+101&"|"&MOD(RC[-5]-1,3)*30+102&"|"&MOD(RC[-5]-1,3)*30+103&"|"&IF(MOD(RC[-5],4)=0,HLOOKUP(Sheet1!R2C10,Sheet1!R2C10:R7C10,MOD(RC[-5]/4-1,6)+1,FALSE),IF(MOD(RC[-5],2)=0,IF(RC[-5]>20,HLOOKUP(Sheet1!R2C7,Sheet1!R2C7:R43C7,MOD(RC[-5]/2-1,42)+1,FALSE),HLOOKUP(Sheet1!R2C4,Sheet1!R2C4:R7C4,MOD(RC[-5]-1,6)+1,FALSE)),MOD(RC[-5]-1,3)*30+104)) -> 160|161|162|163|154 | G60: =HLOOKUP(Sheet1!R2C1,Sheet1!R2C1:R16C1,MOD(RC1-1,2)+MOD(INT((RC1-1)/2),3)*5+1,FALSE)&"|"&HLOOKUP(Sheet1!R2C1,Sheet1!R2C1:R16C1,MOD(RC1,2)+MOD(INT((RC1)/2),3)*5+1,FALSE)&"|"&HLOOKUP(Sheet1!R2C1,Sheet1!R2C1:R16C1,MOD(RC1+1,2)+MOD(INT((RC1+1)/2),3)*5+1,FALSE)&"|"&HLOOKUP(Sheet1!R2C1,Sheet1!R2C1:R16C1,MOD(RC1+2,2)+MOD(INT((RC1+2)/2),3)*5+1,FALSE)&"|"&HLOOKUP(Sheet1!R2C1,Sheet1!R2C1:R16C1,MOD(RC1+3,2)+MOD(INT((RC1+3)/2),3)*5+1,FALSE) -> 161|100|101|130|131 | H60: =HLOOKUP(Sheet1!R2C1,Sheet1!R2C1:R16C1,MOD(RC1+2,2)+MOD(INT((RC1+2)/2),3)*5+1,FALSE)&"|"&HLOOKUP(Sheet1!R2C1,Sheet1!R2C1:R16C1,MOD(RC1+3,2)+MOD(INT((RC1+3)/2),3)*5+1,FALSE)&"|"&HLOOKUP(Sheet1!R2C1,Sheet1!R2C1:R16C1,MOD(RC1+4,2)+MOD(INT((RC1+4)/2),3)*5+1,FALSE)&"|"&HLOOKUP(Sheet1!R2C1,Sheet1!R2C1:R16C1,MOD(RC1+5,2)+MOD(INT((RC1+5)/2),3)*5+1,FALSE)&"|"&HLOOKUP(Sheet1!R2C1,Sheet1!R2C1:R16C1,MOD(RC1+6,2)+MOD(INT((RC1+6)/2),3)*5+1,FALSE) -> 130|131|160|161|100 | I60: =HLOOKUP(Sheet1!R2C1,Sheet1!R2C1:R16C1,MOD(RC1-1,3)+MOD(INT((RC1-1)/3),3)*5+3,FALSE)&"|"&HLOOKUP(Sheet1!R2C1,Sheet1!R2C1:R16C1,MOD(RC1,3)+MOD(INT((RC1)/3),3)*5+3,FALSE)&"|"&HLOOKUP(Sheet1!R2C1,Sheet1!R2C1:R16C1,MOD(RC1+1,3)+MOD(INT((RC1+1)/3),3)*5+3,FALSE)&"|"&HLOOKUP(Sheet1!R2C1,Sheet1!R2C1:R16C1,MOD(RC1+2,3)+MOD(INT((RC1+2)/3),3)*5+3,FALSE)&"|"&HLOOKUP(Sheet1!R2C1,Sheet1!R2C1:R16C1,MOD(RC1+3,3)+MOD(INT((RC1+3)/3),3)*5+3,FALSE) -> 164|102|103|104|132 | J60: =HLOOKUP(Sheet1!R2C1,Sheet1!R2C1:R16C1,MOD(RC1-1,3)+MOD(INT((RC1-1)/3),3)*5+3,FALSE)&"|"&HLOOKUP(Sheet1!R2C1,Sheet1!R2C1:R16C1,MOD(RC1,3)+MOD(INT((RC1)/3),3)*5+3,FALSE)&"|"&HLOOKUP(Sheet1!R2C1,Sheet1!R2C1:R16C1,MOD(RC1+1,3)+MOD(INT((RC1+1)/3),3)*5+3,FALSE)&"|"&HLOOKUP(Sheet1!R2C1,Sheet1!R2C1:R16C1,MOD(RC1+2,3)+MOD(INT((RC1+2)/3),3)*5+3,FALSE)&"|"&HLOOKUP(Sheet1!R2C1,Sheet1!R2C1:R16C1,MOD(RC1+3,3)+MOD(INT((RC1+3)/3),3)*5+3,FALSE) -> 164|102|103|104|132 | K60: =HLOOKUP(Sheet1!R2C1,Sheet1!R2C1:R16C1,MOD(RC1-1,3)+MOD(INT((RC1-1)/3),3)*5+3,FALSE)&"|"&HLOOKUP(Sheet1!R2C1,Sheet1!R2C1:R16C1,MOD(RC1,3)+MOD(INT((RC1)/3),3)*5+3,FALSE)&"|"&HLOOKUP(Sheet1!R2C1,Sheet1!R2C1:R16C1,MOD(RC1+1,3)+MOD(INT((RC1+1)/3),3)*5+3,FALSE)&"|"&HLOOKUP(Sheet1!R2C1,Sheet1!R2C1:R16C1,MOD(RC1+2,3)+MOD(INT((RC1+2)/3),3)*5+3,FALSE)&"|"&HLOOKUP(Sheet1!R2C1,Sheet1!R2C1:R16C1,MOD(RC1+3,3)+MOD(INT((RC1+3)/3),3)*5+3,FALSE) -> 164|102|103|104|132 | L60: 25|22|23|24 | M60: 75301|75300|75300|75300 | N60: 10030|10031|10032|10033 | O60: 1|1|1|1 | P60: 2500|2500|2500|2500
A61: 55 | B61: 53 | C61: 30 | D61: =R[-20]C+2 -> 24 | E61: 1000 | F61: =MOD(RC[-5]-1,3)*30+100&"|"&MOD(RC[-5]-1,3)*30+101&"|"&MOD(RC[-5]-1,3)*30+102&"|"&MOD(RC[-5]-1,3)*30+103&"|"&IF(MOD(RC[-5],4)=0,HLOOKUP(Sheet1!R2C10,Sheet1!R2C10:R7C10,MOD(RC[-5]/4-1,6)+1,FALSE),IF(MOD(RC[-5],2)=0,IF(RC[-5]>20,HLOOKUP(Sheet1!R2C7,Sheet1!R2C7:R43C7,MOD(RC[-5]/2-1,42)+1,FALSE),HLOOKUP(Sheet1!R2C4,Sheet1!R2C4:R7C4,MOD(RC[-5]-1,6)+1,FALSE)),MOD(RC[-5]-1,3)*30+104)) -> 100|101|102|103|104 | G61: =HLOOKUP(Sheet1!R2C1,Sheet1!R2C1:R16C1,MOD(RC1-1,2)+MOD(INT((RC1-1)/2),3)*5+1,FALSE)&"|"&HLOOKUP(Sheet1!R2C1,Sheet1!R2C1:R16C1,MOD(RC1,2)+MOD(INT((RC1)/2),3)*5+1,FALSE)&"|"&HLOOKUP(Sheet1!R2C1,Sheet1!R2C1:R16C1,MOD(RC1+1,2)+MOD(INT((RC1+1)/2),3)*5+1,FALSE)&"|"&HLOOKUP(Sheet1!R2C1,Sheet1!R2C1:R16C1,MOD(RC1+2,2)+MOD(INT((RC1+2)/2),3)*5+1,FALSE)&"|"&HLOOKUP(Sheet1!R2C1,Sheet1!R2C1:R16C1,MOD(RC1+3,2)+MOD(INT((RC1+3)/2),3)*5+1,FALSE) -> 100|101|130|131|160 | H61: =HLOOKUP(Sheet1!R2C1,Sheet1!R2C1:R16C1,MOD(RC1+2,2)+MOD(INT((RC1+2)/2),3)*5+1,FALSE)&"|"&HLOOKUP(Sheet1!R2C1,Sheet1!R2C1:R16C1,MOD(RC1+3,2)+MOD(INT((RC1+3)/2),3)*5+1,FALSE)&"|"&HLOOKUP(Sheet1!R2C1,Sheet1!R2C1:R16C1,MOD(RC1+4,2)+MOD(INT((RC1+4)/2),3)*5+1,FALSE)&"|"&HLOOKUP(Sheet1!R2C1,Sheet1!R2C1:R16C1,MOD(RC1+5,2)+MOD(INT((RC1+5)/2),3)*5+1,FALSE)&"|"&HLOOKUP(Sheet1!R2C1,Sheet1!R2C1:R16C1,MOD(RC1+6,2)+MOD(INT((RC1+6)/2),3)*5+1,FALSE) -> 131|160|161|100|101 | I61: =HLOOKUP(Sheet1!R2C1,Sheet1!R2C1:R16C1,MOD(RC1-1,3)+MOD(INT((RC1-1)/3),3)*5+3,FALSE)&"|"&HLOOKUP(Sheet1!R2C1,Sheet1!R2C1:R16C1,MOD(RC1,3)+MOD(INT((RC1)/3),3)*5+3,FALSE)&"|"&HLOOKUP(Sheet1!R2C1,Sheet1!R2C1:R16C1,MOD(RC1+1,3)+MOD(INT((RC1+1)/3),3)*5+3,FALSE)&"|"&HLOOKUP(Sheet1!R2C1,Sheet1!R2C1:R16C1,MOD(RC1+2,3)+MOD(INT((RC1+2)/3),3)*5+3,FALSE)&"|"&HLOOKUP(Sheet1!R2C1,Sheet1!R2C1:R16C1,MOD(RC1+3,3)+MOD(INT((RC1+3)/3),3)*5+3,FALSE) -> 102|103|104|132|133 | J61: =HLOOKUP(Sheet1!R2C1,Sheet1!R2C1:R16C1,MOD(RC1-1,3)+MOD(INT((RC1-1)/3),3)*5+3,FALSE)&"|"&HLOOKUP(Sheet1!R2C1,Sheet1!R2C1:R16C1,MOD(RC1,3)+MOD(INT((RC1)/3),3)*5+3,FALSE)&"|"&HLOOKUP(Sheet1!R2C1,Sheet1!R2C1:R16C1,MOD(RC1+1,3)+MOD(INT((RC1+1)/3),3)*5+3,FALSE)&"|"&HLOOKUP(Sheet1!R2C1,Sheet1!R2C1:R16C1,MOD(RC1+2,3)+MOD(INT((RC1+2)/3),3)*5+3,FALSE)&"|"&HLOOKUP(Sheet1!R2C1,Sheet1!R2C1:R16C1,MOD(RC1+3,3)+MOD(INT((RC1+3)/3),3)*5+3,FALSE) -> 102|103|104|132|133 | K61: =HLOOKUP(Sheet1!R2C1,Sheet1!R2C1:R16C1,MOD(RC1-1,3)+MOD(INT((RC1-1)/3),3)*5+3,FALSE)&"|"&HLOOKUP(Sheet1!R2C1,Sheet1!R2C1:R16C1,MOD(RC1,3)+MOD(INT((RC1)/3),3)*5+3,FALSE)&"|"&HLOOKUP(Sheet1!R2C1,Sheet1!R2C1:R16C1,MOD(RC1+1,3)+MOD(INT((RC1+1)/3),3)*5+3,FALSE)&"|"&HLOOKUP(Sheet1!R2C1,Sheet1!R2C1:R16C1,MOD(RC1+2,3)+MOD(INT((RC1+2)/3),3)*5+3,FALSE)&"|"&HLOOKUP(Sheet1!R2C1,Sheet1!R2C1:R16C1,MOD(RC1+3,3)+MOD(INT((RC1+3)/3),3)*5+3,FALSE) -> 102|103|104|132|133 | L61: 25|22|23|24 | M61: 78642|78643|78643|78643 | N61: 10030|10031|10032|10033|10030|10031|10032|10033|10030|10031|10032|10033|10030|10031|10032|10033|10030|10031|10032|10033|10030|10031|10032|10033|10030|10031|10032|10033|10030|10031|10032|10033|10030|10031|10032|10033|10030|10031|10032|10033 | O61: 1|1|1|1|1|1|1|1|1|1|1|1|1|1|1|1|1|1|1|1|1|1|1|1|1|1|1|1|1|1|1|1|1|1|1|1|1|1|1|1 | P61: 2500|2500|2500|2500|2500|2500|2500|2500|2500|2500|2500|2500|2500|2500|2500|2500|2500|2500|2500|2500|2500|2500|2500|2500|2500|2500|2500|2500|2500|2500|2500|2500|2500|2500|2500|2500|2500|2500|2500|2500
A62: 56 | B62: 54 | C62: 30 | D62: =R[-20]C+2 -> 24 | E62: 1000 | F62: =MOD(RC[-5]-1,3)*30+100&"|"&MOD(RC[-5]-1,3)*30+101&"|"&MOD(RC[-5]-1,3)*30+102&"|"&MOD(RC[-5]-1,3)*30+103&"|"&IF(MOD(RC[-5],4)=0,HLOOKUP(Sheet1!R2C10,Sheet1!R2C10:R7C10,MOD(RC[-5]/4-1,6)+1,FALSE),IF(MOD(RC[-5],2)=0,IF(RC[-5]>20,HLOOKUP(Sheet1!R2C7,Sheet1!R2C7:R43C7,MOD(RC[-5]/2-1,42)+1,FALSE),HLOOKUP(Sheet1!R2C4,Sheet1!R2C4:R7C4,MOD(RC[-5]-1,6)+1,FALSE)),MOD(RC[-5]-1,3)*30+104)) -> 130|131|132|133|191 | G62: =HLOOKUP(Sheet1!R2C1,Sheet1!R2C1:R16C1,MOD(RC1-1,2)+MOD(INT((RC1-1)/2),3)*5+1,FALSE)&"|"&HLOOKUP(Sheet1!R2C1,Sheet1!R2C1:R16C1,MOD(RC1,2)+MOD(INT((RC1)/2),3)*5+1,FALSE)&"|"&HLOOKUP(Sheet1!R2C1,Sheet1!R2C1:R16C1,MOD(RC1+1,2)+MOD(INT((RC1+1)/2),3)*5+1,FALSE)&"|"&HLOOKUP(Sheet1!R2C1,Sheet1!R2C1:R16C1,MOD(RC1+2,2)+MOD(INT((RC1+2)/2),3)*5+1,FALSE)&"|"&HLOOKUP(Sheet1!R2C1,Sheet1!R2C1:R16C1,MOD(RC1+3,2)+MOD(INT((RC1+3)/2),3)*5+1,FALSE) -> 101|130|131|160|161 | H62: =HLOOKUP(Sheet1!R2C1,Sheet1!R2C1:R16C1,MOD(RC1+2,2)+MOD(INT((RC1+2)/2),3)*5+1,FALSE)&"|"&HLOOKUP(Sheet1!R2C1,Sheet1!R2C1:R16C1,MOD(RC1+3,2)+MOD(INT((RC1+3)/2),3)*5+1,FALSE)&"|"&HLOOKUP(Sheet1!R2C1,Sheet1!R2C1:R16C1,MOD(RC1+4,2)+MOD(INT((RC1+4)/2),3)*5+1,FALSE)&"|"&HLOOKUP(Sheet1!R2C1,Sheet1!R2C1:R16C1,MOD(RC1+5,2)+MOD(INT((RC1+5)/2),3)*5+1,FALSE)&"|"&HLOOKUP(Sheet1!R2C1,Sheet1!R2C1:R16C1,MOD(RC1+6,2)+MOD(INT((RC1+6)/2),3)*5+1,FALSE) -> 160|161|100|101|130 | I62: =HLOOKUP(Sheet1!R2C1,Sheet1!R2C1:R16C1,MOD(RC1-1,3)+MOD(INT((RC1-1)/3),3)*5+3,FALSE)&"|"&HLOOKUP(Sheet1!R2C1,Sheet1!R2C1:R16C1,MOD(RC1,3)+MOD(INT((RC1)/3),3)*5+3,FALSE)&"|"&HLOOKUP(Sheet1!R2C1,Sheet1!R2C1:R16C1,MOD(RC1+1,3)+MOD(INT((RC1+1)/3),3)*5+3,FALSE)&"|"&HLOOKUP(Sheet1!R2C1,Sheet1!R2C1:R16C1,MOD(RC1+2,3)+MOD(INT((RC1+2)/3),3)*5+3,FALSE)&"|"&HLOOKUP(Sheet1!R2C1,Sheet1!R2C1:R16C1,MOD(RC1+3,3)+MOD(INT((RC1+3)/3),3)*5+3,FALSE) -> 103|104|132|133|134 | J62: =HLOOKUP(Sheet1!R2C1,Sheet1!R2C1:R16C1,MOD(RC1-1,3)+MOD(INT((RC1-1)/3),3)*5+3,FALSE)&"|"&HLOOKUP(Sheet1!R2C1,Sheet1!R2C1:R16C1,MOD(RC1,3)+MOD(INT((RC1)/3),3)*5+3,FALSE)&"|"&HLOOKUP(Sheet1!R2C1,Sheet1!R2C1:R16C1,MOD(RC1+1,3)+MOD(INT((RC1+1)/3),3)*5+3,FALSE)&"|"&HLOOKUP(Sheet1!R2C1,Sheet1!R2C1:R16C1,MOD(RC1+2,3)+MOD(INT((RC1+2)/3),3)*5+3,FALSE)&"|"&HLOOKUP(Sheet1!R2C1,Sheet1!R2C1:R16C1,MOD(RC1+3,3)+MOD(INT((RC1+3)/3),3)*5+3,FALSE) -> 103|104|132|133|134 | K62: =HLOOKUP(Sheet1!R2C1,Sheet1!R2C1:R16C1,MOD(RC1-1,3)+MOD(INT((RC1-1)/3),3)*5+3,FALSE)&"|"&HLOOKUP(Sheet1!R2C1,Sheet1!R2C1:R16C1,MOD(RC1,3)+MOD(INT((RC1)/3),3)*5+3,FALSE)&"|"&HLOOKUP(Sheet1!R2C1,Sheet1!R2C1:R16C1,MOD(RC1+1,3)+MOD(INT((RC1+1)/3),3)*5+3,FALSE)&"|"&HLOOKUP(Sheet1!R2C1,Sheet1!R2C1:R16C1,MOD(RC1+2,3)+MOD(INT((RC1+2)/3),3)*5+3,FALSE)&"|"&HLOOKUP(Sheet1!R2C1,Sheet1!R2C1:R16C1,MOD(RC1+3,3)+MOD(INT((RC1+3)/3),3)*5+3,FALSE) -> 103|104|132|133|134 | L62: 25|22|23|24 | M62: 82010|82010|82010|82010 | N62: 10030|10031|10032|10033 | O62: 1|1|1|1 | P62: 2500|2500|2500|2500
A63: 57 | B63: 55 | C63: 30 | D63: =R[-20]C+2 -> 24 | E63: 1000 | F63: =MOD(RC[-5]-1,3)*30+100&"|"&MOD(RC[-5]-1,3)*30+101&"|"&MOD(RC[-5]-1,3)*30+102&"|"&MOD(RC[-5]-1,3)*30+103&"|"&IF(MOD(RC[-5],4)=0,HLOOKUP(Sheet1!R2C10,Sheet1!R2C10:R7C10,MOD(RC[-5]/4-1,6)+1,FALSE),IF(MOD(RC[-5],2)=0,IF(RC[-5]>20,HLOOKUP(Sheet1!R2C7,Sheet1!R2C7:R43C7,MOD(RC[-5]/2-1,42)+1,FALSE),HLOOKUP(Sheet1!R2C4,Sheet1!R2C4:R7C4,MOD(RC[-5]-1,6)+1,FALSE)),MOD(RC[-5]-1,3)*30+104)) -> 160|161|162|163|164 | G63: =HLOOKUP(Sheet1!R2C1,Sheet1!R2C1:R16C1,MOD(RC1-1,2)+MOD(INT((RC1-1)/2),3)*5+1,FALSE)&"|"&HLOOKUP(Sheet1!R2C1,Sheet1!R2C1:R16C1,MOD(RC1,2)+MOD(INT((RC1)/2),3)*5+1,FALSE)&"|"&HLOOKUP(Sheet1!R2C1,Sheet1!R2C1:R16C1,MOD(RC1+1,2)+MOD(INT((RC1+1)/2),3)*5+1,FALSE)&"|"&HLOOKUP(Sheet1!R2C1,Sheet1!R2C1:R16C1,MOD(RC1+2,2)+MOD(INT((RC1+2)/2),3)*5+1,FALSE)&"|"&HLOOKUP(Sheet1!R2C1,Sheet1!R2C1:R16C1,MOD(RC1+3,2)+MOD(INT((RC1+3)/2),3)*5+1,FALSE) -> 130|131|160|161|100 | H63: =HLOOKUP(Sheet1!R2C1,Sheet1!R2C1:R16C1,MOD(RC1+2,2)+MOD(INT((RC1+2)/2),3)*5+1,FALSE)&"|"&HLOOKUP(Sheet1!R2C1,Sheet1!R2C1:R16C1,MOD(RC1+3,2)+MOD(INT((RC1+3)/2),3)*5+1,FALSE)&"|"&HLOOKUP(Sheet1!R2C1,Sheet1!R2C1:R16C1,MOD(RC1+4,2)+MOD(INT((RC1+4)/2),3)*5+1,FALSE)&"|"&HLOOKUP(Sheet1!R2C1,Sheet1!R2C1:R16C1,MOD(RC1+5,2)+MOD(INT((RC1+5)/2),3)*5+1,FALSE)&"|"&HLOOKUP(Sheet1!R2C1,Sheet1!R2C1:R16C1,MOD(RC1+6,2)+MOD(INT((RC1+6)/2),3)*5+1,FALSE) -> 161|100|101|130|131 | I63: =HLOOKUP(Sheet1!R2C1,Sheet1!R2C1:R16C1,MOD(RC1-1,3)+MOD(INT((RC1-1)/3),3)*5+3,FALSE)&"|"&HLOOKUP(Sheet1!R2C1,Sheet1!R2C1:R16C1,MOD(RC1,3)+MOD(INT((RC1)/3),3)*5+3,FALSE)&"|"&HLOOKUP(Sheet1!R2C1,Sheet1!R2C1:R16C1,MOD(RC1+1,3)+MOD(INT((RC1+1)/3),3)*5+3,FALSE)&"|"&HLOOKUP(Sheet1!R2C1,Sheet1!R2C1:R16C1,MOD(RC1+2,3)+MOD(INT((RC1+2)/3),3)*5+3,FALSE)&"|"&HLOOKUP(Sheet1!R2C1,Sheet1!R2C1:R16C1,MOD(RC1+3,3)+MOD(INT((RC1+3)/3),3)*5+3,FALSE) -> 104|132|133|134|162 | J63: =HLOOKUP(Sheet1!R2C1,Sheet1!R2C1:R16C1,MOD(RC1-1,3)+MOD(INT((RC1-1)/3),3)*5+3,FALSE)&"|"&HLOOKUP(Sheet1!R2C1,Sheet1!R2C1:R16C1,MOD(RC1,3)+MOD(INT((RC1)/3),3)*5+3,FALSE)&"|"&HLOOKUP(Sheet1!R2C1,Sheet1!R2C1:R16C1,MOD(RC1+1,3)+MOD(INT((RC1+1)/3),3)*5+3,FALSE)&"|"&HLOOKUP(Sheet1!R2C1,Sheet1!R2C1:R16C1,MOD(RC1+2,3)+MOD(INT((RC1+2)/3),3)*5+3,FALSE)&"|"&HLOOKUP(Sheet1!R2C1,Sheet1!R2C1:R16C1,MOD(RC1+3,3)+MOD(INT((RC1+3)/3),3)*5+3,FALSE) -> 104|132|133|134|162 | K63: =HLOOKUP(Sheet1!R2C1,Sheet1!R2C1:R16C1,MOD(RC1-1,3)+MOD(INT((RC1-1)/3),3)*5+3,FALSE)&"|"&HLOOKUP(Sheet1!R2C1,Sheet1!R2C1:R16C1,MOD(RC1,3)+MOD(INT((RC1)/3),3)*5+3,FALSE)&"|"&HLOOKUP(Sheet1!R2C1,Sheet1!R2C1:R16C1,MOD(RC1+1,3)+MOD(INT((RC1+1)/3),3)*5+3,FALSE)&"|"&HLOOKUP(Sheet1!R2C1,Sheet1!R2C1:R16C1,MOD(RC1+2,3)+MOD(INT((RC1+2)/3),3)*5+3,FALSE)&"|"&HLOOKUP(Sheet1!R2C1,Sheet1!R2C1:R16C1,MOD(RC1+3,3)+MOD(INT((RC1+3)/3),3)*5+3,FALSE) -> 104|132|133|134|162 | L63: 25|22|23|24 | M63: 85484|85484|85483|85483 | N63: 10030|10031|10032|10033 | O63: 1|1|1|1 | P63: 2500|2500|2500|2500
A64: 58 | B64: 56 | C64: 30 | D64: =R[-20]C+2 -> 24 | E64: 1000 | F64: =MOD(RC[-5]-1,3)*30+100&"|"&MOD(RC[-5]-1,3)*30+101&"|"&MOD(RC[-5]-1,3)*30+102&"|"&MOD(RC[-5]-1,3)*30+103&"|"&IF(MOD(RC[-5],4)=0,HLOOKUP(Sheet1!R2C10,Sheet1!R2C10:R7C10,MOD(RC[-5]/4-1,6)+1,FALSE),IF(MOD(RC[-5],2)=0,IF(RC[-5]>20,HLOOKUP(Sheet1!R2C7,Sheet1!R2C7:R43C7,MOD(RC[-5]/2-1,42)+1,FALSE),HLOOKUP(Sheet1!R2C4,Sheet1!R2C4:R7C4,MOD(RC[-5]-1,6)+1,FALSE)),MOD(RC[-5]-1,3)*30+104)) -> 100|101|102|103|172 | G64: =HLOOKUP(Sheet1!R2C1,Sheet1!R2C1:R16C1,MOD(RC1-1,2)+MOD(INT((RC1-1)/2),3)*5+1,FALSE)&"|"&HLOOKUP(Sheet1!R2C1,Sheet1!R2C1:R16C1,MOD(RC1,2)+MOD(INT((RC1)/2),3)*5+1,FALSE)&"|"&HLOOKUP(Sheet1!R2C1,Sheet1!R2C1:R16C1,MOD(RC1+1,2)+MOD(INT((RC1+1)/2),3)*5+1,FALSE)&"|"&HLOOKUP(Sheet1!R2C1,Sheet1!R2C1:R16C1,MOD(RC1+2,2)+MOD(INT((RC1+2)/2),3)*5+1,FALSE)&"|"&HLOOKUP(Sheet1!R2C1,Sheet1!R2C1:R16C1,MOD(RC1+3,2)+MOD(INT((RC1+3)/2),3)*5+1,FALSE) -> 131|160|161|100|101 | H64: =HLOOKUP(Sheet1!R2C1,Sheet1!R2C1:R16C1,MOD(RC1+2,2)+MOD(INT((RC1+2)/2),3)*5+1,FALSE)&"|"&HLOOKUP(Sheet1!R2C1,Sheet1!R2C1:R16C1,MOD(RC1+3,2)+MOD(INT((RC1+3)/2),3)*5+1,FALSE)&"|"&HLOOKUP(Sheet1!R2C1,Sheet1!R2C1:R16C1,MOD(RC1+4,2)+MOD(INT((RC1+4)/2),3)*5+1,FALSE)&"|"&HLOOKUP(Sheet1!R2C1,Sheet1!R2C1:R16C1,MOD(RC1+5,2)+MOD(INT((RC1+5)/2),3)*5+1,FALSE)&"|"&HLOOKUP(Sheet1!R2C1,Sheet1!R2C1:R16C1,MOD(RC1+6,2)+MOD(INT((RC1+6)/2),3)*5+1,FALSE) -> 100|101|130|131|160 | I64: =HLOOKUP(Sheet1!R2C1,Sheet1!R2C1:R16C1,MOD(RC1-1,3)+MOD(INT((RC1-1)/3),3)*5+3,FALSE)&"|"&HLOOKUP(Sheet1!R2C1,Sheet1!R2C1:R16C1,MOD(RC1,3)+MOD(INT((RC1)/3),3)*5+3,FALSE)&"|"&HLOOKUP(Sheet1!R2C1,Sheet1!R2C1:R16C1,MOD(RC1+1,3)+MOD(INT((RC1+1)/3),3)*5+3,FALSE)&"|"&HLOOKUP(Sheet1!R2C1,Sheet1!R2C1:R16C1,MOD(RC1+2,3)+MOD(INT((RC1+2)/3),3)*5+3,FALSE)&"|"&HLOOKUP(Sheet1!R2C1,Sheet1!R2C1:R16C1,MOD(RC1+3,3)+MOD(INT((RC1+3)/3),3)*5+3,FALSE) -> 132|133|134|162|163 | J64: =HLOOKUP(Sheet1!R2C1,Sheet1!R2C1:R16C1,MOD(RC1-1,3)+MOD(INT((RC1-1)/3),3)*5+3,FALSE)&"|"&HLOOKUP(Sheet1!R2C1,Sheet1!R2C1:R16C1,MOD(RC1,3)+MOD(INT((RC1)/3),3)*5+3,FALSE)&"|"&HLOOKUP(Sheet1!R2C1,Sheet1!R2C1:R16C1,MOD(RC1+1,3)+MOD(INT((RC1+1)/3),3)*5+3,FALSE)&"|"&HLOOKUP(Sheet1!R2C1,Sheet1!R2C1:R16C1,MOD(RC1+2,3)+MOD(INT((RC1+2)/3),3)*5+3,FALSE)&"|"&HLOOKUP(Sheet1!R2C1,Sheet1!R2C1:R16C1,MOD(RC1+3,3)+MOD(INT((RC1+3)/3),3)*5+3,FALSE) -> 132|133|134|162|163 | K64: =HLOOKUP(Sheet1!R2C1,Sheet1!R2C1:R16C1,MOD(RC1-1,3)+MOD(INT((RC1-1)/3),3)*5+3,FALSE)&"|"&HLOOKUP(Sheet1!R2C1,Sheet1!R2C1:R16C1,MOD(RC1,3)+MOD(INT((RC1)/3),3)*5+3,FALSE)&"|"&HLOOKUP(Sheet1!R2C1,Sheet1!R2C1:R16C1,MOD(RC1+1,3)+MOD(INT((RC1+1)/3),3)*5+3,FALSE)&"|"&HLOOKUP(Sheet1!R2C1,Sheet1!R2C1:R16C1,MOD(RC1+2,3)+MOD(INT((RC1+2)/3),3)*5+3,FALSE)&"|"&HLOOKUP(Sheet1!R2C1,Sheet1!R2C1:R16C1,MOD(RC1+3,3)+MOD(INT((RC1+3)/3),3)*5+3,FALSE) -> 132|133|134|162|163 | L64: 25|22|23|24 | M64: 89057|89056|89058|89058 | N64: 10030|10031|10032|10033 | O64: 1|1|1|1 | P64: 2500|2500|2500|2500
A65: 59 | B65: 57 | C65: 30 | D65: =R[-20]C+2 -> 24 | E65: 1000 | F65: =MOD(RC[-5]-1,3)*30+100&"|"&MOD(RC[-5]-1,3)*30+101&"|"&MOD(RC[-5]-1,3)*30+102&"|"&MOD(RC[-5]-1,3)*30+103&"|"&IF(MOD(RC[-5],4)=0,HLOOKUP(Sheet1!R2C10,Sheet1!R2C10:R7C10,MOD(RC[-5]/4-1,6)+1,FALSE),IF(MOD(RC[-5],2)=0,IF(RC[-5]>20,HLOOKUP(Sheet1!R2C7,Sheet1!R2C7:R43C7,MOD(RC[-5]/2-1,42)+1,FALSE),HLOOKUP(Sheet1!R2C4,Sheet1!R2C4:R7C4,MOD(RC[-5]-1,6)+1,FALSE)),MOD(RC[-5]-1,3)*30+104)) -> 130|131|132|133|134 | G65: =HLOOKUP(Sheet1!R2C1,Sheet1!R2C1:R16C1,MOD(RC1-1,2)+MOD(INT((RC1-1)/2),3)*5+1,FALSE)&"|"&HLOOKUP(Sheet1!R2C1,Sheet1!R2C1:R16C1,MOD(RC1,2)+MOD(INT((RC1)/2),3)*5+1,FALSE)&"|"&HLOOKUP(Sheet1!R2C1,Sheet1!R2C1:R16C1,MOD(RC1+1,2)+MOD(INT((RC1+1)/2),3)*5+1,FALSE)&"|"&HLOOKUP(Sheet1!R2C1,Sheet1!R2C1:R16C1,MOD(RC1+2,2)+MOD(INT((RC1+2)/2),3)*5+1,FALSE)&"|"&HLOOKUP(Sheet1!R2C1,Sheet1!R2C1:R16C1,MOD(RC1+3,2)+MOD(INT((RC1+3)/2),3)*5+1,FALSE) -> 160|161|100|101|130 | H65: =HLOOKUP(Sheet1!R2C1,Sheet1!R2C1:R16C1,MOD(RC1+2,2)+MOD(INT((RC1+2)/2),3)*5+1,FALSE)&"|"&HLOOKUP(Sheet1!R2C1,Sheet1!R2C1:R16C1,MOD(RC1+3,2)+MOD(INT((RC1+3)/2),3)*5+1,FALSE)&"|"&HLOOKUP(Sheet1!R2C1,Sheet1!R2C1:R16C1,MOD(RC1+4,2)+MOD(INT((RC1+4)/2),3)*5+1,FALSE)&"|"&HLOOKUP(Sheet1!R2C1,Sheet1!R2C1:R16C1,MOD(RC1+5,2)+MOD(INT((RC1+5)/2),3)*5+1,FALSE)&"|"&HLOOKUP(Sheet1!R2C1,Sheet1!R2C1:R16C1,MOD(RC1+6,2)+MOD(INT((RC1+6)/2),3)*5+1,FALSE) -> 101|130|131|160|161 | I65: =HLOOKUP(Sheet1!R2C1,Sheet1!R2C1:R16C1,MOD(RC1-1,3)+MOD(INT((RC1-1)/3),3)*5+3,FALSE)&"|"&HLOOKUP(Sheet1!R2C1,Sheet1!R2C1:R16C1,MOD(RC1,3)+MOD(INT((RC1)/3),3)*5+3,FALSE)&"|"&HLOOKUP(Sheet1!R2C1,Sheet1!R2C1:R16C1,MOD(RC1+1,3)+MOD(INT((RC1+1)/3),3)*5+3,FALSE)&"|"&HLOOKUP(Sheet1!R2C1,Sheet1!R2C1:R16C1,MOD(RC1+2,3)+MOD(INT((RC1+2)/3),3)*5+3,FALSE)&"|"&HLOOKUP(Sheet1!R2C1,Sheet1!R2C1:R16C1,MOD(RC1+3,3)+MOD(INT((RC1+3)/3),3)*5+3,FALSE) -> 133|134|162|163|164 | J65: =HLOOKUP(Sheet1!R2C1,Sheet1!R2C1:R16C1,MOD(RC1-1,3)+MOD(INT((RC1-1)/3),3)*5+3,FALSE)&"|"&HLOOKUP(Sheet1!R2C1,Sheet1!R2C1:R16C1,MOD(RC1,3)+MOD(INT((RC1)/3),3)*5+3,FALSE)&"|"&HLOOKUP(Sheet1!R2C1,Sheet1!R2C1:R16C1,MOD(RC1+1,3)+MOD(INT((RC1+1)/3),3)*5+3,FALSE)&"|"&HLOOKUP(Sheet1!R2C1,Sheet1!R2C1:R16C1,MOD(RC1+2,3)+MOD(INT((RC1+2)/3),3)*5+3,FALSE)&"|"&HLOOKUP(Sheet1!R2C1,Sheet1!R2C1:R16C1,MOD(RC1+3,3)+MOD(INT((RC1+3)/3),3)*5+3,FALSE) -> 133|134|162|163|164 | K65: =HLOOKUP(Sheet1!R2C1,Sheet1!R2C1:R16C1,MOD(RC1-1,3)+MOD(INT((RC1-1)/3),3)*5+3,FALSE)&"|"&HLOOKUP(Sheet1!R2C1,Sheet1!R2C1:R16C1,MOD(RC1,3)+MOD(INT((RC1)/3),3)*5+3,FALSE)&"|"&HLOOKUP(Sheet1!R2C1,Sheet1!R2C1:R16C1,MOD(RC1+1,3)+MOD(INT((RC1+1)/3),3)*5+3,FALSE)&"|"&HLOOKUP(Sheet1!R2C1,Sheet1!R2C1:R16C1,MOD(RC1+2,3)+MOD(INT((RC1+2)/3),3)*5+3,FALSE)&"|"&HLOOKUP(Sheet1!R2C1,Sheet1!R2C1:R16C1,MOD(RC1+3,3)+MOD(INT((RC1+3)/3),3)*5+3,FALSE) -> 133|134|162|163|164 | L65: 25|22|23|24 | M65: 92296|92296|92295|92295 | N65: 10030|10031|10032|10033 | O65: 1|1|1|1 | P65: 2500|2500|2500|2500
A66: 60 | B66: 58 | C66: 30 | D66: =R[-20]C+2 -> 24 | E66: 1000 | F66: =MOD(RC[-5]-1,3)*30+100&"|"&MOD(RC[-5]-1,3)*30+101&"|"&MOD(RC[-5]-1,3)*30+102&"|"&MOD(RC[-5]-1,3)*30+103&"|"&IF(MOD(RC[-5],4)=0,HLOOKUP(Sheet1!R2C10,Sheet1!R2C10:R7C10,MOD(RC[-5]/4-1,6)+1,FALSE),IF(MOD(RC[-5],2)=0,IF(RC[-5]>20,HLOOKUP(Sheet1!R2C7,Sheet1!R2C7:R43C7,MOD(RC[-5]/2-1,42)+1,FALSE),HLOOKUP(Sheet1!R2C4,Sheet1!R2C4:R7C4,MOD(RC[-5]-1,6)+1,FALSE)),MOD(RC[-5]-1,3)*30+104)) -> 160|161|162|163|192 | G66: =HLOOKUP(Sheet1!R2C1,Sheet1!R2C1:R16C1,MOD(RC1-1,2)+MOD(INT((RC1-1)/2),3)*5+1,FALSE)&"|"&HLOOKUP(Sheet1!R2C1,Sheet1!R2C1:R16C1,MOD(RC1,2)+MOD(INT((RC1)/2),3)*5+1,FALSE)&"|"&HLOOKUP(Sheet1!R2C1,Sheet1!R2C1:R16C1,MOD(RC1+1,2)+MOD(INT((RC1+1)/2),3)*5+1,FALSE)&"|"&HLOOKUP(Sheet1!R2C1,Sheet1!R2C1:R16C1,MOD(RC1+2,2)+MOD(INT((RC1+2)/2),3)*5+1,FALSE)&"|"&HLOOKUP(Sheet1!R2C1,Sheet1!R2C1:R16C1,MOD(RC1+3,2)+MOD(INT((RC1+3)/2),3)*5+1,FALSE) -> 161|100|101|130|131 | H66: =HLOOKUP(Sheet1!R2C1,Sheet1!R2C1:R16C1,MOD(RC1+2,2)+MOD(INT((RC1+2)/2),3)*5+1,FALSE)&"|"&HLOOKUP(Sheet1!R2C1,Sheet1!R2C1:R16C1,MOD(RC1+3,2)+MOD(INT((RC1+3)/2),3)*5+1,FALSE)&"|"&HLOOKUP(Sheet1!R2C1,Sheet1!R2C1:R16C1,MOD(RC1+4,2)+MOD(INT((RC1+4)/2),3)*5+1,FALSE)&"|"&HLOOKUP(Sheet1!R2C1,Sheet1!R2C1:R16C1,MOD(RC1+5,2)+MOD(INT((RC1+5)/2),3)*5+1,FALSE)&"|"&HLOOKUP(Sheet1!R2C1,Sheet1!R2C1:R16C1,MOD(RC1+6,2)+MOD(INT((RC1+6)/2),3)*5+1,FALSE) -> 130|131|160|161|100 | I66: =HLOOKUP(Sheet1!R2C1,Sheet1!R2C1:R16C1,MOD(RC1-1,3)+MOD(INT((RC1-1)/3),3)*5+3,FALSE)&"|"&HLOOKUP(Sheet1!R2C1,Sheet1!R2C1:R16C1,MOD(RC1,3)+MOD(INT((RC1)/3),3)*5+3,FALSE)&"|"&HLOOKUP(Sheet1!R2C1,Sheet1!R2C1:R16C1,MOD(RC1+1,3)+MOD(INT((RC1+1)/3),3)*5+3,FALSE)&"|"&HLOOKUP(Sheet1!R2C1,Sheet1!R2C1:R16C1,MOD(RC1+2,3)+MOD(INT((RC1+2)/3),3)*5+3,FALSE)&"|"&HLOOKUP(Sheet1!R2C1,Sheet1!R2C1:R16C1,MOD(RC1+3,3)+MOD(INT((RC1+3)/3),3)*5+3,FALSE) -> 134|162|163|164|102 | J66: =HLOOKUP(Sheet1!R2C1,Sheet1!R2C1:R16C1,MOD(RC1-1,3)+MOD(INT((RC1-1)/3),3)*5+3,FALSE)&"|"&HLOOKUP(Sheet1!R2C1,Sheet1!R2C1:R16C1,MOD(RC1,3)+MOD(INT((RC1)/3),3)*5+3,FALSE)&"|"&HLOOKUP(Sheet1!R2C1,Sheet1!R2C1:R16C1,MOD(RC1+1,3)+MOD(INT((RC1+1)/3),3)*5+3,FALSE)&"|"&HLOOKUP(Sheet1!R2C1,Sheet1!R2C1:R16C1,MOD(RC1+2,3)+MOD(INT((RC1+2)/3),3)*5+3,FALSE)&"|"&HLOOKUP(Sheet1!R2C1,Sheet1!R2C1:R16C1,MOD(RC1+3,3)+MOD(INT((RC1+3)/3),3)*5+3,FALSE) -> 134|162|163|164|102 | K66: =HLOOKUP(Sheet1!R2C1,Sheet1!R2C1:R16C1,MOD(RC1-1,3)+MOD(INT((RC1-1)/3),3)*5+3,FALSE)&"|"&HLOOKUP(Sheet1!R2C1,Sheet1!R2C1:R16C1,MOD(RC1,3)+MOD(INT((RC1)/3),3)*5+3,FALSE)&"|"&HLOOKUP(Sheet1!R2C1,Sheet1!R2C1:R16C1,MOD(RC1+1,3)+MOD(INT((RC1+1)/3),3)*5+3,FALSE)&"|"&HLOOKUP(Sheet1!R2C1,Sheet1!R2C1:R16C1,MOD(RC1+2,3)+MOD(INT((RC1+2)/3),3)*5+3,FALSE)&"|"&HLOOKUP(Sheet1!R2C1,Sheet1!R2C1:R16C1,MOD(RC1+3,3)+MOD(INT((RC1+3)/3),3)*5+3,FALSE) -> 134|162|163|164|102 | L66: 25|22|23|24 | M66: 95024|95024|95025|95025 | N66: 10030|10031|10032|10033|10030|10031|10032|10033|10030|10031|10032|10033|10030|10031|10032|10033|10030|10031|10032|10033|10030|10031|10032|10033|10030|10031|10032|10033|10030|10031|10032|10033|10030|10031|10032|10033|10030|10031|10032|10033 | O66: 1|1|1|1|1|1|1|1|1|1|1|1|1|1|1|1|1|1|1|1|1|1|1|1|1|1|1|1|1|1|1|1|1|1|1|1|1|1|1|1 | P66: 2500|2500|2500|2500|2500|2500|2500|2500|2500|2500|2500|2500|2500|2500|2500|2500|2500|2500|2500|2500|2500|2500|2500|2500|2500|2500|2500|2500|2500|2500|2500|2500|2500|2500|2500|2500|2500|2500|2500|2500
A67: 61 | B67: 59 | C67: 30 | D67: =R[-20]C+2 -> 26 | E67: 1000 | F67: =MOD(RC[-5]-1,3)*30+100&"|"&MOD(RC[-5]-1,3)*30+101&"|"&MOD(RC[-5]-1,3)*30+102&"|"&MOD(RC[-5]-1,3)*30+103&"|"&IF(MOD(RC[-5],4)=0,HLOOKUP(Sheet1!R2C10,Sheet1!R2C10:R7C10,MOD(RC[-5]/4-1,6)+1,FALSE),IF(MOD(RC[-5],2)=0,IF(RC[-5]>20,HLOOKUP(Sheet1!R2C7,Sheet1!R2C7:R43C7,MOD(RC[-5]/2-1,42)+1,FALSE),HLOOKUP(Sheet1!R2C4,Sheet1!R2C4:R7C4,MOD(RC[-5]-1,6)+1,FALSE)),MOD(RC[-5]-1,3)*30+104)) -> 100|101|102|103|104 | G67: =HLOOKUP(Sheet1!R2C1,Sheet1!R2C1:R16C1,MOD(RC1-1,2)+MOD(INT((RC1-1)/2),3)*5+1,FALSE)&"|"&HLOOKUP(Sheet1!R2C1,Sheet1!R2C1:R16C1,MOD(RC1,2)+MOD(INT((RC1)/2),3)*5+1,FALSE)&"|"&HLOOKUP(Sheet1!R2C1,Sheet1!R2C1:R16C1,MOD(RC1+1,2)+MOD(INT((RC1+1)/2),3)*5+1,FALSE)&"|"&HLOOKUP(Sheet1!R2C1,Sheet1!R2C1:R16C1,MOD(RC1+2,2)+MOD(INT((RC1+2)/2),3)*5+1,FALSE)&"|"&HLOOKUP(Sheet1!R2C1,Sheet1!R2C1:R16C1,MOD(RC1+3,2)+MOD(INT((RC1+3)/2),3)*5+1,FALSE) -> 100|101|130|131|160 | H67: =HLOOKUP(Sheet1!R2C1,Sheet1!R2C1:R16C1,MOD(RC1+2,2)+MOD(INT((RC1+2)/2),3)*5+1,FALSE)&"|"&HLOOKUP(Sheet1!R2C1,Sheet1!R2C1:R16C1,MOD(RC1+3,2)+MOD(INT((RC1+3)/2),3)*5+1,FALSE)&"|"&HLOOKUP(Sheet1!R2C1,Sheet1!R2C1:R16C1,MOD(RC1+4,2)+MOD(INT((RC1+4)/2),3)*5+1,FALSE)&"|"&HLOOKUP(Sheet1!R2C1,Sheet1!R2C1:R16C1,MOD(RC1+5,2)+MOD(INT((RC1+5)/2),3)*5+1,FALSE)&"|"&HLOOKUP(Sheet1!R2C1,Sheet1!R2C1:R16C1,MOD(RC1+6,2)+MOD(INT((RC1+6)/2),3)*5+1,FALSE) -> 131|160|161|100|101 | I67: =HLOOKUP(Sheet1!R2C1,Sheet1!R2C1:R16C1,MOD(RC1-1,3)+MOD(INT((RC1-1)/3),3)*5+3,FALSE)&"|"&HLOOKUP(Sheet1!R2C1,Sheet1!R2C1:R16C1,MOD(RC1,3)+MOD(INT((RC1)/3),3)*5+3,FALSE)&"|"&HLOOKUP(Sheet1!R2C1,Sheet1!R2C1:R16C1,MOD(RC1+1,3)+MOD(INT((RC1+1)/3),3)*5+3,FALSE)&"|"&HLOOKUP(Sheet1!R2C1,Sheet1!R2C1:R16C1,MOD(RC1+2,3)+MOD(INT((RC1+2)/3),3)*5+3,FALSE)&"|"&HLOOKUP(Sheet1!R2C1,Sheet1!R2C1:R16C1,MOD(RC1+3,3)+MOD(INT((RC1+3)/3),3)*5+3,FALSE) -> 162|163|164|102|103 | J67: =HLOOKUP(Sheet1!R2C1,Sheet1!R2C1:R16C1,MOD(RC1-1,3)+MOD(INT((RC1-1)/3),3)*5+3,FALSE)&"|"&HLOOKUP(Sheet1!R2C1,Sheet1!R2C1:R16C1,MOD(RC1,3)+MOD(INT((RC1)/3),3)*5+3,FALSE)&"|"&HLOOKUP(Sheet1!R2C1,Sheet1!R2C1:R16C1,MOD(RC1+1,3)+MOD(INT((RC1+1)/3),3)*5+3,FALSE)&"|"&HLOOKUP(Sheet1!R2C1,Sheet1!R2C1:R16C1,MOD(RC1+2,3)+MOD(INT((RC1+2)/3),3)*5+3,FALSE)&"|"&HLOOKUP(Sheet1!R2C1,Sheet1!R2C1:R16C1,MOD(RC1+3,3)+MOD(INT((RC1+3)/3),3)*5+3,FALSE) -> 162|163|164|102|103 | K67: =HLOOKUP(Sheet1!R2C1,Sheet1!R2C1:R16C1,MOD(RC1-1,3)+MOD(INT((RC1-1)/3),3)*5+3,FALSE)&"|"&HLOOKUP(Sheet1!R2C1,Sheet1!R2C1:R16C1,MOD(RC1,3)+MOD(INT((RC1)/3),3)*5+3,FALSE)&"|"&HLOOKUP(Sheet1!R2C1,Sheet1!R2C1:R16C1,MOD(RC1+1,3)+MOD(INT((RC1+1)/3),3)*5+3,FALSE)&"|"&HLOOKUP(Sheet1!R2C1,Sheet1!R2C1:R16C1,MOD(RC1+2,3)+MOD(INT((RC1+2)/3),3)*5+3,FALSE)&"|"&HLOOKUP(Sheet1!R2C1,Sheet1!R2C1:R16C1,MOD(RC1+3,3)+MOD(INT((RC1+3)/3),3)*5+3,FALSE) -> 162|163|164|102|103 | L67: 25|22|23|24 | M67: 97677|97678|97678|97678 | N67: 10030|10031|10032|10033 | O67: 1|1|1|1 | P67: 2500|2500|2500|2500
A68: 62 | B68: 60 | C68: 30 | D68: =R[-20]C+2 -> 26 | E68: 1000 | F68: =MOD(RC[-5]-1,3)*30+100&"|"&MOD(RC[-5]-1,3)*30+101&"|"&MOD(RC[-5]-1,3)*30+102&"|"&MOD(RC[-5]-1,3)*30+103&"|"&IF(MOD(RC[-5],4)=0,HLOOKUP(Sheet1!R2C10,Sheet1!R2C10:R7C10,MOD(RC[-5]/4-1,6)+1,FALSE),IF(MOD(RC[-5],2)=0,IF(RC[-5]>20,HLOOKUP(Sheet1!R2C7,Sheet1!R2C7:R43C7,MOD(RC[-5]/2-1,42)+1,FALSE),HLOOKUP(Sheet1!R2C4,Sheet1!R2C4:R7C4,MOD(RC[-5]-1,6)+1,FALSE)),MOD(RC[-5]-1,3)*30+104)) -> 130|131|132|133|174 | G68: =HLOOKUP(Sheet1!R2C1,Sheet1!R2C1:R16C1,MOD(RC1-1,2)+MOD(INT((RC1-1)/2),3)*5+1,FALSE)&"|"&HLOOKUP(Sheet1!R2C1,Sheet1!R2C1:R16C1,MOD(RC1,2)+MOD(INT((RC1)/2),3)*5+1,FALSE)&"|"&HLOOKUP(Sheet1!R2C1,Sheet1!R2C1:R16C1,MOD(RC1+1,2)+MOD(INT((RC1+1)/2),3)*5+1,FALSE)&"|"&HLOOKUP(Sheet1!R2C1,Sheet1!R2C1:R16C1,MOD(RC1+2,2)+MOD(INT((RC1+2)/2),3)*5+1,FALSE)&"|"&HLOOKUP(Sheet1!R2C1,Sheet1!R2C1:R16C1,MOD(RC1+3,2)+MOD(INT((RC1+3)/2),3)*5+1,FALSE) -> 101|130|131|160|161 | H68: =HLOOKUP(Sheet1!R2C1,Sheet1!R2C1:R16C1,MOD(RC1+2,2)+MOD(INT((RC1+2)/2),3)*5+1,FALSE)&"|"&HLOOKUP(Sheet1!R2C1,Sheet1!R2C1:R16C1,MOD(RC1+3,2)+MOD(INT((RC1+3)/2),3)*5+1,FALSE)&"|"&HLOOKUP(Sheet1!R2C1,Sheet1!R2C1:R16C1,MOD(RC1+4,2)+MOD(INT((RC1+4)/2),3)*5+1,FALSE)&"|"&HLOOKUP(Sheet1!R2C1,Sheet1!R2C1:R16C1,MOD(RC1+5,2)+MOD(INT((RC1+5)/2),3)*5+1,FALSE)&"|"&HLOOKUP(Sheet1!R2C1,Sheet1!R2C1:R16C1,MOD(RC1+6,2)+MOD(INT((RC1+6)/2),3)*5+1,FALSE) -> 160|161|100|101|130 | I68: =HLOOKUP(Sheet1!R2C1,Sheet1!R2C1:R16C1,MOD(RC1-1,3)+MOD(INT((RC1-1)/3),3)*5+3,FALSE)&"|"&HLOOKUP(Sheet1!R2C1,Sheet1!R2C1:R16C1,MOD(RC1,3)+MOD(INT((RC1)/3),3)*5+3,FALSE)&"|"&HLOOKUP(Sheet1!R2C1,Sheet1!R2C1:R16C1,MOD(RC1+1,3)+MOD(INT((RC1+1)/3),3)*5+3,FALSE)&"|"&HLOOKUP(Sheet1!R2C1,Sheet1!R2C1:R16C1,MOD(RC1+2,3)+MOD(INT((RC1+2)/3),3)*5+3,FALSE)&"|"&HLOOKUP(Sheet1!R2C1,Sheet1!R2C1:R16C1,MOD(RC1+3,3)+MOD(INT((RC1+3)/3),3)*5+3,FALSE) -> 163|164|102|103|104 | J68: =HLOOKUP(Sheet1!R2C1,Sheet1!R2C1:R16C1,MOD(RC1-1,3)+MOD(INT((RC1-1)/3),3)*5+3,FALSE)&"|"&HLOOKUP(Sheet1!R2C1,Sheet1!R2C1:R16C1,MOD(RC1,3)+MOD(INT((RC1)/3),3)*5+3,FALSE)&"|"&HLOOKUP(Sheet1!R2C1,Sheet1!R2C1:R16C1,MOD(RC1+1,3)+MOD(INT((RC1+1)/3),3)*5+3,FALSE)&"|"&HLOOKUP(Sheet1!R2C1,Sheet1!R2C1:R16C1,MOD(RC1+2,3)+MOD(INT((RC1+2)/3),3)*5+3,FALSE)&"|"&HLOOKUP(Sheet1!R2C1,Sheet1!R2C1:R16C1,MOD(RC1+3,3)+MOD(INT((RC1+3)/3),3)*5+3,FALSE) -> 163|164|102|103|104 | K68: =HLOOKUP(Sheet1!R2C1,Sheet1!R2C1:R16C1,MOD(RC1-1,3)+MOD(INT((RC1-1)/3),3)*5+3,FALSE)&"|"&HLOOKUP(Sheet1!R2C1,Sheet1!R2C1:R16C1,MOD(RC1,3)+MOD(INT((RC1)/3),3)*5+3,FALSE)&"|"&HLOOKUP(Sheet1!R2C1,Sheet1!R2C1:R16C1,MOD(RC1+1,3)+MOD(INT((RC1+1)/3),3)*5+3,FALSE)&"|"&HLOOKUP(Sheet1!R2C1,Sheet1!R2C1:R16C1,MOD(RC1+2,3)+MOD(INT((RC1+2)/3),3)*5+3,FALSE)&"|"&HLOOKUP(Sheet1!R2C1,Sheet1!R2C1:R16C1,MOD(RC1+3,3)+MOD(INT((RC1+3)/3),3)*5+3,FALSE) -> 163|164|102|103|104 | L68: 25|22|23|24 | M68: 100402|100403|100403|100403 | N68: 10030|10031|10032|10033 | O68: 1|1|1|1 | P68: 2500|2500|2500|2500
A69: 63 | B69: 61 | C69: 30 | D69: =R[-20]C+2 -> 26 | E69: 1000 | F69: =MOD(RC[-5]-1,3)*30+100&"|"&MOD(RC[-5]-1,3)*30+101&"|"&MOD(RC[-5]-1,3)*30+102&"|"&MOD(RC[-5]-1,3)*30+103&"|"&IF(MOD(RC[-5],4)=0,HLOOKUP(Sheet1!R2C10,Sheet1!R2C10:R7C10,MOD(RC[-5]/4-1,6)+1,FALSE),IF(MOD(RC[-5],2)=0,IF(RC[-5]>20,HLOOKUP(Sheet1!R2C7,Sheet1!R2C7:R43C7,MOD(RC[-5]/2-1,42)+1,FALSE),HLOOKUP(Sheet1!R2C4,Sheet1!R2C4:R7C4,MOD(RC[-5]-1,6)+1,FALSE)),MOD(RC[-5]-1,3)*30+104)) -> 160|161|162|163|164 | G69: =HLOOKUP(Sheet1!R2C1,Sheet1!R2C1:R16C1,MOD(RC1-1,2)+MOD(INT((RC1-1)/2),3)*5+1,FALSE)&"|"&HLOOKUP(Sheet1!R2C1,Sheet1!R2C1:R16C1,MOD(RC1,2)+MOD(INT((RC1)/2),3)*5+1,FALSE)&"|"&HLOOKUP(Sheet1!R2C1,Sheet1!R2C1:R16C1,MOD(RC1+1,2)+MOD(INT((RC1+1)/2),3)*5+1,FALSE)&"|"&HLOOKUP(Sheet1!R2C1,Sheet1!R2C1:R16C1,MOD(RC1+2,2)+MOD(INT((RC1+2)/2),3)*5+1,FALSE)&"|"&HLOOKUP(Sheet1!R2C1,Sheet1!R2C1:R16C1,MOD(RC1+3,2)+MOD(INT((RC1+3)/2),3)*5+1,FALSE) -> 130|131|160|161|100 | H69: =HLOOKUP(Sheet1!R2C1,Sheet1!R2C1:R16C1,MOD(RC1+2,2)+MOD(INT((RC1+2)/2),3)*5+1,FALSE)&"|"&HLOOKUP(Sheet1!R2C1,Sheet1!R2C1:R16C1,MOD(RC1+3,2)+MOD(INT((RC1+3)/2),3)*5+1,FALSE)&"|"&HLOOKUP(Sheet1!R2C1,Sheet1!R2C1:R16C1,MOD(RC1+4,2)+MOD(INT((RC1+4)/2),3)*5+1,FALSE)&"|"&HLOOKUP(Sheet1!R2C1,Sheet1!R2C1:R16C1,MOD(RC1+5,2)+MOD(INT((RC1+5)/2),3)*5+1,FALSE)&"|"&HLOOKUP(Sheet1!R2C1,Sheet1!R2C1:R16C1,MOD(RC1+6,2)+MOD(INT((RC1+6)/2),3)*5+1,FALSE) -> 161|100|101|130|131 | I69: =HLOOKUP(Sheet1!R2C1,Sheet1!R2C1:R16C1,MOD(RC1-1,3)+MOD(INT((RC1-1)/3),3)*5+3,FALSE)&"|"&HLOOKUP(Sheet1!R2C1,Sheet1!R2C1:R16C1,MOD(RC1,3)+MOD(INT((RC1)/3),3)*5+3,FALSE)&"|"&HLOOKUP(Sheet1!R2C1,Sheet1!R2C1:R16C1,MOD(RC1+1,3)+MOD(INT((RC1+1)/3),3)*5+3,FALSE)&"|"&HLOOKUP(Sheet1!R2C1,Sheet1!R2C1:R16C1,MOD(RC1+2,3)+MOD(INT((RC1+2)/3),3)*5+3,FALSE)&"|"&HLOOKUP(Sheet1!R2C1,Sheet1!R2C1:R16C1,MOD(RC1+3,3)+MOD(INT((RC1+3)/3),3)*5+3,FALSE) -> 164|102|103|104|132 | J69: =HLOOKUP(Sheet1!R2C1,Sheet1!R2C1:R16C1,MOD(RC1-1,3)+MOD(INT((RC1-1)/3),3)*5+3,FALSE)&"|"&HLOOKUP(Sheet1!R2C1,Sheet1!R2C1:R16C1,MOD(RC1,3)+MOD(INT((RC1)/3),3)*5+3,FALSE)&"|"&HLOOKUP(Sheet1!R2C1,Sheet1!R2C1:R16C1,MOD(RC1+1,3)+MOD(INT((RC1+1)/3),3)*5+3,FALSE)&"|"&HLOOKUP(Sheet1!R2C1,Sheet1!R2C1:R16C1,MOD(RC1+2,3)+MOD(INT((RC1+2)/3),3)*5+3,FALSE)&"|"&HLOOKUP(Sheet1!R2C1,Sheet1!R2C1:R16C1,MOD(RC1+3,3)+MOD(INT((RC1+3)/3),3)*5+3,FALSE) -> 164|102|103|104|132 | K69: =HLOOKUP(Sheet1!R2C1,Sheet1!R2C1:R16C1,MOD(RC1-1,3)+MOD(INT((RC1-1)/3),3)*5+3,FALSE)&"|"&HLOOKUP(Sheet1!R2C1,Sheet1!R2C1:R16C1,MOD(RC1,3)+MOD(INT((RC1)/3),3)*5+3,FALSE)&"|"&HLOOKUP(Sheet1!R2C1,Sheet1!R2C1:R16C1,MOD(RC1+1,3)+MOD(INT((RC1+1)/3),3)*5+3,FALSE)&"|"&HLOOKUP(Sheet1!R2C1,Sheet1!R2C1:R16C1,MOD(RC1+2,3)+MOD(INT((RC1+2)/3),3)*5+3,FALSE)&"|"&HLOOKUP(Sheet1!R2C1,Sheet1!R2C1:R16C1,MOD(RC1+3,3)+MOD(INT((RC1+3)/3),3)*5+3,FALSE) -> 164|102|103|104|132 | L69: 25|22|23|24 | M69: 103214|103214|103215|103215 | N69: 10030|10031|10032|10033 | O69: 1|1|1|1 | P69: 2500|2500|2500|2500
A70: 64 | B70: 62 | C70: 30 | D70: =R[-20]C+2 -> 26 | E70: 1000 | F70: =MOD(RC[-5]-1,3)*30+100&"|"&MOD(RC[-5]-1,3)*30+101&"|"&MOD(RC[-5]-1,3)*30+102&"|"&MOD(RC[-5]-1,3)*30+103&"|"&IF(MOD(RC[-5],4)=0,HLOOKUP(Sheet1!R2C10,Sheet1!R2C10:R7C10,MOD(RC[-5]/4-1,6)+1,FALSE),IF(MOD(RC[-5],2)=0,IF(RC[-5]>20,HLOOKUP(Sheet1!R2C7,Sheet1!R2C7:R43C7,MOD(RC[-5]/2-1,42)+1,FALSE),HLOOKUP(Sheet1!R2C4,Sheet1!R2C4:R7C4,MOD(RC[-5]-1,6)+1,FALSE)),MOD(RC[-5]-1,3)*30+104)) -> 100|101|102|103|193 | G70: =HLOOKUP(Sheet1!R2C1,Sheet1!R2C1:R16C1,MOD(RC1-1,2)+MOD(INT((RC1-1)/2),3)*5+1,FALSE)&"|"&HLOOKUP(Sheet1!R2C1,Sheet1!R2C1:R16C1,MOD(RC1,2)+MOD(INT((RC1)/2),3)*5+1,FALSE)&"|"&HLOOKUP(Sheet1!R2C1,Sheet1!R2C1:R16C1,MOD(RC1+1,2)+MOD(INT((RC1+1)/2),3)*5+1,FALSE)&"|"&HLOOKUP(Sheet1!R2C1,Sheet1!R2C1:R16C1,MOD(RC1+2,2)+MOD(INT((RC1+2)/2),3)*5+1,FALSE)&"|"&HLOOKUP(Sheet1!R2C1,Sheet1!R2C1:R16C1,MOD(RC1+3,2)+MOD(INT((RC1+3)/2),3)*5+1,FALSE) -> 131|160|161|100|101 | H70: =HLOOKUP(Sheet1!R2C1,Sheet1!R2C1:R16C1,MOD(RC1+2,2)+MOD(INT((RC1+2)/2),3)*5+1,FALSE)&"|"&HLOOKUP(Sheet1!R2C1,Sheet1!R2C1:R16C1,MOD(RC1+3,2)+MOD(INT((RC1+3)/2),3)*5+1,FALSE)&"|"&HLOOKUP(Sheet1!R2C1,Sheet1!R2C1:R16C1,MOD(RC1+4,2)+MOD(INT((RC1+4)/2),3)*5+1,FALSE)&"|"&HLOOKUP(Sheet1!R2C1,Sheet1!R2C1:R16C1,MOD(RC1+5,2)+MOD(INT((RC1+5)/2),3)*5+1,FALSE)&"|"&HLOOKUP(Sheet1!R2C1,Sheet1!R2C1:R16C1,MOD(RC1+6,2)+MOD(INT((RC1+6)/2),3)*5+1,FALSE) -> 100|101|130|131|160 | I70: =HLOOKUP(Sheet1!R2C1,Sheet1!R2C1:R16C1,MOD(RC1-1,3)+MOD(INT((RC1-1)/3),3)*5+3,FALSE)&"|"&HLOOKUP(Sheet1!R2C1,Sheet1!R2C1:R16C1,MOD(RC1,3)+MOD(INT((RC1)/3),3)*5+3,FALSE)&"|"&HLOOKUP(Sheet1!R2C1,Sheet1!R2C1:R16C1,MOD(RC1+1,3)+MOD(INT((RC1+1)/3),3)*5+3,FALSE)&"|"&HLOOKUP(Sheet1!R2C1,Sheet1!R2C1:R16C1,MOD(RC1+2,3)+MOD(INT((RC1+2)/3),3)*5+3,FALSE)&"|"&HLOOKUP(Sheet1!R2C1,Sheet1!R2C1:R16C1,MOD(RC1+3,3)+MOD(INT((RC1+3)/3),3)*5+3,FALSE) -> 102|103|104|132|133 | J70: =HLOOKUP(Sheet1!R2C1,Sheet1!R2C1:R16C1,MOD(RC1-1,3)+MOD(INT((RC1-1)/3),3)*5+3,FALSE)&"|"&HLOOKUP(Sheet1!R2C1,Sheet1!R2C1:R16C1,MOD(RC1,3)+MOD(INT((RC1)/3),3)*5+3,FALSE)&"|"&HLOOKUP(Sheet1!R2C1,Sheet1!R2C1:R16C1,MOD(RC1+1,3)+MOD(INT((RC1+1)/3),3)*5+3,FALSE)&"|"&HLOOKUP(Sheet1!R2C1,Sheet1!R2C1:R16C1,MOD(RC1+2,3)+MOD(INT((RC1+2)/3),3)*5+3,FALSE)&"|"&HLOOKUP(Sheet1!R2C1,Sheet1!R2C1:R16C1,MOD(RC1+3,3)+MOD(INT((RC1+3)/3),3)*5+3,FALSE) -> 102|103|104|132|133 | K70: =HLOOKUP(Sheet1!R2C1,Sheet1!R2C1:R16C1,MOD(RC1-1,3)+MOD(INT((RC1-1)/3),3)*5+3,FALSE)&"|"&HLOOKUP(Sheet1!R2C1,Sheet1!R2C1:R16C1,MOD(RC1,3)+MOD(INT((RC1)/3),3)*5+3,FALSE)&"|"&HLOOKUP(Sheet1!R2C1,Sheet1!R2C1:R16C1,MOD(RC1+1,3)+MOD(INT((RC1+1)/3),3)*5+3,FALSE)&"|"&HLOOKUP(Sheet1!R2C1,Sheet1!R2C1:R16C1,MOD(RC1+2,3)+MOD(INT((RC1+2)/3),3)*5+3,FALSE)&"|"&HLOOKUP(Sheet1!R2C1,Sheet1!R2C1:R16C1,MOD(RC1+3,3)+MOD(INT((RC1+3)/3),3)*5+3,FALSE) -> 102|103|104|132|133 | L70: 25|22|23|24 | M70: 106026|106026|106025|106025 | N70: 10030|10031|10032|10033 | O70: 1|1|1|1 | P70: 2500|2500|2500|2500
A71: 65 | B71: 63 | C71: 30 | D71: =R[-20]C+2 -> 26 | E71: 1000 | F71: =MOD(RC[-5]-1,3)*30+100&"|"&MOD(RC[-5]-1,3)*30+101&"|"&MOD(RC[-5]-1,3)*30+102&"|"&MOD(RC[-5]-1,3)*30+103&"|"&IF(MOD(RC[-5],4)=0,HLOOKUP(Sheet1!R2C10,Sheet1!R2C10:R7C10,MOD(RC[-5]/4-1,6)+1,FALSE),IF(MOD(RC[-5],2)=0,IF(RC[-5]>20,HLOOKUP(Sheet1!R2C7,Sheet1!R2C7:R43C7,MOD(RC[-5]/2-1,42)+1,FALSE),HLOOKUP(Sheet1!R2C4,Sheet1!R2C4:R7C4,MOD(RC[-5]-1,6)+1,FALSE)),MOD(RC[-5]-1,3)*30+104)) -> 130|131|132|133|134 | G71: =HLOOKUP(Sheet1!R2C1,Sheet1!R2C1:R16C1,MOD(RC1-1,2)+MOD(INT((RC1-1)/2),3)*5+1,FALSE)&"|"&HLOOKUP(Sheet1!R2C1,Sheet1!R2C1:R16C1,MOD(RC1,2)+MOD(INT((RC1)/2),3)*5+1,FALSE)&"|"&HLOOKUP(Sheet1!R2C1,Sheet1!R2C1:R16C1,MOD(RC1+1,2)+MOD(INT((RC1+1)/2),3)*5+1,FALSE)&"|"&HLOOKUP(Sheet1!R2C1,Sheet1!R2C1:R16C1,MOD(RC1+2,2)+MOD(INT((RC1+2)/2),3)*5+1,FALSE)&"|"&HLOOKUP(Sheet1!R2C1,Sheet1!R2C1:R16C1,MOD(RC1+3,2)+MOD(INT((RC1+3)/2),3)*5+1,FALSE) -> 160|161|100|101|130 | H71: =HLOOKUP(Sheet1!R2C1,Sheet1!R2C1:R16C1,MOD(RC1+2,2)+MOD(INT((RC1+2)/2),3)*5+1,FALSE)&"|"&HLOOKUP(Sheet1!R2C1,Sheet1!R2C1:R16C1,MOD(RC1+3,2)+MOD(INT((RC1+3)/2),3)*5+1,FALSE)&"|"&HLOOKUP(Sheet1!R2C1,Sheet1!R2C1:R16C1,MOD(RC1+4,2)+MOD(INT((RC1+4)/2),3)*5+1,FALSE)&"|"&HLOOKUP(Sheet1!R2C1,Sheet1!R2C1:R16C1,MOD(RC1+5,2)+MOD(INT((RC1+5)/2),3)*5+1,FALSE)&"|"&HLOOKUP(Sheet1!R2C1,Sheet1!R2C1:R16C1,MOD(RC1+6,2)+MOD(INT((RC1+6)/2),3)*5+1,FALSE) -> 101|130|131|160|161 | I71: =HLOOKUP(Sheet1!R2C1,Sheet1!R2C1:R16C1,MOD(RC1-1,3)+MOD(INT((RC1-1)/3),3)*5+3,FALSE)&"|"&HLOOKUP(Sheet1!R2C1,Sheet1!R2C1:R16C1,MOD(RC1,3)+MOD(INT((RC1)/3),3)*5+3,FALSE)&"|"&HLOOKUP(Sheet1!R2C1,Sheet1!R2C1:R16C1,MOD(RC1+1,3)+MOD(INT((RC1+1)/3),3)*5+3,FALSE)&"|"&HLOOKUP(Sheet1!R2C1,Sheet1!R2C1:R16C1,MOD(RC1+2,3)+MOD(INT((RC1+2)/3),3)*5+3,FALSE)&"|"&HLOOKUP(Sheet1!R2C1,Sheet1!R2C1:R16C1,MOD(RC1+3,3)+MOD(INT((RC1+3)/3),3)*5+3,FALSE) -> 103|104|132|133|134 | J71: =HLOOKUP(Sheet1!R2C1,Sheet1!R2C1:R16C1,MOD(RC1-1,3)+MOD(INT((RC1-1)/3),3)*5+3,FALSE)&"|"&HLOOKUP(Sheet1!R2C1,Sheet1!R2C1:R16C1,MOD(RC1,3)+MOD(INT((RC1)/3),3)*5+3,FALSE)&"|"&HLOOKUP(Sheet1!R2C1,Sheet1!R2C1:R16C1,MOD(RC1+1,3)+MOD(INT((RC1+1)/3),3)*5+3,FALSE)&"|"&HLOOKUP(Sheet1!R2C1,Sheet1!R2C1:R16C1,MOD(RC1+2,3)+MOD(INT((RC1+2)/3),3)*5+3,FALSE)&"|"&HLOOKUP(Sheet1!R2C1,Sheet1!R2C1:R16C1,MOD(RC1+3,3)+MOD(INT((RC1+3)/3),3)*5+3,FALSE) -> 103|104|132|133|134 | K71: =HLOOKUP(Sheet1!R2C1,Sheet1!R2C1:R16C1,MOD(RC1-1,3)+MOD(INT((RC1-1)/3),3)*5+3,FALSE)&"|"&HLOOKUP(Sheet1!R2C1,Sheet1!R2C1:R16C1,MOD(RC1,3)+MOD(INT((RC1)/3),3)*5+3,FALSE)&"|"&HLOOKUP(Sheet1!R2C1,Sheet1!R2C1:R16C1,MOD(RC1+1,3)+MOD(INT((RC1+1)/3),3)*5+3,FALSE)&"|"&HLOOKUP(Sheet1!R2C1,Sheet1!R2C1:R16C1,MOD(RC1+2,3)+MOD(INT((RC1+2)/3),3)*5+3,FALSE)&"|"&HLOOKUP(Sheet1!R2C1,Sheet1!R2C1:R16C1,MOD(RC1+3,3)+MOD(INT((RC1+3)/3),3)*5+3,FALSE) -> 103|104|132|133|134 | L71: 25|22|23|24 | M71: 109319|109319|109320|109320 | N71: 10030|10031|10032|10033|10030|10031|10032|10033|10030|10031|10032|10033|10030|10031|10032|10033|10030|10031|10032|10033|10030|10031|10032|10033|10030|10031|10032|10033|10030|10031|10032|10033|10030|10031|10032|10033|10030|10031|10032|10033 | O71: 1|1|1|1|1|1|1|1|1|1|1|1|1|1|1|1|1|1|1|1|1|1|1|1|1|1|1|1|1|1|1|1|1|1|1|1|1|1|1|1 | P71: 2500|2500|2500|2500|2500|2500|2500|2500|2500|2500|2500|2500|2500|2500|2500|2500|2500|2500|2500|2500|2500|2500|2500|2500|2500|2500|2500|2500|2500|2500|2500|2500|2500|2500|2500|2500|2500|2500|2500|2500
A72: 66 | B72: 64 | C72: 30 | D72: =R[-20]C+2 -> 26 | E72: 1000 | F72: =MOD(RC[-5]-1,3)*30+100&"|"&MOD(RC[-5]-1,3)*30+101&"|"&MOD(RC[-5]-1,3)*30+102&"|"&MOD(RC[-5]-1,3)*30+103&"|"&IF(MOD(RC[-5],4)=0,HLOOKUP(Sheet1!R2C10,Sheet1!R2C10:R7C10,MOD(RC[-5]/4-1,6)+1,FALSE),IF(MOD(RC[-5],2)=0,IF(RC[-5]>20,HLOOKUP(Sheet1!R2C7,Sheet1!R2C7:R43C7,MOD(RC[-5]/2-1,42)+1,FALSE),HLOOKUP(Sheet1!R2C4,Sheet1!R2C4:R7C4,MOD(RC[-5]-1,6)+1,FALSE)),MOD(RC[-5]-1,3)*30+104)) -> 160|161|162|163|176 | G72: =HLOOKUP(Sheet1!R2C1,Sheet1!R2C1:R16C1,MOD(RC1-1,2)+MOD(INT((RC1-1)/2),3)*5+1,FALSE)&"|"&HLOOKUP(Sheet1!R2C1,Sheet1!R2C1:R16C1,MOD(RC1,2)+MOD(INT((RC1)/2),3)*5+1,FALSE)&"|"&HLOOKUP(Sheet1!R2C1,Sheet1!R2C1:R16C1,MOD(RC1+1,2)+MOD(INT((RC1+1)/2),3)*5+1,FALSE)&"|"&HLOOKUP(Sheet1!R2C1,Sheet1!R2C1:R16C1,MOD(RC1+2,2)+MOD(INT((RC1+2)/2),3)*5+1,FALSE)&"|"&HLOOKUP(Sheet1!R2C1,Sheet1!R2C1:R16C1,MOD(RC1+3,2)+MOD(INT((RC1+3)/2),3)*5+1,FALSE) -> 161|100|101|130|131 | H72: =HLOOKUP(Sheet1!R2C1,Sheet1!R2C1:R16C1,MOD(RC1+2,2)+MOD(INT((RC1+2)/2),3)*5+1,FALSE)&"|"&HLOOKUP(Sheet1!R2C1,Sheet1!R2C1:R16C1,MOD(RC1+3,2)+MOD(INT((RC1+3)/2),3)*5+1,FALSE)&"|"&HLOOKUP(Sheet1!R2C1,Sheet1!R2C1:R16C1,MOD(RC1+4,2)+MOD(INT((RC1+4)/2),3)*5+1,FALSE)&"|"&HLOOKUP(Sheet1!R2C1,Sheet1!R2C1:R16C1,MOD(RC1+5,2)+MOD(INT((RC1+5)/2),3)*5+1,FALSE)&"|"&HLOOKUP(Sheet1!R2C1,Sheet1!R2C1:R16C1,MOD(RC1+6,2)+MOD(INT((RC1+6)/2),3)*5+1,FALSE) -> 130|131|160|161|100 | I72: =HLOOKUP(Sheet1!R2C1,Sheet1!R2C1:R16C1,MOD(RC1-1,3)+MOD(INT((RC1-1)/3),3)*5+3,FALSE)&"|"&HLOOKUP(Sheet1!R2C1,Sheet1!R2C1:R16C1,MOD(RC1,3)+MOD(INT((RC1)/3),3)*5+3,FALSE)&"|"&HLOOKUP(Sheet1!R2C1,Sheet1!R2C1:R16C1,MOD(RC1+1,3)+MOD(INT((RC1+1)/3),3)*5+3,FALSE)&"|"&HLOOKUP(Sheet1!R2C1,Sheet1!R2C1:R16C1,MOD(RC1+2,3)+MOD(INT((RC1+2)/3),3)*5+3,FALSE)&"|"&HLOOKUP(Sheet1!R2C1,Sheet1!R2C1:R16C1,MOD(RC1+3,3)+MOD(INT((RC1+3)/3),3)*5+3,FALSE) -> 104|132|133|134|162 | J72: =HLOOKUP(Sheet1!R2C1,Sheet1!R2C1:R16C1,MOD(RC1-1,3)+MOD(INT((RC1-1)/3),3)*5+3,FALSE)&"|"&HLOOKUP(Sheet1!R2C1,Sheet1!R2C1:R16C1,MOD(RC1,3)+MOD(INT((RC1)/3),3)*5+3,FALSE)&"|"&HLOOKUP(Sheet1!R2C1,Sheet1!R2C1:R16C1,MOD(RC1+1,3)+MOD(INT((RC1+1)/3),3)*5+3,FALSE)&"|"&HLOOKUP(Sheet1!R2C1,Sheet1!R2C1:R16C1,MOD(RC1+2,3)+MOD(INT((RC1+2)/3),3)*5+3,FALSE)&"|"&HLOOKUP(Sheet1!R2C1,Sheet1!R2C1:R16C1,MOD(RC1+3,3)+MOD(INT((RC1+3)/3),3)*5+3,FALSE) -> 104|132|133|134|162 | K72: =HLOOKUP(Sheet1!R2C1,Sheet1!R2C1:R16C1,MOD(RC1-1,3)+MOD(INT((RC1-1)/3),3)*5+3,FALSE)&"|"&HLOOKUP(Sheet1!R2C1,Sheet1!R2C1:R16C1,MOD(RC1,3)+MOD(INT((RC1)/3),3)*5+3,FALSE)&"|"&HLOOKUP(Sheet1!R2C1,Sheet1!R2C1:R16C1,MOD(RC1+1,3)+MOD(INT((RC1+1)/3),3)*5+3,FALSE)&"|"&HLOOKUP(Sheet1!R2C1,Sheet1!R2C1:R16C1,MOD(RC1+2,3)+MOD(INT((RC1+2)/3),3)*5+3,FALSE)&"|"&HLOOKUP(Sheet1!R2C1,Sheet1!R2C1:R16C1,MOD(RC1+3,3)+MOD(INT((RC1+3)/3),3)*5+3,FALSE) -> 104|132|133|134|162 | L72: 25|22|23|24 | M72: 112830|112830|112830|112830 | N72: 10030|10031|10032|10033 | O72: 1|1|1|1 | P72: 2500|2500|2500|2500
A73: 67 | B73: 65 | C73: 30 | D73: =R[-20]C+2 -> 26 | E73: 1000 | F73: =MOD(RC[-5]-1,3)*30+100&"|"&MOD(RC[-5]-1,3)*30+101&"|"&MOD(RC[-5]-1,3)*30+102&"|"&MOD(RC[-5]-1,3)*30+103&"|"&IF(MOD(RC[-5],4)=0,HLOOKUP(Sheet1!R2C10,Sheet1!R2C10:R7C10,MOD(RC[-5]/4-1,6)+1,FALSE),IF(MOD(RC[-5],2)=0,IF(RC[-5]>20,HLOOKUP(Sheet1!R2C7,Sheet1!R2C7:R43C7,MOD(RC[-5]/2-1,42)+1,FALSE),HLOOKUP(Sheet1!R2C4,Sheet1!R2C4:R7C4,MOD(RC[-5]-1,6)+1,FALSE)),MOD(RC[-5]-1,3)*30+104)) -> 100|101|102|103|104 | G73: =HLOOKUP(Sheet1!R2C1,Sheet1!R2C1:R16C1,MOD(RC1-1,2)+MOD(INT((RC1-1)/2),3)*5+1,FALSE)&"|"&HLOOKUP(Sheet1!R2C1,Sheet1!R2C1:R16C1,MOD(RC1,2)+MOD(INT((RC1)/2),3)*5+1,FALSE)&"|"&HLOOKUP(Sheet1!R2C1,Sheet1!R2C1:R16C1,MOD(RC1+1,2)+MOD(INT((RC1+1)/2),3)*5+1,FALSE)&"|"&HLOOKUP(Sheet1!R2C1,Sheet1!R2C1:R16C1,MOD(RC1+2,2)+MOD(INT((RC1+2)/2),3)*5+1,FALSE)&"|"&HLOOKUP(Sheet1!R2C1,Sheet1!R2C1:R16C1,MOD(RC1+3,2)+MOD(INT((RC1+3)/2),3)*5+1,FALSE) -> 100|101|130|131|160 | H73: =HLOOKUP(Sheet1!R2C1,Sheet1!R2C1:R16C1,MOD(RC1+2,2)+MOD(INT((RC1+2)/2),3)*5+1,FALSE)&"|"&HLOOKUP(Sheet1!R2C1,Sheet1!R2C1:R16C1,MOD(RC1+3,2)+MOD(INT((RC1+3)/2),3)*5+1,FALSE)&"|"&HLOOKUP(Sheet1!R2C1,Sheet1!R2C1:R16C1,MOD(RC1+4,2)+MOD(INT((RC1+4)/2),3)*5+1,FALSE)&"|"&HLOOKUP(Sheet1!R2C1,Sheet1!R2C1:R16C1,MOD(RC1+5,2)+MOD(INT((RC1+5)/2),3)*5+1,FALSE)&"|"&HLOOKUP(Sheet1!R2C1,Sheet1!R2C1:R16C1,MOD(RC1+6,2)+MOD(INT((RC1+6)/2),3)*5+1,FALSE) -> 131|160|161|100|101 | I73: =HLOOKUP(Sheet1!R2C1,Sheet1!R2C1:R16C1,MOD(RC1-1,3)+MOD(INT((RC1-1)/3),3)*5+3,FALSE)&"|"&HLOOKUP(Sheet1!R2C1,Sheet1!R2C1:R16C1,MOD(RC1,3)+MOD(INT((RC1)/3),3)*5+3,FALSE)&"|"&HLOOKUP(Sheet1!R2C1,Sheet1!R2C1:R16C1,MOD(RC1+1,3)+MOD(INT((RC1+1)/3),3)*5+3,FALSE)&"|"&HLOOKUP(Sheet1!R2C1,Sheet1!R2C1:R16C1,MOD(RC1+2,3)+MOD(INT((RC1+2)/3),3)*5+3,FALSE)&"|"&HLOOKUP(Sheet1!R2C1,Sheet1!R2C1:R16C1,MOD(RC1+3,3)+MOD(INT((RC1+3)/3),3)*5+3,FALSE) -> 132|133|134|162|163 | J73: =HLOOKUP(Sheet1!R2C1,Sheet1!R2C1:R16C1,MOD(RC1-1,3)+MOD(INT((RC1-1)/3),3)*5+3,FALSE)&"|"&HLOOKUP(Sheet1!R2C1,Sheet1!R2C1:R16C1,MOD(RC1,3)+MOD(INT((RC1)/3),3)*5+3,FALSE)&"|"&HLOOKUP(Sheet1!R2C1,Sheet1!R2C1:R16C1,MOD(RC1+1,3)+MOD(INT((RC1+1)/3),3)*5+3,FALSE)&"|"&HLOOKUP(Sheet1!R2C1,Sheet1!R2C1:R16C1,MOD(RC1+2,3)+MOD(INT((RC1+2)/3),3)*5+3,FALSE)&"|"&HLOOKUP(Sheet1!R2C1,Sheet1!R2C1:R16C1,MOD(RC1+3,3)+MOD(INT((RC1+3)/3),3)*5+3,FALSE) -> 132|133|134|162|163 | K73: =HLOOKUP(Sheet1!R2C1,Sheet1!R2C1:R16C1,MOD(RC1-1,3)+MOD(INT((RC1-1)/3),3)*5+3,FALSE)&"|"&HLOOKUP(Sheet1!R2C1,Sheet1!R2C1:R16C1,MOD(RC1,3)+MOD(INT((RC1)/3),3)*5+3,FALSE)&"|"&HLOOKUP(Sheet1!R2C1,Sheet1!R2C1:R16C1,MOD(RC1+1,3)+MOD(INT((RC1+1)/3),3)*5+3,FALSE)&"|"&HLOOKUP(Sheet1!R2C1,Sheet1!R2C1:R16C1,MOD(RC1+2,3)+MOD(INT((RC1+2)/3),3)*5+3,FALSE)&"|"&HLOOKUP(Sheet1!R2C1,Sheet1!R2C1:R16C1,MOD(RC1+3,3)+MOD(INT((RC1+3)/3),3)*5+3,FALSE) -> 132|133|134|162|163 | L73: 25|22|23|24 | M73: 116445|116445|116445|116445 | N73: 10030|10031|10032|10033 | O73: 1|1|1|1 | P73: 2500|2500|2500|2500
A74: 68 | B74: 66 | C74: 30 | D74: =R[-20]C+2 -> 26 | E74: 1000 | F74: =MOD(RC[-5]-1,3)*30+100&"|"&MOD(RC[-5]-1,3)*30+101&"|"&MOD(RC[-5]-1,3)*30+102&"|"&MOD(RC[-5]-1,3)*30+103&"|"&IF(MOD(RC[-5],4)=0,HLOOKUP(Sheet1!R2C10,Sheet1!R2C10:R7C10,MOD(RC[-5]/4-1,6)+1,FALSE),IF(MOD(RC[-5],2)=0,IF(RC[-5]>20,HLOOKUP(Sheet1!R2C7,Sheet1!R2C7:R43C7,MOD(RC[-5]/2-1,42)+1,FALSE),HLOOKUP(Sheet1!R2C4,Sheet1!R2C4:R7C4,MOD(RC[-5]-1,6)+1,FALSE)),MOD(RC[-5]-1,3)*30+104)) -> 130|131|132|133|194 | G74: =HLOOKUP(Sheet1!R2C1,Sheet1!R2C1:R16C1,MOD(RC1-1,2)+MOD(INT((RC1-1)/2),3)*5+1,FALSE)&"|"&HLOOKUP(Sheet1!R2C1,Sheet1!R2C1:R16C1,MOD(RC1,2)+MOD(INT((RC1)/2),3)*5+1,FALSE)&"|"&HLOOKUP(Sheet1!R2C1,Sheet1!R2C1:R16C1,MOD(RC1+1,2)+MOD(INT((RC1+1)/2),3)*5+1,FALSE)&"|"&HLOOKUP(Sheet1!R2C1,Sheet1!R2C1:R16C1,MOD(RC1+2,2)+MOD(INT((RC1+2)/2),3)*5+1,FALSE)&"|"&HLOOKUP(Sheet1!R2C1,Sheet1!R2C1:R16C1,MOD(RC1+3,2)+MOD(INT((RC1+3)/2),3)*5+1,FALSE) -> 101|130|131|160|161 | H74: =HLOOKUP(Sheet1!R2C1,Sheet1!R2C1:R16C1,MOD(RC1+2,2)+MOD(INT((RC1+2)/2),3)*5+1,FALSE)&"|"&HLOOKUP(Sheet1!R2C1,Sheet1!R2C1:R16C1,MOD(RC1+3,2)+MOD(INT((RC1+3)/2),3)*5+1,FALSE)&"|"&HLOOKUP(Sheet1!R2C1,Sheet1!R2C1:R16C1,MOD(RC1+4,2)+MOD(INT((RC1+4)/2),3)*5+1,FALSE)&"|"&HLOOKUP(Sheet1!R2C1,Sheet1!R2C1:R16C1,MOD(RC1+5,2)+MOD(INT((RC1+5)/2),3)*5+1,FALSE)&"|"&HLOOKUP(Sheet1!R2C1,Sheet1!R2C1:R16C1,MOD(RC1+6,2)+MOD(INT((RC1+6)/2),3)*5+1,FALSE) -> 160|161|100|101|130 | I74: =HLOOKUP(Sheet1!R2C1,Sheet1!R2C1:R16C1,MOD(RC1-1,3)+MOD(INT((RC1-1)/3),3)*5+3,FALSE)&"|"&HLOOKUP(Sheet1!R2C1,Sheet1!R2C1:R16C1,MOD(RC1,3)+MOD(INT((RC1)/3),3)*5+3,FALSE)&"|"&HLOOKUP(Sheet1!R2C1,Sheet1!R2C1:R16C1,MOD(RC1+1,3)+MOD(INT((RC1+1)/3),3)*5+3,FALSE)&"|"&HLOOKUP(Sheet1!R2C1,Sheet1!R2C1:R16C1,MOD(RC1+2,3)+MOD(INT((RC1+2)/3),3)*5+3,FALSE)&"|"&HLOOKUP(Sheet1!R2C1,Sheet1!R2C1:R16C1,MOD(RC1+3,3)+MOD(INT((RC1+3)/3),3)*5+3,FALSE) -> 133|134|162|163|164 | J74: =HLOOKUP(Sheet1!R2C1,Sheet1!R2C1:R16C1,MOD(RC1-1,3)+MOD(INT((RC1-1)/3),3)*5+3,FALSE)&"|"&HLOOKUP(Sheet1!R2C1,Sheet1!R2C1:R16C1,MOD(RC1,3)+MOD(INT((RC1)/3),3)*5+3,FALSE)&"|"&HLOOKUP(Sheet1!R2C1,Sheet1!R2C1:R16C1,MOD(RC1+1,3)+MOD(INT((RC1+1)/3),3)*5+3,FALSE)&"|"&HLOOKUP(Sheet1!R2C1,Sheet1!R2C1:R16C1,MOD(RC1+2,3)+MOD(INT((RC1+2)/3),3)*5+3,FALSE)&"|"&HLOOKUP(Sheet1!R2C1,Sheet1!R2C1:R16C1,MOD(RC1+3,3)+MOD(INT((RC1+3)/3),3)*5+3,FALSE) -> 133|134|162|163|164 | K74: =HLOOKUP(Sheet1!R2C1,Sheet1!R2C1:R16C1,MOD(RC1-1,3)+MOD(INT((RC1-1)/3),3)*5+3,FALSE)&"|"&HLOOKUP(Sheet1!R2C1,Sheet1!R2C1:R16C1,MOD(RC1,3)+MOD(INT((RC1)/3),3)*5+3,FALSE)&"|"&HLOOKUP(Sheet1!R2C1,Sheet1!R2C1:R16C1,MOD(RC1+1,3)+MOD(INT((RC1+1)/3),3)*5+3,FALSE)&"|"&HLOOKUP(Sheet1!R2C1,Sheet1!R2C1:R16C1,MOD(RC1+2,3)+MOD(INT((RC1+2)/3),3)*5+3,FALSE)&"|"&HLOOKUP(Sheet1!R2C1,Sheet1!R2C1:R16C1,MOD(RC1+3,3)+MOD(INT((RC1+3)/3),3)*5+3,FALSE) -> 133|134|162|163|164 | L74: 25|22|23|24 | M74: 119548|119548|119548|119548 | N74: 10030|10031|10032|10033 | O74: 1|1|1|1 | P74: 2500|2500|2500|2500
A75: 69 | B75: 67 | C75: 30 | D75: =R[-20]C+2 -> 26 | E75: 1000 | F75: =MOD(RC[-5]-1,3)*30+100&"|"&MOD(RC[-5]-1,3)*30+101&"|"&MOD(RC[-5]-1,3)*30+102&"|"&MOD(RC[-5]-1,3)*30+103&"|"&IF(MOD(RC[-5],4)=0,HLOOKUP(Sheet1!R2C10,Sheet1!R2C10:R7C10,MOD(RC[-5]/4-1,6)+1,FALSE),IF(MOD(RC[-5],2)=0,IF(RC[-5]>20,HLOOKUP(Sheet1!R2C7,Sheet1!R2C7:R43C7,MOD(RC[-5]/2-1,42)+1,FALSE),HLOOKUP(Sheet1!R2C4,Sheet1!R2C4:R7C4,MOD(RC[-5]-1,6)+1,FALSE)),MOD(RC[-5]-1,3)*30+104)) -> 160|161|162|163|164 | G75: =HLOOKUP(Sheet1!R2C1,Sheet1!R2C1:R16C1,MOD(RC1-1,2)+MOD(INT((RC1-1)/2),3)*5+1,FALSE)&"|"&HLOOKUP(Sheet1!R2C1,Sheet1!R2C1:R16C1,MOD(RC1,2)+MOD(INT((RC1)/2),3)*5+1,FALSE)&"|"&HLOOKUP(Sheet1!R2C1,Sheet1!R2C1:R16C1,MOD(RC1+1,2)+MOD(INT((RC1+1)/2),3)*5+1,FALSE)&"|"&HLOOKUP(Sheet1!R2C1,Sheet1!R2C1:R16C1,MOD(RC1+2,2)+MOD(INT((RC1+2)/2),3)*5+1,FALSE)&"|"&HLOOKUP(Sheet1!R2C1,Sheet1!R2C1:R16C1,MOD(RC1+3,2)+MOD(INT((RC1+3)/2),3)*5+1,FALSE) -> 130|131|160|161|100 | H75: =HLOOKUP(Sheet1!R2C1,Sheet1!R2C1:R16C1,MOD(RC1+2,2)+MOD(INT((RC1+2)/2),3)*5+1,FALSE)&"|"&HLOOKUP(Sheet1!R2C1,Sheet1!R2C1:R16C1,MOD(RC1+3,2)+MOD(INT((RC1+3)/2),3)*5+1,FALSE)&"|"&HLOOKUP(Sheet1!R2C1,Sheet1!R2C1:R16C1,MOD(RC1+4,2)+MOD(INT((RC1+4)/2),3)*5+1,FALSE)&"|"&HLOOKUP(Sheet1!R2C1,Sheet1!R2C1:R16C1,MOD(RC1+5,2)+MOD(INT((RC1+5)/2),3)*5+1,FALSE)&"|"&HLOOKUP(Sheet1!R2C1,Sheet1!R2C1:R16C1,MOD(RC1+6,2)+MOD(INT((RC1+6)/2),3)*5+1,FALSE) -> 161|100|101|130|131 | I75: =HLOOKUP(Sheet1!R2C1,Sheet1!R2C1:R16C1,MOD(RC1-1,3)+MOD(INT((RC1-1)/3),3)*5+3,FALSE)&"|"&HLOOKUP(Sheet1!R2C1,Sheet1!R2C1:R16C1,MOD(RC1,3)+MOD(INT((RC1)/3),3)*5+3,FALSE)&"|"&HLOOKUP(Sheet1!R2C1,Sheet1!R2C1:R16C1,MOD(RC1+1,3)+MOD(INT((RC1+1)/3),3)*5+3,FALSE)&"|"&HLOOKUP(Sheet1!R2C1,Sheet1!R2C1:R16C1,MOD(RC1+2,3)+MOD(INT((RC1+2)/3),3)*5+3,FALSE)&"|"&HLOOKUP(Sheet1!R2C1,Sheet1!R2C1:R16C1,MOD(RC1+3,3)+MOD(INT((RC1+3)/3),3)*5+3,FALSE) -> 134|162|163|164|102 | J75: =HLOOKUP(Sheet1!R2C1,Sheet1!R2C1:R16C1,MOD(RC1-1,3)+MOD(INT((RC1-1)/3),3)*5+3,FALSE)&"|"&HLOOKUP(Sheet1!R2C1,Sheet1!R2C1:R16C1,MOD(RC1,3)+MOD(INT((RC1)/3),3)*5+3,FALSE)&"|"&HLOOKUP(Sheet1!R2C1,Sheet1!R2C1:R16C1,MOD(RC1+1,3)+MOD(INT((RC1+1)/3),3)*5+3,FALSE)&"|"&HLOOKUP(Sheet1!R2C1,Sheet1!R2C1:R16C1,MOD(RC1+2,3)+MOD(INT((RC1+2)/3),3)*5+3,FALSE)&"|"&HLOOKUP(Sheet1!R2C1,Sheet1!R2C1:R16C1,MOD(RC1+3,3)+MOD(INT((RC1+3)/3),3)*5+3,FALSE) -> 134|162|163|164|102 | K75: =HLOOKUP(Sheet1!R2C1,Sheet1!R2C1:R16C1,MOD(RC1-1,3)+MOD(INT((RC1-1)/3),3)*5+3,FALSE)&"|"&HLOOKUP(Sheet1!R2C1,Sheet1!R2C1:R16C1,MOD(RC1,3)+MOD(INT((RC1)/3),3)*5+3,FALSE)&"|"&HLOOKUP(Sheet1!R2C1,Sheet1!R2C1:R16C1,MOD(RC1+1,3)+MOD(INT((RC1+1)/3),3)*5+3,FALSE)&"|"&HLOOKUP(Sheet1!R2C1,Sheet1!R2C1:R16C1,MOD(RC1+2,3)+MOD(INT((RC1+2)/3),3)*5+3,FALSE)&"|"&HLOOKUP(Sheet1!R2C1,Sheet1!R2C1:R16C1,MOD(RC1+3,3)+MOD(INT((RC1+3)/3),3)*5+3,FALSE) -> 134|162|163|164|102 | L75: 25|22|23|24 | M75: 122567|122566|122568|122568 | N75: 10030|10031|10032|10033 | O75: 1|1|1|1 | P75: 2500|2500|2500|2500
A76: 70 | B76: 68 | C76: 30 | D76: =R[-20]C+2 -> 26 | E76: 1000 | F76: =MOD(RC[-5]-1,3)*30+100&"|"&MOD(RC[-5]-1,3)*30+101&"|"&MOD(RC[-5]-1,3)*30+102&"|"&MOD(RC[-5]-1,3)*30+103&"|"&IF(MOD(RC[-5],4)=0,HLOOKUP(Sheet1!R2C10,Sheet1!R2C10:R7C10,MOD(RC[-5]/4-1,6)+1,FALSE),IF(MOD(RC[-5],2)=0,IF(RC[-5]>20,HLOOKUP(Sheet1!R2C7,Sheet1!R2C7:R43C7,MOD(RC[-5]/2-1,42)+1,FALSE),HLOOKUP(Sheet1!R2C4,Sheet1!R2C4:R7C4,MOD(RC[-5]-1,6)+1,FALSE)),MOD(RC[-5]-1,3)*30+104)) -> 100|101|102|103|178 | G76: =HLOOKUP(Sheet1!R2C1,Sheet1!R2C1:R16C1,MOD(RC1-1,2)+MOD(INT((RC1-1)/2),3)*5+1,FALSE)&"|"&HLOOKUP(Sheet1!R2C1,Sheet1!R2C1:R16C1,MOD(RC1,2)+MOD(INT((RC1)/2),3)*5+1,FALSE)&"|"&HLOOKUP(Sheet1!R2C1,Sheet1!R2C1:R16C1,MOD(RC1+1,2)+MOD(INT((RC1+1)/2),3)*5+1,FALSE)&"|"&HLOOKUP(Sheet1!R2C1,Sheet1!R2C1:R16C1,MOD(RC1+2,2)+MOD(INT((RC1+2)/2),3)*5+1,FALSE)&"|"&HLOOKUP(Sheet1!R2C1,Sheet1!R2C1:R16C1,MOD(RC1+3,2)+MOD(INT((RC1+3)/2),3)*5+1,FALSE) -> 131|160|161|100|101 | H76: =HLOOKUP(Sheet1!R2C1,Sheet1!R2C1:R16C1,MOD(RC1+2,2)+MOD(INT((RC1+2)/2),3)*5+1,FALSE)&"|"&HLOOKUP(Sheet1!R2C1,Sheet1!R2C1:R16C1,MOD(RC1+3,2)+MOD(INT((RC1+3)/2),3)*5+1,FALSE)&"|"&HLOOKUP(Sheet1!R2C1,Sheet1!R2C1:R16C1,MOD(RC1+4,2)+MOD(INT((RC1+4)/2),3)*5+1,FALSE)&"|"&HLOOKUP(Sheet1!R2C1,Sheet1!R2C1:R16C1,MOD(RC1+5,2)+MOD(INT((RC1+5)/2),3)*5+1,FALSE)&"|"&HLOOKUP(Sheet1!R2C1,Sheet1!R2C1:R16C1,MOD(RC1+6,2)+MOD(INT((RC1+6)/2),3)*5+1,FALSE) -> 100|101|130|131|160 | I76: =HLOOKUP(Sheet1!R2C1,Sheet1!R2C1:R16C1,MOD(RC1-1,3)+MOD(INT((RC1-1)/3),3)*5+3,FALSE)&"|"&HLOOKUP(Sheet1!R2C1,Sheet1!R2C1:R16C1,MOD(RC1,3)+MOD(INT((RC1)/3),3)*5+3,FALSE)&"|"&HLOOKUP(Sheet1!R2C1,Sheet1!R2C1:R16C1,MOD(RC1+1,3)+MOD(INT((RC1+1)/3),3)*5+3,FALSE)&"|"&HLOOKUP(Sheet1!R2C1,Sheet1!R2C1:R16C1,MOD(RC1+2,3)+MOD(INT((RC1+2)/3),3)*5+3,FALSE)&"|"&HLOOKUP(Sheet1!R2C1,Sheet1!R2C1:R16C1,MOD(RC1+3,3)+MOD(INT((RC1+3)/3),3)*5+3,FALSE) -> 162|163|164|102|103 | J76: =HLOOKUP(Sheet1!R2C1,Sheet1!R2C1:R16C1,MOD(RC1-1,3)+MOD(INT((RC1-1)/3),3)*5+3,FALSE)&"|"&HLOOKUP(Sheet1!R2C1,Sheet1!R2C1:R16C1,MOD(RC1,3)+MOD(INT((RC1)/3),3)*5+3,FALSE)&"|"&HLOOKUP(Sheet1!R2C1,Sheet1!R2C1:R16C1,MOD(RC1+1,3)+MOD(INT((RC1+1)/3),3)*5+3,FALSE)&"|"&HLOOKUP(Sheet1!R2C1,Sheet1!R2C1:R16C1,MOD(RC1+2,3)+MOD(INT((RC1+2)/3),3)*5+3,FALSE)&"|"&HLOOKUP(Sheet1!R2C1,Sheet1!R2C1:R16C1,MOD(RC1+3,3)+MOD(INT((RC1+3)/3),3)*5+3,FALSE) -> 162|163|164|102|103 | K76: =HLOOKUP(Sheet1!R2C1,Sheet1!R2C1:R16C1,MOD(RC1-1,3)+MOD(INT((RC1-1)/3),3)*5+3,FALSE)&"|"&HLOOKUP(Sheet1!R2C1,Sheet1!R2C1:R16C1,MOD(RC1,3)+MOD(INT((RC1)/3),3)*5+3,FALSE)&"|"&HLOOKUP(Sheet1!R2C1,Sheet1!R2C1:R16C1,MOD(RC1+1,3)+MOD(INT((RC1+1)/3),3)*5+3,FALSE)&"|"&HLOOKUP(Sheet1!R2C1,Sheet1!R2C1:R16C1,MOD(RC1+2,3)+MOD(INT((RC1+2)/3),3)*5+3,FALSE)&"|"&HLOOKUP(Sheet1!R2C1,Sheet1!R2C1:R16C1,MOD(RC1+3,3)+MOD(INT((RC1+3)/3),3)*5+3,FALSE) -> 162|163|164|102|103 | L76: 25|22|23|24 | M76: 125499|125499|125500|125500 | N76: 10030|10031|10032|10033|10030|10031|10032|10033|10030|10031|10032|10033|10030|10031|10032|10033|10030|10031|10032|10033|10030|10031|10032|10033|10030|10031|10032|10033|10030|10031|10032|10033|10030|10031|10032|10033|10030|10031|10032|10033 | O76: 1|1|1|1|1|1|1|1|1|1|1|1|1|1|1|1|1|1|1|1|1|1|1|1|1|1|1|1|1|1|1|1|1|1|1|1|1|1|1|1 | P76: 2500|2500|2500|2500|2500|2500|2500|2500|2500|2500|2500|2500|2500|2500|2500|2500|2500|2500|2500|2500|2500|2500|2500|2500|2500|2500|2500|2500|2500|2500|2500|2500|2500|2500|2500|2500|2500|2500|2500|2500
A77: 71 | B77: 69 | C77: 30 | D77: =R[-20]C+2 -> 26 | E77: 1000 | F77: =MOD(RC[-5]-1,3)*30+100&"|"&MOD(RC[-5]-1,3)*30+101&"|"&MOD(RC[-5]-1,3)*30+102&"|"&MOD(RC[-5]-1,3)*30+103&"|"&IF(MOD(RC[-5],4)=0,HLOOKUP(Sheet1!R2C10,Sheet1!R2C10:R7C10,MOD(RC[-5]/4-1,6)+1,FALSE),IF(MOD(RC[-5],2)=0,IF(RC[-5]>20,HLOOKUP(Sheet1!R2C7,Sheet1!R2C7:R43C7,MOD(RC[-5]/2-1,42)+1,FALSE),HLOOKUP(Sheet1!R2C4,Sheet1!R2C4:R7C4,MOD(RC[-5]-1,6)+1,FALSE)),MOD(RC[-5]-1,3)*30+104)) -> 130|131|132|133|134 | G77: =HLOOKUP(Sheet1!R2C1,Sheet1!R2C1:R16C1,MOD(RC1-1,2)+MOD(INT((RC1-1)/2),3)*5+1,FALSE)&"|"&HLOOKUP(Sheet1!R2C1,Sheet1!R2C1:R16C1,MOD(RC1,2)+MOD(INT((RC1)/2),3)*5+1,FALSE)&"|"&HLOOKUP(Sheet1!R2C1,Sheet1!R2C1:R16C1,MOD(RC1+1,2)+MOD(INT((RC1+1)/2),3)*5+1,FALSE)&"|"&HLOOKUP(Sheet1!R2C1,Sheet1!R2C1:R16C1,MOD(RC1+2,2)+MOD(INT((RC1+2)/2),3)*5+1,FALSE)&"|"&HLOOKUP(Sheet1!R2C1,Sheet1!R2C1:R16C1,MOD(RC1+3,2)+MOD(INT((RC1+3)/2),3)*5+1,FALSE) -> 160|161|100|101|130 | H77: =HLOOKUP(Sheet1!R2C1,Sheet1!R2C1:R16C1,MOD(RC1+2,2)+MOD(INT((RC1+2)/2),3)*5+1,FALSE)&"|"&HLOOKUP(Sheet1!R2C1,Sheet1!R2C1:R16C1,MOD(RC1+3,2)+MOD(INT((RC1+3)/2),3)*5+1,FALSE)&"|"&HLOOKUP(Sheet1!R2C1,Sheet1!R2C1:R16C1,MOD(RC1+4,2)+MOD(INT((RC1+4)/2),3)*5+1,FALSE)&"|"&HLOOKUP(Sheet1!R2C1,Sheet1!R2C1:R16C1,MOD(RC1+5,2)+MOD(INT((RC1+5)/2),3)*5+1,FALSE)&"|"&HLOOKUP(Sheet1!R2C1,Sheet1!R2C1:R16C1,MOD(RC1+6,2)+MOD(INT((RC1+6)/2),3)*5+1,FALSE) -> 101|130|131|160|161 | I77: =HLOOKUP(Sheet1!R2C1,Sheet1!R2C1:R16C1,MOD(RC1-1,3)+MOD(INT((RC1-1)/3),3)*5+3,FALSE)&"|"&HLOOKUP(Sheet1!R2C1,Sheet1!R2C1:R16C1,MOD(RC1,3)+MOD(INT((RC1)/3),3)*5+3,FALSE)&"|"&HLOOKUP(Sheet1!R2C1,Sheet1!R2C1:R16C1,MOD(RC1+1,3)+MOD(INT((RC1+1)/3),3)*5+3,FALSE)&"|"&HLOOKUP(Sheet1!R2C1,Sheet1!R2C1:R16C1,MOD(RC1+2,3)+MOD(INT((RC1+2)/3),3)*5+3,FALSE)&"|"&HLOOKUP(Sheet1!R2C1,Sheet1!R2C1:R16C1,MOD(RC1+3,3)+MOD(INT((RC1+3)/3),3)*5+3,FALSE) -> 163|164|102|103|104 | J77: =HLOOKUP(Sheet1!R2C1,Sheet1!R2C1:R16C1,MOD(RC1-1,3)+MOD(INT((RC1-1)/3),3)*5+3,FALSE)&"|"&HLOOKUP(Sheet1!R2C1,Sheet1!R2C1:R16C1,MOD(RC1,3)+MOD(INT((RC1)/3),3)*5+3,FALSE)&"|"&HLOOKUP(Sheet1!R2C1,Sheet1!R2C1:R16C1,MOD(RC1+1,3)+MOD(INT((RC1+1)/3),3)*5+3,FALSE)&"|"&HLOOKUP(Sheet1!R2C1,Sheet1!R2C1:R16C1,MOD(RC1+2,3)+MOD(INT((RC1+2)/3),3)*5+3,FALSE)&"|"&HLOOKUP(Sheet1!R2C1,Sheet1!R2C1:R16C1,MOD(RC1+3,3)+MOD(INT((RC1+3)/3),3)*5+3,FALSE) -> 163|164|102|103|104 | K77: =HLOOKUP(Sheet1!R2C1,Sheet1!R2C1:R16C1,MOD(RC1-1,3)+MOD(INT((RC1-1)/3),3)*5+3,FALSE)&"|"&HLOOKUP(Sheet1!R2C1,Sheet1!R2C1:R16C1,MOD(RC1,3)+MOD(INT((RC1)/3),3)*5+3,FALSE)&"|"&HLOOKUP(Sheet1!R2C1,Sheet1!R2C1:R16C1,MOD(RC1+1,3)+MOD(INT((RC1+1)/3),3)*5+3,FALSE)&"|"&HLOOKUP(Sheet1!R2C1,Sheet1!R2C1:R16C1,MOD(RC1+2,3)+MOD(INT((RC1+2)/3),3)*5+3,FALSE)&"|"&HLOOKUP(Sheet1!R2C1,Sheet1!R2C1:R16C1,MOD(RC1+3,3)+MOD(INT((RC1+3)/3),3)*5+3,FALSE) -> 163|164|102|103|104 | L77: 25|22|23|24 | M77: 129162|129163|129163|129163 | N77: 10030|10031|10032|10033 | O77: 1|1|1|1 | P77: 2500|2500|2500|2500
A78: 72 | B78: 70 | C78: 30 | D78: =R[-20]C+2 -> 26 | E78: 1000 | F78: =MOD(RC[-5]-1,3)*30+100&"|"&MOD(RC[-5]-1,3)*30+101&"|"&MOD(RC[-5]-1,3)*30+102&"|"&MOD(RC[-5]-1,3)*30+103&"|"&IF(MOD(RC[-5],4)=0,HLOOKUP(Sheet1!R2C10,Sheet1!R2C10:R7C10,MOD(RC[-5]/4-1,6)+1,FALSE),IF(MOD(RC[-5],2)=0,IF(RC[-5]>20,HLOOKUP(Sheet1!R2C7,Sheet1!R2C7:R43C7,MOD(RC[-5]/2-1,42)+1,FALSE),HLOOKUP(Sheet1!R2C4,Sheet1!R2C4:R7C4,MOD(RC[-5]-1,6)+1,FALSE)),MOD(RC[-5]-1,3)*30+104)) -> 160|161|162|163|195 | G78: =HLOOKUP(Sheet1!R2C1,Sheet1!R2C1:R16C1,MOD(RC1-1,2)+MOD(INT((RC1-1)/2),3)*5+1,FALSE)&"|"&HLOOKUP(Sheet1!R2C1,Sheet1!R2C1:R16C1,MOD(RC1,2)+MOD(INT((RC1)/2),3)*5+1,FALSE)&"|"&HLOOKUP(Sheet1!R2C1,Sheet1!R2C1:R16C1,MOD(RC1+1,2)+MOD(INT((RC1+1)/2),3)*5+1,FALSE)&"|"&HLOOKUP(Sheet1!R2C1,Sheet1!R2C1:R16C1,MOD(RC1+2,2)+MOD(INT((RC1+2)/2),3)*5+1,FALSE)&"|"&HLOOKUP(Sheet1!R2C1,Sheet1!R2C1:R16C1,MOD(RC1+3,2)+MOD(INT((RC1+3)/2),3)*5+1,FALSE) -> 161|100|101|130|131 | H78: =HLOOKUP(Sheet1!R2C1,Sheet1!R2C1:R16C1,MOD(RC1+2,2)+MOD(INT((RC1+2)/2),3)*5+1,FALSE)&"|"&HLOOKUP(Sheet1!R2C1,Sheet1!R2C1:R16C1,MOD(RC1+3,2)+MOD(INT((RC1+3)/2),3)*5+1,FALSE)&"|"&HLOOKUP(Sheet1!R2C1,Sheet1!R2C1:R16C1,MOD(RC1+4,2)+MOD(INT((RC1+4)/2),3)*5+1,FALSE)&"|"&HLOOKUP(Sheet1!R2C1,Sheet1!R2C1:R16C1,MOD(RC1+5,2)+MOD(INT((RC1+5)/2),3)*5+1,FALSE)&"|"&HLOOKUP(Sheet1!R2C1,Sheet1!R2C1:R16C1,MOD(RC1+6,2)+MOD(INT((RC1+6)/2),3)*5+1,FALSE) -> 130|131|160|161|100 | I78: =HLOOKUP(Sheet1!R2C1,Sheet1!R2C1:R16C1,MOD(RC1-1,3)+MOD(INT((RC1-1)/3),3)*5+3,FALSE)&"|"&HLOOKUP(Sheet1!R2C1,Sheet1!R2C1:R16C1,MOD(RC1,3)+MOD(INT((RC1)/3),3)*5+3,FALSE)&"|"&HLOOKUP(Sheet1!R2C1,Sheet1!R2C1:R16C1,MOD(RC1+1,3)+MOD(INT((RC1+1)/3),3)*5+3,FALSE)&"|"&HLOOKUP(Sheet1!R2C1,Sheet1!R2C1:R16C1,MOD(RC1+2,3)+MOD(INT((RC1+2)/3),3)*5+3,FALSE)&"|"&HLOOKUP(Sheet1!R2C1,Sheet1!R2C1:R16C1,MOD(RC1+3,3)+MOD(INT((RC1+3)/3),3)*5+3,FALSE) -> 164|102|103|104|132 | J78: =HLOOKUP(Sheet1!R2C1,Sheet1!R2C1:R16C1,MOD(RC1-1,3)+MOD(INT((RC1-1)/3),3)*5+3,FALSE)&"|"&HLOOKUP(Sheet1!R2C1,Sheet1!R2C1:R16C1,MOD(RC1,3)+MOD(INT((RC1)/3),3)*5+3,FALSE)&"|"&HLOOKUP(Sheet1!R2C1,Sheet1!R2C1:R16C1,MOD(RC1+1,3)+MOD(INT((RC1+1)/3),3)*5+3,FALSE)&"|"&HLOOKUP(Sheet1!R2C1,Sheet1!R2C1:R16C1,MOD(RC1+2,3)+MOD(INT((RC1+2)/3),3)*5+3,FALSE)&"|"&HLOOKUP(Sheet1!R2C1,Sheet1!R2C1:R16C1,MOD(RC1+3,3)+MOD(INT((RC1+3)/3),3)*5+3,FALSE) -> 164|102|103|104|132 | K78: =HLOOKUP(Sheet1!R2C1,Sheet1!R2C1:R16C1,MOD(RC1-1,3)+MOD(INT((RC1-1)/3),3)*5+3,FALSE)&"|"&HLOOKUP(Sheet1!R2C1,Sheet1!R2C1:R16C1,MOD(RC1,3)+MOD(INT((RC1)/3),3)*5+3,FALSE)&"|"&HLOOKUP(Sheet1!R2C1,Sheet1!R2C1:R16C1,MOD(RC1+1,3)+MOD(INT((RC1+1)/3),3)*5+3,FALSE)&"|"&HLOOKUP(Sheet1!R2C1,Sheet1!R2C1:R16C1,MOD(RC1+2,3)+MOD(INT((RC1+2)/3),3)*5+3,FALSE)&"|"&HLOOKUP(Sheet1!R2C1,Sheet1!R2C1:R16C1,MOD(RC1+3,3)+MOD(INT((RC1+3)/3),3)*5+3,FALSE) -> 164|102|103|104|132 | L78: 25|22|23|24 | M78: 133014|133014|133013|133013 | N78: 10030|10031|10032|10033 | O78: 1|1|1|1 | P78: 2500|2500|2500|2500
A79: 73 | B79: 71 | C79: 30 | D79: =R[-20]C+2 -> 26 | E79: 1000 | F79: =MOD(RC[-5]-1,3)*30+100&"|"&MOD(RC[-5]-1,3)*30+101&"|"&MOD(RC[-5]-1,3)*30+102&"|"&MOD(RC[-5]-1,3)*30+103&"|"&IF(MOD(RC[-5],4)=0,HLOOKUP(Sheet1!R2C10,Sheet1!R2C10:R7C10,MOD(RC[-5]/4-1,6)+1,FALSE),IF(MOD(RC[-5],2)=0,IF(RC[-5]>20,HLOOKUP(Sheet1!R2C7,Sheet1!R2C7:R43C7,MOD(RC[-5]/2-1,42)+1,FALSE),HLOOKUP(Sheet1!R2C4,Sheet1!R2C4:R7C4,MOD(RC[-5]-1,6)+1,FALSE)),MOD(RC[-5]-1,3)*30+104)) -> 100|101|102|103|104 | G79: =HLOOKUP(Sheet1!R2C1,Sheet1!R2C1:R16C1,MOD(RC1-1,2)+MOD(INT((RC1-1)/2),3)*5+1,FALSE)&"|"&HLOOKUP(Sheet1!R2C1,Sheet1!R2C1:R16C1,MOD(RC1,2)+MOD(INT((RC1)/2),3)*5+1,FALSE)&"|"&HLOOKUP(Sheet1!R2C1,Sheet1!R2C1:R16C1,MOD(RC1+1,2)+MOD(INT((RC1+1)/2),3)*5+1,FALSE)&"|"&HLOOKUP(Sheet1!R2C1,Sheet1!R2C1:R16C1,MOD(RC1+2,2)+MOD(INT((RC1+2)/2),3)*5+1,FALSE)&"|"&HLOOKUP(Sheet1!R2C1,Sheet1!R2C1:R16C1,MOD(RC1+3,2)+MOD(INT((RC1+3)/2),3)*5+1,FALSE) -> 100|101|130|131|160 | H79: =HLOOKUP(Sheet1!R2C1,Sheet1!R2C1:R16C1,MOD(RC1+2,2)+MOD(INT((RC1+2)/2),3)*5+1,FALSE)&"|"&HLOOKUP(Sheet1!R2C1,Sheet1!R2C1:R16C1,MOD(RC1+3,2)+MOD(INT((RC1+3)/2),3)*5+1,FALSE)&"|"&HLOOKUP(Sheet1!R2C1,Sheet1!R2C1:R16C1,MOD(RC1+4,2)+MOD(INT((RC1+4)/2),3)*5+1,FALSE)&"|"&HLOOKUP(Sheet1!R2C1,Sheet1!R2C1:R16C1,MOD(RC1+5,2)+MOD(INT((RC1+5)/2),3)*5+1,FALSE)&"|"&HLOOKUP(Sheet1!R2C1,Sheet1!R2C1:R16C1,MOD(RC1+6,2)+MOD(INT((RC1+6)/2),3)*5+1,FALSE) -> 131|160|161|100|101 | I79: =HLOOKUP(Sheet1!R2C1,Sheet1!R2C1:R16C1,MOD(RC1-1,3)+MOD(INT((RC1-1)/3),3)*5+3,FALSE)&"|"&HLOOKUP(Sheet1!R2C1,Sheet1!R2C1:R16C1,MOD(RC1,3)+MOD(INT((RC1)/3),3)*5+3,FALSE)&"|"&HLOOKUP(Sheet1!R2C1,Sheet1!R2C1:R16C1,MOD(RC1+1,3)+MOD(INT((RC1+1)/3),3)*5+3,FALSE)&"|"&HLOOKUP(Sheet1!R2C1,Sheet1!R2C1:R16C1,MOD(RC1+2,3)+MOD(INT((RC1+2)/3),3)*5+3,FALSE)&"|"&HLOOKUP(Sheet1!R2C1,Sheet1!R2C1:R16C1,MOD(RC1+3,3)+MOD(INT((RC1+3)/3),3)*5+3,FALSE) -> 102|103|104|132|133 | J79: =HLOOKUP(Sheet1!R2C1,Sheet1!R2C1:R16C1,MOD(RC1-1,3)+MOD(INT((RC1-1)/3),3)*5+3,FALSE)&"|"&HLOOKUP(Sheet1!R2C1,Sheet1!R2C1:R16C1,MOD(RC1,3)+MOD(INT((RC1)/3),3)*5+3,FALSE)&"|"&HLOOKUP(Sheet1!R2C1,Sheet1!R2C1:R16C1,MOD(RC1+1,3)+MOD(INT((RC1+1)/3),3)*5+3,FALSE)&"|"&HLOOKUP(Sheet1!R2C1,Sheet1!R2C1:R16C1,MOD(RC1+2,3)+MOD(INT((RC1+2)/3),3)*5+3,FALSE)&"|"&HLOOKUP(Sheet1!R2C1,Sheet1!R2C1:R16C1,MOD(RC1+3,3)+MOD(INT((RC1+3)/3),3)*5+3,FALSE) -> 102|103|104|132|133 | K79: =HLOOKUP(Sheet1!R2C1,Sheet1!R2C1:R16C1,MOD(RC1-1,3)+MOD(INT((RC1-1)/3),3)*5+3,FALSE)&"|"&HLOOKUP(Sheet1!R2C1,Sheet1!R2C1:R16C1,MOD(RC1,3)+MOD(INT((RC1)/3),3)*5+3,FALSE)&"|"&HLOOKUP(Sheet1!R2C1,Sheet1!R2C1:R16C1,MOD(RC1+1,3)+MOD(INT((RC1+1)/3),3)*5+3,FALSE)&"|"&HLOOKUP(Sheet1!R2C1,Sheet1!R2C1:R16C1,MOD(RC1+2,3)+MOD(INT((RC1+2)/3),3)*5+3,FALSE)&"|"&HLOOKUP(Sheet1!R2C1,Sheet1!R2C1:R16C1,MOD(RC1+3,3)+MOD(INT((RC1+3)/3),3)*5+3,FALSE) -> 102|103|104|132|133 | L79: 25|22|23|24 | M79: 136866|136865|136865|136865 | N79: 10030|10031|10032|10033 | O79: 1|1|1|1 | P79: 2500|2500|2500|2500
A80: 74 | B80: 72 | C80: 30 | D80: =R[-20]C+2 -> 26 | E80: 1000 | F80: =MOD(RC[-5]-1,3)*30+100&"|"&MOD(RC[-5]-1,3)*30+101&"|"&MOD(RC[-5]-1,3)*30+102&"|"&MOD(RC[-5]-1,3)*30+103&"|"&IF(MOD(RC[-5],4)=0,HLOOKUP(Sheet1!R2C10,Sheet1!R2C10:R7C10,MOD(RC[-5]/4-1,6)+1,FALSE),IF(MOD(RC[-5],2)=0,IF(RC[-5]>20,HLOOKUP(Sheet1!R2C7,Sheet1!R2C7:R43C7,MOD(RC[-5]/2-1,42)+1,FALSE),HLOOKUP(Sheet1!R2C4,Sheet1!R2C4:R7C4,MOD(RC[-5]-1,6)+1,FALSE)),MOD(RC[-5]-1,3)*30+104)) -> 130|131|132|133|180 | G80: =HLOOKUP(Sheet1!R2C1,Sheet1!R2C1:R16C1,MOD(RC1-1,2)+MOD(INT((RC1-1)/2),3)*5+1,FALSE)&"|"&HLOOKUP(Sheet1!R2C1,Sheet1!R2C1:R16C1,MOD(RC1,2)+MOD(INT((RC1)/2),3)*5+1,FALSE)&"|"&HLOOKUP(Sheet1!R2C1,Sheet1!R2C1:R16C1,MOD(RC1+1,2)+MOD(INT((RC1+1)/2),3)*5+1,FALSE)&"|"&HLOOKUP(Sheet1!R2C1,Sheet1!R2C1:R16C1,MOD(RC1+2,2)+MOD(INT((RC1+2)/2),3)*5+1,FALSE)&"|"&HLOOKUP(Sheet1!R2C1,Sheet1!R2C1:R16C1,MOD(RC1+3,2)+MOD(INT((RC1+3)/2),3)*5+1,FALSE) -> 101|130|131|160|161 | H80: =HLOOKUP(Sheet1!R2C1,Sheet1!R2C1:R16C1,MOD(RC1+2,2)+MOD(INT((RC1+2)/2),3)*5+1,FALSE)&"|"&HLOOKUP(Sheet1!R2C1,Sheet1!R2C1:R16C1,MOD(RC1+3,2)+MOD(INT((RC1+3)/2),3)*5+1,FALSE)&"|"&HLOOKUP(Sheet1!R2C1,Sheet1!R2C1:R16C1,MOD(RC1+4,2)+MOD(INT((RC1+4)/2),3)*5+1,FALSE)&"|"&HLOOKUP(Sheet1!R2C1,Sheet1!R2C1:R16C1,MOD(RC1+5,2)+MOD(INT((RC1+5)/2),3)*5+1,FALSE)&"|"&HLOOKUP(Sheet1!R2C1,Sheet1!R2C1:R16C1,MOD(RC1+6,2)+MOD(INT((RC1+6)/2),3)*5+1,FALSE) -> 160|161|100|101|130 | I80: =HLOOKUP(Sheet1!R2C1,Sheet1!R2C1:R16C1,MOD(RC1-1,3)+MOD(INT((RC1-1)/3),3)*5+3,FALSE)&"|"&HLOOKUP(Sheet1!R2C1,Sheet1!R2C1:R16C1,MOD(RC1,3)+MOD(INT((RC1)/3),3)*5+3,FALSE)&"|"&HLOOKUP(Sheet1!R2C1,Sheet1!R2C1:R16C1,MOD(RC1+1,3)+MOD(INT((RC1+1)/3),3)*5+3,FALSE)&"|"&HLOOKUP(Sheet1!R2C1,Sheet1!R2C1:R16C1,MOD(RC1+2,3)+MOD(INT((RC1+2)/3),3)*5+3,FALSE)&"|"&HLOOKUP(Sheet1!R2C1,Sheet1!R2C1:R16C1,MOD(RC1+3,3)+MOD(INT((RC1+3)/3),3)*5+3,FALSE) -> 103|104|132|133|134 | J80: =HLOOKUP(Sheet1!R2C1,Sheet1!R2C1:R16C1,MOD(RC1-1,3)+MOD(INT((RC1-1)/3),3)*5+3,FALSE)&"|"&HLOOKUP(Sheet1!R2C1,Sheet1!R2C1:R16C1,MOD(RC1,3)+MOD(INT((RC1)/3),3)*5+3,FALSE)&"|"&HLOOKUP(Sheet1!R2C1,Sheet1!R2C1:R16C1,MOD(RC1+1,3)+MOD(INT((RC1+1)/3),3)*5+3,FALSE)&"|"&HLOOKUP(Sheet1!R2C1,Sheet1!R2C1:R16C1,MOD(RC1+2,3)+MOD(INT((RC1+2)/3),3)*5+3,FALSE)&"|"&HLOOKUP(Sheet1!R2C1,Sheet1!R2C1:R16C1,MOD(RC1+3,3)+MOD(INT((RC1+3)/3),3)*5+3,FALSE) -> 103|104|132|133|134 | K80: =HLOOKUP(Sheet1!R2C1,Sheet1!R2C1:R16C1,MOD(RC1-1,3)+MOD(INT((RC1-1)/3),3)*5+3,FALSE)&"|"&HLOOKUP(Sheet1!R2C1,Sheet1!R2C1:R16C1,MOD(RC1,3)+MOD(INT((RC1)/3),3)*5+3,FALSE)&"|"&HLOOKUP(Sheet1!R2C1,Sheet1!R2C1:R16C1,MOD(RC1+1,3)+MOD(INT((RC1+1)/3),3)*5+3,FALSE)&"|"&HLOOKUP(Sheet1!R2C1,Sheet1!R2C1:R16C1,MOD(RC1+2,3)+MOD(INT((RC1+2)/3),3)*5+3,FALSE)&"|"&HLOOKUP(Sheet1!R2C1,Sheet1!R2C1:R16C1,MOD(RC1+3,3)+MOD(INT((RC1+3)/3),3)*5+3,FALSE) -> 103|104|132|133|134 | L80: 25|22|23|24 | M80: 140167|140168|140168|140168 | N80: 10030|10031|10032|10033 | O80: 1|1|1|1 | P80: 2500|2500|2500|2500
A81: 75 | B81: 73 | C81: 30 | D81: =R[-20]C+2 -> 26 | E81: 1000 | F81: =MOD(RC[-5]-1,3)*30+100&"|"&MOD(RC[-5]-1,3)*30+101&"|"&MOD(RC[-5]-1,3)*30+102&"|"&MOD(RC[-5]-1,3)*30+103&"|"&IF(MOD(RC[-5],4)=0,HLOOKUP(Sheet1!R2C10,Sheet1!R2C10:R7C10,MOD(RC[-5]/4-1,6)+1,FALSE),IF(MOD(RC[-5],2)=0,IF(RC[-5]>20,HLOOKUP(Sheet1!R2C7,Sheet1!R2C7:R43C7,MOD(RC[-5]/2-1,42)+1,FALSE),HLOOKUP(Sheet1!R2C4,Sheet1!R2C4:R7C4,MOD(RC[-5]-1,6)+1,FALSE)),MOD(RC[-5]-1,3)*30+104)) -> 160|161|162|163|164 | G81: =HLOOKUP(Sheet1!R2C1,Sheet1!R2C1:R16C1,MOD(RC1-1,2)+MOD(INT((RC1-1)/2),3)*5+1,FALSE)&"|"&HLOOKUP(Sheet1!R2C1,Sheet1!R2C1:R16C1,MOD(RC1,2)+MOD(INT((RC1)/2),3)*5+1,FALSE)&"|"&HLOOKUP(Sheet1!R2C1,Sheet1!R2C1:R16C1,MOD(RC1+1,2)+MOD(INT((RC1+1)/2),3)*5+1,FALSE)&"|"&HLOOKUP(Sheet1!R2C1,Sheet1!R2C1:R16C1,MOD(RC1+2,2)+MOD(INT((RC1+2)/2),3)*5+1,FALSE)&"|"&HLOOKUP(Sheet1!R2C1,Sheet1!R2C1:R16C1,MOD(RC1+3,2)+MOD(INT((RC1+3)/2),3)*5+1,FALSE) -> 130|131|160|161|100 | H81: =HLOOKUP(Sheet1!R2C1,Sheet1!R2C1:R16C1,MOD(RC1+2,2)+MOD(INT((RC1+2)/2),3)*5+1,FALSE)&"|"&HLOOKUP(Sheet1!R2C1,Sheet1!R2C1:R16C1,MOD(RC1+3,2)+MOD(INT((RC1+3)/2),3)*5+1,FALSE)&"|"&HLOOKUP(Sheet1!R2C1,Sheet1!R2C1:R16C1,MOD(RC1+4,2)+MOD(INT((RC1+4)/2),3)*5+1,FALSE)&"|"&HLOOKUP(Sheet1!R2C1,Sheet1!R2C1:R16C1,MOD(RC1+5,2)+MOD(INT((RC1+5)/2),3)*5+1,FALSE)&"|"&HLOOKUP(Sheet1!R2C1,Sheet1!R2C1:R16C1,MOD(RC1+6,2)+MOD(INT((RC1+6)/2),3)*5+1,FALSE) -> 161|100|101|130|131 | I81: =HLOOKUP(Sheet1!R2C1,Sheet1!R2C1:R16C1,MOD(RC1-1,3)+MOD(INT((RC1-1)/3),3)*5+3,FALSE)&"|"&HLOOKUP(Sheet1!R2C1,Sheet1!R2C1:R16C1,MOD(RC1,3)+MOD(INT((RC1)/3),3)*5+3,FALSE)&"|"&HLOOKUP(Sheet1!R2C1,Sheet1!R2C1:R16C1,MOD(RC1+1,3)+MOD(INT((RC1+1)/3),3)*5+3,FALSE)&"|"&HLOOKUP(Sheet1!R2C1,Sheet1!R2C1:R16C1,MOD(RC1+2,3)+MOD(INT((RC1+2)/3),3)*5+3,FALSE)&"|"&HLOOKUP(Sheet1!R2C1,Sheet1!R2C1:R16C1,MOD(RC1+3,3)+MOD(INT((RC1+3)/3),3)*5+3,FALSE) -> 104|132|133|134|162 | J81: =HLOOKUP(Sheet1!R2C1,Sheet1!R2C1:R16C1,MOD(RC1-1,3)+MOD(INT((RC1-1)/3),3)*5+3,FALSE)&"|"&HLOOKUP(Sheet1!R2C1,Sheet1!R2C1:R16C1,MOD(RC1,3)+MOD(INT((RC1)/3),3)*5+3,FALSE)&"|"&HLOOKUP(Sheet1!R2C1,Sheet1!R2C1:R16C1,MOD(RC1+1,3)+MOD(INT((RC1+1)/3),3)*5+3,FALSE)&"|"&HLOOKUP(Sheet1!R2C1,Sheet1!R2C1:R16C1,MOD(RC1+2,3)+MOD(INT((RC1+2)/3),3)*5+3,FALSE)&"|"&HLOOKUP(Sheet1!R2C1,Sheet1!R2C1:R16C1,MOD(RC1+3,3)+MOD(INT((RC1+3)/3),3)*5+3,FALSE) -> 104|132|133|134|162 | K81: =HLOOKUP(Sheet1!R2C1,Sheet1!R2C1:R16C1,MOD(RC1-1,3)+MOD(INT((RC1-1)/3),3)*5+3,FALSE)&"|"&HLOOKUP(Sheet1!R2C1,Sheet1!R2C1:R16C1,MOD(RC1,3)+MOD(INT((RC1)/3),3)*5+3,FALSE)&"|"&HLOOKUP(Sheet1!R2C1,Sheet1!R2C1:R16C1,MOD(RC1+1,3)+MOD(INT((RC1+1)/3),3)*5+3,FALSE)&"|"&HLOOKUP(Sheet1!R2C1,Sheet1!R2C1:R16C1,MOD(RC1+2,3)+MOD(INT((RC1+2)/3),3)*5+3,FALSE)&"|"&HLOOKUP(Sheet1!R2C1,Sheet1!R2C1:R16C1,MOD(RC1+3,3)+MOD(INT((RC1+3)/3),3)*5+3,FALSE) -> 104|132|133|134|162 | L81: 25|22|23|24 | M81: 143374|143374|143373|143373 | N81: 10030|10031|10032|10033|10030|10031|10032|10033|10030|10031|10032|10033|10030|10031|10032|10033|10030|10031|10032|10033|10030|10031|10032|10033|10030|10031|10032|10033|10030|10031|10032|10033|10030|10031|10032|10033|10030|10031|10032|10033 | O81: 1|1|1|1|1|1|1|1|1|1|1|1|1|1|1|1|1|1|1|1|1|1|1|1|1|1|1|1|1|1|1|1|1|1|1|1|1|1|1|1 | P81: 2500|2500|2500|2500|2500|2500|2500|2500|2500|2500|2500|2500|2500|2500|2500|2500|2500|2500|2500|2500|2500|2500|2500|2500|2500|2500|2500|2500|2500|2500|2500|2500|2500|2500|2500|2500|2500|2500|2500|2500
A82: 76 | B82: 74 | C82: 30 | D82: =R[-20]C+2 -> 26 | E82: 1000 | F82: =MOD(RC[-5]-1,3)*30+100&"|"&MOD(RC[-5]-1,3)*30+101&"|"&MOD(RC[-5]-1,3)*30+102&"|"&MOD(RC[-5]-1,3)*30+103&"|"&IF(MOD(RC[-5],4)=0,HLOOKUP(Sheet1!R2C10,Sheet1!R2C10:R7C10,MOD(RC[-5]/4-1,6)+1,FALSE),IF(MOD(RC[-5],2)=0,IF(RC[-5]>20,HLOOKUP(Sheet1!R2C7,Sheet1!R2C7:R43C7,MOD(RC[-5]/2-1,42)+1,FALSE),HLOOKUP(Sheet1!R2C4,Sheet1!R2C4:R7C4,MOD(RC[-5]-1,6)+1,FALSE)),MOD(RC[-5]-1,3)*30+104)) -> 100|101|102|103|190 | G82: =HLOOKUP(Sheet1!R2C1,Sheet1!R2C1:R16C1,MOD(RC1-1,2)+MOD(INT((RC1-1)/2),3)*5+1,FALSE)&"|"&HLOOKUP(Sheet1!R2C1,Sheet1!R2C1:R16C1,MOD(RC1,2)+MOD(INT((RC1)/2),3)*5+1,FALSE)&"|"&HLOOKUP(Sheet1!R2C1,Sheet1!R2C1:R16C1,MOD(RC1+1,2)+MOD(INT((RC1+1)/2),3)*5+1,FALSE)&"|"&HLOOKUP(Sheet1!R2C1,Sheet1!R2C1:R16C1,MOD(RC1+2,2)+MOD(INT((RC1+2)/2),3)*5+1,FALSE)&"|"&HLOOKUP(Sheet1!R2C1,Sheet1!R2C1:R16C1,MOD(RC1+3,2)+MOD(INT((RC1+3)/2),3)*5+1,FALSE) -> 131|160|161|100|101 | H82: =HLOOKUP(Sheet1!R2C1,Sheet1!R2C1:R16C1,MOD(RC1+2,2)+MOD(INT((RC1+2)/2),3)*5+1,FALSE)&"|"&HLOOKUP(Sheet1!R2C1,Sheet1!R2C1:R16C1,MOD(RC1+3,2)+MOD(INT((RC1+3)/2),3)*5+1,FALSE)&"|"&HLOOKUP(Sheet1!R2C1,Sheet1!R2C1:R16C1,MOD(RC1+4,2)+MOD(INT((RC1+4)/2),3)*5+1,FALSE)&"|"&HLOOKUP(Sheet1!R2C1,Sheet1!R2C1:R16C1,MOD(RC1+5,2)+MOD(INT((RC1+5)/2),3)*5+1,FALSE)&"|"&HLOOKUP(Sheet1!R2C1,Sheet1!R2C1:R16C1,MOD(RC1+6,2)+MOD(INT((RC1+6)/2),3)*5+1,FALSE) -> 100|101|130|131|160 | I82: =HLOOKUP(Sheet1!R2C1,Sheet1!R2C1:R16C1,MOD(RC1-1,3)+MOD(INT((RC1-1)/3),3)*5+3,FALSE)&"|"&HLOOKUP(Sheet1!R2C1,Sheet1!R2C1:R16C1,MOD(RC1,3)+MOD(INT((RC1)/3),3)*5+3,FALSE)&"|"&HLOOKUP(Sheet1!R2C1,Sheet1!R2C1:R16C1,MOD(RC1+1,3)+MOD(INT((RC1+1)/3),3)*5+3,FALSE)&"|"&HLOOKUP(Sheet1!R2C1,Sheet1!R2C1:R16C1,MOD(RC1+2,3)+MOD(INT((RC1+2)/3),3)*5+3,FALSE)&"|"&HLOOKUP(Sheet1!R2C1,Sheet1!R2C1:R16C1,MOD(RC1+3,3)+MOD(INT((RC1+3)/3),3)*5+3,FALSE) -> 132|133|134|162|163 | J82: =HLOOKUP(Sheet1!R2C1,Sheet1!R2C1:R16C1,MOD(RC1-1,3)+MOD(INT((RC1-1)/3),3)*5+3,FALSE)&"|"&HLOOKUP(Sheet1!R2C1,Sheet1!R2C1:R16C1,MOD(RC1,3)+MOD(INT((RC1)/3),3)*5+3,FALSE)&"|"&HLOOKUP(Sheet1!R2C1,Sheet1!R2C1:R16C1,MOD(RC1+1,3)+MOD(INT((RC1+1)/3),3)*5+3,FALSE)&"|"&HLOOKUP(Sheet1!R2C1,Sheet1!R2C1:R16C1,MOD(RC1+2,3)+MOD(INT((RC1+2)/3),3)*5+3,FALSE)&"|"&HLOOKUP(Sheet1!R2C1,Sheet1!R2C1:R16C1,MOD(RC1+3,3)+MOD(INT((RC1+3)/3),3)*5+3,FALSE) -> 132|133|134|162|163 | K82: =HLOOKUP(Sheet1!R2C1,Sheet1!R2C1:R16C1,MOD(RC1-1,3)+MOD(INT((RC1-1)/3),3)*5+3,FALSE)&"|"&HLOOKUP(Sheet1!R2C1,Sheet1!R2C1:R16C1,MOD(RC1,3)+MOD(INT((RC1)/3),3)*5+3,FALSE)&"|"&HLOOKUP(Sheet1!R2C1,Sheet1!R2C1:R16C1,MOD(RC1+1,3)+MOD(INT((RC1+1)/3),3)*5+3,FALSE)&"|"&HLOOKUP(Sheet1!R2C1,Sheet1!R2C1:R16C1,MOD(RC1+2,3)+MOD(INT((RC1+2)/3),3)*5+3,FALSE)&"|"&HLOOKUP(Sheet1!R2C1,Sheet1!R2C1:R16C1,MOD(RC1+3,3)+MOD(INT((RC1+3)/3),3)*5+3,FALSE) -> 132|133|134|162|163 | L82: 25|22|23|24 | M82: 146486|146486|146485|146485 | N82: 10030|10031|10032|10033 | O82: 1|1|1|1 | P82: 2500|2500|2500|2500
A83: 77 | B83: 75 | C83: 30 | D83: =R[-20]C+2 -> 26 | E83: 1000 | F83: =MOD(RC[-5]-1,3)*30+100&"|"&MOD(RC[-5]-1,3)*30+101&"|"&MOD(RC[-5]-1,3)*30+102&"|"&MOD(RC[-5]-1,3)*30+103&"|"&IF(MOD(RC[-5],4)=0,HLOOKUP(Sheet1!R2C10,Sheet1!R2C10:R7C10,MOD(RC[-5]/4-1,6)+1,FALSE),IF(MOD(RC[-5],2)=0,IF(RC[-5]>20,HLOOKUP(Sheet1!R2C7,Sheet1!R2C7:R43C7,MOD(RC[-5]/2-1,42)+1,FALSE),HLOOKUP(Sheet1!R2C4,Sheet1!R2C4:R7C4,MOD(RC[-5]-1,6)+1,FALSE)),MOD(RC[-5]-1,3)*30+104)) -> 130|131|132|133|134 | G83: =HLOOKUP(Sheet1!R2C1,Sheet1!R2C1:R16C1,MOD(RC1-1,2)+MOD(INT((RC1-1)/2),3)*5+1,FALSE)&"|"&HLOOKUP(Sheet1!R2C1,Sheet1!R2C1:R16C1,MOD(RC1,2)+MOD(INT((RC1)/2),3)*5+1,FALSE)&"|"&HLOOKUP(Sheet1!R2C1,Sheet1!R2C1:R16C1,MOD(RC1+1,2)+MOD(INT((RC1+1)/2),3)*5+1,FALSE)&"|"&HLOOKUP(Sheet1!R2C1,Sheet1!R2C1:R16C1,MOD(RC1+2,2)+MOD(INT((RC1+2)/2),3)*5+1,FALSE)&"|"&HLOOKUP(Sheet1!R2C1,Sheet1!R2C1:R16C1,MOD(RC1+3,2)+MOD(INT((RC1+3)/2),3)*5+1,FALSE) -> 160|161|100|101|130 | H83: =HLOOKUP(Sheet1!R2C1,Sheet1!R2C1:R16C1,MOD(RC1+2,2)+MOD(INT((RC1+2)/2),3)*5+1,FALSE)&"|"&HLOOKUP(Sheet1!R2C1,Sheet1!R2C1:R16C1,MOD(RC1+3,2)+MOD(INT((RC1+3)/2),3)*5+1,FALSE)&"|"&HLOOKUP(Sheet1!R2C1,Sheet1!R2C1:R16C1,MOD(RC1+4,2)+MOD(INT((RC1+4)/2),3)*5+1,FALSE)&"|"&HLOOKUP(Sheet1!R2C1,Sheet1!R2C1:R16C1,MOD(RC1+5,2)+MOD(INT((RC1+5)/2),3)*5+1,FALSE)&"|"&HLOOKUP(Sheet1!R2C1,Sheet1!R2C1:R16C1,MOD(RC1+6,2)+MOD(INT((RC1+6)/2),3)*5+1,FALSE) -> 101|130|131|160|161 | I83: =HLOOKUP(Sheet1!R2C1,Sheet1!R2C1:R16C1,MOD(RC1-1,3)+MOD(INT((RC1-1)/3),3)*5+3,FALSE)&"|"&HLOOKUP(Sheet1!R2C1,Sheet1!R2C1:R16C1,MOD(RC1,3)+MOD(INT((RC1)/3),3)*5+3,FALSE)&"|"&HLOOKUP(Sheet1!R2C1,Sheet1!R2C1:R16C1,MOD(RC1+1,3)+MOD(INT((RC1+1)/3),3)*5+3,FALSE)&"|"&HLOOKUP(Sheet1!R2C1,Sheet1!R2C1:R16C1,MOD(RC1+2,3)+MOD(INT((RC1+2)/3),3)*5+3,FALSE)&"|"&HLOOKUP(Sheet1!R2C1,Sheet1!R2C1:R16C1,MOD(RC1+3,3)+MOD(INT((RC1+3)/3),3)*5+3,FALSE) -> 133|134|162|163|164 | J83: =HLOOKUP(Sheet1!R2C1,Sheet1!R2C1:R16C1,MOD(RC1-1,3)+MOD(INT((RC1-1)/3),3)*5+3,FALSE)&"|"&HLOOKUP(Sheet1!R2C1,Sheet1!R2C1:R16C1,MOD(RC1,3)+MOD(INT((RC1)/3),3)*5+3,FALSE)&"|"&HLOOKUP(Sheet1!R2C1,Sheet1!R2C1:R16C1,MOD(RC1+1,3)+MOD(INT((RC1+1)/3),3)*5+3,FALSE)&"|"&HLOOKUP(Sheet1!R2C1,Sheet1!R2C1:R16C1,MOD(RC1+2,3)+MOD(INT((RC1+2)/3),3)*5+3,FALSE)&"|"&HLOOKUP(Sheet1!R2C1,Sheet1!R2C1:R16C1,MOD(RC1+3,3)+MOD(INT((RC1+3)/3),3)*5+3,FALSE) -> 133|134|162|163|164 | K83: =HLOOKUP(Sheet1!R2C1,Sheet1!R2C1:R16C1,MOD(RC1-1,3)+MOD(INT((RC1-1)/3),3)*5+3,FALSE)&"|"&HLOOKUP(Sheet1!R2C1,Sheet1!R2C1:R16C1,MOD(RC1,3)+MOD(INT((RC1)/3),3)*5+3,FALSE)&"|"&HLOOKUP(Sheet1!R2C1,Sheet1!R2C1:R16C1,MOD(RC1+1,3)+MOD(INT((RC1+1)/3),3)*5+3,FALSE)&"|"&HLOOKUP(Sheet1!R2C1,Sheet1!R2C1:R16C1,MOD(RC1+2,3)+MOD(INT((RC1+2)/3),3)*5+3,FALSE)&"|"&HLOOKUP(Sheet1!R2C1,Sheet1!R2C1:R16C1,MOD(RC1+3,3)+MOD(INT((RC1+3)/3),3)*5+3,FALSE) -> 133|134|162|163|164 | L83: 25|22|23|24 | M83: 150289|150289|150290|150290 | N83: 10030|10031|10032|10033 | O83: 1|1|1|1 | P83: 2500|2500|2500|2500
A84: 78 | B84: 76 | C84: 30 | D84: =R[-20]C+2 -> 26 | E84: 1000 | F84: =MOD(RC[-5]-1,3)*30+100&"|"&MOD(RC[-5]-1,3)*30+101&"|"&MOD(RC[-5]-1,3)*30+102&"|"&MOD(RC[-5]-1,3)*30+103&"|"&IF(MOD(RC[-5],4)=0,HLOOKUP(Sheet1!R2C10,Sheet1!R2C10:R7C10,MOD(RC[-5]/4-1,6)+1,FALSE),IF(MOD(RC[-5],2)=0,IF(RC[-5]>20,HLOOKUP(Sheet1!R2C7,Sheet1!R2C7:R43C7,MOD(RC[-5]/2-1,42)+1,FALSE),HLOOKUP(Sheet1!R2C4,Sheet1!R2C4:R7C4,MOD(RC[-5]-1,6)+1,FALSE)),MOD(RC[-5]-1,3)*30+104)) -> 160|161|162|163|182 | G84: =HLOOKUP(Sheet1!R2C1,Sheet1!R2C1:R16C1,MOD(RC1-1,2)+MOD(INT((RC1-1)/2),3)*5+1,FALSE)&"|"&HLOOKUP(Sheet1!R2C1,Sheet1!R2C1:R16C1,MOD(RC1,2)+MOD(INT((RC1)/2),3)*5+1,FALSE)&"|"&HLOOKUP(Sheet1!R2C1,Sheet1!R2C1:R16C1,MOD(RC1+1,2)+MOD(INT((RC1+1)/2),3)*5+1,FALSE)&"|"&HLOOKUP(Sheet1!R2C1,Sheet1!R2C1:R16C1,MOD(RC1+2,2)+MOD(INT((RC1+2)/2),3)*5+1,FALSE)&"|"&HLOOKUP(Sheet1!R2C1,Sheet1!R2C1:R16C1,MOD(RC1+3,2)+MOD(INT((RC1+3)/2),3)*5+1,FALSE) -> 161|100|101|130|131 | H84: =HLOOKUP(Sheet1!R2C1,Sheet1!R2C1:R16C1,MOD(RC1+2,2)+MOD(INT((RC1+2)/2),3)*5+1,FALSE)&"|"&HLOOKUP(Sheet1!R2C1,Sheet1!R2C1:R16C1,MOD(RC1+3,2)+MOD(INT((RC1+3)/2),3)*5+1,FALSE)&"|"&HLOOKUP(Sheet1!R2C1,Sheet1!R2C1:R16C1,MOD(RC1+4,2)+MOD(INT((RC1+4)/2),3)*5+1,FALSE)&"|"&HLOOKUP(Sheet1!R2C1,Sheet1!R2C1:R16C1,MOD(RC1+5,2)+MOD(INT((RC1+5)/2),3)*5+1,FALSE)&"|"&HLOOKUP(Sheet1!R2C1,Sheet1!R2C1:R16C1,MOD(RC1+6,2)+MOD(INT((RC1+6)/2),3)*5+1,FALSE) -> 130|131|160|161|100 | I84: =HLOOKUP(Sheet1!R2C1,Sheet1!R2C1:R16C1,MOD(RC1-1,3)+MOD(INT((RC1-1)/3),3)*5+3,FALSE)&"|"&HLOOKUP(Sheet1!R2C1,Sheet1!R2C1:R16C1,MOD(RC1,3)+MOD(INT((RC1)/3),3)*5+3,FALSE)&"|"&HLOOKUP(Sheet1!R2C1,Sheet1!R2C1:R16C1,MOD(RC1+1,3)+MOD(INT((RC1+1)/3),3)*5+3,FALSE)&"|"&HLOOKUP(Sheet1!R2C1,Sheet1!R2C1:R16C1,MOD(RC1+2,3)+MOD(INT((RC1+2)/3),3)*5+3,FALSE)&"|"&HLOOKUP(Sheet1!R2C1,Sheet1!R2C1:R16C1,MOD(RC1+3,3)+MOD(INT((RC1+3)/3),3)*5+3,FALSE) -> 134|162|163|164|102 | J84: =HLOOKUP(Sheet1!R2C1,Sheet1!R2C1:R16C1,MOD(RC1-1,3)+MOD(INT((RC1-1)/3),3)*5+3,FALSE)&"|"&HLOOKUP(Sheet1!R2C1,Sheet1!R2C1:R16C1,MOD(RC1,3)+MOD(INT((RC1)/3),3)*5+3,FALSE)&"|"&HLOOKUP(Sheet1!R2C1,Sheet1!R2C1:R16C1,MOD(RC1+1,3)+MOD(INT((RC1+1)/3),3)*5+3,FALSE)&"|"&HLOOKUP(Sheet1!R2C1,Sheet1!R2C1:R16C1,MOD(RC1+2,3)+MOD(INT((RC1+2)/3),3)*5+3,FALSE)&"|"&HLOOKUP(Sheet1!R2C1,Sheet1!R2C1:R16C1,MOD(RC1+3,3)+MOD(INT((RC1+3)/3),3)*5+3,FALSE) -> 134|162|163|164|102 | K84: =HLOOKUP(Sheet1!R2C1,Sheet1!R2C1:R16C1,MOD(RC1-1,3)+MOD(INT((RC1-1)/3),3)*5+3,FALSE)&"|"&HLOOKUP(Sheet1!R2C1,Sheet1!R2C1:R16C1,MOD(RC1,3)+MOD(INT((RC1)/3),3)*5+3,FALSE)&"|"&HLOOKUP(Sheet1!R2C1,Sheet1!R2C1:R16C1,MOD(RC1+1,3)+MOD(INT((RC1+1)/3),3)*5+3,FALSE)&"|"&HLOOKUP(Sheet1!R2C1,Sheet1!R2C1:R16C1,MOD(RC1+2,3)+MOD(INT((RC1+2)/3),3)*5+3,FALSE)&"|"&HLOOKUP(Sheet1!R2C1,Sheet1!R2C1:R16C1,MOD(RC1+3,3)+MOD(INT((RC1+3)/3),3)*5+3,FALSE) -> 134|162|163|164|102 | L84: 25|22|23|24 | M84: 154058|154058|154058|154058 | N84: 10030|10031|10032|10033 | O84: 1|1|1|1 | P84: 2500|2500|2500|2500
A85: 79 | B85: 77 | C85: 30 | D85: =R[-20]C+2 -> 26 | E85: 1000 | F85: =MOD(RC[-5]-1,3)*30+100&"|"&MOD(RC[-5]-1,3)*30+101&"|"&MOD(RC[-5]-1,3)*30+102&"|"&MOD(RC[-5]-1,3)*30+103&"|"&IF(MOD(RC[-5],4)=0,HLOOKUP(Sheet1!R2C10,Sheet1!R2C10:R7C10,MOD(RC[-5]/4-1,6)+1,FALSE),IF(MOD(RC[-5],2)=0,IF(RC[-5]>20,HLOOKUP(Sheet1!R2C7,Sheet1!R2C7:R43C7,MOD(RC[-5]/2-1,42)+1,FALSE),HLOOKUP(Sheet1!R2C4,Sheet1!R2C4:R7C4,MOD(RC[-5]-1,6)+1,FALSE)),MOD(RC[-5]-1,3)*30+104)) -> 100|101|102|103|104 | G85: =HLOOKUP(Sheet1!R2C1,Sheet1!R2C1:R16C1,MOD(RC1-1,2)+MOD(INT((RC1-1)/2),3)*5+1,FALSE)&"|"&HLOOKUP(Sheet1!R2C1,Sheet1!R2C1:R16C1,MOD(RC1,2)+MOD(INT((RC1)/2),3)*5+1,FALSE)&"|"&HLOOKUP(Sheet1!R2C1,Sheet1!R2C1:R16C1,MOD(RC1+1,2)+MOD(INT((RC1+1)/2),3)*5+1,FALSE)&"|"&HLOOKUP(Sheet1!R2C1,Sheet1!R2C1:R16C1,MOD(RC1+2,2)+MOD(INT((RC1+2)/2),3)*5+1,FALSE)&"|"&HLOOKUP(Sheet1!R2C1,Sheet1!R2C1:R16C1,MOD(RC1+3,2)+MOD(INT((RC1+3)/2),3)*5+1,FALSE) -> 100|101|130|131|160 | H85: =HLOOKUP(Sheet1!R2C1,Sheet1!R2C1:R16C1,MOD(RC1+2,2)+MOD(INT((RC1+2)/2),3)*5+1,FALSE)&"|"&HLOOKUP(Sheet1!R2C1,Sheet1!R2C1:R16C1,MOD(RC1+3,2)+MOD(INT((RC1+3)/2),3)*5+1,FALSE)&"|"&HLOOKUP(Sheet1!R2C1,Sheet1!R2C1:R16C1,MOD(RC1+4,2)+MOD(INT((RC1+4)/2),3)*5+1,FALSE)&"|"&HLOOKUP(Sheet1!R2C1,Sheet1!R2C1:R16C1,MOD(RC1+5,2)+MOD(INT((RC1+5)/2),3)*5+1,FALSE)&"|"&HLOOKUP(Sheet1!R2C1,Sheet1!R2C1:R16C1,MOD(RC1+6,2)+MOD(INT((RC1+6)/2),3)*5+1,FALSE) -> 131|160|161|100|101 | I85: =HLOOKUP(Sheet1!R2C1,Sheet1!R2C1:R16C1,MOD(RC1-1,3)+MOD(INT((RC1-1)/3),3)*5+3,FALSE)&"|"&HLOOKUP(Sheet1!R2C1,Sheet1!R2C1:R16C1,MOD(RC1,3)+MOD(INT((RC1)/3),3)*5+3,FALSE)&"|"&HLOOKUP(Sheet1!R2C1,Sheet1!R2C1:R16C1,MOD(RC1+1,3)+MOD(INT((RC1+1)/3),3)*5+3,FALSE)&"|"&HLOOKUP(Sheet1!R2C1,Sheet1!R2C1:R16C1,MOD(RC1+2,3)+MOD(INT((RC1+2)/3),3)*5+3,FALSE)&"|"&HLOOKUP(Sheet1!R2C1,Sheet1!R2C1:R16C1,MOD(RC1+3,3)+MOD(INT((RC1+3)/3),3)*5+3,FALSE) -> 162|163|164|102|103 | J85: =HLOOKUP(Sheet1!R2C1,Sheet1!R2C1:R16C1,MOD(RC1-1,3)+MOD(INT((RC1-1)/3),3)*5+3,FALSE)&"|"&HLOOKUP(Sheet1!R2C1,Sheet1!R2C1:R16C1,MOD(RC1,3)+MOD(INT((RC1)/3),3)*5+3,FALSE)&"|"&HLOOKUP(Sheet1!R2C1,Sheet1!R2C1:R16C1,MOD(RC1+1,3)+MOD(INT((RC1+1)/3),3)*5+3,FALSE)&"|"&HLOOKUP(Sheet1!R2C1,Sheet1!R2C1:R16C1,MOD(RC1+2,3)+MOD(INT((RC1+2)/3),3)*5+3,FALSE)&"|"&HLOOKUP(Sheet1!R2C1,Sheet1!R2C1:R16C1,MOD(RC1+3,3)+MOD(INT((RC1+3)/3),3)*5+3,FALSE) -> 162|163|164|102|103 | K85: =HLOOKUP(Sheet1!R2C1,Sheet1!R2C1:R16C1,MOD(RC1-1,3)+MOD(INT((RC1-1)/3),3)*5+3,FALSE)&"|"&HLOOKUP(Sheet1!R2C1,Sheet1!R2C1:R16C1,MOD(RC1,3)+MOD(INT((RC1)/3),3)*5+3,FALSE)&"|"&HLOOKUP(Sheet1!R2C1,Sheet1!R2C1:R16C1,MOD(RC1+1,3)+MOD(INT((RC1+1)/3),3)*5+3,FALSE)&"|"&HLOOKUP(Sheet1!R2C1,Sheet1!R2C1:R16C1,MOD(RC1+2,3)+MOD(INT((RC1+2)/3),3)*5+3,FALSE)&"|"&HLOOKUP(Sheet1!R2C1,Sheet1!R2C1:R16C1,MOD(RC1+3,3)+MOD(INT((RC1+3)/3),3)*5+3,FALSE) -> 162|163|164|102|103 | L85: 25|22|23|24 | M85: 157940|157940|157940|157940 | N85: 10030|10031|10032|10033 | O85: 1|1|1|1 | P85: 2500|2500|2500|2500
A86: 80 | B86: 78 | C86: 30 | D86: =R[-20]C+2 -> 26 | E86: 1000 | F86: =MOD(RC[-5]-1,3)*30+100&"|"&MOD(RC[-5]-1,3)*30+101&"|"&MOD(RC[-5]-1,3)*30+102&"|"&MOD(RC[-5]-1,3)*30+103&"|"&IF(MOD(RC[-5],4)=0,HLOOKUP(Sheet1!R2C10,Sheet1!R2C10:R7C10,MOD(RC[-5]/4-1,6)+1,FALSE),IF(MOD(RC[-5],2)=0,IF(RC[-5]>20,HLOOKUP(Sheet1!R2C7,Sheet1!R2C7:R43C7,MOD(RC[-5]/2-1,42)+1,FALSE),HLOOKUP(Sheet1!R2C4,Sheet1!R2C4:R7C4,MOD(RC[-5]-1,6)+1,FALSE)),MOD(RC[-5]-1,3)*30+104)) -> 130|131|132|133|191 | G86: =HLOOKUP(Sheet1!R2C1,Sheet1!R2C1:R16C1,MOD(RC1-1,2)+MOD(INT((RC1-1)/2),3)*5+1,FALSE)&"|"&HLOOKUP(Sheet1!R2C1,Sheet1!R2C1:R16C1,MOD(RC1,2)+MOD(INT((RC1)/2),3)*5+1,FALSE)&"|"&HLOOKUP(Sheet1!R2C1,Sheet1!R2C1:R16C1,MOD(RC1+1,2)+MOD(INT((RC1+1)/2),3)*5+1,FALSE)&"|"&HLOOKUP(Sheet1!R2C1,Sheet1!R2C1:R16C1,MOD(RC1+2,2)+MOD(INT((RC1+2)/2),3)*5+1,FALSE)&"|"&HLOOKUP(Sheet1!R2C1,Sheet1!R2C1:R16C1,MOD(RC1+3,2)+MOD(INT((RC1+3)/2),3)*5+1,FALSE) -> 101|130|131|160|161 | H86: =HLOOKUP(Sheet1!R2C1,Sheet1!R2C1:R16C1,MOD(RC1+2,2)+MOD(INT((RC1+2)/2),3)*5+1,FALSE)&"|"&HLOOKUP(Sheet1!R2C1,Sheet1!R2C1:R16C1,MOD(RC1+3,2)+MOD(INT((RC1+3)/2),3)*5+1,FALSE)&"|"&HLOOKUP(Sheet1!R2C1,Sheet1!R2C1:R16C1,MOD(RC1+4,2)+MOD(INT((RC1+4)/2),3)*5+1,FALSE)&"|"&HLOOKUP(Sheet1!R2C1,Sheet1!R2C1:R16C1,MOD(RC1+5,2)+MOD(INT((RC1+5)/2),3)*5+1,FALSE)&"|"&HLOOKUP(Sheet1!R2C1,Sheet1!R2C1:R16C1,MOD(RC1+6,2)+MOD(INT((RC1+6)/2),3)*5+1,FALSE) -> 160|161|100|101|130 | I86: =HLOOKUP(Sheet1!R2C1,Sheet1!R2C1:R16C1,MOD(RC1-1,3)+MOD(INT((RC1-1)/3),3)*5+3,FALSE)&"|"&HLOOKUP(Sheet1!R2C1,Sheet1!R2C1:R16C1,MOD(RC1,3)+MOD(INT((RC1)/3),3)*5+3,FALSE)&"|"&HLOOKUP(Sheet1!R2C1,Sheet1!R2C1:R16C1,MOD(RC1+1,3)+MOD(INT((RC1+1)/3),3)*5+3,FALSE)&"|"&HLOOKUP(Sheet1!R2C1,Sheet1!R2C1:R16C1,MOD(RC1+2,3)+MOD(INT((RC1+2)/3),3)*5+3,FALSE)&"|"&HLOOKUP(Sheet1!R2C1,Sheet1!R2C1:R16C1,MOD(RC1+3,3)+MOD(INT((RC1+3)/3),3)*5+3,FALSE) -> 163|164|102|103|104 | J86: =HLOOKUP(Sheet1!R2C1,Sheet1!R2C1:R16C1,MOD(RC1-1,3)+MOD(INT((RC1-1)/3),3)*5+3,FALSE)&"|"&HLOOKUP(Sheet1!R2C1,Sheet1!R2C1:R16C1,MOD(RC1,3)+MOD(INT((RC1)/3),3)*5+3,FALSE)&"|"&HLOOKUP(Sheet1!R2C1,Sheet1!R2C1:R16C1,MOD(RC1+1,3)+MOD(INT((RC1+1)/3),3)*5+3,FALSE)&"|"&HLOOKUP(Sheet1!R2C1,Sheet1!R2C1:R16C1,MOD(RC1+2,3)+MOD(INT((RC1+2)/3),3)*5+3,FALSE)&"|"&HLOOKUP(Sheet1!R2C1,Sheet1!R2C1:R16C1,MOD(RC1+3,3)+MOD(INT((RC1+3)/3),3)*5+3,FALSE) -> 163|164|102|103|104 | K86: =HLOOKUP(Sheet1!R2C1,Sheet1!R2C1:R16C1,MOD(RC1-1,3)+MOD(INT((RC1-1)/3),3)*5+3,FALSE)&"|"&HLOOKUP(Sheet1!R2C1,Sheet1!R2C1:R16C1,MOD(RC1,3)+MOD(INT((RC1)/3),3)*5+3,FALSE)&"|"&HLOOKUP(Sheet1!R2C1,Sheet1!R2C1:R16C1,MOD(RC1+1,3)+MOD(INT((RC1+1)/3),3)*5+3,FALSE)&"|"&HLOOKUP(Sheet1!R2C1,Sheet1!R2C1:R16C1,MOD(RC1+2,3)+MOD(INT((RC1+2)/3),3)*5+3,FALSE)&"|"&HLOOKUP(Sheet1!R2C1,Sheet1!R2C1:R16C1,MOD(RC1+3,3)+MOD(INT((RC1+3)/3),3)*5+3,FALSE) -> 163|164|102|103|104 | L86: 25|22|23|24 | M86: 161713|161713|161713|161713 | N86: 10030|10031|10032|10033|10030|10031|10032|10033|10030|10031|10032|10033|10030|10031|10032|10033|10030|10031|10032|10033|10030|10031|10032|10033|10030|10031|10032|10033|10030|10031|10032|10033|10030|10031|10032|10033|10030|10031|10032|10033 | O86: 1|1|1|1|1|1|1|1|1|1|1|1|1|1|1|1|1|1|1|1|1|1|1|1|1|1|1|1|1|1|1|1|1|1|1|1|1|1|1|1 | P86: 2500|2500|2500|2500|2500|2500|2500|2500|2500|2500|2500|2500|2500|2500|2500|2500|2500|2500|2500|2500|2500|2500|2500|2500|2500|2500|2500|2500|2500|2500|2500|2500|2500|2500|2500|2500|2500|2500|2500|2500
A87: 81 | B87: 79 | C87: 30 | D87: =R[-20]C+2 -> 28 | E87: 1000 | F87: =MOD(RC[-5]-1,3)*30+100&"|"&MOD(RC[-5]-1,3)*30+101&"|"&MOD(RC[-5]-1,3)*30+102&"|"&MOD(RC[-5]-1,3)*30+103&"|"&IF(MOD(RC[-5],4)=0,HLOOKUP(Sheet1!R2C10,Sheet1!R2C10:R7C10,MOD(RC[-5]/4-1,6)+1,FALSE),IF(MOD(RC[-5],2)=0,IF(RC[-5]>20,HLOOKUP(Sheet1!R2C7,Sheet1!R2C7:R43C7,MOD(RC[-5]/2-1,42)+1,FALSE),HLOOKUP(Sheet1!R2C4,Sheet1!R2C4:R7C4,MOD(RC[-5]-1,6)+1,FALSE)),MOD(RC[-5]-1,3)*30+104)) -> 160|161|162|163|164 | G87: =HLOOKUP(Sheet1!R2C1,Sheet1!R2C1:R16C1,MOD(RC1-1,2)+MOD(INT((RC1-1)/2),3)*5+1,FALSE)&"|"&HLOOKUP(Sheet1!R2C1,Sheet1!R2C1:R16C1,MOD(RC1,2)+MOD(INT((RC1)/2),3)*5+1,FALSE)&"|"&HLOOKUP(Sheet1!R2C1,Sheet1!R2C1:R16C1,MOD(RC1+1,2)+MOD(INT((RC1+1)/2),3)*5+1,FALSE)&"|"&HLOOKUP(Sheet1!R2C1,Sheet1!R2C1:R16C1,MOD(RC1+2,2)+MOD(INT((RC1+2)/2),3)*5+1,FALSE)&"|"&HLOOKUP(Sheet1!R2C1,Sheet1!R2C1:R16C1,MOD(RC1+3,2)+MOD(INT((RC1+3)/2),3)*5+1,FALSE) -> 130|131|160|161|100 | H87: =HLOOKUP(Sheet1!R2C1,Sheet1!R2C1:R16C1,MOD(RC1+2,2)+MOD(INT((RC1+2)/2),3)*5+1,FALSE)&"|"&HLOOKUP(Sheet1!R2C1,Sheet1!R2C1:R16C1,MOD(RC1+3,2)+MOD(INT((RC1+3)/2),3)*5+1,FALSE)&"|"&HLOOKUP(Sheet1!R2C1,Sheet1!R2C1:R16C1,MOD(RC1+4,2)+MOD(INT((RC1+4)/2),3)*5+1,FALSE)&"|"&HLOOKUP(Sheet1!R2C1,Sheet1!R2C1:R16C1,MOD(RC1+5,2)+MOD(INT((RC1+5)/2),3)*5+1,FALSE)&"|"&HLOOKUP(Sheet1!R2C1,Sheet1!R2C1:R16C1,MOD(RC1+6,2)+MOD(INT((RC1+6)/2),3)*5+1,FALSE) -> 161|100|101|130|131 | I87: =HLOOKUP(Sheet1!R2C1,Sheet1!R2C1:R16C1,MOD(RC1-1,3)+MOD(INT((RC1-1)/3),3)*5+3,FALSE)&"|"&HLOOKUP(Sheet1!R2C1,Sheet1!R2C1:R16C1,MOD(RC1,3)+MOD(INT((RC1)/3),3)*5+3,FALSE)&"|"&HLOOKUP(Sheet1!R2C1,Sheet1!R2C1:R16C1,MOD(RC1+1,3)+MOD(INT((RC1+1)/3),3)*5+3,FALSE)&"|"&HLOOKUP(Sheet1!R2C1,Sheet1!R2C1:R16C1,MOD(RC1+2,3)+MOD(INT((RC1+2)/3),3)*5+3,FALSE)&"|"&HLOOKUP(Sheet1!R2C1,Sheet1!R2C1:R16C1,MOD(RC1+3,3)+MOD(INT((RC1+3)/3),3)*5+3,FALSE) -> 164|102|103|104|132 | J87: =HLOOKUP(Sheet1!R2C1,Sheet1!R2C1:R16C1,MOD(RC1-1,3)+MOD(INT((RC1-1)/3),3)*5+3,FALSE)&"|"&HLOOKUP(Sheet1!R2C1,Sheet1!R2C1:R16C1,MOD(RC1,3)+MOD(INT((RC1)/3),3)*5+3,FALSE)&"|"&HLOOKUP(Sheet1!R2C1,Sheet1!R2C1:R16C1,MOD(RC1+1,3)+MOD(INT((RC1+1)/3),3)*5+3,FALSE)&"|"&HLOOKUP(Sheet1!R2C1,Sheet1!R2C1:R16C1,MOD(RC1+2,3)+MOD(INT((RC1+2)/3),3)*5+3,FALSE)&"|"&HLOOKUP(Sheet1!R2C1,Sheet1!R2C1:R16C1,MOD(RC1+3,3)+MOD(INT((RC1+3)/3),3)*5+3,FALSE) -> 164|102|103|104|132 | K87: =HLOOKUP(Sheet1!R2C1,Sheet1!R2C1:R16C1,MOD(RC1-1,3)+MOD(INT((RC1-1)/3),3)*5+3,FALSE)&"|"&HLOOKUP(Sheet1!R2C1,Sheet1!R2C1:R16C1,MOD(RC1,3)+MOD(INT((RC1)/3),3)*5+3,FALSE)&"|"&HLOOKUP(Sheet1!R2C1,Sheet1!R2C1:R16C1,MOD(RC1+1,3)+MOD(INT((RC1+1)/3),3)*5+3,FALSE)&"|"&HLOOKUP(Sheet1!R2C1,Sheet1!R2C1:R16C1,MOD(RC1+2,3)+MOD(INT((RC1+2)/3),3)*5+3,FALSE)&"|"&HLOOKUP(Sheet1!R2C1,Sheet1!R2C1:R16C1,MOD(RC1+3,3)+MOD(INT((RC1+3)/3),3)*5+3,FALSE) -> 164|102|103|104|132 | L87: 25|22|23|24 | M87: 165485|165485|165485|165485 | N87: 10030|10031|10032|10033 | O87: 1|1|1|1 | P87: 2500|2500|2500|2500
A88: 82 | B88: 80 | C88: 30 | D88: =R[-20]C+2 -> 28 | E88: 1000 | F88: =MOD(RC[-5]-1,3)*30+100&"|"&MOD(RC[-5]-1,3)*30+101&"|"&MOD(RC[-5]-1,3)*30+102&"|"&MOD(RC[-5]-1,3)*30+103&"|"&IF(MOD(RC[-5],4)=0,HLOOKUP(Sheet1!R2C10,Sheet1!R2C10:R7C10,MOD(RC[-5]/4-1,6)+1,FALSE),IF(MOD(RC[-5],2)=0,IF(RC[-5]>20,HLOOKUP(Sheet1!R2C7,Sheet1!R2C7:R43C7,MOD(RC[-5]/2-1,42)+1,FALSE),HLOOKUP(Sheet1!R2C4,Sheet1!R2C4:R7C4,MOD(RC[-5]-1,6)+1,FALSE)),MOD(RC[-5]-1,3)*30+104)) -> 100|101|102|103|184 | G88: =HLOOKUP(Sheet1!R2C1,Sheet1!R2C1:R16C1,MOD(RC1-1,2)+MOD(INT((RC1-1)/2),3)*5+1,FALSE)&"|"&HLOOKUP(Sheet1!R2C1,Sheet1!R2C1:R16C1,MOD(RC1,2)+MOD(INT((RC1)/2),3)*5+1,FALSE)&"|"&HLOOKUP(Sheet1!R2C1,Sheet1!R2C1:R16C1,MOD(RC1+1,2)+MOD(INT((RC1+1)/2),3)*5+1,FALSE)&"|"&HLOOKUP(Sheet1!R2C1,Sheet1!R2C1:R16C1,MOD(RC1+2,2)+MOD(INT((RC1+2)/2),3)*5+1,FALSE)&"|"&HLOOKUP(Sheet1!R2C1,Sheet1!R2C1:R16C1,MOD(RC1+3,2)+MOD(INT((RC1+3)/2),3)*5+1,FALSE) -> 131|160|161|100|101 | H88: =HLOOKUP(Sheet1!R2C1,Sheet1!R2C1:R16C1,MOD(RC1+2,2)+MOD(INT((RC1+2)/2),3)*5+1,FALSE)&"|"&HLOOKUP(Sheet1!R2C1,Sheet1!R2C1:R16C1,MOD(RC1+3,2)+MOD(INT((RC1+3)/2),3)*5+1,FALSE)&"|"&HLOOKUP(Sheet1!R2C1,Sheet1!R2C1:R16C1,MOD(RC1+4,2)+MOD(INT((RC1+4)/2),3)*5+1,FALSE)&"|"&HLOOKUP(Sheet1!R2C1,Sheet1!R2C1:R16C1,MOD(RC1+5,2)+MOD(INT((RC1+5)/2),3)*5+1,FALSE)&"|"&HLOOKUP(Sheet1!R2C1,Sheet1!R2C1:R16C1,MOD(RC1+6,2)+MOD(INT((RC1+6)/2),3)*5+1,FALSE) -> 100|101|130|131|160 | I88: =HLOOKUP(Sheet1!R2C1,Sheet1!R2C1:R16C1,MOD(RC1-1,3)+MOD(INT((RC1-1)/3),3)*5+3,FALSE)&"|"&HLOOKUP(Sheet1!R2C1,Sheet1!R2C1:R16C1,MOD(RC1,3)+MOD(INT((RC1)/3),3)*5+3,FALSE)&"|"&HLOOKUP(Sheet1!R2C1,Sheet1!R2C1:R16C1,MOD(RC1+1,3)+MOD(INT((RC1+1)/3),3)*5+3,FALSE)&"|"&HLOOKUP(Sheet1!R2C1,Sheet1!R2C1:R16C1,MOD(RC1+2,3)+MOD(INT((RC1+2)/3),3)*5+3,FALSE)&"|"&HLOOKUP(Sheet1!R2C1,Sheet1!R2C1:R16C1,MOD(RC1+3,3)+MOD(INT((RC1+3)/3),3)*5+3,FALSE) -> 102|103|104|132|133 | J88: =HLOOKUP(Sheet1!R2C1,Sheet1!R2C1:R16C1,MOD(RC1-1,3)+MOD(INT((RC1-1)/3),3)*5+3,FALSE)&"|"&HLOOKUP(Sheet1!R2C1,Sheet1!R2C1:R16C1,MOD(RC1,3)+MOD(INT((RC1)/3),3)*5+3,FALSE)&"|"&HLOOKUP(Sheet1!R2C1,Sheet1!R2C1:R16C1,MOD(RC1+1,3)+MOD(INT((RC1+1)/3),3)*5+3,FALSE)&"|"&HLOOKUP(Sheet1!R2C1,Sheet1!R2C1:R16C1,MOD(RC1+2,3)+MOD(INT((RC1+2)/3),3)*5+3,FALSE)&"|"&HLOOKUP(Sheet1!R2C1,Sheet1!R2C1:R16C1,MOD(RC1+3,3)+MOD(INT((RC1+3)/3),3)*5+3,FALSE) -> 102|103|104|132|133 | K88: =HLOOKUP(Sheet1!R2C1,Sheet1!R2C1:R16C1,MOD(RC1-1,3)+MOD(INT((RC1-1)/3),3)*5+3,FALSE)&"|"&HLOOKUP(Sheet1!R2C1,Sheet1!R2C1:R16C1,MOD(RC1,3)+MOD(INT((RC1)/3),3)*5+3,FALSE)&"|"&HLOOKUP(Sheet1!R2C1,Sheet1!R2C1:R16C1,MOD(RC1+1,3)+MOD(INT((RC1+1)/3),3)*5+3,FALSE)&"|"&HLOOKUP(Sheet1!R2C1,Sheet1!R2C1:R16C1,MOD(RC1+2,3)+MOD(INT((RC1+2)/3),3)*5+3,FALSE)&"|"&HLOOKUP(Sheet1!R2C1,Sheet1!R2C1:R16C1,MOD(RC1+3,3)+MOD(INT((RC1+3)/3),3)*5+3,FALSE) -> 102|103|104|132|133 | L88: 25|22|23|24 | M88: 169372|169371|169373|169373 | N88: 10030|10031|10032|10033 | O88: 1|1|1|1 | P88: 2500|2500|2500|2500
A89: 83 | B89: 81 | C89: 30 | D89: =R[-20]C+2 -> 28 | E89: 1000 | F89: =MOD(RC[-5]-1,3)*30+100&"|"&MOD(RC[-5]-1,3)*30+101&"|"&MOD(RC[-5]-1,3)*30+102&"|"&MOD(RC[-5]-1,3)*30+103&"|"&IF(MOD(RC[-5],4)=0,HLOOKUP(Sheet1!R2C10,Sheet1!R2C10:R7C10,MOD(RC[-5]/4-1,6)+1,FALSE),IF(MOD(RC[-5],2)=0,IF(RC[-5]>20,HLOOKUP(Sheet1!R2C7,Sheet1!R2C7:R43C7,MOD(RC[-5]/2-1,42)+1,FALSE),HLOOKUP(Sheet1!R2C4,Sheet1!R2C4:R7C4,MOD(RC[-5]-1,6)+1,FALSE)),MOD(RC[-5]-1,3)*30+104)) -> 130|131|132|133|134 | G89: =HLOOKUP(Sheet1!R2C1,Sheet1!R2C1:R16C1,MOD(RC1-1,2)+MOD(INT((RC1-1)/2),3)*5+1,FALSE)&"|"&HLOOKUP(Sheet1!R2C1,Sheet1!R2C1:R16C1,MOD(RC1,2)+MOD(INT((RC1)/2),3)*5+1,FALSE)&"|"&HLOOKUP(Sheet1!R2C1,Sheet1!R2C1:R16C1,MOD(RC1+1,2)+MOD(INT((RC1+1)/2),3)*5+1,FALSE)&"|"&HLOOKUP(Sheet1!R2C1,Sheet1!R2C1:R16C1,MOD(RC1+2,2)+MOD(INT((RC1+2)/2),3)*5+1,FALSE)&"|"&HLOOKUP(Sheet1!R2C1,Sheet1!R2C1:R16C1,MOD(RC1+3,2)+MOD(INT((RC1+3)/2),3)*5+1,FALSE) -> 160|161|100|101|130 | H89: =HLOOKUP(Sheet1!R2C1,Sheet1!R2C1:R16C1,MOD(RC1+2,2)+MOD(INT((RC1+2)/2),3)*5+1,FALSE)&"|"&HLOOKUP(Sheet1!R2C1,Sheet1!R2C1:R16C1,MOD(RC1+3,2)+MOD(INT((RC1+3)/2),3)*5+1,FALSE)&"|"&HLOOKUP(Sheet1!R2C1,Sheet1!R2C1:R16C1,MOD(RC1+4,2)+MOD(INT((RC1+4)/2),3)*5+1,FALSE)&"|"&HLOOKUP(Sheet1!R2C1,Sheet1!R2C1:R16C1,MOD(RC1+5,2)+MOD(INT((RC1+5)/2),3)*5+1,FALSE)&"|"&HLOOKUP(Sheet1!R2C1,Sheet1!R2C1:R16C1,MOD(RC1+6,2)+MOD(INT((RC1+6)/2),3)*5+1,FALSE) -> 101|130|131|160|161 | I89: =HLOOKUP(Sheet1!R2C1,Sheet1!R2C1:R16C1,MOD(RC1-1,3)+MOD(INT((RC1-1)/3),3)*5+3,FALSE)&"|"&HLOOKUP(Sheet1!R2C1,Sheet1!R2C1:R16C1,MOD(RC1,3)+MOD(INT((RC1)/3),3)*5+3,FALSE)&"|"&HLOOKUP(Sheet1!R2C1,Sheet1!R2C1:R16C1,MOD(RC1+1,3)+MOD(INT((RC1+1)/3),3)*5+3,FALSE)&"|"&HLOOKUP(Sheet1!R2C1,Sheet1!R2C1:R16C1,MOD(RC1+2,3)+MOD(INT((RC1+2)/3),3)*5+3,FALSE)&"|"&HLOOKUP(Sheet1!R2C1,Sheet1!R2C1:R16C1,MOD(RC1+3,3)+MOD(INT((RC1+3)/3),3)*5+3,FALSE) -> 103|104|132|133|134 | J89: =HLOOKUP(Sheet1!R2C1,Sheet1!R2C1:R16C1,MOD(RC1-1,3)+MOD(INT((RC1-1)/3),3)*5+3,FALSE)&"|"&HLOOKUP(Sheet1!R2C1,Sheet1!R2C1:R16C1,MOD(RC1,3)+MOD(INT((RC1)/3),3)*5+3,FALSE)&"|"&HLOOKUP(Sheet1!R2C1,Sheet1!R2C1:R16C1,MOD(RC1+1,3)+MOD(INT((RC1+1)/3),3)*5+3,FALSE)&"|"&HLOOKUP(Sheet1!R2C1,Sheet1!R2C1:R16C1,MOD(RC1+2,3)+MOD(INT((RC1+2)/3),3)*5+3,FALSE)&"|"&HLOOKUP(Sheet1!R2C1,Sheet1!R2C1:R16C1,MOD(RC1+3,3)+MOD(INT((RC1+3)/3),3)*5+3,FALSE) -> 103|104|132|133|134 | K89: =HLOOKUP(Sheet1!R2C1,Sheet1!R2C1:R16C1,MOD(RC1-1,3)+MOD(INT((RC1-1)/3),3)*5+3,FALSE)&"|"&HLOOKUP(Sheet1!R2C1,Sheet1!R2C1:R16C1,MOD(RC1,3)+MOD(INT((RC1)/3),3)*5+3,FALSE)&"|"&HLOOKUP(Sheet1!R2C1,Sheet1!R2C1:R16C1,MOD(RC1+1,3)+MOD(INT((RC1+1)/3),3)*5+3,FALSE)&"|"&HLOOKUP(Sheet1!R2C1,Sheet1!R2C1:R16C1,MOD(RC1+2,3)+MOD(INT((RC1+2)/3),3)*5+3,FALSE)&"|"&HLOOKUP(Sheet1!R2C1,Sheet1!R2C1:R16C1,MOD(RC1+3,3)+MOD(INT((RC1+3)/3),3)*5+3,FALSE) -> 103|104|132|133|134 | L89: 25|22|23|24 | M89: 172921|172921|172923|172923 | N89: 10030|10031|10032|10033 | O89: 1|1|1|1 | P89: 2500|2500|2500|2500
A90: 84 | B90: 82 | C90: 30 | D90: =R[-20]C+2 -> 28 | E90: 1000 | F90: =MOD(RC[-5]-1,3)*30+100&"|"&MOD(RC[-5]-1,3)*30+101&"|"&MOD(RC[-5]-1,3)*30+102&"|"&MOD(RC[-5]-1,3)*30+103&"|"&IF(MOD(RC[-5],4)=0,HLOOKUP(Sheet1!R2C10,Sheet1!R2C10:R7C10,MOD(RC[-5]/4-1,6)+1,FALSE),IF(MOD(RC[-5],2)=0,IF(RC[-5]>20,HLOOKUP(Sheet1!R2C7,Sheet1!R2C7:R43C7,MOD(RC[-5]/2-1,42)+1,FALSE),HLOOKUP(Sheet1!R2C4,Sheet1!R2C4:R7C4,MOD(RC[-5]-1,6)+1,FALSE)),MOD(RC[-5]-1,3)*30+104)) -> 160|161|162|163|192 | G90: =HLOOKUP(Sheet1!R2C1,Sheet1!R2C1:R16C1,MOD(RC1-1,2)+MOD(INT((RC1-1)/2),3)*5+1,FALSE)&"|"&HLOOKUP(Sheet1!R2C1,Sheet1!R2C1:R16C1,MOD(RC1,2)+MOD(INT((RC1)/2),3)*5+1,FALSE)&"|"&HLOOKUP(Sheet1!R2C1,Sheet1!R2C1:R16C1,MOD(RC1+1,2)+MOD(INT((RC1+1)/2),3)*5+1,FALSE)&"|"&HLOOKUP(Sheet1!R2C1,Sheet1!R2C1:R16C1,MOD(RC1+2,2)+MOD(INT((RC1+2)/2),3)*5+1,FALSE)&"|"&HLOOKUP(Sheet1!R2C1,Sheet1!R2C1:R16C1,MOD(RC1+3,2)+MOD(INT((RC1+3)/2),3)*5+1,FALSE) -> 161|100|101|130|131 | H90: =HLOOKUP(Sheet1!R2C1,Sheet1!R2C1:R16C1,MOD(RC1+2,2)+MOD(INT((RC1+2)/2),3)*5+1,FALSE)&"|"&HLOOKUP(Sheet1!R2C1,Sheet1!R2C1:R16C1,MOD(RC1+3,2)+MOD(INT((RC1+3)/2),3)*5+1,FALSE)&"|"&HLOOKUP(Sheet1!R2C1,Sheet1!R2C1:R16C1,MOD(RC1+4,2)+MOD(INT((RC1+4)/2),3)*5+1,FALSE)&"|"&HLOOKUP(Sheet1!R2C1,Sheet1!R2C1:R16C1,MOD(RC1+5,2)+MOD(INT((RC1+5)/2),3)*5+1,FALSE)&"|"&HLOOKUP(Sheet1!R2C1,Sheet1!R2C1:R16C1,MOD(RC1+6,2)+MOD(INT((RC1+6)/2),3)*5+1,FALSE) -> 130|131|160|161|100 | I90: =HLOOKUP(Sheet1!R2C1,Sheet1!R2C1:R16C1,MOD(RC1-1,3)+MOD(INT((RC1-1)/3),3)*5+3,FALSE)&"|"&HLOOKUP(Sheet1!R2C1,Sheet1!R2C1:R16C1,MOD(RC1,3)+MOD(INT((RC1)/3),3)*5+3,FALSE)&"|"&HLOOKUP(Sheet1!R2C1,Sheet1!R2C1:R16C1,MOD(RC1+1,3)+MOD(INT((RC1+1)/3),3)*5+3,FALSE)&"|"&HLOOKUP(Sheet1!R2C1,Sheet1!R2C1:R16C1,MOD(RC1+2,3)+MOD(INT((RC1+2)/3),3)*5+3,FALSE)&"|"&HLOOKUP(Sheet1!R2C1,Sheet1!R2C1:R16C1,MOD(RC1+3,3)+MOD(INT((RC1+3)/3),3)*5+3,FALSE) -> 104|132|133|134|162 | J90: =HLOOKUP(Sheet1!R2C1,Sheet1!R2C1:R16C1,MOD(RC1-1,3)+MOD(INT((RC1-1)/3),3)*5+3,FALSE)&"|"&HLOOKUP(Sheet1!R2C1,Sheet1!R2C1:R16C1,MOD(RC1,3)+MOD(INT((RC1)/3),3)*5+3,FALSE)&"|"&HLOOKUP(Sheet1!R2C1,Sheet1!R2C1:R16C1,MOD(RC1+1,3)+MOD(INT((RC1+1)/3),3)*5+3,FALSE)&"|"&HLOOKUP(Sheet1!R2C1,Sheet1!R2C1:R16C1,MOD(RC1+2,3)+MOD(INT((RC1+2)/3),3)*5+3,FALSE)&"|"&HLOOKUP(Sheet1!R2C1,Sheet1!R2C1:R16C1,MOD(RC1+3,3)+MOD(INT((RC1+3)/3),3)*5+3,FALSE) -> 104|132|133|134|162 | K90: =HLOOKUP(Sheet1!R2C1,Sheet1!R2C1:R16C1,MOD(RC1-1,3)+MOD(INT((RC1-1)/3),3)*5+3,FALSE)&"|"&HLOOKUP(Sheet1!R2C1,Sheet1!R2C1:R16C1,MOD(RC1,3)+MOD(INT((RC1)/3),3)*5+3,FALSE)&"|"&HLOOKUP(Sheet1!R2C1,Sheet1!R2C1:R16C1,MOD(RC1+1,3)+MOD(INT((RC1+1)/3),3)*5+3,FALSE)&"|"&HLOOKUP(Sheet1!R2C1,Sheet1!R2C1:R16C1,MOD(RC1+2,3)+MOD(INT((RC1+2)/3),3)*5+3,FALSE)&"|"&HLOOKUP(Sheet1!R2C1,Sheet1!R2C1:R16C1,MOD(RC1+3,3)+MOD(INT((RC1+3)/3),3)*5+3,FALSE) -> 104|132|133|134|162 | L90: 25|22|23|24 | M90: 176449|176449|176450|176450 | N90: 10030|10031|10032|10033 | O90: 1|1|1|1 | P90: 2500|2500|2500|2500
A91: 85 | B91: 83 | C91: 30 | D91: =R[-20]C+2 -> 28 | E91: 1000 | F91: =MOD(RC[-5]-1,3)*30+100&"|"&MOD(RC[-5]-1,3)*30+101&"|"&MOD(RC[-5]-1,3)*30+102&"|"&MOD(RC[-5]-1,3)*30+103&"|"&IF(MOD(RC[-5],4)=0,HLOOKUP(Sheet1!R2C10,Sheet1!R2C10:R7C10,MOD(RC[-5]/4-1,6)+1,FALSE),IF(MOD(RC[-5],2)=0,IF(RC[-5]>20,HLOOKUP(Sheet1!R2C7,Sheet1!R2C7:R43C7,MOD(RC[-5]/2-1,42)+1,FALSE),HLOOKUP(Sheet1!R2C4,Sheet1!R2C4:R7C4,MOD(RC[-5]-1,6)+1,FALSE)),MOD(RC[-5]-1,3)*30+104)) -> 100|101|102|103|104 | G91: =HLOOKUP(Sheet1!R2C1,Sheet1!R2C1:R16C1,MOD(RC1-1,2)+MOD(INT((RC1-1)/2),3)*5+1,FALSE)&"|"&HLOOKUP(Sheet1!R2C1,Sheet1!R2C1:R16C1,MOD(RC1,2)+MOD(INT((RC1)/2),3)*5+1,FALSE)&"|"&HLOOKUP(Sheet1!R2C1,Sheet1!R2C1:R16C1,MOD(RC1+1,2)+MOD(INT((RC1+1)/2),3)*5+1,FALSE)&"|"&HLOOKUP(Sheet1!R2C1,Sheet1!R2C1:R16C1,MOD(RC1+2,2)+MOD(INT((RC1+2)/2),3)*5+1,FALSE)&"|"&HLOOKUP(Sheet1!R2C1,Sheet1!R2C1:R16C1,MOD(RC1+3,2)+MOD(INT((RC1+3)/2),3)*5+1,FALSE) -> 100|101|130|131|160 | H91: =HLOOKUP(Sheet1!R2C1,Sheet1!R2C1:R16C1,MOD(RC1+2,2)+MOD(INT((RC1+2)/2),3)*5+1,FALSE)&"|"&HLOOKUP(Sheet1!R2C1,Sheet1!R2C1:R16C1,MOD(RC1+3,2)+MOD(INT((RC1+3)/2),3)*5+1,FALSE)&"|"&HLOOKUP(Sheet1!R2C1,Sheet1!R2C1:R16C1,MOD(RC1+4,2)+MOD(INT((RC1+4)/2),3)*5+1,FALSE)&"|"&HLOOKUP(Sheet1!R2C1,Sheet1!R2C1:R16C1,MOD(RC1+5,2)+MOD(INT((RC1+5)/2),3)*5+1,FALSE)&"|"&HLOOKUP(Sheet1!R2C1,Sheet1!R2C1:R16C1,MOD(RC1+6,2)+MOD(INT((RC1+6)/2),3)*5+1,FALSE) -> 131|160|161|100|101 | I91: =HLOOKUP(Sheet1!R2C1,Sheet1!R2C1:R16C1,MOD(RC1-1,3)+MOD(INT((RC1-1)/3),3)*5+3,FALSE)&"|"&HLOOKUP(Sheet1!R2C1,Sheet1!R2C1:R16C1,MOD(RC1,3)+MOD(INT((RC1)/3),3)*5+3,FALSE)&"|"&HLOOKUP(Sheet1!R2C1,Sheet1!R2C1:R16C1,MOD(RC1+1,3)+MOD(INT((RC1+1)/3),3)*5+3,FALSE)&"|"&HLOOKUP(Sheet1!R2C1,Sheet1!R2C1:R16C1,MOD(RC1+2,3)+MOD(INT((RC1+2)/3),3)*5+3,FALSE)&"|"&HLOOKUP(Sheet1!R2C1,Sheet1!R2C1:R16C1,MOD(RC1+3,3)+MOD(INT((RC1+3)/3),3)*5+3,FALSE) -> 132|133|134|162|163 | J91: =HLOOKUP(Sheet1!R2C1,Sheet1!R2C1:R16C1,MOD(RC1-1,3)+MOD(INT((RC1-1)/3),3)*5+3,FALSE)&"|"&HLOOKUP(Sheet1!R2C1,Sheet1!R2C1:R16C1,MOD(RC1,3)+MOD(INT((RC1)/3),3)*5+3,FALSE)&"|"&HLOOKUP(Sheet1!R2C1,Sheet1!R2C1:R16C1,MOD(RC1+1,3)+MOD(INT((RC1+1)/3),3)*5+3,FALSE)&"|"&HLOOKUP(Sheet1!R2C1,Sheet1!R2C1:R16C1,MOD(RC1+2,3)+MOD(INT((RC1+2)/3),3)*5+3,FALSE)&"|"&HLOOKUP(Sheet1!R2C1,Sheet1!R2C1:R16C1,MOD(RC1+3,3)+MOD(INT((RC1+3)/3),3)*5+3,FALSE) -> 132|133|134|162|163 | K91: =HLOOKUP(Sheet1!R2C1,Sheet1!R2C1:R16C1,MOD(RC1-1,3)+MOD(INT((RC1-1)/3),3)*5+3,FALSE)&"|"&HLOOKUP(Sheet1!R2C1,Sheet1!R2C1:R16C1,MOD(RC1,3)+MOD(INT((RC1)/3),3)*5+3,FALSE)&"|"&HLOOKUP(Sheet1!R2C1,Sheet1!R2C1:R16C1,MOD(RC1+1,3)+MOD(INT((RC1+1)/3),3)*5+3,FALSE)&"|"&HLOOKUP(Sheet1!R2C1,Sheet1!R2C1:R16C1,MOD(RC1+2,3)+MOD(INT((RC1+2)/3),3)*5+3,FALSE)&"|"&HLOOKUP(Sheet1!R2C1,Sheet1!R2C1:R16C1,MOD(RC1+3,3)+MOD(INT((RC1+3)/3),3)*5+3,FALSE) -> 132|133|134|162|163 | L91: 25|22|23|24 | M91: 179977|179976|179978|179978 | N91: 10030|10031|10032|10033|10030|10031|10032|10033|10030|10031|10032|10033|10030|10031|10032|10033|10030|10031|10032|10033|10030|10031|10032|10033|10030|10031|10032|10033|10030|10031|10032|10033|10030|10031|10032|10033|10030|10031|10032|10033 | O91: 1|1|1|1|1|1|1|1|1|1|1|1|1|1|1|1|1|1|1|1|1|1|1|1|1|1|1|1|1|1|1|1|1|1|1|1|1|1|1|1 | P91: 2500|2500|2500|2500|2500|2500|2500|2500|2500|2500|2500|2500|2500|2500|2500|2500|2500|2500|2500|2500|2500|2500|2500|2500|2500|2500|2500|2500|2500|2500|2500|2500|2500|2500|2500|2500|2500|2500|2500|2500
A92: 86 | B92: 84 | C92: 30 | D92: =R[-20]C+2 -> 28 | E92: 1000 | F92: =MOD(RC[-5]-1,3)*30+100&"|"&MOD(RC[-5]-1,3)*30+101&"|"&MOD(RC[-5]-1,3)*30+102&"|"&MOD(RC[-5]-1,3)*30+103&"|"&IF(MOD(RC[-5],4)=0,HLOOKUP(Sheet1!R2C10,Sheet1!R2C10:R7C10,MOD(RC[-5]/4-1,6)+1,FALSE),IF(MOD(RC[-5],2)=0,IF(RC[-5]>20,HLOOKUP(Sheet1!R2C7,Sheet1!R2C7:R43C7,MOD(RC[-5]/2-1,42)+1,FALSE),HLOOKUP(Sheet1!R2C4,Sheet1!R2C4:R7C4,MOD(RC[-5]-1,6)+1,FALSE)),MOD(RC[-5]-1,3)*30+104)) -> 130|131|132|133|112 | G92: =HLOOKUP(Sheet1!R2C1,Sheet1!R2C1:R16C1,MOD(RC1-1,2)+MOD(INT((RC1-1)/2),3)*5+1,FALSE)&"|"&HLOOKUP(Sheet1!R2C1,Sheet1!R2C1:R16C1,MOD(RC1,2)+MOD(INT((RC1)/2),3)*5+1,FALSE)&"|"&HLOOKUP(Sheet1!R2C1,Sheet1!R2C1:R16C1,MOD(RC1+1,2)+MOD(INT((RC1+1)/2),3)*5+1,FALSE)&"|"&HLOOKUP(Sheet1!R2C1,Sheet1!R2C1:R16C1,MOD(RC1+2,2)+MOD(INT((RC1+2)/2),3)*5+1,FALSE)&"|"&HLOOKUP(Sheet1!R2C1,Sheet1!R2C1:R16C1,MOD(RC1+3,2)+MOD(INT((RC1+3)/2),3)*5+1,FALSE) -> 101|130|131|160|161 | H92: =HLOOKUP(Sheet1!R2C1,Sheet1!R2C1:R16C1,MOD(RC1+2,2)+MOD(INT((RC1+2)/2),3)*5+1,FALSE)&"|"&HLOOKUP(Sheet1!R2C1,Sheet1!R2C1:R16C1,MOD(RC1+3,2)+MOD(INT((RC1+3)/2),3)*5+1,FALSE)&"|"&HLOOKUP(Sheet1!R2C1,Sheet1!R2C1:R16C1,MOD(RC1+4,2)+MOD(INT((RC1+4)/2),3)*5+1,FALSE)&"|"&HLOOKUP(Sheet1!R2C1,Sheet1!R2C1:R16C1,MOD(RC1+5,2)+MOD(INT((RC1+5)/2),3)*5+1,FALSE)&"|"&HLOOKUP(Sheet1!R2C1,Sheet1!R2C1:R16C1,MOD(RC1+6,2)+MOD(INT((RC1+6)/2),3)*5+1,FALSE) -> 160|161|100|101|130 | I92: =HLOOKUP(Sheet1!R2C1,Sheet1!R2C1:R16C1,MOD(RC1-1,3)+MOD(INT((RC1-1)/3),3)*5+3,FALSE)&"|"&HLOOKUP(Sheet1!R2C1,Sheet1!R2C1:R16C1,MOD(RC1,3)+MOD(INT((RC1)/3),3)*5+3,FALSE)&"|"&HLOOKUP(Sheet1!R2C1,Sheet1!R2C1:R16C1,MOD(RC1+1,3)+MOD(INT((RC1+1)/3),3)*5+3,FALSE)&"|"&HLOOKUP(Sheet1!R2C1,Sheet1!R2C1:R16C1,MOD(RC1+2,3)+MOD(INT((RC1+2)/3),3)*5+3,FALSE)&"|"&HLOOKUP(Sheet1!R2C1,Sheet1!R2C1:R16C1,MOD(RC1+3,3)+MOD(INT((RC1+3)/3),3)*5+3,FALSE) -> 133|134|162|163|164 | J92: =HLOOKUP(Sheet1!R2C1,Sheet1!R2C1:R16C1,MOD(RC1-1,3)+MOD(INT((RC1-1)/3),3)*5+3,FALSE)&"|"&HLOOKUP(Sheet1!R2C1,Sheet1!R2C1:R16C1,MOD(RC1,3)+MOD(INT((RC1)/3),3)*5+3,FALSE)&"|"&HLOOKUP(Sheet1!R2C1,Sheet1!R2C1:R16C1,MOD(RC1+1,3)+MOD(INT((RC1+1)/3),3)*5+3,FALSE)&"|"&HLOOKUP(Sheet1!R2C1,Sheet1!R2C1:R16C1,MOD(RC1+2,3)+MOD(INT((RC1+2)/3),3)*5+3,FALSE)&"|"&HLOOKUP(Sheet1!R2C1,Sheet1!R2C1:R16C1,MOD(RC1+3,3)+MOD(INT((RC1+3)/3),3)*5+3,FALSE) -> 133|134|162|163|164 | K92: =HLOOKUP(Sheet1!R2C1,Sheet1!R2C1:R16C1,MOD(RC1-1,3)+MOD(INT((RC1-1)/3),3)*5+3,FALSE)&"|"&HLOOKUP(Sheet1!R2C1,Sheet1!R2C1:R16C1,MOD(RC1,3)+MOD(INT((RC1)/3),3)*5+3,FALSE)&"|"&HLOOKUP(Sheet1!R2C1,Sheet1!R2C1:R16C1,MOD(RC1+1,3)+MOD(INT((RC1+1)/3),3)*5+3,FALSE)&"|"&HLOOKUP(Sheet1!R2C1,Sheet1!R2C1:R16C1,MOD(RC1+2,3)+MOD(INT((RC1+2)/3),3)*5+3,FALSE)&"|"&HLOOKUP(Sheet1!R2C1,Sheet1!R2C1:R16C1,MOD(RC1+3,3)+MOD(INT((RC1+3)/3),3)*5+3,FALSE) -> 133|134|162|163|164 | L92: 25|22|23|24 | M92: 183625|183625|183625|183625 | N92: 10030|10031|10032|10033 | O92: 1|1|1|1 | P92: 2500|2500|2500|2500
A93: 87 | B93: 85 | C93: 30 | D93: =R[-20]C+2 -> 28 | E93: 1000 | F93: =MOD(RC[-5]-1,3)*30+100&"|"&MOD(RC[-5]-1,3)*30+101&"|"&MOD(RC[-5]-1,3)*30+102&"|"&MOD(RC[-5]-1,3)*30+103&"|"&IF(MOD(RC[-5],4)=0,HLOOKUP(Sheet1!R2C10,Sheet1!R2C10:R7C10,MOD(RC[-5]/4-1,6)+1,FALSE),IF(MOD(RC[-5],2)=0,IF(RC[-5]>20,HLOOKUP(Sheet1!R2C7,Sheet1!R2C7:R43C7,MOD(RC[-5]/2-1,42)+1,FALSE),HLOOKUP(Sheet1!R2C4,Sheet1!R2C4:R7C4,MOD(RC[-5]-1,6)+1,FALSE)),MOD(RC[-5]-1,3)*30+104)) -> 160|161|162|163|164 | G93: =HLOOKUP(Sheet1!R2C1,Sheet1!R2C1:R16C1,MOD(RC1-1,2)+MOD(INT((RC1-1)/2),3)*5+1,FALSE)&"|"&HLOOKUP(Sheet1!R2C1,Sheet1!R2C1:R16C1,MOD(RC1,2)+MOD(INT((RC1)/2),3)*5+1,FALSE)&"|"&HLOOKUP(Sheet1!R2C1,Sheet1!R2C1:R16C1,MOD(RC1+1,2)+MOD(INT((RC1+1)/2),3)*5+1,FALSE)&"|"&HLOOKUP(Sheet1!R2C1,Sheet1!R2C1:R16C1,MOD(RC1+2,2)+MOD(INT((RC1+2)/2),3)*5+1,FALSE)&"|"&HLOOKUP(Sheet1!R2C1,Sheet1!R2C1:R16C1,MOD(RC1+3,2)+MOD(INT((RC1+3)/2),3)*5+1,FALSE) -> 130|131|160|161|100 | H93: =HLOOKUP(Sheet1!R2C1,Sheet1!R2C1:R16C1,MOD(RC1+2,2)+MOD(INT((RC1+2)/2),3)*5+1,FALSE)&"|"&HLOOKUP(Sheet1!R2C1,Sheet1!R2C1:R16C1,MOD(RC1+3,2)+MOD(INT((RC1+3)/2),3)*5+1,FALSE)&"|"&HLOOKUP(Sheet1!R2C1,Sheet1!R2C1:R16C1,MOD(RC1+4,2)+MOD(INT((RC1+4)/2),3)*5+1,FALSE)&"|"&HLOOKUP(Sheet1!R2C1,Sheet1!R2C1:R16C1,MOD(RC1+5,2)+MOD(INT((RC1+5)/2),3)*5+1,FALSE)&"|"&HLOOKUP(Sheet1!R2C1,Sheet1!R2C1:R16C1,MOD(RC1+6,2)+MOD(INT((RC1+6)/2),3)*5+1,FALSE) -> 161|100|101|130|131 | I93: =HLOOKUP(Sheet1!R2C1,Sheet1!R2C1:R16C1,MOD(RC1-1,3)+MOD(INT((RC1-1)/3),3)*5+3,FALSE)&"|"&HLOOKUP(Sheet1!R2C1,Sheet1!R2C1:R16C1,MOD(RC1,3)+MOD(INT((RC1)/3),3)*5+3,FALSE)&"|"&HLOOKUP(Sheet1!R2C1,Sheet1!R2C1:R16C1,MOD(RC1+1,3)+MOD(INT((RC1+1)/3),3)*5+3,FALSE)&"|"&HLOOKUP(Sheet1!R2C1,Sheet1!R2C1:R16C1,MOD(RC1+2,3)+MOD(INT((RC1+2)/3),3)*5+3,FALSE)&"|"&HLOOKUP(Sheet1!R2C1,Sheet1!R2C1:R16C1,MOD(RC1+3,3)+MOD(INT((RC1+3)/3),3)*5+3,FALSE) -> 134|162|163|164|102 | J93: =HLOOKUP(Sheet1!R2C1,Sheet1!R2C1:R16C1,MOD(RC1-1,3)+MOD(INT((RC1-1)/3),3)*5+3,FALSE)&"|"&HLOOKUP(Sheet1!R2C1,Sheet1!R2C1:R16C1,MOD(RC1,3)+MOD(INT((RC1)/3),3)*5+3,FALSE)&"|"&HLOOKUP(Sheet1!R2C1,Sheet1!R2C1:R16C1,MOD(RC1+1,3)+MOD(INT((RC1+1)/3),3)*5+3,FALSE)&"|"&HLOOKUP(Sheet1!R2C1,Sheet1!R2C1:R16C1,MOD(RC1+2,3)+MOD(INT((RC1+2)/3),3)*5+3,FALSE)&"|"&HLOOKUP(Sheet1!R2C1,Sheet1!R2C1:R16C1,MOD(RC1+3,3)+MOD(INT((RC1+3)/3),3)*5+3,FALSE) -> 134|162|163|164|102 | K93: =HLOOKUP(Sheet1!R2C1,Sheet1!R2C1:R16C1,MOD(RC1-1,3)+MOD(INT((RC1-1)/3),3)*5+3,FALSE)&"|"&HLOOKUP(Sheet1!R2C1,Sheet1!R2C1:R16C1,MOD(RC1,3)+MOD(INT((RC1)/3),3)*5+3,FALSE)&"|"&HLOOKUP(Sheet1!R2C1,Sheet1!R2C1:R16C1,MOD(RC1+1,3)+MOD(INT((RC1+1)/3),3)*5+3,FALSE)&"|"&HLOOKUP(Sheet1!R2C1,Sheet1!R2C1:R16C1,MOD(RC1+2,3)+MOD(INT((RC1+2)/3),3)*5+3,FALSE)&"|"&HLOOKUP(Sheet1!R2C1,Sheet1!R2C1:R16C1,MOD(RC1+3,3)+MOD(INT((RC1+3)/3),3)*5+3,FALSE) -> 134|162|163|164|102 | L93: 25|22|23|24 | M93: 187178|187179|187178|187178 | N93: 10030|10031|10032|10033 | O93: 1|1|1|1 | P93: 2500|2500|2500|2500
A94: 88 | B94: 86 | C94: 30 | D94: =R[-20]C+2 -> 28 | E94: 1000 | F94: =MOD(RC[-5]-1,3)*30+100&"|"&MOD(RC[-5]-1,3)*30+101&"|"&MOD(RC[-5]-1,3)*30+102&"|"&MOD(RC[-5]-1,3)*30+103&"|"&IF(MOD(RC[-5],4)=0,HLOOKUP(Sheet1!R2C10,Sheet1!R2C10:R7C10,MOD(RC[-5]/4-1,6)+1,FALSE),IF(MOD(RC[-5],2)=0,IF(RC[-5]>20,HLOOKUP(Sheet1!R2C7,Sheet1!R2C7:R43C7,MOD(RC[-5]/2-1,42)+1,FALSE),HLOOKUP(Sheet1!R2C4,Sheet1!R2C4:R7C4,MOD(RC[-5]-1,6)+1,FALSE)),MOD(RC[-5]-1,3)*30+104)) -> 100|101|102|103|193 | G94: =HLOOKUP(Sheet1!R2C1,Sheet1!R2C1:R16C1,MOD(RC1-1,2)+MOD(INT((RC1-1)/2),3)*5+1,FALSE)&"|"&HLOOKUP(Sheet1!R2C1,Sheet1!R2C1:R16C1,MOD(RC1,2)+MOD(INT((RC1)/2),3)*5+1,FALSE)&"|"&HLOOKUP(Sheet1!R2C1,Sheet1!R2C1:R16C1,MOD(RC1+1,2)+MOD(INT((RC1+1)/2),3)*5+1,FALSE)&"|"&HLOOKUP(Sheet1!R2C1,Sheet1!R2C1:R16C1,MOD(RC1+2,2)+MOD(INT((RC1+2)/2),3)*5+1,FALSE)&"|"&HLOOKUP(Sheet1!R2C1,Sheet1!R2C1:R16C1,MOD(RC1+3,2)+MOD(INT((RC1+3)/2),3)*5+1,FALSE) -> 131|160|161|100|101 | H94: =HLOOKUP(Sheet1!R2C1,Sheet1!R2C1:R16C1,MOD(RC1+2,2)+MOD(INT((RC1+2)/2),3)*5+1,FALSE)&"|"&HLOOKUP(Sheet1!R2C1,Sheet1!R2C1:R16C1,MOD(RC1+3,2)+MOD(INT((RC1+3)/2),3)*5+1,FALSE)&"|"&HLOOKUP(Sheet1!R2C1,Sheet1!R2C1:R16C1,MOD(RC1+4,2)+MOD(INT((RC1+4)/2),3)*5+1,FALSE)&"|"&HLOOKUP(Sheet1!R2C1,Sheet1!R2C1:R16C1,MOD(RC1+5,2)+MOD(INT((RC1+5)/2),3)*5+1,FALSE)&"|"&HLOOKUP(Sheet1!R2C1,Sheet1!R2C1:R16C1,MOD(RC1+6,2)+MOD(INT((RC1+6)/2),3)*5+1,FALSE) -> 100|101|130|131|160 | I94: =HLOOKUP(Sheet1!R2C1,Sheet1!R2C1:R16C1,MOD(RC1-1,3)+MOD(INT((RC1-1)/3),3)*5+3,FALSE)&"|"&HLOOKUP(Sheet1!R2C1,Sheet1!R2C1:R16C1,MOD(RC1,3)+MOD(INT((RC1)/3),3)*5+3,FALSE)&"|"&HLOOKUP(Sheet1!R2C1,Sheet1!R2C1:R16C1,MOD(RC1+1,3)+MOD(INT((RC1+1)/3),3)*5+3,FALSE)&"|"&HLOOKUP(Sheet1!R2C1,Sheet1!R2C1:R16C1,MOD(RC1+2,3)+MOD(INT((RC1+2)/3),3)*5+3,FALSE)&"|"&HLOOKUP(Sheet1!R2C1,Sheet1!R2C1:R16C1,MOD(RC1+3,3)+MOD(INT((RC1+3)/3),3)*5+3,FALSE) -> 162|163|164|102|103 | J94: =HLOOKUP(Sheet1!R2C1,Sheet1!R2C1:R16C1,MOD(RC1-1,3)+MOD(INT((RC1-1)/3),3)*5+3,FALSE)&"|"&HLOOKUP(Sheet1!R2C1,Sheet1!R2C1:R16C1,MOD(RC1,3)+MOD(INT((RC1)/3),3)*5+3,FALSE)&"|"&HLOOKUP(Sheet1!R2C1,Sheet1!R2C1:R16C1,MOD(RC1+1,3)+MOD(INT((RC1+1)/3),3)*5+3,FALSE)&"|"&HLOOKUP(Sheet1!R2C1,Sheet1!R2C1:R16C1,MOD(RC1+2,3)+MOD(INT((RC1+2)/3),3)*5+3,FALSE)&"|"&HLOOKUP(Sheet1!R2C1,Sheet1!R2C1:R16C1,MOD(RC1+3,3)+MOD(INT((RC1+3)/3),3)*5+3,FALSE) -> 162|163|164|102|103 | K94: =HLOOKUP(Sheet1!R2C1,Sheet1!R2C1:R16C1,MOD(RC1-1,3)+MOD(INT((RC1-1)/3),3)*5+3,FALSE)&"|"&HLOOKUP(Sheet1!R2C1,Sheet1!R2C1:R16C1,MOD(RC1,3)+MOD(INT((RC1)/3),3)*5+3,FALSE)&"|"&HLOOKUP(Sheet1!R2C1,Sheet1!R2C1:R16C1,MOD(RC1+1,3)+MOD(INT((RC1+1)/3),3)*5+3,FALSE)&"|"&HLOOKUP(Sheet1!R2C1,Sheet1!R2C1:R16C1,MOD(RC1+2,3)+MOD(INT((RC1+2)/3),3)*5+3,FALSE)&"|"&HLOOKUP(Sheet1!R2C1,Sheet1!R2C1:R16C1,MOD(RC1+3,3)+MOD(INT((RC1+3)/3),3)*5+3,FALSE) -> 162|163|164|102|103 | L94: 25|22|23|24 | M94: 190843|190843|190843|190843 | N94: 10030|10031|10032|10033 | O94: 1|1|1|1 | P94: 2500|2500|2500|2500
A95: 89 | B95: 87 | C95: 30 | D95: =R[-20]C+2 -> 28 | E95: 1000 | F95: =MOD(RC[-5]-1,3)*30+100&"|"&MOD(RC[-5]-1,3)*30+101&"|"&MOD(RC[-5]-1,3)*30+102&"|"&MOD(RC[-5]-1,3)*30+103&"|"&IF(MOD(RC[-5],4)=0,HLOOKUP(Sheet1!R2C10,Sheet1!R2C10:R7C10,MOD(RC[-5]/4-1,6)+1,FALSE),IF(MOD(RC[-5],2)=0,IF(RC[-5]>20,HLOOKUP(Sheet1!R2C7,Sheet1!R2C7:R43C7,MOD(RC[-5]/2-1,42)+1,FALSE),HLOOKUP(Sheet1!R2C4,Sheet1!R2C4:R7C4,MOD(RC[-5]-1,6)+1,FALSE)),MOD(RC[-5]-1,3)*30+104)) -> 130|131|132|133|134 | G95: =HLOOKUP(Sheet1!R2C1,Sheet1!R2C1:R16C1,MOD(RC1-1,2)+MOD(INT((RC1-1)/2),3)*5+1,FALSE)&"|"&HLOOKUP(Sheet1!R2C1,Sheet1!R2C1:R16C1,MOD(RC1,2)+MOD(INT((RC1)/2),3)*5+1,FALSE)&"|"&HLOOKUP(Sheet1!R2C1,Sheet1!R2C1:R16C1,MOD(RC1+1,2)+MOD(INT((RC1+1)/2),3)*5+1,FALSE)&"|"&HLOOKUP(Sheet1!R2C1,Sheet1!R2C1:R16C1,MOD(RC1+2,2)+MOD(INT((RC1+2)/2),3)*5+1,FALSE)&"|"&HLOOKUP(Sheet1!R2C1,Sheet1!R2C1:R16C1,MOD(RC1+3,2)+MOD(INT((RC1+3)/2),3)*5+1,FALSE) -> 160|161|100|101|130 | H95: =HLOOKUP(Sheet1!R2C1,Sheet1!R2C1:R16C1,MOD(RC1+2,2)+MOD(INT((RC1+2)/2),3)*5+1,FALSE)&"|"&HLOOKUP(Sheet1!R2C1,Sheet1!R2C1:R16C1,MOD(RC1+3,2)+MOD(INT((RC1+3)/2),3)*5+1,FALSE)&"|"&HLOOKUP(Sheet1!R2C1,Sheet1!R2C1:R16C1,MOD(RC1+4,2)+MOD(INT((RC1+4)/2),3)*5+1,FALSE)&"|"&HLOOKUP(Sheet1!R2C1,Sheet1!R2C1:R16C1,MOD(RC1+5,2)+MOD(INT((RC1+5)/2),3)*5+1,FALSE)&"|"&HLOOKUP(Sheet1!R2C1,Sheet1!R2C1:R16C1,MOD(RC1+6,2)+MOD(INT((RC1+6)/2),3)*5+1,FALSE) -> 101|130|131|160|161 | I95: =HLOOKUP(Sheet1!R2C1,Sheet1!R2C1:R16C1,MOD(RC1-1,3)+MOD(INT((RC1-1)/3),3)*5+3,FALSE)&"|"&HLOOKUP(Sheet1!R2C1,Sheet1!R2C1:R16C1,MOD(RC1,3)+MOD(INT((RC1)/3),3)*5+3,FALSE)&"|"&HLOOKUP(Sheet1!R2C1,Sheet1!R2C1:R16C1,MOD(RC1+1,3)+MOD(INT((RC1+1)/3),3)*5+3,FALSE)&"|"&HLOOKUP(Sheet1!R2C1,Sheet1!R2C1:R16C1,MOD(RC1+2,3)+MOD(INT((RC1+2)/3),3)*5+3,FALSE)&"|"&HLOOKUP(Sheet1!R2C1,Sheet1!R2C1:R16C1,MOD(RC1+3,3)+MOD(INT((RC1+3)/3),3)*5+3,FALSE) -> 163|164|102|103|104 | J95: =HLOOKUP(Sheet1!R2C1,Sheet1!R2C1:R16C1,MOD(RC1-1,3)+MOD(INT((RC1-1)/3),3)*5+3,FALSE)&"|"&HLOOKUP(Sheet1!R2C1,Sheet1!R2C1:R16C1,MOD(RC1,3)+MOD(INT((RC1)/3),3)*5+3,FALSE)&"|"&HLOOKUP(Sheet1!R2C1,Sheet1!R2C1:R16C1,MOD(RC1+1,3)+MOD(INT((RC1+1)/3),3)*5+3,FALSE)&"|"&HLOOKUP(Sheet1!R2C1,Sheet1!R2C1:R16C1,MOD(RC1+2,3)+MOD(INT((RC1+2)/3),3)*5+3,FALSE)&"|"&HLOOKUP(Sheet1!R2C1,Sheet1!R2C1:R16C1,MOD(RC1+3,3)+MOD(INT((RC1+3)/3),3)*5+3,FALSE) -> 163|164|102|103|104 | K95: =HLOOKUP(Sheet1!R2C1,Sheet1!R2C1:R16C1,MOD(RC1-1,3)+MOD(INT((RC1-1)/3),3)*5+3,FALSE)&"|"&HLOOKUP(Sheet1!R2C1,Sheet1!R2C1:R16C1,MOD(RC1,3)+MOD(INT((RC1)/3),3)*5+3,FALSE)&"|"&HLOOKUP(Sheet1!R2C1,Sheet1!R2C1:R16C1,MOD(RC1+1,3)+MOD(INT((RC1+1)/3),3)*5+3,FALSE)&"|"&HLOOKUP(Sheet1!R2C1,Sheet1!R2C1:R16C1,MOD(RC1+2,3)+MOD(INT((RC1+2)/3),3)*5+3,FALSE)&"|"&HLOOKUP(Sheet1!R2C1,Sheet1!R2C1:R16C1,MOD(RC1+3,3)+MOD(INT((RC1+3)/3),3)*5+3,FALSE) -> 163|164|102|103|104 | L95: 25|22|23|24 | M95: 194663|194663|194663|194663 | N95: 10030|10031|10032|10033 | O95: 1|1|1|1 | P95: 2500|2500|2500|2500
A96: 90 | B96: 88 | C96: 30 | D96: =R[-20]C+2 -> 28 | E96: 1000 | F96: =MOD(RC[-5]-1,3)*30+100&"|"&MOD(RC[-5]-1,3)*30+101&"|"&MOD(RC[-5]-1,3)*30+102&"|"&MOD(RC[-5]-1,3)*30+103&"|"&IF(MOD(RC[-5],4)=0,HLOOKUP(Sheet1!R2C10,Sheet1!R2C10:R7C10,MOD(RC[-5]/4-1,6)+1,FALSE),IF(MOD(RC[-5],2)=0,IF(RC[-5]>20,HLOOKUP(Sheet1!R2C7,Sheet1!R2C7:R43C7,MOD(RC[-5]/2-1,42)+1,FALSE),HLOOKUP(Sheet1!R2C4,Sheet1!R2C4:R7C4,MOD(RC[-5]-1,6)+1,FALSE)),MOD(RC[-5]-1,3)*30+104)) -> 160|161|162|163|114 | G96: =HLOOKUP(Sheet1!R2C1,Sheet1!R2C1:R16C1,MOD(RC1-1,2)+MOD(INT((RC1-1)/2),3)*5+1,FALSE)&"|"&HLOOKUP(Sheet1!R2C1,Sheet1!R2C1:R16C1,MOD(RC1,2)+MOD(INT((RC1)/2),3)*5+1,FALSE)&"|"&HLOOKUP(Sheet1!R2C1,Sheet1!R2C1:R16C1,MOD(RC1+1,2)+MOD(INT((RC1+1)/2),3)*5+1,FALSE)&"|"&HLOOKUP(Sheet1!R2C1,Sheet1!R2C1:R16C1,MOD(RC1+2,2)+MOD(INT((RC1+2)/2),3)*5+1,FALSE)&"|"&HLOOKUP(Sheet1!R2C1,Sheet1!R2C1:R16C1,MOD(RC1+3,2)+MOD(INT((RC1+3)/2),3)*5+1,FALSE) -> 161|100|101|130|131 | H96: =HLOOKUP(Sheet1!R2C1,Sheet1!R2C1:R16C1,MOD(RC1+2,2)+MOD(INT((RC1+2)/2),3)*5+1,FALSE)&"|"&HLOOKUP(Sheet1!R2C1,Sheet1!R2C1:R16C1,MOD(RC1+3,2)+MOD(INT((RC1+3)/2),3)*5+1,FALSE)&"|"&HLOOKUP(Sheet1!R2C1,Sheet1!R2C1:R16C1,MOD(RC1+4,2)+MOD(INT((RC1+4)/2),3)*5+1,FALSE)&"|"&HLOOKUP(Sheet1!R2C1,Sheet1!R2C1:R16C1,MOD(RC1+5,2)+MOD(INT((RC1+5)/2),3)*5+1,FALSE)&"|"&HLOOKUP(Sheet1!R2C1,Sheet1!R2C1:R16C1,MOD(RC1+6,2)+MOD(INT((RC1+6)/2),3)*5+1,FALSE) -> 130|131|160|161|100 | I96: =HLOOKUP(Sheet1!R2C1,Sheet1!R2C1:R16C1,MOD(RC1-1,3)+MOD(INT((RC1-1)/3),3)*5+3,FALSE)&"|"&HLOOKUP(Sheet1!R2C1,Sheet1!R2C1:R16C1,MOD(RC1,3)+MOD(INT((RC1)/3),3)*5+3,FALSE)&"|"&HLOOKUP(Sheet1!R2C1,Sheet1!R2C1:R16C1,MOD(RC1+1,3)+MOD(INT((RC1+1)/3),3)*5+3,FALSE)&"|"&HLOOKUP(Sheet1!R2C1,Sheet1!R2C1:R16C1,MOD(RC1+2,3)+MOD(INT((RC1+2)/3),3)*5+3,FALSE)&"|"&HLOOKUP(Sheet1!R2C1,Sheet1!R2C1:R16C1,MOD(RC1+3,3)+MOD(INT((RC1+3)/3),3)*5+3,FALSE) -> 164|102|103|104|132 | J96: =HLOOKUP(Sheet1!R2C1,Sheet1!R2C1:R16C1,MOD(RC1-1,3)+MOD(INT((RC1-1)/3),3)*5+3,FALSE)&"|"&HLOOKUP(Sheet1!R2C1,Sheet1!R2C1:R16C1,MOD(RC1,3)+MOD(INT((RC1)/3),3)*5+3,FALSE)&"|"&HLOOKUP(Sheet1!R2C1,Sheet1!R2C1:R16C1,MOD(RC1+1,3)+MOD(INT((RC1+1)/3),3)*5+3,FALSE)&"|"&HLOOKUP(Sheet1!R2C1,Sheet1!R2C1:R16C1,MOD(RC1+2,3)+MOD(INT((RC1+2)/3),3)*5+3,FALSE)&"|"&HLOOKUP(Sheet1!R2C1,Sheet1!R2C1:R16C1,MOD(RC1+3,3)+MOD(INT((RC1+3)/3),3)*5+3,FALSE) -> 164|102|103|104|132 | K96: =HLOOKUP(Sheet1!R2C1,Sheet1!R2C1:R16C1,MOD(RC1-1,3)+MOD(INT((RC1-1)/3),3)*5+3,FALSE)&"|"&HLOOKUP(Sheet1!R2C1,Sheet1!R2C1:R16C1,MOD(RC1,3)+MOD(INT((RC1)/3),3)*5+3,FALSE)&"|"&HLOOKUP(Sheet1!R2C1,Sheet1!R2C1:R16C1,MOD(RC1+1,3)+MOD(INT((RC1+1)/3),3)*5+3,FALSE)&"|"&HLOOKUP(Sheet1!R2C1,Sheet1!R2C1:R16C1,MOD(RC1+2,3)+MOD(INT((RC1+2)/3),3)*5+3,FALSE)&"|"&HLOOKUP(Sheet1!R2C1,Sheet1!R2C1:R16C1,MOD(RC1+3,3)+MOD(INT((RC1+3)/3),3)*5+3,FALSE) -> 164|102|103|104|132 | L96: 25|22|23|24 | M96: 198400|198400|198400|198400 | N96: 10030|10031|10032|10033|10030|10031|10032|10033|10030|10031|10032|10033|10030|10031|10032|10033|10030|10031|10032|10033|10030|10031|10032|10033|10030|10031|10032|10033|10030|10031|10032|10033|10030|10031|10032|10033|10030|10031|10032|10033 | O96: 1|1|1|1|1|1|1|1|1|1|1|1|1|1|1|1|1|1|1|1|1|1|1|1|1|1|1|1|1|1|1|1|1|1|1|1|1|1|1|1 | P96: 2500|2500|2500|2500|2500|2500|2500|2500|2500|2500|2500|2500|2500|2500|2500|2500|2500|2500|2500|2500|2500|2500|2500|2500|2500|2500|2500|2500|2500|2500|2500|2500|2500|2500|2500|2500|2500|2500|2500|2500
A97: 91 | B97: 89 | C97: 30 | D97: =R[-20]C+2 -> 28 | E97: 1000 | F97: =MOD(RC[-5]-1,3)*30+100&"|"&MOD(RC[-5]-1,3)*30+101&"|"&MOD(RC[-5]-1,3)*30+102&"|"&MOD(RC[-5]-1,3)*30+103&"|"&IF(MOD(RC[-5],4)=0,HLOOKUP(Sheet1!R2C10,Sheet1!R2C10:R7C10,MOD(RC[-5]/4-1,6)+1,FALSE),IF(MOD(RC[-5],2)=0,IF(RC[-5]>20,HLOOKUP(Sheet1!R2C7,Sheet1!R2C7:R43C7,MOD(RC[-5]/2-1,42)+1,FALSE),HLOOKUP(Sheet1!R2C4,Sheet1!R2C4:R7C4,MOD(RC[-5]-1,6)+1,FALSE)),MOD(RC[-5]-1,3)*30+104)) -> 100|101|102|103|104 | G97: =HLOOKUP(Sheet1!R2C1,Sheet1!R2C1:R16C1,MOD(RC1-1,2)+MOD(INT((RC1-1)/2),3)*5+1,FALSE)&"|"&HLOOKUP(Sheet1!R2C1,Sheet1!R2C1:R16C1,MOD(RC1,2)+MOD(INT((RC1)/2),3)*5+1,FALSE)&"|"&HLOOKUP(Sheet1!R2C1,Sheet1!R2C1:R16C1,MOD(RC1+1,2)+MOD(INT((RC1+1)/2),3)*5+1,FALSE)&"|"&HLOOKUP(Sheet1!R2C1,Sheet1!R2C1:R16C1,MOD(RC1+2,2)+MOD(INT((RC1+2)/2),3)*5+1,FALSE)&"|"&HLOOKUP(Sheet1!R2C1,Sheet1!R2C1:R16C1,MOD(RC1+3,2)+MOD(INT((RC1+3)/2),3)*5+1,FALSE) -> 100|101|130|131|160 | H97: =HLOOKUP(Sheet1!R2C1,Sheet1!R2C1:R16C1,MOD(RC1+2,2)+MOD(INT((RC1+2)/2),3)*5+1,FALSE)&"|"&HLOOKUP(Sheet1!R2C1,Sheet1!R2C1:R16C1,MOD(RC1+3,2)+MOD(INT((RC1+3)/2),3)*5+1,FALSE)&"|"&HLOOKUP(Sheet1!R2C1,Sheet1!R2C1:R16C1,MOD(RC1+4,2)+MOD(INT((RC1+4)/2),3)*5+1,FALSE)&"|"&HLOOKUP(Sheet1!R2C1,Sheet1!R2C1:R16C1,MOD(RC1+5,2)+MOD(INT((RC1+5)/2),3)*5+1,FALSE)&"|"&HLOOKUP(Sheet1!R2C1,Sheet1!R2C1:R16C1,MOD(RC1+6,2)+MOD(INT((RC1+6)/2),3)*5+1,FALSE) -> 131|160|161|100|101 | I97: =HLOOKUP(Sheet1!R2C1,Sheet1!R2C1:R16C1,MOD(RC1-1,3)+MOD(INT((RC1-1)/3),3)*5+3,FALSE)&"|"&HLOOKUP(Sheet1!R2C1,Sheet1!R2C1:R16C1,MOD(RC1,3)+MOD(INT((RC1)/3),3)*5+3,FALSE)&"|"&HLOOKUP(Sheet1!R2C1,Sheet1!R2C1:R16C1,MOD(RC1+1,3)+MOD(INT((RC1+1)/3),3)*5+3,FALSE)&"|"&HLOOKUP(Sheet1!R2C1,Sheet1!R2C1:R16C1,MOD(RC1+2,3)+MOD(INT((RC1+2)/3),3)*5+3,FALSE)&"|"&HLOOKUP(Sheet1!R2C1,Sheet1!R2C1:R16C1,MOD(RC1+3,3)+MOD(INT((RC1+3)/3),3)*5+3,FALSE) -> 102|103|104|132|133 | J97: =HLOOKUP(Sheet1!R2C1,Sheet1!R2C1:R16C1,MOD(RC1-1,3)+MOD(INT((RC1-1)/3),3)*5+3,FALSE)&"|"&HLOOKUP(Sheet1!R2C1,Sheet1!R2C1:R16C1,MOD(RC1,3)+MOD(INT((RC1)/3),3)*5+3,FALSE)&"|"&HLOOKUP(Sheet1!R2C1,Sheet1!R2C1:R16C1,MOD(RC1+1,3)+MOD(INT((RC1+1)/3),3)*5+3,FALSE)&"|"&HLOOKUP(Sheet1!R2C1,Sheet1!R2C1:R16C1,MOD(RC1+2,3)+MOD(INT((RC1+2)/3),3)*5+3,FALSE)&"|"&HLOOKUP(Sheet1!R2C1,Sheet1!R2C1:R16C1,MOD(RC1+3,3)+MOD(INT((RC1+3)/3),3)*5+3,FALSE) -> 102|103|104|132|133 | K97: =HLOOKUP(Sheet1!R2C1,Sheet1!R2C1:R16C1,MOD(RC1-1,3)+MOD(INT((RC1-1)/3),3)*5+3,FALSE)&"|"&HLOOKUP(Sheet1!R2C1,Sheet1!R2C1:R16C1,MOD(RC1,3)+MOD(INT((RC1)/3),3)*5+3,FALSE)&"|"&HLOOKUP(Sheet1!R2C1,Sheet1!R2C1:R16C1,MOD(RC1+1,3)+MOD(INT((RC1+1)/3),3)*5+3,FALSE)&"|"&HLOOKUP(Sheet1!R2C1,Sheet1!R2C1:R16C1,MOD(RC1+2,3)+MOD(INT((RC1+2)/3),3)*5+3,FALSE)&"|"&HLOOKUP(Sheet1!R2C1,Sheet1!R2C1:R16C1,MOD(RC1+3,3)+MOD(INT((RC1+3)/3),3)*5+3,FALSE) -> 102|103|104|132|133 | L97: 25|22|23|24 | M97: 202254|202254|202255|202255 | N97: 10030|10031|10032|10033 | O97: 1|1|1|1 | P97: 2500|2500|2500|2500
A98: 92 | B98: 90 | C98: 30 | D98: =R[-20]C+2 -> 28 | E98: 1000 | F98: =MOD(RC[-5]-1,3)*30+100&"|"&MOD(RC[-5]-1,3)*30+101&"|"&MOD(RC[-5]-1,3)*30+102&"|"&MOD(RC[-5]-1,3)*30+103&"|"&IF(MOD(RC[-5],4)=0,HLOOKUP(Sheet1!R2C10,Sheet1!R2C10:R7C10,MOD(RC[-5]/4-1,6)+1,FALSE),IF(MOD(RC[-5],2)=0,IF(RC[-5]>20,HLOOKUP(Sheet1!R2C7,Sheet1!R2C7:R43C7,MOD(RC[-5]/2-1,42)+1,FALSE),HLOOKUP(Sheet1!R2C4,Sheet1!R2C4:R7C4,MOD(RC[-5]-1,6)+1,FALSE)),MOD(RC[-5]-1,3)*30+104)) -> 130|131|132|133|194 | G98: =HLOOKUP(Sheet1!R2C1,Sheet1!R2C1:R16C1,MOD(RC1-1,2)+MOD(INT((RC1-1)/2),3)*5+1,FALSE)&"|"&HLOOKUP(Sheet1!R2C1,Sheet1!R2C1:R16C1,MOD(RC1,2)+MOD(INT((RC1)/2),3)*5+1,FALSE)&"|"&HLOOKUP(Sheet1!R2C1,Sheet1!R2C1:R16C1,MOD(RC1+1,2)+MOD(INT((RC1+1)/2),3)*5+1,FALSE)&"|"&HLOOKUP(Sheet1!R2C1,Sheet1!R2C1:R16C1,MOD(RC1+2,2)+MOD(INT((RC1+2)/2),3)*5+1,FALSE)&"|"&HLOOKUP(Sheet1!R2C1,Sheet1!R2C1:R16C1,MOD(RC1+3,2)+MOD(INT((RC1+3)/2),3)*5+1,FALSE) -> 101|130|131|160|161 | H98: =HLOOKUP(Sheet1!R2C1,Sheet1!R2C1:R16C1,MOD(RC1+2,2)+MOD(INT((RC1+2)/2),3)*5+1,FALSE)&"|"&HLOOKUP(Sheet1!R2C1,Sheet1!R2C1:R16C1,MOD(RC1+3,2)+MOD(INT((RC1+3)/2),3)*5+1,FALSE)&"|"&HLOOKUP(Sheet1!R2C1,Sheet1!R2C1:R16C1,MOD(RC1+4,2)+MOD(INT((RC1+4)/2),3)*5+1,FALSE)&"|"&HLOOKUP(Sheet1!R2C1,Sheet1!R2C1:R16C1,MOD(RC1+5,2)+MOD(INT((RC1+5)/2),3)*5+1,FALSE)&"|"&HLOOKUP(Sheet1!R2C1,Sheet1!R2C1:R16C1,MOD(RC1+6,2)+MOD(INT((RC1+6)/2),3)*5+1,FALSE) -> 160|161|100|101|130 | I98: =HLOOKUP(Sheet1!R2C1,Sheet1!R2C1:R16C1,MOD(RC1-1,3)+MOD(INT((RC1-1)/3),3)*5+3,FALSE)&"|"&HLOOKUP(Sheet1!R2C1,Sheet1!R2C1:R16C1,MOD(RC1,3)+MOD(INT((RC1)/3),3)*5+3,FALSE)&"|"&HLOOKUP(Sheet1!R2C1,Sheet1!R2C1:R16C1,MOD(RC1+1,3)+MOD(INT((RC1+1)/3),3)*5+3,FALSE)&"|"&HLOOKUP(Sheet1!R2C1,Sheet1!R2C1:R16C1,MOD(RC1+2,3)+MOD(INT((RC1+2)/3),3)*5+3,FALSE)&"|"&HLOOKUP(Sheet1!R2C1,Sheet1!R2C1:R16C1,MOD(RC1+3,3)+MOD(INT((RC1+3)/3),3)*5+3,FALSE) -> 103|104|132|133|134 | J98: =HLOOKUP(Sheet1!R2C1,Sheet1!R2C1:R16C1,MOD(RC1-1,3)+MOD(INT((RC1-1)/3),3)*5+3,FALSE)&"|"&HLOOKUP(Sheet1!R2C1,Sheet1!R2C1:R16C1,MOD(RC1,3)+MOD(INT((RC1)/3),3)*5+3,FALSE)&"|"&HLOOKUP(Sheet1!R2C1,Sheet1!R2C1:R16C1,MOD(RC1+1,3)+MOD(INT((RC1+1)/3),3)*5+3,FALSE)&"|"&HLOOKUP(Sheet1!R2C1,Sheet1!R2C1:R16C1,MOD(RC1+2,3)+MOD(INT((RC1+2)/3),3)*5+3,FALSE)&"|"&HLOOKUP(Sheet1!R2C1,Sheet1!R2C1:R16C1,MOD(RC1+3,3)+MOD(INT((RC1+3)/3),3)*5+3,FALSE) -> 103|104|132|133|134 | K98: =HLOOKUP(Sheet1!R2C1,Sheet1!R2C1:R16C1,MOD(RC1-1,3)+MOD(INT((RC1-1)/3),3)*5+3,FALSE)&"|"&HLOOKUP(Sheet1!R2C1,Sheet1!R2C1:R16C1,MOD(RC1,3)+MOD(INT((RC1)/3),3)*5+3,FALSE)&"|"&HLOOKUP(Sheet1!R2C1,Sheet1!R2C1:R16C1,MOD(RC1+1,3)+MOD(INT((RC1+1)/3),3)*5+3,FALSE)&"|"&HLOOKUP(Sheet1!R2C1,Sheet1!R2C1:R16C1,MOD(RC1+2,3)+MOD(INT((RC1+2)/3),3)*5+3,FALSE)&"|"&HLOOKUP(Sheet1!R2C1,Sheet1!R2C1:R16C1,MOD(RC1+3,3)+MOD(INT((RC1+3)/3),3)*5+3,FALSE) -> 103|104|132|133|134 | L98: 25|22|23|24 | M98: 206706|206706|206705|206705 | N98: 10030|10031|10032|10033 | O98: 1|1|1|1 | P98: 2500|2500|2500|2500
A99: 93 | B99: 91 | C99: 30 | D99: =R[-20]C+2 -> 28 | E99: 1000 | F99: =MOD(RC[-5]-1,3)*30+100&"|"&MOD(RC[-5]-1,3)*30+101&"|"&MOD(RC[-5]-1,3)*30+102&"|"&MOD(RC[-5]-1,3)*30+103&"|"&IF(MOD(RC[-5],4)=0,HLOOKUP(Sheet1!R2C10,Sheet1!R2C10:R7C10,MOD(RC[-5]/4-1,6)+1,FALSE),IF(MOD(RC[-5],2)=0,IF(RC[-5]>20,HLOOKUP(Sheet1!R2C7,Sheet1!R2C7:R43C7,MOD(RC[-5]/2-1,42)+1,FALSE),HLOOKUP(Sheet1!R2C4,Sheet1!R2C4:R7C4,MOD(RC[-5]-1,6)+1,FALSE)),MOD(RC[-5]-1,3)*30+104)) -> 160|161|162|163|164 | G99: =HLOOKUP(Sheet1!R2C1,Sheet1!R2C1:R16C1,MOD(RC1-1,2)+MOD(INT((RC1-1)/2),3)*5+1,FALSE)&"|"&HLOOKUP(Sheet1!R2C1,Sheet1!R2C1:R16C1,MOD(RC1,2)+MOD(INT((RC1)/2),3)*5+1,FALSE)&"|"&HLOOKUP(Sheet1!R2C1,Sheet1!R2C1:R16C1,MOD(RC1+1,2)+MOD(INT((RC1+1)/2),3)*5+1,FALSE)&"|"&HLOOKUP(Sheet1!R2C1,Sheet1!R2C1:R16C1,MOD(RC1+2,2)+MOD(INT((RC1+2)/2),3)*5+1,FALSE)&"|"&HLOOKUP(Sheet1!R2C1,Sheet1!R2C1:R16C1,MOD(RC1+3,2)+MOD(INT((RC1+3)/2),3)*5+1,FALSE) -> 130|131|160|161|100 | H99: =HLOOKUP(Sheet1!R2C1,Sheet1!R2C1:R16C1,MOD(RC1+2,2)+MOD(INT((RC1+2)/2),3)*5+1,FALSE)&"|"&HLOOKUP(Sheet1!R2C1,Sheet1!R2C1:R16C1,MOD(RC1+3,2)+MOD(INT((RC1+3)/2),3)*5+1,FALSE)&"|"&HLOOKUP(Sheet1!R2C1,Sheet1!R2C1:R16C1,MOD(RC1+4,2)+MOD(INT((RC1+4)/2),3)*5+1,FALSE)&"|"&HLOOKUP(Sheet1!R2C1,Sheet1!R2C1:R16C1,MOD(RC1+5,2)+MOD(INT((RC1+5)/2),3)*5+1,FALSE)&"|"&HLOOKUP(Sheet1!R2C1,Sheet1!R2C1:R16C1,MOD(RC1+6,2)+MOD(INT((RC1+6)/2),3)*5+1,FALSE) -> 161|100|101|130|131 | I99: =HLOOKUP(Sheet1!R2C1,Sheet1!R2C1:R16C1,MOD(RC1-1,3)+MOD(INT((RC1-1)/3),3)*5+3,FALSE)&"|"&HLOOKUP(Sheet1!R2C1,Sheet1!R2C1:R16C1,MOD(RC1,3)+MOD(INT((RC1)/3),3)*5+3,FALSE)&"|"&HLOOKUP(Sheet1!R2C1,Sheet1!R2C1:R16C1,MOD(RC1+1,3)+MOD(INT((RC1+1)/3),3)*5+3,FALSE)&"|"&HLOOKUP(Sheet1!R2C1,Sheet1!R2C1:R16C1,MOD(RC1+2,3)+MOD(INT((RC1+2)/3),3)*5+3,FALSE)&"|"&HLOOKUP(Sheet1!R2C1,Sheet1!R2C1:R16C1,MOD(RC1+3,3)+MOD(INT((RC1+3)/3),3)*5+3,FALSE) -> 104|132|133|134|162 | J99: =HLOOKUP(Sheet1!R2C1,Sheet1!R2C1:R16C1,MOD(RC1-1,3)+MOD(INT((RC1-1)/3),3)*5+3,FALSE)&"|"&HLOOKUP(Sheet1!R2C1,Sheet1!R2C1:R16C1,MOD(RC1,3)+MOD(INT((RC1)/3),3)*5+3,FALSE)&"|"&HLOOKUP(Sheet1!R2C1,Sheet1!R2C1:R16C1,MOD(RC1+1,3)+MOD(INT((RC1+1)/3),3)*5+3,FALSE)&"|"&HLOOKUP(Sheet1!R2C1,Sheet1!R2C1:R16C1,MOD(RC1+2,3)+MOD(INT((RC1+2)/3),3)*5+3,FALSE)&"|"&HLOOKUP(Sheet1!R2C1,Sheet1!R2C1:R16C1,MOD(RC1+3,3)+MOD(INT((RC1+3)/3),3)*5+3,FALSE) -> 104|132|133|134|162 | K99: =HLOOKUP(Sheet1!R2C1,Sheet1!R2C1:R16C1,MOD(RC1-1,3)+MOD(INT((RC1-1)/3),3)*5+3,FALSE)&"|"&HLOOKUP(Sheet1!R2C1,Sheet1!R2C1:R16C1,MOD(RC1,3)+MOD(INT((RC1)/3),3)*5+3,FALSE)&"|"&HLOOKUP(Sheet1!R2C1,Sheet1!R2C1:R16C1,MOD(RC1+1,3)+MOD(INT((RC1+1)/3),3)*5+3,FALSE)&"|"&HLOOKUP(Sheet1!R2C1,Sheet1!R2C1:R16C1,MOD(RC1+2,3)+MOD(INT((RC1+2)/3),3)*5+3,FALSE)&"|"&HLOOKUP(Sheet1!R2C1,Sheet1!R2C1:R16C1,MOD(RC1+3,3)+MOD(INT((RC1+3)/3),3)*5+3,FALSE) -> 104|132|133|134|162 | L99: 25|22|23|24 | M99: 211543|211543|211543|211543 | N99: 10030|10031|10032|10033 | O99: 1|1|1|1 | P99: 2500|2500|2500|2500
A100: 94 | B100: 92 | C100: 30 | D100: =R[-20]C+2 -> 28 | E100: 1000 | F100: =MOD(RC[-5]-1,3)*30+100&"|"&MOD(RC[-5]-1,3)*30+101&"|"&MOD(RC[-5]-1,3)*30+102&"|"&MOD(RC[-5]-1,3)*30+103&"|"&IF(MOD(RC[-5],4)=0,HLOOKUP(Sheet1!R2C10,Sheet1!R2C10:R7C10,MOD(RC[-5]/4-1,6)+1,FALSE),IF(MOD(RC[-5],2)=0,IF(RC[-5]>20,HLOOKUP(Sheet1!R2C7,Sheet1!R2C7:R43C7,MOD(RC[-5]/2-1,42)+1,FALSE),HLOOKUP(Sheet1!R2C4,Sheet1!R2C4:R7C4,MOD(RC[-5]-1,6)+1,FALSE)),MOD(RC[-5]-1,3)*30+104)) -> 100|101|102|103|116 | G100: =HLOOKUP(Sheet1!R2C1,Sheet1!R2C1:R16C1,MOD(RC1-1,2)+MOD(INT((RC1-1)/2),3)*5+1,FALSE)&"|"&HLOOKUP(Sheet1!R2C1,Sheet1!R2C1:R16C1,MOD(RC1,2)+MOD(INT((RC1)/2),3)*5+1,FALSE)&"|"&HLOOKUP(Sheet1!R2C1,Sheet1!R2C1:R16C1,MOD(RC1+1,2)+MOD(INT((RC1+1)/2),3)*5+1,FALSE)&"|"&HLOOKUP(Sheet1!R2C1,Sheet1!R2C1:R16C1,MOD(RC1+2,2)+MOD(INT((RC1+2)/2),3)*5+1,FALSE)&"|"&HLOOKUP(Sheet1!R2C1,Sheet1!R2C1:R16C1,MOD(RC1+3,2)+MOD(INT((RC1+3)/2),3)*5+1,FALSE) -> 131|160|161|100|101 | H100: =HLOOKUP(Sheet1!R2C1,Sheet1!R2C1:R16C1,MOD(RC1+2,2)+MOD(INT((RC1+2)/2),3)*5+1,FALSE)&"|"&HLOOKUP(Sheet1!R2C1,Sheet1!R2C1:R16C1,MOD(RC1+3,2)+MOD(INT((RC1+3)/2),3)*5+1,FALSE)&"|"&HLOOKUP(Sheet1!R2C1,Sheet1!R2C1:R16C1,MOD(RC1+4,2)+MOD(INT((RC1+4)/2),3)*5+1,FALSE)&"|"&HLOOKUP(Sheet1!R2C1,Sheet1!R2C1:R16C1,MOD(RC1+5,2)+MOD(INT((RC1+5)/2),3)*5+1,FALSE)&"|"&HLOOKUP(Sheet1!R2C1,Sheet1!R2C1:R16C1,MOD(RC1+6,2)+MOD(INT((RC1+6)/2),3)*5+1,FALSE) -> 100|101|130|131|160 | I100: =HLOOKUP(Sheet1!R2C1,Sheet1!R2C1:R16C1,MOD(RC1-1,3)+MOD(INT((RC1-1)/3),3)*5+3,FALSE)&"|"&HLOOKUP(Sheet1!R2C1,Sheet1!R2C1:R16C1,MOD(RC1,3)+MOD(INT((RC1)/3),3)*5+3,FALSE)&"|"&HLOOKUP(Sheet1!R2C1,Sheet1!R2C1:R16C1,MOD(RC1+1,3)+MOD(INT((RC1+1)/3),3)*5+3,FALSE)&"|"&HLOOKUP(Sheet1!R2C1,Sheet1!R2C1:R16C1,MOD(RC1+2,3)+MOD(INT((RC1+2)/3),3)*5+3,FALSE)&"|"&HLOOKUP(Sheet1!R2C1,Sheet1!R2C1:R16C1,MOD(RC1+3,3)+MOD(INT((RC1+3)/3),3)*5+3,FALSE) -> 132|133|134|162|163 | J100: =HLOOKUP(Sheet1!R2C1,Sheet1!R2C1:R16C1,MOD(RC1-1,3)+MOD(INT((RC1-1)/3),3)*5+3,FALSE)&"|"&HLOOKUP(Sheet1!R2C1,Sheet1!R2C1:R16C1,MOD(RC1,3)+MOD(INT((RC1)/3),3)*5+3,FALSE)&"|"&HLOOKUP(Sheet1!R2C1,Sheet1!R2C1:R16C1,MOD(RC1+1,3)+MOD(INT((RC1+1)/3),3)*5+3,FALSE)&"|"&HLOOKUP(Sheet1!R2C1,Sheet1!R2C1:R16C1,MOD(RC1+2,3)+MOD(INT((RC1+2)/3),3)*5+3,FALSE)&"|"&HLOOKUP(Sheet1!R2C1,Sheet1!R2C1:R16C1,MOD(RC1+3,3)+MOD(INT((RC1+3)/3),3)*5+3,FALSE) -> 132|133|134|162|163 | K100: =HLOOKUP(Sheet1!R2C1,Sheet1!R2C1:R16C1,MOD(RC1-1,3)+MOD(INT((RC1-1)/3),3)*5+3,FALSE)&"|"&HLOOKUP(Sheet1!R2C1,Sheet1!R2C1:R16C1,MOD(RC1,3)+MOD(INT((RC1)/3),3)*5+3,FALSE)&"|"&HLOOKUP(Sheet1!R2C1,Sheet1!R2C1:R16C1,MOD(RC1+1,3)+MOD(INT((RC1+1)/3),3)*5+3,FALSE)&"|"&HLOOKUP(Sheet1!R2C1,Sheet1!R2C1:R16C1,MOD(RC1+2,3)+MOD(INT((RC1+2)/3),3)*5+3,FALSE)&"|"&HLOOKUP(Sheet1!R2C1,Sheet1!R2C1:R16C1,MOD(RC1+3,3)+MOD(INT((RC1+3)/3),3)*5+3,FALSE) -> 132|133|134|162|163 | L100: 25|22|23|24 | M100: 216233|216234|216233|216233 | N100: 10030|10031|10032|10033 | O100: 1|1|1|1 | P100: 2500|2500|2500|2500
A101: 95 | B101: 93 | C101: 30 | D101: =R[-20]C+2 -> 28 | E101: 1000 | F101: =MOD(RC[-5]-1,3)*30+100&"|"&MOD(RC[-5]-1,3)*30+101&"|"&MOD(RC[-5]-1,3)*30+102&"|"&MOD(RC[-5]-1,3)*30+103&"|"&IF(MOD(RC[-5],4)=0,HLOOKUP(Sheet1!R2C10,Sheet1!R2C10:R7C10,MOD(RC[-5]/4-1,6)+1,FALSE),IF(MOD(RC[-5],2)=0,IF(RC[-5]>20,HLOOKUP(Sheet1!R2C7,Sheet1!R2C7:R43C7,MOD(RC[-5]/2-1,42)+1,FALSE),HLOOKUP(Sheet1!R2C4,Sheet1!R2C4:R7C4,MOD(RC[-5]-1,6)+1,FALSE)),MOD(RC[-5]-1,3)*30+104)) -> 130|131|132|133|134 | G101: =HLOOKUP(Sheet1!R2C1,Sheet1!R2C1:R16C1,MOD(RC1-1,2)+MOD(INT((RC1-1)/2),3)*5+1,FALSE)&"|"&HLOOKUP(Sheet1!R2C1,Sheet1!R2C1:R16C1,MOD(RC1,2)+MOD(INT((RC1)/2),3)*5+1,FALSE)&"|"&HLOOKUP(Sheet1!R2C1,Sheet1!R2C1:R16C1,MOD(RC1+1,2)+MOD(INT((RC1+1)/2),3)*5+1,FALSE)&"|"&HLOOKUP(Sheet1!R2C1,Sheet1!R2C1:R16C1,MOD(RC1+2,2)+MOD(INT((RC1+2)/2),3)*5+1,FALSE)&"|"&HLOOKUP(Sheet1!R2C1,Sheet1!R2C1:R16C1,MOD(RC1+3,2)+MOD(INT((RC1+3)/2),3)*5+1,FALSE) -> 160|161|100|101|130 | H101: =HLOOKUP(Sheet1!R2C1,Sheet1!R2C1:R16C1,MOD(RC1+2,2)+MOD(INT((RC1+2)/2),3)*5+1,FALSE)&"|"&HLOOKUP(Sheet1!R2C1,Sheet1!R2C1:R16C1,MOD(RC1+3,2)+MOD(INT((RC1+3)/2),3)*5+1,FALSE)&"|"&HLOOKUP(Sheet1!R2C1,Sheet1!R2C1:R16C1,MOD(RC1+4,2)+MOD(INT((RC1+4)/2),3)*5+1,FALSE)&"|"&HLOOKUP(Sheet1!R2C1,Sheet1!R2C1:R16C1,MOD(RC1+5,2)+MOD(INT((RC1+5)/2),3)*5+1,FALSE)&"|"&HLOOKUP(Sheet1!R2C1,Sheet1!R2C1:R16C1,MOD(RC1+6,2)+MOD(INT((RC1+6)/2),3)*5+1,FALSE) -> 101|130|131|160|161 | I101: =HLOOKUP(Sheet1!R2C1,Sheet1!R2C1:R16C1,MOD(RC1-1,3)+MOD(INT((RC1-1)/3),3)*5+3,FALSE)&"|"&HLOOKUP(Sheet1!R2C1,Sheet1!R2C1:R16C1,MOD(RC1,3)+MOD(INT((RC1)/3),3)*5+3,FALSE)&"|"&HLOOKUP(Sheet1!R2C1,Sheet1!R2C1:R16C1,MOD(RC1+1,3)+MOD(INT((RC1+1)/3),3)*5+3,FALSE)&"|"&HLOOKUP(Sheet1!R2C1,Sheet1!R2C1:R16C1,MOD(RC1+2,3)+MOD(INT((RC1+2)/3),3)*5+3,FALSE)&"|"&HLOOKUP(Sheet1!R2C1,Sheet1!R2C1:R16C1,MOD(RC1+3,3)+MOD(INT((RC1+3)/3),3)*5+3,FALSE) -> 133|134|162|163|164 | J101: =HLOOKUP(Sheet1!R2C1,Sheet1!R2C1:R16C1,MOD(RC1-1,3)+MOD(INT((RC1-1)/3),3)*5+3,FALSE)&"|"&HLOOKUP(Sheet1!R2C1,Sheet1!R2C1:R16C1,MOD(RC1,3)+MOD(INT((RC1)/3),3)*5+3,FALSE)&"|"&HLOOKUP(Sheet1!R2C1,Sheet1!R2C1:R16C1,MOD(RC1+1,3)+MOD(INT((RC1+1)/3),3)*5+3,FALSE)&"|"&HLOOKUP(Sheet1!R2C1,Sheet1!R2C1:R16C1,MOD(RC1+2,3)+MOD(INT((RC1+2)/3),3)*5+3,FALSE)&"|"&HLOOKUP(Sheet1!R2C1,Sheet1!R2C1:R16C1,MOD(RC1+3,3)+MOD(INT((RC1+3)/3),3)*5+3,FALSE) -> 133|134|162|163|164 | K101: =HLOOKUP(Sheet1!R2C1,Sheet1!R2C1:R16C1,MOD(RC1-1,3)+MOD(INT((RC1-1)/3),3)*5+3,FALSE)&"|"&HLOOKUP(Sheet1!R2C1,Sheet1!R2C1:R16C1,MOD(RC1,3)+MOD(INT((RC1)/3),3)*5+3,FALSE)&"|"&HLOOKUP(Sheet1!R2C1,Sheet1!R2C1:R16C1,MOD(RC1+1,3)+MOD(INT((RC1+1)/3),3)*5+3,FALSE)&"|"&HLOOKUP(Sheet1!R2C1,Sheet1!R2C1:R16C1,MOD(RC1+2,3)+MOD(INT((RC1+2)/3),3)*5+3,FALSE)&"|"&HLOOKUP(Sheet1!R2C1,Sheet1!R2C1:R16C1,MOD(RC1+3,3)+MOD(INT((RC1+3)/3),3)*5+3,FALSE) -> 133|134|162|163|164 | L101: 25|22|23|24 | M101: 220735|220735|220735|220735 | N101: 10030|10031|10032|10033|10030|10031|10032|10033|10030|10031|10032|10033|10030|10031|10032|10033|10030|10031|10032|10033|10030|10031|10032|10033|10030|10031|10032|10033|10030|10031|10032|10033|10030|10031|10032|10033|10030|10031|10032|10033 | O101: 1|1|1|1|1|1|1|1|1|1|1|1|1|1|1|1|1|1|1|1|1|1|1|1|1|1|1|1|1|1|1|1|1|1|1|1|1|1|1|1 | P101: 2500|2500|2500|2500|2500|2500|2500|2500|2500|2500|2500|2500|2500|2500|2500|2500|2500|2500|2500|2500|2500|2500|2500|2500|2500|2500|2500|2500|2500|2500|2500|2500|2500|2500|2500|2500|2500|2500|2500|2500
A102: 96 | B102: 94 | C102: 30 | D102: =R[-20]C+2 -> 28 | E102: 1000 | F102: =MOD(RC[-5]-1,3)*30+100&"|"&MOD(RC[-5]-1,3)*30+101&"|"&MOD(RC[-5]-1,3)*30+102&"|"&MOD(RC[-5]-1,3)*30+103&"|"&IF(MOD(RC[-5],4)=0,HLOOKUP(Sheet1!R2C10,Sheet1!R2C10:R7C10,MOD(RC[-5]/4-1,6)+1,FALSE),IF(MOD(RC[-5],2)=0,IF(RC[-5]>20,HLOOKUP(Sheet1!R2C7,Sheet1!R2C7:R43C7,MOD(RC[-5]/2-1,42)+1,FALSE),HLOOKUP(Sheet1!R2C4,Sheet1!R2C4:R7C4,MOD(RC[-5]-1,6)+1,FALSE)),MOD(RC[-5]-1,3)*30+104)) -> 160|161|162|163|195 | G102: =HLOOKUP(Sheet1!R2C1,Sheet1!R2C1:R16C1,MOD(RC1-1,2)+MOD(INT((RC1-1)/2),3)*5+1,FALSE)&"|"&HLOOKUP(Sheet1!R2C1,Sheet1!R2C1:R16C1,MOD(RC1,2)+MOD(INT((RC1)/2),3)*5+1,FALSE)&"|"&HLOOKUP(Sheet1!R2C1,Sheet1!R2C1:R16C1,MOD(RC1+1,2)+MOD(INT((RC1+1)/2),3)*5+1,FALSE)&"|"&HLOOKUP(Sheet1!R2C1,Sheet1!R2C1:R16C1,MOD(RC1+2,2)+MOD(INT((RC1+2)/2),3)*5+1,FALSE)&"|"&HLOOKUP(Sheet1!R2C1,Sheet1!R2C1:R16C1,MOD(RC1+3,2)+MOD(INT((RC1+3)/2),3)*5+1,FALSE) -> 161|100|101|130|131 | H102: =HLOOKUP(Sheet1!R2C1,Sheet1!R2C1:R16C1,MOD(RC1+2,2)+MOD(INT((RC1+2)/2),3)*5+1,FALSE)&"|"&HLOOKUP(Sheet1!R2C1,Sheet1!R2C1:R16C1,MOD(RC1+3,2)+MOD(INT((RC1+3)/2),3)*5+1,FALSE)&"|"&HLOOKUP(Sheet1!R2C1,Sheet1!R2C1:R16C1,MOD(RC1+4,2)+MOD(INT((RC1+4)/2),3)*5+1,FALSE)&"|"&HLOOKUP(Sheet1!R2C1,Sheet1!R2C1:R16C1,MOD(RC1+5,2)+MOD(INT((RC1+5)/2),3)*5+1,FALSE)&"|"&HLOOKUP(Sheet1!R2C1,Sheet1!R2C1:R16C1,MOD(RC1+6,2)+MOD(INT((RC1+6)/2),3)*5+1,FALSE) -> 130|131|160|161|100 | I102: =HLOOKUP(Sheet1!R2C1,Sheet1!R2C1:R16C1,MOD(RC1-1,3)+MOD(INT((RC1-1)/3),3)*5+3,FALSE)&"|"&HLOOKUP(Sheet1!R2C1,Sheet1!R2C1:R16C1,MOD(RC1,3)+MOD(INT((RC1)/3),3)*5+3,FALSE)&"|"&HLOOKUP(Sheet1!R2C1,Sheet1!R2C1:R16C1,MOD(RC1+1,3)+MOD(INT((RC1+1)/3),3)*5+3,FALSE)&"|"&HLOOKUP(Sheet1!R2C1,Sheet1!R2C1:R16C1,MOD(RC1+2,3)+MOD(INT((RC1+2)/3),3)*5+3,FALSE)&"|"&HLOOKUP(Sheet1!R2C1,Sheet1!R2C1:R16C1,MOD(RC1+3,3)+MOD(INT((RC1+3)/3),3)*5+3,FALSE) -> 134|162|163|164|102 | J102: =HLOOKUP(Sheet1!R2C1,Sheet1!R2C1:R16C1,MOD(RC1-1,3)+MOD(INT((RC1-1)/3),3)*5+3,FALSE)&"|"&HLOOKUP(Sheet1!R2C1,Sheet1!R2C1:R16C1,MOD(RC1,3)+MOD(INT((RC1)/3),3)*5+3,FALSE)&"|"&HLOOKUP(Sheet1!R2C1,Sheet1!R2C1:R16C1,MOD(RC1+1,3)+MOD(INT((RC1+1)/3),3)*5+3,FALSE)&"|"&HLOOKUP(Sheet1!R2C1,Sheet1!R2C1:R16C1,MOD(RC1+2,3)+MOD(INT((RC1+2)/3),3)*5+3,FALSE)&"|"&HLOOKUP(Sheet1!R2C1,Sheet1!R2C1:R16C1,MOD(RC1+3,3)+MOD(INT((RC1+3)/3),3)*5+3,FALSE) -> 134|162|163|164|102 | K102: =HLOOKUP(Sheet1!R2C1,Sheet1!R2C1:R16C1,MOD(RC1-1,3)+MOD(INT((RC1-1)/3),3)*5+3,FALSE)&"|"&HLOOKUP(Sheet1!R2C1,Sheet1!R2C1:R16C1,MOD(RC1,3)+MOD(INT((RC1)/3),3)*5+3,FALSE)&"|"&HLOOKUP(Sheet1!R2C1,Sheet1!R2C1:R16C1,MOD(RC1+1,3)+MOD(INT((RC1+1)/3),3)*5+3,FALSE)&"|"&HLOOKUP(Sheet1!R2C1,Sheet1!R2C1:R16C1,MOD(RC1+2,3)+MOD(INT((RC1+2)/3),3)*5+3,FALSE)&"|"&HLOOKUP(Sheet1!R2C1,Sheet1!R2C1:R16C1,MOD(RC1+3,3)+MOD(INT((RC1+3)/3),3)*5+3,FALSE) -> 134|162|163|164|102 | L102: 25|22|23|24 | M102: 225137|225138|225138|225138 | N102: 10030|10031|10032|10033 | O102: 1|1|1|1 | P102: 2500|2500|2500|2500
A103: 97 | B103: 95 | C103: 30 | D103: =R[-20]C+2 -> 28 | E103: 1000 | F103: =MOD(RC[-5]-1,3)*30+100&"|"&MOD(RC[-5]-1,3)*30+101&"|"&MOD(RC[-5]-1,3)*30+102&"|"&MOD(RC[-5]-1,3)*30+103&"|"&IF(MOD(RC[-5],4)=0,HLOOKUP(Sheet1!R2C10,Sheet1!R2C10:R7C10,MOD(RC[-5]/4-1,6)+1,FALSE),IF(MOD(RC[-5],2)=0,IF(RC[-5]>20,HLOOKUP(Sheet1!R2C7,Sheet1!R2C7:R43C7,MOD(RC[-5]/2-1,42)+1,FALSE),HLOOKUP(Sheet1!R2C4,Sheet1!R2C4:R7C4,MOD(RC[-5]-1,6)+1,FALSE)),MOD(RC[-5]-1,3)*30+104)) -> 100|101|102|103|104 | G103: =HLOOKUP(Sheet1!R2C1,Sheet1!R2C1:R16C1,MOD(RC1-1,2)+MOD(INT((RC1-1)/2),3)*5+1,FALSE)&"|"&HLOOKUP(Sheet1!R2C1,Sheet1!R2C1:R16C1,MOD(RC1,2)+MOD(INT((RC1)/2),3)*5+1,FALSE)&"|"&HLOOKUP(Sheet1!R2C1,Sheet1!R2C1:R16C1,MOD(RC1+1,2)+MOD(INT((RC1+1)/2),3)*5+1,FALSE)&"|"&HLOOKUP(Sheet1!R2C1,Sheet1!R2C1:R16C1,MOD(RC1+2,2)+MOD(INT((RC1+2)/2),3)*5+1,FALSE)&"|"&HLOOKUP(Sheet1!R2C1,Sheet1!R2C1:R16C1,MOD(RC1+3,2)+MOD(INT((RC1+3)/2),3)*5+1,FALSE) -> 100|101|130|131|160 | H103: =HLOOKUP(Sheet1!R2C1,Sheet1!R2C1:R16C1,MOD(RC1+2,2)+MOD(INT((RC1+2)/2),3)*5+1,FALSE)&"|"&HLOOKUP(Sheet1!R2C1,Sheet1!R2C1:R16C1,MOD(RC1+3,2)+MOD(INT((RC1+3)/2),3)*5+1,FALSE)&"|"&HLOOKUP(Sheet1!R2C1,Sheet1!R2C1:R16C1,MOD(RC1+4,2)+MOD(INT((RC1+4)/2),3)*5+1,FALSE)&"|"&HLOOKUP(Sheet1!R2C1,Sheet1!R2C1:R16C1,MOD(RC1+5,2)+MOD(INT((RC1+5)/2),3)*5+1,FALSE)&"|"&HLOOKUP(Sheet1!R2C1,Sheet1!R2C1:R16C1,MOD(RC1+6,2)+MOD(INT((RC1+6)/2),3)*5+1,FALSE) -> 131|160|161|100|101 | I103: =HLOOKUP(Sheet1!R2C1,Sheet1!R2C1:R16C1,MOD(RC1-1,3)+MOD(INT((RC1-1)/3),3)*5+3,FALSE)&"|"&HLOOKUP(Sheet1!R2C1,Sheet1!R2C1:R16C1,MOD(RC1,3)+MOD(INT((RC1)/3),3)*5+3,FALSE)&"|"&HLOOKUP(Sheet1!R2C1,Sheet1!R2C1:R16C1,MOD(RC1+1,3)+MOD(INT((RC1+1)/3),3)*5+3,FALSE)&"|"&HLOOKUP(Sheet1!R2C1,Sheet1!R2C1:R16C1,MOD(RC1+2,3)+MOD(INT((RC1+2)/3),3)*5+3,FALSE)&"|"&HLOOKUP(Sheet1!R2C1,Sheet1!R2C1:R16C1,MOD(RC1+3,3)+MOD(INT((RC1+3)/3),3)*5+3,FALSE) -> 162|163|164|102|103 | J103: =HLOOKUP(Sheet1!R2C1,Sheet1!R2C1:R16C1,MOD(RC1-1,3)+MOD(INT((RC1-1)/3),3)*5+3,FALSE)&"|"&HLOOKUP(Sheet1!R2C1,Sheet1!R2C1:R16C1,MOD(RC1,3)+MOD(INT((RC1)/3),3)*5+3,FALSE)&"|"&HLOOKUP(Sheet1!R2C1,Sheet1!R2C1:R16C1,MOD(RC1+1,3)+MOD(INT((RC1+1)/3),3)*5+3,FALSE)&"|"&HLOOKUP(Sheet1!R2C1,Sheet1!R2C1:R16C1,MOD(RC1+2,3)+MOD(INT((RC1+2)/3),3)*5+3,FALSE)&"|"&HLOOKUP(Sheet1!R2C1,Sheet1!R2C1:R16C1,MOD(RC1+3,3)+MOD(INT((RC1+3)/3),3)*5+3,FALSE) -> 162|163|164|102|103 | K103: =HLOOKUP(Sheet1!R2C1,Sheet1!R2C1:R16C1,MOD(RC1-1,3)+MOD(INT((RC1-1)/3),3)*5+3,FALSE)&"|"&HLOOKUP(Sheet1!R2C1,Sheet1!R2C1:R16C1,MOD(RC1,3)+MOD(INT((RC1)/3),3)*5+3,FALSE)&"|"&HLOOKUP(Sheet1!R2C1,Sheet1!R2C1:R16C1,MOD(RC1+1,3)+MOD(INT((RC1+1)/3),3)*5+3,FALSE)&"|"&HLOOKUP(Sheet1!R2C1,Sheet1!R2C1:R16C1,MOD(RC1+2,3)+MOD(INT((RC1+2)/3),3)*5+3,FALSE)&"|"&HLOOKUP(Sheet1!R2C1,Sheet1!R2C1:R16C1,MOD(RC1+3,3)+MOD(INT((RC1+3)/3),3)*5+3,FALSE) -> 162|163|164|102|103 | L103: 25|22|23|24 | M103: 229540|229540|229540|229540 | N103: 10030|10031|10032|10033 | O103: 1|1|1|1 | P103: 2500|2500|2500|2500
A104: 98 | B104: 96 | C104: 30 | D104: =R[-20]C+2 -> 28 | E104: 1000 | F104: =MOD(RC[-5]-1,3)*30+100&"|"&MOD(RC[-5]-1,3)*30+101&"|"&MOD(RC[-5]-1,3)*30+102&"|"&MOD(RC[-5]-1,3)*30+103&"|"&IF(MOD(RC[-5],4)=0,HLOOKUP(Sheet1!R2C10,Sheet1!R2C10:R7C10,MOD(RC[-5]/4-1,6)+1,FALSE),IF(MOD(RC[-5],2)=0,IF(RC[-5]>20,HLOOKUP(Sheet1!R2C7,Sheet1!R2C7:R43C7,MOD(RC[-5]/2-1,42)+1,FALSE),HLOOKUP(Sheet1!R2C4,Sheet1!R2C4:R7C4,MOD(RC[-5]-1,6)+1,FALSE)),MOD(RC[-5]-1,3)*30+104)) -> 130|131|132|133|118 | G104: =HLOOKUP(Sheet1!R2C1,Sheet1!R2C1:R16C1,MOD(RC1-1,2)+MOD(INT((RC1-1)/2),3)*5+1,FALSE)&"|"&HLOOKUP(Sheet1!R2C1,Sheet1!R2C1:R16C1,MOD(RC1,2)+MOD(INT((RC1)/2),3)*5+1,FALSE)&"|"&HLOOKUP(Sheet1!R2C1,Sheet1!R2C1:R16C1,MOD(RC1+1,2)+MOD(INT((RC1+1)/2),3)*5+1,FALSE)&"|"&HLOOKUP(Sheet1!R2C1,Sheet1!R2C1:R16C1,MOD(RC1+2,2)+MOD(INT((RC1+2)/2),3)*5+1,FALSE)&"|"&HLOOKUP(Sheet1!R2C1,Sheet1!R2C1:R16C1,MOD(RC1+3,2)+MOD(INT((RC1+3)/2),3)*5+1,FALSE) -> 101|130|131|160|161 | H104: =HLOOKUP(Sheet1!R2C1,Sheet1!R2C1:R16C1,MOD(RC1+2,2)+MOD(INT((RC1+2)/2),3)*5+1,FALSE)&"|"&HLOOKUP(Sheet1!R2C1,Sheet1!R2C1:R16C1,MOD(RC1+3,2)+MOD(INT((RC1+3)/2),3)*5+1,FALSE)&"|"&HLOOKUP(Sheet1!R2C1,Sheet1!R2C1:R16C1,MOD(RC1+4,2)+MOD(INT((RC1+4)/2),3)*5+1,FALSE)&"|"&HLOOKUP(Sheet1!R2C1,Sheet1!R2C1:R16C1,MOD(RC1+5,2)+MOD(INT((RC1+5)/2),3)*5+1,FALSE)&"|"&HLOOKUP(Sheet1!R2C1,Sheet1!R2C1:R16C1,MOD(RC1+6,2)+MOD(INT((RC1+6)/2),3)*5+1,FALSE) -> 160|161|100|101|130 | I104: =HLOOKUP(Sheet1!R2C1,Sheet1!R2C1:R16C1,MOD(RC1-1,3)+MOD(INT((RC1-1)/3),3)*5+3,FALSE)&"|"&HLOOKUP(Sheet1!R2C1,Sheet1!R2C1:R16C1,MOD(RC1,3)+MOD(INT((RC1)/3),3)*5+3,FALSE)&"|"&HLOOKUP(Sheet1!R2C1,Sheet1!R2C1:R16C1,MOD(RC1+1,3)+MOD(INT((RC1+1)/3),3)*5+3,FALSE)&"|"&HLOOKUP(Sheet1!R2C1,Sheet1!R2C1:R16C1,MOD(RC1+2,3)+MOD(INT((RC1+2)/3),3)*5+3,FALSE)&"|"&HLOOKUP(Sheet1!R2C1,Sheet1!R2C1:R16C1,MOD(RC1+3,3)+MOD(INT((RC1+3)/3),3)*5+3,FALSE) -> 163|164|102|103|104 | J104: =HLOOKUP(Sheet1!R2C1,Sheet1!R2C1:R16C1,MOD(RC1-1,3)+MOD(INT((RC1-1)/3),3)*5+3,FALSE)&"|"&HLOOKUP(Sheet1!R2C1,Sheet1!R2C1:R16C1,MOD(RC1,3)+MOD(INT((RC1)/3),3)*5+3,FALSE)&"|"&HLOOKUP(Sheet1!R2C1,Sheet1!R2C1:R16C1,MOD(RC1+1,3)+MOD(INT((RC1+1)/3),3)*5+3,FALSE)&"|"&HLOOKUP(Sheet1!R2C1,Sheet1!R2C1:R16C1,MOD(RC1+2,3)+MOD(INT((RC1+2)/3),3)*5+3,FALSE)&"|"&HLOOKUP(Sheet1!R2C1,Sheet1!R2C1:R16C1,MOD(RC1+3,3)+MOD(INT((RC1+3)/3),3)*5+3,FALSE) -> 163|164|102|103|104 | K104: =HLOOKUP(Sheet1!R2C1,Sheet1!R2C1:R16C1,MOD(RC1-1,3)+MOD(INT((RC1-1)/3),3)*5+3,FALSE)&"|"&HLOOKUP(Sheet1!R2C1,Sheet1!R2C1:R16C1,MOD(RC1,3)+MOD(INT((RC1)/3),3)*5+3,FALSE)&"|"&HLOOKUP(Sheet1!R2C1,Sheet1!R2C1:R16C1,MOD(RC1+1,3)+MOD(INT((RC1+1)/3),3)*5+3,FALSE)&"|"&HLOOKUP(Sheet1!R2C1,Sheet1!R2C1:R16C1,MOD(RC1+2,3)+MOD(INT((RC1+2)/3),3)*5+3,FALSE)&"|"&HLOOKUP(Sheet1!R2C1,Sheet1!R2C1:R16C1,MOD(RC1+3,3)+MOD(INT((RC1+3)/3),3)*5+3,FALSE) -> 163|164|102|103|104 | L104: 25|22|23|24 | M104: 233840|233840|233840|233840 | N104: 10030|10031|10032|10033 | O104: 1|1|1|1 | P104: 2500|2500|2500|2500
A105: 99 | B105: 97 | C105: 30 | D105: =R[-20]C+2 -> 28 | E105: 1000 | F105: =MOD(RC[-5]-1,3)*30+100&"|"&MOD(RC[-5]-1,3)*30+101&"|"&MOD(RC[-5]-1,3)*30+102&"|"&MOD(RC[-5]-1,3)*30+103&"|"&IF(MOD(RC[-5],4)=0,HLOOKUP(Sheet1!R2C10,Sheet1!R2C10:R7C10,MOD(RC[-5]/4-1,6)+1,FALSE),IF(MOD(RC[-5],2)=0,IF(RC[-5]>20,HLOOKUP(Sheet1!R2C7,Sheet1!R2C7:R43C7,MOD(RC[-5]/2-1,42)+1,FALSE),HLOOKUP(Sheet1!R2C4,Sheet1!R2C4:R7C4,MOD(RC[-5]-1,6)+1,FALSE)),MOD(RC[-5]-1,3)*30+104)) -> 160|161|162|163|164 | G105: =HLOOKUP(Sheet1!R2C1,Sheet1!R2C1:R16C1,MOD(RC1-1,2)+MOD(INT((RC1-1)/2),3)*5+1,FALSE)&"|"&HLOOKUP(Sheet1!R2C1,Sheet1!R2C1:R16C1,MOD(RC1,2)+MOD(INT((RC1)/2),3)*5+1,FALSE)&"|"&HLOOKUP(Sheet1!R2C1,Sheet1!R2C1:R16C1,MOD(RC1+1,2)+MOD(INT((RC1+1)/2),3)*5+1,FALSE)&"|"&HLOOKUP(Sheet1!R2C1,Sheet1!R2C1:R16C1,MOD(RC1+2,2)+MOD(INT((RC1+2)/2),3)*5+1,FALSE)&"|"&HLOOKUP(Sheet1!R2C1,Sheet1!R2C1:R16C1,MOD(RC1+3,2)+MOD(INT((RC1+3)/2),3)*5+1,FALSE) -> 130|131|160|161|100 | H105: =HLOOKUP(Sheet1!R2C1,Sheet1!R2C1:R16C1,MOD(RC1+2,2)+MOD(INT((RC1+2)/2),3)*5+1,FALSE)&"|"&HLOOKUP(Sheet1!R2C1,Sheet1!R2C1:R16C1,MOD(RC1+3,2)+MOD(INT((RC1+3)/2),3)*5+1,FALSE)&"|"&HLOOKUP(Sheet1!R2C1,Sheet1!R2C1:R16C1,MOD(RC1+4,2)+MOD(INT((RC1+4)/2),3)*5+1,FALSE)&"|"&HLOOKUP(Sheet1!R2C1,Sheet1!R2C1:R16C1,MOD(RC1+5,2)+MOD(INT((RC1+5)/2),3)*5+1,FALSE)&"|"&HLOOKUP(Sheet1!R2C1,Sheet1!R2C1:R16C1,MOD(RC1+6,2)+MOD(INT((RC1+6)/2),3)*5+1,FALSE) -> 161|100|101|130|131 | I105: =HLOOKUP(Sheet1!R2C1,Sheet1!R2C1:R16C1,MOD(RC1-1,3)+MOD(INT((RC1-1)/3),3)*5+3,FALSE)&"|"&HLOOKUP(Sheet1!R2C1,Sheet1!R2C1:R16C1,MOD(RC1,3)+MOD(INT((RC1)/3),3)*5+3,FALSE)&"|"&HLOOKUP(Sheet1!R2C1,Sheet1!R2C1:R16C1,MOD(RC1+1,3)+MOD(INT((RC1+1)/3),3)*5+3,FALSE)&"|"&HLOOKUP(Sheet1!R2C1,Sheet1!R2C1:R16C1,MOD(RC1+2,3)+MOD(INT((RC1+2)/3),3)*5+3,FALSE)&"|"&HLOOKUP(Sheet1!R2C1,Sheet1!R2C1:R16C1,MOD(RC1+3,3)+MOD(INT((RC1+3)/3),3)*5+3,FALSE) -> 164|102|103|104|132 | J105: =HLOOKUP(Sheet1!R2C1,Sheet1!R2C1:R16C1,MOD(RC1-1,3)+MOD(INT((RC1-1)/3),3)*5+3,FALSE)&"|"&HLOOKUP(Sheet1!R2C1,Sheet1!R2C1:R16C1,MOD(RC1,3)+MOD(INT((RC1)/3),3)*5+3,FALSE)&"|"&HLOOKUP(Sheet1!R2C1,Sheet1!R2C1:R16C1,MOD(RC1+1,3)+MOD(INT((RC1+1)/3),3)*5+3,FALSE)&"|"&HLOOKUP(Sheet1!R2C1,Sheet1!R2C1:R16C1,MOD(RC1+2,3)+MOD(INT((RC1+2)/3),3)*5+3,FALSE)&"|"&HLOOKUP(Sheet1!R2C1,Sheet1!R2C1:R16C1,MOD(RC1+3,3)+MOD(INT((RC1+3)/3),3)*5+3,FALSE) -> 164|102|103|104|132 | K105: =HLOOKUP(Sheet1!R2C1,Sheet1!R2C1:R16C1,MOD(RC1-1,3)+MOD(INT((RC1-1)/3),3)*5+3,FALSE)&"|"&HLOOKUP(Sheet1!R2C1,Sheet1!R2C1:R16C1,MOD(RC1,3)+MOD(INT((RC1)/3),3)*5+3,FALSE)&"|"&HLOOKUP(Sheet1!R2C1,Sheet1!R2C1:R16C1,MOD(RC1+1,3)+MOD(INT((RC1+1)/3),3)*5+3,FALSE)&"|"&HLOOKUP(Sheet1!R2C1,Sheet1!R2C1:R16C1,MOD(RC1+2,3)+MOD(INT((RC1+2)/3),3)*5+3,FALSE)&"|"&HLOOKUP(Sheet1!R2C1,Sheet1!R2C1:R16C1,MOD(RC1+3,3)+MOD(INT((RC1+3)/3),3)*5+3,FALSE) -> 164|102|103|104|132 | L105: 25|22|23|24 | M105: 238051|238051|238050|238050 | N105: 10030|10031|10032|10033 | O105: 1|1|1|1 | P105: 2500|2500|2500|2500
A106: 100 | B106: 98 | C106: 30 | D106: =R[-20]C+2 -> 28 | E106: 1000 | F106: =MOD(RC[-5]-1,3)*30+100&"|"&MOD(RC[-5]-1,3)*30+101&"|"&MOD(RC[-5]-1,3)*30+102&"|"&MOD(RC[-5]-1,3)*30+103&"|"&IF(MOD(RC[-5],4)=0,HLOOKUP(Sheet1!R2C10,Sheet1!R2C10:R7C10,MOD(RC[-5]/4-1,6)+1,FALSE),IF(MOD(RC[-5],2)=0,IF(RC[-5]>20,HLOOKUP(Sheet1!R2C7,Sheet1!R2C7:R43C7,MOD(RC[-5]/2-1,42)+1,FALSE),HLOOKUP(Sheet1!R2C4,Sheet1!R2C4:R7C4,MOD(RC[-5]-1,6)+1,FALSE)),MOD(RC[-5]-1,3)*30+104)) -> 100|101|102|103|190 | G106: =HLOOKUP(Sheet1!R2C1,Sheet1!R2C1:R16C1,MOD(RC1-1,2)+MOD(INT((RC1-1)/2),3)*5+1,FALSE)&"|"&HLOOKUP(Sheet1!R2C1,Sheet1!R2C1:R16C1,MOD(RC1,2)+MOD(INT((RC1)/2),3)*5+1,FALSE)&"|"&HLOOKUP(Sheet1!R2C1,Sheet1!R2C1:R16C1,MOD(RC1+1,2)+MOD(INT((RC1+1)/2),3)*5+1,FALSE)&"|"&HLOOKUP(Sheet1!R2C1,Sheet1!R2C1:R16C1,MOD(RC1+2,2)+MOD(INT((RC1+2)/2),3)*5+1,FALSE)&"|"&HLOOKUP(Sheet1!R2C1,Sheet1!R2C1:R16C1,MOD(RC1+3,2)+MOD(INT((RC1+3)/2),3)*5+1,FALSE) -> 131|160|161|100|101 | H106: =HLOOKUP(Sheet1!R2C1,Sheet1!R2C1:R16C1,MOD(RC1+2,2)+MOD(INT((RC1+2)/2),3)*5+1,FALSE)&"|"&HLOOKUP(Sheet1!R2C1,Sheet1!R2C1:R16C1,MOD(RC1+3,2)+MOD(INT((RC1+3)/2),3)*5+1,FALSE)&"|"&HLOOKUP(Sheet1!R2C1,Sheet1!R2C1:R16C1,MOD(RC1+4,2)+MOD(INT((RC1+4)/2),3)*5+1,FALSE)&"|"&HLOOKUP(Sheet1!R2C1,Sheet1!R2C1:R16C1,MOD(RC1+5,2)+MOD(INT((RC1+5)/2),3)*5+1,FALSE)&"|"&HLOOKUP(Sheet1!R2C1,Sheet1!R2C1:R16C1,MOD(RC1+6,2)+MOD(INT((RC1+6)/2),3)*5+1,FALSE) -> 100|101|130|131|160 | I106: =HLOOKUP(Sheet1!R2C1,Sheet1!R2C1:R16C1,MOD(RC1-1,3)+MOD(INT((RC1-1)/3),3)*5+3,FALSE)&"|"&HLOOKUP(Sheet1!R2C1,Sheet1!R2C1:R16C1,MOD(RC1,3)+MOD(INT((RC1)/3),3)*5+3,FALSE)&"|"&HLOOKUP(Sheet1!R2C1,Sheet1!R2C1:R16C1,MOD(RC1+1,3)+MOD(INT((RC1+1)/3),3)*5+3,FALSE)&"|"&HLOOKUP(Sheet1!R2C1,Sheet1!R2C1:R16C1,MOD(RC1+2,3)+MOD(INT((RC1+2)/3),3)*5+3,FALSE)&"|"&HLOOKUP(Sheet1!R2C1,Sheet1!R2C1:R16C1,MOD(RC1+3,3)+MOD(INT((RC1+3)/3),3)*5+3,FALSE) -> 102|103|104|132|133 | J106: =HLOOKUP(Sheet1!R2C1,Sheet1!R2C1:R16C1,MOD(RC1-1,3)+MOD(INT((RC1-1)/3),3)*5+3,FALSE)&"|"&HLOOKUP(Sheet1!R2C1,Sheet1!R2C1:R16C1,MOD(RC1,3)+MOD(INT((RC1)/3),3)*5+3,FALSE)&"|"&HLOOKUP(Sheet1!R2C1,Sheet1!R2C1:R16C1,MOD(RC1+1,3)+MOD(INT((RC1+1)/3),3)*5+3,FALSE)&"|"&HLOOKUP(Sheet1!R2C1,Sheet1!R2C1:R16C1,MOD(RC1+2,3)+MOD(INT((RC1+2)/3),3)*5+3,FALSE)&"|"&HLOOKUP(Sheet1!R2C1,Sheet1!R2C1:R16C1,MOD(RC1+3,3)+MOD(INT((RC1+3)/3),3)*5+3,FALSE) -> 102|103|104|132|133 | K106: =HLOOKUP(Sheet1!R2C1,Sheet1!R2C1:R16C1,MOD(RC1-1,3)+MOD(INT((RC1-1)/3),3)*5+3,FALSE)&"|"&HLOOKUP(Sheet1!R2C1,Sheet1!R2C1:R16C1,MOD(RC1,3)+MOD(INT((RC1)/3),3)*5+3,FALSE)&"|"&HLOOKUP(Sheet1!R2C1,Sheet1!R2C1:R16C1,MOD(RC1+1,3)+MOD(INT((RC1+1)/3),3)*5+3,FALSE)&"|"&HLOOKUP(Sheet1!R2C1,Sheet1!R2C1:R16C1,MOD(RC1+2,3)+MOD(INT((RC1+2)/3),3)*5+3,FALSE)&"|"&HLOOKUP(Sheet1!R2C1,Sheet1!R2C1:R16C1,MOD(RC1+3,3)+MOD(INT((RC1+3)/3),3)*5+3,FALSE) -> 102|103|104|132|133 | L106: 25|22|23|24 | M106: 242262|242261|242263|242263 | N106: 10030|10031|10032|10033|10030|10031|10032|10033|10030|10031|10032|10033|10030|10031|10032|10033|10030|10031|10032|10033|10030|10031|10032|10033|10030|10031|10032|10033|10030|10031|10032|10033|10030|10031|10032|10033|10030|10031|10032|10033 | O106: 1|1|1|1|1|1|1|1|1|1|1|1|1|1|1|1|1|1|1|1|1|1|1|1|1|1|1|1|1|1|1|1|1|1|1|1|1|1|1|1 | P106: 2500|2500|2500|2500|2500|2500|2500|2500|2500|2500|2500|2500|2500|2500|2500|2500|2500|2500|2500|2500|2500|2500|2500|2500|2500|2500|2500|2500|2500|2500|2500|2500|2500|2500|2500|2500|2500|2500|2500|2500
A107: 101 | B107: 99 | C107: 30 | D107: =R[-20]C+2 -> 30 | E107: 1000 | F107: =MOD(RC[-5]-1,3)*30+100&"|"&MOD(RC[-5]-1,3)*30+101&"|"&MOD(RC[-5]-1,3)*30+102&"|"&MOD(RC[-5]-1,3)*30+103&"|"&IF(MOD(RC[-5],4)=0,HLOOKUP(Sheet1!R2C10,Sheet1!R2C10:R7C10,MOD(RC[-5]/4-1,6)+1,FALSE),IF(MOD(RC[-5],2)=0,IF(RC[-5]>20,HLOOKUP(Sheet1!R2C7,Sheet1!R2C7:R43C7,MOD(RC[-5]/2-1,42)+1,FALSE),HLOOKUP(Sheet1!R2C4,Sheet1!R2C4:R7C4,MOD(RC[-5]-1,6)+1,FALSE)),MOD(RC[-5]-1,3)*30+104)) -> 130|131|132|133|134 | G107: =HLOOKUP(Sheet1!R2C1,Sheet1!R2C1:R16C1,MOD(RC1-1,2)+MOD(INT((RC1-1)/2),3)*5+1,FALSE)&"|"&HLOOKUP(Sheet1!R2C1,Sheet1!R2C1:R16C1,MOD(RC1,2)+MOD(INT((RC1)/2),3)*5+1,FALSE)&"|"&HLOOKUP(Sheet1!R2C1,Sheet1!R2C1:R16C1,MOD(RC1+1,2)+MOD(INT((RC1+1)/2),3)*5+1,FALSE)&"|"&HLOOKUP(Sheet1!R2C1,Sheet1!R2C1:R16C1,MOD(RC1+2,2)+MOD(INT((RC1+2)/2),3)*5+1,FALSE)&"|"&HLOOKUP(Sheet1!R2C1,Sheet1!R2C1:R16C1,MOD(RC1+3,2)+MOD(INT((RC1+3)/2),3)*5+1,FALSE) -> 160|161|100|101|130 | H107: =HLOOKUP(Sheet1!R2C1,Sheet1!R2C1:R16C1,MOD(RC1+2,2)+MOD(INT((RC1+2)/2),3)*5+1,FALSE)&"|"&HLOOKUP(Sheet1!R2C1,Sheet1!R2C1:R16C1,MOD(RC1+3,2)+MOD(INT((RC1+3)/2),3)*5+1,FALSE)&"|"&HLOOKUP(Sheet1!R2C1,Sheet1!R2C1:R16C1,MOD(RC1+4,2)+MOD(INT((RC1+4)/2),3)*5+1,FALSE)&"|"&HLOOKUP(Sheet1!R2C1,Sheet1!R2C1:R16C1,MOD(RC1+5,2)+MOD(INT((RC1+5)/2),3)*5+1,FALSE)&"|"&HLOOKUP(Sheet1!R2C1,Sheet1!R2C1:R16C1,MOD(RC1+6,2)+MOD(INT((RC1+6)/2),3)*5+1,FALSE) -> 101|130|131|160|161 | I107: =HLOOKUP(Sheet1!R2C1,Sheet1!R2C1:R16C1,MOD(RC1-1,3)+MOD(INT((RC1-1)/3),3)*5+3,FALSE)&"|"&HLOOKUP(Sheet1!R2C1,Sheet1!R2C1:R16C1,MOD(RC1,3)+MOD(INT((RC1)/3),3)*5+3,FALSE)&"|"&HLOOKUP(Sheet1!R2C1,Sheet1!R2C1:R16C1,MOD(RC1+1,3)+MOD(INT((RC1+1)/3),3)*5+3,FALSE)&"|"&HLOOKUP(Sheet1!R2C1,Sheet1!R2C1:R16C1,MOD(RC1+2,3)+MOD(INT((RC1+2)/3),3)*5+3,FALSE)&"|"&HLOOKUP(Sheet1!R2C1,Sheet1!R2C1:R16C1,MOD(RC1+3,3)+MOD(INT((RC1+3)/3),3)*5+3,FALSE) -> 103|104|132|133|134 | J107: =HLOOKUP(Sheet1!R2C1,Sheet1!R2C1:R16C1,MOD(RC1-1,3)+MOD(INT((RC1-1)/3),3)*5+3,FALSE)&"|"&HLOOKUP(Sheet1!R2C1,Sheet1!R2C1:R16C1,MOD(RC1,3)+MOD(INT((RC1)/3),3)*5+3,FALSE)&"|"&HLOOKUP(Sheet1!R2C1,Sheet1!R2C1:R16C1,MOD(RC1+1,3)+MOD(INT((RC1+1)/3),3)*5+3,FALSE)&"|"&HLOOKUP(Sheet1!R2C1,Sheet1!R2C1:R16C1,MOD(RC1+2,3)+MOD(INT((RC1+2)/3),3)*5+3,FALSE)&"|"&HLOOKUP(Sheet1!R2C1,Sheet1!R2C1:R16C1,MOD(RC1+3,3)+MOD(INT((RC1+3)/3),3)*5+3,FALSE) -> 103|104|132|133|134 | K107: =HLOOKUP(Sheet1!R2C1,Sheet1!R2C1:R16C1,MOD(RC1-1,3)+MOD(INT((RC1-1)/3),3)*5+3,FALSE)&"|"&HLOOKUP(Sheet1!R2C1,Sheet1!R2C1:R16C1,MOD(RC1,3)+MOD(INT((RC1)/3),3)*5+3,FALSE)&"|"&HLOOKUP(Sheet1!R2C1,Sheet1!R2C1:R16C1,MOD(RC1+1,3)+MOD(INT((RC1+1)/3),3)*5+3,FALSE)&"|"&HLOOKUP(Sheet1!R2C1,Sheet1!R2C1:R16C1,MOD(RC1+2,3)+MOD(INT((RC1+2)/3),3)*5+3,FALSE)&"|"&HLOOKUP(Sheet1!R2C1,Sheet1!R2C1:R16C1,MOD(RC1+3,3)+MOD(INT((RC1+3)/3),3)*5+3,FALSE) -> 103|104|132|133|134 | L107: 25|22|23|24 | M107: 246534|246534|246535|246535 | N107: 10030|10031|10032|10033 | O107: 1|1|1|1 | P107: 2500|2500|2500|2500
A108: 102 | B108: 100 | C108: 30 | D108: =R[-20]C+2 -> 30 | E108: 1000 | F108: =MOD(RC[-5]-1,3)*30+100&"|"&MOD(RC[-5]-1,3)*30+101&"|"&MOD(RC[-5]-1,3)*30+102&"|"&MOD(RC[-5]-1,3)*30+103&"|"&IF(MOD(RC[-5],4)=0,HLOOKUP(Sheet1!R2C10,Sheet1!R2C10:R7C10,MOD(RC[-5]/4-1,6)+1,FALSE),IF(MOD(RC[-5],2)=0,IF(RC[-5]>20,HLOOKUP(Sheet1!R2C7,Sheet1!R2C7:R43C7,MOD(RC[-5]/2-1,42)+1,FALSE),HLOOKUP(Sheet1!R2C4,Sheet1!R2C4:R7C4,MOD(RC[-5]-1,6)+1,FALSE)),MOD(RC[-5]-1,3)*30+104)) -> 160|161|162|163|120 | G108: =HLOOKUP(Sheet1!R2C1,Sheet1!R2C1:R16C1,MOD(RC1-1,2)+MOD(INT((RC1-1)/2),3)*5+1,FALSE)&"|"&HLOOKUP(Sheet1!R2C1,Sheet1!R2C1:R16C1,MOD(RC1,2)+MOD(INT((RC1)/2),3)*5+1,FALSE)&"|"&HLOOKUP(Sheet1!R2C1,Sheet1!R2C1:R16C1,MOD(RC1+1,2)+MOD(INT((RC1+1)/2),3)*5+1,FALSE)&"|"&HLOOKUP(Sheet1!R2C1,Sheet1!R2C1:R16C1,MOD(RC1+2,2)+MOD(INT((RC1+2)/2),3)*5+1,FALSE)&"|"&HLOOKUP(Sheet1!R2C1,Sheet1!R2C1:R16C1,MOD(RC1+3,2)+MOD(INT((RC1+3)/2),3)*5+1,FALSE) -> 161|100|101|130|131 | H108: =HLOOKUP(Sheet1!R2C1,Sheet1!R2C1:R16C1,MOD(RC1+2,2)+MOD(INT((RC1+2)/2),3)*5+1,FALSE)&"|"&HLOOKUP(Sheet1!R2C1,Sheet1!R2C1:R16C1,MOD(RC1+3,2)+MOD(INT((RC1+3)/2),3)*5+1,FALSE)&"|"&HLOOKUP(Sheet1!R2C1,Sheet1!R2C1:R16C1,MOD(RC1+4,2)+MOD(INT((RC1+4)/2),3)*5+1,FALSE)&"|"&HLOOKUP(Sheet1!R2C1,Sheet1!R2C1:R16C1,MOD(RC1+5,2)+MOD(INT((RC1+5)/2),3)*5+1,FALSE)&"|"&HLOOKUP(Sheet1!R2C1,Sheet1!R2C1:R16C1,MOD(RC1+6,2)+MOD(INT((RC1+6)/2),3)*5+1,FALSE) -> 130|131|160|161|100 | I108: =HLOOKUP(Sheet1!R2C1,Sheet1!R2C1:R16C1,MOD(RC1-1,3)+MOD(INT((RC1-1)/3),3)*5+3,FALSE)&"|"&HLOOKUP(Sheet1!R2C1,Sheet1!R2C1:R16C1,MOD(RC1,3)+MOD(INT((RC1)/3),3)*5+3,FALSE)&"|"&HLOOKUP(Sheet1!R2C1,Sheet1!R2C1:R16C1,MOD(RC1+1,3)+MOD(INT((RC1+1)/3),3)*5+3,FALSE)&"|"&HLOOKUP(Sheet1!R2C1,Sheet1!R2C1:R16C1,MOD(RC1+2,3)+MOD(INT((RC1+2)/3),3)*5+3,FALSE)&"|"&HLOOKUP(Sheet1!R2C1,Sheet1!R2C1:R16C1,MOD(RC1+3,3)+MOD(INT((RC1+3)/3),3)*5+3,FALSE) -> 104|132|133|134|162 | J108: =HLOOKUP(Sheet1!R2C1,Sheet1!R2C1:R16C1,MOD(RC1-1,3)+MOD(INT((RC1-1)/3),3)*5+3,FALSE)&"|"&HLOOKUP(Sheet1!R2C1,Sheet1!R2C1:R16C1,MOD(RC1,3)+MOD(INT((RC1)/3),3)*5+3,FALSE)&"|"&HLOOKUP(Sheet1!R2C1,Sheet1!R2C1:R16C1,MOD(RC1+1,3)+MOD(INT((RC1+1)/3),3)*5+3,FALSE)&"|"&HLOOKUP(Sheet1!R2C1,Sheet1!R2C1:R16C1,MOD(RC1+2,3)+MOD(INT((RC1+2)/3),3)*5+3,FALSE)&"|"&HLOOKUP(Sheet1!R2C1,Sheet1!R2C1:R16C1,MOD(RC1+3,3)+MOD(INT((RC1+3)/3),3)*5+3,FALSE) -> 104|132|133|134|162 | K108: =HLOOKUP(Sheet1!R2C1,Sheet1!R2C1:R16C1,MOD(RC1-1,3)+MOD(INT((RC1-1)/3),3)*5+3,FALSE)&"|"&HLOOKUP(Sheet1!R2C1,Sheet1!R2C1:R16C1,MOD(RC1,3)+MOD(INT((RC1)/3),3)*5+3,FALSE)&"|"&HLOOKUP(Sheet1!R2C1,Sheet1!R2C1:R16C1,MOD(RC1+1,3)+MOD(INT((RC1+1)/3),3)*5+3,FALSE)&"|"&HLOOKUP(Sheet1!R2C1,Sheet1!R2C1:R16C1,MOD(RC1+2,3)+MOD(INT((RC1+2)/3),3)*5+3,FALSE)&"|"&HLOOKUP(Sheet1!R2C1,Sheet1!R2C1:R16C1,MOD(RC1+3,3)+MOD(INT((RC1+3)/3),3)*5+3,FALSE) -> 104|132|133|134|162 | L108: 25|22|23|24 | M108: 250898|250898|250898|250898 | N108: 10030|10031|10032|10033 | O108: 1|1|1|1 | P108: 2500|2500|2500|2500
A109: 103 | B109: 101 | C109: 30 | D109: =R[-20]C+2 -> 30 | E109: 1000 | F109: =MOD(RC[-5]-1,3)*30+100&"|"&MOD(RC[-5]-1,3)*30+101&"|"&MOD(RC[-5]-1,3)*30+102&"|"&MOD(RC[-5]-1,3)*30+103&"|"&IF(MOD(RC[-5],4)=0,HLOOKUP(Sheet1!R2C10,Sheet1!R2C10:R7C10,MOD(RC[-5]/4-1,6)+1,FALSE),IF(MOD(RC[-5],2)=0,IF(RC[-5]>20,HLOOKUP(Sheet1!R2C7,Sheet1!R2C7:R43C7,MOD(RC[-5]/2-1,42)+1,FALSE),HLOOKUP(Sheet1!R2C4,Sheet1!R2C4:R7C4,MOD(RC[-5]-1,6)+1,FALSE)),MOD(RC[-5]-1,3)*30+104)) -> 100|101|102|103|104 | G109: =HLOOKUP(Sheet1!R2C1,Sheet1!R2C1:R16C1,MOD(RC1-1,2)+MOD(INT((RC1-1)/2),3)*5+1,FALSE)&"|"&HLOOKUP(Sheet1!R2C1,Sheet1!R2C1:R16C1,MOD(RC1,2)+MOD(INT((RC1)/2),3)*5+1,FALSE)&"|"&HLOOKUP(Sheet1!R2C1,Sheet1!R2C1:R16C1,MOD(RC1+1,2)+MOD(INT((RC1+1)/2),3)*5+1,FALSE)&"|"&HLOOKUP(Sheet1!R2C1,Sheet1!R2C1:R16C1,MOD(RC1+2,2)+MOD(INT((RC1+2)/2),3)*5+1,FALSE)&"|"&HLOOKUP(Sheet1!R2C1,Sheet1!R2C1:R16C1,MOD(RC1+3,2)+MOD(INT((RC1+3)/2),3)*5+1,FALSE) -> 100|101|130|131|160 | H109: =HLOOKUP(Sheet1!R2C1,Sheet1!R2C1:R16C1,MOD(RC1+2,2)+MOD(INT((RC1+2)/2),3)*5+1,FALSE)&"|"&HLOOKUP(Sheet1!R2C1,Sheet1!R2C1:R16C1,MOD(RC1+3,2)+MOD(INT((RC1+3)/2),3)*5+1,FALSE)&"|"&HLOOKUP(Sheet1!R2C1,Sheet1!R2C1:R16C1,MOD(RC1+4,2)+MOD(INT((RC1+4)/2),3)*5+1,FALSE)&"|"&HLOOKUP(Sheet1!R2C1,Sheet1!R2C1:R16C1,MOD(RC1+5,2)+MOD(INT((RC1+5)/2),3)*5+1,FALSE)&"|"&HLOOKUP(Sheet1!R2C1,Sheet1!R2C1:R16C1,MOD(RC1+6,2)+MOD(INT((RC1+6)/2),3)*5+1,FALSE) -> 131|160|161|100|101 | I109: =HLOOKUP(Sheet1!R2C1,Sheet1!R2C1:R16C1,MOD(RC1-1,3)+MOD(INT((RC1-1)/3),3)*5+3,FALSE)&"|"&HLOOKUP(Sheet1!R2C1,Sheet1!R2C1:R16C1,MOD(RC1,3)+MOD(INT((RC1)/3),3)*5+3,FALSE)&"|"&HLOOKUP(Sheet1!R2C1,Sheet1!R2C1:R16C1,MOD(RC1+1,3)+MOD(INT((RC1+1)/3),3)*5+3,FALSE)&"|"&HLOOKUP(Sheet1!R2C1,Sheet1!R2C1:R16C1,MOD(RC1+2,3)+MOD(INT((RC1+2)/3),3)*5+3,FALSE)&"|"&HLOOKUP(Sheet1!R2C1,Sheet1!R2C1:R16C1,MOD(RC1+3,3)+MOD(INT((RC1+3)/3),3)*5+3,FALSE) -> 132|133|134|162|163 | J109: =HLOOKUP(Sheet1!R2C1,Sheet1!R2C1:R16C1,MOD(RC1-1,3)+MOD(INT((RC1-1)/3),3)*5+3,FALSE)&"|"&HLOOKUP(Sheet1!R2C1,Sheet1!R2C1:R16C1,MOD(RC1,3)+MOD(INT((RC1)/3),3)*5+3,FALSE)&"|"&HLOOKUP(Sheet1!R2C1,Sheet1!R2C1:R16C1,MOD(RC1+1,3)+MOD(INT((RC1+1)/3),3)*5+3,FALSE)&"|"&HLOOKUP(Sheet1!R2C1,Sheet1!R2C1:R16C1,MOD(RC1+2,3)+MOD(INT((RC1+2)/3),3)*5+3,FALSE)&"|"&HLOOKUP(Sheet1!R2C1,Sheet1!R2C1:R16C1,MOD(RC1+3,3)+MOD(INT((RC1+3)/3),3)*5+3,FALSE) -> 132|133|134|162|163 | K109: =HLOOKUP(Sheet1!R2C1,Sheet1!R2C1:R16C1,MOD(RC1-1,3)+MOD(INT((RC1-1)/3),3)*5+3,FALSE)&"|"&HLOOKUP(Sheet1!R2C1,Sheet1!R2C1:R16C1,MOD(RC1,3)+MOD(INT((RC1)/3),3)*5+3,FALSE)&"|"&HLOOKUP(Sheet1!R2C1,Sheet1!R2C1:R16C1,MOD(RC1+1,3)+MOD(INT((RC1+1)/3),3)*5+3,FALSE)&"|"&HLOOKUP(Sheet1!R2C1,Sheet1!R2C1:R16C1,MOD(RC1+2,3)+MOD(INT((RC1+2)/3),3)*5+3,FALSE)&"|"&HLOOKUP(Sheet1!R2C1,Sheet1!R2C1:R16C1,MOD(RC1+3,3)+MOD(INT((RC1+3)/3),3)*5+3,FALSE) -> 132|133|134|162|163 | L109: 25|22|23|24 | M109: 255125|255125|255125|255125 | N109: 10030|10031|10032|10033 | O109: 1|1|1|1 | P109: 2500|2500|2500|2500
A110: 104 | B110: 102 | C110: 30 | D110: =R[-20]C+2 -> 30 | E110: 1000 | F110: =MOD(RC[-5]-1,3)*30+100&"|"&MOD(RC[-5]-1,3)*30+101&"|"&MOD(RC[-5]-1,3)*30+102&"|"&MOD(RC[-5]-1,3)*30+103&"|"&IF(MOD(RC[-5],4)=0,HLOOKUP(Sheet1!R2C10,Sheet1!R2C10:R7C10,MOD(RC[-5]/4-1,6)+1,FALSE),IF(MOD(RC[-5],2)=0,IF(RC[-5]>20,HLOOKUP(Sheet1!R2C7,Sheet1!R2C7:R43C7,MOD(RC[-5]/2-1,42)+1,FALSE),HLOOKUP(Sheet1!R2C4,Sheet1!R2C4:R7C4,MOD(RC[-5]-1,6)+1,FALSE)),MOD(RC[-5]-1,3)*30+104)) -> 130|131|132|133|191 | G110: =HLOOKUP(Sheet1!R2C1,Sheet1!R2C1:R16C1,MOD(RC1-1,2)+MOD(INT((RC1-1)/2),3)*5+1,FALSE)&"|"&HLOOKUP(Sheet1!R2C1,Sheet1!R2C1:R16C1,MOD(RC1,2)+MOD(INT((RC1)/2),3)*5+1,FALSE)&"|"&HLOOKUP(Sheet1!R2C1,Sheet1!R2C1:R16C1,MOD(RC1+1,2)+MOD(INT((RC1+1)/2),3)*5+1,FALSE)&"|"&HLOOKUP(Sheet1!R2C1,Sheet1!R2C1:R16C1,MOD(RC1+2,2)+MOD(INT((RC1+2)/2),3)*5+1,FALSE)&"|"&HLOOKUP(Sheet1!R2C1,Sheet1!R2C1:R16C1,MOD(RC1+3,2)+MOD(INT((RC1+3)/2),3)*5+1,FALSE) -> 101|130|131|160|161 | H110: =HLOOKUP(Sheet1!R2C1,Sheet1!R2C1:R16C1,MOD(RC1+2,2)+MOD(INT((RC1+2)/2),3)*5+1,FALSE)&"|"&HLOOKUP(Sheet1!R2C1,Sheet1!R2C1:R16C1,MOD(RC1+3,2)+MOD(INT((RC1+3)/2),3)*5+1,FALSE)&"|"&HLOOKUP(Sheet1!R2C1,Sheet1!R2C1:R16C1,MOD(RC1+4,2)+MOD(INT((RC1+4)/2),3)*5+1,FALSE)&"|"&HLOOKUP(Sheet1!R2C1,Sheet1!R2C1:R16C1,MOD(RC1+5,2)+MOD(INT((RC1+5)/2),3)*5+1,FALSE)&"|"&HLOOKUP(Sheet1!R2C1,Sheet1!R2C1:R16C1,MOD(RC1+6,2)+MOD(INT((RC1+6)/2),3)*5+1,FALSE) -> 160|161|100|101|130 | I110: =HLOOKUP(Sheet1!R2C1,Sheet1!R2C1:R16C1,MOD(RC1-1,3)+MOD(INT((RC1-1)/3),3)*5+3,FALSE)&"|"&HLOOKUP(Sheet1!R2C1,Sheet1!R2C1:R16C1,MOD(RC1,3)+MOD(INT((RC1)/3),3)*5+3,FALSE)&"|"&HLOOKUP(Sheet1!R2C1,Sheet1!R2C1:R16C1,MOD(RC1+1,3)+MOD(INT((RC1+1)/3),3)*5+3,FALSE)&"|"&HLOOKUP(Sheet1!R2C1,Sheet1!R2C1:R16C1,MOD(RC1+2,3)+MOD(INT((RC1+2)/3),3)*5+3,FALSE)&"|"&HLOOKUP(Sheet1!R2C1,Sheet1!R2C1:R16C1,MOD(RC1+3,3)+MOD(INT((RC1+3)/3),3)*5+3,FALSE) -> 133|134|162|163|164 | J110: =HLOOKUP(Sheet1!R2C1,Sheet1!R2C1:R16C1,MOD(RC1-1,3)+MOD(INT((RC1-1)/3),3)*5+3,FALSE)&"|"&HLOOKUP(Sheet1!R2C1,Sheet1!R2C1:R16C1,MOD(RC1,3)+MOD(INT((RC1)/3),3)*5+3,FALSE)&"|"&HLOOKUP(Sheet1!R2C1,Sheet1!R2C1:R16C1,MOD(RC1+1,3)+MOD(INT((RC1+1)/3),3)*5+3,FALSE)&"|"&HLOOKUP(Sheet1!R2C1,Sheet1!R2C1:R16C1,MOD(RC1+2,3)+MOD(INT((RC1+2)/3),3)*5+3,FALSE)&"|"&HLOOKUP(Sheet1!R2C1,Sheet1!R2C1:R16C1,MOD(RC1+3,3)+MOD(INT((RC1+3)/3),3)*5+3,FALSE) -> 133|134|162|163|164 | K110: =HLOOKUP(Sheet1!R2C1,Sheet1!R2C1:R16C1,MOD(RC1-1,3)+MOD(INT((RC1-1)/3),3)*5+3,FALSE)&"|"&HLOOKUP(Sheet1!R2C1,Sheet1!R2C1:R16C1,MOD(RC1,3)+MOD(INT((RC1)/3),3)*5+3,FALSE)&"|"&HLOOKUP(Sheet1!R2C1,Sheet1!R2C1:R16C1,MOD(RC1+1,3)+MOD(INT((RC1+1)/3),3)*5+3,FALSE)&"|"&HLOOKUP(Sheet1!R2C1,Sheet1!R2C1:R16C1,MOD(RC1+2,3)+MOD(INT((RC1+2)/3),3)*5+3,FALSE)&"|"&HLOOKUP(Sheet1!R2C1,Sheet1!R2C1:R16C1,MOD(RC1+3,3)+MOD(INT((RC1+3)/3),3)*5+3,FALSE) -> 133|134|162|163|164 | L110: 25|22|23|24 | M110: 259777|259776|259778|259778 | N110: 10030|10031|10032|10033 | O110: 1|1|1|1 | P110: 2500|2500|2500|2500
A111: 105 | B111: 103 | C111: 30 | D111: =R[-20]C+2 -> 30 | E111: 1000 | F111: =MOD(RC[-5]-1,3)*30+100&"|"&MOD(RC[-5]-1,3)*30+101&"|"&MOD(RC[-5]-1,3)*30+102&"|"&MOD(RC[-5]-1,3)*30+103&"|"&IF(MOD(RC[-5],4)=0,HLOOKUP(Sheet1!R2C10,Sheet1!R2C10:R7C10,MOD(RC[-5]/4-1,6)+1,FALSE),IF(MOD(RC[-5],2)=0,IF(RC[-5]>20,HLOOKUP(Sheet1!R2C7,Sheet1!R2C7:R43C7,MOD(RC[-5]/2-1,42)+1,FALSE),HLOOKUP(Sheet1!R2C4,Sheet1!R2C4:R7C4,MOD(RC[-5]-1,6)+1,FALSE)),MOD(RC[-5]-1,3)*30+104)) -> 160|161|162|163|164 | G111: =HLOOKUP(Sheet1!R2C1,Sheet1!R2C1:R16C1,MOD(RC1-1,2)+MOD(INT((RC1-1)/2),3)*5+1,FALSE)&"|"&HLOOKUP(Sheet1!R2C1,Sheet1!R2C1:R16C1,MOD(RC1,2)+MOD(INT((RC1)/2),3)*5+1,FALSE)&"|"&HLOOKUP(Sheet1!R2C1,Sheet1!R2C1:R16C1,MOD(RC1+1,2)+MOD(INT((RC1+1)/2),3)*5+1,FALSE)&"|"&HLOOKUP(Sheet1!R2C1,Sheet1!R2C1:R16C1,MOD(RC1+2,2)+MOD(INT((RC1+2)/2),3)*5+1,FALSE)&"|"&HLOOKUP(Sheet1!R2C1,Sheet1!R2C1:R16C1,MOD(RC1+3,2)+MOD(INT((RC1+3)/2),3)*5+1,FALSE) -> 130|131|160|161|100 | H111: =HLOOKUP(Sheet1!R2C1,Sheet1!R2C1:R16C1,MOD(RC1+2,2)+MOD(INT((RC1+2)/2),3)*5+1,FALSE)&"|"&HLOOKUP(Sheet1!R2C1,Sheet1!R2C1:R16C1,MOD(RC1+3,2)+MOD(INT((RC1+3)/2),3)*5+1,FALSE)&"|"&HLOOKUP(Sheet1!R2C1,Sheet1!R2C1:R16C1,MOD(RC1+4,2)+MOD(INT((RC1+4)/2),3)*5+1,FALSE)&"|"&HLOOKUP(Sheet1!R2C1,Sheet1!R2C1:R16C1,MOD(RC1+5,2)+MOD(INT((RC1+5)/2),3)*5+1,FALSE)&"|"&HLOOKUP(Sheet1!R2C1,Sheet1!R2C1:R16C1,MOD(RC1+6,2)+MOD(INT((RC1+6)/2),3)*5+1,FALSE) -> 161|100|101|130|131 | I111: =HLOOKUP(Sheet1!R2C1,Sheet1!R2C1:R16C1,MOD(RC1-1,3)+MOD(INT((RC1-1)/3),3)*5+3,FALSE)&"|"&HLOOKUP(Sheet1!R2C1,Sheet1!R2C1:R16C1,MOD(RC1,3)+MOD(INT((RC1)/3),3)*5+3,FALSE)&"|"&HLOOKUP(Sheet1!R2C1,Sheet1!R2C1:R16C1,MOD(RC1+1,3)+MOD(INT((RC1+1)/3),3)*5+3,FALSE)&"|"&HLOOKUP(Sheet1!R2C1,Sheet1!R2C1:R16C1,MOD(RC1+2,3)+MOD(INT((RC1+2)/3),3)*5+3,FALSE)&"|"&HLOOKUP(Sheet1!R2C1,Sheet1!R2C1:R16C1,MOD(RC1+3,3)+MOD(INT((RC1+3)/3),3)*5+3,FALSE) -> 134|162|163|164|102 | J111: =HLOOKUP(Sheet1!R2C1,Sheet1!R2C1:R16C1,MOD(RC1-1,3)+MOD(INT((RC1-1)/3),3)*5+3,FALSE)&"|"&HLOOKUP(Sheet1!R2C1,Sheet1!R2C1:R16C1,MOD(RC1,3)+MOD(INT((RC1)/3),3)*5+3,FALSE)&"|"&HLOOKUP(Sheet1!R2C1,Sheet1!R2C1:R16C1,MOD(RC1+1,3)+MOD(INT((RC1+1)/3),3)*5+3,FALSE)&"|"&HLOOKUP(Sheet1!R2C1,Sheet1!R2C1:R16C1,MOD(RC1+2,3)+MOD(INT((RC1+2)/3),3)*5+3,FALSE)&"|"&HLOOKUP(Sheet1!R2C1,Sheet1!R2C1:R16C1,MOD(RC1+3,3)+MOD(INT((RC1+3)/3),3)*5+3,FALSE) -> 134|162|163|164|102 | K111: =HLOOKUP(Sheet1!R2C1,Sheet1!R2C1:R16C1,MOD(RC1-1,3)+MOD(INT((RC1-1)/3),3)*5+3,FALSE)&"|"&HLOOKUP(Sheet1!R2C1,Sheet1!R2C1:R16C1,MOD(RC1,3)+MOD(INT((RC1)/3),3)*5+3,FALSE)&"|"&HLOOKUP(Sheet1!R2C1,Sheet1!R2C1:R16C1,MOD(RC1+1,3)+MOD(INT((RC1+1)/3),3)*5+3,FALSE)&"|"&HLOOKUP(Sheet1!R2C1,Sheet1!R2C1:R16C1,MOD(RC1+2,3)+MOD(INT((RC1+2)/3),3)*5+3,FALSE)&"|"&HLOOKUP(Sheet1!R2C1,Sheet1!R2C1:R16C1,MOD(RC1+3,3)+MOD(INT((RC1+3)/3),3)*5+3,FALSE) -> 134|162|163|164|102 | L111: 25|22|23|24 | M111: 265294|265294|265295|265295 | N111: 10030|10031|10032|10033|10030|10031|10032|10033|10030|10031|10032|10033|10030|10031|10032|10033|10030|10031|10032|10033|10030|10031|10032|10033|10030|10031|10032|10033|10030|10031|10032|10033|10030|10031|10032|10033|10030|10031|10032|10033 | O111: 1|1|1|1|1|1|1|1|1|1|1|1|1|1|1|1|1|1|1|1|1|1|1|1|1|1|1|1|1|1|1|1|1|1|1|1|1|1|1|1 | P111: 2500|2500|2500|2500|2500|2500|2500|2500|2500|2500|2500|2500|2500|2500|2500|2500|2500|2500|2500|2500|2500|2500|2500|2500|2500|2500|2500|2500|2500|2500|2500|2500|2500|2500|2500|2500|2500|2500|2500|2500
A112: 106 | B112: 104 | C112: 30 | D112: =R[-20]C+2 -> 30 | E112: 1000 | F112: =MOD(RC[-5]-1,3)*30+100&"|"&MOD(RC[-5]-1,3)*30+101&"|"&MOD(RC[-5]-1,3)*30+102&"|"&MOD(RC[-5]-1,3)*30+103&"|"&IF(MOD(RC[-5],4)=0,HLOOKUP(Sheet1!R2C10,Sheet1!R2C10:R7C10,MOD(RC[-5]/4-1,6)+1,FALSE),IF(MOD(RC[-5],2)=0,IF(RC[-5]>20,HLOOKUP(Sheet1!R2C7,Sheet1!R2C7:R43C7,MOD(RC[-5]/2-1,42)+1,FALSE),HLOOKUP(Sheet1!R2C4,Sheet1!R2C4:R7C4,MOD(RC[-5]-1,6)+1,FALSE)),MOD(RC[-5]-1,3)*30+104)) -> 100|101|102|103|122 | G112: =HLOOKUP(Sheet1!R2C1,Sheet1!R2C1:R16C1,MOD(RC1-1,2)+MOD(INT((RC1-1)/2),3)*5+1,FALSE)&"|"&HLOOKUP(Sheet1!R2C1,Sheet1!R2C1:R16C1,MOD(RC1,2)+MOD(INT((RC1)/2),3)*5+1,FALSE)&"|"&HLOOKUP(Sheet1!R2C1,Sheet1!R2C1:R16C1,MOD(RC1+1,2)+MOD(INT((RC1+1)/2),3)*5+1,FALSE)&"|"&HLOOKUP(Sheet1!R2C1,Sheet1!R2C1:R16C1,MOD(RC1+2,2)+MOD(INT((RC1+2)/2),3)*5+1,FALSE)&"|"&HLOOKUP(Sheet1!R2C1,Sheet1!R2C1:R16C1,MOD(RC1+3,2)+MOD(INT((RC1+3)/2),3)*5+1,FALSE) -> 131|160|161|100|101 | H112: =HLOOKUP(Sheet1!R2C1,Sheet1!R2C1:R16C1,MOD(RC1+2,2)+MOD(INT((RC1+2)/2),3)*5+1,FALSE)&"|"&HLOOKUP(Sheet1!R2C1,Sheet1!R2C1:R16C1,MOD(RC1+3,2)+MOD(INT((RC1+3)/2),3)*5+1,FALSE)&"|"&HLOOKUP(Sheet1!R2C1,Sheet1!R2C1:R16C1,MOD(RC1+4,2)+MOD(INT((RC1+4)/2),3)*5+1,FALSE)&"|"&HLOOKUP(Sheet1!R2C1,Sheet1!R2C1:R16C1,MOD(RC1+5,2)+MOD(INT((RC1+5)/2),3)*5+1,FALSE)&"|"&HLOOKUP(Sheet1!R2C1,Sheet1!R2C1:R16C1,MOD(RC1+6,2)+MOD(INT((RC1+6)/2),3)*5+1,FALSE) -> 100|101|130|131|160 | I112: =HLOOKUP(Sheet1!R2C1,Sheet1!R2C1:R16C1,MOD(RC1-1,3)+MOD(INT((RC1-1)/3),3)*5+3,FALSE)&"|"&HLOOKUP(Sheet1!R2C1,Sheet1!R2C1:R16C1,MOD(RC1,3)+MOD(INT((RC1)/3),3)*5+3,FALSE)&"|"&HLOOKUP(Sheet1!R2C1,Sheet1!R2C1:R16C1,MOD(RC1+1,3)+MOD(INT((RC1+1)/3),3)*5+3,FALSE)&"|"&HLOOKUP(Sheet1!R2C1,Sheet1!R2C1:R16C1,MOD(RC1+2,3)+MOD(INT((RC1+2)/3),3)*5+3,FALSE)&"|"&HLOOKUP(Sheet1!R2C1,Sheet1!R2C1:R16C1,MOD(RC1+3,3)+MOD(INT((RC1+3)/3),3)*5+3,FALSE) -> 162|163|164|102|103 | J112: =HLOOKUP(Sheet1!R2C1,Sheet1!R2C1:R16C1,MOD(RC1-1,3)+MOD(INT((RC1-1)/3),3)*5+3,FALSE)&"|"&HLOOKUP(Sheet1!R2C1,Sheet1!R2C1:R16C1,MOD(RC1,3)+MOD(INT((RC1)/3),3)*5+3,FALSE)&"|"&HLOOKUP(Sheet1!R2C1,Sheet1!R2C1:R16C1,MOD(RC1+1,3)+MOD(INT((RC1+1)/3),3)*5+3,FALSE)&"|"&HLOOKUP(Sheet1!R2C1,Sheet1!R2C1:R16C1,MOD(RC1+2,3)+MOD(INT((RC1+2)/3),3)*5+3,FALSE)&"|"&HLOOKUP(Sheet1!R2C1,Sheet1!R2C1:R16C1,MOD(RC1+3,3)+MOD(INT((RC1+3)/3),3)*5+3,FALSE) -> 162|163|164|102|103 | K112: =HLOOKUP(Sheet1!R2C1,Sheet1!R2C1:R16C1,MOD(RC1-1,3)+MOD(INT((RC1-1)/3),3)*5+3,FALSE)&"|"&HLOOKUP(Sheet1!R2C1,Sheet1!R2C1:R16C1,MOD(RC1,3)+MOD(INT((RC1)/3),3)*5+3,FALSE)&"|"&HLOOKUP(Sheet1!R2C1,Sheet1!R2C1:R16C1,MOD(RC1+1,3)+MOD(INT((RC1+1)/3),3)*5+3,FALSE)&"|"&HLOOKUP(Sheet1!R2C1,Sheet1!R2C1:R16C1,MOD(RC1+2,3)+MOD(INT((RC1+2)/3),3)*5+3,FALSE)&"|"&HLOOKUP(Sheet1!R2C1,Sheet1!R2C1:R16C1,MOD(RC1+3,3)+MOD(INT((RC1+3)/3),3)*5+3,FALSE) -> 162|163|164|102|103 | L112: 25|22|23|24 | M112: 270640|270640|270640|270640 | N112: 10030|10031|10032|10033 | O112: 1|1|1|1 | P112: 2500|2500|2500|2500
A113: 107 | B113: 105 | C113: 30 | D113: =R[-20]C+2 -> 30 | E113: 1000 | F113: =MOD(RC[-5]-1,3)*30+100&"|"&MOD(RC[-5]-1,3)*30+101&"|"&MOD(RC[-5]-1,3)*30+102&"|"&MOD(RC[-5]-1,3)*30+103&"|"&IF(MOD(RC[-5],4)=0,HLOOKUP(Sheet1!R2C10,Sheet1!R2C10:R7C10,MOD(RC[-5]/4-1,6)+1,FALSE),IF(MOD(RC[-5],2)=0,IF(RC[-5]>20,HLOOKUP(Sheet1!R2C7,Sheet1!R2C7:R43C7,MOD(RC[-5]/2-1,42)+1,FALSE),HLOOKUP(Sheet1!R2C4,Sheet1!R2C4:R7C4,MOD(RC[-5]-1,6)+1,FALSE)),MOD(RC[-5]-1,3)*30+104)) -> 130|131|132|133|134 | G113: =HLOOKUP(Sheet1!R2C1,Sheet1!R2C1:R16C1,MOD(RC1-1,2)+MOD(INT((RC1-1)/2),3)*5+1,FALSE)&"|"&HLOOKUP(Sheet1!R2C1,Sheet1!R2C1:R16C1,MOD(RC1,2)+MOD(INT((RC1)/2),3)*5+1,FALSE)&"|"&HLOOKUP(Sheet1!R2C1,Sheet1!R2C1:R16C1,MOD(RC1+1,2)+MOD(INT((RC1+1)/2),3)*5+1,FALSE)&"|"&HLOOKUP(Sheet1!R2C1,Sheet1!R2C1:R16C1,MOD(RC1+2,2)+MOD(INT((RC1+2)/2),3)*5+1,FALSE)&"|"&HLOOKUP(Sheet1!R2C1,Sheet1!R2C1:R16C1,MOD(RC1+3,2)+MOD(INT((RC1+3)/2),3)*5+1,FALSE) -> 160|161|100|101|130 | H113: =HLOOKUP(Sheet1!R2C1,Sheet1!R2C1:R16C1,MOD(RC1+2,2)+MOD(INT((RC1+2)/2),3)*5+1,FALSE)&"|"&HLOOKUP(Sheet1!R2C1,Sheet1!R2C1:R16C1,MOD(RC1+3,2)+MOD(INT((RC1+3)/2),3)*5+1,FALSE)&"|"&HLOOKUP(Sheet1!R2C1,Sheet1!R2C1:R16C1,MOD(RC1+4,2)+MOD(INT((RC1+4)/2),3)*5+1,FALSE)&"|"&HLOOKUP(Sheet1!R2C1,Sheet1!R2C1:R16C1,MOD(RC1+5,2)+MOD(INT((RC1+5)/2),3)*5+1,FALSE)&"|"&HLOOKUP(Sheet1!R2C1,Sheet1!R2C1:R16C1,MOD(RC1+6,2)+MOD(INT((RC1+6)/2),3)*5+1,FALSE) -> 101|130|131|160|161 | I113: =HLOOKUP(Sheet1!R2C1,Sheet1!R2C1:R16C1,MOD(RC1-1,3)+MOD(INT((RC1-1)/3),3)*5+3,FALSE)&"|"&HLOOKUP(Sheet1!R2C1,Sheet1!R2C1:R16C1,MOD(RC1,3)+MOD(INT((RC1)/3),3)*5+3,FALSE)&"|"&HLOOKUP(Sheet1!R2C1,Sheet1!R2C1:R16C1,MOD(RC1+1,3)+MOD(INT((RC1+1)/3),3)*5+3,FALSE)&"|"&HLOOKUP(Sheet1!R2C1,Sheet1!R2C1:R16C1,MOD(RC1+2,3)+MOD(INT((RC1+2)/3),3)*5+3,FALSE)&"|"&HLOOKUP(Sheet1!R2C1,Sheet1!R2C1:R16C1,MOD(RC1+3,3)+MOD(INT((RC1+3)/3),3)*5+3,FALSE) -> 163|164|102|103|104 | J113: =HLOOKUP(Sheet1!R2C1,Sheet1!R2C1:R16C1,MOD(RC1-1,3)+MOD(INT((RC1-1)/3),3)*5+3,FALSE)&"|"&HLOOKUP(Sheet1!R2C1,Sheet1!R2C1:R16C1,MOD(RC1,3)+MOD(INT((RC1)/3),3)*5+3,FALSE)&"|"&HLOOKUP(Sheet1!R2C1,Sheet1!R2C1:R16C1,MOD(RC1+1,3)+MOD(INT((RC1+1)/3),3)*5+3,FALSE)&"|"&HLOOKUP(Sheet1!R2C1,Sheet1!R2C1:R16C1,MOD(RC1+2,3)+MOD(INT((RC1+2)/3),3)*5+3,FALSE)&"|"&HLOOKUP(Sheet1!R2C1,Sheet1!R2C1:R16C1,MOD(RC1+3,3)+MOD(INT((RC1+3)/3),3)*5+3,FALSE) -> 163|164|102|103|104 | K113: =HLOOKUP(Sheet1!R2C1,Sheet1!R2C1:R16C1,MOD(RC1-1,3)+MOD(INT((RC1-1)/3),3)*5+3,FALSE)&"|"&HLOOKUP(Sheet1!R2C1,Sheet1!R2C1:R16C1,MOD(RC1,3)+MOD(INT((RC1)/3),3)*5+3,FALSE)&"|"&HLOOKUP(Sheet1!R2C1,Sheet1!R2C1:R16C1,MOD(RC1+1,3)+MOD(INT((RC1+1)/3),3)*5+3,FALSE)&"|"&HLOOKUP(Sheet1!R2C1,Sheet1!R2C1:R16C1,MOD(RC1+2,3)+MOD(INT((RC1+2)/3),3)*5+3,FALSE)&"|"&HLOOKUP(Sheet1!R2C1,Sheet1!R2C1:R16C1,MOD(RC1+3,3)+MOD(INT((RC1+3)/3),3)*5+3,FALSE) -> 163|164|102|103|104 | L113: 25|22|23|24 | M113: 275966|275966|275968|275968 | N113: 10030|10031|10032|10033 | O113: 1|1|1|1 | P113: 2500|2500|2500|2500
A114: 108 | B114: 106 | C114: 30 | D114: =R[-20]C+2 -> 30 | E114: 1000 | F114: =MOD(RC[-5]-1,3)*30+100&"|"&MOD(RC[-5]-1,3)*30+101&"|"&MOD(RC[-5]-1,3)*30+102&"|"&MOD(RC[-5]-1,3)*30+103&"|"&IF(MOD(RC[-5],4)=0,HLOOKUP(Sheet1!R2C10,Sheet1!R2C10:R7C10,MOD(RC[-5]/4-1,6)+1,FALSE),IF(MOD(RC[-5],2)=0,IF(RC[-5]>20,HLOOKUP(Sheet1!R2C7,Sheet1!R2C7:R43C7,MOD(RC[-5]/2-1,42)+1,FALSE),HLOOKUP(Sheet1!R2C4,Sheet1!R2C4:R7C4,MOD(RC[-5]-1,6)+1,FALSE)),MOD(RC[-5]-1,3)*30+104)) -> 160|161|162|163|192 | G114: =HLOOKUP(Sheet1!R2C1,Sheet1!R2C1:R16C1,MOD(RC1-1,2)+MOD(INT((RC1-1)/2),3)*5+1,FALSE)&"|"&HLOOKUP(Sheet1!R2C1,Sheet1!R2C1:R16C1,MOD(RC1,2)+MOD(INT((RC1)/2),3)*5+1,FALSE)&"|"&HLOOKUP(Sheet1!R2C1,Sheet1!R2C1:R16C1,MOD(RC1+1,2)+MOD(INT((RC1+1)/2),3)*5+1,FALSE)&"|"&HLOOKUP(Sheet1!R2C1,Sheet1!R2C1:R16C1,MOD(RC1+2,2)+MOD(INT((RC1+2)/2),3)*5+1,FALSE)&"|"&HLOOKUP(Sheet1!R2C1,Sheet1!R2C1:R16C1,MOD(RC1+3,2)+MOD(INT((RC1+3)/2),3)*5+1,FALSE) -> 161|100|101|130|131 | H114: =HLOOKUP(Sheet1!R2C1,Sheet1!R2C1:R16C1,MOD(RC1+2,2)+MOD(INT((RC1+2)/2),3)*5+1,FALSE)&"|"&HLOOKUP(Sheet1!R2C1,Sheet1!R2C1:R16C1,MOD(RC1+3,2)+MOD(INT((RC1+3)/2),3)*5+1,FALSE)&"|"&HLOOKUP(Sheet1!R2C1,Sheet1!R2C1:R16C1,MOD(RC1+4,2)+MOD(INT((RC1+4)/2),3)*5+1,FALSE)&"|"&HLOOKUP(Sheet1!R2C1,Sheet1!R2C1:R16C1,MOD(RC1+5,2)+MOD(INT((RC1+5)/2),3)*5+1,FALSE)&"|"&HLOOKUP(Sheet1!R2C1,Sheet1!R2C1:R16C1,MOD(RC1+6,2)+MOD(INT((RC1+6)/2),3)*5+1,FALSE) -> 130|131|160|161|100 | I114: =HLOOKUP(Sheet1!R2C1,Sheet1!R2C1:R16C1,MOD(RC1-1,3)+MOD(INT((RC1-1)/3),3)*5+3,FALSE)&"|"&HLOOKUP(Sheet1!R2C1,Sheet1!R2C1:R16C1,MOD(RC1,3)+MOD(INT((RC1)/3),3)*5+3,FALSE)&"|"&HLOOKUP(Sheet1!R2C1,Sheet1!R2C1:R16C1,MOD(RC1+1,3)+MOD(INT((RC1+1)/3),3)*5+3,FALSE)&"|"&HLOOKUP(Sheet1!R2C1,Sheet1!R2C1:R16C1,MOD(RC1+2,3)+MOD(INT((RC1+2)/3),3)*5+3,FALSE)&"|"&HLOOKUP(Sheet1!R2C1,Sheet1!R2C1:R16C1,MOD(RC1+3,3)+MOD(INT((RC1+3)/3),3)*5+3,FALSE) -> 164|102|103|104|132 | J114: =HLOOKUP(Sheet1!R2C1,Sheet1!R2C1:R16C1,MOD(RC1-1,3)+MOD(INT((RC1-1)/3),3)*5+3,FALSE)&"|"&HLOOKUP(Sheet1!R2C1,Sheet1!R2C1:R16C1,MOD(RC1,3)+MOD(INT((RC1)/3),3)*5+3,FALSE)&"|"&HLOOKUP(Sheet1!R2C1,Sheet1!R2C1:R16C1,MOD(RC1+1,3)+MOD(INT((RC1+1)/3),3)*5+3,FALSE)&"|"&HLOOKUP(Sheet1!R2C1,Sheet1!R2C1:R16C1,MOD(RC1+2,3)+MOD(INT((RC1+2)/3),3)*5+3,FALSE)&"|"&HLOOKUP(Sheet1!R2C1,Sheet1!R2C1:R16C1,MOD(RC1+3,3)+MOD(INT((RC1+3)/3),3)*5+3,FALSE) -> 164|102|103|104|132 | K114: =HLOOKUP(Sheet1!R2C1,Sheet1!R2C1:R16C1,MOD(RC1-1,3)+MOD(INT((RC1-1)/3),3)*5+3,FALSE)&"|"&HLOOKUP(Sheet1!R2C1,Sheet1!R2C1:R16C1,MOD(RC1,3)+MOD(INT((RC1)/3),3)*5+3,FALSE)&"|"&HLOOKUP(Sheet1!R2C1,Sheet1!R2C1:R16C1,MOD(RC1+1,3)+MOD(INT((RC1+1)/3),3)*5+3,FALSE)&"|"&HLOOKUP(Sheet1!R2C1,Sheet1!R2C1:R16C1,MOD(RC1+2,3)+MOD(INT((RC1+2)/3),3)*5+3,FALSE)&"|"&HLOOKUP(Sheet1!R2C1,Sheet1!R2C1:R16C1,MOD(RC1+3,3)+MOD(INT((RC1+3)/3),3)*5+3,FALSE) -> 164|102|103|104|132 | L114: 25|22|23|24 | M114: 281183|281184|281183|281183 | N114: 10030|10031|10032|10033 | O114: 1|1|1|1 | P114: 2500|2500|2500|2500
A115: 109 | B115: 107 | C115: 30 | D115: =R[-20]C+2 -> 30 | E115: 1000 | F115: =MOD(RC[-5]-1,3)*30+100&"|"&MOD(RC[-5]-1,3)*30+101&"|"&MOD(RC[-5]-1,3)*30+102&"|"&MOD(RC[-5]-1,3)*30+103&"|"&IF(MOD(RC[-5],4)=0,HLOOKUP(Sheet1!R2C10,Sheet1!R2C10:R7C10,MOD(RC[-5]/4-1,6)+1,FALSE),IF(MOD(RC[-5],2)=0,IF(RC[-5]>20,HLOOKUP(Sheet1!R2C7,Sheet1!R2C7:R43C7,MOD(RC[-5]/2-1,42)+1,FALSE),HLOOKUP(Sheet1!R2C4,Sheet1!R2C4:R7C4,MOD(RC[-5]-1,6)+1,FALSE)),MOD(RC[-5]-1,3)*30+104)) -> 100|101|102|103|104 | G115: =HLOOKUP(Sheet1!R2C1,Sheet1!R2C1:R16C1,MOD(RC1-1,2)+MOD(INT((RC1-1)/2),3)*5+1,FALSE)&"|"&HLOOKUP(Sheet1!R2C1,Sheet1!R2C1:R16C1,MOD(RC1,2)+MOD(INT((RC1)/2),3)*5+1,FALSE)&"|"&HLOOKUP(Sheet1!R2C1,Sheet1!R2C1:R16C1,MOD(RC1+1,2)+MOD(INT((RC1+1)/2),3)*5+1,FALSE)&"|"&HLOOKUP(Sheet1!R2C1,Sheet1!R2C1:R16C1,MOD(RC1+2,2)+MOD(INT((RC1+2)/2),3)*5+1,FALSE)&"|"&HLOOKUP(Sheet1!R2C1,Sheet1!R2C1:R16C1,MOD(RC1+3,2)+MOD(INT((RC1+3)/2),3)*5+1,FALSE) -> 100|101|130|131|160 | H115: =HLOOKUP(Sheet1!R2C1,Sheet1!R2C1:R16C1,MOD(RC1+2,2)+MOD(INT((RC1+2)/2),3)*5+1,FALSE)&"|"&HLOOKUP(Sheet1!R2C1,Sheet1!R2C1:R16C1,MOD(RC1+3,2)+MOD(INT((RC1+3)/2),3)*5+1,FALSE)&"|"&HLOOKUP(Sheet1!R2C1,Sheet1!R2C1:R16C1,MOD(RC1+4,2)+MOD(INT((RC1+4)/2),3)*5+1,FALSE)&"|"&HLOOKUP(Sheet1!R2C1,Sheet1!R2C1:R16C1,MOD(RC1+5,2)+MOD(INT((RC1+5)/2),3)*5+1,FALSE)&"|"&HLOOKUP(Sheet1!R2C1,Sheet1!R2C1:R16C1,MOD(RC1+6,2)+MOD(INT((RC1+6)/2),3)*5+1,FALSE) -> 131|160|161|100|101 | I115: =HLOOKUP(Sheet1!R2C1,Sheet1!R2C1:R16C1,MOD(RC1-1,3)+MOD(INT((RC1-1)/3),3)*5+3,FALSE)&"|"&HLOOKUP(Sheet1!R2C1,Sheet1!R2C1:R16C1,MOD(RC1,3)+MOD(INT((RC1)/3),3)*5+3,FALSE)&"|"&HLOOKUP(Sheet1!R2C1,Sheet1!R2C1:R16C1,MOD(RC1+1,3)+MOD(INT((RC1+1)/3),3)*5+3,FALSE)&"|"&HLOOKUP(Sheet1!R2C1,Sheet1!R2C1:R16C1,MOD(RC1+2,3)+MOD(INT((RC1+2)/3),3)*5+3,FALSE)&"|"&HLOOKUP(Sheet1!R2C1,Sheet1!R2C1:R16C1,MOD(RC1+3,3)+MOD(INT((RC1+3)/3),3)*5+3,FALSE) -> 102|103|104|132|133 | J115: =HLOOKUP(Sheet1!R2C1,Sheet1!R2C1:R16C1,MOD(RC1-1,3)+MOD(INT((RC1-1)/3),3)*5+3,FALSE)&"|"&HLOOKUP(Sheet1!R2C1,Sheet1!R2C1:R16C1,MOD(RC1,3)+MOD(INT((RC1)/3),3)*5+3,FALSE)&"|"&HLOOKUP(Sheet1!R2C1,Sheet1!R2C1:R16C1,MOD(RC1+1,3)+MOD(INT((RC1+1)/3),3)*5+3,FALSE)&"|"&HLOOKUP(Sheet1!R2C1,Sheet1!R2C1:R16C1,MOD(RC1+2,3)+MOD(INT((RC1+2)/3),3)*5+3,FALSE)&"|"&HLOOKUP(Sheet1!R2C1,Sheet1!R2C1:R16C1,MOD(RC1+3,3)+MOD(INT((RC1+3)/3),3)*5+3,FALSE) -> 102|103|104|132|133 | K115: =HLOOKUP(Sheet1!R2C1,Sheet1!R2C1:R16C1,MOD(RC1-1,3)+MOD(INT((RC1-1)/3),3)*5+3,FALSE)&"|"&HLOOKUP(Sheet1!R2C1,Sheet1!R2C1:R16C1,MOD(RC1,3)+MOD(INT((RC1)/3),3)*5+3,FALSE)&"|"&HLOOKUP(Sheet1!R2C1,Sheet1!R2C1:R16C1,MOD(RC1+1,3)+MOD(INT((RC1+1)/3),3)*5+3,FALSE)&"|"&HLOOKUP(Sheet1!R2C1,Sheet1!R2C1:R16C1,MOD(RC1+2,3)+MOD(INT((RC1+2)/3),3)*5+3,FALSE)&"|"&HLOOKUP(Sheet1!R2C1,Sheet1!R2C1:R16C1,MOD(RC1+3,3)+MOD(INT((RC1+3)/3),3)*5+3,FALSE) -> 102|103|104|132|133 | L115: 25|22|23|24 | M115: 286238|286238|286238|286238 | N115: 10030|10031|10032|10033 | O115: 1|1|1|1 | P115: 2500|2500|2500|2500
A116: 110 | B116: 108 | C116: 30 | D116: =R[-20]C+2 -> 30 | E116: 1000 | F116: =MOD(RC[-5]-1,3)*30+100&"|"&MOD(RC[-5]-1,3)*30+101&"|"&MOD(RC[-5]-1,3)*30+102&"|"&MOD(RC[-5]-1,3)*30+103&"|"&IF(MOD(RC[-5],4)=0,HLOOKUP(Sheet1!R2C10,Sheet1!R2C10:R7C10,MOD(RC[-5]/4-1,6)+1,FALSE),IF(MOD(RC[-5],2)=0,IF(RC[-5]>20,HLOOKUP(Sheet1!R2C7,Sheet1!R2C7:R43C7,MOD(RC[-5]/2-1,42)+1,FALSE),HLOOKUP(Sheet1!R2C4,Sheet1!R2C4:R7C4,MOD(RC[-5]-1,6)+1,FALSE)),MOD(RC[-5]-1,3)*30+104)) -> 130|131|132|133|124 | G116: =HLOOKUP(Sheet1!R2C1,Sheet1!R2C1:R16C1,MOD(RC1-1,2)+MOD(INT((RC1-1)/2),3)*5+1,FALSE)&"|"&HLOOKUP(Sheet1!R2C1,Sheet1!R2C1:R16C1,MOD(RC1,2)+MOD(INT((RC1)/2),3)*5+1,FALSE)&"|"&HLOOKUP(Sheet1!R2C1,Sheet1!R2C1:R16C1,MOD(RC1+1,2)+MOD(INT((RC1+1)/2),3)*5+1,FALSE)&"|"&HLOOKUP(Sheet1!R2C1,Sheet1!R2C1:R16C1,MOD(RC1+2,2)+MOD(INT((RC1+2)/2),3)*5+1,FALSE)&"|"&HLOOKUP(Sheet1!R2C1,Sheet1!R2C1:R16C1,MOD(RC1+3,2)+MOD(INT((RC1+3)/2),3)*5+1,FALSE) -> 101|130|131|160|161 | H116: =HLOOKUP(Sheet1!R2C1,Sheet1!R2C1:R16C1,MOD(RC1+2,2)+MOD(INT((RC1+2)/2),3)*5+1,FALSE)&"|"&HLOOKUP(Sheet1!R2C1,Sheet1!R2C1:R16C1,MOD(RC1+3,2)+MOD(INT((RC1+3)/2),3)*5+1,FALSE)&"|"&HLOOKUP(Sheet1!R2C1,Sheet1!R2C1:R16C1,MOD(RC1+4,2)+MOD(INT((RC1+4)/2),3)*5+1,FALSE)&"|"&HLOOKUP(Sheet1!R2C1,Sheet1!R2C1:R16C1,MOD(RC1+5,2)+MOD(INT((RC1+5)/2),3)*5+1,FALSE)&"|"&HLOOKUP(Sheet1!R2C1,Sheet1!R2C1:R16C1,MOD(RC1+6,2)+MOD(INT((RC1+6)/2),3)*5+1,FALSE) -> 160|161|100|101|130 | I116: =HLOOKUP(Sheet1!R2C1,Sheet1!R2C1:R16C1,MOD(RC1-1,3)+MOD(INT((RC1-1)/3),3)*5+3,FALSE)&"|"&HLOOKUP(Sheet1!R2C1,Sheet1!R2C1:R16C1,MOD(RC1,3)+MOD(INT((RC1)/3),3)*5+3,FALSE)&"|"&HLOOKUP(Sheet1!R2C1,Sheet1!R2C1:R16C1,MOD(RC1+1,3)+MOD(INT((RC1+1)/3),3)*5+3,FALSE)&"|"&HLOOKUP(Sheet1!R2C1,Sheet1!R2C1:R16C1,MOD(RC1+2,3)+MOD(INT((RC1+2)/3),3)*5+3,FALSE)&"|"&HLOOKUP(Sheet1!R2C1,Sheet1!R2C1:R16C1,MOD(RC1+3,3)+MOD(INT((RC1+3)/3),3)*5+3,FALSE) -> 103|104|132|133|134 | J116: =HLOOKUP(Sheet1!R2C1,Sheet1!R2C1:R16C1,MOD(RC1-1,3)+MOD(INT((RC1-1)/3),3)*5+3,FALSE)&"|"&HLOOKUP(Sheet1!R2C1,Sheet1!R2C1:R16C1,MOD(RC1,3)+MOD(INT((RC1)/3),3)*5+3,FALSE)&"|"&HLOOKUP(Sheet1!R2C1,Sheet1!R2C1:R16C1,MOD(RC1+1,3)+MOD(INT((RC1+1)/3),3)*5+3,FALSE)&"|"&HLOOKUP(Sheet1!R2C1,Sheet1!R2C1:R16C1,MOD(RC1+2,3)+MOD(INT((RC1+2)/3),3)*5+3,FALSE)&"|"&HLOOKUP(Sheet1!R2C1,Sheet1!R2C1:R16C1,MOD(RC1+3,3)+MOD(INT((RC1+3)/3),3)*5+3,FALSE) -> 103|104|132|133|134 | K116: =HLOOKUP(Sheet1!R2C1,Sheet1!R2C1:R16C1,MOD(RC1-1,3)+MOD(INT((RC1-1)/3),3)*5+3,FALSE)&"|"&HLOOKUP(Sheet1!R2C1,Sheet1!R2C1:R16C1,MOD(RC1,3)+MOD(INT((RC1)/3),3)*5+3,FALSE)&"|"&HLOOKUP(Sheet1!R2C1,Sheet1!R2C1:R16C1,MOD(RC1+1,3)+MOD(INT((RC1+1)/3),3)*5+3,FALSE)&"|"&HLOOKUP(Sheet1!R2C1,Sheet1!R2C1:R16C1,MOD(RC1+2,3)+MOD(INT((RC1+2)/3),3)*5+3,FALSE)&"|"&HLOOKUP(Sheet1!R2C1,Sheet1!R2C1:R16C1,MOD(RC1+3,3)+MOD(INT((RC1+3)/3),3)*5+3,FALSE) -> 103|104|132|133|134 | L116: 25|22|23|24 | M116: 291292|291291|291293|291293 | N116: 10030|10031|10032|10033|10030|10031|10032|10033|10030|10031|10032|10033|10030|10031|10032|10033|10030|10031|10032|10033|10030|10031|10032|10033|10030|10031|10032|10033|10030|10031|10032|10033|10030|10031|10032|10033|10030|10031|10032|10033 | O116: 1|1|1|1|1|1|1|1|1|1|1|1|1|1|1|1|1|1|1|1|1|1|1|1|1|1|1|1|1|1|1|1|1|1|1|1|1|1|1|1 | P116: 2500|2500|2500|2500|2500|2500|2500|2500|2500|2500|2500|2500|2500|2500|2500|2500|2500|2500|2500|2500|2500|2500|2500|2500|2500|2500|2500|2500|2500|2500|2500|2500|2500|2500|2500|2500|2500|2500|2500|2500
A117: 111 | B117: 109 | C117: 30 | D117: =R[-20]C+2 -> 30 | E117: 1000 | F117: =MOD(RC[-5]-1,3)*30+100&"|"&MOD(RC[-5]-1,3)*30+101&"|"&MOD(RC[-5]-1,3)*30+102&"|"&MOD(RC[-5]-1,3)*30+103&"|"&IF(MOD(RC[-5],4)=0,HLOOKUP(Sheet1!R2C10,Sheet1!R2C10:R7C10,MOD(RC[-5]/4-1,6)+1,FALSE),IF(MOD(RC[-5],2)=0,IF(RC[-5]>20,HLOOKUP(Sheet1!R2C7,Sheet1!R2C7:R43C7,MOD(RC[-5]/2-1,42)+1,FALSE),HLOOKUP(Sheet1!R2C4,Sheet1!R2C4:R7C4,MOD(RC[-5]-1,6)+1,FALSE)),MOD(RC[-5]-1,3)*30+104)) -> 160|161|162|163|164 | G117: =HLOOKUP(Sheet1!R2C1,Sheet1!R2C1:R16C1,MOD(RC1-1,2)+MOD(INT((RC1-1)/2),3)*5+1,FALSE)&"|"&HLOOKUP(Sheet1!R2C1,Sheet1!R2C1:R16C1,MOD(RC1,2)+MOD(INT((RC1)/2),3)*5+1,FALSE)&"|"&HLOOKUP(Sheet1!R2C1,Sheet1!R2C1:R16C1,MOD(RC1+1,2)+MOD(INT((RC1+1)/2),3)*5+1,FALSE)&"|"&HLOOKUP(Sheet1!R2C1,Sheet1!R2C1:R16C1,MOD(RC1+2,2)+MOD(INT((RC1+2)/2),3)*5+1,FALSE)&"|"&HLOOKUP(Sheet1!R2C1,Sheet1!R2C1:R16C1,MOD(RC1+3,2)+MOD(INT((RC1+3)/2),3)*5+1,FALSE) -> 130|131|160|161|100 | H117: =HLOOKUP(Sheet1!R2C1,Sheet1!R2C1:R16C1,MOD(RC1+2,2)+MOD(INT((RC1+2)/2),3)*5+1,FALSE)&"|"&HLOOKUP(Sheet1!R2C1,Sheet1!R2C1:R16C1,MOD(RC1+3,2)+MOD(INT((RC1+3)/2),3)*5+1,FALSE)&"|"&HLOOKUP(Sheet1!R2C1,Sheet1!R2C1:R16C1,MOD(RC1+4,2)+MOD(INT((RC1+4)/2),3)*5+1,FALSE)&"|"&HLOOKUP(Sheet1!R2C1,Sheet1!R2C1:R16C1,MOD(RC1+5,2)+MOD(INT((RC1+5)/2),3)*5+1,FALSE)&"|"&HLOOKUP(Sheet1!R2C1,Sheet1!R2C1:R16C1,MOD(RC1+6,2)+MOD(INT((RC1+6)/2),3)*5+1,FALSE) -> 161|100|101|130|131 | I117: =HLOOKUP(Sheet1!R2C1,Sheet1!R2C1:R16C1,MOD(RC1-1,3)+MOD(INT((RC1-1)/3),3)*5+3,FALSE)&"|"&HLOOKUP(Sheet1!R2C1,Sheet1!R2C1:R16C1,MOD(RC1,3)+MOD(INT((RC1)/3),3)*5+3,FALSE)&"|"&HLOOKUP(Sheet1!R2C1,Sheet1!R2C1:R16C1,MOD(RC1+1,3)+MOD(INT((RC1+1)/3),3)*5+3,FALSE)&"|"&HLOOKUP(Sheet1!R2C1,Sheet1!R2C1:R16C1,MOD(RC1+2,3)+MOD(INT((RC1+2)/3),3)*5+3,FALSE)&"|"&HLOOKUP(Sheet1!R2C1,Sheet1!R2C1:R16C1,MOD(RC1+3,3)+MOD(INT((RC1+3)/3),3)*5+3,FALSE) -> 104|132|133|134|162 | J117: =HLOOKUP(Sheet1!R2C1,Sheet1!R2C1:R16C1,MOD(RC1-1,3)+MOD(INT((RC1-1)/3),3)*5+3,FALSE)&"|"&HLOOKUP(Sheet1!R2C1,Sheet1!R2C1:R16C1,MOD(RC1,3)+MOD(INT((RC1)/3),3)*5+3,FALSE)&"|"&HLOOKUP(Sheet1!R2C1,Sheet1!R2C1:R16C1,MOD(RC1+1,3)+MOD(INT((RC1+1)/3),3)*5+3,FALSE)&"|"&HLOOKUP(Sheet1!R2C1,Sheet1!R2C1:R16C1,MOD(RC1+2,3)+MOD(INT((RC1+2)/3),3)*5+3,FALSE)&"|"&HLOOKUP(Sheet1!R2C1,Sheet1!R2C1:R16C1,MOD(RC1+3,3)+MOD(INT((RC1+3)/3),3)*5+3,FALSE) -> 104|132|133|134|162 | K117: =HLOOKUP(Sheet1!R2C1,Sheet1!R2C1:R16C1,MOD(RC1-1,3)+MOD(INT((RC1-1)/3),3)*5+3,FALSE)&"|"&HLOOKUP(Sheet1!R2C1,Sheet1!R2C1:R16C1,MOD(RC1,3)+MOD(INT((RC1)/3),3)*5+3,FALSE)&"|"&HLOOKUP(Sheet1!R2C1,Sheet1!R2C1:R16C1,MOD(RC1+1,3)+MOD(INT((RC1+1)/3),3)*5+3,FALSE)&"|"&HLOOKUP(Sheet1!R2C1,Sheet1!R2C1:R16C1,MOD(RC1+2,3)+MOD(INT((RC1+2)/3),3)*5+3,FALSE)&"|"&HLOOKUP(Sheet1!R2C1,Sheet1!R2C1:R16C1,MOD(RC1+3,3)+MOD(INT((RC1+3)/3),3)*5+3,FALSE) -> 104|132|133|134|162 | L117: 25|22|23|24 | M117: 296193|296193|296193|296193 | N117: 10030|10031|10032|10033 | O117: 1|1|1|1 | P117: 2500|2500|2500|2500
A118: 112 | B118: 110 | C118: 30 | D118: =R[-20]C+2 -> 30 | E118: 1000 | F118: =MOD(RC[-5]-1,3)*30+100&"|"&MOD(RC[-5]-1,3)*30+101&"|"&MOD(RC[-5]-1,3)*30+102&"|"&MOD(RC[-5]-1,3)*30+103&"|"&IF(MOD(RC[-5],4)=0,HLOOKUP(Sheet1!R2C10,Sheet1!R2C10:R7C10,MOD(RC[-5]/4-1,6)+1,FALSE),IF(MOD(RC[-5],2)=0,IF(RC[-5]>20,HLOOKUP(Sheet1!R2C7,Sheet1!R2C7:R43C7,MOD(RC[-5]/2-1,42)+1,FALSE),HLOOKUP(Sheet1!R2C4,Sheet1!R2C4:R7C4,MOD(RC[-5]-1,6)+1,FALSE)),MOD(RC[-5]-1,3)*30+104)) -> 100|101|102|103|193 | G118: =HLOOKUP(Sheet1!R2C1,Sheet1!R2C1:R16C1,MOD(RC1-1,2)+MOD(INT((RC1-1)/2),3)*5+1,FALSE)&"|"&HLOOKUP(Sheet1!R2C1,Sheet1!R2C1:R16C1,MOD(RC1,2)+MOD(INT((RC1)/2),3)*5+1,FALSE)&"|"&HLOOKUP(Sheet1!R2C1,Sheet1!R2C1:R16C1,MOD(RC1+1,2)+MOD(INT((RC1+1)/2),3)*5+1,FALSE)&"|"&HLOOKUP(Sheet1!R2C1,Sheet1!R2C1:R16C1,MOD(RC1+2,2)+MOD(INT((RC1+2)/2),3)*5+1,FALSE)&"|"&HLOOKUP(Sheet1!R2C1,Sheet1!R2C1:R16C1,MOD(RC1+3,2)+MOD(INT((RC1+3)/2),3)*5+1,FALSE) -> 131|160|161|100|101 | H118: =HLOOKUP(Sheet1!R2C1,Sheet1!R2C1:R16C1,MOD(RC1+2,2)+MOD(INT((RC1+2)/2),3)*5+1,FALSE)&"|"&HLOOKUP(Sheet1!R2C1,Sheet1!R2C1:R16C1,MOD(RC1+3,2)+MOD(INT((RC1+3)/2),3)*5+1,FALSE)&"|"&HLOOKUP(Sheet1!R2C1,Sheet1!R2C1:R16C1,MOD(RC1+4,2)+MOD(INT((RC1+4)/2),3)*5+1,FALSE)&"|"&HLOOKUP(Sheet1!R2C1,Sheet1!R2C1:R16C1,MOD(RC1+5,2)+MOD(INT((RC1+5)/2),3)*5+1,FALSE)&"|"&HLOOKUP(Sheet1!R2C1,Sheet1!R2C1:R16C1,MOD(RC1+6,2)+MOD(INT((RC1+6)/2),3)*5+1,FALSE) -> 100|101|130|131|160 | I118: =HLOOKUP(Sheet1!R2C1,Sheet1!R2C1:R16C1,MOD(RC1-1,3)+MOD(INT((RC1-1)/3),3)*5+3,FALSE)&"|"&HLOOKUP(Sheet1!R2C1,Sheet1!R2C1:R16C1,MOD(RC1,3)+MOD(INT((RC1)/3),3)*5+3,FALSE)&"|"&HLOOKUP(Sheet1!R2C1,Sheet1!R2C1:R16C1,MOD(RC1+1,3)+MOD(INT((RC1+1)/3),3)*5+3,FALSE)&"|"&HLOOKUP(Sheet1!R2C1,Sheet1!R2C1:R16C1,MOD(RC1+2,3)+MOD(INT((RC1+2)/3),3)*5+3,FALSE)&"|"&HLOOKUP(Sheet1!R2C1,Sheet1!R2C1:R16C1,MOD(RC1+3,3)+MOD(INT((RC1+3)/3),3)*5+3,FALSE) -> 132|133|134|162|163 | J118: =HLOOKUP(Sheet1!R2C1,Sheet1!R2C1:R16C1,MOD(RC1-1,3)+MOD(INT((RC1-1)/3),3)*5+3,FALSE)&"|"&HLOOKUP(Sheet1!R2C1,Sheet1!R2C1:R16C1,MOD(RC1,3)+MOD(INT((RC1)/3),3)*5+3,FALSE)&"|"&HLOOKUP(Sheet1!R2C1,Sheet1!R2C1:R16C1,MOD(RC1+1,3)+MOD(INT((RC1+1)/3),3)*5+3,FALSE)&"|"&HLOOKUP(Sheet1!R2C1,Sheet1!R2C1:R16C1,MOD(RC1+2,3)+MOD(INT((RC1+2)/3),3)*5+3,FALSE)&"|"&HLOOKUP(Sheet1!R2C1,Sheet1!R2C1:R16C1,MOD(RC1+3,3)+MOD(INT((RC1+3)/3),3)*5+3,FALSE) -> 132|133|134|162|163 | K118: =HLOOKUP(Sheet1!R2C1,Sheet1!R2C1:R16C1,MOD(RC1-1,3)+MOD(INT((RC1-1)/3),3)*5+3,FALSE)&"|"&HLOOKUP(Sheet1!R2C1,Sheet1!R2C1:R16C1,MOD(RC1,3)+MOD(INT((RC1)/3),3)*5+3,FALSE)&"|"&HLOOKUP(Sheet1!R2C1,Sheet1!R2C1:R16C1,MOD(RC1+1,3)+MOD(INT((RC1+1)/3),3)*5+3,FALSE)&"|"&HLOOKUP(Sheet1!R2C1,Sheet1!R2C1:R16C1,MOD(RC1+2,3)+MOD(INT((RC1+2)/3),3)*5+3,FALSE)&"|"&HLOOKUP(Sheet1!R2C1,Sheet1!R2C1:R16C1,MOD(RC1+3,3)+MOD(INT((RC1+3)/3),3)*5+3,FALSE) -> 132|133|134|162|163 | L118: 25|22|23|24 | M118: 300897|300898|300898|300898 | N118: 10030|10031|10032|10033 | O118: 1|1|1|1 | P118: 2500|2500|2500|2500
A119: 113 | B119: 111 | C119: 30 | D119: =R[-20]C+2 -> 30 | E119: 1000 | F119: =MOD(RC[-5]-1,3)*30+100&"|"&MOD(RC[-5]-1,3)*30+101&"|"&MOD(RC[-5]-1,3)*30+102&"|"&MOD(RC[-5]-1,3)*30+103&"|"&IF(MOD(RC[-5],4)=0,HLOOKUP(Sheet1!R2C10,Sheet1!R2C10:R7C10,MOD(RC[-5]/4-1,6)+1,FALSE),IF(MOD(RC[-5],2)=0,IF(RC[-5]>20,HLOOKUP(Sheet1!R2C7,Sheet1!R2C7:R43C7,MOD(RC[-5]/2-1,42)+1,FALSE),HLOOKUP(Sheet1!R2C4,Sheet1!R2C4:R7C4,MOD(RC[-5]-1,6)+1,FALSE)),MOD(RC[-5]-1,3)*30+104)) -> 130|131|132|133|134 | G119: =HLOOKUP(Sheet1!R2C1,Sheet1!R2C1:R16C1,MOD(RC1-1,2)+MOD(INT((RC1-1)/2),3)*5+1,FALSE)&"|"&HLOOKUP(Sheet1!R2C1,Sheet1!R2C1:R16C1,MOD(RC1,2)+MOD(INT((RC1)/2),3)*5+1,FALSE)&"|"&HLOOKUP(Sheet1!R2C1,Sheet1!R2C1:R16C1,MOD(RC1+1,2)+MOD(INT((RC1+1)/2),3)*5+1,FALSE)&"|"&HLOOKUP(Sheet1!R2C1,Sheet1!R2C1:R16C1,MOD(RC1+2,2)+MOD(INT((RC1+2)/2),3)*5+1,FALSE)&"|"&HLOOKUP(Sheet1!R2C1,Sheet1!R2C1:R16C1,MOD(RC1+3,2)+MOD(INT((RC1+3)/2),3)*5+1,FALSE) -> 160|161|100|101|130 | H119: =HLOOKUP(Sheet1!R2C1,Sheet1!R2C1:R16C1,MOD(RC1+2,2)+MOD(INT((RC1+2)/2),3)*5+1,FALSE)&"|"&HLOOKUP(Sheet1!R2C1,Sheet1!R2C1:R16C1,MOD(RC1+3,2)+MOD(INT((RC1+3)/2),3)*5+1,FALSE)&"|"&HLOOKUP(Sheet1!R2C1,Sheet1!R2C1:R16C1,MOD(RC1+4,2)+MOD(INT((RC1+4)/2),3)*5+1,FALSE)&"|"&HLOOKUP(Sheet1!R2C1,Sheet1!R2C1:R16C1,MOD(RC1+5,2)+MOD(INT((RC1+5)/2),3)*5+1,FALSE)&"|"&HLOOKUP(Sheet1!R2C1,Sheet1!R2C1:R16C1,MOD(RC1+6,2)+MOD(INT((RC1+6)/2),3)*5+1,FALSE) -> 101|130|131|160|161 | I119: =HLOOKUP(Sheet1!R2C1,Sheet1!R2C1:R16C1,MOD(RC1-1,3)+MOD(INT((RC1-1)/3),3)*5+3,FALSE)&"|"&HLOOKUP(Sheet1!R2C1,Sheet1!R2C1:R16C1,MOD(RC1,3)+MOD(INT((RC1)/3),3)*5+3,FALSE)&"|"&HLOOKUP(Sheet1!R2C1,Sheet1!R2C1:R16C1,MOD(RC1+1,3)+MOD(INT((RC1+1)/3),3)*5+3,FALSE)&"|"&HLOOKUP(Sheet1!R2C1,Sheet1!R2C1:R16C1,MOD(RC1+2,3)+MOD(INT((RC1+2)/3),3)*5+3,FALSE)&"|"&HLOOKUP(Sheet1!R2C1,Sheet1!R2C1:R16C1,MOD(RC1+3,3)+MOD(INT((RC1+3)/3),3)*5+3,FALSE) -> 133|134|162|163|164 | J119: =HLOOKUP(Sheet1!R2C1,Sheet1!R2C1:R16C1,MOD(RC1-1,3)+MOD(INT((RC1-1)/3),3)*5+3,FALSE)&"|"&HLOOKUP(Sheet1!R2C1,Sheet1!R2C1:R16C1,MOD(RC1,3)+MOD(INT((RC1)/3),3)*5+3,FALSE)&"|"&HLOOKUP(Sheet1!R2C1,Sheet1!R2C1:R16C1,MOD(RC1+1,3)+MOD(INT((RC1+1)/3),3)*5+3,FALSE)&"|"&HLOOKUP(Sheet1!R2C1,Sheet1!R2C1:R16C1,MOD(RC1+2,3)+MOD(INT((RC1+2)/3),3)*5+3,FALSE)&"|"&HLOOKUP(Sheet1!R2C1,Sheet1!R2C1:R16C1,MOD(RC1+3,3)+MOD(INT((RC1+3)/3),3)*5+3,FALSE) -> 133|134|162|163|164 | K119: =HLOOKUP(Sheet1!R2C1,Sheet1!R2C1:R16C1,MOD(RC1-1,3)+MOD(INT((RC1-1)/3),3)*5+3,FALSE)&"|"&HLOOKUP(Sheet1!R2C1,Sheet1!R2C1:R16C1,MOD(RC1,3)+MOD(INT((RC1)/3),3)*5+3,FALSE)&"|"&HLOOKUP(Sheet1!R2C1,Sheet1!R2C1:R16C1,MOD(RC1+1,3)+MOD(INT((RC1+1)/3),3)*5+3,FALSE)&"|"&HLOOKUP(Sheet1!R2C1,Sheet1!R2C1:R16C1,MOD(RC1+2,3)+MOD(INT((RC1+2)/3),3)*5+3,FALSE)&"|"&HLOOKUP(Sheet1!R2C1,Sheet1!R2C1:R16C1,MOD(RC1+3,3)+MOD(INT((RC1+3)/3),3)*5+3,FALSE) -> 133|134|162|163|164 | L119: 25|22|23|24 | M119: 305602|305603|305603|305603 | N119: 10030|10031|10032|10033 | O119: 1|1|1|1 | P119: 2500|2500|2500|2500
A120: 114 | B120: 112 | C120: 30 | D120: =R[-20]C+2 -> 30 | E120: 1000 | F120: =MOD(RC[-5]-1,3)*30+100&"|"&MOD(RC[-5]-1,3)*30+101&"|"&MOD(RC[-5]-1,3)*30+102&"|"&MOD(RC[-5]-1,3)*30+103&"|"&IF(MOD(RC[-5],4)=0,HLOOKUP(Sheet1!R2C10,Sheet1!R2C10:R7C10,MOD(RC[-5]/4-1,6)+1,FALSE),IF(MOD(RC[-5],2)=0,IF(RC[-5]>20,HLOOKUP(Sheet1!R2C7,Sheet1!R2C7:R43C7,MOD(RC[-5]/2-1,42)+1,FALSE),HLOOKUP(Sheet1!R2C4,Sheet1!R2C4:R7C4,MOD(RC[-5]-1,6)+1,FALSE)),MOD(RC[-5]-1,3)*30+104)) -> 160|161|162|163|142 | G120: =HLOOKUP(Sheet1!R2C1,Sheet1!R2C1:R16C1,MOD(RC1-1,2)+MOD(INT((RC1-1)/2),3)*5+1,FALSE)&"|"&HLOOKUP(Sheet1!R2C1,Sheet1!R2C1:R16C1,MOD(RC1,2)+MOD(INT((RC1)/2),3)*5+1,FALSE)&"|"&HLOOKUP(Sheet1!R2C1,Sheet1!R2C1:R16C1,MOD(RC1+1,2)+MOD(INT((RC1+1)/2),3)*5+1,FALSE)&"|"&HLOOKUP(Sheet1!R2C1,Sheet1!R2C1:R16C1,MOD(RC1+2,2)+MOD(INT((RC1+2)/2),3)*5+1,FALSE)&"|"&HLOOKUP(Sheet1!R2C1,Sheet1!R2C1:R16C1,MOD(RC1+3,2)+MOD(INT((RC1+3)/2),3)*5+1,FALSE) -> 161|100|101|130|131 | H120: =HLOOKUP(Sheet1!R2C1,Sheet1!R2C1:R16C1,MOD(RC1+2,2)+MOD(INT((RC1+2)/2),3)*5+1,FALSE)&"|"&HLOOKUP(Sheet1!R2C1,Sheet1!R2C1:R16C1,MOD(RC1+3,2)+MOD(INT((RC1+3)/2),3)*5+1,FALSE)&"|"&HLOOKUP(Sheet1!R2C1,Sheet1!R2C1:R16C1,MOD(RC1+4,2)+MOD(INT((RC1+4)/2),3)*5+1,FALSE)&"|"&HLOOKUP(Sheet1!R2C1,Sheet1!R2C1:R16C1,MOD(RC1+5,2)+MOD(INT((RC1+5)/2),3)*5+1,FALSE)&"|"&HLOOKUP(Sheet1!R2C1,Sheet1!R2C1:R16C1,MOD(RC1+6,2)+MOD(INT((RC1+6)/2),3)*5+1,FALSE) -> 130|131|160|161|100 | I120: =HLOOKUP(Sheet1!R2C1,Sheet1!R2C1:R16C1,MOD(RC1-1,3)+MOD(INT((RC1-1)/3),3)*5+3,FALSE)&"|"&HLOOKUP(Sheet1!R2C1,Sheet1!R2C1:R16C1,MOD(RC1,3)+MOD(INT((RC1)/3),3)*5+3,FALSE)&"|"&HLOOKUP(Sheet1!R2C1,Sheet1!R2C1:R16C1,MOD(RC1+1,3)+MOD(INT((RC1+1)/3),3)*5+3,FALSE)&"|"&HLOOKUP(Sheet1!R2C1,Sheet1!R2C1:R16C1,MOD(RC1+2,3)+MOD(INT((RC1+2)/3),3)*5+3,FALSE)&"|"&HLOOKUP(Sheet1!R2C1,Sheet1!R2C1:R16C1,MOD(RC1+3,3)+MOD(INT((RC1+3)/3),3)*5+3,FALSE) -> 134|162|163|164|102 | J120: =HLOOKUP(Sheet1!R2C1,Sheet1!R2C1:R16C1,MOD(RC1-1,3)+MOD(INT((RC1-1)/3),3)*5+3,FALSE)&"|"&HLOOKUP(Sheet1!R2C1,Sheet1!R2C1:R16C1,MOD(RC1,3)+MOD(INT((RC1)/3),3)*5+3,FALSE)&"|"&HLOOKUP(Sheet1!R2C1,Sheet1!R2C1:R16C1,MOD(RC1+1,3)+MOD(INT((RC1+1)/3),3)*5+3,FALSE)&"|"&HLOOKUP(Sheet1!R2C1,Sheet1!R2C1:R16C1,MOD(RC1+2,3)+MOD(INT((RC1+2)/3),3)*5+3,FALSE)&"|"&HLOOKUP(Sheet1!R2C1,Sheet1!R2C1:R16C1,MOD(RC1+3,3)+MOD(INT((RC1+3)/3),3)*5+3,FALSE) -> 134|162|163|164|102 | K120: =HLOOKUP(Sheet1!R2C1,Sheet1!R2C1:R16C1,MOD(RC1-1,3)+MOD(INT((RC1-1)/3),3)*5+3,FALSE)&"|"&HLOOKUP(Sheet1!R2C1,Sheet1!R2C1:R16C1,MOD(RC1,3)+MOD(INT((RC1)/3),3)*5+3,FALSE)&"|"&HLOOKUP(Sheet1!R2C1,Sheet1!R2C1:R16C1,MOD(RC1+1,3)+MOD(INT((RC1+1)/3),3)*5+3,FALSE)&"|"&HLOOKUP(Sheet1!R2C1,Sheet1!R2C1:R16C1,MOD(RC1+2,3)+MOD(INT((RC1+2)/3),3)*5+3,FALSE)&"|"&HLOOKUP(Sheet1!R2C1,Sheet1!R2C1:R16C1,MOD(RC1+3,3)+MOD(INT((RC1+3)/3),3)*5+3,FALSE) -> 134|162|163|164|102 | L120: 25|22|23|24 | M120: 310422|310423|310423|310423 | N120: 10030|10031|10032|10033 | O120: 1|1|1|1 | P120: 2500|2500|2500|2500
A121: 115 | B121: 113 | C121: 30 | D121: =R[-20]C+2 -> 30 | E121: 1000 | F121: =MOD(RC[-5]-1,3)*30+100&"|"&MOD(RC[-5]-1,3)*30+101&"|"&MOD(RC[-5]-1,3)*30+102&"|"&MOD(RC[-5]-1,3)*30+103&"|"&IF(MOD(RC[-5],4)=0,HLOOKUP(Sheet1!R2C10,Sheet1!R2C10:R7C10,MOD(RC[-5]/4-1,6)+1,FALSE),IF(MOD(RC[-5],2)=0,IF(RC[-5]>20,HLOOKUP(Sheet1!R2C7,Sheet1!R2C7:R43C7,MOD(RC[-5]/2-1,42)+1,FALSE),HLOOKUP(Sheet1!R2C4,Sheet1!R2C4:R7C4,MOD(RC[-5]-1,6)+1,FALSE)),MOD(RC[-5]-1,3)*30+104)) -> 100|101|102|103|104 | G121: =HLOOKUP(Sheet1!R2C1,Sheet1!R2C1:R16C1,MOD(RC1-1,2)+MOD(INT((RC1-1)/2),3)*5+1,FALSE)&"|"&HLOOKUP(Sheet1!R2C1,Sheet1!R2C1:R16C1,MOD(RC1,2)+MOD(INT((RC1)/2),3)*5+1,FALSE)&"|"&HLOOKUP(Sheet1!R2C1,Sheet1!R2C1:R16C1,MOD(RC1+1,2)+MOD(INT((RC1+1)/2),3)*5+1,FALSE)&"|"&HLOOKUP(Sheet1!R2C1,Sheet1!R2C1:R16C1,MOD(RC1+2,2)+MOD(INT((RC1+2)/2),3)*5+1,FALSE)&"|"&HLOOKUP(Sheet1!R2C1,Sheet1!R2C1:R16C1,MOD(RC1+3,2)+MOD(INT((RC1+3)/2),3)*5+1,FALSE) -> 100|101|130|131|160 | H121: =HLOOKUP(Sheet1!R2C1,Sheet1!R2C1:R16C1,MOD(RC1+2,2)+MOD(INT((RC1+2)/2),3)*5+1,FALSE)&"|"&HLOOKUP(Sheet1!R2C1,Sheet1!R2C1:R16C1,MOD(RC1+3,2)+MOD(INT((RC1+3)/2),3)*5+1,FALSE)&"|"&HLOOKUP(Sheet1!R2C1,Sheet1!R2C1:R16C1,MOD(RC1+4,2)+MOD(INT((RC1+4)/2),3)*5+1,FALSE)&"|"&HLOOKUP(Sheet1!R2C1,Sheet1!R2C1:R16C1,MOD(RC1+5,2)+MOD(INT((RC1+5)/2),3)*5+1,FALSE)&"|"&HLOOKUP(Sheet1!R2C1,Sheet1!R2C1:R16C1,MOD(RC1+6,2)+MOD(INT((RC1+6)/2),3)*5+1,FALSE) -> 131|160|161|100|101 | I121: =HLOOKUP(Sheet1!R2C1,Sheet1!R2C1:R16C1,MOD(RC1-1,3)+MOD(INT((RC1-1)/3),3)*5+3,FALSE)&"|"&HLOOKUP(Sheet1!R2C1,Sheet1!R2C1:R16C1,MOD(RC1,3)+MOD(INT((RC1)/3),3)*5+3,FALSE)&"|"&HLOOKUP(Sheet1!R2C1,Sheet1!R2C1:R16C1,MOD(RC1+1,3)+MOD(INT((RC1+1)/3),3)*5+3,FALSE)&"|"&HLOOKUP(Sheet1!R2C1,Sheet1!R2C1:R16C1,MOD(RC1+2,3)+MOD(INT((RC1+2)/3),3)*5+3,FALSE)&"|"&HLOOKUP(Sheet1!R2C1,Sheet1!R2C1:R16C1,MOD(RC1+3,3)+MOD(INT((RC1+3)/3),3)*5+3,FALSE) -> 162|163|164|102|103 | J121: =HLOOKUP(Sheet1!R2C1,Sheet1!R2C1:R16C1,MOD(RC1-1,3)+MOD(INT((RC1-1)/3),3)*5+3,FALSE)&"|"&HLOOKUP(Sheet1!R2C1,Sheet1!R2C1:R16C1,MOD(RC1,3)+MOD(INT((RC1)/3),3)*5+3,FALSE)&"|"&HLOOKUP(Sheet1!R2C1,Sheet1!R2C1:R16C1,MOD(RC1+1,3)+MOD(INT((RC1+1)/3),3)*5+3,FALSE)&"|"&HLOOKUP(Sheet1!R2C1,Sheet1!R2C1:R16C1,MOD(RC1+2,3)+MOD(INT((RC1+2)/3),3)*5+3,FALSE)&"|"&HLOOKUP(Sheet1!R2C1,Sheet1!R2C1:R16C1,MOD(RC1+3,3)+MOD(INT((RC1+3)/3),3)*5+3,FALSE) -> 162|163|164|102|103 | K121: =HLOOKUP(Sheet1!R2C1,Sheet1!R2C1:R16C1,MOD(RC1-1,3)+MOD(INT((RC1-1)/3),3)*5+3,FALSE)&"|"&HLOOKUP(Sheet1!R2C1,Sheet1!R2C1:R16C1,MOD(RC1,3)+MOD(INT((RC1)/3),3)*5+3,FALSE)&"|"&HLOOKUP(Sheet1!R2C1,Sheet1!R2C1:R16C1,MOD(RC1+1,3)+MOD(INT((RC1+1)/3),3)*5+3,FALSE)&"|"&HLOOKUP(Sheet1!R2C1,Sheet1!R2C1:R16C1,MOD(RC1+2,3)+MOD(INT((RC1+2)/3),3)*5+3,FALSE)&"|"&HLOOKUP(Sheet1!R2C1,Sheet1!R2C1:R16C1,MOD(RC1+3,3)+MOD(INT((RC1+3)/3),3)*5+3,FALSE) -> 162|163|164|102|103 | L121: 25|22|23|24 | M121: 315298|315299|315298|315298 | N121: 10030|10031|10032|10033|10030|10031|10032|10033|10030|10031|10032|10033|10030|10031|10032|10033|10030|10031|10032|10033|10030|10031|10032|10033|10030|10031|10032|10033|10030|10031|10032|10033|10030|10031|10032|10033|10030|10031|10032|10033 | O121: 1|1|1|1|1|1|1|1|1|1|1|1|1|1|1|1|1|1|1|1|1|1|1|1|1|1|1|1|1|1|1|1|1|1|1|1|1|1|1|1 | P121: 2500|2500|2500|2500|2500|2500|2500|2500|2500|2500|2500|2500|2500|2500|2500|2500|2500|2500|2500|2500|2500|2500|2500|2500|2500|2500|2500|2500|2500|2500|2500|2500|2500|2500|2500|2500|2500|2500|2500|2500
A122: 116 | B122: 114 | C122: 30 | D122: =R[-20]C+2 -> 30 | E122: 1000 | F122: =MOD(RC[-5]-1,3)*30+100&"|"&MOD(RC[-5]-1,3)*30+101&"|"&MOD(RC[-5]-1,3)*30+102&"|"&MOD(RC[-5]-1,3)*30+103&"|"&IF(MOD(RC[-5],4)=0,HLOOKUP(Sheet1!R2C10,Sheet1!R2C10:R7C10,MOD(RC[-5]/4-1,6)+1,FALSE),IF(MOD(RC[-5],2)=0,IF(RC[-5]>20,HLOOKUP(Sheet1!R2C7,Sheet1!R2C7:R43C7,MOD(RC[-5]/2-1,42)+1,FALSE),HLOOKUP(Sheet1!R2C4,Sheet1!R2C4:R7C4,MOD(RC[-5]-1,6)+1,FALSE)),MOD(RC[-5]-1,3)*30+104)) -> 130|131|132|133|194 | G122: =HLOOKUP(Sheet1!R2C1,Sheet1!R2C1:R16C1,MOD(RC1-1,2)+MOD(INT((RC1-1)/2),3)*5+1,FALSE)&"|"&HLOOKUP(Sheet1!R2C1,Sheet1!R2C1:R16C1,MOD(RC1,2)+MOD(INT((RC1)/2),3)*5+1,FALSE)&"|"&HLOOKUP(Sheet1!R2C1,Sheet1!R2C1:R16C1,MOD(RC1+1,2)+MOD(INT((RC1+1)/2),3)*5+1,FALSE)&"|"&HLOOKUP(Sheet1!R2C1,Sheet1!R2C1:R16C1,MOD(RC1+2,2)+MOD(INT((RC1+2)/2),3)*5+1,FALSE)&"|"&HLOOKUP(Sheet1!R2C1,Sheet1!R2C1:R16C1,MOD(RC1+3,2)+MOD(INT((RC1+3)/2),3)*5+1,FALSE) -> 101|130|131|160|161 | H122: =HLOOKUP(Sheet1!R2C1,Sheet1!R2C1:R16C1,MOD(RC1+2,2)+MOD(INT((RC1+2)/2),3)*5+1,FALSE)&"|"&HLOOKUP(Sheet1!R2C1,Sheet1!R2C1:R16C1,MOD(RC1+3,2)+MOD(INT((RC1+3)/2),3)*5+1,FALSE)&"|"&HLOOKUP(Sheet1!R2C1,Sheet1!R2C1:R16C1,MOD(RC1+4,2)+MOD(INT((RC1+4)/2),3)*5+1,FALSE)&"|"&HLOOKUP(Sheet1!R2C1,Sheet1!R2C1:R16C1,MOD(RC1+5,2)+MOD(INT((RC1+5)/2),3)*5+1,FALSE)&"|"&HLOOKUP(Sheet1!R2C1,Sheet1!R2C1:R16C1,MOD(RC1+6,2)+MOD(INT((RC1+6)/2),3)*5+1,FALSE) -> 160|161|100|101|130 | I122: =HLOOKUP(Sheet1!R2C1,Sheet1!R2C1:R16C1,MOD(RC1-1,3)+MOD(INT((RC1-1)/3),3)*5+3,FALSE)&"|"&HLOOKUP(Sheet1!R2C1,Sheet1!R2C1:R16C1,MOD(RC1,3)+MOD(INT((RC1)/3),3)*5+3,FALSE)&"|"&HLOOKUP(Sheet1!R2C1,Sheet1!R2C1:R16C1,MOD(RC1+1,3)+MOD(INT((RC1+1)/3),3)*5+3,FALSE)&"|"&HLOOKUP(Sheet1!R2C1,Sheet1!R2C1:R16C1,MOD(RC1+2,3)+MOD(INT((RC1+2)/3),3)*5+3,FALSE)&"|"&HLOOKUP(Sheet1!R2C1,Sheet1!R2C1:R16C1,MOD(RC1+3,3)+MOD(INT((RC1+3)/3),3)*5+3,FALSE) -> 163|164|102|103|104 | J122: =HLOOKUP(Sheet1!R2C1,Sheet1!R2C1:R16C1,MOD(RC1-1,3)+MOD(INT((RC1-1)/3),3)*5+3,FALSE)&"|"&HLOOKUP(Sheet1!R2C1,Sheet1!R2C1:R16C1,MOD(RC1,3)+MOD(INT((RC1)/3),3)*5+3,FALSE)&"|"&HLOOKUP(Sheet1!R2C1,Sheet1!R2C1:R16C1,MOD(RC1+1,3)+MOD(INT((RC1+1)/3),3)*5+3,FALSE)&"|"&HLOOKUP(Sheet1!R2C1,Sheet1!R2C1:R16C1,MOD(RC1+2,3)+MOD(INT((RC1+2)/3),3)*5+3,FALSE)&"|"&HLOOKUP(Sheet1!R2C1,Sheet1!R2C1:R16C1,MOD(RC1+3,3)+MOD(INT((RC1+3)/3),3)*5+3,FALSE) -> 163|164|102|103|104 | K122: =HLOOKUP(Sheet1!R2C1,Sheet1!R2C1:R16C1,MOD(RC1-1,3)+MOD(INT((RC1-1)/3),3)*5+3,FALSE)&"|"&HLOOKUP(Sheet1!R2C1,Sheet1!R2C1:R16C1,MOD(RC1,3)+MOD(INT((RC1)/3),3)*5+3,FALSE)&"|"&HLOOKUP(Sheet1!R2C1,Sheet1!R2C1:R16C1,MOD(RC1+1,3)+MOD(INT((RC1+1)/3),3)*5+3,FALSE)&"|"&HLOOKUP(Sheet1!R2C1,Sheet1!R2C1:R16C1,MOD(RC1+2,3)+MOD(INT((RC1+2)/3),3)*5+3,FALSE)&"|"&HLOOKUP(Sheet1!R2C1,Sheet1!R2C1:R16C1,MOD(RC1+3,3)+MOD(INT((RC1+3)/3),3)*5+3,FALSE) -> 163|164|102|103|104 | L122: 25|22|23|24 | M122: 320174|320174|320175|320175 | N122: 10030|10031|10032|10033 | O122: 1|1|1|1 | P122: 2500|2500|2500|2500
A123: 117 | B123: 115 | C123: 30 | D123: =R[-20]C+2 -> 30 | E123: 1000 | F123: =MOD(RC[-5]-1,3)*30+100&"|"&MOD(RC[-5]-1,3)*30+101&"|"&MOD(RC[-5]-1,3)*30+102&"|"&MOD(RC[-5]-1,3)*30+103&"|"&IF(MOD(RC[-5],4)=0,HLOOKUP(Sheet1!R2C10,Sheet1!R2C10:R7C10,MOD(RC[-5]/4-1,6)+1,FALSE),IF(MOD(RC[-5],2)=0,IF(RC[-5]>20,HLOOKUP(Sheet1!R2C7,Sheet1!R2C7:R43C7,MOD(RC[-5]/2-1,42)+1,FALSE),HLOOKUP(Sheet1!R2C4,Sheet1!R2C4:R7C4,MOD(RC[-5]-1,6)+1,FALSE)),MOD(RC[-5]-1,3)*30+104)) -> 160|161|162|163|164 | G123: =HLOOKUP(Sheet1!R2C1,Sheet1!R2C1:R16C1,MOD(RC1-1,2)+MOD(INT((RC1-1)/2),3)*5+1,FALSE)&"|"&HLOOKUP(Sheet1!R2C1,Sheet1!R2C1:R16C1,MOD(RC1,2)+MOD(INT((RC1)/2),3)*5+1,FALSE)&"|"&HLOOKUP(Sheet1!R2C1,Sheet1!R2C1:R16C1,MOD(RC1+1,2)+MOD(INT((RC1+1)/2),3)*5+1,FALSE)&"|"&HLOOKUP(Sheet1!R2C1,Sheet1!R2C1:R16C1,MOD(RC1+2,2)+MOD(INT((RC1+2)/2),3)*5+1,FALSE)&"|"&HLOOKUP(Sheet1!R2C1,Sheet1!R2C1:R16C1,MOD(RC1+3,2)+MOD(INT((RC1+3)/2),3)*5+1,FALSE) -> 130|131|160|161|100 | H123: =HLOOKUP(Sheet1!R2C1,Sheet1!R2C1:R16C1,MOD(RC1+2,2)+MOD(INT((RC1+2)/2),3)*5+1,FALSE)&"|"&HLOOKUP(Sheet1!R2C1,Sheet1!R2C1:R16C1,MOD(RC1+3,2)+MOD(INT((RC1+3)/2),3)*5+1,FALSE)&"|"&HLOOKUP(Sheet1!R2C1,Sheet1!R2C1:R16C1,MOD(RC1+4,2)+MOD(INT((RC1+4)/2),3)*5+1,FALSE)&"|"&HLOOKUP(Sheet1!R2C1,Sheet1!R2C1:R16C1,MOD(RC1+5,2)+MOD(INT((RC1+5)/2),3)*5+1,FALSE)&"|"&HLOOKUP(Sheet1!R2C1,Sheet1!R2C1:R16C1,MOD(RC1+6,2)+MOD(INT((RC1+6)/2),3)*5+1,FALSE) -> 161|100|101|130|131 | I123: =HLOOKUP(Sheet1!R2C1,Sheet1!R2C1:R16C1,MOD(RC1-1,3)+MOD(INT((RC1-1)/3),3)*5+3,FALSE)&"|"&HLOOKUP(Sheet1!R2C1,Sheet1!R2C1:R16C1,MOD(RC1,3)+MOD(INT((RC1)/3),3)*5+3,FALSE)&"|"&HLOOKUP(Sheet1!R2C1,Sheet1!R2C1:R16C1,MOD(RC1+1,3)+MOD(INT((RC1+1)/3),3)*5+3,FALSE)&"|"&HLOOKUP(Sheet1!R2C1,Sheet1!R2C1:R16C1,MOD(RC1+2,3)+MOD(INT((RC1+2)/3),3)*5+3,FALSE)&"|"&HLOOKUP(Sheet1!R2C1,Sheet1!R2C1:R16C1,MOD(RC1+3,3)+MOD(INT((RC1+3)/3),3)*5+3,FALSE) -> 164|102|103|104|132 | J123: =HLOOKUP(Sheet1!R2C1,Sheet1!R2C1:R16C1,MOD(RC1-1,3)+MOD(INT((RC1-1)/3),3)*5+3,FALSE)&"|"&HLOOKUP(Sheet1!R2C1,Sheet1!R2C1:R16C1,MOD(RC1,3)+MOD(INT((RC1)/3),3)*5+3,FALSE)&"|"&HLOOKUP(Sheet1!R2C1,Sheet1!R2C1:R16C1,MOD(RC1+1,3)+MOD(INT((RC1+1)/3),3)*5+3,FALSE)&"|"&HLOOKUP(Sheet1!R2C1,Sheet1!R2C1:R16C1,MOD(RC1+2,3)+MOD(INT((RC1+2)/3),3)*5+3,FALSE)&"|"&HLOOKUP(Sheet1!R2C1,Sheet1!R2C1:R16C1,MOD(RC1+3,3)+MOD(INT((RC1+3)/3),3)*5+3,FALSE) -> 164|102|103|104|132 | K123: =HLOOKUP(Sheet1!R2C1,Sheet1!R2C1:R16C1,MOD(RC1-1,3)+MOD(INT((RC1-1)/3),3)*5+3,FALSE)&"|"&HLOOKUP(Sheet1!R2C1,Sheet1!R2C1:R16C1,MOD(RC1,3)+MOD(INT((RC1)/3),3)*5+3,FALSE)&"|"&HLOOKUP(Sheet1!R2C1,Sheet1!R2C1:R16C1,MOD(RC1+1,3)+MOD(INT((RC1+1)/3),3)*5+3,FALSE)&"|"&HLOOKUP(Sheet1!R2C1,Sheet1!R2C1:R16C1,MOD(RC1+2,3)+MOD(INT((RC1+2)/3),3)*5+3,FALSE)&"|"&HLOOKUP(Sheet1!R2C1,Sheet1!R2C1:R16C1,MOD(RC1+3,3)+MOD(INT((RC1+3)/3),3)*5+3,FALSE) -> 164|102|103|104|132 | L123: 25|22|23|24 | M123: 325155|325155|325155|325155 | N123: 10030|10031|10032|10033 | O123: 1|1|1|1 | P123: 2500|2500|2500|2500
A124: 118 | B124: 116 | C124: 30 | D124: =R[-20]C+2 -> 30 | E124: 1000 | F124: =MOD(RC[-5]-1,3)*30+100&"|"&MOD(RC[-5]-1,3)*30+101&"|"&MOD(RC[-5]-1,3)*30+102&"|"&MOD(RC[-5]-1,3)*30+103&"|"&IF(MOD(RC[-5],4)=0,HLOOKUP(Sheet1!R2C10,Sheet1!R2C10:R7C10,MOD(RC[-5]/4-1,6)+1,FALSE),IF(MOD(RC[-5],2)=0,IF(RC[-5]>20,HLOOKUP(Sheet1!R2C7,Sheet1!R2C7:R43C7,MOD(RC[-5]/2-1,42)+1,FALSE),HLOOKUP(Sheet1!R2C4,Sheet1!R2C4:R7C4,MOD(RC[-5]-1,6)+1,FALSE)),MOD(RC[-5]-1,3)*30+104)) -> 100|101|102|103|144 | G124: =HLOOKUP(Sheet1!R2C1,Sheet1!R2C1:R16C1,MOD(RC1-1,2)+MOD(INT((RC1-1)/2),3)*5+1,FALSE)&"|"&HLOOKUP(Sheet1!R2C1,Sheet1!R2C1:R16C1,MOD(RC1,2)+MOD(INT((RC1)/2),3)*5+1,FALSE)&"|"&HLOOKUP(Sheet1!R2C1,Sheet1!R2C1:R16C1,MOD(RC1+1,2)+MOD(INT((RC1+1)/2),3)*5+1,FALSE)&"|"&HLOOKUP(Sheet1!R2C1,Sheet1!R2C1:R16C1,MOD(RC1+2,2)+MOD(INT((RC1+2)/2),3)*5+1,FALSE)&"|"&HLOOKUP(Sheet1!R2C1,Sheet1!R2C1:R16C1,MOD(RC1+3,2)+MOD(INT((RC1+3)/2),3)*5+1,FALSE) -> 131|160|161|100|101 | H124: =HLOOKUP(Sheet1!R2C1,Sheet1!R2C1:R16C1,MOD(RC1+2,2)+MOD(INT((RC1+2)/2),3)*5+1,FALSE)&"|"&HLOOKUP(Sheet1!R2C1,Sheet1!R2C1:R16C1,MOD(RC1+3,2)+MOD(INT((RC1+3)/2),3)*5+1,FALSE)&"|"&HLOOKUP(Sheet1!R2C1,Sheet1!R2C1:R16C1,MOD(RC1+4,2)+MOD(INT((RC1+4)/2),3)*5+1,FALSE)&"|"&HLOOKUP(Sheet1!R2C1,Sheet1!R2C1:R16C1,MOD(RC1+5,2)+MOD(INT((RC1+5)/2),3)*5+1,FALSE)&"|"&HLOOKUP(Sheet1!R2C1,Sheet1!R2C1:R16C1,MOD(RC1+6,2)+MOD(INT((RC1+6)/2),3)*5+1,FALSE) -> 100|101|130|131|160 | I124: =HLOOKUP(Sheet1!R2C1,Sheet1!R2C1:R16C1,MOD(RC1-1,3)+MOD(INT((RC1-1)/3),3)*5+3,FALSE)&"|"&HLOOKUP(Sheet1!R2C1,Sheet1!R2C1:R16C1,MOD(RC1,3)+MOD(INT((RC1)/3),3)*5+3,FALSE)&"|"&HLOOKUP(Sheet1!R2C1,Sheet1!R2C1:R16C1,MOD(RC1+1,3)+MOD(INT((RC1+1)/3),3)*5+3,FALSE)&"|"&HLOOKUP(Sheet1!R2C1,Sheet1!R2C1:R16C1,MOD(RC1+2,3)+MOD(INT((RC1+2)/3),3)*5+3,FALSE)&"|"&HLOOKUP(Sheet1!R2C1,Sheet1!R2C1:R16C1,MOD(RC1+3,3)+MOD(INT((RC1+3)/3),3)*5+3,FALSE) -> 102|103|104|132|133 | J124: =HLOOKUP(Sheet1!R2C1,Sheet1!R2C1:R16C1,MOD(RC1-1,3)+MOD(INT((RC1-1)/3),3)*5+3,FALSE)&"|"&HLOOKUP(Sheet1!R2C1,Sheet1!R2C1:R16C1,MOD(RC1,3)+MOD(INT((RC1)/3),3)*5+3,FALSE)&"|"&HLOOKUP(Sheet1!R2C1,Sheet1!R2C1:R16C1,MOD(RC1+1,3)+MOD(INT((RC1+1)/3),3)*5+3,FALSE)&"|"&HLOOKUP(Sheet1!R2C1,Sheet1!R2C1:R16C1,MOD(RC1+2,3)+MOD(INT((RC1+2)/3),3)*5+3,FALSE)&"|"&HLOOKUP(Sheet1!R2C1,Sheet1!R2C1:R16C1,MOD(RC1+3,3)+MOD(INT((RC1+3)/3),3)*5+3,FALSE) -> 102|103|104|132|133 | K124: =HLOOKUP(Sheet1!R2C1,Sheet1!R2C1:R16C1,MOD(RC1-1,3)+MOD(INT((RC1-1)/3),3)*5+3,FALSE)&"|"&HLOOKUP(Sheet1!R2C1,Sheet1!R2C1:R16C1,MOD(RC1,3)+MOD(INT((RC1)/3),3)*5+3,FALSE)&"|"&HLOOKUP(Sheet1!R2C1,Sheet1!R2C1:R16C1,MOD(RC1+1,3)+MOD(INT((RC1+1)/3),3)*5+3,FALSE)&"|"&HLOOKUP(Sheet1!R2C1,Sheet1!R2C1:R16C1,MOD(RC1+2,3)+MOD(INT((RC1+2)/3),3)*5+3,FALSE)&"|"&HLOOKUP(Sheet1!R2C1,Sheet1!R2C1:R16C1,MOD(RC1+3,3)+MOD(INT((RC1+3)/3),3)*5+3,FALSE) -> 102|103|104|132|133 | L124: 25|22|23|24 | M124: 330263|330263|330263|330263 | N124: 10030|10031|10032|10033 | O124: 1|1|1|1 | P124: 2500|2500|2500|2500
A125: 119 | B125: 117 | C125: 30 | D125: =R[-20]C+2 -> 30 | E125: 1000 | F125: =MOD(RC[-5]-1,3)*30+100&"|"&MOD(RC[-5]-1,3)*30+101&"|"&MOD(RC[-5]-1,3)*30+102&"|"&MOD(RC[-5]-1,3)*30+103&"|"&IF(MOD(RC[-5],4)=0,HLOOKUP(Sheet1!R2C10,Sheet1!R2C10:R7C10,MOD(RC[-5]/4-1,6)+1,FALSE),IF(MOD(RC[-5],2)=0,IF(RC[-5]>20,HLOOKUP(Sheet1!R2C7,Sheet1!R2C7:R43C7,MOD(RC[-5]/2-1,42)+1,FALSE),HLOOKUP(Sheet1!R2C4,Sheet1!R2C4:R7C4,MOD(RC[-5]-1,6)+1,FALSE)),MOD(RC[-5]-1,3)*30+104)) -> 130|131|132|133|134 | G125: =HLOOKUP(Sheet1!R2C1,Sheet1!R2C1:R16C1,MOD(RC1-1,2)+MOD(INT((RC1-1)/2),3)*5+1,FALSE)&"|"&HLOOKUP(Sheet1!R2C1,Sheet1!R2C1:R16C1,MOD(RC1,2)+MOD(INT((RC1)/2),3)*5+1,FALSE)&"|"&HLOOKUP(Sheet1!R2C1,Sheet1!R2C1:R16C1,MOD(RC1+1,2)+MOD(INT((RC1+1)/2),3)*5+1,FALSE)&"|"&HLOOKUP(Sheet1!R2C1,Sheet1!R2C1:R16C1,MOD(RC1+2,2)+MOD(INT((RC1+2)/2),3)*5+1,FALSE)&"|"&HLOOKUP(Sheet1!R2C1,Sheet1!R2C1:R16C1,MOD(RC1+3,2)+MOD(INT((RC1+3)/2),3)*5+1,FALSE) -> 160|161|100|101|130 | H125: =HLOOKUP(Sheet1!R2C1,Sheet1!R2C1:R16C1,MOD(RC1+2,2)+MOD(INT((RC1+2)/2),3)*5+1,FALSE)&"|"&HLOOKUP(Sheet1!R2C1,Sheet1!R2C1:R16C1,MOD(RC1+3,2)+MOD(INT((RC1+3)/2),3)*5+1,FALSE)&"|"&HLOOKUP(Sheet1!R2C1,Sheet1!R2C1:R16C1,MOD(RC1+4,2)+MOD(INT((RC1+4)/2),3)*5+1,FALSE)&"|"&HLOOKUP(Sheet1!R2C1,Sheet1!R2C1:R16C1,MOD(RC1+5,2)+MOD(INT((RC1+5)/2),3)*5+1,FALSE)&"|"&HLOOKUP(Sheet1!R2C1,Sheet1!R2C1:R16C1,MOD(RC1+6,2)+MOD(INT((RC1+6)/2),3)*5+1,FALSE) -> 101|130|131|160|161 | I125: =HLOOKUP(Sheet1!R2C1,Sheet1!R2C1:R16C1,MOD(RC1-1,3)+MOD(INT((RC1-1)/3),3)*5+3,FALSE)&"|"&HLOOKUP(Sheet1!R2C1,Sheet1!R2C1:R16C1,MOD(RC1,3)+MOD(INT((RC1)/3),3)*5+3,FALSE)&"|"&HLOOKUP(Sheet1!R2C1,Sheet1!R2C1:R16C1,MOD(RC1+1,3)+MOD(INT((RC1+1)/3),3)*5+3,FALSE)&"|"&HLOOKUP(Sheet1!R2C1,Sheet1!R2C1:R16C1,MOD(RC1+2,3)+MOD(INT((RC1+2)/3),3)*5+3,FALSE)&"|"&HLOOKUP(Sheet1!R2C1,Sheet1!R2C1:R16C1,MOD(RC1+3,3)+MOD(INT((RC1+3)/3),3)*5+3,FALSE) -> 103|104|132|133|134 | J125: =HLOOKUP(Sheet1!R2C1,Sheet1!R2C1:R16C1,MOD(RC1-1,3)+MOD(INT((RC1-1)/3),3)*5+3,FALSE)&"|"&HLOOKUP(Sheet1!R2C1,Sheet1!R2C1:R16C1,MOD(RC1,3)+MOD(INT((RC1)/3),3)*5+3,FALSE)&"|"&HLOOKUP(Sheet1!R2C1,Sheet1!R2C1:R16C1,MOD(RC1+1,3)+MOD(INT((RC1+1)/3),3)*5+3,FALSE)&"|"&HLOOKUP(Sheet1!R2C1,Sheet1!R2C1:R16C1,MOD(RC1+2,3)+MOD(INT((RC1+2)/3),3)*5+3,FALSE)&"|"&HLOOKUP(Sheet1!R2C1,Sheet1!R2C1:R16C1,MOD(RC1+3,3)+MOD(INT((RC1+3)/3),3)*5+3,FALSE) -> 103|104|132|133|134 | K125: =HLOOKUP(Sheet1!R2C1,Sheet1!R2C1:R16C1,MOD(RC1-1,3)+MOD(INT((RC1-1)/3),3)*5+3,FALSE)&"|"&HLOOKUP(Sheet1!R2C1,Sheet1!R2C1:R16C1,MOD(RC1,3)+MOD(INT((RC1)/3),3)*5+3,FALSE)&"|"&HLOOKUP(Sheet1!R2C1,Sheet1!R2C1:R16C1,MOD(RC1+1,3)+MOD(INT((RC1+1)/3),3)*5+3,FALSE)&"|"&HLOOKUP(Sheet1!R2C1,Sheet1!R2C1:R16C1,MOD(RC1+2,3)+MOD(INT((RC1+2)/3),3)*5+3,FALSE)&"|"&HLOOKUP(Sheet1!R2C1,Sheet1!R2C1:R16C1,MOD(RC1+3,3)+MOD(INT((RC1+3)/3),3)*5+3,FALSE) -> 103|104|132|133|134 | L125: 25|22|23|24 | M125: 335206|335206|335205|335205 | N125: 10030|10031|10032|10033 | O125: 1|1|1|1 | P125: 2500|2500|2500|2500
A126: 120 | B126: 118 | C126: 30 | D126: =R[-20]C+2 -> 30 | E126: 1000 | F126: =MOD(RC[-5]-1,3)*30+100&"|"&MOD(RC[-5]-1,3)*30+101&"|"&MOD(RC[-5]-1,3)*30+102&"|"&MOD(RC[-5]-1,3)*30+103&"|"&IF(MOD(RC[-5],4)=0,HLOOKUP(Sheet1!R2C10,Sheet1!R2C10:R7C10,MOD(RC[-5]/4-1,6)+1,FALSE),IF(MOD(RC[-5],2)=0,IF(RC[-5]>20,HLOOKUP(Sheet1!R2C7,Sheet1!R2C7:R43C7,MOD(RC[-5]/2-1,42)+1,FALSE),HLOOKUP(Sheet1!R2C4,Sheet1!R2C4:R7C4,MOD(RC[-5]-1,6)+1,FALSE)),MOD(RC[-5]-1,3)*30+104)) -> 160|161|162|163|195 | G126: =HLOOKUP(Sheet1!R2C1,Sheet1!R2C1:R16C1,MOD(RC1-1,2)+MOD(INT((RC1-1)/2),3)*5+1,FALSE)&"|"&HLOOKUP(Sheet1!R2C1,Sheet1!R2C1:R16C1,MOD(RC1,2)+MOD(INT((RC1)/2),3)*5+1,FALSE)&"|"&HLOOKUP(Sheet1!R2C1,Sheet1!R2C1:R16C1,MOD(RC1+1,2)+MOD(INT((RC1+1)/2),3)*5+1,FALSE)&"|"&HLOOKUP(Sheet1!R2C1,Sheet1!R2C1:R16C1,MOD(RC1+2,2)+MOD(INT((RC1+2)/2),3)*5+1,FALSE)&"|"&HLOOKUP(Sheet1!R2C1,Sheet1!R2C1:R16C1,MOD(RC1+3,2)+MOD(INT((RC1+3)/2),3)*5+1,FALSE) -> 161|100|101|130|131 | H126: =HLOOKUP(Sheet1!R2C1,Sheet1!R2C1:R16C1,MOD(RC1+2,2)+MOD(INT((RC1+2)/2),3)*5+1,FALSE)&"|"&HLOOKUP(Sheet1!R2C1,Sheet1!R2C1:R16C1,MOD(RC1+3,2)+MOD(INT((RC1+3)/2),3)*5+1,FALSE)&"|"&HLOOKUP(Sheet1!R2C1,Sheet1!R2C1:R16C1,MOD(RC1+4,2)+MOD(INT((RC1+4)/2),3)*5+1,FALSE)&"|"&HLOOKUP(Sheet1!R2C1,Sheet1!R2C1:R16C1,MOD(RC1+5,2)+MOD(INT((RC1+5)/2),3)*5+1,FALSE)&"|"&HLOOKUP(Sheet1!R2C1,Sheet1!R2C1:R16C1,MOD(RC1+6,2)+MOD(INT((RC1+6)/2),3)*5+1,FALSE) -> 130|131|160|161|100 | I126: =HLOOKUP(Sheet1!R2C1,Sheet1!R2C1:R16C1,MOD(RC1-1,3)+MOD(INT((RC1-1)/3),3)*5+3,FALSE)&"|"&HLOOKUP(Sheet1!R2C1,Sheet1!R2C1:R16C1,MOD(RC1,3)+MOD(INT((RC1)/3),3)*5+3,FALSE)&"|"&HLOOKUP(Sheet1!R2C1,Sheet1!R2C1:R16C1,MOD(RC1+1,3)+MOD(INT((RC1+1)/3),3)*5+3,FALSE)&"|"&HLOOKUP(Sheet1!R2C1,Sheet1!R2C1:R16C1,MOD(RC1+2,3)+MOD(INT((RC1+2)/3),3)*5+3,FALSE)&"|"&HLOOKUP(Sheet1!R2C1,Sheet1!R2C1:R16C1,MOD(RC1+3,3)+MOD(INT((RC1+3)/3),3)*5+3,FALSE) -> 104|132|133|134|162 | J126: =HLOOKUP(Sheet1!R2C1,Sheet1!R2C1:R16C1,MOD(RC1-1,3)+MOD(INT((RC1-1)/3),3)*5+3,FALSE)&"|"&HLOOKUP(Sheet1!R2C1,Sheet1!R2C1:R16C1,MOD(RC1,3)+MOD(INT((RC1)/3),3)*5+3,FALSE)&"|"&HLOOKUP(Sheet1!R2C1,Sheet1!R2C1:R16C1,MOD(RC1+1,3)+MOD(INT((RC1+1)/3),3)*5+3,FALSE)&"|"&HLOOKUP(Sheet1!R2C1,Sheet1!R2C1:R16C1,MOD(RC1+2,3)+MOD(INT((RC1+2)/3),3)*5+3,FALSE)&"|"&HLOOKUP(Sheet1!R2C1,Sheet1!R2C1:R16C1,MOD(RC1+3,3)+MOD(INT((RC1+3)/3),3)*5+3,FALSE) -> 104|132|133|134|162 | K126: =HLOOKUP(Sheet1!R2C1,Sheet1!R2C1:R16C1,MOD(RC1-1,3)+MOD(INT((RC1-1)/3),3)*5+3,FALSE)&"|"&HLOOKUP(Sheet1!R2C1,Sheet1!R2C1:R16C1,MOD(RC1,3)+MOD(INT((RC1)/3),3)*5+3,FALSE)&"|"&HLOOKUP(Sheet1!R2C1,Sheet1!R2C1:R16C1,MOD(RC1+1,3)+MOD(INT((RC1+1)/3),3)*5+3,FALSE)&"|"&HLOOKUP(Sheet1!R2C1,Sheet1!R2C1:R16C1,MOD(RC1+2,3)+MOD(INT((RC1+2)/3),3)*5+3,FALSE)&"|"&HLOOKUP(Sheet1!R2C1,Sheet1!R2C1:R16C1,MOD(RC1+3,3)+MOD(INT((RC1+3)/3),3)*5+3,FALSE) -> 104|132|133|134|162 | L126: 25|22|23|24 | M126: 340577|340578|340578|340578 | N126: 10030|10031|10032|10033|10030|10031|10032|10033|10030|10031|10032|10033|10030|10031|10032|10033|10030|10031|10032|10033|10030|10031|10032|10033|10030|10031|10032|10033|10030|10031|10032|10033|10030|10031|10032|10033|10030|10031|10032|10033 | O126: 1|1|1|1|1|1|1|1|1|1|1|1|1|1|1|1|1|1|1|1|1|1|1|1|1|1|1|1|1|1|1|1|1|1|1|1|1|1|1|1 | P126: 2500|2500|2500|2500|2500|2500|2500|2500|2500|2500|2500|2500|2500|2500|2500|2500|2500|2500|2500|2500|2500|2500|2500|2500|2500|2500|2500|2500|2500|2500|2500|2500|2500|2500|2500|2500|2500|2500|2500|2500
A127: 121 | B127: 119 | C127: 30 | D127: =R[-20]C+2 -> 32 | E127: 1000 | F127: =MOD(RC[-5]-1,3)*30+100&"|"&MOD(RC[-5]-1,3)*30+101&"|"&MOD(RC[-5]-1,3)*30+102&"|"&MOD(RC[-5]-1,3)*30+103&"|"&IF(MOD(RC[-5],4)=0,HLOOKUP(Sheet1!R2C10,Sheet1!R2C10:R7C10,MOD(RC[-5]/4-1,6)+1,FALSE),IF(MOD(RC[-5],2)=0,IF(RC[-5]>20,HLOOKUP(Sheet1!R2C7,Sheet1!R2C7:R43C7,MOD(RC[-5]/2-1,42)+1,FALSE),HLOOKUP(Sheet1!R2C4,Sheet1!R2C4:R7C4,MOD(RC[-5]-1,6)+1,FALSE)),MOD(RC[-5]-1,3)*30+104)) -> 100|101|102|103|104 | G127: =HLOOKUP(Sheet1!R2C1,Sheet1!R2C1:R16C1,MOD(RC1-1,2)+MOD(INT((RC1-1)/2),3)*5+1,FALSE)&"|"&HLOOKUP(Sheet1!R2C1,Sheet1!R2C1:R16C1,MOD(RC1,2)+MOD(INT((RC1)/2),3)*5+1,FALSE)&"|"&HLOOKUP(Sheet1!R2C1,Sheet1!R2C1:R16C1,MOD(RC1+1,2)+MOD(INT((RC1+1)/2),3)*5+1,FALSE)&"|"&HLOOKUP(Sheet1!R2C1,Sheet1!R2C1:R16C1,MOD(RC1+2,2)+MOD(INT((RC1+2)/2),3)*5+1,FALSE)&"|"&HLOOKUP(Sheet1!R2C1,Sheet1!R2C1:R16C1,MOD(RC1+3,2)+MOD(INT((RC1+3)/2),3)*5+1,FALSE) -> 100|101|130|131|160 | H127: =HLOOKUP(Sheet1!R2C1,Sheet1!R2C1:R16C1,MOD(RC1+2,2)+MOD(INT((RC1+2)/2),3)*5+1,FALSE)&"|"&HLOOKUP(Sheet1!R2C1,Sheet1!R2C1:R16C1,MOD(RC1+3,2)+MOD(INT((RC1+3)/2),3)*5+1,FALSE)&"|"&HLOOKUP(Sheet1!R2C1,Sheet1!R2C1:R16C1,MOD(RC1+4,2)+MOD(INT((RC1+4)/2),3)*5+1,FALSE)&"|"&HLOOKUP(Sheet1!R2C1,Sheet1!R2C1:R16C1,MOD(RC1+5,2)+MOD(INT((RC1+5)/2),3)*5+1,FALSE)&"|"&HLOOKUP(Sheet1!R2C1,Sheet1!R2C1:R16C1,MOD(RC1+6,2)+MOD(INT((RC1+6)/2),3)*5+1,FALSE) -> 131|160|161|100|101 | I127: =HLOOKUP(Sheet1!R2C1,Sheet1!R2C1:R16C1,MOD(RC1-1,3)+MOD(INT((RC1-1)/3),3)*5+3,FALSE)&"|"&HLOOKUP(Sheet1!R2C1,Sheet1!R2C1:R16C1,MOD(RC1,3)+MOD(INT((RC1)/3),3)*5+3,FALSE)&"|"&HLOOKUP(Sheet1!R2C1,Sheet1!R2C1:R16C1,MOD(RC1+1,3)+MOD(INT((RC1+1)/3),3)*5+3,FALSE)&"|"&HLOOKUP(Sheet1!R2C1,Sheet1!R2C1:R16C1,MOD(RC1+2,3)+MOD(INT((RC1+2)/3),3)*5+3,FALSE)&"|"&HLOOKUP(Sheet1!R2C1,Sheet1!R2C1:R16C1,MOD(RC1+3,3)+MOD(INT((RC1+3)/3),3)*5+3,FALSE) -> 132|133|134|162|163 | J127: =HLOOKUP(Sheet1!R2C1,Sheet1!R2C1:R16C1,MOD(RC1-1,3)+MOD(INT((RC1-1)/3),3)*5+3,FALSE)&"|"&HLOOKUP(Sheet1!R2C1,Sheet1!R2C1:R16C1,MOD(RC1,3)+MOD(INT((RC1)/3),3)*5+3,FALSE)&"|"&HLOOKUP(Sheet1!R2C1,Sheet1!R2C1:R16C1,MOD(RC1+1,3)+MOD(INT((RC1+1)/3),3)*5+3,FALSE)&"|"&HLOOKUP(Sheet1!R2C1,Sheet1!R2C1:R16C1,MOD(RC1+2,3)+MOD(INT((RC1+2)/3),3)*5+3,FALSE)&"|"&HLOOKUP(Sheet1!R2C1,Sheet1!R2C1:R16C1,MOD(RC1+3,3)+MOD(INT((RC1+3)/3),3)*5+3,FALSE) -> 132|133|134|162|163 | K127: =HLOOKUP(Sheet1!R2C1,Sheet1!R2C1:R16C1,MOD(RC1-1,3)+MOD(INT((RC1-1)/3),3)*5+3,FALSE)&"|"&HLOOKUP(Sheet1!R2C1,Sheet1!R2C1:R16C1,MOD(RC1,3)+MOD(INT((RC1)/3),3)*5+3,FALSE)&"|"&HLOOKUP(Sheet1!R2C1,Sheet1!R2C1:R16C1,MOD(RC1+1,3)+MOD(INT((RC1+1)/3),3)*5+3,FALSE)&"|"&HLOOKUP(Sheet1!R2C1,Sheet1!R2C1:R16C1,MOD(RC1+2,3)+MOD(INT((RC1+2)/3),3)*5+3,FALSE)&"|"&HLOOKUP(Sheet1!R2C1,Sheet1!R2C1:R16C1,MOD(RC1+3,3)+MOD(INT((RC1+3)/3),3)*5+3,FALSE) -> 132|133|134|162|163 | L127: 25|22|23|24 | M127: 347042|347043|347043|347043 | N127: 10030|10031|10032|10033 | O127: 1|1|1|1 | P127: 2500|2500|2500|2500
A128: 122 | B128: 120 | C128: 30 | D128: =R[-20]C+2 -> 32 | E128: 1000 | F128: =MOD(RC[-5]-1,3)*30+100&"|"&MOD(RC[-5]-1,3)*30+101&"|"&MOD(RC[-5]-1,3)*30+102&"|"&MOD(RC[-5]-1,3)*30+103&"|"&IF(MOD(RC[-5],4)=0,HLOOKUP(Sheet1!R2C10,Sheet1!R2C10:R7C10,MOD(RC[-5]/4-1,6)+1,FALSE),IF(MOD(RC[-5],2)=0,IF(RC[-5]>20,HLOOKUP(Sheet1!R2C7,Sheet1!R2C7:R43C7,MOD(RC[-5]/2-1,42)+1,FALSE),HLOOKUP(Sheet1!R2C4,Sheet1!R2C4:R7C4,MOD(RC[-5]-1,6)+1,FALSE)),MOD(RC[-5]-1,3)*30+104)) -> 130|131|132|133|146 | G128: =HLOOKUP(Sheet1!R2C1,Sheet1!R2C1:R16C1,MOD(RC1-1,2)+MOD(INT((RC1-1)/2),3)*5+1,FALSE)&"|"&HLOOKUP(Sheet1!R2C1,Sheet1!R2C1:R16C1,MOD(RC1,2)+MOD(INT((RC1)/2),3)*5+1,FALSE)&"|"&HLOOKUP(Sheet1!R2C1,Sheet1!R2C1:R16C1,MOD(RC1+1,2)+MOD(INT((RC1+1)/2),3)*5+1,FALSE)&"|"&HLOOKUP(Sheet1!R2C1,Sheet1!R2C1:R16C1,MOD(RC1+2,2)+MOD(INT((RC1+2)/2),3)*5+1,FALSE)&"|"&HLOOKUP(Sheet1!R2C1,Sheet1!R2C1:R16C1,MOD(RC1+3,2)+MOD(INT((RC1+3)/2),3)*5+1,FALSE) -> 101|130|131|160|161 | H128: =HLOOKUP(Sheet1!R2C1,Sheet1!R2C1:R16C1,MOD(RC1+2,2)+MOD(INT((RC1+2)/2),3)*5+1,FALSE)&"|"&HLOOKUP(Sheet1!R2C1,Sheet1!R2C1:R16C1,MOD(RC1+3,2)+MOD(INT((RC1+3)/2),3)*5+1,FALSE)&"|"&HLOOKUP(Sheet1!R2C1,Sheet1!R2C1:R16C1,MOD(RC1+4,2)+MOD(INT((RC1+4)/2),3)*5+1,FALSE)&"|"&HLOOKUP(Sheet1!R2C1,Sheet1!R2C1:R16C1,MOD(RC1+5,2)+MOD(INT((RC1+5)/2),3)*5+1,FALSE)&"|"&HLOOKUP(Sheet1!R2C1,Sheet1!R2C1:R16C1,MOD(RC1+6,2)+MOD(INT((RC1+6)/2),3)*5+1,FALSE) -> 160|161|100|101|130 | I128: =HLOOKUP(Sheet1!R2C1,Sheet1!R2C1:R16C1,MOD(RC1-1,3)+MOD(INT((RC1-1)/3),3)*5+3,FALSE)&"|"&HLOOKUP(Sheet1!R2C1,Sheet1!R2C1:R16C1,MOD(RC1,3)+MOD(INT((RC1)/3),3)*5+3,FALSE)&"|"&HLOOKUP(Sheet1!R2C1,Sheet1!R2C1:R16C1,MOD(RC1+1,3)+MOD(INT((RC1+1)/3),3)*5+3,FALSE)&"|"&HLOOKUP(Sheet1!R2C1,Sheet1!R2C1:R16C1,MOD(RC1+2,3)+MOD(INT((RC1+2)/3),3)*5+3,FALSE)&"|"&HLOOKUP(Sheet1!R2C1,Sheet1!R2C1:R16C1,MOD(RC1+3,3)+MOD(INT((RC1+3)/3),3)*5+3,FALSE) -> 133|134|162|163|164 | J128: =HLOOKUP(Sheet1!R2C1,Sheet1!R2C1:R16C1,MOD(RC1-1,3)+MOD(INT((RC1-1)/3),3)*5+3,FALSE)&"|"&HLOOKUP(Sheet1!R2C1,Sheet1!R2C1:R16C1,MOD(RC1,3)+MOD(INT((RC1)/3),3)*5+3,FALSE)&"|"&HLOOKUP(Sheet1!R2C1,Sheet1!R2C1:R16C1,MOD(RC1+1,3)+MOD(INT((RC1+1)/3),3)*5+3,FALSE)&"|"&HLOOKUP(Sheet1!R2C1,Sheet1!R2C1:R16C1,MOD(RC1+2,3)+MOD(INT((RC1+2)/3),3)*5+3,FALSE)&"|"&HLOOKUP(Sheet1!R2C1,Sheet1!R2C1:R16C1,MOD(RC1+3,3)+MOD(INT((RC1+3)/3),3)*5+3,FALSE) -> 133|134|162|163|164 | K128: =HLOOKUP(Sheet1!R2C1,Sheet1!R2C1:R16C1,MOD(RC1-1,3)+MOD(INT((RC1-1)/3),3)*5+3,FALSE)&"|"&HLOOKUP(Sheet1!R2C1,Sheet1!R2C1:R16C1,MOD(RC1,3)+MOD(INT((RC1)/3),3)*5+3,FALSE)&"|"&HLOOKUP(Sheet1!R2C1,Sheet1!R2C1:R16C1,MOD(RC1+1,3)+MOD(INT((RC1+1)/3),3)*5+3,FALSE)&"|"&HLOOKUP(Sheet1!R2C1,Sheet1!R2C1:R16C1,MOD(RC1+2,3)+MOD(INT((RC1+2)/3),3)*5+3,FALSE)&"|"&HLOOKUP(Sheet1!R2C1,Sheet1!R2C1:R16C1,MOD(RC1+3,3)+MOD(INT((RC1+3)/3),3)*5+3,FALSE) -> 133|134|162|163|164 | L128: 25|22|23|24 | M128: 353508|353508|353508|353508 | N128: 10030|10031|10032|10033 | O128: 1|1|1|1 | P128: 2500|2500|2500|2500
A129: 123 | B129: 121 | C129: 30 | D129: =R[-20]C+2 -> 32 | E129: 1000 | F129: =MOD(RC[-5]-1,3)*30+100&"|"&MOD(RC[-5]-1,3)*30+101&"|"&MOD(RC[-5]-1,3)*30+102&"|"&MOD(RC[-5]-1,3)*30+103&"|"&IF(MOD(RC[-5],4)=0,HLOOKUP(Sheet1!R2C10,Sheet1!R2C10:R7C10,MOD(RC[-5]/4-1,6)+1,FALSE),IF(MOD(RC[-5],2)=0,IF(RC[-5]>20,HLOOKUP(Sheet1!R2C7,Sheet1!R2C7:R43C7,MOD(RC[-5]/2-1,42)+1,FALSE),HLOOKUP(Sheet1!R2C4,Sheet1!R2C4:R7C4,MOD(RC[-5]-1,6)+1,FALSE)),MOD(RC[-5]-1,3)*30+104)) -> 160|161|162|163|164 | G129: =HLOOKUP(Sheet1!R2C1,Sheet1!R2C1:R16C1,MOD(RC1-1,2)+MOD(INT((RC1-1)/2),3)*5+1,FALSE)&"|"&HLOOKUP(Sheet1!R2C1,Sheet1!R2C1:R16C1,MOD(RC1,2)+MOD(INT((RC1)/2),3)*5+1,FALSE)&"|"&HLOOKUP(Sheet1!R2C1,Sheet1!R2C1:R16C1,MOD(RC1+1,2)+MOD(INT((RC1+1)/2),3)*5+1,FALSE)&"|"&HLOOKUP(Sheet1!R2C1,Sheet1!R2C1:R16C1,MOD(RC1+2,2)+MOD(INT((RC1+2)/2),3)*5+1,FALSE)&"|"&HLOOKUP(Sheet1!R2C1,Sheet1!R2C1:R16C1,MOD(RC1+3,2)+MOD(INT((RC1+3)/2),3)*5+1,FALSE) -> 130|131|160|161|100 | H129: =HLOOKUP(Sheet1!R2C1,Sheet1!R2C1:R16C1,MOD(RC1+2,2)+MOD(INT((RC1+2)/2),3)*5+1,FALSE)&"|"&HLOOKUP(Sheet1!R2C1,Sheet1!R2C1:R16C1,MOD(RC1+3,2)+MOD(INT((RC1+3)/2),3)*5+1,FALSE)&"|"&HLOOKUP(Sheet1!R2C1,Sheet1!R2C1:R16C1,MOD(RC1+4,2)+MOD(INT((RC1+4)/2),3)*5+1,FALSE)&"|"&HLOOKUP(Sheet1!R2C1,Sheet1!R2C1:R16C1,MOD(RC1+5,2)+MOD(INT((RC1+5)/2),3)*5+1,FALSE)&"|"&HLOOKUP(Sheet1!R2C1,Sheet1!R2C1:R16C1,MOD(RC1+6,2)+MOD(INT((RC1+6)/2),3)*5+1,FALSE) -> 161|100|101|130|131 | I129: =HLOOKUP(Sheet1!R2C1,Sheet1!R2C1:R16C1,MOD(RC1-1,3)+MOD(INT((RC1-1)/3),3)*5+3,FALSE)&"|"&HLOOKUP(Sheet1!R2C1,Sheet1!R2C1:R16C1,MOD(RC1,3)+MOD(INT((RC1)/3),3)*5+3,FALSE)&"|"&HLOOKUP(Sheet1!R2C1,Sheet1!R2C1:R16C1,MOD(RC1+1,3)+MOD(INT((RC1+1)/3),3)*5+3,FALSE)&"|"&HLOOKUP(Sheet1!R2C1,Sheet1!R2C1:R16C1,MOD(RC1+2,3)+MOD(INT((RC1+2)/3),3)*5+3,FALSE)&"|"&HLOOKUP(Sheet1!R2C1,Sheet1!R2C1:R16C1,MOD(RC1+3,3)+MOD(INT((RC1+3)/3),3)*5+3,FALSE) -> 134|162|163|164|102 | J129: =HLOOKUP(Sheet1!R2C1,Sheet1!R2C1:R16C1,MOD(RC1-1,3)+MOD(INT((RC1-1)/3),3)*5+3,FALSE)&"|"&HLOOKUP(Sheet1!R2C1,Sheet1!R2C1:R16C1,MOD(RC1,3)+MOD(INT((RC1)/3),3)*5+3,FALSE)&"|"&HLOOKUP(Sheet1!R2C1,Sheet1!R2C1:R16C1,MOD(RC1+1,3)+MOD(INT((RC1+1)/3),3)*5+3,FALSE)&"|"&HLOOKUP(Sheet1!R2C1,Sheet1!R2C1:R16C1,MOD(RC1+2,3)+MOD(INT((RC1+2)/3),3)*5+3,FALSE)&"|"&HLOOKUP(Sheet1!R2C1,Sheet1!R2C1:R16C1,MOD(RC1+3,3)+MOD(INT((RC1+3)/3),3)*5+3,FALSE) -> 134|162|163|164|102 | K129: =HLOOKUP(Sheet1!R2C1,Sheet1!R2C1:R16C1,MOD(RC1-1,3)+MOD(INT((RC1-1)/3),3)*5+3,FALSE)&"|"&HLOOKUP(Sheet1!R2C1,Sheet1!R2C1:R16C1,MOD(RC1,3)+MOD(INT((RC1)/3),3)*5+3,FALSE)&"|"&HLOOKUP(Sheet1!R2C1,Sheet1!R2C1:R16C1,MOD(RC1+1,3)+MOD(INT((RC1+1)/3),3)*5+3,FALSE)&"|"&HLOOKUP(Sheet1!R2C1,Sheet1!R2C1:R16C1,MOD(RC1+2,3)+MOD(INT((RC1+2)/3),3)*5+3,FALSE)&"|"&HLOOKUP(Sheet1!R2C1,Sheet1!R2C1:R16C1,MOD(RC1+3,3)+MOD(INT((RC1+3)/3),3)*5+3,FALSE) -> 134|162|163|164|102 | L129: 25|22|23|24 | M129: 359765|359765|359765|359765 | N129: 10030|10031|10032|10033 | O129: 1|1|1|1 | P129: 2500|2500|2500|2500
A130: 124 | B130: 122 | C130: 30 | D130: =R[-20]C+2 -> 32 | E130: 1000 | F130: =MOD(RC[-5]-1,3)*30+100&"|"&MOD(RC[-5]-1,3)*30+101&"|"&MOD(RC[-5]-1,3)*30+102&"|"&MOD(RC[-5]-1,3)*30+103&"|"&IF(MOD(RC[-5],4)=0,HLOOKUP(Sheet1!R2C10,Sheet1!R2C10:R7C10,MOD(RC[-5]/4-1,6)+1,FALSE),IF(MOD(RC[-5],2)=0,IF(RC[-5]>20,HLOOKUP(Sheet1!R2C7,Sheet1!R2C7:R43C7,MOD(RC[-5]/2-1,42)+1,FALSE),HLOOKUP(Sheet1!R2C4,Sheet1!R2C4:R7C4,MOD(RC[-5]-1,6)+1,FALSE)),MOD(RC[-5]-1,3)*30+104)) -> 100|101|102|103|190 | G130: =HLOOKUP(Sheet1!R2C1,Sheet1!R2C1:R16C1,MOD(RC1-1,2)+MOD(INT((RC1-1)/2),3)*5+1,FALSE)&"|"&HLOOKUP(Sheet1!R2C1,Sheet1!R2C1:R16C1,MOD(RC1,2)+MOD(INT((RC1)/2),3)*5+1,FALSE)&"|"&HLOOKUP(Sheet1!R2C1,Sheet1!R2C1:R16C1,MOD(RC1+1,2)+MOD(INT((RC1+1)/2),3)*5+1,FALSE)&"|"&HLOOKUP(Sheet1!R2C1,Sheet1!R2C1:R16C1,MOD(RC1+2,2)+MOD(INT((RC1+2)/2),3)*5+1,FALSE)&"|"&HLOOKUP(Sheet1!R2C1,Sheet1!R2C1:R16C1,MOD(RC1+3,2)+MOD(INT((RC1+3)/2),3)*5+1,FALSE) -> 131|160|161|100|101 | H130: =HLOOKUP(Sheet1!R2C1,Sheet1!R2C1:R16C1,MOD(RC1+2,2)+MOD(INT((RC1+2)/2),3)*5+1,FALSE)&"|"&HLOOKUP(Sheet1!R2C1,Sheet1!R2C1:R16C1,MOD(RC1+3,2)+MOD(INT((RC1+3)/2),3)*5+1,FALSE)&"|"&HLOOKUP(Sheet1!R2C1,Sheet1!R2C1:R16C1,MOD(RC1+4,2)+MOD(INT((RC1+4)/2),3)*5+1,FALSE)&"|"&HLOOKUP(Sheet1!R2C1,Sheet1!R2C1:R16C1,MOD(RC1+5,2)+MOD(INT((RC1+5)/2),3)*5+1,FALSE)&"|"&HLOOKUP(Sheet1!R2C1,Sheet1!R2C1:R16C1,MOD(RC1+6,2)+MOD(INT((RC1+6)/2),3)*5+1,FALSE) -> 100|101|130|131|160 | I130: =HLOOKUP(Sheet1!R2C1,Sheet1!R2C1:R16C1,MOD(RC1-1,3)+MOD(INT((RC1-1)/3),3)*5+3,FALSE)&"|"&HLOOKUP(Sheet1!R2C1,Sheet1!R2C1:R16C1,MOD(RC1,3)+MOD(INT((RC1)/3),3)*5+3,FALSE)&"|"&HLOOKUP(Sheet1!R2C1,Sheet1!R2C1:R16C1,MOD(RC1+1,3)+MOD(INT((RC1+1)/3),3)*5+3,FALSE)&"|"&HLOOKUP(Sheet1!R2C1,Sheet1!R2C1:R16C1,MOD(RC1+2,3)+MOD(INT((RC1+2)/3),3)*5+3,FALSE)&"|"&HLOOKUP(Sheet1!R2C1,Sheet1!R2C1:R16C1,MOD(RC1+3,3)+MOD(INT((RC1+3)/3),3)*5+3,FALSE) -> 162|163|164|102|103 | J130: =HLOOKUP(Sheet1!R2C1,Sheet1!R2C1:R16C1,MOD(RC1-1,3)+MOD(INT((RC1-1)/3),3)*5+3,FALSE)&"|"&HLOOKUP(Sheet1!R2C1,Sheet1!R2C1:R16C1,MOD(RC1,3)+MOD(INT((RC1)/3),3)*5+3,FALSE)&"|"&HLOOKUP(Sheet1!R2C1,Sheet1!R2C1:R16C1,MOD(RC1+1,3)+MOD(INT((RC1+1)/3),3)*5+3,FALSE)&"|"&HLOOKUP(Sheet1!R2C1,Sheet1!R2C1:R16C1,MOD(RC1+2,3)+MOD(INT((RC1+2)/3),3)*5+3,FALSE)&"|"&HLOOKUP(Sheet1!R2C1,Sheet1!R2C1:R16C1,MOD(RC1+3,3)+MOD(INT((RC1+3)/3),3)*5+3,FALSE) -> 162|163|164|102|103 | K130: =HLOOKUP(Sheet1!R2C1,Sheet1!R2C1:R16C1,MOD(RC1-1,3)+MOD(INT((RC1-1)/3),3)*5+3,FALSE)&"|"&HLOOKUP(Sheet1!R2C1,Sheet1!R2C1:R16C1,MOD(RC1,3)+MOD(INT((RC1)/3),3)*5+3,FALSE)&"|"&HLOOKUP(Sheet1!R2C1,Sheet1!R2C1:R16C1,MOD(RC1+1,3)+MOD(INT((RC1+1)/3),3)*5+3,FALSE)&"|"&HLOOKUP(Sheet1!R2C1,Sheet1!R2C1:R16C1,MOD(RC1+2,3)+MOD(INT((RC1+2)/3),3)*5+3,FALSE)&"|"&HLOOKUP(Sheet1!R2C1,Sheet1!R2C1:R16C1,MOD(RC1+3,3)+MOD(INT((RC1+3)/3),3)*5+3,FALSE) -> 162|163|164|102|103 | L130: 25|22|23|24 | M130: 365833|365833|365833|365833 | N130: 10030|10031|10032|10033 | O130: 1|1|1|1 | P130: 2500|2500|2500|2500
A131: 125 | B131: 123 | C131: 30 | D131: =R[-20]C+2 -> 32 | E131: 1000 | F131: =MOD(RC[-5]-1,3)*30+100&"|"&MOD(RC[-5]-1,3)*30+101&"|"&MOD(RC[-5]-1,3)*30+102&"|"&MOD(RC[-5]-1,3)*30+103&"|"&IF(MOD(RC[-5],4)=0,HLOOKUP(Sheet1!R2C10,Sheet1!R2C10:R7C10,MOD(RC[-5]/4-1,6)+1,FALSE),IF(MOD(RC[-5],2)=0,IF(RC[-5]>20,HLOOKUP(Sheet1!R2C7,Sheet1!R2C7:R43C7,MOD(RC[-5]/2-1,42)+1,FALSE),HLOOKUP(Sheet1!R2C4,Sheet1!R2C4:R7C4,MOD(RC[-5]-1,6)+1,FALSE)),MOD(RC[-5]-1,3)*30+104)) -> 130|131|132|133|134 | G131: =HLOOKUP(Sheet1!R2C1,Sheet1!R2C1:R16C1,MOD(RC1-1,2)+MOD(INT((RC1-1)/2),3)*5+1,FALSE)&"|"&HLOOKUP(Sheet1!R2C1,Sheet1!R2C1:R16C1,MOD(RC1,2)+MOD(INT((RC1)/2),3)*5+1,FALSE)&"|"&HLOOKUP(Sheet1!R2C1,Sheet1!R2C1:R16C1,MOD(RC1+1,2)+MOD(INT((RC1+1)/2),3)*5+1,FALSE)&"|"&HLOOKUP(Sheet1!R2C1,Sheet1!R2C1:R16C1,MOD(RC1+2,2)+MOD(INT((RC1+2)/2),3)*5+1,FALSE)&"|"&HLOOKUP(Sheet1!R2C1,Sheet1!R2C1:R16C1,MOD(RC1+3,2)+MOD(INT((RC1+3)/2),3)*5+1,FALSE) -> 160|161|100|101|130 | H131: =HLOOKUP(Sheet1!R2C1,Sheet1!R2C1:R16C1,MOD(RC1+2,2)+MOD(INT((RC1+2)/2),3)*5+1,FALSE)&"|"&HLOOKUP(Sheet1!R2C1,Sheet1!R2C1:R16C1,MOD(RC1+3,2)+MOD(INT((RC1+3)/2),3)*5+1,FALSE)&"|"&HLOOKUP(Sheet1!R2C1,Sheet1!R2C1:R16C1,MOD(RC1+4,2)+MOD(INT((RC1+4)/2),3)*5+1,FALSE)&"|"&HLOOKUP(Sheet1!R2C1,Sheet1!R2C1:R16C1,MOD(RC1+5,2)+MOD(INT((RC1+5)/2),3)*5+1,FALSE)&"|"&HLOOKUP(Sheet1!R2C1,Sheet1!R2C1:R16C1,MOD(RC1+6,2)+MOD(INT((RC1+6)/2),3)*5+1,FALSE) -> 101|130|131|160|161 | I131: =HLOOKUP(Sheet1!R2C1,Sheet1!R2C1:R16C1,MOD(RC1-1,3)+MOD(INT((RC1-1)/3),3)*5+3,FALSE)&"|"&HLOOKUP(Sheet1!R2C1,Sheet1!R2C1:R16C1,MOD(RC1,3)+MOD(INT((RC1)/3),3)*5+3,FALSE)&"|"&HLOOKUP(Sheet1!R2C1,Sheet1!R2C1:R16C1,MOD(RC1+1,3)+MOD(INT((RC1+1)/3),3)*5+3,FALSE)&"|"&HLOOKUP(Sheet1!R2C1,Sheet1!R2C1:R16C1,MOD(RC1+2,3)+MOD(INT((RC1+2)/3),3)*5+3,FALSE)&"|"&HLOOKUP(Sheet1!R2C1,Sheet1!R2C1:R16C1,MOD(RC1+3,3)+MOD(INT((RC1+3)/3),3)*5+3,FALSE) -> 163|164|102|103|104 | J131: =HLOOKUP(Sheet1!R2C1,Sheet1!R2C1:R16C1,MOD(RC1-1,3)+MOD(INT((RC1-1)/3),3)*5+3,FALSE)&"|"&HLOOKUP(Sheet1!R2C1,Sheet1!R2C1:R16C1,MOD(RC1,3)+MOD(INT((RC1)/3),3)*5+3,FALSE)&"|"&HLOOKUP(Sheet1!R2C1,Sheet1!R2C1:R16C1,MOD(RC1+1,3)+MOD(INT((RC1+1)/3),3)*5+3,FALSE)&"|"&HLOOKUP(Sheet1!R2C1,Sheet1!R2C1:R16C1,MOD(RC1+2,3)+MOD(INT((RC1+2)/3),3)*5+3,FALSE)&"|"&HLOOKUP(Sheet1!R2C1,Sheet1!R2C1:R16C1,MOD(RC1+3,3)+MOD(INT((RC1+3)/3),3)*5+3,FALSE) -> 163|164|102|103|104 | K131: =HLOOKUP(Sheet1!R2C1,Sheet1!R2C1:R16C1,MOD(RC1-1,3)+MOD(INT((RC1-1)/3),3)*5+3,FALSE)&"|"&HLOOKUP(Sheet1!R2C1,Sheet1!R2C1:R16C1,MOD(RC1,3)+MOD(INT((RC1)/3),3)*5+3,FALSE)&"|"&HLOOKUP(Sheet1!R2C1,Sheet1!R2C1:R16C1,MOD(RC1+1,3)+MOD(INT((RC1+1)/3),3)*5+3,FALSE)&"|"&HLOOKUP(Sheet1!R2C1,Sheet1!R2C1:R16C1,MOD(RC1+2,3)+MOD(INT((RC1+2)/3),3)*5+3,FALSE)&"|"&HLOOKUP(Sheet1!R2C1,Sheet1!R2C1:R16C1,MOD(RC1+3,3)+MOD(INT((RC1+3)/3),3)*5+3,FALSE) -> 163|164|102|103|104 | L131: 25|22|23|24 | M131: 371679|371679|371678|371678 | N131: 10030|10031|10032|10033|10030|10031|10032|10033|10030|10031|10032|10033|10030|10031|10032|10033|10030|10031|10032|10033|10030|10031|10032|10033|10030|10031|10032|10033|10030|10031|10032|10033|10030|10031|10032|10033|10030|10031|10032|10033 | O131: 1|1|1|1|1|1|1|1|1|1|1|1|1|1|1|1|1|1|1|1|1|1|1|1|1|1|1|1|1|1|1|1|1|1|1|1|1|1|1|1 | P131: 2500|2500|2500|2500|2500|2500|2500|2500|2500|2500|2500|2500|2500|2500|2500|2500|2500|2500|2500|2500|2500|2500|2500|2500|2500|2500|2500|2500|2500|2500|2500|2500|2500|2500|2500|2500|2500|2500|2500|2500
A132: 126 | B132: 124 | C132: 30 | D132: =R[-20]C+2 -> 32 | E132: 1000 | F132: =MOD(RC[-5]-1,3)*30+100&"|"&MOD(RC[-5]-1,3)*30+101&"|"&MOD(RC[-5]-1,3)*30+102&"|"&MOD(RC[-5]-1,3)*30+103&"|"&IF(MOD(RC[-5],4)=0,HLOOKUP(Sheet1!R2C10,Sheet1!R2C10:R7C10,MOD(RC[-5]/4-1,6)+1,FALSE),IF(MOD(RC[-5],2)=0,IF(RC[-5]>20,HLOOKUP(Sheet1!R2C7,Sheet1!R2C7:R43C7,MOD(RC[-5]/2-1,42)+1,FALSE),HLOOKUP(Sheet1!R2C4,Sheet1!R2C4:R7C4,MOD(RC[-5]-1,6)+1,FALSE)),MOD(RC[-5]-1,3)*30+104)) -> 160|161|162|163|148 | G132: =HLOOKUP(Sheet1!R2C1,Sheet1!R2C1:R16C1,MOD(RC1-1,2)+MOD(INT((RC1-1)/2),3)*5+1,FALSE)&"|"&HLOOKUP(Sheet1!R2C1,Sheet1!R2C1:R16C1,MOD(RC1,2)+MOD(INT((RC1)/2),3)*5+1,FALSE)&"|"&HLOOKUP(Sheet1!R2C1,Sheet1!R2C1:R16C1,MOD(RC1+1,2)+MOD(INT((RC1+1)/2),3)*5+1,FALSE)&"|"&HLOOKUP(Sheet1!R2C1,Sheet1!R2C1:R16C1,MOD(RC1+2,2)+MOD(INT((RC1+2)/2),3)*5+1,FALSE)&"|"&HLOOKUP(Sheet1!R2C1,Sheet1!R2C1:R16C1,MOD(RC1+3,2)+MOD(INT((RC1+3)/2),3)*5+1,FALSE) -> 161|100|101|130|131 | H132: =HLOOKUP(Sheet1!R2C1,Sheet1!R2C1:R16C1,MOD(RC1+2,2)+MOD(INT((RC1+2)/2),3)*5+1,FALSE)&"|"&HLOOKUP(Sheet1!R2C1,Sheet1!R2C1:R16C1,MOD(RC1+3,2)+MOD(INT((RC1+3)/2),3)*5+1,FALSE)&"|"&HLOOKUP(Sheet1!R2C1,Sheet1!R2C1:R16C1,MOD(RC1+4,2)+MOD(INT((RC1+4)/2),3)*5+1,FALSE)&"|"&HLOOKUP(Sheet1!R2C1,Sheet1!R2C1:R16C1,MOD(RC1+5,2)+MOD(INT((RC1+5)/2),3)*5+1,FALSE)&"|"&HLOOKUP(Sheet1!R2C1,Sheet1!R2C1:R16C1,MOD(RC1+6,2)+MOD(INT((RC1+6)/2),3)*5+1,FALSE) -> 130|131|160|161|100 | I132: =HLOOKUP(Sheet1!R2C1,Sheet1!R2C1:R16C1,MOD(RC1-1,3)+MOD(INT((RC1-1)/3),3)*5+3,FALSE)&"|"&HLOOKUP(Sheet1!R2C1,Sheet1!R2C1:R16C1,MOD(RC1,3)+MOD(INT((RC1)/3),3)*5+3,FALSE)&"|"&HLOOKUP(Sheet1!R2C1,Sheet1!R2C1:R16C1,MOD(RC1+1,3)+MOD(INT((RC1+1)/3),3)*5+3,FALSE)&"|"&HLOOKUP(Sheet1!R2C1,Sheet1!R2C1:R16C1,MOD(RC1+2,3)+MOD(INT((RC1+2)/3),3)*5+3,FALSE)&"|"&HLOOKUP(Sheet1!R2C1,Sheet1!R2C1:R16C1,MOD(RC1+3,3)+MOD(INT((RC1+3)/3),3)*5+3,FALSE) -> 164|102|103|104|132 | J132: =HLOOKUP(Sheet1!R2C1,Sheet1!R2C1:R16C1,MOD(RC1-1,3)+MOD(INT((RC1-1)/3),3)*5+3,FALSE)&"|"&HLOOKUP(Sheet1!R2C1,Sheet1!R2C1:R16C1,MOD(RC1,3)+MOD(INT((RC1)/3),3)*5+3,FALSE)&"|"&HLOOKUP(Sheet1!R2C1,Sheet1!R2C1:R16C1,MOD(RC1+1,3)+MOD(INT((RC1+1)/3),3)*5+3,FALSE)&"|"&HLOOKUP(Sheet1!R2C1,Sheet1!R2C1:R16C1,MOD(RC1+2,3)+MOD(INT((RC1+2)/3),3)*5+3,FALSE)&"|"&HLOOKUP(Sheet1!R2C1,Sheet1!R2C1:R16C1,MOD(RC1+3,3)+MOD(INT((RC1+3)/3),3)*5+3,FALSE) -> 164|102|103|104|132 | K132: =HLOOKUP(Sheet1!R2C1,Sheet1!R2C1:R16C1,MOD(RC1-1,3)+MOD(INT((RC1-1)/3),3)*5+3,FALSE)&"|"&HLOOKUP(Sheet1!R2C1,Sheet1!R2C1:R16C1,MOD(RC1,3)+MOD(INT((RC1)/3),3)*5+3,FALSE)&"|"&HLOOKUP(Sheet1!R2C1,Sheet1!R2C1:R16C1,MOD(RC1+1,3)+MOD(INT((RC1+1)/3),3)*5+3,FALSE)&"|"&HLOOKUP(Sheet1!R2C1,Sheet1!R2C1:R16C1,MOD(RC1+2,3)+MOD(INT((RC1+2)/3),3)*5+3,FALSE)&"|"&HLOOKUP(Sheet1!R2C1,Sheet1!R2C1:R16C1,MOD(RC1+3,3)+MOD(INT((RC1+3)/3),3)*5+3,FALSE) -> 164|102|103|104|132 | L132: 25|22|23|24 | M132: 377719|377720|377720|377720 | N132: 10030|10031|10032|10033 | O132: 1|1|1|1 | P132: 2500|2500|2500|2500
A133: 127 | B133: 125 | C133: 30 | D133: =R[-20]C+2 -> 32 | E133: 1000 | F133: =MOD(RC[-5]-1,3)*30+100&"|"&MOD(RC[-5]-1,3)*30+101&"|"&MOD(RC[-5]-1,3)*30+102&"|"&MOD(RC[-5]-1,3)*30+103&"|"&IF(MOD(RC[-5],4)=0,HLOOKUP(Sheet1!R2C10,Sheet1!R2C10:R7C10,MOD(RC[-5]/4-1,6)+1,FALSE),IF(MOD(RC[-5],2)=0,IF(RC[-5]>20,HLOOKUP(Sheet1!R2C7,Sheet1!R2C7:R43C7,MOD(RC[-5]/2-1,42)+1,FALSE),HLOOKUP(Sheet1!R2C4,Sheet1!R2C4:R7C4,MOD(RC[-5]-1,6)+1,FALSE)),MOD(RC[-5]-1,3)*30+104)) -> 100|101|102|103|104 | G133: =HLOOKUP(Sheet1!R2C1,Sheet1!R2C1:R16C1,MOD(RC1-1,2)+MOD(INT((RC1-1)/2),3)*5+1,FALSE)&"|"&HLOOKUP(Sheet1!R2C1,Sheet1!R2C1:R16C1,MOD(RC1,2)+MOD(INT((RC1)/2),3)*5+1,FALSE)&"|"&HLOOKUP(Sheet1!R2C1,Sheet1!R2C1:R16C1,MOD(RC1+1,2)+MOD(INT((RC1+1)/2),3)*5+1,FALSE)&"|"&HLOOKUP(Sheet1!R2C1,Sheet1!R2C1:R16C1,MOD(RC1+2,2)+MOD(INT((RC1+2)/2),3)*5+1,FALSE)&"|"&HLOOKUP(Sheet1!R2C1,Sheet1!R2C1:R16C1,MOD(RC1+3,2)+MOD(INT((RC1+3)/2),3)*5+1,FALSE) -> 100|101|130|131|160 | H133: =HLOOKUP(Sheet1!R2C1,Sheet1!R2C1:R16C1,MOD(RC1+2,2)+MOD(INT((RC1+2)/2),3)*5+1,FALSE)&"|"&HLOOKUP(Sheet1!R2C1,Sheet1!R2C1:R16C1,MOD(RC1+3,2)+MOD(INT((RC1+3)/2),3)*5+1,FALSE)&"|"&HLOOKUP(Sheet1!R2C1,Sheet1!R2C1:R16C1,MOD(RC1+4,2)+MOD(INT((RC1+4)/2),3)*5+1,FALSE)&"|"&HLOOKUP(Sheet1!R2C1,Sheet1!R2C1:R16C1,MOD(RC1+5,2)+MOD(INT((RC1+5)/2),3)*5+1,FALSE)&"|"&HLOOKUP(Sheet1!R2C1,Sheet1!R2C1:R16C1,MOD(RC1+6,2)+MOD(INT((RC1+6)/2),3)*5+1,FALSE) -> 131|160|161|100|101 | I133: =HLOOKUP(Sheet1!R2C1,Sheet1!R2C1:R16C1,MOD(RC1-1,3)+MOD(INT((RC1-1)/3),3)*5+3,FALSE)&"|"&HLOOKUP(Sheet1!R2C1,Sheet1!R2C1:R16C1,MOD(RC1,3)+MOD(INT((RC1)/3),3)*5+3,FALSE)&"|"&HLOOKUP(Sheet1!R2C1,Sheet1!R2C1:R16C1,MOD(RC1+1,3)+MOD(INT((RC1+1)/3),3)*5+3,FALSE)&"|"&HLOOKUP(Sheet1!R2C1,Sheet1!R2C1:R16C1,MOD(RC1+2,3)+MOD(INT((RC1+2)/3),3)*5+3,FALSE)&"|"&HLOOKUP(Sheet1!R2C1,Sheet1!R2C1:R16C1,MOD(RC1+3,3)+MOD(INT((RC1+3)/3),3)*5+3,FALSE) -> 102|103|104|132|133 | J133: =HLOOKUP(Sheet1!R2C1,Sheet1!R2C1:R16C1,MOD(RC1-1,3)+MOD(INT((RC1-1)/3),3)*5+3,FALSE)&"|"&HLOOKUP(Sheet1!R2C1,Sheet1!R2C1:R16C1,MOD(RC1,3)+MOD(INT((RC1)/3),3)*5+3,FALSE)&"|"&HLOOKUP(Sheet1!R2C1,Sheet1!R2C1:R16C1,MOD(RC1+1,3)+MOD(INT((RC1+1)/3),3)*5+3,FALSE)&"|"&HLOOKUP(Sheet1!R2C1,Sheet1!R2C1:R16C1,MOD(RC1+2,3)+MOD(INT((RC1+2)/3),3)*5+3,FALSE)&"|"&HLOOKUP(Sheet1!R2C1,Sheet1!R2C1:R16C1,MOD(RC1+3,3)+MOD(INT((RC1+3)/3),3)*5+3,FALSE) -> 102|103|104|132|133 | K133: =HLOOKUP(Sheet1!R2C1,Sheet1!R2C1:R16C1,MOD(RC1-1,3)+MOD(INT((RC1-1)/3),3)*5+3,FALSE)&"|"&HLOOKUP(Sheet1!R2C1,Sheet1!R2C1:R16C1,MOD(RC1,3)+MOD(INT((RC1)/3),3)*5+3,FALSE)&"|"&HLOOKUP(Sheet1!R2C1,Sheet1!R2C1:R16C1,MOD(RC1+1,3)+MOD(INT((RC1+1)/3),3)*5+3,FALSE)&"|"&HLOOKUP(Sheet1!R2C1,Sheet1!R2C1:R16C1,MOD(RC1+2,3)+MOD(INT((RC1+2)/3),3)*5+3,FALSE)&"|"&HLOOKUP(Sheet1!R2C1,Sheet1!R2C1:R16C1,MOD(RC1+3,3)+MOD(INT((RC1+3)/3),3)*5+3,FALSE) -> 102|103|104|132|133 | L133: 25|22|23|24 | M133: 383322|383323|383323|383323 | N133: 10030|10031|10032|10033 | O133: 1|1|1|1 | P133: 2500|2500|2500|2500
A134: 128 | B134: 126 | C134: 30 | D134: =R[-20]C+2 -> 32 | E134: 1000 | F134: =MOD(RC[-5]-1,3)*30+100&"|"&MOD(RC[-5]-1,3)*30+101&"|"&MOD(RC[-5]-1,3)*30+102&"|"&MOD(RC[-5]-1,3)*30+103&"|"&IF(MOD(RC[-5],4)=0,HLOOKUP(Sheet1!R2C10,Sheet1!R2C10:R7C10,MOD(RC[-5]/4-1,6)+1,FALSE),IF(MOD(RC[-5],2)=0,IF(RC[-5]>20,HLOOKUP(Sheet1!R2C7,Sheet1!R2C7:R43C7,MOD(RC[-5]/2-1,42)+1,FALSE),HLOOKUP(Sheet1!R2C4,Sheet1!R2C4:R7C4,MOD(RC[-5]-1,6)+1,FALSE)),MOD(RC[-5]-1,3)*30+104)) -> 130|131|132|133|191 | G134: =HLOOKUP(Sheet1!R2C1,Sheet1!R2C1:R16C1,MOD(RC1-1,2)+MOD(INT((RC1-1)/2),3)*5+1,FALSE)&"|"&HLOOKUP(Sheet1!R2C1,Sheet1!R2C1:R16C1,MOD(RC1,2)+MOD(INT((RC1)/2),3)*5+1,FALSE)&"|"&HLOOKUP(Sheet1!R2C1,Sheet1!R2C1:R16C1,MOD(RC1+1,2)+MOD(INT((RC1+1)/2),3)*5+1,FALSE)&"|"&HLOOKUP(Sheet1!R2C1,Sheet1!R2C1:R16C1,MOD(RC1+2,2)+MOD(INT((RC1+2)/2),3)*5+1,FALSE)&"|"&HLOOKUP(Sheet1!R2C1,Sheet1!R2C1:R16C1,MOD(RC1+3,2)+MOD(INT((RC1+3)/2),3)*5+1,FALSE) -> 101|130|131|160|161 | H134: =HLOOKUP(Sheet1!R2C1,Sheet1!R2C1:R16C1,MOD(RC1+2,2)+MOD(INT((RC1+2)/2),3)*5+1,FALSE)&"|"&HLOOKUP(Sheet1!R2C1,Sheet1!R2C1:R16C1,MOD(RC1+3,2)+MOD(INT((RC1+3)/2),3)*5+1,FALSE)&"|"&HLOOKUP(Sheet1!R2C1,Sheet1!R2C1:R16C1,MOD(RC1+4,2)+MOD(INT((RC1+4)/2),3)*5+1,FALSE)&"|"&HLOOKUP(Sheet1!R2C1,Sheet1!R2C1:R16C1,MOD(RC1+5,2)+MOD(INT((RC1+5)/2),3)*5+1,FALSE)&"|"&HLOOKUP(Sheet1!R2C1,Sheet1!R2C1:R16C1,MOD(RC1+6,2)+MOD(INT((RC1+6)/2),3)*5+1,FALSE) -> 160|161|100|101|130 | I134: =HLOOKUP(Sheet1!R2C1,Sheet1!R2C1:R16C1,MOD(RC1-1,3)+MOD(INT((RC1-1)/3),3)*5+3,FALSE)&"|"&HLOOKUP(Sheet1!R2C1,Sheet1!R2C1:R16C1,MOD(RC1,3)+MOD(INT((RC1)/3),3)*5+3,FALSE)&"|"&HLOOKUP(Sheet1!R2C1,Sheet1!R2C1:R16C1,MOD(RC1+1,3)+MOD(INT((RC1+1)/3),3)*5+3,FALSE)&"|"&HLOOKUP(Sheet1!R2C1,Sheet1!R2C1:R16C1,MOD(RC1+2,3)+MOD(INT((RC1+2)/3),3)*5+3,FALSE)&"|"&HLOOKUP(Sheet1!R2C1,Sheet1!R2C1:R16C1,MOD(RC1+3,3)+MOD(INT((RC1+3)/3),3)*5+3,FALSE) -> 103|104|132|133|134 | J134: =HLOOKUP(Sheet1!R2C1,Sheet1!R2C1:R16C1,MOD(RC1-1,3)+MOD(INT((RC1-1)/3),3)*5+3,FALSE)&"|"&HLOOKUP(Sheet1!R2C1,Sheet1!R2C1:R16C1,MOD(RC1,3)+MOD(INT((RC1)/3),3)*5+3,FALSE)&"|"&HLOOKUP(Sheet1!R2C1,Sheet1!R2C1:R16C1,MOD(RC1+1,3)+MOD(INT((RC1+1)/3),3)*5+3,FALSE)&"|"&HLOOKUP(Sheet1!R2C1,Sheet1!R2C1:R16C1,MOD(RC1+2,3)+MOD(INT((RC1+2)/3),3)*5+3,FALSE)&"|"&HLOOKUP(Sheet1!R2C1,Sheet1!R2C1:R16C1,MOD(RC1+3,3)+MOD(INT((RC1+3)/3),3)*5+3,FALSE) -> 103|104|132|133|134 | K134: =HLOOKUP(Sheet1!R2C1,Sheet1!R2C1:R16C1,MOD(RC1-1,3)+MOD(INT((RC1-1)/3),3)*5+3,FALSE)&"|"&HLOOKUP(Sheet1!R2C1,Sheet1!R2C1:R16C1,MOD(RC1,3)+MOD(INT((RC1)/3),3)*5+3,FALSE)&"|"&HLOOKUP(Sheet1!R2C1,Sheet1!R2C1:R16C1,MOD(RC1+1,3)+MOD(INT((RC1+1)/3),3)*5+3,FALSE)&"|"&HLOOKUP(Sheet1!R2C1,Sheet1!R2C1:R16C1,MOD(RC1+2,3)+MOD(INT((RC1+2)/3),3)*5+3,FALSE)&"|"&HLOOKUP(Sheet1!R2C1,Sheet1!R2C1:R16C1,MOD(RC1+3,3)+MOD(INT((RC1+3)/3),3)*5+3,FALSE) -> 103|104|132|133|134 | L134: 25|22|23|24 | M134: 388803|388803|388803|388803 | N134: 10030|10031|10032|10033 | O134: 1|1|1|1 | P134: 2500|2500|2500|2500
A135: 129 | B135: 127 | C135: 30 | D135: =R[-20]C+2 -> 32 | E135: 1000 | F135: =MOD(RC[-5]-1,3)*30+100&"|"&MOD(RC[-5]-1,3)*30+101&"|"&MOD(RC[-5]-1,3)*30+102&"|"&MOD(RC[-5]-1,3)*30+103&"|"&IF(MOD(RC[-5],4)=0,HLOOKUP(Sheet1!R2C10,Sheet1!R2C10:R7C10,MOD(RC[-5]/4-1,6)+1,FALSE),IF(MOD(RC[-5],2)=0,IF(RC[-5]>20,HLOOKUP(Sheet1!R2C7,Sheet1!R2C7:R43C7,MOD(RC[-5]/2-1,42)+1,FALSE),HLOOKUP(Sheet1!R2C4,Sheet1!R2C4:R7C4,MOD(RC[-5]-1,6)+1,FALSE)),MOD(RC[-5]-1,3)*30+104)) -> 160|161|162|163|164 | G135: =HLOOKUP(Sheet1!R2C1,Sheet1!R2C1:R16C1,MOD(RC1-1,2)+MOD(INT((RC1-1)/2),3)*5+1,FALSE)&"|"&HLOOKUP(Sheet1!R2C1,Sheet1!R2C1:R16C1,MOD(RC1,2)+MOD(INT((RC1)/2),3)*5+1,FALSE)&"|"&HLOOKUP(Sheet1!R2C1,Sheet1!R2C1:R16C1,MOD(RC1+1,2)+MOD(INT((RC1+1)/2),3)*5+1,FALSE)&"|"&HLOOKUP(Sheet1!R2C1,Sheet1!R2C1:R16C1,MOD(RC1+2,2)+MOD(INT((RC1+2)/2),3)*5+1,FALSE)&"|"&HLOOKUP(Sheet1!R2C1,Sheet1!R2C1:R16C1,MOD(RC1+3,2)+MOD(INT((RC1+3)/2),3)*5+1,FALSE) -> 130|131|160|161|100 | H135: =HLOOKUP(Sheet1!R2C1,Sheet1!R2C1:R16C1,MOD(RC1+2,2)+MOD(INT((RC1+2)/2),3)*5+1,FALSE)&"|"&HLOOKUP(Sheet1!R2C1,Sheet1!R2C1:R16C1,MOD(RC1+3,2)+MOD(INT((RC1+3)/2),3)*5+1,FALSE)&"|"&HLOOKUP(Sheet1!R2C1,Sheet1!R2C1:R16C1,MOD(RC1+4,2)+MOD(INT((RC1+4)/2),3)*5+1,FALSE)&"|"&HLOOKUP(Sheet1!R2C1,Sheet1!R2C1:R16C1,MOD(RC1+5,2)+MOD(INT((RC1+5)/2),3)*5+1,FALSE)&"|"&HLOOKUP(Sheet1!R2C1,Sheet1!R2C1:R16C1,MOD(RC1+6,2)+MOD(INT((RC1+6)/2),3)*5+1,FALSE) -> 161|100|101|130|131 | I135: =HLOOKUP(Sheet1!R2C1,Sheet1!R2C1:R16C1,MOD(RC1-1,3)+MOD(INT((RC1-1)/3),3)*5+3,FALSE)&"|"&HLOOKUP(Sheet1!R2C1,Sheet1!R2C1:R16C1,MOD(RC1,3)+MOD(INT((RC1)/3),3)*5+3,FALSE)&"|"&HLOOKUP(Sheet1!R2C1,Sheet1!R2C1:R16C1,MOD(RC1+1,3)+MOD(INT((RC1+1)/3),3)*5+3,FALSE)&"|"&HLOOKUP(Sheet1!R2C1,Sheet1!R2C1:R16C1,MOD(RC1+2,3)+MOD(INT((RC1+2)/3),3)*5+3,FALSE)&"|"&HLOOKUP(Sheet1!R2C1,Sheet1!R2C1:R16C1,MOD(RC1+3,3)+MOD(INT((RC1+3)/3),3)*5+3,FALSE) -> 104|132|133|134|162 | J135: =HLOOKUP(Sheet1!R2C1,Sheet1!R2C1:R16C1,MOD(RC1-1,3)+MOD(INT((RC1-1)/3),3)*5+3,FALSE)&"|"&HLOOKUP(Sheet1!R2C1,Sheet1!R2C1:R16C1,MOD(RC1,3)+MOD(INT((RC1)/3),3)*5+3,FALSE)&"|"&HLOOKUP(Sheet1!R2C1,Sheet1!R2C1:R16C1,MOD(RC1+1,3)+MOD(INT((RC1+1)/3),3)*5+3,FALSE)&"|"&HLOOKUP(Sheet1!R2C1,Sheet1!R2C1:R16C1,MOD(RC1+2,3)+MOD(INT((RC1+2)/3),3)*5+3,FALSE)&"|"&HLOOKUP(Sheet1!R2C1,Sheet1!R2C1:R16C1,MOD(RC1+3,3)+MOD(INT((RC1+3)/3),3)*5+3,FALSE) -> 104|132|133|134|162 | K135: =HLOOKUP(Sheet1!R2C1,Sheet1!R2C1:R16C1,MOD(RC1-1,3)+MOD(INT((RC1-1)/3),3)*5+3,FALSE)&"|"&HLOOKUP(Sheet1!R2C1,Sheet1!R2C1:R16C1,MOD(RC1,3)+MOD(INT((RC1)/3),3)*5+3,FALSE)&"|"&HLOOKUP(Sheet1!R2C1,Sheet1!R2C1:R16C1,MOD(RC1+1,3)+MOD(INT((RC1+1)/3),3)*5+3,FALSE)&"|"&HLOOKUP(Sheet1!R2C1,Sheet1!R2C1:R16C1,MOD(RC1+2,3)+MOD(INT((RC1+2)/3),3)*5+3,FALSE)&"|"&HLOOKUP(Sheet1!R2C1,Sheet1!R2C1:R16C1,MOD(RC1+3,3)+MOD(INT((RC1+3)/3),3)*5+3,FALSE) -> 104|132|133|134|162 | L135: 25|22|23|24 | M135: 394466|394466|394468|394468 | N135: 10030|10031|10032|10033 | O135: 1|1|1|1 | P135: 2500|2500|2500|2500
A136: 130 | B136: 128 | C136: 30 | D136: =R[-20]C+2 -> 32 | E136: 1000 | F136: =MOD(RC[-5]-1,3)*30+100&"|"&MOD(RC[-5]-1,3)*30+101&"|"&MOD(RC[-5]-1,3)*30+102&"|"&MOD(RC[-5]-1,3)*30+103&"|"&IF(MOD(RC[-5],4)=0,HLOOKUP(Sheet1!R2C10,Sheet1!R2C10:R7C10,MOD(RC[-5]/4-1,6)+1,FALSE),IF(MOD(RC[-5],2)=0,IF(RC[-5]>20,HLOOKUP(Sheet1!R2C7,Sheet1!R2C7:R43C7,MOD(RC[-5]/2-1,42)+1,FALSE),HLOOKUP(Sheet1!R2C4,Sheet1!R2C4:R7C4,MOD(RC[-5]-1,6)+1,FALSE)),MOD(RC[-5]-1,3)*30+104)) -> 100|101|102|103|150 | G136: =HLOOKUP(Sheet1!R2C1,Sheet1!R2C1:R16C1,MOD(RC1-1,2)+MOD(INT((RC1-1)/2),3)*5+1,FALSE)&"|"&HLOOKUP(Sheet1!R2C1,Sheet1!R2C1:R16C1,MOD(RC1,2)+MOD(INT((RC1)/2),3)*5+1,FALSE)&"|"&HLOOKUP(Sheet1!R2C1,Sheet1!R2C1:R16C1,MOD(RC1+1,2)+MOD(INT((RC1+1)/2),3)*5+1,FALSE)&"|"&HLOOKUP(Sheet1!R2C1,Sheet1!R2C1:R16C1,MOD(RC1+2,2)+MOD(INT((RC1+2)/2),3)*5+1,FALSE)&"|"&HLOOKUP(Sheet1!R2C1,Sheet1!R2C1:R16C1,MOD(RC1+3,2)+MOD(INT((RC1+3)/2),3)*5+1,FALSE) -> 131|160|161|100|101 | H136: =HLOOKUP(Sheet1!R2C1,Sheet1!R2C1:R16C1,MOD(RC1+2,2)+MOD(INT((RC1+2)/2),3)*5+1,FALSE)&"|"&HLOOKUP(Sheet1!R2C1,Sheet1!R2C1:R16C1,MOD(RC1+3,2)+MOD(INT((RC1+3)/2),3)*5+1,FALSE)&"|"&HLOOKUP(Sheet1!R2C1,Sheet1!R2C1:R16C1,MOD(RC1+4,2)+MOD(INT((RC1+4)/2),3)*5+1,FALSE)&"|"&HLOOKUP(Sheet1!R2C1,Sheet1!R2C1:R16C1,MOD(RC1+5,2)+MOD(INT((RC1+5)/2),3)*5+1,FALSE)&"|"&HLOOKUP(Sheet1!R2C1,Sheet1!R2C1:R16C1,MOD(RC1+6,2)+MOD(INT((RC1+6)/2),3)*5+1,FALSE) -> 100|101|130|131|160 | I136: =HLOOKUP(Sheet1!R2C1,Sheet1!R2C1:R16C1,MOD(RC1-1,3)+MOD(INT((RC1-1)/3),3)*5+3,FALSE)&"|"&HLOOKUP(Sheet1!R2C1,Sheet1!R2C1:R16C1,MOD(RC1,3)+MOD(INT((RC1)/3),3)*5+3,FALSE)&"|"&HLOOKUP(Sheet1!R2C1,Sheet1!R2C1:R16C1,MOD(RC1+1,3)+MOD(INT((RC1+1)/3),3)*5+3,FALSE)&"|"&HLOOKUP(Sheet1!R2C1,Sheet1!R2C1:R16C1,MOD(RC1+2,3)+MOD(INT((RC1+2)/3),3)*5+3,FALSE)&"|"&HLOOKUP(Sheet1!R2C1,Sheet1!R2C1:R16C1,MOD(RC1+3,3)+MOD(INT((RC1+3)/3),3)*5+3,FALSE) -> 132|133|134|162|163 | J136: =HLOOKUP(Sheet1!R2C1,Sheet1!R2C1:R16C1,MOD(RC1-1,3)+MOD(INT((RC1-1)/3),3)*5+3,FALSE)&"|"&HLOOKUP(Sheet1!R2C1,Sheet1!R2C1:R16C1,MOD(RC1,3)+MOD(INT((RC1)/3),3)*5+3,FALSE)&"|"&HLOOKUP(Sheet1!R2C1,Sheet1!R2C1:R16C1,MOD(RC1+1,3)+MOD(INT((RC1+1)/3),3)*5+3,FALSE)&"|"&HLOOKUP(Sheet1!R2C1,Sheet1!R2C1:R16C1,MOD(RC1+2,3)+MOD(INT((RC1+2)/3),3)*5+3,FALSE)&"|"&HLOOKUP(Sheet1!R2C1,Sheet1!R2C1:R16C1,MOD(RC1+3,3)+MOD(INT((RC1+3)/3),3)*5+3,FALSE) -> 132|133|134|162|163 | K136: =HLOOKUP(Sheet1!R2C1,Sheet1!R2C1:R16C1,MOD(RC1-1,3)+MOD(INT((RC1-1)/3),3)*5+3,FALSE)&"|"&HLOOKUP(Sheet1!R2C1,Sheet1!R2C1:R16C1,MOD(RC1,3)+MOD(INT((RC1)/3),3)*5+3,FALSE)&"|"&HLOOKUP(Sheet1!R2C1,Sheet1!R2C1:R16C1,MOD(RC1+1,3)+MOD(INT((RC1+1)/3),3)*5+3,FALSE)&"|"&HLOOKUP(Sheet1!R2C1,Sheet1!R2C1:R16C1,MOD(RC1+2,3)+MOD(INT((RC1+2)/3),3)*5+3,FALSE)&"|"&HLOOKUP(Sheet1!R2C1,Sheet1!R2C1:R16C1,MOD(RC1+3,3)+MOD(INT((RC1+3)/3),3)*5+3,FALSE) -> 132|133|134|162|163 | L136: 25|22|23|24 | M136: 400039|400039|400040|400040 | N136: 10030|10031|10032|10033|10030|10031|10032|10033|10030|10031|10032|10033|10030|10031|10032|10033|10030|10031|10032|10033|10030|10031|10032|10033|10030|10031|10032|10033|10030|10031|10032|10033|10030|10031|10032|10033|10030|10031|10032|10033 | O136: 1|1|1|1|1|1|1|1|1|1|1|1|1|1|1|1|1|1|1|1|1|1|1|1|1|1|1|1|1|1|1|1|1|1|1|1|1|1|1|1 | P136: 2500|2500|2500|2500|2500|2500|2500|2500|2500|2500|2500|2500|2500|2500|2500|2500|2500|2500|2500|2500|2500|2500|2500|2500|2500|2500|2500|2500|2500|2500|2500|2500|2500|2500|2500|2500|2500|2500|2500|2500
A137: 131 | B137: 129 | C137: 30 | D137: =R[-20]C+2 -> 32 | E137: 1000 | F137: =MOD(RC[-5]-1,3)*30+100&"|"&MOD(RC[-5]-1,3)*30+101&"|"&MOD(RC[-5]-1,3)*30+102&"|"&MOD(RC[-5]-1,3)*30+103&"|"&IF(MOD(RC[-5],4)=0,HLOOKUP(Sheet1!R2C10,Sheet1!R2C10:R7C10,MOD(RC[-5]/4-1,6)+1,FALSE),IF(MOD(RC[-5],2)=0,IF(RC[-5]>20,HLOOKUP(Sheet1!R2C7,Sheet1!R2C7:R43C7,MOD(RC[-5]/2-1,42)+1,FALSE),HLOOKUP(Sheet1!R2C4,Sheet1!R2C4:R7C4,MOD(RC[-5]-1,6)+1,FALSE)),MOD(RC[-5]-1,3)*30+104)) -> 130|131|132|133|134 | G137: =HLOOKUP(Sheet1!R2C1,Sheet1!R2C1:R16C1,MOD(RC1-1,2)+MOD(INT((RC1-1)/2),3)*5+1,FALSE)&"|"&HLOOKUP(Sheet1!R2C1,Sheet1!R2C1:R16C1,MOD(RC1,2)+MOD(INT((RC1)/2),3)*5+1,FALSE)&"|"&HLOOKUP(Sheet1!R2C1,Sheet1!R2C1:R16C1,MOD(RC1+1,2)+MOD(INT((RC1+1)/2),3)*5+1,FALSE)&"|"&HLOOKUP(Sheet1!R2C1,Sheet1!R2C1:R16C1,MOD(RC1+2,2)+MOD(INT((RC1+2)/2),3)*5+1,FALSE)&"|"&HLOOKUP(Sheet1!R2C1,Sheet1!R2C1:R16C1,MOD(RC1+3,2)+MOD(INT((RC1+3)/2),3)*5+1,FALSE) -> 160|161|100|101|130 | H137: =HLOOKUP(Sheet1!R2C1,Sheet1!R2C1:R16C1,MOD(RC1+2,2)+MOD(INT((RC1+2)/2),3)*5+1,FALSE)&"|"&HLOOKUP(Sheet1!R2C1,Sheet1!R2C1:R16C1,MOD(RC1+3,2)+MOD(INT((RC1+3)/2),3)*5+1,FALSE)&"|"&HLOOKUP(Sheet1!R2C1,Sheet1!R2C1:R16C1,MOD(RC1+4,2)+MOD(INT((RC1+4)/2),3)*5+1,FALSE)&"|"&HLOOKUP(Sheet1!R2C1,Sheet1!R2C1:R16C1,MOD(RC1+5,2)+MOD(INT((RC1+5)/2),3)*5+1,FALSE)&"|"&HLOOKUP(Sheet1!R2C1,Sheet1!R2C1:R16C1,MOD(RC1+6,2)+MOD(INT((RC1+6)/2),3)*5+1,FALSE) -> 101|130|131|160|161 | I137: =HLOOKUP(Sheet1!R2C1,Sheet1!R2C1:R16C1,MOD(RC1-1,3)+MOD(INT((RC1-1)/3),3)*5+3,FALSE)&"|"&HLOOKUP(Sheet1!R2C1,Sheet1!R2C1:R16C1,MOD(RC1,3)+MOD(INT((RC1)/3),3)*5+3,FALSE)&"|"&HLOOKUP(Sheet1!R2C1,Sheet1!R2C1:R16C1,MOD(RC1+1,3)+MOD(INT((RC1+1)/3),3)*5+3,FALSE)&"|"&HLOOKUP(Sheet1!R2C1,Sheet1!R2C1:R16C1,MOD(RC1+2,3)+MOD(INT((RC1+2)/3),3)*5+3,FALSE)&"|"&HLOOKUP(Sheet1!R2C1,Sheet1!R2C1:R16C1,MOD(RC1+3,3)+MOD(INT((RC1+3)/3),3)*5+3,FALSE) -> 133|134|162|163|164 | J137: =HLOOKUP(Sheet1!R2C1,Sheet1!R2C1:R16C1,MOD(RC1-1,3)+MOD(INT((RC1-1)/3),3)*5+3,FALSE)&"|"&HLOOKUP(Sheet1!R2C1,Sheet1!R2C1:R16C1,MOD(RC1,3)+MOD(INT((RC1)/3),3)*5+3,FALSE)&"|"&HLOOKUP(Sheet1!R2C1,Sheet1!R2C1:R16C1,MOD(RC1+1,3)+MOD(INT((RC1+1)/3),3)*5+3,FALSE)&"|"&HLOOKUP(Sheet1!R2C1,Sheet1!R2C1:R16C1,MOD(RC1+2,3)+MOD(INT((RC1+2)/3),3)*5+3,FALSE)&"|"&HLOOKUP(Sheet1!R2C1,Sheet1!R2C1:R16C1,MOD(RC1+3,3)+MOD(INT((RC1+3)/3),3)*5+3,FALSE) -> 133|134|162|163|164 | K137: =HLOOKUP(Sheet1!R2C1,Sheet1!R2C1:R16C1,MOD(RC1-1,3)+MOD(INT((RC1-1)/3),3)*5+3,FALSE)&"|"&HLOOKUP(Sheet1!R2C1,Sheet1!R2C1:R16C1,MOD(RC1,3)+MOD(INT((RC1)/3),3)*5+3,FALSE)&"|"&HLOOKUP(Sheet1!R2C1,Sheet1!R2C1:R16C1,MOD(RC1+1,3)+MOD(INT((RC1+1)/3),3)*5+3,FALSE)&"|"&HLOOKUP(Sheet1!R2C1,Sheet1!R2C1:R16C1,MOD(RC1+2,3)+MOD(INT((RC1+2)/3),3)*5+3,FALSE)&"|"&HLOOKUP(Sheet1!R2C1,Sheet1!R2C1:R16C1,MOD(RC1+3,3)+MOD(INT((RC1+3)/3),3)*5+3,FALSE) -> 133|134|162|163|164 | L137: 25|22|23|24 | M137: 405770|405770|405770|405770 | N137: 10030|10031|10032|10033 | O137: 1|1|1|1 | P137: 2500|2500|2500|2500
A138: 132 | B138: 130 | C138: 30 | D138: =R[-20]C+2 -> 32 | E138: 1000 | F138: =MOD(RC[-5]-1,3)*30+100&"|"&MOD(RC[-5]-1,3)*30+101&"|"&MOD(RC[-5]-1,3)*30+102&"|"&MOD(RC[-5]-1,3)*30+103&"|"&IF(MOD(RC[-5],4)=0,HLOOKUP(Sheet1!R2C10,Sheet1!R2C10:R7C10,MOD(RC[-5]/4-1,6)+1,FALSE),IF(MOD(RC[-5],2)=0,IF(RC[-5]>20,HLOOKUP(Sheet1!R2C7,Sheet1!R2C7:R43C7,MOD(RC[-5]/2-1,42)+1,FALSE),HLOOKUP(Sheet1!R2C4,Sheet1!R2C4:R7C4,MOD(RC[-5]-1,6)+1,FALSE)),MOD(RC[-5]-1,3)*30+104)) -> 160|161|162|163|192 | G138: =HLOOKUP(Sheet1!R2C1,Sheet1!R2C1:R16C1,MOD(RC1-1,2)+MOD(INT((RC1-1)/2),3)*5+1,FALSE)&"|"&HLOOKUP(Sheet1!R2C1,Sheet1!R2C1:R16C1,MOD(RC1,2)+MOD(INT((RC1)/2),3)*5+1,FALSE)&"|"&HLOOKUP(Sheet1!R2C1,Sheet1!R2C1:R16C1,MOD(RC1+1,2)+MOD(INT((RC1+1)/2),3)*5+1,FALSE)&"|"&HLOOKUP(Sheet1!R2C1,Sheet1!R2C1:R16C1,MOD(RC1+2,2)+MOD(INT((RC1+2)/2),3)*5+1,FALSE)&"|"&HLOOKUP(Sheet1!R2C1,Sheet1!R2C1:R16C1,MOD(RC1+3,2)+MOD(INT((RC1+3)/2),3)*5+1,FALSE) -> 161|100|101|130|131 | H138: =HLOOKUP(Sheet1!R2C1,Sheet1!R2C1:R16C1,MOD(RC1+2,2)+MOD(INT((RC1+2)/2),3)*5+1,FALSE)&"|"&HLOOKUP(Sheet1!R2C1,Sheet1!R2C1:R16C1,MOD(RC1+3,2)+MOD(INT((RC1+3)/2),3)*5+1,FALSE)&"|"&HLOOKUP(Sheet1!R2C1,Sheet1!R2C1:R16C1,MOD(RC1+4,2)+MOD(INT((RC1+4)/2),3)*5+1,FALSE)&"|"&HLOOKUP(Sheet1!R2C1,Sheet1!R2C1:R16C1,MOD(RC1+5,2)+MOD(INT((RC1+5)/2),3)*5+1,FALSE)&"|"&HLOOKUP(Sheet1!R2C1,Sheet1!R2C1:R16C1,MOD(RC1+6,2)+MOD(INT((RC1+6)/2),3)*5+1,FALSE) -> 130|131|160|161|100 | I138: =HLOOKUP(Sheet1!R2C1,Sheet1!R2C1:R16C1,MOD(RC1-1,3)+MOD(INT((RC1-1)/3),3)*5+3,FALSE)&"|"&HLOOKUP(Sheet1!R2C1,Sheet1!R2C1:R16C1,MOD(RC1,3)+MOD(INT((RC1)/3),3)*5+3,FALSE)&"|"&HLOOKUP(Sheet1!R2C1,Sheet1!R2C1:R16C1,MOD(RC1+1,3)+MOD(INT((RC1+1)/3),3)*5+3,FALSE)&"|"&HLOOKUP(Sheet1!R2C1,Sheet1!R2C1:R16C1,MOD(RC1+2,3)+MOD(INT((RC1+2)/3),3)*5+3,FALSE)&"|"&HLOOKUP(Sheet1!R2C1,Sheet1!R2C1:R16C1,MOD(RC1+3,3)+MOD(INT((RC1+3)/3),3)*5+3,FALSE) -> 134|162|163|164|102 | J138: =HLOOKUP(Sheet1!R2C1,Sheet1!R2C1:R16C1,MOD(RC1-1,3)+MOD(INT((RC1-1)/3),3)*5+3,FALSE)&"|"&HLOOKUP(Sheet1!R2C1,Sheet1!R2C1:R16C1,MOD(RC1,3)+MOD(INT((RC1)/3),3)*5+3,FALSE)&"|"&HLOOKUP(Sheet1!R2C1,Sheet1!R2C1:R16C1,MOD(RC1+1,3)+MOD(INT((RC1+1)/3),3)*5+3,FALSE)&"|"&HLOOKUP(Sheet1!R2C1,Sheet1!R2C1:R16C1,MOD(RC1+2,3)+MOD(INT((RC1+2)/3),3)*5+3,FALSE)&"|"&HLOOKUP(Sheet1!R2C1,Sheet1!R2C1:R16C1,MOD(RC1+3,3)+MOD(INT((RC1+3)/3),3)*5+3,FALSE) -> 134|162|163|164|102 | K138: =HLOOKUP(Sheet1!R2C1,Sheet1!R2C1:R16C1,MOD(RC1-1,3)+MOD(INT((RC1-1)/3),3)*5+3,FALSE)&"|"&HLOOKUP(Sheet1!R2C1,Sheet1!R2C1:R16C1,MOD(RC1,3)+MOD(INT((RC1)/3),3)*5+3,FALSE)&"|"&HLOOKUP(Sheet1!R2C1,Sheet1!R2C1:R16C1,MOD(RC1+1,3)+MOD(INT((RC1+1)/3),3)*5+3,FALSE)&"|"&HLOOKUP(Sheet1!R2C1,Sheet1!R2C1:R16C1,MOD(RC1+2,3)+MOD(INT((RC1+2)/3),3)*5+3,FALSE)&"|"&HLOOKUP(Sheet1!R2C1,Sheet1!R2C1:R16C1,MOD(RC1+3,3)+MOD(INT((RC1+3)/3),3)*5+3,FALSE) -> 134|162|163|164|102 | L138: 25|22|23|24 | M138: 411501|411501|411503|411503 | N138: 10030|10031|10032|10033 | O138: 1|1|1|1 | P138: 2500|2500|2500|2500
A139: 133 | B139: 131 | C139: 30 | D139: =R[-20]C+2 -> 32 | E139: 1000 | F139: =MOD(RC[-5]-1,3)*30+100&"|"&MOD(RC[-5]-1,3)*30+101&"|"&MOD(RC[-5]-1,3)*30+102&"|"&MOD(RC[-5]-1,3)*30+103&"|"&IF(MOD(RC[-5],4)=0,HLOOKUP(Sheet1!R2C10,Sheet1!R2C10:R7C10,MOD(RC[-5]/4-1,6)+1,FALSE),IF(MOD(RC[-5],2)=0,IF(RC[-5]>20,HLOOKUP(Sheet1!R2C7,Sheet1!R2C7:R43C7,MOD(RC[-5]/2-1,42)+1,FALSE),HLOOKUP(Sheet1!R2C4,Sheet1!R2C4:R7C4,MOD(RC[-5]-1,6)+1,FALSE)),MOD(RC[-5]-1,3)*30+104)) -> 100|101|102|103|104 | G139: =HLOOKUP(Sheet1!R2C1,Sheet1!R2C1:R16C1,MOD(RC1-1,2)+MOD(INT((RC1-1)/2),3)*5+1,FALSE)&"|"&HLOOKUP(Sheet1!R2C1,Sheet1!R2C1:R16C1,MOD(RC1,2)+MOD(INT((RC1)/2),3)*5+1,FALSE)&"|"&HLOOKUP(Sheet1!R2C1,Sheet1!R2C1:R16C1,MOD(RC1+1,2)+MOD(INT((RC1+1)/2),3)*5+1,FALSE)&"|"&HLOOKUP(Sheet1!R2C1,Sheet1!R2C1:R16C1,MOD(RC1+2,2)+MOD(INT((RC1+2)/2),3)*5+1,FALSE)&"|"&HLOOKUP(Sheet1!R2C1,Sheet1!R2C1:R16C1,MOD(RC1+3,2)+MOD(INT((RC1+3)/2),3)*5+1,FALSE) -> 100|101|130|131|160 | H139: =HLOOKUP(Sheet1!R2C1,Sheet1!R2C1:R16C1,MOD(RC1+2,2)+MOD(INT((RC1+2)/2),3)*5+1,FALSE)&"|"&HLOOKUP(Sheet1!R2C1,Sheet1!R2C1:R16C1,MOD(RC1+3,2)+MOD(INT((RC1+3)/2),3)*5+1,FALSE)&"|"&HLOOKUP(Sheet1!R2C1,Sheet1!R2C1:R16C1,MOD(RC1+4,2)+MOD(INT((RC1+4)/2),3)*5+1,FALSE)&"|"&HLOOKUP(Sheet1!R2C1,Sheet1!R2C1:R16C1,MOD(RC1+5,2)+MOD(INT((RC1+5)/2),3)*5+1,FALSE)&"|"&HLOOKUP(Sheet1!R2C1,Sheet1!R2C1:R16C1,MOD(RC1+6,2)+MOD(INT((RC1+6)/2),3)*5+1,FALSE) -> 131|160|161|100|101 | I139: =HLOOKUP(Sheet1!R2C1,Sheet1!R2C1:R16C1,MOD(RC1-1,3)+MOD(INT((RC1-1)/3),3)*5+3,FALSE)&"|"&HLOOKUP(Sheet1!R2C1,Sheet1!R2C1:R16C1,MOD(RC1,3)+MOD(INT((RC1)/3),3)*5+3,FALSE)&"|"&HLOOKUP(Sheet1!R2C1,Sheet1!R2C1:R16C1,MOD(RC1+1,3)+MOD(INT((RC1+1)/3),3)*5+3,FALSE)&"|"&HLOOKUP(Sheet1!R2C1,Sheet1!R2C1:R16C1,MOD(RC1+2,3)+MOD(INT((RC1+2)/3),3)*5+3,FALSE)&"|"&HLOOKUP(Sheet1!R2C1,Sheet1!R2C1:R16C1,MOD(RC1+3,3)+MOD(INT((RC1+3)/3),3)*5+3,FALSE) -> 162|163|164|102|103 | J139: =HLOOKUP(Sheet1!R2C1,Sheet1!R2C1:R16C1,MOD(RC1-1,3)+MOD(INT((RC1-1)/3),3)*5+3,FALSE)&"|"&HLOOKUP(Sheet1!R2C1,Sheet1!R2C1:R16C1,MOD(RC1,3)+MOD(INT((RC1)/3),3)*5+3,FALSE)&"|"&HLOOKUP(Sheet1!R2C1,Sheet1!R2C1:R16C1,MOD(RC1+1,3)+MOD(INT((RC1+1)/3),3)*5+3,FALSE)&"|"&HLOOKUP(Sheet1!R2C1,Sheet1!R2C1:R16C1,MOD(RC1+2,3)+MOD(INT((RC1+2)/3),3)*5+3,FALSE)&"|"&HLOOKUP(Sheet1!R2C1,Sheet1!R2C1:R16C1,MOD(RC1+3,3)+MOD(INT((RC1+3)/3),3)*5+3,FALSE) -> 162|163|164|102|103 | K139: =HLOOKUP(Sheet1!R2C1,Sheet1!R2C1:R16C1,MOD(RC1-1,3)+MOD(INT((RC1-1)/3),3)*5+3,FALSE)&"|"&HLOOKUP(Sheet1!R2C1,Sheet1!R2C1:R16C1,MOD(RC1,3)+MOD(INT((RC1)/3),3)*5+3,FALSE)&"|"&HLOOKUP(Sheet1!R2C1,Sheet1!R2C1:R16C1,MOD(RC1+1,3)+MOD(INT((RC1+1)/3),3)*5+3,FALSE)&"|"&HLOOKUP(Sheet1!R2C1,Sheet1!R2C1:R16C1,MOD(RC1+2,3)+MOD(INT((RC1+2)/3),3)*5+3,FALSE)&"|"&HLOOKUP(Sheet1!R2C1,Sheet1!R2C1:R16C1,MOD(RC1+3,3)+MOD(INT((RC1+3)/3),3)*5+3,FALSE) -> 162|163|164|102|103 | L139: 25|22|23|24 | M139: 417237|417238|417238|417238 | N139: 10030|10031|10032|10033 | O139: 1|1|1|1 | P139: 2500|2500|2500|2500
A140: 134 | B140: 132 | C140: 30 | D140: =R[-20]C+2 -> 32 | E140: 1000 | F140: =MOD(RC[-5]-1,3)*30+100&"|"&MOD(RC[-5]-1,3)*30+101&"|"&MOD(RC[-5]-1,3)*30+102&"|"&MOD(RC[-5]-1,3)*30+103&"|"&IF(MOD(RC[-5],4)=0,HLOOKUP(Sheet1!R2C10,Sheet1!R2C10:R7C10,MOD(RC[-5]/4-1,6)+1,FALSE),IF(MOD(RC[-5],2)=0,IF(RC[-5]>20,HLOOKUP(Sheet1!R2C7,Sheet1!R2C7:R43C7,MOD(RC[-5]/2-1,42)+1,FALSE),HLOOKUP(Sheet1!R2C4,Sheet1!R2C4:R7C4,MOD(RC[-5]-1,6)+1,FALSE)),MOD(RC[-5]-1,3)*30+104)) -> 130|131|132|133|152 | G140: =HLOOKUP(Sheet1!R2C1,Sheet1!R2C1:R16C1,MOD(RC1-1,2)+MOD(INT((RC1-1)/2),3)*5+1,FALSE)&"|"&HLOOKUP(Sheet1!R2C1,Sheet1!R2C1:R16C1,MOD(RC1,2)+MOD(INT((RC1)/2),3)*5+1,FALSE)&"|"&HLOOKUP(Sheet1!R2C1,Sheet1!R2C1:R16C1,MOD(RC1+1,2)+MOD(INT((RC1+1)/2),3)*5+1,FALSE)&"|"&HLOOKUP(Sheet1!R2C1,Sheet1!R2C1:R16C1,MOD(RC1+2,2)+MOD(INT((RC1+2)/2),3)*5+1,FALSE)&"|"&HLOOKUP(Sheet1!R2C1,Sheet1!R2C1:R16C1,MOD(RC1+3,2)+MOD(INT((RC1+3)/2),3)*5+1,FALSE) -> 101|130|131|160|161 | H140: =HLOOKUP(Sheet1!R2C1,Sheet1!R2C1:R16C1,MOD(RC1+2,2)+MOD(INT((RC1+2)/2),3)*5+1,FALSE)&"|"&HLOOKUP(Sheet1!R2C1,Sheet1!R2C1:R16C1,MOD(RC1+3,2)+MOD(INT((RC1+3)/2),3)*5+1,FALSE)&"|"&HLOOKUP(Sheet1!R2C1,Sheet1!R2C1:R16C1,MOD(RC1+4,2)+MOD(INT((RC1+4)/2),3)*5+1,FALSE)&"|"&HLOOKUP(Sheet1!R2C1,Sheet1!R2C1:R16C1,MOD(RC1+5,2)+MOD(INT((RC1+5)/2),3)*5+1,FALSE)&"|"&HLOOKUP(Sheet1!R2C1,Sheet1!R2C1:R16C1,MOD(RC1+6,2)+MOD(INT((RC1+6)/2),3)*5+1,FALSE) -> 160|161|100|101|130 | I140: =HLOOKUP(Sheet1!R2C1,Sheet1!R2C1:R16C1,MOD(RC1-1,3)+MOD(INT((RC1-1)/3),3)*5+3,FALSE)&"|"&HLOOKUP(Sheet1!R2C1,Sheet1!R2C1:R16C1,MOD(RC1,3)+MOD(INT((RC1)/3),3)*5+3,FALSE)&"|"&HLOOKUP(Sheet1!R2C1,Sheet1!R2C1:R16C1,MOD(RC1+1,3)+MOD(INT((RC1+1)/3),3)*5+3,FALSE)&"|"&HLOOKUP(Sheet1!R2C1,Sheet1!R2C1:R16C1,MOD(RC1+2,3)+MOD(INT((RC1+2)/3),3)*5+3,FALSE)&"|"&HLOOKUP(Sheet1!R2C1,Sheet1!R2C1:R16C1,MOD(RC1+3,3)+MOD(INT((RC1+3)/3),3)*5+3,FALSE) -> 163|164|102|103|104 | J140: =HLOOKUP(Sheet1!R2C1,Sheet1!R2C1:R16C1,MOD(RC1-1,3)+MOD(INT((RC1-1)/3),3)*5+3,FALSE)&"|"&HLOOKUP(Sheet1!R2C1,Sheet1!R2C1:R16C1,MOD(RC1,3)+MOD(INT((RC1)/3),3)*5+3,FALSE)&"|"&HLOOKUP(Sheet1!R2C1,Sheet1!R2C1:R16C1,MOD(RC1+1,3)+MOD(INT((RC1+1)/3),3)*5+3,FALSE)&"|"&HLOOKUP(Sheet1!R2C1,Sheet1!R2C1:R16C1,MOD(RC1+2,3)+MOD(INT((RC1+2)/3),3)*5+3,FALSE)&"|"&HLOOKUP(Sheet1!R2C1,Sheet1!R2C1:R16C1,MOD(RC1+3,3)+MOD(INT((RC1+3)/3),3)*5+3,FALSE) -> 163|164|102|103|104 | K140: =HLOOKUP(Sheet1!R2C1,Sheet1!R2C1:R16C1,MOD(RC1-1,3)+MOD(INT((RC1-1)/3),3)*5+3,FALSE)&"|"&HLOOKUP(Sheet1!R2C1,Sheet1!R2C1:R16C1,MOD(RC1,3)+MOD(INT((RC1)/3),3)*5+3,FALSE)&"|"&HLOOKUP(Sheet1!R2C1,Sheet1!R2C1:R16C1,MOD(RC1+1,3)+MOD(INT((RC1+1)/3),3)*5+3,FALSE)&"|"&HLOOKUP(Sheet1!R2C1,Sheet1!R2C1:R16C1,MOD(RC1+2,3)+MOD(INT((RC1+2)/3),3)*5+3,FALSE)&"|"&HLOOKUP(Sheet1!R2C1,Sheet1!R2C1:R16C1,MOD(RC1+3,3)+MOD(INT((RC1+3)/3),3)*5+3,FALSE) -> 163|164|102|103|104 | L140: 25|22|23|24 | M140: 423114|423114|423115|423115 | N140: 10030|10031|10032|10033 | O140: 1|1|1|1 | P140: 2500|2500|2500|2500
A141: 135 | B141: 133 | C141: 30 | D141: =R[-20]C+2 -> 32 | E141: 1000 | F141: =MOD(RC[-5]-1,3)*30+100&"|"&MOD(RC[-5]-1,3)*30+101&"|"&MOD(RC[-5]-1,3)*30+102&"|"&MOD(RC[-5]-1,3)*30+103&"|"&IF(MOD(RC[-5],4)=0,HLOOKUP(Sheet1!R2C10,Sheet1!R2C10:R7C10,MOD(RC[-5]/4-1,6)+1,FALSE),IF(MOD(RC[-5],2)=0,IF(RC[-5]>20,HLOOKUP(Sheet1!R2C7,Sheet1!R2C7:R43C7,MOD(RC[-5]/2-1,42)+1,FALSE),HLOOKUP(Sheet1!R2C4,Sheet1!R2C4:R7C4,MOD(RC[-5]-1,6)+1,FALSE)),MOD(RC[-5]-1,3)*30+104)) -> 160|161|162|163|164 | G141: =HLOOKUP(Sheet1!R2C1,Sheet1!R2C1:R16C1,MOD(RC1-1,2)+MOD(INT((RC1-1)/2),3)*5+1,FALSE)&"|"&HLOOKUP(Sheet1!R2C1,Sheet1!R2C1:R16C1,MOD(RC1,2)+MOD(INT((RC1)/2),3)*5+1,FALSE)&"|"&HLOOKUP(Sheet1!R2C1,Sheet1!R2C1:R16C1,MOD(RC1+1,2)+MOD(INT((RC1+1)/2),3)*5+1,FALSE)&"|"&HLOOKUP(Sheet1!R2C1,Sheet1!R2C1:R16C1,MOD(RC1+2,2)+MOD(INT((RC1+2)/2),3)*5+1,FALSE)&"|"&HLOOKUP(Sheet1!R2C1,Sheet1!R2C1:R16C1,MOD(RC1+3,2)+MOD(INT((RC1+3)/2),3)*5+1,FALSE) -> 130|131|160|161|100 | H141: =HLOOKUP(Sheet1!R2C1,Sheet1!R2C1:R16C1,MOD(RC1+2,2)+MOD(INT((RC1+2)/2),3)*5+1,FALSE)&"|"&HLOOKUP(Sheet1!R2C1,Sheet1!R2C1:R16C1,MOD(RC1+3,2)+MOD(INT((RC1+3)/2),3)*5+1,FALSE)&"|"&HLOOKUP(Sheet1!R2C1,Sheet1!R2C1:R16C1,MOD(RC1+4,2)+MOD(INT((RC1+4)/2),3)*5+1,FALSE)&"|"&HLOOKUP(Sheet1!R2C1,Sheet1!R2C1:R16C1,MOD(RC1+5,2)+MOD(INT((RC1+5)/2),3)*5+1,FALSE)&"|"&HLOOKUP(Sheet1!R2C1,Sheet1!R2C1:R16C1,MOD(RC1+6,2)+MOD(INT((RC1+6)/2),3)*5+1,FALSE) -> 161|100|101|130|131 | I141: =HLOOKUP(Sheet1!R2C1,Sheet1!R2C1:R16C1,MOD(RC1-1,3)+MOD(INT((RC1-1)/3),3)*5+3,FALSE)&"|"&HLOOKUP(Sheet1!R2C1,Sheet1!R2C1:R16C1,MOD(RC1,3)+MOD(INT((RC1)/3),3)*5+3,FALSE)&"|"&HLOOKUP(Sheet1!R2C1,Sheet1!R2C1:R16C1,MOD(RC1+1,3)+MOD(INT((RC1+1)/3),3)*5+3,FALSE)&"|"&HLOOKUP(Sheet1!R2C1,Sheet1!R2C1:R16C1,MOD(RC1+2,3)+MOD(INT((RC1+2)/3),3)*5+3,FALSE)&"|"&HLOOKUP(Sheet1!R2C1,Sheet1!R2C1:R16C1,MOD(RC1+3,3)+MOD(INT((RC1+3)/3),3)*5+3,FALSE) -> 164|102|103|104|132 | J141: =HLOOKUP(Sheet1!R2C1,Sheet1!R2C1:R16C1,MOD(RC1-1,3)+MOD(INT((RC1-1)/3),3)*5+3,FALSE)&"|"&HLOOKUP(Sheet1!R2C1,Sheet1!R2C1:R16C1,MOD(RC1,3)+MOD(INT((RC1)/3),3)*5+3,FALSE)&"|"&HLOOKUP(Sheet1!R2C1,Sheet1!R2C1:R16C1,MOD(RC1+1,3)+MOD(INT((RC1+1)/3),3)*5+3,FALSE)&"|"&HLOOKUP(Sheet1!R2C1,Sheet1!R2C1:R16C1,MOD(RC1+2,3)+MOD(INT((RC1+2)/3),3)*5+3,FALSE)&"|"&HLOOKUP(Sheet1!R2C1,Sheet1!R2C1:R16C1,MOD(RC1+3,3)+MOD(INT((RC1+3)/3),3)*5+3,FALSE) -> 164|102|103|104|132 | K141: =HLOOKUP(Sheet1!R2C1,Sheet1!R2C1:R16C1,MOD(RC1-1,3)+MOD(INT((RC1-1)/3),3)*5+3,FALSE)&"|"&HLOOKUP(Sheet1!R2C1,Sheet1!R2C1:R16C1,MOD(RC1,3)+MOD(INT((RC1)/3),3)*5+3,FALSE)&"|"&HLOOKUP(Sheet1!R2C1,Sheet1!R2C1:R16C1,MOD(RC1+1,3)+MOD(INT((RC1+1)/3),3)*5+3,FALSE)&"|"&HLOOKUP(Sheet1!R2C1,Sheet1!R2C1:R16C1,MOD(RC1+2,3)+MOD(INT((RC1+2)/3),3)*5+3,FALSE)&"|"&HLOOKUP(Sheet1!R2C1,Sheet1!R2C1:R16C1,MOD(RC1+3,3)+MOD(INT((RC1+3)/3),3)*5+3,FALSE) -> 164|102|103|104|132 | L141: 25|22|23|24 | M141: 428991|428991|428990|428990 | N141: 10030|10031|10032|10033|10030|10031|10032|10033|10030|10031|10032|10033|10030|10031|10032|10033|10030|10031|10032|10033|10030|10031|10032|10033|10030|10031|10032|10033|10030|10031|10032|10033|10030|10031|10032|10033|10030|10031|10032|10033 | O141: 1|1|1|1|1|1|1|1|1|1|1|1|1|1|1|1|1|1|1|1|1|1|1|1|1|1|1|1|1|1|1|1|1|1|1|1|1|1|1|1 | P141: 2500|2500|2500|2500|2500|2500|2500|2500|2500|2500|2500|2500|2500|2500|2500|2500|2500|2500|2500|2500|2500|2500|2500|2500|2500|2500|2500|2500|2500|2500|2500|2500|2500|2500|2500|2500|2500|2500|2500|2500
A142: 136 | B142: 134 | C142: 30 | D142: =R[-20]C+2 -> 32 | E142: 1000 | F142: =MOD(RC[-5]-1,3)*30+100&"|"&MOD(RC[-5]-1,3)*30+101&"|"&MOD(RC[-5]-1,3)*30+102&"|"&MOD(RC[-5]-1,3)*30+103&"|"&IF(MOD(RC[-5],4)=0,HLOOKUP(Sheet1!R2C10,Sheet1!R2C10:R7C10,MOD(RC[-5]/4-1,6)+1,FALSE),IF(MOD(RC[-5],2)=0,IF(RC[-5]>20,HLOOKUP(Sheet1!R2C7,Sheet1!R2C7:R43C7,MOD(RC[-5]/2-1,42)+1,FALSE),HLOOKUP(Sheet1!R2C4,Sheet1!R2C4:R7C4,MOD(RC[-5]-1,6)+1,FALSE)),MOD(RC[-5]-1,3)*30+104)) -> 100|101|102|103|193 | G142: =HLOOKUP(Sheet1!R2C1,Sheet1!R2C1:R16C1,MOD(RC1-1,2)+MOD(INT((RC1-1)/2),3)*5+1,FALSE)&"|"&HLOOKUP(Sheet1!R2C1,Sheet1!R2C1:R16C1,MOD(RC1,2)+MOD(INT((RC1)/2),3)*5+1,FALSE)&"|"&HLOOKUP(Sheet1!R2C1,Sheet1!R2C1:R16C1,MOD(RC1+1,2)+MOD(INT((RC1+1)/2),3)*5+1,FALSE)&"|"&HLOOKUP(Sheet1!R2C1,Sheet1!R2C1:R16C1,MOD(RC1+2,2)+MOD(INT((RC1+2)/2),3)*5+1,FALSE)&"|"&HLOOKUP(Sheet1!R2C1,Sheet1!R2C1:R16C1,MOD(RC1+3,2)+MOD(INT((RC1+3)/2),3)*5+1,FALSE) -> 131|160|161|100|101 | H142: =HLOOKUP(Sheet1!R2C1,Sheet1!R2C1:R16C1,MOD(RC1+2,2)+MOD(INT((RC1+2)/2),3)*5+1,FALSE)&"|"&HLOOKUP(Sheet1!R2C1,Sheet1!R2C1:R16C1,MOD(RC1+3,2)+MOD(INT((RC1+3)/2),3)*5+1,FALSE)&"|"&HLOOKUP(Sheet1!R2C1,Sheet1!R2C1:R16C1,MOD(RC1+4,2)+MOD(INT((RC1+4)/2),3)*5+1,FALSE)&"|"&HLOOKUP(Sheet1!R2C1,Sheet1!R2C1:R16C1,MOD(RC1+5,2)+MOD(INT((RC1+5)/2),3)*5+1,FALSE)&"|"&HLOOKUP(Sheet1!R2C1,Sheet1!R2C1:R16C1,MOD(RC1+6,2)+MOD(INT((RC1+6)/2),3)*5+1,FALSE) -> 100|101|130|131|160 | I142: =HLOOKUP(Sheet1!R2C1,Sheet1!R2C1:R16C1,MOD(RC1-1,3)+MOD(INT((RC1-1)/3),3)*5+3,FALSE)&"|"&HLOOKUP(Sheet1!R2C1,Sheet1!R2C1:R16C1,MOD(RC1,3)+MOD(INT((RC1)/3),3)*5+3,FALSE)&"|"&HLOOKUP(Sheet1!R2C1,Sheet1!R2C1:R16C1,MOD(RC1+1,3)+MOD(INT((RC1+1)/3),3)*5+3,FALSE)&"|"&HLOOKUP(Sheet1!R2C1,Sheet1!R2C1:R16C1,MOD(RC1+2,3)+MOD(INT((RC1+2)/3),3)*5+3,FALSE)&"|"&HLOOKUP(Sheet1!R2C1,Sheet1!R2C1:R16C1,MOD(RC1+3,3)+MOD(INT((RC1+3)/3),3)*5+3,FALSE) -> 102|103|104|132|133 | J142: =HLOOKUP(Sheet1!R2C1,Sheet1!R2C1:R16C1,MOD(RC1-1,3)+MOD(INT((RC1-1)/3),3)*5+3,FALSE)&"|"&HLOOKUP(Sheet1!R2C1,Sheet1!R2C1:R16C1,MOD(RC1,3)+MOD(INT((RC1)/3),3)*5+3,FALSE)&"|"&HLOOKUP(Sheet1!R2C1,Sheet1!R2C1:R16C1,MOD(RC1+1,3)+MOD(INT((RC1+1)/3),3)*5+3,FALSE)&"|"&HLOOKUP(Sheet1!R2C1,Sheet1!R2C1:R16C1,MOD(RC1+2,3)+MOD(INT((RC1+2)/3),3)*5+3,FALSE)&"|"&HLOOKUP(Sheet1!R2C1,Sheet1!R2C1:R16C1,MOD(RC1+3,3)+MOD(INT((RC1+3)/3),3)*5+3,FALSE) -> 102|103|104|132|133 | K142: =HLOOKUP(Sheet1!R2C1,Sheet1!R2C1:R16C1,MOD(RC1-1,3)+MOD(INT((RC1-1)/3),3)*5+3,FALSE)&"|"&HLOOKUP(Sheet1!R2C1,Sheet1!R2C1:R16C1,MOD(RC1,3)+MOD(INT((RC1)/3),3)*5+3,FALSE)&"|"&HLOOKUP(Sheet1!R2C1,Sheet1!R2C1:R16C1,MOD(RC1+1,3)+MOD(INT((RC1+1)/3),3)*5+3,FALSE)&"|"&HLOOKUP(Sheet1!R2C1,Sheet1!R2C1:R16C1,MOD(RC1+2,3)+MOD(INT((RC1+2)/3),3)*5+3,FALSE)&"|"&HLOOKUP(Sheet1!R2C1,Sheet1!R2C1:R16C1,MOD(RC1+3,3)+MOD(INT((RC1+3)/3),3)*5+3,FALSE) -> 102|103|104|132|133 | L142: 25|22|23|24 | M142: 434868|434868|434868|434868 | N142: 10030|10031|10032|10033 | O142: 1|1|1|1 | P142: 2500|2500|2500|2500
A143: 137 | B143: 135 | C143: 30 | D143: =R[-20]C+2 -> 32 | E143: 1000 | F143: =MOD(RC[-5]-1,3)*30+100&"|"&MOD(RC[-5]-1,3)*30+101&"|"&MOD(RC[-5]-1,3)*30+102&"|"&MOD(RC[-5]-1,3)*30+103&"|"&IF(MOD(RC[-5],4)=0,HLOOKUP(Sheet1!R2C10,Sheet1!R2C10:R7C10,MOD(RC[-5]/4-1,6)+1,FALSE),IF(MOD(RC[-5],2)=0,IF(RC[-5]>20,HLOOKUP(Sheet1!R2C7,Sheet1!R2C7:R43C7,MOD(RC[-5]/2-1,42)+1,FALSE),HLOOKUP(Sheet1!R2C4,Sheet1!R2C4:R7C4,MOD(RC[-5]-1,6)+1,FALSE)),MOD(RC[-5]-1,3)*30+104)) -> 130|131|132|133|134 | G143: =HLOOKUP(Sheet1!R2C1,Sheet1!R2C1:R16C1,MOD(RC1-1,2)+MOD(INT((RC1-1)/2),3)*5+1,FALSE)&"|"&HLOOKUP(Sheet1!R2C1,Sheet1!R2C1:R16C1,MOD(RC1,2)+MOD(INT((RC1)/2),3)*5+1,FALSE)&"|"&HLOOKUP(Sheet1!R2C1,Sheet1!R2C1:R16C1,MOD(RC1+1,2)+MOD(INT((RC1+1)/2),3)*5+1,FALSE)&"|"&HLOOKUP(Sheet1!R2C1,Sheet1!R2C1:R16C1,MOD(RC1+2,2)+MOD(INT((RC1+2)/2),3)*5+1,FALSE)&"|"&HLOOKUP(Sheet1!R2C1,Sheet1!R2C1:R16C1,MOD(RC1+3,2)+MOD(INT((RC1+3)/2),3)*5+1,FALSE) -> 160|161|100|101|130 | H143: =HLOOKUP(Sheet1!R2C1,Sheet1!R2C1:R16C1,MOD(RC1+2,2)+MOD(INT((RC1+2)/2),3)*5+1,FALSE)&"|"&HLOOKUP(Sheet1!R2C1,Sheet1!R2C1:R16C1,MOD(RC1+3,2)+MOD(INT((RC1+3)/2),3)*5+1,FALSE)&"|"&HLOOKUP(Sheet1!R2C1,Sheet1!R2C1:R16C1,MOD(RC1+4,2)+MOD(INT((RC1+4)/2),3)*5+1,FALSE)&"|"&HLOOKUP(Sheet1!R2C1,Sheet1!R2C1:R16C1,MOD(RC1+5,2)+MOD(INT((RC1+5)/2),3)*5+1,FALSE)&"|"&HLOOKUP(Sheet1!R2C1,Sheet1!R2C1:R16C1,MOD(RC1+6,2)+MOD(INT((RC1+6)/2),3)*5+1,FALSE) -> 101|130|131|160|161 | I143: =HLOOKUP(Sheet1!R2C1,Sheet1!R2C1:R16C1,MOD(RC1-1,3)+MOD(INT((RC1-1)/3),3)*5+3,FALSE)&"|"&HLOOKUP(Sheet1!R2C1,Sheet1!R2C1:R16C1,MOD(RC1,3)+MOD(INT((RC1)/3),3)*5+3,FALSE)&"|"&HLOOKUP(Sheet1!R2C1,Sheet1!R2C1:R16C1,MOD(RC1+1,3)+MOD(INT((RC1+1)/3),3)*5+3,FALSE)&"|"&HLOOKUP(Sheet1!R2C1,Sheet1!R2C1:R16C1,MOD(RC1+2,3)+MOD(INT((RC1+2)/3),3)*5+3,FALSE)&"|"&HLOOKUP(Sheet1!R2C1,Sheet1!R2C1:R16C1,MOD(RC1+3,3)+MOD(INT((RC1+3)/3),3)*5+3,FALSE) -> 103|104|132|133|134 | J143: =HLOOKUP(Sheet1!R2C1,Sheet1!R2C1:R16C1,MOD(RC1-1,3)+MOD(INT((RC1-1)/3),3)*5+3,FALSE)&"|"&HLOOKUP(Sheet1!R2C1,Sheet1!R2C1:R16C1,MOD(RC1,3)+MOD(INT((RC1)/3),3)*5+3,FALSE)&"|"&HLOOKUP(Sheet1!R2C1,Sheet1!R2C1:R16C1,MOD(RC1+1,3)+MOD(INT((RC1+1)/3),3)*5+3,FALSE)&"|"&HLOOKUP(Sheet1!R2C1,Sheet1!R2C1:R16C1,MOD(RC1+2,3)+MOD(INT((RC1+2)/3),3)*5+3,FALSE)&"|"&HLOOKUP(Sheet1!R2C1,Sheet1!R2C1:R16C1,MOD(RC1+3,3)+MOD(INT((RC1+3)/3),3)*5+3,FALSE) -> 103|104|132|133|134 | K143: =HLOOKUP(Sheet1!R2C1,Sheet1!R2C1:R16C1,MOD(RC1-1,3)+MOD(INT((RC1-1)/3),3)*5+3,FALSE)&"|"&HLOOKUP(Sheet1!R2C1,Sheet1!R2C1:R16C1,MOD(RC1,3)+MOD(INT((RC1)/3),3)*5+3,FALSE)&"|"&HLOOKUP(Sheet1!R2C1,Sheet1!R2C1:R16C1,MOD(RC1+1,3)+MOD(INT((RC1+1)/3),3)*5+3,FALSE)&"|"&HLOOKUP(Sheet1!R2C1,Sheet1!R2C1:R16C1,MOD(RC1+2,3)+MOD(INT((RC1+2)/3),3)*5+3,FALSE)&"|"&HLOOKUP(Sheet1!R2C1,Sheet1!R2C1:R16C1,MOD(RC1+3,3)+MOD(INT((RC1+3)/3),3)*5+3,FALSE) -> 103|104|132|133|134 | L143: 25|22|23|24 | M143: 442753|442754|442753|442753 | N143: 10030|10031|10032|10033 | O143: 1|1|1|1 | P143: 2500|2500|2500|2500
A144: 138 | B144: 136 | C144: 30 | D144: =R[-20]C+2 -> 32 | E144: 1000 | F144: =MOD(RC[-5]-1,3)*30+100&"|"&MOD(RC[-5]-1,3)*30+101&"|"&MOD(RC[-5]-1,3)*30+102&"|"&MOD(RC[-5]-1,3)*30+103&"|"&IF(MOD(RC[-5],4)=0,HLOOKUP(Sheet1!R2C10,Sheet1!R2C10:R7C10,MOD(RC[-5]/4-1,6)+1,FALSE),IF(MOD(RC[-5],2)=0,IF(RC[-5]>20,HLOOKUP(Sheet1!R2C7,Sheet1!R2C7:R43C7,MOD(RC[-5]/2-1,42)+1,FALSE),HLOOKUP(Sheet1!R2C4,Sheet1!R2C4:R7C4,MOD(RC[-5]-1,6)+1,FALSE)),MOD(RC[-5]-1,3)*30+104)) -> 160|161|162|163|154 | G144: =HLOOKUP(Sheet1!R2C1,Sheet1!R2C1:R16C1,MOD(RC1-1,2)+MOD(INT((RC1-1)/2),3)*5+1,FALSE)&"|"&HLOOKUP(Sheet1!R2C1,Sheet1!R2C1:R16C1,MOD(RC1,2)+MOD(INT((RC1)/2),3)*5+1,FALSE)&"|"&HLOOKUP(Sheet1!R2C1,Sheet1!R2C1:R16C1,MOD(RC1+1,2)+MOD(INT((RC1+1)/2),3)*5+1,FALSE)&"|"&HLOOKUP(Sheet1!R2C1,Sheet1!R2C1:R16C1,MOD(RC1+2,2)+MOD(INT((RC1+2)/2),3)*5+1,FALSE)&"|"&HLOOKUP(Sheet1!R2C1,Sheet1!R2C1:R16C1,MOD(RC1+3,2)+MOD(INT((RC1+3)/2),3)*5+1,FALSE) -> 161|100|101|130|131 | H144: =HLOOKUP(Sheet1!R2C1,Sheet1!R2C1:R16C1,MOD(RC1+2,2)+MOD(INT((RC1+2)/2),3)*5+1,FALSE)&"|"&HLOOKUP(Sheet1!R2C1,Sheet1!R2C1:R16C1,MOD(RC1+3,2)+MOD(INT((RC1+3)/2),3)*5+1,FALSE)&"|"&HLOOKUP(Sheet1!R2C1,Sheet1!R2C1:R16C1,MOD(RC1+4,2)+MOD(INT((RC1+4)/2),3)*5+1,FALSE)&"|"&HLOOKUP(Sheet1!R2C1,Sheet1!R2C1:R16C1,MOD(RC1+5,2)+MOD(INT((RC1+5)/2),3)*5+1,FALSE)&"|"&HLOOKUP(Sheet1!R2C1,Sheet1!R2C1:R16C1,MOD(RC1+6,2)+MOD(INT((RC1+6)/2),3)*5+1,FALSE) -> 130|131|160|161|100 | I144: =HLOOKUP(Sheet1!R2C1,Sheet1!R2C1:R16C1,MOD(RC1-1,3)+MOD(INT((RC1-1)/3),3)*5+3,FALSE)&"|"&HLOOKUP(Sheet1!R2C1,Sheet1!R2C1:R16C1,MOD(RC1,3)+MOD(INT((RC1)/3),3)*5+3,FALSE)&"|"&HLOOKUP(Sheet1!R2C1,Sheet1!R2C1:R16C1,MOD(RC1+1,3)+MOD(INT((RC1+1)/3),3)*5+3,FALSE)&"|"&HLOOKUP(Sheet1!R2C1,Sheet1!R2C1:R16C1,MOD(RC1+2,3)+MOD(INT((RC1+2)/3),3)*5+3,FALSE)&"|"&HLOOKUP(Sheet1!R2C1,Sheet1!R2C1:R16C1,MOD(RC1+3,3)+MOD(INT((RC1+3)/3),3)*5+3,FALSE) -> 104|132|133|134|162 | J144: =HLOOKUP(Sheet1!R2C1,Sheet1!R2C1:R16C1,MOD(RC1-1,3)+MOD(INT((RC1-1)/3),3)*5+3,FALSE)&"|"&HLOOKUP(Sheet1!R2C1,Sheet1!R2C1:R16C1,MOD(RC1,3)+MOD(INT((RC1)/3),3)*5+3,FALSE)&"|"&HLOOKUP(Sheet1!R2C1,Sheet1!R2C1:R16C1,MOD(RC1+1,3)+MOD(INT((RC1+1)/3),3)*5+3,FALSE)&"|"&HLOOKUP(Sheet1!R2C1,Sheet1!R2C1:R16C1,MOD(RC1+2,3)+MOD(INT((RC1+2)/3),3)*5+3,FALSE)&"|"&HLOOKUP(Sheet1!R2C1,Sheet1!R2C1:R16C1,MOD(RC1+3,3)+MOD(INT((RC1+3)/3),3)*5+3,FALSE) -> 104|132|133|134|162 | K144: =HLOOKUP(Sheet1!R2C1,Sheet1!R2C1:R16C1,MOD(RC1-1,3)+MOD(INT((RC1-1)/3),3)*5+3,FALSE)&"|"&HLOOKUP(Sheet1!R2C1,Sheet1!R2C1:R16C1,MOD(RC1,3)+MOD(INT((RC1)/3),3)*5+3,FALSE)&"|"&HLOOKUP(Sheet1!R2C1,Sheet1!R2C1:R16C1,MOD(RC1+1,3)+MOD(INT((RC1+1)/3),3)*5+3,FALSE)&"|"&HLOOKUP(Sheet1!R2C1,Sheet1!R2C1:R16C1,MOD(RC1+2,3)+MOD(INT((RC1+2)/3),3)*5+3,FALSE)&"|"&HLOOKUP(Sheet1!R2C1,Sheet1!R2C1:R16C1,MOD(RC1+3,3)+MOD(INT((RC1+3)/3),3)*5+3,FALSE) -> 104|132|133|134|162 | L144: 25|22|23|24 | M144: 451499|451499|451500|451500 | N144: 10030|10031|10032|10033 | O144: 1|1|1|1 | P144: 2500|2500|2500|2500
A145: 139 | B145: 137 | C145: 30 | D145: =R[-20]C+2 -> 32 | E145: 1000 | F145: =MOD(RC[-5]-1,3)*30+100&"|"&MOD(RC[-5]-1,3)*30+101&"|"&MOD(RC[-5]-1,3)*30+102&"|"&MOD(RC[-5]-1,3)*30+103&"|"&IF(MOD(RC[-5],4)=0,HLOOKUP(Sheet1!R2C10,Sheet1!R2C10:R7C10,MOD(RC[-5]/4-1,6)+1,FALSE),IF(MOD(RC[-5],2)=0,IF(RC[-5]>20,HLOOKUP(Sheet1!R2C7,Sheet1!R2C7:R43C7,MOD(RC[-5]/2-1,42)+1,FALSE),HLOOKUP(Sheet1!R2C4,Sheet1!R2C4:R7C4,MOD(RC[-5]-1,6)+1,FALSE)),MOD(RC[-5]-1,3)*30+104)) -> 100|101|102|103|104 | G145: =HLOOKUP(Sheet1!R2C1,Sheet1!R2C1:R16C1,MOD(RC1-1,2)+MOD(INT((RC1-1)/2),3)*5+1,FALSE)&"|"&HLOOKUP(Sheet1!R2C1,Sheet1!R2C1:R16C1,MOD(RC1,2)+MOD(INT((RC1)/2),3)*5+1,FALSE)&"|"&HLOOKUP(Sheet1!R2C1,Sheet1!R2C1:R16C1,MOD(RC1+1,2)+MOD(INT((RC1+1)/2),3)*5+1,FALSE)&"|"&HLOOKUP(Sheet1!R2C1,Sheet1!R2C1:R16C1,MOD(RC1+2,2)+MOD(INT((RC1+2)/2),3)*5+1,FALSE)&"|"&HLOOKUP(Sheet1!R2C1,Sheet1!R2C1:R16C1,MOD(RC1+3,2)+MOD(INT((RC1+3)/2),3)*5+1,FALSE) -> 100|101|130|131|160 | H145: =HLOOKUP(Sheet1!R2C1,Sheet1!R2C1:R16C1,MOD(RC1+2,2)+MOD(INT((RC1+2)/2),3)*5+1,FALSE)&"|"&HLOOKUP(Sheet1!R2C1,Sheet1!R2C1:R16C1,MOD(RC1+3,2)+MOD(INT((RC1+3)/2),3)*5+1,FALSE)&"|"&HLOOKUP(Sheet1!R2C1,Sheet1!R2C1:R16C1,MOD(RC1+4,2)+MOD(INT((RC1+4)/2),3)*5+1,FALSE)&"|"&HLOOKUP(Sheet1!R2C1,Sheet1!R2C1:R16C1,MOD(RC1+5,2)+MOD(INT((RC1+5)/2),3)*5+1,FALSE)&"|"&HLOOKUP(Sheet1!R2C1,Sheet1!R2C1:R16C1,MOD(RC1+6,2)+MOD(INT((RC1+6)/2),3)*5+1,FALSE) -> 131|160|161|100|101 | I145: =HLOOKUP(Sheet1!R2C1,Sheet1!R2C1:R16C1,MOD(RC1-1,3)+MOD(INT((RC1-1)/3),3)*5+3,FALSE)&"|"&HLOOKUP(Sheet1!R2C1,Sheet1!R2C1:R16C1,MOD(RC1,3)+MOD(INT((RC1)/3),3)*5+3,FALSE)&"|"&HLOOKUP(Sheet1!R2C1,Sheet1!R2C1:R16C1,MOD(RC1+1,3)+MOD(INT((RC1+1)/3),3)*5+3,FALSE)&"|"&HLOOKUP(Sheet1!R2C1,Sheet1!R2C1:R16C1,MOD(RC1+2,3)+MOD(INT((RC1+2)/3),3)*5+3,FALSE)&"|"&HLOOKUP(Sheet1!R2C1,Sheet1!R2C1:R16C1,MOD(RC1+3,3)+MOD(INT((RC1+3)/3),3)*5+3,FALSE) -> 132|133|134|162|163 | J145: =HLOOKUP(Sheet1!R2C1,Sheet1!R2C1:R16C1,MOD(RC1-1,3)+MOD(INT((RC1-1)/3),3)*5+3,FALSE)&"|"&HLOOKUP(Sheet1!R2C1,Sheet1!R2C1:R16C1,MOD(RC1,3)+MOD(INT((RC1)/3),3)*5+3,FALSE)&"|"&HLOOKUP(Sheet1!R2C1,Sheet1!R2C1:R16C1,MOD(RC1+1,3)+MOD(INT((RC1+1)/3),3)*5+3,FALSE)&"|"&HLOOKUP(Sheet1!R2C1,Sheet1!R2C1:R16C1,MOD(RC1+2,3)+MOD(INT((RC1+2)/3),3)*5+3,FALSE)&"|"&HLOOKUP(Sheet1!R2C1,Sheet1!R2C1:R16C1,MOD(RC1+3,3)+MOD(INT((RC1+3)/3),3)*5+3,FALSE) -> 132|133|134|162|163 | K145: =HLOOKUP(Sheet1!R2C1,Sheet1!R2C1:R16C1,MOD(RC1-1,3)+MOD(INT((RC1-1)/3),3)*5+3,FALSE)&"|"&HLOOKUP(Sheet1!R2C1,Sheet1!R2C1:R16C1,MOD(RC1,3)+MOD(INT((RC1)/3),3)*5+3,FALSE)&"|"&HLOOKUP(Sheet1!R2C1,Sheet1!R2C1:R16C1,MOD(RC1+1,3)+MOD(INT((RC1+1)/3),3)*5+3,FALSE)&"|"&HLOOKUP(Sheet1!R2C1,Sheet1!R2C1:R16C1,MOD(RC1+2,3)+MOD(INT((RC1+2)/3),3)*5+3,FALSE)&"|"&HLOOKUP(Sheet1!R2C1,Sheet1!R2C1:R16C1,MOD(RC1+3,3)+MOD(INT((RC1+3)/3),3)*5+3,FALSE) -> 132|133|134|162|163 | L145: 25|22|23|24 | M145: 460245|460245|460245|460245 | N145: 10030|10031|10032|10033 | O145: 1|1|1|1 | P145: 2500|2500|2500|2500
A146: 140 | B146: 138 | C146: 30 | D146: =R[-20]C+2 -> 32 | E146: 1000 | F146: =MOD(RC[-5]-1,3)*30+100&"|"&MOD(RC[-5]-1,3)*30+101&"|"&MOD(RC[-5]-1,3)*30+102&"|"&MOD(RC[-5]-1,3)*30+103&"|"&IF(MOD(RC[-5],4)=0,HLOOKUP(Sheet1!R2C10,Sheet1!R2C10:R7C10,MOD(RC[-5]/4-1,6)+1,FALSE),IF(MOD(RC[-5],2)=0,IF(RC[-5]>20,HLOOKUP(Sheet1!R2C7,Sheet1!R2C7:R43C7,MOD(RC[-5]/2-1,42)+1,FALSE),HLOOKUP(Sheet1!R2C4,Sheet1!R2C4:R7C4,MOD(RC[-5]-1,6)+1,FALSE)),MOD(RC[-5]-1,3)*30+104)) -> 130|131|132|133|194 | G146: =HLOOKUP(Sheet1!R2C1,Sheet1!R2C1:R16C1,MOD(RC1-1,2)+MOD(INT((RC1-1)/2),3)*5+1,FALSE)&"|"&HLOOKUP(Sheet1!R2C1,Sheet1!R2C1:R16C1,MOD(RC1,2)+MOD(INT((RC1)/2),3)*5+1,FALSE)&"|"&HLOOKUP(Sheet1!R2C1,Sheet1!R2C1:R16C1,MOD(RC1+1,2)+MOD(INT((RC1+1)/2),3)*5+1,FALSE)&"|"&HLOOKUP(Sheet1!R2C1,Sheet1!R2C1:R16C1,MOD(RC1+2,2)+MOD(INT((RC1+2)/2),3)*5+1,FALSE)&"|"&HLOOKUP(Sheet1!R2C1,Sheet1!R2C1:R16C1,MOD(RC1+3,2)+MOD(INT((RC1+3)/2),3)*5+1,FALSE) -> 101|130|131|160|161 | H146: =HLOOKUP(Sheet1!R2C1,Sheet1!R2C1:R16C1,MOD(RC1+2,2)+MOD(INT((RC1+2)/2),3)*5+1,FALSE)&"|"&HLOOKUP(Sheet1!R2C1,Sheet1!R2C1:R16C1,MOD(RC1+3,2)+MOD(INT((RC1+3)/2),3)*5+1,FALSE)&"|"&HLOOKUP(Sheet1!R2C1,Sheet1!R2C1:R16C1,MOD(RC1+4,2)+MOD(INT((RC1+4)/2),3)*5+1,FALSE)&"|"&HLOOKUP(Sheet1!R2C1,Sheet1!R2C1:R16C1,MOD(RC1+5,2)+MOD(INT((RC1+5)/2),3)*5+1,FALSE)&"|"&HLOOKUP(Sheet1!R2C1,Sheet1!R2C1:R16C1,MOD(RC1+6,2)+MOD(INT((RC1+6)/2),3)*5+1,FALSE) -> 160|161|100|101|130 | I146: =HLOOKUP(Sheet1!R2C1,Sheet1!R2C1:R16C1,MOD(RC1-1,3)+MOD(INT((RC1-1)/3),3)*5+3,FALSE)&"|"&HLOOKUP(Sheet1!R2C1,Sheet1!R2C1:R16C1,MOD(RC1,3)+MOD(INT((RC1)/3),3)*5+3,FALSE)&"|"&HLOOKUP(Sheet1!R2C1,Sheet1!R2C1:R16C1,MOD(RC1+1,3)+MOD(INT((RC1+1)/3),3)*5+3,FALSE)&"|"&HLOOKUP(Sheet1!R2C1,Sheet1!R2C1:R16C1,MOD(RC1+2,3)+MOD(INT((RC1+2)/3),3)*5+3,FALSE)&"|"&HLOOKUP(Sheet1!R2C1,Sheet1!R2C1:R16C1,MOD(RC1+3,3)+MOD(INT((RC1+3)/3),3)*5+3,FALSE) -> 133|134|162|163|164 | J146: =HLOOKUP(Sheet1!R2C1,Sheet1!R2C1:R16C1,MOD(RC1-1,3)+MOD(INT((RC1-1)/3),3)*5+3,FALSE)&"|"&HLOOKUP(Sheet1!R2C1,Sheet1!R2C1:R16C1,MOD(RC1,3)+MOD(INT((RC1)/3),3)*5+3,FALSE)&"|"&HLOOKUP(Sheet1!R2C1,Sheet1!R2C1:R16C1,MOD(RC1+1,3)+MOD(INT((RC1+1)/3),3)*5+3,FALSE)&"|"&HLOOKUP(Sheet1!R2C1,Sheet1!R2C1:R16C1,MOD(RC1+2,3)+MOD(INT((RC1+2)/3),3)*5+3,FALSE)&"|"&HLOOKUP(Sheet1!R2C1,Sheet1!R2C1:R16C1,MOD(RC1+3,3)+MOD(INT((RC1+3)/3),3)*5+3,FALSE) -> 133|134|162|163|164 | K146: =HLOOKUP(Sheet1!R2C1,Sheet1!R2C1:R16C1,MOD(RC1-1,3)+MOD(INT((RC1-1)/3),3)*5+3,FALSE)&"|"&HLOOKUP(Sheet1!R2C1,Sheet1!R2C1:R16C1,MOD(RC1,3)+MOD(INT((RC1)/3),3)*5+3,FALSE)&"|"&HLOOKUP(Sheet1!R2C1,Sheet1!R2C1:R16C1,MOD(RC1+1,3)+MOD(INT((RC1+1)/3),3)*5+3,FALSE)&"|"&HLOOKUP(Sheet1!R2C1,Sheet1!R2C1:R16C1,MOD(RC1+2,3)+MOD(INT((RC1+2)/3),3)*5+3,FALSE)&"|"&HLOOKUP(Sheet1!R2C1,Sheet1!R2C1:R16C1,MOD(RC1+3,3)+MOD(INT((RC1+3)/3),3)*5+3,FALSE) -> 133|134|162|163|164 | L146: 25|22|23|24 | M146: 468143|468143|468143|468143 | N146: 10030|10031|10032|10033|10030|10031|10032|10033|10030|10031|10032|10033|10030|10031|10032|10033|10030|10031|10032|10033|10030|10031|10032|10033|10030|10031|10032|10033|10030|10031|10032|10033|10030|10031|10032|10033|10030|10031|10032|10033 | O146: 1|1|1|1|1|1|1|1|1|1|1|1|1|1|1|1|1|1|1|1|1|1|1|1|1|1|1|1|1|1|1|1|1|1|1|1|1|1|1|1 | P146: 2500|2500|2500|2500|2500|2500|2500|2500|2500|2500|2500|2500|2500|2500|2500|2500|2500|2500|2500|2500|2500|2500|2500|2500|2500|2500|2500|2500|2500|2500|2500|2500|2500|2500|2500|2500|2500|2500|2500|2500
A147: 141 | B147: 139 | C147: 30 | D147: =R[-20]C+2 -> 34 | E147: 1000 | F147: =MOD(RC[-5]-1,3)*30+100&"|"&MOD(RC[-5]-1,3)*30+101&"|"&MOD(RC[-5]-1,3)*30+102&"|"&MOD(RC[-5]-1,3)*30+103&"|"&IF(MOD(RC[-5],4)=0,HLOOKUP(Sheet1!R2C10,Sheet1!R2C10:R7C10,MOD(RC[-5]/4-1,6)+1,FALSE),IF(MOD(RC[-5],2)=0,IF(RC[-5]>20,HLOOKUP(Sheet1!R2C7,Sheet1!R2C7:R43C7,MOD(RC[-5]/2-1,42)+1,FALSE),HLOOKUP(Sheet1!R2C4,Sheet1!R2C4:R7C4,MOD(RC[-5]-1,6)+1,FALSE)),MOD(RC[-5]-1,3)*30+104)) -> 160|161|162|163|164 | G147: =HLOOKUP(Sheet1!R2C1,Sheet1!R2C1:R16C1,MOD(RC1-1,2)+MOD(INT((RC1-1)/2),3)*5+1,FALSE)&"|"&HLOOKUP(Sheet1!R2C1,Sheet1!R2C1:R16C1,MOD(RC1,2)+MOD(INT((RC1)/2),3)*5+1,FALSE)&"|"&HLOOKUP(Sheet1!R2C1,Sheet1!R2C1:R16C1,MOD(RC1+1,2)+MOD(INT((RC1+1)/2),3)*5+1,FALSE)&"|"&HLOOKUP(Sheet1!R2C1,Sheet1!R2C1:R16C1,MOD(RC1+2,2)+MOD(INT((RC1+2)/2),3)*5+1,FALSE)&"|"&HLOOKUP(Sheet1!R2C1,Sheet1!R2C1:R16C1,MOD(RC1+3,2)+MOD(INT((RC1+3)/2),3)*5+1,FALSE) -> 130|131|160|161|100 | H147: =HLOOKUP(Sheet1!R2C1,Sheet1!R2C1:R16C1,MOD(RC1+2,2)+MOD(INT((RC1+2)/2),3)*5+1,FALSE)&"|"&HLOOKUP(Sheet1!R2C1,Sheet1!R2C1:R16C1,MOD(RC1+3,2)+MOD(INT((RC1+3)/2),3)*5+1,FALSE)&"|"&HLOOKUP(Sheet1!R2C1,Sheet1!R2C1:R16C1,MOD(RC1+4,2)+MOD(INT((RC1+4)/2),3)*5+1,FALSE)&"|"&HLOOKUP(Sheet1!R2C1,Sheet1!R2C1:R16C1,MOD(RC1+5,2)+MOD(INT((RC1+5)/2),3)*5+1,FALSE)&"|"&HLOOKUP(Sheet1!R2C1,Sheet1!R2C1:R16C1,MOD(RC1+6,2)+MOD(INT((RC1+6)/2),3)*5+1,FALSE) -> 161|100|101|130|131 | I147: =HLOOKUP(Sheet1!R2C1,Sheet1!R2C1:R16C1,MOD(RC1-1,3)+MOD(INT((RC1-1)/3),3)*5+3,FALSE)&"|"&HLOOKUP(Sheet1!R2C1,Sheet1!R2C1:R16C1,MOD(RC1,3)+MOD(INT((RC1)/3),3)*5+3,FALSE)&"|"&HLOOKUP(Sheet1!R2C1,Sheet1!R2C1:R16C1,MOD(RC1+1,3)+MOD(INT((RC1+1)/3),3)*5+3,FALSE)&"|"&HLOOKUP(Sheet1!R2C1,Sheet1!R2C1:R16C1,MOD(RC1+2,3)+MOD(INT((RC1+2)/3),3)*5+3,FALSE)&"|"&HLOOKUP(Sheet1!R2C1,Sheet1!R2C1:R16C1,MOD(RC1+3,3)+MOD(INT((RC1+3)/3),3)*5+3,FALSE) -> 134|162|163|164|102 | J147: =HLOOKUP(Sheet1!R2C1,Sheet1!R2C1:R16C1,MOD(RC1-1,3)+MOD(INT((RC1-1)/3),3)*5+3,FALSE)&"|"&HLOOKUP(Sheet1!R2C1,Sheet1!R2C1:R16C1,MOD(RC1,3)+MOD(INT((RC1)/3),3)*5+3,FALSE)&"|"&HLOOKUP(Sheet1!R2C1,Sheet1!R2C1:R16C1,MOD(RC1+1,3)+MOD(INT((RC1+1)/3),3)*5+3,FALSE)&"|"&HLOOKUP(Sheet1!R2C1,Sheet1!R2C1:R16C1,MOD(RC1+2,3)+MOD(INT((RC1+2)/3),3)*5+3,FALSE)&"|"&HLOOKUP(Sheet1!R2C1,Sheet1!R2C1:R16C1,MOD(RC1+3,3)+MOD(INT((RC1+3)/3),3)*5+3,FALSE) -> 134|162|163|164|102 | K147: =HLOOKUP(Sheet1!R2C1,Sheet1!R2C1:R16C1,MOD(RC1-1,3)+MOD(INT((RC1-1)/3),3)*5+3,FALSE)&"|"&HLOOKUP(Sheet1!R2C1,Sheet1!R2C1:R16C1,MOD(RC1,3)+MOD(INT((RC1)/3),3)*5+3,FALSE)&"|"&HLOOKUP(Sheet1!R2C1,Sheet1!R2C1:R16C1,MOD(RC1+1,3)+MOD(INT((RC1+1)/3),3)*5+3,FALSE)&"|"&HLOOKUP(Sheet1!R2C1,Sheet1!R2C1:R16C1,MOD(RC1+2,3)+MOD(INT((RC1+2)/3),3)*5+3,FALSE)&"|"&HLOOKUP(Sheet1!R2C1,Sheet1!R2C1:R16C1,MOD(RC1+3,3)+MOD(INT((RC1+3)/3),3)*5+3,FALSE) -> 134|162|163|164|102 | L147: 25|22|23|24 | M147: 474576|474576|474575|474575 | N147: 10030|10031|10032|10033 | O147: 1|1|1|1 | P147: 2500|2500|2500|2500
A148: 142 | B148: 140 | C148: 30 | D148: =R[-20]C+2 -> 34 | E148: 1000 | F148: =MOD(RC[-5]-1,3)*30+100&"|"&MOD(RC[-5]-1,3)*30+101&"|"&MOD(RC[-5]-1,3)*30+102&"|"&MOD(RC[-5]-1,3)*30+103&"|"&IF(MOD(RC[-5],4)=0,HLOOKUP(Sheet1!R2C10,Sheet1!R2C10:R7C10,MOD(RC[-5]/4-1,6)+1,FALSE),IF(MOD(RC[-5],2)=0,IF(RC[-5]>20,HLOOKUP(Sheet1!R2C7,Sheet1!R2C7:R43C7,MOD(RC[-5]/2-1,42)+1,FALSE),HLOOKUP(Sheet1!R2C4,Sheet1!R2C4:R7C4,MOD(RC[-5]-1,6)+1,FALSE)),MOD(RC[-5]-1,3)*30+104)) -> 100|101|102|103|172 | G148: =HLOOKUP(Sheet1!R2C1,Sheet1!R2C1:R16C1,MOD(RC1-1,2)+MOD(INT((RC1-1)/2),3)*5+1,FALSE)&"|"&HLOOKUP(Sheet1!R2C1,Sheet1!R2C1:R16C1,MOD(RC1,2)+MOD(INT((RC1)/2),3)*5+1,FALSE)&"|"&HLOOKUP(Sheet1!R2C1,Sheet1!R2C1:R16C1,MOD(RC1+1,2)+MOD(INT((RC1+1)/2),3)*5+1,FALSE)&"|"&HLOOKUP(Sheet1!R2C1,Sheet1!R2C1:R16C1,MOD(RC1+2,2)+MOD(INT((RC1+2)/2),3)*5+1,FALSE)&"|"&HLOOKUP(Sheet1!R2C1,Sheet1!R2C1:R16C1,MOD(RC1+3,2)+MOD(INT((RC1+3)/2),3)*5+1,FALSE) -> 131|160|161|100|101 | H148: =HLOOKUP(Sheet1!R2C1,Sheet1!R2C1:R16C1,MOD(RC1+2,2)+MOD(INT((RC1+2)/2),3)*5+1,FALSE)&"|"&HLOOKUP(Sheet1!R2C1,Sheet1!R2C1:R16C1,MOD(RC1+3,2)+MOD(INT((RC1+3)/2),3)*5+1,FALSE)&"|"&HLOOKUP(Sheet1!R2C1,Sheet1!R2C1:R16C1,MOD(RC1+4,2)+MOD(INT((RC1+4)/2),3)*5+1,FALSE)&"|"&HLOOKUP(Sheet1!R2C1,Sheet1!R2C1:R16C1,MOD(RC1+5,2)+MOD(INT((RC1+5)/2),3)*5+1,FALSE)&"|"&HLOOKUP(Sheet1!R2C1,Sheet1!R2C1:R16C1,MOD(RC1+6,2)+MOD(INT((RC1+6)/2),3)*5+1,FALSE) -> 100|101|130|131|160 | I148: =HLOOKUP(Sheet1!R2C1,Sheet1!R2C1:R16C1,MOD(RC1-1,3)+MOD(INT((RC1-1)/3),3)*5+3,FALSE)&"|"&HLOOKUP(Sheet1!R2C1,Sheet1!R2C1:R16C1,MOD(RC1,3)+MOD(INT((RC1)/3),3)*5+3,FALSE)&"|"&HLOOKUP(Sheet1!R2C1,Sheet1!R2C1:R16C1,MOD(RC1+1,3)+MOD(INT((RC1+1)/3),3)*5+3,FALSE)&"|"&HLOOKUP(Sheet1!R2C1,Sheet1!R2C1:R16C1,MOD(RC1+2,3)+MOD(INT((RC1+2)/3),3)*5+3,FALSE)&"|"&HLOOKUP(Sheet1!R2C1,Sheet1!R2C1:R16C1,MOD(RC1+3,3)+MOD(INT((RC1+3)/3),3)*5+3,FALSE) -> 162|163|164|102|103 | J148: =HLOOKUP(Sheet1!R2C1,Sheet1!R2C1:R16C1,MOD(RC1-1,3)+MOD(INT((RC1-1)/3),3)*5+3,FALSE)&"|"&HLOOKUP(Sheet1!R2C1,Sheet1!R2C1:R16C1,MOD(RC1,3)+MOD(INT((RC1)/3),3)*5+3,FALSE)&"|"&HLOOKUP(Sheet1!R2C1,Sheet1!R2C1:R16C1,MOD(RC1+1,3)+MOD(INT((RC1+1)/3),3)*5+3,FALSE)&"|"&HLOOKUP(Sheet1!R2C1,Sheet1!R2C1:R16C1,MOD(RC1+2,3)+MOD(INT((RC1+2)/3),3)*5+3,FALSE)&"|"&HLOOKUP(Sheet1!R2C1,Sheet1!R2C1:R16C1,MOD(RC1+3,3)+MOD(INT((RC1+3)/3),3)*5+3,FALSE) -> 162|163|164|102|103 | K148: =HLOOKUP(Sheet1!R2C1,Sheet1!R2C1:R16C1,MOD(RC1-1,3)+MOD(INT((RC1-1)/3),3)*5+3,FALSE)&"|"&HLOOKUP(Sheet1!R2C1,Sheet1!R2C1:R16C1,MOD(RC1,3)+MOD(INT((RC1)/3),3)*5+3,FALSE)&"|"&HLOOKUP(Sheet1!R2C1,Sheet1!R2C1:R16C1,MOD(RC1+1,3)+MOD(INT((RC1+1)/3),3)*5+3,FALSE)&"|"&HLOOKUP(Sheet1!R2C1,Sheet1!R2C1:R16C1,MOD(RC1+2,3)+MOD(INT((RC1+2)/3),3)*5+3,FALSE)&"|"&HLOOKUP(Sheet1!R2C1,Sheet1!R2C1:R16C1,MOD(RC1+3,3)+MOD(INT((RC1+3)/3),3)*5+3,FALSE) -> 162|163|164|102|103 | L148: 25|22|23|24 | M148: 480794|480795|480795|480795 | N148: 10030|10031|10032|10033 | O148: 1|1|1|1 | P148: 2500|2500|2500|2500
A149: 143 | B149: 141 | C149: 30 | D149: =R[-20]C+2 -> 34 | E149: 1000 | F149: =MOD(RC[-5]-1,3)*30+100&"|"&MOD(RC[-5]-1,3)*30+101&"|"&MOD(RC[-5]-1,3)*30+102&"|"&MOD(RC[-5]-1,3)*30+103&"|"&IF(MOD(RC[-5],4)=0,HLOOKUP(Sheet1!R2C10,Sheet1!R2C10:R7C10,MOD(RC[-5]/4-1,6)+1,FALSE),IF(MOD(RC[-5],2)=0,IF(RC[-5]>20,HLOOKUP(Sheet1!R2C7,Sheet1!R2C7:R43C7,MOD(RC[-5]/2-1,42)+1,FALSE),HLOOKUP(Sheet1!R2C4,Sheet1!R2C4:R7C4,MOD(RC[-5]-1,6)+1,FALSE)),MOD(RC[-5]-1,3)*30+104)) -> 130|131|132|133|134 | G149: =HLOOKUP(Sheet1!R2C1,Sheet1!R2C1:R16C1,MOD(RC1-1,2)+MOD(INT((RC1-1)/2),3)*5+1,FALSE)&"|"&HLOOKUP(Sheet1!R2C1,Sheet1!R2C1:R16C1,MOD(RC1,2)+MOD(INT((RC1)/2),3)*5+1,FALSE)&"|"&HLOOKUP(Sheet1!R2C1,Sheet1!R2C1:R16C1,MOD(RC1+1,2)+MOD(INT((RC1+1)/2),3)*5+1,FALSE)&"|"&HLOOKUP(Sheet1!R2C1,Sheet1!R2C1:R16C1,MOD(RC1+2,2)+MOD(INT((RC1+2)/2),3)*5+1,FALSE)&"|"&HLOOKUP(Sheet1!R2C1,Sheet1!R2C1:R16C1,MOD(RC1+3,2)+MOD(INT((RC1+3)/2),3)*5+1,FALSE) -> 160|161|100|101|130 | H149: =HLOOKUP(Sheet1!R2C1,Sheet1!R2C1:R16C1,MOD(RC1+2,2)+MOD(INT((RC1+2)/2),3)*5+1,FALSE)&"|"&HLOOKUP(Sheet1!R2C1,Sheet1!R2C1:R16C1,MOD(RC1+3,2)+MOD(INT((RC1+3)/2),3)*5+1,FALSE)&"|"&HLOOKUP(Sheet1!R2C1,Sheet1!R2C1:R16C1,MOD(RC1+4,2)+MOD(INT((RC1+4)/2),3)*5+1,FALSE)&"|"&HLOOKUP(Sheet1!R2C1,Sheet1!R2C1:R16C1,MOD(RC1+5,2)+MOD(INT((RC1+5)/2),3)*5+1,FALSE)&"|"&HLOOKUP(Sheet1!R2C1,Sheet1!R2C1:R16C1,MOD(RC1+6,2)+MOD(INT((RC1+6)/2),3)*5+1,FALSE) -> 101|130|131|160|161 | I149: =HLOOKUP(Sheet1!R2C1,Sheet1!R2C1:R16C1,MOD(RC1-1,3)+MOD(INT((RC1-1)/3),3)*5+3,FALSE)&"|"&HLOOKUP(Sheet1!R2C1,Sheet1!R2C1:R16C1,MOD(RC1,3)+MOD(INT((RC1)/3),3)*5+3,FALSE)&"|"&HLOOKUP(Sheet1!R2C1,Sheet1!R2C1:R16C1,MOD(RC1+1,3)+MOD(INT((RC1+1)/3),3)*5+3,FALSE)&"|"&HLOOKUP(Sheet1!R2C1,Sheet1!R2C1:R16C1,MOD(RC1+2,3)+MOD(INT((RC1+2)/3),3)*5+3,FALSE)&"|"&HLOOKUP(Sheet1!R2C1,Sheet1!R2C1:R16C1,MOD(RC1+3,3)+MOD(INT((RC1+3)/3),3)*5+3,FALSE) -> 163|164|102|103|104 | J149: =HLOOKUP(Sheet1!R2C1,Sheet1!R2C1:R16C1,MOD(RC1-1,3)+MOD(INT((RC1-1)/3),3)*5+3,FALSE)&"|"&HLOOKUP(Sheet1!R2C1,Sheet1!R2C1:R16C1,MOD(RC1,3)+MOD(INT((RC1)/3),3)*5+3,FALSE)&"|"&HLOOKUP(Sheet1!R2C1,Sheet1!R2C1:R16C1,MOD(RC1+1,3)+MOD(INT((RC1+1)/3),3)*5+3,FALSE)&"|"&HLOOKUP(Sheet1!R2C1,Sheet1!R2C1:R16C1,MOD(RC1+2,3)+MOD(INT((RC1+2)/3),3)*5+3,FALSE)&"|"&HLOOKUP(Sheet1!R2C1,Sheet1!R2C1:R16C1,MOD(RC1+3,3)+MOD(INT((RC1+3)/3),3)*5+3,FALSE) -> 163|164|102|103|104 | K149: =HLOOKUP(Sheet1!R2C1,Sheet1!R2C1:R16C1,MOD(RC1-1,3)+MOD(INT((RC1-1)/3),3)*5+3,FALSE)&"|"&HLOOKUP(Sheet1!R2C1,Sheet1!R2C1:R16C1,MOD(RC1,3)+MOD(INT((RC1)/3),3)*5+3,FALSE)&"|"&HLOOKUP(Sheet1!R2C1,Sheet1!R2C1:R16C1,MOD(RC1+1,3)+MOD(INT((RC1+1)/3),3)*5+3,FALSE)&"|"&HLOOKUP(Sheet1!R2C1,Sheet1!R2C1:R16C1,MOD(RC1+2,3)+MOD(INT((RC1+2)/3),3)*5+3,FALSE)&"|"&HLOOKUP(Sheet1!R2C1,Sheet1!R2C1:R16C1,MOD(RC1+3,3)+MOD(INT((RC1+3)/3),3)*5+3,FALSE) -> 163|164|102|103|104 | L149: 25|22|23|24 | M149: 487228|487228|487228|487228 | N149: 10030|10031|10032|10033 | O149: 1|1|1|1 | P149: 2500|2500|2500|2500
A150: 144 | B150: 142 | C150: 30 | D150: =R[-20]C+2 -> 34 | E150: 1000 | F150: =MOD(RC[-5]-1,3)*30+100&"|"&MOD(RC[-5]-1,3)*30+101&"|"&MOD(RC[-5]-1,3)*30+102&"|"&MOD(RC[-5]-1,3)*30+103&"|"&IF(MOD(RC[-5],4)=0,HLOOKUP(Sheet1!R2C10,Sheet1!R2C10:R7C10,MOD(RC[-5]/4-1,6)+1,FALSE),IF(MOD(RC[-5],2)=0,IF(RC[-5]>20,HLOOKUP(Sheet1!R2C7,Sheet1!R2C7:R43C7,MOD(RC[-5]/2-1,42)+1,FALSE),HLOOKUP(Sheet1!R2C4,Sheet1!R2C4:R7C4,MOD(RC[-5]-1,6)+1,FALSE)),MOD(RC[-5]-1,3)*30+104)) -> 160|161|162|163|195 | G150: =HLOOKUP(Sheet1!R2C1,Sheet1!R2C1:R16C1,MOD(RC1-1,2)+MOD(INT((RC1-1)/2),3)*5+1,FALSE)&"|"&HLOOKUP(Sheet1!R2C1,Sheet1!R2C1:R16C1,MOD(RC1,2)+MOD(INT((RC1)/2),3)*5+1,FALSE)&"|"&HLOOKUP(Sheet1!R2C1,Sheet1!R2C1:R16C1,MOD(RC1+1,2)+MOD(INT((RC1+1)/2),3)*5+1,FALSE)&"|"&HLOOKUP(Sheet1!R2C1,Sheet1!R2C1:R16C1,MOD(RC1+2,2)+MOD(INT((RC1+2)/2),3)*5+1,FALSE)&"|"&HLOOKUP(Sheet1!R2C1,Sheet1!R2C1:R16C1,MOD(RC1+3,2)+MOD(INT((RC1+3)/2),3)*5+1,FALSE) -> 161|100|101|130|131 | H150: =HLOOKUP(Sheet1!R2C1,Sheet1!R2C1:R16C1,MOD(RC1+2,2)+MOD(INT((RC1+2)/2),3)*5+1,FALSE)&"|"&HLOOKUP(Sheet1!R2C1,Sheet1!R2C1:R16C1,MOD(RC1+3,2)+MOD(INT((RC1+3)/2),3)*5+1,FALSE)&"|"&HLOOKUP(Sheet1!R2C1,Sheet1!R2C1:R16C1,MOD(RC1+4,2)+MOD(INT((RC1+4)/2),3)*5+1,FALSE)&"|"&HLOOKUP(Sheet1!R2C1,Sheet1!R2C1:R16C1,MOD(RC1+5,2)+MOD(INT((RC1+5)/2),3)*5+1,FALSE)&"|"&HLOOKUP(Sheet1!R2C1,Sheet1!R2C1:R16C1,MOD(RC1+6,2)+MOD(INT((RC1+6)/2),3)*5+1,FALSE) -> 130|131|160|161|100 | I150: =HLOOKUP(Sheet1!R2C1,Sheet1!R2C1:R16C1,MOD(RC1-1,3)+MOD(INT((RC1-1)/3),3)*5+3,FALSE)&"|"&HLOOKUP(Sheet1!R2C1,Sheet1!R2C1:R16C1,MOD(RC1,3)+MOD(INT((RC1)/3),3)*5+3,FALSE)&"|"&HLOOKUP(Sheet1!R2C1,Sheet1!R2C1:R16C1,MOD(RC1+1,3)+MOD(INT((RC1+1)/3),3)*5+3,FALSE)&"|"&HLOOKUP(Sheet1!R2C1,Sheet1!R2C1:R16C1,MOD(RC1+2,3)+MOD(INT((RC1+2)/3),3)*5+3,FALSE)&"|"&HLOOKUP(Sheet1!R2C1,Sheet1!R2C1:R16C1,MOD(RC1+3,3)+MOD(INT((RC1+3)/3),3)*5+3,FALSE) -> 164|102|103|104|132 | J150: =HLOOKUP(Sheet1!R2C1,Sheet1!R2C1:R16C1,MOD(RC1-1,3)+MOD(INT((RC1-1)/3),3)*5+3,FALSE)&"|"&HLOOKUP(Sheet1!R2C1,Sheet1!R2C1:R16C1,MOD(RC1,3)+MOD(INT((RC1)/3),3)*5+3,FALSE)&"|"&HLOOKUP(Sheet1!R2C1,Sheet1!R2C1:R16C1,MOD(RC1+1,3)+MOD(INT((RC1+1)/3),3)*5+3,FALSE)&"|"&HLOOKUP(Sheet1!R2C1,Sheet1!R2C1:R16C1,MOD(RC1+2,3)+MOD(INT((RC1+2)/3),3)*5+3,FALSE)&"|"&HLOOKUP(Sheet1!R2C1,Sheet1!R2C1:R16C1,MOD(RC1+3,3)+MOD(INT((RC1+3)/3),3)*5+3,FALSE) -> 164|102|103|104|132 | K150: =HLOOKUP(Sheet1!R2C1,Sheet1!R2C1:R16C1,MOD(RC1-1,3)+MOD(INT((RC1-1)/3),3)*5+3,FALSE)&"|"&HLOOKUP(Sheet1!R2C1,Sheet1!R2C1:R16C1,MOD(RC1,3)+MOD(INT((RC1)/3),3)*5+3,FALSE)&"|"&HLOOKUP(Sheet1!R2C1,Sheet1!R2C1:R16C1,MOD(RC1+1,3)+MOD(INT((RC1+1)/3),3)*5+3,FALSE)&"|"&HLOOKUP(Sheet1!R2C1,Sheet1!R2C1:R16C1,MOD(RC1+2,3)+MOD(INT((RC1+2)/3),3)*5+3,FALSE)&"|"&HLOOKUP(Sheet1!R2C1,Sheet1!R2C1:R16C1,MOD(RC1+3,3)+MOD(INT((RC1+3)/3),3)*5+3,FALSE) -> 164|102|103|104|132 | L150: 25|22|23|24 | M150: 493828|493829|493828|493828 | N150: 10030|10031|10032|10033 | O150: 1|1|1|1 | P150: 2500|2500|2500|2500
A151: 145 | B151: 143 | C151: 30 | D151: =R[-20]C+2 -> 34 | E151: 1000 | F151: =MOD(RC[-5]-1,3)*30+100&"|"&MOD(RC[-5]-1,3)*30+101&"|"&MOD(RC[-5]-1,3)*30+102&"|"&MOD(RC[-5]-1,3)*30+103&"|"&IF(MOD(RC[-5],4)=0,HLOOKUP(Sheet1!R2C10,Sheet1!R2C10:R7C10,MOD(RC[-5]/4-1,6)+1,FALSE),IF(MOD(RC[-5],2)=0,IF(RC[-5]>20,HLOOKUP(Sheet1!R2C7,Sheet1!R2C7:R43C7,MOD(RC[-5]/2-1,42)+1,FALSE),HLOOKUP(Sheet1!R2C4,Sheet1!R2C4:R7C4,MOD(RC[-5]-1,6)+1,FALSE)),MOD(RC[-5]-1,3)*30+104)) -> 100|101|102|103|104 | G151: =HLOOKUP(Sheet1!R2C1,Sheet1!R2C1:R16C1,MOD(RC1-1,2)+MOD(INT((RC1-1)/2),3)*5+1,FALSE)&"|"&HLOOKUP(Sheet1!R2C1,Sheet1!R2C1:R16C1,MOD(RC1,2)+MOD(INT((RC1)/2),3)*5+1,FALSE)&"|"&HLOOKUP(Sheet1!R2C1,Sheet1!R2C1:R16C1,MOD(RC1+1,2)+MOD(INT((RC1+1)/2),3)*5+1,FALSE)&"|"&HLOOKUP(Sheet1!R2C1,Sheet1!R2C1:R16C1,MOD(RC1+2,2)+MOD(INT((RC1+2)/2),3)*5+1,FALSE)&"|"&HLOOKUP(Sheet1!R2C1,Sheet1!R2C1:R16C1,MOD(RC1+3,2)+MOD(INT((RC1+3)/2),3)*5+1,FALSE) -> 100|101|130|131|160 | H151: =HLOOKUP(Sheet1!R2C1,Sheet1!R2C1:R16C1,MOD(RC1+2,2)+MOD(INT((RC1+2)/2),3)*5+1,FALSE)&"|"&HLOOKUP(Sheet1!R2C1,Sheet1!R2C1:R16C1,MOD(RC1+3,2)+MOD(INT((RC1+3)/2),3)*5+1,FALSE)&"|"&HLOOKUP(Sheet1!R2C1,Sheet1!R2C1:R16C1,MOD(RC1+4,2)+MOD(INT((RC1+4)/2),3)*5+1,FALSE)&"|"&HLOOKUP(Sheet1!R2C1,Sheet1!R2C1:R16C1,MOD(RC1+5,2)+MOD(INT((RC1+5)/2),3)*5+1,FALSE)&"|"&HLOOKUP(Sheet1!R2C1,Sheet1!R2C1:R16C1,MOD(RC1+6,2)+MOD(INT((RC1+6)/2),3)*5+1,FALSE) -> 131|160|161|100|101 | I151: =HLOOKUP(Sheet1!R2C1,Sheet1!R2C1:R16C1,MOD(RC1-1,3)+MOD(INT((RC1-1)/3),3)*5+3,FALSE)&"|"&HLOOKUP(Sheet1!R2C1,Sheet1!R2C1:R16C1,MOD(RC1,3)+MOD(INT((RC1)/3),3)*5+3,FALSE)&"|"&HLOOKUP(Sheet1!R2C1,Sheet1!R2C1:R16C1,MOD(RC1+1,3)+MOD(INT((RC1+1)/3),3)*5+3,FALSE)&"|"&HLOOKUP(Sheet1!R2C1,Sheet1!R2C1:R16C1,MOD(RC1+2,3)+MOD(INT((RC1+2)/3),3)*5+3,FALSE)&"|"&HLOOKUP(Sheet1!R2C1,Sheet1!R2C1:R16C1,MOD(RC1+3,3)+MOD(INT((RC1+3)/3),3)*5+3,FALSE) -> 102|103|104|132|133 | J151: =HLOOKUP(Sheet1!R2C1,Sheet1!R2C1:R16C1,MOD(RC1-1,3)+MOD(INT((RC1-1)/3),3)*5+3,FALSE)&"|"&HLOOKUP(Sheet1!R2C1,Sheet1!R2C1:R16C1,MOD(RC1,3)+MOD(INT((RC1)/3),3)*5+3,FALSE)&"|"&HLOOKUP(Sheet1!R2C1,Sheet1!R2C1:R16C1,MOD(RC1+1,3)+MOD(INT((RC1+1)/3),3)*5+3,FALSE)&"|"&HLOOKUP(Sheet1!R2C1,Sheet1!R2C1:R16C1,MOD(RC1+2,3)+MOD(INT((RC1+2)/3),3)*5+3,FALSE)&"|"&HLOOKUP(Sheet1!R2C1,Sheet1!R2C1:R16C1,MOD(RC1+3,3)+MOD(INT((RC1+3)/3),3)*5+3,FALSE) -> 102|103|104|132|133 | K151: =HLOOKUP(Sheet1!R2C1,Sheet1!R2C1:R16C1,MOD(RC1-1,3)+MOD(INT((RC1-1)/3),3)*5+3,FALSE)&"|"&HLOOKUP(Sheet1!R2C1,Sheet1!R2C1:R16C1,MOD(RC1,3)+MOD(INT((RC1)/3),3)*5+3,FALSE)&"|"&HLOOKUP(Sheet1!R2C1,Sheet1!R2C1:R16C1,MOD(RC1+1,3)+MOD(INT((RC1+1)/3),3)*5+3,FALSE)&"|"&HLOOKUP(Sheet1!R2C1,Sheet1!R2C1:R16C1,MOD(RC1+2,3)+MOD(INT((RC1+2)/3),3)*5+3,FALSE)&"|"&HLOOKUP(Sheet1!R2C1,Sheet1!R2C1:R16C1,MOD(RC1+3,3)+MOD(INT((RC1+3)/3),3)*5+3,FALSE) -> 102|103|104|132|133 | L151: 25|22|23|24 | M151: 500209|500209|500210|500210 | N151: 10030|10031|10032|10033|10030|10031|10032|10033|10030|10031|10032|10033|10030|10031|10032|10033|10030|10031|10032|10033|10030|10031|10032|10033|10030|10031|10032|10033|10030|10031|10032|10033|10030|10031|10032|10033|10030|10031|10032|10033 | O151: 1|1|1|1|1|1|1|1|1|1|1|1|1|1|1|1|1|1|1|1|1|1|1|1|1|1|1|1|1|1|1|1|1|1|1|1|1|1|1|1 | P151: 2500|2500|2500|2500|2500|2500|2500|2500|2500|2500|2500|2500|2500|2500|2500|2500|2500|2500|2500|2500|2500|2500|2500|2500|2500|2500|2500|2500|2500|2500|2500|2500|2500|2500|2500|2500|2500|2500|2500|2500
A152: 146 | B152: 144 | C152: 30 | D152: =R[-20]C+2 -> 34 | E152: 1000 | F152: =MOD(RC[-5]-1,3)*30+100&"|"&MOD(RC[-5]-1,3)*30+101&"|"&MOD(RC[-5]-1,3)*30+102&"|"&MOD(RC[-5]-1,3)*30+103&"|"&IF(MOD(RC[-5],4)=0,HLOOKUP(Sheet1!R2C10,Sheet1!R2C10:R7C10,MOD(RC[-5]/4-1,6)+1,FALSE),IF(MOD(RC[-5],2)=0,IF(RC[-5]>20,HLOOKUP(Sheet1!R2C7,Sheet1!R2C7:R43C7,MOD(RC[-5]/2-1,42)+1,FALSE),HLOOKUP(Sheet1!R2C4,Sheet1!R2C4:R7C4,MOD(RC[-5]-1,6)+1,FALSE)),MOD(RC[-5]-1,3)*30+104)) -> 130|131|132|133|174 | G152: =HLOOKUP(Sheet1!R2C1,Sheet1!R2C1:R16C1,MOD(RC1-1,2)+MOD(INT((RC1-1)/2),3)*5+1,FALSE)&"|"&HLOOKUP(Sheet1!R2C1,Sheet1!R2C1:R16C1,MOD(RC1,2)+MOD(INT((RC1)/2),3)*5+1,FALSE)&"|"&HLOOKUP(Sheet1!R2C1,Sheet1!R2C1:R16C1,MOD(RC1+1,2)+MOD(INT((RC1+1)/2),3)*5+1,FALSE)&"|"&HLOOKUP(Sheet1!R2C1,Sheet1!R2C1:R16C1,MOD(RC1+2,2)+MOD(INT((RC1+2)/2),3)*5+1,FALSE)&"|"&HLOOKUP(Sheet1!R2C1,Sheet1!R2C1:R16C1,MOD(RC1+3,2)+MOD(INT((RC1+3)/2),3)*5+1,FALSE) -> 101|130|131|160|161 | H152: =HLOOKUP(Sheet1!R2C1,Sheet1!R2C1:R16C1,MOD(RC1+2,2)+MOD(INT((RC1+2)/2),3)*5+1,FALSE)&"|"&HLOOKUP(Sheet1!R2C1,Sheet1!R2C1:R16C1,MOD(RC1+3,2)+MOD(INT((RC1+3)/2),3)*5+1,FALSE)&"|"&HLOOKUP(Sheet1!R2C1,Sheet1!R2C1:R16C1,MOD(RC1+4,2)+MOD(INT((RC1+4)/2),3)*5+1,FALSE)&"|"&HLOOKUP(Sheet1!R2C1,Sheet1!R2C1:R16C1,MOD(RC1+5,2)+MOD(INT((RC1+5)/2),3)*5+1,FALSE)&"|"&HLOOKUP(Sheet1!R2C1,Sheet1!R2C1:R16C1,MOD(RC1+6,2)+MOD(INT((RC1+6)/2),3)*5+1,FALSE) -> 160|161|100|101|130 | I152: =HLOOKUP(Sheet1!R2C1,Sheet1!R2C1:R16C1,MOD(RC1-1,3)+MOD(INT((RC1-1)/3),3)*5+3,FALSE)&"|"&HLOOKUP(Sheet1!R2C1,Sheet1!R2C1:R16C1,MOD(RC1,3)+MOD(INT((RC1)/3),3)*5+3,FALSE)&"|"&HLOOKUP(Sheet1!R2C1,Sheet1!R2C1:R16C1,MOD(RC1+1,3)+MOD(INT((RC1+1)/3),3)*5+3,FALSE)&"|"&HLOOKUP(Sheet1!R2C1,Sheet1!R2C1:R16C1,MOD(RC1+2,3)+MOD(INT((RC1+2)/3),3)*5+3,FALSE)&"|"&HLOOKUP(Sheet1!R2C1,Sheet1!R2C1:R16C1,MOD(RC1+3,3)+MOD(INT((RC1+3)/3),3)*5+3,FALSE) -> 103|104|132|133|134 | J152: =HLOOKUP(Sheet1!R2C1,Sheet1!R2C1:R16C1,MOD(RC1-1,3)+MOD(INT((RC1-1)/3),3)*5+3,FALSE)&"|"&HLOOKUP(Sheet1!R2C1,Sheet1!R2C1:R16C1,MOD(RC1,3)+MOD(INT((RC1)/3),3)*5+3,FALSE)&"|"&HLOOKUP(Sheet1!R2C1,Sheet1!R2C1:R16C1,MOD(RC1+1,3)+MOD(INT((RC1+1)/3),3)*5+3,FALSE)&"|"&HLOOKUP(Sheet1!R2C1,Sheet1!R2C1:R16C1,MOD(RC1+2,3)+MOD(INT((RC1+2)/3),3)*5+3,FALSE)&"|"&HLOOKUP(Sheet1!R2C1,Sheet1!R2C1:R16C1,MOD(RC1+3,3)+MOD(INT((RC1+3)/3),3)*5+3,FALSE) -> 103|104|132|133|134 | K152: =HLOOKUP(Sheet1!R2C1,Sheet1!R2C1:R16C1,MOD(RC1-1,3)+MOD(INT((RC1-1)/3),3)*5+3,FALSE)&"|"&HLOOKUP(Sheet1!R2C1,Sheet1!R2C1:R16C1,MOD(RC1,3)+MOD(INT((RC1)/3),3)*5+3,FALSE)&"|"&HLOOKUP(Sheet1!R2C1,Sheet1!R2C1:R16C1,MOD(RC1+1,3)+MOD(INT((RC1+1)/3),3)*5+3,FALSE)&"|"&HLOOKUP(Sheet1!R2C1,Sheet1!R2C1:R16C1,MOD(RC1+2,3)+MOD(INT((RC1+2)/3),3)*5+3,FALSE)&"|"&HLOOKUP(Sheet1!R2C1,Sheet1!R2C1:R16C1,MOD(RC1+3,3)+MOD(INT((RC1+3)/3),3)*5+3,FALSE) -> 103|104|132|133|134 | L152: 25|22|23|24 | M152: 506810|506810|506810|506810 | N152: 10030|10031|10032|10033 | O152: 1|1|1|1 | P152: 2500|2500|2500|2500
A153: 147 | B153: 145 | C153: 30 | D153: =R[-20]C+2 -> 34 | E153: 1000 | F153: =MOD(RC[-5]-1,3)*30+100&"|"&MOD(RC[-5]-1,3)*30+101&"|"&MOD(RC[-5]-1,3)*30+102&"|"&MOD(RC[-5]-1,3)*30+103&"|"&IF(MOD(RC[-5],4)=0,HLOOKUP(Sheet1!R2C10,Sheet1!R2C10:R7C10,MOD(RC[-5]/4-1,6)+1,FALSE),IF(MOD(RC[-5],2)=0,IF(RC[-5]>20,HLOOKUP(Sheet1!R2C7,Sheet1!R2C7:R43C7,MOD(RC[-5]/2-1,42)+1,FALSE),HLOOKUP(Sheet1!R2C4,Sheet1!R2C4:R7C4,MOD(RC[-5]-1,6)+1,FALSE)),MOD(RC[-5]-1,3)*30+104)) -> 160|161|162|163|164 | G153: =HLOOKUP(Sheet1!R2C1,Sheet1!R2C1:R16C1,MOD(RC1-1,2)+MOD(INT((RC1-1)/2),3)*5+1,FALSE)&"|"&HLOOKUP(Sheet1!R2C1,Sheet1!R2C1:R16C1,MOD(RC1,2)+MOD(INT((RC1)/2),3)*5+1,FALSE)&"|"&HLOOKUP(Sheet1!R2C1,Sheet1!R2C1:R16C1,MOD(RC1+1,2)+MOD(INT((RC1+1)/2),3)*5+1,FALSE)&"|"&HLOOKUP(Sheet1!R2C1,Sheet1!R2C1:R16C1,MOD(RC1+2,2)+MOD(INT((RC1+2)/2),3)*5+1,FALSE)&"|"&HLOOKUP(Sheet1!R2C1,Sheet1!R2C1:R16C1,MOD(RC1+3,2)+MOD(INT((RC1+3)/2),3)*5+1,FALSE) -> 130|131|160|161|100 | H153: =HLOOKUP(Sheet1!R2C1,Sheet1!R2C1:R16C1,MOD(RC1+2,2)+MOD(INT((RC1+2)/2),3)*5+1,FALSE)&"|"&HLOOKUP(Sheet1!R2C1,Sheet1!R2C1:R16C1,MOD(RC1+3,2)+MOD(INT((RC1+3)/2),3)*5+1,FALSE)&"|"&HLOOKUP(Sheet1!R2C1,Sheet1!R2C1:R16C1,MOD(RC1+4,2)+MOD(INT((RC1+4)/2),3)*5+1,FALSE)&"|"&HLOOKUP(Sheet1!R2C1,Sheet1!R2C1:R16C1,MOD(RC1+5,2)+MOD(INT((RC1+5)/2),3)*5+1,FALSE)&"|"&HLOOKUP(Sheet1!R2C1,Sheet1!R2C1:R16C1,MOD(RC1+6,2)+MOD(INT((RC1+6)/2),3)*5+1,FALSE) -> 161|100|101|130|131 | I153: =HLOOKUP(Sheet1!R2C1,Sheet1!R2C1:R16C1,MOD(RC1-1,3)+MOD(INT((RC1-1)/3),3)*5+3,FALSE)&"|"&HLOOKUP(Sheet1!R2C1,Sheet1!R2C1:R16C1,MOD(RC1,3)+MOD(INT((RC1)/3),3)*5+3,FALSE)&"|"&HLOOKUP(Sheet1!R2C1,Sheet1!R2C1:R16C1,MOD(RC1+1,3)+MOD(INT((RC1+1)/3),3)*5+3,FALSE)&"|"&HLOOKUP(Sheet1!R2C1,Sheet1!R2C1:R16C1,MOD(RC1+2,3)+MOD(INT((RC1+2)/3),3)*5+3,FALSE)&"|"&HLOOKUP(Sheet1!R2C1,Sheet1!R2C1:R16C1,MOD(RC1+3,3)+MOD(INT((RC1+3)/3),3)*5+3,FALSE) -> 104|132|133|134|162 | J153: =HLOOKUP(Sheet1!R2C1,Sheet1!R2C1:R16C1,MOD(RC1-1,3)+MOD(INT((RC1-1)/3),3)*5+3,FALSE)&"|"&HLOOKUP(Sheet1!R2C1,Sheet1!R2C1:R16C1,MOD(RC1,3)+MOD(INT((RC1)/3),3)*5+3,FALSE)&"|"&HLOOKUP(Sheet1!R2C1,Sheet1!R2C1:R16C1,MOD(RC1+1,3)+MOD(INT((RC1+1)/3),3)*5+3,FALSE)&"|"&HLOOKUP(Sheet1!R2C1,Sheet1!R2C1:R16C1,MOD(RC1+2,3)+MOD(INT((RC1+2)/3),3)*5+3,FALSE)&"|"&HLOOKUP(Sheet1!R2C1,Sheet1!R2C1:R16C1,MOD(RC1+3,3)+MOD(INT((RC1+3)/3),3)*5+3,FALSE) -> 104|132|133|134|162 | K153: =HLOOKUP(Sheet1!R2C1,Sheet1!R2C1:R16C1,MOD(RC1-1,3)+MOD(INT((RC1-1)/3),3)*5+3,FALSE)&"|"&HLOOKUP(Sheet1!R2C1,Sheet1!R2C1:R16C1,MOD(RC1,3)+MOD(INT((RC1)/3),3)*5+3,FALSE)&"|"&HLOOKUP(Sheet1!R2C1,Sheet1!R2C1:R16C1,MOD(RC1+1,3)+MOD(INT((RC1+1)/3),3)*5+3,FALSE)&"|"&HLOOKUP(Sheet1!R2C1,Sheet1!R2C1:R16C1,MOD(RC1+2,3)+MOD(INT((RC1+2)/3),3)*5+3,FALSE)&"|"&HLOOKUP(Sheet1!R2C1,Sheet1!R2C1:R16C1,MOD(RC1+3,3)+MOD(INT((RC1+3)/3),3)*5+3,FALSE) -> 104|132|133|134|162 | L153: 25|22|23|24 | M153: 513328|513329|513328|513328 | N153: 10030|10031|10032|10033 | O153: 1|1|1|1 | P153: 2500|2500|2500|2500
A154: 148 | B154: 146 | C154: 30 | D154: =R[-20]C+2 -> 34 | E154: 1000 | F154: =MOD(RC[-5]-1,3)*30+100&"|"&MOD(RC[-5]-1,3)*30+101&"|"&MOD(RC[-5]-1,3)*30+102&"|"&MOD(RC[-5]-1,3)*30+103&"|"&IF(MOD(RC[-5],4)=0,HLOOKUP(Sheet1!R2C10,Sheet1!R2C10:R7C10,MOD(RC[-5]/4-1,6)+1,FALSE),IF(MOD(RC[-5],2)=0,IF(RC[-5]>20,HLOOKUP(Sheet1!R2C7,Sheet1!R2C7:R43C7,MOD(RC[-5]/2-1,42)+1,FALSE),HLOOKUP(Sheet1!R2C4,Sheet1!R2C4:R7C4,MOD(RC[-5]-1,6)+1,FALSE)),MOD(RC[-5]-1,3)*30+104)) -> 100|101|102|103|190 | G154: =HLOOKUP(Sheet1!R2C1,Sheet1!R2C1:R16C1,MOD(RC1-1,2)+MOD(INT((RC1-1)/2),3)*5+1,FALSE)&"|"&HLOOKUP(Sheet1!R2C1,Sheet1!R2C1:R16C1,MOD(RC1,2)+MOD(INT((RC1)/2),3)*5+1,FALSE)&"|"&HLOOKUP(Sheet1!R2C1,Sheet1!R2C1:R16C1,MOD(RC1+1,2)+MOD(INT((RC1+1)/2),3)*5+1,FALSE)&"|"&HLOOKUP(Sheet1!R2C1,Sheet1!R2C1:R16C1,MOD(RC1+2,2)+MOD(INT((RC1+2)/2),3)*5+1,FALSE)&"|"&HLOOKUP(Sheet1!R2C1,Sheet1!R2C1:R16C1,MOD(RC1+3,2)+MOD(INT((RC1+3)/2),3)*5+1,FALSE) -> 131|160|161|100|101 | H154: =HLOOKUP(Sheet1!R2C1,Sheet1!R2C1:R16C1,MOD(RC1+2,2)+MOD(INT((RC1+2)/2),3)*5+1,FALSE)&"|"&HLOOKUP(Sheet1!R2C1,Sheet1!R2C1:R16C1,MOD(RC1+3,2)+MOD(INT((RC1+3)/2),3)*5+1,FALSE)&"|"&HLOOKUP(Sheet1!R2C1,Sheet1!R2C1:R16C1,MOD(RC1+4,2)+MOD(INT((RC1+4)/2),3)*5+1,FALSE)&"|"&HLOOKUP(Sheet1!R2C1,Sheet1!R2C1:R16C1,MOD(RC1+5,2)+MOD(INT((RC1+5)/2),3)*5+1,FALSE)&"|"&HLOOKUP(Sheet1!R2C1,Sheet1!R2C1:R16C1,MOD(RC1+6,2)+MOD(INT((RC1+6)/2),3)*5+1,FALSE) -> 100|101|130|131|160 | I154: =HLOOKUP(Sheet1!R2C1,Sheet1!R2C1:R16C1,MOD(RC1-1,3)+MOD(INT((RC1-1)/3),3)*5+3,FALSE)&"|"&HLOOKUP(Sheet1!R2C1,Sheet1!R2C1:R16C1,MOD(RC1,3)+MOD(INT((RC1)/3),3)*5+3,FALSE)&"|"&HLOOKUP(Sheet1!R2C1,Sheet1!R2C1:R16C1,MOD(RC1+1,3)+MOD(INT((RC1+1)/3),3)*5+3,FALSE)&"|"&HLOOKUP(Sheet1!R2C1,Sheet1!R2C1:R16C1,MOD(RC1+2,3)+MOD(INT((RC1+2)/3),3)*5+3,FALSE)&"|"&HLOOKUP(Sheet1!R2C1,Sheet1!R2C1:R16C1,MOD(RC1+3,3)+MOD(INT((RC1+3)/3),3)*5+3,FALSE) -> 132|133|134|162|163 | J154: =HLOOKUP(Sheet1!R2C1,Sheet1!R2C1:R16C1,MOD(RC1-1,3)+MOD(INT((RC1-1)/3),3)*5+3,FALSE)&"|"&HLOOKUP(Sheet1!R2C1,Sheet1!R2C1:R16C1,MOD(RC1,3)+MOD(INT((RC1)/3),3)*5+3,FALSE)&"|"&HLOOKUP(Sheet1!R2C1,Sheet1!R2C1:R16C1,MOD(RC1+1,3)+MOD(INT((RC1+1)/3),3)*5+3,FALSE)&"|"&HLOOKUP(Sheet1!R2C1,Sheet1!R2C1:R16C1,MOD(RC1+2,3)+MOD(INT((RC1+2)/3),3)*5+3,FALSE)&"|"&HLOOKUP(Sheet1!R2C1,Sheet1!R2C1:R16C1,MOD(RC1+3,3)+MOD(INT((RC1+3)/3),3)*5+3,FALSE) -> 132|133|134|162|163 | K154: =HLOOKUP(Sheet1!R2C1,Sheet1!R2C1:R16C1,MOD(RC1-1,3)+MOD(INT((RC1-1)/3),3)*5+3,FALSE)&"|"&HLOOKUP(Sheet1!R2C1,Sheet1!R2C1:R16C1,MOD(RC1,3)+MOD(INT((RC1)/3),3)*5+3,FALSE)&"|"&HLOOKUP(Sheet1!R2C1,Sheet1!R2C1:R16C1,MOD(RC1+1,3)+MOD(INT((RC1+1)/3),3)*5+3,FALSE)&"|"&HLOOKUP(Sheet1!R2C1,Sheet1!R2C1:R16C1,MOD(RC1+2,3)+MOD(INT((RC1+2)/3),3)*5+3,FALSE)&"|"&HLOOKUP(Sheet1!R2C1,Sheet1!R2C1:R16C1,MOD(RC1+3,3)+MOD(INT((RC1+3)/3),3)*5+3,FALSE) -> 132|133|134|162|163 | L154: 25|22|23|24 | M154: 520158|520158|520158|520158 | N154: 10030|10031|10032|10033 | O154: 1|1|1|1 | P154: 2500|2500|2500|2500
A155: 149 | B155: 147 | C155: 30 | D155: =R[-20]C+2 -> 34 | E155: 1000 | F155: =MOD(RC[-5]-1,3)*30+100&"|"&MOD(RC[-5]-1,3)*30+101&"|"&MOD(RC[-5]-1,3)*30+102&"|"&MOD(RC[-5]-1,3)*30+103&"|"&IF(MOD(RC[-5],4)=0,HLOOKUP(Sheet1!R2C10,Sheet1!R2C10:R7C10,MOD(RC[-5]/4-1,6)+1,FALSE),IF(MOD(RC[-5],2)=0,IF(RC[-5]>20,HLOOKUP(Sheet1!R2C7,Sheet1!R2C7:R43C7,MOD(RC[-5]/2-1,42)+1,FALSE),HLOOKUP(Sheet1!R2C4,Sheet1!R2C4:R7C4,MOD(RC[-5]-1,6)+1,FALSE)),MOD(RC[-5]-1,3)*30+104)) -> 130|131|132|133|134 | G155: =HLOOKUP(Sheet1!R2C1,Sheet1!R2C1:R16C1,MOD(RC1-1,2)+MOD(INT((RC1-1)/2),3)*5+1,FALSE)&"|"&HLOOKUP(Sheet1!R2C1,Sheet1!R2C1:R16C1,MOD(RC1,2)+MOD(INT((RC1)/2),3)*5+1,FALSE)&"|"&HLOOKUP(Sheet1!R2C1,Sheet1!R2C1:R16C1,MOD(RC1+1,2)+MOD(INT((RC1+1)/2),3)*5+1,FALSE)&"|"&HLOOKUP(Sheet1!R2C1,Sheet1!R2C1:R16C1,MOD(RC1+2,2)+MOD(INT((RC1+2)/2),3)*5+1,FALSE)&"|"&HLOOKUP(Sheet1!R2C1,Sheet1!R2C1:R16C1,MOD(RC1+3,2)+MOD(INT((RC1+3)/2),3)*5+1,FALSE) -> 160|161|100|101|130 | H155: =HLOOKUP(Sheet1!R2C1,Sheet1!R2C1:R16C1,MOD(RC1+2,2)+MOD(INT((RC1+2)/2),3)*5+1,FALSE)&"|"&HLOOKUP(Sheet1!R2C1,Sheet1!R2C1:R16C1,MOD(RC1+3,2)+MOD(INT((RC1+3)/2),3)*5+1,FALSE)&"|"&HLOOKUP(Sheet1!R2C1,Sheet1!R2C1:R16C1,MOD(RC1+4,2)+MOD(INT((RC1+4)/2),3)*5+1,FALSE)&"|"&HLOOKUP(Sheet1!R2C1,Sheet1!R2C1:R16C1,MOD(RC1+5,2)+MOD(INT((RC1+5)/2),3)*5+1,FALSE)&"|"&HLOOKUP(Sheet1!R2C1,Sheet1!R2C1:R16C1,MOD(RC1+6,2)+MOD(INT((RC1+6)/2),3)*5+1,FALSE) -> 101|130|131|160|161 | I155: =HLOOKUP(Sheet1!R2C1,Sheet1!R2C1:R16C1,MOD(RC1-1,3)+MOD(INT((RC1-1)/3),3)*5+3,FALSE)&"|"&HLOOKUP(Sheet1!R2C1,Sheet1!R2C1:R16C1,MOD(RC1,3)+MOD(INT((RC1)/3),3)*5+3,FALSE)&"|"&HLOOKUP(Sheet1!R2C1,Sheet1!R2C1:R16C1,MOD(RC1+1,3)+MOD(INT((RC1+1)/3),3)*5+3,FALSE)&"|"&HLOOKUP(Sheet1!R2C1,Sheet1!R2C1:R16C1,MOD(RC1+2,3)+MOD(INT((RC1+2)/3),3)*5+3,FALSE)&"|"&HLOOKUP(Sheet1!R2C1,Sheet1!R2C1:R16C1,MOD(RC1+3,3)+MOD(INT((RC1+3)/3),3)*5+3,FALSE) -> 133|134|162|163|164 | J155: =HLOOKUP(Sheet1!R2C1,Sheet1!R2C1:R16C1,MOD(RC1-1,3)+MOD(INT((RC1-1)/3),3)*5+3,FALSE)&"|"&HLOOKUP(Sheet1!R2C1,Sheet1!R2C1:R16C1,MOD(RC1,3)+MOD(INT((RC1)/3),3)*5+3,FALSE)&"|"&HLOOKUP(Sheet1!R2C1,Sheet1!R2C1:R16C1,MOD(RC1+1,3)+MOD(INT((RC1+1)/3),3)*5+3,FALSE)&"|"&HLOOKUP(Sheet1!R2C1,Sheet1!R2C1:R16C1,MOD(RC1+2,3)+MOD(INT((RC1+2)/3),3)*5+3,FALSE)&"|"&HLOOKUP(Sheet1!R2C1,Sheet1!R2C1:R16C1,MOD(RC1+3,3)+MOD(INT((RC1+3)/3),3)*5+3,FALSE) -> 133|134|162|163|164 | K155: =HLOOKUP(Sheet1!R2C1,Sheet1!R2C1:R16C1,MOD(RC1-1,3)+MOD(INT((RC1-1)/3),3)*5+3,FALSE)&"|"&HLOOKUP(Sheet1!R2C1,Sheet1!R2C1:R16C1,MOD(RC1,3)+MOD(INT((RC1)/3),3)*5+3,FALSE)&"|"&HLOOKUP(Sheet1!R2C1,Sheet1!R2C1:R16C1,MOD(RC1+1,3)+MOD(INT((RC1+1)/3),3)*5+3,FALSE)&"|"&HLOOKUP(Sheet1!R2C1,Sheet1!R2C1:R16C1,MOD(RC1+2,3)+MOD(INT((RC1+2)/3),3)*5+3,FALSE)&"|"&HLOOKUP(Sheet1!R2C1,Sheet1!R2C1:R16C1,MOD(RC1+3,3)+MOD(INT((RC1+3)/3),3)*5+3,FALSE) -> 133|134|162|163|164 | L155: 25|22|23|24 | M155: 526760|526760|526760|526760 | N155: 10030|10031|10032|10033 | O155: 1|1|1|1 | P155: 2500|2500|2500|2500
A156: 150 | B156: 148 | C156: 30 | D156: =R[-20]C+2 -> 34 | E156: 1000 | F156: =MOD(RC[-5]-1,3)*30+100&"|"&MOD(RC[-5]-1,3)*30+101&"|"&MOD(RC[-5]-1,3)*30+102&"|"&MOD(RC[-5]-1,3)*30+103&"|"&IF(MOD(RC[-5],4)=0,HLOOKUP(Sheet1!R2C10,Sheet1!R2C10:R7C10,MOD(RC[-5]/4-1,6)+1,FALSE),IF(MOD(RC[-5],2)=0,IF(RC[-5]>20,HLOOKUP(Sheet1!R2C7,Sheet1!R2C7:R43C7,MOD(RC[-5]/2-1,42)+1,FALSE),HLOOKUP(Sheet1!R2C4,Sheet1!R2C4:R7C4,MOD(RC[-5]-1,6)+1,FALSE)),MOD(RC[-5]-1,3)*30+104)) -> 160|161|162|163|176 | G156: =HLOOKUP(Sheet1!R2C1,Sheet1!R2C1:R16C1,MOD(RC1-1,2)+MOD(INT((RC1-1)/2),3)*5+1,FALSE)&"|"&HLOOKUP(Sheet1!R2C1,Sheet1!R2C1:R16C1,MOD(RC1,2)+MOD(INT((RC1)/2),3)*5+1,FALSE)&"|"&HLOOKUP(Sheet1!R2C1,Sheet1!R2C1:R16C1,MOD(RC1+1,2)+MOD(INT((RC1+1)/2),3)*5+1,FALSE)&"|"&HLOOKUP(Sheet1!R2C1,Sheet1!R2C1:R16C1,MOD(RC1+2,2)+MOD(INT((RC1+2)/2),3)*5+1,FALSE)&"|"&HLOOKUP(Sheet1!R2C1,Sheet1!R2C1:R16C1,MOD(RC1+3,2)+MOD(INT((RC1+3)/2),3)*5+1,FALSE) -> 161|100|101|130|131 | H156: =HLOOKUP(Sheet1!R2C1,Sheet1!R2C1:R16C1,MOD(RC1+2,2)+MOD(INT((RC1+2)/2),3)*5+1,FALSE)&"|"&HLOOKUP(Sheet1!R2C1,Sheet1!R2C1:R16C1,MOD(RC1+3,2)+MOD(INT((RC1+3)/2),3)*5+1,FALSE)&"|"&HLOOKUP(Sheet1!R2C1,Sheet1!R2C1:R16C1,MOD(RC1+4,2)+MOD(INT((RC1+4)/2),3)*5+1,FALSE)&"|"&HLOOKUP(Sheet1!R2C1,Sheet1!R2C1:R16C1,MOD(RC1+5,2)+MOD(INT((RC1+5)/2),3)*5+1,FALSE)&"|"&HLOOKUP(Sheet1!R2C1,Sheet1!R2C1:R16C1,MOD(RC1+6,2)+MOD(INT((RC1+6)/2),3)*5+1,FALSE) -> 130|131|160|161|100 | I156: =HLOOKUP(Sheet1!R2C1,Sheet1!R2C1:R16C1,MOD(RC1-1,3)+MOD(INT((RC1-1)/3),3)*5+3,FALSE)&"|"&HLOOKUP(Sheet1!R2C1,Sheet1!R2C1:R16C1,MOD(RC1,3)+MOD(INT((RC1)/3),3)*5+3,FALSE)&"|"&HLOOKUP(Sheet1!R2C1,Sheet1!R2C1:R16C1,MOD(RC1+1,3)+MOD(INT((RC1+1)/3),3)*5+3,FALSE)&"|"&HLOOKUP(Sheet1!R2C1,Sheet1!R2C1:R16C1,MOD(RC1+2,3)+MOD(INT((RC1+2)/3),3)*5+3,FALSE)&"|"&HLOOKUP(Sheet1!R2C1,Sheet1!R2C1:R16C1,MOD(RC1+3,3)+MOD(INT((RC1+3)/3),3)*5+3,FALSE) -> 134|162|163|164|102 | J156: =HLOOKUP(Sheet1!R2C1,Sheet1!R2C1:R16C1,MOD(RC1-1,3)+MOD(INT((RC1-1)/3),3)*5+3,FALSE)&"|"&HLOOKUP(Sheet1!R2C1,Sheet1!R2C1:R16C1,MOD(RC1,3)+MOD(INT((RC1)/3),3)*5+3,FALSE)&"|"&HLOOKUP(Sheet1!R2C1,Sheet1!R2C1:R16C1,MOD(RC1+1,3)+MOD(INT((RC1+1)/3),3)*5+3,FALSE)&"|"&HLOOKUP(Sheet1!R2C1,Sheet1!R2C1:R16C1,MOD(RC1+2,3)+MOD(INT((RC1+2)/3),3)*5+3,FALSE)&"|"&HLOOKUP(Sheet1!R2C1,Sheet1!R2C1:R16C1,MOD(RC1+3,3)+MOD(INT((RC1+3)/3),3)*5+3,FALSE) -> 134|162|163|164|102 | K156: =HLOOKUP(Sheet1!R2C1,Sheet1!R2C1:R16C1,MOD(RC1-1,3)+MOD(INT((RC1-1)/3),3)*5+3,FALSE)&"|"&HLOOKUP(Sheet1!R2C1,Sheet1!R2C1:R16C1,MOD(RC1,3)+MOD(INT((RC1)/3),3)*5+3,FALSE)&"|"&HLOOKUP(Sheet1!R2C1,Sheet1!R2C1:R16C1,MOD(RC1+1,3)+MOD(INT((RC1+1)/3),3)*5+3,FALSE)&"|"&HLOOKUP(Sheet1!R2C1,Sheet1!R2C1:R16C1,MOD(RC1+2,3)+MOD(INT((RC1+2)/3),3)*5+3,FALSE)&"|"&HLOOKUP(Sheet1!R2C1,Sheet1!R2C1:R16C1,MOD(RC1+3,3)+MOD(INT((RC1+3)/3),3)*5+3,FALSE) -> 134|162|163|164|102 | L156: 25|22|23|24 | M156: 533422|533423|533423|533423 | N156: 10030|10031|10032|10033|10030|10031|10032|10033|10030|10031|10032|10033|10030|10031|10032|10033|10030|10031|10032|10033|10030|10031|10032|10033|10030|10031|10032|10033|10030|10031|10032|10033|10030|10031|10032|10033|10030|10031|10032|10033 | O156: 1|1|1|1|1|1|1|1|1|1|1|1|1|1|1|1|1|1|1|1|1|1|1|1|1|1|1|1|1|1|1|1|1|1|1|1|1|1|1|1 | P156: 2500|2500|2500|2500|2500|2500|2500|2500|2500|2500|2500|2500|2500|2500|2500|2500|2500|2500|2500|2500|2500|2500|2500|2500|2500|2500|2500|2500|2500|2500|2500|2500|2500|2500|2500|2500|2500|2500|2500|2500
A157: 151 | B157: 149 | C157: 30 | D157: =R[-20]C+2 -> 34 | E157: 1000 | F157: =MOD(RC[-5]-1,3)*30+100&"|"&MOD(RC[-5]-1,3)*30+101&"|"&MOD(RC[-5]-1,3)*30+102&"|"&MOD(RC[-5]-1,3)*30+103&"|"&IF(MOD(RC[-5],4)=0,HLOOKUP(Sheet1!R2C10,Sheet1!R2C10:R7C10,MOD(RC[-5]/4-1,6)+1,FALSE),IF(MOD(RC[-5],2)=0,IF(RC[-5]>20,HLOOKUP(Sheet1!R2C7,Sheet1!R2C7:R43C7,MOD(RC[-5]/2-1,42)+1,FALSE),HLOOKUP(Sheet1!R2C4,Sheet1!R2C4:R7C4,MOD(RC[-5]-1,6)+1,FALSE)),MOD(RC[-5]-1,3)*30+104)) -> 100|101|102|103|104 | G157: =HLOOKUP(Sheet1!R2C1,Sheet1!R2C1:R16C1,MOD(RC1-1,2)+MOD(INT((RC1-1)/2),3)*5+1,FALSE)&"|"&HLOOKUP(Sheet1!R2C1,Sheet1!R2C1:R16C1,MOD(RC1,2)+MOD(INT((RC1)/2),3)*5+1,FALSE)&"|"&HLOOKUP(Sheet1!R2C1,Sheet1!R2C1:R16C1,MOD(RC1+1,2)+MOD(INT((RC1+1)/2),3)*5+1,FALSE)&"|"&HLOOKUP(Sheet1!R2C1,Sheet1!R2C1:R16C1,MOD(RC1+2,2)+MOD(INT((RC1+2)/2),3)*5+1,FALSE)&"|"&HLOOKUP(Sheet1!R2C1,Sheet1!R2C1:R16C1,MOD(RC1+3,2)+MOD(INT((RC1+3)/2),3)*5+1,FALSE) -> 100|101|130|131|160 | H157: =HLOOKUP(Sheet1!R2C1,Sheet1!R2C1:R16C1,MOD(RC1+2,2)+MOD(INT((RC1+2)/2),3)*5+1,FALSE)&"|"&HLOOKUP(Sheet1!R2C1,Sheet1!R2C1:R16C1,MOD(RC1+3,2)+MOD(INT((RC1+3)/2),3)*5+1,FALSE)&"|"&HLOOKUP(Sheet1!R2C1,Sheet1!R2C1:R16C1,MOD(RC1+4,2)+MOD(INT((RC1+4)/2),3)*5+1,FALSE)&"|"&HLOOKUP(Sheet1!R2C1,Sheet1!R2C1:R16C1,MOD(RC1+5,2)+MOD(INT((RC1+5)/2),3)*5+1,FALSE)&"|"&HLOOKUP(Sheet1!R2C1,Sheet1!R2C1:R16C1,MOD(RC1+6,2)+MOD(INT((RC1+6)/2),3)*5+1,FALSE) -> 131|160|161|100|101 | I157: =HLOOKUP(Sheet1!R2C1,Sheet1!R2C1:R16C1,MOD(RC1-1,3)+MOD(INT((RC1-1)/3),3)*5+3,FALSE)&"|"&HLOOKUP(Sheet1!R2C1,Sheet1!R2C1:R16C1,MOD(RC1,3)+MOD(INT((RC1)/3),3)*5+3,FALSE)&"|"&HLOOKUP(Sheet1!R2C1,Sheet1!R2C1:R16C1,MOD(RC1+1,3)+MOD(INT((RC1+1)/3),3)*5+3,FALSE)&"|"&HLOOKUP(Sheet1!R2C1,Sheet1!R2C1:R16C1,MOD(RC1+2,3)+MOD(INT((RC1+2)/3),3)*5+3,FALSE)&"|"&HLOOKUP(Sheet1!R2C1,Sheet1!R2C1:R16C1,MOD(RC1+3,3)+MOD(INT((RC1+3)/3),3)*5+3,FALSE) -> 162|163|164|102|103 | J157: =HLOOKUP(Sheet1!R2C1,Sheet1!R2C1:R16C1,MOD(RC1-1,3)+MOD(INT((RC1-1)/3),3)*5+3,FALSE)&"|"&HLOOKUP(Sheet1!R2C1,Sheet1!R2C1:R16C1,MOD(RC1,3)+MOD(INT((RC1)/3),3)*5+3,FALSE)&"|"&HLOOKUP(Sheet1!R2C1,Sheet1!R2C1:R16C1,MOD(RC1+1,3)+MOD(INT((RC1+1)/3),3)*5+3,FALSE)&"|"&HLOOKUP(Sheet1!R2C1,Sheet1!R2C1:R16C1,MOD(RC1+2,3)+MOD(INT((RC1+2)/3),3)*5+3,FALSE)&"|"&HLOOKUP(Sheet1!R2C1,Sheet1!R2C1:R16C1,MOD(RC1+3,3)+MOD(INT((RC1+3)/3),3)*5+3,FALSE) -> 162|163|164|102|103 | K157: =HLOOKUP(Sheet1!R2C1,Sheet1!R2C1:R16C1,MOD(RC1-1,3)+MOD(INT((RC1-1)/3),3)*5+3,FALSE)&"|"&HLOOKUP(Sheet1!R2C1,Sheet1!R2C1:R16C1,MOD(RC1,3)+MOD(INT((RC1)/3),3)*5+3,FALSE)&"|"&HLOOKUP(Sheet1!R2C1,Sheet1!R2C1:R16C1,MOD(RC1+1,3)+MOD(INT((RC1+1)/3),3)*5+3,FALSE)&"|"&HLOOKUP(Sheet1!R2C1,Sheet1!R2C1:R16C1,MOD(RC1+2,3)+MOD(INT((RC1+2)/3),3)*5+3,FALSE)&"|"&HLOOKUP(Sheet1!R2C1,Sheet1!R2C1:R16C1,MOD(RC1+3,3)+MOD(INT((RC1+3)/3),3)*5+3,FALSE) -> 162|163|164|102|103 | L157: 25|22|23|24 | M157: 540553|540553|540553|540553 | N157: 10030|10031|10032|10033 | O157: 1|1|1|1 | P157: 2500|2500|2500|2500
A158: 152 | B158: 150 | C158: 30 | D158: =R[-20]C+2 -> 34 | E158: 1000 | F158: =MOD(RC[-5]-1,3)*30+100&"|"&MOD(RC[-5]-1,3)*30+101&"|"&MOD(RC[-5]-1,3)*30+102&"|"&MOD(RC[-5]-1,3)*30+103&"|"&IF(MOD(RC[-5],4)=0,HLOOKUP(Sheet1!R2C10,Sheet1!R2C10:R7C10,MOD(RC[-5]/4-1,6)+1,FALSE),IF(MOD(RC[-5],2)=0,IF(RC[-5]>20,HLOOKUP(Sheet1!R2C7,Sheet1!R2C7:R43C7,MOD(RC[-5]/2-1,42)+1,FALSE),HLOOKUP(Sheet1!R2C4,Sheet1!R2C4:R7C4,MOD(RC[-5]-1,6)+1,FALSE)),MOD(RC[-5]-1,3)*30+104)) -> 130|131|132|133|191 | G158: =HLOOKUP(Sheet1!R2C1,Sheet1!R2C1:R16C1,MOD(RC1-1,2)+MOD(INT((RC1-1)/2),3)*5+1,FALSE)&"|"&HLOOKUP(Sheet1!R2C1,Sheet1!R2C1:R16C1,MOD(RC1,2)+MOD(INT((RC1)/2),3)*5+1,FALSE)&"|"&HLOOKUP(Sheet1!R2C1,Sheet1!R2C1:R16C1,MOD(RC1+1,2)+MOD(INT((RC1+1)/2),3)*5+1,FALSE)&"|"&HLOOKUP(Sheet1!R2C1,Sheet1!R2C1:R16C1,MOD(RC1+2,2)+MOD(INT((RC1+2)/2),3)*5+1,FALSE)&"|"&HLOOKUP(Sheet1!R2C1,Sheet1!R2C1:R16C1,MOD(RC1+3,2)+MOD(INT((RC1+3)/2),3)*5+1,FALSE) -> 101|130|131|160|161 | H158: =HLOOKUP(Sheet1!R2C1,Sheet1!R2C1:R16C1,MOD(RC1+2,2)+MOD(INT((RC1+2)/2),3)*5+1,FALSE)&"|"&HLOOKUP(Sheet1!R2C1,Sheet1!R2C1:R16C1,MOD(RC1+3,2)+MOD(INT((RC1+3)/2),3)*5+1,FALSE)&"|"&HLOOKUP(Sheet1!R2C1,Sheet1!R2C1:R16C1,MOD(RC1+4,2)+MOD(INT((RC1+4)/2),3)*5+1,FALSE)&"|"&HLOOKUP(Sheet1!R2C1,Sheet1!R2C1:R16C1,MOD(RC1+5,2)+MOD(INT((RC1+5)/2),3)*5+1,FALSE)&"|"&HLOOKUP(Sheet1!R2C1,Sheet1!R2C1:R16C1,MOD(RC1+6,2)+MOD(INT((RC1+6)/2),3)*5+1,FALSE) -> 160|161|100|101|130 | I158: =HLOOKUP(Sheet1!R2C1,Sheet1!R2C1:R16C1,MOD(RC1-1,3)+MOD(INT((RC1-1)/3),3)*5+3,FALSE)&"|"&HLOOKUP(Sheet1!R2C1,Sheet1!R2C1:R16C1,MOD(RC1,3)+MOD(INT((RC1)/3),3)*5+3,FALSE)&"|"&HLOOKUP(Sheet1!R2C1,Sheet1!R2C1:R16C1,MOD(RC1+1,3)+MOD(INT((RC1+1)/3),3)*5+3,FALSE)&"|"&HLOOKUP(Sheet1!R2C1,Sheet1!R2C1:R16C1,MOD(RC1+2,3)+MOD(INT((RC1+2)/3),3)*5+3,FALSE)&"|"&HLOOKUP(Sheet1!R2C1,Sheet1!R2C1:R16C1,MOD(RC1+3,3)+MOD(INT((RC1+3)/3),3)*5+3,FALSE) -> 163|164|102|103|104 | J158: =HLOOKUP(Sheet1!R2C1,Sheet1!R2C1:R16C1,MOD(RC1-1,3)+MOD(INT((RC1-1)/3),3)*5+3,FALSE)&"|"&HLOOKUP(Sheet1!R2C1,Sheet1!R2C1:R16C1,MOD(RC1,3)+MOD(INT((RC1)/3),3)*5+3,FALSE)&"|"&HLOOKUP(Sheet1!R2C1,Sheet1!R2C1:R16C1,MOD(RC1+1,3)+MOD(INT((RC1+1)/3),3)*5+3,FALSE)&"|"&HLOOKUP(Sheet1!R2C1,Sheet1!R2C1:R16C1,MOD(RC1+2,3)+MOD(INT((RC1+2)/3),3)*5+3,FALSE)&"|"&HLOOKUP(Sheet1!R2C1,Sheet1!R2C1:R16C1,MOD(RC1+3,3)+MOD(INT((RC1+3)/3),3)*5+3,FALSE) -> 163|164|102|103|104 | K158: =HLOOKUP(Sheet1!R2C1,Sheet1!R2C1:R16C1,MOD(RC1-1,3)+MOD(INT((RC1-1)/3),3)*5+3,FALSE)&"|"&HLOOKUP(Sheet1!R2C1,Sheet1!R2C1:R16C1,MOD(RC1,3)+MOD(INT((RC1)/3),3)*5+3,FALSE)&"|"&HLOOKUP(Sheet1!R2C1,Sheet1!R2C1:R16C1,MOD(RC1+1,3)+MOD(INT((RC1+1)/3),3)*5+3,FALSE)&"|"&HLOOKUP(Sheet1!R2C1,Sheet1!R2C1:R16C1,MOD(RC1+2,3)+MOD(INT((RC1+2)/3),3)*5+3,FALSE)&"|"&HLOOKUP(Sheet1!R2C1,Sheet1!R2C1:R16C1,MOD(RC1+3,3)+MOD(INT((RC1+3)/3),3)*5+3,FALSE) -> 163|164|102|103|104 | L158: 25|22|23|24 | M158: 547446|547446|547445|547445 | N158: 10030|10031|10032|10033 | O158: 1|1|1|1 | P158: 2500|2500|2500|2500
A159: 153 | B159: 151 | C159: 30 | D159: =R[-20]C+2 -> 34 | E159: 1000 | F159: =MOD(RC[-5]-1,3)*30+100&"|"&MOD(RC[-5]-1,3)*30+101&"|"&MOD(RC[-5]-1,3)*30+102&"|"&MOD(RC[-5]-1,3)*30+103&"|"&IF(MOD(RC[-5],4)=0,HLOOKUP(Sheet1!R2C10,Sheet1!R2C10:R7C10,MOD(RC[-5]/4-1,6)+1,FALSE),IF(MOD(RC[-5],2)=0,IF(RC[-5]>20,HLOOKUP(Sheet1!R2C7,Sheet1!R2C7:R43C7,MOD(RC[-5]/2-1,42)+1,FALSE),HLOOKUP(Sheet1!R2C4,Sheet1!R2C4:R7C4,MOD(RC[-5]-1,6)+1,FALSE)),MOD(RC[-5]-1,3)*30+104)) -> 160|161|162|163|164 | G159: =HLOOKUP(Sheet1!R2C1,Sheet1!R2C1:R16C1,MOD(RC1-1,2)+MOD(INT((RC1-1)/2),3)*5+1,FALSE)&"|"&HLOOKUP(Sheet1!R2C1,Sheet1!R2C1:R16C1,MOD(RC1,2)+MOD(INT((RC1)/2),3)*5+1,FALSE)&"|"&HLOOKUP(Sheet1!R2C1,Sheet1!R2C1:R16C1,MOD(RC1+1,2)+MOD(INT((RC1+1)/2),3)*5+1,FALSE)&"|"&HLOOKUP(Sheet1!R2C1,Sheet1!R2C1:R16C1,MOD(RC1+2,2)+MOD(INT((RC1+2)/2),3)*5+1,FALSE)&"|"&HLOOKUP(Sheet1!R2C1,Sheet1!R2C1:R16C1,MOD(RC1+3,2)+MOD(INT((RC1+3)/2),3)*5+1,FALSE) -> 130|131|160|161|100 | H159: =HLOOKUP(Sheet1!R2C1,Sheet1!R2C1:R16C1,MOD(RC1+2,2)+MOD(INT((RC1+2)/2),3)*5+1,FALSE)&"|"&HLOOKUP(Sheet1!R2C1,Sheet1!R2C1:R16C1,MOD(RC1+3,2)+MOD(INT((RC1+3)/2),3)*5+1,FALSE)&"|"&HLOOKUP(Sheet1!R2C1,Sheet1!R2C1:R16C1,MOD(RC1+4,2)+MOD(INT((RC1+4)/2),3)*5+1,FALSE)&"|"&HLOOKUP(Sheet1!R2C1,Sheet1!R2C1:R16C1,MOD(RC1+5,2)+MOD(INT((RC1+5)/2),3)*5+1,FALSE)&"|"&HLOOKUP(Sheet1!R2C1,Sheet1!R2C1:R16C1,MOD(RC1+6,2)+MOD(INT((RC1+6)/2),3)*5+1,FALSE) -> 161|100|101|130|131 | I159: =HLOOKUP(Sheet1!R2C1,Sheet1!R2C1:R16C1,MOD(RC1-1,3)+MOD(INT((RC1-1)/3),3)*5+3,FALSE)&"|"&HLOOKUP(Sheet1!R2C1,Sheet1!R2C1:R16C1,MOD(RC1,3)+MOD(INT((RC1)/3),3)*5+3,FALSE)&"|"&HLOOKUP(Sheet1!R2C1,Sheet1!R2C1:R16C1,MOD(RC1+1,3)+MOD(INT((RC1+1)/3),3)*5+3,FALSE)&"|"&HLOOKUP(Sheet1!R2C1,Sheet1!R2C1:R16C1,MOD(RC1+2,3)+MOD(INT((RC1+2)/3),3)*5+3,FALSE)&"|"&HLOOKUP(Sheet1!R2C1,Sheet1!R2C1:R16C1,MOD(RC1+3,3)+MOD(INT((RC1+3)/3),3)*5+3,FALSE) -> 164|102|103|104|132 | J159: =HLOOKUP(Sheet1!R2C1,Sheet1!R2C1:R16C1,MOD(RC1-1,3)+MOD(INT((RC1-1)/3),3)*5+3,FALSE)&"|"&HLOOKUP(Sheet1!R2C1,Sheet1!R2C1:R16C1,MOD(RC1,3)+MOD(INT((RC1)/3),3)*5+3,FALSE)&"|"&HLOOKUP(Sheet1!R2C1,Sheet1!R2C1:R16C1,MOD(RC1+1,3)+MOD(INT((RC1+1)/3),3)*5+3,FALSE)&"|"&HLOOKUP(Sheet1!R2C1,Sheet1!R2C1:R16C1,MOD(RC1+2,3)+MOD(INT((RC1+2)/3),3)*5+3,FALSE)&"|"&HLOOKUP(Sheet1!R2C1,Sheet1!R2C1:R16C1,MOD(RC1+3,3)+MOD(INT((RC1+3)/3),3)*5+3,FALSE) -> 164|102|103|104|132 | K159: =HLOOKUP(Sheet1!R2C1,Sheet1!R2C1:R16C1,MOD(RC1-1,3)+MOD(INT((RC1-1)/3),3)*5+3,FALSE)&"|"&HLOOKUP(Sheet1!R2C1,Sheet1!R2C1:R16C1,MOD(RC1,3)+MOD(INT((RC1)/3),3)*5+3,FALSE)&"|"&HLOOKUP(Sheet1!R2C1,Sheet1!R2C1:R16C1,MOD(RC1+1,3)+MOD(INT((RC1+1)/3),3)*5+3,FALSE)&"|"&HLOOKUP(Sheet1!R2C1,Sheet1!R2C1:R16C1,MOD(RC1+2,3)+MOD(INT((RC1+2)/3),3)*5+3,FALSE)&"|"&HLOOKUP(Sheet1!R2C1,Sheet1!R2C1:R16C1,MOD(RC1+3,3)+MOD(INT((RC1+3)/3),3)*5+3,FALSE) -> 164|102|103|104|132 | L159: 25|22|23|24 | M159: 554339|554339|554340|554340 | N159: 10030|10031|10032|10033 | O159: 1|1|1|1 | P159: 2500|2500|2500|2500
A160: 154 | B160: 152 | C160: 30 | D160: =R[-20]C+2 -> 34 | E160: 1000 | F160: =MOD(RC[-5]-1,3)*30+100&"|"&MOD(RC[-5]-1,3)*30+101&"|"&MOD(RC[-5]-1,3)*30+102&"|"&MOD(RC[-5]-1,3)*30+103&"|"&IF(MOD(RC[-5],4)=0,HLOOKUP(Sheet1!R2C10,Sheet1!R2C10:R7C10,MOD(RC[-5]/4-1,6)+1,FALSE),IF(MOD(RC[-5],2)=0,IF(RC[-5]>20,HLOOKUP(Sheet1!R2C7,Sheet1!R2C7:R43C7,MOD(RC[-5]/2-1,42)+1,FALSE),HLOOKUP(Sheet1!R2C4,Sheet1!R2C4:R7C4,MOD(RC[-5]-1,6)+1,FALSE)),MOD(RC[-5]-1,3)*30+104)) -> 100|101|102|103|178 | G160: =HLOOKUP(Sheet1!R2C1,Sheet1!R2C1:R16C1,MOD(RC1-1,2)+MOD(INT((RC1-1)/2),3)*5+1,FALSE)&"|"&HLOOKUP(Sheet1!R2C1,Sheet1!R2C1:R16C1,MOD(RC1,2)+MOD(INT((RC1)/2),3)*5+1,FALSE)&"|"&HLOOKUP(Sheet1!R2C1,Sheet1!R2C1:R16C1,MOD(RC1+1,2)+MOD(INT((RC1+1)/2),3)*5+1,FALSE)&"|"&HLOOKUP(Sheet1!R2C1,Sheet1!R2C1:R16C1,MOD(RC1+2,2)+MOD(INT((RC1+2)/2),3)*5+1,FALSE)&"|"&HLOOKUP(Sheet1!R2C1,Sheet1!R2C1:R16C1,MOD(RC1+3,2)+MOD(INT((RC1+3)/2),3)*5+1,FALSE) -> 131|160|161|100|101 | H160: =HLOOKUP(Sheet1!R2C1,Sheet1!R2C1:R16C1,MOD(RC1+2,2)+MOD(INT((RC1+2)/2),3)*5+1,FALSE)&"|"&HLOOKUP(Sheet1!R2C1,Sheet1!R2C1:R16C1,MOD(RC1+3,2)+MOD(INT((RC1+3)/2),3)*5+1,FALSE)&"|"&HLOOKUP(Sheet1!R2C1,Sheet1!R2C1:R16C1,MOD(RC1+4,2)+MOD(INT((RC1+4)/2),3)*5+1,FALSE)&"|"&HLOOKUP(Sheet1!R2C1,Sheet1!R2C1:R16C1,MOD(RC1+5,2)+MOD(INT((RC1+5)/2),3)*5+1,FALSE)&"|"&HLOOKUP(Sheet1!R2C1,Sheet1!R2C1:R16C1,MOD(RC1+6,2)+MOD(INT((RC1+6)/2),3)*5+1,FALSE) -> 100|101|130|131|160 | I160: =HLOOKUP(Sheet1!R2C1,Sheet1!R2C1:R16C1,MOD(RC1-1,3)+MOD(INT((RC1-1)/3),3)*5+3,FALSE)&"|"&HLOOKUP(Sheet1!R2C1,Sheet1!R2C1:R16C1,MOD(RC1,3)+MOD(INT((RC1)/3),3)*5+3,FALSE)&"|"&HLOOKUP(Sheet1!R2C1,Sheet1!R2C1:R16C1,MOD(RC1+1,3)+MOD(INT((RC1+1)/3),3)*5+3,FALSE)&"|"&HLOOKUP(Sheet1!R2C1,Sheet1!R2C1:R16C1,MOD(RC1+2,3)+MOD(INT((RC1+2)/3),3)*5+3,FALSE)&"|"&HLOOKUP(Sheet1!R2C1,Sheet1!R2C1:R16C1,MOD(RC1+3,3)+MOD(INT((RC1+3)/3),3)*5+3,FALSE) -> 102|103|104|132|133 | J160: =HLOOKUP(Sheet1!R2C1,Sheet1!R2C1:R16C1,MOD(RC1-1,3)+MOD(INT((RC1-1)/3),3)*5+3,FALSE)&"|"&HLOOKUP(Sheet1!R2C1,Sheet1!R2C1:R16C1,MOD(RC1,3)+MOD(INT((RC1)/3),3)*5+3,FALSE)&"|"&HLOOKUP(Sheet1!R2C1,Sheet1!R2C1:R16C1,MOD(RC1+1,3)+MOD(INT((RC1+1)/3),3)*5+3,FALSE)&"|"&HLOOKUP(Sheet1!R2C1,Sheet1!R2C1:R16C1,MOD(RC1+2,3)+MOD(INT((RC1+2)/3),3)*5+3,FALSE)&"|"&HLOOKUP(Sheet1!R2C1,Sheet1!R2C1:R16C1,MOD(RC1+3,3)+MOD(INT((RC1+3)/3),3)*5+3,FALSE) -> 102|103|104|132|133 | K160: =HLOOKUP(Sheet1!R2C1,Sheet1!R2C1:R16C1,MOD(RC1-1,3)+MOD(INT((RC1-1)/3),3)*5+3,FALSE)&"|"&HLOOKUP(Sheet1!R2C1,Sheet1!R2C1:R16C1,MOD(RC1,3)+MOD(INT((RC1)/3),3)*5+3,FALSE)&"|"&HLOOKUP(Sheet1!R2C1,Sheet1!R2C1:R16C1,MOD(RC1+1,3)+MOD(INT((RC1+1)/3),3)*5+3,FALSE)&"|"&HLOOKUP(Sheet1!R2C1,Sheet1!R2C1:R16C1,MOD(RC1+2,3)+MOD(INT((RC1+2)/3),3)*5+3,FALSE)&"|"&HLOOKUP(Sheet1!R2C1,Sheet1!R2C1:R16C1,MOD(RC1+3,3)+MOD(INT((RC1+3)/3),3)*5+3,FALSE) -> 102|103|104|132|133 | L160: 25|22|23|24 | M160: 562294|562294|562293|562293 | N160: 10030|10031|10032|10033 | O160: 1|1|1|1 | P160: 2500|2500|2500|2500
A161: 155 | B161: 153 | C161: 30 | D161: =R[-20]C+2 -> 34 | E161: 1000 | F161: =MOD(RC[-5]-1,3)*30+100&"|"&MOD(RC[-5]-1,3)*30+101&"|"&MOD(RC[-5]-1,3)*30+102&"|"&MOD(RC[-5]-1,3)*30+103&"|"&IF(MOD(RC[-5],4)=0,HLOOKUP(Sheet1!R2C10,Sheet1!R2C10:R7C10,MOD(RC[-5]/4-1,6)+1,FALSE),IF(MOD(RC[-5],2)=0,IF(RC[-5]>20,HLOOKUP(Sheet1!R2C7,Sheet1!R2C7:R43C7,MOD(RC[-5]/2-1,42)+1,FALSE),HLOOKUP(Sheet1!R2C4,Sheet1!R2C4:R7C4,MOD(RC[-5]-1,6)+1,FALSE)),MOD(RC[-5]-1,3)*30+104)) -> 130|131|132|133|134 | G161: =HLOOKUP(Sheet1!R2C1,Sheet1!R2C1:R16C1,MOD(RC1-1,2)+MOD(INT((RC1-1)/2),3)*5+1,FALSE)&"|"&HLOOKUP(Sheet1!R2C1,Sheet1!R2C1:R16C1,MOD(RC1,2)+MOD(INT((RC1)/2),3)*5+1,FALSE)&"|"&HLOOKUP(Sheet1!R2C1,Sheet1!R2C1:R16C1,MOD(RC1+1,2)+MOD(INT((RC1+1)/2),3)*5+1,FALSE)&"|"&HLOOKUP(Sheet1!R2C1,Sheet1!R2C1:R16C1,MOD(RC1+2,2)+MOD(INT((RC1+2)/2),3)*5+1,FALSE)&"|"&HLOOKUP(Sheet1!R2C1,Sheet1!R2C1:R16C1,MOD(RC1+3,2)+MOD(INT((RC1+3)/2),3)*5+1,FALSE) -> 160|161|100|101|130 | H161: =HLOOKUP(Sheet1!R2C1,Sheet1!R2C1:R16C1,MOD(RC1+2,2)+MOD(INT((RC1+2)/2),3)*5+1,FALSE)&"|"&HLOOKUP(Sheet1!R2C1,Sheet1!R2C1:R16C1,MOD(RC1+3,2)+MOD(INT((RC1+3)/2),3)*5+1,FALSE)&"|"&HLOOKUP(Sheet1!R2C1,Sheet1!R2C1:R16C1,MOD(RC1+4,2)+MOD(INT((RC1+4)/2),3)*5+1,FALSE)&"|"&HLOOKUP(Sheet1!R2C1,Sheet1!R2C1:R16C1,MOD(RC1+5,2)+MOD(INT((RC1+5)/2),3)*5+1,FALSE)&"|"&HLOOKUP(Sheet1!R2C1,Sheet1!R2C1:R16C1,MOD(RC1+6,2)+MOD(INT((RC1+6)/2),3)*5+1,FALSE) -> 101|130|131|160|161 | I161: =HLOOKUP(Sheet1!R2C1,Sheet1!R2C1:R16C1,MOD(RC1-1,3)+MOD(INT((RC1-1)/3),3)*5+3,FALSE)&"|"&HLOOKUP(Sheet1!R2C1,Sheet1!R2C1:R16C1,MOD(RC1,3)+MOD(INT((RC1)/3),3)*5+3,FALSE)&"|"&HLOOKUP(Sheet1!R2C1,Sheet1!R2C1:R16C1,MOD(RC1+1,3)+MOD(INT((RC1+1)/3),3)*5+3,FALSE)&"|"&HLOOKUP(Sheet1!R2C1,Sheet1!R2C1:R16C1,MOD(RC1+2,3)+MOD(INT((RC1+2)/3),3)*5+3,FALSE)&"|"&HLOOKUP(Sheet1!R2C1,Sheet1!R2C1:R16C1,MOD(RC1+3,3)+MOD(INT((RC1+3)/3),3)*5+3,FALSE) -> 103|104|132|133|134 | J161: =HLOOKUP(Sheet1!R2C1,Sheet1!R2C1:R16C1,MOD(RC1-1,3)+MOD(INT((RC1-1)/3),3)*5+3,FALSE)&"|"&HLOOKUP(Sheet1!R2C1,Sheet1!R2C1:R16C1,MOD(RC1,3)+MOD(INT((RC1)/3),3)*5+3,FALSE)&"|"&HLOOKUP(Sheet1!R2C1,Sheet1!R2C1:R16C1,MOD(RC1+1,3)+MOD(INT((RC1+1)/3),3)*5+3,FALSE)&"|"&HLOOKUP(Sheet1!R2C1,Sheet1!R2C1:R16C1,MOD(RC1+2,3)+MOD(INT((RC1+2)/3),3)*5+3,FALSE)&"|"&HLOOKUP(Sheet1!R2C1,Sheet1!R2C1:R16C1,MOD(RC1+3,3)+MOD(INT((RC1+3)/3),3)*5+3,FALSE) -> 103|104|132|133|134 | K161: =HLOOKUP(Sheet1!R2C1,Sheet1!R2C1:R16C1,MOD(RC1-1,3)+MOD(INT((RC1-1)/3),3)*5+3,FALSE)&"|"&HLOOKUP(Sheet1!R2C1,Sheet1!R2C1:R16C1,MOD(RC1,3)+MOD(INT((RC1)/3),3)*5+3,FALSE)&"|"&HLOOKUP(Sheet1!R2C1,Sheet1!R2C1:R16C1,MOD(RC1+1,3)+MOD(INT((RC1+1)/3),3)*5+3,FALSE)&"|"&HLOOKUP(Sheet1!R2C1,Sheet1!R2C1:R16C1,MOD(RC1+2,3)+MOD(INT((RC1+2)/3),3)*5+3,FALSE)&"|"&HLOOKUP(Sheet1!R2C1,Sheet1!R2C1:R16C1,MOD(RC1+3,3)+MOD(INT((RC1+3)/3),3)*5+3,FALSE) -> 103|104|132|133|134 | L161: 25|22|23|24 | M161: 570183|570183|570183|570183 | N161: 10030|10031|10032|10033|10030|10031|10032|10033|10030|10031|10032|10033|10030|10031|10032|10033|10030|10031|10032|10033|10030|10031|10032|10033|10030|10031|10032|10033|10030|10031|10032|10033|10030|10031|10032|10033|10030|10031|10032|10033 | O161: 1|1|1|1|1|1|1|1|1|1|1|1|1|1|1|1|1|1|1|1|1|1|1|1|1|1|1|1|1|1|1|1|1|1|1|1|1|1|1|1 | P161: 2500|2500|2500|2500|2500|2500|2500|2500|2500|2500|2500|2500|2500|2500|2500|2500|2500|2500|2500|2500|2500|2500|2500|2500|2500|2500|2500|2500|2500|2500|2500|2500|2500|2500|2500|2500|2500|2500|2500|2500
A162: 156 | B162: 154 | C162: 30 | D162: =R[-20]C+2 -> 34 | E162: 1000 | F162: =MOD(RC[-5]-1,3)*30+100&"|"&MOD(RC[-5]-1,3)*30+101&"|"&MOD(RC[-5]-1,3)*30+102&"|"&MOD(RC[-5]-1,3)*30+103&"|"&IF(MOD(RC[-5],4)=0,HLOOKUP(Sheet1!R2C10,Sheet1!R2C10:R7C10,MOD(RC[-5]/4-1,6)+1,FALSE),IF(MOD(RC[-5],2)=0,IF(RC[-5]>20,HLOOKUP(Sheet1!R2C7,Sheet1!R2C7:R43C7,MOD(RC[-5]/2-1,42)+1,FALSE),HLOOKUP(Sheet1!R2C4,Sheet1!R2C4:R7C4,MOD(RC[-5]-1,6)+1,FALSE)),MOD(RC[-5]-1,3)*30+104)) -> 160|161|162|163|192 | G162: =HLOOKUP(Sheet1!R2C1,Sheet1!R2C1:R16C1,MOD(RC1-1,2)+MOD(INT((RC1-1)/2),3)*5+1,FALSE)&"|"&HLOOKUP(Sheet1!R2C1,Sheet1!R2C1:R16C1,MOD(RC1,2)+MOD(INT((RC1)/2),3)*5+1,FALSE)&"|"&HLOOKUP(Sheet1!R2C1,Sheet1!R2C1:R16C1,MOD(RC1+1,2)+MOD(INT((RC1+1)/2),3)*5+1,FALSE)&"|"&HLOOKUP(Sheet1!R2C1,Sheet1!R2C1:R16C1,MOD(RC1+2,2)+MOD(INT((RC1+2)/2),3)*5+1,FALSE)&"|"&HLOOKUP(Sheet1!R2C1,Sheet1!R2C1:R16C1,MOD(RC1+3,2)+MOD(INT((RC1+3)/2),3)*5+1,FALSE) -> 161|100|101|130|131 | H162: =HLOOKUP(Sheet1!R2C1,Sheet1!R2C1:R16C1,MOD(RC1+2,2)+MOD(INT((RC1+2)/2),3)*5+1,FALSE)&"|"&HLOOKUP(Sheet1!R2C1,Sheet1!R2C1:R16C1,MOD(RC1+3,2)+MOD(INT((RC1+3)/2),3)*5+1,FALSE)&"|"&HLOOKUP(Sheet1!R2C1,Sheet1!R2C1:R16C1,MOD(RC1+4,2)+MOD(INT((RC1+4)/2),3)*5+1,FALSE)&"|"&HLOOKUP(Sheet1!R2C1,Sheet1!R2C1:R16C1,MOD(RC1+5,2)+MOD(INT((RC1+5)/2),3)*5+1,FALSE)&"|"&HLOOKUP(Sheet1!R2C1,Sheet1!R2C1:R16C1,MOD(RC1+6,2)+MOD(INT((RC1+6)/2),3)*5+1,FALSE) -> 130|131|160|161|100 | I162: =HLOOKUP(Sheet1!R2C1,Sheet1!R2C1:R16C1,MOD(RC1-1,3)+MOD(INT((RC1-1)/3),3)*5+3,FALSE)&"|"&HLOOKUP(Sheet1!R2C1,Sheet1!R2C1:R16C1,MOD(RC1,3)+MOD(INT((RC1)/3),3)*5+3,FALSE)&"|"&HLOOKUP(Sheet1!R2C1,Sheet1!R2C1:R16C1,MOD(RC1+1,3)+MOD(INT((RC1+1)/3),3)*5+3,FALSE)&"|"&HLOOKUP(Sheet1!R2C1,Sheet1!R2C1:R16C1,MOD(RC1+2,3)+MOD(INT((RC1+2)/3),3)*5+3,FALSE)&"|"&HLOOKUP(Sheet1!R2C1,Sheet1!R2C1:R16C1,MOD(RC1+3,3)+MOD(INT((RC1+3)/3),3)*5+3,FALSE) -> 104|132|133|134|162 | J162: =HLOOKUP(Sheet1!R2C1,Sheet1!R2C1:R16C1,MOD(RC1-1,3)+MOD(INT((RC1-1)/3),3)*5+3,FALSE)&"|"&HLOOKUP(Sheet1!R2C1,Sheet1!R2C1:R16C1,MOD(RC1,3)+MOD(INT((RC1)/3),3)*5+3,FALSE)&"|"&HLOOKUP(Sheet1!R2C1,Sheet1!R2C1:R16C1,MOD(RC1+1,3)+MOD(INT((RC1+1)/3),3)*5+3,FALSE)&"|"&HLOOKUP(Sheet1!R2C1,Sheet1!R2C1:R16C1,MOD(RC1+2,3)+MOD(INT((RC1+2)/3),3)*5+3,FALSE)&"|"&HLOOKUP(Sheet1!R2C1,Sheet1!R2C1:R16C1,MOD(RC1+3,3)+MOD(INT((RC1+3)/3),3)*5+3,FALSE) -> 104|132|133|134|162 | K162: =HLOOKUP(Sheet1!R2C1,Sheet1!R2C1:R16C1,MOD(RC1-1,3)+MOD(INT((RC1-1)/3),3)*5+3,FALSE)&"|"&HLOOKUP(Sheet1!R2C1,Sheet1!R2C1:R16C1,MOD(RC1,3)+MOD(INT((RC1)/3),3)*5+3,FALSE)&"|"&HLOOKUP(Sheet1!R2C1,Sheet1!R2C1:R16C1,MOD(RC1+1,3)+MOD(INT((RC1+1)/3),3)*5+3,FALSE)&"|"&HLOOKUP(Sheet1!R2C1,Sheet1!R2C1:R16C1,MOD(RC1+2,3)+MOD(INT((RC1+2)/3),3)*5+3,FALSE)&"|"&HLOOKUP(Sheet1!R2C1,Sheet1!R2C1:R16C1,MOD(RC1+3,3)+MOD(INT((RC1+3)/3),3)*5+3,FALSE) -> 104|132|133|134|162 | L162: 25|22|23|24 | M162: 578071|578071|578073|578073 | N162: 10030|10031|10032|10033 | O162: 1|1|1|1 | P162: 2500|2500|2500|2500
A163: 157 | B163: 155 | C163: 30 | D163: =R[-20]C+2 -> 34 | E163: 1000 | F163: =MOD(RC[-5]-1,3)*30+100&"|"&MOD(RC[-5]-1,3)*30+101&"|"&MOD(RC[-5]-1,3)*30+102&"|"&MOD(RC[-5]-1,3)*30+103&"|"&IF(MOD(RC[-5],4)=0,HLOOKUP(Sheet1!R2C10,Sheet1!R2C10:R7C10,MOD(RC[-5]/4-1,6)+1,FALSE),IF(MOD(RC[-5],2)=0,IF(RC[-5]>20,HLOOKUP(Sheet1!R2C7,Sheet1!R2C7:R43C7,MOD(RC[-5]/2-1,42)+1,FALSE),HLOOKUP(Sheet1!R2C4,Sheet1!R2C4:R7C4,MOD(RC[-5]-1,6)+1,FALSE)),MOD(RC[-5]-1,3)*30+104)) -> 100|101|102|103|104 | G163: =HLOOKUP(Sheet1!R2C1,Sheet1!R2C1:R16C1,MOD(RC1-1,2)+MOD(INT((RC1-1)/2),3)*5+1,FALSE)&"|"&HLOOKUP(Sheet1!R2C1,Sheet1!R2C1:R16C1,MOD(RC1,2)+MOD(INT((RC1)/2),3)*5+1,FALSE)&"|"&HLOOKUP(Sheet1!R2C1,Sheet1!R2C1:R16C1,MOD(RC1+1,2)+MOD(INT((RC1+1)/2),3)*5+1,FALSE)&"|"&HLOOKUP(Sheet1!R2C1,Sheet1!R2C1:R16C1,MOD(RC1+2,2)+MOD(INT((RC1+2)/2),3)*5+1,FALSE)&"|"&HLOOKUP(Sheet1!R2C1,Sheet1!R2C1:R16C1,MOD(RC1+3,2)+MOD(INT((RC1+3)/2),3)*5+1,FALSE) -> 100|101|130|131|160 | H163: =HLOOKUP(Sheet1!R2C1,Sheet1!R2C1:R16C1,MOD(RC1+2,2)+MOD(INT((RC1+2)/2),3)*5+1,FALSE)&"|"&HLOOKUP(Sheet1!R2C1,Sheet1!R2C1:R16C1,MOD(RC1+3,2)+MOD(INT((RC1+3)/2),3)*5+1,FALSE)&"|"&HLOOKUP(Sheet1!R2C1,Sheet1!R2C1:R16C1,MOD(RC1+4,2)+MOD(INT((RC1+4)/2),3)*5+1,FALSE)&"|"&HLOOKUP(Sheet1!R2C1,Sheet1!R2C1:R16C1,MOD(RC1+5,2)+MOD(INT((RC1+5)/2),3)*5+1,FALSE)&"|"&HLOOKUP(Sheet1!R2C1,Sheet1!R2C1:R16C1,MOD(RC1+6,2)+MOD(INT((RC1+6)/2),3)*5+1,FALSE) -> 131|160|161|100|101 | I163: =HLOOKUP(Sheet1!R2C1,Sheet1!R2C1:R16C1,MOD(RC1-1,3)+MOD(INT((RC1-1)/3),3)*5+3,FALSE)&"|"&HLOOKUP(Sheet1!R2C1,Sheet1!R2C1:R16C1,MOD(RC1,3)+MOD(INT((RC1)/3),3)*5+3,FALSE)&"|"&HLOOKUP(Sheet1!R2C1,Sheet1!R2C1:R16C1,MOD(RC1+1,3)+MOD(INT((RC1+1)/3),3)*5+3,FALSE)&"|"&HLOOKUP(Sheet1!R2C1,Sheet1!R2C1:R16C1,MOD(RC1+2,3)+MOD(INT((RC1+2)/3),3)*5+3,FALSE)&"|"&HLOOKUP(Sheet1!R2C1,Sheet1!R2C1:R16C1,MOD(RC1+3,3)+MOD(INT((RC1+3)/3),3)*5+3,FALSE) -> 132|133|134|162|163 | J163: =HLOOKUP(Sheet1!R2C1,Sheet1!R2C1:R16C1,MOD(RC1-1,3)+MOD(INT((RC1-1)/3),3)*5+3,FALSE)&"|"&HLOOKUP(Sheet1!R2C1,Sheet1!R2C1:R16C1,MOD(RC1,3)+MOD(INT((RC1)/3),3)*5+3,FALSE)&"|"&HLOOKUP(Sheet1!R2C1,Sheet1!R2C1:R16C1,MOD(RC1+1,3)+MOD(INT((RC1+1)/3),3)*5+3,FALSE)&"|"&HLOOKUP(Sheet1!R2C1,Sheet1!R2C1:R16C1,MOD(RC1+2,3)+MOD(INT((RC1+2)/3),3)*5+3,FALSE)&"|"&HLOOKUP(Sheet1!R2C1,Sheet1!R2C1:R16C1,MOD(RC1+3,3)+MOD(INT((RC1+3)/3),3)*5+3,FALSE) -> 132|133|134|162|163 | K163: =HLOOKUP(Sheet1!R2C1,Sheet1!R2C1:R16C1,MOD(RC1-1,3)+MOD(INT((RC1-1)/3),3)*5+3,FALSE)&"|"&HLOOKUP(Sheet1!R2C1,Sheet1!R2C1:R16C1,MOD(RC1,3)+MOD(INT((RC1)/3),3)*5+3,FALSE)&"|"&HLOOKUP(Sheet1!R2C1,Sheet1!R2C1:R16C1,MOD(RC1+1,3)+MOD(INT((RC1+1)/3),3)*5+3,FALSE)&"|"&HLOOKUP(Sheet1!R2C1,Sheet1!R2C1:R16C1,MOD(RC1+2,3)+MOD(INT((RC1+2)/3),3)*5+3,FALSE)&"|"&HLOOKUP(Sheet1!R2C1,Sheet1!R2C1:R16C1,MOD(RC1+3,3)+MOD(INT((RC1+3)/3),3)*5+3,FALSE) -> 132|133|134|162|163 | L163: 25|22|23|24 | M163: 585798|585799|585798|585798 | N163: 10030|10031|10032|10033 | O163: 1|1|1|1 | P163: 2500|2500|2500|2500
A164: 158 | B164: 156 | C164: 30 | D164: =R[-20]C+2 -> 34 | E164: 1000 | F164: =MOD(RC[-5]-1,3)*30+100&"|"&MOD(RC[-5]-1,3)*30+101&"|"&MOD(RC[-5]-1,3)*30+102&"|"&MOD(RC[-5]-1,3)*30+103&"|"&IF(MOD(RC[-5],4)=0,HLOOKUP(Sheet1!R2C10,Sheet1!R2C10:R7C10,MOD(RC[-5]/4-1,6)+1,FALSE),IF(MOD(RC[-5],2)=0,IF(RC[-5]>20,HLOOKUP(Sheet1!R2C7,Sheet1!R2C7:R43C7,MOD(RC[-5]/2-1,42)+1,FALSE),HLOOKUP(Sheet1!R2C4,Sheet1!R2C4:R7C4,MOD(RC[-5]-1,6)+1,FALSE)),MOD(RC[-5]-1,3)*30+104)) -> 130|131|132|133|180 | G164: =HLOOKUP(Sheet1!R2C1,Sheet1!R2C1:R16C1,MOD(RC1-1,2)+MOD(INT((RC1-1)/2),3)*5+1,FALSE)&"|"&HLOOKUP(Sheet1!R2C1,Sheet1!R2C1:R16C1,MOD(RC1,2)+MOD(INT((RC1)/2),3)*5+1,FALSE)&"|"&HLOOKUP(Sheet1!R2C1,Sheet1!R2C1:R16C1,MOD(RC1+1,2)+MOD(INT((RC1+1)/2),3)*5+1,FALSE)&"|"&HLOOKUP(Sheet1!R2C1,Sheet1!R2C1:R16C1,MOD(RC1+2,2)+MOD(INT((RC1+2)/2),3)*5+1,FALSE)&"|"&HLOOKUP(Sheet1!R2C1,Sheet1!R2C1:R16C1,MOD(RC1+3,2)+MOD(INT((RC1+3)/2),3)*5+1,FALSE) -> 101|130|131|160|161 | H164: =HLOOKUP(Sheet1!R2C1,Sheet1!R2C1:R16C1,MOD(RC1+2,2)+MOD(INT((RC1+2)/2),3)*5+1,FALSE)&"|"&HLOOKUP(Sheet1!R2C1,Sheet1!R2C1:R16C1,MOD(RC1+3,2)+MOD(INT((RC1+3)/2),3)*5+1,FALSE)&"|"&HLOOKUP(Sheet1!R2C1,Sheet1!R2C1:R16C1,MOD(RC1+4,2)+MOD(INT((RC1+4)/2),3)*5+1,FALSE)&"|"&HLOOKUP(Sheet1!R2C1,Sheet1!R2C1:R16C1,MOD(RC1+5,2)+MOD(INT((RC1+5)/2),3)*5+1,FALSE)&"|"&HLOOKUP(Sheet1!R2C1,Sheet1!R2C1:R16C1,MOD(RC1+6,2)+MOD(INT((RC1+6)/2),3)*5+1,FALSE) -> 160|161|100|101|130 | I164: =HLOOKUP(Sheet1!R2C1,Sheet1!R2C1:R16C1,MOD(RC1-1,3)+MOD(INT((RC1-1)/3),3)*5+3,FALSE)&"|"&HLOOKUP(Sheet1!R2C1,Sheet1!R2C1:R16C1,MOD(RC1,3)+MOD(INT((RC1)/3),3)*5+3,FALSE)&"|"&HLOOKUP(Sheet1!R2C1,Sheet1!R2C1:R16C1,MOD(RC1+1,3)+MOD(INT((RC1+1)/3),3)*5+3,FALSE)&"|"&HLOOKUP(Sheet1!R2C1,Sheet1!R2C1:R16C1,MOD(RC1+2,3)+MOD(INT((RC1+2)/3),3)*5+3,FALSE)&"|"&HLOOKUP(Sheet1!R2C1,Sheet1!R2C1:R16C1,MOD(RC1+3,3)+MOD(INT((RC1+3)/3),3)*5+3,FALSE) -> 133|134|162|163|164 | J164: =HLOOKUP(Sheet1!R2C1,Sheet1!R2C1:R16C1,MOD(RC1-1,3)+MOD(INT((RC1-1)/3),3)*5+3,FALSE)&"|"&HLOOKUP(Sheet1!R2C1,Sheet1!R2C1:R16C1,MOD(RC1,3)+MOD(INT((RC1)/3),3)*5+3,FALSE)&"|"&HLOOKUP(Sheet1!R2C1,Sheet1!R2C1:R16C1,MOD(RC1+1,3)+MOD(INT((RC1+1)/3),3)*5+3,FALSE)&"|"&HLOOKUP(Sheet1!R2C1,Sheet1!R2C1:R16C1,MOD(RC1+2,3)+MOD(INT((RC1+2)/3),3)*5+3,FALSE)&"|"&HLOOKUP(Sheet1!R2C1,Sheet1!R2C1:R16C1,MOD(RC1+3,3)+MOD(INT((RC1+3)/3),3)*5+3,FALSE) -> 133|134|162|163|164 | K164: =HLOOKUP(Sheet1!R2C1,Sheet1!R2C1:R16C1,MOD(RC1-1,3)+MOD(INT((RC1-1)/3),3)*5+3,FALSE)&"|"&HLOOKUP(Sheet1!R2C1,Sheet1!R2C1:R16C1,MOD(RC1,3)+MOD(INT((RC1)/3),3)*5+3,FALSE)&"|"&HLOOKUP(Sheet1!R2C1,Sheet1!R2C1:R16C1,MOD(RC1+1,3)+MOD(INT((RC1+1)/3),3)*5+3,FALSE)&"|"&HLOOKUP(Sheet1!R2C1,Sheet1!R2C1:R16C1,MOD(RC1+2,3)+MOD(INT((RC1+2)/3),3)*5+3,FALSE)&"|"&HLOOKUP(Sheet1!R2C1,Sheet1!R2C1:R16C1,MOD(RC1+3,3)+MOD(INT((RC1+3)/3),3)*5+3,FALSE) -> 133|134|162|163|164 | L164: 25|22|23|24 | M164: 593259|593259|593260|593260 | N164: 10030|10031|10032|10033 | O164: 1|1|1|1 | P164: 2500|2500|2500|2500
A165: 159 | B165: 157 | C165: 30 | D165: =R[-20]C+2 -> 34 | E165: 1000 | F165: =MOD(RC[-5]-1,3)*30+100&"|"&MOD(RC[-5]-1,3)*30+101&"|"&MOD(RC[-5]-1,3)*30+102&"|"&MOD(RC[-5]-1,3)*30+103&"|"&IF(MOD(RC[-5],4)=0,HLOOKUP(Sheet1!R2C10,Sheet1!R2C10:R7C10,MOD(RC[-5]/4-1,6)+1,FALSE),IF(MOD(RC[-5],2)=0,IF(RC[-5]>20,HLOOKUP(Sheet1!R2C7,Sheet1!R2C7:R43C7,MOD(RC[-5]/2-1,42)+1,FALSE),HLOOKUP(Sheet1!R2C4,Sheet1!R2C4:R7C4,MOD(RC[-5]-1,6)+1,FALSE)),MOD(RC[-5]-1,3)*30+104)) -> 160|161|162|163|164 | G165: =HLOOKUP(Sheet1!R2C1,Sheet1!R2C1:R16C1,MOD(RC1-1,2)+MOD(INT((RC1-1)/2),3)*5+1,FALSE)&"|"&HLOOKUP(Sheet1!R2C1,Sheet1!R2C1:R16C1,MOD(RC1,2)+MOD(INT((RC1)/2),3)*5+1,FALSE)&"|"&HLOOKUP(Sheet1!R2C1,Sheet1!R2C1:R16C1,MOD(RC1+1,2)+MOD(INT((RC1+1)/2),3)*5+1,FALSE)&"|"&HLOOKUP(Sheet1!R2C1,Sheet1!R2C1:R16C1,MOD(RC1+2,2)+MOD(INT((RC1+2)/2),3)*5+1,FALSE)&"|"&HLOOKUP(Sheet1!R2C1,Sheet1!R2C1:R16C1,MOD(RC1+3,2)+MOD(INT((RC1+3)/2),3)*5+1,FALSE) -> 130|131|160|161|100 | H165: =HLOOKUP(Sheet1!R2C1,Sheet1!R2C1:R16C1,MOD(RC1+2,2)+MOD(INT((RC1+2)/2),3)*5+1,FALSE)&"|"&HLOOKUP(Sheet1!R2C1,Sheet1!R2C1:R16C1,MOD(RC1+3,2)+MOD(INT((RC1+3)/2),3)*5+1,FALSE)&"|"&HLOOKUP(Sheet1!R2C1,Sheet1!R2C1:R16C1,MOD(RC1+4,2)+MOD(INT((RC1+4)/2),3)*5+1,FALSE)&"|"&HLOOKUP(Sheet1!R2C1,Sheet1!R2C1:R16C1,MOD(RC1+5,2)+MOD(INT((RC1+5)/2),3)*5+1,FALSE)&"|"&HLOOKUP(Sheet1!R2C1,Sheet1!R2C1:R16C1,MOD(RC1+6,2)+MOD(INT((RC1+6)/2),3)*5+1,FALSE) -> 161|100|101|130|131 | I165: =HLOOKUP(Sheet1!R2C1,Sheet1!R2C1:R16C1,MOD(RC1-1,3)+MOD(INT((RC1-1)/3),3)*5+3,FALSE)&"|"&HLOOKUP(Sheet1!R2C1,Sheet1!R2C1:R16C1,MOD(RC1,3)+MOD(INT((RC1)/3),3)*5+3,FALSE)&"|"&HLOOKUP(Sheet1!R2C1,Sheet1!R2C1:R16C1,MOD(RC1+1,3)+MOD(INT((RC1+1)/3),3)*5+3,FALSE)&"|"&HLOOKUP(Sheet1!R2C1,Sheet1!R2C1:R16C1,MOD(RC1+2,3)+MOD(INT((RC1+2)/3),3)*5+3,FALSE)&"|"&HLOOKUP(Sheet1!R2C1,Sheet1!R2C1:R16C1,MOD(RC1+3,3)+MOD(INT((RC1+3)/3),3)*5+3,FALSE) -> 134|162|163|164|102 | J165: =HLOOKUP(Sheet1!R2C1,Sheet1!R2C1:R16C1,MOD(RC1-1,3)+MOD(INT((RC1-1)/3),3)*5+3,FALSE)&"|"&HLOOKUP(Sheet1!R2C1,Sheet1!R2C1:R16C1,MOD(RC1,3)+MOD(INT((RC1)/3),3)*5+3,FALSE)&"|"&HLOOKUP(Sheet1!R2C1,Sheet1!R2C1:R16C1,MOD(RC1+1,3)+MOD(INT((RC1+1)/3),3)*5+3,FALSE)&"|"&HLOOKUP(Sheet1!R2C1,Sheet1!R2C1:R16C1,MOD(RC1+2,3)+MOD(INT((RC1+2)/3),3)*5+3,FALSE)&"|"&HLOOKUP(Sheet1!R2C1,Sheet1!R2C1:R16C1,MOD(RC1+3,3)+MOD(INT((RC1+3)/3),3)*5+3,FALSE) -> 134|162|163|164|102 | K165: =HLOOKUP(Sheet1!R2C1,Sheet1!R2C1:R16C1,MOD(RC1-1,3)+MOD(INT((RC1-1)/3),3)*5+3,FALSE)&"|"&HLOOKUP(Sheet1!R2C1,Sheet1!R2C1:R16C1,MOD(RC1,3)+MOD(INT((RC1)/3),3)*5+3,FALSE)&"|"&HLOOKUP(Sheet1!R2C1,Sheet1!R2C1:R16C1,MOD(RC1+1,3)+MOD(INT((RC1+1)/3),3)*5+3,FALSE)&"|"&HLOOKUP(Sheet1!R2C1,Sheet1!R2C1:R16C1,MOD(RC1+2,3)+MOD(INT((RC1+2)/3),3)*5+3,FALSE)&"|"&HLOOKUP(Sheet1!R2C1,Sheet1!R2C1:R16C1,MOD(RC1+3,3)+MOD(INT((RC1+3)/3),3)*5+3,FALSE) -> 134|162|163|164|102 | L165: 25|22|23|24 | M165: 600721|600720|600720|600720 | N165: 10030|10031|10032|10033 | O165: 1|1|1|1 | P165: 2500|2500|2500|2500
A166: 160 | B166: 158 | C166: 30 | D166: =R[-20]C+2 -> 34 | E166: 1000 | F166: =MOD(RC[-5]-1,3)*30+100&"|"&MOD(RC[-5]-1,3)*30+101&"|"&MOD(RC[-5]-1,3)*30+102&"|"&MOD(RC[-5]-1,3)*30+103&"|"&IF(MOD(RC[-5],4)=0,HLOOKUP(Sheet1!R2C10,Sheet1!R2C10:R7C10,MOD(RC[-5]/4-1,6)+1,FALSE),IF(MOD(RC[-5],2)=0,IF(RC[-5]>20,HLOOKUP(Sheet1!R2C7,Sheet1!R2C7:R43C7,MOD(RC[-5]/2-1,42)+1,FALSE),HLOOKUP(Sheet1!R2C4,Sheet1!R2C4:R7C4,MOD(RC[-5]-1,6)+1,FALSE)),MOD(RC[-5]-1,3)*30+104)) -> 100|101|102|103|193 | G166: =HLOOKUP(Sheet1!R2C1,Sheet1!R2C1:R16C1,MOD(RC1-1,2)+MOD(INT((RC1-1)/2),3)*5+1,FALSE)&"|"&HLOOKUP(Sheet1!R2C1,Sheet1!R2C1:R16C1,MOD(RC1,2)+MOD(INT((RC1)/2),3)*5+1,FALSE)&"|"&HLOOKUP(Sheet1!R2C1,Sheet1!R2C1:R16C1,MOD(RC1+1,2)+MOD(INT((RC1+1)/2),3)*5+1,FALSE)&"|"&HLOOKUP(Sheet1!R2C1,Sheet1!R2C1:R16C1,MOD(RC1+2,2)+MOD(INT((RC1+2)/2),3)*5+1,FALSE)&"|"&HLOOKUP(Sheet1!R2C1,Sheet1!R2C1:R16C1,MOD(RC1+3,2)+MOD(INT((RC1+3)/2),3)*5+1,FALSE) -> 131|160|161|100|101 | H166: =HLOOKUP(Sheet1!R2C1,Sheet1!R2C1:R16C1,MOD(RC1+2,2)+MOD(INT((RC1+2)/2),3)*5+1,FALSE)&"|"&HLOOKUP(Sheet1!R2C1,Sheet1!R2C1:R16C1,MOD(RC1+3,2)+MOD(INT((RC1+3)/2),3)*5+1,FALSE)&"|"&HLOOKUP(Sheet1!R2C1,Sheet1!R2C1:R16C1,MOD(RC1+4,2)+MOD(INT((RC1+4)/2),3)*5+1,FALSE)&"|"&HLOOKUP(Sheet1!R2C1,Sheet1!R2C1:R16C1,MOD(RC1+5,2)+MOD(INT((RC1+5)/2),3)*5+1,FALSE)&"|"&HLOOKUP(Sheet1!R2C1,Sheet1!R2C1:R16C1,MOD(RC1+6,2)+MOD(INT((RC1+6)/2),3)*5+1,FALSE) -> 100|101|130|131|160 | I166: =HLOOKUP(Sheet1!R2C1,Sheet1!R2C1:R16C1,MOD(RC1-1,3)+MOD(INT((RC1-1)/3),3)*5+3,FALSE)&"|"&HLOOKUP(Sheet1!R2C1,Sheet1!R2C1:R16C1,MOD(RC1,3)+MOD(INT((RC1)/3),3)*5+3,FALSE)&"|"&HLOOKUP(Sheet1!R2C1,Sheet1!R2C1:R16C1,MOD(RC1+1,3)+MOD(INT((RC1+1)/3),3)*5+3,FALSE)&"|"&HLOOKUP(Sheet1!R2C1,Sheet1!R2C1:R16C1,MOD(RC1+2,3)+MOD(INT((RC1+2)/3),3)*5+3,FALSE)&"|"&HLOOKUP(Sheet1!R2C1,Sheet1!R2C1:R16C1,MOD(RC1+3,3)+MOD(INT((RC1+3)/3),3)*5+3,FALSE) -> 162|163|164|102|103 | J166: =HLOOKUP(Sheet1!R2C1,Sheet1!R2C1:R16C1,MOD(RC1-1,3)+MOD(INT((RC1-1)/3),3)*5+3,FALSE)&"|"&HLOOKUP(Sheet1!R2C1,Sheet1!R2C1:R16C1,MOD(RC1,3)+MOD(INT((RC1)/3),3)*5+3,FALSE)&"|"&HLOOKUP(Sheet1!R2C1,Sheet1!R2C1:R16C1,MOD(RC1+1,3)+MOD(INT((RC1+1)/3),3)*5+3,FALSE)&"|"&HLOOKUP(Sheet1!R2C1,Sheet1!R2C1:R16C1,MOD(RC1+2,3)+MOD(INT((RC1+2)/3),3)*5+3,FALSE)&"|"&HLOOKUP(Sheet1!R2C1,Sheet1!R2C1:R16C1,MOD(RC1+3,3)+MOD(INT((RC1+3)/3),3)*5+3,FALSE) -> 162|163|164|102|103 | K166: =HLOOKUP(Sheet1!R2C1,Sheet1!R2C1:R16C1,MOD(RC1-1,3)+MOD(INT((RC1-1)/3),3)*5+3,FALSE)&"|"&HLOOKUP(Sheet1!R2C1,Sheet1!R2C1:R16C1,MOD(RC1,3)+MOD(INT((RC1)/3),3)*5+3,FALSE)&"|"&HLOOKUP(Sheet1!R2C1,Sheet1!R2C1:R16C1,MOD(RC1+1,3)+MOD(INT((RC1+1)/3),3)*5+3,FALSE)&"|"&HLOOKUP(Sheet1!R2C1,Sheet1!R2C1:R16C1,MOD(RC1+2,3)+MOD(INT((RC1+2)/3),3)*5+3,FALSE)&"|"&HLOOKUP(Sheet1!R2C1,Sheet1!R2C1:R16C1,MOD(RC1+3,3)+MOD(INT((RC1+3)/3),3)*5+3,FALSE) -> 162|163|164|102|103 | L166: 25|22|23|24 | M166: 608182|608181|608183|608183 | N166: 10030|10031|10032|10033|10030|10031|10032|10033|10030|10031|10032|10033|10030|10031|10032|10033|10030|10031|10032|10033|10030|10031|10032|10033|10030|10031|10032|10033|10030|10031|10032|10033|10030|10031|10032|10033|10030|10031|10032|10033 | O166: 1|1|1|1|1|1|1|1|1|1|1|1|1|1|1|1|1|1|1|1|1|1|1|1|1|1|1|1|1|1|1|1|1|1|1|1|1|1|1|1 | P166: 2500|2500|2500|2500|2500|2500|2500|2500|2500|2500|2500|2500|2500|2500|2500|2500|2500|2500|2500|2500|2500|2500|2500|2500|2500|2500|2500|2500|2500|2500|2500|2500|2500|2500|2500|2500|2500|2500|2500|2500
A167: 161 | B167: 159 | C167: 30 | D167: =R[-20]C+2 -> 36 | E167: 1000 | F167: =MOD(RC[-5]-1,3)*30+100&"|"&MOD(RC[-5]-1,3)*30+101&"|"&MOD(RC[-5]-1,3)*30+102&"|"&MOD(RC[-5]-1,3)*30+103&"|"&IF(MOD(RC[-5],4)=0,HLOOKUP(Sheet1!R2C10,Sheet1!R2C10:R7C10,MOD(RC[-5]/4-1,6)+1,FALSE),IF(MOD(RC[-5],2)=0,IF(RC[-5]>20,HLOOKUP(Sheet1!R2C7,Sheet1!R2C7:R43C7,MOD(RC[-5]/2-1,42)+1,FALSE),HLOOKUP(Sheet1!R2C4,Sheet1!R2C4:R7C4,MOD(RC[-5]-1,6)+1,FALSE)),MOD(RC[-5]-1,3)*30+104)) -> 130|131|132|133|134 | G167: =HLOOKUP(Sheet1!R2C1,Sheet1!R2C1:R16C1,MOD(RC1-1,2)+MOD(INT((RC1-1)/2),3)*5+1,FALSE)&"|"&HLOOKUP(Sheet1!R2C1,Sheet1!R2C1:R16C1,MOD(RC1,2)+MOD(INT((RC1)/2),3)*5+1,FALSE)&"|"&HLOOKUP(Sheet1!R2C1,Sheet1!R2C1:R16C1,MOD(RC1+1,2)+MOD(INT((RC1+1)/2),3)*5+1,FALSE)&"|"&HLOOKUP(Sheet1!R2C1,Sheet1!R2C1:R16C1,MOD(RC1+2,2)+MOD(INT((RC1+2)/2),3)*5+1,FALSE)&"|"&HLOOKUP(Sheet1!R2C1,Sheet1!R2C1:R16C1,MOD(RC1+3,2)+MOD(INT((RC1+3)/2),3)*5+1,FALSE) -> 160|161|100|101|130 | H167: =HLOOKUP(Sheet1!R2C1,Sheet1!R2C1:R16C1,MOD(RC1+2,2)+MOD(INT((RC1+2)/2),3)*5+1,FALSE)&"|"&HLOOKUP(Sheet1!R2C1,Sheet1!R2C1:R16C1,MOD(RC1+3,2)+MOD(INT((RC1+3)/2),3)*5+1,FALSE)&"|"&HLOOKUP(Sheet1!R2C1,Sheet1!R2C1:R16C1,MOD(RC1+4,2)+MOD(INT((RC1+4)/2),3)*5+1,FALSE)&"|"&HLOOKUP(Sheet1!R2C1,Sheet1!R2C1:R16C1,MOD(RC1+5,2)+MOD(INT((RC1+5)/2),3)*5+1,FALSE)&"|"&HLOOKUP(Sheet1!R2C1,Sheet1!R2C1:R16C1,MOD(RC1+6,2)+MOD(INT((RC1+6)/2),3)*5+1,FALSE) -> 101|130|131|160|161 | I167: =HLOOKUP(Sheet1!R2C1,Sheet1!R2C1:R16C1,MOD(RC1-1,3)+MOD(INT((RC1-1)/3),3)*5+3,FALSE)&"|"&HLOOKUP(Sheet1!R2C1,Sheet1!R2C1:R16C1,MOD(RC1,3)+MOD(INT((RC1)/3),3)*5+3,FALSE)&"|"&HLOOKUP(Sheet1!R2C1,Sheet1!R2C1:R16C1,MOD(RC1+1,3)+MOD(INT((RC1+1)/3),3)*5+3,FALSE)&"|"&HLOOKUP(Sheet1!R2C1,Sheet1!R2C1:R16C1,MOD(RC1+2,3)+MOD(INT((RC1+2)/3),3)*5+3,FALSE)&"|"&HLOOKUP(Sheet1!R2C1,Sheet1!R2C1:R16C1,MOD(RC1+3,3)+MOD(INT((RC1+3)/3),3)*5+3,FALSE) -> 163|164|102|103|104 | J167: =HLOOKUP(Sheet1!R2C1,Sheet1!R2C1:R16C1,MOD(RC1-1,3)+MOD(INT((RC1-1)/3),3)*5+3,FALSE)&"|"&HLOOKUP(Sheet1!R2C1,Sheet1!R2C1:R16C1,MOD(RC1,3)+MOD(INT((RC1)/3),3)*5+3,FALSE)&"|"&HLOOKUP(Sheet1!R2C1,Sheet1!R2C1:R16C1,MOD(RC1+1,3)+MOD(INT((RC1+1)/3),3)*5+3,FALSE)&"|"&HLOOKUP(Sheet1!R2C1,Sheet1!R2C1:R16C1,MOD(RC1+2,3)+MOD(INT((RC1+2)/3),3)*5+3,FALSE)&"|"&HLOOKUP(Sheet1!R2C1,Sheet1!R2C1:R16C1,MOD(RC1+3,3)+MOD(INT((RC1+3)/3),3)*5+3,FALSE) -> 163|164|102|103|104 | K167: =HLOOKUP(Sheet1!R2C1,Sheet1!R2C1:R16C1,MOD(RC1-1,3)+MOD(INT((RC1-1)/3),3)*5+3,FALSE)&"|"&HLOOKUP(Sheet1!R2C1,Sheet1!R2C1:R16C1,MOD(RC1,3)+MOD(INT((RC1)/3),3)*5+3,FALSE)&"|"&HLOOKUP(Sheet1!R2C1,Sheet1!R2C1:R16C1,MOD(RC1+1,3)+MOD(INT((RC1+1)/3),3)*5+3,FALSE)&"|"&HLOOKUP(Sheet1!R2C1,Sheet1!R2C1:R16C1,MOD(RC1+2,3)+MOD(INT((RC1+2)/3),3)*5+3,FALSE)&"|"&HLOOKUP(Sheet1!R2C1,Sheet1!R2C1:R16C1,MOD(RC1+3,3)+MOD(INT((RC1+3)/3),3)*5+3,FALSE) -> 163|164|102|103|104 | L167: 25|22|23|24 | M167: 615843|615844|615843|615843 | N167: 10030|10031|10032|10033 | O167: 1|1|1|1 | P167: 2500|2500|2500|2500
A168: 162 | B168: 160 | C168: 30 | D168: =R[-20]C+2 -> 36 | E168: 1000 | F168: =MOD(RC[-5]-1,3)*30+100&"|"&MOD(RC[-5]-1,3)*30+101&"|"&MOD(RC[-5]-1,3)*30+102&"|"&MOD(RC[-5]-1,3)*30+103&"|"&IF(MOD(RC[-5],4)=0,HLOOKUP(Sheet1!R2C10,Sheet1!R2C10:R7C10,MOD(RC[-5]/4-1,6)+1,FALSE),IF(MOD(RC[-5],2)=0,IF(RC[-5]>20,HLOOKUP(Sheet1!R2C7,Sheet1!R2C7:R43C7,MOD(RC[-5]/2-1,42)+1,FALSE),HLOOKUP(Sheet1!R2C4,Sheet1!R2C4:R7C4,MOD(RC[-5]-1,6)+1,FALSE)),MOD(RC[-5]-1,3)*30+104)) -> 160|161|162|163|182 | G168: =HLOOKUP(Sheet1!R2C1,Sheet1!R2C1:R16C1,MOD(RC1-1,2)+MOD(INT((RC1-1)/2),3)*5+1,FALSE)&"|"&HLOOKUP(Sheet1!R2C1,Sheet1!R2C1:R16C1,MOD(RC1,2)+MOD(INT((RC1)/2),3)*5+1,FALSE)&"|"&HLOOKUP(Sheet1!R2C1,Sheet1!R2C1:R16C1,MOD(RC1+1,2)+MOD(INT((RC1+1)/2),3)*5+1,FALSE)&"|"&HLOOKUP(Sheet1!R2C1,Sheet1!R2C1:R16C1,MOD(RC1+2,2)+MOD(INT((RC1+2)/2),3)*5+1,FALSE)&"|"&HLOOKUP(Sheet1!R2C1,Sheet1!R2C1:R16C1,MOD(RC1+3,2)+MOD(INT((RC1+3)/2),3)*5+1,FALSE) -> 161|100|101|130|131 | H168: =HLOOKUP(Sheet1!R2C1,Sheet1!R2C1:R16C1,MOD(RC1+2,2)+MOD(INT((RC1+2)/2),3)*5+1,FALSE)&"|"&HLOOKUP(Sheet1!R2C1,Sheet1!R2C1:R16C1,MOD(RC1+3,2)+MOD(INT((RC1+3)/2),3)*5+1,FALSE)&"|"&HLOOKUP(Sheet1!R2C1,Sheet1!R2C1:R16C1,MOD(RC1+4,2)+MOD(INT((RC1+4)/2),3)*5+1,FALSE)&"|"&HLOOKUP(Sheet1!R2C1,Sheet1!R2C1:R16C1,MOD(RC1+5,2)+MOD(INT((RC1+5)/2),3)*5+1,FALSE)&"|"&HLOOKUP(Sheet1!R2C1,Sheet1!R2C1:R16C1,MOD(RC1+6,2)+MOD(INT((RC1+6)/2),3)*5+1,FALSE) -> 130|131|160|161|100 | I168: =HLOOKUP(Sheet1!R2C1,Sheet1!R2C1:R16C1,MOD(RC1-1,3)+MOD(INT((RC1-1)/3),3)*5+3,FALSE)&"|"&HLOOKUP(Sheet1!R2C1,Sheet1!R2C1:R16C1,MOD(RC1,3)+MOD(INT((RC1)/3),3)*5+3,FALSE)&"|"&HLOOKUP(Sheet1!R2C1,Sheet1!R2C1:R16C1,MOD(RC1+1,3)+MOD(INT((RC1+1)/3),3)*5+3,FALSE)&"|"&HLOOKUP(Sheet1!R2C1,Sheet1!R2C1:R16C1,MOD(RC1+2,3)+MOD(INT((RC1+2)/3),3)*5+3,FALSE)&"|"&HLOOKUP(Sheet1!R2C1,Sheet1!R2C1:R16C1,MOD(RC1+3,3)+MOD(INT((RC1+3)/3),3)*5+3,FALSE) -> 164|102|103|104|132 | J168: =HLOOKUP(Sheet1!R2C1,Sheet1!R2C1:R16C1,MOD(RC1-1,3)+MOD(INT((RC1-1)/3),3)*5+3,FALSE)&"|"&HLOOKUP(Sheet1!R2C1,Sheet1!R2C1:R16C1,MOD(RC1,3)+MOD(INT((RC1)/3),3)*5+3,FALSE)&"|"&HLOOKUP(Sheet1!R2C1,Sheet1!R2C1:R16C1,MOD(RC1+1,3)+MOD(INT((RC1+1)/3),3)*5+3,FALSE)&"|"&HLOOKUP(Sheet1!R2C1,Sheet1!R2C1:R16C1,MOD(RC1+2,3)+MOD(INT((RC1+2)/3),3)*5+3,FALSE)&"|"&HLOOKUP(Sheet1!R2C1,Sheet1!R2C1:R16C1,MOD(RC1+3,3)+MOD(INT((RC1+3)/3),3)*5+3,FALSE) -> 164|102|103|104|132 | K168: =HLOOKUP(Sheet1!R2C1,Sheet1!R2C1:R16C1,MOD(RC1-1,3)+MOD(INT((RC1-1)/3),3)*5+3,FALSE)&"|"&HLOOKUP(Sheet1!R2C1,Sheet1!R2C1:R16C1,MOD(RC1,3)+MOD(INT((RC1)/3),3)*5+3,FALSE)&"|"&HLOOKUP(Sheet1!R2C1,Sheet1!R2C1:R16C1,MOD(RC1+1,3)+MOD(INT((RC1+1)/3),3)*5+3,FALSE)&"|"&HLOOKUP(Sheet1!R2C1,Sheet1!R2C1:R16C1,MOD(RC1+2,3)+MOD(INT((RC1+2)/3),3)*5+3,FALSE)&"|"&HLOOKUP(Sheet1!R2C1,Sheet1!R2C1:R16C1,MOD(RC1+3,3)+MOD(INT((RC1+3)/3),3)*5+3,FALSE) -> 164|102|103|104|132 | L168: 25|22|23|24 | M168: 623519|623520|623520|623520 | N168: 10030|10031|10032|10033 | O168: 1|1|1|1 | P168: 2500|2500|2500|2500
A169: 163 | B169: 161 | C169: 30 | D169: =R[-20]C+2 -> 36 | E169: 1000 | F169: =MOD(RC[-5]-1,3)*30+100&"|"&MOD(RC[-5]-1,3)*30+101&"|"&MOD(RC[-5]-1,3)*30+102&"|"&MOD(RC[-5]-1,3)*30+103&"|"&IF(MOD(RC[-5],4)=0,HLOOKUP(Sheet1!R2C10,Sheet1!R2C10:R7C10,MOD(RC[-5]/4-1,6)+1,FALSE),IF(MOD(RC[-5],2)=0,IF(RC[-5]>20,HLOOKUP(Sheet1!R2C7,Sheet1!R2C7:R43C7,MOD(RC[-5]/2-1,42)+1,FALSE),HLOOKUP(Sheet1!R2C4,Sheet1!R2C4:R7C4,MOD(RC[-5]-1,6)+1,FALSE)),MOD(RC[-5]-1,3)*30+104)) -> 100|101|102|103|104 | G169: =HLOOKUP(Sheet1!R2C1,Sheet1!R2C1:R16C1,MOD(RC1-1,2)+MOD(INT((RC1-1)/2),3)*5+1,FALSE)&"|"&HLOOKUP(Sheet1!R2C1,Sheet1!R2C1:R16C1,MOD(RC1,2)+MOD(INT((RC1)/2),3)*5+1,FALSE)&"|"&HLOOKUP(Sheet1!R2C1,Sheet1!R2C1:R16C1,MOD(RC1+1,2)+MOD(INT((RC1+1)/2),3)*5+1,FALSE)&"|"&HLOOKUP(Sheet1!R2C1,Sheet1!R2C1:R16C1,MOD(RC1+2,2)+MOD(INT((RC1+2)/2),3)*5+1,FALSE)&"|"&HLOOKUP(Sheet1!R2C1,Sheet1!R2C1:R16C1,MOD(RC1+3,2)+MOD(INT((RC1+3)/2),3)*5+1,FALSE) -> 100|101|130|131|160 | H169: =HLOOKUP(Sheet1!R2C1,Sheet1!R2C1:R16C1,MOD(RC1+2,2)+MOD(INT((RC1+2)/2),3)*5+1,FALSE)&"|"&HLOOKUP(Sheet1!R2C1,Sheet1!R2C1:R16C1,MOD(RC1+3,2)+MOD(INT((RC1+3)/2),3)*5+1,FALSE)&"|"&HLOOKUP(Sheet1!R2C1,Sheet1!R2C1:R16C1,MOD(RC1+4,2)+MOD(INT((RC1+4)/2),3)*5+1,FALSE)&"|"&HLOOKUP(Sheet1!R2C1,Sheet1!R2C1:R16C1,MOD(RC1+5,2)+MOD(INT((RC1+5)/2),3)*5+1,FALSE)&"|"&HLOOKUP(Sheet1!R2C1,Sheet1!R2C1:R16C1,MOD(RC1+6,2)+MOD(INT((RC1+6)/2),3)*5+1,FALSE) -> 131|160|161|100|101 | I169: =HLOOKUP(Sheet1!R2C1,Sheet1!R2C1:R16C1,MOD(RC1-1,3)+MOD(INT((RC1-1)/3),3)*5+3,FALSE)&"|"&HLOOKUP(Sheet1!R2C1,Sheet1!R2C1:R16C1,MOD(RC1,3)+MOD(INT((RC1)/3),3)*5+3,FALSE)&"|"&HLOOKUP(Sheet1!R2C1,Sheet1!R2C1:R16C1,MOD(RC1+1,3)+MOD(INT((RC1+1)/3),3)*5+3,FALSE)&"|"&HLOOKUP(Sheet1!R2C1,Sheet1!R2C1:R16C1,MOD(RC1+2,3)+MOD(INT((RC1+2)/3),3)*5+3,FALSE)&"|"&HLOOKUP(Sheet1!R2C1,Sheet1!R2C1:R16C1,MOD(RC1+3,3)+MOD(INT((RC1+3)/3),3)*5+3,FALSE) -> 102|103|104|132|133 | J169: =HLOOKUP(Sheet1!R2C1,Sheet1!R2C1:R16C1,MOD(RC1-1,3)+MOD(INT((RC1-1)/3),3)*5+3,FALSE)&"|"&HLOOKUP(Sheet1!R2C1,Sheet1!R2C1:R16C1,MOD(RC1,3)+MOD(INT((RC1)/3),3)*5+3,FALSE)&"|"&HLOOKUP(Sheet1!R2C1,Sheet1!R2C1:R16C1,MOD(RC1+1,3)+MOD(INT((RC1+1)/3),3)*5+3,FALSE)&"|"&HLOOKUP(Sheet1!R2C1,Sheet1!R2C1:R16C1,MOD(RC1+2,3)+MOD(INT((RC1+2)/3),3)*5+3,FALSE)&"|"&HLOOKUP(Sheet1!R2C1,Sheet1!R2C1:R16C1,MOD(RC1+3,3)+MOD(INT((RC1+3)/3),3)*5+3,FALSE) -> 102|103|104|132|133 | K169: =HLOOKUP(Sheet1!R2C1,Sheet1!R2C1:R16C1,MOD(RC1-1,3)+MOD(INT((RC1-1)/3),3)*5+3,FALSE)&"|"&HLOOKUP(Sheet1!R2C1,Sheet1!R2C1:R16C1,MOD(RC1,3)+MOD(INT((RC1)/3),3)*5+3,FALSE)&"|"&HLOOKUP(Sheet1!R2C1,Sheet1!R2C1:R16C1,MOD(RC1+1,3)+MOD(INT((RC1+1)/3),3)*5+3,FALSE)&"|"&HLOOKUP(Sheet1!R2C1,Sheet1!R2C1:R16C1,MOD(RC1+2,3)+MOD(INT((RC1+2)/3),3)*5+3,FALSE)&"|"&HLOOKUP(Sheet1!R2C1,Sheet1!R2C1:R16C1,MOD(RC1+3,3)+MOD(INT((RC1+3)/3),3)*5+3,FALSE) -> 102|103|104|132|133 | L169: 25|22|23|24 | M169: 631196|631196|631195|631195 | N169: 10030|10031|10032|10033 | O169: 1|1|1|1 | P169: 2500|2500|2500|2500
A170: 164 | B170: 162 | C170: 30 | D170: =R[-20]C+2 -> 36 | E170: 1000 | F170: =MOD(RC[-5]-1,3)*30+100&"|"&MOD(RC[-5]-1,3)*30+101&"|"&MOD(RC[-5]-1,3)*30+102&"|"&MOD(RC[-5]-1,3)*30+103&"|"&IF(MOD(RC[-5],4)=0,HLOOKUP(Sheet1!R2C10,Sheet1!R2C10:R7C10,MOD(RC[-5]/4-1,6)+1,FALSE),IF(MOD(RC[-5],2)=0,IF(RC[-5]>20,HLOOKUP(Sheet1!R2C7,Sheet1!R2C7:R43C7,MOD(RC[-5]/2-1,42)+1,FALSE),HLOOKUP(Sheet1!R2C4,Sheet1!R2C4:R7C4,MOD(RC[-5]-1,6)+1,FALSE)),MOD(RC[-5]-1,3)*30+104)) -> 130|131|132|133|194 | G170: =HLOOKUP(Sheet1!R2C1,Sheet1!R2C1:R16C1,MOD(RC1-1,2)+MOD(INT((RC1-1)/2),3)*5+1,FALSE)&"|"&HLOOKUP(Sheet1!R2C1,Sheet1!R2C1:R16C1,MOD(RC1,2)+MOD(INT((RC1)/2),3)*5+1,FALSE)&"|"&HLOOKUP(Sheet1!R2C1,Sheet1!R2C1:R16C1,MOD(RC1+1,2)+MOD(INT((RC1+1)/2),3)*5+1,FALSE)&"|"&HLOOKUP(Sheet1!R2C1,Sheet1!R2C1:R16C1,MOD(RC1+2,2)+MOD(INT((RC1+2)/2),3)*5+1,FALSE)&"|"&HLOOKUP(Sheet1!R2C1,Sheet1!R2C1:R16C1,MOD(RC1+3,2)+MOD(INT((RC1+3)/2),3)*5+1,FALSE) -> 101|130|131|160|161 | H170: =HLOOKUP(Sheet1!R2C1,Sheet1!R2C1:R16C1,MOD(RC1+2,2)+MOD(INT((RC1+2)/2),3)*5+1,FALSE)&"|"&HLOOKUP(Sheet1!R2C1,Sheet1!R2C1:R16C1,MOD(RC1+3,2)+MOD(INT((RC1+3)/2),3)*5+1,FALSE)&"|"&HLOOKUP(Sheet1!R2C1,Sheet1!R2C1:R16C1,MOD(RC1+4,2)+MOD(INT((RC1+4)/2),3)*5+1,FALSE)&"|"&HLOOKUP(Sheet1!R2C1,Sheet1!R2C1:R16C1,MOD(RC1+5,2)+MOD(INT((RC1+5)/2),3)*5+1,FALSE)&"|"&HLOOKUP(Sheet1!R2C1,Sheet1!R2C1:R16C1,MOD(RC1+6,2)+MOD(INT((RC1+6)/2),3)*5+1,FALSE) -> 160|161|100|101|130 | I170: =HLOOKUP(Sheet1!R2C1,Sheet1!R2C1:R16C1,MOD(RC1-1,3)+MOD(INT((RC1-1)/3),3)*5+3,FALSE)&"|"&HLOOKUP(Sheet1!R2C1,Sheet1!R2C1:R16C1,MOD(RC1,3)+MOD(INT((RC1)/3),3)*5+3,FALSE)&"|"&HLOOKUP(Sheet1!R2C1,Sheet1!R2C1:R16C1,MOD(RC1+1,3)+MOD(INT((RC1+1)/3),3)*5+3,FALSE)&"|"&HLOOKUP(Sheet1!R2C1,Sheet1!R2C1:R16C1,MOD(RC1+2,3)+MOD(INT((RC1+2)/3),3)*5+3,FALSE)&"|"&HLOOKUP(Sheet1!R2C1,Sheet1!R2C1:R16C1,MOD(RC1+3,3)+MOD(INT((RC1+3)/3),3)*5+3,FALSE) -> 103|104|132|133|134 | J170: =HLOOKUP(Sheet1!R2C1,Sheet1!R2C1:R16C1,MOD(RC1-1,3)+MOD(INT((RC1-1)/3),3)*5+3,FALSE)&"|"&HLOOKUP(Sheet1!R2C1,Sheet1!R2C1:R16C1,MOD(RC1,3)+MOD(INT((RC1)/3),3)*5+3,FALSE)&"|"&HLOOKUP(Sheet1!R2C1,Sheet1!R2C1:R16C1,MOD(RC1+1,3)+MOD(INT((RC1+1)/3),3)*5+3,FALSE)&"|"&HLOOKUP(Sheet1!R2C1,Sheet1!R2C1:R16C1,MOD(RC1+2,3)+MOD(INT((RC1+2)/3),3)*5+3,FALSE)&"|"&HLOOKUP(Sheet1!R2C1,Sheet1!R2C1:R16C1,MOD(RC1+3,3)+MOD(INT((RC1+3)/3),3)*5+3,FALSE) -> 103|104|132|133|134 | K170: =HLOOKUP(Sheet1!R2C1,Sheet1!R2C1:R16C1,MOD(RC1-1,3)+MOD(INT((RC1-1)/3),3)*5+3,FALSE)&"|"&HLOOKUP(Sheet1!R2C1,Sheet1!R2C1:R16C1,MOD(RC1,3)+MOD(INT((RC1)/3),3)*5+3,FALSE)&"|"&HLOOKUP(Sheet1!R2C1,Sheet1!R2C1:R16C1,MOD(RC1+1,3)+MOD(INT((RC1+1)/3),3)*5+3,FALSE)&"|"&HLOOKUP(Sheet1!R2C1,Sheet1!R2C1:R16C1,MOD(RC1+2,3)+MOD(INT((RC1+2)/3),3)*5+3,FALSE)&"|"&HLOOKUP(Sheet1!R2C1,Sheet1!R2C1:R16C1,MOD(RC1+3,3)+MOD(INT((RC1+3)/3),3)*5+3,FALSE) -> 103|104|132|133|134 | L170: 25|22|23|24 | M170: 640306|640305|640305|640305 | N170: 10030|10031|10032|10033 | O170: 1|1|1|1 | P170: 2500|2500|2500|2500
A171: 165 | B171: 163 | C171: 30 | D171: =R[-20]C+2 -> 36 | E171: 1000 | F171: =MOD(RC[-5]-1,3)*30+100&"|"&MOD(RC[-5]-1,3)*30+101&"|"&MOD(RC[-5]-1,3)*30+102&"|"&MOD(RC[-5]-1,3)*30+103&"|"&IF(MOD(RC[-5],4)=0,HLOOKUP(Sheet1!R2C10,Sheet1!R2C10:R7C10,MOD(RC[-5]/4-1,6)+1,FALSE),IF(MOD(RC[-5],2)=0,IF(RC[-5]>20,HLOOKUP(Sheet1!R2C7,Sheet1!R2C7:R43C7,MOD(RC[-5]/2-1,42)+1,FALSE),HLOOKUP(Sheet1!R2C4,Sheet1!R2C4:R7C4,MOD(RC[-5]-1,6)+1,FALSE)),MOD(RC[-5]-1,3)*30+104)) -> 160|161|162|163|164 | G171: =HLOOKUP(Sheet1!R2C1,Sheet1!R2C1:R16C1,MOD(RC1-1,2)+MOD(INT((RC1-1)/2),3)*5+1,FALSE)&"|"&HLOOKUP(Sheet1!R2C1,Sheet1!R2C1:R16C1,MOD(RC1,2)+MOD(INT((RC1)/2),3)*5+1,FALSE)&"|"&HLOOKUP(Sheet1!R2C1,Sheet1!R2C1:R16C1,MOD(RC1+1,2)+MOD(INT((RC1+1)/2),3)*5+1,FALSE)&"|"&HLOOKUP(Sheet1!R2C1,Sheet1!R2C1:R16C1,MOD(RC1+2,2)+MOD(INT((RC1+2)/2),3)*5+1,FALSE)&"|"&HLOOKUP(Sheet1!R2C1,Sheet1!R2C1:R16C1,MOD(RC1+3,2)+MOD(INT((RC1+3)/2),3)*5+1,FALSE) -> 130|131|160|161|100 | H171: =HLOOKUP(Sheet1!R2C1,Sheet1!R2C1:R16C1,MOD(RC1+2,2)+MOD(INT((RC1+2)/2),3)*5+1,FALSE)&"|"&HLOOKUP(Sheet1!R2C1,Sheet1!R2C1:R16C1,MOD(RC1+3,2)+MOD(INT((RC1+3)/2),3)*5+1,FALSE)&"|"&HLOOKUP(Sheet1!R2C1,Sheet1!R2C1:R16C1,MOD(RC1+4,2)+MOD(INT((RC1+4)/2),3)*5+1,FALSE)&"|"&HLOOKUP(Sheet1!R2C1,Sheet1!R2C1:R16C1,MOD(RC1+5,2)+MOD(INT((RC1+5)/2),3)*5+1,FALSE)&"|"&HLOOKUP(Sheet1!R2C1,Sheet1!R2C1:R16C1,MOD(RC1+6,2)+MOD(INT((RC1+6)/2),3)*5+1,FALSE) -> 161|100|101|130|131 | I171: =HLOOKUP(Sheet1!R2C1,Sheet1!R2C1:R16C1,MOD(RC1-1,3)+MOD(INT((RC1-1)/3),3)*5+3,FALSE)&"|"&HLOOKUP(Sheet1!R2C1,Sheet1!R2C1:R16C1,MOD(RC1,3)+MOD(INT((RC1)/3),3)*5+3,FALSE)&"|"&HLOOKUP(Sheet1!R2C1,Sheet1!R2C1:R16C1,MOD(RC1+1,3)+MOD(INT((RC1+1)/3),3)*5+3,FALSE)&"|"&HLOOKUP(Sheet1!R2C1,Sheet1!R2C1:R16C1,MOD(RC1+2,3)+MOD(INT((RC1+2)/3),3)*5+3,FALSE)&"|"&HLOOKUP(Sheet1!R2C1,Sheet1!R2C1:R16C1,MOD(RC1+3,3)+MOD(INT((RC1+3)/3),3)*5+3,FALSE) -> 104|132|133|134|162 | J171: =HLOOKUP(Sheet1!R2C1,Sheet1!R2C1:R16C1,MOD(RC1-1,3)+MOD(INT((RC1-1)/3),3)*5+3,FALSE)&"|"&HLOOKUP(Sheet1!R2C1,Sheet1!R2C1:R16C1,MOD(RC1,3)+MOD(INT((RC1)/3),3)*5+3,FALSE)&"|"&HLOOKUP(Sheet1!R2C1,Sheet1!R2C1:R16C1,MOD(RC1+1,3)+MOD(INT((RC1+1)/3),3)*5+3,FALSE)&"|"&HLOOKUP(Sheet1!R2C1,Sheet1!R2C1:R16C1,MOD(RC1+2,3)+MOD(INT((RC1+2)/3),3)*5+3,FALSE)&"|"&HLOOKUP(Sheet1!R2C1,Sheet1!R2C1:R16C1,MOD(RC1+3,3)+MOD(INT((RC1+3)/3),3)*5+3,FALSE) -> 104|132|133|134|162 | K171: =HLOOKUP(Sheet1!R2C1,Sheet1!R2C1:R16C1,MOD(RC1-1,3)+MOD(INT((RC1-1)/3),3)*5+3,FALSE)&"|"&HLOOKUP(Sheet1!R2C1,Sheet1!R2C1:R16C1,MOD(RC1,3)+MOD(INT((RC1)/3),3)*5+3,FALSE)&"|"&HLOOKUP(Sheet1!R2C1,Sheet1!R2C1:R16C1,MOD(RC1+1,3)+MOD(INT((RC1+1)/3),3)*5+3,FALSE)&"|"&HLOOKUP(Sheet1!R2C1,Sheet1!R2C1:R16C1,MOD(RC1+2,3)+MOD(INT((RC1+2)/3),3)*5+3,FALSE)&"|"&HLOOKUP(Sheet1!R2C1,Sheet1!R2C1:R16C1,MOD(RC1+3,3)+MOD(INT((RC1+3)/3),3)*5+3,FALSE) -> 104|132|133|134|162 | L171: 25|22|23|24 | M171: 650951|650951|650953|650953 | N171: 10030|10031|10032|10033|10030|10031|10032|10033|10030|10031|10032|10033|10030|10031|10032|10033|10030|10031|10032|10033|10030|10031|10032|10033|10030|10031|10032|10033|10030|10031|10032|10033|10030|10031|10032|10033|10030|10031|10032|10033 | O171: 1|1|1|1|1|1|1|1|1|1|1|1|1|1|1|1|1|1|1|1|1|1|1|1|1|1|1|1|1|1|1|1|1|1|1|1|1|1|1|1 | P171: 2500|2500|2500|2500|2500|2500|2500|2500|2500|2500|2500|2500|2500|2500|2500|2500|2500|2500|2500|2500|2500|2500|2500|2500|2500|2500|2500|2500|2500|2500|2500|2500|2500|2500|2500|2500|2500|2500|2500|2500
A172: 166 | B172: 164 | C172: 30 | D172: =R[-20]C+2 -> 36 | E172: 1000 | F172: =MOD(RC[-5]-1,3)*30+100&"|"&MOD(RC[-5]-1,3)*30+101&"|"&MOD(RC[-5]-1,3)*30+102&"|"&MOD(RC[-5]-1,3)*30+103&"|"&IF(MOD(RC[-5],4)=0,HLOOKUP(Sheet1!R2C10,Sheet1!R2C10:R7C10,MOD(RC[-5]/4-1,6)+1,FALSE),IF(MOD(RC[-5],2)=0,IF(RC[-5]>20,HLOOKUP(Sheet1!R2C7,Sheet1!R2C7:R43C7,MOD(RC[-5]/2-1,42)+1,FALSE),HLOOKUP(Sheet1!R2C4,Sheet1!R2C4:R7C4,MOD(RC[-5]-1,6)+1,FALSE)),MOD(RC[-5]-1,3)*30+104)) -> 100|101|102|103|184 | G172: =HLOOKUP(Sheet1!R2C1,Sheet1!R2C1:R16C1,MOD(RC1-1,2)+MOD(INT((RC1-1)/2),3)*5+1,FALSE)&"|"&HLOOKUP(Sheet1!R2C1,Sheet1!R2C1:R16C1,MOD(RC1,2)+MOD(INT((RC1)/2),3)*5+1,FALSE)&"|"&HLOOKUP(Sheet1!R2C1,Sheet1!R2C1:R16C1,MOD(RC1+1,2)+MOD(INT((RC1+1)/2),3)*5+1,FALSE)&"|"&HLOOKUP(Sheet1!R2C1,Sheet1!R2C1:R16C1,MOD(RC1+2,2)+MOD(INT((RC1+2)/2),3)*5+1,FALSE)&"|"&HLOOKUP(Sheet1!R2C1,Sheet1!R2C1:R16C1,MOD(RC1+3,2)+MOD(INT((RC1+3)/2),3)*5+1,FALSE) -> 131|160|161|100|101 | H172: =HLOOKUP(Sheet1!R2C1,Sheet1!R2C1:R16C1,MOD(RC1+2,2)+MOD(INT((RC1+2)/2),3)*5+1,FALSE)&"|"&HLOOKUP(Sheet1!R2C1,Sheet1!R2C1:R16C1,MOD(RC1+3,2)+MOD(INT((RC1+3)/2),3)*5+1,FALSE)&"|"&HLOOKUP(Sheet1!R2C1,Sheet1!R2C1:R16C1,MOD(RC1+4,2)+MOD(INT((RC1+4)/2),3)*5+1,FALSE)&"|"&HLOOKUP(Sheet1!R2C1,Sheet1!R2C1:R16C1,MOD(RC1+5,2)+MOD(INT((RC1+5)/2),3)*5+1,FALSE)&"|"&HLOOKUP(Sheet1!R2C1,Sheet1!R2C1:R16C1,MOD(RC1+6,2)+MOD(INT((RC1+6)/2),3)*5+1,FALSE) -> 100|101|130|131|160 | I172: =HLOOKUP(Sheet1!R2C1,Sheet1!R2C1:R16C1,MOD(RC1-1,3)+MOD(INT((RC1-1)/3),3)*5+3,FALSE)&"|"&HLOOKUP(Sheet1!R2C1,Sheet1!R2C1:R16C1,MOD(RC1,3)+MOD(INT((RC1)/3),3)*5+3,FALSE)&"|"&HLOOKUP(Sheet1!R2C1,Sheet1!R2C1:R16C1,MOD(RC1+1,3)+MOD(INT((RC1+1)/3),3)*5+3,FALSE)&"|"&HLOOKUP(Sheet1!R2C1,Sheet1!R2C1:R16C1,MOD(RC1+2,3)+MOD(INT((RC1+2)/3),3)*5+3,FALSE)&"|"&HLOOKUP(Sheet1!R2C1,Sheet1!R2C1:R16C1,MOD(RC1+3,3)+MOD(INT((RC1+3)/3),3)*5+3,FALSE) -> 132|133|134|162|163 | J172: =HLOOKUP(Sheet1!R2C1,Sheet1!R2C1:R16C1,MOD(RC1-1,3)+MOD(INT((RC1-1)/3),3)*5+3,FALSE)&"|"&HLOOKUP(Sheet1!R2C1,Sheet1!R2C1:R16C1,MOD(RC1,3)+MOD(INT((RC1)/3),3)*5+3,FALSE)&"|"&HLOOKUP(Sheet1!R2C1,Sheet1!R2C1:R16C1,MOD(RC1+1,3)+MOD(INT((RC1+1)/3),3)*5+3,FALSE)&"|"&HLOOKUP(Sheet1!R2C1,Sheet1!R2C1:R16C1,MOD(RC1+2,3)+MOD(INT((RC1+2)/3),3)*5+3,FALSE)&"|"&HLOOKUP(Sheet1!R2C1,Sheet1!R2C1:R16C1,MOD(RC1+3,3)+MOD(INT((RC1+3)/3),3)*5+3,FALSE) -> 132|133|134|162|163 | K172: =HLOOKUP(Sheet1!R2C1,Sheet1!R2C1:R16C1,MOD(RC1-1,3)+MOD(INT((RC1-1)/3),3)*5+3,FALSE)&"|"&HLOOKUP(Sheet1!R2C1,Sheet1!R2C1:R16C1,MOD(RC1,3)+MOD(INT((RC1)/3),3)*5+3,FALSE)&"|"&HLOOKUP(Sheet1!R2C1,Sheet1!R2C1:R16C1,MOD(RC1+1,3)+MOD(INT((RC1+1)/3),3)*5+3,FALSE)&"|"&HLOOKUP(Sheet1!R2C1,Sheet1!R2C1:R16C1,MOD(RC1+2,3)+MOD(INT((RC1+2)/3),3)*5+3,FALSE)&"|"&HLOOKUP(Sheet1!R2C1,Sheet1!R2C1:R16C1,MOD(RC1+3,3)+MOD(INT((RC1+3)/3),3)*5+3,FALSE) -> 132|133|134|162|163 | L172: 25|22|23|24 | M172: 661597|661598|661598|661598 | N172: 10030|10031|10032|10033 | O172: 1|1|1|1 | P172: 2500|2500|2500|2500
A173: 167 | B173: 165 | C173: 30 | D173: =R[-20]C+2 -> 36 | E173: 1000 | F173: =MOD(RC[-5]-1,3)*30+100&"|"&MOD(RC[-5]-1,3)*30+101&"|"&MOD(RC[-5]-1,3)*30+102&"|"&MOD(RC[-5]-1,3)*30+103&"|"&IF(MOD(RC[-5],4)=0,HLOOKUP(Sheet1!R2C10,Sheet1!R2C10:R7C10,MOD(RC[-5]/4-1,6)+1,FALSE),IF(MOD(RC[-5],2)=0,IF(RC[-5]>20,HLOOKUP(Sheet1!R2C7,Sheet1!R2C7:R43C7,MOD(RC[-5]/2-1,42)+1,FALSE),HLOOKUP(Sheet1!R2C4,Sheet1!R2C4:R7C4,MOD(RC[-5]-1,6)+1,FALSE)),MOD(RC[-5]-1,3)*30+104)) -> 130|131|132|133|134 | G173: =HLOOKUP(Sheet1!R2C1,Sheet1!R2C1:R16C1,MOD(RC1-1,2)+MOD(INT((RC1-1)/2),3)*5+1,FALSE)&"|"&HLOOKUP(Sheet1!R2C1,Sheet1!R2C1:R16C1,MOD(RC1,2)+MOD(INT((RC1)/2),3)*5+1,FALSE)&"|"&HLOOKUP(Sheet1!R2C1,Sheet1!R2C1:R16C1,MOD(RC1+1,2)+MOD(INT((RC1+1)/2),3)*5+1,FALSE)&"|"&HLOOKUP(Sheet1!R2C1,Sheet1!R2C1:R16C1,MOD(RC1+2,2)+MOD(INT((RC1+2)/2),3)*5+1,FALSE)&"|"&HLOOKUP(Sheet1!R2C1,Sheet1!R2C1:R16C1,MOD(RC1+3,2)+MOD(INT((RC1+3)/2),3)*5+1,FALSE) -> 160|161|100|101|130 | H173: =HLOOKUP(Sheet1!R2C1,Sheet1!R2C1:R16C1,MOD(RC1+2,2)+MOD(INT((RC1+2)/2),3)*5+1,FALSE)&"|"&HLOOKUP(Sheet1!R2C1,Sheet1!R2C1:R16C1,MOD(RC1+3,2)+MOD(INT((RC1+3)/2),3)*5+1,FALSE)&"|"&HLOOKUP(Sheet1!R2C1,Sheet1!R2C1:R16C1,MOD(RC1+4,2)+MOD(INT((RC1+4)/2),3)*5+1,FALSE)&"|"&HLOOKUP(Sheet1!R2C1,Sheet1!R2C1:R16C1,MOD(RC1+5,2)+MOD(INT((RC1+5)/2),3)*5+1,FALSE)&"|"&HLOOKUP(Sheet1!R2C1,Sheet1!R2C1:R16C1,MOD(RC1+6,2)+MOD(INT((RC1+6)/2),3)*5+1,FALSE) -> 101|130|131|160|161 | I173: =HLOOKUP(Sheet1!R2C1,Sheet1!R2C1:R16C1,MOD(RC1-1,3)+MOD(INT((RC1-1)/3),3)*5+3,FALSE)&"|"&HLOOKUP(Sheet1!R2C1,Sheet1!R2C1:R16C1,MOD(RC1,3)+MOD(INT((RC1)/3),3)*5+3,FALSE)&"|"&HLOOKUP(Sheet1!R2C1,Sheet1!R2C1:R16C1,MOD(RC1+1,3)+MOD(INT((RC1+1)/3),3)*5+3,FALSE)&"|"&HLOOKUP(Sheet1!R2C1,Sheet1!R2C1:R16C1,MOD(RC1+2,3)+MOD(INT((RC1+2)/3),3)*5+3,FALSE)&"|"&HLOOKUP(Sheet1!R2C1,Sheet1!R2C1:R16C1,MOD(RC1+3,3)+MOD(INT((RC1+3)/3),3)*5+3,FALSE) -> 133|134|162|163|164 | J173: =HLOOKUP(Sheet1!R2C1,Sheet1!R2C1:R16C1,MOD(RC1-1,3)+MOD(INT((RC1-1)/3),3)*5+3,FALSE)&"|"&HLOOKUP(Sheet1!R2C1,Sheet1!R2C1:R16C1,MOD(RC1,3)+MOD(INT((RC1)/3),3)*5+3,FALSE)&"|"&HLOOKUP(Sheet1!R2C1,Sheet1!R2C1:R16C1,MOD(RC1+1,3)+MOD(INT((RC1+1)/3),3)*5+3,FALSE)&"|"&HLOOKUP(Sheet1!R2C1,Sheet1!R2C1:R16C1,MOD(RC1+2,3)+MOD(INT((RC1+2)/3),3)*5+3,FALSE)&"|"&HLOOKUP(Sheet1!R2C1,Sheet1!R2C1:R16C1,MOD(RC1+3,3)+MOD(INT((RC1+3)/3),3)*5+3,FALSE) -> 133|134|162|163|164 | K173: =HLOOKUP(Sheet1!R2C1,Sheet1!R2C1:R16C1,MOD(RC1-1,3)+MOD(INT((RC1-1)/3),3)*5+3,FALSE)&"|"&HLOOKUP(Sheet1!R2C1,Sheet1!R2C1:R16C1,MOD(RC1,3)+MOD(INT((RC1)/3),3)*5+3,FALSE)&"|"&HLOOKUP(Sheet1!R2C1,Sheet1!R2C1:R16C1,MOD(RC1+1,3)+MOD(INT((RC1+1)/3),3)*5+3,FALSE)&"|"&HLOOKUP(Sheet1!R2C1,Sheet1!R2C1:R16C1,MOD(RC1+2,3)+MOD(INT((RC1+2)/3),3)*5+3,FALSE)&"|"&HLOOKUP(Sheet1!R2C1,Sheet1!R2C1:R16C1,MOD(RC1+3,3)+MOD(INT((RC1+3)/3),3)*5+3,FALSE) -> 133|134|162|163|164 | L173: 25|22|23|24 | M173: 671876|671875|671875|671875 | N173: 10030|10031|10032|10033 | O173: 1|1|1|1 | P173: 2500|2500|2500|2500
A174: 168 | B174: 166 | C174: 30 | D174: =R[-20]C+2 -> 36 | E174: 1000 | F174: =MOD(RC[-5]-1,3)*30+100&"|"&MOD(RC[-5]-1,3)*30+101&"|"&MOD(RC[-5]-1,3)*30+102&"|"&MOD(RC[-5]-1,3)*30+103&"|"&IF(MOD(RC[-5],4)=0,HLOOKUP(Sheet1!R2C10,Sheet1!R2C10:R7C10,MOD(RC[-5]/4-1,6)+1,FALSE),IF(MOD(RC[-5],2)=0,IF(RC[-5]>20,HLOOKUP(Sheet1!R2C7,Sheet1!R2C7:R43C7,MOD(RC[-5]/2-1,42)+1,FALSE),HLOOKUP(Sheet1!R2C4,Sheet1!R2C4:R7C4,MOD(RC[-5]-1,6)+1,FALSE)),MOD(RC[-5]-1,3)*30+104)) -> 160|161|162|163|195 | G174: =HLOOKUP(Sheet1!R2C1,Sheet1!R2C1:R16C1,MOD(RC1-1,2)+MOD(INT((RC1-1)/2),3)*5+1,FALSE)&"|"&HLOOKUP(Sheet1!R2C1,Sheet1!R2C1:R16C1,MOD(RC1,2)+MOD(INT((RC1)/2),3)*5+1,FALSE)&"|"&HLOOKUP(Sheet1!R2C1,Sheet1!R2C1:R16C1,MOD(RC1+1,2)+MOD(INT((RC1+1)/2),3)*5+1,FALSE)&"|"&HLOOKUP(Sheet1!R2C1,Sheet1!R2C1:R16C1,MOD(RC1+2,2)+MOD(INT((RC1+2)/2),3)*5+1,FALSE)&"|"&HLOOKUP(Sheet1!R2C1,Sheet1!R2C1:R16C1,MOD(RC1+3,2)+MOD(INT((RC1+3)/2),3)*5+1,FALSE) -> 161|100|101|130|131 | H174: =HLOOKUP(Sheet1!R2C1,Sheet1!R2C1:R16C1,MOD(RC1+2,2)+MOD(INT((RC1+2)/2),3)*5+1,FALSE)&"|"&HLOOKUP(Sheet1!R2C1,Sheet1!R2C1:R16C1,MOD(RC1+3,2)+MOD(INT((RC1+3)/2),3)*5+1,FALSE)&"|"&HLOOKUP(Sheet1!R2C1,Sheet1!R2C1:R16C1,MOD(RC1+4,2)+MOD(INT((RC1+4)/2),3)*5+1,FALSE)&"|"&HLOOKUP(Sheet1!R2C1,Sheet1!R2C1:R16C1,MOD(RC1+5,2)+MOD(INT((RC1+5)/2),3)*5+1,FALSE)&"|"&HLOOKUP(Sheet1!R2C1,Sheet1!R2C1:R16C1,MOD(RC1+6,2)+MOD(INT((RC1+6)/2),3)*5+1,FALSE) -> 130|131|160|161|100 | I174: =HLOOKUP(Sheet1!R2C1,Sheet1!R2C1:R16C1,MOD(RC1-1,3)+MOD(INT((RC1-1)/3),3)*5+3,FALSE)&"|"&HLOOKUP(Sheet1!R2C1,Sheet1!R2C1:R16C1,MOD(RC1,3)+MOD(INT((RC1)/3),3)*5+3,FALSE)&"|"&HLOOKUP(Sheet1!R2C1,Sheet1!R2C1:R16C1,MOD(RC1+1,3)+MOD(INT((RC1+1)/3),3)*5+3,FALSE)&"|"&HLOOKUP(Sheet1!R2C1,Sheet1!R2C1:R16C1,MOD(RC1+2,3)+MOD(INT((RC1+2)/3),3)*5+3,FALSE)&"|"&HLOOKUP(Sheet1!R2C1,Sheet1!R2C1:R16C1,MOD(RC1+3,3)+MOD(INT((RC1+3)/3),3)*5+3,FALSE) -> 134|162|163|164|102 | J174: =HLOOKUP(Sheet1!R2C1,Sheet1!R2C1:R16C1,MOD(RC1-1,3)+MOD(INT((RC1-1)/3),3)*5+3,FALSE)&"|"&HLOOKUP(Sheet1!R2C1,Sheet1!R2C1:R16C1,MOD(RC1,3)+MOD(INT((RC1)/3),3)*5+3,FALSE)&"|"&HLOOKUP(Sheet1!R2C1,Sheet1!R2C1:R16C1,MOD(RC1+1,3)+MOD(INT((RC1+1)/3),3)*5+3,FALSE)&"|"&HLOOKUP(Sheet1!R2C1,Sheet1!R2C1:R16C1,MOD(RC1+2,3)+MOD(INT((RC1+2)/3),3)*5+3,FALSE)&"|"&HLOOKUP(Sheet1!R2C1,Sheet1!R2C1:R16C1,MOD(RC1+3,3)+MOD(INT((RC1+3)/3),3)*5+3,FALSE) -> 134|162|163|164|102 | K174: =HLOOKUP(Sheet1!R2C1,Sheet1!R2C1:R16C1,MOD(RC1-1,3)+MOD(INT((RC1-1)/3),3)*5+3,FALSE)&"|"&HLOOKUP(Sheet1!R2C1,Sheet1!R2C1:R16C1,MOD(RC1,3)+MOD(INT((RC1)/3),3)*5+3,FALSE)&"|"&HLOOKUP(Sheet1!R2C1,Sheet1!R2C1:R16C1,MOD(RC1+1,3)+MOD(INT((RC1+1)/3),3)*5+3,FALSE)&"|"&HLOOKUP(Sheet1!R2C1,Sheet1!R2C1:R16C1,MOD(RC1+2,3)+MOD(INT((RC1+2)/3),3)*5+3,FALSE)&"|"&HLOOKUP(Sheet1!R2C1,Sheet1!R2C1:R16C1,MOD(RC1+3,3)+MOD(INT((RC1+3)/3),3)*5+3,FALSE) -> 134|162|163|164|102 | L174: 25|22|23|24 | M174: 680223|680223|680223|680223 | N174: 10030|10031|10032|10033 | O174: 1|1|1|1 | P174: 2500|2500|2500|2500
A175: 169 | B175: 167 | C175: 30 | D175: =R[-20]C+2 -> 36 | E175: 1000 | F175: =MOD(RC[-5]-1,3)*30+100&"|"&MOD(RC[-5]-1,3)*30+101&"|"&MOD(RC[-5]-1,3)*30+102&"|"&MOD(RC[-5]-1,3)*30+103&"|"&IF(MOD(RC[-5],4)=0,HLOOKUP(Sheet1!R2C10,Sheet1!R2C10:R7C10,MOD(RC[-5]/4-1,6)+1,FALSE),IF(MOD(RC[-5],2)=0,IF(RC[-5]>20,HLOOKUP(Sheet1!R2C7,Sheet1!R2C7:R43C7,MOD(RC[-5]/2-1,42)+1,FALSE),HLOOKUP(Sheet1!R2C4,Sheet1!R2C4:R7C4,MOD(RC[-5]-1,6)+1,FALSE)),MOD(RC[-5]-1,3)*30+104)) -> 100|101|102|103|104 | G175: =HLOOKUP(Sheet1!R2C1,Sheet1!R2C1:R16C1,MOD(RC1-1,2)+MOD(INT((RC1-1)/2),3)*5+1,FALSE)&"|"&HLOOKUP(Sheet1!R2C1,Sheet1!R2C1:R16C1,MOD(RC1,2)+MOD(INT((RC1)/2),3)*5+1,FALSE)&"|"&HLOOKUP(Sheet1!R2C1,Sheet1!R2C1:R16C1,MOD(RC1+1,2)+MOD(INT((RC1+1)/2),3)*5+1,FALSE)&"|"&HLOOKUP(Sheet1!R2C1,Sheet1!R2C1:R16C1,MOD(RC1+2,2)+MOD(INT((RC1+2)/2),3)*5+1,FALSE)&"|"&HLOOKUP(Sheet1!R2C1,Sheet1!R2C1:R16C1,MOD(RC1+3,2)+MOD(INT((RC1+3)/2),3)*5+1,FALSE) -> 100|101|130|131|160 | H175: =HLOOKUP(Sheet1!R2C1,Sheet1!R2C1:R16C1,MOD(RC1+2,2)+MOD(INT((RC1+2)/2),3)*5+1,FALSE)&"|"&HLOOKUP(Sheet1!R2C1,Sheet1!R2C1:R16C1,MOD(RC1+3,2)+MOD(INT((RC1+3)/2),3)*5+1,FALSE)&"|"&HLOOKUP(Sheet1!R2C1,Sheet1!R2C1:R16C1,MOD(RC1+4,2)+MOD(INT((RC1+4)/2),3)*5+1,FALSE)&"|"&HLOOKUP(Sheet1!R2C1,Sheet1!R2C1:R16C1,MOD(RC1+5,2)+MOD(INT((RC1+5)/2),3)*5+1,FALSE)&"|"&HLOOKUP(Sheet1!R2C1,Sheet1!R2C1:R16C1,MOD(RC1+6,2)+MOD(INT((RC1+6)/2),3)*5+1,FALSE) -> 131|160|161|100|101 | I175: =HLOOKUP(Sheet1!R2C1,Sheet1!R2C1:R16C1,MOD(RC1-1,3)+MOD(INT((RC1-1)/3),3)*5+3,FALSE)&"|"&HLOOKUP(Sheet1!R2C1,Sheet1!R2C1:R16C1,MOD(RC1,3)+MOD(INT((RC1)/3),3)*5+3,FALSE)&"|"&HLOOKUP(Sheet1!R2C1,Sheet1!R2C1:R16C1,MOD(RC1+1,3)+MOD(INT((RC1+1)/3),3)*5+3,FALSE)&"|"&HLOOKUP(Sheet1!R2C1,Sheet1!R2C1:R16C1,MOD(RC1+2,3)+MOD(INT((RC1+2)/3),3)*5+3,FALSE)&"|"&HLOOKUP(Sheet1!R2C1,Sheet1!R2C1:R16C1,MOD(RC1+3,3)+MOD(INT((RC1+3)/3),3)*5+3,FALSE) -> 162|163|164|102|103 | J175: =HLOOKUP(Sheet1!R2C1,Sheet1!R2C1:R16C1,MOD(RC1-1,3)+MOD(INT((RC1-1)/3),3)*5+3,FALSE)&"|"&HLOOKUP(Sheet1!R2C1,Sheet1!R2C1:R16C1,MOD(RC1,3)+MOD(INT((RC1)/3),3)*5+3,FALSE)&"|"&HLOOKUP(Sheet1!R2C1,Sheet1!R2C1:R16C1,MOD(RC1+1,3)+MOD(INT((RC1+1)/3),3)*5+3,FALSE)&"|"&HLOOKUP(Sheet1!R2C1,Sheet1!R2C1:R16C1,MOD(RC1+2,3)+MOD(INT((RC1+2)/3),3)*5+3,FALSE)&"|"&HLOOKUP(Sheet1!R2C1,Sheet1!R2C1:R16C1,MOD(RC1+3,3)+MOD(INT((RC1+3)/3),3)*5+3,FALSE) -> 162|163|164|102|103 | K175: =HLOOKUP(Sheet1!R2C1,Sheet1!R2C1:R16C1,MOD(RC1-1,3)+MOD(INT((RC1-1)/3),3)*5+3,FALSE)&"|"&HLOOKUP(Sheet1!R2C1,Sheet1!R2C1:R16C1,MOD(RC1,3)+MOD(INT((RC1)/3),3)*5+3,FALSE)&"|"&HLOOKUP(Sheet1!R2C1,Sheet1!R2C1:R16C1,MOD(RC1+1,3)+MOD(INT((RC1+1)/3),3)*5+3,FALSE)&"|"&HLOOKUP(Sheet1!R2C1,Sheet1!R2C1:R16C1,MOD(RC1+2,3)+MOD(INT((RC1+2)/3),3)*5+3,FALSE)&"|"&HLOOKUP(Sheet1!R2C1,Sheet1!R2C1:R16C1,MOD(RC1+3,3)+MOD(INT((RC1+3)/3),3)*5+3,FALSE) -> 162|163|164|102|103 | L175: 25|22|23|24 | M175: 688570|688570|688570|688570 | N175: 10030|10031|10032|10033 | O175: 1|1|1|1 | P175: 2500|2500|2500|2500
A176: 170 | B176: 168 | C176: 30 | D176: =R[-20]C+2 -> 36 | E176: 1000 | F176: =MOD(RC[-5]-1,3)*30+100&"|"&MOD(RC[-5]-1,3)*30+101&"|"&MOD(RC[-5]-1,3)*30+102&"|"&MOD(RC[-5]-1,3)*30+103&"|"&IF(MOD(RC[-5],4)=0,HLOOKUP(Sheet1!R2C10,Sheet1!R2C10:R7C10,MOD(RC[-5]/4-1,6)+1,FALSE),IF(MOD(RC[-5],2)=0,IF(RC[-5]>20,HLOOKUP(Sheet1!R2C7,Sheet1!R2C7:R43C7,MOD(RC[-5]/2-1,42)+1,FALSE),HLOOKUP(Sheet1!R2C4,Sheet1!R2C4:R7C4,MOD(RC[-5]-1,6)+1,FALSE)),MOD(RC[-5]-1,3)*30+104)) -> 130|131|132|133|112 | G176: =HLOOKUP(Sheet1!R2C1,Sheet1!R2C1:R16C1,MOD(RC1-1,2)+MOD(INT((RC1-1)/2),3)*5+1,FALSE)&"|"&HLOOKUP(Sheet1!R2C1,Sheet1!R2C1:R16C1,MOD(RC1,2)+MOD(INT((RC1)/2),3)*5+1,FALSE)&"|"&HLOOKUP(Sheet1!R2C1,Sheet1!R2C1:R16C1,MOD(RC1+1,2)+MOD(INT((RC1+1)/2),3)*5+1,FALSE)&"|"&HLOOKUP(Sheet1!R2C1,Sheet1!R2C1:R16C1,MOD(RC1+2,2)+MOD(INT((RC1+2)/2),3)*5+1,FALSE)&"|"&HLOOKUP(Sheet1!R2C1,Sheet1!R2C1:R16C1,MOD(RC1+3,2)+MOD(INT((RC1+3)/2),3)*5+1,FALSE) -> 101|130|131|160|161 | H176: =HLOOKUP(Sheet1!R2C1,Sheet1!R2C1:R16C1,MOD(RC1+2,2)+MOD(INT((RC1+2)/2),3)*5+1,FALSE)&"|"&HLOOKUP(Sheet1!R2C1,Sheet1!R2C1:R16C1,MOD(RC1+3,2)+MOD(INT((RC1+3)/2),3)*5+1,FALSE)&"|"&HLOOKUP(Sheet1!R2C1,Sheet1!R2C1:R16C1,MOD(RC1+4,2)+MOD(INT((RC1+4)/2),3)*5+1,FALSE)&"|"&HLOOKUP(Sheet1!R2C1,Sheet1!R2C1:R16C1,MOD(RC1+5,2)+MOD(INT((RC1+5)/2),3)*5+1,FALSE)&"|"&HLOOKUP(Sheet1!R2C1,Sheet1!R2C1:R16C1,MOD(RC1+6,2)+MOD(INT((RC1+6)/2),3)*5+1,FALSE) -> 160|161|100|101|130 | I176: =HLOOKUP(Sheet1!R2C1,Sheet1!R2C1:R16C1,MOD(RC1-1,3)+MOD(INT((RC1-1)/3),3)*5+3,FALSE)&"|"&HLOOKUP(Sheet1!R2C1,Sheet1!R2C1:R16C1,MOD(RC1,3)+MOD(INT((RC1)/3),3)*5+3,FALSE)&"|"&HLOOKUP(Sheet1!R2C1,Sheet1!R2C1:R16C1,MOD(RC1+1,3)+MOD(INT((RC1+1)/3),3)*5+3,FALSE)&"|"&HLOOKUP(Sheet1!R2C1,Sheet1!R2C1:R16C1,MOD(RC1+2,3)+MOD(INT((RC1+2)/3),3)*5+3,FALSE)&"|"&HLOOKUP(Sheet1!R2C1,Sheet1!R2C1:R16C1,MOD(RC1+3,3)+MOD(INT((RC1+3)/3),3)*5+3,FALSE) -> 163|164|102|103|104 | J176: =HLOOKUP(Sheet1!R2C1,Sheet1!R2C1:R16C1,MOD(RC1-1,3)+MOD(INT((RC1-1)/3),3)*5+3,FALSE)&"|"&HLOOKUP(Sheet1!R2C1,Sheet1!R2C1:R16C1,MOD(RC1,3)+MOD(INT((RC1)/3),3)*5+3,FALSE)&"|"&HLOOKUP(Sheet1!R2C1,Sheet1!R2C1:R16C1,MOD(RC1+1,3)+MOD(INT((RC1+1)/3),3)*5+3,FALSE)&"|"&HLOOKUP(Sheet1!R2C1,Sheet1!R2C1:R16C1,MOD(RC1+2,3)+MOD(INT((RC1+2)/3),3)*5+3,FALSE)&"|"&HLOOKUP(Sheet1!R2C1,Sheet1!R2C1:R16C1,MOD(RC1+3,3)+MOD(INT((RC1+3)/3),3)*5+3,FALSE) -> 163|164|102|103|104 | K176: =HLOOKUP(Sheet1!R2C1,Sheet1!R2C1:R16C1,MOD(RC1-1,3)+MOD(INT((RC1-1)/3),3)*5+3,FALSE)&"|"&HLOOKUP(Sheet1!R2C1,Sheet1!R2C1:R16C1,MOD(RC1,3)+MOD(INT((RC1)/3),3)*5+3,FALSE)&"|"&HLOOKUP(Sheet1!R2C1,Sheet1!R2C1:R16C1,MOD(RC1+1,3)+MOD(INT((RC1+1)/3),3)*5+3,FALSE)&"|"&HLOOKUP(Sheet1!R2C1,Sheet1!R2C1:R16C1,MOD(RC1+2,3)+MOD(INT((RC1+2)/3),3)*5+3,FALSE)&"|"&HLOOKUP(Sheet1!R2C1,Sheet1!R2C1:R16C1,MOD(RC1+3,3)+MOD(INT((RC1+3)/3),3)*5+3,FALSE) -> 163|164|102|103|104 | L176: 25|22|23|24 | M176: 696629|696629|696628|696628 | N176: 10030|10031|10032|10033|10030|10031|10032|10033|10030|10031|10032|10033|10030|10031|10032|10033|10030|10031|10032|10033|10030|10031|10032|10033|10030|10031|10032|10033|10030|10031|10032|10033|10030|10031|10032|10033|10030|10031|10032|10033 | O176: 1|1|1|1|1|1|1|1|1|1|1|1|1|1|1|1|1|1|1|1|1|1|1|1|1|1|1|1|1|1|1|1|1|1|1|1|1|1|1|1 | P176: 2500|2500|2500|2500|2500|2500|2500|2500|2500|2500|2500|2500|2500|2500|2500|2500|2500|2500|2500|2500|2500|2500|2500|2500|2500|2500|2500|2500|2500|2500|2500|2500|2500|2500|2500|2500|2500|2500|2500|2500
A177: 171 | B177: 169 | C177: 30 | D177: =R[-20]C+2 -> 36 | E177: 1000 | F177: =MOD(RC[-5]-1,3)*30+100&"|"&MOD(RC[-5]-1,3)*30+101&"|"&MOD(RC[-5]-1,3)*30+102&"|"&MOD(RC[-5]-1,3)*30+103&"|"&IF(MOD(RC[-5],4)=0,HLOOKUP(Sheet1!R2C10,Sheet1!R2C10:R7C10,MOD(RC[-5]/4-1,6)+1,FALSE),IF(MOD(RC[-5],2)=0,IF(RC[-5]>20,HLOOKUP(Sheet1!R2C7,Sheet1!R2C7:R43C7,MOD(RC[-5]/2-1,42)+1,FALSE),HLOOKUP(Sheet1!R2C4,Sheet1!R2C4:R7C4,MOD(RC[-5]-1,6)+1,FALSE)),MOD(RC[-5]-1,3)*30+104)) -> 160|161|162|163|164 | G177: =HLOOKUP(Sheet1!R2C1,Sheet1!R2C1:R16C1,MOD(RC1-1,2)+MOD(INT((RC1-1)/2),3)*5+1,FALSE)&"|"&HLOOKUP(Sheet1!R2C1,Sheet1!R2C1:R16C1,MOD(RC1,2)+MOD(INT((RC1)/2),3)*5+1,FALSE)&"|"&HLOOKUP(Sheet1!R2C1,Sheet1!R2C1:R16C1,MOD(RC1+1,2)+MOD(INT((RC1+1)/2),3)*5+1,FALSE)&"|"&HLOOKUP(Sheet1!R2C1,Sheet1!R2C1:R16C1,MOD(RC1+2,2)+MOD(INT((RC1+2)/2),3)*5+1,FALSE)&"|"&HLOOKUP(Sheet1!R2C1,Sheet1!R2C1:R16C1,MOD(RC1+3,2)+MOD(INT((RC1+3)/2),3)*5+1,FALSE) -> 130|131|160|161|100 | H177: =HLOOKUP(Sheet1!R2C1,Sheet1!R2C1:R16C1,MOD(RC1+2,2)+MOD(INT((RC1+2)/2),3)*5+1,FALSE)&"|"&HLOOKUP(Sheet1!R2C1,Sheet1!R2C1:R16C1,MOD(RC1+3,2)+MOD(INT((RC1+3)/2),3)*5+1,FALSE)&"|"&HLOOKUP(Sheet1!R2C1,Sheet1!R2C1:R16C1,MOD(RC1+4,2)+MOD(INT((RC1+4)/2),3)*5+1,FALSE)&"|"&HLOOKUP(Sheet1!R2C1,Sheet1!R2C1:R16C1,MOD(RC1+5,2)+MOD(INT((RC1+5)/2),3)*5+1,FALSE)&"|"&HLOOKUP(Sheet1!R2C1,Sheet1!R2C1:R16C1,MOD(RC1+6,2)+MOD(INT((RC1+6)/2),3)*5+1,FALSE) -> 161|100|101|130|131 | I177: =HLOOKUP(Sheet1!R2C1,Sheet1!R2C1:R16C1,MOD(RC1-1,3)+MOD(INT((RC1-1)/3),3)*5+3,FALSE)&"|"&HLOOKUP(Sheet1!R2C1,Sheet1!R2C1:R16C1,MOD(RC1,3)+MOD(INT((RC1)/3),3)*5+3,FALSE)&"|"&HLOOKUP(Sheet1!R2C1,Sheet1!R2C1:R16C1,MOD(RC1+1,3)+MOD(INT((RC1+1)/3),3)*5+3,FALSE)&"|"&HLOOKUP(Sheet1!R2C1,Sheet1!R2C1:R16C1,MOD(RC1+2,3)+MOD(INT((RC1+2)/3),3)*5+3,FALSE)&"|"&HLOOKUP(Sheet1!R2C1,Sheet1!R2C1:R16C1,MOD(RC1+3,3)+MOD(INT((RC1+3)/3),3)*5+3,FALSE) -> 164|102|103|104|132 | J177: =HLOOKUP(Sheet1!R2C1,Sheet1!R2C1:R16C1,MOD(RC1-1,3)+MOD(INT((RC1-1)/3),3)*5+3,FALSE)&"|"&HLOOKUP(Sheet1!R2C1,Sheet1!R2C1:R16C1,MOD(RC1,3)+MOD(INT((RC1)/3),3)*5+3,FALSE)&"|"&HLOOKUP(Sheet1!R2C1,Sheet1!R2C1:R16C1,MOD(RC1+1,3)+MOD(INT((RC1+1)/3),3)*5+3,FALSE)&"|"&HLOOKUP(Sheet1!R2C1,Sheet1!R2C1:R16C1,MOD(RC1+2,3)+MOD(INT((RC1+2)/3),3)*5+3,FALSE)&"|"&HLOOKUP(Sheet1!R2C1,Sheet1!R2C1:R16C1,MOD(RC1+3,3)+MOD(INT((RC1+3)/3),3)*5+3,FALSE) -> 164|102|103|104|132 | K177: =HLOOKUP(Sheet1!R2C1,Sheet1!R2C1:R16C1,MOD(RC1-1,3)+MOD(INT((RC1-1)/3),3)*5+3,FALSE)&"|"&HLOOKUP(Sheet1!R2C1,Sheet1!R2C1:R16C1,MOD(RC1,3)+MOD(INT((RC1)/3),3)*5+3,FALSE)&"|"&HLOOKUP(Sheet1!R2C1,Sheet1!R2C1:R16C1,MOD(RC1+1,3)+MOD(INT((RC1+1)/3),3)*5+3,FALSE)&"|"&HLOOKUP(Sheet1!R2C1,Sheet1!R2C1:R16C1,MOD(RC1+2,3)+MOD(INT((RC1+2)/3),3)*5+3,FALSE)&"|"&HLOOKUP(Sheet1!R2C1,Sheet1!R2C1:R16C1,MOD(RC1+3,3)+MOD(INT((RC1+3)/3),3)*5+3,FALSE) -> 164|102|103|104|132 | L177: 25|22|23|24 | M177: 705604|705604|705605|705605 | N177: 10030|10031|10032|10033 | O177: 1|1|1|1 | P177: 2500|2500|2500|2500
A178: 172 | B178: 170 | C178: 30 | D178: =R[-20]C+2 -> 36 | E178: 1000 | F178: =MOD(RC[-5]-1,3)*30+100&"|"&MOD(RC[-5]-1,3)*30+101&"|"&MOD(RC[-5]-1,3)*30+102&"|"&MOD(RC[-5]-1,3)*30+103&"|"&IF(MOD(RC[-5],4)=0,HLOOKUP(Sheet1!R2C10,Sheet1!R2C10:R7C10,MOD(RC[-5]/4-1,6)+1,FALSE),IF(MOD(RC[-5],2)=0,IF(RC[-5]>20,HLOOKUP(Sheet1!R2C7,Sheet1!R2C7:R43C7,MOD(RC[-5]/2-1,42)+1,FALSE),HLOOKUP(Sheet1!R2C4,Sheet1!R2C4:R7C4,MOD(RC[-5]-1,6)+1,FALSE)),MOD(RC[-5]-1,3)*30+104)) -> 100|101|102|103|190 | G178: =HLOOKUP(Sheet1!R2C1,Sheet1!R2C1:R16C1,MOD(RC1-1,2)+MOD(INT((RC1-1)/2),3)*5+1,FALSE)&"|"&HLOOKUP(Sheet1!R2C1,Sheet1!R2C1:R16C1,MOD(RC1,2)+MOD(INT((RC1)/2),3)*5+1,FALSE)&"|"&HLOOKUP(Sheet1!R2C1,Sheet1!R2C1:R16C1,MOD(RC1+1,2)+MOD(INT((RC1+1)/2),3)*5+1,FALSE)&"|"&HLOOKUP(Sheet1!R2C1,Sheet1!R2C1:R16C1,MOD(RC1+2,2)+MOD(INT((RC1+2)/2),3)*5+1,FALSE)&"|"&HLOOKUP(Sheet1!R2C1,Sheet1!R2C1:R16C1,MOD(RC1+3,2)+MOD(INT((RC1+3)/2),3)*5+1,FALSE) -> 131|160|161|100|101 | H178: =HLOOKUP(Sheet1!R2C1,Sheet1!R2C1:R16C1,MOD(RC1+2,2)+MOD(INT((RC1+2)/2),3)*5+1,FALSE)&"|"&HLOOKUP(Sheet1!R2C1,Sheet1!R2C1:R16C1,MOD(RC1+3,2)+MOD(INT((RC1+3)/2),3)*5+1,FALSE)&"|"&HLOOKUP(Sheet1!R2C1,Sheet1!R2C1:R16C1,MOD(RC1+4,2)+MOD(INT((RC1+4)/2),3)*5+1,FALSE)&"|"&HLOOKUP(Sheet1!R2C1,Sheet1!R2C1:R16C1,MOD(RC1+5,2)+MOD(INT((RC1+5)/2),3)*5+1,FALSE)&"|"&HLOOKUP(Sheet1!R2C1,Sheet1!R2C1:R16C1,MOD(RC1+6,2)+MOD(INT((RC1+6)/2),3)*5+1,FALSE) -> 100|101|130|131|160 | I178: =HLOOKUP(Sheet1!R2C1,Sheet1!R2C1:R16C1,MOD(RC1-1,3)+MOD(INT((RC1-1)/3),3)*5+3,FALSE)&"|"&HLOOKUP(Sheet1!R2C1,Sheet1!R2C1:R16C1,MOD(RC1,3)+MOD(INT((RC1)/3),3)*5+3,FALSE)&"|"&HLOOKUP(Sheet1!R2C1,Sheet1!R2C1:R16C1,MOD(RC1+1,3)+MOD(INT((RC1+1)/3),3)*5+3,FALSE)&"|"&HLOOKUP(Sheet1!R2C1,Sheet1!R2C1:R16C1,MOD(RC1+2,3)+MOD(INT((RC1+2)/3),3)*5+3,FALSE)&"|"&HLOOKUP(Sheet1!R2C1,Sheet1!R2C1:R16C1,MOD(RC1+3,3)+MOD(INT((RC1+3)/3),3)*5+3,FALSE) -> 102|103|104|132|133 | J178: =HLOOKUP(Sheet1!R2C1,Sheet1!R2C1:R16C1,MOD(RC1-1,3)+MOD(INT((RC1-1)/3),3)*5+3,FALSE)&"|"&HLOOKUP(Sheet1!R2C1,Sheet1!R2C1:R16C1,MOD(RC1,3)+MOD(INT((RC1)/3),3)*5+3,FALSE)&"|"&HLOOKUP(Sheet1!R2C1,Sheet1!R2C1:R16C1,MOD(RC1+1,3)+MOD(INT((RC1+1)/3),3)*5+3,FALSE)&"|"&HLOOKUP(Sheet1!R2C1,Sheet1!R2C1:R16C1,MOD(RC1+2,3)+MOD(INT((RC1+2)/3),3)*5+3,FALSE)&"|"&HLOOKUP(Sheet1!R2C1,Sheet1!R2C1:R16C1,MOD(RC1+3,3)+MOD(INT((RC1+3)/3),3)*5+3,FALSE) -> 102|103|104|132|133 | K178: =HLOOKUP(Sheet1!R2C1,Sheet1!R2C1:R16C1,MOD(RC1-1,3)+MOD(INT((RC1-1)/3),3)*5+3,FALSE)&"|"&HLOOKUP(Sheet1!R2C1,Sheet1!R2C1:R16C1,MOD(RC1,3)+MOD(INT((RC1)/3),3)*5+3,FALSE)&"|"&HLOOKUP(Sheet1!R2C1,Sheet1!R2C1:R16C1,MOD(RC1+1,3)+MOD(INT((RC1+1)/3),3)*5+3,FALSE)&"|"&HLOOKUP(Sheet1!R2C1,Sheet1!R2C1:R16C1,MOD(RC1+2,3)+MOD(INT((RC1+2)/3),3)*5+3,FALSE)&"|"&HLOOKUP(Sheet1!R2C1,Sheet1!R2C1:R16C1,MOD(RC1+3,3)+MOD(INT((RC1+3)/3),3)*5+3,FALSE) -> 102|103|104|132|133 | L178: 25|22|23|24 | M178: 715167|715166|715168|715168 | N178: 10030|10031|10032|10033 | O178: 1|1|1|1 | P178: 2500|2500|2500|2500
A179: 173 | B179: 171 | C179: 30 | D179: =R[-20]C+2 -> 36 | E179: 1000 | F179: =MOD(RC[-5]-1,3)*30+100&"|"&MOD(RC[-5]-1,3)*30+101&"|"&MOD(RC[-5]-1,3)*30+102&"|"&MOD(RC[-5]-1,3)*30+103&"|"&IF(MOD(RC[-5],4)=0,HLOOKUP(Sheet1!R2C10,Sheet1!R2C10:R7C10,MOD(RC[-5]/4-1,6)+1,FALSE),IF(MOD(RC[-5],2)=0,IF(RC[-5]>20,HLOOKUP(Sheet1!R2C7,Sheet1!R2C7:R43C7,MOD(RC[-5]/2-1,42)+1,FALSE),HLOOKUP(Sheet1!R2C4,Sheet1!R2C4:R7C4,MOD(RC[-5]-1,6)+1,FALSE)),MOD(RC[-5]-1,3)*30+104)) -> 130|131|132|133|134 | G179: =HLOOKUP(Sheet1!R2C1,Sheet1!R2C1:R16C1,MOD(RC1-1,2)+MOD(INT((RC1-1)/2),3)*5+1,FALSE)&"|"&HLOOKUP(Sheet1!R2C1,Sheet1!R2C1:R16C1,MOD(RC1,2)+MOD(INT((RC1)/2),3)*5+1,FALSE)&"|"&HLOOKUP(Sheet1!R2C1,Sheet1!R2C1:R16C1,MOD(RC1+1,2)+MOD(INT((RC1+1)/2),3)*5+1,FALSE)&"|"&HLOOKUP(Sheet1!R2C1,Sheet1!R2C1:R16C1,MOD(RC1+2,2)+MOD(INT((RC1+2)/2),3)*5+1,FALSE)&"|"&HLOOKUP(Sheet1!R2C1,Sheet1!R2C1:R16C1,MOD(RC1+3,2)+MOD(INT((RC1+3)/2),3)*5+1,FALSE) -> 160|161|100|101|130 | H179: =HLOOKUP(Sheet1!R2C1,Sheet1!R2C1:R16C1,MOD(RC1+2,2)+MOD(INT((RC1+2)/2),3)*5+1,FALSE)&"|"&HLOOKUP(Sheet1!R2C1,Sheet1!R2C1:R16C1,MOD(RC1+3,2)+MOD(INT((RC1+3)/2),3)*5+1,FALSE)&"|"&HLOOKUP(Sheet1!R2C1,Sheet1!R2C1:R16C1,MOD(RC1+4,2)+MOD(INT((RC1+4)/2),3)*5+1,FALSE)&"|"&HLOOKUP(Sheet1!R2C1,Sheet1!R2C1:R16C1,MOD(RC1+5,2)+MOD(INT((RC1+5)/2),3)*5+1,FALSE)&"|"&HLOOKUP(Sheet1!R2C1,Sheet1!R2C1:R16C1,MOD(RC1+6,2)+MOD(INT((RC1+6)/2),3)*5+1,FALSE) -> 101|130|131|160|161 | I179: =HLOOKUP(Sheet1!R2C1,Sheet1!R2C1:R16C1,MOD(RC1-1,3)+MOD(INT((RC1-1)/3),3)*5+3,FALSE)&"|"&HLOOKUP(Sheet1!R2C1,Sheet1!R2C1:R16C1,MOD(RC1,3)+MOD(INT((RC1)/3),3)*5+3,FALSE)&"|"&HLOOKUP(Sheet1!R2C1,Sheet1!R2C1:R16C1,MOD(RC1+1,3)+MOD(INT((RC1+1)/3),3)*5+3,FALSE)&"|"&HLOOKUP(Sheet1!R2C1,Sheet1!R2C1:R16C1,MOD(RC1+2,3)+MOD(INT((RC1+2)/3),3)*5+3,FALSE)&"|"&HLOOKUP(Sheet1!R2C1,Sheet1!R2C1:R16C1,MOD(RC1+3,3)+MOD(INT((RC1+3)/3),3)*5+3,FALSE) -> 103|104|132|133|134 | J179: =HLOOKUP(Sheet1!R2C1,Sheet1!R2C1:R16C1,MOD(RC1-1,3)+MOD(INT((RC1-1)/3),3)*5+3,FALSE)&"|"&HLOOKUP(Sheet1!R2C1,Sheet1!R2C1:R16C1,MOD(RC1,3)+MOD(INT((RC1)/3),3)*5+3,FALSE)&"|"&HLOOKUP(Sheet1!R2C1,Sheet1!R2C1:R16C1,MOD(RC1+1,3)+MOD(INT((RC1+1)/3),3)*5+3,FALSE)&"|"&HLOOKUP(Sheet1!R2C1,Sheet1!R2C1:R16C1,MOD(RC1+2,3)+MOD(INT((RC1+2)/3),3)*5+3,FALSE)&"|"&HLOOKUP(Sheet1!R2C1,Sheet1!R2C1:R16C1,MOD(RC1+3,3)+MOD(INT((RC1+3)/3),3)*5+3,FALSE) -> 103|104|132|133|134 | K179: =HLOOKUP(Sheet1!R2C1,Sheet1!R2C1:R16C1,MOD(RC1-1,3)+MOD(INT((RC1-1)/3),3)*5+3,FALSE)&"|"&HLOOKUP(Sheet1!R2C1,Sheet1!R2C1:R16C1,MOD(RC1,3)+MOD(INT((RC1)/3),3)*5+3,FALSE)&"|"&HLOOKUP(Sheet1!R2C1,Sheet1!R2C1:R16C1,MOD(RC1+1,3)+MOD(INT((RC1+1)/3),3)*5+3,FALSE)&"|"&HLOOKUP(Sheet1!R2C1,Sheet1!R2C1:R16C1,MOD(RC1+2,3)+MOD(INT((RC1+2)/3),3)*5+3,FALSE)&"|"&HLOOKUP(Sheet1!R2C1,Sheet1!R2C1:R16C1,MOD(RC1+3,3)+MOD(INT((RC1+3)/3),3)*5+3,FALSE) -> 103|104|132|133|134 | L179: 25|22|23|24 | M179: 724399|724399|724400|724400 | N179: 10030|10031|10032|10033 | O179: 1|1|1|1 | P179: 2500|2500|2500|2500
A180: 174 | B180: 172 | C180: 30 | D180: =R[-20]C+2 -> 36 | E180: 1000 | F180: =MOD(RC[-5]-1,3)*30+100&"|"&MOD(RC[-5]-1,3)*30+101&"|"&MOD(RC[-5]-1,3)*30+102&"|"&MOD(RC[-5]-1,3)*30+103&"|"&IF(MOD(RC[-5],4)=0,HLOOKUP(Sheet1!R2C10,Sheet1!R2C10:R7C10,MOD(RC[-5]/4-1,6)+1,FALSE),IF(MOD(RC[-5],2)=0,IF(RC[-5]>20,HLOOKUP(Sheet1!R2C7,Sheet1!R2C7:R43C7,MOD(RC[-5]/2-1,42)+1,FALSE),HLOOKUP(Sheet1!R2C4,Sheet1!R2C4:R7C4,MOD(RC[-5]-1,6)+1,FALSE)),MOD(RC[-5]-1,3)*30+104)) -> 160|161|162|163|114 | G180: =HLOOKUP(Sheet1!R2C1,Sheet1!R2C1:R16C1,MOD(RC1-1,2)+MOD(INT((RC1-1)/2),3)*5+1,FALSE)&"|"&HLOOKUP(Sheet1!R2C1,Sheet1!R2C1:R16C1,MOD(RC1,2)+MOD(INT((RC1)/2),3)*5+1,FALSE)&"|"&HLOOKUP(Sheet1!R2C1,Sheet1!R2C1:R16C1,MOD(RC1+1,2)+MOD(INT((RC1+1)/2),3)*5+1,FALSE)&"|"&HLOOKUP(Sheet1!R2C1,Sheet1!R2C1:R16C1,MOD(RC1+2,2)+MOD(INT((RC1+2)/2),3)*5+1,FALSE)&"|"&HLOOKUP(Sheet1!R2C1,Sheet1!R2C1:R16C1,MOD(RC1+3,2)+MOD(INT((RC1+3)/2),3)*5+1,FALSE) -> 161|100|101|130|131 | H180: =HLOOKUP(Sheet1!R2C1,Sheet1!R2C1:R16C1,MOD(RC1+2,2)+MOD(INT((RC1+2)/2),3)*5+1,FALSE)&"|"&HLOOKUP(Sheet1!R2C1,Sheet1!R2C1:R16C1,MOD(RC1+3,2)+MOD(INT((RC1+3)/2),3)*5+1,FALSE)&"|"&HLOOKUP(Sheet1!R2C1,Sheet1!R2C1:R16C1,MOD(RC1+4,2)+MOD(INT((RC1+4)/2),3)*5+1,FALSE)&"|"&HLOOKUP(Sheet1!R2C1,Sheet1!R2C1:R16C1,MOD(RC1+5,2)+MOD(INT((RC1+5)/2),3)*5+1,FALSE)&"|"&HLOOKUP(Sheet1!R2C1,Sheet1!R2C1:R16C1,MOD(RC1+6,2)+MOD(INT((RC1+6)/2),3)*5+1,FALSE) -> 130|131|160|161|100 | I180: =HLOOKUP(Sheet1!R2C1,Sheet1!R2C1:R16C1,MOD(RC1-1,3)+MOD(INT((RC1-1)/3),3)*5+3,FALSE)&"|"&HLOOKUP(Sheet1!R2C1,Sheet1!R2C1:R16C1,MOD(RC1,3)+MOD(INT((RC1)/3),3)*5+3,FALSE)&"|"&HLOOKUP(Sheet1!R2C1,Sheet1!R2C1:R16C1,MOD(RC1+1,3)+MOD(INT((RC1+1)/3),3)*5+3,FALSE)&"|"&HLOOKUP(Sheet1!R2C1,Sheet1!R2C1:R16C1,MOD(RC1+2,3)+MOD(INT((RC1+2)/3),3)*5+3,FALSE)&"|"&HLOOKUP(Sheet1!R2C1,Sheet1!R2C1:R16C1,MOD(RC1+3,3)+MOD(INT((RC1+3)/3),3)*5+3,FALSE) -> 104|132|133|134|162 | J180: =HLOOKUP(Sheet1!R2C1,Sheet1!R2C1:R16C1,MOD(RC1-1,3)+MOD(INT((RC1-1)/3),3)*5+3,FALSE)&"|"&HLOOKUP(Sheet1!R2C1,Sheet1!R2C1:R16C1,MOD(RC1,3)+MOD(INT((RC1)/3),3)*5+3,FALSE)&"|"&HLOOKUP(Sheet1!R2C1,Sheet1!R2C1:R16C1,MOD(RC1+1,3)+MOD(INT((RC1+1)/3),3)*5+3,FALSE)&"|"&HLOOKUP(Sheet1!R2C1,Sheet1!R2C1:R16C1,MOD(RC1+2,3)+MOD(INT((RC1+2)/3),3)*5+3,FALSE)&"|"&HLOOKUP(Sheet1!R2C1,Sheet1!R2C1:R16C1,MOD(RC1+3,3)+MOD(INT((RC1+3)/3),3)*5+3,FALSE) -> 104|132|133|134|162 | K180: =HLOOKUP(Sheet1!R2C1,Sheet1!R2C1:R16C1,MOD(RC1-1,3)+MOD(INT((RC1-1)/3),3)*5+3,FALSE)&"|"&HLOOKUP(Sheet1!R2C1,Sheet1!R2C1:R16C1,MOD(RC1,3)+MOD(INT((RC1)/3),3)*5+3,FALSE)&"|"&HLOOKUP(Sheet1!R2C1,Sheet1!R2C1:R16C1,MOD(RC1+1,3)+MOD(INT((RC1+1)/3),3)*5+3,FALSE)&"|"&HLOOKUP(Sheet1!R2C1,Sheet1!R2C1:R16C1,MOD(RC1+2,3)+MOD(INT((RC1+2)/3),3)*5+3,FALSE)&"|"&HLOOKUP(Sheet1!R2C1,Sheet1!R2C1:R16C1,MOD(RC1+3,3)+MOD(INT((RC1+3)/3),3)*5+3,FALSE) -> 104|132|133|134|162 | L180: 25|22|23|24 | M180: 733937|733936|733938|733938 | N180: 10030|10031|10032|10033 | O180: 1|1|1|1 | P180: 2500|2500|2500|2500
A181: 175 | B181: 173 | C181: 30 | D181: =R[-20]C+2 -> 36 | E181: 1000 | F181: =MOD(RC[-5]-1,3)*30+100&"|"&MOD(RC[-5]-1,3)*30+101&"|"&MOD(RC[-5]-1,3)*30+102&"|"&MOD(RC[-5]-1,3)*30+103&"|"&IF(MOD(RC[-5],4)=0,HLOOKUP(Sheet1!R2C10,Sheet1!R2C10:R7C10,MOD(RC[-5]/4-1,6)+1,FALSE),IF(MOD(RC[-5],2)=0,IF(RC[-5]>20,HLOOKUP(Sheet1!R2C7,Sheet1!R2C7:R43C7,MOD(RC[-5]/2-1,42)+1,FALSE),HLOOKUP(Sheet1!R2C4,Sheet1!R2C4:R7C4,MOD(RC[-5]-1,6)+1,FALSE)),MOD(RC[-5]-1,3)*30+104)) -> 100|101|102|103|104 | G181: =HLOOKUP(Sheet1!R2C1,Sheet1!R2C1:R16C1,MOD(RC1-1,2)+MOD(INT((RC1-1)/2),3)*5+1,FALSE)&"|"&HLOOKUP(Sheet1!R2C1,Sheet1!R2C1:R16C1,MOD(RC1,2)+MOD(INT((RC1)/2),3)*5+1,FALSE)&"|"&HLOOKUP(Sheet1!R2C1,Sheet1!R2C1:R16C1,MOD(RC1+1,2)+MOD(INT((RC1+1)/2),3)*5+1,FALSE)&"|"&HLOOKUP(Sheet1!R2C1,Sheet1!R2C1:R16C1,MOD(RC1+2,2)+MOD(INT((RC1+2)/2),3)*5+1,FALSE)&"|"&HLOOKUP(Sheet1!R2C1,Sheet1!R2C1:R16C1,MOD(RC1+3,2)+MOD(INT((RC1+3)/2),3)*5+1,FALSE) -> 100|101|130|131|160 | H181: =HLOOKUP(Sheet1!R2C1,Sheet1!R2C1:R16C1,MOD(RC1+2,2)+MOD(INT((RC1+2)/2),3)*5+1,FALSE)&"|"&HLOOKUP(Sheet1!R2C1,Sheet1!R2C1:R16C1,MOD(RC1+3,2)+MOD(INT((RC1+3)/2),3)*5+1,FALSE)&"|"&HLOOKUP(Sheet1!R2C1,Sheet1!R2C1:R16C1,MOD(RC1+4,2)+MOD(INT((RC1+4)/2),3)*5+1,FALSE)&"|"&HLOOKUP(Sheet1!R2C1,Sheet1!R2C1:R16C1,MOD(RC1+5,2)+MOD(INT((RC1+5)/2),3)*5+1,FALSE)&"|"&HLOOKUP(Sheet1!R2C1,Sheet1!R2C1:R16C1,MOD(RC1+6,2)+MOD(INT((RC1+6)/2),3)*5+1,FALSE) -> 131|160|161|100|101 | I181: =HLOOKUP(Sheet1!R2C1,Sheet1!R2C1:R16C1,MOD(RC1-1,3)+MOD(INT((RC1-1)/3),3)*5+3,FALSE)&"|"&HLOOKUP(Sheet1!R2C1,Sheet1!R2C1:R16C1,MOD(RC1,3)+MOD(INT((RC1)/3),3)*5+3,FALSE)&"|"&HLOOKUP(Sheet1!R2C1,Sheet1!R2C1:R16C1,MOD(RC1+1,3)+MOD(INT((RC1+1)/3),3)*5+3,FALSE)&"|"&HLOOKUP(Sheet1!R2C1,Sheet1!R2C1:R16C1,MOD(RC1+2,3)+MOD(INT((RC1+2)/3),3)*5+3,FALSE)&"|"&HLOOKUP(Sheet1!R2C1,Sheet1!R2C1:R16C1,MOD(RC1+3,3)+MOD(INT((RC1+3)/3),3)*5+3,FALSE) -> 132|133|134|162|163 | J181: =HLOOKUP(Sheet1!R2C1,Sheet1!R2C1:R16C1,MOD(RC1-1,3)+MOD(INT((RC1-1)/3),3)*5+3,FALSE)&"|"&HLOOKUP(Sheet1!R2C1,Sheet1!R2C1:R16C1,MOD(RC1,3)+MOD(INT((RC1)/3),3)*5+3,FALSE)&"|"&HLOOKUP(Sheet1!R2C1,Sheet1!R2C1:R16C1,MOD(RC1+1,3)+MOD(INT((RC1+1)/3),3)*5+3,FALSE)&"|"&HLOOKUP(Sheet1!R2C1,Sheet1!R2C1:R16C1,MOD(RC1+2,3)+MOD(INT((RC1+2)/3),3)*5+3,FALSE)&"|"&HLOOKUP(Sheet1!R2C1,Sheet1!R2C1:R16C1,MOD(RC1+3,3)+MOD(INT((RC1+3)/3),3)*5+3,FALSE) -> 132|133|134|162|163 | K181: =HLOOKUP(Sheet1!R2C1,Sheet1!R2C1:R16C1,MOD(RC1-1,3)+MOD(INT((RC1-1)/3),3)*5+3,FALSE)&"|"&HLOOKUP(Sheet1!R2C1,Sheet1!R2C1:R16C1,MOD(RC1,3)+MOD(INT((RC1)/3),3)*5+3,FALSE)&"|"&HLOOKUP(Sheet1!R2C1,Sheet1!R2C1:R16C1,MOD(RC1+1,3)+MOD(INT((RC1+1)/3),3)*5+3,FALSE)&"|"&HLOOKUP(Sheet1!R2C1,Sheet1!R2C1:R16C1,MOD(RC1+2,3)+MOD(INT((RC1+2)/3),3)*5+3,FALSE)&"|"&HLOOKUP(Sheet1!R2C1,Sheet1!R2C1:R16C1,MOD(RC1+3,3)+MOD(INT((RC1+3)/3),3)*5+3,FALSE) -> 132|133|134|162|163 | L181: 25|22|23|24 | M181: 742466|742465|742465|742465 | N181: 10030|10031|10032|10033|10030|10031|10032|10033|10030|10031|10032|10033|10030|10031|10032|10033|10030|10031|10032|10033|10030|10031|10032|10033|10030|10031|10032|10033|10030|10031|10032|10033|10030|10031|10032|10033|10030|10031|10032|10033 | O181: 1|1|1|1|1|1|1|1|1|1|1|1|1|1|1|1|1|1|1|1|1|1|1|1|1|1|1|1|1|1|1|1|1|1|1|1|1|1|1|1 | P181: 2500|2500|2500|2500|2500|2500|2500|2500|2500|2500|2500|2500|2500|2500|2500|2500|2500|2500|2500|2500|2500|2500|2500|2500|2500|2500|2500|2500|2500|2500|2500|2500|2500|2500|2500|2500|2500|2500|2500|2500
A182: 176 | B182: 174 | C182: 30 | D182: =R[-20]C+2 -> 36 | E182: 1000 | F182: =MOD(RC[-5]-1,3)*30+100&"|"&MOD(RC[-5]-1,3)*30+101&"|"&MOD(RC[-5]-1,3)*30+102&"|"&MOD(RC[-5]-1,3)*30+103&"|"&IF(MOD(RC[-5],4)=0,HLOOKUP(Sheet1!R2C10,Sheet1!R2C10:R7C10,MOD(RC[-5]/4-1,6)+1,FALSE),IF(MOD(RC[-5],2)=0,IF(RC[-5]>20,HLOOKUP(Sheet1!R2C7,Sheet1!R2C7:R43C7,MOD(RC[-5]/2-1,42)+1,FALSE),HLOOKUP(Sheet1!R2C4,Sheet1!R2C4:R7C4,MOD(RC[-5]-1,6)+1,FALSE)),MOD(RC[-5]-1,3)*30+104)) -> 130|131|132|133|191 | G182: =HLOOKUP(Sheet1!R2C1,Sheet1!R2C1:R16C1,MOD(RC1-1,2)+MOD(INT((RC1-1)/2),3)*5+1,FALSE)&"|"&HLOOKUP(Sheet1!R2C1,Sheet1!R2C1:R16C1,MOD(RC1,2)+MOD(INT((RC1)/2),3)*5+1,FALSE)&"|"&HLOOKUP(Sheet1!R2C1,Sheet1!R2C1:R16C1,MOD(RC1+1,2)+MOD(INT((RC1+1)/2),3)*5+1,FALSE)&"|"&HLOOKUP(Sheet1!R2C1,Sheet1!R2C1:R16C1,MOD(RC1+2,2)+MOD(INT((RC1+2)/2),3)*5+1,FALSE)&"|"&HLOOKUP(Sheet1!R2C1,Sheet1!R2C1:R16C1,MOD(RC1+3,2)+MOD(INT((RC1+3)/2),3)*5+1,FALSE) -> 101|130|131|160|161 | H182: =HLOOKUP(Sheet1!R2C1,Sheet1!R2C1:R16C1,MOD(RC1+2,2)+MOD(INT((RC1+2)/2),3)*5+1,FALSE)&"|"&HLOOKUP(Sheet1!R2C1,Sheet1!R2C1:R16C1,MOD(RC1+3,2)+MOD(INT((RC1+3)/2),3)*5+1,FALSE)&"|"&HLOOKUP(Sheet1!R2C1,Sheet1!R2C1:R16C1,MOD(RC1+4,2)+MOD(INT((RC1+4)/2),3)*5+1,FALSE)&"|"&HLOOKUP(Sheet1!R2C1,Sheet1!R2C1:R16C1,MOD(RC1+5,2)+MOD(INT((RC1+5)/2),3)*5+1,FALSE)&"|"&HLOOKUP(Sheet1!R2C1,Sheet1!R2C1:R16C1,MOD(RC1+6,2)+MOD(INT((RC1+6)/2),3)*5+1,FALSE) -> 160|161|100|101|130 | I182: =HLOOKUP(Sheet1!R2C1,Sheet1!R2C1:R16C1,MOD(RC1-1,3)+MOD(INT((RC1-1)/3),3)*5+3,FALSE)&"|"&HLOOKUP(Sheet1!R2C1,Sheet1!R2C1:R16C1,MOD(RC1,3)+MOD(INT((RC1)/3),3)*5+3,FALSE)&"|"&HLOOKUP(Sheet1!R2C1,Sheet1!R2C1:R16C1,MOD(RC1+1,3)+MOD(INT((RC1+1)/3),3)*5+3,FALSE)&"|"&HLOOKUP(Sheet1!R2C1,Sheet1!R2C1:R16C1,MOD(RC1+2,3)+MOD(INT((RC1+2)/3),3)*5+3,FALSE)&"|"&HLOOKUP(Sheet1!R2C1,Sheet1!R2C1:R16C1,MOD(RC1+3,3)+MOD(INT((RC1+3)/3),3)*5+3,FALSE) -> 133|134|162|163|164 | J182: =HLOOKUP(Sheet1!R2C1,Sheet1!R2C1:R16C1,MOD(RC1-1,3)+MOD(INT((RC1-1)/3),3)*5+3,FALSE)&"|"&HLOOKUP(Sheet1!R2C1,Sheet1!R2C1:R16C1,MOD(RC1,3)+MOD(INT((RC1)/3),3)*5+3,FALSE)&"|"&HLOOKUP(Sheet1!R2C1,Sheet1!R2C1:R16C1,MOD(RC1+1,3)+MOD(INT((RC1+1)/3),3)*5+3,FALSE)&"|"&HLOOKUP(Sheet1!R2C1,Sheet1!R2C1:R16C1,MOD(RC1+2,3)+MOD(INT((RC1+2)/3),3)*5+3,FALSE)&"|"&HLOOKUP(Sheet1!R2C1,Sheet1!R2C1:R16C1,MOD(RC1+3,3)+MOD(INT((RC1+3)/3),3)*5+3,FALSE) -> 133|134|162|163|164 | K182: =HLOOKUP(Sheet1!R2C1,Sheet1!R2C1:R16C1,MOD(RC1-1,3)+MOD(INT((RC1-1)/3),3)*5+3,FALSE)&"|"&HLOOKUP(Sheet1!R2C1,Sheet1!R2C1:R16C1,MOD(RC1,3)+MOD(INT((RC1)/3),3)*5+3,FALSE)&"|"&HLOOKUP(Sheet1!R2C1,Sheet1!R2C1:R16C1,MOD(RC1+1,3)+MOD(INT((RC1+1)/3),3)*5+3,FALSE)&"|"&HLOOKUP(Sheet1!R2C1,Sheet1!R2C1:R16C1,MOD(RC1+2,3)+MOD(INT((RC1+2)/3),3)*5+3,FALSE)&"|"&HLOOKUP(Sheet1!R2C1,Sheet1!R2C1:R16C1,MOD(RC1+3,3)+MOD(INT((RC1+3)/3),3)*5+3,FALSE) -> 133|134|162|163|164 | L182: 25|22|23|24 | M182: 751299|751299|751300|751300 | N182: 10030|10031|10032|10033 | O182: 1|1|1|1 | P182: 2500|2500|2500|2500
A183: 177 | B183: 175 | C183: 30 | D183: =R[-20]C+2 -> 36 | E183: 1000 | F183: =MOD(RC[-5]-1,3)*30+100&"|"&MOD(RC[-5]-1,3)*30+101&"|"&MOD(RC[-5]-1,3)*30+102&"|"&MOD(RC[-5]-1,3)*30+103&"|"&IF(MOD(RC[-5],4)=0,HLOOKUP(Sheet1!R2C10,Sheet1!R2C10:R7C10,MOD(RC[-5]/4-1,6)+1,FALSE),IF(MOD(RC[-5],2)=0,IF(RC[-5]>20,HLOOKUP(Sheet1!R2C7,Sheet1!R2C7:R43C7,MOD(RC[-5]/2-1,42)+1,FALSE),HLOOKUP(Sheet1!R2C4,Sheet1!R2C4:R7C4,MOD(RC[-5]-1,6)+1,FALSE)),MOD(RC[-5]-1,3)*30+104)) -> 160|161|162|163|164 | G183: =HLOOKUP(Sheet1!R2C1,Sheet1!R2C1:R16C1,MOD(RC1-1,2)+MOD(INT((RC1-1)/2),3)*5+1,FALSE)&"|"&HLOOKUP(Sheet1!R2C1,Sheet1!R2C1:R16C1,MOD(RC1,2)+MOD(INT((RC1)/2),3)*5+1,FALSE)&"|"&HLOOKUP(Sheet1!R2C1,Sheet1!R2C1:R16C1,MOD(RC1+1,2)+MOD(INT((RC1+1)/2),3)*5+1,FALSE)&"|"&HLOOKUP(Sheet1!R2C1,Sheet1!R2C1:R16C1,MOD(RC1+2,2)+MOD(INT((RC1+2)/2),3)*5+1,FALSE)&"|"&HLOOKUP(Sheet1!R2C1,Sheet1!R2C1:R16C1,MOD(RC1+3,2)+MOD(INT((RC1+3)/2),3)*5+1,FALSE) -> 130|131|160|161|100 | H183: =HLOOKUP(Sheet1!R2C1,Sheet1!R2C1:R16C1,MOD(RC1+2,2)+MOD(INT((RC1+2)/2),3)*5+1,FALSE)&"|"&HLOOKUP(Sheet1!R2C1,Sheet1!R2C1:R16C1,MOD(RC1+3,2)+MOD(INT((RC1+3)/2),3)*5+1,FALSE)&"|"&HLOOKUP(Sheet1!R2C1,Sheet1!R2C1:R16C1,MOD(RC1+4,2)+MOD(INT((RC1+4)/2),3)*5+1,FALSE)&"|"&HLOOKUP(Sheet1!R2C1,Sheet1!R2C1:R16C1,MOD(RC1+5,2)+MOD(INT((RC1+5)/2),3)*5+1,FALSE)&"|"&HLOOKUP(Sheet1!R2C1,Sheet1!R2C1:R16C1,MOD(RC1+6,2)+MOD(INT((RC1+6)/2),3)*5+1,FALSE) -> 161|100|101|130|131 | I183: =HLOOKUP(Sheet1!R2C1,Sheet1!R2C1:R16C1,MOD(RC1-1,3)+MOD(INT((RC1-1)/3),3)*5+3,FALSE)&"|"&HLOOKUP(Sheet1!R2C1,Sheet1!R2C1:R16C1,MOD(RC1,3)+MOD(INT((RC1)/3),3)*5+3,FALSE)&"|"&HLOOKUP(Sheet1!R2C1,Sheet1!R2C1:R16C1,MOD(RC1+1,3)+MOD(INT((RC1+1)/3),3)*5+3,FALSE)&"|"&HLOOKUP(Sheet1!R2C1,Sheet1!R2C1:R16C1,MOD(RC1+2,3)+MOD(INT((RC1+2)/3),3)*5+3,FALSE)&"|"&HLOOKUP(Sheet1!R2C1,Sheet1!R2C1:R16C1,MOD(RC1+3,3)+MOD(INT((RC1+3)/3),3)*5+3,FALSE) -> 134|162|163|164|102 | J183: =HLOOKUP(Sheet1!R2C1,Sheet1!R2C1:R16C1,MOD(RC1-1,3)+MOD(INT((RC1-1)/3),3)*5+3,FALSE)&"|"&HLOOKUP(Sheet1!R2C1,Sheet1!R2C1:R16C1,MOD(RC1,3)+MOD(INT((RC1)/3),3)*5+3,FALSE)&"|"&HLOOKUP(Sheet1!R2C1,Sheet1!R2C1:R16C1,MOD(RC1+1,3)+MOD(INT((RC1+1)/3),3)*5+3,FALSE)&"|"&HLOOKUP(Sheet1!R2C1,Sheet1!R2C1:R16C1,MOD(RC1+2,3)+MOD(INT((RC1+2)/3),3)*5+3,FALSE)&"|"&HLOOKUP(Sheet1!R2C1,Sheet1!R2C1:R16C1,MOD(RC1+3,3)+MOD(INT((RC1+3)/3),3)*5+3,FALSE) -> 134|162|163|164|102 | K183: =HLOOKUP(Sheet1!R2C1,Sheet1!R2C1:R16C1,MOD(RC1-1,3)+MOD(INT((RC1-1)/3),3)*5+3,FALSE)&"|"&HLOOKUP(Sheet1!R2C1,Sheet1!R2C1:R16C1,MOD(RC1,3)+MOD(INT((RC1)/3),3)*5+3,FALSE)&"|"&HLOOKUP(Sheet1!R2C1,Sheet1!R2C1:R16C1,MOD(RC1+1,3)+MOD(INT((RC1+1)/3),3)*5+3,FALSE)&"|"&HLOOKUP(Sheet1!R2C1,Sheet1!R2C1:R16C1,MOD(RC1+2,3)+MOD(INT((RC1+2)/3),3)*5+3,FALSE)&"|"&HLOOKUP(Sheet1!R2C1,Sheet1!R2C1:R16C1,MOD(RC1+3,3)+MOD(INT((RC1+3)/3),3)*5+3,FALSE) -> 134|162|163|164|102 | L183: 25|22|23|24 | M183: 759828|759829|759828|759828 | N183: 10030|10031|10032|10033 | O183: 1|1|1|1 | P183: 2500|2500|2500|2500
A184: 178 | B184: 176 | C184: 30 | D184: =R[-20]C+2 -> 36 | E184: 1000 | F184: =MOD(RC[-5]-1,3)*30+100&"|"&MOD(RC[-5]-1,3)*30+101&"|"&MOD(RC[-5]-1,3)*30+102&"|"&MOD(RC[-5]-1,3)*30+103&"|"&IF(MOD(RC[-5],4)=0,HLOOKUP(Sheet1!R2C10,Sheet1!R2C10:R7C10,MOD(RC[-5]/4-1,6)+1,FALSE),IF(MOD(RC[-5],2)=0,IF(RC[-5]>20,HLOOKUP(Sheet1!R2C7,Sheet1!R2C7:R43C7,MOD(RC[-5]/2-1,42)+1,FALSE),HLOOKUP(Sheet1!R2C4,Sheet1!R2C4:R7C4,MOD(RC[-5]-1,6)+1,FALSE)),MOD(RC[-5]-1,3)*30+104)) -> 100|101|102|103|116 | G184: =HLOOKUP(Sheet1!R2C1,Sheet1!R2C1:R16C1,MOD(RC1-1,2)+MOD(INT((RC1-1)/2),3)*5+1,FALSE)&"|"&HLOOKUP(Sheet1!R2C1,Sheet1!R2C1:R16C1,MOD(RC1,2)+MOD(INT((RC1)/2),3)*5+1,FALSE)&"|"&HLOOKUP(Sheet1!R2C1,Sheet1!R2C1:R16C1,MOD(RC1+1,2)+MOD(INT((RC1+1)/2),3)*5+1,FALSE)&"|"&HLOOKUP(Sheet1!R2C1,Sheet1!R2C1:R16C1,MOD(RC1+2,2)+MOD(INT((RC1+2)/2),3)*5+1,FALSE)&"|"&HLOOKUP(Sheet1!R2C1,Sheet1!R2C1:R16C1,MOD(RC1+3,2)+MOD(INT((RC1+3)/2),3)*5+1,FALSE) -> 131|160|161|100|101 | H184: =HLOOKUP(Sheet1!R2C1,Sheet1!R2C1:R16C1,MOD(RC1+2,2)+MOD(INT((RC1+2)/2),3)*5+1,FALSE)&"|"&HLOOKUP(Sheet1!R2C1,Sheet1!R2C1:R16C1,MOD(RC1+3,2)+MOD(INT((RC1+3)/2),3)*5+1,FALSE)&"|"&HLOOKUP(Sheet1!R2C1,Sheet1!R2C1:R16C1,MOD(RC1+4,2)+MOD(INT((RC1+4)/2),3)*5+1,FALSE)&"|"&HLOOKUP(Sheet1!R2C1,Sheet1!R2C1:R16C1,MOD(RC1+5,2)+MOD(INT((RC1+5)/2),3)*5+1,FALSE)&"|"&HLOOKUP(Sheet1!R2C1,Sheet1!R2C1:R16C1,MOD(RC1+6,2)+MOD(INT((RC1+6)/2),3)*5+1,FALSE) -> 100|101|130|131|160 | I184: =HLOOKUP(Sheet1!R2C1,Sheet1!R2C1:R16C1,MOD(RC1-1,3)+MOD(INT((RC1-1)/3),3)*5+3,FALSE)&"|"&HLOOKUP(Sheet1!R2C1,Sheet1!R2C1:R16C1,MOD(RC1,3)+MOD(INT((RC1)/3),3)*5+3,FALSE)&"|"&HLOOKUP(Sheet1!R2C1,Sheet1!R2C1:R16C1,MOD(RC1+1,3)+MOD(INT((RC1+1)/3),3)*5+3,FALSE)&"|"&HLOOKUP(Sheet1!R2C1,Sheet1!R2C1:R16C1,MOD(RC1+2,3)+MOD(INT((RC1+2)/3),3)*5+3,FALSE)&"|"&HLOOKUP(Sheet1!R2C1,Sheet1!R2C1:R16C1,MOD(RC1+3,3)+MOD(INT((RC1+3)/3),3)*5+3,FALSE) -> 162|163|164|102|103 | J184: =HLOOKUP(Sheet1!R2C1,Sheet1!R2C1:R16C1,MOD(RC1-1,3)+MOD(INT((RC1-1)/3),3)*5+3,FALSE)&"|"&HLOOKUP(Sheet1!R2C1,Sheet1!R2C1:R16C1,MOD(RC1,3)+MOD(INT((RC1)/3),3)*5+3,FALSE)&"|"&HLOOKUP(Sheet1!R2C1,Sheet1!R2C1:R16C1,MOD(RC1+1,3)+MOD(INT((RC1+1)/3),3)*5+3,FALSE)&"|"&HLOOKUP(Sheet1!R2C1,Sheet1!R2C1:R16C1,MOD(RC1+2,3)+MOD(INT((RC1+2)/3),3)*5+3,FALSE)&"|"&HLOOKUP(Sheet1!R2C1,Sheet1!R2C1:R16C1,MOD(RC1+3,3)+MOD(INT((RC1+3)/3),3)*5+3,FALSE) -> 162|163|164|102|103 | K184: =HLOOKUP(Sheet1!R2C1,Sheet1!R2C1:R16C1,MOD(RC1-1,3)+MOD(INT((RC1-1)/3),3)*5+3,FALSE)&"|"&HLOOKUP(Sheet1!R2C1,Sheet1!R2C1:R16C1,MOD(RC1,3)+MOD(INT((RC1)/3),3)*5+3,FALSE)&"|"&HLOOKUP(Sheet1!R2C1,Sheet1!R2C1:R16C1,MOD(RC1+1,3)+MOD(INT((RC1+1)/3),3)*5+3,FALSE)&"|"&HLOOKUP(Sheet1!R2C1,Sheet1!R2C1:R16C1,MOD(RC1+2,3)+MOD(INT((RC1+2)/3),3)*5+3,FALSE)&"|"&HLOOKUP(Sheet1!R2C1,Sheet1!R2C1:R16C1,MOD(RC1+3,3)+MOD(INT((RC1+3)/3),3)*5+3,FALSE) -> 162|163|164|102|103 | L184: 25|22|23|24 | M184: 768574|768574|768575|768575 | N184: 10030|10031|10032|10033 | O184: 1|1|1|1 | P184: 2500|2500|2500|2500
A185: 179 | B185: 177 | C185: 30 | D185: =R[-20]C+2 -> 36 | E185: 1000 | F185: =MOD(RC[-5]-1,3)*30+100&"|"&MOD(RC[-5]-1,3)*30+101&"|"&MOD(RC[-5]-1,3)*30+102&"|"&MOD(RC[-5]-1,3)*30+103&"|"&IF(MOD(RC[-5],4)=0,HLOOKUP(Sheet1!R2C10,Sheet1!R2C10:R7C10,MOD(RC[-5]/4-1,6)+1,FALSE),IF(MOD(RC[-5],2)=0,IF(RC[-5]>20,HLOOKUP(Sheet1!R2C7,Sheet1!R2C7:R43C7,MOD(RC[-5]/2-1,42)+1,FALSE),HLOOKUP(Sheet1!R2C4,Sheet1!R2C4:R7C4,MOD(RC[-5]-1,6)+1,FALSE)),MOD(RC[-5]-1,3)*30+104)) -> 130|131|132|133|134 | G185: =HLOOKUP(Sheet1!R2C1,Sheet1!R2C1:R16C1,MOD(RC1-1,2)+MOD(INT((RC1-1)/2),3)*5+1,FALSE)&"|"&HLOOKUP(Sheet1!R2C1,Sheet1!R2C1:R16C1,MOD(RC1,2)+MOD(INT((RC1)/2),3)*5+1,FALSE)&"|"&HLOOKUP(Sheet1!R2C1,Sheet1!R2C1:R16C1,MOD(RC1+1,2)+MOD(INT((RC1+1)/2),3)*5+1,FALSE)&"|"&HLOOKUP(Sheet1!R2C1,Sheet1!R2C1:R16C1,MOD(RC1+2,2)+MOD(INT((RC1+2)/2),3)*5+1,FALSE)&"|"&HLOOKUP(Sheet1!R2C1,Sheet1!R2C1:R16C1,MOD(RC1+3,2)+MOD(INT((RC1+3)/2),3)*5+1,FALSE) -> 160|161|100|101|130 | H185: =HLOOKUP(Sheet1!R2C1,Sheet1!R2C1:R16C1,MOD(RC1+2,2)+MOD(INT((RC1+2)/2),3)*5+1,FALSE)&"|"&HLOOKUP(Sheet1!R2C1,Sheet1!R2C1:R16C1,MOD(RC1+3,2)+MOD(INT((RC1+3)/2),3)*5+1,FALSE)&"|"&HLOOKUP(Sheet1!R2C1,Sheet1!R2C1:R16C1,MOD(RC1+4,2)+MOD(INT((RC1+4)/2),3)*5+1,FALSE)&"|"&HLOOKUP(Sheet1!R2C1,Sheet1!R2C1:R16C1,MOD(RC1+5,2)+MOD(INT((RC1+5)/2),3)*5+1,FALSE)&"|"&HLOOKUP(Sheet1!R2C1,Sheet1!R2C1:R16C1,MOD(RC1+6,2)+MOD(INT((RC1+6)/2),3)*5+1,FALSE) -> 101|130|131|160|161 | I185: =HLOOKUP(Sheet1!R2C1,Sheet1!R2C1:R16C1,MOD(RC1-1,3)+MOD(INT((RC1-1)/3),3)*5+3,FALSE)&"|"&HLOOKUP(Sheet1!R2C1,Sheet1!R2C1:R16C1,MOD(RC1,3)+MOD(INT((RC1)/3),3)*5+3,FALSE)&"|"&HLOOKUP(Sheet1!R2C1,Sheet1!R2C1:R16C1,MOD(RC1+1,3)+MOD(INT((RC1+1)/3),3)*5+3,FALSE)&"|"&HLOOKUP(Sheet1!R2C1,Sheet1!R2C1:R16C1,MOD(RC1+2,3)+MOD(INT((RC1+2)/3),3)*5+3,FALSE)&"|"&HLOOKUP(Sheet1!R2C1,Sheet1!R2C1:R16C1,MOD(RC1+3,3)+MOD(INT((RC1+3)/3),3)*5+3,FALSE) -> 163|164|102|103|104 | J185: =HLOOKUP(Sheet1!R2C1,Sheet1!R2C1:R16C1,MOD(RC1-1,3)+MOD(INT((RC1-1)/3),3)*5+3,FALSE)&"|"&HLOOKUP(Sheet1!R2C1,Sheet1!R2C1:R16C1,MOD(RC1,3)+MOD(INT((RC1)/3),3)*5+3,FALSE)&"|"&HLOOKUP(Sheet1!R2C1,Sheet1!R2C1:R16C1,MOD(RC1+1,3)+MOD(INT((RC1+1)/3),3)*5+3,FALSE)&"|"&HLOOKUP(Sheet1!R2C1,Sheet1!R2C1:R16C1,MOD(RC1+2,3)+MOD(INT((RC1+2)/3),3)*5+3,FALSE)&"|"&HLOOKUP(Sheet1!R2C1,Sheet1!R2C1:R16C1,MOD(RC1+3,3)+MOD(INT((RC1+3)/3),3)*5+3,FALSE) -> 163|164|102|103|104 | K185: =HLOOKUP(Sheet1!R2C1,Sheet1!R2C1:R16C1,MOD(RC1-1,3)+MOD(INT((RC1-1)/3),3)*5+3,FALSE)&"|"&HLOOKUP(Sheet1!R2C1,Sheet1!R2C1:R16C1,MOD(RC1,3)+MOD(INT((RC1)/3),3)*5+3,FALSE)&"|"&HLOOKUP(Sheet1!R2C1,Sheet1!R2C1:R16C1,MOD(RC1+1,3)+MOD(INT((RC1+1)/3),3)*5+3,FALSE)&"|"&HLOOKUP(Sheet1!R2C1,Sheet1!R2C1:R16C1,MOD(RC1+2,3)+MOD(INT((RC1+2)/3),3)*5+3,FALSE)&"|"&HLOOKUP(Sheet1!R2C1,Sheet1!R2C1:R16C1,MOD(RC1+3,3)+MOD(INT((RC1+3)/3),3)*5+3,FALSE) -> 163|164|102|103|104 | L185: 25|22|23|24 | M185: 777857|777858|777858|777858 | N185: 10030|10031|10032|10033 | O185: 1|1|1|1 | P185: 2500|2500|2500|2500
A186: 180 | B186: 178 | C186: 30 | D186: =R[-20]C+2 -> 36 | E186: 1000 | F186: =MOD(RC[-5]-1,3)*30+100&"|"&MOD(RC[-5]-1,3)*30+101&"|"&MOD(RC[-5]-1,3)*30+102&"|"&MOD(RC[-5]-1,3)*30+103&"|"&IF(MOD(RC[-5],4)=0,HLOOKUP(Sheet1!R2C10,Sheet1!R2C10:R7C10,MOD(RC[-5]/4-1,6)+1,FALSE),IF(MOD(RC[-5],2)=0,IF(RC[-5]>20,HLOOKUP(Sheet1!R2C7,Sheet1!R2C7:R43C7,MOD(RC[-5]/2-1,42)+1,FALSE),HLOOKUP(Sheet1!R2C4,Sheet1!R2C4:R7C4,MOD(RC[-5]-1,6)+1,FALSE)),MOD(RC[-5]-1,3)*30+104)) -> 160|161|162|163|192 | G186: =HLOOKUP(Sheet1!R2C1,Sheet1!R2C1:R16C1,MOD(RC1-1,2)+MOD(INT((RC1-1)/2),3)*5+1,FALSE)&"|"&HLOOKUP(Sheet1!R2C1,Sheet1!R2C1:R16C1,MOD(RC1,2)+MOD(INT((RC1)/2),3)*5+1,FALSE)&"|"&HLOOKUP(Sheet1!R2C1,Sheet1!R2C1:R16C1,MOD(RC1+1,2)+MOD(INT((RC1+1)/2),3)*5+1,FALSE)&"|"&HLOOKUP(Sheet1!R2C1,Sheet1!R2C1:R16C1,MOD(RC1+2,2)+MOD(INT((RC1+2)/2),3)*5+1,FALSE)&"|"&HLOOKUP(Sheet1!R2C1,Sheet1!R2C1:R16C1,MOD(RC1+3,2)+MOD(INT((RC1+3)/2),3)*5+1,FALSE) -> 161|100|101|130|131 | H186: =HLOOKUP(Sheet1!R2C1,Sheet1!R2C1:R16C1,MOD(RC1+2,2)+MOD(INT((RC1+2)/2),3)*5+1,FALSE)&"|"&HLOOKUP(Sheet1!R2C1,Sheet1!R2C1:R16C1,MOD(RC1+3,2)+MOD(INT((RC1+3)/2),3)*5+1,FALSE)&"|"&HLOOKUP(Sheet1!R2C1,Sheet1!R2C1:R16C1,MOD(RC1+4,2)+MOD(INT((RC1+4)/2),3)*5+1,FALSE)&"|"&HLOOKUP(Sheet1!R2C1,Sheet1!R2C1:R16C1,MOD(RC1+5,2)+MOD(INT((RC1+5)/2),3)*5+1,FALSE)&"|"&HLOOKUP(Sheet1!R2C1,Sheet1!R2C1:R16C1,MOD(RC1+6,2)+MOD(INT((RC1+6)/2),3)*5+1,FALSE) -> 130|131|160|161|100 | I186: =HLOOKUP(Sheet1!R2C1,Sheet1!R2C1:R16C1,MOD(RC1-1,3)+MOD(INT((RC1-1)/3),3)*5+3,FALSE)&"|"&HLOOKUP(Sheet1!R2C1,Sheet1!R2C1:R16C1,MOD(RC1,3)+MOD(INT((RC1)/3),3)*5+3,FALSE)&"|"&HLOOKUP(Sheet1!R2C1,Sheet1!R2C1:R16C1,MOD(RC1+1,3)+MOD(INT((RC1+1)/3),3)*5+3,FALSE)&"|"&HLOOKUP(Sheet1!R2C1,Sheet1!R2C1:R16C1,MOD(RC1+2,3)+MOD(INT((RC1+2)/3),3)*5+3,FALSE)&"|"&HLOOKUP(Sheet1!R2C1,Sheet1!R2C1:R16C1,MOD(RC1+3,3)+MOD(INT((RC1+3)/3),3)*5+3,FALSE) -> 164|102|103|104|132 | J186: =HLOOKUP(Sheet1!R2C1,Sheet1!R2C1:R16C1,MOD(RC1-1,3)+MOD(INT((RC1-1)/3),3)*5+3,FALSE)&"|"&HLOOKUP(Sheet1!R2C1,Sheet1!R2C1:R16C1,MOD(RC1,3)+MOD(INT((RC1)/3),3)*5+3,FALSE)&"|"&HLOOKUP(Sheet1!R2C1,Sheet1!R2C1:R16C1,MOD(RC1+1,3)+MOD(INT((RC1+1)/3),3)*5+3,FALSE)&"|"&HLOOKUP(Sheet1!R2C1,Sheet1!R2C1:R16C1,MOD(RC1+2,3)+MOD(INT((RC1+2)/3),3)*5+3,FALSE)&"|"&HLOOKUP(Sheet1!R2C1,Sheet1!R2C1:R16C1,MOD(RC1+3,3)+MOD(INT((RC1+3)/3),3)*5+3,FALSE) -> 164|102|103|104|132 | K186: =HLOOKUP(Sheet1!R2C1,Sheet1!R2C1:R16C1,MOD(RC1-1,3)+MOD(INT((RC1-1)/3),3)*5+3,FALSE)&"|"&HLOOKUP(Sheet1!R2C1,Sheet1!R2C1:R16C1,MOD(RC1,3)+MOD(INT((RC1)/3),3)*5+3,FALSE)&"|"&HLOOKUP(Sheet1!R2C1,Sheet1!R2C1:R16C1,MOD(RC1+1,3)+MOD(INT((RC1+1)/3),3)*5+3,FALSE)&"|"&HLOOKUP(Sheet1!R2C1,Sheet1!R2C1:R16C1,MOD(RC1+2,3)+MOD(INT((RC1+2)/3),3)*5+3,FALSE)&"|"&HLOOKUP(Sheet1!R2C1,Sheet1!R2C1:R16C1,MOD(RC1+3,3)+MOD(INT((RC1+3)/3),3)*5+3,FALSE) -> 164|102|103|104|132 | L186: 25|22|23|24 | M186: 786820|786820|786820|786820 | N186: 10030|10031|10032|10033|10030|10031|10032|10033|10030|10031|10032|10033|10030|10031|10032|10033|10030|10031|10032|10033|10030|10031|10032|10033|10030|10031|10032|10033|10030|10031|10032|10033|10030|10031|10032|10033|10030|10031|10032|10033 | O186: 1|1|1|1|1|1|1|1|1|1|1|1|1|1|1|1|1|1|1|1|1|1|1|1|1|1|1|1|1|1|1|1|1|1|1|1|1|1|1|1 | P186: 2500|2500|2500|2500|2500|2500|2500|2500|2500|2500|2500|2500|2500|2500|2500|2500|2500|2500|2500|2500|2500|2500|2500|2500|2500|2500|2500|2500|2500|2500|2500|2500|2500|2500|2500|2500|2500|2500|2500|2500
A187: 181 | B187: 179 | C187: 30 | D187: =R[-20]C+2 -> 38 | E187: 1000 | F187: =MOD(RC[-5]-1,3)*30+100&"|"&MOD(RC[-5]-1,3)*30+101&"|"&MOD(RC[-5]-1,3)*30+102&"|"&MOD(RC[-5]-1,3)*30+103&"|"&IF(MOD(RC[-5],4)=0,HLOOKUP(Sheet1!R2C10,Sheet1!R2C10:R7C10,MOD(RC[-5]/4-1,6)+1,FALSE),IF(MOD(RC[-5],2)=0,IF(RC[-5]>20,HLOOKUP(Sheet1!R2C7,Sheet1!R2C7:R43C7,MOD(RC[-5]/2-1,42)+1,FALSE),HLOOKUP(Sheet1!R2C4,Sheet1!R2C4:R7C4,MOD(RC[-5]-1,6)+1,FALSE)),MOD(RC[-5]-1,3)*30+104)) -> 100|101|102|103|104 | G187: =HLOOKUP(Sheet1!R2C1,Sheet1!R2C1:R16C1,MOD(RC1-1,2)+MOD(INT((RC1-1)/2),3)*5+1,FALSE)&"|"&HLOOKUP(Sheet1!R2C1,Sheet1!R2C1:R16C1,MOD(RC1,2)+MOD(INT((RC1)/2),3)*5+1,FALSE)&"|"&HLOOKUP(Sheet1!R2C1,Sheet1!R2C1:R16C1,MOD(RC1+1,2)+MOD(INT((RC1+1)/2),3)*5+1,FALSE)&"|"&HLOOKUP(Sheet1!R2C1,Sheet1!R2C1:R16C1,MOD(RC1+2,2)+MOD(INT((RC1+2)/2),3)*5+1,FALSE)&"|"&HLOOKUP(Sheet1!R2C1,Sheet1!R2C1:R16C1,MOD(RC1+3,2)+MOD(INT((RC1+3)/2),3)*5+1,FALSE) -> 100|101|130|131|160 | H187: =HLOOKUP(Sheet1!R2C1,Sheet1!R2C1:R16C1,MOD(RC1+2,2)+MOD(INT((RC1+2)/2),3)*5+1,FALSE)&"|"&HLOOKUP(Sheet1!R2C1,Sheet1!R2C1:R16C1,MOD(RC1+3,2)+MOD(INT((RC1+3)/2),3)*5+1,FALSE)&"|"&HLOOKUP(Sheet1!R2C1,Sheet1!R2C1:R16C1,MOD(RC1+4,2)+MOD(INT((RC1+4)/2),3)*5+1,FALSE)&"|"&HLOOKUP(Sheet1!R2C1,Sheet1!R2C1:R16C1,MOD(RC1+5,2)+MOD(INT((RC1+5)/2),3)*5+1,FALSE)&"|"&HLOOKUP(Sheet1!R2C1,Sheet1!R2C1:R16C1,MOD(RC1+6,2)+MOD(INT((RC1+6)/2),3)*5+1,FALSE) -> 131|160|161|100|101 | I187: =HLOOKUP(Sheet1!R2C1,Sheet1!R2C1:R16C1,MOD(RC1-1,3)+MOD(INT((RC1-1)/3),3)*5+3,FALSE)&"|"&HLOOKUP(Sheet1!R2C1,Sheet1!R2C1:R16C1,MOD(RC1,3)+MOD(INT((RC1)/3),3)*5+3,FALSE)&"|"&HLOOKUP(Sheet1!R2C1,Sheet1!R2C1:R16C1,MOD(RC1+1,3)+MOD(INT((RC1+1)/3),3)*5+3,FALSE)&"|"&HLOOKUP(Sheet1!R2C1,Sheet1!R2C1:R16C1,MOD(RC1+2,3)+MOD(INT((RC1+2)/3),3)*5+3,FALSE)&"|"&HLOOKUP(Sheet1!R2C1,Sheet1!R2C1:R16C1,MOD(RC1+3,3)+MOD(INT((RC1+3)/3),3)*5+3,FALSE) -> 102|103|104|132|133 | J187: =HLOOKUP(Sheet1!R2C1,Sheet1!R2C1:R16C1,MOD(RC1-1,3)+MOD(INT((RC1-1)/3),3)*5+3,FALSE)&"|"&HLOOKUP(Sheet1!R2C1,Sheet1!R2C1:R16C1,MOD(RC1,3)+MOD(INT((RC1)/3),3)*5+3,FALSE)&"|"&HLOOKUP(Sheet1!R2C1,Sheet1!R2C1:R16C1,MOD(RC1+1,3)+MOD(INT((RC1+1)/3),3)*5+3,FALSE)&"|"&HLOOKUP(Sheet1!R2C1,Sheet1!R2C1:R16C1,MOD(RC1+2,3)+MOD(INT((RC1+2)/3),3)*5+3,FALSE)&"|"&HLOOKUP(Sheet1!R2C1,Sheet1!R2C1:R16C1,MOD(RC1+3,3)+MOD(INT((RC1+3)/3),3)*5+3,FALSE) -> 102|103|104|132|133 | K187: =HLOOKUP(Sheet1!R2C1,Sheet1!R2C1:R16C1,MOD(RC1-1,3)+MOD(INT((RC1-1)/3),3)*5+3,FALSE)&"|"&HLOOKUP(Sheet1!R2C1,Sheet1!R2C1:R16C1,MOD(RC1,3)+MOD(INT((RC1)/3),3)*5+3,FALSE)&"|"&HLOOKUP(Sheet1!R2C1,Sheet1!R2C1:R16C1,MOD(RC1+1,3)+MOD(INT((RC1+1)/3),3)*5+3,FALSE)&"|"&HLOOKUP(Sheet1!R2C1,Sheet1!R2C1:R16C1,MOD(RC1+2,3)+MOD(INT((RC1+2)/3),3)*5+3,FALSE)&"|"&HLOOKUP(Sheet1!R2C1,Sheet1!R2C1:R16C1,MOD(RC1+3,3)+MOD(INT((RC1+3)/3),3)*5+3,FALSE) -> 102|103|104|132|133 | L187: 25|22|23|24 | M187: 795783|795783|795783|795783 | N187: 10030|10031|10032|10033 | O187: 1|1|1|1 | P187: 2500|2500|2500|2500
A188: 182 | B188: 180 | C188: 30 | D188: =R[-20]C+2 -> 38 | E188: 1000 | F188: =MOD(RC[-5]-1,3)*30+100&"|"&MOD(RC[-5]-1,3)*30+101&"|"&MOD(RC[-5]-1,3)*30+102&"|"&MOD(RC[-5]-1,3)*30+103&"|"&IF(MOD(RC[-5],4)=0,HLOOKUP(Sheet1!R2C10,Sheet1!R2C10:R7C10,MOD(RC[-5]/4-1,6)+1,FALSE),IF(MOD(RC[-5],2)=0,IF(RC[-5]>20,HLOOKUP(Sheet1!R2C7,Sheet1!R2C7:R43C7,MOD(RC[-5]/2-1,42)+1,FALSE),HLOOKUP(Sheet1!R2C4,Sheet1!R2C4:R7C4,MOD(RC[-5]-1,6)+1,FALSE)),MOD(RC[-5]-1,3)*30+104)) -> 130|131|132|133|118 | G188: =HLOOKUP(Sheet1!R2C1,Sheet1!R2C1:R16C1,MOD(RC1-1,2)+MOD(INT((RC1-1)/2),3)*5+1,FALSE)&"|"&HLOOKUP(Sheet1!R2C1,Sheet1!R2C1:R16C1,MOD(RC1,2)+MOD(INT((RC1)/2),3)*5+1,FALSE)&"|"&HLOOKUP(Sheet1!R2C1,Sheet1!R2C1:R16C1,MOD(RC1+1,2)+MOD(INT((RC1+1)/2),3)*5+1,FALSE)&"|"&HLOOKUP(Sheet1!R2C1,Sheet1!R2C1:R16C1,MOD(RC1+2,2)+MOD(INT((RC1+2)/2),3)*5+1,FALSE)&"|"&HLOOKUP(Sheet1!R2C1,Sheet1!R2C1:R16C1,MOD(RC1+3,2)+MOD(INT((RC1+3)/2),3)*5+1,FALSE) -> 101|130|131|160|161 | H188: =HLOOKUP(Sheet1!R2C1,Sheet1!R2C1:R16C1,MOD(RC1+2,2)+MOD(INT((RC1+2)/2),3)*5+1,FALSE)&"|"&HLOOKUP(Sheet1!R2C1,Sheet1!R2C1:R16C1,MOD(RC1+3,2)+MOD(INT((RC1+3)/2),3)*5+1,FALSE)&"|"&HLOOKUP(Sheet1!R2C1,Sheet1!R2C1:R16C1,MOD(RC1+4,2)+MOD(INT((RC1+4)/2),3)*5+1,FALSE)&"|"&HLOOKUP(Sheet1!R2C1,Sheet1!R2C1:R16C1,MOD(RC1+5,2)+MOD(INT((RC1+5)/2),3)*5+1,FALSE)&"|"&HLOOKUP(Sheet1!R2C1,Sheet1!R2C1:R16C1,MOD(RC1+6,2)+MOD(INT((RC1+6)/2),3)*5+1,FALSE) -> 160|161|100|101|130 | I188: =HLOOKUP(Sheet1!R2C1,Sheet1!R2C1:R16C1,MOD(RC1-1,3)+MOD(INT((RC1-1)/3),3)*5+3,FALSE)&"|"&HLOOKUP(Sheet1!R2C1,Sheet1!R2C1:R16C1,MOD(RC1,3)+MOD(INT((RC1)/3),3)*5+3,FALSE)&"|"&HLOOKUP(Sheet1!R2C1,Sheet1!R2C1:R16C1,MOD(RC1+1,3)+MOD(INT((RC1+1)/3),3)*5+3,FALSE)&"|"&HLOOKUP(Sheet1!R2C1,Sheet1!R2C1:R16C1,MOD(RC1+2,3)+MOD(INT((RC1+2)/3),3)*5+3,FALSE)&"|"&HLOOKUP(Sheet1!R2C1,Sheet1!R2C1:R16C1,MOD(RC1+3,3)+MOD(INT((RC1+3)/3),3)*5+3,FALSE) -> 103|104|132|133|134 | J188: =HLOOKUP(Sheet1!R2C1,Sheet1!R2C1:R16C1,MOD(RC1-1,3)+MOD(INT((RC1-1)/3),3)*5+3,FALSE)&"|"&HLOOKUP(Sheet1!R2C1,Sheet1!R2C1:R16C1,MOD(RC1,3)+MOD(INT((RC1)/3),3)*5+3,FALSE)&"|"&HLOOKUP(Sheet1!R2C1,Sheet1!R2C1:R16C1,MOD(RC1+1,3)+MOD(INT((RC1+1)/3),3)*5+3,FALSE)&"|"&HLOOKUP(Sheet1!R2C1,Sheet1!R2C1:R16C1,MOD(RC1+2,3)+MOD(INT((RC1+2)/3),3)*5+3,FALSE)&"|"&HLOOKUP(Sheet1!R2C1,Sheet1!R2C1:R16C1,MOD(RC1+3,3)+MOD(INT((RC1+3)/3),3)*5+3,FALSE) -> 103|104|132|133|134 | K188: =HLOOKUP(Sheet1!R2C1,Sheet1!R2C1:R16C1,MOD(RC1-1,3)+MOD(INT((RC1-1)/3),3)*5+3,FALSE)&"|"&HLOOKUP(Sheet1!R2C1,Sheet1!R2C1:R16C1,MOD(RC1,3)+MOD(INT((RC1)/3),3)*5+3,FALSE)&"|"&HLOOKUP(Sheet1!R2C1,Sheet1!R2C1:R16C1,MOD(RC1+1,3)+MOD(INT((RC1+1)/3),3)*5+3,FALSE)&"|"&HLOOKUP(Sheet1!R2C1,Sheet1!R2C1:R16C1,MOD(RC1+2,3)+MOD(INT((RC1+2)/3),3)*5+3,FALSE)&"|"&HLOOKUP(Sheet1!R2C1,Sheet1!R2C1:R16C1,MOD(RC1+3,3)+MOD(INT((RC1+3)/3),3)*5+3,FALSE) -> 103|104|132|133|134 | L188: 25|22|23|24 | M188: 805300|805300|805300|805300 | N188: 10030|10031|10032|10033 | O188: 1|1|1|1 | P188: 2500|2500|2500|2500
A189: 183 | B189: 181 | C189: 30 | D189: =R[-20]C+2 -> 38 | E189: 1000 | F189: =MOD(RC[-5]-1,3)*30+100&"|"&MOD(RC[-5]-1,3)*30+101&"|"&MOD(RC[-5]-1,3)*30+102&"|"&MOD(RC[-5]-1,3)*30+103&"|"&IF(MOD(RC[-5],4)=0,HLOOKUP(Sheet1!R2C10,Sheet1!R2C10:R7C10,MOD(RC[-5]/4-1,6)+1,FALSE),IF(MOD(RC[-5],2)=0,IF(RC[-5]>20,HLOOKUP(Sheet1!R2C7,Sheet1!R2C7:R43C7,MOD(RC[-5]/2-1,42)+1,FALSE),HLOOKUP(Sheet1!R2C4,Sheet1!R2C4:R7C4,MOD(RC[-5]-1,6)+1,FALSE)),MOD(RC[-5]-1,3)*30+104)) -> 160|161|162|163|164 | G189: =HLOOKUP(Sheet1!R2C1,Sheet1!R2C1:R16C1,MOD(RC1-1,2)+MOD(INT((RC1-1)/2),3)*5+1,FALSE)&"|"&HLOOKUP(Sheet1!R2C1,Sheet1!R2C1:R16C1,MOD(RC1,2)+MOD(INT((RC1)/2),3)*5+1,FALSE)&"|"&HLOOKUP(Sheet1!R2C1,Sheet1!R2C1:R16C1,MOD(RC1+1,2)+MOD(INT((RC1+1)/2),3)*5+1,FALSE)&"|"&HLOOKUP(Sheet1!R2C1,Sheet1!R2C1:R16C1,MOD(RC1+2,2)+MOD(INT((RC1+2)/2),3)*5+1,FALSE)&"|"&HLOOKUP(Sheet1!R2C1,Sheet1!R2C1:R16C1,MOD(RC1+3,2)+MOD(INT((RC1+3)/2),3)*5+1,FALSE) -> 130|131|160|161|100 | H189: =HLOOKUP(Sheet1!R2C1,Sheet1!R2C1:R16C1,MOD(RC1+2,2)+MOD(INT((RC1+2)/2),3)*5+1,FALSE)&"|"&HLOOKUP(Sheet1!R2C1,Sheet1!R2C1:R16C1,MOD(RC1+3,2)+MOD(INT((RC1+3)/2),3)*5+1,FALSE)&"|"&HLOOKUP(Sheet1!R2C1,Sheet1!R2C1:R16C1,MOD(RC1+4,2)+MOD(INT((RC1+4)/2),3)*5+1,FALSE)&"|"&HLOOKUP(Sheet1!R2C1,Sheet1!R2C1:R16C1,MOD(RC1+5,2)+MOD(INT((RC1+5)/2),3)*5+1,FALSE)&"|"&HLOOKUP(Sheet1!R2C1,Sheet1!R2C1:R16C1,MOD(RC1+6,2)+MOD(INT((RC1+6)/2),3)*5+1,FALSE) -> 161|100|101|130|131 | I189: =HLOOKUP(Sheet1!R2C1,Sheet1!R2C1:R16C1,MOD(RC1-1,3)+MOD(INT((RC1-1)/3),3)*5+3,FALSE)&"|"&HLOOKUP(Sheet1!R2C1,Sheet1!R2C1:R16C1,MOD(RC1,3)+MOD(INT((RC1)/3),3)*5+3,FALSE)&"|"&HLOOKUP(Sheet1!R2C1,Sheet1!R2C1:R16C1,MOD(RC1+1,3)+MOD(INT((RC1+1)/3),3)*5+3,FALSE)&"|"&HLOOKUP(Sheet1!R2C1,Sheet1!R2C1:R16C1,MOD(RC1+2,3)+MOD(INT((RC1+2)/3),3)*5+3,FALSE)&"|"&HLOOKUP(Sheet1!R2C1,Sheet1!R2C1:R16C1,MOD(RC1+3,3)+MOD(INT((RC1+3)/3),3)*5+3,FALSE) -> 104|132|133|134|162 | J189: =HLOOKUP(Sheet1!R2C1,Sheet1!R2C1:R16C1,MOD(RC1-1,3)+MOD(INT((RC1-1)/3),3)*5+3,FALSE)&"|"&HLOOKUP(Sheet1!R2C1,Sheet1!R2C1:R16C1,MOD(RC1,3)+MOD(INT((RC1)/3),3)*5+3,FALSE)&"|"&HLOOKUP(Sheet1!R2C1,Sheet1!R2C1:R16C1,MOD(RC1+1,3)+MOD(INT((RC1+1)/3),3)*5+3,FALSE)&"|"&HLOOKUP(Sheet1!R2C1,Sheet1!R2C1:R16C1,MOD(RC1+2,3)+MOD(INT((RC1+2)/3),3)*5+3,FALSE)&"|"&HLOOKUP(Sheet1!R2C1,Sheet1!R2C1:R16C1,MOD(RC1+3,3)+MOD(INT((RC1+3)/3),3)*5+3,FALSE) -> 104|132|133|134|162 | K189: =HLOOKUP(Sheet1!R2C1,Sheet1!R2C1:R16C1,MOD(RC1-1,3)+MOD(INT((RC1-1)/3),3)*5+3,FALSE)&"|"&HLOOKUP(Sheet1!R2C1,Sheet1!R2C1:R16C1,MOD(RC1,3)+MOD(INT((RC1)/3),3)*5+3,FALSE)&"|"&HLOOKUP(Sheet1!R2C1,Sheet1!R2C1:R16C1,MOD(RC1+1,3)+MOD(INT((RC1+1)/3),3)*5+3,FALSE)&"|"&HLOOKUP(Sheet1!R2C1,Sheet1!R2C1:R16C1,MOD(RC1+2,3)+MOD(INT((RC1+2)/3),3)*5+3,FALSE)&"|"&HLOOKUP(Sheet1!R2C1,Sheet1!R2C1:R16C1,MOD(RC1+3,3)+MOD(INT((RC1+3)/3),3)*5+3,FALSE) -> 104|132|133|134|162 | L189: 25|22|23|24 | M189: 814497|814496|814498|814498 | N189: 10030|10031|10032|10033 | O189: 1|1|1|1 | P189: 2500|2500|2500|2500
A190: 184 | B190: 182 | C190: 30 | D190: =R[-20]C+2 -> 38 | E190: 1000 | F190: =MOD(RC[-5]-1,3)*30+100&"|"&MOD(RC[-5]-1,3)*30+101&"|"&MOD(RC[-5]-1,3)*30+102&"|"&MOD(RC[-5]-1,3)*30+103&"|"&IF(MOD(RC[-5],4)=0,HLOOKUP(Sheet1!R2C10,Sheet1!R2C10:R7C10,MOD(RC[-5]/4-1,6)+1,FALSE),IF(MOD(RC[-5],2)=0,IF(RC[-5]>20,HLOOKUP(Sheet1!R2C7,Sheet1!R2C7:R43C7,MOD(RC[-5]/2-1,42)+1,FALSE),HLOOKUP(Sheet1!R2C4,Sheet1!R2C4:R7C4,MOD(RC[-5]-1,6)+1,FALSE)),MOD(RC[-5]-1,3)*30+104)) -> 100|101|102|103|193 | G190: =HLOOKUP(Sheet1!R2C1,Sheet1!R2C1:R16C1,MOD(RC1-1,2)+MOD(INT((RC1-1)/2),3)*5+1,FALSE)&"|"&HLOOKUP(Sheet1!R2C1,Sheet1!R2C1:R16C1,MOD(RC1,2)+MOD(INT((RC1)/2),3)*5+1,FALSE)&"|"&HLOOKUP(Sheet1!R2C1,Sheet1!R2C1:R16C1,MOD(RC1+1,2)+MOD(INT((RC1+1)/2),3)*5+1,FALSE)&"|"&HLOOKUP(Sheet1!R2C1,Sheet1!R2C1:R16C1,MOD(RC1+2,2)+MOD(INT((RC1+2)/2),3)*5+1,FALSE)&"|"&HLOOKUP(Sheet1!R2C1,Sheet1!R2C1:R16C1,MOD(RC1+3,2)+MOD(INT((RC1+3)/2),3)*5+1,FALSE) -> 131|160|161|100|101 | H190: =HLOOKUP(Sheet1!R2C1,Sheet1!R2C1:R16C1,MOD(RC1+2,2)+MOD(INT((RC1+2)/2),3)*5+1,FALSE)&"|"&HLOOKUP(Sheet1!R2C1,Sheet1!R2C1:R16C1,MOD(RC1+3,2)+MOD(INT((RC1+3)/2),3)*5+1,FALSE)&"|"&HLOOKUP(Sheet1!R2C1,Sheet1!R2C1:R16C1,MOD(RC1+4,2)+MOD(INT((RC1+4)/2),3)*5+1,FALSE)&"|"&HLOOKUP(Sheet1!R2C1,Sheet1!R2C1:R16C1,MOD(RC1+5,2)+MOD(INT((RC1+5)/2),3)*5+1,FALSE)&"|"&HLOOKUP(Sheet1!R2C1,Sheet1!R2C1:R16C1,MOD(RC1+6,2)+MOD(INT((RC1+6)/2),3)*5+1,FALSE) -> 100|101|130|131|160 | I190: =HLOOKUP(Sheet1!R2C1,Sheet1!R2C1:R16C1,MOD(RC1-1,3)+MOD(INT((RC1-1)/3),3)*5+3,FALSE)&"|"&HLOOKUP(Sheet1!R2C1,Sheet1!R2C1:R16C1,MOD(RC1,3)+MOD(INT((RC1)/3),3)*5+3,FALSE)&"|"&HLOOKUP(Sheet1!R2C1,Sheet1!R2C1:R16C1,MOD(RC1+1,3)+MOD(INT((RC1+1)/3),3)*5+3,FALSE)&"|"&HLOOKUP(Sheet1!R2C1,Sheet1!R2C1:R16C1,MOD(RC1+2,3)+MOD(INT((RC1+2)/3),3)*5+3,FALSE)&"|"&HLOOKUP(Sheet1!R2C1,Sheet1!R2C1:R16C1,MOD(RC1+3,3)+MOD(INT((RC1+3)/3),3)*5+3,FALSE) -> 132|133|134|162|163 | J190: =HLOOKUP(Sheet1!R2C1,Sheet1!R2C1:R16C1,MOD(RC1-1,3)+MOD(INT((RC1-1)/3),3)*5+3,FALSE)&"|"&HLOOKUP(Sheet1!R2C1,Sheet1!R2C1:R16C1,MOD(RC1,3)+MOD(INT((RC1)/3),3)*5+3,FALSE)&"|"&HLOOKUP(Sheet1!R2C1,Sheet1!R2C1:R16C1,MOD(RC1+1,3)+MOD(INT((RC1+1)/3),3)*5+3,FALSE)&"|"&HLOOKUP(Sheet1!R2C1,Sheet1!R2C1:R16C1,MOD(RC1+2,3)+MOD(INT((RC1+2)/3),3)*5+3,FALSE)&"|"&HLOOKUP(Sheet1!R2C1,Sheet1!R2C1:R16C1,MOD(RC1+3,3)+MOD(INT((RC1+3)/3),3)*5+3,FALSE) -> 132|133|134|162|163 | K190: =HLOOKUP(Sheet1!R2C1,Sheet1!R2C1:R16C1,MOD(RC1-1,3)+MOD(INT((RC1-1)/3),3)*5+3,FALSE)&"|"&HLOOKUP(Sheet1!R2C1,Sheet1!R2C1:R16C1,MOD(RC1,3)+MOD(INT((RC1)/3),3)*5+3,FALSE)&"|"&HLOOKUP(Sheet1!R2C1,Sheet1!R2C1:R16C1,MOD(RC1+1,3)+MOD(INT((RC1+1)/3),3)*5+3,FALSE)&"|"&HLOOKUP(Sheet1!R2C1,Sheet1!R2C1:R16C1,MOD(RC1+2,3)+MOD(INT((RC1+2)/3),3)*5+3,FALSE)&"|"&HLOOKUP(Sheet1!R2C1,Sheet1!R2C1:R16C1,MOD(RC1+3,3)+MOD(INT((RC1+3)/3),3)*5+3,FALSE) -> 132|133|134|162|163 | L190: 25|22|23|24 | M190: 823693|823694|823693|823693 | N190: 10030|10031|10032|10033 | O190: 1|1|1|1 | P190: 2500|2500|2500|2500
A191: 185 | B191: 183 | C191: 30 | D191: =R[-20]C+2 -> 38 | E191: 1000 | F191: =MOD(RC[-5]-1,3)*30+100&"|"&MOD(RC[-5]-1,3)*30+101&"|"&MOD(RC[-5]-1,3)*30+102&"|"&MOD(RC[-5]-1,3)*30+103&"|"&IF(MOD(RC[-5],4)=0,HLOOKUP(Sheet1!R2C10,Sheet1!R2C10:R7C10,MOD(RC[-5]/4-1,6)+1,FALSE),IF(MOD(RC[-5],2)=0,IF(RC[-5]>20,HLOOKUP(Sheet1!R2C7,Sheet1!R2C7:R43C7,MOD(RC[-5]/2-1,42)+1,FALSE),HLOOKUP(Sheet1!R2C4,Sheet1!R2C4:R7C4,MOD(RC[-5]-1,6)+1,FALSE)),MOD(RC[-5]-1,3)*30+104)) -> 130|131|132|133|134 | G191: =HLOOKUP(Sheet1!R2C1,Sheet1!R2C1:R16C1,MOD(RC1-1,2)+MOD(INT((RC1-1)/2),3)*5+1,FALSE)&"|"&HLOOKUP(Sheet1!R2C1,Sheet1!R2C1:R16C1,MOD(RC1,2)+MOD(INT((RC1)/2),3)*5+1,FALSE)&"|"&HLOOKUP(Sheet1!R2C1,Sheet1!R2C1:R16C1,MOD(RC1+1,2)+MOD(INT((RC1+1)/2),3)*5+1,FALSE)&"|"&HLOOKUP(Sheet1!R2C1,Sheet1!R2C1:R16C1,MOD(RC1+2,2)+MOD(INT((RC1+2)/2),3)*5+1,FALSE)&"|"&HLOOKUP(Sheet1!R2C1,Sheet1!R2C1:R16C1,MOD(RC1+3,2)+MOD(INT((RC1+3)/2),3)*5+1,FALSE) -> 160|161|100|101|130 | H191: =HLOOKUP(Sheet1!R2C1,Sheet1!R2C1:R16C1,MOD(RC1+2,2)+MOD(INT((RC1+2)/2),3)*5+1,FALSE)&"|"&HLOOKUP(Sheet1!R2C1,Sheet1!R2C1:R16C1,MOD(RC1+3,2)+MOD(INT((RC1+3)/2),3)*5+1,FALSE)&"|"&HLOOKUP(Sheet1!R2C1,Sheet1!R2C1:R16C1,MOD(RC1+4,2)+MOD(INT((RC1+4)/2),3)*5+1,FALSE)&"|"&HLOOKUP(Sheet1!R2C1,Sheet1!R2C1:R16C1,MOD(RC1+5,2)+MOD(INT((RC1+5)/2),3)*5+1,FALSE)&"|"&HLOOKUP(Sheet1!R2C1,Sheet1!R2C1:R16C1,MOD(RC1+6,2)+MOD(INT((RC1+6)/2),3)*5+1,FALSE) -> 101|130|131|160|161 | I191: =HLOOKUP(Sheet1!R2C1,Sheet1!R2C1:R16C1,MOD(RC1-1,3)+MOD(INT((RC1-1)/3),3)*5+3,FALSE)&"|"&HLOOKUP(Sheet1!R2C1,Sheet1!R2C1:R16C1,MOD(RC1,3)+MOD(INT((RC1)/3),3)*5+3,FALSE)&"|"&HLOOKUP(Sheet1!R2C1,Sheet1!R2C1:R16C1,MOD(RC1+1,3)+MOD(INT((RC1+1)/3),3)*5+3,FALSE)&"|"&HLOOKUP(Sheet1!R2C1,Sheet1!R2C1:R16C1,MOD(RC1+2,3)+MOD(INT((RC1+2)/3),3)*5+3,FALSE)&"|"&HLOOKUP(Sheet1!R2C1,Sheet1!R2C1:R16C1,MOD(RC1+3,3)+MOD(INT((RC1+3)/3),3)*5+3,FALSE) -> 133|134|162|163|164 | J191: =HLOOKUP(Sheet1!R2C1,Sheet1!R2C1:R16C1,MOD(RC1-1,3)+MOD(INT((RC1-1)/3),3)*5+3,FALSE)&"|"&HLOOKUP(Sheet1!R2C1,Sheet1!R2C1:R16C1,MOD(RC1,3)+MOD(INT((RC1)/3),3)*5+3,FALSE)&"|"&HLOOKUP(Sheet1!R2C1,Sheet1!R2C1:R16C1,MOD(RC1+1,3)+MOD(INT((RC1+1)/3),3)*5+3,FALSE)&"|"&HLOOKUP(Sheet1!R2C1,Sheet1!R2C1:R16C1,MOD(RC1+2,3)+MOD(INT((RC1+2)/3),3)*5+3,FALSE)&"|"&HLOOKUP(Sheet1!R2C1,Sheet1!R2C1:R16C1,MOD(RC1+3,3)+MOD(INT((RC1+3)/3),3)*5+3,FALSE) -> 133|134|162|163|164 | K191: =HLOOKUP(Sheet1!R2C1,Sheet1!R2C1:R16C1,MOD(RC1-1,3)+MOD(INT((RC1-1)/3),3)*5+3,FALSE)&"|"&HLOOKUP(Sheet1!R2C1,Sheet1!R2C1:R16C1,MOD(RC1,3)+MOD(INT((RC1)/3),3)*5+3,FALSE)&"|"&HLOOKUP(Sheet1!R2C1,Sheet1!R2C1:R16C1,MOD(RC1+1,3)+MOD(INT((RC1+1)/3),3)*5+3,FALSE)&"|"&HLOOKUP(Sheet1!R2C1,Sheet1!R2C1:R16C1,MOD(RC1+2,3)+MOD(INT((RC1+2)/3),3)*5+3,FALSE)&"|"&HLOOKUP(Sheet1!R2C1,Sheet1!R2C1:R16C1,MOD(RC1+3,3)+MOD(INT((RC1+3)/3),3)*5+3,FALSE) -> 133|134|162|163|164 | L191: 25|22|23|24 | M191: 833485|833485|833485|833485 | N191: 10030|10031|10032|10033|10030|10031|10032|10033|10030|10031|10032|10033|10030|10031|10032|10033|10030|10031|10032|10033|10030|10031|10032|10033|10030|10031|10032|10033|10030|10031|10032|10033|10030|10031|10032|10033|10030|10031|10032|10033 | O191: 1|1|1|1|1|1|1|1|1|1|1|1|1|1|1|1|1|1|1|1|1|1|1|1|1|1|1|1|1|1|1|1|1|1|1|1|1|1|1|1 | P191: 2500|2500|2500|2500|2500|2500|2500|2500|2500|2500|2500|2500|2500|2500|2500|2500|2500|2500|2500|2500|2500|2500|2500|2500|2500|2500|2500|2500|2500|2500|2500|2500|2500|2500|2500|2500|2500|2500|2500|2500
A192: 186 | B192: 184 | C192: 30 | D192: =R[-20]C+2 -> 38 | E192: 1000 | F192: =MOD(RC[-5]-1,3)*30+100&"|"&MOD(RC[-5]-1,3)*30+101&"|"&MOD(RC[-5]-1,3)*30+102&"|"&MOD(RC[-5]-1,3)*30+103&"|"&IF(MOD(RC[-5],4)=0,HLOOKUP(Sheet1!R2C10,Sheet1!R2C10:R7C10,MOD(RC[-5]/4-1,6)+1,FALSE),IF(MOD(RC[-5],2)=0,IF(RC[-5]>20,HLOOKUP(Sheet1!R2C7,Sheet1!R2C7:R43C7,MOD(RC[-5]/2-1,42)+1,FALSE),HLOOKUP(Sheet1!R2C4,Sheet1!R2C4:R7C4,MOD(RC[-5]-1,6)+1,FALSE)),MOD(RC[-5]-1,3)*30+104)) -> 160|161|162|163|120 | G192: =HLOOKUP(Sheet1!R2C1,Sheet1!R2C1:R16C1,MOD(RC1-1,2)+MOD(INT((RC1-1)/2),3)*5+1,FALSE)&"|"&HLOOKUP(Sheet1!R2C1,Sheet1!R2C1:R16C1,MOD(RC1,2)+MOD(INT((RC1)/2),3)*5+1,FALSE)&"|"&HLOOKUP(Sheet1!R2C1,Sheet1!R2C1:R16C1,MOD(RC1+1,2)+MOD(INT((RC1+1)/2),3)*5+1,FALSE)&"|"&HLOOKUP(Sheet1!R2C1,Sheet1!R2C1:R16C1,MOD(RC1+2,2)+MOD(INT((RC1+2)/2),3)*5+1,FALSE)&"|"&HLOOKUP(Sheet1!R2C1,Sheet1!R2C1:R16C1,MOD(RC1+3,2)+MOD(INT((RC1+3)/2),3)*5+1,FALSE) -> 161|100|101|130|131 | H192: =HLOOKUP(Sheet1!R2C1,Sheet1!R2C1:R16C1,MOD(RC1+2,2)+MOD(INT((RC1+2)/2),3)*5+1,FALSE)&"|"&HLOOKUP(Sheet1!R2C1,Sheet1!R2C1:R16C1,MOD(RC1+3,2)+MOD(INT((RC1+3)/2),3)*5+1,FALSE)&"|"&HLOOKUP(Sheet1!R2C1,Sheet1!R2C1:R16C1,MOD(RC1+4,2)+MOD(INT((RC1+4)/2),3)*5+1,FALSE)&"|"&HLOOKUP(Sheet1!R2C1,Sheet1!R2C1:R16C1,MOD(RC1+5,2)+MOD(INT((RC1+5)/2),3)*5+1,FALSE)&"|"&HLOOKUP(Sheet1!R2C1,Sheet1!R2C1:R16C1,MOD(RC1+6,2)+MOD(INT((RC1+6)/2),3)*5+1,FALSE) -> 130|131|160|161|100 | I192: =HLOOKUP(Sheet1!R2C1,Sheet1!R2C1:R16C1,MOD(RC1-1,3)+MOD(INT((RC1-1)/3),3)*5+3,FALSE)&"|"&HLOOKUP(Sheet1!R2C1,Sheet1!R2C1:R16C1,MOD(RC1,3)+MOD(INT((RC1)/3),3)*5+3,FALSE)&"|"&HLOOKUP(Sheet1!R2C1,Sheet1!R2C1:R16C1,MOD(RC1+1,3)+MOD(INT((RC1+1)/3),3)*5+3,FALSE)&"|"&HLOOKUP(Sheet1!R2C1,Sheet1!R2C1:R16C1,MOD(RC1+2,3)+MOD(INT((RC1+2)/3),3)*5+3,FALSE)&"|"&HLOOKUP(Sheet1!R2C1,Sheet1!R2C1:R16C1,MOD(RC1+3,3)+MOD(INT((RC1+3)/3),3)*5+3,FALSE) -> 134|162|163|164|102 | J192: =HLOOKUP(Sheet1!R2C1,Sheet1!R2C1:R16C1,MOD(RC1-1,3)+MOD(INT((RC1-1)/3),3)*5+3,FALSE)&"|"&HLOOKUP(Sheet1!R2C1,Sheet1!R2C1:R16C1,MOD(RC1,3)+MOD(INT((RC1)/3),3)*5+3,FALSE)&"|"&HLOOKUP(Sheet1!R2C1,Sheet1!R2C1:R16C1,MOD(RC1+1,3)+MOD(INT((RC1+1)/3),3)*5+3,FALSE)&"|"&HLOOKUP(Sheet1!R2C1,Sheet1!R2C1:R16C1,MOD(RC1+2,3)+MOD(INT((RC1+2)/3),3)*5+3,FALSE)&"|"&HLOOKUP(Sheet1!R2C1,Sheet1!R2C1:R16C1,MOD(RC1+3,3)+MOD(INT((RC1+3)/3),3)*5+3,FALSE) -> 134|162|163|164|102 | K192: =HLOOKUP(Sheet1!R2C1,Sheet1!R2C1:R16C1,MOD(RC1-1,3)+MOD(INT((RC1-1)/3),3)*5+3,FALSE)&"|"&HLOOKUP(Sheet1!R2C1,Sheet1!R2C1:R16C1,MOD(RC1,3)+MOD(INT((RC1)/3),3)*5+3,FALSE)&"|"&HLOOKUP(Sheet1!R2C1,Sheet1!R2C1:R16C1,MOD(RC1+1,3)+MOD(INT((RC1+1)/3),3)*5+3,FALSE)&"|"&HLOOKUP(Sheet1!R2C1,Sheet1!R2C1:R16C1,MOD(RC1+2,3)+MOD(INT((RC1+2)/3),3)*5+3,FALSE)&"|"&HLOOKUP(Sheet1!R2C1,Sheet1!R2C1:R16C1,MOD(RC1+3,3)+MOD(INT((RC1+3)/3),3)*5+3,FALSE) -> 134|162|163|164|102 | L192: 25|22|23|24 | M192: 844070|844070|844070|844070 | N192: 10030|10031|10032|10033 | O192: 1|1|1|1 | P192: 2500|2500|2500|2500
A193: 187 | B193: 185 | C193: 30 | D193: =R[-20]C+2 -> 38 | E193: 1000 | F193: =MOD(RC[-5]-1,3)*30+100&"|"&MOD(RC[-5]-1,3)*30+101&"|"&MOD(RC[-5]-1,3)*30+102&"|"&MOD(RC[-5]-1,3)*30+103&"|"&IF(MOD(RC[-5],4)=0,HLOOKUP(Sheet1!R2C10,Sheet1!R2C10:R7C10,MOD(RC[-5]/4-1,6)+1,FALSE),IF(MOD(RC[-5],2)=0,IF(RC[-5]>20,HLOOKUP(Sheet1!R2C7,Sheet1!R2C7:R43C7,MOD(RC[-5]/2-1,42)+1,FALSE),HLOOKUP(Sheet1!R2C4,Sheet1!R2C4:R7C4,MOD(RC[-5]-1,6)+1,FALSE)),MOD(RC[-5]-1,3)*30+104)) -> 100|101|102|103|104 | G193: =HLOOKUP(Sheet1!R2C1,Sheet1!R2C1:R16C1,MOD(RC1-1,2)+MOD(INT((RC1-1)/2),3)*5+1,FALSE)&"|"&HLOOKUP(Sheet1!R2C1,Sheet1!R2C1:R16C1,MOD(RC1,2)+MOD(INT((RC1)/2),3)*5+1,FALSE)&"|"&HLOOKUP(Sheet1!R2C1,Sheet1!R2C1:R16C1,MOD(RC1+1,2)+MOD(INT((RC1+1)/2),3)*5+1,FALSE)&"|"&HLOOKUP(Sheet1!R2C1,Sheet1!R2C1:R16C1,MOD(RC1+2,2)+MOD(INT((RC1+2)/2),3)*5+1,FALSE)&"|"&HLOOKUP(Sheet1!R2C1,Sheet1!R2C1:R16C1,MOD(RC1+3,2)+MOD(INT((RC1+3)/2),3)*5+1,FALSE) -> 100|101|130|131|160 | H193: =HLOOKUP(Sheet1!R2C1,Sheet1!R2C1:R16C1,MOD(RC1+2,2)+MOD(INT((RC1+2)/2),3)*5+1,FALSE)&"|"&HLOOKUP(Sheet1!R2C1,Sheet1!R2C1:R16C1,MOD(RC1+3,2)+MOD(INT((RC1+3)/2),3)*5+1,FALSE)&"|"&HLOOKUP(Sheet1!R2C1,Sheet1!R2C1:R16C1,MOD(RC1+4,2)+MOD(INT((RC1+4)/2),3)*5+1,FALSE)&"|"&HLOOKUP(Sheet1!R2C1,Sheet1!R2C1:R16C1,MOD(RC1+5,2)+MOD(INT((RC1+5)/2),3)*5+1,FALSE)&"|"&HLOOKUP(Sheet1!R2C1,Sheet1!R2C1:R16C1,MOD(RC1+6,2)+MOD(INT((RC1+6)/2),3)*5+1,FALSE) -> 131|160|161|100|101 | I193: =HLOOKUP(Sheet1!R2C1,Sheet1!R2C1:R16C1,MOD(RC1-1,3)+MOD(INT((RC1-1)/3),3)*5+3,FALSE)&"|"&HLOOKUP(Sheet1!R2C1,Sheet1!R2C1:R16C1,MOD(RC1,3)+MOD(INT((RC1)/3),3)*5+3,FALSE)&"|"&HLOOKUP(Sheet1!R2C1,Sheet1!R2C1:R16C1,MOD(RC1+1,3)+MOD(INT((RC1+1)/3),3)*5+3,FALSE)&"|"&HLOOKUP(Sheet1!R2C1,Sheet1!R2C1:R16C1,MOD(RC1+2,3)+MOD(INT((RC1+2)/3),3)*5+3,FALSE)&"|"&HLOOKUP(Sheet1!R2C1,Sheet1!R2C1:R16C1,MOD(RC1+3,3)+MOD(INT((RC1+3)/3),3)*5+3,FALSE) -> 162|163|164|102|103 | J193: =HLOOKUP(Sheet1!R2C1,Sheet1!R2C1:R16C1,MOD(RC1-1,3)+MOD(INT((RC1-1)/3),3)*5+3,FALSE)&"|"&HLOOKUP(Sheet1!R2C1,Sheet1!R2C1:R16C1,MOD(RC1,3)+MOD(INT((RC1)/3),3)*5+3,FALSE)&"|"&HLOOKUP(Sheet1!R2C1,Sheet1!R2C1:R16C1,MOD(RC1+1,3)+MOD(INT((RC1+1)/3),3)*5+3,FALSE)&"|"&HLOOKUP(Sheet1!R2C1,Sheet1!R2C1:R16C1,MOD(RC1+2,3)+MOD(INT((RC1+2)/3),3)*5+3,FALSE)&"|"&HLOOKUP(Sheet1!R2C1,Sheet1!R2C1:R16C1,MOD(RC1+3,3)+MOD(INT((RC1+3)/3),3)*5+3,FALSE) -> 162|163|164|102|103 | K193: =HLOOKUP(Sheet1!R2C1,Sheet1!R2C1:R16C1,MOD(RC1-1,3)+MOD(INT((RC1-1)/3),3)*5+3,FALSE)&"|"&HLOOKUP(Sheet1!R2C1,Sheet1!R2C1:R16C1,MOD(RC1,3)+MOD(INT((RC1)/3),3)*5+3,FALSE)&"|"&HLOOKUP(Sheet1!R2C1,Sheet1!R2C1:R16C1,MOD(RC1+1,3)+MOD(INT((RC1+1)/3),3)*5+3,FALSE)&"|"&HLOOKUP(Sheet1!R2C1,Sheet1!R2C1:R16C1,MOD(RC1+2,3)+MOD(INT((RC1+2)/3),3)*5+3,FALSE)&"|"&HLOOKUP(Sheet1!R2C1,Sheet1!R2C1:R16C1,MOD(RC1+3,3)+MOD(INT((RC1+3)/3),3)*5+3,FALSE) -> 162|163|164|102|103 | L193: 25|22|23|24 | M193: 855032|855033|855033|855033 | N193: 10030|10031|10032|10033 | O193: 1|1|1|1 | P193: 2500|2500|2500|2500
A194: 188 | B194: 186 | C194: 30 | D194: =R[-20]C+2 -> 38 | E194: 1000 | F194: =MOD(RC[-5]-1,3)*30+100&"|"&MOD(RC[-5]-1,3)*30+101&"|"&MOD(RC[-5]-1,3)*30+102&"|"&MOD(RC[-5]-1,3)*30+103&"|"&IF(MOD(RC[-5],4)=0,HLOOKUP(Sheet1!R2C10,Sheet1!R2C10:R7C10,MOD(RC[-5]/4-1,6)+1,FALSE),IF(MOD(RC[-5],2)=0,IF(RC[-5]>20,HLOOKUP(Sheet1!R2C7,Sheet1!R2C7:R43C7,MOD(RC[-5]/2-1,42)+1,FALSE),HLOOKUP(Sheet1!R2C4,Sheet1!R2C4:R7C4,MOD(RC[-5]-1,6)+1,FALSE)),MOD(RC[-5]-1,3)*30+104)) -> 130|131|132|133|194 | G194: =HLOOKUP(Sheet1!R2C1,Sheet1!R2C1:R16C1,MOD(RC1-1,2)+MOD(INT((RC1-1)/2),3)*5+1,FALSE)&"|"&HLOOKUP(Sheet1!R2C1,Sheet1!R2C1:R16C1,MOD(RC1,2)+MOD(INT((RC1)/2),3)*5+1,FALSE)&"|"&HLOOKUP(Sheet1!R2C1,Sheet1!R2C1:R16C1,MOD(RC1+1,2)+MOD(INT((RC1+1)/2),3)*5+1,FALSE)&"|"&HLOOKUP(Sheet1!R2C1,Sheet1!R2C1:R16C1,MOD(RC1+2,2)+MOD(INT((RC1+2)/2),3)*5+1,FALSE)&"|"&HLOOKUP(Sheet1!R2C1,Sheet1!R2C1:R16C1,MOD(RC1+3,2)+MOD(INT((RC1+3)/2),3)*5+1,FALSE) -> 101|130|131|160|161 | H194: =HLOOKUP(Sheet1!R2C1,Sheet1!R2C1:R16C1,MOD(RC1+2,2)+MOD(INT((RC1+2)/2),3)*5+1,FALSE)&"|"&HLOOKUP(Sheet1!R2C1,Sheet1!R2C1:R16C1,MOD(RC1+3,2)+MOD(INT((RC1+3)/2),3)*5+1,FALSE)&"|"&HLOOKUP(Sheet1!R2C1,Sheet1!R2C1:R16C1,MOD(RC1+4,2)+MOD(INT((RC1+4)/2),3)*5+1,FALSE)&"|"&HLOOKUP(Sheet1!R2C1,Sheet1!R2C1:R16C1,MOD(RC1+5,2)+MOD(INT((RC1+5)/2),3)*5+1,FALSE)&"|"&HLOOKUP(Sheet1!R2C1,Sheet1!R2C1:R16C1,MOD(RC1+6,2)+MOD(INT((RC1+6)/2),3)*5+1,FALSE) -> 160|161|100|101|130 | I194: =HLOOKUP(Sheet1!R2C1,Sheet1!R2C1:R16C1,MOD(RC1-1,3)+MOD(INT((RC1-1)/3),3)*5+3,FALSE)&"|"&HLOOKUP(Sheet1!R2C1,Sheet1!R2C1:R16C1,MOD(RC1,3)+MOD(INT((RC1)/3),3)*5+3,FALSE)&"|"&HLOOKUP(Sheet1!R2C1,Sheet1!R2C1:R16C1,MOD(RC1+1,3)+MOD(INT((RC1+1)/3),3)*5+3,FALSE)&"|"&HLOOKUP(Sheet1!R2C1,Sheet1!R2C1:R16C1,MOD(RC1+2,3)+MOD(INT((RC1+2)/3),3)*5+3,FALSE)&"|"&HLOOKUP(Sheet1!R2C1,Sheet1!R2C1:R16C1,MOD(RC1+3,3)+MOD(INT((RC1+3)/3),3)*5+3,FALSE) -> 163|164|102|103|104 | J194: =HLOOKUP(Sheet1!R2C1,Sheet1!R2C1:R16C1,MOD(RC1-1,3)+MOD(INT((RC1-1)/3),3)*5+3,FALSE)&"|"&HLOOKUP(Sheet1!R2C1,Sheet1!R2C1:R16C1,MOD(RC1,3)+MOD(INT((RC1)/3),3)*5+3,FALSE)&"|"&HLOOKUP(Sheet1!R2C1,Sheet1!R2C1:R16C1,MOD(RC1+1,3)+MOD(INT((RC1+1)/3),3)*5+3,FALSE)&"|"&HLOOKUP(Sheet1!R2C1,Sheet1!R2C1:R16C1,MOD(RC1+2,3)+MOD(INT((RC1+2)/3),3)*5+3,FALSE)&"|"&HLOOKUP(Sheet1!R2C1,Sheet1!R2C1:R16C1,MOD(RC1+3,3)+MOD(INT((RC1+3)/3),3)*5+3,FALSE) -> 163|164|102|103|104 | K194: =HLOOKUP(Sheet1!R2C1,Sheet1!R2C1:R16C1,MOD(RC1-1,3)+MOD(INT((RC1-1)/3),3)*5+3,FALSE)&"|"&HLOOKUP(Sheet1!R2C1,Sheet1!R2C1:R16C1,MOD(RC1,3)+MOD(INT((RC1)/3),3)*5+3,FALSE)&"|"&HLOOKUP(Sheet1!R2C1,Sheet1!R2C1:R16C1,MOD(RC1+1,3)+MOD(INT((RC1+1)/3),3)*5+3,FALSE)&"|"&HLOOKUP(Sheet1!R2C1,Sheet1!R2C1:R16C1,MOD(RC1+2,3)+MOD(INT((RC1+2)/3),3)*5+3,FALSE)&"|"&HLOOKUP(Sheet1!R2C1,Sheet1!R2C1:R16C1,MOD(RC1+3,3)+MOD(INT((RC1+3)/3),3)*5+3,FALSE) -> 163|164|102|103|104 | L194: 25|22|23|24 | M194: 865617|865618|865618|865618 | N194: 10030|10031|10032|10033 | O194: 1|1|1|1 | P194: 2500|2500|2500|2500
A195: 189 | B195: 187 | C195: 30 | D195: =R[-20]C+2 -> 38 | E195: 1000 | F195: =MOD(RC[-5]-1,3)*30+100&"|"&MOD(RC[-5]-1,3)*30+101&"|"&MOD(RC[-5]-1,3)*30+102&"|"&MOD(RC[-5]-1,3)*30+103&"|"&IF(MOD(RC[-5],4)=0,HLOOKUP(Sheet1!R2C10,Sheet1!R2C10:R7C10,MOD(RC[-5]/4-1,6)+1,FALSE),IF(MOD(RC[-5],2)=0,IF(RC[-5]>20,HLOOKUP(Sheet1!R2C7,Sheet1!R2C7:R43C7,MOD(RC[-5]/2-1,42)+1,FALSE),HLOOKUP(Sheet1!R2C4,Sheet1!R2C4:R7C4,MOD(RC[-5]-1,6)+1,FALSE)),MOD(RC[-5]-1,3)*30+104)) -> 160|161|162|163|164 | G195: =HLOOKUP(Sheet1!R2C1,Sheet1!R2C1:R16C1,MOD(RC1-1,2)+MOD(INT((RC1-1)/2),3)*5+1,FALSE)&"|"&HLOOKUP(Sheet1!R2C1,Sheet1!R2C1:R16C1,MOD(RC1,2)+MOD(INT((RC1)/2),3)*5+1,FALSE)&"|"&HLOOKUP(Sheet1!R2C1,Sheet1!R2C1:R16C1,MOD(RC1+1,2)+MOD(INT((RC1+1)/2),3)*5+1,FALSE)&"|"&HLOOKUP(Sheet1!R2C1,Sheet1!R2C1:R16C1,MOD(RC1+2,2)+MOD(INT((RC1+2)/2),3)*5+1,FALSE)&"|"&HLOOKUP(Sheet1!R2C1,Sheet1!R2C1:R16C1,MOD(RC1+3,2)+MOD(INT((RC1+3)/2),3)*5+1,FALSE) -> 130|131|160|161|100 | H195: =HLOOKUP(Sheet1!R2C1,Sheet1!R2C1:R16C1,MOD(RC1+2,2)+MOD(INT((RC1+2)/2),3)*5+1,FALSE)&"|"&HLOOKUP(Sheet1!R2C1,Sheet1!R2C1:R16C1,MOD(RC1+3,2)+MOD(INT((RC1+3)/2),3)*5+1,FALSE)&"|"&HLOOKUP(Sheet1!R2C1,Sheet1!R2C1:R16C1,MOD(RC1+4,2)+MOD(INT((RC1+4)/2),3)*5+1,FALSE)&"|"&HLOOKUP(Sheet1!R2C1,Sheet1!R2C1:R16C1,MOD(RC1+5,2)+MOD(INT((RC1+5)/2),3)*5+1,FALSE)&"|"&HLOOKUP(Sheet1!R2C1,Sheet1!R2C1:R16C1,MOD(RC1+6,2)+MOD(INT((RC1+6)/2),3)*5+1,FALSE) -> 161|100|101|130|131 | I195: =HLOOKUP(Sheet1!R2C1,Sheet1!R2C1:R16C1,MOD(RC1-1,3)+MOD(INT((RC1-1)/3),3)*5+3,FALSE)&"|"&HLOOKUP(Sheet1!R2C1,Sheet1!R2C1:R16C1,MOD(RC1,3)+MOD(INT((RC1)/3),3)*5+3,FALSE)&"|"&HLOOKUP(Sheet1!R2C1,Sheet1!R2C1:R16C1,MOD(RC1+1,3)+MOD(INT((RC1+1)/3),3)*5+3,FALSE)&"|"&HLOOKUP(Sheet1!R2C1,Sheet1!R2C1:R16C1,MOD(RC1+2,3)+MOD(INT((RC1+2)/3),3)*5+3,FALSE)&"|"&HLOOKUP(Sheet1!R2C1,Sheet1!R2C1:R16C1,MOD(RC1+3,3)+MOD(INT((RC1+3)/3),3)*5+3,FALSE) -> 164|102|103|104|132 | J195: =HLOOKUP(Sheet1!R2C1,Sheet1!R2C1:R16C1,MOD(RC1-1,3)+MOD(INT((RC1-1)/3),3)*5+3,FALSE)&"|"&HLOOKUP(Sheet1!R2C1,Sheet1!R2C1:R16C1,MOD(RC1,3)+MOD(INT((RC1)/3),3)*5+3,FALSE)&"|"&HLOOKUP(Sheet1!R2C1,Sheet1!R2C1:R16C1,MOD(RC1+1,3)+MOD(INT((RC1+1)/3),3)*5+3,FALSE)&"|"&HLOOKUP(Sheet1!R2C1,Sheet1!R2C1:R16C1,MOD(RC1+2,3)+MOD(INT((RC1+2)/3),3)*5+3,FALSE)&"|"&HLOOKUP(Sheet1!R2C1,Sheet1!R2C1:R16C1,MOD(RC1+3,3)+MOD(INT((RC1+3)/3),3)*5+3,FALSE) -> 164|102|103|104|132 | K195: =HLOOKUP(Sheet1!R2C1,Sheet1!R2C1:R16C1,MOD(RC1-1,3)+MOD(INT((RC1-1)/3),3)*5+3,FALSE)&"|"&HLOOKUP(Sheet1!R2C1,Sheet1!R2C1:R16C1,MOD(RC1,3)+MOD(INT((RC1)/3),3)*5+3,FALSE)&"|"&HLOOKUP(Sheet1!R2C1,Sheet1!R2C1:R16C1,MOD(RC1+1,3)+MOD(INT((RC1+1)/3),3)*5+3,FALSE)&"|"&HLOOKUP(Sheet1!R2C1,Sheet1!R2C1:R16C1,MOD(RC1+2,3)+MOD(INT((RC1+2)/3),3)*5+3,FALSE)&"|"&HLOOKUP(Sheet1!R2C1,Sheet1!R2C1:R16C1,MOD(RC1+3,3)+MOD(INT((RC1+3)/3),3)*5+3,FALSE) -> 164|102|103|104|132 | L195: 25|22|23|24 | M195: 878550|878550|878550|878550 | N195: 10030|10031|10032|10033 | O195: 1|1|1|1 | P195: 2500|2500|2500|2500
A196: 190 | B196: 188 | C196: 30 | D196: =R[-20]C+2 -> 38 | E196: 1000 | F196: =MOD(RC[-5]-1,3)*30+100&"|"&MOD(RC[-5]-1,3)*30+101&"|"&MOD(RC[-5]-1,3)*30+102&"|"&MOD(RC[-5]-1,3)*30+103&"|"&IF(MOD(RC[-5],4)=0,HLOOKUP(Sheet1!R2C10,Sheet1!R2C10:R7C10,MOD(RC[-5]/4-1,6)+1,FALSE),IF(MOD(RC[-5],2)=0,IF(RC[-5]>20,HLOOKUP(Sheet1!R2C7,Sheet1!R2C7:R43C7,MOD(RC[-5]/2-1,42)+1,FALSE),HLOOKUP(Sheet1!R2C4,Sheet1!R2C4:R7C4,MOD(RC[-5]-1,6)+1,FALSE)),MOD(RC[-5]-1,3)*30+104)) -> 100|101|102|103|122 | G196: =HLOOKUP(Sheet1!R2C1,Sheet1!R2C1:R16C1,MOD(RC1-1,2)+MOD(INT((RC1-1)/2),3)*5+1,FALSE)&"|"&HLOOKUP(Sheet1!R2C1,Sheet1!R2C1:R16C1,MOD(RC1,2)+MOD(INT((RC1)/2),3)*5+1,FALSE)&"|"&HLOOKUP(Sheet1!R2C1,Sheet1!R2C1:R16C1,MOD(RC1+1,2)+MOD(INT((RC1+1)/2),3)*5+1,FALSE)&"|"&HLOOKUP(Sheet1!R2C1,Sheet1!R2C1:R16C1,MOD(RC1+2,2)+MOD(INT((RC1+2)/2),3)*5+1,FALSE)&"|"&HLOOKUP(Sheet1!R2C1,Sheet1!R2C1:R16C1,MOD(RC1+3,2)+MOD(INT((RC1+3)/2),3)*5+1,FALSE) -> 131|160|161|100|101 | H196: =HLOOKUP(Sheet1!R2C1,Sheet1!R2C1:R16C1,MOD(RC1+2,2)+MOD(INT((RC1+2)/2),3)*5+1,FALSE)&"|"&HLOOKUP(Sheet1!R2C1,Sheet1!R2C1:R16C1,MOD(RC1+3,2)+MOD(INT((RC1+3)/2),3)*5+1,FALSE)&"|"&HLOOKUP(Sheet1!R2C1,Sheet1!R2C1:R16C1,MOD(RC1+4,2)+MOD(INT((RC1+4)/2),3)*5+1,FALSE)&"|"&HLOOKUP(Sheet1!R2C1,Sheet1!R2C1:R16C1,MOD(RC1+5,2)+MOD(INT((RC1+5)/2),3)*5+1,FALSE)&"|"&HLOOKUP(Sheet1!R2C1,Sheet1!R2C1:R16C1,MOD(RC1+6,2)+MOD(INT((RC1+6)/2),3)*5+1,FALSE) -> 100|101|130|131|160 | I196: =HLOOKUP(Sheet1!R2C1,Sheet1!R2C1:R16C1,MOD(RC1-1,3)+MOD(INT((RC1-1)/3),3)*5+3,FALSE)&"|"&HLOOKUP(Sheet1!R2C1,Sheet1!R2C1:R16C1,MOD(RC1,3)+MOD(INT((RC1)/3),3)*5+3,FALSE)&"|"&HLOOKUP(Sheet1!R2C1,Sheet1!R2C1:R16C1,MOD(RC1+1,3)+MOD(INT((RC1+1)/3),3)*5+3,FALSE)&"|"&HLOOKUP(Sheet1!R2C1,Sheet1!R2C1:R16C1,MOD(RC1+2,3)+MOD(INT((RC1+2)/3),3)*5+3,FALSE)&"|"&HLOOKUP(Sheet1!R2C1,Sheet1!R2C1:R16C1,MOD(RC1+3,3)+MOD(INT((RC1+3)/3),3)*5+3,FALSE) -> 102|103|104|132|133 | J196: =HLOOKUP(Sheet1!R2C1,Sheet1!R2C1:R16C1,MOD(RC1-1,3)+MOD(INT((RC1-1)/3),3)*5+3,FALSE)&"|"&HLOOKUP(Sheet1!R2C1,Sheet1!R2C1:R16C1,MOD(RC1,3)+MOD(INT((RC1)/3),3)*5+3,FALSE)&"|"&HLOOKUP(Sheet1!R2C1,Sheet1!R2C1:R16C1,MOD(RC1+1,3)+MOD(INT((RC1+1)/3),3)*5+3,FALSE)&"|"&HLOOKUP(Sheet1!R2C1,Sheet1!R2C1:R16C1,MOD(RC1+2,3)+MOD(INT((RC1+2)/3),3)*5+3,FALSE)&"|"&HLOOKUP(Sheet1!R2C1,Sheet1!R2C1:R16C1,MOD(RC1+3,3)+MOD(INT((RC1+3)/3),3)*5+3,FALSE) -> 102|103|104|132|133 | K196: =HLOOKUP(Sheet1!R2C1,Sheet1!R2C1:R16C1,MOD(RC1-1,3)+MOD(INT((RC1-1)/3),3)*5+3,FALSE)&"|"&HLOOKUP(Sheet1!R2C1,Sheet1!R2C1:R16C1,MOD(RC1,3)+MOD(INT((RC1)/3),3)*5+3,FALSE)&"|"&HLOOKUP(Sheet1!R2C1,Sheet1!R2C1:R16C1,MOD(RC1+1,3)+MOD(INT((RC1+1)/3),3)*5+3,FALSE)&"|"&HLOOKUP(Sheet1!R2C1,Sheet1!R2C1:R16C1,MOD(RC1+2,3)+MOD(INT((RC1+2)/3),3)*5+3,FALSE)&"|"&HLOOKUP(Sheet1!R2C1,Sheet1!R2C1:R16C1,MOD(RC1+3,3)+MOD(INT((RC1+3)/3),3)*5+3,FALSE) -> 102|103|104|132|133 | L196: 25|22|23|24 | M196: 891765|891765|891765|891765 | N196: 10030|10031|10032|10033|10030|10031|10032|10033|10030|10031|10032|10033|10030|10031|10032|10033|10030|10031|10032|10033|10030|10031|10032|10033|10030|10031|10032|10033|10030|10031|10032|10033|10030|10031|10032|10033|10030|10031|10032|10033 | O196: 1|1|1|1|1|1|1|1|1|1|1|1|1|1|1|1|1|1|1|1|1|1|1|1|1|1|1|1|1|1|1|1|1|1|1|1|1|1|1|1 | P196: 2500|2500|2500|2500|2500|2500|2500|2500|2500|2500|2500|2500|2500|2500|2500|2500|2500|2500|2500|2500|2500|2500|2500|2500|2500|2500|2500|2500|2500|2500|2500|2500|2500|2500|2500|2500|2500|2500|2500|2500
A197: 191 | B197: 189 | C197: 30 | D197: =R[-20]C+2 -> 38 | E197: 1000 | F197: =MOD(RC[-5]-1,3)*30+100&"|"&MOD(RC[-5]-1,3)*30+101&"|"&MOD(RC[-5]-1,3)*30+102&"|"&MOD(RC[-5]-1,3)*30+103&"|"&IF(MOD(RC[-5],4)=0,HLOOKUP(Sheet1!R2C10,Sheet1!R2C10:R7C10,MOD(RC[-5]/4-1,6)+1,FALSE),IF(MOD(RC[-5],2)=0,IF(RC[-5]>20,HLOOKUP(Sheet1!R2C7,Sheet1!R2C7:R43C7,MOD(RC[-5]/2-1,42)+1,FALSE),HLOOKUP(Sheet1!R2C4,Sheet1!R2C4:R7C4,MOD(RC[-5]-1,6)+1,FALSE)),MOD(RC[-5]-1,3)*30+104)) -> 130|131|132|133|134 | G197: =HLOOKUP(Sheet1!R2C1,Sheet1!R2C1:R16C1,MOD(RC1-1,2)+MOD(INT((RC1-1)/2),3)*5+1,FALSE)&"|"&HLOOKUP(Sheet1!R2C1,Sheet1!R2C1:R16C1,MOD(RC1,2)+MOD(INT((RC1)/2),3)*5+1,FALSE)&"|"&HLOOKUP(Sheet1!R2C1,Sheet1!R2C1:R16C1,MOD(RC1+1,2)+MOD(INT((RC1+1)/2),3)*5+1,FALSE)&"|"&HLOOKUP(Sheet1!R2C1,Sheet1!R2C1:R16C1,MOD(RC1+2,2)+MOD(INT((RC1+2)/2),3)*5+1,FALSE)&"|"&HLOOKUP(Sheet1!R2C1,Sheet1!R2C1:R16C1,MOD(RC1+3,2)+MOD(INT((RC1+3)/2),3)*5+1,FALSE) -> 160|161|100|101|130 | H197: =HLOOKUP(Sheet1!R2C1,Sheet1!R2C1:R16C1,MOD(RC1+2,2)+MOD(INT((RC1+2)/2),3)*5+1,FALSE)&"|"&HLOOKUP(Sheet1!R2C1,Sheet1!R2C1:R16C1,MOD(RC1+3,2)+MOD(INT((RC1+3)/2),3)*5+1,FALSE)&"|"&HLOOKUP(Sheet1!R2C1,Sheet1!R2C1:R16C1,MOD(RC1+4,2)+MOD(INT((RC1+4)/2),3)*5+1,FALSE)&"|"&HLOOKUP(Sheet1!R2C1,Sheet1!R2C1:R16C1,MOD(RC1+5,2)+MOD(INT((RC1+5)/2),3)*5+1,FALSE)&"|"&HLOOKUP(Sheet1!R2C1,Sheet1!R2C1:R16C1,MOD(RC1+6,2)+MOD(INT((RC1+6)/2),3)*5+1,FALSE) -> 101|130|131|160|161 | I197: =HLOOKUP(Sheet1!R2C1,Sheet1!R2C1:R16C1,MOD(RC1-1,3)+MOD(INT((RC1-1)/3),3)*5+3,FALSE)&"|"&HLOOKUP(Sheet1!R2C1,Sheet1!R2C1:R16C1,MOD(RC1,3)+MOD(INT((RC1)/3),3)*5+3,FALSE)&"|"&HLOOKUP(Sheet1!R2C1,Sheet1!R2C1:R16C1,MOD(RC1+1,3)+MOD(INT((RC1+1)/3),3)*5+3,FALSE)&"|"&HLOOKUP(Sheet1!R2C1,Sheet1!R2C1:R16C1,MOD(RC1+2,3)+MOD(INT((RC1+2)/3),3)*5+3,FALSE)&"|"&HLOOKUP(Sheet1!R2C1,Sheet1!R2C1:R16C1,MOD(RC1+3,3)+MOD(INT((RC1+3)/3),3)*5+3,FALSE) -> 103|104|132|133|134 | J197: =HLOOKUP(Sheet1!R2C1,Sheet1!R2C1:R16C1,MOD(RC1-1,3)+MOD(INT((RC1-1)/3),3)*5+3,FALSE)&"|"&HLOOKUP(Sheet1!R2C1,Sheet1!R2C1:R16C1,MOD(RC1,3)+MOD(INT((RC1)/3),3)*5+3,FALSE)&"|"&HLOOKUP(Sheet1!R2C1,Sheet1!R2C1:R16C1,MOD(RC1+1,3)+MOD(INT((RC1+1)/3),3)*5+3,FALSE)&"|"&HLOOKUP(Sheet1!R2C1,Sheet1!R2C1:R16C1,MOD(RC1+2,3)+MOD(INT((RC1+2)/3),3)*5+3,FALSE)&"|"&HLOOKUP(Sheet1!R2C1,Sheet1!R2C1:R16C1,MOD(RC1+3,3)+MOD(INT((RC1+3)/3),3)*5+3,FALSE) -> 103|104|132|133|134 | K197: =HLOOKUP(Sheet1!R2C1,Sheet1!R2C1:R16C1,MOD(RC1-1,3)+MOD(INT((RC1-1)/3),3)*5+3,FALSE)&"|"&HLOOKUP(Sheet1!R2C1,Sheet1!R2C1:R16C1,MOD(RC1,3)+MOD(INT((RC1)/3),3)*5+3,FALSE)&"|"&HLOOKUP(Sheet1!R2C1,Sheet1!R2C1:R16C1,MOD(RC1+1,3)+MOD(INT((RC1+1)/3),3)*5+3,FALSE)&"|"&HLOOKUP(Sheet1!R2C1,Sheet1!R2C1:R16C1,MOD(RC1+2,3)+MOD(INT((RC1+2)/3),3)*5+3,FALSE)&"|"&HLOOKUP(Sheet1!R2C1,Sheet1!R2C1:R16C1,MOD(RC1+3,3)+MOD(INT((RC1+3)/3),3)*5+3,FALSE) -> 103|104|132|133|134 | L197: 25|22|23|24 | M197: 904980|904980|904980|904980 | N197: 10030|10031|10032|10033 | O197: 1|1|1|1 | P197: 2500|2500|2500|2500
A198: 192 | B198: 190 | C198: 30 | D198: =R[-20]C+2 -> 38 | E198: 1000 | F198: =MOD(RC[-5]-1,3)*30+100&"|"&MOD(RC[-5]-1,3)*30+101&"|"&MOD(RC[-5]-1,3)*30+102&"|"&MOD(RC[-5]-1,3)*30+103&"|"&IF(MOD(RC[-5],4)=0,HLOOKUP(Sheet1!R2C10,Sheet1!R2C10:R7C10,MOD(RC[-5]/4-1,6)+1,FALSE),IF(MOD(RC[-5],2)=0,IF(RC[-5]>20,HLOOKUP(Sheet1!R2C7,Sheet1!R2C7:R43C7,MOD(RC[-5]/2-1,42)+1,FALSE),HLOOKUP(Sheet1!R2C4,Sheet1!R2C4:R7C4,MOD(RC[-5]-1,6)+1,FALSE)),MOD(RC[-5]-1,3)*30+104)) -> 160|161|162|163|195 | G198: =HLOOKUP(Sheet1!R2C1,Sheet1!R2C1:R16C1,MOD(RC1-1,2)+MOD(INT((RC1-1)/2),3)*5+1,FALSE)&"|"&HLOOKUP(Sheet1!R2C1,Sheet1!R2C1:R16C1,MOD(RC1,2)+MOD(INT((RC1)/2),3)*5+1,FALSE)&"|"&HLOOKUP(Sheet1!R2C1,Sheet1!R2C1:R16C1,MOD(RC1+1,2)+MOD(INT((RC1+1)/2),3)*5+1,FALSE)&"|"&HLOOKUP(Sheet1!R2C1,Sheet1!R2C1:R16C1,MOD(RC1+2,2)+MOD(INT((RC1+2)/2),3)*5+1,FALSE)&"|"&HLOOKUP(Sheet1!R2C1,Sheet1!R2C1:R16C1,MOD(RC1+3,2)+MOD(INT((RC1+3)/2),3)*5+1,FALSE) -> 161|100|101|130|131 | H198: =HLOOKUP(Sheet1!R2C1,Sheet1!R2C1:R16C1,MOD(RC1+2,2)+MOD(INT((RC1+2)/2),3)*5+1,FALSE)&"|"&HLOOKUP(Sheet1!R2C1,Sheet1!R2C1:R16C1,MOD(RC1+3,2)+MOD(INT((RC1+3)/2),3)*5+1,FALSE)&"|"&HLOOKUP(Sheet1!R2C1,Sheet1!R2C1:R16C1,MOD(RC1+4,2)+MOD(INT((RC1+4)/2),3)*5+1,FALSE)&"|"&HLOOKUP(Sheet1!R2C1,Sheet1!R2C1:R16C1,MOD(RC1+5,2)+MOD(INT((RC1+5)/2),3)*5+1,FALSE)&"|"&HLOOKUP(Sheet1!R2C1,Sheet1!R2C1:R16C1,MOD(RC1+6,2)+MOD(INT((RC1+6)/2),3)*5+1,FALSE) -> 130|131|160|161|100 | I198: =HLOOKUP(Sheet1!R2C1,Sheet1!R2C1:R16C1,MOD(RC1-1,3)+MOD(INT((RC1-1)/3),3)*5+3,FALSE)&"|"&HLOOKUP(Sheet1!R2C1,Sheet1!R2C1:R16C1,MOD(RC1,3)+MOD(INT((RC1)/3),3)*5+3,FALSE)&"|"&HLOOKUP(Sheet1!R2C1,Sheet1!R2C1:R16C1,MOD(RC1+1,3)+MOD(INT((RC1+1)/3),3)*5+3,FALSE)&"|"&HLOOKUP(Sheet1!R2C1,Sheet1!R2C1:R16C1,MOD(RC1+2,3)+MOD(INT((RC1+2)/3),3)*5+3,FALSE)&"|"&HLOOKUP(Sheet1!R2C1,Sheet1!R2C1:R16C1,MOD(RC1+3,3)+MOD(INT((RC1+3)/3),3)*5+3,FALSE) -> 104|132|133|134|162 | J198: =HLOOKUP(Sheet1!R2C1,Sheet1!R2C1:R16C1,MOD(RC1-1,3)+MOD(INT((RC1-1)/3),3)*5+3,FALSE)&"|"&HLOOKUP(Sheet1!R2C1,Sheet1!R2C1:R16C1,MOD(RC1,3)+MOD(INT((RC1)/3),3)*5+3,FALSE)&"|"&HLOOKUP(Sheet1!R2C1,Sheet1!R2C1:R16C1,MOD(RC1+1,3)+MOD(INT((RC1+1)/3),3)*5+3,FALSE)&"|"&HLOOKUP(Sheet1!R2C1,Sheet1!R2C1:R16C1,MOD(RC1+2,3)+MOD(INT((RC1+2)/3),3)*5+3,FALSE)&"|"&HLOOKUP(Sheet1!R2C1,Sheet1!R2C1:R16C1,MOD(RC1+3,3)+MOD(INT((RC1+3)/3),3)*5+3,FALSE) -> 104|132|133|134|162 | K198: =HLOOKUP(Sheet1!R2C1,Sheet1!R2C1:R16C1,MOD(RC1-1,3)+MOD(INT((RC1-1)/3),3)*5+3,FALSE)&"|"&HLOOKUP(Sheet1!R2C1,Sheet1!R2C1:R16C1,MOD(RC1,3)+MOD(INT((RC1)/3),3)*5+3,FALSE)&"|"&HLOOKUP(Sheet1!R2C1,Sheet1!R2C1:R16C1,MOD(RC1+1,3)+MOD(INT((RC1+1)/3),3)*5+3,FALSE)&"|"&HLOOKUP(Sheet1!R2C1,Sheet1!R2C1:R16C1,MOD(RC1+2,3)+MOD(INT((RC1+2)/3),3)*5+3,FALSE)&"|"&HLOOKUP(Sheet1!R2C1,Sheet1!R2C1:R16C1,MOD(RC1+3,3)+MOD(INT((RC1+3)/3),3)*5+3,FALSE) -> 104|132|133|134|162 | L198: 25|22|23|24 | M198: 917259|917259|917260|917260 | N198: 10030|10031|10032|10033 | O198: 1|1|1|1 | P198: 2500|2500|2500|2500
A199: 193 | B199: 191 | C199: 30 | D199: =R[-20]C+2 -> 38 | E199: 1000 | F199: =MOD(RC[-5]-1,3)*30+100&"|"&MOD(RC[-5]-1,3)*30+101&"|"&MOD(RC[-5]-1,3)*30+102&"|"&MOD(RC[-5]-1,3)*30+103&"|"&IF(MOD(RC[-5],4)=0,HLOOKUP(Sheet1!R2C10,Sheet1!R2C10:R7C10,MOD(RC[-5]/4-1,6)+1,FALSE),IF(MOD(RC[-5],2)=0,IF(RC[-5]>20,HLOOKUP(Sheet1!R2C7,Sheet1!R2C7:R43C7,MOD(RC[-5]/2-1,42)+1,FALSE),HLOOKUP(Sheet1!R2C4,Sheet1!R2C4:R7C4,MOD(RC[-5]-1,6)+1,FALSE)),MOD(RC[-5]-1,3)*30+104)) -> 100|101|102|103|104 | G199: =HLOOKUP(Sheet1!R2C1,Sheet1!R2C1:R16C1,MOD(RC1-1,2)+MOD(INT((RC1-1)/2),3)*5+1,FALSE)&"|"&HLOOKUP(Sheet1!R2C1,Sheet1!R2C1:R16C1,MOD(RC1,2)+MOD(INT((RC1)/2),3)*5+1,FALSE)&"|"&HLOOKUP(Sheet1!R2C1,Sheet1!R2C1:R16C1,MOD(RC1+1,2)+MOD(INT((RC1+1)/2),3)*5+1,FALSE)&"|"&HLOOKUP(Sheet1!R2C1,Sheet1!R2C1:R16C1,MOD(RC1+2,2)+MOD(INT((RC1+2)/2),3)*5+1,FALSE)&"|"&HLOOKUP(Sheet1!R2C1,Sheet1!R2C1:R16C1,MOD(RC1+3,2)+MOD(INT((RC1+3)/2),3)*5+1,FALSE) -> 100|101|130|131|160 | H199: =HLOOKUP(Sheet1!R2C1,Sheet1!R2C1:R16C1,MOD(RC1+2,2)+MOD(INT((RC1+2)/2),3)*5+1,FALSE)&"|"&HLOOKUP(Sheet1!R2C1,Sheet1!R2C1:R16C1,MOD(RC1+3,2)+MOD(INT((RC1+3)/2),3)*5+1,FALSE)&"|"&HLOOKUP(Sheet1!R2C1,Sheet1!R2C1:R16C1,MOD(RC1+4,2)+MOD(INT((RC1+4)/2),3)*5+1,FALSE)&"|"&HLOOKUP(Sheet1!R2C1,Sheet1!R2C1:R16C1,MOD(RC1+5,2)+MOD(INT((RC1+5)/2),3)*5+1,FALSE)&"|"&HLOOKUP(Sheet1!R2C1,Sheet1!R2C1:R16C1,MOD(RC1+6,2)+MOD(INT((RC1+6)/2),3)*5+1,FALSE) -> 131|160|161|100|101 | I199: =HLOOKUP(Sheet1!R2C1,Sheet1!R2C1:R16C1,MOD(RC1-1,3)+MOD(INT((RC1-1)/3),3)*5+3,FALSE)&"|"&HLOOKUP(Sheet1!R2C1,Sheet1!R2C1:R16C1,MOD(RC1,3)+MOD(INT((RC1)/3),3)*5+3,FALSE)&"|"&HLOOKUP(Sheet1!R2C1,Sheet1!R2C1:R16C1,MOD(RC1+1,3)+MOD(INT((RC1+1)/3),3)*5+3,FALSE)&"|"&HLOOKUP(Sheet1!R2C1,Sheet1!R2C1:R16C1,MOD(RC1+2,3)+MOD(INT((RC1+2)/3),3)*5+3,FALSE)&"|"&HLOOKUP(Sheet1!R2C1,Sheet1!R2C1:R16C1,MOD(RC1+3,3)+MOD(INT((RC1+3)/3),3)*5+3,FALSE) -> 132|133|134|162|163 | J199: =HLOOKUP(Sheet1!R2C1,Sheet1!R2C1:R16C1,MOD(RC1-1,3)+MOD(INT((RC1-1)/3),3)*5+3,FALSE)&"|"&HLOOKUP(Sheet1!R2C1,Sheet1!R2C1:R16C1,MOD(RC1,3)+MOD(INT((RC1)/3),3)*5+3,FALSE)&"|"&HLOOKUP(Sheet1!R2C1,Sheet1!R2C1:R16C1,MOD(RC1+1,3)+MOD(INT((RC1+1)/3),3)*5+3,FALSE)&"|"&HLOOKUP(Sheet1!R2C1,Sheet1!R2C1:R16C1,MOD(RC1+2,3)+MOD(INT((RC1+2)/3),3)*5+3,FALSE)&"|"&HLOOKUP(Sheet1!R2C1,Sheet1!R2C1:R16C1,MOD(RC1+3,3)+MOD(INT((RC1+3)/3),3)*5+3,FALSE) -> 132|133|134|162|163 | K199: =HLOOKUP(Sheet1!R2C1,Sheet1!R2C1:R16C1,MOD(RC1-1,3)+MOD(INT((RC1-1)/3),3)*5+3,FALSE)&"|"&HLOOKUP(Sheet1!R2C1,Sheet1!R2C1:R16C1,MOD(RC1,3)+MOD(INT((RC1)/3),3)*5+3,FALSE)&"|"&HLOOKUP(Sheet1!R2C1,Sheet1!R2C1:R16C1,MOD(RC1+1,3)+MOD(INT((RC1+1)/3),3)*5+3,FALSE)&"|"&HLOOKUP(Sheet1!R2C1,Sheet1!R2C1:R16C1,MOD(RC1+2,3)+MOD(INT((RC1+2)/3),3)*5+3,FALSE)&"|"&HLOOKUP(Sheet1!R2C1,Sheet1!R2C1:R16C1,MOD(RC1+3,3)+MOD(INT((RC1+3)/3),3)*5+3,FALSE) -> 132|133|134|162|163 | L199: 25|22|23|24 | M199: 927560|927560|927560|927560 | N199: 10030|10031|10032|10033 | O199: 1|1|1|1 | P199: 2500|2500|2500|2500
A200: 194 | B200: 192 | C200: 30 | D200: =R[-20]C+2 -> 38 | E200: 1000 | F200: =MOD(RC[-5]-1,3)*30+100&"|"&MOD(RC[-5]-1,3)*30+101&"|"&MOD(RC[-5]-1,3)*30+102&"|"&MOD(RC[-5]-1,3)*30+103&"|"&IF(MOD(RC[-5],4)=0,HLOOKUP(Sheet1!R2C10,Sheet1!R2C10:R7C10,MOD(RC[-5]/4-1,6)+1,FALSE),IF(MOD(RC[-5],2)=0,IF(RC[-5]>20,HLOOKUP(Sheet1!R2C7,Sheet1!R2C7:R43C7,MOD(RC[-5]/2-1,42)+1,FALSE),HLOOKUP(Sheet1!R2C4,Sheet1!R2C4:R7C4,MOD(RC[-5]-1,6)+1,FALSE)),MOD(RC[-5]-1,3)*30+104)) -> 130|131|132|133|124 | G200: =HLOOKUP(Sheet1!R2C1,Sheet1!R2C1:R16C1,MOD(RC1-1,2)+MOD(INT((RC1-1)/2),3)*5+1,FALSE)&"|"&HLOOKUP(Sheet1!R2C1,Sheet1!R2C1:R16C1,MOD(RC1,2)+MOD(INT((RC1)/2),3)*5+1,FALSE)&"|"&HLOOKUP(Sheet1!R2C1,Sheet1!R2C1:R16C1,MOD(RC1+1,2)+MOD(INT((RC1+1)/2),3)*5+1,FALSE)&"|"&HLOOKUP(Sheet1!R2C1,Sheet1!R2C1:R16C1,MOD(RC1+2,2)+MOD(INT((RC1+2)/2),3)*5+1,FALSE)&"|"&HLOOKUP(Sheet1!R2C1,Sheet1!R2C1:R16C1,MOD(RC1+3,2)+MOD(INT((RC1+3)/2),3)*5+1,FALSE) -> 101|130|131|160|161 | H200: =HLOOKUP(Sheet1!R2C1,Sheet1!R2C1:R16C1,MOD(RC1+2,2)+MOD(INT((RC1+2)/2),3)*5+1,FALSE)&"|"&HLOOKUP(Sheet1!R2C1,Sheet1!R2C1:R16C1,MOD(RC1+3,2)+MOD(INT((RC1+3)/2),3)*5+1,FALSE)&"|"&HLOOKUP(Sheet1!R2C1,Sheet1!R2C1:R16C1,MOD(RC1+4,2)+MOD(INT((RC1+4)/2),3)*5+1,FALSE)&"|"&HLOOKUP(Sheet1!R2C1,Sheet1!R2C1:R16C1,MOD(RC1+5,2)+MOD(INT((RC1+5)/2),3)*5+1,FALSE)&"|"&HLOOKUP(Sheet1!R2C1,Sheet1!R2C1:R16C1,MOD(RC1+6,2)+MOD(INT((RC1+6)/2),3)*5+1,FALSE) -> 160|161|100|101|130 | I200: =HLOOKUP(Sheet1!R2C1,Sheet1!R2C1:R16C1,MOD(RC1-1,3)+MOD(INT((RC1-1)/3),3)*5+3,FALSE)&"|"&HLOOKUP(Sheet1!R2C1,Sheet1!R2C1:R16C1,MOD(RC1,3)+MOD(INT((RC1)/3),3)*5+3,FALSE)&"|"&HLOOKUP(Sheet1!R2C1,Sheet1!R2C1:R16C1,MOD(RC1+1,3)+MOD(INT((RC1+1)/3),3)*5+3,FALSE)&"|"&HLOOKUP(Sheet1!R2C1,Sheet1!R2C1:R16C1,MOD(RC1+2,3)+MOD(INT((RC1+2)/3),3)*5+3,FALSE)&"|"&HLOOKUP(Sheet1!R2C1,Sheet1!R2C1:R16C1,MOD(RC1+3,3)+MOD(INT((RC1+3)/3),3)*5+3,FALSE) -> 133|134|162|163|164 | J200: =HLOOKUP(Sheet1!R2C1,Sheet1!R2C1:R16C1,MOD(RC1-1,3)+MOD(INT((RC1-1)/3),3)*5+3,FALSE)&"|"&HLOOKUP(Sheet1!R2C1,Sheet1!R2C1:R16C1,MOD(RC1,3)+MOD(INT((RC1)/3),3)*5+3,FALSE)&"|"&HLOOKUP(Sheet1!R2C1,Sheet1!R2C1:R16C1,MOD(RC1+1,3)+MOD(INT((RC1+1)/3),3)*5+3,FALSE)&"|"&HLOOKUP(Sheet1!R2C1,Sheet1!R2C1:R16C1,MOD(RC1+2,3)+MOD(INT((RC1+2)/3),3)*5+3,FALSE)&"|"&HLOOKUP(Sheet1!R2C1,Sheet1!R2C1:R16C1,MOD(RC1+3,3)+MOD(INT((RC1+3)/3),3)*5+3,FALSE) -> 133|134|162|163|164 | K200: =HLOOKUP(Sheet1!R2C1,Sheet1!R2C1:R16C1,MOD(RC1-1,3)+MOD(INT((RC1-1)/3),3)*5+3,FALSE)&"|"&HLOOKUP(Sheet1!R2C1,Sheet1!R2C1:R16C1,MOD(RC1,3)+MOD(INT((RC1)/3),3)*5+3,FALSE)&"|"&HLOOKUP(Sheet1!R2C1,Sheet1!R2C1:R16C1,MOD(RC1+1,3)+MOD(INT((RC1+1)/3),3)*5+3,FALSE)&"|"&HLOOKUP(Sheet1!R2C1,Sheet1!R2C1:R16C1,MOD(RC1+2,3)+MOD(INT((RC1+2)/3),3)*5+3,FALSE)&"|"&HLOOKUP(Sheet1!R2C1,Sheet1!R2C1:R16C1,MOD(RC1+3,3)+MOD(INT((RC1+3)/3),3)*5+3,FALSE) -> 133|134|162|163|164 | L200: 25|22|23|24 | M200: 937861|937861|937863|937863 | N200: 10030|10031|10032|10033 | O200: 1|1|1|1 | P200: 2500|2500|2500|2500
A201: 195 | B201: 193 | C201: 30 | D201: =R[-20]C+2 -> 38 | E201: 1000 | F201: =MOD(RC[-5]-1,3)*30+100&"|"&MOD(RC[-5]-1,3)*30+101&"|"&MOD(RC[-5]-1,3)*30+102&"|"&MOD(RC[-5]-1,3)*30+103&"|"&IF(MOD(RC[-5],4)=0,HLOOKUP(Sheet1!R2C10,Sheet1!R2C10:R7C10,MOD(RC[-5]/4-1,6)+1,FALSE),IF(MOD(RC[-5],2)=0,IF(RC[-5]>20,HLOOKUP(Sheet1!R2C7,Sheet1!R2C7:R43C7,MOD(RC[-5]/2-1,42)+1,FALSE),HLOOKUP(Sheet1!R2C4,Sheet1!R2C4:R7C4,MOD(RC[-5]-1,6)+1,FALSE)),MOD(RC[-5]-1,3)*30+104)) -> 160|161|162|163|164 | G201: =HLOOKUP(Sheet1!R2C1,Sheet1!R2C1:R16C1,MOD(RC1-1,2)+MOD(INT((RC1-1)/2),3)*5+1,FALSE)&"|"&HLOOKUP(Sheet1!R2C1,Sheet1!R2C1:R16C1,MOD(RC1,2)+MOD(INT((RC1)/2),3)*5+1,FALSE)&"|"&HLOOKUP(Sheet1!R2C1,Sheet1!R2C1:R16C1,MOD(RC1+1,2)+MOD(INT((RC1+1)/2),3)*5+1,FALSE)&"|"&HLOOKUP(Sheet1!R2C1,Sheet1!R2C1:R16C1,MOD(RC1+2,2)+MOD(INT((RC1+2)/2),3)*5+1,FALSE)&"|"&HLOOKUP(Sheet1!R2C1,Sheet1!R2C1:R16C1,MOD(RC1+3,2)+MOD(INT((RC1+3)/2),3)*5+1,FALSE) -> 130|131|160|161|100 | H201: =HLOOKUP(Sheet1!R2C1,Sheet1!R2C1:R16C1,MOD(RC1+2,2)+MOD(INT((RC1+2)/2),3)*5+1,FALSE)&"|"&HLOOKUP(Sheet1!R2C1,Sheet1!R2C1:R16C1,MOD(RC1+3,2)+MOD(INT((RC1+3)/2),3)*5+1,FALSE)&"|"&HLOOKUP(Sheet1!R2C1,Sheet1!R2C1:R16C1,MOD(RC1+4,2)+MOD(INT((RC1+4)/2),3)*5+1,FALSE)&"|"&HLOOKUP(Sheet1!R2C1,Sheet1!R2C1:R16C1,MOD(RC1+5,2)+MOD(INT((RC1+5)/2),3)*5+1,FALSE)&"|"&HLOOKUP(Sheet1!R2C1,Sheet1!R2C1:R16C1,MOD(RC1+6,2)+MOD(INT((RC1+6)/2),3)*5+1,FALSE) -> 161|100|101|130|131 | I201: =HLOOKUP(Sheet1!R2C1,Sheet1!R2C1:R16C1,MOD(RC1-1,3)+MOD(INT((RC1-1)/3),3)*5+3,FALSE)&"|"&HLOOKUP(Sheet1!R2C1,Sheet1!R2C1:R16C1,MOD(RC1,3)+MOD(INT((RC1)/3),3)*5+3,FALSE)&"|"&HLOOKUP(Sheet1!R2C1,Sheet1!R2C1:R16C1,MOD(RC1+1,3)+MOD(INT((RC1+1)/3),3)*5+3,FALSE)&"|"&HLOOKUP(Sheet1!R2C1,Sheet1!R2C1:R16C1,MOD(RC1+2,3)+MOD(INT((RC1+2)/3),3)*5+3,FALSE)&"|"&HLOOKUP(Sheet1!R2C1,Sheet1!R2C1:R16C1,MOD(RC1+3,3)+MOD(INT((RC1+3)/3),3)*5+3,FALSE) -> 134|162|163|164|102 | J201: =HLOOKUP(Sheet1!R2C1,Sheet1!R2C1:R16C1,MOD(RC1-1,3)+MOD(INT((RC1-1)/3),3)*5+3,FALSE)&"|"&HLOOKUP(Sheet1!R2C1,Sheet1!R2C1:R16C1,MOD(RC1,3)+MOD(INT((RC1)/3),3)*5+3,FALSE)&"|"&HLOOKUP(Sheet1!R2C1,Sheet1!R2C1:R16C1,MOD(RC1+1,3)+MOD(INT((RC1+1)/3),3)*5+3,FALSE)&"|"&HLOOKUP(Sheet1!R2C1,Sheet1!R2C1:R16C1,MOD(RC1+2,3)+MOD(INT((RC1+2)/3),3)*5+3,FALSE)&"|"&HLOOKUP(Sheet1!R2C1,Sheet1!R2C1:R16C1,MOD(RC1+3,3)+MOD(INT((RC1+3)/3),3)*5+3,FALSE) -> 134|162|163|164|102 | K201: =HLOOKUP(Sheet1!R2C1,Sheet1!R2C1:R16C1,MOD(RC1-1,3)+MOD(INT((RC1-1)/3),3)*5+3,FALSE)&"|"&HLOOKUP(Sheet1!R2C1,Sheet1!R2C1:R16C1,MOD(RC1,3)+MOD(INT((RC1)/3),3)*5+3,FALSE)&"|"&HLOOKUP(Sheet1!R2C1,Sheet1!R2C1:R16C1,MOD(RC1+1,3)+MOD(INT((RC1+1)/3),3)*5+3,FALSE)&"|"&HLOOKUP(Sheet1!R2C1,Sheet1!R2C1:R16C1,MOD(RC1+2,3)+MOD(INT((RC1+2)/3),3)*5+3,FALSE)&"|"&HLOOKUP(Sheet1!R2C1,Sheet1!R2C1:R16C1,MOD(RC1+3,3)+MOD(INT((RC1+3)/3),3)*5+3,FALSE) -> 134|162|163|164|102 | L201: 25|22|23|24 | M201: 947795|947795|947795|947795 | N201: 10030|10031|10032|10033|10030|10031|10032|10033|10030|10031|10032|10033|10030|10031|10032|10033|10030|10031|10032|10033|10030|10031|10032|10033|10030|10031|10032|10033|10030|10031|10032|10033|10030|10031|10032|10033|10030|10031|10032|10033 | O201: 1|1|1|1|1|1|1|1|1|1|1|1|1|1|1|1|1|1|1|1|1|1|1|1|1|1|1|1|1|1|1|1|1|1|1|1|1|1|1|1 | P201: 2500|2500|2500|2500|2500|2500|2500|2500|2500|2500|2500|2500|2500|2500|2500|2500|2500|2500|2500|2500|2500|2500|2500|2500|2500|2500|2500|2500|2500|2500|2500|2500|2500|2500|2500|2500|2500|2500|2500|2500
A202: 196 | B202: 194 | C202: 30 | D202: =R[-20]C+2 -> 38 | E202: 1000 | F202: =MOD(RC[-5]-1,3)*30+100&"|"&MOD(RC[-5]-1,3)*30+101&"|"&MOD(RC[-5]-1,3)*30+102&"|"&MOD(RC[-5]-1,3)*30+103&"|"&IF(MOD(RC[-5],4)=0,HLOOKUP(Sheet1!R2C10,Sheet1!R2C10:R7C10,MOD(RC[-5]/4-1,6)+1,FALSE),IF(MOD(RC[-5],2)=0,IF(RC[-5]>20,HLOOKUP(Sheet1!R2C7,Sheet1!R2C7:R43C7,MOD(RC[-5]/2-1,42)+1,FALSE),HLOOKUP(Sheet1!R2C4,Sheet1!R2C4:R7C4,MOD(RC[-5]-1,6)+1,FALSE)),MOD(RC[-5]-1,3)*30+104)) -> 100|101|102|103|190 | G202: =HLOOKUP(Sheet1!R2C1,Sheet1!R2C1:R16C1,MOD(RC1-1,2)+MOD(INT((RC1-1)/2),3)*5+1,FALSE)&"|"&HLOOKUP(Sheet1!R2C1,Sheet1!R2C1:R16C1,MOD(RC1,2)+MOD(INT((RC1)/2),3)*5+1,FALSE)&"|"&HLOOKUP(Sheet1!R2C1,Sheet1!R2C1:R16C1,MOD(RC1+1,2)+MOD(INT((RC1+1)/2),3)*5+1,FALSE)&"|"&HLOOKUP(Sheet1!R2C1,Sheet1!R2C1:R16C1,MOD(RC1+2,2)+MOD(INT((RC1+2)/2),3)*5+1,FALSE)&"|"&HLOOKUP(Sheet1!R2C1,Sheet1!R2C1:R16C1,MOD(RC1+3,2)+MOD(INT((RC1+3)/2),3)*5+1,FALSE) -> 131|160|161|100|101 | H202: =HLOOKUP(Sheet1!R2C1,Sheet1!R2C1:R16C1,MOD(RC1+2,2)+MOD(INT((RC1+2)/2),3)*5+1,FALSE)&"|"&HLOOKUP(Sheet1!R2C1,Sheet1!R2C1:R16C1,MOD(RC1+3,2)+MOD(INT((RC1+3)/2),3)*5+1,FALSE)&"|"&HLOOKUP(Sheet1!R2C1,Sheet1!R2C1:R16C1,MOD(RC1+4,2)+MOD(INT((RC1+4)/2),3)*5+1,FALSE)&"|"&HLOOKUP(Sheet1!R2C1,Sheet1!R2C1:R16C1,MOD(RC1+5,2)+MOD(INT((RC1+5)/2),3)*5+1,FALSE)&"|"&HLOOKUP(Sheet1!R2C1,Sheet1!R2C1:R16C1,MOD(RC1+6,2)+MOD(INT((RC1+6)/2),3)*5+1,FALSE) -> 100|101|130|131|160 | I202: =HLOOKUP(Sheet1!R2C1,Sheet1!R2C1:R16C1,MOD(RC1-1,3)+MOD(INT((RC1-1)/3),3)*5+3,FALSE)&"|"&HLOOKUP(Sheet1!R2C1,Sheet1!R2C1:R16C1,MOD(RC1,3)+MOD(INT((RC1)/3),3)*5+3,FALSE)&"|"&HLOOKUP(Sheet1!R2C1,Sheet1!R2C1:R16C1,MOD(RC1+1,3)+MOD(INT((RC1+1)/3),3)*5+3,FALSE)&"|"&HLOOKUP(Sheet1!R2C1,Sheet1!R2C1:R16C1,MOD(RC1+2,3)+MOD(INT((RC1+2)/3),3)*5+3,FALSE)&"|"&HLOOKUP(Sheet1!R2C1,Sheet1!R2C1:R16C1,MOD(RC1+3,3)+MOD(INT((RC1+3)/3),3)*5+3,FALSE) -> 162|163|164|102|103 | J202: =HLOOKUP(Sheet1!R2C1,Sheet1!R2C1:R16C1,MOD(RC1-1,3)+MOD(INT((RC1-1)/3),3)*5+3,FALSE)&"|"&HLOOKUP(Sheet1!R2C1,Sheet1!R2C1:R16C1,MOD(RC1,3)+MOD(INT((RC1)/3),3)*5+3,FALSE)&"|"&HLOOKUP(Sheet1!R2C1,Sheet1!R2C1:R16C1,MOD(RC1+1,3)+MOD(INT((RC1+1)/3),3)*5+3,FALSE)&"|"&HLOOKUP(Sheet1!R2C1,Sheet1!R2C1:R16C1,MOD(RC1+2,3)+MOD(INT((RC1+2)/3),3)*5+3,FALSE)&"|"&HLOOKUP(Sheet1!R2C1,Sheet1!R2C1:R16C1,MOD(RC1+3,3)+MOD(INT((RC1+3)/3),3)*5+3,FALSE) -> 162|163|164|102|103 | K202: =HLOOKUP(Sheet1!R2C1,Sheet1!R2C1:R16C1,MOD(RC1-1,3)+MOD(INT((RC1-1)/3),3)*5+3,FALSE)&"|"&HLOOKUP(Sheet1!R2C1,Sheet1!R2C1:R16C1,MOD(RC1,3)+MOD(INT((RC1)/3),3)*5+3,FALSE)&"|"&HLOOKUP(Sheet1!R2C1,Sheet1!R2C1:R16C1,MOD(RC1+1,3)+MOD(INT((RC1+1)/3),3)*5+3,FALSE)&"|"&HLOOKUP(Sheet1!R2C1,Sheet1!R2C1:R16C1,MOD(RC1+2,3)+MOD(INT((RC1+2)/3),3)*5+3,FALSE)&"|"&HLOOKUP(Sheet1!R2C1,Sheet1!R2C1:R16C1,MOD(RC1+3,3)+MOD(INT((RC1+3)/3),3)*5+3,FALSE) -> 162|163|164|102|103 | L202: 25|22|23|24 | M202: 958423|958423|958423|958423 | N202: 10030|10031|10032|10033 | O202: 1|1|1|1 | P202: 2500|2500|2500|2500
A203: 197 | B203: 195 | C203: 30 | D203: =R[-20]C+2 -> 38 | E203: 1000 | F203: =MOD(RC[-5]-1,3)*30+100&"|"&MOD(RC[-5]-1,3)*30+101&"|"&MOD(RC[-5]-1,3)*30+102&"|"&MOD(RC[-5]-1,3)*30+103&"|"&IF(MOD(RC[-5],4)=0,HLOOKUP(Sheet1!R2C10,Sheet1!R2C10:R7C10,MOD(RC[-5]/4-1,6)+1,FALSE),IF(MOD(RC[-5],2)=0,IF(RC[-5]>20,HLOOKUP(Sheet1!R2C7,Sheet1!R2C7:R43C7,MOD(RC[-5]/2-1,42)+1,FALSE),HLOOKUP(Sheet1!R2C4,Sheet1!R2C4:R7C4,MOD(RC[-5]-1,6)+1,FALSE)),MOD(RC[-5]-1,3)*30+104)) -> 130|131|132|133|134 | G203: =HLOOKUP(Sheet1!R2C1,Sheet1!R2C1:R16C1,MOD(RC1-1,2)+MOD(INT((RC1-1)/2),3)*5+1,FALSE)&"|"&HLOOKUP(Sheet1!R2C1,Sheet1!R2C1:R16C1,MOD(RC1,2)+MOD(INT((RC1)/2),3)*5+1,FALSE)&"|"&HLOOKUP(Sheet1!R2C1,Sheet1!R2C1:R16C1,MOD(RC1+1,2)+MOD(INT((RC1+1)/2),3)*5+1,FALSE)&"|"&HLOOKUP(Sheet1!R2C1,Sheet1!R2C1:R16C1,MOD(RC1+2,2)+MOD(INT((RC1+2)/2),3)*5+1,FALSE)&"|"&HLOOKUP(Sheet1!R2C1,Sheet1!R2C1:R16C1,MOD(RC1+3,2)+MOD(INT((RC1+3)/2),3)*5+1,FALSE) -> 160|161|100|101|130 | H203: =HLOOKUP(Sheet1!R2C1,Sheet1!R2C1:R16C1,MOD(RC1+2,2)+MOD(INT((RC1+2)/2),3)*5+1,FALSE)&"|"&HLOOKUP(Sheet1!R2C1,Sheet1!R2C1:R16C1,MOD(RC1+3,2)+MOD(INT((RC1+3)/2),3)*5+1,FALSE)&"|"&HLOOKUP(Sheet1!R2C1,Sheet1!R2C1:R16C1,MOD(RC1+4,2)+MOD(INT((RC1+4)/2),3)*5+1,FALSE)&"|"&HLOOKUP(Sheet1!R2C1,Sheet1!R2C1:R16C1,MOD(RC1+5,2)+MOD(INT((RC1+5)/2),3)*5+1,FALSE)&"|"&HLOOKUP(Sheet1!R2C1,Sheet1!R2C1:R16C1,MOD(RC1+6,2)+MOD(INT((RC1+6)/2),3)*5+1,FALSE) -> 101|130|131|160|161 | I203: =HLOOKUP(Sheet1!R2C1,Sheet1!R2C1:R16C1,MOD(RC1-1,3)+MOD(INT((RC1-1)/3),3)*5+3,FALSE)&"|"&HLOOKUP(Sheet1!R2C1,Sheet1!R2C1:R16C1,MOD(RC1,3)+MOD(INT((RC1)/3),3)*5+3,FALSE)&"|"&HLOOKUP(Sheet1!R2C1,Sheet1!R2C1:R16C1,MOD(RC1+1,3)+MOD(INT((RC1+1)/3),3)*5+3,FALSE)&"|"&HLOOKUP(Sheet1!R2C1,Sheet1!R2C1:R16C1,MOD(RC1+2,3)+MOD(INT((RC1+2)/3),3)*5+3,FALSE)&"|"&HLOOKUP(Sheet1!R2C1,Sheet1!R2C1:R16C1,MOD(RC1+3,3)+MOD(INT((RC1+3)/3),3)*5+3,FALSE) -> 163|164|102|103|104 | J203: =HLOOKUP(Sheet1!R2C1,Sheet1!R2C1:R16C1,MOD(RC1-1,3)+MOD(INT((RC1-1)/3),3)*5+3,FALSE)&"|"&HLOOKUP(Sheet1!R2C1,Sheet1!R2C1:R16C1,MOD(RC1,3)+MOD(INT((RC1)/3),3)*5+3,FALSE)&"|"&HLOOKUP(Sheet1!R2C1,Sheet1!R2C1:R16C1,MOD(RC1+1,3)+MOD(INT((RC1+1)/3),3)*5+3,FALSE)&"|"&HLOOKUP(Sheet1!R2C1,Sheet1!R2C1:R16C1,MOD(RC1+2,3)+MOD(INT((RC1+2)/3),3)*5+3,FALSE)&"|"&HLOOKUP(Sheet1!R2C1,Sheet1!R2C1:R16C1,MOD(RC1+3,3)+MOD(INT((RC1+3)/3),3)*5+3,FALSE) -> 163|164|102|103|104 | K203: =HLOOKUP(Sheet1!R2C1,Sheet1!R2C1:R16C1,MOD(RC1-1,3)+MOD(INT((RC1-1)/3),3)*5+3,FALSE)&"|"&HLOOKUP(Sheet1!R2C1,Sheet1!R2C1:R16C1,MOD(RC1,3)+MOD(INT((RC1)/3),3)*5+3,FALSE)&"|"&HLOOKUP(Sheet1!R2C1,Sheet1!R2C1:R16C1,MOD(RC1+1,3)+MOD(INT((RC1+1)/3),3)*5+3,FALSE)&"|"&HLOOKUP(Sheet1!R2C1,Sheet1!R2C1:R16C1,MOD(RC1+2,3)+MOD(INT((RC1+2)/3),3)*5+3,FALSE)&"|"&HLOOKUP(Sheet1!R2C1,Sheet1!R2C1:R16C1,MOD(RC1+3,3)+MOD(INT((RC1+3)/3),3)*5+3,FALSE) -> 163|164|102|103|104 | L203: 25|22|23|24 | M203: 969181|969181|969183|969183 | N203: 10030|10031|10032|10033 | O203: 1|1|1|1 | P203: 2500|2500|2500|2500
A204: 198 | B204: 196 | C204: 30 | D204: =R[-20]C+2 -> 38 | E204: 1000 | F204: =MOD(RC[-5]-1,3)*30+100&"|"&MOD(RC[-5]-1,3)*30+101&"|"&MOD(RC[-5]-1,3)*30+102&"|"&MOD(RC[-5]-1,3)*30+103&"|"&IF(MOD(RC[-5],4)=0,HLOOKUP(Sheet1!R2C10,Sheet1!R2C10:R7C10,MOD(RC[-5]/4-1,6)+1,FALSE),IF(MOD(RC[-5],2)=0,IF(RC[-5]>20,HLOOKUP(Sheet1!R2C7,Sheet1!R2C7:R43C7,MOD(RC[-5]/2-1,42)+1,FALSE),HLOOKUP(Sheet1!R2C4,Sheet1!R2C4:R7C4,MOD(RC[-5]-1,6)+1,FALSE)),MOD(RC[-5]-1,3)*30+104)) -> 160|161|162|163|142 | G204: =HLOOKUP(Sheet1!R2C1,Sheet1!R2C1:R16C1,MOD(RC1-1,2)+MOD(INT((RC1-1)/2),3)*5+1,FALSE)&"|"&HLOOKUP(Sheet1!R2C1,Sheet1!R2C1:R16C1,MOD(RC1,2)+MOD(INT((RC1)/2),3)*5+1,FALSE)&"|"&HLOOKUP(Sheet1!R2C1,Sheet1!R2C1:R16C1,MOD(RC1+1,2)+MOD(INT((RC1+1)/2),3)*5+1,FALSE)&"|"&HLOOKUP(Sheet1!R2C1,Sheet1!R2C1:R16C1,MOD(RC1+2,2)+MOD(INT((RC1+2)/2),3)*5+1,FALSE)&"|"&HLOOKUP(Sheet1!R2C1,Sheet1!R2C1:R16C1,MOD(RC1+3,2)+MOD(INT((RC1+3)/2),3)*5+1,FALSE) -> 161|100|101|130|131 | H204: =HLOOKUP(Sheet1!R2C1,Sheet1!R2C1:R16C1,MOD(RC1+2,2)+MOD(INT((RC1+2)/2),3)*5+1,FALSE)&"|"&HLOOKUP(Sheet1!R2C1,Sheet1!R2C1:R16C1,MOD(RC1+3,2)+MOD(INT((RC1+3)/2),3)*5+1,FALSE)&"|"&HLOOKUP(Sheet1!R2C1,Sheet1!R2C1:R16C1,MOD(RC1+4,2)+MOD(INT((RC1+4)/2),3)*5+1,FALSE)&"|"&HLOOKUP(Sheet1!R2C1,Sheet1!R2C1:R16C1,MOD(RC1+5,2)+MOD(INT((RC1+5)/2),3)*5+1,FALSE)&"|"&HLOOKUP(Sheet1!R2C1,Sheet1!R2C1:R16C1,MOD(RC1+6,2)+MOD(INT((RC1+6)/2),3)*5+1,FALSE) -> 130|131|160|161|100 | I204: =HLOOKUP(Sheet1!R2C1,Sheet1!R2C1:R16C1,MOD(RC1-1,3)+MOD(INT((RC1-1)/3),3)*5+3,FALSE)&"|"&HLOOKUP(Sheet1!R2C1,Sheet1!R2C1:R16C1,MOD(RC1,3)+MOD(INT((RC1)/3),3)*5+3,FALSE)&"|"&HLOOKUP(Sheet1!R2C1,Sheet1!R2C1:R16C1,MOD(RC1+1,3)+MOD(INT((RC1+1)/3),3)*5+3,FALSE)&"|"&HLOOKUP(Sheet1!R2C1,Sheet1!R2C1:R16C1,MOD(RC1+2,3)+MOD(INT((RC1+2)/3),3)*5+3,FALSE)&"|"&HLOOKUP(Sheet1!R2C1,Sheet1!R2C1:R16C1,MOD(RC1+3,3)+MOD(INT((RC1+3)/3),3)*5+3,FALSE) -> 164|102|103|104|132 | J204: =HLOOKUP(Sheet1!R2C1,Sheet1!R2C1:R16C1,MOD(RC1-1,3)+MOD(INT((RC1-1)/3),3)*5+3,FALSE)&"|"&HLOOKUP(Sheet1!R2C1,Sheet1!R2C1:R16C1,MOD(RC1,3)+MOD(INT((RC1)/3),3)*5+3,FALSE)&"|"&HLOOKUP(Sheet1!R2C1,Sheet1!R2C1:R16C1,MOD(RC1+1,3)+MOD(INT((RC1+1)/3),3)*5+3,FALSE)&"|"&HLOOKUP(Sheet1!R2C1,Sheet1!R2C1:R16C1,MOD(RC1+2,3)+MOD(INT((RC1+2)/3),3)*5+3,FALSE)&"|"&HLOOKUP(Sheet1!R2C1,Sheet1!R2C1:R16C1,MOD(RC1+3,3)+MOD(INT((RC1+3)/3),3)*5+3,FALSE) -> 164|102|103|104|132 | K204: =HLOOKUP(Sheet1!R2C1,Sheet1!R2C1:R16C1,MOD(RC1-1,3)+MOD(INT((RC1-1)/3),3)*5+3,FALSE)&"|"&HLOOKUP(Sheet1!R2C1,Sheet1!R2C1:R16C1,MOD(RC1,3)+MOD(INT((RC1)/3),3)*5+3,FALSE)&"|"&HLOOKUP(Sheet1!R2C1,Sheet1!R2C1:R16C1,MOD(RC1+1,3)+MOD(INT((RC1+1)/3),3)*5+3,FALSE)&"|"&HLOOKUP(Sheet1!R2C1,Sheet1!R2C1:R16C1,MOD(RC1+2,3)+MOD(INT((RC1+2)/3),3)*5+3,FALSE)&"|"&HLOOKUP(Sheet1!R2C1,Sheet1!R2C1:R16C1,MOD(RC1+3,3)+MOD(INT((RC1+3)/3),3)*5+3,FALSE) -> 164|102|103|104|132 | L204: 25|22|23|24 | M204: 979940|979940|979940|979940 | N204: 10030|10031|10032|10033 | O204: 1|1|1|1 | P204: 2500|2500|2500|2500
A205: 199 | B205: 197 | C205: 30 | D205: =R[-20]C+2 -> 38 | E205: 1000 | F205: =MOD(RC[-5]-1,3)*30+100&"|"&MOD(RC[-5]-1,3)*30+101&"|"&MOD(RC[-5]-1,3)*30+102&"|"&MOD(RC[-5]-1,3)*30+103&"|"&IF(MOD(RC[-5],4)=0,HLOOKUP(Sheet1!R2C10,Sheet1!R2C10:R7C10,MOD(RC[-5]/4-1,6)+1,FALSE),IF(MOD(RC[-5],2)=0,IF(RC[-5]>20,HLOOKUP(Sheet1!R2C7,Sheet1!R2C7:R43C7,MOD(RC[-5]/2-1,42)+1,FALSE),HLOOKUP(Sheet1!R2C4,Sheet1!R2C4:R7C4,MOD(RC[-5]-1,6)+1,FALSE)),MOD(RC[-5]-1,3)*30+104)) -> 100|101|102|103|104 | G205: =HLOOKUP(Sheet1!R2C1,Sheet1!R2C1:R16C1,MOD(RC1-1,2)+MOD(INT((RC1-1)/2),3)*5+1,FALSE)&"|"&HLOOKUP(Sheet1!R2C1,Sheet1!R2C1:R16C1,MOD(RC1,2)+MOD(INT((RC1)/2),3)*5+1,FALSE)&"|"&HLOOKUP(Sheet1!R2C1,Sheet1!R2C1:R16C1,MOD(RC1+1,2)+MOD(INT((RC1+1)/2),3)*5+1,FALSE)&"|"&HLOOKUP(Sheet1!R2C1,Sheet1!R2C1:R16C1,MOD(RC1+2,2)+MOD(INT((RC1+2)/2),3)*5+1,FALSE)&"|"&HLOOKUP(Sheet1!R2C1,Sheet1!R2C1:R16C1,MOD(RC1+3,2)+MOD(INT((RC1+3)/2),3)*5+1,FALSE) -> 100|101|130|131|160 | H205: =HLOOKUP(Sheet1!R2C1,Sheet1!R2C1:R16C1,MOD(RC1+2,2)+MOD(INT((RC1+2)/2),3)*5+1,FALSE)&"|"&HLOOKUP(Sheet1!R2C1,Sheet1!R2C1:R16C1,MOD(RC1+3,2)+MOD(INT((RC1+3)/2),3)*5+1,FALSE)&"|"&HLOOKUP(Sheet1!R2C1,Sheet1!R2C1:R16C1,MOD(RC1+4,2)+MOD(INT((RC1+4)/2),3)*5+1,FALSE)&"|"&HLOOKUP(Sheet1!R2C1,Sheet1!R2C1:R16C1,MOD(RC1+5,2)+MOD(INT((RC1+5)/2),3)*5+1,FALSE)&"|"&HLOOKUP(Sheet1!R2C1,Sheet1!R2C1:R16C1,MOD(RC1+6,2)+MOD(INT((RC1+6)/2),3)*5+1,FALSE) -> 131|160|161|100|101 | I205: =HLOOKUP(Sheet1!R2C1,Sheet1!R2C1:R16C1,MOD(RC1-1,3)+MOD(INT((RC1-1)/3),3)*5+3,FALSE)&"|"&HLOOKUP(Sheet1!R2C1,Sheet1!R2C1:R16C1,MOD(RC1,3)+MOD(INT((RC1)/3),3)*5+3,FALSE)&"|"&HLOOKUP(Sheet1!R2C1,Sheet1!R2C1:R16C1,MOD(RC1+1,3)+MOD(INT((RC1+1)/3),3)*5+3,FALSE)&"|"&HLOOKUP(Sheet1!R2C1,Sheet1!R2C1:R16C1,MOD(RC1+2,3)+MOD(INT((RC1+2)/3),3)*5+3,FALSE)&"|"&HLOOKUP(Sheet1!R2C1,Sheet1!R2C1:R16C1,MOD(RC1+3,3)+MOD(INT((RC1+3)/3),3)*5+3,FALSE) -> 102|103|104|132|133 | J205: =HLOOKUP(Sheet1!R2C1,Sheet1!R2C1:R16C1,MOD(RC1-1,3)+MOD(INT((RC1-1)/3),3)*5+3,FALSE)&"|"&HLOOKUP(Sheet1!R2C1,Sheet1!R2C1:R16C1,MOD(RC1,3)+MOD(INT((RC1)/3),3)*5+3,FALSE)&"|"&HLOOKUP(Sheet1!R2C1,Sheet1!R2C1:R16C1,MOD(RC1+1,3)+MOD(INT((RC1+1)/3),3)*5+3,FALSE)&"|"&HLOOKUP(Sheet1!R2C1,Sheet1!R2C1:R16C1,MOD(RC1+2,3)+MOD(INT((RC1+2)/3),3)*5+3,FALSE)&"|"&HLOOKUP(Sheet1!R2C1,Sheet1!R2C1:R16C1,MOD(RC1+3,3)+MOD(INT((RC1+3)/3),3)*5+3,FALSE) -> 102|103|104|132|133 | K205: =HLOOKUP(Sheet1!R2C1,Sheet1!R2C1:R16C1,MOD(RC1-1,3)+MOD(INT((RC1-1)/3),3)*5+3,FALSE)&"|"&HLOOKUP(Sheet1!R2C1,Sheet1!R2C1:R16C1,MOD(RC1,3)+MOD(INT((RC1)/3),3)*5+3,FALSE)&"|"&HLOOKUP(Sheet1!R2C1,Sheet1!R2C1:R16C1,MOD(RC1+1,3)+MOD(INT((RC1+1)/3),3)*5+3,FALSE)&"|"&HLOOKUP(Sheet1!R2C1,Sheet1!R2C1:R16C1,MOD(RC1+2,3)+MOD(INT((RC1+2)/3),3)*5+3,FALSE)&"|"&HLOOKUP(Sheet1!R2C1,Sheet1!R2C1:R16C1,MOD(RC1+3,3)+MOD(INT((RC1+3)/3),3)*5+3,FALSE) -> 102|103|104|132|133 | L205: 25|22|23|24 | M205: 990727|990728|990728|990728 | N205: 10030|10031|10032|10033 | O205: 1|1|1|1 | P205: 2500|2500|2500|2500
A206: 200 | B206: 198 | C206: 30 | D206: =R[-20]C+2 -> 38 | E206: 1000 | F206: =MOD(RC[-5]-1,3)*30+100&"|"&MOD(RC[-5]-1,3)*30+101&"|"&MOD(RC[-5]-1,3)*30+102&"|"&MOD(RC[-5]-1,3)*30+103&"|"&IF(MOD(RC[-5],4)=0,HLOOKUP(Sheet1!R2C10,Sheet1!R2C10:R7C10,MOD(RC[-5]/4-1,6)+1,FALSE),IF(MOD(RC[-5],2)=0,IF(RC[-5]>20,HLOOKUP(Sheet1!R2C7,Sheet1!R2C7:R43C7,MOD(RC[-5]/2-1,42)+1,FALSE),HLOOKUP(Sheet1!R2C4,Sheet1!R2C4:R7C4,MOD(RC[-5]-1,6)+1,FALSE)),MOD(RC[-5]-1,3)*30+104)) -> 130|131|132|133|191 | G206: =HLOOKUP(Sheet1!R2C1,Sheet1!R2C1:R16C1,MOD(RC1-1,2)+MOD(INT((RC1-1)/2),3)*5+1,FALSE)&"|"&HLOOKUP(Sheet1!R2C1,Sheet1!R2C1:R16C1,MOD(RC1,2)+MOD(INT((RC1)/2),3)*5+1,FALSE)&"|"&HLOOKUP(Sheet1!R2C1,Sheet1!R2C1:R16C1,MOD(RC1+1,2)+MOD(INT((RC1+1)/2),3)*5+1,FALSE)&"|"&HLOOKUP(Sheet1!R2C1,Sheet1!R2C1:R16C1,MOD(RC1+2,2)+MOD(INT((RC1+2)/2),3)*5+1,FALSE)&"|"&HLOOKUP(Sheet1!R2C1,Sheet1!R2C1:R16C1,MOD(RC1+3,2)+MOD(INT((RC1+3)/2),3)*5+1,FALSE) -> 101|130|131|160|161 | H206: =HLOOKUP(Sheet1!R2C1,Sheet1!R2C1:R16C1,MOD(RC1+2,2)+MOD(INT((RC1+2)/2),3)*5+1,FALSE)&"|"&HLOOKUP(Sheet1!R2C1,Sheet1!R2C1:R16C1,MOD(RC1+3,2)+MOD(INT((RC1+3)/2),3)*5+1,FALSE)&"|"&HLOOKUP(Sheet1!R2C1,Sheet1!R2C1:R16C1,MOD(RC1+4,2)+MOD(INT((RC1+4)/2),3)*5+1,FALSE)&"|"&HLOOKUP(Sheet1!R2C1,Sheet1!R2C1:R16C1,MOD(RC1+5,2)+MOD(INT((RC1+5)/2),3)*5+1,FALSE)&"|"&HLOOKUP(Sheet1!R2C1,Sheet1!R2C1:R16C1,MOD(RC1+6,2)+MOD(INT((RC1+6)/2),3)*5+1,FALSE) -> 160|161|100|101|130 | I206: =HLOOKUP(Sheet1!R2C1,Sheet1!R2C1:R16C1,MOD(RC1-1,3)+MOD(INT((RC1-1)/3),3)*5+3,FALSE)&"|"&HLOOKUP(Sheet1!R2C1,Sheet1!R2C1:R16C1,MOD(RC1,3)+MOD(INT((RC1)/3),3)*5+3,FALSE)&"|"&HLOOKUP(Sheet1!R2C1,Sheet1!R2C1:R16C1,MOD(RC1+1,3)+MOD(INT((RC1+1)/3),3)*5+3,FALSE)&"|"&HLOOKUP(Sheet1!R2C1,Sheet1!R2C1:R16C1,MOD(RC1+2,3)+MOD(INT((RC1+2)/3),3)*5+3,FALSE)&"|"&HLOOKUP(Sheet1!R2C1,Sheet1!R2C1:R16C1,MOD(RC1+3,3)+MOD(INT((RC1+3)/3),3)*5+3,FALSE) -> 103|104|132|133|134 | J206: =HLOOKUP(Sheet1!R2C1,Sheet1!R2C1:R16C1,MOD(RC1-1,3)+MOD(INT((RC1-1)/3),3)*5+3,FALSE)&"|"&HLOOKUP(Sheet1!R2C1,Sheet1!R2C1:R16C1,MOD(RC1,3)+MOD(INT((RC1)/3),3)*5+3,FALSE)&"|"&HLOOKUP(Sheet1!R2C1,Sheet1!R2C1:R16C1,MOD(RC1+1,3)+MOD(INT((RC1+1)/3),3)*5+3,FALSE)&"|"&HLOOKUP(Sheet1!R2C1,Sheet1!R2C1:R16C1,MOD(RC1+2,3)+MOD(INT((RC1+2)/3),3)*5+3,FALSE)&"|"&HLOOKUP(Sheet1!R2C1,Sheet1!R2C1:R16C1,MOD(RC1+3,3)+MOD(INT((RC1+3)/3),3)*5+3,FALSE) -> 103|104|132|133|134 | K206: =HLOOKUP(Sheet1!R2C1,Sheet1!R2C1:R16C1,MOD(RC1-1,3)+MOD(INT((RC1-1)/3),3)*5+3,FALSE)&"|"&HLOOKUP(Sheet1!R2C1,Sheet1!R2C1:R16C1,MOD(RC1,3)+MOD(INT((RC1)/3),3)*5+3,FALSE)&"|"&HLOOKUP(Sheet1!R2C1,Sheet1!R2C1:R16C1,MOD(RC1+1,3)+MOD(INT((RC1+1)/3),3)*5+3,FALSE)&"|"&HLOOKUP(Sheet1!R2C1,Sheet1!R2C1:R16C1,MOD(RC1+2,3)+MOD(INT((RC1+2)/3),3)*5+3,FALSE)&"|"&HLOOKUP(Sheet1!R2C1,Sheet1!R2C1:R16C1,MOD(RC1+3,3)+MOD(INT((RC1+3)/3),3)*5+3,FALSE) -> 103|104|132|133|134 | L206: 25|22|23|24 | M206: 1001294|1001294|1001293|1001293 | N206: 10030|10031|10032|10033|10030|10031|10032|10033|10030|10031|10032|10033|10030|10031|10032|10033|10030|10031|10032|10033|10030|10031|10032|10033|10030|10031|10032|10033|10030|10031|10032|10033|10030|10031|10032|10033|10030|10031|10032|10033 | O206: 1|1|1|1|1|1|1|1|1|1|1|1|1|1|1|1|1|1|1|1|1|1|1|1|1|1|1|1|1|1|1|1|1|1|1|1|1|1|1|1 | P206: 2500|2500|2500|2500|2500|2500|2500|2500|2500|2500|2500|2500|2500|2500|2500|2500|2500|2500|2500|2500|2500|2500|2500|2500|2500|2500|2500|2500|2500|2500|2500|2500|2500|2500|2500|2500|2500|2500|2500|2500
A207: 201 | B207: 199 | C207: 30 | D207: =R[-20]C+2 -> 40 | E207: 1000 | F207: =MOD(RC[-5]-1,3)*30+100&"|"&MOD(RC[-5]-1,3)*30+101&"|"&MOD(RC[-5]-1,3)*30+102&"|"&MOD(RC[-5]-1,3)*30+103&"|"&IF(MOD(RC[-5],4)=0,HLOOKUP(Sheet1!R2C10,Sheet1!R2C10:R7C10,MOD(RC[-5]/4-1,6)+1,FALSE),IF(MOD(RC[-5],2)=0,IF(RC[-5]>20,HLOOKUP(Sheet1!R2C7,Sheet1!R2C7:R43C7,MOD(RC[-5]/2-1,42)+1,FALSE),HLOOKUP(Sheet1!R2C4,Sheet1!R2C4:R7C4,MOD(RC[-5]-1,6)+1,FALSE)),MOD(RC[-5]-1,3)*30+104)) -> 160|161|162|163|164 | G207: =HLOOKUP(Sheet1!R2C1,Sheet1!R2C1:R16C1,MOD(RC1-1,2)+MOD(INT((RC1-1)/2),3)*5+1,FALSE)&"|"&HLOOKUP(Sheet1!R2C1,Sheet1!R2C1:R16C1,MOD(RC1,2)+MOD(INT((RC1)/2),3)*5+1,FALSE)&"|"&HLOOKUP(Sheet1!R2C1,Sheet1!R2C1:R16C1,MOD(RC1+1,2)+MOD(INT((RC1+1)/2),3)*5+1,FALSE)&"|"&HLOOKUP(Sheet1!R2C1,Sheet1!R2C1:R16C1,MOD(RC1+2,2)+MOD(INT((RC1+2)/2),3)*5+1,FALSE)&"|"&HLOOKUP(Sheet1!R2C1,Sheet1!R2C1:R16C1,MOD(RC1+3,2)+MOD(INT((RC1+3)/2),3)*5+1,FALSE) -> 130|131|160|161|100 | H207: =HLOOKUP(Sheet1!R2C1,Sheet1!R2C1:R16C1,MOD(RC1+2,2)+MOD(INT((RC1+2)/2),3)*5+1,FALSE)&"|"&HLOOKUP(Sheet1!R2C1,Sheet1!R2C1:R16C1,MOD(RC1+3,2)+MOD(INT((RC1+3)/2),3)*5+1,FALSE)&"|"&HLOOKUP(Sheet1!R2C1,Sheet1!R2C1:R16C1,MOD(RC1+4,2)+MOD(INT((RC1+4)/2),3)*5+1,FALSE)&"|"&HLOOKUP(Sheet1!R2C1,Sheet1!R2C1:R16C1,MOD(RC1+5,2)+MOD(INT((RC1+5)/2),3)*5+1,FALSE)&"|"&HLOOKUP(Sheet1!R2C1,Sheet1!R2C1:R16C1,MOD(RC1+6,2)+MOD(INT((RC1+6)/2),3)*5+1,FALSE) -> 161|100|101|130|131 | I207: =HLOOKUP(Sheet1!R2C1,Sheet1!R2C1:R16C1,MOD(RC1-1,3)+MOD(INT((RC1-1)/3),3)*5+3,FALSE)&"|"&HLOOKUP(Sheet1!R2C1,Sheet1!R2C1:R16C1,MOD(RC1,3)+MOD(INT((RC1)/3),3)*5+3,FALSE)&"|"&HLOOKUP(Sheet1!R2C1,Sheet1!R2C1:R16C1,MOD(RC1+1,3)+MOD(INT((RC1+1)/3),3)*5+3,FALSE)&"|"&HLOOKUP(Sheet1!R2C1,Sheet1!R2C1:R16C1,MOD(RC1+2,3)+MOD(INT((RC1+2)/3),3)*5+3,FALSE)&"|"&HLOOKUP(Sheet1!R2C1,Sheet1!R2C1:R16C1,MOD(RC1+3,3)+MOD(INT((RC1+3)/3),3)*5+3,FALSE) -> 104|132|133|134|162 | J207: =HLOOKUP(Sheet1!R2C1,Sheet1!R2C1:R16C1,MOD(RC1-1,3)+MOD(INT((RC1-1)/3),3)*5+3,FALSE)&"|"&HLOOKUP(Sheet1!R2C1,Sheet1!R2C1:R16C1,MOD(RC1,3)+MOD(INT((RC1)/3),3)*5+3,FALSE)&"|"&HLOOKUP(Sheet1!R2C1,Sheet1!R2C1:R16C1,MOD(RC1+1,3)+MOD(INT((RC1+1)/3),3)*5+3,FALSE)&"|"&HLOOKUP(Sheet1!R2C1,Sheet1!R2C1:R16C1,MOD(RC1+2,3)+MOD(INT((RC1+2)/3),3)*5+3,FALSE)&"|"&HLOOKUP(Sheet1!R2C1,Sheet1!R2C1:R16C1,MOD(RC1+3,3)+MOD(INT((RC1+3)/3),3)*5+3,FALSE) -> 104|132|133|134|162 | K207: =HLOOKUP(Sheet1!R2C1,Sheet1!R2C1:R16C1,MOD(RC1-1,3)+MOD(INT((RC1-1)/3),3)*5+3,FALSE)&"|"&HLOOKUP(Sheet1!R2C1,Sheet1!R2C1:R16C1,MOD(RC1,3)+MOD(INT((RC1)/3),3)*5+3,FALSE)&"|"&HLOOKUP(Sheet1!R2C1,Sheet1!R2C1:R16C1,MOD(RC1+1,3)+MOD(INT((RC1+1)/3),3)*5+3,FALSE)&"|"&HLOOKUP(Sheet1!R2C1,Sheet1!R2C1:R16C1,MOD(RC1+2,3)+MOD(INT((RC1+2)/3),3)*5+3,FALSE)&"|"&HLOOKUP(Sheet1!R2C1,Sheet1!R2C1:R16C1,MOD(RC1+3,3)+MOD(INT((RC1+3)/3),3)*5+3,FALSE) -> 104|132|133|134|162 | L207: 25|22|23|24 | M207: 1012251|1012251|1012250|1012250 | N207: 10030|10031|10032|10033 | O207: 1|1|1|1 | P207: 2500|2500|2500|2500
A208: 202 | B208: 200 | C208: 30 | D208: =R[-20]C+2 -> 40 | E208: 1000 | F208: =MOD(RC[-5]-1,3)*30+100&"|"&MOD(RC[-5]-1,3)*30+101&"|"&MOD(RC[-5]-1,3)*30+102&"|"&MOD(RC[-5]-1,3)*30+103&"|"&IF(MOD(RC[-5],4)=0,HLOOKUP(Sheet1!R2C10,Sheet1!R2C10:R7C10,MOD(RC[-5]/4-1,6)+1,FALSE),IF(MOD(RC[-5],2)=0,IF(RC[-5]>20,HLOOKUP(Sheet1!R2C7,Sheet1!R2C7:R43C7,MOD(RC[-5]/2-1,42)+1,FALSE),HLOOKUP(Sheet1!R2C4,Sheet1!R2C4:R7C4,MOD(RC[-5]-1,6)+1,FALSE)),MOD(RC[-5]-1,3)*30+104)) -> 100|101|102|103|144 | G208: =HLOOKUP(Sheet1!R2C1,Sheet1!R2C1:R16C1,MOD(RC1-1,2)+MOD(INT((RC1-1)/2),3)*5+1,FALSE)&"|"&HLOOKUP(Sheet1!R2C1,Sheet1!R2C1:R16C1,MOD(RC1,2)+MOD(INT((RC1)/2),3)*5+1,FALSE)&"|"&HLOOKUP(Sheet1!R2C1,Sheet1!R2C1:R16C1,MOD(RC1+1,2)+MOD(INT((RC1+1)/2),3)*5+1,FALSE)&"|"&HLOOKUP(Sheet1!R2C1,Sheet1!R2C1:R16C1,MOD(RC1+2,2)+MOD(INT((RC1+2)/2),3)*5+1,FALSE)&"|"&HLOOKUP(Sheet1!R2C1,Sheet1!R2C1:R16C1,MOD(RC1+3,2)+MOD(INT((RC1+3)/2),3)*5+1,FALSE) -> 131|160|161|100|101 | H208: =HLOOKUP(Sheet1!R2C1,Sheet1!R2C1:R16C1,MOD(RC1+2,2)+MOD(INT((RC1+2)/2),3)*5+1,FALSE)&"|"&HLOOKUP(Sheet1!R2C1,Sheet1!R2C1:R16C1,MOD(RC1+3,2)+MOD(INT((RC1+3)/2),3)*5+1,FALSE)&"|"&HLOOKUP(Sheet1!R2C1,Sheet1!R2C1:R16C1,MOD(RC1+4,2)+MOD(INT((RC1+4)/2),3)*5+1,FALSE)&"|"&HLOOKUP(Sheet1!R2C1,Sheet1!R2C1:R16C1,MOD(RC1+5,2)+MOD(INT((RC1+5)/2),3)*5+1,FALSE)&"|"&HLOOKUP(Sheet1!R2C1,Sheet1!R2C1:R16C1,MOD(RC1+6,2)+MOD(INT((RC1+6)/2),3)*5+1,FALSE) -> 100|101|130|131|160 | I208: =HLOOKUP(Sheet1!R2C1,Sheet1!R2C1:R16C1,MOD(RC1-1,3)+MOD(INT((RC1-1)/3),3)*5+3,FALSE)&"|"&HLOOKUP(Sheet1!R2C1,Sheet1!R2C1:R16C1,MOD(RC1,3)+MOD(INT((RC1)/3),3)*5+3,FALSE)&"|"&HLOOKUP(Sheet1!R2C1,Sheet1!R2C1:R16C1,MOD(RC1+1,3)+MOD(INT((RC1+1)/3),3)*5+3,FALSE)&"|"&HLOOKUP(Sheet1!R2C1,Sheet1!R2C1:R16C1,MOD(RC1+2,3)+MOD(INT((RC1+2)/3),3)*5+3,FALSE)&"|"&HLOOKUP(Sheet1!R2C1,Sheet1!R2C1:R16C1,MOD(RC1+3,3)+MOD(INT((RC1+3)/3),3)*5+3,FALSE) -> 132|133|134|162|163 | J208: =HLOOKUP(Sheet1!R2C1,Sheet1!R2C1:R16C1,MOD(RC1-1,3)+MOD(INT((RC1-1)/3),3)*5+3,FALSE)&"|"&HLOOKUP(Sheet1!R2C1,Sheet1!R2C1:R16C1,MOD(RC1,3)+MOD(INT((RC1)/3),3)*5+3,FALSE)&"|"&HLOOKUP(Sheet1!R2C1,Sheet1!R2C1:R16C1,MOD(RC1+1,3)+MOD(INT((RC1+1)/3),3)*5+3,FALSE)&"|"&HLOOKUP(Sheet1!R2C1,Sheet1!R2C1:R16C1,MOD(RC1+2,3)+MOD(INT((RC1+2)/3),3)*5+3,FALSE)&"|"&HLOOKUP(Sheet1!R2C1,Sheet1!R2C1:R16C1,MOD(RC1+3,3)+MOD(INT((RC1+3)/3),3)*5+3,FALSE) -> 132|133|134|162|163 | K208: =HLOOKUP(Sheet1!R2C1,Sheet1!R2C1:R16C1,MOD(RC1-1,3)+MOD(INT((RC1-1)/3),3)*5+3,FALSE)&"|"&HLOOKUP(Sheet1!R2C1,Sheet1!R2C1:R16C1,MOD(RC1,3)+MOD(INT((RC1)/3),3)*5+3,FALSE)&"|"&HLOOKUP(Sheet1!R2C1,Sheet1!R2C1:R16C1,MOD(RC1+1,3)+MOD(INT((RC1+1)/3),3)*5+3,FALSE)&"|"&HLOOKUP(Sheet1!R2C1,Sheet1!R2C1:R16C1,MOD(RC1+2,3)+MOD(INT((RC1+2)/3),3)*5+3,FALSE)&"|"&HLOOKUP(Sheet1!R2C1,Sheet1!R2C1:R16C1,MOD(RC1+3,3)+MOD(INT((RC1+3)/3),3)*5+3,FALSE) -> 132|133|134|162|163 | L208: 25|22|23|24 | M208: 1023209|1023209|1023208|1023208 | N208: 10030|10031|10032|10033 | O208: 1|1|1|1 | P208: 2500|2500|2500|2500
A209: 203 | B209: 201 | C209: 30 | D209: =R[-20]C+2 -> 40 | E209: 1000 | F209: =MOD(RC[-5]-1,3)*30+100&"|"&MOD(RC[-5]-1,3)*30+101&"|"&MOD(RC[-5]-1,3)*30+102&"|"&MOD(RC[-5]-1,3)*30+103&"|"&IF(MOD(RC[-5],4)=0,HLOOKUP(Sheet1!R2C10,Sheet1!R2C10:R7C10,MOD(RC[-5]/4-1,6)+1,FALSE),IF(MOD(RC[-5],2)=0,IF(RC[-5]>20,HLOOKUP(Sheet1!R2C7,Sheet1!R2C7:R43C7,MOD(RC[-5]/2-1,42)+1,FALSE),HLOOKUP(Sheet1!R2C4,Sheet1!R2C4:R7C4,MOD(RC[-5]-1,6)+1,FALSE)),MOD(RC[-5]-1,3)*30+104)) -> 130|131|132|133|134 | G209: =HLOOKUP(Sheet1!R2C1,Sheet1!R2C1:R16C1,MOD(RC1-1,2)+MOD(INT((RC1-1)/2),3)*5+1,FALSE)&"|"&HLOOKUP(Sheet1!R2C1,Sheet1!R2C1:R16C1,MOD(RC1,2)+MOD(INT((RC1)/2),3)*5+1,FALSE)&"|"&HLOOKUP(Sheet1!R2C1,Sheet1!R2C1:R16C1,MOD(RC1+1,2)+MOD(INT((RC1+1)/2),3)*5+1,FALSE)&"|"&HLOOKUP(Sheet1!R2C1,Sheet1!R2C1:R16C1,MOD(RC1+2,2)+MOD(INT((RC1+2)/2),3)*5+1,FALSE)&"|"&HLOOKUP(Sheet1!R2C1,Sheet1!R2C1:R16C1,MOD(RC1+3,2)+MOD(INT((RC1+3)/2),3)*5+1,FALSE) -> 160|161|100|101|130 | H209: =HLOOKUP(Sheet1!R2C1,Sheet1!R2C1:R16C1,MOD(RC1+2,2)+MOD(INT((RC1+2)/2),3)*5+1,FALSE)&"|"&HLOOKUP(Sheet1!R2C1,Sheet1!R2C1:R16C1,MOD(RC1+3,2)+MOD(INT((RC1+3)/2),3)*5+1,FALSE)&"|"&HLOOKUP(Sheet1!R2C1,Sheet1!R2C1:R16C1,MOD(RC1+4,2)+MOD(INT((RC1+4)/2),3)*5+1,FALSE)&"|"&HLOOKUP(Sheet1!R2C1,Sheet1!R2C1:R16C1,MOD(RC1+5,2)+MOD(INT((RC1+5)/2),3)*5+1,FALSE)&"|"&HLOOKUP(Sheet1!R2C1,Sheet1!R2C1:R16C1,MOD(RC1+6,2)+MOD(INT((RC1+6)/2),3)*5+1,FALSE) -> 101|130|131|160|161 | I209: =HLOOKUP(Sheet1!R2C1,Sheet1!R2C1:R16C1,MOD(RC1-1,3)+MOD(INT((RC1-1)/3),3)*5+3,FALSE)&"|"&HLOOKUP(Sheet1!R2C1,Sheet1!R2C1:R16C1,MOD(RC1,3)+MOD(INT((RC1)/3),3)*5+3,FALSE)&"|"&HLOOKUP(Sheet1!R2C1,Sheet1!R2C1:R16C1,MOD(RC1+1,3)+MOD(INT((RC1+1)/3),3)*5+3,FALSE)&"|"&HLOOKUP(Sheet1!R2C1,Sheet1!R2C1:R16C1,MOD(RC1+2,3)+MOD(INT((RC1+2)/3),3)*5+3,FALSE)&"|"&HLOOKUP(Sheet1!R2C1,Sheet1!R2C1:R16C1,MOD(RC1+3,3)+MOD(INT((RC1+3)/3),3)*5+3,FALSE) -> 133|134|162|163|164 | J209: =HLOOKUP(Sheet1!R2C1,Sheet1!R2C1:R16C1,MOD(RC1-1,3)+MOD(INT((RC1-1)/3),3)*5+3,FALSE)&"|"&HLOOKUP(Sheet1!R2C1,Sheet1!R2C1:R16C1,MOD(RC1,3)+MOD(INT((RC1)/3),3)*5+3,FALSE)&"|"&HLOOKUP(Sheet1!R2C1,Sheet1!R2C1:R16C1,MOD(RC1+1,3)+MOD(INT((RC1+1)/3),3)*5+3,FALSE)&"|"&HLOOKUP(Sheet1!R2C1,Sheet1!R2C1:R16C1,MOD(RC1+2,3)+MOD(INT((RC1+2)/3),3)*5+3,FALSE)&"|"&HLOOKUP(Sheet1!R2C1,Sheet1!R2C1:R16C1,MOD(RC1+3,3)+MOD(INT((RC1+3)/3),3)*5+3,FALSE) -> 133|134|162|163|164 | K209: =HLOOKUP(Sheet1!R2C1,Sheet1!R2C1:R16C1,MOD(RC1-1,3)+MOD(INT((RC1-1)/3),3)*5+3,FALSE)&"|"&HLOOKUP(Sheet1!R2C1,Sheet1!R2C1:R16C1,MOD(RC1,3)+MOD(INT((RC1)/3),3)*5+3,FALSE)&"|"&HLOOKUP(Sheet1!R2C1,Sheet1!R2C1:R16C1,MOD(RC1+1,3)+MOD(INT((RC1+1)/3),3)*5+3,FALSE)&"|"&HLOOKUP(Sheet1!R2C1,Sheet1!R2C1:R16C1,MOD(RC1+2,3)+MOD(INT((RC1+2)/3),3)*5+3,FALSE)&"|"&HLOOKUP(Sheet1!R2C1,Sheet1!R2C1:R16C1,MOD(RC1+3,3)+MOD(INT((RC1+3)/3),3)*5+3,FALSE) -> 133|134|162|163|164 | L209: 25|22|23|24 | M209: 1035239|1035239|1035240|1035240 | N209: 10030|10031|10032|10033 | O209: 1|1|1|1 | P209: 2500|2500|2500|2500
A210: 204 | B210: 202 | C210: 30 | D210: =R[-20]C+2 -> 40 | E210: 1000 | F210: =MOD(RC[-5]-1,3)*30+100&"|"&MOD(RC[-5]-1,3)*30+101&"|"&MOD(RC[-5]-1,3)*30+102&"|"&MOD(RC[-5]-1,3)*30+103&"|"&IF(MOD(RC[-5],4)=0,HLOOKUP(Sheet1!R2C10,Sheet1!R2C10:R7C10,MOD(RC[-5]/4-1,6)+1,FALSE),IF(MOD(RC[-5],2)=0,IF(RC[-5]>20,HLOOKUP(Sheet1!R2C7,Sheet1!R2C7:R43C7,MOD(RC[-5]/2-1,42)+1,FALSE),HLOOKUP(Sheet1!R2C4,Sheet1!R2C4:R7C4,MOD(RC[-5]-1,6)+1,FALSE)),MOD(RC[-5]-1,3)*30+104)) -> 160|161|162|163|192 | G210: =HLOOKUP(Sheet1!R2C1,Sheet1!R2C1:R16C1,MOD(RC1-1,2)+MOD(INT((RC1-1)/2),3)*5+1,FALSE)&"|"&HLOOKUP(Sheet1!R2C1,Sheet1!R2C1:R16C1,MOD(RC1,2)+MOD(INT((RC1)/2),3)*5+1,FALSE)&"|"&HLOOKUP(Sheet1!R2C1,Sheet1!R2C1:R16C1,MOD(RC1+1,2)+MOD(INT((RC1+1)/2),3)*5+1,FALSE)&"|"&HLOOKUP(Sheet1!R2C1,Sheet1!R2C1:R16C1,MOD(RC1+2,2)+MOD(INT((RC1+2)/2),3)*5+1,FALSE)&"|"&HLOOKUP(Sheet1!R2C1,Sheet1!R2C1:R16C1,MOD(RC1+3,2)+MOD(INT((RC1+3)/2),3)*5+1,FALSE) -> 161|100|101|130|131 | H210: =HLOOKUP(Sheet1!R2C1,Sheet1!R2C1:R16C1,MOD(RC1+2,2)+MOD(INT((RC1+2)/2),3)*5+1,FALSE)&"|"&HLOOKUP(Sheet1!R2C1,Sheet1!R2C1:R16C1,MOD(RC1+3,2)+MOD(INT((RC1+3)/2),3)*5+1,FALSE)&"|"&HLOOKUP(Sheet1!R2C1,Sheet1!R2C1:R16C1,MOD(RC1+4,2)+MOD(INT((RC1+4)/2),3)*5+1,FALSE)&"|"&HLOOKUP(Sheet1!R2C1,Sheet1!R2C1:R16C1,MOD(RC1+5,2)+MOD(INT((RC1+5)/2),3)*5+1,FALSE)&"|"&HLOOKUP(Sheet1!R2C1,Sheet1!R2C1:R16C1,MOD(RC1+6,2)+MOD(INT((RC1+6)/2),3)*5+1,FALSE) -> 130|131|160|161|100 | I210: =HLOOKUP(Sheet1!R2C1,Sheet1!R2C1:R16C1,MOD(RC1-1,3)+MOD(INT((RC1-1)/3),3)*5+3,FALSE)&"|"&HLOOKUP(Sheet1!R2C1,Sheet1!R2C1:R16C1,MOD(RC1,3)+MOD(INT((RC1)/3),3)*5+3,FALSE)&"|"&HLOOKUP(Sheet1!R2C1,Sheet1!R2C1:R16C1,MOD(RC1+1,3)+MOD(INT((RC1+1)/3),3)*5+3,FALSE)&"|"&HLOOKUP(Sheet1!R2C1,Sheet1!R2C1:R16C1,MOD(RC1+2,3)+MOD(INT((RC1+2)/3),3)*5+3,FALSE)&"|"&HLOOKUP(Sheet1!R2C1,Sheet1!R2C1:R16C1,MOD(RC1+3,3)+MOD(INT((RC1+3)/3),3)*5+3,FALSE) -> 134|162|163|164|102 | J210: =HLOOKUP(Sheet1!R2C1,Sheet1!R2C1:R16C1,MOD(RC1-1,3)+MOD(INT((RC1-1)/3),3)*5+3,FALSE)&"|"&HLOOKUP(Sheet1!R2C1,Sheet1!R2C1:R16C1,MOD(RC1,3)+MOD(INT((RC1)/3),3)*5+3,FALSE)&"|"&HLOOKUP(Sheet1!R2C1,Sheet1!R2C1:R16C1,MOD(RC1+1,3)+MOD(INT((RC1+1)/3),3)*5+3,FALSE)&"|"&HLOOKUP(Sheet1!R2C1,Sheet1!R2C1:R16C1,MOD(RC1+2,3)+MOD(INT((RC1+2)/3),3)*5+3,FALSE)&"|"&HLOOKUP(Sheet1!R2C1,Sheet1!R2C1:R16C1,MOD(RC1+3,3)+MOD(INT((RC1+3)/3),3)*5+3,FALSE) -> 134|162|163|164|102 | K210: =HLOOKUP(Sheet1!R2C1,Sheet1!R2C1:R16C1,MOD(RC1-1,3)+MOD(INT((RC1-1)/3),3)*5+3,FALSE)&"|"&HLOOKUP(Sheet1!R2C1,Sheet1!R2C1:R16C1,MOD(RC1,3)+MOD(INT((RC1)/3),3)*5+3,FALSE)&"|"&HLOOKUP(Sheet1!R2C1,Sheet1!R2C1:R16C1,MOD(RC1+1,3)+MOD(INT((RC1+1)/3),3)*5+3,FALSE)&"|"&HLOOKUP(Sheet1!R2C1,Sheet1!R2C1:R16C1,MOD(RC1+2,3)+MOD(INT((RC1+2)/3),3)*5+3,FALSE)&"|"&HLOOKUP(Sheet1!R2C1,Sheet1!R2C1:R16C1,MOD(RC1+3,3)+MOD(INT((RC1+3)/3),3)*5+3,FALSE) -> 134|162|163|164|102 | L210: 25|22|23|24 | M210: 1047737|1047738|1047738|1047738 | N210: 10030|10031|10032|10033 | O210: 1|1|1|1 | P210: 2500|2500|2500|2500
A211: 205 | B211: 203 | C211: 30 | D211: =R[-20]C+2 -> 40 | E211: 1000 | F211: =MOD(RC[-5]-1,3)*30+100&"|"&MOD(RC[-5]-1,3)*30+101&"|"&MOD(RC[-5]-1,3)*30+102&"|"&MOD(RC[-5]-1,3)*30+103&"|"&IF(MOD(RC[-5],4)=0,HLOOKUP(Sheet1!R2C10,Sheet1!R2C10:R7C10,MOD(RC[-5]/4-1,6)+1,FALSE),IF(MOD(RC[-5],2)=0,IF(RC[-5]>20,HLOOKUP(Sheet1!R2C7,Sheet1!R2C7:R43C7,MOD(RC[-5]/2-1,42)+1,FALSE),HLOOKUP(Sheet1!R2C4,Sheet1!R2C4:R7C4,MOD(RC[-5]-1,6)+1,FALSE)),MOD(RC[-5]-1,3)*30+104)) -> 100|101|102|103|104 | G211: =HLOOKUP(Sheet1!R2C1,Sheet1!R2C1:R16C1,MOD(RC1-1,2)+MOD(INT((RC1-1)/2),3)*5+1,FALSE)&"|"&HLOOKUP(Sheet1!R2C1,Sheet1!R2C1:R16C1,MOD(RC1,2)+MOD(INT((RC1)/2),3)*5+1,FALSE)&"|"&HLOOKUP(Sheet1!R2C1,Sheet1!R2C1:R16C1,MOD(RC1+1,2)+MOD(INT((RC1+1)/2),3)*5+1,FALSE)&"|"&HLOOKUP(Sheet1!R2C1,Sheet1!R2C1:R16C1,MOD(RC1+2,2)+MOD(INT((RC1+2)/2),3)*5+1,FALSE)&"|"&HLOOKUP(Sheet1!R2C1,Sheet1!R2C1:R16C1,MOD(RC1+3,2)+MOD(INT((RC1+3)/2),3)*5+1,FALSE) -> 100|101|130|131|160 | H211: =HLOOKUP(Sheet1!R2C1,Sheet1!R2C1:R16C1,MOD(RC1+2,2)+MOD(INT((RC1+2)/2),3)*5+1,FALSE)&"|"&HLOOKUP(Sheet1!R2C1,Sheet1!R2C1:R16C1,MOD(RC1+3,2)+MOD(INT((RC1+3)/2),3)*5+1,FALSE)&"|"&HLOOKUP(Sheet1!R2C1,Sheet1!R2C1:R16C1,MOD(RC1+4,2)+MOD(INT((RC1+4)/2),3)*5+1,FALSE)&"|"&HLOOKUP(Sheet1!R2C1,Sheet1!R2C1:R16C1,MOD(RC1+5,2)+MOD(INT((RC1+5)/2),3)*5+1,FALSE)&"|"&HLOOKUP(Sheet1!R2C1,Sheet1!R2C1:R16C1,MOD(RC1+6,2)+MOD(INT((RC1+6)/2),3)*5+1,FALSE) -> 131|160|161|100|101 | I211: =HLOOKUP(Sheet1!R2C1,Sheet1!R2C1:R16C1,MOD(RC1-1,3)+MOD(INT((RC1-1)/3),3)*5+3,FALSE)&"|"&HLOOKUP(Sheet1!R2C1,Sheet1!R2C1:R16C1,MOD(RC1,3)+MOD(INT((RC1)/3),3)*5+3,FALSE)&"|"&HLOOKUP(Sheet1!R2C1,Sheet1!R2C1:R16C1,MOD(RC1+1,3)+MOD(INT((RC1+1)/3),3)*5+3,FALSE)&"|"&HLOOKUP(Sheet1!R2C1,Sheet1!R2C1:R16C1,MOD(RC1+2,3)+MOD(INT((RC1+2)/3),3)*5+3,FALSE)&"|"&HLOOKUP(Sheet1!R2C1,Sheet1!R2C1:R16C1,MOD(RC1+3,3)+MOD(INT((RC1+3)/3),3)*5+3,FALSE) -> 162|163|164|102|103 | J211: =HLOOKUP(Sheet1!R2C1,Sheet1!R2C1:R16C1,MOD(RC1-1,3)+MOD(INT((RC1-1)/3),3)*5+3,FALSE)&"|"&HLOOKUP(Sheet1!R2C1,Sheet1!R2C1:R16C1,MOD(RC1,3)+MOD(INT((RC1)/3),3)*5+3,FALSE)&"|"&HLOOKUP(Sheet1!R2C1,Sheet1!R2C1:R16C1,MOD(RC1+1,3)+MOD(INT((RC1+1)/3),3)*5+3,FALSE)&"|"&HLOOKUP(Sheet1!R2C1,Sheet1!R2C1:R16C1,MOD(RC1+2,3)+MOD(INT((RC1+2)/3),3)*5+3,FALSE)&"|"&HLOOKUP(Sheet1!R2C1,Sheet1!R2C1:R16C1,MOD(RC1+3,3)+MOD(INT((RC1+3)/3),3)*5+3,FALSE) -> 162|163|164|102|103 | K211: =HLOOKUP(Sheet1!R2C1,Sheet1!R2C1:R16C1,MOD(RC1-1,3)+MOD(INT((RC1-1)/3),3)*5+3,FALSE)&"|"&HLOOKUP(Sheet1!R2C1,Sheet1!R2C1:R16C1,MOD(RC1,3)+MOD(INT((RC1)/3),3)*5+3,FALSE)&"|"&HLOOKUP(Sheet1!R2C1,Sheet1!R2C1:R16C1,MOD(RC1+1,3)+MOD(INT((RC1+1)/3),3)*5+3,FALSE)&"|"&HLOOKUP(Sheet1!R2C1,Sheet1!R2C1:R16C1,MOD(RC1+2,3)+MOD(INT((RC1+2)/3),3)*5+3,FALSE)&"|"&HLOOKUP(Sheet1!R2C1,Sheet1!R2C1:R16C1,MOD(RC1+3,3)+MOD(INT((RC1+3)/3),3)*5+3,FALSE) -> 162|163|164|102|103 | L211: 25|22|23|24 | M211: 1060698|1060698|1060698|1060698 | N211: 10030|10031|10032|10033|10030|10031|10032|10033|10030|10031|10032|10033|10030|10031|10032|10033|10030|10031|10032|10033|10030|10031|10032|10033|10030|10031|10032|10033|10030|10031|10032|10033|10030|10031|10032|10033|10030|10031|10032|10033 | O211: 1|1|1|1|1|1|1|1|1|1|1|1|1|1|1|1|1|1|1|1|1|1|1|1|1|1|1|1|1|1|1|1|1|1|1|1|1|1|1|1 | P211: 2500|2500|2500|2500|2500|2500|2500|2500|2500|2500|2500|2500|2500|2500|2500|2500|2500|2500|2500|2500|2500|2500|2500|2500|2500|2500|2500|2500|2500|2500|2500|2500|2500|2500|2500|2500|2500|2500|2500|2500
A212: 206 | B212: 204 | C212: 30 | D212: =R[-20]C+2 -> 40 | E212: 1000 | F212: =MOD(RC[-5]-1,3)*30+100&"|"&MOD(RC[-5]-1,3)*30+101&"|"&MOD(RC[-5]-1,3)*30+102&"|"&MOD(RC[-5]-1,3)*30+103&"|"&IF(MOD(RC[-5],4)=0,HLOOKUP(Sheet1!R2C10,Sheet1!R2C10:R7C10,MOD(RC[-5]/4-1,6)+1,FALSE),IF(MOD(RC[-5],2)=0,IF(RC[-5]>20,HLOOKUP(Sheet1!R2C7,Sheet1!R2C7:R43C7,MOD(RC[-5]/2-1,42)+1,FALSE),HLOOKUP(Sheet1!R2C4,Sheet1!R2C4:R7C4,MOD(RC[-5]-1,6)+1,FALSE)),MOD(RC[-5]-1,3)*30+104)) -> 130|131|132|133|146 | G212: =HLOOKUP(Sheet1!R2C1,Sheet1!R2C1:R16C1,MOD(RC1-1,2)+MOD(INT((RC1-1)/2),3)*5+1,FALSE)&"|"&HLOOKUP(Sheet1!R2C1,Sheet1!R2C1:R16C1,MOD(RC1,2)+MOD(INT((RC1)/2),3)*5+1,FALSE)&"|"&HLOOKUP(Sheet1!R2C1,Sheet1!R2C1:R16C1,MOD(RC1+1,2)+MOD(INT((RC1+1)/2),3)*5+1,FALSE)&"|"&HLOOKUP(Sheet1!R2C1,Sheet1!R2C1:R16C1,MOD(RC1+2,2)+MOD(INT((RC1+2)/2),3)*5+1,FALSE)&"|"&HLOOKUP(Sheet1!R2C1,Sheet1!R2C1:R16C1,MOD(RC1+3,2)+MOD(INT((RC1+3)/2),3)*5+1,FALSE) -> 101|130|131|160|161 | H212: =HLOOKUP(Sheet1!R2C1,Sheet1!R2C1:R16C1,MOD(RC1+2,2)+MOD(INT((RC1+2)/2),3)*5+1,FALSE)&"|"&HLOOKUP(Sheet1!R2C1,Sheet1!R2C1:R16C1,MOD(RC1+3,2)+MOD(INT((RC1+3)/2),3)*5+1,FALSE)&"|"&HLOOKUP(Sheet1!R2C1,Sheet1!R2C1:R16C1,MOD(RC1+4,2)+MOD(INT((RC1+4)/2),3)*5+1,FALSE)&"|"&HLOOKUP(Sheet1!R2C1,Sheet1!R2C1:R16C1,MOD(RC1+5,2)+MOD(INT((RC1+5)/2),3)*5+1,FALSE)&"|"&HLOOKUP(Sheet1!R2C1,Sheet1!R2C1:R16C1,MOD(RC1+6,2)+MOD(INT((RC1+6)/2),3)*5+1,FALSE) -> 160|161|100|101|130 | I212: =HLOOKUP(Sheet1!R2C1,Sheet1!R2C1:R16C1,MOD(RC1-1,3)+MOD(INT((RC1-1)/3),3)*5+3,FALSE)&"|"&HLOOKUP(Sheet1!R2C1,Sheet1!R2C1:R16C1,MOD(RC1,3)+MOD(INT((RC1)/3),3)*5+3,FALSE)&"|"&HLOOKUP(Sheet1!R2C1,Sheet1!R2C1:R16C1,MOD(RC1+1,3)+MOD(INT((RC1+1)/3),3)*5+3,FALSE)&"|"&HLOOKUP(Sheet1!R2C1,Sheet1!R2C1:R16C1,MOD(RC1+2,3)+MOD(INT((RC1+2)/3),3)*5+3,FALSE)&"|"&HLOOKUP(Sheet1!R2C1,Sheet1!R2C1:R16C1,MOD(RC1+3,3)+MOD(INT((RC1+3)/3),3)*5+3,FALSE) -> 163|164|102|103|104 | J212: =HLOOKUP(Sheet1!R2C1,Sheet1!R2C1:R16C1,MOD(RC1-1,3)+MOD(INT((RC1-1)/3),3)*5+3,FALSE)&"|"&HLOOKUP(Sheet1!R2C1,Sheet1!R2C1:R16C1,MOD(RC1,3)+MOD(INT((RC1)/3),3)*5+3,FALSE)&"|"&HLOOKUP(Sheet1!R2C1,Sheet1!R2C1:R16C1,MOD(RC1+1,3)+MOD(INT((RC1+1)/3),3)*5+3,FALSE)&"|"&HLOOKUP(Sheet1!R2C1,Sheet1!R2C1:R16C1,MOD(RC1+2,3)+MOD(INT((RC1+2)/3),3)*5+3,FALSE)&"|"&HLOOKUP(Sheet1!R2C1,Sheet1!R2C1:R16C1,MOD(RC1+3,3)+MOD(INT((RC1+3)/3),3)*5+3,FALSE) -> 163|164|102|103|104 | K212: =HLOOKUP(Sheet1!R2C1,Sheet1!R2C1:R16C1,MOD(RC1-1,3)+MOD(INT((RC1-1)/3),3)*5+3,FALSE)&"|"&HLOOKUP(Sheet1!R2C1,Sheet1!R2C1:R16C1,MOD(RC1,3)+MOD(INT((RC1)/3),3)*5+3,FALSE)&"|"&HLOOKUP(Sheet1!R2C1,Sheet1!R2C1:R16C1,MOD(RC1+1,3)+MOD(INT((RC1+1)/3),3)*5+3,FALSE)&"|"&HLOOKUP(Sheet1!R2C1,Sheet1!R2C1:R16C1,MOD(RC1+2,3)+MOD(INT((RC1+2)/3),3)*5+3,FALSE)&"|"&HLOOKUP(Sheet1!R2C1,Sheet1!R2C1:R16C1,MOD(RC1+3,3)+MOD(INT((RC1+3)/3),3)*5+3,FALSE) -> 163|164|102|103|104 | L212: 25|22|23|24 | M212: 1073195|1073195|1073195|1073195 | N212: 10030|10031|10032|10033 | O212: 1|1|1|1 | P212: 2500|2500|2500|2500
A213: 207 | B213: 205 | C213: 30 | D213: =R[-20]C+2 -> 40 | E213: 1000 | F213: =MOD(RC[-5]-1,3)*30+100&"|"&MOD(RC[-5]-1,3)*30+101&"|"&MOD(RC[-5]-1,3)*30+102&"|"&MOD(RC[-5]-1,3)*30+103&"|"&IF(MOD(RC[-5],4)=0,HLOOKUP(Sheet1!R2C10,Sheet1!R2C10:R7C10,MOD(RC[-5]/4-1,6)+1,FALSE),IF(MOD(RC[-5],2)=0,IF(RC[-5]>20,HLOOKUP(Sheet1!R2C7,Sheet1!R2C7:R43C7,MOD(RC[-5]/2-1,42)+1,FALSE),HLOOKUP(Sheet1!R2C4,Sheet1!R2C4:R7C4,MOD(RC[-5]-1,6)+1,FALSE)),MOD(RC[-5]-1,3)*30+104)) -> 160|161|162|163|164 | G213: =HLOOKUP(Sheet1!R2C1,Sheet1!R2C1:R16C1,MOD(RC1-1,2)+MOD(INT((RC1-1)/2),3)*5+1,FALSE)&"|"&HLOOKUP(Sheet1!R2C1,Sheet1!R2C1:R16C1,MOD(RC1,2)+MOD(INT((RC1)/2),3)*5+1,FALSE)&"|"&HLOOKUP(Sheet1!R2C1,Sheet1!R2C1:R16C1,MOD(RC1+1,2)+MOD(INT((RC1+1)/2),3)*5+1,FALSE)&"|"&HLOOKUP(Sheet1!R2C1,Sheet1!R2C1:R16C1,MOD(RC1+2,2)+MOD(INT((RC1+2)/2),3)*5+1,FALSE)&"|"&HLOOKUP(Sheet1!R2C1,Sheet1!R2C1:R16C1,MOD(RC1+3,2)+MOD(INT((RC1+3)/2),3)*5+1,FALSE) -> 130|131|160|161|100 | H213: =HLOOKUP(Sheet1!R2C1,Sheet1!R2C1:R16C1,MOD(RC1+2,2)+MOD(INT((RC1+2)/2),3)*5+1,FALSE)&"|"&HLOOKUP(Sheet1!R2C1,Sheet1!R2C1:R16C1,MOD(RC1+3,2)+MOD(INT((RC1+3)/2),3)*5+1,FALSE)&"|"&HLOOKUP(Sheet1!R2C1,Sheet1!R2C1:R16C1,MOD(RC1+4,2)+MOD(INT((RC1+4)/2),3)*5+1,FALSE)&"|"&HLOOKUP(Sheet1!R2C1,Sheet1!R2C1:R16C1,MOD(RC1+5,2)+MOD(INT((RC1+5)/2),3)*5+1,FALSE)&"|"&HLOOKUP(Sheet1!R2C1,Sheet1!R2C1:R16C1,MOD(RC1+6,2)+MOD(INT((RC1+6)/2),3)*5+1,FALSE) -> 161|100|101|130|131 | I213: =HLOOKUP(Sheet1!R2C1,Sheet1!R2C1:R16C1,MOD(RC1-1,3)+MOD(INT((RC1-1)/3),3)*5+3,FALSE)&"|"&HLOOKUP(Sheet1!R2C1,Sheet1!R2C1:R16C1,MOD(RC1,3)+MOD(INT((RC1)/3),3)*5+3,FALSE)&"|"&HLOOKUP(Sheet1!R2C1,Sheet1!R2C1:R16C1,MOD(RC1+1,3)+MOD(INT((RC1+1)/3),3)*5+3,FALSE)&"|"&HLOOKUP(Sheet1!R2C1,Sheet1!R2C1:R16C1,MOD(RC1+2,3)+MOD(INT((RC1+2)/3),3)*5+3,FALSE)&"|"&HLOOKUP(Sheet1!R2C1,Sheet1!R2C1:R16C1,MOD(RC1+3,3)+MOD(INT((RC1+3)/3),3)*5+3,FALSE) -> 164|102|103|104|132 | J213: =HLOOKUP(Sheet1!R2C1,Sheet1!R2C1:R16C1,MOD(RC1-1,3)+MOD(INT((RC1-1)/3),3)*5+3,FALSE)&"|"&HLOOKUP(Sheet1!R2C1,Sheet1!R2C1:R16C1,MOD(RC1,3)+MOD(INT((RC1)/3),3)*5+3,FALSE)&"|"&HLOOKUP(Sheet1!R2C1,Sheet1!R2C1:R16C1,MOD(RC1+1,3)+MOD(INT((RC1+1)/3),3)*5+3,FALSE)&"|"&HLOOKUP(Sheet1!R2C1,Sheet1!R2C1:R16C1,MOD(RC1+2,3)+MOD(INT((RC1+2)/3),3)*5+3,FALSE)&"|"&HLOOKUP(Sheet1!R2C1,Sheet1!R2C1:R16C1,MOD(RC1+3,3)+MOD(INT((RC1+3)/3),3)*5+3,FALSE) -> 164|102|103|104|132 | K213: =HLOOKUP(Sheet1!R2C1,Sheet1!R2C1:R16C1,MOD(RC1-1,3)+MOD(INT((RC1-1)/3),3)*5+3,FALSE)&"|"&HLOOKUP(Sheet1!R2C1,Sheet1!R2C1:R16C1,MOD(RC1,3)+MOD(INT((RC1)/3),3)*5+3,FALSE)&"|"&HLOOKUP(Sheet1!R2C1,Sheet1!R2C1:R16C1,MOD(RC1+1,3)+MOD(INT((RC1+1)/3),3)*5+3,FALSE)&"|"&HLOOKUP(Sheet1!R2C1,Sheet1!R2C1:R16C1,MOD(RC1+2,3)+MOD(INT((RC1+2)/3),3)*5+3,FALSE)&"|"&HLOOKUP(Sheet1!R2C1,Sheet1!R2C1:R16C1,MOD(RC1+3,3)+MOD(INT((RC1+3)/3),3)*5+3,FALSE) -> 164|102|103|104|132 | L213: 25|22|23|24 | M213: 1084856|1084856|1084855|1084855 | N213: 10030|10031|10032|10033 | O213: 1|1|1|1 | P213: 2500|2500|2500|2500
A214: 208 | B214: 206 | C214: 30 | D214: =R[-20]C+2 -> 40 | E214: 1000 | F214: =MOD(RC[-5]-1,3)*30+100&"|"&MOD(RC[-5]-1,3)*30+101&"|"&MOD(RC[-5]-1,3)*30+102&"|"&MOD(RC[-5]-1,3)*30+103&"|"&IF(MOD(RC[-5],4)=0,HLOOKUP(Sheet1!R2C10,Sheet1!R2C10:R7C10,MOD(RC[-5]/4-1,6)+1,FALSE),IF(MOD(RC[-5],2)=0,IF(RC[-5]>20,HLOOKUP(Sheet1!R2C7,Sheet1!R2C7:R43C7,MOD(RC[-5]/2-1,42)+1,FALSE),HLOOKUP(Sheet1!R2C4,Sheet1!R2C4:R7C4,MOD(RC[-5]-1,6)+1,FALSE)),MOD(RC[-5]-1,3)*30+104)) -> 100|101|102|103|193 | G214: =HLOOKUP(Sheet1!R2C1,Sheet1!R2C1:R16C1,MOD(RC1-1,2)+MOD(INT((RC1-1)/2),3)*5+1,FALSE)&"|"&HLOOKUP(Sheet1!R2C1,Sheet1!R2C1:R16C1,MOD(RC1,2)+MOD(INT((RC1)/2),3)*5+1,FALSE)&"|"&HLOOKUP(Sheet1!R2C1,Sheet1!R2C1:R16C1,MOD(RC1+1,2)+MOD(INT((RC1+1)/2),3)*5+1,FALSE)&"|"&HLOOKUP(Sheet1!R2C1,Sheet1!R2C1:R16C1,MOD(RC1+2,2)+MOD(INT((RC1+2)/2),3)*5+1,FALSE)&"|"&HLOOKUP(Sheet1!R2C1,Sheet1!R2C1:R16C1,MOD(RC1+3,2)+MOD(INT((RC1+3)/2),3)*5+1,FALSE) -> 131|160|161|100|101 | H214: =HLOOKUP(Sheet1!R2C1,Sheet1!R2C1:R16C1,MOD(RC1+2,2)+MOD(INT((RC1+2)/2),3)*5+1,FALSE)&"|"&HLOOKUP(Sheet1!R2C1,Sheet1!R2C1:R16C1,MOD(RC1+3,2)+MOD(INT((RC1+3)/2),3)*5+1,FALSE)&"|"&HLOOKUP(Sheet1!R2C1,Sheet1!R2C1:R16C1,MOD(RC1+4,2)+MOD(INT((RC1+4)/2),3)*5+1,FALSE)&"|"&HLOOKUP(Sheet1!R2C1,Sheet1!R2C1:R16C1,MOD(RC1+5,2)+MOD(INT((RC1+5)/2),3)*5+1,FALSE)&"|"&HLOOKUP(Sheet1!R2C1,Sheet1!R2C1:R16C1,MOD(RC1+6,2)+MOD(INT((RC1+6)/2),3)*5+1,FALSE) -> 100|101|130|131|160 | I214: =HLOOKUP(Sheet1!R2C1,Sheet1!R2C1:R16C1,MOD(RC1-1,3)+MOD(INT((RC1-1)/3),3)*5+3,FALSE)&"|"&HLOOKUP(Sheet1!R2C1,Sheet1!R2C1:R16C1,MOD(RC1,3)+MOD(INT((RC1)/3),3)*5+3,FALSE)&"|"&HLOOKUP(Sheet1!R2C1,Sheet1!R2C1:R16C1,MOD(RC1+1,3)+MOD(INT((RC1+1)/3),3)*5+3,FALSE)&"|"&HLOOKUP(Sheet1!R2C1,Sheet1!R2C1:R16C1,MOD(RC1+2,3)+MOD(INT((RC1+2)/3),3)*5+3,FALSE)&"|"&HLOOKUP(Sheet1!R2C1,Sheet1!R2C1:R16C1,MOD(RC1+3,3)+MOD(INT((RC1+3)/3),3)*5+3,FALSE) -> 102|103|104|132|133 | J214: =HLOOKUP(Sheet1!R2C1,Sheet1!R2C1:R16C1,MOD(RC1-1,3)+MOD(INT((RC1-1)/3),3)*5+3,FALSE)&"|"&HLOOKUP(Sheet1!R2C1,Sheet1!R2C1:R16C1,MOD(RC1,3)+MOD(INT((RC1)/3),3)*5+3,FALSE)&"|"&HLOOKUP(Sheet1!R2C1,Sheet1!R2C1:R16C1,MOD(RC1+1,3)+MOD(INT((RC1+1)/3),3)*5+3,FALSE)&"|"&HLOOKUP(Sheet1!R2C1,Sheet1!R2C1:R16C1,MOD(RC1+2,3)+MOD(INT((RC1+2)/3),3)*5+3,FALSE)&"|"&HLOOKUP(Sheet1!R2C1,Sheet1!R2C1:R16C1,MOD(RC1+3,3)+MOD(INT((RC1+3)/3),3)*5+3,FALSE) -> 102|103|104|132|133 | K214: =HLOOKUP(Sheet1!R2C1,Sheet1!R2C1:R16C1,MOD(RC1-1,3)+MOD(INT((RC1-1)/3),3)*5+3,FALSE)&"|"&HLOOKUP(Sheet1!R2C1,Sheet1!R2C1:R16C1,MOD(RC1,3)+MOD(INT((RC1)/3),3)*5+3,FALSE)&"|"&HLOOKUP(Sheet1!R2C1,Sheet1!R2C1:R16C1,MOD(RC1+1,3)+MOD(INT((RC1+1)/3),3)*5+3,FALSE)&"|"&HLOOKUP(Sheet1!R2C1,Sheet1!R2C1:R16C1,MOD(RC1+2,3)+MOD(INT((RC1+2)/3),3)*5+3,FALSE)&"|"&HLOOKUP(Sheet1!R2C1,Sheet1!R2C1:R16C1,MOD(RC1+3,3)+MOD(INT((RC1+3)/3),3)*5+3,FALSE) -> 102|103|104|132|133 | L214: 25|22|23|24 | M214: 1095950|1095950|1095950|1095950 | N214: 10030|10031|10032|10033 | O214: 1|1|1|1 | P214: 2500|2500|2500|2500
A215: 209 | B215: 207 | C215: 30 | D215: =R[-20]C+2 -> 40 | E215: 1000 | F215: =MOD(RC[-5]-1,3)*30+100&"|"&MOD(RC[-5]-1,3)*30+101&"|"&MOD(RC[-5]-1,3)*30+102&"|"&MOD(RC[-5]-1,3)*30+103&"|"&IF(MOD(RC[-5],4)=0,HLOOKUP(Sheet1!R2C10,Sheet1!R2C10:R7C10,MOD(RC[-5]/4-1,6)+1,FALSE),IF(MOD(RC[-5],2)=0,IF(RC[-5]>20,HLOOKUP(Sheet1!R2C7,Sheet1!R2C7:R43C7,MOD(RC[-5]/2-1,42)+1,FALSE),HLOOKUP(Sheet1!R2C4,Sheet1!R2C4:R7C4,MOD(RC[-5]-1,6)+1,FALSE)),MOD(RC[-5]-1,3)*30+104)) -> 130|131|132|133|134 | G215: =HLOOKUP(Sheet1!R2C1,Sheet1!R2C1:R16C1,MOD(RC1-1,2)+MOD(INT((RC1-1)/2),3)*5+1,FALSE)&"|"&HLOOKUP(Sheet1!R2C1,Sheet1!R2C1:R16C1,MOD(RC1,2)+MOD(INT((RC1)/2),3)*5+1,FALSE)&"|"&HLOOKUP(Sheet1!R2C1,Sheet1!R2C1:R16C1,MOD(RC1+1,2)+MOD(INT((RC1+1)/2),3)*5+1,FALSE)&"|"&HLOOKUP(Sheet1!R2C1,Sheet1!R2C1:R16C1,MOD(RC1+2,2)+MOD(INT((RC1+2)/2),3)*5+1,FALSE)&"|"&HLOOKUP(Sheet1!R2C1,Sheet1!R2C1:R16C1,MOD(RC1+3,2)+MOD(INT((RC1+3)/2),3)*5+1,FALSE) -> 160|161|100|101|130 | H215: =HLOOKUP(Sheet1!R2C1,Sheet1!R2C1:R16C1,MOD(RC1+2,2)+MOD(INT((RC1+2)/2),3)*5+1,FALSE)&"|"&HLOOKUP(Sheet1!R2C1,Sheet1!R2C1:R16C1,MOD(RC1+3,2)+MOD(INT((RC1+3)/2),3)*5+1,FALSE)&"|"&HLOOKUP(Sheet1!R2C1,Sheet1!R2C1:R16C1,MOD(RC1+4,2)+MOD(INT((RC1+4)/2),3)*5+1,FALSE)&"|"&HLOOKUP(Sheet1!R2C1,Sheet1!R2C1:R16C1,MOD(RC1+5,2)+MOD(INT((RC1+5)/2),3)*5+1,FALSE)&"|"&HLOOKUP(Sheet1!R2C1,Sheet1!R2C1:R16C1,MOD(RC1+6,2)+MOD(INT((RC1+6)/2),3)*5+1,FALSE) -> 101|130|131|160|161 | I215: =HLOOKUP(Sheet1!R2C1,Sheet1!R2C1:R16C1,MOD(RC1-1,3)+MOD(INT((RC1-1)/3),3)*5+3,FALSE)&"|"&HLOOKUP(Sheet1!R2C1,Sheet1!R2C1:R16C1,MOD(RC1,3)+MOD(INT((RC1)/3),3)*5+3,FALSE)&"|"&HLOOKUP(Sheet1!R2C1,Sheet1!R2C1:R16C1,MOD(RC1+1,3)+MOD(INT((RC1+1)/3),3)*5+3,FALSE)&"|"&HLOOKUP(Sheet1!R2C1,Sheet1!R2C1:R16C1,MOD(RC1+2,3)+MOD(INT((RC1+2)/3),3)*5+3,FALSE)&"|"&HLOOKUP(Sheet1!R2C1,Sheet1!R2C1:R16C1,MOD(RC1+3,3)+MOD(INT((RC1+3)/3),3)*5+3,FALSE) -> 103|104|132|133|134 | J215: =HLOOKUP(Sheet1!R2C1,Sheet1!R2C1:R16C1,MOD(RC1-1,3)+MOD(INT((RC1-1)/3),3)*5+3,FALSE)&"|"&HLOOKUP(Sheet1!R2C1,Sheet1!R2C1:R16C1,MOD(RC1,3)+MOD(INT((RC1)/3),3)*5+3,FALSE)&"|"&HLOOKUP(Sheet1!R2C1,Sheet1!R2C1:R16C1,MOD(RC1+1,3)+MOD(INT((RC1+1)/3),3)*5+3,FALSE)&"|"&HLOOKUP(Sheet1!R2C1,Sheet1!R2C1:R16C1,MOD(RC1+2,3)+MOD(INT((RC1+2)/3),3)*5+3,FALSE)&"|"&HLOOKUP(Sheet1!R2C1,Sheet1!R2C1:R16C1,MOD(RC1+3,3)+MOD(INT((RC1+3)/3),3)*5+3,FALSE) -> 103|104|132|133|134 | K215: =HLOOKUP(Sheet1!R2C1,Sheet1!R2C1:R16C1,MOD(RC1-1,3)+MOD(INT((RC1-1)/3),3)*5+3,FALSE)&"|"&HLOOKUP(Sheet1!R2C1,Sheet1!R2C1:R16C1,MOD(RC1,3)+MOD(INT((RC1)/3),3)*5+3,FALSE)&"|"&HLOOKUP(Sheet1!R2C1,Sheet1!R2C1:R16C1,MOD(RC1+1,3)+MOD(INT((RC1+1)/3),3)*5+3,FALSE)&"|"&HLOOKUP(Sheet1!R2C1,Sheet1!R2C1:R16C1,MOD(RC1+2,3)+MOD(INT((RC1+2)/3),3)*5+3,FALSE)&"|"&HLOOKUP(Sheet1!R2C1,Sheet1!R2C1:R16C1,MOD(RC1+3,3)+MOD(INT((RC1+3)/3),3)*5+3,FALSE) -> 103|104|132|133|134 | L215: 25|22|23|24 | M215: 1107455|1107455|1107455|1107455 | N215: 10030|10031|10032|10033 | O215: 1|1|1|1 | P215: 2500|2500|2500|2500
A216: 210 | B216: 208 | C216: 30 | D216: =R[-20]C+2 -> 40 | E216: 1000 | F216: =MOD(RC[-5]-1,3)*30+100&"|"&MOD(RC[-5]-1,3)*30+101&"|"&MOD(RC[-5]-1,3)*30+102&"|"&MOD(RC[-5]-1,3)*30+103&"|"&IF(MOD(RC[-5],4)=0,HLOOKUP(Sheet1!R2C10,Sheet1!R2C10:R7C10,MOD(RC[-5]/4-1,6)+1,FALSE),IF(MOD(RC[-5],2)=0,IF(RC[-5]>20,HLOOKUP(Sheet1!R2C7,Sheet1!R2C7:R43C7,MOD(RC[-5]/2-1,42)+1,FALSE),HLOOKUP(Sheet1!R2C4,Sheet1!R2C4:R7C4,MOD(RC[-5]-1,6)+1,FALSE)),MOD(RC[-5]-1,3)*30+104)) -> 160|161|162|163|148 | G216: =HLOOKUP(Sheet1!R2C1,Sheet1!R2C1:R16C1,MOD(RC1-1,2)+MOD(INT((RC1-1)/2),3)*5+1,FALSE)&"|"&HLOOKUP(Sheet1!R2C1,Sheet1!R2C1:R16C1,MOD(RC1,2)+MOD(INT((RC1)/2),3)*5+1,FALSE)&"|"&HLOOKUP(Sheet1!R2C1,Sheet1!R2C1:R16C1,MOD(RC1+1,2)+MOD(INT((RC1+1)/2),3)*5+1,FALSE)&"|"&HLOOKUP(Sheet1!R2C1,Sheet1!R2C1:R16C1,MOD(RC1+2,2)+MOD(INT((RC1+2)/2),3)*5+1,FALSE)&"|"&HLOOKUP(Sheet1!R2C1,Sheet1!R2C1:R16C1,MOD(RC1+3,2)+MOD(INT((RC1+3)/2),3)*5+1,FALSE) -> 161|100|101|130|131 | H216: =HLOOKUP(Sheet1!R2C1,Sheet1!R2C1:R16C1,MOD(RC1+2,2)+MOD(INT((RC1+2)/2),3)*5+1,FALSE)&"|"&HLOOKUP(Sheet1!R2C1,Sheet1!R2C1:R16C1,MOD(RC1+3,2)+MOD(INT((RC1+3)/2),3)*5+1,FALSE)&"|"&HLOOKUP(Sheet1!R2C1,Sheet1!R2C1:R16C1,MOD(RC1+4,2)+MOD(INT((RC1+4)/2),3)*5+1,FALSE)&"|"&HLOOKUP(Sheet1!R2C1,Sheet1!R2C1:R16C1,MOD(RC1+5,2)+MOD(INT((RC1+5)/2),3)*5+1,FALSE)&"|"&HLOOKUP(Sheet1!R2C1,Sheet1!R2C1:R16C1,MOD(RC1+6,2)+MOD(INT((RC1+6)/2),3)*5+1,FALSE) -> 130|131|160|161|100 | I216: =HLOOKUP(Sheet1!R2C1,Sheet1!R2C1:R16C1,MOD(RC1-1,3)+MOD(INT((RC1-1)/3),3)*5+3,FALSE)&"|"&HLOOKUP(Sheet1!R2C1,Sheet1!R2C1:R16C1,MOD(RC1,3)+MOD(INT((RC1)/3),3)*5+3,FALSE)&"|"&HLOOKUP(Sheet1!R2C1,Sheet1!R2C1:R16C1,MOD(RC1+1,3)+MOD(INT((RC1+1)/3),3)*5+3,FALSE)&"|"&HLOOKUP(Sheet1!R2C1,Sheet1!R2C1:R16C1,MOD(RC1+2,3)+MOD(INT((RC1+2)/3),3)*5+3,FALSE)&"|"&HLOOKUP(Sheet1!R2C1,Sheet1!R2C1:R16C1,MOD(RC1+3,3)+MOD(INT((RC1+3)/3),3)*5+3,FALSE) -> 104|132|133|134|162 | J216: =HLOOKUP(Sheet1!R2C1,Sheet1!R2C1:R16C1,MOD(RC1-1,3)+MOD(INT((RC1-1)/3),3)*5+3,FALSE)&"|"&HLOOKUP(Sheet1!R2C1,Sheet1!R2C1:R16C1,MOD(RC1,3)+MOD(INT((RC1)/3),3)*5+3,FALSE)&"|"&HLOOKUP(Sheet1!R2C1,Sheet1!R2C1:R16C1,MOD(RC1+1,3)+MOD(INT((RC1+1)/3),3)*5+3,FALSE)&"|"&HLOOKUP(Sheet1!R2C1,Sheet1!R2C1:R16C1,MOD(RC1+2,3)+MOD(INT((RC1+2)/3),3)*5+3,FALSE)&"|"&HLOOKUP(Sheet1!R2C1,Sheet1!R2C1:R16C1,MOD(RC1+3,3)+MOD(INT((RC1+3)/3),3)*5+3,FALSE) -> 104|132|133|134|162 | K216: =HLOOKUP(Sheet1!R2C1,Sheet1!R2C1:R16C1,MOD(RC1-1,3)+MOD(INT((RC1-1)/3),3)*5+3,FALSE)&"|"&HLOOKUP(Sheet1!R2C1,Sheet1!R2C1:R16C1,MOD(RC1,3)+MOD(INT((RC1)/3),3)*5+3,FALSE)&"|"&HLOOKUP(Sheet1!R2C1,Sheet1!R2C1:R16C1,MOD(RC1+1,3)+MOD(INT((RC1+1)/3),3)*5+3,FALSE)&"|"&HLOOKUP(Sheet1!R2C1,Sheet1!R2C1:R16C1,MOD(RC1+2,3)+MOD(INT((RC1+2)/3),3)*5+3,FALSE)&"|"&HLOOKUP(Sheet1!R2C1,Sheet1!R2C1:R16C1,MOD(RC1+3,3)+MOD(INT((RC1+3)/3),3)*5+3,FALSE) -> 104|132|133|134|162 | L216: 25|22|23|24 | M216: 1118694|1118694|1118695|1118695 | N216: 10030|10031|10032|10033|10030|10031|10032|10033|10030|10031|10032|10033|10030|10031|10032|10033|10030|10031|10032|10033|10030|10031|10032|10033|10030|10031|10032|10033|10030|10031|10032|10033|10030|10031|10032|10033|10030|10031|10032|10033 | O216: 1|1|1|1|1|1|1|1|1|1|1|1|1|1|1|1|1|1|1|1|1|1|1|1|1|1|1|1|1|1|1|1|1|1|1|1|1|1|1|1 | P216: 2500|2500|2500|2500|2500|2500|2500|2500|2500|2500|2500|2500|2500|2500|2500|2500|2500|2500|2500|2500|2500|2500|2500|2500|2500|2500|2500|2500|2500|2500|2500|2500|2500|2500|2500|2500|2500|2500|2500|2500
A217: 211 | B217: 209 | C217: 30 | D217: =R[-20]C+2 -> 40 | E217: 1000 | F217: =MOD(RC[-5]-1,3)*30+100&"|"&MOD(RC[-5]-1,3)*30+101&"|"&MOD(RC[-5]-1,3)*30+102&"|"&MOD(RC[-5]-1,3)*30+103&"|"&IF(MOD(RC[-5],4)=0,HLOOKUP(Sheet1!R2C10,Sheet1!R2C10:R7C10,MOD(RC[-5]/4-1,6)+1,FALSE),IF(MOD(RC[-5],2)=0,IF(RC[-5]>20,HLOOKUP(Sheet1!R2C7,Sheet1!R2C7:R43C7,MOD(RC[-5]/2-1,42)+1,FALSE),HLOOKUP(Sheet1!R2C4,Sheet1!R2C4:R7C4,MOD(RC[-5]-1,6)+1,FALSE)),MOD(RC[-5]-1,3)*30+104)) -> 100|101|102|103|104 | G217: =HLOOKUP(Sheet1!R2C1,Sheet1!R2C1:R16C1,MOD(RC1-1,2)+MOD(INT((RC1-1)/2),3)*5+1,FALSE)&"|"&HLOOKUP(Sheet1!R2C1,Sheet1!R2C1:R16C1,MOD(RC1,2)+MOD(INT((RC1)/2),3)*5+1,FALSE)&"|"&HLOOKUP(Sheet1!R2C1,Sheet1!R2C1:R16C1,MOD(RC1+1,2)+MOD(INT((RC1+1)/2),3)*5+1,FALSE)&"|"&HLOOKUP(Sheet1!R2C1,Sheet1!R2C1:R16C1,MOD(RC1+2,2)+MOD(INT((RC1+2)/2),3)*5+1,FALSE)&"|"&HLOOKUP(Sheet1!R2C1,Sheet1!R2C1:R16C1,MOD(RC1+3,2)+MOD(INT((RC1+3)/2),3)*5+1,FALSE) -> 100|101|130|131|160 | H217: =HLOOKUP(Sheet1!R2C1,Sheet1!R2C1:R16C1,MOD(RC1+2,2)+MOD(INT((RC1+2)/2),3)*5+1,FALSE)&"|"&HLOOKUP(Sheet1!R2C1,Sheet1!R2C1:R16C1,MOD(RC1+3,2)+MOD(INT((RC1+3)/2),3)*5+1,FALSE)&"|"&HLOOKUP(Sheet1!R2C1,Sheet1!R2C1:R16C1,MOD(RC1+4,2)+MOD(INT((RC1+4)/2),3)*5+1,FALSE)&"|"&HLOOKUP(Sheet1!R2C1,Sheet1!R2C1:R16C1,MOD(RC1+5,2)+MOD(INT((RC1+5)/2),3)*5+1,FALSE)&"|"&HLOOKUP(Sheet1!R2C1,Sheet1!R2C1:R16C1,MOD(RC1+6,2)+MOD(INT((RC1+6)/2),3)*5+1,FALSE) -> 131|160|161|100|101 | I217: =HLOOKUP(Sheet1!R2C1,Sheet1!R2C1:R16C1,MOD(RC1-1,3)+MOD(INT((RC1-1)/3),3)*5+3,FALSE)&"|"&HLOOKUP(Sheet1!R2C1,Sheet1!R2C1:R16C1,MOD(RC1,3)+MOD(INT((RC1)/3),3)*5+3,FALSE)&"|"&HLOOKUP(Sheet1!R2C1,Sheet1!R2C1:R16C1,MOD(RC1+1,3)+MOD(INT((RC1+1)/3),3)*5+3,FALSE)&"|"&HLOOKUP(Sheet1!R2C1,Sheet1!R2C1:R16C1,MOD(RC1+2,3)+MOD(INT((RC1+2)/3),3)*5+3,FALSE)&"|"&HLOOKUP(Sheet1!R2C1,Sheet1!R2C1:R16C1,MOD(RC1+3,3)+MOD(INT((RC1+3)/3),3)*5+3,FALSE) -> 132|133|134|162|163 | J217: =HLOOKUP(Sheet1!R2C1,Sheet1!R2C1:R16C1,MOD(RC1-1,3)+MOD(INT((RC1-1)/3),3)*5+3,FALSE)&"|"&HLOOKUP(Sheet1!R2C1,Sheet1!R2C1:R16C1,MOD(RC1,3)+MOD(INT((RC1)/3),3)*5+3,FALSE)&"|"&HLOOKUP(Sheet1!R2C1,Sheet1!R2C1:R16C1,MOD(RC1+1,3)+MOD(INT((RC1+1)/3),3)*5+3,FALSE)&"|"&HLOOKUP(Sheet1!R2C1,Sheet1!R2C1:R16C1,MOD(RC1+2,3)+MOD(INT((RC1+2)/3),3)*5+3,FALSE)&"|"&HLOOKUP(Sheet1!R2C1,Sheet1!R2C1:R16C1,MOD(RC1+3,3)+MOD(INT((RC1+3)/3),3)*5+3,FALSE) -> 132|133|134|162|163 | K217: =HLOOKUP(Sheet1!R2C1,Sheet1!R2C1:R16C1,MOD(RC1-1,3)+MOD(INT((RC1-1)/3),3)*5+3,FALSE)&"|"&HLOOKUP(Sheet1!R2C1,Sheet1!R2C1:R16C1,MOD(RC1,3)+MOD(INT((RC1)/3),3)*5+3,FALSE)&"|"&HLOOKUP(Sheet1!R2C1,Sheet1!R2C1:R16C1,MOD(RC1+1,3)+MOD(INT((RC1+1)/3),3)*5+3,FALSE)&"|"&HLOOKUP(Sheet1!R2C1,Sheet1!R2C1:R16C1,MOD(RC1+2,3)+MOD(INT((RC1+2)/3),3)*5+3,FALSE)&"|"&HLOOKUP(Sheet1!R2C1,Sheet1!R2C1:R16C1,MOD(RC1+3,3)+MOD(INT((RC1+3)/3),3)*5+3,FALSE) -> 132|133|134|162|163 | L217: 25|22|23|24 | M217: 1130780|1130780|1130780|1130780 | N217: 10030|10031|10032|10033 | O217: 1|1|1|1 | P217: 2500|2500|2500|2500
A218: 212 | B218: 210 | C218: 30 | D218: =R[-20]C+2 -> 40 | E218: 1000 | F218: =MOD(RC[-5]-1,3)*30+100&"|"&MOD(RC[-5]-1,3)*30+101&"|"&MOD(RC[-5]-1,3)*30+102&"|"&MOD(RC[-5]-1,3)*30+103&"|"&IF(MOD(RC[-5],4)=0,HLOOKUP(Sheet1!R2C10,Sheet1!R2C10:R7C10,MOD(RC[-5]/4-1,6)+1,FALSE),IF(MOD(RC[-5],2)=0,IF(RC[-5]>20,HLOOKUP(Sheet1!R2C7,Sheet1!R2C7:R43C7,MOD(RC[-5]/2-1,42)+1,FALSE),HLOOKUP(Sheet1!R2C4,Sheet1!R2C4:R7C4,MOD(RC[-5]-1,6)+1,FALSE)),MOD(RC[-5]-1,3)*30+104)) -> 130|131|132|133|194 | G218: =HLOOKUP(Sheet1!R2C1,Sheet1!R2C1:R16C1,MOD(RC1-1,2)+MOD(INT((RC1-1)/2),3)*5+1,FALSE)&"|"&HLOOKUP(Sheet1!R2C1,Sheet1!R2C1:R16C1,MOD(RC1,2)+MOD(INT((RC1)/2),3)*5+1,FALSE)&"|"&HLOOKUP(Sheet1!R2C1,Sheet1!R2C1:R16C1,MOD(RC1+1,2)+MOD(INT((RC1+1)/2),3)*5+1,FALSE)&"|"&HLOOKUP(Sheet1!R2C1,Sheet1!R2C1:R16C1,MOD(RC1+2,2)+MOD(INT((RC1+2)/2),3)*5+1,FALSE)&"|"&HLOOKUP(Sheet1!R2C1,Sheet1!R2C1:R16C1,MOD(RC1+3,2)+MOD(INT((RC1+3)/2),3)*5+1,FALSE) -> 101|130|131|160|161 | H218: =HLOOKUP(Sheet1!R2C1,Sheet1!R2C1:R16C1,MOD(RC1+2,2)+MOD(INT((RC1+2)/2),3)*5+1,FALSE)&"|"&HLOOKUP(Sheet1!R2C1,Sheet1!R2C1:R16C1,MOD(RC1+3,2)+MOD(INT((RC1+3)/2),3)*5+1,FALSE)&"|"&HLOOKUP(Sheet1!R2C1,Sheet1!R2C1:R16C1,MOD(RC1+4,2)+MOD(INT((RC1+4)/2),3)*5+1,FALSE)&"|"&HLOOKUP(Sheet1!R2C1,Sheet1!R2C1:R16C1,MOD(RC1+5,2)+MOD(INT((RC1+5)/2),3)*5+1,FALSE)&"|"&HLOOKUP(Sheet1!R2C1,Sheet1!R2C1:R16C1,MOD(RC1+6,2)+MOD(INT((RC1+6)/2),3)*5+1,FALSE) -> 160|161|100|101|130 | I218: =HLOOKUP(Sheet1!R2C1,Sheet1!R2C1:R16C1,MOD(RC1-1,3)+MOD(INT((RC1-1)/3),3)*5+3,FALSE)&"|"&HLOOKUP(Sheet1!R2C1,Sheet1!R2C1:R16C1,MOD(RC1,3)+MOD(INT((RC1)/3),3)*5+3,FALSE)&"|"&HLOOKUP(Sheet1!R2C1,Sheet1!R2C1:R16C1,MOD(RC1+1,3)+MOD(INT((RC1+1)/3),3)*5+3,FALSE)&"|"&HLOOKUP(Sheet1!R2C1,Sheet1!R2C1:R16C1,MOD(RC1+2,3)+MOD(INT((RC1+2)/3),3)*5+3,FALSE)&"|"&HLOOKUP(Sheet1!R2C1,Sheet1!R2C1:R16C1,MOD(RC1+3,3)+MOD(INT((RC1+3)/3),3)*5+3,FALSE) -> 133|134|162|163|164 | J218: =HLOOKUP(Sheet1!R2C1,Sheet1!R2C1:R16C1,MOD(RC1-1,3)+MOD(INT((RC1-1)/3),3)*5+3,FALSE)&"|"&HLOOKUP(Sheet1!R2C1,Sheet1!R2C1:R16C1,MOD(RC1,3)+MOD(INT((RC1)/3),3)*5+3,FALSE)&"|"&HLOOKUP(Sheet1!R2C1,Sheet1!R2C1:R16C1,MOD(RC1+1,3)+MOD(INT((RC1+1)/3),3)*5+3,FALSE)&"|"&HLOOKUP(Sheet1!R2C1,Sheet1!R2C1:R16C1,MOD(RC1+2,3)+MOD(INT((RC1+2)/3),3)*5+3,FALSE)&"|"&HLOOKUP(Sheet1!R2C1,Sheet1!R2C1:R16C1,MOD(RC1+3,3)+MOD(INT((RC1+3)/3),3)*5+3,FALSE) -> 133|134|162|163|164 | K218: =HLOOKUP(Sheet1!R2C1,Sheet1!R2C1:R16C1,MOD(RC1-1,3)+MOD(INT((RC1-1)/3),3)*5+3,FALSE)&"|"&HLOOKUP(Sheet1!R2C1,Sheet1!R2C1:R16C1,MOD(RC1,3)+MOD(INT((RC1)/3),3)*5+3,FALSE)&"|"&HLOOKUP(Sheet1!R2C1,Sheet1!R2C1:R16C1,MOD(RC1+1,3)+MOD(INT((RC1+1)/3),3)*5+3,FALSE)&"|"&HLOOKUP(Sheet1!R2C1,Sheet1!R2C1:R16C1,MOD(RC1+2,3)+MOD(INT((RC1+2)/3),3)*5+3,FALSE)&"|"&HLOOKUP(Sheet1!R2C1,Sheet1!R2C1:R16C1,MOD(RC1+3,3)+MOD(INT((RC1+3)/3),3)*5+3,FALSE) -> 133|134|162|163|164 | L218: 25|22|23|24 | M218: 1142435|1142435|1142435|1142435 | N218: 10030|10031|10032|10033 | O218: 1|1|1|1 | P218: 2500|2500|2500|2500
A219: 213 | B219: 211 | C219: 30 | D219: =R[-20]C+2 -> 40 | E219: 1000 | F219: =MOD(RC[-5]-1,3)*30+100&"|"&MOD(RC[-5]-1,3)*30+101&"|"&MOD(RC[-5]-1,3)*30+102&"|"&MOD(RC[-5]-1,3)*30+103&"|"&IF(MOD(RC[-5],4)=0,HLOOKUP(Sheet1!R2C10,Sheet1!R2C10:R7C10,MOD(RC[-5]/4-1,6)+1,FALSE),IF(MOD(RC[-5],2)=0,IF(RC[-5]>20,HLOOKUP(Sheet1!R2C7,Sheet1!R2C7:R43C7,MOD(RC[-5]/2-1,42)+1,FALSE),HLOOKUP(Sheet1!R2C4,Sheet1!R2C4:R7C4,MOD(RC[-5]-1,6)+1,FALSE)),MOD(RC[-5]-1,3)*30+104)) -> 160|161|162|163|164 | G219: =HLOOKUP(Sheet1!R2C1,Sheet1!R2C1:R16C1,MOD(RC1-1,2)+MOD(INT((RC1-1)/2),3)*5+1,FALSE)&"|"&HLOOKUP(Sheet1!R2C1,Sheet1!R2C1:R16C1,MOD(RC1,2)+MOD(INT((RC1)/2),3)*5+1,FALSE)&"|"&HLOOKUP(Sheet1!R2C1,Sheet1!R2C1:R16C1,MOD(RC1+1,2)+MOD(INT((RC1+1)/2),3)*5+1,FALSE)&"|"&HLOOKUP(Sheet1!R2C1,Sheet1!R2C1:R16C1,MOD(RC1+2,2)+MOD(INT((RC1+2)/2),3)*5+1,FALSE)&"|"&HLOOKUP(Sheet1!R2C1,Sheet1!R2C1:R16C1,MOD(RC1+3,2)+MOD(INT((RC1+3)/2),3)*5+1,FALSE) -> 130|131|160|161|100 | H219: =HLOOKUP(Sheet1!R2C1,Sheet1!R2C1:R16C1,MOD(RC1+2,2)+MOD(INT((RC1+2)/2),3)*5+1,FALSE)&"|"&HLOOKUP(Sheet1!R2C1,Sheet1!R2C1:R16C1,MOD(RC1+3,2)+MOD(INT((RC1+3)/2),3)*5+1,FALSE)&"|"&HLOOKUP(Sheet1!R2C1,Sheet1!R2C1:R16C1,MOD(RC1+4,2)+MOD(INT((RC1+4)/2),3)*5+1,FALSE)&"|"&HLOOKUP(Sheet1!R2C1,Sheet1!R2C1:R16C1,MOD(RC1+5,2)+MOD(INT((RC1+5)/2),3)*5+1,FALSE)&"|"&HLOOKUP(Sheet1!R2C1,Sheet1!R2C1:R16C1,MOD(RC1+6,2)+MOD(INT((RC1+6)/2),3)*5+1,FALSE) -> 161|100|101|130|131 | I219: =HLOOKUP(Sheet1!R2C1,Sheet1!R2C1:R16C1,MOD(RC1-1,3)+MOD(INT((RC1-1)/3),3)*5+3,FALSE)&"|"&HLOOKUP(Sheet1!R2C1,Sheet1!R2C1:R16C1,MOD(RC1,3)+MOD(INT((RC1)/3),3)*5+3,FALSE)&"|"&HLOOKUP(Sheet1!R2C1,Sheet1!R2C1:R16C1,MOD(RC1+1,3)+MOD(INT((RC1+1)/3),3)*5+3,FALSE)&"|"&HLOOKUP(Sheet1!R2C1,Sheet1!R2C1:R16C1,MOD(RC1+2,3)+MOD(INT((RC1+2)/3),3)*5+3,FALSE)&"|"&HLOOKUP(Sheet1!R2C1,Sheet1!R2C1:R16C1,MOD(RC1+3,3)+MOD(INT((RC1+3)/3),3)*5+3,FALSE) -> 134|162|163|164|102 | J219: =HLOOKUP(Sheet1!R2C1,Sheet1!R2C1:R16C1,MOD(RC1-1,3)+MOD(INT((RC1-1)/3),3)*5+3,FALSE)&"|"&HLOOKUP(Sheet1!R2C1,Sheet1!R2C1:R16C1,MOD(RC1,3)+MOD(INT((RC1)/3),3)*5+3,FALSE)&"|"&HLOOKUP(Sheet1!R2C1,Sheet1!R2C1:R16C1,MOD(RC1+1,3)+MOD(INT((RC1+1)/3),3)*5+3,FALSE)&"|"&HLOOKUP(Sheet1!R2C1,Sheet1!R2C1:R16C1,MOD(RC1+2,3)+MOD(INT((RC1+2)/3),3)*5+3,FALSE)&"|"&HLOOKUP(Sheet1!R2C1,Sheet1!R2C1:R16C1,MOD(RC1+3,3)+MOD(INT((RC1+3)/3),3)*5+3,FALSE) -> 134|162|163|164|102 | K219: =HLOOKUP(Sheet1!R2C1,Sheet1!R2C1:R16C1,MOD(RC1-1,3)+MOD(INT((RC1-1)/3),3)*5+3,FALSE)&"|"&HLOOKUP(Sheet1!R2C1,Sheet1!R2C1:R16C1,MOD(RC1,3)+MOD(INT((RC1)/3),3)*5+3,FALSE)&"|"&HLOOKUP(Sheet1!R2C1,Sheet1!R2C1:R16C1,MOD(RC1+1,3)+MOD(INT((RC1+1)/3),3)*5+3,FALSE)&"|"&HLOOKUP(Sheet1!R2C1,Sheet1!R2C1:R16C1,MOD(RC1+2,3)+MOD(INT((RC1+2)/3),3)*5+3,FALSE)&"|"&HLOOKUP(Sheet1!R2C1,Sheet1!R2C1:R16C1,MOD(RC1+3,3)+MOD(INT((RC1+3)/3),3)*5+3,FALSE) -> 134|162|163|164|102 | L219: 25|22|23|24 | M219: 1154521|1154521|1154523|1154523 | N219: 10030|10031|10032|10033 | O219: 1|1|1|1 | P219: 2500|2500|2500|2500
A220: 214 | B220: 212 | C220: 30 | D220: =R[-20]C+2 -> 40 | E220: 1000 | F220: =MOD(RC[-5]-1,3)*30+100&"|"&MOD(RC[-5]-1,3)*30+101&"|"&MOD(RC[-5]-1,3)*30+102&"|"&MOD(RC[-5]-1,3)*30+103&"|"&IF(MOD(RC[-5],4)=0,HLOOKUP(Sheet1!R2C10,Sheet1!R2C10:R7C10,MOD(RC[-5]/4-1,6)+1,FALSE),IF(MOD(RC[-5],2)=0,IF(RC[-5]>20,HLOOKUP(Sheet1!R2C7,Sheet1!R2C7:R43C7,MOD(RC[-5]/2-1,42)+1,FALSE),HLOOKUP(Sheet1!R2C4,Sheet1!R2C4:R7C4,MOD(RC[-5]-1,6)+1,FALSE)),MOD(RC[-5]-1,3)*30+104)) -> 100|101|102|103|150 | G220: =HLOOKUP(Sheet1!R2C1,Sheet1!R2C1:R16C1,MOD(RC1-1,2)+MOD(INT((RC1-1)/2),3)*5+1,FALSE)&"|"&HLOOKUP(Sheet1!R2C1,Sheet1!R2C1:R16C1,MOD(RC1,2)+MOD(INT((RC1)/2),3)*5+1,FALSE)&"|"&HLOOKUP(Sheet1!R2C1,Sheet1!R2C1:R16C1,MOD(RC1+1,2)+MOD(INT((RC1+1)/2),3)*5+1,FALSE)&"|"&HLOOKUP(Sheet1!R2C1,Sheet1!R2C1:R16C1,MOD(RC1+2,2)+MOD(INT((RC1+2)/2),3)*5+1,FALSE)&"|"&HLOOKUP(Sheet1!R2C1,Sheet1!R2C1:R16C1,MOD(RC1+3,2)+MOD(INT((RC1+3)/2),3)*5+1,FALSE) -> 131|160|161|100|101 | H220: =HLOOKUP(Sheet1!R2C1,Sheet1!R2C1:R16C1,MOD(RC1+2,2)+MOD(INT((RC1+2)/2),3)*5+1,FALSE)&"|"&HLOOKUP(Sheet1!R2C1,Sheet1!R2C1:R16C1,MOD(RC1+3,2)+MOD(INT((RC1+3)/2),3)*5+1,FALSE)&"|"&HLOOKUP(Sheet1!R2C1,Sheet1!R2C1:R16C1,MOD(RC1+4,2)+MOD(INT((RC1+4)/2),3)*5+1,FALSE)&"|"&HLOOKUP(Sheet1!R2C1,Sheet1!R2C1:R16C1,MOD(RC1+5,2)+MOD(INT((RC1+5)/2),3)*5+1,FALSE)&"|"&HLOOKUP(Sheet1!R2C1,Sheet1!R2C1:R16C1,MOD(RC1+6,2)+MOD(INT((RC1+6)/2),3)*5+1,FALSE) -> 100|101|130|131|160 | I220: =HLOOKUP(Sheet1!R2C1,Sheet1!R2C1:R16C1,MOD(RC1-1,3)+MOD(INT((RC1-1)/3),3)*5+3,FALSE)&"|"&HLOOKUP(Sheet1!R2C1,Sheet1!R2C1:R16C1,MOD(RC1,3)+MOD(INT((RC1)/3),3)*5+3,FALSE)&"|"&HLOOKUP(Sheet1!R2C1,Sheet1!R2C1:R16C1,MOD(RC1+1,3)+MOD(INT((RC1+1)/3),3)*5+3,FALSE)&"|"&HLOOKUP(Sheet1!R2C1,Sheet1!R2C1:R16C1,MOD(RC1+2,3)+MOD(INT((RC1+2)/3),3)*5+3,FALSE)&"|"&HLOOKUP(Sheet1!R2C1,Sheet1!R2C1:R16C1,MOD(RC1+3,3)+MOD(INT((RC1+3)/3),3)*5+3,FALSE) -> 162|163|164|102|103 | J220: =HLOOKUP(Sheet1!R2C1,Sheet1!R2C1:R16C1,MOD(RC1-1,3)+MOD(INT((RC1-1)/3),3)*5+3,FALSE)&"|"&HLOOKUP(Sheet1!R2C1,Sheet1!R2C1:R16C1,MOD(RC1,3)+MOD(INT((RC1)/3),3)*5+3,FALSE)&"|"&HLOOKUP(Sheet1!R2C1,Sheet1!R2C1:R16C1,MOD(RC1+1,3)+MOD(INT((RC1+1)/3),3)*5+3,FALSE)&"|"&HLOOKUP(Sheet1!R2C1,Sheet1!R2C1:R16C1,MOD(RC1+2,3)+MOD(INT((RC1+2)/3),3)*5+3,FALSE)&"|"&HLOOKUP(Sheet1!R2C1,Sheet1!R2C1:R16C1,MOD(RC1+3,3)+MOD(INT((RC1+3)/3),3)*5+3,FALSE) -> 162|163|164|102|103 | K220: =HLOOKUP(Sheet1!R2C1,Sheet1!R2C1:R16C1,MOD(RC1-1,3)+MOD(INT((RC1-1)/3),3)*5+3,FALSE)&"|"&HLOOKUP(Sheet1!R2C1,Sheet1!R2C1:R16C1,MOD(RC1,3)+MOD(INT((RC1)/3),3)*5+3,FALSE)&"|"&HLOOKUP(Sheet1!R2C1,Sheet1!R2C1:R16C1,MOD(RC1+1,3)+MOD(INT((RC1+1)/3),3)*5+3,FALSE)&"|"&HLOOKUP(Sheet1!R2C1,Sheet1!R2C1:R16C1,MOD(RC1+2,3)+MOD(INT((RC1+2)/3),3)*5+3,FALSE)&"|"&HLOOKUP(Sheet1!R2C1,Sheet1!R2C1:R16C1,MOD(RC1+3,3)+MOD(INT((RC1+3)/3),3)*5+3,FALSE) -> 162|163|164|102|103 | L220: 25|22|23|24 | M220: 1171363|1171364|1171363|1171363 | N220: 10030|10031|10032|10033 | O220: 1|1|1|1 | P220: 2500|2500|2500|2500
A221: 215 | B221: 213 | C221: 30 | D221: =R[-20]C+2 -> 40 | E221: 1000 | F221: =MOD(RC[-5]-1,3)*30+100&"|"&MOD(RC[-5]-1,3)*30+101&"|"&MOD(RC[-5]-1,3)*30+102&"|"&MOD(RC[-5]-1,3)*30+103&"|"&IF(MOD(RC[-5],4)=0,HLOOKUP(Sheet1!R2C10,Sheet1!R2C10:R7C10,MOD(RC[-5]/4-1,6)+1,FALSE),IF(MOD(RC[-5],2)=0,IF(RC[-5]>20,HLOOKUP(Sheet1!R2C7,Sheet1!R2C7:R43C7,MOD(RC[-5]/2-1,42)+1,FALSE),HLOOKUP(Sheet1!R2C4,Sheet1!R2C4:R7C4,MOD(RC[-5]-1,6)+1,FALSE)),MOD(RC[-5]-1,3)*30+104)) -> 130|131|132|133|134 | G221: =HLOOKUP(Sheet1!R2C1,Sheet1!R2C1:R16C1,MOD(RC1-1,2)+MOD(INT((RC1-1)/2),3)*5+1,FALSE)&"|"&HLOOKUP(Sheet1!R2C1,Sheet1!R2C1:R16C1,MOD(RC1,2)+MOD(INT((RC1)/2),3)*5+1,FALSE)&"|"&HLOOKUP(Sheet1!R2C1,Sheet1!R2C1:R16C1,MOD(RC1+1,2)+MOD(INT((RC1+1)/2),3)*5+1,FALSE)&"|"&HLOOKUP(Sheet1!R2C1,Sheet1!R2C1:R16C1,MOD(RC1+2,2)+MOD(INT((RC1+2)/2),3)*5+1,FALSE)&"|"&HLOOKUP(Sheet1!R2C1,Sheet1!R2C1:R16C1,MOD(RC1+3,2)+MOD(INT((RC1+3)/2),3)*5+1,FALSE) -> 160|161|100|101|130 | H221: =HLOOKUP(Sheet1!R2C1,Sheet1!R2C1:R16C1,MOD(RC1+2,2)+MOD(INT((RC1+2)/2),3)*5+1,FALSE)&"|"&HLOOKUP(Sheet1!R2C1,Sheet1!R2C1:R16C1,MOD(RC1+3,2)+MOD(INT((RC1+3)/2),3)*5+1,FALSE)&"|"&HLOOKUP(Sheet1!R2C1,Sheet1!R2C1:R16C1,MOD(RC1+4,2)+MOD(INT((RC1+4)/2),3)*5+1,FALSE)&"|"&HLOOKUP(Sheet1!R2C1,Sheet1!R2C1:R16C1,MOD(RC1+5,2)+MOD(INT((RC1+5)/2),3)*5+1,FALSE)&"|"&HLOOKUP(Sheet1!R2C1,Sheet1!R2C1:R16C1,MOD(RC1+6,2)+MOD(INT((RC1+6)/2),3)*5+1,FALSE) -> 101|130|131|160|161 | I221: =HLOOKUP(Sheet1!R2C1,Sheet1!R2C1:R16C1,MOD(RC1-1,3)+MOD(INT((RC1-1)/3),3)*5+3,FALSE)&"|"&HLOOKUP(Sheet1!R2C1,Sheet1!R2C1:R16C1,MOD(RC1,3)+MOD(INT((RC1)/3),3)*5+3,FALSE)&"|"&HLOOKUP(Sheet1!R2C1,Sheet1!R2C1:R16C1,MOD(RC1+1,3)+MOD(INT((RC1+1)/3),3)*5+3,FALSE)&"|"&HLOOKUP(Sheet1!R2C1,Sheet1!R2C1:R16C1,MOD(RC1+2,3)+MOD(INT((RC1+2)/3),3)*5+3,FALSE)&"|"&HLOOKUP(Sheet1!R2C1,Sheet1!R2C1:R16C1,MOD(RC1+3,3)+MOD(INT((RC1+3)/3),3)*5+3,FALSE) -> 163|164|102|103|104 | J221: =HLOOKUP(Sheet1!R2C1,Sheet1!R2C1:R16C1,MOD(RC1-1,3)+MOD(INT((RC1-1)/3),3)*5+3,FALSE)&"|"&HLOOKUP(Sheet1!R2C1,Sheet1!R2C1:R16C1,MOD(RC1,3)+MOD(INT((RC1)/3),3)*5+3,FALSE)&"|"&HLOOKUP(Sheet1!R2C1,Sheet1!R2C1:R16C1,MOD(RC1+1,3)+MOD(INT((RC1+1)/3),3)*5+3,FALSE)&"|"&HLOOKUP(Sheet1!R2C1,Sheet1!R2C1:R16C1,MOD(RC1+2,3)+MOD(INT((RC1+2)/3),3)*5+3,FALSE)&"|"&HLOOKUP(Sheet1!R2C1,Sheet1!R2C1:R16C1,MOD(RC1+3,3)+MOD(INT((RC1+3)/3),3)*5+3,FALSE) -> 163|164|102|103|104 | K221: =HLOOKUP(Sheet1!R2C1,Sheet1!R2C1:R16C1,MOD(RC1-1,3)+MOD(INT((RC1-1)/3),3)*5+3,FALSE)&"|"&HLOOKUP(Sheet1!R2C1,Sheet1!R2C1:R16C1,MOD(RC1,3)+MOD(INT((RC1)/3),3)*5+3,FALSE)&"|"&HLOOKUP(Sheet1!R2C1,Sheet1!R2C1:R16C1,MOD(RC1+1,3)+MOD(INT((RC1+1)/3),3)*5+3,FALSE)&"|"&HLOOKUP(Sheet1!R2C1,Sheet1!R2C1:R16C1,MOD(RC1+2,3)+MOD(INT((RC1+2)/3),3)*5+3,FALSE)&"|"&HLOOKUP(Sheet1!R2C1,Sheet1!R2C1:R16C1,MOD(RC1+3,3)+MOD(INT((RC1+3)/3),3)*5+3,FALSE) -> 163|164|102|103|104 | L221: 25|22|23|24 | M221: 1191256|1191256|1191255|1191255 | N221: 10030|10031|10032|10033|10030|10031|10032|10033|10030|10031|10032|10033|10030|10031|10032|10033|10030|10031|10032|10033|10030|10031|10032|10033|10030|10031|10032|10033|10030|10031|10032|10033|10030|10031|10032|10033|10030|10031|10032|10033 | O221: 1|1|1|1|1|1|1|1|1|1|1|1|1|1|1|1|1|1|1|1|1|1|1|1|1|1|1|1|1|1|1|1|1|1|1|1|1|1|1|1 | P221: 2500|2500|2500|2500|2500|2500|2500|2500|2500|2500|2500|2500|2500|2500|2500|2500|2500|2500|2500|2500|2500|2500|2500|2500|2500|2500|2500|2500|2500|2500|2500|2500|2500|2500|2500|2500|2500|2500|2500|2500
A222: 216 | B222: 214 | C222: 30 | D222: =R[-20]C+2 -> 40 | E222: 1000 | F222: =MOD(RC[-5]-1,3)*30+100&"|"&MOD(RC[-5]-1,3)*30+101&"|"&MOD(RC[-5]-1,3)*30+102&"|"&MOD(RC[-5]-1,3)*30+103&"|"&IF(MOD(RC[-5],4)=0,HLOOKUP(Sheet1!R2C10,Sheet1!R2C10:R7C10,MOD(RC[-5]/4-1,6)+1,FALSE),IF(MOD(RC[-5],2)=0,IF(RC[-5]>20,HLOOKUP(Sheet1!R2C7,Sheet1!R2C7:R43C7,MOD(RC[-5]/2-1,42)+1,FALSE),HLOOKUP(Sheet1!R2C4,Sheet1!R2C4:R7C4,MOD(RC[-5]-1,6)+1,FALSE)),MOD(RC[-5]-1,3)*30+104)) -> 160|161|162|163|195 | G222: =HLOOKUP(Sheet1!R2C1,Sheet1!R2C1:R16C1,MOD(RC1-1,2)+MOD(INT((RC1-1)/2),3)*5+1,FALSE)&"|"&HLOOKUP(Sheet1!R2C1,Sheet1!R2C1:R16C1,MOD(RC1,2)+MOD(INT((RC1)/2),3)*5+1,FALSE)&"|"&HLOOKUP(Sheet1!R2C1,Sheet1!R2C1:R16C1,MOD(RC1+1,2)+MOD(INT((RC1+1)/2),3)*5+1,FALSE)&"|"&HLOOKUP(Sheet1!R2C1,Sheet1!R2C1:R16C1,MOD(RC1+2,2)+MOD(INT((RC1+2)/2),3)*5+1,FALSE)&"|"&HLOOKUP(Sheet1!R2C1,Sheet1!R2C1:R16C1,MOD(RC1+3,2)+MOD(INT((RC1+3)/2),3)*5+1,FALSE) -> 161|100|101|130|131 | H222: =HLOOKUP(Sheet1!R2C1,Sheet1!R2C1:R16C1,MOD(RC1+2,2)+MOD(INT((RC1+2)/2),3)*5+1,FALSE)&"|"&HLOOKUP(Sheet1!R2C1,Sheet1!R2C1:R16C1,MOD(RC1+3,2)+MOD(INT((RC1+3)/2),3)*5+1,FALSE)&"|"&HLOOKUP(Sheet1!R2C1,Sheet1!R2C1:R16C1,MOD(RC1+4,2)+MOD(INT((RC1+4)/2),3)*5+1,FALSE)&"|"&HLOOKUP(Sheet1!R2C1,Sheet1!R2C1:R16C1,MOD(RC1+5,2)+MOD(INT((RC1+5)/2),3)*5+1,FALSE)&"|"&HLOOKUP(Sheet1!R2C1,Sheet1!R2C1:R16C1,MOD(RC1+6,2)+MOD(INT((RC1+6)/2),3)*5+1,FALSE) -> 130|131|160|161|100 | I222: =HLOOKUP(Sheet1!R2C1,Sheet1!R2C1:R16C1,MOD(RC1-1,3)+MOD(INT((RC1-1)/3),3)*5+3,FALSE)&"|"&HLOOKUP(Sheet1!R2C1,Sheet1!R2C1:R16C1,MOD(RC1,3)+MOD(INT((RC1)/3),3)*5+3,FALSE)&"|"&HLOOKUP(Sheet1!R2C1,Sheet1!R2C1:R16C1,MOD(RC1+1,3)+MOD(INT((RC1+1)/3),3)*5+3,FALSE)&"|"&HLOOKUP(Sheet1!R2C1,Sheet1!R2C1:R16C1,MOD(RC1+2,3)+MOD(INT((RC1+2)/3),3)*5+3,FALSE)&"|"&HLOOKUP(Sheet1!R2C1,Sheet1!R2C1:R16C1,MOD(RC1+3,3)+MOD(INT((RC1+3)/3),3)*5+3,FALSE) -> 164|102|103|104|132 | J222: =HLOOKUP(Sheet1!R2C1,Sheet1!R2C1:R16C1,MOD(RC1-1,3)+MOD(INT((RC1-1)/3),3)*5+3,FALSE)&"|"&HLOOKUP(Sheet1!R2C1,Sheet1!R2C1:R16C1,MOD(RC1,3)+MOD(INT((RC1)/3),3)*5+3,FALSE)&"|"&HLOOKUP(Sheet1!R2C1,Sheet1!R2C1:R16C1,MOD(RC1+1,3)+MOD(INT((RC1+1)/3),3)*5+3,FALSE)&"|"&HLOOKUP(Sheet1!R2C1,Sheet1!R2C1:R16C1,MOD(RC1+2,3)+MOD(INT((RC1+2)/3),3)*5+3,FALSE)&"|"&HLOOKUP(Sheet1!R2C1,Sheet1!R2C1:R16C1,MOD(RC1+3,3)+MOD(INT((RC1+3)/3),3)*5+3,FALSE) -> 164|102|103|104|132 | K222: =HLOOKUP(Sheet1!R2C1,Sheet1!R2C1:R16C1,MOD(RC1-1,3)+MOD(INT((RC1-1)/3),3)*5+3,FALSE)&"|"&HLOOKUP(Sheet1!R2C1,Sheet1!R2C1:R16C1,MOD(RC1,3)+MOD(INT((RC1)/3),3)*5+3,FALSE)&"|"&HLOOKUP(Sheet1!R2C1,Sheet1!R2C1:R16C1,MOD(RC1+1,3)+MOD(INT((RC1+1)/3),3)*5+3,FALSE)&"|"&HLOOKUP(Sheet1!R2C1,Sheet1!R2C1:R16C1,MOD(RC1+2,3)+MOD(INT((RC1+2)/3),3)*5+3,FALSE)&"|"&HLOOKUP(Sheet1!R2C1,Sheet1!R2C1:R16C1,MOD(RC1+3,3)+MOD(INT((RC1+3)/3),3)*5+3,FALSE) -> 164|102|103|104|132 | L222: 25|22|23|24 | M222: 1211886|1211885|1211885|1211885 | N222: 10030|10031|10032|10033 | O222: 1|1|1|1 | P222: 2500|2500|2500|2500
A223: 217 | B223: 215 | C223: 30 | D223: =R[-20]C+2 -> 40 | E223: 1000 | F223: =MOD(RC[-5]-1,3)*30+100&"|"&MOD(RC[-5]-1,3)*30+101&"|"&MOD(RC[-5]-1,3)*30+102&"|"&MOD(RC[-5]-1,3)*30+103&"|"&IF(MOD(RC[-5],4)=0,HLOOKUP(Sheet1!R2C10,Sheet1!R2C10:R7C10,MOD(RC[-5]/4-1,6)+1,FALSE),IF(MOD(RC[-5],2)=0,IF(RC[-5]>20,HLOOKUP(Sheet1!R2C7,Sheet1!R2C7:R43C7,MOD(RC[-5]/2-1,42)+1,FALSE),HLOOKUP(Sheet1!R2C4,Sheet1!R2C4:R7C4,MOD(RC[-5]-1,6)+1,FALSE)),MOD(RC[-5]-1,3)*30+104)) -> 100|101|102|103|104 | G223: =HLOOKUP(Sheet1!R2C1,Sheet1!R2C1:R16C1,MOD(RC1-1,2)+MOD(INT((RC1-1)/2),3)*5+1,FALSE)&"|"&HLOOKUP(Sheet1!R2C1,Sheet1!R2C1:R16C1,MOD(RC1,2)+MOD(INT((RC1)/2),3)*5+1,FALSE)&"|"&HLOOKUP(Sheet1!R2C1,Sheet1!R2C1:R16C1,MOD(RC1+1,2)+MOD(INT((RC1+1)/2),3)*5+1,FALSE)&"|"&HLOOKUP(Sheet1!R2C1,Sheet1!R2C1:R16C1,MOD(RC1+2,2)+MOD(INT((RC1+2)/2),3)*5+1,FALSE)&"|"&HLOOKUP(Sheet1!R2C1,Sheet1!R2C1:R16C1,MOD(RC1+3,2)+MOD(INT((RC1+3)/2),3)*5+1,FALSE) -> 100|101|130|131|160 | H223: =HLOOKUP(Sheet1!R2C1,Sheet1!R2C1:R16C1,MOD(RC1+2,2)+MOD(INT((RC1+2)/2),3)*5+1,FALSE)&"|"&HLOOKUP(Sheet1!R2C1,Sheet1!R2C1:R16C1,MOD(RC1+3,2)+MOD(INT((RC1+3)/2),3)*5+1,FALSE)&"|"&HLOOKUP(Sheet1!R2C1,Sheet1!R2C1:R16C1,MOD(RC1+4,2)+MOD(INT((RC1+4)/2),3)*5+1,FALSE)&"|"&HLOOKUP(Sheet1!R2C1,Sheet1!R2C1:R16C1,MOD(RC1+5,2)+MOD(INT((RC1+5)/2),3)*5+1,FALSE)&"|"&HLOOKUP(Sheet1!R2C1,Sheet1!R2C1:R16C1,MOD(RC1+6,2)+MOD(INT((RC1+6)/2),3)*5+1,FALSE) -> 131|160|161|100|101 | I223: =HLOOKUP(Sheet1!R2C1,Sheet1!R2C1:R16C1,MOD(RC1-1,3)+MOD(INT((RC1-1)/3),3)*5+3,FALSE)&"|"&HLOOKUP(Sheet1!R2C1,Sheet1!R2C1:R16C1,MOD(RC1,3)+MOD(INT((RC1)/3),3)*5+3,FALSE)&"|"&HLOOKUP(Sheet1!R2C1,Sheet1!R2C1:R16C1,MOD(RC1+1,3)+MOD(INT((RC1+1)/3),3)*5+3,FALSE)&"|"&HLOOKUP(Sheet1!R2C1,Sheet1!R2C1:R16C1,MOD(RC1+2,3)+MOD(INT((RC1+2)/3),3)*5+3,FALSE)&"|"&HLOOKUP(Sheet1!R2C1,Sheet1!R2C1:R16C1,MOD(RC1+3,3)+MOD(INT((RC1+3)/3),3)*5+3,FALSE) -> 102|103|104|132|133 | J223: =HLOOKUP(Sheet1!R2C1,Sheet1!R2C1:R16C1,MOD(RC1-1,3)+MOD(INT((RC1-1)/3),3)*5+3,FALSE)&"|"&HLOOKUP(Sheet1!R2C1,Sheet1!R2C1:R16C1,MOD(RC1,3)+MOD(INT((RC1)/3),3)*5+3,FALSE)&"|"&HLOOKUP(Sheet1!R2C1,Sheet1!R2C1:R16C1,MOD(RC1+1,3)+MOD(INT((RC1+1)/3),3)*5+3,FALSE)&"|"&HLOOKUP(Sheet1!R2C1,Sheet1!R2C1:R16C1,MOD(RC1+2,3)+MOD(INT((RC1+2)/3),3)*5+3,FALSE)&"|"&HLOOKUP(Sheet1!R2C1,Sheet1!R2C1:R16C1,MOD(RC1+3,3)+MOD(INT((RC1+3)/3),3)*5+3,FALSE) -> 102|103|104|132|133 | K223: =HLOOKUP(Sheet1!R2C1,Sheet1!R2C1:R16C1,MOD(RC1-1,3)+MOD(INT((RC1-1)/3),3)*5+3,FALSE)&"|"&HLOOKUP(Sheet1!R2C1,Sheet1!R2C1:R16C1,MOD(RC1,3)+MOD(INT((RC1)/3),3)*5+3,FALSE)&"|"&HLOOKUP(Sheet1!R2C1,Sheet1!R2C1:R16C1,MOD(RC1+1,3)+MOD(INT((RC1+1)/3),3)*5+3,FALSE)&"|"&HLOOKUP(Sheet1!R2C1,Sheet1!R2C1:R16C1,MOD(RC1+2,3)+MOD(INT((RC1+2)/3),3)*5+3,FALSE)&"|"&HLOOKUP(Sheet1!R2C1,Sheet1!R2C1:R16C1,MOD(RC1+3,3)+MOD(INT((RC1+3)/3),3)*5+3,FALSE) -> 102|103|104|132|133 | L223: 25|22|23|24 | M223: 1231778|1231779|1231778|1231778 | N223: 10030|10031|10032|10033 | O223: 1|1|1|1 | P223: 2500|2500|2500|2500
A224: 218 | B224: 216 | C224: 30 | D224: =R[-20]C+2 -> 40 | E224: 1000 | F224: =MOD(RC[-5]-1,3)*30+100&"|"&MOD(RC[-5]-1,3)*30+101&"|"&MOD(RC[-5]-1,3)*30+102&"|"&MOD(RC[-5]-1,3)*30+103&"|"&IF(MOD(RC[-5],4)=0,HLOOKUP(Sheet1!R2C10,Sheet1!R2C10:R7C10,MOD(RC[-5]/4-1,6)+1,FALSE),IF(MOD(RC[-5],2)=0,IF(RC[-5]>20,HLOOKUP(Sheet1!R2C7,Sheet1!R2C7:R43C7,MOD(RC[-5]/2-1,42)+1,FALSE),HLOOKUP(Sheet1!R2C4,Sheet1!R2C4:R7C4,MOD(RC[-5]-1,6)+1,FALSE)),MOD(RC[-5]-1,3)*30+104)) -> 130|131|132|133|152 | G224: =HLOOKUP(Sheet1!R2C1,Sheet1!R2C1:R16C1,MOD(RC1-1,2)+MOD(INT((RC1-1)/2),3)*5+1,FALSE)&"|"&HLOOKUP(Sheet1!R2C1,Sheet1!R2C1:R16C1,MOD(RC1,2)+MOD(INT((RC1)/2),3)*5+1,FALSE)&"|"&HLOOKUP(Sheet1!R2C1,Sheet1!R2C1:R16C1,MOD(RC1+1,2)+MOD(INT((RC1+1)/2),3)*5+1,FALSE)&"|"&HLOOKUP(Sheet1!R2C1,Sheet1!R2C1:R16C1,MOD(RC1+2,2)+MOD(INT((RC1+2)/2),3)*5+1,FALSE)&"|"&HLOOKUP(Sheet1!R2C1,Sheet1!R2C1:R16C1,MOD(RC1+3,2)+MOD(INT((RC1+3)/2),3)*5+1,FALSE) -> 101|130|131|160|161 | H224: =HLOOKUP(Sheet1!R2C1,Sheet1!R2C1:R16C1,MOD(RC1+2,2)+MOD(INT((RC1+2)/2),3)*5+1,FALSE)&"|"&HLOOKUP(Sheet1!R2C1,Sheet1!R2C1:R16C1,MOD(RC1+3,2)+MOD(INT((RC1+3)/2),3)*5+1,FALSE)&"|"&HLOOKUP(Sheet1!R2C1,Sheet1!R2C1:R16C1,MOD(RC1+4,2)+MOD(INT((RC1+4)/2),3)*5+1,FALSE)&"|"&HLOOKUP(Sheet1!R2C1,Sheet1!R2C1:R16C1,MOD(RC1+5,2)+MOD(INT((RC1+5)/2),3)*5+1,FALSE)&"|"&HLOOKUP(Sheet1!R2C1,Sheet1!R2C1:R16C1,MOD(RC1+6,2)+MOD(INT((RC1+6)/2),3)*5+1,FALSE) -> 160|161|100|101|130 | I224: =HLOOKUP(Sheet1!R2C1,Sheet1!R2C1:R16C1,MOD(RC1-1,3)+MOD(INT((RC1-1)/3),3)*5+3,FALSE)&"|"&HLOOKUP(Sheet1!R2C1,Sheet1!R2C1:R16C1,MOD(RC1,3)+MOD(INT((RC1)/3),3)*5+3,FALSE)&"|"&HLOOKUP(Sheet1!R2C1,Sheet1!R2C1:R16C1,MOD(RC1+1,3)+MOD(INT((RC1+1)/3),3)*5+3,FALSE)&"|"&HLOOKUP(Sheet1!R2C1,Sheet1!R2C1:R16C1,MOD(RC1+2,3)+MOD(INT((RC1+2)/3),3)*5+3,FALSE)&"|"&HLOOKUP(Sheet1!R2C1,Sheet1!R2C1:R16C1,MOD(RC1+3,3)+MOD(INT((RC1+3)/3),3)*5+3,FALSE) -> 103|104|132|133|134 | J224: =HLOOKUP(Sheet1!R2C1,Sheet1!R2C1:R16C1,MOD(RC1-1,3)+MOD(INT((RC1-1)/3),3)*5+3,FALSE)&"|"&HLOOKUP(Sheet1!R2C1,Sheet1!R2C1:R16C1,MOD(RC1,3)+MOD(INT((RC1)/3),3)*5+3,FALSE)&"|"&HLOOKUP(Sheet1!R2C1,Sheet1!R2C1:R16C1,MOD(RC1+1,3)+MOD(INT((RC1+1)/3),3)*5+3,FALSE)&"|"&HLOOKUP(Sheet1!R2C1,Sheet1!R2C1:R16C1,MOD(RC1+2,3)+MOD(INT((RC1+2)/3),3)*5+3,FALSE)&"|"&HLOOKUP(Sheet1!R2C1,Sheet1!R2C1:R16C1,MOD(RC1+3,3)+MOD(INT((RC1+3)/3),3)*5+3,FALSE) -> 103|104|132|133|134 | K224: =HLOOKUP(Sheet1!R2C1,Sheet1!R2C1:R16C1,MOD(RC1-1,3)+MOD(INT((RC1-1)/3),3)*5+3,FALSE)&"|"&HLOOKUP(Sheet1!R2C1,Sheet1!R2C1:R16C1,MOD(RC1,3)+MOD(INT((RC1)/3),3)*5+3,FALSE)&"|"&HLOOKUP(Sheet1!R2C1,Sheet1!R2C1:R16C1,MOD(RC1+1,3)+MOD(INT((RC1+1)/3),3)*5+3,FALSE)&"|"&HLOOKUP(Sheet1!R2C1,Sheet1!R2C1:R16C1,MOD(RC1+2,3)+MOD(INT((RC1+2)/3),3)*5+3,FALSE)&"|"&HLOOKUP(Sheet1!R2C1,Sheet1!R2C1:R16C1,MOD(RC1+3,3)+MOD(INT((RC1+3)/3),3)*5+3,FALSE) -> 103|104|132|133|134 | L224: 25|22|23|24 | M224: 1244478|1244479|1244478|1244478 | N224: 10030|10031|10032|10033 | O224: 1|1|1|1 | P224: 2500|2500|2500|2500
A225: 219 | B225: 217 | C225: 30 | D225: =R[-20]C+2 -> 40 | E225: 1000 | F225: =MOD(RC[-5]-1,3)*30+100&"|"&MOD(RC[-5]-1,3)*30+101&"|"&MOD(RC[-5]-1,3)*30+102&"|"&MOD(RC[-5]-1,3)*30+103&"|"&IF(MOD(RC[-5],4)=0,HLOOKUP(Sheet1!R2C10,Sheet1!R2C10:R7C10,MOD(RC[-5]/4-1,6)+1,FALSE),IF(MOD(RC[-5],2)=0,IF(RC[-5]>20,HLOOKUP(Sheet1!R2C7,Sheet1!R2C7:R43C7,MOD(RC[-5]/2-1,42)+1,FALSE),HLOOKUP(Sheet1!R2C4,Sheet1!R2C4:R7C4,MOD(RC[-5]-1,6)+1,FALSE)),MOD(RC[-5]-1,3)*30+104)) -> 160|161|162|163|164 | G225: =HLOOKUP(Sheet1!R2C1,Sheet1!R2C1:R16C1,MOD(RC1-1,2)+MOD(INT((RC1-1)/2),3)*5+1,FALSE)&"|"&HLOOKUP(Sheet1!R2C1,Sheet1!R2C1:R16C1,MOD(RC1,2)+MOD(INT((RC1)/2),3)*5+1,FALSE)&"|"&HLOOKUP(Sheet1!R2C1,Sheet1!R2C1:R16C1,MOD(RC1+1,2)+MOD(INT((RC1+1)/2),3)*5+1,FALSE)&"|"&HLOOKUP(Sheet1!R2C1,Sheet1!R2C1:R16C1,MOD(RC1+2,2)+MOD(INT((RC1+2)/2),3)*5+1,FALSE)&"|"&HLOOKUP(Sheet1!R2C1,Sheet1!R2C1:R16C1,MOD(RC1+3,2)+MOD(INT((RC1+3)/2),3)*5+1,FALSE) -> 130|131|160|161|100 | H225: =HLOOKUP(Sheet1!R2C1,Sheet1!R2C1:R16C1,MOD(RC1+2,2)+MOD(INT((RC1+2)/2),3)*5+1,FALSE)&"|"&HLOOKUP(Sheet1!R2C1,Sheet1!R2C1:R16C1,MOD(RC1+3,2)+MOD(INT((RC1+3)/2),3)*5+1,FALSE)&"|"&HLOOKUP(Sheet1!R2C1,Sheet1!R2C1:R16C1,MOD(RC1+4,2)+MOD(INT((RC1+4)/2),3)*5+1,FALSE)&"|"&HLOOKUP(Sheet1!R2C1,Sheet1!R2C1:R16C1,MOD(RC1+5,2)+MOD(INT((RC1+5)/2),3)*5+1,FALSE)&"|"&HLOOKUP(Sheet1!R2C1,Sheet1!R2C1:R16C1,MOD(RC1+6,2)+MOD(INT((RC1+6)/2),3)*5+1,FALSE) -> 161|100|101|130|131 | I225: =HLOOKUP(Sheet1!R2C1,Sheet1!R2C1:R16C1,MOD(RC1-1,3)+MOD(INT((RC1-1)/3),3)*5+3,FALSE)&"|"&HLOOKUP(Sheet1!R2C1,Sheet1!R2C1:R16C1,MOD(RC1,3)+MOD(INT((RC1)/3),3)*5+3,FALSE)&"|"&HLOOKUP(Sheet1!R2C1,Sheet1!R2C1:R16C1,MOD(RC1+1,3)+MOD(INT((RC1+1)/3),3)*5+3,FALSE)&"|"&HLOOKUP(Sheet1!R2C1,Sheet1!R2C1:R16C1,MOD(RC1+2,3)+MOD(INT((RC1+2)/3),3)*5+3,FALSE)&"|"&HLOOKUP(Sheet1!R2C1,Sheet1!R2C1:R16C1,MOD(RC1+3,3)+MOD(INT((RC1+3)/3),3)*5+3,FALSE) -> 104|132|133|134|162 | J225: =HLOOKUP(Sheet1!R2C1,Sheet1!R2C1:R16C1,MOD(RC1-1,3)+MOD(INT((RC1-1)/3),3)*5+3,FALSE)&"|"&HLOOKUP(Sheet1!R2C1,Sheet1!R2C1:R16C1,MOD(RC1,3)+MOD(INT((RC1)/3),3)*5+3,FALSE)&"|"&HLOOKUP(Sheet1!R2C1,Sheet1!R2C1:R16C1,MOD(RC1+1,3)+MOD(INT((RC1+1)/3),3)*5+3,FALSE)&"|"&HLOOKUP(Sheet1!R2C1,Sheet1!R2C1:R16C1,MOD(RC1+2,3)+MOD(INT((RC1+2)/3),3)*5+3,FALSE)&"|"&HLOOKUP(Sheet1!R2C1,Sheet1!R2C1:R16C1,MOD(RC1+3,3)+MOD(INT((RC1+3)/3),3)*5+3,FALSE) -> 104|132|133|134|162 | K225: =HLOOKUP(Sheet1!R2C1,Sheet1!R2C1:R16C1,MOD(RC1-1,3)+MOD(INT((RC1-1)/3),3)*5+3,FALSE)&"|"&HLOOKUP(Sheet1!R2C1,Sheet1!R2C1:R16C1,MOD(RC1,3)+MOD(INT((RC1)/3),3)*5+3,FALSE)&"|"&HLOOKUP(Sheet1!R2C1,Sheet1!R2C1:R16C1,MOD(RC1+1,3)+MOD(INT((RC1+1)/3),3)*5+3,FALSE)&"|"&HLOOKUP(Sheet1!R2C1,Sheet1!R2C1:R16C1,MOD(RC1+2,3)+MOD(INT((RC1+2)/3),3)*5+3,FALSE)&"|"&HLOOKUP(Sheet1!R2C1,Sheet1!R2C1:R16C1,MOD(RC1+3,3)+MOD(INT((RC1+3)/3),3)*5+3,FALSE) -> 104|132|133|134|162 | L225: 25|22|23|24 | M225: 1256902|1256901|1256903|1256903 | N225: 10030|10031|10032|10033 | O225: 1|1|1|1 | P225: 2500|2500|2500|2500
A226: 220 | B226: 218 | C226: 30 | D226: =R[-20]C+2 -> 40 | E226: 1000 | F226: =MOD(RC[-5]-1,3)*30+100&"|"&MOD(RC[-5]-1,3)*30+101&"|"&MOD(RC[-5]-1,3)*30+102&"|"&MOD(RC[-5]-1,3)*30+103&"|"&IF(MOD(RC[-5],4)=0,HLOOKUP(Sheet1!R2C10,Sheet1!R2C10:R7C10,MOD(RC[-5]/4-1,6)+1,FALSE),IF(MOD(RC[-5],2)=0,IF(RC[-5]>20,HLOOKUP(Sheet1!R2C7,Sheet1!R2C7:R43C7,MOD(RC[-5]/2-1,42)+1,FALSE),HLOOKUP(Sheet1!R2C4,Sheet1!R2C4:R7C4,MOD(RC[-5]-1,6)+1,FALSE)),MOD(RC[-5]-1,3)*30+104)) -> 100|101|102|103|190 | G226: =HLOOKUP(Sheet1!R2C1,Sheet1!R2C1:R16C1,MOD(RC1-1,2)+MOD(INT((RC1-1)/2),3)*5+1,FALSE)&"|"&HLOOKUP(Sheet1!R2C1,Sheet1!R2C1:R16C1,MOD(RC1,2)+MOD(INT((RC1)/2),3)*5+1,FALSE)&"|"&HLOOKUP(Sheet1!R2C1,Sheet1!R2C1:R16C1,MOD(RC1+1,2)+MOD(INT((RC1+1)/2),3)*5+1,FALSE)&"|"&HLOOKUP(Sheet1!R2C1,Sheet1!R2C1:R16C1,MOD(RC1+2,2)+MOD(INT((RC1+2)/2),3)*5+1,FALSE)&"|"&HLOOKUP(Sheet1!R2C1,Sheet1!R2C1:R16C1,MOD(RC1+3,2)+MOD(INT((RC1+3)/2),3)*5+1,FALSE) -> 131|160|161|100|101 | H226: =HLOOKUP(Sheet1!R2C1,Sheet1!R2C1:R16C1,MOD(RC1+2,2)+MOD(INT((RC1+2)/2),3)*5+1,FALSE)&"|"&HLOOKUP(Sheet1!R2C1,Sheet1!R2C1:R16C1,MOD(RC1+3,2)+MOD(INT((RC1+3)/2),3)*5+1,FALSE)&"|"&HLOOKUP(Sheet1!R2C1,Sheet1!R2C1:R16C1,MOD(RC1+4,2)+MOD(INT((RC1+4)/2),3)*5+1,FALSE)&"|"&HLOOKUP(Sheet1!R2C1,Sheet1!R2C1:R16C1,MOD(RC1+5,2)+MOD(INT((RC1+5)/2),3)*5+1,FALSE)&"|"&HLOOKUP(Sheet1!R2C1,Sheet1!R2C1:R16C1,MOD(RC1+6,2)+MOD(INT((RC1+6)/2),3)*5+1,FALSE) -> 100|101|130|131|160 | I226: =HLOOKUP(Sheet1!R2C1,Sheet1!R2C1:R16C1,MOD(RC1-1,3)+MOD(INT((RC1-1)/3),3)*5+3,FALSE)&"|"&HLOOKUP(Sheet1!R2C1,Sheet1!R2C1:R16C1,MOD(RC1,3)+MOD(INT((RC1)/3),3)*5+3,FALSE)&"|"&HLOOKUP(Sheet1!R2C1,Sheet1!R2C1:R16C1,MOD(RC1+1,3)+MOD(INT((RC1+1)/3),3)*5+3,FALSE)&"|"&HLOOKUP(Sheet1!R2C1,Sheet1!R2C1:R16C1,MOD(RC1+2,3)+MOD(INT((RC1+2)/3),3)*5+3,FALSE)&"|"&HLOOKUP(Sheet1!R2C1,Sheet1!R2C1:R16C1,MOD(RC1+3,3)+MOD(INT((RC1+3)/3),3)*5+3,FALSE) -> 132|133|134|162|163 | J226: =HLOOKUP(Sheet1!R2C1,Sheet1!R2C1:R16C1,MOD(RC1-1,3)+MOD(INT((RC1-1)/3),3)*5+3,FALSE)&"|"&HLOOKUP(Sheet1!R2C1,Sheet1!R2C1:R16C1,MOD(RC1,3)+MOD(INT((RC1)/3),3)*5+3,FALSE)&"|"&HLOOKUP(Sheet1!R2C1,Sheet1!R2C1:R16C1,MOD(RC1+1,3)+MOD(INT((RC1+1)/3),3)*5+3,FALSE)&"|"&HLOOKUP(Sheet1!R2C1,Sheet1!R2C1:R16C1,MOD(RC1+2,3)+MOD(INT((RC1+2)/3),3)*5+3,FALSE)&"|"&HLOOKUP(Sheet1!R2C1,Sheet1!R2C1:R16C1,MOD(RC1+3,3)+MOD(INT((RC1+3)/3),3)*5+3,FALSE) -> 132|133|134|162|163 | K226: =HLOOKUP(Sheet1!R2C1,Sheet1!R2C1:R16C1,MOD(RC1-1,3)+MOD(INT((RC1-1)/3),3)*5+3,FALSE)&"|"&HLOOKUP(Sheet1!R2C1,Sheet1!R2C1:R16C1,MOD(RC1,3)+MOD(INT((RC1)/3),3)*5+3,FALSE)&"|"&HLOOKUP(Sheet1!R2C1,Sheet1!R2C1:R16C1,MOD(RC1+1,3)+MOD(INT((RC1+1)/3),3)*5+3,FALSE)&"|"&HLOOKUP(Sheet1!R2C1,Sheet1!R2C1:R16C1,MOD(RC1+2,3)+MOD(INT((RC1+2)/3),3)*5+3,FALSE)&"|"&HLOOKUP(Sheet1!R2C1,Sheet1!R2C1:R16C1,MOD(RC1+3,3)+MOD(INT((RC1+3)/3),3)*5+3,FALSE) -> 132|133|134|162|163 | L226: 25|22|23|24 | M226: 1269785|1269785|1269785|1269785 | N226: 10030|10031|10032|10033|10030|10031|10032|10033|10030|10031|10032|10033|10030|10031|10032|10033|10030|10031|10032|10033|10030|10031|10032|10033|10030|10031|10032|10033|10030|10031|10032|10033|10030|10031|10032|10033|10030|10031|10032|10033 | O226: 1|1|1|1|1|1|1|1|1|1|1|1|1|1|1|1|1|1|1|1|1|1|1|1|1|1|1|1|1|1|1|1|1|1|1|1|1|1|1|1 | P226: 2500|2500|2500|2500|2500|2500|2500|2500|2500|2500|2500|2500|2500|2500|2500|2500|2500|2500|2500|2500|2500|2500|2500|2500|2500|2500|2500|2500|2500|2500|2500|2500|2500|2500|2500|2500|2500|2500|2500|2500
A227: 221 | B227: 219 | C227: 30 | D227: =R[-20]C+2 -> 42 | E227: 1000 | F227: =MOD(RC[-5]-1,3)*30+100&"|"&MOD(RC[-5]-1,3)*30+101&"|"&MOD(RC[-5]-1,3)*30+102&"|"&MOD(RC[-5]-1,3)*30+103&"|"&IF(MOD(RC[-5],4)=0,HLOOKUP(Sheet1!R2C10,Sheet1!R2C10:R7C10,MOD(RC[-5]/4-1,6)+1,FALSE),IF(MOD(RC[-5],2)=0,IF(RC[-5]>20,HLOOKUP(Sheet1!R2C7,Sheet1!R2C7:R43C7,MOD(RC[-5]/2-1,42)+1,FALSE),HLOOKUP(Sheet1!R2C4,Sheet1!R2C4:R7C4,MOD(RC[-5]-1,6)+1,FALSE)),MOD(RC[-5]-1,3)*30+104)) -> 130|131|132|133|134 | G227: =HLOOKUP(Sheet1!R2C1,Sheet1!R2C1:R16C1,MOD(RC1-1,2)+MOD(INT((RC1-1)/2),3)*5+1,FALSE)&"|"&HLOOKUP(Sheet1!R2C1,Sheet1!R2C1:R16C1,MOD(RC1,2)+MOD(INT((RC1)/2),3)*5+1,FALSE)&"|"&HLOOKUP(Sheet1!R2C1,Sheet1!R2C1:R16C1,MOD(RC1+1,2)+MOD(INT((RC1+1)/2),3)*5+1,FALSE)&"|"&HLOOKUP(Sheet1!R2C1,Sheet1!R2C1:R16C1,MOD(RC1+2,2)+MOD(INT((RC1+2)/2),3)*5+1,FALSE)&"|"&HLOOKUP(Sheet1!R2C1,Sheet1!R2C1:R16C1,MOD(RC1+3,2)+MOD(INT((RC1+3)/2),3)*5+1,FALSE) -> 160|161|100|101|130 | H227: =HLOOKUP(Sheet1!R2C1,Sheet1!R2C1:R16C1,MOD(RC1+2,2)+MOD(INT((RC1+2)/2),3)*5+1,FALSE)&"|"&HLOOKUP(Sheet1!R2C1,Sheet1!R2C1:R16C1,MOD(RC1+3,2)+MOD(INT((RC1+3)/2),3)*5+1,FALSE)&"|"&HLOOKUP(Sheet1!R2C1,Sheet1!R2C1:R16C1,MOD(RC1+4,2)+MOD(INT((RC1+4)/2),3)*5+1,FALSE)&"|"&HLOOKUP(Sheet1!R2C1,Sheet1!R2C1:R16C1,MOD(RC1+5,2)+MOD(INT((RC1+5)/2),3)*5+1,FALSE)&"|"&HLOOKUP(Sheet1!R2C1,Sheet1!R2C1:R16C1,MOD(RC1+6,2)+MOD(INT((RC1+6)/2),3)*5+1,FALSE) -> 101|130|131|160|161 | I227: =HLOOKUP(Sheet1!R2C1,Sheet1!R2C1:R16C1,MOD(RC1-1,3)+MOD(INT((RC1-1)/3),3)*5+3,FALSE)&"|"&HLOOKUP(Sheet1!R2C1,Sheet1!R2C1:R16C1,MOD(RC1,3)+MOD(INT((RC1)/3),3)*5+3,FALSE)&"|"&HLOOKUP(Sheet1!R2C1,Sheet1!R2C1:R16C1,MOD(RC1+1,3)+MOD(INT((RC1+1)/3),3)*5+3,FALSE)&"|"&HLOOKUP(Sheet1!R2C1,Sheet1!R2C1:R16C1,MOD(RC1+2,3)+MOD(INT((RC1+2)/3),3)*5+3,FALSE)&"|"&HLOOKUP(Sheet1!R2C1,Sheet1!R2C1:R16C1,MOD(RC1+3,3)+MOD(INT((RC1+3)/3),3)*5+3,FALSE) -> 133|134|162|163|164 | J227: =HLOOKUP(Sheet1!R2C1,Sheet1!R2C1:R16C1,MOD(RC1-1,3)+MOD(INT((RC1-1)/3),3)*5+3,FALSE)&"|"&HLOOKUP(Sheet1!R2C1,Sheet1!R2C1:R16C1,MOD(RC1,3)+MOD(INT((RC1)/3),3)*5+3,FALSE)&"|"&HLOOKUP(Sheet1!R2C1,Sheet1!R2C1:R16C1,MOD(RC1+1,3)+MOD(INT((RC1+1)/3),3)*5+3,FALSE)&"|"&HLOOKUP(Sheet1!R2C1,Sheet1!R2C1:R16C1,MOD(RC1+2,3)+MOD(INT((RC1+2)/3),3)*5+3,FALSE)&"|"&HLOOKUP(Sheet1!R2C1,Sheet1!R2C1:R16C1,MOD(RC1+3,3)+MOD(INT((RC1+3)/3),3)*5+3,FALSE) -> 133|134|162|163|164 | K227: =HLOOKUP(Sheet1!R2C1,Sheet1!R2C1:R16C1,MOD(RC1-1,3)+MOD(INT((RC1-1)/3),3)*5+3,FALSE)&"|"&HLOOKUP(Sheet1!R2C1,Sheet1!R2C1:R16C1,MOD(RC1,3)+MOD(INT((RC1)/3),3)*5+3,FALSE)&"|"&HLOOKUP(Sheet1!R2C1,Sheet1!R2C1:R16C1,MOD(RC1+1,3)+MOD(INT((RC1+1)/3),3)*5+3,FALSE)&"|"&HLOOKUP(Sheet1!R2C1,Sheet1!R2C1:R16C1,MOD(RC1+2,3)+MOD(INT((RC1+2)/3),3)*5+3,FALSE)&"|"&HLOOKUP(Sheet1!R2C1,Sheet1!R2C1:R16C1,MOD(RC1+3,3)+MOD(INT((RC1+3)/3),3)*5+3,FALSE) -> 133|134|162|163|164 | L227: 25|22|23|24 | M227: 1282403|1282403|1282403|1282403 | N227: 10030|10031|10032|10033 | O227: 1|1|1|1 | P227: 2500|2500|2500|2500
A228: 222 | B228: 220 | C228: 30 | D228: =R[-20]C+2 -> 42 | E228: 1000 | F228: =MOD(RC[-5]-1,3)*30+100&"|"&MOD(RC[-5]-1,3)*30+101&"|"&MOD(RC[-5]-1,3)*30+102&"|"&MOD(RC[-5]-1,3)*30+103&"|"&IF(MOD(RC[-5],4)=0,HLOOKUP(Sheet1!R2C10,Sheet1!R2C10:R7C10,MOD(RC[-5]/4-1,6)+1,FALSE),IF(MOD(RC[-5],2)=0,IF(RC[-5]>20,HLOOKUP(Sheet1!R2C7,Sheet1!R2C7:R43C7,MOD(RC[-5]/2-1,42)+1,FALSE),HLOOKUP(Sheet1!R2C4,Sheet1!R2C4:R7C4,MOD(RC[-5]-1,6)+1,FALSE)),MOD(RC[-5]-1,3)*30+104)) -> 160|161|162|163|154 | G228: =HLOOKUP(Sheet1!R2C1,Sheet1!R2C1:R16C1,MOD(RC1-1,2)+MOD(INT((RC1-1)/2),3)*5+1,FALSE)&"|"&HLOOKUP(Sheet1!R2C1,Sheet1!R2C1:R16C1,MOD(RC1,2)+MOD(INT((RC1)/2),3)*5+1,FALSE)&"|"&HLOOKUP(Sheet1!R2C1,Sheet1!R2C1:R16C1,MOD(RC1+1,2)+MOD(INT((RC1+1)/2),3)*5+1,FALSE)&"|"&HLOOKUP(Sheet1!R2C1,Sheet1!R2C1:R16C1,MOD(RC1+2,2)+MOD(INT((RC1+2)/2),3)*5+1,FALSE)&"|"&HLOOKUP(Sheet1!R2C1,Sheet1!R2C1:R16C1,MOD(RC1+3,2)+MOD(INT((RC1+3)/2),3)*5+1,FALSE) -> 161|100|101|130|131 | H228: =HLOOKUP(Sheet1!R2C1,Sheet1!R2C1:R16C1,MOD(RC1+2,2)+MOD(INT((RC1+2)/2),3)*5+1,FALSE)&"|"&HLOOKUP(Sheet1!R2C1,Sheet1!R2C1:R16C1,MOD(RC1+3,2)+MOD(INT((RC1+3)/2),3)*5+1,FALSE)&"|"&HLOOKUP(Sheet1!R2C1,Sheet1!R2C1:R16C1,MOD(RC1+4,2)+MOD(INT((RC1+4)/2),3)*5+1,FALSE)&"|"&HLOOKUP(Sheet1!R2C1,Sheet1!R2C1:R16C1,MOD(RC1+5,2)+MOD(INT((RC1+5)/2),3)*5+1,FALSE)&"|"&HLOOKUP(Sheet1!R2C1,Sheet1!R2C1:R16C1,MOD(RC1+6,2)+MOD(INT((RC1+6)/2),3)*5+1,FALSE) -> 130|131|160|161|100 | I228: =HLOOKUP(Sheet1!R2C1,Sheet1!R2C1:R16C1,MOD(RC1-1,3)+MOD(INT((RC1-1)/3),3)*5+3,FALSE)&"|"&HLOOKUP(Sheet1!R2C1,Sheet1!R2C1:R16C1,MOD(RC1,3)+MOD(INT((RC1)/3),3)*5+3,FALSE)&"|"&HLOOKUP(Sheet1!R2C1,Sheet1!R2C1:R16C1,MOD(RC1+1,3)+MOD(INT((RC1+1)/3),3)*5+3,FALSE)&"|"&HLOOKUP(Sheet1!R2C1,Sheet1!R2C1:R16C1,MOD(RC1+2,3)+MOD(INT((RC1+2)/3),3)*5+3,FALSE)&"|"&HLOOKUP(Sheet1!R2C1,Sheet1!R2C1:R16C1,MOD(RC1+3,3)+MOD(INT((RC1+3)/3),3)*5+3,FALSE) -> 134|162|163|164|102 | J228: =HLOOKUP(Sheet1!R2C1,Sheet1!R2C1:R16C1,MOD(RC1-1,3)+MOD(INT((RC1-1)/3),3)*5+3,FALSE)&"|"&HLOOKUP(Sheet1!R2C1,Sheet1!R2C1:R16C1,MOD(RC1,3)+MOD(INT((RC1)/3),3)*5+3,FALSE)&"|"&HLOOKUP(Sheet1!R2C1,Sheet1!R2C1:R16C1,MOD(RC1+1,3)+MOD(INT((RC1+1)/3),3)*5+3,FALSE)&"|"&HLOOKUP(Sheet1!R2C1,Sheet1!R2C1:R16C1,MOD(RC1+2,3)+MOD(INT((RC1+2)/3),3)*5+3,FALSE)&"|"&HLOOKUP(Sheet1!R2C1,Sheet1!R2C1:R16C1,MOD(RC1+3,3)+MOD(INT((RC1+3)/3),3)*5+3,FALSE) -> 134|162|163|164|102 | K228: =HLOOKUP(Sheet1!R2C1,Sheet1!R2C1:R16C1,MOD(RC1-1,3)+MOD(INT((RC1-1)/3),3)*5+3,FALSE)&"|"&HLOOKUP(Sheet1!R2C1,Sheet1!R2C1:R16C1,MOD(RC1,3)+MOD(INT((RC1)/3),3)*5+3,FALSE)&"|"&HLOOKUP(Sheet1!R2C1,Sheet1!R2C1:R16C1,MOD(RC1+1,3)+MOD(INT((RC1+1)/3),3)*5+3,FALSE)&"|"&HLOOKUP(Sheet1!R2C1,Sheet1!R2C1:R16C1,MOD(RC1+2,3)+MOD(INT((RC1+2)/3),3)*5+3,FALSE)&"|"&HLOOKUP(Sheet1!R2C1,Sheet1!R2C1:R16C1,MOD(RC1+3,3)+MOD(INT((RC1+3)/3),3)*5+3,FALSE) -> 134|162|163|164|102 | L228: 25|22|23|24 | M228: 1295483|1295483|1295483|1295483 | N228: 10030|10031|10032|10033 | O228: 1|1|1|1 | P228: 2500|2500|2500|2500
A229: 223 | B229: 221 | C229: 30 | D229: =R[-20]C+2 -> 42 | E229: 1000 | F229: =MOD(RC[-5]-1,3)*30+100&"|"&MOD(RC[-5]-1,3)*30+101&"|"&MOD(RC[-5]-1,3)*30+102&"|"&MOD(RC[-5]-1,3)*30+103&"|"&IF(MOD(RC[-5],4)=0,HLOOKUP(Sheet1!R2C10,Sheet1!R2C10:R7C10,MOD(RC[-5]/4-1,6)+1,FALSE),IF(MOD(RC[-5],2)=0,IF(RC[-5]>20,HLOOKUP(Sheet1!R2C7,Sheet1!R2C7:R43C7,MOD(RC[-5]/2-1,42)+1,FALSE),HLOOKUP(Sheet1!R2C4,Sheet1!R2C4:R7C4,MOD(RC[-5]-1,6)+1,FALSE)),MOD(RC[-5]-1,3)*30+104)) -> 100|101|102|103|104 | G229: =HLOOKUP(Sheet1!R2C1,Sheet1!R2C1:R16C1,MOD(RC1-1,2)+MOD(INT((RC1-1)/2),3)*5+1,FALSE)&"|"&HLOOKUP(Sheet1!R2C1,Sheet1!R2C1:R16C1,MOD(RC1,2)+MOD(INT((RC1)/2),3)*5+1,FALSE)&"|"&HLOOKUP(Sheet1!R2C1,Sheet1!R2C1:R16C1,MOD(RC1+1,2)+MOD(INT((RC1+1)/2),3)*5+1,FALSE)&"|"&HLOOKUP(Sheet1!R2C1,Sheet1!R2C1:R16C1,MOD(RC1+2,2)+MOD(INT((RC1+2)/2),3)*5+1,FALSE)&"|"&HLOOKUP(Sheet1!R2C1,Sheet1!R2C1:R16C1,MOD(RC1+3,2)+MOD(INT((RC1+3)/2),3)*5+1,FALSE) -> 100|101|130|131|160 | H229: =HLOOKUP(Sheet1!R2C1,Sheet1!R2C1:R16C1,MOD(RC1+2,2)+MOD(INT((RC1+2)/2),3)*5+1,FALSE)&"|"&HLOOKUP(Sheet1!R2C1,Sheet1!R2C1:R16C1,MOD(RC1+3,2)+MOD(INT((RC1+3)/2),3)*5+1,FALSE)&"|"&HLOOKUP(Sheet1!R2C1,Sheet1!R2C1:R16C1,MOD(RC1+4,2)+MOD(INT((RC1+4)/2),3)*5+1,FALSE)&"|"&HLOOKUP(Sheet1!R2C1,Sheet1!R2C1:R16C1,MOD(RC1+5,2)+MOD(INT((RC1+5)/2),3)*5+1,FALSE)&"|"&HLOOKUP(Sheet1!R2C1,Sheet1!R2C1:R16C1,MOD(RC1+6,2)+MOD(INT((RC1+6)/2),3)*5+1,FALSE) -> 131|160|161|100|101 | I229: =HLOOKUP(Sheet1!R2C1,Sheet1!R2C1:R16C1,MOD(RC1-1,3)+MOD(INT((RC1-1)/3),3)*5+3,FALSE)&"|"&HLOOKUP(Sheet1!R2C1,Sheet1!R2C1:R16C1,MOD(RC1,3)+MOD(INT((RC1)/3),3)*5+3,FALSE)&"|"&HLOOKUP(Sheet1!R2C1,Sheet1!R2C1:R16C1,MOD(RC1+1,3)+MOD(INT((RC1+1)/3),3)*5+3,FALSE)&"|"&HLOOKUP(Sheet1!R2C1,Sheet1!R2C1:R16C1,MOD(RC1+2,3)+MOD(INT((RC1+2)/3),3)*5+3,FALSE)&"|"&HLOOKUP(Sheet1!R2C1,Sheet1!R2C1:R16C1,MOD(RC1+3,3)+MOD(INT((RC1+3)/3),3)*5+3,FALSE) -> 162|163|164|102|103 | J229: =HLOOKUP(Sheet1!R2C1,Sheet1!R2C1:R16C1,MOD(RC1-1,3)+MOD(INT((RC1-1)/3),3)*5+3,FALSE)&"|"&HLOOKUP(Sheet1!R2C1,Sheet1!R2C1:R16C1,MOD(RC1,3)+MOD(INT((RC1)/3),3)*5+3,FALSE)&"|"&HLOOKUP(Sheet1!R2C1,Sheet1!R2C1:R16C1,MOD(RC1+1,3)+MOD(INT((RC1+1)/3),3)*5+3,FALSE)&"|"&HLOOKUP(Sheet1!R2C1,Sheet1!R2C1:R16C1,MOD(RC1+2,3)+MOD(INT((RC1+2)/3),3)*5+3,FALSE)&"|"&HLOOKUP(Sheet1!R2C1,Sheet1!R2C1:R16C1,MOD(RC1+3,3)+MOD(INT((RC1+3)/3),3)*5+3,FALSE) -> 162|163|164|102|103 | K229: =HLOOKUP(Sheet1!R2C1,Sheet1!R2C1:R16C1,MOD(RC1-1,3)+MOD(INT((RC1-1)/3),3)*5+3,FALSE)&"|"&HLOOKUP(Sheet1!R2C1,Sheet1!R2C1:R16C1,MOD(RC1,3)+MOD(INT((RC1)/3),3)*5+3,FALSE)&"|"&HLOOKUP(Sheet1!R2C1,Sheet1!R2C1:R16C1,MOD(RC1+1,3)+MOD(INT((RC1+1)/3),3)*5+3,FALSE)&"|"&HLOOKUP(Sheet1!R2C1,Sheet1!R2C1:R16C1,MOD(RC1+2,3)+MOD(INT((RC1+2)/3),3)*5+3,FALSE)&"|"&HLOOKUP(Sheet1!R2C1,Sheet1!R2C1:R16C1,MOD(RC1+3,3)+MOD(INT((RC1+3)/3),3)*5+3,FALSE) -> 162|163|164|102|103 | L229: 25|22|23|24 | M229: 1308562|1308563|1308563|1308563 | N229: 10030|10031|10032|10033 | O229: 1|1|1|1 | P229: 2500|2500|2500|2500
A230: 224 | B230: 222 | C230: 30 | D230: =R[-20]C+2 -> 42 | E230: 1000 | F230: =MOD(RC[-5]-1,3)*30+100&"|"&MOD(RC[-5]-1,3)*30+101&"|"&MOD(RC[-5]-1,3)*30+102&"|"&MOD(RC[-5]-1,3)*30+103&"|"&IF(MOD(RC[-5],4)=0,HLOOKUP(Sheet1!R2C10,Sheet1!R2C10:R7C10,MOD(RC[-5]/4-1,6)+1,FALSE),IF(MOD(RC[-5],2)=0,IF(RC[-5]>20,HLOOKUP(Sheet1!R2C7,Sheet1!R2C7:R43C7,MOD(RC[-5]/2-1,42)+1,FALSE),HLOOKUP(Sheet1!R2C4,Sheet1!R2C4:R7C4,MOD(RC[-5]-1,6)+1,FALSE)),MOD(RC[-5]-1,3)*30+104)) -> 130|131|132|133|191 | G230: =HLOOKUP(Sheet1!R2C1,Sheet1!R2C1:R16C1,MOD(RC1-1,2)+MOD(INT((RC1-1)/2),3)*5+1,FALSE)&"|"&HLOOKUP(Sheet1!R2C1,Sheet1!R2C1:R16C1,MOD(RC1,2)+MOD(INT((RC1)/2),3)*5+1,FALSE)&"|"&HLOOKUP(Sheet1!R2C1,Sheet1!R2C1:R16C1,MOD(RC1+1,2)+MOD(INT((RC1+1)/2),3)*5+1,FALSE)&"|"&HLOOKUP(Sheet1!R2C1,Sheet1!R2C1:R16C1,MOD(RC1+2,2)+MOD(INT((RC1+2)/2),3)*5+1,FALSE)&"|"&HLOOKUP(Sheet1!R2C1,Sheet1!R2C1:R16C1,MOD(RC1+3,2)+MOD(INT((RC1+3)/2),3)*5+1,FALSE) -> 101|130|131|160|161 | H230: =HLOOKUP(Sheet1!R2C1,Sheet1!R2C1:R16C1,MOD(RC1+2,2)+MOD(INT((RC1+2)/2),3)*5+1,FALSE)&"|"&HLOOKUP(Sheet1!R2C1,Sheet1!R2C1:R16C1,MOD(RC1+3,2)+MOD(INT((RC1+3)/2),3)*5+1,FALSE)&"|"&HLOOKUP(Sheet1!R2C1,Sheet1!R2C1:R16C1,MOD(RC1+4,2)+MOD(INT((RC1+4)/2),3)*5+1,FALSE)&"|"&HLOOKUP(Sheet1!R2C1,Sheet1!R2C1:R16C1,MOD(RC1+5,2)+MOD(INT((RC1+5)/2),3)*5+1,FALSE)&"|"&HLOOKUP(Sheet1!R2C1,Sheet1!R2C1:R16C1,MOD(RC1+6,2)+MOD(INT((RC1+6)/2),3)*5+1,FALSE) -> 160|161|100|101|130 | I230: =HLOOKUP(Sheet1!R2C1,Sheet1!R2C1:R16C1,MOD(RC1-1,3)+MOD(INT((RC1-1)/3),3)*5+3,FALSE)&"|"&HLOOKUP(Sheet1!R2C1,Sheet1!R2C1:R16C1,MOD(RC1,3)+MOD(INT((RC1)/3),3)*5+3,FALSE)&"|"&HLOOKUP(Sheet1!R2C1,Sheet1!R2C1:R16C1,MOD(RC1+1,3)+MOD(INT((RC1+1)/3),3)*5+3,FALSE)&"|"&HLOOKUP(Sheet1!R2C1,Sheet1!R2C1:R16C1,MOD(RC1+2,3)+MOD(INT((RC1+2)/3),3)*5+3,FALSE)&"|"&HLOOKUP(Sheet1!R2C1,Sheet1!R2C1:R16C1,MOD(RC1+3,3)+MOD(INT((RC1+3)/3),3)*5+3,FALSE) -> 163|164|102|103|104 | J230: =HLOOKUP(Sheet1!R2C1,Sheet1!R2C1:R16C1,MOD(RC1-1,3)+MOD(INT((RC1-1)/3),3)*5+3,FALSE)&"|"&HLOOKUP(Sheet1!R2C1,Sheet1!R2C1:R16C1,MOD(RC1,3)+MOD(INT((RC1)/3),3)*5+3,FALSE)&"|"&HLOOKUP(Sheet1!R2C1,Sheet1!R2C1:R16C1,MOD(RC1+1,3)+MOD(INT((RC1+1)/3),3)*5+3,FALSE)&"|"&HLOOKUP(Sheet1!R2C1,Sheet1!R2C1:R16C1,MOD(RC1+2,3)+MOD(INT((RC1+2)/3),3)*5+3,FALSE)&"|"&HLOOKUP(Sheet1!R2C1,Sheet1!R2C1:R16C1,MOD(RC1+3,3)+MOD(INT((RC1+3)/3),3)*5+3,FALSE) -> 163|164|102|103|104 | K230: =HLOOKUP(Sheet1!R2C1,Sheet1!R2C1:R16C1,MOD(RC1-1,3)+MOD(INT((RC1-1)/3),3)*5+3,FALSE)&"|"&HLOOKUP(Sheet1!R2C1,Sheet1!R2C1:R16C1,MOD(RC1,3)+MOD(INT((RC1)/3),3)*5+3,FALSE)&"|"&HLOOKUP(Sheet1!R2C1,Sheet1!R2C1:R16C1,MOD(RC1+1,3)+MOD(INT((RC1+1)/3),3)*5+3,FALSE)&"|"&HLOOKUP(Sheet1!R2C1,Sheet1!R2C1:R16C1,MOD(RC1+2,3)+MOD(INT((RC1+2)/3),3)*5+3,FALSE)&"|"&HLOOKUP(Sheet1!R2C1,Sheet1!R2C1:R16C1,MOD(RC1+3,3)+MOD(INT((RC1+3)/3),3)*5+3,FALSE) -> 163|164|102|103|104 | L230: 25|22|23|24 | M230: 1321642|1321641|1321643|1321643 | N230: 10030|10031|10032|10033 | O230: 1|1|1|1 | P230: 2500|2500|2500|2500
A231: 225 | B231: 223 | C231: 30 | D231: =R[-20]C+2 -> 42 | E231: 1000 | F231: =MOD(RC[-5]-1,3)*30+100&"|"&MOD(RC[-5]-1,3)*30+101&"|"&MOD(RC[-5]-1,3)*30+102&"|"&MOD(RC[-5]-1,3)*30+103&"|"&IF(MOD(RC[-5],4)=0,HLOOKUP(Sheet1!R2C10,Sheet1!R2C10:R7C10,MOD(RC[-5]/4-1,6)+1,FALSE),IF(MOD(RC[-5],2)=0,IF(RC[-5]>20,HLOOKUP(Sheet1!R2C7,Sheet1!R2C7:R43C7,MOD(RC[-5]/2-1,42)+1,FALSE),HLOOKUP(Sheet1!R2C4,Sheet1!R2C4:R7C4,MOD(RC[-5]-1,6)+1,FALSE)),MOD(RC[-5]-1,3)*30+104)) -> 160|161|162|163|164 | G231: =HLOOKUP(Sheet1!R2C1,Sheet1!R2C1:R16C1,MOD(RC1-1,2)+MOD(INT((RC1-1)/2),3)*5+1,FALSE)&"|"&HLOOKUP(Sheet1!R2C1,Sheet1!R2C1:R16C1,MOD(RC1,2)+MOD(INT((RC1)/2),3)*5+1,FALSE)&"|"&HLOOKUP(Sheet1!R2C1,Sheet1!R2C1:R16C1,MOD(RC1+1,2)+MOD(INT((RC1+1)/2),3)*5+1,FALSE)&"|"&HLOOKUP(Sheet1!R2C1,Sheet1!R2C1:R16C1,MOD(RC1+2,2)+MOD(INT((RC1+2)/2),3)*5+1,FALSE)&"|"&HLOOKUP(Sheet1!R2C1,Sheet1!R2C1:R16C1,MOD(RC1+3,2)+MOD(INT((RC1+3)/2),3)*5+1,FALSE) -> 130|131|160|161|100 | H231: =HLOOKUP(Sheet1!R2C1,Sheet1!R2C1:R16C1,MOD(RC1+2,2)+MOD(INT((RC1+2)/2),3)*5+1,FALSE)&"|"&HLOOKUP(Sheet1!R2C1,Sheet1!R2C1:R16C1,MOD(RC1+3,2)+MOD(INT((RC1+3)/2),3)*5+1,FALSE)&"|"&HLOOKUP(Sheet1!R2C1,Sheet1!R2C1:R16C1,MOD(RC1+4,2)+MOD(INT((RC1+4)/2),3)*5+1,FALSE)&"|"&HLOOKUP(Sheet1!R2C1,Sheet1!R2C1:R16C1,MOD(RC1+5,2)+MOD(INT((RC1+5)/2),3)*5+1,FALSE)&"|"&HLOOKUP(Sheet1!R2C1,Sheet1!R2C1:R16C1,MOD(RC1+6,2)+MOD(INT((RC1+6)/2),3)*5+1,FALSE) -> 161|100|101|130|131 | I231: =HLOOKUP(Sheet1!R2C1,Sheet1!R2C1:R16C1,MOD(RC1-1,3)+MOD(INT((RC1-1)/3),3)*5+3,FALSE)&"|"&HLOOKUP(Sheet1!R2C1,Sheet1!R2C1:R16C1,MOD(RC1,3)+MOD(INT((RC1)/3),3)*5+3,FALSE)&"|"&HLOOKUP(Sheet1!R2C1,Sheet1!R2C1:R16C1,MOD(RC1+1,3)+MOD(INT((RC1+1)/3),3)*5+3,FALSE)&"|"&HLOOKUP(Sheet1!R2C1,Sheet1!R2C1:R16C1,MOD(RC1+2,3)+MOD(INT((RC1+2)/3),3)*5+3,FALSE)&"|"&HLOOKUP(Sheet1!R2C1,Sheet1!R2C1:R16C1,MOD(RC1+3,3)+MOD(INT((RC1+3)/3),3)*5+3,FALSE) -> 164|102|103|104|132 | J231: =HLOOKUP(Sheet1!R2C1,Sheet1!R2C1:R16C1,MOD(RC1-1,3)+MOD(INT((RC1-1)/3),3)*5+3,FALSE)&"|"&HLOOKUP(Sheet1!R2C1,Sheet1!R2C1:R16C1,MOD(RC1,3)+MOD(INT((RC1)/3),3)*5+3,FALSE)&"|"&HLOOKUP(Sheet1!R2C1,Sheet1!R2C1:R16C1,MOD(RC1+1,3)+MOD(INT((RC1+1)/3),3)*5+3,FALSE)&"|"&HLOOKUP(Sheet1!R2C1,Sheet1!R2C1:R16C1,MOD(RC1+2,3)+MOD(INT((RC1+2)/3),3)*5+3,FALSE)&"|"&HLOOKUP(Sheet1!R2C1,Sheet1!R2C1:R16C1,MOD(RC1+3,3)+MOD(INT((RC1+3)/3),3)*5+3,FALSE) -> 164|102|103|104|132 | K231: =HLOOKUP(Sheet1!R2C1,Sheet1!R2C1:R16C1,MOD(RC1-1,3)+MOD(INT((RC1-1)/3),3)*5+3,FALSE)&"|"&HLOOKUP(Sheet1!R2C1,Sheet1!R2C1:R16C1,MOD(RC1,3)+MOD(INT((RC1)/3),3)*5+3,FALSE)&"|"&HLOOKUP(Sheet1!R2C1,Sheet1!R2C1:R16C1,MOD(RC1+1,3)+MOD(INT((RC1+1)/3),3)*5+3,FALSE)&"|"&HLOOKUP(Sheet1!R2C1,Sheet1!R2C1:R16C1,MOD(RC1+2,3)+MOD(INT((RC1+2)/3),3)*5+3,FALSE)&"|"&HLOOKUP(Sheet1!R2C1,Sheet1!R2C1:R16C1,MOD(RC1+3,3)+MOD(INT((RC1+3)/3),3)*5+3,FALSE) -> 164|102|103|104|132 | L231: 25|22|23|24 | M231: 1334988|1334988|1334988|1334988 | N231: 10030|10031|10032|10033|10030|10031|10032|10033|10030|10031|10032|10033|10030|10031|10032|10033|10030|10031|10032|10033|10030|10031|10032|10033|10030|10031|10032|10033|10030|10031|10032|10033|10030|10031|10032|10033|10030|10031|10032|10033 | O231: 1|1|1|1|1|1|1|1|1|1|1|1|1|1|1|1|1|1|1|1|1|1|1|1|1|1|1|1|1|1|1|1|1|1|1|1|1|1|1|1 | P231: 2500|2500|2500|2500|2500|2500|2500|2500|2500|2500|2500|2500|2500|2500|2500|2500|2500|2500|2500|2500|2500|2500|2500|2500|2500|2500|2500|2500|2500|2500|2500|2500|2500|2500|2500|2500|2500|2500|2500|2500
A232: 226 | B232: 224 | C232: 30 | D232: =R[-20]C+2 -> 42 | E232: 1000 | F232: =MOD(RC[-5]-1,3)*30+100&"|"&MOD(RC[-5]-1,3)*30+101&"|"&MOD(RC[-5]-1,3)*30+102&"|"&MOD(RC[-5]-1,3)*30+103&"|"&IF(MOD(RC[-5],4)=0,HLOOKUP(Sheet1!R2C10,Sheet1!R2C10:R7C10,MOD(RC[-5]/4-1,6)+1,FALSE),IF(MOD(RC[-5],2)=0,IF(RC[-5]>20,HLOOKUP(Sheet1!R2C7,Sheet1!R2C7:R43C7,MOD(RC[-5]/2-1,42)+1,FALSE),HLOOKUP(Sheet1!R2C4,Sheet1!R2C4:R7C4,MOD(RC[-5]-1,6)+1,FALSE)),MOD(RC[-5]-1,3)*30+104)) -> 100|101|102|103|172 | G232: =HLOOKUP(Sheet1!R2C1,Sheet1!R2C1:R16C1,MOD(RC1-1,2)+MOD(INT((RC1-1)/2),3)*5+1,FALSE)&"|"&HLOOKUP(Sheet1!R2C1,Sheet1!R2C1:R16C1,MOD(RC1,2)+MOD(INT((RC1)/2),3)*5+1,FALSE)&"|"&HLOOKUP(Sheet1!R2C1,Sheet1!R2C1:R16C1,MOD(RC1+1,2)+MOD(INT((RC1+1)/2),3)*5+1,FALSE)&"|"&HLOOKUP(Sheet1!R2C1,Sheet1!R2C1:R16C1,MOD(RC1+2,2)+MOD(INT((RC1+2)/2),3)*5+1,FALSE)&"|"&HLOOKUP(Sheet1!R2C1,Sheet1!R2C1:R16C1,MOD(RC1+3,2)+MOD(INT((RC1+3)/2),3)*5+1,FALSE) -> 131|160|161|100|101 | H232: =HLOOKUP(Sheet1!R2C1,Sheet1!R2C1:R16C1,MOD(RC1+2,2)+MOD(INT((RC1+2)/2),3)*5+1,FALSE)&"|"&HLOOKUP(Sheet1!R2C1,Sheet1!R2C1:R16C1,MOD(RC1+3,2)+MOD(INT((RC1+3)/2),3)*5+1,FALSE)&"|"&HLOOKUP(Sheet1!R2C1,Sheet1!R2C1:R16C1,MOD(RC1+4,2)+MOD(INT((RC1+4)/2),3)*5+1,FALSE)&"|"&HLOOKUP(Sheet1!R2C1,Sheet1!R2C1:R16C1,MOD(RC1+5,2)+MOD(INT((RC1+5)/2),3)*5+1,FALSE)&"|"&HLOOKUP(Sheet1!R2C1,Sheet1!R2C1:R16C1,MOD(RC1+6,2)+MOD(INT((RC1+6)/2),3)*5+1,FALSE) -> 100|101|130|131|160 | I232: =HLOOKUP(Sheet1!R2C1,Sheet1!R2C1:R16C1,MOD(RC1-1,3)+MOD(INT((RC1-1)/3),3)*5+3,FALSE)&"|"&HLOOKUP(Sheet1!R2C1,Sheet1!R2C1:R16C1,MOD(RC1,3)+MOD(INT((RC1)/3),3)*5+3,FALSE)&"|"&HLOOKUP(Sheet1!R2C1,Sheet1!R2C1:R16C1,MOD(RC1+1,3)+MOD(INT((RC1+1)/3),3)*5+3,FALSE)&"|"&HLOOKUP(Sheet1!R2C1,Sheet1!R2C1:R16C1,MOD(RC1+2,3)+MOD(INT((RC1+2)/3),3)*5+3,FALSE)&"|"&HLOOKUP(Sheet1!R2C1,Sheet1!R2C1:R16C1,MOD(RC1+3,3)+MOD(INT((RC1+3)/3),3)*5+3,FALSE) -> 102|103|104|132|133 | J232: =HLOOKUP(Sheet1!R2C1,Sheet1!R2C1:R16C1,MOD(RC1-1,3)+MOD(INT((RC1-1)/3),3)*5+3,FALSE)&"|"&HLOOKUP(Sheet1!R2C1,Sheet1!R2C1:R16C1,MOD(RC1,3)+MOD(INT((RC1)/3),3)*5+3,FALSE)&"|"&HLOOKUP(Sheet1!R2C1,Sheet1!R2C1:R16C1,MOD(RC1+1,3)+MOD(INT((RC1+1)/3),3)*5+3,FALSE)&"|"&HLOOKUP(Sheet1!R2C1,Sheet1!R2C1:R16C1,MOD(RC1+2,3)+MOD(INT((RC1+2)/3),3)*5+3,FALSE)&"|"&HLOOKUP(Sheet1!R2C1,Sheet1!R2C1:R16C1,MOD(RC1+3,3)+MOD(INT((RC1+3)/3),3)*5+3,FALSE) -> 102|103|104|132|133 | K232: =HLOOKUP(Sheet1!R2C1,Sheet1!R2C1:R16C1,MOD(RC1-1,3)+MOD(INT((RC1-1)/3),3)*5+3,FALSE)&"|"&HLOOKUP(Sheet1!R2C1,Sheet1!R2C1:R16C1,MOD(RC1,3)+MOD(INT((RC1)/3),3)*5+3,FALSE)&"|"&HLOOKUP(Sheet1!R2C1,Sheet1!R2C1:R16C1,MOD(RC1+1,3)+MOD(INT((RC1+1)/3),3)*5+3,FALSE)&"|"&HLOOKUP(Sheet1!R2C1,Sheet1!R2C1:R16C1,MOD(RC1+2,3)+MOD(INT((RC1+2)/3),3)*5+3,FALSE)&"|"&HLOOKUP(Sheet1!R2C1,Sheet1!R2C1:R16C1,MOD(RC1+3,3)+MOD(INT((RC1+3)/3),3)*5+3,FALSE) -> 102|103|104|132|133 | L232: 25|22|23|24 | M232: 1348517|1348518|1348518|1348518 | N232: 10030|10031|10032|10033 | O232: 1|1|1|1 | P232: 2500|2500|2500|2500
A233: 227 | B233: 225 | C233: 30 | D233: =R[-20]C+2 -> 42 | E233: 1000 | F233: =MOD(RC[-5]-1,3)*30+100&"|"&MOD(RC[-5]-1,3)*30+101&"|"&MOD(RC[-5]-1,3)*30+102&"|"&MOD(RC[-5]-1,3)*30+103&"|"&IF(MOD(RC[-5],4)=0,HLOOKUP(Sheet1!R2C10,Sheet1!R2C10:R7C10,MOD(RC[-5]/4-1,6)+1,FALSE),IF(MOD(RC[-5],2)=0,IF(RC[-5]>20,HLOOKUP(Sheet1!R2C7,Sheet1!R2C7:R43C7,MOD(RC[-5]/2-1,42)+1,FALSE),HLOOKUP(Sheet1!R2C4,Sheet1!R2C4:R7C4,MOD(RC[-5]-1,6)+1,FALSE)),MOD(RC[-5]-1,3)*30+104)) -> 130|131|132|133|134 | G233: =HLOOKUP(Sheet1!R2C1,Sheet1!R2C1:R16C1,MOD(RC1-1,2)+MOD(INT((RC1-1)/2),3)*5+1,FALSE)&"|"&HLOOKUP(Sheet1!R2C1,Sheet1!R2C1:R16C1,MOD(RC1,2)+MOD(INT((RC1)/2),3)*5+1,FALSE)&"|"&HLOOKUP(Sheet1!R2C1,Sheet1!R2C1:R16C1,MOD(RC1+1,2)+MOD(INT((RC1+1)/2),3)*5+1,FALSE)&"|"&HLOOKUP(Sheet1!R2C1,Sheet1!R2C1:R16C1,MOD(RC1+2,2)+MOD(INT((RC1+2)/2),3)*5+1,FALSE)&"|"&HLOOKUP(Sheet1!R2C1,Sheet1!R2C1:R16C1,MOD(RC1+3,2)+MOD(INT((RC1+3)/2),3)*5+1,FALSE) -> 160|161|100|101|130 | H233: =HLOOKUP(Sheet1!R2C1,Sheet1!R2C1:R16C1,MOD(RC1+2,2)+MOD(INT((RC1+2)/2),3)*5+1,FALSE)&"|"&HLOOKUP(Sheet1!R2C1,Sheet1!R2C1:R16C1,MOD(RC1+3,2)+MOD(INT((RC1+3)/2),3)*5+1,FALSE)&"|"&HLOOKUP(Sheet1!R2C1,Sheet1!R2C1:R16C1,MOD(RC1+4,2)+MOD(INT((RC1+4)/2),3)*5+1,FALSE)&"|"&HLOOKUP(Sheet1!R2C1,Sheet1!R2C1:R16C1,MOD(RC1+5,2)+MOD(INT((RC1+5)/2),3)*5+1,FALSE)&"|"&HLOOKUP(Sheet1!R2C1,Sheet1!R2C1:R16C1,MOD(RC1+6,2)+MOD(INT((RC1+6)/2),3)*5+1,FALSE) -> 101|130|131|160|161 | I233: =HLOOKUP(Sheet1!R2C1,Sheet1!R2C1:R16C1,MOD(RC1-1,3)+MOD(INT((RC1-1)/3),3)*5+3,FALSE)&"|"&HLOOKUP(Sheet1!R2C1,Sheet1!R2C1:R16C1,MOD(RC1,3)+MOD(INT((RC1)/3),3)*5+3,FALSE)&"|"&HLOOKUP(Sheet1!R2C1,Sheet1!R2C1:R16C1,MOD(RC1+1,3)+MOD(INT((RC1+1)/3),3)*5+3,FALSE)&"|"&HLOOKUP(Sheet1!R2C1,Sheet1!R2C1:R16C1,MOD(RC1+2,3)+MOD(INT((RC1+2)/3),3)*5+3,FALSE)&"|"&HLOOKUP(Sheet1!R2C1,Sheet1!R2C1:R16C1,MOD(RC1+3,3)+MOD(INT((RC1+3)/3),3)*5+3,FALSE) -> 103|104|132|133|134 | J233: =HLOOKUP(Sheet1!R2C1,Sheet1!R2C1:R16C1,MOD(RC1-1,3)+MOD(INT((RC1-1)/3),3)*5+3,FALSE)&"|"&HLOOKUP(Sheet1!R2C1,Sheet1!R2C1:R16C1,MOD(RC1,3)+MOD(INT((RC1)/3),3)*5+3,FALSE)&"|"&HLOOKUP(Sheet1!R2C1,Sheet1!R2C1:R16C1,MOD(RC1+1,3)+MOD(INT((RC1+1)/3),3)*5+3,FALSE)&"|"&HLOOKUP(Sheet1!R2C1,Sheet1!R2C1:R16C1,MOD(RC1+2,3)+MOD(INT((RC1+2)/3),3)*5+3,FALSE)&"|"&HLOOKUP(Sheet1!R2C1,Sheet1!R2C1:R16C1,MOD(RC1+3,3)+MOD(INT((RC1+3)/3),3)*5+3,FALSE) -> 103|104|132|133|134 | K233: =HLOOKUP(Sheet1!R2C1,Sheet1!R2C1:R16C1,MOD(RC1-1,3)+MOD(INT((RC1-1)/3),3)*5+3,FALSE)&"|"&HLOOKUP(Sheet1!R2C1,Sheet1!R2C1:R16C1,MOD(RC1,3)+MOD(INT((RC1)/3),3)*5+3,FALSE)&"|"&HLOOKUP(Sheet1!R2C1,Sheet1!R2C1:R16C1,MOD(RC1+1,3)+MOD(INT((RC1+1)/3),3)*5+3,FALSE)&"|"&HLOOKUP(Sheet1!R2C1,Sheet1!R2C1:R16C1,MOD(RC1+2,3)+MOD(INT((RC1+2)/3),3)*5+3,FALSE)&"|"&HLOOKUP(Sheet1!R2C1,Sheet1!R2C1:R16C1,MOD(RC1+3,3)+MOD(INT((RC1+3)/3),3)*5+3,FALSE) -> 103|104|132|133|134 | L233: 25|22|23|24 | M233: 1362047|1362046|1362048|1362048 | N233: 10030|10031|10032|10033 | O233: 1|1|1|1 | P233: 2500|2500|2500|2500
A234: 228 | B234: 226 | C234: 30 | D234: =R[-20]C+2 -> 42 | E234: 1000 | F234: =MOD(RC[-5]-1,3)*30+100&"|"&MOD(RC[-5]-1,3)*30+101&"|"&MOD(RC[-5]-1,3)*30+102&"|"&MOD(RC[-5]-1,3)*30+103&"|"&IF(MOD(RC[-5],4)=0,HLOOKUP(Sheet1!R2C10,Sheet1!R2C10:R7C10,MOD(RC[-5]/4-1,6)+1,FALSE),IF(MOD(RC[-5],2)=0,IF(RC[-5]>20,HLOOKUP(Sheet1!R2C7,Sheet1!R2C7:R43C7,MOD(RC[-5]/2-1,42)+1,FALSE),HLOOKUP(Sheet1!R2C4,Sheet1!R2C4:R7C4,MOD(RC[-5]-1,6)+1,FALSE)),MOD(RC[-5]-1,3)*30+104)) -> 160|161|162|163|192 | G234: =HLOOKUP(Sheet1!R2C1,Sheet1!R2C1:R16C1,MOD(RC1-1,2)+MOD(INT((RC1-1)/2),3)*5+1,FALSE)&"|"&HLOOKUP(Sheet1!R2C1,Sheet1!R2C1:R16C1,MOD(RC1,2)+MOD(INT((RC1)/2),3)*5+1,FALSE)&"|"&HLOOKUP(Sheet1!R2C1,Sheet1!R2C1:R16C1,MOD(RC1+1,2)+MOD(INT((RC1+1)/2),3)*5+1,FALSE)&"|"&HLOOKUP(Sheet1!R2C1,Sheet1!R2C1:R16C1,MOD(RC1+2,2)+MOD(INT((RC1+2)/2),3)*5+1,FALSE)&"|"&HLOOKUP(Sheet1!R2C1,Sheet1!R2C1:R16C1,MOD(RC1+3,2)+MOD(INT((RC1+3)/2),3)*5+1,FALSE) -> 161|100|101|130|131 | H234: =HLOOKUP(Sheet1!R2C1,Sheet1!R2C1:R16C1,MOD(RC1+2,2)+MOD(INT((RC1+2)/2),3)*5+1,FALSE)&"|"&HLOOKUP(Sheet1!R2C1,Sheet1!R2C1:R16C1,MOD(RC1+3,2)+MOD(INT((RC1+3)/2),3)*5+1,FALSE)&"|"&HLOOKUP(Sheet1!R2C1,Sheet1!R2C1:R16C1,MOD(RC1+4,2)+MOD(INT((RC1+4)/2),3)*5+1,FALSE)&"|"&HLOOKUP(Sheet1!R2C1,Sheet1!R2C1:R16C1,MOD(RC1+5,2)+MOD(INT((RC1+5)/2),3)*5+1,FALSE)&"|"&HLOOKUP(Sheet1!R2C1,Sheet1!R2C1:R16C1,MOD(RC1+6,2)+MOD(INT((RC1+6)/2),3)*5+1,FALSE) -> 130|131|160|161|100 | I234: =HLOOKUP(Sheet1!R2C1,Sheet1!R2C1:R16C1,MOD(RC1-1,3)+MOD(INT((RC1-1)/3),3)*5+3,FALSE)&"|"&HLOOKUP(Sheet1!R2C1,Sheet1!R2C1:R16C1,MOD(RC1,3)+MOD(INT((RC1)/3),3)*5+3,FALSE)&"|"&HLOOKUP(Sheet1!R2C1,Sheet1!R2C1:R16C1,MOD(RC1+1,3)+MOD(INT((RC1+1)/3),3)*5+3,FALSE)&"|"&HLOOKUP(Sheet1!R2C1,Sheet1!R2C1:R16C1,MOD(RC1+2,3)+MOD(INT((RC1+2)/3),3)*5+3,FALSE)&"|"&HLOOKUP(Sheet1!R2C1,Sheet1!R2C1:R16C1,MOD(RC1+3,3)+MOD(INT((RC1+3)/3),3)*5+3,FALSE) -> 104|132|133|134|162 | J234: =HLOOKUP(Sheet1!R2C1,Sheet1!R2C1:R16C1,MOD(RC1-1,3)+MOD(INT((RC1-1)/3),3)*5+3,FALSE)&"|"&HLOOKUP(Sheet1!R2C1,Sheet1!R2C1:R16C1,MOD(RC1,3)+MOD(INT((RC1)/3),3)*5+3,FALSE)&"|"&HLOOKUP(Sheet1!R2C1,Sheet1!R2C1:R16C1,MOD(RC1+1,3)+MOD(INT((RC1+1)/3),3)*5+3,FALSE)&"|"&HLOOKUP(Sheet1!R2C1,Sheet1!R2C1:R16C1,MOD(RC1+2,3)+MOD(INT((RC1+2)/3),3)*5+3,FALSE)&"|"&HLOOKUP(Sheet1!R2C1,Sheet1!R2C1:R16C1,MOD(RC1+3,3)+MOD(INT((RC1+3)/3),3)*5+3,FALSE) -> 104|132|133|134|162 | K234: =HLOOKUP(Sheet1!R2C1,Sheet1!R2C1:R16C1,MOD(RC1-1,3)+MOD(INT((RC1-1)/3),3)*5+3,FALSE)&"|"&HLOOKUP(Sheet1!R2C1,Sheet1!R2C1:R16C1,MOD(RC1,3)+MOD(INT((RC1)/3),3)*5+3,FALSE)&"|"&HLOOKUP(Sheet1!R2C1,Sheet1!R2C1:R16C1,MOD(RC1+1,3)+MOD(INT((RC1+1)/3),3)*5+3,FALSE)&"|"&HLOOKUP(Sheet1!R2C1,Sheet1!R2C1:R16C1,MOD(RC1+2,3)+MOD(INT((RC1+2)/3),3)*5+3,FALSE)&"|"&HLOOKUP(Sheet1!R2C1,Sheet1!R2C1:R16C1,MOD(RC1+3,3)+MOD(INT((RC1+3)/3),3)*5+3,FALSE) -> 104|132|133|134|162 | L234: 25|22|23|24 | M234: 1375576|1375576|1375575|1375575 | N234: 10030|10031|10032|10033 | O234: 1|1|1|1 | P234: 2500|2500|2500|2500
A235: 229 | B235: 227 | C235: 30 | D235: =R[-20]C+2 -> 42 | E235: 1000 | F235: =MOD(RC[-5]-1,3)*30+100&"|"&MOD(RC[-5]-1,3)*30+101&"|"&MOD(RC[-5]-1,3)*30+102&"|"&MOD(RC[-5]-1,3)*30+103&"|"&IF(MOD(RC[-5],4)=0,HLOOKUP(Sheet1!R2C10,Sheet1!R2C10:R7C10,MOD(RC[-5]/4-1,6)+1,FALSE),IF(MOD(RC[-5],2)=0,IF(RC[-5]>20,HLOOKUP(Sheet1!R2C7,Sheet1!R2C7:R43C7,MOD(RC[-5]/2-1,42)+1,FALSE),HLOOKUP(Sheet1!R2C4,Sheet1!R2C4:R7C4,MOD(RC[-5]-1,6)+1,FALSE)),MOD(RC[-5]-1,3)*30+104)) -> 100|101|102|103|104 | G235: =HLOOKUP(Sheet1!R2C1,Sheet1!R2C1:R16C1,MOD(RC1-1,2)+MOD(INT((RC1-1)/2),3)*5+1,FALSE)&"|"&HLOOKUP(Sheet1!R2C1,Sheet1!R2C1:R16C1,MOD(RC1,2)+MOD(INT((RC1)/2),3)*5+1,FALSE)&"|"&HLOOKUP(Sheet1!R2C1,Sheet1!R2C1:R16C1,MOD(RC1+1,2)+MOD(INT((RC1+1)/2),3)*5+1,FALSE)&"|"&HLOOKUP(Sheet1!R2C1,Sheet1!R2C1:R16C1,MOD(RC1+2,2)+MOD(INT((RC1+2)/2),3)*5+1,FALSE)&"|"&HLOOKUP(Sheet1!R2C1,Sheet1!R2C1:R16C1,MOD(RC1+3,2)+MOD(INT((RC1+3)/2),3)*5+1,FALSE) -> 100|101|130|131|160 | H235: =HLOOKUP(Sheet1!R2C1,Sheet1!R2C1:R16C1,MOD(RC1+2,2)+MOD(INT((RC1+2)/2),3)*5+1,FALSE)&"|"&HLOOKUP(Sheet1!R2C1,Sheet1!R2C1:R16C1,MOD(RC1+3,2)+MOD(INT((RC1+3)/2),3)*5+1,FALSE)&"|"&HLOOKUP(Sheet1!R2C1,Sheet1!R2C1:R16C1,MOD(RC1+4,2)+MOD(INT((RC1+4)/2),3)*5+1,FALSE)&"|"&HLOOKUP(Sheet1!R2C1,Sheet1!R2C1:R16C1,MOD(RC1+5,2)+MOD(INT((RC1+5)/2),3)*5+1,FALSE)&"|"&HLOOKUP(Sheet1!R2C1,Sheet1!R2C1:R16C1,MOD(RC1+6,2)+MOD(INT((RC1+6)/2),3)*5+1,FALSE) -> 131|160|161|100|101 | I235: =HLOOKUP(Sheet1!R2C1,Sheet1!R2C1:R16C1,MOD(RC1-1,3)+MOD(INT((RC1-1)/3),3)*5+3,FALSE)&"|"&HLOOKUP(Sheet1!R2C1,Sheet1!R2C1:R16C1,MOD(RC1,3)+MOD(INT((RC1)/3),3)*5+3,FALSE)&"|"&HLOOKUP(Sheet1!R2C1,Sheet1!R2C1:R16C1,MOD(RC1+1,3)+MOD(INT((RC1+1)/3),3)*5+3,FALSE)&"|"&HLOOKUP(Sheet1!R2C1,Sheet1!R2C1:R16C1,MOD(RC1+2,3)+MOD(INT((RC1+2)/3),3)*5+3,FALSE)&"|"&HLOOKUP(Sheet1!R2C1,Sheet1!R2C1:R16C1,MOD(RC1+3,3)+MOD(INT((RC1+3)/3),3)*5+3,FALSE) -> 132|133|134|162|163 | J235: =HLOOKUP(Sheet1!R2C1,Sheet1!R2C1:R16C1,MOD(RC1-1,3)+MOD(INT((RC1-1)/3),3)*5+3,FALSE)&"|"&HLOOKUP(Sheet1!R2C1,Sheet1!R2C1:R16C1,MOD(RC1,3)+MOD(INT((RC1)/3),3)*5+3,FALSE)&"|"&HLOOKUP(Sheet1!R2C1,Sheet1!R2C1:R16C1,MOD(RC1+1,3)+MOD(INT((RC1+1)/3),3)*5+3,FALSE)&"|"&HLOOKUP(Sheet1!R2C1,Sheet1!R2C1:R16C1,MOD(RC1+2,3)+MOD(INT((RC1+2)/3),3)*5+3,FALSE)&"|"&HLOOKUP(Sheet1!R2C1,Sheet1!R2C1:R16C1,MOD(RC1+3,3)+MOD(INT((RC1+3)/3),3)*5+3,FALSE) -> 132|133|134|162|163 | K235: =HLOOKUP(Sheet1!R2C1,Sheet1!R2C1:R16C1,MOD(RC1-1,3)+MOD(INT((RC1-1)/3),3)*5+3,FALSE)&"|"&HLOOKUP(Sheet1!R2C1,Sheet1!R2C1:R16C1,MOD(RC1,3)+MOD(INT((RC1)/3),3)*5+3,FALSE)&"|"&HLOOKUP(Sheet1!R2C1,Sheet1!R2C1:R16C1,MOD(RC1+1,3)+MOD(INT((RC1+1)/3),3)*5+3,FALSE)&"|"&HLOOKUP(Sheet1!R2C1,Sheet1!R2C1:R16C1,MOD(RC1+2,3)+MOD(INT((RC1+2)/3),3)*5+3,FALSE)&"|"&HLOOKUP(Sheet1!R2C1,Sheet1!R2C1:R16C1,MOD(RC1+3,3)+MOD(INT((RC1+3)/3),3)*5+3,FALSE) -> 132|133|134|162|163 | L235: 25|22|23|24 | M235: 1389319|1389319|1389318|1389318 | N235: 10030|10031|10032|10033 | O235: 1|1|1|1 | P235: 2500|2500|2500|2500
A236: 230 | B236: 228 | C236: 30 | D236: =R[-20]C+2 -> 42 | E236: 1000 | F236: =MOD(RC[-5]-1,3)*30+100&"|"&MOD(RC[-5]-1,3)*30+101&"|"&MOD(RC[-5]-1,3)*30+102&"|"&MOD(RC[-5]-1,3)*30+103&"|"&IF(MOD(RC[-5],4)=0,HLOOKUP(Sheet1!R2C10,Sheet1!R2C10:R7C10,MOD(RC[-5]/4-1,6)+1,FALSE),IF(MOD(RC[-5],2)=0,IF(RC[-5]>20,HLOOKUP(Sheet1!R2C7,Sheet1!R2C7:R43C7,MOD(RC[-5]/2-1,42)+1,FALSE),HLOOKUP(Sheet1!R2C4,Sheet1!R2C4:R7C4,MOD(RC[-5]-1,6)+1,FALSE)),MOD(RC[-5]-1,3)*30+104)) -> 130|131|132|133|174 | G236: =HLOOKUP(Sheet1!R2C1,Sheet1!R2C1:R16C1,MOD(RC1-1,2)+MOD(INT((RC1-1)/2),3)*5+1,FALSE)&"|"&HLOOKUP(Sheet1!R2C1,Sheet1!R2C1:R16C1,MOD(RC1,2)+MOD(INT((RC1)/2),3)*5+1,FALSE)&"|"&HLOOKUP(Sheet1!R2C1,Sheet1!R2C1:R16C1,MOD(RC1+1,2)+MOD(INT((RC1+1)/2),3)*5+1,FALSE)&"|"&HLOOKUP(Sheet1!R2C1,Sheet1!R2C1:R16C1,MOD(RC1+2,2)+MOD(INT((RC1+2)/2),3)*5+1,FALSE)&"|"&HLOOKUP(Sheet1!R2C1,Sheet1!R2C1:R16C1,MOD(RC1+3,2)+MOD(INT((RC1+3)/2),3)*5+1,FALSE) -> 101|130|131|160|161 | H236: =HLOOKUP(Sheet1!R2C1,Sheet1!R2C1:R16C1,MOD(RC1+2,2)+MOD(INT((RC1+2)/2),3)*5+1,FALSE)&"|"&HLOOKUP(Sheet1!R2C1,Sheet1!R2C1:R16C1,MOD(RC1+3,2)+MOD(INT((RC1+3)/2),3)*5+1,FALSE)&"|"&HLOOKUP(Sheet1!R2C1,Sheet1!R2C1:R16C1,MOD(RC1+4,2)+MOD(INT((RC1+4)/2),3)*5+1,FALSE)&"|"&HLOOKUP(Sheet1!R2C1,Sheet1!R2C1:R16C1,MOD(RC1+5,2)+MOD(INT((RC1+5)/2),3)*5+1,FALSE)&"|"&HLOOKUP(Sheet1!R2C1,Sheet1!R2C1:R16C1,MOD(RC1+6,2)+MOD(INT((RC1+6)/2),3)*5+1,FALSE) -> 160|161|100|101|130 | I236: =HLOOKUP(Sheet1!R2C1,Sheet1!R2C1:R16C1,MOD(RC1-1,3)+MOD(INT((RC1-1)/3),3)*5+3,FALSE)&"|"&HLOOKUP(Sheet1!R2C1,Sheet1!R2C1:R16C1,MOD(RC1,3)+MOD(INT((RC1)/3),3)*5+3,FALSE)&"|"&HLOOKUP(Sheet1!R2C1,Sheet1!R2C1:R16C1,MOD(RC1+1,3)+MOD(INT((RC1+1)/3),3)*5+3,FALSE)&"|"&HLOOKUP(Sheet1!R2C1,Sheet1!R2C1:R16C1,MOD(RC1+2,3)+MOD(INT((RC1+2)/3),3)*5+3,FALSE)&"|"&HLOOKUP(Sheet1!R2C1,Sheet1!R2C1:R16C1,MOD(RC1+3,3)+MOD(INT((RC1+3)/3),3)*5+3,FALSE) -> 133|134|162|163|164 | J236: =HLOOKUP(Sheet1!R2C1,Sheet1!R2C1:R16C1,MOD(RC1-1,3)+MOD(INT((RC1-1)/3),3)*5+3,FALSE)&"|"&HLOOKUP(Sheet1!R2C1,Sheet1!R2C1:R16C1,MOD(RC1,3)+MOD(INT((RC1)/3),3)*5+3,FALSE)&"|"&HLOOKUP(Sheet1!R2C1,Sheet1!R2C1:R16C1,MOD(RC1+1,3)+MOD(INT((RC1+1)/3),3)*5+3,FALSE)&"|"&HLOOKUP(Sheet1!R2C1,Sheet1!R2C1:R16C1,MOD(RC1+2,3)+MOD(INT((RC1+2)/3),3)*5+3,FALSE)&"|"&HLOOKUP(Sheet1!R2C1,Sheet1!R2C1:R16C1,MOD(RC1+3,3)+MOD(INT((RC1+3)/3),3)*5+3,FALSE) -> 133|134|162|163|164 | K236: =HLOOKUP(Sheet1!R2C1,Sheet1!R2C1:R16C1,MOD(RC1-1,3)+MOD(INT((RC1-1)/3),3)*5+3,FALSE)&"|"&HLOOKUP(Sheet1!R2C1,Sheet1!R2C1:R16C1,MOD(RC1,3)+MOD(INT((RC1)/3),3)*5+3,FALSE)&"|"&HLOOKUP(Sheet1!R2C1,Sheet1!R2C1:R16C1,MOD(RC1+1,3)+MOD(INT((RC1+1)/3),3)*5+3,FALSE)&"|"&HLOOKUP(Sheet1!R2C1,Sheet1!R2C1:R16C1,MOD(RC1+2,3)+MOD(INT((RC1+2)/3),3)*5+3,FALSE)&"|"&HLOOKUP(Sheet1!R2C1,Sheet1!R2C1:R16C1,MOD(RC1+3,3)+MOD(INT((RC1+3)/3),3)*5+3,FALSE) -> 133|134|162|163|164 | L236: 25|22|23|24 | M236: 1403088|1403088|1403088|1403088 | N236: 10030|10031|10032|10033|10030|10031|10032|10033|10030|10031|10032|10033|10030|10031|10032|10033|10030|10031|10032|10033|10030|10031|10032|10033|10030|10031|10032|10033|10030|10031|10032|10033|10030|10031|10032|10033|10030|10031|10032|10033 | O236: 1|1|1|1|1|1|1|1|1|1|1|1|1|1|1|1|1|1|1|1|1|1|1|1|1|1|1|1|1|1|1|1|1|1|1|1|1|1|1|1 | P236: 2500|2500|2500|2500|2500|2500|2500|2500|2500|2500|2500|2500|2500|2500|2500|2500|2500|2500|2500|2500|2500|2500|2500|2500|2500|2500|2500|2500|2500|2500|2500|2500|2500|2500|2500|2500|2500|2500|2500|2500
A237: 231 | B237: 229 | C237: 30 | D237: =R[-20]C+2 -> 42 | E237: 1000 | F237: =MOD(RC[-5]-1,3)*30+100&"|"&MOD(RC[-5]-1,3)*30+101&"|"&MOD(RC[-5]-1,3)*30+102&"|"&MOD(RC[-5]-1,3)*30+103&"|"&IF(MOD(RC[-5],4)=0,HLOOKUP(Sheet1!R2C10,Sheet1!R2C10:R7C10,MOD(RC[-5]/4-1,6)+1,FALSE),IF(MOD(RC[-5],2)=0,IF(RC[-5]>20,HLOOKUP(Sheet1!R2C7,Sheet1!R2C7:R43C7,MOD(RC[-5]/2-1,42)+1,FALSE),HLOOKUP(Sheet1!R2C4,Sheet1!R2C4:R7C4,MOD(RC[-5]-1,6)+1,FALSE)),MOD(RC[-5]-1,3)*30+104)) -> 160|161|162|163|164 | G237: =HLOOKUP(Sheet1!R2C1,Sheet1!R2C1:R16C1,MOD(RC1-1,2)+MOD(INT((RC1-1)/2),3)*5+1,FALSE)&"|"&HLOOKUP(Sheet1!R2C1,Sheet1!R2C1:R16C1,MOD(RC1,2)+MOD(INT((RC1)/2),3)*5+1,FALSE)&"|"&HLOOKUP(Sheet1!R2C1,Sheet1!R2C1:R16C1,MOD(RC1+1,2)+MOD(INT((RC1+1)/2),3)*5+1,FALSE)&"|"&HLOOKUP(Sheet1!R2C1,Sheet1!R2C1:R16C1,MOD(RC1+2,2)+MOD(INT((RC1+2)/2),3)*5+1,FALSE)&"|"&HLOOKUP(Sheet1!R2C1,Sheet1!R2C1:R16C1,MOD(RC1+3,2)+MOD(INT((RC1+3)/2),3)*5+1,FALSE) -> 130|131|160|161|100 | H237: =HLOOKUP(Sheet1!R2C1,Sheet1!R2C1:R16C1,MOD(RC1+2,2)+MOD(INT((RC1+2)/2),3)*5+1,FALSE)&"|"&HLOOKUP(Sheet1!R2C1,Sheet1!R2C1:R16C1,MOD(RC1+3,2)+MOD(INT((RC1+3)/2),3)*5+1,FALSE)&"|"&HLOOKUP(Sheet1!R2C1,Sheet1!R2C1:R16C1,MOD(RC1+4,2)+MOD(INT((RC1+4)/2),3)*5+1,FALSE)&"|"&HLOOKUP(Sheet1!R2C1,Sheet1!R2C1:R16C1,MOD(RC1+5,2)+MOD(INT((RC1+5)/2),3)*5+1,FALSE)&"|"&HLOOKUP(Sheet1!R2C1,Sheet1!R2C1:R16C1,MOD(RC1+6,2)+MOD(INT((RC1+6)/2),3)*5+1,FALSE) -> 161|100|101|130|131 | I237: =HLOOKUP(Sheet1!R2C1,Sheet1!R2C1:R16C1,MOD(RC1-1,3)+MOD(INT((RC1-1)/3),3)*5+3,FALSE)&"|"&HLOOKUP(Sheet1!R2C1,Sheet1!R2C1:R16C1,MOD(RC1,3)+MOD(INT((RC1)/3),3)*5+3,FALSE)&"|"&HLOOKUP(Sheet1!R2C1,Sheet1!R2C1:R16C1,MOD(RC1+1,3)+MOD(INT((RC1+1)/3),3)*5+3,FALSE)&"|"&HLOOKUP(Sheet1!R2C1,Sheet1!R2C1:R16C1,MOD(RC1+2,3)+MOD(INT((RC1+2)/3),3)*5+3,FALSE)&"|"&HLOOKUP(Sheet1!R2C1,Sheet1!R2C1:R16C1,MOD(RC1+3,3)+MOD(INT((RC1+3)/3),3)*5+3,FALSE) -> 134|162|163|164|102 | J237: =HLOOKUP(Sheet1!R2C1,Sheet1!R2C1:R16C1,MOD(RC1-1,3)+MOD(INT((RC1-1)/3),3)*5+3,FALSE)&"|"&HLOOKUP(Sheet1!R2C1,Sheet1!R2C1:R16C1,MOD(RC1,3)+MOD(INT((RC1)/3),3)*5+3,FALSE)&"|"&HLOOKUP(Sheet1!R2C1,Sheet1!R2C1:R16C1,MOD(RC1+1,3)+MOD(INT((RC1+1)/3),3)*5+3,FALSE)&"|"&HLOOKUP(Sheet1!R2C1,Sheet1!R2C1:R16C1,MOD(RC1+2,3)+MOD(INT((RC1+2)/3),3)*5+3,FALSE)&"|"&HLOOKUP(Sheet1!R2C1,Sheet1!R2C1:R16C1,MOD(RC1+3,3)+MOD(INT((RC1+3)/3),3)*5+3,FALSE) -> 134|162|163|164|102 | K237: =HLOOKUP(Sheet1!R2C1,Sheet1!R2C1:R16C1,MOD(RC1-1,3)+MOD(INT((RC1-1)/3),3)*5+3,FALSE)&"|"&HLOOKUP(Sheet1!R2C1,Sheet1!R2C1:R16C1,MOD(RC1,3)+MOD(INT((RC1)/3),3)*5+3,FALSE)&"|"&HLOOKUP(Sheet1!R2C1,Sheet1!R2C1:R16C1,MOD(RC1+1,3)+MOD(INT((RC1+1)/3),3)*5+3,FALSE)&"|"&HLOOKUP(Sheet1!R2C1,Sheet1!R2C1:R16C1,MOD(RC1+2,3)+MOD(INT((RC1+2)/3),3)*5+3,FALSE)&"|"&HLOOKUP(Sheet1!R2C1,Sheet1!R2C1:R16C1,MOD(RC1+3,3)+MOD(INT((RC1+3)/3),3)*5+3,FALSE) -> 134|162|163|164|102 | L237: 25|22|23|24 | M237: 1416857|1416858|1416858|1416858 | N237: 10030|10031|10032|10033 | O237: 1|1|1|1 | P237: 2500|2500|2500|2500
A238: 232 | B238: 230 | C238: 30 | D238: =R[-20]C+2 -> 42 | E238: 1000 | F238: =MOD(RC[-5]-1,3)*30+100&"|"&MOD(RC[-5]-1,3)*30+101&"|"&MOD(RC[-5]-1,3)*30+102&"|"&MOD(RC[-5]-1,3)*30+103&"|"&IF(MOD(RC[-5],4)=0,HLOOKUP(Sheet1!R2C10,Sheet1!R2C10:R7C10,MOD(RC[-5]/4-1,6)+1,FALSE),IF(MOD(RC[-5],2)=0,IF(RC[-5]>20,HLOOKUP(Sheet1!R2C7,Sheet1!R2C7:R43C7,MOD(RC[-5]/2-1,42)+1,FALSE),HLOOKUP(Sheet1!R2C4,Sheet1!R2C4:R7C4,MOD(RC[-5]-1,6)+1,FALSE)),MOD(RC[-5]-1,3)*30+104)) -> 100|101|102|103|193 | G238: =HLOOKUP(Sheet1!R2C1,Sheet1!R2C1:R16C1,MOD(RC1-1,2)+MOD(INT((RC1-1)/2),3)*5+1,FALSE)&"|"&HLOOKUP(Sheet1!R2C1,Sheet1!R2C1:R16C1,MOD(RC1,2)+MOD(INT((RC1)/2),3)*5+1,FALSE)&"|"&HLOOKUP(Sheet1!R2C1,Sheet1!R2C1:R16C1,MOD(RC1+1,2)+MOD(INT((RC1+1)/2),3)*5+1,FALSE)&"|"&HLOOKUP(Sheet1!R2C1,Sheet1!R2C1:R16C1,MOD(RC1+2,2)+MOD(INT((RC1+2)/2),3)*5+1,FALSE)&"|"&HLOOKUP(Sheet1!R2C1,Sheet1!R2C1:R16C1,MOD(RC1+3,2)+MOD(INT((RC1+3)/2),3)*5+1,FALSE) -> 131|160|161|100|101 | H238: =HLOOKUP(Sheet1!R2C1,Sheet1!R2C1:R16C1,MOD(RC1+2,2)+MOD(INT((RC1+2)/2),3)*5+1,FALSE)&"|"&HLOOKUP(Sheet1!R2C1,Sheet1!R2C1:R16C1,MOD(RC1+3,2)+MOD(INT((RC1+3)/2),3)*5+1,FALSE)&"|"&HLOOKUP(Sheet1!R2C1,Sheet1!R2C1:R16C1,MOD(RC1+4,2)+MOD(INT((RC1+4)/2),3)*5+1,FALSE)&"|"&HLOOKUP(Sheet1!R2C1,Sheet1!R2C1:R16C1,MOD(RC1+5,2)+MOD(INT((RC1+5)/2),3)*5+1,FALSE)&"|"&HLOOKUP(Sheet1!R2C1,Sheet1!R2C1:R16C1,MOD(RC1+6,2)+MOD(INT((RC1+6)/2),3)*5+1,FALSE) -> 100|101|130|131|160 | I238: =HLOOKUP(Sheet1!R2C1,Sheet1!R2C1:R16C1,MOD(RC1-1,3)+MOD(INT((RC1-1)/3),3)*5+3,FALSE)&"|"&HLOOKUP(Sheet1!R2C1,Sheet1!R2C1:R16C1,MOD(RC1,3)+MOD(INT((RC1)/3),3)*5+3,FALSE)&"|"&HLOOKUP(Sheet1!R2C1,Sheet1!R2C1:R16C1,MOD(RC1+1,3)+MOD(INT((RC1+1)/3),3)*5+3,FALSE)&"|"&HLOOKUP(Sheet1!R2C1,Sheet1!R2C1:R16C1,MOD(RC1+2,3)+MOD(INT((RC1+2)/3),3)*5+3,FALSE)&"|"&HLOOKUP(Sheet1!R2C1,Sheet1!R2C1:R16C1,MOD(RC1+3,3)+MOD(INT((RC1+3)/3),3)*5+3,FALSE) -> 162|163|164|102|103 | J238: =HLOOKUP(Sheet1!R2C1,Sheet1!R2C1:R16C1,MOD(RC1-1,3)+MOD(INT((RC1-1)/3),3)*5+3,FALSE)&"|"&HLOOKUP(Sheet1!R2C1,Sheet1!R2C1:R16C1,MOD(RC1,3)+MOD(INT((RC1)/3),3)*5+3,FALSE)&"|"&HLOOKUP(Sheet1!R2C1,Sheet1!R2C1:R16C1,MOD(RC1+1,3)+MOD(INT((RC1+1)/3),3)*5+3,FALSE)&"|"&HLOOKUP(Sheet1!R2C1,Sheet1!R2C1:R16C1,MOD(RC1+2,3)+MOD(INT((RC1+2)/3),3)*5+3,FALSE)&"|"&HLOOKUP(Sheet1!R2C1,Sheet1!R2C1:R16C1,MOD(RC1+3,3)+MOD(INT((RC1+3)/3),3)*5+3,FALSE) -> 162|163|164|102|103 | K238: =HLOOKUP(Sheet1!R2C1,Sheet1!R2C1:R16C1,MOD(RC1-1,3)+MOD(INT((RC1-1)/3),3)*5+3,FALSE)&"|"&HLOOKUP(Sheet1!R2C1,Sheet1!R2C1:R16C1,MOD(RC1,3)+MOD(INT((RC1)/3),3)*5+3,FALSE)&"|"&HLOOKUP(Sheet1!R2C1,Sheet1!R2C1:R16C1,MOD(RC1+1,3)+MOD(INT((RC1+1)/3),3)*5+3,FALSE)&"|"&HLOOKUP(Sheet1!R2C1,Sheet1!R2C1:R16C1,MOD(RC1+2,3)+MOD(INT((RC1+2)/3),3)*5+3,FALSE)&"|"&HLOOKUP(Sheet1!R2C1,Sheet1!R2C1:R16C1,MOD(RC1+3,3)+MOD(INT((RC1+3)/3),3)*5+3,FALSE) -> 162|163|164|102|103 | L238: 25|22|23|24 | M238: 1430758|1430758|1430758|1430758 | N238: 10030|10031|10032|10033 | O238: 1|1|1|1 | P238: 2500|2500|2500|2500
A239: 233 | B239: 231 | C239: 30 | D239: =R[-20]C+2 -> 42 | E239: 1000 | F239: =MOD(RC[-5]-1,3)*30+100&"|"&MOD(RC[-5]-1,3)*30+101&"|"&MOD(RC[-5]-1,3)*30+102&"|"&MOD(RC[-5]-1,3)*30+103&"|"&IF(MOD(RC[-5],4)=0,HLOOKUP(Sheet1!R2C10,Sheet1!R2C10:R7C10,MOD(RC[-5]/4-1,6)+1,FALSE),IF(MOD(RC[-5],2)=0,IF(RC[-5]>20,HLOOKUP(Sheet1!R2C7,Sheet1!R2C7:R43C7,MOD(RC[-5]/2-1,42)+1,FALSE),HLOOKUP(Sheet1!R2C4,Sheet1!R2C4:R7C4,MOD(RC[-5]-1,6)+1,FALSE)),MOD(RC[-5]-1,3)*30+104)) -> 130|131|132|133|134 | G239: =HLOOKUP(Sheet1!R2C1,Sheet1!R2C1:R16C1,MOD(RC1-1,2)+MOD(INT((RC1-1)/2),3)*5+1,FALSE)&"|"&HLOOKUP(Sheet1!R2C1,Sheet1!R2C1:R16C1,MOD(RC1,2)+MOD(INT((RC1)/2),3)*5+1,FALSE)&"|"&HLOOKUP(Sheet1!R2C1,Sheet1!R2C1:R16C1,MOD(RC1+1,2)+MOD(INT((RC1+1)/2),3)*5+1,FALSE)&"|"&HLOOKUP(Sheet1!R2C1,Sheet1!R2C1:R16C1,MOD(RC1+2,2)+MOD(INT((RC1+2)/2),3)*5+1,FALSE)&"|"&HLOOKUP(Sheet1!R2C1,Sheet1!R2C1:R16C1,MOD(RC1+3,2)+MOD(INT((RC1+3)/2),3)*5+1,FALSE) -> 160|161|100|101|130 | H239: =HLOOKUP(Sheet1!R2C1,Sheet1!R2C1:R16C1,MOD(RC1+2,2)+MOD(INT((RC1+2)/2),3)*5+1,FALSE)&"|"&HLOOKUP(Sheet1!R2C1,Sheet1!R2C1:R16C1,MOD(RC1+3,2)+MOD(INT((RC1+3)/2),3)*5+1,FALSE)&"|"&HLOOKUP(Sheet1!R2C1,Sheet1!R2C1:R16C1,MOD(RC1+4,2)+MOD(INT((RC1+4)/2),3)*5+1,FALSE)&"|"&HLOOKUP(Sheet1!R2C1,Sheet1!R2C1:R16C1,MOD(RC1+5,2)+MOD(INT((RC1+5)/2),3)*5+1,FALSE)&"|"&HLOOKUP(Sheet1!R2C1,Sheet1!R2C1:R16C1,MOD(RC1+6,2)+MOD(INT((RC1+6)/2),3)*5+1,FALSE) -> 101|130|131|160|161 | I239: =HLOOKUP(Sheet1!R2C1,Sheet1!R2C1:R16C1,MOD(RC1-1,3)+MOD(INT((RC1-1)/3),3)*5+3,FALSE)&"|"&HLOOKUP(Sheet1!R2C1,Sheet1!R2C1:R16C1,MOD(RC1,3)+MOD(INT((RC1)/3),3)*5+3,FALSE)&"|"&HLOOKUP(Sheet1!R2C1,Sheet1!R2C1:R16C1,MOD(RC1+1,3)+MOD(INT((RC1+1)/3),3)*5+3,FALSE)&"|"&HLOOKUP(Sheet1!R2C1,Sheet1!R2C1:R16C1,MOD(RC1+2,3)+MOD(INT((RC1+2)/3),3)*5+3,FALSE)&"|"&HLOOKUP(Sheet1!R2C1,Sheet1!R2C1:R16C1,MOD(RC1+3,3)+MOD(INT((RC1+3)/3),3)*5+3,FALSE) -> 163|164|102|103|104 | J239: =HLOOKUP(Sheet1!R2C1,Sheet1!R2C1:R16C1,MOD(RC1-1,3)+MOD(INT((RC1-1)/3),3)*5+3,FALSE)&"|"&HLOOKUP(Sheet1!R2C1,Sheet1!R2C1:R16C1,MOD(RC1,3)+MOD(INT((RC1)/3),3)*5+3,FALSE)&"|"&HLOOKUP(Sheet1!R2C1,Sheet1!R2C1:R16C1,MOD(RC1+1,3)+MOD(INT((RC1+1)/3),3)*5+3,FALSE)&"|"&HLOOKUP(Sheet1!R2C1,Sheet1!R2C1:R16C1,MOD(RC1+2,3)+MOD(INT((RC1+2)/3),3)*5+3,FALSE)&"|"&HLOOKUP(Sheet1!R2C1,Sheet1!R2C1:R16C1,MOD(RC1+3,3)+MOD(INT((RC1+3)/3),3)*5+3,FALSE) -> 163|164|102|103|104 | K239: =HLOOKUP(Sheet1!R2C1,Sheet1!R2C1:R16C1,MOD(RC1-1,3)+MOD(INT((RC1-1)/3),3)*5+3,FALSE)&"|"&HLOOKUP(Sheet1!R2C1,Sheet1!R2C1:R16C1,MOD(RC1,3)+MOD(INT((RC1)/3),3)*5+3,FALSE)&"|"&HLOOKUP(Sheet1!R2C1,Sheet1!R2C1:R16C1,MOD(RC1+1,3)+MOD(INT((RC1+1)/3),3)*5+3,FALSE)&"|"&HLOOKUP(Sheet1!R2C1,Sheet1!R2C1:R16C1,MOD(RC1+2,3)+MOD(INT((RC1+2)/3),3)*5+3,FALSE)&"|"&HLOOKUP(Sheet1!R2C1,Sheet1!R2C1:R16C1,MOD(RC1+3,3)+MOD(INT((RC1+3)/3),3)*5+3,FALSE) -> 163|164|102|103|104 | L239: 25|22|23|24 | M239: 1445239|1445240|1445240|1445240 | N239: 10030|10031|10032|10033 | O239: 1|1|1|1 | P239: 2500|2500|2500|2500
A240: 234 | B240: 232 | C240: 30 | D240: =R[-20]C+2 -> 42 | E240: 1000 | F240: =MOD(RC[-5]-1,3)*30+100&"|"&MOD(RC[-5]-1,3)*30+101&"|"&MOD(RC[-5]-1,3)*30+102&"|"&MOD(RC[-5]-1,3)*30+103&"|"&IF(MOD(RC[-5],4)=0,HLOOKUP(Sheet1!R2C10,Sheet1!R2C10:R7C10,MOD(RC[-5]/4-1,6)+1,FALSE),IF(MOD(RC[-5],2)=0,IF(RC[-5]>20,HLOOKUP(Sheet1!R2C7,Sheet1!R2C7:R43C7,MOD(RC[-5]/2-1,42)+1,FALSE),HLOOKUP(Sheet1!R2C4,Sheet1!R2C4:R7C4,MOD(RC[-5]-1,6)+1,FALSE)),MOD(RC[-5]-1,3)*30+104)) -> 160|161|162|163|176 | G240: =HLOOKUP(Sheet1!R2C1,Sheet1!R2C1:R16C1,MOD(RC1-1,2)+MOD(INT((RC1-1)/2),3)*5+1,FALSE)&"|"&HLOOKUP(Sheet1!R2C1,Sheet1!R2C1:R16C1,MOD(RC1,2)+MOD(INT((RC1)/2),3)*5+1,FALSE)&"|"&HLOOKUP(Sheet1!R2C1,Sheet1!R2C1:R16C1,MOD(RC1+1,2)+MOD(INT((RC1+1)/2),3)*5+1,FALSE)&"|"&HLOOKUP(Sheet1!R2C1,Sheet1!R2C1:R16C1,MOD(RC1+2,2)+MOD(INT((RC1+2)/2),3)*5+1,FALSE)&"|"&HLOOKUP(Sheet1!R2C1,Sheet1!R2C1:R16C1,MOD(RC1+3,2)+MOD(INT((RC1+3)/2),3)*5+1,FALSE) -> 161|100|101|130|131 | H240: =HLOOKUP(Sheet1!R2C1,Sheet1!R2C1:R16C1,MOD(RC1+2,2)+MOD(INT((RC1+2)/2),3)*5+1,FALSE)&"|"&HLOOKUP(Sheet1!R2C1,Sheet1!R2C1:R16C1,MOD(RC1+3,2)+MOD(INT((RC1+3)/2),3)*5+1,FALSE)&"|"&HLOOKUP(Sheet1!R2C1,Sheet1!R2C1:R16C1,MOD(RC1+4,2)+MOD(INT((RC1+4)/2),3)*5+1,FALSE)&"|"&HLOOKUP(Sheet1!R2C1,Sheet1!R2C1:R16C1,MOD(RC1+5,2)+MOD(INT((RC1+5)/2),3)*5+1,FALSE)&"|"&HLOOKUP(Sheet1!R2C1,Sheet1!R2C1:R16C1,MOD(RC1+6,2)+MOD(INT((RC1+6)/2),3)*5+1,FALSE) -> 130|131|160|161|100 | I240: =HLOOKUP(Sheet1!R2C1,Sheet1!R2C1:R16C1,MOD(RC1-1,3)+MOD(INT((RC1-1)/3),3)*5+3,FALSE)&"|"&HLOOKUP(Sheet1!R2C1,Sheet1!R2C1:R16C1,MOD(RC1,3)+MOD(INT((RC1)/3),3)*5+3,FALSE)&"|"&HLOOKUP(Sheet1!R2C1,Sheet1!R2C1:R16C1,MOD(RC1+1,3)+MOD(INT((RC1+1)/3),3)*5+3,FALSE)&"|"&HLOOKUP(Sheet1!R2C1,Sheet1!R2C1:R16C1,MOD(RC1+2,3)+MOD(INT((RC1+2)/3),3)*5+3,FALSE)&"|"&HLOOKUP(Sheet1!R2C1,Sheet1!R2C1:R16C1,MOD(RC1+3,3)+MOD(INT((RC1+3)/3),3)*5+3,FALSE) -> 164|102|103|104|132 | J240: =HLOOKUP(Sheet1!R2C1,Sheet1!R2C1:R16C1,MOD(RC1-1,3)+MOD(INT((RC1-1)/3),3)*5+3,FALSE)&"|"&HLOOKUP(Sheet1!R2C1,Sheet1!R2C1:R16C1,MOD(RC1,3)+MOD(INT((RC1)/3),3)*5+3,FALSE)&"|"&HLOOKUP(Sheet1!R2C1,Sheet1!R2C1:R16C1,MOD(RC1+1,3)+MOD(INT((RC1+1)/3),3)*5+3,FALSE)&"|"&HLOOKUP(Sheet1!R2C1,Sheet1!R2C1:R16C1,MOD(RC1+2,3)+MOD(INT((RC1+2)/3),3)*5+3,FALSE)&"|"&HLOOKUP(Sheet1!R2C1,Sheet1!R2C1:R16C1,MOD(RC1+3,3)+MOD(INT((RC1+3)/3),3)*5+3,FALSE) -> 164|102|103|104|132 | K240: =HLOOKUP(Sheet1!R2C1,Sheet1!R2C1:R16C1,MOD(RC1-1,3)+MOD(INT((RC1-1)/3),3)*5+3,FALSE)&"|"&HLOOKUP(Sheet1!R2C1,Sheet1!R2C1:R16C1,MOD(RC1,3)+MOD(INT((RC1)/3),3)*5+3,FALSE)&"|"&HLOOKUP(Sheet1!R2C1,Sheet1!R2C1:R16C1,MOD(RC1+1,3)+MOD(INT((RC1+1)/3),3)*5+3,FALSE)&"|"&HLOOKUP(Sheet1!R2C1,Sheet1!R2C1:R16C1,MOD(RC1+2,3)+MOD(INT((RC1+2)/3),3)*5+3,FALSE)&"|"&HLOOKUP(Sheet1!R2C1,Sheet1!R2C1:R16C1,MOD(RC1+3,3)+MOD(INT((RC1+3)/3),3)*5+3,FALSE) -> 164|102|103|104|132 | L240: 25|22|23|24 | M240: 1459721|1459721|1459720|1459720 | N240: 10030|10031|10032|10033 | O240: 1|1|1|1 | P240: 2500|2500|2500|2500
A241: 235 | B241: 233 | C241: 30 | D241: =R[-20]C+2 -> 42 | E241: 1000 | F241: =MOD(RC[-5]-1,3)*30+100&"|"&MOD(RC[-5]-1,3)*30+101&"|"&MOD(RC[-5]-1,3)*30+102&"|"&MOD(RC[-5]-1,3)*30+103&"|"&IF(MOD(RC[-5],4)=0,HLOOKUP(Sheet1!R2C10,Sheet1!R2C10:R7C10,MOD(RC[-5]/4-1,6)+1,FALSE),IF(MOD(RC[-5],2)=0,IF(RC[-5]>20,HLOOKUP(Sheet1!R2C7,Sheet1!R2C7:R43C7,MOD(RC[-5]/2-1,42)+1,FALSE),HLOOKUP(Sheet1!R2C4,Sheet1!R2C4:R7C4,MOD(RC[-5]-1,6)+1,FALSE)),MOD(RC[-5]-1,3)*30+104)) -> 100|101|102|103|104 | G241: =HLOOKUP(Sheet1!R2C1,Sheet1!R2C1:R16C1,MOD(RC1-1,2)+MOD(INT((RC1-1)/2),3)*5+1,FALSE)&"|"&HLOOKUP(Sheet1!R2C1,Sheet1!R2C1:R16C1,MOD(RC1,2)+MOD(INT((RC1)/2),3)*5+1,FALSE)&"|"&HLOOKUP(Sheet1!R2C1,Sheet1!R2C1:R16C1,MOD(RC1+1,2)+MOD(INT((RC1+1)/2),3)*5+1,FALSE)&"|"&HLOOKUP(Sheet1!R2C1,Sheet1!R2C1:R16C1,MOD(RC1+2,2)+MOD(INT((RC1+2)/2),3)*5+1,FALSE)&"|"&HLOOKUP(Sheet1!R2C1,Sheet1!R2C1:R16C1,MOD(RC1+3,2)+MOD(INT((RC1+3)/2),3)*5+1,FALSE) -> 100|101|130|131|160 | H241: =HLOOKUP(Sheet1!R2C1,Sheet1!R2C1:R16C1,MOD(RC1+2,2)+MOD(INT((RC1+2)/2),3)*5+1,FALSE)&"|"&HLOOKUP(Sheet1!R2C1,Sheet1!R2C1:R16C1,MOD(RC1+3,2)+MOD(INT((RC1+3)/2),3)*5+1,FALSE)&"|"&HLOOKUP(Sheet1!R2C1,Sheet1!R2C1:R16C1,MOD(RC1+4,2)+MOD(INT((RC1+4)/2),3)*5+1,FALSE)&"|"&HLOOKUP(Sheet1!R2C1,Sheet1!R2C1:R16C1,MOD(RC1+5,2)+MOD(INT((RC1+5)/2),3)*5+1,FALSE)&"|"&HLOOKUP(Sheet1!R2C1,Sheet1!R2C1:R16C1,MOD(RC1+6,2)+MOD(INT((RC1+6)/2),3)*5+1,FALSE) -> 131|160|161|100|101 | I241: =HLOOKUP(Sheet1!R2C1,Sheet1!R2C1:R16C1,MOD(RC1-1,3)+MOD(INT((RC1-1)/3),3)*5+3,FALSE)&"|"&HLOOKUP(Sheet1!R2C1,Sheet1!R2C1:R16C1,MOD(RC1,3)+MOD(INT((RC1)/3),3)*5+3,FALSE)&"|"&HLOOKUP(Sheet1!R2C1,Sheet1!R2C1:R16C1,MOD(RC1+1,3)+MOD(INT((RC1+1)/3),3)*5+3,FALSE)&"|"&HLOOKUP(Sheet1!R2C1,Sheet1!R2C1:R16C1,MOD(RC1+2,3)+MOD(INT((RC1+2)/3),3)*5+3,FALSE)&"|"&HLOOKUP(Sheet1!R2C1,Sheet1!R2C1:R16C1,MOD(RC1+3,3)+MOD(INT((RC1+3)/3),3)*5+3,FALSE) -> 102|103|104|132|133 | J241: =HLOOKUP(Sheet1!R2C1,Sheet1!R2C1:R16C1,MOD(RC1-1,3)+MOD(INT((RC1-1)/3),3)*5+3,FALSE)&"|"&HLOOKUP(Sheet1!R2C1,Sheet1!R2C1:R16C1,MOD(RC1,3)+MOD(INT((RC1)/3),3)*5+3,FALSE)&"|"&HLOOKUP(Sheet1!R2C1,Sheet1!R2C1:R16C1,MOD(RC1+1,3)+MOD(INT((RC1+1)/3),3)*5+3,FALSE)&"|"&HLOOKUP(Sheet1!R2C1,Sheet1!R2C1:R16C1,MOD(RC1+2,3)+MOD(INT((RC1+2)/3),3)*5+3,FALSE)&"|"&HLOOKUP(Sheet1!R2C1,Sheet1!R2C1:R16C1,MOD(RC1+3,3)+MOD(INT((RC1+3)/3),3)*5+3,FALSE) -> 102|103|104|132|133 | K241: =HLOOKUP(Sheet1!R2C1,Sheet1!R2C1:R16C1,MOD(RC1-1,3)+MOD(INT((RC1-1)/3),3)*5+3,FALSE)&"|"&HLOOKUP(Sheet1!R2C1,Sheet1!R2C1:R16C1,MOD(RC1,3)+MOD(INT((RC1)/3),3)*5+3,FALSE)&"|"&HLOOKUP(Sheet1!R2C1,Sheet1!R2C1:R16C1,MOD(RC1+1,3)+MOD(INT((RC1+1)/3),3)*5+3,FALSE)&"|"&HLOOKUP(Sheet1!R2C1,Sheet1!R2C1:R16C1,MOD(RC1+2,3)+MOD(INT((RC1+2)/3),3)*5+3,FALSE)&"|"&HLOOKUP(Sheet1!R2C1,Sheet1!R2C1:R16C1,MOD(RC1+3,3)+MOD(INT((RC1+3)/3),3)*5+3,FALSE) -> 102|103|104|132|133 | L241: 25|22|23|24 | M241: 1474202|1474203|1474203|1474203 | N241: 10030|10031|10032|10033|10030|10031|10032|10033|10030|10031|10032|10033|10030|10031|10032|10033|10030|10031|10032|10033|10030|10031|10032|10033|10030|10031|10032|10033|10030|10031|10032|10033|10030|10031|10032|10033|10030|10031|10032|10033 | O241: 1|1|1|1|1|1|1|1|1|1|1|1|1|1|1|1|1|1|1|1|1|1|1|1|1|1|1|1|1|1|1|1|1|1|1|1|1|1|1|1 | P241: 2500|2500|2500|2500|2500|2500|2500|2500|2500|2500|2500|2500|2500|2500|2500|2500|2500|2500|2500|2500|2500|2500|2500|2500|2500|2500|2500|2500|2500|2500|2500|2500|2500|2500|2500|2500|2500|2500|2500|2500
A242: 236 | B242: 234 | C242: 30 | D242: =R[-20]C+2 -> 42 | E242: 1000 | F242: =MOD(RC[-5]-1,3)*30+100&"|"&MOD(RC[-5]-1,3)*30+101&"|"&MOD(RC[-5]-1,3)*30+102&"|"&MOD(RC[-5]-1,3)*30+103&"|"&IF(MOD(RC[-5],4)=0,HLOOKUP(Sheet1!R2C10,Sheet1!R2C10:R7C10,MOD(RC[-5]/4-1,6)+1,FALSE),IF(MOD(RC[-5],2)=0,IF(RC[-5]>20,HLOOKUP(Sheet1!R2C7,Sheet1!R2C7:R43C7,MOD(RC[-5]/2-1,42)+1,FALSE),HLOOKUP(Sheet1!R2C4,Sheet1!R2C4:R7C4,MOD(RC[-5]-1,6)+1,FALSE)),MOD(RC[-5]-1,3)*30+104)) -> 130|131|132|133|194 | G242: =HLOOKUP(Sheet1!R2C1,Sheet1!R2C1:R16C1,MOD(RC1-1,2)+MOD(INT((RC1-1)/2),3)*5+1,FALSE)&"|"&HLOOKUP(Sheet1!R2C1,Sheet1!R2C1:R16C1,MOD(RC1,2)+MOD(INT((RC1)/2),3)*5+1,FALSE)&"|"&HLOOKUP(Sheet1!R2C1,Sheet1!R2C1:R16C1,MOD(RC1+1,2)+MOD(INT((RC1+1)/2),3)*5+1,FALSE)&"|"&HLOOKUP(Sheet1!R2C1,Sheet1!R2C1:R16C1,MOD(RC1+2,2)+MOD(INT((RC1+2)/2),3)*5+1,FALSE)&"|"&HLOOKUP(Sheet1!R2C1,Sheet1!R2C1:R16C1,MOD(RC1+3,2)+MOD(INT((RC1+3)/2),3)*5+1,FALSE) -> 101|130|131|160|161 | H242: =HLOOKUP(Sheet1!R2C1,Sheet1!R2C1:R16C1,MOD(RC1+2,2)+MOD(INT((RC1+2)/2),3)*5+1,FALSE)&"|"&HLOOKUP(Sheet1!R2C1,Sheet1!R2C1:R16C1,MOD(RC1+3,2)+MOD(INT((RC1+3)/2),3)*5+1,FALSE)&"|"&HLOOKUP(Sheet1!R2C1,Sheet1!R2C1:R16C1,MOD(RC1+4,2)+MOD(INT((RC1+4)/2),3)*5+1,FALSE)&"|"&HLOOKUP(Sheet1!R2C1,Sheet1!R2C1:R16C1,MOD(RC1+5,2)+MOD(INT((RC1+5)/2),3)*5+1,FALSE)&"|"&HLOOKUP(Sheet1!R2C1,Sheet1!R2C1:R16C1,MOD(RC1+6,2)+MOD(INT((RC1+6)/2),3)*5+1,FALSE) -> 160|161|100|101|130 | I242: =HLOOKUP(Sheet1!R2C1,Sheet1!R2C1:R16C1,MOD(RC1-1,3)+MOD(INT((RC1-1)/3),3)*5+3,FALSE)&"|"&HLOOKUP(Sheet1!R2C1,Sheet1!R2C1:R16C1,MOD(RC1,3)+MOD(INT((RC1)/3),3)*5+3,FALSE)&"|"&HLOOKUP(Sheet1!R2C1,Sheet1!R2C1:R16C1,MOD(RC1+1,3)+MOD(INT((RC1+1)/3),3)*5+3,FALSE)&"|"&HLOOKUP(Sheet1!R2C1,Sheet1!R2C1:R16C1,MOD(RC1+2,3)+MOD(INT((RC1+2)/3),3)*5+3,FALSE)&"|"&HLOOKUP(Sheet1!R2C1,Sheet1!R2C1:R16C1,MOD(RC1+3,3)+MOD(INT((RC1+3)/3),3)*5+3,FALSE) -> 103|104|132|133|134 | J242: =HLOOKUP(Sheet1!R2C1,Sheet1!R2C1:R16C1,MOD(RC1-1,3)+MOD(INT((RC1-1)/3),3)*5+3,FALSE)&"|"&HLOOKUP(Sheet1!R2C1,Sheet1!R2C1:R16C1,MOD(RC1,3)+MOD(INT((RC1)/3),3)*5+3,FALSE)&"|"&HLOOKUP(Sheet1!R2C1,Sheet1!R2C1:R16C1,MOD(RC1+1,3)+MOD(INT((RC1+1)/3),3)*5+3,FALSE)&"|"&HLOOKUP(Sheet1!R2C1,Sheet1!R2C1:R16C1,MOD(RC1+2,3)+MOD(INT((RC1+2)/3),3)*5+3,FALSE)&"|"&HLOOKUP(Sheet1!R2C1,Sheet1!R2C1:R16C1,MOD(RC1+3,3)+MOD(INT((RC1+3)/3),3)*5+3,FALSE) -> 103|104|132|133|134 | K242: =HLOOKUP(Sheet1!R2C1,Sheet1!R2C1:R16C1,MOD(RC1-1,3)+MOD(INT((RC1-1)/3),3)*5+3,FALSE)&"|"&HLOOKUP(Sheet1!R2C1,Sheet1!R2C1:R16C1,MOD(RC1,3)+MOD(INT((RC1)/3),3)*5+3,FALSE)&"|"&HLOOKUP(Sheet1!R2C1,Sheet1!R2C1:R16C1,MOD(RC1+1,3)+MOD(INT((RC1+1)/3),3)*5+3,FALSE)&"|"&HLOOKUP(Sheet1!R2C1,Sheet1!R2C1:R16C1,MOD(RC1+2,3)+MOD(INT((RC1+2)/3),3)*5+3,FALSE)&"|"&HLOOKUP(Sheet1!R2C1,Sheet1!R2C1:R16C1,MOD(RC1+3,3)+MOD(INT((RC1+3)/3),3)*5+3,FALSE) -> 103|104|132|133|134 | L242: 25|22|23|24 | M242: 1488938|1488938|1488938|1488938 | N242: 10030|10031|10032|10033 | O242: 1|1|1|1 | P242: 2500|2500|2500|2500
A243: 237 | B243: 235 | C243: 30 | D243: =R[-20]C+2 -> 42 | E243: 1000 | F243: =MOD(RC[-5]-1,3)*30+100&"|"&MOD(RC[-5]-1,3)*30+101&"|"&MOD(RC[-5]-1,3)*30+102&"|"&MOD(RC[-5]-1,3)*30+103&"|"&IF(MOD(RC[-5],4)=0,HLOOKUP(Sheet1!R2C10,Sheet1!R2C10:R7C10,MOD(RC[-5]/4-1,6)+1,FALSE),IF(MOD(RC[-5],2)=0,IF(RC[-5]>20,HLOOKUP(Sheet1!R2C7,Sheet1!R2C7:R43C7,MOD(RC[-5]/2-1,42)+1,FALSE),HLOOKUP(Sheet1!R2C4,Sheet1!R2C4:R7C4,MOD(RC[-5]-1,6)+1,FALSE)),MOD(RC[-5]-1,3)*30+104)) -> 160|161|162|163|164 | G243: =HLOOKUP(Sheet1!R2C1,Sheet1!R2C1:R16C1,MOD(RC1-1,2)+MOD(INT((RC1-1)/2),3)*5+1,FALSE)&"|"&HLOOKUP(Sheet1!R2C1,Sheet1!R2C1:R16C1,MOD(RC1,2)+MOD(INT((RC1)/2),3)*5+1,FALSE)&"|"&HLOOKUP(Sheet1!R2C1,Sheet1!R2C1:R16C1,MOD(RC1+1,2)+MOD(INT((RC1+1)/2),3)*5+1,FALSE)&"|"&HLOOKUP(Sheet1!R2C1,Sheet1!R2C1:R16C1,MOD(RC1+2,2)+MOD(INT((RC1+2)/2),3)*5+1,FALSE)&"|"&HLOOKUP(Sheet1!R2C1,Sheet1!R2C1:R16C1,MOD(RC1+3,2)+MOD(INT((RC1+3)/2),3)*5+1,FALSE) -> 130|131|160|161|100 | H243: =HLOOKUP(Sheet1!R2C1,Sheet1!R2C1:R16C1,MOD(RC1+2,2)+MOD(INT((RC1+2)/2),3)*5+1,FALSE)&"|"&HLOOKUP(Sheet1!R2C1,Sheet1!R2C1:R16C1,MOD(RC1+3,2)+MOD(INT((RC1+3)/2),3)*5+1,FALSE)&"|"&HLOOKUP(Sheet1!R2C1,Sheet1!R2C1:R16C1,MOD(RC1+4,2)+MOD(INT((RC1+4)/2),3)*5+1,FALSE)&"|"&HLOOKUP(Sheet1!R2C1,Sheet1!R2C1:R16C1,MOD(RC1+5,2)+MOD(INT((RC1+5)/2),3)*5+1,FALSE)&"|"&HLOOKUP(Sheet1!R2C1,Sheet1!R2C1:R16C1,MOD(RC1+6,2)+MOD(INT((RC1+6)/2),3)*5+1,FALSE) -> 161|100|101|130|131 | I243: =HLOOKUP(Sheet1!R2C1,Sheet1!R2C1:R16C1,MOD(RC1-1,3)+MOD(INT((RC1-1)/3),3)*5+3,FALSE)&"|"&HLOOKUP(Sheet1!R2C1,Sheet1!R2C1:R16C1,MOD(RC1,3)+MOD(INT((RC1)/3),3)*5+3,FALSE)&"|"&HLOOKUP(Sheet1!R2C1,Sheet1!R2C1:R16C1,MOD(RC1+1,3)+MOD(INT((RC1+1)/3),3)*5+3,FALSE)&"|"&HLOOKUP(Sheet1!R2C1,Sheet1!R2C1:R16C1,MOD(RC1+2,3)+MOD(INT((RC1+2)/3),3)*5+3,FALSE)&"|"&HLOOKUP(Sheet1!R2C1,Sheet1!R2C1:R16C1,MOD(RC1+3,3)+MOD(INT((RC1+3)/3),3)*5+3,FALSE) -> 104|132|133|134|162 | J243: =HLOOKUP(Sheet1!R2C1,Sheet1!R2C1:R16C1,MOD(RC1-1,3)+MOD(INT((RC1-1)/3),3)*5+3,FALSE)&"|"&HLOOKUP(Sheet1!R2C1,Sheet1!R2C1:R16C1,MOD(RC1,3)+MOD(INT((RC1)/3),3)*5+3,FALSE)&"|"&HLOOKUP(Sheet1!R2C1,Sheet1!R2C1:R16C1,MOD(RC1+1,3)+MOD(INT((RC1+1)/3),3)*5+3,FALSE)&"|"&HLOOKUP(Sheet1!R2C1,Sheet1!R2C1:R16C1,MOD(RC1+2,3)+MOD(INT((RC1+2)/3),3)*5+3,FALSE)&"|"&HLOOKUP(Sheet1!R2C1,Sheet1!R2C1:R16C1,MOD(RC1+3,3)+MOD(INT((RC1+3)/3),3)*5+3,FALSE) -> 104|132|133|134|162 | K243: =HLOOKUP(Sheet1!R2C1,Sheet1!R2C1:R16C1,MOD(RC1-1,3)+MOD(INT((RC1-1)/3),3)*5+3,FALSE)&"|"&HLOOKUP(Sheet1!R2C1,Sheet1!R2C1:R16C1,MOD(RC1,3)+MOD(INT((RC1)/3),3)*5+3,FALSE)&"|"&HLOOKUP(Sheet1!R2C1,Sheet1!R2C1:R16C1,MOD(RC1+1,3)+MOD(INT((RC1+1)/3),3)*5+3,FALSE)&"|"&HLOOKUP(Sheet1!R2C1,Sheet1!R2C1:R16C1,MOD(RC1+2,3)+MOD(INT((RC1+2)/3),3)*5+3,FALSE)&"|"&HLOOKUP(Sheet1!R2C1,Sheet1!R2C1:R16C1,MOD(RC1+3,3)+MOD(INT((RC1+3)/3),3)*5+3,FALSE) -> 104|132|133|134|162 | L243: 25|22|23|24 | M243: 1503946|1503946|1503945|1503945 | N243: 10030|10031|10032|10033 | O243: 1|1|1|1 | P243: 2500|2500|2500|2500
A244: 238 | B244: 236 | C244: 30 | D244: =R[-20]C+2 -> 42 | E244: 1000 | F244: =MOD(RC[-5]-1,3)*30+100&"|"&MOD(RC[-5]-1,3)*30+101&"|"&MOD(RC[-5]-1,3)*30+102&"|"&MOD(RC[-5]-1,3)*30+103&"|"&IF(MOD(RC[-5],4)=0,HLOOKUP(Sheet1!R2C10,Sheet1!R2C10:R7C10,MOD(RC[-5]/4-1,6)+1,FALSE),IF(MOD(RC[-5],2)=0,IF(RC[-5]>20,HLOOKUP(Sheet1!R2C7,Sheet1!R2C7:R43C7,MOD(RC[-5]/2-1,42)+1,FALSE),HLOOKUP(Sheet1!R2C4,Sheet1!R2C4:R7C4,MOD(RC[-5]-1,6)+1,FALSE)),MOD(RC[-5]-1,3)*30+104)) -> 100|101|102|103|178 | G244: =HLOOKUP(Sheet1!R2C1,Sheet1!R2C1:R16C1,MOD(RC1-1,2)+MOD(INT((RC1-1)/2),3)*5+1,FALSE)&"|"&HLOOKUP(Sheet1!R2C1,Sheet1!R2C1:R16C1,MOD(RC1,2)+MOD(INT((RC1)/2),3)*5+1,FALSE)&"|"&HLOOKUP(Sheet1!R2C1,Sheet1!R2C1:R16C1,MOD(RC1+1,2)+MOD(INT((RC1+1)/2),3)*5+1,FALSE)&"|"&HLOOKUP(Sheet1!R2C1,Sheet1!R2C1:R16C1,MOD(RC1+2,2)+MOD(INT((RC1+2)/2),3)*5+1,FALSE)&"|"&HLOOKUP(Sheet1!R2C1,Sheet1!R2C1:R16C1,MOD(RC1+3,2)+MOD(INT((RC1+3)/2),3)*5+1,FALSE) -> 131|160|161|100|101 | H244: =HLOOKUP(Sheet1!R2C1,Sheet1!R2C1:R16C1,MOD(RC1+2,2)+MOD(INT((RC1+2)/2),3)*5+1,FALSE)&"|"&HLOOKUP(Sheet1!R2C1,Sheet1!R2C1:R16C1,MOD(RC1+3,2)+MOD(INT((RC1+3)/2),3)*5+1,FALSE)&"|"&HLOOKUP(Sheet1!R2C1,Sheet1!R2C1:R16C1,MOD(RC1+4,2)+MOD(INT((RC1+4)/2),3)*5+1,FALSE)&"|"&HLOOKUP(Sheet1!R2C1,Sheet1!R2C1:R16C1,MOD(RC1+5,2)+MOD(INT((RC1+5)/2),3)*5+1,FALSE)&"|"&HLOOKUP(Sheet1!R2C1,Sheet1!R2C1:R16C1,MOD(RC1+6,2)+MOD(INT((RC1+6)/2),3)*5+1,FALSE) -> 100|101|130|131|160 | I244: =HLOOKUP(Sheet1!R2C1,Sheet1!R2C1:R16C1,MOD(RC1-1,3)+MOD(INT((RC1-1)/3),3)*5+3,FALSE)&"|"&HLOOKUP(Sheet1!R2C1,Sheet1!R2C1:R16C1,MOD(RC1,3)+MOD(INT((RC1)/3),3)*5+3,FALSE)&"|"&HLOOKUP(Sheet1!R2C1,Sheet1!R2C1:R16C1,MOD(RC1+1,3)+MOD(INT((RC1+1)/3),3)*5+3,FALSE)&"|"&HLOOKUP(Sheet1!R2C1,Sheet1!R2C1:R16C1,MOD(RC1+2,3)+MOD(INT((RC1+2)/3),3)*5+3,FALSE)&"|"&HLOOKUP(Sheet1!R2C1,Sheet1!R2C1:R16C1,MOD(RC1+3,3)+MOD(INT((RC1+3)/3),3)*5+3,FALSE) -> 132|133|134|162|163 | J244: =HLOOKUP(Sheet1!R2C1,Sheet1!R2C1:R16C1,MOD(RC1-1,3)+MOD(INT((RC1-1)/3),3)*5+3,FALSE)&"|"&HLOOKUP(Sheet1!R2C1,Sheet1!R2C1:R16C1,MOD(RC1,3)+MOD(INT((RC1)/3),3)*5+3,FALSE)&"|"&HLOOKUP(Sheet1!R2C1,Sheet1!R2C1:R16C1,MOD(RC1+1,3)+MOD(INT((RC1+1)/3),3)*5+3,FALSE)&"|"&HLOOKUP(Sheet1!R2C1,Sheet1!R2C1:R16C1,MOD(RC1+2,3)+MOD(INT((RC1+2)/3),3)*5+3,FALSE)&"|"&HLOOKUP(Sheet1!R2C1,Sheet1!R2C1:R16C1,MOD(RC1+3,3)+MOD(INT((RC1+3)/3),3)*5+3,FALSE) -> 132|133|134|162|163 | K244: =HLOOKUP(Sheet1!R2C1,Sheet1!R2C1:R16C1,MOD(RC1-1,3)+MOD(INT((RC1-1)/3),3)*5+3,FALSE)&"|"&HLOOKUP(Sheet1!R2C1,Sheet1!R2C1:R16C1,MOD(RC1,3)+MOD(INT((RC1)/3),3)*5+3,FALSE)&"|"&HLOOKUP(Sheet1!R2C1,Sheet1!R2C1:R16C1,MOD(RC1+1,3)+MOD(INT((RC1+1)/3),3)*5+3,FALSE)&"|"&HLOOKUP(Sheet1!R2C1,Sheet1!R2C1:R16C1,MOD(RC1+2,3)+MOD(INT((RC1+2)/3),3)*5+3,FALSE)&"|"&HLOOKUP(Sheet1!R2C1,Sheet1!R2C1:R16C1,MOD(RC1+3,3)+MOD(INT((RC1+3)/3),3)*5+3,FALSE) -> 132|133|134|162|163 | L244: 25|22|23|24 | M244: 1518398|1518399|1518398|1518398 | N244: 10030|10031|10032|10033 | O244: 1|1|1|1 | P244: 2500|2500|2500|2500
A245: 239 | B245: 237 | C245: 30 | D245: =R[-20]C+2 -> 42 | E245: 1000 | F245: =MOD(RC[-5]-1,3)*30+100&"|"&MOD(RC[-5]-1,3)*30+101&"|"&MOD(RC[-5]-1,3)*30+102&"|"&MOD(RC[-5]-1,3)*30+103&"|"&IF(MOD(RC[-5],4)=0,HLOOKUP(Sheet1!R2C10,Sheet1!R2C10:R7C10,MOD(RC[-5]/4-1,6)+1,FALSE),IF(MOD(RC[-5],2)=0,IF(RC[-5]>20,HLOOKUP(Sheet1!R2C7,Sheet1!R2C7:R43C7,MOD(RC[-5]/2-1,42)+1,FALSE),HLOOKUP(Sheet1!R2C4,Sheet1!R2C4:R7C4,MOD(RC[-5]-1,6)+1,FALSE)),MOD(RC[-5]-1,3)*30+104)) -> 130|131|132|133|134 | G245: =HLOOKUP(Sheet1!R2C1,Sheet1!R2C1:R16C1,MOD(RC1-1,2)+MOD(INT((RC1-1)/2),3)*5+1,FALSE)&"|"&HLOOKUP(Sheet1!R2C1,Sheet1!R2C1:R16C1,MOD(RC1,2)+MOD(INT((RC1)/2),3)*5+1,FALSE)&"|"&HLOOKUP(Sheet1!R2C1,Sheet1!R2C1:R16C1,MOD(RC1+1,2)+MOD(INT((RC1+1)/2),3)*5+1,FALSE)&"|"&HLOOKUP(Sheet1!R2C1,Sheet1!R2C1:R16C1,MOD(RC1+2,2)+MOD(INT((RC1+2)/2),3)*5+1,FALSE)&"|"&HLOOKUP(Sheet1!R2C1,Sheet1!R2C1:R16C1,MOD(RC1+3,2)+MOD(INT((RC1+3)/2),3)*5+1,FALSE) -> 160|161|100|101|130 | H245: =HLOOKUP(Sheet1!R2C1,Sheet1!R2C1:R16C1,MOD(RC1+2,2)+MOD(INT((RC1+2)/2),3)*5+1,FALSE)&"|"&HLOOKUP(Sheet1!R2C1,Sheet1!R2C1:R16C1,MOD(RC1+3,2)+MOD(INT((RC1+3)/2),3)*5+1,FALSE)&"|"&HLOOKUP(Sheet1!R2C1,Sheet1!R2C1:R16C1,MOD(RC1+4,2)+MOD(INT((RC1+4)/2),3)*5+1,FALSE)&"|"&HLOOKUP(Sheet1!R2C1,Sheet1!R2C1:R16C1,MOD(RC1+5,2)+MOD(INT((RC1+5)/2),3)*5+1,FALSE)&"|"&HLOOKUP(Sheet1!R2C1,Sheet1!R2C1:R16C1,MOD(RC1+6,2)+MOD(INT((RC1+6)/2),3)*5+1,FALSE) -> 101|130|131|160|161 | I245: =HLOOKUP(Sheet1!R2C1,Sheet1!R2C1:R16C1,MOD(RC1-1,3)+MOD(INT((RC1-1)/3),3)*5+3,FALSE)&"|"&HLOOKUP(Sheet1!R2C1,Sheet1!R2C1:R16C1,MOD(RC1,3)+MOD(INT((RC1)/3),3)*5+3,FALSE)&"|"&HLOOKUP(Sheet1!R2C1,Sheet1!R2C1:R16C1,MOD(RC1+1,3)+MOD(INT((RC1+1)/3),3)*5+3,FALSE)&"|"&HLOOKUP(Sheet1!R2C1,Sheet1!R2C1:R16C1,MOD(RC1+2,3)+MOD(INT((RC1+2)/3),3)*5+3,FALSE)&"|"&HLOOKUP(Sheet1!R2C1,Sheet1!R2C1:R16C1,MOD(RC1+3,3)+MOD(INT((RC1+3)/3),3)*5+3,FALSE) -> 133|134|162|163|164 | J245: =HLOOKUP(Sheet1!R2C1,Sheet1!R2C1:R16C1,MOD(RC1-1,3)+MOD(INT((RC1-1)/3),3)*5+3,FALSE)&"|"&HLOOKUP(Sheet1!R2C1,Sheet1!R2C1:R16C1,MOD(RC1,3)+MOD(INT((RC1)/3),3)*5+3,FALSE)&"|"&HLOOKUP(Sheet1!R2C1,Sheet1!R2C1:R16C1,MOD(RC1+1,3)+MOD(INT((RC1+1)/3),3)*5+3,FALSE)&"|"&HLOOKUP(Sheet1!R2C1,Sheet1!R2C1:R16C1,MOD(RC1+2,3)+MOD(INT((RC1+2)/3),3)*5+3,FALSE)&"|"&HLOOKUP(Sheet1!R2C1,Sheet1!R2C1:R16C1,MOD(RC1+3,3)+MOD(INT((RC1+3)/3),3)*5+3,FALSE) -> 133|134|162|163|164 | K245: =HLOOKUP(Sheet1!R2C1,Sheet1!R2C1:R16C1,MOD(RC1-1,3)+MOD(INT((RC1-1)/3),3)*5+3,FALSE)&"|"&HLOOKUP(Sheet1!R2C1,Sheet1!R2C1:R16C1,MOD(RC1,3)+MOD(INT((RC1)/3),3)*5+3,FALSE)&"|"&HLOOKUP(Sheet1!R2C1,Sheet1!R2C1:R16C1,MOD(RC1+1,3)+MOD(INT((RC1+1)/3),3)*5+3,FALSE)&"|"&HLOOKUP(Sheet1!R2C1,Sheet1!R2C1:R16C1,MOD(RC1+2,3)+MOD(INT((RC1+2)/3),3)*5+3,FALSE)&"|"&HLOOKUP(Sheet1!R2C1,Sheet1!R2C1:R16C1,MOD(RC1+3,3)+MOD(INT((RC1+3)/3),3)*5+3,FALSE) -> 133|134|162|163|164 | L245: 25|22|23|24 | M245: 1533407|1533406|1533408|1533408 | N245: 10030|10031|10032|10033 | O245: 1|1|1|1 | P245: 2500|2500|2500|2500
A246: 240 | B246: 238 | C246: 30 | D246: =R[-20]C+2 -> 42 | E246: 1000 | F246: =MOD(RC[-5]-1,3)*30+100&"|"&MOD(RC[-5]-1,3)*30+101&"|"&MOD(RC[-5]-1,3)*30+102&"|"&MOD(RC[-5]-1,3)*30+103&"|"&IF(MOD(RC[-5],4)=0,HLOOKUP(Sheet1!R2C10,Sheet1!R2C10:R7C10,MOD(RC[-5]/4-1,6)+1,FALSE),IF(MOD(RC[-5],2)=0,IF(RC[-5]>20,HLOOKUP(Sheet1!R2C7,Sheet1!R2C7:R43C7,MOD(RC[-5]/2-1,42)+1,FALSE),HLOOKUP(Sheet1!R2C4,Sheet1!R2C4:R7C4,MOD(RC[-5]-1,6)+1,FALSE)),MOD(RC[-5]-1,3)*30+104)) -> 160|161|162|163|195 | G246: =HLOOKUP(Sheet1!R2C1,Sheet1!R2C1:R16C1,MOD(RC1-1,2)+MOD(INT((RC1-1)/2),3)*5+1,FALSE)&"|"&HLOOKUP(Sheet1!R2C1,Sheet1!R2C1:R16C1,MOD(RC1,2)+MOD(INT((RC1)/2),3)*5+1,FALSE)&"|"&HLOOKUP(Sheet1!R2C1,Sheet1!R2C1:R16C1,MOD(RC1+1,2)+MOD(INT((RC1+1)/2),3)*5+1,FALSE)&"|"&HLOOKUP(Sheet1!R2C1,Sheet1!R2C1:R16C1,MOD(RC1+2,2)+MOD(INT((RC1+2)/2),3)*5+1,FALSE)&"|"&HLOOKUP(Sheet1!R2C1,Sheet1!R2C1:R16C1,MOD(RC1+3,2)+MOD(INT((RC1+3)/2),3)*5+1,FALSE) -> 161|100|101|130|131 | H246: =HLOOKUP(Sheet1!R2C1,Sheet1!R2C1:R16C1,MOD(RC1+2,2)+MOD(INT((RC1+2)/2),3)*5+1,FALSE)&"|"&HLOOKUP(Sheet1!R2C1,Sheet1!R2C1:R16C1,MOD(RC1+3,2)+MOD(INT((RC1+3)/2),3)*5+1,FALSE)&"|"&HLOOKUP(Sheet1!R2C1,Sheet1!R2C1:R16C1,MOD(RC1+4,2)+MOD(INT((RC1+4)/2),3)*5+1,FALSE)&"|"&HLOOKUP(Sheet1!R2C1,Sheet1!R2C1:R16C1,MOD(RC1+5,2)+MOD(INT((RC1+5)/2),3)*5+1,FALSE)&"|"&HLOOKUP(Sheet1!R2C1,Sheet1!R2C1:R16C1,MOD(RC1+6,2)+MOD(INT((RC1+6)/2),3)*5+1,FALSE) -> 130|131|160|161|100 | I246: =HLOOKUP(Sheet1!R2C1,Sheet1!R2C1:R16C1,MOD(RC1-1,3)+MOD(INT((RC1-1)/3),3)*5+3,FALSE)&"|"&HLOOKUP(Sheet1!R2C1,Sheet1!R2C1:R16C1,MOD(RC1,3)+MOD(INT((RC1)/3),3)*5+3,FALSE)&"|"&HLOOKUP(Sheet1!R2C1,Sheet1!R2C1:R16C1,MOD(RC1+1,3)+MOD(INT((RC1+1)/3),3)*5+3,FALSE)&"|"&HLOOKUP(Sheet1!R2C1,Sheet1!R2C1:R16C1,MOD(RC1+2,3)+MOD(INT((RC1+2)/3),3)*5+3,FALSE)&"|"&HLOOKUP(Sheet1!R2C1,Sheet1!R2C1:R16C1,MOD(RC1+3,3)+MOD(INT((RC1+3)/3),3)*5+3,FALSE) -> 134|162|163|164|102 | J246: =HLOOKUP(Sheet1!R2C1,Sheet1!R2C1:R16C1,MOD(RC1-1,3)+MOD(INT((RC1-1)/3),3)*5+3,FALSE)&"|"&HLOOKUP(Sheet1!R2C1,Sheet1!R2C1:R16C1,MOD(RC1,3)+MOD(INT((RC1)/3),3)*5+3,FALSE)&"|"&HLOOKUP(Sheet1!R2C1,Sheet1!R2C1:R16C1,MOD(RC1+1,3)+MOD(INT((RC1+1)/3),3)*5+3,FALSE)&"|"&HLOOKUP(Sheet1!R2C1,Sheet1!R2C1:R16C1,MOD(RC1+2,3)+MOD(INT((RC1+2)/3),3)*5+3,FALSE)&"|"&HLOOKUP(Sheet1!R2C1,Sheet1!R2C1:R16C1,MOD(RC1+3,3)+MOD(INT((RC1+3)/3),3)*5+3,FALSE) -> 134|162|163|164|102 | K246: =HLOOKUP(Sheet1!R2C1,Sheet1!R2C1:R16C1,MOD(RC1-1,3)+MOD(INT((RC1-1)/3),3)*5+3,FALSE)&"|"&HLOOKUP(Sheet1!R2C1,Sheet1!R2C1:R16C1,MOD(RC1,3)+MOD(INT((RC1)/3),3)*5+3,FALSE)&"|"&HLOOKUP(Sheet1!R2C1,Sheet1!R2C1:R16C1,MOD(RC1+1,3)+MOD(INT((RC1+1)/3),3)*5+3,FALSE)&"|"&HLOOKUP(Sheet1!R2C1,Sheet1!R2C1:R16C1,MOD(RC1+2,3)+MOD(INT((RC1+2)/3),3)*5+3,FALSE)&"|"&HLOOKUP(Sheet1!R2C1,Sheet1!R2C1:R16C1,MOD(RC1+3,3)+MOD(INT((RC1+3)/3),3)*5+3,FALSE) -> 134|162|163|164|102 | L246: 25|22|23|24 | M246: 1548817|1548816|1548818|1548818 | N246: 10030|10031|10032|10033|10030|10031|10032|10033|10030|10031|10032|10033|10030|10031|10032|10033|10030|10031|10032|10033|10030|10031|10032|10033|10030|10031|10032|10033|10030|10031|10032|10033|10030|10031|10032|10033|10030|10031|10032|10033 | O246: 1|1|1|1|1|1|1|1|1|1|1|1|1|1|1|1|1|1|1|1|1|1|1|1|1|1|1|1|1|1|1|1|1|1|1|1|1|1|1|1 | P246: 2500|2500|2500|2500|2500|2500|2500|2500|2500|2500|2500|2500|2500|2500|2500|2500|2500|2500|2500|2500|2500|2500|2500|2500|2500|2500|2500|2500|2500|2500|2500|2500|2500|2500|2500|2500|2500|2500|2500|2500
A247: 241 | B247: 239 | C247: 30 | D247: =R[-20]C+2 -> 44 | E247: 1000 | F247: =MOD(RC[-5]-1,3)*30+100&"|"&MOD(RC[-5]-1,3)*30+101&"|"&MOD(RC[-5]-1,3)*30+102&"|"&MOD(RC[-5]-1,3)*30+103&"|"&IF(MOD(RC[-5],4)=0,HLOOKUP(Sheet1!R2C10,Sheet1!R2C10:R7C10,MOD(RC[-5]/4-1,6)+1,FALSE),IF(MOD(RC[-5],2)=0,IF(RC[-5]>20,HLOOKUP(Sheet1!R2C7,Sheet1!R2C7:R43C7,MOD(RC[-5]/2-1,42)+1,FALSE),HLOOKUP(Sheet1!R2C4,Sheet1!R2C4:R7C4,MOD(RC[-5]-1,6)+1,FALSE)),MOD(RC[-5]-1,3)*30+104)) -> 100|101|102|103|104 | G247: =HLOOKUP(Sheet1!R2C1,Sheet1!R2C1:R16C1,MOD(RC1-1,2)+MOD(INT((RC1-1)/2),3)*5+1,FALSE)&"|"&HLOOKUP(Sheet1!R2C1,Sheet1!R2C1:R16C1,MOD(RC1,2)+MOD(INT((RC1)/2),3)*5+1,FALSE)&"|"&HLOOKUP(Sheet1!R2C1,Sheet1!R2C1:R16C1,MOD(RC1+1,2)+MOD(INT((RC1+1)/2),3)*5+1,FALSE)&"|"&HLOOKUP(Sheet1!R2C1,Sheet1!R2C1:R16C1,MOD(RC1+2,2)+MOD(INT((RC1+2)/2),3)*5+1,FALSE)&"|"&HLOOKUP(Sheet1!R2C1,Sheet1!R2C1:R16C1,MOD(RC1+3,2)+MOD(INT((RC1+3)/2),3)*5+1,FALSE) -> 100|101|130|131|160 | H247: =HLOOKUP(Sheet1!R2C1,Sheet1!R2C1:R16C1,MOD(RC1+2,2)+MOD(INT((RC1+2)/2),3)*5+1,FALSE)&"|"&HLOOKUP(Sheet1!R2C1,Sheet1!R2C1:R16C1,MOD(RC1+3,2)+MOD(INT((RC1+3)/2),3)*5+1,FALSE)&"|"&HLOOKUP(Sheet1!R2C1,Sheet1!R2C1:R16C1,MOD(RC1+4,2)+MOD(INT((RC1+4)/2),3)*5+1,FALSE)&"|"&HLOOKUP(Sheet1!R2C1,Sheet1!R2C1:R16C1,MOD(RC1+5,2)+MOD(INT((RC1+5)/2),3)*5+1,FALSE)&"|"&HLOOKUP(Sheet1!R2C1,Sheet1!R2C1:R16C1,MOD(RC1+6,2)+MOD(INT((RC1+6)/2),3)*5+1,FALSE) -> 131|160|161|100|101 | I247: =HLOOKUP(Sheet1!R2C1,Sheet1!R2C1:R16C1,MOD(RC1-1,3)+MOD(INT((RC1-1)/3),3)*5+3,FALSE)&"|"&HLOOKUP(Sheet1!R2C1,Sheet1!R2C1:R16C1,MOD(RC1,3)+MOD(INT((RC1)/3),3)*5+3,FALSE)&"|"&HLOOKUP(Sheet1!R2C1,Sheet1!R2C1:R16C1,MOD(RC1+1,3)+MOD(INT((RC1+1)/3),3)*5+3,FALSE)&"|"&HLOOKUP(Sheet1!R2C1,Sheet1!R2C1:R16C1,MOD(RC1+2,3)+MOD(INT((RC1+2)/3),3)*5+3,FALSE)&"|"&HLOOKUP(Sheet1!R2C1,Sheet1!R2C1:R16C1,MOD(RC1+3,3)+MOD(INT((RC1+3)/3),3)*5+3,FALSE) -> 162|163|164|102|103 | J247: =HLOOKUP(Sheet1!R2C1,Sheet1!R2C1:R16C1,MOD(RC1-1,3)+MOD(INT((RC1-1)/3),3)*5+3,FALSE)&"|"&HLOOKUP(Sheet1!R2C1,Sheet1!R2C1:R16C1,MOD(RC1,3)+MOD(INT((RC1)/3),3)*5+3,FALSE)&"|"&HLOOKUP(Sheet1!R2C1,Sheet1!R2C1:R16C1,MOD(RC1+1,3)+MOD(INT((RC1+1)/3),3)*5+3,FALSE)&"|"&HLOOKUP(Sheet1!R2C1,Sheet1!R2C1:R16C1,MOD(RC1+2,3)+MOD(INT((RC1+2)/3),3)*5+3,FALSE)&"|"&HLOOKUP(Sheet1!R2C1,Sheet1!R2C1:R16C1,MOD(RC1+3,3)+MOD(INT((RC1+3)/3),3)*5+3,FALSE) -> 162|163|164|102|103 | K247: =HLOOKUP(Sheet1!R2C1,Sheet1!R2C1:R16C1,MOD(RC1-1,3)+MOD(INT((RC1-1)/3),3)*5+3,FALSE)&"|"&HLOOKUP(Sheet1!R2C1,Sheet1!R2C1:R16C1,MOD(RC1,3)+MOD(INT((RC1)/3),3)*5+3,FALSE)&"|"&HLOOKUP(Sheet1!R2C1,Sheet1!R2C1:R16C1,MOD(RC1+1,3)+MOD(INT((RC1+1)/3),3)*5+3,FALSE)&"|"&HLOOKUP(Sheet1!R2C1,Sheet1!R2C1:R16C1,MOD(RC1+2,3)+MOD(INT((RC1+2)/3),3)*5+3,FALSE)&"|"&HLOOKUP(Sheet1!R2C1,Sheet1!R2C1:R16C1,MOD(RC1+3,3)+MOD(INT((RC1+3)/3),3)*5+3,FALSE) -> 162|163|164|102|103 | L247: 25|22|23|24 | M247: 1564367|1564368|1564368|1564368 | N247: 10030|10031|10032|10033 | O247: 1|1|1|1 | P247: 2500|2500|2500|2500
A248: 242 | B248: 240 | C248: 30 | D248: =R[-20]C+2 -> 44 | E248: 1000 | F248: =MOD(RC[-5]-1,3)*30+100&"|"&MOD(RC[-5]-1,3)*30+101&"|"&MOD(RC[-5]-1,3)*30+102&"|"&MOD(RC[-5]-1,3)*30+103&"|"&IF(MOD(RC[-5],4)=0,HLOOKUP(Sheet1!R2C10,Sheet1!R2C10:R7C10,MOD(RC[-5]/4-1,6)+1,FALSE),IF(MOD(RC[-5],2)=0,IF(RC[-5]>20,HLOOKUP(Sheet1!R2C7,Sheet1!R2C7:R43C7,MOD(RC[-5]/2-1,42)+1,FALSE),HLOOKUP(Sheet1!R2C4,Sheet1!R2C4:R7C4,MOD(RC[-5]-1,6)+1,FALSE)),MOD(RC[-5]-1,3)*30+104)) -> 130|131|132|133|180 | G248: =HLOOKUP(Sheet1!R2C1,Sheet1!R2C1:R16C1,MOD(RC1-1,2)+MOD(INT((RC1-1)/2),3)*5+1,FALSE)&"|"&HLOOKUP(Sheet1!R2C1,Sheet1!R2C1:R16C1,MOD(RC1,2)+MOD(INT((RC1)/2),3)*5+1,FALSE)&"|"&HLOOKUP(Sheet1!R2C1,Sheet1!R2C1:R16C1,MOD(RC1+1,2)+MOD(INT((RC1+1)/2),3)*5+1,FALSE)&"|"&HLOOKUP(Sheet1!R2C1,Sheet1!R2C1:R16C1,MOD(RC1+2,2)+MOD(INT((RC1+2)/2),3)*5+1,FALSE)&"|"&HLOOKUP(Sheet1!R2C1,Sheet1!R2C1:R16C1,MOD(RC1+3,2)+MOD(INT((RC1+3)/2),3)*5+1,FALSE) -> 101|130|131|160|161 | H248: =HLOOKUP(Sheet1!R2C1,Sheet1!R2C1:R16C1,MOD(RC1+2,2)+MOD(INT((RC1+2)/2),3)*5+1,FALSE)&"|"&HLOOKUP(Sheet1!R2C1,Sheet1!R2C1:R16C1,MOD(RC1+3,2)+MOD(INT((RC1+3)/2),3)*5+1,FALSE)&"|"&HLOOKUP(Sheet1!R2C1,Sheet1!R2C1:R16C1,MOD(RC1+4,2)+MOD(INT((RC1+4)/2),3)*5+1,FALSE)&"|"&HLOOKUP(Sheet1!R2C1,Sheet1!R2C1:R16C1,MOD(RC1+5,2)+MOD(INT((RC1+5)/2),3)*5+1,FALSE)&"|"&HLOOKUP(Sheet1!R2C1,Sheet1!R2C1:R16C1,MOD(RC1+6,2)+MOD(INT((RC1+6)/2),3)*5+1,FALSE) -> 160|161|100|101|130 | I248: =HLOOKUP(Sheet1!R2C1,Sheet1!R2C1:R16C1,MOD(RC1-1,3)+MOD(INT((RC1-1)/3),3)*5+3,FALSE)&"|"&HLOOKUP(Sheet1!R2C1,Sheet1!R2C1:R16C1,MOD(RC1,3)+MOD(INT((RC1)/3),3)*5+3,FALSE)&"|"&HLOOKUP(Sheet1!R2C1,Sheet1!R2C1:R16C1,MOD(RC1+1,3)+MOD(INT((RC1+1)/3),3)*5+3,FALSE)&"|"&HLOOKUP(Sheet1!R2C1,Sheet1!R2C1:R16C1,MOD(RC1+2,3)+MOD(INT((RC1+2)/3),3)*5+3,FALSE)&"|"&HLOOKUP(Sheet1!R2C1,Sheet1!R2C1:R16C1,MOD(RC1+3,3)+MOD(INT((RC1+3)/3),3)*5+3,FALSE) -> 163|164|102|103|104 | J248: =HLOOKUP(Sheet1!R2C1,Sheet1!R2C1:R16C1,MOD(RC1-1,3)+MOD(INT((RC1-1)/3),3)*5+3,FALSE)&"|"&HLOOKUP(Sheet1!R2C1,Sheet1!R2C1:R16C1,MOD(RC1,3)+MOD(INT((RC1)/3),3)*5+3,FALSE)&"|"&HLOOKUP(Sheet1!R2C1,Sheet1!R2C1:R16C1,MOD(RC1+1,3)+MOD(INT((RC1+1)/3),3)*5+3,FALSE)&"|"&HLOOKUP(Sheet1!R2C1,Sheet1!R2C1:R16C1,MOD(RC1+2,3)+MOD(INT((RC1+2)/3),3)*5+3,FALSE)&"|"&HLOOKUP(Sheet1!R2C1,Sheet1!R2C1:R16C1,MOD(RC1+3,3)+MOD(INT((RC1+3)/3),3)*5+3,FALSE) -> 163|164|102|103|104 | K248: =HLOOKUP(Sheet1!R2C1,Sheet1!R2C1:R16C1,MOD(RC1-1,3)+MOD(INT((RC1-1)/3),3)*5+3,FALSE)&"|"&HLOOKUP(Sheet1!R2C1,Sheet1!R2C1:R16C1,MOD(RC1,3)+MOD(INT((RC1)/3),3)*5+3,FALSE)&"|"&HLOOKUP(Sheet1!R2C1,Sheet1!R2C1:R16C1,MOD(RC1+1,3)+MOD(INT((RC1+1)/3),3)*5+3,FALSE)&"|"&HLOOKUP(Sheet1!R2C1,Sheet1!R2C1:R16C1,MOD(RC1+2,3)+MOD(INT((RC1+2)/3),3)*5+3,FALSE)&"|"&HLOOKUP(Sheet1!R2C1,Sheet1!R2C1:R16C1,MOD(RC1+3,3)+MOD(INT((RC1+3)/3),3)*5+3,FALSE) -> 163|164|102|103|104 | L248: 25|22|23|24 | M248: 1579342|1579343|1579343|1579343 | N248: 10030|10031|10032|10033 | O248: 1|1|1|1 | P248: 2500|2500|2500|2500
A249: 243 | B249: 241 | C249: 30 | D249: =R[-20]C+2 -> 44 | E249: 1000 | F249: =MOD(RC[-5]-1,3)*30+100&"|"&MOD(RC[-5]-1,3)*30+101&"|"&MOD(RC[-5]-1,3)*30+102&"|"&MOD(RC[-5]-1,3)*30+103&"|"&IF(MOD(RC[-5],4)=0,HLOOKUP(Sheet1!R2C10,Sheet1!R2C10:R7C10,MOD(RC[-5]/4-1,6)+1,FALSE),IF(MOD(RC[-5],2)=0,IF(RC[-5]>20,HLOOKUP(Sheet1!R2C7,Sheet1!R2C7:R43C7,MOD(RC[-5]/2-1,42)+1,FALSE),HLOOKUP(Sheet1!R2C4,Sheet1!R2C4:R7C4,MOD(RC[-5]-1,6)+1,FALSE)),MOD(RC[-5]-1,3)*30+104)) -> 160|161|162|163|164 | G249: =HLOOKUP(Sheet1!R2C1,Sheet1!R2C1:R16C1,MOD(RC1-1,2)+MOD(INT((RC1-1)/2),3)*5+1,FALSE)&"|"&HLOOKUP(Sheet1!R2C1,Sheet1!R2C1:R16C1,MOD(RC1,2)+MOD(INT((RC1)/2),3)*5+1,FALSE)&"|"&HLOOKUP(Sheet1!R2C1,Sheet1!R2C1:R16C1,MOD(RC1+1,2)+MOD(INT((RC1+1)/2),3)*5+1,FALSE)&"|"&HLOOKUP(Sheet1!R2C1,Sheet1!R2C1:R16C1,MOD(RC1+2,2)+MOD(INT((RC1+2)/2),3)*5+1,FALSE)&"|"&HLOOKUP(Sheet1!R2C1,Sheet1!R2C1:R16C1,MOD(RC1+3,2)+MOD(INT((RC1+3)/2),3)*5+1,FALSE) -> 130|131|160|161|100 | H249: =HLOOKUP(Sheet1!R2C1,Sheet1!R2C1:R16C1,MOD(RC1+2,2)+MOD(INT((RC1+2)/2),3)*5+1,FALSE)&"|"&HLOOKUP(Sheet1!R2C1,Sheet1!R2C1:R16C1,MOD(RC1+3,2)+MOD(INT((RC1+3)/2),3)*5+1,FALSE)&"|"&HLOOKUP(Sheet1!R2C1,Sheet1!R2C1:R16C1,MOD(RC1+4,2)+MOD(INT((RC1+4)/2),3)*5+1,FALSE)&"|"&HLOOKUP(Sheet1!R2C1,Sheet1!R2C1:R16C1,MOD(RC1+5,2)+MOD(INT((RC1+5)/2),3)*5+1,FALSE)&"|"&HLOOKUP(Sheet1!R2C1,Sheet1!R2C1:R16C1,MOD(RC1+6,2)+MOD(INT((RC1+6)/2),3)*5+1,FALSE) -> 161|100|101|130|131 | I249: =HLOOKUP(Sheet1!R2C1,Sheet1!R2C1:R16C1,MOD(RC1-1,3)+MOD(INT((RC1-1)/3),3)*5+3,FALSE)&"|"&HLOOKUP(Sheet1!R2C1,Sheet1!R2C1:R16C1,MOD(RC1,3)+MOD(INT((RC1)/3),3)*5+3,FALSE)&"|"&HLOOKUP(Sheet1!R2C1,Sheet1!R2C1:R16C1,MOD(RC1+1,3)+MOD(INT((RC1+1)/3),3)*5+3,FALSE)&"|"&HLOOKUP(Sheet1!R2C1,Sheet1!R2C1:R16C1,MOD(RC1+2,3)+MOD(INT((RC1+2)/3),3)*5+3,FALSE)&"|"&HLOOKUP(Sheet1!R2C1,Sheet1!R2C1:R16C1,MOD(RC1+3,3)+MOD(INT((RC1+3)/3),3)*5+3,FALSE) -> 164|102|103|104|132 | J249: =HLOOKUP(Sheet1!R2C1,Sheet1!R2C1:R16C1,MOD(RC1-1,3)+MOD(INT((RC1-1)/3),3)*5+3,FALSE)&"|"&HLOOKUP(Sheet1!R2C1,Sheet1!R2C1:R16C1,MOD(RC1,3)+MOD(INT((RC1)/3),3)*5+3,FALSE)&"|"&HLOOKUP(Sheet1!R2C1,Sheet1!R2C1:R16C1,MOD(RC1+1,3)+MOD(INT((RC1+1)/3),3)*5+3,FALSE)&"|"&HLOOKUP(Sheet1!R2C1,Sheet1!R2C1:R16C1,MOD(RC1+2,3)+MOD(INT((RC1+2)/3),3)*5+3,FALSE)&"|"&HLOOKUP(Sheet1!R2C1,Sheet1!R2C1:R16C1,MOD(RC1+3,3)+MOD(INT((RC1+3)/3),3)*5+3,FALSE) -> 164|102|103|104|132 | K249: =HLOOKUP(Sheet1!R2C1,Sheet1!R2C1:R16C1,MOD(RC1-1,3)+MOD(INT((RC1-1)/3),3)*5+3,FALSE)&"|"&HLOOKUP(Sheet1!R2C1,Sheet1!R2C1:R16C1,MOD(RC1,3)+MOD(INT((RC1)/3),3)*5+3,FALSE)&"|"&HLOOKUP(Sheet1!R2C1,Sheet1!R2C1:R16C1,MOD(RC1+1,3)+MOD(INT((RC1+1)/3),3)*5+3,FALSE)&"|"&HLOOKUP(Sheet1!R2C1,Sheet1!R2C1:R16C1,MOD(RC1+2,3)+MOD(INT((RC1+2)/3),3)*5+3,FALSE)&"|"&HLOOKUP(Sheet1!R2C1,Sheet1!R2C1:R16C1,MOD(RC1+3,3)+MOD(INT((RC1+3)/3),3)*5+3,FALSE) -> 164|102|103|104|132 | L249: 25|22|23|24 | M249: 1594893|1594893|1594893|1594893 | N249: 10030|10031|10032|10033 | O249: 1|1|1|1 | P249: 2500|2500|2500|2500
A250: 244 | B250: 242 | C250: 30 | D250: =R[-20]C+2 -> 44 | E250: 1000 | F250: =MOD(RC[-5]-1,3)*30+100&"|"&MOD(RC[-5]-1,3)*30+101&"|"&MOD(RC[-5]-1,3)*30+102&"|"&MOD(RC[-5]-1,3)*30+103&"|"&IF(MOD(RC[-5],4)=0,HLOOKUP(Sheet1!R2C10,Sheet1!R2C10:R7C10,MOD(RC[-5]/4-1,6)+1,FALSE),IF(MOD(RC[-5],2)=0,IF(RC[-5]>20,HLOOKUP(Sheet1!R2C7,Sheet1!R2C7:R43C7,MOD(RC[-5]/2-1,42)+1,FALSE),HLOOKUP(Sheet1!R2C4,Sheet1!R2C4:R7C4,MOD(RC[-5]-1,6)+1,FALSE)),MOD(RC[-5]-1,3)*30+104)) -> 100|101|102|103|190 | G250: =HLOOKUP(Sheet1!R2C1,Sheet1!R2C1:R16C1,MOD(RC1-1,2)+MOD(INT((RC1-1)/2),3)*5+1,FALSE)&"|"&HLOOKUP(Sheet1!R2C1,Sheet1!R2C1:R16C1,MOD(RC1,2)+MOD(INT((RC1)/2),3)*5+1,FALSE)&"|"&HLOOKUP(Sheet1!R2C1,Sheet1!R2C1:R16C1,MOD(RC1+1,2)+MOD(INT((RC1+1)/2),3)*5+1,FALSE)&"|"&HLOOKUP(Sheet1!R2C1,Sheet1!R2C1:R16C1,MOD(RC1+2,2)+MOD(INT((RC1+2)/2),3)*5+1,FALSE)&"|"&HLOOKUP(Sheet1!R2C1,Sheet1!R2C1:R16C1,MOD(RC1+3,2)+MOD(INT((RC1+3)/2),3)*5+1,FALSE) -> 131|160|161|100|101 | H250: =HLOOKUP(Sheet1!R2C1,Sheet1!R2C1:R16C1,MOD(RC1+2,2)+MOD(INT((RC1+2)/2),3)*5+1,FALSE)&"|"&HLOOKUP(Sheet1!R2C1,Sheet1!R2C1:R16C1,MOD(RC1+3,2)+MOD(INT((RC1+3)/2),3)*5+1,FALSE)&"|"&HLOOKUP(Sheet1!R2C1,Sheet1!R2C1:R16C1,MOD(RC1+4,2)+MOD(INT((RC1+4)/2),3)*5+1,FALSE)&"|"&HLOOKUP(Sheet1!R2C1,Sheet1!R2C1:R16C1,MOD(RC1+5,2)+MOD(INT((RC1+5)/2),3)*5+1,FALSE)&"|"&HLOOKUP(Sheet1!R2C1,Sheet1!R2C1:R16C1,MOD(RC1+6,2)+MOD(INT((RC1+6)/2),3)*5+1,FALSE) -> 100|101|130|131|160 | I250: =HLOOKUP(Sheet1!R2C1,Sheet1!R2C1:R16C1,MOD(RC1-1,3)+MOD(INT((RC1-1)/3),3)*5+3,FALSE)&"|"&HLOOKUP(Sheet1!R2C1,Sheet1!R2C1:R16C1,MOD(RC1,3)+MOD(INT((RC1)/3),3)*5+3,FALSE)&"|"&HLOOKUP(Sheet1!R2C1,Sheet1!R2C1:R16C1,MOD(RC1+1,3)+MOD(INT((RC1+1)/3),3)*5+3,FALSE)&"|"&HLOOKUP(Sheet1!R2C1,Sheet1!R2C1:R16C1,MOD(RC1+2,3)+MOD(INT((RC1+2)/3),3)*5+3,FALSE)&"|"&HLOOKUP(Sheet1!R2C1,Sheet1!R2C1:R16C1,MOD(RC1+3,3)+MOD(INT((RC1+3)/3),3)*5+3,FALSE) -> 102|103|104|132|133 | J250: =HLOOKUP(Sheet1!R2C1,Sheet1!R2C1:R16C1,MOD(RC1-1,3)+MOD(INT((RC1-1)/3),3)*5+3,FALSE)&"|"&HLOOKUP(Sheet1!R2C1,Sheet1!R2C1:R16C1,MOD(RC1,3)+MOD(INT((RC1)/3),3)*5+3,FALSE)&"|"&HLOOKUP(Sheet1!R2C1,Sheet1!R2C1:R16C1,MOD(RC1+1,3)+MOD(INT((RC1+1)/3),3)*5+3,FALSE)&"|"&HLOOKUP(Sheet1!R2C1,Sheet1!R2C1:R16C1,MOD(RC1+2,3)+MOD(INT((RC1+2)/3),3)*5+3,FALSE)&"|"&HLOOKUP(Sheet1!R2C1,Sheet1!R2C1:R16C1,MOD(RC1+3,3)+MOD(INT((RC1+3)/3),3)*5+3,FALSE) -> 102|103|104|132|133 | K250: =HLOOKUP(Sheet1!R2C1,Sheet1!R2C1:R16C1,MOD(RC1-1,3)+MOD(INT((RC1-1)/3),3)*5+3,FALSE)&"|"&HLOOKUP(Sheet1!R2C1,Sheet1!R2C1:R16C1,MOD(RC1,3)+MOD(INT((RC1)/3),3)*5+3,FALSE)&"|"&HLOOKUP(Sheet1!R2C1,Sheet1!R2C1:R16C1,MOD(RC1+1,3)+MOD(INT((RC1+1)/3),3)*5+3,FALSE)&"|"&HLOOKUP(Sheet1!R2C1,Sheet1!R2C1:R16C1,MOD(RC1+2,3)+MOD(INT((RC1+2)/3),3)*5+3,FALSE)&"|"&HLOOKUP(Sheet1!R2C1,Sheet1!R2C1:R16C1,MOD(RC1+3,3)+MOD(INT((RC1+3)/3),3)*5+3,FALSE) -> 102|103|104|132|133 | L250: 25|22|23|24 | M250: 1610726|1610725|1610725|1610725 | N250: 10030|10031|10032|10033 | O250: 1|1|1|1 | P250: 2500|2500|2500|2500
A251: 245 | B251: 243 | C251: 30 | D251: =R[-20]C+2 -> 44 | E251: 1000 | F251: =MOD(RC[-5]-1,3)*30+100&"|"&MOD(RC[-5]-1,3)*30+101&"|"&MOD(RC[-5]-1,3)*30+102&"|"&MOD(RC[-5]-1,3)*30+103&"|"&IF(MOD(RC[-5],4)=0,HLOOKUP(Sheet1!R2C10,Sheet1!R2C10:R7C10,MOD(RC[-5]/4-1,6)+1,FALSE),IF(MOD(RC[-5],2)=0,IF(RC[-5]>20,HLOOKUP(Sheet1!R2C7,Sheet1!R2C7:R43C7,MOD(RC[-5]/2-1,42)+1,FALSE),HLOOKUP(Sheet1!R2C4,Sheet1!R2C4:R7C4,MOD(RC[-5]-1,6)+1,FALSE)),MOD(RC[-5]-1,3)*30+104)) -> 130|131|132|133|134 | G251: =HLOOKUP(Sheet1!R2C1,Sheet1!R2C1:R16C1,MOD(RC1-1,2)+MOD(INT((RC1-1)/2),3)*5+1,FALSE)&"|"&HLOOKUP(Sheet1!R2C1,Sheet1!R2C1:R16C1,MOD(RC1,2)+MOD(INT((RC1)/2),3)*5+1,FALSE)&"|"&HLOOKUP(Sheet1!R2C1,Sheet1!R2C1:R16C1,MOD(RC1+1,2)+MOD(INT((RC1+1)/2),3)*5+1,FALSE)&"|"&HLOOKUP(Sheet1!R2C1,Sheet1!R2C1:R16C1,MOD(RC1+2,2)+MOD(INT((RC1+2)/2),3)*5+1,FALSE)&"|"&HLOOKUP(Sheet1!R2C1,Sheet1!R2C1:R16C1,MOD(RC1+3,2)+MOD(INT((RC1+3)/2),3)*5+1,FALSE) -> 160|161|100|101|130 | H251: =HLOOKUP(Sheet1!R2C1,Sheet1!R2C1:R16C1,MOD(RC1+2,2)+MOD(INT((RC1+2)/2),3)*5+1,FALSE)&"|"&HLOOKUP(Sheet1!R2C1,Sheet1!R2C1:R16C1,MOD(RC1+3,2)+MOD(INT((RC1+3)/2),3)*5+1,FALSE)&"|"&HLOOKUP(Sheet1!R2C1,Sheet1!R2C1:R16C1,MOD(RC1+4,2)+MOD(INT((RC1+4)/2),3)*5+1,FALSE)&"|"&HLOOKUP(Sheet1!R2C1,Sheet1!R2C1:R16C1,MOD(RC1+5,2)+MOD(INT((RC1+5)/2),3)*5+1,FALSE)&"|"&HLOOKUP(Sheet1!R2C1,Sheet1!R2C1:R16C1,MOD(RC1+6,2)+MOD(INT((RC1+6)/2),3)*5+1,FALSE) -> 101|130|131|160|161 | I251: =HLOOKUP(Sheet1!R2C1,Sheet1!R2C1:R16C1,MOD(RC1-1,3)+MOD(INT((RC1-1)/3),3)*5+3,FALSE)&"|"&HLOOKUP(Sheet1!R2C1,Sheet1!R2C1:R16C1,MOD(RC1,3)+MOD(INT((RC1)/3),3)*5+3,FALSE)&"|"&HLOOKUP(Sheet1!R2C1,Sheet1!R2C1:R16C1,MOD(RC1+1,3)+MOD(INT((RC1+1)/3),3)*5+3,FALSE)&"|"&HLOOKUP(Sheet1!R2C1,Sheet1!R2C1:R16C1,MOD(RC1+2,3)+MOD(INT((RC1+2)/3),3)*5+3,FALSE)&"|"&HLOOKUP(Sheet1!R2C1,Sheet1!R2C1:R16C1,MOD(RC1+3,3)+MOD(INT((RC1+3)/3),3)*5+3,FALSE) -> 103|104|132|133|134 | J251: =HLOOKUP(Sheet1!R2C1,Sheet1!R2C1:R16C1,MOD(RC1-1,3)+MOD(INT((RC1-1)/3),3)*5+3,FALSE)&"|"&HLOOKUP(Sheet1!R2C1,Sheet1!R2C1:R16C1,MOD(RC1,3)+MOD(INT((RC1)/3),3)*5+3,FALSE)&"|"&HLOOKUP(Sheet1!R2C1,Sheet1!R2C1:R16C1,MOD(RC1+1,3)+MOD(INT((RC1+1)/3),3)*5+3,FALSE)&"|"&HLOOKUP(Sheet1!R2C1,Sheet1!R2C1:R16C1,MOD(RC1+2,3)+MOD(INT((RC1+2)/3),3)*5+3,FALSE)&"|"&HLOOKUP(Sheet1!R2C1,Sheet1!R2C1:R16C1,MOD(RC1+3,3)+MOD(INT((RC1+3)/3),3)*5+3,FALSE) -> 103|104|132|133|134 | K251: =HLOOKUP(Sheet1!R2C1,Sheet1!R2C1:R16C1,MOD(RC1-1,3)+MOD(INT((RC1-1)/3),3)*5+3,FALSE)&"|"&HLOOKUP(Sheet1!R2C1,Sheet1!R2C1:R16C1,MOD(RC1,3)+MOD(INT((RC1)/3),3)*5+3,FALSE)&"|"&HLOOKUP(Sheet1!R2C1,Sheet1!R2C1:R16C1,MOD(RC1+1,3)+MOD(INT((RC1+1)/3),3)*5+3,FALSE)&"|"&HLOOKUP(Sheet1!R2C1,Sheet1!R2C1:R16C1,MOD(RC1+2,3)+MOD(INT((RC1+2)/3),3)*5+3,FALSE)&"|"&HLOOKUP(Sheet1!R2C1,Sheet1!R2C1:R16C1,MOD(RC1+3,3)+MOD(INT((RC1+3)/3),3)*5+3,FALSE) -> 103|104|132|133|134 | L251: 25|22|23|24 | M251: 1625972|1625973|1625973|1625973 | N251: 10030|10031|10032|10033|10030|10031|10032|10033|10030|10031|10032|10033|10030|10031|10032|10033|10030|10031|10032|10033|10030|10031|10032|10033|10030|10031|10032|10033|10030|10031|10032|10033|10030|10031|10032|10033|10030|10031|10032|10033 | O251: 1|1|1|1|1|1|1|1|1|1|1|1|1|1|1|1|1|1|1|1|1|1|1|1|1|1|1|1|1|1|1|1|1|1|1|1|1|1|1|1 | P251: 2500|2500|2500|2500|2500|2500|2500|2500|2500|2500|2500|2500|2500|2500|2500|2500|2500|2500|2500|2500|2500|2500|2500|2500|2500|2500|2500|2500|2500|2500|2500|2500|2500|2500|2500|2500|2500|2500|2500|2500
A252: 246 | B252: 244 | C252: 30 | D252: =R[-20]C+2 -> 44 | E252: 1000 | F252: =MOD(RC[-5]-1,3)*30+100&"|"&MOD(RC[-5]-1,3)*30+101&"|"&MOD(RC[-5]-1,3)*30+102&"|"&MOD(RC[-5]-1,3)*30+103&"|"&IF(MOD(RC[-5],4)=0,HLOOKUP(Sheet1!R2C10,Sheet1!R2C10:R7C10,MOD(RC[-5]/4-1,6)+1,FALSE),IF(MOD(RC[-5],2)=0,IF(RC[-5]>20,HLOOKUP(Sheet1!R2C7,Sheet1!R2C7:R43C7,MOD(RC[-5]/2-1,42)+1,FALSE),HLOOKUP(Sheet1!R2C4,Sheet1!R2C4:R7C4,MOD(RC[-5]-1,6)+1,FALSE)),MOD(RC[-5]-1,3)*30+104)) -> 160|161|162|163|182 | G252: =HLOOKUP(Sheet1!R2C1,Sheet1!R2C1:R16C1,MOD(RC1-1,2)+MOD(INT((RC1-1)/2),3)*5+1,FALSE)&"|"&HLOOKUP(Sheet1!R2C1,Sheet1!R2C1:R16C1,MOD(RC1,2)+MOD(INT((RC1)/2),3)*5+1,FALSE)&"|"&HLOOKUP(Sheet1!R2C1,Sheet1!R2C1:R16C1,MOD(RC1+1,2)+MOD(INT((RC1+1)/2),3)*5+1,FALSE)&"|"&HLOOKUP(Sheet1!R2C1,Sheet1!R2C1:R16C1,MOD(RC1+2,2)+MOD(INT((RC1+2)/2),3)*5+1,FALSE)&"|"&HLOOKUP(Sheet1!R2C1,Sheet1!R2C1:R16C1,MOD(RC1+3,2)+MOD(INT((RC1+3)/2),3)*5+1,FALSE) -> 161|100|101|130|131 | H252: =HLOOKUP(Sheet1!R2C1,Sheet1!R2C1:R16C1,MOD(RC1+2,2)+MOD(INT((RC1+2)/2),3)*5+1,FALSE)&"|"&HLOOKUP(Sheet1!R2C1,Sheet1!R2C1:R16C1,MOD(RC1+3,2)+MOD(INT((RC1+3)/2),3)*5+1,FALSE)&"|"&HLOOKUP(Sheet1!R2C1,Sheet1!R2C1:R16C1,MOD(RC1+4,2)+MOD(INT((RC1+4)/2),3)*5+1,FALSE)&"|"&HLOOKUP(Sheet1!R2C1,Sheet1!R2C1:R16C1,MOD(RC1+5,2)+MOD(INT((RC1+5)/2),3)*5+1,FALSE)&"|"&HLOOKUP(Sheet1!R2C1,Sheet1!R2C1:R16C1,MOD(RC1+6,2)+MOD(INT((RC1+6)/2),3)*5+1,FALSE) -> 130|131|160|161|100 | I252: =HLOOKUP(Sheet1!R2C1,Sheet1!R2C1:R16C1,MOD(RC1-1,3)+MOD(INT((RC1-1)/3),3)*5+3,FALSE)&"|"&HLOOKUP(Sheet1!R2C1,Sheet1!R2C1:R16C1,MOD(RC1,3)+MOD(INT((RC1)/3),3)*5+3,FALSE)&"|"&HLOOKUP(Sheet1!R2C1,Sheet1!R2C1:R16C1,MOD(RC1+1,3)+MOD(INT((RC1+1)/3),3)*5+3,FALSE)&"|"&HLOOKUP(Sheet1!R2C1,Sheet1!R2C1:R16C1,MOD(RC1+2,3)+MOD(INT((RC1+2)/3),3)*5+3,FALSE)&"|"&HLOOKUP(Sheet1!R2C1,Sheet1!R2C1:R16C1,MOD(RC1+3,3)+MOD(INT((RC1+3)/3),3)*5+3,FALSE) -> 104|132|133|134|162 | J252: =HLOOKUP(Sheet1!R2C1,Sheet1!R2C1:R16C1,MOD(RC1-1,3)+MOD(INT((RC1-1)/3),3)*5+3,FALSE)&"|"&HLOOKUP(Sheet1!R2C1,Sheet1!R2C1:R16C1,MOD(RC1,3)+MOD(INT((RC1)/3),3)*5+3,FALSE)&"|"&HLOOKUP(Sheet1!R2C1,Sheet1!R2C1:R16C1,MOD(RC1+1,3)+MOD(INT((RC1+1)/3),3)*5+3,FALSE)&"|"&HLOOKUP(Sheet1!R2C1,Sheet1!R2C1:R16C1,MOD(RC1+2,3)+MOD(INT((RC1+2)/3),3)*5+3,FALSE)&"|"&HLOOKUP(Sheet1!R2C1,Sheet1!R2C1:R16C1,MOD(RC1+3,3)+MOD(INT((RC1+3)/3),3)*5+3,FALSE) -> 104|132|133|134|162 | K252: =HLOOKUP(Sheet1!R2C1,Sheet1!R2C1:R16C1,MOD(RC1-1,3)+MOD(INT((RC1-1)/3),3)*5+3,FALSE)&"|"&HLOOKUP(Sheet1!R2C1,Sheet1!R2C1:R16C1,MOD(RC1,3)+MOD(INT((RC1)/3),3)*5+3,FALSE)&"|"&HLOOKUP(Sheet1!R2C1,Sheet1!R2C1:R16C1,MOD(RC1+1,3)+MOD(INT((RC1+1)/3),3)*5+3,FALSE)&"|"&HLOOKUP(Sheet1!R2C1,Sheet1!R2C1:R16C1,MOD(RC1+2,3)+MOD(INT((RC1+2)/3),3)*5+3,FALSE)&"|"&HLOOKUP(Sheet1!R2C1,Sheet1!R2C1:R16C1,MOD(RC1+3,3)+MOD(INT((RC1+3)/3),3)*5+3,FALSE) -> 104|132|133|134|162 | L252: 25|22|23|24 | M252: 1641805|1641805|1641805|1641805 | N252: 10030|10031|10032|10033 | O252: 1|1|1|1 | P252: 2500|2500|2500|2500
A253: 247 | B253: 245 | C253: 30 | D253: =R[-20]C+2 -> 44 | E253: 1000 | F253: =MOD(RC[-5]-1,3)*30+100&"|"&MOD(RC[-5]-1,3)*30+101&"|"&MOD(RC[-5]-1,3)*30+102&"|"&MOD(RC[-5]-1,3)*30+103&"|"&IF(MOD(RC[-5],4)=0,HLOOKUP(Sheet1!R2C10,Sheet1!R2C10:R7C10,MOD(RC[-5]/4-1,6)+1,FALSE),IF(MOD(RC[-5],2)=0,IF(RC[-5]>20,HLOOKUP(Sheet1!R2C7,Sheet1!R2C7:R43C7,MOD(RC[-5]/2-1,42)+1,FALSE),HLOOKUP(Sheet1!R2C4,Sheet1!R2C4:R7C4,MOD(RC[-5]-1,6)+1,FALSE)),MOD(RC[-5]-1,3)*30+104)) -> 100|101|102|103|104 | G253: =HLOOKUP(Sheet1!R2C1,Sheet1!R2C1:R16C1,MOD(RC1-1,2)+MOD(INT((RC1-1)/2),3)*5+1,FALSE)&"|"&HLOOKUP(Sheet1!R2C1,Sheet1!R2C1:R16C1,MOD(RC1,2)+MOD(INT((RC1)/2),3)*5+1,FALSE)&"|"&HLOOKUP(Sheet1!R2C1,Sheet1!R2C1:R16C1,MOD(RC1+1,2)+MOD(INT((RC1+1)/2),3)*5+1,FALSE)&"|"&HLOOKUP(Sheet1!R2C1,Sheet1!R2C1:R16C1,MOD(RC1+2,2)+MOD(INT((RC1+2)/2),3)*5+1,FALSE)&"|"&HLOOKUP(Sheet1!R2C1,Sheet1!R2C1:R16C1,MOD(RC1+3,2)+MOD(INT((RC1+3)/2),3)*5+1,FALSE) -> 100|101|130|131|160 | H253: =HLOOKUP(Sheet1!R2C1,Sheet1!R2C1:R16C1,MOD(RC1+2,2)+MOD(INT((RC1+2)/2),3)*5+1,FALSE)&"|"&HLOOKUP(Sheet1!R2C1,Sheet1!R2C1:R16C1,MOD(RC1+3,2)+MOD(INT((RC1+3)/2),3)*5+1,FALSE)&"|"&HLOOKUP(Sheet1!R2C1,Sheet1!R2C1:R16C1,MOD(RC1+4,2)+MOD(INT((RC1+4)/2),3)*5+1,FALSE)&"|"&HLOOKUP(Sheet1!R2C1,Sheet1!R2C1:R16C1,MOD(RC1+5,2)+MOD(INT((RC1+5)/2),3)*5+1,FALSE)&"|"&HLOOKUP(Sheet1!R2C1,Sheet1!R2C1:R16C1,MOD(RC1+6,2)+MOD(INT((RC1+6)/2),3)*5+1,FALSE) -> 131|160|161|100|101 | I253: =HLOOKUP(Sheet1!R2C1,Sheet1!R2C1:R16C1,MOD(RC1-1,3)+MOD(INT((RC1-1)/3),3)*5+3,FALSE)&"|"&HLOOKUP(Sheet1!R2C1,Sheet1!R2C1:R16C1,MOD(RC1,3)+MOD(INT((RC1)/3),3)*5+3,FALSE)&"|"&HLOOKUP(Sheet1!R2C1,Sheet1!R2C1:R16C1,MOD(RC1+1,3)+MOD(INT((RC1+1)/3),3)*5+3,FALSE)&"|"&HLOOKUP(Sheet1!R2C1,Sheet1!R2C1:R16C1,MOD(RC1+2,3)+MOD(INT((RC1+2)/3),3)*5+3,FALSE)&"|"&HLOOKUP(Sheet1!R2C1,Sheet1!R2C1:R16C1,MOD(RC1+3,3)+MOD(INT((RC1+3)/3),3)*5+3,FALSE) -> 132|133|134|162|163 | J253: =HLOOKUP(Sheet1!R2C1,Sheet1!R2C1:R16C1,MOD(RC1-1,3)+MOD(INT((RC1-1)/3),3)*5+3,FALSE)&"|"&HLOOKUP(Sheet1!R2C1,Sheet1!R2C1:R16C1,MOD(RC1,3)+MOD(INT((RC1)/3),3)*5+3,FALSE)&"|"&HLOOKUP(Sheet1!R2C1,Sheet1!R2C1:R16C1,MOD(RC1+1,3)+MOD(INT((RC1+1)/3),3)*5+3,FALSE)&"|"&HLOOKUP(Sheet1!R2C1,Sheet1!R2C1:R16C1,MOD(RC1+2,3)+MOD(INT((RC1+2)/3),3)*5+3,FALSE)&"|"&HLOOKUP(Sheet1!R2C1,Sheet1!R2C1:R16C1,MOD(RC1+3,3)+MOD(INT((RC1+3)/3),3)*5+3,FALSE) -> 132|133|134|162|163 | K253: =HLOOKUP(Sheet1!R2C1,Sheet1!R2C1:R16C1,MOD(RC1-1,3)+MOD(INT((RC1-1)/3),3)*5+3,FALSE)&"|"&HLOOKUP(Sheet1!R2C1,Sheet1!R2C1:R16C1,MOD(RC1,3)+MOD(INT((RC1)/3),3)*5+3,FALSE)&"|"&HLOOKUP(Sheet1!R2C1,Sheet1!R2C1:R16C1,MOD(RC1+1,3)+MOD(INT((RC1+1)/3),3)*5+3,FALSE)&"|"&HLOOKUP(Sheet1!R2C1,Sheet1!R2C1:R16C1,MOD(RC1+2,3)+MOD(INT((RC1+2)/3),3)*5+3,FALSE)&"|"&HLOOKUP(Sheet1!R2C1,Sheet1!R2C1:R16C1,MOD(RC1+3,3)+MOD(INT((RC1+3)/3),3)*5+3,FALSE) -> 132|133|134|162|163 | L253: 25|22|23|24 | M253: 1657234|1657234|1657233|1657233 | N253: 10030|10031|10032|10033 | O253: 1|1|1|1 | P253: 2500|2500|2500|2500
A254: 248 | B254: 246 | C254: 30 | D254: =R[-20]C+2 -> 44 | E254: 1000 | F254: =MOD(RC[-5]-1,3)*30+100&"|"&MOD(RC[-5]-1,3)*30+101&"|"&MOD(RC[-5]-1,3)*30+102&"|"&MOD(RC[-5]-1,3)*30+103&"|"&IF(MOD(RC[-5],4)=0,HLOOKUP(Sheet1!R2C10,Sheet1!R2C10:R7C10,MOD(RC[-5]/4-1,6)+1,FALSE),IF(MOD(RC[-5],2)=0,IF(RC[-5]>20,HLOOKUP(Sheet1!R2C7,Sheet1!R2C7:R43C7,MOD(RC[-5]/2-1,42)+1,FALSE),HLOOKUP(Sheet1!R2C4,Sheet1!R2C4:R7C4,MOD(RC[-5]-1,6)+1,FALSE)),MOD(RC[-5]-1,3)*30+104)) -> 130|131|132|133|191 | G254: =HLOOKUP(Sheet1!R2C1,Sheet1!R2C1:R16C1,MOD(RC1-1,2)+MOD(INT((RC1-1)/2),3)*5+1,FALSE)&"|"&HLOOKUP(Sheet1!R2C1,Sheet1!R2C1:R16C1,MOD(RC1,2)+MOD(INT((RC1)/2),3)*5+1,FALSE)&"|"&HLOOKUP(Sheet1!R2C1,Sheet1!R2C1:R16C1,MOD(RC1+1,2)+MOD(INT((RC1+1)/2),3)*5+1,FALSE)&"|"&HLOOKUP(Sheet1!R2C1,Sheet1!R2C1:R16C1,MOD(RC1+2,2)+MOD(INT((RC1+2)/2),3)*5+1,FALSE)&"|"&HLOOKUP(Sheet1!R2C1,Sheet1!R2C1:R16C1,MOD(RC1+3,2)+MOD(INT((RC1+3)/2),3)*5+1,FALSE) -> 101|130|131|160|161 | H254: =HLOOKUP(Sheet1!R2C1,Sheet1!R2C1:R16C1,MOD(RC1+2,2)+MOD(INT((RC1+2)/2),3)*5+1,FALSE)&"|"&HLOOKUP(Sheet1!R2C1,Sheet1!R2C1:R16C1,MOD(RC1+3,2)+MOD(INT((RC1+3)/2),3)*5+1,FALSE)&"|"&HLOOKUP(Sheet1!R2C1,Sheet1!R2C1:R16C1,MOD(RC1+4,2)+MOD(INT((RC1+4)/2),3)*5+1,FALSE)&"|"&HLOOKUP(Sheet1!R2C1,Sheet1!R2C1:R16C1,MOD(RC1+5,2)+MOD(INT((RC1+5)/2),3)*5+1,FALSE)&"|"&HLOOKUP(Sheet1!R2C1,Sheet1!R2C1:R16C1,MOD(RC1+6,2)+MOD(INT((RC1+6)/2),3)*5+1,FALSE) -> 160|161|100|101|130 | I254: =HLOOKUP(Sheet1!R2C1,Sheet1!R2C1:R16C1,MOD(RC1-1,3)+MOD(INT((RC1-1)/3),3)*5+3,FALSE)&"|"&HLOOKUP(Sheet1!R2C1,Sheet1!R2C1:R16C1,MOD(RC1,3)+MOD(INT((RC1)/3),3)*5+3,FALSE)&"|"&HLOOKUP(Sheet1!R2C1,Sheet1!R2C1:R16C1,MOD(RC1+1,3)+MOD(INT((RC1+1)/3),3)*5+3,FALSE)&"|"&HLOOKUP(Sheet1!R2C1,Sheet1!R2C1:R16C1,MOD(RC1+2,3)+MOD(INT((RC1+2)/3),3)*5+3,FALSE)&"|"&HLOOKUP(Sheet1!R2C1,Sheet1!R2C1:R16C1,MOD(RC1+3,3)+MOD(INT((RC1+3)/3),3)*5+3,FALSE) -> 133|134|162|163|164 | J254: =HLOOKUP(Sheet1!R2C1,Sheet1!R2C1:R16C1,MOD(RC1-1,3)+MOD(INT((RC1-1)/3),3)*5+3,FALSE)&"|"&HLOOKUP(Sheet1!R2C1,Sheet1!R2C1:R16C1,MOD(RC1,3)+MOD(INT((RC1)/3),3)*5+3,FALSE)&"|"&HLOOKUP(Sheet1!R2C1,Sheet1!R2C1:R16C1,MOD(RC1+1,3)+MOD(INT((RC1+1)/3),3)*5+3,FALSE)&"|"&HLOOKUP(Sheet1!R2C1,Sheet1!R2C1:R16C1,MOD(RC1+2,3)+MOD(INT((RC1+2)/3),3)*5+3,FALSE)&"|"&HLOOKUP(Sheet1!R2C1,Sheet1!R2C1:R16C1,MOD(RC1+3,3)+MOD(INT((RC1+3)/3),3)*5+3,FALSE) -> 133|134|162|163|164 | K254: =HLOOKUP(Sheet1!R2C1,Sheet1!R2C1:R16C1,MOD(RC1-1,3)+MOD(INT((RC1-1)/3),3)*5+3,FALSE)&"|"&HLOOKUP(Sheet1!R2C1,Sheet1!R2C1:R16C1,MOD(RC1,3)+MOD(INT((RC1)/3),3)*5+3,FALSE)&"|"&HLOOKUP(Sheet1!R2C1,Sheet1!R2C1:R16C1,MOD(RC1+1,3)+MOD(INT((RC1+1)/3),3)*5+3,FALSE)&"|"&HLOOKUP(Sheet1!R2C1,Sheet1!R2C1:R16C1,MOD(RC1+2,3)+MOD(INT((RC1+2)/3),3)*5+3,FALSE)&"|"&HLOOKUP(Sheet1!R2C1,Sheet1!R2C1:R16C1,MOD(RC1+3,3)+MOD(INT((RC1+3)/3),3)*5+3,FALSE) -> 133|134|162|163|164 | L254: 25|22|23|24 | M254: 1673886|1673886|1673888|1673888 | N254: 10030|10031|10032|10033 | O254: 1|1|1|1 | P254: 2500|2500|2500|2500
A255: 249 | B255: 247 | C255: 30 | D255: =R[-20]C+2 -> 44 | E255: 1000 | F255: =MOD(RC[-5]-1,3)*30+100&"|"&MOD(RC[-5]-1,3)*30+101&"|"&MOD(RC[-5]-1,3)*30+102&"|"&MOD(RC[-5]-1,3)*30+103&"|"&IF(MOD(RC[-5],4)=0,HLOOKUP(Sheet1!R2C10,Sheet1!R2C10:R7C10,MOD(RC[-5]/4-1,6)+1,FALSE),IF(MOD(RC[-5],2)=0,IF(RC[-5]>20,HLOOKUP(Sheet1!R2C7,Sheet1!R2C7:R43C7,MOD(RC[-5]/2-1,42)+1,FALSE),HLOOKUP(Sheet1!R2C4,Sheet1!R2C4:R7C4,MOD(RC[-5]-1,6)+1,FALSE)),MOD(RC[-5]-1,3)*30+104)) -> 160|161|162|163|164 | G255: =HLOOKUP(Sheet1!R2C1,Sheet1!R2C1:R16C1,MOD(RC1-1,2)+MOD(INT((RC1-1)/2),3)*5+1,FALSE)&"|"&HLOOKUP(Sheet1!R2C1,Sheet1!R2C1:R16C1,MOD(RC1,2)+MOD(INT((RC1)/2),3)*5+1,FALSE)&"|"&HLOOKUP(Sheet1!R2C1,Sheet1!R2C1:R16C1,MOD(RC1+1,2)+MOD(INT((RC1+1)/2),3)*5+1,FALSE)&"|"&HLOOKUP(Sheet1!R2C1,Sheet1!R2C1:R16C1,MOD(RC1+2,2)+MOD(INT((RC1+2)/2),3)*5+1,FALSE)&"|"&HLOOKUP(Sheet1!R2C1,Sheet1!R2C1:R16C1,MOD(RC1+3,2)+MOD(INT((RC1+3)/2),3)*5+1,FALSE) -> 130|131|160|161|100 | H255: =HLOOKUP(Sheet1!R2C1,Sheet1!R2C1:R16C1,MOD(RC1+2,2)+MOD(INT((RC1+2)/2),3)*5+1,FALSE)&"|"&HLOOKUP(Sheet1!R2C1,Sheet1!R2C1:R16C1,MOD(RC1+3,2)+MOD(INT((RC1+3)/2),3)*5+1,FALSE)&"|"&HLOOKUP(Sheet1!R2C1,Sheet1!R2C1:R16C1,MOD(RC1+4,2)+MOD(INT((RC1+4)/2),3)*5+1,FALSE)&"|"&HLOOKUP(Sheet1!R2C1,Sheet1!R2C1:R16C1,MOD(RC1+5,2)+MOD(INT((RC1+5)/2),3)*5+1,FALSE)&"|"&HLOOKUP(Sheet1!R2C1,Sheet1!R2C1:R16C1,MOD(RC1+6,2)+MOD(INT((RC1+6)/2),3)*5+1,FALSE) -> 161|100|101|130|131 | I255: =HLOOKUP(Sheet1!R2C1,Sheet1!R2C1:R16C1,MOD(RC1-1,3)+MOD(INT((RC1-1)/3),3)*5+3,FALSE)&"|"&HLOOKUP(Sheet1!R2C1,Sheet1!R2C1:R16C1,MOD(RC1,3)+MOD(INT((RC1)/3),3)*5+3,FALSE)&"|"&HLOOKUP(Sheet1!R2C1,Sheet1!R2C1:R16C1,MOD(RC1+1,3)+MOD(INT((RC1+1)/3),3)*5+3,FALSE)&"|"&HLOOKUP(Sheet1!R2C1,Sheet1!R2C1:R16C1,MOD(RC1+2,3)+MOD(INT((RC1+2)/3),3)*5+3,FALSE)&"|"&HLOOKUP(Sheet1!R2C1,Sheet1!R2C1:R16C1,MOD(RC1+3,3)+MOD(INT((RC1+3)/3),3)*5+3,FALSE) -> 134|162|163|164|102 | J255: =HLOOKUP(Sheet1!R2C1,Sheet1!R2C1:R16C1,MOD(RC1-1,3)+MOD(INT((RC1-1)/3),3)*5+3,FALSE)&"|"&HLOOKUP(Sheet1!R2C1,Sheet1!R2C1:R16C1,MOD(RC1,3)+MOD(INT((RC1)/3),3)*5+3,FALSE)&"|"&HLOOKUP(Sheet1!R2C1,Sheet1!R2C1:R16C1,MOD(RC1+1,3)+MOD(INT((RC1+1)/3),3)*5+3,FALSE)&"|"&HLOOKUP(Sheet1!R2C1,Sheet1!R2C1:R16C1,MOD(RC1+2,3)+MOD(INT((RC1+2)/3),3)*5+3,FALSE)&"|"&HLOOKUP(Sheet1!R2C1,Sheet1!R2C1:R16C1,MOD(RC1+3,3)+MOD(INT((RC1+3)/3),3)*5+3,FALSE) -> 134|162|163|164|102 | K255: =HLOOKUP(Sheet1!R2C1,Sheet1!R2C1:R16C1,MOD(RC1-1,3)+MOD(INT((RC1-1)/3),3)*5+3,FALSE)&"|"&HLOOKUP(Sheet1!R2C1,Sheet1!R2C1:R16C1,MOD(RC1,3)+MOD(INT((RC1)/3),3)*5+3,FALSE)&"|"&HLOOKUP(Sheet1!R2C1,Sheet1!R2C1:R16C1,MOD(RC1+1,3)+MOD(INT((RC1+1)/3),3)*5+3,FALSE)&"|"&HLOOKUP(Sheet1!R2C1,Sheet1!R2C1:R16C1,MOD(RC1+2,3)+MOD(INT((RC1+2)/3),3)*5+3,FALSE)&"|"&HLOOKUP(Sheet1!R2C1,Sheet1!R2C1:R16C1,MOD(RC1+3,3)+MOD(INT((RC1+3)/3),3)*5+3,FALSE) -> 134|162|163|164|102 | L255: 25|22|23|24 | M255: 1690539|1690539|1690540|1690540 | N255: 10030|10031|10032|10033 | O255: 1|1|1|1 | P255: 2500|2500|2500|2500
A256: 250 | B256: 248 | C256: 30 | D256: =R[-20]C+2 -> 44 | E256: 1000 | F256: =MOD(RC[-5]-1,3)*30+100&"|"&MOD(RC[-5]-1,3)*30+101&"|"&MOD(RC[-5]-1,3)*30+102&"|"&MOD(RC[-5]-1,3)*30+103&"|"&IF(MOD(RC[-5],4)=0,HLOOKUP(Sheet1!R2C10,Sheet1!R2C10:R7C10,MOD(RC[-5]/4-1,6)+1,FALSE),IF(MOD(RC[-5],2)=0,IF(RC[-5]>20,HLOOKUP(Sheet1!R2C7,Sheet1!R2C7:R43C7,MOD(RC[-5]/2-1,42)+1,FALSE),HLOOKUP(Sheet1!R2C4,Sheet1!R2C4:R7C4,MOD(RC[-5]-1,6)+1,FALSE)),MOD(RC[-5]-1,3)*30+104)) -> 100|101|102|103|184 | G256: =HLOOKUP(Sheet1!R2C1,Sheet1!R2C1:R16C1,MOD(RC1-1,2)+MOD(INT((RC1-1)/2),3)*5+1,FALSE)&"|"&HLOOKUP(Sheet1!R2C1,Sheet1!R2C1:R16C1,MOD(RC1,2)+MOD(INT((RC1)/2),3)*5+1,FALSE)&"|"&HLOOKUP(Sheet1!R2C1,Sheet1!R2C1:R16C1,MOD(RC1+1,2)+MOD(INT((RC1+1)/2),3)*5+1,FALSE)&"|"&HLOOKUP(Sheet1!R2C1,Sheet1!R2C1:R16C1,MOD(RC1+2,2)+MOD(INT((RC1+2)/2),3)*5+1,FALSE)&"|"&HLOOKUP(Sheet1!R2C1,Sheet1!R2C1:R16C1,MOD(RC1+3,2)+MOD(INT((RC1+3)/2),3)*5+1,FALSE) -> 131|160|161|100|101 | H256: =HLOOKUP(Sheet1!R2C1,Sheet1!R2C1:R16C1,MOD(RC1+2,2)+MOD(INT((RC1+2)/2),3)*5+1,FALSE)&"|"&HLOOKUP(Sheet1!R2C1,Sheet1!R2C1:R16C1,MOD(RC1+3,2)+MOD(INT((RC1+3)/2),3)*5+1,FALSE)&"|"&HLOOKUP(Sheet1!R2C1,Sheet1!R2C1:R16C1,MOD(RC1+4,2)+MOD(INT((RC1+4)/2),3)*5+1,FALSE)&"|"&HLOOKUP(Sheet1!R2C1,Sheet1!R2C1:R16C1,MOD(RC1+5,2)+MOD(INT((RC1+5)/2),3)*5+1,FALSE)&"|"&HLOOKUP(Sheet1!R2C1,Sheet1!R2C1:R16C1,MOD(RC1+6,2)+MOD(INT((RC1+6)/2),3)*5+1,FALSE) -> 100|101|130|131|160 | I256: =HLOOKUP(Sheet1!R2C1,Sheet1!R2C1:R16C1,MOD(RC1-1,3)+MOD(INT((RC1-1)/3),3)*5+3,FALSE)&"|"&HLOOKUP(Sheet1!R2C1,Sheet1!R2C1:R16C1,MOD(RC1,3)+MOD(INT((RC1)/3),3)*5+3,FALSE)&"|"&HLOOKUP(Sheet1!R2C1,Sheet1!R2C1:R16C1,MOD(RC1+1,3)+MOD(INT((RC1+1)/3),3)*5+3,FALSE)&"|"&HLOOKUP(Sheet1!R2C1,Sheet1!R2C1:R16C1,MOD(RC1+2,3)+MOD(INT((RC1+2)/3),3)*5+3,FALSE)&"|"&HLOOKUP(Sheet1!R2C1,Sheet1!R2C1:R16C1,MOD(RC1+3,3)+MOD(INT((RC1+3)/3),3)*5+3,FALSE) -> 162|163|164|102|103 | J256: =HLOOKUP(Sheet1!R2C1,Sheet1!R2C1:R16C1,MOD(RC1-1,3)+MOD(INT((RC1-1)/3),3)*5+3,FALSE)&"|"&HLOOKUP(Sheet1!R2C1,Sheet1!R2C1:R16C1,MOD(RC1,3)+MOD(INT((RC1)/3),3)*5+3,FALSE)&"|"&HLOOKUP(Sheet1!R2C1,Sheet1!R2C1:R16C1,MOD(RC1+1,3)+MOD(INT((RC1+1)/3),3)*5+3,FALSE)&"|"&HLOOKUP(Sheet1!R2C1,Sheet1!R2C1:R16C1,MOD(RC1+2,3)+MOD(INT((RC1+2)/3),3)*5+3,FALSE)&"|"&HLOOKUP(Sheet1!R2C1,Sheet1!R2C1:R16C1,MOD(RC1+3,3)+MOD(INT((RC1+3)/3),3)*5+3,FALSE) -> 162|163|164|102|103 | K256: =HLOOKUP(Sheet1!R2C1,Sheet1!R2C1:R16C1,MOD(RC1-1,3)+MOD(INT((RC1-1)/3),3)*5+3,FALSE)&"|"&HLOOKUP(Sheet1!R2C1,Sheet1!R2C1:R16C1,MOD(RC1,3)+MOD(INT((RC1)/3),3)*5+3,FALSE)&"|"&HLOOKUP(Sheet1!R2C1,Sheet1!R2C1:R16C1,MOD(RC1+1,3)+MOD(INT((RC1+1)/3),3)*5+3,FALSE)&"|"&HLOOKUP(Sheet1!R2C1,Sheet1!R2C1:R16C1,MOD(RC1+2,3)+MOD(INT((RC1+2)/3),3)*5+3,FALSE)&"|"&HLOOKUP(Sheet1!R2C1,Sheet1!R2C1:R16C1,MOD(RC1+3,3)+MOD(INT((RC1+3)/3),3)*5+3,FALSE) -> 162|163|164|102|103 | L256: 25|22|23|24 | M256: 1706575|1706575|1706575|1706575 | N256: 10030|10031|10032|10033|10030|10031|10032|10033|10030|10031|10032|10033|10030|10031|10032|10033|10030|10031|10032|10033|10030|10031|10032|10033|10030|10031|10032|10033|10030|10031|10032|10033|10030|10031|10032|10033|10030|10031|10032|10033 | O256: 1|1|1|1|1|1|1|1|1|1|1|1|1|1|1|1|1|1|1|1|1|1|1|1|1|1|1|1|1|1|1|1|1|1|1|1|1|1|1|1 | P256: 2500|2500|2500|2500|2500|2500|2500|2500|2500|2500|2500|2500|2500|2500|2500|2500|2500|2500|2500|2500|2500|2500|2500|2500|2500|2500|2500|2500|2500|2500|2500|2500|2500|2500|2500|2500|2500|2500|2500|2500
A257: 251 | B257: 249 | C257: 30 | D257: =R[-20]C+2 -> 44 | E257: 1000 | F257: =MOD(RC[-5]-1,3)*30+100&"|"&MOD(RC[-5]-1,3)*30+101&"|"&MOD(RC[-5]-1,3)*30+102&"|"&MOD(RC[-5]-1,3)*30+103&"|"&IF(MOD(RC[-5],4)=0,HLOOKUP(Sheet1!R2C10,Sheet1!R2C10:R7C10,MOD(RC[-5]/4-1,6)+1,FALSE),IF(MOD(RC[-5],2)=0,IF(RC[-5]>20,HLOOKUP(Sheet1!R2C7,Sheet1!R2C7:R43C7,MOD(RC[-5]/2-1,42)+1,FALSE),HLOOKUP(Sheet1!R2C4,Sheet1!R2C4:R7C4,MOD(RC[-5]-1,6)+1,FALSE)),MOD(RC[-5]-1,3)*30+104)) -> 130|131|132|133|134 | G257: =HLOOKUP(Sheet1!R2C1,Sheet1!R2C1:R16C1,MOD(RC1-1,2)+MOD(INT((RC1-1)/2),3)*5+1,FALSE)&"|"&HLOOKUP(Sheet1!R2C1,Sheet1!R2C1:R16C1,MOD(RC1,2)+MOD(INT((RC1)/2),3)*5+1,FALSE)&"|"&HLOOKUP(Sheet1!R2C1,Sheet1!R2C1:R16C1,MOD(RC1+1,2)+MOD(INT((RC1+1)/2),3)*5+1,FALSE)&"|"&HLOOKUP(Sheet1!R2C1,Sheet1!R2C1:R16C1,MOD(RC1+2,2)+MOD(INT((RC1+2)/2),3)*5+1,FALSE)&"|"&HLOOKUP(Sheet1!R2C1,Sheet1!R2C1:R16C1,MOD(RC1+3,2)+MOD(INT((RC1+3)/2),3)*5+1,FALSE) -> 160|161|100|101|130 | H257: =HLOOKUP(Sheet1!R2C1,Sheet1!R2C1:R16C1,MOD(RC1+2,2)+MOD(INT((RC1+2)/2),3)*5+1,FALSE)&"|"&HLOOKUP(Sheet1!R2C1,Sheet1!R2C1:R16C1,MOD(RC1+3,2)+MOD(INT((RC1+3)/2),3)*5+1,FALSE)&"|"&HLOOKUP(Sheet1!R2C1,Sheet1!R2C1:R16C1,MOD(RC1+4,2)+MOD(INT((RC1+4)/2),3)*5+1,FALSE)&"|"&HLOOKUP(Sheet1!R2C1,Sheet1!R2C1:R16C1,MOD(RC1+5,2)+MOD(INT((RC1+5)/2),3)*5+1,FALSE)&"|"&HLOOKUP(Sheet1!R2C1,Sheet1!R2C1:R16C1,MOD(RC1+6,2)+MOD(INT((RC1+6)/2),3)*5+1,FALSE) -> 101|130|131|160|161 | I257: =HLOOKUP(Sheet1!R2C1,Sheet1!R2C1:R16C1,MOD(RC1-1,3)+MOD(INT((RC1-1)/3),3)*5+3,FALSE)&"|"&HLOOKUP(Sheet1!R2C1,Sheet1!R2C1:R16C1,MOD(RC1,3)+MOD(INT((RC1)/3),3)*5+3,FALSE)&"|"&HLOOKUP(Sheet1!R2C1,Sheet1!R2C1:R16C1,MOD(RC1+1,3)+MOD(INT((RC1+1)/3),3)*5+3,FALSE)&"|"&HLOOKUP(Sheet1!R2C1,Sheet1!R2C1:R16C1,MOD(RC1+2,3)+MOD(INT((RC1+2)/3),3)*5+3,FALSE)&"|"&HLOOKUP(Sheet1!R2C1,Sheet1!R2C1:R16C1,MOD(RC1+3,3)+MOD(INT((RC1+3)/3),3)*5+3,FALSE) -> 163|164|102|103|104 | J257: =HLOOKUP(Sheet1!R2C1,Sheet1!R2C1:R16C1,MOD(RC1-1,3)+MOD(INT((RC1-1)/3),3)*5+3,FALSE)&"|"&HLOOKUP(Sheet1!R2C1,Sheet1!R2C1:R16C1,MOD(RC1,3)+MOD(INT((RC1)/3),3)*5+3,FALSE)&"|"&HLOOKUP(Sheet1!R2C1,Sheet1!R2C1:R16C1,MOD(RC1+1,3)+MOD(INT((RC1+1)/3),3)*5+3,FALSE)&"|"&HLOOKUP(Sheet1!R2C1,Sheet1!R2C1:R16C1,MOD(RC1+2,3)+MOD(INT((RC1+2)/3),3)*5+3,FALSE)&"|"&HLOOKUP(Sheet1!R2C1,Sheet1!R2C1:R16C1,MOD(RC1+3,3)+MOD(INT((RC1+3)/3),3)*5+3,FALSE) -> 163|164|102|103|104 | K257: =HLOOKUP(Sheet1!R2C1,Sheet1!R2C1:R16C1,MOD(RC1-1,3)+MOD(INT((RC1-1)/3),3)*5+3,FALSE)&"|"&HLOOKUP(Sheet1!R2C1,Sheet1!R2C1:R16C1,MOD(RC1,3)+MOD(INT((RC1)/3),3)*5+3,FALSE)&"|"&HLOOKUP(Sheet1!R2C1,Sheet1!R2C1:R16C1,MOD(RC1+1,3)+MOD(INT((RC1+1)/3),3)*5+3,FALSE)&"|"&HLOOKUP(Sheet1!R2C1,Sheet1!R2C1:R16C1,MOD(RC1+2,3)+MOD(INT((RC1+2)/3),3)*5+3,FALSE)&"|"&HLOOKUP(Sheet1!R2C1,Sheet1!R2C1:R16C1,MOD(RC1+3,3)+MOD(INT((RC1+3)/3),3)*5+3,FALSE) -> 163|164|102|103|104 | L257: 25|22|23|24 | M257: 1723508|1723508|1723508|1723508 | N257: 10030|10031|10032|10033 | O257: 1|1|1|1 | P257: 2500|2500|2500|2500
A258: 252 | B258: 250 | C258: 30 | D258: =R[-20]C+2 -> 44 | E258: 1000 | F258: =MOD(RC[-5]-1,3)*30+100&"|"&MOD(RC[-5]-1,3)*30+101&"|"&MOD(RC[-5]-1,3)*30+102&"|"&MOD(RC[-5]-1,3)*30+103&"|"&IF(MOD(RC[-5],4)=0,HLOOKUP(Sheet1!R2C10,Sheet1!R2C10:R7C10,MOD(RC[-5]/4-1,6)+1,FALSE),IF(MOD(RC[-5],2)=0,IF(RC[-5]>20,HLOOKUP(Sheet1!R2C7,Sheet1!R2C7:R43C7,MOD(RC[-5]/2-1,42)+1,FALSE),HLOOKUP(Sheet1!R2C4,Sheet1!R2C4:R7C4,MOD(RC[-5]-1,6)+1,FALSE)),MOD(RC[-5]-1,3)*30+104)) -> 160|161|162|163|192 | G258: =HLOOKUP(Sheet1!R2C1,Sheet1!R2C1:R16C1,MOD(RC1-1,2)+MOD(INT((RC1-1)/2),3)*5+1,FALSE)&"|"&HLOOKUP(Sheet1!R2C1,Sheet1!R2C1:R16C1,MOD(RC1,2)+MOD(INT((RC1)/2),3)*5+1,FALSE)&"|"&HLOOKUP(Sheet1!R2C1,Sheet1!R2C1:R16C1,MOD(RC1+1,2)+MOD(INT((RC1+1)/2),3)*5+1,FALSE)&"|"&HLOOKUP(Sheet1!R2C1,Sheet1!R2C1:R16C1,MOD(RC1+2,2)+MOD(INT((RC1+2)/2),3)*5+1,FALSE)&"|"&HLOOKUP(Sheet1!R2C1,Sheet1!R2C1:R16C1,MOD(RC1+3,2)+MOD(INT((RC1+3)/2),3)*5+1,FALSE) -> 161|100|101|130|131 | H258: =HLOOKUP(Sheet1!R2C1,Sheet1!R2C1:R16C1,MOD(RC1+2,2)+MOD(INT((RC1+2)/2),3)*5+1,FALSE)&"|"&HLOOKUP(Sheet1!R2C1,Sheet1!R2C1:R16C1,MOD(RC1+3,2)+MOD(INT((RC1+3)/2),3)*5+1,FALSE)&"|"&HLOOKUP(Sheet1!R2C1,Sheet1!R2C1:R16C1,MOD(RC1+4,2)+MOD(INT((RC1+4)/2),3)*5+1,FALSE)&"|"&HLOOKUP(Sheet1!R2C1,Sheet1!R2C1:R16C1,MOD(RC1+5,2)+MOD(INT((RC1+5)/2),3)*5+1,FALSE)&"|"&HLOOKUP(Sheet1!R2C1,Sheet1!R2C1:R16C1,MOD(RC1+6,2)+MOD(INT((RC1+6)/2),3)*5+1,FALSE) -> 130|131|160|161|100 | I258: =HLOOKUP(Sheet1!R2C1,Sheet1!R2C1:R16C1,MOD(RC1-1,3)+MOD(INT((RC1-1)/3),3)*5+3,FALSE)&"|"&HLOOKUP(Sheet1!R2C1,Sheet1!R2C1:R16C1,MOD(RC1,3)+MOD(INT((RC1)/3),3)*5+3,FALSE)&"|"&HLOOKUP(Sheet1!R2C1,Sheet1!R2C1:R16C1,MOD(RC1+1,3)+MOD(INT((RC1+1)/3),3)*5+3,FALSE)&"|"&HLOOKUP(Sheet1!R2C1,Sheet1!R2C1:R16C1,MOD(RC1+2,3)+MOD(INT((RC1+2)/3),3)*5+3,FALSE)&"|"&HLOOKUP(Sheet1!R2C1,Sheet1!R2C1:R16C1,MOD(RC1+3,3)+MOD(INT((RC1+3)/3),3)*5+3,FALSE) -> 164|102|103|104|132 | J258: =HLOOKUP(Sheet1!R2C1,Sheet1!R2C1:R16C1,MOD(RC1-1,3)+MOD(INT((RC1-1)/3),3)*5+3,FALSE)&"|"&HLOOKUP(Sheet1!R2C1,Sheet1!R2C1:R16C1,MOD(RC1,3)+MOD(INT((RC1)/3),3)*5+3,FALSE)&"|"&HLOOKUP(Sheet1!R2C1,Sheet1!R2C1:R16C1,MOD(RC1+1,3)+MOD(INT((RC1+1)/3),3)*5+3,FALSE)&"|"&HLOOKUP(Sheet1!R2C1,Sheet1!R2C1:R16C1,MOD(RC1+2,3)+MOD(INT((RC1+2)/3),3)*5+3,FALSE)&"|"&HLOOKUP(Sheet1!R2C1,Sheet1!R2C1:R16C1,MOD(RC1+3,3)+MOD(INT((RC1+3)/3),3)*5+3,FALSE) -> 164|102|103|104|132 | K258: =HLOOKUP(Sheet1!R2C1,Sheet1!R2C1:R16C1,MOD(RC1-1,3)+MOD(INT((RC1-1)/3),3)*5+3,FALSE)&"|"&HLOOKUP(Sheet1!R2C1,Sheet1!R2C1:R16C1,MOD(RC1,3)+MOD(INT((RC1)/3),3)*5+3,FALSE)&"|"&HLOOKUP(Sheet1!R2C1,Sheet1!R2C1:R16C1,MOD(RC1+1,3)+MOD(INT((RC1+1)/3),3)*5+3,FALSE)&"|"&HLOOKUP(Sheet1!R2C1,Sheet1!R2C1:R16C1,MOD(RC1+2,3)+MOD(INT((RC1+2)/3),3)*5+3,FALSE)&"|"&HLOOKUP(Sheet1!R2C1,Sheet1!R2C1:R16C1,MOD(RC1+3,3)+MOD(INT((RC1+3)/3),3)*5+3,FALSE) -> 164|102|103|104|132 | L258: 25|22|23|24 | M258: 1740105|1740105|1740105|1740105 | N258: 10030|10031|10032|10033 | O258: 1|1|1|1 | P258: 2500|2500|2500|2500
A259: 253 | B259: 251 | C259: 30 | D259: =R[-20]C+2 -> 44 | E259: 1000 | F259: =MOD(RC[-5]-1,3)*30+100&"|"&MOD(RC[-5]-1,3)*30+101&"|"&MOD(RC[-5]-1,3)*30+102&"|"&MOD(RC[-5]-1,3)*30+103&"|"&IF(MOD(RC[-5],4)=0,HLOOKUP(Sheet1!R2C10,Sheet1!R2C10:R7C10,MOD(RC[-5]/4-1,6)+1,FALSE),IF(MOD(RC[-5],2)=0,IF(RC[-5]>20,HLOOKUP(Sheet1!R2C7,Sheet1!R2C7:R43C7,MOD(RC[-5]/2-1,42)+1,FALSE),HLOOKUP(Sheet1!R2C4,Sheet1!R2C4:R7C4,MOD(RC[-5]-1,6)+1,FALSE)),MOD(RC[-5]-1,3)*30+104)) -> 100|101|102|103|104 | G259: =HLOOKUP(Sheet1!R2C1,Sheet1!R2C1:R16C1,MOD(RC1-1,2)+MOD(INT((RC1-1)/2),3)*5+1,FALSE)&"|"&HLOOKUP(Sheet1!R2C1,Sheet1!R2C1:R16C1,MOD(RC1,2)+MOD(INT((RC1)/2),3)*5+1,FALSE)&"|"&HLOOKUP(Sheet1!R2C1,Sheet1!R2C1:R16C1,MOD(RC1+1,2)+MOD(INT((RC1+1)/2),3)*5+1,FALSE)&"|"&HLOOKUP(Sheet1!R2C1,Sheet1!R2C1:R16C1,MOD(RC1+2,2)+MOD(INT((RC1+2)/2),3)*5+1,FALSE)&"|"&HLOOKUP(Sheet1!R2C1,Sheet1!R2C1:R16C1,MOD(RC1+3,2)+MOD(INT((RC1+3)/2),3)*5+1,FALSE) -> 100|101|130|131|160 | H259: =HLOOKUP(Sheet1!R2C1,Sheet1!R2C1:R16C1,MOD(RC1+2,2)+MOD(INT((RC1+2)/2),3)*5+1,FALSE)&"|"&HLOOKUP(Sheet1!R2C1,Sheet1!R2C1:R16C1,MOD(RC1+3,2)+MOD(INT((RC1+3)/2),3)*5+1,FALSE)&"|"&HLOOKUP(Sheet1!R2C1,Sheet1!R2C1:R16C1,MOD(RC1+4,2)+MOD(INT((RC1+4)/2),3)*5+1,FALSE)&"|"&HLOOKUP(Sheet1!R2C1,Sheet1!R2C1:R16C1,MOD(RC1+5,2)+MOD(INT((RC1+5)/2),3)*5+1,FALSE)&"|"&HLOOKUP(Sheet1!R2C1,Sheet1!R2C1:R16C1,MOD(RC1+6,2)+MOD(INT((RC1+6)/2),3)*5+1,FALSE) -> 131|160|161|100|101 | I259: =HLOOKUP(Sheet1!R2C1,Sheet1!R2C1:R16C1,MOD(RC1-1,3)+MOD(INT((RC1-1)/3),3)*5+3,FALSE)&"|"&HLOOKUP(Sheet1!R2C1,Sheet1!R2C1:R16C1,MOD(RC1,3)+MOD(INT((RC1)/3),3)*5+3,FALSE)&"|"&HLOOKUP(Sheet1!R2C1,Sheet1!R2C1:R16C1,MOD(RC1+1,3)+MOD(INT((RC1+1)/3),3)*5+3,FALSE)&"|"&HLOOKUP(Sheet1!R2C1,Sheet1!R2C1:R16C1,MOD(RC1+2,3)+MOD(INT((RC1+2)/3),3)*5+3,FALSE)&"|"&HLOOKUP(Sheet1!R2C1,Sheet1!R2C1:R16C1,MOD(RC1+3,3)+MOD(INT((RC1+3)/3),3)*5+3,FALSE) -> 102|103|104|132|133 | J259: =HLOOKUP(Sheet1!R2C1,Sheet1!R2C1:R16C1,MOD(RC1-1,3)+MOD(INT((RC1-1)/3),3)*5+3,FALSE)&"|"&HLOOKUP(Sheet1!R2C1,Sheet1!R2C1:R16C1,MOD(RC1,3)+MOD(INT((RC1)/3),3)*5+3,FALSE)&"|"&HLOOKUP(Sheet1!R2C1,Sheet1!R2C1:R16C1,MOD(RC1+1,3)+MOD(INT((RC1+1)/3),3)*5+3,FALSE)&"|"&HLOOKUP(Sheet1!R2C1,Sheet1!R2C1:R16C1,MOD(RC1+2,3)+MOD(INT((RC1+2)/3),3)*5+3,FALSE)&"|"&HLOOKUP(Sheet1!R2C1,Sheet1!R2C1:R16C1,MOD(RC1+3,3)+MOD(INT((RC1+3)/3),3)*5+3,FALSE) -> 102|103|104|132|133 | K259: =HLOOKUP(Sheet1!R2C1,Sheet1!R2C1:R16C1,MOD(RC1-1,3)+MOD(INT((RC1-1)/3),3)*5+3,FALSE)&"|"&HLOOKUP(Sheet1!R2C1,Sheet1!R2C1:R16C1,MOD(RC1,3)+MOD(INT((RC1)/3),3)*5+3,FALSE)&"|"&HLOOKUP(Sheet1!R2C1,Sheet1!R2C1:R16C1,MOD(RC1+1,3)+MOD(INT((RC1+1)/3),3)*5+3,FALSE)&"|"&HLOOKUP(Sheet1!R2C1,Sheet1!R2C1:R16C1,MOD(RC1+2,3)+MOD(INT((RC1+2)/3),3)*5+3,FALSE)&"|"&HLOOKUP(Sheet1!R2C1,Sheet1!R2C1:R16C1,MOD(RC1+3,3)+MOD(INT((RC1+3)/3),3)*5+3,FALSE) -> 102|103|104|132|133 | L259: 25|22|23|24 | M259: 1757339|1757340|1757340|1757340 | N259: 10030|10031|10032|10033 | O259: 1|1|1|1 | P259: 2500|2500|2500|2500
A260: 254 | B260: 252 | C260: 30 | D260: =R[-20]C+2 -> 44 | E260: 1000 | F260: =MOD(RC[-5]-1,3)*30+100&"|"&MOD(RC[-5]-1,3)*30+101&"|"&MOD(RC[-5]-1,3)*30+102&"|"&MOD(RC[-5]-1,3)*30+103&"|"&IF(MOD(RC[-5],4)=0,HLOOKUP(Sheet1!R2C10,Sheet1!R2C10:R7C10,MOD(RC[-5]/4-1,6)+1,FALSE),IF(MOD(RC[-5],2)=0,IF(RC[-5]>20,HLOOKUP(Sheet1!R2C7,Sheet1!R2C7:R43C7,MOD(RC[-5]/2-1,42)+1,FALSE),HLOOKUP(Sheet1!R2C4,Sheet1!R2C4:R7C4,MOD(RC[-5]-1,6)+1,FALSE)),MOD(RC[-5]-1,3)*30+104)) -> 130|131|132|133|112 | G260: =HLOOKUP(Sheet1!R2C1,Sheet1!R2C1:R16C1,MOD(RC1-1,2)+MOD(INT((RC1-1)/2),3)*5+1,FALSE)&"|"&HLOOKUP(Sheet1!R2C1,Sheet1!R2C1:R16C1,MOD(RC1,2)+MOD(INT((RC1)/2),3)*5+1,FALSE)&"|"&HLOOKUP(Sheet1!R2C1,Sheet1!R2C1:R16C1,MOD(RC1+1,2)+MOD(INT((RC1+1)/2),3)*5+1,FALSE)&"|"&HLOOKUP(Sheet1!R2C1,Sheet1!R2C1:R16C1,MOD(RC1+2,2)+MOD(INT((RC1+2)/2),3)*5+1,FALSE)&"|"&HLOOKUP(Sheet1!R2C1,Sheet1!R2C1:R16C1,MOD(RC1+3,2)+MOD(INT((RC1+3)/2),3)*5+1,FALSE) -> 101|130|131|160|161 | H260: =HLOOKUP(Sheet1!R2C1,Sheet1!R2C1:R16C1,MOD(RC1+2,2)+MOD(INT((RC1+2)/2),3)*5+1,FALSE)&"|"&HLOOKUP(Sheet1!R2C1,Sheet1!R2C1:R16C1,MOD(RC1+3,2)+MOD(INT((RC1+3)/2),3)*5+1,FALSE)&"|"&HLOOKUP(Sheet1!R2C1,Sheet1!R2C1:R16C1,MOD(RC1+4,2)+MOD(INT((RC1+4)/2),3)*5+1,FALSE)&"|"&HLOOKUP(Sheet1!R2C1,Sheet1!R2C1:R16C1,MOD(RC1+5,2)+MOD(INT((RC1+5)/2),3)*5+1,FALSE)&"|"&HLOOKUP(Sheet1!R2C1,Sheet1!R2C1:R16C1,MOD(RC1+6,2)+MOD(INT((RC1+6)/2),3)*5+1,FALSE) -> 160|161|100|101|130 | I260: =HLOOKUP(Sheet1!R2C1,Sheet1!R2C1:R16C1,MOD(RC1-1,3)+MOD(INT((RC1-1)/3),3)*5+3,FALSE)&"|"&HLOOKUP(Sheet1!R2C1,Sheet1!R2C1:R16C1,MOD(RC1,3)+MOD(INT((RC1)/3),3)*5+3,FALSE)&"|"&HLOOKUP(Sheet1!R2C1,Sheet1!R2C1:R16C1,MOD(RC1+1,3)+MOD(INT((RC1+1)/3),3)*5+3,FALSE)&"|"&HLOOKUP(Sheet1!R2C1,Sheet1!R2C1:R16C1,MOD(RC1+2,3)+MOD(INT((RC1+2)/3),3)*5+3,FALSE)&"|"&HLOOKUP(Sheet1!R2C1,Sheet1!R2C1:R16C1,MOD(RC1+3,3)+MOD(INT((RC1+3)/3),3)*5+3,FALSE) -> 103|104|132|133|134 | J260: =HLOOKUP(Sheet1!R2C1,Sheet1!R2C1:R16C1,MOD(RC1-1,3)+MOD(INT((RC1-1)/3),3)*5+3,FALSE)&"|"&HLOOKUP(Sheet1!R2C1,Sheet1!R2C1:R16C1,MOD(RC1,3)+MOD(INT((RC1)/3),3)*5+3,FALSE)&"|"&HLOOKUP(Sheet1!R2C1,Sheet1!R2C1:R16C1,MOD(RC1+1,3)+MOD(INT((RC1+1)/3),3)*5+3,FALSE)&"|"&HLOOKUP(Sheet1!R2C1,Sheet1!R2C1:R16C1,MOD(RC1+2,3)+MOD(INT((RC1+2)/3),3)*5+3,FALSE)&"|"&HLOOKUP(Sheet1!R2C1,Sheet1!R2C1:R16C1,MOD(RC1+3,3)+MOD(INT((RC1+3)/3),3)*5+3,FALSE) -> 103|104|132|133|134 | K260: =HLOOKUP(Sheet1!R2C1,Sheet1!R2C1:R16C1,MOD(RC1-1,3)+MOD(INT((RC1-1)/3),3)*5+3,FALSE)&"|"&HLOOKUP(Sheet1!R2C1,Sheet1!R2C1:R16C1,MOD(RC1,3)+MOD(INT((RC1)/3),3)*5+3,FALSE)&"|"&HLOOKUP(Sheet1!R2C1,Sheet1!R2C1:R16C1,MOD(RC1+1,3)+MOD(INT((RC1+1)/3),3)*5+3,FALSE)&"|"&HLOOKUP(Sheet1!R2C1,Sheet1!R2C1:R16C1,MOD(RC1+2,3)+MOD(INT((RC1+2)/3),3)*5+3,FALSE)&"|"&HLOOKUP(Sheet1!R2C1,Sheet1!R2C1:R16C1,MOD(RC1+3,3)+MOD(INT((RC1+3)/3),3)*5+3,FALSE) -> 103|104|132|133|134 | L260: 25|22|23|24 | M260: 1773936|1773936|1773935|1773935 | N260: 10030|10031|10032|10033 | O260: 1|1|1|1 | P260: 2500|2500|2500|2500
A261: 255 | B261: 253 | C261: 30 | D261: =R[-20]C+2 -> 44 | E261: 1000 | F261: =MOD(RC[-5]-1,3)*30+100&"|"&MOD(RC[-5]-1,3)*30+101&"|"&MOD(RC[-5]-1,3)*30+102&"|"&MOD(RC[-5]-1,3)*30+103&"|"&IF(MOD(RC[-5],4)=0,HLOOKUP(Sheet1!R2C10,Sheet1!R2C10:R7C10,MOD(RC[-5]/4-1,6)+1,FALSE),IF(MOD(RC[-5],2)=0,IF(RC[-5]>20,HLOOKUP(Sheet1!R2C7,Sheet1!R2C7:R43C7,MOD(RC[-5]/2-1,42)+1,FALSE),HLOOKUP(Sheet1!R2C4,Sheet1!R2C4:R7C4,MOD(RC[-5]-1,6)+1,FALSE)),MOD(RC[-5]-1,3)*30+104)) -> 160|161|162|163|164 | G261: =HLOOKUP(Sheet1!R2C1,Sheet1!R2C1:R16C1,MOD(RC1-1,2)+MOD(INT((RC1-1)/2),3)*5+1,FALSE)&"|"&HLOOKUP(Sheet1!R2C1,Sheet1!R2C1:R16C1,MOD(RC1,2)+MOD(INT((RC1)/2),3)*5+1,FALSE)&"|"&HLOOKUP(Sheet1!R2C1,Sheet1!R2C1:R16C1,MOD(RC1+1,2)+MOD(INT((RC1+1)/2),3)*5+1,FALSE)&"|"&HLOOKUP(Sheet1!R2C1,Sheet1!R2C1:R16C1,MOD(RC1+2,2)+MOD(INT((RC1+2)/2),3)*5+1,FALSE)&"|"&HLOOKUP(Sheet1!R2C1,Sheet1!R2C1:R16C1,MOD(RC1+3,2)+MOD(INT((RC1+3)/2),3)*5+1,FALSE) -> 130|131|160|161|100 | H261: =HLOOKUP(Sheet1!R2C1,Sheet1!R2C1:R16C1,MOD(RC1+2,2)+MOD(INT((RC1+2)/2),3)*5+1,FALSE)&"|"&HLOOKUP(Sheet1!R2C1,Sheet1!R2C1:R16C1,MOD(RC1+3,2)+MOD(INT((RC1+3)/2),3)*5+1,FALSE)&"|"&HLOOKUP(Sheet1!R2C1,Sheet1!R2C1:R16C1,MOD(RC1+4,2)+MOD(INT((RC1+4)/2),3)*5+1,FALSE)&"|"&HLOOKUP(Sheet1!R2C1,Sheet1!R2C1:R16C1,MOD(RC1+5,2)+MOD(INT((RC1+5)/2),3)*5+1,FALSE)&"|"&HLOOKUP(Sheet1!R2C1,Sheet1!R2C1:R16C1,MOD(RC1+6,2)+MOD(INT((RC1+6)/2),3)*5+1,FALSE) -> 161|100|101|130|131 | I261: =HLOOKUP(Sheet1!R2C1,Sheet1!R2C1:R16C1,MOD(RC1-1,3)+MOD(INT((RC1-1)/3),3)*5+3,FALSE)&"|"&HLOOKUP(Sheet1!R2C1,Sheet1!R2C1:R16C1,MOD(RC1,3)+MOD(INT((RC1)/3),3)*5+3,FALSE)&"|"&HLOOKUP(Sheet1!R2C1,Sheet1!R2C1:R16C1,MOD(RC1+1,3)+MOD(INT((RC1+1)/3),3)*5+3,FALSE)&"|"&HLOOKUP(Sheet1!R2C1,Sheet1!R2C1:R16C1,MOD(RC1+2,3)+MOD(INT((RC1+2)/3),3)*5+3,FALSE)&"|"&HLOOKUP(Sheet1!R2C1,Sheet1!R2C1:R16C1,MOD(RC1+3,3)+MOD(INT((RC1+3)/3),3)*5+3,FALSE) -> 104|132|133|134|162 | J261: =HLOOKUP(Sheet1!R2C1,Sheet1!R2C1:R16C1,MOD(RC1-1,3)+MOD(INT((RC1-1)/3),3)*5+3,FALSE)&"|"&HLOOKUP(Sheet1!R2C1,Sheet1!R2C1:R16C1,MOD(RC1,3)+MOD(INT((RC1)/3),3)*5+3,FALSE)&"|"&HLOOKUP(Sheet1!R2C1,Sheet1!R2C1:R16C1,MOD(RC1+1,3)+MOD(INT((RC1+1)/3),3)*5+3,FALSE)&"|"&HLOOKUP(Sheet1!R2C1,Sheet1!R2C1:R16C1,MOD(RC1+2,3)+MOD(INT((RC1+2)/3),3)*5+3,FALSE)&"|"&HLOOKUP(Sheet1!R2C1,Sheet1!R2C1:R16C1,MOD(RC1+3,3)+MOD(INT((RC1+3)/3),3)*5+3,FALSE) -> 104|132|133|134|162 | K261: =HLOOKUP(Sheet1!R2C1,Sheet1!R2C1:R16C1,MOD(RC1-1,3)+MOD(INT((RC1-1)/3),3)*5+3,FALSE)&"|"&HLOOKUP(Sheet1!R2C1,Sheet1!R2C1:R16C1,MOD(RC1,3)+MOD(INT((RC1)/3),3)*5+3,FALSE)&"|"&HLOOKUP(Sheet1!R2C1,Sheet1!R2C1:R16C1,MOD(RC1+1,3)+MOD(INT((RC1+1)/3),3)*5+3,FALSE)&"|"&HLOOKUP(Sheet1!R2C1,Sheet1!R2C1:R16C1,MOD(RC1+2,3)+MOD(INT((RC1+2)/3),3)*5+3,FALSE)&"|"&HLOOKUP(Sheet1!R2C1,Sheet1!R2C1:R16C1,MOD(RC1+3,3)+MOD(INT((RC1+3)/3),3)*5+3,FALSE) -> 104|132|133|134|162 | L261: 25|22|23|24 | M261: 1790935|1790935|1790935|1790935 | N261: 10030|10031|10032|10033|10030|10031|10032|10033|10030|10031|10032|10033|10030|10031|10032|10033|10030|10031|10032|10033|10030|10031|10032|10033|10030|10031|10032|10033|10030|10031|10032|10033|10030|10031|10032|10033|10030|10031|10032|10033 | O261: 1|1|1|1|1|1|1|1|1|1|1|1|1|1|1|1|1|1|1|1|1|1|1|1|1|1|1|1|1|1|1|1|1|1|1|1|1|1|1|1 | P261: 2500|2500|2500|2500|2500|2500|2500|2500|2500|2500|2500|2500|2500|2500|2500|2500|2500|2500|2500|2500|2500|2500|2500|2500|2500|2500|2500|2500|2500|2500|2500|2500|2500|2500|2500|2500|2500|2500|2500|2500
A262: 256 | B262: 254 | C262: 30 | D262: =R[-20]C+2 -> 44 | E262: 1000 | F262: =MOD(RC[-5]-1,3)*30+100&"|"&MOD(RC[-5]-1,3)*30+101&"|"&MOD(RC[-5]-1,3)*30+102&"|"&MOD(RC[-5]-1,3)*30+103&"|"&IF(MOD(RC[-5],4)=0,HLOOKUP(Sheet1!R2C10,Sheet1!R2C10:R7C10,MOD(RC[-5]/4-1,6)+1,FALSE),IF(MOD(RC[-5],2)=0,IF(RC[-5]>20,HLOOKUP(Sheet1!R2C7,Sheet1!R2C7:R43C7,MOD(RC[-5]/2-1,42)+1,FALSE),HLOOKUP(Sheet1!R2C4,Sheet1!R2C4:R7C4,MOD(RC[-5]-1,6)+1,FALSE)),MOD(RC[-5]-1,3)*30+104)) -> 100|101|102|103|193 | G262: =HLOOKUP(Sheet1!R2C1,Sheet1!R2C1:R16C1,MOD(RC1-1,2)+MOD(INT((RC1-1)/2),3)*5+1,FALSE)&"|"&HLOOKUP(Sheet1!R2C1,Sheet1!R2C1:R16C1,MOD(RC1,2)+MOD(INT((RC1)/2),3)*5+1,FALSE)&"|"&HLOOKUP(Sheet1!R2C1,Sheet1!R2C1:R16C1,MOD(RC1+1,2)+MOD(INT((RC1+1)/2),3)*5+1,FALSE)&"|"&HLOOKUP(Sheet1!R2C1,Sheet1!R2C1:R16C1,MOD(RC1+2,2)+MOD(INT((RC1+2)/2),3)*5+1,FALSE)&"|"&HLOOKUP(Sheet1!R2C1,Sheet1!R2C1:R16C1,MOD(RC1+3,2)+MOD(INT((RC1+3)/2),3)*5+1,FALSE) -> 131|160|161|100|101 | H262: =HLOOKUP(Sheet1!R2C1,Sheet1!R2C1:R16C1,MOD(RC1+2,2)+MOD(INT((RC1+2)/2),3)*5+1,FALSE)&"|"&HLOOKUP(Sheet1!R2C1,Sheet1!R2C1:R16C1,MOD(RC1+3,2)+MOD(INT((RC1+3)/2),3)*5+1,FALSE)&"|"&HLOOKUP(Sheet1!R2C1,Sheet1!R2C1:R16C1,MOD(RC1+4,2)+MOD(INT((RC1+4)/2),3)*5+1,FALSE)&"|"&HLOOKUP(Sheet1!R2C1,Sheet1!R2C1:R16C1,MOD(RC1+5,2)+MOD(INT((RC1+5)/2),3)*5+1,FALSE)&"|"&HLOOKUP(Sheet1!R2C1,Sheet1!R2C1:R16C1,MOD(RC1+6,2)+MOD(INT((RC1+6)/2),3)*5+1,FALSE) -> 100|101|130|131|160 | I262: =HLOOKUP(Sheet1!R2C1,Sheet1!R2C1:R16C1,MOD(RC1-1,3)+MOD(INT((RC1-1)/3),3)*5+3,FALSE)&"|"&HLOOKUP(Sheet1!R2C1,Sheet1!R2C1:R16C1,MOD(RC1,3)+MOD(INT((RC1)/3),3)*5+3,FALSE)&"|"&HLOOKUP(Sheet1!R2C1,Sheet1!R2C1:R16C1,MOD(RC1+1,3)+MOD(INT((RC1+1)/3),3)*5+3,FALSE)&"|"&HLOOKUP(Sheet1!R2C1,Sheet1!R2C1:R16C1,MOD(RC1+2,3)+MOD(INT((RC1+2)/3),3)*5+3,FALSE)&"|"&HLOOKUP(Sheet1!R2C1,Sheet1!R2C1:R16C1,MOD(RC1+3,3)+MOD(INT((RC1+3)/3),3)*5+3,FALSE) -> 132|133|134|162|163 | J262: =HLOOKUP(Sheet1!R2C1,Sheet1!R2C1:R16C1,MOD(RC1-1,3)+MOD(INT((RC1-1)/3),3)*5+3,FALSE)&"|"&HLOOKUP(Sheet1!R2C1,Sheet1!R2C1:R16C1,MOD(RC1,3)+MOD(INT((RC1)/3),3)*5+3,FALSE)&"|"&HLOOKUP(Sheet1!R2C1,Sheet1!R2C1:R16C1,MOD(RC1+1,3)+MOD(INT((RC1+1)/3),3)*5+3,FALSE)&"|"&HLOOKUP(Sheet1!R2C1,Sheet1!R2C1:R16C1,MOD(RC1+2,3)+MOD(INT((RC1+2)/3),3)*5+3,FALSE)&"|"&HLOOKUP(Sheet1!R2C1,Sheet1!R2C1:R16C1,MOD(RC1+3,3)+MOD(INT((RC1+3)/3),3)*5+3,FALSE) -> 132|133|134|162|163 | K262: =HLOOKUP(Sheet1!R2C1,Sheet1!R2C1:R16C1,MOD(RC1-1,3)+MOD(INT((RC1-1)/3),3)*5+3,FALSE)&"|"&HLOOKUP(Sheet1!R2C1,Sheet1!R2C1:R16C1,MOD(RC1,3)+MOD(INT((RC1)/3),3)*5+3,FALSE)&"|"&HLOOKUP(Sheet1!R2C1,Sheet1!R2C1:R16C1,MOD(RC1+1,3)+MOD(INT((RC1+1)/3),3)*5+3,FALSE)&"|"&HLOOKUP(Sheet1!R2C1,Sheet1!R2C1:R16C1,MOD(RC1+2,3)+MOD(INT((RC1+2)/3),3)*5+3,FALSE)&"|"&HLOOKUP(Sheet1!R2C1,Sheet1!R2C1:R16C1,MOD(RC1+3,3)+MOD(INT((RC1+3)/3),3)*5+3,FALSE) -> 132|133|134|162|163 | L262: 25|22|23|24 | M262: 1808774|1808774|1808775|1808775 | N262: 10030|10031|10032|10033 | O262: 1|1|1|1 | P262: 2500|2500|2500|2500
A263: 257 | B263: 255 | C263: 30 | D263: =R[-20]C+2 -> 44 | E263: 1000 | F263: =MOD(RC[-5]-1,3)*30+100&"|"&MOD(RC[-5]-1,3)*30+101&"|"&MOD(RC[-5]-1,3)*30+102&"|"&MOD(RC[-5]-1,3)*30+103&"|"&IF(MOD(RC[-5],4)=0,HLOOKUP(Sheet1!R2C10,Sheet1!R2C10:R7C10,MOD(RC[-5]/4-1,6)+1,FALSE),IF(MOD(RC[-5],2)=0,IF(RC[-5]>20,HLOOKUP(Sheet1!R2C7,Sheet1!R2C7:R43C7,MOD(RC[-5]/2-1,42)+1,FALSE),HLOOKUP(Sheet1!R2C4,Sheet1!R2C4:R7C4,MOD(RC[-5]-1,6)+1,FALSE)),MOD(RC[-5]-1,3)*30+104)) -> 130|131|132|133|134 | G263: =HLOOKUP(Sheet1!R2C1,Sheet1!R2C1:R16C1,MOD(RC1-1,2)+MOD(INT((RC1-1)/2),3)*5+1,FALSE)&"|"&HLOOKUP(Sheet1!R2C1,Sheet1!R2C1:R16C1,MOD(RC1,2)+MOD(INT((RC1)/2),3)*5+1,FALSE)&"|"&HLOOKUP(Sheet1!R2C1,Sheet1!R2C1:R16C1,MOD(RC1+1,2)+MOD(INT((RC1+1)/2),3)*5+1,FALSE)&"|"&HLOOKUP(Sheet1!R2C1,Sheet1!R2C1:R16C1,MOD(RC1+2,2)+MOD(INT((RC1+2)/2),3)*5+1,FALSE)&"|"&HLOOKUP(Sheet1!R2C1,Sheet1!R2C1:R16C1,MOD(RC1+3,2)+MOD(INT((RC1+3)/2),3)*5+1,FALSE) -> 160|161|100|101|130 | H263: =HLOOKUP(Sheet1!R2C1,Sheet1!R2C1:R16C1,MOD(RC1+2,2)+MOD(INT((RC1+2)/2),3)*5+1,FALSE)&"|"&HLOOKUP(Sheet1!R2C1,Sheet1!R2C1:R16C1,MOD(RC1+3,2)+MOD(INT((RC1+3)/2),3)*5+1,FALSE)&"|"&HLOOKUP(Sheet1!R2C1,Sheet1!R2C1:R16C1,MOD(RC1+4,2)+MOD(INT((RC1+4)/2),3)*5+1,FALSE)&"|"&HLOOKUP(Sheet1!R2C1,Sheet1!R2C1:R16C1,MOD(RC1+5,2)+MOD(INT((RC1+5)/2),3)*5+1,FALSE)&"|"&HLOOKUP(Sheet1!R2C1,Sheet1!R2C1:R16C1,MOD(RC1+6,2)+MOD(INT((RC1+6)/2),3)*5+1,FALSE) -> 101|130|131|160|161 | I263: =HLOOKUP(Sheet1!R2C1,Sheet1!R2C1:R16C1,MOD(RC1-1,3)+MOD(INT((RC1-1)/3),3)*5+3,FALSE)&"|"&HLOOKUP(Sheet1!R2C1,Sheet1!R2C1:R16C1,MOD(RC1,3)+MOD(INT((RC1)/3),3)*5+3,FALSE)&"|"&HLOOKUP(Sheet1!R2C1,Sheet1!R2C1:R16C1,MOD(RC1+1,3)+MOD(INT((RC1+1)/3),3)*5+3,FALSE)&"|"&HLOOKUP(Sheet1!R2C1,Sheet1!R2C1:R16C1,MOD(RC1+2,3)+MOD(INT((RC1+2)/3),3)*5+3,FALSE)&"|"&HLOOKUP(Sheet1!R2C1,Sheet1!R2C1:R16C1,MOD(RC1+3,3)+MOD(INT((RC1+3)/3),3)*5+3,FALSE) -> 133|134|162|163|164 | J263: =HLOOKUP(Sheet1!R2C1,Sheet1!R2C1:R16C1,MOD(RC1-1,3)+MOD(INT((RC1-1)/3),3)*5+3,FALSE)&"|"&HLOOKUP(Sheet1!R2C1,Sheet1!R2C1:R16C1,MOD(RC1,3)+MOD(INT((RC1)/3),3)*5+3,FALSE)&"|"&HLOOKUP(Sheet1!R2C1,Sheet1!R2C1:R16C1,MOD(RC1+1,3)+MOD(INT((RC1+1)/3),3)*5+3,FALSE)&"|"&HLOOKUP(Sheet1!R2C1,Sheet1!R2C1:R16C1,MOD(RC1+2,3)+MOD(INT((RC1+2)/3),3)*5+3,FALSE)&"|"&HLOOKUP(Sheet1!R2C1,Sheet1!R2C1:R16C1,MOD(RC1+3,3)+MOD(INT((RC1+3)/3),3)*5+3,FALSE) -> 133|134|162|163|164 | K263: =HLOOKUP(Sheet1!R2C1,Sheet1!R2C1:R16C1,MOD(RC1-1,3)+MOD(INT((RC1-1)/3),3)*5+3,FALSE)&"|"&HLOOKUP(Sheet1!R2C1,Sheet1!R2C1:R16C1,MOD(RC1,3)+MOD(INT((RC1)/3),3)*5+3,FALSE)&"|"&HLOOKUP(Sheet1!R2C1,Sheet1!R2C1:R16C1,MOD(RC1+1,3)+MOD(INT((RC1+1)/3),3)*5+3,FALSE)&"|"&HLOOKUP(Sheet1!R2C1,Sheet1!R2C1:R16C1,MOD(RC1+2,3)+MOD(INT((RC1+2)/3),3)*5+3,FALSE)&"|"&HLOOKUP(Sheet1!R2C1,Sheet1!R2C1:R16C1,MOD(RC1+3,3)+MOD(INT((RC1+3)/3),3)*5+3,FALSE) -> 133|134|162|163|164 | L263: 25|22|23|24 | M263: 1825953|1825953|1825953|1825953 | N263: 10030|10031|10032|10033 | O263: 1|1|1|1 | P263: 2500|2500|2500|2500
A264: 258 | B264: 256 | C264: 30 | D264: =R[-20]C+2 -> 44 | E264: 1000 | F264: =MOD(RC[-5]-1,3)*30+100&"|"&MOD(RC[-5]-1,3)*30+101&"|"&MOD(RC[-5]-1,3)*30+102&"|"&MOD(RC[-5]-1,3)*30+103&"|"&IF(MOD(RC[-5],4)=0,HLOOKUP(Sheet1!R2C10,Sheet1!R2C10:R7C10,MOD(RC[-5]/4-1,6)+1,FALSE),IF(MOD(RC[-5],2)=0,IF(RC[-5]>20,HLOOKUP(Sheet1!R2C7,Sheet1!R2C7:R43C7,MOD(RC[-5]/2-1,42)+1,FALSE),HLOOKUP(Sheet1!R2C4,Sheet1!R2C4:R7C4,MOD(RC[-5]-1,6)+1,FALSE)),MOD(RC[-5]-1,3)*30+104)) -> 160|161|162|163|114 | G264: =HLOOKUP(Sheet1!R2C1,Sheet1!R2C1:R16C1,MOD(RC1-1,2)+MOD(INT((RC1-1)/2),3)*5+1,FALSE)&"|"&HLOOKUP(Sheet1!R2C1,Sheet1!R2C1:R16C1,MOD(RC1,2)+MOD(INT((RC1)/2),3)*5+1,FALSE)&"|"&HLOOKUP(Sheet1!R2C1,Sheet1!R2C1:R16C1,MOD(RC1+1,2)+MOD(INT((RC1+1)/2),3)*5+1,FALSE)&"|"&HLOOKUP(Sheet1!R2C1,Sheet1!R2C1:R16C1,MOD(RC1+2,2)+MOD(INT((RC1+2)/2),3)*5+1,FALSE)&"|"&HLOOKUP(Sheet1!R2C1,Sheet1!R2C1:R16C1,MOD(RC1+3,2)+MOD(INT((RC1+3)/2),3)*5+1,FALSE) -> 161|100|101|130|131 | H264: =HLOOKUP(Sheet1!R2C1,Sheet1!R2C1:R16C1,MOD(RC1+2,2)+MOD(INT((RC1+2)/2),3)*5+1,FALSE)&"|"&HLOOKUP(Sheet1!R2C1,Sheet1!R2C1:R16C1,MOD(RC1+3,2)+MOD(INT((RC1+3)/2),3)*5+1,FALSE)&"|"&HLOOKUP(Sheet1!R2C1,Sheet1!R2C1:R16C1,MOD(RC1+4,2)+MOD(INT((RC1+4)/2),3)*5+1,FALSE)&"|"&HLOOKUP(Sheet1!R2C1,Sheet1!R2C1:R16C1,MOD(RC1+5,2)+MOD(INT((RC1+5)/2),3)*5+1,FALSE)&"|"&HLOOKUP(Sheet1!R2C1,Sheet1!R2C1:R16C1,MOD(RC1+6,2)+MOD(INT((RC1+6)/2),3)*5+1,FALSE) -> 130|131|160|161|100 | I264: =HLOOKUP(Sheet1!R2C1,Sheet1!R2C1:R16C1,MOD(RC1-1,3)+MOD(INT((RC1-1)/3),3)*5+3,FALSE)&"|"&HLOOKUP(Sheet1!R2C1,Sheet1!R2C1:R16C1,MOD(RC1,3)+MOD(INT((RC1)/3),3)*5+3,FALSE)&"|"&HLOOKUP(Sheet1!R2C1,Sheet1!R2C1:R16C1,MOD(RC1+1,3)+MOD(INT((RC1+1)/3),3)*5+3,FALSE)&"|"&HLOOKUP(Sheet1!R2C1,Sheet1!R2C1:R16C1,MOD(RC1+2,3)+MOD(INT((RC1+2)/3),3)*5+3,FALSE)&"|"&HLOOKUP(Sheet1!R2C1,Sheet1!R2C1:R16C1,MOD(RC1+3,3)+MOD(INT((RC1+3)/3),3)*5+3,FALSE) -> 134|162|163|164|102 | J264: =HLOOKUP(Sheet1!R2C1,Sheet1!R2C1:R16C1,MOD(RC1-1,3)+MOD(INT((RC1-1)/3),3)*5+3,FALSE)&"|"&HLOOKUP(Sheet1!R2C1,Sheet1!R2C1:R16C1,MOD(RC1,3)+MOD(INT((RC1)/3),3)*5+3,FALSE)&"|"&HLOOKUP(Sheet1!R2C1,Sheet1!R2C1:R16C1,MOD(RC1+1,3)+MOD(INT((RC1+1)/3),3)*5+3,FALSE)&"|"&HLOOKUP(Sheet1!R2C1,Sheet1!R2C1:R16C1,MOD(RC1+2,3)+MOD(INT((RC1+2)/3),3)*5+3,FALSE)&"|"&HLOOKUP(Sheet1!R2C1,Sheet1!R2C1:R16C1,MOD(RC1+3,3)+MOD(INT((RC1+3)/3),3)*5+3,FALSE) -> 134|162|163|164|102 | K264: =HLOOKUP(Sheet1!R2C1,Sheet1!R2C1:R16C1,MOD(RC1-1,3)+MOD(INT((RC1-1)/3),3)*5+3,FALSE)&"|"&HLOOKUP(Sheet1!R2C1,Sheet1!R2C1:R16C1,MOD(RC1,3)+MOD(INT((RC1)/3),3)*5+3,FALSE)&"|"&HLOOKUP(Sheet1!R2C1,Sheet1!R2C1:R16C1,MOD(RC1+1,3)+MOD(INT((RC1+1)/3),3)*5+3,FALSE)&"|"&HLOOKUP(Sheet1!R2C1,Sheet1!R2C1:R16C1,MOD(RC1+2,3)+MOD(INT((RC1+2)/3),3)*5+3,FALSE)&"|"&HLOOKUP(Sheet1!R2C1,Sheet1!R2C1:R16C1,MOD(RC1+3,3)+MOD(INT((RC1+3)/3),3)*5+3,FALSE) -> 134|162|163|164|102 | L264: 25|22|23|24 | M264: 1843792|1843791|1843793|1843793 | N264: 10030|10031|10032|10033 | O264: 1|1|1|1 | P264: 2500|2500|2500|2500
A265: 259 | B265: 257 | C265: 30 | D265: =R[-20]C+2 -> 44 | E265: 1000 | F265: =MOD(RC[-5]-1,3)*30+100&"|"&MOD(RC[-5]-1,3)*30+101&"|"&MOD(RC[-5]-1,3)*30+102&"|"&MOD(RC[-5]-1,3)*30+103&"|"&IF(MOD(RC[-5],4)=0,HLOOKUP(Sheet1!R2C10,Sheet1!R2C10:R7C10,MOD(RC[-5]/4-1,6)+1,FALSE),IF(MOD(RC[-5],2)=0,IF(RC[-5]>20,HLOOKUP(Sheet1!R2C7,Sheet1!R2C7:R43C7,MOD(RC[-5]/2-1,42)+1,FALSE),HLOOKUP(Sheet1!R2C4,Sheet1!R2C4:R7C4,MOD(RC[-5]-1,6)+1,FALSE)),MOD(RC[-5]-1,3)*30+104)) -> 100|101|102|103|104 | G265: =HLOOKUP(Sheet1!R2C1,Sheet1!R2C1:R16C1,MOD(RC1-1,2)+MOD(INT((RC1-1)/2),3)*5+1,FALSE)&"|"&HLOOKUP(Sheet1!R2C1,Sheet1!R2C1:R16C1,MOD(RC1,2)+MOD(INT((RC1)/2),3)*5+1,FALSE)&"|"&HLOOKUP(Sheet1!R2C1,Sheet1!R2C1:R16C1,MOD(RC1+1,2)+MOD(INT((RC1+1)/2),3)*5+1,FALSE)&"|"&HLOOKUP(Sheet1!R2C1,Sheet1!R2C1:R16C1,MOD(RC1+2,2)+MOD(INT((RC1+2)/2),3)*5+1,FALSE)&"|"&HLOOKUP(Sheet1!R2C1,Sheet1!R2C1:R16C1,MOD(RC1+3,2)+MOD(INT((RC1+3)/2),3)*5+1,FALSE) -> 100|101|130|131|160 | H265: =HLOOKUP(Sheet1!R2C1,Sheet1!R2C1:R16C1,MOD(RC1+2,2)+MOD(INT((RC1+2)/2),3)*5+1,FALSE)&"|"&HLOOKUP(Sheet1!R2C1,Sheet1!R2C1:R16C1,MOD(RC1+3,2)+MOD(INT((RC1+3)/2),3)*5+1,FALSE)&"|"&HLOOKUP(Sheet1!R2C1,Sheet1!R2C1:R16C1,MOD(RC1+4,2)+MOD(INT((RC1+4)/2),3)*5+1,FALSE)&"|"&HLOOKUP(Sheet1!R2C1,Sheet1!R2C1:R16C1,MOD(RC1+5,2)+MOD(INT((RC1+5)/2),3)*5+1,FALSE)&"|"&HLOOKUP(Sheet1!R2C1,Sheet1!R2C1:R16C1,MOD(RC1+6,2)+MOD(INT((RC1+6)/2),3)*5+1,FALSE) -> 131|160|161|100|101 | I265: =HLOOKUP(Sheet1!R2C1,Sheet1!R2C1:R16C1,MOD(RC1-1,3)+MOD(INT((RC1-1)/3),3)*5+3,FALSE)&"|"&HLOOKUP(Sheet1!R2C1,Sheet1!R2C1:R16C1,MOD(RC1,3)+MOD(INT((RC1)/3),3)*5+3,FALSE)&"|"&HLOOKUP(Sheet1!R2C1,Sheet1!R2C1:R16C1,MOD(RC1+1,3)+MOD(INT((RC1+1)/3),3)*5+3,FALSE)&"|"&HLOOKUP(Sheet1!R2C1,Sheet1!R2C1:R16C1,MOD(RC1+2,3)+MOD(INT((RC1+2)/3),3)*5+3,FALSE)&"|"&HLOOKUP(Sheet1!R2C1,Sheet1!R2C1:R16C1,MOD(RC1+3,3)+MOD(INT((RC1+3)/3),3)*5+3,FALSE) -> 162|163|164|102|103 | J265: =HLOOKUP(Sheet1!R2C1,Sheet1!R2C1:R16C1,MOD(RC1-1,3)+MOD(INT((RC1-1)/3),3)*5+3,FALSE)&"|"&HLOOKUP(Sheet1!R2C1,Sheet1!R2C1:R16C1,MOD(RC1,3)+MOD(INT((RC1)/3),3)*5+3,FALSE)&"|"&HLOOKUP(Sheet1!R2C1,Sheet1!R2C1:R16C1,MOD(RC1+1,3)+MOD(INT((RC1+1)/3),3)*5+3,FALSE)&"|"&HLOOKUP(Sheet1!R2C1,Sheet1!R2C1:R16C1,MOD(RC1+2,3)+MOD(INT((RC1+2)/3),3)*5+3,FALSE)&"|"&HLOOKUP(Sheet1!R2C1,Sheet1!R2C1:R16C1,MOD(RC1+3,3)+MOD(INT((RC1+3)/3),3)*5+3,FALSE) -> 162|163|164|102|103 | K265: =HLOOKUP(Sheet1!R2C1,Sheet1!R2C1:R16C1,MOD(RC1-1,3)+MOD(INT((RC1-1)/3),3)*5+3,FALSE)&"|"&HLOOKUP(Sheet1!R2C1,Sheet1!R2C1:R16C1,MOD(RC1,3)+MOD(INT((RC1)/3),3)*5+3,FALSE)&"|"&HLOOKUP(Sheet1!R2C1,Sheet1!R2C1:R16C1,MOD(RC1+1,3)+MOD(INT((RC1+1)/3),3)*5+3,FALSE)&"|"&HLOOKUP(Sheet1!R2C1,Sheet1!R2C1:R16C1,MOD(RC1+2,3)+MOD(INT((RC1+2)/3),3)*5+3,FALSE)&"|"&HLOOKUP(Sheet1!R2C1,Sheet1!R2C1:R16C1,MOD(RC1+3,3)+MOD(INT((RC1+3)/3),3)*5+3,FALSE) -> 162|163|164|102|103 | L265: 25|22|23|24 | M265: 1861044|1861045|1861045|1861045 | N265: 10030|10031|10032|10033 | O265: 1|1|1|1 | P265: 2500|2500|2500|2500
A266: 260 | B266: 258 | C266: 30 | D266: =R[-20]C+2 -> 44 | E266: 1000 | F266: =MOD(RC[-5]-1,3)*30+100&"|"&MOD(RC[-5]-1,3)*30+101&"|"&MOD(RC[-5]-1,3)*30+102&"|"&MOD(RC[-5]-1,3)*30+103&"|"&IF(MOD(RC[-5],4)=0,HLOOKUP(Sheet1!R2C10,Sheet1!R2C10:R7C10,MOD(RC[-5]/4-1,6)+1,FALSE),IF(MOD(RC[-5],2)=0,IF(RC[-5]>20,HLOOKUP(Sheet1!R2C7,Sheet1!R2C7:R43C7,MOD(RC[-5]/2-1,42)+1,FALSE),HLOOKUP(Sheet1!R2C4,Sheet1!R2C4:R7C4,MOD(RC[-5]-1,6)+1,FALSE)),MOD(RC[-5]-1,3)*30+104)) -> 130|131|132|133|194 | G266: =HLOOKUP(Sheet1!R2C1,Sheet1!R2C1:R16C1,MOD(RC1-1,2)+MOD(INT((RC1-1)/2),3)*5+1,FALSE)&"|"&HLOOKUP(Sheet1!R2C1,Sheet1!R2C1:R16C1,MOD(RC1,2)+MOD(INT((RC1)/2),3)*5+1,FALSE)&"|"&HLOOKUP(Sheet1!R2C1,Sheet1!R2C1:R16C1,MOD(RC1+1,2)+MOD(INT((RC1+1)/2),3)*5+1,FALSE)&"|"&HLOOKUP(Sheet1!R2C1,Sheet1!R2C1:R16C1,MOD(RC1+2,2)+MOD(INT((RC1+2)/2),3)*5+1,FALSE)&"|"&HLOOKUP(Sheet1!R2C1,Sheet1!R2C1:R16C1,MOD(RC1+3,2)+MOD(INT((RC1+3)/2),3)*5+1,FALSE) -> 101|130|131|160|161 | H266: =HLOOKUP(Sheet1!R2C1,Sheet1!R2C1:R16C1,MOD(RC1+2,2)+MOD(INT((RC1+2)/2),3)*5+1,FALSE)&"|"&HLOOKUP(Sheet1!R2C1,Sheet1!R2C1:R16C1,MOD(RC1+3,2)+MOD(INT((RC1+3)/2),3)*5+1,FALSE)&"|"&HLOOKUP(Sheet1!R2C1,Sheet1!R2C1:R16C1,MOD(RC1+4,2)+MOD(INT((RC1+4)/2),3)*5+1,FALSE)&"|"&HLOOKUP(Sheet1!R2C1,Sheet1!R2C1:R16C1,MOD(RC1+5,2)+MOD(INT((RC1+5)/2),3)*5+1,FALSE)&"|"&HLOOKUP(Sheet1!R2C1,Sheet1!R2C1:R16C1,MOD(RC1+6,2)+MOD(INT((RC1+6)/2),3)*5+1,FALSE) -> 160|161|100|101|130 | I266: =HLOOKUP(Sheet1!R2C1,Sheet1!R2C1:R16C1,MOD(RC1-1,3)+MOD(INT((RC1-1)/3),3)*5+3,FALSE)&"|"&HLOOKUP(Sheet1!R2C1,Sheet1!R2C1:R16C1,MOD(RC1,3)+MOD(INT((RC1)/3),3)*5+3,FALSE)&"|"&HLOOKUP(Sheet1!R2C1,Sheet1!R2C1:R16C1,MOD(RC1+1,3)+MOD(INT((RC1+1)/3),3)*5+3,FALSE)&"|"&HLOOKUP(Sheet1!R2C1,Sheet1!R2C1:R16C1,MOD(RC1+2,3)+MOD(INT((RC1+2)/3),3)*5+3,FALSE)&"|"&HLOOKUP(Sheet1!R2C1,Sheet1!R2C1:R16C1,MOD(RC1+3,3)+MOD(INT((RC1+3)/3),3)*5+3,FALSE) -> 163|164|102|103|104 | J266: =HLOOKUP(Sheet1!R2C1,Sheet1!R2C1:R16C1,MOD(RC1-1,3)+MOD(INT((RC1-1)/3),3)*5+3,FALSE)&"|"&HLOOKUP(Sheet1!R2C1,Sheet1!R2C1:R16C1,MOD(RC1,3)+MOD(INT((RC1)/3),3)*5+3,FALSE)&"|"&HLOOKUP(Sheet1!R2C1,Sheet1!R2C1:R16C1,MOD(RC1+1,3)+MOD(INT((RC1+1)/3),3)*5+3,FALSE)&"|"&HLOOKUP(Sheet1!R2C1,Sheet1!R2C1:R16C1,MOD(RC1+2,3)+MOD(INT((RC1+2)/3),3)*5+3,FALSE)&"|"&HLOOKUP(Sheet1!R2C1,Sheet1!R2C1:R16C1,MOD(RC1+3,3)+MOD(INT((RC1+3)/3),3)*5+3,FALSE) -> 163|164|102|103|104 | K266: =HLOOKUP(Sheet1!R2C1,Sheet1!R2C1:R16C1,MOD(RC1-1,3)+MOD(INT((RC1-1)/3),3)*5+3,FALSE)&"|"&HLOOKUP(Sheet1!R2C1,Sheet1!R2C1:R16C1,MOD(RC1,3)+MOD(INT((RC1)/3),3)*5+3,FALSE)&"|"&HLOOKUP(Sheet1!R2C1,Sheet1!R2C1:R16C1,MOD(RC1+1,3)+MOD(INT((RC1+1)/3),3)*5+3,FALSE)&"|"&HLOOKUP(Sheet1!R2C1,Sheet1!R2C1:R16C1,MOD(RC1+2,3)+MOD(INT((RC1+2)/3),3)*5+3,FALSE)&"|"&HLOOKUP(Sheet1!R2C1,Sheet1!R2C1:R16C1,MOD(RC1+3,3)+MOD(INT((RC1+3)/3),3)*5+3,FALSE) -> 163|164|102|103|104 | L266: 25|22|23|24 | M266: 1878303|1878304|1878303|1878303 | N266: 10030|10031|10032|10033|10030|10031|10032|10033|10030|10031|10032|10033|10030|10031|10032|10033|10030|10031|10032|10033|10030|10031|10032|10033|10030|10031|10032|10033|10030|10031|10032|10033|10030|10031|10032|10033|10030|10031|10032|10033 | O266: 1|1|1|1|1|1|1|1|1|1|1|1|1|1|1|1|1|1|1|1|1|1|1|1|1|1|1|1|1|1|1|1|1|1|1|1|1|1|1|1 | P266: 2500|2500|2500|2500|2500|2500|2500|2500|2500|2500|2500|2500|2500|2500|2500|2500|2500|2500|2500|2500|2500|2500|2500|2500|2500|2500|2500|2500|2500|2500|2500|2500|2500|2500|2500|2500|2500|2500|2500|2500
A267: 261 | B267: 259 | C267: 30 | D267: =R[-20]C+2 -> 46 | E267: 1000 | F267: =MOD(RC[-5]-1,3)*30+100&"|"&MOD(RC[-5]-1,3)*30+101&"|"&MOD(RC[-5]-1,3)*30+102&"|"&MOD(RC[-5]-1,3)*30+103&"|"&IF(MOD(RC[-5],4)=0,HLOOKUP(Sheet1!R2C10,Sheet1!R2C10:R7C10,MOD(RC[-5]/4-1,6)+1,FALSE),IF(MOD(RC[-5],2)=0,IF(RC[-5]>20,HLOOKUP(Sheet1!R2C7,Sheet1!R2C7:R43C7,MOD(RC[-5]/2-1,42)+1,FALSE),HLOOKUP(Sheet1!R2C4,Sheet1!R2C4:R7C4,MOD(RC[-5]-1,6)+1,FALSE)),MOD(RC[-5]-1,3)*30+104)) -> 160|161|162|163|164 | G267: =HLOOKUP(Sheet1!R2C1,Sheet1!R2C1:R16C1,MOD(RC1-1,2)+MOD(INT((RC1-1)/2),3)*5+1,FALSE)&"|"&HLOOKUP(Sheet1!R2C1,Sheet1!R2C1:R16C1,MOD(RC1,2)+MOD(INT((RC1)/2),3)*5+1,FALSE)&"|"&HLOOKUP(Sheet1!R2C1,Sheet1!R2C1:R16C1,MOD(RC1+1,2)+MOD(INT((RC1+1)/2),3)*5+1,FALSE)&"|"&HLOOKUP(Sheet1!R2C1,Sheet1!R2C1:R16C1,MOD(RC1+2,2)+MOD(INT((RC1+2)/2),3)*5+1,FALSE)&"|"&HLOOKUP(Sheet1!R2C1,Sheet1!R2C1:R16C1,MOD(RC1+3,2)+MOD(INT((RC1+3)/2),3)*5+1,FALSE) -> 130|131|160|161|100 | H267: =HLOOKUP(Sheet1!R2C1,Sheet1!R2C1:R16C1,MOD(RC1+2,2)+MOD(INT((RC1+2)/2),3)*5+1,FALSE)&"|"&HLOOKUP(Sheet1!R2C1,Sheet1!R2C1:R16C1,MOD(RC1+3,2)+MOD(INT((RC1+3)/2),3)*5+1,FALSE)&"|"&HLOOKUP(Sheet1!R2C1,Sheet1!R2C1:R16C1,MOD(RC1+4,2)+MOD(INT((RC1+4)/2),3)*5+1,FALSE)&"|"&HLOOKUP(Sheet1!R2C1,Sheet1!R2C1:R16C1,MOD(RC1+5,2)+MOD(INT((RC1+5)/2),3)*5+1,FALSE)&"|"&HLOOKUP(Sheet1!R2C1,Sheet1!R2C1:R16C1,MOD(RC1+6,2)+MOD(INT((RC1+6)/2),3)*5+1,FALSE) -> 161|100|101|130|131 | I267: =HLOOKUP(Sheet1!R2C1,Sheet1!R2C1:R16C1,MOD(RC1-1,3)+MOD(INT((RC1-1)/3),3)*5+3,FALSE)&"|"&HLOOKUP(Sheet1!R2C1,Sheet1!R2C1:R16C1,MOD(RC1,3)+MOD(INT((RC1)/3),3)*5+3,FALSE)&"|"&HLOOKUP(Sheet1!R2C1,Sheet1!R2C1:R16C1,MOD(RC1+1,3)+MOD(INT((RC1+1)/3),3)*5+3,FALSE)&"|"&HLOOKUP(Sheet1!R2C1,Sheet1!R2C1:R16C1,MOD(RC1+2,3)+MOD(INT((RC1+2)/3),3)*5+3,FALSE)&"|"&HLOOKUP(Sheet1!R2C1,Sheet1!R2C1:R16C1,MOD(RC1+3,3)+MOD(INT((RC1+3)/3),3)*5+3,FALSE) -> 164|102|103|104|132 | J267: =HLOOKUP(Sheet1!R2C1,Sheet1!R2C1:R16C1,MOD(RC1-1,3)+MOD(INT((RC1-1)/3),3)*5+3,FALSE)&"|"&HLOOKUP(Sheet1!R2C1,Sheet1!R2C1:R16C1,MOD(RC1,3)+MOD(INT((RC1)/3),3)*5+3,FALSE)&"|"&HLOOKUP(Sheet1!R2C1,Sheet1!R2C1:R16C1,MOD(RC1+1,3)+MOD(INT((RC1+1)/3),3)*5+3,FALSE)&"|"&HLOOKUP(Sheet1!R2C1,Sheet1!R2C1:R16C1,MOD(RC1+2,3)+MOD(INT((RC1+2)/3),3)*5+3,FALSE)&"|"&HLOOKUP(Sheet1!R2C1,Sheet1!R2C1:R16C1,MOD(RC1+3,3)+MOD(INT((RC1+3)/3),3)*5+3,FALSE) -> 164|102|103|104|132 | K267: =HLOOKUP(Sheet1!R2C1,Sheet1!R2C1:R16C1,MOD(RC1-1,3)+MOD(INT((RC1-1)/3),3)*5+3,FALSE)&"|"&HLOOKUP(Sheet1!R2C1,Sheet1!R2C1:R16C1,MOD(RC1,3)+MOD(INT((RC1)/3),3)*5+3,FALSE)&"|"&HLOOKUP(Sheet1!R2C1,Sheet1!R2C1:R16C1,MOD(RC1+1,3)+MOD(INT((RC1+1)/3),3)*5+3,FALSE)&"|"&HLOOKUP(Sheet1!R2C1,Sheet1!R2C1:R16C1,MOD(RC1+2,3)+MOD(INT((RC1+2)/3),3)*5+3,FALSE)&"|"&HLOOKUP(Sheet1!R2C1,Sheet1!R2C1:R16C1,MOD(RC1+3,3)+MOD(INT((RC1+3)/3),3)*5+3,FALSE) -> 164|102|103|104|132 | L267: 25|22|23|24 | M267: 1896226|1896226|1896225|1896225 | N267: 10030|10031|10032|10033 | O267: 1|1|1|1 | P267: 2500|2500|2500|2500
A268: 262 | B268: 260 | C268: 30 | D268: =R[-20]C+2 -> 46 | E268: 1000 | F268: =MOD(RC[-5]-1,3)*30+100&"|"&MOD(RC[-5]-1,3)*30+101&"|"&MOD(RC[-5]-1,3)*30+102&"|"&MOD(RC[-5]-1,3)*30+103&"|"&IF(MOD(RC[-5],4)=0,HLOOKUP(Sheet1!R2C10,Sheet1!R2C10:R7C10,MOD(RC[-5]/4-1,6)+1,FALSE),IF(MOD(RC[-5],2)=0,IF(RC[-5]>20,HLOOKUP(Sheet1!R2C7,Sheet1!R2C7:R43C7,MOD(RC[-5]/2-1,42)+1,FALSE),HLOOKUP(Sheet1!R2C4,Sheet1!R2C4:R7C4,MOD(RC[-5]-1,6)+1,FALSE)),MOD(RC[-5]-1,3)*30+104)) -> 100|101|102|103|116 | G268: =HLOOKUP(Sheet1!R2C1,Sheet1!R2C1:R16C1,MOD(RC1-1,2)+MOD(INT((RC1-1)/2),3)*5+1,FALSE)&"|"&HLOOKUP(Sheet1!R2C1,Sheet1!R2C1:R16C1,MOD(RC1,2)+MOD(INT((RC1)/2),3)*5+1,FALSE)&"|"&HLOOKUP(Sheet1!R2C1,Sheet1!R2C1:R16C1,MOD(RC1+1,2)+MOD(INT((RC1+1)/2),3)*5+1,FALSE)&"|"&HLOOKUP(Sheet1!R2C1,Sheet1!R2C1:R16C1,MOD(RC1+2,2)+MOD(INT((RC1+2)/2),3)*5+1,FALSE)&"|"&HLOOKUP(Sheet1!R2C1,Sheet1!R2C1:R16C1,MOD(RC1+3,2)+MOD(INT((RC1+3)/2),3)*5+1,FALSE) -> 131|160|161|100|101 | H268: =HLOOKUP(Sheet1!R2C1,Sheet1!R2C1:R16C1,MOD(RC1+2,2)+MOD(INT((RC1+2)/2),3)*5+1,FALSE)&"|"&HLOOKUP(Sheet1!R2C1,Sheet1!R2C1:R16C1,MOD(RC1+3,2)+MOD(INT((RC1+3)/2),3)*5+1,FALSE)&"|"&HLOOKUP(Sheet1!R2C1,Sheet1!R2C1:R16C1,MOD(RC1+4,2)+MOD(INT((RC1+4)/2),3)*5+1,FALSE)&"|"&HLOOKUP(Sheet1!R2C1,Sheet1!R2C1:R16C1,MOD(RC1+5,2)+MOD(INT((RC1+5)/2),3)*5+1,FALSE)&"|"&HLOOKUP(Sheet1!R2C1,Sheet1!R2C1:R16C1,MOD(RC1+6,2)+MOD(INT((RC1+6)/2),3)*5+1,FALSE) -> 100|101|130|131|160 | I268: =HLOOKUP(Sheet1!R2C1,Sheet1!R2C1:R16C1,MOD(RC1-1,3)+MOD(INT((RC1-1)/3),3)*5+3,FALSE)&"|"&HLOOKUP(Sheet1!R2C1,Sheet1!R2C1:R16C1,MOD(RC1,3)+MOD(INT((RC1)/3),3)*5+3,FALSE)&"|"&HLOOKUP(Sheet1!R2C1,Sheet1!R2C1:R16C1,MOD(RC1+1,3)+MOD(INT((RC1+1)/3),3)*5+3,FALSE)&"|"&HLOOKUP(Sheet1!R2C1,Sheet1!R2C1:R16C1,MOD(RC1+2,3)+MOD(INT((RC1+2)/3),3)*5+3,FALSE)&"|"&HLOOKUP(Sheet1!R2C1,Sheet1!R2C1:R16C1,MOD(RC1+3,3)+MOD(INT((RC1+3)/3),3)*5+3,FALSE) -> 102|103|104|132|133 | J268: =HLOOKUP(Sheet1!R2C1,Sheet1!R2C1:R16C1,MOD(RC1-1,3)+MOD(INT((RC1-1)/3),3)*5+3,FALSE)&"|"&HLOOKUP(Sheet1!R2C1,Sheet1!R2C1:R16C1,MOD(RC1,3)+MOD(INT((RC1)/3),3)*5+3,FALSE)&"|"&HLOOKUP(Sheet1!R2C1,Sheet1!R2C1:R16C1,MOD(RC1+1,3)+MOD(INT((RC1+1)/3),3)*5+3,FALSE)&"|"&HLOOKUP(Sheet1!R2C1,Sheet1!R2C1:R16C1,MOD(RC1+2,3)+MOD(INT((RC1+2)/3),3)*5+3,FALSE)&"|"&HLOOKUP(Sheet1!R2C1,Sheet1!R2C1:R16C1,MOD(RC1+3,3)+MOD(INT((RC1+3)/3),3)*5+3,FALSE) -> 102|103|104|132|133 | K268: =HLOOKUP(Sheet1!R2C1,Sheet1!R2C1:R16C1,MOD(RC1-1,3)+MOD(INT((RC1-1)/3),3)*5+3,FALSE)&"|"&HLOOKUP(Sheet1!R2C1,Sheet1!R2C1:R16C1,MOD(RC1,3)+MOD(INT((RC1)/3),3)*5+3,FALSE)&"|"&HLOOKUP(Sheet1!R2C1,Sheet1!R2C1:R16C1,MOD(RC1+1,3)+MOD(INT((RC1+1)/3),3)*5+3,FALSE)&"|"&HLOOKUP(Sheet1!R2C1,Sheet1!R2C1:R16C1,MOD(RC1+2,3)+MOD(INT((RC1+2)/3),3)*5+3,FALSE)&"|"&HLOOKUP(Sheet1!R2C1,Sheet1!R2C1:R16C1,MOD(RC1+3,3)+MOD(INT((RC1+3)/3),3)*5+3,FALSE) -> 102|103|104|132|133 | L268: 25|22|23|24 | M268: 1913556|1913556|1913558|1913558 | N268: 10030|10031|10032|10033 | O268: 1|1|1|1 | P268: 2500|2500|2500|2500
A269: 263 | B269: 261 | C269: 30 | D269: =R[-20]C+2 -> 46 | E269: 1000 | F269: =MOD(RC[-5]-1,3)*30+100&"|"&MOD(RC[-5]-1,3)*30+101&"|"&MOD(RC[-5]-1,3)*30+102&"|"&MOD(RC[-5]-1,3)*30+103&"|"&IF(MOD(RC[-5],4)=0,HLOOKUP(Sheet1!R2C10,Sheet1!R2C10:R7C10,MOD(RC[-5]/4-1,6)+1,FALSE),IF(MOD(RC[-5],2)=0,IF(RC[-5]>20,HLOOKUP(Sheet1!R2C7,Sheet1!R2C7:R43C7,MOD(RC[-5]/2-1,42)+1,FALSE),HLOOKUP(Sheet1!R2C4,Sheet1!R2C4:R7C4,MOD(RC[-5]-1,6)+1,FALSE)),MOD(RC[-5]-1,3)*30+104)) -> 130|131|132|133|134 | G269: =HLOOKUP(Sheet1!R2C1,Sheet1!R2C1:R16C1,MOD(RC1-1,2)+MOD(INT((RC1-1)/2),3)*5+1,FALSE)&"|"&HLOOKUP(Sheet1!R2C1,Sheet1!R2C1:R16C1,MOD(RC1,2)+MOD(INT((RC1)/2),3)*5+1,FALSE)&"|"&HLOOKUP(Sheet1!R2C1,Sheet1!R2C1:R16C1,MOD(RC1+1,2)+MOD(INT((RC1+1)/2),3)*5+1,FALSE)&"|"&HLOOKUP(Sheet1!R2C1,Sheet1!R2C1:R16C1,MOD(RC1+2,2)+MOD(INT((RC1+2)/2),3)*5+1,FALSE)&"|"&HLOOKUP(Sheet1!R2C1,Sheet1!R2C1:R16C1,MOD(RC1+3,2)+MOD(INT((RC1+3)/2),3)*5+1,FALSE) -> 160|161|100|101|130 | H269: =HLOOKUP(Sheet1!R2C1,Sheet1!R2C1:R16C1,MOD(RC1+2,2)+MOD(INT((RC1+2)/2),3)*5+1,FALSE)&"|"&HLOOKUP(Sheet1!R2C1,Sheet1!R2C1:R16C1,MOD(RC1+3,2)+MOD(INT((RC1+3)/2),3)*5+1,FALSE)&"|"&HLOOKUP(Sheet1!R2C1,Sheet1!R2C1:R16C1,MOD(RC1+4,2)+MOD(INT((RC1+4)/2),3)*5+1,FALSE)&"|"&HLOOKUP(Sheet1!R2C1,Sheet1!R2C1:R16C1,MOD(RC1+5,2)+MOD(INT((RC1+5)/2),3)*5+1,FALSE)&"|"&HLOOKUP(Sheet1!R2C1,Sheet1!R2C1:R16C1,MOD(RC1+6,2)+MOD(INT((RC1+6)/2),3)*5+1,FALSE) -> 101|130|131|160|161 | I269: =HLOOKUP(Sheet1!R2C1,Sheet1!R2C1:R16C1,MOD(RC1-1,3)+MOD(INT((RC1-1)/3),3)*5+3,FALSE)&"|"&HLOOKUP(Sheet1!R2C1,Sheet1!R2C1:R16C1,MOD(RC1,3)+MOD(INT((RC1)/3),3)*5+3,FALSE)&"|"&HLOOKUP(Sheet1!R2C1,Sheet1!R2C1:R16C1,MOD(RC1+1,3)+MOD(INT((RC1+1)/3),3)*5+3,FALSE)&"|"&HLOOKUP(Sheet1!R2C1,Sheet1!R2C1:R16C1,MOD(RC1+2,3)+MOD(INT((RC1+2)/3),3)*5+3,FALSE)&"|"&HLOOKUP(Sheet1!R2C1,Sheet1!R2C1:R16C1,MOD(RC1+3,3)+MOD(INT((RC1+3)/3),3)*5+3,FALSE) -> 103|104|132|133|134 | J269: =HLOOKUP(Sheet1!R2C1,Sheet1!R2C1:R16C1,MOD(RC1-1,3)+MOD(INT((RC1-1)/3),3)*5+3,FALSE)&"|"&HLOOKUP(Sheet1!R2C1,Sheet1!R2C1:R16C1,MOD(RC1,3)+MOD(INT((RC1)/3),3)*5+3,FALSE)&"|"&HLOOKUP(Sheet1!R2C1,Sheet1!R2C1:R16C1,MOD(RC1+1,3)+MOD(INT((RC1+1)/3),3)*5+3,FALSE)&"|"&HLOOKUP(Sheet1!R2C1,Sheet1!R2C1:R16C1,MOD(RC1+2,3)+MOD(INT((RC1+2)/3),3)*5+3,FALSE)&"|"&HLOOKUP(Sheet1!R2C1,Sheet1!R2C1:R16C1,MOD(RC1+3,3)+MOD(INT((RC1+3)/3),3)*5+3,FALSE) -> 103|104|132|133|134 | K269: =HLOOKUP(Sheet1!R2C1,Sheet1!R2C1:R16C1,MOD(RC1-1,3)+MOD(INT((RC1-1)/3),3)*5+3,FALSE)&"|"&HLOOKUP(Sheet1!R2C1,Sheet1!R2C1:R16C1,MOD(RC1,3)+MOD(INT((RC1)/3),3)*5+3,FALSE)&"|"&HLOOKUP(Sheet1!R2C1,Sheet1!R2C1:R16C1,MOD(RC1+1,3)+MOD(INT((RC1+1)/3),3)*5+3,FALSE)&"|"&HLOOKUP(Sheet1!R2C1,Sheet1!R2C1:R16C1,MOD(RC1+2,3)+MOD(INT((RC1+2)/3),3)*5+3,FALSE)&"|"&HLOOKUP(Sheet1!R2C1,Sheet1!R2C1:R16C1,MOD(RC1+3,3)+MOD(INT((RC1+3)/3),3)*5+3,FALSE) -> 103|104|132|133|134 | L269: 25|22|23|24 | M269: 1931432|1931433|1931433|1931433 | N269: 10030|10031|10032|10033 | O269: 1|1|1|1 | P269: 2500|2500|2500|2500
A270: 264 | B270: 262 | C270: 30 | D270: =R[-20]C+2 -> 46 | E270: 1000 | F270: =MOD(RC[-5]-1,3)*30+100&"|"&MOD(RC[-5]-1,3)*30+101&"|"&MOD(RC[-5]-1,3)*30+102&"|"&MOD(RC[-5]-1,3)*30+103&"|"&IF(MOD(RC[-5],4)=0,HLOOKUP(Sheet1!R2C10,Sheet1!R2C10:R7C10,MOD(RC[-5]/4-1,6)+1,FALSE),IF(MOD(RC[-5],2)=0,IF(RC[-5]>20,HLOOKUP(Sheet1!R2C7,Sheet1!R2C7:R43C7,MOD(RC[-5]/2-1,42)+1,FALSE),HLOOKUP(Sheet1!R2C4,Sheet1!R2C4:R7C4,MOD(RC[-5]-1,6)+1,FALSE)),MOD(RC[-5]-1,3)*30+104)) -> 160|161|162|163|195 | G270: =HLOOKUP(Sheet1!R2C1,Sheet1!R2C1:R16C1,MOD(RC1-1,2)+MOD(INT((RC1-1)/2),3)*5+1,FALSE)&"|"&HLOOKUP(Sheet1!R2C1,Sheet1!R2C1:R16C1,MOD(RC1,2)+MOD(INT((RC1)/2),3)*5+1,FALSE)&"|"&HLOOKUP(Sheet1!R2C1,Sheet1!R2C1:R16C1,MOD(RC1+1,2)+MOD(INT((RC1+1)/2),3)*5+1,FALSE)&"|"&HLOOKUP(Sheet1!R2C1,Sheet1!R2C1:R16C1,MOD(RC1+2,2)+MOD(INT((RC1+2)/2),3)*5+1,FALSE)&"|"&HLOOKUP(Sheet1!R2C1,Sheet1!R2C1:R16C1,MOD(RC1+3,2)+MOD(INT((RC1+3)/2),3)*5+1,FALSE) -> 161|100|101|130|131 | H270: =HLOOKUP(Sheet1!R2C1,Sheet1!R2C1:R16C1,MOD(RC1+2,2)+MOD(INT((RC1+2)/2),3)*5+1,FALSE)&"|"&HLOOKUP(Sheet1!R2C1,Sheet1!R2C1:R16C1,MOD(RC1+3,2)+MOD(INT((RC1+3)/2),3)*5+1,FALSE)&"|"&HLOOKUP(Sheet1!R2C1,Sheet1!R2C1:R16C1,MOD(RC1+4,2)+MOD(INT((RC1+4)/2),3)*5+1,FALSE)&"|"&HLOOKUP(Sheet1!R2C1,Sheet1!R2C1:R16C1,MOD(RC1+5,2)+MOD(INT((RC1+5)/2),3)*5+1,FALSE)&"|"&HLOOKUP(Sheet1!R2C1,Sheet1!R2C1:R16C1,MOD(RC1+6,2)+MOD(INT((RC1+6)/2),3)*5+1,FALSE) -> 130|131|160|161|100 | I270: =HLOOKUP(Sheet1!R2C1,Sheet1!R2C1:R16C1,MOD(RC1-1,3)+MOD(INT((RC1-1)/3),3)*5+3,FALSE)&"|"&HLOOKUP(Sheet1!R2C1,Sheet1!R2C1:R16C1,MOD(RC1,3)+MOD(INT((RC1)/3),3)*5+3,FALSE)&"|"&HLOOKUP(Sheet1!R2C1,Sheet1!R2C1:R16C1,MOD(RC1+1,3)+MOD(INT((RC1+1)/3),3)*5+3,FALSE)&"|"&HLOOKUP(Sheet1!R2C1,Sheet1!R2C1:R16C1,MOD(RC1+2,3)+MOD(INT((RC1+2)/3),3)*5+3,FALSE)&"|"&HLOOKUP(Sheet1!R2C1,Sheet1!R2C1:R16C1,MOD(RC1+3,3)+MOD(INT((RC1+3)/3),3)*5+3,FALSE) -> 104|132|133|134|162 | J270: =HLOOKUP(Sheet1!R2C1,Sheet1!R2C1:R16C1,MOD(RC1-1,3)+MOD(INT((RC1-1)/3),3)*5+3,FALSE)&"|"&HLOOKUP(Sheet1!R2C1,Sheet1!R2C1:R16C1,MOD(RC1,3)+MOD(INT((RC1)/3),3)*5+3,FALSE)&"|"&HLOOKUP(Sheet1!R2C1,Sheet1!R2C1:R16C1,MOD(RC1+1,3)+MOD(INT((RC1+1)/3),3)*5+3,FALSE)&"|"&HLOOKUP(Sheet1!R2C1,Sheet1!R2C1:R16C1,MOD(RC1+2,3)+MOD(INT((RC1+2)/3),3)*5+3,FALSE)&"|"&HLOOKUP(Sheet1!R2C1,Sheet1!R2C1:R16C1,MOD(RC1+3,3)+MOD(INT((RC1+3)/3),3)*5+3,FALSE) -> 104|132|133|134|162 | K270: =HLOOKUP(Sheet1!R2C1,Sheet1!R2C1:R16C1,MOD(RC1-1,3)+MOD(INT((RC1-1)/3),3)*5+3,FALSE)&"|"&HLOOKUP(Sheet1!R2C1,Sheet1!R2C1:R16C1,MOD(RC1,3)+MOD(INT((RC1)/3),3)*5+3,FALSE)&"|"&HLOOKUP(Sheet1!R2C1,Sheet1!R2C1:R16C1,MOD(RC1+1,3)+MOD(INT((RC1+1)/3),3)*5+3,FALSE)&"|"&HLOOKUP(Sheet1!R2C1,Sheet1!R2C1:R16C1,MOD(RC1+2,3)+MOD(INT((RC1+2)/3),3)*5+3,FALSE)&"|"&HLOOKUP(Sheet1!R2C1,Sheet1!R2C1:R16C1,MOD(RC1+3,3)+MOD(INT((RC1+3)/3),3)*5+3,FALSE) -> 104|132|133|134|162 | L270: 25|22|23|24 | M270: 1949308|1949309|1949308|1949308 | N270: 10030|10031|10032|10033 | O270: 1|1|1|1 | P270: 2500|2500|2500|2500
A271: 265 | B271: 263 | C271: 30 | D271: =R[-20]C+2 -> 46 | E271: 1000 | F271: =MOD(RC[-5]-1,3)*30+100&"|"&MOD(RC[-5]-1,3)*30+101&"|"&MOD(RC[-5]-1,3)*30+102&"|"&MOD(RC[-5]-1,3)*30+103&"|"&IF(MOD(RC[-5],4)=0,HLOOKUP(Sheet1!R2C10,Sheet1!R2C10:R7C10,MOD(RC[-5]/4-1,6)+1,FALSE),IF(MOD(RC[-5],2)=0,IF(RC[-5]>20,HLOOKUP(Sheet1!R2C7,Sheet1!R2C7:R43C7,MOD(RC[-5]/2-1,42)+1,FALSE),HLOOKUP(Sheet1!R2C4,Sheet1!R2C4:R7C4,MOD(RC[-5]-1,6)+1,FALSE)),MOD(RC[-5]-1,3)*30+104)) -> 100|101|102|103|104 | G271: =HLOOKUP(Sheet1!R2C1,Sheet1!R2C1:R16C1,MOD(RC1-1,2)+MOD(INT((RC1-1)/2),3)*5+1,FALSE)&"|"&HLOOKUP(Sheet1!R2C1,Sheet1!R2C1:R16C1,MOD(RC1,2)+MOD(INT((RC1)/2),3)*5+1,FALSE)&"|"&HLOOKUP(Sheet1!R2C1,Sheet1!R2C1:R16C1,MOD(RC1+1,2)+MOD(INT((RC1+1)/2),3)*5+1,FALSE)&"|"&HLOOKUP(Sheet1!R2C1,Sheet1!R2C1:R16C1,MOD(RC1+2,2)+MOD(INT((RC1+2)/2),3)*5+1,FALSE)&"|"&HLOOKUP(Sheet1!R2C1,Sheet1!R2C1:R16C1,MOD(RC1+3,2)+MOD(INT((RC1+3)/2),3)*5+1,FALSE) -> 100|101|130|131|160 | H271: =HLOOKUP(Sheet1!R2C1,Sheet1!R2C1:R16C1,MOD(RC1+2,2)+MOD(INT((RC1+2)/2),3)*5+1,FALSE)&"|"&HLOOKUP(Sheet1!R2C1,Sheet1!R2C1:R16C1,MOD(RC1+3,2)+MOD(INT((RC1+3)/2),3)*5+1,FALSE)&"|"&HLOOKUP(Sheet1!R2C1,Sheet1!R2C1:R16C1,MOD(RC1+4,2)+MOD(INT((RC1+4)/2),3)*5+1,FALSE)&"|"&HLOOKUP(Sheet1!R2C1,Sheet1!R2C1:R16C1,MOD(RC1+5,2)+MOD(INT((RC1+5)/2),3)*5+1,FALSE)&"|"&HLOOKUP(Sheet1!R2C1,Sheet1!R2C1:R16C1,MOD(RC1+6,2)+MOD(INT((RC1+6)/2),3)*5+1,FALSE) -> 131|160|161|100|101 | I271: =HLOOKUP(Sheet1!R2C1,Sheet1!R2C1:R16C1,MOD(RC1-1,3)+MOD(INT((RC1-1)/3),3)*5+3,FALSE)&"|"&HLOOKUP(Sheet1!R2C1,Sheet1!R2C1:R16C1,MOD(RC1,3)+MOD(INT((RC1)/3),3)*5+3,FALSE)&"|"&HLOOKUP(Sheet1!R2C1,Sheet1!R2C1:R16C1,MOD(RC1+1,3)+MOD(INT((RC1+1)/3),3)*5+3,FALSE)&"|"&HLOOKUP(Sheet1!R2C1,Sheet1!R2C1:R16C1,MOD(RC1+2,3)+MOD(INT((RC1+2)/3),3)*5+3,FALSE)&"|"&HLOOKUP(Sheet1!R2C1,Sheet1!R2C1:R16C1,MOD(RC1+3,3)+MOD(INT((RC1+3)/3),3)*5+3,FALSE) -> 132|133|134|162|163 | J271: =HLOOKUP(Sheet1!R2C1,Sheet1!R2C1:R16C1,MOD(RC1-1,3)+MOD(INT((RC1-1)/3),3)*5+3,FALSE)&"|"&HLOOKUP(Sheet1!R2C1,Sheet1!R2C1:R16C1,MOD(RC1,3)+MOD(INT((RC1)/3),3)*5+3,FALSE)&"|"&HLOOKUP(Sheet1!R2C1,Sheet1!R2C1:R16C1,MOD(RC1+1,3)+MOD(INT((RC1+1)/3),3)*5+3,FALSE)&"|"&HLOOKUP(Sheet1!R2C1,Sheet1!R2C1:R16C1,MOD(RC1+2,3)+MOD(INT((RC1+2)/3),3)*5+3,FALSE)&"|"&HLOOKUP(Sheet1!R2C1,Sheet1!R2C1:R16C1,MOD(RC1+3,3)+MOD(INT((RC1+3)/3),3)*5+3,FALSE) -> 132|133|134|162|163 | K271: =HLOOKUP(Sheet1!R2C1,Sheet1!R2C1:R16C1,MOD(RC1-1,3)+MOD(INT((RC1-1)/3),3)*5+3,FALSE)&"|"&HLOOKUP(Sheet1!R2C1,Sheet1!R2C1:R16C1,MOD(RC1,3)+MOD(INT((RC1)/3),3)*5+3,FALSE)&"|"&HLOOKUP(Sheet1!R2C1,Sheet1!R2C1:R16C1,MOD(RC1+1,3)+MOD(INT((RC1+1)/3),3)*5+3,FALSE)&"|"&HLOOKUP(Sheet1!R2C1,Sheet1!R2C1:R16C1,MOD(RC1+2,3)+MOD(INT((RC1+2)/3),3)*5+3,FALSE)&"|"&HLOOKUP(Sheet1!R2C1,Sheet1!R2C1:R16C1,MOD(RC1+3,3)+MOD(INT((RC1+3)/3),3)*5+3,FALSE) -> 132|133|134|162|163 | L271: 25|22|23|24 | M271: 1967872|1967871|1967873|1967873 | N271: 10030|10031|10032|10033|10030|10031|10032|10033|10030|10031|10032|10033|10030|10031|10032|10033|10030|10031|10032|10033|10030|10031|10032|10033|10030|10031|10032|10033|10030|10031|10032|10033|10030|10031|10032|10033|10030|10031|10032|10033 | O271: 1|1|1|1|1|1|1|1|1|1|1|1|1|1|1|1|1|1|1|1|1|1|1|1|1|1|1|1|1|1|1|1|1|1|1|1|1|1|1|1 | P271: 2500|2500|2500|2500|2500|2500|2500|2500|2500|2500|2500|2500|2500|2500|2500|2500|2500|2500|2500|2500|2500|2500|2500|2500|2500|2500|2500|2500|2500|2500|2500|2500|2500|2500|2500|2500|2500|2500|2500|2500
A272: 266 | B272: 264 | C272: 30 | D272: =R[-20]C+2 -> 46 | E272: 1000 | F272: =MOD(RC[-5]-1,3)*30+100&"|"&MOD(RC[-5]-1,3)*30+101&"|"&MOD(RC[-5]-1,3)*30+102&"|"&MOD(RC[-5]-1,3)*30+103&"|"&IF(MOD(RC[-5],4)=0,HLOOKUP(Sheet1!R2C10,Sheet1!R2C10:R7C10,MOD(RC[-5]/4-1,6)+1,FALSE),IF(MOD(RC[-5],2)=0,IF(RC[-5]>20,HLOOKUP(Sheet1!R2C7,Sheet1!R2C7:R43C7,MOD(RC[-5]/2-1,42)+1,FALSE),HLOOKUP(Sheet1!R2C4,Sheet1!R2C4:R7C4,MOD(RC[-5]-1,6)+1,FALSE)),MOD(RC[-5]-1,3)*30+104)) -> 130|131|132|133|118 | G272: =HLOOKUP(Sheet1!R2C1,Sheet1!R2C1:R16C1,MOD(RC1-1,2)+MOD(INT((RC1-1)/2),3)*5+1,FALSE)&"|"&HLOOKUP(Sheet1!R2C1,Sheet1!R2C1:R16C1,MOD(RC1,2)+MOD(INT((RC1)/2),3)*5+1,FALSE)&"|"&HLOOKUP(Sheet1!R2C1,Sheet1!R2C1:R16C1,MOD(RC1+1,2)+MOD(INT((RC1+1)/2),3)*5+1,FALSE)&"|"&HLOOKUP(Sheet1!R2C1,Sheet1!R2C1:R16C1,MOD(RC1+2,2)+MOD(INT((RC1+2)/2),3)*5+1,FALSE)&"|"&HLOOKUP(Sheet1!R2C1,Sheet1!R2C1:R16C1,MOD(RC1+3,2)+MOD(INT((RC1+3)/2),3)*5+1,FALSE) -> 101|130|131|160|161 | H272: =HLOOKUP(Sheet1!R2C1,Sheet1!R2C1:R16C1,MOD(RC1+2,2)+MOD(INT((RC1+2)/2),3)*5+1,FALSE)&"|"&HLOOKUP(Sheet1!R2C1,Sheet1!R2C1:R16C1,MOD(RC1+3,2)+MOD(INT((RC1+3)/2),3)*5+1,FALSE)&"|"&HLOOKUP(Sheet1!R2C1,Sheet1!R2C1:R16C1,MOD(RC1+4,2)+MOD(INT((RC1+4)/2),3)*5+1,FALSE)&"|"&HLOOKUP(Sheet1!R2C1,Sheet1!R2C1:R16C1,MOD(RC1+5,2)+MOD(INT((RC1+5)/2),3)*5+1,FALSE)&"|"&HLOOKUP(Sheet1!R2C1,Sheet1!R2C1:R16C1,MOD(RC1+6,2)+MOD(INT((RC1+6)/2),3)*5+1,FALSE) -> 160|161|100|101|130 | I272: =HLOOKUP(Sheet1!R2C1,Sheet1!R2C1:R16C1,MOD(RC1-1,3)+MOD(INT((RC1-1)/3),3)*5+3,FALSE)&"|"&HLOOKUP(Sheet1!R2C1,Sheet1!R2C1:R16C1,MOD(RC1,3)+MOD(INT((RC1)/3),3)*5+3,FALSE)&"|"&HLOOKUP(Sheet1!R2C1,Sheet1!R2C1:R16C1,MOD(RC1+1,3)+MOD(INT((RC1+1)/3),3)*5+3,FALSE)&"|"&HLOOKUP(Sheet1!R2C1,Sheet1!R2C1:R16C1,MOD(RC1+2,3)+MOD(INT((RC1+2)/3),3)*5+3,FALSE)&"|"&HLOOKUP(Sheet1!R2C1,Sheet1!R2C1:R16C1,MOD(RC1+3,3)+MOD(INT((RC1+3)/3),3)*5+3,FALSE) -> 133|134|162|163|164 | J272: =HLOOKUP(Sheet1!R2C1,Sheet1!R2C1:R16C1,MOD(RC1-1,3)+MOD(INT((RC1-1)/3),3)*5+3,FALSE)&"|"&HLOOKUP(Sheet1!R2C1,Sheet1!R2C1:R16C1,MOD(RC1,3)+MOD(INT((RC1)/3),3)*5+3,FALSE)&"|"&HLOOKUP(Sheet1!R2C1,Sheet1!R2C1:R16C1,MOD(RC1+1,3)+MOD(INT((RC1+1)/3),3)*5+3,FALSE)&"|"&HLOOKUP(Sheet1!R2C1,Sheet1!R2C1:R16C1,MOD(RC1+2,3)+MOD(INT((RC1+2)/3),3)*5+3,FALSE)&"|"&HLOOKUP(Sheet1!R2C1,Sheet1!R2C1:R16C1,MOD(RC1+3,3)+MOD(INT((RC1+3)/3),3)*5+3,FALSE) -> 133|134|162|163|164 | K272: =HLOOKUP(Sheet1!R2C1,Sheet1!R2C1:R16C1,MOD(RC1-1,3)+MOD(INT((RC1-1)/3),3)*5+3,FALSE)&"|"&HLOOKUP(Sheet1!R2C1,Sheet1!R2C1:R16C1,MOD(RC1,3)+MOD(INT((RC1)/3),3)*5+3,FALSE)&"|"&HLOOKUP(Sheet1!R2C1,Sheet1!R2C1:R16C1,MOD(RC1+1,3)+MOD(INT((RC1+1)/3),3)*5+3,FALSE)&"|"&HLOOKUP(Sheet1!R2C1,Sheet1!R2C1:R16C1,MOD(RC1+2,3)+MOD(INT((RC1+2)/3),3)*5+3,FALSE)&"|"&HLOOKUP(Sheet1!R2C1,Sheet1!R2C1:R16C1,MOD(RC1+3,3)+MOD(INT((RC1+3)/3),3)*5+3,FALSE) -> 133|134|162|163|164 | L272: 25|22|23|24 | M272: 1985944|1985944|1985945|1985945 | N272: 10030|10031|10032|10033 | O272: 1|1|1|1 | P272: 2500|2500|2500|2500
A273: 267 | B273: 265 | C273: 30 | D273: =R[-20]C+2 -> 46 | E273: 1000 | F273: =MOD(RC[-5]-1,3)*30+100&"|"&MOD(RC[-5]-1,3)*30+101&"|"&MOD(RC[-5]-1,3)*30+102&"|"&MOD(RC[-5]-1,3)*30+103&"|"&IF(MOD(RC[-5],4)=0,HLOOKUP(Sheet1!R2C10,Sheet1!R2C10:R7C10,MOD(RC[-5]/4-1,6)+1,FALSE),IF(MOD(RC[-5],2)=0,IF(RC[-5]>20,HLOOKUP(Sheet1!R2C7,Sheet1!R2C7:R43C7,MOD(RC[-5]/2-1,42)+1,FALSE),HLOOKUP(Sheet1!R2C4,Sheet1!R2C4:R7C4,MOD(RC[-5]-1,6)+1,FALSE)),MOD(RC[-5]-1,3)*30+104)) -> 160|161|162|163|164 | G273: =HLOOKUP(Sheet1!R2C1,Sheet1!R2C1:R16C1,MOD(RC1-1,2)+MOD(INT((RC1-1)/2),3)*5+1,FALSE)&"|"&HLOOKUP(Sheet1!R2C1,Sheet1!R2C1:R16C1,MOD(RC1,2)+MOD(INT((RC1)/2),3)*5+1,FALSE)&"|"&HLOOKUP(Sheet1!R2C1,Sheet1!R2C1:R16C1,MOD(RC1+1,2)+MOD(INT((RC1+1)/2),3)*5+1,FALSE)&"|"&HLOOKUP(Sheet1!R2C1,Sheet1!R2C1:R16C1,MOD(RC1+2,2)+MOD(INT((RC1+2)/2),3)*5+1,FALSE)&"|"&HLOOKUP(Sheet1!R2C1,Sheet1!R2C1:R16C1,MOD(RC1+3,2)+MOD(INT((RC1+3)/2),3)*5+1,FALSE) -> 130|131|160|161|100 | H273: =HLOOKUP(Sheet1!R2C1,Sheet1!R2C1:R16C1,MOD(RC1+2,2)+MOD(INT((RC1+2)/2),3)*5+1,FALSE)&"|"&HLOOKUP(Sheet1!R2C1,Sheet1!R2C1:R16C1,MOD(RC1+3,2)+MOD(INT((RC1+3)/2),3)*5+1,FALSE)&"|"&HLOOKUP(Sheet1!R2C1,Sheet1!R2C1:R16C1,MOD(RC1+4,2)+MOD(INT((RC1+4)/2),3)*5+1,FALSE)&"|"&HLOOKUP(Sheet1!R2C1,Sheet1!R2C1:R16C1,MOD(RC1+5,2)+MOD(INT((RC1+5)/2),3)*5+1,FALSE)&"|"&HLOOKUP(Sheet1!R2C1,Sheet1!R2C1:R16C1,MOD(RC1+6,2)+MOD(INT((RC1+6)/2),3)*5+1,FALSE) -> 161|100|101|130|131 | I273: =HLOOKUP(Sheet1!R2C1,Sheet1!R2C1:R16C1,MOD(RC1-1,3)+MOD(INT((RC1-1)/3),3)*5+3,FALSE)&"|"&HLOOKUP(Sheet1!R2C1,Sheet1!R2C1:R16C1,MOD(RC1,3)+MOD(INT((RC1)/3),3)*5+3,FALSE)&"|"&HLOOKUP(Sheet1!R2C1,Sheet1!R2C1:R16C1,MOD(RC1+1,3)+MOD(INT((RC1+1)/3),3)*5+3,FALSE)&"|"&HLOOKUP(Sheet1!R2C1,Sheet1!R2C1:R16C1,MOD(RC1+2,3)+MOD(INT((RC1+2)/3),3)*5+3,FALSE)&"|"&HLOOKUP(Sheet1!R2C1,Sheet1!R2C1:R16C1,MOD(RC1+3,3)+MOD(INT((RC1+3)/3),3)*5+3,FALSE) -> 134|162|163|164|102 | J273: =HLOOKUP(Sheet1!R2C1,Sheet1!R2C1:R16C1,MOD(RC1-1,3)+MOD(INT((RC1-1)/3),3)*5+3,FALSE)&"|"&HLOOKUP(Sheet1!R2C1,Sheet1!R2C1:R16C1,MOD(RC1,3)+MOD(INT((RC1)/3),3)*5+3,FALSE)&"|"&HLOOKUP(Sheet1!R2C1,Sheet1!R2C1:R16C1,MOD(RC1+1,3)+MOD(INT((RC1+1)/3),3)*5+3,FALSE)&"|"&HLOOKUP(Sheet1!R2C1,Sheet1!R2C1:R16C1,MOD(RC1+2,3)+MOD(INT((RC1+2)/3),3)*5+3,FALSE)&"|"&HLOOKUP(Sheet1!R2C1,Sheet1!R2C1:R16C1,MOD(RC1+3,3)+MOD(INT((RC1+3)/3),3)*5+3,FALSE) -> 134|162|163|164|102 | K273: =HLOOKUP(Sheet1!R2C1,Sheet1!R2C1:R16C1,MOD(RC1-1,3)+MOD(INT((RC1-1)/3),3)*5+3,FALSE)&"|"&HLOOKUP(Sheet1!R2C1,Sheet1!R2C1:R16C1,MOD(RC1,3)+MOD(INT((RC1)/3),3)*5+3,FALSE)&"|"&HLOOKUP(Sheet1!R2C1,Sheet1!R2C1:R16C1,MOD(RC1+1,3)+MOD(INT((RC1+1)/3),3)*5+3,FALSE)&"|"&HLOOKUP(Sheet1!R2C1,Sheet1!R2C1:R16C1,MOD(RC1+2,3)+MOD(INT((RC1+2)/3),3)*5+3,FALSE)&"|"&HLOOKUP(Sheet1!R2C1,Sheet1!R2C1:R16C1,MOD(RC1+3,3)+MOD(INT((RC1+3)/3),3)*5+3,FALSE) -> 134|162|163|164|102 | L273: 25|22|23|24 | M273: 2004459|2004459|2004460|2004460 | N273: 10030|10031|10032|10033 | O273: 1|1|1|1 | P273: 2500|2500|2500|2500
A274: 268 | B274: 266 | C274: 30 | D274: =R[-20]C+2 -> 46 | E274: 1000 | F274: =MOD(RC[-5]-1,3)*30+100&"|"&MOD(RC[-5]-1,3)*30+101&"|"&MOD(RC[-5]-1,3)*30+102&"|"&MOD(RC[-5]-1,3)*30+103&"|"&IF(MOD(RC[-5],4)=0,HLOOKUP(Sheet1!R2C10,Sheet1!R2C10:R7C10,MOD(RC[-5]/4-1,6)+1,FALSE),IF(MOD(RC[-5],2)=0,IF(RC[-5]>20,HLOOKUP(Sheet1!R2C7,Sheet1!R2C7:R43C7,MOD(RC[-5]/2-1,42)+1,FALSE),HLOOKUP(Sheet1!R2C4,Sheet1!R2C4:R7C4,MOD(RC[-5]-1,6)+1,FALSE)),MOD(RC[-5]-1,3)*30+104)) -> 100|101|102|103|190 | G274: =HLOOKUP(Sheet1!R2C1,Sheet1!R2C1:R16C1,MOD(RC1-1,2)+MOD(INT((RC1-1)/2),3)*5+1,FALSE)&"|"&HLOOKUP(Sheet1!R2C1,Sheet1!R2C1:R16C1,MOD(RC1,2)+MOD(INT((RC1)/2),3)*5+1,FALSE)&"|"&HLOOKUP(Sheet1!R2C1,Sheet1!R2C1:R16C1,MOD(RC1+1,2)+MOD(INT((RC1+1)/2),3)*5+1,FALSE)&"|"&HLOOKUP(Sheet1!R2C1,Sheet1!R2C1:R16C1,MOD(RC1+2,2)+MOD(INT((RC1+2)/2),3)*5+1,FALSE)&"|"&HLOOKUP(Sheet1!R2C1,Sheet1!R2C1:R16C1,MOD(RC1+3,2)+MOD(INT((RC1+3)/2),3)*5+1,FALSE) -> 131|160|161|100|101 | H274: =HLOOKUP(Sheet1!R2C1,Sheet1!R2C1:R16C1,MOD(RC1+2,2)+MOD(INT((RC1+2)/2),3)*5+1,FALSE)&"|"&HLOOKUP(Sheet1!R2C1,Sheet1!R2C1:R16C1,MOD(RC1+3,2)+MOD(INT((RC1+3)/2),3)*5+1,FALSE)&"|"&HLOOKUP(Sheet1!R2C1,Sheet1!R2C1:R16C1,MOD(RC1+4,2)+MOD(INT((RC1+4)/2),3)*5+1,FALSE)&"|"&HLOOKUP(Sheet1!R2C1,Sheet1!R2C1:R16C1,MOD(RC1+5,2)+MOD(INT((RC1+5)/2),3)*5+1,FALSE)&"|"&HLOOKUP(Sheet1!R2C1,Sheet1!R2C1:R16C1,MOD(RC1+6,2)+MOD(INT((RC1+6)/2),3)*5+1,FALSE) -> 100|101|130|131|160 | I274: =HLOOKUP(Sheet1!R2C1,Sheet1!R2C1:R16C1,MOD(RC1-1,3)+MOD(INT((RC1-1)/3),3)*5+3,FALSE)&"|"&HLOOKUP(Sheet1!R2C1,Sheet1!R2C1:R16C1,MOD(RC1,3)+MOD(INT((RC1)/3),3)*5+3,FALSE)&"|"&HLOOKUP(Sheet1!R2C1,Sheet1!R2C1:R16C1,MOD(RC1+1,3)+MOD(INT((RC1+1)/3),3)*5+3,FALSE)&"|"&HLOOKUP(Sheet1!R2C1,Sheet1!R2C1:R16C1,MOD(RC1+2,3)+MOD(INT((RC1+2)/3),3)*5+3,FALSE)&"|"&HLOOKUP(Sheet1!R2C1,Sheet1!R2C1:R16C1,MOD(RC1+3,3)+MOD(INT((RC1+3)/3),3)*5+3,FALSE) -> 162|163|164|102|103 | J274: =HLOOKUP(Sheet1!R2C1,Sheet1!R2C1:R16C1,MOD(RC1-1,3)+MOD(INT((RC1-1)/3),3)*5+3,FALSE)&"|"&HLOOKUP(Sheet1!R2C1,Sheet1!R2C1:R16C1,MOD(RC1,3)+MOD(INT((RC1)/3),3)*5+3,FALSE)&"|"&HLOOKUP(Sheet1!R2C1,Sheet1!R2C1:R16C1,MOD(RC1+1,3)+MOD(INT((RC1+1)/3),3)*5+3,FALSE)&"|"&HLOOKUP(Sheet1!R2C1,Sheet1!R2C1:R16C1,MOD(RC1+2,3)+MOD(INT((RC1+2)/3),3)*5+3,FALSE)&"|"&HLOOKUP(Sheet1!R2C1,Sheet1!R2C1:R16C1,MOD(RC1+3,3)+MOD(INT((RC1+3)/3),3)*5+3,FALSE) -> 162|163|164|102|103 | K274: =HLOOKUP(Sheet1!R2C1,Sheet1!R2C1:R16C1,MOD(RC1-1,3)+MOD(INT((RC1-1)/3),3)*5+3,FALSE)&"|"&HLOOKUP(Sheet1!R2C1,Sheet1!R2C1:R16C1,MOD(RC1,3)+MOD(INT((RC1)/3),3)*5+3,FALSE)&"|"&HLOOKUP(Sheet1!R2C1,Sheet1!R2C1:R16C1,MOD(RC1+1,3)+MOD(INT((RC1+1)/3),3)*5+3,FALSE)&"|"&HLOOKUP(Sheet1!R2C1,Sheet1!R2C1:R16C1,MOD(RC1+2,3)+MOD(INT((RC1+2)/3),3)*5+3,FALSE)&"|"&HLOOKUP(Sheet1!R2C1,Sheet1!R2C1:R16C1,MOD(RC1+3,3)+MOD(INT((RC1+3)/3),3)*5+3,FALSE) -> 162|163|164|102|103 | L274: 25|22|23|24 | M274: 2022974|2022974|2022975|2022975 | N274: 10030|10031|10032|10033 | O274: 1|1|1|1 | P274: 2500|2500|2500|2500
A275: 269 | B275: 267 | C275: 30 | D275: =R[-20]C+2 -> 46 | E275: 1000 | F275: =MOD(RC[-5]-1,3)*30+100&"|"&MOD(RC[-5]-1,3)*30+101&"|"&MOD(RC[-5]-1,3)*30+102&"|"&MOD(RC[-5]-1,3)*30+103&"|"&IF(MOD(RC[-5],4)=0,HLOOKUP(Sheet1!R2C10,Sheet1!R2C10:R7C10,MOD(RC[-5]/4-1,6)+1,FALSE),IF(MOD(RC[-5],2)=0,IF(RC[-5]>20,HLOOKUP(Sheet1!R2C7,Sheet1!R2C7:R43C7,MOD(RC[-5]/2-1,42)+1,FALSE),HLOOKUP(Sheet1!R2C4,Sheet1!R2C4:R7C4,MOD(RC[-5]-1,6)+1,FALSE)),MOD(RC[-5]-1,3)*30+104)) -> 130|131|132|133|134 | G275: =HLOOKUP(Sheet1!R2C1,Sheet1!R2C1:R16C1,MOD(RC1-1,2)+MOD(INT((RC1-1)/2),3)*5+1,FALSE)&"|"&HLOOKUP(Sheet1!R2C1,Sheet1!R2C1:R16C1,MOD(RC1,2)+MOD(INT((RC1)/2),3)*5+1,FALSE)&"|"&HLOOKUP(Sheet1!R2C1,Sheet1!R2C1:R16C1,MOD(RC1+1,2)+MOD(INT((RC1+1)/2),3)*5+1,FALSE)&"|"&HLOOKUP(Sheet1!R2C1,Sheet1!R2C1:R16C1,MOD(RC1+2,2)+MOD(INT((RC1+2)/2),3)*5+1,FALSE)&"|"&HLOOKUP(Sheet1!R2C1,Sheet1!R2C1:R16C1,MOD(RC1+3,2)+MOD(INT((RC1+3)/2),3)*5+1,FALSE) -> 160|161|100|101|130 | H275: =HLOOKUP(Sheet1!R2C1,Sheet1!R2C1:R16C1,MOD(RC1+2,2)+MOD(INT((RC1+2)/2),3)*5+1,FALSE)&"|"&HLOOKUP(Sheet1!R2C1,Sheet1!R2C1:R16C1,MOD(RC1+3,2)+MOD(INT((RC1+3)/2),3)*5+1,FALSE)&"|"&HLOOKUP(Sheet1!R2C1,Sheet1!R2C1:R16C1,MOD(RC1+4,2)+MOD(INT((RC1+4)/2),3)*5+1,FALSE)&"|"&HLOOKUP(Sheet1!R2C1,Sheet1!R2C1:R16C1,MOD(RC1+5,2)+MOD(INT((RC1+5)/2),3)*5+1,FALSE)&"|"&HLOOKUP(Sheet1!R2C1,Sheet1!R2C1:R16C1,MOD(RC1+6,2)+MOD(INT((RC1+6)/2),3)*5+1,FALSE) -> 101|130|131|160|161 | I275: =HLOOKUP(Sheet1!R2C1,Sheet1!R2C1:R16C1,MOD(RC1-1,3)+MOD(INT((RC1-1)/3),3)*5+3,FALSE)&"|"&HLOOKUP(Sheet1!R2C1,Sheet1!R2C1:R16C1,MOD(RC1,3)+MOD(INT((RC1)/3),3)*5+3,FALSE)&"|"&HLOOKUP(Sheet1!R2C1,Sheet1!R2C1:R16C1,MOD(RC1+1,3)+MOD(INT((RC1+1)/3),3)*5+3,FALSE)&"|"&HLOOKUP(Sheet1!R2C1,Sheet1!R2C1:R16C1,MOD(RC1+2,3)+MOD(INT((RC1+2)/3),3)*5+3,FALSE)&"|"&HLOOKUP(Sheet1!R2C1,Sheet1!R2C1:R16C1,MOD(RC1+3,3)+MOD(INT((RC1+3)/3),3)*5+3,FALSE) -> 163|164|102|103|104 | J275: =HLOOKUP(Sheet1!R2C1,Sheet1!R2C1:R16C1,MOD(RC1-1,3)+MOD(INT((RC1-1)/3),3)*5+3,FALSE)&"|"&HLOOKUP(Sheet1!R2C1,Sheet1!R2C1:R16C1,MOD(RC1,3)+MOD(INT((RC1)/3),3)*5+3,FALSE)&"|"&HLOOKUP(Sheet1!R2C1,Sheet1!R2C1:R16C1,MOD(RC1+1,3)+MOD(INT((RC1+1)/3),3)*5+3,FALSE)&"|"&HLOOKUP(Sheet1!R2C1,Sheet1!R2C1:R16C1,MOD(RC1+2,3)+MOD(INT((RC1+2)/3),3)*5+3,FALSE)&"|"&HLOOKUP(Sheet1!R2C1,Sheet1!R2C1:R16C1,MOD(RC1+3,3)+MOD(INT((RC1+3)/3),3)*5+3,FALSE) -> 163|164|102|103|104 | K275: =HLOOKUP(Sheet1!R2C1,Sheet1!R2C1:R16C1,MOD(RC1-1,3)+MOD(INT((RC1-1)/3),3)*5+3,FALSE)&"|"&HLOOKUP(Sheet1!R2C1,Sheet1!R2C1:R16C1,MOD(RC1,3)+MOD(INT((RC1)/3),3)*5+3,FALSE)&"|"&HLOOKUP(Sheet1!R2C1,Sheet1!R2C1:R16C1,MOD(RC1+1,3)+MOD(INT((RC1+1)/3),3)*5+3,FALSE)&"|"&HLOOKUP(Sheet1!R2C1,Sheet1!R2C1:R16C1,MOD(RC1+2,3)+MOD(INT((RC1+2)/3),3)*5+3,FALSE)&"|"&HLOOKUP(Sheet1!R2C1,Sheet1!R2C1:R16C1,MOD(RC1+3,3)+MOD(INT((RC1+3)/3),3)*5+3,FALSE) -> 163|164|102|103|104 | L275: 25|22|23|24 | M275: 2041489|2041489|2041490|2041490 | N275: 10030|10031|10032|10033 | O275: 1|1|1|1 | P275: 2500|2500|2500|2500
A276: 270 | B276: 268 | C276: 30 | D276: =R[-20]C+2 -> 46 | E276: 1000 | F276: =MOD(RC[-5]-1,3)*30+100&"|"&MOD(RC[-5]-1,3)*30+101&"|"&MOD(RC[-5]-1,3)*30+102&"|"&MOD(RC[-5]-1,3)*30+103&"|"&IF(MOD(RC[-5],4)=0,HLOOKUP(Sheet1!R2C10,Sheet1!R2C10:R7C10,MOD(RC[-5]/4-1,6)+1,FALSE),IF(MOD(RC[-5],2)=0,IF(RC[-5]>20,HLOOKUP(Sheet1!R2C7,Sheet1!R2C7:R43C7,MOD(RC[-5]/2-1,42)+1,FALSE),HLOOKUP(Sheet1!R2C4,Sheet1!R2C4:R7C4,MOD(RC[-5]-1,6)+1,FALSE)),MOD(RC[-5]-1,3)*30+104)) -> 160|161|162|163|120 | G276: =HLOOKUP(Sheet1!R2C1,Sheet1!R2C1:R16C1,MOD(RC1-1,2)+MOD(INT((RC1-1)/2),3)*5+1,FALSE)&"|"&HLOOKUP(Sheet1!R2C1,Sheet1!R2C1:R16C1,MOD(RC1,2)+MOD(INT((RC1)/2),3)*5+1,FALSE)&"|"&HLOOKUP(Sheet1!R2C1,Sheet1!R2C1:R16C1,MOD(RC1+1,2)+MOD(INT((RC1+1)/2),3)*5+1,FALSE)&"|"&HLOOKUP(Sheet1!R2C1,Sheet1!R2C1:R16C1,MOD(RC1+2,2)+MOD(INT((RC1+2)/2),3)*5+1,FALSE)&"|"&HLOOKUP(Sheet1!R2C1,Sheet1!R2C1:R16C1,MOD(RC1+3,2)+MOD(INT((RC1+3)/2),3)*5+1,FALSE) -> 161|100|101|130|131 | H276: =HLOOKUP(Sheet1!R2C1,Sheet1!R2C1:R16C1,MOD(RC1+2,2)+MOD(INT((RC1+2)/2),3)*5+1,FALSE)&"|"&HLOOKUP(Sheet1!R2C1,Sheet1!R2C1:R16C1,MOD(RC1+3,2)+MOD(INT((RC1+3)/2),3)*5+1,FALSE)&"|"&HLOOKUP(Sheet1!R2C1,Sheet1!R2C1:R16C1,MOD(RC1+4,2)+MOD(INT((RC1+4)/2),3)*5+1,FALSE)&"|"&HLOOKUP(Sheet1!R2C1,Sheet1!R2C1:R16C1,MOD(RC1+5,2)+MOD(INT((RC1+5)/2),3)*5+1,FALSE)&"|"&HLOOKUP(Sheet1!R2C1,Sheet1!R2C1:R16C1,MOD(RC1+6,2)+MOD(INT((RC1+6)/2),3)*5+1,FALSE) -> 130|131|160|161|100 | I276: =HLOOKUP(Sheet1!R2C1,Sheet1!R2C1:R16C1,MOD(RC1-1,3)+MOD(INT((RC1-1)/3),3)*5+3,FALSE)&"|"&HLOOKUP(Sheet1!R2C1,Sheet1!R2C1:R16C1,MOD(RC1,3)+MOD(INT((RC1)/3),3)*5+3,FALSE)&"|"&HLOOKUP(Sheet1!R2C1,Sheet1!R2C1:R16C1,MOD(RC1+1,3)+MOD(INT((RC1+1)/3),3)*5+3,FALSE)&"|"&HLOOKUP(Sheet1!R2C1,Sheet1!R2C1:R16C1,MOD(RC1+2,3)+MOD(INT((RC1+2)/3),3)*5+3,FALSE)&"|"&HLOOKUP(Sheet1!R2C1,Sheet1!R2C1:R16C1,MOD(RC1+3,3)+MOD(INT((RC1+3)/3),3)*5+3,FALSE) -> 164|102|103|104|132 | J276: =HLOOKUP(Sheet1!R2C1,Sheet1!R2C1:R16C1,MOD(RC1-1,3)+MOD(INT((RC1-1)/3),3)*5+3,FALSE)&"|"&HLOOKUP(Sheet1!R2C1,Sheet1!R2C1:R16C1,MOD(RC1,3)+MOD(INT((RC1)/3),3)*5+3,FALSE)&"|"&HLOOKUP(Sheet1!R2C1,Sheet1!R2C1:R16C1,MOD(RC1+1,3)+MOD(INT((RC1+1)/3),3)*5+3,FALSE)&"|"&HLOOKUP(Sheet1!R2C1,Sheet1!R2C1:R16C1,MOD(RC1+2,3)+MOD(INT((RC1+2)/3),3)*5+3,FALSE)&"|"&HLOOKUP(Sheet1!R2C1,Sheet1!R2C1:R16C1,MOD(RC1+3,3)+MOD(INT((RC1+3)/3),3)*5+3,FALSE) -> 164|102|103|104|132 | K276: =HLOOKUP(Sheet1!R2C1,Sheet1!R2C1:R16C1,MOD(RC1-1,3)+MOD(INT((RC1-1)/3),3)*5+3,FALSE)&"|"&HLOOKUP(Sheet1!R2C1,Sheet1!R2C1:R16C1,MOD(RC1,3)+MOD(INT((RC1)/3),3)*5+3,FALSE)&"|"&HLOOKUP(Sheet1!R2C1,Sheet1!R2C1:R16C1,MOD(RC1+1,3)+MOD(INT((RC1+1)/3),3)*5+3,FALSE)&"|"&HLOOKUP(Sheet1!R2C1,Sheet1!R2C1:R16C1,MOD(RC1+2,3)+MOD(INT((RC1+2)/3),3)*5+3,FALSE)&"|"&HLOOKUP(Sheet1!R2C1,Sheet1!R2C1:R16C1,MOD(RC1+3,3)+MOD(INT((RC1+3)/3),3)*5+3,FALSE) -> 164|102|103|104|132 | L276: 25|22|23|24 | M276: 2060310|2060310|2060310|2060310 | N276: 10030|10031|10032|10033|10030|10031|10032|10033|10030|10031|10032|10033|10030|10031|10032|10033|10030|10031|10032|10033|10030|10031|10032|10033|10030|10031|10032|10033|10030|10031|10032|10033|10030|10031|10032|10033|10030|10031|10032|10033 | O276: 1|1|1|1|1|1|1|1|1|1|1|1|1|1|1|1|1|1|1|1|1|1|1|1|1|1|1|1|1|1|1|1|1|1|1|1|1|1|1|1 | P276: 2500|2500|2500|2500|2500|2500|2500|2500|2500|2500|2500|2500|2500|2500|2500|2500|2500|2500|2500|2500|2500|2500|2500|2500|2500|2500|2500|2500|2500|2500|2500|2500|2500|2500|2500|2500|2500|2500|2500|2500
A277: 271 | B277: 269 | C277: 30 | D277: =R[-20]C+2 -> 46 | E277: 1000 | F277: =MOD(RC[-5]-1,3)*30+100&"|"&MOD(RC[-5]-1,3)*30+101&"|"&MOD(RC[-5]-1,3)*30+102&"|"&MOD(RC[-5]-1,3)*30+103&"|"&IF(MOD(RC[-5],4)=0,HLOOKUP(Sheet1!R2C10,Sheet1!R2C10:R7C10,MOD(RC[-5]/4-1,6)+1,FALSE),IF(MOD(RC[-5],2)=0,IF(RC[-5]>20,HLOOKUP(Sheet1!R2C7,Sheet1!R2C7:R43C7,MOD(RC[-5]/2-1,42)+1,FALSE),HLOOKUP(Sheet1!R2C4,Sheet1!R2C4:R7C4,MOD(RC[-5]-1,6)+1,FALSE)),MOD(RC[-5]-1,3)*30+104)) -> 100|101|102|103|104 | G277: =HLOOKUP(Sheet1!R2C1,Sheet1!R2C1:R16C1,MOD(RC1-1,2)+MOD(INT((RC1-1)/2),3)*5+1,FALSE)&"|"&HLOOKUP(Sheet1!R2C1,Sheet1!R2C1:R16C1,MOD(RC1,2)+MOD(INT((RC1)/2),3)*5+1,FALSE)&"|"&HLOOKUP(Sheet1!R2C1,Sheet1!R2C1:R16C1,MOD(RC1+1,2)+MOD(INT((RC1+1)/2),3)*5+1,FALSE)&"|"&HLOOKUP(Sheet1!R2C1,Sheet1!R2C1:R16C1,MOD(RC1+2,2)+MOD(INT((RC1+2)/2),3)*5+1,FALSE)&"|"&HLOOKUP(Sheet1!R2C1,Sheet1!R2C1:R16C1,MOD(RC1+3,2)+MOD(INT((RC1+3)/2),3)*5+1,FALSE) -> 100|101|130|131|160 | H277: =HLOOKUP(Sheet1!R2C1,Sheet1!R2C1:R16C1,MOD(RC1+2,2)+MOD(INT((RC1+2)/2),3)*5+1,FALSE)&"|"&HLOOKUP(Sheet1!R2C1,Sheet1!R2C1:R16C1,MOD(RC1+3,2)+MOD(INT((RC1+3)/2),3)*5+1,FALSE)&"|"&HLOOKUP(Sheet1!R2C1,Sheet1!R2C1:R16C1,MOD(RC1+4,2)+MOD(INT((RC1+4)/2),3)*5+1,FALSE)&"|"&HLOOKUP(Sheet1!R2C1,Sheet1!R2C1:R16C1,MOD(RC1+5,2)+MOD(INT((RC1+5)/2),3)*5+1,FALSE)&"|"&HLOOKUP(Sheet1!R2C1,Sheet1!R2C1:R16C1,MOD(RC1+6,2)+MOD(INT((RC1+6)/2),3)*5+1,FALSE) -> 131|160|161|100|101 | I277: =HLOOKUP(Sheet1!R2C1,Sheet1!R2C1:R16C1,MOD(RC1-1,3)+MOD(INT((RC1-1)/3),3)*5+3,FALSE)&"|"&HLOOKUP(Sheet1!R2C1,Sheet1!R2C1:R16C1,MOD(RC1,3)+MOD(INT((RC1)/3),3)*5+3,FALSE)&"|"&HLOOKUP(Sheet1!R2C1,Sheet1!R2C1:R16C1,MOD(RC1+1,3)+MOD(INT((RC1+1)/3),3)*5+3,FALSE)&"|"&HLOOKUP(Sheet1!R2C1,Sheet1!R2C1:R16C1,MOD(RC1+2,3)+MOD(INT((RC1+2)/3),3)*5+3,FALSE)&"|"&HLOOKUP(Sheet1!R2C1,Sheet1!R2C1:R16C1,MOD(RC1+3,3)+MOD(INT((RC1+3)/3),3)*5+3,FALSE) -> 102|103|104|132|133 | J277: =HLOOKUP(Sheet1!R2C1,Sheet1!R2C1:R16C1,MOD(RC1-1,3)+MOD(INT((RC1-1)/3),3)*5+3,FALSE)&"|"&HLOOKUP(Sheet1!R2C1,Sheet1!R2C1:R16C1,MOD(RC1,3)+MOD(INT((RC1)/3),3)*5+3,FALSE)&"|"&HLOOKUP(Sheet1!R2C1,Sheet1!R2C1:R16C1,MOD(RC1+1,3)+MOD(INT((RC1+1)/3),3)*5+3,FALSE)&"|"&HLOOKUP(Sheet1!R2C1,Sheet1!R2C1:R16C1,MOD(RC1+2,3)+MOD(INT((RC1+2)/3),3)*5+3,FALSE)&"|"&HLOOKUP(Sheet1!R2C1,Sheet1!R2C1:R16C1,MOD(RC1+3,3)+MOD(INT((RC1+3)/3),3)*5+3,FALSE) -> 102|103|104|132|133 | K277: =HLOOKUP(Sheet1!R2C1,Sheet1!R2C1:R16C1,MOD(RC1-1,3)+MOD(INT((RC1-1)/3),3)*5+3,FALSE)&"|"&HLOOKUP(Sheet1!R2C1,Sheet1!R2C1:R16C1,MOD(RC1,3)+MOD(INT((RC1)/3),3)*5+3,FALSE)&"|"&HLOOKUP(Sheet1!R2C1,Sheet1!R2C1:R16C1,MOD(RC1+1,3)+MOD(INT((RC1+1)/3),3)*5+3,FALSE)&"|"&HLOOKUP(Sheet1!R2C1,Sheet1!R2C1:R16C1,MOD(RC1+2,3)+MOD(INT((RC1+2)/3),3)*5+3,FALSE)&"|"&HLOOKUP(Sheet1!R2C1,Sheet1!R2C1:R16C1,MOD(RC1+3,3)+MOD(INT((RC1+3)/3),3)*5+3,FALSE) -> 102|103|104|132|133 | L277: 25|22|23|24 | M277: 2079486|2079486|2079488|2079488 | N277: 10030|10031|10032|10033 | O277: 1|1|1|1 | P277: 2500|2500|2500|2500
A278: 272 | B278: 270 | C278: 30 | D278: =R[-20]C+2 -> 46 | E278: 1000 | F278: =MOD(RC[-5]-1,3)*30+100&"|"&MOD(RC[-5]-1,3)*30+101&"|"&MOD(RC[-5]-1,3)*30+102&"|"&MOD(RC[-5]-1,3)*30+103&"|"&IF(MOD(RC[-5],4)=0,HLOOKUP(Sheet1!R2C10,Sheet1!R2C10:R7C10,MOD(RC[-5]/4-1,6)+1,FALSE),IF(MOD(RC[-5],2)=0,IF(RC[-5]>20,HLOOKUP(Sheet1!R2C7,Sheet1!R2C7:R43C7,MOD(RC[-5]/2-1,42)+1,FALSE),HLOOKUP(Sheet1!R2C4,Sheet1!R2C4:R7C4,MOD(RC[-5]-1,6)+1,FALSE)),MOD(RC[-5]-1,3)*30+104)) -> 130|131|132|133|191 | G278: =HLOOKUP(Sheet1!R2C1,Sheet1!R2C1:R16C1,MOD(RC1-1,2)+MOD(INT((RC1-1)/2),3)*5+1,FALSE)&"|"&HLOOKUP(Sheet1!R2C1,Sheet1!R2C1:R16C1,MOD(RC1,2)+MOD(INT((RC1)/2),3)*5+1,FALSE)&"|"&HLOOKUP(Sheet1!R2C1,Sheet1!R2C1:R16C1,MOD(RC1+1,2)+MOD(INT((RC1+1)/2),3)*5+1,FALSE)&"|"&HLOOKUP(Sheet1!R2C1,Sheet1!R2C1:R16C1,MOD(RC1+2,2)+MOD(INT((RC1+2)/2),3)*5+1,FALSE)&"|"&HLOOKUP(Sheet1!R2C1,Sheet1!R2C1:R16C1,MOD(RC1+3,2)+MOD(INT((RC1+3)/2),3)*5+1,FALSE) -> 101|130|131|160|161 | H278: =HLOOKUP(Sheet1!R2C1,Sheet1!R2C1:R16C1,MOD(RC1+2,2)+MOD(INT((RC1+2)/2),3)*5+1,FALSE)&"|"&HLOOKUP(Sheet1!R2C1,Sheet1!R2C1:R16C1,MOD(RC1+3,2)+MOD(INT((RC1+3)/2),3)*5+1,FALSE)&"|"&HLOOKUP(Sheet1!R2C1,Sheet1!R2C1:R16C1,MOD(RC1+4,2)+MOD(INT((RC1+4)/2),3)*5+1,FALSE)&"|"&HLOOKUP(Sheet1!R2C1,Sheet1!R2C1:R16C1,MOD(RC1+5,2)+MOD(INT((RC1+5)/2),3)*5+1,FALSE)&"|"&HLOOKUP(Sheet1!R2C1,Sheet1!R2C1:R16C1,MOD(RC1+6,2)+MOD(INT((RC1+6)/2),3)*5+1,FALSE) -> 160|161|100|101|130 | I278: =HLOOKUP(Sheet1!R2C1,Sheet1!R2C1:R16C1,MOD(RC1-1,3)+MOD(INT((RC1-1)/3),3)*5+3,FALSE)&"|"&HLOOKUP(Sheet1!R2C1,Sheet1!R2C1:R16C1,MOD(RC1,3)+MOD(INT((RC1)/3),3)*5+3,FALSE)&"|"&HLOOKUP(Sheet1!R2C1,Sheet1!R2C1:R16C1,MOD(RC1+1,3)+MOD(INT((RC1+1)/3),3)*5+3,FALSE)&"|"&HLOOKUP(Sheet1!R2C1,Sheet1!R2C1:R16C1,MOD(RC1+2,3)+MOD(INT((RC1+2)/3),3)*5+3,FALSE)&"|"&HLOOKUP(Sheet1!R2C1,Sheet1!R2C1:R16C1,MOD(RC1+3,3)+MOD(INT((RC1+3)/3),3)*5+3,FALSE) -> 103|104|132|133|134 | J278: =HLOOKUP(Sheet1!R2C1,Sheet1!R2C1:R16C1,MOD(RC1-1,3)+MOD(INT((RC1-1)/3),3)*5+3,FALSE)&"|"&HLOOKUP(Sheet1!R2C1,Sheet1!R2C1:R16C1,MOD(RC1,3)+MOD(INT((RC1)/3),3)*5+3,FALSE)&"|"&HLOOKUP(Sheet1!R2C1,Sheet1!R2C1:R16C1,MOD(RC1+1,3)+MOD(INT((RC1+1)/3),3)*5+3,FALSE)&"|"&HLOOKUP(Sheet1!R2C1,Sheet1!R2C1:R16C1,MOD(RC1+2,3)+MOD(INT((RC1+2)/3),3)*5+3,FALSE)&"|"&HLOOKUP(Sheet1!R2C1,Sheet1!R2C1:R16C1,MOD(RC1+3,3)+MOD(INT((RC1+3)/3),3)*5+3,FALSE) -> 103|104|132|133|134 | K278: =HLOOKUP(Sheet1!R2C1,Sheet1!R2C1:R16C1,MOD(RC1-1,3)+MOD(INT((RC1-1)/3),3)*5+3,FALSE)&"|"&HLOOKUP(Sheet1!R2C1,Sheet1!R2C1:R16C1,MOD(RC1,3)+MOD(INT((RC1)/3),3)*5+3,FALSE)&"|"&HLOOKUP(Sheet1!R2C1,Sheet1!R2C1:R16C1,MOD(RC1+1,3)+MOD(INT((RC1+1)/3),3)*5+3,FALSE)&"|"&HLOOKUP(Sheet1!R2C1,Sheet1!R2C1:R16C1,MOD(RC1+2,3)+MOD(INT((RC1+2)/3),3)*5+3,FALSE)&"|"&HLOOKUP(Sheet1!R2C1,Sheet1!R2C1:R16C1,MOD(RC1+3,3)+MOD(INT((RC1+3)/3),3)*5+3,FALSE) -> 103|104|132|133|134 | L278: 25|22|23|24 | M278: 2099401|2099401|2099400|2099400 | N278: 10030|10031|10032|10033 | O278: 1|1|1|1 | P278: 2500|2500|2500|2500
A279: 273 | B279: 271 | C279: 30 | D279: =R[-20]C+2 -> 46 | E279: 1000 | F279: =MOD(RC[-5]-1,3)*30+100&"|"&MOD(RC[-5]-1,3)*30+101&"|"&MOD(RC[-5]-1,3)*30+102&"|"&MOD(RC[-5]-1,3)*30+103&"|"&IF(MOD(RC[-5],4)=0,HLOOKUP(Sheet1!R2C10,Sheet1!R2C10:R7C10,MOD(RC[-5]/4-1,6)+1,FALSE),IF(MOD(RC[-5],2)=0,IF(RC[-5]>20,HLOOKUP(Sheet1!R2C7,Sheet1!R2C7:R43C7,MOD(RC[-5]/2-1,42)+1,FALSE),HLOOKUP(Sheet1!R2C4,Sheet1!R2C4:R7C4,MOD(RC[-5]-1,6)+1,FALSE)),MOD(RC[-5]-1,3)*30+104)) -> 160|161|162|163|164 | G279: =HLOOKUP(Sheet1!R2C1,Sheet1!R2C1:R16C1,MOD(RC1-1,2)+MOD(INT((RC1-1)/2),3)*5+1,FALSE)&"|"&HLOOKUP(Sheet1!R2C1,Sheet1!R2C1:R16C1,MOD(RC1,2)+MOD(INT((RC1)/2),3)*5+1,FALSE)&"|"&HLOOKUP(Sheet1!R2C1,Sheet1!R2C1:R16C1,MOD(RC1+1,2)+MOD(INT((RC1+1)/2),3)*5+1,FALSE)&"|"&HLOOKUP(Sheet1!R2C1,Sheet1!R2C1:R16C1,MOD(RC1+2,2)+MOD(INT((RC1+2)/2),3)*5+1,FALSE)&"|"&HLOOKUP(Sheet1!R2C1,Sheet1!R2C1:R16C1,MOD(RC1+3,2)+MOD(INT((RC1+3)/2),3)*5+1,FALSE) -> 130|131|160|161|100 | H279: =HLOOKUP(Sheet1!R2C1,Sheet1!R2C1:R16C1,MOD(RC1+2,2)+MOD(INT((RC1+2)/2),3)*5+1,FALSE)&"|"&HLOOKUP(Sheet1!R2C1,Sheet1!R2C1:R16C1,MOD(RC1+3,2)+MOD(INT((RC1+3)/2),3)*5+1,FALSE)&"|"&HLOOKUP(Sheet1!R2C1,Sheet1!R2C1:R16C1,MOD(RC1+4,2)+MOD(INT((RC1+4)/2),3)*5+1,FALSE)&"|"&HLOOKUP(Sheet1!R2C1,Sheet1!R2C1:R16C1,MOD(RC1+5,2)+MOD(INT((RC1+5)/2),3)*5+1,FALSE)&"|"&HLOOKUP(Sheet1!R2C1,Sheet1!R2C1:R16C1,MOD(RC1+6,2)+MOD(INT((RC1+6)/2),3)*5+1,FALSE) -> 161|100|101|130|131 | I279: =HLOOKUP(Sheet1!R2C1,Sheet1!R2C1:R16C1,MOD(RC1-1,3)+MOD(INT((RC1-1)/3),3)*5+3,FALSE)&"|"&HLOOKUP(Sheet1!R2C1,Sheet1!R2C1:R16C1,MOD(RC1,3)+MOD(INT((RC1)/3),3)*5+3,FALSE)&"|"&HLOOKUP(Sheet1!R2C1,Sheet1!R2C1:R16C1,MOD(RC1+1,3)+MOD(INT((RC1+1)/3),3)*5+3,FALSE)&"|"&HLOOKUP(Sheet1!R2C1,Sheet1!R2C1:R16C1,MOD(RC1+2,3)+MOD(INT((RC1+2)/3),3)*5+3,FALSE)&"|"&HLOOKUP(Sheet1!R2C1,Sheet1!R2C1:R16C1,MOD(RC1+3,3)+MOD(INT((RC1+3)/3),3)*5+3,FALSE) -> 104|132|133|134|162 | J279: =HLOOKUP(Sheet1!R2C1,Sheet1!R2C1:R16C1,MOD(RC1-1,3)+MOD(INT((RC1-1)/3),3)*5+3,FALSE)&"|"&HLOOKUP(Sheet1!R2C1,Sheet1!R2C1:R16C1,MOD(RC1,3)+MOD(INT((RC1)/3),3)*5+3,FALSE)&"|"&HLOOKUP(Sheet1!R2C1,Sheet1!R2C1:R16C1,MOD(RC1+1,3)+MOD(INT((RC1+1)/3),3)*5+3,FALSE)&"|"&HLOOKUP(Sheet1!R2C1,Sheet1!R2C1:R16C1,MOD(RC1+2,3)+MOD(INT((RC1+2)/3),3)*5+3,FALSE)&"|"&HLOOKUP(Sheet1!R2C1,Sheet1!R2C1:R16C1,MOD(RC1+3,3)+MOD(INT((RC1+3)/3),3)*5+3,FALSE) -> 104|132|133|134|162 | K279: =HLOOKUP(Sheet1!R2C1,Sheet1!R2C1:R16C1,MOD(RC1-1,3)+MOD(INT((RC1-1)/3),3)*5+3,FALSE)&"|"&HLOOKUP(Sheet1!R2C1,Sheet1!R2C1:R16C1,MOD(RC1,3)+MOD(INT((RC1)/3),3)*5+3,FALSE)&"|"&HLOOKUP(Sheet1!R2C1,Sheet1!R2C1:R16C1,MOD(RC1+1,3)+MOD(INT((RC1+1)/3),3)*5+3,FALSE)&"|"&HLOOKUP(Sheet1!R2C1,Sheet1!R2C1:R16C1,MOD(RC1+2,3)+MOD(INT((RC1+2)/3),3)*5+3,FALSE)&"|"&HLOOKUP(Sheet1!R2C1,Sheet1!R2C1:R16C1,MOD(RC1+3,3)+MOD(INT((RC1+3)/3),3)*5+3,FALSE) -> 104|132|133|134|162 | L279: 25|22|23|24 | M279: 2118577|2118578|2118578|2118578 | N279: 10030|10031|10032|10033 | O279: 1|1|1|1 | P279: 2500|2500|2500|2500
A280: 274 | B280: 272 | C280: 30 | D280: =R[-20]C+2 -> 46 | E280: 1000 | F280: =MOD(RC[-5]-1,3)*30+100&"|"&MOD(RC[-5]-1,3)*30+101&"|"&MOD(RC[-5]-1,3)*30+102&"|"&MOD(RC[-5]-1,3)*30+103&"|"&IF(MOD(RC[-5],4)=0,HLOOKUP(Sheet1!R2C10,Sheet1!R2C10:R7C10,MOD(RC[-5]/4-1,6)+1,FALSE),IF(MOD(RC[-5],2)=0,IF(RC[-5]>20,HLOOKUP(Sheet1!R2C7,Sheet1!R2C7:R43C7,MOD(RC[-5]/2-1,42)+1,FALSE),HLOOKUP(Sheet1!R2C4,Sheet1!R2C4:R7C4,MOD(RC[-5]-1,6)+1,FALSE)),MOD(RC[-5]-1,3)*30+104)) -> 100|101|102|103|122 | G280: =HLOOKUP(Sheet1!R2C1,Sheet1!R2C1:R16C1,MOD(RC1-1,2)+MOD(INT((RC1-1)/2),3)*5+1,FALSE)&"|"&HLOOKUP(Sheet1!R2C1,Sheet1!R2C1:R16C1,MOD(RC1,2)+MOD(INT((RC1)/2),3)*5+1,FALSE)&"|"&HLOOKUP(Sheet1!R2C1,Sheet1!R2C1:R16C1,MOD(RC1+1,2)+MOD(INT((RC1+1)/2),3)*5+1,FALSE)&"|"&HLOOKUP(Sheet1!R2C1,Sheet1!R2C1:R16C1,MOD(RC1+2,2)+MOD(INT((RC1+2)/2),3)*5+1,FALSE)&"|"&HLOOKUP(Sheet1!R2C1,Sheet1!R2C1:R16C1,MOD(RC1+3,2)+MOD(INT((RC1+3)/2),3)*5+1,FALSE) -> 131|160|161|100|101 | H280: =HLOOKUP(Sheet1!R2C1,Sheet1!R2C1:R16C1,MOD(RC1+2,2)+MOD(INT((RC1+2)/2),3)*5+1,FALSE)&"|"&HLOOKUP(Sheet1!R2C1,Sheet1!R2C1:R16C1,MOD(RC1+3,2)+MOD(INT((RC1+3)/2),3)*5+1,FALSE)&"|"&HLOOKUP(Sheet1!R2C1,Sheet1!R2C1:R16C1,MOD(RC1+4,2)+MOD(INT((RC1+4)/2),3)*5+1,FALSE)&"|"&HLOOKUP(Sheet1!R2C1,Sheet1!R2C1:R16C1,MOD(RC1+5,2)+MOD(INT((RC1+5)/2),3)*5+1,FALSE)&"|"&HLOOKUP(Sheet1!R2C1,Sheet1!R2C1:R16C1,MOD(RC1+6,2)+MOD(INT((RC1+6)/2),3)*5+1,FALSE) -> 100|101|130|131|160 | I280: =HLOOKUP(Sheet1!R2C1,Sheet1!R2C1:R16C1,MOD(RC1-1,3)+MOD(INT((RC1-1)/3),3)*5+3,FALSE)&"|"&HLOOKUP(Sheet1!R2C1,Sheet1!R2C1:R16C1,MOD(RC1,3)+MOD(INT((RC1)/3),3)*5+3,FALSE)&"|"&HLOOKUP(Sheet1!R2C1,Sheet1!R2C1:R16C1,MOD(RC1+1,3)+MOD(INT((RC1+1)/3),3)*5+3,FALSE)&"|"&HLOOKUP(Sheet1!R2C1,Sheet1!R2C1:R16C1,MOD(RC1+2,3)+MOD(INT((RC1+2)/3),3)*5+3,FALSE)&"|"&HLOOKUP(Sheet1!R2C1,Sheet1!R2C1:R16C1,MOD(RC1+3,3)+MOD(INT((RC1+3)/3),3)*5+3,FALSE) -> 132|133|134|162|163 | J280: =HLOOKUP(Sheet1!R2C1,Sheet1!R2C1:R16C1,MOD(RC1-1,3)+MOD(INT((RC1-1)/3),3)*5+3,FALSE)&"|"&HLOOKUP(Sheet1!R2C1,Sheet1!R2C1:R16C1,MOD(RC1,3)+MOD(INT((RC1)/3),3)*5+3,FALSE)&"|"&HLOOKUP(Sheet1!R2C1,Sheet1!R2C1:R16C1,MOD(RC1+1,3)+MOD(INT((RC1+1)/3),3)*5+3,FALSE)&"|"&HLOOKUP(Sheet1!R2C1,Sheet1!R2C1:R16C1,MOD(RC1+2,3)+MOD(INT((RC1+2)/3),3)*5+3,FALSE)&"|"&HLOOKUP(Sheet1!R2C1,Sheet1!R2C1:R16C1,MOD(RC1+3,3)+MOD(INT((RC1+3)/3),3)*5+3,FALSE) -> 132|133|134|162|163 | K280: =HLOOKUP(Sheet1!R2C1,Sheet1!R2C1:R16C1,MOD(RC1-1,3)+MOD(INT((RC1-1)/3),3)*5+3,FALSE)&"|"&HLOOKUP(Sheet1!R2C1,Sheet1!R2C1:R16C1,MOD(RC1,3)+MOD(INT((RC1)/3),3)*5+3,FALSE)&"|"&HLOOKUP(Sheet1!R2C1,Sheet1!R2C1:R16C1,MOD(RC1+1,3)+MOD(INT((RC1+1)/3),3)*5+3,FALSE)&"|"&HLOOKUP(Sheet1!R2C1,Sheet1!R2C1:R16C1,MOD(RC1+2,3)+MOD(INT((RC1+2)/3),3)*5+3,FALSE)&"|"&HLOOKUP(Sheet1!R2C1,Sheet1!R2C1:R16C1,MOD(RC1+3,3)+MOD(INT((RC1+3)/3),3)*5+3,FALSE) -> 132|133|134|162|163 | L280: 25|22|23|24 | M280: 2138205|2138205|2138205|2138205 | N280: 10030|10031|10032|10033 | O280: 1|1|1|1 | P280: 2500|2500|2500|2500
A281: 275 | B281: 273 | C281: 30 | D281: =R[-20]C+2 -> 46 | E281: 1000 | F281: =MOD(RC[-5]-1,3)*30+100&"|"&MOD(RC[-5]-1,3)*30+101&"|"&MOD(RC[-5]-1,3)*30+102&"|"&MOD(RC[-5]-1,3)*30+103&"|"&IF(MOD(RC[-5],4)=0,HLOOKUP(Sheet1!R2C10,Sheet1!R2C10:R7C10,MOD(RC[-5]/4-1,6)+1,FALSE),IF(MOD(RC[-5],2)=0,IF(RC[-5]>20,HLOOKUP(Sheet1!R2C7,Sheet1!R2C7:R43C7,MOD(RC[-5]/2-1,42)+1,FALSE),HLOOKUP(Sheet1!R2C4,Sheet1!R2C4:R7C4,MOD(RC[-5]-1,6)+1,FALSE)),MOD(RC[-5]-1,3)*30+104)) -> 130|131|132|133|134 | G281: =HLOOKUP(Sheet1!R2C1,Sheet1!R2C1:R16C1,MOD(RC1-1,2)+MOD(INT((RC1-1)/2),3)*5+1,FALSE)&"|"&HLOOKUP(Sheet1!R2C1,Sheet1!R2C1:R16C1,MOD(RC1,2)+MOD(INT((RC1)/2),3)*5+1,FALSE)&"|"&HLOOKUP(Sheet1!R2C1,Sheet1!R2C1:R16C1,MOD(RC1+1,2)+MOD(INT((RC1+1)/2),3)*5+1,FALSE)&"|"&HLOOKUP(Sheet1!R2C1,Sheet1!R2C1:R16C1,MOD(RC1+2,2)+MOD(INT((RC1+2)/2),3)*5+1,FALSE)&"|"&HLOOKUP(Sheet1!R2C1,Sheet1!R2C1:R16C1,MOD(RC1+3,2)+MOD(INT((RC1+3)/2),3)*5+1,FALSE) -> 160|161|100|101|130 | H281: =HLOOKUP(Sheet1!R2C1,Sheet1!R2C1:R16C1,MOD(RC1+2,2)+MOD(INT((RC1+2)/2),3)*5+1,FALSE)&"|"&HLOOKUP(Sheet1!R2C1,Sheet1!R2C1:R16C1,MOD(RC1+3,2)+MOD(INT((RC1+3)/2),3)*5+1,FALSE)&"|"&HLOOKUP(Sheet1!R2C1,Sheet1!R2C1:R16C1,MOD(RC1+4,2)+MOD(INT((RC1+4)/2),3)*5+1,FALSE)&"|"&HLOOKUP(Sheet1!R2C1,Sheet1!R2C1:R16C1,MOD(RC1+5,2)+MOD(INT((RC1+5)/2),3)*5+1,FALSE)&"|"&HLOOKUP(Sheet1!R2C1,Sheet1!R2C1:R16C1,MOD(RC1+6,2)+MOD(INT((RC1+6)/2),3)*5+1,FALSE) -> 101|130|131|160|161 | I281: =HLOOKUP(Sheet1!R2C1,Sheet1!R2C1:R16C1,MOD(RC1-1,3)+MOD(INT((RC1-1)/3),3)*5+3,FALSE)&"|"&HLOOKUP(Sheet1!R2C1,Sheet1!R2C1:R16C1,MOD(RC1,3)+MOD(INT((RC1)/3),3)*5+3,FALSE)&"|"&HLOOKUP(Sheet1!R2C1,Sheet1!R2C1:R16C1,MOD(RC1+1,3)+MOD(INT((RC1+1)/3),3)*5+3,FALSE)&"|"&HLOOKUP(Sheet1!R2C1,Sheet1!R2C1:R16C1,MOD(RC1+2,3)+MOD(INT((RC1+2)/3),3)*5+3,FALSE)&"|"&HLOOKUP(Sheet1!R2C1,Sheet1!R2C1:R16C1,MOD(RC1+3,3)+MOD(INT((RC1+3)/3),3)*5+3,FALSE) -> 133|134|162|163|164 | J281: =HLOOKUP(Sheet1!R2C1,Sheet1!R2C1:R16C1,MOD(RC1-1,3)+MOD(INT((RC1-1)/3),3)*5+3,FALSE)&"|"&HLOOKUP(Sheet1!R2C1,Sheet1!R2C1:R16C1,MOD(RC1,3)+MOD(INT((RC1)/3),3)*5+3,FALSE)&"|"&HLOOKUP(Sheet1!R2C1,Sheet1!R2C1:R16C1,MOD(RC1+1,3)+MOD(INT((RC1+1)/3),3)*5+3,FALSE)&"|"&HLOOKUP(Sheet1!R2C1,Sheet1!R2C1:R16C1,MOD(RC1+2,3)+MOD(INT((RC1+2)/3),3)*5+3,FALSE)&"|"&HLOOKUP(Sheet1!R2C1,Sheet1!R2C1:R16C1,MOD(RC1+3,3)+MOD(INT((RC1+3)/3),3)*5+3,FALSE) -> 133|134|162|163|164 | K281: =HLOOKUP(Sheet1!R2C1,Sheet1!R2C1:R16C1,MOD(RC1-1,3)+MOD(INT((RC1-1)/3),3)*5+3,FALSE)&"|"&HLOOKUP(Sheet1!R2C1,Sheet1!R2C1:R16C1,MOD(RC1,3)+MOD(INT((RC1)/3),3)*5+3,FALSE)&"|"&HLOOKUP(Sheet1!R2C1,Sheet1!R2C1:R16C1,MOD(RC1+1,3)+MOD(INT((RC1+1)/3),3)*5+3,FALSE)&"|"&HLOOKUP(Sheet1!R2C1,Sheet1!R2C1:R16C1,MOD(RC1+2,3)+MOD(INT((RC1+2)/3),3)*5+3,FALSE)&"|"&HLOOKUP(Sheet1!R2C1,Sheet1!R2C1:R16C1,MOD(RC1+3,3)+MOD(INT((RC1+3)/3),3)*5+3,FALSE) -> 133|134|162|163|164 | L281: 25|22|23|24 | M281: 2158072|2158073|2158073|2158073 | N281: 10030|10031|10032|10033|10030|10031|10032|10033|10030|10031|10032|10033|10030|10031|10032|10033|10030|10031|10032|10033|10030|10031|10032|10033|10030|10031|10032|10033|10030|10031|10032|10033|10030|10031|10032|10033|10030|10031|10032|10033 | O281: 1|1|1|1|1|1|1|1|1|1|1|1|1|1|1|1|1|1|1|1|1|1|1|1|1|1|1|1|1|1|1|1|1|1|1|1|1|1|1|1 | P281: 2500|2500|2500|2500|2500|2500|2500|2500|2500|2500|2500|2500|2500|2500|2500|2500|2500|2500|2500|2500|2500|2500|2500|2500|2500|2500|2500|2500|2500|2500|2500|2500|2500|2500|2500|2500|2500|2500|2500|2500
A282: 276 | B282: 274 | C282: 30 | D282: =R[-20]C+2 -> 46 | E282: 1000 | F282: =MOD(RC[-5]-1,3)*30+100&"|"&MOD(RC[-5]-1,3)*30+101&"|"&MOD(RC[-5]-1,3)*30+102&"|"&MOD(RC[-5]-1,3)*30+103&"|"&IF(MOD(RC[-5],4)=0,HLOOKUP(Sheet1!R2C10,Sheet1!R2C10:R7C10,MOD(RC[-5]/4-1,6)+1,FALSE),IF(MOD(RC[-5],2)=0,IF(RC[-5]>20,HLOOKUP(Sheet1!R2C7,Sheet1!R2C7:R43C7,MOD(RC[-5]/2-1,42)+1,FALSE),HLOOKUP(Sheet1!R2C4,Sheet1!R2C4:R7C4,MOD(RC[-5]-1,6)+1,FALSE)),MOD(RC[-5]-1,3)*30+104)) -> 160|161|162|163|192 | G282: =HLOOKUP(Sheet1!R2C1,Sheet1!R2C1:R16C1,MOD(RC1-1,2)+MOD(INT((RC1-1)/2),3)*5+1,FALSE)&"|"&HLOOKUP(Sheet1!R2C1,Sheet1!R2C1:R16C1,MOD(RC1,2)+MOD(INT((RC1)/2),3)*5+1,FALSE)&"|"&HLOOKUP(Sheet1!R2C1,Sheet1!R2C1:R16C1,MOD(RC1+1,2)+MOD(INT((RC1+1)/2),3)*5+1,FALSE)&"|"&HLOOKUP(Sheet1!R2C1,Sheet1!R2C1:R16C1,MOD(RC1+2,2)+MOD(INT((RC1+2)/2),3)*5+1,FALSE)&"|"&HLOOKUP(Sheet1!R2C1,Sheet1!R2C1:R16C1,MOD(RC1+3,2)+MOD(INT((RC1+3)/2),3)*5+1,FALSE) -> 161|100|101|130|131 | H282: =HLOOKUP(Sheet1!R2C1,Sheet1!R2C1:R16C1,MOD(RC1+2,2)+MOD(INT((RC1+2)/2),3)*5+1,FALSE)&"|"&HLOOKUP(Sheet1!R2C1,Sheet1!R2C1:R16C1,MOD(RC1+3,2)+MOD(INT((RC1+3)/2),3)*5+1,FALSE)&"|"&HLOOKUP(Sheet1!R2C1,Sheet1!R2C1:R16C1,MOD(RC1+4,2)+MOD(INT((RC1+4)/2),3)*5+1,FALSE)&"|"&HLOOKUP(Sheet1!R2C1,Sheet1!R2C1:R16C1,MOD(RC1+5,2)+MOD(INT((RC1+5)/2),3)*5+1,FALSE)&"|"&HLOOKUP(Sheet1!R2C1,Sheet1!R2C1:R16C1,MOD(RC1+6,2)+MOD(INT((RC1+6)/2),3)*5+1,FALSE) -> 130|131|160|161|100 | I282: =HLOOKUP(Sheet1!R2C1,Sheet1!R2C1:R16C1,MOD(RC1-1,3)+MOD(INT((RC1-1)/3),3)*5+3,FALSE)&"|"&HLOOKUP(Sheet1!R2C1,Sheet1!R2C1:R16C1,MOD(RC1,3)+MOD(INT((RC1)/3),3)*5+3,FALSE)&"|"&HLOOKUP(Sheet1!R2C1,Sheet1!R2C1:R16C1,MOD(RC1+1,3)+MOD(INT((RC1+1)/3),3)*5+3,FALSE)&"|"&HLOOKUP(Sheet1!R2C1,Sheet1!R2C1:R16C1,MOD(RC1+2,3)+MOD(INT((RC1+2)/3),3)*5+3,FALSE)&"|"&HLOOKUP(Sheet1!R2C1,Sheet1!R2C1:R16C1,MOD(RC1+3,3)+MOD(INT((RC1+3)/3),3)*5+3,FALSE) -> 134|162|163|164|102 | J282: =HLOOKUP(Sheet1!R2C1,Sheet1!R2C1:R16C1,MOD(RC1-1,3)+MOD(INT((RC1-1)/3),3)*5+3,FALSE)&"|"&HLOOKUP(Sheet1!R2C1,Sheet1!R2C1:R16C1,MOD(RC1,3)+MOD(INT((RC1)/3),3)*5+3,FALSE)&"|"&HLOOKUP(Sheet1!R2C1,Sheet1!R2C1:R16C1,MOD(RC1+1,3)+MOD(INT((RC1+1)/3),3)*5+3,FALSE)&"|"&HLOOKUP(Sheet1!R2C1,Sheet1!R2C1:R16C1,MOD(RC1+2,3)+MOD(INT((RC1+2)/3),3)*5+3,FALSE)&"|"&HLOOKUP(Sheet1!R2C1,Sheet1!R2C1:R16C1,MOD(RC1+3,3)+MOD(INT((RC1+3)/3),3)*5+3,FALSE) -> 134|162|163|164|102 | K282: =HLOOKUP(Sheet1!R2C1,Sheet1!R2C1:R16C1,MOD(RC1-1,3)+MOD(INT((RC1-1)/3),3)*5+3,FALSE)&"|"&HLOOKUP(Sheet1!R2C1,Sheet1!R2C1:R16C1,MOD(RC1,3)+MOD(INT((RC1)/3),3)*5+3,FALSE)&"|"&HLOOKUP(Sheet1!R2C1,Sheet1!R2C1:R16C1,MOD(RC1+1,3)+MOD(INT((RC1+1)/3),3)*5+3,FALSE)&"|"&HLOOKUP(Sheet1!R2C1,Sheet1!R2C1:R16C1,MOD(RC1+2,3)+MOD(INT((RC1+2)/3),3)*5+3,FALSE)&"|"&HLOOKUP(Sheet1!R2C1,Sheet1!R2C1:R16C1,MOD(RC1+3,3)+MOD(INT((RC1+3)/3),3)*5+3,FALSE) -> 134|162|163|164|102 | L282: 25|22|23|24 | M282: 2177939|2177939|2177940|2177940 | N282: 10030|10031|10032|10033 | O282: 1|1|1|1 | P282: 2500|2500|2500|2500
A283: 277 | B283: 275 | C283: 30 | D283: =R[-20]C+2 -> 46 | E283: 1000 | F283: =MOD(RC[-5]-1,3)*30+100&"|"&MOD(RC[-5]-1,3)*30+101&"|"&MOD(RC[-5]-1,3)*30+102&"|"&MOD(RC[-5]-1,3)*30+103&"|"&IF(MOD(RC[-5],4)=0,HLOOKUP(Sheet1!R2C10,Sheet1!R2C10:R7C10,MOD(RC[-5]/4-1,6)+1,FALSE),IF(MOD(RC[-5],2)=0,IF(RC[-5]>20,HLOOKUP(Sheet1!R2C7,Sheet1!R2C7:R43C7,MOD(RC[-5]/2-1,42)+1,FALSE),HLOOKUP(Sheet1!R2C4,Sheet1!R2C4:R7C4,MOD(RC[-5]-1,6)+1,FALSE)),MOD(RC[-5]-1,3)*30+104)) -> 100|101|102|103|104 | G283: =HLOOKUP(Sheet1!R2C1,Sheet1!R2C1:R16C1,MOD(RC1-1,2)+MOD(INT((RC1-1)/2),3)*5+1,FALSE)&"|"&HLOOKUP(Sheet1!R2C1,Sheet1!R2C1:R16C1,MOD(RC1,2)+MOD(INT((RC1)/2),3)*5+1,FALSE)&"|"&HLOOKUP(Sheet1!R2C1,Sheet1!R2C1:R16C1,MOD(RC1+1,2)+MOD(INT((RC1+1)/2),3)*5+1,FALSE)&"|"&HLOOKUP(Sheet1!R2C1,Sheet1!R2C1:R16C1,MOD(RC1+2,2)+MOD(INT((RC1+2)/2),3)*5+1,FALSE)&"|"&HLOOKUP(Sheet1!R2C1,Sheet1!R2C1:R16C1,MOD(RC1+3,2)+MOD(INT((RC1+3)/2),3)*5+1,FALSE) -> 100|101|130|131|160 | H283: =HLOOKUP(Sheet1!R2C1,Sheet1!R2C1:R16C1,MOD(RC1+2,2)+MOD(INT((RC1+2)/2),3)*5+1,FALSE)&"|"&HLOOKUP(Sheet1!R2C1,Sheet1!R2C1:R16C1,MOD(RC1+3,2)+MOD(INT((RC1+3)/2),3)*5+1,FALSE)&"|"&HLOOKUP(Sheet1!R2C1,Sheet1!R2C1:R16C1,MOD(RC1+4,2)+MOD(INT((RC1+4)/2),3)*5+1,FALSE)&"|"&HLOOKUP(Sheet1!R2C1,Sheet1!R2C1:R16C1,MOD(RC1+5,2)+MOD(INT((RC1+5)/2),3)*5+1,FALSE)&"|"&HLOOKUP(Sheet1!R2C1,Sheet1!R2C1:R16C1,MOD(RC1+6,2)+MOD(INT((RC1+6)/2),3)*5+1,FALSE) -> 131|160|161|100|101 | I283: =HLOOKUP(Sheet1!R2C1,Sheet1!R2C1:R16C1,MOD(RC1-1,3)+MOD(INT((RC1-1)/3),3)*5+3,FALSE)&"|"&HLOOKUP(Sheet1!R2C1,Sheet1!R2C1:R16C1,MOD(RC1,3)+MOD(INT((RC1)/3),3)*5+3,FALSE)&"|"&HLOOKUP(Sheet1!R2C1,Sheet1!R2C1:R16C1,MOD(RC1+1,3)+MOD(INT((RC1+1)/3),3)*5+3,FALSE)&"|"&HLOOKUP(Sheet1!R2C1,Sheet1!R2C1:R16C1,MOD(RC1+2,3)+MOD(INT((RC1+2)/3),3)*5+3,FALSE)&"|"&HLOOKUP(Sheet1!R2C1,Sheet1!R2C1:R16C1,MOD(RC1+3,3)+MOD(INT((RC1+3)/3),3)*5+3,FALSE) -> 162|163|164|102|103 | J283: =HLOOKUP(Sheet1!R2C1,Sheet1!R2C1:R16C1,MOD(RC1-1,3)+MOD(INT((RC1-1)/3),3)*5+3,FALSE)&"|"&HLOOKUP(Sheet1!R2C1,Sheet1!R2C1:R16C1,MOD(RC1,3)+MOD(INT((RC1)/3),3)*5+3,FALSE)&"|"&HLOOKUP(Sheet1!R2C1,Sheet1!R2C1:R16C1,MOD(RC1+1,3)+MOD(INT((RC1+1)/3),3)*5+3,FALSE)&"|"&HLOOKUP(Sheet1!R2C1,Sheet1!R2C1:R16C1,MOD(RC1+2,3)+MOD(INT((RC1+2)/3),3)*5+3,FALSE)&"|"&HLOOKUP(Sheet1!R2C1,Sheet1!R2C1:R16C1,MOD(RC1+3,3)+MOD(INT((RC1+3)/3),3)*5+3,FALSE) -> 162|163|164|102|103 | K283: =HLOOKUP(Sheet1!R2C1,Sheet1!R2C1:R16C1,MOD(RC1-1,3)+MOD(INT((RC1-1)/3),3)*5+3,FALSE)&"|"&HLOOKUP(Sheet1!R2C1,Sheet1!R2C1:R16C1,MOD(RC1,3)+MOD(INT((RC1)/3),3)*5+3,FALSE)&"|"&HLOOKUP(Sheet1!R2C1,Sheet1!R2C1:R16C1,MOD(RC1+1,3)+MOD(INT((RC1+1)/3),3)*5+3,FALSE)&"|"&HLOOKUP(Sheet1!R2C1,Sheet1!R2C1:R16C1,MOD(RC1+2,3)+MOD(INT((RC1+2)/3),3)*5+3,FALSE)&"|"&HLOOKUP(Sheet1!R2C1,Sheet1!R2C1:R16C1,MOD(RC1+3,3)+MOD(INT((RC1+3)/3),3)*5+3,FALSE) -> 162|163|164|102|103 | L283: 25|22|23|24 | M283: 2197806|2197806|2197805|2197805 | N283: 10030|10031|10032|10033 | O283: 1|1|1|1 | P283: 2500|2500|2500|2500
A284: 278 | B284: 276 | C284: 30 | D284: =R[-20]C+2 -> 46 | E284: 1000 | F284: =MOD(RC[-5]-1,3)*30+100&"|"&MOD(RC[-5]-1,3)*30+101&"|"&MOD(RC[-5]-1,3)*30+102&"|"&MOD(RC[-5]-1,3)*30+103&"|"&IF(MOD(RC[-5],4)=0,HLOOKUP(Sheet1!R2C10,Sheet1!R2C10:R7C10,MOD(RC[-5]/4-1,6)+1,FALSE),IF(MOD(RC[-5],2)=0,IF(RC[-5]>20,HLOOKUP(Sheet1!R2C7,Sheet1!R2C7:R43C7,MOD(RC[-5]/2-1,42)+1,FALSE),HLOOKUP(Sheet1!R2C4,Sheet1!R2C4:R7C4,MOD(RC[-5]-1,6)+1,FALSE)),MOD(RC[-5]-1,3)*30+104)) -> 130|131|132|133|124 | G284: =HLOOKUP(Sheet1!R2C1,Sheet1!R2C1:R16C1,MOD(RC1-1,2)+MOD(INT((RC1-1)/2),3)*5+1,FALSE)&"|"&HLOOKUP(Sheet1!R2C1,Sheet1!R2C1:R16C1,MOD(RC1,2)+MOD(INT((RC1)/2),3)*5+1,FALSE)&"|"&HLOOKUP(Sheet1!R2C1,Sheet1!R2C1:R16C1,MOD(RC1+1,2)+MOD(INT((RC1+1)/2),3)*5+1,FALSE)&"|"&HLOOKUP(Sheet1!R2C1,Sheet1!R2C1:R16C1,MOD(RC1+2,2)+MOD(INT((RC1+2)/2),3)*5+1,FALSE)&"|"&HLOOKUP(Sheet1!R2C1,Sheet1!R2C1:R16C1,MOD(RC1+3,2)+MOD(INT((RC1+3)/2),3)*5+1,FALSE) -> 101|130|131|160|161 | H284: =HLOOKUP(Sheet1!R2C1,Sheet1!R2C1:R16C1,MOD(RC1+2,2)+MOD(INT((RC1+2)/2),3)*5+1,FALSE)&"|"&HLOOKUP(Sheet1!R2C1,Sheet1!R2C1:R16C1,MOD(RC1+3,2)+MOD(INT((RC1+3)/2),3)*5+1,FALSE)&"|"&HLOOKUP(Sheet1!R2C1,Sheet1!R2C1:R16C1,MOD(RC1+4,2)+MOD(INT((RC1+4)/2),3)*5+1,FALSE)&"|"&HLOOKUP(Sheet1!R2C1,Sheet1!R2C1:R16C1,MOD(RC1+5,2)+MOD(INT((RC1+5)/2),3)*5+1,FALSE)&"|"&HLOOKUP(Sheet1!R2C1,Sheet1!R2C1:R16C1,MOD(RC1+6,2)+MOD(INT((RC1+6)/2),3)*5+1,FALSE) -> 160|161|100|101|130 | I284: =HLOOKUP(Sheet1!R2C1,Sheet1!R2C1:R16C1,MOD(RC1-1,3)+MOD(INT((RC1-1)/3),3)*5+3,FALSE)&"|"&HLOOKUP(Sheet1!R2C1,Sheet1!R2C1:R16C1,MOD(RC1,3)+MOD(INT((RC1)/3),3)*5+3,FALSE)&"|"&HLOOKUP(Sheet1!R2C1,Sheet1!R2C1:R16C1,MOD(RC1+1,3)+MOD(INT((RC1+1)/3),3)*5+3,FALSE)&"|"&HLOOKUP(Sheet1!R2C1,Sheet1!R2C1:R16C1,MOD(RC1+2,3)+MOD(INT((RC1+2)/3),3)*5+3,FALSE)&"|"&HLOOKUP(Sheet1!R2C1,Sheet1!R2C1:R16C1,MOD(RC1+3,3)+MOD(INT((RC1+3)/3),3)*5+3,FALSE) -> 163|164|102|103|104 | J284: =HLOOKUP(Sheet1!R2C1,Sheet1!R2C1:R16C1,MOD(RC1-1,3)+MOD(INT((RC1-1)/3),3)*5+3,FALSE)&"|"&HLOOKUP(Sheet1!R2C1,Sheet1!R2C1:R16C1,MOD(RC1,3)+MOD(INT((RC1)/3),3)*5+3,FALSE)&"|"&HLOOKUP(Sheet1!R2C1,Sheet1!R2C1:R16C1,MOD(RC1+1,3)+MOD(INT((RC1+1)/3),3)*5+3,FALSE)&"|"&HLOOKUP(Sheet1!R2C1,Sheet1!R2C1:R16C1,MOD(RC1+2,3)+MOD(INT((RC1+2)/3),3)*5+3,FALSE)&"|"&HLOOKUP(Sheet1!R2C1,Sheet1!R2C1:R16C1,MOD(RC1+3,3)+MOD(INT((RC1+3)/3),3)*5+3,FALSE) -> 163|164|102|103|104 | K284: =HLOOKUP(Sheet1!R2C1,Sheet1!R2C1:R16C1,MOD(RC1-1,3)+MOD(INT((RC1-1)/3),3)*5+3,FALSE)&"|"&HLOOKUP(Sheet1!R2C1,Sheet1!R2C1:R16C1,MOD(RC1,3)+MOD(INT((RC1)/3),3)*5+3,FALSE)&"|"&HLOOKUP(Sheet1!R2C1,Sheet1!R2C1:R16C1,MOD(RC1+1,3)+MOD(INT((RC1+1)/3),3)*5+3,FALSE)&"|"&HLOOKUP(Sheet1!R2C1,Sheet1!R2C1:R16C1,MOD(RC1+2,3)+MOD(INT((RC1+2)/3),3)*5+3,FALSE)&"|"&HLOOKUP(Sheet1!R2C1,Sheet1!R2C1:R16C1,MOD(RC1+3,3)+MOD(INT((RC1+3)/3),3)*5+3,FALSE) -> 163|164|102|103|104 | L284: 25|22|23|24 | M284: 2218250|2218250|2218250|2218250 | N284: 10030|10031|10032|10033 | O284: 1|1|1|1 | P284: 2500|2500|2500|2500
A285: 279 | B285: 277 | C285: 30 | D285: =R[-20]C+2 -> 46 | E285: 1000 | F285: =MOD(RC[-5]-1,3)*30+100&"|"&MOD(RC[-5]-1,3)*30+101&"|"&MOD(RC[-5]-1,3)*30+102&"|"&MOD(RC[-5]-1,3)*30+103&"|"&IF(MOD(RC[-5],4)=0,HLOOKUP(Sheet1!R2C10,Sheet1!R2C10:R7C10,MOD(RC[-5]/4-1,6)+1,FALSE),IF(MOD(RC[-5],2)=0,IF(RC[-5]>20,HLOOKUP(Sheet1!R2C7,Sheet1!R2C7:R43C7,MOD(RC[-5]/2-1,42)+1,FALSE),HLOOKUP(Sheet1!R2C4,Sheet1!R2C4:R7C4,MOD(RC[-5]-1,6)+1,FALSE)),MOD(RC[-5]-1,3)*30+104)) -> 160|161|162|163|164 | G285: =HLOOKUP(Sheet1!R2C1,Sheet1!R2C1:R16C1,MOD(RC1-1,2)+MOD(INT((RC1-1)/2),3)*5+1,FALSE)&"|"&HLOOKUP(Sheet1!R2C1,Sheet1!R2C1:R16C1,MOD(RC1,2)+MOD(INT((RC1)/2),3)*5+1,FALSE)&"|"&HLOOKUP(Sheet1!R2C1,Sheet1!R2C1:R16C1,MOD(RC1+1,2)+MOD(INT((RC1+1)/2),3)*5+1,FALSE)&"|"&HLOOKUP(Sheet1!R2C1,Sheet1!R2C1:R16C1,MOD(RC1+2,2)+MOD(INT((RC1+2)/2),3)*5+1,FALSE)&"|"&HLOOKUP(Sheet1!R2C1,Sheet1!R2C1:R16C1,MOD(RC1+3,2)+MOD(INT((RC1+3)/2),3)*5+1,FALSE) -> 130|131|160|161|100 | H285: =HLOOKUP(Sheet1!R2C1,Sheet1!R2C1:R16C1,MOD(RC1+2,2)+MOD(INT((RC1+2)/2),3)*5+1,FALSE)&"|"&HLOOKUP(Sheet1!R2C1,Sheet1!R2C1:R16C1,MOD(RC1+3,2)+MOD(INT((RC1+3)/2),3)*5+1,FALSE)&"|"&HLOOKUP(Sheet1!R2C1,Sheet1!R2C1:R16C1,MOD(RC1+4,2)+MOD(INT((RC1+4)/2),3)*5+1,FALSE)&"|"&HLOOKUP(Sheet1!R2C1,Sheet1!R2C1:R16C1,MOD(RC1+5,2)+MOD(INT((RC1+5)/2),3)*5+1,FALSE)&"|"&HLOOKUP(Sheet1!R2C1,Sheet1!R2C1:R16C1,MOD(RC1+6,2)+MOD(INT((RC1+6)/2),3)*5+1,FALSE) -> 161|100|101|130|131 | I285: =HLOOKUP(Sheet1!R2C1,Sheet1!R2C1:R16C1,MOD(RC1-1,3)+MOD(INT((RC1-1)/3),3)*5+3,FALSE)&"|"&HLOOKUP(Sheet1!R2C1,Sheet1!R2C1:R16C1,MOD(RC1,3)+MOD(INT((RC1)/3),3)*5+3,FALSE)&"|"&HLOOKUP(Sheet1!R2C1,Sheet1!R2C1:R16C1,MOD(RC1+1,3)+MOD(INT((RC1+1)/3),3)*5+3,FALSE)&"|"&HLOOKUP(Sheet1!R2C1,Sheet1!R2C1:R16C1,MOD(RC1+2,3)+MOD(INT((RC1+2)/3),3)*5+3,FALSE)&"|"&HLOOKUP(Sheet1!R2C1,Sheet1!R2C1:R16C1,MOD(RC1+3,3)+MOD(INT((RC1+3)/3),3)*5+3,FALSE) -> 164|102|103|104|132 | J285: =HLOOKUP(Sheet1!R2C1,Sheet1!R2C1:R16C1,MOD(RC1-1,3)+MOD(INT((RC1-1)/3),3)*5+3,FALSE)&"|"&HLOOKUP(Sheet1!R2C1,Sheet1!R2C1:R16C1,MOD(RC1,3)+MOD(INT((RC1)/3),3)*5+3,FALSE)&"|"&HLOOKUP(Sheet1!R2C1,Sheet1!R2C1:R16C1,MOD(RC1+1,3)+MOD(INT((RC1+1)/3),3)*5+3,FALSE)&"|"&HLOOKUP(Sheet1!R2C1,Sheet1!R2C1:R16C1,MOD(RC1+2,3)+MOD(INT((RC1+2)/3),3)*5+3,FALSE)&"|"&HLOOKUP(Sheet1!R2C1,Sheet1!R2C1:R16C1,MOD(RC1+3,3)+MOD(INT((RC1+3)/3),3)*5+3,FALSE) -> 164|102|103|104|132 | K285: =HLOOKUP(Sheet1!R2C1,Sheet1!R2C1:R16C1,MOD(RC1-1,3)+MOD(INT((RC1-1)/3),3)*5+3,FALSE)&"|"&HLOOKUP(Sheet1!R2C1,Sheet1!R2C1:R16C1,MOD(RC1,3)+MOD(INT((RC1)/3),3)*5+3,FALSE)&"|"&HLOOKUP(Sheet1!R2C1,Sheet1!R2C1:R16C1,MOD(RC1+1,3)+MOD(INT((RC1+1)/3),3)*5+3,FALSE)&"|"&HLOOKUP(Sheet1!R2C1,Sheet1!R2C1:R16C1,MOD(RC1+2,3)+MOD(INT((RC1+2)/3),3)*5+3,FALSE)&"|"&HLOOKUP(Sheet1!R2C1,Sheet1!R2C1:R16C1,MOD(RC1+3,3)+MOD(INT((RC1+3)/3),3)*5+3,FALSE) -> 164|102|103|104|132 | L285: 25|22|23|24 | M285: 2238832|2238831|2238833|2238833 | N285: 10030|10031|10032|10033 | O285: 1|1|1|1 | P285: 2500|2500|2500|2500
A286: 280 | B286: 278 | C286: 30 | D286: =R[-20]C+2 -> 46 | E286: 1000 | F286: =MOD(RC[-5]-1,3)*30+100&"|"&MOD(RC[-5]-1,3)*30+101&"|"&MOD(RC[-5]-1,3)*30+102&"|"&MOD(RC[-5]-1,3)*30+103&"|"&IF(MOD(RC[-5],4)=0,HLOOKUP(Sheet1!R2C10,Sheet1!R2C10:R7C10,MOD(RC[-5]/4-1,6)+1,FALSE),IF(MOD(RC[-5],2)=0,IF(RC[-5]>20,HLOOKUP(Sheet1!R2C7,Sheet1!R2C7:R43C7,MOD(RC[-5]/2-1,42)+1,FALSE),HLOOKUP(Sheet1!R2C4,Sheet1!R2C4:R7C4,MOD(RC[-5]-1,6)+1,FALSE)),MOD(RC[-5]-1,3)*30+104)) -> 100|101|102|103|193 | G286: =HLOOKUP(Sheet1!R2C1,Sheet1!R2C1:R16C1,MOD(RC1-1,2)+MOD(INT((RC1-1)/2),3)*5+1,FALSE)&"|"&HLOOKUP(Sheet1!R2C1,Sheet1!R2C1:R16C1,MOD(RC1,2)+MOD(INT((RC1)/2),3)*5+1,FALSE)&"|"&HLOOKUP(Sheet1!R2C1,Sheet1!R2C1:R16C1,MOD(RC1+1,2)+MOD(INT((RC1+1)/2),3)*5+1,FALSE)&"|"&HLOOKUP(Sheet1!R2C1,Sheet1!R2C1:R16C1,MOD(RC1+2,2)+MOD(INT((RC1+2)/2),3)*5+1,FALSE)&"|"&HLOOKUP(Sheet1!R2C1,Sheet1!R2C1:R16C1,MOD(RC1+3,2)+MOD(INT((RC1+3)/2),3)*5+1,FALSE) -> 131|160|161|100|101 | H286: =HLOOKUP(Sheet1!R2C1,Sheet1!R2C1:R16C1,MOD(RC1+2,2)+MOD(INT((RC1+2)/2),3)*5+1,FALSE)&"|"&HLOOKUP(Sheet1!R2C1,Sheet1!R2C1:R16C1,MOD(RC1+3,2)+MOD(INT((RC1+3)/2),3)*5+1,FALSE)&"|"&HLOOKUP(Sheet1!R2C1,Sheet1!R2C1:R16C1,MOD(RC1+4,2)+MOD(INT((RC1+4)/2),3)*5+1,FALSE)&"|"&HLOOKUP(Sheet1!R2C1,Sheet1!R2C1:R16C1,MOD(RC1+5,2)+MOD(INT((RC1+5)/2),3)*5+1,FALSE)&"|"&HLOOKUP(Sheet1!R2C1,Sheet1!R2C1:R16C1,MOD(RC1+6,2)+MOD(INT((RC1+6)/2),3)*5+1,FALSE) -> 100|101|130|131|160 | I286: =HLOOKUP(Sheet1!R2C1,Sheet1!R2C1:R16C1,MOD(RC1-1,3)+MOD(INT((RC1-1)/3),3)*5+3,FALSE)&"|"&HLOOKUP(Sheet1!R2C1,Sheet1!R2C1:R16C1,MOD(RC1,3)+MOD(INT((RC1)/3),3)*5+3,FALSE)&"|"&HLOOKUP(Sheet1!R2C1,Sheet1!R2C1:R16C1,MOD(RC1+1,3)+MOD(INT((RC1+1)/3),3)*5+3,FALSE)&"|"&HLOOKUP(Sheet1!R2C1,Sheet1!R2C1:R16C1,MOD(RC1+2,3)+MOD(INT((RC1+2)/3),3)*5+3,FALSE)&"|"&HLOOKUP(Sheet1!R2C1,Sheet1!R2C1:R16C1,MOD(RC1+3,3)+MOD(INT((RC1+3)/3),3)*5+3,FALSE) -> 102|103|104|132|133 | J286: =HLOOKUP(Sheet1!R2C1,Sheet1!R2C1:R16C1,MOD(RC1-1,3)+MOD(INT((RC1-1)/3),3)*5+3,FALSE)&"|"&HLOOKUP(Sheet1!R2C1,Sheet1!R2C1:R16C1,MOD(RC1,3)+MOD(INT((RC1)/3),3)*5+3,FALSE)&"|"&HLOOKUP(Sheet1!R2C1,Sheet1!R2C1:R16C1,MOD(RC1+1,3)+MOD(INT((RC1+1)/3),3)*5+3,FALSE)&"|"&HLOOKUP(Sheet1!R2C1,Sheet1!R2C1:R16C1,MOD(RC1+2,3)+MOD(INT((RC1+2)/3),3)*5+3,FALSE)&"|"&HLOOKUP(Sheet1!R2C1,Sheet1!R2C1:R16C1,MOD(RC1+3,3)+MOD(INT((RC1+3)/3),3)*5+3,FALSE) -> 102|103|104|132|133 | K286: =HLOOKUP(Sheet1!R2C1,Sheet1!R2C1:R16C1,MOD(RC1-1,3)+MOD(INT((RC1-1)/3),3)*5+3,FALSE)&"|"&HLOOKUP(Sheet1!R2C1,Sheet1!R2C1:R16C1,MOD(RC1,3)+MOD(INT((RC1)/3),3)*5+3,FALSE)&"|"&HLOOKUP(Sheet1!R2C1,Sheet1!R2C1:R16C1,MOD(RC1+1,3)+MOD(INT((RC1+1)/3),3)*5+3,FALSE)&"|"&HLOOKUP(Sheet1!R2C1,Sheet1!R2C1:R16C1,MOD(RC1+2,3)+MOD(INT((RC1+2)/3),3)*5+3,FALSE)&"|"&HLOOKUP(Sheet1!R2C1,Sheet1!R2C1:R16C1,MOD(RC1+3,3)+MOD(INT((RC1+3)/3),3)*5+3,FALSE) -> 102|103|104|132|133 | L286: 25|22|23|24 | M286: 2258621|2258621|2258623|2258623 | N286: 10030|10031|10032|10033|10030|10031|10032|10033|10030|10031|10032|10033|10030|10031|10032|10033|10030|10031|10032|10033|10030|10031|10032|10033|10030|10031|10032|10033|10030|10031|10032|10033|10030|10031|10032|10033|10030|10031|10032|10033 | O286: 1|1|1|1|1|1|1|1|1|1|1|1|1|1|1|1|1|1|1|1|1|1|1|1|1|1|1|1|1|1|1|1|1|1|1|1|1|1|1|1 | P286: 2500|2500|2500|2500|2500|2500|2500|2500|2500|2500|2500|2500|2500|2500|2500|2500|2500|2500|2500|2500|2500|2500|2500|2500|2500|2500|2500|2500|2500|2500|2500|2500|2500|2500|2500|2500|2500|2500|2500|2500
A287: 281 | B287: 279 | C287: 30 | D287: =R[-20]C+2 -> 48 | E287: 1000 | F287: =MOD(RC[-5]-1,3)*30+100&"|"&MOD(RC[-5]-1,3)*30+101&"|"&MOD(RC[-5]-1,3)*30+102&"|"&MOD(RC[-5]-1,3)*30+103&"|"&IF(MOD(RC[-5],4)=0,HLOOKUP(Sheet1!R2C10,Sheet1!R2C10:R7C10,MOD(RC[-5]/4-1,6)+1,FALSE),IF(MOD(RC[-5],2)=0,IF(RC[-5]>20,HLOOKUP(Sheet1!R2C7,Sheet1!R2C7:R43C7,MOD(RC[-5]/2-1,42)+1,FALSE),HLOOKUP(Sheet1!R2C4,Sheet1!R2C4:R7C4,MOD(RC[-5]-1,6)+1,FALSE)),MOD(RC[-5]-1,3)*30+104)) -> 130|131|132|133|134 | G287: =HLOOKUP(Sheet1!R2C1,Sheet1!R2C1:R16C1,MOD(RC1-1,2)+MOD(INT((RC1-1)/2),3)*5+1,FALSE)&"|"&HLOOKUP(Sheet1!R2C1,Sheet1!R2C1:R16C1,MOD(RC1,2)+MOD(INT((RC1)/2),3)*5+1,FALSE)&"|"&HLOOKUP(Sheet1!R2C1,Sheet1!R2C1:R16C1,MOD(RC1+1,2)+MOD(INT((RC1+1)/2),3)*5+1,FALSE)&"|"&HLOOKUP(Sheet1!R2C1,Sheet1!R2C1:R16C1,MOD(RC1+2,2)+MOD(INT((RC1+2)/2),3)*5+1,FALSE)&"|"&HLOOKUP(Sheet1!R2C1,Sheet1!R2C1:R16C1,MOD(RC1+3,2)+MOD(INT((RC1+3)/2),3)*5+1,FALSE) -> 160|161|100|101|130 | H287: =HLOOKUP(Sheet1!R2C1,Sheet1!R2C1:R16C1,MOD(RC1+2,2)+MOD(INT((RC1+2)/2),3)*5+1,FALSE)&"|"&HLOOKUP(Sheet1!R2C1,Sheet1!R2C1:R16C1,MOD(RC1+3,2)+MOD(INT((RC1+3)/2),3)*5+1,FALSE)&"|"&HLOOKUP(Sheet1!R2C1,Sheet1!R2C1:R16C1,MOD(RC1+4,2)+MOD(INT((RC1+4)/2),3)*5+1,FALSE)&"|"&HLOOKUP(Sheet1!R2C1,Sheet1!R2C1:R16C1,MOD(RC1+5,2)+MOD(INT((RC1+5)/2),3)*5+1,FALSE)&"|"&HLOOKUP(Sheet1!R2C1,Sheet1!R2C1:R16C1,MOD(RC1+6,2)+MOD(INT((RC1+6)/2),3)*5+1,FALSE) -> 101|130|131|160|161 | I287: =HLOOKUP(Sheet1!R2C1,Sheet1!R2C1:R16C1,MOD(RC1-1,3)+MOD(INT((RC1-1)/3),3)*5+3,FALSE)&"|"&HLOOKUP(Sheet1!R2C1,Sheet1!R2C1:R16C1,MOD(RC1,3)+MOD(INT((RC1)/3),3)*5+3,FALSE)&"|"&HLOOKUP(Sheet1!R2C1,Sheet1!R2C1:R16C1,MOD(RC1+1,3)+MOD(INT((RC1+1)/3),3)*5+3,FALSE)&"|"&HLOOKUP(Sheet1!R2C1,Sheet1!R2C1:R16C1,MOD(RC1+2,3)+MOD(INT((RC1+2)/3),3)*5+3,FALSE)&"|"&HLOOKUP(Sheet1!R2C1,Sheet1!R2C1:R16C1,MOD(RC1+3,3)+MOD(INT((RC1+3)/3),3)*5+3,FALSE) -> 103|104|132|133|134 | J287: =HLOOKUP(Sheet1!R2C1,Sheet1!R2C1:R16C1,MOD(RC1-1,3)+MOD(INT((RC1-1)/3),3)*5+3,FALSE)&"|"&HLOOKUP(Sheet1!R2C1,Sheet1!R2C1:R16C1,MOD(RC1,3)+MOD(INT((RC1)/3),3)*5+3,FALSE)&"|"&HLOOKUP(Sheet1!R2C1,Sheet1!R2C1:R16C1,MOD(RC1+1,3)+MOD(INT((RC1+1)/3),3)*5+3,FALSE)&"|"&HLOOKUP(Sheet1!R2C1,Sheet1!R2C1:R16C1,MOD(RC1+2,3)+MOD(INT((RC1+2)/3),3)*5+3,FALSE)&"|"&HLOOKUP(Sheet1!R2C1,Sheet1!R2C1:R16C1,MOD(RC1+3,3)+MOD(INT((RC1+3)/3),3)*5+3,FALSE) -> 103|104|132|133|134 | K287: =HLOOKUP(Sheet1!R2C1,Sheet1!R2C1:R16C1,MOD(RC1-1,3)+MOD(INT((RC1-1)/3),3)*5+3,FALSE)&"|"&HLOOKUP(Sheet1!R2C1,Sheet1!R2C1:R16C1,MOD(RC1,3)+MOD(INT((RC1)/3),3)*5+3,FALSE)&"|"&HLOOKUP(Sheet1!R2C1,Sheet1!R2C1:R16C1,MOD(RC1+1,3)+MOD(INT((RC1+1)/3),3)*5+3,FALSE)&"|"&HLOOKUP(Sheet1!R2C1,Sheet1!R2C1:R16C1,MOD(RC1+2,3)+MOD(INT((RC1+2)/3),3)*5+3,FALSE)&"|"&HLOOKUP(Sheet1!R2C1,Sheet1!R2C1:R16C1,MOD(RC1+3,3)+MOD(INT((RC1+3)/3),3)*5+3,FALSE) -> 103|104|132|133|134 | L287: 25|22|23|24 | M287: 2279203|2279203|2279203|2279203 | N287: 10030|10031|10032|10033 | O287: 1|1|1|1 | P287: 2500|2500|2500|2500
A288: 282 | B288: 280 | C288: 30 | D288: =R[-20]C+2 -> 48 | E288: 1000 | F288: =MOD(RC[-5]-1,3)*30+100&"|"&MOD(RC[-5]-1,3)*30+101&"|"&MOD(RC[-5]-1,3)*30+102&"|"&MOD(RC[-5]-1,3)*30+103&"|"&IF(MOD(RC[-5],4)=0,HLOOKUP(Sheet1!R2C10,Sheet1!R2C10:R7C10,MOD(RC[-5]/4-1,6)+1,FALSE),IF(MOD(RC[-5],2)=0,IF(RC[-5]>20,HLOOKUP(Sheet1!R2C7,Sheet1!R2C7:R43C7,MOD(RC[-5]/2-1,42)+1,FALSE),HLOOKUP(Sheet1!R2C4,Sheet1!R2C4:R7C4,MOD(RC[-5]-1,6)+1,FALSE)),MOD(RC[-5]-1,3)*30+104)) -> 160|161|162|163|142 | G288: =HLOOKUP(Sheet1!R2C1,Sheet1!R2C1:R16C1,MOD(RC1-1,2)+MOD(INT((RC1-1)/2),3)*5+1,FALSE)&"|"&HLOOKUP(Sheet1!R2C1,Sheet1!R2C1:R16C1,MOD(RC1,2)+MOD(INT((RC1)/2),3)*5+1,FALSE)&"|"&HLOOKUP(Sheet1!R2C1,Sheet1!R2C1:R16C1,MOD(RC1+1,2)+MOD(INT((RC1+1)/2),3)*5+1,FALSE)&"|"&HLOOKUP(Sheet1!R2C1,Sheet1!R2C1:R16C1,MOD(RC1+2,2)+MOD(INT((RC1+2)/2),3)*5+1,FALSE)&"|"&HLOOKUP(Sheet1!R2C1,Sheet1!R2C1:R16C1,MOD(RC1+3,2)+MOD(INT((RC1+3)/2),3)*5+1,FALSE) -> 161|100|101|130|131 | H288: =HLOOKUP(Sheet1!R2C1,Sheet1!R2C1:R16C1,MOD(RC1+2,2)+MOD(INT((RC1+2)/2),3)*5+1,FALSE)&"|"&HLOOKUP(Sheet1!R2C1,Sheet1!R2C1:R16C1,MOD(RC1+3,2)+MOD(INT((RC1+3)/2),3)*5+1,FALSE)&"|"&HLOOKUP(Sheet1!R2C1,Sheet1!R2C1:R16C1,MOD(RC1+4,2)+MOD(INT((RC1+4)/2),3)*5+1,FALSE)&"|"&HLOOKUP(Sheet1!R2C1,Sheet1!R2C1:R16C1,MOD(RC1+5,2)+MOD(INT((RC1+5)/2),3)*5+1,FALSE)&"|"&HLOOKUP(Sheet1!R2C1,Sheet1!R2C1:R16C1,MOD(RC1+6,2)+MOD(INT((RC1+6)/2),3)*5+1,FALSE) -> 130|131|160|161|100 | I288: =HLOOKUP(Sheet1!R2C1,Sheet1!R2C1:R16C1,MOD(RC1-1,3)+MOD(INT((RC1-1)/3),3)*5+3,FALSE)&"|"&HLOOKUP(Sheet1!R2C1,Sheet1!R2C1:R16C1,MOD(RC1,3)+MOD(INT((RC1)/3),3)*5+3,FALSE)&"|"&HLOOKUP(Sheet1!R2C1,Sheet1!R2C1:R16C1,MOD(RC1+1,3)+MOD(INT((RC1+1)/3),3)*5+3,FALSE)&"|"&HLOOKUP(Sheet1!R2C1,Sheet1!R2C1:R16C1,MOD(RC1+2,3)+MOD(INT((RC1+2)/3),3)*5+3,FALSE)&"|"&HLOOKUP(Sheet1!R2C1,Sheet1!R2C1:R16C1,MOD(RC1+3,3)+MOD(INT((RC1+3)/3),3)*5+3,FALSE) -> 104|132|133|134|162 | J288: =HLOOKUP(Sheet1!R2C1,Sheet1!R2C1:R16C1,MOD(RC1-1,3)+MOD(INT((RC1-1)/3),3)*5+3,FALSE)&"|"&HLOOKUP(Sheet1!R2C1,Sheet1!R2C1:R16C1,MOD(RC1,3)+MOD(INT((RC1)/3),3)*5+3,FALSE)&"|"&HLOOKUP(Sheet1!R2C1,Sheet1!R2C1:R16C1,MOD(RC1+1,3)+MOD(INT((RC1+1)/3),3)*5+3,FALSE)&"|"&HLOOKUP(Sheet1!R2C1,Sheet1!R2C1:R16C1,MOD(RC1+2,3)+MOD(INT((RC1+2)/3),3)*5+3,FALSE)&"|"&HLOOKUP(Sheet1!R2C1,Sheet1!R2C1:R16C1,MOD(RC1+3,3)+MOD(INT((RC1+3)/3),3)*5+3,FALSE) -> 104|132|133|134|162 | K288: =HLOOKUP(Sheet1!R2C1,Sheet1!R2C1:R16C1,MOD(RC1-1,3)+MOD(INT((RC1-1)/3),3)*5+3,FALSE)&"|"&HLOOKUP(Sheet1!R2C1,Sheet1!R2C1:R16C1,MOD(RC1,3)+MOD(INT((RC1)/3),3)*5+3,FALSE)&"|"&HLOOKUP(Sheet1!R2C1,Sheet1!R2C1:R16C1,MOD(RC1+1,3)+MOD(INT((RC1+1)/3),3)*5+3,FALSE)&"|"&HLOOKUP(Sheet1!R2C1,Sheet1!R2C1:R16C1,MOD(RC1+2,3)+MOD(INT((RC1+2)/3),3)*5+3,FALSE)&"|"&HLOOKUP(Sheet1!R2C1,Sheet1!R2C1:R16C1,MOD(RC1+3,3)+MOD(INT((RC1+3)/3),3)*5+3,FALSE) -> 104|132|133|134|162 | L288: 25|22|23|24 | M288: 2300467|2300466|2300468|2300468 | N288: 10030|10031|10032|10033 | O288: 1|1|1|1 | P288: 2500|2500|2500|2500
A289: 283 | B289: 281 | C289: 30 | D289: =R[-20]C+2 -> 48 | E289: 1000 | F289: =MOD(RC[-5]-1,3)*30+100&"|"&MOD(RC[-5]-1,3)*30+101&"|"&MOD(RC[-5]-1,3)*30+102&"|"&MOD(RC[-5]-1,3)*30+103&"|"&IF(MOD(RC[-5],4)=0,HLOOKUP(Sheet1!R2C10,Sheet1!R2C10:R7C10,MOD(RC[-5]/4-1,6)+1,FALSE),IF(MOD(RC[-5],2)=0,IF(RC[-5]>20,HLOOKUP(Sheet1!R2C7,Sheet1!R2C7:R43C7,MOD(RC[-5]/2-1,42)+1,FALSE),HLOOKUP(Sheet1!R2C4,Sheet1!R2C4:R7C4,MOD(RC[-5]-1,6)+1,FALSE)),MOD(RC[-5]-1,3)*30+104)) -> 100|101|102|103|104 | G289: =HLOOKUP(Sheet1!R2C1,Sheet1!R2C1:R16C1,MOD(RC1-1,2)+MOD(INT((RC1-1)/2),3)*5+1,FALSE)&"|"&HLOOKUP(Sheet1!R2C1,Sheet1!R2C1:R16C1,MOD(RC1,2)+MOD(INT((RC1)/2),3)*5+1,FALSE)&"|"&HLOOKUP(Sheet1!R2C1,Sheet1!R2C1:R16C1,MOD(RC1+1,2)+MOD(INT((RC1+1)/2),3)*5+1,FALSE)&"|"&HLOOKUP(Sheet1!R2C1,Sheet1!R2C1:R16C1,MOD(RC1+2,2)+MOD(INT((RC1+2)/2),3)*5+1,FALSE)&"|"&HLOOKUP(Sheet1!R2C1,Sheet1!R2C1:R16C1,MOD(RC1+3,2)+MOD(INT((RC1+3)/2),3)*5+1,FALSE) -> 100|101|130|131|160 | H289: =HLOOKUP(Sheet1!R2C1,Sheet1!R2C1:R16C1,MOD(RC1+2,2)+MOD(INT((RC1+2)/2),3)*5+1,FALSE)&"|"&HLOOKUP(Sheet1!R2C1,Sheet1!R2C1:R16C1,MOD(RC1+3,2)+MOD(INT((RC1+3)/2),3)*5+1,FALSE)&"|"&HLOOKUP(Sheet1!R2C1,Sheet1!R2C1:R16C1,MOD(RC1+4,2)+MOD(INT((RC1+4)/2),3)*5+1,FALSE)&"|"&HLOOKUP(Sheet1!R2C1,Sheet1!R2C1:R16C1,MOD(RC1+5,2)+MOD(INT((RC1+5)/2),3)*5+1,FALSE)&"|"&HLOOKUP(Sheet1!R2C1,Sheet1!R2C1:R16C1,MOD(RC1+6,2)+MOD(INT((RC1+6)/2),3)*5+1,FALSE) -> 131|160|161|100|101 | I289: =HLOOKUP(Sheet1!R2C1,Sheet1!R2C1:R16C1,MOD(RC1-1,3)+MOD(INT((RC1-1)/3),3)*5+3,FALSE)&"|"&HLOOKUP(Sheet1!R2C1,Sheet1!R2C1:R16C1,MOD(RC1,3)+MOD(INT((RC1)/3),3)*5+3,FALSE)&"|"&HLOOKUP(Sheet1!R2C1,Sheet1!R2C1:R16C1,MOD(RC1+1,3)+MOD(INT((RC1+1)/3),3)*5+3,FALSE)&"|"&HLOOKUP(Sheet1!R2C1,Sheet1!R2C1:R16C1,MOD(RC1+2,3)+MOD(INT((RC1+2)/3),3)*5+3,FALSE)&"|"&HLOOKUP(Sheet1!R2C1,Sheet1!R2C1:R16C1,MOD(RC1+3,3)+MOD(INT((RC1+3)/3),3)*5+3,FALSE) -> 132|133|134|162|163 | J289: =HLOOKUP(Sheet1!R2C1,Sheet1!R2C1:R16C1,MOD(RC1-1,3)+MOD(INT((RC1-1)/3),3)*5+3,FALSE)&"|"&HLOOKUP(Sheet1!R2C1,Sheet1!R2C1:R16C1,MOD(RC1,3)+MOD(INT((RC1)/3),3)*5+3,FALSE)&"|"&HLOOKUP(Sheet1!R2C1,Sheet1!R2C1:R16C1,MOD(RC1+1,3)+MOD(INT((RC1+1)/3),3)*5+3,FALSE)&"|"&HLOOKUP(Sheet1!R2C1,Sheet1!R2C1:R16C1,MOD(RC1+2,3)+MOD(INT((RC1+2)/3),3)*5+3,FALSE)&"|"&HLOOKUP(Sheet1!R2C1,Sheet1!R2C1:R16C1,MOD(RC1+3,3)+MOD(INT((RC1+3)/3),3)*5+3,FALSE) -> 132|133|134|162|163 | K289: =HLOOKUP(Sheet1!R2C1,Sheet1!R2C1:R16C1,MOD(RC1-1,3)+MOD(INT((RC1-1)/3),3)*5+3,FALSE)&"|"&HLOOKUP(Sheet1!R2C1,Sheet1!R2C1:R16C1,MOD(RC1,3)+MOD(INT((RC1)/3),3)*5+3,FALSE)&"|"&HLOOKUP(Sheet1!R2C1,Sheet1!R2C1:R16C1,MOD(RC1+1,3)+MOD(INT((RC1+1)/3),3)*5+3,FALSE)&"|"&HLOOKUP(Sheet1!R2C1,Sheet1!R2C1:R16C1,MOD(RC1+2,3)+MOD(INT((RC1+2)/3),3)*5+3,FALSE)&"|"&HLOOKUP(Sheet1!R2C1,Sheet1!R2C1:R16C1,MOD(RC1+3,3)+MOD(INT((RC1+3)/3),3)*5+3,FALSE) -> 132|133|134|162|163 | L289: 25|22|23|24 | M289: 2321787|2321788|2321788|2321788 | N289: 10030|10031|10032|10033 | O289: 1|1|1|1 | P289: 2500|2500|2500|2500
A290: 284 | B290: 282 | C290: 30 | D290: =R[-20]C+2 -> 48 | E290: 1000 | F290: =MOD(RC[-5]-1,3)*30+100&"|"&MOD(RC[-5]-1,3)*30+101&"|"&MOD(RC[-5]-1,3)*30+102&"|"&MOD(RC[-5]-1,3)*30+103&"|"&IF(MOD(RC[-5],4)=0,HLOOKUP(Sheet1!R2C10,Sheet1!R2C10:R7C10,MOD(RC[-5]/4-1,6)+1,FALSE),IF(MOD(RC[-5],2)=0,IF(RC[-5]>20,HLOOKUP(Sheet1!R2C7,Sheet1!R2C7:R43C7,MOD(RC[-5]/2-1,42)+1,FALSE),HLOOKUP(Sheet1!R2C4,Sheet1!R2C4:R7C4,MOD(RC[-5]-1,6)+1,FALSE)),MOD(RC[-5]-1,3)*30+104)) -> 130|131|132|133|194 | G290: =HLOOKUP(Sheet1!R2C1,Sheet1!R2C1:R16C1,MOD(RC1-1,2)+MOD(INT((RC1-1)/2),3)*5+1,FALSE)&"|"&HLOOKUP(Sheet1!R2C1,Sheet1!R2C1:R16C1,MOD(RC1,2)+MOD(INT((RC1)/2),3)*5+1,FALSE)&"|"&HLOOKUP(Sheet1!R2C1,Sheet1!R2C1:R16C1,MOD(RC1+1,2)+MOD(INT((RC1+1)/2),3)*5+1,FALSE)&"|"&HLOOKUP(Sheet1!R2C1,Sheet1!R2C1:R16C1,MOD(RC1+2,2)+MOD(INT((RC1+2)/2),3)*5+1,FALSE)&"|"&HLOOKUP(Sheet1!R2C1,Sheet1!R2C1:R16C1,MOD(RC1+3,2)+MOD(INT((RC1+3)/2),3)*5+1,FALSE) -> 101|130|131|160|161 | H290: =HLOOKUP(Sheet1!R2C1,Sheet1!R2C1:R16C1,MOD(RC1+2,2)+MOD(INT((RC1+2)/2),3)*5+1,FALSE)&"|"&HLOOKUP(Sheet1!R2C1,Sheet1!R2C1:R16C1,MOD(RC1+3,2)+MOD(INT((RC1+3)/2),3)*5+1,FALSE)&"|"&HLOOKUP(Sheet1!R2C1,Sheet1!R2C1:R16C1,MOD(RC1+4,2)+MOD(INT((RC1+4)/2),3)*5+1,FALSE)&"|"&HLOOKUP(Sheet1!R2C1,Sheet1!R2C1:R16C1,MOD(RC1+5,2)+MOD(INT((RC1+5)/2),3)*5+1,FALSE)&"|"&HLOOKUP(Sheet1!R2C1,Sheet1!R2C1:R16C1,MOD(RC1+6,2)+MOD(INT((RC1+6)/2),3)*5+1,FALSE) -> 160|161|100|101|130 | I290: =HLOOKUP(Sheet1!R2C1,Sheet1!R2C1:R16C1,MOD(RC1-1,3)+MOD(INT((RC1-1)/3),3)*5+3,FALSE)&"|"&HLOOKUP(Sheet1!R2C1,Sheet1!R2C1:R16C1,MOD(RC1,3)+MOD(INT((RC1)/3),3)*5+3,FALSE)&"|"&HLOOKUP(Sheet1!R2C1,Sheet1!R2C1:R16C1,MOD(RC1+1,3)+MOD(INT((RC1+1)/3),3)*5+3,FALSE)&"|"&HLOOKUP(Sheet1!R2C1,Sheet1!R2C1:R16C1,MOD(RC1+2,3)+MOD(INT((RC1+2)/3),3)*5+3,FALSE)&"|"&HLOOKUP(Sheet1!R2C1,Sheet1!R2C1:R16C1,MOD(RC1+3,3)+MOD(INT((RC1+3)/3),3)*5+3,FALSE) -> 133|134|162|163|164 | J290: =HLOOKUP(Sheet1!R2C1,Sheet1!R2C1:R16C1,MOD(RC1-1,3)+MOD(INT((RC1-1)/3),3)*5+3,FALSE)&"|"&HLOOKUP(Sheet1!R2C1,Sheet1!R2C1:R16C1,MOD(RC1,3)+MOD(INT((RC1)/3),3)*5+3,FALSE)&"|"&HLOOKUP(Sheet1!R2C1,Sheet1!R2C1:R16C1,MOD(RC1+1,3)+MOD(INT((RC1+1)/3),3)*5+3,FALSE)&"|"&HLOOKUP(Sheet1!R2C1,Sheet1!R2C1:R16C1,MOD(RC1+2,3)+MOD(INT((RC1+2)/3),3)*5+3,FALSE)&"|"&HLOOKUP(Sheet1!R2C1,Sheet1!R2C1:R16C1,MOD(RC1+3,3)+MOD(INT((RC1+3)/3),3)*5+3,FALSE) -> 133|134|162|163|164 | K290: =HLOOKUP(Sheet1!R2C1,Sheet1!R2C1:R16C1,MOD(RC1-1,3)+MOD(INT((RC1-1)/3),3)*5+3,FALSE)&"|"&HLOOKUP(Sheet1!R2C1,Sheet1!R2C1:R16C1,MOD(RC1,3)+MOD(INT((RC1)/3),3)*5+3,FALSE)&"|"&HLOOKUP(Sheet1!R2C1,Sheet1!R2C1:R16C1,MOD(RC1+1,3)+MOD(INT((RC1+1)/3),3)*5+3,FALSE)&"|"&HLOOKUP(Sheet1!R2C1,Sheet1!R2C1:R16C1,MOD(RC1+2,3)+MOD(INT((RC1+2)/3),3)*5+3,FALSE)&"|"&HLOOKUP(Sheet1!R2C1,Sheet1!R2C1:R16C1,MOD(RC1+3,3)+MOD(INT((RC1+3)/3),3)*5+3,FALSE) -> 133|134|162|163|164 | L290: 25|22|23|24 | M290: 2343108|2343108|2343108|2343108 | N290: 10030|10031|10032|10033 | O290: 1|1|1|1 | P290: 2500|2500|2500|2500
A291: 285 | B291: 283 | C291: 30 | D291: =R[-20]C+2 -> 48 | E291: 1000 | F291: =MOD(RC[-5]-1,3)*30+100&"|"&MOD(RC[-5]-1,3)*30+101&"|"&MOD(RC[-5]-1,3)*30+102&"|"&MOD(RC[-5]-1,3)*30+103&"|"&IF(MOD(RC[-5],4)=0,HLOOKUP(Sheet1!R2C10,Sheet1!R2C10:R7C10,MOD(RC[-5]/4-1,6)+1,FALSE),IF(MOD(RC[-5],2)=0,IF(RC[-5]>20,HLOOKUP(Sheet1!R2C7,Sheet1!R2C7:R43C7,MOD(RC[-5]/2-1,42)+1,FALSE),HLOOKUP(Sheet1!R2C4,Sheet1!R2C4:R7C4,MOD(RC[-5]-1,6)+1,FALSE)),MOD(RC[-5]-1,3)*30+104)) -> 160|161|162|163|164 | G291: =HLOOKUP(Sheet1!R2C1,Sheet1!R2C1:R16C1,MOD(RC1-1,2)+MOD(INT((RC1-1)/2),3)*5+1,FALSE)&"|"&HLOOKUP(Sheet1!R2C1,Sheet1!R2C1:R16C1,MOD(RC1,2)+MOD(INT((RC1)/2),3)*5+1,FALSE)&"|"&HLOOKUP(Sheet1!R2C1,Sheet1!R2C1:R16C1,MOD(RC1+1,2)+MOD(INT((RC1+1)/2),3)*5+1,FALSE)&"|"&HLOOKUP(Sheet1!R2C1,Sheet1!R2C1:R16C1,MOD(RC1+2,2)+MOD(INT((RC1+2)/2),3)*5+1,FALSE)&"|"&HLOOKUP(Sheet1!R2C1,Sheet1!R2C1:R16C1,MOD(RC1+3,2)+MOD(INT((RC1+3)/2),3)*5+1,FALSE) -> 130|131|160|161|100 | H291: =HLOOKUP(Sheet1!R2C1,Sheet1!R2C1:R16C1,MOD(RC1+2,2)+MOD(INT((RC1+2)/2),3)*5+1,FALSE)&"|"&HLOOKUP(Sheet1!R2C1,Sheet1!R2C1:R16C1,MOD(RC1+3,2)+MOD(INT((RC1+3)/2),3)*5+1,FALSE)&"|"&HLOOKUP(Sheet1!R2C1,Sheet1!R2C1:R16C1,MOD(RC1+4,2)+MOD(INT((RC1+4)/2),3)*5+1,FALSE)&"|"&HLOOKUP(Sheet1!R2C1,Sheet1!R2C1:R16C1,MOD(RC1+5,2)+MOD(INT((RC1+5)/2),3)*5+1,FALSE)&"|"&HLOOKUP(Sheet1!R2C1,Sheet1!R2C1:R16C1,MOD(RC1+6,2)+MOD(INT((RC1+6)/2),3)*5+1,FALSE) -> 161|100|101|130|131 | I291: =HLOOKUP(Sheet1!R2C1,Sheet1!R2C1:R16C1,MOD(RC1-1,3)+MOD(INT((RC1-1)/3),3)*5+3,FALSE)&"|"&HLOOKUP(Sheet1!R2C1,Sheet1!R2C1:R16C1,MOD(RC1,3)+MOD(INT((RC1)/3),3)*5+3,FALSE)&"|"&HLOOKUP(Sheet1!R2C1,Sheet1!R2C1:R16C1,MOD(RC1+1,3)+MOD(INT((RC1+1)/3),3)*5+3,FALSE)&"|"&HLOOKUP(Sheet1!R2C1,Sheet1!R2C1:R16C1,MOD(RC1+2,3)+MOD(INT((RC1+2)/3),3)*5+3,FALSE)&"|"&HLOOKUP(Sheet1!R2C1,Sheet1!R2C1:R16C1,MOD(RC1+3,3)+MOD(INT((RC1+3)/3),3)*5+3,FALSE) -> 134|162|163|164|102 | J291: =HLOOKUP(Sheet1!R2C1,Sheet1!R2C1:R16C1,MOD(RC1-1,3)+MOD(INT((RC1-1)/3),3)*5+3,FALSE)&"|"&HLOOKUP(Sheet1!R2C1,Sheet1!R2C1:R16C1,MOD(RC1,3)+MOD(INT((RC1)/3),3)*5+3,FALSE)&"|"&HLOOKUP(Sheet1!R2C1,Sheet1!R2C1:R16C1,MOD(RC1+1,3)+MOD(INT((RC1+1)/3),3)*5+3,FALSE)&"|"&HLOOKUP(Sheet1!R2C1,Sheet1!R2C1:R16C1,MOD(RC1+2,3)+MOD(INT((RC1+2)/3),3)*5+3,FALSE)&"|"&HLOOKUP(Sheet1!R2C1,Sheet1!R2C1:R16C1,MOD(RC1+3,3)+MOD(INT((RC1+3)/3),3)*5+3,FALSE) -> 134|162|163|164|102 | K291: =HLOOKUP(Sheet1!R2C1,Sheet1!R2C1:R16C1,MOD(RC1-1,3)+MOD(INT((RC1-1)/3),3)*5+3,FALSE)&"|"&HLOOKUP(Sheet1!R2C1,Sheet1!R2C1:R16C1,MOD(RC1,3)+MOD(INT((RC1)/3),3)*5+3,FALSE)&"|"&HLOOKUP(Sheet1!R2C1,Sheet1!R2C1:R16C1,MOD(RC1+1,3)+MOD(INT((RC1+1)/3),3)*5+3,FALSE)&"|"&HLOOKUP(Sheet1!R2C1,Sheet1!R2C1:R16C1,MOD(RC1+2,3)+MOD(INT((RC1+2)/3),3)*5+3,FALSE)&"|"&HLOOKUP(Sheet1!R2C1,Sheet1!R2C1:R16C1,MOD(RC1+3,3)+MOD(INT((RC1+3)/3),3)*5+3,FALSE) -> 134|162|163|164|102 | L291: 25|22|23|24 | M291: 2364488|2364488|2364488|2364488 | N291: 10030|10031|10032|10033|10030|10031|10032|10033|10030|10031|10032|10033|10030|10031|10032|10033|10030|10031|10032|10033|10030|10031|10032|10033|10030|10031|10032|10033|10030|10031|10032|10033|10030|10031|10032|10033|10030|10031|10032|10033 | O291: 1|1|1|1|1|1|1|1|1|1|1|1|1|1|1|1|1|1|1|1|1|1|1|1|1|1|1|1|1|1|1|1|1|1|1|1|1|1|1|1 | P291: 2500|2500|2500|2500|2500|2500|2500|2500|2500|2500|2500|2500|2500|2500|2500|2500|2500|2500|2500|2500|2500|2500|2500|2500|2500|2500|2500|2500|2500|2500|2500|2500|2500|2500|2500|2500|2500|2500|2500|2500
A292: 286 | B292: 284 | C292: 30 | D292: =R[-20]C+2 -> 48 | E292: 1000 | F292: =MOD(RC[-5]-1,3)*30+100&"|"&MOD(RC[-5]-1,3)*30+101&"|"&MOD(RC[-5]-1,3)*30+102&"|"&MOD(RC[-5]-1,3)*30+103&"|"&IF(MOD(RC[-5],4)=0,HLOOKUP(Sheet1!R2C10,Sheet1!R2C10:R7C10,MOD(RC[-5]/4-1,6)+1,FALSE),IF(MOD(RC[-5],2)=0,IF(RC[-5]>20,HLOOKUP(Sheet1!R2C7,Sheet1!R2C7:R43C7,MOD(RC[-5]/2-1,42)+1,FALSE),HLOOKUP(Sheet1!R2C4,Sheet1!R2C4:R7C4,MOD(RC[-5]-1,6)+1,FALSE)),MOD(RC[-5]-1,3)*30+104)) -> 100|101|102|103|144 | G292: =HLOOKUP(Sheet1!R2C1,Sheet1!R2C1:R16C1,MOD(RC1-1,2)+MOD(INT((RC1-1)/2),3)*5+1,FALSE)&"|"&HLOOKUP(Sheet1!R2C1,Sheet1!R2C1:R16C1,MOD(RC1,2)+MOD(INT((RC1)/2),3)*5+1,FALSE)&"|"&HLOOKUP(Sheet1!R2C1,Sheet1!R2C1:R16C1,MOD(RC1+1,2)+MOD(INT((RC1+1)/2),3)*5+1,FALSE)&"|"&HLOOKUP(Sheet1!R2C1,Sheet1!R2C1:R16C1,MOD(RC1+2,2)+MOD(INT((RC1+2)/2),3)*5+1,FALSE)&"|"&HLOOKUP(Sheet1!R2C1,Sheet1!R2C1:R16C1,MOD(RC1+3,2)+MOD(INT((RC1+3)/2),3)*5+1,FALSE) -> 131|160|161|100|101 | H292: =HLOOKUP(Sheet1!R2C1,Sheet1!R2C1:R16C1,MOD(RC1+2,2)+MOD(INT((RC1+2)/2),3)*5+1,FALSE)&"|"&HLOOKUP(Sheet1!R2C1,Sheet1!R2C1:R16C1,MOD(RC1+3,2)+MOD(INT((RC1+3)/2),3)*5+1,FALSE)&"|"&HLOOKUP(Sheet1!R2C1,Sheet1!R2C1:R16C1,MOD(RC1+4,2)+MOD(INT((RC1+4)/2),3)*5+1,FALSE)&"|"&HLOOKUP(Sheet1!R2C1,Sheet1!R2C1:R16C1,MOD(RC1+5,2)+MOD(INT((RC1+5)/2),3)*5+1,FALSE)&"|"&HLOOKUP(Sheet1!R2C1,Sheet1!R2C1:R16C1,MOD(RC1+6,2)+MOD(INT((RC1+6)/2),3)*5+1,FALSE) -> 100|101|130|131|160 | I292: =HLOOKUP(Sheet1!R2C1,Sheet1!R2C1:R16C1,MOD(RC1-1,3)+MOD(INT((RC1-1)/3),3)*5+3,FALSE)&"|"&HLOOKUP(Sheet1!R2C1,Sheet1!R2C1:R16C1,MOD(RC1,3)+MOD(INT((RC1)/3),3)*5+3,FALSE)&"|"&HLOOKUP(Sheet1!R2C1,Sheet1!R2C1:R16C1,MOD(RC1+1,3)+MOD(INT((RC1+1)/3),3)*5+3,FALSE)&"|"&HLOOKUP(Sheet1!R2C1,Sheet1!R2C1:R16C1,MOD(RC1+2,3)+MOD(INT((RC1+2)/3),3)*5+3,FALSE)&"|"&HLOOKUP(Sheet1!R2C1,Sheet1!R2C1:R16C1,MOD(RC1+3,3)+MOD(INT((RC1+3)/3),3)*5+3,FALSE) -> 162|163|164|102|103 | J292: =HLOOKUP(Sheet1!R2C1,Sheet1!R2C1:R16C1,MOD(RC1-1,3)+MOD(INT((RC1-1)/3),3)*5+3,FALSE)&"|"&HLOOKUP(Sheet1!R2C1,Sheet1!R2C1:R16C1,MOD(RC1,3)+MOD(INT((RC1)/3),3)*5+3,FALSE)&"|"&HLOOKUP(Sheet1!R2C1,Sheet1!R2C1:R16C1,MOD(RC1+1,3)+MOD(INT((RC1+1)/3),3)*5+3,FALSE)&"|"&HLOOKUP(Sheet1!R2C1,Sheet1!R2C1:R16C1,MOD(RC1+2,3)+MOD(INT((RC1+2)/3),3)*5+3,FALSE)&"|"&HLOOKUP(Sheet1!R2C1,Sheet1!R2C1:R16C1,MOD(RC1+3,3)+MOD(INT((RC1+3)/3),3)*5+3,FALSE) -> 162|163|164|102|103 | K292: =HLOOKUP(Sheet1!R2C1,Sheet1!R2C1:R16C1,MOD(RC1-1,3)+MOD(INT((RC1-1)/3),3)*5+3,FALSE)&"|"&HLOOKUP(Sheet1!R2C1,Sheet1!R2C1:R16C1,MOD(RC1,3)+MOD(INT((RC1)/3),3)*5+3,FALSE)&"|"&HLOOKUP(Sheet1!R2C1,Sheet1!R2C1:R16C1,MOD(RC1+1,3)+MOD(INT((RC1+1)/3),3)*5+3,FALSE)&"|"&HLOOKUP(Sheet1!R2C1,Sheet1!R2C1:R16C1,MOD(RC1+2,3)+MOD(INT((RC1+2)/3),3)*5+3,FALSE)&"|"&HLOOKUP(Sheet1!R2C1,Sheet1!R2C1:R16C1,MOD(RC1+3,3)+MOD(INT((RC1+3)/3),3)*5+3,FALSE) -> 162|163|164|102|103 | L292: 25|22|23|24 | M292: 2386583|2386583|2386583|2386583 | N292: 10030|10031|10032|10033 | O292: 1|1|1|1 | P292: 2500|2500|2500|2500
A293: 287 | B293: 285 | C293: 30 | D293: =R[-20]C+2 -> 48 | E293: 1000 | F293: =MOD(RC[-5]-1,3)*30+100&"|"&MOD(RC[-5]-1,3)*30+101&"|"&MOD(RC[-5]-1,3)*30+102&"|"&MOD(RC[-5]-1,3)*30+103&"|"&IF(MOD(RC[-5],4)=0,HLOOKUP(Sheet1!R2C10,Sheet1!R2C10:R7C10,MOD(RC[-5]/4-1,6)+1,FALSE),IF(MOD(RC[-5],2)=0,IF(RC[-5]>20,HLOOKUP(Sheet1!R2C7,Sheet1!R2C7:R43C7,MOD(RC[-5]/2-1,42)+1,FALSE),HLOOKUP(Sheet1!R2C4,Sheet1!R2C4:R7C4,MOD(RC[-5]-1,6)+1,FALSE)),MOD(RC[-5]-1,3)*30+104)) -> 130|131|132|133|134 | G293: =HLOOKUP(Sheet1!R2C1,Sheet1!R2C1:R16C1,MOD(RC1-1,2)+MOD(INT((RC1-1)/2),3)*5+1,FALSE)&"|"&HLOOKUP(Sheet1!R2C1,Sheet1!R2C1:R16C1,MOD(RC1,2)+MOD(INT((RC1)/2),3)*5+1,FALSE)&"|"&HLOOKUP(Sheet1!R2C1,Sheet1!R2C1:R16C1,MOD(RC1+1,2)+MOD(INT((RC1+1)/2),3)*5+1,FALSE)&"|"&HLOOKUP(Sheet1!R2C1,Sheet1!R2C1:R16C1,MOD(RC1+2,2)+MOD(INT((RC1+2)/2),3)*5+1,FALSE)&"|"&HLOOKUP(Sheet1!R2C1,Sheet1!R2C1:R16C1,MOD(RC1+3,2)+MOD(INT((RC1+3)/2),3)*5+1,FALSE) -> 160|161|100|101|130 | H293: =HLOOKUP(Sheet1!R2C1,Sheet1!R2C1:R16C1,MOD(RC1+2,2)+MOD(INT((RC1+2)/2),3)*5+1,FALSE)&"|"&HLOOKUP(Sheet1!R2C1,Sheet1!R2C1:R16C1,MOD(RC1+3,2)+MOD(INT((RC1+3)/2),3)*5+1,FALSE)&"|"&HLOOKUP(Sheet1!R2C1,Sheet1!R2C1:R16C1,MOD(RC1+4,2)+MOD(INT((RC1+4)/2),3)*5+1,FALSE)&"|"&HLOOKUP(Sheet1!R2C1,Sheet1!R2C1:R16C1,MOD(RC1+5,2)+MOD(INT((RC1+5)/2),3)*5+1,FALSE)&"|"&HLOOKUP(Sheet1!R2C1,Sheet1!R2C1:R16C1,MOD(RC1+6,2)+MOD(INT((RC1+6)/2),3)*5+1,FALSE) -> 101|130|131|160|161 | I293: =HLOOKUP(Sheet1!R2C1,Sheet1!R2C1:R16C1,MOD(RC1-1,3)+MOD(INT((RC1-1)/3),3)*5+3,FALSE)&"|"&HLOOKUP(Sheet1!R2C1,Sheet1!R2C1:R16C1,MOD(RC1,3)+MOD(INT((RC1)/3),3)*5+3,FALSE)&"|"&HLOOKUP(Sheet1!R2C1,Sheet1!R2C1:R16C1,MOD(RC1+1,3)+MOD(INT((RC1+1)/3),3)*5+3,FALSE)&"|"&HLOOKUP(Sheet1!R2C1,Sheet1!R2C1:R16C1,MOD(RC1+2,3)+MOD(INT((RC1+2)/3),3)*5+3,FALSE)&"|"&HLOOKUP(Sheet1!R2C1,Sheet1!R2C1:R16C1,MOD(RC1+3,3)+MOD(INT((RC1+3)/3),3)*5+3,FALSE) -> 163|164|102|103|104 | J293: =HLOOKUP(Sheet1!R2C1,Sheet1!R2C1:R16C1,MOD(RC1-1,3)+MOD(INT((RC1-1)/3),3)*5+3,FALSE)&"|"&HLOOKUP(Sheet1!R2C1,Sheet1!R2C1:R16C1,MOD(RC1,3)+MOD(INT((RC1)/3),3)*5+3,FALSE)&"|"&HLOOKUP(Sheet1!R2C1,Sheet1!R2C1:R16C1,MOD(RC1+1,3)+MOD(INT((RC1+1)/3),3)*5+3,FALSE)&"|"&HLOOKUP(Sheet1!R2C1,Sheet1!R2C1:R16C1,MOD(RC1+2,3)+MOD(INT((RC1+2)/3),3)*5+3,FALSE)&"|"&HLOOKUP(Sheet1!R2C1,Sheet1!R2C1:R16C1,MOD(RC1+3,3)+MOD(INT((RC1+3)/3),3)*5+3,FALSE) -> 163|164|102|103|104 | K293: =HLOOKUP(Sheet1!R2C1,Sheet1!R2C1:R16C1,MOD(RC1-1,3)+MOD(INT((RC1-1)/3),3)*5+3,FALSE)&"|"&HLOOKUP(Sheet1!R2C1,Sheet1!R2C1:R16C1,MOD(RC1,3)+MOD(INT((RC1)/3),3)*5+3,FALSE)&"|"&HLOOKUP(Sheet1!R2C1,Sheet1!R2C1:R16C1,MOD(RC1+1,3)+MOD(INT((RC1+1)/3),3)*5+3,FALSE)&"|"&HLOOKUP(Sheet1!R2C1,Sheet1!R2C1:R16C1,MOD(RC1+2,3)+MOD(INT((RC1+2)/3),3)*5+3,FALSE)&"|"&HLOOKUP(Sheet1!R2C1,Sheet1!R2C1:R16C1,MOD(RC1+3,3)+MOD(INT((RC1+3)/3),3)*5+3,FALSE) -> 163|164|102|103|104 | L293: 25|22|23|24 | M293: 2407828|2407828|2407828|2407828 | N293: 10030|10031|10032|10033 | O293: 1|1|1|1 | P293: 2500|2500|2500|2500
A294: 288 | B294: 286 | C294: 30 | D294: =R[-20]C+2 -> 48 | E294: 1000 | F294: =MOD(RC[-5]-1,3)*30+100&"|"&MOD(RC[-5]-1,3)*30+101&"|"&MOD(RC[-5]-1,3)*30+102&"|"&MOD(RC[-5]-1,3)*30+103&"|"&IF(MOD(RC[-5],4)=0,HLOOKUP(Sheet1!R2C10,Sheet1!R2C10:R7C10,MOD(RC[-5]/4-1,6)+1,FALSE),IF(MOD(RC[-5],2)=0,IF(RC[-5]>20,HLOOKUP(Sheet1!R2C7,Sheet1!R2C7:R43C7,MOD(RC[-5]/2-1,42)+1,FALSE),HLOOKUP(Sheet1!R2C4,Sheet1!R2C4:R7C4,MOD(RC[-5]-1,6)+1,FALSE)),MOD(RC[-5]-1,3)*30+104)) -> 160|161|162|163|195 | G294: =HLOOKUP(Sheet1!R2C1,Sheet1!R2C1:R16C1,MOD(RC1-1,2)+MOD(INT((RC1-1)/2),3)*5+1,FALSE)&"|"&HLOOKUP(Sheet1!R2C1,Sheet1!R2C1:R16C1,MOD(RC1,2)+MOD(INT((RC1)/2),3)*5+1,FALSE)&"|"&HLOOKUP(Sheet1!R2C1,Sheet1!R2C1:R16C1,MOD(RC1+1,2)+MOD(INT((RC1+1)/2),3)*5+1,FALSE)&"|"&HLOOKUP(Sheet1!R2C1,Sheet1!R2C1:R16C1,MOD(RC1+2,2)+MOD(INT((RC1+2)/2),3)*5+1,FALSE)&"|"&HLOOKUP(Sheet1!R2C1,Sheet1!R2C1:R16C1,MOD(RC1+3,2)+MOD(INT((RC1+3)/2),3)*5+1,FALSE) -> 161|100|101|130|131 | H294: =HLOOKUP(Sheet1!R2C1,Sheet1!R2C1:R16C1,MOD(RC1+2,2)+MOD(INT((RC1+2)/2),3)*5+1,FALSE)&"|"&HLOOKUP(Sheet1!R2C1,Sheet1!R2C1:R16C1,MOD(RC1+3,2)+MOD(INT((RC1+3)/2),3)*5+1,FALSE)&"|"&HLOOKUP(Sheet1!R2C1,Sheet1!R2C1:R16C1,MOD(RC1+4,2)+MOD(INT((RC1+4)/2),3)*5+1,FALSE)&"|"&HLOOKUP(Sheet1!R2C1,Sheet1!R2C1:R16C1,MOD(RC1+5,2)+MOD(INT((RC1+5)/2),3)*5+1,FALSE)&"|"&HLOOKUP(Sheet1!R2C1,Sheet1!R2C1:R16C1,MOD(RC1+6,2)+MOD(INT((RC1+6)/2),3)*5+1,FALSE) -> 130|131|160|161|100 | I294: =HLOOKUP(Sheet1!R2C1,Sheet1!R2C1:R16C1,MOD(RC1-1,3)+MOD(INT((RC1-1)/3),3)*5+3,FALSE)&"|"&HLOOKUP(Sheet1!R2C1,Sheet1!R2C1:R16C1,MOD(RC1,3)+MOD(INT((RC1)/3),3)*5+3,FALSE)&"|"&HLOOKUP(Sheet1!R2C1,Sheet1!R2C1:R16C1,MOD(RC1+1,3)+MOD(INT((RC1+1)/3),3)*5+3,FALSE)&"|"&HLOOKUP(Sheet1!R2C1,Sheet1!R2C1:R16C1,MOD(RC1+2,3)+MOD(INT((RC1+2)/3),3)*5+3,FALSE)&"|"&HLOOKUP(Sheet1!R2C1,Sheet1!R2C1:R16C1,MOD(RC1+3,3)+MOD(INT((RC1+3)/3),3)*5+3,FALSE) -> 164|102|103|104|132 | J294: =HLOOKUP(Sheet1!R2C1,Sheet1!R2C1:R16C1,MOD(RC1-1,3)+MOD(INT((RC1-1)/3),3)*5+3,FALSE)&"|"&HLOOKUP(Sheet1!R2C1,Sheet1!R2C1:R16C1,MOD(RC1,3)+MOD(INT((RC1)/3),3)*5+3,FALSE)&"|"&HLOOKUP(Sheet1!R2C1,Sheet1!R2C1:R16C1,MOD(RC1+1,3)+MOD(INT((RC1+1)/3),3)*5+3,FALSE)&"|"&HLOOKUP(Sheet1!R2C1,Sheet1!R2C1:R16C1,MOD(RC1+2,3)+MOD(INT((RC1+2)/3),3)*5+3,FALSE)&"|"&HLOOKUP(Sheet1!R2C1,Sheet1!R2C1:R16C1,MOD(RC1+3,3)+MOD(INT((RC1+3)/3),3)*5+3,FALSE) -> 164|102|103|104|132 | K294: =HLOOKUP(Sheet1!R2C1,Sheet1!R2C1:R16C1,MOD(RC1-1,3)+MOD(INT((RC1-1)/3),3)*5+3,FALSE)&"|"&HLOOKUP(Sheet1!R2C1,Sheet1!R2C1:R16C1,MOD(RC1,3)+MOD(INT((RC1)/3),3)*5+3,FALSE)&"|"&HLOOKUP(Sheet1!R2C1,Sheet1!R2C1:R16C1,MOD(RC1+1,3)+MOD(INT((RC1+1)/3),3)*5+3,FALSE)&"|"&HLOOKUP(Sheet1!R2C1,Sheet1!R2C1:R16C1,MOD(RC1+2,3)+MOD(INT((RC1+2)/3),3)*5+3,FALSE)&"|"&HLOOKUP(Sheet1!R2C1,Sheet1!R2C1:R16C1,MOD(RC1+3,3)+MOD(INT((RC1+3)/3),3)*5+3,FALSE) -> 164|102|103|104|132 | L294: 25|22|23|24 | M294: 2429923|2429923|2429923|2429923 | N294: 10030|10031|10032|10033 | O294: 1|1|1|1 | P294: 2500|2500|2500|2500
A295: 289 | B295: 287 | C295: 30 | D295: =R[-20]C+2 -> 48 | E295: 1000 | F295: =MOD(RC[-5]-1,3)*30+100&"|"&MOD(RC[-5]-1,3)*30+101&"|"&MOD(RC[-5]-1,3)*30+102&"|"&MOD(RC[-5]-1,3)*30+103&"|"&IF(MOD(RC[-5],4)=0,HLOOKUP(Sheet1!R2C10,Sheet1!R2C10:R7C10,MOD(RC[-5]/4-1,6)+1,FALSE),IF(MOD(RC[-5],2)=0,IF(RC[-5]>20,HLOOKUP(Sheet1!R2C7,Sheet1!R2C7:R43C7,MOD(RC[-5]/2-1,42)+1,FALSE),HLOOKUP(Sheet1!R2C4,Sheet1!R2C4:R7C4,MOD(RC[-5]-1,6)+1,FALSE)),MOD(RC[-5]-1,3)*30+104)) -> 100|101|102|103|104 | G295: =HLOOKUP(Sheet1!R2C1,Sheet1!R2C1:R16C1,MOD(RC1-1,2)+MOD(INT((RC1-1)/2),3)*5+1,FALSE)&"|"&HLOOKUP(Sheet1!R2C1,Sheet1!R2C1:R16C1,MOD(RC1,2)+MOD(INT((RC1)/2),3)*5+1,FALSE)&"|"&HLOOKUP(Sheet1!R2C1,Sheet1!R2C1:R16C1,MOD(RC1+1,2)+MOD(INT((RC1+1)/2),3)*5+1,FALSE)&"|"&HLOOKUP(Sheet1!R2C1,Sheet1!R2C1:R16C1,MOD(RC1+2,2)+MOD(INT((RC1+2)/2),3)*5+1,FALSE)&"|"&HLOOKUP(Sheet1!R2C1,Sheet1!R2C1:R16C1,MOD(RC1+3,2)+MOD(INT((RC1+3)/2),3)*5+1,FALSE) -> 100|101|130|131|160 | H295: =HLOOKUP(Sheet1!R2C1,Sheet1!R2C1:R16C1,MOD(RC1+2,2)+MOD(INT((RC1+2)/2),3)*5+1,FALSE)&"|"&HLOOKUP(Sheet1!R2C1,Sheet1!R2C1:R16C1,MOD(RC1+3,2)+MOD(INT((RC1+3)/2),3)*5+1,FALSE)&"|"&HLOOKUP(Sheet1!R2C1,Sheet1!R2C1:R16C1,MOD(RC1+4,2)+MOD(INT((RC1+4)/2),3)*5+1,FALSE)&"|"&HLOOKUP(Sheet1!R2C1,Sheet1!R2C1:R16C1,MOD(RC1+5,2)+MOD(INT((RC1+5)/2),3)*5+1,FALSE)&"|"&HLOOKUP(Sheet1!R2C1,Sheet1!R2C1:R16C1,MOD(RC1+6,2)+MOD(INT((RC1+6)/2),3)*5+1,FALSE) -> 131|160|161|100|101 | I295: =HLOOKUP(Sheet1!R2C1,Sheet1!R2C1:R16C1,MOD(RC1-1,3)+MOD(INT((RC1-1)/3),3)*5+3,FALSE)&"|"&HLOOKUP(Sheet1!R2C1,Sheet1!R2C1:R16C1,MOD(RC1,3)+MOD(INT((RC1)/3),3)*5+3,FALSE)&"|"&HLOOKUP(Sheet1!R2C1,Sheet1!R2C1:R16C1,MOD(RC1+1,3)+MOD(INT((RC1+1)/3),3)*5+3,FALSE)&"|"&HLOOKUP(Sheet1!R2C1,Sheet1!R2C1:R16C1,MOD(RC1+2,3)+MOD(INT((RC1+2)/3),3)*5+3,FALSE)&"|"&HLOOKUP(Sheet1!R2C1,Sheet1!R2C1:R16C1,MOD(RC1+3,3)+MOD(INT((RC1+3)/3),3)*5+3,FALSE) -> 102|103|104|132|133 | J295: =HLOOKUP(Sheet1!R2C1,Sheet1!R2C1:R16C1,MOD(RC1-1,3)+MOD(INT((RC1-1)/3),3)*5+3,FALSE)&"|"&HLOOKUP(Sheet1!R2C1,Sheet1!R2C1:R16C1,MOD(RC1,3)+MOD(INT((RC1)/3),3)*5+3,FALSE)&"|"&HLOOKUP(Sheet1!R2C1,Sheet1!R2C1:R16C1,MOD(RC1+1,3)+MOD(INT((RC1+1)/3),3)*5+3,FALSE)&"|"&HLOOKUP(Sheet1!R2C1,Sheet1!R2C1:R16C1,MOD(RC1+2,3)+MOD(INT((RC1+2)/3),3)*5+3,FALSE)&"|"&HLOOKUP(Sheet1!R2C1,Sheet1!R2C1:R16C1,MOD(RC1+3,3)+MOD(INT((RC1+3)/3),3)*5+3,FALSE) -> 102|103|104|132|133 | K295: =HLOOKUP(Sheet1!R2C1,Sheet1!R2C1:R16C1,MOD(RC1-1,3)+MOD(INT((RC1-1)/3),3)*5+3,FALSE)&"|"&HLOOKUP(Sheet1!R2C1,Sheet1!R2C1:R16C1,MOD(RC1,3)+MOD(INT((RC1)/3),3)*5+3,FALSE)&"|"&HLOOKUP(Sheet1!R2C1,Sheet1!R2C1:R16C1,MOD(RC1+1,3)+MOD(INT((RC1+1)/3),3)*5+3,FALSE)&"|"&HLOOKUP(Sheet1!R2C1,Sheet1!R2C1:R16C1,MOD(RC1+2,3)+MOD(INT((RC1+2)/3),3)*5+3,FALSE)&"|"&HLOOKUP(Sheet1!R2C1,Sheet1!R2C1:R16C1,MOD(RC1+3,3)+MOD(INT((RC1+3)/3),3)*5+3,FALSE) -> 102|103|104|132|133 | L295: 25|22|23|24 | M295: 2452171|2452171|2452170|2452170 | N295: 10030|10031|10032|10033 | O295: 1|1|1|1 | P295: 2500|2500|2500|2500
A296: 290 | B296: 288 | C296: 30 | D296: =R[-20]C+2 -> 48 | E296: 1000 | F296: =MOD(RC[-5]-1,3)*30+100&"|"&MOD(RC[-5]-1,3)*30+101&"|"&MOD(RC[-5]-1,3)*30+102&"|"&MOD(RC[-5]-1,3)*30+103&"|"&IF(MOD(RC[-5],4)=0,HLOOKUP(Sheet1!R2C10,Sheet1!R2C10:R7C10,MOD(RC[-5]/4-1,6)+1,FALSE),IF(MOD(RC[-5],2)=0,IF(RC[-5]>20,HLOOKUP(Sheet1!R2C7,Sheet1!R2C7:R43C7,MOD(RC[-5]/2-1,42)+1,FALSE),HLOOKUP(Sheet1!R2C4,Sheet1!R2C4:R7C4,MOD(RC[-5]-1,6)+1,FALSE)),MOD(RC[-5]-1,3)*30+104)) -> 130|131|132|133|146 | G296: =HLOOKUP(Sheet1!R2C1,Sheet1!R2C1:R16C1,MOD(RC1-1,2)+MOD(INT((RC1-1)/2),3)*5+1,FALSE)&"|"&HLOOKUP(Sheet1!R2C1,Sheet1!R2C1:R16C1,MOD(RC1,2)+MOD(INT((RC1)/2),3)*5+1,FALSE)&"|"&HLOOKUP(Sheet1!R2C1,Sheet1!R2C1:R16C1,MOD(RC1+1,2)+MOD(INT((RC1+1)/2),3)*5+1,FALSE)&"|"&HLOOKUP(Sheet1!R2C1,Sheet1!R2C1:R16C1,MOD(RC1+2,2)+MOD(INT((RC1+2)/2),3)*5+1,FALSE)&"|"&HLOOKUP(Sheet1!R2C1,Sheet1!R2C1:R16C1,MOD(RC1+3,2)+MOD(INT((RC1+3)/2),3)*5+1,FALSE) -> 101|130|131|160|161 | H296: =HLOOKUP(Sheet1!R2C1,Sheet1!R2C1:R16C1,MOD(RC1+2,2)+MOD(INT((RC1+2)/2),3)*5+1,FALSE)&"|"&HLOOKUP(Sheet1!R2C1,Sheet1!R2C1:R16C1,MOD(RC1+3,2)+MOD(INT((RC1+3)/2),3)*5+1,FALSE)&"|"&HLOOKUP(Sheet1!R2C1,Sheet1!R2C1:R16C1,MOD(RC1+4,2)+MOD(INT((RC1+4)/2),3)*5+1,FALSE)&"|"&HLOOKUP(Sheet1!R2C1,Sheet1!R2C1:R16C1,MOD(RC1+5,2)+MOD(INT((RC1+5)/2),3)*5+1,FALSE)&"|"&HLOOKUP(Sheet1!R2C1,Sheet1!R2C1:R16C1,MOD(RC1+6,2)+MOD(INT((RC1+6)/2),3)*5+1,FALSE) -> 160|161|100|101|130 | I296: =HLOOKUP(Sheet1!R2C1,Sheet1!R2C1:R16C1,MOD(RC1-1,3)+MOD(INT((RC1-1)/3),3)*5+3,FALSE)&"|"&HLOOKUP(Sheet1!R2C1,Sheet1!R2C1:R16C1,MOD(RC1,3)+MOD(INT((RC1)/3),3)*5+3,FALSE)&"|"&HLOOKUP(Sheet1!R2C1,Sheet1!R2C1:R16C1,MOD(RC1+1,3)+MOD(INT((RC1+1)/3),3)*5+3,FALSE)&"|"&HLOOKUP(Sheet1!R2C1,Sheet1!R2C1:R16C1,MOD(RC1+2,3)+MOD(INT((RC1+2)/3),3)*5+3,FALSE)&"|"&HLOOKUP(Sheet1!R2C1,Sheet1!R2C1:R16C1,MOD(RC1+3,3)+MOD(INT((RC1+3)/3),3)*5+3,FALSE) -> 103|104|132|133|134 | J296: =HLOOKUP(Sheet1!R2C1,Sheet1!R2C1:R16C1,MOD(RC1-1,3)+MOD(INT((RC1-1)/3),3)*5+3,FALSE)&"|"&HLOOKUP(Sheet1!R2C1,Sheet1!R2C1:R16C1,MOD(RC1,3)+MOD(INT((RC1)/3),3)*5+3,FALSE)&"|"&HLOOKUP(Sheet1!R2C1,Sheet1!R2C1:R16C1,MOD(RC1+1,3)+MOD(INT((RC1+1)/3),3)*5+3,FALSE)&"|"&HLOOKUP(Sheet1!R2C1,Sheet1!R2C1:R16C1,MOD(RC1+2,3)+MOD(INT((RC1+2)/3),3)*5+3,FALSE)&"|"&HLOOKUP(Sheet1!R2C1,Sheet1!R2C1:R16C1,MOD(RC1+3,3)+MOD(INT((RC1+3)/3),3)*5+3,FALSE) -> 103|104|132|133|134 | K296: =HLOOKUP(Sheet1!R2C1,Sheet1!R2C1:R16C1,MOD(RC1-1,3)+MOD(INT((RC1-1)/3),3)*5+3,FALSE)&"|"&HLOOKUP(Sheet1!R2C1,Sheet1!R2C1:R16C1,MOD(RC1,3)+MOD(INT((RC1)/3),3)*5+3,FALSE)&"|"&HLOOKUP(Sheet1!R2C1,Sheet1!R2C1:R16C1,MOD(RC1+1,3)+MOD(INT((RC1+1)/3),3)*5+3,FALSE)&"|"&HLOOKUP(Sheet1!R2C1,Sheet1!R2C1:R16C1,MOD(RC1+2,3)+MOD(INT((RC1+2)/3),3)*5+3,FALSE)&"|"&HLOOKUP(Sheet1!R2C1,Sheet1!R2C1:R16C1,MOD(RC1+3,3)+MOD(INT((RC1+3)/3),3)*5+3,FALSE) -> 103|104|132|133|134 | L296: 25|22|23|24 | M296: 2475066|2475066|2475065|2475065 | N296: 10030|10031|10032|10033|10030|10031|10032|10033|10030|10031|10032|10033|10030|10031|10032|10033|10030|10031|10032|10033|10030|10031|10032|10033|10030|10031|10032|10033|10030|10031|10032|10033|10030|10031|10032|10033|10030|10031|10032|10033 | O296: 1|1|1|1|1|1|1|1|1|1|1|1|1|1|1|1|1|1|1|1|1|1|1|1|1|1|1|1|1|1|1|1|1|1|1|1|1|1|1|1 | P296: 2500|2500|2500|2500|2500|2500|2500|2500|2500|2500|2500|2500|2500|2500|2500|2500|2500|2500|2500|2500|2500|2500|2500|2500|2500|2500|2500|2500|2500|2500|2500|2500|2500|2500|2500|2500|2500|2500|2500|2500
A297: 291 | B297: 289 | C297: 30 | D297: =R[-20]C+2 -> 48 | E297: 1000 | F297: =MOD(RC[-5]-1,3)*30+100&"|"&MOD(RC[-5]-1,3)*30+101&"|"&MOD(RC[-5]-1,3)*30+102&"|"&MOD(RC[-5]-1,3)*30+103&"|"&IF(MOD(RC[-5],4)=0,HLOOKUP(Sheet1!R2C10,Sheet1!R2C10:R7C10,MOD(RC[-5]/4-1,6)+1,FALSE),IF(MOD(RC[-5],2)=0,IF(RC[-5]>20,HLOOKUP(Sheet1!R2C7,Sheet1!R2C7:R43C7,MOD(RC[-5]/2-1,42)+1,FALSE),HLOOKUP(Sheet1!R2C4,Sheet1!R2C4:R7C4,MOD(RC[-5]-1,6)+1,FALSE)),MOD(RC[-5]-1,3)*30+104)) -> 160|161|162|163|164 | G297: =HLOOKUP(Sheet1!R2C1,Sheet1!R2C1:R16C1,MOD(RC1-1,2)+MOD(INT((RC1-1)/2),3)*5+1,FALSE)&"|"&HLOOKUP(Sheet1!R2C1,Sheet1!R2C1:R16C1,MOD(RC1,2)+MOD(INT((RC1)/2),3)*5+1,FALSE)&"|"&HLOOKUP(Sheet1!R2C1,Sheet1!R2C1:R16C1,MOD(RC1+1,2)+MOD(INT((RC1+1)/2),3)*5+1,FALSE)&"|"&HLOOKUP(Sheet1!R2C1,Sheet1!R2C1:R16C1,MOD(RC1+2,2)+MOD(INT((RC1+2)/2),3)*5+1,FALSE)&"|"&HLOOKUP(Sheet1!R2C1,Sheet1!R2C1:R16C1,MOD(RC1+3,2)+MOD(INT((RC1+3)/2),3)*5+1,FALSE) -> 130|131|160|161|100 | H297: =HLOOKUP(Sheet1!R2C1,Sheet1!R2C1:R16C1,MOD(RC1+2,2)+MOD(INT((RC1+2)/2),3)*5+1,FALSE)&"|"&HLOOKUP(Sheet1!R2C1,Sheet1!R2C1:R16C1,MOD(RC1+3,2)+MOD(INT((RC1+3)/2),3)*5+1,FALSE)&"|"&HLOOKUP(Sheet1!R2C1,Sheet1!R2C1:R16C1,MOD(RC1+4,2)+MOD(INT((RC1+4)/2),3)*5+1,FALSE)&"|"&HLOOKUP(Sheet1!R2C1,Sheet1!R2C1:R16C1,MOD(RC1+5,2)+MOD(INT((RC1+5)/2),3)*5+1,FALSE)&"|"&HLOOKUP(Sheet1!R2C1,Sheet1!R2C1:R16C1,MOD(RC1+6,2)+MOD(INT((RC1+6)/2),3)*5+1,FALSE) -> 161|100|101|130|131 | I297: =HLOOKUP(Sheet1!R2C1,Sheet1!R2C1:R16C1,MOD(RC1-1,3)+MOD(INT((RC1-1)/3),3)*5+3,FALSE)&"|"&HLOOKUP(Sheet1!R2C1,Sheet1!R2C1:R16C1,MOD(RC1,3)+MOD(INT((RC1)/3),3)*5+3,FALSE)&"|"&HLOOKUP(Sheet1!R2C1,Sheet1!R2C1:R16C1,MOD(RC1+1,3)+MOD(INT((RC1+1)/3),3)*5+3,FALSE)&"|"&HLOOKUP(Sheet1!R2C1,Sheet1!R2C1:R16C1,MOD(RC1+2,3)+MOD(INT((RC1+2)/3),3)*5+3,FALSE)&"|"&HLOOKUP(Sheet1!R2C1,Sheet1!R2C1:R16C1,MOD(RC1+3,3)+MOD(INT((RC1+3)/3),3)*5+3,FALSE) -> 104|132|133|134|162 | J297: =HLOOKUP(Sheet1!R2C1,Sheet1!R2C1:R16C1,MOD(RC1-1,3)+MOD(INT((RC1-1)/3),3)*5+3,FALSE)&"|"&HLOOKUP(Sheet1!R2C1,Sheet1!R2C1:R16C1,MOD(RC1,3)+MOD(INT((RC1)/3),3)*5+3,FALSE)&"|"&HLOOKUP(Sheet1!R2C1,Sheet1!R2C1:R16C1,MOD(RC1+1,3)+MOD(INT((RC1+1)/3),3)*5+3,FALSE)&"|"&HLOOKUP(Sheet1!R2C1,Sheet1!R2C1:R16C1,MOD(RC1+2,3)+MOD(INT((RC1+2)/3),3)*5+3,FALSE)&"|"&HLOOKUP(Sheet1!R2C1,Sheet1!R2C1:R16C1,MOD(RC1+3,3)+MOD(INT((RC1+3)/3),3)*5+3,FALSE) -> 104|132|133|134|162 | K297: =HLOOKUP(Sheet1!R2C1,Sheet1!R2C1:R16C1,MOD(RC1-1,3)+MOD(INT((RC1-1)/3),3)*5+3,FALSE)&"|"&HLOOKUP(Sheet1!R2C1,Sheet1!R2C1:R16C1,MOD(RC1,3)+MOD(INT((RC1)/3),3)*5+3,FALSE)&"|"&HLOOKUP(Sheet1!R2C1,Sheet1!R2C1:R16C1,MOD(RC1+1,3)+MOD(INT((RC1+1)/3),3)*5+3,FALSE)&"|"&HLOOKUP(Sheet1!R2C1,Sheet1!R2C1:R16C1,MOD(RC1+2,3)+MOD(INT((RC1+2)/3),3)*5+3,FALSE)&"|"&HLOOKUP(Sheet1!R2C1,Sheet1!R2C1:R16C1,MOD(RC1+3,3)+MOD(INT((RC1+3)/3),3)*5+3,FALSE) -> 104|132|133|134|162 | L297: 25|22|23|24 | M297: 2497961|2497961|2497960|2497960 | N297: 10030|10031|10032|10033 | O297: 1|1|1|1 | P297: 2500|2500|2500|2500
A298: 292 | B298: 290 | C298: 30 | D298: =R[-20]C+2 -> 48 | E298: 1000 | F298: =MOD(RC[-5]-1,3)*30+100&"|"&MOD(RC[-5]-1,3)*30+101&"|"&MOD(RC[-5]-1,3)*30+102&"|"&MOD(RC[-5]-1,3)*30+103&"|"&IF(MOD(RC[-5],4)=0,HLOOKUP(Sheet1!R2C10,Sheet1!R2C10:R7C10,MOD(RC[-5]/4-1,6)+1,FALSE),IF(MOD(RC[-5],2)=0,IF(RC[-5]>20,HLOOKUP(Sheet1!R2C7,Sheet1!R2C7:R43C7,MOD(RC[-5]/2-1,42)+1,FALSE),HLOOKUP(Sheet1!R2C4,Sheet1!R2C4:R7C4,MOD(RC[-5]-1,6)+1,FALSE)),MOD(RC[-5]-1,3)*30+104)) -> 100|101|102|103|190 | G298: =HLOOKUP(Sheet1!R2C1,Sheet1!R2C1:R16C1,MOD(RC1-1,2)+MOD(INT((RC1-1)/2),3)*5+1,FALSE)&"|"&HLOOKUP(Sheet1!R2C1,Sheet1!R2C1:R16C1,MOD(RC1,2)+MOD(INT((RC1)/2),3)*5+1,FALSE)&"|"&HLOOKUP(Sheet1!R2C1,Sheet1!R2C1:R16C1,MOD(RC1+1,2)+MOD(INT((RC1+1)/2),3)*5+1,FALSE)&"|"&HLOOKUP(Sheet1!R2C1,Sheet1!R2C1:R16C1,MOD(RC1+2,2)+MOD(INT((RC1+2)/2),3)*5+1,FALSE)&"|"&HLOOKUP(Sheet1!R2C1,Sheet1!R2C1:R16C1,MOD(RC1+3,2)+MOD(INT((RC1+3)/2),3)*5+1,FALSE) -> 131|160|161|100|101 | H298: =HLOOKUP(Sheet1!R2C1,Sheet1!R2C1:R16C1,MOD(RC1+2,2)+MOD(INT((RC1+2)/2),3)*5+1,FALSE)&"|"&HLOOKUP(Sheet1!R2C1,Sheet1!R2C1:R16C1,MOD(RC1+3,2)+MOD(INT((RC1+3)/2),3)*5+1,FALSE)&"|"&HLOOKUP(Sheet1!R2C1,Sheet1!R2C1:R16C1,MOD(RC1+4,2)+MOD(INT((RC1+4)/2),3)*5+1,FALSE)&"|"&HLOOKUP(Sheet1!R2C1,Sheet1!R2C1:R16C1,MOD(RC1+5,2)+MOD(INT((RC1+5)/2),3)*5+1,FALSE)&"|"&HLOOKUP(Sheet1!R2C1,Sheet1!R2C1:R16C1,MOD(RC1+6,2)+MOD(INT((RC1+6)/2),3)*5+1,FALSE) -> 100|101|130|131|160 | I298: =HLOOKUP(Sheet1!R2C1,Sheet1!R2C1:R16C1,MOD(RC1-1,3)+MOD(INT((RC1-1)/3),3)*5+3,FALSE)&"|"&HLOOKUP(Sheet1!R2C1,Sheet1!R2C1:R16C1,MOD(RC1,3)+MOD(INT((RC1)/3),3)*5+3,FALSE)&"|"&HLOOKUP(Sheet1!R2C1,Sheet1!R2C1:R16C1,MOD(RC1+1,3)+MOD(INT((RC1+1)/3),3)*5+3,FALSE)&"|"&HLOOKUP(Sheet1!R2C1,Sheet1!R2C1:R16C1,MOD(RC1+2,3)+MOD(INT((RC1+2)/3),3)*5+3,FALSE)&"|"&HLOOKUP(Sheet1!R2C1,Sheet1!R2C1:R16C1,MOD(RC1+3,3)+MOD(INT((RC1+3)/3),3)*5+3,FALSE) -> 132|133|134|162|163 | J298: =HLOOKUP(Sheet1!R2C1,Sheet1!R2C1:R16C1,MOD(RC1-1,3)+MOD(INT((RC1-1)/3),3)*5+3,FALSE)&"|"&HLOOKUP(Sheet1!R2C1,Sheet1!R2C1:R16C1,MOD(RC1,3)+MOD(INT((RC1)/3),3)*5+3,FALSE)&"|"&HLOOKUP(Sheet1!R2C1,Sheet1!R2C1:R16C1,MOD(RC1+1,3)+MOD(INT((RC1+1)/3),3)*5+3,FALSE)&"|"&HLOOKUP(Sheet1!R2C1,Sheet1!R2C1:R16C1,MOD(RC1+2,3)+MOD(INT((RC1+2)/3),3)*5+3,FALSE)&"|"&HLOOKUP(Sheet1!R2C1,Sheet1!R2C1:R16C1,MOD(RC1+3,3)+MOD(INT((RC1+3)/3),3)*5+3,FALSE) -> 132|133|134|162|163 | K298: =HLOOKUP(Sheet1!R2C1,Sheet1!R2C1:R16C1,MOD(RC1-1,3)+MOD(INT((RC1-1)/3),3)*5+3,FALSE)&"|"&HLOOKUP(Sheet1!R2C1,Sheet1!R2C1:R16C1,MOD(RC1,3)+MOD(INT((RC1)/3),3)*5+3,FALSE)&"|"&HLOOKUP(Sheet1!R2C1,Sheet1!R2C1:R16C1,MOD(RC1+1,3)+MOD(INT((RC1+1)/3),3)*5+3,FALSE)&"|"&HLOOKUP(Sheet1!R2C1,Sheet1!R2C1:R16C1,MOD(RC1+2,3)+MOD(INT((RC1+2)/3),3)*5+3,FALSE)&"|"&HLOOKUP(Sheet1!R2C1,Sheet1!R2C1:R16C1,MOD(RC1+3,3)+MOD(INT((RC1+3)/3),3)*5+3,FALSE) -> 132|133|134|162|163 | L298: 25|22|23|24 | M298: 2519975|2519975|2519975|2519975 | N298: 10030|10031|10032|10033 | O298: 1|1|1|1 | P298: 2500|2500|2500|2500
A299: 293 | B299: 291 | C299: 30 | D299: =R[-20]C+2 -> 48 | E299: 1000 | F299: =MOD(RC[-5]-1,3)*30+100&"|"&MOD(RC[-5]-1,3)*30+101&"|"&MOD(RC[-5]-1,3)*30+102&"|"&MOD(RC[-5]-1,3)*30+103&"|"&IF(MOD(RC[-5],4)=0,HLOOKUP(Sheet1!R2C10,Sheet1!R2C10:R7C10,MOD(RC[-5]/4-1,6)+1,FALSE),IF(MOD(RC[-5],2)=0,IF(RC[-5]>20,HLOOKUP(Sheet1!R2C7,Sheet1!R2C7:R43C7,MOD(RC[-5]/2-1,42)+1,FALSE),HLOOKUP(Sheet1!R2C4,Sheet1!R2C4:R7C4,MOD(RC[-5]-1,6)+1,FALSE)),MOD(RC[-5]-1,3)*30+104)) -> 130|131|132|133|134 | G299: =HLOOKUP(Sheet1!R2C1,Sheet1!R2C1:R16C1,MOD(RC1-1,2)+MOD(INT((RC1-1)/2),3)*5+1,FALSE)&"|"&HLOOKUP(Sheet1!R2C1,Sheet1!R2C1:R16C1,MOD(RC1,2)+MOD(INT((RC1)/2),3)*5+1,FALSE)&"|"&HLOOKUP(Sheet1!R2C1,Sheet1!R2C1:R16C1,MOD(RC1+1,2)+MOD(INT((RC1+1)/2),3)*5+1,FALSE)&"|"&HLOOKUP(Sheet1!R2C1,Sheet1!R2C1:R16C1,MOD(RC1+2,2)+MOD(INT((RC1+2)/2),3)*5+1,FALSE)&"|"&HLOOKUP(Sheet1!R2C1,Sheet1!R2C1:R16C1,MOD(RC1+3,2)+MOD(INT((RC1+3)/2),3)*5+1,FALSE) -> 160|161|100|101|130 | H299: =HLOOKUP(Sheet1!R2C1,Sheet1!R2C1:R16C1,MOD(RC1+2,2)+MOD(INT((RC1+2)/2),3)*5+1,FALSE)&"|"&HLOOKUP(Sheet1!R2C1,Sheet1!R2C1:R16C1,MOD(RC1+3,2)+MOD(INT((RC1+3)/2),3)*5+1,FALSE)&"|"&HLOOKUP(Sheet1!R2C1,Sheet1!R2C1:R16C1,MOD(RC1+4,2)+MOD(INT((RC1+4)/2),3)*5+1,FALSE)&"|"&HLOOKUP(Sheet1!R2C1,Sheet1!R2C1:R16C1,MOD(RC1+5,2)+MOD(INT((RC1+5)/2),3)*5+1,FALSE)&"|"&HLOOKUP(Sheet1!R2C1,Sheet1!R2C1:R16C1,MOD(RC1+6,2)+MOD(INT((RC1+6)/2),3)*5+1,FALSE) -> 101|130|131|160|161 | I299: =HLOOKUP(Sheet1!R2C1,Sheet1!R2C1:R16C1,MOD(RC1-1,3)+MOD(INT((RC1-1)/3),3)*5+3,FALSE)&"|"&HLOOKUP(Sheet1!R2C1,Sheet1!R2C1:R16C1,MOD(RC1,3)+MOD(INT((RC1)/3),3)*5+3,FALSE)&"|"&HLOOKUP(Sheet1!R2C1,Sheet1!R2C1:R16C1,MOD(RC1+1,3)+MOD(INT((RC1+1)/3),3)*5+3,FALSE)&"|"&HLOOKUP(Sheet1!R2C1,Sheet1!R2C1:R16C1,MOD(RC1+2,3)+MOD(INT((RC1+2)/3),3)*5+3,FALSE)&"|"&HLOOKUP(Sheet1!R2C1,Sheet1!R2C1:R16C1,MOD(RC1+3,3)+MOD(INT((RC1+3)/3),3)*5+3,FALSE) -> 133|134|162|163|164 | J299: =HLOOKUP(Sheet1!R2C1,Sheet1!R2C1:R16C1,MOD(RC1-1,3)+MOD(INT((RC1-1)/3),3)*5+3,FALSE)&"|"&HLOOKUP(Sheet1!R2C1,Sheet1!R2C1:R16C1,MOD(RC1,3)+MOD(INT((RC1)/3),3)*5+3,FALSE)&"|"&HLOOKUP(Sheet1!R2C1,Sheet1!R2C1:R16C1,MOD(RC1+1,3)+MOD(INT((RC1+1)/3),3)*5+3,FALSE)&"|"&HLOOKUP(Sheet1!R2C1,Sheet1!R2C1:R16C1,MOD(RC1+2,3)+MOD(INT((RC1+2)/3),3)*5+3,FALSE)&"|"&HLOOKUP(Sheet1!R2C1,Sheet1!R2C1:R16C1,MOD(RC1+3,3)+MOD(INT((RC1+3)/3),3)*5+3,FALSE) -> 133|134|162|163|164 | K299: =HLOOKUP(Sheet1!R2C1,Sheet1!R2C1:R16C1,MOD(RC1-1,3)+MOD(INT((RC1-1)/3),3)*5+3,FALSE)&"|"&HLOOKUP(Sheet1!R2C1,Sheet1!R2C1:R16C1,MOD(RC1,3)+MOD(INT((RC1)/3),3)*5+3,FALSE)&"|"&HLOOKUP(Sheet1!R2C1,Sheet1!R2C1:R16C1,MOD(RC1+1,3)+MOD(INT((RC1+1)/3),3)*5+3,FALSE)&"|"&HLOOKUP(Sheet1!R2C1,Sheet1!R2C1:R16C1,MOD(RC1+2,3)+MOD(INT((RC1+2)/3),3)*5+3,FALSE)&"|"&HLOOKUP(Sheet1!R2C1,Sheet1!R2C1:R16C1,MOD(RC1+3,3)+MOD(INT((RC1+3)/3),3)*5+3,FALSE) -> 133|134|162|163|164 | L299: 25|22|23|24 | M299: 2543125|2543125|2543125|2543125 | N299: 10030|10031|10032|10033 | O299: 1|1|1|1 | P299: 2500|2500|2500|2500
A300: 294 | B300: 292 | C300: 30 | D300: =R[-20]C+2 -> 48 | E300: 1000 | F300: =MOD(RC[-5]-1,3)*30+100&"|"&MOD(RC[-5]-1,3)*30+101&"|"&MOD(RC[-5]-1,3)*30+102&"|"&MOD(RC[-5]-1,3)*30+103&"|"&IF(MOD(RC[-5],4)=0,HLOOKUP(Sheet1!R2C10,Sheet1!R2C10:R7C10,MOD(RC[-5]/4-1,6)+1,FALSE),IF(MOD(RC[-5],2)=0,IF(RC[-5]>20,HLOOKUP(Sheet1!R2C7,Sheet1!R2C7:R43C7,MOD(RC[-5]/2-1,42)+1,FALSE),HLOOKUP(Sheet1!R2C4,Sheet1!R2C4:R7C4,MOD(RC[-5]-1,6)+1,FALSE)),MOD(RC[-5]-1,3)*30+104)) -> 160|161|162|163|148 | G300: =HLOOKUP(Sheet1!R2C1,Sheet1!R2C1:R16C1,MOD(RC1-1,2)+MOD(INT((RC1-1)/2),3)*5+1,FALSE)&"|"&HLOOKUP(Sheet1!R2C1,Sheet1!R2C1:R16C1,MOD(RC1,2)+MOD(INT((RC1)/2),3)*5+1,FALSE)&"|"&HLOOKUP(Sheet1!R2C1,Sheet1!R2C1:R16C1,MOD(RC1+1,2)+MOD(INT((RC1+1)/2),3)*5+1,FALSE)&"|"&HLOOKUP(Sheet1!R2C1,Sheet1!R2C1:R16C1,MOD(RC1+2,2)+MOD(INT((RC1+2)/2),3)*5+1,FALSE)&"|"&HLOOKUP(Sheet1!R2C1,Sheet1!R2C1:R16C1,MOD(RC1+3,2)+MOD(INT((RC1+3)/2),3)*5+1,FALSE) -> 161|100|101|130|131 | H300: =HLOOKUP(Sheet1!R2C1,Sheet1!R2C1:R16C1,MOD(RC1+2,2)+MOD(INT((RC1+2)/2),3)*5+1,FALSE)&"|"&HLOOKUP(Sheet1!R2C1,Sheet1!R2C1:R16C1,MOD(RC1+3,2)+MOD(INT((RC1+3)/2),3)*5+1,FALSE)&"|"&HLOOKUP(Sheet1!R2C1,Sheet1!R2C1:R16C1,MOD(RC1+4,2)+MOD(INT((RC1+4)/2),3)*5+1,FALSE)&"|"&HLOOKUP(Sheet1!R2C1,Sheet1!R2C1:R16C1,MOD(RC1+5,2)+MOD(INT((RC1+5)/2),3)*5+1,FALSE)&"|"&HLOOKUP(Sheet1!R2C1,Sheet1!R2C1:R16C1,MOD(RC1+6,2)+MOD(INT((RC1+6)/2),3)*5+1,FALSE) -> 130|131|160|161|100 | I300: =HLOOKUP(Sheet1!R2C1,Sheet1!R2C1:R16C1,MOD(RC1-1,3)+MOD(INT((RC1-1)/3),3)*5+3,FALSE)&"|"&HLOOKUP(Sheet1!R2C1,Sheet1!R2C1:R16C1,MOD(RC1,3)+MOD(INT((RC1)/3),3)*5+3,FALSE)&"|"&HLOOKUP(Sheet1!R2C1,Sheet1!R2C1:R16C1,MOD(RC1+1,3)+MOD(INT((RC1+1)/3),3)*5+3,FALSE)&"|"&HLOOKUP(Sheet1!R2C1,Sheet1!R2C1:R16C1,MOD(RC1+2,3)+MOD(INT((RC1+2)/3),3)*5+3,FALSE)&"|"&HLOOKUP(Sheet1!R2C1,Sheet1!R2C1:R16C1,MOD(RC1+3,3)+MOD(INT((RC1+3)/3),3)*5+3,FALSE) -> 134|162|163|164|102 | J300: =HLOOKUP(Sheet1!R2C1,Sheet1!R2C1:R16C1,MOD(RC1-1,3)+MOD(INT((RC1-1)/3),3)*5+3,FALSE)&"|"&HLOOKUP(Sheet1!R2C1,Sheet1!R2C1:R16C1,MOD(RC1,3)+MOD(INT((RC1)/3),3)*5+3,FALSE)&"|"&HLOOKUP(Sheet1!R2C1,Sheet1!R2C1:R16C1,MOD(RC1+1,3)+MOD(INT((RC1+1)/3),3)*5+3,FALSE)&"|"&HLOOKUP(Sheet1!R2C1,Sheet1!R2C1:R16C1,MOD(RC1+2,3)+MOD(INT((RC1+2)/3),3)*5+3,FALSE)&"|"&HLOOKUP(Sheet1!R2C1,Sheet1!R2C1:R16C1,MOD(RC1+3,3)+MOD(INT((RC1+3)/3),3)*5+3,FALSE) -> 134|162|163|164|102 | K300: =HLOOKUP(Sheet1!R2C1,Sheet1!R2C1:R16C1,MOD(RC1-1,3)+MOD(INT((RC1-1)/3),3)*5+3,FALSE)&"|"&HLOOKUP(Sheet1!R2C1,Sheet1!R2C1:R16C1,MOD(RC1,3)+MOD(INT((RC1)/3),3)*5+3,FALSE)&"|"&HLOOKUP(Sheet1!R2C1,Sheet1!R2C1:R16C1,MOD(RC1+1,3)+MOD(INT((RC1+1)/3),3)*5+3,FALSE)&"|"&HLOOKUP(Sheet1!R2C1,Sheet1!R2C1:R16C1,MOD(RC1+2,3)+MOD(INT((RC1+2)/3),3)*5+3,FALSE)&"|"&HLOOKUP(Sheet1!R2C1,Sheet1!R2C1:R16C1,MOD(RC1+3,3)+MOD(INT((RC1+3)/3),3)*5+3,FALSE) -> 134|162|163|164|102 | L300: 25|22|23|24 | M300: 2566851|2566850|2566850|2566850 | N300: 10030|10031|10032|10033 | O300: 1|1|1|1 | P300: 2500|2500|2500|2500
A301: 295 | B301: 293 | C301: 30 | D301: =R[-20]C+2 -> 48 | E301: 1000 | F301: =MOD(RC[-5]-1,3)*30+100&"|"&MOD(RC[-5]-1,3)*30+101&"|"&MOD(RC[-5]-1,3)*30+102&"|"&MOD(RC[-5]-1,3)*30+103&"|"&IF(MOD(RC[-5],4)=0,HLOOKUP(Sheet1!R2C10,Sheet1!R2C10:R7C10,MOD(RC[-5]/4-1,6)+1,FALSE),IF(MOD(RC[-5],2)=0,IF(RC[-5]>20,HLOOKUP(Sheet1!R2C7,Sheet1!R2C7:R43C7,MOD(RC[-5]/2-1,42)+1,FALSE),HLOOKUP(Sheet1!R2C4,Sheet1!R2C4:R7C4,MOD(RC[-5]-1,6)+1,FALSE)),MOD(RC[-5]-1,3)*30+104)) -> 100|101|102|103|104 | G301: =HLOOKUP(Sheet1!R2C1,Sheet1!R2C1:R16C1,MOD(RC1-1,2)+MOD(INT((RC1-1)/2),3)*5+1,FALSE)&"|"&HLOOKUP(Sheet1!R2C1,Sheet1!R2C1:R16C1,MOD(RC1,2)+MOD(INT((RC1)/2),3)*5+1,FALSE)&"|"&HLOOKUP(Sheet1!R2C1,Sheet1!R2C1:R16C1,MOD(RC1+1,2)+MOD(INT((RC1+1)/2),3)*5+1,FALSE)&"|"&HLOOKUP(Sheet1!R2C1,Sheet1!R2C1:R16C1,MOD(RC1+2,2)+MOD(INT((RC1+2)/2),3)*5+1,FALSE)&"|"&HLOOKUP(Sheet1!R2C1,Sheet1!R2C1:R16C1,MOD(RC1+3,2)+MOD(INT((RC1+3)/2),3)*5+1,FALSE) -> 100|101|130|131|160 | H301: =HLOOKUP(Sheet1!R2C1,Sheet1!R2C1:R16C1,MOD(RC1+2,2)+MOD(INT((RC1+2)/2),3)*5+1,FALSE)&"|"&HLOOKUP(Sheet1!R2C1,Sheet1!R2C1:R16C1,MOD(RC1+3,2)+MOD(INT((RC1+3)/2),3)*5+1,FALSE)&"|"&HLOOKUP(Sheet1!R2C1,Sheet1!R2C1:R16C1,MOD(RC1+4,2)+MOD(INT((RC1+4)/2),3)*5+1,FALSE)&"|"&HLOOKUP(Sheet1!R2C1,Sheet1!R2C1:R16C1,MOD(RC1+5,2)+MOD(INT((RC1+5)/2),3)*5+1,FALSE)&"|"&HLOOKUP(Sheet1!R2C1,Sheet1!R2C1:R16C1,MOD(RC1+6,2)+MOD(INT((RC1+6)/2),3)*5+1,FALSE) -> 131|160|161|100|101 | I301: =HLOOKUP(Sheet1!R2C1,Sheet1!R2C1:R16C1,MOD(RC1-1,3)+MOD(INT((RC1-1)/3),3)*5+3,FALSE)&"|"&HLOOKUP(Sheet1!R2C1,Sheet1!R2C1:R16C1,MOD(RC1,3)+MOD(INT((RC1)/3),3)*5+3,FALSE)&"|"&HLOOKUP(Sheet1!R2C1,Sheet1!R2C1:R16C1,MOD(RC1+1,3)+MOD(INT((RC1+1)/3),3)*5+3,FALSE)&"|"&HLOOKUP(Sheet1!R2C1,Sheet1!R2C1:R16C1,MOD(RC1+2,3)+MOD(INT((RC1+2)/3),3)*5+3,FALSE)&"|"&HLOOKUP(Sheet1!R2C1,Sheet1!R2C1:R16C1,MOD(RC1+3,3)+MOD(INT((RC1+3)/3),3)*5+3,FALSE) -> 162|163|164|102|103 | J301: =HLOOKUP(Sheet1!R2C1,Sheet1!R2C1:R16C1,MOD(RC1-1,3)+MOD(INT((RC1-1)/3),3)*5+3,FALSE)&"|"&HLOOKUP(Sheet1!R2C1,Sheet1!R2C1:R16C1,MOD(RC1,3)+MOD(INT((RC1)/3),3)*5+3,FALSE)&"|"&HLOOKUP(Sheet1!R2C1,Sheet1!R2C1:R16C1,MOD(RC1+1,3)+MOD(INT((RC1+1)/3),3)*5+3,FALSE)&"|"&HLOOKUP(Sheet1!R2C1,Sheet1!R2C1:R16C1,MOD(RC1+2,3)+MOD(INT((RC1+2)/3),3)*5+3,FALSE)&"|"&HLOOKUP(Sheet1!R2C1,Sheet1!R2C1:R16C1,MOD(RC1+3,3)+MOD(INT((RC1+3)/3),3)*5+3,FALSE) -> 162|163|164|102|103 | K301: =HLOOKUP(Sheet1!R2C1,Sheet1!R2C1:R16C1,MOD(RC1-1,3)+MOD(INT((RC1-1)/3),3)*5+3,FALSE)&"|"&HLOOKUP(Sheet1!R2C1,Sheet1!R2C1:R16C1,MOD(RC1,3)+MOD(INT((RC1)/3),3)*5+3,FALSE)&"|"&HLOOKUP(Sheet1!R2C1,Sheet1!R2C1:R16C1,MOD(RC1+1,3)+MOD(INT((RC1+1)/3),3)*5+3,FALSE)&"|"&HLOOKUP(Sheet1!R2C1,Sheet1!R2C1:R16C1,MOD(RC1+2,3)+MOD(INT((RC1+2)/3),3)*5+3,FALSE)&"|"&HLOOKUP(Sheet1!R2C1,Sheet1!R2C1:R16C1,MOD(RC1+3,3)+MOD(INT((RC1+3)/3),3)*5+3,FALSE) -> 162|163|164|102|103 | L301: 25|22|23|24 | M301: 2589663|2589664|2589663|2589663 | N301: 10030|10031|10032|10033|10030|10031|10032|10033|10030|10031|10032|10033|10030|10031|10032|10033|10030|10031|10032|10033|10030|10031|10032|10033|10030|10031|10032|10033|10030|10031|10032|10033|10030|10031|10032|10033|10030|10031|10032|10033 | O301: 1|1|1|1|1|1|1|1|1|1|1|1|1|1|1|1|1|1|1|1|1|1|1|1|1|1|1|1|1|1|1|1|1|1|1|1|1|1|1|1 | P301: 2500|2500|2500|2500|2500|2500|2500|2500|2500|2500|2500|2500|2500|2500|2500|2500|2500|2500|2500|2500|2500|2500|2500|2500|2500|2500|2500|2500|2500|2500|2500|2500|2500|2500|2500|2500|2500|2500|2500|2500
A302: 296 | B302: 294 | C302: 30 | D302: =R[-20]C+2 -> 48 | E302: 1000 | F302: =MOD(RC[-5]-1,3)*30+100&"|"&MOD(RC[-5]-1,3)*30+101&"|"&MOD(RC[-5]-1,3)*30+102&"|"&MOD(RC[-5]-1,3)*30+103&"|"&IF(MOD(RC[-5],4)=0,HLOOKUP(Sheet1!R2C10,Sheet1!R2C10:R7C10,MOD(RC[-5]/4-1,6)+1,FALSE),IF(MOD(RC[-5],2)=0,IF(RC[-5]>20,HLOOKUP(Sheet1!R2C7,Sheet1!R2C7:R43C7,MOD(RC[-5]/2-1,42)+1,FALSE),HLOOKUP(Sheet1!R2C4,Sheet1!R2C4:R7C4,MOD(RC[-5]-1,6)+1,FALSE)),MOD(RC[-5]-1,3)*30+104)) -> 130|131|132|133|191 | G302: =HLOOKUP(Sheet1!R2C1,Sheet1!R2C1:R16C1,MOD(RC1-1,2)+MOD(INT((RC1-1)/2),3)*5+1,FALSE)&"|"&HLOOKUP(Sheet1!R2C1,Sheet1!R2C1:R16C1,MOD(RC1,2)+MOD(INT((RC1)/2),3)*5+1,FALSE)&"|"&HLOOKUP(Sheet1!R2C1,Sheet1!R2C1:R16C1,MOD(RC1+1,2)+MOD(INT((RC1+1)/2),3)*5+1,FALSE)&"|"&HLOOKUP(Sheet1!R2C1,Sheet1!R2C1:R16C1,MOD(RC1+2,2)+MOD(INT((RC1+2)/2),3)*5+1,FALSE)&"|"&HLOOKUP(Sheet1!R2C1,Sheet1!R2C1:R16C1,MOD(RC1+3,2)+MOD(INT((RC1+3)/2),3)*5+1,FALSE) -> 101|130|131|160|161 | H302: =HLOOKUP(Sheet1!R2C1,Sheet1!R2C1:R16C1,MOD(RC1+2,2)+MOD(INT((RC1+2)/2),3)*5+1,FALSE)&"|"&HLOOKUP(Sheet1!R2C1,Sheet1!R2C1:R16C1,MOD(RC1+3,2)+MOD(INT((RC1+3)/2),3)*5+1,FALSE)&"|"&HLOOKUP(Sheet1!R2C1,Sheet1!R2C1:R16C1,MOD(RC1+4,2)+MOD(INT((RC1+4)/2),3)*5+1,FALSE)&"|"&HLOOKUP(Sheet1!R2C1,Sheet1!R2C1:R16C1,MOD(RC1+5,2)+MOD(INT((RC1+5)/2),3)*5+1,FALSE)&"|"&HLOOKUP(Sheet1!R2C1,Sheet1!R2C1:R16C1,MOD(RC1+6,2)+MOD(INT((RC1+6)/2),3)*5+1,FALSE) -> 160|161|100|101|130 | I302: =HLOOKUP(Sheet1!R2C1,Sheet1!R2C1:R16C1,MOD(RC1-1,3)+MOD(INT((RC1-1)/3),3)*5+3,FALSE)&"|"&HLOOKUP(Sheet1!R2C1,Sheet1!R2C1:R16C1,MOD(RC1,3)+MOD(INT((RC1)/3),3)*5+3,FALSE)&"|"&HLOOKUP(Sheet1!R2C1,Sheet1!R2C1:R16C1,MOD(RC1+1,3)+MOD(INT((RC1+1)/3),3)*5+3,FALSE)&"|"&HLOOKUP(Sheet1!R2C1,Sheet1!R2C1:R16C1,MOD(RC1+2,3)+MOD(INT((RC1+2)/3),3)*5+3,FALSE)&"|"&HLOOKUP(Sheet1!R2C1,Sheet1!R2C1:R16C1,MOD(RC1+3,3)+MOD(INT((RC1+3)/3),3)*5+3,FALSE) -> 163|164|102|103|104 | J302: =HLOOKUP(Sheet1!R2C1,Sheet1!R2C1:R16C1,MOD(RC1-1,3)+MOD(INT((RC1-1)/3),3)*5+3,FALSE)&"|"&HLOOKUP(Sheet1!R2C1,Sheet1!R2C1:R16C1,MOD(RC1,3)+MOD(INT((RC1)/3),3)*5+3,FALSE)&"|"&HLOOKUP(Sheet1!R2C1,Sheet1!R2C1:R16C1,MOD(RC1+1,3)+MOD(INT((RC1+1)/3),3)*5+3,FALSE)&"|"&HLOOKUP(Sheet1!R2C1,Sheet1!R2C1:R16C1,MOD(RC1+2,3)+MOD(INT((RC1+2)/3),3)*5+3,FALSE)&"|"&HLOOKUP(Sheet1!R2C1,Sheet1!R2C1:R16C1,MOD(RC1+3,3)+MOD(INT((RC1+3)/3),3)*5+3,FALSE) -> 163|164|102|103|104 | K302: =HLOOKUP(Sheet1!R2C1,Sheet1!R2C1:R16C1,MOD(RC1-1,3)+MOD(INT((RC1-1)/3),3)*5+3,FALSE)&"|"&HLOOKUP(Sheet1!R2C1,Sheet1!R2C1:R16C1,MOD(RC1,3)+MOD(INT((RC1)/3),3)*5+3,FALSE)&"|"&HLOOKUP(Sheet1!R2C1,Sheet1!R2C1:R16C1,MOD(RC1+1,3)+MOD(INT((RC1+1)/3),3)*5+3,FALSE)&"|"&HLOOKUP(Sheet1!R2C1,Sheet1!R2C1:R16C1,MOD(RC1+2,3)+MOD(INT((RC1+2)/3),3)*5+3,FALSE)&"|"&HLOOKUP(Sheet1!R2C1,Sheet1!R2C1:R16C1,MOD(RC1+3,3)+MOD(INT((RC1+3)/3),3)*5+3,FALSE) -> 163|164|102|103|104 | L302: 25|22|23|24 | M302: 2613388|2613389|2613388|2613388 | N302: 10030|10031|10032|10033 | O302: 1|1|1|1 | P302: 2500|2500|2500|2500
A303: 297 | B303: 295 | C303: 30 | D303: =R[-20]C+2 -> 48 | E303: 1000 | F303: =MOD(RC[-5]-1,3)*30+100&"|"&MOD(RC[-5]-1,3)*30+101&"|"&MOD(RC[-5]-1,3)*30+102&"|"&MOD(RC[-5]-1,3)*30+103&"|"&IF(MOD(RC[-5],4)=0,HLOOKUP(Sheet1!R2C10,Sheet1!R2C10:R7C10,MOD(RC[-5]/4-1,6)+1,FALSE),IF(MOD(RC[-5],2)=0,IF(RC[-5]>20,HLOOKUP(Sheet1!R2C7,Sheet1!R2C7:R43C7,MOD(RC[-5]/2-1,42)+1,FALSE),HLOOKUP(Sheet1!R2C4,Sheet1!R2C4:R7C4,MOD(RC[-5]-1,6)+1,FALSE)),MOD(RC[-5]-1,3)*30+104)) -> 160|161|162|163|164 | G303: =HLOOKUP(Sheet1!R2C1,Sheet1!R2C1:R16C1,MOD(RC1-1,2)+MOD(INT((RC1-1)/2),3)*5+1,FALSE)&"|"&HLOOKUP(Sheet1!R2C1,Sheet1!R2C1:R16C1,MOD(RC1,2)+MOD(INT((RC1)/2),3)*5+1,FALSE)&"|"&HLOOKUP(Sheet1!R2C1,Sheet1!R2C1:R16C1,MOD(RC1+1,2)+MOD(INT((RC1+1)/2),3)*5+1,FALSE)&"|"&HLOOKUP(Sheet1!R2C1,Sheet1!R2C1:R16C1,MOD(RC1+2,2)+MOD(INT((RC1+2)/2),3)*5+1,FALSE)&"|"&HLOOKUP(Sheet1!R2C1,Sheet1!R2C1:R16C1,MOD(RC1+3,2)+MOD(INT((RC1+3)/2),3)*5+1,FALSE) -> 130|131|160|161|100 | H303: =HLOOKUP(Sheet1!R2C1,Sheet1!R2C1:R16C1,MOD(RC1+2,2)+MOD(INT((RC1+2)/2),3)*5+1,FALSE)&"|"&HLOOKUP(Sheet1!R2C1,Sheet1!R2C1:R16C1,MOD(RC1+3,2)+MOD(INT((RC1+3)/2),3)*5+1,FALSE)&"|"&HLOOKUP(Sheet1!R2C1,Sheet1!R2C1:R16C1,MOD(RC1+4,2)+MOD(INT((RC1+4)/2),3)*5+1,FALSE)&"|"&HLOOKUP(Sheet1!R2C1,Sheet1!R2C1:R16C1,MOD(RC1+5,2)+MOD(INT((RC1+5)/2),3)*5+1,FALSE)&"|"&HLOOKUP(Sheet1!R2C1,Sheet1!R2C1:R16C1,MOD(RC1+6,2)+MOD(INT((RC1+6)/2),3)*5+1,FALSE) -> 161|100|101|130|131 | I303: =HLOOKUP(Sheet1!R2C1,Sheet1!R2C1:R16C1,MOD(RC1-1,3)+MOD(INT((RC1-1)/3),3)*5+3,FALSE)&"|"&HLOOKUP(Sheet1!R2C1,Sheet1!R2C1:R16C1,MOD(RC1,3)+MOD(INT((RC1)/3),3)*5+3,FALSE)&"|"&HLOOKUP(Sheet1!R2C1,Sheet1!R2C1:R16C1,MOD(RC1+1,3)+MOD(INT((RC1+1)/3),3)*5+3,FALSE)&"|"&HLOOKUP(Sheet1!R2C1,Sheet1!R2C1:R16C1,MOD(RC1+2,3)+MOD(INT((RC1+2)/3),3)*5+3,FALSE)&"|"&HLOOKUP(Sheet1!R2C1,Sheet1!R2C1:R16C1,MOD(RC1+3,3)+MOD(INT((RC1+3)/3),3)*5+3,FALSE) -> 164|102|103|104|132 | J303: =HLOOKUP(Sheet1!R2C1,Sheet1!R2C1:R16C1,MOD(RC1-1,3)+MOD(INT((RC1-1)/3),3)*5+3,FALSE)&"|"&HLOOKUP(Sheet1!R2C1,Sheet1!R2C1:R16C1,MOD(RC1,3)+MOD(INT((RC1)/3),3)*5+3,FALSE)&"|"&HLOOKUP(Sheet1!R2C1,Sheet1!R2C1:R16C1,MOD(RC1+1,3)+MOD(INT((RC1+1)/3),3)*5+3,FALSE)&"|"&HLOOKUP(Sheet1!R2C1,Sheet1!R2C1:R16C1,MOD(RC1+2,3)+MOD(INT((RC1+2)/3),3)*5+3,FALSE)&"|"&HLOOKUP(Sheet1!R2C1,Sheet1!R2C1:R16C1,MOD(RC1+3,3)+MOD(INT((RC1+3)/3),3)*5+3,FALSE) -> 164|102|103|104|132 | K303: =HLOOKUP(Sheet1!R2C1,Sheet1!R2C1:R16C1,MOD(RC1-1,3)+MOD(INT((RC1-1)/3),3)*5+3,FALSE)&"|"&HLOOKUP(Sheet1!R2C1,Sheet1!R2C1:R16C1,MOD(RC1,3)+MOD(INT((RC1)/3),3)*5+3,FALSE)&"|"&HLOOKUP(Sheet1!R2C1,Sheet1!R2C1:R16C1,MOD(RC1+1,3)+MOD(INT((RC1+1)/3),3)*5+3,FALSE)&"|"&HLOOKUP(Sheet1!R2C1,Sheet1!R2C1:R16C1,MOD(RC1+2,3)+MOD(INT((RC1+2)/3),3)*5+3,FALSE)&"|"&HLOOKUP(Sheet1!R2C1,Sheet1!R2C1:R16C1,MOD(RC1+3,3)+MOD(INT((RC1+3)/3),3)*5+3,FALSE) -> 164|102|103|104|132 | L303: 25|22|23|24 | M303: 2637480|2637480|2637480|2637480 | N303: 10030|10031|10032|10033 | O303: 1|1|1|1 | P303: 2500|2500|2500|2500
A304: 298 | B304: 296 | C304: 30 | D304: =R[-20]C+2 -> 48 | E304: 1000 | F304: =MOD(RC[-5]-1,3)*30+100&"|"&MOD(RC[-5]-1,3)*30+101&"|"&MOD(RC[-5]-1,3)*30+102&"|"&MOD(RC[-5]-1,3)*30+103&"|"&IF(MOD(RC[-5],4)=0,HLOOKUP(Sheet1!R2C10,Sheet1!R2C10:R7C10,MOD(RC[-5]/4-1,6)+1,FALSE),IF(MOD(RC[-5],2)=0,IF(RC[-5]>20,HLOOKUP(Sheet1!R2C7,Sheet1!R2C7:R43C7,MOD(RC[-5]/2-1,42)+1,FALSE),HLOOKUP(Sheet1!R2C4,Sheet1!R2C4:R7C4,MOD(RC[-5]-1,6)+1,FALSE)),MOD(RC[-5]-1,3)*30+104)) -> 100|101|102|103|150 | G304: =HLOOKUP(Sheet1!R2C1,Sheet1!R2C1:R16C1,MOD(RC1-1,2)+MOD(INT((RC1-1)/2),3)*5+1,FALSE)&"|"&HLOOKUP(Sheet1!R2C1,Sheet1!R2C1:R16C1,MOD(RC1,2)+MOD(INT((RC1)/2),3)*5+1,FALSE)&"|"&HLOOKUP(Sheet1!R2C1,Sheet1!R2C1:R16C1,MOD(RC1+1,2)+MOD(INT((RC1+1)/2),3)*5+1,FALSE)&"|"&HLOOKUP(Sheet1!R2C1,Sheet1!R2C1:R16C1,MOD(RC1+2,2)+MOD(INT((RC1+2)/2),3)*5+1,FALSE)&"|"&HLOOKUP(Sheet1!R2C1,Sheet1!R2C1:R16C1,MOD(RC1+3,2)+MOD(INT((RC1+3)/2),3)*5+1,FALSE) -> 131|160|161|100|101 | H304: =HLOOKUP(Sheet1!R2C1,Sheet1!R2C1:R16C1,MOD(RC1+2,2)+MOD(INT((RC1+2)/2),3)*5+1,FALSE)&"|"&HLOOKUP(Sheet1!R2C1,Sheet1!R2C1:R16C1,MOD(RC1+3,2)+MOD(INT((RC1+3)/2),3)*5+1,FALSE)&"|"&HLOOKUP(Sheet1!R2C1,Sheet1!R2C1:R16C1,MOD(RC1+4,2)+MOD(INT((RC1+4)/2),3)*5+1,FALSE)&"|"&HLOOKUP(Sheet1!R2C1,Sheet1!R2C1:R16C1,MOD(RC1+5,2)+MOD(INT((RC1+5)/2),3)*5+1,FALSE)&"|"&HLOOKUP(Sheet1!R2C1,Sheet1!R2C1:R16C1,MOD(RC1+6,2)+MOD(INT((RC1+6)/2),3)*5+1,FALSE) -> 100|101|130|131|160 | I304: =HLOOKUP(Sheet1!R2C1,Sheet1!R2C1:R16C1,MOD(RC1-1,3)+MOD(INT((RC1-1)/3),3)*5+3,FALSE)&"|"&HLOOKUP(Sheet1!R2C1,Sheet1!R2C1:R16C1,MOD(RC1,3)+MOD(INT((RC1)/3),3)*5+3,FALSE)&"|"&HLOOKUP(Sheet1!R2C1,Sheet1!R2C1:R16C1,MOD(RC1+1,3)+MOD(INT((RC1+1)/3),3)*5+3,FALSE)&"|"&HLOOKUP(Sheet1!R2C1,Sheet1!R2C1:R16C1,MOD(RC1+2,3)+MOD(INT((RC1+2)/3),3)*5+3,FALSE)&"|"&HLOOKUP(Sheet1!R2C1,Sheet1!R2C1:R16C1,MOD(RC1+3,3)+MOD(INT((RC1+3)/3),3)*5+3,FALSE) -> 102|103|104|132|133 | J304: =HLOOKUP(Sheet1!R2C1,Sheet1!R2C1:R16C1,MOD(RC1-1,3)+MOD(INT((RC1-1)/3),3)*5+3,FALSE)&"|"&HLOOKUP(Sheet1!R2C1,Sheet1!R2C1:R16C1,MOD(RC1,3)+MOD(INT((RC1)/3),3)*5+3,FALSE)&"|"&HLOOKUP(Sheet1!R2C1,Sheet1!R2C1:R16C1,MOD(RC1+1,3)+MOD(INT((RC1+1)/3),3)*5+3,FALSE)&"|"&HLOOKUP(Sheet1!R2C1,Sheet1!R2C1:R16C1,MOD(RC1+2,3)+MOD(INT((RC1+2)/3),3)*5+3,FALSE)&"|"&HLOOKUP(Sheet1!R2C1,Sheet1!R2C1:R16C1,MOD(RC1+3,3)+MOD(INT((RC1+3)/3),3)*5+3,FALSE) -> 102|103|104|132|133 | K304: =HLOOKUP(Sheet1!R2C1,Sheet1!R2C1:R16C1,MOD(RC1-1,3)+MOD(INT((RC1-1)/3),3)*5+3,FALSE)&"|"&HLOOKUP(Sheet1!R2C1,Sheet1!R2C1:R16C1,MOD(RC1,3)+MOD(INT((RC1)/3),3)*5+3,FALSE)&"|"&HLOOKUP(Sheet1!R2C1,Sheet1!R2C1:R16C1,MOD(RC1+1,3)+MOD(INT((RC1+1)/3),3)*5+3,FALSE)&"|"&HLOOKUP(Sheet1!R2C1,Sheet1!R2C1:R16C1,MOD(RC1+2,3)+MOD(INT((RC1+2)/3),3)*5+3,FALSE)&"|"&HLOOKUP(Sheet1!R2C1,Sheet1!R2C1:R16C1,MOD(RC1+3,3)+MOD(INT((RC1+3)/3),3)*5+3,FALSE) -> 102|103|104|132|133 | L304: 25|22|23|24 | M304: 2661124|2661124|2661125|2661125 | N304: 10030|10031|10032|10033 | O304: 1|1|1|1 | P304: 2500|2500|2500|2500
A305: 299 | B305: 297 | C305: 30 | D305: =R[-20]C+2 -> 48 | E305: 1000 | F305: =MOD(RC[-5]-1,3)*30+100&"|"&MOD(RC[-5]-1,3)*30+101&"|"&MOD(RC[-5]-1,3)*30+102&"|"&MOD(RC[-5]-1,3)*30+103&"|"&IF(MOD(RC[-5],4)=0,HLOOKUP(Sheet1!R2C10,Sheet1!R2C10:R7C10,MOD(RC[-5]/4-1,6)+1,FALSE),IF(MOD(RC[-5],2)=0,IF(RC[-5]>20,HLOOKUP(Sheet1!R2C7,Sheet1!R2C7:R43C7,MOD(RC[-5]/2-1,42)+1,FALSE),HLOOKUP(Sheet1!R2C4,Sheet1!R2C4:R7C4,MOD(RC[-5]-1,6)+1,FALSE)),MOD(RC[-5]-1,3)*30+104)) -> 130|131|132|133|134 | G305: =HLOOKUP(Sheet1!R2C1,Sheet1!R2C1:R16C1,MOD(RC1-1,2)+MOD(INT((RC1-1)/2),3)*5+1,FALSE)&"|"&HLOOKUP(Sheet1!R2C1,Sheet1!R2C1:R16C1,MOD(RC1,2)+MOD(INT((RC1)/2),3)*5+1,FALSE)&"|"&HLOOKUP(Sheet1!R2C1,Sheet1!R2C1:R16C1,MOD(RC1+1,2)+MOD(INT((RC1+1)/2),3)*5+1,FALSE)&"|"&HLOOKUP(Sheet1!R2C1,Sheet1!R2C1:R16C1,MOD(RC1+2,2)+MOD(INT((RC1+2)/2),3)*5+1,FALSE)&"|"&HLOOKUP(Sheet1!R2C1,Sheet1!R2C1:R16C1,MOD(RC1+3,2)+MOD(INT((RC1+3)/2),3)*5+1,FALSE) -> 160|161|100|101|130 | H305: =HLOOKUP(Sheet1!R2C1,Sheet1!R2C1:R16C1,MOD(RC1+2,2)+MOD(INT((RC1+2)/2),3)*5+1,FALSE)&"|"&HLOOKUP(Sheet1!R2C1,Sheet1!R2C1:R16C1,MOD(RC1+3,2)+MOD(INT((RC1+3)/2),3)*5+1,FALSE)&"|"&HLOOKUP(Sheet1!R2C1,Sheet1!R2C1:R16C1,MOD(RC1+4,2)+MOD(INT((RC1+4)/2),3)*5+1,FALSE)&"|"&HLOOKUP(Sheet1!R2C1,Sheet1!R2C1:R16C1,MOD(RC1+5,2)+MOD(INT((RC1+5)/2),3)*5+1,FALSE)&"|"&HLOOKUP(Sheet1!R2C1,Sheet1!R2C1:R16C1,MOD(RC1+6,2)+MOD(INT((RC1+6)/2),3)*5+1,FALSE) -> 101|130|131|160|161 | I305: =HLOOKUP(Sheet1!R2C1,Sheet1!R2C1:R16C1,MOD(RC1-1,3)+MOD(INT((RC1-1)/3),3)*5+3,FALSE)&"|"&HLOOKUP(Sheet1!R2C1,Sheet1!R2C1:R16C1,MOD(RC1,3)+MOD(INT((RC1)/3),3)*5+3,FALSE)&"|"&HLOOKUP(Sheet1!R2C1,Sheet1!R2C1:R16C1,MOD(RC1+1,3)+MOD(INT((RC1+1)/3),3)*5+3,FALSE)&"|"&HLOOKUP(Sheet1!R2C1,Sheet1!R2C1:R16C1,MOD(RC1+2,3)+MOD(INT((RC1+2)/3),3)*5+3,FALSE)&"|"&HLOOKUP(Sheet1!R2C1,Sheet1!R2C1:R16C1,MOD(RC1+3,3)+MOD(INT((RC1+3)/3),3)*5+3,FALSE) -> 103|104|132|133|134 | J305: =HLOOKUP(Sheet1!R2C1,Sheet1!R2C1:R16C1,MOD(RC1-1,3)+MOD(INT((RC1-1)/3),3)*5+3,FALSE)&"|"&HLOOKUP(Sheet1!R2C1,Sheet1!R2C1:R16C1,MOD(RC1,3)+MOD(INT((RC1)/3),3)*5+3,FALSE)&"|"&HLOOKUP(Sheet1!R2C1,Sheet1!R2C1:R16C1,MOD(RC1+1,3)+MOD(INT((RC1+1)/3),3)*5+3,FALSE)&"|"&HLOOKUP(Sheet1!R2C1,Sheet1!R2C1:R16C1,MOD(RC1+2,3)+MOD(INT((RC1+2)/3),3)*5+3,FALSE)&"|"&HLOOKUP(Sheet1!R2C1,Sheet1!R2C1:R16C1,MOD(RC1+3,3)+MOD(INT((RC1+3)/3),3)*5+3,FALSE) -> 103|104|132|133|134 | K305: =HLOOKUP(Sheet1!R2C1,Sheet1!R2C1:R16C1,MOD(RC1-1,3)+MOD(INT((RC1-1)/3),3)*5+3,FALSE)&"|"&HLOOKUP(Sheet1!R2C1,Sheet1!R2C1:R16C1,MOD(RC1,3)+MOD(INT((RC1)/3),3)*5+3,FALSE)&"|"&HLOOKUP(Sheet1!R2C1,Sheet1!R2C1:R16C1,MOD(RC1+1,3)+MOD(INT((RC1+1)/3),3)*5+3,FALSE)&"|"&HLOOKUP(Sheet1!R2C1,Sheet1!R2C1:R16C1,MOD(RC1+2,3)+MOD(INT((RC1+2)/3),3)*5+3,FALSE)&"|"&HLOOKUP(Sheet1!R2C1,Sheet1!R2C1:R16C1,MOD(RC1+3,3)+MOD(INT((RC1+3)/3),3)*5+3,FALSE) -> 103|104|132|133|134 | L305: 25|22|23|24 | M305: 2685715|2685715|2685715|2685715 | N305: 10030|10031|10032|10033 | O305: 1|1|1|1 | P305: 2500|2500|2500|2500
A306: 300 | B306: 298 | C306: 30 | D306: =R[-20]C+2 -> 48 | E306: 1000 | F306: =MOD(RC[-5]-1,3)*30+100&"|"&MOD(RC[-5]-1,3)*30+101&"|"&MOD(RC[-5]-1,3)*30+102&"|"&MOD(RC[-5]-1,3)*30+103&"|"&IF(MOD(RC[-5],4)=0,HLOOKUP(Sheet1!R2C10,Sheet1!R2C10:R7C10,MOD(RC[-5]/4-1,6)+1,FALSE),IF(MOD(RC[-5],2)=0,IF(RC[-5]>20,HLOOKUP(Sheet1!R2C7,Sheet1!R2C7:R43C7,MOD(RC[-5]/2-1,42)+1,FALSE),HLOOKUP(Sheet1!R2C4,Sheet1!R2C4:R7C4,MOD(RC[-5]-1,6)+1,FALSE)),MOD(RC[-5]-1,3)*30+104)) -> 160|161|162|163|192 | G306: =HLOOKUP(Sheet1!R2C1,Sheet1!R2C1:R16C1,MOD(RC1-1,2)+MOD(INT((RC1-1)/2),3)*5+1,FALSE)&"|"&HLOOKUP(Sheet1!R2C1,Sheet1!R2C1:R16C1,MOD(RC1,2)+MOD(INT((RC1)/2),3)*5+1,FALSE)&"|"&HLOOKUP(Sheet1!R2C1,Sheet1!R2C1:R16C1,MOD(RC1+1,2)+MOD(INT((RC1+1)/2),3)*5+1,FALSE)&"|"&HLOOKUP(Sheet1!R2C1,Sheet1!R2C1:R16C1,MOD(RC1+2,2)+MOD(INT((RC1+2)/2),3)*5+1,FALSE)&"|"&HLOOKUP(Sheet1!R2C1,Sheet1!R2C1:R16C1,MOD(RC1+3,2)+MOD(INT((RC1+3)/2),3)*5+1,FALSE) -> 161|100|101|130|131 | H306: =HLOOKUP(Sheet1!R2C1,Sheet1!R2C1:R16C1,MOD(RC1+2,2)+MOD(INT((RC1+2)/2),3)*5+1,FALSE)&"|"&HLOOKUP(Sheet1!R2C1,Sheet1!R2C1:R16C1,MOD(RC1+3,2)+MOD(INT((RC1+3)/2),3)*5+1,FALSE)&"|"&HLOOKUP(Sheet1!R2C1,Sheet1!R2C1:R16C1,MOD(RC1+4,2)+MOD(INT((RC1+4)/2),3)*5+1,FALSE)&"|"&HLOOKUP(Sheet1!R2C1,Sheet1!R2C1:R16C1,MOD(RC1+5,2)+MOD(INT((RC1+5)/2),3)*5+1,FALSE)&"|"&HLOOKUP(Sheet1!R2C1,Sheet1!R2C1:R16C1,MOD(RC1+6,2)+MOD(INT((RC1+6)/2),3)*5+1,FALSE) -> 130|131|160|161|100 | I306: =HLOOKUP(Sheet1!R2C1,Sheet1!R2C1:R16C1,MOD(RC1-1,3)+MOD(INT((RC1-1)/3),3)*5+3,FALSE)&"|"&HLOOKUP(Sheet1!R2C1,Sheet1!R2C1:R16C1,MOD(RC1,3)+MOD(INT((RC1)/3),3)*5+3,FALSE)&"|"&HLOOKUP(Sheet1!R2C1,Sheet1!R2C1:R16C1,MOD(RC1+1,3)+MOD(INT((RC1+1)/3),3)*5+3,FALSE)&"|"&HLOOKUP(Sheet1!R2C1,Sheet1!R2C1:R16C1,MOD(RC1+2,3)+MOD(INT((RC1+2)/3),3)*5+3,FALSE)&"|"&HLOOKUP(Sheet1!R2C1,Sheet1!R2C1:R16C1,MOD(RC1+3,3)+MOD(INT((RC1+3)/3),3)*5+3,FALSE) -> 104|132|133|134|162 | J306: =HLOOKUP(Sheet1!R2C1,Sheet1!R2C1:R16C1,MOD(RC1-1,3)+MOD(INT((RC1-1)/3),3)*5+3,FALSE)&"|"&HLOOKUP(Sheet1!R2C1,Sheet1!R2C1:R16C1,MOD(RC1,3)+MOD(INT((RC1)/3),3)*5+3,FALSE)&"|"&HLOOKUP(Sheet1!R2C1,Sheet1!R2C1:R16C1,MOD(RC1+1,3)+MOD(INT((RC1+1)/3),3)*5+3,FALSE)&"|"&HLOOKUP(Sheet1!R2C1,Sheet1!R2C1:R16C1,MOD(RC1+2,3)+MOD(INT((RC1+2)/3),3)*5+3,FALSE)&"|"&HLOOKUP(Sheet1!R2C1,Sheet1!R2C1:R16C1,MOD(RC1+3,3)+MOD(INT((RC1+3)/3),3)*5+3,FALSE) -> 104|132|133|134|162 | K306: =HLOOKUP(Sheet1!R2C1,Sheet1!R2C1:R16C1,MOD(RC1-1,3)+MOD(INT((RC1-1)/3),3)*5+3,FALSE)&"|"&HLOOKUP(Sheet1!R2C1,Sheet1!R2C1:R16C1,MOD(RC1,3)+MOD(INT((RC1)/3),3)*5+3,FALSE)&"|"&HLOOKUP(Sheet1!R2C1,Sheet1!R2C1:R16C1,MOD(RC1+1,3)+MOD(INT((RC1+1)/3),3)*5+3,FALSE)&"|"&HLOOKUP(Sheet1!R2C1,Sheet1!R2C1:R16C1,MOD(RC1+2,3)+MOD(INT((RC1+2)/3),3)*5+3,FALSE)&"|"&HLOOKUP(Sheet1!R2C1,Sheet1!R2C1:R16C1,MOD(RC1+3,3)+MOD(INT((RC1+3)/3),3)*5+3,FALSE) -> 104|132|133|134|162 | L306: 25|22|23|24 | M306: 2709359|2709359|2709360|2709360 | N306: 10030|10031|10032|10033|10030|10031|10032|10033|10030|10031|10032|10033|10030|10031|10032|10033|10030|10031|10032|10033|10030|10031|10032|10033|10030|10031|10032|10033|10030|10031|10032|10033|10030|10031|10032|10033|10030|10031|10032|10033 | O306: 1|1|1|1|1|1|1|1|1|1|1|1|1|1|1|1|1|1|1|1|1|1|1|1|1|1|1|1|1|1|1|1|1|1|1|1|1|1|1|1 | P306: 2500|2500|2500|2500|2500|2500|2500|2500|2500|2500|2500|2500|2500|2500|2500|2500|2500|2500|2500|2500|2500|2500|2500|2500|2500|2500|2500|2500|2500|2500|2500|2500|2500|2500|2500|2500|2500|2500|2500|2500
A307: 301 | B307: 299 | C307: 30 | D307: =R[-20]C+2 -> 50 | E307: 1000 | F307: =MOD(RC[-5]-1,3)*30+100&"|"&MOD(RC[-5]-1,3)*30+101&"|"&MOD(RC[-5]-1,3)*30+102&"|"&MOD(RC[-5]-1,3)*30+103&"|"&IF(MOD(RC[-5],4)=0,HLOOKUP(Sheet1!R2C10,Sheet1!R2C10:R7C10,MOD(RC[-5]/4-1,6)+1,FALSE),IF(MOD(RC[-5],2)=0,IF(RC[-5]>20,HLOOKUP(Sheet1!R2C7,Sheet1!R2C7:R43C7,MOD(RC[-5]/2-1,42)+1,FALSE),HLOOKUP(Sheet1!R2C4,Sheet1!R2C4:R7C4,MOD(RC[-5]-1,6)+1,FALSE)),MOD(RC[-5]-1,3)*30+104)) -> 100|101|102|103|104 | G307: =HLOOKUP(Sheet1!R2C1,Sheet1!R2C1:R16C1,MOD(RC1-1,2)+MOD(INT((RC1-1)/2),3)*5+1,FALSE)&"|"&HLOOKUP(Sheet1!R2C1,Sheet1!R2C1:R16C1,MOD(RC1,2)+MOD(INT((RC1)/2),3)*5+1,FALSE)&"|"&HLOOKUP(Sheet1!R2C1,Sheet1!R2C1:R16C1,MOD(RC1+1,2)+MOD(INT((RC1+1)/2),3)*5+1,FALSE)&"|"&HLOOKUP(Sheet1!R2C1,Sheet1!R2C1:R16C1,MOD(RC1+2,2)+MOD(INT((RC1+2)/2),3)*5+1,FALSE)&"|"&HLOOKUP(Sheet1!R2C1,Sheet1!R2C1:R16C1,MOD(RC1+3,2)+MOD(INT((RC1+3)/2),3)*5+1,FALSE) -> 100|101|130|131|160 | H307: =HLOOKUP(Sheet1!R2C1,Sheet1!R2C1:R16C1,MOD(RC1+2,2)+MOD(INT((RC1+2)/2),3)*5+1,FALSE)&"|"&HLOOKUP(Sheet1!R2C1,Sheet1!R2C1:R16C1,MOD(RC1+3,2)+MOD(INT((RC1+3)/2),3)*5+1,FALSE)&"|"&HLOOKUP(Sheet1!R2C1,Sheet1!R2C1:R16C1,MOD(RC1+4,2)+MOD(INT((RC1+4)/2),3)*5+1,FALSE)&"|"&HLOOKUP(Sheet1!R2C1,Sheet1!R2C1:R16C1,MOD(RC1+5,2)+MOD(INT((RC1+5)/2),3)*5+1,FALSE)&"|"&HLOOKUP(Sheet1!R2C1,Sheet1!R2C1:R16C1,MOD(RC1+6,2)+MOD(INT((RC1+6)/2),3)*5+1,FALSE) -> 131|160|161|100|101 | I307: =HLOOKUP(Sheet1!R2C1,Sheet1!R2C1:R16C1,MOD(RC1-1,3)+MOD(INT((RC1-1)/3),3)*5+3,FALSE)&"|"&HLOOKUP(Sheet1!R2C1,Sheet1!R2C1:R16C1,MOD(RC1,3)+MOD(INT((RC1)/3),3)*5+3,FALSE)&"|"&HLOOKUP(Sheet1!R2C1,Sheet1!R2C1:R16C1,MOD(RC1+1,3)+MOD(INT((RC1+1)/3),3)*5+3,FALSE)&"|"&HLOOKUP(Sheet1!R2C1,Sheet1!R2C1:R16C1,MOD(RC1+2,3)+MOD(INT((RC1+2)/3),3)*5+3,FALSE)&"|"&HLOOKUP(Sheet1!R2C1,Sheet1!R2C1:R16C1,MOD(RC1+3,3)+MOD(INT((RC1+3)/3),3)*5+3,FALSE) -> 132|133|134|162|163 | J307: =HLOOKUP(Sheet1!R2C1,Sheet1!R2C1:R16C1,MOD(RC1-1,3)+MOD(INT((RC1-1)/3),3)*5+3,FALSE)&"|"&HLOOKUP(Sheet1!R2C1,Sheet1!R2C1:R16C1,MOD(RC1,3)+MOD(INT((RC1)/3),3)*5+3,FALSE)&"|"&HLOOKUP(Sheet1!R2C1,Sheet1!R2C1:R16C1,MOD(RC1+1,3)+MOD(INT((RC1+1)/3),3)*5+3,FALSE)&"|"&HLOOKUP(Sheet1!R2C1,Sheet1!R2C1:R16C1,MOD(RC1+2,3)+MOD(INT((RC1+2)/3),3)*5+3,FALSE)&"|"&HLOOKUP(Sheet1!R2C1,Sheet1!R2C1:R16C1,MOD(RC1+3,3)+MOD(INT((RC1+3)/3),3)*5+3,FALSE) -> 132|133|134|162|163 | K307: =HLOOKUP(Sheet1!R2C1,Sheet1!R2C1:R16C1,MOD(RC1-1,3)+MOD(INT((RC1-1)/3),3)*5+3,FALSE)&"|"&HLOOKUP(Sheet1!R2C1,Sheet1!R2C1:R16C1,MOD(RC1,3)+MOD(INT((RC1)/3),3)*5+3,FALSE)&"|"&HLOOKUP(Sheet1!R2C1,Sheet1!R2C1:R16C1,MOD(RC1+1,3)+MOD(INT((RC1+1)/3),3)*5+3,FALSE)&"|"&HLOOKUP(Sheet1!R2C1,Sheet1!R2C1:R16C1,MOD(RC1+2,3)+MOD(INT((RC1+2)/3),3)*5+3,FALSE)&"|"&HLOOKUP(Sheet1!R2C1,Sheet1!R2C1:R16C1,MOD(RC1+3,3)+MOD(INT((RC1+3)/3),3)*5+3,FALSE) -> 132|133|134|162|163 | L307: 25|22|23|24 | M307: 2734397|2734398|2734398|2734398 | N307: 10030|10031|10032|10033 | O307: 1|1|1|1 | P307: 2500|2500|2500|2500
A308: 302 | B308: 300 | C308: 30 | D308: =R[-20]C+2 -> 50 | E308: 1000 | F308: =MOD(RC[-5]-1,3)*30+100&"|"&MOD(RC[-5]-1,3)*30+101&"|"&MOD(RC[-5]-1,3)*30+102&"|"&MOD(RC[-5]-1,3)*30+103&"|"&IF(MOD(RC[-5],4)=0,HLOOKUP(Sheet1!R2C10,Sheet1!R2C10:R7C10,MOD(RC[-5]/4-1,6)+1,FALSE),IF(MOD(RC[-5],2)=0,IF(RC[-5]>20,HLOOKUP(Sheet1!R2C7,Sheet1!R2C7:R43C7,MOD(RC[-5]/2-1,42)+1,FALSE),HLOOKUP(Sheet1!R2C4,Sheet1!R2C4:R7C4,MOD(RC[-5]-1,6)+1,FALSE)),MOD(RC[-5]-1,3)*30+104)) -> 130|131|132|133|152 | G308: =HLOOKUP(Sheet1!R2C1,Sheet1!R2C1:R16C1,MOD(RC1-1,2)+MOD(INT((RC1-1)/2),3)*5+1,FALSE)&"|"&HLOOKUP(Sheet1!R2C1,Sheet1!R2C1:R16C1,MOD(RC1,2)+MOD(INT((RC1)/2),3)*5+1,FALSE)&"|"&HLOOKUP(Sheet1!R2C1,Sheet1!R2C1:R16C1,MOD(RC1+1,2)+MOD(INT((RC1+1)/2),3)*5+1,FALSE)&"|"&HLOOKUP(Sheet1!R2C1,Sheet1!R2C1:R16C1,MOD(RC1+2,2)+MOD(INT((RC1+2)/2),3)*5+1,FALSE)&"|"&HLOOKUP(Sheet1!R2C1,Sheet1!R2C1:R16C1,MOD(RC1+3,2)+MOD(INT((RC1+3)/2),3)*5+1,FALSE) -> 101|130|131|160|161 | H308: =HLOOKUP(Sheet1!R2C1,Sheet1!R2C1:R16C1,MOD(RC1+2,2)+MOD(INT((RC1+2)/2),3)*5+1,FALSE)&"|"&HLOOKUP(Sheet1!R2C1,Sheet1!R2C1:R16C1,MOD(RC1+3,2)+MOD(INT((RC1+3)/2),3)*5+1,FALSE)&"|"&HLOOKUP(Sheet1!R2C1,Sheet1!R2C1:R16C1,MOD(RC1+4,2)+MOD(INT((RC1+4)/2),3)*5+1,FALSE)&"|"&HLOOKUP(Sheet1!R2C1,Sheet1!R2C1:R16C1,MOD(RC1+5,2)+MOD(INT((RC1+5)/2),3)*5+1,FALSE)&"|"&HLOOKUP(Sheet1!R2C1,Sheet1!R2C1:R16C1,MOD(RC1+6,2)+MOD(INT((RC1+6)/2),3)*5+1,FALSE) -> 160|161|100|101|130 | I308: =HLOOKUP(Sheet1!R2C1,Sheet1!R2C1:R16C1,MOD(RC1-1,3)+MOD(INT((RC1-1)/3),3)*5+3,FALSE)&"|"&HLOOKUP(Sheet1!R2C1,Sheet1!R2C1:R16C1,MOD(RC1,3)+MOD(INT((RC1)/3),3)*5+3,FALSE)&"|"&HLOOKUP(Sheet1!R2C1,Sheet1!R2C1:R16C1,MOD(RC1+1,3)+MOD(INT((RC1+1)/3),3)*5+3,FALSE)&"|"&HLOOKUP(Sheet1!R2C1,Sheet1!R2C1:R16C1,MOD(RC1+2,3)+MOD(INT((RC1+2)/3),3)*5+3,FALSE)&"|"&HLOOKUP(Sheet1!R2C1,Sheet1!R2C1:R16C1,MOD(RC1+3,3)+MOD(INT((RC1+3)/3),3)*5+3,FALSE) -> 133|134|162|163|164 | J308: =HLOOKUP(Sheet1!R2C1,Sheet1!R2C1:R16C1,MOD(RC1-1,3)+MOD(INT((RC1-1)/3),3)*5+3,FALSE)&"|"&HLOOKUP(Sheet1!R2C1,Sheet1!R2C1:R16C1,MOD(RC1,3)+MOD(INT((RC1)/3),3)*5+3,FALSE)&"|"&HLOOKUP(Sheet1!R2C1,Sheet1!R2C1:R16C1,MOD(RC1+1,3)+MOD(INT((RC1+1)/3),3)*5+3,FALSE)&"|"&HLOOKUP(Sheet1!R2C1,Sheet1!R2C1:R16C1,MOD(RC1+2,3)+MOD(INT((RC1+2)/3),3)*5+3,FALSE)&"|"&HLOOKUP(Sheet1!R2C1,Sheet1!R2C1:R16C1,MOD(RC1+3,3)+MOD(INT((RC1+3)/3),3)*5+3,FALSE) -> 133|134|162|163|164 | K308: =HLOOKUP(Sheet1!R2C1,Sheet1!R2C1:R16C1,MOD(RC1-1,3)+MOD(INT((RC1-1)/3),3)*5+3,FALSE)&"|"&HLOOKUP(Sheet1!R2C1,Sheet1!R2C1:R16C1,MOD(RC1,3)+MOD(INT((RC1)/3),3)*5+3,FALSE)&"|"&HLOOKUP(Sheet1!R2C1,Sheet1!R2C1:R16C1,MOD(RC1+1,3)+MOD(INT((RC1+1)/3),3)*5+3,FALSE)&"|"&HLOOKUP(Sheet1!R2C1,Sheet1!R2C1:R16C1,MOD(RC1+2,3)+MOD(INT((RC1+2)/3),3)*5+3,FALSE)&"|"&HLOOKUP(Sheet1!R2C1,Sheet1!R2C1:R16C1,MOD(RC1+3,3)+MOD(INT((RC1+3)/3),3)*5+3,FALSE) -> 133|134|162|163|164 | L308: 25|22|23|24 | M308: 2758903|2758903|2758903|2758903 | N308: 10030|10031|10032|10033 | O308: 1|1|1|1 | P308: 2500|2500|2500|2500
A309: 303 | B309: 301 | C309: 30 | D309: =R[-20]C+2 -> 50 | E309: 1000 | F309: =MOD(RC[-5]-1,3)*30+100&"|"&MOD(RC[-5]-1,3)*30+101&"|"&MOD(RC[-5]-1,3)*30+102&"|"&MOD(RC[-5]-1,3)*30+103&"|"&IF(MOD(RC[-5],4)=0,HLOOKUP(Sheet1!R2C10,Sheet1!R2C10:R7C10,MOD(RC[-5]/4-1,6)+1,FALSE),IF(MOD(RC[-5],2)=0,IF(RC[-5]>20,HLOOKUP(Sheet1!R2C7,Sheet1!R2C7:R43C7,MOD(RC[-5]/2-1,42)+1,FALSE),HLOOKUP(Sheet1!R2C4,Sheet1!R2C4:R7C4,MOD(RC[-5]-1,6)+1,FALSE)),MOD(RC[-5]-1,3)*30+104)) -> 160|161|162|163|164 | G309: =HLOOKUP(Sheet1!R2C1,Sheet1!R2C1:R16C1,MOD(RC1-1,2)+MOD(INT((RC1-1)/2),3)*5+1,FALSE)&"|"&HLOOKUP(Sheet1!R2C1,Sheet1!R2C1:R16C1,MOD(RC1,2)+MOD(INT((RC1)/2),3)*5+1,FALSE)&"|"&HLOOKUP(Sheet1!R2C1,Sheet1!R2C1:R16C1,MOD(RC1+1,2)+MOD(INT((RC1+1)/2),3)*5+1,FALSE)&"|"&HLOOKUP(Sheet1!R2C1,Sheet1!R2C1:R16C1,MOD(RC1+2,2)+MOD(INT((RC1+2)/2),3)*5+1,FALSE)&"|"&HLOOKUP(Sheet1!R2C1,Sheet1!R2C1:R16C1,MOD(RC1+3,2)+MOD(INT((RC1+3)/2),3)*5+1,FALSE) -> 130|131|160|161|100 | H309: =HLOOKUP(Sheet1!R2C1,Sheet1!R2C1:R16C1,MOD(RC1+2,2)+MOD(INT((RC1+2)/2),3)*5+1,FALSE)&"|"&HLOOKUP(Sheet1!R2C1,Sheet1!R2C1:R16C1,MOD(RC1+3,2)+MOD(INT((RC1+3)/2),3)*5+1,FALSE)&"|"&HLOOKUP(Sheet1!R2C1,Sheet1!R2C1:R16C1,MOD(RC1+4,2)+MOD(INT((RC1+4)/2),3)*5+1,FALSE)&"|"&HLOOKUP(Sheet1!R2C1,Sheet1!R2C1:R16C1,MOD(RC1+5,2)+MOD(INT((RC1+5)/2),3)*5+1,FALSE)&"|"&HLOOKUP(Sheet1!R2C1,Sheet1!R2C1:R16C1,MOD(RC1+6,2)+MOD(INT((RC1+6)/2),3)*5+1,FALSE) -> 161|100|101|130|131 | I309: =HLOOKUP(Sheet1!R2C1,Sheet1!R2C1:R16C1,MOD(RC1-1,3)+MOD(INT((RC1-1)/3),3)*5+3,FALSE)&"|"&HLOOKUP(Sheet1!R2C1,Sheet1!R2C1:R16C1,MOD(RC1,3)+MOD(INT((RC1)/3),3)*5+3,FALSE)&"|"&HLOOKUP(Sheet1!R2C1,Sheet1!R2C1:R16C1,MOD(RC1+1,3)+MOD(INT((RC1+1)/3),3)*5+3,FALSE)&"|"&HLOOKUP(Sheet1!R2C1,Sheet1!R2C1:R16C1,MOD(RC1+2,3)+MOD(INT((RC1+2)/3),3)*5+3,FALSE)&"|"&HLOOKUP(Sheet1!R2C1,Sheet1!R2C1:R16C1,MOD(RC1+3,3)+MOD(INT((RC1+3)/3),3)*5+3,FALSE) -> 134|162|163|164|102 | J309: =HLOOKUP(Sheet1!R2C1,Sheet1!R2C1:R16C1,MOD(RC1-1,3)+MOD(INT((RC1-1)/3),3)*5+3,FALSE)&"|"&HLOOKUP(Sheet1!R2C1,Sheet1!R2C1:R16C1,MOD(RC1,3)+MOD(INT((RC1)/3),3)*5+3,FALSE)&"|"&HLOOKUP(Sheet1!R2C1,Sheet1!R2C1:R16C1,MOD(RC1+1,3)+MOD(INT((RC1+1)/3),3)*5+3,FALSE)&"|"&HLOOKUP(Sheet1!R2C1,Sheet1!R2C1:R16C1,MOD(RC1+2,3)+MOD(INT((RC1+2)/3),3)*5+3,FALSE)&"|"&HLOOKUP(Sheet1!R2C1,Sheet1!R2C1:R16C1,MOD(RC1+3,3)+MOD(INT((RC1+3)/3),3)*5+3,FALSE) -> 134|162|163|164|102 | K309: =HLOOKUP(Sheet1!R2C1,Sheet1!R2C1:R16C1,MOD(RC1-1,3)+MOD(INT((RC1-1)/3),3)*5+3,FALSE)&"|"&HLOOKUP(Sheet1!R2C1,Sheet1!R2C1:R16C1,MOD(RC1,3)+MOD(INT((RC1)/3),3)*5+3,FALSE)&"|"&HLOOKUP(Sheet1!R2C1,Sheet1!R2C1:R16C1,MOD(RC1+1,3)+MOD(INT((RC1+1)/3),3)*5+3,FALSE)&"|"&HLOOKUP(Sheet1!R2C1,Sheet1!R2C1:R16C1,MOD(RC1+2,3)+MOD(INT((RC1+2)/3),3)*5+3,FALSE)&"|"&HLOOKUP(Sheet1!R2C1,Sheet1!R2C1:R16C1,MOD(RC1+3,3)+MOD(INT((RC1+3)/3),3)*5+3,FALSE) -> 134|162|163|164|102 | L309: 25|22|23|24 | M309: 2784389|2784389|2784390|2784390 | N309: 10030|10031|10032|10033 | O309: 1|1|1|1 | P309: 2500|2500|2500|2500
A310: 304 | B310: 302 | C310: 30 | D310: =R[-20]C+2 -> 50 | E310: 1000 | F310: =MOD(RC[-5]-1,3)*30+100&"|"&MOD(RC[-5]-1,3)*30+101&"|"&MOD(RC[-5]-1,3)*30+102&"|"&MOD(RC[-5]-1,3)*30+103&"|"&IF(MOD(RC[-5],4)=0,HLOOKUP(Sheet1!R2C10,Sheet1!R2C10:R7C10,MOD(RC[-5]/4-1,6)+1,FALSE),IF(MOD(RC[-5],2)=0,IF(RC[-5]>20,HLOOKUP(Sheet1!R2C7,Sheet1!R2C7:R43C7,MOD(RC[-5]/2-1,42)+1,FALSE),HLOOKUP(Sheet1!R2C4,Sheet1!R2C4:R7C4,MOD(RC[-5]-1,6)+1,FALSE)),MOD(RC[-5]-1,3)*30+104)) -> 100|101|102|103|193 | G310: =HLOOKUP(Sheet1!R2C1,Sheet1!R2C1:R16C1,MOD(RC1-1,2)+MOD(INT((RC1-1)/2),3)*5+1,FALSE)&"|"&HLOOKUP(Sheet1!R2C1,Sheet1!R2C1:R16C1,MOD(RC1,2)+MOD(INT((RC1)/2),3)*5+1,FALSE)&"|"&HLOOKUP(Sheet1!R2C1,Sheet1!R2C1:R16C1,MOD(RC1+1,2)+MOD(INT((RC1+1)/2),3)*5+1,FALSE)&"|"&HLOOKUP(Sheet1!R2C1,Sheet1!R2C1:R16C1,MOD(RC1+2,2)+MOD(INT((RC1+2)/2),3)*5+1,FALSE)&"|"&HLOOKUP(Sheet1!R2C1,Sheet1!R2C1:R16C1,MOD(RC1+3,2)+MOD(INT((RC1+3)/2),3)*5+1,FALSE) -> 131|160|161|100|101 | H310: =HLOOKUP(Sheet1!R2C1,Sheet1!R2C1:R16C1,MOD(RC1+2,2)+MOD(INT((RC1+2)/2),3)*5+1,FALSE)&"|"&HLOOKUP(Sheet1!R2C1,Sheet1!R2C1:R16C1,MOD(RC1+3,2)+MOD(INT((RC1+3)/2),3)*5+1,FALSE)&"|"&HLOOKUP(Sheet1!R2C1,Sheet1!R2C1:R16C1,MOD(RC1+4,2)+MOD(INT((RC1+4)/2),3)*5+1,FALSE)&"|"&HLOOKUP(Sheet1!R2C1,Sheet1!R2C1:R16C1,MOD(RC1+5,2)+MOD(INT((RC1+5)/2),3)*5+1,FALSE)&"|"&HLOOKUP(Sheet1!R2C1,Sheet1!R2C1:R16C1,MOD(RC1+6,2)+MOD(INT((RC1+6)/2),3)*5+1,FALSE) -> 100|101|130|131|160 | I310: =HLOOKUP(Sheet1!R2C1,Sheet1!R2C1:R16C1,MOD(RC1-1,3)+MOD(INT((RC1-1)/3),3)*5+3,FALSE)&"|"&HLOOKUP(Sheet1!R2C1,Sheet1!R2C1:R16C1,MOD(RC1,3)+MOD(INT((RC1)/3),3)*5+3,FALSE)&"|"&HLOOKUP(Sheet1!R2C1,Sheet1!R2C1:R16C1,MOD(RC1+1,3)+MOD(INT((RC1+1)/3),3)*5+3,FALSE)&"|"&HLOOKUP(Sheet1!R2C1,Sheet1!R2C1:R16C1,MOD(RC1+2,3)+MOD(INT((RC1+2)/3),3)*5+3,FALSE)&"|"&HLOOKUP(Sheet1!R2C1,Sheet1!R2C1:R16C1,MOD(RC1+3,3)+MOD(INT((RC1+3)/3),3)*5+3,FALSE) -> 162|163|164|102|103 | J310: =HLOOKUP(Sheet1!R2C1,Sheet1!R2C1:R16C1,MOD(RC1-1,3)+MOD(INT((RC1-1)/3),3)*5+3,FALSE)&"|"&HLOOKUP(Sheet1!R2C1,Sheet1!R2C1:R16C1,MOD(RC1,3)+MOD(INT((RC1)/3),3)*5+3,FALSE)&"|"&HLOOKUP(Sheet1!R2C1,Sheet1!R2C1:R16C1,MOD(RC1+1,3)+MOD(INT((RC1+1)/3),3)*5+3,FALSE)&"|"&HLOOKUP(Sheet1!R2C1,Sheet1!R2C1:R16C1,MOD(RC1+2,3)+MOD(INT((RC1+2)/3),3)*5+3,FALSE)&"|"&HLOOKUP(Sheet1!R2C1,Sheet1!R2C1:R16C1,MOD(RC1+3,3)+MOD(INT((RC1+3)/3),3)*5+3,FALSE) -> 162|163|164|102|103 | K310: =HLOOKUP(Sheet1!R2C1,Sheet1!R2C1:R16C1,MOD(RC1-1,3)+MOD(INT((RC1-1)/3),3)*5+3,FALSE)&"|"&HLOOKUP(Sheet1!R2C1,Sheet1!R2C1:R16C1,MOD(RC1,3)+MOD(INT((RC1)/3),3)*5+3,FALSE)&"|"&HLOOKUP(Sheet1!R2C1,Sheet1!R2C1:R16C1,MOD(RC1+1,3)+MOD(INT((RC1+1)/3),3)*5+3,FALSE)&"|"&HLOOKUP(Sheet1!R2C1,Sheet1!R2C1:R16C1,MOD(RC1+2,3)+MOD(INT((RC1+2)/3),3)*5+3,FALSE)&"|"&HLOOKUP(Sheet1!R2C1,Sheet1!R2C1:R16C1,MOD(RC1+3,3)+MOD(INT((RC1+3)/3),3)*5+3,FALSE) -> 162|163|164|102|103 | L310: 25|22|23|24 | M310: 2808894|2808895|2808895|2808895 | N310: 10030|10031|10032|10033 | O310: 1|1|1|1 | P310: 2500|2500|2500|2500
A311: 305 | B311: 303 | C311: 30 | D311: =R[-20]C+2 -> 50 | E311: 1000 | F311: =MOD(RC[-5]-1,3)*30+100&"|"&MOD(RC[-5]-1,3)*30+101&"|"&MOD(RC[-5]-1,3)*30+102&"|"&MOD(RC[-5]-1,3)*30+103&"|"&IF(MOD(RC[-5],4)=0,HLOOKUP(Sheet1!R2C10,Sheet1!R2C10:R7C10,MOD(RC[-5]/4-1,6)+1,FALSE),IF(MOD(RC[-5],2)=0,IF(RC[-5]>20,HLOOKUP(Sheet1!R2C7,Sheet1!R2C7:R43C7,MOD(RC[-5]/2-1,42)+1,FALSE),HLOOKUP(Sheet1!R2C4,Sheet1!R2C4:R7C4,MOD(RC[-5]-1,6)+1,FALSE)),MOD(RC[-5]-1,3)*30+104)) -> 130|131|132|133|134 | G311: =HLOOKUP(Sheet1!R2C1,Sheet1!R2C1:R16C1,MOD(RC1-1,2)+MOD(INT((RC1-1)/2),3)*5+1,FALSE)&"|"&HLOOKUP(Sheet1!R2C1,Sheet1!R2C1:R16C1,MOD(RC1,2)+MOD(INT((RC1)/2),3)*5+1,FALSE)&"|"&HLOOKUP(Sheet1!R2C1,Sheet1!R2C1:R16C1,MOD(RC1+1,2)+MOD(INT((RC1+1)/2),3)*5+1,FALSE)&"|"&HLOOKUP(Sheet1!R2C1,Sheet1!R2C1:R16C1,MOD(RC1+2,2)+MOD(INT((RC1+2)/2),3)*5+1,FALSE)&"|"&HLOOKUP(Sheet1!R2C1,Sheet1!R2C1:R16C1,MOD(RC1+3,2)+MOD(INT((RC1+3)/2),3)*5+1,FALSE) -> 160|161|100|101|130 | H311: =HLOOKUP(Sheet1!R2C1,Sheet1!R2C1:R16C1,MOD(RC1+2,2)+MOD(INT((RC1+2)/2),3)*5+1,FALSE)&"|"&HLOOKUP(Sheet1!R2C1,Sheet1!R2C1:R16C1,MOD(RC1+3,2)+MOD(INT((RC1+3)/2),3)*5+1,FALSE)&"|"&HLOOKUP(Sheet1!R2C1,Sheet1!R2C1:R16C1,MOD(RC1+4,2)+MOD(INT((RC1+4)/2),3)*5+1,FALSE)&"|"&HLOOKUP(Sheet1!R2C1,Sheet1!R2C1:R16C1,MOD(RC1+5,2)+MOD(INT((RC1+5)/2),3)*5+1,FALSE)&"|"&HLOOKUP(Sheet1!R2C1,Sheet1!R2C1:R16C1,MOD(RC1+6,2)+MOD(INT((RC1+6)/2),3)*5+1,FALSE) -> 101|130|131|160|161 | I311: =HLOOKUP(Sheet1!R2C1,Sheet1!R2C1:R16C1,MOD(RC1-1,3)+MOD(INT((RC1-1)/3),3)*5+3,FALSE)&"|"&HLOOKUP(Sheet1!R2C1,Sheet1!R2C1:R16C1,MOD(RC1,3)+MOD(INT((RC1)/3),3)*5+3,FALSE)&"|"&HLOOKUP(Sheet1!R2C1,Sheet1!R2C1:R16C1,MOD(RC1+1,3)+MOD(INT((RC1+1)/3),3)*5+3,FALSE)&"|"&HLOOKUP(Sheet1!R2C1,Sheet1!R2C1:R16C1,MOD(RC1+2,3)+MOD(INT((RC1+2)/3),3)*5+3,FALSE)&"|"&HLOOKUP(Sheet1!R2C1,Sheet1!R2C1:R16C1,MOD(RC1+3,3)+MOD(INT((RC1+3)/3),3)*5+3,FALSE) -> 163|164|102|103|104 | J311: =HLOOKUP(Sheet1!R2C1,Sheet1!R2C1:R16C1,MOD(RC1-1,3)+MOD(INT((RC1-1)/3),3)*5+3,FALSE)&"|"&HLOOKUP(Sheet1!R2C1,Sheet1!R2C1:R16C1,MOD(RC1,3)+MOD(INT((RC1)/3),3)*5+3,FALSE)&"|"&HLOOKUP(Sheet1!R2C1,Sheet1!R2C1:R16C1,MOD(RC1+1,3)+MOD(INT((RC1+1)/3),3)*5+3,FALSE)&"|"&HLOOKUP(Sheet1!R2C1,Sheet1!R2C1:R16C1,MOD(RC1+2,3)+MOD(INT((RC1+2)/3),3)*5+3,FALSE)&"|"&HLOOKUP(Sheet1!R2C1,Sheet1!R2C1:R16C1,MOD(RC1+3,3)+MOD(INT((RC1+3)/3),3)*5+3,FALSE) -> 163|164|102|103|104 | K311: =HLOOKUP(Sheet1!R2C1,Sheet1!R2C1:R16C1,MOD(RC1-1,3)+MOD(INT((RC1-1)/3),3)*5+3,FALSE)&"|"&HLOOKUP(Sheet1!R2C1,Sheet1!R2C1:R16C1,MOD(RC1,3)+MOD(INT((RC1)/3),3)*5+3,FALSE)&"|"&HLOOKUP(Sheet1!R2C1,Sheet1!R2C1:R16C1,MOD(RC1+1,3)+MOD(INT((RC1+1)/3),3)*5+3,FALSE)&"|"&HLOOKUP(Sheet1!R2C1,Sheet1!R2C1:R16C1,MOD(RC1+2,3)+MOD(INT((RC1+2)/3),3)*5+3,FALSE)&"|"&HLOOKUP(Sheet1!R2C1,Sheet1!R2C1:R16C1,MOD(RC1+3,3)+MOD(INT((RC1+3)/3),3)*5+3,FALSE) -> 163|164|102|103|104 | L311: 25|22|23|24 | M311: 2834915|2834915|2834915|2834915 | N311: 10030|10031|10032|10033|10030|10031|10032|10033|10030|10031|10032|10033|10030|10031|10032|10033|10030|10031|10032|10033|10030|10031|10032|10033|10030|10031|10032|10033|10030|10031|10032|10033|10030|10031|10032|10033|10030|10031|10032|10033 | O311: 1|1|1|1|1|1|1|1|1|1|1|1|1|1|1|1|1|1|1|1|1|1|1|1|1|1|1|1|1|1|1|1|1|1|1|1|1|1|1|1 | P311: 2500|2500|2500|2500|2500|2500|2500|2500|2500|2500|2500|2500|2500|2500|2500|2500|2500|2500|2500|2500|2500|2500|2500|2500|2500|2500|2500|2500|2500|2500|2500|2500|2500|2500|2500|2500|2500|2500|2500|2500
A312: 306 | B312: 304 | C312: 30 | D312: =R[-20]C+2 -> 50 | E312: 1000 | F312: =MOD(RC[-5]-1,3)*30+100&"|"&MOD(RC[-5]-1,3)*30+101&"|"&MOD(RC[-5]-1,3)*30+102&"|"&MOD(RC[-5]-1,3)*30+103&"|"&IF(MOD(RC[-5],4)=0,HLOOKUP(Sheet1!R2C10,Sheet1!R2C10:R7C10,MOD(RC[-5]/4-1,6)+1,FALSE),IF(MOD(RC[-5],2)=0,IF(RC[-5]>20,HLOOKUP(Sheet1!R2C7,Sheet1!R2C7:R43C7,MOD(RC[-5]/2-1,42)+1,FALSE),HLOOKUP(Sheet1!R2C4,Sheet1!R2C4:R7C4,MOD(RC[-5]-1,6)+1,FALSE)),MOD(RC[-5]-1,3)*30+104)) -> 160|161|162|163|154 | G312: =HLOOKUP(Sheet1!R2C1,Sheet1!R2C1:R16C1,MOD(RC1-1,2)+MOD(INT((RC1-1)/2),3)*5+1,FALSE)&"|"&HLOOKUP(Sheet1!R2C1,Sheet1!R2C1:R16C1,MOD(RC1,2)+MOD(INT((RC1)/2),3)*5+1,FALSE)&"|"&HLOOKUP(Sheet1!R2C1,Sheet1!R2C1:R16C1,MOD(RC1+1,2)+MOD(INT((RC1+1)/2),3)*5+1,FALSE)&"|"&HLOOKUP(Sheet1!R2C1,Sheet1!R2C1:R16C1,MOD(RC1+2,2)+MOD(INT((RC1+2)/2),3)*5+1,FALSE)&"|"&HLOOKUP(Sheet1!R2C1,Sheet1!R2C1:R16C1,MOD(RC1+3,2)+MOD(INT((RC1+3)/2),3)*5+1,FALSE) -> 161|100|101|130|131 | H312: =HLOOKUP(Sheet1!R2C1,Sheet1!R2C1:R16C1,MOD(RC1+2,2)+MOD(INT((RC1+2)/2),3)*5+1,FALSE)&"|"&HLOOKUP(Sheet1!R2C1,Sheet1!R2C1:R16C1,MOD(RC1+3,2)+MOD(INT((RC1+3)/2),3)*5+1,FALSE)&"|"&HLOOKUP(Sheet1!R2C1,Sheet1!R2C1:R16C1,MOD(RC1+4,2)+MOD(INT((RC1+4)/2),3)*5+1,FALSE)&"|"&HLOOKUP(Sheet1!R2C1,Sheet1!R2C1:R16C1,MOD(RC1+5,2)+MOD(INT((RC1+5)/2),3)*5+1,FALSE)&"|"&HLOOKUP(Sheet1!R2C1,Sheet1!R2C1:R16C1,MOD(RC1+6,2)+MOD(INT((RC1+6)/2),3)*5+1,FALSE) -> 130|131|160|161|100 | I312: =HLOOKUP(Sheet1!R2C1,Sheet1!R2C1:R16C1,MOD(RC1-1,3)+MOD(INT((RC1-1)/3),3)*5+3,FALSE)&"|"&HLOOKUP(Sheet1!R2C1,Sheet1!R2C1:R16C1,MOD(RC1,3)+MOD(INT((RC1)/3),3)*5+3,FALSE)&"|"&HLOOKUP(Sheet1!R2C1,Sheet1!R2C1:R16C1,MOD(RC1+1,3)+MOD(INT((RC1+1)/3),3)*5+3,FALSE)&"|"&HLOOKUP(Sheet1!R2C1,Sheet1!R2C1:R16C1,MOD(RC1+2,3)+MOD(INT((RC1+2)/3),3)*5+3,FALSE)&"|"&HLOOKUP(Sheet1!R2C1,Sheet1!R2C1:R16C1,MOD(RC1+3,3)+MOD(INT((RC1+3)/3),3)*5+3,FALSE) -> 164|102|103|104|132 | J312: =HLOOKUP(Sheet1!R2C1,Sheet1!R2C1:R16C1,MOD(RC1-1,3)+MOD(INT((RC1-1)/3),3)*5+3,FALSE)&"|"&HLOOKUP(Sheet1!R2C1,Sheet1!R2C1:R16C1,MOD(RC1,3)+MOD(INT((RC1)/3),3)*5+3,FALSE)&"|"&HLOOKUP(Sheet1!R2C1,Sheet1!R2C1:R16C1,MOD(RC1+1,3)+MOD(INT((RC1+1)/3),3)*5+3,FALSE)&"|"&HLOOKUP(Sheet1!R2C1,Sheet1!R2C1:R16C1,MOD(RC1+2,3)+MOD(INT((RC1+2)/3),3)*5+3,FALSE)&"|"&HLOOKUP(Sheet1!R2C1,Sheet1!R2C1:R16C1,MOD(RC1+3,3)+MOD(INT((RC1+3)/3),3)*5+3,FALSE) -> 164|102|103|104|132 | K312: =HLOOKUP(Sheet1!R2C1,Sheet1!R2C1:R16C1,MOD(RC1-1,3)+MOD(INT((RC1-1)/3),3)*5+3,FALSE)&"|"&HLOOKUP(Sheet1!R2C1,Sheet1!R2C1:R16C1,MOD(RC1,3)+MOD(INT((RC1)/3),3)*5+3,FALSE)&"|"&HLOOKUP(Sheet1!R2C1,Sheet1!R2C1:R16C1,MOD(RC1+1,3)+MOD(INT((RC1+1)/3),3)*5+3,FALSE)&"|"&HLOOKUP(Sheet1!R2C1,Sheet1!R2C1:R16C1,MOD(RC1+2,3)+MOD(INT((RC1+2)/3),3)*5+3,FALSE)&"|"&HLOOKUP(Sheet1!R2C1,Sheet1!R2C1:R16C1,MOD(RC1+3,3)+MOD(INT((RC1+3)/3),3)*5+3,FALSE) -> 164|102|103|104|132 | L312: 25|22|23|24 | M312: 2860313|2860313|2860313|2860313 | N312: 10030|10031|10032|10033 | O312: 1|1|1|1 | P312: 2500|2500|2500|2500
A313: 307 | B313: 305 | C313: 30 | D313: =R[-20]C+2 -> 50 | E313: 1000 | F313: =MOD(RC[-5]-1,3)*30+100&"|"&MOD(RC[-5]-1,3)*30+101&"|"&MOD(RC[-5]-1,3)*30+102&"|"&MOD(RC[-5]-1,3)*30+103&"|"&IF(MOD(RC[-5],4)=0,HLOOKUP(Sheet1!R2C10,Sheet1!R2C10:R7C10,MOD(RC[-5]/4-1,6)+1,FALSE),IF(MOD(RC[-5],2)=0,IF(RC[-5]>20,HLOOKUP(Sheet1!R2C7,Sheet1!R2C7:R43C7,MOD(RC[-5]/2-1,42)+1,FALSE),HLOOKUP(Sheet1!R2C4,Sheet1!R2C4:R7C4,MOD(RC[-5]-1,6)+1,FALSE)),MOD(RC[-5]-1,3)*30+104)) -> 100|101|102|103|104 | G313: =HLOOKUP(Sheet1!R2C1,Sheet1!R2C1:R16C1,MOD(RC1-1,2)+MOD(INT((RC1-1)/2),3)*5+1,FALSE)&"|"&HLOOKUP(Sheet1!R2C1,Sheet1!R2C1:R16C1,MOD(RC1,2)+MOD(INT((RC1)/2),3)*5+1,FALSE)&"|"&HLOOKUP(Sheet1!R2C1,Sheet1!R2C1:R16C1,MOD(RC1+1,2)+MOD(INT((RC1+1)/2),3)*5+1,FALSE)&"|"&HLOOKUP(Sheet1!R2C1,Sheet1!R2C1:R16C1,MOD(RC1+2,2)+MOD(INT((RC1+2)/2),3)*5+1,FALSE)&"|"&HLOOKUP(Sheet1!R2C1,Sheet1!R2C1:R16C1,MOD(RC1+3,2)+MOD(INT((RC1+3)/2),3)*5+1,FALSE) -> 100|101|130|131|160 | H313: =HLOOKUP(Sheet1!R2C1,Sheet1!R2C1:R16C1,MOD(RC1+2,2)+MOD(INT((RC1+2)/2),3)*5+1,FALSE)&"|"&HLOOKUP(Sheet1!R2C1,Sheet1!R2C1:R16C1,MOD(RC1+3,2)+MOD(INT((RC1+3)/2),3)*5+1,FALSE)&"|"&HLOOKUP(Sheet1!R2C1,Sheet1!R2C1:R16C1,MOD(RC1+4,2)+MOD(INT((RC1+4)/2),3)*5+1,FALSE)&"|"&HLOOKUP(Sheet1!R2C1,Sheet1!R2C1:R16C1,MOD(RC1+5,2)+MOD(INT((RC1+5)/2),3)*5+1,FALSE)&"|"&HLOOKUP(Sheet1!R2C1,Sheet1!R2C1:R16C1,MOD(RC1+6,2)+MOD(INT((RC1+6)/2),3)*5+1,FALSE) -> 131|160|161|100|101 | I313: =HLOOKUP(Sheet1!R2C1,Sheet1!R2C1:R16C1,MOD(RC1-1,3)+MOD(INT((RC1-1)/3),3)*5+3,FALSE)&"|"&HLOOKUP(Sheet1!R2C1,Sheet1!R2C1:R16C1,MOD(RC1,3)+MOD(INT((RC1)/3),3)*5+3,FALSE)&"|"&HLOOKUP(Sheet1!R2C1,Sheet1!R2C1:R16C1,MOD(RC1+1,3)+MOD(INT((RC1+1)/3),3)*5+3,FALSE)&"|"&HLOOKUP(Sheet1!R2C1,Sheet1!R2C1:R16C1,MOD(RC1+2,3)+MOD(INT((RC1+2)/3),3)*5+3,FALSE)&"|"&HLOOKUP(Sheet1!R2C1,Sheet1!R2C1:R16C1,MOD(RC1+3,3)+MOD(INT((RC1+3)/3),3)*5+3,FALSE) -> 102|103|104|132|133 | J313: =HLOOKUP(Sheet1!R2C1,Sheet1!R2C1:R16C1,MOD(RC1-1,3)+MOD(INT((RC1-1)/3),3)*5+3,FALSE)&"|"&HLOOKUP(Sheet1!R2C1,Sheet1!R2C1:R16C1,MOD(RC1,3)+MOD(INT((RC1)/3),3)*5+3,FALSE)&"|"&HLOOKUP(Sheet1!R2C1,Sheet1!R2C1:R16C1,MOD(RC1+1,3)+MOD(INT((RC1+1)/3),3)*5+3,FALSE)&"|"&HLOOKUP(Sheet1!R2C1,Sheet1!R2C1:R16C1,MOD(RC1+2,3)+MOD(INT((RC1+2)/3),3)*5+3,FALSE)&"|"&HLOOKUP(Sheet1!R2C1,Sheet1!R2C1:R16C1,MOD(RC1+3,3)+MOD(INT((RC1+3)/3),3)*5+3,FALSE) -> 102|103|104|132|133 | K313: =HLOOKUP(Sheet1!R2C1,Sheet1!R2C1:R16C1,MOD(RC1-1,3)+MOD(INT((RC1-1)/3),3)*5+3,FALSE)&"|"&HLOOKUP(Sheet1!R2C1,Sheet1!R2C1:R16C1,MOD(RC1,3)+MOD(INT((RC1)/3),3)*5+3,FALSE)&"|"&HLOOKUP(Sheet1!R2C1,Sheet1!R2C1:R16C1,MOD(RC1+1,3)+MOD(INT((RC1+1)/3),3)*5+3,FALSE)&"|"&HLOOKUP(Sheet1!R2C1,Sheet1!R2C1:R16C1,MOD(RC1+2,3)+MOD(INT((RC1+2)/3),3)*5+3,FALSE)&"|"&HLOOKUP(Sheet1!R2C1,Sheet1!R2C1:R16C1,MOD(RC1+3,3)+MOD(INT((RC1+3)/3),3)*5+3,FALSE) -> 102|103|104|132|133 | L313: 25|22|23|24 | M313: 2886726|2886726|2886725|2886725 | N313: 10030|10031|10032|10033 | O313: 1|1|1|1 | P313: 2500|2500|2500|2500
A314: 308 | B314: 306 | C314: 30 | D314: =R[-20]C+2 -> 50 | E314: 1000 | F314: =MOD(RC[-5]-1,3)*30+100&"|"&MOD(RC[-5]-1,3)*30+101&"|"&MOD(RC[-5]-1,3)*30+102&"|"&MOD(RC[-5]-1,3)*30+103&"|"&IF(MOD(RC[-5],4)=0,HLOOKUP(Sheet1!R2C10,Sheet1!R2C10:R7C10,MOD(RC[-5]/4-1,6)+1,FALSE),IF(MOD(RC[-5],2)=0,IF(RC[-5]>20,HLOOKUP(Sheet1!R2C7,Sheet1!R2C7:R43C7,MOD(RC[-5]/2-1,42)+1,FALSE),HLOOKUP(Sheet1!R2C4,Sheet1!R2C4:R7C4,MOD(RC[-5]-1,6)+1,FALSE)),MOD(RC[-5]-1,3)*30+104)) -> 130|131|132|133|194 | G314: =HLOOKUP(Sheet1!R2C1,Sheet1!R2C1:R16C1,MOD(RC1-1,2)+MOD(INT((RC1-1)/2),3)*5+1,FALSE)&"|"&HLOOKUP(Sheet1!R2C1,Sheet1!R2C1:R16C1,MOD(RC1,2)+MOD(INT((RC1)/2),3)*5+1,FALSE)&"|"&HLOOKUP(Sheet1!R2C1,Sheet1!R2C1:R16C1,MOD(RC1+1,2)+MOD(INT((RC1+1)/2),3)*5+1,FALSE)&"|"&HLOOKUP(Sheet1!R2C1,Sheet1!R2C1:R16C1,MOD(RC1+2,2)+MOD(INT((RC1+2)/2),3)*5+1,FALSE)&"|"&HLOOKUP(Sheet1!R2C1,Sheet1!R2C1:R16C1,MOD(RC1+3,2)+MOD(INT((RC1+3)/2),3)*5+1,FALSE) -> 101|130|131|160|161 | H314: =HLOOKUP(Sheet1!R2C1,Sheet1!R2C1:R16C1,MOD(RC1+2,2)+MOD(INT((RC1+2)/2),3)*5+1,FALSE)&"|"&HLOOKUP(Sheet1!R2C1,Sheet1!R2C1:R16C1,MOD(RC1+3,2)+MOD(INT((RC1+3)/2),3)*5+1,FALSE)&"|"&HLOOKUP(Sheet1!R2C1,Sheet1!R2C1:R16C1,MOD(RC1+4,2)+MOD(INT((RC1+4)/2),3)*5+1,FALSE)&"|"&HLOOKUP(Sheet1!R2C1,Sheet1!R2C1:R16C1,MOD(RC1+5,2)+MOD(INT((RC1+5)/2),3)*5+1,FALSE)&"|"&HLOOKUP(Sheet1!R2C1,Sheet1!R2C1:R16C1,MOD(RC1+6,2)+MOD(INT((RC1+6)/2),3)*5+1,FALSE) -> 160|161|100|101|130 | I314: =HLOOKUP(Sheet1!R2C1,Sheet1!R2C1:R16C1,MOD(RC1-1,3)+MOD(INT((RC1-1)/3),3)*5+3,FALSE)&"|"&HLOOKUP(Sheet1!R2C1,Sheet1!R2C1:R16C1,MOD(RC1,3)+MOD(INT((RC1)/3),3)*5+3,FALSE)&"|"&HLOOKUP(Sheet1!R2C1,Sheet1!R2C1:R16C1,MOD(RC1+1,3)+MOD(INT((RC1+1)/3),3)*5+3,FALSE)&"|"&HLOOKUP(Sheet1!R2C1,Sheet1!R2C1:R16C1,MOD(RC1+2,3)+MOD(INT((RC1+2)/3),3)*5+3,FALSE)&"|"&HLOOKUP(Sheet1!R2C1,Sheet1!R2C1:R16C1,MOD(RC1+3,3)+MOD(INT((RC1+3)/3),3)*5+3,FALSE) -> 103|104|132|133|134 | J314: =HLOOKUP(Sheet1!R2C1,Sheet1!R2C1:R16C1,MOD(RC1-1,3)+MOD(INT((RC1-1)/3),3)*5+3,FALSE)&"|"&HLOOKUP(Sheet1!R2C1,Sheet1!R2C1:R16C1,MOD(RC1,3)+MOD(INT((RC1)/3),3)*5+3,FALSE)&"|"&HLOOKUP(Sheet1!R2C1,Sheet1!R2C1:R16C1,MOD(RC1+1,3)+MOD(INT((RC1+1)/3),3)*5+3,FALSE)&"|"&HLOOKUP(Sheet1!R2C1,Sheet1!R2C1:R16C1,MOD(RC1+2,3)+MOD(INT((RC1+2)/3),3)*5+3,FALSE)&"|"&HLOOKUP(Sheet1!R2C1,Sheet1!R2C1:R16C1,MOD(RC1+3,3)+MOD(INT((RC1+3)/3),3)*5+3,FALSE) -> 103|104|132|133|134 | K314: =HLOOKUP(Sheet1!R2C1,Sheet1!R2C1:R16C1,MOD(RC1-1,3)+MOD(INT((RC1-1)/3),3)*5+3,FALSE)&"|"&HLOOKUP(Sheet1!R2C1,Sheet1!R2C1:R16C1,MOD(RC1,3)+MOD(INT((RC1)/3),3)*5+3,FALSE)&"|"&HLOOKUP(Sheet1!R2C1,Sheet1!R2C1:R16C1,MOD(RC1+1,3)+MOD(INT((RC1+1)/3),3)*5+3,FALSE)&"|"&HLOOKUP(Sheet1!R2C1,Sheet1!R2C1:R16C1,MOD(RC1+2,3)+MOD(INT((RC1+2)/3),3)*5+3,FALSE)&"|"&HLOOKUP(Sheet1!R2C1,Sheet1!R2C1:R16C1,MOD(RC1+3,3)+MOD(INT((RC1+3)/3),3)*5+3,FALSE) -> 103|104|132|133|134 | L314: 25|22|23|24 | M314: 2912123|2912124|2912123|2912123 | N314: 10030|10031|10032|10033 | O314: 1|1|1|1 | P314: 2500|2500|2500|2500
A315: 309 | B315: 307 | C315: 30 | D315: =R[-20]C+2 -> 50 | E315: 1000 | F315: =MOD(RC[-5]-1,3)*30+100&"|"&MOD(RC[-5]-1,3)*30+101&"|"&MOD(RC[-5]-1,3)*30+102&"|"&MOD(RC[-5]-1,3)*30+103&"|"&IF(MOD(RC[-5],4)=0,HLOOKUP(Sheet1!R2C10,Sheet1!R2C10:R7C10,MOD(RC[-5]/4-1,6)+1,FALSE),IF(MOD(RC[-5],2)=0,IF(RC[-5]>20,HLOOKUP(Sheet1!R2C7,Sheet1!R2C7:R43C7,MOD(RC[-5]/2-1,42)+1,FALSE),HLOOKUP(Sheet1!R2C4,Sheet1!R2C4:R7C4,MOD(RC[-5]-1,6)+1,FALSE)),MOD(RC[-5]-1,3)*30+104)) -> 160|161|162|163|164 | G315: =HLOOKUP(Sheet1!R2C1,Sheet1!R2C1:R16C1,MOD(RC1-1,2)+MOD(INT((RC1-1)/2),3)*5+1,FALSE)&"|"&HLOOKUP(Sheet1!R2C1,Sheet1!R2C1:R16C1,MOD(RC1,2)+MOD(INT((RC1)/2),3)*5+1,FALSE)&"|"&HLOOKUP(Sheet1!R2C1,Sheet1!R2C1:R16C1,MOD(RC1+1,2)+MOD(INT((RC1+1)/2),3)*5+1,FALSE)&"|"&HLOOKUP(Sheet1!R2C1,Sheet1!R2C1:R16C1,MOD(RC1+2,2)+MOD(INT((RC1+2)/2),3)*5+1,FALSE)&"|"&HLOOKUP(Sheet1!R2C1,Sheet1!R2C1:R16C1,MOD(RC1+3,2)+MOD(INT((RC1+3)/2),3)*5+1,FALSE) -> 130|131|160|161|100 | H315: =HLOOKUP(Sheet1!R2C1,Sheet1!R2C1:R16C1,MOD(RC1+2,2)+MOD(INT((RC1+2)/2),3)*5+1,FALSE)&"|"&HLOOKUP(Sheet1!R2C1,Sheet1!R2C1:R16C1,MOD(RC1+3,2)+MOD(INT((RC1+3)/2),3)*5+1,FALSE)&"|"&HLOOKUP(Sheet1!R2C1,Sheet1!R2C1:R16C1,MOD(RC1+4,2)+MOD(INT((RC1+4)/2),3)*5+1,FALSE)&"|"&HLOOKUP(Sheet1!R2C1,Sheet1!R2C1:R16C1,MOD(RC1+5,2)+MOD(INT((RC1+5)/2),3)*5+1,FALSE)&"|"&HLOOKUP(Sheet1!R2C1,Sheet1!R2C1:R16C1,MOD(RC1+6,2)+MOD(INT((RC1+6)/2),3)*5+1,FALSE) -> 161|100|101|130|131 | I315: =HLOOKUP(Sheet1!R2C1,Sheet1!R2C1:R16C1,MOD(RC1-1,3)+MOD(INT((RC1-1)/3),3)*5+3,FALSE)&"|"&HLOOKUP(Sheet1!R2C1,Sheet1!R2C1:R16C1,MOD(RC1,3)+MOD(INT((RC1)/3),3)*5+3,FALSE)&"|"&HLOOKUP(Sheet1!R2C1,Sheet1!R2C1:R16C1,MOD(RC1+1,3)+MOD(INT((RC1+1)/3),3)*5+3,FALSE)&"|"&HLOOKUP(Sheet1!R2C1,Sheet1!R2C1:R16C1,MOD(RC1+2,3)+MOD(INT((RC1+2)/3),3)*5+3,FALSE)&"|"&HLOOKUP(Sheet1!R2C1,Sheet1!R2C1:R16C1,MOD(RC1+3,3)+MOD(INT((RC1+3)/3),3)*5+3,FALSE) -> 104|132|133|134|162 | J315: =HLOOKUP(Sheet1!R2C1,Sheet1!R2C1:R16C1,MOD(RC1-1,3)+MOD(INT((RC1-1)/3),3)*5+3,FALSE)&"|"&HLOOKUP(Sheet1!R2C1,Sheet1!R2C1:R16C1,MOD(RC1,3)+MOD(INT((RC1)/3),3)*5+3,FALSE)&"|"&HLOOKUP(Sheet1!R2C1,Sheet1!R2C1:R16C1,MOD(RC1+1,3)+MOD(INT((RC1+1)/3),3)*5+3,FALSE)&"|"&HLOOKUP(Sheet1!R2C1,Sheet1!R2C1:R16C1,MOD(RC1+2,3)+MOD(INT((RC1+2)/3),3)*5+3,FALSE)&"|"&HLOOKUP(Sheet1!R2C1,Sheet1!R2C1:R16C1,MOD(RC1+3,3)+MOD(INT((RC1+3)/3),3)*5+3,FALSE) -> 104|132|133|134|162 | K315: =HLOOKUP(Sheet1!R2C1,Sheet1!R2C1:R16C1,MOD(RC1-1,3)+MOD(INT((RC1-1)/3),3)*5+3,FALSE)&"|"&HLOOKUP(Sheet1!R2C1,Sheet1!R2C1:R16C1,MOD(RC1,3)+MOD(INT((RC1)/3),3)*5+3,FALSE)&"|"&HLOOKUP(Sheet1!R2C1,Sheet1!R2C1:R16C1,MOD(RC1+1,3)+MOD(INT((RC1+1)/3),3)*5+3,FALSE)&"|"&HLOOKUP(Sheet1!R2C1,Sheet1!R2C1:R16C1,MOD(RC1+2,3)+MOD(INT((RC1+2)/3),3)*5+3,FALSE)&"|"&HLOOKUP(Sheet1!R2C1,Sheet1!R2C1:R16C1,MOD(RC1+3,3)+MOD(INT((RC1+3)/3),3)*5+3,FALSE) -> 104|132|133|134|162 | L315: 25|22|23|24 | M315: 2939170|2939170|2939170|2939170 | N315: 10030|10031|10032|10033 | O315: 1|1|1|1 | P315: 2500|2500|2500|2500
A316: 310 | B316: 308 | C316: 30 | D316: =R[-20]C+2 -> 50 | E316: 1000 | F316: =MOD(RC[-5]-1,3)*30+100&"|"&MOD(RC[-5]-1,3)*30+101&"|"&MOD(RC[-5]-1,3)*30+102&"|"&MOD(RC[-5]-1,3)*30+103&"|"&IF(MOD(RC[-5],4)=0,HLOOKUP(Sheet1!R2C10,Sheet1!R2C10:R7C10,MOD(RC[-5]/4-1,6)+1,FALSE),IF(MOD(RC[-5],2)=0,IF(RC[-5]>20,HLOOKUP(Sheet1!R2C7,Sheet1!R2C7:R43C7,MOD(RC[-5]/2-1,42)+1,FALSE),HLOOKUP(Sheet1!R2C4,Sheet1!R2C4:R7C4,MOD(RC[-5]-1,6)+1,FALSE)),MOD(RC[-5]-1,3)*30+104)) -> 100|101|102|103|172 | G316: =HLOOKUP(Sheet1!R2C1,Sheet1!R2C1:R16C1,MOD(RC1-1,2)+MOD(INT((RC1-1)/2),3)*5+1,FALSE)&"|"&HLOOKUP(Sheet1!R2C1,Sheet1!R2C1:R16C1,MOD(RC1,2)+MOD(INT((RC1)/2),3)*5+1,FALSE)&"|"&HLOOKUP(Sheet1!R2C1,Sheet1!R2C1:R16C1,MOD(RC1+1,2)+MOD(INT((RC1+1)/2),3)*5+1,FALSE)&"|"&HLOOKUP(Sheet1!R2C1,Sheet1!R2C1:R16C1,MOD(RC1+2,2)+MOD(INT((RC1+2)/2),3)*5+1,FALSE)&"|"&HLOOKUP(Sheet1!R2C1,Sheet1!R2C1:R16C1,MOD(RC1+3,2)+MOD(INT((RC1+3)/2),3)*5+1,FALSE) -> 131|160|161|100|101 | H316: =HLOOKUP(Sheet1!R2C1,Sheet1!R2C1:R16C1,MOD(RC1+2,2)+MOD(INT((RC1+2)/2),3)*5+1,FALSE)&"|"&HLOOKUP(Sheet1!R2C1,Sheet1!R2C1:R16C1,MOD(RC1+3,2)+MOD(INT((RC1+3)/2),3)*5+1,FALSE)&"|"&HLOOKUP(Sheet1!R2C1,Sheet1!R2C1:R16C1,MOD(RC1+4,2)+MOD(INT((RC1+4)/2),3)*5+1,FALSE)&"|"&HLOOKUP(Sheet1!R2C1,Sheet1!R2C1:R16C1,MOD(RC1+5,2)+MOD(INT((RC1+5)/2),3)*5+1,FALSE)&"|"&HLOOKUP(Sheet1!R2C1,Sheet1!R2C1:R16C1,MOD(RC1+6,2)+MOD(INT((RC1+6)/2),3)*5+1,FALSE) -> 100|101|130|131|160 | I316: =HLOOKUP(Sheet1!R2C1,Sheet1!R2C1:R16C1,MOD(RC1-1,3)+MOD(INT((RC1-1)/3),3)*5+3,FALSE)&"|"&HLOOKUP(Sheet1!R2C1,Sheet1!R2C1:R16C1,MOD(RC1,3)+MOD(INT((RC1)/3),3)*5+3,FALSE)&"|"&HLOOKUP(Sheet1!R2C1,Sheet1!R2C1:R16C1,MOD(RC1+1,3)+MOD(INT((RC1+1)/3),3)*5+3,FALSE)&"|"&HLOOKUP(Sheet1!R2C1,Sheet1!R2C1:R16C1,MOD(RC1+2,3)+MOD(INT((RC1+2)/3),3)*5+3,FALSE)&"|"&HLOOKUP(Sheet1!R2C1,Sheet1!R2C1:R16C1,MOD(RC1+3,3)+MOD(INT((RC1+3)/3),3)*5+3,FALSE) -> 132|133|134|162|163 | J316: =HLOOKUP(Sheet1!R2C1,Sheet1!R2C1:R16C1,MOD(RC1-1,3)+MOD(INT((RC1-1)/3),3)*5+3,FALSE)&"|"&HLOOKUP(Sheet1!R2C1,Sheet1!R2C1:R16C1,MOD(RC1,3)+MOD(INT((RC1)/3),3)*5+3,FALSE)&"|"&HLOOKUP(Sheet1!R2C1,Sheet1!R2C1:R16C1,MOD(RC1+1,3)+MOD(INT((RC1+1)/3),3)*5+3,FALSE)&"|"&HLOOKUP(Sheet1!R2C1,Sheet1!R2C1:R16C1,MOD(RC1+2,3)+MOD(INT((RC1+2)/3),3)*5+3,FALSE)&"|"&HLOOKUP(Sheet1!R2C1,Sheet1!R2C1:R16C1,MOD(RC1+3,3)+MOD(INT((RC1+3)/3),3)*5+3,FALSE) -> 132|133|134|162|163 | K316: =HLOOKUP(Sheet1!R2C1,Sheet1!R2C1:R16C1,MOD(RC1-1,3)+MOD(INT((RC1-1)/3),3)*5+3,FALSE)&"|"&HLOOKUP(Sheet1!R2C1,Sheet1!R2C1:R16C1,MOD(RC1,3)+MOD(INT((RC1)/3),3)*5+3,FALSE)&"|"&HLOOKUP(Sheet1!R2C1,Sheet1!R2C1:R16C1,MOD(RC1+1,3)+MOD(INT((RC1+1)/3),3)*5+3,FALSE)&"|"&HLOOKUP(Sheet1!R2C1,Sheet1!R2C1:R16C1,MOD(RC1+2,3)+MOD(INT((RC1+2)/3),3)*5+3,FALSE)&"|"&HLOOKUP(Sheet1!R2C1,Sheet1!R2C1:R16C1,MOD(RC1+3,3)+MOD(INT((RC1+3)/3),3)*5+3,FALSE) -> 132|133|134|162|163 | L316: 25|22|23|24 | M316: 2965500|2965500|2965500|2965500 | N316: 10030|10031|10032|10033|10030|10031|10032|10033|10030|10031|10032|10033|10030|10031|10032|10033|10030|10031|10032|10033|10030|10031|10032|10033|10030|10031|10032|10033|10030|10031|10032|10033|10030|10031|10032|10033|10030|10031|10032|10033 | O316: 1|1|1|1|1|1|1|1|1|1|1|1|1|1|1|1|1|1|1|1|1|1|1|1|1|1|1|1|1|1|1|1|1|1|1|1|1|1|1|1 | P316: 2500|2500|2500|2500|2500|2500|2500|2500|2500|2500|2500|2500|2500|2500|2500|2500|2500|2500|2500|2500|2500|2500|2500|2500|2500|2500|2500|2500|2500|2500|2500|2500|2500|2500|2500|2500|2500|2500|2500|2500
A317: 311 | B317: 309 | C317: 30 | D317: =R[-20]C+2 -> 50 | E317: 1000 | F317: =MOD(RC[-5]-1,3)*30+100&"|"&MOD(RC[-5]-1,3)*30+101&"|"&MOD(RC[-5]-1,3)*30+102&"|"&MOD(RC[-5]-1,3)*30+103&"|"&IF(MOD(RC[-5],4)=0,HLOOKUP(Sheet1!R2C10,Sheet1!R2C10:R7C10,MOD(RC[-5]/4-1,6)+1,FALSE),IF(MOD(RC[-5],2)=0,IF(RC[-5]>20,HLOOKUP(Sheet1!R2C7,Sheet1!R2C7:R43C7,MOD(RC[-5]/2-1,42)+1,FALSE),HLOOKUP(Sheet1!R2C4,Sheet1!R2C4:R7C4,MOD(RC[-5]-1,6)+1,FALSE)),MOD(RC[-5]-1,3)*30+104)) -> 130|131|132|133|134 | G317: =HLOOKUP(Sheet1!R2C1,Sheet1!R2C1:R16C1,MOD(RC1-1,2)+MOD(INT((RC1-1)/2),3)*5+1,FALSE)&"|"&HLOOKUP(Sheet1!R2C1,Sheet1!R2C1:R16C1,MOD(RC1,2)+MOD(INT((RC1)/2),3)*5+1,FALSE)&"|"&HLOOKUP(Sheet1!R2C1,Sheet1!R2C1:R16C1,MOD(RC1+1,2)+MOD(INT((RC1+1)/2),3)*5+1,FALSE)&"|"&HLOOKUP(Sheet1!R2C1,Sheet1!R2C1:R16C1,MOD(RC1+2,2)+MOD(INT((RC1+2)/2),3)*5+1,FALSE)&"|"&HLOOKUP(Sheet1!R2C1,Sheet1!R2C1:R16C1,MOD(RC1+3,2)+MOD(INT((RC1+3)/2),3)*5+1,FALSE) -> 160|161|100|101|130 | H317: =HLOOKUP(Sheet1!R2C1,Sheet1!R2C1:R16C1,MOD(RC1+2,2)+MOD(INT((RC1+2)/2),3)*5+1,FALSE)&"|"&HLOOKUP(Sheet1!R2C1,Sheet1!R2C1:R16C1,MOD(RC1+3,2)+MOD(INT((RC1+3)/2),3)*5+1,FALSE)&"|"&HLOOKUP(Sheet1!R2C1,Sheet1!R2C1:R16C1,MOD(RC1+4,2)+MOD(INT((RC1+4)/2),3)*5+1,FALSE)&"|"&HLOOKUP(Sheet1!R2C1,Sheet1!R2C1:R16C1,MOD(RC1+5,2)+MOD(INT((RC1+5)/2),3)*5+1,FALSE)&"|"&HLOOKUP(Sheet1!R2C1,Sheet1!R2C1:R16C1,MOD(RC1+6,2)+MOD(INT((RC1+6)/2),3)*5+1,FALSE) -> 101|130|131|160|161 | I317: =HLOOKUP(Sheet1!R2C1,Sheet1!R2C1:R16C1,MOD(RC1-1,3)+MOD(INT((RC1-1)/3),3)*5+3,FALSE)&"|"&HLOOKUP(Sheet1!R2C1,Sheet1!R2C1:R16C1,MOD(RC1,3)+MOD(INT((RC1)/3),3)*5+3,FALSE)&"|"&HLOOKUP(Sheet1!R2C1,Sheet1!R2C1:R16C1,MOD(RC1+1,3)+MOD(INT((RC1+1)/3),3)*5+3,FALSE)&"|"&HLOOKUP(Sheet1!R2C1,Sheet1!R2C1:R16C1,MOD(RC1+2,3)+MOD(INT((RC1+2)/3),3)*5+3,FALSE)&"|"&HLOOKUP(Sheet1!R2C1,Sheet1!R2C1:R16C1,MOD(RC1+3,3)+MOD(INT((RC1+3)/3),3)*5+3,FALSE) -> 133|134|162|163|164 | J317: =HLOOKUP(Sheet1!R2C1,Sheet1!R2C1:R16C1,MOD(RC1-1,3)+MOD(INT((RC1-1)/3),3)*5+3,FALSE)&"|"&HLOOKUP(Sheet1!R2C1,Sheet1!R2C1:R16C1,MOD(RC1,3)+MOD(INT((RC1)/3),3)*5+3,FALSE)&"|"&HLOOKUP(Sheet1!R2C1,Sheet1!R2C1:R16C1,MOD(RC1+1,3)+MOD(INT((RC1+1)/3),3)*5+3,FALSE)&"|"&HLOOKUP(Sheet1!R2C1,Sheet1!R2C1:R16C1,MOD(RC1+2,3)+MOD(INT((RC1+2)/3),3)*5+3,FALSE)&"|"&HLOOKUP(Sheet1!R2C1,Sheet1!R2C1:R16C1,MOD(RC1+3,3)+MOD(INT((RC1+3)/3),3)*5+3,FALSE) -> 133|134|162|163|164 | K317: =HLOOKUP(Sheet1!R2C1,Sheet1!R2C1:R16C1,MOD(RC1-1,3)+MOD(INT((RC1-1)/3),3)*5+3,FALSE)&"|"&HLOOKUP(Sheet1!R2C1,Sheet1!R2C1:R16C1,MOD(RC1,3)+MOD(INT((RC1)/3),3)*5+3,FALSE)&"|"&HLOOKUP(Sheet1!R2C1,Sheet1!R2C1:R16C1,MOD(RC1+1,3)+MOD(INT((RC1+1)/3),3)*5+3,FALSE)&"|"&HLOOKUP(Sheet1!R2C1,Sheet1!R2C1:R16C1,MOD(RC1+2,3)+MOD(INT((RC1+2)/3),3)*5+3,FALSE)&"|"&HLOOKUP(Sheet1!R2C1,Sheet1!R2C1:R16C1,MOD(RC1+3,3)+MOD(INT((RC1+3)/3),3)*5+3,FALSE) -> 133|134|162|163|164 | L317: 25|22|23|24 | M317: 2992882|2992883|2992883|2992883 | N317: 10030|10031|10032|10033 | O317: 1|1|1|1 | P317: 2500|2500|2500|2500
A318: 312 | B318: 310 | C318: 30 | D318: =R[-20]C+2 -> 50 | E318: 1000 | F318: =MOD(RC[-5]-1,3)*30+100&"|"&MOD(RC[-5]-1,3)*30+101&"|"&MOD(RC[-5]-1,3)*30+102&"|"&MOD(RC[-5]-1,3)*30+103&"|"&IF(MOD(RC[-5],4)=0,HLOOKUP(Sheet1!R2C10,Sheet1!R2C10:R7C10,MOD(RC[-5]/4-1,6)+1,FALSE),IF(MOD(RC[-5],2)=0,IF(RC[-5]>20,HLOOKUP(Sheet1!R2C7,Sheet1!R2C7:R43C7,MOD(RC[-5]/2-1,42)+1,FALSE),HLOOKUP(Sheet1!R2C4,Sheet1!R2C4:R7C4,MOD(RC[-5]-1,6)+1,FALSE)),MOD(RC[-5]-1,3)*30+104)) -> 160|161|162|163|195 | G318: =HLOOKUP(Sheet1!R2C1,Sheet1!R2C1:R16C1,MOD(RC1-1,2)+MOD(INT((RC1-1)/2),3)*5+1,FALSE)&"|"&HLOOKUP(Sheet1!R2C1,Sheet1!R2C1:R16C1,MOD(RC1,2)+MOD(INT((RC1)/2),3)*5+1,FALSE)&"|"&HLOOKUP(Sheet1!R2C1,Sheet1!R2C1:R16C1,MOD(RC1+1,2)+MOD(INT((RC1+1)/2),3)*5+1,FALSE)&"|"&HLOOKUP(Sheet1!R2C1,Sheet1!R2C1:R16C1,MOD(RC1+2,2)+MOD(INT((RC1+2)/2),3)*5+1,FALSE)&"|"&HLOOKUP(Sheet1!R2C1,Sheet1!R2C1:R16C1,MOD(RC1+3,2)+MOD(INT((RC1+3)/2),3)*5+1,FALSE) -> 161|100|101|130|131 | H318: =HLOOKUP(Sheet1!R2C1,Sheet1!R2C1:R16C1,MOD(RC1+2,2)+MOD(INT((RC1+2)/2),3)*5+1,FALSE)&"|"&HLOOKUP(Sheet1!R2C1,Sheet1!R2C1:R16C1,MOD(RC1+3,2)+MOD(INT((RC1+3)/2),3)*5+1,FALSE)&"|"&HLOOKUP(Sheet1!R2C1,Sheet1!R2C1:R16C1,MOD(RC1+4,2)+MOD(INT((RC1+4)/2),3)*5+1,FALSE)&"|"&HLOOKUP(Sheet1!R2C1,Sheet1!R2C1:R16C1,MOD(RC1+5,2)+MOD(INT((RC1+5)/2),3)*5+1,FALSE)&"|"&HLOOKUP(Sheet1!R2C1,Sheet1!R2C1:R16C1,MOD(RC1+6,2)+MOD(INT((RC1+6)/2),3)*5+1,FALSE) -> 130|131|160|161|100 | I318: =HLOOKUP(Sheet1!R2C1,Sheet1!R2C1:R16C1,MOD(RC1-1,3)+MOD(INT((RC1-1)/3),3)*5+3,FALSE)&"|"&HLOOKUP(Sheet1!R2C1,Sheet1!R2C1:R16C1,MOD(RC1,3)+MOD(INT((RC1)/3),3)*5+3,FALSE)&"|"&HLOOKUP(Sheet1!R2C1,Sheet1!R2C1:R16C1,MOD(RC1+1,3)+MOD(INT((RC1+1)/3),3)*5+3,FALSE)&"|"&HLOOKUP(Sheet1!R2C1,Sheet1!R2C1:R16C1,MOD(RC1+2,3)+MOD(INT((RC1+2)/3),3)*5+3,FALSE)&"|"&HLOOKUP(Sheet1!R2C1,Sheet1!R2C1:R16C1,MOD(RC1+3,3)+MOD(INT((RC1+3)/3),3)*5+3,FALSE) -> 134|162|163|164|102 | J318: =HLOOKUP(Sheet1!R2C1,Sheet1!R2C1:R16C1,MOD(RC1-1,3)+MOD(INT((RC1-1)/3),3)*5+3,FALSE)&"|"&HLOOKUP(Sheet1!R2C1,Sheet1!R2C1:R16C1,MOD(RC1,3)+MOD(INT((RC1)/3),3)*5+3,FALSE)&"|"&HLOOKUP(Sheet1!R2C1,Sheet1!R2C1:R16C1,MOD(RC1+1,3)+MOD(INT((RC1+1)/3),3)*5+3,FALSE)&"|"&HLOOKUP(Sheet1!R2C1,Sheet1!R2C1:R16C1,MOD(RC1+2,3)+MOD(INT((RC1+2)/3),3)*5+3,FALSE)&"|"&HLOOKUP(Sheet1!R2C1,Sheet1!R2C1:R16C1,MOD(RC1+3,3)+MOD(INT((RC1+3)/3),3)*5+3,FALSE) -> 134|162|163|164|102 | K318: =HLOOKUP(Sheet1!R2C1,Sheet1!R2C1:R16C1,MOD(RC1-1,3)+MOD(INT((RC1-1)/3),3)*5+3,FALSE)&"|"&HLOOKUP(Sheet1!R2C1,Sheet1!R2C1:R16C1,MOD(RC1,3)+MOD(INT((RC1)/3),3)*5+3,FALSE)&"|"&HLOOKUP(Sheet1!R2C1,Sheet1!R2C1:R16C1,MOD(RC1+1,3)+MOD(INT((RC1+1)/3),3)*5+3,FALSE)&"|"&HLOOKUP(Sheet1!R2C1,Sheet1!R2C1:R16C1,MOD(RC1+2,3)+MOD(INT((RC1+2)/3),3)*5+3,FALSE)&"|"&HLOOKUP(Sheet1!R2C1,Sheet1!R2C1:R16C1,MOD(RC1+3,3)+MOD(INT((RC1+3)/3),3)*5+3,FALSE) -> 134|162|163|164|102 | L318: 25|22|23|24 | M318: 3019211|3019211|3019213|3019213 | N318: 10030|10031|10032|10033 | O318: 1|1|1|1 | P318: 2500|2500|2500|2500
A319: 313 | B319: 311 | C319: 30 | D319: =R[-20]C+2 -> 50 | E319: 1000 | F319: =MOD(RC[-5]-1,3)*30+100&"|"&MOD(RC[-5]-1,3)*30+101&"|"&MOD(RC[-5]-1,3)*30+102&"|"&MOD(RC[-5]-1,3)*30+103&"|"&IF(MOD(RC[-5],4)=0,HLOOKUP(Sheet1!R2C10,Sheet1!R2C10:R7C10,MOD(RC[-5]/4-1,6)+1,FALSE),IF(MOD(RC[-5],2)=0,IF(RC[-5]>20,HLOOKUP(Sheet1!R2C7,Sheet1!R2C7:R43C7,MOD(RC[-5]/2-1,42)+1,FALSE),HLOOKUP(Sheet1!R2C4,Sheet1!R2C4:R7C4,MOD(RC[-5]-1,6)+1,FALSE)),MOD(RC[-5]-1,3)*30+104)) -> 100|101|102|103|104 | G319: =HLOOKUP(Sheet1!R2C1,Sheet1!R2C1:R16C1,MOD(RC1-1,2)+MOD(INT((RC1-1)/2),3)*5+1,FALSE)&"|"&HLOOKUP(Sheet1!R2C1,Sheet1!R2C1:R16C1,MOD(RC1,2)+MOD(INT((RC1)/2),3)*5+1,FALSE)&"|"&HLOOKUP(Sheet1!R2C1,Sheet1!R2C1:R16C1,MOD(RC1+1,2)+MOD(INT((RC1+1)/2),3)*5+1,FALSE)&"|"&HLOOKUP(Sheet1!R2C1,Sheet1!R2C1:R16C1,MOD(RC1+2,2)+MOD(INT((RC1+2)/2),3)*5+1,FALSE)&"|"&HLOOKUP(Sheet1!R2C1,Sheet1!R2C1:R16C1,MOD(RC1+3,2)+MOD(INT((RC1+3)/2),3)*5+1,FALSE) -> 100|101|130|131|160 | H319: =HLOOKUP(Sheet1!R2C1,Sheet1!R2C1:R16C1,MOD(RC1+2,2)+MOD(INT((RC1+2)/2),3)*5+1,FALSE)&"|"&HLOOKUP(Sheet1!R2C1,Sheet1!R2C1:R16C1,MOD(RC1+3,2)+MOD(INT((RC1+3)/2),3)*5+1,FALSE)&"|"&HLOOKUP(Sheet1!R2C1,Sheet1!R2C1:R16C1,MOD(RC1+4,2)+MOD(INT((RC1+4)/2),3)*5+1,FALSE)&"|"&HLOOKUP(Sheet1!R2C1,Sheet1!R2C1:R16C1,MOD(RC1+5,2)+MOD(INT((RC1+5)/2),3)*5+1,FALSE)&"|"&HLOOKUP(Sheet1!R2C1,Sheet1!R2C1:R16C1,MOD(RC1+6,2)+MOD(INT((RC1+6)/2),3)*5+1,FALSE) -> 131|160|161|100|101 | I319: =HLOOKUP(Sheet1!R2C1,Sheet1!R2C1:R16C1,MOD(RC1-1,3)+MOD(INT((RC1-1)/3),3)*5+3,FALSE)&"|"&HLOOKUP(Sheet1!R2C1,Sheet1!R2C1:R16C1,MOD(RC1,3)+MOD(INT((RC1)/3),3)*5+3,FALSE)&"|"&HLOOKUP(Sheet1!R2C1,Sheet1!R2C1:R16C1,MOD(RC1+1,3)+MOD(INT((RC1+1)/3),3)*5+3,FALSE)&"|"&HLOOKUP(Sheet1!R2C1,Sheet1!R2C1:R16C1,MOD(RC1+2,3)+MOD(INT((RC1+2)/3),3)*5+3,FALSE)&"|"&HLOOKUP(Sheet1!R2C1,Sheet1!R2C1:R16C1,MOD(RC1+3,3)+MOD(INT((RC1+3)/3),3)*5+3,FALSE) -> 162|163|164|102|103 | J319: =HLOOKUP(Sheet1!R2C1,Sheet1!R2C1:R16C1,MOD(RC1-1,3)+MOD(INT((RC1-1)/3),3)*5+3,FALSE)&"|"&HLOOKUP(Sheet1!R2C1,Sheet1!R2C1:R16C1,MOD(RC1,3)+MOD(INT((RC1)/3),3)*5+3,FALSE)&"|"&HLOOKUP(Sheet1!R2C1,Sheet1!R2C1:R16C1,MOD(RC1+1,3)+MOD(INT((RC1+1)/3),3)*5+3,FALSE)&"|"&HLOOKUP(Sheet1!R2C1,Sheet1!R2C1:R16C1,MOD(RC1+2,3)+MOD(INT((RC1+2)/3),3)*5+3,FALSE)&"|"&HLOOKUP(Sheet1!R2C1,Sheet1!R2C1:R16C1,MOD(RC1+3,3)+MOD(INT((RC1+3)/3),3)*5+3,FALSE) -> 162|163|164|102|103 | K319: =HLOOKUP(Sheet1!R2C1,Sheet1!R2C1:R16C1,MOD(RC1-1,3)+MOD(INT((RC1-1)/3),3)*5+3,FALSE)&"|"&HLOOKUP(Sheet1!R2C1,Sheet1!R2C1:R16C1,MOD(RC1,3)+MOD(INT((RC1)/3),3)*5+3,FALSE)&"|"&HLOOKUP(Sheet1!R2C1,Sheet1!R2C1:R16C1,MOD(RC1+1,3)+MOD(INT((RC1+1)/3),3)*5+3,FALSE)&"|"&HLOOKUP(Sheet1!R2C1,Sheet1!R2C1:R16C1,MOD(RC1+2,3)+MOD(INT((RC1+2)/3),3)*5+3,FALSE)&"|"&HLOOKUP(Sheet1!R2C1,Sheet1!R2C1:R16C1,MOD(RC1+3,3)+MOD(INT((RC1+3)/3),3)*5+3,FALSE) -> 162|163|164|102|103 | L319: 25|22|23|24 | M319: 3046236|3046236|3046235|3046235 | N319: 10030|10031|10032|10033 | O319: 1|1|1|1 | P319: 2500|2500|2500|2500
A320: 314 | B320: 312 | C320: 30 | D320: =R[-20]C+2 -> 50 | E320: 1000 | F320: =MOD(RC[-5]-1,3)*30+100&"|"&MOD(RC[-5]-1,3)*30+101&"|"&MOD(RC[-5]-1,3)*30+102&"|"&MOD(RC[-5]-1,3)*30+103&"|"&IF(MOD(RC[-5],4)=0,HLOOKUP(Sheet1!R2C10,Sheet1!R2C10:R7C10,MOD(RC[-5]/4-1,6)+1,FALSE),IF(MOD(RC[-5],2)=0,IF(RC[-5]>20,HLOOKUP(Sheet1!R2C7,Sheet1!R2C7:R43C7,MOD(RC[-5]/2-1,42)+1,FALSE),HLOOKUP(Sheet1!R2C4,Sheet1!R2C4:R7C4,MOD(RC[-5]-1,6)+1,FALSE)),MOD(RC[-5]-1,3)*30+104)) -> 130|131|132|133|174 | G320: =HLOOKUP(Sheet1!R2C1,Sheet1!R2C1:R16C1,MOD(RC1-1,2)+MOD(INT((RC1-1)/2),3)*5+1,FALSE)&"|"&HLOOKUP(Sheet1!R2C1,Sheet1!R2C1:R16C1,MOD(RC1,2)+MOD(INT((RC1)/2),3)*5+1,FALSE)&"|"&HLOOKUP(Sheet1!R2C1,Sheet1!R2C1:R16C1,MOD(RC1+1,2)+MOD(INT((RC1+1)/2),3)*5+1,FALSE)&"|"&HLOOKUP(Sheet1!R2C1,Sheet1!R2C1:R16C1,MOD(RC1+2,2)+MOD(INT((RC1+2)/2),3)*5+1,FALSE)&"|"&HLOOKUP(Sheet1!R2C1,Sheet1!R2C1:R16C1,MOD(RC1+3,2)+MOD(INT((RC1+3)/2),3)*5+1,FALSE) -> 101|130|131|160|161 | H320: =HLOOKUP(Sheet1!R2C1,Sheet1!R2C1:R16C1,MOD(RC1+2,2)+MOD(INT((RC1+2)/2),3)*5+1,FALSE)&"|"&HLOOKUP(Sheet1!R2C1,Sheet1!R2C1:R16C1,MOD(RC1+3,2)+MOD(INT((RC1+3)/2),3)*5+1,FALSE)&"|"&HLOOKUP(Sheet1!R2C1,Sheet1!R2C1:R16C1,MOD(RC1+4,2)+MOD(INT((RC1+4)/2),3)*5+1,FALSE)&"|"&HLOOKUP(Sheet1!R2C1,Sheet1!R2C1:R16C1,MOD(RC1+5,2)+MOD(INT((RC1+5)/2),3)*5+1,FALSE)&"|"&HLOOKUP(Sheet1!R2C1,Sheet1!R2C1:R16C1,MOD(RC1+6,2)+MOD(INT((RC1+6)/2),3)*5+1,FALSE) -> 160|161|100|101|130 | I320: =HLOOKUP(Sheet1!R2C1,Sheet1!R2C1:R16C1,MOD(RC1-1,3)+MOD(INT((RC1-1)/3),3)*5+3,FALSE)&"|"&HLOOKUP(Sheet1!R2C1,Sheet1!R2C1:R16C1,MOD(RC1,3)+MOD(INT((RC1)/3),3)*5+3,FALSE)&"|"&HLOOKUP(Sheet1!R2C1,Sheet1!R2C1:R16C1,MOD(RC1+1,3)+MOD(INT((RC1+1)/3),3)*5+3,FALSE)&"|"&HLOOKUP(Sheet1!R2C1,Sheet1!R2C1:R16C1,MOD(RC1+2,3)+MOD(INT((RC1+2)/3),3)*5+3,FALSE)&"|"&HLOOKUP(Sheet1!R2C1,Sheet1!R2C1:R16C1,MOD(RC1+3,3)+MOD(INT((RC1+3)/3),3)*5+3,FALSE) -> 163|164|102|103|104 | J320: =HLOOKUP(Sheet1!R2C1,Sheet1!R2C1:R16C1,MOD(RC1-1,3)+MOD(INT((RC1-1)/3),3)*5+3,FALSE)&"|"&HLOOKUP(Sheet1!R2C1,Sheet1!R2C1:R16C1,MOD(RC1,3)+MOD(INT((RC1)/3),3)*5+3,FALSE)&"|"&HLOOKUP(Sheet1!R2C1,Sheet1!R2C1:R16C1,MOD(RC1+1,3)+MOD(INT((RC1+1)/3),3)*5+3,FALSE)&"|"&HLOOKUP(Sheet1!R2C1,Sheet1!R2C1:R16C1,MOD(RC1+2,3)+MOD(INT((RC1+2)/3),3)*5+3,FALSE)&"|"&HLOOKUP(Sheet1!R2C1,Sheet1!R2C1:R16C1,MOD(RC1+3,3)+MOD(INT((RC1+3)/3),3)*5+3,FALSE) -> 163|164|102|103|104 | K320: =HLOOKUP(Sheet1!R2C1,Sheet1!R2C1:R16C1,MOD(RC1-1,3)+MOD(INT((RC1-1)/3),3)*5+3,FALSE)&"|"&HLOOKUP(Sheet1!R2C1,Sheet1!R2C1:R16C1,MOD(RC1,3)+MOD(INT((RC1)/3),3)*5+3,FALSE)&"|"&HLOOKUP(Sheet1!R2C1,Sheet1!R2C1:R16C1,MOD(RC1+1,3)+MOD(INT((RC1+1)/3),3)*5+3,FALSE)&"|"&HLOOKUP(Sheet1!R2C1,Sheet1!R2C1:R16C1,MOD(RC1+2,3)+MOD(INT((RC1+2)/3),3)*5+3,FALSE)&"|"&HLOOKUP(Sheet1!R2C1,Sheet1!R2C1:R16C1,MOD(RC1+3,3)+MOD(INT((RC1+3)/3),3)*5+3,FALSE) -> 163|164|102|103|104 | L320: 25|22|23|24 | M320: 3074623|3074623|3074623|3074623 | N320: 10030|10031|10032|10033 | O320: 1|1|1|1 | P320: 2500|2500|2500|2500
A321: 315 | B321: 313 | C321: 30 | D321: =R[-20]C+2 -> 50 | E321: 1000 | F321: =MOD(RC[-5]-1,3)*30+100&"|"&MOD(RC[-5]-1,3)*30+101&"|"&MOD(RC[-5]-1,3)*30+102&"|"&MOD(RC[-5]-1,3)*30+103&"|"&IF(MOD(RC[-5],4)=0,HLOOKUP(Sheet1!R2C10,Sheet1!R2C10:R7C10,MOD(RC[-5]/4-1,6)+1,FALSE),IF(MOD(RC[-5],2)=0,IF(RC[-5]>20,HLOOKUP(Sheet1!R2C7,Sheet1!R2C7:R43C7,MOD(RC[-5]/2-1,42)+1,FALSE),HLOOKUP(Sheet1!R2C4,Sheet1!R2C4:R7C4,MOD(RC[-5]-1,6)+1,FALSE)),MOD(RC[-5]-1,3)*30+104)) -> 160|161|162|163|164 | G321: =HLOOKUP(Sheet1!R2C1,Sheet1!R2C1:R16C1,MOD(RC1-1,2)+MOD(INT((RC1-1)/2),3)*5+1,FALSE)&"|"&HLOOKUP(Sheet1!R2C1,Sheet1!R2C1:R16C1,MOD(RC1,2)+MOD(INT((RC1)/2),3)*5+1,FALSE)&"|"&HLOOKUP(Sheet1!R2C1,Sheet1!R2C1:R16C1,MOD(RC1+1,2)+MOD(INT((RC1+1)/2),3)*5+1,FALSE)&"|"&HLOOKUP(Sheet1!R2C1,Sheet1!R2C1:R16C1,MOD(RC1+2,2)+MOD(INT((RC1+2)/2),3)*5+1,FALSE)&"|"&HLOOKUP(Sheet1!R2C1,Sheet1!R2C1:R16C1,MOD(RC1+3,2)+MOD(INT((RC1+3)/2),3)*5+1,FALSE) -> 130|131|160|161|100 | H321: =HLOOKUP(Sheet1!R2C1,Sheet1!R2C1:R16C1,MOD(RC1+2,2)+MOD(INT((RC1+2)/2),3)*5+1,FALSE)&"|"&HLOOKUP(Sheet1!R2C1,Sheet1!R2C1:R16C1,MOD(RC1+3,2)+MOD(INT((RC1+3)/2),3)*5+1,FALSE)&"|"&HLOOKUP(Sheet1!R2C1,Sheet1!R2C1:R16C1,MOD(RC1+4,2)+MOD(INT((RC1+4)/2),3)*5+1,FALSE)&"|"&HLOOKUP(Sheet1!R2C1,Sheet1!R2C1:R16C1,MOD(RC1+5,2)+MOD(INT((RC1+5)/2),3)*5+1,FALSE)&"|"&HLOOKUP(Sheet1!R2C1,Sheet1!R2C1:R16C1,MOD(RC1+6,2)+MOD(INT((RC1+6)/2),3)*5+1,FALSE) -> 161|100|101|130|131 | I321: =HLOOKUP(Sheet1!R2C1,Sheet1!R2C1:R16C1,MOD(RC1-1,3)+MOD(INT((RC1-1)/3),3)*5+3,FALSE)&"|"&HLOOKUP(Sheet1!R2C1,Sheet1!R2C1:R16C1,MOD(RC1,3)+MOD(INT((RC1)/3),3)*5+3,FALSE)&"|"&HLOOKUP(Sheet1!R2C1,Sheet1!R2C1:R16C1,MOD(RC1+1,3)+MOD(INT((RC1+1)/3),3)*5+3,FALSE)&"|"&HLOOKUP(Sheet1!R2C1,Sheet1!R2C1:R16C1,MOD(RC1+2,3)+MOD(INT((RC1+2)/3),3)*5+3,FALSE)&"|"&HLOOKUP(Sheet1!R2C1,Sheet1!R2C1:R16C1,MOD(RC1+3,3)+MOD(INT((RC1+3)/3),3)*5+3,FALSE) -> 164|102|103|104|132 | J321: =HLOOKUP(Sheet1!R2C1,Sheet1!R2C1:R16C1,MOD(RC1-1,3)+MOD(INT((RC1-1)/3),3)*5+3,FALSE)&"|"&HLOOKUP(Sheet1!R2C1,Sheet1!R2C1:R16C1,MOD(RC1,3)+MOD(INT((RC1)/3),3)*5+3,FALSE)&"|"&HLOOKUP(Sheet1!R2C1,Sheet1!R2C1:R16C1,MOD(RC1+1,3)+MOD(INT((RC1+1)/3),3)*5+3,FALSE)&"|"&HLOOKUP(Sheet1!R2C1,Sheet1!R2C1:R16C1,MOD(RC1+2,3)+MOD(INT((RC1+2)/3),3)*5+3,FALSE)&"|"&HLOOKUP(Sheet1!R2C1,Sheet1!R2C1:R16C1,MOD(RC1+3,3)+MOD(INT((RC1+3)/3),3)*5+3,FALSE) -> 164|102|103|104|132 | K321: =HLOOKUP(Sheet1!R2C1,Sheet1!R2C1:R16C1,MOD(RC1-1,3)+MOD(INT((RC1-1)/3),3)*5+3,FALSE)&"|"&HLOOKUP(Sheet1!R2C1,Sheet1!R2C1:R16C1,MOD(RC1,3)+MOD(INT((RC1)/3),3)*5+3,FALSE)&"|"&HLOOKUP(Sheet1!R2C1,Sheet1!R2C1:R16C1,MOD(RC1+1,3)+MOD(INT((RC1+1)/3),3)*5+3,FALSE)&"|"&HLOOKUP(Sheet1!R2C1,Sheet1!R2C1:R16C1,MOD(RC1+2,3)+MOD(INT((RC1+2)/3),3)*5+3,FALSE)&"|"&HLOOKUP(Sheet1!R2C1,Sheet1!R2C1:R16C1,MOD(RC1+3,3)+MOD(INT((RC1+3)/3),3)*5+3,FALSE) -> 164|102|103|104|132 | L321: 25|22|23|24 | M321: 3101917|3101918|3101918|3101918 | N321: 10030|10031|10032|10033|10030|10031|10032|10033|10030|10031|10032|10033|10030|10031|10032|10033|10030|10031|10032|10033|10030|10031|10032|10033|10030|10031|10032|10033|10030|10031|10032|10033|10030|10031|10032|10033|10030|10031|10032|10033 | O321: 1|1|1|1|1|1|1|1|1|1|1|1|1|1|1|1|1|1|1|1|1|1|1|1|1|1|1|1|1|1|1|1|1|1|1|1|1|1|1|1 | P321: 2500|2500|2500|2500|2500|2500|2500|2500|2500|2500|2500|2500|2500|2500|2500|2500|2500|2500|2500|2500|2500|2500|2500|2500|2500|2500|2500|2500|2500|2500|2500|2500|2500|2500|2500|2500|2500|2500|2500|2500
A322: 316 | B322: 314 | C322: 30 | D322: =R[-20]C+2 -> 50 | E322: 1000 | F322: =MOD(RC[-5]-1,3)*30+100&"|"&MOD(RC[-5]-1,3)*30+101&"|"&MOD(RC[-5]-1,3)*30+102&"|"&MOD(RC[-5]-1,3)*30+103&"|"&IF(MOD(RC[-5],4)=0,HLOOKUP(Sheet1!R2C10,Sheet1!R2C10:R7C10,MOD(RC[-5]/4-1,6)+1,FALSE),IF(MOD(RC[-5],2)=0,IF(RC[-5]>20,HLOOKUP(Sheet1!R2C7,Sheet1!R2C7:R43C7,MOD(RC[-5]/2-1,42)+1,FALSE),HLOOKUP(Sheet1!R2C4,Sheet1!R2C4:R7C4,MOD(RC[-5]-1,6)+1,FALSE)),MOD(RC[-5]-1,3)*30+104)) -> 100|101|102|103|190 | G322: =HLOOKUP(Sheet1!R2C1,Sheet1!R2C1:R16C1,MOD(RC1-1,2)+MOD(INT((RC1-1)/2),3)*5+1,FALSE)&"|"&HLOOKUP(Sheet1!R2C1,Sheet1!R2C1:R16C1,MOD(RC1,2)+MOD(INT((RC1)/2),3)*5+1,FALSE)&"|"&HLOOKUP(Sheet1!R2C1,Sheet1!R2C1:R16C1,MOD(RC1+1,2)+MOD(INT((RC1+1)/2),3)*5+1,FALSE)&"|"&HLOOKUP(Sheet1!R2C1,Sheet1!R2C1:R16C1,MOD(RC1+2,2)+MOD(INT((RC1+2)/2),3)*5+1,FALSE)&"|"&HLOOKUP(Sheet1!R2C1,Sheet1!R2C1:R16C1,MOD(RC1+3,2)+MOD(INT((RC1+3)/2),3)*5+1,FALSE) -> 131|160|161|100|101 | H322: =HLOOKUP(Sheet1!R2C1,Sheet1!R2C1:R16C1,MOD(RC1+2,2)+MOD(INT((RC1+2)/2),3)*5+1,FALSE)&"|"&HLOOKUP(Sheet1!R2C1,Sheet1!R2C1:R16C1,MOD(RC1+3,2)+MOD(INT((RC1+3)/2),3)*5+1,FALSE)&"|"&HLOOKUP(Sheet1!R2C1,Sheet1!R2C1:R16C1,MOD(RC1+4,2)+MOD(INT((RC1+4)/2),3)*5+1,FALSE)&"|"&HLOOKUP(Sheet1!R2C1,Sheet1!R2C1:R16C1,MOD(RC1+5,2)+MOD(INT((RC1+5)/2),3)*5+1,FALSE)&"|"&HLOOKUP(Sheet1!R2C1,Sheet1!R2C1:R16C1,MOD(RC1+6,2)+MOD(INT((RC1+6)/2),3)*5+1,FALSE) -> 100|101|130|131|160 | I322: =HLOOKUP(Sheet1!R2C1,Sheet1!R2C1:R16C1,MOD(RC1-1,3)+MOD(INT((RC1-1)/3),3)*5+3,FALSE)&"|"&HLOOKUP(Sheet1!R2C1,Sheet1!R2C1:R16C1,MOD(RC1,3)+MOD(INT((RC1)/3),3)*5+3,FALSE)&"|"&HLOOKUP(Sheet1!R2C1,Sheet1!R2C1:R16C1,MOD(RC1+1,3)+MOD(INT((RC1+1)/3),3)*5+3,FALSE)&"|"&HLOOKUP(Sheet1!R2C1,Sheet1!R2C1:R16C1,MOD(RC1+2,3)+MOD(INT((RC1+2)/3),3)*5+3,FALSE)&"|"&HLOOKUP(Sheet1!R2C1,Sheet1!R2C1:R16C1,MOD(RC1+3,3)+MOD(INT((RC1+3)/3),3)*5+3,FALSE) -> 102|103|104|132|133 | J322: =HLOOKUP(Sheet1!R2C1,Sheet1!R2C1:R16C1,MOD(RC1-1,3)+MOD(INT((RC1-1)/3),3)*5+3,FALSE)&"|"&HLOOKUP(Sheet1!R2C1,Sheet1!R2C1:R16C1,MOD(RC1,3)+MOD(INT((RC1)/3),3)*5+3,FALSE)&"|"&HLOOKUP(Sheet1!R2C1,Sheet1!R2C1:R16C1,MOD(RC1+1,3)+MOD(INT((RC1+1)/3),3)*5+3,FALSE)&"|"&HLOOKUP(Sheet1!R2C1,Sheet1!R2C1:R16C1,MOD(RC1+2,3)+MOD(INT((RC1+2)/3),3)*5+3,FALSE)&"|"&HLOOKUP(Sheet1!R2C1,Sheet1!R2C1:R16C1,MOD(RC1+3,3)+MOD(INT((RC1+3)/3),3)*5+3,FALSE) -> 102|103|104|132|133 | K322: =HLOOKUP(Sheet1!R2C1,Sheet1!R2C1:R16C1,MOD(RC1-1,3)+MOD(INT((RC1-1)/3),3)*5+3,FALSE)&"|"&HLOOKUP(Sheet1!R2C1,Sheet1!R2C1:R16C1,MOD(RC1,3)+MOD(INT((RC1)/3),3)*5+3,FALSE)&"|"&HLOOKUP(Sheet1!R2C1,Sheet1!R2C1:R16C1,MOD(RC1+1,3)+MOD(INT((RC1+1)/3),3)*5+3,FALSE)&"|"&HLOOKUP(Sheet1!R2C1,Sheet1!R2C1:R16C1,MOD(RC1+2,3)+MOD(INT((RC1+2)/3),3)*5+3,FALSE)&"|"&HLOOKUP(Sheet1!R2C1,Sheet1!R2C1:R16C1,MOD(RC1+3,3)+MOD(INT((RC1+3)/3),3)*5+3,FALSE) -> 102|103|104|132|133 | L322: 25|22|23|24 | M322: 3129212|3129213|3129213|3129213 | N322: 10030|10031|10032|10033 | O322: 1|1|1|1 | P322: 2500|2500|2500|2500
A323: 317 | B323: 315 | C323: 30 | D323: =R[-20]C+2 -> 50 | E323: 1000 | F323: =MOD(RC[-5]-1,3)*30+100&"|"&MOD(RC[-5]-1,3)*30+101&"|"&MOD(RC[-5]-1,3)*30+102&"|"&MOD(RC[-5]-1,3)*30+103&"|"&IF(MOD(RC[-5],4)=0,HLOOKUP(Sheet1!R2C10,Sheet1!R2C10:R7C10,MOD(RC[-5]/4-1,6)+1,FALSE),IF(MOD(RC[-5],2)=0,IF(RC[-5]>20,HLOOKUP(Sheet1!R2C7,Sheet1!R2C7:R43C7,MOD(RC[-5]/2-1,42)+1,FALSE),HLOOKUP(Sheet1!R2C4,Sheet1!R2C4:R7C4,MOD(RC[-5]-1,6)+1,FALSE)),MOD(RC[-5]-1,3)*30+104)) -> 130|131|132|133|134 | G323: =HLOOKUP(Sheet1!R2C1,Sheet1!R2C1:R16C1,MOD(RC1-1,2)+MOD(INT((RC1-1)/2),3)*5+1,FALSE)&"|"&HLOOKUP(Sheet1!R2C1,Sheet1!R2C1:R16C1,MOD(RC1,2)+MOD(INT((RC1)/2),3)*5+1,FALSE)&"|"&HLOOKUP(Sheet1!R2C1,Sheet1!R2C1:R16C1,MOD(RC1+1,2)+MOD(INT((RC1+1)/2),3)*5+1,FALSE)&"|"&HLOOKUP(Sheet1!R2C1,Sheet1!R2C1:R16C1,MOD(RC1+2,2)+MOD(INT((RC1+2)/2),3)*5+1,FALSE)&"|"&HLOOKUP(Sheet1!R2C1,Sheet1!R2C1:R16C1,MOD(RC1+3,2)+MOD(INT((RC1+3)/2),3)*5+1,FALSE) -> 160|161|100|101|130 | H323: =HLOOKUP(Sheet1!R2C1,Sheet1!R2C1:R16C1,MOD(RC1+2,2)+MOD(INT((RC1+2)/2),3)*5+1,FALSE)&"|"&HLOOKUP(Sheet1!R2C1,Sheet1!R2C1:R16C1,MOD(RC1+3,2)+MOD(INT((RC1+3)/2),3)*5+1,FALSE)&"|"&HLOOKUP(Sheet1!R2C1,Sheet1!R2C1:R16C1,MOD(RC1+4,2)+MOD(INT((RC1+4)/2),3)*5+1,FALSE)&"|"&HLOOKUP(Sheet1!R2C1,Sheet1!R2C1:R16C1,MOD(RC1+5,2)+MOD(INT((RC1+5)/2),3)*5+1,FALSE)&"|"&HLOOKUP(Sheet1!R2C1,Sheet1!R2C1:R16C1,MOD(RC1+6,2)+MOD(INT((RC1+6)/2),3)*5+1,FALSE) -> 101|130|131|160|161 | I323: =HLOOKUP(Sheet1!R2C1,Sheet1!R2C1:R16C1,MOD(RC1-1,3)+MOD(INT((RC1-1)/3),3)*5+3,FALSE)&"|"&HLOOKUP(Sheet1!R2C1,Sheet1!R2C1:R16C1,MOD(RC1,3)+MOD(INT((RC1)/3),3)*5+3,FALSE)&"|"&HLOOKUP(Sheet1!R2C1,Sheet1!R2C1:R16C1,MOD(RC1+1,3)+MOD(INT((RC1+1)/3),3)*5+3,FALSE)&"|"&HLOOKUP(Sheet1!R2C1,Sheet1!R2C1:R16C1,MOD(RC1+2,3)+MOD(INT((RC1+2)/3),3)*5+3,FALSE)&"|"&HLOOKUP(Sheet1!R2C1,Sheet1!R2C1:R16C1,MOD(RC1+3,3)+MOD(INT((RC1+3)/3),3)*5+3,FALSE) -> 103|104|132|133|134 | J323: =HLOOKUP(Sheet1!R2C1,Sheet1!R2C1:R16C1,MOD(RC1-1,3)+MOD(INT((RC1-1)/3),3)*5+3,FALSE)&"|"&HLOOKUP(Sheet1!R2C1,Sheet1!R2C1:R16C1,MOD(RC1,3)+MOD(INT((RC1)/3),3)*5+3,FALSE)&"|"&HLOOKUP(Sheet1!R2C1,Sheet1!R2C1:R16C1,MOD(RC1+1,3)+MOD(INT((RC1+1)/3),3)*5+3,FALSE)&"|"&HLOOKUP(Sheet1!R2C1,Sheet1!R2C1:R16C1,MOD(RC1+2,3)+MOD(INT((RC1+2)/3),3)*5+3,FALSE)&"|"&HLOOKUP(Sheet1!R2C1,Sheet1!R2C1:R16C1,MOD(RC1+3,3)+MOD(INT((RC1+3)/3),3)*5+3,FALSE) -> 103|104|132|133|134 | K323: =HLOOKUP(Sheet1!R2C1,Sheet1!R2C1:R16C1,MOD(RC1-1,3)+MOD(INT((RC1-1)/3),3)*5+3,FALSE)&"|"&HLOOKUP(Sheet1!R2C1,Sheet1!R2C1:R16C1,MOD(RC1,3)+MOD(INT((RC1)/3),3)*5+3,FALSE)&"|"&HLOOKUP(Sheet1!R2C1,Sheet1!R2C1:R16C1,MOD(RC1+1,3)+MOD(INT((RC1+1)/3),3)*5+3,FALSE)&"|"&HLOOKUP(Sheet1!R2C1,Sheet1!R2C1:R16C1,MOD(RC1+2,3)+MOD(INT((RC1+2)/3),3)*5+3,FALSE)&"|"&HLOOKUP(Sheet1!R2C1,Sheet1!R2C1:R16C1,MOD(RC1+3,3)+MOD(INT((RC1+3)/3),3)*5+3,FALSE) -> 103|104|132|133|134 | L323: 25|22|23|24 | M323: 3158403|3158403|3158403|3158403 | N323: 10030|10031|10032|10033 | O323: 1|1|1|1 | P323: 2500|2500|2500|2500
A324: 318 | B324: 316 | C324: 30 | D324: =R[-20]C+2 -> 50 | E324: 1000 | F324: =MOD(RC[-5]-1,3)*30+100&"|"&MOD(RC[-5]-1,3)*30+101&"|"&MOD(RC[-5]-1,3)*30+102&"|"&MOD(RC[-5]-1,3)*30+103&"|"&IF(MOD(RC[-5],4)=0,HLOOKUP(Sheet1!R2C10,Sheet1!R2C10:R7C10,MOD(RC[-5]/4-1,6)+1,FALSE),IF(MOD(RC[-5],2)=0,IF(RC[-5]>20,HLOOKUP(Sheet1!R2C7,Sheet1!R2C7:R43C7,MOD(RC[-5]/2-1,42)+1,FALSE),HLOOKUP(Sheet1!R2C4,Sheet1!R2C4:R7C4,MOD(RC[-5]-1,6)+1,FALSE)),MOD(RC[-5]-1,3)*30+104)) -> 160|161|162|163|176 | G324: =HLOOKUP(Sheet1!R2C1,Sheet1!R2C1:R16C1,MOD(RC1-1,2)+MOD(INT((RC1-1)/2),3)*5+1,FALSE)&"|"&HLOOKUP(Sheet1!R2C1,Sheet1!R2C1:R16C1,MOD(RC1,2)+MOD(INT((RC1)/2),3)*5+1,FALSE)&"|"&HLOOKUP(Sheet1!R2C1,Sheet1!R2C1:R16C1,MOD(RC1+1,2)+MOD(INT((RC1+1)/2),3)*5+1,FALSE)&"|"&HLOOKUP(Sheet1!R2C1,Sheet1!R2C1:R16C1,MOD(RC1+2,2)+MOD(INT((RC1+2)/2),3)*5+1,FALSE)&"|"&HLOOKUP(Sheet1!R2C1,Sheet1!R2C1:R16C1,MOD(RC1+3,2)+MOD(INT((RC1+3)/2),3)*5+1,FALSE) -> 161|100|101|130|131 | H324: =HLOOKUP(Sheet1!R2C1,Sheet1!R2C1:R16C1,MOD(RC1+2,2)+MOD(INT((RC1+2)/2),3)*5+1,FALSE)&"|"&HLOOKUP(Sheet1!R2C1,Sheet1!R2C1:R16C1,MOD(RC1+3,2)+MOD(INT((RC1+3)/2),3)*5+1,FALSE)&"|"&HLOOKUP(Sheet1!R2C1,Sheet1!R2C1:R16C1,MOD(RC1+4,2)+MOD(INT((RC1+4)/2),3)*5+1,FALSE)&"|"&HLOOKUP(Sheet1!R2C1,Sheet1!R2C1:R16C1,MOD(RC1+5,2)+MOD(INT((RC1+5)/2),3)*5+1,FALSE)&"|"&HLOOKUP(Sheet1!R2C1,Sheet1!R2C1:R16C1,MOD(RC1+6,2)+MOD(INT((RC1+6)/2),3)*5+1,FALSE) -> 130|131|160|161|100 | I324: =HLOOKUP(Sheet1!R2C1,Sheet1!R2C1:R16C1,MOD(RC1-1,3)+MOD(INT((RC1-1)/3),3)*5+3,FALSE)&"|"&HLOOKUP(Sheet1!R2C1,Sheet1!R2C1:R16C1,MOD(RC1,3)+MOD(INT((RC1)/3),3)*5+3,FALSE)&"|"&HLOOKUP(Sheet1!R2C1,Sheet1!R2C1:R16C1,MOD(RC1+1,3)+MOD(INT((RC1+1)/3),3)*5+3,FALSE)&"|"&HLOOKUP(Sheet1!R2C1,Sheet1!R2C1:R16C1,MOD(RC1+2,3)+MOD(INT((RC1+2)/3),3)*5+3,FALSE)&"|"&HLOOKUP(Sheet1!R2C1,Sheet1!R2C1:R16C1,MOD(RC1+3,3)+MOD(INT((RC1+3)/3),3)*5+3,FALSE) -> 104|132|133|134|162 | J324: =HLOOKUP(Sheet1!R2C1,Sheet1!R2C1:R16C1,MOD(RC1-1,3)+MOD(INT((RC1-1)/3),3)*5+3,FALSE)&"|"&HLOOKUP(Sheet1!R2C1,Sheet1!R2C1:R16C1,MOD(RC1,3)+MOD(INT((RC1)/3),3)*5+3,FALSE)&"|"&HLOOKUP(Sheet1!R2C1,Sheet1!R2C1:R16C1,MOD(RC1+1,3)+MOD(INT((RC1+1)/3),3)*5+3,FALSE)&"|"&HLOOKUP(Sheet1!R2C1,Sheet1!R2C1:R16C1,MOD(RC1+2,3)+MOD(INT((RC1+2)/3),3)*5+3,FALSE)&"|"&HLOOKUP(Sheet1!R2C1,Sheet1!R2C1:R16C1,MOD(RC1+3,3)+MOD(INT((RC1+3)/3),3)*5+3,FALSE) -> 104|132|133|134|162 | K324: =HLOOKUP(Sheet1!R2C1,Sheet1!R2C1:R16C1,MOD(RC1-1,3)+MOD(INT((RC1-1)/3),3)*5+3,FALSE)&"|"&HLOOKUP(Sheet1!R2C1,Sheet1!R2C1:R16C1,MOD(RC1,3)+MOD(INT((RC1)/3),3)*5+3,FALSE)&"|"&HLOOKUP(Sheet1!R2C1,Sheet1!R2C1:R16C1,MOD(RC1+1,3)+MOD(INT((RC1+1)/3),3)*5+3,FALSE)&"|"&HLOOKUP(Sheet1!R2C1,Sheet1!R2C1:R16C1,MOD(RC1+2,3)+MOD(INT((RC1+2)/3),3)*5+3,FALSE)&"|"&HLOOKUP(Sheet1!R2C1,Sheet1!R2C1:R16C1,MOD(RC1+3,3)+MOD(INT((RC1+3)/3),3)*5+3,FALSE) -> 104|132|133|134|162 | L324: 25|22|23|24 | M324: 3186702|3186703|3186703|3186703 | N324: 10030|10031|10032|10033 | O324: 1|1|1|1 | P324: 2500|2500|2500|2500
A325: 319 | B325: 317 | C325: 30 | D325: =R[-20]C+2 -> 50 | E325: 1000 | F325: =MOD(RC[-5]-1,3)*30+100&"|"&MOD(RC[-5]-1,3)*30+101&"|"&MOD(RC[-5]-1,3)*30+102&"|"&MOD(RC[-5]-1,3)*30+103&"|"&IF(MOD(RC[-5],4)=0,HLOOKUP(Sheet1!R2C10,Sheet1!R2C10:R7C10,MOD(RC[-5]/4-1,6)+1,FALSE),IF(MOD(RC[-5],2)=0,IF(RC[-5]>20,HLOOKUP(Sheet1!R2C7,Sheet1!R2C7:R43C7,MOD(RC[-5]/2-1,42)+1,FALSE),HLOOKUP(Sheet1!R2C4,Sheet1!R2C4:R7C4,MOD(RC[-5]-1,6)+1,FALSE)),MOD(RC[-5]-1,3)*30+104)) -> 100|101|102|103|104 | G325: =HLOOKUP(Sheet1!R2C1,Sheet1!R2C1:R16C1,MOD(RC1-1,2)+MOD(INT((RC1-1)/2),3)*5+1,FALSE)&"|"&HLOOKUP(Sheet1!R2C1,Sheet1!R2C1:R16C1,MOD(RC1,2)+MOD(INT((RC1)/2),3)*5+1,FALSE)&"|"&HLOOKUP(Sheet1!R2C1,Sheet1!R2C1:R16C1,MOD(RC1+1,2)+MOD(INT((RC1+1)/2),3)*5+1,FALSE)&"|"&HLOOKUP(Sheet1!R2C1,Sheet1!R2C1:R16C1,MOD(RC1+2,2)+MOD(INT((RC1+2)/2),3)*5+1,FALSE)&"|"&HLOOKUP(Sheet1!R2C1,Sheet1!R2C1:R16C1,MOD(RC1+3,2)+MOD(INT((RC1+3)/2),3)*5+1,FALSE) -> 100|101|130|131|160 | H325: =HLOOKUP(Sheet1!R2C1,Sheet1!R2C1:R16C1,MOD(RC1+2,2)+MOD(INT((RC1+2)/2),3)*5+1,FALSE)&"|"&HLOOKUP(Sheet1!R2C1,Sheet1!R2C1:R16C1,MOD(RC1+3,2)+MOD(INT((RC1+3)/2),3)*5+1,FALSE)&"|"&HLOOKUP(Sheet1!R2C1,Sheet1!R2C1:R16C1,MOD(RC1+4,2)+MOD(INT((RC1+4)/2),3)*5+1,FALSE)&"|"&HLOOKUP(Sheet1!R2C1,Sheet1!R2C1:R16C1,MOD(RC1+5,2)+MOD(INT((RC1+5)/2),3)*5+1,FALSE)&"|"&HLOOKUP(Sheet1!R2C1,Sheet1!R2C1:R16C1,MOD(RC1+6,2)+MOD(INT((RC1+6)/2),3)*5+1,FALSE) -> 131|160|161|100|101 | I325: =HLOOKUP(Sheet1!R2C1,Sheet1!R2C1:R16C1,MOD(RC1-1,3)+MOD(INT((RC1-1)/3),3)*5+3,FALSE)&"|"&HLOOKUP(Sheet1!R2C1,Sheet1!R2C1:R16C1,MOD(RC1,3)+MOD(INT((RC1)/3),3)*5+3,FALSE)&"|"&HLOOKUP(Sheet1!R2C1,Sheet1!R2C1:R16C1,MOD(RC1+1,3)+MOD(INT((RC1+1)/3),3)*5+3,FALSE)&"|"&HLOOKUP(Sheet1!R2C1,Sheet1!R2C1:R16C1,MOD(RC1+2,3)+MOD(INT((RC1+2)/3),3)*5+3,FALSE)&"|"&HLOOKUP(Sheet1!R2C1,Sheet1!R2C1:R16C1,MOD(RC1+3,3)+MOD(INT((RC1+3)/3),3)*5+3,FALSE) -> 132|133|134|162|163 | J325: =HLOOKUP(Sheet1!R2C1,Sheet1!R2C1:R16C1,MOD(RC1-1,3)+MOD(INT((RC1-1)/3),3)*5+3,FALSE)&"|"&HLOOKUP(Sheet1!R2C1,Sheet1!R2C1:R16C1,MOD(RC1,3)+MOD(INT((RC1)/3),3)*5+3,FALSE)&"|"&HLOOKUP(Sheet1!R2C1,Sheet1!R2C1:R16C1,MOD(RC1+1,3)+MOD(INT((RC1+1)/3),3)*5+3,FALSE)&"|"&HLOOKUP(Sheet1!R2C1,Sheet1!R2C1:R16C1,MOD(RC1+2,3)+MOD(INT((RC1+2)/3),3)*5+3,FALSE)&"|"&HLOOKUP(Sheet1!R2C1,Sheet1!R2C1:R16C1,MOD(RC1+3,3)+MOD(INT((RC1+3)/3),3)*5+3,FALSE) -> 132|133|134|162|163 | K325: =HLOOKUP(Sheet1!R2C1,Sheet1!R2C1:R16C1,MOD(RC1-1,3)+MOD(INT((RC1-1)/3),3)*5+3,FALSE)&"|"&HLOOKUP(Sheet1!R2C1,Sheet1!R2C1:R16C1,MOD(RC1,3)+MOD(INT((RC1)/3),3)*5+3,FALSE)&"|"&HLOOKUP(Sheet1!R2C1,Sheet1!R2C1:R16C1,MOD(RC1+1,3)+MOD(INT((RC1+1)/3),3)*5+3,FALSE)&"|"&HLOOKUP(Sheet1!R2C1,Sheet1!R2C1:R16C1,MOD(RC1+2,3)+MOD(INT((RC1+2)/3),3)*5+3,FALSE)&"|"&HLOOKUP(Sheet1!R2C1,Sheet1!R2C1:R16C1,MOD(RC1+3,3)+MOD(INT((RC1+3)/3),3)*5+3,FALSE) -> 132|133|134|162|163 | L325: 25|22|23|24 | M325: 3215001|3215001|3215003|3215003 | N325: 10030|10031|10032|10033 | O325: 1|1|1|1 | P325: 2500|2500|2500|2500
A326: 320 | B326: 318 | C326: 30 | D326: =R[-20]C+2 -> 50 | E326: 1000 | F326: =MOD(RC[-5]-1,3)*30+100&"|"&MOD(RC[-5]-1,3)*30+101&"|"&MOD(RC[-5]-1,3)*30+102&"|"&MOD(RC[-5]-1,3)*30+103&"|"&IF(MOD(RC[-5],4)=0,HLOOKUP(Sheet1!R2C10,Sheet1!R2C10:R7C10,MOD(RC[-5]/4-1,6)+1,FALSE),IF(MOD(RC[-5],2)=0,IF(RC[-5]>20,HLOOKUP(Sheet1!R2C7,Sheet1!R2C7:R43C7,MOD(RC[-5]/2-1,42)+1,FALSE),HLOOKUP(Sheet1!R2C4,Sheet1!R2C4:R7C4,MOD(RC[-5]-1,6)+1,FALSE)),MOD(RC[-5]-1,3)*30+104)) -> 130|131|132|133|191 | G326: =HLOOKUP(Sheet1!R2C1,Sheet1!R2C1:R16C1,MOD(RC1-1,2)+MOD(INT((RC1-1)/2),3)*5+1,FALSE)&"|"&HLOOKUP(Sheet1!R2C1,Sheet1!R2C1:R16C1,MOD(RC1,2)+MOD(INT((RC1)/2),3)*5+1,FALSE)&"|"&HLOOKUP(Sheet1!R2C1,Sheet1!R2C1:R16C1,MOD(RC1+1,2)+MOD(INT((RC1+1)/2),3)*5+1,FALSE)&"|"&HLOOKUP(Sheet1!R2C1,Sheet1!R2C1:R16C1,MOD(RC1+2,2)+MOD(INT((RC1+2)/2),3)*5+1,FALSE)&"|"&HLOOKUP(Sheet1!R2C1,Sheet1!R2C1:R16C1,MOD(RC1+3,2)+MOD(INT((RC1+3)/2),3)*5+1,FALSE) -> 101|130|131|160|161 | H326: =HLOOKUP(Sheet1!R2C1,Sheet1!R2C1:R16C1,MOD(RC1+2,2)+MOD(INT((RC1+2)/2),3)*5+1,FALSE)&"|"&HLOOKUP(Sheet1!R2C1,Sheet1!R2C1:R16C1,MOD(RC1+3,2)+MOD(INT((RC1+3)/2),3)*5+1,FALSE)&"|"&HLOOKUP(Sheet1!R2C1,Sheet1!R2C1:R16C1,MOD(RC1+4,2)+MOD(INT((RC1+4)/2),3)*5+1,FALSE)&"|"&HLOOKUP(Sheet1!R2C1,Sheet1!R2C1:R16C1,MOD(RC1+5,2)+MOD(INT((RC1+5)/2),3)*5+1,FALSE)&"|"&HLOOKUP(Sheet1!R2C1,Sheet1!R2C1:R16C1,MOD(RC1+6,2)+MOD(INT((RC1+6)/2),3)*5+1,FALSE) -> 160|161|100|101|130 | I326: =HLOOKUP(Sheet1!R2C1,Sheet1!R2C1:R16C1,MOD(RC1-1,3)+MOD(INT((RC1-1)/3),3)*5+3,FALSE)&"|"&HLOOKUP(Sheet1!R2C1,Sheet1!R2C1:R16C1,MOD(RC1,3)+MOD(INT((RC1)/3),3)*5+3,FALSE)&"|"&HLOOKUP(Sheet1!R2C1,Sheet1!R2C1:R16C1,MOD(RC1+1,3)+MOD(INT((RC1+1)/3),3)*5+3,FALSE)&"|"&HLOOKUP(Sheet1!R2C1,Sheet1!R2C1:R16C1,MOD(RC1+2,3)+MOD(INT((RC1+2)/3),3)*5+3,FALSE)&"|"&HLOOKUP(Sheet1!R2C1,Sheet1!R2C1:R16C1,MOD(RC1+3,3)+MOD(INT((RC1+3)/3),3)*5+3,FALSE) -> 133|134|162|163|164 | J326: =HLOOKUP(Sheet1!R2C1,Sheet1!R2C1:R16C1,MOD(RC1-1,3)+MOD(INT((RC1-1)/3),3)*5+3,FALSE)&"|"&HLOOKUP(Sheet1!R2C1,Sheet1!R2C1:R16C1,MOD(RC1,3)+MOD(INT((RC1)/3),3)*5+3,FALSE)&"|"&HLOOKUP(Sheet1!R2C1,Sheet1!R2C1:R16C1,MOD(RC1+1,3)+MOD(INT((RC1+1)/3),3)*5+3,FALSE)&"|"&HLOOKUP(Sheet1!R2C1,Sheet1!R2C1:R16C1,MOD(RC1+2,3)+MOD(INT((RC1+2)/3),3)*5+3,FALSE)&"|"&HLOOKUP(Sheet1!R2C1,Sheet1!R2C1:R16C1,MOD(RC1+3,3)+MOD(INT((RC1+3)/3),3)*5+3,FALSE) -> 133|134|162|163|164 | K326: =HLOOKUP(Sheet1!R2C1,Sheet1!R2C1:R16C1,MOD(RC1-1,3)+MOD(INT((RC1-1)/3),3)*5+3,FALSE)&"|"&HLOOKUP(Sheet1!R2C1,Sheet1!R2C1:R16C1,MOD(RC1,3)+MOD(INT((RC1)/3),3)*5+3,FALSE)&"|"&HLOOKUP(Sheet1!R2C1,Sheet1!R2C1:R16C1,MOD(RC1+1,3)+MOD(INT((RC1+1)/3),3)*5+3,FALSE)&"|"&HLOOKUP(Sheet1!R2C1,Sheet1!R2C1:R16C1,MOD(RC1+2,3)+MOD(INT((RC1+2)/3),3)*5+3,FALSE)&"|"&HLOOKUP(Sheet1!R2C1,Sheet1!R2C1:R16C1,MOD(RC1+3,3)+MOD(INT((RC1+3)/3),3)*5+3,FALSE) -> 133|134|162|163|164 | L326: 25|22|23|24 | M326: 3243301|3243301|3243300|3243300 | N326: 10030|10031|10032|10033|10030|10031|10032|10033|10030|10031|10032|10033|10030|10031|10032|10033|10030|10031|10032|10033|10030|10031|10032|10033|10030|10031|10032|10033|10030|10031|10032|10033|10030|10031|10032|10033|10030|10031|10032|10033 | O326: 1|1|1|1|1|1|1|1|1|1|1|1|1|1|1|1|1|1|1|1|1|1|1|1|1|1|1|1|1|1|1|1|1|1|1|1|1|1|1|1 | P326: 2500|2500|2500|2500|2500|2500|2500|2500|2500|2500|2500|2500|2500|2500|2500|2500|2500|2500|2500|2500|2500|2500|2500|2500|2500|2500|2500|2500|2500|2500|2500|2500|2500|2500|2500|2500|2500|2500|2500|2500
A327: 321 | B327: 319 | C327: 30 | D327: =R[-20]C+2 -> 52 | E327: 1000 | F327: =MOD(RC[-5]-1,3)*30+100&"|"&MOD(RC[-5]-1,3)*30+101&"|"&MOD(RC[-5]-1,3)*30+102&"|"&MOD(RC[-5]-1,3)*30+103&"|"&IF(MOD(RC[-5],4)=0,HLOOKUP(Sheet1!R2C10,Sheet1!R2C10:R7C10,MOD(RC[-5]/4-1,6)+1,FALSE),IF(MOD(RC[-5],2)=0,IF(RC[-5]>20,HLOOKUP(Sheet1!R2C7,Sheet1!R2C7:R43C7,MOD(RC[-5]/2-1,42)+1,FALSE),HLOOKUP(Sheet1!R2C4,Sheet1!R2C4:R7C4,MOD(RC[-5]-1,6)+1,FALSE)),MOD(RC[-5]-1,3)*30+104)) -> 160|161|162|163|164 | G327: =HLOOKUP(Sheet1!R2C1,Sheet1!R2C1:R16C1,MOD(RC1-1,2)+MOD(INT((RC1-1)/2),3)*5+1,FALSE)&"|"&HLOOKUP(Sheet1!R2C1,Sheet1!R2C1:R16C1,MOD(RC1,2)+MOD(INT((RC1)/2),3)*5+1,FALSE)&"|"&HLOOKUP(Sheet1!R2C1,Sheet1!R2C1:R16C1,MOD(RC1+1,2)+MOD(INT((RC1+1)/2),3)*5+1,FALSE)&"|"&HLOOKUP(Sheet1!R2C1,Sheet1!R2C1:R16C1,MOD(RC1+2,2)+MOD(INT((RC1+2)/2),3)*5+1,FALSE)&"|"&HLOOKUP(Sheet1!R2C1,Sheet1!R2C1:R16C1,MOD(RC1+3,2)+MOD(INT((RC1+3)/2),3)*5+1,FALSE) -> 130|131|160|161|100 | H327: =HLOOKUP(Sheet1!R2C1,Sheet1!R2C1:R16C1,MOD(RC1+2,2)+MOD(INT((RC1+2)/2),3)*5+1,FALSE)&"|"&HLOOKUP(Sheet1!R2C1,Sheet1!R2C1:R16C1,MOD(RC1+3,2)+MOD(INT((RC1+3)/2),3)*5+1,FALSE)&"|"&HLOOKUP(Sheet1!R2C1,Sheet1!R2C1:R16C1,MOD(RC1+4,2)+MOD(INT((RC1+4)/2),3)*5+1,FALSE)&"|"&HLOOKUP(Sheet1!R2C1,Sheet1!R2C1:R16C1,MOD(RC1+5,2)+MOD(INT((RC1+5)/2),3)*5+1,FALSE)&"|"&HLOOKUP(Sheet1!R2C1,Sheet1!R2C1:R16C1,MOD(RC1+6,2)+MOD(INT((RC1+6)/2),3)*5+1,FALSE) -> 161|100|101|130|131 | I327: =HLOOKUP(Sheet1!R2C1,Sheet1!R2C1:R16C1,MOD(RC1-1,3)+MOD(INT((RC1-1)/3),3)*5+3,FALSE)&"|"&HLOOKUP(Sheet1!R2C1,Sheet1!R2C1:R16C1,MOD(RC1,3)+MOD(INT((RC1)/3),3)*5+3,FALSE)&"|"&HLOOKUP(Sheet1!R2C1,Sheet1!R2C1:R16C1,MOD(RC1+1,3)+MOD(INT((RC1+1)/3),3)*5+3,FALSE)&"|"&HLOOKUP(Sheet1!R2C1,Sheet1!R2C1:R16C1,MOD(RC1+2,3)+MOD(INT((RC1+2)/3),3)*5+3,FALSE)&"|"&HLOOKUP(Sheet1!R2C1,Sheet1!R2C1:R16C1,MOD(RC1+3,3)+MOD(INT((RC1+3)/3),3)*5+3,FALSE) -> 134|162|163|164|102 | J327: =HLOOKUP(Sheet1!R2C1,Sheet1!R2C1:R16C1,MOD(RC1-1,3)+MOD(INT((RC1-1)/3),3)*5+3,FALSE)&"|"&HLOOKUP(Sheet1!R2C1,Sheet1!R2C1:R16C1,MOD(RC1,3)+MOD(INT((RC1)/3),3)*5+3,FALSE)&"|"&HLOOKUP(Sheet1!R2C1,Sheet1!R2C1:R16C1,MOD(RC1+1,3)+MOD(INT((RC1+1)/3),3)*5+3,FALSE)&"|"&HLOOKUP(Sheet1!R2C1,Sheet1!R2C1:R16C1,MOD(RC1+2,3)+MOD(INT((RC1+2)/3),3)*5+3,FALSE)&"|"&HLOOKUP(Sheet1!R2C1,Sheet1!R2C1:R16C1,MOD(RC1+3,3)+MOD(INT((RC1+3)/3),3)*5+3,FALSE) -> 134|162|163|164|102 | K327: =HLOOKUP(Sheet1!R2C1,Sheet1!R2C1:R16C1,MOD(RC1-1,3)+MOD(INT((RC1-1)/3),3)*5+3,FALSE)&"|"&HLOOKUP(Sheet1!R2C1,Sheet1!R2C1:R16C1,MOD(RC1,3)+MOD(INT((RC1)/3),3)*5+3,FALSE)&"|"&HLOOKUP(Sheet1!R2C1,Sheet1!R2C1:R16C1,MOD(RC1+1,3)+MOD(INT((RC1+1)/3),3)*5+3,FALSE)&"|"&HLOOKUP(Sheet1!R2C1,Sheet1!R2C1:R16C1,MOD(RC1+2,3)+MOD(INT((RC1+2)/3),3)*5+3,FALSE)&"|"&HLOOKUP(Sheet1!R2C1,Sheet1!R2C1:R16C1,MOD(RC1+3,3)+MOD(INT((RC1+3)/3),3)*5+3,FALSE) -> 134|162|163|164|102 | L327: 25|22|23|24 | M327: 3273608|3273609|3273608|3273608 | N327: 10030|10031|10032|10033 | O327: 1|1|1|1 | P327: 2500|2500|2500|2500
A328: 322 | B328: 320 | C328: 30 | D328: =R[-20]C+2 -> 52 | E328: 1000 | F328: =MOD(RC[-5]-1,3)*30+100&"|"&MOD(RC[-5]-1,3)*30+101&"|"&MOD(RC[-5]-1,3)*30+102&"|"&MOD(RC[-5]-1,3)*30+103&"|"&IF(MOD(RC[-5],4)=0,HLOOKUP(Sheet1!R2C10,Sheet1!R2C10:R7C10,MOD(RC[-5]/4-1,6)+1,FALSE),IF(MOD(RC[-5],2)=0,IF(RC[-5]>20,HLOOKUP(Sheet1!R2C7,Sheet1!R2C7:R43C7,MOD(RC[-5]/2-1,42)+1,FALSE),HLOOKUP(Sheet1!R2C4,Sheet1!R2C4:R7C4,MOD(RC[-5]-1,6)+1,FALSE)),MOD(RC[-5]-1,3)*30+104)) -> 100|101|102|103|178 | G328: =HLOOKUP(Sheet1!R2C1,Sheet1!R2C1:R16C1,MOD(RC1-1,2)+MOD(INT((RC1-1)/2),3)*5+1,FALSE)&"|"&HLOOKUP(Sheet1!R2C1,Sheet1!R2C1:R16C1,MOD(RC1,2)+MOD(INT((RC1)/2),3)*5+1,FALSE)&"|"&HLOOKUP(Sheet1!R2C1,Sheet1!R2C1:R16C1,MOD(RC1+1,2)+MOD(INT((RC1+1)/2),3)*5+1,FALSE)&"|"&HLOOKUP(Sheet1!R2C1,Sheet1!R2C1:R16C1,MOD(RC1+2,2)+MOD(INT((RC1+2)/2),3)*5+1,FALSE)&"|"&HLOOKUP(Sheet1!R2C1,Sheet1!R2C1:R16C1,MOD(RC1+3,2)+MOD(INT((RC1+3)/2),3)*5+1,FALSE) -> 131|160|161|100|101 | H328: =HLOOKUP(Sheet1!R2C1,Sheet1!R2C1:R16C1,MOD(RC1+2,2)+MOD(INT((RC1+2)/2),3)*5+1,FALSE)&"|"&HLOOKUP(Sheet1!R2C1,Sheet1!R2C1:R16C1,MOD(RC1+3,2)+MOD(INT((RC1+3)/2),3)*5+1,FALSE)&"|"&HLOOKUP(Sheet1!R2C1,Sheet1!R2C1:R16C1,MOD(RC1+4,2)+MOD(INT((RC1+4)/2),3)*5+1,FALSE)&"|"&HLOOKUP(Sheet1!R2C1,Sheet1!R2C1:R16C1,MOD(RC1+5,2)+MOD(INT((RC1+5)/2),3)*5+1,FALSE)&"|"&HLOOKUP(Sheet1!R2C1,Sheet1!R2C1:R16C1,MOD(RC1+6,2)+MOD(INT((RC1+6)/2),3)*5+1,FALSE) -> 100|101|130|131|160 | I328: =HLOOKUP(Sheet1!R2C1,Sheet1!R2C1:R16C1,MOD(RC1-1,3)+MOD(INT((RC1-1)/3),3)*5+3,FALSE)&"|"&HLOOKUP(Sheet1!R2C1,Sheet1!R2C1:R16C1,MOD(RC1,3)+MOD(INT((RC1)/3),3)*5+3,FALSE)&"|"&HLOOKUP(Sheet1!R2C1,Sheet1!R2C1:R16C1,MOD(RC1+1,3)+MOD(INT((RC1+1)/3),3)*5+3,FALSE)&"|"&HLOOKUP(Sheet1!R2C1,Sheet1!R2C1:R16C1,MOD(RC1+2,3)+MOD(INT((RC1+2)/3),3)*5+3,FALSE)&"|"&HLOOKUP(Sheet1!R2C1,Sheet1!R2C1:R16C1,MOD(RC1+3,3)+MOD(INT((RC1+3)/3),3)*5+3,FALSE) -> 162|163|164|102|103 | J328: =HLOOKUP(Sheet1!R2C1,Sheet1!R2C1:R16C1,MOD(RC1-1,3)+MOD(INT((RC1-1)/3),3)*5+3,FALSE)&"|"&HLOOKUP(Sheet1!R2C1,Sheet1!R2C1:R16C1,MOD(RC1,3)+MOD(INT((RC1)/3),3)*5+3,FALSE)&"|"&HLOOKUP(Sheet1!R2C1,Sheet1!R2C1:R16C1,MOD(RC1+1,3)+MOD(INT((RC1+1)/3),3)*5+3,FALSE)&"|"&HLOOKUP(Sheet1!R2C1,Sheet1!R2C1:R16C1,MOD(RC1+2,3)+MOD(INT((RC1+2)/3),3)*5+3,FALSE)&"|"&HLOOKUP(Sheet1!R2C1,Sheet1!R2C1:R16C1,MOD(RC1+3,3)+MOD(INT((RC1+3)/3),3)*5+3,FALSE) -> 162|163|164|102|103 | K328: =HLOOKUP(Sheet1!R2C1,Sheet1!R2C1:R16C1,MOD(RC1-1,3)+MOD(INT((RC1-1)/3),3)*5+3,FALSE)&"|"&HLOOKUP(Sheet1!R2C1,Sheet1!R2C1:R16C1,MOD(RC1,3)+MOD(INT((RC1)/3),3)*5+3,FALSE)&"|"&HLOOKUP(Sheet1!R2C1,Sheet1!R2C1:R16C1,MOD(RC1+1,3)+MOD(INT((RC1+1)/3),3)*5+3,FALSE)&"|"&HLOOKUP(Sheet1!R2C1,Sheet1!R2C1:R16C1,MOD(RC1+2,3)+MOD(INT((RC1+2)/3),3)*5+3,FALSE)&"|"&HLOOKUP(Sheet1!R2C1,Sheet1!R2C1:R16C1,MOD(RC1+3,3)+MOD(INT((RC1+3)/3),3)*5+3,FALSE) -> 162|163|164|102|103 | L328: 25|22|23|24 | M328: 3302951|3302950|3302950|3302950 | N328: 10030|10031|10032|10033 | O328: 1|1|1|1 | P328: 2500|2500|2500|2500
A329: 323 | B329: 321 | C329: 30 | D329: =R[-20]C+2 -> 52 | E329: 1000 | F329: =MOD(RC[-5]-1,3)*30+100&"|"&MOD(RC[-5]-1,3)*30+101&"|"&MOD(RC[-5]-1,3)*30+102&"|"&MOD(RC[-5]-1,3)*30+103&"|"&IF(MOD(RC[-5],4)=0,HLOOKUP(Sheet1!R2C10,Sheet1!R2C10:R7C10,MOD(RC[-5]/4-1,6)+1,FALSE),IF(MOD(RC[-5],2)=0,IF(RC[-5]>20,HLOOKUP(Sheet1!R2C7,Sheet1!R2C7:R43C7,MOD(RC[-5]/2-1,42)+1,FALSE),HLOOKUP(Sheet1!R2C4,Sheet1!R2C4:R7C4,MOD(RC[-5]-1,6)+1,FALSE)),MOD(RC[-5]-1,3)*30+104)) -> 130|131|132|133|134 | G329: =HLOOKUP(Sheet1!R2C1,Sheet1!R2C1:R16C1,MOD(RC1-1,2)+MOD(INT((RC1-1)/2),3)*5+1,FALSE)&"|"&HLOOKUP(Sheet1!R2C1,Sheet1!R2C1:R16C1,MOD(RC1,2)+MOD(INT((RC1)/2),3)*5+1,FALSE)&"|"&HLOOKUP(Sheet1!R2C1,Sheet1!R2C1:R16C1,MOD(RC1+1,2)+MOD(INT((RC1+1)/2),3)*5+1,FALSE)&"|"&HLOOKUP(Sheet1!R2C1,Sheet1!R2C1:R16C1,MOD(RC1+2,2)+MOD(INT((RC1+2)/2),3)*5+1,FALSE)&"|"&HLOOKUP(Sheet1!R2C1,Sheet1!R2C1:R16C1,MOD(RC1+3,2)+MOD(INT((RC1+3)/2),3)*5+1,FALSE) -> 160|161|100|101|130 | H329: =HLOOKUP(Sheet1!R2C1,Sheet1!R2C1:R16C1,MOD(RC1+2,2)+MOD(INT((RC1+2)/2),3)*5+1,FALSE)&"|"&HLOOKUP(Sheet1!R2C1,Sheet1!R2C1:R16C1,MOD(RC1+3,2)+MOD(INT((RC1+3)/2),3)*5+1,FALSE)&"|"&HLOOKUP(Sheet1!R2C1,Sheet1!R2C1:R16C1,MOD(RC1+4,2)+MOD(INT((RC1+4)/2),3)*5+1,FALSE)&"|"&HLOOKUP(Sheet1!R2C1,Sheet1!R2C1:R16C1,MOD(RC1+5,2)+MOD(INT((RC1+5)/2),3)*5+1,FALSE)&"|"&HLOOKUP(Sheet1!R2C1,Sheet1!R2C1:R16C1,MOD(RC1+6,2)+MOD(INT((RC1+6)/2),3)*5+1,FALSE) -> 101|130|131|160|161 | I329: =HLOOKUP(Sheet1!R2C1,Sheet1!R2C1:R16C1,MOD(RC1-1,3)+MOD(INT((RC1-1)/3),3)*5+3,FALSE)&"|"&HLOOKUP(Sheet1!R2C1,Sheet1!R2C1:R16C1,MOD(RC1,3)+MOD(INT((RC1)/3),3)*5+3,FALSE)&"|"&HLOOKUP(Sheet1!R2C1,Sheet1!R2C1:R16C1,MOD(RC1+1,3)+MOD(INT((RC1+1)/3),3)*5+3,FALSE)&"|"&HLOOKUP(Sheet1!R2C1,Sheet1!R2C1:R16C1,MOD(RC1+2,3)+MOD(INT((RC1+2)/3),3)*5+3,FALSE)&"|"&HLOOKUP(Sheet1!R2C1,Sheet1!R2C1:R16C1,MOD(RC1+3,3)+MOD(INT((RC1+3)/3),3)*5+3,FALSE) -> 163|164|102|103|104 | J329: =HLOOKUP(Sheet1!R2C1,Sheet1!R2C1:R16C1,MOD(RC1-1,3)+MOD(INT((RC1-1)/3),3)*5+3,FALSE)&"|"&HLOOKUP(Sheet1!R2C1,Sheet1!R2C1:R16C1,MOD(RC1,3)+MOD(INT((RC1)/3),3)*5+3,FALSE)&"|"&HLOOKUP(Sheet1!R2C1,Sheet1!R2C1:R16C1,MOD(RC1+1,3)+MOD(INT((RC1+1)/3),3)*5+3,FALSE)&"|"&HLOOKUP(Sheet1!R2C1,Sheet1!R2C1:R16C1,MOD(RC1+2,3)+MOD(INT((RC1+2)/3),3)*5+3,FALSE)&"|"&HLOOKUP(Sheet1!R2C1,Sheet1!R2C1:R16C1,MOD(RC1+3,3)+MOD(INT((RC1+3)/3),3)*5+3,FALSE) -> 163|164|102|103|104 | K329: =HLOOKUP(Sheet1!R2C1,Sheet1!R2C1:R16C1,MOD(RC1-1,3)+MOD(INT((RC1-1)/3),3)*5+3,FALSE)&"|"&HLOOKUP(Sheet1!R2C1,Sheet1!R2C1:R16C1,MOD(RC1,3)+MOD(INT((RC1)/3),3)*5+3,FALSE)&"|"&HLOOKUP(Sheet1!R2C1,Sheet1!R2C1:R16C1,MOD(RC1+1,3)+MOD(INT((RC1+1)/3),3)*5+3,FALSE)&"|"&HLOOKUP(Sheet1!R2C1,Sheet1!R2C1:R16C1,MOD(RC1+2,3)+MOD(INT((RC1+2)/3),3)*5+3,FALSE)&"|"&HLOOKUP(Sheet1!R2C1,Sheet1!R2C1:R16C1,MOD(RC1+3,3)+MOD(INT((RC1+3)/3),3)*5+3,FALSE) -> 163|164|102|103|104 | L329: 25|22|23|24 | M329: 3332293|3332293|3332293|3332293 | N329: 10030|10031|10032|10033 | O329: 1|1|1|1 | P329: 2500|2500|2500|2500
A330: 324 | B330: 322 | C330: 30 | D330: =R[-20]C+2 -> 52 | E330: 1000 | F330: =MOD(RC[-5]-1,3)*30+100&"|"&MOD(RC[-5]-1,3)*30+101&"|"&MOD(RC[-5]-1,3)*30+102&"|"&MOD(RC[-5]-1,3)*30+103&"|"&IF(MOD(RC[-5],4)=0,HLOOKUP(Sheet1!R2C10,Sheet1!R2C10:R7C10,MOD(RC[-5]/4-1,6)+1,FALSE),IF(MOD(RC[-5],2)=0,IF(RC[-5]>20,HLOOKUP(Sheet1!R2C7,Sheet1!R2C7:R43C7,MOD(RC[-5]/2-1,42)+1,FALSE),HLOOKUP(Sheet1!R2C4,Sheet1!R2C4:R7C4,MOD(RC[-5]-1,6)+1,FALSE)),MOD(RC[-5]-1,3)*30+104)) -> 160|161|162|163|192 | G330: =HLOOKUP(Sheet1!R2C1,Sheet1!R2C1:R16C1,MOD(RC1-1,2)+MOD(INT((RC1-1)/2),3)*5+1,FALSE)&"|"&HLOOKUP(Sheet1!R2C1,Sheet1!R2C1:R16C1,MOD(RC1,2)+MOD(INT((RC1)/2),3)*5+1,FALSE)&"|"&HLOOKUP(Sheet1!R2C1,Sheet1!R2C1:R16C1,MOD(RC1+1,2)+MOD(INT((RC1+1)/2),3)*5+1,FALSE)&"|"&HLOOKUP(Sheet1!R2C1,Sheet1!R2C1:R16C1,MOD(RC1+2,2)+MOD(INT((RC1+2)/2),3)*5+1,FALSE)&"|"&HLOOKUP(Sheet1!R2C1,Sheet1!R2C1:R16C1,MOD(RC1+3,2)+MOD(INT((RC1+3)/2),3)*5+1,FALSE) -> 161|100|101|130|131 | H330: =HLOOKUP(Sheet1!R2C1,Sheet1!R2C1:R16C1,MOD(RC1+2,2)+MOD(INT((RC1+2)/2),3)*5+1,FALSE)&"|"&HLOOKUP(Sheet1!R2C1,Sheet1!R2C1:R16C1,MOD(RC1+3,2)+MOD(INT((RC1+3)/2),3)*5+1,FALSE)&"|"&HLOOKUP(Sheet1!R2C1,Sheet1!R2C1:R16C1,MOD(RC1+4,2)+MOD(INT((RC1+4)/2),3)*5+1,FALSE)&"|"&HLOOKUP(Sheet1!R2C1,Sheet1!R2C1:R16C1,MOD(RC1+5,2)+MOD(INT((RC1+5)/2),3)*5+1,FALSE)&"|"&HLOOKUP(Sheet1!R2C1,Sheet1!R2C1:R16C1,MOD(RC1+6,2)+MOD(INT((RC1+6)/2),3)*5+1,FALSE) -> 130|131|160|161|100 | I330: =HLOOKUP(Sheet1!R2C1,Sheet1!R2C1:R16C1,MOD(RC1-1,3)+MOD(INT((RC1-1)/3),3)*5+3,FALSE)&"|"&HLOOKUP(Sheet1!R2C1,Sheet1!R2C1:R16C1,MOD(RC1,3)+MOD(INT((RC1)/3),3)*5+3,FALSE)&"|"&HLOOKUP(Sheet1!R2C1,Sheet1!R2C1:R16C1,MOD(RC1+1,3)+MOD(INT((RC1+1)/3),3)*5+3,FALSE)&"|"&HLOOKUP(Sheet1!R2C1,Sheet1!R2C1:R16C1,MOD(RC1+2,3)+MOD(INT((RC1+2)/3),3)*5+3,FALSE)&"|"&HLOOKUP(Sheet1!R2C1,Sheet1!R2C1:R16C1,MOD(RC1+3,3)+MOD(INT((RC1+3)/3),3)*5+3,FALSE) -> 164|102|103|104|132 | J330: =HLOOKUP(Sheet1!R2C1,Sheet1!R2C1:R16C1,MOD(RC1-1,3)+MOD(INT((RC1-1)/3),3)*5+3,FALSE)&"|"&HLOOKUP(Sheet1!R2C1,Sheet1!R2C1:R16C1,MOD(RC1,3)+MOD(INT((RC1)/3),3)*5+3,FALSE)&"|"&HLOOKUP(Sheet1!R2C1,Sheet1!R2C1:R16C1,MOD(RC1+1,3)+MOD(INT((RC1+1)/3),3)*5+3,FALSE)&"|"&HLOOKUP(Sheet1!R2C1,Sheet1!R2C1:R16C1,MOD(RC1+2,3)+MOD(INT((RC1+2)/3),3)*5+3,FALSE)&"|"&HLOOKUP(Sheet1!R2C1,Sheet1!R2C1:R16C1,MOD(RC1+3,3)+MOD(INT((RC1+3)/3),3)*5+3,FALSE) -> 164|102|103|104|132 | K330: =HLOOKUP(Sheet1!R2C1,Sheet1!R2C1:R16C1,MOD(RC1-1,3)+MOD(INT((RC1-1)/3),3)*5+3,FALSE)&"|"&HLOOKUP(Sheet1!R2C1,Sheet1!R2C1:R16C1,MOD(RC1,3)+MOD(INT((RC1)/3),3)*5+3,FALSE)&"|"&HLOOKUP(Sheet1!R2C1,Sheet1!R2C1:R16C1,MOD(RC1+1,3)+MOD(INT((RC1+1)/3),3)*5+3,FALSE)&"|"&HLOOKUP(Sheet1!R2C1,Sheet1!R2C1:R16C1,MOD(RC1+2,3)+MOD(INT((RC1+2)/3),3)*5+3,FALSE)&"|"&HLOOKUP(Sheet1!R2C1,Sheet1!R2C1:R16C1,MOD(RC1+3,3)+MOD(INT((RC1+3)/3),3)*5+3,FALSE) -> 164|102|103|104|132 | L330: 25|22|23|24 | M330: 3361635|3361635|3361635|3361635 | N330: 10030|10031|10032|10033 | O330: 1|1|1|1 | P330: 2500|2500|2500|2500
A331: 325 | B331: 323 | C331: 30 | D331: =R[-20]C+2 -> 52 | E331: 1000 | F331: =MOD(RC[-5]-1,3)*30+100&"|"&MOD(RC[-5]-1,3)*30+101&"|"&MOD(RC[-5]-1,3)*30+102&"|"&MOD(RC[-5]-1,3)*30+103&"|"&IF(MOD(RC[-5],4)=0,HLOOKUP(Sheet1!R2C10,Sheet1!R2C10:R7C10,MOD(RC[-5]/4-1,6)+1,FALSE),IF(MOD(RC[-5],2)=0,IF(RC[-5]>20,HLOOKUP(Sheet1!R2C7,Sheet1!R2C7:R43C7,MOD(RC[-5]/2-1,42)+1,FALSE),HLOOKUP(Sheet1!R2C4,Sheet1!R2C4:R7C4,MOD(RC[-5]-1,6)+1,FALSE)),MOD(RC[-5]-1,3)*30+104)) -> 100|101|102|103|104 | G331: =HLOOKUP(Sheet1!R2C1,Sheet1!R2C1:R16C1,MOD(RC1-1,2)+MOD(INT((RC1-1)/2),3)*5+1,FALSE)&"|"&HLOOKUP(Sheet1!R2C1,Sheet1!R2C1:R16C1,MOD(RC1,2)+MOD(INT((RC1)/2),3)*5+1,FALSE)&"|"&HLOOKUP(Sheet1!R2C1,Sheet1!R2C1:R16C1,MOD(RC1+1,2)+MOD(INT((RC1+1)/2),3)*5+1,FALSE)&"|"&HLOOKUP(Sheet1!R2C1,Sheet1!R2C1:R16C1,MOD(RC1+2,2)+MOD(INT((RC1+2)/2),3)*5+1,FALSE)&"|"&HLOOKUP(Sheet1!R2C1,Sheet1!R2C1:R16C1,MOD(RC1+3,2)+MOD(INT((RC1+3)/2),3)*5+1,FALSE) -> 100|101|130|131|160 | H331: =HLOOKUP(Sheet1!R2C1,Sheet1!R2C1:R16C1,MOD(RC1+2,2)+MOD(INT((RC1+2)/2),3)*5+1,FALSE)&"|"&HLOOKUP(Sheet1!R2C1,Sheet1!R2C1:R16C1,MOD(RC1+3,2)+MOD(INT((RC1+3)/2),3)*5+1,FALSE)&"|"&HLOOKUP(Sheet1!R2C1,Sheet1!R2C1:R16C1,MOD(RC1+4,2)+MOD(INT((RC1+4)/2),3)*5+1,FALSE)&"|"&HLOOKUP(Sheet1!R2C1,Sheet1!R2C1:R16C1,MOD(RC1+5,2)+MOD(INT((RC1+5)/2),3)*5+1,FALSE)&"|"&HLOOKUP(Sheet1!R2C1,Sheet1!R2C1:R16C1,MOD(RC1+6,2)+MOD(INT((RC1+6)/2),3)*5+1,FALSE) -> 131|160|161|100|101 | I331: =HLOOKUP(Sheet1!R2C1,Sheet1!R2C1:R16C1,MOD(RC1-1,3)+MOD(INT((RC1-1)/3),3)*5+3,FALSE)&"|"&HLOOKUP(Sheet1!R2C1,Sheet1!R2C1:R16C1,MOD(RC1,3)+MOD(INT((RC1)/3),3)*5+3,FALSE)&"|"&HLOOKUP(Sheet1!R2C1,Sheet1!R2C1:R16C1,MOD(RC1+1,3)+MOD(INT((RC1+1)/3),3)*5+3,FALSE)&"|"&HLOOKUP(Sheet1!R2C1,Sheet1!R2C1:R16C1,MOD(RC1+2,3)+MOD(INT((RC1+2)/3),3)*5+3,FALSE)&"|"&HLOOKUP(Sheet1!R2C1,Sheet1!R2C1:R16C1,MOD(RC1+3,3)+MOD(INT((RC1+3)/3),3)*5+3,FALSE) -> 102|103|104|132|133 | J331: =HLOOKUP(Sheet1!R2C1,Sheet1!R2C1:R16C1,MOD(RC1-1,3)+MOD(INT((RC1-1)/3),3)*5+3,FALSE)&"|"&HLOOKUP(Sheet1!R2C1,Sheet1!R2C1:R16C1,MOD(RC1,3)+MOD(INT((RC1)/3),3)*5+3,FALSE)&"|"&HLOOKUP(Sheet1!R2C1,Sheet1!R2C1:R16C1,MOD(RC1+1,3)+MOD(INT((RC1+1)/3),3)*5+3,FALSE)&"|"&HLOOKUP(Sheet1!R2C1,Sheet1!R2C1:R16C1,MOD(RC1+2,3)+MOD(INT((RC1+2)/3),3)*5+3,FALSE)&"|"&HLOOKUP(Sheet1!R2C1,Sheet1!R2C1:R16C1,MOD(RC1+3,3)+MOD(INT((RC1+3)/3),3)*5+3,FALSE) -> 102|103|104|132|133 | K331: =HLOOKUP(Sheet1!R2C1,Sheet1!R2C1:R16C1,MOD(RC1-1,3)+MOD(INT((RC1-1)/3),3)*5+3,FALSE)&"|"&HLOOKUP(Sheet1!R2C1,Sheet1!R2C1:R16C1,MOD(RC1,3)+MOD(INT((RC1)/3),3)*5+3,FALSE)&"|"&HLOOKUP(Sheet1!R2C1,Sheet1!R2C1:R16C1,MOD(RC1+1,3)+MOD(INT((RC1+1)/3),3)*5+3,FALSE)&"|"&HLOOKUP(Sheet1!R2C1,Sheet1!R2C1:R16C1,MOD(RC1+2,3)+MOD(INT((RC1+2)/3),3)*5+3,FALSE)&"|"&HLOOKUP(Sheet1!R2C1,Sheet1!R2C1:R16C1,MOD(RC1+3,3)+MOD(INT((RC1+3)/3),3)*5+3,FALSE) -> 102|103|104|132|133 | L331: 25|22|23|24 | M331: 3391882|3391883|3391883|3391883 | N331: 10030|10031|10032|10033|10030|10031|10032|10033|10030|10031|10032|10033|10030|10031|10032|10033|10030|10031|10032|10033|10030|10031|10032|10033|10030|10031|10032|10033|10030|10031|10032|10033|10030|10031|10032|10033|10030|10031|10032|10033 | O331: 1|1|1|1|1|1|1|1|1|1|1|1|1|1|1|1|1|1|1|1|1|1|1|1|1|1|1|1|1|1|1|1|1|1|1|1|1|1|1|1 | P331: 2500|2500|2500|2500|2500|2500|2500|2500|2500|2500|2500|2500|2500|2500|2500|2500|2500|2500|2500|2500|2500|2500|2500|2500|2500|2500|2500|2500|2500|2500|2500|2500|2500|2500|2500|2500|2500|2500|2500|2500
A332: 326 | B332: 324 | C332: 30 | D332: =R[-20]C+2 -> 52 | E332: 1000 | F332: =MOD(RC[-5]-1,3)*30+100&"|"&MOD(RC[-5]-1,3)*30+101&"|"&MOD(RC[-5]-1,3)*30+102&"|"&MOD(RC[-5]-1,3)*30+103&"|"&IF(MOD(RC[-5],4)=0,HLOOKUP(Sheet1!R2C10,Sheet1!R2C10:R7C10,MOD(RC[-5]/4-1,6)+1,FALSE),IF(MOD(RC[-5],2)=0,IF(RC[-5]>20,HLOOKUP(Sheet1!R2C7,Sheet1!R2C7:R43C7,MOD(RC[-5]/2-1,42)+1,FALSE),HLOOKUP(Sheet1!R2C4,Sheet1!R2C4:R7C4,MOD(RC[-5]-1,6)+1,FALSE)),MOD(RC[-5]-1,3)*30+104)) -> 130|131|132|133|180 | G332: =HLOOKUP(Sheet1!R2C1,Sheet1!R2C1:R16C1,MOD(RC1-1,2)+MOD(INT((RC1-1)/2),3)*5+1,FALSE)&"|"&HLOOKUP(Sheet1!R2C1,Sheet1!R2C1:R16C1,MOD(RC1,2)+MOD(INT((RC1)/2),3)*5+1,FALSE)&"|"&HLOOKUP(Sheet1!R2C1,Sheet1!R2C1:R16C1,MOD(RC1+1,2)+MOD(INT((RC1+1)/2),3)*5+1,FALSE)&"|"&HLOOKUP(Sheet1!R2C1,Sheet1!R2C1:R16C1,MOD(RC1+2,2)+MOD(INT((RC1+2)/2),3)*5+1,FALSE)&"|"&HLOOKUP(Sheet1!R2C1,Sheet1!R2C1:R16C1,MOD(RC1+3,2)+MOD(INT((RC1+3)/2),3)*5+1,FALSE) -> 101|130|131|160|161 | H332: =HLOOKUP(Sheet1!R2C1,Sheet1!R2C1:R16C1,MOD(RC1+2,2)+MOD(INT((RC1+2)/2),3)*5+1,FALSE)&"|"&HLOOKUP(Sheet1!R2C1,Sheet1!R2C1:R16C1,MOD(RC1+3,2)+MOD(INT((RC1+3)/2),3)*5+1,FALSE)&"|"&HLOOKUP(Sheet1!R2C1,Sheet1!R2C1:R16C1,MOD(RC1+4,2)+MOD(INT((RC1+4)/2),3)*5+1,FALSE)&"|"&HLOOKUP(Sheet1!R2C1,Sheet1!R2C1:R16C1,MOD(RC1+5,2)+MOD(INT((RC1+5)/2),3)*5+1,FALSE)&"|"&HLOOKUP(Sheet1!R2C1,Sheet1!R2C1:R16C1,MOD(RC1+6,2)+MOD(INT((RC1+6)/2),3)*5+1,FALSE) -> 160|161|100|101|130 | I332: =HLOOKUP(Sheet1!R2C1,Sheet1!R2C1:R16C1,MOD(RC1-1,3)+MOD(INT((RC1-1)/3),3)*5+3,FALSE)&"|"&HLOOKUP(Sheet1!R2C1,Sheet1!R2C1:R16C1,MOD(RC1,3)+MOD(INT((RC1)/3),3)*5+3,FALSE)&"|"&HLOOKUP(Sheet1!R2C1,Sheet1!R2C1:R16C1,MOD(RC1+1,3)+MOD(INT((RC1+1)/3),3)*5+3,FALSE)&"|"&HLOOKUP(Sheet1!R2C1,Sheet1!R2C1:R16C1,MOD(RC1+2,3)+MOD(INT((RC1+2)/3),3)*5+3,FALSE)&"|"&HLOOKUP(Sheet1!R2C1,Sheet1!R2C1:R16C1,MOD(RC1+3,3)+MOD(INT((RC1+3)/3),3)*5+3,FALSE) -> 103|104|132|133|134 | J332: =HLOOKUP(Sheet1!R2C1,Sheet1!R2C1:R16C1,MOD(RC1-1,3)+MOD(INT((RC1-1)/3),3)*5+3,FALSE)&"|"&HLOOKUP(Sheet1!R2C1,Sheet1!R2C1:R16C1,MOD(RC1,3)+MOD(INT((RC1)/3),3)*5+3,FALSE)&"|"&HLOOKUP(Sheet1!R2C1,Sheet1!R2C1:R16C1,MOD(RC1+1,3)+MOD(INT((RC1+1)/3),3)*5+3,FALSE)&"|"&HLOOKUP(Sheet1!R2C1,Sheet1!R2C1:R16C1,MOD(RC1+2,3)+MOD(INT((RC1+2)/3),3)*5+3,FALSE)&"|"&HLOOKUP(Sheet1!R2C1,Sheet1!R2C1:R16C1,MOD(RC1+3,3)+MOD(INT((RC1+3)/3),3)*5+3,FALSE) -> 103|104|132|133|134 | K332: =HLOOKUP(Sheet1!R2C1,Sheet1!R2C1:R16C1,MOD(RC1-1,3)+MOD(INT((RC1-1)/3),3)*5+3,FALSE)&"|"&HLOOKUP(Sheet1!R2C1,Sheet1!R2C1:R16C1,MOD(RC1,3)+MOD(INT((RC1)/3),3)*5+3,FALSE)&"|"&HLOOKUP(Sheet1!R2C1,Sheet1!R2C1:R16C1,MOD(RC1+1,3)+MOD(INT((RC1+1)/3),3)*5+3,FALSE)&"|"&HLOOKUP(Sheet1!R2C1,Sheet1!R2C1:R16C1,MOD(RC1+2,3)+MOD(INT((RC1+2)/3),3)*5+3,FALSE)&"|"&HLOOKUP(Sheet1!R2C1,Sheet1!R2C1:R16C1,MOD(RC1+3,3)+MOD(INT((RC1+3)/3),3)*5+3,FALSE) -> 103|104|132|133|134 | L332: 25|22|23|24 | M332: 3422301|3422301|3422300|3422300 | N332: 10030|10031|10032|10033 | O332: 1|1|1|1 | P332: 2500|2500|2500|2500
A333: 327 | B333: 325 | C333: 30 | D333: =R[-20]C+2 -> 52 | E333: 1000 | F333: =MOD(RC[-5]-1,3)*30+100&"|"&MOD(RC[-5]-1,3)*30+101&"|"&MOD(RC[-5]-1,3)*30+102&"|"&MOD(RC[-5]-1,3)*30+103&"|"&IF(MOD(RC[-5],4)=0,HLOOKUP(Sheet1!R2C10,Sheet1!R2C10:R7C10,MOD(RC[-5]/4-1,6)+1,FALSE),IF(MOD(RC[-5],2)=0,IF(RC[-5]>20,HLOOKUP(Sheet1!R2C7,Sheet1!R2C7:R43C7,MOD(RC[-5]/2-1,42)+1,FALSE),HLOOKUP(Sheet1!R2C4,Sheet1!R2C4:R7C4,MOD(RC[-5]-1,6)+1,FALSE)),MOD(RC[-5]-1,3)*30+104)) -> 160|161|162|163|164 | G333: =HLOOKUP(Sheet1!R2C1,Sheet1!R2C1:R16C1,MOD(RC1-1,2)+MOD(INT((RC1-1)/2),3)*5+1,FALSE)&"|"&HLOOKUP(Sheet1!R2C1,Sheet1!R2C1:R16C1,MOD(RC1,2)+MOD(INT((RC1)/2),3)*5+1,FALSE)&"|"&HLOOKUP(Sheet1!R2C1,Sheet1!R2C1:R16C1,MOD(RC1+1,2)+MOD(INT((RC1+1)/2),3)*5+1,FALSE)&"|"&HLOOKUP(Sheet1!R2C1,Sheet1!R2C1:R16C1,MOD(RC1+2,2)+MOD(INT((RC1+2)/2),3)*5+1,FALSE)&"|"&HLOOKUP(Sheet1!R2C1,Sheet1!R2C1:R16C1,MOD(RC1+3,2)+MOD(INT((RC1+3)/2),3)*5+1,FALSE) -> 130|131|160|161|100 | H333: =HLOOKUP(Sheet1!R2C1,Sheet1!R2C1:R16C1,MOD(RC1+2,2)+MOD(INT((RC1+2)/2),3)*5+1,FALSE)&"|"&HLOOKUP(Sheet1!R2C1,Sheet1!R2C1:R16C1,MOD(RC1+3,2)+MOD(INT((RC1+3)/2),3)*5+1,FALSE)&"|"&HLOOKUP(Sheet1!R2C1,Sheet1!R2C1:R16C1,MOD(RC1+4,2)+MOD(INT((RC1+4)/2),3)*5+1,FALSE)&"|"&HLOOKUP(Sheet1!R2C1,Sheet1!R2C1:R16C1,MOD(RC1+5,2)+MOD(INT((RC1+5)/2),3)*5+1,FALSE)&"|"&HLOOKUP(Sheet1!R2C1,Sheet1!R2C1:R16C1,MOD(RC1+6,2)+MOD(INT((RC1+6)/2),3)*5+1,FALSE) -> 161|100|101|130|131 | I333: =HLOOKUP(Sheet1!R2C1,Sheet1!R2C1:R16C1,MOD(RC1-1,3)+MOD(INT((RC1-1)/3),3)*5+3,FALSE)&"|"&HLOOKUP(Sheet1!R2C1,Sheet1!R2C1:R16C1,MOD(RC1,3)+MOD(INT((RC1)/3),3)*5+3,FALSE)&"|"&HLOOKUP(Sheet1!R2C1,Sheet1!R2C1:R16C1,MOD(RC1+1,3)+MOD(INT((RC1+1)/3),3)*5+3,FALSE)&"|"&HLOOKUP(Sheet1!R2C1,Sheet1!R2C1:R16C1,MOD(RC1+2,3)+MOD(INT((RC1+2)/3),3)*5+3,FALSE)&"|"&HLOOKUP(Sheet1!R2C1,Sheet1!R2C1:R16C1,MOD(RC1+3,3)+MOD(INT((RC1+3)/3),3)*5+3,FALSE) -> 104|132|133|134|162 | J333: =HLOOKUP(Sheet1!R2C1,Sheet1!R2C1:R16C1,MOD(RC1-1,3)+MOD(INT((RC1-1)/3),3)*5+3,FALSE)&"|"&HLOOKUP(Sheet1!R2C1,Sheet1!R2C1:R16C1,MOD(RC1,3)+MOD(INT((RC1)/3),3)*5+3,FALSE)&"|"&HLOOKUP(Sheet1!R2C1,Sheet1!R2C1:R16C1,MOD(RC1+1,3)+MOD(INT((RC1+1)/3),3)*5+3,FALSE)&"|"&HLOOKUP(Sheet1!R2C1,Sheet1!R2C1:R16C1,MOD(RC1+2,3)+MOD(INT((RC1+2)/3),3)*5+3,FALSE)&"|"&HLOOKUP(Sheet1!R2C1,Sheet1!R2C1:R16C1,MOD(RC1+3,3)+MOD(INT((RC1+3)/3),3)*5+3,FALSE) -> 104|132|133|134|162 | K333: =HLOOKUP(Sheet1!R2C1,Sheet1!R2C1:R16C1,MOD(RC1-1,3)+MOD(INT((RC1-1)/3),3)*5+3,FALSE)&"|"&HLOOKUP(Sheet1!R2C1,Sheet1!R2C1:R16C1,MOD(RC1,3)+MOD(INT((RC1)/3),3)*5+3,FALSE)&"|"&HLOOKUP(Sheet1!R2C1,Sheet1!R2C1:R16C1,MOD(RC1+1,3)+MOD(INT((RC1+1)/3),3)*5+3,FALSE)&"|"&HLOOKUP(Sheet1!R2C1,Sheet1!R2C1:R16C1,MOD(RC1+2,3)+MOD(INT((RC1+2)/3),3)*5+3,FALSE)&"|"&HLOOKUP(Sheet1!R2C1,Sheet1!R2C1:R16C1,MOD(RC1+3,3)+MOD(INT((RC1+3)/3),3)*5+3,FALSE) -> 104|132|133|134|162 | L333: 25|22|23|24 | M333: 3453937|3453936|3453938|3453938 | N333: 10030|10031|10032|10033 | O333: 1|1|1|1 | P333: 2500|2500|2500|2500
A334: 328 | B334: 326 | C334: 30 | D334: =R[-20]C+2 -> 52 | E334: 1000 | F334: =MOD(RC[-5]-1,3)*30+100&"|"&MOD(RC[-5]-1,3)*30+101&"|"&MOD(RC[-5]-1,3)*30+102&"|"&MOD(RC[-5]-1,3)*30+103&"|"&IF(MOD(RC[-5],4)=0,HLOOKUP(Sheet1!R2C10,Sheet1!R2C10:R7C10,MOD(RC[-5]/4-1,6)+1,FALSE),IF(MOD(RC[-5],2)=0,IF(RC[-5]>20,HLOOKUP(Sheet1!R2C7,Sheet1!R2C7:R43C7,MOD(RC[-5]/2-1,42)+1,FALSE),HLOOKUP(Sheet1!R2C4,Sheet1!R2C4:R7C4,MOD(RC[-5]-1,6)+1,FALSE)),MOD(RC[-5]-1,3)*30+104)) -> 100|101|102|103|193 | G334: =HLOOKUP(Sheet1!R2C1,Sheet1!R2C1:R16C1,MOD(RC1-1,2)+MOD(INT((RC1-1)/2),3)*5+1,FALSE)&"|"&HLOOKUP(Sheet1!R2C1,Sheet1!R2C1:R16C1,MOD(RC1,2)+MOD(INT((RC1)/2),3)*5+1,FALSE)&"|"&HLOOKUP(Sheet1!R2C1,Sheet1!R2C1:R16C1,MOD(RC1+1,2)+MOD(INT((RC1+1)/2),3)*5+1,FALSE)&"|"&HLOOKUP(Sheet1!R2C1,Sheet1!R2C1:R16C1,MOD(RC1+2,2)+MOD(INT((RC1+2)/2),3)*5+1,FALSE)&"|"&HLOOKUP(Sheet1!R2C1,Sheet1!R2C1:R16C1,MOD(RC1+3,2)+MOD(INT((RC1+3)/2),3)*5+1,FALSE) -> 131|160|161|100|101 | H334: =HLOOKUP(Sheet1!R2C1,Sheet1!R2C1:R16C1,MOD(RC1+2,2)+MOD(INT((RC1+2)/2),3)*5+1,FALSE)&"|"&HLOOKUP(Sheet1!R2C1,Sheet1!R2C1:R16C1,MOD(RC1+3,2)+MOD(INT((RC1+3)/2),3)*5+1,FALSE)&"|"&HLOOKUP(Sheet1!R2C1,Sheet1!R2C1:R16C1,MOD(RC1+4,2)+MOD(INT((RC1+4)/2),3)*5+1,FALSE)&"|"&HLOOKUP(Sheet1!R2C1,Sheet1!R2C1:R16C1,MOD(RC1+5,2)+MOD(INT((RC1+5)/2),3)*5+1,FALSE)&"|"&HLOOKUP(Sheet1!R2C1,Sheet1!R2C1:R16C1,MOD(RC1+6,2)+MOD(INT((RC1+6)/2),3)*5+1,FALSE) -> 100|101|130|131|160 | I334: =HLOOKUP(Sheet1!R2C1,Sheet1!R2C1:R16C1,MOD(RC1-1,3)+MOD(INT((RC1-1)/3),3)*5+3,FALSE)&"|"&HLOOKUP(Sheet1!R2C1,Sheet1!R2C1:R16C1,MOD(RC1,3)+MOD(INT((RC1)/3),3)*5+3,FALSE)&"|"&HLOOKUP(Sheet1!R2C1,Sheet1!R2C1:R16C1,MOD(RC1+1,3)+MOD(INT((RC1+1)/3),3)*5+3,FALSE)&"|"&HLOOKUP(Sheet1!R2C1,Sheet1!R2C1:R16C1,MOD(RC1+2,3)+MOD(INT((RC1+2)/3),3)*5+3,FALSE)&"|"&HLOOKUP(Sheet1!R2C1,Sheet1!R2C1:R16C1,MOD(RC1+3,3)+MOD(INT((RC1+3)/3),3)*5+3,FALSE) -> 132|133|134|162|163 | J334: =HLOOKUP(Sheet1!R2C1,Sheet1!R2C1:R16C1,MOD(RC1-1,3)+MOD(INT((RC1-1)/3),3)*5+3,FALSE)&"|"&HLOOKUP(Sheet1!R2C1,Sheet1!R2C1:R16C1,MOD(RC1,3)+MOD(INT((RC1)/3),3)*5+3,FALSE)&"|"&HLOOKUP(Sheet1!R2C1,Sheet1!R2C1:R16C1,MOD(RC1+1,3)+MOD(INT((RC1+1)/3),3)*5+3,FALSE)&"|"&HLOOKUP(Sheet1!R2C1,Sheet1!R2C1:R16C1,MOD(RC1+2,3)+MOD(INT((RC1+2)/3),3)*5+3,FALSE)&"|"&HLOOKUP(Sheet1!R2C1,Sheet1!R2C1:R16C1,MOD(RC1+3,3)+MOD(INT((RC1+3)/3),3)*5+3,FALSE) -> 132|133|134|162|163 | K334: =HLOOKUP(Sheet1!R2C1,Sheet1!R2C1:R16C1,MOD(RC1-1,3)+MOD(INT((RC1-1)/3),3)*5+3,FALSE)&"|"&HLOOKUP(Sheet1!R2C1,Sheet1!R2C1:R16C1,MOD(RC1,3)+MOD(INT((RC1)/3),3)*5+3,FALSE)&"|"&HLOOKUP(Sheet1!R2C1,Sheet1!R2C1:R16C1,MOD(RC1+1,3)+MOD(INT((RC1+1)/3),3)*5+3,FALSE)&"|"&HLOOKUP(Sheet1!R2C1,Sheet1!R2C1:R16C1,MOD(RC1+2,3)+MOD(INT((RC1+2)/3),3)*5+3,FALSE)&"|"&HLOOKUP(Sheet1!R2C1,Sheet1!R2C1:R16C1,MOD(RC1+3,3)+MOD(INT((RC1+3)/3),3)*5+3,FALSE) -> 132|133|134|162|163 | L334: 25|22|23|24 | M334: 3484356|3484356|3484355|3484355 | N334: 10030|10031|10032|10033 | O334: 1|1|1|1 | P334: 2500|2500|2500|2500
A335: 329 | B335: 327 | C335: 30 | D335: =R[-20]C+2 -> 52 | E335: 1000 | F335: =MOD(RC[-5]-1,3)*30+100&"|"&MOD(RC[-5]-1,3)*30+101&"|"&MOD(RC[-5]-1,3)*30+102&"|"&MOD(RC[-5]-1,3)*30+103&"|"&IF(MOD(RC[-5],4)=0,HLOOKUP(Sheet1!R2C10,Sheet1!R2C10:R7C10,MOD(RC[-5]/4-1,6)+1,FALSE),IF(MOD(RC[-5],2)=0,IF(RC[-5]>20,HLOOKUP(Sheet1!R2C7,Sheet1!R2C7:R43C7,MOD(RC[-5]/2-1,42)+1,FALSE),HLOOKUP(Sheet1!R2C4,Sheet1!R2C4:R7C4,MOD(RC[-5]-1,6)+1,FALSE)),MOD(RC[-5]-1,3)*30+104)) -> 130|131|132|133|134 | G335: =HLOOKUP(Sheet1!R2C1,Sheet1!R2C1:R16C1,MOD(RC1-1,2)+MOD(INT((RC1-1)/2),3)*5+1,FALSE)&"|"&HLOOKUP(Sheet1!R2C1,Sheet1!R2C1:R16C1,MOD(RC1,2)+MOD(INT((RC1)/2),3)*5+1,FALSE)&"|"&HLOOKUP(Sheet1!R2C1,Sheet1!R2C1:R16C1,MOD(RC1+1,2)+MOD(INT((RC1+1)/2),3)*5+1,FALSE)&"|"&HLOOKUP(Sheet1!R2C1,Sheet1!R2C1:R16C1,MOD(RC1+2,2)+MOD(INT((RC1+2)/2),3)*5+1,FALSE)&"|"&HLOOKUP(Sheet1!R2C1,Sheet1!R2C1:R16C1,MOD(RC1+3,2)+MOD(INT((RC1+3)/2),3)*5+1,FALSE) -> 160|161|100|101|130 | H335: =HLOOKUP(Sheet1!R2C1,Sheet1!R2C1:R16C1,MOD(RC1+2,2)+MOD(INT((RC1+2)/2),3)*5+1,FALSE)&"|"&HLOOKUP(Sheet1!R2C1,Sheet1!R2C1:R16C1,MOD(RC1+3,2)+MOD(INT((RC1+3)/2),3)*5+1,FALSE)&"|"&HLOOKUP(Sheet1!R2C1,Sheet1!R2C1:R16C1,MOD(RC1+4,2)+MOD(INT((RC1+4)/2),3)*5+1,FALSE)&"|"&HLOOKUP(Sheet1!R2C1,Sheet1!R2C1:R16C1,MOD(RC1+5,2)+MOD(INT((RC1+5)/2),3)*5+1,FALSE)&"|"&HLOOKUP(Sheet1!R2C1,Sheet1!R2C1:R16C1,MOD(RC1+6,2)+MOD(INT((RC1+6)/2),3)*5+1,FALSE) -> 101|130|131|160|161 | I335: =HLOOKUP(Sheet1!R2C1,Sheet1!R2C1:R16C1,MOD(RC1-1,3)+MOD(INT((RC1-1)/3),3)*5+3,FALSE)&"|"&HLOOKUP(Sheet1!R2C1,Sheet1!R2C1:R16C1,MOD(RC1,3)+MOD(INT((RC1)/3),3)*5+3,FALSE)&"|"&HLOOKUP(Sheet1!R2C1,Sheet1!R2C1:R16C1,MOD(RC1+1,3)+MOD(INT((RC1+1)/3),3)*5+3,FALSE)&"|"&HLOOKUP(Sheet1!R2C1,Sheet1!R2C1:R16C1,MOD(RC1+2,3)+MOD(INT((RC1+2)/3),3)*5+3,FALSE)&"|"&HLOOKUP(Sheet1!R2C1,Sheet1!R2C1:R16C1,MOD(RC1+3,3)+MOD(INT((RC1+3)/3),3)*5+3,FALSE) -> 133|134|162|163|164 | J335: =HLOOKUP(Sheet1!R2C1,Sheet1!R2C1:R16C1,MOD(RC1-1,3)+MOD(INT((RC1-1)/3),3)*5+3,FALSE)&"|"&HLOOKUP(Sheet1!R2C1,Sheet1!R2C1:R16C1,MOD(RC1,3)+MOD(INT((RC1)/3),3)*5+3,FALSE)&"|"&HLOOKUP(Sheet1!R2C1,Sheet1!R2C1:R16C1,MOD(RC1+1,3)+MOD(INT((RC1+1)/3),3)*5+3,FALSE)&"|"&HLOOKUP(Sheet1!R2C1,Sheet1!R2C1:R16C1,MOD(RC1+2,3)+MOD(INT((RC1+2)/3),3)*5+3,FALSE)&"|"&HLOOKUP(Sheet1!R2C1,Sheet1!R2C1:R16C1,MOD(RC1+3,3)+MOD(INT((RC1+3)/3),3)*5+3,FALSE) -> 133|134|162|163|164 | K335: =HLOOKUP(Sheet1!R2C1,Sheet1!R2C1:R16C1,MOD(RC1-1,3)+MOD(INT((RC1-1)/3),3)*5+3,FALSE)&"|"&HLOOKUP(Sheet1!R2C1,Sheet1!R2C1:R16C1,MOD(RC1,3)+MOD(INT((RC1)/3),3)*5+3,FALSE)&"|"&HLOOKUP(Sheet1!R2C1,Sheet1!R2C1:R16C1,MOD(RC1+1,3)+MOD(INT((RC1+1)/3),3)*5+3,FALSE)&"|"&HLOOKUP(Sheet1!R2C1,Sheet1!R2C1:R16C1,MOD(RC1+2,3)+MOD(INT((RC1+2)/3),3)*5+3,FALSE)&"|"&HLOOKUP(Sheet1!R2C1,Sheet1!R2C1:R16C1,MOD(RC1+3,3)+MOD(INT((RC1+3)/3),3)*5+3,FALSE) -> 133|134|162|163|164 | L335: 25|22|23|24 | M335: 3515769|3515769|3515770|3515770 | N335: 10030|10031|10032|10033 | O335: 1|1|1|1 | P335: 2500|2500|2500|2500
A336: 330 | B336: 328 | C336: 30 | D336: =R[-20]C+2 -> 52 | E336: 1000 | F336: =MOD(RC[-5]-1,3)*30+100&"|"&MOD(RC[-5]-1,3)*30+101&"|"&MOD(RC[-5]-1,3)*30+102&"|"&MOD(RC[-5]-1,3)*30+103&"|"&IF(MOD(RC[-5],4)=0,HLOOKUP(Sheet1!R2C10,Sheet1!R2C10:R7C10,MOD(RC[-5]/4-1,6)+1,FALSE),IF(MOD(RC[-5],2)=0,IF(RC[-5]>20,HLOOKUP(Sheet1!R2C7,Sheet1!R2C7:R43C7,MOD(RC[-5]/2-1,42)+1,FALSE),HLOOKUP(Sheet1!R2C4,Sheet1!R2C4:R7C4,MOD(RC[-5]-1,6)+1,FALSE)),MOD(RC[-5]-1,3)*30+104)) -> 160|161|162|163|182 | G336: =HLOOKUP(Sheet1!R2C1,Sheet1!R2C1:R16C1,MOD(RC1-1,2)+MOD(INT((RC1-1)/2),3)*5+1,FALSE)&"|"&HLOOKUP(Sheet1!R2C1,Sheet1!R2C1:R16C1,MOD(RC1,2)+MOD(INT((RC1)/2),3)*5+1,FALSE)&"|"&HLOOKUP(Sheet1!R2C1,Sheet1!R2C1:R16C1,MOD(RC1+1,2)+MOD(INT((RC1+1)/2),3)*5+1,FALSE)&"|"&HLOOKUP(Sheet1!R2C1,Sheet1!R2C1:R16C1,MOD(RC1+2,2)+MOD(INT((RC1+2)/2),3)*5+1,FALSE)&"|"&HLOOKUP(Sheet1!R2C1,Sheet1!R2C1:R16C1,MOD(RC1+3,2)+MOD(INT((RC1+3)/2),3)*5+1,FALSE) -> 161|100|101|130|131 | H336: =HLOOKUP(Sheet1!R2C1,Sheet1!R2C1:R16C1,MOD(RC1+2,2)+MOD(INT((RC1+2)/2),3)*5+1,FALSE)&"|"&HLOOKUP(Sheet1!R2C1,Sheet1!R2C1:R16C1,MOD(RC1+3,2)+MOD(INT((RC1+3)/2),3)*5+1,FALSE)&"|"&HLOOKUP(Sheet1!R2C1,Sheet1!R2C1:R16C1,MOD(RC1+4,2)+MOD(INT((RC1+4)/2),3)*5+1,FALSE)&"|"&HLOOKUP(Sheet1!R2C1,Sheet1!R2C1:R16C1,MOD(RC1+5,2)+MOD(INT((RC1+5)/2),3)*5+1,FALSE)&"|"&HLOOKUP(Sheet1!R2C1,Sheet1!R2C1:R16C1,MOD(RC1+6,2)+MOD(INT((RC1+6)/2),3)*5+1,FALSE) -> 130|131|160|161|100 | I336: =HLOOKUP(Sheet1!R2C1,Sheet1!R2C1:R16C1,MOD(RC1-1,3)+MOD(INT((RC1-1)/3),3)*5+3,FALSE)&"|"&HLOOKUP(Sheet1!R2C1,Sheet1!R2C1:R16C1,MOD(RC1,3)+MOD(INT((RC1)/3),3)*5+3,FALSE)&"|"&HLOOKUP(Sheet1!R2C1,Sheet1!R2C1:R16C1,MOD(RC1+1,3)+MOD(INT((RC1+1)/3),3)*5+3,FALSE)&"|"&HLOOKUP(Sheet1!R2C1,Sheet1!R2C1:R16C1,MOD(RC1+2,3)+MOD(INT((RC1+2)/3),3)*5+3,FALSE)&"|"&HLOOKUP(Sheet1!R2C1,Sheet1!R2C1:R16C1,MOD(RC1+3,3)+MOD(INT((RC1+3)/3),3)*5+3,FALSE) -> 134|162|163|164|102 | J336: =HLOOKUP(Sheet1!R2C1,Sheet1!R2C1:R16C1,MOD(RC1-1,3)+MOD(INT((RC1-1)/3),3)*5+3,FALSE)&"|"&HLOOKUP(Sheet1!R2C1,Sheet1!R2C1:R16C1,MOD(RC1,3)+MOD(INT((RC1)/3),3)*5+3,FALSE)&"|"&HLOOKUP(Sheet1!R2C1,Sheet1!R2C1:R16C1,MOD(RC1+1,3)+MOD(INT((RC1+1)/3),3)*5+3,FALSE)&"|"&HLOOKUP(Sheet1!R2C1,Sheet1!R2C1:R16C1,MOD(RC1+2,3)+MOD(INT((RC1+2)/3),3)*5+3,FALSE)&"|"&HLOOKUP(Sheet1!R2C1,Sheet1!R2C1:R16C1,MOD(RC1+3,3)+MOD(INT((RC1+3)/3),3)*5+3,FALSE) -> 134|162|163|164|102 | K336: =HLOOKUP(Sheet1!R2C1,Sheet1!R2C1:R16C1,MOD(RC1-1,3)+MOD(INT((RC1-1)/3),3)*5+3,FALSE)&"|"&HLOOKUP(Sheet1!R2C1,Sheet1!R2C1:R16C1,MOD(RC1,3)+MOD(INT((RC1)/3),3)*5+3,FALSE)&"|"&HLOOKUP(Sheet1!R2C1,Sheet1!R2C1:R16C1,MOD(RC1+1,3)+MOD(INT((RC1+1)/3),3)*5+3,FALSE)&"|"&HLOOKUP(Sheet1!R2C1,Sheet1!R2C1:R16C1,MOD(RC1+2,3)+MOD(INT((RC1+2)/3),3)*5+3,FALSE)&"|"&HLOOKUP(Sheet1!R2C1,Sheet1!R2C1:R16C1,MOD(RC1+3,3)+MOD(INT((RC1+3)/3),3)*5+3,FALSE) -> 134|162|163|164|102 | L336: 25|22|23|24 | M336: 3547319|3547319|3547318|3547318 | N336: 10030|10031|10032|10033|10030|10031|10032|10033|10030|10031|10032|10033|10030|10031|10032|10033|10030|10031|10032|10033|10030|10031|10032|10033|10030|10031|10032|10033|10030|10031|10032|10033|10030|10031|10032|10033|10030|10031|10032|10033 | O336: 1|1|1|1|1|1|1|1|1|1|1|1|1|1|1|1|1|1|1|1|1|1|1|1|1|1|1|1|1|1|1|1|1|1|1|1|1|1|1|1 | P336: 2500|2500|2500|2500|2500|2500|2500|2500|2500|2500|2500|2500|2500|2500|2500|2500|2500|2500|2500|2500|2500|2500|2500|2500|2500|2500|2500|2500|2500|2500|2500|2500|2500|2500|2500|2500|2500|2500|2500|2500
A337: 331 | B337: 329 | C337: 30 | D337: =R[-20]C+2 -> 52 | E337: 1000 | F337: =MOD(RC[-5]-1,3)*30+100&"|"&MOD(RC[-5]-1,3)*30+101&"|"&MOD(RC[-5]-1,3)*30+102&"|"&MOD(RC[-5]-1,3)*30+103&"|"&IF(MOD(RC[-5],4)=0,HLOOKUP(Sheet1!R2C10,Sheet1!R2C10:R7C10,MOD(RC[-5]/4-1,6)+1,FALSE),IF(MOD(RC[-5],2)=0,IF(RC[-5]>20,HLOOKUP(Sheet1!R2C7,Sheet1!R2C7:R43C7,MOD(RC[-5]/2-1,42)+1,FALSE),HLOOKUP(Sheet1!R2C4,Sheet1!R2C4:R7C4,MOD(RC[-5]-1,6)+1,FALSE)),MOD(RC[-5]-1,3)*30+104)) -> 100|101|102|103|104 | G337: =HLOOKUP(Sheet1!R2C1,Sheet1!R2C1:R16C1,MOD(RC1-1,2)+MOD(INT((RC1-1)/2),3)*5+1,FALSE)&"|"&HLOOKUP(Sheet1!R2C1,Sheet1!R2C1:R16C1,MOD(RC1,2)+MOD(INT((RC1)/2),3)*5+1,FALSE)&"|"&HLOOKUP(Sheet1!R2C1,Sheet1!R2C1:R16C1,MOD(RC1+1,2)+MOD(INT((RC1+1)/2),3)*5+1,FALSE)&"|"&HLOOKUP(Sheet1!R2C1,Sheet1!R2C1:R16C1,MOD(RC1+2,2)+MOD(INT((RC1+2)/2),3)*5+1,FALSE)&"|"&HLOOKUP(Sheet1!R2C1,Sheet1!R2C1:R16C1,MOD(RC1+3,2)+MOD(INT((RC1+3)/2),3)*5+1,FALSE) -> 100|101|130|131|160 | H337: =HLOOKUP(Sheet1!R2C1,Sheet1!R2C1:R16C1,MOD(RC1+2,2)+MOD(INT((RC1+2)/2),3)*5+1,FALSE)&"|"&HLOOKUP(Sheet1!R2C1,Sheet1!R2C1:R16C1,MOD(RC1+3,2)+MOD(INT((RC1+3)/2),3)*5+1,FALSE)&"|"&HLOOKUP(Sheet1!R2C1,Sheet1!R2C1:R16C1,MOD(RC1+4,2)+MOD(INT((RC1+4)/2),3)*5+1,FALSE)&"|"&HLOOKUP(Sheet1!R2C1,Sheet1!R2C1:R16C1,MOD(RC1+5,2)+MOD(INT((RC1+5)/2),3)*5+1,FALSE)&"|"&HLOOKUP(Sheet1!R2C1,Sheet1!R2C1:R16C1,MOD(RC1+6,2)+MOD(INT((RC1+6)/2),3)*5+1,FALSE) -> 131|160|161|100|101 | I337: =HLOOKUP(Sheet1!R2C1,Sheet1!R2C1:R16C1,MOD(RC1-1,3)+MOD(INT((RC1-1)/3),3)*5+3,FALSE)&"|"&HLOOKUP(Sheet1!R2C1,Sheet1!R2C1:R16C1,MOD(RC1,3)+MOD(INT((RC1)/3),3)*5+3,FALSE)&"|"&HLOOKUP(Sheet1!R2C1,Sheet1!R2C1:R16C1,MOD(RC1+1,3)+MOD(INT((RC1+1)/3),3)*5+3,FALSE)&"|"&HLOOKUP(Sheet1!R2C1,Sheet1!R2C1:R16C1,MOD(RC1+2,3)+MOD(INT((RC1+2)/3),3)*5+3,FALSE)&"|"&HLOOKUP(Sheet1!R2C1,Sheet1!R2C1:R16C1,MOD(RC1+3,3)+MOD(INT((RC1+3)/3),3)*5+3,FALSE) -> 162|163|164|102|103 | J337: =HLOOKUP(Sheet1!R2C1,Sheet1!R2C1:R16C1,MOD(RC1-1,3)+MOD(INT((RC1-1)/3),3)*5+3,FALSE)&"|"&HLOOKUP(Sheet1!R2C1,Sheet1!R2C1:R16C1,MOD(RC1,3)+MOD(INT((RC1)/3),3)*5+3,FALSE)&"|"&HLOOKUP(Sheet1!R2C1,Sheet1!R2C1:R16C1,MOD(RC1+1,3)+MOD(INT((RC1+1)/3),3)*5+3,FALSE)&"|"&HLOOKUP(Sheet1!R2C1,Sheet1!R2C1:R16C1,MOD(RC1+2,3)+MOD(INT((RC1+2)/3),3)*5+3,FALSE)&"|"&HLOOKUP(Sheet1!R2C1,Sheet1!R2C1:R16C1,MOD(RC1+3,3)+MOD(INT((RC1+3)/3),3)*5+3,FALSE) -> 162|163|164|102|103 | K337: =HLOOKUP(Sheet1!R2C1,Sheet1!R2C1:R16C1,MOD(RC1-1,3)+MOD(INT((RC1-1)/3),3)*5+3,FALSE)&"|"&HLOOKUP(Sheet1!R2C1,Sheet1!R2C1:R16C1,MOD(RC1,3)+MOD(INT((RC1)/3),3)*5+3,FALSE)&"|"&HLOOKUP(Sheet1!R2C1,Sheet1!R2C1:R16C1,MOD(RC1+1,3)+MOD(INT((RC1+1)/3),3)*5+3,FALSE)&"|"&HLOOKUP(Sheet1!R2C1,Sheet1!R2C1:R16C1,MOD(RC1+2,3)+MOD(INT((RC1+2)/3),3)*5+3,FALSE)&"|"&HLOOKUP(Sheet1!R2C1,Sheet1!R2C1:R16C1,MOD(RC1+3,3)+MOD(INT((RC1+3)/3),3)*5+3,FALSE) -> 162|163|164|102|103 | L337: 25|22|23|24 | M337: 3578868|3578868|3578868|3578868 | N337: 10030|10031|10032|10033 | O337: 1|1|1|1 | P337: 2500|2500|2500|2500
A338: 332 | B338: 330 | C338: 30 | D338: =R[-20]C+2 -> 52 | E338: 1000 | F338: =MOD(RC[-5]-1,3)*30+100&"|"&MOD(RC[-5]-1,3)*30+101&"|"&MOD(RC[-5]-1,3)*30+102&"|"&MOD(RC[-5]-1,3)*30+103&"|"&IF(MOD(RC[-5],4)=0,HLOOKUP(Sheet1!R2C10,Sheet1!R2C10:R7C10,MOD(RC[-5]/4-1,6)+1,FALSE),IF(MOD(RC[-5],2)=0,IF(RC[-5]>20,HLOOKUP(Sheet1!R2C7,Sheet1!R2C7:R43C7,MOD(RC[-5]/2-1,42)+1,FALSE),HLOOKUP(Sheet1!R2C4,Sheet1!R2C4:R7C4,MOD(RC[-5]-1,6)+1,FALSE)),MOD(RC[-5]-1,3)*30+104)) -> 130|131|132|133|194 | G338: =HLOOKUP(Sheet1!R2C1,Sheet1!R2C1:R16C1,MOD(RC1-1,2)+MOD(INT((RC1-1)/2),3)*5+1,FALSE)&"|"&HLOOKUP(Sheet1!R2C1,Sheet1!R2C1:R16C1,MOD(RC1,2)+MOD(INT((RC1)/2),3)*5+1,FALSE)&"|"&HLOOKUP(Sheet1!R2C1,Sheet1!R2C1:R16C1,MOD(RC1+1,2)+MOD(INT((RC1+1)/2),3)*5+1,FALSE)&"|"&HLOOKUP(Sheet1!R2C1,Sheet1!R2C1:R16C1,MOD(RC1+2,2)+MOD(INT((RC1+2)/2),3)*5+1,FALSE)&"|"&HLOOKUP(Sheet1!R2C1,Sheet1!R2C1:R16C1,MOD(RC1+3,2)+MOD(INT((RC1+3)/2),3)*5+1,FALSE) -> 101|130|131|160|161 | H338: =HLOOKUP(Sheet1!R2C1,Sheet1!R2C1:R16C1,MOD(RC1+2,2)+MOD(INT((RC1+2)/2),3)*5+1,FALSE)&"|"&HLOOKUP(Sheet1!R2C1,Sheet1!R2C1:R16C1,MOD(RC1+3,2)+MOD(INT((RC1+3)/2),3)*5+1,FALSE)&"|"&HLOOKUP(Sheet1!R2C1,Sheet1!R2C1:R16C1,MOD(RC1+4,2)+MOD(INT((RC1+4)/2),3)*5+1,FALSE)&"|"&HLOOKUP(Sheet1!R2C1,Sheet1!R2C1:R16C1,MOD(RC1+5,2)+MOD(INT((RC1+5)/2),3)*5+1,FALSE)&"|"&HLOOKUP(Sheet1!R2C1,Sheet1!R2C1:R16C1,MOD(RC1+6,2)+MOD(INT((RC1+6)/2),3)*5+1,FALSE) -> 160|161|100|101|130 | I338: =HLOOKUP(Sheet1!R2C1,Sheet1!R2C1:R16C1,MOD(RC1-1,3)+MOD(INT((RC1-1)/3),3)*5+3,FALSE)&"|"&HLOOKUP(Sheet1!R2C1,Sheet1!R2C1:R16C1,MOD(RC1,3)+MOD(INT((RC1)/3),3)*5+3,FALSE)&"|"&HLOOKUP(Sheet1!R2C1,Sheet1!R2C1:R16C1,MOD(RC1+1,3)+MOD(INT((RC1+1)/3),3)*5+3,FALSE)&"|"&HLOOKUP(Sheet1!R2C1,Sheet1!R2C1:R16C1,MOD(RC1+2,3)+MOD(INT((RC1+2)/3),3)*5+3,FALSE)&"|"&HLOOKUP(Sheet1!R2C1,Sheet1!R2C1:R16C1,MOD(RC1+3,3)+MOD(INT((RC1+3)/3),3)*5+3,FALSE) -> 163|164|102|103|104 | J338: =HLOOKUP(Sheet1!R2C1,Sheet1!R2C1:R16C1,MOD(RC1-1,3)+MOD(INT((RC1-1)/3),3)*5+3,FALSE)&"|"&HLOOKUP(Sheet1!R2C1,Sheet1!R2C1:R16C1,MOD(RC1,3)+MOD(INT((RC1)/3),3)*5+3,FALSE)&"|"&HLOOKUP(Sheet1!R2C1,Sheet1!R2C1:R16C1,MOD(RC1+1,3)+MOD(INT((RC1+1)/3),3)*5+3,FALSE)&"|"&HLOOKUP(Sheet1!R2C1,Sheet1!R2C1:R16C1,MOD(RC1+2,3)+MOD(INT((RC1+2)/3),3)*5+3,FALSE)&"|"&HLOOKUP(Sheet1!R2C1,Sheet1!R2C1:R16C1,MOD(RC1+3,3)+MOD(INT((RC1+3)/3),3)*5+3,FALSE) -> 163|164|102|103|104 | K338: =HLOOKUP(Sheet1!R2C1,Sheet1!R2C1:R16C1,MOD(RC1-1,3)+MOD(INT((RC1-1)/3),3)*5+3,FALSE)&"|"&HLOOKUP(Sheet1!R2C1,Sheet1!R2C1:R16C1,MOD(RC1,3)+MOD(INT((RC1)/3),3)*5+3,FALSE)&"|"&HLOOKUP(Sheet1!R2C1,Sheet1!R2C1:R16C1,MOD(RC1+1,3)+MOD(INT((RC1+1)/3),3)*5+3,FALSE)&"|"&HLOOKUP(Sheet1!R2C1,Sheet1!R2C1:R16C1,MOD(RC1+2,3)+MOD(INT((RC1+2)/3),3)*5+3,FALSE)&"|"&HLOOKUP(Sheet1!R2C1,Sheet1!R2C1:R16C1,MOD(RC1+3,3)+MOD(INT((RC1+3)/3),3)*5+3,FALSE) -> 163|164|102|103|104 | L338: 25|22|23|24 | M338: 3610417|3610416|3610418|3610418 | N338: 10030|10031|10032|10033 | O338: 1|1|1|1 | P338: 2500|2500|2500|2500
A339: 333 | B339: 331 | C339: 30 | D339: =R[-20]C+2 -> 52 | E339: 1000 | F339: =MOD(RC[-5]-1,3)*30+100&"|"&MOD(RC[-5]-1,3)*30+101&"|"&MOD(RC[-5]-1,3)*30+102&"|"&MOD(RC[-5]-1,3)*30+103&"|"&IF(MOD(RC[-5],4)=0,HLOOKUP(Sheet1!R2C10,Sheet1!R2C10:R7C10,MOD(RC[-5]/4-1,6)+1,FALSE),IF(MOD(RC[-5],2)=0,IF(RC[-5]>20,HLOOKUP(Sheet1!R2C7,Sheet1!R2C7:R43C7,MOD(RC[-5]/2-1,42)+1,FALSE),HLOOKUP(Sheet1!R2C4,Sheet1!R2C4:R7C4,MOD(RC[-5]-1,6)+1,FALSE)),MOD(RC[-5]-1,3)*30+104)) -> 160|161|162|163|164 | G339: =HLOOKUP(Sheet1!R2C1,Sheet1!R2C1:R16C1,MOD(RC1-1,2)+MOD(INT((RC1-1)/2),3)*5+1,FALSE)&"|"&HLOOKUP(Sheet1!R2C1,Sheet1!R2C1:R16C1,MOD(RC1,2)+MOD(INT((RC1)/2),3)*5+1,FALSE)&"|"&HLOOKUP(Sheet1!R2C1,Sheet1!R2C1:R16C1,MOD(RC1+1,2)+MOD(INT((RC1+1)/2),3)*5+1,FALSE)&"|"&HLOOKUP(Sheet1!R2C1,Sheet1!R2C1:R16C1,MOD(RC1+2,2)+MOD(INT((RC1+2)/2),3)*5+1,FALSE)&"|"&HLOOKUP(Sheet1!R2C1,Sheet1!R2C1:R16C1,MOD(RC1+3,2)+MOD(INT((RC1+3)/2),3)*5+1,FALSE) -> 130|131|160|161|100 | H339: =HLOOKUP(Sheet1!R2C1,Sheet1!R2C1:R16C1,MOD(RC1+2,2)+MOD(INT((RC1+2)/2),3)*5+1,FALSE)&"|"&HLOOKUP(Sheet1!R2C1,Sheet1!R2C1:R16C1,MOD(RC1+3,2)+MOD(INT((RC1+3)/2),3)*5+1,FALSE)&"|"&HLOOKUP(Sheet1!R2C1,Sheet1!R2C1:R16C1,MOD(RC1+4,2)+MOD(INT((RC1+4)/2),3)*5+1,FALSE)&"|"&HLOOKUP(Sheet1!R2C1,Sheet1!R2C1:R16C1,MOD(RC1+5,2)+MOD(INT((RC1+5)/2),3)*5+1,FALSE)&"|"&HLOOKUP(Sheet1!R2C1,Sheet1!R2C1:R16C1,MOD(RC1+6,2)+MOD(INT((RC1+6)/2),3)*5+1,FALSE) -> 161|100|101|130|131 | I339: =HLOOKUP(Sheet1!R2C1,Sheet1!R2C1:R16C1,MOD(RC1-1,3)+MOD(INT((RC1-1)/3),3)*5+3,FALSE)&"|"&HLOOKUP(Sheet1!R2C1,Sheet1!R2C1:R16C1,MOD(RC1,3)+MOD(INT((RC1)/3),3)*5+3,FALSE)&"|"&HLOOKUP(Sheet1!R2C1,Sheet1!R2C1:R16C1,MOD(RC1+1,3)+MOD(INT((RC1+1)/3),3)*5+3,FALSE)&"|"&HLOOKUP(Sheet1!R2C1,Sheet1!R2C1:R16C1,MOD(RC1+2,3)+MOD(INT((RC1+2)/3),3)*5+3,FALSE)&"|"&HLOOKUP(Sheet1!R2C1,Sheet1!R2C1:R16C1,MOD(RC1+3,3)+MOD(INT((RC1+3)/3),3)*5+3,FALSE) -> 164|102|103|104|132 | J339: =HLOOKUP(Sheet1!R2C1,Sheet1!R2C1:R16C1,MOD(RC1-1,3)+MOD(INT((RC1-1)/3),3)*5+3,FALSE)&"|"&HLOOKUP(Sheet1!R2C1,Sheet1!R2C1:R16C1,MOD(RC1,3)+MOD(INT((RC1)/3),3)*5+3,FALSE)&"|"&HLOOKUP(Sheet1!R2C1,Sheet1!R2C1:R16C1,MOD(RC1+1,3)+MOD(INT((RC1+1)/3),3)*5+3,FALSE)&"|"&HLOOKUP(Sheet1!R2C1,Sheet1!R2C1:R16C1,MOD(RC1+2,3)+MOD(INT((RC1+2)/3),3)*5+3,FALSE)&"|"&HLOOKUP(Sheet1!R2C1,Sheet1!R2C1:R16C1,MOD(RC1+3,3)+MOD(INT((RC1+3)/3),3)*5+3,FALSE) -> 164|102|103|104|132 | K339: =HLOOKUP(Sheet1!R2C1,Sheet1!R2C1:R16C1,MOD(RC1-1,3)+MOD(INT((RC1-1)/3),3)*5+3,FALSE)&"|"&HLOOKUP(Sheet1!R2C1,Sheet1!R2C1:R16C1,MOD(RC1,3)+MOD(INT((RC1)/3),3)*5+3,FALSE)&"|"&HLOOKUP(Sheet1!R2C1,Sheet1!R2C1:R16C1,MOD(RC1+1,3)+MOD(INT((RC1+1)/3),3)*5+3,FALSE)&"|"&HLOOKUP(Sheet1!R2C1,Sheet1!R2C1:R16C1,MOD(RC1+2,3)+MOD(INT((RC1+2)/3),3)*5+3,FALSE)&"|"&HLOOKUP(Sheet1!R2C1,Sheet1!R2C1:R16C1,MOD(RC1+3,3)+MOD(INT((RC1+3)/3),3)*5+3,FALSE) -> 164|102|103|104|132 | L339: 25|22|23|24 | M339: 3642996|3642996|3642995|3642995 | N339: 10030|10031|10032|10033 | O339: 1|1|1|1 | P339: 2500|2500|2500|2500
A340: 334 | B340: 332 | C340: 30 | D340: =R[-20]C+2 -> 52 | E340: 1000 | F340: =MOD(RC[-5]-1,3)*30+100&"|"&MOD(RC[-5]-1,3)*30+101&"|"&MOD(RC[-5]-1,3)*30+102&"|"&MOD(RC[-5]-1,3)*30+103&"|"&IF(MOD(RC[-5],4)=0,HLOOKUP(Sheet1!R2C10,Sheet1!R2C10:R7C10,MOD(RC[-5]/4-1,6)+1,FALSE),IF(MOD(RC[-5],2)=0,IF(RC[-5]>20,HLOOKUP(Sheet1!R2C7,Sheet1!R2C7:R43C7,MOD(RC[-5]/2-1,42)+1,FALSE),HLOOKUP(Sheet1!R2C4,Sheet1!R2C4:R7C4,MOD(RC[-5]-1,6)+1,FALSE)),MOD(RC[-5]-1,3)*30+104)) -> 100|101|102|103|184 | G340: =HLOOKUP(Sheet1!R2C1,Sheet1!R2C1:R16C1,MOD(RC1-1,2)+MOD(INT((RC1-1)/2),3)*5+1,FALSE)&"|"&HLOOKUP(Sheet1!R2C1,Sheet1!R2C1:R16C1,MOD(RC1,2)+MOD(INT((RC1)/2),3)*5+1,FALSE)&"|"&HLOOKUP(Sheet1!R2C1,Sheet1!R2C1:R16C1,MOD(RC1+1,2)+MOD(INT((RC1+1)/2),3)*5+1,FALSE)&"|"&HLOOKUP(Sheet1!R2C1,Sheet1!R2C1:R16C1,MOD(RC1+2,2)+MOD(INT((RC1+2)/2),3)*5+1,FALSE)&"|"&HLOOKUP(Sheet1!R2C1,Sheet1!R2C1:R16C1,MOD(RC1+3,2)+MOD(INT((RC1+3)/2),3)*5+1,FALSE) -> 131|160|161|100|101 | H340: =HLOOKUP(Sheet1!R2C1,Sheet1!R2C1:R16C1,MOD(RC1+2,2)+MOD(INT((RC1+2)/2),3)*5+1,FALSE)&"|"&HLOOKUP(Sheet1!R2C1,Sheet1!R2C1:R16C1,MOD(RC1+3,2)+MOD(INT((RC1+3)/2),3)*5+1,FALSE)&"|"&HLOOKUP(Sheet1!R2C1,Sheet1!R2C1:R16C1,MOD(RC1+4,2)+MOD(INT((RC1+4)/2),3)*5+1,FALSE)&"|"&HLOOKUP(Sheet1!R2C1,Sheet1!R2C1:R16C1,MOD(RC1+5,2)+MOD(INT((RC1+5)/2),3)*5+1,FALSE)&"|"&HLOOKUP(Sheet1!R2C1,Sheet1!R2C1:R16C1,MOD(RC1+6,2)+MOD(INT((RC1+6)/2),3)*5+1,FALSE) -> 100|101|130|131|160 | I340: =HLOOKUP(Sheet1!R2C1,Sheet1!R2C1:R16C1,MOD(RC1-1,3)+MOD(INT((RC1-1)/3),3)*5+3,FALSE)&"|"&HLOOKUP(Sheet1!R2C1,Sheet1!R2C1:R16C1,MOD(RC1,3)+MOD(INT((RC1)/3),3)*5+3,FALSE)&"|"&HLOOKUP(Sheet1!R2C1,Sheet1!R2C1:R16C1,MOD(RC1+1,3)+MOD(INT((RC1+1)/3),3)*5+3,FALSE)&"|"&HLOOKUP(Sheet1!R2C1,Sheet1!R2C1:R16C1,MOD(RC1+2,3)+MOD(INT((RC1+2)/3),3)*5+3,FALSE)&"|"&HLOOKUP(Sheet1!R2C1,Sheet1!R2C1:R16C1,MOD(RC1+3,3)+MOD(INT((RC1+3)/3),3)*5+3,FALSE) -> 102|103|104|132|133 | J340: =HLOOKUP(Sheet1!R2C1,Sheet1!R2C1:R16C1,MOD(RC1-1,3)+MOD(INT((RC1-1)/3),3)*5+3,FALSE)&"|"&HLOOKUP(Sheet1!R2C1,Sheet1!R2C1:R16C1,MOD(RC1,3)+MOD(INT((RC1)/3),3)*5+3,FALSE)&"|"&HLOOKUP(Sheet1!R2C1,Sheet1!R2C1:R16C1,MOD(RC1+1,3)+MOD(INT((RC1+1)/3),3)*5+3,FALSE)&"|"&HLOOKUP(Sheet1!R2C1,Sheet1!R2C1:R16C1,MOD(RC1+2,3)+MOD(INT((RC1+2)/3),3)*5+3,FALSE)&"|"&HLOOKUP(Sheet1!R2C1,Sheet1!R2C1:R16C1,MOD(RC1+3,3)+MOD(INT((RC1+3)/3),3)*5+3,FALSE) -> 102|103|104|132|133 | K340: =HLOOKUP(Sheet1!R2C1,Sheet1!R2C1:R16C1,MOD(RC1-1,3)+MOD(INT((RC1-1)/3),3)*5+3,FALSE)&"|"&HLOOKUP(Sheet1!R2C1,Sheet1!R2C1:R16C1,MOD(RC1,3)+MOD(INT((RC1)/3),3)*5+3,FALSE)&"|"&HLOOKUP(Sheet1!R2C1,Sheet1!R2C1:R16C1,MOD(RC1+1,3)+MOD(INT((RC1+1)/3),3)*5+3,FALSE)&"|"&HLOOKUP(Sheet1!R2C1,Sheet1!R2C1:R16C1,MOD(RC1+2,3)+MOD(INT((RC1+2)/3),3)*5+3,FALSE)&"|"&HLOOKUP(Sheet1!R2C1,Sheet1!R2C1:R16C1,MOD(RC1+3,3)+MOD(INT((RC1+3)/3),3)*5+3,FALSE) -> 102|103|104|132|133 | L340: 25|22|23|24 | M340: 3675715|3675715|3675715|3675715 | N340: 10030|10031|10032|10033 | O340: 1|1|1|1 | P340: 2500|2500|2500|2500
A341: 335 | B341: 333 | C341: 30 | D341: =R[-20]C+2 -> 52 | E341: 1000 | F341: =MOD(RC[-5]-1,3)*30+100&"|"&MOD(RC[-5]-1,3)*30+101&"|"&MOD(RC[-5]-1,3)*30+102&"|"&MOD(RC[-5]-1,3)*30+103&"|"&IF(MOD(RC[-5],4)=0,HLOOKUP(Sheet1!R2C10,Sheet1!R2C10:R7C10,MOD(RC[-5]/4-1,6)+1,FALSE),IF(MOD(RC[-5],2)=0,IF(RC[-5]>20,HLOOKUP(Sheet1!R2C7,Sheet1!R2C7:R43C7,MOD(RC[-5]/2-1,42)+1,FALSE),HLOOKUP(Sheet1!R2C4,Sheet1!R2C4:R7C4,MOD(RC[-5]-1,6)+1,FALSE)),MOD(RC[-5]-1,3)*30+104)) -> 130|131|132|133|134 | G341: =HLOOKUP(Sheet1!R2C1,Sheet1!R2C1:R16C1,MOD(RC1-1,2)+MOD(INT((RC1-1)/2),3)*5+1,FALSE)&"|"&HLOOKUP(Sheet1!R2C1,Sheet1!R2C1:R16C1,MOD(RC1,2)+MOD(INT((RC1)/2),3)*5+1,FALSE)&"|"&HLOOKUP(Sheet1!R2C1,Sheet1!R2C1:R16C1,MOD(RC1+1,2)+MOD(INT((RC1+1)/2),3)*5+1,FALSE)&"|"&HLOOKUP(Sheet1!R2C1,Sheet1!R2C1:R16C1,MOD(RC1+2,2)+MOD(INT((RC1+2)/2),3)*5+1,FALSE)&"|"&HLOOKUP(Sheet1!R2C1,Sheet1!R2C1:R16C1,MOD(RC1+3,2)+MOD(INT((RC1+3)/2),3)*5+1,FALSE) -> 160|161|100|101|130 | H341: =HLOOKUP(Sheet1!R2C1,Sheet1!R2C1:R16C1,MOD(RC1+2,2)+MOD(INT((RC1+2)/2),3)*5+1,FALSE)&"|"&HLOOKUP(Sheet1!R2C1,Sheet1!R2C1:R16C1,MOD(RC1+3,2)+MOD(INT((RC1+3)/2),3)*5+1,FALSE)&"|"&HLOOKUP(Sheet1!R2C1,Sheet1!R2C1:R16C1,MOD(RC1+4,2)+MOD(INT((RC1+4)/2),3)*5+1,FALSE)&"|"&HLOOKUP(Sheet1!R2C1,Sheet1!R2C1:R16C1,MOD(RC1+5,2)+MOD(INT((RC1+5)/2),3)*5+1,FALSE)&"|"&HLOOKUP(Sheet1!R2C1,Sheet1!R2C1:R16C1,MOD(RC1+6,2)+MOD(INT((RC1+6)/2),3)*5+1,FALSE) -> 101|130|131|160|161 | I341: =HLOOKUP(Sheet1!R2C1,Sheet1!R2C1:R16C1,MOD(RC1-1,3)+MOD(INT((RC1-1)/3),3)*5+3,FALSE)&"|"&HLOOKUP(Sheet1!R2C1,Sheet1!R2C1:R16C1,MOD(RC1,3)+MOD(INT((RC1)/3),3)*5+3,FALSE)&"|"&HLOOKUP(Sheet1!R2C1,Sheet1!R2C1:R16C1,MOD(RC1+1,3)+MOD(INT((RC1+1)/3),3)*5+3,FALSE)&"|"&HLOOKUP(Sheet1!R2C1,Sheet1!R2C1:R16C1,MOD(RC1+2,3)+MOD(INT((RC1+2)/3),3)*5+3,FALSE)&"|"&HLOOKUP(Sheet1!R2C1,Sheet1!R2C1:R16C1,MOD(RC1+3,3)+MOD(INT((RC1+3)/3),3)*5+3,FALSE) -> 103|104|132|133|134 | J341: =HLOOKUP(Sheet1!R2C1,Sheet1!R2C1:R16C1,MOD(RC1-1,3)+MOD(INT((RC1-1)/3),3)*5+3,FALSE)&"|"&HLOOKUP(Sheet1!R2C1,Sheet1!R2C1:R16C1,MOD(RC1,3)+MOD(INT((RC1)/3),3)*5+3,FALSE)&"|"&HLOOKUP(Sheet1!R2C1,Sheet1!R2C1:R16C1,MOD(RC1+1,3)+MOD(INT((RC1+1)/3),3)*5+3,FALSE)&"|"&HLOOKUP(Sheet1!R2C1,Sheet1!R2C1:R16C1,MOD(RC1+2,3)+MOD(INT((RC1+2)/3),3)*5+3,FALSE)&"|"&HLOOKUP(Sheet1!R2C1,Sheet1!R2C1:R16C1,MOD(RC1+3,3)+MOD(INT((RC1+3)/3),3)*5+3,FALSE) -> 103|104|132|133|134 | K341: =HLOOKUP(Sheet1!R2C1,Sheet1!R2C1:R16C1,MOD(RC1-1,3)+MOD(INT((RC1-1)/3),3)*5+3,FALSE)&"|"&HLOOKUP(Sheet1!R2C1,Sheet1!R2C1:R16C1,MOD(RC1,3)+MOD(INT((RC1)/3),3)*5+3,FALSE)&"|"&HLOOKUP(Sheet1!R2C1,Sheet1!R2C1:R16C1,MOD(RC1+1,3)+MOD(INT((RC1+1)/3),3)*5+3,FALSE)&"|"&HLOOKUP(Sheet1!R2C1,Sheet1!R2C1:R16C1,MOD(RC1+2,3)+MOD(INT((RC1+2)/3),3)*5+3,FALSE)&"|"&HLOOKUP(Sheet1!R2C1,Sheet1!R2C1:R16C1,MOD(RC1+3,3)+MOD(INT((RC1+3)/3),3)*5+3,FALSE) -> 103|104|132|133|134 | L341: 25|22|23|24 | M341: 3708435|3708435|3708435|3708435 | N341: 10030|10031|10032|10033|10030|10031|10032|10033|10030|10031|10032|10033|10030|10031|10032|10033|10030|10031|10032|10033|10030|10031|10032|10033|10030|10031|10032|10033|10030|10031|10032|10033|10030|10031|10032|10033|10030|10031|10032|10033 | O341: 1|1|1|1|1|1|1|1|1|1|1|1|1|1|1|1|1|1|1|1|1|1|1|1|1|1|1|1|1|1|1|1|1|1|1|1|1|1|1|1 | P341: 2500|2500|2500|2500|2500|2500|2500|2500|2500|2500|2500|2500|2500|2500|2500|2500|2500|2500|2500|2500|2500|2500|2500|2500|2500|2500|2500|2500|2500|2500|2500|2500|2500|2500|2500|2500|2500|2500|2500|2500
A342: 336 | B342: 334 | C342: 30 | D342: =R[-20]C+2 -> 52 | E342: 1000 | F342: =MOD(RC[-5]-1,3)*30+100&"|"&MOD(RC[-5]-1,3)*30+101&"|"&MOD(RC[-5]-1,3)*30+102&"|"&MOD(RC[-5]-1,3)*30+103&"|"&IF(MOD(RC[-5],4)=0,HLOOKUP(Sheet1!R2C10,Sheet1!R2C10:R7C10,MOD(RC[-5]/4-1,6)+1,FALSE),IF(MOD(RC[-5],2)=0,IF(RC[-5]>20,HLOOKUP(Sheet1!R2C7,Sheet1!R2C7:R43C7,MOD(RC[-5]/2-1,42)+1,FALSE),HLOOKUP(Sheet1!R2C4,Sheet1!R2C4:R7C4,MOD(RC[-5]-1,6)+1,FALSE)),MOD(RC[-5]-1,3)*30+104)) -> 160|161|162|163|195 | G342: =HLOOKUP(Sheet1!R2C1,Sheet1!R2C1:R16C1,MOD(RC1-1,2)+MOD(INT((RC1-1)/2),3)*5+1,FALSE)&"|"&HLOOKUP(Sheet1!R2C1,Sheet1!R2C1:R16C1,MOD(RC1,2)+MOD(INT((RC1)/2),3)*5+1,FALSE)&"|"&HLOOKUP(Sheet1!R2C1,Sheet1!R2C1:R16C1,MOD(RC1+1,2)+MOD(INT((RC1+1)/2),3)*5+1,FALSE)&"|"&HLOOKUP(Sheet1!R2C1,Sheet1!R2C1:R16C1,MOD(RC1+2,2)+MOD(INT((RC1+2)/2),3)*5+1,FALSE)&"|"&HLOOKUP(Sheet1!R2C1,Sheet1!R2C1:R16C1,MOD(RC1+3,2)+MOD(INT((RC1+3)/2),3)*5+1,FALSE) -> 161|100|101|130|131 | H342: =HLOOKUP(Sheet1!R2C1,Sheet1!R2C1:R16C1,MOD(RC1+2,2)+MOD(INT((RC1+2)/2),3)*5+1,FALSE)&"|"&HLOOKUP(Sheet1!R2C1,Sheet1!R2C1:R16C1,MOD(RC1+3,2)+MOD(INT((RC1+3)/2),3)*5+1,FALSE)&"|"&HLOOKUP(Sheet1!R2C1,Sheet1!R2C1:R16C1,MOD(RC1+4,2)+MOD(INT((RC1+4)/2),3)*5+1,FALSE)&"|"&HLOOKUP(Sheet1!R2C1,Sheet1!R2C1:R16C1,MOD(RC1+5,2)+MOD(INT((RC1+5)/2),3)*5+1,FALSE)&"|"&HLOOKUP(Sheet1!R2C1,Sheet1!R2C1:R16C1,MOD(RC1+6,2)+MOD(INT((RC1+6)/2),3)*5+1,FALSE) -> 130|131|160|161|100 | I342: =HLOOKUP(Sheet1!R2C1,Sheet1!R2C1:R16C1,MOD(RC1-1,3)+MOD(INT((RC1-1)/3),3)*5+3,FALSE)&"|"&HLOOKUP(Sheet1!R2C1,Sheet1!R2C1:R16C1,MOD(RC1,3)+MOD(INT((RC1)/3),3)*5+3,FALSE)&"|"&HLOOKUP(Sheet1!R2C1,Sheet1!R2C1:R16C1,MOD(RC1+1,3)+MOD(INT((RC1+1)/3),3)*5+3,FALSE)&"|"&HLOOKUP(Sheet1!R2C1,Sheet1!R2C1:R16C1,MOD(RC1+2,3)+MOD(INT((RC1+2)/3),3)*5+3,FALSE)&"|"&HLOOKUP(Sheet1!R2C1,Sheet1!R2C1:R16C1,MOD(RC1+3,3)+MOD(INT((RC1+3)/3),3)*5+3,FALSE) -> 104|132|133|134|162 | J342: =HLOOKUP(Sheet1!R2C1,Sheet1!R2C1:R16C1,MOD(RC1-1,3)+MOD(INT((RC1-1)/3),3)*5+3,FALSE)&"|"&HLOOKUP(Sheet1!R2C1,Sheet1!R2C1:R16C1,MOD(RC1,3)+MOD(INT((RC1)/3),3)*5+3,FALSE)&"|"&HLOOKUP(Sheet1!R2C1,Sheet1!R2C1:R16C1,MOD(RC1+1,3)+MOD(INT((RC1+1)/3),3)*5+3,FALSE)&"|"&HLOOKUP(Sheet1!R2C1,Sheet1!R2C1:R16C1,MOD(RC1+2,3)+MOD(INT((RC1+2)/3),3)*5+3,FALSE)&"|"&HLOOKUP(Sheet1!R2C1,Sheet1!R2C1:R16C1,MOD(RC1+3,3)+MOD(INT((RC1+3)/3),3)*5+3,FALSE) -> 104|132|133|134|162 | K342: =HLOOKUP(Sheet1!R2C1,Sheet1!R2C1:R16C1,MOD(RC1-1,3)+MOD(INT((RC1-1)/3),3)*5+3,FALSE)&"|"&HLOOKUP(Sheet1!R2C1,Sheet1!R2C1:R16C1,MOD(RC1,3)+MOD(INT((RC1)/3),3)*5+3,FALSE)&"|"&HLOOKUP(Sheet1!R2C1,Sheet1!R2C1:R16C1,MOD(RC1+1,3)+MOD(INT((RC1+1)/3),3)*5+3,FALSE)&"|"&HLOOKUP(Sheet1!R2C1,Sheet1!R2C1:R16C1,MOD(RC1+2,3)+MOD(INT((RC1+2)/3),3)*5+3,FALSE)&"|"&HLOOKUP(Sheet1!R2C1,Sheet1!R2C1:R16C1,MOD(RC1+3,3)+MOD(INT((RC1+3)/3),3)*5+3,FALSE) -> 104|132|133|134|162 | L342: 25|22|23|24 | M342: 3741154|3741154|3741155|3741155 | N342: 10030|10031|10032|10033 | O342: 1|1|1|1 | P342: 2500|2500|2500|2500
A343: 337 | B343: 335 | C343: 30 | D343: =R[-20]C+2 -> 52 | E343: 1000 | F343: =MOD(RC[-5]-1,3)*30+100&"|"&MOD(RC[-5]-1,3)*30+101&"|"&MOD(RC[-5]-1,3)*30+102&"|"&MOD(RC[-5]-1,3)*30+103&"|"&IF(MOD(RC[-5],4)=0,HLOOKUP(Sheet1!R2C10,Sheet1!R2C10:R7C10,MOD(RC[-5]/4-1,6)+1,FALSE),IF(MOD(RC[-5],2)=0,IF(RC[-5]>20,HLOOKUP(Sheet1!R2C7,Sheet1!R2C7:R43C7,MOD(RC[-5]/2-1,42)+1,FALSE),HLOOKUP(Sheet1!R2C4,Sheet1!R2C4:R7C4,MOD(RC[-5]-1,6)+1,FALSE)),MOD(RC[-5]-1,3)*30+104)) -> 100|101|102|103|104 | G343: =HLOOKUP(Sheet1!R2C1,Sheet1!R2C1:R16C1,MOD(RC1-1,2)+MOD(INT((RC1-1)/2),3)*5+1,FALSE)&"|"&HLOOKUP(Sheet1!R2C1,Sheet1!R2C1:R16C1,MOD(RC1,2)+MOD(INT((RC1)/2),3)*5+1,FALSE)&"|"&HLOOKUP(Sheet1!R2C1,Sheet1!R2C1:R16C1,MOD(RC1+1,2)+MOD(INT((RC1+1)/2),3)*5+1,FALSE)&"|"&HLOOKUP(Sheet1!R2C1,Sheet1!R2C1:R16C1,MOD(RC1+2,2)+MOD(INT((RC1+2)/2),3)*5+1,FALSE)&"|"&HLOOKUP(Sheet1!R2C1,Sheet1!R2C1:R16C1,MOD(RC1+3,2)+MOD(INT((RC1+3)/2),3)*5+1,FALSE) -> 100|101|130|131|160 | H343: =HLOOKUP(Sheet1!R2C1,Sheet1!R2C1:R16C1,MOD(RC1+2,2)+MOD(INT((RC1+2)/2),3)*5+1,FALSE)&"|"&HLOOKUP(Sheet1!R2C1,Sheet1!R2C1:R16C1,MOD(RC1+3,2)+MOD(INT((RC1+3)/2),3)*5+1,FALSE)&"|"&HLOOKUP(Sheet1!R2C1,Sheet1!R2C1:R16C1,MOD(RC1+4,2)+MOD(INT((RC1+4)/2),3)*5+1,FALSE)&"|"&HLOOKUP(Sheet1!R2C1,Sheet1!R2C1:R16C1,MOD(RC1+5,2)+MOD(INT((RC1+5)/2),3)*5+1,FALSE)&"|"&HLOOKUP(Sheet1!R2C1,Sheet1!R2C1:R16C1,MOD(RC1+6,2)+MOD(INT((RC1+6)/2),3)*5+1,FALSE) -> 131|160|161|100|101 | I343: =HLOOKUP(Sheet1!R2C1,Sheet1!R2C1:R16C1,MOD(RC1-1,3)+MOD(INT((RC1-1)/3),3)*5+3,FALSE)&"|"&HLOOKUP(Sheet1!R2C1,Sheet1!R2C1:R16C1,MOD(RC1,3)+MOD(INT((RC1)/3),3)*5+3,FALSE)&"|"&HLOOKUP(Sheet1!R2C1,Sheet1!R2C1:R16C1,MOD(RC1+1,3)+MOD(INT((RC1+1)/3),3)*5+3,FALSE)&"|"&HLOOKUP(Sheet1!R2C1,Sheet1!R2C1:R16C1,MOD(RC1+2,3)+MOD(INT((RC1+2)/3),3)*5+3,FALSE)&"|"&HLOOKUP(Sheet1!R2C1,Sheet1!R2C1:R16C1,MOD(RC1+3,3)+MOD(INT((RC1+3)/3),3)*5+3,FALSE) -> 132|133|134|162|163 | J343: =HLOOKUP(Sheet1!R2C1,Sheet1!R2C1:R16C1,MOD(RC1-1,3)+MOD(INT((RC1-1)/3),3)*5+3,FALSE)&"|"&HLOOKUP(Sheet1!R2C1,Sheet1!R2C1:R16C1,MOD(RC1,3)+MOD(INT((RC1)/3),3)*5+3,FALSE)&"|"&HLOOKUP(Sheet1!R2C1,Sheet1!R2C1:R16C1,MOD(RC1+1,3)+MOD(INT((RC1+1)/3),3)*5+3,FALSE)&"|"&HLOOKUP(Sheet1!R2C1,Sheet1!R2C1:R16C1,MOD(RC1+2,3)+MOD(INT((RC1+2)/3),3)*5+3,FALSE)&"|"&HLOOKUP(Sheet1!R2C1,Sheet1!R2C1:R16C1,MOD(RC1+3,3)+MOD(INT((RC1+3)/3),3)*5+3,FALSE) -> 132|133|134|162|163 | K343: =HLOOKUP(Sheet1!R2C1,Sheet1!R2C1:R16C1,MOD(RC1-1,3)+MOD(INT((RC1-1)/3),3)*5+3,FALSE)&"|"&HLOOKUP(Sheet1!R2C1,Sheet1!R2C1:R16C1,MOD(RC1,3)+MOD(INT((RC1)/3),3)*5+3,FALSE)&"|"&HLOOKUP(Sheet1!R2C1,Sheet1!R2C1:R16C1,MOD(RC1+1,3)+MOD(INT((RC1+1)/3),3)*5+3,FALSE)&"|"&HLOOKUP(Sheet1!R2C1,Sheet1!R2C1:R16C1,MOD(RC1+2,3)+MOD(INT((RC1+2)/3),3)*5+3,FALSE)&"|"&HLOOKUP(Sheet1!R2C1,Sheet1!R2C1:R16C1,MOD(RC1+3,3)+MOD(INT((RC1+3)/3),3)*5+3,FALSE) -> 132|133|134|162|163 | L343: 25|22|23|24 | M343: 3774934|3774935|3774935|3774935 | N343: 10030|10031|10032|10033 | O343: 1|1|1|1 | P343: 2500|2500|2500|2500
A344: 338 | B344: 336 | C344: 30 | D344: =R[-20]C+2 -> 52 | E344: 1000 | F344: =MOD(RC[-5]-1,3)*30+100&"|"&MOD(RC[-5]-1,3)*30+101&"|"&MOD(RC[-5]-1,3)*30+102&"|"&MOD(RC[-5]-1,3)*30+103&"|"&IF(MOD(RC[-5],4)=0,HLOOKUP(Sheet1!R2C10,Sheet1!R2C10:R7C10,MOD(RC[-5]/4-1,6)+1,FALSE),IF(MOD(RC[-5],2)=0,IF(RC[-5]>20,HLOOKUP(Sheet1!R2C7,Sheet1!R2C7:R43C7,MOD(RC[-5]/2-1,42)+1,FALSE),HLOOKUP(Sheet1!R2C4,Sheet1!R2C4:R7C4,MOD(RC[-5]-1,6)+1,FALSE)),MOD(RC[-5]-1,3)*30+104)) -> 130|131|132|133|112 | G344: =HLOOKUP(Sheet1!R2C1,Sheet1!R2C1:R16C1,MOD(RC1-1,2)+MOD(INT((RC1-1)/2),3)*5+1,FALSE)&"|"&HLOOKUP(Sheet1!R2C1,Sheet1!R2C1:R16C1,MOD(RC1,2)+MOD(INT((RC1)/2),3)*5+1,FALSE)&"|"&HLOOKUP(Sheet1!R2C1,Sheet1!R2C1:R16C1,MOD(RC1+1,2)+MOD(INT((RC1+1)/2),3)*5+1,FALSE)&"|"&HLOOKUP(Sheet1!R2C1,Sheet1!R2C1:R16C1,MOD(RC1+2,2)+MOD(INT((RC1+2)/2),3)*5+1,FALSE)&"|"&HLOOKUP(Sheet1!R2C1,Sheet1!R2C1:R16C1,MOD(RC1+3,2)+MOD(INT((RC1+3)/2),3)*5+1,FALSE) -> 101|130|131|160|161 | H344: =HLOOKUP(Sheet1!R2C1,Sheet1!R2C1:R16C1,MOD(RC1+2,2)+MOD(INT((RC1+2)/2),3)*5+1,FALSE)&"|"&HLOOKUP(Sheet1!R2C1,Sheet1!R2C1:R16C1,MOD(RC1+3,2)+MOD(INT((RC1+3)/2),3)*5+1,FALSE)&"|"&HLOOKUP(Sheet1!R2C1,Sheet1!R2C1:R16C1,MOD(RC1+4,2)+MOD(INT((RC1+4)/2),3)*5+1,FALSE)&"|"&HLOOKUP(Sheet1!R2C1,Sheet1!R2C1:R16C1,MOD(RC1+5,2)+MOD(INT((RC1+5)/2),3)*5+1,FALSE)&"|"&HLOOKUP(Sheet1!R2C1,Sheet1!R2C1:R16C1,MOD(RC1+6,2)+MOD(INT((RC1+6)/2),3)*5+1,FALSE) -> 160|161|100|101|130 | I344: =HLOOKUP(Sheet1!R2C1,Sheet1!R2C1:R16C1,MOD(RC1-1,3)+MOD(INT((RC1-1)/3),3)*5+3,FALSE)&"|"&HLOOKUP(Sheet1!R2C1,Sheet1!R2C1:R16C1,MOD(RC1,3)+MOD(INT((RC1)/3),3)*5+3,FALSE)&"|"&HLOOKUP(Sheet1!R2C1,Sheet1!R2C1:R16C1,MOD(RC1+1,3)+MOD(INT((RC1+1)/3),3)*5+3,FALSE)&"|"&HLOOKUP(Sheet1!R2C1,Sheet1!R2C1:R16C1,MOD(RC1+2,3)+MOD(INT((RC1+2)/3),3)*5+3,FALSE)&"|"&HLOOKUP(Sheet1!R2C1,Sheet1!R2C1:R16C1,MOD(RC1+3,3)+MOD(INT((RC1+3)/3),3)*5+3,FALSE) -> 133|134|162|163|164 | J344: =HLOOKUP(Sheet1!R2C1,Sheet1!R2C1:R16C1,MOD(RC1-1,3)+MOD(INT((RC1-1)/3),3)*5+3,FALSE)&"|"&HLOOKUP(Sheet1!R2C1,Sheet1!R2C1:R16C1,MOD(RC1,3)+MOD(INT((RC1)/3),3)*5+3,FALSE)&"|"&HLOOKUP(Sheet1!R2C1,Sheet1!R2C1:R16C1,MOD(RC1+1,3)+MOD(INT((RC1+1)/3),3)*5+3,FALSE)&"|"&HLOOKUP(Sheet1!R2C1,Sheet1!R2C1:R16C1,MOD(RC1+2,3)+MOD(INT((RC1+2)/3),3)*5+3,FALSE)&"|"&HLOOKUP(Sheet1!R2C1,Sheet1!R2C1:R16C1,MOD(RC1+3,3)+MOD(INT((RC1+3)/3),3)*5+3,FALSE) -> 133|134|162|163|164 | K344: =HLOOKUP(Sheet1!R2C1,Sheet1!R2C1:R16C1,MOD(RC1-1,3)+MOD(INT((RC1-1)/3),3)*5+3,FALSE)&"|"&HLOOKUP(Sheet1!R2C1,Sheet1!R2C1:R16C1,MOD(RC1,3)+MOD(INT((RC1)/3),3)*5+3,FALSE)&"|"&HLOOKUP(Sheet1!R2C1,Sheet1!R2C1:R16C1,MOD(RC1+1,3)+MOD(INT((RC1+1)/3),3)*5+3,FALSE)&"|"&HLOOKUP(Sheet1!R2C1,Sheet1!R2C1:R16C1,MOD(RC1+2,3)+MOD(INT((RC1+2)/3),3)*5+3,FALSE)&"|"&HLOOKUP(Sheet1!R2C1,Sheet1!R2C1:R16C1,MOD(RC1+3,3)+MOD(INT((RC1+3)/3),3)*5+3,FALSE) -> 133|134|162|163|164 | L344: 25|22|23|24 | M344: 3808859|3808860|3808860|3808860 | N344: 10030|10031|10032|10033 | O344: 1|1|1|1 | P344: 2500|2500|2500|2500
A345: 339 | B345: 337 | C345: 30 | D345: =R[-20]C+2 -> 52 | E345: 1000 | F345: =MOD(RC[-5]-1,3)*30+100&"|"&MOD(RC[-5]-1,3)*30+101&"|"&MOD(RC[-5]-1,3)*30+102&"|"&MOD(RC[-5]-1,3)*30+103&"|"&IF(MOD(RC[-5],4)=0,HLOOKUP(Sheet1!R2C10,Sheet1!R2C10:R7C10,MOD(RC[-5]/4-1,6)+1,FALSE),IF(MOD(RC[-5],2)=0,IF(RC[-5]>20,HLOOKUP(Sheet1!R2C7,Sheet1!R2C7:R43C7,MOD(RC[-5]/2-1,42)+1,FALSE),HLOOKUP(Sheet1!R2C4,Sheet1!R2C4:R7C4,MOD(RC[-5]-1,6)+1,FALSE)),MOD(RC[-5]-1,3)*30+104)) -> 160|161|162|163|164 | G345: =HLOOKUP(Sheet1!R2C1,Sheet1!R2C1:R16C1,MOD(RC1-1,2)+MOD(INT((RC1-1)/2),3)*5+1,FALSE)&"|"&HLOOKUP(Sheet1!R2C1,Sheet1!R2C1:R16C1,MOD(RC1,2)+MOD(INT((RC1)/2),3)*5+1,FALSE)&"|"&HLOOKUP(Sheet1!R2C1,Sheet1!R2C1:R16C1,MOD(RC1+1,2)+MOD(INT((RC1+1)/2),3)*5+1,FALSE)&"|"&HLOOKUP(Sheet1!R2C1,Sheet1!R2C1:R16C1,MOD(RC1+2,2)+MOD(INT((RC1+2)/2),3)*5+1,FALSE)&"|"&HLOOKUP(Sheet1!R2C1,Sheet1!R2C1:R16C1,MOD(RC1+3,2)+MOD(INT((RC1+3)/2),3)*5+1,FALSE) -> 130|131|160|161|100 | H345: =HLOOKUP(Sheet1!R2C1,Sheet1!R2C1:R16C1,MOD(RC1+2,2)+MOD(INT((RC1+2)/2),3)*5+1,FALSE)&"|"&HLOOKUP(Sheet1!R2C1,Sheet1!R2C1:R16C1,MOD(RC1+3,2)+MOD(INT((RC1+3)/2),3)*5+1,FALSE)&"|"&HLOOKUP(Sheet1!R2C1,Sheet1!R2C1:R16C1,MOD(RC1+4,2)+MOD(INT((RC1+4)/2),3)*5+1,FALSE)&"|"&HLOOKUP(Sheet1!R2C1,Sheet1!R2C1:R16C1,MOD(RC1+5,2)+MOD(INT((RC1+5)/2),3)*5+1,FALSE)&"|"&HLOOKUP(Sheet1!R2C1,Sheet1!R2C1:R16C1,MOD(RC1+6,2)+MOD(INT((RC1+6)/2),3)*5+1,FALSE) -> 161|100|101|130|131 | I345: =HLOOKUP(Sheet1!R2C1,Sheet1!R2C1:R16C1,MOD(RC1-1,3)+MOD(INT((RC1-1)/3),3)*5+3,FALSE)&"|"&HLOOKUP(Sheet1!R2C1,Sheet1!R2C1:R16C1,MOD(RC1,3)+MOD(INT((RC1)/3),3)*5+3,FALSE)&"|"&HLOOKUP(Sheet1!R2C1,Sheet1!R2C1:R16C1,MOD(RC1+1,3)+MOD(INT((RC1+1)/3),3)*5+3,FALSE)&"|"&HLOOKUP(Sheet1!R2C1,Sheet1!R2C1:R16C1,MOD(RC1+2,3)+MOD(INT((RC1+2)/3),3)*5+3,FALSE)&"|"&HLOOKUP(Sheet1!R2C1,Sheet1!R2C1:R16C1,MOD(RC1+3,3)+MOD(INT((RC1+3)/3),3)*5+3,FALSE) -> 134|162|163|164|102 | J345: =HLOOKUP(Sheet1!R2C1,Sheet1!R2C1:R16C1,MOD(RC1-1,3)+MOD(INT((RC1-1)/3),3)*5+3,FALSE)&"|"&HLOOKUP(Sheet1!R2C1,Sheet1!R2C1:R16C1,MOD(RC1,3)+MOD(INT((RC1)/3),3)*5+3,FALSE)&"|"&HLOOKUP(Sheet1!R2C1,Sheet1!R2C1:R16C1,MOD(RC1+1,3)+MOD(INT((RC1+1)/3),3)*5+3,FALSE)&"|"&HLOOKUP(Sheet1!R2C1,Sheet1!R2C1:R16C1,MOD(RC1+2,3)+MOD(INT((RC1+2)/3),3)*5+3,FALSE)&"|"&HLOOKUP(Sheet1!R2C1,Sheet1!R2C1:R16C1,MOD(RC1+3,3)+MOD(INT((RC1+3)/3),3)*5+3,FALSE) -> 134|162|163|164|102 | K345: =HLOOKUP(Sheet1!R2C1,Sheet1!R2C1:R16C1,MOD(RC1-1,3)+MOD(INT((RC1-1)/3),3)*5+3,FALSE)&"|"&HLOOKUP(Sheet1!R2C1,Sheet1!R2C1:R16C1,MOD(RC1,3)+MOD(INT((RC1)/3),3)*5+3,FALSE)&"|"&HLOOKUP(Sheet1!R2C1,Sheet1!R2C1:R16C1,MOD(RC1+1,3)+MOD(INT((RC1+1)/3),3)*5+3,FALSE)&"|"&HLOOKUP(Sheet1!R2C1,Sheet1!R2C1:R16C1,MOD(RC1+2,3)+MOD(INT((RC1+2)/3),3)*5+3,FALSE)&"|"&HLOOKUP(Sheet1!R2C1,Sheet1!R2C1:R16C1,MOD(RC1+3,3)+MOD(INT((RC1+3)/3),3)*5+3,FALSE) -> 134|162|163|164|102 | L345: 25|22|23|24 | M345: 3842785|3842785|3842785|3842785 | N345: 10030|10031|10032|10033 | O345: 1|1|1|1 | P345: 2500|2500|2500|2500
A346: 340 | B346: 338 | C346: 30 | D346: =R[-20]C+2 -> 52 | E346: 1000 | F346: =MOD(RC[-5]-1,3)*30+100&"|"&MOD(RC[-5]-1,3)*30+101&"|"&MOD(RC[-5]-1,3)*30+102&"|"&MOD(RC[-5]-1,3)*30+103&"|"&IF(MOD(RC[-5],4)=0,HLOOKUP(Sheet1!R2C10,Sheet1!R2C10:R7C10,MOD(RC[-5]/4-1,6)+1,FALSE),IF(MOD(RC[-5],2)=0,IF(RC[-5]>20,HLOOKUP(Sheet1!R2C7,Sheet1!R2C7:R43C7,MOD(RC[-5]/2-1,42)+1,FALSE),HLOOKUP(Sheet1!R2C4,Sheet1!R2C4:R7C4,MOD(RC[-5]-1,6)+1,FALSE)),MOD(RC[-5]-1,3)*30+104)) -> 100|101|102|103|190 | G346: =HLOOKUP(Sheet1!R2C1,Sheet1!R2C1:R16C1,MOD(RC1-1,2)+MOD(INT((RC1-1)/2),3)*5+1,FALSE)&"|"&HLOOKUP(Sheet1!R2C1,Sheet1!R2C1:R16C1,MOD(RC1,2)+MOD(INT((RC1)/2),3)*5+1,FALSE)&"|"&HLOOKUP(Sheet1!R2C1,Sheet1!R2C1:R16C1,MOD(RC1+1,2)+MOD(INT((RC1+1)/2),3)*5+1,FALSE)&"|"&HLOOKUP(Sheet1!R2C1,Sheet1!R2C1:R16C1,MOD(RC1+2,2)+MOD(INT((RC1+2)/2),3)*5+1,FALSE)&"|"&HLOOKUP(Sheet1!R2C1,Sheet1!R2C1:R16C1,MOD(RC1+3,2)+MOD(INT((RC1+3)/2),3)*5+1,FALSE) -> 131|160|161|100|101 | H346: =HLOOKUP(Sheet1!R2C1,Sheet1!R2C1:R16C1,MOD(RC1+2,2)+MOD(INT((RC1+2)/2),3)*5+1,FALSE)&"|"&HLOOKUP(Sheet1!R2C1,Sheet1!R2C1:R16C1,MOD(RC1+3,2)+MOD(INT((RC1+3)/2),3)*5+1,FALSE)&"|"&HLOOKUP(Sheet1!R2C1,Sheet1!R2C1:R16C1,MOD(RC1+4,2)+MOD(INT((RC1+4)/2),3)*5+1,FALSE)&"|"&HLOOKUP(Sheet1!R2C1,Sheet1!R2C1:R16C1,MOD(RC1+5,2)+MOD(INT((RC1+5)/2),3)*5+1,FALSE)&"|"&HLOOKUP(Sheet1!R2C1,Sheet1!R2C1:R16C1,MOD(RC1+6,2)+MOD(INT((RC1+6)/2),3)*5+1,FALSE) -> 100|101|130|131|160 | I346: =HLOOKUP(Sheet1!R2C1,Sheet1!R2C1:R16C1,MOD(RC1-1,3)+MOD(INT((RC1-1)/3),3)*5+3,FALSE)&"|"&HLOOKUP(Sheet1!R2C1,Sheet1!R2C1:R16C1,MOD(RC1,3)+MOD(INT((RC1)/3),3)*5+3,FALSE)&"|"&HLOOKUP(Sheet1!R2C1,Sheet1!R2C1:R16C1,MOD(RC1+1,3)+MOD(INT((RC1+1)/3),3)*5+3,FALSE)&"|"&HLOOKUP(Sheet1!R2C1,Sheet1!R2C1:R16C1,MOD(RC1+2,3)+MOD(INT((RC1+2)/3),3)*5+3,FALSE)&"|"&HLOOKUP(Sheet1!R2C1,Sheet1!R2C1:R16C1,MOD(RC1+3,3)+MOD(INT((RC1+3)/3),3)*5+3,FALSE) -> 162|163|164|102|103 | J346: =HLOOKUP(Sheet1!R2C1,Sheet1!R2C1:R16C1,MOD(RC1-1,3)+MOD(INT((RC1-1)/3),3)*5+3,FALSE)&"|"&HLOOKUP(Sheet1!R2C1,Sheet1!R2C1:R16C1,MOD(RC1,3)+MOD(INT((RC1)/3),3)*5+3,FALSE)&"|"&HLOOKUP(Sheet1!R2C1,Sheet1!R2C1:R16C1,MOD(RC1+1,3)+MOD(INT((RC1+1)/3),3)*5+3,FALSE)&"|"&HLOOKUP(Sheet1!R2C1,Sheet1!R2C1:R16C1,MOD(RC1+2,3)+MOD(INT((RC1+2)/3),3)*5+3,FALSE)&"|"&HLOOKUP(Sheet1!R2C1,Sheet1!R2C1:R16C1,MOD(RC1+3,3)+MOD(INT((RC1+3)/3),3)*5+3,FALSE) -> 162|163|164|102|103 | K346: =HLOOKUP(Sheet1!R2C1,Sheet1!R2C1:R16C1,MOD(RC1-1,3)+MOD(INT((RC1-1)/3),3)*5+3,FALSE)&"|"&HLOOKUP(Sheet1!R2C1,Sheet1!R2C1:R16C1,MOD(RC1,3)+MOD(INT((RC1)/3),3)*5+3,FALSE)&"|"&HLOOKUP(Sheet1!R2C1,Sheet1!R2C1:R16C1,MOD(RC1+1,3)+MOD(INT((RC1+1)/3),3)*5+3,FALSE)&"|"&HLOOKUP(Sheet1!R2C1,Sheet1!R2C1:R16C1,MOD(RC1+2,3)+MOD(INT((RC1+2)/3),3)*5+3,FALSE)&"|"&HLOOKUP(Sheet1!R2C1,Sheet1!R2C1:R16C1,MOD(RC1+3,3)+MOD(INT((RC1+3)/3),3)*5+3,FALSE) -> 162|163|164|102|103 | L346: 25|22|23|24 | M346: 3876710|3876710|3876710|3876710 | N346: 10030|10031|10032|10033|10030|10031|10032|10033|10030|10031|10032|10033|10030|10031|10032|10033|10030|10031|10032|10033|10030|10031|10032|10033|10030|10031|10032|10033|10030|10031|10032|10033|10030|10031|10032|10033|10030|10031|10032|10033 | O346: 1|1|1|1|1|1|1|1|1|1|1|1|1|1|1|1|1|1|1|1|1|1|1|1|1|1|1|1|1|1|1|1|1|1|1|1|1|1|1|1 | P346: 2500|2500|2500|2500|2500|2500|2500|2500|2500|2500|2500|2500|2500|2500|2500|2500|2500|2500|2500|2500|2500|2500|2500|2500|2500|2500|2500|2500|2500|2500|2500|2500|2500|2500|2500|2500|2500|2500|2500|2500
A347: 341 | B347: 339 | C347: 30 | D347: =R[-20]C+2 -> 54 | E347: 1000 | F347: =MOD(RC[-5]-1,3)*30+100&"|"&MOD(RC[-5]-1,3)*30+101&"|"&MOD(RC[-5]-1,3)*30+102&"|"&MOD(RC[-5]-1,3)*30+103&"|"&IF(MOD(RC[-5],4)=0,HLOOKUP(Sheet1!R2C10,Sheet1!R2C10:R7C10,MOD(RC[-5]/4-1,6)+1,FALSE),IF(MOD(RC[-5],2)=0,IF(RC[-5]>20,HLOOKUP(Sheet1!R2C7,Sheet1!R2C7:R43C7,MOD(RC[-5]/2-1,42)+1,FALSE),HLOOKUP(Sheet1!R2C4,Sheet1!R2C4:R7C4,MOD(RC[-5]-1,6)+1,FALSE)),MOD(RC[-5]-1,3)*30+104)) -> 130|131|132|133|134 | G347: =HLOOKUP(Sheet1!R2C1,Sheet1!R2C1:R16C1,MOD(RC1-1,2)+MOD(INT((RC1-1)/2),3)*5+1,FALSE)&"|"&HLOOKUP(Sheet1!R2C1,Sheet1!R2C1:R16C1,MOD(RC1,2)+MOD(INT((RC1)/2),3)*5+1,FALSE)&"|"&HLOOKUP(Sheet1!R2C1,Sheet1!R2C1:R16C1,MOD(RC1+1,2)+MOD(INT((RC1+1)/2),3)*5+1,FALSE)&"|"&HLOOKUP(Sheet1!R2C1,Sheet1!R2C1:R16C1,MOD(RC1+2,2)+MOD(INT((RC1+2)/2),3)*5+1,FALSE)&"|"&HLOOKUP(Sheet1!R2C1,Sheet1!R2C1:R16C1,MOD(RC1+3,2)+MOD(INT((RC1+3)/2),3)*5+1,FALSE) -> 160|161|100|101|130 | H347: =HLOOKUP(Sheet1!R2C1,Sheet1!R2C1:R16C1,MOD(RC1+2,2)+MOD(INT((RC1+2)/2),3)*5+1,FALSE)&"|"&HLOOKUP(Sheet1!R2C1,Sheet1!R2C1:R16C1,MOD(RC1+3,2)+MOD(INT((RC1+3)/2),3)*5+1,FALSE)&"|"&HLOOKUP(Sheet1!R2C1,Sheet1!R2C1:R16C1,MOD(RC1+4,2)+MOD(INT((RC1+4)/2),3)*5+1,FALSE)&"|"&HLOOKUP(Sheet1!R2C1,Sheet1!R2C1:R16C1,MOD(RC1+5,2)+MOD(INT((RC1+5)/2),3)*5+1,FALSE)&"|"&HLOOKUP(Sheet1!R2C1,Sheet1!R2C1:R16C1,MOD(RC1+6,2)+MOD(INT((RC1+6)/2),3)*5+1,FALSE) -> 101|130|131|160|161 | I347: =HLOOKUP(Sheet1!R2C1,Sheet1!R2C1:R16C1,MOD(RC1-1,3)+MOD(INT((RC1-1)/3),3)*5+3,FALSE)&"|"&HLOOKUP(Sheet1!R2C1,Sheet1!R2C1:R16C1,MOD(RC1,3)+MOD(INT((RC1)/3),3)*5+3,FALSE)&"|"&HLOOKUP(Sheet1!R2C1,Sheet1!R2C1:R16C1,MOD(RC1+1,3)+MOD(INT((RC1+1)/3),3)*5+3,FALSE)&"|"&HLOOKUP(Sheet1!R2C1,Sheet1!R2C1:R16C1,MOD(RC1+2,3)+MOD(INT((RC1+2)/3),3)*5+3,FALSE)&"|"&HLOOKUP(Sheet1!R2C1,Sheet1!R2C1:R16C1,MOD(RC1+3,3)+MOD(INT((RC1+3)/3),3)*5+3,FALSE) -> 163|164|102|103|104 | J347: =HLOOKUP(Sheet1!R2C1,Sheet1!R2C1:R16C1,MOD(RC1-1,3)+MOD(INT((RC1-1)/3),3)*5+3,FALSE)&"|"&HLOOKUP(Sheet1!R2C1,Sheet1!R2C1:R16C1,MOD(RC1,3)+MOD(INT((RC1)/3),3)*5+3,FALSE)&"|"&HLOOKUP(Sheet1!R2C1,Sheet1!R2C1:R16C1,MOD(RC1+1,3)+MOD(INT((RC1+1)/3),3)*5+3,FALSE)&"|"&HLOOKUP(Sheet1!R2C1,Sheet1!R2C1:R16C1,MOD(RC1+2,3)+MOD(INT((RC1+2)/3),3)*5+3,FALSE)&"|"&HLOOKUP(Sheet1!R2C1,Sheet1!R2C1:R16C1,MOD(RC1+3,3)+MOD(INT((RC1+3)/3),3)*5+3,FALSE) -> 163|164|102|103|104 | K347: =HLOOKUP(Sheet1!R2C1,Sheet1!R2C1:R16C1,MOD(RC1-1,3)+MOD(INT((RC1-1)/3),3)*5+3,FALSE)&"|"&HLOOKUP(Sheet1!R2C1,Sheet1!R2C1:R16C1,MOD(RC1,3)+MOD(INT((RC1)/3),3)*5+3,FALSE)&"|"&HLOOKUP(Sheet1!R2C1,Sheet1!R2C1:R16C1,MOD(RC1+1,3)+MOD(INT((RC1+1)/3),3)*5+3,FALSE)&"|"&HLOOKUP(Sheet1!R2C1,Sheet1!R2C1:R16C1,MOD(RC1+2,3)+MOD(INT((RC1+2)/3),3)*5+3,FALSE)&"|"&HLOOKUP(Sheet1!R2C1,Sheet1!R2C1:R16C1,MOD(RC1+3,3)+MOD(INT((RC1+3)/3),3)*5+3,FALSE) -> 163|164|102|103|104 | L347: 25|22|23|24 | M347: 3911752|3911753|3911753|3911753 | N347: 10030|10031|10032|10033 | O347: 1|1|1|1 | P347: 2500|2500|2500|2500
A348: 342 | B348: 340 | C348: 30 | D348: =R[-20]C+2 -> 54 | E348: 1000 | F348: =MOD(RC[-5]-1,3)*30+100&"|"&MOD(RC[-5]-1,3)*30+101&"|"&MOD(RC[-5]-1,3)*30+102&"|"&MOD(RC[-5]-1,3)*30+103&"|"&IF(MOD(RC[-5],4)=0,HLOOKUP(Sheet1!R2C10,Sheet1!R2C10:R7C10,MOD(RC[-5]/4-1,6)+1,FALSE),IF(MOD(RC[-5],2)=0,IF(RC[-5]>20,HLOOKUP(Sheet1!R2C7,Sheet1!R2C7:R43C7,MOD(RC[-5]/2-1,42)+1,FALSE),HLOOKUP(Sheet1!R2C4,Sheet1!R2C4:R7C4,MOD(RC[-5]-1,6)+1,FALSE)),MOD(RC[-5]-1,3)*30+104)) -> 160|161|162|163|114 | G348: =HLOOKUP(Sheet1!R2C1,Sheet1!R2C1:R16C1,MOD(RC1-1,2)+MOD(INT((RC1-1)/2),3)*5+1,FALSE)&"|"&HLOOKUP(Sheet1!R2C1,Sheet1!R2C1:R16C1,MOD(RC1,2)+MOD(INT((RC1)/2),3)*5+1,FALSE)&"|"&HLOOKUP(Sheet1!R2C1,Sheet1!R2C1:R16C1,MOD(RC1+1,2)+MOD(INT((RC1+1)/2),3)*5+1,FALSE)&"|"&HLOOKUP(Sheet1!R2C1,Sheet1!R2C1:R16C1,MOD(RC1+2,2)+MOD(INT((RC1+2)/2),3)*5+1,FALSE)&"|"&HLOOKUP(Sheet1!R2C1,Sheet1!R2C1:R16C1,MOD(RC1+3,2)+MOD(INT((RC1+3)/2),3)*5+1,FALSE) -> 161|100|101|130|131 | H348: =HLOOKUP(Sheet1!R2C1,Sheet1!R2C1:R16C1,MOD(RC1+2,2)+MOD(INT((RC1+2)/2),3)*5+1,FALSE)&"|"&HLOOKUP(Sheet1!R2C1,Sheet1!R2C1:R16C1,MOD(RC1+3,2)+MOD(INT((RC1+3)/2),3)*5+1,FALSE)&"|"&HLOOKUP(Sheet1!R2C1,Sheet1!R2C1:R16C1,MOD(RC1+4,2)+MOD(INT((RC1+4)/2),3)*5+1,FALSE)&"|"&HLOOKUP(Sheet1!R2C1,Sheet1!R2C1:R16C1,MOD(RC1+5,2)+MOD(INT((RC1+5)/2),3)*5+1,FALSE)&"|"&HLOOKUP(Sheet1!R2C1,Sheet1!R2C1:R16C1,MOD(RC1+6,2)+MOD(INT((RC1+6)/2),3)*5+1,FALSE) -> 130|131|160|161|100 | I348: =HLOOKUP(Sheet1!R2C1,Sheet1!R2C1:R16C1,MOD(RC1-1,3)+MOD(INT((RC1-1)/3),3)*5+3,FALSE)&"|"&HLOOKUP(Sheet1!R2C1,Sheet1!R2C1:R16C1,MOD(RC1,3)+MOD(INT((RC1)/3),3)*5+3,FALSE)&"|"&HLOOKUP(Sheet1!R2C1,Sheet1!R2C1:R16C1,MOD(RC1+1,3)+MOD(INT((RC1+1)/3),3)*5+3,FALSE)&"|"&HLOOKUP(Sheet1!R2C1,Sheet1!R2C1:R16C1,MOD(RC1+2,3)+MOD(INT((RC1+2)/3),3)*5+3,FALSE)&"|"&HLOOKUP(Sheet1!R2C1,Sheet1!R2C1:R16C1,MOD(RC1+3,3)+MOD(INT((RC1+3)/3),3)*5+3,FALSE) -> 164|102|103|104|132 | J348: =HLOOKUP(Sheet1!R2C1,Sheet1!R2C1:R16C1,MOD(RC1-1,3)+MOD(INT((RC1-1)/3),3)*5+3,FALSE)&"|"&HLOOKUP(Sheet1!R2C1,Sheet1!R2C1:R16C1,MOD(RC1,3)+MOD(INT((RC1)/3),3)*5+3,FALSE)&"|"&HLOOKUP(Sheet1!R2C1,Sheet1!R2C1:R16C1,MOD(RC1+1,3)+MOD(INT((RC1+1)/3),3)*5+3,FALSE)&"|"&HLOOKUP(Sheet1!R2C1,Sheet1!R2C1:R16C1,MOD(RC1+2,3)+MOD(INT((RC1+2)/3),3)*5+3,FALSE)&"|"&HLOOKUP(Sheet1!R2C1,Sheet1!R2C1:R16C1,MOD(RC1+3,3)+MOD(INT((RC1+3)/3),3)*5+3,FALSE) -> 164|102|103|104|132 | K348: =HLOOKUP(Sheet1!R2C1,Sheet1!R2C1:R16C1,MOD(RC1-1,3)+MOD(INT((RC1-1)/3),3)*5+3,FALSE)&"|"&HLOOKUP(Sheet1!R2C1,Sheet1!R2C1:R16C1,MOD(RC1,3)+MOD(INT((RC1)/3),3)*5+3,FALSE)&"|"&HLOOKUP(Sheet1!R2C1,Sheet1!R2C1:R16C1,MOD(RC1+1,3)+MOD(INT((RC1+1)/3),3)*5+3,FALSE)&"|"&HLOOKUP(Sheet1!R2C1,Sheet1!R2C1:R16C1,MOD(RC1+2,3)+MOD(INT((RC1+2)/3),3)*5+3,FALSE)&"|"&HLOOKUP(Sheet1!R2C1,Sheet1!R2C1:R16C1,MOD(RC1+3,3)+MOD(INT((RC1+3)/3),3)*5+3,FALSE) -> 164|102|103|104|132 | L348: 25|22|23|24 | M348: 3946947|3946948|3946948|3946948 | N348: 10030|10031|10032|10033 | O348: 1|1|1|1 | P348: 2500|2500|2500|2500
A349: 343 | B349: 341 | C349: 30 | D349: =R[-20]C+2 -> 54 | E349: 1000 | F349: =MOD(RC[-5]-1,3)*30+100&"|"&MOD(RC[-5]-1,3)*30+101&"|"&MOD(RC[-5]-1,3)*30+102&"|"&MOD(RC[-5]-1,3)*30+103&"|"&IF(MOD(RC[-5],4)=0,HLOOKUP(Sheet1!R2C10,Sheet1!R2C10:R7C10,MOD(RC[-5]/4-1,6)+1,FALSE),IF(MOD(RC[-5],2)=0,IF(RC[-5]>20,HLOOKUP(Sheet1!R2C7,Sheet1!R2C7:R43C7,MOD(RC[-5]/2-1,42)+1,FALSE),HLOOKUP(Sheet1!R2C4,Sheet1!R2C4:R7C4,MOD(RC[-5]-1,6)+1,FALSE)),MOD(RC[-5]-1,3)*30+104)) -> 100|101|102|103|104 | G349: =HLOOKUP(Sheet1!R2C1,Sheet1!R2C1:R16C1,MOD(RC1-1,2)+MOD(INT((RC1-1)/2),3)*5+1,FALSE)&"|"&HLOOKUP(Sheet1!R2C1,Sheet1!R2C1:R16C1,MOD(RC1,2)+MOD(INT((RC1)/2),3)*5+1,FALSE)&"|"&HLOOKUP(Sheet1!R2C1,Sheet1!R2C1:R16C1,MOD(RC1+1,2)+MOD(INT((RC1+1)/2),3)*5+1,FALSE)&"|"&HLOOKUP(Sheet1!R2C1,Sheet1!R2C1:R16C1,MOD(RC1+2,2)+MOD(INT((RC1+2)/2),3)*5+1,FALSE)&"|"&HLOOKUP(Sheet1!R2C1,Sheet1!R2C1:R16C1,MOD(RC1+3,2)+MOD(INT((RC1+3)/2),3)*5+1,FALSE) -> 100|101|130|131|160 | H349: =HLOOKUP(Sheet1!R2C1,Sheet1!R2C1:R16C1,MOD(RC1+2,2)+MOD(INT((RC1+2)/2),3)*5+1,FALSE)&"|"&HLOOKUP(Sheet1!R2C1,Sheet1!R2C1:R16C1,MOD(RC1+3,2)+MOD(INT((RC1+3)/2),3)*5+1,FALSE)&"|"&HLOOKUP(Sheet1!R2C1,Sheet1!R2C1:R16C1,MOD(RC1+4,2)+MOD(INT((RC1+4)/2),3)*5+1,FALSE)&"|"&HLOOKUP(Sheet1!R2C1,Sheet1!R2C1:R16C1,MOD(RC1+5,2)+MOD(INT((RC1+5)/2),3)*5+1,FALSE)&"|"&HLOOKUP(Sheet1!R2C1,Sheet1!R2C1:R16C1,MOD(RC1+6,2)+MOD(INT((RC1+6)/2),3)*5+1,FALSE) -> 131|160|161|100|101 | I349: =HLOOKUP(Sheet1!R2C1,Sheet1!R2C1:R16C1,MOD(RC1-1,3)+MOD(INT((RC1-1)/3),3)*5+3,FALSE)&"|"&HLOOKUP(Sheet1!R2C1,Sheet1!R2C1:R16C1,MOD(RC1,3)+MOD(INT((RC1)/3),3)*5+3,FALSE)&"|"&HLOOKUP(Sheet1!R2C1,Sheet1!R2C1:R16C1,MOD(RC1+1,3)+MOD(INT((RC1+1)/3),3)*5+3,FALSE)&"|"&HLOOKUP(Sheet1!R2C1,Sheet1!R2C1:R16C1,MOD(RC1+2,3)+MOD(INT((RC1+2)/3),3)*5+3,FALSE)&"|"&HLOOKUP(Sheet1!R2C1,Sheet1!R2C1:R16C1,MOD(RC1+3,3)+MOD(INT((RC1+3)/3),3)*5+3,FALSE) -> 102|103|104|132|133 | J349: =HLOOKUP(Sheet1!R2C1,Sheet1!R2C1:R16C1,MOD(RC1-1,3)+MOD(INT((RC1-1)/3),3)*5+3,FALSE)&"|"&HLOOKUP(Sheet1!R2C1,Sheet1!R2C1:R16C1,MOD(RC1,3)+MOD(INT((RC1)/3),3)*5+3,FALSE)&"|"&HLOOKUP(Sheet1!R2C1,Sheet1!R2C1:R16C1,MOD(RC1+1,3)+MOD(INT((RC1+1)/3),3)*5+3,FALSE)&"|"&HLOOKUP(Sheet1!R2C1,Sheet1!R2C1:R16C1,MOD(RC1+2,3)+MOD(INT((RC1+2)/3),3)*5+3,FALSE)&"|"&HLOOKUP(Sheet1!R2C1,Sheet1!R2C1:R16C1,MOD(RC1+3,3)+MOD(INT((RC1+3)/3),3)*5+3,FALSE) -> 102|103|104|132|133 | K349: =HLOOKUP(Sheet1!R2C1,Sheet1!R2C1:R16C1,MOD(RC1-1,3)+MOD(INT((RC1-1)/3),3)*5+3,FALSE)&"|"&HLOOKUP(Sheet1!R2C1,Sheet1!R2C1:R16C1,MOD(RC1,3)+MOD(INT((RC1)/3),3)*5+3,FALSE)&"|"&HLOOKUP(Sheet1!R2C1,Sheet1!R2C1:R16C1,MOD(RC1+1,3)+MOD(INT((RC1+1)/3),3)*5+3,FALSE)&"|"&HLOOKUP(Sheet1!R2C1,Sheet1!R2C1:R16C1,MOD(RC1+2,3)+MOD(INT((RC1+2)/3),3)*5+3,FALSE)&"|"&HLOOKUP(Sheet1!R2C1,Sheet1!R2C1:R16C1,MOD(RC1+3,3)+MOD(INT((RC1+3)/3),3)*5+3,FALSE) -> 102|103|104|132|133 | L349: 25|22|23|24 | M349: 3982142|3982143|3982143|3982143 | N349: 10030|10031|10032|10033 | O349: 1|1|1|1 | P349: 2500|2500|2500|2500
A350: 344 | B350: 342 | C350: 30 | D350: =R[-20]C+2 -> 54 | E350: 1000 | F350: =MOD(RC[-5]-1,3)*30+100&"|"&MOD(RC[-5]-1,3)*30+101&"|"&MOD(RC[-5]-1,3)*30+102&"|"&MOD(RC[-5]-1,3)*30+103&"|"&IF(MOD(RC[-5],4)=0,HLOOKUP(Sheet1!R2C10,Sheet1!R2C10:R7C10,MOD(RC[-5]/4-1,6)+1,FALSE),IF(MOD(RC[-5],2)=0,IF(RC[-5]>20,HLOOKUP(Sheet1!R2C7,Sheet1!R2C7:R43C7,MOD(RC[-5]/2-1,42)+1,FALSE),HLOOKUP(Sheet1!R2C4,Sheet1!R2C4:R7C4,MOD(RC[-5]-1,6)+1,FALSE)),MOD(RC[-5]-1,3)*30+104)) -> 130|131|132|133|191 | G350: =HLOOKUP(Sheet1!R2C1,Sheet1!R2C1:R16C1,MOD(RC1-1,2)+MOD(INT((RC1-1)/2),3)*5+1,FALSE)&"|"&HLOOKUP(Sheet1!R2C1,Sheet1!R2C1:R16C1,MOD(RC1,2)+MOD(INT((RC1)/2),3)*5+1,FALSE)&"|"&HLOOKUP(Sheet1!R2C1,Sheet1!R2C1:R16C1,MOD(RC1+1,2)+MOD(INT((RC1+1)/2),3)*5+1,FALSE)&"|"&HLOOKUP(Sheet1!R2C1,Sheet1!R2C1:R16C1,MOD(RC1+2,2)+MOD(INT((RC1+2)/2),3)*5+1,FALSE)&"|"&HLOOKUP(Sheet1!R2C1,Sheet1!R2C1:R16C1,MOD(RC1+3,2)+MOD(INT((RC1+3)/2),3)*5+1,FALSE) -> 101|130|131|160|161 | H350: =HLOOKUP(Sheet1!R2C1,Sheet1!R2C1:R16C1,MOD(RC1+2,2)+MOD(INT((RC1+2)/2),3)*5+1,FALSE)&"|"&HLOOKUP(Sheet1!R2C1,Sheet1!R2C1:R16C1,MOD(RC1+3,2)+MOD(INT((RC1+3)/2),3)*5+1,FALSE)&"|"&HLOOKUP(Sheet1!R2C1,Sheet1!R2C1:R16C1,MOD(RC1+4,2)+MOD(INT((RC1+4)/2),3)*5+1,FALSE)&"|"&HLOOKUP(Sheet1!R2C1,Sheet1!R2C1:R16C1,MOD(RC1+5,2)+MOD(INT((RC1+5)/2),3)*5+1,FALSE)&"|"&HLOOKUP(Sheet1!R2C1,Sheet1!R2C1:R16C1,MOD(RC1+6,2)+MOD(INT((RC1+6)/2),3)*5+1,FALSE) -> 160|161|100|101|130 | I350: =HLOOKUP(Sheet1!R2C1,Sheet1!R2C1:R16C1,MOD(RC1-1,3)+MOD(INT((RC1-1)/3),3)*5+3,FALSE)&"|"&HLOOKUP(Sheet1!R2C1,Sheet1!R2C1:R16C1,MOD(RC1,3)+MOD(INT((RC1)/3),3)*5+3,FALSE)&"|"&HLOOKUP(Sheet1!R2C1,Sheet1!R2C1:R16C1,MOD(RC1+1,3)+MOD(INT((RC1+1)/3),3)*5+3,FALSE)&"|"&HLOOKUP(Sheet1!R2C1,Sheet1!R2C1:R16C1,MOD(RC1+2,3)+MOD(INT((RC1+2)/3),3)*5+3,FALSE)&"|"&HLOOKUP(Sheet1!R2C1,Sheet1!R2C1:R16C1,MOD(RC1+3,3)+MOD(INT((RC1+3)/3),3)*5+3,FALSE) -> 103|104|132|133|134 | J350: =HLOOKUP(Sheet1!R2C1,Sheet1!R2C1:R16C1,MOD(RC1-1,3)+MOD(INT((RC1-1)/3),3)*5+3,FALSE)&"|"&HLOOKUP(Sheet1!R2C1,Sheet1!R2C1:R16C1,MOD(RC1,3)+MOD(INT((RC1)/3),3)*5+3,FALSE)&"|"&HLOOKUP(Sheet1!R2C1,Sheet1!R2C1:R16C1,MOD(RC1+1,3)+MOD(INT((RC1+1)/3),3)*5+3,FALSE)&"|"&HLOOKUP(Sheet1!R2C1,Sheet1!R2C1:R16C1,MOD(RC1+2,3)+MOD(INT((RC1+2)/3),3)*5+3,FALSE)&"|"&HLOOKUP(Sheet1!R2C1,Sheet1!R2C1:R16C1,MOD(RC1+3,3)+MOD(INT((RC1+3)/3),3)*5+3,FALSE) -> 103|104|132|133|134 | K350: =HLOOKUP(Sheet1!R2C1,Sheet1!R2C1:R16C1,MOD(RC1-1,3)+MOD(INT((RC1-1)/3),3)*5+3,FALSE)&"|"&HLOOKUP(Sheet1!R2C1,Sheet1!R2C1:R16C1,MOD(RC1,3)+MOD(INT((RC1)/3),3)*5+3,FALSE)&"|"&HLOOKUP(Sheet1!R2C1,Sheet1!R2C1:R16C1,MOD(RC1+1,3)+MOD(INT((RC1+1)/3),3)*5+3,FALSE)&"|"&HLOOKUP(Sheet1!R2C1,Sheet1!R2C1:R16C1,MOD(RC1+2,3)+MOD(INT((RC1+2)/3),3)*5+3,FALSE)&"|"&HLOOKUP(Sheet1!R2C1,Sheet1!R2C1:R16C1,MOD(RC1+3,3)+MOD(INT((RC1+3)/3),3)*5+3,FALSE) -> 103|104|132|133|134 | L350: 25|22|23|24 | M350: 4017337|4017336|4017338|4017338 | N350: 10030|10031|10032|10033 | O350: 1|1|1|1 | P350: 2500|2500|2500|2500
A351: 345 | B351: 343 | C351: 30 | D351: =R[-20]C+2 -> 54 | E351: 1000 | F351: =MOD(RC[-5]-1,3)*30+100&"|"&MOD(RC[-5]-1,3)*30+101&"|"&MOD(RC[-5]-1,3)*30+102&"|"&MOD(RC[-5]-1,3)*30+103&"|"&IF(MOD(RC[-5],4)=0,HLOOKUP(Sheet1!R2C10,Sheet1!R2C10:R7C10,MOD(RC[-5]/4-1,6)+1,FALSE),IF(MOD(RC[-5],2)=0,IF(RC[-5]>20,HLOOKUP(Sheet1!R2C7,Sheet1!R2C7:R43C7,MOD(RC[-5]/2-1,42)+1,FALSE),HLOOKUP(Sheet1!R2C4,Sheet1!R2C4:R7C4,MOD(RC[-5]-1,6)+1,FALSE)),MOD(RC[-5]-1,3)*30+104)) -> 160|161|162|163|164 | G351: =HLOOKUP(Sheet1!R2C1,Sheet1!R2C1:R16C1,MOD(RC1-1,2)+MOD(INT((RC1-1)/2),3)*5+1,FALSE)&"|"&HLOOKUP(Sheet1!R2C1,Sheet1!R2C1:R16C1,MOD(RC1,2)+MOD(INT((RC1)/2),3)*5+1,FALSE)&"|"&HLOOKUP(Sheet1!R2C1,Sheet1!R2C1:R16C1,MOD(RC1+1,2)+MOD(INT((RC1+1)/2),3)*5+1,FALSE)&"|"&HLOOKUP(Sheet1!R2C1,Sheet1!R2C1:R16C1,MOD(RC1+2,2)+MOD(INT((RC1+2)/2),3)*5+1,FALSE)&"|"&HLOOKUP(Sheet1!R2C1,Sheet1!R2C1:R16C1,MOD(RC1+3,2)+MOD(INT((RC1+3)/2),3)*5+1,FALSE) -> 130|131|160|161|100 | H351: =HLOOKUP(Sheet1!R2C1,Sheet1!R2C1:R16C1,MOD(RC1+2,2)+MOD(INT((RC1+2)/2),3)*5+1,FALSE)&"|"&HLOOKUP(Sheet1!R2C1,Sheet1!R2C1:R16C1,MOD(RC1+3,2)+MOD(INT((RC1+3)/2),3)*5+1,FALSE)&"|"&HLOOKUP(Sheet1!R2C1,Sheet1!R2C1:R16C1,MOD(RC1+4,2)+MOD(INT((RC1+4)/2),3)*5+1,FALSE)&"|"&HLOOKUP(Sheet1!R2C1,Sheet1!R2C1:R16C1,MOD(RC1+5,2)+MOD(INT((RC1+5)/2),3)*5+1,FALSE)&"|"&HLOOKUP(Sheet1!R2C1,Sheet1!R2C1:R16C1,MOD(RC1+6,2)+MOD(INT((RC1+6)/2),3)*5+1,FALSE) -> 161|100|101|130|131 | I351: =HLOOKUP(Sheet1!R2C1,Sheet1!R2C1:R16C1,MOD(RC1-1,3)+MOD(INT((RC1-1)/3),3)*5+3,FALSE)&"|"&HLOOKUP(Sheet1!R2C1,Sheet1!R2C1:R16C1,MOD(RC1,3)+MOD(INT((RC1)/3),3)*5+3,FALSE)&"|"&HLOOKUP(Sheet1!R2C1,Sheet1!R2C1:R16C1,MOD(RC1+1,3)+MOD(INT((RC1+1)/3),3)*5+3,FALSE)&"|"&HLOOKUP(Sheet1!R2C1,Sheet1!R2C1:R16C1,MOD(RC1+2,3)+MOD(INT((RC1+2)/3),3)*5+3,FALSE)&"|"&HLOOKUP(Sheet1!R2C1,Sheet1!R2C1:R16C1,MOD(RC1+3,3)+MOD(INT((RC1+3)/3),3)*5+3,FALSE) -> 104|132|133|134|162 | J351: =HLOOKUP(Sheet1!R2C1,Sheet1!R2C1:R16C1,MOD(RC1-1,3)+MOD(INT((RC1-1)/3),3)*5+3,FALSE)&"|"&HLOOKUP(Sheet1!R2C1,Sheet1!R2C1:R16C1,MOD(RC1,3)+MOD(INT((RC1)/3),3)*5+3,FALSE)&"|"&HLOOKUP(Sheet1!R2C1,Sheet1!R2C1:R16C1,MOD(RC1+1,3)+MOD(INT((RC1+1)/3),3)*5+3,FALSE)&"|"&HLOOKUP(Sheet1!R2C1,Sheet1!R2C1:R16C1,MOD(RC1+2,3)+MOD(INT((RC1+2)/3),3)*5+3,FALSE)&"|"&HLOOKUP(Sheet1!R2C1,Sheet1!R2C1:R16C1,MOD(RC1+3,3)+MOD(INT((RC1+3)/3),3)*5+3,FALSE) -> 104|132|133|134|162 | K351: =HLOOKUP(Sheet1!R2C1,Sheet1!R2C1:R16C1,MOD(RC1-1,3)+MOD(INT((RC1-1)/3),3)*5+3,FALSE)&"|"&HLOOKUP(Sheet1!R2C1,Sheet1!R2C1:R16C1,MOD(RC1,3)+MOD(INT((RC1)/3),3)*5+3,FALSE)&"|"&HLOOKUP(Sheet1!R2C1,Sheet1!R2C1:R16C1,MOD(RC1+1,3)+MOD(INT((RC1+1)/3),3)*5+3,FALSE)&"|"&HLOOKUP(Sheet1!R2C1,Sheet1!R2C1:R16C1,MOD(RC1+2,3)+MOD(INT((RC1+2)/3),3)*5+3,FALSE)&"|"&HLOOKUP(Sheet1!R2C1,Sheet1!R2C1:R16C1,MOD(RC1+3,3)+MOD(INT((RC1+3)/3),3)*5+3,FALSE) -> 104|132|133|134|162 | L351: 25|22|23|24 | M351: 4052223|4052224|4052223|4052223 | N351: 10030|10031|10032|10033|10030|10031|10032|10033|10030|10031|10032|10033|10030|10031|10032|10033|10030|10031|10032|10033|10030|10031|10032|10033|10030|10031|10032|10033|10030|10031|10032|10033|10030|10031|10032|10033|10030|10031|10032|10033 | O351: 1|1|1|1|1|1|1|1|1|1|1|1|1|1|1|1|1|1|1|1|1|1|1|1|1|1|1|1|1|1|1|1|1|1|1|1|1|1|1|1 | P351: 2500|2500|2500|2500|2500|2500|2500|2500|2500|2500|2500|2500|2500|2500|2500|2500|2500|2500|2500|2500|2500|2500|2500|2500|2500|2500|2500|2500|2500|2500|2500|2500|2500|2500|2500|2500|2500|2500|2500|2500
A352: 346 | B352: 344 | C352: 30 | D352: =R[-20]C+2 -> 54 | E352: 1000 | F352: =MOD(RC[-5]-1,3)*30+100&"|"&MOD(RC[-5]-1,3)*30+101&"|"&MOD(RC[-5]-1,3)*30+102&"|"&MOD(RC[-5]-1,3)*30+103&"|"&IF(MOD(RC[-5],4)=0,HLOOKUP(Sheet1!R2C10,Sheet1!R2C10:R7C10,MOD(RC[-5]/4-1,6)+1,FALSE),IF(MOD(RC[-5],2)=0,IF(RC[-5]>20,HLOOKUP(Sheet1!R2C7,Sheet1!R2C7:R43C7,MOD(RC[-5]/2-1,42)+1,FALSE),HLOOKUP(Sheet1!R2C4,Sheet1!R2C4:R7C4,MOD(RC[-5]-1,6)+1,FALSE)),MOD(RC[-5]-1,3)*30+104)) -> 100|101|102|103|116 | G352: =HLOOKUP(Sheet1!R2C1,Sheet1!R2C1:R16C1,MOD(RC1-1,2)+MOD(INT((RC1-1)/2),3)*5+1,FALSE)&"|"&HLOOKUP(Sheet1!R2C1,Sheet1!R2C1:R16C1,MOD(RC1,2)+MOD(INT((RC1)/2),3)*5+1,FALSE)&"|"&HLOOKUP(Sheet1!R2C1,Sheet1!R2C1:R16C1,MOD(RC1+1,2)+MOD(INT((RC1+1)/2),3)*5+1,FALSE)&"|"&HLOOKUP(Sheet1!R2C1,Sheet1!R2C1:R16C1,MOD(RC1+2,2)+MOD(INT((RC1+2)/2),3)*5+1,FALSE)&"|"&HLOOKUP(Sheet1!R2C1,Sheet1!R2C1:R16C1,MOD(RC1+3,2)+MOD(INT((RC1+3)/2),3)*5+1,FALSE) -> 131|160|161|100|101 | H352: =HLOOKUP(Sheet1!R2C1,Sheet1!R2C1:R16C1,MOD(RC1+2,2)+MOD(INT((RC1+2)/2),3)*5+1,FALSE)&"|"&HLOOKUP(Sheet1!R2C1,Sheet1!R2C1:R16C1,MOD(RC1+3,2)+MOD(INT((RC1+3)/2),3)*5+1,FALSE)&"|"&HLOOKUP(Sheet1!R2C1,Sheet1!R2C1:R16C1,MOD(RC1+4,2)+MOD(INT((RC1+4)/2),3)*5+1,FALSE)&"|"&HLOOKUP(Sheet1!R2C1,Sheet1!R2C1:R16C1,MOD(RC1+5,2)+MOD(INT((RC1+5)/2),3)*5+1,FALSE)&"|"&HLOOKUP(Sheet1!R2C1,Sheet1!R2C1:R16C1,MOD(RC1+6,2)+MOD(INT((RC1+6)/2),3)*5+1,FALSE) -> 100|101|130|131|160 | I352: =HLOOKUP(Sheet1!R2C1,Sheet1!R2C1:R16C1,MOD(RC1-1,3)+MOD(INT((RC1-1)/3),3)*5+3,FALSE)&"|"&HLOOKUP(Sheet1!R2C1,Sheet1!R2C1:R16C1,MOD(RC1,3)+MOD(INT((RC1)/3),3)*5+3,FALSE)&"|"&HLOOKUP(Sheet1!R2C1,Sheet1!R2C1:R16C1,MOD(RC1+1,3)+MOD(INT((RC1+1)/3),3)*5+3,FALSE)&"|"&HLOOKUP(Sheet1!R2C1,Sheet1!R2C1:R16C1,MOD(RC1+2,3)+MOD(INT((RC1+2)/3),3)*5+3,FALSE)&"|"&HLOOKUP(Sheet1!R2C1,Sheet1!R2C1:R16C1,MOD(RC1+3,3)+MOD(INT((RC1+3)/3),3)*5+3,FALSE) -> 132|133|134|162|163 | J352: =HLOOKUP(Sheet1!R2C1,Sheet1!R2C1:R16C1,MOD(RC1-1,3)+MOD(INT((RC1-1)/3),3)*5+3,FALSE)&"|"&HLOOKUP(Sheet1!R2C1,Sheet1!R2C1:R16C1,MOD(RC1,3)+MOD(INT((RC1)/3),3)*5+3,FALSE)&"|"&HLOOKUP(Sheet1!R2C1,Sheet1!R2C1:R16C1,MOD(RC1+1,3)+MOD(INT((RC1+1)/3),3)*5+3,FALSE)&"|"&HLOOKUP(Sheet1!R2C1,Sheet1!R2C1:R16C1,MOD(RC1+2,3)+MOD(INT((RC1+2)/3),3)*5+3,FALSE)&"|"&HLOOKUP(Sheet1!R2C1,Sheet1!R2C1:R16C1,MOD(RC1+3,3)+MOD(INT((RC1+3)/3),3)*5+3,FALSE) -> 132|133|134|162|163 | K352: =HLOOKUP(Sheet1!R2C1,Sheet1!R2C1:R16C1,MOD(RC1-1,3)+MOD(INT((RC1-1)/3),3)*5+3,FALSE)&"|"&HLOOKUP(Sheet1!R2C1,Sheet1!R2C1:R16C1,MOD(RC1,3)+MOD(INT((RC1)/3),3)*5+3,FALSE)&"|"&HLOOKUP(Sheet1!R2C1,Sheet1!R2C1:R16C1,MOD(RC1+1,3)+MOD(INT((RC1+1)/3),3)*5+3,FALSE)&"|"&HLOOKUP(Sheet1!R2C1,Sheet1!R2C1:R16C1,MOD(RC1+2,3)+MOD(INT((RC1+2)/3),3)*5+3,FALSE)&"|"&HLOOKUP(Sheet1!R2C1,Sheet1!R2C1:R16C1,MOD(RC1+3,3)+MOD(INT((RC1+3)/3),3)*5+3,FALSE) -> 132|133|134|162|163 | L352: 25|22|23|24 | M352: 4088727|4088728|4088728|4088728 | N352: 10030|10031|10032|10033 | O352: 1|1|1|1 | P352: 2500|2500|2500|2500
A353: 347 | B353: 345 | C353: 30 | D353: =R[-20]C+2 -> 54 | E353: 1000 | F353: =MOD(RC[-5]-1,3)*30+100&"|"&MOD(RC[-5]-1,3)*30+101&"|"&MOD(RC[-5]-1,3)*30+102&"|"&MOD(RC[-5]-1,3)*30+103&"|"&IF(MOD(RC[-5],4)=0,HLOOKUP(Sheet1!R2C10,Sheet1!R2C10:R7C10,MOD(RC[-5]/4-1,6)+1,FALSE),IF(MOD(RC[-5],2)=0,IF(RC[-5]>20,HLOOKUP(Sheet1!R2C7,Sheet1!R2C7:R43C7,MOD(RC[-5]/2-1,42)+1,FALSE),HLOOKUP(Sheet1!R2C4,Sheet1!R2C4:R7C4,MOD(RC[-5]-1,6)+1,FALSE)),MOD(RC[-5]-1,3)*30+104)) -> 130|131|132|133|134 | G353: =HLOOKUP(Sheet1!R2C1,Sheet1!R2C1:R16C1,MOD(RC1-1,2)+MOD(INT((RC1-1)/2),3)*5+1,FALSE)&"|"&HLOOKUP(Sheet1!R2C1,Sheet1!R2C1:R16C1,MOD(RC1,2)+MOD(INT((RC1)/2),3)*5+1,FALSE)&"|"&HLOOKUP(Sheet1!R2C1,Sheet1!R2C1:R16C1,MOD(RC1+1,2)+MOD(INT((RC1+1)/2),3)*5+1,FALSE)&"|"&HLOOKUP(Sheet1!R2C1,Sheet1!R2C1:R16C1,MOD(RC1+2,2)+MOD(INT((RC1+2)/2),3)*5+1,FALSE)&"|"&HLOOKUP(Sheet1!R2C1,Sheet1!R2C1:R16C1,MOD(RC1+3,2)+MOD(INT((RC1+3)/2),3)*5+1,FALSE) -> 160|161|100|101|130 | H353: =HLOOKUP(Sheet1!R2C1,Sheet1!R2C1:R16C1,MOD(RC1+2,2)+MOD(INT((RC1+2)/2),3)*5+1,FALSE)&"|"&HLOOKUP(Sheet1!R2C1,Sheet1!R2C1:R16C1,MOD(RC1+3,2)+MOD(INT((RC1+3)/2),3)*5+1,FALSE)&"|"&HLOOKUP(Sheet1!R2C1,Sheet1!R2C1:R16C1,MOD(RC1+4,2)+MOD(INT((RC1+4)/2),3)*5+1,FALSE)&"|"&HLOOKUP(Sheet1!R2C1,Sheet1!R2C1:R16C1,MOD(RC1+5,2)+MOD(INT((RC1+5)/2),3)*5+1,FALSE)&"|"&HLOOKUP(Sheet1!R2C1,Sheet1!R2C1:R16C1,MOD(RC1+6,2)+MOD(INT((RC1+6)/2),3)*5+1,FALSE) -> 101|130|131|160|161 | I353: =HLOOKUP(Sheet1!R2C1,Sheet1!R2C1:R16C1,MOD(RC1-1,3)+MOD(INT((RC1-1)/3),3)*5+3,FALSE)&"|"&HLOOKUP(Sheet1!R2C1,Sheet1!R2C1:R16C1,MOD(RC1,3)+MOD(INT((RC1)/3),3)*5+3,FALSE)&"|"&HLOOKUP(Sheet1!R2C1,Sheet1!R2C1:R16C1,MOD(RC1+1,3)+MOD(INT((RC1+1)/3),3)*5+3,FALSE)&"|"&HLOOKUP(Sheet1!R2C1,Sheet1!R2C1:R16C1,MOD(RC1+2,3)+MOD(INT((RC1+2)/3),3)*5+3,FALSE)&"|"&HLOOKUP(Sheet1!R2C1,Sheet1!R2C1:R16C1,MOD(RC1+3,3)+MOD(INT((RC1+3)/3),3)*5+3,FALSE) -> 133|134|162|163|164 | J353: =HLOOKUP(Sheet1!R2C1,Sheet1!R2C1:R16C1,MOD(RC1-1,3)+MOD(INT((RC1-1)/3),3)*5+3,FALSE)&"|"&HLOOKUP(Sheet1!R2C1,Sheet1!R2C1:R16C1,MOD(RC1,3)+MOD(INT((RC1)/3),3)*5+3,FALSE)&"|"&HLOOKUP(Sheet1!R2C1,Sheet1!R2C1:R16C1,MOD(RC1+1,3)+MOD(INT((RC1+1)/3),3)*5+3,FALSE)&"|"&HLOOKUP(Sheet1!R2C1,Sheet1!R2C1:R16C1,MOD(RC1+2,3)+MOD(INT((RC1+2)/3),3)*5+3,FALSE)&"|"&HLOOKUP(Sheet1!R2C1,Sheet1!R2C1:R16C1,MOD(RC1+3,3)+MOD(INT((RC1+3)/3),3)*5+3,FALSE) -> 133|134|162|163|164 | K353: =HLOOKUP(Sheet1!R2C1,Sheet1!R2C1:R16C1,MOD(RC1-1,3)+MOD(INT((RC1-1)/3),3)*5+3,FALSE)&"|"&HLOOKUP(Sheet1!R2C1,Sheet1!R2C1:R16C1,MOD(RC1,3)+MOD(INT((RC1)/3),3)*5+3,FALSE)&"|"&HLOOKUP(Sheet1!R2C1,Sheet1!R2C1:R16C1,MOD(RC1+1,3)+MOD(INT((RC1+1)/3),3)*5+3,FALSE)&"|"&HLOOKUP(Sheet1!R2C1,Sheet1!R2C1:R16C1,MOD(RC1+2,3)+MOD(INT((RC1+2)/3),3)*5+3,FALSE)&"|"&HLOOKUP(Sheet1!R2C1,Sheet1!R2C1:R16C1,MOD(RC1+3,3)+MOD(INT((RC1+3)/3),3)*5+3,FALSE) -> 133|134|162|163|164 | L353: 25|22|23|24 | M353: 4125231|4125231|4125233|4125233 | N353: 10030|10031|10032|10033 | O353: 1|1|1|1 | P353: 2500|2500|2500|2500
A354: 348 | B354: 346 | C354: 30 | D354: =R[-20]C+2 -> 54 | E354: 1000 | F354: =MOD(RC[-5]-1,3)*30+100&"|"&MOD(RC[-5]-1,3)*30+101&"|"&MOD(RC[-5]-1,3)*30+102&"|"&MOD(RC[-5]-1,3)*30+103&"|"&IF(MOD(RC[-5],4)=0,HLOOKUP(Sheet1!R2C10,Sheet1!R2C10:R7C10,MOD(RC[-5]/4-1,6)+1,FALSE),IF(MOD(RC[-5],2)=0,IF(RC[-5]>20,HLOOKUP(Sheet1!R2C7,Sheet1!R2C7:R43C7,MOD(RC[-5]/2-1,42)+1,FALSE),HLOOKUP(Sheet1!R2C4,Sheet1!R2C4:R7C4,MOD(RC[-5]-1,6)+1,FALSE)),MOD(RC[-5]-1,3)*30+104)) -> 160|161|162|163|192 | G354: =HLOOKUP(Sheet1!R2C1,Sheet1!R2C1:R16C1,MOD(RC1-1,2)+MOD(INT((RC1-1)/2),3)*5+1,FALSE)&"|"&HLOOKUP(Sheet1!R2C1,Sheet1!R2C1:R16C1,MOD(RC1,2)+MOD(INT((RC1)/2),3)*5+1,FALSE)&"|"&HLOOKUP(Sheet1!R2C1,Sheet1!R2C1:R16C1,MOD(RC1+1,2)+MOD(INT((RC1+1)/2),3)*5+1,FALSE)&"|"&HLOOKUP(Sheet1!R2C1,Sheet1!R2C1:R16C1,MOD(RC1+2,2)+MOD(INT((RC1+2)/2),3)*5+1,FALSE)&"|"&HLOOKUP(Sheet1!R2C1,Sheet1!R2C1:R16C1,MOD(RC1+3,2)+MOD(INT((RC1+3)/2),3)*5+1,FALSE) -> 161|100|101|130|131 | H354: =HLOOKUP(Sheet1!R2C1,Sheet1!R2C1:R16C1,MOD(RC1+2,2)+MOD(INT((RC1+2)/2),3)*5+1,FALSE)&"|"&HLOOKUP(Sheet1!R2C1,Sheet1!R2C1:R16C1,MOD(RC1+3,2)+MOD(INT((RC1+3)/2),3)*5+1,FALSE)&"|"&HLOOKUP(Sheet1!R2C1,Sheet1!R2C1:R16C1,MOD(RC1+4,2)+MOD(INT((RC1+4)/2),3)*5+1,FALSE)&"|"&HLOOKUP(Sheet1!R2C1,Sheet1!R2C1:R16C1,MOD(RC1+5,2)+MOD(INT((RC1+5)/2),3)*5+1,FALSE)&"|"&HLOOKUP(Sheet1!R2C1,Sheet1!R2C1:R16C1,MOD(RC1+6,2)+MOD(INT((RC1+6)/2),3)*5+1,FALSE) -> 130|131|160|161|100 | I354: =HLOOKUP(Sheet1!R2C1,Sheet1!R2C1:R16C1,MOD(RC1-1,3)+MOD(INT((RC1-1)/3),3)*5+3,FALSE)&"|"&HLOOKUP(Sheet1!R2C1,Sheet1!R2C1:R16C1,MOD(RC1,3)+MOD(INT((RC1)/3),3)*5+3,FALSE)&"|"&HLOOKUP(Sheet1!R2C1,Sheet1!R2C1:R16C1,MOD(RC1+1,3)+MOD(INT((RC1+1)/3),3)*5+3,FALSE)&"|"&HLOOKUP(Sheet1!R2C1,Sheet1!R2C1:R16C1,MOD(RC1+2,3)+MOD(INT((RC1+2)/3),3)*5+3,FALSE)&"|"&HLOOKUP(Sheet1!R2C1,Sheet1!R2C1:R16C1,MOD(RC1+3,3)+MOD(INT((RC1+3)/3),3)*5+3,FALSE) -> 134|162|163|164|102 | J354: =HLOOKUP(Sheet1!R2C1,Sheet1!R2C1:R16C1,MOD(RC1-1,3)+MOD(INT((RC1-1)/3),3)*5+3,FALSE)&"|"&HLOOKUP(Sheet1!R2C1,Sheet1!R2C1:R16C1,MOD(RC1,3)+MOD(INT((RC1)/3),3)*5+3,FALSE)&"|"&HLOOKUP(Sheet1!R2C1,Sheet1!R2C1:R16C1,MOD(RC1+1,3)+MOD(INT((RC1+1)/3),3)*5+3,FALSE)&"|"&HLOOKUP(Sheet1!R2C1,Sheet1!R2C1:R16C1,MOD(RC1+2,3)+MOD(INT((RC1+2)/3),3)*5+3,FALSE)&"|"&HLOOKUP(Sheet1!R2C1,Sheet1!R2C1:R16C1,MOD(RC1+3,3)+MOD(INT((RC1+3)/3),3)*5+3,FALSE) -> 134|162|163|164|102 | K354: =HLOOKUP(Sheet1!R2C1,Sheet1!R2C1:R16C1,MOD(RC1-1,3)+MOD(INT((RC1-1)/3),3)*5+3,FALSE)&"|"&HLOOKUP(Sheet1!R2C1,Sheet1!R2C1:R16C1,MOD(RC1,3)+MOD(INT((RC1)/3),3)*5+3,FALSE)&"|"&HLOOKUP(Sheet1!R2C1,Sheet1!R2C1:R16C1,MOD(RC1+1,3)+MOD(INT((RC1+1)/3),3)*5+3,FALSE)&"|"&HLOOKUP(Sheet1!R2C1,Sheet1!R2C1:R16C1,MOD(RC1+2,3)+MOD(INT((RC1+2)/3),3)*5+3,FALSE)&"|"&HLOOKUP(Sheet1!R2C1,Sheet1!R2C1:R16C1,MOD(RC1+3,3)+MOD(INT((RC1+3)/3),3)*5+3,FALSE) -> 134|162|163|164|102 | L354: 25|22|23|24 | M354: 4161735|4161735|4161735|4161735 | N354: 10030|10031|10032|10033 | O354: 1|1|1|1 | P354: 2500|2500|2500|2500
A355: 349 | B355: 347 | C355: 30 | D355: =R[-20]C+2 -> 54 | E355: 1000 | F355: =MOD(RC[-5]-1,3)*30+100&"|"&MOD(RC[-5]-1,3)*30+101&"|"&MOD(RC[-5]-1,3)*30+102&"|"&MOD(RC[-5]-1,3)*30+103&"|"&IF(MOD(RC[-5],4)=0,HLOOKUP(Sheet1!R2C10,Sheet1!R2C10:R7C10,MOD(RC[-5]/4-1,6)+1,FALSE),IF(MOD(RC[-5],2)=0,IF(RC[-5]>20,HLOOKUP(Sheet1!R2C7,Sheet1!R2C7:R43C7,MOD(RC[-5]/2-1,42)+1,FALSE),HLOOKUP(Sheet1!R2C4,Sheet1!R2C4:R7C4,MOD(RC[-5]-1,6)+1,FALSE)),MOD(RC[-5]-1,3)*30+104)) -> 100|101|102|103|104 | G355: =HLOOKUP(Sheet1!R2C1,Sheet1!R2C1:R16C1,MOD(RC1-1,2)+MOD(INT((RC1-1)/2),3)*5+1,FALSE)&"|"&HLOOKUP(Sheet1!R2C1,Sheet1!R2C1:R16C1,MOD(RC1,2)+MOD(INT((RC1)/2),3)*5+1,FALSE)&"|"&HLOOKUP(Sheet1!R2C1,Sheet1!R2C1:R16C1,MOD(RC1+1,2)+MOD(INT((RC1+1)/2),3)*5+1,FALSE)&"|"&HLOOKUP(Sheet1!R2C1,Sheet1!R2C1:R16C1,MOD(RC1+2,2)+MOD(INT((RC1+2)/2),3)*5+1,FALSE)&"|"&HLOOKUP(Sheet1!R2C1,Sheet1!R2C1:R16C1,MOD(RC1+3,2)+MOD(INT((RC1+3)/2),3)*5+1,FALSE) -> 100|101|130|131|160 | H355: =HLOOKUP(Sheet1!R2C1,Sheet1!R2C1:R16C1,MOD(RC1+2,2)+MOD(INT((RC1+2)/2),3)*5+1,FALSE)&"|"&HLOOKUP(Sheet1!R2C1,Sheet1!R2C1:R16C1,MOD(RC1+3,2)+MOD(INT((RC1+3)/2),3)*5+1,FALSE)&"|"&HLOOKUP(Sheet1!R2C1,Sheet1!R2C1:R16C1,MOD(RC1+4,2)+MOD(INT((RC1+4)/2),3)*5+1,FALSE)&"|"&HLOOKUP(Sheet1!R2C1,Sheet1!R2C1:R16C1,MOD(RC1+5,2)+MOD(INT((RC1+5)/2),3)*5+1,FALSE)&"|"&HLOOKUP(Sheet1!R2C1,Sheet1!R2C1:R16C1,MOD(RC1+6,2)+MOD(INT((RC1+6)/2),3)*5+1,FALSE) -> 131|160|161|100|101 | I355: =HLOOKUP(Sheet1!R2C1,Sheet1!R2C1:R16C1,MOD(RC1-1,3)+MOD(INT((RC1-1)/3),3)*5+3,FALSE)&"|"&HLOOKUP(Sheet1!R2C1,Sheet1!R2C1:R16C1,MOD(RC1,3)+MOD(INT((RC1)/3),3)*5+3,FALSE)&"|"&HLOOKUP(Sheet1!R2C1,Sheet1!R2C1:R16C1,MOD(RC1+1,3)+MOD(INT((RC1+1)/3),3)*5+3,FALSE)&"|"&HLOOKUP(Sheet1!R2C1,Sheet1!R2C1:R16C1,MOD(RC1+2,3)+MOD(INT((RC1+2)/3),3)*5+3,FALSE)&"|"&HLOOKUP(Sheet1!R2C1,Sheet1!R2C1:R16C1,MOD(RC1+3,3)+MOD(INT((RC1+3)/3),3)*5+3,FALSE) -> 162|163|164|102|103 | J355: =HLOOKUP(Sheet1!R2C1,Sheet1!R2C1:R16C1,MOD(RC1-1,3)+MOD(INT((RC1-1)/3),3)*5+3,FALSE)&"|"&HLOOKUP(Sheet1!R2C1,Sheet1!R2C1:R16C1,MOD(RC1,3)+MOD(INT((RC1)/3),3)*5+3,FALSE)&"|"&HLOOKUP(Sheet1!R2C1,Sheet1!R2C1:R16C1,MOD(RC1+1,3)+MOD(INT((RC1+1)/3),3)*5+3,FALSE)&"|"&HLOOKUP(Sheet1!R2C1,Sheet1!R2C1:R16C1,MOD(RC1+2,3)+MOD(INT((RC1+2)/3),3)*5+3,FALSE)&"|"&HLOOKUP(Sheet1!R2C1,Sheet1!R2C1:R16C1,MOD(RC1+3,3)+MOD(INT((RC1+3)/3),3)*5+3,FALSE) -> 162|163|164|102|103 | K355: =HLOOKUP(Sheet1!R2C1,Sheet1!R2C1:R16C1,MOD(RC1-1,3)+MOD(INT((RC1-1)/3),3)*5+3,FALSE)&"|"&HLOOKUP(Sheet1!R2C1,Sheet1!R2C1:R16C1,MOD(RC1,3)+MOD(INT((RC1)/3),3)*5+3,FALSE)&"|"&HLOOKUP(Sheet1!R2C1,Sheet1!R2C1:R16C1,MOD(RC1+1,3)+MOD(INT((RC1+1)/3),3)*5+3,FALSE)&"|"&HLOOKUP(Sheet1!R2C1,Sheet1!R2C1:R16C1,MOD(RC1+2,3)+MOD(INT((RC1+2)/3),3)*5+3,FALSE)&"|"&HLOOKUP(Sheet1!R2C1,Sheet1!R2C1:R16C1,MOD(RC1+3,3)+MOD(INT((RC1+3)/3),3)*5+3,FALSE) -> 162|163|164|102|103 | L355: 25|22|23|24 | M355: 4199388|4199388|4199388|4199388 | N355: 10030|10031|10032|10033 | O355: 1|1|1|1 | P355: 2500|2500|2500|2500
A356: 350 | B356: 348 | C356: 30 | D356: =R[-20]C+2 -> 54 | E356: 1000 | F356: =MOD(RC[-5]-1,3)*30+100&"|"&MOD(RC[-5]-1,3)*30+101&"|"&MOD(RC[-5]-1,3)*30+102&"|"&MOD(RC[-5]-1,3)*30+103&"|"&IF(MOD(RC[-5],4)=0,HLOOKUP(Sheet1!R2C10,Sheet1!R2C10:R7C10,MOD(RC[-5]/4-1,6)+1,FALSE),IF(MOD(RC[-5],2)=0,IF(RC[-5]>20,HLOOKUP(Sheet1!R2C7,Sheet1!R2C7:R43C7,MOD(RC[-5]/2-1,42)+1,FALSE),HLOOKUP(Sheet1!R2C4,Sheet1!R2C4:R7C4,MOD(RC[-5]-1,6)+1,FALSE)),MOD(RC[-5]-1,3)*30+104)) -> 130|131|132|133|118 | G356: =HLOOKUP(Sheet1!R2C1,Sheet1!R2C1:R16C1,MOD(RC1-1,2)+MOD(INT((RC1-1)/2),3)*5+1,FALSE)&"|"&HLOOKUP(Sheet1!R2C1,Sheet1!R2C1:R16C1,MOD(RC1,2)+MOD(INT((RC1)/2),3)*5+1,FALSE)&"|"&HLOOKUP(Sheet1!R2C1,Sheet1!R2C1:R16C1,MOD(RC1+1,2)+MOD(INT((RC1+1)/2),3)*5+1,FALSE)&"|"&HLOOKUP(Sheet1!R2C1,Sheet1!R2C1:R16C1,MOD(RC1+2,2)+MOD(INT((RC1+2)/2),3)*5+1,FALSE)&"|"&HLOOKUP(Sheet1!R2C1,Sheet1!R2C1:R16C1,MOD(RC1+3,2)+MOD(INT((RC1+3)/2),3)*5+1,FALSE) -> 101|130|131|160|161 | H356: =HLOOKUP(Sheet1!R2C1,Sheet1!R2C1:R16C1,MOD(RC1+2,2)+MOD(INT((RC1+2)/2),3)*5+1,FALSE)&"|"&HLOOKUP(Sheet1!R2C1,Sheet1!R2C1:R16C1,MOD(RC1+3,2)+MOD(INT((RC1+3)/2),3)*5+1,FALSE)&"|"&HLOOKUP(Sheet1!R2C1,Sheet1!R2C1:R16C1,MOD(RC1+4,2)+MOD(INT((RC1+4)/2),3)*5+1,FALSE)&"|"&HLOOKUP(Sheet1!R2C1,Sheet1!R2C1:R16C1,MOD(RC1+5,2)+MOD(INT((RC1+5)/2),3)*5+1,FALSE)&"|"&HLOOKUP(Sheet1!R2C1,Sheet1!R2C1:R16C1,MOD(RC1+6,2)+MOD(INT((RC1+6)/2),3)*5+1,FALSE) -> 160|161|100|101|130 | I356: =HLOOKUP(Sheet1!R2C1,Sheet1!R2C1:R16C1,MOD(RC1-1,3)+MOD(INT((RC1-1)/3),3)*5+3,FALSE)&"|"&HLOOKUP(Sheet1!R2C1,Sheet1!R2C1:R16C1,MOD(RC1,3)+MOD(INT((RC1)/3),3)*5+3,FALSE)&"|"&HLOOKUP(Sheet1!R2C1,Sheet1!R2C1:R16C1,MOD(RC1+1,3)+MOD(INT((RC1+1)/3),3)*5+3,FALSE)&"|"&HLOOKUP(Sheet1!R2C1,Sheet1!R2C1:R16C1,MOD(RC1+2,3)+MOD(INT((RC1+2)/3),3)*5+3,FALSE)&"|"&HLOOKUP(Sheet1!R2C1,Sheet1!R2C1:R16C1,MOD(RC1+3,3)+MOD(INT((RC1+3)/3),3)*5+3,FALSE) -> 163|164|102|103|104 | J356: =HLOOKUP(Sheet1!R2C1,Sheet1!R2C1:R16C1,MOD(RC1-1,3)+MOD(INT((RC1-1)/3),3)*5+3,FALSE)&"|"&HLOOKUP(Sheet1!R2C1,Sheet1!R2C1:R16C1,MOD(RC1,3)+MOD(INT((RC1)/3),3)*5+3,FALSE)&"|"&HLOOKUP(Sheet1!R2C1,Sheet1!R2C1:R16C1,MOD(RC1+1,3)+MOD(INT((RC1+1)/3),3)*5+3,FALSE)&"|"&HLOOKUP(Sheet1!R2C1,Sheet1!R2C1:R16C1,MOD(RC1+2,3)+MOD(INT((RC1+2)/3),3)*5+3,FALSE)&"|"&HLOOKUP(Sheet1!R2C1,Sheet1!R2C1:R16C1,MOD(RC1+3,3)+MOD(INT((RC1+3)/3),3)*5+3,FALSE) -> 163|164|102|103|104 | K356: =HLOOKUP(Sheet1!R2C1,Sheet1!R2C1:R16C1,MOD(RC1-1,3)+MOD(INT((RC1-1)/3),3)*5+3,FALSE)&"|"&HLOOKUP(Sheet1!R2C1,Sheet1!R2C1:R16C1,MOD(RC1,3)+MOD(INT((RC1)/3),3)*5+3,FALSE)&"|"&HLOOKUP(Sheet1!R2C1,Sheet1!R2C1:R16C1,MOD(RC1+1,3)+MOD(INT((RC1+1)/3),3)*5+3,FALSE)&"|"&HLOOKUP(Sheet1!R2C1,Sheet1!R2C1:R16C1,MOD(RC1+2,3)+MOD(INT((RC1+2)/3),3)*5+3,FALSE)&"|"&HLOOKUP(Sheet1!R2C1,Sheet1!R2C1:R16C1,MOD(RC1+3,3)+MOD(INT((RC1+3)/3),3)*5+3,FALSE) -> 163|164|102|103|104 | L356: 25|22|23|24 | M356: 4237259|4237259|4237260|4237260 | N356: 10030|10031|10032|10033|10030|10031|10032|10033|10030|10031|10032|10033|10030|10031|10032|10033|10030|10031|10032|10033|10030|10031|10032|10033|10030|10031|10032|10033|10030|10031|10032|10033|10030|10031|10032|10033|10030|10031|10032|10033 | O356: 1|1|1|1|1|1|1|1|1|1|1|1|1|1|1|1|1|1|1|1|1|1|1|1|1|1|1|1|1|1|1|1|1|1|1|1|1|1|1|1 | P356: 2500|2500|2500|2500|2500|2500|2500|2500|2500|2500|2500|2500|2500|2500|2500|2500|2500|2500|2500|2500|2500|2500|2500|2500|2500|2500|2500|2500|2500|2500|2500|2500|2500|2500|2500|2500|2500|2500|2500|2500
A357: 351 | B357: 349 | C357: 30 | D357: =R[-20]C+2 -> 54 | E357: 1000 | F357: =MOD(RC[-5]-1,3)*30+100&"|"&MOD(RC[-5]-1,3)*30+101&"|"&MOD(RC[-5]-1,3)*30+102&"|"&MOD(RC[-5]-1,3)*30+103&"|"&IF(MOD(RC[-5],4)=0,HLOOKUP(Sheet1!R2C10,Sheet1!R2C10:R7C10,MOD(RC[-5]/4-1,6)+1,FALSE),IF(MOD(RC[-5],2)=0,IF(RC[-5]>20,HLOOKUP(Sheet1!R2C7,Sheet1!R2C7:R43C7,MOD(RC[-5]/2-1,42)+1,FALSE),HLOOKUP(Sheet1!R2C4,Sheet1!R2C4:R7C4,MOD(RC[-5]-1,6)+1,FALSE)),MOD(RC[-5]-1,3)*30+104)) -> 160|161|162|163|164 | G357: =HLOOKUP(Sheet1!R2C1,Sheet1!R2C1:R16C1,MOD(RC1-1,2)+MOD(INT((RC1-1)/2),3)*5+1,FALSE)&"|"&HLOOKUP(Sheet1!R2C1,Sheet1!R2C1:R16C1,MOD(RC1,2)+MOD(INT((RC1)/2),3)*5+1,FALSE)&"|"&HLOOKUP(Sheet1!R2C1,Sheet1!R2C1:R16C1,MOD(RC1+1,2)+MOD(INT((RC1+1)/2),3)*5+1,FALSE)&"|"&HLOOKUP(Sheet1!R2C1,Sheet1!R2C1:R16C1,MOD(RC1+2,2)+MOD(INT((RC1+2)/2),3)*5+1,FALSE)&"|"&HLOOKUP(Sheet1!R2C1,Sheet1!R2C1:R16C1,MOD(RC1+3,2)+MOD(INT((RC1+3)/2),3)*5+1,FALSE) -> 130|131|160|161|100 | H357: =HLOOKUP(Sheet1!R2C1,Sheet1!R2C1:R16C1,MOD(RC1+2,2)+MOD(INT((RC1+2)/2),3)*5+1,FALSE)&"|"&HLOOKUP(Sheet1!R2C1,Sheet1!R2C1:R16C1,MOD(RC1+3,2)+MOD(INT((RC1+3)/2),3)*5+1,FALSE)&"|"&HLOOKUP(Sheet1!R2C1,Sheet1!R2C1:R16C1,MOD(RC1+4,2)+MOD(INT((RC1+4)/2),3)*5+1,FALSE)&"|"&HLOOKUP(Sheet1!R2C1,Sheet1!R2C1:R16C1,MOD(RC1+5,2)+MOD(INT((RC1+5)/2),3)*5+1,FALSE)&"|"&HLOOKUP(Sheet1!R2C1,Sheet1!R2C1:R16C1,MOD(RC1+6,2)+MOD(INT((RC1+6)/2),3)*5+1,FALSE) -> 161|100|101|130|131 | I357: =HLOOKUP(Sheet1!R2C1,Sheet1!R2C1:R16C1,MOD(RC1-1,3)+MOD(INT((RC1-1)/3),3)*5+3,FALSE)&"|"&HLOOKUP(Sheet1!R2C1,Sheet1!R2C1:R16C1,MOD(RC1,3)+MOD(INT((RC1)/3),3)*5+3,FALSE)&"|"&HLOOKUP(Sheet1!R2C1,Sheet1!R2C1:R16C1,MOD(RC1+1,3)+MOD(INT((RC1+1)/3),3)*5+3,FALSE)&"|"&HLOOKUP(Sheet1!R2C1,Sheet1!R2C1:R16C1,MOD(RC1+2,3)+MOD(INT((RC1+2)/3),3)*5+3,FALSE)&"|"&HLOOKUP(Sheet1!R2C1,Sheet1!R2C1:R16C1,MOD(RC1+3,3)+MOD(INT((RC1+3)/3),3)*5+3,FALSE) -> 164|102|103|104|132 | J357: =HLOOKUP(Sheet1!R2C1,Sheet1!R2C1:R16C1,MOD(RC1-1,3)+MOD(INT((RC1-1)/3),3)*5+3,FALSE)&"|"&HLOOKUP(Sheet1!R2C1,Sheet1!R2C1:R16C1,MOD(RC1,3)+MOD(INT((RC1)/3),3)*5+3,FALSE)&"|"&HLOOKUP(Sheet1!R2C1,Sheet1!R2C1:R16C1,MOD(RC1+1,3)+MOD(INT((RC1+1)/3),3)*5+3,FALSE)&"|"&HLOOKUP(Sheet1!R2C1,Sheet1!R2C1:R16C1,MOD(RC1+2,3)+MOD(INT((RC1+2)/3),3)*5+3,FALSE)&"|"&HLOOKUP(Sheet1!R2C1,Sheet1!R2C1:R16C1,MOD(RC1+3,3)+MOD(INT((RC1+3)/3),3)*5+3,FALSE) -> 164|102|103|104|132 | K357: =HLOOKUP(Sheet1!R2C1,Sheet1!R2C1:R16C1,MOD(RC1-1,3)+MOD(INT((RC1-1)/3),3)*5+3,FALSE)&"|"&HLOOKUP(Sheet1!R2C1,Sheet1!R2C1:R16C1,MOD(RC1,3)+MOD(INT((RC1)/3),3)*5+3,FALSE)&"|"&HLOOKUP(Sheet1!R2C1,Sheet1!R2C1:R16C1,MOD(RC1+1,3)+MOD(INT((RC1+1)/3),3)*5+3,FALSE)&"|"&HLOOKUP(Sheet1!R2C1,Sheet1!R2C1:R16C1,MOD(RC1+2,3)+MOD(INT((RC1+2)/3),3)*5+3,FALSE)&"|"&HLOOKUP(Sheet1!R2C1,Sheet1!R2C1:R16C1,MOD(RC1+3,3)+MOD(INT((RC1+3)/3),3)*5+3,FALSE) -> 164|102|103|104|132 | L357: 25|22|23|24 | M357: 4273615|4273615|4273615|4273615 | N357: 10030|10031|10032|10033 | O357: 1|1|1|1 | P357: 2500|2500|2500|2500
A358: 352 | B358: 350 | C358: 30 | D358: =R[-20]C+2 -> 54 | E358: 1000 | F358: =MOD(RC[-5]-1,3)*30+100&"|"&MOD(RC[-5]-1,3)*30+101&"|"&MOD(RC[-5]-1,3)*30+102&"|"&MOD(RC[-5]-1,3)*30+103&"|"&IF(MOD(RC[-5],4)=0,HLOOKUP(Sheet1!R2C10,Sheet1!R2C10:R7C10,MOD(RC[-5]/4-1,6)+1,FALSE),IF(MOD(RC[-5],2)=0,IF(RC[-5]>20,HLOOKUP(Sheet1!R2C7,Sheet1!R2C7:R43C7,MOD(RC[-5]/2-1,42)+1,FALSE),HLOOKUP(Sheet1!R2C4,Sheet1!R2C4:R7C4,MOD(RC[-5]-1,6)+1,FALSE)),MOD(RC[-5]-1,3)*30+104)) -> 100|101|102|103|193 | G358: =HLOOKUP(Sheet1!R2C1,Sheet1!R2C1:R16C1,MOD(RC1-1,2)+MOD(INT((RC1-1)/2),3)*5+1,FALSE)&"|"&HLOOKUP(Sheet1!R2C1,Sheet1!R2C1:R16C1,MOD(RC1,2)+MOD(INT((RC1)/2),3)*5+1,FALSE)&"|"&HLOOKUP(Sheet1!R2C1,Sheet1!R2C1:R16C1,MOD(RC1+1,2)+MOD(INT((RC1+1)/2),3)*5+1,FALSE)&"|"&HLOOKUP(Sheet1!R2C1,Sheet1!R2C1:R16C1,MOD(RC1+2,2)+MOD(INT((RC1+2)/2),3)*5+1,FALSE)&"|"&HLOOKUP(Sheet1!R2C1,Sheet1!R2C1:R16C1,MOD(RC1+3,2)+MOD(INT((RC1+3)/2),3)*5+1,FALSE) -> 131|160|161|100|101 | H358: =HLOOKUP(Sheet1!R2C1,Sheet1!R2C1:R16C1,MOD(RC1+2,2)+MOD(INT((RC1+2)/2),3)*5+1,FALSE)&"|"&HLOOKUP(Sheet1!R2C1,Sheet1!R2C1:R16C1,MOD(RC1+3,2)+MOD(INT((RC1+3)/2),3)*5+1,FALSE)&"|"&HLOOKUP(Sheet1!R2C1,Sheet1!R2C1:R16C1,MOD(RC1+4,2)+MOD(INT((RC1+4)/2),3)*5+1,FALSE)&"|"&HLOOKUP(Sheet1!R2C1,Sheet1!R2C1:R16C1,MOD(RC1+5,2)+MOD(INT((RC1+5)/2),3)*5+1,FALSE)&"|"&HLOOKUP(Sheet1!R2C1,Sheet1!R2C1:R16C1,MOD(RC1+6,2)+MOD(INT((RC1+6)/2),3)*5+1,FALSE) -> 100|101|130|131|160 | I358: =HLOOKUP(Sheet1!R2C1,Sheet1!R2C1:R16C1,MOD(RC1-1,3)+MOD(INT((RC1-1)/3),3)*5+3,FALSE)&"|"&HLOOKUP(Sheet1!R2C1,Sheet1!R2C1:R16C1,MOD(RC1,3)+MOD(INT((RC1)/3),3)*5+3,FALSE)&"|"&HLOOKUP(Sheet1!R2C1,Sheet1!R2C1:R16C1,MOD(RC1+1,3)+MOD(INT((RC1+1)/3),3)*5+3,FALSE)&"|"&HLOOKUP(Sheet1!R2C1,Sheet1!R2C1:R16C1,MOD(RC1+2,3)+MOD(INT((RC1+2)/3),3)*5+3,FALSE)&"|"&HLOOKUP(Sheet1!R2C1,Sheet1!R2C1:R16C1,MOD(RC1+3,3)+MOD(INT((RC1+3)/3),3)*5+3,FALSE) -> 102|103|104|132|133 | J358: =HLOOKUP(Sheet1!R2C1,Sheet1!R2C1:R16C1,MOD(RC1-1,3)+MOD(INT((RC1-1)/3),3)*5+3,FALSE)&"|"&HLOOKUP(Sheet1!R2C1,Sheet1!R2C1:R16C1,MOD(RC1,3)+MOD(INT((RC1)/3),3)*5+3,FALSE)&"|"&HLOOKUP(Sheet1!R2C1,Sheet1!R2C1:R16C1,MOD(RC1+1,3)+MOD(INT((RC1+1)/3),3)*5+3,FALSE)&"|"&HLOOKUP(Sheet1!R2C1,Sheet1!R2C1:R16C1,MOD(RC1+2,3)+MOD(INT((RC1+2)/3),3)*5+3,FALSE)&"|"&HLOOKUP(Sheet1!R2C1,Sheet1!R2C1:R16C1,MOD(RC1+3,3)+MOD(INT((RC1+3)/3),3)*5+3,FALSE) -> 102|103|104|132|133 | K358: =HLOOKUP(Sheet1!R2C1,Sheet1!R2C1:R16C1,MOD(RC1-1,3)+MOD(INT((RC1-1)/3),3)*5+3,FALSE)&"|"&HLOOKUP(Sheet1!R2C1,Sheet1!R2C1:R16C1,MOD(RC1,3)+MOD(INT((RC1)/3),3)*5+3,FALSE)&"|"&HLOOKUP(Sheet1!R2C1,Sheet1!R2C1:R16C1,MOD(RC1+1,3)+MOD(INT((RC1+1)/3),3)*5+3,FALSE)&"|"&HLOOKUP(Sheet1!R2C1,Sheet1!R2C1:R16C1,MOD(RC1+2,3)+MOD(INT((RC1+2)/3),3)*5+3,FALSE)&"|"&HLOOKUP(Sheet1!R2C1,Sheet1!R2C1:R16C1,MOD(RC1+3,3)+MOD(INT((RC1+3)/3),3)*5+3,FALSE) -> 102|103|104|132|133 | L358: 25|22|23|24 | M358: 4311486|4311486|4311488|4311488 | N358: 10030|10031|10032|10033 | O358: 1|1|1|1 | P358: 2500|2500|2500|2500
A359: 353 | B359: 351 | C359: 30 | D359: =R[-20]C+2 -> 54 | E359: 1000 | F359: =MOD(RC[-5]-1,3)*30+100&"|"&MOD(RC[-5]-1,3)*30+101&"|"&MOD(RC[-5]-1,3)*30+102&"|"&MOD(RC[-5]-1,3)*30+103&"|"&IF(MOD(RC[-5],4)=0,HLOOKUP(Sheet1!R2C10,Sheet1!R2C10:R7C10,MOD(RC[-5]/4-1,6)+1,FALSE),IF(MOD(RC[-5],2)=0,IF(RC[-5]>20,HLOOKUP(Sheet1!R2C7,Sheet1!R2C7:R43C7,MOD(RC[-5]/2-1,42)+1,FALSE),HLOOKUP(Sheet1!R2C4,Sheet1!R2C4:R7C4,MOD(RC[-5]-1,6)+1,FALSE)),MOD(RC[-5]-1,3)*30+104)) -> 130|131|132|133|134 | G359: =HLOOKUP(Sheet1!R2C1,Sheet1!R2C1:R16C1,MOD(RC1-1,2)+MOD(INT((RC1-1)/2),3)*5+1,FALSE)&"|"&HLOOKUP(Sheet1!R2C1,Sheet1!R2C1:R16C1,MOD(RC1,2)+MOD(INT((RC1)/2),3)*5+1,FALSE)&"|"&HLOOKUP(Sheet1!R2C1,Sheet1!R2C1:R16C1,MOD(RC1+1,2)+MOD(INT((RC1+1)/2),3)*5+1,FALSE)&"|"&HLOOKUP(Sheet1!R2C1,Sheet1!R2C1:R16C1,MOD(RC1+2,2)+MOD(INT((RC1+2)/2),3)*5+1,FALSE)&"|"&HLOOKUP(Sheet1!R2C1,Sheet1!R2C1:R16C1,MOD(RC1+3,2)+MOD(INT((RC1+3)/2),3)*5+1,FALSE) -> 160|161|100|101|130 | H359: =HLOOKUP(Sheet1!R2C1,Sheet1!R2C1:R16C1,MOD(RC1+2,2)+MOD(INT((RC1+2)/2),3)*5+1,FALSE)&"|"&HLOOKUP(Sheet1!R2C1,Sheet1!R2C1:R16C1,MOD(RC1+3,2)+MOD(INT((RC1+3)/2),3)*5+1,FALSE)&"|"&HLOOKUP(Sheet1!R2C1,Sheet1!R2C1:R16C1,MOD(RC1+4,2)+MOD(INT((RC1+4)/2),3)*5+1,FALSE)&"|"&HLOOKUP(Sheet1!R2C1,Sheet1!R2C1:R16C1,MOD(RC1+5,2)+MOD(INT((RC1+5)/2),3)*5+1,FALSE)&"|"&HLOOKUP(Sheet1!R2C1,Sheet1!R2C1:R16C1,MOD(RC1+6,2)+MOD(INT((RC1+6)/2),3)*5+1,FALSE) -> 101|130|131|160|161 | I359: =HLOOKUP(Sheet1!R2C1,Sheet1!R2C1:R16C1,MOD(RC1-1,3)+MOD(INT((RC1-1)/3),3)*5+3,FALSE)&"|"&HLOOKUP(Sheet1!R2C1,Sheet1!R2C1:R16C1,MOD(RC1,3)+MOD(INT((RC1)/3),3)*5+3,FALSE)&"|"&HLOOKUP(Sheet1!R2C1,Sheet1!R2C1:R16C1,MOD(RC1+1,3)+MOD(INT((RC1+1)/3),3)*5+3,FALSE)&"|"&HLOOKUP(Sheet1!R2C1,Sheet1!R2C1:R16C1,MOD(RC1+2,3)+MOD(INT((RC1+2)/3),3)*5+3,FALSE)&"|"&HLOOKUP(Sheet1!R2C1,Sheet1!R2C1:R16C1,MOD(RC1+3,3)+MOD(INT((RC1+3)/3),3)*5+3,FALSE) -> 103|104|132|133|134 | J359: =HLOOKUP(Sheet1!R2C1,Sheet1!R2C1:R16C1,MOD(RC1-1,3)+MOD(INT((RC1-1)/3),3)*5+3,FALSE)&"|"&HLOOKUP(Sheet1!R2C1,Sheet1!R2C1:R16C1,MOD(RC1,3)+MOD(INT((RC1)/3),3)*5+3,FALSE)&"|"&HLOOKUP(Sheet1!R2C1,Sheet1!R2C1:R16C1,MOD(RC1+1,3)+MOD(INT((RC1+1)/3),3)*5+3,FALSE)&"|"&HLOOKUP(Sheet1!R2C1,Sheet1!R2C1:R16C1,MOD(RC1+2,3)+MOD(INT((RC1+2)/3),3)*5+3,FALSE)&"|"&HLOOKUP(Sheet1!R2C1,Sheet1!R2C1:R16C1,MOD(RC1+3,3)+MOD(INT((RC1+3)/3),3)*5+3,FALSE) -> 103|104|132|133|134 | K359: =HLOOKUP(Sheet1!R2C1,Sheet1!R2C1:R16C1,MOD(RC1-1,3)+MOD(INT((RC1-1)/3),3)*5+3,FALSE)&"|"&HLOOKUP(Sheet1!R2C1,Sheet1!R2C1:R16C1,MOD(RC1,3)+MOD(INT((RC1)/3),3)*5+3,FALSE)&"|"&HLOOKUP(Sheet1!R2C1,Sheet1!R2C1:R16C1,MOD(RC1+1,3)+MOD(INT((RC1+1)/3),3)*5+3,FALSE)&"|"&HLOOKUP(Sheet1!R2C1,Sheet1!R2C1:R16C1,MOD(RC1+2,3)+MOD(INT((RC1+2)/3),3)*5+3,FALSE)&"|"&HLOOKUP(Sheet1!R2C1,Sheet1!R2C1:R16C1,MOD(RC1+3,3)+MOD(INT((RC1+3)/3),3)*5+3,FALSE) -> 103|104|132|133|134 | L359: 25|22|23|24 | M359: 4350484|4350484|4350485|4350485 | N359: 10030|10031|10032|10033 | O359: 1|1|1|1 | P359: 2500|2500|2500|2500
A360: 354 | B360: 352 | C360: 30 | D360: =R[-20]C+2 -> 54 | E360: 1000 | F360: =MOD(RC[-5]-1,3)*30+100&"|"&MOD(RC[-5]-1,3)*30+101&"|"&MOD(RC[-5]-1,3)*30+102&"|"&MOD(RC[-5]-1,3)*30+103&"|"&IF(MOD(RC[-5],4)=0,HLOOKUP(Sheet1!R2C10,Sheet1!R2C10:R7C10,MOD(RC[-5]/4-1,6)+1,FALSE),IF(MOD(RC[-5],2)=0,IF(RC[-5]>20,HLOOKUP(Sheet1!R2C7,Sheet1!R2C7:R43C7,MOD(RC[-5]/2-1,42)+1,FALSE),HLOOKUP(Sheet1!R2C4,Sheet1!R2C4:R7C4,MOD(RC[-5]-1,6)+1,FALSE)),MOD(RC[-5]-1,3)*30+104)) -> 160|161|162|163|120 | G360: =HLOOKUP(Sheet1!R2C1,Sheet1!R2C1:R16C1,MOD(RC1-1,2)+MOD(INT((RC1-1)/2),3)*5+1,FALSE)&"|"&HLOOKUP(Sheet1!R2C1,Sheet1!R2C1:R16C1,MOD(RC1,2)+MOD(INT((RC1)/2),3)*5+1,FALSE)&"|"&HLOOKUP(Sheet1!R2C1,Sheet1!R2C1:R16C1,MOD(RC1+1,2)+MOD(INT((RC1+1)/2),3)*5+1,FALSE)&"|"&HLOOKUP(Sheet1!R2C1,Sheet1!R2C1:R16C1,MOD(RC1+2,2)+MOD(INT((RC1+2)/2),3)*5+1,FALSE)&"|"&HLOOKUP(Sheet1!R2C1,Sheet1!R2C1:R16C1,MOD(RC1+3,2)+MOD(INT((RC1+3)/2),3)*5+1,FALSE) -> 161|100|101|130|131 | H360: =HLOOKUP(Sheet1!R2C1,Sheet1!R2C1:R16C1,MOD(RC1+2,2)+MOD(INT((RC1+2)/2),3)*5+1,FALSE)&"|"&HLOOKUP(Sheet1!R2C1,Sheet1!R2C1:R16C1,MOD(RC1+3,2)+MOD(INT((RC1+3)/2),3)*5+1,FALSE)&"|"&HLOOKUP(Sheet1!R2C1,Sheet1!R2C1:R16C1,MOD(RC1+4,2)+MOD(INT((RC1+4)/2),3)*5+1,FALSE)&"|"&HLOOKUP(Sheet1!R2C1,Sheet1!R2C1:R16C1,MOD(RC1+5,2)+MOD(INT((RC1+5)/2),3)*5+1,FALSE)&"|"&HLOOKUP(Sheet1!R2C1,Sheet1!R2C1:R16C1,MOD(RC1+6,2)+MOD(INT((RC1+6)/2),3)*5+1,FALSE) -> 130|131|160|161|100 | I360: =HLOOKUP(Sheet1!R2C1,Sheet1!R2C1:R16C1,MOD(RC1-1,3)+MOD(INT((RC1-1)/3),3)*5+3,FALSE)&"|"&HLOOKUP(Sheet1!R2C1,Sheet1!R2C1:R16C1,MOD(RC1,3)+MOD(INT((RC1)/3),3)*5+3,FALSE)&"|"&HLOOKUP(Sheet1!R2C1,Sheet1!R2C1:R16C1,MOD(RC1+1,3)+MOD(INT((RC1+1)/3),3)*5+3,FALSE)&"|"&HLOOKUP(Sheet1!R2C1,Sheet1!R2C1:R16C1,MOD(RC1+2,3)+MOD(INT((RC1+2)/3),3)*5+3,FALSE)&"|"&HLOOKUP(Sheet1!R2C1,Sheet1!R2C1:R16C1,MOD(RC1+3,3)+MOD(INT((RC1+3)/3),3)*5+3,FALSE) -> 104|132|133|134|162 | J360: =HLOOKUP(Sheet1!R2C1,Sheet1!R2C1:R16C1,MOD(RC1-1,3)+MOD(INT((RC1-1)/3),3)*5+3,FALSE)&"|"&HLOOKUP(Sheet1!R2C1,Sheet1!R2C1:R16C1,MOD(RC1,3)+MOD(INT((RC1)/3),3)*5+3,FALSE)&"|"&HLOOKUP(Sheet1!R2C1,Sheet1!R2C1:R16C1,MOD(RC1+1,3)+MOD(INT((RC1+1)/3),3)*5+3,FALSE)&"|"&HLOOKUP(Sheet1!R2C1,Sheet1!R2C1:R16C1,MOD(RC1+2,3)+MOD(INT((RC1+2)/3),3)*5+3,FALSE)&"|"&HLOOKUP(Sheet1!R2C1,Sheet1!R2C1:R16C1,MOD(RC1+3,3)+MOD(INT((RC1+3)/3),3)*5+3,FALSE) -> 104|132|133|134|162 | K360: =HLOOKUP(Sheet1!R2C1,Sheet1!R2C1:R16C1,MOD(RC1-1,3)+MOD(INT((RC1-1)/3),3)*5+3,FALSE)&"|"&HLOOKUP(Sheet1!R2C1,Sheet1!R2C1:R16C1,MOD(RC1,3)+MOD(INT((RC1)/3),3)*5+3,FALSE)&"|"&HLOOKUP(Sheet1!R2C1,Sheet1!R2C1:R16C1,MOD(RC1+1,3)+MOD(INT((RC1+1)/3),3)*5+3,FALSE)&"|"&HLOOKUP(Sheet1!R2C1,Sheet1!R2C1:R16C1,MOD(RC1+2,3)+MOD(INT((RC1+2)/3),3)*5+3,FALSE)&"|"&HLOOKUP(Sheet1!R2C1,Sheet1!R2C1:R16C1,MOD(RC1+3,3)+MOD(INT((RC1+3)/3),3)*5+3,FALSE) -> 104|132|133|134|162 | L360: 25|22|23|24 | M360: 4389764|4389764|4389765|4389765 | N360: 10030|10031|10032|10033 | O360: 1|1|1|1 | P360: 2500|2500|2500|2500
A361: 355 | B361: 353 | C361: 30 | D361: =R[-20]C+2 -> 54 | E361: 1000 | F361: =MOD(RC[-5]-1,3)*30+100&"|"&MOD(RC[-5]-1,3)*30+101&"|"&MOD(RC[-5]-1,3)*30+102&"|"&MOD(RC[-5]-1,3)*30+103&"|"&IF(MOD(RC[-5],4)=0,HLOOKUP(Sheet1!R2C10,Sheet1!R2C10:R7C10,MOD(RC[-5]/4-1,6)+1,FALSE),IF(MOD(RC[-5],2)=0,IF(RC[-5]>20,HLOOKUP(Sheet1!R2C7,Sheet1!R2C7:R43C7,MOD(RC[-5]/2-1,42)+1,FALSE),HLOOKUP(Sheet1!R2C4,Sheet1!R2C4:R7C4,MOD(RC[-5]-1,6)+1,FALSE)),MOD(RC[-5]-1,3)*30+104)) -> 100|101|102|103|104 | G361: =HLOOKUP(Sheet1!R2C1,Sheet1!R2C1:R16C1,MOD(RC1-1,2)+MOD(INT((RC1-1)/2),3)*5+1,FALSE)&"|"&HLOOKUP(Sheet1!R2C1,Sheet1!R2C1:R16C1,MOD(RC1,2)+MOD(INT((RC1)/2),3)*5+1,FALSE)&"|"&HLOOKUP(Sheet1!R2C1,Sheet1!R2C1:R16C1,MOD(RC1+1,2)+MOD(INT((RC1+1)/2),3)*5+1,FALSE)&"|"&HLOOKUP(Sheet1!R2C1,Sheet1!R2C1:R16C1,MOD(RC1+2,2)+MOD(INT((RC1+2)/2),3)*5+1,FALSE)&"|"&HLOOKUP(Sheet1!R2C1,Sheet1!R2C1:R16C1,MOD(RC1+3,2)+MOD(INT((RC1+3)/2),3)*5+1,FALSE) -> 100|101|130|131|160 | H361: =HLOOKUP(Sheet1!R2C1,Sheet1!R2C1:R16C1,MOD(RC1+2,2)+MOD(INT((RC1+2)/2),3)*5+1,FALSE)&"|"&HLOOKUP(Sheet1!R2C1,Sheet1!R2C1:R16C1,MOD(RC1+3,2)+MOD(INT((RC1+3)/2),3)*5+1,FALSE)&"|"&HLOOKUP(Sheet1!R2C1,Sheet1!R2C1:R16C1,MOD(RC1+4,2)+MOD(INT((RC1+4)/2),3)*5+1,FALSE)&"|"&HLOOKUP(Sheet1!R2C1,Sheet1!R2C1:R16C1,MOD(RC1+5,2)+MOD(INT((RC1+5)/2),3)*5+1,FALSE)&"|"&HLOOKUP(Sheet1!R2C1,Sheet1!R2C1:R16C1,MOD(RC1+6,2)+MOD(INT((RC1+6)/2),3)*5+1,FALSE) -> 131|160|161|100|101 | I361: =HLOOKUP(Sheet1!R2C1,Sheet1!R2C1:R16C1,MOD(RC1-1,3)+MOD(INT((RC1-1)/3),3)*5+3,FALSE)&"|"&HLOOKUP(Sheet1!R2C1,Sheet1!R2C1:R16C1,MOD(RC1,3)+MOD(INT((RC1)/3),3)*5+3,FALSE)&"|"&HLOOKUP(Sheet1!R2C1,Sheet1!R2C1:R16C1,MOD(RC1+1,3)+MOD(INT((RC1+1)/3),3)*5+3,FALSE)&"|"&HLOOKUP(Sheet1!R2C1,Sheet1!R2C1:R16C1,MOD(RC1+2,3)+MOD(INT((RC1+2)/3),3)*5+3,FALSE)&"|"&HLOOKUP(Sheet1!R2C1,Sheet1!R2C1:R16C1,MOD(RC1+3,3)+MOD(INT((RC1+3)/3),3)*5+3,FALSE) -> 132|133|134|162|163 | J361: =HLOOKUP(Sheet1!R2C1,Sheet1!R2C1:R16C1,MOD(RC1-1,3)+MOD(INT((RC1-1)/3),3)*5+3,FALSE)&"|"&HLOOKUP(Sheet1!R2C1,Sheet1!R2C1:R16C1,MOD(RC1,3)+MOD(INT((RC1)/3),3)*5+3,FALSE)&"|"&HLOOKUP(Sheet1!R2C1,Sheet1!R2C1:R16C1,MOD(RC1+1,3)+MOD(INT((RC1+1)/3),3)*5+3,FALSE)&"|"&HLOOKUP(Sheet1!R2C1,Sheet1!R2C1:R16C1,MOD(RC1+2,3)+MOD(INT((RC1+2)/3),3)*5+3,FALSE)&"|"&HLOOKUP(Sheet1!R2C1,Sheet1!R2C1:R16C1,MOD(RC1+3,3)+MOD(INT((RC1+3)/3),3)*5+3,FALSE) -> 132|133|134|162|163 | K361: =HLOOKUP(Sheet1!R2C1,Sheet1!R2C1:R16C1,MOD(RC1-1,3)+MOD(INT((RC1-1)/3),3)*5+3,FALSE)&"|"&HLOOKUP(Sheet1!R2C1,Sheet1!R2C1:R16C1,MOD(RC1,3)+MOD(INT((RC1)/3),3)*5+3,FALSE)&"|"&HLOOKUP(Sheet1!R2C1,Sheet1!R2C1:R16C1,MOD(RC1+1,3)+MOD(INT((RC1+1)/3),3)*5+3,FALSE)&"|"&HLOOKUP(Sheet1!R2C1,Sheet1!R2C1:R16C1,MOD(RC1+2,3)+MOD(INT((RC1+2)/3),3)*5+3,FALSE)&"|"&HLOOKUP(Sheet1!R2C1,Sheet1!R2C1:R16C1,MOD(RC1+3,3)+MOD(INT((RC1+3)/3),3)*5+3,FALSE) -> 132|133|134|162|163 | L361: 25|22|23|24 | M361: 4427473|4427473|4427473|4427473 | N361: 10030|10031|10032|10033|10030|10031|10032|10033|10030|10031|10032|10033|10030|10031|10032|10033|10030|10031|10032|10033|10030|10031|10032|10033|10030|10031|10032|10033|10030|10031|10032|10033|10030|10031|10032|10033|10030|10031|10032|10033 | O361: 1|1|1|1|1|1|1|1|1|1|1|1|1|1|1|1|1|1|1|1|1|1|1|1|1|1|1|1|1|1|1|1|1|1|1|1|1|1|1|1 | P361: 2500|2500|2500|2500|2500|2500|2500|2500|2500|2500|2500|2500|2500|2500|2500|2500|2500|2500|2500|2500|2500|2500|2500|2500|2500|2500|2500|2500|2500|2500|2500|2500|2500|2500|2500|2500|2500|2500|2500|2500
A362: 356 | B362: 354 | C362: 30 | D362: =R[-20]C+2 -> 54 | E362: 1000 | F362: =MOD(RC[-5]-1,3)*30+100&"|"&MOD(RC[-5]-1,3)*30+101&"|"&MOD(RC[-5]-1,3)*30+102&"|"&MOD(RC[-5]-1,3)*30+103&"|"&IF(MOD(RC[-5],4)=0,HLOOKUP(Sheet1!R2C10,Sheet1!R2C10:R7C10,MOD(RC[-5]/4-1,6)+1,FALSE),IF(MOD(RC[-5],2)=0,IF(RC[-5]>20,HLOOKUP(Sheet1!R2C7,Sheet1!R2C7:R43C7,MOD(RC[-5]/2-1,42)+1,FALSE),HLOOKUP(Sheet1!R2C4,Sheet1!R2C4:R7C4,MOD(RC[-5]-1,6)+1,FALSE)),MOD(RC[-5]-1,3)*30+104)) -> 130|131|132|133|194 | G362: =HLOOKUP(Sheet1!R2C1,Sheet1!R2C1:R16C1,MOD(RC1-1,2)+MOD(INT((RC1-1)/2),3)*5+1,FALSE)&"|"&HLOOKUP(Sheet1!R2C1,Sheet1!R2C1:R16C1,MOD(RC1,2)+MOD(INT((RC1)/2),3)*5+1,FALSE)&"|"&HLOOKUP(Sheet1!R2C1,Sheet1!R2C1:R16C1,MOD(RC1+1,2)+MOD(INT((RC1+1)/2),3)*5+1,FALSE)&"|"&HLOOKUP(Sheet1!R2C1,Sheet1!R2C1:R16C1,MOD(RC1+2,2)+MOD(INT((RC1+2)/2),3)*5+1,FALSE)&"|"&HLOOKUP(Sheet1!R2C1,Sheet1!R2C1:R16C1,MOD(RC1+3,2)+MOD(INT((RC1+3)/2),3)*5+1,FALSE) -> 101|130|131|160|161 | H362: =HLOOKUP(Sheet1!R2C1,Sheet1!R2C1:R16C1,MOD(RC1+2,2)+MOD(INT((RC1+2)/2),3)*5+1,FALSE)&"|"&HLOOKUP(Sheet1!R2C1,Sheet1!R2C1:R16C1,MOD(RC1+3,2)+MOD(INT((RC1+3)/2),3)*5+1,FALSE)&"|"&HLOOKUP(Sheet1!R2C1,Sheet1!R2C1:R16C1,MOD(RC1+4,2)+MOD(INT((RC1+4)/2),3)*5+1,FALSE)&"|"&HLOOKUP(Sheet1!R2C1,Sheet1!R2C1:R16C1,MOD(RC1+5,2)+MOD(INT((RC1+5)/2),3)*5+1,FALSE)&"|"&HLOOKUP(Sheet1!R2C1,Sheet1!R2C1:R16C1,MOD(RC1+6,2)+MOD(INT((RC1+6)/2),3)*5+1,FALSE) -> 160|161|100|101|130 | I362: =HLOOKUP(Sheet1!R2C1,Sheet1!R2C1:R16C1,MOD(RC1-1,3)+MOD(INT((RC1-1)/3),3)*5+3,FALSE)&"|"&HLOOKUP(Sheet1!R2C1,Sheet1!R2C1:R16C1,MOD(RC1,3)+MOD(INT((RC1)/3),3)*5+3,FALSE)&"|"&HLOOKUP(Sheet1!R2C1,Sheet1!R2C1:R16C1,MOD(RC1+1,3)+MOD(INT((RC1+1)/3),3)*5+3,FALSE)&"|"&HLOOKUP(Sheet1!R2C1,Sheet1!R2C1:R16C1,MOD(RC1+2,3)+MOD(INT((RC1+2)/3),3)*5+3,FALSE)&"|"&HLOOKUP(Sheet1!R2C1,Sheet1!R2C1:R16C1,MOD(RC1+3,3)+MOD(INT((RC1+3)/3),3)*5+3,FALSE) -> 133|134|162|163|164 | J362: =HLOOKUP(Sheet1!R2C1,Sheet1!R2C1:R16C1,MOD(RC1-1,3)+MOD(INT((RC1-1)/3),3)*5+3,FALSE)&"|"&HLOOKUP(Sheet1!R2C1,Sheet1!R2C1:R16C1,MOD(RC1,3)+MOD(INT((RC1)/3),3)*5+3,FALSE)&"|"&HLOOKUP(Sheet1!R2C1,Sheet1!R2C1:R16C1,MOD(RC1+1,3)+MOD(INT((RC1+1)/3),3)*5+3,FALSE)&"|"&HLOOKUP(Sheet1!R2C1,Sheet1!R2C1:R16C1,MOD(RC1+2,3)+MOD(INT((RC1+2)/3),3)*5+3,FALSE)&"|"&HLOOKUP(Sheet1!R2C1,Sheet1!R2C1:R16C1,MOD(RC1+3,3)+MOD(INT((RC1+3)/3),3)*5+3,FALSE) -> 133|134|162|163|164 | K362: =HLOOKUP(Sheet1!R2C1,Sheet1!R2C1:R16C1,MOD(RC1-1,3)+MOD(INT((RC1-1)/3),3)*5+3,FALSE)&"|"&HLOOKUP(Sheet1!R2C1,Sheet1!R2C1:R16C1,MOD(RC1,3)+MOD(INT((RC1)/3),3)*5+3,FALSE)&"|"&HLOOKUP(Sheet1!R2C1,Sheet1!R2C1:R16C1,MOD(RC1+1,3)+MOD(INT((RC1+1)/3),3)*5+3,FALSE)&"|"&HLOOKUP(Sheet1!R2C1,Sheet1!R2C1:R16C1,MOD(RC1+2,3)+MOD(INT((RC1+2)/3),3)*5+3,FALSE)&"|"&HLOOKUP(Sheet1!R2C1,Sheet1!R2C1:R16C1,MOD(RC1+3,3)+MOD(INT((RC1+3)/3),3)*5+3,FALSE) -> 133|134|162|163|164 | L362: 25|22|23|24 | M362: 4466753|4466753|4466753|4466753 | N362: 10030|10031|10032|10033 | O362: 1|1|1|1 | P362: 2500|2500|2500|2500
A363: 357 | B363: 355 | C363: 30 | D363: =R[-20]C+2 -> 54 | E363: 1000 | F363: =MOD(RC[-5]-1,3)*30+100&"|"&MOD(RC[-5]-1,3)*30+101&"|"&MOD(RC[-5]-1,3)*30+102&"|"&MOD(RC[-5]-1,3)*30+103&"|"&IF(MOD(RC[-5],4)=0,HLOOKUP(Sheet1!R2C10,Sheet1!R2C10:R7C10,MOD(RC[-5]/4-1,6)+1,FALSE),IF(MOD(RC[-5],2)=0,IF(RC[-5]>20,HLOOKUP(Sheet1!R2C7,Sheet1!R2C7:R43C7,MOD(RC[-5]/2-1,42)+1,FALSE),HLOOKUP(Sheet1!R2C4,Sheet1!R2C4:R7C4,MOD(RC[-5]-1,6)+1,FALSE)),MOD(RC[-5]-1,3)*30+104)) -> 160|161|162|163|164 | G363: =HLOOKUP(Sheet1!R2C1,Sheet1!R2C1:R16C1,MOD(RC1-1,2)+MOD(INT((RC1-1)/2),3)*5+1,FALSE)&"|"&HLOOKUP(Sheet1!R2C1,Sheet1!R2C1:R16C1,MOD(RC1,2)+MOD(INT((RC1)/2),3)*5+1,FALSE)&"|"&HLOOKUP(Sheet1!R2C1,Sheet1!R2C1:R16C1,MOD(RC1+1,2)+MOD(INT((RC1+1)/2),3)*5+1,FALSE)&"|"&HLOOKUP(Sheet1!R2C1,Sheet1!R2C1:R16C1,MOD(RC1+2,2)+MOD(INT((RC1+2)/2),3)*5+1,FALSE)&"|"&HLOOKUP(Sheet1!R2C1,Sheet1!R2C1:R16C1,MOD(RC1+3,2)+MOD(INT((RC1+3)/2),3)*5+1,FALSE) -> 130|131|160|161|100 | H363: =HLOOKUP(Sheet1!R2C1,Sheet1!R2C1:R16C1,MOD(RC1+2,2)+MOD(INT((RC1+2)/2),3)*5+1,FALSE)&"|"&HLOOKUP(Sheet1!R2C1,Sheet1!R2C1:R16C1,MOD(RC1+3,2)+MOD(INT((RC1+3)/2),3)*5+1,FALSE)&"|"&HLOOKUP(Sheet1!R2C1,Sheet1!R2C1:R16C1,MOD(RC1+4,2)+MOD(INT((RC1+4)/2),3)*5+1,FALSE)&"|"&HLOOKUP(Sheet1!R2C1,Sheet1!R2C1:R16C1,MOD(RC1+5,2)+MOD(INT((RC1+5)/2),3)*5+1,FALSE)&"|"&HLOOKUP(Sheet1!R2C1,Sheet1!R2C1:R16C1,MOD(RC1+6,2)+MOD(INT((RC1+6)/2),3)*5+1,FALSE) -> 161|100|101|130|131 | I363: =HLOOKUP(Sheet1!R2C1,Sheet1!R2C1:R16C1,MOD(RC1-1,3)+MOD(INT((RC1-1)/3),3)*5+3,FALSE)&"|"&HLOOKUP(Sheet1!R2C1,Sheet1!R2C1:R16C1,MOD(RC1,3)+MOD(INT((RC1)/3),3)*5+3,FALSE)&"|"&HLOOKUP(Sheet1!R2C1,Sheet1!R2C1:R16C1,MOD(RC1+1,3)+MOD(INT((RC1+1)/3),3)*5+3,FALSE)&"|"&HLOOKUP(Sheet1!R2C1,Sheet1!R2C1:R16C1,MOD(RC1+2,3)+MOD(INT((RC1+2)/3),3)*5+3,FALSE)&"|"&HLOOKUP(Sheet1!R2C1,Sheet1!R2C1:R16C1,MOD(RC1+3,3)+MOD(INT((RC1+3)/3),3)*5+3,FALSE) -> 134|162|163|164|102 | J363: =HLOOKUP(Sheet1!R2C1,Sheet1!R2C1:R16C1,MOD(RC1-1,3)+MOD(INT((RC1-1)/3),3)*5+3,FALSE)&"|"&HLOOKUP(Sheet1!R2C1,Sheet1!R2C1:R16C1,MOD(RC1,3)+MOD(INT((RC1)/3),3)*5+3,FALSE)&"|"&HLOOKUP(Sheet1!R2C1,Sheet1!R2C1:R16C1,MOD(RC1+1,3)+MOD(INT((RC1+1)/3),3)*5+3,FALSE)&"|"&HLOOKUP(Sheet1!R2C1,Sheet1!R2C1:R16C1,MOD(RC1+2,3)+MOD(INT((RC1+2)/3),3)*5+3,FALSE)&"|"&HLOOKUP(Sheet1!R2C1,Sheet1!R2C1:R16C1,MOD(RC1+3,3)+MOD(INT((RC1+3)/3),3)*5+3,FALSE) -> 134|162|163|164|102 | K363: =HLOOKUP(Sheet1!R2C1,Sheet1!R2C1:R16C1,MOD(RC1-1,3)+MOD(INT((RC1-1)/3),3)*5+3,FALSE)&"|"&HLOOKUP(Sheet1!R2C1,Sheet1!R2C1:R16C1,MOD(RC1,3)+MOD(INT((RC1)/3),3)*5+3,FALSE)&"|"&HLOOKUP(Sheet1!R2C1,Sheet1!R2C1:R16C1,MOD(RC1+1,3)+MOD(INT((RC1+1)/3),3)*5+3,FALSE)&"|"&HLOOKUP(Sheet1!R2C1,Sheet1!R2C1:R16C1,MOD(RC1+2,3)+MOD(INT((RC1+2)/3),3)*5+3,FALSE)&"|"&HLOOKUP(Sheet1!R2C1,Sheet1!R2C1:R16C1,MOD(RC1+3,3)+MOD(INT((RC1+3)/3),3)*5+3,FALSE) -> 134|162|163|164|102 | L363: 25|22|23|24 | M363: 4507155|4507155|4507155|4507155 | N363: 10030|10031|10032|10033 | O363: 1|1|1|1 | P363: 2500|2500|2500|2500
A364: 358 | B364: 356 | C364: 30 | D364: =R[-20]C+2 -> 54 | E364: 1000 | F364: =MOD(RC[-5]-1,3)*30+100&"|"&MOD(RC[-5]-1,3)*30+101&"|"&MOD(RC[-5]-1,3)*30+102&"|"&MOD(RC[-5]-1,3)*30+103&"|"&IF(MOD(RC[-5],4)=0,HLOOKUP(Sheet1!R2C10,Sheet1!R2C10:R7C10,MOD(RC[-5]/4-1,6)+1,FALSE),IF(MOD(RC[-5],2)=0,IF(RC[-5]>20,HLOOKUP(Sheet1!R2C7,Sheet1!R2C7:R43C7,MOD(RC[-5]/2-1,42)+1,FALSE),HLOOKUP(Sheet1!R2C4,Sheet1!R2C4:R7C4,MOD(RC[-5]-1,6)+1,FALSE)),MOD(RC[-5]-1,3)*30+104)) -> 100|101|102|103|122 | G364: =HLOOKUP(Sheet1!R2C1,Sheet1!R2C1:R16C1,MOD(RC1-1,2)+MOD(INT((RC1-1)/2),3)*5+1,FALSE)&"|"&HLOOKUP(Sheet1!R2C1,Sheet1!R2C1:R16C1,MOD(RC1,2)+MOD(INT((RC1)/2),3)*5+1,FALSE)&"|"&HLOOKUP(Sheet1!R2C1,Sheet1!R2C1:R16C1,MOD(RC1+1,2)+MOD(INT((RC1+1)/2),3)*5+1,FALSE)&"|"&HLOOKUP(Sheet1!R2C1,Sheet1!R2C1:R16C1,MOD(RC1+2,2)+MOD(INT((RC1+2)/2),3)*5+1,FALSE)&"|"&HLOOKUP(Sheet1!R2C1,Sheet1!R2C1:R16C1,MOD(RC1+3,2)+MOD(INT((RC1+3)/2),3)*5+1,FALSE) -> 131|160|161|100|101 | H364: =HLOOKUP(Sheet1!R2C1,Sheet1!R2C1:R16C1,MOD(RC1+2,2)+MOD(INT((RC1+2)/2),3)*5+1,FALSE)&"|"&HLOOKUP(Sheet1!R2C1,Sheet1!R2C1:R16C1,MOD(RC1+3,2)+MOD(INT((RC1+3)/2),3)*5+1,FALSE)&"|"&HLOOKUP(Sheet1!R2C1,Sheet1!R2C1:R16C1,MOD(RC1+4,2)+MOD(INT((RC1+4)/2),3)*5+1,FALSE)&"|"&HLOOKUP(Sheet1!R2C1,Sheet1!R2C1:R16C1,MOD(RC1+5,2)+MOD(INT((RC1+5)/2),3)*5+1,FALSE)&"|"&HLOOKUP(Sheet1!R2C1,Sheet1!R2C1:R16C1,MOD(RC1+6,2)+MOD(INT((RC1+6)/2),3)*5+1,FALSE) -> 100|101|130|131|160 | I364: =HLOOKUP(Sheet1!R2C1,Sheet1!R2C1:R16C1,MOD(RC1-1,3)+MOD(INT((RC1-1)/3),3)*5+3,FALSE)&"|"&HLOOKUP(Sheet1!R2C1,Sheet1!R2C1:R16C1,MOD(RC1,3)+MOD(INT((RC1)/3),3)*5+3,FALSE)&"|"&HLOOKUP(Sheet1!R2C1,Sheet1!R2C1:R16C1,MOD(RC1+1,3)+MOD(INT((RC1+1)/3),3)*5+3,FALSE)&"|"&HLOOKUP(Sheet1!R2C1,Sheet1!R2C1:R16C1,MOD(RC1+2,3)+MOD(INT((RC1+2)/3),3)*5+3,FALSE)&"|"&HLOOKUP(Sheet1!R2C1,Sheet1!R2C1:R16C1,MOD(RC1+3,3)+MOD(INT((RC1+3)/3),3)*5+3,FALSE) -> 162|163|164|102|103 | J364: =HLOOKUP(Sheet1!R2C1,Sheet1!R2C1:R16C1,MOD(RC1-1,3)+MOD(INT((RC1-1)/3),3)*5+3,FALSE)&"|"&HLOOKUP(Sheet1!R2C1,Sheet1!R2C1:R16C1,MOD(RC1,3)+MOD(INT((RC1)/3),3)*5+3,FALSE)&"|"&HLOOKUP(Sheet1!R2C1,Sheet1!R2C1:R16C1,MOD(RC1+1,3)+MOD(INT((RC1+1)/3),3)*5+3,FALSE)&"|"&HLOOKUP(Sheet1!R2C1,Sheet1!R2C1:R16C1,MOD(RC1+2,3)+MOD(INT((RC1+2)/3),3)*5+3,FALSE)&"|"&HLOOKUP(Sheet1!R2C1,Sheet1!R2C1:R16C1,MOD(RC1+3,3)+MOD(INT((RC1+3)/3),3)*5+3,FALSE) -> 162|163|164|102|103 | K364: =HLOOKUP(Sheet1!R2C1,Sheet1!R2C1:R16C1,MOD(RC1-1,3)+MOD(INT((RC1-1)/3),3)*5+3,FALSE)&"|"&HLOOKUP(Sheet1!R2C1,Sheet1!R2C1:R16C1,MOD(RC1,3)+MOD(INT((RC1)/3),3)*5+3,FALSE)&"|"&HLOOKUP(Sheet1!R2C1,Sheet1!R2C1:R16C1,MOD(RC1+1,3)+MOD(INT((RC1+1)/3),3)*5+3,FALSE)&"|"&HLOOKUP(Sheet1!R2C1,Sheet1!R2C1:R16C1,MOD(RC1+2,3)+MOD(INT((RC1+2)/3),3)*5+3,FALSE)&"|"&HLOOKUP(Sheet1!R2C1,Sheet1!R2C1:R16C1,MOD(RC1+3,3)+MOD(INT((RC1+3)/3),3)*5+3,FALSE) -> 162|163|164|102|103 | L364: 25|22|23|24 | M364: 4546281|4546281|4546280|4546280 | N364: 10030|10031|10032|10033 | O364: 1|1|1|1 | P364: 2500|2500|2500|2500
A365: 359 | B365: 357 | C365: 30 | D365: =R[-20]C+2 -> 54 | E365: 1000 | F365: =MOD(RC[-5]-1,3)*30+100&"|"&MOD(RC[-5]-1,3)*30+101&"|"&MOD(RC[-5]-1,3)*30+102&"|"&MOD(RC[-5]-1,3)*30+103&"|"&IF(MOD(RC[-5],4)=0,HLOOKUP(Sheet1!R2C10,Sheet1!R2C10:R7C10,MOD(RC[-5]/4-1,6)+1,FALSE),IF(MOD(RC[-5],2)=0,IF(RC[-5]>20,HLOOKUP(Sheet1!R2C7,Sheet1!R2C7:R43C7,MOD(RC[-5]/2-1,42)+1,FALSE),HLOOKUP(Sheet1!R2C4,Sheet1!R2C4:R7C4,MOD(RC[-5]-1,6)+1,FALSE)),MOD(RC[-5]-1,3)*30+104)) -> 130|131|132|133|134 | G365: =HLOOKUP(Sheet1!R2C1,Sheet1!R2C1:R16C1,MOD(RC1-1,2)+MOD(INT((RC1-1)/2),3)*5+1,FALSE)&"|"&HLOOKUP(Sheet1!R2C1,Sheet1!R2C1:R16C1,MOD(RC1,2)+MOD(INT((RC1)/2),3)*5+1,FALSE)&"|"&HLOOKUP(Sheet1!R2C1,Sheet1!R2C1:R16C1,MOD(RC1+1,2)+MOD(INT((RC1+1)/2),3)*5+1,FALSE)&"|"&HLOOKUP(Sheet1!R2C1,Sheet1!R2C1:R16C1,MOD(RC1+2,2)+MOD(INT((RC1+2)/2),3)*5+1,FALSE)&"|"&HLOOKUP(Sheet1!R2C1,Sheet1!R2C1:R16C1,MOD(RC1+3,2)+MOD(INT((RC1+3)/2),3)*5+1,FALSE) -> 160|161|100|101|130 | H365: =HLOOKUP(Sheet1!R2C1,Sheet1!R2C1:R16C1,MOD(RC1+2,2)+MOD(INT((RC1+2)/2),3)*5+1,FALSE)&"|"&HLOOKUP(Sheet1!R2C1,Sheet1!R2C1:R16C1,MOD(RC1+3,2)+MOD(INT((RC1+3)/2),3)*5+1,FALSE)&"|"&HLOOKUP(Sheet1!R2C1,Sheet1!R2C1:R16C1,MOD(RC1+4,2)+MOD(INT((RC1+4)/2),3)*5+1,FALSE)&"|"&HLOOKUP(Sheet1!R2C1,Sheet1!R2C1:R16C1,MOD(RC1+5,2)+MOD(INT((RC1+5)/2),3)*5+1,FALSE)&"|"&HLOOKUP(Sheet1!R2C1,Sheet1!R2C1:R16C1,MOD(RC1+6,2)+MOD(INT((RC1+6)/2),3)*5+1,FALSE) -> 101|130|131|160|161 | I365: =HLOOKUP(Sheet1!R2C1,Sheet1!R2C1:R16C1,MOD(RC1-1,3)+MOD(INT((RC1-1)/3),3)*5+3,FALSE)&"|"&HLOOKUP(Sheet1!R2C1,Sheet1!R2C1:R16C1,MOD(RC1,3)+MOD(INT((RC1)/3),3)*5+3,FALSE)&"|"&HLOOKUP(Sheet1!R2C1,Sheet1!R2C1:R16C1,MOD(RC1+1,3)+MOD(INT((RC1+1)/3),3)*5+3,FALSE)&"|"&HLOOKUP(Sheet1!R2C1,Sheet1!R2C1:R16C1,MOD(RC1+2,3)+MOD(INT((RC1+2)/3),3)*5+3,FALSE)&"|"&HLOOKUP(Sheet1!R2C1,Sheet1!R2C1:R16C1,MOD(RC1+3,3)+MOD(INT((RC1+3)/3),3)*5+3,FALSE) -> 163|164|102|103|104 | J365: =HLOOKUP(Sheet1!R2C1,Sheet1!R2C1:R16C1,MOD(RC1-1,3)+MOD(INT((RC1-1)/3),3)*5+3,FALSE)&"|"&HLOOKUP(Sheet1!R2C1,Sheet1!R2C1:R16C1,MOD(RC1,3)+MOD(INT((RC1)/3),3)*5+3,FALSE)&"|"&HLOOKUP(Sheet1!R2C1,Sheet1!R2C1:R16C1,MOD(RC1+1,3)+MOD(INT((RC1+1)/3),3)*5+3,FALSE)&"|"&HLOOKUP(Sheet1!R2C1,Sheet1!R2C1:R16C1,MOD(RC1+2,3)+MOD(INT((RC1+2)/3),3)*5+3,FALSE)&"|"&HLOOKUP(Sheet1!R2C1,Sheet1!R2C1:R16C1,MOD(RC1+3,3)+MOD(INT((RC1+3)/3),3)*5+3,FALSE) -> 163|164|102|103|104 | K365: =HLOOKUP(Sheet1!R2C1,Sheet1!R2C1:R16C1,MOD(RC1-1,3)+MOD(INT((RC1-1)/3),3)*5+3,FALSE)&"|"&HLOOKUP(Sheet1!R2C1,Sheet1!R2C1:R16C1,MOD(RC1,3)+MOD(INT((RC1)/3),3)*5+3,FALSE)&"|"&HLOOKUP(Sheet1!R2C1,Sheet1!R2C1:R16C1,MOD(RC1+1,3)+MOD(INT((RC1+1)/3),3)*5+3,FALSE)&"|"&HLOOKUP(Sheet1!R2C1,Sheet1!R2C1:R16C1,MOD(RC1+2,3)+MOD(INT((RC1+2)/3),3)*5+3,FALSE)&"|"&HLOOKUP(Sheet1!R2C1,Sheet1!R2C1:R16C1,MOD(RC1+3,3)+MOD(INT((RC1+3)/3),3)*5+3,FALSE) -> 163|164|102|103|104 | L365: 25|22|23|24 | M365: 4587037|4587038|4587038|4587038 | N365: 10030|10031|10032|10033 | O365: 1|1|1|1 | P365: 2500|2500|2500|2500
A366: 360 | B366: 358 | C366: 30 | D366: =R[-20]C+2 -> 54 | E366: 1000 | F366: =MOD(RC[-5]-1,3)*30+100&"|"&MOD(RC[-5]-1,3)*30+101&"|"&MOD(RC[-5]-1,3)*30+102&"|"&MOD(RC[-5]-1,3)*30+103&"|"&IF(MOD(RC[-5],4)=0,HLOOKUP(Sheet1!R2C10,Sheet1!R2C10:R7C10,MOD(RC[-5]/4-1,6)+1,FALSE),IF(MOD(RC[-5],2)=0,IF(RC[-5]>20,HLOOKUP(Sheet1!R2C7,Sheet1!R2C7:R43C7,MOD(RC[-5]/2-1,42)+1,FALSE),HLOOKUP(Sheet1!R2C4,Sheet1!R2C4:R7C4,MOD(RC[-5]-1,6)+1,FALSE)),MOD(RC[-5]-1,3)*30+104)) -> 160|161|162|163|195 | G366: =HLOOKUP(Sheet1!R2C1,Sheet1!R2C1:R16C1,MOD(RC1-1,2)+MOD(INT((RC1-1)/2),3)*5+1,FALSE)&"|"&HLOOKUP(Sheet1!R2C1,Sheet1!R2C1:R16C1,MOD(RC1,2)+MOD(INT((RC1)/2),3)*5+1,FALSE)&"|"&HLOOKUP(Sheet1!R2C1,Sheet1!R2C1:R16C1,MOD(RC1+1,2)+MOD(INT((RC1+1)/2),3)*5+1,FALSE)&"|"&HLOOKUP(Sheet1!R2C1,Sheet1!R2C1:R16C1,MOD(RC1+2,2)+MOD(INT((RC1+2)/2),3)*5+1,FALSE)&"|"&HLOOKUP(Sheet1!R2C1,Sheet1!R2C1:R16C1,MOD(RC1+3,2)+MOD(INT((RC1+3)/2),3)*5+1,FALSE) -> 161|100|101|130|131 | H366: =HLOOKUP(Sheet1!R2C1,Sheet1!R2C1:R16C1,MOD(RC1+2,2)+MOD(INT((RC1+2)/2),3)*5+1,FALSE)&"|"&HLOOKUP(Sheet1!R2C1,Sheet1!R2C1:R16C1,MOD(RC1+3,2)+MOD(INT((RC1+3)/2),3)*5+1,FALSE)&"|"&HLOOKUP(Sheet1!R2C1,Sheet1!R2C1:R16C1,MOD(RC1+4,2)+MOD(INT((RC1+4)/2),3)*5+1,FALSE)&"|"&HLOOKUP(Sheet1!R2C1,Sheet1!R2C1:R16C1,MOD(RC1+5,2)+MOD(INT((RC1+5)/2),3)*5+1,FALSE)&"|"&HLOOKUP(Sheet1!R2C1,Sheet1!R2C1:R16C1,MOD(RC1+6,2)+MOD(INT((RC1+6)/2),3)*5+1,FALSE) -> 130|131|160|161|100 | I366: =HLOOKUP(Sheet1!R2C1,Sheet1!R2C1:R16C1,MOD(RC1-1,3)+MOD(INT((RC1-1)/3),3)*5+3,FALSE)&"|"&HLOOKUP(Sheet1!R2C1,Sheet1!R2C1:R16C1,MOD(RC1,3)+MOD(INT((RC1)/3),3)*5+3,FALSE)&"|"&HLOOKUP(Sheet1!R2C1,Sheet1!R2C1:R16C1,MOD(RC1+1,3)+MOD(INT((RC1+1)/3),3)*5+3,FALSE)&"|"&HLOOKUP(Sheet1!R2C1,Sheet1!R2C1:R16C1,MOD(RC1+2,3)+MOD(INT((RC1+2)/3),3)*5+3,FALSE)&"|"&HLOOKUP(Sheet1!R2C1,Sheet1!R2C1:R16C1,MOD(RC1+3,3)+MOD(INT((RC1+3)/3),3)*5+3,FALSE) -> 164|102|103|104|132 | J366: =HLOOKUP(Sheet1!R2C1,Sheet1!R2C1:R16C1,MOD(RC1-1,3)+MOD(INT((RC1-1)/3),3)*5+3,FALSE)&"|"&HLOOKUP(Sheet1!R2C1,Sheet1!R2C1:R16C1,MOD(RC1,3)+MOD(INT((RC1)/3),3)*5+3,FALSE)&"|"&HLOOKUP(Sheet1!R2C1,Sheet1!R2C1:R16C1,MOD(RC1+1,3)+MOD(INT((RC1+1)/3),3)*5+3,FALSE)&"|"&HLOOKUP(Sheet1!R2C1,Sheet1!R2C1:R16C1,MOD(RC1+2,3)+MOD(INT((RC1+2)/3),3)*5+3,FALSE)&"|"&HLOOKUP(Sheet1!R2C1,Sheet1!R2C1:R16C1,MOD(RC1+3,3)+MOD(INT((RC1+3)/3),3)*5+3,FALSE) -> 164|102|103|104|132 | K366: =HLOOKUP(Sheet1!R2C1,Sheet1!R2C1:R16C1,MOD(RC1-1,3)+MOD(INT((RC1-1)/3),3)*5+3,FALSE)&"|"&HLOOKUP(Sheet1!R2C1,Sheet1!R2C1:R16C1,MOD(RC1,3)+MOD(INT((RC1)/3),3)*5+3,FALSE)&"|"&HLOOKUP(Sheet1!R2C1,Sheet1!R2C1:R16C1,MOD(RC1+1,3)+MOD(INT((RC1+1)/3),3)*5+3,FALSE)&"|"&HLOOKUP(Sheet1!R2C1,Sheet1!R2C1:R16C1,MOD(RC1+2,3)+MOD(INT((RC1+2)/3),3)*5+3,FALSE)&"|"&HLOOKUP(Sheet1!R2C1,Sheet1!R2C1:R16C1,MOD(RC1+3,3)+MOD(INT((RC1+3)/3),3)*5+3,FALSE) -> 164|102|103|104|132 | L366: 25|22|23|24 | M366: 4627794|4627794|4627793|4627793 | N366: 10030|10031|10032|10033|10030|10031|10032|10033|10030|10031|10032|10033|10030|10031|10032|10033|10030|10031|10032|10033|10030|10031|10032|10033|10030|10031|10032|10033|10030|10031|10032|10033|10030|10031|10032|10033|10030|10031|10032|10033 | O366: 1|1|1|1|1|1|1|1|1|1|1|1|1|1|1|1|1|1|1|1|1|1|1|1|1|1|1|1|1|1|1|1|1|1|1|1|1|1|1|1 | P366: 2500|2500|2500|2500|2500|2500|2500|2500|2500|2500|2500|2500|2500|2500|2500|2500|2500|2500|2500|2500|2500|2500|2500|2500|2500|2500|2500|2500|2500|2500|2500|2500|2500|2500|2500|2500|2500|2500|2500|2500
A367: 361 | B367: 359 | C367: 30 | D367: =R[-20]C+2 -> 56 | E367: 1000 | F367: =MOD(RC[-5]-1,3)*30+100&"|"&MOD(RC[-5]-1,3)*30+101&"|"&MOD(RC[-5]-1,3)*30+102&"|"&MOD(RC[-5]-1,3)*30+103&"|"&IF(MOD(RC[-5],4)=0,HLOOKUP(Sheet1!R2C10,Sheet1!R2C10:R7C10,MOD(RC[-5]/4-1,6)+1,FALSE),IF(MOD(RC[-5],2)=0,IF(RC[-5]>20,HLOOKUP(Sheet1!R2C7,Sheet1!R2C7:R43C7,MOD(RC[-5]/2-1,42)+1,FALSE),HLOOKUP(Sheet1!R2C4,Sheet1!R2C4:R7C4,MOD(RC[-5]-1,6)+1,FALSE)),MOD(RC[-5]-1,3)*30+104)) -> 100|101|102|103|104 | G367: =HLOOKUP(Sheet1!R2C1,Sheet1!R2C1:R16C1,MOD(RC1-1,2)+MOD(INT((RC1-1)/2),3)*5+1,FALSE)&"|"&HLOOKUP(Sheet1!R2C1,Sheet1!R2C1:R16C1,MOD(RC1,2)+MOD(INT((RC1)/2),3)*5+1,FALSE)&"|"&HLOOKUP(Sheet1!R2C1,Sheet1!R2C1:R16C1,MOD(RC1+1,2)+MOD(INT((RC1+1)/2),3)*5+1,FALSE)&"|"&HLOOKUP(Sheet1!R2C1,Sheet1!R2C1:R16C1,MOD(RC1+2,2)+MOD(INT((RC1+2)/2),3)*5+1,FALSE)&"|"&HLOOKUP(Sheet1!R2C1,Sheet1!R2C1:R16C1,MOD(RC1+3,2)+MOD(INT((RC1+3)/2),3)*5+1,FALSE) -> 100|101|130|131|160 | H367: =HLOOKUP(Sheet1!R2C1,Sheet1!R2C1:R16C1,MOD(RC1+2,2)+MOD(INT((RC1+2)/2),3)*5+1,FALSE)&"|"&HLOOKUP(Sheet1!R2C1,Sheet1!R2C1:R16C1,MOD(RC1+3,2)+MOD(INT((RC1+3)/2),3)*5+1,FALSE)&"|"&HLOOKUP(Sheet1!R2C1,Sheet1!R2C1:R16C1,MOD(RC1+4,2)+MOD(INT((RC1+4)/2),3)*5+1,FALSE)&"|"&HLOOKUP(Sheet1!R2C1,Sheet1!R2C1:R16C1,MOD(RC1+5,2)+MOD(INT((RC1+5)/2),3)*5+1,FALSE)&"|"&HLOOKUP(Sheet1!R2C1,Sheet1!R2C1:R16C1,MOD(RC1+6,2)+MOD(INT((RC1+6)/2),3)*5+1,FALSE) -> 131|160|161|100|101 | I367: =HLOOKUP(Sheet1!R2C1,Sheet1!R2C1:R16C1,MOD(RC1-1,3)+MOD(INT((RC1-1)/3),3)*5+3,FALSE)&"|"&HLOOKUP(Sheet1!R2C1,Sheet1!R2C1:R16C1,MOD(RC1,3)+MOD(INT((RC1)/3),3)*5+3,FALSE)&"|"&HLOOKUP(Sheet1!R2C1,Sheet1!R2C1:R16C1,MOD(RC1+1,3)+MOD(INT((RC1+1)/3),3)*5+3,FALSE)&"|"&HLOOKUP(Sheet1!R2C1,Sheet1!R2C1:R16C1,MOD(RC1+2,3)+MOD(INT((RC1+2)/3),3)*5+3,FALSE)&"|"&HLOOKUP(Sheet1!R2C1,Sheet1!R2C1:R16C1,MOD(RC1+3,3)+MOD(INT((RC1+3)/3),3)*5+3,FALSE) -> 102|103|104|132|133 | J367: =HLOOKUP(Sheet1!R2C1,Sheet1!R2C1:R16C1,MOD(RC1-1,3)+MOD(INT((RC1-1)/3),3)*5+3,FALSE)&"|"&HLOOKUP(Sheet1!R2C1,Sheet1!R2C1:R16C1,MOD(RC1,3)+MOD(INT((RC1)/3),3)*5+3,FALSE)&"|"&HLOOKUP(Sheet1!R2C1,Sheet1!R2C1:R16C1,MOD(RC1+1,3)+MOD(INT((RC1+1)/3),3)*5+3,FALSE)&"|"&HLOOKUP(Sheet1!R2C1,Sheet1!R2C1:R16C1,MOD(RC1+2,3)+MOD(INT((RC1+2)/3),3)*5+3,FALSE)&"|"&HLOOKUP(Sheet1!R2C1,Sheet1!R2C1:R16C1,MOD(RC1+3,3)+MOD(INT((RC1+3)/3),3)*5+3,FALSE) -> 102|103|104|132|133 | K367: =HLOOKUP(Sheet1!R2C1,Sheet1!R2C1:R16C1,MOD(RC1-1,3)+MOD(INT((RC1-1)/3),3)*5+3,FALSE)&"|"&HLOOKUP(Sheet1!R2C1,Sheet1!R2C1:R16C1,MOD(RC1,3)+MOD(INT((RC1)/3),3)*5+3,FALSE)&"|"&HLOOKUP(Sheet1!R2C1,Sheet1!R2C1:R16C1,MOD(RC1+1,3)+MOD(INT((RC1+1)/3),3)*5+3,FALSE)&"|"&HLOOKUP(Sheet1!R2C1,Sheet1!R2C1:R16C1,MOD(RC1+2,3)+MOD(INT((RC1+2)/3),3)*5+3,FALSE)&"|"&HLOOKUP(Sheet1!R2C1,Sheet1!R2C1:R16C1,MOD(RC1+3,3)+MOD(INT((RC1+3)/3),3)*5+3,FALSE) -> 102|103|104|132|133 | L367: 25|22|23|24 | M367: 4667959|4667959|4667960|4667960 | N367: 10030|10031|10032|10033 | O367: 1|1|1|1 | P367: 2500|2500|2500|2500
A368: 362 | B368: 360 | C368: 30 | D368: =R[-20]C+2 -> 56 | E368: 1000 | F368: =MOD(RC[-5]-1,3)*30+100&"|"&MOD(RC[-5]-1,3)*30+101&"|"&MOD(RC[-5]-1,3)*30+102&"|"&MOD(RC[-5]-1,3)*30+103&"|"&IF(MOD(RC[-5],4)=0,HLOOKUP(Sheet1!R2C10,Sheet1!R2C10:R7C10,MOD(RC[-5]/4-1,6)+1,FALSE),IF(MOD(RC[-5],2)=0,IF(RC[-5]>20,HLOOKUP(Sheet1!R2C7,Sheet1!R2C7:R43C7,MOD(RC[-5]/2-1,42)+1,FALSE),HLOOKUP(Sheet1!R2C4,Sheet1!R2C4:R7C4,MOD(RC[-5]-1,6)+1,FALSE)),MOD(RC[-5]-1,3)*30+104)) -> 130|131|132|133|124 | G368: =HLOOKUP(Sheet1!R2C1,Sheet1!R2C1:R16C1,MOD(RC1-1,2)+MOD(INT((RC1-1)/2),3)*5+1,FALSE)&"|"&HLOOKUP(Sheet1!R2C1,Sheet1!R2C1:R16C1,MOD(RC1,2)+MOD(INT((RC1)/2),3)*5+1,FALSE)&"|"&HLOOKUP(Sheet1!R2C1,Sheet1!R2C1:R16C1,MOD(RC1+1,2)+MOD(INT((RC1+1)/2),3)*5+1,FALSE)&"|"&HLOOKUP(Sheet1!R2C1,Sheet1!R2C1:R16C1,MOD(RC1+2,2)+MOD(INT((RC1+2)/2),3)*5+1,FALSE)&"|"&HLOOKUP(Sheet1!R2C1,Sheet1!R2C1:R16C1,MOD(RC1+3,2)+MOD(INT((RC1+3)/2),3)*5+1,FALSE) -> 101|130|131|160|161 | H368: =HLOOKUP(Sheet1!R2C1,Sheet1!R2C1:R16C1,MOD(RC1+2,2)+MOD(INT((RC1+2)/2),3)*5+1,FALSE)&"|"&HLOOKUP(Sheet1!R2C1,Sheet1!R2C1:R16C1,MOD(RC1+3,2)+MOD(INT((RC1+3)/2),3)*5+1,FALSE)&"|"&HLOOKUP(Sheet1!R2C1,Sheet1!R2C1:R16C1,MOD(RC1+4,2)+MOD(INT((RC1+4)/2),3)*5+1,FALSE)&"|"&HLOOKUP(Sheet1!R2C1,Sheet1!R2C1:R16C1,MOD(RC1+5,2)+MOD(INT((RC1+5)/2),3)*5+1,FALSE)&"|"&HLOOKUP(Sheet1!R2C1,Sheet1!R2C1:R16C1,MOD(RC1+6,2)+MOD(INT((RC1+6)/2),3)*5+1,FALSE) -> 160|161|100|101|130 | I368: =HLOOKUP(Sheet1!R2C1,Sheet1!R2C1:R16C1,MOD(RC1-1,3)+MOD(INT((RC1-1)/3),3)*5+3,FALSE)&"|"&HLOOKUP(Sheet1!R2C1,Sheet1!R2C1:R16C1,MOD(RC1,3)+MOD(INT((RC1)/3),3)*5+3,FALSE)&"|"&HLOOKUP(Sheet1!R2C1,Sheet1!R2C1:R16C1,MOD(RC1+1,3)+MOD(INT((RC1+1)/3),3)*5+3,FALSE)&"|"&HLOOKUP(Sheet1!R2C1,Sheet1!R2C1:R16C1,MOD(RC1+2,3)+MOD(INT((RC1+2)/3),3)*5+3,FALSE)&"|"&HLOOKUP(Sheet1!R2C1,Sheet1!R2C1:R16C1,MOD(RC1+3,3)+MOD(INT((RC1+3)/3),3)*5+3,FALSE) -> 103|104|132|133|134 | J368: =HLOOKUP(Sheet1!R2C1,Sheet1!R2C1:R16C1,MOD(RC1-1,3)+MOD(INT((RC1-1)/3),3)*5+3,FALSE)&"|"&HLOOKUP(Sheet1!R2C1,Sheet1!R2C1:R16C1,MOD(RC1,3)+MOD(INT((RC1)/3),3)*5+3,FALSE)&"|"&HLOOKUP(Sheet1!R2C1,Sheet1!R2C1:R16C1,MOD(RC1+1,3)+MOD(INT((RC1+1)/3),3)*5+3,FALSE)&"|"&HLOOKUP(Sheet1!R2C1,Sheet1!R2C1:R16C1,MOD(RC1+2,3)+MOD(INT((RC1+2)/3),3)*5+3,FALSE)&"|"&HLOOKUP(Sheet1!R2C1,Sheet1!R2C1:R16C1,MOD(RC1+3,3)+MOD(INT((RC1+3)/3),3)*5+3,FALSE) -> 103|104|132|133|134 | K368: =HLOOKUP(Sheet1!R2C1,Sheet1!R2C1:R16C1,MOD(RC1-1,3)+MOD(INT((RC1-1)/3),3)*5+3,FALSE)&"|"&HLOOKUP(Sheet1!R2C1,Sheet1!R2C1:R16C1,MOD(RC1,3)+MOD(INT((RC1)/3),3)*5+3,FALSE)&"|"&HLOOKUP(Sheet1!R2C1,Sheet1!R2C1:R16C1,MOD(RC1+1,3)+MOD(INT((RC1+1)/3),3)*5+3,FALSE)&"|"&HLOOKUP(Sheet1!R2C1,Sheet1!R2C1:R16C1,MOD(RC1+2,3)+MOD(INT((RC1+2)/3),3)*5+3,FALSE)&"|"&HLOOKUP(Sheet1!R2C1,Sheet1!R2C1:R16C1,MOD(RC1+3,3)+MOD(INT((RC1+3)/3),3)*5+3,FALSE) -> 103|104|132|133|134 | L368: 25|22|23|24 | M368: 4710244|4710244|4710245|4710245 | N368: 10030|10031|10032|10033 | O368: 1|1|1|1 | P368: 2500|2500|2500|2500
A369: 363 | B369: 361 | C369: 30 | D369: =R[-20]C+2 -> 56 | E369: 1000 | F369: =MOD(RC[-5]-1,3)*30+100&"|"&MOD(RC[-5]-1,3)*30+101&"|"&MOD(RC[-5]-1,3)*30+102&"|"&MOD(RC[-5]-1,3)*30+103&"|"&IF(MOD(RC[-5],4)=0,HLOOKUP(Sheet1!R2C10,Sheet1!R2C10:R7C10,MOD(RC[-5]/4-1,6)+1,FALSE),IF(MOD(RC[-5],2)=0,IF(RC[-5]>20,HLOOKUP(Sheet1!R2C7,Sheet1!R2C7:R43C7,MOD(RC[-5]/2-1,42)+1,FALSE),HLOOKUP(Sheet1!R2C4,Sheet1!R2C4:R7C4,MOD(RC[-5]-1,6)+1,FALSE)),MOD(RC[-5]-1,3)*30+104)) -> 160|161|162|163|164 | G369: =HLOOKUP(Sheet1!R2C1,Sheet1!R2C1:R16C1,MOD(RC1-1,2)+MOD(INT((RC1-1)/2),3)*5+1,FALSE)&"|"&HLOOKUP(Sheet1!R2C1,Sheet1!R2C1:R16C1,MOD(RC1,2)+MOD(INT((RC1)/2),3)*5+1,FALSE)&"|"&HLOOKUP(Sheet1!R2C1,Sheet1!R2C1:R16C1,MOD(RC1+1,2)+MOD(INT((RC1+1)/2),3)*5+1,FALSE)&"|"&HLOOKUP(Sheet1!R2C1,Sheet1!R2C1:R16C1,MOD(RC1+2,2)+MOD(INT((RC1+2)/2),3)*5+1,FALSE)&"|"&HLOOKUP(Sheet1!R2C1,Sheet1!R2C1:R16C1,MOD(RC1+3,2)+MOD(INT((RC1+3)/2),3)*5+1,FALSE) -> 130|131|160|161|100 | H369: =HLOOKUP(Sheet1!R2C1,Sheet1!R2C1:R16C1,MOD(RC1+2,2)+MOD(INT((RC1+2)/2),3)*5+1,FALSE)&"|"&HLOOKUP(Sheet1!R2C1,Sheet1!R2C1:R16C1,MOD(RC1+3,2)+MOD(INT((RC1+3)/2),3)*5+1,FALSE)&"|"&HLOOKUP(Sheet1!R2C1,Sheet1!R2C1:R16C1,MOD(RC1+4,2)+MOD(INT((RC1+4)/2),3)*5+1,FALSE)&"|"&HLOOKUP(Sheet1!R2C1,Sheet1!R2C1:R16C1,MOD(RC1+5,2)+MOD(INT((RC1+5)/2),3)*5+1,FALSE)&"|"&HLOOKUP(Sheet1!R2C1,Sheet1!R2C1:R16C1,MOD(RC1+6,2)+MOD(INT((RC1+6)/2),3)*5+1,FALSE) -> 161|100|101|130|131 | I369: =HLOOKUP(Sheet1!R2C1,Sheet1!R2C1:R16C1,MOD(RC1-1,3)+MOD(INT((RC1-1)/3),3)*5+3,FALSE)&"|"&HLOOKUP(Sheet1!R2C1,Sheet1!R2C1:R16C1,MOD(RC1,3)+MOD(INT((RC1)/3),3)*5+3,FALSE)&"|"&HLOOKUP(Sheet1!R2C1,Sheet1!R2C1:R16C1,MOD(RC1+1,3)+MOD(INT((RC1+1)/3),3)*5+3,FALSE)&"|"&HLOOKUP(Sheet1!R2C1,Sheet1!R2C1:R16C1,MOD(RC1+2,3)+MOD(INT((RC1+2)/3),3)*5+3,FALSE)&"|"&HLOOKUP(Sheet1!R2C1,Sheet1!R2C1:R16C1,MOD(RC1+3,3)+MOD(INT((RC1+3)/3),3)*5+3,FALSE) -> 104|132|133|134|162 | J369: =HLOOKUP(Sheet1!R2C1,Sheet1!R2C1:R16C1,MOD(RC1-1,3)+MOD(INT((RC1-1)/3),3)*5+3,FALSE)&"|"&HLOOKUP(Sheet1!R2C1,Sheet1!R2C1:R16C1,MOD(RC1,3)+MOD(INT((RC1)/3),3)*5+3,FALSE)&"|"&HLOOKUP(Sheet1!R2C1,Sheet1!R2C1:R16C1,MOD(RC1+1,3)+MOD(INT((RC1+1)/3),3)*5+3,FALSE)&"|"&HLOOKUP(Sheet1!R2C1,Sheet1!R2C1:R16C1,MOD(RC1+2,3)+MOD(INT((RC1+2)/3),3)*5+3,FALSE)&"|"&HLOOKUP(Sheet1!R2C1,Sheet1!R2C1:R16C1,MOD(RC1+3,3)+MOD(INT((RC1+3)/3),3)*5+3,FALSE) -> 104|132|133|134|162 | K369: =HLOOKUP(Sheet1!R2C1,Sheet1!R2C1:R16C1,MOD(RC1-1,3)+MOD(INT((RC1-1)/3),3)*5+3,FALSE)&"|"&HLOOKUP(Sheet1!R2C1,Sheet1!R2C1:R16C1,MOD(RC1,3)+MOD(INT((RC1)/3),3)*5+3,FALSE)&"|"&HLOOKUP(Sheet1!R2C1,Sheet1!R2C1:R16C1,MOD(RC1+1,3)+MOD(INT((RC1+1)/3),3)*5+3,FALSE)&"|"&HLOOKUP(Sheet1!R2C1,Sheet1!R2C1:R16C1,MOD(RC1+2,3)+MOD(INT((RC1+2)/3),3)*5+3,FALSE)&"|"&HLOOKUP(Sheet1!R2C1,Sheet1!R2C1:R16C1,MOD(RC1+3,3)+MOD(INT((RC1+3)/3),3)*5+3,FALSE) -> 104|132|133|134|162 | L369: 25|22|23|24 | M369: 4752529|4752529|4752530|4752530 | N369: 10030|10031|10032|10033 | O369: 1|1|1|1 | P369: 2500|2500|2500|2500
A370: 364 | B370: 362 | C370: 30 | D370: =R[-20]C+2 -> 56 | E370: 1000 | F370: =MOD(RC[-5]-1,3)*30+100&"|"&MOD(RC[-5]-1,3)*30+101&"|"&MOD(RC[-5]-1,3)*30+102&"|"&MOD(RC[-5]-1,3)*30+103&"|"&IF(MOD(RC[-5],4)=0,HLOOKUP(Sheet1!R2C10,Sheet1!R2C10:R7C10,MOD(RC[-5]/4-1,6)+1,FALSE),IF(MOD(RC[-5],2)=0,IF(RC[-5]>20,HLOOKUP(Sheet1!R2C7,Sheet1!R2C7:R43C7,MOD(RC[-5]/2-1,42)+1,FALSE),HLOOKUP(Sheet1!R2C4,Sheet1!R2C4:R7C4,MOD(RC[-5]-1,6)+1,FALSE)),MOD(RC[-5]-1,3)*30+104)) -> 100|101|102|103|190 | G370: =HLOOKUP(Sheet1!R2C1,Sheet1!R2C1:R16C1,MOD(RC1-1,2)+MOD(INT((RC1-1)/2),3)*5+1,FALSE)&"|"&HLOOKUP(Sheet1!R2C1,Sheet1!R2C1:R16C1,MOD(RC1,2)+MOD(INT((RC1)/2),3)*5+1,FALSE)&"|"&HLOOKUP(Sheet1!R2C1,Sheet1!R2C1:R16C1,MOD(RC1+1,2)+MOD(INT((RC1+1)/2),3)*5+1,FALSE)&"|"&HLOOKUP(Sheet1!R2C1,Sheet1!R2C1:R16C1,MOD(RC1+2,2)+MOD(INT((RC1+2)/2),3)*5+1,FALSE)&"|"&HLOOKUP(Sheet1!R2C1,Sheet1!R2C1:R16C1,MOD(RC1+3,2)+MOD(INT((RC1+3)/2),3)*5+1,FALSE) -> 131|160|161|100|101 | H370: =HLOOKUP(Sheet1!R2C1,Sheet1!R2C1:R16C1,MOD(RC1+2,2)+MOD(INT((RC1+2)/2),3)*5+1,FALSE)&"|"&HLOOKUP(Sheet1!R2C1,Sheet1!R2C1:R16C1,MOD(RC1+3,2)+MOD(INT((RC1+3)/2),3)*5+1,FALSE)&"|"&HLOOKUP(Sheet1!R2C1,Sheet1!R2C1:R16C1,MOD(RC1+4,2)+MOD(INT((RC1+4)/2),3)*5+1,FALSE)&"|"&HLOOKUP(Sheet1!R2C1,Sheet1!R2C1:R16C1,MOD(RC1+5,2)+MOD(INT((RC1+5)/2),3)*5+1,FALSE)&"|"&HLOOKUP(Sheet1!R2C1,Sheet1!R2C1:R16C1,MOD(RC1+6,2)+MOD(INT((RC1+6)/2),3)*5+1,FALSE) -> 100|101|130|131|160 | I370: =HLOOKUP(Sheet1!R2C1,Sheet1!R2C1:R16C1,MOD(RC1-1,3)+MOD(INT((RC1-1)/3),3)*5+3,FALSE)&"|"&HLOOKUP(Sheet1!R2C1,Sheet1!R2C1:R16C1,MOD(RC1,3)+MOD(INT((RC1)/3),3)*5+3,FALSE)&"|"&HLOOKUP(Sheet1!R2C1,Sheet1!R2C1:R16C1,MOD(RC1+1,3)+MOD(INT((RC1+1)/3),3)*5+3,FALSE)&"|"&HLOOKUP(Sheet1!R2C1,Sheet1!R2C1:R16C1,MOD(RC1+2,3)+MOD(INT((RC1+2)/3),3)*5+3,FALSE)&"|"&HLOOKUP(Sheet1!R2C1,Sheet1!R2C1:R16C1,MOD(RC1+3,3)+MOD(INT((RC1+3)/3),3)*5+3,FALSE) -> 132|133|134|162|163 | J370: =HLOOKUP(Sheet1!R2C1,Sheet1!R2C1:R16C1,MOD(RC1-1,3)+MOD(INT((RC1-1)/3),3)*5+3,FALSE)&"|"&HLOOKUP(Sheet1!R2C1,Sheet1!R2C1:R16C1,MOD(RC1,3)+MOD(INT((RC1)/3),3)*5+3,FALSE)&"|"&HLOOKUP(Sheet1!R2C1,Sheet1!R2C1:R16C1,MOD(RC1+1,3)+MOD(INT((RC1+1)/3),3)*5+3,FALSE)&"|"&HLOOKUP(Sheet1!R2C1,Sheet1!R2C1:R16C1,MOD(RC1+2,3)+MOD(INT((RC1+2)/3),3)*5+3,FALSE)&"|"&HLOOKUP(Sheet1!R2C1,Sheet1!R2C1:R16C1,MOD(RC1+3,3)+MOD(INT((RC1+3)/3),3)*5+3,FALSE) -> 132|133|134|162|163 | K370: =HLOOKUP(Sheet1!R2C1,Sheet1!R2C1:R16C1,MOD(RC1-1,3)+MOD(INT((RC1-1)/3),3)*5+3,FALSE)&"|"&HLOOKUP(Sheet1!R2C1,Sheet1!R2C1:R16C1,MOD(RC1,3)+MOD(INT((RC1)/3),3)*5+3,FALSE)&"|"&HLOOKUP(Sheet1!R2C1,Sheet1!R2C1:R16C1,MOD(RC1+1,3)+MOD(INT((RC1+1)/3),3)*5+3,FALSE)&"|"&HLOOKUP(Sheet1!R2C1,Sheet1!R2C1:R16C1,MOD(RC1+2,3)+MOD(INT((RC1+2)/3),3)*5+3,FALSE)&"|"&HLOOKUP(Sheet1!R2C1,Sheet1!R2C1:R16C1,MOD(RC1+3,3)+MOD(INT((RC1+3)/3),3)*5+3,FALSE) -> 132|133|134|162|163 | L370: 25|22|23|24 | M370: 4793123|4793123|4793123|4793123 | N370: 10030|10031|10032|10033 | O370: 1|1|1|1 | P370: 2500|2500|2500|2500
A371: 365 | B371: 363 | C371: 30 | D371: =R[-20]C+2 -> 56 | E371: 1000 | F371: =MOD(RC[-5]-1,3)*30+100&"|"&MOD(RC[-5]-1,3)*30+101&"|"&MOD(RC[-5]-1,3)*30+102&"|"&MOD(RC[-5]-1,3)*30+103&"|"&IF(MOD(RC[-5],4)=0,HLOOKUP(Sheet1!R2C10,Sheet1!R2C10:R7C10,MOD(RC[-5]/4-1,6)+1,FALSE),IF(MOD(RC[-5],2)=0,IF(RC[-5]>20,HLOOKUP(Sheet1!R2C7,Sheet1!R2C7:R43C7,MOD(RC[-5]/2-1,42)+1,FALSE),HLOOKUP(Sheet1!R2C4,Sheet1!R2C4:R7C4,MOD(RC[-5]-1,6)+1,FALSE)),MOD(RC[-5]-1,3)*30+104)) -> 130|131|132|133|134 | G371: =HLOOKUP(Sheet1!R2C1,Sheet1!R2C1:R16C1,MOD(RC1-1,2)+MOD(INT((RC1-1)/2),3)*5+1,FALSE)&"|"&HLOOKUP(Sheet1!R2C1,Sheet1!R2C1:R16C1,MOD(RC1,2)+MOD(INT((RC1)/2),3)*5+1,FALSE)&"|"&HLOOKUP(Sheet1!R2C1,Sheet1!R2C1:R16C1,MOD(RC1+1,2)+MOD(INT((RC1+1)/2),3)*5+1,FALSE)&"|"&HLOOKUP(Sheet1!R2C1,Sheet1!R2C1:R16C1,MOD(RC1+2,2)+MOD(INT((RC1+2)/2),3)*5+1,FALSE)&"|"&HLOOKUP(Sheet1!R2C1,Sheet1!R2C1:R16C1,MOD(RC1+3,2)+MOD(INT((RC1+3)/2),3)*5+1,FALSE) -> 160|161|100|101|130 | H371: =HLOOKUP(Sheet1!R2C1,Sheet1!R2C1:R16C1,MOD(RC1+2,2)+MOD(INT((RC1+2)/2),3)*5+1,FALSE)&"|"&HLOOKUP(Sheet1!R2C1,Sheet1!R2C1:R16C1,MOD(RC1+3,2)+MOD(INT((RC1+3)/2),3)*5+1,FALSE)&"|"&HLOOKUP(Sheet1!R2C1,Sheet1!R2C1:R16C1,MOD(RC1+4,2)+MOD(INT((RC1+4)/2),3)*5+1,FALSE)&"|"&HLOOKUP(Sheet1!R2C1,Sheet1!R2C1:R16C1,MOD(RC1+5,2)+MOD(INT((RC1+5)/2),3)*5+1,FALSE)&"|"&HLOOKUP(Sheet1!R2C1,Sheet1!R2C1:R16C1,MOD(RC1+6,2)+MOD(INT((RC1+6)/2),3)*5+1,FALSE) -> 101|130|131|160|161 | I371: =HLOOKUP(Sheet1!R2C1,Sheet1!R2C1:R16C1,MOD(RC1-1,3)+MOD(INT((RC1-1)/3),3)*5+3,FALSE)&"|"&HLOOKUP(Sheet1!R2C1,Sheet1!R2C1:R16C1,MOD(RC1,3)+MOD(INT((RC1)/3),3)*5+3,FALSE)&"|"&HLOOKUP(Sheet1!R2C1,Sheet1!R2C1:R16C1,MOD(RC1+1,3)+MOD(INT((RC1+1)/3),3)*5+3,FALSE)&"|"&HLOOKUP(Sheet1!R2C1,Sheet1!R2C1:R16C1,MOD(RC1+2,3)+MOD(INT((RC1+2)/3),3)*5+3,FALSE)&"|"&HLOOKUP(Sheet1!R2C1,Sheet1!R2C1:R16C1,MOD(RC1+3,3)+MOD(INT((RC1+3)/3),3)*5+3,FALSE) -> 133|134|162|163|164 | J371: =HLOOKUP(Sheet1!R2C1,Sheet1!R2C1:R16C1,MOD(RC1-1,3)+MOD(INT((RC1-1)/3),3)*5+3,FALSE)&"|"&HLOOKUP(Sheet1!R2C1,Sheet1!R2C1:R16C1,MOD(RC1,3)+MOD(INT((RC1)/3),3)*5+3,FALSE)&"|"&HLOOKUP(Sheet1!R2C1,Sheet1!R2C1:R16C1,MOD(RC1+1,3)+MOD(INT((RC1+1)/3),3)*5+3,FALSE)&"|"&HLOOKUP(Sheet1!R2C1,Sheet1!R2C1:R16C1,MOD(RC1+2,3)+MOD(INT((RC1+2)/3),3)*5+3,FALSE)&"|"&HLOOKUP(Sheet1!R2C1,Sheet1!R2C1:R16C1,MOD(RC1+3,3)+MOD(INT((RC1+3)/3),3)*5+3,FALSE) -> 133|134|162|163|164 | K371: =HLOOKUP(Sheet1!R2C1,Sheet1!R2C1:R16C1,MOD(RC1-1,3)+MOD(INT((RC1-1)/3),3)*5+3,FALSE)&"|"&HLOOKUP(Sheet1!R2C1,Sheet1!R2C1:R16C1,MOD(RC1,3)+MOD(INT((RC1)/3),3)*5+3,FALSE)&"|"&HLOOKUP(Sheet1!R2C1,Sheet1!R2C1:R16C1,MOD(RC1+1,3)+MOD(INT((RC1+1)/3),3)*5+3,FALSE)&"|"&HLOOKUP(Sheet1!R2C1,Sheet1!R2C1:R16C1,MOD(RC1+2,3)+MOD(INT((RC1+2)/3),3)*5+3,FALSE)&"|"&HLOOKUP(Sheet1!R2C1,Sheet1!R2C1:R16C1,MOD(RC1+3,3)+MOD(INT((RC1+3)/3),3)*5+3,FALSE) -> 133|134|162|163|164 | L371: 25|22|23|24 | M371: 4836423|4836424|4836423|4836423 | N371: 10030|10031|10032|10033|10030|10031|10032|10033|10030|10031|10032|10033|10030|10031|10032|10033|10030|10031|10032|10033|10030|10031|10032|10033|10030|10031|10032|10033|10030|10031|10032|10033|10030|10031|10032|10033|10030|10031|10032|10033 | O371: 1|1|1|1|1|1|1|1|1|1|1|1|1|1|1|1|1|1|1|1|1|1|1|1|1|1|1|1|1|1|1|1|1|1|1|1|1|1|1|1 | P371: 2500|2500|2500|2500|2500|2500|2500|2500|2500|2500|2500|2500|2500|2500|2500|2500|2500|2500|2500|2500|2500|2500|2500|2500|2500|2500|2500|2500|2500|2500|2500|2500|2500|2500|2500|2500|2500|2500|2500|2500
A372: 366 | B372: 364 | C372: 30 | D372: =R[-20]C+2 -> 56 | E372: 1000 | F372: =MOD(RC[-5]-1,3)*30+100&"|"&MOD(RC[-5]-1,3)*30+101&"|"&MOD(RC[-5]-1,3)*30+102&"|"&MOD(RC[-5]-1,3)*30+103&"|"&IF(MOD(RC[-5],4)=0,HLOOKUP(Sheet1!R2C10,Sheet1!R2C10:R7C10,MOD(RC[-5]/4-1,6)+1,FALSE),IF(MOD(RC[-5],2)=0,IF(RC[-5]>20,HLOOKUP(Sheet1!R2C7,Sheet1!R2C7:R43C7,MOD(RC[-5]/2-1,42)+1,FALSE),HLOOKUP(Sheet1!R2C4,Sheet1!R2C4:R7C4,MOD(RC[-5]-1,6)+1,FALSE)),MOD(RC[-5]-1,3)*30+104)) -> 160|161|162|163|142 | G372: =HLOOKUP(Sheet1!R2C1,Sheet1!R2C1:R16C1,MOD(RC1-1,2)+MOD(INT((RC1-1)/2),3)*5+1,FALSE)&"|"&HLOOKUP(Sheet1!R2C1,Sheet1!R2C1:R16C1,MOD(RC1,2)+MOD(INT((RC1)/2),3)*5+1,FALSE)&"|"&HLOOKUP(Sheet1!R2C1,Sheet1!R2C1:R16C1,MOD(RC1+1,2)+MOD(INT((RC1+1)/2),3)*5+1,FALSE)&"|"&HLOOKUP(Sheet1!R2C1,Sheet1!R2C1:R16C1,MOD(RC1+2,2)+MOD(INT((RC1+2)/2),3)*5+1,FALSE)&"|"&HLOOKUP(Sheet1!R2C1,Sheet1!R2C1:R16C1,MOD(RC1+3,2)+MOD(INT((RC1+3)/2),3)*5+1,FALSE) -> 161|100|101|130|131 | H372: =HLOOKUP(Sheet1!R2C1,Sheet1!R2C1:R16C1,MOD(RC1+2,2)+MOD(INT((RC1+2)/2),3)*5+1,FALSE)&"|"&HLOOKUP(Sheet1!R2C1,Sheet1!R2C1:R16C1,MOD(RC1+3,2)+MOD(INT((RC1+3)/2),3)*5+1,FALSE)&"|"&HLOOKUP(Sheet1!R2C1,Sheet1!R2C1:R16C1,MOD(RC1+4,2)+MOD(INT((RC1+4)/2),3)*5+1,FALSE)&"|"&HLOOKUP(Sheet1!R2C1,Sheet1!R2C1:R16C1,MOD(RC1+5,2)+MOD(INT((RC1+5)/2),3)*5+1,FALSE)&"|"&HLOOKUP(Sheet1!R2C1,Sheet1!R2C1:R16C1,MOD(RC1+6,2)+MOD(INT((RC1+6)/2),3)*5+1,FALSE) -> 130|131|160|161|100 | I372: =HLOOKUP(Sheet1!R2C1,Sheet1!R2C1:R16C1,MOD(RC1-1,3)+MOD(INT((RC1-1)/3),3)*5+3,FALSE)&"|"&HLOOKUP(Sheet1!R2C1,Sheet1!R2C1:R16C1,MOD(RC1,3)+MOD(INT((RC1)/3),3)*5+3,FALSE)&"|"&HLOOKUP(Sheet1!R2C1,Sheet1!R2C1:R16C1,MOD(RC1+1,3)+MOD(INT((RC1+1)/3),3)*5+3,FALSE)&"|"&HLOOKUP(Sheet1!R2C1,Sheet1!R2C1:R16C1,MOD(RC1+2,3)+MOD(INT((RC1+2)/3),3)*5+3,FALSE)&"|"&HLOOKUP(Sheet1!R2C1,Sheet1!R2C1:R16C1,MOD(RC1+3,3)+MOD(INT((RC1+3)/3),3)*5+3,FALSE) -> 134|162|163|164|102 | J372: =HLOOKUP(Sheet1!R2C1,Sheet1!R2C1:R16C1,MOD(RC1-1,3)+MOD(INT((RC1-1)/3),3)*5+3,FALSE)&"|"&HLOOKUP(Sheet1!R2C1,Sheet1!R2C1:R16C1,MOD(RC1,3)+MOD(INT((RC1)/3),3)*5+3,FALSE)&"|"&HLOOKUP(Sheet1!R2C1,Sheet1!R2C1:R16C1,MOD(RC1+1,3)+MOD(INT((RC1+1)/3),3)*5+3,FALSE)&"|"&HLOOKUP(Sheet1!R2C1,Sheet1!R2C1:R16C1,MOD(RC1+2,3)+MOD(INT((RC1+2)/3),3)*5+3,FALSE)&"|"&HLOOKUP(Sheet1!R2C1,Sheet1!R2C1:R16C1,MOD(RC1+3,3)+MOD(INT((RC1+3)/3),3)*5+3,FALSE) -> 134|162|163|164|102 | K372: =HLOOKUP(Sheet1!R2C1,Sheet1!R2C1:R16C1,MOD(RC1-1,3)+MOD(INT((RC1-1)/3),3)*5+3,FALSE)&"|"&HLOOKUP(Sheet1!R2C1,Sheet1!R2C1:R16C1,MOD(RC1,3)+MOD(INT((RC1)/3),3)*5+3,FALSE)&"|"&HLOOKUP(Sheet1!R2C1,Sheet1!R2C1:R16C1,MOD(RC1+1,3)+MOD(INT((RC1+1)/3),3)*5+3,FALSE)&"|"&HLOOKUP(Sheet1!R2C1,Sheet1!R2C1:R16C1,MOD(RC1+2,3)+MOD(INT((RC1+2)/3),3)*5+3,FALSE)&"|"&HLOOKUP(Sheet1!R2C1,Sheet1!R2C1:R16C1,MOD(RC1+3,3)+MOD(INT((RC1+3)/3),3)*5+3,FALSE) -> 134|162|163|164|102 | L372: 25|22|23|24 | M372: 4878540|4878540|4878540|4878540 | N372: 10030|10031|10032|10033 | O372: 1|1|1|1 | P372: 2500|2500|2500|2500
A373: 367 | B373: 365 | C373: 30 | D373: =R[-20]C+2 -> 56 | E373: 1000 | F373: =MOD(RC[-5]-1,3)*30+100&"|"&MOD(RC[-5]-1,3)*30+101&"|"&MOD(RC[-5]-1,3)*30+102&"|"&MOD(RC[-5]-1,3)*30+103&"|"&IF(MOD(RC[-5],4)=0,HLOOKUP(Sheet1!R2C10,Sheet1!R2C10:R7C10,MOD(RC[-5]/4-1,6)+1,FALSE),IF(MOD(RC[-5],2)=0,IF(RC[-5]>20,HLOOKUP(Sheet1!R2C7,Sheet1!R2C7:R43C7,MOD(RC[-5]/2-1,42)+1,FALSE),HLOOKUP(Sheet1!R2C4,Sheet1!R2C4:R7C4,MOD(RC[-5]-1,6)+1,FALSE)),MOD(RC[-5]-1,3)*30+104)) -> 100|101|102|103|104 | G373: =HLOOKUP(Sheet1!R2C1,Sheet1!R2C1:R16C1,MOD(RC1-1,2)+MOD(INT((RC1-1)/2),3)*5+1,FALSE)&"|"&HLOOKUP(Sheet1!R2C1,Sheet1!R2C1:R16C1,MOD(RC1,2)+MOD(INT((RC1)/2),3)*5+1,FALSE)&"|"&HLOOKUP(Sheet1!R2C1,Sheet1!R2C1:R16C1,MOD(RC1+1,2)+MOD(INT((RC1+1)/2),3)*5+1,FALSE)&"|"&HLOOKUP(Sheet1!R2C1,Sheet1!R2C1:R16C1,MOD(RC1+2,2)+MOD(INT((RC1+2)/2),3)*5+1,FALSE)&"|"&HLOOKUP(Sheet1!R2C1,Sheet1!R2C1:R16C1,MOD(RC1+3,2)+MOD(INT((RC1+3)/2),3)*5+1,FALSE) -> 100|101|130|131|160 | H373: =HLOOKUP(Sheet1!R2C1,Sheet1!R2C1:R16C1,MOD(RC1+2,2)+MOD(INT((RC1+2)/2),3)*5+1,FALSE)&"|"&HLOOKUP(Sheet1!R2C1,Sheet1!R2C1:R16C1,MOD(RC1+3,2)+MOD(INT((RC1+3)/2),3)*5+1,FALSE)&"|"&HLOOKUP(Sheet1!R2C1,Sheet1!R2C1:R16C1,MOD(RC1+4,2)+MOD(INT((RC1+4)/2),3)*5+1,FALSE)&"|"&HLOOKUP(Sheet1!R2C1,Sheet1!R2C1:R16C1,MOD(RC1+5,2)+MOD(INT((RC1+5)/2),3)*5+1,FALSE)&"|"&HLOOKUP(Sheet1!R2C1,Sheet1!R2C1:R16C1,MOD(RC1+6,2)+MOD(INT((RC1+6)/2),3)*5+1,FALSE) -> 131|160|161|100|101 | I373: =HLOOKUP(Sheet1!R2C1,Sheet1!R2C1:R16C1,MOD(RC1-1,3)+MOD(INT((RC1-1)/3),3)*5+3,FALSE)&"|"&HLOOKUP(Sheet1!R2C1,Sheet1!R2C1:R16C1,MOD(RC1,3)+MOD(INT((RC1)/3),3)*5+3,FALSE)&"|"&HLOOKUP(Sheet1!R2C1,Sheet1!R2C1:R16C1,MOD(RC1+1,3)+MOD(INT((RC1+1)/3),3)*5+3,FALSE)&"|"&HLOOKUP(Sheet1!R2C1,Sheet1!R2C1:R16C1,MOD(RC1+2,3)+MOD(INT((RC1+2)/3),3)*5+3,FALSE)&"|"&HLOOKUP(Sheet1!R2C1,Sheet1!R2C1:R16C1,MOD(RC1+3,3)+MOD(INT((RC1+3)/3),3)*5+3,FALSE) -> 162|163|164|102|103 | J373: =HLOOKUP(Sheet1!R2C1,Sheet1!R2C1:R16C1,MOD(RC1-1,3)+MOD(INT((RC1-1)/3),3)*5+3,FALSE)&"|"&HLOOKUP(Sheet1!R2C1,Sheet1!R2C1:R16C1,MOD(RC1,3)+MOD(INT((RC1)/3),3)*5+3,FALSE)&"|"&HLOOKUP(Sheet1!R2C1,Sheet1!R2C1:R16C1,MOD(RC1+1,3)+MOD(INT((RC1+1)/3),3)*5+3,FALSE)&"|"&HLOOKUP(Sheet1!R2C1,Sheet1!R2C1:R16C1,MOD(RC1+2,3)+MOD(INT((RC1+2)/3),3)*5+3,FALSE)&"|"&HLOOKUP(Sheet1!R2C1,Sheet1!R2C1:R16C1,MOD(RC1+3,3)+MOD(INT((RC1+3)/3),3)*5+3,FALSE) -> 162|163|164|102|103 | K373: =HLOOKUP(Sheet1!R2C1,Sheet1!R2C1:R16C1,MOD(RC1-1,3)+MOD(INT((RC1-1)/3),3)*5+3,FALSE)&"|"&HLOOKUP(Sheet1!R2C1,Sheet1!R2C1:R16C1,MOD(RC1,3)+MOD(INT((RC1)/3),3)*5+3,FALSE)&"|"&HLOOKUP(Sheet1!R2C1,Sheet1!R2C1:R16C1,MOD(RC1+1,3)+MOD(INT((RC1+1)/3),3)*5+3,FALSE)&"|"&HLOOKUP(Sheet1!R2C1,Sheet1!R2C1:R16C1,MOD(RC1+2,3)+MOD(INT((RC1+2)/3),3)*5+3,FALSE)&"|"&HLOOKUP(Sheet1!R2C1,Sheet1!R2C1:R16C1,MOD(RC1+3,3)+MOD(INT((RC1+3)/3),3)*5+3,FALSE) -> 162|163|164|102|103 | L373: 25|22|23|24 | M373: 4922412|4922413|4922413|4922413 | N373: 10030|10031|10032|10033 | O373: 1|1|1|1 | P373: 2500|2500|2500|2500
A374: 368 | B374: 366 | C374: 30 | D374: =R[-20]C+2 -> 56 | E374: 1000 | F374: =MOD(RC[-5]-1,3)*30+100&"|"&MOD(RC[-5]-1,3)*30+101&"|"&MOD(RC[-5]-1,3)*30+102&"|"&MOD(RC[-5]-1,3)*30+103&"|"&IF(MOD(RC[-5],4)=0,HLOOKUP(Sheet1!R2C10,Sheet1!R2C10:R7C10,MOD(RC[-5]/4-1,6)+1,FALSE),IF(MOD(RC[-5],2)=0,IF(RC[-5]>20,HLOOKUP(Sheet1!R2C7,Sheet1!R2C7:R43C7,MOD(RC[-5]/2-1,42)+1,FALSE),HLOOKUP(Sheet1!R2C4,Sheet1!R2C4:R7C4,MOD(RC[-5]-1,6)+1,FALSE)),MOD(RC[-5]-1,3)*30+104)) -> 130|131|132|133|191 | G374: =HLOOKUP(Sheet1!R2C1,Sheet1!R2C1:R16C1,MOD(RC1-1,2)+MOD(INT((RC1-1)/2),3)*5+1,FALSE)&"|"&HLOOKUP(Sheet1!R2C1,Sheet1!R2C1:R16C1,MOD(RC1,2)+MOD(INT((RC1)/2),3)*5+1,FALSE)&"|"&HLOOKUP(Sheet1!R2C1,Sheet1!R2C1:R16C1,MOD(RC1+1,2)+MOD(INT((RC1+1)/2),3)*5+1,FALSE)&"|"&HLOOKUP(Sheet1!R2C1,Sheet1!R2C1:R16C1,MOD(RC1+2,2)+MOD(INT((RC1+2)/2),3)*5+1,FALSE)&"|"&HLOOKUP(Sheet1!R2C1,Sheet1!R2C1:R16C1,MOD(RC1+3,2)+MOD(INT((RC1+3)/2),3)*5+1,FALSE) -> 101|130|131|160|161 | H374: =HLOOKUP(Sheet1!R2C1,Sheet1!R2C1:R16C1,MOD(RC1+2,2)+MOD(INT((RC1+2)/2),3)*5+1,FALSE)&"|"&HLOOKUP(Sheet1!R2C1,Sheet1!R2C1:R16C1,MOD(RC1+3,2)+MOD(INT((RC1+3)/2),3)*5+1,FALSE)&"|"&HLOOKUP(Sheet1!R2C1,Sheet1!R2C1:R16C1,MOD(RC1+4,2)+MOD(INT((RC1+4)/2),3)*5+1,FALSE)&"|"&HLOOKUP(Sheet1!R2C1,Sheet1!R2C1:R16C1,MOD(RC1+5,2)+MOD(INT((RC1+5)/2),3)*5+1,FALSE)&"|"&HLOOKUP(Sheet1!R2C1,Sheet1!R2C1:R16C1,MOD(RC1+6,2)+MOD(INT((RC1+6)/2),3)*5+1,FALSE) -> 160|161|100|101|130 | I374: =HLOOKUP(Sheet1!R2C1,Sheet1!R2C1:R16C1,MOD(RC1-1,3)+MOD(INT((RC1-1)/3),3)*5+3,FALSE)&"|"&HLOOKUP(Sheet1!R2C1,Sheet1!R2C1:R16C1,MOD(RC1,3)+MOD(INT((RC1)/3),3)*5+3,FALSE)&"|"&HLOOKUP(Sheet1!R2C1,Sheet1!R2C1:R16C1,MOD(RC1+1,3)+MOD(INT((RC1+1)/3),3)*5+3,FALSE)&"|"&HLOOKUP(Sheet1!R2C1,Sheet1!R2C1:R16C1,MOD(RC1+2,3)+MOD(INT((RC1+2)/3),3)*5+3,FALSE)&"|"&HLOOKUP(Sheet1!R2C1,Sheet1!R2C1:R16C1,MOD(RC1+3,3)+MOD(INT((RC1+3)/3),3)*5+3,FALSE) -> 163|164|102|103|104 | J374: =HLOOKUP(Sheet1!R2C1,Sheet1!R2C1:R16C1,MOD(RC1-1,3)+MOD(INT((RC1-1)/3),3)*5+3,FALSE)&"|"&HLOOKUP(Sheet1!R2C1,Sheet1!R2C1:R16C1,MOD(RC1,3)+MOD(INT((RC1)/3),3)*5+3,FALSE)&"|"&HLOOKUP(Sheet1!R2C1,Sheet1!R2C1:R16C1,MOD(RC1+1,3)+MOD(INT((RC1+1)/3),3)*5+3,FALSE)&"|"&HLOOKUP(Sheet1!R2C1,Sheet1!R2C1:R16C1,MOD(RC1+2,3)+MOD(INT((RC1+2)/3),3)*5+3,FALSE)&"|"&HLOOKUP(Sheet1!R2C1,Sheet1!R2C1:R16C1,MOD(RC1+3,3)+MOD(INT((RC1+3)/3),3)*5+3,FALSE) -> 163|164|102|103|104 | K374: =HLOOKUP(Sheet1!R2C1,Sheet1!R2C1:R16C1,MOD(RC1-1,3)+MOD(INT((RC1-1)/3),3)*5+3,FALSE)&"|"&HLOOKUP(Sheet1!R2C1,Sheet1!R2C1:R16C1,MOD(RC1,3)+MOD(INT((RC1)/3),3)*5+3,FALSE)&"|"&HLOOKUP(Sheet1!R2C1,Sheet1!R2C1:R16C1,MOD(RC1+1,3)+MOD(INT((RC1+1)/3),3)*5+3,FALSE)&"|"&HLOOKUP(Sheet1!R2C1,Sheet1!R2C1:R16C1,MOD(RC1+2,3)+MOD(INT((RC1+2)/3),3)*5+3,FALSE)&"|"&HLOOKUP(Sheet1!R2C1,Sheet1!R2C1:R16C1,MOD(RC1+3,3)+MOD(INT((RC1+3)/3),3)*5+3,FALSE) -> 163|164|102|103|104 | L374: 25|22|23|24 | M374: 4966284|4966284|4966285|4966285 | N374: 10030|10031|10032|10033 | O374: 1|1|1|1 | P374: 2500|2500|2500|2500
A375: 369 | B375: 367 | C375: 30 | D375: =R[-20]C+2 -> 56 | E375: 1000 | F375: =MOD(RC[-5]-1,3)*30+100&"|"&MOD(RC[-5]-1,3)*30+101&"|"&MOD(RC[-5]-1,3)*30+102&"|"&MOD(RC[-5]-1,3)*30+103&"|"&IF(MOD(RC[-5],4)=0,HLOOKUP(Sheet1!R2C10,Sheet1!R2C10:R7C10,MOD(RC[-5]/4-1,6)+1,FALSE),IF(MOD(RC[-5],2)=0,IF(RC[-5]>20,HLOOKUP(Sheet1!R2C7,Sheet1!R2C7:R43C7,MOD(RC[-5]/2-1,42)+1,FALSE),HLOOKUP(Sheet1!R2C4,Sheet1!R2C4:R7C4,MOD(RC[-5]-1,6)+1,FALSE)),MOD(RC[-5]-1,3)*30+104)) -> 160|161|162|163|164 | G375: =HLOOKUP(Sheet1!R2C1,Sheet1!R2C1:R16C1,MOD(RC1-1,2)+MOD(INT((RC1-1)/2),3)*5+1,FALSE)&"|"&HLOOKUP(Sheet1!R2C1,Sheet1!R2C1:R16C1,MOD(RC1,2)+MOD(INT((RC1)/2),3)*5+1,FALSE)&"|"&HLOOKUP(Sheet1!R2C1,Sheet1!R2C1:R16C1,MOD(RC1+1,2)+MOD(INT((RC1+1)/2),3)*5+1,FALSE)&"|"&HLOOKUP(Sheet1!R2C1,Sheet1!R2C1:R16C1,MOD(RC1+2,2)+MOD(INT((RC1+2)/2),3)*5+1,FALSE)&"|"&HLOOKUP(Sheet1!R2C1,Sheet1!R2C1:R16C1,MOD(RC1+3,2)+MOD(INT((RC1+3)/2),3)*5+1,FALSE) -> 130|131|160|161|100 | H375: =HLOOKUP(Sheet1!R2C1,Sheet1!R2C1:R16C1,MOD(RC1+2,2)+MOD(INT((RC1+2)/2),3)*5+1,FALSE)&"|"&HLOOKUP(Sheet1!R2C1,Sheet1!R2C1:R16C1,MOD(RC1+3,2)+MOD(INT((RC1+3)/2),3)*5+1,FALSE)&"|"&HLOOKUP(Sheet1!R2C1,Sheet1!R2C1:R16C1,MOD(RC1+4,2)+MOD(INT((RC1+4)/2),3)*5+1,FALSE)&"|"&HLOOKUP(Sheet1!R2C1,Sheet1!R2C1:R16C1,MOD(RC1+5,2)+MOD(INT((RC1+5)/2),3)*5+1,FALSE)&"|"&HLOOKUP(Sheet1!R2C1,Sheet1!R2C1:R16C1,MOD(RC1+6,2)+MOD(INT((RC1+6)/2),3)*5+1,FALSE) -> 161|100|101|130|131 | I375: =HLOOKUP(Sheet1!R2C1,Sheet1!R2C1:R16C1,MOD(RC1-1,3)+MOD(INT((RC1-1)/3),3)*5+3,FALSE)&"|"&HLOOKUP(Sheet1!R2C1,Sheet1!R2C1:R16C1,MOD(RC1,3)+MOD(INT((RC1)/3),3)*5+3,FALSE)&"|"&HLOOKUP(Sheet1!R2C1,Sheet1!R2C1:R16C1,MOD(RC1+1,3)+MOD(INT((RC1+1)/3),3)*5+3,FALSE)&"|"&HLOOKUP(Sheet1!R2C1,Sheet1!R2C1:R16C1,MOD(RC1+2,3)+MOD(INT((RC1+2)/3),3)*5+3,FALSE)&"|"&HLOOKUP(Sheet1!R2C1,Sheet1!R2C1:R16C1,MOD(RC1+3,3)+MOD(INT((RC1+3)/3),3)*5+3,FALSE) -> 164|102|103|104|132 | J375: =HLOOKUP(Sheet1!R2C1,Sheet1!R2C1:R16C1,MOD(RC1-1,3)+MOD(INT((RC1-1)/3),3)*5+3,FALSE)&"|"&HLOOKUP(Sheet1!R2C1,Sheet1!R2C1:R16C1,MOD(RC1,3)+MOD(INT((RC1)/3),3)*5+3,FALSE)&"|"&HLOOKUP(Sheet1!R2C1,Sheet1!R2C1:R16C1,MOD(RC1+1,3)+MOD(INT((RC1+1)/3),3)*5+3,FALSE)&"|"&HLOOKUP(Sheet1!R2C1,Sheet1!R2C1:R16C1,MOD(RC1+2,3)+MOD(INT((RC1+2)/3),3)*5+3,FALSE)&"|"&HLOOKUP(Sheet1!R2C1,Sheet1!R2C1:R16C1,MOD(RC1+3,3)+MOD(INT((RC1+3)/3),3)*5+3,FALSE) -> 164|102|103|104|132 | K375: =HLOOKUP(Sheet1!R2C1,Sheet1!R2C1:R16C1,MOD(RC1-1,3)+MOD(INT((RC1-1)/3),3)*5+3,FALSE)&"|"&HLOOKUP(Sheet1!R2C1,Sheet1!R2C1:R16C1,MOD(RC1,3)+MOD(INT((RC1)/3),3)*5+3,FALSE)&"|"&HLOOKUP(Sheet1!R2C1,Sheet1!R2C1:R16C1,MOD(RC1+1,3)+MOD(INT((RC1+1)/3),3)*5+3,FALSE)&"|"&HLOOKUP(Sheet1!R2C1,Sheet1!R2C1:R16C1,MOD(RC1+2,3)+MOD(INT((RC1+2)/3),3)*5+3,FALSE)&"|"&HLOOKUP(Sheet1!R2C1,Sheet1!R2C1:R16C1,MOD(RC1+3,3)+MOD(INT((RC1+3)/3),3)*5+3,FALSE) -> 164|102|103|104|132 | L375: 25|22|23|24 | M375: 5009329|5009329|5009330|5009330 | N375: 10030|10031|10032|10033 | O375: 1|1|1|1 | P375: 2500|2500|2500|2500
A376: 370 | B376: 368 | C376: 30 | D376: =R[-20]C+2 -> 56 | E376: 1000 | F376: =MOD(RC[-5]-1,3)*30+100&"|"&MOD(RC[-5]-1,3)*30+101&"|"&MOD(RC[-5]-1,3)*30+102&"|"&MOD(RC[-5]-1,3)*30+103&"|"&IF(MOD(RC[-5],4)=0,HLOOKUP(Sheet1!R2C10,Sheet1!R2C10:R7C10,MOD(RC[-5]/4-1,6)+1,FALSE),IF(MOD(RC[-5],2)=0,IF(RC[-5]>20,HLOOKUP(Sheet1!R2C7,Sheet1!R2C7:R43C7,MOD(RC[-5]/2-1,42)+1,FALSE),HLOOKUP(Sheet1!R2C4,Sheet1!R2C4:R7C4,MOD(RC[-5]-1,6)+1,FALSE)),MOD(RC[-5]-1,3)*30+104)) -> 100|101|102|103|144 | G376: =HLOOKUP(Sheet1!R2C1,Sheet1!R2C1:R16C1,MOD(RC1-1,2)+MOD(INT((RC1-1)/2),3)*5+1,FALSE)&"|"&HLOOKUP(Sheet1!R2C1,Sheet1!R2C1:R16C1,MOD(RC1,2)+MOD(INT((RC1)/2),3)*5+1,FALSE)&"|"&HLOOKUP(Sheet1!R2C1,Sheet1!R2C1:R16C1,MOD(RC1+1,2)+MOD(INT((RC1+1)/2),3)*5+1,FALSE)&"|"&HLOOKUP(Sheet1!R2C1,Sheet1!R2C1:R16C1,MOD(RC1+2,2)+MOD(INT((RC1+2)/2),3)*5+1,FALSE)&"|"&HLOOKUP(Sheet1!R2C1,Sheet1!R2C1:R16C1,MOD(RC1+3,2)+MOD(INT((RC1+3)/2),3)*5+1,FALSE) -> 131|160|161|100|101 | H376: =HLOOKUP(Sheet1!R2C1,Sheet1!R2C1:R16C1,MOD(RC1+2,2)+MOD(INT((RC1+2)/2),3)*5+1,FALSE)&"|"&HLOOKUP(Sheet1!R2C1,Sheet1!R2C1:R16C1,MOD(RC1+3,2)+MOD(INT((RC1+3)/2),3)*5+1,FALSE)&"|"&HLOOKUP(Sheet1!R2C1,Sheet1!R2C1:R16C1,MOD(RC1+4,2)+MOD(INT((RC1+4)/2),3)*5+1,FALSE)&"|"&HLOOKUP(Sheet1!R2C1,Sheet1!R2C1:R16C1,MOD(RC1+5,2)+MOD(INT((RC1+5)/2),3)*5+1,FALSE)&"|"&HLOOKUP(Sheet1!R2C1,Sheet1!R2C1:R16C1,MOD(RC1+6,2)+MOD(INT((RC1+6)/2),3)*5+1,FALSE) -> 100|101|130|131|160 | I376: =HLOOKUP(Sheet1!R2C1,Sheet1!R2C1:R16C1,MOD(RC1-1,3)+MOD(INT((RC1-1)/3),3)*5+3,FALSE)&"|"&HLOOKUP(Sheet1!R2C1,Sheet1!R2C1:R16C1,MOD(RC1,3)+MOD(INT((RC1)/3),3)*5+3,FALSE)&"|"&HLOOKUP(Sheet1!R2C1,Sheet1!R2C1:R16C1,MOD(RC1+1,3)+MOD(INT((RC1+1)/3),3)*5+3,FALSE)&"|"&HLOOKUP(Sheet1!R2C1,Sheet1!R2C1:R16C1,MOD(RC1+2,3)+MOD(INT((RC1+2)/3),3)*5+3,FALSE)&"|"&HLOOKUP(Sheet1!R2C1,Sheet1!R2C1:R16C1,MOD(RC1+3,3)+MOD(INT((RC1+3)/3),3)*5+3,FALSE) -> 102|103|104|132|133 | J376: =HLOOKUP(Sheet1!R2C1,Sheet1!R2C1:R16C1,MOD(RC1-1,3)+MOD(INT((RC1-1)/3),3)*5+3,FALSE)&"|"&HLOOKUP(Sheet1!R2C1,Sheet1!R2C1:R16C1,MOD(RC1,3)+MOD(INT((RC1)/3),3)*5+3,FALSE)&"|"&HLOOKUP(Sheet1!R2C1,Sheet1!R2C1:R16C1,MOD(RC1+1,3)+MOD(INT((RC1+1)/3),3)*5+3,FALSE)&"|"&HLOOKUP(Sheet1!R2C1,Sheet1!R2C1:R16C1,MOD(RC1+2,3)+MOD(INT((RC1+2)/3),3)*5+3,FALSE)&"|"&HLOOKUP(Sheet1!R2C1,Sheet1!R2C1:R16C1,MOD(RC1+3,3)+MOD(INT((RC1+3)/3),3)*5+3,FALSE) -> 102|103|104|132|133 | K376: =HLOOKUP(Sheet1!R2C1,Sheet1!R2C1:R16C1,MOD(RC1-1,3)+MOD(INT((RC1-1)/3),3)*5+3,FALSE)&"|"&HLOOKUP(Sheet1!R2C1,Sheet1!R2C1:R16C1,MOD(RC1,3)+MOD(INT((RC1)/3),3)*5+3,FALSE)&"|"&HLOOKUP(Sheet1!R2C1,Sheet1!R2C1:R16C1,MOD(RC1+1,3)+MOD(INT((RC1+1)/3),3)*5+3,FALSE)&"|"&HLOOKUP(Sheet1!R2C1,Sheet1!R2C1:R16C1,MOD(RC1+2,3)+MOD(INT((RC1+2)/3),3)*5+3,FALSE)&"|"&HLOOKUP(Sheet1!R2C1,Sheet1!R2C1:R16C1,MOD(RC1+3,3)+MOD(INT((RC1+3)/3),3)*5+3,FALSE) -> 102|103|104|132|133 | L376: 25|22|23|24 | M376: 5054859|5054859|5054860|5054860 | N376: 10030|10031|10032|10033|10030|10031|10032|10033|10030|10031|10032|10033|10030|10031|10032|10033|10030|10031|10032|10033|10030|10031|10032|10033|10030|10031|10032|10033|10030|10031|10032|10033|10030|10031|10032|10033|10030|10031|10032|10033 | O376: 1|1|1|1|1|1|1|1|1|1|1|1|1|1|1|1|1|1|1|1|1|1|1|1|1|1|1|1|1|1|1|1|1|1|1|1|1|1|1|1 | P376: 2500|2500|2500|2500|2500|2500|2500|2500|2500|2500|2500|2500|2500|2500|2500|2500|2500|2500|2500|2500|2500|2500|2500|2500|2500|2500|2500|2500|2500|2500|2500|2500|2500|2500|2500|2500|2500|2500|2500|2500
A377: 371 | B377: 369 | C377: 30 | D377: =R[-20]C+2 -> 56 | E377: 1000 | F377: =MOD(RC[-5]-1,3)*30+100&"|"&MOD(RC[-5]-1,3)*30+101&"|"&MOD(RC[-5]-1,3)*30+102&"|"&MOD(RC[-5]-1,3)*30+103&"|"&IF(MOD(RC[-5],4)=0,HLOOKUP(Sheet1!R2C10,Sheet1!R2C10:R7C10,MOD(RC[-5]/4-1,6)+1,FALSE),IF(MOD(RC[-5],2)=0,IF(RC[-5]>20,HLOOKUP(Sheet1!R2C7,Sheet1!R2C7:R43C7,MOD(RC[-5]/2-1,42)+1,FALSE),HLOOKUP(Sheet1!R2C4,Sheet1!R2C4:R7C4,MOD(RC[-5]-1,6)+1,FALSE)),MOD(RC[-5]-1,3)*30+104)) -> 130|131|132|133|134 | G377: =HLOOKUP(Sheet1!R2C1,Sheet1!R2C1:R16C1,MOD(RC1-1,2)+MOD(INT((RC1-1)/2),3)*5+1,FALSE)&"|"&HLOOKUP(Sheet1!R2C1,Sheet1!R2C1:R16C1,MOD(RC1,2)+MOD(INT((RC1)/2),3)*5+1,FALSE)&"|"&HLOOKUP(Sheet1!R2C1,Sheet1!R2C1:R16C1,MOD(RC1+1,2)+MOD(INT((RC1+1)/2),3)*5+1,FALSE)&"|"&HLOOKUP(Sheet1!R2C1,Sheet1!R2C1:R16C1,MOD(RC1+2,2)+MOD(INT((RC1+2)/2),3)*5+1,FALSE)&"|"&HLOOKUP(Sheet1!R2C1,Sheet1!R2C1:R16C1,MOD(RC1+3,2)+MOD(INT((RC1+3)/2),3)*5+1,FALSE) -> 160|161|100|101|130 | H377: =HLOOKUP(Sheet1!R2C1,Sheet1!R2C1:R16C1,MOD(RC1+2,2)+MOD(INT((RC1+2)/2),3)*5+1,FALSE)&"|"&HLOOKUP(Sheet1!R2C1,Sheet1!R2C1:R16C1,MOD(RC1+3,2)+MOD(INT((RC1+3)/2),3)*5+1,FALSE)&"|"&HLOOKUP(Sheet1!R2C1,Sheet1!R2C1:R16C1,MOD(RC1+4,2)+MOD(INT((RC1+4)/2),3)*5+1,FALSE)&"|"&HLOOKUP(Sheet1!R2C1,Sheet1!R2C1:R16C1,MOD(RC1+5,2)+MOD(INT((RC1+5)/2),3)*5+1,FALSE)&"|"&HLOOKUP(Sheet1!R2C1,Sheet1!R2C1:R16C1,MOD(RC1+6,2)+MOD(INT((RC1+6)/2),3)*5+1,FALSE) -> 101|130|131|160|161 | I377: =HLOOKUP(Sheet1!R2C1,Sheet1!R2C1:R16C1,MOD(RC1-1,3)+MOD(INT((RC1-1)/3),3)*5+3,FALSE)&"|"&HLOOKUP(Sheet1!R2C1,Sheet1!R2C1:R16C1,MOD(RC1,3)+MOD(INT((RC1)/3),3)*5+3,FALSE)&"|"&HLOOKUP(Sheet1!R2C1,Sheet1!R2C1:R16C1,MOD(RC1+1,3)+MOD(INT((RC1+1)/3),3)*5+3,FALSE)&"|"&HLOOKUP(Sheet1!R2C1,Sheet1!R2C1:R16C1,MOD(RC1+2,3)+MOD(INT((RC1+2)/3),3)*5+3,FALSE)&"|"&HLOOKUP(Sheet1!R2C1,Sheet1!R2C1:R16C1,MOD(RC1+3,3)+MOD(INT((RC1+3)/3),3)*5+3,FALSE) -> 103|104|132|133|134 | J377: =HLOOKUP(Sheet1!R2C1,Sheet1!R2C1:R16C1,MOD(RC1-1,3)+MOD(INT((RC1-1)/3),3)*5+3,FALSE)&"|"&HLOOKUP(Sheet1!R2C1,Sheet1!R2C1:R16C1,MOD(RC1,3)+MOD(INT((RC1)/3),3)*5+3,FALSE)&"|"&HLOOKUP(Sheet1!R2C1,Sheet1!R2C1:R16C1,MOD(RC1+1,3)+MOD(INT((RC1+1)/3),3)*5+3,FALSE)&"|"&HLOOKUP(Sheet1!R2C1,Sheet1!R2C1:R16C1,MOD(RC1+2,3)+MOD(INT((RC1+2)/3),3)*5+3,FALSE)&"|"&HLOOKUP(Sheet1!R2C1,Sheet1!R2C1:R16C1,MOD(RC1+3,3)+MOD(INT((RC1+3)/3),3)*5+3,FALSE) -> 103|104|132|133|134 | K377: =HLOOKUP(Sheet1!R2C1,Sheet1!R2C1:R16C1,MOD(RC1-1,3)+MOD(INT((RC1-1)/3),3)*5+3,FALSE)&"|"&HLOOKUP(Sheet1!R2C1,Sheet1!R2C1:R16C1,MOD(RC1,3)+MOD(INT((RC1)/3),3)*5+3,FALSE)&"|"&HLOOKUP(Sheet1!R2C1,Sheet1!R2C1:R16C1,MOD(RC1+1,3)+MOD(INT((RC1+1)/3),3)*5+3,FALSE)&"|"&HLOOKUP(Sheet1!R2C1,Sheet1!R2C1:R16C1,MOD(RC1+2,3)+MOD(INT((RC1+2)/3),3)*5+3,FALSE)&"|"&HLOOKUP(Sheet1!R2C1,Sheet1!R2C1:R16C1,MOD(RC1+3,3)+MOD(INT((RC1+3)/3),3)*5+3,FALSE) -> 103|104|132|133|134 | L377: 25|22|23|24 | M377: 5098568|5098568|5098568|5098568 | N377: 10030|10031|10032|10033 | O377: 1|1|1|1 | P377: 2500|2500|2500|2500
A378: 372 | B378: 370 | C378: 30 | D378: =R[-20]C+2 -> 56 | E378: 1000 | F378: =MOD(RC[-5]-1,3)*30+100&"|"&MOD(RC[-5]-1,3)*30+101&"|"&MOD(RC[-5]-1,3)*30+102&"|"&MOD(RC[-5]-1,3)*30+103&"|"&IF(MOD(RC[-5],4)=0,HLOOKUP(Sheet1!R2C10,Sheet1!R2C10:R7C10,MOD(RC[-5]/4-1,6)+1,FALSE),IF(MOD(RC[-5],2)=0,IF(RC[-5]>20,HLOOKUP(Sheet1!R2C7,Sheet1!R2C7:R43C7,MOD(RC[-5]/2-1,42)+1,FALSE),HLOOKUP(Sheet1!R2C4,Sheet1!R2C4:R7C4,MOD(RC[-5]-1,6)+1,FALSE)),MOD(RC[-5]-1,3)*30+104)) -> 160|161|162|163|192 | G378: =HLOOKUP(Sheet1!R2C1,Sheet1!R2C1:R16C1,MOD(RC1-1,2)+MOD(INT((RC1-1)/2),3)*5+1,FALSE)&"|"&HLOOKUP(Sheet1!R2C1,Sheet1!R2C1:R16C1,MOD(RC1,2)+MOD(INT((RC1)/2),3)*5+1,FALSE)&"|"&HLOOKUP(Sheet1!R2C1,Sheet1!R2C1:R16C1,MOD(RC1+1,2)+MOD(INT((RC1+1)/2),3)*5+1,FALSE)&"|"&HLOOKUP(Sheet1!R2C1,Sheet1!R2C1:R16C1,MOD(RC1+2,2)+MOD(INT((RC1+2)/2),3)*5+1,FALSE)&"|"&HLOOKUP(Sheet1!R2C1,Sheet1!R2C1:R16C1,MOD(RC1+3,2)+MOD(INT((RC1+3)/2),3)*5+1,FALSE) -> 161|100|101|130|131 | H378: =HLOOKUP(Sheet1!R2C1,Sheet1!R2C1:R16C1,MOD(RC1+2,2)+MOD(INT((RC1+2)/2),3)*5+1,FALSE)&"|"&HLOOKUP(Sheet1!R2C1,Sheet1!R2C1:R16C1,MOD(RC1+3,2)+MOD(INT((RC1+3)/2),3)*5+1,FALSE)&"|"&HLOOKUP(Sheet1!R2C1,Sheet1!R2C1:R16C1,MOD(RC1+4,2)+MOD(INT((RC1+4)/2),3)*5+1,FALSE)&"|"&HLOOKUP(Sheet1!R2C1,Sheet1!R2C1:R16C1,MOD(RC1+5,2)+MOD(INT((RC1+5)/2),3)*5+1,FALSE)&"|"&HLOOKUP(Sheet1!R2C1,Sheet1!R2C1:R16C1,MOD(RC1+6,2)+MOD(INT((RC1+6)/2),3)*5+1,FALSE) -> 130|131|160|161|100 | I378: =HLOOKUP(Sheet1!R2C1,Sheet1!R2C1:R16C1,MOD(RC1-1,3)+MOD(INT((RC1-1)/3),3)*5+3,FALSE)&"|"&HLOOKUP(Sheet1!R2C1,Sheet1!R2C1:R16C1,MOD(RC1,3)+MOD(INT((RC1)/3),3)*5+3,FALSE)&"|"&HLOOKUP(Sheet1!R2C1,Sheet1!R2C1:R16C1,MOD(RC1+1,3)+MOD(INT((RC1+1)/3),3)*5+3,FALSE)&"|"&HLOOKUP(Sheet1!R2C1,Sheet1!R2C1:R16C1,MOD(RC1+2,3)+MOD(INT((RC1+2)/3),3)*5+3,FALSE)&"|"&HLOOKUP(Sheet1!R2C1,Sheet1!R2C1:R16C1,MOD(RC1+3,3)+MOD(INT((RC1+3)/3),3)*5+3,FALSE) -> 104|132|133|134|162 | J378: =HLOOKUP(Sheet1!R2C1,Sheet1!R2C1:R16C1,MOD(RC1-1,3)+MOD(INT((RC1-1)/3),3)*5+3,FALSE)&"|"&HLOOKUP(Sheet1!R2C1,Sheet1!R2C1:R16C1,MOD(RC1,3)+MOD(INT((RC1)/3),3)*5+3,FALSE)&"|"&HLOOKUP(Sheet1!R2C1,Sheet1!R2C1:R16C1,MOD(RC1+1,3)+MOD(INT((RC1+1)/3),3)*5+3,FALSE)&"|"&HLOOKUP(Sheet1!R2C1,Sheet1!R2C1:R16C1,MOD(RC1+2,3)+MOD(INT((RC1+2)/3),3)*5+3,FALSE)&"|"&HLOOKUP(Sheet1!R2C1,Sheet1!R2C1:R16C1,MOD(RC1+3,3)+MOD(INT((RC1+3)/3),3)*5+3,FALSE) -> 104|132|133|134|162 | K378: =HLOOKUP(Sheet1!R2C1,Sheet1!R2C1:R16C1,MOD(RC1-1,3)+MOD(INT((RC1-1)/3),3)*5+3,FALSE)&"|"&HLOOKUP(Sheet1!R2C1,Sheet1!R2C1:R16C1,MOD(RC1,3)+MOD(INT((RC1)/3),3)*5+3,FALSE)&"|"&HLOOKUP(Sheet1!R2C1,Sheet1!R2C1:R16C1,MOD(RC1+1,3)+MOD(INT((RC1+1)/3),3)*5+3,FALSE)&"|"&HLOOKUP(Sheet1!R2C1,Sheet1!R2C1:R16C1,MOD(RC1+2,3)+MOD(INT((RC1+2)/3),3)*5+3,FALSE)&"|"&HLOOKUP(Sheet1!R2C1,Sheet1!R2C1:R16C1,MOD(RC1+3,3)+MOD(INT((RC1+3)/3),3)*5+3,FALSE) -> 104|132|133|134|162 | L378: 25|22|23|24 | M378: 5144097|5144098|5144098|5144098 | N378: 10030|10031|10032|10033 | O378: 1|1|1|1 | P378: 2500|2500|2500|2500
A379: 373 | B379: 371 | C379: 30 | D379: =R[-20]C+2 -> 56 | E379: 1000 | F379: =MOD(RC[-5]-1,3)*30+100&"|"&MOD(RC[-5]-1,3)*30+101&"|"&MOD(RC[-5]-1,3)*30+102&"|"&MOD(RC[-5]-1,3)*30+103&"|"&IF(MOD(RC[-5],4)=0,HLOOKUP(Sheet1!R2C10,Sheet1!R2C10:R7C10,MOD(RC[-5]/4-1,6)+1,FALSE),IF(MOD(RC[-5],2)=0,IF(RC[-5]>20,HLOOKUP(Sheet1!R2C7,Sheet1!R2C7:R43C7,MOD(RC[-5]/2-1,42)+1,FALSE),HLOOKUP(Sheet1!R2C4,Sheet1!R2C4:R7C4,MOD(RC[-5]-1,6)+1,FALSE)),MOD(RC[-5]-1,3)*30+104)) -> 100|101|102|103|104 | G379: =HLOOKUP(Sheet1!R2C1,Sheet1!R2C1:R16C1,MOD(RC1-1,2)+MOD(INT((RC1-1)/2),3)*5+1,FALSE)&"|"&HLOOKUP(Sheet1!R2C1,Sheet1!R2C1:R16C1,MOD(RC1,2)+MOD(INT((RC1)/2),3)*5+1,FALSE)&"|"&HLOOKUP(Sheet1!R2C1,Sheet1!R2C1:R16C1,MOD(RC1+1,2)+MOD(INT((RC1+1)/2),3)*5+1,FALSE)&"|"&HLOOKUP(Sheet1!R2C1,Sheet1!R2C1:R16C1,MOD(RC1+2,2)+MOD(INT((RC1+2)/2),3)*5+1,FALSE)&"|"&HLOOKUP(Sheet1!R2C1,Sheet1!R2C1:R16C1,MOD(RC1+3,2)+MOD(INT((RC1+3)/2),3)*5+1,FALSE) -> 100|101|130|131|160 | H379: =HLOOKUP(Sheet1!R2C1,Sheet1!R2C1:R16C1,MOD(RC1+2,2)+MOD(INT((RC1+2)/2),3)*5+1,FALSE)&"|"&HLOOKUP(Sheet1!R2C1,Sheet1!R2C1:R16C1,MOD(RC1+3,2)+MOD(INT((RC1+3)/2),3)*5+1,FALSE)&"|"&HLOOKUP(Sheet1!R2C1,Sheet1!R2C1:R16C1,MOD(RC1+4,2)+MOD(INT((RC1+4)/2),3)*5+1,FALSE)&"|"&HLOOKUP(Sheet1!R2C1,Sheet1!R2C1:R16C1,MOD(RC1+5,2)+MOD(INT((RC1+5)/2),3)*5+1,FALSE)&"|"&HLOOKUP(Sheet1!R2C1,Sheet1!R2C1:R16C1,MOD(RC1+6,2)+MOD(INT((RC1+6)/2),3)*5+1,FALSE) -> 131|160|161|100|101 | I379: =HLOOKUP(Sheet1!R2C1,Sheet1!R2C1:R16C1,MOD(RC1-1,3)+MOD(INT((RC1-1)/3),3)*5+3,FALSE)&"|"&HLOOKUP(Sheet1!R2C1,Sheet1!R2C1:R16C1,MOD(RC1,3)+MOD(INT((RC1)/3),3)*5+3,FALSE)&"|"&HLOOKUP(Sheet1!R2C1,Sheet1!R2C1:R16C1,MOD(RC1+1,3)+MOD(INT((RC1+1)/3),3)*5+3,FALSE)&"|"&HLOOKUP(Sheet1!R2C1,Sheet1!R2C1:R16C1,MOD(RC1+2,3)+MOD(INT((RC1+2)/3),3)*5+3,FALSE)&"|"&HLOOKUP(Sheet1!R2C1,Sheet1!R2C1:R16C1,MOD(RC1+3,3)+MOD(INT((RC1+3)/3),3)*5+3,FALSE) -> 132|133|134|162|163 | J379: =HLOOKUP(Sheet1!R2C1,Sheet1!R2C1:R16C1,MOD(RC1-1,3)+MOD(INT((RC1-1)/3),3)*5+3,FALSE)&"|"&HLOOKUP(Sheet1!R2C1,Sheet1!R2C1:R16C1,MOD(RC1,3)+MOD(INT((RC1)/3),3)*5+3,FALSE)&"|"&HLOOKUP(Sheet1!R2C1,Sheet1!R2C1:R16C1,MOD(RC1+1,3)+MOD(INT((RC1+1)/3),3)*5+3,FALSE)&"|"&HLOOKUP(Sheet1!R2C1,Sheet1!R2C1:R16C1,MOD(RC1+2,3)+MOD(INT((RC1+2)/3),3)*5+3,FALSE)&"|"&HLOOKUP(Sheet1!R2C1,Sheet1!R2C1:R16C1,MOD(RC1+3,3)+MOD(INT((RC1+3)/3),3)*5+3,FALSE) -> 132|133|134|162|163 | K379: =HLOOKUP(Sheet1!R2C1,Sheet1!R2C1:R16C1,MOD(RC1-1,3)+MOD(INT((RC1-1)/3),3)*5+3,FALSE)&"|"&HLOOKUP(Sheet1!R2C1,Sheet1!R2C1:R16C1,MOD(RC1,3)+MOD(INT((RC1)/3),3)*5+3,FALSE)&"|"&HLOOKUP(Sheet1!R2C1,Sheet1!R2C1:R16C1,MOD(RC1+1,3)+MOD(INT((RC1+1)/3),3)*5+3,FALSE)&"|"&HLOOKUP(Sheet1!R2C1,Sheet1!R2C1:R16C1,MOD(RC1+2,3)+MOD(INT((RC1+2)/3),3)*5+3,FALSE)&"|"&HLOOKUP(Sheet1!R2C1,Sheet1!R2C1:R16C1,MOD(RC1+3,3)+MOD(INT((RC1+3)/3),3)*5+3,FALSE) -> 132|133|134|162|163 | L379: 25|22|23|24 | M379: 5188630|5188630|5188630|5188630 | N379: 10030|10031|10032|10033 | O379: 1|1|1|1 | P379: 2500|2500|2500|2500
A380: 374 | B380: 372 | C380: 30 | D380: =R[-20]C+2 -> 56 | E380: 1000 | F380: =MOD(RC[-5]-1,3)*30+100&"|"&MOD(RC[-5]-1,3)*30+101&"|"&MOD(RC[-5]-1,3)*30+102&"|"&MOD(RC[-5]-1,3)*30+103&"|"&IF(MOD(RC[-5],4)=0,HLOOKUP(Sheet1!R2C10,Sheet1!R2C10:R7C10,MOD(RC[-5]/4-1,6)+1,FALSE),IF(MOD(RC[-5],2)=0,IF(RC[-5]>20,HLOOKUP(Sheet1!R2C7,Sheet1!R2C7:R43C7,MOD(RC[-5]/2-1,42)+1,FALSE),HLOOKUP(Sheet1!R2C4,Sheet1!R2C4:R7C4,MOD(RC[-5]-1,6)+1,FALSE)),MOD(RC[-5]-1,3)*30+104)) -> 130|131|132|133|146 | G380: =HLOOKUP(Sheet1!R2C1,Sheet1!R2C1:R16C1,MOD(RC1-1,2)+MOD(INT((RC1-1)/2),3)*5+1,FALSE)&"|"&HLOOKUP(Sheet1!R2C1,Sheet1!R2C1:R16C1,MOD(RC1,2)+MOD(INT((RC1)/2),3)*5+1,FALSE)&"|"&HLOOKUP(Sheet1!R2C1,Sheet1!R2C1:R16C1,MOD(RC1+1,2)+MOD(INT((RC1+1)/2),3)*5+1,FALSE)&"|"&HLOOKUP(Sheet1!R2C1,Sheet1!R2C1:R16C1,MOD(RC1+2,2)+MOD(INT((RC1+2)/2),3)*5+1,FALSE)&"|"&HLOOKUP(Sheet1!R2C1,Sheet1!R2C1:R16C1,MOD(RC1+3,2)+MOD(INT((RC1+3)/2),3)*5+1,FALSE) -> 101|130|131|160|161 | H380: =HLOOKUP(Sheet1!R2C1,Sheet1!R2C1:R16C1,MOD(RC1+2,2)+MOD(INT((RC1+2)/2),3)*5+1,FALSE)&"|"&HLOOKUP(Sheet1!R2C1,Sheet1!R2C1:R16C1,MOD(RC1+3,2)+MOD(INT((RC1+3)/2),3)*5+1,FALSE)&"|"&HLOOKUP(Sheet1!R2C1,Sheet1!R2C1:R16C1,MOD(RC1+4,2)+MOD(INT((RC1+4)/2),3)*5+1,FALSE)&"|"&HLOOKUP(Sheet1!R2C1,Sheet1!R2C1:R16C1,MOD(RC1+5,2)+MOD(INT((RC1+5)/2),3)*5+1,FALSE)&"|"&HLOOKUP(Sheet1!R2C1,Sheet1!R2C1:R16C1,MOD(RC1+6,2)+MOD(INT((RC1+6)/2),3)*5+1,FALSE) -> 160|161|100|101|130 | I380: =HLOOKUP(Sheet1!R2C1,Sheet1!R2C1:R16C1,MOD(RC1-1,3)+MOD(INT((RC1-1)/3),3)*5+3,FALSE)&"|"&HLOOKUP(Sheet1!R2C1,Sheet1!R2C1:R16C1,MOD(RC1,3)+MOD(INT((RC1)/3),3)*5+3,FALSE)&"|"&HLOOKUP(Sheet1!R2C1,Sheet1!R2C1:R16C1,MOD(RC1+1,3)+MOD(INT((RC1+1)/3),3)*5+3,FALSE)&"|"&HLOOKUP(Sheet1!R2C1,Sheet1!R2C1:R16C1,MOD(RC1+2,3)+MOD(INT((RC1+2)/3),3)*5+3,FALSE)&"|"&HLOOKUP(Sheet1!R2C1,Sheet1!R2C1:R16C1,MOD(RC1+3,3)+MOD(INT((RC1+3)/3),3)*5+3,FALSE) -> 133|134|162|163|164 | J380: =HLOOKUP(Sheet1!R2C1,Sheet1!R2C1:R16C1,MOD(RC1-1,3)+MOD(INT((RC1-1)/3),3)*5+3,FALSE)&"|"&HLOOKUP(Sheet1!R2C1,Sheet1!R2C1:R16C1,MOD(RC1,3)+MOD(INT((RC1)/3),3)*5+3,FALSE)&"|"&HLOOKUP(Sheet1!R2C1,Sheet1!R2C1:R16C1,MOD(RC1+1,3)+MOD(INT((RC1+1)/3),3)*5+3,FALSE)&"|"&HLOOKUP(Sheet1!R2C1,Sheet1!R2C1:R16C1,MOD(RC1+2,3)+MOD(INT((RC1+2)/3),3)*5+3,FALSE)&"|"&HLOOKUP(Sheet1!R2C1,Sheet1!R2C1:R16C1,MOD(RC1+3,3)+MOD(INT((RC1+3)/3),3)*5+3,FALSE) -> 133|134|162|163|164 | K380: =HLOOKUP(Sheet1!R2C1,Sheet1!R2C1:R16C1,MOD(RC1-1,3)+MOD(INT((RC1-1)/3),3)*5+3,FALSE)&"|"&HLOOKUP(Sheet1!R2C1,Sheet1!R2C1:R16C1,MOD(RC1,3)+MOD(INT((RC1)/3),3)*5+3,FALSE)&"|"&HLOOKUP(Sheet1!R2C1,Sheet1!R2C1:R16C1,MOD(RC1+1,3)+MOD(INT((RC1+1)/3),3)*5+3,FALSE)&"|"&HLOOKUP(Sheet1!R2C1,Sheet1!R2C1:R16C1,MOD(RC1+2,3)+MOD(INT((RC1+2)/3),3)*5+3,FALSE)&"|"&HLOOKUP(Sheet1!R2C1,Sheet1!R2C1:R16C1,MOD(RC1+3,3)+MOD(INT((RC1+3)/3),3)*5+3,FALSE) -> 133|134|162|163|164 | L380: 25|22|23|24 | M380: 5235876|5235876|5235875|5235875 | N380: 10030|10031|10032|10033 | O380: 1|1|1|1 | P380: 2500|2500|2500|2500
A381: 375 | B381: 373 | C381: 30 | D381: =R[-20]C+2 -> 56 | E381: 1000 | F381: =MOD(RC[-5]-1,3)*30+100&"|"&MOD(RC[-5]-1,3)*30+101&"|"&MOD(RC[-5]-1,3)*30+102&"|"&MOD(RC[-5]-1,3)*30+103&"|"&IF(MOD(RC[-5],4)=0,HLOOKUP(Sheet1!R2C10,Sheet1!R2C10:R7C10,MOD(RC[-5]/4-1,6)+1,FALSE),IF(MOD(RC[-5],2)=0,IF(RC[-5]>20,HLOOKUP(Sheet1!R2C7,Sheet1!R2C7:R43C7,MOD(RC[-5]/2-1,42)+1,FALSE),HLOOKUP(Sheet1!R2C4,Sheet1!R2C4:R7C4,MOD(RC[-5]-1,6)+1,FALSE)),MOD(RC[-5]-1,3)*30+104)) -> 160|161|162|163|164 | G381: =HLOOKUP(Sheet1!R2C1,Sheet1!R2C1:R16C1,MOD(RC1-1,2)+MOD(INT((RC1-1)/2),3)*5+1,FALSE)&"|"&HLOOKUP(Sheet1!R2C1,Sheet1!R2C1:R16C1,MOD(RC1,2)+MOD(INT((RC1)/2),3)*5+1,FALSE)&"|"&HLOOKUP(Sheet1!R2C1,Sheet1!R2C1:R16C1,MOD(RC1+1,2)+MOD(INT((RC1+1)/2),3)*5+1,FALSE)&"|"&HLOOKUP(Sheet1!R2C1,Sheet1!R2C1:R16C1,MOD(RC1+2,2)+MOD(INT((RC1+2)/2),3)*5+1,FALSE)&"|"&HLOOKUP(Sheet1!R2C1,Sheet1!R2C1:R16C1,MOD(RC1+3,2)+MOD(INT((RC1+3)/2),3)*5+1,FALSE) -> 130|131|160|161|100 | H381: =HLOOKUP(Sheet1!R2C1,Sheet1!R2C1:R16C1,MOD(RC1+2,2)+MOD(INT((RC1+2)/2),3)*5+1,FALSE)&"|"&HLOOKUP(Sheet1!R2C1,Sheet1!R2C1:R16C1,MOD(RC1+3,2)+MOD(INT((RC1+3)/2),3)*5+1,FALSE)&"|"&HLOOKUP(Sheet1!R2C1,Sheet1!R2C1:R16C1,MOD(RC1+4,2)+MOD(INT((RC1+4)/2),3)*5+1,FALSE)&"|"&HLOOKUP(Sheet1!R2C1,Sheet1!R2C1:R16C1,MOD(RC1+5,2)+MOD(INT((RC1+5)/2),3)*5+1,FALSE)&"|"&HLOOKUP(Sheet1!R2C1,Sheet1!R2C1:R16C1,MOD(RC1+6,2)+MOD(INT((RC1+6)/2),3)*5+1,FALSE) -> 161|100|101|130|131 | I381: =HLOOKUP(Sheet1!R2C1,Sheet1!R2C1:R16C1,MOD(RC1-1,3)+MOD(INT((RC1-1)/3),3)*5+3,FALSE)&"|"&HLOOKUP(Sheet1!R2C1,Sheet1!R2C1:R16C1,MOD(RC1,3)+MOD(INT((RC1)/3),3)*5+3,FALSE)&"|"&HLOOKUP(Sheet1!R2C1,Sheet1!R2C1:R16C1,MOD(RC1+1,3)+MOD(INT((RC1+1)/3),3)*5+3,FALSE)&"|"&HLOOKUP(Sheet1!R2C1,Sheet1!R2C1:R16C1,MOD(RC1+2,3)+MOD(INT((RC1+2)/3),3)*5+3,FALSE)&"|"&HLOOKUP(Sheet1!R2C1,Sheet1!R2C1:R16C1,MOD(RC1+3,3)+MOD(INT((RC1+3)/3),3)*5+3,FALSE) -> 134|162|163|164|102 | J381: =HLOOKUP(Sheet1!R2C1,Sheet1!R2C1:R16C1,MOD(RC1-1,3)+MOD(INT((RC1-1)/3),3)*5+3,FALSE)&"|"&HLOOKUP(Sheet1!R2C1,Sheet1!R2C1:R16C1,MOD(RC1,3)+MOD(INT((RC1)/3),3)*5+3,FALSE)&"|"&HLOOKUP(Sheet1!R2C1,Sheet1!R2C1:R16C1,MOD(RC1+1,3)+MOD(INT((RC1+1)/3),3)*5+3,FALSE)&"|"&HLOOKUP(Sheet1!R2C1,Sheet1!R2C1:R16C1,MOD(RC1+2,3)+MOD(INT((RC1+2)/3),3)*5+3,FALSE)&"|"&HLOOKUP(Sheet1!R2C1,Sheet1!R2C1:R16C1,MOD(RC1+3,3)+MOD(INT((RC1+3)/3),3)*5+3,FALSE) -> 134|162|163|164|102 | K381: =HLOOKUP(Sheet1!R2C1,Sheet1!R2C1:R16C1,MOD(RC1-1,3)+MOD(INT((RC1-1)/3),3)*5+3,FALSE)&"|"&HLOOKUP(Sheet1!R2C1,Sheet1!R2C1:R16C1,MOD(RC1,3)+MOD(INT((RC1)/3),3)*5+3,FALSE)&"|"&HLOOKUP(Sheet1!R2C1,Sheet1!R2C1:R16C1,MOD(RC1+1,3)+MOD(INT((RC1+1)/3),3)*5+3,FALSE)&"|"&HLOOKUP(Sheet1!R2C1,Sheet1!R2C1:R16C1,MOD(RC1+2,3)+MOD(INT((RC1+2)/3),3)*5+3,FALSE)&"|"&HLOOKUP(Sheet1!R2C1,Sheet1!R2C1:R16C1,MOD(RC1+3,3)+MOD(INT((RC1+3)/3),3)*5+3,FALSE) -> 134|162|163|164|102 | L381: 25|22|23|24 | M381: 5281232|5281231|5281233|5281233 | N381: 10030|10031|10032|10033|10030|10031|10032|10033|10030|10031|10032|10033|10030|10031|10032|10033|10030|10031|10032|10033|10030|10031|10032|10033|10030|10031|10032|10033|10030|10031|10032|10033|10030|10031|10032|10033|10030|10031|10032|10033 | O381: 1|1|1|1|1|1|1|1|1|1|1|1|1|1|1|1|1|1|1|1|1|1|1|1|1|1|1|1|1|1|1|1|1|1|1|1|1|1|1|1 | P381: 2500|2500|2500|2500|2500|2500|2500|2500|2500|2500|2500|2500|2500|2500|2500|2500|2500|2500|2500|2500|2500|2500|2500|2500|2500|2500|2500|2500|2500|2500|2500|2500|2500|2500|2500|2500|2500|2500|2500|2500
A382: 376 | B382: 374 | C382: 30 | D382: =R[-20]C+2 -> 56 | E382: 1000 | F382: =MOD(RC[-5]-1,3)*30+100&"|"&MOD(RC[-5]-1,3)*30+101&"|"&MOD(RC[-5]-1,3)*30+102&"|"&MOD(RC[-5]-1,3)*30+103&"|"&IF(MOD(RC[-5],4)=0,HLOOKUP(Sheet1!R2C10,Sheet1!R2C10:R7C10,MOD(RC[-5]/4-1,6)+1,FALSE),IF(MOD(RC[-5],2)=0,IF(RC[-5]>20,HLOOKUP(Sheet1!R2C7,Sheet1!R2C7:R43C7,MOD(RC[-5]/2-1,42)+1,FALSE),HLOOKUP(Sheet1!R2C4,Sheet1!R2C4:R7C4,MOD(RC[-5]-1,6)+1,FALSE)),MOD(RC[-5]-1,3)*30+104)) -> 100|101|102|103|193 | G382: =HLOOKUP(Sheet1!R2C1,Sheet1!R2C1:R16C1,MOD(RC1-1,2)+MOD(INT((RC1-1)/2),3)*5+1,FALSE)&"|"&HLOOKUP(Sheet1!R2C1,Sheet1!R2C1:R16C1,MOD(RC1,2)+MOD(INT((RC1)/2),3)*5+1,FALSE)&"|"&HLOOKUP(Sheet1!R2C1,Sheet1!R2C1:R16C1,MOD(RC1+1,2)+MOD(INT((RC1+1)/2),3)*5+1,FALSE)&"|"&HLOOKUP(Sheet1!R2C1,Sheet1!R2C1:R16C1,MOD(RC1+2,2)+MOD(INT((RC1+2)/2),3)*5+1,FALSE)&"|"&HLOOKUP(Sheet1!R2C1,Sheet1!R2C1:R16C1,MOD(RC1+3,2)+MOD(INT((RC1+3)/2),3)*5+1,FALSE) -> 131|160|161|100|101 | H382: =HLOOKUP(Sheet1!R2C1,Sheet1!R2C1:R16C1,MOD(RC1+2,2)+MOD(INT((RC1+2)/2),3)*5+1,FALSE)&"|"&HLOOKUP(Sheet1!R2C1,Sheet1!R2C1:R16C1,MOD(RC1+3,2)+MOD(INT((RC1+3)/2),3)*5+1,FALSE)&"|"&HLOOKUP(Sheet1!R2C1,Sheet1!R2C1:R16C1,MOD(RC1+4,2)+MOD(INT((RC1+4)/2),3)*5+1,FALSE)&"|"&HLOOKUP(Sheet1!R2C1,Sheet1!R2C1:R16C1,MOD(RC1+5,2)+MOD(INT((RC1+5)/2),3)*5+1,FALSE)&"|"&HLOOKUP(Sheet1!R2C1,Sheet1!R2C1:R16C1,MOD(RC1+6,2)+MOD(INT((RC1+6)/2),3)*5+1,FALSE) -> 100|101|130|131|160 | I382: =HLOOKUP(Sheet1!R2C1,Sheet1!R2C1:R16C1,MOD(RC1-1,3)+MOD(INT((RC1-1)/3),3)*5+3,FALSE)&"|"&HLOOKUP(Sheet1!R2C1,Sheet1!R2C1:R16C1,MOD(RC1,3)+MOD(INT((RC1)/3),3)*5+3,FALSE)&"|"&HLOOKUP(Sheet1!R2C1,Sheet1!R2C1:R16C1,MOD(RC1+1,3)+MOD(INT((RC1+1)/3),3)*5+3,FALSE)&"|"&HLOOKUP(Sheet1!R2C1,Sheet1!R2C1:R16C1,MOD(RC1+2,3)+MOD(INT((RC1+2)/3),3)*5+3,FALSE)&"|"&HLOOKUP(Sheet1!R2C1,Sheet1!R2C1:R16C1,MOD(RC1+3,3)+MOD(INT((RC1+3)/3),3)*5+3,FALSE) -> 162|163|164|102|103 | J382: =HLOOKUP(Sheet1!R2C1,Sheet1!R2C1:R16C1,MOD(RC1-1,3)+MOD(INT((RC1-1)/3),3)*5+3,FALSE)&"|"&HLOOKUP(Sheet1!R2C1,Sheet1!R2C1:R16C1,MOD(RC1,3)+MOD(INT((RC1)/3),3)*5+3,FALSE)&"|"&HLOOKUP(Sheet1!R2C1,Sheet1!R2C1:R16C1,MOD(RC1+1,3)+MOD(INT((RC1+1)/3),3)*5+3,FALSE)&"|"&HLOOKUP(Sheet1!R2C1,Sheet1!R2C1:R16C1,MOD(RC1+2,3)+MOD(INT((RC1+2)/3),3)*5+3,FALSE)&"|"&HLOOKUP(Sheet1!R2C1,Sheet1!R2C1:R16C1,MOD(RC1+3,3)+MOD(INT((RC1+3)/3),3)*5+3,FALSE) -> 162|163|164|102|103 | K382: =HLOOKUP(Sheet1!R2C1,Sheet1!R2C1:R16C1,MOD(RC1-1,3)+MOD(INT((RC1-1)/3),3)*5+3,FALSE)&"|"&HLOOKUP(Sheet1!R2C1,Sheet1!R2C1:R16C1,MOD(RC1,3)+MOD(INT((RC1)/3),3)*5+3,FALSE)&"|"&HLOOKUP(Sheet1!R2C1,Sheet1!R2C1:R16C1,MOD(RC1+1,3)+MOD(INT((RC1+1)/3),3)*5+3,FALSE)&"|"&HLOOKUP(Sheet1!R2C1,Sheet1!R2C1:R16C1,MOD(RC1+2,3)+MOD(INT((RC1+2)/3),3)*5+3,FALSE)&"|"&HLOOKUP(Sheet1!R2C1,Sheet1!R2C1:R16C1,MOD(RC1+3,3)+MOD(INT((RC1+3)/3),3)*5+3,FALSE) -> 162|163|164|102|103 | L382: 25|22|23|24 | M382: 5328478|5328478|5328478|5328478 | N382: 10030|10031|10032|10033 | O382: 1|1|1|1 | P382: 2500|2500|2500|2500
A383: 377 | B383: 375 | C383: 30 | D383: =R[-20]C+2 -> 56 | E383: 1000 | F383: =MOD(RC[-5]-1,3)*30+100&"|"&MOD(RC[-5]-1,3)*30+101&"|"&MOD(RC[-5]-1,3)*30+102&"|"&MOD(RC[-5]-1,3)*30+103&"|"&IF(MOD(RC[-5],4)=0,HLOOKUP(Sheet1!R2C10,Sheet1!R2C10:R7C10,MOD(RC[-5]/4-1,6)+1,FALSE),IF(MOD(RC[-5],2)=0,IF(RC[-5]>20,HLOOKUP(Sheet1!R2C7,Sheet1!R2C7:R43C7,MOD(RC[-5]/2-1,42)+1,FALSE),HLOOKUP(Sheet1!R2C4,Sheet1!R2C4:R7C4,MOD(RC[-5]-1,6)+1,FALSE)),MOD(RC[-5]-1,3)*30+104)) -> 130|131|132|133|134 | G383: =HLOOKUP(Sheet1!R2C1,Sheet1!R2C1:R16C1,MOD(RC1-1,2)+MOD(INT((RC1-1)/2),3)*5+1,FALSE)&"|"&HLOOKUP(Sheet1!R2C1,Sheet1!R2C1:R16C1,MOD(RC1,2)+MOD(INT((RC1)/2),3)*5+1,FALSE)&"|"&HLOOKUP(Sheet1!R2C1,Sheet1!R2C1:R16C1,MOD(RC1+1,2)+MOD(INT((RC1+1)/2),3)*5+1,FALSE)&"|"&HLOOKUP(Sheet1!R2C1,Sheet1!R2C1:R16C1,MOD(RC1+2,2)+MOD(INT((RC1+2)/2),3)*5+1,FALSE)&"|"&HLOOKUP(Sheet1!R2C1,Sheet1!R2C1:R16C1,MOD(RC1+3,2)+MOD(INT((RC1+3)/2),3)*5+1,FALSE) -> 160|161|100|101|130 | H383: =HLOOKUP(Sheet1!R2C1,Sheet1!R2C1:R16C1,MOD(RC1+2,2)+MOD(INT((RC1+2)/2),3)*5+1,FALSE)&"|"&HLOOKUP(Sheet1!R2C1,Sheet1!R2C1:R16C1,MOD(RC1+3,2)+MOD(INT((RC1+3)/2),3)*5+1,FALSE)&"|"&HLOOKUP(Sheet1!R2C1,Sheet1!R2C1:R16C1,MOD(RC1+4,2)+MOD(INT((RC1+4)/2),3)*5+1,FALSE)&"|"&HLOOKUP(Sheet1!R2C1,Sheet1!R2C1:R16C1,MOD(RC1+5,2)+MOD(INT((RC1+5)/2),3)*5+1,FALSE)&"|"&HLOOKUP(Sheet1!R2C1,Sheet1!R2C1:R16C1,MOD(RC1+6,2)+MOD(INT((RC1+6)/2),3)*5+1,FALSE) -> 101|130|131|160|161 | I383: =HLOOKUP(Sheet1!R2C1,Sheet1!R2C1:R16C1,MOD(RC1-1,3)+MOD(INT((RC1-1)/3),3)*5+3,FALSE)&"|"&HLOOKUP(Sheet1!R2C1,Sheet1!R2C1:R16C1,MOD(RC1,3)+MOD(INT((RC1)/3),3)*5+3,FALSE)&"|"&HLOOKUP(Sheet1!R2C1,Sheet1!R2C1:R16C1,MOD(RC1+1,3)+MOD(INT((RC1+1)/3),3)*5+3,FALSE)&"|"&HLOOKUP(Sheet1!R2C1,Sheet1!R2C1:R16C1,MOD(RC1+2,3)+MOD(INT((RC1+2)/3),3)*5+3,FALSE)&"|"&HLOOKUP(Sheet1!R2C1,Sheet1!R2C1:R16C1,MOD(RC1+3,3)+MOD(INT((RC1+3)/3),3)*5+3,FALSE) -> 163|164|102|103|104 | J383: =HLOOKUP(Sheet1!R2C1,Sheet1!R2C1:R16C1,MOD(RC1-1,3)+MOD(INT((RC1-1)/3),3)*5+3,FALSE)&"|"&HLOOKUP(Sheet1!R2C1,Sheet1!R2C1:R16C1,MOD(RC1,3)+MOD(INT((RC1)/3),3)*5+3,FALSE)&"|"&HLOOKUP(Sheet1!R2C1,Sheet1!R2C1:R16C1,MOD(RC1+1,3)+MOD(INT((RC1+1)/3),3)*5+3,FALSE)&"|"&HLOOKUP(Sheet1!R2C1,Sheet1!R2C1:R16C1,MOD(RC1+2,3)+MOD(INT((RC1+2)/3),3)*5+3,FALSE)&"|"&HLOOKUP(Sheet1!R2C1,Sheet1!R2C1:R16C1,MOD(RC1+3,3)+MOD(INT((RC1+3)/3),3)*5+3,FALSE) -> 163|164|102|103|104 | K383: =HLOOKUP(Sheet1!R2C1,Sheet1!R2C1:R16C1,MOD(RC1-1,3)+MOD(INT((RC1-1)/3),3)*5+3,FALSE)&"|"&HLOOKUP(Sheet1!R2C1,Sheet1!R2C1:R16C1,MOD(RC1,3)+MOD(INT((RC1)/3),3)*5+3,FALSE)&"|"&HLOOKUP(Sheet1!R2C1,Sheet1!R2C1:R16C1,MOD(RC1+1,3)+MOD(INT((RC1+1)/3),3)*5+3,FALSE)&"|"&HLOOKUP(Sheet1!R2C1,Sheet1!R2C1:R16C1,MOD(RC1+2,3)+MOD(INT((RC1+2)/3),3)*5+3,FALSE)&"|"&HLOOKUP(Sheet1!R2C1,Sheet1!R2C1:R16C1,MOD(RC1+3,3)+MOD(INT((RC1+3)/3),3)*5+3,FALSE) -> 163|164|102|103|104 | L383: 25|22|23|24 | M383: 5374550|5374550|5374550|5374550 | N383: 10030|10031|10032|10033 | O383: 1|1|1|1 | P383: 2500|2500|2500|2500
A384: 378 | B384: 376 | C384: 30 | D384: =R[-20]C+2 -> 56 | E384: 1000 | F384: =MOD(RC[-5]-1,3)*30+100&"|"&MOD(RC[-5]-1,3)*30+101&"|"&MOD(RC[-5]-1,3)*30+102&"|"&MOD(RC[-5]-1,3)*30+103&"|"&IF(MOD(RC[-5],4)=0,HLOOKUP(Sheet1!R2C10,Sheet1!R2C10:R7C10,MOD(RC[-5]/4-1,6)+1,FALSE),IF(MOD(RC[-5],2)=0,IF(RC[-5]>20,HLOOKUP(Sheet1!R2C7,Sheet1!R2C7:R43C7,MOD(RC[-5]/2-1,42)+1,FALSE),HLOOKUP(Sheet1!R2C4,Sheet1!R2C4:R7C4,MOD(RC[-5]-1,6)+1,FALSE)),MOD(RC[-5]-1,3)*30+104)) -> 160|161|162|163|148 | G384: =HLOOKUP(Sheet1!R2C1,Sheet1!R2C1:R16C1,MOD(RC1-1,2)+MOD(INT((RC1-1)/2),3)*5+1,FALSE)&"|"&HLOOKUP(Sheet1!R2C1,Sheet1!R2C1:R16C1,MOD(RC1,2)+MOD(INT((RC1)/2),3)*5+1,FALSE)&"|"&HLOOKUP(Sheet1!R2C1,Sheet1!R2C1:R16C1,MOD(RC1+1,2)+MOD(INT((RC1+1)/2),3)*5+1,FALSE)&"|"&HLOOKUP(Sheet1!R2C1,Sheet1!R2C1:R16C1,MOD(RC1+2,2)+MOD(INT((RC1+2)/2),3)*5+1,FALSE)&"|"&HLOOKUP(Sheet1!R2C1,Sheet1!R2C1:R16C1,MOD(RC1+3,2)+MOD(INT((RC1+3)/2),3)*5+1,FALSE) -> 161|100|101|130|131 | H384: =HLOOKUP(Sheet1!R2C1,Sheet1!R2C1:R16C1,MOD(RC1+2,2)+MOD(INT((RC1+2)/2),3)*5+1,FALSE)&"|"&HLOOKUP(Sheet1!R2C1,Sheet1!R2C1:R16C1,MOD(RC1+3,2)+MOD(INT((RC1+3)/2),3)*5+1,FALSE)&"|"&HLOOKUP(Sheet1!R2C1,Sheet1!R2C1:R16C1,MOD(RC1+4,2)+MOD(INT((RC1+4)/2),3)*5+1,FALSE)&"|"&HLOOKUP(Sheet1!R2C1,Sheet1!R2C1:R16C1,MOD(RC1+5,2)+MOD(INT((RC1+5)/2),3)*5+1,FALSE)&"|"&HLOOKUP(Sheet1!R2C1,Sheet1!R2C1:R16C1,MOD(RC1+6,2)+MOD(INT((RC1+6)/2),3)*5+1,FALSE) -> 130|131|160|161|100 | I384: =HLOOKUP(Sheet1!R2C1,Sheet1!R2C1:R16C1,MOD(RC1-1,3)+MOD(INT((RC1-1)/3),3)*5+3,FALSE)&"|"&HLOOKUP(Sheet1!R2C1,Sheet1!R2C1:R16C1,MOD(RC1,3)+MOD(INT((RC1)/3),3)*5+3,FALSE)&"|"&HLOOKUP(Sheet1!R2C1,Sheet1!R2C1:R16C1,MOD(RC1+1,3)+MOD(INT((RC1+1)/3),3)*5+3,FALSE)&"|"&HLOOKUP(Sheet1!R2C1,Sheet1!R2C1:R16C1,MOD(RC1+2,3)+MOD(INT((RC1+2)/3),3)*5+3,FALSE)&"|"&HLOOKUP(Sheet1!R2C1,Sheet1!R2C1:R16C1,MOD(RC1+3,3)+MOD(INT((RC1+3)/3),3)*5+3,FALSE) -> 164|102|103|104|132 | J384: =HLOOKUP(Sheet1!R2C1,Sheet1!R2C1:R16C1,MOD(RC1-1,3)+MOD(INT((RC1-1)/3),3)*5+3,FALSE)&"|"&HLOOKUP(Sheet1!R2C1,Sheet1!R2C1:R16C1,MOD(RC1,3)+MOD(INT((RC1)/3),3)*5+3,FALSE)&"|"&HLOOKUP(Sheet1!R2C1,Sheet1!R2C1:R16C1,MOD(RC1+1,3)+MOD(INT((RC1+1)/3),3)*5+3,FALSE)&"|"&HLOOKUP(Sheet1!R2C1,Sheet1!R2C1:R16C1,MOD(RC1+2,3)+MOD(INT((RC1+2)/3),3)*5+3,FALSE)&"|"&HLOOKUP(Sheet1!R2C1,Sheet1!R2C1:R16C1,MOD(RC1+3,3)+MOD(INT((RC1+3)/3),3)*5+3,FALSE) -> 164|102|103|104|132 | K384: =HLOOKUP(Sheet1!R2C1,Sheet1!R2C1:R16C1,MOD(RC1-1,3)+MOD(INT((RC1-1)/3),3)*5+3,FALSE)&"|"&HLOOKUP(Sheet1!R2C1,Sheet1!R2C1:R16C1,MOD(RC1,3)+MOD(INT((RC1)/3),3)*5+3,FALSE)&"|"&HLOOKUP(Sheet1!R2C1,Sheet1!R2C1:R16C1,MOD(RC1+1,3)+MOD(INT((RC1+1)/3),3)*5+3,FALSE)&"|"&HLOOKUP(Sheet1!R2C1,Sheet1!R2C1:R16C1,MOD(RC1+2,3)+MOD(INT((RC1+2)/3),3)*5+3,FALSE)&"|"&HLOOKUP(Sheet1!R2C1,Sheet1!R2C1:R16C1,MOD(RC1+3,3)+MOD(INT((RC1+3)/3),3)*5+3,FALSE) -> 164|102|103|104|132 | L384: 25|22|23|24 | M384: 5421626|5421626|5421625|5421625 | N384: 10030|10031|10032|10033 | O384: 1|1|1|1 | P384: 2500|2500|2500|2500
A385: 379 | B385: 377 | C385: 30 | D385: =R[-20]C+2 -> 56 | E385: 1000 | F385: =MOD(RC[-5]-1,3)*30+100&"|"&MOD(RC[-5]-1,3)*30+101&"|"&MOD(RC[-5]-1,3)*30+102&"|"&MOD(RC[-5]-1,3)*30+103&"|"&IF(MOD(RC[-5],4)=0,HLOOKUP(Sheet1!R2C10,Sheet1!R2C10:R7C10,MOD(RC[-5]/4-1,6)+1,FALSE),IF(MOD(RC[-5],2)=0,IF(RC[-5]>20,HLOOKUP(Sheet1!R2C7,Sheet1!R2C7:R43C7,MOD(RC[-5]/2-1,42)+1,FALSE),HLOOKUP(Sheet1!R2C4,Sheet1!R2C4:R7C4,MOD(RC[-5]-1,6)+1,FALSE)),MOD(RC[-5]-1,3)*30+104)) -> 100|101|102|103|104 | G385: =HLOOKUP(Sheet1!R2C1,Sheet1!R2C1:R16C1,MOD(RC1-1,2)+MOD(INT((RC1-1)/2),3)*5+1,FALSE)&"|"&HLOOKUP(Sheet1!R2C1,Sheet1!R2C1:R16C1,MOD(RC1,2)+MOD(INT((RC1)/2),3)*5+1,FALSE)&"|"&HLOOKUP(Sheet1!R2C1,Sheet1!R2C1:R16C1,MOD(RC1+1,2)+MOD(INT((RC1+1)/2),3)*5+1,FALSE)&"|"&HLOOKUP(Sheet1!R2C1,Sheet1!R2C1:R16C1,MOD(RC1+2,2)+MOD(INT((RC1+2)/2),3)*5+1,FALSE)&"|"&HLOOKUP(Sheet1!R2C1,Sheet1!R2C1:R16C1,MOD(RC1+3,2)+MOD(INT((RC1+3)/2),3)*5+1,FALSE) -> 100|101|130|131|160 | H385: =HLOOKUP(Sheet1!R2C1,Sheet1!R2C1:R16C1,MOD(RC1+2,2)+MOD(INT((RC1+2)/2),3)*5+1,FALSE)&"|"&HLOOKUP(Sheet1!R2C1,Sheet1!R2C1:R16C1,MOD(RC1+3,2)+MOD(INT((RC1+3)/2),3)*5+1,FALSE)&"|"&HLOOKUP(Sheet1!R2C1,Sheet1!R2C1:R16C1,MOD(RC1+4,2)+MOD(INT((RC1+4)/2),3)*5+1,FALSE)&"|"&HLOOKUP(Sheet1!R2C1,Sheet1!R2C1:R16C1,MOD(RC1+5,2)+MOD(INT((RC1+5)/2),3)*5+1,FALSE)&"|"&HLOOKUP(Sheet1!R2C1,Sheet1!R2C1:R16C1,MOD(RC1+6,2)+MOD(INT((RC1+6)/2),3)*5+1,FALSE) -> 131|160|161|100|101 | I385: =HLOOKUP(Sheet1!R2C1,Sheet1!R2C1:R16C1,MOD(RC1-1,3)+MOD(INT((RC1-1)/3),3)*5+3,FALSE)&"|"&HLOOKUP(Sheet1!R2C1,Sheet1!R2C1:R16C1,MOD(RC1,3)+MOD(INT((RC1)/3),3)*5+3,FALSE)&"|"&HLOOKUP(Sheet1!R2C1,Sheet1!R2C1:R16C1,MOD(RC1+1,3)+MOD(INT((RC1+1)/3),3)*5+3,FALSE)&"|"&HLOOKUP(Sheet1!R2C1,Sheet1!R2C1:R16C1,MOD(RC1+2,3)+MOD(INT((RC1+2)/3),3)*5+3,FALSE)&"|"&HLOOKUP(Sheet1!R2C1,Sheet1!R2C1:R16C1,MOD(RC1+3,3)+MOD(INT((RC1+3)/3),3)*5+3,FALSE) -> 102|103|104|132|133 | J385: =HLOOKUP(Sheet1!R2C1,Sheet1!R2C1:R16C1,MOD(RC1-1,3)+MOD(INT((RC1-1)/3),3)*5+3,FALSE)&"|"&HLOOKUP(Sheet1!R2C1,Sheet1!R2C1:R16C1,MOD(RC1,3)+MOD(INT((RC1)/3),3)*5+3,FALSE)&"|"&HLOOKUP(Sheet1!R2C1,Sheet1!R2C1:R16C1,MOD(RC1+1,3)+MOD(INT((RC1+1)/3),3)*5+3,FALSE)&"|"&HLOOKUP(Sheet1!R2C1,Sheet1!R2C1:R16C1,MOD(RC1+2,3)+MOD(INT((RC1+2)/3),3)*5+3,FALSE)&"|"&HLOOKUP(Sheet1!R2C1,Sheet1!R2C1:R16C1,MOD(RC1+3,3)+MOD(INT((RC1+3)/3),3)*5+3,FALSE) -> 102|103|104|132|133 | K385: =HLOOKUP(Sheet1!R2C1,Sheet1!R2C1:R16C1,MOD(RC1-1,3)+MOD(INT((RC1-1)/3),3)*5+3,FALSE)&"|"&HLOOKUP(Sheet1!R2C1,Sheet1!R2C1:R16C1,MOD(RC1,3)+MOD(INT((RC1)/3),3)*5+3,FALSE)&"|"&HLOOKUP(Sheet1!R2C1,Sheet1!R2C1:R16C1,MOD(RC1+1,3)+MOD(INT((RC1+1)/3),3)*5+3,FALSE)&"|"&HLOOKUP(Sheet1!R2C1,Sheet1!R2C1:R16C1,MOD(RC1+2,3)+MOD(INT((RC1+2)/3),3)*5+3,FALSE)&"|"&HLOOKUP(Sheet1!R2C1,Sheet1!R2C1:R16C1,MOD(RC1+3,3)+MOD(INT((RC1+3)/3),3)*5+3,FALSE) -> 102|103|104|132|133 | L385: 25|22|23|24 | M385: 5470663|5470663|5470663|5470663 | N385: 10030|10031|10032|10033 | O385: 1|1|1|1 | P385: 2500|2500|2500|2500
A386: 380 | B386: 378 | C386: 30 | D386: =R[-20]C+2 -> 56 | E386: 1000 | F386: =MOD(RC[-5]-1,3)*30+100&"|"&MOD(RC[-5]-1,3)*30+101&"|"&MOD(RC[-5]-1,3)*30+102&"|"&MOD(RC[-5]-1,3)*30+103&"|"&IF(MOD(RC[-5],4)=0,HLOOKUP(Sheet1!R2C10,Sheet1!R2C10:R7C10,MOD(RC[-5]/4-1,6)+1,FALSE),IF(MOD(RC[-5],2)=0,IF(RC[-5]>20,HLOOKUP(Sheet1!R2C7,Sheet1!R2C7:R43C7,MOD(RC[-5]/2-1,42)+1,FALSE),HLOOKUP(Sheet1!R2C4,Sheet1!R2C4:R7C4,MOD(RC[-5]-1,6)+1,FALSE)),MOD(RC[-5]-1,3)*30+104)) -> 130|131|132|133|194 | G386: =HLOOKUP(Sheet1!R2C1,Sheet1!R2C1:R16C1,MOD(RC1-1,2)+MOD(INT((RC1-1)/2),3)*5+1,FALSE)&"|"&HLOOKUP(Sheet1!R2C1,Sheet1!R2C1:R16C1,MOD(RC1,2)+MOD(INT((RC1)/2),3)*5+1,FALSE)&"|"&HLOOKUP(Sheet1!R2C1,Sheet1!R2C1:R16C1,MOD(RC1+1,2)+MOD(INT((RC1+1)/2),3)*5+1,FALSE)&"|"&HLOOKUP(Sheet1!R2C1,Sheet1!R2C1:R16C1,MOD(RC1+2,2)+MOD(INT((RC1+2)/2),3)*5+1,FALSE)&"|"&HLOOKUP(Sheet1!R2C1,Sheet1!R2C1:R16C1,MOD(RC1+3,2)+MOD(INT((RC1+3)/2),3)*5+1,FALSE) -> 101|130|131|160|161 | H386: =HLOOKUP(Sheet1!R2C1,Sheet1!R2C1:R16C1,MOD(RC1+2,2)+MOD(INT((RC1+2)/2),3)*5+1,FALSE)&"|"&HLOOKUP(Sheet1!R2C1,Sheet1!R2C1:R16C1,MOD(RC1+3,2)+MOD(INT((RC1+3)/2),3)*5+1,FALSE)&"|"&HLOOKUP(Sheet1!R2C1,Sheet1!R2C1:R16C1,MOD(RC1+4,2)+MOD(INT((RC1+4)/2),3)*5+1,FALSE)&"|"&HLOOKUP(Sheet1!R2C1,Sheet1!R2C1:R16C1,MOD(RC1+5,2)+MOD(INT((RC1+5)/2),3)*5+1,FALSE)&"|"&HLOOKUP(Sheet1!R2C1,Sheet1!R2C1:R16C1,MOD(RC1+6,2)+MOD(INT((RC1+6)/2),3)*5+1,FALSE) -> 160|161|100|101|130 | I386: =HLOOKUP(Sheet1!R2C1,Sheet1!R2C1:R16C1,MOD(RC1-1,3)+MOD(INT((RC1-1)/3),3)*5+3,FALSE)&"|"&HLOOKUP(Sheet1!R2C1,Sheet1!R2C1:R16C1,MOD(RC1,3)+MOD(INT((RC1)/3),3)*5+3,FALSE)&"|"&HLOOKUP(Sheet1!R2C1,Sheet1!R2C1:R16C1,MOD(RC1+1,3)+MOD(INT((RC1+1)/3),3)*5+3,FALSE)&"|"&HLOOKUP(Sheet1!R2C1,Sheet1!R2C1:R16C1,MOD(RC1+2,3)+MOD(INT((RC1+2)/3),3)*5+3,FALSE)&"|"&HLOOKUP(Sheet1!R2C1,Sheet1!R2C1:R16C1,MOD(RC1+3,3)+MOD(INT((RC1+3)/3),3)*5+3,FALSE) -> 103|104|132|133|134 | J386: =HLOOKUP(Sheet1!R2C1,Sheet1!R2C1:R16C1,MOD(RC1-1,3)+MOD(INT((RC1-1)/3),3)*5+3,FALSE)&"|"&HLOOKUP(Sheet1!R2C1,Sheet1!R2C1:R16C1,MOD(RC1,3)+MOD(INT((RC1)/3),3)*5+3,FALSE)&"|"&HLOOKUP(Sheet1!R2C1,Sheet1!R2C1:R16C1,MOD(RC1+1,3)+MOD(INT((RC1+1)/3),3)*5+3,FALSE)&"|"&HLOOKUP(Sheet1!R2C1,Sheet1!R2C1:R16C1,MOD(RC1+2,3)+MOD(INT((RC1+2)/3),3)*5+3,FALSE)&"|"&HLOOKUP(Sheet1!R2C1,Sheet1!R2C1:R16C1,MOD(RC1+3,3)+MOD(INT((RC1+3)/3),3)*5+3,FALSE) -> 103|104|132|133|134 | K386: =HLOOKUP(Sheet1!R2C1,Sheet1!R2C1:R16C1,MOD(RC1-1,3)+MOD(INT((RC1-1)/3),3)*5+3,FALSE)&"|"&HLOOKUP(Sheet1!R2C1,Sheet1!R2C1:R16C1,MOD(RC1,3)+MOD(INT((RC1)/3),3)*5+3,FALSE)&"|"&HLOOKUP(Sheet1!R2C1,Sheet1!R2C1:R16C1,MOD(RC1+1,3)+MOD(INT((RC1+1)/3),3)*5+3,FALSE)&"|"&HLOOKUP(Sheet1!R2C1,Sheet1!R2C1:R16C1,MOD(RC1+2,3)+MOD(INT((RC1+2)/3),3)*5+3,FALSE)&"|"&HLOOKUP(Sheet1!R2C1,Sheet1!R2C1:R16C1,MOD(RC1+3,3)+MOD(INT((RC1+3)/3),3)*5+3,FALSE) -> 103|104|132|133|134 | L386: 25|22|23|24 | M386: 5517738|5517739|5517738|5517738 | N386: 10030|10031|10032|10033|10030|10031|10032|10033|10030|10031|10032|10033|10030|10031|10032|10033|10030|10031|10032|10033|10030|10031|10032|10033|10030|10031|10032|10033|10030|10031|10032|10033|10030|10031|10032|10033|10030|10031|10032|10033 | O386: 1|1|1|1|1|1|1|1|1|1|1|1|1|1|1|1|1|1|1|1|1|1|1|1|1|1|1|1|1|1|1|1|1|1|1|1|1|1|1|1 | P386: 2500|2500|2500|2500|2500|2500|2500|2500|2500|2500|2500|2500|2500|2500|2500|2500|2500|2500|2500|2500|2500|2500|2500|2500|2500|2500|2500|2500|2500|2500|2500|2500|2500|2500|2500|2500|2500|2500|2500|2500
A387: 381 | B387: 379 | C387: 30 | D387: =R[-20]C+2 -> 58 | E387: 1000 | F387: =MOD(RC[-5]-1,3)*30+100&"|"&MOD(RC[-5]-1,3)*30+101&"|"&MOD(RC[-5]-1,3)*30+102&"|"&MOD(RC[-5]-1,3)*30+103&"|"&IF(MOD(RC[-5],4)=0,HLOOKUP(Sheet1!R2C10,Sheet1!R2C10:R7C10,MOD(RC[-5]/4-1,6)+1,FALSE),IF(MOD(RC[-5],2)=0,IF(RC[-5]>20,HLOOKUP(Sheet1!R2C7,Sheet1!R2C7:R43C7,MOD(RC[-5]/2-1,42)+1,FALSE),HLOOKUP(Sheet1!R2C4,Sheet1!R2C4:R7C4,MOD(RC[-5]-1,6)+1,FALSE)),MOD(RC[-5]-1,3)*30+104)) -> 160|161|162|163|164 | G387: =HLOOKUP(Sheet1!R2C1,Sheet1!R2C1:R16C1,MOD(RC1-1,2)+MOD(INT((RC1-1)/2),3)*5+1,FALSE)&"|"&HLOOKUP(Sheet1!R2C1,Sheet1!R2C1:R16C1,MOD(RC1,2)+MOD(INT((RC1)/2),3)*5+1,FALSE)&"|"&HLOOKUP(Sheet1!R2C1,Sheet1!R2C1:R16C1,MOD(RC1+1,2)+MOD(INT((RC1+1)/2),3)*5+1,FALSE)&"|"&HLOOKUP(Sheet1!R2C1,Sheet1!R2C1:R16C1,MOD(RC1+2,2)+MOD(INT((RC1+2)/2),3)*5+1,FALSE)&"|"&HLOOKUP(Sheet1!R2C1,Sheet1!R2C1:R16C1,MOD(RC1+3,2)+MOD(INT((RC1+3)/2),3)*5+1,FALSE) -> 130|131|160|161|100 | H387: =HLOOKUP(Sheet1!R2C1,Sheet1!R2C1:R16C1,MOD(RC1+2,2)+MOD(INT((RC1+2)/2),3)*5+1,FALSE)&"|"&HLOOKUP(Sheet1!R2C1,Sheet1!R2C1:R16C1,MOD(RC1+3,2)+MOD(INT((RC1+3)/2),3)*5+1,FALSE)&"|"&HLOOKUP(Sheet1!R2C1,Sheet1!R2C1:R16C1,MOD(RC1+4,2)+MOD(INT((RC1+4)/2),3)*5+1,FALSE)&"|"&HLOOKUP(Sheet1!R2C1,Sheet1!R2C1:R16C1,MOD(RC1+5,2)+MOD(INT((RC1+5)/2),3)*5+1,FALSE)&"|"&HLOOKUP(Sheet1!R2C1,Sheet1!R2C1:R16C1,MOD(RC1+6,2)+MOD(INT((RC1+6)/2),3)*5+1,FALSE) -> 161|100|101|130|131 | I387: =HLOOKUP(Sheet1!R2C1,Sheet1!R2C1:R16C1,MOD(RC1-1,3)+MOD(INT((RC1-1)/3),3)*5+3,FALSE)&"|"&HLOOKUP(Sheet1!R2C1,Sheet1!R2C1:R16C1,MOD(RC1,3)+MOD(INT((RC1)/3),3)*5+3,FALSE)&"|"&HLOOKUP(Sheet1!R2C1,Sheet1!R2C1:R16C1,MOD(RC1+1,3)+MOD(INT((RC1+1)/3),3)*5+3,FALSE)&"|"&HLOOKUP(Sheet1!R2C1,Sheet1!R2C1:R16C1,MOD(RC1+2,3)+MOD(INT((RC1+2)/3),3)*5+3,FALSE)&"|"&HLOOKUP(Sheet1!R2C1,Sheet1!R2C1:R16C1,MOD(RC1+3,3)+MOD(INT((RC1+3)/3),3)*5+3,FALSE) -> 104|132|133|134|162 | J387: =HLOOKUP(Sheet1!R2C1,Sheet1!R2C1:R16C1,MOD(RC1-1,3)+MOD(INT((RC1-1)/3),3)*5+3,FALSE)&"|"&HLOOKUP(Sheet1!R2C1,Sheet1!R2C1:R16C1,MOD(RC1,3)+MOD(INT((RC1)/3),3)*5+3,FALSE)&"|"&HLOOKUP(Sheet1!R2C1,Sheet1!R2C1:R16C1,MOD(RC1+1,3)+MOD(INT((RC1+1)/3),3)*5+3,FALSE)&"|"&HLOOKUP(Sheet1!R2C1,Sheet1!R2C1:R16C1,MOD(RC1+2,3)+MOD(INT((RC1+2)/3),3)*5+3,FALSE)&"|"&HLOOKUP(Sheet1!R2C1,Sheet1!R2C1:R16C1,MOD(RC1+3,3)+MOD(INT((RC1+3)/3),3)*5+3,FALSE) -> 104|132|133|134|162 | K387: =HLOOKUP(Sheet1!R2C1,Sheet1!R2C1:R16C1,MOD(RC1-1,3)+MOD(INT((RC1-1)/3),3)*5+3,FALSE)&"|"&HLOOKUP(Sheet1!R2C1,Sheet1!R2C1:R16C1,MOD(RC1,3)+MOD(INT((RC1)/3),3)*5+3,FALSE)&"|"&HLOOKUP(Sheet1!R2C1,Sheet1!R2C1:R16C1,MOD(RC1+1,3)+MOD(INT((RC1+1)/3),3)*5+3,FALSE)&"|"&HLOOKUP(Sheet1!R2C1,Sheet1!R2C1:R16C1,MOD(RC1+2,3)+MOD(INT((RC1+2)/3),3)*5+3,FALSE)&"|"&HLOOKUP(Sheet1!R2C1,Sheet1!R2C1:R16C1,MOD(RC1+3,3)+MOD(INT((RC1+3)/3),3)*5+3,FALSE) -> 104|132|133|134|162 | L387: 25|22|23|24 | M387: 5567368|5567369|5567368|5567368 | N387: 10030|10031|10032|10033 | O387: 1|1|1|1 | P387: 2500|2500|2500|2500
A388: 382 | B388: 380 | C388: 30 | D388: =R[-20]C+2 -> 58 | E388: 1000 | F388: =MOD(RC[-5]-1,3)*30+100&"|"&MOD(RC[-5]-1,3)*30+101&"|"&MOD(RC[-5]-1,3)*30+102&"|"&MOD(RC[-5]-1,3)*30+103&"|"&IF(MOD(RC[-5],4)=0,HLOOKUP(Sheet1!R2C10,Sheet1!R2C10:R7C10,MOD(RC[-5]/4-1,6)+1,FALSE),IF(MOD(RC[-5],2)=0,IF(RC[-5]>20,HLOOKUP(Sheet1!R2C7,Sheet1!R2C7:R43C7,MOD(RC[-5]/2-1,42)+1,FALSE),HLOOKUP(Sheet1!R2C4,Sheet1!R2C4:R7C4,MOD(RC[-5]-1,6)+1,FALSE)),MOD(RC[-5]-1,3)*30+104)) -> 100|101|102|103|150 | G388: =HLOOKUP(Sheet1!R2C1,Sheet1!R2C1:R16C1,MOD(RC1-1,2)+MOD(INT((RC1-1)/2),3)*5+1,FALSE)&"|"&HLOOKUP(Sheet1!R2C1,Sheet1!R2C1:R16C1,MOD(RC1,2)+MOD(INT((RC1)/2),3)*5+1,FALSE)&"|"&HLOOKUP(Sheet1!R2C1,Sheet1!R2C1:R16C1,MOD(RC1+1,2)+MOD(INT((RC1+1)/2),3)*5+1,FALSE)&"|"&HLOOKUP(Sheet1!R2C1,Sheet1!R2C1:R16C1,MOD(RC1+2,2)+MOD(INT((RC1+2)/2),3)*5+1,FALSE)&"|"&HLOOKUP(Sheet1!R2C1,Sheet1!R2C1:R16C1,MOD(RC1+3,2)+MOD(INT((RC1+3)/2),3)*5+1,FALSE) -> 131|160|161|100|101 | H388: =HLOOKUP(Sheet1!R2C1,Sheet1!R2C1:R16C1,MOD(RC1+2,2)+MOD(INT((RC1+2)/2),3)*5+1,FALSE)&"|"&HLOOKUP(Sheet1!R2C1,Sheet1!R2C1:R16C1,MOD(RC1+3,2)+MOD(INT((RC1+3)/2),3)*5+1,FALSE)&"|"&HLOOKUP(Sheet1!R2C1,Sheet1!R2C1:R16C1,MOD(RC1+4,2)+MOD(INT((RC1+4)/2),3)*5+1,FALSE)&"|"&HLOOKUP(Sheet1!R2C1,Sheet1!R2C1:R16C1,MOD(RC1+5,2)+MOD(INT((RC1+5)/2),3)*5+1,FALSE)&"|"&HLOOKUP(Sheet1!R2C1,Sheet1!R2C1:R16C1,MOD(RC1+6,2)+MOD(INT((RC1+6)/2),3)*5+1,FALSE) -> 100|101|130|131|160 | I388: =HLOOKUP(Sheet1!R2C1,Sheet1!R2C1:R16C1,MOD(RC1-1,3)+MOD(INT((RC1-1)/3),3)*5+3,FALSE)&"|"&HLOOKUP(Sheet1!R2C1,Sheet1!R2C1:R16C1,MOD(RC1,3)+MOD(INT((RC1)/3),3)*5+3,FALSE)&"|"&HLOOKUP(Sheet1!R2C1,Sheet1!R2C1:R16C1,MOD(RC1+1,3)+MOD(INT((RC1+1)/3),3)*5+3,FALSE)&"|"&HLOOKUP(Sheet1!R2C1,Sheet1!R2C1:R16C1,MOD(RC1+2,3)+MOD(INT((RC1+2)/3),3)*5+3,FALSE)&"|"&HLOOKUP(Sheet1!R2C1,Sheet1!R2C1:R16C1,MOD(RC1+3,3)+MOD(INT((RC1+3)/3),3)*5+3,FALSE) -> 132|133|134|162|163 | J388: =HLOOKUP(Sheet1!R2C1,Sheet1!R2C1:R16C1,MOD(RC1-1,3)+MOD(INT((RC1-1)/3),3)*5+3,FALSE)&"|"&HLOOKUP(Sheet1!R2C1,Sheet1!R2C1:R16C1,MOD(RC1,3)+MOD(INT((RC1)/3),3)*5+3,FALSE)&"|"&HLOOKUP(Sheet1!R2C1,Sheet1!R2C1:R16C1,MOD(RC1+1,3)+MOD(INT((RC1+1)/3),3)*5+3,FALSE)&"|"&HLOOKUP(Sheet1!R2C1,Sheet1!R2C1:R16C1,MOD(RC1+2,3)+MOD(INT((RC1+2)/3),3)*5+3,FALSE)&"|"&HLOOKUP(Sheet1!R2C1,Sheet1!R2C1:R16C1,MOD(RC1+3,3)+MOD(INT((RC1+3)/3),3)*5+3,FALSE) -> 132|133|134|162|163 | K388: =HLOOKUP(Sheet1!R2C1,Sheet1!R2C1:R16C1,MOD(RC1-1,3)+MOD(INT((RC1-1)/3),3)*5+3,FALSE)&"|"&HLOOKUP(Sheet1!R2C1,Sheet1!R2C1:R16C1,MOD(RC1,3)+MOD(INT((RC1)/3),3)*5+3,FALSE)&"|"&HLOOKUP(Sheet1!R2C1,Sheet1!R2C1:R16C1,MOD(RC1+1,3)+MOD(INT((RC1+1)/3),3)*5+3,FALSE)&"|"&HLOOKUP(Sheet1!R2C1,Sheet1!R2C1:R16C1,MOD(RC1+2,3)+MOD(INT((RC1+2)/3),3)*5+3,FALSE)&"|"&HLOOKUP(Sheet1!R2C1,Sheet1!R2C1:R16C1,MOD(RC1+3,3)+MOD(INT((RC1+3)/3),3)*5+3,FALSE) -> 132|133|134|162|163 | L388: 25|22|23|24 | M388: 5616222|5616223|5616223|5616223 | N388: 10030|10031|10032|10033 | O388: 1|1|1|1 | P388: 2500|2500|2500|2500
A389: 383 | B389: 381 | C389: 30 | D389: =R[-20]C+2 -> 58 | E389: 1000 | F389: =MOD(RC[-5]-1,3)*30+100&"|"&MOD(RC[-5]-1,3)*30+101&"|"&MOD(RC[-5]-1,3)*30+102&"|"&MOD(RC[-5]-1,3)*30+103&"|"&IF(MOD(RC[-5],4)=0,HLOOKUP(Sheet1!R2C10,Sheet1!R2C10:R7C10,MOD(RC[-5]/4-1,6)+1,FALSE),IF(MOD(RC[-5],2)=0,IF(RC[-5]>20,HLOOKUP(Sheet1!R2C7,Sheet1!R2C7:R43C7,MOD(RC[-5]/2-1,42)+1,FALSE),HLOOKUP(Sheet1!R2C4,Sheet1!R2C4:R7C4,MOD(RC[-5]-1,6)+1,FALSE)),MOD(RC[-5]-1,3)*30+104)) -> 130|131|132|133|134 | G389: =HLOOKUP(Sheet1!R2C1,Sheet1!R2C1:R16C1,MOD(RC1-1,2)+MOD(INT((RC1-1)/2),3)*5+1,FALSE)&"|"&HLOOKUP(Sheet1!R2C1,Sheet1!R2C1:R16C1,MOD(RC1,2)+MOD(INT((RC1)/2),3)*5+1,FALSE)&"|"&HLOOKUP(Sheet1!R2C1,Sheet1!R2C1:R16C1,MOD(RC1+1,2)+MOD(INT((RC1+1)/2),3)*5+1,FALSE)&"|"&HLOOKUP(Sheet1!R2C1,Sheet1!R2C1:R16C1,MOD(RC1+2,2)+MOD(INT((RC1+2)/2),3)*5+1,FALSE)&"|"&HLOOKUP(Sheet1!R2C1,Sheet1!R2C1:R16C1,MOD(RC1+3,2)+MOD(INT((RC1+3)/2),3)*5+1,FALSE) -> 160|161|100|101|130 | H389: =HLOOKUP(Sheet1!R2C1,Sheet1!R2C1:R16C1,MOD(RC1+2,2)+MOD(INT((RC1+2)/2),3)*5+1,FALSE)&"|"&HLOOKUP(Sheet1!R2C1,Sheet1!R2C1:R16C1,MOD(RC1+3,2)+MOD(INT((RC1+3)/2),3)*5+1,FALSE)&"|"&HLOOKUP(Sheet1!R2C1,Sheet1!R2C1:R16C1,MOD(RC1+4,2)+MOD(INT((RC1+4)/2),3)*5+1,FALSE)&"|"&HLOOKUP(Sheet1!R2C1,Sheet1!R2C1:R16C1,MOD(RC1+5,2)+MOD(INT((RC1+5)/2),3)*5+1,FALSE)&"|"&HLOOKUP(Sheet1!R2C1,Sheet1!R2C1:R16C1,MOD(RC1+6,2)+MOD(INT((RC1+6)/2),3)*5+1,FALSE) -> 101|130|131|160|161 | I389: =HLOOKUP(Sheet1!R2C1,Sheet1!R2C1:R16C1,MOD(RC1-1,3)+MOD(INT((RC1-1)/3),3)*5+3,FALSE)&"|"&HLOOKUP(Sheet1!R2C1,Sheet1!R2C1:R16C1,MOD(RC1,3)+MOD(INT((RC1)/3),3)*5+3,FALSE)&"|"&HLOOKUP(Sheet1!R2C1,Sheet1!R2C1:R16C1,MOD(RC1+1,3)+MOD(INT((RC1+1)/3),3)*5+3,FALSE)&"|"&HLOOKUP(Sheet1!R2C1,Sheet1!R2C1:R16C1,MOD(RC1+2,3)+MOD(INT((RC1+2)/3),3)*5+3,FALSE)&"|"&HLOOKUP(Sheet1!R2C1,Sheet1!R2C1:R16C1,MOD(RC1+3,3)+MOD(INT((RC1+3)/3),3)*5+3,FALSE) -> 133|134|162|163|164 | J389: =HLOOKUP(Sheet1!R2C1,Sheet1!R2C1:R16C1,MOD(RC1-1,3)+MOD(INT((RC1-1)/3),3)*5+3,FALSE)&"|"&HLOOKUP(Sheet1!R2C1,Sheet1!R2C1:R16C1,MOD(RC1,3)+MOD(INT((RC1)/3),3)*5+3,FALSE)&"|"&HLOOKUP(Sheet1!R2C1,Sheet1!R2C1:R16C1,MOD(RC1+1,3)+MOD(INT((RC1+1)/3),3)*5+3,FALSE)&"|"&HLOOKUP(Sheet1!R2C1,Sheet1!R2C1:R16C1,MOD(RC1+2,3)+MOD(INT((RC1+2)/3),3)*5+3,FALSE)&"|"&HLOOKUP(Sheet1!R2C1,Sheet1!R2C1:R16C1,MOD(RC1+3,3)+MOD(INT((RC1+3)/3),3)*5+3,FALSE) -> 133|134|162|163|164 | K389: =HLOOKUP(Sheet1!R2C1,Sheet1!R2C1:R16C1,MOD(RC1-1,3)+MOD(INT((RC1-1)/3),3)*5+3,FALSE)&"|"&HLOOKUP(Sheet1!R2C1,Sheet1!R2C1:R16C1,MOD(RC1,3)+MOD(INT((RC1)/3),3)*5+3,FALSE)&"|"&HLOOKUP(Sheet1!R2C1,Sheet1!R2C1:R16C1,MOD(RC1+1,3)+MOD(INT((RC1+1)/3),3)*5+3,FALSE)&"|"&HLOOKUP(Sheet1!R2C1,Sheet1!R2C1:R16C1,MOD(RC1+2,3)+MOD(INT((RC1+2)/3),3)*5+3,FALSE)&"|"&HLOOKUP(Sheet1!R2C1,Sheet1!R2C1:R16C1,MOD(RC1+3,3)+MOD(INT((RC1+3)/3),3)*5+3,FALSE) -> 133|134|162|163|164 | L389: 25|22|23|24 | M389: 5665077|5665076|5665078|5665078 | N389: 10030|10031|10032|10033 | O389: 1|1|1|1 | P389: 2500|2500|2500|2500
A390: 384 | B390: 382 | C390: 30 | D390: =R[-20]C+2 -> 58 | E390: 1000 | F390: =MOD(RC[-5]-1,3)*30+100&"|"&MOD(RC[-5]-1,3)*30+101&"|"&MOD(RC[-5]-1,3)*30+102&"|"&MOD(RC[-5]-1,3)*30+103&"|"&IF(MOD(RC[-5],4)=0,HLOOKUP(Sheet1!R2C10,Sheet1!R2C10:R7C10,MOD(RC[-5]/4-1,6)+1,FALSE),IF(MOD(RC[-5],2)=0,IF(RC[-5]>20,HLOOKUP(Sheet1!R2C7,Sheet1!R2C7:R43C7,MOD(RC[-5]/2-1,42)+1,FALSE),HLOOKUP(Sheet1!R2C4,Sheet1!R2C4:R7C4,MOD(RC[-5]-1,6)+1,FALSE)),MOD(RC[-5]-1,3)*30+104)) -> 160|161|162|163|195 | G390: =HLOOKUP(Sheet1!R2C1,Sheet1!R2C1:R16C1,MOD(RC1-1,2)+MOD(INT((RC1-1)/2),3)*5+1,FALSE)&"|"&HLOOKUP(Sheet1!R2C1,Sheet1!R2C1:R16C1,MOD(RC1,2)+MOD(INT((RC1)/2),3)*5+1,FALSE)&"|"&HLOOKUP(Sheet1!R2C1,Sheet1!R2C1:R16C1,MOD(RC1+1,2)+MOD(INT((RC1+1)/2),3)*5+1,FALSE)&"|"&HLOOKUP(Sheet1!R2C1,Sheet1!R2C1:R16C1,MOD(RC1+2,2)+MOD(INT((RC1+2)/2),3)*5+1,FALSE)&"|"&HLOOKUP(Sheet1!R2C1,Sheet1!R2C1:R16C1,MOD(RC1+3,2)+MOD(INT((RC1+3)/2),3)*5+1,FALSE) -> 161|100|101|130|131 | H390: =HLOOKUP(Sheet1!R2C1,Sheet1!R2C1:R16C1,MOD(RC1+2,2)+MOD(INT((RC1+2)/2),3)*5+1,FALSE)&"|"&HLOOKUP(Sheet1!R2C1,Sheet1!R2C1:R16C1,MOD(RC1+3,2)+MOD(INT((RC1+3)/2),3)*5+1,FALSE)&"|"&HLOOKUP(Sheet1!R2C1,Sheet1!R2C1:R16C1,MOD(RC1+4,2)+MOD(INT((RC1+4)/2),3)*5+1,FALSE)&"|"&HLOOKUP(Sheet1!R2C1,Sheet1!R2C1:R16C1,MOD(RC1+5,2)+MOD(INT((RC1+5)/2),3)*5+1,FALSE)&"|"&HLOOKUP(Sheet1!R2C1,Sheet1!R2C1:R16C1,MOD(RC1+6,2)+MOD(INT((RC1+6)/2),3)*5+1,FALSE) -> 130|131|160|161|100 | I390: =HLOOKUP(Sheet1!R2C1,Sheet1!R2C1:R16C1,MOD(RC1-1,3)+MOD(INT((RC1-1)/3),3)*5+3,FALSE)&"|"&HLOOKUP(Sheet1!R2C1,Sheet1!R2C1:R16C1,MOD(RC1,3)+MOD(INT((RC1)/3),3)*5+3,FALSE)&"|"&HLOOKUP(Sheet1!R2C1,Sheet1!R2C1:R16C1,MOD(RC1+1,3)+MOD(INT((RC1+1)/3),3)*5+3,FALSE)&"|"&HLOOKUP(Sheet1!R2C1,Sheet1!R2C1:R16C1,MOD(RC1+2,3)+MOD(INT((RC1+2)/3),3)*5+3,FALSE)&"|"&HLOOKUP(Sheet1!R2C1,Sheet1!R2C1:R16C1,MOD(RC1+3,3)+MOD(INT((RC1+3)/3),3)*5+3,FALSE) -> 134|162|163|164|102 | J390: =HLOOKUP(Sheet1!R2C1,Sheet1!R2C1:R16C1,MOD(RC1-1,3)+MOD(INT((RC1-1)/3),3)*5+3,FALSE)&"|"&HLOOKUP(Sheet1!R2C1,Sheet1!R2C1:R16C1,MOD(RC1,3)+MOD(INT((RC1)/3),3)*5+3,FALSE)&"|"&HLOOKUP(Sheet1!R2C1,Sheet1!R2C1:R16C1,MOD(RC1+1,3)+MOD(INT((RC1+1)/3),3)*5+3,FALSE)&"|"&HLOOKUP(Sheet1!R2C1,Sheet1!R2C1:R16C1,MOD(RC1+2,3)+MOD(INT((RC1+2)/3),3)*5+3,FALSE)&"|"&HLOOKUP(Sheet1!R2C1,Sheet1!R2C1:R16C1,MOD(RC1+3,3)+MOD(INT((RC1+3)/3),3)*5+3,FALSE) -> 134|162|163|164|102 | K390: =HLOOKUP(Sheet1!R2C1,Sheet1!R2C1:R16C1,MOD(RC1-1,3)+MOD(INT((RC1-1)/3),3)*5+3,FALSE)&"|"&HLOOKUP(Sheet1!R2C1,Sheet1!R2C1:R16C1,MOD(RC1,3)+MOD(INT((RC1)/3),3)*5+3,FALSE)&"|"&HLOOKUP(Sheet1!R2C1,Sheet1!R2C1:R16C1,MOD(RC1+1,3)+MOD(INT((RC1+1)/3),3)*5+3,FALSE)&"|"&HLOOKUP(Sheet1!R2C1,Sheet1!R2C1:R16C1,MOD(RC1+2,3)+MOD(INT((RC1+2)/3),3)*5+3,FALSE)&"|"&HLOOKUP(Sheet1!R2C1,Sheet1!R2C1:R16C1,MOD(RC1+3,3)+MOD(INT((RC1+3)/3),3)*5+3,FALSE) -> 134|162|163|164|102 | L390: 25|22|23|24 | M390: 5715966|5715966|5715968|5715968 | N390: 10030|10031|10032|10033 | O390: 1|1|1|1 | P390: 2500|2500|2500|2500
A391: 385 | B391: 383 | C391: 30 | D391: =R[-20]C+2 -> 58 | E391: 1000 | F391: =MOD(RC[-5]-1,3)*30+100&"|"&MOD(RC[-5]-1,3)*30+101&"|"&MOD(RC[-5]-1,3)*30+102&"|"&MOD(RC[-5]-1,3)*30+103&"|"&IF(MOD(RC[-5],4)=0,HLOOKUP(Sheet1!R2C10,Sheet1!R2C10:R7C10,MOD(RC[-5]/4-1,6)+1,FALSE),IF(MOD(RC[-5],2)=0,IF(RC[-5]>20,HLOOKUP(Sheet1!R2C7,Sheet1!R2C7:R43C7,MOD(RC[-5]/2-1,42)+1,FALSE),HLOOKUP(Sheet1!R2C4,Sheet1!R2C4:R7C4,MOD(RC[-5]-1,6)+1,FALSE)),MOD(RC[-5]-1,3)*30+104)) -> 100|101|102|103|104 | G391: =HLOOKUP(Sheet1!R2C1,Sheet1!R2C1:R16C1,MOD(RC1-1,2)+MOD(INT((RC1-1)/2),3)*5+1,FALSE)&"|"&HLOOKUP(Sheet1!R2C1,Sheet1!R2C1:R16C1,MOD(RC1,2)+MOD(INT((RC1)/2),3)*5+1,FALSE)&"|"&HLOOKUP(Sheet1!R2C1,Sheet1!R2C1:R16C1,MOD(RC1+1,2)+MOD(INT((RC1+1)/2),3)*5+1,FALSE)&"|"&HLOOKUP(Sheet1!R2C1,Sheet1!R2C1:R16C1,MOD(RC1+2,2)+MOD(INT((RC1+2)/2),3)*5+1,FALSE)&"|"&HLOOKUP(Sheet1!R2C1,Sheet1!R2C1:R16C1,MOD(RC1+3,2)+MOD(INT((RC1+3)/2),3)*5+1,FALSE) -> 100|101|130|131|160 | H391: =HLOOKUP(Sheet1!R2C1,Sheet1!R2C1:R16C1,MOD(RC1+2,2)+MOD(INT((RC1+2)/2),3)*5+1,FALSE)&"|"&HLOOKUP(Sheet1!R2C1,Sheet1!R2C1:R16C1,MOD(RC1+3,2)+MOD(INT((RC1+3)/2),3)*5+1,FALSE)&"|"&HLOOKUP(Sheet1!R2C1,Sheet1!R2C1:R16C1,MOD(RC1+4,2)+MOD(INT((RC1+4)/2),3)*5+1,FALSE)&"|"&HLOOKUP(Sheet1!R2C1,Sheet1!R2C1:R16C1,MOD(RC1+5,2)+MOD(INT((RC1+5)/2),3)*5+1,FALSE)&"|"&HLOOKUP(Sheet1!R2C1,Sheet1!R2C1:R16C1,MOD(RC1+6,2)+MOD(INT((RC1+6)/2),3)*5+1,FALSE) -> 131|160|161|100|101 | I391: =HLOOKUP(Sheet1!R2C1,Sheet1!R2C1:R16C1,MOD(RC1-1,3)+MOD(INT((RC1-1)/3),3)*5+3,FALSE)&"|"&HLOOKUP(Sheet1!R2C1,Sheet1!R2C1:R16C1,MOD(RC1,3)+MOD(INT((RC1)/3),3)*5+3,FALSE)&"|"&HLOOKUP(Sheet1!R2C1,Sheet1!R2C1:R16C1,MOD(RC1+1,3)+MOD(INT((RC1+1)/3),3)*5+3,FALSE)&"|"&HLOOKUP(Sheet1!R2C1,Sheet1!R2C1:R16C1,MOD(RC1+2,3)+MOD(INT((RC1+2)/3),3)*5+3,FALSE)&"|"&HLOOKUP(Sheet1!R2C1,Sheet1!R2C1:R16C1,MOD(RC1+3,3)+MOD(INT((RC1+3)/3),3)*5+3,FALSE) -> 162|163|164|102|103 | J391: =HLOOKUP(Sheet1!R2C1,Sheet1!R2C1:R16C1,MOD(RC1-1,3)+MOD(INT((RC1-1)/3),3)*5+3,FALSE)&"|"&HLOOKUP(Sheet1!R2C1,Sheet1!R2C1:R16C1,MOD(RC1,3)+MOD(INT((RC1)/3),3)*5+3,FALSE)&"|"&HLOOKUP(Sheet1!R2C1,Sheet1!R2C1:R16C1,MOD(RC1+1,3)+MOD(INT((RC1+1)/3),3)*5+3,FALSE)&"|"&HLOOKUP(Sheet1!R2C1,Sheet1!R2C1:R16C1,MOD(RC1+2,3)+MOD(INT((RC1+2)/3),3)*5+3,FALSE)&"|"&HLOOKUP(Sheet1!R2C1,Sheet1!R2C1:R16C1,MOD(RC1+3,3)+MOD(INT((RC1+3)/3),3)*5+3,FALSE) -> 162|163|164|102|103 | K391: =HLOOKUP(Sheet1!R2C1,Sheet1!R2C1:R16C1,MOD(RC1-1,3)+MOD(INT((RC1-1)/3),3)*5+3,FALSE)&"|"&HLOOKUP(Sheet1!R2C1,Sheet1!R2C1:R16C1,MOD(RC1,3)+MOD(INT((RC1)/3),3)*5+3,FALSE)&"|"&HLOOKUP(Sheet1!R2C1,Sheet1!R2C1:R16C1,MOD(RC1+1,3)+MOD(INT((RC1+1)/3),3)*5+3,FALSE)&"|"&HLOOKUP(Sheet1!R2C1,Sheet1!R2C1:R16C1,MOD(RC1+2,3)+MOD(INT((RC1+2)/3),3)*5+3,FALSE)&"|"&HLOOKUP(Sheet1!R2C1,Sheet1!R2C1:R16C1,MOD(RC1+3,3)+MOD(INT((RC1+3)/3),3)*5+3,FALSE) -> 162|163|164|102|103 | L391: 25|22|23|24 | M391: 5765205|5765205|5765205|5765205 | N391: 10030|10031|10032|10033|10030|10031|10032|10033|10030|10031|10032|10033|10030|10031|10032|10033|10030|10031|10032|10033|10030|10031|10032|10033|10030|10031|10032|10033|10030|10031|10032|10033|10030|10031|10032|10033|10030|10031|10032|10033 | O391: 1|1|1|1|1|1|1|1|1|1|1|1|1|1|1|1|1|1|1|1|1|1|1|1|1|1|1|1|1|1|1|1|1|1|1|1|1|1|1|1 | P391: 2500|2500|2500|2500|2500|2500|2500|2500|2500|2500|2500|2500|2500|2500|2500|2500|2500|2500|2500|2500|2500|2500|2500|2500|2500|2500|2500|2500|2500|2500|2500|2500|2500|2500|2500|2500|2500|2500|2500|2500
A392: 386 | B392: 384 | C392: 30 | D392: =R[-20]C+2 -> 58 | E392: 1000 | F392: =MOD(RC[-5]-1,3)*30+100&"|"&MOD(RC[-5]-1,3)*30+101&"|"&MOD(RC[-5]-1,3)*30+102&"|"&MOD(RC[-5]-1,3)*30+103&"|"&IF(MOD(RC[-5],4)=0,HLOOKUP(Sheet1!R2C10,Sheet1!R2C10:R7C10,MOD(RC[-5]/4-1,6)+1,FALSE),IF(MOD(RC[-5],2)=0,IF(RC[-5]>20,HLOOKUP(Sheet1!R2C7,Sheet1!R2C7:R43C7,MOD(RC[-5]/2-1,42)+1,FALSE),HLOOKUP(Sheet1!R2C4,Sheet1!R2C4:R7C4,MOD(RC[-5]-1,6)+1,FALSE)),MOD(RC[-5]-1,3)*30+104)) -> 130|131|132|133|152 | G392: =HLOOKUP(Sheet1!R2C1,Sheet1!R2C1:R16C1,MOD(RC1-1,2)+MOD(INT((RC1-1)/2),3)*5+1,FALSE)&"|"&HLOOKUP(Sheet1!R2C1,Sheet1!R2C1:R16C1,MOD(RC1,2)+MOD(INT((RC1)/2),3)*5+1,FALSE)&"|"&HLOOKUP(Sheet1!R2C1,Sheet1!R2C1:R16C1,MOD(RC1+1,2)+MOD(INT((RC1+1)/2),3)*5+1,FALSE)&"|"&HLOOKUP(Sheet1!R2C1,Sheet1!R2C1:R16C1,MOD(RC1+2,2)+MOD(INT((RC1+2)/2),3)*5+1,FALSE)&"|"&HLOOKUP(Sheet1!R2C1,Sheet1!R2C1:R16C1,MOD(RC1+3,2)+MOD(INT((RC1+3)/2),3)*5+1,FALSE) -> 101|130|131|160|161 | H392: =HLOOKUP(Sheet1!R2C1,Sheet1!R2C1:R16C1,MOD(RC1+2,2)+MOD(INT((RC1+2)/2),3)*5+1,FALSE)&"|"&HLOOKUP(Sheet1!R2C1,Sheet1!R2C1:R16C1,MOD(RC1+3,2)+MOD(INT((RC1+3)/2),3)*5+1,FALSE)&"|"&HLOOKUP(Sheet1!R2C1,Sheet1!R2C1:R16C1,MOD(RC1+4,2)+MOD(INT((RC1+4)/2),3)*5+1,FALSE)&"|"&HLOOKUP(Sheet1!R2C1,Sheet1!R2C1:R16C1,MOD(RC1+5,2)+MOD(INT((RC1+5)/2),3)*5+1,FALSE)&"|"&HLOOKUP(Sheet1!R2C1,Sheet1!R2C1:R16C1,MOD(RC1+6,2)+MOD(INT((RC1+6)/2),3)*5+1,FALSE) -> 160|161|100|101|130 | I392: =HLOOKUP(Sheet1!R2C1,Sheet1!R2C1:R16C1,MOD(RC1-1,3)+MOD(INT((RC1-1)/3),3)*5+3,FALSE)&"|"&HLOOKUP(Sheet1!R2C1,Sheet1!R2C1:R16C1,MOD(RC1,3)+MOD(INT((RC1)/3),3)*5+3,FALSE)&"|"&HLOOKUP(Sheet1!R2C1,Sheet1!R2C1:R16C1,MOD(RC1+1,3)+MOD(INT((RC1+1)/3),3)*5+3,FALSE)&"|"&HLOOKUP(Sheet1!R2C1,Sheet1!R2C1:R16C1,MOD(RC1+2,3)+MOD(INT((RC1+2)/3),3)*5+3,FALSE)&"|"&HLOOKUP(Sheet1!R2C1,Sheet1!R2C1:R16C1,MOD(RC1+3,3)+MOD(INT((RC1+3)/3),3)*5+3,FALSE) -> 163|164|102|103|104 | J392: =HLOOKUP(Sheet1!R2C1,Sheet1!R2C1:R16C1,MOD(RC1-1,3)+MOD(INT((RC1-1)/3),3)*5+3,FALSE)&"|"&HLOOKUP(Sheet1!R2C1,Sheet1!R2C1:R16C1,MOD(RC1,3)+MOD(INT((RC1)/3),3)*5+3,FALSE)&"|"&HLOOKUP(Sheet1!R2C1,Sheet1!R2C1:R16C1,MOD(RC1+1,3)+MOD(INT((RC1+1)/3),3)*5+3,FALSE)&"|"&HLOOKUP(Sheet1!R2C1,Sheet1!R2C1:R16C1,MOD(RC1+2,3)+MOD(INT((RC1+2)/3),3)*5+3,FALSE)&"|"&HLOOKUP(Sheet1!R2C1,Sheet1!R2C1:R16C1,MOD(RC1+3,3)+MOD(INT((RC1+3)/3),3)*5+3,FALSE) -> 163|164|102|103|104 | K392: =HLOOKUP(Sheet1!R2C1,Sheet1!R2C1:R16C1,MOD(RC1-1,3)+MOD(INT((RC1-1)/3),3)*5+3,FALSE)&"|"&HLOOKUP(Sheet1!R2C1,Sheet1!R2C1:R16C1,MOD(RC1,3)+MOD(INT((RC1)/3),3)*5+3,FALSE)&"|"&HLOOKUP(Sheet1!R2C1,Sheet1!R2C1:R16C1,MOD(RC1+1,3)+MOD(INT((RC1+1)/3),3)*5+3,FALSE)&"|"&HLOOKUP(Sheet1!R2C1,Sheet1!R2C1:R16C1,MOD(RC1+2,3)+MOD(INT((RC1+2)/3),3)*5+3,FALSE)&"|"&HLOOKUP(Sheet1!R2C1,Sheet1!R2C1:R16C1,MOD(RC1+3,3)+MOD(INT((RC1+3)/3),3)*5+3,FALSE) -> 163|164|102|103|104 | L392: 25|22|23|24 | M392: 5815902|5815903|5815903|5815903 | N392: 10030|10031|10032|10033 | O392: 1|1|1|1 | P392: 2500|2500|2500|2500
A393: 387 | B393: 385 | C393: 30 | D393: =R[-20]C+2 -> 58 | E393: 1000 | F393: =MOD(RC[-5]-1,3)*30+100&"|"&MOD(RC[-5]-1,3)*30+101&"|"&MOD(RC[-5]-1,3)*30+102&"|"&MOD(RC[-5]-1,3)*30+103&"|"&IF(MOD(RC[-5],4)=0,HLOOKUP(Sheet1!R2C10,Sheet1!R2C10:R7C10,MOD(RC[-5]/4-1,6)+1,FALSE),IF(MOD(RC[-5],2)=0,IF(RC[-5]>20,HLOOKUP(Sheet1!R2C7,Sheet1!R2C7:R43C7,MOD(RC[-5]/2-1,42)+1,FALSE),HLOOKUP(Sheet1!R2C4,Sheet1!R2C4:R7C4,MOD(RC[-5]-1,6)+1,FALSE)),MOD(RC[-5]-1,3)*30+104)) -> 160|161|162|163|164 | G393: =HLOOKUP(Sheet1!R2C1,Sheet1!R2C1:R16C1,MOD(RC1-1,2)+MOD(INT((RC1-1)/2),3)*5+1,FALSE)&"|"&HLOOKUP(Sheet1!R2C1,Sheet1!R2C1:R16C1,MOD(RC1,2)+MOD(INT((RC1)/2),3)*5+1,FALSE)&"|"&HLOOKUP(Sheet1!R2C1,Sheet1!R2C1:R16C1,MOD(RC1+1,2)+MOD(INT((RC1+1)/2),3)*5+1,FALSE)&"|"&HLOOKUP(Sheet1!R2C1,Sheet1!R2C1:R16C1,MOD(RC1+2,2)+MOD(INT((RC1+2)/2),3)*5+1,FALSE)&"|"&HLOOKUP(Sheet1!R2C1,Sheet1!R2C1:R16C1,MOD(RC1+3,2)+MOD(INT((RC1+3)/2),3)*5+1,FALSE) -> 130|131|160|161|100 | H393: =HLOOKUP(Sheet1!R2C1,Sheet1!R2C1:R16C1,MOD(RC1+2,2)+MOD(INT((RC1+2)/2),3)*5+1,FALSE)&"|"&HLOOKUP(Sheet1!R2C1,Sheet1!R2C1:R16C1,MOD(RC1+3,2)+MOD(INT((RC1+3)/2),3)*5+1,FALSE)&"|"&HLOOKUP(Sheet1!R2C1,Sheet1!R2C1:R16C1,MOD(RC1+4,2)+MOD(INT((RC1+4)/2),3)*5+1,FALSE)&"|"&HLOOKUP(Sheet1!R2C1,Sheet1!R2C1:R16C1,MOD(RC1+5,2)+MOD(INT((RC1+5)/2),3)*5+1,FALSE)&"|"&HLOOKUP(Sheet1!R2C1,Sheet1!R2C1:R16C1,MOD(RC1+6,2)+MOD(INT((RC1+6)/2),3)*5+1,FALSE) -> 161|100|101|130|131 | I393: =HLOOKUP(Sheet1!R2C1,Sheet1!R2C1:R16C1,MOD(RC1-1,3)+MOD(INT((RC1-1)/3),3)*5+3,FALSE)&"|"&HLOOKUP(Sheet1!R2C1,Sheet1!R2C1:R16C1,MOD(RC1,3)+MOD(INT((RC1)/3),3)*5+3,FALSE)&"|"&HLOOKUP(Sheet1!R2C1,Sheet1!R2C1:R16C1,MOD(RC1+1,3)+MOD(INT((RC1+1)/3),3)*5+3,FALSE)&"|"&HLOOKUP(Sheet1!R2C1,Sheet1!R2C1:R16C1,MOD(RC1+2,3)+MOD(INT((RC1+2)/3),3)*5+3,FALSE)&"|"&HLOOKUP(Sheet1!R2C1,Sheet1!R2C1:R16C1,MOD(RC1+3,3)+MOD(INT((RC1+3)/3),3)*5+3,FALSE) -> 164|102|103|104|132 | J393: =HLOOKUP(Sheet1!R2C1,Sheet1!R2C1:R16C1,MOD(RC1-1,3)+MOD(INT((RC1-1)/3),3)*5+3,FALSE)&"|"&HLOOKUP(Sheet1!R2C1,Sheet1!R2C1:R16C1,MOD(RC1,3)+MOD(INT((RC1)/3),3)*5+3,FALSE)&"|"&HLOOKUP(Sheet1!R2C1,Sheet1!R2C1:R16C1,MOD(RC1+1,3)+MOD(INT((RC1+1)/3),3)*5+3,FALSE)&"|"&HLOOKUP(Sheet1!R2C1,Sheet1!R2C1:R16C1,MOD(RC1+2,3)+MOD(INT((RC1+2)/3),3)*5+3,FALSE)&"|"&HLOOKUP(Sheet1!R2C1,Sheet1!R2C1:R16C1,MOD(RC1+3,3)+MOD(INT((RC1+3)/3),3)*5+3,FALSE) -> 164|102|103|104|132 | K393: =HLOOKUP(Sheet1!R2C1,Sheet1!R2C1:R16C1,MOD(RC1-1,3)+MOD(INT((RC1-1)/3),3)*5+3,FALSE)&"|"&HLOOKUP(Sheet1!R2C1,Sheet1!R2C1:R16C1,MOD(RC1,3)+MOD(INT((RC1)/3),3)*5+3,FALSE)&"|"&HLOOKUP(Sheet1!R2C1,Sheet1!R2C1:R16C1,MOD(RC1+1,3)+MOD(INT((RC1+1)/3),3)*5+3,FALSE)&"|"&HLOOKUP(Sheet1!R2C1,Sheet1!R2C1:R16C1,MOD(RC1+2,3)+MOD(INT((RC1+2)/3),3)*5+3,FALSE)&"|"&HLOOKUP(Sheet1!R2C1,Sheet1!R2C1:R16C1,MOD(RC1+3,3)+MOD(INT((RC1+3)/3),3)*5+3,FALSE) -> 164|102|103|104|132 | L393: 25|22|23|24 | M393: 5868713|5868713|5868713|5868713 | N393: 10030|10031|10032|10033 | O393: 1|1|1|1 | P393: 2500|2500|2500|2500
A394: 388 | B394: 386 | C394: 30 | D394: =R[-20]C+2 -> 58 | E394: 1000 | F394: =MOD(RC[-5]-1,3)*30+100&"|"&MOD(RC[-5]-1,3)*30+101&"|"&MOD(RC[-5]-1,3)*30+102&"|"&MOD(RC[-5]-1,3)*30+103&"|"&IF(MOD(RC[-5],4)=0,HLOOKUP(Sheet1!R2C10,Sheet1!R2C10:R7C10,MOD(RC[-5]/4-1,6)+1,FALSE),IF(MOD(RC[-5],2)=0,IF(RC[-5]>20,HLOOKUP(Sheet1!R2C7,Sheet1!R2C7:R43C7,MOD(RC[-5]/2-1,42)+1,FALSE),HLOOKUP(Sheet1!R2C4,Sheet1!R2C4:R7C4,MOD(RC[-5]-1,6)+1,FALSE)),MOD(RC[-5]-1,3)*30+104)) -> 100|101|102|103|190 | G394: =HLOOKUP(Sheet1!R2C1,Sheet1!R2C1:R16C1,MOD(RC1-1,2)+MOD(INT((RC1-1)/2),3)*5+1,FALSE)&"|"&HLOOKUP(Sheet1!R2C1,Sheet1!R2C1:R16C1,MOD(RC1,2)+MOD(INT((RC1)/2),3)*5+1,FALSE)&"|"&HLOOKUP(Sheet1!R2C1,Sheet1!R2C1:R16C1,MOD(RC1+1,2)+MOD(INT((RC1+1)/2),3)*5+1,FALSE)&"|"&HLOOKUP(Sheet1!R2C1,Sheet1!R2C1:R16C1,MOD(RC1+2,2)+MOD(INT((RC1+2)/2),3)*5+1,FALSE)&"|"&HLOOKUP(Sheet1!R2C1,Sheet1!R2C1:R16C1,MOD(RC1+3,2)+MOD(INT((RC1+3)/2),3)*5+1,FALSE) -> 131|160|161|100|101 | H394: =HLOOKUP(Sheet1!R2C1,Sheet1!R2C1:R16C1,MOD(RC1+2,2)+MOD(INT((RC1+2)/2),3)*5+1,FALSE)&"|"&HLOOKUP(Sheet1!R2C1,Sheet1!R2C1:R16C1,MOD(RC1+3,2)+MOD(INT((RC1+3)/2),3)*5+1,FALSE)&"|"&HLOOKUP(Sheet1!R2C1,Sheet1!R2C1:R16C1,MOD(RC1+4,2)+MOD(INT((RC1+4)/2),3)*5+1,FALSE)&"|"&HLOOKUP(Sheet1!R2C1,Sheet1!R2C1:R16C1,MOD(RC1+5,2)+MOD(INT((RC1+5)/2),3)*5+1,FALSE)&"|"&HLOOKUP(Sheet1!R2C1,Sheet1!R2C1:R16C1,MOD(RC1+6,2)+MOD(INT((RC1+6)/2),3)*5+1,FALSE) -> 100|101|130|131|160 | I394: =HLOOKUP(Sheet1!R2C1,Sheet1!R2C1:R16C1,MOD(RC1-1,3)+MOD(INT((RC1-1)/3),3)*5+3,FALSE)&"|"&HLOOKUP(Sheet1!R2C1,Sheet1!R2C1:R16C1,MOD(RC1,3)+MOD(INT((RC1)/3),3)*5+3,FALSE)&"|"&HLOOKUP(Sheet1!R2C1,Sheet1!R2C1:R16C1,MOD(RC1+1,3)+MOD(INT((RC1+1)/3),3)*5+3,FALSE)&"|"&HLOOKUP(Sheet1!R2C1,Sheet1!R2C1:R16C1,MOD(RC1+2,3)+MOD(INT((RC1+2)/3),3)*5+3,FALSE)&"|"&HLOOKUP(Sheet1!R2C1,Sheet1!R2C1:R16C1,MOD(RC1+3,3)+MOD(INT((RC1+3)/3),3)*5+3,FALSE) -> 102|103|104|132|133 | J394: =HLOOKUP(Sheet1!R2C1,Sheet1!R2C1:R16C1,MOD(RC1-1,3)+MOD(INT((RC1-1)/3),3)*5+3,FALSE)&"|"&HLOOKUP(Sheet1!R2C1,Sheet1!R2C1:R16C1,MOD(RC1,3)+MOD(INT((RC1)/3),3)*5+3,FALSE)&"|"&HLOOKUP(Sheet1!R2C1,Sheet1!R2C1:R16C1,MOD(RC1+1,3)+MOD(INT((RC1+1)/3),3)*5+3,FALSE)&"|"&HLOOKUP(Sheet1!R2C1,Sheet1!R2C1:R16C1,MOD(RC1+2,3)+MOD(INT((RC1+2)/3),3)*5+3,FALSE)&"|"&HLOOKUP(Sheet1!R2C1,Sheet1!R2C1:R16C1,MOD(RC1+3,3)+MOD(INT((RC1+3)/3),3)*5+3,FALSE) -> 102|103|104|132|133 | K394: =HLOOKUP(Sheet1!R2C1,Sheet1!R2C1:R16C1,MOD(RC1-1,3)+MOD(INT((RC1-1)/3),3)*5+3,FALSE)&"|"&HLOOKUP(Sheet1!R2C1,Sheet1!R2C1:R16C1,MOD(RC1,3)+MOD(INT((RC1)/3),3)*5+3,FALSE)&"|"&HLOOKUP(Sheet1!R2C1,Sheet1!R2C1:R16C1,MOD(RC1+1,3)+MOD(INT((RC1+1)/3),3)*5+3,FALSE)&"|"&HLOOKUP(Sheet1!R2C1,Sheet1!R2C1:R16C1,MOD(RC1+2,3)+MOD(INT((RC1+2)/3),3)*5+3,FALSE)&"|"&HLOOKUP(Sheet1!R2C1,Sheet1!R2C1:R16C1,MOD(RC1+3,3)+MOD(INT((RC1+3)/3),3)*5+3,FALSE) -> 102|103|104|132|133 | L394: 25|22|23|24 | M394: 5919411|5919411|5919410|5919410 | N394: 10030|10031|10032|10033 | O394: 1|1|1|1 | P394: 2500|2500|2500|2500
A395: 389 | B395: 387 | C395: 30 | D395: =R[-20]C+2 -> 58 | E395: 1000 | F395: =MOD(RC[-5]-1,3)*30+100&"|"&MOD(RC[-5]-1,3)*30+101&"|"&MOD(RC[-5]-1,3)*30+102&"|"&MOD(RC[-5]-1,3)*30+103&"|"&IF(MOD(RC[-5],4)=0,HLOOKUP(Sheet1!R2C10,Sheet1!R2C10:R7C10,MOD(RC[-5]/4-1,6)+1,FALSE),IF(MOD(RC[-5],2)=0,IF(RC[-5]>20,HLOOKUP(Sheet1!R2C7,Sheet1!R2C7:R43C7,MOD(RC[-5]/2-1,42)+1,FALSE),HLOOKUP(Sheet1!R2C4,Sheet1!R2C4:R7C4,MOD(RC[-5]-1,6)+1,FALSE)),MOD(RC[-5]-1,3)*30+104)) -> 130|131|132|133|134 | G395: =HLOOKUP(Sheet1!R2C1,Sheet1!R2C1:R16C1,MOD(RC1-1,2)+MOD(INT((RC1-1)/2),3)*5+1,FALSE)&"|"&HLOOKUP(Sheet1!R2C1,Sheet1!R2C1:R16C1,MOD(RC1,2)+MOD(INT((RC1)/2),3)*5+1,FALSE)&"|"&HLOOKUP(Sheet1!R2C1,Sheet1!R2C1:R16C1,MOD(RC1+1,2)+MOD(INT((RC1+1)/2),3)*5+1,FALSE)&"|"&HLOOKUP(Sheet1!R2C1,Sheet1!R2C1:R16C1,MOD(RC1+2,2)+MOD(INT((RC1+2)/2),3)*5+1,FALSE)&"|"&HLOOKUP(Sheet1!R2C1,Sheet1!R2C1:R16C1,MOD(RC1+3,2)+MOD(INT((RC1+3)/2),3)*5+1,FALSE) -> 160|161|100|101|130 | H395: =HLOOKUP(Sheet1!R2C1,Sheet1!R2C1:R16C1,MOD(RC1+2,2)+MOD(INT((RC1+2)/2),3)*5+1,FALSE)&"|"&HLOOKUP(Sheet1!R2C1,Sheet1!R2C1:R16C1,MOD(RC1+3,2)+MOD(INT((RC1+3)/2),3)*5+1,FALSE)&"|"&HLOOKUP(Sheet1!R2C1,Sheet1!R2C1:R16C1,MOD(RC1+4,2)+MOD(INT((RC1+4)/2),3)*5+1,FALSE)&"|"&HLOOKUP(Sheet1!R2C1,Sheet1!R2C1:R16C1,MOD(RC1+5,2)+MOD(INT((RC1+5)/2),3)*5+1,FALSE)&"|"&HLOOKUP(Sheet1!R2C1,Sheet1!R2C1:R16C1,MOD(RC1+6,2)+MOD(INT((RC1+6)/2),3)*5+1,FALSE) -> 101|130|131|160|161 | I395: =HLOOKUP(Sheet1!R2C1,Sheet1!R2C1:R16C1,MOD(RC1-1,3)+MOD(INT((RC1-1)/3),3)*5+3,FALSE)&"|"&HLOOKUP(Sheet1!R2C1,Sheet1!R2C1:R16C1,MOD(RC1,3)+MOD(INT((RC1)/3),3)*5+3,FALSE)&"|"&HLOOKUP(Sheet1!R2C1,Sheet1!R2C1:R16C1,MOD(RC1+1,3)+MOD(INT((RC1+1)/3),3)*5+3,FALSE)&"|"&HLOOKUP(Sheet1!R2C1,Sheet1!R2C1:R16C1,MOD(RC1+2,3)+MOD(INT((RC1+2)/3),3)*5+3,FALSE)&"|"&HLOOKUP(Sheet1!R2C1,Sheet1!R2C1:R16C1,MOD(RC1+3,3)+MOD(INT((RC1+3)/3),3)*5+3,FALSE) -> 103|104|132|133|134 | J395: =HLOOKUP(Sheet1!R2C1,Sheet1!R2C1:R16C1,MOD(RC1-1,3)+MOD(INT((RC1-1)/3),3)*5+3,FALSE)&"|"&HLOOKUP(Sheet1!R2C1,Sheet1!R2C1:R16C1,MOD(RC1,3)+MOD(INT((RC1)/3),3)*5+3,FALSE)&"|"&HLOOKUP(Sheet1!R2C1,Sheet1!R2C1:R16C1,MOD(RC1+1,3)+MOD(INT((RC1+1)/3),3)*5+3,FALSE)&"|"&HLOOKUP(Sheet1!R2C1,Sheet1!R2C1:R16C1,MOD(RC1+2,3)+MOD(INT((RC1+2)/3),3)*5+3,FALSE)&"|"&HLOOKUP(Sheet1!R2C1,Sheet1!R2C1:R16C1,MOD(RC1+3,3)+MOD(INT((RC1+3)/3),3)*5+3,FALSE) -> 103|104|132|133|134 | K395: =HLOOKUP(Sheet1!R2C1,Sheet1!R2C1:R16C1,MOD(RC1-1,3)+MOD(INT((RC1-1)/3),3)*5+3,FALSE)&"|"&HLOOKUP(Sheet1!R2C1,Sheet1!R2C1:R16C1,MOD(RC1,3)+MOD(INT((RC1)/3),3)*5+3,FALSE)&"|"&HLOOKUP(Sheet1!R2C1,Sheet1!R2C1:R16C1,MOD(RC1+1,3)+MOD(INT((RC1+1)/3),3)*5+3,FALSE)&"|"&HLOOKUP(Sheet1!R2C1,Sheet1!R2C1:R16C1,MOD(RC1+2,3)+MOD(INT((RC1+2)/3),3)*5+3,FALSE)&"|"&HLOOKUP(Sheet1!R2C1,Sheet1!R2C1:R16C1,MOD(RC1+3,3)+MOD(INT((RC1+3)/3),3)*5+3,FALSE) -> 103|104|132|133|134 | L395: 25|22|23|24 | M395: 5970271|5970271|5970270|5970270 | N395: 10030|10031|10032|10033 | O395: 1|1|1|1 | P395: 2500|2500|2500|2500
A396: 390 | B396: 388 | C396: 30 | D396: =R[-20]C+2 -> 58 | E396: 1000 | F396: =MOD(RC[-5]-1,3)*30+100&"|"&MOD(RC[-5]-1,3)*30+101&"|"&MOD(RC[-5]-1,3)*30+102&"|"&MOD(RC[-5]-1,3)*30+103&"|"&IF(MOD(RC[-5],4)=0,HLOOKUP(Sheet1!R2C10,Sheet1!R2C10:R7C10,MOD(RC[-5]/4-1,6)+1,FALSE),IF(MOD(RC[-5],2)=0,IF(RC[-5]>20,HLOOKUP(Sheet1!R2C7,Sheet1!R2C7:R43C7,MOD(RC[-5]/2-1,42)+1,FALSE),HLOOKUP(Sheet1!R2C4,Sheet1!R2C4:R7C4,MOD(RC[-5]-1,6)+1,FALSE)),MOD(RC[-5]-1,3)*30+104)) -> 160|161|162|163|154 | G396: =HLOOKUP(Sheet1!R2C1,Sheet1!R2C1:R16C1,MOD(RC1-1,2)+MOD(INT((RC1-1)/2),3)*5+1,FALSE)&"|"&HLOOKUP(Sheet1!R2C1,Sheet1!R2C1:R16C1,MOD(RC1,2)+MOD(INT((RC1)/2),3)*5+1,FALSE)&"|"&HLOOKUP(Sheet1!R2C1,Sheet1!R2C1:R16C1,MOD(RC1+1,2)+MOD(INT((RC1+1)/2),3)*5+1,FALSE)&"|"&HLOOKUP(Sheet1!R2C1,Sheet1!R2C1:R16C1,MOD(RC1+2,2)+MOD(INT((RC1+2)/2),3)*5+1,FALSE)&"|"&HLOOKUP(Sheet1!R2C1,Sheet1!R2C1:R16C1,MOD(RC1+3,2)+MOD(INT((RC1+3)/2),3)*5+1,FALSE) -> 161|100|101|130|131 | H396: =HLOOKUP(Sheet1!R2C1,Sheet1!R2C1:R16C1,MOD(RC1+2,2)+MOD(INT((RC1+2)/2),3)*5+1,FALSE)&"|"&HLOOKUP(Sheet1!R2C1,Sheet1!R2C1:R16C1,MOD(RC1+3,2)+MOD(INT((RC1+3)/2),3)*5+1,FALSE)&"|"&HLOOKUP(Sheet1!R2C1,Sheet1!R2C1:R16C1,MOD(RC1+4,2)+MOD(INT((RC1+4)/2),3)*5+1,FALSE)&"|"&HLOOKUP(Sheet1!R2C1,Sheet1!R2C1:R16C1,MOD(RC1+5,2)+MOD(INT((RC1+5)/2),3)*5+1,FALSE)&"|"&HLOOKUP(Sheet1!R2C1,Sheet1!R2C1:R16C1,MOD(RC1+6,2)+MOD(INT((RC1+6)/2),3)*5+1,FALSE) -> 130|131|160|161|100 | I396: =HLOOKUP(Sheet1!R2C1,Sheet1!R2C1:R16C1,MOD(RC1-1,3)+MOD(INT((RC1-1)/3),3)*5+3,FALSE)&"|"&HLOOKUP(Sheet1!R2C1,Sheet1!R2C1:R16C1,MOD(RC1,3)+MOD(INT((RC1)/3),3)*5+3,FALSE)&"|"&HLOOKUP(Sheet1!R2C1,Sheet1!R2C1:R16C1,MOD(RC1+1,3)+MOD(INT((RC1+1)/3),3)*5+3,FALSE)&"|"&HLOOKUP(Sheet1!R2C1,Sheet1!R2C1:R16C1,MOD(RC1+2,3)+MOD(INT((RC1+2)/3),3)*5+3,FALSE)&"|"&HLOOKUP(Sheet1!R2C1,Sheet1!R2C1:R16C1,MOD(RC1+3,3)+MOD(INT((RC1+3)/3),3)*5+3,FALSE) -> 104|132|133|134|162 | J396: =HLOOKUP(Sheet1!R2C1,Sheet1!R2C1:R16C1,MOD(RC1-1,3)+MOD(INT((RC1-1)/3),3)*5+3,FALSE)&"|"&HLOOKUP(Sheet1!R2C1,Sheet1!R2C1:R16C1,MOD(RC1,3)+MOD(INT((RC1)/3),3)*5+3,FALSE)&"|"&HLOOKUP(Sheet1!R2C1,Sheet1!R2C1:R16C1,MOD(RC1+1,3)+MOD(INT((RC1+1)/3),3)*5+3,FALSE)&"|"&HLOOKUP(Sheet1!R2C1,Sheet1!R2C1:R16C1,MOD(RC1+2,3)+MOD(INT((RC1+2)/3),3)*5+3,FALSE)&"|"&HLOOKUP(Sheet1!R2C1,Sheet1!R2C1:R16C1,MOD(RC1+3,3)+MOD(INT((RC1+3)/3),3)*5+3,FALSE) -> 104|132|133|134|162 | K396: =HLOOKUP(Sheet1!R2C1,Sheet1!R2C1:R16C1,MOD(RC1-1,3)+MOD(INT((RC1-1)/3),3)*5+3,FALSE)&"|"&HLOOKUP(Sheet1!R2C1,Sheet1!R2C1:R16C1,MOD(RC1,3)+MOD(INT((RC1)/3),3)*5+3,FALSE)&"|"&HLOOKUP(Sheet1!R2C1,Sheet1!R2C1:R16C1,MOD(RC1+1,3)+MOD(INT((RC1+1)/3),3)*5+3,FALSE)&"|"&HLOOKUP(Sheet1!R2C1,Sheet1!R2C1:R16C1,MOD(RC1+2,3)+MOD(INT((RC1+2)/3),3)*5+3,FALSE)&"|"&HLOOKUP(Sheet1!R2C1,Sheet1!R2C1:R16C1,MOD(RC1+3,3)+MOD(INT((RC1+3)/3),3)*5+3,FALSE) -> 104|132|133|134|162 | L396: 25|22|23|24 | M396: 6022916|6022916|6022915|6022915 | N396: 10030|10031|10032|10033|10030|10031|10032|10033|10030|10031|10032|10033|10030|10031|10032|10033|10030|10031|10032|10033|10030|10031|10032|10033|10030|10031|10032|10033|10030|10031|10032|10033|10030|10031|10032|10033|10030|10031|10032|10033 | O396: 1|1|1|1|1|1|1|1|1|1|1|1|1|1|1|1|1|1|1|1|1|1|1|1|1|1|1|1|1|1|1|1|1|1|1|1|1|1|1|1 | P396: 2500|2500|2500|2500|2500|2500|2500|2500|2500|2500|2500|2500|2500|2500|2500|2500|2500|2500|2500|2500|2500|2500|2500|2500|2500|2500|2500|2500|2500|2500|2500|2500|2500|2500|2500|2500|2500|2500|2500|2500
A397: 391 | B397: 389 | C397: 30 | D397: =R[-20]C+2 -> 58 | E397: 1000 | F397: =MOD(RC[-5]-1,3)*30+100&"|"&MOD(RC[-5]-1,3)*30+101&"|"&MOD(RC[-5]-1,3)*30+102&"|"&MOD(RC[-5]-1,3)*30+103&"|"&IF(MOD(RC[-5],4)=0,HLOOKUP(Sheet1!R2C10,Sheet1!R2C10:R7C10,MOD(RC[-5]/4-1,6)+1,FALSE),IF(MOD(RC[-5],2)=0,IF(RC[-5]>20,HLOOKUP(Sheet1!R2C7,Sheet1!R2C7:R43C7,MOD(RC[-5]/2-1,42)+1,FALSE),HLOOKUP(Sheet1!R2C4,Sheet1!R2C4:R7C4,MOD(RC[-5]-1,6)+1,FALSE)),MOD(RC[-5]-1,3)*30+104)) -> 100|101|102|103|104 | G397: =HLOOKUP(Sheet1!R2C1,Sheet1!R2C1:R16C1,MOD(RC1-1,2)+MOD(INT((RC1-1)/2),3)*5+1,FALSE)&"|"&HLOOKUP(Sheet1!R2C1,Sheet1!R2C1:R16C1,MOD(RC1,2)+MOD(INT((RC1)/2),3)*5+1,FALSE)&"|"&HLOOKUP(Sheet1!R2C1,Sheet1!R2C1:R16C1,MOD(RC1+1,2)+MOD(INT((RC1+1)/2),3)*5+1,FALSE)&"|"&HLOOKUP(Sheet1!R2C1,Sheet1!R2C1:R16C1,MOD(RC1+2,2)+MOD(INT((RC1+2)/2),3)*5+1,FALSE)&"|"&HLOOKUP(Sheet1!R2C1,Sheet1!R2C1:R16C1,MOD(RC1+3,2)+MOD(INT((RC1+3)/2),3)*5+1,FALSE) -> 100|101|130|131|160 | H397: =HLOOKUP(Sheet1!R2C1,Sheet1!R2C1:R16C1,MOD(RC1+2,2)+MOD(INT((RC1+2)/2),3)*5+1,FALSE)&"|"&HLOOKUP(Sheet1!R2C1,Sheet1!R2C1:R16C1,MOD(RC1+3,2)+MOD(INT((RC1+3)/2),3)*5+1,FALSE)&"|"&HLOOKUP(Sheet1!R2C1,Sheet1!R2C1:R16C1,MOD(RC1+4,2)+MOD(INT((RC1+4)/2),3)*5+1,FALSE)&"|"&HLOOKUP(Sheet1!R2C1,Sheet1!R2C1:R16C1,MOD(RC1+5,2)+MOD(INT((RC1+5)/2),3)*5+1,FALSE)&"|"&HLOOKUP(Sheet1!R2C1,Sheet1!R2C1:R16C1,MOD(RC1+6,2)+MOD(INT((RC1+6)/2),3)*5+1,FALSE) -> 131|160|161|100|101 | I397: =HLOOKUP(Sheet1!R2C1,Sheet1!R2C1:R16C1,MOD(RC1-1,3)+MOD(INT((RC1-1)/3),3)*5+3,FALSE)&"|"&HLOOKUP(Sheet1!R2C1,Sheet1!R2C1:R16C1,MOD(RC1,3)+MOD(INT((RC1)/3),3)*5+3,FALSE)&"|"&HLOOKUP(Sheet1!R2C1,Sheet1!R2C1:R16C1,MOD(RC1+1,3)+MOD(INT((RC1+1)/3),3)*5+3,FALSE)&"|"&HLOOKUP(Sheet1!R2C1,Sheet1!R2C1:R16C1,MOD(RC1+2,3)+MOD(INT((RC1+2)/3),3)*5+3,FALSE)&"|"&HLOOKUP(Sheet1!R2C1,Sheet1!R2C1:R16C1,MOD(RC1+3,3)+MOD(INT((RC1+3)/3),3)*5+3,FALSE) -> 132|133|134|162|163 | J397: =HLOOKUP(Sheet1!R2C1,Sheet1!R2C1:R16C1,MOD(RC1-1,3)+MOD(INT((RC1-1)/3),3)*5+3,FALSE)&"|"&HLOOKUP(Sheet1!R2C1,Sheet1!R2C1:R16C1,MOD(RC1,3)+MOD(INT((RC1)/3),3)*5+3,FALSE)&"|"&HLOOKUP(Sheet1!R2C1,Sheet1!R2C1:R16C1,MOD(RC1+1,3)+MOD(INT((RC1+1)/3),3)*5+3,FALSE)&"|"&HLOOKUP(Sheet1!R2C1,Sheet1!R2C1:R16C1,MOD(RC1+2,3)+MOD(INT((RC1+2)/3),3)*5+3,FALSE)&"|"&HLOOKUP(Sheet1!R2C1,Sheet1!R2C1:R16C1,MOD(RC1+3,3)+MOD(INT((RC1+3)/3),3)*5+3,FALSE) -> 132|133|134|162|163 | K397: =HLOOKUP(Sheet1!R2C1,Sheet1!R2C1:R16C1,MOD(RC1-1,3)+MOD(INT((RC1-1)/3),3)*5+3,FALSE)&"|"&HLOOKUP(Sheet1!R2C1,Sheet1!R2C1:R16C1,MOD(RC1,3)+MOD(INT((RC1)/3),3)*5+3,FALSE)&"|"&HLOOKUP(Sheet1!R2C1,Sheet1!R2C1:R16C1,MOD(RC1+1,3)+MOD(INT((RC1+1)/3),3)*5+3,FALSE)&"|"&HLOOKUP(Sheet1!R2C1,Sheet1!R2C1:R16C1,MOD(RC1+2,3)+MOD(INT((RC1+2)/3),3)*5+3,FALSE)&"|"&HLOOKUP(Sheet1!R2C1,Sheet1!R2C1:R16C1,MOD(RC1+3,3)+MOD(INT((RC1+3)/3),3)*5+3,FALSE) -> 132|133|134|162|163 | L397: 25|22|23|24 | M397: 6077755|6077755|6077755|6077755 | N397: 10030|10031|10032|10033 | O397: 1|1|1|1 | P397: 2500|2500|2500|2500
A398: 392 | B398: 390 | C398: 30 | D398: =R[-20]C+2 -> 58 | E398: 1000 | F398: =MOD(RC[-5]-1,3)*30+100&"|"&MOD(RC[-5]-1,3)*30+101&"|"&MOD(RC[-5]-1,3)*30+102&"|"&MOD(RC[-5]-1,3)*30+103&"|"&IF(MOD(RC[-5],4)=0,HLOOKUP(Sheet1!R2C10,Sheet1!R2C10:R7C10,MOD(RC[-5]/4-1,6)+1,FALSE),IF(MOD(RC[-5],2)=0,IF(RC[-5]>20,HLOOKUP(Sheet1!R2C7,Sheet1!R2C7:R43C7,MOD(RC[-5]/2-1,42)+1,FALSE),HLOOKUP(Sheet1!R2C4,Sheet1!R2C4:R7C4,MOD(RC[-5]-1,6)+1,FALSE)),MOD(RC[-5]-1,3)*30+104)) -> 130|131|132|133|191 | G398: =HLOOKUP(Sheet1!R2C1,Sheet1!R2C1:R16C1,MOD(RC1-1,2)+MOD(INT((RC1-1)/2),3)*5+1,FALSE)&"|"&HLOOKUP(Sheet1!R2C1,Sheet1!R2C1:R16C1,MOD(RC1,2)+MOD(INT((RC1)/2),3)*5+1,FALSE)&"|"&HLOOKUP(Sheet1!R2C1,Sheet1!R2C1:R16C1,MOD(RC1+1,2)+MOD(INT((RC1+1)/2),3)*5+1,FALSE)&"|"&HLOOKUP(Sheet1!R2C1,Sheet1!R2C1:R16C1,MOD(RC1+2,2)+MOD(INT((RC1+2)/2),3)*5+1,FALSE)&"|"&HLOOKUP(Sheet1!R2C1,Sheet1!R2C1:R16C1,MOD(RC1+3,2)+MOD(INT((RC1+3)/2),3)*5+1,FALSE) -> 101|130|131|160|161 | H398: =HLOOKUP(Sheet1!R2C1,Sheet1!R2C1:R16C1,MOD(RC1+2,2)+MOD(INT((RC1+2)/2),3)*5+1,FALSE)&"|"&HLOOKUP(Sheet1!R2C1,Sheet1!R2C1:R16C1,MOD(RC1+3,2)+MOD(INT((RC1+3)/2),3)*5+1,FALSE)&"|"&HLOOKUP(Sheet1!R2C1,Sheet1!R2C1:R16C1,MOD(RC1+4,2)+MOD(INT((RC1+4)/2),3)*5+1,FALSE)&"|"&HLOOKUP(Sheet1!R2C1,Sheet1!R2C1:R16C1,MOD(RC1+5,2)+MOD(INT((RC1+5)/2),3)*5+1,FALSE)&"|"&HLOOKUP(Sheet1!R2C1,Sheet1!R2C1:R16C1,MOD(RC1+6,2)+MOD(INT((RC1+6)/2),3)*5+1,FALSE) -> 160|161|100|101|130 | I398: =HLOOKUP(Sheet1!R2C1,Sheet1!R2C1:R16C1,MOD(RC1-1,3)+MOD(INT((RC1-1)/3),3)*5+3,FALSE)&"|"&HLOOKUP(Sheet1!R2C1,Sheet1!R2C1:R16C1,MOD(RC1,3)+MOD(INT((RC1)/3),3)*5+3,FALSE)&"|"&HLOOKUP(Sheet1!R2C1,Sheet1!R2C1:R16C1,MOD(RC1+1,3)+MOD(INT((RC1+1)/3),3)*5+3,FALSE)&"|"&HLOOKUP(Sheet1!R2C1,Sheet1!R2C1:R16C1,MOD(RC1+2,3)+MOD(INT((RC1+2)/3),3)*5+3,FALSE)&"|"&HLOOKUP(Sheet1!R2C1,Sheet1!R2C1:R16C1,MOD(RC1+3,3)+MOD(INT((RC1+3)/3),3)*5+3,FALSE) -> 133|134|162|163|164 | J398: =HLOOKUP(Sheet1!R2C1,Sheet1!R2C1:R16C1,MOD(RC1-1,3)+MOD(INT((RC1-1)/3),3)*5+3,FALSE)&"|"&HLOOKUP(Sheet1!R2C1,Sheet1!R2C1:R16C1,MOD(RC1,3)+MOD(INT((RC1)/3),3)*5+3,FALSE)&"|"&HLOOKUP(Sheet1!R2C1,Sheet1!R2C1:R16C1,MOD(RC1+1,3)+MOD(INT((RC1+1)/3),3)*5+3,FALSE)&"|"&HLOOKUP(Sheet1!R2C1,Sheet1!R2C1:R16C1,MOD(RC1+2,3)+MOD(INT((RC1+2)/3),3)*5+3,FALSE)&"|"&HLOOKUP(Sheet1!R2C1,Sheet1!R2C1:R16C1,MOD(RC1+3,3)+MOD(INT((RC1+3)/3),3)*5+3,FALSE) -> 133|134|162|163|164 | K398: =HLOOKUP(Sheet1!R2C1,Sheet1!R2C1:R16C1,MOD(RC1-1,3)+MOD(INT((RC1-1)/3),3)*5+3,FALSE)&"|"&HLOOKUP(Sheet1!R2C1,Sheet1!R2C1:R16C1,MOD(RC1,3)+MOD(INT((RC1)/3),3)*5+3,FALSE)&"|"&HLOOKUP(Sheet1!R2C1,Sheet1!R2C1:R16C1,MOD(RC1+1,3)+MOD(INT((RC1+1)/3),3)*5+3,FALSE)&"|"&HLOOKUP(Sheet1!R2C1,Sheet1!R2C1:R16C1,MOD(RC1+2,3)+MOD(INT((RC1+2)/3),3)*5+3,FALSE)&"|"&HLOOKUP(Sheet1!R2C1,Sheet1!R2C1:R16C1,MOD(RC1+3,3)+MOD(INT((RC1+3)/3),3)*5+3,FALSE) -> 133|134|162|163|164 | L398: 25|22|23|24 | M398: 6130400|6130400|6130400|6130400 | N398: 10030|10031|10032|10033 | O398: 1|1|1|1 | P398: 2500|2500|2500|2500
A399: 393 | B399: 391 | C399: 30 | D399: =R[-20]C+2 -> 58 | E399: 1000 | F399: =MOD(RC[-5]-1,3)*30+100&"|"&MOD(RC[-5]-1,3)*30+101&"|"&MOD(RC[-5]-1,3)*30+102&"|"&MOD(RC[-5]-1,3)*30+103&"|"&IF(MOD(RC[-5],4)=0,HLOOKUP(Sheet1!R2C10,Sheet1!R2C10:R7C10,MOD(RC[-5]/4-1,6)+1,FALSE),IF(MOD(RC[-5],2)=0,IF(RC[-5]>20,HLOOKUP(Sheet1!R2C7,Sheet1!R2C7:R43C7,MOD(RC[-5]/2-1,42)+1,FALSE),HLOOKUP(Sheet1!R2C4,Sheet1!R2C4:R7C4,MOD(RC[-5]-1,6)+1,FALSE)),MOD(RC[-5]-1,3)*30+104)) -> 160|161|162|163|164 | G399: =HLOOKUP(Sheet1!R2C1,Sheet1!R2C1:R16C1,MOD(RC1-1,2)+MOD(INT((RC1-1)/2),3)*5+1,FALSE)&"|"&HLOOKUP(Sheet1!R2C1,Sheet1!R2C1:R16C1,MOD(RC1,2)+MOD(INT((RC1)/2),3)*5+1,FALSE)&"|"&HLOOKUP(Sheet1!R2C1,Sheet1!R2C1:R16C1,MOD(RC1+1,2)+MOD(INT((RC1+1)/2),3)*5+1,FALSE)&"|"&HLOOKUP(Sheet1!R2C1,Sheet1!R2C1:R16C1,MOD(RC1+2,2)+MOD(INT((RC1+2)/2),3)*5+1,FALSE)&"|"&HLOOKUP(Sheet1!R2C1,Sheet1!R2C1:R16C1,MOD(RC1+3,2)+MOD(INT((RC1+3)/2),3)*5+1,FALSE) -> 130|131|160|161|100 | H399: =HLOOKUP(Sheet1!R2C1,Sheet1!R2C1:R16C1,MOD(RC1+2,2)+MOD(INT((RC1+2)/2),3)*5+1,FALSE)&"|"&HLOOKUP(Sheet1!R2C1,Sheet1!R2C1:R16C1,MOD(RC1+3,2)+MOD(INT((RC1+3)/2),3)*5+1,FALSE)&"|"&HLOOKUP(Sheet1!R2C1,Sheet1!R2C1:R16C1,MOD(RC1+4,2)+MOD(INT((RC1+4)/2),3)*5+1,FALSE)&"|"&HLOOKUP(Sheet1!R2C1,Sheet1!R2C1:R16C1,MOD(RC1+5,2)+MOD(INT((RC1+5)/2),3)*5+1,FALSE)&"|"&HLOOKUP(Sheet1!R2C1,Sheet1!R2C1:R16C1,MOD(RC1+6,2)+MOD(INT((RC1+6)/2),3)*5+1,FALSE) -> 161|100|101|130|131 | I399: =HLOOKUP(Sheet1!R2C1,Sheet1!R2C1:R16C1,MOD(RC1-1,3)+MOD(INT((RC1-1)/3),3)*5+3,FALSE)&"|"&HLOOKUP(Sheet1!R2C1,Sheet1!R2C1:R16C1,MOD(RC1,3)+MOD(INT((RC1)/3),3)*5+3,FALSE)&"|"&HLOOKUP(Sheet1!R2C1,Sheet1!R2C1:R16C1,MOD(RC1+1,3)+MOD(INT((RC1+1)/3),3)*5+3,FALSE)&"|"&HLOOKUP(Sheet1!R2C1,Sheet1!R2C1:R16C1,MOD(RC1+2,3)+MOD(INT((RC1+2)/3),3)*5+3,FALSE)&"|"&HLOOKUP(Sheet1!R2C1,Sheet1!R2C1:R16C1,MOD(RC1+3,3)+MOD(INT((RC1+3)/3),3)*5+3,FALSE) -> 134|162|163|164|102 | J399: =HLOOKUP(Sheet1!R2C1,Sheet1!R2C1:R16C1,MOD(RC1-1,3)+MOD(INT((RC1-1)/3),3)*5+3,FALSE)&"|"&HLOOKUP(Sheet1!R2C1,Sheet1!R2C1:R16C1,MOD(RC1,3)+MOD(INT((RC1)/3),3)*5+3,FALSE)&"|"&HLOOKUP(Sheet1!R2C1,Sheet1!R2C1:R16C1,MOD(RC1+1,3)+MOD(INT((RC1+1)/3),3)*5+3,FALSE)&"|"&HLOOKUP(Sheet1!R2C1,Sheet1!R2C1:R16C1,MOD(RC1+2,3)+MOD(INT((RC1+2)/3),3)*5+3,FALSE)&"|"&HLOOKUP(Sheet1!R2C1,Sheet1!R2C1:R16C1,MOD(RC1+3,3)+MOD(INT((RC1+3)/3),3)*5+3,FALSE) -> 134|162|163|164|102 | K399: =HLOOKUP(Sheet1!R2C1,Sheet1!R2C1:R16C1,MOD(RC1-1,3)+MOD(INT((RC1-1)/3),3)*5+3,FALSE)&"|"&HLOOKUP(Sheet1!R2C1,Sheet1!R2C1:R16C1,MOD(RC1,3)+MOD(INT((RC1)/3),3)*5+3,FALSE)&"|"&HLOOKUP(Sheet1!R2C1,Sheet1!R2C1:R16C1,MOD(RC1+1,3)+MOD(INT((RC1+1)/3),3)*5+3,FALSE)&"|"&HLOOKUP(Sheet1!R2C1,Sheet1!R2C1:R16C1,MOD(RC1+2,3)+MOD(INT((RC1+2)/3),3)*5+3,FALSE)&"|"&HLOOKUP(Sheet1!R2C1,Sheet1!R2C1:R16C1,MOD(RC1+3,3)+MOD(INT((RC1+3)/3),3)*5+3,FALSE) -> 134|162|163|164|102 | L399: 25|22|23|24 | M399: 6183046|6183046|6183045|6183045 | N399: 10030|10031|10032|10033 | O399: 1|1|1|1 | P399: 2500|2500|2500|2500
A400: 394 | B400: 392 | C400: 30 | D400: =R[-20]C+2 -> 58 | E400: 1000 | F400: =MOD(RC[-5]-1,3)*30+100&"|"&MOD(RC[-5]-1,3)*30+101&"|"&MOD(RC[-5]-1,3)*30+102&"|"&MOD(RC[-5]-1,3)*30+103&"|"&IF(MOD(RC[-5],4)=0,HLOOKUP(Sheet1!R2C10,Sheet1!R2C10:R7C10,MOD(RC[-5]/4-1,6)+1,FALSE),IF(MOD(RC[-5],2)=0,IF(RC[-5]>20,HLOOKUP(Sheet1!R2C7,Sheet1!R2C7:R43C7,MOD(RC[-5]/2-1,42)+1,FALSE),HLOOKUP(Sheet1!R2C4,Sheet1!R2C4:R7C4,MOD(RC[-5]-1,6)+1,FALSE)),MOD(RC[-5]-1,3)*30+104)) -> 100|101|102|103|172 | G400: =HLOOKUP(Sheet1!R2C1,Sheet1!R2C1:R16C1,MOD(RC1-1,2)+MOD(INT((RC1-1)/2),3)*5+1,FALSE)&"|"&HLOOKUP(Sheet1!R2C1,Sheet1!R2C1:R16C1,MOD(RC1,2)+MOD(INT((RC1)/2),3)*5+1,FALSE)&"|"&HLOOKUP(Sheet1!R2C1,Sheet1!R2C1:R16C1,MOD(RC1+1,2)+MOD(INT((RC1+1)/2),3)*5+1,FALSE)&"|"&HLOOKUP(Sheet1!R2C1,Sheet1!R2C1:R16C1,MOD(RC1+2,2)+MOD(INT((RC1+2)/2),3)*5+1,FALSE)&"|"&HLOOKUP(Sheet1!R2C1,Sheet1!R2C1:R16C1,MOD(RC1+3,2)+MOD(INT((RC1+3)/2),3)*5+1,FALSE) -> 131|160|161|100|101 | H400: =HLOOKUP(Sheet1!R2C1,Sheet1!R2C1:R16C1,MOD(RC1+2,2)+MOD(INT((RC1+2)/2),3)*5+1,FALSE)&"|"&HLOOKUP(Sheet1!R2C1,Sheet1!R2C1:R16C1,MOD(RC1+3,2)+MOD(INT((RC1+3)/2),3)*5+1,FALSE)&"|"&HLOOKUP(Sheet1!R2C1,Sheet1!R2C1:R16C1,MOD(RC1+4,2)+MOD(INT((RC1+4)/2),3)*5+1,FALSE)&"|"&HLOOKUP(Sheet1!R2C1,Sheet1!R2C1:R16C1,MOD(RC1+5,2)+MOD(INT((RC1+5)/2),3)*5+1,FALSE)&"|"&HLOOKUP(Sheet1!R2C1,Sheet1!R2C1:R16C1,MOD(RC1+6,2)+MOD(INT((RC1+6)/2),3)*5+1,FALSE) -> 100|101|130|131|160 | I400: =HLOOKUP(Sheet1!R2C1,Sheet1!R2C1:R16C1,MOD(RC1-1,3)+MOD(INT((RC1-1)/3),3)*5+3,FALSE)&"|"&HLOOKUP(Sheet1!R2C1,Sheet1!R2C1:R16C1,MOD(RC1,3)+MOD(INT((RC1)/3),3)*5+3,FALSE)&"|"&HLOOKUP(Sheet1!R2C1,Sheet1!R2C1:R16C1,MOD(RC1+1,3)+MOD(INT((RC1+1)/3),3)*5+3,FALSE)&"|"&HLOOKUP(Sheet1!R2C1,Sheet1!R2C1:R16C1,MOD(RC1+2,3)+MOD(INT((RC1+2)/3),3)*5+3,FALSE)&"|"&HLOOKUP(Sheet1!R2C1,Sheet1!R2C1:R16C1,MOD(RC1+3,3)+MOD(INT((RC1+3)/3),3)*5+3,FALSE) -> 162|163|164|102|103 | J400: =HLOOKUP(Sheet1!R2C1,Sheet1!R2C1:R16C1,MOD(RC1-1,3)+MOD(INT((RC1-1)/3),3)*5+3,FALSE)&"|"&HLOOKUP(Sheet1!R2C1,Sheet1!R2C1:R16C1,MOD(RC1,3)+MOD(INT((RC1)/3),3)*5+3,FALSE)&"|"&HLOOKUP(Sheet1!R2C1,Sheet1!R2C1:R16C1,MOD(RC1+1,3)+MOD(INT((RC1+1)/3),3)*5+3,FALSE)&"|"&HLOOKUP(Sheet1!R2C1,Sheet1!R2C1:R16C1,MOD(RC1+2,3)+MOD(INT((RC1+2)/3),3)*5+3,FALSE)&"|"&HLOOKUP(Sheet1!R2C1,Sheet1!R2C1:R16C1,MOD(RC1+3,3)+MOD(INT((RC1+3)/3),3)*5+3,FALSE) -> 162|163|164|102|103 | K400: =HLOOKUP(Sheet1!R2C1,Sheet1!R2C1:R16C1,MOD(RC1-1,3)+MOD(INT((RC1-1)/3),3)*5+3,FALSE)&"|"&HLOOKUP(Sheet1!R2C1,Sheet1!R2C1:R16C1,MOD(RC1,3)+MOD(INT((RC1)/3),3)*5+3,FALSE)&"|"&HLOOKUP(Sheet1!R2C1,Sheet1!R2C1:R16C1,MOD(RC1+1,3)+MOD(INT((RC1+1)/3),3)*5+3,FALSE)&"|"&HLOOKUP(Sheet1!R2C1,Sheet1!R2C1:R16C1,MOD(RC1+2,3)+MOD(INT((RC1+2)/3),3)*5+3,FALSE)&"|"&HLOOKUP(Sheet1!R2C1,Sheet1!R2C1:R16C1,MOD(RC1+3,3)+MOD(INT((RC1+3)/3),3)*5+3,FALSE) -> 162|163|164|102|103 | L400: 25|22|23|24 | M400: 6237592|6237591|6237593|6237593 | N400: 10030|10031|10032|10033 | O400: 1|1|1|1 | P400: 2500|2500|2500|2500
A401: 395 | B401: 393 | C401: 30 | D401: =R[-20]C+2 -> 58 | E401: 1000 | F401: =MOD(RC[-5]-1,3)*30+100&"|"&MOD(RC[-5]-1,3)*30+101&"|"&MOD(RC[-5]-1,3)*30+102&"|"&MOD(RC[-5]-1,3)*30+103&"|"&IF(MOD(RC[-5],4)=0,HLOOKUP(Sheet1!R2C10,Sheet1!R2C10:R7C10,MOD(RC[-5]/4-1,6)+1,FALSE),IF(MOD(RC[-5],2)=0,IF(RC[-5]>20,HLOOKUP(Sheet1!R2C7,Sheet1!R2C7:R43C7,MOD(RC[-5]/2-1,42)+1,FALSE),HLOOKUP(Sheet1!R2C4,Sheet1!R2C4:R7C4,MOD(RC[-5]-1,6)+1,FALSE)),MOD(RC[-5]-1,3)*30+104)) -> 130|131|132|133|134 | G401: =HLOOKUP(Sheet1!R2C1,Sheet1!R2C1:R16C1,MOD(RC1-1,2)+MOD(INT((RC1-1)/2),3)*5+1,FALSE)&"|"&HLOOKUP(Sheet1!R2C1,Sheet1!R2C1:R16C1,MOD(RC1,2)+MOD(INT((RC1)/2),3)*5+1,FALSE)&"|"&HLOOKUP(Sheet1!R2C1,Sheet1!R2C1:R16C1,MOD(RC1+1,2)+MOD(INT((RC1+1)/2),3)*5+1,FALSE)&"|"&HLOOKUP(Sheet1!R2C1,Sheet1!R2C1:R16C1,MOD(RC1+2,2)+MOD(INT((RC1+2)/2),3)*5+1,FALSE)&"|"&HLOOKUP(Sheet1!R2C1,Sheet1!R2C1:R16C1,MOD(RC1+3,2)+MOD(INT((RC1+3)/2),3)*5+1,FALSE) -> 160|161|100|101|130 | H401: =HLOOKUP(Sheet1!R2C1,Sheet1!R2C1:R16C1,MOD(RC1+2,2)+MOD(INT((RC1+2)/2),3)*5+1,FALSE)&"|"&HLOOKUP(Sheet1!R2C1,Sheet1!R2C1:R16C1,MOD(RC1+3,2)+MOD(INT((RC1+3)/2),3)*5+1,FALSE)&"|"&HLOOKUP(Sheet1!R2C1,Sheet1!R2C1:R16C1,MOD(RC1+4,2)+MOD(INT((RC1+4)/2),3)*5+1,FALSE)&"|"&HLOOKUP(Sheet1!R2C1,Sheet1!R2C1:R16C1,MOD(RC1+5,2)+MOD(INT((RC1+5)/2),3)*5+1,FALSE)&"|"&HLOOKUP(Sheet1!R2C1,Sheet1!R2C1:R16C1,MOD(RC1+6,2)+MOD(INT((RC1+6)/2),3)*5+1,FALSE) -> 101|130|131|160|161 | I401: =HLOOKUP(Sheet1!R2C1,Sheet1!R2C1:R16C1,MOD(RC1-1,3)+MOD(INT((RC1-1)/3),3)*5+3,FALSE)&"|"&HLOOKUP(Sheet1!R2C1,Sheet1!R2C1:R16C1,MOD(RC1,3)+MOD(INT((RC1)/3),3)*5+3,FALSE)&"|"&HLOOKUP(Sheet1!R2C1,Sheet1!R2C1:R16C1,MOD(RC1+1,3)+MOD(INT((RC1+1)/3),3)*5+3,FALSE)&"|"&HLOOKUP(Sheet1!R2C1,Sheet1!R2C1:R16C1,MOD(RC1+2,3)+MOD(INT((RC1+2)/3),3)*5+3,FALSE)&"|"&HLOOKUP(Sheet1!R2C1,Sheet1!R2C1:R16C1,MOD(RC1+3,3)+MOD(INT((RC1+3)/3),3)*5+3,FALSE) -> 163|164|102|103|104 | J401: =HLOOKUP(Sheet1!R2C1,Sheet1!R2C1:R16C1,MOD(RC1-1,3)+MOD(INT((RC1-1)/3),3)*5+3,FALSE)&"|"&HLOOKUP(Sheet1!R2C1,Sheet1!R2C1:R16C1,MOD(RC1,3)+MOD(INT((RC1)/3),3)*5+3,FALSE)&"|"&HLOOKUP(Sheet1!R2C1,Sheet1!R2C1:R16C1,MOD(RC1+1,3)+MOD(INT((RC1+1)/3),3)*5+3,FALSE)&"|"&HLOOKUP(Sheet1!R2C1,Sheet1!R2C1:R16C1,MOD(RC1+2,3)+MOD(INT((RC1+2)/3),3)*5+3,FALSE)&"|"&HLOOKUP(Sheet1!R2C1,Sheet1!R2C1:R16C1,MOD(RC1+3,3)+MOD(INT((RC1+3)/3),3)*5+3,FALSE) -> 163|164|102|103|104 | K401: =HLOOKUP(Sheet1!R2C1,Sheet1!R2C1:R16C1,MOD(RC1-1,3)+MOD(INT((RC1-1)/3),3)*5+3,FALSE)&"|"&HLOOKUP(Sheet1!R2C1,Sheet1!R2C1:R16C1,MOD(RC1,3)+MOD(INT((RC1)/3),3)*5+3,FALSE)&"|"&HLOOKUP(Sheet1!R2C1,Sheet1!R2C1:R16C1,MOD(RC1+1,3)+MOD(INT((RC1+1)/3),3)*5+3,FALSE)&"|"&HLOOKUP(Sheet1!R2C1,Sheet1!R2C1:R16C1,MOD(RC1+2,3)+MOD(INT((RC1+2)/3),3)*5+3,FALSE)&"|"&HLOOKUP(Sheet1!R2C1,Sheet1!R2C1:R16C1,MOD(RC1+3,3)+MOD(INT((RC1+3)/3),3)*5+3,FALSE) -> 163|164|102|103|104 | L401: 25|22|23|24 | M401: 6294496|6294496|6294498|6294498 | N401: 10030|10031|10032|10033|10030|10031|10032|10033|10030|10031|10032|10033|10030|10031|10032|10033|10030|10031|10032|10033|10030|10031|10032|10033|10030|10031|10032|10033|10030|10031|10032|10033|10030|10031|10032|10033|10030|10031|10032|10033 | O401: 1|1|1|1|1|1|1|1|1|1|1|1|1|1|1|1|1|1|1|1|1|1|1|1|1|1|1|1|1|1|1|1|1|1|1|1|1|1|1|1 | P401: 2500|2500|2500|2500|2500|2500|2500|2500|2500|2500|2500|2500|2500|2500|2500|2500|2500|2500|2500|2500|2500|2500|2500|2500|2500|2500|2500|2500|2500|2500|2500|2500|2500|2500|2500|2500|2500|2500|2500|2500
A402: 396 | B402: 394 | C402: 30 | D402: =R[-20]C+2 -> 58 | E402: 1000 | F402: =MOD(RC[-5]-1,3)*30+100&"|"&MOD(RC[-5]-1,3)*30+101&"|"&MOD(RC[-5]-1,3)*30+102&"|"&MOD(RC[-5]-1,3)*30+103&"|"&IF(MOD(RC[-5],4)=0,HLOOKUP(Sheet1!R2C10,Sheet1!R2C10:R7C10,MOD(RC[-5]/4-1,6)+1,FALSE),IF(MOD(RC[-5],2)=0,IF(RC[-5]>20,HLOOKUP(Sheet1!R2C7,Sheet1!R2C7:R43C7,MOD(RC[-5]/2-1,42)+1,FALSE),HLOOKUP(Sheet1!R2C4,Sheet1!R2C4:R7C4,MOD(RC[-5]-1,6)+1,FALSE)),MOD(RC[-5]-1,3)*30+104)) -> 160|161|162|163|192 | G402: =HLOOKUP(Sheet1!R2C1,Sheet1!R2C1:R16C1,MOD(RC1-1,2)+MOD(INT((RC1-1)/2),3)*5+1,FALSE)&"|"&HLOOKUP(Sheet1!R2C1,Sheet1!R2C1:R16C1,MOD(RC1,2)+MOD(INT((RC1)/2),3)*5+1,FALSE)&"|"&HLOOKUP(Sheet1!R2C1,Sheet1!R2C1:R16C1,MOD(RC1+1,2)+MOD(INT((RC1+1)/2),3)*5+1,FALSE)&"|"&HLOOKUP(Sheet1!R2C1,Sheet1!R2C1:R16C1,MOD(RC1+2,2)+MOD(INT((RC1+2)/2),3)*5+1,FALSE)&"|"&HLOOKUP(Sheet1!R2C1,Sheet1!R2C1:R16C1,MOD(RC1+3,2)+MOD(INT((RC1+3)/2),3)*5+1,FALSE) -> 161|100|101|130|131 | H402: =HLOOKUP(Sheet1!R2C1,Sheet1!R2C1:R16C1,MOD(RC1+2,2)+MOD(INT((RC1+2)/2),3)*5+1,FALSE)&"|"&HLOOKUP(Sheet1!R2C1,Sheet1!R2C1:R16C1,MOD(RC1+3,2)+MOD(INT((RC1+3)/2),3)*5+1,FALSE)&"|"&HLOOKUP(Sheet1!R2C1,Sheet1!R2C1:R16C1,MOD(RC1+4,2)+MOD(INT((RC1+4)/2),3)*5+1,FALSE)&"|"&HLOOKUP(Sheet1!R2C1,Sheet1!R2C1:R16C1,MOD(RC1+5,2)+MOD(INT((RC1+5)/2),3)*5+1,FALSE)&"|"&HLOOKUP(Sheet1!R2C1,Sheet1!R2C1:R16C1,MOD(RC1+6,2)+MOD(INT((RC1+6)/2),3)*5+1,FALSE) -> 130|131|160|161|100 | I402: =HLOOKUP(Sheet1!R2C1,Sheet1!R2C1:R16C1,MOD(RC1-1,3)+MOD(INT((RC1-1)/3),3)*5+3,FALSE)&"|"&HLOOKUP(Sheet1!R2C1,Sheet1!R2C1:R16C1,MOD(RC1,3)+MOD(INT((RC1)/3),3)*5+3,FALSE)&"|"&HLOOKUP(Sheet1!R2C1,Sheet1!R2C1:R16C1,MOD(RC1+1,3)+MOD(INT((RC1+1)/3),3)*5+3,FALSE)&"|"&HLOOKUP(Sheet1!R2C1,Sheet1!R2C1:R16C1,MOD(RC1+2,3)+MOD(INT((RC1+2)/3),3)*5+3,FALSE)&"|"&HLOOKUP(Sheet1!R2C1,Sheet1!R2C1:R16C1,MOD(RC1+3,3)+MOD(INT((RC1+3)/3),3)*5+3,FALSE) -> 164|102|103|104|132 | J402: =HLOOKUP(Sheet1!R2C1,Sheet1!R2C1:R16C1,MOD(RC1-1,3)+MOD(INT((RC1-1)/3),3)*5+3,FALSE)&"|"&HLOOKUP(Sheet1!R2C1,Sheet1!R2C1:R16C1,MOD(RC1,3)+MOD(INT((RC1)/3),3)*5+3,FALSE)&"|"&HLOOKUP(Sheet1!R2C1,Sheet1!R2C1:R16C1,MOD(RC1+1,3)+MOD(INT((RC1+1)/3),3)*5+3,FALSE)&"|"&HLOOKUP(Sheet1!R2C1,Sheet1!R2C1:R16C1,MOD(RC1+2,3)+MOD(INT((RC1+2)/3),3)*5+3,FALSE)&"|"&HLOOKUP(Sheet1!R2C1,Sheet1!R2C1:R16C1,MOD(RC1+3,3)+MOD(INT((RC1+3)/3),3)*5+3,FALSE) -> 164|102|103|104|132 | K402: =HLOOKUP(Sheet1!R2C1,Sheet1!R2C1:R16C1,MOD(RC1-1,3)+MOD(INT((RC1-1)/3),3)*5+3,FALSE)&"|"&HLOOKUP(Sheet1!R2C1,Sheet1!R2C1:R16C1,MOD(RC1,3)+MOD(INT((RC1)/3),3)*5+3,FALSE)&"|"&HLOOKUP(Sheet1!R2C1,Sheet1!R2C1:R16C1,MOD(RC1+1,3)+MOD(INT((RC1+1)/3),3)*5+3,FALSE)&"|"&HLOOKUP(Sheet1!R2C1,Sheet1!R2C1:R16C1,MOD(RC1+2,3)+MOD(INT((RC1+2)/3),3)*5+3,FALSE)&"|"&HLOOKUP(Sheet1!R2C1,Sheet1!R2C1:R16C1,MOD(RC1+3,3)+MOD(INT((RC1+3)/3),3)*5+3,FALSE) -> 164|102|103|104|132 | L402: 25|22|23|24 | M402: 6349125|6349125|6349125|6349125 | N402: 10030|10031|10032|10033 | O402: 1|1|1|1 | P402: 2500|2500|2500|2500
A403: 397 | B403: 395 | C403: 30 | D403: =R[-20]C+2 -> 58 | E403: 1000 | F403: =MOD(RC[-5]-1,3)*30+100&"|"&MOD(RC[-5]-1,3)*30+101&"|"&MOD(RC[-5]-1,3)*30+102&"|"&MOD(RC[-5]-1,3)*30+103&"|"&IF(MOD(RC[-5],4)=0,HLOOKUP(Sheet1!R2C10,Sheet1!R2C10:R7C10,MOD(RC[-5]/4-1,6)+1,FALSE),IF(MOD(RC[-5],2)=0,IF(RC[-5]>20,HLOOKUP(Sheet1!R2C7,Sheet1!R2C7:R43C7,MOD(RC[-5]/2-1,42)+1,FALSE),HLOOKUP(Sheet1!R2C4,Sheet1!R2C4:R7C4,MOD(RC[-5]-1,6)+1,FALSE)),MOD(RC[-5]-1,3)*30+104)) -> 100|101|102|103|104 | G403: =HLOOKUP(Sheet1!R2C1,Sheet1!R2C1:R16C1,MOD(RC1-1,2)+MOD(INT((RC1-1)/2),3)*5+1,FALSE)&"|"&HLOOKUP(Sheet1!R2C1,Sheet1!R2C1:R16C1,MOD(RC1,2)+MOD(INT((RC1)/2),3)*5+1,FALSE)&"|"&HLOOKUP(Sheet1!R2C1,Sheet1!R2C1:R16C1,MOD(RC1+1,2)+MOD(INT((RC1+1)/2),3)*5+1,FALSE)&"|"&HLOOKUP(Sheet1!R2C1,Sheet1!R2C1:R16C1,MOD(RC1+2,2)+MOD(INT((RC1+2)/2),3)*5+1,FALSE)&"|"&HLOOKUP(Sheet1!R2C1,Sheet1!R2C1:R16C1,MOD(RC1+3,2)+MOD(INT((RC1+3)/2),3)*5+1,FALSE) -> 100|101|130|131|160 | H403: =HLOOKUP(Sheet1!R2C1,Sheet1!R2C1:R16C1,MOD(RC1+2,2)+MOD(INT((RC1+2)/2),3)*5+1,FALSE)&"|"&HLOOKUP(Sheet1!R2C1,Sheet1!R2C1:R16C1,MOD(RC1+3,2)+MOD(INT((RC1+3)/2),3)*5+1,FALSE)&"|"&HLOOKUP(Sheet1!R2C1,Sheet1!R2C1:R16C1,MOD(RC1+4,2)+MOD(INT((RC1+4)/2),3)*5+1,FALSE)&"|"&HLOOKUP(Sheet1!R2C1,Sheet1!R2C1:R16C1,MOD(RC1+5,2)+MOD(INT((RC1+5)/2),3)*5+1,FALSE)&"|"&HLOOKUP(Sheet1!R2C1,Sheet1!R2C1:R16C1,MOD(RC1+6,2)+MOD(INT((RC1+6)/2),3)*5+1,FALSE) -> 131|160|161|100|101 | I403: =HLOOKUP(Sheet1!R2C1,Sheet1!R2C1:R16C1,MOD(RC1-1,3)+MOD(INT((RC1-1)/3),3)*5+3,FALSE)&"|"&HLOOKUP(Sheet1!R2C1,Sheet1!R2C1:R16C1,MOD(RC1,3)+MOD(INT((RC1)/3),3)*5+3,FALSE)&"|"&HLOOKUP(Sheet1!R2C1,Sheet1!R2C1:R16C1,MOD(RC1+1,3)+MOD(INT((RC1+1)/3),3)*5+3,FALSE)&"|"&HLOOKUP(Sheet1!R2C1,Sheet1!R2C1:R16C1,MOD(RC1+2,3)+MOD(INT((RC1+2)/3),3)*5+3,FALSE)&"|"&HLOOKUP(Sheet1!R2C1,Sheet1!R2C1:R16C1,MOD(RC1+3,3)+MOD(INT((RC1+3)/3),3)*5+3,FALSE) -> 102|103|104|132|133 | J403: =HLOOKUP(Sheet1!R2C1,Sheet1!R2C1:R16C1,MOD(RC1-1,3)+MOD(INT((RC1-1)/3),3)*5+3,FALSE)&"|"&HLOOKUP(Sheet1!R2C1,Sheet1!R2C1:R16C1,MOD(RC1,3)+MOD(INT((RC1)/3),3)*5+3,FALSE)&"|"&HLOOKUP(Sheet1!R2C1,Sheet1!R2C1:R16C1,MOD(RC1+1,3)+MOD(INT((RC1+1)/3),3)*5+3,FALSE)&"|"&HLOOKUP(Sheet1!R2C1,Sheet1!R2C1:R16C1,MOD(RC1+2,3)+MOD(INT((RC1+2)/3),3)*5+3,FALSE)&"|"&HLOOKUP(Sheet1!R2C1,Sheet1!R2C1:R16C1,MOD(RC1+3,3)+MOD(INT((RC1+3)/3),3)*5+3,FALSE) -> 102|103|104|132|133 | K403: =HLOOKUP(Sheet1!R2C1,Sheet1!R2C1:R16C1,MOD(RC1-1,3)+MOD(INT((RC1-1)/3),3)*5+3,FALSE)&"|"&HLOOKUP(Sheet1!R2C1,Sheet1!R2C1:R16C1,MOD(RC1,3)+MOD(INT((RC1)/3),3)*5+3,FALSE)&"|"&HLOOKUP(Sheet1!R2C1,Sheet1!R2C1:R16C1,MOD(RC1+1,3)+MOD(INT((RC1+1)/3),3)*5+3,FALSE)&"|"&HLOOKUP(Sheet1!R2C1,Sheet1!R2C1:R16C1,MOD(RC1+2,3)+MOD(INT((RC1+2)/3),3)*5+3,FALSE)&"|"&HLOOKUP(Sheet1!R2C1,Sheet1!R2C1:R16C1,MOD(RC1+3,3)+MOD(INT((RC1+3)/3),3)*5+3,FALSE) -> 102|103|104|132|133 | L403: 25|22|23|24 | M403: 6403754|6403754|6403753|6403753 | N403: 10030|10031|10032|10033 | O403: 1|1|1|1 | P403: 2500|2500|2500|2500
A404: 398 | B404: 396 | C404: 30 | D404: =R[-20]C+2 -> 58 | E404: 1000 | F404: =MOD(RC[-5]-1,3)*30+100&"|"&MOD(RC[-5]-1,3)*30+101&"|"&MOD(RC[-5]-1,3)*30+102&"|"&MOD(RC[-5]-1,3)*30+103&"|"&IF(MOD(RC[-5],4)=0,HLOOKUP(Sheet1!R2C10,Sheet1!R2C10:R7C10,MOD(RC[-5]/4-1,6)+1,FALSE),IF(MOD(RC[-5],2)=0,IF(RC[-5]>20,HLOOKUP(Sheet1!R2C7,Sheet1!R2C7:R43C7,MOD(RC[-5]/2-1,42)+1,FALSE),HLOOKUP(Sheet1!R2C4,Sheet1!R2C4:R7C4,MOD(RC[-5]-1,6)+1,FALSE)),MOD(RC[-5]-1,3)*30+104)) -> 130|131|132|133|174 | G404: =HLOOKUP(Sheet1!R2C1,Sheet1!R2C1:R16C1,MOD(RC1-1,2)+MOD(INT((RC1-1)/2),3)*5+1,FALSE)&"|"&HLOOKUP(Sheet1!R2C1,Sheet1!R2C1:R16C1,MOD(RC1,2)+MOD(INT((RC1)/2),3)*5+1,FALSE)&"|"&HLOOKUP(Sheet1!R2C1,Sheet1!R2C1:R16C1,MOD(RC1+1,2)+MOD(INT((RC1+1)/2),3)*5+1,FALSE)&"|"&HLOOKUP(Sheet1!R2C1,Sheet1!R2C1:R16C1,MOD(RC1+2,2)+MOD(INT((RC1+2)/2),3)*5+1,FALSE)&"|"&HLOOKUP(Sheet1!R2C1,Sheet1!R2C1:R16C1,MOD(RC1+3,2)+MOD(INT((RC1+3)/2),3)*5+1,FALSE) -> 101|130|131|160|161 | H404: =HLOOKUP(Sheet1!R2C1,Sheet1!R2C1:R16C1,MOD(RC1+2,2)+MOD(INT((RC1+2)/2),3)*5+1,FALSE)&"|"&HLOOKUP(Sheet1!R2C1,Sheet1!R2C1:R16C1,MOD(RC1+3,2)+MOD(INT((RC1+3)/2),3)*5+1,FALSE)&"|"&HLOOKUP(Sheet1!R2C1,Sheet1!R2C1:R16C1,MOD(RC1+4,2)+MOD(INT((RC1+4)/2),3)*5+1,FALSE)&"|"&HLOOKUP(Sheet1!R2C1,Sheet1!R2C1:R16C1,MOD(RC1+5,2)+MOD(INT((RC1+5)/2),3)*5+1,FALSE)&"|"&HLOOKUP(Sheet1!R2C1,Sheet1!R2C1:R16C1,MOD(RC1+6,2)+MOD(INT((RC1+6)/2),3)*5+1,FALSE) -> 160|161|100|101|130 | I404: =HLOOKUP(Sheet1!R2C1,Sheet1!R2C1:R16C1,MOD(RC1-1,3)+MOD(INT((RC1-1)/3),3)*5+3,FALSE)&"|"&HLOOKUP(Sheet1!R2C1,Sheet1!R2C1:R16C1,MOD(RC1,3)+MOD(INT((RC1)/3),3)*5+3,FALSE)&"|"&HLOOKUP(Sheet1!R2C1,Sheet1!R2C1:R16C1,MOD(RC1+1,3)+MOD(INT((RC1+1)/3),3)*5+3,FALSE)&"|"&HLOOKUP(Sheet1!R2C1,Sheet1!R2C1:R16C1,MOD(RC1+2,3)+MOD(INT((RC1+2)/3),3)*5+3,FALSE)&"|"&HLOOKUP(Sheet1!R2C1,Sheet1!R2C1:R16C1,MOD(RC1+3,3)+MOD(INT((RC1+3)/3),3)*5+3,FALSE) -> 103|104|132|133|134 | J404: =HLOOKUP(Sheet1!R2C1,Sheet1!R2C1:R16C1,MOD(RC1-1,3)+MOD(INT((RC1-1)/3),3)*5+3,FALSE)&"|"&HLOOKUP(Sheet1!R2C1,Sheet1!R2C1:R16C1,MOD(RC1,3)+MOD(INT((RC1)/3),3)*5+3,FALSE)&"|"&HLOOKUP(Sheet1!R2C1,Sheet1!R2C1:R16C1,MOD(RC1+1,3)+MOD(INT((RC1+1)/3),3)*5+3,FALSE)&"|"&HLOOKUP(Sheet1!R2C1,Sheet1!R2C1:R16C1,MOD(RC1+2,3)+MOD(INT((RC1+2)/3),3)*5+3,FALSE)&"|"&HLOOKUP(Sheet1!R2C1,Sheet1!R2C1:R16C1,MOD(RC1+3,3)+MOD(INT((RC1+3)/3),3)*5+3,FALSE) -> 103|104|132|133|134 | K404: =HLOOKUP(Sheet1!R2C1,Sheet1!R2C1:R16C1,MOD(RC1-1,3)+MOD(INT((RC1-1)/3),3)*5+3,FALSE)&"|"&HLOOKUP(Sheet1!R2C1,Sheet1!R2C1:R16C1,MOD(RC1,3)+MOD(INT((RC1)/3),3)*5+3,FALSE)&"|"&HLOOKUP(Sheet1!R2C1,Sheet1!R2C1:R16C1,MOD(RC1+1,3)+MOD(INT((RC1+1)/3),3)*5+3,FALSE)&"|"&HLOOKUP(Sheet1!R2C1,Sheet1!R2C1:R16C1,MOD(RC1+2,3)+MOD(INT((RC1+2)/3),3)*5+3,FALSE)&"|"&HLOOKUP(Sheet1!R2C1,Sheet1!R2C1:R16C1,MOD(RC1+3,3)+MOD(INT((RC1+3)/3),3)*5+3,FALSE) -> 103|104|132|133|134 | L404: 25|22|23|24 | M404: 6460134|6460134|6460133|6460133 | N404: 10030|10031|10032|10033 | O404: 1|1|1|1 | P404: 2500|2500|2500|2500
A405: 399 | B405: 397 | C405: 30 | D405: =R[-20]C+2 -> 58 | E405: 1000 | F405: =MOD(RC[-5]-1,3)*30+100&"|"&MOD(RC[-5]-1,3)*30+101&"|"&MOD(RC[-5]-1,3)*30+102&"|"&MOD(RC[-5]-1,3)*30+103&"|"&IF(MOD(RC[-5],4)=0,HLOOKUP(Sheet1!R2C10,Sheet1!R2C10:R7C10,MOD(RC[-5]/4-1,6)+1,FALSE),IF(MOD(RC[-5],2)=0,IF(RC[-5]>20,HLOOKUP(Sheet1!R2C7,Sheet1!R2C7:R43C7,MOD(RC[-5]/2-1,42)+1,FALSE),HLOOKUP(Sheet1!R2C4,Sheet1!R2C4:R7C4,MOD(RC[-5]-1,6)+1,FALSE)),MOD(RC[-5]-1,3)*30+104)) -> 160|161|162|163|164 | G405: =HLOOKUP(Sheet1!R2C1,Sheet1!R2C1:R16C1,MOD(RC1-1,2)+MOD(INT((RC1-1)/2),3)*5+1,FALSE)&"|"&HLOOKUP(Sheet1!R2C1,Sheet1!R2C1:R16C1,MOD(RC1,2)+MOD(INT((RC1)/2),3)*5+1,FALSE)&"|"&HLOOKUP(Sheet1!R2C1,Sheet1!R2C1:R16C1,MOD(RC1+1,2)+MOD(INT((RC1+1)/2),3)*5+1,FALSE)&"|"&HLOOKUP(Sheet1!R2C1,Sheet1!R2C1:R16C1,MOD(RC1+2,2)+MOD(INT((RC1+2)/2),3)*5+1,FALSE)&"|"&HLOOKUP(Sheet1!R2C1,Sheet1!R2C1:R16C1,MOD(RC1+3,2)+MOD(INT((RC1+3)/2),3)*5+1,FALSE) -> 130|131|160|161|100 | H405: =HLOOKUP(Sheet1!R2C1,Sheet1!R2C1:R16C1,MOD(RC1+2,2)+MOD(INT((RC1+2)/2),3)*5+1,FALSE)&"|"&HLOOKUP(Sheet1!R2C1,Sheet1!R2C1:R16C1,MOD(RC1+3,2)+MOD(INT((RC1+3)/2),3)*5+1,FALSE)&"|"&HLOOKUP(Sheet1!R2C1,Sheet1!R2C1:R16C1,MOD(RC1+4,2)+MOD(INT((RC1+4)/2),3)*5+1,FALSE)&"|"&HLOOKUP(Sheet1!R2C1,Sheet1!R2C1:R16C1,MOD(RC1+5,2)+MOD(INT((RC1+5)/2),3)*5+1,FALSE)&"|"&HLOOKUP(Sheet1!R2C1,Sheet1!R2C1:R16C1,MOD(RC1+6,2)+MOD(INT((RC1+6)/2),3)*5+1,FALSE) -> 161|100|101|130|131 | I405: =HLOOKUP(Sheet1!R2C1,Sheet1!R2C1:R16C1,MOD(RC1-1,3)+MOD(INT((RC1-1)/3),3)*5+3,FALSE)&"|"&HLOOKUP(Sheet1!R2C1,Sheet1!R2C1:R16C1,MOD(RC1,3)+MOD(INT((RC1)/3),3)*5+3,FALSE)&"|"&HLOOKUP(Sheet1!R2C1,Sheet1!R2C1:R16C1,MOD(RC1+1,3)+MOD(INT((RC1+1)/3),3)*5+3,FALSE)&"|"&HLOOKUP(Sheet1!R2C1,Sheet1!R2C1:R16C1,MOD(RC1+2,3)+MOD(INT((RC1+2)/3),3)*5+3,FALSE)&"|"&HLOOKUP(Sheet1!R2C1,Sheet1!R2C1:R16C1,MOD(RC1+3,3)+MOD(INT((RC1+3)/3),3)*5+3,FALSE) -> 104|132|133|134|162 | J405: =HLOOKUP(Sheet1!R2C1,Sheet1!R2C1:R16C1,MOD(RC1-1,3)+MOD(INT((RC1-1)/3),3)*5+3,FALSE)&"|"&HLOOKUP(Sheet1!R2C1,Sheet1!R2C1:R16C1,MOD(RC1,3)+MOD(INT((RC1)/3),3)*5+3,FALSE)&"|"&HLOOKUP(Sheet1!R2C1,Sheet1!R2C1:R16C1,MOD(RC1+1,3)+MOD(INT((RC1+1)/3),3)*5+3,FALSE)&"|"&HLOOKUP(Sheet1!R2C1,Sheet1!R2C1:R16C1,MOD(RC1+2,3)+MOD(INT((RC1+2)/3),3)*5+3,FALSE)&"|"&HLOOKUP(Sheet1!R2C1,Sheet1!R2C1:R16C1,MOD(RC1+3,3)+MOD(INT((RC1+3)/3),3)*5+3,FALSE) -> 104|132|133|134|162 | K405: =HLOOKUP(Sheet1!R2C1,Sheet1!R2C1:R16C1,MOD(RC1-1,3)+MOD(INT((RC1-1)/3),3)*5+3,FALSE)&"|"&HLOOKUP(Sheet1!R2C1,Sheet1!R2C1:R16C1,MOD(RC1,3)+MOD(INT((RC1)/3),3)*5+3,FALSE)&"|"&HLOOKUP(Sheet1!R2C1,Sheet1!R2C1:R16C1,MOD(RC1+1,3)+MOD(INT((RC1+1)/3),3)*5+3,FALSE)&"|"&HLOOKUP(Sheet1!R2C1,Sheet1!R2C1:R16C1,MOD(RC1+2,3)+MOD(INT((RC1+2)/3),3)*5+3,FALSE)&"|"&HLOOKUP(Sheet1!R2C1,Sheet1!R2C1:R16C1,MOD(RC1+3,3)+MOD(INT((RC1+3)/3),3)*5+3,FALSE) -> 104|132|133|134|162 | L405: 25|22|23|24 | M405: 6516864|6516864|6516865|6516865 | N405: 10030|10031|10032|10033 | O405: 1|1|1|1 | P405: 2500|2500|2500|2500
A406: 400 | B406: 398 | C406: 30 | D406: =R[-20]C+2 -> 58 | E406: 1000 | F406: =MOD(RC[-5]-1,3)*30+100&"|"&MOD(RC[-5]-1,3)*30+101&"|"&MOD(RC[-5]-1,3)*30+102&"|"&MOD(RC[-5]-1,3)*30+103&"|"&IF(MOD(RC[-5],4)=0,HLOOKUP(Sheet1!R2C10,Sheet1!R2C10:R7C10,MOD(RC[-5]/4-1,6)+1,FALSE),IF(MOD(RC[-5],2)=0,IF(RC[-5]>20,HLOOKUP(Sheet1!R2C7,Sheet1!R2C7:R43C7,MOD(RC[-5]/2-1,42)+1,FALSE),HLOOKUP(Sheet1!R2C4,Sheet1!R2C4:R7C4,MOD(RC[-5]-1,6)+1,FALSE)),MOD(RC[-5]-1,3)*30+104)) -> 100|101|102|103|193 | G406: =HLOOKUP(Sheet1!R2C1,Sheet1!R2C1:R16C1,MOD(RC1-1,2)+MOD(INT((RC1-1)/2),3)*5+1,FALSE)&"|"&HLOOKUP(Sheet1!R2C1,Sheet1!R2C1:R16C1,MOD(RC1,2)+MOD(INT((RC1)/2),3)*5+1,FALSE)&"|"&HLOOKUP(Sheet1!R2C1,Sheet1!R2C1:R16C1,MOD(RC1+1,2)+MOD(INT((RC1+1)/2),3)*5+1,FALSE)&"|"&HLOOKUP(Sheet1!R2C1,Sheet1!R2C1:R16C1,MOD(RC1+2,2)+MOD(INT((RC1+2)/2),3)*5+1,FALSE)&"|"&HLOOKUP(Sheet1!R2C1,Sheet1!R2C1:R16C1,MOD(RC1+3,2)+MOD(INT((RC1+3)/2),3)*5+1,FALSE) -> 131|160|161|100|101 | H406: =HLOOKUP(Sheet1!R2C1,Sheet1!R2C1:R16C1,MOD(RC1+2,2)+MOD(INT((RC1+2)/2),3)*5+1,FALSE)&"|"&HLOOKUP(Sheet1!R2C1,Sheet1!R2C1:R16C1,MOD(RC1+3,2)+MOD(INT((RC1+3)/2),3)*5+1,FALSE)&"|"&HLOOKUP(Sheet1!R2C1,Sheet1!R2C1:R16C1,MOD(RC1+4,2)+MOD(INT((RC1+4)/2),3)*5+1,FALSE)&"|"&HLOOKUP(Sheet1!R2C1,Sheet1!R2C1:R16C1,MOD(RC1+5,2)+MOD(INT((RC1+5)/2),3)*5+1,FALSE)&"|"&HLOOKUP(Sheet1!R2C1,Sheet1!R2C1:R16C1,MOD(RC1+6,2)+MOD(INT((RC1+6)/2),3)*5+1,FALSE) -> 100|101|130|131|160 | I406: =HLOOKUP(Sheet1!R2C1,Sheet1!R2C1:R16C1,MOD(RC1-1,3)+MOD(INT((RC1-1)/3),3)*5+3,FALSE)&"|"&HLOOKUP(Sheet1!R2C1,Sheet1!R2C1:R16C1,MOD(RC1,3)+MOD(INT((RC1)/3),3)*5+3,FALSE)&"|"&HLOOKUP(Sheet1!R2C1,Sheet1!R2C1:R16C1,MOD(RC1+1,3)+MOD(INT((RC1+1)/3),3)*5+3,FALSE)&"|"&HLOOKUP(Sheet1!R2C1,Sheet1!R2C1:R16C1,MOD(RC1+2,3)+MOD(INT((RC1+2)/3),3)*5+3,FALSE)&"|"&HLOOKUP(Sheet1!R2C1,Sheet1!R2C1:R16C1,MOD(RC1+3,3)+MOD(INT((RC1+3)/3),3)*5+3,FALSE) -> 132|133|134|162|163 | J406: =HLOOKUP(Sheet1!R2C1,Sheet1!R2C1:R16C1,MOD(RC1-1,3)+MOD(INT((RC1-1)/3),3)*5+3,FALSE)&"|"&HLOOKUP(Sheet1!R2C1,Sheet1!R2C1:R16C1,MOD(RC1,3)+MOD(INT((RC1)/3),3)*5+3,FALSE)&"|"&HLOOKUP(Sheet1!R2C1,Sheet1!R2C1:R16C1,MOD(RC1+1,3)+MOD(INT((RC1+1)/3),3)*5+3,FALSE)&"|"&HLOOKUP(Sheet1!R2C1,Sheet1!R2C1:R16C1,MOD(RC1+2,3)+MOD(INT((RC1+2)/3),3)*5+3,FALSE)&"|"&HLOOKUP(Sheet1!R2C1,Sheet1!R2C1:R16C1,MOD(RC1+3,3)+MOD(INT((RC1+3)/3),3)*5+3,FALSE) -> 132|133|134|162|163 | K406: =HLOOKUP(Sheet1!R2C1,Sheet1!R2C1:R16C1,MOD(RC1-1,3)+MOD(INT((RC1-1)/3),3)*5+3,FALSE)&"|"&HLOOKUP(Sheet1!R2C1,Sheet1!R2C1:R16C1,MOD(RC1,3)+MOD(INT((RC1)/3),3)*5+3,FALSE)&"|"&HLOOKUP(Sheet1!R2C1,Sheet1!R2C1:R16C1,MOD(RC1+1,3)+MOD(INT((RC1+1)/3),3)*5+3,FALSE)&"|"&HLOOKUP(Sheet1!R2C1,Sheet1!R2C1:R16C1,MOD(RC1+2,3)+MOD(INT((RC1+2)/3),3)*5+3,FALSE)&"|"&HLOOKUP(Sheet1!R2C1,Sheet1!R2C1:R16C1,MOD(RC1+3,3)+MOD(INT((RC1+3)/3),3)*5+3,FALSE) -> 132|133|134|162|163 | L406: 25|22|23|24 | M406: 6573594|6573594|6573595|6573595 | N406: 10030|10031|10032|10033|10030|10031|10032|10033|10030|10031|10032|10033|10030|10031|10032|10033|10030|10031|10032|10033|10030|10031|10032|10033|10030|10031|10032|10033|10030|10031|10032|10033|10030|10031|10032|10033|10030|10031|10032|10033 | O406: 1|1|1|1|1|1|1|1|1|1|1|1|1|1|1|1|1|1|1|1|1|1|1|1|1|1|1|1|1|1|1|1|1|1|1|1|1|1|1|1 | P406: 2500|2500|2500|2500|2500|2500|2500|2500|2500|2500|2500|2500|2500|2500|2500|2500|2500|2500|2500|2500|2500|2500|2500|2500|2500|2500|2500|2500|2500|2500|2500|2500|2500|2500|2500|2500|2500|2500|2500|2500
A407: 401 | B407: 399 | C407: 30 | D407: =R[-20]C+2 -> 60 | E407: 1000 | F407: =MOD(RC[-5]-1,3)*30+100&"|"&MOD(RC[-5]-1,3)*30+101&"|"&MOD(RC[-5]-1,3)*30+102&"|"&MOD(RC[-5]-1,3)*30+103&"|"&IF(MOD(RC[-5],4)=0,HLOOKUP(Sheet1!R2C10,Sheet1!R2C10:R7C10,MOD(RC[-5]/4-1,6)+1,FALSE),IF(MOD(RC[-5],2)=0,IF(RC[-5]>20,HLOOKUP(Sheet1!R2C7,Sheet1!R2C7:R43C7,MOD(RC[-5]/2-1,42)+1,FALSE),HLOOKUP(Sheet1!R2C4,Sheet1!R2C4:R7C4,MOD(RC[-5]-1,6)+1,FALSE)),MOD(RC[-5]-1,3)*30+104)) -> 130|131|132|133|134 | G407: =HLOOKUP(Sheet1!R2C1,Sheet1!R2C1:R16C1,MOD(RC1-1,2)+MOD(INT((RC1-1)/2),3)*5+1,FALSE)&"|"&HLOOKUP(Sheet1!R2C1,Sheet1!R2C1:R16C1,MOD(RC1,2)+MOD(INT((RC1)/2),3)*5+1,FALSE)&"|"&HLOOKUP(Sheet1!R2C1,Sheet1!R2C1:R16C1,MOD(RC1+1,2)+MOD(INT((RC1+1)/2),3)*5+1,FALSE)&"|"&HLOOKUP(Sheet1!R2C1,Sheet1!R2C1:R16C1,MOD(RC1+2,2)+MOD(INT((RC1+2)/2),3)*5+1,FALSE)&"|"&HLOOKUP(Sheet1!R2C1,Sheet1!R2C1:R16C1,MOD(RC1+3,2)+MOD(INT((RC1+3)/2),3)*5+1,FALSE) -> 160|161|100|101|130 | H407: =HLOOKUP(Sheet1!R2C1,Sheet1!R2C1:R16C1,MOD(RC1+2,2)+MOD(INT((RC1+2)/2),3)*5+1,FALSE)&"|"&HLOOKUP(Sheet1!R2C1,Sheet1!R2C1:R16C1,MOD(RC1+3,2)+MOD(INT((RC1+3)/2),3)*5+1,FALSE)&"|"&HLOOKUP(Sheet1!R2C1,Sheet1!R2C1:R16C1,MOD(RC1+4,2)+MOD(INT((RC1+4)/2),3)*5+1,FALSE)&"|"&HLOOKUP(Sheet1!R2C1,Sheet1!R2C1:R16C1,MOD(RC1+5,2)+MOD(INT((RC1+5)/2),3)*5+1,FALSE)&"|"&HLOOKUP(Sheet1!R2C1,Sheet1!R2C1:R16C1,MOD(RC1+6,2)+MOD(INT((RC1+6)/2),3)*5+1,FALSE) -> 101|130|131|160|161 | I407: =HLOOKUP(Sheet1!R2C1,Sheet1!R2C1:R16C1,MOD(RC1-1,3)+MOD(INT((RC1-1)/3),3)*5+3,FALSE)&"|"&HLOOKUP(Sheet1!R2C1,Sheet1!R2C1:R16C1,MOD(RC1,3)+MOD(INT((RC1)/3),3)*5+3,FALSE)&"|"&HLOOKUP(Sheet1!R2C1,Sheet1!R2C1:R16C1,MOD(RC1+1,3)+MOD(INT((RC1+1)/3),3)*5+3,FALSE)&"|"&HLOOKUP(Sheet1!R2C1,Sheet1!R2C1:R16C1,MOD(RC1+2,3)+MOD(INT((RC1+2)/3),3)*5+3,FALSE)&"|"&HLOOKUP(Sheet1!R2C1,Sheet1!R2C1:R16C1,MOD(RC1+3,3)+MOD(INT((RC1+3)/3),3)*5+3,FALSE) -> 133|134|162|163|164 | J407: =HLOOKUP(Sheet1!R2C1,Sheet1!R2C1:R16C1,MOD(RC1-1,3)+MOD(INT((RC1-1)/3),3)*5+3,FALSE)&"|"&HLOOKUP(Sheet1!R2C1,Sheet1!R2C1:R16C1,MOD(RC1,3)+MOD(INT((RC1)/3),3)*5+3,FALSE)&"|"&HLOOKUP(Sheet1!R2C1,Sheet1!R2C1:R16C1,MOD(RC1+1,3)+MOD(INT((RC1+1)/3),3)*5+3,FALSE)&"|"&HLOOKUP(Sheet1!R2C1,Sheet1!R2C1:R16C1,MOD(RC1+2,3)+MOD(INT((RC1+2)/3),3)*5+3,FALSE)&"|"&HLOOKUP(Sheet1!R2C1,Sheet1!R2C1:R16C1,MOD(RC1+3,3)+MOD(INT((RC1+3)/3),3)*5+3,FALSE) -> 133|134|162|163|164 | K407: =HLOOKUP(Sheet1!R2C1,Sheet1!R2C1:R16C1,MOD(RC1-1,3)+MOD(INT((RC1-1)/3),3)*5+3,FALSE)&"|"&HLOOKUP(Sheet1!R2C1,Sheet1!R2C1:R16C1,MOD(RC1,3)+MOD(INT((RC1)/3),3)*5+3,FALSE)&"|"&HLOOKUP(Sheet1!R2C1,Sheet1!R2C1:R16C1,MOD(RC1+1,3)+MOD(INT((RC1+1)/3),3)*5+3,FALSE)&"|"&HLOOKUP(Sheet1!R2C1,Sheet1!R2C1:R16C1,MOD(RC1+2,3)+MOD(INT((RC1+2)/3),3)*5+3,FALSE)&"|"&HLOOKUP(Sheet1!R2C1,Sheet1!R2C1:R16C1,MOD(RC1+3,3)+MOD(INT((RC1+3)/3),3)*5+3,FALSE) -> 133|134|162|163|164 | L407: 25|22|23|24 | M407: 6630324|6630325|6630325|6630325 | N407: 10030|10031|10032|10033 | O407: 1|1|1|1 | P407: 2500|2500|2500|2500
A408: 402 | B408: 400 | C408: 30 | D408: =R[-20]C+2 -> 60 | E408: 1000 | F408: =MOD(RC[-5]-1,3)*30+100&"|"&MOD(RC[-5]-1,3)*30+101&"|"&MOD(RC[-5]-1,3)*30+102&"|"&MOD(RC[-5]-1,3)*30+103&"|"&IF(MOD(RC[-5],4)=0,HLOOKUP(Sheet1!R2C10,Sheet1!R2C10:R7C10,MOD(RC[-5]/4-1,6)+1,FALSE),IF(MOD(RC[-5],2)=0,IF(RC[-5]>20,HLOOKUP(Sheet1!R2C7,Sheet1!R2C7:R43C7,MOD(RC[-5]/2-1,42)+1,FALSE),HLOOKUP(Sheet1!R2C4,Sheet1!R2C4:R7C4,MOD(RC[-5]-1,6)+1,FALSE)),MOD(RC[-5]-1,3)*30+104)) -> 160|161|162|163|176 | G408: =HLOOKUP(Sheet1!R2C1,Sheet1!R2C1:R16C1,MOD(RC1-1,2)+MOD(INT((RC1-1)/2),3)*5+1,FALSE)&"|"&HLOOKUP(Sheet1!R2C1,Sheet1!R2C1:R16C1,MOD(RC1,2)+MOD(INT((RC1)/2),3)*5+1,FALSE)&"|"&HLOOKUP(Sheet1!R2C1,Sheet1!R2C1:R16C1,MOD(RC1+1,2)+MOD(INT((RC1+1)/2),3)*5+1,FALSE)&"|"&HLOOKUP(Sheet1!R2C1,Sheet1!R2C1:R16C1,MOD(RC1+2,2)+MOD(INT((RC1+2)/2),3)*5+1,FALSE)&"|"&HLOOKUP(Sheet1!R2C1,Sheet1!R2C1:R16C1,MOD(RC1+3,2)+MOD(INT((RC1+3)/2),3)*5+1,FALSE) -> 161|100|101|130|131 | H408: =HLOOKUP(Sheet1!R2C1,Sheet1!R2C1:R16C1,MOD(RC1+2,2)+MOD(INT((RC1+2)/2),3)*5+1,FALSE)&"|"&HLOOKUP(Sheet1!R2C1,Sheet1!R2C1:R16C1,MOD(RC1+3,2)+MOD(INT((RC1+3)/2),3)*5+1,FALSE)&"|"&HLOOKUP(Sheet1!R2C1,Sheet1!R2C1:R16C1,MOD(RC1+4,2)+MOD(INT((RC1+4)/2),3)*5+1,FALSE)&"|"&HLOOKUP(Sheet1!R2C1,Sheet1!R2C1:R16C1,MOD(RC1+5,2)+MOD(INT((RC1+5)/2),3)*5+1,FALSE)&"|"&HLOOKUP(Sheet1!R2C1,Sheet1!R2C1:R16C1,MOD(RC1+6,2)+MOD(INT((RC1+6)/2),3)*5+1,FALSE) -> 130|131|160|161|100 | I408: =HLOOKUP(Sheet1!R2C1,Sheet1!R2C1:R16C1,MOD(RC1-1,3)+MOD(INT((RC1-1)/3),3)*5+3,FALSE)&"|"&HLOOKUP(Sheet1!R2C1,Sheet1!R2C1:R16C1,MOD(RC1,3)+MOD(INT((RC1)/3),3)*5+3,FALSE)&"|"&HLOOKUP(Sheet1!R2C1,Sheet1!R2C1:R16C1,MOD(RC1+1,3)+MOD(INT((RC1+1)/3),3)*5+3,FALSE)&"|"&HLOOKUP(Sheet1!R2C1,Sheet1!R2C1:R16C1,MOD(RC1+2,3)+MOD(INT((RC1+2)/3),3)*5+3,FALSE)&"|"&HLOOKUP(Sheet1!R2C1,Sheet1!R2C1:R16C1,MOD(RC1+3,3)+MOD(INT((RC1+3)/3),3)*5+3,FALSE) -> 134|162|163|164|102 | J408: =HLOOKUP(Sheet1!R2C1,Sheet1!R2C1:R16C1,MOD(RC1-1,3)+MOD(INT((RC1-1)/3),3)*5+3,FALSE)&"|"&HLOOKUP(Sheet1!R2C1,Sheet1!R2C1:R16C1,MOD(RC1,3)+MOD(INT((RC1)/3),3)*5+3,FALSE)&"|"&HLOOKUP(Sheet1!R2C1,Sheet1!R2C1:R16C1,MOD(RC1+1,3)+MOD(INT((RC1+1)/3),3)*5+3,FALSE)&"|"&HLOOKUP(Sheet1!R2C1,Sheet1!R2C1:R16C1,MOD(RC1+2,3)+MOD(INT((RC1+2)/3),3)*5+3,FALSE)&"|"&HLOOKUP(Sheet1!R2C1,Sheet1!R2C1:R16C1,MOD(RC1+3,3)+MOD(INT((RC1+3)/3),3)*5+3,FALSE) -> 134|162|163|164|102 | K408: =HLOOKUP(Sheet1!R2C1,Sheet1!R2C1:R16C1,MOD(RC1-1,3)+MOD(INT((RC1-1)/3),3)*5+3,FALSE)&"|"&HLOOKUP(Sheet1!R2C1,Sheet1!R2C1:R16C1,MOD(RC1,3)+MOD(INT((RC1)/3),3)*5+3,FALSE)&"|"&HLOOKUP(Sheet1!R2C1,Sheet1!R2C1:R16C1,MOD(RC1+1,3)+MOD(INT((RC1+1)/3),3)*5+3,FALSE)&"|"&HLOOKUP(Sheet1!R2C1,Sheet1!R2C1:R16C1,MOD(RC1+2,3)+MOD(INT((RC1+2)/3),3)*5+3,FALSE)&"|"&HLOOKUP(Sheet1!R2C1,Sheet1!R2C1:R16C1,MOD(RC1+3,3)+MOD(INT((RC1+3)/3),3)*5+3,FALSE) -> 134|162|163|164|102 | L408: 25|22|23|24 | M408: 6690897|6690898|6690898|6690898 | N408: 10030|10031|10032|10033 | O408: 1|1|1|1 | P408: 2500|2500|2500|2500
A409: 403 | B409: 401 | C409: 30 | D409: =R[-20]C+2 -> 60 | E409: 1000 | F409: =MOD(RC[-5]-1,3)*30+100&"|"&MOD(RC[-5]-1,3)*30+101&"|"&MOD(RC[-5]-1,3)*30+102&"|"&MOD(RC[-5]-1,3)*30+103&"|"&IF(MOD(RC[-5],4)=0,HLOOKUP(Sheet1!R2C10,Sheet1!R2C10:R7C10,MOD(RC[-5]/4-1,6)+1,FALSE),IF(MOD(RC[-5],2)=0,IF(RC[-5]>20,HLOOKUP(Sheet1!R2C7,Sheet1!R2C7:R43C7,MOD(RC[-5]/2-1,42)+1,FALSE),HLOOKUP(Sheet1!R2C4,Sheet1!R2C4:R7C4,MOD(RC[-5]-1,6)+1,FALSE)),MOD(RC[-5]-1,3)*30+104)) -> 100|101|102|103|104 | G409: =HLOOKUP(Sheet1!R2C1,Sheet1!R2C1:R16C1,MOD(RC1-1,2)+MOD(INT((RC1-1)/2),3)*5+1,FALSE)&"|"&HLOOKUP(Sheet1!R2C1,Sheet1!R2C1:R16C1,MOD(RC1,2)+MOD(INT((RC1)/2),3)*5+1,FALSE)&"|"&HLOOKUP(Sheet1!R2C1,Sheet1!R2C1:R16C1,MOD(RC1+1,2)+MOD(INT((RC1+1)/2),3)*5+1,FALSE)&"|"&HLOOKUP(Sheet1!R2C1,Sheet1!R2C1:R16C1,MOD(RC1+2,2)+MOD(INT((RC1+2)/2),3)*5+1,FALSE)&"|"&HLOOKUP(Sheet1!R2C1,Sheet1!R2C1:R16C1,MOD(RC1+3,2)+MOD(INT((RC1+3)/2),3)*5+1,FALSE) -> 100|101|130|131|160 | H409: =HLOOKUP(Sheet1!R2C1,Sheet1!R2C1:R16C1,MOD(RC1+2,2)+MOD(INT((RC1+2)/2),3)*5+1,FALSE)&"|"&HLOOKUP(Sheet1!R2C1,Sheet1!R2C1:R16C1,MOD(RC1+3,2)+MOD(INT((RC1+3)/2),3)*5+1,FALSE)&"|"&HLOOKUP(Sheet1!R2C1,Sheet1!R2C1:R16C1,MOD(RC1+4,2)+MOD(INT((RC1+4)/2),3)*5+1,FALSE)&"|"&HLOOKUP(Sheet1!R2C1,Sheet1!R2C1:R16C1,MOD(RC1+5,2)+MOD(INT((RC1+5)/2),3)*5+1,FALSE)&"|"&HLOOKUP(Sheet1!R2C1,Sheet1!R2C1:R16C1,MOD(RC1+6,2)+MOD(INT((RC1+6)/2),3)*5+1,FALSE) -> 131|160|161|100|101 | I409: =HLOOKUP(Sheet1!R2C1,Sheet1!R2C1:R16C1,MOD(RC1-1,3)+MOD(INT((RC1-1)/3),3)*5+3,FALSE)&"|"&HLOOKUP(Sheet1!R2C1,Sheet1!R2C1:R16C1,MOD(RC1,3)+MOD(INT((RC1)/3),3)*5+3,FALSE)&"|"&HLOOKUP(Sheet1!R2C1,Sheet1!R2C1:R16C1,MOD(RC1+1,3)+MOD(INT((RC1+1)/3),3)*5+3,FALSE)&"|"&HLOOKUP(Sheet1!R2C1,Sheet1!R2C1:R16C1,MOD(RC1+2,3)+MOD(INT((RC1+2)/3),3)*5+3,FALSE)&"|"&HLOOKUP(Sheet1!R2C1,Sheet1!R2C1:R16C1,MOD(RC1+3,3)+MOD(INT((RC1+3)/3),3)*5+3,FALSE) -> 162|163|164|102|103 | J409: =HLOOKUP(Sheet1!R2C1,Sheet1!R2C1:R16C1,MOD(RC1-1,3)+MOD(INT((RC1-1)/3),3)*5+3,FALSE)&"|"&HLOOKUP(Sheet1!R2C1,Sheet1!R2C1:R16C1,MOD(RC1,3)+MOD(INT((RC1)/3),3)*5+3,FALSE)&"|"&HLOOKUP(Sheet1!R2C1,Sheet1!R2C1:R16C1,MOD(RC1+1,3)+MOD(INT((RC1+1)/3),3)*5+3,FALSE)&"|"&HLOOKUP(Sheet1!R2C1,Sheet1!R2C1:R16C1,MOD(RC1+2,3)+MOD(INT((RC1+2)/3),3)*5+3,FALSE)&"|"&HLOOKUP(Sheet1!R2C1,Sheet1!R2C1:R16C1,MOD(RC1+3,3)+MOD(INT((RC1+3)/3),3)*5+3,FALSE) -> 162|163|164|102|103 | K409: =HLOOKUP(Sheet1!R2C1,Sheet1!R2C1:R16C1,MOD(RC1-1,3)+MOD(INT((RC1-1)/3),3)*5+3,FALSE)&"|"&HLOOKUP(Sheet1!R2C1,Sheet1!R2C1:R16C1,MOD(RC1,3)+MOD(INT((RC1)/3),3)*5+3,FALSE)&"|"&HLOOKUP(Sheet1!R2C1,Sheet1!R2C1:R16C1,MOD(RC1+1,3)+MOD(INT((RC1+1)/3),3)*5+3,FALSE)&"|"&HLOOKUP(Sheet1!R2C1,Sheet1!R2C1:R16C1,MOD(RC1+2,3)+MOD(INT((RC1+2)/3),3)*5+3,FALSE)&"|"&HLOOKUP(Sheet1!R2C1,Sheet1!R2C1:R16C1,MOD(RC1+3,3)+MOD(INT((RC1+3)/3),3)*5+3,FALSE) -> 162|163|164|102|103 | L409: 25|22|23|24 | M409: 6749715|6749715|6749715|6749715 | N409: 10030|10031|10032|10033 | O409: 1|1|1|1 | P409: 2500|2500|2500|2500
A410: 404 | B410: 402 | C410: 30 | D410: =R[-20]C+2 -> 60 | E410: 1000 | F410: =MOD(RC[-5]-1,3)*30+100&"|"&MOD(RC[-5]-1,3)*30+101&"|"&MOD(RC[-5]-1,3)*30+102&"|"&MOD(RC[-5]-1,3)*30+103&"|"&IF(MOD(RC[-5],4)=0,HLOOKUP(Sheet1!R2C10,Sheet1!R2C10:R7C10,MOD(RC[-5]/4-1,6)+1,FALSE),IF(MOD(RC[-5],2)=0,IF(RC[-5]>20,HLOOKUP(Sheet1!R2C7,Sheet1!R2C7:R43C7,MOD(RC[-5]/2-1,42)+1,FALSE),HLOOKUP(Sheet1!R2C4,Sheet1!R2C4:R7C4,MOD(RC[-5]-1,6)+1,FALSE)),MOD(RC[-5]-1,3)*30+104)) -> 130|131|132|133|194 | G410: =HLOOKUP(Sheet1!R2C1,Sheet1!R2C1:R16C1,MOD(RC1-1,2)+MOD(INT((RC1-1)/2),3)*5+1,FALSE)&"|"&HLOOKUP(Sheet1!R2C1,Sheet1!R2C1:R16C1,MOD(RC1,2)+MOD(INT((RC1)/2),3)*5+1,FALSE)&"|"&HLOOKUP(Sheet1!R2C1,Sheet1!R2C1:R16C1,MOD(RC1+1,2)+MOD(INT((RC1+1)/2),3)*5+1,FALSE)&"|"&HLOOKUP(Sheet1!R2C1,Sheet1!R2C1:R16C1,MOD(RC1+2,2)+MOD(INT((RC1+2)/2),3)*5+1,FALSE)&"|"&HLOOKUP(Sheet1!R2C1,Sheet1!R2C1:R16C1,MOD(RC1+3,2)+MOD(INT((RC1+3)/2),3)*5+1,FALSE) -> 101|130|131|160|161 | H410: =HLOOKUP(Sheet1!R2C1,Sheet1!R2C1:R16C1,MOD(RC1+2,2)+MOD(INT((RC1+2)/2),3)*5+1,FALSE)&"|"&HLOOKUP(Sheet1!R2C1,Sheet1!R2C1:R16C1,MOD(RC1+3,2)+MOD(INT((RC1+3)/2),3)*5+1,FALSE)&"|"&HLOOKUP(Sheet1!R2C1,Sheet1!R2C1:R16C1,MOD(RC1+4,2)+MOD(INT((RC1+4)/2),3)*5+1,FALSE)&"|"&HLOOKUP(Sheet1!R2C1,Sheet1!R2C1:R16C1,MOD(RC1+5,2)+MOD(INT((RC1+5)/2),3)*5+1,FALSE)&"|"&HLOOKUP(Sheet1!R2C1,Sheet1!R2C1:R16C1,MOD(RC1+6,2)+MOD(INT((RC1+6)/2),3)*5+1,FALSE) -> 160|161|100|101|130 | I410: =HLOOKUP(Sheet1!R2C1,Sheet1!R2C1:R16C1,MOD(RC1-1,3)+MOD(INT((RC1-1)/3),3)*5+3,FALSE)&"|"&HLOOKUP(Sheet1!R2C1,Sheet1!R2C1:R16C1,MOD(RC1,3)+MOD(INT((RC1)/3),3)*5+3,FALSE)&"|"&HLOOKUP(Sheet1!R2C1,Sheet1!R2C1:R16C1,MOD(RC1+1,3)+MOD(INT((RC1+1)/3),3)*5+3,FALSE)&"|"&HLOOKUP(Sheet1!R2C1,Sheet1!R2C1:R16C1,MOD(RC1+2,3)+MOD(INT((RC1+2)/3),3)*5+3,FALSE)&"|"&HLOOKUP(Sheet1!R2C1,Sheet1!R2C1:R16C1,MOD(RC1+3,3)+MOD(INT((RC1+3)/3),3)*5+3,FALSE) -> 163|164|102|103|104 | J410: =HLOOKUP(Sheet1!R2C1,Sheet1!R2C1:R16C1,MOD(RC1-1,3)+MOD(INT((RC1-1)/3),3)*5+3,FALSE)&"|"&HLOOKUP(Sheet1!R2C1,Sheet1!R2C1:R16C1,MOD(RC1,3)+MOD(INT((RC1)/3),3)*5+3,FALSE)&"|"&HLOOKUP(Sheet1!R2C1,Sheet1!R2C1:R16C1,MOD(RC1+1,3)+MOD(INT((RC1+1)/3),3)*5+3,FALSE)&"|"&HLOOKUP(Sheet1!R2C1,Sheet1!R2C1:R16C1,MOD(RC1+2,3)+MOD(INT((RC1+2)/3),3)*5+3,FALSE)&"|"&HLOOKUP(Sheet1!R2C1,Sheet1!R2C1:R16C1,MOD(RC1+3,3)+MOD(INT((RC1+3)/3),3)*5+3,FALSE) -> 163|164|102|103|104 | K410: =HLOOKUP(Sheet1!R2C1,Sheet1!R2C1:R16C1,MOD(RC1-1,3)+MOD(INT((RC1-1)/3),3)*5+3,FALSE)&"|"&HLOOKUP(Sheet1!R2C1,Sheet1!R2C1:R16C1,MOD(RC1,3)+MOD(INT((RC1)/3),3)*5+3,FALSE)&"|"&HLOOKUP(Sheet1!R2C1,Sheet1!R2C1:R16C1,MOD(RC1+1,3)+MOD(INT((RC1+1)/3),3)*5+3,FALSE)&"|"&HLOOKUP(Sheet1!R2C1,Sheet1!R2C1:R16C1,MOD(RC1+2,3)+MOD(INT((RC1+2)/3),3)*5+3,FALSE)&"|"&HLOOKUP(Sheet1!R2C1,Sheet1!R2C1:R16C1,MOD(RC1+3,3)+MOD(INT((RC1+3)/3),3)*5+3,FALSE) -> 163|164|102|103|104 | L410: 25|22|23|24 | M410: 6808533|6808534|6808533|6808533 | N410: 10030|10031|10032|10033 | O410: 1|1|1|1 | P410: 2500|2500|2500|2500
A411: 405 | B411: 403 | C411: 30 | D411: =R[-20]C+2 -> 60 | E411: 1000 | F411: =MOD(RC[-5]-1,3)*30+100&"|"&MOD(RC[-5]-1,3)*30+101&"|"&MOD(RC[-5]-1,3)*30+102&"|"&MOD(RC[-5]-1,3)*30+103&"|"&IF(MOD(RC[-5],4)=0,HLOOKUP(Sheet1!R2C10,Sheet1!R2C10:R7C10,MOD(RC[-5]/4-1,6)+1,FALSE),IF(MOD(RC[-5],2)=0,IF(RC[-5]>20,HLOOKUP(Sheet1!R2C7,Sheet1!R2C7:R43C7,MOD(RC[-5]/2-1,42)+1,FALSE),HLOOKUP(Sheet1!R2C4,Sheet1!R2C4:R7C4,MOD(RC[-5]-1,6)+1,FALSE)),MOD(RC[-5]-1,3)*30+104)) -> 160|161|162|163|164 | G411: =HLOOKUP(Sheet1!R2C1,Sheet1!R2C1:R16C1,MOD(RC1-1,2)+MOD(INT((RC1-1)/2),3)*5+1,FALSE)&"|"&HLOOKUP(Sheet1!R2C1,Sheet1!R2C1:R16C1,MOD(RC1,2)+MOD(INT((RC1)/2),3)*5+1,FALSE)&"|"&HLOOKUP(Sheet1!R2C1,Sheet1!R2C1:R16C1,MOD(RC1+1,2)+MOD(INT((RC1+1)/2),3)*5+1,FALSE)&"|"&HLOOKUP(Sheet1!R2C1,Sheet1!R2C1:R16C1,MOD(RC1+2,2)+MOD(INT((RC1+2)/2),3)*5+1,FALSE)&"|"&HLOOKUP(Sheet1!R2C1,Sheet1!R2C1:R16C1,MOD(RC1+3,2)+MOD(INT((RC1+3)/2),3)*5+1,FALSE) -> 130|131|160|161|100 | H411: =HLOOKUP(Sheet1!R2C1,Sheet1!R2C1:R16C1,MOD(RC1+2,2)+MOD(INT((RC1+2)/2),3)*5+1,FALSE)&"|"&HLOOKUP(Sheet1!R2C1,Sheet1!R2C1:R16C1,MOD(RC1+3,2)+MOD(INT((RC1+3)/2),3)*5+1,FALSE)&"|"&HLOOKUP(Sheet1!R2C1,Sheet1!R2C1:R16C1,MOD(RC1+4,2)+MOD(INT((RC1+4)/2),3)*5+1,FALSE)&"|"&HLOOKUP(Sheet1!R2C1,Sheet1!R2C1:R16C1,MOD(RC1+5,2)+MOD(INT((RC1+5)/2),3)*5+1,FALSE)&"|"&HLOOKUP(Sheet1!R2C1,Sheet1!R2C1:R16C1,MOD(RC1+6,2)+MOD(INT((RC1+6)/2),3)*5+1,FALSE) -> 161|100|101|130|131 | I411: =HLOOKUP(Sheet1!R2C1,Sheet1!R2C1:R16C1,MOD(RC1-1,3)+MOD(INT((RC1-1)/3),3)*5+3,FALSE)&"|"&HLOOKUP(Sheet1!R2C1,Sheet1!R2C1:R16C1,MOD(RC1,3)+MOD(INT((RC1)/3),3)*5+3,FALSE)&"|"&HLOOKUP(Sheet1!R2C1,Sheet1!R2C1:R16C1,MOD(RC1+1,3)+MOD(INT((RC1+1)/3),3)*5+3,FALSE)&"|"&HLOOKUP(Sheet1!R2C1,Sheet1!R2C1:R16C1,MOD(RC1+2,3)+MOD(INT((RC1+2)/3),3)*5+3,FALSE)&"|"&HLOOKUP(Sheet1!R2C1,Sheet1!R2C1:R16C1,MOD(RC1+3,3)+MOD(INT((RC1+3)/3),3)*5+3,FALSE) -> 164|102|103|104|132 | J411: =HLOOKUP(Sheet1!R2C1,Sheet1!R2C1:R16C1,MOD(RC1-1,3)+MOD(INT((RC1-1)/3),3)*5+3,FALSE)&"|"&HLOOKUP(Sheet1!R2C1,Sheet1!R2C1:R16C1,MOD(RC1,3)+MOD(INT((RC1)/3),3)*5+3,FALSE)&"|"&HLOOKUP(Sheet1!R2C1,Sheet1!R2C1:R16C1,MOD(RC1+1,3)+MOD(INT((RC1+1)/3),3)*5+3,FALSE)&"|"&HLOOKUP(Sheet1!R2C1,Sheet1!R2C1:R16C1,MOD(RC1+2,3)+MOD(INT((RC1+2)/3),3)*5+3,FALSE)&"|"&HLOOKUP(Sheet1!R2C1,Sheet1!R2C1:R16C1,MOD(RC1+3,3)+MOD(INT((RC1+3)/3),3)*5+3,FALSE) -> 164|102|103|104|132 | K411: =HLOOKUP(Sheet1!R2C1,Sheet1!R2C1:R16C1,MOD(RC1-1,3)+MOD(INT((RC1-1)/3),3)*5+3,FALSE)&"|"&HLOOKUP(Sheet1!R2C1,Sheet1!R2C1:R16C1,MOD(RC1,3)+MOD(INT((RC1)/3),3)*5+3,FALSE)&"|"&HLOOKUP(Sheet1!R2C1,Sheet1!R2C1:R16C1,MOD(RC1+1,3)+MOD(INT((RC1+1)/3),3)*5+3,FALSE)&"|"&HLOOKUP(Sheet1!R2C1,Sheet1!R2C1:R16C1,MOD(RC1+2,3)+MOD(INT((RC1+2)/3),3)*5+3,FALSE)&"|"&HLOOKUP(Sheet1!R2C1,Sheet1!R2C1:R16C1,MOD(RC1+3,3)+MOD(INT((RC1+3)/3),3)*5+3,FALSE) -> 164|102|103|104|132 | L411: 25|22|23|24 | M411: 6867352|6867351|6867353|6867353 | N411: 10030|10031|10032|10033|10030|10031|10032|10033|10030|10031|10032|10033|10030|10031|10032|10033|10030|10031|10032|10033|10030|10031|10032|10033|10030|10031|10032|10033|10030|10031|10032|10033|10030|10031|10032|10033|10030|10031|10032|10033 | O411: 1|1|1|1|1|1|1|1|1|1|1|1|1|1|1|1|1|1|1|1|1|1|1|1|1|1|1|1|1|1|1|1|1|1|1|1|1|1|1|1 | P411: 2500|2500|2500|2500|2500|2500|2500|2500|2500|2500|2500|2500|2500|2500|2500|2500|2500|2500|2500|2500|2500|2500|2500|2500|2500|2500|2500|2500|2500|2500|2500|2500|2500|2500|2500|2500|2500|2500|2500|2500
A412: 406 | B412: 404 | C412: 30 | D412: =R[-20]C+2 -> 60 | E412: 1000 | F412: =MOD(RC[-5]-1,3)*30+100&"|"&MOD(RC[-5]-1,3)*30+101&"|"&MOD(RC[-5]-1,3)*30+102&"|"&MOD(RC[-5]-1,3)*30+103&"|"&IF(MOD(RC[-5],4)=0,HLOOKUP(Sheet1!R2C10,Sheet1!R2C10:R7C10,MOD(RC[-5]/4-1,6)+1,FALSE),IF(MOD(RC[-5],2)=0,IF(RC[-5]>20,HLOOKUP(Sheet1!R2C7,Sheet1!R2C7:R43C7,MOD(RC[-5]/2-1,42)+1,FALSE),HLOOKUP(Sheet1!R2C4,Sheet1!R2C4:R7C4,MOD(RC[-5]-1,6)+1,FALSE)),MOD(RC[-5]-1,3)*30+104)) -> 100|101|102|103|178 | G412: =HLOOKUP(Sheet1!R2C1,Sheet1!R2C1:R16C1,MOD(RC1-1,2)+MOD(INT((RC1-1)/2),3)*5+1,FALSE)&"|"&HLOOKUP(Sheet1!R2C1,Sheet1!R2C1:R16C1,MOD(RC1,2)+MOD(INT((RC1)/2),3)*5+1,FALSE)&"|"&HLOOKUP(Sheet1!R2C1,Sheet1!R2C1:R16C1,MOD(RC1+1,2)+MOD(INT((RC1+1)/2),3)*5+1,FALSE)&"|"&HLOOKUP(Sheet1!R2C1,Sheet1!R2C1:R16C1,MOD(RC1+2,2)+MOD(INT((RC1+2)/2),3)*5+1,FALSE)&"|"&HLOOKUP(Sheet1!R2C1,Sheet1!R2C1:R16C1,MOD(RC1+3,2)+MOD(INT((RC1+3)/2),3)*5+1,FALSE) -> 131|160|161|100|101 | H412: =HLOOKUP(Sheet1!R2C1,Sheet1!R2C1:R16C1,MOD(RC1+2,2)+MOD(INT((RC1+2)/2),3)*5+1,FALSE)&"|"&HLOOKUP(Sheet1!R2C1,Sheet1!R2C1:R16C1,MOD(RC1+3,2)+MOD(INT((RC1+3)/2),3)*5+1,FALSE)&"|"&HLOOKUP(Sheet1!R2C1,Sheet1!R2C1:R16C1,MOD(RC1+4,2)+MOD(INT((RC1+4)/2),3)*5+1,FALSE)&"|"&HLOOKUP(Sheet1!R2C1,Sheet1!R2C1:R16C1,MOD(RC1+5,2)+MOD(INT((RC1+5)/2),3)*5+1,FALSE)&"|"&HLOOKUP(Sheet1!R2C1,Sheet1!R2C1:R16C1,MOD(RC1+6,2)+MOD(INT((RC1+6)/2),3)*5+1,FALSE) -> 100|101|130|131|160 | I412: =HLOOKUP(Sheet1!R2C1,Sheet1!R2C1:R16C1,MOD(RC1-1,3)+MOD(INT((RC1-1)/3),3)*5+3,FALSE)&"|"&HLOOKUP(Sheet1!R2C1,Sheet1!R2C1:R16C1,MOD(RC1,3)+MOD(INT((RC1)/3),3)*5+3,FALSE)&"|"&HLOOKUP(Sheet1!R2C1,Sheet1!R2C1:R16C1,MOD(RC1+1,3)+MOD(INT((RC1+1)/3),3)*5+3,FALSE)&"|"&HLOOKUP(Sheet1!R2C1,Sheet1!R2C1:R16C1,MOD(RC1+2,3)+MOD(INT((RC1+2)/3),3)*5+3,FALSE)&"|"&HLOOKUP(Sheet1!R2C1,Sheet1!R2C1:R16C1,MOD(RC1+3,3)+MOD(INT((RC1+3)/3),3)*5+3,FALSE) -> 102|103|104|132|133 | J412: =HLOOKUP(Sheet1!R2C1,Sheet1!R2C1:R16C1,MOD(RC1-1,3)+MOD(INT((RC1-1)/3),3)*5+3,FALSE)&"|"&HLOOKUP(Sheet1!R2C1,Sheet1!R2C1:R16C1,MOD(RC1,3)+MOD(INT((RC1)/3),3)*5+3,FALSE)&"|"&HLOOKUP(Sheet1!R2C1,Sheet1!R2C1:R16C1,MOD(RC1+1,3)+MOD(INT((RC1+1)/3),3)*5+3,FALSE)&"|"&HLOOKUP(Sheet1!R2C1,Sheet1!R2C1:R16C1,MOD(RC1+2,3)+MOD(INT((RC1+2)/3),3)*5+3,FALSE)&"|"&HLOOKUP(Sheet1!R2C1,Sheet1!R2C1:R16C1,MOD(RC1+3,3)+MOD(INT((RC1+3)/3),3)*5+3,FALSE) -> 102|103|104|132|133 | K412: =HLOOKUP(Sheet1!R2C1,Sheet1!R2C1:R16C1,MOD(RC1-1,3)+MOD(INT((RC1-1)/3),3)*5+3,FALSE)&"|"&HLOOKUP(Sheet1!R2C1,Sheet1!R2C1:R16C1,MOD(RC1,3)+MOD(INT((RC1)/3),3)*5+3,FALSE)&"|"&HLOOKUP(Sheet1!R2C1,Sheet1!R2C1:R16C1,MOD(RC1+1,3)+MOD(INT((RC1+1)/3),3)*5+3,FALSE)&"|"&HLOOKUP(Sheet1!R2C1,Sheet1!R2C1:R16C1,MOD(RC1+2,3)+MOD(INT((RC1+2)/3),3)*5+3,FALSE)&"|"&HLOOKUP(Sheet1!R2C1,Sheet1!R2C1:R16C1,MOD(RC1+3,3)+MOD(INT((RC1+3)/3),3)*5+3,FALSE) -> 102|103|104|132|133 | L412: 25|22|23|24 | M412: 6927342|6927343|6927343|6927343 | N412: 10030|10031|10032|10033 | O412: 1|1|1|1 | P412: 2500|2500|2500|2500
A413: 407 | B413: 405 | C413: 30 | D413: =R[-20]C+2 -> 60 | E413: 1000 | F413: =MOD(RC[-5]-1,3)*30+100&"|"&MOD(RC[-5]-1,3)*30+101&"|"&MOD(RC[-5]-1,3)*30+102&"|"&MOD(RC[-5]-1,3)*30+103&"|"&IF(MOD(RC[-5],4)=0,HLOOKUP(Sheet1!R2C10,Sheet1!R2C10:R7C10,MOD(RC[-5]/4-1,6)+1,FALSE),IF(MOD(RC[-5],2)=0,IF(RC[-5]>20,HLOOKUP(Sheet1!R2C7,Sheet1!R2C7:R43C7,MOD(RC[-5]/2-1,42)+1,FALSE),HLOOKUP(Sheet1!R2C4,Sheet1!R2C4:R7C4,MOD(RC[-5]-1,6)+1,FALSE)),MOD(RC[-5]-1,3)*30+104)) -> 130|131|132|133|134 | G413: =HLOOKUP(Sheet1!R2C1,Sheet1!R2C1:R16C1,MOD(RC1-1,2)+MOD(INT((RC1-1)/2),3)*5+1,FALSE)&"|"&HLOOKUP(Sheet1!R2C1,Sheet1!R2C1:R16C1,MOD(RC1,2)+MOD(INT((RC1)/2),3)*5+1,FALSE)&"|"&HLOOKUP(Sheet1!R2C1,Sheet1!R2C1:R16C1,MOD(RC1+1,2)+MOD(INT((RC1+1)/2),3)*5+1,FALSE)&"|"&HLOOKUP(Sheet1!R2C1,Sheet1!R2C1:R16C1,MOD(RC1+2,2)+MOD(INT((RC1+2)/2),3)*5+1,FALSE)&"|"&HLOOKUP(Sheet1!R2C1,Sheet1!R2C1:R16C1,MOD(RC1+3,2)+MOD(INT((RC1+3)/2),3)*5+1,FALSE) -> 160|161|100|101|130 | H413: =HLOOKUP(Sheet1!R2C1,Sheet1!R2C1:R16C1,MOD(RC1+2,2)+MOD(INT((RC1+2)/2),3)*5+1,FALSE)&"|"&HLOOKUP(Sheet1!R2C1,Sheet1!R2C1:R16C1,MOD(RC1+3,2)+MOD(INT((RC1+3)/2),3)*5+1,FALSE)&"|"&HLOOKUP(Sheet1!R2C1,Sheet1!R2C1:R16C1,MOD(RC1+4,2)+MOD(INT((RC1+4)/2),3)*5+1,FALSE)&"|"&HLOOKUP(Sheet1!R2C1,Sheet1!R2C1:R16C1,MOD(RC1+5,2)+MOD(INT((RC1+5)/2),3)*5+1,FALSE)&"|"&HLOOKUP(Sheet1!R2C1,Sheet1!R2C1:R16C1,MOD(RC1+6,2)+MOD(INT((RC1+6)/2),3)*5+1,FALSE) -> 101|130|131|160|161 | I413: =HLOOKUP(Sheet1!R2C1,Sheet1!R2C1:R16C1,MOD(RC1-1,3)+MOD(INT((RC1-1)/3),3)*5+3,FALSE)&"|"&HLOOKUP(Sheet1!R2C1,Sheet1!R2C1:R16C1,MOD(RC1,3)+MOD(INT((RC1)/3),3)*5+3,FALSE)&"|"&HLOOKUP(Sheet1!R2C1,Sheet1!R2C1:R16C1,MOD(RC1+1,3)+MOD(INT((RC1+1)/3),3)*5+3,FALSE)&"|"&HLOOKUP(Sheet1!R2C1,Sheet1!R2C1:R16C1,MOD(RC1+2,3)+MOD(INT((RC1+2)/3),3)*5+3,FALSE)&"|"&HLOOKUP(Sheet1!R2C1,Sheet1!R2C1:R16C1,MOD(RC1+3,3)+MOD(INT((RC1+3)/3),3)*5+3,FALSE) -> 103|104|132|133|134 | J413: =HLOOKUP(Sheet1!R2C1,Sheet1!R2C1:R16C1,MOD(RC1-1,3)+MOD(INT((RC1-1)/3),3)*5+3,FALSE)&"|"&HLOOKUP(Sheet1!R2C1,Sheet1!R2C1:R16C1,MOD(RC1,3)+MOD(INT((RC1)/3),3)*5+3,FALSE)&"|"&HLOOKUP(Sheet1!R2C1,Sheet1!R2C1:R16C1,MOD(RC1+1,3)+MOD(INT((RC1+1)/3),3)*5+3,FALSE)&"|"&HLOOKUP(Sheet1!R2C1,Sheet1!R2C1:R16C1,MOD(RC1+2,3)+MOD(INT((RC1+2)/3),3)*5+3,FALSE)&"|"&HLOOKUP(Sheet1!R2C1,Sheet1!R2C1:R16C1,MOD(RC1+3,3)+MOD(INT((RC1+3)/3),3)*5+3,FALSE) -> 103|104|132|133|134 | K413: =HLOOKUP(Sheet1!R2C1,Sheet1!R2C1:R16C1,MOD(RC1-1,3)+MOD(INT((RC1-1)/3),3)*5+3,FALSE)&"|"&HLOOKUP(Sheet1!R2C1,Sheet1!R2C1:R16C1,MOD(RC1,3)+MOD(INT((RC1)/3),3)*5+3,FALSE)&"|"&HLOOKUP(Sheet1!R2C1,Sheet1!R2C1:R16C1,MOD(RC1+1,3)+MOD(INT((RC1+1)/3),3)*5+3,FALSE)&"|"&HLOOKUP(Sheet1!R2C1,Sheet1!R2C1:R16C1,MOD(RC1+2,3)+MOD(INT((RC1+2)/3),3)*5+3,FALSE)&"|"&HLOOKUP(Sheet1!R2C1,Sheet1!R2C1:R16C1,MOD(RC1+3,3)+MOD(INT((RC1+3)/3),3)*5+3,FALSE) -> 103|104|132|133|134 | L413: 25|22|23|24 | M413: 6988325|6988325|6988325|6988325 | N413: 10030|10031|10032|10033 | O413: 1|1|1|1 | P413: 2500|2500|2500|2500
A414: 408 | B414: 406 | C414: 30 | D414: =R[-20]C+2 -> 60 | E414: 1000 | F414: =MOD(RC[-5]-1,3)*30+100&"|"&MOD(RC[-5]-1,3)*30+101&"|"&MOD(RC[-5]-1,3)*30+102&"|"&MOD(RC[-5]-1,3)*30+103&"|"&IF(MOD(RC[-5],4)=0,HLOOKUP(Sheet1!R2C10,Sheet1!R2C10:R7C10,MOD(RC[-5]/4-1,6)+1,FALSE),IF(MOD(RC[-5],2)=0,IF(RC[-5]>20,HLOOKUP(Sheet1!R2C7,Sheet1!R2C7:R43C7,MOD(RC[-5]/2-1,42)+1,FALSE),HLOOKUP(Sheet1!R2C4,Sheet1!R2C4:R7C4,MOD(RC[-5]-1,6)+1,FALSE)),MOD(RC[-5]-1,3)*30+104)) -> 160|161|162|163|195 | G414: =HLOOKUP(Sheet1!R2C1,Sheet1!R2C1:R16C1,MOD(RC1-1,2)+MOD(INT((RC1-1)/2),3)*5+1,FALSE)&"|"&HLOOKUP(Sheet1!R2C1,Sheet1!R2C1:R16C1,MOD(RC1,2)+MOD(INT((RC1)/2),3)*5+1,FALSE)&"|"&HLOOKUP(Sheet1!R2C1,Sheet1!R2C1:R16C1,MOD(RC1+1,2)+MOD(INT((RC1+1)/2),3)*5+1,FALSE)&"|"&HLOOKUP(Sheet1!R2C1,Sheet1!R2C1:R16C1,MOD(RC1+2,2)+MOD(INT((RC1+2)/2),3)*5+1,FALSE)&"|"&HLOOKUP(Sheet1!R2C1,Sheet1!R2C1:R16C1,MOD(RC1+3,2)+MOD(INT((RC1+3)/2),3)*5+1,FALSE) -> 161|100|101|130|131 | H414: =HLOOKUP(Sheet1!R2C1,Sheet1!R2C1:R16C1,MOD(RC1+2,2)+MOD(INT((RC1+2)/2),3)*5+1,FALSE)&"|"&HLOOKUP(Sheet1!R2C1,Sheet1!R2C1:R16C1,MOD(RC1+3,2)+MOD(INT((RC1+3)/2),3)*5+1,FALSE)&"|"&HLOOKUP(Sheet1!R2C1,Sheet1!R2C1:R16C1,MOD(RC1+4,2)+MOD(INT((RC1+4)/2),3)*5+1,FALSE)&"|"&HLOOKUP(Sheet1!R2C1,Sheet1!R2C1:R16C1,MOD(RC1+5,2)+MOD(INT((RC1+5)/2),3)*5+1,FALSE)&"|"&HLOOKUP(Sheet1!R2C1,Sheet1!R2C1:R16C1,MOD(RC1+6,2)+MOD(INT((RC1+6)/2),3)*5+1,FALSE) -> 130|131|160|161|100 | I414: =HLOOKUP(Sheet1!R2C1,Sheet1!R2C1:R16C1,MOD(RC1-1,3)+MOD(INT((RC1-1)/3),3)*5+3,FALSE)&"|"&HLOOKUP(Sheet1!R2C1,Sheet1!R2C1:R16C1,MOD(RC1,3)+MOD(INT((RC1)/3),3)*5+3,FALSE)&"|"&HLOOKUP(Sheet1!R2C1,Sheet1!R2C1:R16C1,MOD(RC1+1,3)+MOD(INT((RC1+1)/3),3)*5+3,FALSE)&"|"&HLOOKUP(Sheet1!R2C1,Sheet1!R2C1:R16C1,MOD(RC1+2,3)+MOD(INT((RC1+2)/3),3)*5+3,FALSE)&"|"&HLOOKUP(Sheet1!R2C1,Sheet1!R2C1:R16C1,MOD(RC1+3,3)+MOD(INT((RC1+3)/3),3)*5+3,FALSE) -> 104|132|133|134|162 | J414: =HLOOKUP(Sheet1!R2C1,Sheet1!R2C1:R16C1,MOD(RC1-1,3)+MOD(INT((RC1-1)/3),3)*5+3,FALSE)&"|"&HLOOKUP(Sheet1!R2C1,Sheet1!R2C1:R16C1,MOD(RC1,3)+MOD(INT((RC1)/3),3)*5+3,FALSE)&"|"&HLOOKUP(Sheet1!R2C1,Sheet1!R2C1:R16C1,MOD(RC1+1,3)+MOD(INT((RC1+1)/3),3)*5+3,FALSE)&"|"&HLOOKUP(Sheet1!R2C1,Sheet1!R2C1:R16C1,MOD(RC1+2,3)+MOD(INT((RC1+2)/3),3)*5+3,FALSE)&"|"&HLOOKUP(Sheet1!R2C1,Sheet1!R2C1:R16C1,MOD(RC1+3,3)+MOD(INT((RC1+3)/3),3)*5+3,FALSE) -> 104|132|133|134|162 | K414: =HLOOKUP(Sheet1!R2C1,Sheet1!R2C1:R16C1,MOD(RC1-1,3)+MOD(INT((RC1-1)/3),3)*5+3,FALSE)&"|"&HLOOKUP(Sheet1!R2C1,Sheet1!R2C1:R16C1,MOD(RC1,3)+MOD(INT((RC1)/3),3)*5+3,FALSE)&"|"&HLOOKUP(Sheet1!R2C1,Sheet1!R2C1:R16C1,MOD(RC1+1,3)+MOD(INT((RC1+1)/3),3)*5+3,FALSE)&"|"&HLOOKUP(Sheet1!R2C1,Sheet1!R2C1:R16C1,MOD(RC1+2,3)+MOD(INT((RC1+2)/3),3)*5+3,FALSE)&"|"&HLOOKUP(Sheet1!R2C1,Sheet1!R2C1:R16C1,MOD(RC1+3,3)+MOD(INT((RC1+3)/3),3)*5+3,FALSE) -> 104|132|133|134|162 | L414: 25|22|23|24 | M414: 7049308|7049308|7049308|7049308 | N414: 10030|10031|10032|10033 | O414: 1|1|1|1 | P414: 2500|2500|2500|2500
A415: 409 | B415: 407 | C415: 30 | D415: =R[-20]C+2 -> 60 | E415: 1000 | F415: =MOD(RC[-5]-1,3)*30+100&"|"&MOD(RC[-5]-1,3)*30+101&"|"&MOD(RC[-5]-1,3)*30+102&"|"&MOD(RC[-5]-1,3)*30+103&"|"&IF(MOD(RC[-5],4)=0,HLOOKUP(Sheet1!R2C10,Sheet1!R2C10:R7C10,MOD(RC[-5]/4-1,6)+1,FALSE),IF(MOD(RC[-5],2)=0,IF(RC[-5]>20,HLOOKUP(Sheet1!R2C7,Sheet1!R2C7:R43C7,MOD(RC[-5]/2-1,42)+1,FALSE),HLOOKUP(Sheet1!R2C4,Sheet1!R2C4:R7C4,MOD(RC[-5]-1,6)+1,FALSE)),MOD(RC[-5]-1,3)*30+104)) -> 100|101|102|103|104 | G415: =HLOOKUP(Sheet1!R2C1,Sheet1!R2C1:R16C1,MOD(RC1-1,2)+MOD(INT((RC1-1)/2),3)*5+1,FALSE)&"|"&HLOOKUP(Sheet1!R2C1,Sheet1!R2C1:R16C1,MOD(RC1,2)+MOD(INT((RC1)/2),3)*5+1,FALSE)&"|"&HLOOKUP(Sheet1!R2C1,Sheet1!R2C1:R16C1,MOD(RC1+1,2)+MOD(INT((RC1+1)/2),3)*5+1,FALSE)&"|"&HLOOKUP(Sheet1!R2C1,Sheet1!R2C1:R16C1,MOD(RC1+2,2)+MOD(INT((RC1+2)/2),3)*5+1,FALSE)&"|"&HLOOKUP(Sheet1!R2C1,Sheet1!R2C1:R16C1,MOD(RC1+3,2)+MOD(INT((RC1+3)/2),3)*5+1,FALSE) -> 100|101|130|131|160 | H415: =HLOOKUP(Sheet1!R2C1,Sheet1!R2C1:R16C1,MOD(RC1+2,2)+MOD(INT((RC1+2)/2),3)*5+1,FALSE)&"|"&HLOOKUP(Sheet1!R2C1,Sheet1!R2C1:R16C1,MOD(RC1+3,2)+MOD(INT((RC1+3)/2),3)*5+1,FALSE)&"|"&HLOOKUP(Sheet1!R2C1,Sheet1!R2C1:R16C1,MOD(RC1+4,2)+MOD(INT((RC1+4)/2),3)*5+1,FALSE)&"|"&HLOOKUP(Sheet1!R2C1,Sheet1!R2C1:R16C1,MOD(RC1+5,2)+MOD(INT((RC1+5)/2),3)*5+1,FALSE)&"|"&HLOOKUP(Sheet1!R2C1,Sheet1!R2C1:R16C1,MOD(RC1+6,2)+MOD(INT((RC1+6)/2),3)*5+1,FALSE) -> 131|160|161|100|101 | I415: =HLOOKUP(Sheet1!R2C1,Sheet1!R2C1:R16C1,MOD(RC1-1,3)+MOD(INT((RC1-1)/3),3)*5+3,FALSE)&"|"&HLOOKUP(Sheet1!R2C1,Sheet1!R2C1:R16C1,MOD(RC1,3)+MOD(INT((RC1)/3),3)*5+3,FALSE)&"|"&HLOOKUP(Sheet1!R2C1,Sheet1!R2C1:R16C1,MOD(RC1+1,3)+MOD(INT((RC1+1)/3),3)*5+3,FALSE)&"|"&HLOOKUP(Sheet1!R2C1,Sheet1!R2C1:R16C1,MOD(RC1+2,3)+MOD(INT((RC1+2)/3),3)*5+3,FALSE)&"|"&HLOOKUP(Sheet1!R2C1,Sheet1!R2C1:R16C1,MOD(RC1+3,3)+MOD(INT((RC1+3)/3),3)*5+3,FALSE) -> 132|133|134|162|163 | J415: =HLOOKUP(Sheet1!R2C1,Sheet1!R2C1:R16C1,MOD(RC1-1,3)+MOD(INT((RC1-1)/3),3)*5+3,FALSE)&"|"&HLOOKUP(Sheet1!R2C1,Sheet1!R2C1:R16C1,MOD(RC1,3)+MOD(INT((RC1)/3),3)*5+3,FALSE)&"|"&HLOOKUP(Sheet1!R2C1,Sheet1!R2C1:R16C1,MOD(RC1+1,3)+MOD(INT((RC1+1)/3),3)*5+3,FALSE)&"|"&HLOOKUP(Sheet1!R2C1,Sheet1!R2C1:R16C1,MOD(RC1+2,3)+MOD(INT((RC1+2)/3),3)*5+3,FALSE)&"|"&HLOOKUP(Sheet1!R2C1,Sheet1!R2C1:R16C1,MOD(RC1+3,3)+MOD(INT((RC1+3)/3),3)*5+3,FALSE) -> 132|133|134|162|163 | K415: =HLOOKUP(Sheet1!R2C1,Sheet1!R2C1:R16C1,MOD(RC1-1,3)+MOD(INT((RC1-1)/3),3)*5+3,FALSE)&"|"&HLOOKUP(Sheet1!R2C1,Sheet1!R2C1:R16C1,MOD(RC1,3)+MOD(INT((RC1)/3),3)*5+3,FALSE)&"|"&HLOOKUP(Sheet1!R2C1,Sheet1!R2C1:R16C1,MOD(RC1+1,3)+MOD(INT((RC1+1)/3),3)*5+3,FALSE)&"|"&HLOOKUP(Sheet1!R2C1,Sheet1!R2C1:R16C1,MOD(RC1+2,3)+MOD(INT((RC1+2)/3),3)*5+3,FALSE)&"|"&HLOOKUP(Sheet1!R2C1,Sheet1!R2C1:R16C1,MOD(RC1+3,3)+MOD(INT((RC1+3)/3),3)*5+3,FALSE) -> 132|133|134|162|163 | L415: 25|22|23|24 | M415: 7110290|7110290|7110290|7110290 | N415: 10030|10031|10032|10033 | O415: 1|1|1|1 | P415: 2500|2500|2500|2500
A416: 410 | B416: 408 | C416: 30 | D416: =R[-20]C+2 -> 60 | E416: 1000 | F416: =MOD(RC[-5]-1,3)*30+100&"|"&MOD(RC[-5]-1,3)*30+101&"|"&MOD(RC[-5]-1,3)*30+102&"|"&MOD(RC[-5]-1,3)*30+103&"|"&IF(MOD(RC[-5],4)=0,HLOOKUP(Sheet1!R2C10,Sheet1!R2C10:R7C10,MOD(RC[-5]/4-1,6)+1,FALSE),IF(MOD(RC[-5],2)=0,IF(RC[-5]>20,HLOOKUP(Sheet1!R2C7,Sheet1!R2C7:R43C7,MOD(RC[-5]/2-1,42)+1,FALSE),HLOOKUP(Sheet1!R2C4,Sheet1!R2C4:R7C4,MOD(RC[-5]-1,6)+1,FALSE)),MOD(RC[-5]-1,3)*30+104)) -> 130|131|132|133|180 | G416: =HLOOKUP(Sheet1!R2C1,Sheet1!R2C1:R16C1,MOD(RC1-1,2)+MOD(INT((RC1-1)/2),3)*5+1,FALSE)&"|"&HLOOKUP(Sheet1!R2C1,Sheet1!R2C1:R16C1,MOD(RC1,2)+MOD(INT((RC1)/2),3)*5+1,FALSE)&"|"&HLOOKUP(Sheet1!R2C1,Sheet1!R2C1:R16C1,MOD(RC1+1,2)+MOD(INT((RC1+1)/2),3)*5+1,FALSE)&"|"&HLOOKUP(Sheet1!R2C1,Sheet1!R2C1:R16C1,MOD(RC1+2,2)+MOD(INT((RC1+2)/2),3)*5+1,FALSE)&"|"&HLOOKUP(Sheet1!R2C1,Sheet1!R2C1:R16C1,MOD(RC1+3,2)+MOD(INT((RC1+3)/2),3)*5+1,FALSE) -> 101|130|131|160|161 | H416: =HLOOKUP(Sheet1!R2C1,Sheet1!R2C1:R16C1,MOD(RC1+2,2)+MOD(INT((RC1+2)/2),3)*5+1,FALSE)&"|"&HLOOKUP(Sheet1!R2C1,Sheet1!R2C1:R16C1,MOD(RC1+3,2)+MOD(INT((RC1+3)/2),3)*5+1,FALSE)&"|"&HLOOKUP(Sheet1!R2C1,Sheet1!R2C1:R16C1,MOD(RC1+4,2)+MOD(INT((RC1+4)/2),3)*5+1,FALSE)&"|"&HLOOKUP(Sheet1!R2C1,Sheet1!R2C1:R16C1,MOD(RC1+5,2)+MOD(INT((RC1+5)/2),3)*5+1,FALSE)&"|"&HLOOKUP(Sheet1!R2C1,Sheet1!R2C1:R16C1,MOD(RC1+6,2)+MOD(INT((RC1+6)/2),3)*5+1,FALSE) -> 160|161|100|101|130 | I416: =HLOOKUP(Sheet1!R2C1,Sheet1!R2C1:R16C1,MOD(RC1-1,3)+MOD(INT((RC1-1)/3),3)*5+3,FALSE)&"|"&HLOOKUP(Sheet1!R2C1,Sheet1!R2C1:R16C1,MOD(RC1,3)+MOD(INT((RC1)/3),3)*5+3,FALSE)&"|"&HLOOKUP(Sheet1!R2C1,Sheet1!R2C1:R16C1,MOD(RC1+1,3)+MOD(INT((RC1+1)/3),3)*5+3,FALSE)&"|"&HLOOKUP(Sheet1!R2C1,Sheet1!R2C1:R16C1,MOD(RC1+2,3)+MOD(INT((RC1+2)/3),3)*5+3,FALSE)&"|"&HLOOKUP(Sheet1!R2C1,Sheet1!R2C1:R16C1,MOD(RC1+3,3)+MOD(INT((RC1+3)/3),3)*5+3,FALSE) -> 133|134|162|163|164 | J416: =HLOOKUP(Sheet1!R2C1,Sheet1!R2C1:R16C1,MOD(RC1-1,3)+MOD(INT((RC1-1)/3),3)*5+3,FALSE)&"|"&HLOOKUP(Sheet1!R2C1,Sheet1!R2C1:R16C1,MOD(RC1,3)+MOD(INT((RC1)/3),3)*5+3,FALSE)&"|"&HLOOKUP(Sheet1!R2C1,Sheet1!R2C1:R16C1,MOD(RC1+1,3)+MOD(INT((RC1+1)/3),3)*5+3,FALSE)&"|"&HLOOKUP(Sheet1!R2C1,Sheet1!R2C1:R16C1,MOD(RC1+2,3)+MOD(INT((RC1+2)/3),3)*5+3,FALSE)&"|"&HLOOKUP(Sheet1!R2C1,Sheet1!R2C1:R16C1,MOD(RC1+3,3)+MOD(INT((RC1+3)/3),3)*5+3,FALSE) -> 133|134|162|163|164 | K416: =HLOOKUP(Sheet1!R2C1,Sheet1!R2C1:R16C1,MOD(RC1-1,3)+MOD(INT((RC1-1)/3),3)*5+3,FALSE)&"|"&HLOOKUP(Sheet1!R2C1,Sheet1!R2C1:R16C1,MOD(RC1,3)+MOD(INT((RC1)/3),3)*5+3,FALSE)&"|"&HLOOKUP(Sheet1!R2C1,Sheet1!R2C1:R16C1,MOD(RC1+1,3)+MOD(INT((RC1+1)/3),3)*5+3,FALSE)&"|"&HLOOKUP(Sheet1!R2C1,Sheet1!R2C1:R16C1,MOD(RC1+2,3)+MOD(INT((RC1+2)/3),3)*5+3,FALSE)&"|"&HLOOKUP(Sheet1!R2C1,Sheet1!R2C1:R16C1,MOD(RC1+3,3)+MOD(INT((RC1+3)/3),3)*5+3,FALSE) -> 133|134|162|163|164 | L416: 25|22|23|24 | M416: 7172115|7172115|7172115|7172115 | N416: 10030|10031|10032|10033|10030|10031|10032|10033|10030|10031|10032|10033|10030|10031|10032|10033|10030|10031|10032|10033|10030|10031|10032|10033|10030|10031|10032|10033|10030|10031|10032|10033|10030|10031|10032|10033|10030|10031|10032|10033 | O416: 1|1|1|1|1|1|1|1|1|1|1|1|1|1|1|1|1|1|1|1|1|1|1|1|1|1|1|1|1|1|1|1|1|1|1|1|1|1|1|1 | P416: 2500|2500|2500|2500|2500|2500|2500|2500|2500|2500|2500|2500|2500|2500|2500|2500|2500|2500|2500|2500|2500|2500|2500|2500|2500|2500|2500|2500|2500|2500|2500|2500|2500|2500|2500|2500|2500|2500|2500|2500
A417: 411 | B417: 409 | C417: 30 | D417: =R[-20]C+2 -> 60 | E417: 1000 | F417: =MOD(RC[-5]-1,3)*30+100&"|"&MOD(RC[-5]-1,3)*30+101&"|"&MOD(RC[-5]-1,3)*30+102&"|"&MOD(RC[-5]-1,3)*30+103&"|"&IF(MOD(RC[-5],4)=0,HLOOKUP(Sheet1!R2C10,Sheet1!R2C10:R7C10,MOD(RC[-5]/4-1,6)+1,FALSE),IF(MOD(RC[-5],2)=0,IF(RC[-5]>20,HLOOKUP(Sheet1!R2C7,Sheet1!R2C7:R43C7,MOD(RC[-5]/2-1,42)+1,FALSE),HLOOKUP(Sheet1!R2C4,Sheet1!R2C4:R7C4,MOD(RC[-5]-1,6)+1,FALSE)),MOD(RC[-5]-1,3)*30+104)) -> 160|161|162|163|164 | G417: =HLOOKUP(Sheet1!R2C1,Sheet1!R2C1:R16C1,MOD(RC1-1,2)+MOD(INT((RC1-1)/2),3)*5+1,FALSE)&"|"&HLOOKUP(Sheet1!R2C1,Sheet1!R2C1:R16C1,MOD(RC1,2)+MOD(INT((RC1)/2),3)*5+1,FALSE)&"|"&HLOOKUP(Sheet1!R2C1,Sheet1!R2C1:R16C1,MOD(RC1+1,2)+MOD(INT((RC1+1)/2),3)*5+1,FALSE)&"|"&HLOOKUP(Sheet1!R2C1,Sheet1!R2C1:R16C1,MOD(RC1+2,2)+MOD(INT((RC1+2)/2),3)*5+1,FALSE)&"|"&HLOOKUP(Sheet1!R2C1,Sheet1!R2C1:R16C1,MOD(RC1+3,2)+MOD(INT((RC1+3)/2),3)*5+1,FALSE) -> 130|131|160|161|100 | H417: =HLOOKUP(Sheet1!R2C1,Sheet1!R2C1:R16C1,MOD(RC1+2,2)+MOD(INT((RC1+2)/2),3)*5+1,FALSE)&"|"&HLOOKUP(Sheet1!R2C1,Sheet1!R2C1:R16C1,MOD(RC1+3,2)+MOD(INT((RC1+3)/2),3)*5+1,FALSE)&"|"&HLOOKUP(Sheet1!R2C1,Sheet1!R2C1:R16C1,MOD(RC1+4,2)+MOD(INT((RC1+4)/2),3)*5+1,FALSE)&"|"&HLOOKUP(Sheet1!R2C1,Sheet1!R2C1:R16C1,MOD(RC1+5,2)+MOD(INT((RC1+5)/2),3)*5+1,FALSE)&"|"&HLOOKUP(Sheet1!R2C1,Sheet1!R2C1:R16C1,MOD(RC1+6,2)+MOD(INT((RC1+6)/2),3)*5+1,FALSE) -> 161|100|101|130|131 | I417: =HLOOKUP(Sheet1!R2C1,Sheet1!R2C1:R16C1,MOD(RC1-1,3)+MOD(INT((RC1-1)/3),3)*5+3,FALSE)&"|"&HLOOKUP(Sheet1!R2C1,Sheet1!R2C1:R16C1,MOD(RC1,3)+MOD(INT((RC1)/3),3)*5+3,FALSE)&"|"&HLOOKUP(Sheet1!R2C1,Sheet1!R2C1:R16C1,MOD(RC1+1,3)+MOD(INT((RC1+1)/3),3)*5+3,FALSE)&"|"&HLOOKUP(Sheet1!R2C1,Sheet1!R2C1:R16C1,MOD(RC1+2,3)+MOD(INT((RC1+2)/3),3)*5+3,FALSE)&"|"&HLOOKUP(Sheet1!R2C1,Sheet1!R2C1:R16C1,MOD(RC1+3,3)+MOD(INT((RC1+3)/3),3)*5+3,FALSE) -> 134|162|163|164|102 | J417: =HLOOKUP(Sheet1!R2C1,Sheet1!R2C1:R16C1,MOD(RC1-1,3)+MOD(INT((RC1-1)/3),3)*5+3,FALSE)&"|"&HLOOKUP(Sheet1!R2C1,Sheet1!R2C1:R16C1,MOD(RC1,3)+MOD(INT((RC1)/3),3)*5+3,FALSE)&"|"&HLOOKUP(Sheet1!R2C1,Sheet1!R2C1:R16C1,MOD(RC1+1,3)+MOD(INT((RC1+1)/3),3)*5+3,FALSE)&"|"&HLOOKUP(Sheet1!R2C1,Sheet1!R2C1:R16C1,MOD(RC1+2,3)+MOD(INT((RC1+2)/3),3)*5+3,FALSE)&"|"&HLOOKUP(Sheet1!R2C1,Sheet1!R2C1:R16C1,MOD(RC1+3,3)+MOD(INT((RC1+3)/3),3)*5+3,FALSE) -> 134|162|163|164|102 | K417: =HLOOKUP(Sheet1!R2C1,Sheet1!R2C1:R16C1,MOD(RC1-1,3)+MOD(INT((RC1-1)/3),3)*5+3,FALSE)&"|"&HLOOKUP(Sheet1!R2C1,Sheet1!R2C1:R16C1,MOD(RC1,3)+MOD(INT((RC1)/3),3)*5+3,FALSE)&"|"&HLOOKUP(Sheet1!R2C1,Sheet1!R2C1:R16C1,MOD(RC1+1,3)+MOD(INT((RC1+1)/3),3)*5+3,FALSE)&"|"&HLOOKUP(Sheet1!R2C1,Sheet1!R2C1:R16C1,MOD(RC1+2,3)+MOD(INT((RC1+2)/3),3)*5+3,FALSE)&"|"&HLOOKUP(Sheet1!R2C1,Sheet1!R2C1:R16C1,MOD(RC1+3,3)+MOD(INT((RC1+3)/3),3)*5+3,FALSE) -> 134|162|163|164|102 | L417: 25|22|23|24 | M417: 7235342|7235341|7235343|7235343 | N417: 10030|10031|10032|10033 | O417: 1|1|1|1 | P417: 2500|2500|2500|2500
A418: 412 | B418: 410 | C418: 30 | D418: =R[-20]C+2 -> 60 | E418: 1000 | F418: =MOD(RC[-5]-1,3)*30+100&"|"&MOD(RC[-5]-1,3)*30+101&"|"&MOD(RC[-5]-1,3)*30+102&"|"&MOD(RC[-5]-1,3)*30+103&"|"&IF(MOD(RC[-5],4)=0,HLOOKUP(Sheet1!R2C10,Sheet1!R2C10:R7C10,MOD(RC[-5]/4-1,6)+1,FALSE),IF(MOD(RC[-5],2)=0,IF(RC[-5]>20,HLOOKUP(Sheet1!R2C7,Sheet1!R2C7:R43C7,MOD(RC[-5]/2-1,42)+1,FALSE),HLOOKUP(Sheet1!R2C4,Sheet1!R2C4:R7C4,MOD(RC[-5]-1,6)+1,FALSE)),MOD(RC[-5]-1,3)*30+104)) -> 100|101|102|103|190 | G418: =HLOOKUP(Sheet1!R2C1,Sheet1!R2C1:R16C1,MOD(RC1-1,2)+MOD(INT((RC1-1)/2),3)*5+1,FALSE)&"|"&HLOOKUP(Sheet1!R2C1,Sheet1!R2C1:R16C1,MOD(RC1,2)+MOD(INT((RC1)/2),3)*5+1,FALSE)&"|"&HLOOKUP(Sheet1!R2C1,Sheet1!R2C1:R16C1,MOD(RC1+1,2)+MOD(INT((RC1+1)/2),3)*5+1,FALSE)&"|"&HLOOKUP(Sheet1!R2C1,Sheet1!R2C1:R16C1,MOD(RC1+2,2)+MOD(INT((RC1+2)/2),3)*5+1,FALSE)&"|"&HLOOKUP(Sheet1!R2C1,Sheet1!R2C1:R16C1,MOD(RC1+3,2)+MOD(INT((RC1+3)/2),3)*5+1,FALSE) -> 131|160|161|100|101 | H418: =HLOOKUP(Sheet1!R2C1,Sheet1!R2C1:R16C1,MOD(RC1+2,2)+MOD(INT((RC1+2)/2),3)*5+1,FALSE)&"|"&HLOOKUP(Sheet1!R2C1,Sheet1!R2C1:R16C1,MOD(RC1+3,2)+MOD(INT((RC1+3)/2),3)*5+1,FALSE)&"|"&HLOOKUP(Sheet1!R2C1,Sheet1!R2C1:R16C1,MOD(RC1+4,2)+MOD(INT((RC1+4)/2),3)*5+1,FALSE)&"|"&HLOOKUP(Sheet1!R2C1,Sheet1!R2C1:R16C1,MOD(RC1+5,2)+MOD(INT((RC1+5)/2),3)*5+1,FALSE)&"|"&HLOOKUP(Sheet1!R2C1,Sheet1!R2C1:R16C1,MOD(RC1+6,2)+MOD(INT((RC1+6)/2),3)*5+1,FALSE) -> 100|101|130|131|160 | I418: =HLOOKUP(Sheet1!R2C1,Sheet1!R2C1:R16C1,MOD(RC1-1,3)+MOD(INT((RC1-1)/3),3)*5+3,FALSE)&"|"&HLOOKUP(Sheet1!R2C1,Sheet1!R2C1:R16C1,MOD(RC1,3)+MOD(INT((RC1)/3),3)*5+3,FALSE)&"|"&HLOOKUP(Sheet1!R2C1,Sheet1!R2C1:R16C1,MOD(RC1+1,3)+MOD(INT((RC1+1)/3),3)*5+3,FALSE)&"|"&HLOOKUP(Sheet1!R2C1,Sheet1!R2C1:R16C1,MOD(RC1+2,3)+MOD(INT((RC1+2)/3),3)*5+3,FALSE)&"|"&HLOOKUP(Sheet1!R2C1,Sheet1!R2C1:R16C1,MOD(RC1+3,3)+MOD(INT((RC1+3)/3),3)*5+3,FALSE) -> 162|163|164|102|103 | J418: =HLOOKUP(Sheet1!R2C1,Sheet1!R2C1:R16C1,MOD(RC1-1,3)+MOD(INT((RC1-1)/3),3)*5+3,FALSE)&"|"&HLOOKUP(Sheet1!R2C1,Sheet1!R2C1:R16C1,MOD(RC1,3)+MOD(INT((RC1)/3),3)*5+3,FALSE)&"|"&HLOOKUP(Sheet1!R2C1,Sheet1!R2C1:R16C1,MOD(RC1+1,3)+MOD(INT((RC1+1)/3),3)*5+3,FALSE)&"|"&HLOOKUP(Sheet1!R2C1,Sheet1!R2C1:R16C1,MOD(RC1+2,3)+MOD(INT((RC1+2)/3),3)*5+3,FALSE)&"|"&HLOOKUP(Sheet1!R2C1,Sheet1!R2C1:R16C1,MOD(RC1+3,3)+MOD(INT((RC1+3)/3),3)*5+3,FALSE) -> 162|163|164|102|103 | K418: =HLOOKUP(Sheet1!R2C1,Sheet1!R2C1:R16C1,MOD(RC1-1,3)+MOD(INT((RC1-1)/3),3)*5+3,FALSE)&"|"&HLOOKUP(Sheet1!R2C1,Sheet1!R2C1:R16C1,MOD(RC1,3)+MOD(INT((RC1)/3),3)*5+3,FALSE)&"|"&HLOOKUP(Sheet1!R2C1,Sheet1!R2C1:R16C1,MOD(RC1+1,3)+MOD(INT((RC1+1)/3),3)*5+3,FALSE)&"|"&HLOOKUP(Sheet1!R2C1,Sheet1!R2C1:R16C1,MOD(RC1+2,3)+MOD(INT((RC1+2)/3),3)*5+3,FALSE)&"|"&HLOOKUP(Sheet1!R2C1,Sheet1!R2C1:R16C1,MOD(RC1+3,3)+MOD(INT((RC1+3)/3),3)*5+3,FALSE) -> 162|163|164|102|103 | L418: 25|22|23|24 | M418: 7298569|7298569|7298568|7298568 | N418: 10030|10031|10032|10033 | O418: 1|1|1|1 | P418: 2500|2500|2500|2500
A419: 413 | B419: 411 | C419: 30 | D419: =R[-20]C+2 -> 60 | E419: 1000 | F419: =MOD(RC[-5]-1,3)*30+100&"|"&MOD(RC[-5]-1,3)*30+101&"|"&MOD(RC[-5]-1,3)*30+102&"|"&MOD(RC[-5]-1,3)*30+103&"|"&IF(MOD(RC[-5],4)=0,HLOOKUP(Sheet1!R2C10,Sheet1!R2C10:R7C10,MOD(RC[-5]/4-1,6)+1,FALSE),IF(MOD(RC[-5],2)=0,IF(RC[-5]>20,HLOOKUP(Sheet1!R2C7,Sheet1!R2C7:R43C7,MOD(RC[-5]/2-1,42)+1,FALSE),HLOOKUP(Sheet1!R2C4,Sheet1!R2C4:R7C4,MOD(RC[-5]-1,6)+1,FALSE)),MOD(RC[-5]-1,3)*30+104)) -> 130|131|132|133|134 | G419: =HLOOKUP(Sheet1!R2C1,Sheet1!R2C1:R16C1,MOD(RC1-1,2)+MOD(INT((RC1-1)/2),3)*5+1,FALSE)&"|"&HLOOKUP(Sheet1!R2C1,Sheet1!R2C1:R16C1,MOD(RC1,2)+MOD(INT((RC1)/2),3)*5+1,FALSE)&"|"&HLOOKUP(Sheet1!R2C1,Sheet1!R2C1:R16C1,MOD(RC1+1,2)+MOD(INT((RC1+1)/2),3)*5+1,FALSE)&"|"&HLOOKUP(Sheet1!R2C1,Sheet1!R2C1:R16C1,MOD(RC1+2,2)+MOD(INT((RC1+2)/2),3)*5+1,FALSE)&"|"&HLOOKUP(Sheet1!R2C1,Sheet1!R2C1:R16C1,MOD(RC1+3,2)+MOD(INT((RC1+3)/2),3)*5+1,FALSE) -> 160|161|100|101|130 | H419: =HLOOKUP(Sheet1!R2C1,Sheet1!R2C1:R16C1,MOD(RC1+2,2)+MOD(INT((RC1+2)/2),3)*5+1,FALSE)&"|"&HLOOKUP(Sheet1!R2C1,Sheet1!R2C1:R16C1,MOD(RC1+3,2)+MOD(INT((RC1+3)/2),3)*5+1,FALSE)&"|"&HLOOKUP(Sheet1!R2C1,Sheet1!R2C1:R16C1,MOD(RC1+4,2)+MOD(INT((RC1+4)/2),3)*5+1,FALSE)&"|"&HLOOKUP(Sheet1!R2C1,Sheet1!R2C1:R16C1,MOD(RC1+5,2)+MOD(INT((RC1+5)/2),3)*5+1,FALSE)&"|"&HLOOKUP(Sheet1!R2C1,Sheet1!R2C1:R16C1,MOD(RC1+6,2)+MOD(INT((RC1+6)/2),3)*5+1,FALSE) -> 101|130|131|160|161 | I419: =HLOOKUP(Sheet1!R2C1,Sheet1!R2C1:R16C1,MOD(RC1-1,3)+MOD(INT((RC1-1)/3),3)*5+3,FALSE)&"|"&HLOOKUP(Sheet1!R2C1,Sheet1!R2C1:R16C1,MOD(RC1,3)+MOD(INT((RC1)/3),3)*5+3,FALSE)&"|"&HLOOKUP(Sheet1!R2C1,Sheet1!R2C1:R16C1,MOD(RC1+1,3)+MOD(INT((RC1+1)/3),3)*5+3,FALSE)&"|"&HLOOKUP(Sheet1!R2C1,Sheet1!R2C1:R16C1,MOD(RC1+2,3)+MOD(INT((RC1+2)/3),3)*5+3,FALSE)&"|"&HLOOKUP(Sheet1!R2C1,Sheet1!R2C1:R16C1,MOD(RC1+3,3)+MOD(INT((RC1+3)/3),3)*5+3,FALSE) -> 163|164|102|103|104 | J419: =HLOOKUP(Sheet1!R2C1,Sheet1!R2C1:R16C1,MOD(RC1-1,3)+MOD(INT((RC1-1)/3),3)*5+3,FALSE)&"|"&HLOOKUP(Sheet1!R2C1,Sheet1!R2C1:R16C1,MOD(RC1,3)+MOD(INT((RC1)/3),3)*5+3,FALSE)&"|"&HLOOKUP(Sheet1!R2C1,Sheet1!R2C1:R16C1,MOD(RC1+1,3)+MOD(INT((RC1+1)/3),3)*5+3,FALSE)&"|"&HLOOKUP(Sheet1!R2C1,Sheet1!R2C1:R16C1,MOD(RC1+2,3)+MOD(INT((RC1+2)/3),3)*5+3,FALSE)&"|"&HLOOKUP(Sheet1!R2C1,Sheet1!R2C1:R16C1,MOD(RC1+3,3)+MOD(INT((RC1+3)/3),3)*5+3,FALSE) -> 163|164|102|103|104 | K419: =HLOOKUP(Sheet1!R2C1,Sheet1!R2C1:R16C1,MOD(RC1-1,3)+MOD(INT((RC1-1)/3),3)*5+3,FALSE)&"|"&HLOOKUP(Sheet1!R2C1,Sheet1!R2C1:R16C1,MOD(RC1,3)+MOD(INT((RC1)/3),3)*5+3,FALSE)&"|"&HLOOKUP(Sheet1!R2C1,Sheet1!R2C1:R16C1,MOD(RC1+1,3)+MOD(INT((RC1+1)/3),3)*5+3,FALSE)&"|"&HLOOKUP(Sheet1!R2C1,Sheet1!R2C1:R16C1,MOD(RC1+2,3)+MOD(INT((RC1+2)/3),3)*5+3,FALSE)&"|"&HLOOKUP(Sheet1!R2C1,Sheet1!R2C1:R16C1,MOD(RC1+3,3)+MOD(INT((RC1+3)/3),3)*5+3,FALSE) -> 163|164|102|103|104 | L419: 25|22|23|24 | M419: 7361796|7361796|7361795|7361795 | N419: 10030|10031|10032|10033 | O419: 1|1|1|1 | P419: 2500|2500|2500|2500
A420: 414 | B420: 412 | C420: 30 | D420: =R[-20]C+2 -> 60 | E420: 1000 | F420: =MOD(RC[-5]-1,3)*30+100&"|"&MOD(RC[-5]-1,3)*30+101&"|"&MOD(RC[-5]-1,3)*30+102&"|"&MOD(RC[-5]-1,3)*30+103&"|"&IF(MOD(RC[-5],4)=0,HLOOKUP(Sheet1!R2C10,Sheet1!R2C10:R7C10,MOD(RC[-5]/4-1,6)+1,FALSE),IF(MOD(RC[-5],2)=0,IF(RC[-5]>20,HLOOKUP(Sheet1!R2C7,Sheet1!R2C7:R43C7,MOD(RC[-5]/2-1,42)+1,FALSE),HLOOKUP(Sheet1!R2C4,Sheet1!R2C4:R7C4,MOD(RC[-5]-1,6)+1,FALSE)),MOD(RC[-5]-1,3)*30+104)) -> 160|161|162|163|182 | G420: =HLOOKUP(Sheet1!R2C1,Sheet1!R2C1:R16C1,MOD(RC1-1,2)+MOD(INT((RC1-1)/2),3)*5+1,FALSE)&"|"&HLOOKUP(Sheet1!R2C1,Sheet1!R2C1:R16C1,MOD(RC1,2)+MOD(INT((RC1)/2),3)*5+1,FALSE)&"|"&HLOOKUP(Sheet1!R2C1,Sheet1!R2C1:R16C1,MOD(RC1+1,2)+MOD(INT((RC1+1)/2),3)*5+1,FALSE)&"|"&HLOOKUP(Sheet1!R2C1,Sheet1!R2C1:R16C1,MOD(RC1+2,2)+MOD(INT((RC1+2)/2),3)*5+1,FALSE)&"|"&HLOOKUP(Sheet1!R2C1,Sheet1!R2C1:R16C1,MOD(RC1+3,2)+MOD(INT((RC1+3)/2),3)*5+1,FALSE) -> 161|100|101|130|131 | H420: =HLOOKUP(Sheet1!R2C1,Sheet1!R2C1:R16C1,MOD(RC1+2,2)+MOD(INT((RC1+2)/2),3)*5+1,FALSE)&"|"&HLOOKUP(Sheet1!R2C1,Sheet1!R2C1:R16C1,MOD(RC1+3,2)+MOD(INT((RC1+3)/2),3)*5+1,FALSE)&"|"&HLOOKUP(Sheet1!R2C1,Sheet1!R2C1:R16C1,MOD(RC1+4,2)+MOD(INT((RC1+4)/2),3)*5+1,FALSE)&"|"&HLOOKUP(Sheet1!R2C1,Sheet1!R2C1:R16C1,MOD(RC1+5,2)+MOD(INT((RC1+5)/2),3)*5+1,FALSE)&"|"&HLOOKUP(Sheet1!R2C1,Sheet1!R2C1:R16C1,MOD(RC1+6,2)+MOD(INT((RC1+6)/2),3)*5+1,FALSE) -> 130|131|160|161|100 | I420: =HLOOKUP(Sheet1!R2C1,Sheet1!R2C1:R16C1,MOD(RC1-1,3)+MOD(INT((RC1-1)/3),3)*5+3,FALSE)&"|"&HLOOKUP(Sheet1!R2C1,Sheet1!R2C1:R16C1,MOD(RC1,3)+MOD(INT((RC1)/3),3)*5+3,FALSE)&"|"&HLOOKUP(Sheet1!R2C1,Sheet1!R2C1:R16C1,MOD(RC1+1,3)+MOD(INT((RC1+1)/3),3)*5+3,FALSE)&"|"&HLOOKUP(Sheet1!R2C1,Sheet1!R2C1:R16C1,MOD(RC1+2,3)+MOD(INT((RC1+2)/3),3)*5+3,FALSE)&"|"&HLOOKUP(Sheet1!R2C1,Sheet1!R2C1:R16C1,MOD(RC1+3,3)+MOD(INT((RC1+3)/3),3)*5+3,FALSE) -> 164|102|103|104|132 | J420: =HLOOKUP(Sheet1!R2C1,Sheet1!R2C1:R16C1,MOD(RC1-1,3)+MOD(INT((RC1-1)/3),3)*5+3,FALSE)&"|"&HLOOKUP(Sheet1!R2C1,Sheet1!R2C1:R16C1,MOD(RC1,3)+MOD(INT((RC1)/3),3)*5+3,FALSE)&"|"&HLOOKUP(Sheet1!R2C1,Sheet1!R2C1:R16C1,MOD(RC1+1,3)+MOD(INT((RC1+1)/3),3)*5+3,FALSE)&"|"&HLOOKUP(Sheet1!R2C1,Sheet1!R2C1:R16C1,MOD(RC1+2,3)+MOD(INT((RC1+2)/3),3)*5+3,FALSE)&"|"&HLOOKUP(Sheet1!R2C1,Sheet1!R2C1:R16C1,MOD(RC1+3,3)+MOD(INT((RC1+3)/3),3)*5+3,FALSE) -> 164|102|103|104|132 | K420: =HLOOKUP(Sheet1!R2C1,Sheet1!R2C1:R16C1,MOD(RC1-1,3)+MOD(INT((RC1-1)/3),3)*5+3,FALSE)&"|"&HLOOKUP(Sheet1!R2C1,Sheet1!R2C1:R16C1,MOD(RC1,3)+MOD(INT((RC1)/3),3)*5+3,FALSE)&"|"&HLOOKUP(Sheet1!R2C1,Sheet1!R2C1:R16C1,MOD(RC1+1,3)+MOD(INT((RC1+1)/3),3)*5+3,FALSE)&"|"&HLOOKUP(Sheet1!R2C1,Sheet1!R2C1:R16C1,MOD(RC1+2,3)+MOD(INT((RC1+2)/3),3)*5+3,FALSE)&"|"&HLOOKUP(Sheet1!R2C1,Sheet1!R2C1:R16C1,MOD(RC1+3,3)+MOD(INT((RC1+3)/3),3)*5+3,FALSE) -> 164|102|103|104|132 | L420: 25|22|23|24 | M420: 7425508|7425508|7425508|7425508 | N420: 10030|10031|10032|10033 | O420: 1|1|1|1 | P420: 2500|2500|2500|2500
A421: 415 | B421: 413 | C421: 30 | D421: =R[-20]C+2 -> 60 | E421: 1000 | F421: =MOD(RC[-5]-1,3)*30+100&"|"&MOD(RC[-5]-1,3)*30+101&"|"&MOD(RC[-5]-1,3)*30+102&"|"&MOD(RC[-5]-1,3)*30+103&"|"&IF(MOD(RC[-5],4)=0,HLOOKUP(Sheet1!R2C10,Sheet1!R2C10:R7C10,MOD(RC[-5]/4-1,6)+1,FALSE),IF(MOD(RC[-5],2)=0,IF(RC[-5]>20,HLOOKUP(Sheet1!R2C7,Sheet1!R2C7:R43C7,MOD(RC[-5]/2-1,42)+1,FALSE),HLOOKUP(Sheet1!R2C4,Sheet1!R2C4:R7C4,MOD(RC[-5]-1,6)+1,FALSE)),MOD(RC[-5]-1,3)*30+104)) -> 100|101|102|103|104 | G421: =HLOOKUP(Sheet1!R2C1,Sheet1!R2C1:R16C1,MOD(RC1-1,2)+MOD(INT((RC1-1)/2),3)*5+1,FALSE)&"|"&HLOOKUP(Sheet1!R2C1,Sheet1!R2C1:R16C1,MOD(RC1,2)+MOD(INT((RC1)/2),3)*5+1,FALSE)&"|"&HLOOKUP(Sheet1!R2C1,Sheet1!R2C1:R16C1,MOD(RC1+1,2)+MOD(INT((RC1+1)/2),3)*5+1,FALSE)&"|"&HLOOKUP(Sheet1!R2C1,Sheet1!R2C1:R16C1,MOD(RC1+2,2)+MOD(INT((RC1+2)/2),3)*5+1,FALSE)&"|"&HLOOKUP(Sheet1!R2C1,Sheet1!R2C1:R16C1,MOD(RC1+3,2)+MOD(INT((RC1+3)/2),3)*5+1,FALSE) -> 100|101|130|131|160 | H421: =HLOOKUP(Sheet1!R2C1,Sheet1!R2C1:R16C1,MOD(RC1+2,2)+MOD(INT((RC1+2)/2),3)*5+1,FALSE)&"|"&HLOOKUP(Sheet1!R2C1,Sheet1!R2C1:R16C1,MOD(RC1+3,2)+MOD(INT((RC1+3)/2),3)*5+1,FALSE)&"|"&HLOOKUP(Sheet1!R2C1,Sheet1!R2C1:R16C1,MOD(RC1+4,2)+MOD(INT((RC1+4)/2),3)*5+1,FALSE)&"|"&HLOOKUP(Sheet1!R2C1,Sheet1!R2C1:R16C1,MOD(RC1+5,2)+MOD(INT((RC1+5)/2),3)*5+1,FALSE)&"|"&HLOOKUP(Sheet1!R2C1,Sheet1!R2C1:R16C1,MOD(RC1+6,2)+MOD(INT((RC1+6)/2),3)*5+1,FALSE) -> 131|160|161|100|101 | I421: =HLOOKUP(Sheet1!R2C1,Sheet1!R2C1:R16C1,MOD(RC1-1,3)+MOD(INT((RC1-1)/3),3)*5+3,FALSE)&"|"&HLOOKUP(Sheet1!R2C1,Sheet1!R2C1:R16C1,MOD(RC1,3)+MOD(INT((RC1)/3),3)*5+3,FALSE)&"|"&HLOOKUP(Sheet1!R2C1,Sheet1!R2C1:R16C1,MOD(RC1+1,3)+MOD(INT((RC1+1)/3),3)*5+3,FALSE)&"|"&HLOOKUP(Sheet1!R2C1,Sheet1!R2C1:R16C1,MOD(RC1+2,3)+MOD(INT((RC1+2)/3),3)*5+3,FALSE)&"|"&HLOOKUP(Sheet1!R2C1,Sheet1!R2C1:R16C1,MOD(RC1+3,3)+MOD(INT((RC1+3)/3),3)*5+3,FALSE) -> 102|103|104|132|133 | J421: =HLOOKUP(Sheet1!R2C1,Sheet1!R2C1:R16C1,MOD(RC1-1,3)+MOD(INT((RC1-1)/3),3)*5+3,FALSE)&"|"&HLOOKUP(Sheet1!R2C1,Sheet1!R2C1:R16C1,MOD(RC1,3)+MOD(INT((RC1)/3),3)*5+3,FALSE)&"|"&HLOOKUP(Sheet1!R2C1,Sheet1!R2C1:R16C1,MOD(RC1+1,3)+MOD(INT((RC1+1)/3),3)*5+3,FALSE)&"|"&HLOOKUP(Sheet1!R2C1,Sheet1!R2C1:R16C1,MOD(RC1+2,3)+MOD(INT((RC1+2)/3),3)*5+3,FALSE)&"|"&HLOOKUP(Sheet1!R2C1,Sheet1!R2C1:R16C1,MOD(RC1+3,3)+MOD(INT((RC1+3)/3),3)*5+3,FALSE) -> 102|103|104|132|133 | K421: =HLOOKUP(Sheet1!R2C1,Sheet1!R2C1:R16C1,MOD(RC1-1,3)+MOD(INT((RC1-1)/3),3)*5+3,FALSE)&"|"&HLOOKUP(Sheet1!R2C1,Sheet1!R2C1:R16C1,MOD(RC1,3)+MOD(INT((RC1)/3),3)*5+3,FALSE)&"|"&HLOOKUP(Sheet1!R2C1,Sheet1!R2C1:R16C1,MOD(RC1+1,3)+MOD(INT((RC1+1)/3),3)*5+3,FALSE)&"|"&HLOOKUP(Sheet1!R2C1,Sheet1!R2C1:R16C1,MOD(RC1+2,3)+MOD(INT((RC1+2)/3),3)*5+3,FALSE)&"|"&HLOOKUP(Sheet1!R2C1,Sheet1!R2C1:R16C1,MOD(RC1+3,3)+MOD(INT((RC1+3)/3),3)*5+3,FALSE) -> 102|103|104|132|133 | L421: 25|22|23|24 | M421: 7491061|7491061|7491063|7491063 | N421: 10030|10031|10032|10033|10030|10031|10032|10033|10030|10031|10032|10033|10030|10031|10032|10033|10030|10031|10032|10033|10030|10031|10032|10033|10030|10031|10032|10033|10030|10031|10032|10033|10030|10031|10032|10033|10030|10031|10032|10033 | O421: 1|1|1|1|1|1|1|1|1|1|1|1|1|1|1|1|1|1|1|1|1|1|1|1|1|1|1|1|1|1|1|1|1|1|1|1|1|1|1|1 | P421: 2500|2500|2500|2500|2500|2500|2500|2500|2500|2500|2500|2500|2500|2500|2500|2500|2500|2500|2500|2500|2500|2500|2500|2500|2500|2500|2500|2500|2500|2500|2500|2500|2500|2500|2500|2500|2500|2500|2500|2500
A422: 416 | B422: 414 | C422: 30 | D422: =R[-20]C+2 -> 60 | E422: 1000 | F422: =MOD(RC[-5]-1,3)*30+100&"|"&MOD(RC[-5]-1,3)*30+101&"|"&MOD(RC[-5]-1,3)*30+102&"|"&MOD(RC[-5]-1,3)*30+103&"|"&IF(MOD(RC[-5],4)=0,HLOOKUP(Sheet1!R2C10,Sheet1!R2C10:R7C10,MOD(RC[-5]/4-1,6)+1,FALSE),IF(MOD(RC[-5],2)=0,IF(RC[-5]>20,HLOOKUP(Sheet1!R2C7,Sheet1!R2C7:R43C7,MOD(RC[-5]/2-1,42)+1,FALSE),HLOOKUP(Sheet1!R2C4,Sheet1!R2C4:R7C4,MOD(RC[-5]-1,6)+1,FALSE)),MOD(RC[-5]-1,3)*30+104)) -> 130|131|132|133|191 | G422: =HLOOKUP(Sheet1!R2C1,Sheet1!R2C1:R16C1,MOD(RC1-1,2)+MOD(INT((RC1-1)/2),3)*5+1,FALSE)&"|"&HLOOKUP(Sheet1!R2C1,Sheet1!R2C1:R16C1,MOD(RC1,2)+MOD(INT((RC1)/2),3)*5+1,FALSE)&"|"&HLOOKUP(Sheet1!R2C1,Sheet1!R2C1:R16C1,MOD(RC1+1,2)+MOD(INT((RC1+1)/2),3)*5+1,FALSE)&"|"&HLOOKUP(Sheet1!R2C1,Sheet1!R2C1:R16C1,MOD(RC1+2,2)+MOD(INT((RC1+2)/2),3)*5+1,FALSE)&"|"&HLOOKUP(Sheet1!R2C1,Sheet1!R2C1:R16C1,MOD(RC1+3,2)+MOD(INT((RC1+3)/2),3)*5+1,FALSE) -> 101|130|131|160|161 | H422: =HLOOKUP(Sheet1!R2C1,Sheet1!R2C1:R16C1,MOD(RC1+2,2)+MOD(INT((RC1+2)/2),3)*5+1,FALSE)&"|"&HLOOKUP(Sheet1!R2C1,Sheet1!R2C1:R16C1,MOD(RC1+3,2)+MOD(INT((RC1+3)/2),3)*5+1,FALSE)&"|"&HLOOKUP(Sheet1!R2C1,Sheet1!R2C1:R16C1,MOD(RC1+4,2)+MOD(INT((RC1+4)/2),3)*5+1,FALSE)&"|"&HLOOKUP(Sheet1!R2C1,Sheet1!R2C1:R16C1,MOD(RC1+5,2)+MOD(INT((RC1+5)/2),3)*5+1,FALSE)&"|"&HLOOKUP(Sheet1!R2C1,Sheet1!R2C1:R16C1,MOD(RC1+6,2)+MOD(INT((RC1+6)/2),3)*5+1,FALSE) -> 160|161|100|101|130 | I422: =HLOOKUP(Sheet1!R2C1,Sheet1!R2C1:R16C1,MOD(RC1-1,3)+MOD(INT((RC1-1)/3),3)*5+3,FALSE)&"|"&HLOOKUP(Sheet1!R2C1,Sheet1!R2C1:R16C1,MOD(RC1,3)+MOD(INT((RC1)/3),3)*5+3,FALSE)&"|"&HLOOKUP(Sheet1!R2C1,Sheet1!R2C1:R16C1,MOD(RC1+1,3)+MOD(INT((RC1+1)/3),3)*5+3,FALSE)&"|"&HLOOKUP(Sheet1!R2C1,Sheet1!R2C1:R16C1,MOD(RC1+2,3)+MOD(INT((RC1+2)/3),3)*5+3,FALSE)&"|"&HLOOKUP(Sheet1!R2C1,Sheet1!R2C1:R16C1,MOD(RC1+3,3)+MOD(INT((RC1+3)/3),3)*5+3,FALSE) -> 103|104|132|133|134 | J422: =HLOOKUP(Sheet1!R2C1,Sheet1!R2C1:R16C1,MOD(RC1-1,3)+MOD(INT((RC1-1)/3),3)*5+3,FALSE)&"|"&HLOOKUP(Sheet1!R2C1,Sheet1!R2C1:R16C1,MOD(RC1,3)+MOD(INT((RC1)/3),3)*5+3,FALSE)&"|"&HLOOKUP(Sheet1!R2C1,Sheet1!R2C1:R16C1,MOD(RC1+1,3)+MOD(INT((RC1+1)/3),3)*5+3,FALSE)&"|"&HLOOKUP(Sheet1!R2C1,Sheet1!R2C1:R16C1,MOD(RC1+2,3)+MOD(INT((RC1+2)/3),3)*5+3,FALSE)&"|"&HLOOKUP(Sheet1!R2C1,Sheet1!R2C1:R16C1,MOD(RC1+3,3)+MOD(INT((RC1+3)/3),3)*5+3,FALSE) -> 103|104|132|133|134 | K422: =HLOOKUP(Sheet1!R2C1,Sheet1!R2C1:R16C1,MOD(RC1-1,3)+MOD(INT((RC1-1)/3),3)*5+3,FALSE)&"|"&HLOOKUP(Sheet1!R2C1,Sheet1!R2C1:R16C1,MOD(RC1,3)+MOD(INT((RC1)/3),3)*5+3,FALSE)&"|"&HLOOKUP(Sheet1!R2C1,Sheet1!R2C1:R16C1,MOD(RC1+1,3)+MOD(INT((RC1+1)/3),3)*5+3,FALSE)&"|"&HLOOKUP(Sheet1!R2C1,Sheet1!R2C1:R16C1,MOD(RC1+2,3)+MOD(INT((RC1+2)/3),3)*5+3,FALSE)&"|"&HLOOKUP(Sheet1!R2C1,Sheet1!R2C1:R16C1,MOD(RC1+3,3)+MOD(INT((RC1+3)/3),3)*5+3,FALSE) -> 103|104|132|133|134 | L422: 25|22|23|24 | M422: 7556615|7556615|7556615|7556615 | N422: 10030|10031|10032|10033 | O422: 1|1|1|1 | P422: 2500|2500|2500|2500
A423: 417 | B423: 415 | C423: 30 | D423: =R[-20]C+2 -> 60 | E423: 1000 | F423: =MOD(RC[-5]-1,3)*30+100&"|"&MOD(RC[-5]-1,3)*30+101&"|"&MOD(RC[-5]-1,3)*30+102&"|"&MOD(RC[-5]-1,3)*30+103&"|"&IF(MOD(RC[-5],4)=0,HLOOKUP(Sheet1!R2C10,Sheet1!R2C10:R7C10,MOD(RC[-5]/4-1,6)+1,FALSE),IF(MOD(RC[-5],2)=0,IF(RC[-5]>20,HLOOKUP(Sheet1!R2C7,Sheet1!R2C7:R43C7,MOD(RC[-5]/2-1,42)+1,FALSE),HLOOKUP(Sheet1!R2C4,Sheet1!R2C4:R7C4,MOD(RC[-5]-1,6)+1,FALSE)),MOD(RC[-5]-1,3)*30+104)) -> 160|161|162|163|164 | G423: =HLOOKUP(Sheet1!R2C1,Sheet1!R2C1:R16C1,MOD(RC1-1,2)+MOD(INT((RC1-1)/2),3)*5+1,FALSE)&"|"&HLOOKUP(Sheet1!R2C1,Sheet1!R2C1:R16C1,MOD(RC1,2)+MOD(INT((RC1)/2),3)*5+1,FALSE)&"|"&HLOOKUP(Sheet1!R2C1,Sheet1!R2C1:R16C1,MOD(RC1+1,2)+MOD(INT((RC1+1)/2),3)*5+1,FALSE)&"|"&HLOOKUP(Sheet1!R2C1,Sheet1!R2C1:R16C1,MOD(RC1+2,2)+MOD(INT((RC1+2)/2),3)*5+1,FALSE)&"|"&HLOOKUP(Sheet1!R2C1,Sheet1!R2C1:R16C1,MOD(RC1+3,2)+MOD(INT((RC1+3)/2),3)*5+1,FALSE) -> 130|131|160|161|100 | H423: =HLOOKUP(Sheet1!R2C1,Sheet1!R2C1:R16C1,MOD(RC1+2,2)+MOD(INT((RC1+2)/2),3)*5+1,FALSE)&"|"&HLOOKUP(Sheet1!R2C1,Sheet1!R2C1:R16C1,MOD(RC1+3,2)+MOD(INT((RC1+3)/2),3)*5+1,FALSE)&"|"&HLOOKUP(Sheet1!R2C1,Sheet1!R2C1:R16C1,MOD(RC1+4,2)+MOD(INT((RC1+4)/2),3)*5+1,FALSE)&"|"&HLOOKUP(Sheet1!R2C1,Sheet1!R2C1:R16C1,MOD(RC1+5,2)+MOD(INT((RC1+5)/2),3)*5+1,FALSE)&"|"&HLOOKUP(Sheet1!R2C1,Sheet1!R2C1:R16C1,MOD(RC1+6,2)+MOD(INT((RC1+6)/2),3)*5+1,FALSE) -> 161|100|101|130|131 | I423: =HLOOKUP(Sheet1!R2C1,Sheet1!R2C1:R16C1,MOD(RC1-1,3)+MOD(INT((RC1-1)/3),3)*5+3,FALSE)&"|"&HLOOKUP(Sheet1!R2C1,Sheet1!R2C1:R16C1,MOD(RC1,3)+MOD(INT((RC1)/3),3)*5+3,FALSE)&"|"&HLOOKUP(Sheet1!R2C1,Sheet1!R2C1:R16C1,MOD(RC1+1,3)+MOD(INT((RC1+1)/3),3)*5+3,FALSE)&"|"&HLOOKUP(Sheet1!R2C1,Sheet1!R2C1:R16C1,MOD(RC1+2,3)+MOD(INT((RC1+2)/3),3)*5+3,FALSE)&"|"&HLOOKUP(Sheet1!R2C1,Sheet1!R2C1:R16C1,MOD(RC1+3,3)+MOD(INT((RC1+3)/3),3)*5+3,FALSE) -> 104|132|133|134|162 | J423: =HLOOKUP(Sheet1!R2C1,Sheet1!R2C1:R16C1,MOD(RC1-1,3)+MOD(INT((RC1-1)/3),3)*5+3,FALSE)&"|"&HLOOKUP(Sheet1!R2C1,Sheet1!R2C1:R16C1,MOD(RC1,3)+MOD(INT((RC1)/3),3)*5+3,FALSE)&"|"&HLOOKUP(Sheet1!R2C1,Sheet1!R2C1:R16C1,MOD(RC1+1,3)+MOD(INT((RC1+1)/3),3)*5+3,FALSE)&"|"&HLOOKUP(Sheet1!R2C1,Sheet1!R2C1:R16C1,MOD(RC1+2,3)+MOD(INT((RC1+2)/3),3)*5+3,FALSE)&"|"&HLOOKUP(Sheet1!R2C1,Sheet1!R2C1:R16C1,MOD(RC1+3,3)+MOD(INT((RC1+3)/3),3)*5+3,FALSE) -> 104|132|133|134|162 | K423: =HLOOKUP(Sheet1!R2C1,Sheet1!R2C1:R16C1,MOD(RC1-1,3)+MOD(INT((RC1-1)/3),3)*5+3,FALSE)&"|"&HLOOKUP(Sheet1!R2C1,Sheet1!R2C1:R16C1,MOD(RC1,3)+MOD(INT((RC1)/3),3)*5+3,FALSE)&"|"&HLOOKUP(Sheet1!R2C1,Sheet1!R2C1:R16C1,MOD(RC1+1,3)+MOD(INT((RC1+1)/3),3)*5+3,FALSE)&"|"&HLOOKUP(Sheet1!R2C1,Sheet1!R2C1:R16C1,MOD(RC1+2,3)+MOD(INT((RC1+2)/3),3)*5+3,FALSE)&"|"&HLOOKUP(Sheet1!R2C1,Sheet1!R2C1:R16C1,MOD(RC1+3,3)+MOD(INT((RC1+3)/3),3)*5+3,FALSE) -> 104|132|133|134|162 | L423: 25|22|23|24 | M423: 7622169|7622169|7622170|7622170 | N423: 10030|10031|10032|10033 | O423: 1|1|1|1 | P423: 2500|2500|2500|2500
A424: 418 | B424: 416 | C424: 30 | D424: =R[-20]C+2 -> 60 | E424: 1000 | F424: =MOD(RC[-5]-1,3)*30+100&"|"&MOD(RC[-5]-1,3)*30+101&"|"&MOD(RC[-5]-1,3)*30+102&"|"&MOD(RC[-5]-1,3)*30+103&"|"&IF(MOD(RC[-5],4)=0,HLOOKUP(Sheet1!R2C10,Sheet1!R2C10:R7C10,MOD(RC[-5]/4-1,6)+1,FALSE),IF(MOD(RC[-5],2)=0,IF(RC[-5]>20,HLOOKUP(Sheet1!R2C7,Sheet1!R2C7:R43C7,MOD(RC[-5]/2-1,42)+1,FALSE),HLOOKUP(Sheet1!R2C4,Sheet1!R2C4:R7C4,MOD(RC[-5]-1,6)+1,FALSE)),MOD(RC[-5]-1,3)*30+104)) -> 100|101|102|103|184 | G424: =HLOOKUP(Sheet1!R2C1,Sheet1!R2C1:R16C1,MOD(RC1-1,2)+MOD(INT((RC1-1)/2),3)*5+1,FALSE)&"|"&HLOOKUP(Sheet1!R2C1,Sheet1!R2C1:R16C1,MOD(RC1,2)+MOD(INT((RC1)/2),3)*5+1,FALSE)&"|"&HLOOKUP(Sheet1!R2C1,Sheet1!R2C1:R16C1,MOD(RC1+1,2)+MOD(INT((RC1+1)/2),3)*5+1,FALSE)&"|"&HLOOKUP(Sheet1!R2C1,Sheet1!R2C1:R16C1,MOD(RC1+2,2)+MOD(INT((RC1+2)/2),3)*5+1,FALSE)&"|"&HLOOKUP(Sheet1!R2C1,Sheet1!R2C1:R16C1,MOD(RC1+3,2)+MOD(INT((RC1+3)/2),3)*5+1,FALSE) -> 131|160|161|100|101 | H424: =HLOOKUP(Sheet1!R2C1,Sheet1!R2C1:R16C1,MOD(RC1+2,2)+MOD(INT((RC1+2)/2),3)*5+1,FALSE)&"|"&HLOOKUP(Sheet1!R2C1,Sheet1!R2C1:R16C1,MOD(RC1+3,2)+MOD(INT((RC1+3)/2),3)*5+1,FALSE)&"|"&HLOOKUP(Sheet1!R2C1,Sheet1!R2C1:R16C1,MOD(RC1+4,2)+MOD(INT((RC1+4)/2),3)*5+1,FALSE)&"|"&HLOOKUP(Sheet1!R2C1,Sheet1!R2C1:R16C1,MOD(RC1+5,2)+MOD(INT((RC1+5)/2),3)*5+1,FALSE)&"|"&HLOOKUP(Sheet1!R2C1,Sheet1!R2C1:R16C1,MOD(RC1+6,2)+MOD(INT((RC1+6)/2),3)*5+1,FALSE) -> 100|101|130|131|160 | I424: =HLOOKUP(Sheet1!R2C1,Sheet1!R2C1:R16C1,MOD(RC1-1,3)+MOD(INT((RC1-1)/3),3)*5+3,FALSE)&"|"&HLOOKUP(Sheet1!R2C1,Sheet1!R2C1:R16C1,MOD(RC1,3)+MOD(INT((RC1)/3),3)*5+3,FALSE)&"|"&HLOOKUP(Sheet1!R2C1,Sheet1!R2C1:R16C1,MOD(RC1+1,3)+MOD(INT((RC1+1)/3),3)*5+3,FALSE)&"|"&HLOOKUP(Sheet1!R2C1,Sheet1!R2C1:R16C1,MOD(RC1+2,3)+MOD(INT((RC1+2)/3),3)*5+3,FALSE)&"|"&HLOOKUP(Sheet1!R2C1,Sheet1!R2C1:R16C1,MOD(RC1+3,3)+MOD(INT((RC1+3)/3),3)*5+3,FALSE) -> 132|133|134|162|163 | J424: =HLOOKUP(Sheet1!R2C1,Sheet1!R2C1:R16C1,MOD(RC1-1,3)+MOD(INT((RC1-1)/3),3)*5+3,FALSE)&"|"&HLOOKUP(Sheet1!R2C1,Sheet1!R2C1:R16C1,MOD(RC1,3)+MOD(INT((RC1)/3),3)*5+3,FALSE)&"|"&HLOOKUP(Sheet1!R2C1,Sheet1!R2C1:R16C1,MOD(RC1+1,3)+MOD(INT((RC1+1)/3),3)*5+3,FALSE)&"|"&HLOOKUP(Sheet1!R2C1,Sheet1!R2C1:R16C1,MOD(RC1+2,3)+MOD(INT((RC1+2)/3),3)*5+3,FALSE)&"|"&HLOOKUP(Sheet1!R2C1,Sheet1!R2C1:R16C1,MOD(RC1+3,3)+MOD(INT((RC1+3)/3),3)*5+3,FALSE) -> 132|133|134|162|163 | K424: =HLOOKUP(Sheet1!R2C1,Sheet1!R2C1:R16C1,MOD(RC1-1,3)+MOD(INT((RC1-1)/3),3)*5+3,FALSE)&"|"&HLOOKUP(Sheet1!R2C1,Sheet1!R2C1:R16C1,MOD(RC1,3)+MOD(INT((RC1)/3),3)*5+3,FALSE)&"|"&HLOOKUP(Sheet1!R2C1,Sheet1!R2C1:R16C1,MOD(RC1+1,3)+MOD(INT((RC1+1)/3),3)*5+3,FALSE)&"|"&HLOOKUP(Sheet1!R2C1,Sheet1!R2C1:R16C1,MOD(RC1+2,3)+MOD(INT((RC1+2)/3),3)*5+3,FALSE)&"|"&HLOOKUP(Sheet1!R2C1,Sheet1!R2C1:R16C1,MOD(RC1+3,3)+MOD(INT((RC1+3)/3),3)*5+3,FALSE) -> 132|133|134|162|163 | L424: 25|22|23|24 | M424: 7687824|7687824|7687825|7687825 | N424: 10030|10031|10032|10033 | O424: 1|1|1|1 | P424: 2500|2500|2500|2500
A425: 419 | B425: 417 | C425: 30 | D425: =R[-20]C+2 -> 60 | E425: 1000 | F425: =MOD(RC[-5]-1,3)*30+100&"|"&MOD(RC[-5]-1,3)*30+101&"|"&MOD(RC[-5]-1,3)*30+102&"|"&MOD(RC[-5]-1,3)*30+103&"|"&IF(MOD(RC[-5],4)=0,HLOOKUP(Sheet1!R2C10,Sheet1!R2C10:R7C10,MOD(RC[-5]/4-1,6)+1,FALSE),IF(MOD(RC[-5],2)=0,IF(RC[-5]>20,HLOOKUP(Sheet1!R2C7,Sheet1!R2C7:R43C7,MOD(RC[-5]/2-1,42)+1,FALSE),HLOOKUP(Sheet1!R2C4,Sheet1!R2C4:R7C4,MOD(RC[-5]-1,6)+1,FALSE)),MOD(RC[-5]-1,3)*30+104)) -> 130|131|132|133|134 | G425: =HLOOKUP(Sheet1!R2C1,Sheet1!R2C1:R16C1,MOD(RC1-1,2)+MOD(INT((RC1-1)/2),3)*5+1,FALSE)&"|"&HLOOKUP(Sheet1!R2C1,Sheet1!R2C1:R16C1,MOD(RC1,2)+MOD(INT((RC1)/2),3)*5+1,FALSE)&"|"&HLOOKUP(Sheet1!R2C1,Sheet1!R2C1:R16C1,MOD(RC1+1,2)+MOD(INT((RC1+1)/2),3)*5+1,FALSE)&"|"&HLOOKUP(Sheet1!R2C1,Sheet1!R2C1:R16C1,MOD(RC1+2,2)+MOD(INT((RC1+2)/2),3)*5+1,FALSE)&"|"&HLOOKUP(Sheet1!R2C1,Sheet1!R2C1:R16C1,MOD(RC1+3,2)+MOD(INT((RC1+3)/2),3)*5+1,FALSE) -> 160|161|100|101|130 | H425: =HLOOKUP(Sheet1!R2C1,Sheet1!R2C1:R16C1,MOD(RC1+2,2)+MOD(INT((RC1+2)/2),3)*5+1,FALSE)&"|"&HLOOKUP(Sheet1!R2C1,Sheet1!R2C1:R16C1,MOD(RC1+3,2)+MOD(INT((RC1+3)/2),3)*5+1,FALSE)&"|"&HLOOKUP(Sheet1!R2C1,Sheet1!R2C1:R16C1,MOD(RC1+4,2)+MOD(INT((RC1+4)/2),3)*5+1,FALSE)&"|"&HLOOKUP(Sheet1!R2C1,Sheet1!R2C1:R16C1,MOD(RC1+5,2)+MOD(INT((RC1+5)/2),3)*5+1,FALSE)&"|"&HLOOKUP(Sheet1!R2C1,Sheet1!R2C1:R16C1,MOD(RC1+6,2)+MOD(INT((RC1+6)/2),3)*5+1,FALSE) -> 101|130|131|160|161 | I425: =HLOOKUP(Sheet1!R2C1,Sheet1!R2C1:R16C1,MOD(RC1-1,3)+MOD(INT((RC1-1)/3),3)*5+3,FALSE)&"|"&HLOOKUP(Sheet1!R2C1,Sheet1!R2C1:R16C1,MOD(RC1,3)+MOD(INT((RC1)/3),3)*5+3,FALSE)&"|"&HLOOKUP(Sheet1!R2C1,Sheet1!R2C1:R16C1,MOD(RC1+1,3)+MOD(INT((RC1+1)/3),3)*5+3,FALSE)&"|"&HLOOKUP(Sheet1!R2C1,Sheet1!R2C1:R16C1,MOD(RC1+2,3)+MOD(INT((RC1+2)/3),3)*5+3,FALSE)&"|"&HLOOKUP(Sheet1!R2C1,Sheet1!R2C1:R16C1,MOD(RC1+3,3)+MOD(INT((RC1+3)/3),3)*5+3,FALSE) -> 133|134|162|163|164 | J425: =HLOOKUP(Sheet1!R2C1,Sheet1!R2C1:R16C1,MOD(RC1-1,3)+MOD(INT((RC1-1)/3),3)*5+3,FALSE)&"|"&HLOOKUP(Sheet1!R2C1,Sheet1!R2C1:R16C1,MOD(RC1,3)+MOD(INT((RC1)/3),3)*5+3,FALSE)&"|"&HLOOKUP(Sheet1!R2C1,Sheet1!R2C1:R16C1,MOD(RC1+1,3)+MOD(INT((RC1+1)/3),3)*5+3,FALSE)&"|"&HLOOKUP(Sheet1!R2C1,Sheet1!R2C1:R16C1,MOD(RC1+2,3)+MOD(INT((RC1+2)/3),3)*5+3,FALSE)&"|"&HLOOKUP(Sheet1!R2C1,Sheet1!R2C1:R16C1,MOD(RC1+3,3)+MOD(INT((RC1+3)/3),3)*5+3,FALSE) -> 133|134|162|163|164 | K425: =HLOOKUP(Sheet1!R2C1,Sheet1!R2C1:R16C1,MOD(RC1-1,3)+MOD(INT((RC1-1)/3),3)*5+3,FALSE)&"|"&HLOOKUP(Sheet1!R2C1,Sheet1!R2C1:R16C1,MOD(RC1,3)+MOD(INT((RC1)/3),3)*5+3,FALSE)&"|"&HLOOKUP(Sheet1!R2C1,Sheet1!R2C1:R16C1,MOD(RC1+1,3)+MOD(INT((RC1+1)/3),3)*5+3,FALSE)&"|"&HLOOKUP(Sheet1!R2C1,Sheet1!R2C1:R16C1,MOD(RC1+2,3)+MOD(INT((RC1+2)/3),3)*5+3,FALSE)&"|"&HLOOKUP(Sheet1!R2C1,Sheet1!R2C1:R16C1,MOD(RC1+3,3)+MOD(INT((RC1+3)/3),3)*5+3,FALSE) -> 133|134|162|163|164 | L425: 25|22|23|24 | M425: 7755790|7755790|7755790|7755790 | N425: 10030|10031|10032|10033 | O425: 1|1|1|1 | P425: 2500|2500|2500|2500
A426: 420 | B426: 418 | C426: 30 | D426: =R[-20]C+2 -> 60 | E426: 1000 | F426: =MOD(RC[-5]-1,3)*30+100&"|"&MOD(RC[-5]-1,3)*30+101&"|"&MOD(RC[-5]-1,3)*30+102&"|"&MOD(RC[-5]-1,3)*30+103&"|"&IF(MOD(RC[-5],4)=0,HLOOKUP(Sheet1!R2C10,Sheet1!R2C10:R7C10,MOD(RC[-5]/4-1,6)+1,FALSE),IF(MOD(RC[-5],2)=0,IF(RC[-5]>20,HLOOKUP(Sheet1!R2C7,Sheet1!R2C7:R43C7,MOD(RC[-5]/2-1,42)+1,FALSE),HLOOKUP(Sheet1!R2C4,Sheet1!R2C4:R7C4,MOD(RC[-5]-1,6)+1,FALSE)),MOD(RC[-5]-1,3)*30+104)) -> 160|161|162|163|192 | G426: =HLOOKUP(Sheet1!R2C1,Sheet1!R2C1:R16C1,MOD(RC1-1,2)+MOD(INT((RC1-1)/2),3)*5+1,FALSE)&"|"&HLOOKUP(Sheet1!R2C1,Sheet1!R2C1:R16C1,MOD(RC1,2)+MOD(INT((RC1)/2),3)*5+1,FALSE)&"|"&HLOOKUP(Sheet1!R2C1,Sheet1!R2C1:R16C1,MOD(RC1+1,2)+MOD(INT((RC1+1)/2),3)*5+1,FALSE)&"|"&HLOOKUP(Sheet1!R2C1,Sheet1!R2C1:R16C1,MOD(RC1+2,2)+MOD(INT((RC1+2)/2),3)*5+1,FALSE)&"|"&HLOOKUP(Sheet1!R2C1,Sheet1!R2C1:R16C1,MOD(RC1+3,2)+MOD(INT((RC1+3)/2),3)*5+1,FALSE) -> 161|100|101|130|131 | H426: =HLOOKUP(Sheet1!R2C1,Sheet1!R2C1:R16C1,MOD(RC1+2,2)+MOD(INT((RC1+2)/2),3)*5+1,FALSE)&"|"&HLOOKUP(Sheet1!R2C1,Sheet1!R2C1:R16C1,MOD(RC1+3,2)+MOD(INT((RC1+3)/2),3)*5+1,FALSE)&"|"&HLOOKUP(Sheet1!R2C1,Sheet1!R2C1:R16C1,MOD(RC1+4,2)+MOD(INT((RC1+4)/2),3)*5+1,FALSE)&"|"&HLOOKUP(Sheet1!R2C1,Sheet1!R2C1:R16C1,MOD(RC1+5,2)+MOD(INT((RC1+5)/2),3)*5+1,FALSE)&"|"&HLOOKUP(Sheet1!R2C1,Sheet1!R2C1:R16C1,MOD(RC1+6,2)+MOD(INT((RC1+6)/2),3)*5+1,FALSE) -> 130|131|160|161|100 | I426: =HLOOKUP(Sheet1!R2C1,Sheet1!R2C1:R16C1,MOD(RC1-1,3)+MOD(INT((RC1-1)/3),3)*5+3,FALSE)&"|"&HLOOKUP(Sheet1!R2C1,Sheet1!R2C1:R16C1,MOD(RC1,3)+MOD(INT((RC1)/3),3)*5+3,FALSE)&"|"&HLOOKUP(Sheet1!R2C1,Sheet1!R2C1:R16C1,MOD(RC1+1,3)+MOD(INT((RC1+1)/3),3)*5+3,FALSE)&"|"&HLOOKUP(Sheet1!R2C1,Sheet1!R2C1:R16C1,MOD(RC1+2,3)+MOD(INT((RC1+2)/3),3)*5+3,FALSE)&"|"&HLOOKUP(Sheet1!R2C1,Sheet1!R2C1:R16C1,MOD(RC1+3,3)+MOD(INT((RC1+3)/3),3)*5+3,FALSE) -> 134|162|163|164|102 | J426: =HLOOKUP(Sheet1!R2C1,Sheet1!R2C1:R16C1,MOD(RC1-1,3)+MOD(INT((RC1-1)/3),3)*5+3,FALSE)&"|"&HLOOKUP(Sheet1!R2C1,Sheet1!R2C1:R16C1,MOD(RC1,3)+MOD(INT((RC1)/3),3)*5+3,FALSE)&"|"&HLOOKUP(Sheet1!R2C1,Sheet1!R2C1:R16C1,MOD(RC1+1,3)+MOD(INT((RC1+1)/3),3)*5+3,FALSE)&"|"&HLOOKUP(Sheet1!R2C1,Sheet1!R2C1:R16C1,MOD(RC1+2,3)+MOD(INT((RC1+2)/3),3)*5+3,FALSE)&"|"&HLOOKUP(Sheet1!R2C1,Sheet1!R2C1:R16C1,MOD(RC1+3,3)+MOD(INT((RC1+3)/3),3)*5+3,FALSE) -> 134|162|163|164|102 | K426: =HLOOKUP(Sheet1!R2C1,Sheet1!R2C1:R16C1,MOD(RC1-1,3)+MOD(INT((RC1-1)/3),3)*5+3,FALSE)&"|"&HLOOKUP(Sheet1!R2C1,Sheet1!R2C1:R16C1,MOD(RC1,3)+MOD(INT((RC1)/3),3)*5+3,FALSE)&"|"&HLOOKUP(Sheet1!R2C1,Sheet1!R2C1:R16C1,MOD(RC1+1,3)+MOD(INT((RC1+1)/3),3)*5+3,FALSE)&"|"&HLOOKUP(Sheet1!R2C1,Sheet1!R2C1:R16C1,MOD(RC1+2,3)+MOD(INT((RC1+2)/3),3)*5+3,FALSE)&"|"&HLOOKUP(Sheet1!R2C1,Sheet1!R2C1:R16C1,MOD(RC1+3,3)+MOD(INT((RC1+3)/3),3)*5+3,FALSE) -> 134|162|163|164|102 | L426: 25|22|23|24 | M426: 7823757|7823756|7823758|7823758 | N426: 10030|10031|10032|10033|10030|10031|10032|10033|10030|10031|10032|10033|10030|10031|10032|10033|10030|10031|10032|10033|10030|10031|10032|10033|10030|10031|10032|10033|10030|10031|10032|10033|10030|10031|10032|10033|10030|10031|10032|10033 | O426: 1|1|1|1|1|1|1|1|1|1|1|1|1|1|1|1|1|1|1|1|1|1|1|1|1|1|1|1|1|1|1|1|1|1|1|1|1|1|1|1 | P426: 2500|2500|2500|2500|2500|2500|2500|2500|2500|2500|2500|2500|2500|2500|2500|2500|2500|2500|2500|2500|2500|2500|2500|2500|2500|2500|2500|2500|2500|2500|2500|2500|2500|2500|2500|2500|2500|2500|2500|2500
A427: 421 | B427: 419 | C427: 30 | D427: =R[-20]C+2 -> 62 | E427: 1000 | F427: =MOD(RC[-5]-1,3)*30+100&"|"&MOD(RC[-5]-1,3)*30+101&"|"&MOD(RC[-5]-1,3)*30+102&"|"&MOD(RC[-5]-1,3)*30+103&"|"&IF(MOD(RC[-5],4)=0,HLOOKUP(Sheet1!R2C10,Sheet1!R2C10:R7C10,MOD(RC[-5]/4-1,6)+1,FALSE),IF(MOD(RC[-5],2)=0,IF(RC[-5]>20,HLOOKUP(Sheet1!R2C7,Sheet1!R2C7:R43C7,MOD(RC[-5]/2-1,42)+1,FALSE),HLOOKUP(Sheet1!R2C4,Sheet1!R2C4:R7C4,MOD(RC[-5]-1,6)+1,FALSE)),MOD(RC[-5]-1,3)*30+104)) -> 100|101|102|103|104 | G427: =HLOOKUP(Sheet1!R2C1,Sheet1!R2C1:R16C1,MOD(RC1-1,2)+MOD(INT((RC1-1)/2),3)*5+1,FALSE)&"|"&HLOOKUP(Sheet1!R2C1,Sheet1!R2C1:R16C1,MOD(RC1,2)+MOD(INT((RC1)/2),3)*5+1,FALSE)&"|"&HLOOKUP(Sheet1!R2C1,Sheet1!R2C1:R16C1,MOD(RC1+1,2)+MOD(INT((RC1+1)/2),3)*5+1,FALSE)&"|"&HLOOKUP(Sheet1!R2C1,Sheet1!R2C1:R16C1,MOD(RC1+2,2)+MOD(INT((RC1+2)/2),3)*5+1,FALSE)&"|"&HLOOKUP(Sheet1!R2C1,Sheet1!R2C1:R16C1,MOD(RC1+3,2)+MOD(INT((RC1+3)/2),3)*5+1,FALSE) -> 100|101|130|131|160 | H427: =HLOOKUP(Sheet1!R2C1,Sheet1!R2C1:R16C1,MOD(RC1+2,2)+MOD(INT((RC1+2)/2),3)*5+1,FALSE)&"|"&HLOOKUP(Sheet1!R2C1,Sheet1!R2C1:R16C1,MOD(RC1+3,2)+MOD(INT((RC1+3)/2),3)*5+1,FALSE)&"|"&HLOOKUP(Sheet1!R2C1,Sheet1!R2C1:R16C1,MOD(RC1+4,2)+MOD(INT((RC1+4)/2),3)*5+1,FALSE)&"|"&HLOOKUP(Sheet1!R2C1,Sheet1!R2C1:R16C1,MOD(RC1+5,2)+MOD(INT((RC1+5)/2),3)*5+1,FALSE)&"|"&HLOOKUP(Sheet1!R2C1,Sheet1!R2C1:R16C1,MOD(RC1+6,2)+MOD(INT((RC1+6)/2),3)*5+1,FALSE) -> 131|160|161|100|101 | I427: =HLOOKUP(Sheet1!R2C1,Sheet1!R2C1:R16C1,MOD(RC1-1,3)+MOD(INT((RC1-1)/3),3)*5+3,FALSE)&"|"&HLOOKUP(Sheet1!R2C1,Sheet1!R2C1:R16C1,MOD(RC1,3)+MOD(INT((RC1)/3),3)*5+3,FALSE)&"|"&HLOOKUP(Sheet1!R2C1,Sheet1!R2C1:R16C1,MOD(RC1+1,3)+MOD(INT((RC1+1)/3),3)*5+3,FALSE)&"|"&HLOOKUP(Sheet1!R2C1,Sheet1!R2C1:R16C1,MOD(RC1+2,3)+MOD(INT((RC1+2)/3),3)*5+3,FALSE)&"|"&HLOOKUP(Sheet1!R2C1,Sheet1!R2C1:R16C1,MOD(RC1+3,3)+MOD(INT((RC1+3)/3),3)*5+3,FALSE) -> 162|163|164|102|103 | J427: =HLOOKUP(Sheet1!R2C1,Sheet1!R2C1:R16C1,MOD(RC1-1,3)+MOD(INT((RC1-1)/3),3)*5+3,FALSE)&"|"&HLOOKUP(Sheet1!R2C1,Sheet1!R2C1:R16C1,MOD(RC1,3)+MOD(INT((RC1)/3),3)*5+3,FALSE)&"|"&HLOOKUP(Sheet1!R2C1,Sheet1!R2C1:R16C1,MOD(RC1+1,3)+MOD(INT((RC1+1)/3),3)*5+3,FALSE)&"|"&HLOOKUP(Sheet1!R2C1,Sheet1!R2C1:R16C1,MOD(RC1+2,3)+MOD(INT((RC1+2)/3),3)*5+3,FALSE)&"|"&HLOOKUP(Sheet1!R2C1,Sheet1!R2C1:R16C1,MOD(RC1+3,3)+MOD(INT((RC1+3)/3),3)*5+3,FALSE) -> 162|163|164|102|103 | K427: =HLOOKUP(Sheet1!R2C1,Sheet1!R2C1:R16C1,MOD(RC1-1,3)+MOD(INT((RC1-1)/3),3)*5+3,FALSE)&"|"&HLOOKUP(Sheet1!R2C1,Sheet1!R2C1:R16C1,MOD(RC1,3)+MOD(INT((RC1)/3),3)*5+3,FALSE)&"|"&HLOOKUP(Sheet1!R2C1,Sheet1!R2C1:R16C1,MOD(RC1+1,3)+MOD(INT((RC1+1)/3),3)*5+3,FALSE)&"|"&HLOOKUP(Sheet1!R2C1,Sheet1!R2C1:R16C1,MOD(RC1+2,3)+MOD(INT((RC1+2)/3),3)*5+3,FALSE)&"|"&HLOOKUP(Sheet1!R2C1,Sheet1!R2C1:R16C1,MOD(RC1+3,3)+MOD(INT((RC1+3)/3),3)*5+3,FALSE) -> 162|163|164|102|103 | L427: 25|22|23|24 | M427: 7891723|7891724|7891723|7891723 | N427: 10030|10031|10032|10033 | O427: 1|1|1|1 | P427: 2500|2500|2500|2500
A428: 422 | B428: 420 | C428: 30 | D428: =R[-20]C+2 -> 62 | E428: 1000 | F428: =MOD(RC[-5]-1,3)*30+100&"|"&MOD(RC[-5]-1,3)*30+101&"|"&MOD(RC[-5]-1,3)*30+102&"|"&MOD(RC[-5]-1,3)*30+103&"|"&IF(MOD(RC[-5],4)=0,HLOOKUP(Sheet1!R2C10,Sheet1!R2C10:R7C10,MOD(RC[-5]/4-1,6)+1,FALSE),IF(MOD(RC[-5],2)=0,IF(RC[-5]>20,HLOOKUP(Sheet1!R2C7,Sheet1!R2C7:R43C7,MOD(RC[-5]/2-1,42)+1,FALSE),HLOOKUP(Sheet1!R2C4,Sheet1!R2C4:R7C4,MOD(RC[-5]-1,6)+1,FALSE)),MOD(RC[-5]-1,3)*30+104)) -> 130|131|132|133|112 | G428: =HLOOKUP(Sheet1!R2C1,Sheet1!R2C1:R16C1,MOD(RC1-1,2)+MOD(INT((RC1-1)/2),3)*5+1,FALSE)&"|"&HLOOKUP(Sheet1!R2C1,Sheet1!R2C1:R16C1,MOD(RC1,2)+MOD(INT((RC1)/2),3)*5+1,FALSE)&"|"&HLOOKUP(Sheet1!R2C1,Sheet1!R2C1:R16C1,MOD(RC1+1,2)+MOD(INT((RC1+1)/2),3)*5+1,FALSE)&"|"&HLOOKUP(Sheet1!R2C1,Sheet1!R2C1:R16C1,MOD(RC1+2,2)+MOD(INT((RC1+2)/2),3)*5+1,FALSE)&"|"&HLOOKUP(Sheet1!R2C1,Sheet1!R2C1:R16C1,MOD(RC1+3,2)+MOD(INT((RC1+3)/2),3)*5+1,FALSE) -> 101|130|131|160|161 | H428: =HLOOKUP(Sheet1!R2C1,Sheet1!R2C1:R16C1,MOD(RC1+2,2)+MOD(INT((RC1+2)/2),3)*5+1,FALSE)&"|"&HLOOKUP(Sheet1!R2C1,Sheet1!R2C1:R16C1,MOD(RC1+3,2)+MOD(INT((RC1+3)/2),3)*5+1,FALSE)&"|"&HLOOKUP(Sheet1!R2C1,Sheet1!R2C1:R16C1,MOD(RC1+4,2)+MOD(INT((RC1+4)/2),3)*5+1,FALSE)&"|"&HLOOKUP(Sheet1!R2C1,Sheet1!R2C1:R16C1,MOD(RC1+5,2)+MOD(INT((RC1+5)/2),3)*5+1,FALSE)&"|"&HLOOKUP(Sheet1!R2C1,Sheet1!R2C1:R16C1,MOD(RC1+6,2)+MOD(INT((RC1+6)/2),3)*5+1,FALSE) -> 160|161|100|101|130 | I428: =HLOOKUP(Sheet1!R2C1,Sheet1!R2C1:R16C1,MOD(RC1-1,3)+MOD(INT((RC1-1)/3),3)*5+3,FALSE)&"|"&HLOOKUP(Sheet1!R2C1,Sheet1!R2C1:R16C1,MOD(RC1,3)+MOD(INT((RC1)/3),3)*5+3,FALSE)&"|"&HLOOKUP(Sheet1!R2C1,Sheet1!R2C1:R16C1,MOD(RC1+1,3)+MOD(INT((RC1+1)/3),3)*5+3,FALSE)&"|"&HLOOKUP(Sheet1!R2C1,Sheet1!R2C1:R16C1,MOD(RC1+2,3)+MOD(INT((RC1+2)/3),3)*5+3,FALSE)&"|"&HLOOKUP(Sheet1!R2C1,Sheet1!R2C1:R16C1,MOD(RC1+3,3)+MOD(INT((RC1+3)/3),3)*5+3,FALSE) -> 163|164|102|103|104 | J428: =HLOOKUP(Sheet1!R2C1,Sheet1!R2C1:R16C1,MOD(RC1-1,3)+MOD(INT((RC1-1)/3),3)*5+3,FALSE)&"|"&HLOOKUP(Sheet1!R2C1,Sheet1!R2C1:R16C1,MOD(RC1,3)+MOD(INT((RC1)/3),3)*5+3,FALSE)&"|"&HLOOKUP(Sheet1!R2C1,Sheet1!R2C1:R16C1,MOD(RC1+1,3)+MOD(INT((RC1+1)/3),3)*5+3,FALSE)&"|"&HLOOKUP(Sheet1!R2C1,Sheet1!R2C1:R16C1,MOD(RC1+2,3)+MOD(INT((RC1+2)/3),3)*5+3,FALSE)&"|"&HLOOKUP(Sheet1!R2C1,Sheet1!R2C1:R16C1,MOD(RC1+3,3)+MOD(INT((RC1+3)/3),3)*5+3,FALSE) -> 163|164|102|103|104 | K428: =HLOOKUP(Sheet1!R2C1,Sheet1!R2C1:R16C1,MOD(RC1-1,3)+MOD(INT((RC1-1)/3),3)*5+3,FALSE)&"|"&HLOOKUP(Sheet1!R2C1,Sheet1!R2C1:R16C1,MOD(RC1,3)+MOD(INT((RC1)/3),3)*5+3,FALSE)&"|"&HLOOKUP(Sheet1!R2C1,Sheet1!R2C1:R16C1,MOD(RC1+1,3)+MOD(INT((RC1+1)/3),3)*5+3,FALSE)&"|"&HLOOKUP(Sheet1!R2C1,Sheet1!R2C1:R16C1,MOD(RC1+2,3)+MOD(INT((RC1+2)/3),3)*5+3,FALSE)&"|"&HLOOKUP(Sheet1!R2C1,Sheet1!R2C1:R16C1,MOD(RC1+3,3)+MOD(INT((RC1+3)/3),3)*5+3,FALSE) -> 163|164|102|103|104 | L428: 25|22|23|24 | M428: 7959690|7959690|7959690|7959690 | N428: 10030|10031|10032|10033 | O428: 1|1|1|1 | P428: 2500|2500|2500|2500
A429: 423 | B429: 421 | C429: 30 | D429: =R[-20]C+2 -> 62 | E429: 1000 | F429: =MOD(RC[-5]-1,3)*30+100&"|"&MOD(RC[-5]-1,3)*30+101&"|"&MOD(RC[-5]-1,3)*30+102&"|"&MOD(RC[-5]-1,3)*30+103&"|"&IF(MOD(RC[-5],4)=0,HLOOKUP(Sheet1!R2C10,Sheet1!R2C10:R7C10,MOD(RC[-5]/4-1,6)+1,FALSE),IF(MOD(RC[-5],2)=0,IF(RC[-5]>20,HLOOKUP(Sheet1!R2C7,Sheet1!R2C7:R43C7,MOD(RC[-5]/2-1,42)+1,FALSE),HLOOKUP(Sheet1!R2C4,Sheet1!R2C4:R7C4,MOD(RC[-5]-1,6)+1,FALSE)),MOD(RC[-5]-1,3)*30+104)) -> 160|161|162|163|164 | G429: =HLOOKUP(Sheet1!R2C1,Sheet1!R2C1:R16C1,MOD(RC1-1,2)+MOD(INT((RC1-1)/2),3)*5+1,FALSE)&"|"&HLOOKUP(Sheet1!R2C1,Sheet1!R2C1:R16C1,MOD(RC1,2)+MOD(INT((RC1)/2),3)*5+1,FALSE)&"|"&HLOOKUP(Sheet1!R2C1,Sheet1!R2C1:R16C1,MOD(RC1+1,2)+MOD(INT((RC1+1)/2),3)*5+1,FALSE)&"|"&HLOOKUP(Sheet1!R2C1,Sheet1!R2C1:R16C1,MOD(RC1+2,2)+MOD(INT((RC1+2)/2),3)*5+1,FALSE)&"|"&HLOOKUP(Sheet1!R2C1,Sheet1!R2C1:R16C1,MOD(RC1+3,2)+MOD(INT((RC1+3)/2),3)*5+1,FALSE) -> 130|131|160|161|100 | H429: =HLOOKUP(Sheet1!R2C1,Sheet1!R2C1:R16C1,MOD(RC1+2,2)+MOD(INT((RC1+2)/2),3)*5+1,FALSE)&"|"&HLOOKUP(Sheet1!R2C1,Sheet1!R2C1:R16C1,MOD(RC1+3,2)+MOD(INT((RC1+3)/2),3)*5+1,FALSE)&"|"&HLOOKUP(Sheet1!R2C1,Sheet1!R2C1:R16C1,MOD(RC1+4,2)+MOD(INT((RC1+4)/2),3)*5+1,FALSE)&"|"&HLOOKUP(Sheet1!R2C1,Sheet1!R2C1:R16C1,MOD(RC1+5,2)+MOD(INT((RC1+5)/2),3)*5+1,FALSE)&"|"&HLOOKUP(Sheet1!R2C1,Sheet1!R2C1:R16C1,MOD(RC1+6,2)+MOD(INT((RC1+6)/2),3)*5+1,FALSE) -> 161|100|101|130|131 | I429: =HLOOKUP(Sheet1!R2C1,Sheet1!R2C1:R16C1,MOD(RC1-1,3)+MOD(INT((RC1-1)/3),3)*5+3,FALSE)&"|"&HLOOKUP(Sheet1!R2C1,Sheet1!R2C1:R16C1,MOD(RC1,3)+MOD(INT((RC1)/3),3)*5+3,FALSE)&"|"&HLOOKUP(Sheet1!R2C1,Sheet1!R2C1:R16C1,MOD(RC1+1,3)+MOD(INT((RC1+1)/3),3)*5+3,FALSE)&"|"&HLOOKUP(Sheet1!R2C1,Sheet1!R2C1:R16C1,MOD(RC1+2,3)+MOD(INT((RC1+2)/3),3)*5+3,FALSE)&"|"&HLOOKUP(Sheet1!R2C1,Sheet1!R2C1:R16C1,MOD(RC1+3,3)+MOD(INT((RC1+3)/3),3)*5+3,FALSE) -> 164|102|103|104|132 | J429: =HLOOKUP(Sheet1!R2C1,Sheet1!R2C1:R16C1,MOD(RC1-1,3)+MOD(INT((RC1-1)/3),3)*5+3,FALSE)&"|"&HLOOKUP(Sheet1!R2C1,Sheet1!R2C1:R16C1,MOD(RC1,3)+MOD(INT((RC1)/3),3)*5+3,FALSE)&"|"&HLOOKUP(Sheet1!R2C1,Sheet1!R2C1:R16C1,MOD(RC1+1,3)+MOD(INT((RC1+1)/3),3)*5+3,FALSE)&"|"&HLOOKUP(Sheet1!R2C1,Sheet1!R2C1:R16C1,MOD(RC1+2,3)+MOD(INT((RC1+2)/3),3)*5+3,FALSE)&"|"&HLOOKUP(Sheet1!R2C1,Sheet1!R2C1:R16C1,MOD(RC1+3,3)+MOD(INT((RC1+3)/3),3)*5+3,FALSE) -> 164|102|103|104|132 | K429: =HLOOKUP(Sheet1!R2C1,Sheet1!R2C1:R16C1,MOD(RC1-1,3)+MOD(INT((RC1-1)/3),3)*5+3,FALSE)&"|"&HLOOKUP(Sheet1!R2C1,Sheet1!R2C1:R16C1,MOD(RC1,3)+MOD(INT((RC1)/3),3)*5+3,FALSE)&"|"&HLOOKUP(Sheet1!R2C1,Sheet1!R2C1:R16C1,MOD(RC1+1,3)+MOD(INT((RC1+1)/3),3)*5+3,FALSE)&"|"&HLOOKUP(Sheet1!R2C1,Sheet1!R2C1:R16C1,MOD(RC1+2,3)+MOD(INT((RC1+2)/3),3)*5+3,FALSE)&"|"&HLOOKUP(Sheet1!R2C1,Sheet1!R2C1:R16C1,MOD(RC1+3,3)+MOD(INT((RC1+3)/3),3)*5+3,FALSE) -> 164|102|103|104|132 | L429: 25|22|23|24 | M429: 8026909|8026909|8026908|8026908 | N429: 10030|10031|10032|10033 | O429: 1|1|1|1 | P429: 2500|2500|2500|2500
A430: 424 | B430: 422 | C430: 30 | D430: =R[-20]C+2 -> 62 | E430: 1000 | F430: =MOD(RC[-5]-1,3)*30+100&"|"&MOD(RC[-5]-1,3)*30+101&"|"&MOD(RC[-5]-1,3)*30+102&"|"&MOD(RC[-5]-1,3)*30+103&"|"&IF(MOD(RC[-5],4)=0,HLOOKUP(Sheet1!R2C10,Sheet1!R2C10:R7C10,MOD(RC[-5]/4-1,6)+1,FALSE),IF(MOD(RC[-5],2)=0,IF(RC[-5]>20,HLOOKUP(Sheet1!R2C7,Sheet1!R2C7:R43C7,MOD(RC[-5]/2-1,42)+1,FALSE),HLOOKUP(Sheet1!R2C4,Sheet1!R2C4:R7C4,MOD(RC[-5]-1,6)+1,FALSE)),MOD(RC[-5]-1,3)*30+104)) -> 100|101|102|103|193 | G430: =HLOOKUP(Sheet1!R2C1,Sheet1!R2C1:R16C1,MOD(RC1-1,2)+MOD(INT((RC1-1)/2),3)*5+1,FALSE)&"|"&HLOOKUP(Sheet1!R2C1,Sheet1!R2C1:R16C1,MOD(RC1,2)+MOD(INT((RC1)/2),3)*5+1,FALSE)&"|"&HLOOKUP(Sheet1!R2C1,Sheet1!R2C1:R16C1,MOD(RC1+1,2)+MOD(INT((RC1+1)/2),3)*5+1,FALSE)&"|"&HLOOKUP(Sheet1!R2C1,Sheet1!R2C1:R16C1,MOD(RC1+2,2)+MOD(INT((RC1+2)/2),3)*5+1,FALSE)&"|"&HLOOKUP(Sheet1!R2C1,Sheet1!R2C1:R16C1,MOD(RC1+3,2)+MOD(INT((RC1+3)/2),3)*5+1,FALSE) -> 131|160|161|100|101 | H430: =HLOOKUP(Sheet1!R2C1,Sheet1!R2C1:R16C1,MOD(RC1+2,2)+MOD(INT((RC1+2)/2),3)*5+1,FALSE)&"|"&HLOOKUP(Sheet1!R2C1,Sheet1!R2C1:R16C1,MOD(RC1+3,2)+MOD(INT((RC1+3)/2),3)*5+1,FALSE)&"|"&HLOOKUP(Sheet1!R2C1,Sheet1!R2C1:R16C1,MOD(RC1+4,2)+MOD(INT((RC1+4)/2),3)*5+1,FALSE)&"|"&HLOOKUP(Sheet1!R2C1,Sheet1!R2C1:R16C1,MOD(RC1+5,2)+MOD(INT((RC1+5)/2),3)*5+1,FALSE)&"|"&HLOOKUP(Sheet1!R2C1,Sheet1!R2C1:R16C1,MOD(RC1+6,2)+MOD(INT((RC1+6)/2),3)*5+1,FALSE) -> 100|101|130|131|160 | I430: =HLOOKUP(Sheet1!R2C1,Sheet1!R2C1:R16C1,MOD(RC1-1,3)+MOD(INT((RC1-1)/3),3)*5+3,FALSE)&"|"&HLOOKUP(Sheet1!R2C1,Sheet1!R2C1:R16C1,MOD(RC1,3)+MOD(INT((RC1)/3),3)*5+3,FALSE)&"|"&HLOOKUP(Sheet1!R2C1,Sheet1!R2C1:R16C1,MOD(RC1+1,3)+MOD(INT((RC1+1)/3),3)*5+3,FALSE)&"|"&HLOOKUP(Sheet1!R2C1,Sheet1!R2C1:R16C1,MOD(RC1+2,3)+MOD(INT((RC1+2)/3),3)*5+3,FALSE)&"|"&HLOOKUP(Sheet1!R2C1,Sheet1!R2C1:R16C1,MOD(RC1+3,3)+MOD(INT((RC1+3)/3),3)*5+3,FALSE) -> 102|103|104|132|133 | J430: =HLOOKUP(Sheet1!R2C1,Sheet1!R2C1:R16C1,MOD(RC1-1,3)+MOD(INT((RC1-1)/3),3)*5+3,FALSE)&"|"&HLOOKUP(Sheet1!R2C1,Sheet1!R2C1:R16C1,MOD(RC1,3)+MOD(INT((RC1)/3),3)*5+3,FALSE)&"|"&HLOOKUP(Sheet1!R2C1,Sheet1!R2C1:R16C1,MOD(RC1+1,3)+MOD(INT((RC1+1)/3),3)*5+3,FALSE)&"|"&HLOOKUP(Sheet1!R2C1,Sheet1!R2C1:R16C1,MOD(RC1+2,3)+MOD(INT((RC1+2)/3),3)*5+3,FALSE)&"|"&HLOOKUP(Sheet1!R2C1,Sheet1!R2C1:R16C1,MOD(RC1+3,3)+MOD(INT((RC1+3)/3),3)*5+3,FALSE) -> 102|103|104|132|133 | K430: =HLOOKUP(Sheet1!R2C1,Sheet1!R2C1:R16C1,MOD(RC1-1,3)+MOD(INT((RC1-1)/3),3)*5+3,FALSE)&"|"&HLOOKUP(Sheet1!R2C1,Sheet1!R2C1:R16C1,MOD(RC1,3)+MOD(INT((RC1)/3),3)*5+3,FALSE)&"|"&HLOOKUP(Sheet1!R2C1,Sheet1!R2C1:R16C1,MOD(RC1+1,3)+MOD(INT((RC1+1)/3),3)*5+3,FALSE)&"|"&HLOOKUP(Sheet1!R2C1,Sheet1!R2C1:R16C1,MOD(RC1+2,3)+MOD(INT((RC1+2)/3),3)*5+3,FALSE)&"|"&HLOOKUP(Sheet1!R2C1,Sheet1!R2C1:R16C1,MOD(RC1+3,3)+MOD(INT((RC1+3)/3),3)*5+3,FALSE) -> 102|103|104|132|133 | L430: 25|22|23|24 | M430: 8097376|8097376|8097378|8097378 | N430: 10030|10031|10032|10033 | O430: 1|1|1|1 | P430: 2500|2500|2500|2500
A431: 425 | B431: 423 | C431: 30 | D431: =R[-20]C+2 -> 62 | E431: 1000 | F431: =MOD(RC[-5]-1,3)*30+100&"|"&MOD(RC[-5]-1,3)*30+101&"|"&MOD(RC[-5]-1,3)*30+102&"|"&MOD(RC[-5]-1,3)*30+103&"|"&IF(MOD(RC[-5],4)=0,HLOOKUP(Sheet1!R2C10,Sheet1!R2C10:R7C10,MOD(RC[-5]/4-1,6)+1,FALSE),IF(MOD(RC[-5],2)=0,IF(RC[-5]>20,HLOOKUP(Sheet1!R2C7,Sheet1!R2C7:R43C7,MOD(RC[-5]/2-1,42)+1,FALSE),HLOOKUP(Sheet1!R2C4,Sheet1!R2C4:R7C4,MOD(RC[-5]-1,6)+1,FALSE)),MOD(RC[-5]-1,3)*30+104)) -> 130|131|132|133|134 | G431: =HLOOKUP(Sheet1!R2C1,Sheet1!R2C1:R16C1,MOD(RC1-1,2)+MOD(INT((RC1-1)/2),3)*5+1,FALSE)&"|"&HLOOKUP(Sheet1!R2C1,Sheet1!R2C1:R16C1,MOD(RC1,2)+MOD(INT((RC1)/2),3)*5+1,FALSE)&"|"&HLOOKUP(Sheet1!R2C1,Sheet1!R2C1:R16C1,MOD(RC1+1,2)+MOD(INT((RC1+1)/2),3)*5+1,FALSE)&"|"&HLOOKUP(Sheet1!R2C1,Sheet1!R2C1:R16C1,MOD(RC1+2,2)+MOD(INT((RC1+2)/2),3)*5+1,FALSE)&"|"&HLOOKUP(Sheet1!R2C1,Sheet1!R2C1:R16C1,MOD(RC1+3,2)+MOD(INT((RC1+3)/2),3)*5+1,FALSE) -> 160|161|100|101|130 | H431: =HLOOKUP(Sheet1!R2C1,Sheet1!R2C1:R16C1,MOD(RC1+2,2)+MOD(INT((RC1+2)/2),3)*5+1,FALSE)&"|"&HLOOKUP(Sheet1!R2C1,Sheet1!R2C1:R16C1,MOD(RC1+3,2)+MOD(INT((RC1+3)/2),3)*5+1,FALSE)&"|"&HLOOKUP(Sheet1!R2C1,Sheet1!R2C1:R16C1,MOD(RC1+4,2)+MOD(INT((RC1+4)/2),3)*5+1,FALSE)&"|"&HLOOKUP(Sheet1!R2C1,Sheet1!R2C1:R16C1,MOD(RC1+5,2)+MOD(INT((RC1+5)/2),3)*5+1,FALSE)&"|"&HLOOKUP(Sheet1!R2C1,Sheet1!R2C1:R16C1,MOD(RC1+6,2)+MOD(INT((RC1+6)/2),3)*5+1,FALSE) -> 101|130|131|160|161 | I431: =HLOOKUP(Sheet1!R2C1,Sheet1!R2C1:R16C1,MOD(RC1-1,3)+MOD(INT((RC1-1)/3),3)*5+3,FALSE)&"|"&HLOOKUP(Sheet1!R2C1,Sheet1!R2C1:R16C1,MOD(RC1,3)+MOD(INT((RC1)/3),3)*5+3,FALSE)&"|"&HLOOKUP(Sheet1!R2C1,Sheet1!R2C1:R16C1,MOD(RC1+1,3)+MOD(INT((RC1+1)/3),3)*5+3,FALSE)&"|"&HLOOKUP(Sheet1!R2C1,Sheet1!R2C1:R16C1,MOD(RC1+2,3)+MOD(INT((RC1+2)/3),3)*5+3,FALSE)&"|"&HLOOKUP(Sheet1!R2C1,Sheet1!R2C1:R16C1,MOD(RC1+3,3)+MOD(INT((RC1+3)/3),3)*5+3,FALSE) -> 103|104|132|133|134 | J431: =HLOOKUP(Sheet1!R2C1,Sheet1!R2C1:R16C1,MOD(RC1-1,3)+MOD(INT((RC1-1)/3),3)*5+3,FALSE)&"|"&HLOOKUP(Sheet1!R2C1,Sheet1!R2C1:R16C1,MOD(RC1,3)+MOD(INT((RC1)/3),3)*5+3,FALSE)&"|"&HLOOKUP(Sheet1!R2C1,Sheet1!R2C1:R16C1,MOD(RC1+1,3)+MOD(INT((RC1+1)/3),3)*5+3,FALSE)&"|"&HLOOKUP(Sheet1!R2C1,Sheet1!R2C1:R16C1,MOD(RC1+2,3)+MOD(INT((RC1+2)/3),3)*5+3,FALSE)&"|"&HLOOKUP(Sheet1!R2C1,Sheet1!R2C1:R16C1,MOD(RC1+3,3)+MOD(INT((RC1+3)/3),3)*5+3,FALSE) -> 103|104|132|133|134 | K431: =HLOOKUP(Sheet1!R2C1,Sheet1!R2C1:R16C1,MOD(RC1-1,3)+MOD(INT((RC1-1)/3),3)*5+3,FALSE)&"|"&HLOOKUP(Sheet1!R2C1,Sheet1!R2C1:R16C1,MOD(RC1,3)+MOD(INT((RC1)/3),3)*5+3,FALSE)&"|"&HLOOKUP(Sheet1!R2C1,Sheet1!R2C1:R16C1,MOD(RC1+1,3)+MOD(INT((RC1+1)/3),3)*5+3,FALSE)&"|"&HLOOKUP(Sheet1!R2C1,Sheet1!R2C1:R16C1,MOD(RC1+2,3)+MOD(INT((RC1+2)/3),3)*5+3,FALSE)&"|"&HLOOKUP(Sheet1!R2C1,Sheet1!R2C1:R16C1,MOD(RC1+3,3)+MOD(INT((RC1+3)/3),3)*5+3,FALSE) -> 103|104|132|133|134 | L431: 25|22|23|24 | M431: 8167844|8167844|8167845|8167845 | N431: 10030|10031|10032|10033|10030|10031|10032|10033|10030|10031|10032|10033|10030|10031|10032|10033|10030|10031|10032|10033|10030|10031|10032|10033|10030|10031|10032|10033|10030|10031|10032|10033|10030|10031|10032|10033|10030|10031|10032|10033 | O431: 1|1|1|1|1|1|1|1|1|1|1|1|1|1|1|1|1|1|1|1|1|1|1|1|1|1|1|1|1|1|1|1|1|1|1|1|1|1|1|1 | P431: 2500|2500|2500|2500|2500|2500|2500|2500|2500|2500|2500|2500|2500|2500|2500|2500|2500|2500|2500|2500|2500|2500|2500|2500|2500|2500|2500|2500|2500|2500|2500|2500|2500|2500|2500|2500|2500|2500|2500|2500
A432: 426 | B432: 424 | C432: 30 | D432: =R[-20]C+2 -> 62 | E432: 1000 | F432: =MOD(RC[-5]-1,3)*30+100&"|"&MOD(RC[-5]-1,3)*30+101&"|"&MOD(RC[-5]-1,3)*30+102&"|"&MOD(RC[-5]-1,3)*30+103&"|"&IF(MOD(RC[-5],4)=0,HLOOKUP(Sheet1!R2C10,Sheet1!R2C10:R7C10,MOD(RC[-5]/4-1,6)+1,FALSE),IF(MOD(RC[-5],2)=0,IF(RC[-5]>20,HLOOKUP(Sheet1!R2C7,Sheet1!R2C7:R43C7,MOD(RC[-5]/2-1,42)+1,FALSE),HLOOKUP(Sheet1!R2C4,Sheet1!R2C4:R7C4,MOD(RC[-5]-1,6)+1,FALSE)),MOD(RC[-5]-1,3)*30+104)) -> 160|161|162|163|114 | G432: =HLOOKUP(Sheet1!R2C1,Sheet1!R2C1:R16C1,MOD(RC1-1,2)+MOD(INT((RC1-1)/2),3)*5+1,FALSE)&"|"&HLOOKUP(Sheet1!R2C1,Sheet1!R2C1:R16C1,MOD(RC1,2)+MOD(INT((RC1)/2),3)*5+1,FALSE)&"|"&HLOOKUP(Sheet1!R2C1,Sheet1!R2C1:R16C1,MOD(RC1+1,2)+MOD(INT((RC1+1)/2),3)*5+1,FALSE)&"|"&HLOOKUP(Sheet1!R2C1,Sheet1!R2C1:R16C1,MOD(RC1+2,2)+MOD(INT((RC1+2)/2),3)*5+1,FALSE)&"|"&HLOOKUP(Sheet1!R2C1,Sheet1!R2C1:R16C1,MOD(RC1+3,2)+MOD(INT((RC1+3)/2),3)*5+1,FALSE) -> 161|100|101|130|131 | H432: =HLOOKUP(Sheet1!R2C1,Sheet1!R2C1:R16C1,MOD(RC1+2,2)+MOD(INT((RC1+2)/2),3)*5+1,FALSE)&"|"&HLOOKUP(Sheet1!R2C1,Sheet1!R2C1:R16C1,MOD(RC1+3,2)+MOD(INT((RC1+3)/2),3)*5+1,FALSE)&"|"&HLOOKUP(Sheet1!R2C1,Sheet1!R2C1:R16C1,MOD(RC1+4,2)+MOD(INT((RC1+4)/2),3)*5+1,FALSE)&"|"&HLOOKUP(Sheet1!R2C1,Sheet1!R2C1:R16C1,MOD(RC1+5,2)+MOD(INT((RC1+5)/2),3)*5+1,FALSE)&"|"&HLOOKUP(Sheet1!R2C1,Sheet1!R2C1:R16C1,MOD(RC1+6,2)+MOD(INT((RC1+6)/2),3)*5+1,FALSE) -> 130|131|160|161|100 | I432: =HLOOKUP(Sheet1!R2C1,Sheet1!R2C1:R16C1,MOD(RC1-1,3)+MOD(INT((RC1-1)/3),3)*5+3,FALSE)&"|"&HLOOKUP(Sheet1!R2C1,Sheet1!R2C1:R16C1,MOD(RC1,3)+MOD(INT((RC1)/3),3)*5+3,FALSE)&"|"&HLOOKUP(Sheet1!R2C1,Sheet1!R2C1:R16C1,MOD(RC1+1,3)+MOD(INT((RC1+1)/3),3)*5+3,FALSE)&"|"&HLOOKUP(Sheet1!R2C1,Sheet1!R2C1:R16C1,MOD(RC1+2,3)+MOD(INT((RC1+2)/3),3)*5+3,FALSE)&"|"&HLOOKUP(Sheet1!R2C1,Sheet1!R2C1:R16C1,MOD(RC1+3,3)+MOD(INT((RC1+3)/3),3)*5+3,FALSE) -> 104|132|133|134|162 | J432: =HLOOKUP(Sheet1!R2C1,Sheet1!R2C1:R16C1,MOD(RC1-1,3)+MOD(INT((RC1-1)/3),3)*5+3,FALSE)&"|"&HLOOKUP(Sheet1!R2C1,Sheet1!R2C1:R16C1,MOD(RC1,3)+MOD(INT((RC1)/3),3)*5+3,FALSE)&"|"&HLOOKUP(Sheet1!R2C1,Sheet1!R2C1:R16C1,MOD(RC1+1,3)+MOD(INT((RC1+1)/3),3)*5+3,FALSE)&"|"&HLOOKUP(Sheet1!R2C1,Sheet1!R2C1:R16C1,MOD(RC1+2,3)+MOD(INT((RC1+2)/3),3)*5+3,FALSE)&"|"&HLOOKUP(Sheet1!R2C1,Sheet1!R2C1:R16C1,MOD(RC1+3,3)+MOD(INT((RC1+3)/3),3)*5+3,FALSE) -> 104|132|133|134|162 | K432: =HLOOKUP(Sheet1!R2C1,Sheet1!R2C1:R16C1,MOD(RC1-1,3)+MOD(INT((RC1-1)/3),3)*5+3,FALSE)&"|"&HLOOKUP(Sheet1!R2C1,Sheet1!R2C1:R16C1,MOD(RC1,3)+MOD(INT((RC1)/3),3)*5+3,FALSE)&"|"&HLOOKUP(Sheet1!R2C1,Sheet1!R2C1:R16C1,MOD(RC1+1,3)+MOD(INT((RC1+1)/3),3)*5+3,FALSE)&"|"&HLOOKUP(Sheet1!R2C1,Sheet1!R2C1:R16C1,MOD(RC1+2,3)+MOD(INT((RC1+2)/3),3)*5+3,FALSE)&"|"&HLOOKUP(Sheet1!R2C1,Sheet1!R2C1:R16C1,MOD(RC1+3,3)+MOD(INT((RC1+3)/3),3)*5+3,FALSE) -> 104|132|133|134|162 | L432: 25|22|23|24 | M432: 8238312|8238313|8238313|8238313 | N432: 10030|10031|10032|10033 | O432: 1|1|1|1 | P432: 2500|2500|2500|2500
A433: 427 | B433: 425 | C433: 30 | D433: =R[-20]C+2 -> 62 | E433: 1000 | F433: =MOD(RC[-5]-1,3)*30+100&"|"&MOD(RC[-5]-1,3)*30+101&"|"&MOD(RC[-5]-1,3)*30+102&"|"&MOD(RC[-5]-1,3)*30+103&"|"&IF(MOD(RC[-5],4)=0,HLOOKUP(Sheet1!R2C10,Sheet1!R2C10:R7C10,MOD(RC[-5]/4-1,6)+1,FALSE),IF(MOD(RC[-5],2)=0,IF(RC[-5]>20,HLOOKUP(Sheet1!R2C7,Sheet1!R2C7:R43C7,MOD(RC[-5]/2-1,42)+1,FALSE),HLOOKUP(Sheet1!R2C4,Sheet1!R2C4:R7C4,MOD(RC[-5]-1,6)+1,FALSE)),MOD(RC[-5]-1,3)*30+104)) -> 100|101|102|103|104 | G433: =HLOOKUP(Sheet1!R2C1,Sheet1!R2C1:R16C1,MOD(RC1-1,2)+MOD(INT((RC1-1)/2),3)*5+1,FALSE)&"|"&HLOOKUP(Sheet1!R2C1,Sheet1!R2C1:R16C1,MOD(RC1,2)+MOD(INT((RC1)/2),3)*5+1,FALSE)&"|"&HLOOKUP(Sheet1!R2C1,Sheet1!R2C1:R16C1,MOD(RC1+1,2)+MOD(INT((RC1+1)/2),3)*5+1,FALSE)&"|"&HLOOKUP(Sheet1!R2C1,Sheet1!R2C1:R16C1,MOD(RC1+2,2)+MOD(INT((RC1+2)/2),3)*5+1,FALSE)&"|"&HLOOKUP(Sheet1!R2C1,Sheet1!R2C1:R16C1,MOD(RC1+3,2)+MOD(INT((RC1+3)/2),3)*5+1,FALSE) -> 100|101|130|131|160 | H433: =HLOOKUP(Sheet1!R2C1,Sheet1!R2C1:R16C1,MOD(RC1+2,2)+MOD(INT((RC1+2)/2),3)*5+1,FALSE)&"|"&HLOOKUP(Sheet1!R2C1,Sheet1!R2C1:R16C1,MOD(RC1+3,2)+MOD(INT((RC1+3)/2),3)*5+1,FALSE)&"|"&HLOOKUP(Sheet1!R2C1,Sheet1!R2C1:R16C1,MOD(RC1+4,2)+MOD(INT((RC1+4)/2),3)*5+1,FALSE)&"|"&HLOOKUP(Sheet1!R2C1,Sheet1!R2C1:R16C1,MOD(RC1+5,2)+MOD(INT((RC1+5)/2),3)*5+1,FALSE)&"|"&HLOOKUP(Sheet1!R2C1,Sheet1!R2C1:R16C1,MOD(RC1+6,2)+MOD(INT((RC1+6)/2),3)*5+1,FALSE) -> 131|160|161|100|101 | I433: =HLOOKUP(Sheet1!R2C1,Sheet1!R2C1:R16C1,MOD(RC1-1,3)+MOD(INT((RC1-1)/3),3)*5+3,FALSE)&"|"&HLOOKUP(Sheet1!R2C1,Sheet1!R2C1:R16C1,MOD(RC1,3)+MOD(INT((RC1)/3),3)*5+3,FALSE)&"|"&HLOOKUP(Sheet1!R2C1,Sheet1!R2C1:R16C1,MOD(RC1+1,3)+MOD(INT((RC1+1)/3),3)*5+3,FALSE)&"|"&HLOOKUP(Sheet1!R2C1,Sheet1!R2C1:R16C1,MOD(RC1+2,3)+MOD(INT((RC1+2)/3),3)*5+3,FALSE)&"|"&HLOOKUP(Sheet1!R2C1,Sheet1!R2C1:R16C1,MOD(RC1+3,3)+MOD(INT((RC1+3)/3),3)*5+3,FALSE) -> 132|133|134|162|163 | J433: =HLOOKUP(Sheet1!R2C1,Sheet1!R2C1:R16C1,MOD(RC1-1,3)+MOD(INT((RC1-1)/3),3)*5+3,FALSE)&"|"&HLOOKUP(Sheet1!R2C1,Sheet1!R2C1:R16C1,MOD(RC1,3)+MOD(INT((RC1)/3),3)*5+3,FALSE)&"|"&HLOOKUP(Sheet1!R2C1,Sheet1!R2C1:R16C1,MOD(RC1+1,3)+MOD(INT((RC1+1)/3),3)*5+3,FALSE)&"|"&HLOOKUP(Sheet1!R2C1,Sheet1!R2C1:R16C1,MOD(RC1+2,3)+MOD(INT((RC1+2)/3),3)*5+3,FALSE)&"|"&HLOOKUP(Sheet1!R2C1,Sheet1!R2C1:R16C1,MOD(RC1+3,3)+MOD(INT((RC1+3)/3),3)*5+3,FALSE) -> 132|133|134|162|163 | K433: =HLOOKUP(Sheet1!R2C1,Sheet1!R2C1:R16C1,MOD(RC1-1,3)+MOD(INT((RC1-1)/3),3)*5+3,FALSE)&"|"&HLOOKUP(Sheet1!R2C1,Sheet1!R2C1:R16C1,MOD(RC1,3)+MOD(INT((RC1)/3),3)*5+3,FALSE)&"|"&HLOOKUP(Sheet1!R2C1,Sheet1!R2C1:R16C1,MOD(RC1+1,3)+MOD(INT((RC1+1)/3),3)*5+3,FALSE)&"|"&HLOOKUP(Sheet1!R2C1,Sheet1!R2C1:R16C1,MOD(RC1+2,3)+MOD(INT((RC1+2)/3),3)*5+3,FALSE)&"|"&HLOOKUP(Sheet1!R2C1,Sheet1!R2C1:R16C1,MOD(RC1+3,3)+MOD(INT((RC1+3)/3),3)*5+3,FALSE) -> 132|133|134|162|163 | L433: 25|22|23|24 | M433: 8310509|8310509|8310510|8310510 | N433: 10030|10031|10032|10033 | O433: 1|1|1|1 | P433: 2500|2500|2500|2500
A434: 428 | B434: 426 | C434: 30 | D434: =R[-20]C+2 -> 62 | E434: 1000 | F434: =MOD(RC[-5]-1,3)*30+100&"|"&MOD(RC[-5]-1,3)*30+101&"|"&MOD(RC[-5]-1,3)*30+102&"|"&MOD(RC[-5]-1,3)*30+103&"|"&IF(MOD(RC[-5],4)=0,HLOOKUP(Sheet1!R2C10,Sheet1!R2C10:R7C10,MOD(RC[-5]/4-1,6)+1,FALSE),IF(MOD(RC[-5],2)=0,IF(RC[-5]>20,HLOOKUP(Sheet1!R2C7,Sheet1!R2C7:R43C7,MOD(RC[-5]/2-1,42)+1,FALSE),HLOOKUP(Sheet1!R2C4,Sheet1!R2C4:R7C4,MOD(RC[-5]-1,6)+1,FALSE)),MOD(RC[-5]-1,3)*30+104)) -> 130|131|132|133|194 | G434: =HLOOKUP(Sheet1!R2C1,Sheet1!R2C1:R16C1,MOD(RC1-1,2)+MOD(INT((RC1-1)/2),3)*5+1,FALSE)&"|"&HLOOKUP(Sheet1!R2C1,Sheet1!R2C1:R16C1,MOD(RC1,2)+MOD(INT((RC1)/2),3)*5+1,FALSE)&"|"&HLOOKUP(Sheet1!R2C1,Sheet1!R2C1:R16C1,MOD(RC1+1,2)+MOD(INT((RC1+1)/2),3)*5+1,FALSE)&"|"&HLOOKUP(Sheet1!R2C1,Sheet1!R2C1:R16C1,MOD(RC1+2,2)+MOD(INT((RC1+2)/2),3)*5+1,FALSE)&"|"&HLOOKUP(Sheet1!R2C1,Sheet1!R2C1:R16C1,MOD(RC1+3,2)+MOD(INT((RC1+3)/2),3)*5+1,FALSE) -> 101|130|131|160|161 | H434: =HLOOKUP(Sheet1!R2C1,Sheet1!R2C1:R16C1,MOD(RC1+2,2)+MOD(INT((RC1+2)/2),3)*5+1,FALSE)&"|"&HLOOKUP(Sheet1!R2C1,Sheet1!R2C1:R16C1,MOD(RC1+3,2)+MOD(INT((RC1+3)/2),3)*5+1,FALSE)&"|"&HLOOKUP(Sheet1!R2C1,Sheet1!R2C1:R16C1,MOD(RC1+4,2)+MOD(INT((RC1+4)/2),3)*5+1,FALSE)&"|"&HLOOKUP(Sheet1!R2C1,Sheet1!R2C1:R16C1,MOD(RC1+5,2)+MOD(INT((RC1+5)/2),3)*5+1,FALSE)&"|"&HLOOKUP(Sheet1!R2C1,Sheet1!R2C1:R16C1,MOD(RC1+6,2)+MOD(INT((RC1+6)/2),3)*5+1,FALSE) -> 160|161|100|101|130 | I434: =HLOOKUP(Sheet1!R2C1,Sheet1!R2C1:R16C1,MOD(RC1-1,3)+MOD(INT((RC1-1)/3),3)*5+3,FALSE)&"|"&HLOOKUP(Sheet1!R2C1,Sheet1!R2C1:R16C1,MOD(RC1,3)+MOD(INT((RC1)/3),3)*5+3,FALSE)&"|"&HLOOKUP(Sheet1!R2C1,Sheet1!R2C1:R16C1,MOD(RC1+1,3)+MOD(INT((RC1+1)/3),3)*5+3,FALSE)&"|"&HLOOKUP(Sheet1!R2C1,Sheet1!R2C1:R16C1,MOD(RC1+2,3)+MOD(INT((RC1+2)/3),3)*5+3,FALSE)&"|"&HLOOKUP(Sheet1!R2C1,Sheet1!R2C1:R16C1,MOD(RC1+3,3)+MOD(INT((RC1+3)/3),3)*5+3,FALSE) -> 133|134|162|163|164 | J434: =HLOOKUP(Sheet1!R2C1,Sheet1!R2C1:R16C1,MOD(RC1-1,3)+MOD(INT((RC1-1)/3),3)*5+3,FALSE)&"|"&HLOOKUP(Sheet1!R2C1,Sheet1!R2C1:R16C1,MOD(RC1,3)+MOD(INT((RC1)/3),3)*5+3,FALSE)&"|"&HLOOKUP(Sheet1!R2C1,Sheet1!R2C1:R16C1,MOD(RC1+1,3)+MOD(INT((RC1+1)/3),3)*5+3,FALSE)&"|"&HLOOKUP(Sheet1!R2C1,Sheet1!R2C1:R16C1,MOD(RC1+2,3)+MOD(INT((RC1+2)/3),3)*5+3,FALSE)&"|"&HLOOKUP(Sheet1!R2C1,Sheet1!R2C1:R16C1,MOD(RC1+3,3)+MOD(INT((RC1+3)/3),3)*5+3,FALSE) -> 133|134|162|163|164 | K434: =HLOOKUP(Sheet1!R2C1,Sheet1!R2C1:R16C1,MOD(RC1-1,3)+MOD(INT((RC1-1)/3),3)*5+3,FALSE)&"|"&HLOOKUP(Sheet1!R2C1,Sheet1!R2C1:R16C1,MOD(RC1,3)+MOD(INT((RC1)/3),3)*5+3,FALSE)&"|"&HLOOKUP(Sheet1!R2C1,Sheet1!R2C1:R16C1,MOD(RC1+1,3)+MOD(INT((RC1+1)/3),3)*5+3,FALSE)&"|"&HLOOKUP(Sheet1!R2C1,Sheet1!R2C1:R16C1,MOD(RC1+2,3)+MOD(INT((RC1+2)/3),3)*5+3,FALSE)&"|"&HLOOKUP(Sheet1!R2C1,Sheet1!R2C1:R16C1,MOD(RC1+3,3)+MOD(INT((RC1+3)/3),3)*5+3,FALSE) -> 133|134|162|163|164 | L434: 25|22|23|24 | M434: 8383570|8383570|8383570|8383570 | N434: 10030|10031|10032|10033 | O434: 1|1|1|1 | P434: 2500|2500|2500|2500
A435: 429 | B435: 427 | C435: 30 | D435: =R[-20]C+2 -> 62 | E435: 1000 | F435: =MOD(RC[-5]-1,3)*30+100&"|"&MOD(RC[-5]-1,3)*30+101&"|"&MOD(RC[-5]-1,3)*30+102&"|"&MOD(RC[-5]-1,3)*30+103&"|"&IF(MOD(RC[-5],4)=0,HLOOKUP(Sheet1!R2C10,Sheet1!R2C10:R7C10,MOD(RC[-5]/4-1,6)+1,FALSE),IF(MOD(RC[-5],2)=0,IF(RC[-5]>20,HLOOKUP(Sheet1!R2C7,Sheet1!R2C7:R43C7,MOD(RC[-5]/2-1,42)+1,FALSE),HLOOKUP(Sheet1!R2C4,Sheet1!R2C4:R7C4,MOD(RC[-5]-1,6)+1,FALSE)),MOD(RC[-5]-1,3)*30+104)) -> 160|161|162|163|164 | G435: =HLOOKUP(Sheet1!R2C1,Sheet1!R2C1:R16C1,MOD(RC1-1,2)+MOD(INT((RC1-1)/2),3)*5+1,FALSE)&"|"&HLOOKUP(Sheet1!R2C1,Sheet1!R2C1:R16C1,MOD(RC1,2)+MOD(INT((RC1)/2),3)*5+1,FALSE)&"|"&HLOOKUP(Sheet1!R2C1,Sheet1!R2C1:R16C1,MOD(RC1+1,2)+MOD(INT((RC1+1)/2),3)*5+1,FALSE)&"|"&HLOOKUP(Sheet1!R2C1,Sheet1!R2C1:R16C1,MOD(RC1+2,2)+MOD(INT((RC1+2)/2),3)*5+1,FALSE)&"|"&HLOOKUP(Sheet1!R2C1,Sheet1!R2C1:R16C1,MOD(RC1+3,2)+MOD(INT((RC1+3)/2),3)*5+1,FALSE) -> 130|131|160|161|100 | H435: =HLOOKUP(Sheet1!R2C1,Sheet1!R2C1:R16C1,MOD(RC1+2,2)+MOD(INT((RC1+2)/2),3)*5+1,FALSE)&"|"&HLOOKUP(Sheet1!R2C1,Sheet1!R2C1:R16C1,MOD(RC1+3,2)+MOD(INT((RC1+3)/2),3)*5+1,FALSE)&"|"&HLOOKUP(Sheet1!R2C1,Sheet1!R2C1:R16C1,MOD(RC1+4,2)+MOD(INT((RC1+4)/2),3)*5+1,FALSE)&"|"&HLOOKUP(Sheet1!R2C1,Sheet1!R2C1:R16C1,MOD(RC1+5,2)+MOD(INT((RC1+5)/2),3)*5+1,FALSE)&"|"&HLOOKUP(Sheet1!R2C1,Sheet1!R2C1:R16C1,MOD(RC1+6,2)+MOD(INT((RC1+6)/2),3)*5+1,FALSE) -> 161|100|101|130|131 | I435: =HLOOKUP(Sheet1!R2C1,Sheet1!R2C1:R16C1,MOD(RC1-1,3)+MOD(INT((RC1-1)/3),3)*5+3,FALSE)&"|"&HLOOKUP(Sheet1!R2C1,Sheet1!R2C1:R16C1,MOD(RC1,3)+MOD(INT((RC1)/3),3)*5+3,FALSE)&"|"&HLOOKUP(Sheet1!R2C1,Sheet1!R2C1:R16C1,MOD(RC1+1,3)+MOD(INT((RC1+1)/3),3)*5+3,FALSE)&"|"&HLOOKUP(Sheet1!R2C1,Sheet1!R2C1:R16C1,MOD(RC1+2,3)+MOD(INT((RC1+2)/3),3)*5+3,FALSE)&"|"&HLOOKUP(Sheet1!R2C1,Sheet1!R2C1:R16C1,MOD(RC1+3,3)+MOD(INT((RC1+3)/3),3)*5+3,FALSE) -> 134|162|163|164|102 | J435: =HLOOKUP(Sheet1!R2C1,Sheet1!R2C1:R16C1,MOD(RC1-1,3)+MOD(INT((RC1-1)/3),3)*5+3,FALSE)&"|"&HLOOKUP(Sheet1!R2C1,Sheet1!R2C1:R16C1,MOD(RC1,3)+MOD(INT((RC1)/3),3)*5+3,FALSE)&"|"&HLOOKUP(Sheet1!R2C1,Sheet1!R2C1:R16C1,MOD(RC1+1,3)+MOD(INT((RC1+1)/3),3)*5+3,FALSE)&"|"&HLOOKUP(Sheet1!R2C1,Sheet1!R2C1:R16C1,MOD(RC1+2,3)+MOD(INT((RC1+2)/3),3)*5+3,FALSE)&"|"&HLOOKUP(Sheet1!R2C1,Sheet1!R2C1:R16C1,MOD(RC1+3,3)+MOD(INT((RC1+3)/3),3)*5+3,FALSE) -> 134|162|163|164|102 | K435: =HLOOKUP(Sheet1!R2C1,Sheet1!R2C1:R16C1,MOD(RC1-1,3)+MOD(INT((RC1-1)/3),3)*5+3,FALSE)&"|"&HLOOKUP(Sheet1!R2C1,Sheet1!R2C1:R16C1,MOD(RC1,3)+MOD(INT((RC1)/3),3)*5+3,FALSE)&"|"&HLOOKUP(Sheet1!R2C1,Sheet1!R2C1:R16C1,MOD(RC1+1,3)+MOD(INT((RC1+1)/3),3)*5+3,FALSE)&"|"&HLOOKUP(Sheet1!R2C1,Sheet1!R2C1:R16C1,MOD(RC1+2,3)+MOD(INT((RC1+2)/3),3)*5+3,FALSE)&"|"&HLOOKUP(Sheet1!R2C1,Sheet1!R2C1:R16C1,MOD(RC1+3,3)+MOD(INT((RC1+3)/3),3)*5+3,FALSE) -> 134|162|163|164|102 | L435: 25|22|23|24 | M435: 8453587|8453588|8453588|8453588 | N435: 10030|10031|10032|10033 | O435: 1|1|1|1 | P435: 2500|2500|2500|2500
A436: 430 | B436: 428 | C436: 30 | D436: =R[-20]C+2 -> 62 | E436: 1000 | F436: =MOD(RC[-5]-1,3)*30+100&"|"&MOD(RC[-5]-1,3)*30+101&"|"&MOD(RC[-5]-1,3)*30+102&"|"&MOD(RC[-5]-1,3)*30+103&"|"&IF(MOD(RC[-5],4)=0,HLOOKUP(Sheet1!R2C10,Sheet1!R2C10:R7C10,MOD(RC[-5]/4-1,6)+1,FALSE),IF(MOD(RC[-5],2)=0,IF(RC[-5]>20,HLOOKUP(Sheet1!R2C7,Sheet1!R2C7:R43C7,MOD(RC[-5]/2-1,42)+1,FALSE),HLOOKUP(Sheet1!R2C4,Sheet1!R2C4:R7C4,MOD(RC[-5]-1,6)+1,FALSE)),MOD(RC[-5]-1,3)*30+104)) -> 100|101|102|103|116 | G436: =HLOOKUP(Sheet1!R2C1,Sheet1!R2C1:R16C1,MOD(RC1-1,2)+MOD(INT((RC1-1)/2),3)*5+1,FALSE)&"|"&HLOOKUP(Sheet1!R2C1,Sheet1!R2C1:R16C1,MOD(RC1,2)+MOD(INT((RC1)/2),3)*5+1,FALSE)&"|"&HLOOKUP(Sheet1!R2C1,Sheet1!R2C1:R16C1,MOD(RC1+1,2)+MOD(INT((RC1+1)/2),3)*5+1,FALSE)&"|"&HLOOKUP(Sheet1!R2C1,Sheet1!R2C1:R16C1,MOD(RC1+2,2)+MOD(INT((RC1+2)/2),3)*5+1,FALSE)&"|"&HLOOKUP(Sheet1!R2C1,Sheet1!R2C1:R16C1,MOD(RC1+3,2)+MOD(INT((RC1+3)/2),3)*5+1,FALSE) -> 131|160|161|100|101 | H436: =HLOOKUP(Sheet1!R2C1,Sheet1!R2C1:R16C1,MOD(RC1+2,2)+MOD(INT((RC1+2)/2),3)*5+1,FALSE)&"|"&HLOOKUP(Sheet1!R2C1,Sheet1!R2C1:R16C1,MOD(RC1+3,2)+MOD(INT((RC1+3)/2),3)*5+1,FALSE)&"|"&HLOOKUP(Sheet1!R2C1,Sheet1!R2C1:R16C1,MOD(RC1+4,2)+MOD(INT((RC1+4)/2),3)*5+1,FALSE)&"|"&HLOOKUP(Sheet1!R2C1,Sheet1!R2C1:R16C1,MOD(RC1+5,2)+MOD(INT((RC1+5)/2),3)*5+1,FALSE)&"|"&HLOOKUP(Sheet1!R2C1,Sheet1!R2C1:R16C1,MOD(RC1+6,2)+MOD(INT((RC1+6)/2),3)*5+1,FALSE) -> 100|101|130|131|160 | I436: =HLOOKUP(Sheet1!R2C1,Sheet1!R2C1:R16C1,MOD(RC1-1,3)+MOD(INT((RC1-1)/3),3)*5+3,FALSE)&"|"&HLOOKUP(Sheet1!R2C1,Sheet1!R2C1:R16C1,MOD(RC1,3)+MOD(INT((RC1)/3),3)*5+3,FALSE)&"|"&HLOOKUP(Sheet1!R2C1,Sheet1!R2C1:R16C1,MOD(RC1+1,3)+MOD(INT((RC1+1)/3),3)*5+3,FALSE)&"|"&HLOOKUP(Sheet1!R2C1,Sheet1!R2C1:R16C1,MOD(RC1+2,3)+MOD(INT((RC1+2)/3),3)*5+3,FALSE)&"|"&HLOOKUP(Sheet1!R2C1,Sheet1!R2C1:R16C1,MOD(RC1+3,3)+MOD(INT((RC1+3)/3),3)*5+3,FALSE) -> 162|163|164|102|103 | J436: =HLOOKUP(Sheet1!R2C1,Sheet1!R2C1:R16C1,MOD(RC1-1,3)+MOD(INT((RC1-1)/3),3)*5+3,FALSE)&"|"&HLOOKUP(Sheet1!R2C1,Sheet1!R2C1:R16C1,MOD(RC1,3)+MOD(INT((RC1)/3),3)*5+3,FALSE)&"|"&HLOOKUP(Sheet1!R2C1,Sheet1!R2C1:R16C1,MOD(RC1+1,3)+MOD(INT((RC1+1)/3),3)*5+3,FALSE)&"|"&HLOOKUP(Sheet1!R2C1,Sheet1!R2C1:R16C1,MOD(RC1+2,3)+MOD(INT((RC1+2)/3),3)*5+3,FALSE)&"|"&HLOOKUP(Sheet1!R2C1,Sheet1!R2C1:R16C1,MOD(RC1+3,3)+MOD(INT((RC1+3)/3),3)*5+3,FALSE) -> 162|163|164|102|103 | K436: =HLOOKUP(Sheet1!R2C1,Sheet1!R2C1:R16C1,MOD(RC1-1,3)+MOD(INT((RC1-1)/3),3)*5+3,FALSE)&"|"&HLOOKUP(Sheet1!R2C1,Sheet1!R2C1:R16C1,MOD(RC1,3)+MOD(INT((RC1)/3),3)*5+3,FALSE)&"|"&HLOOKUP(Sheet1!R2C1,Sheet1!R2C1:R16C1,MOD(RC1+1,3)+MOD(INT((RC1+1)/3),3)*5+3,FALSE)&"|"&HLOOKUP(Sheet1!R2C1,Sheet1!R2C1:R16C1,MOD(RC1+2,3)+MOD(INT((RC1+2)/3),3)*5+3,FALSE)&"|"&HLOOKUP(Sheet1!R2C1,Sheet1!R2C1:R16C1,MOD(RC1+3,3)+MOD(INT((RC1+3)/3),3)*5+3,FALSE) -> 162|163|164|102|103 | L436: 25|22|23|24 | M436: 8526648|8526648|8526648|8526648 | N436: 10030|10031|10032|10033|10030|10031|10032|10033|10030|10031|10032|10033|10030|10031|10032|10033|10030|10031|10032|10033|10030|10031|10032|10033|10030|10031|10032|10033|10030|10031|10032|10033|10030|10031|10032|10033|10030|10031|10032|10033 | O436: 1|1|1|1|1|1|1|1|1|1|1|1|1|1|1|1|1|1|1|1|1|1|1|1|1|1|1|1|1|1|1|1|1|1|1|1|1|1|1|1 | P436: 2500|2500|2500|2500|2500|2500|2500|2500|2500|2500|2500|2500|2500|2500|2500|2500|2500|2500|2500|2500|2500|2500|2500|2500|2500|2500|2500|2500|2500|2500|2500|2500|2500|2500|2500|2500|2500|2500|2500|2500
A437: 431 | B437: 429 | C437: 30 | D437: =R[-20]C+2 -> 62 | E437: 1000 | F437: =MOD(RC[-5]-1,3)*30+100&"|"&MOD(RC[-5]-1,3)*30+101&"|"&MOD(RC[-5]-1,3)*30+102&"|"&MOD(RC[-5]-1,3)*30+103&"|"&IF(MOD(RC[-5],4)=0,HLOOKUP(Sheet1!R2C10,Sheet1!R2C10:R7C10,MOD(RC[-5]/4-1,6)+1,FALSE),IF(MOD(RC[-5],2)=0,IF(RC[-5]>20,HLOOKUP(Sheet1!R2C7,Sheet1!R2C7:R43C7,MOD(RC[-5]/2-1,42)+1,FALSE),HLOOKUP(Sheet1!R2C4,Sheet1!R2C4:R7C4,MOD(RC[-5]-1,6)+1,FALSE)),MOD(RC[-5]-1,3)*30+104)) -> 130|131|132|133|134 | G437: =HLOOKUP(Sheet1!R2C1,Sheet1!R2C1:R16C1,MOD(RC1-1,2)+MOD(INT((RC1-1)/2),3)*5+1,FALSE)&"|"&HLOOKUP(Sheet1!R2C1,Sheet1!R2C1:R16C1,MOD(RC1,2)+MOD(INT((RC1)/2),3)*5+1,FALSE)&"|"&HLOOKUP(Sheet1!R2C1,Sheet1!R2C1:R16C1,MOD(RC1+1,2)+MOD(INT((RC1+1)/2),3)*5+1,FALSE)&"|"&HLOOKUP(Sheet1!R2C1,Sheet1!R2C1:R16C1,MOD(RC1+2,2)+MOD(INT((RC1+2)/2),3)*5+1,FALSE)&"|"&HLOOKUP(Sheet1!R2C1,Sheet1!R2C1:R16C1,MOD(RC1+3,2)+MOD(INT((RC1+3)/2),3)*5+1,FALSE) -> 160|161|100|101|130 | H437: =HLOOKUP(Sheet1!R2C1,Sheet1!R2C1:R16C1,MOD(RC1+2,2)+MOD(INT((RC1+2)/2),3)*5+1,FALSE)&"|"&HLOOKUP(Sheet1!R2C1,Sheet1!R2C1:R16C1,MOD(RC1+3,2)+MOD(INT((RC1+3)/2),3)*5+1,FALSE)&"|"&HLOOKUP(Sheet1!R2C1,Sheet1!R2C1:R16C1,MOD(RC1+4,2)+MOD(INT((RC1+4)/2),3)*5+1,FALSE)&"|"&HLOOKUP(Sheet1!R2C1,Sheet1!R2C1:R16C1,MOD(RC1+5,2)+MOD(INT((RC1+5)/2),3)*5+1,FALSE)&"|"&HLOOKUP(Sheet1!R2C1,Sheet1!R2C1:R16C1,MOD(RC1+6,2)+MOD(INT((RC1+6)/2),3)*5+1,FALSE) -> 101|130|131|160|161 | I437: =HLOOKUP(Sheet1!R2C1,Sheet1!R2C1:R16C1,MOD(RC1-1,3)+MOD(INT((RC1-1)/3),3)*5+3,FALSE)&"|"&HLOOKUP(Sheet1!R2C1,Sheet1!R2C1:R16C1,MOD(RC1,3)+MOD(INT((RC1)/3),3)*5+3,FALSE)&"|"&HLOOKUP(Sheet1!R2C1,Sheet1!R2C1:R16C1,MOD(RC1+1,3)+MOD(INT((RC1+1)/3),3)*5+3,FALSE)&"|"&HLOOKUP(Sheet1!R2C1,Sheet1!R2C1:R16C1,MOD(RC1+2,3)+MOD(INT((RC1+2)/3),3)*5+3,FALSE)&"|"&HLOOKUP(Sheet1!R2C1,Sheet1!R2C1:R16C1,MOD(RC1+3,3)+MOD(INT((RC1+3)/3),3)*5+3,FALSE) -> 163|164|102|103|104 | J437: =HLOOKUP(Sheet1!R2C1,Sheet1!R2C1:R16C1,MOD(RC1-1,3)+MOD(INT((RC1-1)/3),3)*5+3,FALSE)&"|"&HLOOKUP(Sheet1!R2C1,Sheet1!R2C1:R16C1,MOD(RC1,3)+MOD(INT((RC1)/3),3)*5+3,FALSE)&"|"&HLOOKUP(Sheet1!R2C1,Sheet1!R2C1:R16C1,MOD(RC1+1,3)+MOD(INT((RC1+1)/3),3)*5+3,FALSE)&"|"&HLOOKUP(Sheet1!R2C1,Sheet1!R2C1:R16C1,MOD(RC1+2,3)+MOD(INT((RC1+2)/3),3)*5+3,FALSE)&"|"&HLOOKUP(Sheet1!R2C1,Sheet1!R2C1:R16C1,MOD(RC1+3,3)+MOD(INT((RC1+3)/3),3)*5+3,FALSE) -> 163|164|102|103|104 | K437: =HLOOKUP(Sheet1!R2C1,Sheet1!R2C1:R16C1,MOD(RC1-1,3)+MOD(INT((RC1-1)/3),3)*5+3,FALSE)&"|"&HLOOKUP(Sheet1!R2C1,Sheet1!R2C1:R16C1,MOD(RC1,3)+MOD(INT((RC1)/3),3)*5+3,FALSE)&"|"&HLOOKUP(Sheet1!R2C1,Sheet1!R2C1:R16C1,MOD(RC1+1,3)+MOD(INT((RC1+1)/3),3)*5+3,FALSE)&"|"&HLOOKUP(Sheet1!R2C1,Sheet1!R2C1:R16C1,MOD(RC1+2,3)+MOD(INT((RC1+2)/3),3)*5+3,FALSE)&"|"&HLOOKUP(Sheet1!R2C1,Sheet1!R2C1:R16C1,MOD(RC1+3,3)+MOD(INT((RC1+3)/3),3)*5+3,FALSE) -> 163|164|102|103|104 | L437: 25|22|23|24 | M437: 8600942|8600941|8600943|8600943 | N437: 10030|10031|10032|10033 | O437: 1|1|1|1 | P437: 2500|2500|2500|2500
A438: 432 | B438: 430 | C438: 30 | D438: =R[-20]C+2 -> 62 | E438: 1000 | F438: =MOD(RC[-5]-1,3)*30+100&"|"&MOD(RC[-5]-1,3)*30+101&"|"&MOD(RC[-5]-1,3)*30+102&"|"&MOD(RC[-5]-1,3)*30+103&"|"&IF(MOD(RC[-5],4)=0,HLOOKUP(Sheet1!R2C10,Sheet1!R2C10:R7C10,MOD(RC[-5]/4-1,6)+1,FALSE),IF(MOD(RC[-5],2)=0,IF(RC[-5]>20,HLOOKUP(Sheet1!R2C7,Sheet1!R2C7:R43C7,MOD(RC[-5]/2-1,42)+1,FALSE),HLOOKUP(Sheet1!R2C4,Sheet1!R2C4:R7C4,MOD(RC[-5]-1,6)+1,FALSE)),MOD(RC[-5]-1,3)*30+104)) -> 160|161|162|163|195 | G438: =HLOOKUP(Sheet1!R2C1,Sheet1!R2C1:R16C1,MOD(RC1-1,2)+MOD(INT((RC1-1)/2),3)*5+1,FALSE)&"|"&HLOOKUP(Sheet1!R2C1,Sheet1!R2C1:R16C1,MOD(RC1,2)+MOD(INT((RC1)/2),3)*5+1,FALSE)&"|"&HLOOKUP(Sheet1!R2C1,Sheet1!R2C1:R16C1,MOD(RC1+1,2)+MOD(INT((RC1+1)/2),3)*5+1,FALSE)&"|"&HLOOKUP(Sheet1!R2C1,Sheet1!R2C1:R16C1,MOD(RC1+2,2)+MOD(INT((RC1+2)/2),3)*5+1,FALSE)&"|"&HLOOKUP(Sheet1!R2C1,Sheet1!R2C1:R16C1,MOD(RC1+3,2)+MOD(INT((RC1+3)/2),3)*5+1,FALSE) -> 161|100|101|130|131 | H438: =HLOOKUP(Sheet1!R2C1,Sheet1!R2C1:R16C1,MOD(RC1+2,2)+MOD(INT((RC1+2)/2),3)*5+1,FALSE)&"|"&HLOOKUP(Sheet1!R2C1,Sheet1!R2C1:R16C1,MOD(RC1+3,2)+MOD(INT((RC1+3)/2),3)*5+1,FALSE)&"|"&HLOOKUP(Sheet1!R2C1,Sheet1!R2C1:R16C1,MOD(RC1+4,2)+MOD(INT((RC1+4)/2),3)*5+1,FALSE)&"|"&HLOOKUP(Sheet1!R2C1,Sheet1!R2C1:R16C1,MOD(RC1+5,2)+MOD(INT((RC1+5)/2),3)*5+1,FALSE)&"|"&HLOOKUP(Sheet1!R2C1,Sheet1!R2C1:R16C1,MOD(RC1+6,2)+MOD(INT((RC1+6)/2),3)*5+1,FALSE) -> 130|131|160|161|100 | I438: =HLOOKUP(Sheet1!R2C1,Sheet1!R2C1:R16C1,MOD(RC1-1,3)+MOD(INT((RC1-1)/3),3)*5+3,FALSE)&"|"&HLOOKUP(Sheet1!R2C1,Sheet1!R2C1:R16C1,MOD(RC1,3)+MOD(INT((RC1)/3),3)*5+3,FALSE)&"|"&HLOOKUP(Sheet1!R2C1,Sheet1!R2C1:R16C1,MOD(RC1+1,3)+MOD(INT((RC1+1)/3),3)*5+3,FALSE)&"|"&HLOOKUP(Sheet1!R2C1,Sheet1!R2C1:R16C1,MOD(RC1+2,3)+MOD(INT((RC1+2)/3),3)*5+3,FALSE)&"|"&HLOOKUP(Sheet1!R2C1,Sheet1!R2C1:R16C1,MOD(RC1+3,3)+MOD(INT((RC1+3)/3),3)*5+3,FALSE) -> 164|102|103|104|132 | J438: =HLOOKUP(Sheet1!R2C1,Sheet1!R2C1:R16C1,MOD(RC1-1,3)+MOD(INT((RC1-1)/3),3)*5+3,FALSE)&"|"&HLOOKUP(Sheet1!R2C1,Sheet1!R2C1:R16C1,MOD(RC1,3)+MOD(INT((RC1)/3),3)*5+3,FALSE)&"|"&HLOOKUP(Sheet1!R2C1,Sheet1!R2C1:R16C1,MOD(RC1+1,3)+MOD(INT((RC1+1)/3),3)*5+3,FALSE)&"|"&HLOOKUP(Sheet1!R2C1,Sheet1!R2C1:R16C1,MOD(RC1+2,3)+MOD(INT((RC1+2)/3),3)*5+3,FALSE)&"|"&HLOOKUP(Sheet1!R2C1,Sheet1!R2C1:R16C1,MOD(RC1+3,3)+MOD(INT((RC1+3)/3),3)*5+3,FALSE) -> 164|102|103|104|132 | K438: =HLOOKUP(Sheet1!R2C1,Sheet1!R2C1:R16C1,MOD(RC1-1,3)+MOD(INT((RC1-1)/3),3)*5+3,FALSE)&"|"&HLOOKUP(Sheet1!R2C1,Sheet1!R2C1:R16C1,MOD(RC1,3)+MOD(INT((RC1)/3),3)*5+3,FALSE)&"|"&HLOOKUP(Sheet1!R2C1,Sheet1!R2C1:R16C1,MOD(RC1+1,3)+MOD(INT((RC1+1)/3),3)*5+3,FALSE)&"|"&HLOOKUP(Sheet1!R2C1,Sheet1!R2C1:R16C1,MOD(RC1+2,3)+MOD(INT((RC1+2)/3),3)*5+3,FALSE)&"|"&HLOOKUP(Sheet1!R2C1,Sheet1!R2C1:R16C1,MOD(RC1+3,3)+MOD(INT((RC1+3)/3),3)*5+3,FALSE) -> 164|102|103|104|132 | L438: 25|22|23|24 | M438: 8676692|8676691|8676693|8676693 | N438: 10030|10031|10032|10033 | O438: 1|1|1|1 | P438: 2500|2500|2500|2500
A439: 433 | B439: 431 | C439: 30 | D439: =R[-20]C+2 -> 62 | E439: 1000 | F439: =MOD(RC[-5]-1,3)*30+100&"|"&MOD(RC[-5]-1,3)*30+101&"|"&MOD(RC[-5]-1,3)*30+102&"|"&MOD(RC[-5]-1,3)*30+103&"|"&IF(MOD(RC[-5],4)=0,HLOOKUP(Sheet1!R2C10,Sheet1!R2C10:R7C10,MOD(RC[-5]/4-1,6)+1,FALSE),IF(MOD(RC[-5],2)=0,IF(RC[-5]>20,HLOOKUP(Sheet1!R2C7,Sheet1!R2C7:R43C7,MOD(RC[-5]/2-1,42)+1,FALSE),HLOOKUP(Sheet1!R2C4,Sheet1!R2C4:R7C4,MOD(RC[-5]-1,6)+1,FALSE)),MOD(RC[-5]-1,3)*30+104)) -> 100|101|102|103|104 | G439: =HLOOKUP(Sheet1!R2C1,Sheet1!R2C1:R16C1,MOD(RC1-1,2)+MOD(INT((RC1-1)/2),3)*5+1,FALSE)&"|"&HLOOKUP(Sheet1!R2C1,Sheet1!R2C1:R16C1,MOD(RC1,2)+MOD(INT((RC1)/2),3)*5+1,FALSE)&"|"&HLOOKUP(Sheet1!R2C1,Sheet1!R2C1:R16C1,MOD(RC1+1,2)+MOD(INT((RC1+1)/2),3)*5+1,FALSE)&"|"&HLOOKUP(Sheet1!R2C1,Sheet1!R2C1:R16C1,MOD(RC1+2,2)+MOD(INT((RC1+2)/2),3)*5+1,FALSE)&"|"&HLOOKUP(Sheet1!R2C1,Sheet1!R2C1:R16C1,MOD(RC1+3,2)+MOD(INT((RC1+3)/2),3)*5+1,FALSE) -> 100|101|130|131|160 | H439: =HLOOKUP(Sheet1!R2C1,Sheet1!R2C1:R16C1,MOD(RC1+2,2)+MOD(INT((RC1+2)/2),3)*5+1,FALSE)&"|"&HLOOKUP(Sheet1!R2C1,Sheet1!R2C1:R16C1,MOD(RC1+3,2)+MOD(INT((RC1+3)/2),3)*5+1,FALSE)&"|"&HLOOKUP(Sheet1!R2C1,Sheet1!R2C1:R16C1,MOD(RC1+4,2)+MOD(INT((RC1+4)/2),3)*5+1,FALSE)&"|"&HLOOKUP(Sheet1!R2C1,Sheet1!R2C1:R16C1,MOD(RC1+5,2)+MOD(INT((RC1+5)/2),3)*5+1,FALSE)&"|"&HLOOKUP(Sheet1!R2C1,Sheet1!R2C1:R16C1,MOD(RC1+6,2)+MOD(INT((RC1+6)/2),3)*5+1,FALSE) -> 131|160|161|100|101 | I439: =HLOOKUP(Sheet1!R2C1,Sheet1!R2C1:R16C1,MOD(RC1-1,3)+MOD(INT((RC1-1)/3),3)*5+3,FALSE)&"|"&HLOOKUP(Sheet1!R2C1,Sheet1!R2C1:R16C1,MOD(RC1,3)+MOD(INT((RC1)/3),3)*5+3,FALSE)&"|"&HLOOKUP(Sheet1!R2C1,Sheet1!R2C1:R16C1,MOD(RC1+1,3)+MOD(INT((RC1+1)/3),3)*5+3,FALSE)&"|"&HLOOKUP(Sheet1!R2C1,Sheet1!R2C1:R16C1,MOD(RC1+2,3)+MOD(INT((RC1+2)/3),3)*5+3,FALSE)&"|"&HLOOKUP(Sheet1!R2C1,Sheet1!R2C1:R16C1,MOD(RC1+3,3)+MOD(INT((RC1+3)/3),3)*5+3,FALSE) -> 102|103|104|132|133 | J439: =HLOOKUP(Sheet1!R2C1,Sheet1!R2C1:R16C1,MOD(RC1-1,3)+MOD(INT((RC1-1)/3),3)*5+3,FALSE)&"|"&HLOOKUP(Sheet1!R2C1,Sheet1!R2C1:R16C1,MOD(RC1,3)+MOD(INT((RC1)/3),3)*5+3,FALSE)&"|"&HLOOKUP(Sheet1!R2C1,Sheet1!R2C1:R16C1,MOD(RC1+1,3)+MOD(INT((RC1+1)/3),3)*5+3,FALSE)&"|"&HLOOKUP(Sheet1!R2C1,Sheet1!R2C1:R16C1,MOD(RC1+2,3)+MOD(INT((RC1+2)/3),3)*5+3,FALSE)&"|"&HLOOKUP(Sheet1!R2C1,Sheet1!R2C1:R16C1,MOD(RC1+3,3)+MOD(INT((RC1+3)/3),3)*5+3,FALSE) -> 102|103|104|132|133 | K439: =HLOOKUP(Sheet1!R2C1,Sheet1!R2C1:R16C1,MOD(RC1-1,3)+MOD(INT((RC1-1)/3),3)*5+3,FALSE)&"|"&HLOOKUP(Sheet1!R2C1,Sheet1!R2C1:R16C1,MOD(RC1,3)+MOD(INT((RC1)/3),3)*5+3,FALSE)&"|"&HLOOKUP(Sheet1!R2C1,Sheet1!R2C1:R16C1,MOD(RC1+1,3)+MOD(INT((RC1+1)/3),3)*5+3,FALSE)&"|"&HLOOKUP(Sheet1!R2C1,Sheet1!R2C1:R16C1,MOD(RC1+2,3)+MOD(INT((RC1+2)/3),3)*5+3,FALSE)&"|"&HLOOKUP(Sheet1!R2C1,Sheet1!R2C1:R16C1,MOD(RC1+3,3)+MOD(INT((RC1+3)/3),3)*5+3,FALSE) -> 102|103|104|132|133 | L439: 25|22|23|24 | M439: 8752442|8752441|8752443|8752443 | N439: 10030|10031|10032|10033 | O439: 1|1|1|1 | P439: 2500|2500|2500|2500
A440: 434 | B440: 432 | C440: 30 | D440: =R[-20]C+2 -> 62 | E440: 1000 | F440: =MOD(RC[-5]-1,3)*30+100&"|"&MOD(RC[-5]-1,3)*30+101&"|"&MOD(RC[-5]-1,3)*30+102&"|"&MOD(RC[-5]-1,3)*30+103&"|"&IF(MOD(RC[-5],4)=0,HLOOKUP(Sheet1!R2C10,Sheet1!R2C10:R7C10,MOD(RC[-5]/4-1,6)+1,FALSE),IF(MOD(RC[-5],2)=0,IF(RC[-5]>20,HLOOKUP(Sheet1!R2C7,Sheet1!R2C7:R43C7,MOD(RC[-5]/2-1,42)+1,FALSE),HLOOKUP(Sheet1!R2C4,Sheet1!R2C4:R7C4,MOD(RC[-5]-1,6)+1,FALSE)),MOD(RC[-5]-1,3)*30+104)) -> 130|131|132|133|118 | G440: =HLOOKUP(Sheet1!R2C1,Sheet1!R2C1:R16C1,MOD(RC1-1,2)+MOD(INT((RC1-1)/2),3)*5+1,FALSE)&"|"&HLOOKUP(Sheet1!R2C1,Sheet1!R2C1:R16C1,MOD(RC1,2)+MOD(INT((RC1)/2),3)*5+1,FALSE)&"|"&HLOOKUP(Sheet1!R2C1,Sheet1!R2C1:R16C1,MOD(RC1+1,2)+MOD(INT((RC1+1)/2),3)*5+1,FALSE)&"|"&HLOOKUP(Sheet1!R2C1,Sheet1!R2C1:R16C1,MOD(RC1+2,2)+MOD(INT((RC1+2)/2),3)*5+1,FALSE)&"|"&HLOOKUP(Sheet1!R2C1,Sheet1!R2C1:R16C1,MOD(RC1+3,2)+MOD(INT((RC1+3)/2),3)*5+1,FALSE) -> 101|130|131|160|161 | H440: =HLOOKUP(Sheet1!R2C1,Sheet1!R2C1:R16C1,MOD(RC1+2,2)+MOD(INT((RC1+2)/2),3)*5+1,FALSE)&"|"&HLOOKUP(Sheet1!R2C1,Sheet1!R2C1:R16C1,MOD(RC1+3,2)+MOD(INT((RC1+3)/2),3)*5+1,FALSE)&"|"&HLOOKUP(Sheet1!R2C1,Sheet1!R2C1:R16C1,MOD(RC1+4,2)+MOD(INT((RC1+4)/2),3)*5+1,FALSE)&"|"&HLOOKUP(Sheet1!R2C1,Sheet1!R2C1:R16C1,MOD(RC1+5,2)+MOD(INT((RC1+5)/2),3)*5+1,FALSE)&"|"&HLOOKUP(Sheet1!R2C1,Sheet1!R2C1:R16C1,MOD(RC1+6,2)+MOD(INT((RC1+6)/2),3)*5+1,FALSE) -> 160|161|100|101|130 | I440: =HLOOKUP(Sheet1!R2C1,Sheet1!R2C1:R16C1,MOD(RC1-1,3)+MOD(INT((RC1-1)/3),3)*5+3,FALSE)&"|"&HLOOKUP(Sheet1!R2C1,Sheet1!R2C1:R16C1,MOD(RC1,3)+MOD(INT((RC1)/3),3)*5+3,FALSE)&"|"&HLOOKUP(Sheet1!R2C1,Sheet1!R2C1:R16C1,MOD(RC1+1,3)+MOD(INT((RC1+1)/3),3)*5+3,FALSE)&"|"&HLOOKUP(Sheet1!R2C1,Sheet1!R2C1:R16C1,MOD(RC1+2,3)+MOD(INT((RC1+2)/3),3)*5+3,FALSE)&"|"&HLOOKUP(Sheet1!R2C1,Sheet1!R2C1:R16C1,MOD(RC1+3,3)+MOD(INT((RC1+3)/3),3)*5+3,FALSE) -> 103|104|132|133|134 | J440: =HLOOKUP(Sheet1!R2C1,Sheet1!R2C1:R16C1,MOD(RC1-1,3)+MOD(INT((RC1-1)/3),3)*5+3,FALSE)&"|"&HLOOKUP(Sheet1!R2C1,Sheet1!R2C1:R16C1,MOD(RC1,3)+MOD(INT((RC1)/3),3)*5+3,FALSE)&"|"&HLOOKUP(Sheet1!R2C1,Sheet1!R2C1:R16C1,MOD(RC1+1,3)+MOD(INT((RC1+1)/3),3)*5+3,FALSE)&"|"&HLOOKUP(Sheet1!R2C1,Sheet1!R2C1:R16C1,MOD(RC1+2,3)+MOD(INT((RC1+2)/3),3)*5+3,FALSE)&"|"&HLOOKUP(Sheet1!R2C1,Sheet1!R2C1:R16C1,MOD(RC1+3,3)+MOD(INT((RC1+3)/3),3)*5+3,FALSE) -> 103|104|132|133|134 | K440: =HLOOKUP(Sheet1!R2C1,Sheet1!R2C1:R16C1,MOD(RC1-1,3)+MOD(INT((RC1-1)/3),3)*5+3,FALSE)&"|"&HLOOKUP(Sheet1!R2C1,Sheet1!R2C1:R16C1,MOD(RC1,3)+MOD(INT((RC1)/3),3)*5+3,FALSE)&"|"&HLOOKUP(Sheet1!R2C1,Sheet1!R2C1:R16C1,MOD(RC1+1,3)+MOD(INT((RC1+1)/3),3)*5+3,FALSE)&"|"&HLOOKUP(Sheet1!R2C1,Sheet1!R2C1:R16C1,MOD(RC1+2,3)+MOD(INT((RC1+2)/3),3)*5+3,FALSE)&"|"&HLOOKUP(Sheet1!R2C1,Sheet1!R2C1:R16C1,MOD(RC1+3,3)+MOD(INT((RC1+3)/3),3)*5+3,FALSE) -> 103|104|132|133|134 | L440: 25|22|23|24 | M440: 8825035|8825035|8825035|8825035 | N440: 10030|10031|10032|10033 | O440: 1|1|1|1 | P440: 2500|2500|2500|2500
A441: 435 | B441: 433 | C441: 30 | D441: =R[-20]C+2 -> 62 | E441: 1000 | F441: =MOD(RC[-5]-1,3)*30+100&"|"&MOD(RC[-5]-1,3)*30+101&"|"&MOD(RC[-5]-1,3)*30+102&"|"&MOD(RC[-5]-1,3)*30+103&"|"&IF(MOD(RC[-5],4)=0,HLOOKUP(Sheet1!R2C10,Sheet1!R2C10:R7C10,MOD(RC[-5]/4-1,6)+1,FALSE),IF(MOD(RC[-5],2)=0,IF(RC[-5]>20,HLOOKUP(Sheet1!R2C7,Sheet1!R2C7:R43C7,MOD(RC[-5]/2-1,42)+1,FALSE),HLOOKUP(Sheet1!R2C4,Sheet1!R2C4:R7C4,MOD(RC[-5]-1,6)+1,FALSE)),MOD(RC[-5]-1,3)*30+104)) -> 160|161|162|163|164 | G441: =HLOOKUP(Sheet1!R2C1,Sheet1!R2C1:R16C1,MOD(RC1-1,2)+MOD(INT((RC1-1)/2),3)*5+1,FALSE)&"|"&HLOOKUP(Sheet1!R2C1,Sheet1!R2C1:R16C1,MOD(RC1,2)+MOD(INT((RC1)/2),3)*5+1,FALSE)&"|"&HLOOKUP(Sheet1!R2C1,Sheet1!R2C1:R16C1,MOD(RC1+1,2)+MOD(INT((RC1+1)/2),3)*5+1,FALSE)&"|"&HLOOKUP(Sheet1!R2C1,Sheet1!R2C1:R16C1,MOD(RC1+2,2)+MOD(INT((RC1+2)/2),3)*5+1,FALSE)&"|"&HLOOKUP(Sheet1!R2C1,Sheet1!R2C1:R16C1,MOD(RC1+3,2)+MOD(INT((RC1+3)/2),3)*5+1,FALSE) -> 130|131|160|161|100 | H441: =HLOOKUP(Sheet1!R2C1,Sheet1!R2C1:R16C1,MOD(RC1+2,2)+MOD(INT((RC1+2)/2),3)*5+1,FALSE)&"|"&HLOOKUP(Sheet1!R2C1,Sheet1!R2C1:R16C1,MOD(RC1+3,2)+MOD(INT((RC1+3)/2),3)*5+1,FALSE)&"|"&HLOOKUP(Sheet1!R2C1,Sheet1!R2C1:R16C1,MOD(RC1+4,2)+MOD(INT((RC1+4)/2),3)*5+1,FALSE)&"|"&HLOOKUP(Sheet1!R2C1,Sheet1!R2C1:R16C1,MOD(RC1+5,2)+MOD(INT((RC1+5)/2),3)*5+1,FALSE)&"|"&HLOOKUP(Sheet1!R2C1,Sheet1!R2C1:R16C1,MOD(RC1+6,2)+MOD(INT((RC1+6)/2),3)*5+1,FALSE) -> 161|100|101|130|131 | I441: =HLOOKUP(Sheet1!R2C1,Sheet1!R2C1:R16C1,MOD(RC1-1,3)+MOD(INT((RC1-1)/3),3)*5+3,FALSE)&"|"&HLOOKUP(Sheet1!R2C1,Sheet1!R2C1:R16C1,MOD(RC1,3)+MOD(INT((RC1)/3),3)*5+3,FALSE)&"|"&HLOOKUP(Sheet1!R2C1,Sheet1!R2C1:R16C1,MOD(RC1+1,3)+MOD(INT((RC1+1)/3),3)*5+3,FALSE)&"|"&HLOOKUP(Sheet1!R2C1,Sheet1!R2C1:R16C1,MOD(RC1+2,3)+MOD(INT((RC1+2)/3),3)*5+3,FALSE)&"|"&HLOOKUP(Sheet1!R2C1,Sheet1!R2C1:R16C1,MOD(RC1+3,3)+MOD(INT((RC1+3)/3),3)*5+3,FALSE) -> 104|132|133|134|162 | J441: =HLOOKUP(Sheet1!R2C1,Sheet1!R2C1:R16C1,MOD(RC1-1,3)+MOD(INT((RC1-1)/3),3)*5+3,FALSE)&"|"&HLOOKUP(Sheet1!R2C1,Sheet1!R2C1:R16C1,MOD(RC1,3)+MOD(INT((RC1)/3),3)*5+3,FALSE)&"|"&HLOOKUP(Sheet1!R2C1,Sheet1!R2C1:R16C1,MOD(RC1+1,3)+MOD(INT((RC1+1)/3),3)*5+3,FALSE)&"|"&HLOOKUP(Sheet1!R2C1,Sheet1!R2C1:R16C1,MOD(RC1+2,3)+MOD(INT((RC1+2)/3),3)*5+3,FALSE)&"|"&HLOOKUP(Sheet1!R2C1,Sheet1!R2C1:R16C1,MOD(RC1+3,3)+MOD(INT((RC1+3)/3),3)*5+3,FALSE) -> 104|132|133|134|162 | K441: =HLOOKUP(Sheet1!R2C1,Sheet1!R2C1:R16C1,MOD(RC1-1,3)+MOD(INT((RC1-1)/3),3)*5+3,FALSE)&"|"&HLOOKUP(Sheet1!R2C1,Sheet1!R2C1:R16C1,MOD(RC1,3)+MOD(INT((RC1)/3),3)*5+3,FALSE)&"|"&HLOOKUP(Sheet1!R2C1,Sheet1!R2C1:R16C1,MOD(RC1+1,3)+MOD(INT((RC1+1)/3),3)*5+3,FALSE)&"|"&HLOOKUP(Sheet1!R2C1,Sheet1!R2C1:R16C1,MOD(RC1+2,3)+MOD(INT((RC1+2)/3),3)*5+3,FALSE)&"|"&HLOOKUP(Sheet1!R2C1,Sheet1!R2C1:R16C1,MOD(RC1+3,3)+MOD(INT((RC1+3)/3),3)*5+3,FALSE) -> 104|132|133|134|162 | L441: 25|22|23|24 | M441: 8901482|8901483|8901483|8901483 | N441: 10030|10031|10032|10033|10030|10031|10032|10033|10030|10031|10032|10033|10030|10031|10032|10033|10030|10031|10032|10033|10030|10031|10032|10033|10030|10031|10032|10033|10030|10031|10032|10033|10030|10031|10032|10033|10030|10031|10032|10033 | O441: 1|1|1|1|1|1|1|1|1|1|1|1|1|1|1|1|1|1|1|1|1|1|1|1|1|1|1|1|1|1|1|1|1|1|1|1|1|1|1|1 | P441: 2500|2500|2500|2500|2500|2500|2500|2500|2500|2500|2500|2500|2500|2500|2500|2500|2500|2500|2500|2500|2500|2500|2500|2500|2500|2500|2500|2500|2500|2500|2500|2500|2500|2500|2500|2500|2500|2500|2500|2500
A442: 436 | B442: 434 | C442: 30 | D442: =R[-20]C+2 -> 62 | E442: 1000 | F442: =MOD(RC[-5]-1,3)*30+100&"|"&MOD(RC[-5]-1,3)*30+101&"|"&MOD(RC[-5]-1,3)*30+102&"|"&MOD(RC[-5]-1,3)*30+103&"|"&IF(MOD(RC[-5],4)=0,HLOOKUP(Sheet1!R2C10,Sheet1!R2C10:R7C10,MOD(RC[-5]/4-1,6)+1,FALSE),IF(MOD(RC[-5],2)=0,IF(RC[-5]>20,HLOOKUP(Sheet1!R2C7,Sheet1!R2C7:R43C7,MOD(RC[-5]/2-1,42)+1,FALSE),HLOOKUP(Sheet1!R2C4,Sheet1!R2C4:R7C4,MOD(RC[-5]-1,6)+1,FALSE)),MOD(RC[-5]-1,3)*30+104)) -> 100|101|102|103|190 | G442: =HLOOKUP(Sheet1!R2C1,Sheet1!R2C1:R16C1,MOD(RC1-1,2)+MOD(INT((RC1-1)/2),3)*5+1,FALSE)&"|"&HLOOKUP(Sheet1!R2C1,Sheet1!R2C1:R16C1,MOD(RC1,2)+MOD(INT((RC1)/2),3)*5+1,FALSE)&"|"&HLOOKUP(Sheet1!R2C1,Sheet1!R2C1:R16C1,MOD(RC1+1,2)+MOD(INT((RC1+1)/2),3)*5+1,FALSE)&"|"&HLOOKUP(Sheet1!R2C1,Sheet1!R2C1:R16C1,MOD(RC1+2,2)+MOD(INT((RC1+2)/2),3)*5+1,FALSE)&"|"&HLOOKUP(Sheet1!R2C1,Sheet1!R2C1:R16C1,MOD(RC1+3,2)+MOD(INT((RC1+3)/2),3)*5+1,FALSE) -> 131|160|161|100|101 | H442: =HLOOKUP(Sheet1!R2C1,Sheet1!R2C1:R16C1,MOD(RC1+2,2)+MOD(INT((RC1+2)/2),3)*5+1,FALSE)&"|"&HLOOKUP(Sheet1!R2C1,Sheet1!R2C1:R16C1,MOD(RC1+3,2)+MOD(INT((RC1+3)/2),3)*5+1,FALSE)&"|"&HLOOKUP(Sheet1!R2C1,Sheet1!R2C1:R16C1,MOD(RC1+4,2)+MOD(INT((RC1+4)/2),3)*5+1,FALSE)&"|"&HLOOKUP(Sheet1!R2C1,Sheet1!R2C1:R16C1,MOD(RC1+5,2)+MOD(INT((RC1+5)/2),3)*5+1,FALSE)&"|"&HLOOKUP(Sheet1!R2C1,Sheet1!R2C1:R16C1,MOD(RC1+6,2)+MOD(INT((RC1+6)/2),3)*5+1,FALSE) -> 100|101|130|131|160 | I442: =HLOOKUP(Sheet1!R2C1,Sheet1!R2C1:R16C1,MOD(RC1-1,3)+MOD(INT((RC1-1)/3),3)*5+3,FALSE)&"|"&HLOOKUP(Sheet1!R2C1,Sheet1!R2C1:R16C1,MOD(RC1,3)+MOD(INT((RC1)/3),3)*5+3,FALSE)&"|"&HLOOKUP(Sheet1!R2C1,Sheet1!R2C1:R16C1,MOD(RC1+1,3)+MOD(INT((RC1+1)/3),3)*5+3,FALSE)&"|"&HLOOKUP(Sheet1!R2C1,Sheet1!R2C1:R16C1,MOD(RC1+2,3)+MOD(INT((RC1+2)/3),3)*5+3,FALSE)&"|"&HLOOKUP(Sheet1!R2C1,Sheet1!R2C1:R16C1,MOD(RC1+3,3)+MOD(INT((RC1+3)/3),3)*5+3,FALSE) -> 132|133|134|162|163 | J442: =HLOOKUP(Sheet1!R2C1,Sheet1!R2C1:R16C1,MOD(RC1-1,3)+MOD(INT((RC1-1)/3),3)*5+3,FALSE)&"|"&HLOOKUP(Sheet1!R2C1,Sheet1!R2C1:R16C1,MOD(RC1,3)+MOD(INT((RC1)/3),3)*5+3,FALSE)&"|"&HLOOKUP(Sheet1!R2C1,Sheet1!R2C1:R16C1,MOD(RC1+1,3)+MOD(INT((RC1+1)/3),3)*5+3,FALSE)&"|"&HLOOKUP(Sheet1!R2C1,Sheet1!R2C1:R16C1,MOD(RC1+2,3)+MOD(INT((RC1+2)/3),3)*5+3,FALSE)&"|"&HLOOKUP(Sheet1!R2C1,Sheet1!R2C1:R16C1,MOD(RC1+3,3)+MOD(INT((RC1+3)/3),3)*5+3,FALSE) -> 132|133|134|162|163 | K442: =HLOOKUP(Sheet1!R2C1,Sheet1!R2C1:R16C1,MOD(RC1-1,3)+MOD(INT((RC1-1)/3),3)*5+3,FALSE)&"|"&HLOOKUP(Sheet1!R2C1,Sheet1!R2C1:R16C1,MOD(RC1,3)+MOD(INT((RC1)/3),3)*5+3,FALSE)&"|"&HLOOKUP(Sheet1!R2C1,Sheet1!R2C1:R16C1,MOD(RC1+1,3)+MOD(INT((RC1+1)/3),3)*5+3,FALSE)&"|"&HLOOKUP(Sheet1!R2C1,Sheet1!R2C1:R16C1,MOD(RC1+2,3)+MOD(INT((RC1+2)/3),3)*5+3,FALSE)&"|"&HLOOKUP(Sheet1!R2C1,Sheet1!R2C1:R16C1,MOD(RC1+3,3)+MOD(INT((RC1+3)/3),3)*5+3,FALSE) -> 132|133|134|162|163 | L442: 25|22|23|24 | M442: 8980020|8980020|8980020|8980020 | N442: 10030|10031|10032|10033 | O442: 1|1|1|1 | P442: 2500|2500|2500|2500
A443: 437 | B443: 435 | C443: 30 | D443: =R[-20]C+2 -> 62 | E443: 1000 | F443: =MOD(RC[-5]-1,3)*30+100&"|"&MOD(RC[-5]-1,3)*30+101&"|"&MOD(RC[-5]-1,3)*30+102&"|"&MOD(RC[-5]-1,3)*30+103&"|"&IF(MOD(RC[-5],4)=0,HLOOKUP(Sheet1!R2C10,Sheet1!R2C10:R7C10,MOD(RC[-5]/4-1,6)+1,FALSE),IF(MOD(RC[-5],2)=0,IF(RC[-5]>20,HLOOKUP(Sheet1!R2C7,Sheet1!R2C7:R43C7,MOD(RC[-5]/2-1,42)+1,FALSE),HLOOKUP(Sheet1!R2C4,Sheet1!R2C4:R7C4,MOD(RC[-5]-1,6)+1,FALSE)),MOD(RC[-5]-1,3)*30+104)) -> 130|131|132|133|134 | G443: =HLOOKUP(Sheet1!R2C1,Sheet1!R2C1:R16C1,MOD(RC1-1,2)+MOD(INT((RC1-1)/2),3)*5+1,FALSE)&"|"&HLOOKUP(Sheet1!R2C1,Sheet1!R2C1:R16C1,MOD(RC1,2)+MOD(INT((RC1)/2),3)*5+1,FALSE)&"|"&HLOOKUP(Sheet1!R2C1,Sheet1!R2C1:R16C1,MOD(RC1+1,2)+MOD(INT((RC1+1)/2),3)*5+1,FALSE)&"|"&HLOOKUP(Sheet1!R2C1,Sheet1!R2C1:R16C1,MOD(RC1+2,2)+MOD(INT((RC1+2)/2),3)*5+1,FALSE)&"|"&HLOOKUP(Sheet1!R2C1,Sheet1!R2C1:R16C1,MOD(RC1+3,2)+MOD(INT((RC1+3)/2),3)*5+1,FALSE) -> 160|161|100|101|130 | H443: =HLOOKUP(Sheet1!R2C1,Sheet1!R2C1:R16C1,MOD(RC1+2,2)+MOD(INT((RC1+2)/2),3)*5+1,FALSE)&"|"&HLOOKUP(Sheet1!R2C1,Sheet1!R2C1:R16C1,MOD(RC1+3,2)+MOD(INT((RC1+3)/2),3)*5+1,FALSE)&"|"&HLOOKUP(Sheet1!R2C1,Sheet1!R2C1:R16C1,MOD(RC1+4,2)+MOD(INT((RC1+4)/2),3)*5+1,FALSE)&"|"&HLOOKUP(Sheet1!R2C1,Sheet1!R2C1:R16C1,MOD(RC1+5,2)+MOD(INT((RC1+5)/2),3)*5+1,FALSE)&"|"&HLOOKUP(Sheet1!R2C1,Sheet1!R2C1:R16C1,MOD(RC1+6,2)+MOD(INT((RC1+6)/2),3)*5+1,FALSE) -> 101|130|131|160|161 | I443: =HLOOKUP(Sheet1!R2C1,Sheet1!R2C1:R16C1,MOD(RC1-1,3)+MOD(INT((RC1-1)/3),3)*5+3,FALSE)&"|"&HLOOKUP(Sheet1!R2C1,Sheet1!R2C1:R16C1,MOD(RC1,3)+MOD(INT((RC1)/3),3)*5+3,FALSE)&"|"&HLOOKUP(Sheet1!R2C1,Sheet1!R2C1:R16C1,MOD(RC1+1,3)+MOD(INT((RC1+1)/3),3)*5+3,FALSE)&"|"&HLOOKUP(Sheet1!R2C1,Sheet1!R2C1:R16C1,MOD(RC1+2,3)+MOD(INT((RC1+2)/3),3)*5+3,FALSE)&"|"&HLOOKUP(Sheet1!R2C1,Sheet1!R2C1:R16C1,MOD(RC1+3,3)+MOD(INT((RC1+3)/3),3)*5+3,FALSE) -> 133|134|162|163|164 | J443: =HLOOKUP(Sheet1!R2C1,Sheet1!R2C1:R16C1,MOD(RC1-1,3)+MOD(INT((RC1-1)/3),3)*5+3,FALSE)&"|"&HLOOKUP(Sheet1!R2C1,Sheet1!R2C1:R16C1,MOD(RC1,3)+MOD(INT((RC1)/3),3)*5+3,FALSE)&"|"&HLOOKUP(Sheet1!R2C1,Sheet1!R2C1:R16C1,MOD(RC1+1,3)+MOD(INT((RC1+1)/3),3)*5+3,FALSE)&"|"&HLOOKUP(Sheet1!R2C1,Sheet1!R2C1:R16C1,MOD(RC1+2,3)+MOD(INT((RC1+2)/3),3)*5+3,FALSE)&"|"&HLOOKUP(Sheet1!R2C1,Sheet1!R2C1:R16C1,MOD(RC1+3,3)+MOD(INT((RC1+3)/3),3)*5+3,FALSE) -> 133|134|162|163|164 | K443: =HLOOKUP(Sheet1!R2C1,Sheet1!R2C1:R16C1,MOD(RC1-1,3)+MOD(INT((RC1-1)/3),3)*5+3,FALSE)&"|"&HLOOKUP(Sheet1!R2C1,Sheet1!R2C1:R16C1,MOD(RC1,3)+MOD(INT((RC1)/3),3)*5+3,FALSE)&"|"&HLOOKUP(Sheet1!R2C1,Sheet1!R2C1:R16C1,MOD(RC1+1,3)+MOD(INT((RC1+1)/3),3)*5+3,FALSE)&"|"&HLOOKUP(Sheet1!R2C1,Sheet1!R2C1:R16C1,MOD(RC1+2,3)+MOD(INT((RC1+2)/3),3)*5+3,FALSE)&"|"&HLOOKUP(Sheet1!R2C1,Sheet1!R2C1:R16C1,MOD(RC1+3,3)+MOD(INT((RC1+3)/3),3)*5+3,FALSE) -> 133|134|162|163|164 | L443: 25|22|23|24 | M443: 9055285|9055285|9055285|9055285 | N443: 10030|10031|10032|10033 | O443: 1|1|1|1 | P443: 2500|2500|2500|2500
A444: 438 | B444: 436 | C444: 30 | D444: =R[-20]C+2 -> 62 | E444: 1000 | F444: =MOD(RC[-5]-1,3)*30+100&"|"&MOD(RC[-5]-1,3)*30+101&"|"&MOD(RC[-5]-1,3)*30+102&"|"&MOD(RC[-5]-1,3)*30+103&"|"&IF(MOD(RC[-5],4)=0,HLOOKUP(Sheet1!R2C10,Sheet1!R2C10:R7C10,MOD(RC[-5]/4-1,6)+1,FALSE),IF(MOD(RC[-5],2)=0,IF(RC[-5]>20,HLOOKUP(Sheet1!R2C7,Sheet1!R2C7:R43C7,MOD(RC[-5]/2-1,42)+1,FALSE),HLOOKUP(Sheet1!R2C4,Sheet1!R2C4:R7C4,MOD(RC[-5]-1,6)+1,FALSE)),MOD(RC[-5]-1,3)*30+104)) -> 160|161|162|163|120 | G444: =HLOOKUP(Sheet1!R2C1,Sheet1!R2C1:R16C1,MOD(RC1-1,2)+MOD(INT((RC1-1)/2),3)*5+1,FALSE)&"|"&HLOOKUP(Sheet1!R2C1,Sheet1!R2C1:R16C1,MOD(RC1,2)+MOD(INT((RC1)/2),3)*5+1,FALSE)&"|"&HLOOKUP(Sheet1!R2C1,Sheet1!R2C1:R16C1,MOD(RC1+1,2)+MOD(INT((RC1+1)/2),3)*5+1,FALSE)&"|"&HLOOKUP(Sheet1!R2C1,Sheet1!R2C1:R16C1,MOD(RC1+2,2)+MOD(INT((RC1+2)/2),3)*5+1,FALSE)&"|"&HLOOKUP(Sheet1!R2C1,Sheet1!R2C1:R16C1,MOD(RC1+3,2)+MOD(INT((RC1+3)/2),3)*5+1,FALSE) -> 161|100|101|130|131 | H444: =HLOOKUP(Sheet1!R2C1,Sheet1!R2C1:R16C1,MOD(RC1+2,2)+MOD(INT((RC1+2)/2),3)*5+1,FALSE)&"|"&HLOOKUP(Sheet1!R2C1,Sheet1!R2C1:R16C1,MOD(RC1+3,2)+MOD(INT((RC1+3)/2),3)*5+1,FALSE)&"|"&HLOOKUP(Sheet1!R2C1,Sheet1!R2C1:R16C1,MOD(RC1+4,2)+MOD(INT((RC1+4)/2),3)*5+1,FALSE)&"|"&HLOOKUP(Sheet1!R2C1,Sheet1!R2C1:R16C1,MOD(RC1+5,2)+MOD(INT((RC1+5)/2),3)*5+1,FALSE)&"|"&HLOOKUP(Sheet1!R2C1,Sheet1!R2C1:R16C1,MOD(RC1+6,2)+MOD(INT((RC1+6)/2),3)*5+1,FALSE) -> 130|131|160|161|100 | I444: =HLOOKUP(Sheet1!R2C1,Sheet1!R2C1:R16C1,MOD(RC1-1,3)+MOD(INT((RC1-1)/3),3)*5+3,FALSE)&"|"&HLOOKUP(Sheet1!R2C1,Sheet1!R2C1:R16C1,MOD(RC1,3)+MOD(INT((RC1)/3),3)*5+3,FALSE)&"|"&HLOOKUP(Sheet1!R2C1,Sheet1!R2C1:R16C1,MOD(RC1+1,3)+MOD(INT((RC1+1)/3),3)*5+3,FALSE)&"|"&HLOOKUP(Sheet1!R2C1,Sheet1!R2C1:R16C1,MOD(RC1+2,3)+MOD(INT((RC1+2)/3),3)*5+3,FALSE)&"|"&HLOOKUP(Sheet1!R2C1,Sheet1!R2C1:R16C1,MOD(RC1+3,3)+MOD(INT((RC1+3)/3),3)*5+3,FALSE) -> 134|162|163|164|102 | J444: =HLOOKUP(Sheet1!R2C1,Sheet1!R2C1:R16C1,MOD(RC1-1,3)+MOD(INT((RC1-1)/3),3)*5+3,FALSE)&"|"&HLOOKUP(Sheet1!R2C1,Sheet1!R2C1:R16C1,MOD(RC1,3)+MOD(INT((RC1)/3),3)*5+3,FALSE)&"|"&HLOOKUP(Sheet1!R2C1,Sheet1!R2C1:R16C1,MOD(RC1+1,3)+MOD(INT((RC1+1)/3),3)*5+3,FALSE)&"|"&HLOOKUP(Sheet1!R2C1,Sheet1!R2C1:R16C1,MOD(RC1+2,3)+MOD(INT((RC1+2)/3),3)*5+3,FALSE)&"|"&HLOOKUP(Sheet1!R2C1,Sheet1!R2C1:R16C1,MOD(RC1+3,3)+MOD(INT((RC1+3)/3),3)*5+3,FALSE) -> 134|162|163|164|102 | K444: =HLOOKUP(Sheet1!R2C1,Sheet1!R2C1:R16C1,MOD(RC1-1,3)+MOD(INT((RC1-1)/3),3)*5+3,FALSE)&"|"&HLOOKUP(Sheet1!R2C1,Sheet1!R2C1:R16C1,MOD(RC1,3)+MOD(INT((RC1)/3),3)*5+3,FALSE)&"|"&HLOOKUP(Sheet1!R2C1,Sheet1!R2C1:R16C1,MOD(RC1+1,3)+MOD(INT((RC1+1)/3),3)*5+3,FALSE)&"|"&HLOOKUP(Sheet1!R2C1,Sheet1!R2C1:R16C1,MOD(RC1+2,3)+MOD(INT((RC1+2)/3),3)*5+3,FALSE)&"|"&HLOOKUP(Sheet1!R2C1,Sheet1!R2C1:R16C1,MOD(RC1+3,3)+MOD(INT((RC1+3)/3),3)*5+3,FALSE) -> 134|162|163|164|102 | L444: 25|22|23|24 | M444: 9133823|9133824|9133823|9133823 | N444: 10030|10031|10032|10033 | O444: 1|1|1|1 | P444: 2500|2500|2500|2500
A445: 439 | B445: 437 | C445: 30 | D445: =R[-20]C+2 -> 62 | E445: 1000 | F445: =MOD(RC[-5]-1,3)*30+100&"|"&MOD(RC[-5]-1,3)*30+101&"|"&MOD(RC[-5]-1,3)*30+102&"|"&MOD(RC[-5]-1,3)*30+103&"|"&IF(MOD(RC[-5],4)=0,HLOOKUP(Sheet1!R2C10,Sheet1!R2C10:R7C10,MOD(RC[-5]/4-1,6)+1,FALSE),IF(MOD(RC[-5],2)=0,IF(RC[-5]>20,HLOOKUP(Sheet1!R2C7,Sheet1!R2C7:R43C7,MOD(RC[-5]/2-1,42)+1,FALSE),HLOOKUP(Sheet1!R2C4,Sheet1!R2C4:R7C4,MOD(RC[-5]-1,6)+1,FALSE)),MOD(RC[-5]-1,3)*30+104)) -> 100|101|102|103|104 | G445: =HLOOKUP(Sheet1!R2C1,Sheet1!R2C1:R16C1,MOD(RC1-1,2)+MOD(INT((RC1-1)/2),3)*5+1,FALSE)&"|"&HLOOKUP(Sheet1!R2C1,Sheet1!R2C1:R16C1,MOD(RC1,2)+MOD(INT((RC1)/2),3)*5+1,FALSE)&"|"&HLOOKUP(Sheet1!R2C1,Sheet1!R2C1:R16C1,MOD(RC1+1,2)+MOD(INT((RC1+1)/2),3)*5+1,FALSE)&"|"&HLOOKUP(Sheet1!R2C1,Sheet1!R2C1:R16C1,MOD(RC1+2,2)+MOD(INT((RC1+2)/2),3)*5+1,FALSE)&"|"&HLOOKUP(Sheet1!R2C1,Sheet1!R2C1:R16C1,MOD(RC1+3,2)+MOD(INT((RC1+3)/2),3)*5+1,FALSE) -> 100|101|130|131|160 | H445: =HLOOKUP(Sheet1!R2C1,Sheet1!R2C1:R16C1,MOD(RC1+2,2)+MOD(INT((RC1+2)/2),3)*5+1,FALSE)&"|"&HLOOKUP(Sheet1!R2C1,Sheet1!R2C1:R16C1,MOD(RC1+3,2)+MOD(INT((RC1+3)/2),3)*5+1,FALSE)&"|"&HLOOKUP(Sheet1!R2C1,Sheet1!R2C1:R16C1,MOD(RC1+4,2)+MOD(INT((RC1+4)/2),3)*5+1,FALSE)&"|"&HLOOKUP(Sheet1!R2C1,Sheet1!R2C1:R16C1,MOD(RC1+5,2)+MOD(INT((RC1+5)/2),3)*5+1,FALSE)&"|"&HLOOKUP(Sheet1!R2C1,Sheet1!R2C1:R16C1,MOD(RC1+6,2)+MOD(INT((RC1+6)/2),3)*5+1,FALSE) -> 131|160|161|100|101 | I445: =HLOOKUP(Sheet1!R2C1,Sheet1!R2C1:R16C1,MOD(RC1-1,3)+MOD(INT((RC1-1)/3),3)*5+3,FALSE)&"|"&HLOOKUP(Sheet1!R2C1,Sheet1!R2C1:R16C1,MOD(RC1,3)+MOD(INT((RC1)/3),3)*5+3,FALSE)&"|"&HLOOKUP(Sheet1!R2C1,Sheet1!R2C1:R16C1,MOD(RC1+1,3)+MOD(INT((RC1+1)/3),3)*5+3,FALSE)&"|"&HLOOKUP(Sheet1!R2C1,Sheet1!R2C1:R16C1,MOD(RC1+2,3)+MOD(INT((RC1+2)/3),3)*5+3,FALSE)&"|"&HLOOKUP(Sheet1!R2C1,Sheet1!R2C1:R16C1,MOD(RC1+3,3)+MOD(INT((RC1+3)/3),3)*5+3,FALSE) -> 162|163|164|102|103 | J445: =HLOOKUP(Sheet1!R2C1,Sheet1!R2C1:R16C1,MOD(RC1-1,3)+MOD(INT((RC1-1)/3),3)*5+3,FALSE)&"|"&HLOOKUP(Sheet1!R2C1,Sheet1!R2C1:R16C1,MOD(RC1,3)+MOD(INT((RC1)/3),3)*5+3,FALSE)&"|"&HLOOKUP(Sheet1!R2C1,Sheet1!R2C1:R16C1,MOD(RC1+1,3)+MOD(INT((RC1+1)/3),3)*5+3,FALSE)&"|"&HLOOKUP(Sheet1!R2C1,Sheet1!R2C1:R16C1,MOD(RC1+2,3)+MOD(INT((RC1+2)/3),3)*5+3,FALSE)&"|"&HLOOKUP(Sheet1!R2C1,Sheet1!R2C1:R16C1,MOD(RC1+3,3)+MOD(INT((RC1+3)/3),3)*5+3,FALSE) -> 162|163|164|102|103 | K445: =HLOOKUP(Sheet1!R2C1,Sheet1!R2C1:R16C1,MOD(RC1-1,3)+MOD(INT((RC1-1)/3),3)*5+3,FALSE)&"|"&HLOOKUP(Sheet1!R2C1,Sheet1!R2C1:R16C1,MOD(RC1,3)+MOD(INT((RC1)/3),3)*5+3,FALSE)&"|"&HLOOKUP(Sheet1!R2C1,Sheet1!R2C1:R16C1,MOD(RC1+1,3)+MOD(INT((RC1+1)/3),3)*5+3,FALSE)&"|"&HLOOKUP(Sheet1!R2C1,Sheet1!R2C1:R16C1,MOD(RC1+2,3)+MOD(INT((RC1+2)/3),3)*5+3,FALSE)&"|"&HLOOKUP(Sheet1!R2C1,Sheet1!R2C1:R16C1,MOD(RC1+3,3)+MOD(INT((RC1+3)/3),3)*5+3,FALSE) -> 162|163|164|102|103 | L445: 25|22|23|24 | M445: 9212481|9212481|9212483|9212483 | N445: 10030|10031|10032|10033 | O445: 1|1|1|1 | P445: 2500|2500|2500|2500
A446: 440 | B446: 438 | C446: 30 | D446: =R[-20]C+2 -> 62 | E446: 1000 | F446: =MOD(RC[-5]-1,3)*30+100&"|"&MOD(RC[-5]-1,3)*30+101&"|"&MOD(RC[-5]-1,3)*30+102&"|"&MOD(RC[-5]-1,3)*30+103&"|"&IF(MOD(RC[-5],4)=0,HLOOKUP(Sheet1!R2C10,Sheet1!R2C10:R7C10,MOD(RC[-5]/4-1,6)+1,FALSE),IF(MOD(RC[-5],2)=0,IF(RC[-5]>20,HLOOKUP(Sheet1!R2C7,Sheet1!R2C7:R43C7,MOD(RC[-5]/2-1,42)+1,FALSE),HLOOKUP(Sheet1!R2C4,Sheet1!R2C4:R7C4,MOD(RC[-5]-1,6)+1,FALSE)),MOD(RC[-5]-1,3)*30+104)) -> 130|131|132|133|191 | G446: =HLOOKUP(Sheet1!R2C1,Sheet1!R2C1:R16C1,MOD(RC1-1,2)+MOD(INT((RC1-1)/2),3)*5+1,FALSE)&"|"&HLOOKUP(Sheet1!R2C1,Sheet1!R2C1:R16C1,MOD(RC1,2)+MOD(INT((RC1)/2),3)*5+1,FALSE)&"|"&HLOOKUP(Sheet1!R2C1,Sheet1!R2C1:R16C1,MOD(RC1+1,2)+MOD(INT((RC1+1)/2),3)*5+1,FALSE)&"|"&HLOOKUP(Sheet1!R2C1,Sheet1!R2C1:R16C1,MOD(RC1+2,2)+MOD(INT((RC1+2)/2),3)*5+1,FALSE)&"|"&HLOOKUP(Sheet1!R2C1,Sheet1!R2C1:R16C1,MOD(RC1+3,2)+MOD(INT((RC1+3)/2),3)*5+1,FALSE) -> 101|130|131|160|161 | H446: =HLOOKUP(Sheet1!R2C1,Sheet1!R2C1:R16C1,MOD(RC1+2,2)+MOD(INT((RC1+2)/2),3)*5+1,FALSE)&"|"&HLOOKUP(Sheet1!R2C1,Sheet1!R2C1:R16C1,MOD(RC1+3,2)+MOD(INT((RC1+3)/2),3)*5+1,FALSE)&"|"&HLOOKUP(Sheet1!R2C1,Sheet1!R2C1:R16C1,MOD(RC1+4,2)+MOD(INT((RC1+4)/2),3)*5+1,FALSE)&"|"&HLOOKUP(Sheet1!R2C1,Sheet1!R2C1:R16C1,MOD(RC1+5,2)+MOD(INT((RC1+5)/2),3)*5+1,FALSE)&"|"&HLOOKUP(Sheet1!R2C1,Sheet1!R2C1:R16C1,MOD(RC1+6,2)+MOD(INT((RC1+6)/2),3)*5+1,FALSE) -> 160|161|100|101|130 | I446: =HLOOKUP(Sheet1!R2C1,Sheet1!R2C1:R16C1,MOD(RC1-1,3)+MOD(INT((RC1-1)/3),3)*5+3,FALSE)&"|"&HLOOKUP(Sheet1!R2C1,Sheet1!R2C1:R16C1,MOD(RC1,3)+MOD(INT((RC1)/3),3)*5+3,FALSE)&"|"&HLOOKUP(Sheet1!R2C1,Sheet1!R2C1:R16C1,MOD(RC1+1,3)+MOD(INT((RC1+1)/3),3)*5+3,FALSE)&"|"&HLOOKUP(Sheet1!R2C1,Sheet1!R2C1:R16C1,MOD(RC1+2,3)+MOD(INT((RC1+2)/3),3)*5+3,FALSE)&"|"&HLOOKUP(Sheet1!R2C1,Sheet1!R2C1:R16C1,MOD(RC1+3,3)+MOD(INT((RC1+3)/3),3)*5+3,FALSE) -> 163|164|102|103|104 | J446: =HLOOKUP(Sheet1!R2C1,Sheet1!R2C1:R16C1,MOD(RC1-1,3)+MOD(INT((RC1-1)/3),3)*5+3,FALSE)&"|"&HLOOKUP(Sheet1!R2C1,Sheet1!R2C1:R16C1,MOD(RC1,3)+MOD(INT((RC1)/3),3)*5+3,FALSE)&"|"&HLOOKUP(Sheet1!R2C1,Sheet1!R2C1:R16C1,MOD(RC1+1,3)+MOD(INT((RC1+1)/3),3)*5+3,FALSE)&"|"&HLOOKUP(Sheet1!R2C1,Sheet1!R2C1:R16C1,MOD(RC1+2,3)+MOD(INT((RC1+2)/3),3)*5+3,FALSE)&"|"&HLOOKUP(Sheet1!R2C1,Sheet1!R2C1:R16C1,MOD(RC1+3,3)+MOD(INT((RC1+3)/3),3)*5+3,FALSE) -> 163|164|102|103|104 | K446: =HLOOKUP(Sheet1!R2C1,Sheet1!R2C1:R16C1,MOD(RC1-1,3)+MOD(INT((RC1-1)/3),3)*5+3,FALSE)&"|"&HLOOKUP(Sheet1!R2C1,Sheet1!R2C1:R16C1,MOD(RC1,3)+MOD(INT((RC1)/3),3)*5+3,FALSE)&"|"&HLOOKUP(Sheet1!R2C1,Sheet1!R2C1:R16C1,MOD(RC1+1,3)+MOD(INT((RC1+1)/3),3)*5+3,FALSE)&"|"&HLOOKUP(Sheet1!R2C1,Sheet1!R2C1:R16C1,MOD(RC1+2,3)+MOD(INT((RC1+2)/3),3)*5+3,FALSE)&"|"&HLOOKUP(Sheet1!R2C1,Sheet1!R2C1:R16C1,MOD(RC1+3,3)+MOD(INT((RC1+3)/3),3)*5+3,FALSE) -> 163|164|102|103|104 | L446: 25|22|23|24 | M446: 9293910|9293910|9293910|9293910 | N446: 10030|10031|10032|10033|10030|10031|10032|10033|10030|10031|10032|10033|10030|10031|10032|10033|10030|10031|10032|10033|10030|10031|10032|10033|10030|10031|10032|10033|10030|10031|10032|10033|10030|10031|10032|10033|10030|10031|10032|10033 | O446: 1|1|1|1|1|1|1|1|1|1|1|1|1|1|1|1|1|1|1|1|1|1|1|1|1|1|1|1|1|1|1|1|1|1|1|1|1|1|1|1 | P446: 2500|2500|2500|2500|2500|2500|2500|2500|2500|2500|2500|2500|2500|2500|2500|2500|2500|2500|2500|2500|2500|2500|2500|2500|2500|2500|2500|2500|2500|2500|2500|2500|2500|2500|2500|2500|2500|2500|2500|2500
A447: 441 | B447: 439 | C447: 30 | D447: =R[-20]C+2 -> 64 | E447: 1000 | F447: =MOD(RC[-5]-1,3)*30+100&"|"&MOD(RC[-5]-1,3)*30+101&"|"&MOD(RC[-5]-1,3)*30+102&"|"&MOD(RC[-5]-1,3)*30+103&"|"&IF(MOD(RC[-5],4)=0,HLOOKUP(Sheet1!R2C10,Sheet1!R2C10:R7C10,MOD(RC[-5]/4-1,6)+1,FALSE),IF(MOD(RC[-5],2)=0,IF(RC[-5]>20,HLOOKUP(Sheet1!R2C7,Sheet1!R2C7:R43C7,MOD(RC[-5]/2-1,42)+1,FALSE),HLOOKUP(Sheet1!R2C4,Sheet1!R2C4:R7C4,MOD(RC[-5]-1,6)+1,FALSE)),MOD(RC[-5]-1,3)*30+104)) -> 160|161|162|163|164 | G447: =HLOOKUP(Sheet1!R2C1,Sheet1!R2C1:R16C1,MOD(RC1-1,2)+MOD(INT((RC1-1)/2),3)*5+1,FALSE)&"|"&HLOOKUP(Sheet1!R2C1,Sheet1!R2C1:R16C1,MOD(RC1,2)+MOD(INT((RC1)/2),3)*5+1,FALSE)&"|"&HLOOKUP(Sheet1!R2C1,Sheet1!R2C1:R16C1,MOD(RC1+1,2)+MOD(INT((RC1+1)/2),3)*5+1,FALSE)&"|"&HLOOKUP(Sheet1!R2C1,Sheet1!R2C1:R16C1,MOD(RC1+2,2)+MOD(INT((RC1+2)/2),3)*5+1,FALSE)&"|"&HLOOKUP(Sheet1!R2C1,Sheet1!R2C1:R16C1,MOD(RC1+3,2)+MOD(INT((RC1+3)/2),3)*5+1,FALSE) -> 130|131|160|161|100 | H447: =HLOOKUP(Sheet1!R2C1,Sheet1!R2C1:R16C1,MOD(RC1+2,2)+MOD(INT((RC1+2)/2),3)*5+1,FALSE)&"|"&HLOOKUP(Sheet1!R2C1,Sheet1!R2C1:R16C1,MOD(RC1+3,2)+MOD(INT((RC1+3)/2),3)*5+1,FALSE)&"|"&HLOOKUP(Sheet1!R2C1,Sheet1!R2C1:R16C1,MOD(RC1+4,2)+MOD(INT((RC1+4)/2),3)*5+1,FALSE)&"|"&HLOOKUP(Sheet1!R2C1,Sheet1!R2C1:R16C1,MOD(RC1+5,2)+MOD(INT((RC1+5)/2),3)*5+1,FALSE)&"|"&HLOOKUP(Sheet1!R2C1,Sheet1!R2C1:R16C1,MOD(RC1+6,2)+MOD(INT((RC1+6)/2),3)*5+1,FALSE) -> 161|100|101|130|131 | I447: =HLOOKUP(Sheet1!R2C1,Sheet1!R2C1:R16C1,MOD(RC1-1,3)+MOD(INT((RC1-1)/3),3)*5+3,FALSE)&"|"&HLOOKUP(Sheet1!R2C1,Sheet1!R2C1:R16C1,MOD(RC1,3)+MOD(INT((RC1)/3),3)*5+3,FALSE)&"|"&HLOOKUP(Sheet1!R2C1,Sheet1!R2C1:R16C1,MOD(RC1+1,3)+MOD(INT((RC1+1)/3),3)*5+3,FALSE)&"|"&HLOOKUP(Sheet1!R2C1,Sheet1!R2C1:R16C1,MOD(RC1+2,3)+MOD(INT((RC1+2)/3),3)*5+3,FALSE)&"|"&HLOOKUP(Sheet1!R2C1,Sheet1!R2C1:R16C1,MOD(RC1+3,3)+MOD(INT((RC1+3)/3),3)*5+3,FALSE) -> 164|102|103|104|132 | J447: =HLOOKUP(Sheet1!R2C1,Sheet1!R2C1:R16C1,MOD(RC1-1,3)+MOD(INT((RC1-1)/3),3)*5+3,FALSE)&"|"&HLOOKUP(Sheet1!R2C1,Sheet1!R2C1:R16C1,MOD(RC1,3)+MOD(INT((RC1)/3),3)*5+3,FALSE)&"|"&HLOOKUP(Sheet1!R2C1,Sheet1!R2C1:R16C1,MOD(RC1+1,3)+MOD(INT((RC1+1)/3),3)*5+3,FALSE)&"|"&HLOOKUP(Sheet1!R2C1,Sheet1!R2C1:R16C1,MOD(RC1+2,3)+MOD(INT((RC1+2)/3),3)*5+3,FALSE)&"|"&HLOOKUP(Sheet1!R2C1,Sheet1!R2C1:R16C1,MOD(RC1+3,3)+MOD(INT((RC1+3)/3),3)*5+3,FALSE) -> 164|102|103|104|132 | K447: =HLOOKUP(Sheet1!R2C1,Sheet1!R2C1:R16C1,MOD(RC1-1,3)+MOD(INT((RC1-1)/3),3)*5+3,FALSE)&"|"&HLOOKUP(Sheet1!R2C1,Sheet1!R2C1:R16C1,MOD(RC1,3)+MOD(INT((RC1)/3),3)*5+3,FALSE)&"|"&HLOOKUP(Sheet1!R2C1,Sheet1!R2C1:R16C1,MOD(RC1+1,3)+MOD(INT((RC1+1)/3),3)*5+3,FALSE)&"|"&HLOOKUP(Sheet1!R2C1,Sheet1!R2C1:R16C1,MOD(RC1+2,3)+MOD(INT((RC1+2)/3),3)*5+3,FALSE)&"|"&HLOOKUP(Sheet1!R2C1,Sheet1!R2C1:R16C1,MOD(RC1+3,3)+MOD(INT((RC1+3)/3),3)*5+3,FALSE) -> 164|102|103|104|132 | L447: 25|22|23|24 | M447: 9371945|9371945|9371945|9371945 | N447: 10030|10031|10032|10033 | O447: 1|1|1|1 | P447: 2500|2500|2500|2500
A448: 442 | B448: 440 | C448: 30 | D448: =R[-20]C+2 -> 64 | E448: 1000 | F448: =MOD(RC[-5]-1,3)*30+100&"|"&MOD(RC[-5]-1,3)*30+101&"|"&MOD(RC[-5]-1,3)*30+102&"|"&MOD(RC[-5]-1,3)*30+103&"|"&IF(MOD(RC[-5],4)=0,HLOOKUP(Sheet1!R2C10,Sheet1!R2C10:R7C10,MOD(RC[-5]/4-1,6)+1,FALSE),IF(MOD(RC[-5],2)=0,IF(RC[-5]>20,HLOOKUP(Sheet1!R2C7,Sheet1!R2C7:R43C7,MOD(RC[-5]/2-1,42)+1,FALSE),HLOOKUP(Sheet1!R2C4,Sheet1!R2C4:R7C4,MOD(RC[-5]-1,6)+1,FALSE)),MOD(RC[-5]-1,3)*30+104)) -> 100|101|102|103|122 | G448: =HLOOKUP(Sheet1!R2C1,Sheet1!R2C1:R16C1,MOD(RC1-1,2)+MOD(INT((RC1-1)/2),3)*5+1,FALSE)&"|"&HLOOKUP(Sheet1!R2C1,Sheet1!R2C1:R16C1,MOD(RC1,2)+MOD(INT((RC1)/2),3)*5+1,FALSE)&"|"&HLOOKUP(Sheet1!R2C1,Sheet1!R2C1:R16C1,MOD(RC1+1,2)+MOD(INT((RC1+1)/2),3)*5+1,FALSE)&"|"&HLOOKUP(Sheet1!R2C1,Sheet1!R2C1:R16C1,MOD(RC1+2,2)+MOD(INT((RC1+2)/2),3)*5+1,FALSE)&"|"&HLOOKUP(Sheet1!R2C1,Sheet1!R2C1:R16C1,MOD(RC1+3,2)+MOD(INT((RC1+3)/2),3)*5+1,FALSE) -> 131|160|161|100|101 | H448: =HLOOKUP(Sheet1!R2C1,Sheet1!R2C1:R16C1,MOD(RC1+2,2)+MOD(INT((RC1+2)/2),3)*5+1,FALSE)&"|"&HLOOKUP(Sheet1!R2C1,Sheet1!R2C1:R16C1,MOD(RC1+3,2)+MOD(INT((RC1+3)/2),3)*5+1,FALSE)&"|"&HLOOKUP(Sheet1!R2C1,Sheet1!R2C1:R16C1,MOD(RC1+4,2)+MOD(INT((RC1+4)/2),3)*5+1,FALSE)&"|"&HLOOKUP(Sheet1!R2C1,Sheet1!R2C1:R16C1,MOD(RC1+5,2)+MOD(INT((RC1+5)/2),3)*5+1,FALSE)&"|"&HLOOKUP(Sheet1!R2C1,Sheet1!R2C1:R16C1,MOD(RC1+6,2)+MOD(INT((RC1+6)/2),3)*5+1,FALSE) -> 100|101|130|131|160 | I448: =HLOOKUP(Sheet1!R2C1,Sheet1!R2C1:R16C1,MOD(RC1-1,3)+MOD(INT((RC1-1)/3),3)*5+3,FALSE)&"|"&HLOOKUP(Sheet1!R2C1,Sheet1!R2C1:R16C1,MOD(RC1,3)+MOD(INT((RC1)/3),3)*5+3,FALSE)&"|"&HLOOKUP(Sheet1!R2C1,Sheet1!R2C1:R16C1,MOD(RC1+1,3)+MOD(INT((RC1+1)/3),3)*5+3,FALSE)&"|"&HLOOKUP(Sheet1!R2C1,Sheet1!R2C1:R16C1,MOD(RC1+2,3)+MOD(INT((RC1+2)/3),3)*5+3,FALSE)&"|"&HLOOKUP(Sheet1!R2C1,Sheet1!R2C1:R16C1,MOD(RC1+3,3)+MOD(INT((RC1+3)/3),3)*5+3,FALSE) -> 102|103|104|132|133 | J448: =HLOOKUP(Sheet1!R2C1,Sheet1!R2C1:R16C1,MOD(RC1-1,3)+MOD(INT((RC1-1)/3),3)*5+3,FALSE)&"|"&HLOOKUP(Sheet1!R2C1,Sheet1!R2C1:R16C1,MOD(RC1,3)+MOD(INT((RC1)/3),3)*5+3,FALSE)&"|"&HLOOKUP(Sheet1!R2C1,Sheet1!R2C1:R16C1,MOD(RC1+1,3)+MOD(INT((RC1+1)/3),3)*5+3,FALSE)&"|"&HLOOKUP(Sheet1!R2C1,Sheet1!R2C1:R16C1,MOD(RC1+2,3)+MOD(INT((RC1+2)/3),3)*5+3,FALSE)&"|"&HLOOKUP(Sheet1!R2C1,Sheet1!R2C1:R16C1,MOD(RC1+3,3)+MOD(INT((RC1+3)/3),3)*5+3,FALSE) -> 102|103|104|132|133 | K448: =HLOOKUP(Sheet1!R2C1,Sheet1!R2C1:R16C1,MOD(RC1-1,3)+MOD(INT((RC1-1)/3),3)*5+3,FALSE)&"|"&HLOOKUP(Sheet1!R2C1,Sheet1!R2C1:R16C1,MOD(RC1,3)+MOD(INT((RC1)/3),3)*5+3,FALSE)&"|"&HLOOKUP(Sheet1!R2C1,Sheet1!R2C1:R16C1,MOD(RC1+1,3)+MOD(INT((RC1+1)/3),3)*5+3,FALSE)&"|"&HLOOKUP(Sheet1!R2C1,Sheet1!R2C1:R16C1,MOD(RC1+2,3)+MOD(INT((RC1+2)/3),3)*5+3,FALSE)&"|"&HLOOKUP(Sheet1!R2C1,Sheet1!R2C1:R16C1,MOD(RC1+3,3)+MOD(INT((RC1+3)/3),3)*5+3,FALSE) -> 102|103|104|132|133 | L448: 25|22|23|24 | M448: 9453373|9453373|9453373|9453373 | N448: 10030|10031|10032|10033 | O448: 1|1|1|1 | P448: 2500|2500|2500|2500
A449: 443 | B449: 441 | C449: 30 | D449: =R[-20]C+2 -> 64 | E449: 1000 | F449: =MOD(RC[-5]-1,3)*30+100&"|"&MOD(RC[-5]-1,3)*30+101&"|"&MOD(RC[-5]-1,3)*30+102&"|"&MOD(RC[-5]-1,3)*30+103&"|"&IF(MOD(RC[-5],4)=0,HLOOKUP(Sheet1!R2C10,Sheet1!R2C10:R7C10,MOD(RC[-5]/4-1,6)+1,FALSE),IF(MOD(RC[-5],2)=0,IF(RC[-5]>20,HLOOKUP(Sheet1!R2C7,Sheet1!R2C7:R43C7,MOD(RC[-5]/2-1,42)+1,FALSE),HLOOKUP(Sheet1!R2C4,Sheet1!R2C4:R7C4,MOD(RC[-5]-1,6)+1,FALSE)),MOD(RC[-5]-1,3)*30+104)) -> 130|131|132|133|134 | G449: =HLOOKUP(Sheet1!R2C1,Sheet1!R2C1:R16C1,MOD(RC1-1,2)+MOD(INT((RC1-1)/2),3)*5+1,FALSE)&"|"&HLOOKUP(Sheet1!R2C1,Sheet1!R2C1:R16C1,MOD(RC1,2)+MOD(INT((RC1)/2),3)*5+1,FALSE)&"|"&HLOOKUP(Sheet1!R2C1,Sheet1!R2C1:R16C1,MOD(RC1+1,2)+MOD(INT((RC1+1)/2),3)*5+1,FALSE)&"|"&HLOOKUP(Sheet1!R2C1,Sheet1!R2C1:R16C1,MOD(RC1+2,2)+MOD(INT((RC1+2)/2),3)*5+1,FALSE)&"|"&HLOOKUP(Sheet1!R2C1,Sheet1!R2C1:R16C1,MOD(RC1+3,2)+MOD(INT((RC1+3)/2),3)*5+1,FALSE) -> 160|161|100|101|130 | H449: =HLOOKUP(Sheet1!R2C1,Sheet1!R2C1:R16C1,MOD(RC1+2,2)+MOD(INT((RC1+2)/2),3)*5+1,FALSE)&"|"&HLOOKUP(Sheet1!R2C1,Sheet1!R2C1:R16C1,MOD(RC1+3,2)+MOD(INT((RC1+3)/2),3)*5+1,FALSE)&"|"&HLOOKUP(Sheet1!R2C1,Sheet1!R2C1:R16C1,MOD(RC1+4,2)+MOD(INT((RC1+4)/2),3)*5+1,FALSE)&"|"&HLOOKUP(Sheet1!R2C1,Sheet1!R2C1:R16C1,MOD(RC1+5,2)+MOD(INT((RC1+5)/2),3)*5+1,FALSE)&"|"&HLOOKUP(Sheet1!R2C1,Sheet1!R2C1:R16C1,MOD(RC1+6,2)+MOD(INT((RC1+6)/2),3)*5+1,FALSE) -> 101|130|131|160|161 | I449: =HLOOKUP(Sheet1!R2C1,Sheet1!R2C1:R16C1,MOD(RC1-1,3)+MOD(INT((RC1-1)/3),3)*5+3,FALSE)&"|"&HLOOKUP(Sheet1!R2C1,Sheet1!R2C1:R16C1,MOD(RC1,3)+MOD(INT((RC1)/3),3)*5+3,FALSE)&"|"&HLOOKUP(Sheet1!R2C1,Sheet1!R2C1:R16C1,MOD(RC1+1,3)+MOD(INT((RC1+1)/3),3)*5+3,FALSE)&"|"&HLOOKUP(Sheet1!R2C1,Sheet1!R2C1:R16C1,MOD(RC1+2,3)+MOD(INT((RC1+2)/3),3)*5+3,FALSE)&"|"&HLOOKUP(Sheet1!R2C1,Sheet1!R2C1:R16C1,MOD(RC1+3,3)+MOD(INT((RC1+3)/3),3)*5+3,FALSE) -> 103|104|132|133|134 | J449: =HLOOKUP(Sheet1!R2C1,Sheet1!R2C1:R16C1,MOD(RC1-1,3)+MOD(INT((RC1-1)/3),3)*5+3,FALSE)&"|"&HLOOKUP(Sheet1!R2C1,Sheet1!R2C1:R16C1,MOD(RC1,3)+MOD(INT((RC1)/3),3)*5+3,FALSE)&"|"&HLOOKUP(Sheet1!R2C1,Sheet1!R2C1:R16C1,MOD(RC1+1,3)+MOD(INT((RC1+1)/3),3)*5+3,FALSE)&"|"&HLOOKUP(Sheet1!R2C1,Sheet1!R2C1:R16C1,MOD(RC1+2,3)+MOD(INT((RC1+2)/3),3)*5+3,FALSE)&"|"&HLOOKUP(Sheet1!R2C1,Sheet1!R2C1:R16C1,MOD(RC1+3,3)+MOD(INT((RC1+3)/3),3)*5+3,FALSE) -> 103|104|132|133|134 | K449: =HLOOKUP(Sheet1!R2C1,Sheet1!R2C1:R16C1,MOD(RC1-1,3)+MOD(INT((RC1-1)/3),3)*5+3,FALSE)&"|"&HLOOKUP(Sheet1!R2C1,Sheet1!R2C1:R16C1,MOD(RC1,3)+MOD(INT((RC1)/3),3)*5+3,FALSE)&"|"&HLOOKUP(Sheet1!R2C1,Sheet1!R2C1:R16C1,MOD(RC1+1,3)+MOD(INT((RC1+1)/3),3)*5+3,FALSE)&"|"&HLOOKUP(Sheet1!R2C1,Sheet1!R2C1:R16C1,MOD(RC1+2,3)+MOD(INT((RC1+2)/3),3)*5+3,FALSE)&"|"&HLOOKUP(Sheet1!R2C1,Sheet1!R2C1:R16C1,MOD(RC1+3,3)+MOD(INT((RC1+3)/3),3)*5+3,FALSE) -> 103|104|132|133|134 | L449: 25|22|23|24 | M449: 9534801|9534801|9534800|9534800 | N449: 10030|10031|10032|10033 | O449: 1|1|1|1 | P449: 2500|2500|2500|2500
A450: 444 | B450: 442 | C450: 30 | D450: =R[-20]C+2 -> 64 | E450: 1000 | F450: =MOD(RC[-5]-1,3)*30+100&"|"&MOD(RC[-5]-1,3)*30+101&"|"&MOD(RC[-5]-1,3)*30+102&"|"&MOD(RC[-5]-1,3)*30+103&"|"&IF(MOD(RC[-5],4)=0,HLOOKUP(Sheet1!R2C10,Sheet1!R2C10:R7C10,MOD(RC[-5]/4-1,6)+1,FALSE),IF(MOD(RC[-5],2)=0,IF(RC[-5]>20,HLOOKUP(Sheet1!R2C7,Sheet1!R2C7:R43C7,MOD(RC[-5]/2-1,42)+1,FALSE),HLOOKUP(Sheet1!R2C4,Sheet1!R2C4:R7C4,MOD(RC[-5]-1,6)+1,FALSE)),MOD(RC[-5]-1,3)*30+104)) -> 160|161|162|163|192 | G450: =HLOOKUP(Sheet1!R2C1,Sheet1!R2C1:R16C1,MOD(RC1-1,2)+MOD(INT((RC1-1)/2),3)*5+1,FALSE)&"|"&HLOOKUP(Sheet1!R2C1,Sheet1!R2C1:R16C1,MOD(RC1,2)+MOD(INT((RC1)/2),3)*5+1,FALSE)&"|"&HLOOKUP(Sheet1!R2C1,Sheet1!R2C1:R16C1,MOD(RC1+1,2)+MOD(INT((RC1+1)/2),3)*5+1,FALSE)&"|"&HLOOKUP(Sheet1!R2C1,Sheet1!R2C1:R16C1,MOD(RC1+2,2)+MOD(INT((RC1+2)/2),3)*5+1,FALSE)&"|"&HLOOKUP(Sheet1!R2C1,Sheet1!R2C1:R16C1,MOD(RC1+3,2)+MOD(INT((RC1+3)/2),3)*5+1,FALSE) -> 161|100|101|130|131 | H450: =HLOOKUP(Sheet1!R2C1,Sheet1!R2C1:R16C1,MOD(RC1+2,2)+MOD(INT((RC1+2)/2),3)*5+1,FALSE)&"|"&HLOOKUP(Sheet1!R2C1,Sheet1!R2C1:R16C1,MOD(RC1+3,2)+MOD(INT((RC1+3)/2),3)*5+1,FALSE)&"|"&HLOOKUP(Sheet1!R2C1,Sheet1!R2C1:R16C1,MOD(RC1+4,2)+MOD(INT((RC1+4)/2),3)*5+1,FALSE)&"|"&HLOOKUP(Sheet1!R2C1,Sheet1!R2C1:R16C1,MOD(RC1+5,2)+MOD(INT((RC1+5)/2),3)*5+1,FALSE)&"|"&HLOOKUP(Sheet1!R2C1,Sheet1!R2C1:R16C1,MOD(RC1+6,2)+MOD(INT((RC1+6)/2),3)*5+1,FALSE) -> 130|131|160|161|100 | I450: =HLOOKUP(Sheet1!R2C1,Sheet1!R2C1:R16C1,MOD(RC1-1,3)+MOD(INT((RC1-1)/3),3)*5+3,FALSE)&"|"&HLOOKUP(Sheet1!R2C1,Sheet1!R2C1:R16C1,MOD(RC1,3)+MOD(INT((RC1)/3),3)*5+3,FALSE)&"|"&HLOOKUP(Sheet1!R2C1,Sheet1!R2C1:R16C1,MOD(RC1+1,3)+MOD(INT((RC1+1)/3),3)*5+3,FALSE)&"|"&HLOOKUP(Sheet1!R2C1,Sheet1!R2C1:R16C1,MOD(RC1+2,3)+MOD(INT((RC1+2)/3),3)*5+3,FALSE)&"|"&HLOOKUP(Sheet1!R2C1,Sheet1!R2C1:R16C1,MOD(RC1+3,3)+MOD(INT((RC1+3)/3),3)*5+3,FALSE) -> 104|132|133|134|162 | J450: =HLOOKUP(Sheet1!R2C1,Sheet1!R2C1:R16C1,MOD(RC1-1,3)+MOD(INT((RC1-1)/3),3)*5+3,FALSE)&"|"&HLOOKUP(Sheet1!R2C1,Sheet1!R2C1:R16C1,MOD(RC1,3)+MOD(INT((RC1)/3),3)*5+3,FALSE)&"|"&HLOOKUP(Sheet1!R2C1,Sheet1!R2C1:R16C1,MOD(RC1+1,3)+MOD(INT((RC1+1)/3),3)*5+3,FALSE)&"|"&HLOOKUP(Sheet1!R2C1,Sheet1!R2C1:R16C1,MOD(RC1+2,3)+MOD(INT((RC1+2)/3),3)*5+3,FALSE)&"|"&HLOOKUP(Sheet1!R2C1,Sheet1!R2C1:R16C1,MOD(RC1+3,3)+MOD(INT((RC1+3)/3),3)*5+3,FALSE) -> 104|132|133|134|162 | K450: =HLOOKUP(Sheet1!R2C1,Sheet1!R2C1:R16C1,MOD(RC1-1,3)+MOD(INT((RC1-1)/3),3)*5+3,FALSE)&"|"&HLOOKUP(Sheet1!R2C1,Sheet1!R2C1:R16C1,MOD(RC1,3)+MOD(INT((RC1)/3),3)*5+3,FALSE)&"|"&HLOOKUP(Sheet1!R2C1,Sheet1!R2C1:R16C1,MOD(RC1+1,3)+MOD(INT((RC1+1)/3),3)*5+3,FALSE)&"|"&HLOOKUP(Sheet1!R2C1,Sheet1!R2C1:R16C1,MOD(RC1+2,3)+MOD(INT((RC1+2)/3),3)*5+3,FALSE)&"|"&HLOOKUP(Sheet1!R2C1,Sheet1!R2C1:R16C1,MOD(RC1+3,3)+MOD(INT((RC1+3)/3),3)*5+3,FALSE) -> 104|132|133|134|162 | L450: 25|22|23|24 | M450: 9615209|9615209|9615210|9615210 | N450: 10030|10031|10032|10033 | O450: 1|1|1|1 | P450: 2500|2500|2500|2500
A451: 445 | B451: 443 | C451: 30 | D451: =R[-20]C+2 -> 64 | E451: 1000 | F451: =MOD(RC[-5]-1,3)*30+100&"|"&MOD(RC[-5]-1,3)*30+101&"|"&MOD(RC[-5]-1,3)*30+102&"|"&MOD(RC[-5]-1,3)*30+103&"|"&IF(MOD(RC[-5],4)=0,HLOOKUP(Sheet1!R2C10,Sheet1!R2C10:R7C10,MOD(RC[-5]/4-1,6)+1,FALSE),IF(MOD(RC[-5],2)=0,IF(RC[-5]>20,HLOOKUP(Sheet1!R2C7,Sheet1!R2C7:R43C7,MOD(RC[-5]/2-1,42)+1,FALSE),HLOOKUP(Sheet1!R2C4,Sheet1!R2C4:R7C4,MOD(RC[-5]-1,6)+1,FALSE)),MOD(RC[-5]-1,3)*30+104)) -> 100|101|102|103|104 | G451: =HLOOKUP(Sheet1!R2C1,Sheet1!R2C1:R16C1,MOD(RC1-1,2)+MOD(INT((RC1-1)/2),3)*5+1,FALSE)&"|"&HLOOKUP(Sheet1!R2C1,Sheet1!R2C1:R16C1,MOD(RC1,2)+MOD(INT((RC1)/2),3)*5+1,FALSE)&"|"&HLOOKUP(Sheet1!R2C1,Sheet1!R2C1:R16C1,MOD(RC1+1,2)+MOD(INT((RC1+1)/2),3)*5+1,FALSE)&"|"&HLOOKUP(Sheet1!R2C1,Sheet1!R2C1:R16C1,MOD(RC1+2,2)+MOD(INT((RC1+2)/2),3)*5+1,FALSE)&"|"&HLOOKUP(Sheet1!R2C1,Sheet1!R2C1:R16C1,MOD(RC1+3,2)+MOD(INT((RC1+3)/2),3)*5+1,FALSE) -> 100|101|130|131|160 | H451: =HLOOKUP(Sheet1!R2C1,Sheet1!R2C1:R16C1,MOD(RC1+2,2)+MOD(INT((RC1+2)/2),3)*5+1,FALSE)&"|"&HLOOKUP(Sheet1!R2C1,Sheet1!R2C1:R16C1,MOD(RC1+3,2)+MOD(INT((RC1+3)/2),3)*5+1,FALSE)&"|"&HLOOKUP(Sheet1!R2C1,Sheet1!R2C1:R16C1,MOD(RC1+4,2)+MOD(INT((RC1+4)/2),3)*5+1,FALSE)&"|"&HLOOKUP(Sheet1!R2C1,Sheet1!R2C1:R16C1,MOD(RC1+5,2)+MOD(INT((RC1+5)/2),3)*5+1,FALSE)&"|"&HLOOKUP(Sheet1!R2C1,Sheet1!R2C1:R16C1,MOD(RC1+6,2)+MOD(INT((RC1+6)/2),3)*5+1,FALSE) -> 131|160|161|100|101 | I451: =HLOOKUP(Sheet1!R2C1,Sheet1!R2C1:R16C1,MOD(RC1-1,3)+MOD(INT((RC1-1)/3),3)*5+3,FALSE)&"|"&HLOOKUP(Sheet1!R2C1,Sheet1!R2C1:R16C1,MOD(RC1,3)+MOD(INT((RC1)/3),3)*5+3,FALSE)&"|"&HLOOKUP(Sheet1!R2C1,Sheet1!R2C1:R16C1,MOD(RC1+1,3)+MOD(INT((RC1+1)/3),3)*5+3,FALSE)&"|"&HLOOKUP(Sheet1!R2C1,Sheet1!R2C1:R16C1,MOD(RC1+2,3)+MOD(INT((RC1+2)/3),3)*5+3,FALSE)&"|"&HLOOKUP(Sheet1!R2C1,Sheet1!R2C1:R16C1,MOD(RC1+3,3)+MOD(INT((RC1+3)/3),3)*5+3,FALSE) -> 132|133|134|162|163 | J451: =HLOOKUP(Sheet1!R2C1,Sheet1!R2C1:R16C1,MOD(RC1-1,3)+MOD(INT((RC1-1)/3),3)*5+3,FALSE)&"|"&HLOOKUP(Sheet1!R2C1,Sheet1!R2C1:R16C1,MOD(RC1,3)+MOD(INT((RC1)/3),3)*5+3,FALSE)&"|"&HLOOKUP(Sheet1!R2C1,Sheet1!R2C1:R16C1,MOD(RC1+1,3)+MOD(INT((RC1+1)/3),3)*5+3,FALSE)&"|"&HLOOKUP(Sheet1!R2C1,Sheet1!R2C1:R16C1,MOD(RC1+2,3)+MOD(INT((RC1+2)/3),3)*5+3,FALSE)&"|"&HLOOKUP(Sheet1!R2C1,Sheet1!R2C1:R16C1,MOD(RC1+3,3)+MOD(INT((RC1+3)/3),3)*5+3,FALSE) -> 132|133|134|162|163 | K451: =HLOOKUP(Sheet1!R2C1,Sheet1!R2C1:R16C1,MOD(RC1-1,3)+MOD(INT((RC1-1)/3),3)*5+3,FALSE)&"|"&HLOOKUP(Sheet1!R2C1,Sheet1!R2C1:R16C1,MOD(RC1,3)+MOD(INT((RC1)/3),3)*5+3,FALSE)&"|"&HLOOKUP(Sheet1!R2C1,Sheet1!R2C1:R16C1,MOD(RC1+1,3)+MOD(INT((RC1+1)/3),3)*5+3,FALSE)&"|"&HLOOKUP(Sheet1!R2C1,Sheet1!R2C1:R16C1,MOD(RC1+2,3)+MOD(INT((RC1+2)/3),3)*5+3,FALSE)&"|"&HLOOKUP(Sheet1!R2C1,Sheet1!R2C1:R16C1,MOD(RC1+3,3)+MOD(INT((RC1+3)/3),3)*5+3,FALSE) -> 132|133|134|162|163 | L451: 25|22|23|24 | M451: 9699634|9699634|9699635|9699635 | N451: 10030|10031|10032|10033|10030|10031|10032|10033|10030|10031|10032|10033|10030|10031|10032|10033|10030|10031|10032|10033|10030|10031|10032|10033|10030|10031|10032|10033|10030|10031|10032|10033|10030|10031|10032|10033|10030|10031|10032|10033 | O451: 1|1|1|1|1|1|1|1|1|1|1|1|1|1|1|1|1|1|1|1|1|1|1|1|1|1|1|1|1|1|1|1|1|1|1|1|1|1|1|1 | P451: 2500|2500|2500|2500|2500|2500|2500|2500|2500|2500|2500|2500|2500|2500|2500|2500|2500|2500|2500|2500|2500|2500|2500|2500|2500|2500|2500|2500|2500|2500|2500|2500|2500|2500|2500|2500|2500|2500|2500|2500
A452: 446 | B452: 444 | C452: 30 | D452: =R[-20]C+2 -> 64 | E452: 1000 | F452: =MOD(RC[-5]-1,3)*30+100&"|"&MOD(RC[-5]-1,3)*30+101&"|"&MOD(RC[-5]-1,3)*30+102&"|"&MOD(RC[-5]-1,3)*30+103&"|"&IF(MOD(RC[-5],4)=0,HLOOKUP(Sheet1!R2C10,Sheet1!R2C10:R7C10,MOD(RC[-5]/4-1,6)+1,FALSE),IF(MOD(RC[-5],2)=0,IF(RC[-5]>20,HLOOKUP(Sheet1!R2C7,Sheet1!R2C7:R43C7,MOD(RC[-5]/2-1,42)+1,FALSE),HLOOKUP(Sheet1!R2C4,Sheet1!R2C4:R7C4,MOD(RC[-5]-1,6)+1,FALSE)),MOD(RC[-5]-1,3)*30+104)) -> 130|131|132|133|124 | G452: =HLOOKUP(Sheet1!R2C1,Sheet1!R2C1:R16C1,MOD(RC1-1,2)+MOD(INT((RC1-1)/2),3)*5+1,FALSE)&"|"&HLOOKUP(Sheet1!R2C1,Sheet1!R2C1:R16C1,MOD(RC1,2)+MOD(INT((RC1)/2),3)*5+1,FALSE)&"|"&HLOOKUP(Sheet1!R2C1,Sheet1!R2C1:R16C1,MOD(RC1+1,2)+MOD(INT((RC1+1)/2),3)*5+1,FALSE)&"|"&HLOOKUP(Sheet1!R2C1,Sheet1!R2C1:R16C1,MOD(RC1+2,2)+MOD(INT((RC1+2)/2),3)*5+1,FALSE)&"|"&HLOOKUP(Sheet1!R2C1,Sheet1!R2C1:R16C1,MOD(RC1+3,2)+MOD(INT((RC1+3)/2),3)*5+1,FALSE) -> 101|130|131|160|161 | H452: =HLOOKUP(Sheet1!R2C1,Sheet1!R2C1:R16C1,MOD(RC1+2,2)+MOD(INT((RC1+2)/2),3)*5+1,FALSE)&"|"&HLOOKUP(Sheet1!R2C1,Sheet1!R2C1:R16C1,MOD(RC1+3,2)+MOD(INT((RC1+3)/2),3)*5+1,FALSE)&"|"&HLOOKUP(Sheet1!R2C1,Sheet1!R2C1:R16C1,MOD(RC1+4,2)+MOD(INT((RC1+4)/2),3)*5+1,FALSE)&"|"&HLOOKUP(Sheet1!R2C1,Sheet1!R2C1:R16C1,MOD(RC1+5,2)+MOD(INT((RC1+5)/2),3)*5+1,FALSE)&"|"&HLOOKUP(Sheet1!R2C1,Sheet1!R2C1:R16C1,MOD(RC1+6,2)+MOD(INT((RC1+6)/2),3)*5+1,FALSE) -> 160|161|100|101|130 | I452: =HLOOKUP(Sheet1!R2C1,Sheet1!R2C1:R16C1,MOD(RC1-1,3)+MOD(INT((RC1-1)/3),3)*5+3,FALSE)&"|"&HLOOKUP(Sheet1!R2C1,Sheet1!R2C1:R16C1,MOD(RC1,3)+MOD(INT((RC1)/3),3)*5+3,FALSE)&"|"&HLOOKUP(Sheet1!R2C1,Sheet1!R2C1:R16C1,MOD(RC1+1,3)+MOD(INT((RC1+1)/3),3)*5+3,FALSE)&"|"&HLOOKUP(Sheet1!R2C1,Sheet1!R2C1:R16C1,MOD(RC1+2,3)+MOD(INT((RC1+2)/3),3)*5+3,FALSE)&"|"&HLOOKUP(Sheet1!R2C1,Sheet1!R2C1:R16C1,MOD(RC1+3,3)+MOD(INT((RC1+3)/3),3)*5+3,FALSE) -> 133|134|162|163|164 | J452: =HLOOKUP(Sheet1!R2C1,Sheet1!R2C1:R16C1,MOD(RC1-1,3)+MOD(INT((RC1-1)/3),3)*5+3,FALSE)&"|"&HLOOKUP(Sheet1!R2C1,Sheet1!R2C1:R16C1,MOD(RC1,3)+MOD(INT((RC1)/3),3)*5+3,FALSE)&"|"&HLOOKUP(Sheet1!R2C1,Sheet1!R2C1:R16C1,MOD(RC1+1,3)+MOD(INT((RC1+1)/3),3)*5+3,FALSE)&"|"&HLOOKUP(Sheet1!R2C1,Sheet1!R2C1:R16C1,MOD(RC1+2,3)+MOD(INT((RC1+2)/3),3)*5+3,FALSE)&"|"&HLOOKUP(Sheet1!R2C1,Sheet1!R2C1:R16C1,MOD(RC1+3,3)+MOD(INT((RC1+3)/3),3)*5+3,FALSE) -> 133|134|162|163|164 | K452: =HLOOKUP(Sheet1!R2C1,Sheet1!R2C1:R16C1,MOD(RC1-1,3)+MOD(INT((RC1-1)/3),3)*5+3,FALSE)&"|"&HLOOKUP(Sheet1!R2C1,Sheet1!R2C1:R16C1,MOD(RC1,3)+MOD(INT((RC1)/3),3)*5+3,FALSE)&"|"&HLOOKUP(Sheet1!R2C1,Sheet1!R2C1:R16C1,MOD(RC1+1,3)+MOD(INT((RC1+1)/3),3)*5+3,FALSE)&"|"&HLOOKUP(Sheet1!R2C1,Sheet1!R2C1:R16C1,MOD(RC1+2,3)+MOD(INT((RC1+2)/3),3)*5+3,FALSE)&"|"&HLOOKUP(Sheet1!R2C1,Sheet1!R2C1:R16C1,MOD(RC1+3,3)+MOD(INT((RC1+3)/3),3)*5+3,FALSE) -> 133|134|162|163|164 | L452: 25|22|23|24 | M452: 9780541|9780541|9780540|9780540 | N452: 10030|10031|10032|10033 | O452: 1|1|1|1 | P452: 2500|2500|2500|2500
A453: 447 | B453: 445 | C453: 30 | D453: =R[-20]C+2 -> 64 | E453: 1000 | F453: =MOD(RC[-5]-1,3)*30+100&"|"&MOD(RC[-5]-1,3)*30+101&"|"&MOD(RC[-5]-1,3)*30+102&"|"&MOD(RC[-5]-1,3)*30+103&"|"&IF(MOD(RC[-5],4)=0,HLOOKUP(Sheet1!R2C10,Sheet1!R2C10:R7C10,MOD(RC[-5]/4-1,6)+1,FALSE),IF(MOD(RC[-5],2)=0,IF(RC[-5]>20,HLOOKUP(Sheet1!R2C7,Sheet1!R2C7:R43C7,MOD(RC[-5]/2-1,42)+1,FALSE),HLOOKUP(Sheet1!R2C4,Sheet1!R2C4:R7C4,MOD(RC[-5]-1,6)+1,FALSE)),MOD(RC[-5]-1,3)*30+104)) -> 160|161|162|163|164 | G453: =HLOOKUP(Sheet1!R2C1,Sheet1!R2C1:R16C1,MOD(RC1-1,2)+MOD(INT((RC1-1)/2),3)*5+1,FALSE)&"|"&HLOOKUP(Sheet1!R2C1,Sheet1!R2C1:R16C1,MOD(RC1,2)+MOD(INT((RC1)/2),3)*5+1,FALSE)&"|"&HLOOKUP(Sheet1!R2C1,Sheet1!R2C1:R16C1,MOD(RC1+1,2)+MOD(INT((RC1+1)/2),3)*5+1,FALSE)&"|"&HLOOKUP(Sheet1!R2C1,Sheet1!R2C1:R16C1,MOD(RC1+2,2)+MOD(INT((RC1+2)/2),3)*5+1,FALSE)&"|"&HLOOKUP(Sheet1!R2C1,Sheet1!R2C1:R16C1,MOD(RC1+3,2)+MOD(INT((RC1+3)/2),3)*5+1,FALSE) -> 130|131|160|161|100 | H453: =HLOOKUP(Sheet1!R2C1,Sheet1!R2C1:R16C1,MOD(RC1+2,2)+MOD(INT((RC1+2)/2),3)*5+1,FALSE)&"|"&HLOOKUP(Sheet1!R2C1,Sheet1!R2C1:R16C1,MOD(RC1+3,2)+MOD(INT((RC1+3)/2),3)*5+1,FALSE)&"|"&HLOOKUP(Sheet1!R2C1,Sheet1!R2C1:R16C1,MOD(RC1+4,2)+MOD(INT((RC1+4)/2),3)*5+1,FALSE)&"|"&HLOOKUP(Sheet1!R2C1,Sheet1!R2C1:R16C1,MOD(RC1+5,2)+MOD(INT((RC1+5)/2),3)*5+1,FALSE)&"|"&HLOOKUP(Sheet1!R2C1,Sheet1!R2C1:R16C1,MOD(RC1+6,2)+MOD(INT((RC1+6)/2),3)*5+1,FALSE) -> 161|100|101|130|131 | I453: =HLOOKUP(Sheet1!R2C1,Sheet1!R2C1:R16C1,MOD(RC1-1,3)+MOD(INT((RC1-1)/3),3)*5+3,FALSE)&"|"&HLOOKUP(Sheet1!R2C1,Sheet1!R2C1:R16C1,MOD(RC1,3)+MOD(INT((RC1)/3),3)*5+3,FALSE)&"|"&HLOOKUP(Sheet1!R2C1,Sheet1!R2C1:R16C1,MOD(RC1+1,3)+MOD(INT((RC1+1)/3),3)*5+3,FALSE)&"|"&HLOOKUP(Sheet1!R2C1,Sheet1!R2C1:R16C1,MOD(RC1+2,3)+MOD(INT((RC1+2)/3),3)*5+3,FALSE)&"|"&HLOOKUP(Sheet1!R2C1,Sheet1!R2C1:R16C1,MOD(RC1+3,3)+MOD(INT((RC1+3)/3),3)*5+3,FALSE) -> 134|162|163|164|102 | J453: =HLOOKUP(Sheet1!R2C1,Sheet1!R2C1:R16C1,MOD(RC1-1,3)+MOD(INT((RC1-1)/3),3)*5+3,FALSE)&"|"&HLOOKUP(Sheet1!R2C1,Sheet1!R2C1:R16C1,MOD(RC1,3)+MOD(INT((RC1)/3),3)*5+3,FALSE)&"|"&HLOOKUP(Sheet1!R2C1,Sheet1!R2C1:R16C1,MOD(RC1+1,3)+MOD(INT((RC1+1)/3),3)*5+3,FALSE)&"|"&HLOOKUP(Sheet1!R2C1,Sheet1!R2C1:R16C1,MOD(RC1+2,3)+MOD(INT((RC1+2)/3),3)*5+3,FALSE)&"|"&HLOOKUP(Sheet1!R2C1,Sheet1!R2C1:R16C1,MOD(RC1+3,3)+MOD(INT((RC1+3)/3),3)*5+3,FALSE) -> 134|162|163|164|102 | K453: =HLOOKUP(Sheet1!R2C1,Sheet1!R2C1:R16C1,MOD(RC1-1,3)+MOD(INT((RC1-1)/3),3)*5+3,FALSE)&"|"&HLOOKUP(Sheet1!R2C1,Sheet1!R2C1:R16C1,MOD(RC1,3)+MOD(INT((RC1)/3),3)*5+3,FALSE)&"|"&HLOOKUP(Sheet1!R2C1,Sheet1!R2C1:R16C1,MOD(RC1+1,3)+MOD(INT((RC1+1)/3),3)*5+3,FALSE)&"|"&HLOOKUP(Sheet1!R2C1,Sheet1!R2C1:R16C1,MOD(RC1+2,3)+MOD(INT((RC1+2)/3),3)*5+3,FALSE)&"|"&HLOOKUP(Sheet1!R2C1,Sheet1!R2C1:R16C1,MOD(RC1+3,3)+MOD(INT((RC1+3)/3),3)*5+3,FALSE) -> 134|162|163|164|102 | L453: 25|22|23|24 | M453: 9864966|9864966|9864965|9864965 | N453: 10030|10031|10032|10033 | O453: 1|1|1|1 | P453: 2500|2500|2500|2500
A454: 448 | B454: 446 | C454: 30 | D454: =R[-20]C+2 -> 64 | E454: 1000 | F454: =MOD(RC[-5]-1,3)*30+100&"|"&MOD(RC[-5]-1,3)*30+101&"|"&MOD(RC[-5]-1,3)*30+102&"|"&MOD(RC[-5]-1,3)*30+103&"|"&IF(MOD(RC[-5],4)=0,HLOOKUP(Sheet1!R2C10,Sheet1!R2C10:R7C10,MOD(RC[-5]/4-1,6)+1,FALSE),IF(MOD(RC[-5],2)=0,IF(RC[-5]>20,HLOOKUP(Sheet1!R2C7,Sheet1!R2C7:R43C7,MOD(RC[-5]/2-1,42)+1,FALSE),HLOOKUP(Sheet1!R2C4,Sheet1!R2C4:R7C4,MOD(RC[-5]-1,6)+1,FALSE)),MOD(RC[-5]-1,3)*30+104)) -> 100|101|102|103|193 | G454: =HLOOKUP(Sheet1!R2C1,Sheet1!R2C1:R16C1,MOD(RC1-1,2)+MOD(INT((RC1-1)/2),3)*5+1,FALSE)&"|"&HLOOKUP(Sheet1!R2C1,Sheet1!R2C1:R16C1,MOD(RC1,2)+MOD(INT((RC1)/2),3)*5+1,FALSE)&"|"&HLOOKUP(Sheet1!R2C1,Sheet1!R2C1:R16C1,MOD(RC1+1,2)+MOD(INT((RC1+1)/2),3)*5+1,FALSE)&"|"&HLOOKUP(Sheet1!R2C1,Sheet1!R2C1:R16C1,MOD(RC1+2,2)+MOD(INT((RC1+2)/2),3)*5+1,FALSE)&"|"&HLOOKUP(Sheet1!R2C1,Sheet1!R2C1:R16C1,MOD(RC1+3,2)+MOD(INT((RC1+3)/2),3)*5+1,FALSE) -> 131|160|161|100|101 | H454: =HLOOKUP(Sheet1!R2C1,Sheet1!R2C1:R16C1,MOD(RC1+2,2)+MOD(INT((RC1+2)/2),3)*5+1,FALSE)&"|"&HLOOKUP(Sheet1!R2C1,Sheet1!R2C1:R16C1,MOD(RC1+3,2)+MOD(INT((RC1+3)/2),3)*5+1,FALSE)&"|"&HLOOKUP(Sheet1!R2C1,Sheet1!R2C1:R16C1,MOD(RC1+4,2)+MOD(INT((RC1+4)/2),3)*5+1,FALSE)&"|"&HLOOKUP(Sheet1!R2C1,Sheet1!R2C1:R16C1,MOD(RC1+5,2)+MOD(INT((RC1+5)/2),3)*5+1,FALSE)&"|"&HLOOKUP(Sheet1!R2C1,Sheet1!R2C1:R16C1,MOD(RC1+6,2)+MOD(INT((RC1+6)/2),3)*5+1,FALSE) -> 100|101|130|131|160 | I454: =HLOOKUP(Sheet1!R2C1,Sheet1!R2C1:R16C1,MOD(RC1-1,3)+MOD(INT((RC1-1)/3),3)*5+3,FALSE)&"|"&HLOOKUP(Sheet1!R2C1,Sheet1!R2C1:R16C1,MOD(RC1,3)+MOD(INT((RC1)/3),3)*5+3,FALSE)&"|"&HLOOKUP(Sheet1!R2C1,Sheet1!R2C1:R16C1,MOD(RC1+1,3)+MOD(INT((RC1+1)/3),3)*5+3,FALSE)&"|"&HLOOKUP(Sheet1!R2C1,Sheet1!R2C1:R16C1,MOD(RC1+2,3)+MOD(INT((RC1+2)/3),3)*5+3,FALSE)&"|"&HLOOKUP(Sheet1!R2C1,Sheet1!R2C1:R16C1,MOD(RC1+3,3)+MOD(INT((RC1+3)/3),3)*5+3,FALSE) -> 162|163|164|102|103 | J454: =HLOOKUP(Sheet1!R2C1,Sheet1!R2C1:R16C1,MOD(RC1-1,3)+MOD(INT((RC1-1)/3),3)*5+3,FALSE)&"|"&HLOOKUP(Sheet1!R2C1,Sheet1!R2C1:R16C1,MOD(RC1,3)+MOD(INT((RC1)/3),3)*5+3,FALSE)&"|"&HLOOKUP(Sheet1!R2C1,Sheet1!R2C1:R16C1,MOD(RC1+1,3)+MOD(INT((RC1+1)/3),3)*5+3,FALSE)&"|"&HLOOKUP(Sheet1!R2C1,Sheet1!R2C1:R16C1,MOD(RC1+2,3)+MOD(INT((RC1+2)/3),3)*5+3,FALSE)&"|"&HLOOKUP(Sheet1!R2C1,Sheet1!R2C1:R16C1,MOD(RC1+3,3)+MOD(INT((RC1+3)/3),3)*5+3,FALSE) -> 162|163|164|102|103 | K454: =HLOOKUP(Sheet1!R2C1,Sheet1!R2C1:R16C1,MOD(RC1-1,3)+MOD(INT((RC1-1)/3),3)*5+3,FALSE)&"|"&HLOOKUP(Sheet1!R2C1,Sheet1!R2C1:R16C1,MOD(RC1,3)+MOD(INT((RC1)/3),3)*5+3,FALSE)&"|"&HLOOKUP(Sheet1!R2C1,Sheet1!R2C1:R16C1,MOD(RC1+1,3)+MOD(INT((RC1+1)/3),3)*5+3,FALSE)&"|"&HLOOKUP(Sheet1!R2C1,Sheet1!R2C1:R16C1,MOD(RC1+2,3)+MOD(INT((RC1+2)/3),3)*5+3,FALSE)&"|"&HLOOKUP(Sheet1!R2C1,Sheet1!R2C1:R16C1,MOD(RC1+3,3)+MOD(INT((RC1+3)/3),3)*5+3,FALSE) -> 162|163|164|102|103 | L454: 25|22|23|24 | M454: 9951203|9951204|9951203|9951203 | N454: 10030|10031|10032|10033 | O454: 1|1|1|1 | P454: 2500|2500|2500|2500
A455: 449 | B455: 447 | C455: 30 | D455: =R[-20]C+2 -> 64 | E455: 1000 | F455: =MOD(RC[-5]-1,3)*30+100&"|"&MOD(RC[-5]-1,3)*30+101&"|"&MOD(RC[-5]-1,3)*30+102&"|"&MOD(RC[-5]-1,3)*30+103&"|"&IF(MOD(RC[-5],4)=0,HLOOKUP(Sheet1!R2C10,Sheet1!R2C10:R7C10,MOD(RC[-5]/4-1,6)+1,FALSE),IF(MOD(RC[-5],2)=0,IF(RC[-5]>20,HLOOKUP(Sheet1!R2C7,Sheet1!R2C7:R43C7,MOD(RC[-5]/2-1,42)+1,FALSE),HLOOKUP(Sheet1!R2C4,Sheet1!R2C4:R7C4,MOD(RC[-5]-1,6)+1,FALSE)),MOD(RC[-5]-1,3)*30+104)) -> 130|131|132|133|134 | G455: =HLOOKUP(Sheet1!R2C1,Sheet1!R2C1:R16C1,MOD(RC1-1,2)+MOD(INT((RC1-1)/2),3)*5+1,FALSE)&"|"&HLOOKUP(Sheet1!R2C1,Sheet1!R2C1:R16C1,MOD(RC1,2)+MOD(INT((RC1)/2),3)*5+1,FALSE)&"|"&HLOOKUP(Sheet1!R2C1,Sheet1!R2C1:R16C1,MOD(RC1+1,2)+MOD(INT((RC1+1)/2),3)*5+1,FALSE)&"|"&HLOOKUP(Sheet1!R2C1,Sheet1!R2C1:R16C1,MOD(RC1+2,2)+MOD(INT((RC1+2)/2),3)*5+1,FALSE)&"|"&HLOOKUP(Sheet1!R2C1,Sheet1!R2C1:R16C1,MOD(RC1+3,2)+MOD(INT((RC1+3)/2),3)*5+1,FALSE) -> 160|161|100|101|130 | H455: =HLOOKUP(Sheet1!R2C1,Sheet1!R2C1:R16C1,MOD(RC1+2,2)+MOD(INT((RC1+2)/2),3)*5+1,FALSE)&"|"&HLOOKUP(Sheet1!R2C1,Sheet1!R2C1:R16C1,MOD(RC1+3,2)+MOD(INT((RC1+3)/2),3)*5+1,FALSE)&"|"&HLOOKUP(Sheet1!R2C1,Sheet1!R2C1:R16C1,MOD(RC1+4,2)+MOD(INT((RC1+4)/2),3)*5+1,FALSE)&"|"&HLOOKUP(Sheet1!R2C1,Sheet1!R2C1:R16C1,MOD(RC1+5,2)+MOD(INT((RC1+5)/2),3)*5+1,FALSE)&"|"&HLOOKUP(Sheet1!R2C1,Sheet1!R2C1:R16C1,MOD(RC1+6,2)+MOD(INT((RC1+6)/2),3)*5+1,FALSE) -> 101|130|131|160|161 | I455: =HLOOKUP(Sheet1!R2C1,Sheet1!R2C1:R16C1,MOD(RC1-1,3)+MOD(INT((RC1-1)/3),3)*5+3,FALSE)&"|"&HLOOKUP(Sheet1!R2C1,Sheet1!R2C1:R16C1,MOD(RC1,3)+MOD(INT((RC1)/3),3)*5+3,FALSE)&"|"&HLOOKUP(Sheet1!R2C1,Sheet1!R2C1:R16C1,MOD(RC1+1,3)+MOD(INT((RC1+1)/3),3)*5+3,FALSE)&"|"&HLOOKUP(Sheet1!R2C1,Sheet1!R2C1:R16C1,MOD(RC1+2,3)+MOD(INT((RC1+2)/3),3)*5+3,FALSE)&"|"&HLOOKUP(Sheet1!R2C1,Sheet1!R2C1:R16C1,MOD(RC1+3,3)+MOD(INT((RC1+3)/3),3)*5+3,FALSE) -> 163|164|102|103|104 | J455: =HLOOKUP(Sheet1!R2C1,Sheet1!R2C1:R16C1,MOD(RC1-1,3)+MOD(INT((RC1-1)/3),3)*5+3,FALSE)&"|"&HLOOKUP(Sheet1!R2C1,Sheet1!R2C1:R16C1,MOD(RC1,3)+MOD(INT((RC1)/3),3)*5+3,FALSE)&"|"&HLOOKUP(Sheet1!R2C1,Sheet1!R2C1:R16C1,MOD(RC1+1,3)+MOD(INT((RC1+1)/3),3)*5+3,FALSE)&"|"&HLOOKUP(Sheet1!R2C1,Sheet1!R2C1:R16C1,MOD(RC1+2,3)+MOD(INT((RC1+2)/3),3)*5+3,FALSE)&"|"&HLOOKUP(Sheet1!R2C1,Sheet1!R2C1:R16C1,MOD(RC1+3,3)+MOD(INT((RC1+3)/3),3)*5+3,FALSE) -> 163|164|102|103|104 | K455: =HLOOKUP(Sheet1!R2C1,Sheet1!R2C1:R16C1,MOD(RC1-1,3)+MOD(INT((RC1-1)/3),3)*5+3,FALSE)&"|"&HLOOKUP(Sheet1!R2C1,Sheet1!R2C1:R16C1,MOD(RC1,3)+MOD(INT((RC1)/3),3)*5+3,FALSE)&"|"&HLOOKUP(Sheet1!R2C1,Sheet1!R2C1:R16C1,MOD(RC1+1,3)+MOD(INT((RC1+1)/3),3)*5+3,FALSE)&"|"&HLOOKUP(Sheet1!R2C1,Sheet1!R2C1:R16C1,MOD(RC1+2,3)+MOD(INT((RC1+2)/3),3)*5+3,FALSE)&"|"&HLOOKUP(Sheet1!R2C1,Sheet1!R2C1:R16C1,MOD(RC1+3,3)+MOD(INT((RC1+3)/3),3)*5+3,FALSE) -> 163|164|102|103|104 | L455: 25|22|23|24 | M455: 10035088|10035088|10035088|10035088 | N455: 10030|10031|10032|10033 | O455: 1|1|1|1 | P455: 2500|2500|2500|2500
A456: 450 | B456: 448 | C456: 30 | D456: =R[-20]C+2 -> 64 | E456: 1000 | F456: =MOD(RC[-5]-1,3)*30+100&"|"&MOD(RC[-5]-1,3)*30+101&"|"&MOD(RC[-5]-1,3)*30+102&"|"&MOD(RC[-5]-1,3)*30+103&"|"&IF(MOD(RC[-5],4)=0,HLOOKUP(Sheet1!R2C10,Sheet1!R2C10:R7C10,MOD(RC[-5]/4-1,6)+1,FALSE),IF(MOD(RC[-5],2)=0,IF(RC[-5]>20,HLOOKUP(Sheet1!R2C7,Sheet1!R2C7:R43C7,MOD(RC[-5]/2-1,42)+1,FALSE),HLOOKUP(Sheet1!R2C4,Sheet1!R2C4:R7C4,MOD(RC[-5]-1,6)+1,FALSE)),MOD(RC[-5]-1,3)*30+104)) -> 160|161|162|163|142 | G456: =HLOOKUP(Sheet1!R2C1,Sheet1!R2C1:R16C1,MOD(RC1-1,2)+MOD(INT((RC1-1)/2),3)*5+1,FALSE)&"|"&HLOOKUP(Sheet1!R2C1,Sheet1!R2C1:R16C1,MOD(RC1,2)+MOD(INT((RC1)/2),3)*5+1,FALSE)&"|"&HLOOKUP(Sheet1!R2C1,Sheet1!R2C1:R16C1,MOD(RC1+1,2)+MOD(INT((RC1+1)/2),3)*5+1,FALSE)&"|"&HLOOKUP(Sheet1!R2C1,Sheet1!R2C1:R16C1,MOD(RC1+2,2)+MOD(INT((RC1+2)/2),3)*5+1,FALSE)&"|"&HLOOKUP(Sheet1!R2C1,Sheet1!R2C1:R16C1,MOD(RC1+3,2)+MOD(INT((RC1+3)/2),3)*5+1,FALSE) -> 161|100|101|130|131 | H456: =HLOOKUP(Sheet1!R2C1,Sheet1!R2C1:R16C1,MOD(RC1+2,2)+MOD(INT((RC1+2)/2),3)*5+1,FALSE)&"|"&HLOOKUP(Sheet1!R2C1,Sheet1!R2C1:R16C1,MOD(RC1+3,2)+MOD(INT((RC1+3)/2),3)*5+1,FALSE)&"|"&HLOOKUP(Sheet1!R2C1,Sheet1!R2C1:R16C1,MOD(RC1+4,2)+MOD(INT((RC1+4)/2),3)*5+1,FALSE)&"|"&HLOOKUP(Sheet1!R2C1,Sheet1!R2C1:R16C1,MOD(RC1+5,2)+MOD(INT((RC1+5)/2),3)*5+1,FALSE)&"|"&HLOOKUP(Sheet1!R2C1,Sheet1!R2C1:R16C1,MOD(RC1+6,2)+MOD(INT((RC1+6)/2),3)*5+1,FALSE) -> 130|131|160|161|100 | I456: =HLOOKUP(Sheet1!R2C1,Sheet1!R2C1:R16C1,MOD(RC1-1,3)+MOD(INT((RC1-1)/3),3)*5+3,FALSE)&"|"&HLOOKUP(Sheet1!R2C1,Sheet1!R2C1:R16C1,MOD(RC1,3)+MOD(INT((RC1)/3),3)*5+3,FALSE)&"|"&HLOOKUP(Sheet1!R2C1,Sheet1!R2C1:R16C1,MOD(RC1+1,3)+MOD(INT((RC1+1)/3),3)*5+3,FALSE)&"|"&HLOOKUP(Sheet1!R2C1,Sheet1!R2C1:R16C1,MOD(RC1+2,3)+MOD(INT((RC1+2)/3),3)*5+3,FALSE)&"|"&HLOOKUP(Sheet1!R2C1,Sheet1!R2C1:R16C1,MOD(RC1+3,3)+MOD(INT((RC1+3)/3),3)*5+3,FALSE) -> 164|102|103|104|132 | J456: =HLOOKUP(Sheet1!R2C1,Sheet1!R2C1:R16C1,MOD(RC1-1,3)+MOD(INT((RC1-1)/3),3)*5+3,FALSE)&"|"&HLOOKUP(Sheet1!R2C1,Sheet1!R2C1:R16C1,MOD(RC1,3)+MOD(INT((RC1)/3),3)*5+3,FALSE)&"|"&HLOOKUP(Sheet1!R2C1,Sheet1!R2C1:R16C1,MOD(RC1+1,3)+MOD(INT((RC1+1)/3),3)*5+3,FALSE)&"|"&HLOOKUP(Sheet1!R2C1,Sheet1!R2C1:R16C1,MOD(RC1+2,3)+MOD(INT((RC1+2)/3),3)*5+3,FALSE)&"|"&HLOOKUP(Sheet1!R2C1,Sheet1!R2C1:R16C1,MOD(RC1+3,3)+MOD(INT((RC1+3)/3),3)*5+3,FALSE) -> 164|102|103|104|132 | K456: =HLOOKUP(Sheet1!R2C1,Sheet1!R2C1:R16C1,MOD(RC1-1,3)+MOD(INT((RC1-1)/3),3)*5+3,FALSE)&"|"&HLOOKUP(Sheet1!R2C1,Sheet1!R2C1:R16C1,MOD(RC1,3)+MOD(INT((RC1)/3),3)*5+3,FALSE)&"|"&HLOOKUP(Sheet1!R2C1,Sheet1!R2C1:R16C1,MOD(RC1+1,3)+MOD(INT((RC1+1)/3),3)*5+3,FALSE)&"|"&HLOOKUP(Sheet1!R2C1,Sheet1!R2C1:R16C1,MOD(RC1+2,3)+MOD(INT((RC1+2)/3),3)*5+3,FALSE)&"|"&HLOOKUP(Sheet1!R2C1,Sheet1!R2C1:R16C1,MOD(RC1+3,3)+MOD(INT((RC1+3)/3),3)*5+3,FALSE) -> 164|102|103|104|132 | L456: 25|22|23|24 | M456: 10122620|10122620|10122620|10122620 | N456: 10030|10031|10032|10033|10030|10031|10032|10033|10030|10031|10032|10033|10030|10031|10032|10033|10030|10031|10032|10033|10030|10031|10032|10033|10030|10031|10032|10033|10030|10031|10032|10033|10030|10031|10032|10033|10030|10031|10032|10033 | O456: 1|1|1|1|1|1|1|1|1|1|1|1|1|1|1|1|1|1|1|1|1|1|1|1|1|1|1|1|1|1|1|1|1|1|1|1|1|1|1|1 | P456: 2500|2500|2500|2500|2500|2500|2500|2500|2500|2500|2500|2500|2500|2500|2500|2500|2500|2500|2500|2500|2500|2500|2500|2500|2500|2500|2500|2500|2500|2500|2500|2500|2500|2500|2500|2500|2500|2500|2500|2500
A457: 451 | B457: 449 | C457: 30 | D457: =R[-20]C+2 -> 64 | E457: 1000 | F457: =MOD(RC[-5]-1,3)*30+100&"|"&MOD(RC[-5]-1,3)*30+101&"|"&MOD(RC[-5]-1,3)*30+102&"|"&MOD(RC[-5]-1,3)*30+103&"|"&IF(MOD(RC[-5],4)=0,HLOOKUP(Sheet1!R2C10,Sheet1!R2C10:R7C10,MOD(RC[-5]/4-1,6)+1,FALSE),IF(MOD(RC[-5],2)=0,IF(RC[-5]>20,HLOOKUP(Sheet1!R2C7,Sheet1!R2C7:R43C7,MOD(RC[-5]/2-1,42)+1,FALSE),HLOOKUP(Sheet1!R2C4,Sheet1!R2C4:R7C4,MOD(RC[-5]-1,6)+1,FALSE)),MOD(RC[-5]-1,3)*30+104)) -> 100|101|102|103|104 | G457: =HLOOKUP(Sheet1!R2C1,Sheet1!R2C1:R16C1,MOD(RC1-1,2)+MOD(INT((RC1-1)/2),3)*5+1,FALSE)&"|"&HLOOKUP(Sheet1!R2C1,Sheet1!R2C1:R16C1,MOD(RC1,2)+MOD(INT((RC1)/2),3)*5+1,FALSE)&"|"&HLOOKUP(Sheet1!R2C1,Sheet1!R2C1:R16C1,MOD(RC1+1,2)+MOD(INT((RC1+1)/2),3)*5+1,FALSE)&"|"&HLOOKUP(Sheet1!R2C1,Sheet1!R2C1:R16C1,MOD(RC1+2,2)+MOD(INT((RC1+2)/2),3)*5+1,FALSE)&"|"&HLOOKUP(Sheet1!R2C1,Sheet1!R2C1:R16C1,MOD(RC1+3,2)+MOD(INT((RC1+3)/2),3)*5+1,FALSE) -> 100|101|130|131|160 | H457: =HLOOKUP(Sheet1!R2C1,Sheet1!R2C1:R16C1,MOD(RC1+2,2)+MOD(INT((RC1+2)/2),3)*5+1,FALSE)&"|"&HLOOKUP(Sheet1!R2C1,Sheet1!R2C1:R16C1,MOD(RC1+3,2)+MOD(INT((RC1+3)/2),3)*5+1,FALSE)&"|"&HLOOKUP(Sheet1!R2C1,Sheet1!R2C1:R16C1,MOD(RC1+4,2)+MOD(INT((RC1+4)/2),3)*5+1,FALSE)&"|"&HLOOKUP(Sheet1!R2C1,Sheet1!R2C1:R16C1,MOD(RC1+5,2)+MOD(INT((RC1+5)/2),3)*5+1,FALSE)&"|"&HLOOKUP(Sheet1!R2C1,Sheet1!R2C1:R16C1,MOD(RC1+6,2)+MOD(INT((RC1+6)/2),3)*5+1,FALSE) -> 131|160|161|100|101 | I457: =HLOOKUP(Sheet1!R2C1,Sheet1!R2C1:R16C1,MOD(RC1-1,3)+MOD(INT((RC1-1)/3),3)*5+3,FALSE)&"|"&HLOOKUP(Sheet1!R2C1,Sheet1!R2C1:R16C1,MOD(RC1,3)+MOD(INT((RC1)/3),3)*5+3,FALSE)&"|"&HLOOKUP(Sheet1!R2C1,Sheet1!R2C1:R16C1,MOD(RC1+1,3)+MOD(INT((RC1+1)/3),3)*5+3,FALSE)&"|"&HLOOKUP(Sheet1!R2C1,Sheet1!R2C1:R16C1,MOD(RC1+2,3)+MOD(INT((RC1+2)/3),3)*5+3,FALSE)&"|"&HLOOKUP(Sheet1!R2C1,Sheet1!R2C1:R16C1,MOD(RC1+3,3)+MOD(INT((RC1+3)/3),3)*5+3,FALSE) -> 102|103|104|132|133 | J457: =HLOOKUP(Sheet1!R2C1,Sheet1!R2C1:R16C1,MOD(RC1-1,3)+MOD(INT((RC1-1)/3),3)*5+3,FALSE)&"|"&HLOOKUP(Sheet1!R2C1,Sheet1!R2C1:R16C1,MOD(RC1,3)+MOD(INT((RC1)/3),3)*5+3,FALSE)&"|"&HLOOKUP(Sheet1!R2C1,Sheet1!R2C1:R16C1,MOD(RC1+1,3)+MOD(INT((RC1+1)/3),3)*5+3,FALSE)&"|"&HLOOKUP(Sheet1!R2C1,Sheet1!R2C1:R16C1,MOD(RC1+2,3)+MOD(INT((RC1+2)/3),3)*5+3,FALSE)&"|"&HLOOKUP(Sheet1!R2C1,Sheet1!R2C1:R16C1,MOD(RC1+3,3)+MOD(INT((RC1+3)/3),3)*5+3,FALSE) -> 102|103|104|132|133 | K457: =HLOOKUP(Sheet1!R2C1,Sheet1!R2C1:R16C1,MOD(RC1-1,3)+MOD(INT((RC1-1)/3),3)*5+3,FALSE)&"|"&HLOOKUP(Sheet1!R2C1,Sheet1!R2C1:R16C1,MOD(RC1,3)+MOD(INT((RC1)/3),3)*5+3,FALSE)&"|"&HLOOKUP(Sheet1!R2C1,Sheet1!R2C1:R16C1,MOD(RC1+1,3)+MOD(INT((RC1+1)/3),3)*5+3,FALSE)&"|"&HLOOKUP(Sheet1!R2C1,Sheet1!R2C1:R16C1,MOD(RC1+2,3)+MOD(INT((RC1+2)/3),3)*5+3,FALSE)&"|"&HLOOKUP(Sheet1!R2C1,Sheet1!R2C1:R16C1,MOD(RC1+3,3)+MOD(INT((RC1+3)/3),3)*5+3,FALSE) -> 102|103|104|132|133 | L457: 25|22|23|24 | M457: 10206505|10206505|10206505|10206505 | N457: 10030|10031|10032|10033 | O457: 1|1|1|1 | P457: 2500|2500|2500|2500
A458: 452 | B458: 450 | C458: 30 | D458: =R[-20]C+2 -> 64 | E458: 1000 | F458: =MOD(RC[-5]-1,3)*30+100&"|"&MOD(RC[-5]-1,3)*30+101&"|"&MOD(RC[-5]-1,3)*30+102&"|"&MOD(RC[-5]-1,3)*30+103&"|"&IF(MOD(RC[-5],4)=0,HLOOKUP(Sheet1!R2C10,Sheet1!R2C10:R7C10,MOD(RC[-5]/4-1,6)+1,FALSE),IF(MOD(RC[-5],2)=0,IF(RC[-5]>20,HLOOKUP(Sheet1!R2C7,Sheet1!R2C7:R43C7,MOD(RC[-5]/2-1,42)+1,FALSE),HLOOKUP(Sheet1!R2C4,Sheet1!R2C4:R7C4,MOD(RC[-5]-1,6)+1,FALSE)),MOD(RC[-5]-1,3)*30+104)) -> 130|131|132|133|194 | G458: =HLOOKUP(Sheet1!R2C1,Sheet1!R2C1:R16C1,MOD(RC1-1,2)+MOD(INT((RC1-1)/2),3)*5+1,FALSE)&"|"&HLOOKUP(Sheet1!R2C1,Sheet1!R2C1:R16C1,MOD(RC1,2)+MOD(INT((RC1)/2),3)*5+1,FALSE)&"|"&HLOOKUP(Sheet1!R2C1,Sheet1!R2C1:R16C1,MOD(RC1+1,2)+MOD(INT((RC1+1)/2),3)*5+1,FALSE)&"|"&HLOOKUP(Sheet1!R2C1,Sheet1!R2C1:R16C1,MOD(RC1+2,2)+MOD(INT((RC1+2)/2),3)*5+1,FALSE)&"|"&HLOOKUP(Sheet1!R2C1,Sheet1!R2C1:R16C1,MOD(RC1+3,2)+MOD(INT((RC1+3)/2),3)*5+1,FALSE) -> 101|130|131|160|161 | H458: =HLOOKUP(Sheet1!R2C1,Sheet1!R2C1:R16C1,MOD(RC1+2,2)+MOD(INT((RC1+2)/2),3)*5+1,FALSE)&"|"&HLOOKUP(Sheet1!R2C1,Sheet1!R2C1:R16C1,MOD(RC1+3,2)+MOD(INT((RC1+3)/2),3)*5+1,FALSE)&"|"&HLOOKUP(Sheet1!R2C1,Sheet1!R2C1:R16C1,MOD(RC1+4,2)+MOD(INT((RC1+4)/2),3)*5+1,FALSE)&"|"&HLOOKUP(Sheet1!R2C1,Sheet1!R2C1:R16C1,MOD(RC1+5,2)+MOD(INT((RC1+5)/2),3)*5+1,FALSE)&"|"&HLOOKUP(Sheet1!R2C1,Sheet1!R2C1:R16C1,MOD(RC1+6,2)+MOD(INT((RC1+6)/2),3)*5+1,FALSE) -> 160|161|100|101|130 | I458: =HLOOKUP(Sheet1!R2C1,Sheet1!R2C1:R16C1,MOD(RC1-1,3)+MOD(INT((RC1-1)/3),3)*5+3,FALSE)&"|"&HLOOKUP(Sheet1!R2C1,Sheet1!R2C1:R16C1,MOD(RC1,3)+MOD(INT((RC1)/3),3)*5+3,FALSE)&"|"&HLOOKUP(Sheet1!R2C1,Sheet1!R2C1:R16C1,MOD(RC1+1,3)+MOD(INT((RC1+1)/3),3)*5+3,FALSE)&"|"&HLOOKUP(Sheet1!R2C1,Sheet1!R2C1:R16C1,MOD(RC1+2,3)+MOD(INT((RC1+2)/3),3)*5+3,FALSE)&"|"&HLOOKUP(Sheet1!R2C1,Sheet1!R2C1:R16C1,MOD(RC1+3,3)+MOD(INT((RC1+3)/3),3)*5+3,FALSE) -> 103|104|132|133|134 | J458: =HLOOKUP(Sheet1!R2C1,Sheet1!R2C1:R16C1,MOD(RC1-1,3)+MOD(INT((RC1-1)/3),3)*5+3,FALSE)&"|"&HLOOKUP(Sheet1!R2C1,Sheet1!R2C1:R16C1,MOD(RC1,3)+MOD(INT((RC1)/3),3)*5+3,FALSE)&"|"&HLOOKUP(Sheet1!R2C1,Sheet1!R2C1:R16C1,MOD(RC1+1,3)+MOD(INT((RC1+1)/3),3)*5+3,FALSE)&"|"&HLOOKUP(Sheet1!R2C1,Sheet1!R2C1:R16C1,MOD(RC1+2,3)+MOD(INT((RC1+2)/3),3)*5+3,FALSE)&"|"&HLOOKUP(Sheet1!R2C1,Sheet1!R2C1:R16C1,MOD(RC1+3,3)+MOD(INT((RC1+3)/3),3)*5+3,FALSE) -> 103|104|132|133|134 | K458: =HLOOKUP(Sheet1!R2C1,Sheet1!R2C1:R16C1,MOD(RC1-1,3)+MOD(INT((RC1-1)/3),3)*5+3,FALSE)&"|"&HLOOKUP(Sheet1!R2C1,Sheet1!R2C1:R16C1,MOD(RC1,3)+MOD(INT((RC1)/3),3)*5+3,FALSE)&"|"&HLOOKUP(Sheet1!R2C1,Sheet1!R2C1:R16C1,MOD(RC1+1,3)+MOD(INT((RC1+1)/3),3)*5+3,FALSE)&"|"&HLOOKUP(Sheet1!R2C1,Sheet1!R2C1:R16C1,MOD(RC1+2,3)+MOD(INT((RC1+2)/3),3)*5+3,FALSE)&"|"&HLOOKUP(Sheet1!R2C1,Sheet1!R2C1:R16C1,MOD(RC1+3,3)+MOD(INT((RC1+3)/3),3)*5+3,FALSE) -> 103|104|132|133|134 | L458: 25|22|23|24 | M458: 10295110|10295110|10295110|10295110 | N458: 10030|10031|10032|10033 | O458: 1|1|1|1 | P458: 2500|2500|2500|2500
A459: 453 | B459: 451 | C459: 30 | D459: =R[-20]C+2 -> 64 | E459: 1000 | F459: =MOD(RC[-5]-1,3)*30+100&"|"&MOD(RC[-5]-1,3)*30+101&"|"&MOD(RC[-5]-1,3)*30+102&"|"&MOD(RC[-5]-1,3)*30+103&"|"&IF(MOD(RC[-5],4)=0,HLOOKUP(Sheet1!R2C10,Sheet1!R2C10:R7C10,MOD(RC[-5]/4-1,6)+1,FALSE),IF(MOD(RC[-5],2)=0,IF(RC[-5]>20,HLOOKUP(Sheet1!R2C7,Sheet1!R2C7:R43C7,MOD(RC[-5]/2-1,42)+1,FALSE),HLOOKUP(Sheet1!R2C4,Sheet1!R2C4:R7C4,MOD(RC[-5]-1,6)+1,FALSE)),MOD(RC[-5]-1,3)*30+104)) -> 160|161|162|163|164 | G459: =HLOOKUP(Sheet1!R2C1,Sheet1!R2C1:R16C1,MOD(RC1-1,2)+MOD(INT((RC1-1)/2),3)*5+1,FALSE)&"|"&HLOOKUP(Sheet1!R2C1,Sheet1!R2C1:R16C1,MOD(RC1,2)+MOD(INT((RC1)/2),3)*5+1,FALSE)&"|"&HLOOKUP(Sheet1!R2C1,Sheet1!R2C1:R16C1,MOD(RC1+1,2)+MOD(INT((RC1+1)/2),3)*5+1,FALSE)&"|"&HLOOKUP(Sheet1!R2C1,Sheet1!R2C1:R16C1,MOD(RC1+2,2)+MOD(INT((RC1+2)/2),3)*5+1,FALSE)&"|"&HLOOKUP(Sheet1!R2C1,Sheet1!R2C1:R16C1,MOD(RC1+3,2)+MOD(INT((RC1+3)/2),3)*5+1,FALSE) -> 130|131|160|161|100 | H459: =HLOOKUP(Sheet1!R2C1,Sheet1!R2C1:R16C1,MOD(RC1+2,2)+MOD(INT((RC1+2)/2),3)*5+1,FALSE)&"|"&HLOOKUP(Sheet1!R2C1,Sheet1!R2C1:R16C1,MOD(RC1+3,2)+MOD(INT((RC1+3)/2),3)*5+1,FALSE)&"|"&HLOOKUP(Sheet1!R2C1,Sheet1!R2C1:R16C1,MOD(RC1+4,2)+MOD(INT((RC1+4)/2),3)*5+1,FALSE)&"|"&HLOOKUP(Sheet1!R2C1,Sheet1!R2C1:R16C1,MOD(RC1+5,2)+MOD(INT((RC1+5)/2),3)*5+1,FALSE)&"|"&HLOOKUP(Sheet1!R2C1,Sheet1!R2C1:R16C1,MOD(RC1+6,2)+MOD(INT((RC1+6)/2),3)*5+1,FALSE) -> 161|100|101|130|131 | I459: =HLOOKUP(Sheet1!R2C1,Sheet1!R2C1:R16C1,MOD(RC1-1,3)+MOD(INT((RC1-1)/3),3)*5+3,FALSE)&"|"&HLOOKUP(Sheet1!R2C1,Sheet1!R2C1:R16C1,MOD(RC1,3)+MOD(INT((RC1)/3),3)*5+3,FALSE)&"|"&HLOOKUP(Sheet1!R2C1,Sheet1!R2C1:R16C1,MOD(RC1+1,3)+MOD(INT((RC1+1)/3),3)*5+3,FALSE)&"|"&HLOOKUP(Sheet1!R2C1,Sheet1!R2C1:R16C1,MOD(RC1+2,3)+MOD(INT((RC1+2)/3),3)*5+3,FALSE)&"|"&HLOOKUP(Sheet1!R2C1,Sheet1!R2C1:R16C1,MOD(RC1+3,3)+MOD(INT((RC1+3)/3),3)*5+3,FALSE) -> 104|132|133|134|162 | J459: =HLOOKUP(Sheet1!R2C1,Sheet1!R2C1:R16C1,MOD(RC1-1,3)+MOD(INT((RC1-1)/3),3)*5+3,FALSE)&"|"&HLOOKUP(Sheet1!R2C1,Sheet1!R2C1:R16C1,MOD(RC1,3)+MOD(INT((RC1)/3),3)*5+3,FALSE)&"|"&HLOOKUP(Sheet1!R2C1,Sheet1!R2C1:R16C1,MOD(RC1+1,3)+MOD(INT((RC1+1)/3),3)*5+3,FALSE)&"|"&HLOOKUP(Sheet1!R2C1,Sheet1!R2C1:R16C1,MOD(RC1+2,3)+MOD(INT((RC1+2)/3),3)*5+3,FALSE)&"|"&HLOOKUP(Sheet1!R2C1,Sheet1!R2C1:R16C1,MOD(RC1+3,3)+MOD(INT((RC1+3)/3),3)*5+3,FALSE) -> 104|132|133|134|162 | K459: =HLOOKUP(Sheet1!R2C1,Sheet1!R2C1:R16C1,MOD(RC1-1,3)+MOD(INT((RC1-1)/3),3)*5+3,FALSE)&"|"&HLOOKUP(Sheet1!R2C1,Sheet1!R2C1:R16C1,MOD(RC1,3)+MOD(INT((RC1)/3),3)*5+3,FALSE)&"|"&HLOOKUP(Sheet1!R2C1,Sheet1!R2C1:R16C1,MOD(RC1+1,3)+MOD(INT((RC1+1)/3),3)*5+3,FALSE)&"|"&HLOOKUP(Sheet1!R2C1,Sheet1!R2C1:R16C1,MOD(RC1+2,3)+MOD(INT((RC1+2)/3),3)*5+3,FALSE)&"|"&HLOOKUP(Sheet1!R2C1,Sheet1!R2C1:R16C1,MOD(RC1+3,3)+MOD(INT((RC1+3)/3),3)*5+3,FALSE) -> 104|132|133|134|162 | L459: 25|22|23|24 | M459: 10382082|10382083|10382083|10382083 | N459: 10030|10031|10032|10033 | O459: 1|1|1|1 | P459: 2500|2500|2500|2500
A460: 454 | B460: 452 | C460: 30 | D460: =R[-20]C+2 -> 64 | E460: 1000 | F460: =MOD(RC[-5]-1,3)*30+100&"|"&MOD(RC[-5]-1,3)*30+101&"|"&MOD(RC[-5]-1,3)*30+102&"|"&MOD(RC[-5]-1,3)*30+103&"|"&IF(MOD(RC[-5],4)=0,HLOOKUP(Sheet1!R2C10,Sheet1!R2C10:R7C10,MOD(RC[-5]/4-1,6)+1,FALSE),IF(MOD(RC[-5],2)=0,IF(RC[-5]>20,HLOOKUP(Sheet1!R2C7,Sheet1!R2C7:R43C7,MOD(RC[-5]/2-1,42)+1,FALSE),HLOOKUP(Sheet1!R2C4,Sheet1!R2C4:R7C4,MOD(RC[-5]-1,6)+1,FALSE)),MOD(RC[-5]-1,3)*30+104)) -> 100|101|102|103|144 | G460: =HLOOKUP(Sheet1!R2C1,Sheet1!R2C1:R16C1,MOD(RC1-1,2)+MOD(INT((RC1-1)/2),3)*5+1,FALSE)&"|"&HLOOKUP(Sheet1!R2C1,Sheet1!R2C1:R16C1,MOD(RC1,2)+MOD(INT((RC1)/2),3)*5+1,FALSE)&"|"&HLOOKUP(Sheet1!R2C1,Sheet1!R2C1:R16C1,MOD(RC1+1,2)+MOD(INT((RC1+1)/2),3)*5+1,FALSE)&"|"&HLOOKUP(Sheet1!R2C1,Sheet1!R2C1:R16C1,MOD(RC1+2,2)+MOD(INT((RC1+2)/2),3)*5+1,FALSE)&"|"&HLOOKUP(Sheet1!R2C1,Sheet1!R2C1:R16C1,MOD(RC1+3,2)+MOD(INT((RC1+3)/2),3)*5+1,FALSE) -> 131|160|161|100|101 | H460: =HLOOKUP(Sheet1!R2C1,Sheet1!R2C1:R16C1,MOD(RC1+2,2)+MOD(INT((RC1+2)/2),3)*5+1,FALSE)&"|"&HLOOKUP(Sheet1!R2C1,Sheet1!R2C1:R16C1,MOD(RC1+3,2)+MOD(INT((RC1+3)/2),3)*5+1,FALSE)&"|"&HLOOKUP(Sheet1!R2C1,Sheet1!R2C1:R16C1,MOD(RC1+4,2)+MOD(INT((RC1+4)/2),3)*5+1,FALSE)&"|"&HLOOKUP(Sheet1!R2C1,Sheet1!R2C1:R16C1,MOD(RC1+5,2)+MOD(INT((RC1+5)/2),3)*5+1,FALSE)&"|"&HLOOKUP(Sheet1!R2C1,Sheet1!R2C1:R16C1,MOD(RC1+6,2)+MOD(INT((RC1+6)/2),3)*5+1,FALSE) -> 100|101|130|131|160 | I460: =HLOOKUP(Sheet1!R2C1,Sheet1!R2C1:R16C1,MOD(RC1-1,3)+MOD(INT((RC1-1)/3),3)*5+3,FALSE)&"|"&HLOOKUP(Sheet1!R2C1,Sheet1!R2C1:R16C1,MOD(RC1,3)+MOD(INT((RC1)/3),3)*5+3,FALSE)&"|"&HLOOKUP(Sheet1!R2C1,Sheet1!R2C1:R16C1,MOD(RC1+1,3)+MOD(INT((RC1+1)/3),3)*5+3,FALSE)&"|"&HLOOKUP(Sheet1!R2C1,Sheet1!R2C1:R16C1,MOD(RC1+2,3)+MOD(INT((RC1+2)/3),3)*5+3,FALSE)&"|"&HLOOKUP(Sheet1!R2C1,Sheet1!R2C1:R16C1,MOD(RC1+3,3)+MOD(INT((RC1+3)/3),3)*5+3,FALSE) -> 132|133|134|162|163 | J460: =HLOOKUP(Sheet1!R2C1,Sheet1!R2C1:R16C1,MOD(RC1-1,3)+MOD(INT((RC1-1)/3),3)*5+3,FALSE)&"|"&HLOOKUP(Sheet1!R2C1,Sheet1!R2C1:R16C1,MOD(RC1,3)+MOD(INT((RC1)/3),3)*5+3,FALSE)&"|"&HLOOKUP(Sheet1!R2C1,Sheet1!R2C1:R16C1,MOD(RC1+1,3)+MOD(INT((RC1+1)/3),3)*5+3,FALSE)&"|"&HLOOKUP(Sheet1!R2C1,Sheet1!R2C1:R16C1,MOD(RC1+2,3)+MOD(INT((RC1+2)/3),3)*5+3,FALSE)&"|"&HLOOKUP(Sheet1!R2C1,Sheet1!R2C1:R16C1,MOD(RC1+3,3)+MOD(INT((RC1+3)/3),3)*5+3,FALSE) -> 132|133|134|162|163 | K460: =HLOOKUP(Sheet1!R2C1,Sheet1!R2C1:R16C1,MOD(RC1-1,3)+MOD(INT((RC1-1)/3),3)*5+3,FALSE)&"|"&HLOOKUP(Sheet1!R2C1,Sheet1!R2C1:R16C1,MOD(RC1,3)+MOD(INT((RC1)/3),3)*5+3,FALSE)&"|"&HLOOKUP(Sheet1!R2C1,Sheet1!R2C1:R16C1,MOD(RC1+1,3)+MOD(INT((RC1+1)/3),3)*5+3,FALSE)&"|"&HLOOKUP(Sheet1!R2C1,Sheet1!R2C1:R16C1,MOD(RC1+2,3)+MOD(INT((RC1+2)/3),3)*5+3,FALSE)&"|"&HLOOKUP(Sheet1!R2C1,Sheet1!R2C1:R16C1,MOD(RC1+3,3)+MOD(INT((RC1+3)/3),3)*5+3,FALSE) -> 132|133|134|162|163 | L460: 25|22|23|24 | M460: 10472836|10472835|10472835|10472835 | N460: 10030|10031|10032|10033 | O460: 1|1|1|1 | P460: 2500|2500|2500|2500
A461: 455 | B461: 453 | C461: 30 | D461: =R[-20]C+2 -> 64 | E461: 1000 | F461: =MOD(RC[-5]-1,3)*30+100&"|"&MOD(RC[-5]-1,3)*30+101&"|"&MOD(RC[-5]-1,3)*30+102&"|"&MOD(RC[-5]-1,3)*30+103&"|"&IF(MOD(RC[-5],4)=0,HLOOKUP(Sheet1!R2C10,Sheet1!R2C10:R7C10,MOD(RC[-5]/4-1,6)+1,FALSE),IF(MOD(RC[-5],2)=0,IF(RC[-5]>20,HLOOKUP(Sheet1!R2C7,Sheet1!R2C7:R43C7,MOD(RC[-5]/2-1,42)+1,FALSE),HLOOKUP(Sheet1!R2C4,Sheet1!R2C4:R7C4,MOD(RC[-5]-1,6)+1,FALSE)),MOD(RC[-5]-1,3)*30+104)) -> 130|131|132|133|134 | G461: =HLOOKUP(Sheet1!R2C1,Sheet1!R2C1:R16C1,MOD(RC1-1,2)+MOD(INT((RC1-1)/2),3)*5+1,FALSE)&"|"&HLOOKUP(Sheet1!R2C1,Sheet1!R2C1:R16C1,MOD(RC1,2)+MOD(INT((RC1)/2),3)*5+1,FALSE)&"|"&HLOOKUP(Sheet1!R2C1,Sheet1!R2C1:R16C1,MOD(RC1+1,2)+MOD(INT((RC1+1)/2),3)*5+1,FALSE)&"|"&HLOOKUP(Sheet1!R2C1,Sheet1!R2C1:R16C1,MOD(RC1+2,2)+MOD(INT((RC1+2)/2),3)*5+1,FALSE)&"|"&HLOOKUP(Sheet1!R2C1,Sheet1!R2C1:R16C1,MOD(RC1+3,2)+MOD(INT((RC1+3)/2),3)*5+1,FALSE) -> 160|161|100|101|130 | H461: =HLOOKUP(Sheet1!R2C1,Sheet1!R2C1:R16C1,MOD(RC1+2,2)+MOD(INT((RC1+2)/2),3)*5+1,FALSE)&"|"&HLOOKUP(Sheet1!R2C1,Sheet1!R2C1:R16C1,MOD(RC1+3,2)+MOD(INT((RC1+3)/2),3)*5+1,FALSE)&"|"&HLOOKUP(Sheet1!R2C1,Sheet1!R2C1:R16C1,MOD(RC1+4,2)+MOD(INT((RC1+4)/2),3)*5+1,FALSE)&"|"&HLOOKUP(Sheet1!R2C1,Sheet1!R2C1:R16C1,MOD(RC1+5,2)+MOD(INT((RC1+5)/2),3)*5+1,FALSE)&"|"&HLOOKUP(Sheet1!R2C1,Sheet1!R2C1:R16C1,MOD(RC1+6,2)+MOD(INT((RC1+6)/2),3)*5+1,FALSE) -> 101|130|131|160|161 | I461: =HLOOKUP(Sheet1!R2C1,Sheet1!R2C1:R16C1,MOD(RC1-1,3)+MOD(INT((RC1-1)/3),3)*5+3,FALSE)&"|"&HLOOKUP(Sheet1!R2C1,Sheet1!R2C1:R16C1,MOD(RC1,3)+MOD(INT((RC1)/3),3)*5+3,FALSE)&"|"&HLOOKUP(Sheet1!R2C1,Sheet1!R2C1:R16C1,MOD(RC1+1,3)+MOD(INT((RC1+1)/3),3)*5+3,FALSE)&"|"&HLOOKUP(Sheet1!R2C1,Sheet1!R2C1:R16C1,MOD(RC1+2,3)+MOD(INT((RC1+2)/3),3)*5+3,FALSE)&"|"&HLOOKUP(Sheet1!R2C1,Sheet1!R2C1:R16C1,MOD(RC1+3,3)+MOD(INT((RC1+3)/3),3)*5+3,FALSE) -> 133|134|162|163|164 | J461: =HLOOKUP(Sheet1!R2C1,Sheet1!R2C1:R16C1,MOD(RC1-1,3)+MOD(INT((RC1-1)/3),3)*5+3,FALSE)&"|"&HLOOKUP(Sheet1!R2C1,Sheet1!R2C1:R16C1,MOD(RC1,3)+MOD(INT((RC1)/3),3)*5+3,FALSE)&"|"&HLOOKUP(Sheet1!R2C1,Sheet1!R2C1:R16C1,MOD(RC1+1,3)+MOD(INT((RC1+1)/3),3)*5+3,FALSE)&"|"&HLOOKUP(Sheet1!R2C1,Sheet1!R2C1:R16C1,MOD(RC1+2,3)+MOD(INT((RC1+2)/3),3)*5+3,FALSE)&"|"&HLOOKUP(Sheet1!R2C1,Sheet1!R2C1:R16C1,MOD(RC1+3,3)+MOD(INT((RC1+3)/3),3)*5+3,FALSE) -> 133|134|162|163|164 | K461: =HLOOKUP(Sheet1!R2C1,Sheet1!R2C1:R16C1,MOD(RC1-1,3)+MOD(INT((RC1-1)/3),3)*5+3,FALSE)&"|"&HLOOKUP(Sheet1!R2C1,Sheet1!R2C1:R16C1,MOD(RC1,3)+MOD(INT((RC1)/3),3)*5+3,FALSE)&"|"&HLOOKUP(Sheet1!R2C1,Sheet1!R2C1:R16C1,MOD(RC1+1,3)+MOD(INT((RC1+1)/3),3)*5+3,FALSE)&"|"&HLOOKUP(Sheet1!R2C1,Sheet1!R2C1:R16C1,MOD(RC1+2,3)+MOD(INT((RC1+2)/3),3)*5+3,FALSE)&"|"&HLOOKUP(Sheet1!R2C1,Sheet1!R2C1:R16C1,MOD(RC1+3,3)+MOD(INT((RC1+3)/3),3)*5+3,FALSE) -> 133|134|162|163|164 | L461: 25|22|23|24 | M461: 10563589|10563589|10563590|10563590 | N461: 10030|10031|10032|10033|10030|10031|10032|10033|10030|10031|10032|10033|10030|10031|10032|10033|10030|10031|10032|10033|10030|10031|10032|10033|10030|10031|10032|10033|10030|10031|10032|10033|10030|10031|10032|10033|10030|10031|10032|10033 | O461: 1|1|1|1|1|1|1|1|1|1|1|1|1|1|1|1|1|1|1|1|1|1|1|1|1|1|1|1|1|1|1|1|1|1|1|1|1|1|1|1 | P461: 2500|2500|2500|2500|2500|2500|2500|2500|2500|2500|2500|2500|2500|2500|2500|2500|2500|2500|2500|2500|2500|2500|2500|2500|2500|2500|2500|2500|2500|2500|2500|2500|2500|2500|2500|2500|2500|2500|2500|2500
A462: 456 | B462: 454 | C462: 30 | D462: =R[-20]C+2 -> 64 | E462: 1000 | F462: =MOD(RC[-5]-1,3)*30+100&"|"&MOD(RC[-5]-1,3)*30+101&"|"&MOD(RC[-5]-1,3)*30+102&"|"&MOD(RC[-5]-1,3)*30+103&"|"&IF(MOD(RC[-5],4)=0,HLOOKUP(Sheet1!R2C10,Sheet1!R2C10:R7C10,MOD(RC[-5]/4-1,6)+1,FALSE),IF(MOD(RC[-5],2)=0,IF(RC[-5]>20,HLOOKUP(Sheet1!R2C7,Sheet1!R2C7:R43C7,MOD(RC[-5]/2-1,42)+1,FALSE),HLOOKUP(Sheet1!R2C4,Sheet1!R2C4:R7C4,MOD(RC[-5]-1,6)+1,FALSE)),MOD(RC[-5]-1,3)*30+104)) -> 160|161|162|163|195 | G462: =HLOOKUP(Sheet1!R2C1,Sheet1!R2C1:R16C1,MOD(RC1-1,2)+MOD(INT((RC1-1)/2),3)*5+1,FALSE)&"|"&HLOOKUP(Sheet1!R2C1,Sheet1!R2C1:R16C1,MOD(RC1,2)+MOD(INT((RC1)/2),3)*5+1,FALSE)&"|"&HLOOKUP(Sheet1!R2C1,Sheet1!R2C1:R16C1,MOD(RC1+1,2)+MOD(INT((RC1+1)/2),3)*5+1,FALSE)&"|"&HLOOKUP(Sheet1!R2C1,Sheet1!R2C1:R16C1,MOD(RC1+2,2)+MOD(INT((RC1+2)/2),3)*5+1,FALSE)&"|"&HLOOKUP(Sheet1!R2C1,Sheet1!R2C1:R16C1,MOD(RC1+3,2)+MOD(INT((RC1+3)/2),3)*5+1,FALSE) -> 161|100|101|130|131 | H462: =HLOOKUP(Sheet1!R2C1,Sheet1!R2C1:R16C1,MOD(RC1+2,2)+MOD(INT((RC1+2)/2),3)*5+1,FALSE)&"|"&HLOOKUP(Sheet1!R2C1,Sheet1!R2C1:R16C1,MOD(RC1+3,2)+MOD(INT((RC1+3)/2),3)*5+1,FALSE)&"|"&HLOOKUP(Sheet1!R2C1,Sheet1!R2C1:R16C1,MOD(RC1+4,2)+MOD(INT((RC1+4)/2),3)*5+1,FALSE)&"|"&HLOOKUP(Sheet1!R2C1,Sheet1!R2C1:R16C1,MOD(RC1+5,2)+MOD(INT((RC1+5)/2),3)*5+1,FALSE)&"|"&HLOOKUP(Sheet1!R2C1,Sheet1!R2C1:R16C1,MOD(RC1+6,2)+MOD(INT((RC1+6)/2),3)*5+1,FALSE) -> 130|131|160|161|100 | I462: =HLOOKUP(Sheet1!R2C1,Sheet1!R2C1:R16C1,MOD(RC1-1,3)+MOD(INT((RC1-1)/3),3)*5+3,FALSE)&"|"&HLOOKUP(Sheet1!R2C1,Sheet1!R2C1:R16C1,MOD(RC1,3)+MOD(INT((RC1)/3),3)*5+3,FALSE)&"|"&HLOOKUP(Sheet1!R2C1,Sheet1!R2C1:R16C1,MOD(RC1+1,3)+MOD(INT((RC1+1)/3),3)*5+3,FALSE)&"|"&HLOOKUP(Sheet1!R2C1,Sheet1!R2C1:R16C1,MOD(RC1+2,3)+MOD(INT((RC1+2)/3),3)*5+3,FALSE)&"|"&HLOOKUP(Sheet1!R2C1,Sheet1!R2C1:R16C1,MOD(RC1+3,3)+MOD(INT((RC1+3)/3),3)*5+3,FALSE) -> 134|162|163|164|102 | J462: =HLOOKUP(Sheet1!R2C1,Sheet1!R2C1:R16C1,MOD(RC1-1,3)+MOD(INT((RC1-1)/3),3)*5+3,FALSE)&"|"&HLOOKUP(Sheet1!R2C1,Sheet1!R2C1:R16C1,MOD(RC1,3)+MOD(INT((RC1)/3),3)*5+3,FALSE)&"|"&HLOOKUP(Sheet1!R2C1,Sheet1!R2C1:R16C1,MOD(RC1+1,3)+MOD(INT((RC1+1)/3),3)*5+3,FALSE)&"|"&HLOOKUP(Sheet1!R2C1,Sheet1!R2C1:R16C1,MOD(RC1+2,3)+MOD(INT((RC1+2)/3),3)*5+3,FALSE)&"|"&HLOOKUP(Sheet1!R2C1,Sheet1!R2C1:R16C1,MOD(RC1+3,3)+MOD(INT((RC1+3)/3),3)*5+3,FALSE) -> 134|162|163|164|102 | K462: =HLOOKUP(Sheet1!R2C1,Sheet1!R2C1:R16C1,MOD(RC1-1,3)+MOD(INT((RC1-1)/3),3)*5+3,FALSE)&"|"&HLOOKUP(Sheet1!R2C1,Sheet1!R2C1:R16C1,MOD(RC1,3)+MOD(INT((RC1)/3),3)*5+3,FALSE)&"|"&HLOOKUP(Sheet1!R2C1,Sheet1!R2C1:R16C1,MOD(RC1+1,3)+MOD(INT((RC1+1)/3),3)*5+3,FALSE)&"|"&HLOOKUP(Sheet1!R2C1,Sheet1!R2C1:R16C1,MOD(RC1+2,3)+MOD(INT((RC1+2)/3),3)*5+3,FALSE)&"|"&HLOOKUP(Sheet1!R2C1,Sheet1!R2C1:R16C1,MOD(RC1+3,3)+MOD(INT((RC1+3)/3),3)*5+3,FALSE) -> 134|162|163|164|102 | L462: 25|22|23|24 | M462: 10650839|10650839|10650840|10650840 | N462: 10030|10031|10032|10033 | O462: 1|1|1|1 | P462: 2500|2500|2500|2500
A463: 457 | B463: 455 | C463: 30 | D463: =R[-20]C+2 -> 64 | E463: 1000 | F463: =MOD(RC[-5]-1,3)*30+100&"|"&MOD(RC[-5]-1,3)*30+101&"|"&MOD(RC[-5]-1,3)*30+102&"|"&MOD(RC[-5]-1,3)*30+103&"|"&IF(MOD(RC[-5],4)=0,HLOOKUP(Sheet1!R2C10,Sheet1!R2C10:R7C10,MOD(RC[-5]/4-1,6)+1,FALSE),IF(MOD(RC[-5],2)=0,IF(RC[-5]>20,HLOOKUP(Sheet1!R2C7,Sheet1!R2C7:R43C7,MOD(RC[-5]/2-1,42)+1,FALSE),HLOOKUP(Sheet1!R2C4,Sheet1!R2C4:R7C4,MOD(RC[-5]-1,6)+1,FALSE)),MOD(RC[-5]-1,3)*30+104)) -> 100|101|102|103|104 | G463: =HLOOKUP(Sheet1!R2C1,Sheet1!R2C1:R16C1,MOD(RC1-1,2)+MOD(INT((RC1-1)/2),3)*5+1,FALSE)&"|"&HLOOKUP(Sheet1!R2C1,Sheet1!R2C1:R16C1,MOD(RC1,2)+MOD(INT((RC1)/2),3)*5+1,FALSE)&"|"&HLOOKUP(Sheet1!R2C1,Sheet1!R2C1:R16C1,MOD(RC1+1,2)+MOD(INT((RC1+1)/2),3)*5+1,FALSE)&"|"&HLOOKUP(Sheet1!R2C1,Sheet1!R2C1:R16C1,MOD(RC1+2,2)+MOD(INT((RC1+2)/2),3)*5+1,FALSE)&"|"&HLOOKUP(Sheet1!R2C1,Sheet1!R2C1:R16C1,MOD(RC1+3,2)+MOD(INT((RC1+3)/2),3)*5+1,FALSE) -> 100|101|130|131|160 | H463: =HLOOKUP(Sheet1!R2C1,Sheet1!R2C1:R16C1,MOD(RC1+2,2)+MOD(INT((RC1+2)/2),3)*5+1,FALSE)&"|"&HLOOKUP(Sheet1!R2C1,Sheet1!R2C1:R16C1,MOD(RC1+3,2)+MOD(INT((RC1+3)/2),3)*5+1,FALSE)&"|"&HLOOKUP(Sheet1!R2C1,Sheet1!R2C1:R16C1,MOD(RC1+4,2)+MOD(INT((RC1+4)/2),3)*5+1,FALSE)&"|"&HLOOKUP(Sheet1!R2C1,Sheet1!R2C1:R16C1,MOD(RC1+5,2)+MOD(INT((RC1+5)/2),3)*5+1,FALSE)&"|"&HLOOKUP(Sheet1!R2C1,Sheet1!R2C1:R16C1,MOD(RC1+6,2)+MOD(INT((RC1+6)/2),3)*5+1,FALSE) -> 131|160|161|100|101 | I463: =HLOOKUP(Sheet1!R2C1,Sheet1!R2C1:R16C1,MOD(RC1-1,3)+MOD(INT((RC1-1)/3),3)*5+3,FALSE)&"|"&HLOOKUP(Sheet1!R2C1,Sheet1!R2C1:R16C1,MOD(RC1,3)+MOD(INT((RC1)/3),3)*5+3,FALSE)&"|"&HLOOKUP(Sheet1!R2C1,Sheet1!R2C1:R16C1,MOD(RC1+1,3)+MOD(INT((RC1+1)/3),3)*5+3,FALSE)&"|"&HLOOKUP(Sheet1!R2C1,Sheet1!R2C1:R16C1,MOD(RC1+2,3)+MOD(INT((RC1+2)/3),3)*5+3,FALSE)&"|"&HLOOKUP(Sheet1!R2C1,Sheet1!R2C1:R16C1,MOD(RC1+3,3)+MOD(INT((RC1+3)/3),3)*5+3,FALSE) -> 162|163|164|102|103 | J463: =HLOOKUP(Sheet1!R2C1,Sheet1!R2C1:R16C1,MOD(RC1-1,3)+MOD(INT((RC1-1)/3),3)*5+3,FALSE)&"|"&HLOOKUP(Sheet1!R2C1,Sheet1!R2C1:R16C1,MOD(RC1,3)+MOD(INT((RC1)/3),3)*5+3,FALSE)&"|"&HLOOKUP(Sheet1!R2C1,Sheet1!R2C1:R16C1,MOD(RC1+1,3)+MOD(INT((RC1+1)/3),3)*5+3,FALSE)&"|"&HLOOKUP(Sheet1!R2C1,Sheet1!R2C1:R16C1,MOD(RC1+2,3)+MOD(INT((RC1+2)/3),3)*5+3,FALSE)&"|"&HLOOKUP(Sheet1!R2C1,Sheet1!R2C1:R16C1,MOD(RC1+3,3)+MOD(INT((RC1+3)/3),3)*5+3,FALSE) -> 162|163|164|102|103 | K463: =HLOOKUP(Sheet1!R2C1,Sheet1!R2C1:R16C1,MOD(RC1-1,3)+MOD(INT((RC1-1)/3),3)*5+3,FALSE)&"|"&HLOOKUP(Sheet1!R2C1,Sheet1!R2C1:R16C1,MOD(RC1,3)+MOD(INT((RC1)/3),3)*5+3,FALSE)&"|"&HLOOKUP(Sheet1!R2C1,Sheet1!R2C1:R16C1,MOD(RC1+1,3)+MOD(INT((RC1+1)/3),3)*5+3,FALSE)&"|"&HLOOKUP(Sheet1!R2C1,Sheet1!R2C1:R16C1,MOD(RC1+2,3)+MOD(INT((RC1+2)/3),3)*5+3,FALSE)&"|"&HLOOKUP(Sheet1!R2C1,Sheet1!R2C1:R16C1,MOD(RC1+3,3)+MOD(INT((RC1+3)/3),3)*5+3,FALSE) -> 162|163|164|102|103 | L463: 25|22|23|24 | M463: 10744932|10744933|10744933|10744933 | N463: 10030|10031|10032|10033 | O463: 1|1|1|1 | P463: 2500|2500|2500|2500
A464: 458 | B464: 456 | C464: 30 | D464: =R[-20]C+2 -> 64 | E464: 1000 | F464: =MOD(RC[-5]-1,3)*30+100&"|"&MOD(RC[-5]-1,3)*30+101&"|"&MOD(RC[-5]-1,3)*30+102&"|"&MOD(RC[-5]-1,3)*30+103&"|"&IF(MOD(RC[-5],4)=0,HLOOKUP(Sheet1!R2C10,Sheet1!R2C10:R7C10,MOD(RC[-5]/4-1,6)+1,FALSE),IF(MOD(RC[-5],2)=0,IF(RC[-5]>20,HLOOKUP(Sheet1!R2C7,Sheet1!R2C7:R43C7,MOD(RC[-5]/2-1,42)+1,FALSE),HLOOKUP(Sheet1!R2C4,Sheet1!R2C4:R7C4,MOD(RC[-5]-1,6)+1,FALSE)),MOD(RC[-5]-1,3)*30+104)) -> 130|131|132|133|146 | G464: =HLOOKUP(Sheet1!R2C1,Sheet1!R2C1:R16C1,MOD(RC1-1,2)+MOD(INT((RC1-1)/2),3)*5+1,FALSE)&"|"&HLOOKUP(Sheet1!R2C1,Sheet1!R2C1:R16C1,MOD(RC1,2)+MOD(INT((RC1)/2),3)*5+1,FALSE)&"|"&HLOOKUP(Sheet1!R2C1,Sheet1!R2C1:R16C1,MOD(RC1+1,2)+MOD(INT((RC1+1)/2),3)*5+1,FALSE)&"|"&HLOOKUP(Sheet1!R2C1,Sheet1!R2C1:R16C1,MOD(RC1+2,2)+MOD(INT((RC1+2)/2),3)*5+1,FALSE)&"|"&HLOOKUP(Sheet1!R2C1,Sheet1!R2C1:R16C1,MOD(RC1+3,2)+MOD(INT((RC1+3)/2),3)*5+1,FALSE) -> 101|130|131|160|161 | H464: =HLOOKUP(Sheet1!R2C1,Sheet1!R2C1:R16C1,MOD(RC1+2,2)+MOD(INT((RC1+2)/2),3)*5+1,FALSE)&"|"&HLOOKUP(Sheet1!R2C1,Sheet1!R2C1:R16C1,MOD(RC1+3,2)+MOD(INT((RC1+3)/2),3)*5+1,FALSE)&"|"&HLOOKUP(Sheet1!R2C1,Sheet1!R2C1:R16C1,MOD(RC1+4,2)+MOD(INT((RC1+4)/2),3)*5+1,FALSE)&"|"&HLOOKUP(Sheet1!R2C1,Sheet1!R2C1:R16C1,MOD(RC1+5,2)+MOD(INT((RC1+5)/2),3)*5+1,FALSE)&"|"&HLOOKUP(Sheet1!R2C1,Sheet1!R2C1:R16C1,MOD(RC1+6,2)+MOD(INT((RC1+6)/2),3)*5+1,FALSE) -> 160|161|100|101|130 | I464: =HLOOKUP(Sheet1!R2C1,Sheet1!R2C1:R16C1,MOD(RC1-1,3)+MOD(INT((RC1-1)/3),3)*5+3,FALSE)&"|"&HLOOKUP(Sheet1!R2C1,Sheet1!R2C1:R16C1,MOD(RC1,3)+MOD(INT((RC1)/3),3)*5+3,FALSE)&"|"&HLOOKUP(Sheet1!R2C1,Sheet1!R2C1:R16C1,MOD(RC1+1,3)+MOD(INT((RC1+1)/3),3)*5+3,FALSE)&"|"&HLOOKUP(Sheet1!R2C1,Sheet1!R2C1:R16C1,MOD(RC1+2,3)+MOD(INT((RC1+2)/3),3)*5+3,FALSE)&"|"&HLOOKUP(Sheet1!R2C1,Sheet1!R2C1:R16C1,MOD(RC1+3,3)+MOD(INT((RC1+3)/3),3)*5+3,FALSE) -> 163|164|102|103|104 | J464: =HLOOKUP(Sheet1!R2C1,Sheet1!R2C1:R16C1,MOD(RC1-1,3)+MOD(INT((RC1-1)/3),3)*5+3,FALSE)&"|"&HLOOKUP(Sheet1!R2C1,Sheet1!R2C1:R16C1,MOD(RC1,3)+MOD(INT((RC1)/3),3)*5+3,FALSE)&"|"&HLOOKUP(Sheet1!R2C1,Sheet1!R2C1:R16C1,MOD(RC1+1,3)+MOD(INT((RC1+1)/3),3)*5+3,FALSE)&"|"&HLOOKUP(Sheet1!R2C1,Sheet1!R2C1:R16C1,MOD(RC1+2,3)+MOD(INT((RC1+2)/3),3)*5+3,FALSE)&"|"&HLOOKUP(Sheet1!R2C1,Sheet1!R2C1:R16C1,MOD(RC1+3,3)+MOD(INT((RC1+3)/3),3)*5+3,FALSE) -> 163|164|102|103|104 | K464: =HLOOKUP(Sheet1!R2C1,Sheet1!R2C1:R16C1,MOD(RC1-1,3)+MOD(INT((RC1-1)/3),3)*5+3,FALSE)&"|"&HLOOKUP(Sheet1!R2C1,Sheet1!R2C1:R16C1,MOD(RC1,3)+MOD(INT((RC1)/3),3)*5+3,FALSE)&"|"&HLOOKUP(Sheet1!R2C1,Sheet1!R2C1:R16C1,MOD(RC1+1,3)+MOD(INT((RC1+1)/3),3)*5+3,FALSE)&"|"&HLOOKUP(Sheet1!R2C1,Sheet1!R2C1:R16C1,MOD(RC1+2,3)+MOD(INT((RC1+2)/3),3)*5+3,FALSE)&"|"&HLOOKUP(Sheet1!R2C1,Sheet1!R2C1:R16C1,MOD(RC1+3,3)+MOD(INT((RC1+3)/3),3)*5+3,FALSE) -> 163|164|102|103|104 | L464: 25|22|23|24 | M464: 10835105|10835105|10835105|10835105 | N464: 10030|10031|10032|10033 | O464: 1|1|1|1 | P464: 2500|2500|2500|2500
A465: 459 | B465: 457 | C465: 30 | D465: =R[-20]C+2 -> 64 | E465: 1000 | F465: =MOD(RC[-5]-1,3)*30+100&"|"&MOD(RC[-5]-1,3)*30+101&"|"&MOD(RC[-5]-1,3)*30+102&"|"&MOD(RC[-5]-1,3)*30+103&"|"&IF(MOD(RC[-5],4)=0,HLOOKUP(Sheet1!R2C10,Sheet1!R2C10:R7C10,MOD(RC[-5]/4-1,6)+1,FALSE),IF(MOD(RC[-5],2)=0,IF(RC[-5]>20,HLOOKUP(Sheet1!R2C7,Sheet1!R2C7:R43C7,MOD(RC[-5]/2-1,42)+1,FALSE),HLOOKUP(Sheet1!R2C4,Sheet1!R2C4:R7C4,MOD(RC[-5]-1,6)+1,FALSE)),MOD(RC[-5]-1,3)*30+104)) -> 160|161|162|163|164 | G465: =HLOOKUP(Sheet1!R2C1,Sheet1!R2C1:R16C1,MOD(RC1-1,2)+MOD(INT((RC1-1)/2),3)*5+1,FALSE)&"|"&HLOOKUP(Sheet1!R2C1,Sheet1!R2C1:R16C1,MOD(RC1,2)+MOD(INT((RC1)/2),3)*5+1,FALSE)&"|"&HLOOKUP(Sheet1!R2C1,Sheet1!R2C1:R16C1,MOD(RC1+1,2)+MOD(INT((RC1+1)/2),3)*5+1,FALSE)&"|"&HLOOKUP(Sheet1!R2C1,Sheet1!R2C1:R16C1,MOD(RC1+2,2)+MOD(INT((RC1+2)/2),3)*5+1,FALSE)&"|"&HLOOKUP(Sheet1!R2C1,Sheet1!R2C1:R16C1,MOD(RC1+3,2)+MOD(INT((RC1+3)/2),3)*5+1,FALSE) -> 130|131|160|161|100 | H465: =HLOOKUP(Sheet1!R2C1,Sheet1!R2C1:R16C1,MOD(RC1+2,2)+MOD(INT((RC1+2)/2),3)*5+1,FALSE)&"|"&HLOOKUP(Sheet1!R2C1,Sheet1!R2C1:R16C1,MOD(RC1+3,2)+MOD(INT((RC1+3)/2),3)*5+1,FALSE)&"|"&HLOOKUP(Sheet1!R2C1,Sheet1!R2C1:R16C1,MOD(RC1+4,2)+MOD(INT((RC1+4)/2),3)*5+1,FALSE)&"|"&HLOOKUP(Sheet1!R2C1,Sheet1!R2C1:R16C1,MOD(RC1+5,2)+MOD(INT((RC1+5)/2),3)*5+1,FALSE)&"|"&HLOOKUP(Sheet1!R2C1,Sheet1!R2C1:R16C1,MOD(RC1+6,2)+MOD(INT((RC1+6)/2),3)*5+1,FALSE) -> 161|100|101|130|131 | I465: =HLOOKUP(Sheet1!R2C1,Sheet1!R2C1:R16C1,MOD(RC1-1,3)+MOD(INT((RC1-1)/3),3)*5+3,FALSE)&"|"&HLOOKUP(Sheet1!R2C1,Sheet1!R2C1:R16C1,MOD(RC1,3)+MOD(INT((RC1)/3),3)*5+3,FALSE)&"|"&HLOOKUP(Sheet1!R2C1,Sheet1!R2C1:R16C1,MOD(RC1+1,3)+MOD(INT((RC1+1)/3),3)*5+3,FALSE)&"|"&HLOOKUP(Sheet1!R2C1,Sheet1!R2C1:R16C1,MOD(RC1+2,3)+MOD(INT((RC1+2)/3),3)*5+3,FALSE)&"|"&HLOOKUP(Sheet1!R2C1,Sheet1!R2C1:R16C1,MOD(RC1+3,3)+MOD(INT((RC1+3)/3),3)*5+3,FALSE) -> 164|102|103|104|132 | J465: =HLOOKUP(Sheet1!R2C1,Sheet1!R2C1:R16C1,MOD(RC1-1,3)+MOD(INT((RC1-1)/3),3)*5+3,FALSE)&"|"&HLOOKUP(Sheet1!R2C1,Sheet1!R2C1:R16C1,MOD(RC1,3)+MOD(INT((RC1)/3),3)*5+3,FALSE)&"|"&HLOOKUP(Sheet1!R2C1,Sheet1!R2C1:R16C1,MOD(RC1+1,3)+MOD(INT((RC1+1)/3),3)*5+3,FALSE)&"|"&HLOOKUP(Sheet1!R2C1,Sheet1!R2C1:R16C1,MOD(RC1+2,3)+MOD(INT((RC1+2)/3),3)*5+3,FALSE)&"|"&HLOOKUP(Sheet1!R2C1,Sheet1!R2C1:R16C1,MOD(RC1+3,3)+MOD(INT((RC1+3)/3),3)*5+3,FALSE) -> 164|102|103|104|132 | K465: =HLOOKUP(Sheet1!R2C1,Sheet1!R2C1:R16C1,MOD(RC1-1,3)+MOD(INT((RC1-1)/3),3)*5+3,FALSE)&"|"&HLOOKUP(Sheet1!R2C1,Sheet1!R2C1:R16C1,MOD(RC1,3)+MOD(INT((RC1)/3),3)*5+3,FALSE)&"|"&HLOOKUP(Sheet1!R2C1,Sheet1!R2C1:R16C1,MOD(RC1+1,3)+MOD(INT((RC1+1)/3),3)*5+3,FALSE)&"|"&HLOOKUP(Sheet1!R2C1,Sheet1!R2C1:R16C1,MOD(RC1+2,3)+MOD(INT((RC1+2)/3),3)*5+3,FALSE)&"|"&HLOOKUP(Sheet1!R2C1,Sheet1!R2C1:R16C1,MOD(RC1+3,3)+MOD(INT((RC1+3)/3),3)*5+3,FALSE) -> 164|102|103|104|132 | L465: 25|22|23|24 | M465: 10929198|10929199|10929198|10929198 | N465: 10030|10031|10032|10033 | O465: 1|1|1|1 | P465: 2500|2500|2500|2500
A466: 460 | B466: 458 | C466: 30 | D466: =R[-20]C+2 -> 64 | E466: 1000 | F466: =MOD(RC[-5]-1,3)*30+100&"|"&MOD(RC[-5]-1,3)*30+101&"|"&MOD(RC[-5]-1,3)*30+102&"|"&MOD(RC[-5]-1,3)*30+103&"|"&IF(MOD(RC[-5],4)=0,HLOOKUP(Sheet1!R2C10,Sheet1!R2C10:R7C10,MOD(RC[-5]/4-1,6)+1,FALSE),IF(MOD(RC[-5],2)=0,IF(RC[-5]>20,HLOOKUP(Sheet1!R2C7,Sheet1!R2C7:R43C7,MOD(RC[-5]/2-1,42)+1,FALSE),HLOOKUP(Sheet1!R2C4,Sheet1!R2C4:R7C4,MOD(RC[-5]-1,6)+1,FALSE)),MOD(RC[-5]-1,3)*30+104)) -> 100|101|102|103|190 | G466: =HLOOKUP(Sheet1!R2C1,Sheet1!R2C1:R16C1,MOD(RC1-1,2)+MOD(INT((RC1-1)/2),3)*5+1,FALSE)&"|"&HLOOKUP(Sheet1!R2C1,Sheet1!R2C1:R16C1,MOD(RC1,2)+MOD(INT((RC1)/2),3)*5+1,FALSE)&"|"&HLOOKUP(Sheet1!R2C1,Sheet1!R2C1:R16C1,MOD(RC1+1,2)+MOD(INT((RC1+1)/2),3)*5+1,FALSE)&"|"&HLOOKUP(Sheet1!R2C1,Sheet1!R2C1:R16C1,MOD(RC1+2,2)+MOD(INT((RC1+2)/2),3)*5+1,FALSE)&"|"&HLOOKUP(Sheet1!R2C1,Sheet1!R2C1:R16C1,MOD(RC1+3,2)+MOD(INT((RC1+3)/2),3)*5+1,FALSE) -> 131|160|161|100|101 | H466: =HLOOKUP(Sheet1!R2C1,Sheet1!R2C1:R16C1,MOD(RC1+2,2)+MOD(INT((RC1+2)/2),3)*5+1,FALSE)&"|"&HLOOKUP(Sheet1!R2C1,Sheet1!R2C1:R16C1,MOD(RC1+3,2)+MOD(INT((RC1+3)/2),3)*5+1,FALSE)&"|"&HLOOKUP(Sheet1!R2C1,Sheet1!R2C1:R16C1,MOD(RC1+4,2)+MOD(INT((RC1+4)/2),3)*5+1,FALSE)&"|"&HLOOKUP(Sheet1!R2C1,Sheet1!R2C1:R16C1,MOD(RC1+5,2)+MOD(INT((RC1+5)/2),3)*5+1,FALSE)&"|"&HLOOKUP(Sheet1!R2C1,Sheet1!R2C1:R16C1,MOD(RC1+6,2)+MOD(INT((RC1+6)/2),3)*5+1,FALSE) -> 100|101|130|131|160 | I466: =HLOOKUP(Sheet1!R2C1,Sheet1!R2C1:R16C1,MOD(RC1-1,3)+MOD(INT((RC1-1)/3),3)*5+3,FALSE)&"|"&HLOOKUP(Sheet1!R2C1,Sheet1!R2C1:R16C1,MOD(RC1,3)+MOD(INT((RC1)/3),3)*5+3,FALSE)&"|"&HLOOKUP(Sheet1!R2C1,Sheet1!R2C1:R16C1,MOD(RC1+1,3)+MOD(INT((RC1+1)/3),3)*5+3,FALSE)&"|"&HLOOKUP(Sheet1!R2C1,Sheet1!R2C1:R16C1,MOD(RC1+2,3)+MOD(INT((RC1+2)/3),3)*5+3,FALSE)&"|"&HLOOKUP(Sheet1!R2C1,Sheet1!R2C1:R16C1,MOD(RC1+3,3)+MOD(INT((RC1+3)/3),3)*5+3,FALSE) -> 102|103|104|132|133 | J466: =HLOOKUP(Sheet1!R2C1,Sheet1!R2C1:R16C1,MOD(RC1-1,3)+MOD(INT((RC1-1)/3),3)*5+3,FALSE)&"|"&HLOOKUP(Sheet1!R2C1,Sheet1!R2C1:R16C1,MOD(RC1,3)+MOD(INT((RC1)/3),3)*5+3,FALSE)&"|"&HLOOKUP(Sheet1!R2C1,Sheet1!R2C1:R16C1,MOD(RC1+1,3)+MOD(INT((RC1+1)/3),3)*5+3,FALSE)&"|"&HLOOKUP(Sheet1!R2C1,Sheet1!R2C1:R16C1,MOD(RC1+2,3)+MOD(INT((RC1+2)/3),3)*5+3,FALSE)&"|"&HLOOKUP(Sheet1!R2C1,Sheet1!R2C1:R16C1,MOD(RC1+3,3)+MOD(INT((RC1+3)/3),3)*5+3,FALSE) -> 102|103|104|132|133 | K466: =HLOOKUP(Sheet1!R2C1,Sheet1!R2C1:R16C1,MOD(RC1-1,3)+MOD(INT((RC1-1)/3),3)*5+3,FALSE)&"|"&HLOOKUP(Sheet1!R2C1,Sheet1!R2C1:R16C1,MOD(RC1,3)+MOD(INT((RC1)/3),3)*5+3,FALSE)&"|"&HLOOKUP(Sheet1!R2C1,Sheet1!R2C1:R16C1,MOD(RC1+1,3)+MOD(INT((RC1+1)/3),3)*5+3,FALSE)&"|"&HLOOKUP(Sheet1!R2C1,Sheet1!R2C1:R16C1,MOD(RC1+2,3)+MOD(INT((RC1+2)/3),3)*5+3,FALSE)&"|"&HLOOKUP(Sheet1!R2C1,Sheet1!R2C1:R16C1,MOD(RC1+3,3)+MOD(INT((RC1+3)/3),3)*5+3,FALSE) -> 102|103|104|132|133 | L466: 25|22|23|24 | M466: 11019371|11019371|11019370|11019370 | N466: 10030|10031|10032|10033|10030|10031|10032|10033|10030|10031|10032|10033|10030|10031|10032|10033|10030|10031|10032|10033|10030|10031|10032|10033|10030|10031|10032|10033|10030|10031|10032|10033|10030|10031|10032|10033|10030|10031|10032|10033 | O466: 1|1|1|1|1|1|1|1|1|1|1|1|1|1|1|1|1|1|1|1|1|1|1|1|1|1|1|1|1|1|1|1|1|1|1|1|1|1|1|1 | P466: 2500|2500|2500|2500|2500|2500|2500|2500|2500|2500|2500|2500|2500|2500|2500|2500|2500|2500|2500|2500|2500|2500|2500|2500|2500|2500|2500|2500|2500|2500|2500|2500|2500|2500|2500|2500|2500|2500|2500|2500
A467: 461 | B467: 459 | C467: 30 | D467: =R[-20]C+2 -> 66 | E467: 1000 | F467: =MOD(RC[-5]-1,3)*30+100&"|"&MOD(RC[-5]-1,3)*30+101&"|"&MOD(RC[-5]-1,3)*30+102&"|"&MOD(RC[-5]-1,3)*30+103&"|"&IF(MOD(RC[-5],4)=0,HLOOKUP(Sheet1!R2C10,Sheet1!R2C10:R7C10,MOD(RC[-5]/4-1,6)+1,FALSE),IF(MOD(RC[-5],2)=0,IF(RC[-5]>20,HLOOKUP(Sheet1!R2C7,Sheet1!R2C7:R43C7,MOD(RC[-5]/2-1,42)+1,FALSE),HLOOKUP(Sheet1!R2C4,Sheet1!R2C4:R7C4,MOD(RC[-5]-1,6)+1,FALSE)),MOD(RC[-5]-1,3)*30+104)) -> 130|131|132|133|134 | G467: =HLOOKUP(Sheet1!R2C1,Sheet1!R2C1:R16C1,MOD(RC1-1,2)+MOD(INT((RC1-1)/2),3)*5+1,FALSE)&"|"&HLOOKUP(Sheet1!R2C1,Sheet1!R2C1:R16C1,MOD(RC1,2)+MOD(INT((RC1)/2),3)*5+1,FALSE)&"|"&HLOOKUP(Sheet1!R2C1,Sheet1!R2C1:R16C1,MOD(RC1+1,2)+MOD(INT((RC1+1)/2),3)*5+1,FALSE)&"|"&HLOOKUP(Sheet1!R2C1,Sheet1!R2C1:R16C1,MOD(RC1+2,2)+MOD(INT((RC1+2)/2),3)*5+1,FALSE)&"|"&HLOOKUP(Sheet1!R2C1,Sheet1!R2C1:R16C1,MOD(RC1+3,2)+MOD(INT((RC1+3)/2),3)*5+1,FALSE) -> 160|161|100|101|130 | H467: =HLOOKUP(Sheet1!R2C1,Sheet1!R2C1:R16C1,MOD(RC1+2,2)+MOD(INT((RC1+2)/2),3)*5+1,FALSE)&"|"&HLOOKUP(Sheet1!R2C1,Sheet1!R2C1:R16C1,MOD(RC1+3,2)+MOD(INT((RC1+3)/2),3)*5+1,FALSE)&"|"&HLOOKUP(Sheet1!R2C1,Sheet1!R2C1:R16C1,MOD(RC1+4,2)+MOD(INT((RC1+4)/2),3)*5+1,FALSE)&"|"&HLOOKUP(Sheet1!R2C1,Sheet1!R2C1:R16C1,MOD(RC1+5,2)+MOD(INT((RC1+5)/2),3)*5+1,FALSE)&"|"&HLOOKUP(Sheet1!R2C1,Sheet1!R2C1:R16C1,MOD(RC1+6,2)+MOD(INT((RC1+6)/2),3)*5+1,FALSE) -> 101|130|131|160|161 | I467: =HLOOKUP(Sheet1!R2C1,Sheet1!R2C1:R16C1,MOD(RC1-1,3)+MOD(INT((RC1-1)/3),3)*5+3,FALSE)&"|"&HLOOKUP(Sheet1!R2C1,Sheet1!R2C1:R16C1,MOD(RC1,3)+MOD(INT((RC1)/3),3)*5+3,FALSE)&"|"&HLOOKUP(Sheet1!R2C1,Sheet1!R2C1:R16C1,MOD(RC1+1,3)+MOD(INT((RC1+1)/3),3)*5+3,FALSE)&"|"&HLOOKUP(Sheet1!R2C1,Sheet1!R2C1:R16C1,MOD(RC1+2,3)+MOD(INT((RC1+2)/3),3)*5+3,FALSE)&"|"&HLOOKUP(Sheet1!R2C1,Sheet1!R2C1:R16C1,MOD(RC1+3,3)+MOD(INT((RC1+3)/3),3)*5+3,FALSE) -> 103|104|132|133|134 | J467: =HLOOKUP(Sheet1!R2C1,Sheet1!R2C1:R16C1,MOD(RC1-1,3)+MOD(INT((RC1-1)/3),3)*5+3,FALSE)&"|"&HLOOKUP(Sheet1!R2C1,Sheet1!R2C1:R16C1,MOD(RC1,3)+MOD(INT((RC1)/3),3)*5+3,FALSE)&"|"&HLOOKUP(Sheet1!R2C1,Sheet1!R2C1:R16C1,MOD(RC1+1,3)+MOD(INT((RC1+1)/3),3)*5+3,FALSE)&"|"&HLOOKUP(Sheet1!R2C1,Sheet1!R2C1:R16C1,MOD(RC1+2,3)+MOD(INT((RC1+2)/3),3)*5+3,FALSE)&"|"&HLOOKUP(Sheet1!R2C1,Sheet1!R2C1:R16C1,MOD(RC1+3,3)+MOD(INT((RC1+3)/3),3)*5+3,FALSE) -> 103|104|132|133|134 | K467: =HLOOKUP(Sheet1!R2C1,Sheet1!R2C1:R16C1,MOD(RC1-1,3)+MOD(INT((RC1-1)/3),3)*5+3,FALSE)&"|"&HLOOKUP(Sheet1!R2C1,Sheet1!R2C1:R16C1,MOD(RC1,3)+MOD(INT((RC1)/3),3)*5+3,FALSE)&"|"&HLOOKUP(Sheet1!R2C1,Sheet1!R2C1:R16C1,MOD(RC1+1,3)+MOD(INT((RC1+1)/3),3)*5+3,FALSE)&"|"&HLOOKUP(Sheet1!R2C1,Sheet1!R2C1:R16C1,MOD(RC1+2,3)+MOD(INT((RC1+2)/3),3)*5+3,FALSE)&"|"&HLOOKUP(Sheet1!R2C1,Sheet1!R2C1:R16C1,MOD(RC1+3,3)+MOD(INT((RC1+3)/3),3)*5+3,FALSE) -> 103|104|132|133|134 | L467: 25|22|23|24 | M467: 11116350|11116350|11116350|11116350 | N467: 10030|10031|10032|10033 | O467: 1|1|1|1 | P467: 2500|2500|2500|2500
A468: 462 | B468: 460 | C468: 30 | D468: =R[-20]C+2 -> 66 | E468: 1000 | F468: =MOD(RC[-5]-1,3)*30+100&"|"&MOD(RC[-5]-1,3)*30+101&"|"&MOD(RC[-5]-1,3)*30+102&"|"&MOD(RC[-5]-1,3)*30+103&"|"&IF(MOD(RC[-5],4)=0,HLOOKUP(Sheet1!R2C10,Sheet1!R2C10:R7C10,MOD(RC[-5]/4-1,6)+1,FALSE),IF(MOD(RC[-5],2)=0,IF(RC[-5]>20,HLOOKUP(Sheet1!R2C7,Sheet1!R2C7:R43C7,MOD(RC[-5]/2-1,42)+1,FALSE),HLOOKUP(Sheet1!R2C4,Sheet1!R2C4:R7C4,MOD(RC[-5]-1,6)+1,FALSE)),MOD(RC[-5]-1,3)*30+104)) -> 160|161|162|163|148 | G468: =HLOOKUP(Sheet1!R2C1,Sheet1!R2C1:R16C1,MOD(RC1-1,2)+MOD(INT((RC1-1)/2),3)*5+1,FALSE)&"|"&HLOOKUP(Sheet1!R2C1,Sheet1!R2C1:R16C1,MOD(RC1,2)+MOD(INT((RC1)/2),3)*5+1,FALSE)&"|"&HLOOKUP(Sheet1!R2C1,Sheet1!R2C1:R16C1,MOD(RC1+1,2)+MOD(INT((RC1+1)/2),3)*5+1,FALSE)&"|"&HLOOKUP(Sheet1!R2C1,Sheet1!R2C1:R16C1,MOD(RC1+2,2)+MOD(INT((RC1+2)/2),3)*5+1,FALSE)&"|"&HLOOKUP(Sheet1!R2C1,Sheet1!R2C1:R16C1,MOD(RC1+3,2)+MOD(INT((RC1+3)/2),3)*5+1,FALSE) -> 161|100|101|130|131 | H468: =HLOOKUP(Sheet1!R2C1,Sheet1!R2C1:R16C1,MOD(RC1+2,2)+MOD(INT((RC1+2)/2),3)*5+1,FALSE)&"|"&HLOOKUP(Sheet1!R2C1,Sheet1!R2C1:R16C1,MOD(RC1+3,2)+MOD(INT((RC1+3)/2),3)*5+1,FALSE)&"|"&HLOOKUP(Sheet1!R2C1,Sheet1!R2C1:R16C1,MOD(RC1+4,2)+MOD(INT((RC1+4)/2),3)*5+1,FALSE)&"|"&HLOOKUP(Sheet1!R2C1,Sheet1!R2C1:R16C1,MOD(RC1+5,2)+MOD(INT((RC1+5)/2),3)*5+1,FALSE)&"|"&HLOOKUP(Sheet1!R2C1,Sheet1!R2C1:R16C1,MOD(RC1+6,2)+MOD(INT((RC1+6)/2),3)*5+1,FALSE) -> 130|131|160|161|100 | I468: =HLOOKUP(Sheet1!R2C1,Sheet1!R2C1:R16C1,MOD(RC1-1,3)+MOD(INT((RC1-1)/3),3)*5+3,FALSE)&"|"&HLOOKUP(Sheet1!R2C1,Sheet1!R2C1:R16C1,MOD(RC1,3)+MOD(INT((RC1)/3),3)*5+3,FALSE)&"|"&HLOOKUP(Sheet1!R2C1,Sheet1!R2C1:R16C1,MOD(RC1+1,3)+MOD(INT((RC1+1)/3),3)*5+3,FALSE)&"|"&HLOOKUP(Sheet1!R2C1,Sheet1!R2C1:R16C1,MOD(RC1+2,3)+MOD(INT((RC1+2)/3),3)*5+3,FALSE)&"|"&HLOOKUP(Sheet1!R2C1,Sheet1!R2C1:R16C1,MOD(RC1+3,3)+MOD(INT((RC1+3)/3),3)*5+3,FALSE) -> 104|132|133|134|162 | J468: =HLOOKUP(Sheet1!R2C1,Sheet1!R2C1:R16C1,MOD(RC1-1,3)+MOD(INT((RC1-1)/3),3)*5+3,FALSE)&"|"&HLOOKUP(Sheet1!R2C1,Sheet1!R2C1:R16C1,MOD(RC1,3)+MOD(INT((RC1)/3),3)*5+3,FALSE)&"|"&HLOOKUP(Sheet1!R2C1,Sheet1!R2C1:R16C1,MOD(RC1+1,3)+MOD(INT((RC1+1)/3),3)*5+3,FALSE)&"|"&HLOOKUP(Sheet1!R2C1,Sheet1!R2C1:R16C1,MOD(RC1+2,3)+MOD(INT((RC1+2)/3),3)*5+3,FALSE)&"|"&HLOOKUP(Sheet1!R2C1,Sheet1!R2C1:R16C1,MOD(RC1+3,3)+MOD(INT((RC1+3)/3),3)*5+3,FALSE) -> 104|132|133|134|162 | K468: =HLOOKUP(Sheet1!R2C1,Sheet1!R2C1:R16C1,MOD(RC1-1,3)+MOD(INT((RC1-1)/3),3)*5+3,FALSE)&"|"&HLOOKUP(Sheet1!R2C1,Sheet1!R2C1:R16C1,MOD(RC1,3)+MOD(INT((RC1)/3),3)*5+3,FALSE)&"|"&HLOOKUP(Sheet1!R2C1,Sheet1!R2C1:R16C1,MOD(RC1+1,3)+MOD(INT((RC1+1)/3),3)*5+3,FALSE)&"|"&HLOOKUP(Sheet1!R2C1,Sheet1!R2C1:R16C1,MOD(RC1+2,3)+MOD(INT((RC1+2)/3),3)*5+3,FALSE)&"|"&HLOOKUP(Sheet1!R2C1,Sheet1!R2C1:R16C1,MOD(RC1+3,3)+MOD(INT((RC1+3)/3),3)*5+3,FALSE) -> 104|132|133|134|162 | L468: 25|22|23|24 | M468: 11209841|11209841|11209840|11209840 | N468: 10030|10031|10032|10033 | O468: 1|1|1|1 | P468: 2500|2500|2500|2500
A469: 463 | B469: 461 | C469: 30 | D469: =R[-20]C+2 -> 66 | E469: 1000 | F469: =MOD(RC[-5]-1,3)*30+100&"|"&MOD(RC[-5]-1,3)*30+101&"|"&MOD(RC[-5]-1,3)*30+102&"|"&MOD(RC[-5]-1,3)*30+103&"|"&IF(MOD(RC[-5],4)=0,HLOOKUP(Sheet1!R2C10,Sheet1!R2C10:R7C10,MOD(RC[-5]/4-1,6)+1,FALSE),IF(MOD(RC[-5],2)=0,IF(RC[-5]>20,HLOOKUP(Sheet1!R2C7,Sheet1!R2C7:R43C7,MOD(RC[-5]/2-1,42)+1,FALSE),HLOOKUP(Sheet1!R2C4,Sheet1!R2C4:R7C4,MOD(RC[-5]-1,6)+1,FALSE)),MOD(RC[-5]-1,3)*30+104)) -> 100|101|102|103|104 | G469: =HLOOKUP(Sheet1!R2C1,Sheet1!R2C1:R16C1,MOD(RC1-1,2)+MOD(INT((RC1-1)/2),3)*5+1,FALSE)&"|"&HLOOKUP(Sheet1!R2C1,Sheet1!R2C1:R16C1,MOD(RC1,2)+MOD(INT((RC1)/2),3)*5+1,FALSE)&"|"&HLOOKUP(Sheet1!R2C1,Sheet1!R2C1:R16C1,MOD(RC1+1,2)+MOD(INT((RC1+1)/2),3)*5+1,FALSE)&"|"&HLOOKUP(Sheet1!R2C1,Sheet1!R2C1:R16C1,MOD(RC1+2,2)+MOD(INT((RC1+2)/2),3)*5+1,FALSE)&"|"&HLOOKUP(Sheet1!R2C1,Sheet1!R2C1:R16C1,MOD(RC1+3,2)+MOD(INT((RC1+3)/2),3)*5+1,FALSE) -> 100|101|130|131|160 | H469: =HLOOKUP(Sheet1!R2C1,Sheet1!R2C1:R16C1,MOD(RC1+2,2)+MOD(INT((RC1+2)/2),3)*5+1,FALSE)&"|"&HLOOKUP(Sheet1!R2C1,Sheet1!R2C1:R16C1,MOD(RC1+3,2)+MOD(INT((RC1+3)/2),3)*5+1,FALSE)&"|"&HLOOKUP(Sheet1!R2C1,Sheet1!R2C1:R16C1,MOD(RC1+4,2)+MOD(INT((RC1+4)/2),3)*5+1,FALSE)&"|"&HLOOKUP(Sheet1!R2C1,Sheet1!R2C1:R16C1,MOD(RC1+5,2)+MOD(INT((RC1+5)/2),3)*5+1,FALSE)&"|"&HLOOKUP(Sheet1!R2C1,Sheet1!R2C1:R16C1,MOD(RC1+6,2)+MOD(INT((RC1+6)/2),3)*5+1,FALSE) -> 131|160|161|100|101 | I469: =HLOOKUP(Sheet1!R2C1,Sheet1!R2C1:R16C1,MOD(RC1-1,3)+MOD(INT((RC1-1)/3),3)*5+3,FALSE)&"|"&HLOOKUP(Sheet1!R2C1,Sheet1!R2C1:R16C1,MOD(RC1,3)+MOD(INT((RC1)/3),3)*5+3,FALSE)&"|"&HLOOKUP(Sheet1!R2C1,Sheet1!R2C1:R16C1,MOD(RC1+1,3)+MOD(INT((RC1+1)/3),3)*5+3,FALSE)&"|"&HLOOKUP(Sheet1!R2C1,Sheet1!R2C1:R16C1,MOD(RC1+2,3)+MOD(INT((RC1+2)/3),3)*5+3,FALSE)&"|"&HLOOKUP(Sheet1!R2C1,Sheet1!R2C1:R16C1,MOD(RC1+3,3)+MOD(INT((RC1+3)/3),3)*5+3,FALSE) -> 132|133|134|162|163 | J469: =HLOOKUP(Sheet1!R2C1,Sheet1!R2C1:R16C1,MOD(RC1-1,3)+MOD(INT((RC1-1)/3),3)*5+3,FALSE)&"|"&HLOOKUP(Sheet1!R2C1,Sheet1!R2C1:R16C1,MOD(RC1,3)+MOD(INT((RC1)/3),3)*5+3,FALSE)&"|"&HLOOKUP(Sheet1!R2C1,Sheet1!R2C1:R16C1,MOD(RC1+1,3)+MOD(INT((RC1+1)/3),3)*5+3,FALSE)&"|"&HLOOKUP(Sheet1!R2C1,Sheet1!R2C1:R16C1,MOD(RC1+2,3)+MOD(INT((RC1+2)/3),3)*5+3,FALSE)&"|"&HLOOKUP(Sheet1!R2C1,Sheet1!R2C1:R16C1,MOD(RC1+3,3)+MOD(INT((RC1+3)/3),3)*5+3,FALSE) -> 132|133|134|162|163 | K469: =HLOOKUP(Sheet1!R2C1,Sheet1!R2C1:R16C1,MOD(RC1-1,3)+MOD(INT((RC1-1)/3),3)*5+3,FALSE)&"|"&HLOOKUP(Sheet1!R2C1,Sheet1!R2C1:R16C1,MOD(RC1,3)+MOD(INT((RC1)/3),3)*5+3,FALSE)&"|"&HLOOKUP(Sheet1!R2C1,Sheet1!R2C1:R16C1,MOD(RC1+1,3)+MOD(INT((RC1+1)/3),3)*5+3,FALSE)&"|"&HLOOKUP(Sheet1!R2C1,Sheet1!R2C1:R16C1,MOD(RC1+2,3)+MOD(INT((RC1+2)/3),3)*5+3,FALSE)&"|"&HLOOKUP(Sheet1!R2C1,Sheet1!R2C1:R16C1,MOD(RC1+3,3)+MOD(INT((RC1+3)/3),3)*5+3,FALSE) -> 132|133|134|162|163 | L469: 25|22|23|24 | M469: 11303332|11303333|11303333|11303333 | N469: 10030|10031|10032|10033 | O469: 1|1|1|1 | P469: 2500|2500|2500|2500
A470: 464 | B470: 462 | C470: 30 | D470: =R[-20]C+2 -> 66 | E470: 1000 | F470: =MOD(RC[-5]-1,3)*30+100&"|"&MOD(RC[-5]-1,3)*30+101&"|"&MOD(RC[-5]-1,3)*30+102&"|"&MOD(RC[-5]-1,3)*30+103&"|"&IF(MOD(RC[-5],4)=0,HLOOKUP(Sheet1!R2C10,Sheet1!R2C10:R7C10,MOD(RC[-5]/4-1,6)+1,FALSE),IF(MOD(RC[-5],2)=0,IF(RC[-5]>20,HLOOKUP(Sheet1!R2C7,Sheet1!R2C7:R43C7,MOD(RC[-5]/2-1,42)+1,FALSE),HLOOKUP(Sheet1!R2C4,Sheet1!R2C4:R7C4,MOD(RC[-5]-1,6)+1,FALSE)),MOD(RC[-5]-1,3)*30+104)) -> 130|131|132|133|191 | G470: =HLOOKUP(Sheet1!R2C1,Sheet1!R2C1:R16C1,MOD(RC1-1,2)+MOD(INT((RC1-1)/2),3)*5+1,FALSE)&"|"&HLOOKUP(Sheet1!R2C1,Sheet1!R2C1:R16C1,MOD(RC1,2)+MOD(INT((RC1)/2),3)*5+1,FALSE)&"|"&HLOOKUP(Sheet1!R2C1,Sheet1!R2C1:R16C1,MOD(RC1+1,2)+MOD(INT((RC1+1)/2),3)*5+1,FALSE)&"|"&HLOOKUP(Sheet1!R2C1,Sheet1!R2C1:R16C1,MOD(RC1+2,2)+MOD(INT((RC1+2)/2),3)*5+1,FALSE)&"|"&HLOOKUP(Sheet1!R2C1,Sheet1!R2C1:R16C1,MOD(RC1+3,2)+MOD(INT((RC1+3)/2),3)*5+1,FALSE) -> 101|130|131|160|161 | H470: =HLOOKUP(Sheet1!R2C1,Sheet1!R2C1:R16C1,MOD(RC1+2,2)+MOD(INT((RC1+2)/2),3)*5+1,FALSE)&"|"&HLOOKUP(Sheet1!R2C1,Sheet1!R2C1:R16C1,MOD(RC1+3,2)+MOD(INT((RC1+3)/2),3)*5+1,FALSE)&"|"&HLOOKUP(Sheet1!R2C1,Sheet1!R2C1:R16C1,MOD(RC1+4,2)+MOD(INT((RC1+4)/2),3)*5+1,FALSE)&"|"&HLOOKUP(Sheet1!R2C1,Sheet1!R2C1:R16C1,MOD(RC1+5,2)+MOD(INT((RC1+5)/2),3)*5+1,FALSE)&"|"&HLOOKUP(Sheet1!R2C1,Sheet1!R2C1:R16C1,MOD(RC1+6,2)+MOD(INT((RC1+6)/2),3)*5+1,FALSE) -> 160|161|100|101|130 | I470: =HLOOKUP(Sheet1!R2C1,Sheet1!R2C1:R16C1,MOD(RC1-1,3)+MOD(INT((RC1-1)/3),3)*5+3,FALSE)&"|"&HLOOKUP(Sheet1!R2C1,Sheet1!R2C1:R16C1,MOD(RC1,3)+MOD(INT((RC1)/3),3)*5+3,FALSE)&"|"&HLOOKUP(Sheet1!R2C1,Sheet1!R2C1:R16C1,MOD(RC1+1,3)+MOD(INT((RC1+1)/3),3)*5+3,FALSE)&"|"&HLOOKUP(Sheet1!R2C1,Sheet1!R2C1:R16C1,MOD(RC1+2,3)+MOD(INT((RC1+2)/3),3)*5+3,FALSE)&"|"&HLOOKUP(Sheet1!R2C1,Sheet1!R2C1:R16C1,MOD(RC1+3,3)+MOD(INT((RC1+3)/3),3)*5+3,FALSE) -> 133|134|162|163|164 | J470: =HLOOKUP(Sheet1!R2C1,Sheet1!R2C1:R16C1,MOD(RC1-1,3)+MOD(INT((RC1-1)/3),3)*5+3,FALSE)&"|"&HLOOKUP(Sheet1!R2C1,Sheet1!R2C1:R16C1,MOD(RC1,3)+MOD(INT((RC1)/3),3)*5+3,FALSE)&"|"&HLOOKUP(Sheet1!R2C1,Sheet1!R2C1:R16C1,MOD(RC1+1,3)+MOD(INT((RC1+1)/3),3)*5+3,FALSE)&"|"&HLOOKUP(Sheet1!R2C1,Sheet1!R2C1:R16C1,MOD(RC1+2,3)+MOD(INT((RC1+2)/3),3)*5+3,FALSE)&"|"&HLOOKUP(Sheet1!R2C1,Sheet1!R2C1:R16C1,MOD(RC1+3,3)+MOD(INT((RC1+3)/3),3)*5+3,FALSE) -> 133|134|162|163|164 | K470: =HLOOKUP(Sheet1!R2C1,Sheet1!R2C1:R16C1,MOD(RC1-1,3)+MOD(INT((RC1-1)/3),3)*5+3,FALSE)&"|"&HLOOKUP(Sheet1!R2C1,Sheet1!R2C1:R16C1,MOD(RC1,3)+MOD(INT((RC1)/3),3)*5+3,FALSE)&"|"&HLOOKUP(Sheet1!R2C1,Sheet1!R2C1:R16C1,MOD(RC1+1,3)+MOD(INT((RC1+1)/3),3)*5+3,FALSE)&"|"&HLOOKUP(Sheet1!R2C1,Sheet1!R2C1:R16C1,MOD(RC1+2,3)+MOD(INT((RC1+2)/3),3)*5+3,FALSE)&"|"&HLOOKUP(Sheet1!R2C1,Sheet1!R2C1:R16C1,MOD(RC1+3,3)+MOD(INT((RC1+3)/3),3)*5+3,FALSE) -> 133|134|162|163|164 | L470: 25|22|23|24 | M470: 11400889|11400889|11400888|11400888 | N470: 10030|10031|10032|10033 | O470: 1|1|1|1 | P470: 2500|2500|2500|2500
A471: 465 | B471: 463 | C471: 30 | D471: =R[-20]C+2 -> 66 | E471: 1000 | F471: =MOD(RC[-5]-1,3)*30+100&"|"&MOD(RC[-5]-1,3)*30+101&"|"&MOD(RC[-5]-1,3)*30+102&"|"&MOD(RC[-5]-1,3)*30+103&"|"&IF(MOD(RC[-5],4)=0,HLOOKUP(Sheet1!R2C10,Sheet1!R2C10:R7C10,MOD(RC[-5]/4-1,6)+1,FALSE),IF(MOD(RC[-5],2)=0,IF(RC[-5]>20,HLOOKUP(Sheet1!R2C7,Sheet1!R2C7:R43C7,MOD(RC[-5]/2-1,42)+1,FALSE),HLOOKUP(Sheet1!R2C4,Sheet1!R2C4:R7C4,MOD(RC[-5]-1,6)+1,FALSE)),MOD(RC[-5]-1,3)*30+104)) -> 160|161|162|163|164 | G471: =HLOOKUP(Sheet1!R2C1,Sheet1!R2C1:R16C1,MOD(RC1-1,2)+MOD(INT((RC1-1)/2),3)*5+1,FALSE)&"|"&HLOOKUP(Sheet1!R2C1,Sheet1!R2C1:R16C1,MOD(RC1,2)+MOD(INT((RC1)/2),3)*5+1,FALSE)&"|"&HLOOKUP(Sheet1!R2C1,Sheet1!R2C1:R16C1,MOD(RC1+1,2)+MOD(INT((RC1+1)/2),3)*5+1,FALSE)&"|"&HLOOKUP(Sheet1!R2C1,Sheet1!R2C1:R16C1,MOD(RC1+2,2)+MOD(INT((RC1+2)/2),3)*5+1,FALSE)&"|"&HLOOKUP(Sheet1!R2C1,Sheet1!R2C1:R16C1,MOD(RC1+3,2)+MOD(INT((RC1+3)/2),3)*5+1,FALSE) -> 130|131|160|161|100 | H471: =HLOOKUP(Sheet1!R2C1,Sheet1!R2C1:R16C1,MOD(RC1+2,2)+MOD(INT((RC1+2)/2),3)*5+1,FALSE)&"|"&HLOOKUP(Sheet1!R2C1,Sheet1!R2C1:R16C1,MOD(RC1+3,2)+MOD(INT((RC1+3)/2),3)*5+1,FALSE)&"|"&HLOOKUP(Sheet1!R2C1,Sheet1!R2C1:R16C1,MOD(RC1+4,2)+MOD(INT((RC1+4)/2),3)*5+1,FALSE)&"|"&HLOOKUP(Sheet1!R2C1,Sheet1!R2C1:R16C1,MOD(RC1+5,2)+MOD(INT((RC1+5)/2),3)*5+1,FALSE)&"|"&HLOOKUP(Sheet1!R2C1,Sheet1!R2C1:R16C1,MOD(RC1+6,2)+MOD(INT((RC1+6)/2),3)*5+1,FALSE) -> 161|100|101|130|131 | I471: =HLOOKUP(Sheet1!R2C1,Sheet1!R2C1:R16C1,MOD(RC1-1,3)+MOD(INT((RC1-1)/3),3)*5+3,FALSE)&"|"&HLOOKUP(Sheet1!R2C1,Sheet1!R2C1:R16C1,MOD(RC1,3)+MOD(INT((RC1)/3),3)*5+3,FALSE)&"|"&HLOOKUP(Sheet1!R2C1,Sheet1!R2C1:R16C1,MOD(RC1+1,3)+MOD(INT((RC1+1)/3),3)*5+3,FALSE)&"|"&HLOOKUP(Sheet1!R2C1,Sheet1!R2C1:R16C1,MOD(RC1+2,3)+MOD(INT((RC1+2)/3),3)*5+3,FALSE)&"|"&HLOOKUP(Sheet1!R2C1,Sheet1!R2C1:R16C1,MOD(RC1+3,3)+MOD(INT((RC1+3)/3),3)*5+3,FALSE) -> 134|162|163|164|102 | J471: =HLOOKUP(Sheet1!R2C1,Sheet1!R2C1:R16C1,MOD(RC1-1,3)+MOD(INT((RC1-1)/3),3)*5+3,FALSE)&"|"&HLOOKUP(Sheet1!R2C1,Sheet1!R2C1:R16C1,MOD(RC1,3)+MOD(INT((RC1)/3),3)*5+3,FALSE)&"|"&HLOOKUP(Sheet1!R2C1,Sheet1!R2C1:R16C1,MOD(RC1+1,3)+MOD(INT((RC1+1)/3),3)*5+3,FALSE)&"|"&HLOOKUP(Sheet1!R2C1,Sheet1!R2C1:R16C1,MOD(RC1+2,3)+MOD(INT((RC1+2)/3),3)*5+3,FALSE)&"|"&HLOOKUP(Sheet1!R2C1,Sheet1!R2C1:R16C1,MOD(RC1+3,3)+MOD(INT((RC1+3)/3),3)*5+3,FALSE) -> 134|162|163|164|102 | K471: =HLOOKUP(Sheet1!R2C1,Sheet1!R2C1:R16C1,MOD(RC1-1,3)+MOD(INT((RC1-1)/3),3)*5+3,FALSE)&"|"&HLOOKUP(Sheet1!R2C1,Sheet1!R2C1:R16C1,MOD(RC1,3)+MOD(INT((RC1)/3),3)*5+3,FALSE)&"|"&HLOOKUP(Sheet1!R2C1,Sheet1!R2C1:R16C1,MOD(RC1+1,3)+MOD(INT((RC1+1)/3),3)*5+3,FALSE)&"|"&HLOOKUP(Sheet1!R2C1,Sheet1!R2C1:R16C1,MOD(RC1+2,3)+MOD(INT((RC1+2)/3),3)*5+3,FALSE)&"|"&HLOOKUP(Sheet1!R2C1,Sheet1!R2C1:R16C1,MOD(RC1+3,3)+MOD(INT((RC1+3)/3),3)*5+3,FALSE) -> 134|162|163|164|102 | L471: 25|22|23|24 | M471: 11496325|11496325|11496325|11496325 | N471: 10030|10031|10032|10033|10030|10031|10032|10033|10030|10031|10032|10033|10030|10031|10032|10033|10030|10031|10032|10033|10030|10031|10032|10033|10030|10031|10032|10033|10030|10031|10032|10033|10030|10031|10032|10033|10030|10031|10032|10033 | O471: 1|1|1|1|1|1|1|1|1|1|1|1|1|1|1|1|1|1|1|1|1|1|1|1|1|1|1|1|1|1|1|1|1|1|1|1|1|1|1|1 | P471: 2500|2500|2500|2500|2500|2500|2500|2500|2500|2500|2500|2500|2500|2500|2500|2500|2500|2500|2500|2500|2500|2500|2500|2500|2500|2500|2500|2500|2500|2500|2500|2500|2500|2500|2500|2500|2500|2500|2500|2500
A472: 466 | B472: 464 | C472: 30 | D472: =R[-20]C+2 -> 66 | E472: 1000 | F472: =MOD(RC[-5]-1,3)*30+100&"|"&MOD(RC[-5]-1,3)*30+101&"|"&MOD(RC[-5]-1,3)*30+102&"|"&MOD(RC[-5]-1,3)*30+103&"|"&IF(MOD(RC[-5],4)=0,HLOOKUP(Sheet1!R2C10,Sheet1!R2C10:R7C10,MOD(RC[-5]/4-1,6)+1,FALSE),IF(MOD(RC[-5],2)=0,IF(RC[-5]>20,HLOOKUP(Sheet1!R2C7,Sheet1!R2C7:R43C7,MOD(RC[-5]/2-1,42)+1,FALSE),HLOOKUP(Sheet1!R2C4,Sheet1!R2C4:R7C4,MOD(RC[-5]-1,6)+1,FALSE)),MOD(RC[-5]-1,3)*30+104)) -> 100|101|102|103|150 | G472: =HLOOKUP(Sheet1!R2C1,Sheet1!R2C1:R16C1,MOD(RC1-1,2)+MOD(INT((RC1-1)/2),3)*5+1,FALSE)&"|"&HLOOKUP(Sheet1!R2C1,Sheet1!R2C1:R16C1,MOD(RC1,2)+MOD(INT((RC1)/2),3)*5+1,FALSE)&"|"&HLOOKUP(Sheet1!R2C1,Sheet1!R2C1:R16C1,MOD(RC1+1,2)+MOD(INT((RC1+1)/2),3)*5+1,FALSE)&"|"&HLOOKUP(Sheet1!R2C1,Sheet1!R2C1:R16C1,MOD(RC1+2,2)+MOD(INT((RC1+2)/2),3)*5+1,FALSE)&"|"&HLOOKUP(Sheet1!R2C1,Sheet1!R2C1:R16C1,MOD(RC1+3,2)+MOD(INT((RC1+3)/2),3)*5+1,FALSE) -> 131|160|161|100|101 | H472: =HLOOKUP(Sheet1!R2C1,Sheet1!R2C1:R16C1,MOD(RC1+2,2)+MOD(INT((RC1+2)/2),3)*5+1,FALSE)&"|"&HLOOKUP(Sheet1!R2C1,Sheet1!R2C1:R16C1,MOD(RC1+3,2)+MOD(INT((RC1+3)/2),3)*5+1,FALSE)&"|"&HLOOKUP(Sheet1!R2C1,Sheet1!R2C1:R16C1,MOD(RC1+4,2)+MOD(INT((RC1+4)/2),3)*5+1,FALSE)&"|"&HLOOKUP(Sheet1!R2C1,Sheet1!R2C1:R16C1,MOD(RC1+5,2)+MOD(INT((RC1+5)/2),3)*5+1,FALSE)&"|"&HLOOKUP(Sheet1!R2C1,Sheet1!R2C1:R16C1,MOD(RC1+6,2)+MOD(INT((RC1+6)/2),3)*5+1,FALSE) -> 100|101|130|131|160 | I472: =HLOOKUP(Sheet1!R2C1,Sheet1!R2C1:R16C1,MOD(RC1-1,3)+MOD(INT((RC1-1)/3),3)*5+3,FALSE)&"|"&HLOOKUP(Sheet1!R2C1,Sheet1!R2C1:R16C1,MOD(RC1,3)+MOD(INT((RC1)/3),3)*5+3,FALSE)&"|"&HLOOKUP(Sheet1!R2C1,Sheet1!R2C1:R16C1,MOD(RC1+1,3)+MOD(INT((RC1+1)/3),3)*5+3,FALSE)&"|"&HLOOKUP(Sheet1!R2C1,Sheet1!R2C1:R16C1,MOD(RC1+2,3)+MOD(INT((RC1+2)/3),3)*5+3,FALSE)&"|"&HLOOKUP(Sheet1!R2C1,Sheet1!R2C1:R16C1,MOD(RC1+3,3)+MOD(INT((RC1+3)/3),3)*5+3,FALSE) -> 162|163|164|102|103 | J472: =HLOOKUP(Sheet1!R2C1,Sheet1!R2C1:R16C1,MOD(RC1-1,3)+MOD(INT((RC1-1)/3),3)*5+3,FALSE)&"|"&HLOOKUP(Sheet1!R2C1,Sheet1!R2C1:R16C1,MOD(RC1,3)+MOD(INT((RC1)/3),3)*5+3,FALSE)&"|"&HLOOKUP(Sheet1!R2C1,Sheet1!R2C1:R16C1,MOD(RC1+1,3)+MOD(INT((RC1+1)/3),3)*5+3,FALSE)&"|"&HLOOKUP(Sheet1!R2C1,Sheet1!R2C1:R16C1,MOD(RC1+2,3)+MOD(INT((RC1+2)/3),3)*5+3,FALSE)&"|"&HLOOKUP(Sheet1!R2C1,Sheet1!R2C1:R16C1,MOD(RC1+3,3)+MOD(INT((RC1+3)/3),3)*5+3,FALSE) -> 162|163|164|102|103 | K472: =HLOOKUP(Sheet1!R2C1,Sheet1!R2C1:R16C1,MOD(RC1-1,3)+MOD(INT((RC1-1)/3),3)*5+3,FALSE)&"|"&HLOOKUP(Sheet1!R2C1,Sheet1!R2C1:R16C1,MOD(RC1,3)+MOD(INT((RC1)/3),3)*5+3,FALSE)&"|"&HLOOKUP(Sheet1!R2C1,Sheet1!R2C1:R16C1,MOD(RC1+1,3)+MOD(INT((RC1+1)/3),3)*5+3,FALSE)&"|"&HLOOKUP(Sheet1!R2C1,Sheet1!R2C1:R16C1,MOD(RC1+2,3)+MOD(INT((RC1+2)/3),3)*5+3,FALSE)&"|"&HLOOKUP(Sheet1!R2C1,Sheet1!R2C1:R16C1,MOD(RC1+3,3)+MOD(INT((RC1+3)/3),3)*5+3,FALSE) -> 162|163|164|102|103 | L472: 25|22|23|24 | M472: 11597471|11597471|11597470|11597470 | N472: 10030|10031|10032|10033 | O472: 1|1|1|1 | P472: 2500|2500|2500|2500
A473: 467 | B473: 465 | C473: 30 | D473: =R[-20]C+2 -> 66 | E473: 1000 | F473: =MOD(RC[-5]-1,3)*30+100&"|"&MOD(RC[-5]-1,3)*30+101&"|"&MOD(RC[-5]-1,3)*30+102&"|"&MOD(RC[-5]-1,3)*30+103&"|"&IF(MOD(RC[-5],4)=0,HLOOKUP(Sheet1!R2C10,Sheet1!R2C10:R7C10,MOD(RC[-5]/4-1,6)+1,FALSE),IF(MOD(RC[-5],2)=0,IF(RC[-5]>20,HLOOKUP(Sheet1!R2C7,Sheet1!R2C7:R43C7,MOD(RC[-5]/2-1,42)+1,FALSE),HLOOKUP(Sheet1!R2C4,Sheet1!R2C4:R7C4,MOD(RC[-5]-1,6)+1,FALSE)),MOD(RC[-5]-1,3)*30+104)) -> 130|131|132|133|134 | G473: =HLOOKUP(Sheet1!R2C1,Sheet1!R2C1:R16C1,MOD(RC1-1,2)+MOD(INT((RC1-1)/2),3)*5+1,FALSE)&"|"&HLOOKUP(Sheet1!R2C1,Sheet1!R2C1:R16C1,MOD(RC1,2)+MOD(INT((RC1)/2),3)*5+1,FALSE)&"|"&HLOOKUP(Sheet1!R2C1,Sheet1!R2C1:R16C1,MOD(RC1+1,2)+MOD(INT((RC1+1)/2),3)*5+1,FALSE)&"|"&HLOOKUP(Sheet1!R2C1,Sheet1!R2C1:R16C1,MOD(RC1+2,2)+MOD(INT((RC1+2)/2),3)*5+1,FALSE)&"|"&HLOOKUP(Sheet1!R2C1,Sheet1!R2C1:R16C1,MOD(RC1+3,2)+MOD(INT((RC1+3)/2),3)*5+1,FALSE) -> 160|161|100|101|130 | H473: =HLOOKUP(Sheet1!R2C1,Sheet1!R2C1:R16C1,MOD(RC1+2,2)+MOD(INT((RC1+2)/2),3)*5+1,FALSE)&"|"&HLOOKUP(Sheet1!R2C1,Sheet1!R2C1:R16C1,MOD(RC1+3,2)+MOD(INT((RC1+3)/2),3)*5+1,FALSE)&"|"&HLOOKUP(Sheet1!R2C1,Sheet1!R2C1:R16C1,MOD(RC1+4,2)+MOD(INT((RC1+4)/2),3)*5+1,FALSE)&"|"&HLOOKUP(Sheet1!R2C1,Sheet1!R2C1:R16C1,MOD(RC1+5,2)+MOD(INT((RC1+5)/2),3)*5+1,FALSE)&"|"&HLOOKUP(Sheet1!R2C1,Sheet1!R2C1:R16C1,MOD(RC1+6,2)+MOD(INT((RC1+6)/2),3)*5+1,FALSE) -> 101|130|131|160|161 | I473: =HLOOKUP(Sheet1!R2C1,Sheet1!R2C1:R16C1,MOD(RC1-1,3)+MOD(INT((RC1-1)/3),3)*5+3,FALSE)&"|"&HLOOKUP(Sheet1!R2C1,Sheet1!R2C1:R16C1,MOD(RC1,3)+MOD(INT((RC1)/3),3)*5+3,FALSE)&"|"&HLOOKUP(Sheet1!R2C1,Sheet1!R2C1:R16C1,MOD(RC1+1,3)+MOD(INT((RC1+1)/3),3)*5+3,FALSE)&"|"&HLOOKUP(Sheet1!R2C1,Sheet1!R2C1:R16C1,MOD(RC1+2,3)+MOD(INT((RC1+2)/3),3)*5+3,FALSE)&"|"&HLOOKUP(Sheet1!R2C1,Sheet1!R2C1:R16C1,MOD(RC1+3,3)+MOD(INT((RC1+3)/3),3)*5+3,FALSE) -> 163|164|102|103|104 | J473: =HLOOKUP(Sheet1!R2C1,Sheet1!R2C1:R16C1,MOD(RC1-1,3)+MOD(INT((RC1-1)/3),3)*5+3,FALSE)&"|"&HLOOKUP(Sheet1!R2C1,Sheet1!R2C1:R16C1,MOD(RC1,3)+MOD(INT((RC1)/3),3)*5+3,FALSE)&"|"&HLOOKUP(Sheet1!R2C1,Sheet1!R2C1:R16C1,MOD(RC1+1,3)+MOD(INT((RC1+1)/3),3)*5+3,FALSE)&"|"&HLOOKUP(Sheet1!R2C1,Sheet1!R2C1:R16C1,MOD(RC1+2,3)+MOD(INT((RC1+2)/3),3)*5+3,FALSE)&"|"&HLOOKUP(Sheet1!R2C1,Sheet1!R2C1:R16C1,MOD(RC1+3,3)+MOD(INT((RC1+3)/3),3)*5+3,FALSE) -> 163|164|102|103|104 | K473: =HLOOKUP(Sheet1!R2C1,Sheet1!R2C1:R16C1,MOD(RC1-1,3)+MOD(INT((RC1-1)/3),3)*5+3,FALSE)&"|"&HLOOKUP(Sheet1!R2C1,Sheet1!R2C1:R16C1,MOD(RC1,3)+MOD(INT((RC1)/3),3)*5+3,FALSE)&"|"&HLOOKUP(Sheet1!R2C1,Sheet1!R2C1:R16C1,MOD(RC1+1,3)+MOD(INT((RC1+1)/3),3)*5+3,FALSE)&"|"&HLOOKUP(Sheet1!R2C1,Sheet1!R2C1:R16C1,MOD(RC1+2,3)+MOD(INT((RC1+2)/3),3)*5+3,FALSE)&"|"&HLOOKUP(Sheet1!R2C1,Sheet1!R2C1:R16C1,MOD(RC1+3,3)+MOD(INT((RC1+3)/3),3)*5+3,FALSE) -> 163|164|102|103|104 | L473: 25|22|23|24 | M473: 11694403|11694403|11694403|11694403 | N473: 10030|10031|10032|10033 | O473: 1|1|1|1 | P473: 2500|2500|2500|2500
A474: 468 | B474: 466 | C474: 30 | D474: =R[-20]C+2 -> 66 | E474: 1000 | F474: =MOD(RC[-5]-1,3)*30+100&"|"&MOD(RC[-5]-1,3)*30+101&"|"&MOD(RC[-5]-1,3)*30+102&"|"&MOD(RC[-5]-1,3)*30+103&"|"&IF(MOD(RC[-5],4)=0,HLOOKUP(Sheet1!R2C10,Sheet1!R2C10:R7C10,MOD(RC[-5]/4-1,6)+1,FALSE),IF(MOD(RC[-5],2)=0,IF(RC[-5]>20,HLOOKUP(Sheet1!R2C7,Sheet1!R2C7:R43C7,MOD(RC[-5]/2-1,42)+1,FALSE),HLOOKUP(Sheet1!R2C4,Sheet1!R2C4:R7C4,MOD(RC[-5]-1,6)+1,FALSE)),MOD(RC[-5]-1,3)*30+104)) -> 160|161|162|163|192 | G474: =HLOOKUP(Sheet1!R2C1,Sheet1!R2C1:R16C1,MOD(RC1-1,2)+MOD(INT((RC1-1)/2),3)*5+1,FALSE)&"|"&HLOOKUP(Sheet1!R2C1,Sheet1!R2C1:R16C1,MOD(RC1,2)+MOD(INT((RC1)/2),3)*5+1,FALSE)&"|"&HLOOKUP(Sheet1!R2C1,Sheet1!R2C1:R16C1,MOD(RC1+1,2)+MOD(INT((RC1+1)/2),3)*5+1,FALSE)&"|"&HLOOKUP(Sheet1!R2C1,Sheet1!R2C1:R16C1,MOD(RC1+2,2)+MOD(INT((RC1+2)/2),3)*5+1,FALSE)&"|"&HLOOKUP(Sheet1!R2C1,Sheet1!R2C1:R16C1,MOD(RC1+3,2)+MOD(INT((RC1+3)/2),3)*5+1,FALSE) -> 161|100|101|130|131 | H474: =HLOOKUP(Sheet1!R2C1,Sheet1!R2C1:R16C1,MOD(RC1+2,2)+MOD(INT((RC1+2)/2),3)*5+1,FALSE)&"|"&HLOOKUP(Sheet1!R2C1,Sheet1!R2C1:R16C1,MOD(RC1+3,2)+MOD(INT((RC1+3)/2),3)*5+1,FALSE)&"|"&HLOOKUP(Sheet1!R2C1,Sheet1!R2C1:R16C1,MOD(RC1+4,2)+MOD(INT((RC1+4)/2),3)*5+1,FALSE)&"|"&HLOOKUP(Sheet1!R2C1,Sheet1!R2C1:R16C1,MOD(RC1+5,2)+MOD(INT((RC1+5)/2),3)*5+1,FALSE)&"|"&HLOOKUP(Sheet1!R2C1,Sheet1!R2C1:R16C1,MOD(RC1+6,2)+MOD(INT((RC1+6)/2),3)*5+1,FALSE) -> 130|131|160|161|100 | I474: =HLOOKUP(Sheet1!R2C1,Sheet1!R2C1:R16C1,MOD(RC1-1,3)+MOD(INT((RC1-1)/3),3)*5+3,FALSE)&"|"&HLOOKUP(Sheet1!R2C1,Sheet1!R2C1:R16C1,MOD(RC1,3)+MOD(INT((RC1)/3),3)*5+3,FALSE)&"|"&HLOOKUP(Sheet1!R2C1,Sheet1!R2C1:R16C1,MOD(RC1+1,3)+MOD(INT((RC1+1)/3),3)*5+3,FALSE)&"|"&HLOOKUP(Sheet1!R2C1,Sheet1!R2C1:R16C1,MOD(RC1+2,3)+MOD(INT((RC1+2)/3),3)*5+3,FALSE)&"|"&HLOOKUP(Sheet1!R2C1,Sheet1!R2C1:R16C1,MOD(RC1+3,3)+MOD(INT((RC1+3)/3),3)*5+3,FALSE) -> 164|102|103|104|132 | J474: =HLOOKUP(Sheet1!R2C1,Sheet1!R2C1:R16C1,MOD(RC1-1,3)+MOD(INT((RC1-1)/3),3)*5+3,FALSE)&"|"&HLOOKUP(Sheet1!R2C1,Sheet1!R2C1:R16C1,MOD(RC1,3)+MOD(INT((RC1)/3),3)*5+3,FALSE)&"|"&HLOOKUP(Sheet1!R2C1,Sheet1!R2C1:R16C1,MOD(RC1+1,3)+MOD(INT((RC1+1)/3),3)*5+3,FALSE)&"|"&HLOOKUP(Sheet1!R2C1,Sheet1!R2C1:R16C1,MOD(RC1+2,3)+MOD(INT((RC1+2)/3),3)*5+3,FALSE)&"|"&HLOOKUP(Sheet1!R2C1,Sheet1!R2C1:R16C1,MOD(RC1+3,3)+MOD(INT((RC1+3)/3),3)*5+3,FALSE) -> 164|102|103|104|132 | K474: =HLOOKUP(Sheet1!R2C1,Sheet1!R2C1:R16C1,MOD(RC1-1,3)+MOD(INT((RC1-1)/3),3)*5+3,FALSE)&"|"&HLOOKUP(Sheet1!R2C1,Sheet1!R2C1:R16C1,MOD(RC1,3)+MOD(INT((RC1)/3),3)*5+3,FALSE)&"|"&HLOOKUP(Sheet1!R2C1,Sheet1!R2C1:R16C1,MOD(RC1+1,3)+MOD(INT((RC1+1)/3),3)*5+3,FALSE)&"|"&HLOOKUP(Sheet1!R2C1,Sheet1!R2C1:R16C1,MOD(RC1+2,3)+MOD(INT((RC1+2)/3),3)*5+3,FALSE)&"|"&HLOOKUP(Sheet1!R2C1,Sheet1!R2C1:R16C1,MOD(RC1+3,3)+MOD(INT((RC1+3)/3),3)*5+3,FALSE) -> 164|102|103|104|132 | L474: 25|22|23|24 | M474: 11791335|11791335|11791335|11791335 | N474: 10030|10031|10032|10033 | O474: 1|1|1|1 | P474: 2500|2500|2500|2500
A475: 469 | B475: 467 | C475: 30 | D475: =R[-20]C+2 -> 66 | E475: 1000 | F475: =MOD(RC[-5]-1,3)*30+100&"|"&MOD(RC[-5]-1,3)*30+101&"|"&MOD(RC[-5]-1,3)*30+102&"|"&MOD(RC[-5]-1,3)*30+103&"|"&IF(MOD(RC[-5],4)=0,HLOOKUP(Sheet1!R2C10,Sheet1!R2C10:R7C10,MOD(RC[-5]/4-1,6)+1,FALSE),IF(MOD(RC[-5],2)=0,IF(RC[-5]>20,HLOOKUP(Sheet1!R2C7,Sheet1!R2C7:R43C7,MOD(RC[-5]/2-1,42)+1,FALSE),HLOOKUP(Sheet1!R2C4,Sheet1!R2C4:R7C4,MOD(RC[-5]-1,6)+1,FALSE)),MOD(RC[-5]-1,3)*30+104)) -> 100|101|102|103|104 | G475: =HLOOKUP(Sheet1!R2C1,Sheet1!R2C1:R16C1,MOD(RC1-1,2)+MOD(INT((RC1-1)/2),3)*5+1,FALSE)&"|"&HLOOKUP(Sheet1!R2C1,Sheet1!R2C1:R16C1,MOD(RC1,2)+MOD(INT((RC1)/2),3)*5+1,FALSE)&"|"&HLOOKUP(Sheet1!R2C1,Sheet1!R2C1:R16C1,MOD(RC1+1,2)+MOD(INT((RC1+1)/2),3)*5+1,FALSE)&"|"&HLOOKUP(Sheet1!R2C1,Sheet1!R2C1:R16C1,MOD(RC1+2,2)+MOD(INT((RC1+2)/2),3)*5+1,FALSE)&"|"&HLOOKUP(Sheet1!R2C1,Sheet1!R2C1:R16C1,MOD(RC1+3,2)+MOD(INT((RC1+3)/2),3)*5+1,FALSE) -> 100|101|130|131|160 | H475: =HLOOKUP(Sheet1!R2C1,Sheet1!R2C1:R16C1,MOD(RC1+2,2)+MOD(INT((RC1+2)/2),3)*5+1,FALSE)&"|"&HLOOKUP(Sheet1!R2C1,Sheet1!R2C1:R16C1,MOD(RC1+3,2)+MOD(INT((RC1+3)/2),3)*5+1,FALSE)&"|"&HLOOKUP(Sheet1!R2C1,Sheet1!R2C1:R16C1,MOD(RC1+4,2)+MOD(INT((RC1+4)/2),3)*5+1,FALSE)&"|"&HLOOKUP(Sheet1!R2C1,Sheet1!R2C1:R16C1,MOD(RC1+5,2)+MOD(INT((RC1+5)/2),3)*5+1,FALSE)&"|"&HLOOKUP(Sheet1!R2C1,Sheet1!R2C1:R16C1,MOD(RC1+6,2)+MOD(INT((RC1+6)/2),3)*5+1,FALSE) -> 131|160|161|100|101 | I475: =HLOOKUP(Sheet1!R2C1,Sheet1!R2C1:R16C1,MOD(RC1-1,3)+MOD(INT((RC1-1)/3),3)*5+3,FALSE)&"|"&HLOOKUP(Sheet1!R2C1,Sheet1!R2C1:R16C1,MOD(RC1,3)+MOD(INT((RC1)/3),3)*5+3,FALSE)&"|"&HLOOKUP(Sheet1!R2C1,Sheet1!R2C1:R16C1,MOD(RC1+1,3)+MOD(INT((RC1+1)/3),3)*5+3,FALSE)&"|"&HLOOKUP(Sheet1!R2C1,Sheet1!R2C1:R16C1,MOD(RC1+2,3)+MOD(INT((RC1+2)/3),3)*5+3,FALSE)&"|"&HLOOKUP(Sheet1!R2C1,Sheet1!R2C1:R16C1,MOD(RC1+3,3)+MOD(INT((RC1+3)/3),3)*5+3,FALSE) -> 102|103|104|132|133 | J475: =HLOOKUP(Sheet1!R2C1,Sheet1!R2C1:R16C1,MOD(RC1-1,3)+MOD(INT((RC1-1)/3),3)*5+3,FALSE)&"|"&HLOOKUP(Sheet1!R2C1,Sheet1!R2C1:R16C1,MOD(RC1,3)+MOD(INT((RC1)/3),3)*5+3,FALSE)&"|"&HLOOKUP(Sheet1!R2C1,Sheet1!R2C1:R16C1,MOD(RC1+1,3)+MOD(INT((RC1+1)/3),3)*5+3,FALSE)&"|"&HLOOKUP(Sheet1!R2C1,Sheet1!R2C1:R16C1,MOD(RC1+2,3)+MOD(INT((RC1+2)/3),3)*5+3,FALSE)&"|"&HLOOKUP(Sheet1!R2C1,Sheet1!R2C1:R16C1,MOD(RC1+3,3)+MOD(INT((RC1+3)/3),3)*5+3,FALSE) -> 102|103|104|132|133 | K475: =HLOOKUP(Sheet1!R2C1,Sheet1!R2C1:R16C1,MOD(RC1-1,3)+MOD(INT((RC1-1)/3),3)*5+3,FALSE)&"|"&HLOOKUP(Sheet1!R2C1,Sheet1!R2C1:R16C1,MOD(RC1,3)+MOD(INT((RC1)/3),3)*5+3,FALSE)&"|"&HLOOKUP(Sheet1!R2C1,Sheet1!R2C1:R16C1,MOD(RC1+1,3)+MOD(INT((RC1+1)/3),3)*5+3,FALSE)&"|"&HLOOKUP(Sheet1!R2C1,Sheet1!R2C1:R16C1,MOD(RC1+2,3)+MOD(INT((RC1+2)/3),3)*5+3,FALSE)&"|"&HLOOKUP(Sheet1!R2C1,Sheet1!R2C1:R16C1,MOD(RC1+3,3)+MOD(INT((RC1+3)/3),3)*5+3,FALSE) -> 102|103|104|132|133 | L475: 25|22|23|24 | M475: 11893567|11893568|11893568|11893568 | N475: 10030|10031|10032|10033 | O475: 1|1|1|1 | P475: 2500|2500|2500|2500
A476: 470 | B476: 468 | C476: 30 | D476: =R[-20]C+2 -> 66 | E476: 1000 | F476: =MOD(RC[-5]-1,3)*30+100&"|"&MOD(RC[-5]-1,3)*30+101&"|"&MOD(RC[-5]-1,3)*30+102&"|"&MOD(RC[-5]-1,3)*30+103&"|"&IF(MOD(RC[-5],4)=0,HLOOKUP(Sheet1!R2C10,Sheet1!R2C10:R7C10,MOD(RC[-5]/4-1,6)+1,FALSE),IF(MOD(RC[-5],2)=0,IF(RC[-5]>20,HLOOKUP(Sheet1!R2C7,Sheet1!R2C7:R43C7,MOD(RC[-5]/2-1,42)+1,FALSE),HLOOKUP(Sheet1!R2C4,Sheet1!R2C4:R7C4,MOD(RC[-5]-1,6)+1,FALSE)),MOD(RC[-5]-1,3)*30+104)) -> 130|131|132|133|152 | G476: =HLOOKUP(Sheet1!R2C1,Sheet1!R2C1:R16C1,MOD(RC1-1,2)+MOD(INT((RC1-1)/2),3)*5+1,FALSE)&"|"&HLOOKUP(Sheet1!R2C1,Sheet1!R2C1:R16C1,MOD(RC1,2)+MOD(INT((RC1)/2),3)*5+1,FALSE)&"|"&HLOOKUP(Sheet1!R2C1,Sheet1!R2C1:R16C1,MOD(RC1+1,2)+MOD(INT((RC1+1)/2),3)*5+1,FALSE)&"|"&HLOOKUP(Sheet1!R2C1,Sheet1!R2C1:R16C1,MOD(RC1+2,2)+MOD(INT((RC1+2)/2),3)*5+1,FALSE)&"|"&HLOOKUP(Sheet1!R2C1,Sheet1!R2C1:R16C1,MOD(RC1+3,2)+MOD(INT((RC1+3)/2),3)*5+1,FALSE) -> 101|130|131|160|161 | H476: =HLOOKUP(Sheet1!R2C1,Sheet1!R2C1:R16C1,MOD(RC1+2,2)+MOD(INT((RC1+2)/2),3)*5+1,FALSE)&"|"&HLOOKUP(Sheet1!R2C1,Sheet1!R2C1:R16C1,MOD(RC1+3,2)+MOD(INT((RC1+3)/2),3)*5+1,FALSE)&"|"&HLOOKUP(Sheet1!R2C1,Sheet1!R2C1:R16C1,MOD(RC1+4,2)+MOD(INT((RC1+4)/2),3)*5+1,FALSE)&"|"&HLOOKUP(Sheet1!R2C1,Sheet1!R2C1:R16C1,MOD(RC1+5,2)+MOD(INT((RC1+5)/2),3)*5+1,FALSE)&"|"&HLOOKUP(Sheet1!R2C1,Sheet1!R2C1:R16C1,MOD(RC1+6,2)+MOD(INT((RC1+6)/2),3)*5+1,FALSE) -> 160|161|100|101|130 | I476: =HLOOKUP(Sheet1!R2C1,Sheet1!R2C1:R16C1,MOD(RC1-1,3)+MOD(INT((RC1-1)/3),3)*5+3,FALSE)&"|"&HLOOKUP(Sheet1!R2C1,Sheet1!R2C1:R16C1,MOD(RC1,3)+MOD(INT((RC1)/3),3)*5+3,FALSE)&"|"&HLOOKUP(Sheet1!R2C1,Sheet1!R2C1:R16C1,MOD(RC1+1,3)+MOD(INT((RC1+1)/3),3)*5+3,FALSE)&"|"&HLOOKUP(Sheet1!R2C1,Sheet1!R2C1:R16C1,MOD(RC1+2,3)+MOD(INT((RC1+2)/3),3)*5+3,FALSE)&"|"&HLOOKUP(Sheet1!R2C1,Sheet1!R2C1:R16C1,MOD(RC1+3,3)+MOD(INT((RC1+3)/3),3)*5+3,FALSE) -> 103|104|132|133|134 | J476: =HLOOKUP(Sheet1!R2C1,Sheet1!R2C1:R16C1,MOD(RC1-1,3)+MOD(INT((RC1-1)/3),3)*5+3,FALSE)&"|"&HLOOKUP(Sheet1!R2C1,Sheet1!R2C1:R16C1,MOD(RC1,3)+MOD(INT((RC1)/3),3)*5+3,FALSE)&"|"&HLOOKUP(Sheet1!R2C1,Sheet1!R2C1:R16C1,MOD(RC1+1,3)+MOD(INT((RC1+1)/3),3)*5+3,FALSE)&"|"&HLOOKUP(Sheet1!R2C1,Sheet1!R2C1:R16C1,MOD(RC1+2,3)+MOD(INT((RC1+2)/3),3)*5+3,FALSE)&"|"&HLOOKUP(Sheet1!R2C1,Sheet1!R2C1:R16C1,MOD(RC1+3,3)+MOD(INT((RC1+3)/3),3)*5+3,FALSE) -> 103|104|132|133|134 | K476: =HLOOKUP(Sheet1!R2C1,Sheet1!R2C1:R16C1,MOD(RC1-1,3)+MOD(INT((RC1-1)/3),3)*5+3,FALSE)&"|"&HLOOKUP(Sheet1!R2C1,Sheet1!R2C1:R16C1,MOD(RC1,3)+MOD(INT((RC1)/3),3)*5+3,FALSE)&"|"&HLOOKUP(Sheet1!R2C1,Sheet1!R2C1:R16C1,MOD(RC1+1,3)+MOD(INT((RC1+1)/3),3)*5+3,FALSE)&"|"&HLOOKUP(Sheet1!R2C1,Sheet1!R2C1:R16C1,MOD(RC1+2,3)+MOD(INT((RC1+2)/3),3)*5+3,FALSE)&"|"&HLOOKUP(Sheet1!R2C1,Sheet1!R2C1:R16C1,MOD(RC1+3,3)+MOD(INT((RC1+3)/3),3)*5+3,FALSE) -> 103|104|132|133|134 | L476: 25|22|23|24 | M476: 11994066|11994066|11994065|11994065 | N476: 10030|10031|10032|10033|10030|10031|10032|10033|10030|10031|10032|10033|10030|10031|10032|10033|10030|10031|10032|10033|10030|10031|10032|10033|10030|10031|10032|10033|10030|10031|10032|10033|10030|10031|10032|10033|10030|10031|10032|10033 | O476: 1|1|1|1|1|1|1|1|1|1|1|1|1|1|1|1|1|1|1|1|1|1|1|1|1|1|1|1|1|1|1|1|1|1|1|1|1|1|1|1 | P476: 2500|2500|2500|2500|2500|2500|2500|2500|2500|2500|2500|2500|2500|2500|2500|2500|2500|2500|2500|2500|2500|2500|2500|2500|2500|2500|2500|2500|2500|2500|2500|2500|2500|2500|2500|2500|2500|2500|2500|2500
A477: 471 | B477: 469 | C477: 30 | D477: =R[-20]C+2 -> 66 | E477: 1000 | F477: =MOD(RC[-5]-1,3)*30+100&"|"&MOD(RC[-5]-1,3)*30+101&"|"&MOD(RC[-5]-1,3)*30+102&"|"&MOD(RC[-5]-1,3)*30+103&"|"&IF(MOD(RC[-5],4)=0,HLOOKUP(Sheet1!R2C10,Sheet1!R2C10:R7C10,MOD(RC[-5]/4-1,6)+1,FALSE),IF(MOD(RC[-5],2)=0,IF(RC[-5]>20,HLOOKUP(Sheet1!R2C7,Sheet1!R2C7:R43C7,MOD(RC[-5]/2-1,42)+1,FALSE),HLOOKUP(Sheet1!R2C4,Sheet1!R2C4:R7C4,MOD(RC[-5]-1,6)+1,FALSE)),MOD(RC[-5]-1,3)*30+104)) -> 160|161|162|163|164 | G477: =HLOOKUP(Sheet1!R2C1,Sheet1!R2C1:R16C1,MOD(RC1-1,2)+MOD(INT((RC1-1)/2),3)*5+1,FALSE)&"|"&HLOOKUP(Sheet1!R2C1,Sheet1!R2C1:R16C1,MOD(RC1,2)+MOD(INT((RC1)/2),3)*5+1,FALSE)&"|"&HLOOKUP(Sheet1!R2C1,Sheet1!R2C1:R16C1,MOD(RC1+1,2)+MOD(INT((RC1+1)/2),3)*5+1,FALSE)&"|"&HLOOKUP(Sheet1!R2C1,Sheet1!R2C1:R16C1,MOD(RC1+2,2)+MOD(INT((RC1+2)/2),3)*5+1,FALSE)&"|"&HLOOKUP(Sheet1!R2C1,Sheet1!R2C1:R16C1,MOD(RC1+3,2)+MOD(INT((RC1+3)/2),3)*5+1,FALSE) -> 130|131|160|161|100 | H477: =HLOOKUP(Sheet1!R2C1,Sheet1!R2C1:R16C1,MOD(RC1+2,2)+MOD(INT((RC1+2)/2),3)*5+1,FALSE)&"|"&HLOOKUP(Sheet1!R2C1,Sheet1!R2C1:R16C1,MOD(RC1+3,2)+MOD(INT((RC1+3)/2),3)*5+1,FALSE)&"|"&HLOOKUP(Sheet1!R2C1,Sheet1!R2C1:R16C1,MOD(RC1+4,2)+MOD(INT((RC1+4)/2),3)*5+1,FALSE)&"|"&HLOOKUP(Sheet1!R2C1,Sheet1!R2C1:R16C1,MOD(RC1+5,2)+MOD(INT((RC1+5)/2),3)*5+1,FALSE)&"|"&HLOOKUP(Sheet1!R2C1,Sheet1!R2C1:R16C1,MOD(RC1+6,2)+MOD(INT((RC1+6)/2),3)*5+1,FALSE) -> 161|100|101|130|131 | I477: =HLOOKUP(Sheet1!R2C1,Sheet1!R2C1:R16C1,MOD(RC1-1,3)+MOD(INT((RC1-1)/3),3)*5+3,FALSE)&"|"&HLOOKUP(Sheet1!R2C1,Sheet1!R2C1:R16C1,MOD(RC1,3)+MOD(INT((RC1)/3),3)*5+3,FALSE)&"|"&HLOOKUP(Sheet1!R2C1,Sheet1!R2C1:R16C1,MOD(RC1+1,3)+MOD(INT((RC1+1)/3),3)*5+3,FALSE)&"|"&HLOOKUP(Sheet1!R2C1,Sheet1!R2C1:R16C1,MOD(RC1+2,3)+MOD(INT((RC1+2)/3),3)*5+3,FALSE)&"|"&HLOOKUP(Sheet1!R2C1,Sheet1!R2C1:R16C1,MOD(RC1+3,3)+MOD(INT((RC1+3)/3),3)*5+3,FALSE) -> 104|132|133|134|162 | J477: =HLOOKUP(Sheet1!R2C1,Sheet1!R2C1:R16C1,MOD(RC1-1,3)+MOD(INT((RC1-1)/3),3)*5+3,FALSE)&"|"&HLOOKUP(Sheet1!R2C1,Sheet1!R2C1:R16C1,MOD(RC1,3)+MOD(INT((RC1)/3),3)*5+3,FALSE)&"|"&HLOOKUP(Sheet1!R2C1,Sheet1!R2C1:R16C1,MOD(RC1+1,3)+MOD(INT((RC1+1)/3),3)*5+3,FALSE)&"|"&HLOOKUP(Sheet1!R2C1,Sheet1!R2C1:R16C1,MOD(RC1+2,3)+MOD(INT((RC1+2)/3),3)*5+3,FALSE)&"|"&HLOOKUP(Sheet1!R2C1,Sheet1!R2C1:R16C1,MOD(RC1+3,3)+MOD(INT((RC1+3)/3),3)*5+3,FALSE) -> 104|132|133|134|162 | K477: =HLOOKUP(Sheet1!R2C1,Sheet1!R2C1:R16C1,MOD(RC1-1,3)+MOD(INT((RC1-1)/3),3)*5+3,FALSE)&"|"&HLOOKUP(Sheet1!R2C1,Sheet1!R2C1:R16C1,MOD(RC1,3)+MOD(INT((RC1)/3),3)*5+3,FALSE)&"|"&HLOOKUP(Sheet1!R2C1,Sheet1!R2C1:R16C1,MOD(RC1+1,3)+MOD(INT((RC1+1)/3),3)*5+3,FALSE)&"|"&HLOOKUP(Sheet1!R2C1,Sheet1!R2C1:R16C1,MOD(RC1+2,3)+MOD(INT((RC1+2)/3),3)*5+3,FALSE)&"|"&HLOOKUP(Sheet1!R2C1,Sheet1!R2C1:R16C1,MOD(RC1+3,3)+MOD(INT((RC1+3)/3),3)*5+3,FALSE) -> 104|132|133|134|162 | L477: 25|22|23|24 | M477: 12098935|12098935|12098935|12098935 | N477: 10030|10031|10032|10033 | O477: 1|1|1|1 | P477: 2500|2500|2500|2500
A478: 472 | B478: 470 | C478: 30 | D478: =R[-20]C+2 -> 66 | E478: 1000 | F478: =MOD(RC[-5]-1,3)*30+100&"|"&MOD(RC[-5]-1,3)*30+101&"|"&MOD(RC[-5]-1,3)*30+102&"|"&MOD(RC[-5]-1,3)*30+103&"|"&IF(MOD(RC[-5],4)=0,HLOOKUP(Sheet1!R2C10,Sheet1!R2C10:R7C10,MOD(RC[-5]/4-1,6)+1,FALSE),IF(MOD(RC[-5],2)=0,IF(RC[-5]>20,HLOOKUP(Sheet1!R2C7,Sheet1!R2C7:R43C7,MOD(RC[-5]/2-1,42)+1,FALSE),HLOOKUP(Sheet1!R2C4,Sheet1!R2C4:R7C4,MOD(RC[-5]-1,6)+1,FALSE)),MOD(RC[-5]-1,3)*30+104)) -> 100|101|102|103|193 | G478: =HLOOKUP(Sheet1!R2C1,Sheet1!R2C1:R16C1,MOD(RC1-1,2)+MOD(INT((RC1-1)/2),3)*5+1,FALSE)&"|"&HLOOKUP(Sheet1!R2C1,Sheet1!R2C1:R16C1,MOD(RC1,2)+MOD(INT((RC1)/2),3)*5+1,FALSE)&"|"&HLOOKUP(Sheet1!R2C1,Sheet1!R2C1:R16C1,MOD(RC1+1,2)+MOD(INT((RC1+1)/2),3)*5+1,FALSE)&"|"&HLOOKUP(Sheet1!R2C1,Sheet1!R2C1:R16C1,MOD(RC1+2,2)+MOD(INT((RC1+2)/2),3)*5+1,FALSE)&"|"&HLOOKUP(Sheet1!R2C1,Sheet1!R2C1:R16C1,MOD(RC1+3,2)+MOD(INT((RC1+3)/2),3)*5+1,FALSE) -> 131|160|161|100|101 | H478: =HLOOKUP(Sheet1!R2C1,Sheet1!R2C1:R16C1,MOD(RC1+2,2)+MOD(INT((RC1+2)/2),3)*5+1,FALSE)&"|"&HLOOKUP(Sheet1!R2C1,Sheet1!R2C1:R16C1,MOD(RC1+3,2)+MOD(INT((RC1+3)/2),3)*5+1,FALSE)&"|"&HLOOKUP(Sheet1!R2C1,Sheet1!R2C1:R16C1,MOD(RC1+4,2)+MOD(INT((RC1+4)/2),3)*5+1,FALSE)&"|"&HLOOKUP(Sheet1!R2C1,Sheet1!R2C1:R16C1,MOD(RC1+5,2)+MOD(INT((RC1+5)/2),3)*5+1,FALSE)&"|"&HLOOKUP(Sheet1!R2C1,Sheet1!R2C1:R16C1,MOD(RC1+6,2)+MOD(INT((RC1+6)/2),3)*5+1,FALSE) -> 100|101|130|131|160 | I478: =HLOOKUP(Sheet1!R2C1,Sheet1!R2C1:R16C1,MOD(RC1-1,3)+MOD(INT((RC1-1)/3),3)*5+3,FALSE)&"|"&HLOOKUP(Sheet1!R2C1,Sheet1!R2C1:R16C1,MOD(RC1,3)+MOD(INT((RC1)/3),3)*5+3,FALSE)&"|"&HLOOKUP(Sheet1!R2C1,Sheet1!R2C1:R16C1,MOD(RC1+1,3)+MOD(INT((RC1+1)/3),3)*5+3,FALSE)&"|"&HLOOKUP(Sheet1!R2C1,Sheet1!R2C1:R16C1,MOD(RC1+2,3)+MOD(INT((RC1+2)/3),3)*5+3,FALSE)&"|"&HLOOKUP(Sheet1!R2C1,Sheet1!R2C1:R16C1,MOD(RC1+3,3)+MOD(INT((RC1+3)/3),3)*5+3,FALSE) -> 132|133|134|162|163 | J478: =HLOOKUP(Sheet1!R2C1,Sheet1!R2C1:R16C1,MOD(RC1-1,3)+MOD(INT((RC1-1)/3),3)*5+3,FALSE)&"|"&HLOOKUP(Sheet1!R2C1,Sheet1!R2C1:R16C1,MOD(RC1,3)+MOD(INT((RC1)/3),3)*5+3,FALSE)&"|"&HLOOKUP(Sheet1!R2C1,Sheet1!R2C1:R16C1,MOD(RC1+1,3)+MOD(INT((RC1+1)/3),3)*5+3,FALSE)&"|"&HLOOKUP(Sheet1!R2C1,Sheet1!R2C1:R16C1,MOD(RC1+2,3)+MOD(INT((RC1+2)/3),3)*5+3,FALSE)&"|"&HLOOKUP(Sheet1!R2C1,Sheet1!R2C1:R16C1,MOD(RC1+3,3)+MOD(INT((RC1+3)/3),3)*5+3,FALSE) -> 132|133|134|162|163 | K478: =HLOOKUP(Sheet1!R2C1,Sheet1!R2C1:R16C1,MOD(RC1-1,3)+MOD(INT((RC1-1)/3),3)*5+3,FALSE)&"|"&HLOOKUP(Sheet1!R2C1,Sheet1!R2C1:R16C1,MOD(RC1,3)+MOD(INT((RC1)/3),3)*5+3,FALSE)&"|"&HLOOKUP(Sheet1!R2C1,Sheet1!R2C1:R16C1,MOD(RC1+1,3)+MOD(INT((RC1+1)/3),3)*5+3,FALSE)&"|"&HLOOKUP(Sheet1!R2C1,Sheet1!R2C1:R16C1,MOD(RC1+2,3)+MOD(INT((RC1+2)/3),3)*5+3,FALSE)&"|"&HLOOKUP(Sheet1!R2C1,Sheet1!R2C1:R16C1,MOD(RC1+3,3)+MOD(INT((RC1+3)/3),3)*5+3,FALSE) -> 132|133|134|162|163 | L478: 25|22|23|24 | M478: 12199434|12199434|12199435|12199435 | N478: 10030|10031|10032|10033 | O478: 1|1|1|1 | P478: 2500|2500|2500|2500
A479: 473 | B479: 471 | C479: 30 | D479: =R[-20]C+2 -> 66 | E479: 1000 | F479: =MOD(RC[-5]-1,3)*30+100&"|"&MOD(RC[-5]-1,3)*30+101&"|"&MOD(RC[-5]-1,3)*30+102&"|"&MOD(RC[-5]-1,3)*30+103&"|"&IF(MOD(RC[-5],4)=0,HLOOKUP(Sheet1!R2C10,Sheet1!R2C10:R7C10,MOD(RC[-5]/4-1,6)+1,FALSE),IF(MOD(RC[-5],2)=0,IF(RC[-5]>20,HLOOKUP(Sheet1!R2C7,Sheet1!R2C7:R43C7,MOD(RC[-5]/2-1,42)+1,FALSE),HLOOKUP(Sheet1!R2C4,Sheet1!R2C4:R7C4,MOD(RC[-5]-1,6)+1,FALSE)),MOD(RC[-5]-1,3)*30+104)) -> 130|131|132|133|134 | G479: =HLOOKUP(Sheet1!R2C1,Sheet1!R2C1:R16C1,MOD(RC1-1,2)+MOD(INT((RC1-1)/2),3)*5+1,FALSE)&"|"&HLOOKUP(Sheet1!R2C1,Sheet1!R2C1:R16C1,MOD(RC1,2)+MOD(INT((RC1)/2),3)*5+1,FALSE)&"|"&HLOOKUP(Sheet1!R2C1,Sheet1!R2C1:R16C1,MOD(RC1+1,2)+MOD(INT((RC1+1)/2),3)*5+1,FALSE)&"|"&HLOOKUP(Sheet1!R2C1,Sheet1!R2C1:R16C1,MOD(RC1+2,2)+MOD(INT((RC1+2)/2),3)*5+1,FALSE)&"|"&HLOOKUP(Sheet1!R2C1,Sheet1!R2C1:R16C1,MOD(RC1+3,2)+MOD(INT((RC1+3)/2),3)*5+1,FALSE) -> 160|161|100|101|130 | H479: =HLOOKUP(Sheet1!R2C1,Sheet1!R2C1:R16C1,MOD(RC1+2,2)+MOD(INT((RC1+2)/2),3)*5+1,FALSE)&"|"&HLOOKUP(Sheet1!R2C1,Sheet1!R2C1:R16C1,MOD(RC1+3,2)+MOD(INT((RC1+3)/2),3)*5+1,FALSE)&"|"&HLOOKUP(Sheet1!R2C1,Sheet1!R2C1:R16C1,MOD(RC1+4,2)+MOD(INT((RC1+4)/2),3)*5+1,FALSE)&"|"&HLOOKUP(Sheet1!R2C1,Sheet1!R2C1:R16C1,MOD(RC1+5,2)+MOD(INT((RC1+5)/2),3)*5+1,FALSE)&"|"&HLOOKUP(Sheet1!R2C1,Sheet1!R2C1:R16C1,MOD(RC1+6,2)+MOD(INT((RC1+6)/2),3)*5+1,FALSE) -> 101|130|131|160|161 | I479: =HLOOKUP(Sheet1!R2C1,Sheet1!R2C1:R16C1,MOD(RC1-1,3)+MOD(INT((RC1-1)/3),3)*5+3,FALSE)&"|"&HLOOKUP(Sheet1!R2C1,Sheet1!R2C1:R16C1,MOD(RC1,3)+MOD(INT((RC1)/3),3)*5+3,FALSE)&"|"&HLOOKUP(Sheet1!R2C1,Sheet1!R2C1:R16C1,MOD(RC1+1,3)+MOD(INT((RC1+1)/3),3)*5+3,FALSE)&"|"&HLOOKUP(Sheet1!R2C1,Sheet1!R2C1:R16C1,MOD(RC1+2,3)+MOD(INT((RC1+2)/3),3)*5+3,FALSE)&"|"&HLOOKUP(Sheet1!R2C1,Sheet1!R2C1:R16C1,MOD(RC1+3,3)+MOD(INT((RC1+3)/3),3)*5+3,FALSE) -> 133|134|162|163|164 | J479: =HLOOKUP(Sheet1!R2C1,Sheet1!R2C1:R16C1,MOD(RC1-1,3)+MOD(INT((RC1-1)/3),3)*5+3,FALSE)&"|"&HLOOKUP(Sheet1!R2C1,Sheet1!R2C1:R16C1,MOD(RC1,3)+MOD(INT((RC1)/3),3)*5+3,FALSE)&"|"&HLOOKUP(Sheet1!R2C1,Sheet1!R2C1:R16C1,MOD(RC1+1,3)+MOD(INT((RC1+1)/3),3)*5+3,FALSE)&"|"&HLOOKUP(Sheet1!R2C1,Sheet1!R2C1:R16C1,MOD(RC1+2,3)+MOD(INT((RC1+2)/3),3)*5+3,FALSE)&"|"&HLOOKUP(Sheet1!R2C1,Sheet1!R2C1:R16C1,MOD(RC1+3,3)+MOD(INT((RC1+3)/3),3)*5+3,FALSE) -> 133|134|162|163|164 | K479: =HLOOKUP(Sheet1!R2C1,Sheet1!R2C1:R16C1,MOD(RC1-1,3)+MOD(INT((RC1-1)/3),3)*5+3,FALSE)&"|"&HLOOKUP(Sheet1!R2C1,Sheet1!R2C1:R16C1,MOD(RC1,3)+MOD(INT((RC1)/3),3)*5+3,FALSE)&"|"&HLOOKUP(Sheet1!R2C1,Sheet1!R2C1:R16C1,MOD(RC1+1,3)+MOD(INT((RC1+1)/3),3)*5+3,FALSE)&"|"&HLOOKUP(Sheet1!R2C1,Sheet1!R2C1:R16C1,MOD(RC1+2,3)+MOD(INT((RC1+2)/3),3)*5+3,FALSE)&"|"&HLOOKUP(Sheet1!R2C1,Sheet1!R2C1:R16C1,MOD(RC1+3,3)+MOD(INT((RC1+3)/3),3)*5+3,FALSE) -> 133|134|162|163|164 | L479: 25|22|23|24 | M479: 12299934|12299934|12299933|12299933 | N479: 10030|10031|10032|10033 | O479: 1|1|1|1 | P479: 2500|2500|2500|2500
A480: 474 | B480: 472 | C480: 30 | D480: =R[-20]C+2 -> 66 | E480: 1000 | F480: =MOD(RC[-5]-1,3)*30+100&"|"&MOD(RC[-5]-1,3)*30+101&"|"&MOD(RC[-5]-1,3)*30+102&"|"&MOD(RC[-5]-1,3)*30+103&"|"&IF(MOD(RC[-5],4)=0,HLOOKUP(Sheet1!R2C10,Sheet1!R2C10:R7C10,MOD(RC[-5]/4-1,6)+1,FALSE),IF(MOD(RC[-5],2)=0,IF(RC[-5]>20,HLOOKUP(Sheet1!R2C7,Sheet1!R2C7:R43C7,MOD(RC[-5]/2-1,42)+1,FALSE),HLOOKUP(Sheet1!R2C4,Sheet1!R2C4:R7C4,MOD(RC[-5]-1,6)+1,FALSE)),MOD(RC[-5]-1,3)*30+104)) -> 160|161|162|163|154 | G480: =HLOOKUP(Sheet1!R2C1,Sheet1!R2C1:R16C1,MOD(RC1-1,2)+MOD(INT((RC1-1)/2),3)*5+1,FALSE)&"|"&HLOOKUP(Sheet1!R2C1,Sheet1!R2C1:R16C1,MOD(RC1,2)+MOD(INT((RC1)/2),3)*5+1,FALSE)&"|"&HLOOKUP(Sheet1!R2C1,Sheet1!R2C1:R16C1,MOD(RC1+1,2)+MOD(INT((RC1+1)/2),3)*5+1,FALSE)&"|"&HLOOKUP(Sheet1!R2C1,Sheet1!R2C1:R16C1,MOD(RC1+2,2)+MOD(INT((RC1+2)/2),3)*5+1,FALSE)&"|"&HLOOKUP(Sheet1!R2C1,Sheet1!R2C1:R16C1,MOD(RC1+3,2)+MOD(INT((RC1+3)/2),3)*5+1,FALSE) -> 161|100|101|130|131 | H480: =HLOOKUP(Sheet1!R2C1,Sheet1!R2C1:R16C1,MOD(RC1+2,2)+MOD(INT((RC1+2)/2),3)*5+1,FALSE)&"|"&HLOOKUP(Sheet1!R2C1,Sheet1!R2C1:R16C1,MOD(RC1+3,2)+MOD(INT((RC1+3)/2),3)*5+1,FALSE)&"|"&HLOOKUP(Sheet1!R2C1,Sheet1!R2C1:R16C1,MOD(RC1+4,2)+MOD(INT((RC1+4)/2),3)*5+1,FALSE)&"|"&HLOOKUP(Sheet1!R2C1,Sheet1!R2C1:R16C1,MOD(RC1+5,2)+MOD(INT((RC1+5)/2),3)*5+1,FALSE)&"|"&HLOOKUP(Sheet1!R2C1,Sheet1!R2C1:R16C1,MOD(RC1+6,2)+MOD(INT((RC1+6)/2),3)*5+1,FALSE) -> 130|131|160|161|100 | I480: =HLOOKUP(Sheet1!R2C1,Sheet1!R2C1:R16C1,MOD(RC1-1,3)+MOD(INT((RC1-1)/3),3)*5+3,FALSE)&"|"&HLOOKUP(Sheet1!R2C1,Sheet1!R2C1:R16C1,MOD(RC1,3)+MOD(INT((RC1)/3),3)*5+3,FALSE)&"|"&HLOOKUP(Sheet1!R2C1,Sheet1!R2C1:R16C1,MOD(RC1+1,3)+MOD(INT((RC1+1)/3),3)*5+3,FALSE)&"|"&HLOOKUP(Sheet1!R2C1,Sheet1!R2C1:R16C1,MOD(RC1+2,3)+MOD(INT((RC1+2)/3),3)*5+3,FALSE)&"|"&HLOOKUP(Sheet1!R2C1,Sheet1!R2C1:R16C1,MOD(RC1+3,3)+MOD(INT((RC1+3)/3),3)*5+3,FALSE) -> 134|162|163|164|102 | J480: =HLOOKUP(Sheet1!R2C1,Sheet1!R2C1:R16C1,MOD(RC1-1,3)+MOD(INT((RC1-1)/3),3)*5+3,FALSE)&"|"&HLOOKUP(Sheet1!R2C1,Sheet1!R2C1:R16C1,MOD(RC1,3)+MOD(INT((RC1)/3),3)*5+3,FALSE)&"|"&HLOOKUP(Sheet1!R2C1,Sheet1!R2C1:R16C1,MOD(RC1+1,3)+MOD(INT((RC1+1)/3),3)*5+3,FALSE)&"|"&HLOOKUP(Sheet1!R2C1,Sheet1!R2C1:R16C1,MOD(RC1+2,3)+MOD(INT((RC1+2)/3),3)*5+3,FALSE)&"|"&HLOOKUP(Sheet1!R2C1,Sheet1!R2C1:R16C1,MOD(RC1+3,3)+MOD(INT((RC1+3)/3),3)*5+3,FALSE) -> 134|162|163|164|102 | K480: =HLOOKUP(Sheet1!R2C1,Sheet1!R2C1:R16C1,MOD(RC1-1,3)+MOD(INT((RC1-1)/3),3)*5+3,FALSE)&"|"&HLOOKUP(Sheet1!R2C1,Sheet1!R2C1:R16C1,MOD(RC1,3)+MOD(INT((RC1)/3),3)*5+3,FALSE)&"|"&HLOOKUP(Sheet1!R2C1,Sheet1!R2C1:R16C1,MOD(RC1+1,3)+MOD(INT((RC1+1)/3),3)*5+3,FALSE)&"|"&HLOOKUP(Sheet1!R2C1,Sheet1!R2C1:R16C1,MOD(RC1+2,3)+MOD(INT((RC1+2)/3),3)*5+3,FALSE)&"|"&HLOOKUP(Sheet1!R2C1,Sheet1!R2C1:R16C1,MOD(RC1+3,3)+MOD(INT((RC1+3)/3),3)*5+3,FALSE) -> 134|162|163|164|102 | L480: 25|22|23|24 | M480: 12408662|12408661|12408663|12408663 | N480: 10030|10031|10032|10033 | O480: 1|1|1|1 | P480: 2500|2500|2500|2500
A481: 475 | B481: 473 | C481: 30 | D481: =R[-20]C+2 -> 66 | E481: 1000 | F481: =MOD(RC[-5]-1,3)*30+100&"|"&MOD(RC[-5]-1,3)*30+101&"|"&MOD(RC[-5]-1,3)*30+102&"|"&MOD(RC[-5]-1,3)*30+103&"|"&IF(MOD(RC[-5],4)=0,HLOOKUP(Sheet1!R2C10,Sheet1!R2C10:R7C10,MOD(RC[-5]/4-1,6)+1,FALSE),IF(MOD(RC[-5],2)=0,IF(RC[-5]>20,HLOOKUP(Sheet1!R2C7,Sheet1!R2C7:R43C7,MOD(RC[-5]/2-1,42)+1,FALSE),HLOOKUP(Sheet1!R2C4,Sheet1!R2C4:R7C4,MOD(RC[-5]-1,6)+1,FALSE)),MOD(RC[-5]-1,3)*30+104)) -> 100|101|102|103|104 | G481: =HLOOKUP(Sheet1!R2C1,Sheet1!R2C1:R16C1,MOD(RC1-1,2)+MOD(INT((RC1-1)/2),3)*5+1,FALSE)&"|"&HLOOKUP(Sheet1!R2C1,Sheet1!R2C1:R16C1,MOD(RC1,2)+MOD(INT((RC1)/2),3)*5+1,FALSE)&"|"&HLOOKUP(Sheet1!R2C1,Sheet1!R2C1:R16C1,MOD(RC1+1,2)+MOD(INT((RC1+1)/2),3)*5+1,FALSE)&"|"&HLOOKUP(Sheet1!R2C1,Sheet1!R2C1:R16C1,MOD(RC1+2,2)+MOD(INT((RC1+2)/2),3)*5+1,FALSE)&"|"&HLOOKUP(Sheet1!R2C1,Sheet1!R2C1:R16C1,MOD(RC1+3,2)+MOD(INT((RC1+3)/2),3)*5+1,FALSE) -> 100|101|130|131|160 | H481: =HLOOKUP(Sheet1!R2C1,Sheet1!R2C1:R16C1,MOD(RC1+2,2)+MOD(INT((RC1+2)/2),3)*5+1,FALSE)&"|"&HLOOKUP(Sheet1!R2C1,Sheet1!R2C1:R16C1,MOD(RC1+3,2)+MOD(INT((RC1+3)/2),3)*5+1,FALSE)&"|"&HLOOKUP(Sheet1!R2C1,Sheet1!R2C1:R16C1,MOD(RC1+4,2)+MOD(INT((RC1+4)/2),3)*5+1,FALSE)&"|"&HLOOKUP(Sheet1!R2C1,Sheet1!R2C1:R16C1,MOD(RC1+5,2)+MOD(INT((RC1+5)/2),3)*5+1,FALSE)&"|"&HLOOKUP(Sheet1!R2C1,Sheet1!R2C1:R16C1,MOD(RC1+6,2)+MOD(INT((RC1+6)/2),3)*5+1,FALSE) -> 131|160|161|100|101 | I481: =HLOOKUP(Sheet1!R2C1,Sheet1!R2C1:R16C1,MOD(RC1-1,3)+MOD(INT((RC1-1)/3),3)*5+3,FALSE)&"|"&HLOOKUP(Sheet1!R2C1,Sheet1!R2C1:R16C1,MOD(RC1,3)+MOD(INT((RC1)/3),3)*5+3,FALSE)&"|"&HLOOKUP(Sheet1!R2C1,Sheet1!R2C1:R16C1,MOD(RC1+1,3)+MOD(INT((RC1+1)/3),3)*5+3,FALSE)&"|"&HLOOKUP(Sheet1!R2C1,Sheet1!R2C1:R16C1,MOD(RC1+2,3)+MOD(INT((RC1+2)/3),3)*5+3,FALSE)&"|"&HLOOKUP(Sheet1!R2C1,Sheet1!R2C1:R16C1,MOD(RC1+3,3)+MOD(INT((RC1+3)/3),3)*5+3,FALSE) -> 162|163|164|102|103 | J481: =HLOOKUP(Sheet1!R2C1,Sheet1!R2C1:R16C1,MOD(RC1-1,3)+MOD(INT((RC1-1)/3),3)*5+3,FALSE)&"|"&HLOOKUP(Sheet1!R2C1,Sheet1!R2C1:R16C1,MOD(RC1,3)+MOD(INT((RC1)/3),3)*5+3,FALSE)&"|"&HLOOKUP(Sheet1!R2C1,Sheet1!R2C1:R16C1,MOD(RC1+1,3)+MOD(INT((RC1+1)/3),3)*5+3,FALSE)&"|"&HLOOKUP(Sheet1!R2C1,Sheet1!R2C1:R16C1,MOD(RC1+2,3)+MOD(INT((RC1+2)/3),3)*5+3,FALSE)&"|"&HLOOKUP(Sheet1!R2C1,Sheet1!R2C1:R16C1,MOD(RC1+3,3)+MOD(INT((RC1+3)/3),3)*5+3,FALSE) -> 162|163|164|102|103 | K481: =HLOOKUP(Sheet1!R2C1,Sheet1!R2C1:R16C1,MOD(RC1-1,3)+MOD(INT((RC1-1)/3),3)*5+3,FALSE)&"|"&HLOOKUP(Sheet1!R2C1,Sheet1!R2C1:R16C1,MOD(RC1,3)+MOD(INT((RC1)/3),3)*5+3,FALSE)&"|"&HLOOKUP(Sheet1!R2C1,Sheet1!R2C1:R16C1,MOD(RC1+1,3)+MOD(INT((RC1+1)/3),3)*5+3,FALSE)&"|"&HLOOKUP(Sheet1!R2C1,Sheet1!R2C1:R16C1,MOD(RC1+2,3)+MOD(INT((RC1+2)/3),3)*5+3,FALSE)&"|"&HLOOKUP(Sheet1!R2C1,Sheet1!R2C1:R16C1,MOD(RC1+3,3)+MOD(INT((RC1+3)/3),3)*5+3,FALSE) -> 162|163|164|102|103 | L481: 25|22|23|24 | M481: 12512860|12512860|12512860|12512860 | N481: 10030|10031|10032|10033|10030|10031|10032|10033|10030|10031|10032|10033|10030|10031|10032|10033|10030|10031|10032|10033|10030|10031|10032|10033|10030|10031|10032|10033|10030|10031|10032|10033|10030|10031|10032|10033|10030|10031|10032|10033 | O481: 1|1|1|1|1|1|1|1|1|1|1|1|1|1|1|1|1|1|1|1|1|1|1|1|1|1|1|1|1|1|1|1|1|1|1|1|1|1|1|1 | P481: 2500|2500|2500|2500|2500|2500|2500|2500|2500|2500|2500|2500|2500|2500|2500|2500|2500|2500|2500|2500|2500|2500|2500|2500|2500|2500|2500|2500|2500|2500|2500|2500|2500|2500|2500|2500|2500|2500|2500|2500
A482: 476 | B482: 474 | C482: 30 | D482: =R[-20]C+2 -> 66 | E482: 1000 | F482: =MOD(RC[-5]-1,3)*30+100&"|"&MOD(RC[-5]-1,3)*30+101&"|"&MOD(RC[-5]-1,3)*30+102&"|"&MOD(RC[-5]-1,3)*30+103&"|"&IF(MOD(RC[-5],4)=0,HLOOKUP(Sheet1!R2C10,Sheet1!R2C10:R7C10,MOD(RC[-5]/4-1,6)+1,FALSE),IF(MOD(RC[-5],2)=0,IF(RC[-5]>20,HLOOKUP(Sheet1!R2C7,Sheet1!R2C7:R43C7,MOD(RC[-5]/2-1,42)+1,FALSE),HLOOKUP(Sheet1!R2C4,Sheet1!R2C4:R7C4,MOD(RC[-5]-1,6)+1,FALSE)),MOD(RC[-5]-1,3)*30+104)) -> 130|131|132|133|194 | G482: =HLOOKUP(Sheet1!R2C1,Sheet1!R2C1:R16C1,MOD(RC1-1,2)+MOD(INT((RC1-1)/2),3)*5+1,FALSE)&"|"&HLOOKUP(Sheet1!R2C1,Sheet1!R2C1:R16C1,MOD(RC1,2)+MOD(INT((RC1)/2),3)*5+1,FALSE)&"|"&HLOOKUP(Sheet1!R2C1,Sheet1!R2C1:R16C1,MOD(RC1+1,2)+MOD(INT((RC1+1)/2),3)*5+1,FALSE)&"|"&HLOOKUP(Sheet1!R2C1,Sheet1!R2C1:R16C1,MOD(RC1+2,2)+MOD(INT((RC1+2)/2),3)*5+1,FALSE)&"|"&HLOOKUP(Sheet1!R2C1,Sheet1!R2C1:R16C1,MOD(RC1+3,2)+MOD(INT((RC1+3)/2),3)*5+1,FALSE) -> 101|130|131|160|161 | H482: =HLOOKUP(Sheet1!R2C1,Sheet1!R2C1:R16C1,MOD(RC1+2,2)+MOD(INT((RC1+2)/2),3)*5+1,FALSE)&"|"&HLOOKUP(Sheet1!R2C1,Sheet1!R2C1:R16C1,MOD(RC1+3,2)+MOD(INT((RC1+3)/2),3)*5+1,FALSE)&"|"&HLOOKUP(Sheet1!R2C1,Sheet1!R2C1:R16C1,MOD(RC1+4,2)+MOD(INT((RC1+4)/2),3)*5+1,FALSE)&"|"&HLOOKUP(Sheet1!R2C1,Sheet1!R2C1:R16C1,MOD(RC1+5,2)+MOD(INT((RC1+5)/2),3)*5+1,FALSE)&"|"&HLOOKUP(Sheet1!R2C1,Sheet1!R2C1:R16C1,MOD(RC1+6,2)+MOD(INT((RC1+6)/2),3)*5+1,FALSE) -> 160|161|100|101|130 | I482: =HLOOKUP(Sheet1!R2C1,Sheet1!R2C1:R16C1,MOD(RC1-1,3)+MOD(INT((RC1-1)/3),3)*5+3,FALSE)&"|"&HLOOKUP(Sheet1!R2C1,Sheet1!R2C1:R16C1,MOD(RC1,3)+MOD(INT((RC1)/3),3)*5+3,FALSE)&"|"&HLOOKUP(Sheet1!R2C1,Sheet1!R2C1:R16C1,MOD(RC1+1,3)+MOD(INT((RC1+1)/3),3)*5+3,FALSE)&"|"&HLOOKUP(Sheet1!R2C1,Sheet1!R2C1:R16C1,MOD(RC1+2,3)+MOD(INT((RC1+2)/3),3)*5+3,FALSE)&"|"&HLOOKUP(Sheet1!R2C1,Sheet1!R2C1:R16C1,MOD(RC1+3,3)+MOD(INT((RC1+3)/3),3)*5+3,FALSE) -> 163|164|102|103|104 | J482: =HLOOKUP(Sheet1!R2C1,Sheet1!R2C1:R16C1,MOD(RC1-1,3)+MOD(INT((RC1-1)/3),3)*5+3,FALSE)&"|"&HLOOKUP(Sheet1!R2C1,Sheet1!R2C1:R16C1,MOD(RC1,3)+MOD(INT((RC1)/3),3)*5+3,FALSE)&"|"&HLOOKUP(Sheet1!R2C1,Sheet1!R2C1:R16C1,MOD(RC1+1,3)+MOD(INT((RC1+1)/3),3)*5+3,FALSE)&"|"&HLOOKUP(Sheet1!R2C1,Sheet1!R2C1:R16C1,MOD(RC1+2,3)+MOD(INT((RC1+2)/3),3)*5+3,FALSE)&"|"&HLOOKUP(Sheet1!R2C1,Sheet1!R2C1:R16C1,MOD(RC1+3,3)+MOD(INT((RC1+3)/3),3)*5+3,FALSE) -> 163|164|102|103|104 | K482: =HLOOKUP(Sheet1!R2C1,Sheet1!R2C1:R16C1,MOD(RC1-1,3)+MOD(INT((RC1-1)/3),3)*5+3,FALSE)&"|"&HLOOKUP(Sheet1!R2C1,Sheet1!R2C1:R16C1,MOD(RC1,3)+MOD(INT((RC1)/3),3)*5+3,FALSE)&"|"&HLOOKUP(Sheet1!R2C1,Sheet1!R2C1:R16C1,MOD(RC1+1,3)+MOD(INT((RC1+1)/3),3)*5+3,FALSE)&"|"&HLOOKUP(Sheet1!R2C1,Sheet1!R2C1:R16C1,MOD(RC1+2,3)+MOD(INT((RC1+2)/3),3)*5+3,FALSE)&"|"&HLOOKUP(Sheet1!R2C1,Sheet1!R2C1:R16C1,MOD(RC1+3,3)+MOD(INT((RC1+3)/3),3)*5+3,FALSE) -> 163|164|102|103|104 | L482: 25|22|23|24 | M482: 12617058|12617058|12617058|12617058 | N482: 10030|10031|10032|10033 | O482: 1|1|1|1 | P482: 2500|2500|2500|2500
A483: 477 | B483: 475 | C483: 30 | D483: =R[-20]C+2 -> 66 | E483: 1000 | F483: =MOD(RC[-5]-1,3)*30+100&"|"&MOD(RC[-5]-1,3)*30+101&"|"&MOD(RC[-5]-1,3)*30+102&"|"&MOD(RC[-5]-1,3)*30+103&"|"&IF(MOD(RC[-5],4)=0,HLOOKUP(Sheet1!R2C10,Sheet1!R2C10:R7C10,MOD(RC[-5]/4-1,6)+1,FALSE),IF(MOD(RC[-5],2)=0,IF(RC[-5]>20,HLOOKUP(Sheet1!R2C7,Sheet1!R2C7:R43C7,MOD(RC[-5]/2-1,42)+1,FALSE),HLOOKUP(Sheet1!R2C4,Sheet1!R2C4:R7C4,MOD(RC[-5]-1,6)+1,FALSE)),MOD(RC[-5]-1,3)*30+104)) -> 160|161|162|163|164 | G483: =HLOOKUP(Sheet1!R2C1,Sheet1!R2C1:R16C1,MOD(RC1-1,2)+MOD(INT((RC1-1)/2),3)*5+1,FALSE)&"|"&HLOOKUP(Sheet1!R2C1,Sheet1!R2C1:R16C1,MOD(RC1,2)+MOD(INT((RC1)/2),3)*5+1,FALSE)&"|"&HLOOKUP(Sheet1!R2C1,Sheet1!R2C1:R16C1,MOD(RC1+1,2)+MOD(INT((RC1+1)/2),3)*5+1,FALSE)&"|"&HLOOKUP(Sheet1!R2C1,Sheet1!R2C1:R16C1,MOD(RC1+2,2)+MOD(INT((RC1+2)/2),3)*5+1,FALSE)&"|"&HLOOKUP(Sheet1!R2C1,Sheet1!R2C1:R16C1,MOD(RC1+3,2)+MOD(INT((RC1+3)/2),3)*5+1,FALSE) -> 130|131|160|161|100 | H483: =HLOOKUP(Sheet1!R2C1,Sheet1!R2C1:R16C1,MOD(RC1+2,2)+MOD(INT((RC1+2)/2),3)*5+1,FALSE)&"|"&HLOOKUP(Sheet1!R2C1,Sheet1!R2C1:R16C1,MOD(RC1+3,2)+MOD(INT((RC1+3)/2),3)*5+1,FALSE)&"|"&HLOOKUP(Sheet1!R2C1,Sheet1!R2C1:R16C1,MOD(RC1+4,2)+MOD(INT((RC1+4)/2),3)*5+1,FALSE)&"|"&HLOOKUP(Sheet1!R2C1,Sheet1!R2C1:R16C1,MOD(RC1+5,2)+MOD(INT((RC1+5)/2),3)*5+1,FALSE)&"|"&HLOOKUP(Sheet1!R2C1,Sheet1!R2C1:R16C1,MOD(RC1+6,2)+MOD(INT((RC1+6)/2),3)*5+1,FALSE) -> 161|100|101|130|131 | I483: =HLOOKUP(Sheet1!R2C1,Sheet1!R2C1:R16C1,MOD(RC1-1,3)+MOD(INT((RC1-1)/3),3)*5+3,FALSE)&"|"&HLOOKUP(Sheet1!R2C1,Sheet1!R2C1:R16C1,MOD(RC1,3)+MOD(INT((RC1)/3),3)*5+3,FALSE)&"|"&HLOOKUP(Sheet1!R2C1,Sheet1!R2C1:R16C1,MOD(RC1+1,3)+MOD(INT((RC1+1)/3),3)*5+3,FALSE)&"|"&HLOOKUP(Sheet1!R2C1,Sheet1!R2C1:R16C1,MOD(RC1+2,3)+MOD(INT((RC1+2)/3),3)*5+3,FALSE)&"|"&HLOOKUP(Sheet1!R2C1,Sheet1!R2C1:R16C1,MOD(RC1+3,3)+MOD(INT((RC1+3)/3),3)*5+3,FALSE) -> 164|102|103|104|132 | J483: =HLOOKUP(Sheet1!R2C1,Sheet1!R2C1:R16C1,MOD(RC1-1,3)+MOD(INT((RC1-1)/3),3)*5+3,FALSE)&"|"&HLOOKUP(Sheet1!R2C1,Sheet1!R2C1:R16C1,MOD(RC1,3)+MOD(INT((RC1)/3),3)*5+3,FALSE)&"|"&HLOOKUP(Sheet1!R2C1,Sheet1!R2C1:R16C1,MOD(RC1+1,3)+MOD(INT((RC1+1)/3),3)*5+3,FALSE)&"|"&HLOOKUP(Sheet1!R2C1,Sheet1!R2C1:R16C1,MOD(RC1+2,3)+MOD(INT((RC1+2)/3),3)*5+3,FALSE)&"|"&HLOOKUP(Sheet1!R2C1,Sheet1!R2C1:R16C1,MOD(RC1+3,3)+MOD(INT((RC1+3)/3),3)*5+3,FALSE) -> 164|102|103|104|132 | K483: =HLOOKUP(Sheet1!R2C1,Sheet1!R2C1:R16C1,MOD(RC1-1,3)+MOD(INT((RC1-1)/3),3)*5+3,FALSE)&"|"&HLOOKUP(Sheet1!R2C1,Sheet1!R2C1:R16C1,MOD(RC1,3)+MOD(INT((RC1)/3),3)*5+3,FALSE)&"|"&HLOOKUP(Sheet1!R2C1,Sheet1!R2C1:R16C1,MOD(RC1+1,3)+MOD(INT((RC1+1)/3),3)*5+3,FALSE)&"|"&HLOOKUP(Sheet1!R2C1,Sheet1!R2C1:R16C1,MOD(RC1+2,3)+MOD(INT((RC1+2)/3),3)*5+3,FALSE)&"|"&HLOOKUP(Sheet1!R2C1,Sheet1!R2C1:R16C1,MOD(RC1+3,3)+MOD(INT((RC1+3)/3),3)*5+3,FALSE) -> 164|102|103|104|132 | L483: 25|22|23|24 | M483: 12725786|12725786|12725785|12725785 | N483: 10030|10031|10032|10033 | O483: 1|1|1|1 | P483: 2500|2500|2500|2500
A484: 478 | B484: 476 | C484: 30 | D484: =R[-20]C+2 -> 66 | E484: 1000 | F484: =MOD(RC[-5]-1,3)*30+100&"|"&MOD(RC[-5]-1,3)*30+101&"|"&MOD(RC[-5]-1,3)*30+102&"|"&MOD(RC[-5]-1,3)*30+103&"|"&IF(MOD(RC[-5],4)=0,HLOOKUP(Sheet1!R2C10,Sheet1!R2C10:R7C10,MOD(RC[-5]/4-1,6)+1,FALSE),IF(MOD(RC[-5],2)=0,IF(RC[-5]>20,HLOOKUP(Sheet1!R2C7,Sheet1!R2C7:R43C7,MOD(RC[-5]/2-1,42)+1,FALSE),HLOOKUP(Sheet1!R2C4,Sheet1!R2C4:R7C4,MOD(RC[-5]-1,6)+1,FALSE)),MOD(RC[-5]-1,3)*30+104)) -> 100|101|102|103|172 | G484: =HLOOKUP(Sheet1!R2C1,Sheet1!R2C1:R16C1,MOD(RC1-1,2)+MOD(INT((RC1-1)/2),3)*5+1,FALSE)&"|"&HLOOKUP(Sheet1!R2C1,Sheet1!R2C1:R16C1,MOD(RC1,2)+MOD(INT((RC1)/2),3)*5+1,FALSE)&"|"&HLOOKUP(Sheet1!R2C1,Sheet1!R2C1:R16C1,MOD(RC1+1,2)+MOD(INT((RC1+1)/2),3)*5+1,FALSE)&"|"&HLOOKUP(Sheet1!R2C1,Sheet1!R2C1:R16C1,MOD(RC1+2,2)+MOD(INT((RC1+2)/2),3)*5+1,FALSE)&"|"&HLOOKUP(Sheet1!R2C1,Sheet1!R2C1:R16C1,MOD(RC1+3,2)+MOD(INT((RC1+3)/2),3)*5+1,FALSE) -> 131|160|161|100|101 | H484: =HLOOKUP(Sheet1!R2C1,Sheet1!R2C1:R16C1,MOD(RC1+2,2)+MOD(INT((RC1+2)/2),3)*5+1,FALSE)&"|"&HLOOKUP(Sheet1!R2C1,Sheet1!R2C1:R16C1,MOD(RC1+3,2)+MOD(INT((RC1+3)/2),3)*5+1,FALSE)&"|"&HLOOKUP(Sheet1!R2C1,Sheet1!R2C1:R16C1,MOD(RC1+4,2)+MOD(INT((RC1+4)/2),3)*5+1,FALSE)&"|"&HLOOKUP(Sheet1!R2C1,Sheet1!R2C1:R16C1,MOD(RC1+5,2)+MOD(INT((RC1+5)/2),3)*5+1,FALSE)&"|"&HLOOKUP(Sheet1!R2C1,Sheet1!R2C1:R16C1,MOD(RC1+6,2)+MOD(INT((RC1+6)/2),3)*5+1,FALSE) -> 100|101|130|131|160 | I484: =HLOOKUP(Sheet1!R2C1,Sheet1!R2C1:R16C1,MOD(RC1-1,3)+MOD(INT((RC1-1)/3),3)*5+3,FALSE)&"|"&HLOOKUP(Sheet1!R2C1,Sheet1!R2C1:R16C1,MOD(RC1,3)+MOD(INT((RC1)/3),3)*5+3,FALSE)&"|"&HLOOKUP(Sheet1!R2C1,Sheet1!R2C1:R16C1,MOD(RC1+1,3)+MOD(INT((RC1+1)/3),3)*5+3,FALSE)&"|"&HLOOKUP(Sheet1!R2C1,Sheet1!R2C1:R16C1,MOD(RC1+2,3)+MOD(INT((RC1+2)/3),3)*5+3,FALSE)&"|"&HLOOKUP(Sheet1!R2C1,Sheet1!R2C1:R16C1,MOD(RC1+3,3)+MOD(INT((RC1+3)/3),3)*5+3,FALSE) -> 102|103|104|132|133 | J484: =HLOOKUP(Sheet1!R2C1,Sheet1!R2C1:R16C1,MOD(RC1-1,3)+MOD(INT((RC1-1)/3),3)*5+3,FALSE)&"|"&HLOOKUP(Sheet1!R2C1,Sheet1!R2C1:R16C1,MOD(RC1,3)+MOD(INT((RC1)/3),3)*5+3,FALSE)&"|"&HLOOKUP(Sheet1!R2C1,Sheet1!R2C1:R16C1,MOD(RC1+1,3)+MOD(INT((RC1+1)/3),3)*5+3,FALSE)&"|"&HLOOKUP(Sheet1!R2C1,Sheet1!R2C1:R16C1,MOD(RC1+2,3)+MOD(INT((RC1+2)/3),3)*5+3,FALSE)&"|"&HLOOKUP(Sheet1!R2C1,Sheet1!R2C1:R16C1,MOD(RC1+3,3)+MOD(INT((RC1+3)/3),3)*5+3,FALSE) -> 102|103|104|132|133 | K484: =HLOOKUP(Sheet1!R2C1,Sheet1!R2C1:R16C1,MOD(RC1-1,3)+MOD(INT((RC1-1)/3),3)*5+3,FALSE)&"|"&HLOOKUP(Sheet1!R2C1,Sheet1!R2C1:R16C1,MOD(RC1,3)+MOD(INT((RC1)/3),3)*5+3,FALSE)&"|"&HLOOKUP(Sheet1!R2C1,Sheet1!R2C1:R16C1,MOD(RC1+1,3)+MOD(INT((RC1+1)/3),3)*5+3,FALSE)&"|"&HLOOKUP(Sheet1!R2C1,Sheet1!R2C1:R16C1,MOD(RC1+2,3)+MOD(INT((RC1+2)/3),3)*5+3,FALSE)&"|"&HLOOKUP(Sheet1!R2C1,Sheet1!R2C1:R16C1,MOD(RC1+3,3)+MOD(INT((RC1+3)/3),3)*5+3,FALSE) -> 102|103|104|132|133 | L484: 25|22|23|24 | M484: 12832818|12832818|12832818|12832818 | N484: 10030|10031|10032|10033 | O484: 1|1|1|1 | P484: 2500|2500|2500|2500
A485: 479 | B485: 477 | C485: 30 | D485: =R[-20]C+2 -> 66 | E485: 1000 | F485: =MOD(RC[-5]-1,3)*30+100&"|"&MOD(RC[-5]-1,3)*30+101&"|"&MOD(RC[-5]-1,3)*30+102&"|"&MOD(RC[-5]-1,3)*30+103&"|"&IF(MOD(RC[-5],4)=0,HLOOKUP(Sheet1!R2C10,Sheet1!R2C10:R7C10,MOD(RC[-5]/4-1,6)+1,FALSE),IF(MOD(RC[-5],2)=0,IF(RC[-5]>20,HLOOKUP(Sheet1!R2C7,Sheet1!R2C7:R43C7,MOD(RC[-5]/2-1,42)+1,FALSE),HLOOKUP(Sheet1!R2C4,Sheet1!R2C4:R7C4,MOD(RC[-5]-1,6)+1,FALSE)),MOD(RC[-5]-1,3)*30+104)) -> 130|131|132|133|134 | G485: =HLOOKUP(Sheet1!R2C1,Sheet1!R2C1:R16C1,MOD(RC1-1,2)+MOD(INT((RC1-1)/2),3)*5+1,FALSE)&"|"&HLOOKUP(Sheet1!R2C1,Sheet1!R2C1:R16C1,MOD(RC1,2)+MOD(INT((RC1)/2),3)*5+1,FALSE)&"|"&HLOOKUP(Sheet1!R2C1,Sheet1!R2C1:R16C1,MOD(RC1+1,2)+MOD(INT((RC1+1)/2),3)*5+1,FALSE)&"|"&HLOOKUP(Sheet1!R2C1,Sheet1!R2C1:R16C1,MOD(RC1+2,2)+MOD(INT((RC1+2)/2),3)*5+1,FALSE)&"|"&HLOOKUP(Sheet1!R2C1,Sheet1!R2C1:R16C1,MOD(RC1+3,2)+MOD(INT((RC1+3)/2),3)*5+1,FALSE) -> 160|161|100|101|130 | H485: =HLOOKUP(Sheet1!R2C1,Sheet1!R2C1:R16C1,MOD(RC1+2,2)+MOD(INT((RC1+2)/2),3)*5+1,FALSE)&"|"&HLOOKUP(Sheet1!R2C1,Sheet1!R2C1:R16C1,MOD(RC1+3,2)+MOD(INT((RC1+3)/2),3)*5+1,FALSE)&"|"&HLOOKUP(Sheet1!R2C1,Sheet1!R2C1:R16C1,MOD(RC1+4,2)+MOD(INT((RC1+4)/2),3)*5+1,FALSE)&"|"&HLOOKUP(Sheet1!R2C1,Sheet1!R2C1:R16C1,MOD(RC1+5,2)+MOD(INT((RC1+5)/2),3)*5+1,FALSE)&"|"&HLOOKUP(Sheet1!R2C1,Sheet1!R2C1:R16C1,MOD(RC1+6,2)+MOD(INT((RC1+6)/2),3)*5+1,FALSE) -> 101|130|131|160|161 | I485: =HLOOKUP(Sheet1!R2C1,Sheet1!R2C1:R16C1,MOD(RC1-1,3)+MOD(INT((RC1-1)/3),3)*5+3,FALSE)&"|"&HLOOKUP(Sheet1!R2C1,Sheet1!R2C1:R16C1,MOD(RC1,3)+MOD(INT((RC1)/3),3)*5+3,FALSE)&"|"&HLOOKUP(Sheet1!R2C1,Sheet1!R2C1:R16C1,MOD(RC1+1,3)+MOD(INT((RC1+1)/3),3)*5+3,FALSE)&"|"&HLOOKUP(Sheet1!R2C1,Sheet1!R2C1:R16C1,MOD(RC1+2,3)+MOD(INT((RC1+2)/3),3)*5+3,FALSE)&"|"&HLOOKUP(Sheet1!R2C1,Sheet1!R2C1:R16C1,MOD(RC1+3,3)+MOD(INT((RC1+3)/3),3)*5+3,FALSE) -> 103|104|132|133|134 | J485: =HLOOKUP(Sheet1!R2C1,Sheet1!R2C1:R16C1,MOD(RC1-1,3)+MOD(INT((RC1-1)/3),3)*5+3,FALSE)&"|"&HLOOKUP(Sheet1!R2C1,Sheet1!R2C1:R16C1,MOD(RC1,3)+MOD(INT((RC1)/3),3)*5+3,FALSE)&"|"&HLOOKUP(Sheet1!R2C1,Sheet1!R2C1:R16C1,MOD(RC1+1,3)+MOD(INT((RC1+1)/3),3)*5+3,FALSE)&"|"&HLOOKUP(Sheet1!R2C1,Sheet1!R2C1:R16C1,MOD(RC1+2,3)+MOD(INT((RC1+2)/3),3)*5+3,FALSE)&"|"&HLOOKUP(Sheet1!R2C1,Sheet1!R2C1:R16C1,MOD(RC1+3,3)+MOD(INT((RC1+3)/3),3)*5+3,FALSE) -> 103|104|132|133|134 | K485: =HLOOKUP(Sheet1!R2C1,Sheet1!R2C1:R16C1,MOD(RC1-1,3)+MOD(INT((RC1-1)/3),3)*5+3,FALSE)&"|"&HLOOKUP(Sheet1!R2C1,Sheet1!R2C1:R16C1,MOD(RC1,3)+MOD(INT((RC1)/3),3)*5+3,FALSE)&"|"&HLOOKUP(Sheet1!R2C1,Sheet1!R2C1:R16C1,MOD(RC1+1,3)+MOD(INT((RC1+1)/3),3)*5+3,FALSE)&"|"&HLOOKUP(Sheet1!R2C1,Sheet1!R2C1:R16C1,MOD(RC1+2,3)+MOD(INT((RC1+2)/3),3)*5+3,FALSE)&"|"&HLOOKUP(Sheet1!R2C1,Sheet1!R2C1:R16C1,MOD(RC1+3,3)+MOD(INT((RC1+3)/3),3)*5+3,FALSE) -> 103|104|132|133|134 | L485: 25|22|23|24 | M485: 12940851|12940850|12940850|12940850 | N485: 10030|10031|10032|10033 | O485: 1|1|1|1 | P485: 2500|2500|2500|2500
A486: 480 | B486: 478 | C486: 30 | D486: =R[-20]C+2 -> 66 | E486: 1000 | F486: =MOD(RC[-5]-1,3)*30+100&"|"&MOD(RC[-5]-1,3)*30+101&"|"&MOD(RC[-5]-1,3)*30+102&"|"&MOD(RC[-5]-1,3)*30+103&"|"&IF(MOD(RC[-5],4)=0,HLOOKUP(Sheet1!R2C10,Sheet1!R2C10:R7C10,MOD(RC[-5]/4-1,6)+1,FALSE),IF(MOD(RC[-5],2)=0,IF(RC[-5]>20,HLOOKUP(Sheet1!R2C7,Sheet1!R2C7:R43C7,MOD(RC[-5]/2-1,42)+1,FALSE),HLOOKUP(Sheet1!R2C4,Sheet1!R2C4:R7C4,MOD(RC[-5]-1,6)+1,FALSE)),MOD(RC[-5]-1,3)*30+104)) -> 160|161|162|163|195 | G486: =HLOOKUP(Sheet1!R2C1,Sheet1!R2C1:R16C1,MOD(RC1-1,2)+MOD(INT((RC1-1)/2),3)*5+1,FALSE)&"|"&HLOOKUP(Sheet1!R2C1,Sheet1!R2C1:R16C1,MOD(RC1,2)+MOD(INT((RC1)/2),3)*5+1,FALSE)&"|"&HLOOKUP(Sheet1!R2C1,Sheet1!R2C1:R16C1,MOD(RC1+1,2)+MOD(INT((RC1+1)/2),3)*5+1,FALSE)&"|"&HLOOKUP(Sheet1!R2C1,Sheet1!R2C1:R16C1,MOD(RC1+2,2)+MOD(INT((RC1+2)/2),3)*5+1,FALSE)&"|"&HLOOKUP(Sheet1!R2C1,Sheet1!R2C1:R16C1,MOD(RC1+3,2)+MOD(INT((RC1+3)/2),3)*5+1,FALSE) -> 161|100|101|130|131 | H486: =HLOOKUP(Sheet1!R2C1,Sheet1!R2C1:R16C1,MOD(RC1+2,2)+MOD(INT((RC1+2)/2),3)*5+1,FALSE)&"|"&HLOOKUP(Sheet1!R2C1,Sheet1!R2C1:R16C1,MOD(RC1+3,2)+MOD(INT((RC1+3)/2),3)*5+1,FALSE)&"|"&HLOOKUP(Sheet1!R2C1,Sheet1!R2C1:R16C1,MOD(RC1+4,2)+MOD(INT((RC1+4)/2),3)*5+1,FALSE)&"|"&HLOOKUP(Sheet1!R2C1,Sheet1!R2C1:R16C1,MOD(RC1+5,2)+MOD(INT((RC1+5)/2),3)*5+1,FALSE)&"|"&HLOOKUP(Sheet1!R2C1,Sheet1!R2C1:R16C1,MOD(RC1+6,2)+MOD(INT((RC1+6)/2),3)*5+1,FALSE) -> 130|131|160|161|100 | I486: =HLOOKUP(Sheet1!R2C1,Sheet1!R2C1:R16C1,MOD(RC1-1,3)+MOD(INT((RC1-1)/3),3)*5+3,FALSE)&"|"&HLOOKUP(Sheet1!R2C1,Sheet1!R2C1:R16C1,MOD(RC1,3)+MOD(INT((RC1)/3),3)*5+3,FALSE)&"|"&HLOOKUP(Sheet1!R2C1,Sheet1!R2C1:R16C1,MOD(RC1+1,3)+MOD(INT((RC1+1)/3),3)*5+3,FALSE)&"|"&HLOOKUP(Sheet1!R2C1,Sheet1!R2C1:R16C1,MOD(RC1+2,3)+MOD(INT((RC1+2)/3),3)*5+3,FALSE)&"|"&HLOOKUP(Sheet1!R2C1,Sheet1!R2C1:R16C1,MOD(RC1+3,3)+MOD(INT((RC1+3)/3),3)*5+3,FALSE) -> 104|132|133|134|162 | J486: =HLOOKUP(Sheet1!R2C1,Sheet1!R2C1:R16C1,MOD(RC1-1,3)+MOD(INT((RC1-1)/3),3)*5+3,FALSE)&"|"&HLOOKUP(Sheet1!R2C1,Sheet1!R2C1:R16C1,MOD(RC1,3)+MOD(INT((RC1)/3),3)*5+3,FALSE)&"|"&HLOOKUP(Sheet1!R2C1,Sheet1!R2C1:R16C1,MOD(RC1+1,3)+MOD(INT((RC1+1)/3),3)*5+3,FALSE)&"|"&HLOOKUP(Sheet1!R2C1,Sheet1!R2C1:R16C1,MOD(RC1+2,3)+MOD(INT((RC1+2)/3),3)*5+3,FALSE)&"|"&HLOOKUP(Sheet1!R2C1,Sheet1!R2C1:R16C1,MOD(RC1+3,3)+MOD(INT((RC1+3)/3),3)*5+3,FALSE) -> 104|132|133|134|162 | K486: =HLOOKUP(Sheet1!R2C1,Sheet1!R2C1:R16C1,MOD(RC1-1,3)+MOD(INT((RC1-1)/3),3)*5+3,FALSE)&"|"&HLOOKUP(Sheet1!R2C1,Sheet1!R2C1:R16C1,MOD(RC1,3)+MOD(INT((RC1)/3),3)*5+3,FALSE)&"|"&HLOOKUP(Sheet1!R2C1,Sheet1!R2C1:R16C1,MOD(RC1+1,3)+MOD(INT((RC1+1)/3),3)*5+3,FALSE)&"|"&HLOOKUP(Sheet1!R2C1,Sheet1!R2C1:R16C1,MOD(RC1+2,3)+MOD(INT((RC1+2)/3),3)*5+3,FALSE)&"|"&HLOOKUP(Sheet1!R2C1,Sheet1!R2C1:R16C1,MOD(RC1+3,3)+MOD(INT((RC1+3)/3),3)*5+3,FALSE) -> 104|132|133|134|162 | L486: 25|22|23|24 | M486: 13048883|13048884|13048883|13048883 | N486: 10030|10031|10032|10033|10030|10031|10032|10033|10030|10031|10032|10033|10030|10031|10032|10033|10030|10031|10032|10033|10030|10031|10032|10033|10030|10031|10032|10033|10030|10031|10032|10033|10030|10031|10032|10033|10030|10031|10032|10033 | O486: 1|1|1|1|1|1|1|1|1|1|1|1|1|1|1|1|1|1|1|1|1|1|1|1|1|1|1|1|1|1|1|1|1|1|1|1|1|1|1|1 | P486: 2500|2500|2500|2500|2500|2500|2500|2500|2500|2500|2500|2500|2500|2500|2500|2500|2500|2500|2500|2500|2500|2500|2500|2500|2500|2500|2500|2500|2500|2500|2500|2500|2500|2500|2500|2500|2500|2500|2500|2500
A487: 481 | B487: 479 | C487: 30 | D487: =R[-20]C+2 -> 68 | E487: 1000 | F487: =MOD(RC[-5]-1,3)*30+100&"|"&MOD(RC[-5]-1,3)*30+101&"|"&MOD(RC[-5]-1,3)*30+102&"|"&MOD(RC[-5]-1,3)*30+103&"|"&IF(MOD(RC[-5],4)=0,HLOOKUP(Sheet1!R2C10,Sheet1!R2C10:R7C10,MOD(RC[-5]/4-1,6)+1,FALSE),IF(MOD(RC[-5],2)=0,IF(RC[-5]>20,HLOOKUP(Sheet1!R2C7,Sheet1!R2C7:R43C7,MOD(RC[-5]/2-1,42)+1,FALSE),HLOOKUP(Sheet1!R2C4,Sheet1!R2C4:R7C4,MOD(RC[-5]-1,6)+1,FALSE)),MOD(RC[-5]-1,3)*30+104)) -> 100|101|102|103|104 | G487: =HLOOKUP(Sheet1!R2C1,Sheet1!R2C1:R16C1,MOD(RC1-1,2)+MOD(INT((RC1-1)/2),3)*5+1,FALSE)&"|"&HLOOKUP(Sheet1!R2C1,Sheet1!R2C1:R16C1,MOD(RC1,2)+MOD(INT((RC1)/2),3)*5+1,FALSE)&"|"&HLOOKUP(Sheet1!R2C1,Sheet1!R2C1:R16C1,MOD(RC1+1,2)+MOD(INT((RC1+1)/2),3)*5+1,FALSE)&"|"&HLOOKUP(Sheet1!R2C1,Sheet1!R2C1:R16C1,MOD(RC1+2,2)+MOD(INT((RC1+2)/2),3)*5+1,FALSE)&"|"&HLOOKUP(Sheet1!R2C1,Sheet1!R2C1:R16C1,MOD(RC1+3,2)+MOD(INT((RC1+3)/2),3)*5+1,FALSE) -> 100|101|130|131|160 | H487: =HLOOKUP(Sheet1!R2C1,Sheet1!R2C1:R16C1,MOD(RC1+2,2)+MOD(INT((RC1+2)/2),3)*5+1,FALSE)&"|"&HLOOKUP(Sheet1!R2C1,Sheet1!R2C1:R16C1,MOD(RC1+3,2)+MOD(INT((RC1+3)/2),3)*5+1,FALSE)&"|"&HLOOKUP(Sheet1!R2C1,Sheet1!R2C1:R16C1,MOD(RC1+4,2)+MOD(INT((RC1+4)/2),3)*5+1,FALSE)&"|"&HLOOKUP(Sheet1!R2C1,Sheet1!R2C1:R16C1,MOD(RC1+5,2)+MOD(INT((RC1+5)/2),3)*5+1,FALSE)&"|"&HLOOKUP(Sheet1!R2C1,Sheet1!R2C1:R16C1,MOD(RC1+6,2)+MOD(INT((RC1+6)/2),3)*5+1,FALSE) -> 131|160|161|100|101 | I487: =HLOOKUP(Sheet1!R2C1,Sheet1!R2C1:R16C1,MOD(RC1-1,3)+MOD(INT((RC1-1)/3),3)*5+3,FALSE)&"|"&HLOOKUP(Sheet1!R2C1,Sheet1!R2C1:R16C1,MOD(RC1,3)+MOD(INT((RC1)/3),3)*5+3,FALSE)&"|"&HLOOKUP(Sheet1!R2C1,Sheet1!R2C1:R16C1,MOD(RC1+1,3)+MOD(INT((RC1+1)/3),3)*5+3,FALSE)&"|"&HLOOKUP(Sheet1!R2C1,Sheet1!R2C1:R16C1,MOD(RC1+2,3)+MOD(INT((RC1+2)/3),3)*5+3,FALSE)&"|"&HLOOKUP(Sheet1!R2C1,Sheet1!R2C1:R16C1,MOD(RC1+3,3)+MOD(INT((RC1+3)/3),3)*5+3,FALSE) -> 132|133|134|162|163 | J487: =HLOOKUP(Sheet1!R2C1,Sheet1!R2C1:R16C1,MOD(RC1-1,3)+MOD(INT((RC1-1)/3),3)*5+3,FALSE)&"|"&HLOOKUP(Sheet1!R2C1,Sheet1!R2C1:R16C1,MOD(RC1,3)+MOD(INT((RC1)/3),3)*5+3,FALSE)&"|"&HLOOKUP(Sheet1!R2C1,Sheet1!R2C1:R16C1,MOD(RC1+1,3)+MOD(INT((RC1+1)/3),3)*5+3,FALSE)&"|"&HLOOKUP(Sheet1!R2C1,Sheet1!R2C1:R16C1,MOD(RC1+2,3)+MOD(INT((RC1+2)/3),3)*5+3,FALSE)&"|"&HLOOKUP(Sheet1!R2C1,Sheet1!R2C1:R16C1,MOD(RC1+3,3)+MOD(INT((RC1+3)/3),3)*5+3,FALSE) -> 132|133|134|162|163 | K487: =HLOOKUP(Sheet1!R2C1,Sheet1!R2C1:R16C1,MOD(RC1-1,3)+MOD(INT((RC1-1)/3),3)*5+3,FALSE)&"|"&HLOOKUP(Sheet1!R2C1,Sheet1!R2C1:R16C1,MOD(RC1,3)+MOD(INT((RC1)/3),3)*5+3,FALSE)&"|"&HLOOKUP(Sheet1!R2C1,Sheet1!R2C1:R16C1,MOD(RC1+1,3)+MOD(INT((RC1+1)/3),3)*5+3,FALSE)&"|"&HLOOKUP(Sheet1!R2C1,Sheet1!R2C1:R16C1,MOD(RC1+2,3)+MOD(INT((RC1+2)/3),3)*5+3,FALSE)&"|"&HLOOKUP(Sheet1!R2C1,Sheet1!R2C1:R16C1,MOD(RC1+3,3)+MOD(INT((RC1+3)/3),3)*5+3,FALSE) -> 132|133|134|162|163 | L487: 25|22|23|24 | M487: 13161613|13161613|13161613|13161613 | N487: 10030|10031|10032|10033 | O487: 1|1|1|1 | P487: 2500|2500|2500|2500
A488: 482 | B488: 480 | C488: 30 | D488: =R[-20]C+2 -> 68 | E488: 1000 | F488: =MOD(RC[-5]-1,3)*30+100&"|"&MOD(RC[-5]-1,3)*30+101&"|"&MOD(RC[-5]-1,3)*30+102&"|"&MOD(RC[-5]-1,3)*30+103&"|"&IF(MOD(RC[-5],4)=0,HLOOKUP(Sheet1!R2C10,Sheet1!R2C10:R7C10,MOD(RC[-5]/4-1,6)+1,FALSE),IF(MOD(RC[-5],2)=0,IF(RC[-5]>20,HLOOKUP(Sheet1!R2C7,Sheet1!R2C7:R43C7,MOD(RC[-5]/2-1,42)+1,FALSE),HLOOKUP(Sheet1!R2C4,Sheet1!R2C4:R7C4,MOD(RC[-5]-1,6)+1,FALSE)),MOD(RC[-5]-1,3)*30+104)) -> 130|131|132|133|174 | G488: =HLOOKUP(Sheet1!R2C1,Sheet1!R2C1:R16C1,MOD(RC1-1,2)+MOD(INT((RC1-1)/2),3)*5+1,FALSE)&"|"&HLOOKUP(Sheet1!R2C1,Sheet1!R2C1:R16C1,MOD(RC1,2)+MOD(INT((RC1)/2),3)*5+1,FALSE)&"|"&HLOOKUP(Sheet1!R2C1,Sheet1!R2C1:R16C1,MOD(RC1+1,2)+MOD(INT((RC1+1)/2),3)*5+1,FALSE)&"|"&HLOOKUP(Sheet1!R2C1,Sheet1!R2C1:R16C1,MOD(RC1+2,2)+MOD(INT((RC1+2)/2),3)*5+1,FALSE)&"|"&HLOOKUP(Sheet1!R2C1,Sheet1!R2C1:R16C1,MOD(RC1+3,2)+MOD(INT((RC1+3)/2),3)*5+1,FALSE) -> 101|130|131|160|161 | H488: =HLOOKUP(Sheet1!R2C1,Sheet1!R2C1:R16C1,MOD(RC1+2,2)+MOD(INT((RC1+2)/2),3)*5+1,FALSE)&"|"&HLOOKUP(Sheet1!R2C1,Sheet1!R2C1:R16C1,MOD(RC1+3,2)+MOD(INT((RC1+3)/2),3)*5+1,FALSE)&"|"&HLOOKUP(Sheet1!R2C1,Sheet1!R2C1:R16C1,MOD(RC1+4,2)+MOD(INT((RC1+4)/2),3)*5+1,FALSE)&"|"&HLOOKUP(Sheet1!R2C1,Sheet1!R2C1:R16C1,MOD(RC1+5,2)+MOD(INT((RC1+5)/2),3)*5+1,FALSE)&"|"&HLOOKUP(Sheet1!R2C1,Sheet1!R2C1:R16C1,MOD(RC1+6,2)+MOD(INT((RC1+6)/2),3)*5+1,FALSE) -> 160|161|100|101|130 | I488: =HLOOKUP(Sheet1!R2C1,Sheet1!R2C1:R16C1,MOD(RC1-1,3)+MOD(INT((RC1-1)/3),3)*5+3,FALSE)&"|"&HLOOKUP(Sheet1!R2C1,Sheet1!R2C1:R16C1,MOD(RC1,3)+MOD(INT((RC1)/3),3)*5+3,FALSE)&"|"&HLOOKUP(Sheet1!R2C1,Sheet1!R2C1:R16C1,MOD(RC1+1,3)+MOD(INT((RC1+1)/3),3)*5+3,FALSE)&"|"&HLOOKUP(Sheet1!R2C1,Sheet1!R2C1:R16C1,MOD(RC1+2,3)+MOD(INT((RC1+2)/3),3)*5+3,FALSE)&"|"&HLOOKUP(Sheet1!R2C1,Sheet1!R2C1:R16C1,MOD(RC1+3,3)+MOD(INT((RC1+3)/3),3)*5+3,FALSE) -> 133|134|162|163|164 | J488: =HLOOKUP(Sheet1!R2C1,Sheet1!R2C1:R16C1,MOD(RC1-1,3)+MOD(INT((RC1-1)/3),3)*5+3,FALSE)&"|"&HLOOKUP(Sheet1!R2C1,Sheet1!R2C1:R16C1,MOD(RC1,3)+MOD(INT((RC1)/3),3)*5+3,FALSE)&"|"&HLOOKUP(Sheet1!R2C1,Sheet1!R2C1:R16C1,MOD(RC1+1,3)+MOD(INT((RC1+1)/3),3)*5+3,FALSE)&"|"&HLOOKUP(Sheet1!R2C1,Sheet1!R2C1:R16C1,MOD(RC1+2,3)+MOD(INT((RC1+2)/3),3)*5+3,FALSE)&"|"&HLOOKUP(Sheet1!R2C1,Sheet1!R2C1:R16C1,MOD(RC1+3,3)+MOD(INT((RC1+3)/3),3)*5+3,FALSE) -> 133|134|162|163|164 | K488: =HLOOKUP(Sheet1!R2C1,Sheet1!R2C1:R16C1,MOD(RC1-1,3)+MOD(INT((RC1-1)/3),3)*5+3,FALSE)&"|"&HLOOKUP(Sheet1!R2C1,Sheet1!R2C1:R16C1,MOD(RC1,3)+MOD(INT((RC1)/3),3)*5+3,FALSE)&"|"&HLOOKUP(Sheet1!R2C1,Sheet1!R2C1:R16C1,MOD(RC1+1,3)+MOD(INT((RC1+1)/3),3)*5+3,FALSE)&"|"&HLOOKUP(Sheet1!R2C1,Sheet1!R2C1:R16C1,MOD(RC1+2,3)+MOD(INT((RC1+2)/3),3)*5+3,FALSE)&"|"&HLOOKUP(Sheet1!R2C1,Sheet1!R2C1:R16C1,MOD(RC1+3,3)+MOD(INT((RC1+3)/3),3)*5+3,FALSE) -> 133|134|162|163|164 | L488: 25|22|23|24 | M488: 13271374|13271374|13271375|13271375 | N488: 10030|10031|10032|10033 | O488: 1|1|1|1 | P488: 2500|2500|2500|2500
A489: 483 | B489: 481 | C489: 30 | D489: =R[-20]C+2 -> 68 | E489: 1000 | F489: =MOD(RC[-5]-1,3)*30+100&"|"&MOD(RC[-5]-1,3)*30+101&"|"&MOD(RC[-5]-1,3)*30+102&"|"&MOD(RC[-5]-1,3)*30+103&"|"&IF(MOD(RC[-5],4)=0,HLOOKUP(Sheet1!R2C10,Sheet1!R2C10:R7C10,MOD(RC[-5]/4-1,6)+1,FALSE),IF(MOD(RC[-5],2)=0,IF(RC[-5]>20,HLOOKUP(Sheet1!R2C7,Sheet1!R2C7:R43C7,MOD(RC[-5]/2-1,42)+1,FALSE),HLOOKUP(Sheet1!R2C4,Sheet1!R2C4:R7C4,MOD(RC[-5]-1,6)+1,FALSE)),MOD(RC[-5]-1,3)*30+104)) -> 160|161|162|163|164 | G489: =HLOOKUP(Sheet1!R2C1,Sheet1!R2C1:R16C1,MOD(RC1-1,2)+MOD(INT((RC1-1)/2),3)*5+1,FALSE)&"|"&HLOOKUP(Sheet1!R2C1,Sheet1!R2C1:R16C1,MOD(RC1,2)+MOD(INT((RC1)/2),3)*5+1,FALSE)&"|"&HLOOKUP(Sheet1!R2C1,Sheet1!R2C1:R16C1,MOD(RC1+1,2)+MOD(INT((RC1+1)/2),3)*5+1,FALSE)&"|"&HLOOKUP(Sheet1!R2C1,Sheet1!R2C1:R16C1,MOD(RC1+2,2)+MOD(INT((RC1+2)/2),3)*5+1,FALSE)&"|"&HLOOKUP(Sheet1!R2C1,Sheet1!R2C1:R16C1,MOD(RC1+3,2)+MOD(INT((RC1+3)/2),3)*5+1,FALSE) -> 130|131|160|161|100 | H489: =HLOOKUP(Sheet1!R2C1,Sheet1!R2C1:R16C1,MOD(RC1+2,2)+MOD(INT((RC1+2)/2),3)*5+1,FALSE)&"|"&HLOOKUP(Sheet1!R2C1,Sheet1!R2C1:R16C1,MOD(RC1+3,2)+MOD(INT((RC1+3)/2),3)*5+1,FALSE)&"|"&HLOOKUP(Sheet1!R2C1,Sheet1!R2C1:R16C1,MOD(RC1+4,2)+MOD(INT((RC1+4)/2),3)*5+1,FALSE)&"|"&HLOOKUP(Sheet1!R2C1,Sheet1!R2C1:R16C1,MOD(RC1+5,2)+MOD(INT((RC1+5)/2),3)*5+1,FALSE)&"|"&HLOOKUP(Sheet1!R2C1,Sheet1!R2C1:R16C1,MOD(RC1+6,2)+MOD(INT((RC1+6)/2),3)*5+1,FALSE) -> 161|100|101|130|131 | I489: =HLOOKUP(Sheet1!R2C1,Sheet1!R2C1:R16C1,MOD(RC1-1,3)+MOD(INT((RC1-1)/3),3)*5+3,FALSE)&"|"&HLOOKUP(Sheet1!R2C1,Sheet1!R2C1:R16C1,MOD(RC1,3)+MOD(INT((RC1)/3),3)*5+3,FALSE)&"|"&HLOOKUP(Sheet1!R2C1,Sheet1!R2C1:R16C1,MOD(RC1+1,3)+MOD(INT((RC1+1)/3),3)*5+3,FALSE)&"|"&HLOOKUP(Sheet1!R2C1,Sheet1!R2C1:R16C1,MOD(RC1+2,3)+MOD(INT((RC1+2)/3),3)*5+3,FALSE)&"|"&HLOOKUP(Sheet1!R2C1,Sheet1!R2C1:R16C1,MOD(RC1+3,3)+MOD(INT((RC1+3)/3),3)*5+3,FALSE) -> 134|162|163|164|102 | J489: =HLOOKUP(Sheet1!R2C1,Sheet1!R2C1:R16C1,MOD(RC1-1,3)+MOD(INT((RC1-1)/3),3)*5+3,FALSE)&"|"&HLOOKUP(Sheet1!R2C1,Sheet1!R2C1:R16C1,MOD(RC1,3)+MOD(INT((RC1)/3),3)*5+3,FALSE)&"|"&HLOOKUP(Sheet1!R2C1,Sheet1!R2C1:R16C1,MOD(RC1+1,3)+MOD(INT((RC1+1)/3),3)*5+3,FALSE)&"|"&HLOOKUP(Sheet1!R2C1,Sheet1!R2C1:R16C1,MOD(RC1+2,3)+MOD(INT((RC1+2)/3),3)*5+3,FALSE)&"|"&HLOOKUP(Sheet1!R2C1,Sheet1!R2C1:R16C1,MOD(RC1+3,3)+MOD(INT((RC1+3)/3),3)*5+3,FALSE) -> 134|162|163|164|102 | K489: =HLOOKUP(Sheet1!R2C1,Sheet1!R2C1:R16C1,MOD(RC1-1,3)+MOD(INT((RC1-1)/3),3)*5+3,FALSE)&"|"&HLOOKUP(Sheet1!R2C1,Sheet1!R2C1:R16C1,MOD(RC1,3)+MOD(INT((RC1)/3),3)*5+3,FALSE)&"|"&HLOOKUP(Sheet1!R2C1,Sheet1!R2C1:R16C1,MOD(RC1+1,3)+MOD(INT((RC1+1)/3),3)*5+3,FALSE)&"|"&HLOOKUP(Sheet1!R2C1,Sheet1!R2C1:R16C1,MOD(RC1+2,3)+MOD(INT((RC1+2)/3),3)*5+3,FALSE)&"|"&HLOOKUP(Sheet1!R2C1,Sheet1!R2C1:R16C1,MOD(RC1+3,3)+MOD(INT((RC1+3)/3),3)*5+3,FALSE) -> 134|162|163|164|102 | L489: 25|22|23|24 | M489: 13383383|13383383|13383383|13383383 | N489: 10030|10031|10032|10033 | O489: 1|1|1|1 | P489: 2500|2500|2500|2500
A490: 484 | B490: 482 | C490: 30 | D490: =R[-20]C+2 -> 68 | E490: 1000 | F490: =MOD(RC[-5]-1,3)*30+100&"|"&MOD(RC[-5]-1,3)*30+101&"|"&MOD(RC[-5]-1,3)*30+102&"|"&MOD(RC[-5]-1,3)*30+103&"|"&IF(MOD(RC[-5],4)=0,HLOOKUP(Sheet1!R2C10,Sheet1!R2C10:R7C10,MOD(RC[-5]/4-1,6)+1,FALSE),IF(MOD(RC[-5],2)=0,IF(RC[-5]>20,HLOOKUP(Sheet1!R2C7,Sheet1!R2C7:R43C7,MOD(RC[-5]/2-1,42)+1,FALSE),HLOOKUP(Sheet1!R2C4,Sheet1!R2C4:R7C4,MOD(RC[-5]-1,6)+1,FALSE)),MOD(RC[-5]-1,3)*30+104)) -> 100|101|102|103|190 | G490: =HLOOKUP(Sheet1!R2C1,Sheet1!R2C1:R16C1,MOD(RC1-1,2)+MOD(INT((RC1-1)/2),3)*5+1,FALSE)&"|"&HLOOKUP(Sheet1!R2C1,Sheet1!R2C1:R16C1,MOD(RC1,2)+MOD(INT((RC1)/2),3)*5+1,FALSE)&"|"&HLOOKUP(Sheet1!R2C1,Sheet1!R2C1:R16C1,MOD(RC1+1,2)+MOD(INT((RC1+1)/2),3)*5+1,FALSE)&"|"&HLOOKUP(Sheet1!R2C1,Sheet1!R2C1:R16C1,MOD(RC1+2,2)+MOD(INT((RC1+2)/2),3)*5+1,FALSE)&"|"&HLOOKUP(Sheet1!R2C1,Sheet1!R2C1:R16C1,MOD(RC1+3,2)+MOD(INT((RC1+3)/2),3)*5+1,FALSE) -> 131|160|161|100|101 | H490: =HLOOKUP(Sheet1!R2C1,Sheet1!R2C1:R16C1,MOD(RC1+2,2)+MOD(INT((RC1+2)/2),3)*5+1,FALSE)&"|"&HLOOKUP(Sheet1!R2C1,Sheet1!R2C1:R16C1,MOD(RC1+3,2)+MOD(INT((RC1+3)/2),3)*5+1,FALSE)&"|"&HLOOKUP(Sheet1!R2C1,Sheet1!R2C1:R16C1,MOD(RC1+4,2)+MOD(INT((RC1+4)/2),3)*5+1,FALSE)&"|"&HLOOKUP(Sheet1!R2C1,Sheet1!R2C1:R16C1,MOD(RC1+5,2)+MOD(INT((RC1+5)/2),3)*5+1,FALSE)&"|"&HLOOKUP(Sheet1!R2C1,Sheet1!R2C1:R16C1,MOD(RC1+6,2)+MOD(INT((RC1+6)/2),3)*5+1,FALSE) -> 100|101|130|131|160 | I490: =HLOOKUP(Sheet1!R2C1,Sheet1!R2C1:R16C1,MOD(RC1-1,3)+MOD(INT((RC1-1)/3),3)*5+3,FALSE)&"|"&HLOOKUP(Sheet1!R2C1,Sheet1!R2C1:R16C1,MOD(RC1,3)+MOD(INT((RC1)/3),3)*5+3,FALSE)&"|"&HLOOKUP(Sheet1!R2C1,Sheet1!R2C1:R16C1,MOD(RC1+1,3)+MOD(INT((RC1+1)/3),3)*5+3,FALSE)&"|"&HLOOKUP(Sheet1!R2C1,Sheet1!R2C1:R16C1,MOD(RC1+2,3)+MOD(INT((RC1+2)/3),3)*5+3,FALSE)&"|"&HLOOKUP(Sheet1!R2C1,Sheet1!R2C1:R16C1,MOD(RC1+3,3)+MOD(INT((RC1+3)/3),3)*5+3,FALSE) -> 162|163|164|102|103 | J490: =HLOOKUP(Sheet1!R2C1,Sheet1!R2C1:R16C1,MOD(RC1-1,3)+MOD(INT((RC1-1)/3),3)*5+3,FALSE)&"|"&HLOOKUP(Sheet1!R2C1,Sheet1!R2C1:R16C1,MOD(RC1,3)+MOD(INT((RC1)/3),3)*5+3,FALSE)&"|"&HLOOKUP(Sheet1!R2C1,Sheet1!R2C1:R16C1,MOD(RC1+1,3)+MOD(INT((RC1+1)/3),3)*5+3,FALSE)&"|"&HLOOKUP(Sheet1!R2C1,Sheet1!R2C1:R16C1,MOD(RC1+2,3)+MOD(INT((RC1+2)/3),3)*5+3,FALSE)&"|"&HLOOKUP(Sheet1!R2C1,Sheet1!R2C1:R16C1,MOD(RC1+3,3)+MOD(INT((RC1+3)/3),3)*5+3,FALSE) -> 162|163|164|102|103 | K490: =HLOOKUP(Sheet1!R2C1,Sheet1!R2C1:R16C1,MOD(RC1-1,3)+MOD(INT((RC1-1)/3),3)*5+3,FALSE)&"|"&HLOOKUP(Sheet1!R2C1,Sheet1!R2C1:R16C1,MOD(RC1,3)+MOD(INT((RC1)/3),3)*5+3,FALSE)&"|"&HLOOKUP(Sheet1!R2C1,Sheet1!R2C1:R16C1,MOD(RC1+1,3)+MOD(INT((RC1+1)/3),3)*5+3,FALSE)&"|"&HLOOKUP(Sheet1!R2C1,Sheet1!R2C1:R16C1,MOD(RC1+2,3)+MOD(INT((RC1+2)/3),3)*5+3,FALSE)&"|"&HLOOKUP(Sheet1!R2C1,Sheet1!R2C1:R16C1,MOD(RC1+3,3)+MOD(INT((RC1+3)/3),3)*5+3,FALSE) -> 162|163|164|102|103 | L490: 25|22|23|24 | M490: 13495391|13495391|13495390|13495390 | N490: 10030|10031|10032|10033 | O490: 1|1|1|1 | P490: 2500|2500|2500|2500
A491: 485 | B491: 483 | C491: 30 | D491: =R[-20]C+2 -> 68 | E491: 1000 | F491: =MOD(RC[-5]-1,3)*30+100&"|"&MOD(RC[-5]-1,3)*30+101&"|"&MOD(RC[-5]-1,3)*30+102&"|"&MOD(RC[-5]-1,3)*30+103&"|"&IF(MOD(RC[-5],4)=0,HLOOKUP(Sheet1!R2C10,Sheet1!R2C10:R7C10,MOD(RC[-5]/4-1,6)+1,FALSE),IF(MOD(RC[-5],2)=0,IF(RC[-5]>20,HLOOKUP(Sheet1!R2C7,Sheet1!R2C7:R43C7,MOD(RC[-5]/2-1,42)+1,FALSE),HLOOKUP(Sheet1!R2C4,Sheet1!R2C4:R7C4,MOD(RC[-5]-1,6)+1,FALSE)),MOD(RC[-5]-1,3)*30+104)) -> 130|131|132|133|134 | G491: =HLOOKUP(Sheet1!R2C1,Sheet1!R2C1:R16C1,MOD(RC1-1,2)+MOD(INT((RC1-1)/2),3)*5+1,FALSE)&"|"&HLOOKUP(Sheet1!R2C1,Sheet1!R2C1:R16C1,MOD(RC1,2)+MOD(INT((RC1)/2),3)*5+1,FALSE)&"|"&HLOOKUP(Sheet1!R2C1,Sheet1!R2C1:R16C1,MOD(RC1+1,2)+MOD(INT((RC1+1)/2),3)*5+1,FALSE)&"|"&HLOOKUP(Sheet1!R2C1,Sheet1!R2C1:R16C1,MOD(RC1+2,2)+MOD(INT((RC1+2)/2),3)*5+1,FALSE)&"|"&HLOOKUP(Sheet1!R2C1,Sheet1!R2C1:R16C1,MOD(RC1+3,2)+MOD(INT((RC1+3)/2),3)*5+1,FALSE) -> 160|161|100|101|130 | H491: =HLOOKUP(Sheet1!R2C1,Sheet1!R2C1:R16C1,MOD(RC1+2,2)+MOD(INT((RC1+2)/2),3)*5+1,FALSE)&"|"&HLOOKUP(Sheet1!R2C1,Sheet1!R2C1:R16C1,MOD(RC1+3,2)+MOD(INT((RC1+3)/2),3)*5+1,FALSE)&"|"&HLOOKUP(Sheet1!R2C1,Sheet1!R2C1:R16C1,MOD(RC1+4,2)+MOD(INT((RC1+4)/2),3)*5+1,FALSE)&"|"&HLOOKUP(Sheet1!R2C1,Sheet1!R2C1:R16C1,MOD(RC1+5,2)+MOD(INT((RC1+5)/2),3)*5+1,FALSE)&"|"&HLOOKUP(Sheet1!R2C1,Sheet1!R2C1:R16C1,MOD(RC1+6,2)+MOD(INT((RC1+6)/2),3)*5+1,FALSE) -> 101|130|131|160|161 | I491: =HLOOKUP(Sheet1!R2C1,Sheet1!R2C1:R16C1,MOD(RC1-1,3)+MOD(INT((RC1-1)/3),3)*5+3,FALSE)&"|"&HLOOKUP(Sheet1!R2C1,Sheet1!R2C1:R16C1,MOD(RC1,3)+MOD(INT((RC1)/3),3)*5+3,FALSE)&"|"&HLOOKUP(Sheet1!R2C1,Sheet1!R2C1:R16C1,MOD(RC1+1,3)+MOD(INT((RC1+1)/3),3)*5+3,FALSE)&"|"&HLOOKUP(Sheet1!R2C1,Sheet1!R2C1:R16C1,MOD(RC1+2,3)+MOD(INT((RC1+2)/3),3)*5+3,FALSE)&"|"&HLOOKUP(Sheet1!R2C1,Sheet1!R2C1:R16C1,MOD(RC1+3,3)+MOD(INT((RC1+3)/3),3)*5+3,FALSE) -> 163|164|102|103|104 | J491: =HLOOKUP(Sheet1!R2C1,Sheet1!R2C1:R16C1,MOD(RC1-1,3)+MOD(INT((RC1-1)/3),3)*5+3,FALSE)&"|"&HLOOKUP(Sheet1!R2C1,Sheet1!R2C1:R16C1,MOD(RC1,3)+MOD(INT((RC1)/3),3)*5+3,FALSE)&"|"&HLOOKUP(Sheet1!R2C1,Sheet1!R2C1:R16C1,MOD(RC1+1,3)+MOD(INT((RC1+1)/3),3)*5+3,FALSE)&"|"&HLOOKUP(Sheet1!R2C1,Sheet1!R2C1:R16C1,MOD(RC1+2,3)+MOD(INT((RC1+2)/3),3)*5+3,FALSE)&"|"&HLOOKUP(Sheet1!R2C1,Sheet1!R2C1:R16C1,MOD(RC1+3,3)+MOD(INT((RC1+3)/3),3)*5+3,FALSE) -> 163|164|102|103|104 | K491: =HLOOKUP(Sheet1!R2C1,Sheet1!R2C1:R16C1,MOD(RC1-1,3)+MOD(INT((RC1-1)/3),3)*5+3,FALSE)&"|"&HLOOKUP(Sheet1!R2C1,Sheet1!R2C1:R16C1,MOD(RC1,3)+MOD(INT((RC1)/3),3)*5+3,FALSE)&"|"&HLOOKUP(Sheet1!R2C1,Sheet1!R2C1:R16C1,MOD(RC1+1,3)+MOD(INT((RC1+1)/3),3)*5+3,FALSE)&"|"&HLOOKUP(Sheet1!R2C1,Sheet1!R2C1:R16C1,MOD(RC1+2,3)+MOD(INT((RC1+2)/3),3)*5+3,FALSE)&"|"&HLOOKUP(Sheet1!R2C1,Sheet1!R2C1:R16C1,MOD(RC1+3,3)+MOD(INT((RC1+3)/3),3)*5+3,FALSE) -> 163|164|102|103|104 | L491: 25|22|23|24 | M491: 13612269|13612270|13612270|13612270 | N491: 10030|10031|10032|10033|10030|10031|10032|10033|10030|10031|10032|10033|10030|10031|10032|10033|10030|10031|10032|10033|10030|10031|10032|10033|10030|10031|10032|10033|10030|10031|10032|10033|10030|10031|10032|10033|10030|10031|10032|10033 | O491: 1|1|1|1|1|1|1|1|1|1|1|1|1|1|1|1|1|1|1|1|1|1|1|1|1|1|1|1|1|1|1|1|1|1|1|1|1|1|1|1 | P491: 2500|2500|2500|2500|2500|2500|2500|2500|2500|2500|2500|2500|2500|2500|2500|2500|2500|2500|2500|2500|2500|2500|2500|2500|2500|2500|2500|2500|2500|2500|2500|2500|2500|2500|2500|2500|2500|2500|2500|2500
A492: 486 | B492: 484 | C492: 30 | D492: =R[-20]C+2 -> 68 | E492: 1000 | F492: =MOD(RC[-5]-1,3)*30+100&"|"&MOD(RC[-5]-1,3)*30+101&"|"&MOD(RC[-5]-1,3)*30+102&"|"&MOD(RC[-5]-1,3)*30+103&"|"&IF(MOD(RC[-5],4)=0,HLOOKUP(Sheet1!R2C10,Sheet1!R2C10:R7C10,MOD(RC[-5]/4-1,6)+1,FALSE),IF(MOD(RC[-5],2)=0,IF(RC[-5]>20,HLOOKUP(Sheet1!R2C7,Sheet1!R2C7:R43C7,MOD(RC[-5]/2-1,42)+1,FALSE),HLOOKUP(Sheet1!R2C4,Sheet1!R2C4:R7C4,MOD(RC[-5]-1,6)+1,FALSE)),MOD(RC[-5]-1,3)*30+104)) -> 160|161|162|163|176 | G492: =HLOOKUP(Sheet1!R2C1,Sheet1!R2C1:R16C1,MOD(RC1-1,2)+MOD(INT((RC1-1)/2),3)*5+1,FALSE)&"|"&HLOOKUP(Sheet1!R2C1,Sheet1!R2C1:R16C1,MOD(RC1,2)+MOD(INT((RC1)/2),3)*5+1,FALSE)&"|"&HLOOKUP(Sheet1!R2C1,Sheet1!R2C1:R16C1,MOD(RC1+1,2)+MOD(INT((RC1+1)/2),3)*5+1,FALSE)&"|"&HLOOKUP(Sheet1!R2C1,Sheet1!R2C1:R16C1,MOD(RC1+2,2)+MOD(INT((RC1+2)/2),3)*5+1,FALSE)&"|"&HLOOKUP(Sheet1!R2C1,Sheet1!R2C1:R16C1,MOD(RC1+3,2)+MOD(INT((RC1+3)/2),3)*5+1,FALSE) -> 161|100|101|130|131 | H492: =HLOOKUP(Sheet1!R2C1,Sheet1!R2C1:R16C1,MOD(RC1+2,2)+MOD(INT((RC1+2)/2),3)*5+1,FALSE)&"|"&HLOOKUP(Sheet1!R2C1,Sheet1!R2C1:R16C1,MOD(RC1+3,2)+MOD(INT((RC1+3)/2),3)*5+1,FALSE)&"|"&HLOOKUP(Sheet1!R2C1,Sheet1!R2C1:R16C1,MOD(RC1+4,2)+MOD(INT((RC1+4)/2),3)*5+1,FALSE)&"|"&HLOOKUP(Sheet1!R2C1,Sheet1!R2C1:R16C1,MOD(RC1+5,2)+MOD(INT((RC1+5)/2),3)*5+1,FALSE)&"|"&HLOOKUP(Sheet1!R2C1,Sheet1!R2C1:R16C1,MOD(RC1+6,2)+MOD(INT((RC1+6)/2),3)*5+1,FALSE) -> 130|131|160|161|100 | I492: =HLOOKUP(Sheet1!R2C1,Sheet1!R2C1:R16C1,MOD(RC1-1,3)+MOD(INT((RC1-1)/3),3)*5+3,FALSE)&"|"&HLOOKUP(Sheet1!R2C1,Sheet1!R2C1:R16C1,MOD(RC1,3)+MOD(INT((RC1)/3),3)*5+3,FALSE)&"|"&HLOOKUP(Sheet1!R2C1,Sheet1!R2C1:R16C1,MOD(RC1+1,3)+MOD(INT((RC1+1)/3),3)*5+3,FALSE)&"|"&HLOOKUP(Sheet1!R2C1,Sheet1!R2C1:R16C1,MOD(RC1+2,3)+MOD(INT((RC1+2)/3),3)*5+3,FALSE)&"|"&HLOOKUP(Sheet1!R2C1,Sheet1!R2C1:R16C1,MOD(RC1+3,3)+MOD(INT((RC1+3)/3),3)*5+3,FALSE) -> 164|102|103|104|132 | J492: =HLOOKUP(Sheet1!R2C1,Sheet1!R2C1:R16C1,MOD(RC1-1,3)+MOD(INT((RC1-1)/3),3)*5+3,FALSE)&"|"&HLOOKUP(Sheet1!R2C1,Sheet1!R2C1:R16C1,MOD(RC1,3)+MOD(INT((RC1)/3),3)*5+3,FALSE)&"|"&HLOOKUP(Sheet1!R2C1,Sheet1!R2C1:R16C1,MOD(RC1+1,3)+MOD(INT((RC1+1)/3),3)*5+3,FALSE)&"|"&HLOOKUP(Sheet1!R2C1,Sheet1!R2C1:R16C1,MOD(RC1+2,3)+MOD(INT((RC1+2)/3),3)*5+3,FALSE)&"|"&HLOOKUP(Sheet1!R2C1,Sheet1!R2C1:R16C1,MOD(RC1+3,3)+MOD(INT((RC1+3)/3),3)*5+3,FALSE) -> 164|102|103|104|132 | K492: =HLOOKUP(Sheet1!R2C1,Sheet1!R2C1:R16C1,MOD(RC1-1,3)+MOD(INT((RC1-1)/3),3)*5+3,FALSE)&"|"&HLOOKUP(Sheet1!R2C1,Sheet1!R2C1:R16C1,MOD(RC1,3)+MOD(INT((RC1)/3),3)*5+3,FALSE)&"|"&HLOOKUP(Sheet1!R2C1,Sheet1!R2C1:R16C1,MOD(RC1+1,3)+MOD(INT((RC1+1)/3),3)*5+3,FALSE)&"|"&HLOOKUP(Sheet1!R2C1,Sheet1!R2C1:R16C1,MOD(RC1+2,3)+MOD(INT((RC1+2)/3),3)*5+3,FALSE)&"|"&HLOOKUP(Sheet1!R2C1,Sheet1!R2C1:R16C1,MOD(RC1+3,3)+MOD(INT((RC1+3)/3),3)*5+3,FALSE) -> 164|102|103|104|132 | L492: 25|22|23|24 | M492: 13724816|13724815|13724815|13724815 | N492: 10030|10031|10032|10033 | O492: 1|1|1|1 | P492: 2500|2500|2500|2500
A493: 487 | B493: 485 | C493: 30 | D493: =R[-20]C+2 -> 68 | E493: 1000 | F493: =MOD(RC[-5]-1,3)*30+100&"|"&MOD(RC[-5]-1,3)*30+101&"|"&MOD(RC[-5]-1,3)*30+102&"|"&MOD(RC[-5]-1,3)*30+103&"|"&IF(MOD(RC[-5],4)=0,HLOOKUP(Sheet1!R2C10,Sheet1!R2C10:R7C10,MOD(RC[-5]/4-1,6)+1,FALSE),IF(MOD(RC[-5],2)=0,IF(RC[-5]>20,HLOOKUP(Sheet1!R2C7,Sheet1!R2C7:R43C7,MOD(RC[-5]/2-1,42)+1,FALSE),HLOOKUP(Sheet1!R2C4,Sheet1!R2C4:R7C4,MOD(RC[-5]-1,6)+1,FALSE)),MOD(RC[-5]-1,3)*30+104)) -> 100|101|102|103|104 | G493: =HLOOKUP(Sheet1!R2C1,Sheet1!R2C1:R16C1,MOD(RC1-1,2)+MOD(INT((RC1-1)/2),3)*5+1,FALSE)&"|"&HLOOKUP(Sheet1!R2C1,Sheet1!R2C1:R16C1,MOD(RC1,2)+MOD(INT((RC1)/2),3)*5+1,FALSE)&"|"&HLOOKUP(Sheet1!R2C1,Sheet1!R2C1:R16C1,MOD(RC1+1,2)+MOD(INT((RC1+1)/2),3)*5+1,FALSE)&"|"&HLOOKUP(Sheet1!R2C1,Sheet1!R2C1:R16C1,MOD(RC1+2,2)+MOD(INT((RC1+2)/2),3)*5+1,FALSE)&"|"&HLOOKUP(Sheet1!R2C1,Sheet1!R2C1:R16C1,MOD(RC1+3,2)+MOD(INT((RC1+3)/2),3)*5+1,FALSE) -> 100|101|130|131|160 | H493: =HLOOKUP(Sheet1!R2C1,Sheet1!R2C1:R16C1,MOD(RC1+2,2)+MOD(INT((RC1+2)/2),3)*5+1,FALSE)&"|"&HLOOKUP(Sheet1!R2C1,Sheet1!R2C1:R16C1,MOD(RC1+3,2)+MOD(INT((RC1+3)/2),3)*5+1,FALSE)&"|"&HLOOKUP(Sheet1!R2C1,Sheet1!R2C1:R16C1,MOD(RC1+4,2)+MOD(INT((RC1+4)/2),3)*5+1,FALSE)&"|"&HLOOKUP(Sheet1!R2C1,Sheet1!R2C1:R16C1,MOD(RC1+5,2)+MOD(INT((RC1+5)/2),3)*5+1,FALSE)&"|"&HLOOKUP(Sheet1!R2C1,Sheet1!R2C1:R16C1,MOD(RC1+6,2)+MOD(INT((RC1+6)/2),3)*5+1,FALSE) -> 131|160|161|100|101 | I493: =HLOOKUP(Sheet1!R2C1,Sheet1!R2C1:R16C1,MOD(RC1-1,3)+MOD(INT((RC1-1)/3),3)*5+3,FALSE)&"|"&HLOOKUP(Sheet1!R2C1,Sheet1!R2C1:R16C1,MOD(RC1,3)+MOD(INT((RC1)/3),3)*5+3,FALSE)&"|"&HLOOKUP(Sheet1!R2C1,Sheet1!R2C1:R16C1,MOD(RC1+1,3)+MOD(INT((RC1+1)/3),3)*5+3,FALSE)&"|"&HLOOKUP(Sheet1!R2C1,Sheet1!R2C1:R16C1,MOD(RC1+2,3)+MOD(INT((RC1+2)/3),3)*5+3,FALSE)&"|"&HLOOKUP(Sheet1!R2C1,Sheet1!R2C1:R16C1,MOD(RC1+3,3)+MOD(INT((RC1+3)/3),3)*5+3,FALSE) -> 102|103|104|132|133 | J493: =HLOOKUP(Sheet1!R2C1,Sheet1!R2C1:R16C1,MOD(RC1-1,3)+MOD(INT((RC1-1)/3),3)*5+3,FALSE)&"|"&HLOOKUP(Sheet1!R2C1,Sheet1!R2C1:R16C1,MOD(RC1,3)+MOD(INT((RC1)/3),3)*5+3,FALSE)&"|"&HLOOKUP(Sheet1!R2C1,Sheet1!R2C1:R16C1,MOD(RC1+1,3)+MOD(INT((RC1+1)/3),3)*5+3,FALSE)&"|"&HLOOKUP(Sheet1!R2C1,Sheet1!R2C1:R16C1,MOD(RC1+2,3)+MOD(INT((RC1+2)/3),3)*5+3,FALSE)&"|"&HLOOKUP(Sheet1!R2C1,Sheet1!R2C1:R16C1,MOD(RC1+3,3)+MOD(INT((RC1+3)/3),3)*5+3,FALSE) -> 102|103|104|132|133 | K493: =HLOOKUP(Sheet1!R2C1,Sheet1!R2C1:R16C1,MOD(RC1-1,3)+MOD(INT((RC1-1)/3),3)*5+3,FALSE)&"|"&HLOOKUP(Sheet1!R2C1,Sheet1!R2C1:R16C1,MOD(RC1,3)+MOD(INT((RC1)/3),3)*5+3,FALSE)&"|"&HLOOKUP(Sheet1!R2C1,Sheet1!R2C1:R16C1,MOD(RC1+1,3)+MOD(INT((RC1+1)/3),3)*5+3,FALSE)&"|"&HLOOKUP(Sheet1!R2C1,Sheet1!R2C1:R16C1,MOD(RC1+2,3)+MOD(INT((RC1+2)/3),3)*5+3,FALSE)&"|"&HLOOKUP(Sheet1!R2C1,Sheet1!R2C1:R16C1,MOD(RC1+3,3)+MOD(INT((RC1+3)/3),3)*5+3,FALSE) -> 102|103|104|132|133 | L493: 25|22|23|24 | M493: 13840946|13840946|13840945|13840945 | N493: 10030|10031|10032|10033 | O493: 1|1|1|1 | P493: 2500|2500|2500|2500
A494: 488 | B494: 486 | C494: 30 | D494: =R[-20]C+2 -> 68 | E494: 1000 | F494: =MOD(RC[-5]-1,3)*30+100&"|"&MOD(RC[-5]-1,3)*30+101&"|"&MOD(RC[-5]-1,3)*30+102&"|"&MOD(RC[-5]-1,3)*30+103&"|"&IF(MOD(RC[-5],4)=0,HLOOKUP(Sheet1!R2C10,Sheet1!R2C10:R7C10,MOD(RC[-5]/4-1,6)+1,FALSE),IF(MOD(RC[-5],2)=0,IF(RC[-5]>20,HLOOKUP(Sheet1!R2C7,Sheet1!R2C7:R43C7,MOD(RC[-5]/2-1,42)+1,FALSE),HLOOKUP(Sheet1!R2C4,Sheet1!R2C4:R7C4,MOD(RC[-5]-1,6)+1,FALSE)),MOD(RC[-5]-1,3)*30+104)) -> 130|131|132|133|191 | G494: =HLOOKUP(Sheet1!R2C1,Sheet1!R2C1:R16C1,MOD(RC1-1,2)+MOD(INT((RC1-1)/2),3)*5+1,FALSE)&"|"&HLOOKUP(Sheet1!R2C1,Sheet1!R2C1:R16C1,MOD(RC1,2)+MOD(INT((RC1)/2),3)*5+1,FALSE)&"|"&HLOOKUP(Sheet1!R2C1,Sheet1!R2C1:R16C1,MOD(RC1+1,2)+MOD(INT((RC1+1)/2),3)*5+1,FALSE)&"|"&HLOOKUP(Sheet1!R2C1,Sheet1!R2C1:R16C1,MOD(RC1+2,2)+MOD(INT((RC1+2)/2),3)*5+1,FALSE)&"|"&HLOOKUP(Sheet1!R2C1,Sheet1!R2C1:R16C1,MOD(RC1+3,2)+MOD(INT((RC1+3)/2),3)*5+1,FALSE) -> 101|130|131|160|161 | H494: =HLOOKUP(Sheet1!R2C1,Sheet1!R2C1:R16C1,MOD(RC1+2,2)+MOD(INT((RC1+2)/2),3)*5+1,FALSE)&"|"&HLOOKUP(Sheet1!R2C1,Sheet1!R2C1:R16C1,MOD(RC1+3,2)+MOD(INT((RC1+3)/2),3)*5+1,FALSE)&"|"&HLOOKUP(Sheet1!R2C1,Sheet1!R2C1:R16C1,MOD(RC1+4,2)+MOD(INT((RC1+4)/2),3)*5+1,FALSE)&"|"&HLOOKUP(Sheet1!R2C1,Sheet1!R2C1:R16C1,MOD(RC1+5,2)+MOD(INT((RC1+5)/2),3)*5+1,FALSE)&"|"&HLOOKUP(Sheet1!R2C1,Sheet1!R2C1:R16C1,MOD(RC1+6,2)+MOD(INT((RC1+6)/2),3)*5+1,FALSE) -> 160|161|100|101|130 | I494: =HLOOKUP(Sheet1!R2C1,Sheet1!R2C1:R16C1,MOD(RC1-1,3)+MOD(INT((RC1-1)/3),3)*5+3,FALSE)&"|"&HLOOKUP(Sheet1!R2C1,Sheet1!R2C1:R16C1,MOD(RC1,3)+MOD(INT((RC1)/3),3)*5+3,FALSE)&"|"&HLOOKUP(Sheet1!R2C1,Sheet1!R2C1:R16C1,MOD(RC1+1,3)+MOD(INT((RC1+1)/3),3)*5+3,FALSE)&"|"&HLOOKUP(Sheet1!R2C1,Sheet1!R2C1:R16C1,MOD(RC1+2,3)+MOD(INT((RC1+2)/3),3)*5+3,FALSE)&"|"&HLOOKUP(Sheet1!R2C1,Sheet1!R2C1:R16C1,MOD(RC1+3,3)+MOD(INT((RC1+3)/3),3)*5+3,FALSE) -> 103|104|132|133|134 | J494: =HLOOKUP(Sheet1!R2C1,Sheet1!R2C1:R16C1,MOD(RC1-1,3)+MOD(INT((RC1-1)/3),3)*5+3,FALSE)&"|"&HLOOKUP(Sheet1!R2C1,Sheet1!R2C1:R16C1,MOD(RC1,3)+MOD(INT((RC1)/3),3)*5+3,FALSE)&"|"&HLOOKUP(Sheet1!R2C1,Sheet1!R2C1:R16C1,MOD(RC1+1,3)+MOD(INT((RC1+1)/3),3)*5+3,FALSE)&"|"&HLOOKUP(Sheet1!R2C1,Sheet1!R2C1:R16C1,MOD(RC1+2,3)+MOD(INT((RC1+2)/3),3)*5+3,FALSE)&"|"&HLOOKUP(Sheet1!R2C1,Sheet1!R2C1:R16C1,MOD(RC1+3,3)+MOD(INT((RC1+3)/3),3)*5+3,FALSE) -> 103|104|132|133|134 | K494: =HLOOKUP(Sheet1!R2C1,Sheet1!R2C1:R16C1,MOD(RC1-1,3)+MOD(INT((RC1-1)/3),3)*5+3,FALSE)&"|"&HLOOKUP(Sheet1!R2C1,Sheet1!R2C1:R16C1,MOD(RC1,3)+MOD(INT((RC1)/3),3)*5+3,FALSE)&"|"&HLOOKUP(Sheet1!R2C1,Sheet1!R2C1:R16C1,MOD(RC1+1,3)+MOD(INT((RC1+1)/3),3)*5+3,FALSE)&"|"&HLOOKUP(Sheet1!R2C1,Sheet1!R2C1:R16C1,MOD(RC1+2,3)+MOD(INT((RC1+2)/3),3)*5+3,FALSE)&"|"&HLOOKUP(Sheet1!R2C1,Sheet1!R2C1:R16C1,MOD(RC1+3,3)+MOD(INT((RC1+3)/3),3)*5+3,FALSE) -> 103|104|132|133|134 | L494: 25|22|23|24 | M494: 13957077|13957076|13957078|13957078 | N494: 10030|10031|10032|10033 | O494: 1|1|1|1 | P494: 2500|2500|2500|2500
A495: 489 | B495: 487 | C495: 30 | D495: =R[-20]C+2 -> 68 | E495: 1000 | F495: =MOD(RC[-5]-1,3)*30+100&"|"&MOD(RC[-5]-1,3)*30+101&"|"&MOD(RC[-5]-1,3)*30+102&"|"&MOD(RC[-5]-1,3)*30+103&"|"&IF(MOD(RC[-5],4)=0,HLOOKUP(Sheet1!R2C10,Sheet1!R2C10:R7C10,MOD(RC[-5]/4-1,6)+1,FALSE),IF(MOD(RC[-5],2)=0,IF(RC[-5]>20,HLOOKUP(Sheet1!R2C7,Sheet1!R2C7:R43C7,MOD(RC[-5]/2-1,42)+1,FALSE),HLOOKUP(Sheet1!R2C4,Sheet1!R2C4:R7C4,MOD(RC[-5]-1,6)+1,FALSE)),MOD(RC[-5]-1,3)*30+104)) -> 160|161|162|163|164 | G495: =HLOOKUP(Sheet1!R2C1,Sheet1!R2C1:R16C1,MOD(RC1-1,2)+MOD(INT((RC1-1)/2),3)*5+1,FALSE)&"|"&HLOOKUP(Sheet1!R2C1,Sheet1!R2C1:R16C1,MOD(RC1,2)+MOD(INT((RC1)/2),3)*5+1,FALSE)&"|"&HLOOKUP(Sheet1!R2C1,Sheet1!R2C1:R16C1,MOD(RC1+1,2)+MOD(INT((RC1+1)/2),3)*5+1,FALSE)&"|"&HLOOKUP(Sheet1!R2C1,Sheet1!R2C1:R16C1,MOD(RC1+2,2)+MOD(INT((RC1+2)/2),3)*5+1,FALSE)&"|"&HLOOKUP(Sheet1!R2C1,Sheet1!R2C1:R16C1,MOD(RC1+3,2)+MOD(INT((RC1+3)/2),3)*5+1,FALSE) -> 130|131|160|161|100 | H495: =HLOOKUP(Sheet1!R2C1,Sheet1!R2C1:R16C1,MOD(RC1+2,2)+MOD(INT((RC1+2)/2),3)*5+1,FALSE)&"|"&HLOOKUP(Sheet1!R2C1,Sheet1!R2C1:R16C1,MOD(RC1+3,2)+MOD(INT((RC1+3)/2),3)*5+1,FALSE)&"|"&HLOOKUP(Sheet1!R2C1,Sheet1!R2C1:R16C1,MOD(RC1+4,2)+MOD(INT((RC1+4)/2),3)*5+1,FALSE)&"|"&HLOOKUP(Sheet1!R2C1,Sheet1!R2C1:R16C1,MOD(RC1+5,2)+MOD(INT((RC1+5)/2),3)*5+1,FALSE)&"|"&HLOOKUP(Sheet1!R2C1,Sheet1!R2C1:R16C1,MOD(RC1+6,2)+MOD(INT((RC1+6)/2),3)*5+1,FALSE) -> 161|100|101|130|131 | I495: =HLOOKUP(Sheet1!R2C1,Sheet1!R2C1:R16C1,MOD(RC1-1,3)+MOD(INT((RC1-1)/3),3)*5+3,FALSE)&"|"&HLOOKUP(Sheet1!R2C1,Sheet1!R2C1:R16C1,MOD(RC1,3)+MOD(INT((RC1)/3),3)*5+3,FALSE)&"|"&HLOOKUP(Sheet1!R2C1,Sheet1!R2C1:R16C1,MOD(RC1+1,3)+MOD(INT((RC1+1)/3),3)*5+3,FALSE)&"|"&HLOOKUP(Sheet1!R2C1,Sheet1!R2C1:R16C1,MOD(RC1+2,3)+MOD(INT((RC1+2)/3),3)*5+3,FALSE)&"|"&HLOOKUP(Sheet1!R2C1,Sheet1!R2C1:R16C1,MOD(RC1+3,3)+MOD(INT((RC1+3)/3),3)*5+3,FALSE) -> 104|132|133|134|162 | J495: =HLOOKUP(Sheet1!R2C1,Sheet1!R2C1:R16C1,MOD(RC1-1,3)+MOD(INT((RC1-1)/3),3)*5+3,FALSE)&"|"&HLOOKUP(Sheet1!R2C1,Sheet1!R2C1:R16C1,MOD(RC1,3)+MOD(INT((RC1)/3),3)*5+3,FALSE)&"|"&HLOOKUP(Sheet1!R2C1,Sheet1!R2C1:R16C1,MOD(RC1+1,3)+MOD(INT((RC1+1)/3),3)*5+3,FALSE)&"|"&HLOOKUP(Sheet1!R2C1,Sheet1!R2C1:R16C1,MOD(RC1+2,3)+MOD(INT((RC1+2)/3),3)*5+3,FALSE)&"|"&HLOOKUP(Sheet1!R2C1,Sheet1!R2C1:R16C1,MOD(RC1+3,3)+MOD(INT((RC1+3)/3),3)*5+3,FALSE) -> 104|132|133|134|162 | K495: =HLOOKUP(Sheet1!R2C1,Sheet1!R2C1:R16C1,MOD(RC1-1,3)+MOD(INT((RC1-1)/3),3)*5+3,FALSE)&"|"&HLOOKUP(Sheet1!R2C1,Sheet1!R2C1:R16C1,MOD(RC1,3)+MOD(INT((RC1)/3),3)*5+3,FALSE)&"|"&HLOOKUP(Sheet1!R2C1,Sheet1!R2C1:R16C1,MOD(RC1+1,3)+MOD(INT((RC1+1)/3),3)*5+3,FALSE)&"|"&HLOOKUP(Sheet1!R2C1,Sheet1!R2C1:R16C1,MOD(RC1+2,3)+MOD(INT((RC1+2)/3),3)*5+3,FALSE)&"|"&HLOOKUP(Sheet1!R2C1,Sheet1!R2C1:R16C1,MOD(RC1+3,3)+MOD(INT((RC1+3)/3),3)*5+3,FALSE) -> 104|132|133|134|162 | L495: 25|22|23|24 | M495: 14078257|14078256|14078258|14078258 | N495: 10030|10031|10032|10033 | O495: 1|1|1|1 | P495: 2500|2500|2500|2500
A496: 490 | B496: 488 | C496: 30 | D496: =R[-20]C+2 -> 68 | E496: 1000 | F496: =MOD(RC[-5]-1,3)*30+100&"|"&MOD(RC[-5]-1,3)*30+101&"|"&MOD(RC[-5]-1,3)*30+102&"|"&MOD(RC[-5]-1,3)*30+103&"|"&IF(MOD(RC[-5],4)=0,HLOOKUP(Sheet1!R2C10,Sheet1!R2C10:R7C10,MOD(RC[-5]/4-1,6)+1,FALSE),IF(MOD(RC[-5],2)=0,IF(RC[-5]>20,HLOOKUP(Sheet1!R2C7,Sheet1!R2C7:R43C7,MOD(RC[-5]/2-1,42)+1,FALSE),HLOOKUP(Sheet1!R2C4,Sheet1!R2C4:R7C4,MOD(RC[-5]-1,6)+1,FALSE)),MOD(RC[-5]-1,3)*30+104)) -> 100|101|102|103|178 | G496: =HLOOKUP(Sheet1!R2C1,Sheet1!R2C1:R16C1,MOD(RC1-1,2)+MOD(INT((RC1-1)/2),3)*5+1,FALSE)&"|"&HLOOKUP(Sheet1!R2C1,Sheet1!R2C1:R16C1,MOD(RC1,2)+MOD(INT((RC1)/2),3)*5+1,FALSE)&"|"&HLOOKUP(Sheet1!R2C1,Sheet1!R2C1:R16C1,MOD(RC1+1,2)+MOD(INT((RC1+1)/2),3)*5+1,FALSE)&"|"&HLOOKUP(Sheet1!R2C1,Sheet1!R2C1:R16C1,MOD(RC1+2,2)+MOD(INT((RC1+2)/2),3)*5+1,FALSE)&"|"&HLOOKUP(Sheet1!R2C1,Sheet1!R2C1:R16C1,MOD(RC1+3,2)+MOD(INT((RC1+3)/2),3)*5+1,FALSE) -> 131|160|161|100|101 | H496: =HLOOKUP(Sheet1!R2C1,Sheet1!R2C1:R16C1,MOD(RC1+2,2)+MOD(INT((RC1+2)/2),3)*5+1,FALSE)&"|"&HLOOKUP(Sheet1!R2C1,Sheet1!R2C1:R16C1,MOD(RC1+3,2)+MOD(INT((RC1+3)/2),3)*5+1,FALSE)&"|"&HLOOKUP(Sheet1!R2C1,Sheet1!R2C1:R16C1,MOD(RC1+4,2)+MOD(INT((RC1+4)/2),3)*5+1,FALSE)&"|"&HLOOKUP(Sheet1!R2C1,Sheet1!R2C1:R16C1,MOD(RC1+5,2)+MOD(INT((RC1+5)/2),3)*5+1,FALSE)&"|"&HLOOKUP(Sheet1!R2C1,Sheet1!R2C1:R16C1,MOD(RC1+6,2)+MOD(INT((RC1+6)/2),3)*5+1,FALSE) -> 100|101|130|131|160 | I496: =HLOOKUP(Sheet1!R2C1,Sheet1!R2C1:R16C1,MOD(RC1-1,3)+MOD(INT((RC1-1)/3),3)*5+3,FALSE)&"|"&HLOOKUP(Sheet1!R2C1,Sheet1!R2C1:R16C1,MOD(RC1,3)+MOD(INT((RC1)/3),3)*5+3,FALSE)&"|"&HLOOKUP(Sheet1!R2C1,Sheet1!R2C1:R16C1,MOD(RC1+1,3)+MOD(INT((RC1+1)/3),3)*5+3,FALSE)&"|"&HLOOKUP(Sheet1!R2C1,Sheet1!R2C1:R16C1,MOD(RC1+2,3)+MOD(INT((RC1+2)/3),3)*5+3,FALSE)&"|"&HLOOKUP(Sheet1!R2C1,Sheet1!R2C1:R16C1,MOD(RC1+3,3)+MOD(INT((RC1+3)/3),3)*5+3,FALSE) -> 132|133|134|162|163 | J496: =HLOOKUP(Sheet1!R2C1,Sheet1!R2C1:R16C1,MOD(RC1-1,3)+MOD(INT((RC1-1)/3),3)*5+3,FALSE)&"|"&HLOOKUP(Sheet1!R2C1,Sheet1!R2C1:R16C1,MOD(RC1,3)+MOD(INT((RC1)/3),3)*5+3,FALSE)&"|"&HLOOKUP(Sheet1!R2C1,Sheet1!R2C1:R16C1,MOD(RC1+1,3)+MOD(INT((RC1+1)/3),3)*5+3,FALSE)&"|"&HLOOKUP(Sheet1!R2C1,Sheet1!R2C1:R16C1,MOD(RC1+2,3)+MOD(INT((RC1+2)/3),3)*5+3,FALSE)&"|"&HLOOKUP(Sheet1!R2C1,Sheet1!R2C1:R16C1,MOD(RC1+3,3)+MOD(INT((RC1+3)/3),3)*5+3,FALSE) -> 132|133|134|162|163 | K496: =HLOOKUP(Sheet1!R2C1,Sheet1!R2C1:R16C1,MOD(RC1-1,3)+MOD(INT((RC1-1)/3),3)*5+3,FALSE)&"|"&HLOOKUP(Sheet1!R2C1,Sheet1!R2C1:R16C1,MOD(RC1,3)+MOD(INT((RC1)/3),3)*5+3,FALSE)&"|"&HLOOKUP(Sheet1!R2C1,Sheet1!R2C1:R16C1,MOD(RC1+1,3)+MOD(INT((RC1+1)/3),3)*5+3,FALSE)&"|"&HLOOKUP(Sheet1!R2C1,Sheet1!R2C1:R16C1,MOD(RC1+2,3)+MOD(INT((RC1+2)/3),3)*5+3,FALSE)&"|"&HLOOKUP(Sheet1!R2C1,Sheet1!R2C1:R16C1,MOD(RC1+3,3)+MOD(INT((RC1+3)/3),3)*5+3,FALSE) -> 132|133|134|162|163 | L496: 25|22|23|24 | M496: 14194387|14194388|14194388|14194388 | N496: 10030|10031|10032|10033|10030|10031|10032|10033|10030|10031|10032|10033|10030|10031|10032|10033|10030|10031|10032|10033|10030|10031|10032|10033|10030|10031|10032|10033|10030|10031|10032|10033|10030|10031|10032|10033|10030|10031|10032|10033 | O496: 1|1|1|1|1|1|1|1|1|1|1|1|1|1|1|1|1|1|1|1|1|1|1|1|1|1|1|1|1|1|1|1|1|1|1|1|1|1|1|1 | P496: 2500|2500|2500|2500|2500|2500|2500|2500|2500|2500|2500|2500|2500|2500|2500|2500|2500|2500|2500|2500|2500|2500|2500|2500|2500|2500|2500|2500|2500|2500|2500|2500|2500|2500|2500|2500|2500|2500|2500|2500
A497: 491 | B497: 489 | C497: 30 | D497: =R[-20]C+2 -> 68 | E497: 1000 | F497: =MOD(RC[-5]-1,3)*30+100&"|"&MOD(RC[-5]-1,3)*30+101&"|"&MOD(RC[-5]-1,3)*30+102&"|"&MOD(RC[-5]-1,3)*30+103&"|"&IF(MOD(RC[-5],4)=0,HLOOKUP(Sheet1!R2C10,Sheet1!R2C10:R7C10,MOD(RC[-5]/4-1,6)+1,FALSE),IF(MOD(RC[-5],2)=0,IF(RC[-5]>20,HLOOKUP(Sheet1!R2C7,Sheet1!R2C7:R43C7,MOD(RC[-5]/2-1,42)+1,FALSE),HLOOKUP(Sheet1!R2C4,Sheet1!R2C4:R7C4,MOD(RC[-5]-1,6)+1,FALSE)),MOD(RC[-5]-1,3)*30+104)) -> 130|131|132|133|134 | G497: =HLOOKUP(Sheet1!R2C1,Sheet1!R2C1:R16C1,MOD(RC1-1,2)+MOD(INT((RC1-1)/2),3)*5+1,FALSE)&"|"&HLOOKUP(Sheet1!R2C1,Sheet1!R2C1:R16C1,MOD(RC1,2)+MOD(INT((RC1)/2),3)*5+1,FALSE)&"|"&HLOOKUP(Sheet1!R2C1,Sheet1!R2C1:R16C1,MOD(RC1+1,2)+MOD(INT((RC1+1)/2),3)*5+1,FALSE)&"|"&HLOOKUP(Sheet1!R2C1,Sheet1!R2C1:R16C1,MOD(RC1+2,2)+MOD(INT((RC1+2)/2),3)*5+1,FALSE)&"|"&HLOOKUP(Sheet1!R2C1,Sheet1!R2C1:R16C1,MOD(RC1+3,2)+MOD(INT((RC1+3)/2),3)*5+1,FALSE) -> 160|161|100|101|130 | H497: =HLOOKUP(Sheet1!R2C1,Sheet1!R2C1:R16C1,MOD(RC1+2,2)+MOD(INT((RC1+2)/2),3)*5+1,FALSE)&"|"&HLOOKUP(Sheet1!R2C1,Sheet1!R2C1:R16C1,MOD(RC1+3,2)+MOD(INT((RC1+3)/2),3)*5+1,FALSE)&"|"&HLOOKUP(Sheet1!R2C1,Sheet1!R2C1:R16C1,MOD(RC1+4,2)+MOD(INT((RC1+4)/2),3)*5+1,FALSE)&"|"&HLOOKUP(Sheet1!R2C1,Sheet1!R2C1:R16C1,MOD(RC1+5,2)+MOD(INT((RC1+5)/2),3)*5+1,FALSE)&"|"&HLOOKUP(Sheet1!R2C1,Sheet1!R2C1:R16C1,MOD(RC1+6,2)+MOD(INT((RC1+6)/2),3)*5+1,FALSE) -> 101|130|131|160|161 | I497: =HLOOKUP(Sheet1!R2C1,Sheet1!R2C1:R16C1,MOD(RC1-1,3)+MOD(INT((RC1-1)/3),3)*5+3,FALSE)&"|"&HLOOKUP(Sheet1!R2C1,Sheet1!R2C1:R16C1,MOD(RC1,3)+MOD(INT((RC1)/3),3)*5+3,FALSE)&"|"&HLOOKUP(Sheet1!R2C1,Sheet1!R2C1:R16C1,MOD(RC1+1,3)+MOD(INT((RC1+1)/3),3)*5+3,FALSE)&"|"&HLOOKUP(Sheet1!R2C1,Sheet1!R2C1:R16C1,MOD(RC1+2,3)+MOD(INT((RC1+2)/3),3)*5+3,FALSE)&"|"&HLOOKUP(Sheet1!R2C1,Sheet1!R2C1:R16C1,MOD(RC1+3,3)+MOD(INT((RC1+3)/3),3)*5+3,FALSE) -> 133|134|162|163|164 | J497: =HLOOKUP(Sheet1!R2C1,Sheet1!R2C1:R16C1,MOD(RC1-1,3)+MOD(INT((RC1-1)/3),3)*5+3,FALSE)&"|"&HLOOKUP(Sheet1!R2C1,Sheet1!R2C1:R16C1,MOD(RC1,3)+MOD(INT((RC1)/3),3)*5+3,FALSE)&"|"&HLOOKUP(Sheet1!R2C1,Sheet1!R2C1:R16C1,MOD(RC1+1,3)+MOD(INT((RC1+1)/3),3)*5+3,FALSE)&"|"&HLOOKUP(Sheet1!R2C1,Sheet1!R2C1:R16C1,MOD(RC1+2,3)+MOD(INT((RC1+2)/3),3)*5+3,FALSE)&"|"&HLOOKUP(Sheet1!R2C1,Sheet1!R2C1:R16C1,MOD(RC1+3,3)+MOD(INT((RC1+3)/3),3)*5+3,FALSE) -> 133|134|162|163|164 | K497: =HLOOKUP(Sheet1!R2C1,Sheet1!R2C1:R16C1,MOD(RC1-1,3)+MOD(INT((RC1-1)/3),3)*5+3,FALSE)&"|"&HLOOKUP(Sheet1!R2C1,Sheet1!R2C1:R16C1,MOD(RC1,3)+MOD(INT((RC1)/3),3)*5+3,FALSE)&"|"&HLOOKUP(Sheet1!R2C1,Sheet1!R2C1:R16C1,MOD(RC1+1,3)+MOD(INT((RC1+1)/3),3)*5+3,FALSE)&"|"&HLOOKUP(Sheet1!R2C1,Sheet1!R2C1:R16C1,MOD(RC1+2,3)+MOD(INT((RC1+2)/3),3)*5+3,FALSE)&"|"&HLOOKUP(Sheet1!R2C1,Sheet1!R2C1:R16C1,MOD(RC1+3,3)+MOD(INT((RC1+3)/3),3)*5+3,FALSE) -> 133|134|162|163|164 | L497: 25|22|23|24 | M497: 14314048|14314049|14314048|14314048 | N497: 10030|10031|10032|10033 | O497: 1|1|1|1 | P497: 2500|2500|2500|2500
A498: 492 | B498: 490 | C498: 30 | D498: =R[-20]C+2 -> 68 | E498: 1000 | F498: =MOD(RC[-5]-1,3)*30+100&"|"&MOD(RC[-5]-1,3)*30+101&"|"&MOD(RC[-5]-1,3)*30+102&"|"&MOD(RC[-5]-1,3)*30+103&"|"&IF(MOD(RC[-5],4)=0,HLOOKUP(Sheet1!R2C10,Sheet1!R2C10:R7C10,MOD(RC[-5]/4-1,6)+1,FALSE),IF(MOD(RC[-5],2)=0,IF(RC[-5]>20,HLOOKUP(Sheet1!R2C7,Sheet1!R2C7:R43C7,MOD(RC[-5]/2-1,42)+1,FALSE),HLOOKUP(Sheet1!R2C4,Sheet1!R2C4:R7C4,MOD(RC[-5]-1,6)+1,FALSE)),MOD(RC[-5]-1,3)*30+104)) -> 160|161|162|163|192 | G498: =HLOOKUP(Sheet1!R2C1,Sheet1!R2C1:R16C1,MOD(RC1-1,2)+MOD(INT((RC1-1)/2),3)*5+1,FALSE)&"|"&HLOOKUP(Sheet1!R2C1,Sheet1!R2C1:R16C1,MOD(RC1,2)+MOD(INT((RC1)/2),3)*5+1,FALSE)&"|"&HLOOKUP(Sheet1!R2C1,Sheet1!R2C1:R16C1,MOD(RC1+1,2)+MOD(INT((RC1+1)/2),3)*5+1,FALSE)&"|"&HLOOKUP(Sheet1!R2C1,Sheet1!R2C1:R16C1,MOD(RC1+2,2)+MOD(INT((RC1+2)/2),3)*5+1,FALSE)&"|"&HLOOKUP(Sheet1!R2C1,Sheet1!R2C1:R16C1,MOD(RC1+3,2)+MOD(INT((RC1+3)/2),3)*5+1,FALSE) -> 161|100|101|130|131 | H498: =HLOOKUP(Sheet1!R2C1,Sheet1!R2C1:R16C1,MOD(RC1+2,2)+MOD(INT((RC1+2)/2),3)*5+1,FALSE)&"|"&HLOOKUP(Sheet1!R2C1,Sheet1!R2C1:R16C1,MOD(RC1+3,2)+MOD(INT((RC1+3)/2),3)*5+1,FALSE)&"|"&HLOOKUP(Sheet1!R2C1,Sheet1!R2C1:R16C1,MOD(RC1+4,2)+MOD(INT((RC1+4)/2),3)*5+1,FALSE)&"|"&HLOOKUP(Sheet1!R2C1,Sheet1!R2C1:R16C1,MOD(RC1+5,2)+MOD(INT((RC1+5)/2),3)*5+1,FALSE)&"|"&HLOOKUP(Sheet1!R2C1,Sheet1!R2C1:R16C1,MOD(RC1+6,2)+MOD(INT((RC1+6)/2),3)*5+1,FALSE) -> 130|131|160|161|100 | I498: =HLOOKUP(Sheet1!R2C1,Sheet1!R2C1:R16C1,MOD(RC1-1,3)+MOD(INT((RC1-1)/3),3)*5+3,FALSE)&"|"&HLOOKUP(Sheet1!R2C1,Sheet1!R2C1:R16C1,MOD(RC1,3)+MOD(INT((RC1)/3),3)*5+3,FALSE)&"|"&HLOOKUP(Sheet1!R2C1,Sheet1!R2C1:R16C1,MOD(RC1+1,3)+MOD(INT((RC1+1)/3),3)*5+3,FALSE)&"|"&HLOOKUP(Sheet1!R2C1,Sheet1!R2C1:R16C1,MOD(RC1+2,3)+MOD(INT((RC1+2)/3),3)*5+3,FALSE)&"|"&HLOOKUP(Sheet1!R2C1,Sheet1!R2C1:R16C1,MOD(RC1+3,3)+MOD(INT((RC1+3)/3),3)*5+3,FALSE) -> 134|162|163|164|102 | J498: =HLOOKUP(Sheet1!R2C1,Sheet1!R2C1:R16C1,MOD(RC1-1,3)+MOD(INT((RC1-1)/3),3)*5+3,FALSE)&"|"&HLOOKUP(Sheet1!R2C1,Sheet1!R2C1:R16C1,MOD(RC1,3)+MOD(INT((RC1)/3),3)*5+3,FALSE)&"|"&HLOOKUP(Sheet1!R2C1,Sheet1!R2C1:R16C1,MOD(RC1+1,3)+MOD(INT((RC1+1)/3),3)*5+3,FALSE)&"|"&HLOOKUP(Sheet1!R2C1,Sheet1!R2C1:R16C1,MOD(RC1+2,3)+MOD(INT((RC1+2)/3),3)*5+3,FALSE)&"|"&HLOOKUP(Sheet1!R2C1,Sheet1!R2C1:R16C1,MOD(RC1+3,3)+MOD(INT((RC1+3)/3),3)*5+3,FALSE) -> 134|162|163|164|102 | K498: =HLOOKUP(Sheet1!R2C1,Sheet1!R2C1:R16C1,MOD(RC1-1,3)+MOD(INT((RC1-1)/3),3)*5+3,FALSE)&"|"&HLOOKUP(Sheet1!R2C1,Sheet1!R2C1:R16C1,MOD(RC1,3)+MOD(INT((RC1)/3),3)*5+3,FALSE)&"|"&HLOOKUP(Sheet1!R2C1,Sheet1!R2C1:R16C1,MOD(RC1+1,3)+MOD(INT((RC1+1)/3),3)*5+3,FALSE)&"|"&HLOOKUP(Sheet1!R2C1,Sheet1!R2C1:R16C1,MOD(RC1+2,3)+MOD(INT((RC1+2)/3),3)*5+3,FALSE)&"|"&HLOOKUP(Sheet1!R2C1,Sheet1!R2C1:R16C1,MOD(RC1+3,3)+MOD(INT((RC1+3)/3),3)*5+3,FALSE) -> 134|162|163|164|102 | L498: 25|22|23|24 | M498: 14434453|14434453|14434453|14434453 | N498: 10030|10031|10032|10033 | O498: 1|1|1|1 | P498: 2500|2500|2500|2500
A499: 493 | B499: 491 | C499: 30 | D499: =R[-20]C+2 -> 68 | E499: 1000 | F499: =MOD(RC[-5]-1,3)*30+100&"|"&MOD(RC[-5]-1,3)*30+101&"|"&MOD(RC[-5]-1,3)*30+102&"|"&MOD(RC[-5]-1,3)*30+103&"|"&IF(MOD(RC[-5],4)=0,HLOOKUP(Sheet1!R2C10,Sheet1!R2C10:R7C10,MOD(RC[-5]/4-1,6)+1,FALSE),IF(MOD(RC[-5],2)=0,IF(RC[-5]>20,HLOOKUP(Sheet1!R2C7,Sheet1!R2C7:R43C7,MOD(RC[-5]/2-1,42)+1,FALSE),HLOOKUP(Sheet1!R2C4,Sheet1!R2C4:R7C4,MOD(RC[-5]-1,6)+1,FALSE)),MOD(RC[-5]-1,3)*30+104)) -> 100|101|102|103|104 | G499: =HLOOKUP(Sheet1!R2C1,Sheet1!R2C1:R16C1,MOD(RC1-1,2)+MOD(INT((RC1-1)/2),3)*5+1,FALSE)&"|"&HLOOKUP(Sheet1!R2C1,Sheet1!R2C1:R16C1,MOD(RC1,2)+MOD(INT((RC1)/2),3)*5+1,FALSE)&"|"&HLOOKUP(Sheet1!R2C1,Sheet1!R2C1:R16C1,MOD(RC1+1,2)+MOD(INT((RC1+1)/2),3)*5+1,FALSE)&"|"&HLOOKUP(Sheet1!R2C1,Sheet1!R2C1:R16C1,MOD(RC1+2,2)+MOD(INT((RC1+2)/2),3)*5+1,FALSE)&"|"&HLOOKUP(Sheet1!R2C1,Sheet1!R2C1:R16C1,MOD(RC1+3,2)+MOD(INT((RC1+3)/2),3)*5+1,FALSE) -> 100|101|130|131|160 | H499: =HLOOKUP(Sheet1!R2C1,Sheet1!R2C1:R16C1,MOD(RC1+2,2)+MOD(INT((RC1+2)/2),3)*5+1,FALSE)&"|"&HLOOKUP(Sheet1!R2C1,Sheet1!R2C1:R16C1,MOD(RC1+3,2)+MOD(INT((RC1+3)/2),3)*5+1,FALSE)&"|"&HLOOKUP(Sheet1!R2C1,Sheet1!R2C1:R16C1,MOD(RC1+4,2)+MOD(INT((RC1+4)/2),3)*5+1,FALSE)&"|"&HLOOKUP(Sheet1!R2C1,Sheet1!R2C1:R16C1,MOD(RC1+5,2)+MOD(INT((RC1+5)/2),3)*5+1,FALSE)&"|"&HLOOKUP(Sheet1!R2C1,Sheet1!R2C1:R16C1,MOD(RC1+6,2)+MOD(INT((RC1+6)/2),3)*5+1,FALSE) -> 131|160|161|100|101 | I499: =HLOOKUP(Sheet1!R2C1,Sheet1!R2C1:R16C1,MOD(RC1-1,3)+MOD(INT((RC1-1)/3),3)*5+3,FALSE)&"|"&HLOOKUP(Sheet1!R2C1,Sheet1!R2C1:R16C1,MOD(RC1,3)+MOD(INT((RC1)/3),3)*5+3,FALSE)&"|"&HLOOKUP(Sheet1!R2C1,Sheet1!R2C1:R16C1,MOD(RC1+1,3)+MOD(INT((RC1+1)/3),3)*5+3,FALSE)&"|"&HLOOKUP(Sheet1!R2C1,Sheet1!R2C1:R16C1,MOD(RC1+2,3)+MOD(INT((RC1+2)/3),3)*5+3,FALSE)&"|"&HLOOKUP(Sheet1!R2C1,Sheet1!R2C1:R16C1,MOD(RC1+3,3)+MOD(INT((RC1+3)/3),3)*5+3,FALSE) -> 162|163|164|102|103 | J499: =HLOOKUP(Sheet1!R2C1,Sheet1!R2C1:R16C1,MOD(RC1-1,3)+MOD(INT((RC1-1)/3),3)*5+3,FALSE)&"|"&HLOOKUP(Sheet1!R2C1,Sheet1!R2C1:R16C1,MOD(RC1,3)+MOD(INT((RC1)/3),3)*5+3,FALSE)&"|"&HLOOKUP(Sheet1!R2C1,Sheet1!R2C1:R16C1,MOD(RC1+1,3)+MOD(INT((RC1+1)/3),3)*5+3,FALSE)&"|"&HLOOKUP(Sheet1!R2C1,Sheet1!R2C1:R16C1,MOD(RC1+2,3)+MOD(INT((RC1+2)/3),3)*5+3,FALSE)&"|"&HLOOKUP(Sheet1!R2C1,Sheet1!R2C1:R16C1,MOD(RC1+3,3)+MOD(INT((RC1+3)/3),3)*5+3,FALSE) -> 162|163|164|102|103 | K499: =HLOOKUP(Sheet1!R2C1,Sheet1!R2C1:R16C1,MOD(RC1-1,3)+MOD(INT((RC1-1)/3),3)*5+3,FALSE)&"|"&HLOOKUP(Sheet1!R2C1,Sheet1!R2C1:R16C1,MOD(RC1,3)+MOD(INT((RC1)/3),3)*5+3,FALSE)&"|"&HLOOKUP(Sheet1!R2C1,Sheet1!R2C1:R16C1,MOD(RC1+1,3)+MOD(INT((RC1+1)/3),3)*5+3,FALSE)&"|"&HLOOKUP(Sheet1!R2C1,Sheet1!R2C1:R16C1,MOD(RC1+2,3)+MOD(INT((RC1+2)/3),3)*5+3,FALSE)&"|"&HLOOKUP(Sheet1!R2C1,Sheet1!R2C1:R16C1,MOD(RC1+3,3)+MOD(INT((RC1+3)/3),3)*5+3,FALSE) -> 162|163|164|102|103 | L499: 25|22|23|24 | M499: 14554857|14554858|14554858|14554858 | N499: 10030|10031|10032|10033 | O499: 1|1|1|1 | P499: 2500|2500|2500|2500
A500: 494 | B500: 492 | C500: 30 | D500: =R[-20]C+2 -> 68 | E500: 1000 | F500: =MOD(RC[-5]-1,3)*30+100&"|"&MOD(RC[-5]-1,3)*30+101&"|"&MOD(RC[-5]-1,3)*30+102&"|"&MOD(RC[-5]-1,3)*30+103&"|"&IF(MOD(RC[-5],4)=0,HLOOKUP(Sheet1!R2C10,Sheet1!R2C10:R7C10,MOD(RC[-5]/4-1,6)+1,FALSE),IF(MOD(RC[-5],2)=0,IF(RC[-5]>20,HLOOKUP(Sheet1!R2C7,Sheet1!R2C7:R43C7,MOD(RC[-5]/2-1,42)+1,FALSE),HLOOKUP(Sheet1!R2C4,Sheet1!R2C4:R7C4,MOD(RC[-5]-1,6)+1,FALSE)),MOD(RC[-5]-1,3)*30+104)) -> 130|131|132|133|180 | G500: =HLOOKUP(Sheet1!R2C1,Sheet1!R2C1:R16C1,MOD(RC1-1,2)+MOD(INT((RC1-1)/2),3)*5+1,FALSE)&"|"&HLOOKUP(Sheet1!R2C1,Sheet1!R2C1:R16C1,MOD(RC1,2)+MOD(INT((RC1)/2),3)*5+1,FALSE)&"|"&HLOOKUP(Sheet1!R2C1,Sheet1!R2C1:R16C1,MOD(RC1+1,2)+MOD(INT((RC1+1)/2),3)*5+1,FALSE)&"|"&HLOOKUP(Sheet1!R2C1,Sheet1!R2C1:R16C1,MOD(RC1+2,2)+MOD(INT((RC1+2)/2),3)*5+1,FALSE)&"|"&HLOOKUP(Sheet1!R2C1,Sheet1!R2C1:R16C1,MOD(RC1+3,2)+MOD(INT((RC1+3)/2),3)*5+1,FALSE) -> 101|130|131|160|161 | H500: =HLOOKUP(Sheet1!R2C1,Sheet1!R2C1:R16C1,MOD(RC1+2,2)+MOD(INT((RC1+2)/2),3)*5+1,FALSE)&"|"&HLOOKUP(Sheet1!R2C1,Sheet1!R2C1:R16C1,MOD(RC1+3,2)+MOD(INT((RC1+3)/2),3)*5+1,FALSE)&"|"&HLOOKUP(Sheet1!R2C1,Sheet1!R2C1:R16C1,MOD(RC1+4,2)+MOD(INT((RC1+4)/2),3)*5+1,FALSE)&"|"&HLOOKUP(Sheet1!R2C1,Sheet1!R2C1:R16C1,MOD(RC1+5,2)+MOD(INT((RC1+5)/2),3)*5+1,FALSE)&"|"&HLOOKUP(Sheet1!R2C1,Sheet1!R2C1:R16C1,MOD(RC1+6,2)+MOD(INT((RC1+6)/2),3)*5+1,FALSE) -> 160|161|100|101|130 | I500: =HLOOKUP(Sheet1!R2C1,Sheet1!R2C1:R16C1,MOD(RC1-1,3)+MOD(INT((RC1-1)/3),3)*5+3,FALSE)&"|"&HLOOKUP(Sheet1!R2C1,Sheet1!R2C1:R16C1,MOD(RC1,3)+MOD(INT((RC1)/3),3)*5+3,FALSE)&"|"&HLOOKUP(Sheet1!R2C1,Sheet1!R2C1:R16C1,MOD(RC1+1,3)+MOD(INT((RC1+1)/3),3)*5+3,FALSE)&"|"&HLOOKUP(Sheet1!R2C1,Sheet1!R2C1:R16C1,MOD(RC1+2,3)+MOD(INT((RC1+2)/3),3)*5+3,FALSE)&"|"&HLOOKUP(Sheet1!R2C1,Sheet1!R2C1:R16C1,MOD(RC1+3,3)+MOD(INT((RC1+3)/3),3)*5+3,FALSE) -> 163|164|102|103|104 | J500: =HLOOKUP(Sheet1!R2C1,Sheet1!R2C1:R16C1,MOD(RC1-1,3)+MOD(INT((RC1-1)/3),3)*5+3,FALSE)&"|"&HLOOKUP(Sheet1!R2C1,Sheet1!R2C1:R16C1,MOD(RC1,3)+MOD(INT((RC1)/3),3)*5+3,FALSE)&"|"&HLOOKUP(Sheet1!R2C1,Sheet1!R2C1:R16C1,MOD(RC1+1,3)+MOD(INT((RC1+1)/3),3)*5+3,FALSE)&"|"&HLOOKUP(Sheet1!R2C1,Sheet1!R2C1:R16C1,MOD(RC1+2,3)+MOD(INT((RC1+2)/3),3)*5+3,FALSE)&"|"&HLOOKUP(Sheet1!R2C1,Sheet1!R2C1:R16C1,MOD(RC1+3,3)+MOD(INT((RC1+3)/3),3)*5+3,FALSE) -> 163|164|102|103|104 | K500: =HLOOKUP(Sheet1!R2C1,Sheet1!R2C1:R16C1,MOD(RC1-1,3)+MOD(INT((RC1-1)/3),3)*5+3,FALSE)&"|"&HLOOKUP(Sheet1!R2C1,Sheet1!R2C1:R16C1,MOD(RC1,3)+MOD(INT((RC1)/3),3)*5+3,FALSE)&"|"&HLOOKUP(Sheet1!R2C1,Sheet1!R2C1:R16C1,MOD(RC1+1,3)+MOD(INT((RC1+1)/3),3)*5+3,FALSE)&"|"&HLOOKUP(Sheet1!R2C1,Sheet1!R2C1:R16C1,MOD(RC1+2,3)+MOD(INT((RC1+2)/3),3)*5+3,FALSE)&"|"&HLOOKUP(Sheet1!R2C1,Sheet1!R2C1:R16C1,MOD(RC1+3,3)+MOD(INT((RC1+3)/3),3)*5+3,FALSE) -> 163|164|102|103|104 | L500: 25|22|23|24 | M500: 14675262|14675263|14675263|14675263 | N500: 10030|10031|10032|10033 | O500: 1|1|1|1 | P500: 2500|2500|2500|2500
A501: 495 | B501: 493 | C501: 30 | D501: =R[-20]C+2 -> 68 | E501: 1000 | F501: =MOD(RC[-5]-1,3)*30+100&"|"&MOD(RC[-5]-1,3)*30+101&"|"&MOD(RC[-5]-1,3)*30+102&"|"&MOD(RC[-5]-1,3)*30+103&"|"&IF(MOD(RC[-5],4)=0,HLOOKUP(Sheet1!R2C10,Sheet1!R2C10:R7C10,MOD(RC[-5]/4-1,6)+1,FALSE),IF(MOD(RC[-5],2)=0,IF(RC[-5]>20,HLOOKUP(Sheet1!R2C7,Sheet1!R2C7:R43C7,MOD(RC[-5]/2-1,42)+1,FALSE),HLOOKUP(Sheet1!R2C4,Sheet1!R2C4:R7C4,MOD(RC[-5]-1,6)+1,FALSE)),MOD(RC[-5]-1,3)*30+104)) -> 160|161|162|163|164 | G501: =HLOOKUP(Sheet1!R2C1,Sheet1!R2C1:R16C1,MOD(RC1-1,2)+MOD(INT((RC1-1)/2),3)*5+1,FALSE)&"|"&HLOOKUP(Sheet1!R2C1,Sheet1!R2C1:R16C1,MOD(RC1,2)+MOD(INT((RC1)/2),3)*5+1,FALSE)&"|"&HLOOKUP(Sheet1!R2C1,Sheet1!R2C1:R16C1,MOD(RC1+1,2)+MOD(INT((RC1+1)/2),3)*5+1,FALSE)&"|"&HLOOKUP(Sheet1!R2C1,Sheet1!R2C1:R16C1,MOD(RC1+2,2)+MOD(INT((RC1+2)/2),3)*5+1,FALSE)&"|"&HLOOKUP(Sheet1!R2C1,Sheet1!R2C1:R16C1,MOD(RC1+3,2)+MOD(INT((RC1+3)/2),3)*5+1,FALSE) -> 130|131|160|161|100 | H501: =HLOOKUP(Sheet1!R2C1,Sheet1!R2C1:R16C1,MOD(RC1+2,2)+MOD(INT((RC1+2)/2),3)*5+1,FALSE)&"|"&HLOOKUP(Sheet1!R2C1,Sheet1!R2C1:R16C1,MOD(RC1+3,2)+MOD(INT((RC1+3)/2),3)*5+1,FALSE)&"|"&HLOOKUP(Sheet1!R2C1,Sheet1!R2C1:R16C1,MOD(RC1+4,2)+MOD(INT((RC1+4)/2),3)*5+1,FALSE)&"|"&HLOOKUP(Sheet1!R2C1,Sheet1!R2C1:R16C1,MOD(RC1+5,2)+MOD(INT((RC1+5)/2),3)*5+1,FALSE)&"|"&HLOOKUP(Sheet1!R2C1,Sheet1!R2C1:R16C1,MOD(RC1+6,2)+MOD(INT((RC1+6)/2),3)*5+1,FALSE) -> 161|100|101|130|131 | I501: =HLOOKUP(Sheet1!R2C1,Sheet1!R2C1:R16C1,MOD(RC1-1,3)+MOD(INT((RC1-1)/3),3)*5+3,FALSE)&"|"&HLOOKUP(Sheet1!R2C1,Sheet1!R2C1:R16C1,MOD(RC1,3)+MOD(INT((RC1)/3),3)*5+3,FALSE)&"|"&HLOOKUP(Sheet1!R2C1,Sheet1!R2C1:R16C1,MOD(RC1+1,3)+MOD(INT((RC1+1)/3),3)*5+3,FALSE)&"|"&HLOOKUP(Sheet1!R2C1,Sheet1!R2C1:R16C1,MOD(RC1+2,3)+MOD(INT((RC1+2)/3),3)*5+3,FALSE)&"|"&HLOOKUP(Sheet1!R2C1,Sheet1!R2C1:R16C1,MOD(RC1+3,3)+MOD(INT((RC1+3)/3),3)*5+3,FALSE) -> 164|102|103|104|132 | J501: =HLOOKUP(Sheet1!R2C1,Sheet1!R2C1:R16C1,MOD(RC1-1,3)+MOD(INT((RC1-1)/3),3)*5+3,FALSE)&"|"&HLOOKUP(Sheet1!R2C1,Sheet1!R2C1:R16C1,MOD(RC1,3)+MOD(INT((RC1)/3),3)*5+3,FALSE)&"|"&HLOOKUP(Sheet1!R2C1,Sheet1!R2C1:R16C1,MOD(RC1+1,3)+MOD(INT((RC1+1)/3),3)*5+3,FALSE)&"|"&HLOOKUP(Sheet1!R2C1,Sheet1!R2C1:R16C1,MOD(RC1+2,3)+MOD(INT((RC1+2)/3),3)*5+3,FALSE)&"|"&HLOOKUP(Sheet1!R2C1,Sheet1!R2C1:R16C1,MOD(RC1+3,3)+MOD(INT((RC1+3)/3),3)*5+3,FALSE) -> 164|102|103|104|132 | K501: =HLOOKUP(Sheet1!R2C1,Sheet1!R2C1:R16C1,MOD(RC1-1,3)+MOD(INT((RC1-1)/3),3)*5+3,FALSE)&"|"&HLOOKUP(Sheet1!R2C1,Sheet1!R2C1:R16C1,MOD(RC1,3)+MOD(INT((RC1)/3),3)*5+3,FALSE)&"|"&HLOOKUP(Sheet1!R2C1,Sheet1!R2C1:R16C1,MOD(RC1+1,3)+MOD(INT((RC1+1)/3),3)*5+3,FALSE)&"|"&HLOOKUP(Sheet1!R2C1,Sheet1!R2C1:R16C1,MOD(RC1+2,3)+MOD(INT((RC1+2)/3),3)*5+3,FALSE)&"|"&HLOOKUP(Sheet1!R2C1,Sheet1!R2C1:R16C1,MOD(RC1+3,3)+MOD(INT((RC1+3)/3),3)*5+3,FALSE) -> 164|102|103|104|132 | L501: 25|22|23|24 | M501: 14797786|14797786|14797785|14797785 | N501: 10030|10031|10032|10033|10030|10031|10032|10033|10030|10031|10032|10033|10030|10031|10032|10033|10030|10031|10032|10033|10030|10031|10032|10033|10030|10031|10032|10033|10030|10031|10032|10033|10030|10031|10032|10033|10030|10031|10032|10033 | O501: 1|1|1|1|1|1|1|1|1|1|1|1|1|1|1|1|1|1|1|1|1|1|1|1|1|1|1|1|1|1|1|1|1|1|1|1|1|1|1|1 | P501: 2500|2500|2500|2500|2500|2500|2500|2500|2500|2500|2500|2500|2500|2500|2500|2500|2500|2500|2500|2500|2500|2500|2500|2500|2500|2500|2500|2500|2500|2500|2500|2500|2500|2500|2500|2500|2500|2500|2500|2500
A502: 496 | B502: 494 | C502: 30 | D502: =R[-20]C+2 -> 68 | E502: 1000 | F502: =MOD(RC[-5]-1,3)*30+100&"|"&MOD(RC[-5]-1,3)*30+101&"|"&MOD(RC[-5]-1,3)*30+102&"|"&MOD(RC[-5]-1,3)*30+103&"|"&IF(MOD(RC[-5],4)=0,HLOOKUP(Sheet1!R2C10,Sheet1!R2C10:R7C10,MOD(RC[-5]/4-1,6)+1,FALSE),IF(MOD(RC[-5],2)=0,IF(RC[-5]>20,HLOOKUP(Sheet1!R2C7,Sheet1!R2C7:R43C7,MOD(RC[-5]/2-1,42)+1,FALSE),HLOOKUP(Sheet1!R2C4,Sheet1!R2C4:R7C4,MOD(RC[-5]-1,6)+1,FALSE)),MOD(RC[-5]-1,3)*30+104)) -> 100|101|102|103|193 | G502: =HLOOKUP(Sheet1!R2C1,Sheet1!R2C1:R16C1,MOD(RC1-1,2)+MOD(INT((RC1-1)/2),3)*5+1,FALSE)&"|"&HLOOKUP(Sheet1!R2C1,Sheet1!R2C1:R16C1,MOD(RC1,2)+MOD(INT((RC1)/2),3)*5+1,FALSE)&"|"&HLOOKUP(Sheet1!R2C1,Sheet1!R2C1:R16C1,MOD(RC1+1,2)+MOD(INT((RC1+1)/2),3)*5+1,FALSE)&"|"&HLOOKUP(Sheet1!R2C1,Sheet1!R2C1:R16C1,MOD(RC1+2,2)+MOD(INT((RC1+2)/2),3)*5+1,FALSE)&"|"&HLOOKUP(Sheet1!R2C1,Sheet1!R2C1:R16C1,MOD(RC1+3,2)+MOD(INT((RC1+3)/2),3)*5+1,FALSE) -> 131|160|161|100|101 | H502: =HLOOKUP(Sheet1!R2C1,Sheet1!R2C1:R16C1,MOD(RC1+2,2)+MOD(INT((RC1+2)/2),3)*5+1,FALSE)&"|"&HLOOKUP(Sheet1!R2C1,Sheet1!R2C1:R16C1,MOD(RC1+3,2)+MOD(INT((RC1+3)/2),3)*5+1,FALSE)&"|"&HLOOKUP(Sheet1!R2C1,Sheet1!R2C1:R16C1,MOD(RC1+4,2)+MOD(INT((RC1+4)/2),3)*5+1,FALSE)&"|"&HLOOKUP(Sheet1!R2C1,Sheet1!R2C1:R16C1,MOD(RC1+5,2)+MOD(INT((RC1+5)/2),3)*5+1,FALSE)&"|"&HLOOKUP(Sheet1!R2C1,Sheet1!R2C1:R16C1,MOD(RC1+6,2)+MOD(INT((RC1+6)/2),3)*5+1,FALSE) -> 100|101|130|131|160 | I502: =HLOOKUP(Sheet1!R2C1,Sheet1!R2C1:R16C1,MOD(RC1-1,3)+MOD(INT((RC1-1)/3),3)*5+3,FALSE)&"|"&HLOOKUP(Sheet1!R2C1,Sheet1!R2C1:R16C1,MOD(RC1,3)+MOD(INT((RC1)/3),3)*5+3,FALSE)&"|"&HLOOKUP(Sheet1!R2C1,Sheet1!R2C1:R16C1,MOD(RC1+1,3)+MOD(INT((RC1+1)/3),3)*5+3,FALSE)&"|"&HLOOKUP(Sheet1!R2C1,Sheet1!R2C1:R16C1,MOD(RC1+2,3)+MOD(INT((RC1+2)/3),3)*5+3,FALSE)&"|"&HLOOKUP(Sheet1!R2C1,Sheet1!R2C1:R16C1,MOD(RC1+3,3)+MOD(INT((RC1+3)/3),3)*5+3,FALSE) -> 102|103|104|132|133 | J502: =HLOOKUP(Sheet1!R2C1,Sheet1!R2C1:R16C1,MOD(RC1-1,3)+MOD(INT((RC1-1)/3),3)*5+3,FALSE)&"|"&HLOOKUP(Sheet1!R2C1,Sheet1!R2C1:R16C1,MOD(RC1,3)+MOD(INT((RC1)/3),3)*5+3,FALSE)&"|"&HLOOKUP(Sheet1!R2C1,Sheet1!R2C1:R16C1,MOD(RC1+1,3)+MOD(INT((RC1+1)/3),3)*5+3,FALSE)&"|"&HLOOKUP(Sheet1!R2C1,Sheet1!R2C1:R16C1,MOD(RC1+2,3)+MOD(INT((RC1+2)/3),3)*5+3,FALSE)&"|"&HLOOKUP(Sheet1!R2C1,Sheet1!R2C1:R16C1,MOD(RC1+3,3)+MOD(INT((RC1+3)/3),3)*5+3,FALSE) -> 102|103|104|132|133 | K502: =HLOOKUP(Sheet1!R2C1,Sheet1!R2C1:R16C1,MOD(RC1-1,3)+MOD(INT((RC1-1)/3),3)*5+3,FALSE)&"|"&HLOOKUP(Sheet1!R2C1,Sheet1!R2C1:R16C1,MOD(RC1,3)+MOD(INT((RC1)/3),3)*5+3,FALSE)&"|"&HLOOKUP(Sheet1!R2C1,Sheet1!R2C1:R16C1,MOD(RC1+1,3)+MOD(INT((RC1+1)/3),3)*5+3,FALSE)&"|"&HLOOKUP(Sheet1!R2C1,Sheet1!R2C1:R16C1,MOD(RC1+2,3)+MOD(INT((RC1+2)/3),3)*5+3,FALSE)&"|"&HLOOKUP(Sheet1!R2C1,Sheet1!R2C1:R16C1,MOD(RC1+3,3)+MOD(INT((RC1+3)/3),3)*5+3,FALSE) -> 102|103|104|132|133 | L502: 25|22|23|24 | M502: 14928049|14928049|14928050|14928050 | N502: 10030|10031|10032|10033 | O502: 1|1|1|1 | P502: 2500|2500|2500|2500
A503: 497 | B503: 495 | C503: 30 | D503: =R[-20]C+2 -> 68 | E503: 1000 | F503: =MOD(RC[-5]-1,3)*30+100&"|"&MOD(RC[-5]-1,3)*30+101&"|"&MOD(RC[-5]-1,3)*30+102&"|"&MOD(RC[-5]-1,3)*30+103&"|"&IF(MOD(RC[-5],4)=0,HLOOKUP(Sheet1!R2C10,Sheet1!R2C10:R7C10,MOD(RC[-5]/4-1,6)+1,FALSE),IF(MOD(RC[-5],2)=0,IF(RC[-5]>20,HLOOKUP(Sheet1!R2C7,Sheet1!R2C7:R43C7,MOD(RC[-5]/2-1,42)+1,FALSE),HLOOKUP(Sheet1!R2C4,Sheet1!R2C4:R7C4,MOD(RC[-5]-1,6)+1,FALSE)),MOD(RC[-5]-1,3)*30+104)) -> 130|131|132|133|134 | G503: =HLOOKUP(Sheet1!R2C1,Sheet1!R2C1:R16C1,MOD(RC1-1,2)+MOD(INT((RC1-1)/2),3)*5+1,FALSE)&"|"&HLOOKUP(Sheet1!R2C1,Sheet1!R2C1:R16C1,MOD(RC1,2)+MOD(INT((RC1)/2),3)*5+1,FALSE)&"|"&HLOOKUP(Sheet1!R2C1,Sheet1!R2C1:R16C1,MOD(RC1+1,2)+MOD(INT((RC1+1)/2),3)*5+1,FALSE)&"|"&HLOOKUP(Sheet1!R2C1,Sheet1!R2C1:R16C1,MOD(RC1+2,2)+MOD(INT((RC1+2)/2),3)*5+1,FALSE)&"|"&HLOOKUP(Sheet1!R2C1,Sheet1!R2C1:R16C1,MOD(RC1+3,2)+MOD(INT((RC1+3)/2),3)*5+1,FALSE) -> 160|161|100|101|130 | H503: =HLOOKUP(Sheet1!R2C1,Sheet1!R2C1:R16C1,MOD(RC1+2,2)+MOD(INT((RC1+2)/2),3)*5+1,FALSE)&"|"&HLOOKUP(Sheet1!R2C1,Sheet1!R2C1:R16C1,MOD(RC1+3,2)+MOD(INT((RC1+3)/2),3)*5+1,FALSE)&"|"&HLOOKUP(Sheet1!R2C1,Sheet1!R2C1:R16C1,MOD(RC1+4,2)+MOD(INT((RC1+4)/2),3)*5+1,FALSE)&"|"&HLOOKUP(Sheet1!R2C1,Sheet1!R2C1:R16C1,MOD(RC1+5,2)+MOD(INT((RC1+5)/2),3)*5+1,FALSE)&"|"&HLOOKUP(Sheet1!R2C1,Sheet1!R2C1:R16C1,MOD(RC1+6,2)+MOD(INT((RC1+6)/2),3)*5+1,FALSE) -> 101|130|131|160|161 | I503: =HLOOKUP(Sheet1!R2C1,Sheet1!R2C1:R16C1,MOD(RC1-1,3)+MOD(INT((RC1-1)/3),3)*5+3,FALSE)&"|"&HLOOKUP(Sheet1!R2C1,Sheet1!R2C1:R16C1,MOD(RC1,3)+MOD(INT((RC1)/3),3)*5+3,FALSE)&"|"&HLOOKUP(Sheet1!R2C1,Sheet1!R2C1:R16C1,MOD(RC1+1,3)+MOD(INT((RC1+1)/3),3)*5+3,FALSE)&"|"&HLOOKUP(Sheet1!R2C1,Sheet1!R2C1:R16C1,MOD(RC1+2,3)+MOD(INT((RC1+2)/3),3)*5+3,FALSE)&"|"&HLOOKUP(Sheet1!R2C1,Sheet1!R2C1:R16C1,MOD(RC1+3,3)+MOD(INT((RC1+3)/3),3)*5+3,FALSE) -> 103|104|132|133|134 | J503: =HLOOKUP(Sheet1!R2C1,Sheet1!R2C1:R16C1,MOD(RC1-1,3)+MOD(INT((RC1-1)/3),3)*5+3,FALSE)&"|"&HLOOKUP(Sheet1!R2C1,Sheet1!R2C1:R16C1,MOD(RC1,3)+MOD(INT((RC1)/3),3)*5+3,FALSE)&"|"&HLOOKUP(Sheet1!R2C1,Sheet1!R2C1:R16C1,MOD(RC1+1,3)+MOD(INT((RC1+1)/3),3)*5+3,FALSE)&"|"&HLOOKUP(Sheet1!R2C1,Sheet1!R2C1:R16C1,MOD(RC1+2,3)+MOD(INT((RC1+2)/3),3)*5+3,FALSE)&"|"&HLOOKUP(Sheet1!R2C1,Sheet1!R2C1:R16C1,MOD(RC1+3,3)+MOD(INT((RC1+3)/3),3)*5+3,FALSE) -> 103|104|132|133|134 | K503: =HLOOKUP(Sheet1!R2C1,Sheet1!R2C1:R16C1,MOD(RC1-1,3)+MOD(INT((RC1-1)/3),3)*5+3,FALSE)&"|"&HLOOKUP(Sheet1!R2C1,Sheet1!R2C1:R16C1,MOD(RC1,3)+MOD(INT((RC1)/3),3)*5+3,FALSE)&"|"&HLOOKUP(Sheet1!R2C1,Sheet1!R2C1:R16C1,MOD(RC1+1,3)+MOD(INT((RC1+1)/3),3)*5+3,FALSE)&"|"&HLOOKUP(Sheet1!R2C1,Sheet1!R2C1:R16C1,MOD(RC1+2,3)+MOD(INT((RC1+2)/3),3)*5+3,FALSE)&"|"&HLOOKUP(Sheet1!R2C1,Sheet1!R2C1:R16C1,MOD(RC1+3,3)+MOD(INT((RC1+3)/3),3)*5+3,FALSE) -> 103|104|132|133|134 | L503: 25|22|23|24 | M503: 15052885|15052885|15052885|15052885 | N503: 10030|10031|10032|10033 | O503: 1|1|1|1 | P503: 2500|2500|2500|2500
A504: 498 | B504: 496 | C504: 30 | D504: =R[-20]C+2 -> 68 | E504: 1000 | F504: =MOD(RC[-5]-1,3)*30+100&"|"&MOD(RC[-5]-1,3)*30+101&"|"&MOD(RC[-5]-1,3)*30+102&"|"&MOD(RC[-5]-1,3)*30+103&"|"&IF(MOD(RC[-5],4)=0,HLOOKUP(Sheet1!R2C10,Sheet1!R2C10:R7C10,MOD(RC[-5]/4-1,6)+1,FALSE),IF(MOD(RC[-5],2)=0,IF(RC[-5]>20,HLOOKUP(Sheet1!R2C7,Sheet1!R2C7:R43C7,MOD(RC[-5]/2-1,42)+1,FALSE),HLOOKUP(Sheet1!R2C4,Sheet1!R2C4:R7C4,MOD(RC[-5]-1,6)+1,FALSE)),MOD(RC[-5]-1,3)*30+104)) -> 160|161|162|163|182 | G504: =HLOOKUP(Sheet1!R2C1,Sheet1!R2C1:R16C1,MOD(RC1-1,2)+MOD(INT((RC1-1)/2),3)*5+1,FALSE)&"|"&HLOOKUP(Sheet1!R2C1,Sheet1!R2C1:R16C1,MOD(RC1,2)+MOD(INT((RC1)/2),3)*5+1,FALSE)&"|"&HLOOKUP(Sheet1!R2C1,Sheet1!R2C1:R16C1,MOD(RC1+1,2)+MOD(INT((RC1+1)/2),3)*5+1,FALSE)&"|"&HLOOKUP(Sheet1!R2C1,Sheet1!R2C1:R16C1,MOD(RC1+2,2)+MOD(INT((RC1+2)/2),3)*5+1,FALSE)&"|"&HLOOKUP(Sheet1!R2C1,Sheet1!R2C1:R16C1,MOD(RC1+3,2)+MOD(INT((RC1+3)/2),3)*5+1,FALSE) -> 161|100|101|130|131 | H504: =HLOOKUP(Sheet1!R2C1,Sheet1!R2C1:R16C1,MOD(RC1+2,2)+MOD(INT((RC1+2)/2),3)*5+1,FALSE)&"|"&HLOOKUP(Sheet1!R2C1,Sheet1!R2C1:R16C1,MOD(RC1+3,2)+MOD(INT((RC1+3)/2),3)*5+1,FALSE)&"|"&HLOOKUP(Sheet1!R2C1,Sheet1!R2C1:R16C1,MOD(RC1+4,2)+MOD(INT((RC1+4)/2),3)*5+1,FALSE)&"|"&HLOOKUP(Sheet1!R2C1,Sheet1!R2C1:R16C1,MOD(RC1+5,2)+MOD(INT((RC1+5)/2),3)*5+1,FALSE)&"|"&HLOOKUP(Sheet1!R2C1,Sheet1!R2C1:R16C1,MOD(RC1+6,2)+MOD(INT((RC1+6)/2),3)*5+1,FALSE) -> 130|131|160|161|100 | I504: =HLOOKUP(Sheet1!R2C1,Sheet1!R2C1:R16C1,MOD(RC1-1,3)+MOD(INT((RC1-1)/3),3)*5+3,FALSE)&"|"&HLOOKUP(Sheet1!R2C1,Sheet1!R2C1:R16C1,MOD(RC1,3)+MOD(INT((RC1)/3),3)*5+3,FALSE)&"|"&HLOOKUP(Sheet1!R2C1,Sheet1!R2C1:R16C1,MOD(RC1+1,3)+MOD(INT((RC1+1)/3),3)*5+3,FALSE)&"|"&HLOOKUP(Sheet1!R2C1,Sheet1!R2C1:R16C1,MOD(RC1+2,3)+MOD(INT((RC1+2)/3),3)*5+3,FALSE)&"|"&HLOOKUP(Sheet1!R2C1,Sheet1!R2C1:R16C1,MOD(RC1+3,3)+MOD(INT((RC1+3)/3),3)*5+3,FALSE) -> 104|132|133|134|162 | J504: =HLOOKUP(Sheet1!R2C1,Sheet1!R2C1:R16C1,MOD(RC1-1,3)+MOD(INT((RC1-1)/3),3)*5+3,FALSE)&"|"&HLOOKUP(Sheet1!R2C1,Sheet1!R2C1:R16C1,MOD(RC1,3)+MOD(INT((RC1)/3),3)*5+3,FALSE)&"|"&HLOOKUP(Sheet1!R2C1,Sheet1!R2C1:R16C1,MOD(RC1+1,3)+MOD(INT((RC1+1)/3),3)*5+3,FALSE)&"|"&HLOOKUP(Sheet1!R2C1,Sheet1!R2C1:R16C1,MOD(RC1+2,3)+MOD(INT((RC1+2)/3),3)*5+3,FALSE)&"|"&HLOOKUP(Sheet1!R2C1,Sheet1!R2C1:R16C1,MOD(RC1+3,3)+MOD(INT((RC1+3)/3),3)*5+3,FALSE) -> 104|132|133|134|162 | K504: =HLOOKUP(Sheet1!R2C1,Sheet1!R2C1:R16C1,MOD(RC1-1,3)+MOD(INT((RC1-1)/3),3)*5+3,FALSE)&"|"&HLOOKUP(Sheet1!R2C1,Sheet1!R2C1:R16C1,MOD(RC1,3)+MOD(INT((RC1)/3),3)*5+3,FALSE)&"|"&HLOOKUP(Sheet1!R2C1,Sheet1!R2C1:R16C1,MOD(RC1+1,3)+MOD(INT((RC1+1)/3),3)*5+3,FALSE)&"|"&HLOOKUP(Sheet1!R2C1,Sheet1!R2C1:R16C1,MOD(RC1+2,3)+MOD(INT((RC1+2)/3),3)*5+3,FALSE)&"|"&HLOOKUP(Sheet1!R2C1,Sheet1!R2C1:R16C1,MOD(RC1+3,3)+MOD(INT((RC1+3)/3),3)*5+3,FALSE) -> 104|132|133|134|162 | L504: 25|22|23|24 | M504: 15177720|15177720|15177720|15177720 | N504: 10030|10031|10032|10033 | O504: 1|1|1|1 | P504: 2500|2500|2500|2500
A505: 499 | B505: 497 | C505: 30 | D505: =R[-20]C+2 -> 68 | E505: 1000 | F505: =MOD(RC[-5]-1,3)*30+100&"|"&MOD(RC[-5]-1,3)*30+101&"|"&MOD(RC[-5]-1,3)*30+102&"|"&MOD(RC[-5]-1,3)*30+103&"|"&IF(MOD(RC[-5],4)=0,HLOOKUP(Sheet1!R2C10,Sheet1!R2C10:R7C10,MOD(RC[-5]/4-1,6)+1,FALSE),IF(MOD(RC[-5],2)=0,IF(RC[-5]>20,HLOOKUP(Sheet1!R2C7,Sheet1!R2C7:R43C7,MOD(RC[-5]/2-1,42)+1,FALSE),HLOOKUP(Sheet1!R2C4,Sheet1!R2C4:R7C4,MOD(RC[-5]-1,6)+1,FALSE)),MOD(RC[-5]-1,3)*30+104)) -> 100|101|102|103|104 | G505: =HLOOKUP(Sheet1!R2C1,Sheet1!R2C1:R16C1,MOD(RC1-1,2)+MOD(INT((RC1-1)/2),3)*5+1,FALSE)&"|"&HLOOKUP(Sheet1!R2C1,Sheet1!R2C1:R16C1,MOD(RC1,2)+MOD(INT((RC1)/2),3)*5+1,FALSE)&"|"&HLOOKUP(Sheet1!R2C1,Sheet1!R2C1:R16C1,MOD(RC1+1,2)+MOD(INT((RC1+1)/2),3)*5+1,FALSE)&"|"&HLOOKUP(Sheet1!R2C1,Sheet1!R2C1:R16C1,MOD(RC1+2,2)+MOD(INT((RC1+2)/2),3)*5+1,FALSE)&"|"&HLOOKUP(Sheet1!R2C1,Sheet1!R2C1:R16C1,MOD(RC1+3,2)+MOD(INT((RC1+3)/2),3)*5+1,FALSE) -> 100|101|130|131|160 | H505: =HLOOKUP(Sheet1!R2C1,Sheet1!R2C1:R16C1,MOD(RC1+2,2)+MOD(INT((RC1+2)/2),3)*5+1,FALSE)&"|"&HLOOKUP(Sheet1!R2C1,Sheet1!R2C1:R16C1,MOD(RC1+3,2)+MOD(INT((RC1+3)/2),3)*5+1,FALSE)&"|"&HLOOKUP(Sheet1!R2C1,Sheet1!R2C1:R16C1,MOD(RC1+4,2)+MOD(INT((RC1+4)/2),3)*5+1,FALSE)&"|"&HLOOKUP(Sheet1!R2C1,Sheet1!R2C1:R16C1,MOD(RC1+5,2)+MOD(INT((RC1+5)/2),3)*5+1,FALSE)&"|"&HLOOKUP(Sheet1!R2C1,Sheet1!R2C1:R16C1,MOD(RC1+6,2)+MOD(INT((RC1+6)/2),3)*5+1,FALSE) -> 131|160|161|100|101 | I505: =HLOOKUP(Sheet1!R2C1,Sheet1!R2C1:R16C1,MOD(RC1-1,3)+MOD(INT((RC1-1)/3),3)*5+3,FALSE)&"|"&HLOOKUP(Sheet1!R2C1,Sheet1!R2C1:R16C1,MOD(RC1,3)+MOD(INT((RC1)/3),3)*5+3,FALSE)&"|"&HLOOKUP(Sheet1!R2C1,Sheet1!R2C1:R16C1,MOD(RC1+1,3)+MOD(INT((RC1+1)/3),3)*5+3,FALSE)&"|"&HLOOKUP(Sheet1!R2C1,Sheet1!R2C1:R16C1,MOD(RC1+2,3)+MOD(INT((RC1+2)/3),3)*5+3,FALSE)&"|"&HLOOKUP(Sheet1!R2C1,Sheet1!R2C1:R16C1,MOD(RC1+3,3)+MOD(INT((RC1+3)/3),3)*5+3,FALSE) -> 132|133|134|162|163 | J505: =HLOOKUP(Sheet1!R2C1,Sheet1!R2C1:R16C1,MOD(RC1-1,3)+MOD(INT((RC1-1)/3),3)*5+3,FALSE)&"|"&HLOOKUP(Sheet1!R2C1,Sheet1!R2C1:R16C1,MOD(RC1,3)+MOD(INT((RC1)/3),3)*5+3,FALSE)&"|"&HLOOKUP(Sheet1!R2C1,Sheet1!R2C1:R16C1,MOD(RC1+1,3)+MOD(INT((RC1+1)/3),3)*5+3,FALSE)&"|"&HLOOKUP(Sheet1!R2C1,Sheet1!R2C1:R16C1,MOD(RC1+2,3)+MOD(INT((RC1+2)/3),3)*5+3,FALSE)&"|"&HLOOKUP(Sheet1!R2C1,Sheet1!R2C1:R16C1,MOD(RC1+3,3)+MOD(INT((RC1+3)/3),3)*5+3,FALSE) -> 132|133|134|162|163 | K505: =HLOOKUP(Sheet1!R2C1,Sheet1!R2C1:R16C1,MOD(RC1-1,3)+MOD(INT((RC1-1)/3),3)*5+3,FALSE)&"|"&HLOOKUP(Sheet1!R2C1,Sheet1!R2C1:R16C1,MOD(RC1,3)+MOD(INT((RC1)/3),3)*5+3,FALSE)&"|"&HLOOKUP(Sheet1!R2C1,Sheet1!R2C1:R16C1,MOD(RC1+1,3)+MOD(INT((RC1+1)/3),3)*5+3,FALSE)&"|"&HLOOKUP(Sheet1!R2C1,Sheet1!R2C1:R16C1,MOD(RC1+2,3)+MOD(INT((RC1+2)/3),3)*5+3,FALSE)&"|"&HLOOKUP(Sheet1!R2C1,Sheet1!R2C1:R16C1,MOD(RC1+3,3)+MOD(INT((RC1+3)/3),3)*5+3,FALSE) -> 132|133|134|162|163 | L505: 25|22|23|24 | M505: 15303355|15303355|15303355|15303355 | N505: 10030|10031|10032|10033 | O505: 1|1|1|1 | P505: 2500|2500|2500|2500
A506: 500 | B506: 498 | C506: 30 | D506: =R[-20]C+2 -> 68 | E506: 1000 | F506: =MOD(RC[-5]-1,3)*30+100&"|"&MOD(RC[-5]-1,3)*30+101&"|"&MOD(RC[-5]-1,3)*30+102&"|"&MOD(RC[-5]-1,3)*30+103&"|"&IF(MOD(RC[-5],4)=0,HLOOKUP(Sheet1!R2C10,Sheet1!R2C10:R7C10,MOD(RC[-5]/4-1,6)+1,FALSE),IF(MOD(RC[-5],2)=0,IF(RC[-5]>20,HLOOKUP(Sheet1!R2C7,Sheet1!R2C7:R43C7,MOD(RC[-5]/2-1,42)+1,FALSE),HLOOKUP(Sheet1!R2C4,Sheet1!R2C4:R7C4,MOD(RC[-5]-1,6)+1,FALSE)),MOD(RC[-5]-1,3)*30+104)) -> 130|131|132|133|194 | G506: =HLOOKUP(Sheet1!R2C1,Sheet1!R2C1:R16C1,MOD(RC1-1,2)+MOD(INT((RC1-1)/2),3)*5+1,FALSE)&"|"&HLOOKUP(Sheet1!R2C1,Sheet1!R2C1:R16C1,MOD(RC1,2)+MOD(INT((RC1)/2),3)*5+1,FALSE)&"|"&HLOOKUP(Sheet1!R2C1,Sheet1!R2C1:R16C1,MOD(RC1+1,2)+MOD(INT((RC1+1)/2),3)*5+1,FALSE)&"|"&HLOOKUP(Sheet1!R2C1,Sheet1!R2C1:R16C1,MOD(RC1+2,2)+MOD(INT((RC1+2)/2),3)*5+1,FALSE)&"|"&HLOOKUP(Sheet1!R2C1,Sheet1!R2C1:R16C1,MOD(RC1+3,2)+MOD(INT((RC1+3)/2),3)*5+1,FALSE) -> 101|130|131|160|161 | H506: =HLOOKUP(Sheet1!R2C1,Sheet1!R2C1:R16C1,MOD(RC1+2,2)+MOD(INT((RC1+2)/2),3)*5+1,FALSE)&"|"&HLOOKUP(Sheet1!R2C1,Sheet1!R2C1:R16C1,MOD(RC1+3,2)+MOD(INT((RC1+3)/2),3)*5+1,FALSE)&"|"&HLOOKUP(Sheet1!R2C1,Sheet1!R2C1:R16C1,MOD(RC1+4,2)+MOD(INT((RC1+4)/2),3)*5+1,FALSE)&"|"&HLOOKUP(Sheet1!R2C1,Sheet1!R2C1:R16C1,MOD(RC1+5,2)+MOD(INT((RC1+5)/2),3)*5+1,FALSE)&"|"&HLOOKUP(Sheet1!R2C1,Sheet1!R2C1:R16C1,MOD(RC1+6,2)+MOD(INT((RC1+6)/2),3)*5+1,FALSE) -> 160|161|100|101|130 | I506: =HLOOKUP(Sheet1!R2C1,Sheet1!R2C1:R16C1,MOD(RC1-1,3)+MOD(INT((RC1-1)/3),3)*5+3,FALSE)&"|"&HLOOKUP(Sheet1!R2C1,Sheet1!R2C1:R16C1,MOD(RC1,3)+MOD(INT((RC1)/3),3)*5+3,FALSE)&"|"&HLOOKUP(Sheet1!R2C1,Sheet1!R2C1:R16C1,MOD(RC1+1,3)+MOD(INT((RC1+1)/3),3)*5+3,FALSE)&"|"&HLOOKUP(Sheet1!R2C1,Sheet1!R2C1:R16C1,MOD(RC1+2,3)+MOD(INT((RC1+2)/3),3)*5+3,FALSE)&"|"&HLOOKUP(Sheet1!R2C1,Sheet1!R2C1:R16C1,MOD(RC1+3,3)+MOD(INT((RC1+3)/3),3)*5+3,FALSE) -> 133|134|162|163|164 | J506: =HLOOKUP(Sheet1!R2C1,Sheet1!R2C1:R16C1,MOD(RC1-1,3)+MOD(INT((RC1-1)/3),3)*5+3,FALSE)&"|"&HLOOKUP(Sheet1!R2C1,Sheet1!R2C1:R16C1,MOD(RC1,3)+MOD(INT((RC1)/3),3)*5+3,FALSE)&"|"&HLOOKUP(Sheet1!R2C1,Sheet1!R2C1:R16C1,MOD(RC1+1,3)+MOD(INT((RC1+1)/3),3)*5+3,FALSE)&"|"&HLOOKUP(Sheet1!R2C1,Sheet1!R2C1:R16C1,MOD(RC1+2,3)+MOD(INT((RC1+2)/3),3)*5+3,FALSE)&"|"&HLOOKUP(Sheet1!R2C1,Sheet1!R2C1:R16C1,MOD(RC1+3,3)+MOD(INT((RC1+3)/3),3)*5+3,FALSE) -> 133|134|162|163|164 | K506: =HLOOKUP(Sheet1!R2C1,Sheet1!R2C1:R16C1,MOD(RC1-1,3)+MOD(INT((RC1-1)/3),3)*5+3,FALSE)&"|"&HLOOKUP(Sheet1!R2C1,Sheet1!R2C1:R16C1,MOD(RC1,3)+MOD(INT((RC1)/3),3)*5+3,FALSE)&"|"&HLOOKUP(Sheet1!R2C1,Sheet1!R2C1:R16C1,MOD(RC1+1,3)+MOD(INT((RC1+1)/3),3)*5+3,FALSE)&"|"&HLOOKUP(Sheet1!R2C1,Sheet1!R2C1:R16C1,MOD(RC1+2,3)+MOD(INT((RC1+2)/3),3)*5+3,FALSE)&"|"&HLOOKUP(Sheet1!R2C1,Sheet1!R2C1:R16C1,MOD(RC1+3,3)+MOD(INT((RC1+3)/3),3)*5+3,FALSE) -> 133|134|162|163|164 | L506: 25|22|23|24 | M506: 15432785|15432785|15432785|15432785 | N506: 10030|10031|10032|10033|10030|10031|10032|10033|10030|10031|10032|10033|10030|10031|10032|10033|10030|10031|10032|10033|10030|10031|10032|10033|10030|10031|10032|10033|10030|10031|10032|10033|10030|10031|10032|10033|10030|10031|10032|10033 | O506: 1|1|1|1|1|1|1|1|1|1|1|1|1|1|1|1|1|1|1|1|1|1|1|1|1|1|1|1|1|1|1|1|1|1|1|1|1|1|1|1 | P506: 2500|2500|2500|2500|2500|2500|2500|2500|2500|2500|2500|2500|2500|2500|2500|2500|2500|2500|2500|2500|2500|2500|2500|2500|2500|2500|2500|2500|2500|2500|2500|2500|2500|2500|2500|2500|2500|2500|2500|2500

Sheet: 排名奖励
A1: rank_min|rank_min | B1: rank_max|rank_max | C1: item_id_list|item_id_list | D1: item_num_list|item_num_list | E1: title_id|title_id
A2: 不可空 | B2: 不可空 | C2: 不可空 | D2: 不可空 | E2: 不可空
A3: 数字 | B3: 数字 | C3: 一维数组 | D3: 一维数组 | E3: 数字
C4: 不定长 | D4: 不定长
A6: 排名下限 | B6: 排名上限 | C6: 奖励物品ID列表 | D6: 奖励物品数量列表 | E6: 获得的称号ID(0=表示木有)
A7: 1 | B7: 1 | C7: 19005|19103 | D7: 80|10 | E7: 2000
A8: 2 | B8: 2 | C8: 19005|19103 | D8: 70|8 | E8: 2001
A9: 3 | B9: 3 | C9: 19005|19103 | D9: 60|5 | E9: 2002
A10: 4 | B10: 10 | C10: 19005|19103 | D10: 50|3 | E10: 0
A11: 11 | B11: 20 | C11: 19005|19103 | D11: 40|2 | E11: 0
A12: 21 | B12: 50 | C12: 19005|19103 | D12: 30|1 | E12: 0
A13: 51 | B13: 100 | C13: 19005|19103 | D13: 20|1 | E13: 0
A14: 101 | B14: 200 | C14: 19005 | D14: 15 | E14: 0
A15: 201 | B15: 500 | C15: 19005 | D15: 10 | E15: 0
A16: 501 | B16: 1000 | C16: 19005 | D16: 5 | E16: 0

Sheet: 连杀奖励
A1: keep_kill_num|keep_kill_num | B1: diamond|diamond
A2: 不可空 | B2: 不可空
A3: 数字 | B3: 数字
A6: 连杀数量 | B6: 奖励的钻石 | C6: 杀怪数间隔
A7: 18 | B7: 66 | C7: =RC[-2] -> 18
A8: 68 | B8: 66 | C8: =RC[-2]-R[-1]C[-2] -> 50
A9: 168 | B9: 66 | C9: =RC[-2]-R[-1]C[-2] -> 100
A10: 268 | B10: 66 | C10: =RC[-2]-R[-1]C[-2] -> 100
A11: 388 | B11: 666 | C11: =RC[-2]-R[-1]C[-2] -> 120
A12: 528 | B12: 66 | C12: =RC[-2]-R[-1]C[-2] -> 140
A13: 666 | B13: 666 | C13: =RC[-2]-R[-1]C[-2] -> 138
A14: 777 | B14: 66 | C14: =RC[-2]-R[-1]C[-2] -> 111
A15: 888 | B15: 666 | C15: =RC[-2]-R[-1]C[-2] -> 111
A16: 998 | B16: 666 | C16: =RC[-2]-R[-1]C[-2] -> 110
A17: 1088 | B17: 128 | C17: =RC[-2]-R[-1]C[-2] -> 90
A18: 1188 | B18: 128 | C18: =RC[-2]-R[-1]C[-2] -> 100
A19: 1288 | B19: 128 | C19: =RC[-2]-R[-1]C[-2] -> 100
A20: 1388 | B20: 128 | C20: =RC[-2]-R[-1]C[-2] -> 100
A21: 1488 | B21: 128 | C21: =RC[-2]-R[-1]C[-2] -> 100
A22: 1588 | B22: 128 | C22: =RC[-2]-R[-1]C[-2] -> 100
A23: 1688 | B23: 666 | C23: =RC[-2]-R[-1]C[-2] -> 100
A24: 1788 | B24: 128 | C24: =RC[-2]-R[-1]C[-2] -> 100
A25: 1888 | B25: 666 | C25: =RC[-2]-R[-1]C[-2] -> 100
A26: 1988 | B26: 128 | C26: =RC[-2]-R[-1]C[-2] -> 100
A27: 2088 | B27: 128 | C27: =RC[-2]-R[-1]C[-2] -> 100
A28: 2188 | B28: 128 | C28: =RC[-2]-R[-1]C[-2] -> 100
A29: 2288 | B29: 128 | C29: =RC[-2]-R[-1]C[-2] -> 100
A30: 2388 | B30: 128 | C30: =RC[-2]-R[-1]C[-2] -> 100
A31: 2488 | B31: 128 | C31: =RC[-2]-R[-1]C[-2] -> 100
A32: 2588 | B32: 128 | C32: =RC[-2]-R[-1]C[-2] -> 100
A33: 2688 | B33: 128 | C33: =RC[-2]-R[-1]C[-2] -> 100
A34: 2788 | B34: 128 | C34: =RC[-2]-R[-1]C[-2] -> 100
A35: 2888 | B35: 666 | C35: =RC[-2]-R[-1]C[-2] -> 100
A36: 2988 | B36: 168 | C36: =RC[-2]-R[-1]C[-2] -> 100
A37: 3088 | B37: 168 | C37: =RC[-2]-R[-1]C[-2] -> 100
A38: 3188 | B38: 168 | C38: =RC[-2]-R[-1]C[-2] -> 100
A39: 3288 | B39: 168 | C39: =RC[-2]-R[-1]C[-2] -> 100
A40: 3388 | B40: 168 | C40: =RC[-2]-R[-1]C[-2] -> 100
A41: 3488 | B41: 168 | C41: =RC[-2]-R[-1]C[-2] -> 100
A42: 3588 | B42: 168 | C42: =RC[-2]-R[-1]C[-2] -> 100
A43: 3688 | B43: 168 | C43: =RC[-2]-R[-1]C[-2] -> 100
A44: 3788 | B44: 168 | C44: =RC[-2]-R[-1]C[-2] -> 100
A45: 3888 | B45: 666 | C45: =RC[-2]-R[-1]C[-2] -> 100
A46: 3988 | B46: 168 | C46: =RC[-2]-R[-1]C[-2] -> 100
A47: 4088 | B47: 168 | C47: =RC[-2]-R[-1]C[-2] -> 100
A48: 4188 | B48: 168 | C48: =RC[-2]-R[-1]C[-2] -> 100
A49: 4288 | B49: 168 | C49: =RC[-2]-R[-1]C[-2] -> 100
A50: 4388 | B50: 168 | C50: =RC[-2]-R[-1]C[-2] -> 100
A51: 4488 | B51: 168 | C51: =RC[-2]-R[-1]C[-2] -> 100
A52: 4588 | B52: 168 | C52: =RC[-2]-R[-1]C[-2] -> 100
A53: 4688 | B53: 168 | C53: =RC[-2]-R[-1]C[-2] -> 100
A54: 4788 | B54: 168 | C54: =RC[-2]-R[-1]C[-2] -> 100
A55: 4888 | B55: 666 | C55: =RC[-2]-R[-1]C[-2] -> 100
A56: 4988 | B56: 168 | C56: =RC[-2]-R[-1]C[-2] -> 100
A57: 5088 | B57: 168 | C57: =RC[-2]-R[-1]C[-2] -> 100
A58: 5188 | B58: 168 | C58: =RC[-2]-R[-1]C[-2] -> 100
A59: 5288 | B59: 168 | C59: =RC[-2]-R[-1]C[-2] -> 100
A60: 5388 | B60: 168 | C60: =RC[-2]-R[-1]C[-2] -> 100
A61: 5488 | B61: 168 | C61: =RC[-2]-R[-1]C[-2] -> 100
A62: 5588 | B62: 168 | C62: =RC[-2]-R[-1]C[-2] -> 100
A63: 5688 | B63: 168 | C63: =RC[-2]-R[-1]C[-2] -> 100
A64: 5788 | B64: 168 | C64: =RC[-2]-R[-1]C[-2] -> 100
A65: 5888 | B65: 666 | C65: =RC[-2]-R[-1]C[-2] -> 100
A66: 5988 | B66: 168 | C66: =RC[-2]-R[-1]C[-2] -> 100
A67: 6088 | B67: 168 | C67: =RC[-2]-R[-1]C[-2] -> 100
A68: 6188 | B68: 168 | C68: =RC[-2]-R[-1]C[-2] -> 100
A69: 6288 | B69: 168 | C69: =RC[-2]-R[-1]C[-2] -> 100
A70: 6388 | B70: 168 | C70: =RC[-2]-R[-1]C[-2] -> 100
A71: 6488 | B71: 168 | C71: =RC[-2]-R[-1]C[-2] -> 100
A72: 6588 | B72: 168 | C72: =RC[-2]-R[-1]C[-2] -> 100
A73: 6688 | B73: 168 | C73: =RC[-2]-R[-1]C[-2] -> 100
A74: 6788 | B74: 168 | C74: =RC[-2]-R[-1]C[-2] -> 100
A75: 6888 | B75: 666 | C75: =RC[-2]-R[-1]C[-2] -> 100

Sheet: 深渊商店
A1: id|id | B1: sort_id| | C1: goods_type|goods_type | D1: item_id|item_id | E1: item_num|item_num | F1: need_role_level|need_role_level | G1: buy_num_max|buy_num_max | H1: cost_type_list|cost_type_list | I1: cost_value_list|cost_value_list | J1: need_kill_monster_num|need_kill_monster_num
A2: 不可空 | B2: 不可空 | C2: 不可空 | D2: 不可空 | E2: 不可空 | F2: 不可空 | G2: 不可空 | H2: 可空#不需字段 | I2: 可空#不需字段 | J2: 不可空
A3: 数字 | B3: 数字 | C3: 数字 | D3: 数字 | E3: 数字 | F3: 数字 | G3: 数字 | H3: 一维数组 | I3: 一维数组 | J3: 数字
H4: 不定长 | I4: 不定长
A6: 商品ID | B6: 排序id | C6: 商品类型(1=道具,2=奖励) | D6: 物品ID | E6: 物品数量 | F6: 需要的角色等级 | G6: 购买数量上限(0=表示无上限) | H6: 消耗类型列表 | I6: 消耗值列表 | J6: 需要的杀怪数量
A7: 1 | B7: 0 | C7: 1 | D7: 10034 | E7: 1 | F7: 1 | G7: 2 | H7: 28 | I7: 2500 | J7: 0
A8: 2 | B8: 1 | C8: 1 | D8: 10035 | E8: 1 | F8: 1 | G8: 2 | H8: 28 | I8: 3000 | J8: 0
A9: 3 | B9: 2 | C9: 1 | D9: 10036 | E9: 1 | F9: 1 | G9: 2 | H9: 28 | I9: 3000 | J9: 0
A10: 4 | B10: 3 | C10: 1 | D10: 10039 | E10: 1 | F10: 1 | G10: 2 | H10: 28 | I10: 2500 | J10: 0
A11: 5 | B11: 4 | C11: 1 | D11: 10040 | E11: 1 | F11: 1 | G11: 2 | H11: 28 | I11: 2500 | J11: 0
A12: 51 | B12: 5 | C12: 1 | D12: 10030 | E12: 10 | F12: 1 | G12: 100 | H12: 28 | I12: 10 | J12: 0
A13: 52 | B13: 6 | C13: 1 | D13: 10031 | E13: 10 | F13: 1 | G13: 100 | H13: 28 | I13: 10 | J13: 0
A14: 53 | B14: 7 | C14: 1 | D14: 10032 | E14: 10 | F14: 1 | G14: 100 | H14: 28 | I14: 10 | J14: 0
A15: 54 | B15: 8 | C15: 1 | D15: 10033 | E15: 10 | F15: 1 | G15: 100 | H15: 28 | I15: 10 | J15: 0
A16: 55 | B16: 9 | C16: 1 | D16: 10030 | E16: 100 | F16: 1 | G16: 10 | H16: 28 | I16: 100 | J16: 0
A17: 56 | B17: 10 | C17: 1 | D17: 10031 | E17: 100 | F17: 1 | G17: 10 | H17: 28 | I17: 100 | J17: 0
A18: 57 | B18: 11 | C18: 1 | D18: 10032 | E18: 100 | F18: 1 | G18: 10 | H18: 28 | I18: 100 | J18: 0
A19: 58 | B19: 12 | C19: 1 | D19: 10033 | E19: 100 | F19: 1 | G19: 10 | H19: 28 | I19: 100 | J19: 0
A20: 59 | B20: 13 | C20: 1 | D20: 10030 | E20: 1000 | F20: 1 | G20: 1 | H20: 28 | I20: 1000 | J20: 0
A21: 60 | B21: 14 | C21: 1 | D21: 10031 | E21: 1000 | F21: 1 | G21: 1 | H21: 28 | I21: 1000 | J21: 0
A22: 61 | B22: 15 | C22: 1 | D22: 10032 | E22: 1000 | F22: 1 | G22: 1 | H22: 28 | I22: 1000 | J22: 0
A23: 62 | B23: 16 | C23: 1 | D23: 10033 | E23: 1000 | F23: 1 | G23: 1 | H23: 28 | I23: 1000 | J23: 0
A24: 101 | B24: 0 | C24: 2 | D24: 13645 | E24: 1 | F24: 1 | G24: 1 | H24: 28 | I24: 8 | J24: 30
A25: 1001 | B25: 1 | C25: 2 | D25: 10030 | E25: 50 | F25: 1 | G25: 1 | H25: 28 | I25: =RC[-4]/2 -> 25 | J25: 100
A26: 1002 | B26: 2 | C26: 2 | D26: 10031 | E26: 50 | F26: 1 | G26: 1 | H26: 28 | I26: =RC[-4]/2 -> 25 | J26: 100
A27: 1003 | B27: 3 | C27: 2 | D27: 10032 | E27: 50 | F27: 1 | G27: 1 | H27: 28 | I27: =RC[-4]/2 -> 25 | J27: 100
A28: 1004 | B28: 4 | C28: 2 | D28: 10033 | E28: 50 | F28: 1 | G28: 1 | H28: 28 | I28: =RC[-4]/2 -> 25 | J28: 100
A29: 1005 | B29: 5 | C29: 2 | D29: 10030 | E29: 50 | F29: 1 | G29: 1 | H29: 28 | I29: =RC[-4]/2 -> 25 | J29: 200
A30: 1006 | B30: 6 | C30: 2 | D30: 10031 | E30: 50 | F30: 1 | G30: 1 | H30: 28 | I30: =RC[-4]/2 -> 25 | J30: 200
A31: 1007 | B31: 7 | C31: 2 | D31: 10032 | E31: 50 | F31: 1 | G31: 1 | H31: 28 | I31: =RC[-4]/2 -> 25 | J31: 200
A32: 1008 | B32: 8 | C32: 2 | D32: 10033 | E32: 50 | F32: 1 | G32: 1 | H32: 28 | I32: =RC[-4]/2 -> 25 | J32: 200
A33: 1009 | B33: 9 | C33: 2 | D33: 10030 | E33: 100 | F33: 1 | G33: 1 | H33: 28 | I33: =RC[-4]/2 -> 50 | J33: 400
A34: 1010 | B34: 10 | C34: 2 | D34: 10031 | E34: 100 | F34: 1 | G34: 1 | H34: 28 | I34: =RC[-4]/2 -> 50 | J34: 400
A35: 1011 | B35: 11 | C35: 2 | D35: 10032 | E35: 100 | F35: 1 | G35: 1 | H35: 28 | I35: =RC[-4]/2 -> 50 | J35: 400
A36: 1012 | B36: 12 | C36: 2 | D36: 10033 | E36: 100 | F36: 1 | G36: 1 | H36: 28 | I36: =RC[-4]/2 -> 50 | J36: 400
A37: 1013 | B37: 13 | C37: 2 | D37: 10030 | E37: 100 | F37: 1 | G37: 1 | H37: 28 | I37: =RC[-4]/2 -> 50 | J37: =R[-4]C+200 -> 600
A38: 1014 | B38: 14 | C38: 2 | D38: 10031 | E38: 100 | F38: 1 | G38: 1 | H38: 28 | I38: =RC[-4]/2 -> 50 | J38: =R[-4]C+200 -> 600
A39: 1015 | B39: 15 | C39: 2 | D39: 10032 | E39: 100 | F39: 1 | G39: 1 | H39: 28 | I39: =RC[-4]/2 -> 50 | J39: =R[-4]C+200 -> 600
A40: 1016 | B40: 16 | C40: 2 | D40: 10033 | E40: 100 | F40: 1 | G40: 1 | H40: 28 | I40: =RC[-4]/2 -> 50 | J40: =R[-4]C+200 -> 600
A41: 1017 | B41: 17 | C41: 2 | D41: 10030 | E41: 150 | F41: 1 | G41: 1 | H41: 28 | I41: =RC[-4]/2 -> 75 | J41: =R[-4]C+200 -> 800
A42: 1018 | B42: 18 | C42: 2 | D42: 10031 | E42: 150 | F42: 1 | G42: 1 | H42: 28 | I42: =RC[-4]/2 -> 75 | J42: =R[-4]C+200 -> 800
A43: 1019 | B43: 19 | C43: 2 | D43: 10032 | E43: 150 | F43: 1 | G43: 1 | H43: 28 | I43: =RC[-4]/2 -> 75 | J43: =R[-4]C+200 -> 800
A44: 1020 | B44: 20 | C44: 2 | D44: 10033 | E44: 150 | F44: 1 | G44: 1 | H44: 28 | I44: =RC[-4]/2 -> 75 | J44: =R[-4]C+200 -> 800
A45: 1021 | B45: 21 | C45: 2 | D45: 10030 | E45: 150 | F45: 1 | G45: 1 | H45: 28 | I45: =RC[-4]/2 -> 75 | J45: =R[-4]C+200 -> 1000
A46: 1022 | B46: 22 | C46: 2 | D46: 10031 | E46: 150 | F46: 1 | G46: 1 | H46: 28 | I46: =RC[-4]/2 -> 75 | J46: =R[-4]C+200 -> 1000
A47: 1023 | B47: 23 | C47: 2 | D47: 10032 | E47: 150 | F47: 1 | G47: 1 | H47: 28 | I47: =RC[-4]/2 -> 75 | J47: =R[-4]C+200 -> 1000
A48: 1024 | B48: 24 | C48: 2 | D48: 10033 | E48: 150 | F48: 1 | G48: 1 | H48: 28 | I48: =RC[-4]/2 -> 75 | J48: =R[-4]C+200 -> 1000
A49: 1025 | B49: 25 | C49: 2 | D49: 10030 | E49: 200 | F49: 1 | G49: 1 | H49: 28 | I49: =RC[-4]/2 -> 100 | J49: =R[-4]C+200 -> 1200
A50: 1026 | B50: 26 | C50: 2 | D50: 10031 | E50: 200 | F50: 1 | G50: 1 | H50: 28 | I50: =RC[-4]/2 -> 100 | J50: =R[-4]C+200 -> 1200
A51: 1027 | B51: 27 | C51: 2 | D51: 10032 | E51: 200 | F51: 1 | G51: 1 | H51: 28 | I51: =RC[-4]/2 -> 100 | J51: =R[-4]C+200 -> 1200
A52: 1028 | B52: 28 | C52: 2 | D52: 10033 | E52: 200 | F52: 1 | G52: 1 | H52: 28 | I52: =RC[-4]/2 -> 100 | J52: =R[-4]C+200 -> 1200
A53: 1029 | B53: 29 | C53: 2 | D53: 10030 | E53: 200 | F53: 1 | G53: 1 | H53: 28 | I53: =RC[-4]/2 -> 100 | J53: =R[-4]C+200 -> 1400
A54: 1030 | B54: 30 | C54: 2 | D54: 10031 | E54: 200 | F54: 1 | G54: 1 | H54: 28 | I54: =RC[-4]/2 -> 100 | J54: =R[-4]C+200 -> 1400
A55: 1031 | B55: 31 | C55: 2 | D55: 10032 | E55: 200 | F55: 1 | G55: 1 | H55: 28 | I55: =RC[-4]/2 -> 100 | J55: =R[-4]C+200 -> 1400
A56: 1032 | B56: 32 | C56: 2 | D56: 10033 | E56: 200 | F56: 1 | G56: 1 | H56: 28 | I56: =RC[-4]/2 -> 100 | J56: =R[-4]C+200 -> 1400
A57: 1033 | B57: 33 | C57: 2 | D57: 10030 | E57: 250 | F57: 1 | G57: 1 | H57: 28 | I57: =RC[-4]/2 -> 125 | J57: =R[-4]C+200 -> 1600
A58: 1034 | B58: 34 | C58: 2 | D58: 10031 | E58: 250 | F58: 1 | G58: 1 | H58: 28 | I58: =RC[-4]/2 -> 125 | J58: =R[-4]C+200 -> 1600
A59: 1035 | B59: 35 | C59: 2 | D59: 10032 | E59: 250 | F59: 1 | G59: 1 | H59: 28 | I59: =RC[-4]/2 -> 125 | J59: =R[-4]C+200 -> 1600
A60: 1036 | B60: 36 | C60: 2 | D60: 10033 | E60: 250 | F60: 1 | G60: 1 | H60: 28 | I60: =RC[-4]/2 -> 125 | J60: =R[-4]C+200 -> 1600
A61: 1037 | B61: 37 | C61: 2 | D61: 10030 | E61: 250 | F61: 1 | G61: 1 | H61: 28 | I61: =RC[-4]/2 -> 125 | J61: =R[-4]C+200 -> 1800
A62: 1038 | B62: 38 | C62: 2 | D62: 10031 | E62: 250 | F62: 1 | G62: 1 | H62: 28 | I62: =RC[-4]/2 -> 125 | J62: =R[-4]C+200 -> 1800
A63: 1039 | B63: 39 | C63: 2 | D63: 10032 | E63: 250 | F63: 1 | G63: 1 | H63: 28 | I63: =RC[-4]/2 -> 125 | J63: =R[-4]C+200 -> 1800
A64: 1040 | B64: 40 | C64: 2 | D64: 10033 | E64: 250 | F64: 1 | G64: 1 | H64: 28 | I64: =RC[-4]/2 -> 125 | J64: =R[-4]C+200 -> 1800
A65: 1041 | B65: 41 | C65: 2 | D65: 10030 | E65: 300 | F65: 1 | G65: 1 | H65: 28 | I65: =RC[-4]/2 -> 150 | J65: =R[-4]C+200 -> 2000
A66: 1042 | B66: 42 | C66: 2 | D66: 10031 | E66: 300 | F66: 1 | G66: 1 | H66: 28 | I66: =RC[-4]/2 -> 150 | J66: =R[-4]C+200 -> 2000
A67: 1043 | B67: 43 | C67: 2 | D67: 10032 | E67: 300 | F67: 1 | G67: 1 | H67: 28 | I67: =RC[-4]/2 -> 150 | J67: =R[-4]C+200 -> 2000
A68: 1044 | B68: 44 | C68: 2 | D68: 10033 | E68: 300 | F68: 1 | G68: 1 | H68: 28 | I68: =RC[-4]/2 -> 150 | J68: =R[-4]C+200 -> 2000
A69: 1045 | B69: 45 | C69: 2 | D69: 10030 | E69: 300 | F69: 1 | G69: 1 | H69: 28 | I69: =RC[-4]/2 -> 150 | J69: =R[-4]C+200 -> 2200
A70: 1046 | B70: 46 | C70: 2 | D70: 10031 | E70: 300 | F70: 1 | G70: 1 | H70: 28 | I70: =RC[-4]/2 -> 150 | J70: =R[-4]C+200 -> 2200
A71: 1047 | B71: 47 | C71: 2 | D71: 10032 | E71: 300 | F71: 1 | G71: 1 | H71: 28 | I71: =RC[-4]/2 -> 150 | J71: =R[-4]C+200 -> 2200
A72: 1048 | B72: 48 | C72: 2 | D72: 10033 | E72: 300 | F72: 1 | G72: 1 | H72: 28 | I72: =RC[-4]/2 -> 150 | J72: =R[-4]C+200 -> 2200
A73: 1049 | B73: 49 | C73: 2 | D73: 10030 | E73: 350 | F73: 1 | G73: 1 | H73: 28 | I73: =RC[-4]/2 -> 175 | J73: =R[-4]C+200 -> 2400
A74: 1050 | B74: 50 | C74: 2 | D74: 10031 | E74: 350 | F74: 1 | G74: 1 | H74: 28 | I74: =RC[-4]/2 -> 175 | J74: =R[-4]C+200 -> 2400
A75: 1051 | B75: 51 | C75: 2 | D75: 10032 | E75: 350 | F75: 1 | G75: 1 | H75: 28 | I75: =RC[-4]/2 -> 175 | J75: =R[-4]C+200 -> 2400
A76: 1052 | B76: 52 | C76: 2 | D76: 10033 | E76: 350 | F76: 1 | G76: 1 | H76: 28 | I76: =RC[-4]/2 -> 175 | J76: =R[-4]C+200 -> 2400
A77: 1053 | B77: 53 | C77: 2 | D77: 10030 | E77: 350 | F77: 1 | G77: 1 | H77: 28 | I77: =RC[-4]/2 -> 175 | J77: =R[-4]C+200 -> 2600
A78: 1054 | B78: 54 | C78: 2 | D78: 10031 | E78: 350 | F78: 1 | G78: 1 | H78: 28 | I78: =RC[-4]/2 -> 175 | J78: =R[-4]C+200 -> 2600
A79: 1055 | B79: 55 | C79: 2 | D79: 10032 | E79: 350 | F79: 1 | G79: 1 | H79: 28 | I79: =RC[-4]/2 -> 175 | J79: =R[-4]C+200 -> 2600
A80: 1056 | B80: 56 | C80: 2 | D80: 10033 | E80: 350 | F80: 1 | G80: 1 | H80: 28 | I80: =RC[-4]/2 -> 175 | J80: =R[-4]C+200 -> 2600
A81: 1057 | B81: 57 | C81: 2 | D81: 10030 | E81: 400 | F81: 1 | G81: 1 | H81: 28 | I81: =RC[-4]/2 -> 200 | J81: =R[-4]C+200 -> 2800
A82: 1058 | B82: 58 | C82: 2 | D82: 10031 | E82: 400 | F82: 1 | G82: 1 | H82: 28 | I82: =RC[-4]/2 -> 200 | J82: =R[-4]C+200 -> 2800
A83: 1059 | B83: 59 | C83: 2 | D83: 10032 | E83: 400 | F83: 1 | G83: 1 | H83: 28 | I83: =RC[-4]/2 -> 200 | J83: =R[-4]C+200 -> 2800
A84: 1060 | B84: 60 | C84: 2 | D84: 10033 | E84: 400 | F84: 1 | G84: 1 | H84: 28 | I84: =RC[-4]/2 -> 200 | J84: =R[-4]C+200 -> 2800
A85: 1061 | B85: 61 | C85: 2 | D85: 10030 | E85: 400 | F85: 1 | G85: 1 | H85: 28 | I85: =RC[-4]/2 -> 200 | J85: =R[-4]C+200 -> 3000
A86: 1062 | B86: 62 | C86: 2 | D86: 10031 | E86: 400 | F86: 1 | G86: 1 | H86: 28 | I86: =RC[-4]/2 -> 200 | J86: =R[-4]C+200 -> 3000
A87: 1063 | B87: 63 | C87: 2 | D87: 10032 | E87: 400 | F87: 1 | G87: 1 | H87: 28 | I87: =RC[-4]/2 -> 200 | J87: =R[-4]C+200 -> 3000
A88: 1064 | B88: 64 | C88: 2 | D88: 10033 | E88: 400 | F88: 1 | G88: 1 | H88: 28 | I88: =RC[-4]/2 -> 200 | J88: =R[-4]C+200 -> 3000

Sheet: 碰撞奖励
A1: id|id | B1: rate|rate | C1: item_id_list|item_id_list | D1: item_num_list|item_num_list
A2: 不可空 | B2: 不可空 | C2: 不可空 | D2: 不可空
A3: 数字 | B3: 数字 | C3: 一维数组 | D3: 一维数组
C4: 不定长 | D4: 不定长
A6: 奖励ID | B6: 概率 | C6: 奖励物品ID列表 | D6: 奖励物品数量列表
A7: 1 | B7: 200 | C7: 19005 | D7: 5
A8: 2 | B8: 100 | C8: 19005 | D8: 10
A9: 3 | B9: 200 | C9: 19003 | D9: 233
A10: 4 | B10: 100 | C10: 19003 | D10: 666
A11: 5 | B11: 50 | C11: 19003 | D11: 998
A12: 6 | B12: 200 | C12: 10030 | D12: 1
A13: 7 | B13: 200 | C13: 10031 | D13: 1
A14: 8 | B14: 200 | C14: 10032 | D14: 1
A15: 9 | B15: 200 | C15: 10033 | D15: 1
A16: 10 | B16: 100 | C16: 10030 | D16: 2
A17: 11 | B17: 100 | C17: 10031 | D17: 2
A18: 12 | B18: 100 | C18: 10032 | D18: 2
A19: 13 | B19: 100 | C19: 10033 | D19: 2

Sheet: 扫荡配置
A1: sweep_time| | B1: monster_rebirth|
A2: 不可空 | B2: 不可空
A3: 数字 | B3: 数字
A6: 扫荡播放时间（毫秒） | B6: 怪物出现间隔（毫秒）
A7: 5000 | B7: 400

Sheet: 挂机表现
A1: hero_say| | B1: monster_say| | C1: monster_show|
A2: 可空#不需字段 | B2: 可空#不需字段 | C2: 可空#不需字段
A3: 一维数组 | B3: 一维数组 | C3: 一维数组
A4: 不定长 | B4: 不定长 | C4: 不定长
A6: 英雄随机喊话 | B6: 怪物随机喊话 | C6: 挂机随机怪物组
A7: "没有人能阻挡我胜利的步伐！"|"我们是深渊的终结者！"|"进攻！进攻！" | B7: "深渊吞噬一切！"|"你们阻挡不了！"|"服从深渊的意志！" | C7: 100|101|102|103|104|130|131|132|133|134|160|161|162|163|164

Sheet: 评分配置
A1: kill_monster| | B1: stay_time| | C1: efecct_icon|
A2: 不可空 | B2: 不可空 | C2: 不可空
A3: 数字 | B3: 数字 | C3: 字符串
A4: 不定长 | B4: 不定长 | C4: 不定长
A6: 怪物数量 | B6: 触发后保留时间 | C6: 显示特效
A7: 30 | B7: 10 | C7: UI_wujinnice
A8: 50 | B8: 10 | C8: UI_wujincool
A9: 80 | B9: 10 | C9: UI_wujinsuper

Sheet: 挑战消耗
A1: battle_times|battle_times | B1: cost_item_id|cost_item_id | C1: cost_item_num|cost_item_num | D1: cost_currency_type|cost_currency_type | E1: cost_currency_value|cost_currency_value
A2: 不可空 | B2: 可空#不需字段 | C2: 可空#不需字段 | D2: 可空#不需字段 | E2: 可空#不需字段
A3: 数字 | B3: 数字 | C3: 数字 | D3: 数字 | E3: 数字
A6: 挑战次数 | B6: 消耗道具ID | C6: 消耗道具数量 | D6: 消耗货币类型 | E6: 消耗货币值
A7: 1
A8: 2 | B8: 10023 | C8: 1 | D8: 5 | E8: 50
A9: 3 | B9: 10023 | C9: 2 | D9: 5 | E9: 75
A10: 4 | B10: 10023 | C10: 4 | D10: 5 | E10: 100
A11: 5 | B11: 10023 | C11: 6 | D11: 5 | E11: 125
A12: 6 | B12: 10023 | C12: 8 | D12: 5 | E12: 150
A13: 7 | B13: 10023 | C13: 10 | D13: 5 | E13: 175
A14: 8 | B14: 10023 | C14: 12 | D14: 5 | E14: 200
A15: 9 | B15: 10023 | C15: 14 | D15: 5 | E15: 200
A16: 10 | B16: 10023 | C16: 16 | D16: 5 | E16: 200

Sheet: Sheet1
A2: 100 | B2: 精英特警 | D2: 110 | E2: 超级队长 | G2: 112 | H2: 红头魔 | J2: 190 | K2: 四爪博士
A3: 101 | B3: 王牌机甲 | D3: 111 | E3: 死亡武士 | G3: 113 | H3: 终极队长 | J3: 191 | K3: 红颅鬼
A4: 102 | B4: 智能激光机械 | D4: 140 | E4: 杰克船长 | G4: 114 | H4: 雷神 | J4: 192 | K4: 独眼巨人
A5: 103 | B5: 智能镭射机械 | D5: 141 | E5: 天使长 | G5: 115 | H5: 野蛮巨人 | J5: 193 | K5: 憎恶
A6: 104 | B6: 精英护士 | D6: 170 | E6: 石头人 | G6: 116 | H6: 致命特工 | J6: 194 | K6: 大地泰坦
A7: 130 | B7: 角斗之王 | D7: 171 | E7: 血源牧师 | G7: 117 | H7: 鹰眸 | J7: 195 | K7: 战争主宰
A8: 131 | B8: 盔甲武士 | G8: 118 | H8: 刀锋猎人
A9: 132 | B9: 弓弩刺客 | G9: 119 | H9: 地狱骑士
A10: 133 | B10: 黑魔导师 | G10: 120 | H10: 铁人
A11: 134 | B11: 白魔导师 | G11: 121 | H11: 树人
A12: 160 | B12: 地精大盗 | G12: 122 | H12: 超凡博士
A13: 161 | B13: 骷髅勇士 | G13: 123 | H13: 白凤凰
A14: 162 | B14: 精英火枪手 | G14: 124 | H14: 地狱铁拳
A15: 163 | B15: 海元素领主 | G15: 125 | H15: 混沌女巫
A16: 164 | B16: 水元素领主 | G16: 142 | H16: 独眼野蛮人
G17: 143 | H17: 圣女贞德
G18: 144 | H18: 美杜莎
G19: 145 | H19: 德古拉伯爵
G20: 146 | H20: 狩猎女神
G21: 147 | H21: 查理大帝
G22: 148 | H22: 佐罗
G23: 149 | H23: 亚马逊女王
G24: 150 | H24: 宙斯
G25: 151 | H25: 斯巴达
G26: 152 | H26: 阿努比斯
G27: 153 | H27: 雅典娜
G28: 154 | H28: 大力神
G29: 155 | H29: 冥王哈迪斯
G30: 172 | H30: 屠夫
G31: 173 | H31: 树精
G32: 174 | H32: 牛头人
G33: 175 | H33: 火女
G34: 176 | H34: 半人马
G35: 177 | H35: 食人魔
G36: 178 | H36: 基伦
G37: 179 | H37: 女警
G38: 180 | H38: 小黑
G39: 181 | H39: 熊阿宝
G40: 182 | H40: 血色指挥官
G41: 183 | H41: 大检察官
G42: 184 | H42: 恶魔猎手
G43: 185 | H43: 神圣牧师