Sheet: 配置
A1: 服务端文件名 | B1: 服务端对应工作表号 | C1: 客户端文件名 | D1: 客户端对应工作表号 | E1: erl头部 | F1: erl内容格式 | G1: erl尾部 | H1: 客户端特殊处理
A2: config_fairy_pokedex.txt | B2: 1 | C2: config_fairy_pokedex.cnf|FairyPokedex | D2: 1 | F2: get(id) -> #$ | H2: 1=>pokedex_type,pokedex_id,star
A3: config_fairy.txt | B3: 2 | C3: config_fairy.cnf|Fairy | D3: 2 | F3: get(id) -> #$ | H3: 2=>id
A4: config_fairy_level_up.txt | B4: 3 | C4: config_fairy_level_up.cnf|FairyLevelUp | D4: 3 | F4: get(id) -> #$ | H4: 1=>quality,level|level_list
A5: config_fairy_break.txt | B5: 4 | C5: config_fairy_break.cnf|FairyBreak | D5: 4 | F5: get(id) -> #$ | H5: 1=>quality,break_level|break_level_list
A6: config_fairy_map.txt | B6: 5 | F6: get(id) -> #$
A7: config_fairy_recruit.txt | B7: 6 | C7: config_fairy_recruit.cnf|FairyRecruit | D7: 6 | F7: get(id) -> #$ | H7: 2=>type
A8: config_fairy_normal_recruit_list.txt | B8: 7 | C8: config_fairy_normal_recruit_list.cnf|FairyNormalRecruitList | D8: 7 | F8: get(id) -> #$ | H8: 2=>id
A9: config_fairy_high_recruit_list.txt | B9: 8 | C9: config_fairy_high_recruit_list.cnf|FairyHighRecruitList | D9: 8 | F9: get(id) -> #$ | H9: 2=>id
A10: config_fairy_pokedex_achievement.txt | B10: 9 | C10: config_fairy_pokedex_achievement.cnf|FairyPokedexAchievement | D10: 9 | F10: get(id) -> #$ | H10: 2=>level

Sheet: 1.图鉴
A1: pokedex_type|pokedex_type | B1: pokedex_id|pokedex_id | C1: star|star | D1: fairy_list|fairy_list | E1: pro_type_list|pro_type_list | F1: pro_value_list|pro_value_list
A2: 不可空 | B2: 不可空 | C2: 不可空 | D2: 不可空 | E2: 不可空 | F2: 不可空
A3: 数字 | B3: 数字 | C3: 数字 | D3: 一维数组 | E3: 一维数组 | F3: 一维数组
D4: 不定长 | E4: 不定长 | F4: 不定长
A6: 图鉴类型 | B6: 图鉴ID | C6: 星数 | D6: 将灵列表 | E6: 属性类型列表 | F6: 属性值列表
A7: 1 | B7: 1 | C7: 0 | D7: 70300 | E7: 1|4 | F7: 50|200
A8: 1 | B8: 1 | C8: 1 | D8: 70300 | E8: 1|4 | F8: 80|320
A9: 1 | B9: 1 | C9: 2 | D9: 70300 | E9: 1|4 | F9: 110|440
A10: 1 | B10: 1 | C10: 3 | D10: 70300 | E10: 1|4 | F10: 140|560
A11: 1 | B11: 1 | C11: 4 | D11: 70300 | E11: 1|4 | F11: 170|680
A12: 1 | B12: 1 | C12: 5 | D12: 70300 | E12: 1|4 | F12: 200|800
A13: 1 | B13: 2 | C13: 0 | D13: 70301 | E13: 1|4 | F13: 50|200
A14: 1 | B14: 2 | C14: 1 | D14: 70301 | E14: 1|4 | F14: 80|320
A15: 1 | B15: 2 | C15: 2 | D15: 70301 | E15: 1|4 | F15: 110|440
A16: 1 | B16: 2 | C16: 3 | D16: 70301 | E16: 1|4 | F16: 140|560
A17: 1 | B17: 2 | C17: 4 | D17: 70301 | E17: 1|4 | F17: 170|680
A18: 1 | B18: 2 | C18: 5 | D18: 70301 | E18: 1|4 | F18: 200|800
A19: 1 | B19: 3 | C19: 0 | D19: 70302 | E19: 1|4 | F19: 50|200
A20: 1 | B20: 3 | C20: 1 | D20: 70302 | E20: 1|4 | F20: 80|320
A21: 1 | B21: 3 | C21: 2 | D21: 70302 | E21: 1|4 | F21: 110|440
A22: 1 | B22: 3 | C22: 3 | D22: 70302 | E22: 1|4 | F22: 140|560
A23: 1 | B23: 3 | C23: 4 | D23: 70302 | E23: 1|4 | F23: 170|680
A24: 1 | B24: 3 | C24: 5 | D24: 70302 | E24: 1|4 | F24: 200|800
A25: 1 | B25: 4 | C25: 0 | D25: 70303 | E25: 1|4 | F25: 50|200
A26: 1 | B26: 4 | C26: 1 | D26: 70303 | E26: 1|4 | F26: 80|320
A27: 1 | B27: 4 | C27: 2 | D27: 70303 | E27: 1|4 | F27: 110|440
A28: 1 | B28: 4 | C28: 3 | D28: 70303 | E28: 1|4 | F28: 140|560
A29: 1 | B29: 4 | C29: 4 | D29: 70303 | E29: 1|4 | F29: 170|680
A30: 1 | B30: 4 | C30: 5 | D30: 70303 | E30: 1|4 | F30: 200|800
A31: 1 | B31: 5 | C31: 0 | D31: 70304 | E31: 1|4 | F31: 50|200
A32: 1 | B32: 5 | C32: 1 | D32: 70304 | E32: 1|4 | F32: 80|320
A33: 1 | B33: 5 | C33: 2 | D33: 70304 | E33: 1|4 | F33: 110|440
A34: 1 | B34: 5 | C34: 3 | D34: 70304 | E34: 1|4 | F34: 140|560
A35: 1 | B35: 5 | C35: 4 | D35: 70304 | E35: 1|4 | F35: 170|680
A36: 1 | B36: 5 | C36: 5 | D36: 70304 | E36: 1|4 | F36: 200|800
A37: 1 | B37: 6 | C37: 0 | D37: 70305 | E37: 1|4 | F37: 50|200
A38: 1 | B38: 6 | C38: 1 | D38: 70305 | E38: 1|4 | F38: 80|320
A39: 1 | B39: 6 | C39: 2 | D39: 70305 | E39: 1|4 | F39: 110|440
A40: 1 | B40: 6 | C40: 3 | D40: 70305 | E40: 1|4 | F40: 140|560
A41: 1 | B41: 6 | C41: 4 | D41: 70305 | E41: 1|4 | F41: 170|680
A42: 1 | B42: 6 | C42: 5 | D42: 70305 | E42: 1|4 | F42: 200|800
A43: 1 | B43: 7 | C43: 0 | D43: 71300 | E43: 2|3 | F43: 60|60
A44: 1 | B44: 7 | C44: 1 | D44: 71300 | E44: 2|3 | F44: 96|96
A45: 1 | B45: 7 | C45: 2 | D45: 71300 | E45: 2|3 | F45: 132|132
A46: 1 | B46: 7 | C46: 3 | D46: 71300 | E46: 2|3 | F46: 168|168
A47: 1 | B47: 7 | C47: 4 | D47: 71300 | E47: 2|3 | F47: 204|204
A48: 1 | B48: 7 | C48: 5 | D48: 71300 | E48: 2|3 | F48: 240|240
A49: 1 | B49: 8 | C49: 0 | D49: 71301 | E49: 2|3 | F49: 60|60
A50: 1 | B50: 8 | C50: 1 | D50: 71301 | E50: 2|3 | F50: 96|96
A51: 1 | B51: 8 | C51: 2 | D51: 71301 | E51: 2|3 | F51: 132|132
A52: 1 | B52: 8 | C52: 3 | D52: 71301 | E52: 2|3 | F52: 168|168
A53: 1 | B53: 8 | C53: 4 | D53: 71301 | E53: 2|3 | F53: 204|204
A54: 1 | B54: 8 | C54: 5 | D54: 71301 | E54: 2|3 | F54: 240|240
A55: 1 | B55: 9 | C55: 0 | D55: 71302 | E55: 2|3 | F55: 60|60
A56: 1 | B56: 9 | C56: 1 | D56: 71302 | E56: 2|3 | F56: 96|96
A57: 1 | B57: 9 | C57: 2 | D57: 71302 | E57: 2|3 | F57: 132|132
A58: 1 | B58: 9 | C58: 3 | D58: 71302 | E58: 2|3 | F58: 168|168
A59: 1 | B59: 9 | C59: 4 | D59: 71302 | E59: 2|3 | F59: 204|204
A60: 1 | B60: 9 | C60: 5 | D60: 71302 | E60: 2|3 | F60: 240|240
A61: 1 | B61: 10 | C61: 0 | D61: 71303 | E61: 2|3 | F61: 60|60
A62: 1 | B62: 10 | C62: 1 | D62: 71303 | E62: 2|3 | F62: 96|96
A63: 1 | B63: 10 | C63: 2 | D63: 71303 | E63: 2|3 | F63: 132|132
A64: 1 | B64: 10 | C64: 3 | D64: 71303 | E64: 2|3 | F64: 168|168
A65: 1 | B65: 10 | C65: 4 | D65: 71303 | E65: 2|3 | F65: 204|204
A66: 1 | B66: 10 | C66: 5 | D66: 71303 | E66: 2|3 | F66: 240|240
A67: 1 | B67: 11 | C67: 0 | D67: 71304 | E67: 2|3 | F67: 60|60
A68: 1 | B68: 11 | C68: 1 | D68: 71304 | E68: 2|3 | F68: 96|96
A69: 1 | B69: 11 | C69: 2 | D69: 71304 | E69: 2|3 | F69: 132|132
A70: 1 | B70: 11 | C70: 3 | D70: 71304 | E70: 2|3 | F70: 168|168
A71: 1 | B71: 11 | C71: 4 | D71: 71304 | E71: 2|3 | F71: 204|204
A72: 1 | B72: 11 | C72: 5 | D72: 71304 | E72: 2|3 | F72: 240|240
A73: 1 | B73: 12 | C73: 0 | D73: 71305 | E73: 2|3 | F73: 60|60
A74: 1 | B74: 12 | C74: 1 | D74: 71305 | E74: 2|3 | F74: 96|96
A75: 1 | B75: 12 | C75: 2 | D75: 71305 | E75: 2|3 | F75: 132|132
A76: 1 | B76: 12 | C76: 3 | D76: 71305 | E76: 2|3 | F76: 168|168
A77: 1 | B77: 12 | C77: 4 | D77: 71305 | E77: 2|3 | F77: 204|204
A78: 1 | B78: 12 | C78: 5 | D78: 71305 | E78: 2|3 | F78: 240|240
A79: 1 | B79: 13 | C79: 0 | D79: 72300 | E79: 2|3 | F79: 60|60
A80: 1 | B80: 13 | C80: 1 | D80: 72300 | E80: 2|3 | F80: 96|96
A81: 1 | B81: 13 | C81: 2 | D81: 72300 | E81: 2|3 | F81: 132|132
A82: 1 | B82: 13 | C82: 3 | D82: 72300 | E82: 2|3 | F82: 168|168
A83: 1 | B83: 13 | C83: 4 | D83: 72300 | E83: 2|3 | F83: 204|204
A84: 1 | B84: 13 | C84: 5 | D84: 72300 | E84: 2|3 | F84: 240|240
A85: 1 | B85: 14 | C85: 0 | D85: 72301 | E85: 2|3 | F85: 60|60
A86: 1 | B86: 14 | C86: 1 | D86: 72301 | E86: 2|3 | F86: 96|96
A87: 1 | B87: 14 | C87: 2 | D87: 72301 | E87: 2|3 | F87: 132|132
A88: 1 | B88: 14 | C88: 3 | D88: 72301 | E88: 2|3 | F88: 168|168
A89: 1 | B89: 14 | C89: 4 | D89: 72301 | E89: 2|3 | F89: 204|204
A90: 1 | B90: 14 | C90: 5 | D90: 72301 | E90: 2|3 | F90: 240|240
A91: 1 | B91: 15 | C91: 0 | D91: 72302 | E91: 2|3 | F91: 60|60
A92: 1 | B92: 15 | C92: 1 | D92: 72302 | E92: 2|3 | F92: 96|96
A93: 1 | B93: 15 | C93: 2 | D93: 72302 | E93: 2|3 | F93: 132|132
A94: 1 | B94: 15 | C94: 3 | D94: 72302 | E94: 2|3 | F94: 168|168
A95: 1 | B95: 15 | C95: 4 | D95: 72302 | E95: 2|3 | F95: 204|204
A96: 1 | B96: 15 | C96: 5 | D96: 72302 | E96: 2|3 | F96: 240|240
A97: 1 | B97: 16 | C97: 0 | D97: 72303 | E97: 2|3 | F97: 60|60
A98: 1 | B98: 16 | C98: 1 | D98: 72303 | E98: 2|3 | F98: 96|96
A99: 1 | B99: 16 | C99: 2 | D99: 72303 | E99: 2|3 | F99: 132|132
A100: 1 | B100: 16 | C100: 3 | D100: 72303 | E100: 2|3 | F100: 168|168
A101: 1 | B101: 16 | C101: 4 | D101: 72303 | E101: 2|3 | F101: 204|204
A102: 1 | B102: 16 | C102: 5 | D102: 72303 | E102: 2|3 | F102: 240|240
A103: 1 | B103: 17 | C103: 0 | D103: 72304 | E103: 2|3 | F103: 60|60
A104: 1 | B104: 17 | C104: 1 | D104: 72304 | E104: 2|3 | F104: 96|96
A105: 1 | B105: 17 | C105: 2 | D105: 72304 | E105: 2|3 | F105: 132|132
A106: 1 | B106: 17 | C106: 3 | D106: 72304 | E106: 2|3 | F106: 168|168
A107: 1 | B107: 17 | C107: 4 | D107: 72304 | E107: 2|3 | F107: 204|204
A108: 1 | B108: 17 | C108: 5 | D108: 72304 | E108: 2|3 | F108: 240|240
A109: 1 | B109: 18 | C109: 0 | D109: 72305 | E109: 2|3 | F109: 60|60
A110: 1 | B110: 18 | C110: 1 | D110: 72305 | E110: 2|3 | F110: 96|96
A111: 1 | B111: 18 | C111: 2 | D111: 72305 | E111: 2|3 | F111: 132|132
A112: 1 | B112: 18 | C112: 3 | D112: 72305 | E112: 2|3 | F112: 168|168
A113: 1 | B113: 18 | C113: 4 | D113: 72305 | E113: 2|3 | F113: 204|204
A114: 1 | B114: 18 | C114: 5 | D114: 72305 | E114: 2|3 | F114: 240|240
A115: 1 | B115: 19 | C115: 0 | D115: 73300 | E115: 1|4 | F115: 50|200
A116: 1 | B116: 19 | C116: 1 | D116: 73300 | E116: 1|4 | F116: 80|320
A117: 1 | B117: 19 | C117: 2 | D117: 73300 | E117: 1|4 | F117: 110|440
A118: 1 | B118: 19 | C118: 3 | D118: 73300 | E118: 1|4 | F118: 140|560
A119: 1 | B119: 19 | C119: 4 | D119: 73300 | E119: 1|4 | F119: 170|680
A120: 1 | B120: 19 | C120: 5 | D120: 73300 | E120: 1|4 | F120: 200|800
A121: 1 | B121: 20 | C121: 0 | D121: 73301 | E121: 1|4 | F121: 50|200
A122: 1 | B122: 20 | C122: 1 | D122: 73301 | E122: 1|4 | F122: 80|320
A123: 1 | B123: 20 | C123: 2 | D123: 73301 | E123: 1|4 | F123: 110|440
A124: 1 | B124: 20 | C124: 3 | D124: 73301 | E124: 1|4 | F124: 140|560
A125: 1 | B125: 20 | C125: 4 | D125: 73301 | E125: 1|4 | F125: 170|680
A126: 1 | B126: 20 | C126: 5 | D126: 73301 | E126: 1|4 | F126: 200|800
A127: 1 | B127: 21 | C127: 0 | D127: 73302 | E127: 1|4 | F127: 50|200
A128: 1 | B128: 21 | C128: 1 | D128: 73302 | E128: 1|4 | F128: 80|320
A129: 1 | B129: 21 | C129: 2 | D129: 73302 | E129: 1|4 | F129: 110|440
A130: 1 | B130: 21 | C130: 3 | D130: 73302 | E130: 1|4 | F130: 140|560
A131: 1 | B131: 21 | C131: 4 | D131: 73302 | E131: 1|4 | F131: 170|680
A132: 1 | B132: 21 | C132: 5 | D132: 73302 | E132: 1|4 | F132: 200|800
A133: 1 | B133: 22 | C133: 0 | D133: 73303 | E133: 1|4 | F133: 50|200
A134: 1 | B134: 22 | C134: 1 | D134: 73303 | E134: 1|4 | F134: 80|320
A135: 1 | B135: 22 | C135: 2 | D135: 73303 | E135: 1|4 | F135: 110|440
A136: 1 | B136: 22 | C136: 3 | D136: 73303 | E136: 1|4 | F136: 140|560
A137: 1 | B137: 22 | C137: 4 | D137: 73303 | E137: 1|4 | F137: 170|680
A138: 1 | B138: 22 | C138: 5 | D138: 73303 | E138: 1|4 | F138: 200|800
A139: 1 | B139: 23 | C139: 0 | D139: 73304 | E139: 1|4 | F139: 50|200
A140: 1 | B140: 23 | C140: 1 | D140: 73304 | E140: 1|4 | F140: 80|320
A141: 1 | B141: 23 | C141: 2 | D141: 73304 | E141: 1|4 | F141: 110|440
A142: 1 | B142: 23 | C142: 3 | D142: 73304 | E142: 1|4 | F142: 140|560
A143: 1 | B143: 23 | C143: 4 | D143: 73304 | E143: 1|4 | F143: 170|680
A144: 1 | B144: 23 | C144: 5 | D144: 73304 | E144: 1|4 | F144: 200|800
A145: 1 | B145: 24 | C145: 0 | D145: 73305 | E145: 1|4 | F145: 50|200
A146: 1 | B146: 24 | C146: 1 | D146: 73305 | E146: 1|4 | F146: 80|320
A147: 1 | B147: 24 | C147: 2 | D147: 73305 | E147: 1|4 | F147: 110|440
A148: 1 | B148: 24 | C148: 3 | D148: 73305 | E148: 1|4 | F148: 140|560
A149: 1 | B149: 24 | C149: 4 | D149: 73305 | E149: 1|4 | F149: 170|680
A150: 1 | B150: 24 | C150: 5 | D150: 73305 | E150: 1|4 | F150: 200|800
A151: 2 | B151: 25 | C151: 0 | D151: 70400 | E151: 1|4 | F151: 100|400
A152: 2 | B152: 25 | C152: 1 | D152: 70400 | E152: 1|4 | F152: 160|640
A153: 2 | B153: 25 | C153: 2 | D153: 70400 | E153: 1|4 | F153: 220|880
A154: 2 | B154: 25 | C154: 3 | D154: 70400 | E154: 1|4 | F154: 280|1120
A155: 2 | B155: 25 | C155: 4 | D155: 70400 | E155: 1|4 | F155: 340|1360
A156: 2 | B156: 25 | C156: 5 | D156: 70400 | E156: 1|4 | F156: 400|1600
A157: 2 | B157: 26 | C157: 0 | D157: 70401 | E157: 1|4 | F157: 100|400
A158: 2 | B158: 26 | C158: 1 | D158: 70401 | E158: 1|4 | F158: 160|640
A159: 2 | B159: 26 | C159: 2 | D159: 70401 | E159: 1|4 | F159: 220|880
A160: 2 | B160: 26 | C160: 3 | D160: 70401 | E160: 1|4 | F160: 280|1120
A161: 2 | B161: 26 | C161: 4 | D161: 70401 | E161: 1|4 | F161: 340|1360
A162: 2 | B162: 26 | C162: 5 | D162: 70401 | E162: 1|4 | F162: 400|1600
A163: 2 | B163: 27 | C163: 0 | D163: 70402 | E163: 1|4 | F163: 100|400
A164: 2 | B164: 27 | C164: 1 | D164: 70402 | E164: 1|4 | F164: 160|640
A165: 2 | B165: 27 | C165: 2 | D165: 70402 | E165: 1|4 | F165: 220|880
A166: 2 | B166: 27 | C166: 3 | D166: 70402 | E166: 1|4 | F166: 280|1120
A167: 2 | B167: 27 | C167: 4 | D167: 70402 | E167: 1|4 | F167: 340|1360
A168: 2 | B168: 27 | C168: 5 | D168: 70402 | E168: 1|4 | F168: 400|1600
A169: 2 | B169: 28 | C169: 0 | D169: 70403 | E169: 1|4 | F169: 100|400
A170: 2 | B170: 28 | C170: 1 | D170: 70403 | E170: 1|4 | F170: 160|640
A171: 2 | B171: 28 | C171: 2 | D171: 70403 | E171: 1|4 | F171: 220|880
A172: 2 | B172: 28 | C172: 3 | D172: 70403 | E172: 1|4 | F172: 280|1120
A173: 2 | B173: 28 | C173: 4 | D173: 70403 | E173: 1|4 | F173: 340|1360
A174: 2 | B174: 28 | C174: 5 | D174: 70403 | E174: 1|4 | F174: 400|1600
A175: 2 | B175: 29 | C175: 0 | D175: 70404 | E175: 1|4 | F175: 100|400
A176: 2 | B176: 29 | C176: 1 | D176: 70404 | E176: 1|4 | F176: 160|640
A177: 2 | B177: 29 | C177: 2 | D177: 70404 | E177: 1|4 | F177: 220|880
A178: 2 | B178: 29 | C178: 3 | D178: 70404 | E178: 1|4 | F178: 280|1120
A179: 2 | B179: 29 | C179: 4 | D179: 70404 | E179: 1|4 | F179: 340|1360
A180: 2 | B180: 29 | C180: 5 | D180: 70404 | E180: 1|4 | F180: 400|1600
A181: 2 | B181: 30 | C181: 0 | D181: 70405 | E181: 1|4 | F181: 100|400
A182: 2 | B182: 30 | C182: 1 | D182: 70405 | E182: 1|4 | F182: 160|640
A183: 2 | B183: 30 | C183: 2 | D183: 70405 | E183: 1|4 | F183: 220|880
A184: 2 | B184: 30 | C184: 3 | D184: 70405 | E184: 1|4 | F184: 280|1120
A185: 2 | B185: 30 | C185: 4 | D185: 70405 | E185: 1|4 | F185: 340|1360
A186: 2 | B186: 30 | C186: 5 | D186: 70405 | E186: 1|4 | F186: 400|1600
A187: 2 | B187: 31 | C187: 0 | D187: 71400 | E187: 2|3 | F187: 120|120
A188: 2 | B188: 31 | C188: 1 | D188: 71400 | E188: 2|3 | F188: 192|192
A189: 2 | B189: 31 | C189: 2 | D189: 71400 | E189: 2|3 | F189: 264|264
A190: 2 | B190: 31 | C190: 3 | D190: 71400 | E190: 2|3 | F190: 336|336
A191: 2 | B191: 31 | C191: 4 | D191: 71400 | E191: 2|3 | F191: 408|408
A192: 2 | B192: 31 | C192: 5 | D192: 71400 | E192: 2|3 | F192: 480|480
A193: 2 | B193: 32 | C193: 0 | D193: 71401 | E193: 2|3 | F193: 120|120
A194: 2 | B194: 32 | C194: 1 | D194: 71401 | E194: 2|3 | F194: 192|192
A195: 2 | B195: 32 | C195: 2 | D195: 71401 | E195: 2|3 | F195: 264|264
A196: 2 | B196: 32 | C196: 3 | D196: 71401 | E196: 2|3 | F196: 336|336
A197: 2 | B197: 32 | C197: 4 | D197: 71401 | E197: 2|3 | F197: 408|408
A198: 2 | B198: 32 | C198: 5 | D198: 71401 | E198: 2|3 | F198: 480|480
A199: 2 | B199: 33 | C199: 0 | D199: 71402 | E199: 2|3 | F199: 120|120
A200: 2 | B200: 33 | C200: 1 | D200: 71402 | E200: 2|3 | F200: 192|192
A201: 2 | B201: 33 | C201: 2 | D201: 71402 | E201: 2|3 | F201: 264|264
A202: 2 | B202: 33 | C202: 3 | D202: 71402 | E202: 2|3 | F202: 336|336
A203: 2 | B203: 33 | C203: 4 | D203: 71402 | E203: 2|3 | F203: 408|408
A204: 2 | B204: 33 | C204: 5 | D204: 71402 | E204: 2|3 | F204: 480|480
A205: 2 | B205: 34 | C205: 0 | D205: 71403 | E205: 2|3 | F205: 120|120
A206: 2 | B206: 34 | C206: 1 | D206: 71403 | E206: 2|3 | F206: 192|192
A207: 2 | B207: 34 | C207: 2 | D207: 71403 | E207: 2|3 | F207: 264|264
A208: 2 | B208: 34 | C208: 3 | D208: 71403 | E208: 2|3 | F208: 336|336
A209: 2 | B209: 34 | C209: 4 | D209: 71403 | E209: 2|3 | F209: 408|408
A210: 2 | B210: 34 | C210: 5 | D210: 71403 | E210: 2|3 | F210: 480|480
A211: 2 | B211: 35 | C211: 0 | D211: 71404 | E211: 2|3 | F211: 120|120
A212: 2 | B212: 35 | C212: 1 | D212: 71404 | E212: 2|3 | F212: 192|192
A213: 2 | B213: 35 | C213: 2 | D213: 71404 | E213: 2|3 | F213: 264|264
A214: 2 | B214: 35 | C214: 3 | D214: 71404 | E214: 2|3 | F214: 336|336
A215: 2 | B215: 35 | C215: 4 | D215: 71404 | E215: 2|3 | F215: 408|408
A216: 2 | B216: 35 | C216: 5 | D216: 71404 | E216: 2|3 | F216: 480|480
A217: 2 | B217: 36 | C217: 0 | D217: 71405 | E217: 2|3 | F217: 120|120
A218: 2 | B218: 36 | C218: 1 | D218: 71405 | E218: 2|3 | F218: 192|192
A219: 2 | B219: 36 | C219: 2 | D219: 71405 | E219: 2|3 | F219: 264|264
A220: 2 | B220: 36 | C220: 3 | D220: 71405 | E220: 2|3 | F220: 336|336
A221: 2 | B221: 36 | C221: 4 | D221: 71405 | E221: 2|3 | F221: 408|408
A222: 2 | B222: 36 | C222: 5 | D222: 71405 | E222: 2|3 | F222: 480|480
A223: 2 | B223: 37 | C223: 0 | D223: 72400 | E223: 2|3 | F223: 120|120
A224: 2 | B224: 37 | C224: 1 | D224: 72400 | E224: 2|3 | F224: 192|192
A225: 2 | B225: 37 | C225: 2 | D225: 72400 | E225: 2|3 | F225: 264|264
A226: 2 | B226: 37 | C226: 3 | D226: 72400 | E226: 2|3 | F226: 336|336
A227: 2 | B227: 37 | C227: 4 | D227: 72400 | E227: 2|3 | F227: 408|408
A228: 2 | B228: 37 | C228: 5 | D228: 72400 | E228: 2|3 | F228: 480|480
A229: 2 | B229: 38 | C229: 0 | D229: 72401 | E229: 2|3 | F229: 120|120
A230: 2 | B230: 38 | C230: 1 | D230: 72401 | E230: 2|3 | F230: 192|192
A231: 2 | B231: 38 | C231: 2 | D231: 72401 | E231: 2|3 | F231: 264|264
A232: 2 | B232: 38 | C232: 3 | D232: 72401 | E232: 2|3 | F232: 336|336
A233: 2 | B233: 38 | C233: 4 | D233: 72401 | E233: 2|3 | F233: 408|408
A234: 2 | B234: 38 | C234: 5 | D234: 72401 | E234: 2|3 | F234: 480|480
A235: 2 | B235: 39 | C235: 0 | D235: 72402 | E235: 2|3 | F235: 120|120
A236: 2 | B236: 39 | C236: 1 | D236: 72402 | E236: 2|3 | F236: 192|192
A237: 2 | B237: 39 | C237: 2 | D237: 72402 | E237: 2|3 | F237: 264|264
A238: 2 | B238: 39 | C238: 3 | D238: 72402 | E238: 2|3 | F238: 336|336
A239: 2 | B239: 39 | C239: 4 | D239: 72402 | E239: 2|3 | F239: 408|408
A240: 2 | B240: 39 | C240: 5 | D240: 72402 | E240: 2|3 | F240: 480|480
A241: 2 | B241: 40 | C241: 0 | D241: 72403 | E241: 2|3 | F241: 120|120
A242: 2 | B242: 40 | C242: 1 | D242: 72403 | E242: 2|3 | F242: 192|192
A243: 2 | B243: 40 | C243: 2 | D243: 72403 | E243: 2|3 | F243: 264|264
A244: 2 | B244: 40 | C244: 3 | D244: 72403 | E244: 2|3 | F244: 336|336
A245: 2 | B245: 40 | C245: 4 | D245: 72403 | E245: 2|3 | F245: 408|408
A246: 2 | B246: 40 | C246: 5 | D246: 72403 | E246: 2|3 | F246: 480|480
A247: 2 | B247: 41 | C247: 0 | D247: 72404 | E247: 2|3 | F247: 120|120
A248: 2 | B248: 41 | C248: 1 | D248: 72404 | E248: 2|3 | F248: 192|192
A249: 2 | B249: 41 | C249: 2 | D249: 72404 | E249: 2|3 | F249: 264|264
A250: 2 | B250: 41 | C250: 3 | D250: 72404 | E250: 2|3 | F250: 336|336
A251: 2 | B251: 41 | C251: 4 | D251: 72404 | E251: 2|3 | F251: 408|408
A252: 2 | B252: 41 | C252: 5 | D252: 72404 | E252: 2|3 | F252: 480|480
A253: 2 | B253: 42 | C253: 0 | D253: 72405 | E253: 2|3 | F253: 120|120
A254: 2 | B254: 42 | C254: 1 | D254: 72405 | E254: 2|3 | F254: 192|192
A255: 2 | B255: 42 | C255: 2 | D255: 72405 | E255: 2|3 | F255: 264|264
A256: 2 | B256: 42 | C256: 3 | D256: 72405 | E256: 2|3 | F256: 336|336
A257: 2 | B257: 42 | C257: 4 | D257: 72405 | E257: 2|3 | F257: 408|408
A258: 2 | B258: 42 | C258: 5 | D258: 72405 | E258: 2|3 | F258: 480|480
A259: 2 | B259: 43 | C259: 0 | D259: 73400 | E259: 1|4 | F259: 100|400
A260: 2 | B260: 43 | C260: 1 | D260: 73400 | E260: 1|4 | F260: 160|640
A261: 2 | B261: 43 | C261: 2 | D261: 73400 | E261: 1|4 | F261: 220|880
A262: 2 | B262: 43 | C262: 3 | D262: 73400 | E262: 1|4 | F262: 280|1120
A263: 2 | B263: 43 | C263: 4 | D263: 73400 | E263: 1|4 | F263: 340|1360
A264: 2 | B264: 43 | C264: 5 | D264: 73400 | E264: 1|4 | F264: 400|1600
A265: 2 | B265: 44 | C265: 0 | D265: 73401 | E265: 1|4 | F265: 100|400
A266: 2 | B266: 44 | C266: 1 | D266: 73401 | E266: 1|4 | F266: 160|640
A267: 2 | B267: 44 | C267: 2 | D267: 73401 | E267: 1|4 | F267: 220|880
A268: 2 | B268: 44 | C268: 3 | D268: 73401 | E268: 1|4 | F268: 280|1120
A269: 2 | B269: 44 | C269: 4 | D269: 73401 | E269: 1|4 | F269: 340|1360
A270: 2 | B270: 44 | C270: 5 | D270: 73401 | E270: 1|4 | F270: 400|1600
A271: 2 | B271: 45 | C271: 0 | D271: 73402 | E271: 1|4 | F271: 100|400
A272: 2 | B272: 45 | C272: 1 | D272: 73402 | E272: 1|4 | F272: 160|640
A273: 2 | B273: 45 | C273: 2 | D273: 73402 | E273: 1|4 | F273: 220|880
A274: 2 | B274: 45 | C274: 3 | D274: 73402 | E274: 1|4 | F274: 280|1120
A275: 2 | B275: 45 | C275: 4 | D275: 73402 | E275: 1|4 | F275: 340|1360
A276: 2 | B276: 45 | C276: 5 | D276: 73402 | E276: 1|4 | F276: 400|1600
A277: 2 | B277: 46 | C277: 0 | D277: 73403 | E277: 1|4 | F277: 100|400
A278: 2 | B278: 46 | C278: 1 | D278: 73403 | E278: 1|4 | F278: 160|640
A279: 2 | B279: 46 | C279: 2 | D279: 73403 | E279: 1|4 | F279: 220|880
A280: 2 | B280: 46 | C280: 3 | D280: 73403 | E280: 1|4 | F280: 280|1120
A281: 2 | B281: 46 | C281: 4 | D281: 73403 | E281: 1|4 | F281: 340|1360
A282: 2 | B282: 46 | C282: 5 | D282: 73403 | E282: 1|4 | F282: 400|1600
A283: 2 | B283: 47 | C283: 0 | D283: 73404 | E283: 1|4 | F283: 100|400
A284: 2 | B284: 47 | C284: 1 | D284: 73404 | E284: 1|4 | F284: 160|640
A285: 2 | B285: 47 | C285: 2 | D285: 73404 | E285: 1|4 | F285: 220|880
A286: 2 | B286: 47 | C286: 3 | D286: 73404 | E286: 1|4 | F286: 280|1120
A287: 2 | B287: 47 | C287: 4 | D287: 73404 | E287: 1|4 | F287: 340|1360
A288: 2 | B288: 47 | C288: 5 | D288: 73404 | E288: 1|4 | F288: 400|1600
A289: 2 | B289: 48 | C289: 0 | D289: 73405 | E289: 1|4 | F289: 100|400
A290: 2 | B290: 48 | C290: 1 | D290: 73405 | E290: 1|4 | F290: 160|640
A291: 2 | B291: 48 | C291: 2 | D291: 73405 | E291: 1|4 | F291: 220|880
A292: 2 | B292: 48 | C292: 3 | D292: 73405 | E292: 1|4 | F292: 280|1120
A293: 2 | B293: 48 | C293: 4 | D293: 73405 | E293: 1|4 | F293: 340|1360
A294: 2 | B294: 48 | C294: 5 | D294: 73405 | E294: 1|4 | F294: 400|1600

Sheet: 2.仙灵
A1: id|id | B1: name| | C1: type| | D1: quality|quality | E1: to_exp|to_exp | F1: base_pro_type_list|base_pro_type_list | G1: base_pro_value_list|base_pro_value_list | H1: level_up_pro_type_list|level_up_pro_type_list | I1: level_up_pro_value_list|level_up_pro_value_list | J1: break_pro_type_list|break_pro_type_list | K1: break_pro_value_list|break_pro_value_list | L1: description| | M1: systemid|
A2: 不可空 | B2: 不可空 | C2: 不可空 | D2: 不可空 | E2: 不可空 | F2: 不可空 | G2: 不可空 | H2: 不可空 | I2: 不可空 | J2: 不可空 | K2: 不可空 | L2: 不可空 | M2: 可空#不需字段
A3: 数字 | B3: 字符串 | C3: 数字 | D3: 数字 | E3: 数字 | F3: 一维数组 | G3: 一维数组 | H3: 一维数组 | I3: 一维数组 | J3: 一维数组 | K3: 一维数组 | L3: 字符串 | M3: 一维数组
F4: 不定长 | G4: 不定长 | H4: 不定长 | I4: 不定长 | J4: 不定长 | K4: 不定长 | M4: 不定长
A6: 将灵ID | B6: 名称 | C6: 类型 | D6: 品质 | E6: 作为升级材料获得的经验 | F6: 基础属性类型列表 | G6: 基础属性值列表 | H6: 升级属性类型列表 | I6: 升级属性值列表 | J6: 突破属性类型列表 | K6: 突破属性值列表 | L6: 描述 | M6: 整装获取途径
A7: 70001 | B7: =VLOOKUP(INT(MOD(RC[-1],1000)/100),Sheet1!R2C11:R8C12,2,FALSE)&VLOOKUP(INT(MOD(RC[-1],10000)/1000),Sheet1!R2C1:R7C4,3,FALSE)&VLOOKUP(INT(MOD(RC[-1],10)/1),Sheet1!R2C6:R9C9,3,FALSE) -> 白品尖锐鹰眼 | C7: =INT(MOD(RC[-2],10000)/1000)*10+MOD(RC[-2],10) -> 1 | D7: =INT(MOD(RC[-3],1000)/100) -> 0 | E7: =2^RC[-1]*100 -> 100 | F7: 100|100 | G7: =VLOOKUP(INT(MOD(RC[-6],10000)/1000),Sheet1!R2C1:R7C4,4,FALSE)&"|"&VLOOKUP(INT(MOD(RC[-6],10)/1),Sheet1!R2C6:R9C9,4,FALSE) -> 1|11 | H7: =VLOOKUP(INT(MOD(RC[-7],10000)/1000),Sheet1!R2C1:R7C4,4,FALSE) -> 1 | I7: 1 | J7: =VLOOKUP(INT(MOD(RC[-9],10)/1),Sheet1!R2C6:R9C9,4,FALSE) -> 11 | K7: 100 | L7: 一二三四五六七八九十一二三四五六七八九十 | M7: 26
A8: 70002 | B8: =VLOOKUP(INT(MOD(RC[-1],1000)/100),Sheet1!R2C11:R8C12,2,FALSE)&VLOOKUP(INT(MOD(RC[-1],10000)/1000),Sheet1!R2C1:R7C4,3,FALSE)&VLOOKUP(INT(MOD(RC[-1],10)/1),Sheet1!R2C6:R9C9,3,FALSE) -> 白品尖锐灵巧 | C8: =INT(MOD(RC[-2],10000)/1000)*10+MOD(RC[-2],10) -> 2 | D8: =INT(MOD(RC[-3],1000)/100) -> 0 | E8: =2^RC[-1]*100 -> 100 | F8: 100|100 | G8: =VLOOKUP(INT(MOD(RC[-6],10000)/1000),Sheet1!R2C1:R7C4,4,FALSE)&"|"&VLOOKUP(INT(MOD(RC[-6],10)/1),Sheet1!R2C6:R9C9,4,FALSE) -> 1|12 | H8: =VLOOKUP(INT(MOD(RC[-7],10000)/1000),Sheet1!R2C1:R7C4,4,FALSE) -> 1 | I8: 1 | J8: =VLOOKUP(INT(MOD(RC[-9],10)/1),Sheet1!R2C6:R9C9,4,FALSE) -> 12 | K8: 100 | L8: 一二三四五六七八九十一二三四五六七八九十 | M8: 33
A9: 70003 | B9: =VLOOKUP(INT(MOD(RC[-1],1000)/100),Sheet1!R2C11:R8C12,2,FALSE)&VLOOKUP(INT(MOD(RC[-1],10000)/1000),Sheet1!R2C1:R7C4,3,FALSE)&VLOOKUP(INT(MOD(RC[-1],10)/1),Sheet1!R2C6:R9C9,3,FALSE) -> 白品尖锐会心 | C9: =INT(MOD(RC[-2],10000)/1000)*10+MOD(RC[-2],10) -> 3 | D9: =INT(MOD(RC[-3],1000)/100) -> 0 | E9: =2^RC[-1]*100 -> 100 | F9: 100|100 | G9: =VLOOKUP(INT(MOD(RC[-6],10000)/1000),Sheet1!R2C1:R7C4,4,FALSE)&"|"&VLOOKUP(INT(MOD(RC[-6],10)/1),Sheet1!R2C6:R9C9,4,FALSE) -> 1|13 | H9: =VLOOKUP(INT(MOD(RC[-7],10000)/1000),Sheet1!R2C1:R7C4,4,FALSE) -> 1 | I9: 1 | J9: =VLOOKUP(INT(MOD(RC[-9],10)/1),Sheet1!R2C6:R9C9,4,FALSE) -> 13 | K9: 100 | L9: 一二三四五六七八九十一二三四五六七八九十 | M9: 26
A10: 70004 | B10: =VLOOKUP(INT(MOD(RC[-1],1000)/100),Sheet1!R2C11:R8C12,2,FALSE)&VLOOKUP(INT(MOD(RC[-1],10000)/1000),Sheet1!R2C1:R7C4,3,FALSE)&VLOOKUP(INT(MOD(RC[-1],10)/1),Sheet1!R2C6:R9C9,3,FALSE) -> 白品尖锐坚韧 | C10: =INT(MOD(RC[-2],10000)/1000)*10+MOD(RC[-2],10) -> 4 | D10: =INT(MOD(RC[-3],1000)/100) -> 0 | E10: =2^RC[-1]*100 -> 100 | F10: 100|100 | G10: =VLOOKUP(INT(MOD(RC[-6],10000)/1000),Sheet1!R2C1:R7C4,4,FALSE)&"|"&VLOOKUP(INT(MOD(RC[-6],10)/1),Sheet1!R2C6:R9C9,4,FALSE) -> 1|14 | H10: =VLOOKUP(INT(MOD(RC[-7],10000)/1000),Sheet1!R2C1:R7C4,4,FALSE) -> 1 | I10: 1 | J10: =VLOOKUP(INT(MOD(RC[-9],10)/1),Sheet1!R2C6:R9C9,4,FALSE) -> 14 | K10: 100 | L10: 一二三四五六七八九十一二三四五六七八九十 | M10: 33
A11: 70005 | B11: =VLOOKUP(INT(MOD(RC[-1],1000)/100),Sheet1!R2C11:R8C12,2,FALSE)&VLOOKUP(INT(MOD(RC[-1],10000)/1000),Sheet1!R2C1:R7C4,3,FALSE)&VLOOKUP(INT(MOD(RC[-1],10)/1),Sheet1!R2C6:R9C9,3,FALSE) -> 白品尖锐要害 | C11: =INT(MOD(RC[-2],10000)/1000)*10+MOD(RC[-2],10) -> 5 | D11: =INT(MOD(RC[-3],1000)/100) -> 0 | E11: =2^RC[-1]*100 -> 100 | F11: 100|100 | G11: =VLOOKUP(INT(MOD(RC[-6],10000)/1000),Sheet1!R2C1:R7C4,4,FALSE)&"|"&VLOOKUP(INT(MOD(RC[-6],10)/1),Sheet1!R2C6:R9C9,4,FALSE) -> 1|7 | H11: =VLOOKUP(INT(MOD(RC[-7],10000)/1000),Sheet1!R2C1:R7C4,4,FALSE) -> 1 | I11: 1 | J11: =VLOOKUP(INT(MOD(RC[-9],10)/1),Sheet1!R2C6:R9C9,4,FALSE) -> 7 | K11: 100 | L11: 一二三四五六七八九十一二三四五六七八九十 | M11: 26
A12: 70006 | B12: =VLOOKUP(INT(MOD(RC[-1],1000)/100),Sheet1!R2C11:R8C12,2,FALSE)&VLOOKUP(INT(MOD(RC[-1],10000)/1000),Sheet1!R2C1:R7C4,3,FALSE)&VLOOKUP(INT(MOD(RC[-1],10)/1),Sheet1!R2C6:R9C9,3,FALSE) -> 白品尖锐护盾 | C12: =INT(MOD(RC[-2],10000)/1000)*10+MOD(RC[-2],10) -> 6 | D12: =INT(MOD(RC[-3],1000)/100) -> 0 | E12: =2^RC[-1]*100 -> 100 | F12: 100|100 | G12: =VLOOKUP(INT(MOD(RC[-6],10000)/1000),Sheet1!R2C1:R7C4,4,FALSE)&"|"&VLOOKUP(INT(MOD(RC[-6],10)/1),Sheet1!R2C6:R9C9,4,FALSE) -> 1|5 | H12: =VLOOKUP(INT(MOD(RC[-7],10000)/1000),Sheet1!R2C1:R7C4,4,FALSE) -> 1 | I12: 1 | J12: =VLOOKUP(INT(MOD(RC[-9],10)/1),Sheet1!R2C6:R9C9,4,FALSE) -> 5 | K12: 100 | L12: 一二三四五六七八九十一二三四五六七八九十 | M12: 33
A13: 70101 | B13: =VLOOKUP(INT(MOD(RC[-1],1000)/100),Sheet1!R2C11:R8C12,2,FALSE)&VLOOKUP(INT(MOD(RC[-1],10000)/1000),Sheet1!R2C1:R7C4,3,FALSE)&VLOOKUP(INT(MOD(RC[-1],10)/1),Sheet1!R2C6:R9C9,3,FALSE) -> 绿品尖锐鹰眼 | C13: =INT(MOD(RC[-2],10000)/1000)*10+MOD(RC[-2],10) -> 1 | D13: =INT(MOD(RC[-3],1000)/100) -> 1 | E13: =2^RC[-1]*100 -> 200 | F13: 100|100 | G13: =VLOOKUP(INT(MOD(RC[-6],10000)/1000),Sheet1!R2C1:R7C4,4,FALSE)&"|"&VLOOKUP(INT(MOD(RC[-6],10)/1),Sheet1!R2C6:R9C9,4,FALSE) -> 1|11 | H13: =VLOOKUP(INT(MOD(RC[-7],10000)/1000),Sheet1!R2C1:R7C4,4,FALSE) -> 1 | I13: 1 | J13: =VLOOKUP(INT(MOD(RC[-9],10)/1),Sheet1!R2C6:R9C9,4,FALSE) -> 11 | K13: 100 | L13: 一二三四五六七八九十一二三四五六七八九十 | M13: 26
A14: 70102 | B14: =VLOOKUP(INT(MOD(RC[-1],1000)/100),Sheet1!R2C11:R8C12,2,FALSE)&VLOOKUP(INT(MOD(RC[-1],10000)/1000),Sheet1!R2C1:R7C4,3,FALSE)&VLOOKUP(INT(MOD(RC[-1],10)/1),Sheet1!R2C6:R9C9,3,FALSE) -> 绿品尖锐灵巧 | C14: =INT(MOD(RC[-2],10000)/1000)*10+MOD(RC[-2],10) -> 2 | D14: =INT(MOD(RC[-3],1000)/100) -> 1 | E14: =2^RC[-1]*100 -> 200 | F14: 100|100 | G14: =VLOOKUP(INT(MOD(RC[-6],10000)/1000),Sheet1!R2C1:R7C4,4,FALSE)&"|"&VLOOKUP(INT(MOD(RC[-6],10)/1),Sheet1!R2C6:R9C9,4,FALSE) -> 1|12 | H14: =VLOOKUP(INT(MOD(RC[-7],10000)/1000),Sheet1!R2C1:R7C4,4,FALSE) -> 1 | I14: 1 | J14: =VLOOKUP(INT(MOD(RC[-9],10)/1),Sheet1!R2C6:R9C9,4,FALSE) -> 12 | K14: 100 | L14: 一二三四五六七八九十一二三四五六七八九十 | M14: 33
A15: 70103 | B15: =VLOOKUP(INT(MOD(RC[-1],1000)/100),Sheet1!R2C11:R8C12,2,FALSE)&VLOOKUP(INT(MOD(RC[-1],10000)/1000),Sheet1!R2C1:R7C4,3,FALSE)&VLOOKUP(INT(MOD(RC[-1],10)/1),Sheet1!R2C6:R9C9,3,FALSE) -> 绿品尖锐会心 | C15: =INT(MOD(RC[-2],10000)/1000)*10+MOD(RC[-2],10) -> 3 | D15: =INT(MOD(RC[-3],1000)/100) -> 1 | E15: =2^RC[-1]*100 -> 200 | F15: 100|100 | G15: =VLOOKUP(INT(MOD(RC[-6],10000)/1000),Sheet1!R2C1:R7C4,4,FALSE)&"|"&VLOOKUP(INT(MOD(RC[-6],10)/1),Sheet1!R2C6:R9C9,4,FALSE) -> 1|13 | H15: =VLOOKUP(INT(MOD(RC[-7],10000)/1000),Sheet1!R2C1:R7C4,4,FALSE) -> 1 | I15: 1 | J15: =VLOOKUP(INT(MOD(RC[-9],10)/1),Sheet1!R2C6:R9C9,4,FALSE) -> 13 | K15: 100 | L15: 一二三四五六七八九十一二三四五六七八九十 | M15: 26
A16: 70104 | B16: =VLOOKUP(INT(MOD(RC[-1],1000)/100),Sheet1!R2C11:R8C12,2,FALSE)&VLOOKUP(INT(MOD(RC[-1],10000)/1000),Sheet1!R2C1:R7C4,3,FALSE)&VLOOKUP(INT(MOD(RC[-1],10)/1),Sheet1!R2C6:R9C9,3,FALSE) -> 绿品尖锐坚韧 | C16: =INT(MOD(RC[-2],10000)/1000)*10+MOD(RC[-2],10) -> 4 | D16: =INT(MOD(RC[-3],1000)/100) -> 1 | E16: =2^RC[-1]*100 -> 200 | F16: 100|100 | G16: =VLOOKUP(INT(MOD(RC[-6],10000)/1000),Sheet1!R2C1:R7C4,4,FALSE)&"|"&VLOOKUP(INT(MOD(RC[-6],10)/1),Sheet1!R2C6:R9C9,4,FALSE) -> 1|14 | H16: =VLOOKUP(INT(MOD(RC[-7],10000)/1000),Sheet1!R2C1:R7C4,4,FALSE) -> 1 | I16: 1 | J16: =VLOOKUP(INT(MOD(RC[-9],10)/1),Sheet1!R2C6:R9C9,4,FALSE) -> 14 | K16: 100 | L16: 一二三四五六七八九十一二三四五六七八九十 | M16: 33
A17: 70105 | B17: =VLOOKUP(INT(MOD(RC[-1],1000)/100),Sheet1!R2C11:R8C12,2,FALSE)&VLOOKUP(INT(MOD(RC[-1],10000)/1000),Sheet1!R2C1:R7C4,3,FALSE)&VLOOKUP(INT(MOD(RC[-1],10)/1),Sheet1!R2C6:R9C9,3,FALSE) -> 绿品尖锐要害 | C17: =INT(MOD(RC[-2],10000)/1000)*10+MOD(RC[-2],10) -> 5 | D17: =INT(MOD(RC[-3],1000)/100) -> 1 | E17: =2^RC[-1]*100 -> 200 | F17: 100|100 | G17: =VLOOKUP(INT(MOD(RC[-6],10000)/1000),Sheet1!R2C1:R7C4,4,FALSE)&"|"&VLOOKUP(INT(MOD(RC[-6],10)/1),Sheet1!R2C6:R9C9,4,FALSE) -> 1|7 | H17: =VLOOKUP(INT(MOD(RC[-7],10000)/1000),Sheet1!R2C1:R7C4,4,FALSE) -> 1 | I17: 1 | J17: =VLOOKUP(INT(MOD(RC[-9],10)/1),Sheet1!R2C6:R9C9,4,FALSE) -> 7 | K17: 100 | L17: 一二三四五六七八九十一二三四五六七八九十 | M17: 26
A18: 70106 | B18: =VLOOKUP(INT(MOD(RC[-1],1000)/100),Sheet1!R2C11:R8C12,2,FALSE)&VLOOKUP(INT(MOD(RC[-1],10000)/1000),Sheet1!R2C1:R7C4,3,FALSE)&VLOOKUP(INT(MOD(RC[-1],10)/1),Sheet1!R2C6:R9C9,3,FALSE) -> 绿品尖锐护盾 | C18: =INT(MOD(RC[-2],10000)/1000)*10+MOD(RC[-2],10) -> 6 | D18: =INT(MOD(RC[-3],1000)/100) -> 1 | E18: =2^RC[-1]*100 -> 200 | F18: 100|100 | G18: =VLOOKUP(INT(MOD(RC[-6],10000)/1000),Sheet1!R2C1:R7C4,4,FALSE)&"|"&VLOOKUP(INT(MOD(RC[-6],10)/1),Sheet1!R2C6:R9C9,4,FALSE) -> 1|5 | H18: =VLOOKUP(INT(MOD(RC[-7],10000)/1000),Sheet1!R2C1:R7C4,4,FALSE) -> 1 | I18: 1 | J18: =VLOOKUP(INT(MOD(RC[-9],10)/1),Sheet1!R2C6:R9C9,4,FALSE) -> 5 | K18: 100 | L18: 一二三四五六七八九十一二三四五六七八九十 | M18: 33
A19: 70201 | B19: =VLOOKUP(INT(MOD(RC[-1],1000)/100),Sheet1!R2C11:R8C12,2,FALSE)&VLOOKUP(INT(MOD(RC[-1],10000)/1000),Sheet1!R2C1:R7C4,3,FALSE)&VLOOKUP(INT(MOD(RC[-1],10)/1),Sheet1!R2C6:R9C9,3,FALSE) -> 蓝品尖锐鹰眼 | C19: =INT(MOD(RC[-2],10000)/1000)*10+MOD(RC[-2],10) -> 1 | D19: =INT(MOD(RC[-3],1000)/100) -> 2 | E19: =2^RC[-1]*100 -> 400 | F19: 100|100 | G19: =VLOOKUP(INT(MOD(RC[-6],10000)/1000),Sheet1!R2C1:R7C4,4,FALSE)&"|"&VLOOKUP(INT(MOD(RC[-6],10)/1),Sheet1!R2C6:R9C9,4,FALSE) -> 1|11 | H19: =VLOOKUP(INT(MOD(RC[-7],10000)/1000),Sheet1!R2C1:R7C4,4,FALSE) -> 1 | I19: 1 | J19: =VLOOKUP(INT(MOD(RC[-9],10)/1),Sheet1!R2C6:R9C9,4,FALSE) -> 11 | K19: 100 | L19: 一二三四五六七八九十一二三四五六七八九十 | M19: 26
A20: 70202 | B20: =VLOOKUP(INT(MOD(RC[-1],1000)/100),Sheet1!R2C11:R8C12,2,FALSE)&VLOOKUP(INT(MOD(RC[-1],10000)/1000),Sheet1!R2C1:R7C4,3,FALSE)&VLOOKUP(INT(MOD(RC[-1],10)/1),Sheet1!R2C6:R9C9,3,FALSE) -> 蓝品尖锐灵巧 | C20: =INT(MOD(RC[-2],10000)/1000)*10+MOD(RC[-2],10) -> 2 | D20: =INT(MOD(RC[-3],1000)/100) -> 2 | E20: =2^RC[-1]*100 -> 400 | F20: 100|100 | G20: =VLOOKUP(INT(MOD(RC[-6],10000)/1000),Sheet1!R2C1:R7C4,4,FALSE)&"|"&VLOOKUP(INT(MOD(RC[-6],10)/1),Sheet1!R2C6:R9C9,4,FALSE) -> 1|12 | H20: =VLOOKUP(INT(MOD(RC[-7],10000)/1000),Sheet1!R2C1:R7C4,4,FALSE) -> 1 | I20: 1 | J20: =VLOOKUP(INT(MOD(RC[-9],10)/1),Sheet1!R2C6:R9C9,4,FALSE) -> 12 | K20: 100 | L20: 一二三四五六七八九十一二三四五六七八九十 | M20: 33
A21: 70203 | B21: =VLOOKUP(INT(MOD(RC[-1],1000)/100),Sheet1!R2C11:R8C12,2,FALSE)&VLOOKUP(INT(MOD(RC[-1],10000)/1000),Sheet1!R2C1:R7C4,3,FALSE)&VLOOKUP(INT(MOD(RC[-1],10)/1),Sheet1!R2C6:R9C9,3,FALSE) -> 蓝品尖锐会心 | C21: =INT(MOD(RC[-2],10000)/1000)*10+MOD(RC[-2],10) -> 3 | D21: =INT(MOD(RC[-3],1000)/100) -> 2 | E21: =2^RC[-1]*100 -> 400 | F21: 100|100 | G21: =VLOOKUP(INT(MOD(RC[-6],10000)/1000),Sheet1!R2C1:R7C4,4,FALSE)&"|"&VLOOKUP(INT(MOD(RC[-6],10)/1),Sheet1!R2C6:R9C9,4,FALSE) -> 1|13 | H21: =VLOOKUP(INT(MOD(RC[-7],10000)/1000),Sheet1!R2C1:R7C4,4,FALSE) -> 1 | I21: 1 | J21: =VLOOKUP(INT(MOD(RC[-9],10)/1),Sheet1!R2C6:R9C9,4,FALSE) -> 13 | K21: 100 | L21: 一二三四五六七八九十一二三四五六七八九十 | M21: 26
A22: 70204 | B22: =VLOOKUP(INT(MOD(RC[-1],1000)/100),Sheet1!R2C11:R8C12,2,FALSE)&VLOOKUP(INT(MOD(RC[-1],10000)/1000),Sheet1!R2C1:R7C4,3,FALSE)&VLOOKUP(INT(MOD(RC[-1],10)/1),Sheet1!R2C6:R9C9,3,FALSE) -> 蓝品尖锐坚韧 | C22: =INT(MOD(RC[-2],10000)/1000)*10+MOD(RC[-2],10) -> 4 | D22: =INT(MOD(RC[-3],1000)/100) -> 2 | E22: =2^RC[-1]*100 -> 400 | F22: 100|100 | G22: =VLOOKUP(INT(MOD(RC[-6],10000)/1000),Sheet1!R2C1:R7C4,4,FALSE)&"|"&VLOOKUP(INT(MOD(RC[-6],10)/1),Sheet1!R2C6:R9C9,4,FALSE) -> 1|14 | H22: =VLOOKUP(INT(MOD(RC[-7],10000)/1000),Sheet1!R2C1:R7C4,4,FALSE) -> 1 | I22: 1 | J22: =VLOOKUP(INT(MOD(RC[-9],10)/1),Sheet1!R2C6:R9C9,4,FALSE) -> 14 | K22: 100 | L22: 一二三四五六七八九十一二三四五六七八九十 | M22: 33
A23: 70205 | B23: =VLOOKUP(INT(MOD(RC[-1],1000)/100),Sheet1!R2C11:R8C12,2,FALSE)&VLOOKUP(INT(MOD(RC[-1],10000)/1000),Sheet1!R2C1:R7C4,3,FALSE)&VLOOKUP(INT(MOD(RC[-1],10)/1),Sheet1!R2C6:R9C9,3,FALSE) -> 蓝品尖锐要害 | C23: =INT(MOD(RC[-2],10000)/1000)*10+MOD(RC[-2],10) -> 5 | D23: =INT(MOD(RC[-3],1000)/100) -> 2 | E23: =2^RC[-1]*100 -> 400 | F23: 100|100 | G23: =VLOOKUP(INT(MOD(RC[-6],10000)/1000),Sheet1!R2C1:R7C4,4,FALSE)&"|"&VLOOKUP(INT(MOD(RC[-6],10)/1),Sheet1!R2C6:R9C9,4,FALSE) -> 1|7 | H23: =VLOOKUP(INT(MOD(RC[-7],10000)/1000),Sheet1!R2C1:R7C4,4,FALSE) -> 1 | I23: 1 | J23: =VLOOKUP(INT(MOD(RC[-9],10)/1),Sheet1!R2C6:R9C9,4,FALSE) -> 7 | K23: 100 | L23: 一二三四五六七八九十一二三四五六七八九十 | M23: 26
A24: 70206 | B24: =VLOOKUP(INT(MOD(RC[-1],1000)/100),Sheet1!R2C11:R8C12,2,FALSE)&VLOOKUP(INT(MOD(RC[-1],10000)/1000),Sheet1!R2C1:R7C4,3,FALSE)&VLOOKUP(INT(MOD(RC[-1],10)/1),Sheet1!R2C6:R9C9,3,FALSE) -> 蓝品尖锐护盾 | C24: =INT(MOD(RC[-2],10000)/1000)*10+MOD(RC[-2],10) -> 6 | D24: =INT(MOD(RC[-3],1000)/100) -> 2 | E24: =2^RC[-1]*100 -> 400 | F24: 100|100 | G24: =VLOOKUP(INT(MOD(RC[-6],10000)/1000),Sheet1!R2C1:R7C4,4,FALSE)&"|"&VLOOKUP(INT(MOD(RC[-6],10)/1),Sheet1!R2C6:R9C9,4,FALSE) -> 1|5 | H24: =VLOOKUP(INT(MOD(RC[-7],10000)/1000),Sheet1!R2C1:R7C4,4,FALSE) -> 1 | I24: 1 | J24: =VLOOKUP(INT(MOD(RC[-9],10)/1),Sheet1!R2C6:R9C9,4,FALSE) -> 5 | K24: 100 | L24: 一二三四五六七八九十一二三四五六七八九十 | M24: 33
A25: 70301 | B25: =VLOOKUP(INT(MOD(RC[-1],1000)/100),Sheet1!R2C11:R8C12,2,FALSE)&VLOOKUP(INT(MOD(RC[-1],10000)/1000),Sheet1!R2C1:R7C4,3,FALSE)&VLOOKUP(INT(MOD(RC[-1],10)/1),Sheet1!R2C6:R9C9,3,FALSE) -> 紫品尖锐鹰眼 | C25: =INT(MOD(RC[-2],10000)/1000)*10+MOD(RC[-2],10) -> 1 | D25: =INT(MOD(RC[-3],1000)/100) -> 3 | E25: =2^RC[-1]*100 -> 800 | F25: 100|100 | G25: =VLOOKUP(INT(MOD(RC[-6],10000)/1000),Sheet1!R2C1:R7C4,4,FALSE)&"|"&VLOOKUP(INT(MOD(RC[-6],10)/1),Sheet1!R2C6:R9C9,4,FALSE) -> 1|11 | H25: =VLOOKUP(INT(MOD(RC[-7],10000)/1000),Sheet1!R2C1:R7C4,4,FALSE) -> 1 | I25: 1 | J25: =VLOOKUP(INT(MOD(RC[-9],10)/1),Sheet1!R2C6:R9C9,4,FALSE) -> 11 | K25: 100 | L25: 一二三四五六七八九十一二三四五六七八九十 | M25: 26
A26: 70302 | B26: =VLOOKUP(INT(MOD(RC[-1],1000)/100),Sheet1!R2C11:R8C12,2,FALSE)&VLOOKUP(INT(MOD(RC[-1],10000)/1000),Sheet1!R2C1:R7C4,3,FALSE)&VLOOKUP(INT(MOD(RC[-1],10)/1),Sheet1!R2C6:R9C9,3,FALSE) -> 紫品尖锐灵巧 | C26: =INT(MOD(RC[-2],10000)/1000)*10+MOD(RC[-2],10) -> 2 | D26: =INT(MOD(RC[-3],1000)/100) -> 3 | E26: =2^RC[-1]*100 -> 800 | F26: 100|100 | G26: =VLOOKUP(INT(MOD(RC[-6],10000)/1000),Sheet1!R2C1:R7C4,4,FALSE)&"|"&VLOOKUP(INT(MOD(RC[-6],10)/1),Sheet1!R2C6:R9C9,4,FALSE) -> 1|12 | H26: =VLOOKUP(INT(MOD(RC[-7],10000)/1000),Sheet1!R2C1:R7C4,4,FALSE) -> 1 | I26: 1 | J26: =VLOOKUP(INT(MOD(RC[-9],10)/1),Sheet1!R2C6:R9C9,4,FALSE) -> 12 | K26: 100 | L26: 一二三四五六七八九十一二三四五六七八九十 | M26: 33
A27: 70303 | B27: =VLOOKUP(INT(MOD(RC[-1],1000)/100),Sheet1!R2C11:R8C12,2,FALSE)&VLOOKUP(INT(MOD(RC[-1],10000)/1000),Sheet1!R2C1:R7C4,3,FALSE)&VLOOKUP(INT(MOD(RC[-1],10)/1),Sheet1!R2C6:R9C9,3,FALSE) -> 紫品尖锐会心 | C27: =INT(MOD(RC[-2],10000)/1000)*10+MOD(RC[-2],10) -> 3 | D27: =INT(MOD(RC[-3],1000)/100) -> 3 | E27: =2^RC[-1]*100 -> 800 | F27: 100|100 | G27: =VLOOKUP(INT(MOD(RC[-6],10000)/1000),Sheet1!R2C1:R7C4,4,FALSE)&"|"&VLOOKUP(INT(MOD(RC[-6],10)/1),Sheet1!R2C6:R9C9,4,FALSE) -> 1|13 | H27: =VLOOKUP(INT(MOD(RC[-7],10000)/1000),Sheet1!R2C1:R7C4,4,FALSE) -> 1 | I27: 1 | J27: =VLOOKUP(INT(MOD(RC[-9],10)/1),Sheet1!R2C6:R9C9,4,FALSE) -> 13 | K27: 100 | L27: 一二三四五六七八九十一二三四五六七八九十 | M27: 26
A28: 70304 | B28: =VLOOKUP(INT(MOD(RC[-1],1000)/100),Sheet1!R2C11:R8C12,2,FALSE)&VLOOKUP(INT(MOD(RC[-1],10000)/1000),Sheet1!R2C1:R7C4,3,FALSE)&VLOOKUP(INT(MOD(RC[-1],10)/1),Sheet1!R2C6:R9C9,3,FALSE) -> 紫品尖锐坚韧 | C28: =INT(MOD(RC[-2],10000)/1000)*10+MOD(RC[-2],10) -> 4 | D28: =INT(MOD(RC[-3],1000)/100) -> 3 | E28: =2^RC[-1]*100 -> 800 | F28: 100|100 | G28: =VLOOKUP(INT(MOD(RC[-6],10000)/1000),Sheet1!R2C1:R7C4,4,FALSE)&"|"&VLOOKUP(INT(MOD(RC[-6],10)/1),Sheet1!R2C6:R9C9,4,FALSE) -> 1|14 | H28: =VLOOKUP(INT(MOD(RC[-7],10000)/1000),Sheet1!R2C1:R7C4,4,FALSE) -> 1 | I28: 1 | J28: =VLOOKUP(INT(MOD(RC[-9],10)/1),Sheet1!R2C6:R9C9,4,FALSE) -> 14 | K28: 100 | L28: 一二三四五六七八九十一二三四五六七八九十 | M28: 33
A29: 70305 | B29: =VLOOKUP(INT(MOD(RC[-1],1000)/100),Sheet1!R2C11:R8C12,2,FALSE)&VLOOKUP(INT(MOD(RC[-1],10000)/1000),Sheet1!R2C1:R7C4,3,FALSE)&VLOOKUP(INT(MOD(RC[-1],10)/1),Sheet1!R2C6:R9C9,3,FALSE) -> 紫品尖锐要害 | C29: =INT(MOD(RC[-2],10000)/1000)*10+MOD(RC[-2],10) -> 5 | D29: =INT(MOD(RC[-3],1000)/100) -> 3 | E29: =2^RC[-1]*100 -> 800 | F29: 100|100 | G29: =VLOOKUP(INT(MOD(RC[-6],10000)/1000),Sheet1!R2C1:R7C4,4,FALSE)&"|"&VLOOKUP(INT(MOD(RC[-6],10)/1),Sheet1!R2C6:R9C9,4,FALSE) -> 1|7 | H29: =VLOOKUP(INT(MOD(RC[-7],10000)/1000),Sheet1!R2C1:R7C4,4,FALSE) -> 1 | I29: 1 | J29: =VLOOKUP(INT(MOD(RC[-9],10)/1),Sheet1!R2C6:R9C9,4,FALSE) -> 7 | K29: 100 | L29: 一二三四五六七八九十一二三四五六七八九十 | M29: 26
A30: 70306 | B30: =VLOOKUP(INT(MOD(RC[-1],1000)/100),Sheet1!R2C11:R8C12,2,FALSE)&VLOOKUP(INT(MOD(RC[-1],10000)/1000),Sheet1!R2C1:R7C4,3,FALSE)&VLOOKUP(INT(MOD(RC[-1],10)/1),Sheet1!R2C6:R9C9,3,FALSE) -> 紫品尖锐护盾 | C30: =INT(MOD(RC[-2],10000)/1000)*10+MOD(RC[-2],10) -> 6 | D30: =INT(MOD(RC[-3],1000)/100) -> 3 | E30: =2^RC[-1]*100 -> 800 | F30: 100|100 | G30: =VLOOKUP(INT(MOD(RC[-6],10000)/1000),Sheet1!R2C1:R7C4,4,FALSE)&"|"&VLOOKUP(INT(MOD(RC[-6],10)/1),Sheet1!R2C6:R9C9,4,FALSE) -> 1|5 | H30: =VLOOKUP(INT(MOD(RC[-7],10000)/1000),Sheet1!R2C1:R7C4,4,FALSE) -> 1 | I30: 1 | J30: =VLOOKUP(INT(MOD(RC[-9],10)/1),Sheet1!R2C6:R9C9,4,FALSE) -> 5 | K30: 100 | L30: 一二三四五六七八九十一二三四五六七八九十 | M30: 33
A31: 70401 | B31: =VLOOKUP(INT(MOD(RC[-1],1000)/100),Sheet1!R2C11:R8C12,2,FALSE)&VLOOKUP(INT(MOD(RC[-1],10000)/1000),Sheet1!R2C1:R7C4,3,FALSE)&VLOOKUP(INT(MOD(RC[-1],10)/1),Sheet1!R2C6:R9C9,3,FALSE) -> 橙品尖锐鹰眼 | C31: =INT(MOD(RC[-2],10000)/1000)*10+MOD(RC[-2],10) -> 1 | D31: =INT(MOD(RC[-3],1000)/100) -> 4 | E31: =2^RC[-1]*100 -> 1600 | F31: 100|100 | G31: =VLOOKUP(INT(MOD(RC[-6],10000)/1000),Sheet1!R2C1:R7C4,4,FALSE)&"|"&VLOOKUP(INT(MOD(RC[-6],10)/1),Sheet1!R2C6:R9C9,4,FALSE) -> 1|11 | H31: =VLOOKUP(INT(MOD(RC[-7],10000)/1000),Sheet1!R2C1:R7C4,4,FALSE) -> 1 | I31: 1 | J31: =VLOOKUP(INT(MOD(RC[-9],10)/1),Sheet1!R2C6:R9C9,4,FALSE) -> 11 | K31: 100 | L31: 一二三四五六七八九十一二三四五六七八九十 | M31: 26
A32: 70402 | B32: =VLOOKUP(INT(MOD(RC[-1],1000)/100),Sheet1!R2C11:R8C12,2,FALSE)&VLOOKUP(INT(MOD(RC[-1],10000)/1000),Sheet1!R2C1:R7C4,3,FALSE)&VLOOKUP(INT(MOD(RC[-1],10)/1),Sheet1!R2C6:R9C9,3,FALSE) -> 橙品尖锐灵巧 | C32: =INT(MOD(RC[-2],10000)/1000)*10+MOD(RC[-2],10) -> 2 | D32: =INT(MOD(RC[-3],1000)/100) -> 4 | E32: =2^RC[-1]*100 -> 1600 | F32: 100|100 | G32: =VLOOKUP(INT(MOD(RC[-6],10000)/1000),Sheet1!R2C1:R7C4,4,FALSE)&"|"&VLOOKUP(INT(MOD(RC[-6],10)/1),Sheet1!R2C6:R9C9,4,FALSE) -> 1|12 | H32: =VLOOKUP(INT(MOD(RC[-7],10000)/1000),Sheet1!R2C1:R7C4,4,FALSE) -> 1 | I32: 1 | J32: =VLOOKUP(INT(MOD(RC[-9],10)/1),Sheet1!R2C6:R9C9,4,FALSE) -> 12 | K32: 100 | L32: 一二三四五六七八九十一二三四五六七八九十 | M32: 33
A33: 70403 | B33: =VLOOKUP(INT(MOD(RC[-1],1000)/100),Sheet1!R2C11:R8C12,2,FALSE)&VLOOKUP(INT(MOD(RC[-1],10000)/1000),Sheet1!R2C1:R7C4,3,FALSE)&VLOOKUP(INT(MOD(RC[-1],10)/1),Sheet1!R2C6:R9C9,3,FALSE) -> 橙品尖锐会心 | C33: =INT(MOD(RC[-2],10000)/1000)*10+MOD(RC[-2],10) -> 3 | D33: =INT(MOD(RC[-3],1000)/100) -> 4 | E33: =2^RC[-1]*100 -> 1600 | F33: 100|100 | G33: =VLOOKUP(INT(MOD(RC[-6],10000)/1000),Sheet1!R2C1:R7C4,4,FALSE)&"|"&VLOOKUP(INT(MOD(RC[-6],10)/1),Sheet1!R2C6:R9C9,4,FALSE) -> 1|13 | H33: =VLOOKUP(INT(MOD(RC[-7],10000)/1000),Sheet1!R2C1:R7C4,4,FALSE) -> 1 | I33: 1 | J33: =VLOOKUP(INT(MOD(RC[-9],10)/1),Sheet1!R2C6:R9C9,4,FALSE) -> 13 | K33: 100 | L33: 一二三四五六七八九十一二三四五六七八九十 | M33: 26
A34: 70404 | B34: =VLOOKUP(INT(MOD(RC[-1],1000)/100),Sheet1!R2C11:R8C12,2,FALSE)&VLOOKUP(INT(MOD(RC[-1],10000)/1000),Sheet1!R2C1:R7C4,3,FALSE)&VLOOKUP(INT(MOD(RC[-1],10)/1),Sheet1!R2C6:R9C9,3,FALSE) -> 橙品尖锐坚韧 | C34: =INT(MOD(RC[-2],10000)/1000)*10+MOD(RC[-2],10) -> 4 | D34: =INT(MOD(RC[-3],1000)/100) -> 4 | E34: =2^RC[-1]*100 -> 1600 | F34: 100|100 | G34: =VLOOKUP(INT(MOD(RC[-6],10000)/1000),Sheet1!R2C1:R7C4,4,FALSE)&"|"&VLOOKUP(INT(MOD(RC[-6],10)/1),Sheet1!R2C6:R9C9,4,FALSE) -> 1|14 | H34: =VLOOKUP(INT(MOD(RC[-7],10000)/1000),Sheet1!R2C1:R7C4,4,FALSE) -> 1 | I34: 1 | J34: =VLOOKUP(INT(MOD(RC[-9],10)/1),Sheet1!R2C6:R9C9,4,FALSE) -> 14 | K34: 100 | L34: 一二三四五六七八九十一二三四五六七八九十 | M34: 33
A35: 70405 | B35: =VLOOKUP(INT(MOD(RC[-1],1000)/100),Sheet1!R2C11:R8C12,2,FALSE)&VLOOKUP(INT(MOD(RC[-1],10000)/1000),Sheet1!R2C1:R7C4,3,FALSE)&VLOOKUP(INT(MOD(RC[-1],10)/1),Sheet1!R2C6:R9C9,3,FALSE) -> 橙品尖锐要害 | C35: =INT(MOD(RC[-2],10000)/1000)*10+MOD(RC[-2],10) -> 5 | D35: =INT(MOD(RC[-3],1000)/100) -> 4 | E35: =2^RC[-1]*100 -> 1600 | F35: 100|100 | G35: =VLOOKUP(INT(MOD(RC[-6],10000)/1000),Sheet1!R2C1:R7C4,4,FALSE)&"|"&VLOOKUP(INT(MOD(RC[-6],10)/1),Sheet1!R2C6:R9C9,4,FALSE) -> 1|7 | H35: =VLOOKUP(INT(MOD(RC[-7],10000)/1000),Sheet1!R2C1:R7C4,4,FALSE) -> 1 | I35: 1 | J35: =VLOOKUP(INT(MOD(RC[-9],10)/1),Sheet1!R2C6:R9C9,4,FALSE) -> 7 | K35: 100 | L35: 一二三四五六七八九十一二三四五六七八九十 | M35: 26
A36: 70406 | B36: =VLOOKUP(INT(MOD(RC[-1],1000)/100),Sheet1!R2C11:R8C12,2,FALSE)&VLOOKUP(INT(MOD(RC[-1],10000)/1000),Sheet1!R2C1:R7C4,3,FALSE)&VLOOKUP(INT(MOD(RC[-1],10)/1),Sheet1!R2C6:R9C9,3,FALSE) -> 橙品尖锐护盾 | C36: =INT(MOD(RC[-2],10000)/1000)*10+MOD(RC[-2],10) -> 6 | D36: =INT(MOD(RC[-3],1000)/100) -> 4 | E36: =2^RC[-1]*100 -> 1600 | F36: 100|100 | G36: =VLOOKUP(INT(MOD(RC[-6],10000)/1000),Sheet1!R2C1:R7C4,4,FALSE)&"|"&VLOOKUP(INT(MOD(RC[-6],10)/1),Sheet1!R2C6:R9C9,4,FALSE) -> 1|5 | H36: =VLOOKUP(INT(MOD(RC[-7],10000)/1000),Sheet1!R2C1:R7C4,4,FALSE) -> 1 | I36: 1 | J36: =VLOOKUP(INT(MOD(RC[-9],10)/1),Sheet1!R2C6:R9C9,4,FALSE) -> 5 | K36: 100 | L36: 一二三四五六七八九十一二三四五六七八九十 | M36: 33
A37: 70501 | B37: =VLOOKUP(INT(MOD(RC[-1],1000)/100),Sheet1!R2C11:R8C12,2,FALSE)&VLOOKUP(INT(MOD(RC[-1],10000)/1000),Sheet1!R2C1:R7C4,3,FALSE)&VLOOKUP(INT(MOD(RC[-1],10)/1),Sheet1!R2C6:R9C9,3,FALSE) -> 红品尖锐鹰眼 | C37: =INT(MOD(RC[-2],10000)/1000)*10+MOD(RC[-2],10) -> 1 | D37: =INT(MOD(RC[-3],1000)/100) -> 5 | E37: =2^RC[-1]*100 -> 3200 | F37: 100|100 | G37: =VLOOKUP(INT(MOD(RC[-6],10000)/1000),Sheet1!R2C1:R7C4,4,FALSE)&"|"&VLOOKUP(INT(MOD(RC[-6],10)/1),Sheet1!R2C6:R9C9,4,FALSE) -> 1|11 | H37: =VLOOKUP(INT(MOD(RC[-7],10000)/1000),Sheet1!R2C1:R7C4,4,FALSE) -> 1 | I37: 1 | J37: =VLOOKUP(INT(MOD(RC[-9],10)/1),Sheet1!R2C6:R9C9,4,FALSE) -> 11 | K37: 100 | L37: 一二三四五六七八九十一二三四五六七八九十 | M37: 26
A38: 70502 | B38: =VLOOKUP(INT(MOD(RC[-1],1000)/100),Sheet1!R2C11:R8C12,2,FALSE)&VLOOKUP(INT(MOD(RC[-1],10000)/1000),Sheet1!R2C1:R7C4,3,FALSE)&VLOOKUP(INT(MOD(RC[-1],10)/1),Sheet1!R2C6:R9C9,3,FALSE) -> 红品尖锐灵巧 | C38: =INT(MOD(RC[-2],10000)/1000)*10+MOD(RC[-2],10) -> 2 | D38: =INT(MOD(RC[-3],1000)/100) -> 5 | E38: =2^RC[-1]*100 -> 3200 | F38: 100|100 | G38: =VLOOKUP(INT(MOD(RC[-6],10000)/1000),Sheet1!R2C1:R7C4,4,FALSE)&"|"&VLOOKUP(INT(MOD(RC[-6],10)/1),Sheet1!R2C6:R9C9,4,FALSE) -> 1|12 | H38: =VLOOKUP(INT(MOD(RC[-7],10000)/1000),Sheet1!R2C1:R7C4,4,FALSE) -> 1 | I38: 1 | J38: =VLOOKUP(INT(MOD(RC[-9],10)/1),Sheet1!R2C6:R9C9,4,FALSE) -> 12 | K38: 100 | L38: 一二三四五六七八九十一二三四五六七八九十 | M38: 33
A39: 70503 | B39: =VLOOKUP(INT(MOD(RC[-1],1000)/100),Sheet1!R2C11:R8C12,2,FALSE)&VLOOKUP(INT(MOD(RC[-1],10000)/1000),Sheet1!R2C1:R7C4,3,FALSE)&VLOOKUP(INT(MOD(RC[-1],10)/1),Sheet1!R2C6:R9C9,3,FALSE) -> 红品尖锐会心 | C39: =INT(MOD(RC[-2],10000)/1000)*10+MOD(RC[-2],10) -> 3 | D39: =INT(MOD(RC[-3],1000)/100) -> 5 | E39: =2^RC[-1]*100 -> 3200 | F39: 100|100 | G39: =VLOOKUP(INT(MOD(RC[-6],10000)/1000),Sheet1!R2C1:R7C4,4,FALSE)&"|"&VLOOKUP(INT(MOD(RC[-6],10)/1),Sheet1!R2C6:R9C9,4,FALSE) -> 1|13 | H39: =VLOOKUP(INT(MOD(RC[-7],10000)/1000),Sheet1!R2C1:R7C4,4,FALSE) -> 1 | I39: 1 | J39: =VLOOKUP(INT(MOD(RC[-9],10)/1),Sheet1!R2C6:R9C9,4,FALSE) -> 13 | K39: 100 | L39: 一二三四五六七八九十一二三四五六七八九十 | M39: 26
A40: 70504 | B40: =VLOOKUP(INT(MOD(RC[-1],1000)/100),Sheet1!R2C11:R8C12,2,FALSE)&VLOOKUP(INT(MOD(RC[-1],10000)/1000),Sheet1!R2C1:R7C4,3,FALSE)&VLOOKUP(INT(MOD(RC[-1],10)/1),Sheet1!R2C6:R9C9,3,FALSE) -> 红品尖锐坚韧 | C40: =INT(MOD(RC[-2],10000)/1000)*10+MOD(RC[-2],10) -> 4 | D40: =INT(MOD(RC[-3],1000)/100) -> 5 | E40: =2^RC[-1]*100 -> 3200 | F40: 100|100 | G40: =VLOOKUP(INT(MOD(RC[-6],10000)/1000),Sheet1!R2C1:R7C4,4,FALSE)&"|"&VLOOKUP(INT(MOD(RC[-6],10)/1),Sheet1!R2C6:R9C9,4,FALSE) -> 1|14 | H40: =VLOOKUP(INT(MOD(RC[-7],10000)/1000),Sheet1!R2C1:R7C4,4,FALSE) -> 1 | I40: 1 | J40: =VLOOKUP(INT(MOD(RC[-9],10)/1),Sheet1!R2C6:R9C9,4,FALSE) -> 14 | K40: 100 | L40: 一二三四五六七八九十一二三四五六七八九十 | M40: 33
A41: 70505 | B41: =VLOOKUP(INT(MOD(RC[-1],1000)/100),Sheet1!R2C11:R8C12,2,FALSE)&VLOOKUP(INT(MOD(RC[-1],10000)/1000),Sheet1!R2C1:R7C4,3,FALSE)&VLOOKUP(INT(MOD(RC[-1],10)/1),Sheet1!R2C6:R9C9,3,FALSE) -> 红品尖锐要害 | C41: =INT(MOD(RC[-2],10000)/1000)*10+MOD(RC[-2],10) -> 5 | D41: =INT(MOD(RC[-3],1000)/100) -> 5 | E41: =2^RC[-1]*100 -> 3200 | F41: 100|100 | G41: =VLOOKUP(INT(MOD(RC[-6],10000)/1000),Sheet1!R2C1:R7C4,4,FALSE)&"|"&VLOOKUP(INT(MOD(RC[-6],10)/1),Sheet1!R2C6:R9C9,4,FALSE) -> 1|7 | H41: =VLOOKUP(INT(MOD(RC[-7],10000)/1000),Sheet1!R2C1:R7C4,4,FALSE) -> 1 | I41: 1 | J41: =VLOOKUP(INT(MOD(RC[-9],10)/1),Sheet1!R2C6:R9C9,4,FALSE) -> 7 | K41: 100 | L41: 一二三四五六七八九十一二三四五六七八九十 | M41: 26
A42: 70506 | B42: =VLOOKUP(INT(MOD(RC[-1],1000)/100),Sheet1!R2C11:R8C12,2,FALSE)&VLOOKUP(INT(MOD(RC[-1],10000)/1000),Sheet1!R2C1:R7C4,3,FALSE)&VLOOKUP(INT(MOD(RC[-1],10)/1),Sheet1!R2C6:R9C9,3,FALSE) -> 红品尖锐护盾 | C42: =INT(MOD(RC[-2],10000)/1000)*10+MOD(RC[-2],10) -> 6 | D42: =INT(MOD(RC[-3],1000)/100) -> 5 | E42: =2^RC[-1]*100 -> 3200 | F42: 100|100 | G42: =VLOOKUP(INT(MOD(RC[-6],10000)/1000),Sheet1!R2C1:R7C4,4,FALSE)&"|"&VLOOKUP(INT(MOD(RC[-6],10)/1),Sheet1!R2C6:R9C9,4,FALSE) -> 1|5 | H42: =VLOOKUP(INT(MOD(RC[-7],10000)/1000),Sheet1!R2C1:R7C4,4,FALSE) -> 1 | I42: 1 | J42: =VLOOKUP(INT(MOD(RC[-9],10)/1),Sheet1!R2C6:R9C9,4,FALSE) -> 5 | K42: 100 | L42: 一二三四五六七八九十一二三四五六七八九十 | M42: 33
A43: 71001 | B43: =VLOOKUP(INT(MOD(RC[-1],1000)/100),Sheet1!R2C11:R8C12,2,FALSE)&VLOOKUP(INT(MOD(RC[-1],10000)/1000),Sheet1!R2C1:R7C4,3,FALSE)&VLOOKUP(INT(MOD(RC[-1],10)/1),Sheet1!R2C6:R9C9,3,FALSE) -> 白品圆润鹰眼 | C43: =INT(MOD(RC[-2],10000)/1000)*10+MOD(RC[-2],10) -> 11 | D43: =INT(MOD(RC[-3],1000)/100) -> 0 | E43: =2^RC[-1]*100 -> 100 | F43: 100|100 | G43: =VLOOKUP(INT(MOD(RC[-6],10000)/1000),Sheet1!R2C1:R7C4,4,FALSE)&"|"&VLOOKUP(INT(MOD(RC[-6],10)/1),Sheet1!R2C6:R9C9,4,FALSE) -> 2|11 | H43: =VLOOKUP(INT(MOD(RC[-7],10000)/1000),Sheet1!R2C1:R7C4,4,FALSE) -> 2 | I43: 1 | J43: =VLOOKUP(INT(MOD(RC[-9],10)/1),Sheet1!R2C6:R9C9,4,FALSE) -> 11 | K43: 100 | L43: 一二三四五六七八九十一二三四五六七八九十 | M43: 26
A44: 71002 | B44: =VLOOKUP(INT(MOD(RC[-1],1000)/100),Sheet1!R2C11:R8C12,2,FALSE)&VLOOKUP(INT(MOD(RC[-1],10000)/1000),Sheet1!R2C1:R7C4,3,FALSE)&VLOOKUP(INT(MOD(RC[-1],10)/1),Sheet1!R2C6:R9C9,3,FALSE) -> 白品圆润灵巧 | C44: =INT(MOD(RC[-2],10000)/1000)*10+MOD(RC[-2],10) -> 12 | D44: =INT(MOD(RC[-3],1000)/100) -> 0 | E44: =2^RC[-1]*100 -> 100 | F44: 100|100 | G44: =VLOOKUP(INT(MOD(RC[-6],10000)/1000),Sheet1!R2C1:R7C4,4,FALSE)&"|"&VLOOKUP(INT(MOD(RC[-6],10)/1),Sheet1!R2C6:R9C9,4,FALSE) -> 2|12 | H44: =VLOOKUP(INT(MOD(RC[-7],10000)/1000),Sheet1!R2C1:R7C4,4,FALSE) -> 2 | I44: 1 | J44: =VLOOKUP(INT(MOD(RC[-9],10)/1),Sheet1!R2C6:R9C9,4,FALSE) -> 12 | K44: 100 | L44: 一二三四五六七八九十一二三四五六七八九十 | M44: 33
A45: 71003 | B45: =VLOOKUP(INT(MOD(RC[-1],1000)/100),Sheet1!R2C11:R8C12,2,FALSE)&VLOOKUP(INT(MOD(RC[-1],10000)/1000),Sheet1!R2C1:R7C4,3,FALSE)&VLOOKUP(INT(MOD(RC[-1],10)/1),Sheet1!R2C6:R9C9,3,FALSE) -> 白品圆润会心 | C45: =INT(MOD(RC[-2],10000)/1000)*10+MOD(RC[-2],10) -> 13 | D45: =INT(MOD(RC[-3],1000)/100) -> 0 | E45: =2^RC[-1]*100 -> 100 | F45: 100|100 | G45: =VLOOKUP(INT(MOD(RC[-6],10000)/1000),Sheet1!R2C1:R7C4,4,FALSE)&"|"&VLOOKUP(INT(MOD(RC[-6],10)/1),Sheet1!R2C6:R9C9,4,FALSE) -> 2|13 | H45: =VLOOKUP(INT(MOD(RC[-7],10000)/1000),Sheet1!R2C1:R7C4,4,FALSE) -> 2 | I45: 1 | J45: =VLOOKUP(INT(MOD(RC[-9],10)/1),Sheet1!R2C6:R9C9,4,FALSE) -> 13 | K45: 100 | L45: 一二三四五六七八九十一二三四五六七八九十 | M45: 26
A46: 71004 | B46: =VLOOKUP(INT(MOD(RC[-1],1000)/100),Sheet1!R2C11:R8C12,2,FALSE)&VLOOKUP(INT(MOD(RC[-1],10000)/1000),Sheet1!R2C1:R7C4,3,FALSE)&VLOOKUP(INT(MOD(RC[-1],10)/1),Sheet1!R2C6:R9C9,3,FALSE) -> 白品圆润坚韧 | C46: =INT(MOD(RC[-2],10000)/1000)*10+MOD(RC[-2],10) -> 14 | D46: =INT(MOD(RC[-3],1000)/100) -> 0 | E46: =2^RC[-1]*100 -> 100 | F46: 100|100 | G46: =VLOOKUP(INT(MOD(RC[-6],10000)/1000),Sheet1!R2C1:R7C4,4,FALSE)&"|"&VLOOKUP(INT(MOD(RC[-6],10)/1),Sheet1!R2C6:R9C9,4,FALSE) -> 2|14 | H46: =VLOOKUP(INT(MOD(RC[-7],10000)/1000),Sheet1!R2C1:R7C4,4,FALSE) -> 2 | I46: 1 | J46: =VLOOKUP(INT(MOD(RC[-9],10)/1),Sheet1!R2C6:R9C9,4,FALSE) -> 14 | K46: 100 | L46: 一二三四五六七八九十一二三四五六七八九十 | M46: 33
A47: 71005 | B47: =VLOOKUP(INT(MOD(RC[-1],1000)/100),Sheet1!R2C11:R8C12,2,FALSE)&VLOOKUP(INT(MOD(RC[-1],10000)/1000),Sheet1!R2C1:R7C4,3,FALSE)&VLOOKUP(INT(MOD(RC[-1],10)/1),Sheet1!R2C6:R9C9,3,FALSE) -> 白品圆润要害 | C47: =INT(MOD(RC[-2],10000)/1000)*10+MOD(RC[-2],10) -> 15 | D47: =INT(MOD(RC[-3],1000)/100) -> 0 | E47: =2^RC[-1]*100 -> 100 | F47: 100|100 | G47: =VLOOKUP(INT(MOD(RC[-6],10000)/1000),Sheet1!R2C1:R7C4,4,FALSE)&"|"&VLOOKUP(INT(MOD(RC[-6],10)/1),Sheet1!R2C6:R9C9,4,FALSE) -> 2|7 | H47: =VLOOKUP(INT(MOD(RC[-7],10000)/1000),Sheet1!R2C1:R7C4,4,FALSE) -> 2 | I47: 1 | J47: =VLOOKUP(INT(MOD(RC[-9],10)/1),Sheet1!R2C6:R9C9,4,FALSE) -> 7 | K47: 100 | L47: 一二三四五六七八九十一二三四五六七八九十 | M47: 26
A48: 71006 | B48: =VLOOKUP(INT(MOD(RC[-1],1000)/100),Sheet1!R2C11:R8C12,2,FALSE)&VLOOKUP(INT(MOD(RC[-1],10000)/1000),Sheet1!R2C1:R7C4,3,FALSE)&VLOOKUP(INT(MOD(RC[-1],10)/1),Sheet1!R2C6:R9C9,3,FALSE) -> 白品圆润护盾 | C48: =INT(MOD(RC[-2],10000)/1000)*10+MOD(RC[-2],10) -> 16 | D48: =INT(MOD(RC[-3],1000)/100) -> 0 | E48: =2^RC[-1]*100 -> 100 | F48: 100|100 | G48: =VLOOKUP(INT(MOD(RC[-6],10000)/1000),Sheet1!R2C1:R7C4,4,FALSE)&"|"&VLOOKUP(INT(MOD(RC[-6],10)/1),Sheet1!R2C6:R9C9,4,FALSE) -> 2|5 | H48: =VLOOKUP(INT(MOD(RC[-7],10000)/1000),Sheet1!R2C1:R7C4,4,FALSE) -> 2 | I48: 1 | J48: =VLOOKUP(INT(MOD(RC[-9],10)/1),Sheet1!R2C6:R9C9,4,FALSE) -> 5 | K48: 100 | L48: 一二三四五六七八九十一二三四五六七八九十 | M48: 33
A49: 71101 | B49: =VLOOKUP(INT(MOD(RC[-1],1000)/100),Sheet1!R2C11:R8C12,2,FALSE)&VLOOKUP(INT(MOD(RC[-1],10000)/1000),Sheet1!R2C1:R7C4,3,FALSE)&VLOOKUP(INT(MOD(RC[-1],10)/1),Sheet1!R2C6:R9C9,3,FALSE) -> 绿品圆润鹰眼 | C49: =INT(MOD(RC[-2],10000)/1000)*10+MOD(RC[-2],10) -> 11 | D49: =INT(MOD(RC[-3],1000)/100) -> 1 | E49: =2^RC[-1]*100 -> 200 | F49: 100|100 | G49: =VLOOKUP(INT(MOD(RC[-6],10000)/1000),Sheet1!R2C1:R7C4,4,FALSE)&"|"&VLOOKUP(INT(MOD(RC[-6],10)/1),Sheet1!R2C6:R9C9,4,FALSE) -> 2|11 | H49: =VLOOKUP(INT(MOD(RC[-7],10000)/1000),Sheet1!R2C1:R7C4,4,FALSE) -> 2 | I49: 1 | J49: =VLOOKUP(INT(MOD(RC[-9],10)/1),Sheet1!R2C6:R9C9,4,FALSE) -> 11 | K49: 100 | L49: 一二三四五六七八九十一二三四五六七八九十 | M49: 26
A50: 71102 | B50: =VLOOKUP(INT(MOD(RC[-1],1000)/100),Sheet1!R2C11:R8C12,2,FALSE)&VLOOKUP(INT(MOD(RC[-1],10000)/1000),Sheet1!R2C1:R7C4,3,FALSE)&VLOOKUP(INT(MOD(RC[-1],10)/1),Sheet1!R2C6:R9C9,3,FALSE) -> 绿品圆润灵巧 | C50: =INT(MOD(RC[-2],10000)/1000)*10+MOD(RC[-2],10) -> 12 | D50: =INT(MOD(RC[-3],1000)/100) -> 1 | E50: =2^RC[-1]*100 -> 200 | F50: 100|100 | G50: =VLOOKUP(INT(MOD(RC[-6],10000)/1000),Sheet1!R2C1:R7C4,4,FALSE)&"|"&VLOOKUP(INT(MOD(RC[-6],10)/1),Sheet1!R2C6:R9C9,4,FALSE) -> 2|12 | H50: =VLOOKUP(INT(MOD(RC[-7],10000)/1000),Sheet1!R2C1:R7C4,4,FALSE) -> 2 | I50: 1 | J50: =VLOOKUP(INT(MOD(RC[-9],10)/1),Sheet1!R2C6:R9C9,4,FALSE) -> 12 | K50: 100 | L50: 一二三四五六七八九十一二三四五六七八九十 | M50: 33
A51: 71103 | B51: =VLOOKUP(INT(MOD(RC[-1],1000)/100),Sheet1!R2C11:R8C12,2,FALSE)&VLOOKUP(INT(MOD(RC[-1],10000)/1000),Sheet1!R2C1:R7C4,3,FALSE)&VLOOKUP(INT(MOD(RC[-1],10)/1),Sheet1!R2C6:R9C9,3,FALSE) -> 绿品圆润会心 | C51: =INT(MOD(RC[-2],10000)/1000)*10+MOD(RC[-2],10) -> 13 | D51: =INT(MOD(RC[-3],1000)/100) -> 1 | E51: =2^RC[-1]*100 -> 200 | F51: 100|100 | G51: =VLOOKUP(INT(MOD(RC[-6],10000)/1000),Sheet1!R2C1:R7C4,4,FALSE)&"|"&VLOOKUP(INT(MOD(RC[-6],10)/1),Sheet1!R2C6:R9C9,4,FALSE) -> 2|13 | H51: =VLOOKUP(INT(MOD(RC[-7],10000)/1000),Sheet1!R2C1:R7C4,4,FALSE) -> 2 | I51: 1 | J51: =VLOOKUP(INT(MOD(RC[-9],10)/1),Sheet1!R2C6:R9C9,4,FALSE) -> 13 | K51: 100 | L51: 一二三四五六七八九十一二三四五六七八九十 | M51: 26
A52: 71104 | B52: =VLOOKUP(INT(MOD(RC[-1],1000)/100),Sheet1!R2C11:R8C12,2,FALSE)&VLOOKUP(INT(MOD(RC[-1],10000)/1000),Sheet1!R2C1:R7C4,3,FALSE)&VLOOKUP(INT(MOD(RC[-1],10)/1),Sheet1!R2C6:R9C9,3,FALSE) -> 绿品圆润坚韧 | C52: =INT(MOD(RC[-2],10000)/1000)*10+MOD(RC[-2],10) -> 14 | D52: =INT(MOD(RC[-3],1000)/100) -> 1 | E52: =2^RC[-1]*100 -> 200 | F52: 100|100 | G52: =VLOOKUP(INT(MOD(RC[-6],10000)/1000),Sheet1!R2C1:R7C4,4,FALSE)&"|"&VLOOKUP(INT(MOD(RC[-6],10)/1),Sheet1!R2C6:R9C9,4,FALSE) -> 2|14 | H52: =VLOOKUP(INT(MOD(RC[-7],10000)/1000),Sheet1!R2C1:R7C4,4,FALSE) -> 2 | I52: 1 | J52: =VLOOKUP(INT(MOD(RC[-9],10)/1),Sheet1!R2C6:R9C9,4,FALSE) -> 14 | K52: 100 | L52: 一二三四五六七八九十一二三四五六七八九十 | M52: 33
A53: 71105 | B53: =VLOOKUP(INT(MOD(RC[-1],1000)/100),Sheet1!R2C11:R8C12,2,FALSE)&VLOOKUP(INT(MOD(RC[-1],10000)/1000),Sheet1!R2C1:R7C4,3,FALSE)&VLOOKUP(INT(MOD(RC[-1],10)/1),Sheet1!R2C6:R9C9,3,FALSE) -> 绿品圆润要害 | C53: =INT(MOD(RC[-2],10000)/1000)*10+MOD(RC[-2],10) -> 15 | D53: =INT(MOD(RC[-3],1000)/100) -> 1 | E53: =2^RC[-1]*100 -> 200 | F53: 100|100 | G53: =VLOOKUP(INT(MOD(RC[-6],10000)/1000),Sheet1!R2C1:R7C4,4,FALSE)&"|"&VLOOKUP(INT(MOD(RC[-6],10)/1),Sheet1!R2C6:R9C9,4,FALSE) -> 2|7 | H53: =VLOOKUP(INT(MOD(RC[-7],10000)/1000),Sheet1!R2C1:R7C4,4,FALSE) -> 2 | I53: 1 | J53: =VLOOKUP(INT(MOD(RC[-9],10)/1),Sheet1!R2C6:R9C9,4,FALSE) -> 7 | K53: 100 | L53: 一二三四五六七八九十一二三四五六七八九十 | M53: 26
A54: 71106 | B54: =VLOOKUP(INT(MOD(RC[-1],1000)/100),Sheet1!R2C11:R8C12,2,FALSE)&VLOOKUP(INT(MOD(RC[-1],10000)/1000),Sheet1!R2C1:R7C4,3,FALSE)&VLOOKUP(INT(MOD(RC[-1],10)/1),Sheet1!R2C6:R9C9,3,FALSE) -> 绿品圆润护盾 | C54: =INT(MOD(RC[-2],10000)/1000)*10+MOD(RC[-2],10) -> 16 | D54: =INT(MOD(RC[-3],1000)/100) -> 1 | E54: =2^RC[-1]*100 -> 200 | F54: 100|100 | G54: =VLOOKUP(INT(MOD(RC[-6],10000)/1000),Sheet1!R2C1:R7C4,4,FALSE)&"|"&VLOOKUP(INT(MOD(RC[-6],10)/1),Sheet1!R2C6:R9C9,4,FALSE) -> 2|5 | H54: =VLOOKUP(INT(MOD(RC[-7],10000)/1000),Sheet1!R2C1:R7C4,4,FALSE) -> 2 | I54: 1 | J54: =VLOOKUP(INT(MOD(RC[-9],10)/1),Sheet1!R2C6:R9C9,4,FALSE) -> 5 | K54: 100 | L54: 一二三四五六七八九十一二三四五六七八九十 | M54: 33
A55: 71201 | B55: =VLOOKUP(INT(MOD(RC[-1],1000)/100),Sheet1!R2C11:R8C12,2,FALSE)&VLOOKUP(INT(MOD(RC[-1],10000)/1000),Sheet1!R2C1:R7C4,3,FALSE)&VLOOKUP(INT(MOD(RC[-1],10)/1),Sheet1!R2C6:R9C9,3,FALSE) -> 蓝品圆润鹰眼 | C55: =INT(MOD(RC[-2],10000)/1000)*10+MOD(RC[-2],10) -> 11 | D55: =INT(MOD(RC[-3],1000)/100) -> 2 | E55: =2^RC[-1]*100 -> 400 | F55: 100|100 | G55: =VLOOKUP(INT(MOD(RC[-6],10000)/1000),Sheet1!R2C1:R7C4,4,FALSE)&"|"&VLOOKUP(INT(MOD(RC[-6],10)/1),Sheet1!R2C6:R9C9,4,FALSE) -> 2|11 | H55: =VLOOKUP(INT(MOD(RC[-7],10000)/1000),Sheet1!R2C1:R7C4,4,FALSE) -> 2 | I55: 1 | J55: =VLOOKUP(INT(MOD(RC[-9],10)/1),Sheet1!R2C6:R9C9,4,FALSE) -> 11 | K55: 100 | L55: 一二三四五六七八九十一二三四五六七八九十 | M55: 26
A56: 71202 | B56: =VLOOKUP(INT(MOD(RC[-1],1000)/100),Sheet1!R2C11:R8C12,2,FALSE)&VLOOKUP(INT(MOD(RC[-1],10000)/1000),Sheet1!R2C1:R7C4,3,FALSE)&VLOOKUP(INT(MOD(RC[-1],10)/1),Sheet1!R2C6:R9C9,3,FALSE) -> 蓝品圆润灵巧 | C56: =INT(MOD(RC[-2],10000)/1000)*10+MOD(RC[-2],10) -> 12 | D56: =INT(MOD(RC[-3],1000)/100) -> 2 | E56: =2^RC[-1]*100 -> 400 | F56: 100|100 | G56: =VLOOKUP(INT(MOD(RC[-6],10000)/1000),Sheet1!R2C1:R7C4,4,FALSE)&"|"&VLOOKUP(INT(MOD(RC[-6],10)/1),Sheet1!R2C6:R9C9,4,FALSE) -> 2|12 | H56: =VLOOKUP(INT(MOD(RC[-7],10000)/1000),Sheet1!R2C1:R7C4,4,FALSE) -> 2 | I56: 1 | J56: =VLOOKUP(INT(MOD(RC[-9],10)/1),Sheet1!R2C6:R9C9,4,FALSE) -> 12 | K56: 100 | L56: 一二三四五六七八九十一二三四五六七八九十 | M56: 33
A57: 71203 | B57: =VLOOKUP(INT(MOD(RC[-1],1000)/100),Sheet1!R2C11:R8C12,2,FALSE)&VLOOKUP(INT(MOD(RC[-1],10000)/1000),Sheet1!R2C1:R7C4,3,FALSE)&VLOOKUP(INT(MOD(RC[-1],10)/1),Sheet1!R2C6:R9C9,3,FALSE) -> 蓝品圆润会心 | C57: =INT(MOD(RC[-2],10000)/1000)*10+MOD(RC[-2],10) -> 13 | D57: =INT(MOD(RC[-3],1000)/100) -> 2 | E57: =2^RC[-1]*100 -> 400 | F57: 100|100 | G57: =VLOOKUP(INT(MOD(RC[-6],10000)/1000),Sheet1!R2C1:R7C4,4,FALSE)&"|"&VLOOKUP(INT(MOD(RC[-6],10)/1),Sheet1!R2C6:R9C9,4,FALSE) -> 2|13 | H57: =VLOOKUP(INT(MOD(RC[-7],10000)/1000),Sheet1!R2C1:R7C4,4,FALSE) -> 2 | I57: 1 | J57: =VLOOKUP(INT(MOD(RC[-9],10)/1),Sheet1!R2C6:R9C9,4,FALSE) -> 13 | K57: 100 | L57: 一二三四五六七八九十一二三四五六七八九十 | M57: 26
A58: 71204 | B58: =VLOOKUP(INT(MOD(RC[-1],1000)/100),Sheet1!R2C11:R8C12,2,FALSE)&VLOOKUP(INT(MOD(RC[-1],10000)/1000),Sheet1!R2C1:R7C4,3,FALSE)&VLOOKUP(INT(MOD(RC[-1],10)/1),Sheet1!R2C6:R9C9,3,FALSE) -> 蓝品圆润坚韧 | C58: =INT(MOD(RC[-2],10000)/1000)*10+MOD(RC[-2],10) -> 14 | D58: =INT(MOD(RC[-3],1000)/100) -> 2 | E58: =2^RC[-1]*100 -> 400 | F58: 100|100 | G58: =VLOOKUP(INT(MOD(RC[-6],10000)/1000),Sheet1!R2C1:R7C4,4,FALSE)&"|"&VLOOKUP(INT(MOD(RC[-6],10)/1),Sheet1!R2C6:R9C9,4,FALSE) -> 2|14 | H58: =VLOOKUP(INT(MOD(RC[-7],10000)/1000),Sheet1!R2C1:R7C4,4,FALSE) -> 2 | I58: 1 | J58: =VLOOKUP(INT(MOD(RC[-9],10)/1),Sheet1!R2C6:R9C9,4,FALSE) -> 14 | K58: 100 | L58: 一二三四五六七八九十一二三四五六七八九十 | M58: 33
A59: 71205 | B59: =VLOOKUP(INT(MOD(RC[-1],1000)/100),Sheet1!R2C11:R8C12,2,FALSE)&VLOOKUP(INT(MOD(RC[-1],10000)/1000),Sheet1!R2C1:R7C4,3,FALSE)&VLOOKUP(INT(MOD(RC[-1],10)/1),Sheet1!R2C6:R9C9,3,FALSE) -> 蓝品圆润要害 | C59: =INT(MOD(RC[-2],10000)/1000)*10+MOD(RC[-2],10) -> 15 | D59: =INT(MOD(RC[-3],1000)/100) -> 2 | E59: =2^RC[-1]*100 -> 400 | F59: 100|100 | G59: =VLOOKUP(INT(MOD(RC[-6],10000)/1000),Sheet1!R2C1:R7C4,4,FALSE)&"|"&VLOOKUP(INT(MOD(RC[-6],10)/1),Sheet1!R2C6:R9C9,4,FALSE) -> 2|7 | H59: =VLOOKUP(INT(MOD(RC[-7],10000)/1000),Sheet1!R2C1:R7C4,4,FALSE) -> 2 | I59: 1 | J59: =VLOOKUP(INT(MOD(RC[-9],10)/1),Sheet1!R2C6:R9C9,4,FALSE) -> 7 | K59: 100 | L59: 一二三四五六七八九十一二三四五六七八九十 | M59: 26
A60: 71206 | B60: =VLOOKUP(INT(MOD(RC[-1],1000)/100),Sheet1!R2C11:R8C12,2,FALSE)&VLOOKUP(INT(MOD(RC[-1],10000)/1000),Sheet1!R2C1:R7C4,3,FALSE)&VLOOKUP(INT(MOD(RC[-1],10)/1),Sheet1!R2C6:R9C9,3,FALSE) -> 蓝品圆润护盾 | C60: =INT(MOD(RC[-2],10000)/1000)*10+MOD(RC[-2],10) -> 16 | D60: =INT(MOD(RC[-3],1000)/100) -> 2 | E60: =2^RC[-1]*100 -> 400 | F60: 100|100 | G60: =VLOOKUP(INT(MOD(RC[-6],10000)/1000),Sheet1!R2C1:R7C4,4,FALSE)&"|"&VLOOKUP(INT(MOD(RC[-6],10)/1),Sheet1!R2C6:R9C9,4,FALSE) -> 2|5 | H60: =VLOOKUP(INT(MOD(RC[-7],10000)/1000),Sheet1!R2C1:R7C4,4,FALSE) -> 2 | I60: 1 | J60: =VLOOKUP(INT(MOD(RC[-9],10)/1),Sheet1!R2C6:R9C9,4,FALSE) -> 5 | K60: 100 | L60: 一二三四五六七八九十一二三四五六七八九十 | M60: 33
A61: 71301 | B61: =VLOOKUP(INT(MOD(RC[-1],1000)/100),Sheet1!R2C11:R8C12,2,FALSE)&VLOOKUP(INT(MOD(RC[-1],10000)/1000),Sheet1!R2C1:R7C4,3,FALSE)&VLOOKUP(INT(MOD(RC[-1],10)/1),Sheet1!R2C6:R9C9,3,FALSE) -> 紫品圆润鹰眼 | C61: =INT(MOD(RC[-2],10000)/1000)*10+MOD(RC[-2],10) -> 11 | D61: =INT(MOD(RC[-3],1000)/100) -> 3 | E61: =2^RC[-1]*100 -> 800 | F61: 100|100 | G61: =VLOOKUP(INT(MOD(RC[-6],10000)/1000),Sheet1!R2C1:R7C4,4,FALSE)&"|"&VLOOKUP(INT(MOD(RC[-6],10)/1),Sheet1!R2C6:R9C9,4,FALSE) -> 2|11 | H61: =VLOOKUP(INT(MOD(RC[-7],10000)/1000),Sheet1!R2C1:R7C4,4,FALSE) -> 2 | I61: 1 | J61: =VLOOKUP(INT(MOD(RC[-9],10)/1),Sheet1!R2C6:R9C9,4,FALSE) -> 11 | K61: 100 | L61: 一二三四五六七八九十一二三四五六七八九十 | M61: 26
A62: 71302 | B62: =VLOOKUP(INT(MOD(RC[-1],1000)/100),Sheet1!R2C11:R8C12,2,FALSE)&VLOOKUP(INT(MOD(RC[-1],10000)/1000),Sheet1!R2C1:R7C4,3,FALSE)&VLOOKUP(INT(MOD(RC[-1],10)/1),Sheet1!R2C6:R9C9,3,FALSE) -> 紫品圆润灵巧 | C62: =INT(MOD(RC[-2],10000)/1000)*10+MOD(RC[-2],10) -> 12 | D62: =INT(MOD(RC[-3],1000)/100) -> 3 | E62: =2^RC[-1]*100 -> 800 | F62: 100|100 | G62: =VLOOKUP(INT(MOD(RC[-6],10000)/1000),Sheet1!R2C1:R7C4,4,FALSE)&"|"&VLOOKUP(INT(MOD(RC[-6],10)/1),Sheet1!R2C6:R9C9,4,FALSE) -> 2|12 | H62: =VLOOKUP(INT(MOD(RC[-7],10000)/1000),Sheet1!R2C1:R7C4,4,FALSE) -> 2 | I62: 1 | J62: =VLOOKUP(INT(MOD(RC[-9],10)/1),Sheet1!R2C6:R9C9,4,FALSE) -> 12 | K62: 100 | L62: 一二三四五六七八九十一二三四五六七八九十 | M62: 33
A63: 71303 | B63: =VLOOKUP(INT(MOD(RC[-1],1000)/100),Sheet1!R2C11:R8C12,2,FALSE)&VLOOKUP(INT(MOD(RC[-1],10000)/1000),Sheet1!R2C1:R7C4,3,FALSE)&VLOOKUP(INT(MOD(RC[-1],10)/1),Sheet1!R2C6:R9C9,3,FALSE) -> 紫品圆润会心 | C63: =INT(MOD(RC[-2],10000)/1000)*10+MOD(RC[-2],10) -> 13 | D63: =INT(MOD(RC[-3],1000)/100) -> 3 | E63: =2^RC[-1]*100 -> 800 | F63: 100|100 | G63: =VLOOKUP(INT(MOD(RC[-6],10000)/1000),Sheet1!R2C1:R7C4,4,FALSE)&"|"&VLOOKUP(INT(MOD(RC[-6],10)/1),Sheet1!R2C6:R9C9,4,FALSE) -> 2|13 | H63: =VLOOKUP(INT(MOD(RC[-7],10000)/1000),Sheet1!R2C1:R7C4,4,FALSE) -> 2 | I63: 1 | J63: =VLOOKUP(INT(MOD(RC[-9],10)/1),Sheet1!R2C6:R9C9,4,FALSE) -> 13 | K63: 100 | L63: 一二三四五六七八九十一二三四五六七八九十 | M63: 26
A64: 71304 | B64: =VLOOKUP(INT(MOD(RC[-1],1000)/100),Sheet1!R2C11:R8C12,2,FALSE)&VLOOKUP(INT(MOD(RC[-1],10000)/1000),Sheet1!R2C1:R7C4,3,FALSE)&VLOOKUP(INT(MOD(RC[-1],10)/1),Sheet1!R2C6:R9C9,3,FALSE) -> 紫品圆润坚韧 | C64: =INT(MOD(RC[-2],10000)/1000)*10+MOD(RC[-2],10) -> 14 | D64: =INT(MOD(RC[-3],1000)/100) -> 3 | E64: =2^RC[-1]*100 -> 800 | F64: 100|100 | G64: =VLOOKUP(INT(MOD(RC[-6],10000)/1000),Sheet1!R2C1:R7C4,4,FALSE)&"|"&VLOOKUP(INT(MOD(RC[-6],10)/1),Sheet1!R2C6:R9C9,4,FALSE) -> 2|14 | H64: =VLOOKUP(INT(MOD(RC[-7],10000)/1000),Sheet1!R2C1:R7C4,4,FALSE) -> 2 | I64: 1 | J64: =VLOOKUP(INT(MOD(RC[-9],10)/1),Sheet1!R2C6:R9C9,4,FALSE) -> 14 | K64: 100 | L64: 一二三四五六七八九十一二三四五六七八九十 | M64: 33
A65: 71305 | B65: =VLOOKUP(INT(MOD(RC[-1],1000)/100),Sheet1!R2C11:R8C12,2,FALSE)&VLOOKUP(INT(MOD(RC[-1],10000)/1000),Sheet1!R2C1:R7C4,3,FALSE)&VLOOKUP(INT(MOD(RC[-1],10)/1),Sheet1!R2C6:R9C9,3,FALSE) -> 紫品圆润要害 | C65: =INT(MOD(RC[-2],10000)/1000)*10+MOD(RC[-2],10) -> 15 | D65: =INT(MOD(RC[-3],1000)/100) -> 3 | E65: =2^RC[-1]*100 -> 800 | F65: 100|100 | G65: =VLOOKUP(INT(MOD(RC[-6],10000)/1000),Sheet1!R2C1:R7C4,4,FALSE)&"|"&VLOOKUP(INT(MOD(RC[-6],10)/1),Sheet1!R2C6:R9C9,4,FALSE) -> 2|7 | H65: =VLOOKUP(INT(MOD(RC[-7],10000)/1000),Sheet1!R2C1:R7C4,4,FALSE) -> 2 | I65: 1 | J65: =VLOOKUP(INT(MOD(RC[-9],10)/1),Sheet1!R2C6:R9C9,4,FALSE) -> 7 | K65: 100 | L65: 一二三四五六七八九十一二三四五六七八九十 | M65: 26
A66: 71306 | B66: =VLOOKUP(INT(MOD(RC[-1],1000)/100),Sheet1!R2C11:R8C12,2,FALSE)&VLOOKUP(INT(MOD(RC[-1],10000)/1000),Sheet1!R2C1:R7C4,3,FALSE)&VLOOKUP(INT(MOD(RC[-1],10)/1),Sheet1!R2C6:R9C9,3,FALSE) -> 紫品圆润护盾 | C66: =INT(MOD(RC[-2],10000)/1000)*10+MOD(RC[-2],10) -> 16 | D66: =INT(MOD(RC[-3],1000)/100) -> 3 | E66: =2^RC[-1]*100 -> 800 | F66: 100|100 | G66: =VLOOKUP(INT(MOD(RC[-6],10000)/1000),Sheet1!R2C1:R7C4,4,FALSE)&"|"&VLOOKUP(INT(MOD(RC[-6],10)/1),Sheet1!R2C6:R9C9,4,FALSE) -> 2|5 | H66: =VLOOKUP(INT(MOD(RC[-7],10000)/1000),Sheet1!R2C1:R7C4,4,FALSE) -> 2 | I66: 1 | J66: =VLOOKUP(INT(MOD(RC[-9],10)/1),Sheet1!R2C6:R9C9,4,FALSE) -> 5 | K66: 100 | L66: 一二三四五六七八九十一二三四五六七八九十 | M66: 33
A67: 71401 | B67: =VLOOKUP(INT(MOD(RC[-1],1000)/100),Sheet1!R2C11:R8C12,2,FALSE)&VLOOKUP(INT(MOD(RC[-1],10000)/1000),Sheet1!R2C1:R7C4,3,FALSE)&VLOOKUP(INT(MOD(RC[-1],10)/1),Sheet1!R2C6:R9C9,3,FALSE) -> 橙品圆润鹰眼 | C67: =INT(MOD(RC[-2],10000)/1000)*10+MOD(RC[-2],10) -> 11 | D67: =INT(MOD(RC[-3],1000)/100) -> 4 | E67: =2^RC[-1]*100 -> 1600 | F67: 100|100 | G67: =VLOOKUP(INT(MOD(RC[-6],10000)/1000),Sheet1!R2C1:R7C4,4,FALSE)&"|"&VLOOKUP(INT(MOD(RC[-6],10)/1),Sheet1!R2C6:R9C9,4,FALSE) -> 2|11 | H67: =VLOOKUP(INT(MOD(RC[-7],10000)/1000),Sheet1!R2C1:R7C4,4,FALSE) -> 2 | I67: 1 | J67: =VLOOKUP(INT(MOD(RC[-9],10)/1),Sheet1!R2C6:R9C9,4,FALSE) -> 11 | K67: 100 | L67: 一二三四五六七八九十一二三四五六七八九十 | M67: 26
A68: 71402 | B68: =VLOOKUP(INT(MOD(RC[-1],1000)/100),Sheet1!R2C11:R8C12,2,FALSE)&VLOOKUP(INT(MOD(RC[-1],10000)/1000),Sheet1!R2C1:R7C4,3,FALSE)&VLOOKUP(INT(MOD(RC[-1],10)/1),Sheet1!R2C6:R9C9,3,FALSE) -> 橙品圆润灵巧 | C68: =INT(MOD(RC[-2],10000)/1000)*10+MOD(RC[-2],10) -> 12 | D68: =INT(MOD(RC[-3],1000)/100) -> 4 | E68: =2^RC[-1]*100 -> 1600 | F68: 100|100 | G68: =VLOOKUP(INT(MOD(RC[-6],10000)/1000),Sheet1!R2C1:R7C4,4,FALSE)&"|"&VLOOKUP(INT(MOD(RC[-6],10)/1),Sheet1!R2C6:R9C9,4,FALSE) -> 2|12 | H68: =VLOOKUP(INT(MOD(RC[-7],10000)/1000),Sheet1!R2C1:R7C4,4,FALSE) -> 2 | I68: 1 | J68: =VLOOKUP(INT(MOD(RC[-9],10)/1),Sheet1!R2C6:R9C9,4,FALSE) -> 12 | K68: 100 | L68: 一二三四五六七八九十一二三四五六七八九十 | M68: 33
A69: 71403 | B69: =VLOOKUP(INT(MOD(RC[-1],1000)/100),Sheet1!R2C11:R8C12,2,FALSE)&VLOOKUP(INT(MOD(RC[-1],10000)/1000),Sheet1!R2C1:R7C4,3,FALSE)&VLOOKUP(INT(MOD(RC[-1],10)/1),Sheet1!R2C6:R9C9,3,FALSE) -> 橙品圆润会心 | C69: =INT(MOD(RC[-2],10000)/1000)*10+MOD(RC[-2],10) -> 13 | D69: =INT(MOD(RC[-3],1000)/100) -> 4 | E69: =2^RC[-1]*100 -> 1600 | F69: 100|100 | G69: =VLOOKUP(INT(MOD(RC[-6],10000)/1000),Sheet1!R2C1:R7C4,4,FALSE)&"|"&VLOOKUP(INT(MOD(RC[-6],10)/1),Sheet1!R2C6:R9C9,4,FALSE) -> 2|13 | H69: =VLOOKUP(INT(MOD(RC[-7],10000)/1000),Sheet1!R2C1:R7C4,4,FALSE) -> 2 | I69: 1 | J69: =VLOOKUP(INT(MOD(RC[-9],10)/1),Sheet1!R2C6:R9C9,4,FALSE) -> 13 | K69: 100 | L69: 一二三四五六七八九十一二三四五六七八九十 | M69: 26
A70: 71404 | B70: =VLOOKUP(INT(MOD(RC[-1],1000)/100),Sheet1!R2C11:R8C12,2,FALSE)&VLOOKUP(INT(MOD(RC[-1],10000)/1000),Sheet1!R2C1:R7C4,3,FALSE)&VLOOKUP(INT(MOD(RC[-1],10)/1),Sheet1!R2C6:R9C9,3,FALSE) -> 橙品圆润坚韧 | C70: =INT(MOD(RC[-2],10000)/1000)*10+MOD(RC[-2],10) -> 14 | D70: =INT(MOD(RC[-3],1000)/100) -> 4 | E70: =2^RC[-1]*100 -> 1600 | F70: 100|100 | G70: =VLOOKUP(INT(MOD(RC[-6],10000)/1000),Sheet1!R2C1:R7C4,4,FALSE)&"|"&VLOOKUP(INT(MOD(RC[-6],10)/1),Sheet1!R2C6:R9C9,4,FALSE) -> 2|14 | H70: =VLOOKUP(INT(MOD(RC[-7],10000)/1000),Sheet1!R2C1:R7C4,4,FALSE) -> 2 | I70: 1 | J70: =VLOOKUP(INT(MOD(RC[-9],10)/1),Sheet1!R2C6:R9C9,4,FALSE) -> 14 | K70: 100 | L70: 一二三四五六七八九十一二三四五六七八九十 | M70: 33
A71: 71405 | B71: =VLOOKUP(INT(MOD(RC[-1],1000)/100),Sheet1!R2C11:R8C12,2,FALSE)&VLOOKUP(INT(MOD(RC[-1],10000)/1000),Sheet1!R2C1:R7C4,3,FALSE)&VLOOKUP(INT(MOD(RC[-1],10)/1),Sheet1!R2C6:R9C9,3,FALSE) -> 橙品圆润要害 | C71: =INT(MOD(RC[-2],10000)/1000)*10+MOD(RC[-2],10) -> 15 | D71: =INT(MOD(RC[-3],1000)/100) -> 4 | E71: =2^RC[-1]*100 -> 1600 | F71: 100|100 | G71: =VLOOKUP(INT(MOD(RC[-6],10000)/1000),Sheet1!R2C1:R7C4,4,FALSE)&"|"&VLOOKUP(INT(MOD(RC[-6],10)/1),Sheet1!R2C6:R9C9,4,FALSE) -> 2|7 | H71: =VLOOKUP(INT(MOD(RC[-7],10000)/1000),Sheet1!R2C1:R7C4,4,FALSE) -> 2 | I71: 1 | J71: =VLOOKUP(INT(MOD(RC[-9],10)/1),Sheet1!R2C6:R9C9,4,FALSE) -> 7 | K71: 100 | L71: 一二三四五六七八九十一二三四五六七八九十 | M71: 26
A72: 71406 | B72: =VLOOKUP(INT(MOD(RC[-1],1000)/100),Sheet1!R2C11:R8C12,2,FALSE)&VLOOKUP(INT(MOD(RC[-1],10000)/1000),Sheet1!R2C1:R7C4,3,FALSE)&VLOOKUP(INT(MOD(RC[-1],10)/1),Sheet1!R2C6:R9C9,3,FALSE) -> 橙品圆润护盾 | C72: =INT(MOD(RC[-2],10000)/1000)*10+MOD(RC[-2],10) -> 16 | D72: =INT(MOD(RC[-3],1000)/100) -> 4 | E72: =2^RC[-1]*100 -> 1600 | F72: 100|100 | G72: =VLOOKUP(INT(MOD(RC[-6],10000)/1000),Sheet1!R2C1:R7C4,4,FALSE)&"|"&VLOOKUP(INT(MOD(RC[-6],10)/1),Sheet1!R2C6:R9C9,4,FALSE) -> 2|5 | H72: =VLOOKUP(INT(MOD(RC[-7],10000)/1000),Sheet1!R2C1:R7C4,4,FALSE) -> 2 | I72: 1 | J72: =VLOOKUP(INT(MOD(RC[-9],10)/1),Sheet1!R2C6:R9C9,4,FALSE) -> 5 | K72: 100 | L72: 一二三四五六七八九十一二三四五六七八九十 | M72: 33
A73: 71501 | B73: =VLOOKUP(INT(MOD(RC[-1],1000)/100),Sheet1!R2C11:R8C12,2,FALSE)&VLOOKUP(INT(MOD(RC[-1],10000)/1000),Sheet1!R2C1:R7C4,3,FALSE)&VLOOKUP(INT(MOD(RC[-1],10)/1),Sheet1!R2C6:R9C9,3,FALSE) -> 红品圆润鹰眼 | C73: =INT(MOD(RC[-2],10000)/1000)*10+MOD(RC[-2],10) -> 11 | D73: =INT(MOD(RC[-3],1000)/100) -> 5 | E73: =2^RC[-1]*100 -> 3200 | F73: 100|100 | G73: =VLOOKUP(INT(MOD(RC[-6],10000)/1000),Sheet1!R2C1:R7C4,4,FALSE)&"|"&VLOOKUP(INT(MOD(RC[-6],10)/1),Sheet1!R2C6:R9C9,4,FALSE) -> 2|11 | H73: =VLOOKUP(INT(MOD(RC[-7],10000)/1000),Sheet1!R2C1:R7C4,4,FALSE) -> 2 | I73: 1 | J73: =VLOOKUP(INT(MOD(RC[-9],10)/1),Sheet1!R2C6:R9C9,4,FALSE) -> 11 | K73: 100 | L73: 一二三四五六七八九十一二三四五六七八九十 | M73: 26
A74: 71502 | B74: =VLOOKUP(INT(MOD(RC[-1],1000)/100),Sheet1!R2C11:R8C12,2,FALSE)&VLOOKUP(INT(MOD(RC[-1],10000)/1000),Sheet1!R2C1:R7C4,3,FALSE)&VLOOKUP(INT(MOD(RC[-1],10)/1),Sheet1!R2C6:R9C9,3,FALSE) -> 红品圆润灵巧 | C74: =INT(MOD(RC[-2],10000)/1000)*10+MOD(RC[-2],10) -> 12 | D74: =INT(MOD(RC[-3],1000)/100) -> 5 | E74: =2^RC[-1]*100 -> 3200 | F74: 100|100 | G74: =VLOOKUP(INT(MOD(RC[-6],10000)/1000),Sheet1!R2C1:R7C4,4,FALSE)&"|"&VLOOKUP(INT(MOD(RC[-6],10)/1),Sheet1!R2C6:R9C9,4,FALSE) -> 2|12 | H74: =VLOOKUP(INT(MOD(RC[-7],10000)/1000),Sheet1!R2C1:R7C4,4,FALSE) -> 2 | I74: 1 | J74: =VLOOKUP(INT(MOD(RC[-9],10)/1),Sheet1!R2C6:R9C9,4,FALSE) -> 12 | K74: 100 | L74: 一二三四五六七八九十一二三四五六七八九十 | M74: 33
A75: 71503 | B75: =VLOOKUP(INT(MOD(RC[-1],1000)/100),Sheet1!R2C11:R8C12,2,FALSE)&VLOOKUP(INT(MOD(RC[-1],10000)/1000),Sheet1!R2C1:R7C4,3,FALSE)&VLOOKUP(INT(MOD(RC[-1],10)/1),Sheet1!R2C6:R9C9,3,FALSE) -> 红品圆润会心 | C75: =INT(MOD(RC[-2],10000)/1000)*10+MOD(RC[-2],10) -> 13 | D75: =INT(MOD(RC[-3],1000)/100) -> 5 | E75: =2^RC[-1]*100 -> 3200 | F75: 100|100 | G75: =VLOOKUP(INT(MOD(RC[-6],10000)/1000),Sheet1!R2C1:R7C4,4,FALSE)&"|"&VLOOKUP(INT(MOD(RC[-6],10)/1),Sheet1!R2C6:R9C9,4,FALSE) -> 2|13 | H75: =VLOOKUP(INT(MOD(RC[-7],10000)/1000),Sheet1!R2C1:R7C4,4,FALSE) -> 2 | I75: 1 | J75: =VLOOKUP(INT(MOD(RC[-9],10)/1),Sheet1!R2C6:R9C9,4,FALSE) -> 13 | K75: 100 | L75: 一二三四五六七八九十一二三四五六七八九十 | M75: 26
A76: 71504 | B76: =VLOOKUP(INT(MOD(RC[-1],1000)/100),Sheet1!R2C11:R8C12,2,FALSE)&VLOOKUP(INT(MOD(RC[-1],10000)/1000),Sheet1!R2C1:R7C4,3,FALSE)&VLOOKUP(INT(MOD(RC[-1],10)/1),Sheet1!R2C6:R9C9,3,FALSE) -> 红品圆润坚韧 | C76: =INT(MOD(RC[-2],10000)/1000)*10+MOD(RC[-2],10) -> 14 | D76: =INT(MOD(RC[-3],1000)/100) -> 5 | E76: =2^RC[-1]*100 -> 3200 | F76: 100|100 | G76: =VLOOKUP(INT(MOD(RC[-6],10000)/1000),Sheet1!R2C1:R7C4,4,FALSE)&"|"&VLOOKUP(INT(MOD(RC[-6],10)/1),Sheet1!R2C6:R9C9,4,FALSE) -> 2|14 | H76: =VLOOKUP(INT(MOD(RC[-7],10000)/1000),Sheet1!R2C1:R7C4,4,FALSE) -> 2 | I76: 1 | J76: =VLOOKUP(INT(MOD(RC[-9],10)/1),Sheet1!R2C6:R9C9,4,FALSE) -> 14 | K76: 100 | L76: 一二三四五六七八九十一二三四五六七八九十 | M76: 33
A77: 71505 | B77: =VLOOKUP(INT(MOD(RC[-1],1000)/100),Sheet1!R2C11:R8C12,2,FALSE)&VLOOKUP(INT(MOD(RC[-1],10000)/1000),Sheet1!R2C1:R7C4,3,FALSE)&VLOOKUP(INT(MOD(RC[-1],10)/1),Sheet1!R2C6:R9C9,3,FALSE) -> 红品圆润要害 | C77: =INT(MOD(RC[-2],10000)/1000)*10+MOD(RC[-2],10) -> 15 | D77: =INT(MOD(RC[-3],1000)/100) -> 5 | E77: =2^RC[-1]*100 -> 3200 | F77: 100|100 | G77: =VLOOKUP(INT(MOD(RC[-6],10000)/1000),Sheet1!R2C1:R7C4,4,FALSE)&"|"&VLOOKUP(INT(MOD(RC[-6],10)/1),Sheet1!R2C6:R9C9,4,FALSE) -> 2|7 | H77: =VLOOKUP(INT(MOD(RC[-7],10000)/1000),Sheet1!R2C1:R7C4,4,FALSE) -> 2 | I77: 1 | J77: =VLOOKUP(INT(MOD(RC[-9],10)/1),Sheet1!R2C6:R9C9,4,FALSE) -> 7 | K77: 100 | L77: 一二三四五六七八九十一二三四五六七八九十 | M77: 26
A78: 71506 | B78: =VLOOKUP(INT(MOD(RC[-1],1000)/100),Sheet1!R2C11:R8C12,2,FALSE)&VLOOKUP(INT(MOD(RC[-1],10000)/1000),Sheet1!R2C1:R7C4,3,FALSE)&VLOOKUP(INT(MOD(RC[-1],10)/1),Sheet1!R2C6:R9C9,3,FALSE) -> 红品圆润护盾 | C78: =INT(MOD(RC[-2],10000)/1000)*10+MOD(RC[-2],10) -> 16 | D78: =INT(MOD(RC[-3],1000)/100) -> 5 | E78: =2^RC[-1]*100 -> 3200 | F78: 100|100 | G78: =VLOOKUP(INT(MOD(RC[-6],10000)/1000),Sheet1!R2C1:R7C4,4,FALSE)&"|"&VLOOKUP(INT(MOD(RC[-6],10)/1),Sheet1!R2C6:R9C9,4,FALSE) -> 2|5 | H78: =VLOOKUP(INT(MOD(RC[-7],10000)/1000),Sheet1!R2C1:R7C4,4,FALSE) -> 2 | I78: 1 | J78: =VLOOKUP(INT(MOD(RC[-9],10)/1),Sheet1!R2C6:R9C9,4,FALSE) -> 5 | K78: 100 | L78: 一二三四五六七八九十一二三四五六七八九十 | M78: 33
A79: 72001 | B79: =VLOOKUP(INT(MOD(RC[-1],1000)/100),Sheet1!R2C11:R8C12,2,FALSE)&VLOOKUP(INT(MOD(RC[-1],10000)/1000),Sheet1!R2C1:R7C4,3,FALSE)&VLOOKUP(INT(MOD(RC[-1],10)/1),Sheet1!R2C6:R9C9,3,FALSE) -> 白品丰满鹰眼 | C79: =INT(MOD(RC[-2],10000)/1000)*10+MOD(RC[-2],10) -> 21 | D79: =INT(MOD(RC[-3],1000)/100) -> 0 | E79: =2^RC[-1]*100 -> 100 | F79: 100|100 | G79: =VLOOKUP(INT(MOD(RC[-6],10000)/1000),Sheet1!R2C1:R7C4,4,FALSE)&"|"&VLOOKUP(INT(MOD(RC[-6],10)/1),Sheet1!R2C6:R9C9,4,FALSE) -> 3|11 | H79: =VLOOKUP(INT(MOD(RC[-7],10000)/1000),Sheet1!R2C1:R7C4,4,FALSE) -> 3 | I79: 1 | J79: =VLOOKUP(INT(MOD(RC[-9],10)/1),Sheet1!R2C6:R9C9,4,FALSE) -> 11 | K79: 100 | L79: 一二三四五六七八九十一二三四五六七八九十 | M79: 26
A80: 72002 | B80: =VLOOKUP(INT(MOD(RC[-1],1000)/100),Sheet1!R2C11:R8C12,2,FALSE)&VLOOKUP(INT(MOD(RC[-1],10000)/1000),Sheet1!R2C1:R7C4,3,FALSE)&VLOOKUP(INT(MOD(RC[-1],10)/1),Sheet1!R2C6:R9C9,3,FALSE) -> 白品丰满灵巧 | C80: =INT(MOD(RC[-2],10000)/1000)*10+MOD(RC[-2],10) -> 22 | D80: =INT(MOD(RC[-3],1000)/100) -> 0 | E80: =2^RC[-1]*100 -> 100 | F80: 100|100 | G80: =VLOOKUP(INT(MOD(RC[-6],10000)/1000),Sheet1!R2C1:R7C4,4,FALSE)&"|"&VLOOKUP(INT(MOD(RC[-6],10)/1),Sheet1!R2C6:R9C9,4,FALSE) -> 3|12 | H80: =VLOOKUP(INT(MOD(RC[-7],10000)/1000),Sheet1!R2C1:R7C4,4,FALSE) -> 3 | I80: 1 | J80: =VLOOKUP(INT(MOD(RC[-9],10)/1),Sheet1!R2C6:R9C9,4,FALSE) -> 12 | K80: 100 | L80: 一二三四五六七八九十一二三四五六七八九十 | M80: 33
A81: 72003 | B81: =VLOOKUP(INT(MOD(RC[-1],1000)/100),Sheet1!R2C11:R8C12,2,FALSE)&VLOOKUP(INT(MOD(RC[-1],10000)/1000),Sheet1!R2C1:R7C4,3,FALSE)&VLOOKUP(INT(MOD(RC[-1],10)/1),Sheet1!R2C6:R9C9,3,FALSE) -> 白品丰满会心 | C81: =INT(MOD(RC[-2],10000)/1000)*10+MOD(RC[-2],10) -> 23 | D81: =INT(MOD(RC[-3],1000)/100) -> 0 | E81: =2^RC[-1]*100 -> 100 | F81: 100|100 | G81: =VLOOKUP(INT(MOD(RC[-6],10000)/1000),Sheet1!R2C1:R7C4,4,FALSE)&"|"&VLOOKUP(INT(MOD(RC[-6],10)/1),Sheet1!R2C6:R9C9,4,FALSE) -> 3|13 | H81: =VLOOKUP(INT(MOD(RC[-7],10000)/1000),Sheet1!R2C1:R7C4,4,FALSE) -> 3 | I81: 1 | J81: =VLOOKUP(INT(MOD(RC[-9],10)/1),Sheet1!R2C6:R9C9,4,FALSE) -> 13 | K81: 100 | L81: 一二三四五六七八九十一二三四五六七八九十 | M81: 26
A82: 72004 | B82: =VLOOKUP(INT(MOD(RC[-1],1000)/100),Sheet1!R2C11:R8C12,2,FALSE)&VLOOKUP(INT(MOD(RC[-1],10000)/1000),Sheet1!R2C1:R7C4,3,FALSE)&VLOOKUP(INT(MOD(RC[-1],10)/1),Sheet1!R2C6:R9C9,3,FALSE) -> 白品丰满坚韧 | C82: =INT(MOD(RC[-2],10000)/1000)*10+MOD(RC[-2],10) -> 24 | D82: =INT(MOD(RC[-3],1000)/100) -> 0 | E82: =2^RC[-1]*100 -> 100 | F82: 100|100 | G82: =VLOOKUP(INT(MOD(RC[-6],10000)/1000),Sheet1!R2C1:R7C4,4,FALSE)&"|"&VLOOKUP(INT(MOD(RC[-6],10)/1),Sheet1!R2C6:R9C9,4,FALSE) -> 3|14 | H82: =VLOOKUP(INT(MOD(RC[-7],10000)/1000),Sheet1!R2C1:R7C4,4,FALSE) -> 3 | I82: 1 | J82: =VLOOKUP(INT(MOD(RC[-9],10)/1),Sheet1!R2C6:R9C9,4,FALSE) -> 14 | K82: 100 | L82: 一二三四五六七八九十一二三四五六七八九十 | M82: 33
A83: 72005 | B83: =VLOOKUP(INT(MOD(RC[-1],1000)/100),Sheet1!R2C11:R8C12,2,FALSE)&VLOOKUP(INT(MOD(RC[-1],10000)/1000),Sheet1!R2C1:R7C4,3,FALSE)&VLOOKUP(INT(MOD(RC[-1],10)/1),Sheet1!R2C6:R9C9,3,FALSE) -> 白品丰满要害 | C83: =INT(MOD(RC[-2],10000)/1000)*10+MOD(RC[-2],10) -> 25 | D83: =INT(MOD(RC[-3],1000)/100) -> 0 | E83: =2^RC[-1]*100 -> 100 | F83: 100|100 | G83: =VLOOKUP(INT(MOD(RC[-6],10000)/1000),Sheet1!R2C1:R7C4,4,FALSE)&"|"&VLOOKUP(INT(MOD(RC[-6],10)/1),Sheet1!R2C6:R9C9,4,FALSE) -> 3|7 | H83: =VLOOKUP(INT(MOD(RC[-7],10000)/1000),Sheet1!R2C1:R7C4,4,FALSE) -> 3 | I83: 1 | J83: =VLOOKUP(INT(MOD(RC[-9],10)/1),Sheet1!R2C6:R9C9,4,FALSE) -> 7 | K83: 100 | L83: 一二三四五六七八九十一二三四五六七八九十 | M83: 26
A84: 72006 | B84: =VLOOKUP(INT(MOD(RC[-1],1000)/100),Sheet1!R2C11:R8C12,2,FALSE)&VLOOKUP(INT(MOD(RC[-1],10000)/1000),Sheet1!R2C1:R7C4,3,FALSE)&VLOOKUP(INT(MOD(RC[-1],10)/1),Sheet1!R2C6:R9C9,3,FALSE) -> 白品丰满护盾 | C84: =INT(MOD(RC[-2],10000)/1000)*10+MOD(RC[-2],10) -> 26 | D84: =INT(MOD(RC[-3],1000)/100) -> 0 | E84: =2^RC[-1]*100 -> 100 | F84: 100|100 | G84: =VLOOKUP(INT(MOD(RC[-6],10000)/1000),Sheet1!R2C1:R7C4,4,FALSE)&"|"&VLOOKUP(INT(MOD(RC[-6],10)/1),Sheet1!R2C6:R9C9,4,FALSE) -> 3|5 | H84: =VLOOKUP(INT(MOD(RC[-7],10000)/1000),Sheet1!R2C1:R7C4,4,FALSE) -> 3 | I84: 1 | J84: =VLOOKUP(INT(MOD(RC[-9],10)/1),Sheet1!R2C6:R9C9,4,FALSE) -> 5 | K84: 100 | L84: 一二三四五六七八九十一二三四五六七八九十 | M84: 33
A85: 72101 | B85: =VLOOKUP(INT(MOD(RC[-1],1000)/100),Sheet1!R2C11:R8C12,2,FALSE)&VLOOKUP(INT(MOD(RC[-1],10000)/1000),Sheet1!R2C1:R7C4,3,FALSE)&VLOOKUP(INT(MOD(RC[-1],10)/1),Sheet1!R2C6:R9C9,3,FALSE) -> 绿品丰满鹰眼 | C85: =INT(MOD(RC[-2],10000)/1000)*10+MOD(RC[-2],10) -> 21 | D85: =INT(MOD(RC[-3],1000)/100) -> 1 | E85: =2^RC[-1]*100 -> 200 | F85: 100|100 | G85: =VLOOKUP(INT(MOD(RC[-6],10000)/1000),Sheet1!R2C1:R7C4,4,FALSE)&"|"&VLOOKUP(INT(MOD(RC[-6],10)/1),Sheet1!R2C6:R9C9,4,FALSE) -> 3|11 | H85: =VLOOKUP(INT(MOD(RC[-7],10000)/1000),Sheet1!R2C1:R7C4,4,FALSE) -> 3 | I85: 1 | J85: =VLOOKUP(INT(MOD(RC[-9],10)/1),Sheet1!R2C6:R9C9,4,FALSE) -> 11 | K85: 100 | L85: 一二三四五六七八九十一二三四五六七八九十 | M85: 26
A86: 72102 | B86: =VLOOKUP(INT(MOD(RC[-1],1000)/100),Sheet1!R2C11:R8C12,2,FALSE)&VLOOKUP(INT(MOD(RC[-1],10000)/1000),Sheet1!R2C1:R7C4,3,FALSE)&VLOOKUP(INT(MOD(RC[-1],10)/1),Sheet1!R2C6:R9C9,3,FALSE) -> 绿品丰满灵巧 | C86: =INT(MOD(RC[-2],10000)/1000)*10+MOD(RC[-2],10) -> 22 | D86: =INT(MOD(RC[-3],1000)/100) -> 1 | E86: =2^RC[-1]*100 -> 200 | F86: 100|100 | G86: =VLOOKUP(INT(MOD(RC[-6],10000)/1000),Sheet1!R2C1:R7C4,4,FALSE)&"|"&VLOOKUP(INT(MOD(RC[-6],10)/1),Sheet1!R2C6:R9C9,4,FALSE) -> 3|12 | H86: =VLOOKUP(INT(MOD(RC[-7],10000)/1000),Sheet1!R2C1:R7C4,4,FALSE) -> 3 | I86: 1 | J86: =VLOOKUP(INT(MOD(RC[-9],10)/1),Sheet1!R2C6:R9C9,4,FALSE) -> 12 | K86: 100 | L86: 一二三四五六七八九十一二三四五六七八九十 | M86: 33
A87: 72103 | B87: =VLOOKUP(INT(MOD(RC[-1],1000)/100),Sheet1!R2C11:R8C12,2,FALSE)&VLOOKUP(INT(MOD(RC[-1],10000)/1000),Sheet1!R2C1:R7C4,3,FALSE)&VLOOKUP(INT(MOD(RC[-1],10)/1),Sheet1!R2C6:R9C9,3,FALSE) -> 绿品丰满会心 | C87: =INT(MOD(RC[-2],10000)/1000)*10+MOD(RC[-2],10) -> 23 | D87: =INT(MOD(RC[-3],1000)/100) -> 1 | E87: =2^RC[-1]*100 -> 200 | F87: 100|100 | G87: =VLOOKUP(INT(MOD(RC[-6],10000)/1000),Sheet1!R2C1:R7C4,4,FALSE)&"|"&VLOOKUP(INT(MOD(RC[-6],10)/1),Sheet1!R2C6:R9C9,4,FALSE) -> 3|13 | H87: =VLOOKUP(INT(MOD(RC[-7],10000)/1000),Sheet1!R2C1:R7C4,4,FALSE) -> 3 | I87: 1 | J87: =VLOOKUP(INT(MOD(RC[-9],10)/1),Sheet1!R2C6:R9C9,4,FALSE) -> 13 | K87: 100 | L87: 一二三四五六七八九十一二三四五六七八九十 | M87: 26
A88: 72104 | B88: =VLOOKUP(INT(MOD(RC[-1],1000)/100),Sheet1!R2C11:R8C12,2,FALSE)&VLOOKUP(INT(MOD(RC[-1],10000)/1000),Sheet1!R2C1:R7C4,3,FALSE)&VLOOKUP(INT(MOD(RC[-1],10)/1),Sheet1!R2C6:R9C9,3,FALSE) -> 绿品丰满坚韧 | C88: =INT(MOD(RC[-2],10000)/1000)*10+MOD(RC[-2],10) -> 24 | D88: =INT(MOD(RC[-3],1000)/100) -> 1 | E88: =2^RC[-1]*100 -> 200 | F88: 100|100 | G88: =VLOOKUP(INT(MOD(RC[-6],10000)/1000),Sheet1!R2C1:R7C4,4,FALSE)&"|"&VLOOKUP(INT(MOD(RC[-6],10)/1),Sheet1!R2C6:R9C9,4,FALSE) -> 3|14 | H88: =VLOOKUP(INT(MOD(RC[-7],10000)/1000),Sheet1!R2C1:R7C4,4,FALSE) -> 3 | I88: 1 | J88: =VLOOKUP(INT(MOD(RC[-9],10)/1),Sheet1!R2C6:R9C9,4,FALSE) -> 14 | K88: 100 | L88: 一二三四五六七八九十一二三四五六七八九十 | M88: 33
A89: 72105 | B89: =VLOOKUP(INT(MOD(RC[-1],1000)/100),Sheet1!R2C11:R8C12,2,FALSE)&VLOOKUP(INT(MOD(RC[-1],10000)/1000),Sheet1!R2C1:R7C4,3,FALSE)&VLOOKUP(INT(MOD(RC[-1],10)/1),Sheet1!R2C6:R9C9,3,FALSE) -> 绿品丰满要害 | C89: =INT(MOD(RC[-2],10000)/1000)*10+MOD(RC[-2],10) -> 25 | D89: =INT(MOD(RC[-3],1000)/100) -> 1 | E89: =2^RC[-1]*100 -> 200 | F89: 100|100 | G89: =VLOOKUP(INT(MOD(RC[-6],10000)/1000),Sheet1!R2C1:R7C4,4,FALSE)&"|"&VLOOKUP(INT(MOD(RC[-6],10)/1),Sheet1!R2C6:R9C9,4,FALSE) -> 3|7 | H89: =VLOOKUP(INT(MOD(RC[-7],10000)/1000),Sheet1!R2C1:R7C4,4,FALSE) -> 3 | I89: 1 | J89: =VLOOKUP(INT(MOD(RC[-9],10)/1),Sheet1!R2C6:R9C9,4,FALSE) -> 7 | K89: 100 | L89: 一二三四五六七八九十一二三四五六七八九十 | M89: 26
A90: 72106 | B90: =VLOOKUP(INT(MOD(RC[-1],1000)/100),Sheet1!R2C11:R8C12,2,FALSE)&VLOOKUP(INT(MOD(RC[-1],10000)/1000),Sheet1!R2C1:R7C4,3,FALSE)&VLOOKUP(INT(MOD(RC[-1],10)/1),Sheet1!R2C6:R9C9,3,FALSE) -> 绿品丰满护盾 | C90: =INT(MOD(RC[-2],10000)/1000)*10+MOD(RC[-2],10) -> 26 | D90: =INT(MOD(RC[-3],1000)/100) -> 1 | E90: =2^RC[-1]*100 -> 200 | F90: 100|100 | G90: =VLOOKUP(INT(MOD(RC[-6],10000)/1000),Sheet1!R2C1:R7C4,4,FALSE)&"|"&VLOOKUP(INT(MOD(RC[-6],10)/1),Sheet1!R2C6:R9C9,4,FALSE) -> 3|5 | H90: =VLOOKUP(INT(MOD(RC[-7],10000)/1000),Sheet1!R2C1:R7C4,4,FALSE) -> 3 | I90: 1 | J90: =VLOOKUP(INT(MOD(RC[-9],10)/1),Sheet1!R2C6:R9C9,4,FALSE) -> 5 | K90: 100 | L90: 一二三四五六七八九十一二三四五六七八九十 | M90: 33
A91: 72201 | B91: =VLOOKUP(INT(MOD(RC[-1],1000)/100),Sheet1!R2C11:R8C12,2,FALSE)&VLOOKUP(INT(MOD(RC[-1],10000)/1000),Sheet1!R2C1:R7C4,3,FALSE)&VLOOKUP(INT(MOD(RC[-1],10)/1),Sheet1!R2C6:R9C9,3,FALSE) -> 蓝品丰满鹰眼 | C91: =INT(MOD(RC[-2],10000)/1000)*10+MOD(RC[-2],10) -> 21 | D91: =INT(MOD(RC[-3],1000)/100) -> 2 | E91: =2^RC[-1]*100 -> 400 | F91: 100|100 | G91: =VLOOKUP(INT(MOD(RC[-6],10000)/1000),Sheet1!R2C1:R7C4,4,FALSE)&"|"&VLOOKUP(INT(MOD(RC[-6],10)/1),Sheet1!R2C6:R9C9,4,FALSE) -> 3|11 | H91: =VLOOKUP(INT(MOD(RC[-7],10000)/1000),Sheet1!R2C1:R7C4,4,FALSE) -> 3 | I91: 1 | J91: =VLOOKUP(INT(MOD(RC[-9],10)/1),Sheet1!R2C6:R9C9,4,FALSE) -> 11 | K91: 100 | L91: 一二三四五六七八九十一二三四五六七八九十 | M91: 26
A92: 72202 | B92: =VLOOKUP(INT(MOD(RC[-1],1000)/100),Sheet1!R2C11:R8C12,2,FALSE)&VLOOKUP(INT(MOD(RC[-1],10000)/1000),Sheet1!R2C1:R7C4,3,FALSE)&VLOOKUP(INT(MOD(RC[-1],10)/1),Sheet1!R2C6:R9C9,3,FALSE) -> 蓝品丰满灵巧 | C92: =INT(MOD(RC[-2],10000)/1000)*10+MOD(RC[-2],10) -> 22 | D92: =INT(MOD(RC[-3],1000)/100) -> 2 | E92: =2^RC[-1]*100 -> 400 | F92: 100|100 | G92: =VLOOKUP(INT(MOD(RC[-6],10000)/1000),Sheet1!R2C1:R7C4,4,FALSE)&"|"&VLOOKUP(INT(MOD(RC[-6],10)/1),Sheet1!R2C6:R9C9,4,FALSE) -> 3|12 | H92: =VLOOKUP(INT(MOD(RC[-7],10000)/1000),Sheet1!R2C1:R7C4,4,FALSE) -> 3 | I92: 1 | J92: =VLOOKUP(INT(MOD(RC[-9],10)/1),Sheet1!R2C6:R9C9,4,FALSE) -> 12 | K92: 100 | L92: 一二三四五六七八九十一二三四五六七八九十 | M92: 33
A93: 72203 | B93: =VLOOKUP(INT(MOD(RC[-1],1000)/100),Sheet1!R2C11:R8C12,2,FALSE)&VLOOKUP(INT(MOD(RC[-1],10000)/1000),Sheet1!R2C1:R7C4,3,FALSE)&VLOOKUP(INT(MOD(RC[-1],10)/1),Sheet1!R2C6:R9C9,3,FALSE) -> 蓝品丰满会心 | C93: =INT(MOD(RC[-2],10000)/1000)*10+MOD(RC[-2],10) -> 23 | D93: =INT(MOD(RC[-3],1000)/100) -> 2 | E93: =2^RC[-1]*100 -> 400 | F93: 100|100 | G93: =VLOOKUP(INT(MOD(RC[-6],10000)/1000),Sheet1!R2C1:R7C4,4,FALSE)&"|"&VLOOKUP(INT(MOD(RC[-6],10)/1),Sheet1!R2C6:R9C9,4,FALSE) -> 3|13 | H93: =VLOOKUP(INT(MOD(RC[-7],10000)/1000),Sheet1!R2C1:R7C4,4,FALSE) -> 3 | I93: 1 | J93: =VLOOKUP(INT(MOD(RC[-9],10)/1),Sheet1!R2C6:R9C9,4,FALSE) -> 13 | K93: 100 | L93: 一二三四五六七八九十一二三四五六七八九十 | M93: 26
A94: 72204 | B94: =VLOOKUP(INT(MOD(RC[-1],1000)/100),Sheet1!R2C11:R8C12,2,FALSE)&VLOOKUP(INT(MOD(RC[-1],10000)/1000),Sheet1!R2C1:R7C4,3,FALSE)&VLOOKUP(INT(MOD(RC[-1],10)/1),Sheet1!R2C6:R9C9,3,FALSE) -> 蓝品丰满坚韧 | C94: =INT(MOD(RC[-2],10000)/1000)*10+MOD(RC[-2],10) -> 24 | D94: =INT(MOD(RC[-3],1000)/100) -> 2 | E94: =2^RC[-1]*100 -> 400 | F94: 100|100 | G94: =VLOOKUP(INT(MOD(RC[-6],10000)/1000),Sheet1!R2C1:R7C4,4,FALSE)&"|"&VLOOKUP(INT(MOD(RC[-6],10)/1),Sheet1!R2C6:R9C9,4,FALSE) -> 3|14 | H94: =VLOOKUP(INT(MOD(RC[-7],10000)/1000),Sheet1!R2C1:R7C4,4,FALSE) -> 3 | I94: 1 | J94: =VLOOKUP(INT(MOD(RC[-9],10)/1),Sheet1!R2C6:R9C9,4,FALSE) -> 14 | K94: 100 | L94: 一二三四五六七八九十一二三四五六七八九十 | M94: 33
A95: 72205 | B95: =VLOOKUP(INT(MOD(RC[-1],1000)/100),Sheet1!R2C11:R8C12,2,FALSE)&VLOOKUP(INT(MOD(RC[-1],10000)/1000),Sheet1!R2C1:R7C4,3,FALSE)&VLOOKUP(INT(MOD(RC[-1],10)/1),Sheet1!R2C6:R9C9,3,FALSE) -> 蓝品丰满要害 | C95: =INT(MOD(RC[-2],10000)/1000)*10+MOD(RC[-2],10) -> 25 | D95: =INT(MOD(RC[-3],1000)/100) -> 2 | E95: =2^RC[-1]*100 -> 400 | F95: 100|100 | G95: =VLOOKUP(INT(MOD(RC[-6],10000)/1000),Sheet1!R2C1:R7C4,4,FALSE)&"|"&VLOOKUP(INT(MOD(RC[-6],10)/1),Sheet1!R2C6:R9C9,4,FALSE) -> 3|7 | H95: =VLOOKUP(INT(MOD(RC[-7],10000)/1000),Sheet1!R2C1:R7C4,4,FALSE) -> 3 | I95: 1 | J95: =VLOOKUP(INT(MOD(RC[-9],10)/1),Sheet1!R2C6:R9C9,4,FALSE) -> 7 | K95: 100 | L95: 一二三四五六七八九十一二三四五六七八九十 | M95: 26
A96: 72206 | B96: =VLOOKUP(INT(MOD(RC[-1],1000)/100),Sheet1!R2C11:R8C12,2,FALSE)&VLOOKUP(INT(MOD(RC[-1],10000)/1000),Sheet1!R2C1:R7C4,3,FALSE)&VLOOKUP(INT(MOD(RC[-1],10)/1),Sheet1!R2C6:R9C9,3,FALSE) -> 蓝品丰满护盾 | C96: =INT(MOD(RC[-2],10000)/1000)*10+MOD(RC[-2],10) -> 26 | D96: =INT(MOD(RC[-3],1000)/100) -> 2 | E96: =2^RC[-1]*100 -> 400 | F96: 100|100 | G96: =VLOOKUP(INT(MOD(RC[-6],10000)/1000),Sheet1!R2C1:R7C4,4,FALSE)&"|"&VLOOKUP(INT(MOD(RC[-6],10)/1),Sheet1!R2C6:R9C9,4,FALSE) -> 3|5 | H96: =VLOOKUP(INT(MOD(RC[-7],10000)/1000),Sheet1!R2C1:R7C4,4,FALSE) -> 3 | I96: 1 | J96: =VLOOKUP(INT(MOD(RC[-9],10)/1),Sheet1!R2C6:R9C9,4,FALSE) -> 5 | K96: 100 | L96: 一二三四五六七八九十一二三四五六七八九十 | M96: 33
A97: 72301 | B97: =VLOOKUP(INT(MOD(RC[-1],1000)/100),Sheet1!R2C11:R8C12,2,FALSE)&VLOOKUP(INT(MOD(RC[-1],10000)/1000),Sheet1!R2C1:R7C4,3,FALSE)&VLOOKUP(INT(MOD(RC[-1],10)/1),Sheet1!R2C6:R9C9,3,FALSE) -> 紫品丰满鹰眼 | C97: =INT(MOD(RC[-2],10000)/1000)*10+MOD(RC[-2],10) -> 21 | D97: =INT(MOD(RC[-3],1000)/100) -> 3 | E97: =2^RC[-1]*100 -> 800 | F97: 100|100 | G97: =VLOOKUP(INT(MOD(RC[-6],10000)/1000),Sheet1!R2C1:R7C4,4,FALSE)&"|"&VLOOKUP(INT(MOD(RC[-6],10)/1),Sheet1!R2C6:R9C9,4,FALSE) -> 3|11 | H97: =VLOOKUP(INT(MOD(RC[-7],10000)/1000),Sheet1!R2C1:R7C4,4,FALSE) -> 3 | I97: 1 | J97: =VLOOKUP(INT(MOD(RC[-9],10)/1),Sheet1!R2C6:R9C9,4,FALSE) -> 11 | K97: 100 | L97: 一二三四五六七八九十一二三四五六七八九十 | M97: 26
A98: 72302 | B98: =VLOOKUP(INT(MOD(RC[-1],1000)/100),Sheet1!R2C11:R8C12,2,FALSE)&VLOOKUP(INT(MOD(RC[-1],10000)/1000),Sheet1!R2C1:R7C4,3,FALSE)&VLOOKUP(INT(MOD(RC[-1],10)/1),Sheet1!R2C6:R9C9,3,FALSE) -> 紫品丰满灵巧 | C98: =INT(MOD(RC[-2],10000)/1000)*10+MOD(RC[-2],10) -> 22 | D98: =INT(MOD(RC[-3],1000)/100) -> 3 | E98: =2^RC[-1]*100 -> 800 | F98: 100|100 | G98: =VLOOKUP(INT(MOD(RC[-6],10000)/1000),Sheet1!R2C1:R7C4,4,FALSE)&"|"&VLOOKUP(INT(MOD(RC[-6],10)/1),Sheet1!R2C6:R9C9,4,FALSE) -> 3|12 | H98: =VLOOKUP(INT(MOD(RC[-7],10000)/1000),Sheet1!R2C1:R7C4,4,FALSE) -> 3 | I98: 1 | J98: =VLOOKUP(INT(MOD(RC[-9],10)/1),Sheet1!R2C6:R9C9,4,FALSE) -> 12 | K98: 100 | L98: 一二三四五六七八九十一二三四五六七八九十 | M98: 33
A99: 72303 | B99: =VLOOKUP(INT(MOD(RC[-1],1000)/100),Sheet1!R2C11:R8C12,2,FALSE)&VLOOKUP(INT(MOD(RC[-1],10000)/1000),Sheet1!R2C1:R7C4,3,FALSE)&VLOOKUP(INT(MOD(RC[-1],10)/1),Sheet1!R2C6:R9C9,3,FALSE) -> 紫品丰满会心 | C99: =INT(MOD(RC[-2],10000)/1000)*10+MOD(RC[-2],10) -> 23 | D99: =INT(MOD(RC[-3],1000)/100) -> 3 | E99: =2^RC[-1]*100 -> 800 | F99: 100|100 | G99: =VLOOKUP(INT(MOD(RC[-6],10000)/1000),Sheet1!R2C1:R7C4,4,FALSE)&"|"&VLOOKUP(INT(MOD(RC[-6],10)/1),Sheet1!R2C6:R9C9,4,FALSE) -> 3|13 | H99: =VLOOKUP(INT(MOD(RC[-7],10000)/1000),Sheet1!R2C1:R7C4,4,FALSE) -> 3 | I99: 1 | J99: =VLOOKUP(INT(MOD(RC[-9],10)/1),Sheet1!R2C6:R9C9,4,FALSE) -> 13 | K99: 100 | L99: 一二三四五六七八九十一二三四五六七八九十 | M99: 26
A100: 72304 | B100: =VLOOKUP(INT(MOD(RC[-1],1000)/100),Sheet1!R2C11:R8C12,2,FALSE)&VLOOKUP(INT(MOD(RC[-1],10000)/1000),Sheet1!R2C1:R7C4,3,FALSE)&VLOOKUP(INT(MOD(RC[-1],10)/1),Sheet1!R2C6:R9C9,3,FALSE) -> 紫品丰满坚韧 | C100: =INT(MOD(RC[-2],10000)/1000)*10+MOD(RC[-2],10) -> 24 | D100: =INT(MOD(RC[-3],1000)/100) -> 3 | E100: =2^RC[-1]*100 -> 800 | F100: 100|100 | G100: =VLOOKUP(INT(MOD(RC[-6],10000)/1000),Sheet1!R2C1:R7C4,4,FALSE)&"|"&VLOOKUP(INT(MOD(RC[-6],10)/1),Sheet1!R2C6:R9C9,4,FALSE) -> 3|14 | H100: =VLOOKUP(INT(MOD(RC[-7],10000)/1000),Sheet1!R2C1:R7C4,4,FALSE) -> 3 | I100: 1 | J100: =VLOOKUP(INT(MOD(RC[-9],10)/1),Sheet1!R2C6:R9C9,4,FALSE) -> 14 | K100: 100 | L100: 一二三四五六七八九十一二三四五六七八九十 | M100: 33
A101: 72305 | B101: =VLOOKUP(INT(MOD(RC[-1],1000)/100),Sheet1!R2C11:R8C12,2,FALSE)&VLOOKUP(INT(MOD(RC[-1],10000)/1000),Sheet1!R2C1:R7C4,3,FALSE)&VLOOKUP(INT(MOD(RC[-1],10)/1),Sheet1!R2C6:R9C9,3,FALSE) -> 紫品丰满要害 | C101: =INT(MOD(RC[-2],10000)/1000)*10+MOD(RC[-2],10) -> 25 | D101: =INT(MOD(RC[-3],1000)/100) -> 3 | E101: =2^RC[-1]*100 -> 800 | F101: 100|100 | G101: =VLOOKUP(INT(MOD(RC[-6],10000)/1000),Sheet1!R2C1:R7C4,4,FALSE)&"|"&VLOOKUP(INT(MOD(RC[-6],10)/1),Sheet1!R2C6:R9C9,4,FALSE) -> 3|7 | H101: =VLOOKUP(INT(MOD(RC[-7],10000)/1000),Sheet1!R2C1:R7C4,4,FALSE) -> 3 | I101: 1 | J101: =VLOOKUP(INT(MOD(RC[-9],10)/1),Sheet1!R2C6:R9C9,4,FALSE) -> 7 | K101: 100 | L101: 一二三四五六七八九十一二三四五六七八九十 | M101: 26
A102: 72306 | B102: =VLOOKUP(INT(MOD(RC[-1],1000)/100),Sheet1!R2C11:R8C12,2,FALSE)&VLOOKUP(INT(MOD(RC[-1],10000)/1000),Sheet1!R2C1:R7C4,3,FALSE)&VLOOKUP(INT(MOD(RC[-1],10)/1),Sheet1!R2C6:R9C9,3,FALSE) -> 紫品丰满护盾 | C102: =INT(MOD(RC[-2],10000)/1000)*10+MOD(RC[-2],10) -> 26 | D102: =INT(MOD(RC[-3],1000)/100) -> 3 | E102: =2^RC[-1]*100 -> 800 | F102: 100|100 | G102: =VLOOKUP(INT(MOD(RC[-6],10000)/1000),Sheet1!R2C1:R7C4,4,FALSE)&"|"&VLOOKUP(INT(MOD(RC[-6],10)/1),Sheet1!R2C6:R9C9,4,FALSE) -> 3|5 | H102: =VLOOKUP(INT(MOD(RC[-7],10000)/1000),Sheet1!R2C1:R7C4,4,FALSE) -> 3 | I102: 1 | J102: =VLOOKUP(INT(MOD(RC[-9],10)/1),Sheet1!R2C6:R9C9,4,FALSE) -> 5 | K102: 100 | L102: 一二三四五六七八九十一二三四五六七八九十 | M102: 33
A103: 72401 | B103: =VLOOKUP(INT(MOD(RC[-1],1000)/100),Sheet1!R2C11:R8C12,2,FALSE)&VLOOKUP(INT(MOD(RC[-1],10000)/1000),Sheet1!R2C1:R7C4,3,FALSE)&VLOOKUP(INT(MOD(RC[-1],10)/1),Sheet1!R2C6:R9C9,3,FALSE) -> 橙品丰满鹰眼 | C103: =INT(MOD(RC[-2],10000)/1000)*10+MOD(RC[-2],10) -> 21 | D103: =INT(MOD(RC[-3],1000)/100) -> 4 | E103: =2^RC[-1]*100 -> 1600 | F103: 100|100 | G103: =VLOOKUP(INT(MOD(RC[-6],10000)/1000),Sheet1!R2C1:R7C4,4,FALSE)&"|"&VLOOKUP(INT(MOD(RC[-6],10)/1),Sheet1!R2C6:R9C9,4,FALSE) -> 3|11 | H103: =VLOOKUP(INT(MOD(RC[-7],10000)/1000),Sheet1!R2C1:R7C4,4,FALSE) -> 3 | I103: 1 | J103: =VLOOKUP(INT(MOD(RC[-9],10)/1),Sheet1!R2C6:R9C9,4,FALSE) -> 11 | K103: 100 | L103: 一二三四五六七八九十一二三四五六七八九十 | M103: 26
A104: 72402 | B104: =VLOOKUP(INT(MOD(RC[-1],1000)/100),Sheet1!R2C11:R8C12,2,FALSE)&VLOOKUP(INT(MOD(RC[-1],10000)/1000),Sheet1!R2C1:R7C4,3,FALSE)&VLOOKUP(INT(MOD(RC[-1],10)/1),Sheet1!R2C6:R9C9,3,FALSE) -> 橙品丰满灵巧 | C104: =INT(MOD(RC[-2],10000)/1000)*10+MOD(RC[-2],10) -> 22 | D104: =INT(MOD(RC[-3],1000)/100) -> 4 | E104: =2^RC[-1]*100 -> 1600 | F104: 100|100 | G104: =VLOOKUP(INT(MOD(RC[-6],10000)/1000),Sheet1!R2C1:R7C4,4,FALSE)&"|"&VLOOKUP(INT(MOD(RC[-6],10)/1),Sheet1!R2C6:R9C9,4,FALSE) -> 3|12 | H104: =VLOOKUP(INT(MOD(RC[-7],10000)/1000),Sheet1!R2C1:R7C4,4,FALSE) -> 3 | I104: 1 | J104: =VLOOKUP(INT(MOD(RC[-9],10)/1),Sheet1!R2C6:R9C9,4,FALSE) -> 12 | K104: 100 | L104: 一二三四五六七八九十一二三四五六七八九十 | M104: 33
A105: 72403 | B105: =VLOOKUP(INT(MOD(RC[-1],1000)/100),Sheet1!R2C11:R8C12,2,FALSE)&VLOOKUP(INT(MOD(RC[-1],10000)/1000),Sheet1!R2C1:R7C4,3,FALSE)&VLOOKUP(INT(MOD(RC[-1],10)/1),Sheet1!R2C6:R9C9,3,FALSE) -> 橙品丰满会心 | C105: =INT(MOD(RC[-2],10000)/1000)*10+MOD(RC[-2],10) -> 23 | D105: =INT(MOD(RC[-3],1000)/100) -> 4 | E105: =2^RC[-1]*100 -> 1600 | F105: 100|100 | G105: =VLOOKUP(INT(MOD(RC[-6],10000)/1000),Sheet1!R2C1:R7C4,4,FALSE)&"|"&VLOOKUP(INT(MOD(RC[-6],10)/1),Sheet1!R2C6:R9C9,4,FALSE) -> 3|13 | H105: =VLOOKUP(INT(MOD(RC[-7],10000)/1000),Sheet1!R2C1:R7C4,4,FALSE) -> 3 | I105: 1 | J105: =VLOOKUP(INT(MOD(RC[-9],10)/1),Sheet1!R2C6:R9C9,4,FALSE) -> 13 | K105: 100 | L105: 一二三四五六七八九十一二三四五六七八九十 | M105: 26
A106: 72404 | B106: =VLOOKUP(INT(MOD(RC[-1],1000)/100),Sheet1!R2C11:R8C12,2,FALSE)&VLOOKUP(INT(MOD(RC[-1],10000)/1000),Sheet1!R2C1:R7C4,3,FALSE)&VLOOKUP(INT(MOD(RC[-1],10)/1),Sheet1!R2C6:R9C9,3,FALSE) -> 橙品丰满坚韧 | C106: =INT(MOD(RC[-2],10000)/1000)*10+MOD(RC[-2],10) -> 24 | D106: =INT(MOD(RC[-3],1000)/100) -> 4 | E106: =2^RC[-1]*100 -> 1600 | F106: 100|100 | G106: =VLOOKUP(INT(MOD(RC[-6],10000)/1000),Sheet1!R2C1:R7C4,4,FALSE)&"|"&VLOOKUP(INT(MOD(RC[-6],10)/1),Sheet1!R2C6:R9C9,4,FALSE) -> 3|14 | H106: =VLOOKUP(INT(MOD(RC[-7],10000)/1000),Sheet1!R2C1:R7C4,4,FALSE) -> 3 | I106: 1 | J106: =VLOOKUP(INT(MOD(RC[-9],10)/1),Sheet1!R2C6:R9C9,4,FALSE) -> 14 | K106: 100 | L106: 一二三四五六七八九十一二三四五六七八九十 | M106: 33
A107: 72405 | B107: =VLOOKUP(INT(MOD(RC[-1],1000)/100),Sheet1!R2C11:R8C12,2,FALSE)&VLOOKUP(INT(MOD(RC[-1],10000)/1000),Sheet1!R2C1:R7C4,3,FALSE)&VLOOKUP(INT(MOD(RC[-1],10)/1),Sheet1!R2C6:R9C9,3,FALSE) -> 橙品丰满要害 | C107: =INT(MOD(RC[-2],10000)/1000)*10+MOD(RC[-2],10) -> 25 | D107: =INT(MOD(RC[-3],1000)/100) -> 4 | E107: =2^RC[-1]*100 -> 1600 | F107: 100|100 | G107: =VLOOKUP(INT(MOD(RC[-6],10000)/1000),Sheet1!R2C1:R7C4,4,FALSE)&"|"&VLOOKUP(INT(MOD(RC[-6],10)/1),Sheet1!R2C6:R9C9,4,FALSE) -> 3|7 | H107: =VLOOKUP(INT(MOD(RC[-7],10000)/1000),Sheet1!R2C1:R7C4,4,FALSE) -> 3 | I107: 1 | J107: =VLOOKUP(INT(MOD(RC[-9],10)/1),Sheet1!R2C6:R9C9,4,FALSE) -> 7 | K107: 100 | L107: 一二三四五六七八九十一二三四五六七八九十 | M107: 26
A108: 72406 | B108: =VLOOKUP(INT(MOD(RC[-1],1000)/100),Sheet1!R2C11:R8C12,2,FALSE)&VLOOKUP(INT(MOD(RC[-1],10000)/1000),Sheet1!R2C1:R7C4,3,FALSE)&VLOOKUP(INT(MOD(RC[-1],10)/1),Sheet1!R2C6:R9C9,3,FALSE) -> 橙品丰满护盾 | C108: =INT(MOD(RC[-2],10000)/1000)*10+MOD(RC[-2],10) -> 26 | D108: =INT(MOD(RC[-3],1000)/100) -> 4 | E108: =2^RC[-1]*100 -> 1600 | F108: 100|100 | G108: =VLOOKUP(INT(MOD(RC[-6],10000)/1000),Sheet1!R2C1:R7C4,4,FALSE)&"|"&VLOOKUP(INT(MOD(RC[-6],10)/1),Sheet1!R2C6:R9C9,4,FALSE) -> 3|5 | H108: =VLOOKUP(INT(MOD(RC[-7],10000)/1000),Sheet1!R2C1:R7C4,4,FALSE) -> 3 | I108: 1 | J108: =VLOOKUP(INT(MOD(RC[-9],10)/1),Sheet1!R2C6:R9C9,4,FALSE) -> 5 | K108: 100 | L108: 一二三四五六七八九十一二三四五六七八九十 | M108: 33
A109: 72501 | B109: =VLOOKUP(INT(MOD(RC[-1],1000)/100),Sheet1!R2C11:R8C12,2,FALSE)&VLOOKUP(INT(MOD(RC[-1],10000)/1000),Sheet1!R2C1:R7C4,3,FALSE)&VLOOKUP(INT(MOD(RC[-1],10)/1),Sheet1!R2C6:R9C9,3,FALSE) -> 红品丰满鹰眼 | C109: =INT(MOD(RC[-2],10000)/1000)*10+MOD(RC[-2],10) -> 21 | D109: =INT(MOD(RC[-3],1000)/100) -> 5 | E109: =2^RC[-1]*100 -> 3200 | F109: 100|100 | G109: =VLOOKUP(INT(MOD(RC[-6],10000)/1000),Sheet1!R2C1:R7C4,4,FALSE)&"|"&VLOOKUP(INT(MOD(RC[-6],10)/1),Sheet1!R2C6:R9C9,4,FALSE) -> 3|11 | H109: =VLOOKUP(INT(MOD(RC[-7],10000)/1000),Sheet1!R2C1:R7C4,4,FALSE) -> 3 | I109: 1 | J109: =VLOOKUP(INT(MOD(RC[-9],10)/1),Sheet1!R2C6:R9C9,4,FALSE) -> 11 | K109: 100 | L109: 一二三四五六七八九十一二三四五六七八九十 | M109: 26
A110: 72502 | B110: =VLOOKUP(INT(MOD(RC[-1],1000)/100),Sheet1!R2C11:R8C12,2,FALSE)&VLOOKUP(INT(MOD(RC[-1],10000)/1000),Sheet1!R2C1:R7C4,3,FALSE)&VLOOKUP(INT(MOD(RC[-1],10)/1),Sheet1!R2C6:R9C9,3,FALSE) -> 红品丰满灵巧 | C110: =INT(MOD(RC[-2],10000)/1000)*10+MOD(RC[-2],10) -> 22 | D110: =INT(MOD(RC[-3],1000)/100) -> 5 | E110: =2^RC[-1]*100 -> 3200 | F110: 100|100 | G110: =VLOOKUP(INT(MOD(RC[-6],10000)/1000),Sheet1!R2C1:R7C4,4,FALSE)&"|"&VLOOKUP(INT(MOD(RC[-6],10)/1),Sheet1!R2C6:R9C9,4,FALSE) -> 3|12 | H110: =VLOOKUP(INT(MOD(RC[-7],10000)/1000),Sheet1!R2C1:R7C4,4,FALSE) -> 3 | I110: 1 | J110: =VLOOKUP(INT(MOD(RC[-9],10)/1),Sheet1!R2C6:R9C9,4,FALSE) -> 12 | K110: 100 | L110: 一二三四五六七八九十一二三四五六七八九十 | M110: 33
A111: 72503 | B111: =VLOOKUP(INT(MOD(RC[-1],1000)/100),Sheet1!R2C11:R8C12,2,FALSE)&VLOOKUP(INT(MOD(RC[-1],10000)/1000),Sheet1!R2C1:R7C4,3,FALSE)&VLOOKUP(INT(MOD(RC[-1],10)/1),Sheet1!R2C6:R9C9,3,FALSE) -> 红品丰满会心 | C111: =INT(MOD(RC[-2],10000)/1000)*10+MOD(RC[-2],10) -> 23 | D111: =INT(MOD(RC[-3],1000)/100) -> 5 | E111: =2^RC[-1]*100 -> 3200 | F111: 100|100 | G111: =VLOOKUP(INT(MOD(RC[-6],10000)/1000),Sheet1!R2C1:R7C4,4,FALSE)&"|"&VLOOKUP(INT(MOD(RC[-6],10)/1),Sheet1!R2C6:R9C9,4,FALSE) -> 3|13 | H111: =VLOOKUP(INT(MOD(RC[-7],10000)/1000),Sheet1!R2C1:R7C4,4,FALSE) -> 3 | I111: 1 | J111: =VLOOKUP(INT(MOD(RC[-9],10)/1),Sheet1!R2C6:R9C9,4,FALSE) -> 13 | K111: 100 | L111: 一二三四五六七八九十一二三四五六七八九十 | M111: 26
A112: 72504 | B112: =VLOOKUP(INT(MOD(RC[-1],1000)/100),Sheet1!R2C11:R8C12,2,FALSE)&VLOOKUP(INT(MOD(RC[-1],10000)/1000),Sheet1!R2C1:R7C4,3,FALSE)&VLOOKUP(INT(MOD(RC[-1],10)/1),Sheet1!R2C6:R9C9,3,FALSE) -> 红品丰满坚韧 | C112: =INT(MOD(RC[-2],10000)/1000)*10+MOD(RC[-2],10) -> 24 | D112: =INT(MOD(RC[-3],1000)/100) -> 5 | E112: =2^RC[-1]*100 -> 3200 | F112: 100|100 | G112: =VLOOKUP(INT(MOD(RC[-6],10000)/1000),Sheet1!R2C1:R7C4,4,FALSE)&"|"&VLOOKUP(INT(MOD(RC[-6],10)/1),Sheet1!R2C6:R9C9,4,FALSE) -> 3|14 | H112: =VLOOKUP(INT(MOD(RC[-7],10000)/1000),Sheet1!R2C1:R7C4,4,FALSE) -> 3 | I112: 1 | J112: =VLOOKUP(INT(MOD(RC[-9],10)/1),Sheet1!R2C6:R9C9,4,FALSE) -> 14 | K112: 100 | L112: 一二三四五六七八九十一二三四五六七八九十 | M112: 33
A113: 72505 | B113: =VLOOKUP(INT(MOD(RC[-1],1000)/100),Sheet1!R2C11:R8C12,2,FALSE)&VLOOKUP(INT(MOD(RC[-1],10000)/1000),Sheet1!R2C1:R7C4,3,FALSE)&VLOOKUP(INT(MOD(RC[-1],10)/1),Sheet1!R2C6:R9C9,3,FALSE) -> 红品丰满要害 | C113: =INT(MOD(RC[-2],10000)/1000)*10+MOD(RC[-2],10) -> 25 | D113: =INT(MOD(RC[-3],1000)/100) -> 5 | E113: =2^RC[-1]*100 -> 3200 | F113: 100|100 | G113: =VLOOKUP(INT(MOD(RC[-6],10000)/1000),Sheet1!R2C1:R7C4,4,FALSE)&"|"&VLOOKUP(INT(MOD(RC[-6],10)/1),Sheet1!R2C6:R9C9,4,FALSE) -> 3|7 | H113: =VLOOKUP(INT(MOD(RC[-7],10000)/1000),Sheet1!R2C1:R7C4,4,FALSE) -> 3 | I113: 1 | J113: =VLOOKUP(INT(MOD(RC[-9],10)/1),Sheet1!R2C6:R9C9,4,FALSE) -> 7 | K113: 100 | L113: 一二三四五六七八九十一二三四五六七八九十 | M113: 26
A114: 72506 | B114: =VLOOKUP(INT(MOD(RC[-1],1000)/100),Sheet1!R2C11:R8C12,2,FALSE)&VLOOKUP(INT(MOD(RC[-1],10000)/1000),Sheet1!R2C1:R7C4,3,FALSE)&VLOOKUP(INT(MOD(RC[-1],10)/1),Sheet1!R2C6:R9C9,3,FALSE) -> 红品丰满护盾 | C114: =INT(MOD(RC[-2],10000)/1000)*10+MOD(RC[-2],10) -> 26 | D114: =INT(MOD(RC[-3],1000)/100) -> 5 | E114: =2^RC[-1]*100 -> 3200 | F114: 100|100 | G114: =VLOOKUP(INT(MOD(RC[-6],10000)/1000),Sheet1!R2C1:R7C4,4,FALSE)&"|"&VLOOKUP(INT(MOD(RC[-6],10)/1),Sheet1!R2C6:R9C9,4,FALSE) -> 3|5 | H114: =VLOOKUP(INT(MOD(RC[-7],10000)/1000),Sheet1!R2C1:R7C4,4,FALSE) -> 3 | I114: 1 | J114: =VLOOKUP(INT(MOD(RC[-9],10)/1),Sheet1!R2C6:R9C9,4,FALSE) -> 5 | K114: 100 | L114: 一二三四五六七八九十一二三四五六七八九十 | M114: 33
A115: 73001 | B115: =VLOOKUP(INT(MOD(RC[-1],1000)/100),Sheet1!R2C11:R8C12,2,FALSE)&VLOOKUP(INT(MOD(RC[-1],10000)/1000),Sheet1!R2C1:R7C4,3,FALSE)&VLOOKUP(INT(MOD(RC[-1],10)/1),Sheet1!R2C6:R9C9,3,FALSE) -> 白品厚实鹰眼 | C115: =INT(MOD(RC[-2],10000)/1000)*10+MOD(RC[-2],10) -> 31 | D115: =INT(MOD(RC[-3],1000)/100) -> 0 | E115: =2^RC[-1]*100 -> 100 | F115: 100|100 | G115: =VLOOKUP(INT(MOD(RC[-6],10000)/1000),Sheet1!R2C1:R7C4,4,FALSE)&"|"&VLOOKUP(INT(MOD(RC[-6],10)/1),Sheet1!R2C6:R9C9,4,FALSE) -> 4|11 | H115: =VLOOKUP(INT(MOD(RC[-7],10000)/1000),Sheet1!R2C1:R7C4,4,FALSE) -> 4 | I115: 1 | J115: =VLOOKUP(INT(MOD(RC[-9],10)/1),Sheet1!R2C6:R9C9,4,FALSE) -> 11 | K115: 100 | L115: 一二三四五六七八九十一二三四五六七八九十 | M115: 26
A116: 73002 | B116: =VLOOKUP(INT(MOD(RC[-1],1000)/100),Sheet1!R2C11:R8C12,2,FALSE)&VLOOKUP(INT(MOD(RC[-1],10000)/1000),Sheet1!R2C1:R7C4,3,FALSE)&VLOOKUP(INT(MOD(RC[-1],10)/1),Sheet1!R2C6:R9C9,3,FALSE) -> 白品厚实灵巧 | C116: =INT(MOD(RC[-2],10000)/1000)*10+MOD(RC[-2],10) -> 32 | D116: =INT(MOD(RC[-3],1000)/100) -> 0 | E116: =2^RC[-1]*100 -> 100 | F116: 100|100 | G116: =VLOOKUP(INT(MOD(RC[-6],10000)/1000),Sheet1!R2C1:R7C4,4,FALSE)&"|"&VLOOKUP(INT(MOD(RC[-6],10)/1),Sheet1!R2C6:R9C9,4,FALSE) -> 4|12 | H116: =VLOOKUP(INT(MOD(RC[-7],10000)/1000),Sheet1!R2C1:R7C4,4,FALSE) -> 4 | I116: 1 | J116: =VLOOKUP(INT(MOD(RC[-9],10)/1),Sheet1!R2C6:R9C9,4,FALSE) -> 12 | K116: 100 | L116: 一二三四五六七八九十一二三四五六七八九十 | M116: 33
A117: 73003 | B117: =VLOOKUP(INT(MOD(RC[-1],1000)/100),Sheet1!R2C11:R8C12,2,FALSE)&VLOOKUP(INT(MOD(RC[-1],10000)/1000),Sheet1!R2C1:R7C4,3,FALSE)&VLOOKUP(INT(MOD(RC[-1],10)/1),Sheet1!R2C6:R9C9,3,FALSE) -> 白品厚实会心 | C117: =INT(MOD(RC[-2],10000)/1000)*10+MOD(RC[-2],10) -> 33 | D117: =INT(MOD(RC[-3],1000)/100) -> 0 | E117: =2^RC[-1]*100 -> 100 | F117: 100|100 | G117: =VLOOKUP(INT(MOD(RC[-6],10000)/1000),Sheet1!R2C1:R7C4,4,FALSE)&"|"&VLOOKUP(INT(MOD(RC[-6],10)/1),Sheet1!R2C6:R9C9,4,FALSE) -> 4|13 | H117: =VLOOKUP(INT(MOD(RC[-7],10000)/1000),Sheet1!R2C1:R7C4,4,FALSE) -> 4 | I117: 1 | J117: =VLOOKUP(INT(MOD(RC[-9],10)/1),Sheet1!R2C6:R9C9,4,FALSE) -> 13 | K117: 100 | L117: 一二三四五六七八九十一二三四五六七八九十 | M117: 26
A118: 73004 | B118: =VLOOKUP(INT(MOD(RC[-1],1000)/100),Sheet1!R2C11:R8C12,2,FALSE)&VLOOKUP(INT(MOD(RC[-1],10000)/1000),Sheet1!R2C1:R7C4,3,FALSE)&VLOOKUP(INT(MOD(RC[-1],10)/1),Sheet1!R2C6:R9C9,3,FALSE) -> 白品厚实坚韧 | C118: =INT(MOD(RC[-2],10000)/1000)*10+MOD(RC[-2],10) -> 34 | D118: =INT(MOD(RC[-3],1000)/100) -> 0 | E118: =2^RC[-1]*100 -> 100 | F118: 100|100 | G118: =VLOOKUP(INT(MOD(RC[-6],10000)/1000),Sheet1!R2C1:R7C4,4,FALSE)&"|"&VLOOKUP(INT(MOD(RC[-6],10)/1),Sheet1!R2C6:R9C9,4,FALSE) -> 4|14 | H118: =VLOOKUP(INT(MOD(RC[-7],10000)/1000),Sheet1!R2C1:R7C4,4,FALSE) -> 4 | I118: 1 | J118: =VLOOKUP(INT(MOD(RC[-9],10)/1),Sheet1!R2C6:R9C9,4,FALSE) -> 14 | K118: 100 | L118: 一二三四五六七八九十一二三四五六七八九十 | M118: 33
A119: 73005 | B119: =VLOOKUP(INT(MOD(RC[-1],1000)/100),Sheet1!R2C11:R8C12,2,FALSE)&VLOOKUP(INT(MOD(RC[-1],10000)/1000),Sheet1!R2C1:R7C4,3,FALSE)&VLOOKUP(INT(MOD(RC[-1],10)/1),Sheet1!R2C6:R9C9,3,FALSE) -> 白品厚实要害 | C119: =INT(MOD(RC[-2],10000)/1000)*10+MOD(RC[-2],10) -> 35 | D119: =INT(MOD(RC[-3],1000)/100) -> 0 | E119: =2^RC[-1]*100 -> 100 | F119: 100|100 | G119: =VLOOKUP(INT(MOD(RC[-6],10000)/1000),Sheet1!R2C1:R7C4,4,FALSE)&"|"&VLOOKUP(INT(MOD(RC[-6],10)/1),Sheet1!R2C6:R9C9,4,FALSE) -> 4|7 | H119: =VLOOKUP(INT(MOD(RC[-7],10000)/1000),Sheet1!R2C1:R7C4,4,FALSE) -> 4 | I119: 1 | J119: =VLOOKUP(INT(MOD(RC[-9],10)/1),Sheet1!R2C6:R9C9,4,FALSE) -> 7 | K119: 100 | L119: 一二三四五六七八九十一二三四五六七八九十 | M119: 26
A120: 73006 | B120: =VLOOKUP(INT(MOD(RC[-1],1000)/100),Sheet1!R2C11:R8C12,2,FALSE)&VLOOKUP(INT(MOD(RC[-1],10000)/1000),Sheet1!R2C1:R7C4,3,FALSE)&VLOOKUP(INT(MOD(RC[-1],10)/1),Sheet1!R2C6:R9C9,3,FALSE) -> 白品厚实护盾 | C120: =INT(MOD(RC[-2],10000)/1000)*10+MOD(RC[-2],10) -> 36 | D120: =INT(MOD(RC[-3],1000)/100) -> 0 | E120: =2^RC[-1]*100 -> 100 | F120: 100|100 | G120: =VLOOKUP(INT(MOD(RC[-6],10000)/1000),Sheet1!R2C1:R7C4,4,FALSE)&"|"&VLOOKUP(INT(MOD(RC[-6],10)/1),Sheet1!R2C6:R9C9,4,FALSE) -> 4|5 | H120: =VLOOKUP(INT(MOD(RC[-7],10000)/1000),Sheet1!R2C1:R7C4,4,FALSE) -> 4 | I120: 1 | J120: =VLOOKUP(INT(MOD(RC[-9],10)/1),Sheet1!R2C6:R9C9,4,FALSE) -> 5 | K120: 100 | L120: 一二三四五六七八九十一二三四五六七八九十 | M120: 33
A121: 73101 | B121: =VLOOKUP(INT(MOD(RC[-1],1000)/100),Sheet1!R2C11:R8C12,2,FALSE)&VLOOKUP(INT(MOD(RC[-1],10000)/1000),Sheet1!R2C1:R7C4,3,FALSE)&VLOOKUP(INT(MOD(RC[-1],10)/1),Sheet1!R2C6:R9C9,3,FALSE) -> 绿品厚实鹰眼 | C121: =INT(MOD(RC[-2],10000)/1000)*10+MOD(RC[-2],10) -> 31 | D121: =INT(MOD(RC[-3],1000)/100) -> 1 | E121: =2^RC[-1]*100 -> 200 | F121: 100|100 | G121: =VLOOKUP(INT(MOD(RC[-6],10000)/1000),Sheet1!R2C1:R7C4,4,FALSE)&"|"&VLOOKUP(INT(MOD(RC[-6],10)/1),Sheet1!R2C6:R9C9,4,FALSE) -> 4|11 | H121: =VLOOKUP(INT(MOD(RC[-7],10000)/1000),Sheet1!R2C1:R7C4,4,FALSE) -> 4 | I121: 1 | J121: =VLOOKUP(INT(MOD(RC[-9],10)/1),Sheet1!R2C6:R9C9,4,FALSE) -> 11 | K121: 100 | L121: 一二三四五六七八九十一二三四五六七八九十 | M121: 26
A122: 73102 | B122: =VLOOKUP(INT(MOD(RC[-1],1000)/100),Sheet1!R2C11:R8C12,2,FALSE)&VLOOKUP(INT(MOD(RC[-1],10000)/1000),Sheet1!R2C1:R7C4,3,FALSE)&VLOOKUP(INT(MOD(RC[-1],10)/1),Sheet1!R2C6:R9C9,3,FALSE) -> 绿品厚实灵巧 | C122: =INT(MOD(RC[-2],10000)/1000)*10+MOD(RC[-2],10) -> 32 | D122: =INT(MOD(RC[-3],1000)/100) -> 1 | E122: =2^RC[-1]*100 -> 200 | F122: 100|100 | G122: =VLOOKUP(INT(MOD(RC[-6],10000)/1000),Sheet1!R2C1:R7C4,4,FALSE)&"|"&VLOOKUP(INT(MOD(RC[-6],10)/1),Sheet1!R2C6:R9C9,4,FALSE) -> 4|12 | H122: =VLOOKUP(INT(MOD(RC[-7],10000)/1000),Sheet1!R2C1:R7C4,4,FALSE) -> 4 | I122: 1 | J122: =VLOOKUP(INT(MOD(RC[-9],10)/1),Sheet1!R2C6:R9C9,4,FALSE) -> 12 | K122: 100 | L122: 一二三四五六七八九十一二三四五六七八九十 | M122: 33
A123: 73103 | B123: =VLOOKUP(INT(MOD(RC[-1],1000)/100),Sheet1!R2C11:R8C12,2,FALSE)&VLOOKUP(INT(MOD(RC[-1],10000)/1000),Sheet1!R2C1:R7C4,3,FALSE)&VLOOKUP(INT(MOD(RC[-1],10)/1),Sheet1!R2C6:R9C9,3,FALSE) -> 绿品厚实会心 | C123: =INT(MOD(RC[-2],10000)/1000)*10+MOD(RC[-2],10) -> 33 | D123: =INT(MOD(RC[-3],1000)/100) -> 1 | E123: =2^RC[-1]*100 -> 200 | F123: 100|100 | G123: =VLOOKUP(INT(MOD(RC[-6],10000)/1000),Sheet1!R2C1:R7C4,4,FALSE)&"|"&VLOOKUP(INT(MOD(RC[-6],10)/1),Sheet1!R2C6:R9C9,4,FALSE) -> 4|13 | H123: =VLOOKUP(INT(MOD(RC[-7],10000)/1000),Sheet1!R2C1:R7C4,4,FALSE) -> 4 | I123: 1 | J123: =VLOOKUP(INT(MOD(RC[-9],10)/1),Sheet1!R2C6:R9C9,4,FALSE) -> 13 | K123: 100 | L123: 一二三四五六七八九十一二三四五六七八九十 | M123: 26
A124: 73104 | B124: =VLOOKUP(INT(MOD(RC[-1],1000)/100),Sheet1!R2C11:R8C12,2,FALSE)&VLOOKUP(INT(MOD(RC[-1],10000)/1000),Sheet1!R2C1:R7C4,3,FALSE)&VLOOKUP(INT(MOD(RC[-1],10)/1),Sheet1!R2C6:R9C9,3,FALSE) -> 绿品厚实坚韧 | C124: =INT(MOD(RC[-2],10000)/1000)*10+MOD(RC[-2],10) -> 34 | D124: =INT(MOD(RC[-3],1000)/100) -> 1 | E124: =2^RC[-1]*100 -> 200 | F124: 100|100 | G124: =VLOOKUP(INT(MOD(RC[-6],10000)/1000),Sheet1!R2C1:R7C4,4,FALSE)&"|"&VLOOKUP(INT(MOD(RC[-6],10)/1),Sheet1!R2C6:R9C9,4,FALSE) -> 4|14 | H124: =VLOOKUP(INT(MOD(RC[-7],10000)/1000),Sheet1!R2C1:R7C4,4,FALSE) -> 4 | I124: 1 | J124: =VLOOKUP(INT(MOD(RC[-9],10)/1),Sheet1!R2C6:R9C9,4,FALSE) -> 14 | K124: 100 | L124: 一二三四五六七八九十一二三四五六七八九十 | M124: 33
A125: 73105 | B125: =VLOOKUP(INT(MOD(RC[-1],1000)/100),Sheet1!R2C11:R8C12,2,FALSE)&VLOOKUP(INT(MOD(RC[-1],10000)/1000),Sheet1!R2C1:R7C4,3,FALSE)&VLOOKUP(INT(MOD(RC[-1],10)/1),Sheet1!R2C6:R9C9,3,FALSE) -> 绿品厚实要害 | C125: =INT(MOD(RC[-2],10000)/1000)*10+MOD(RC[-2],10) -> 35 | D125: =INT(MOD(RC[-3],1000)/100) -> 1 | E125: =2^RC[-1]*100 -> 200 | F125: 100|100 | G125: =VLOOKUP(INT(MOD(RC[-6],10000)/1000),Sheet1!R2C1:R7C4,4,FALSE)&"|"&VLOOKUP(INT(MOD(RC[-6],10)/1),Sheet1!R2C6:R9C9,4,FALSE) -> 4|7 | H125: =VLOOKUP(INT(MOD(RC[-7],10000)/1000),Sheet1!R2C1:R7C4,4,FALSE) -> 4 | I125: 1 | J125: =VLOOKUP(INT(MOD(RC[-9],10)/1),Sheet1!R2C6:R9C9,4,FALSE) -> 7 | K125: 100 | L125: 一二三四五六七八九十一二三四五六七八九十 | M125: 26
A126: 73106 | B126: =VLOOKUP(INT(MOD(RC[-1],1000)/100),Sheet1!R2C11:R8C12,2,FALSE)&VLOOKUP(INT(MOD(RC[-1],10000)/1000),Sheet1!R2C1:R7C4,3,FALSE)&VLOOKUP(INT(MOD(RC[-1],10)/1),Sheet1!R2C6:R9C9,3,FALSE) -> 绿品厚实护盾 | C126: =INT(MOD(RC[-2],10000)/1000)*10+MOD(RC[-2],10) -> 36 | D126: =INT(MOD(RC[-3],1000)/100) -> 1 | E126: =2^RC[-1]*100 -> 200 | F126: 100|100 | G126: =VLOOKUP(INT(MOD(RC[-6],10000)/1000),Sheet1!R2C1:R7C4,4,FALSE)&"|"&VLOOKUP(INT(MOD(RC[-6],10)/1),Sheet1!R2C6:R9C9,4,FALSE) -> 4|5 | H126: =VLOOKUP(INT(MOD(RC[-7],10000)/1000),Sheet1!R2C1:R7C4,4,FALSE) -> 4 | I126: 1 | J126: =VLOOKUP(INT(MOD(RC[-9],10)/1),Sheet1!R2C6:R9C9,4,FALSE) -> 5 | K126: 100 | L126: 一二三四五六七八九十一二三四五六七八九十 | M126: 33
A127: 73201 | B127: =VLOOKUP(INT(MOD(RC[-1],1000)/100),Sheet1!R2C11:R8C12,2,FALSE)&VLOOKUP(INT(MOD(RC[-1],10000)/1000),Sheet1!R2C1:R7C4,3,FALSE)&VLOOKUP(INT(MOD(RC[-1],10)/1),Sheet1!R2C6:R9C9,3,FALSE) -> 蓝品厚实鹰眼 | C127: =INT(MOD(RC[-2],10000)/1000)*10+MOD(RC[-2],10) -> 31 | D127: =INT(MOD(RC[-3],1000)/100) -> 2 | E127: =2^RC[-1]*100 -> 400 | F127: 100|100 | G127: =VLOOKUP(INT(MOD(RC[-6],10000)/1000),Sheet1!R2C1:R7C4,4,FALSE)&"|"&VLOOKUP(INT(MOD(RC[-6],10)/1),Sheet1!R2C6:R9C9,4,FALSE) -> 4|11 | H127: =VLOOKUP(INT(MOD(RC[-7],10000)/1000),Sheet1!R2C1:R7C4,4,FALSE) -> 4 | I127: 1 | J127: =VLOOKUP(INT(MOD(RC[-9],10)/1),Sheet1!R2C6:R9C9,4,FALSE) -> 11 | K127: 100 | L127: 一二三四五六七八九十一二三四五六七八九十 | M127: 26
A128: 73202 | B128: =VLOOKUP(INT(MOD(RC[-1],1000)/100),Sheet1!R2C11:R8C12,2,FALSE)&VLOOKUP(INT(MOD(RC[-1],10000)/1000),Sheet1!R2C1:R7C4,3,FALSE)&VLOOKUP(INT(MOD(RC[-1],10)/1),Sheet1!R2C6:R9C9,3,FALSE) -> 蓝品厚实灵巧 | C128: =INT(MOD(RC[-2],10000)/1000)*10+MOD(RC[-2],10) -> 32 | D128: =INT(MOD(RC[-3],1000)/100) -> 2 | E128: =2^RC[-1]*100 -> 400 | F128: 100|100 | G128: =VLOOKUP(INT(MOD(RC[-6],10000)/1000),Sheet1!R2C1:R7C4,4,FALSE)&"|"&VLOOKUP(INT(MOD(RC[-6],10)/1),Sheet1!R2C6:R9C9,4,FALSE) -> 4|12 | H128: =VLOOKUP(INT(MOD(RC[-7],10000)/1000),Sheet1!R2C1:R7C4,4,FALSE) -> 4 | I128: 1 | J128: =VLOOKUP(INT(MOD(RC[-9],10)/1),Sheet1!R2C6:R9C9,4,FALSE) -> 12 | K128: 100 | L128: 一二三四五六七八九十一二三四五六七八九十 | M128: 33
A129: 73203 | B129: =VLOOKUP(INT(MOD(RC[-1],1000)/100),Sheet1!R2C11:R8C12,2,FALSE)&VLOOKUP(INT(MOD(RC[-1],10000)/1000),Sheet1!R2C1:R7C4,3,FALSE)&VLOOKUP(INT(MOD(RC[-1],10)/1),Sheet1!R2C6:R9C9,3,FALSE) -> 蓝品厚实会心 | C129: =INT(MOD(RC[-2],10000)/1000)*10+MOD(RC[-2],10) -> 33 | D129: =INT(MOD(RC[-3],1000)/100) -> 2 | E129: =2^RC[-1]*100 -> 400 | F129: 100|100 | G129: =VLOOKUP(INT(MOD(RC[-6],10000)/1000),Sheet1!R2C1:R7C4,4,FALSE)&"|"&VLOOKUP(INT(MOD(RC[-6],10)/1),Sheet1!R2C6:R9C9,4,FALSE) -> 4|13 | H129: =VLOOKUP(INT(MOD(RC[-7],10000)/1000),Sheet1!R2C1:R7C4,4,FALSE) -> 4 | I129: 1 | J129: =VLOOKUP(INT(MOD(RC[-9],10)/1),Sheet1!R2C6:R9C9,4,FALSE) -> 13 | K129: 100 | L129: 一二三四五六七八九十一二三四五六七八九十 | M129: 26
A130: 73204 | B130: =VLOOKUP(INT(MOD(RC[-1],1000)/100),Sheet1!R2C11:R8C12,2,FALSE)&VLOOKUP(INT(MOD(RC[-1],10000)/1000),Sheet1!R2C1:R7C4,3,FALSE)&VLOOKUP(INT(MOD(RC[-1],10)/1),Sheet1!R2C6:R9C9,3,FALSE) -> 蓝品厚实坚韧 | C130: =INT(MOD(RC[-2],10000)/1000)*10+MOD(RC[-2],10) -> 34 | D130: =INT(MOD(RC[-3],1000)/100) -> 2 | E130: =2^RC[-1]*100 -> 400 | F130: 100|100 | G130: =VLOOKUP(INT(MOD(RC[-6],10000)/1000),Sheet1!R2C1:R7C4,4,FALSE)&"|"&VLOOKUP(INT(MOD(RC[-6],10)/1),Sheet1!R2C6:R9C9,4,FALSE) -> 4|14 | H130: =VLOOKUP(INT(MOD(RC[-7],10000)/1000),Sheet1!R2C1:R7C4,4,FALSE) -> 4 | I130: 1 | J130: =VLOOKUP(INT(MOD(RC[-9],10)/1),Sheet1!R2C6:R9C9,4,FALSE) -> 14 | K130: 100 | L130: 一二三四五六七八九十一二三四五六七八九十 | M130: 33
A131: 73205 | B131: =VLOOKUP(INT(MOD(RC[-1],1000)/100),Sheet1!R2C11:R8C12,2,FALSE)&VLOOKUP(INT(MOD(RC[-1],10000)/1000),Sheet1!R2C1:R7C4,3,FALSE)&VLOOKUP(INT(MOD(RC[-1],10)/1),Sheet1!R2C6:R9C9,3,FALSE) -> 蓝品厚实要害 | C131: =INT(MOD(RC[-2],10000)/1000)*10+MOD(RC[-2],10) -> 35 | D131: =INT(MOD(RC[-3],1000)/100) -> 2 | E131: =2^RC[-1]*100 -> 400 | F131: 100|100 | G131: =VLOOKUP(INT(MOD(RC[-6],10000)/1000),Sheet1!R2C1:R7C4,4,FALSE)&"|"&VLOOKUP(INT(MOD(RC[-6],10)/1),Sheet1!R2C6:R9C9,4,FALSE) -> 4|7 | H131: =VLOOKUP(INT(MOD(RC[-7],10000)/1000),Sheet1!R2C1:R7C4,4,FALSE) -> 4 | I131: 1 | J131: =VLOOKUP(INT(MOD(RC[-9],10)/1),Sheet1!R2C6:R9C9,4,FALSE) -> 7 | K131: 100 | L131: 一二三四五六七八九十一二三四五六七八九十 | M131: 26
A132: 73206 | B132: =VLOOKUP(INT(MOD(RC[-1],1000)/100),Sheet1!R2C11:R8C12,2,FALSE)&VLOOKUP(INT(MOD(RC[-1],10000)/1000),Sheet1!R2C1:R7C4,3,FALSE)&VLOOKUP(INT(MOD(RC[-1],10)/1),Sheet1!R2C6:R9C9,3,FALSE) -> 蓝品厚实护盾 | C132: =INT(MOD(RC[-2],10000)/1000)*10+MOD(RC[-2],10) -> 36 | D132: =INT(MOD(RC[-3],1000)/100) -> 2 | E132: =2^RC[-1]*100 -> 400 | F132: 100|100 | G132: =VLOOKUP(INT(MOD(RC[-6],10000)/1000),Sheet1!R2C1:R7C4,4,FALSE)&"|"&VLOOKUP(INT(MOD(RC[-6],10)/1),Sheet1!R2C6:R9C9,4,FALSE) -> 4|5 | H132: =VLOOKUP(INT(MOD(RC[-7],10000)/1000),Sheet1!R2C1:R7C4,4,FALSE) -> 4 | I132: 1 | J132: =VLOOKUP(INT(MOD(RC[-9],10)/1),Sheet1!R2C6:R9C9,4,FALSE) -> 5 | K132: 100 | L132: 一二三四五六七八九十一二三四五六七八九十 | M132: 26
A133: 73301 | B133: =VLOOKUP(INT(MOD(RC[-1],1000)/100),Sheet1!R2C11:R8C12,2,FALSE)&VLOOKUP(INT(MOD(RC[-1],10000)/1000),Sheet1!R2C1:R7C4,3,FALSE)&VLOOKUP(INT(MOD(RC[-1],10)/1),Sheet1!R2C6:R9C9,3,FALSE) -> 紫品厚实鹰眼 | C133: =INT(MOD(RC[-2],10000)/1000)*10+MOD(RC[-2],10) -> 31 | D133: =INT(MOD(RC[-3],1000)/100) -> 3 | E133: =2^RC[-1]*100 -> 800 | F133: 100|100 | G133: =VLOOKUP(INT(MOD(RC[-6],10000)/1000),Sheet1!R2C1:R7C4,4,FALSE)&"|"&VLOOKUP(INT(MOD(RC[-6],10)/1),Sheet1!R2C6:R9C9,4,FALSE) -> 4|11 | H133: =VLOOKUP(INT(MOD(RC[-7],10000)/1000),Sheet1!R2C1:R7C4,4,FALSE) -> 4 | I133: 1 | J133: =VLOOKUP(INT(MOD(RC[-9],10)/1),Sheet1!R2C6:R9C9,4,FALSE) -> 11 | K133: 100 | L133: 一二三四五六七八九十一二三四五六七八九十 | M133: 33
A134: 73302 | B134: =VLOOKUP(INT(MOD(RC[-1],1000)/100),Sheet1!R2C11:R8C12,2,FALSE)&VLOOKUP(INT(MOD(RC[-1],10000)/1000),Sheet1!R2C1:R7C4,3,FALSE)&VLOOKUP(INT(MOD(RC[-1],10)/1),Sheet1!R2C6:R9C9,3,FALSE) -> 紫品厚实灵巧 | C134: =INT(MOD(RC[-2],10000)/1000)*10+MOD(RC[-2],10) -> 32 | D134: =INT(MOD(RC[-3],1000)/100) -> 3 | E134: =2^RC[-1]*100 -> 800 | F134: 100|100 | G134: =VLOOKUP(INT(MOD(RC[-6],10000)/1000),Sheet1!R2C1:R7C4,4,FALSE)&"|"&VLOOKUP(INT(MOD(RC[-6],10)/1),Sheet1!R2C6:R9C9,4,FALSE) -> 4|12 | H134: =VLOOKUP(INT(MOD(RC[-7],10000)/1000),Sheet1!R2C1:R7C4,4,FALSE) -> 4 | I134: 1 | J134: =VLOOKUP(INT(MOD(RC[-9],10)/1),Sheet1!R2C6:R9C9,4,FALSE) -> 12 | K134: 100 | L134: 一二三四五六七八九十一二三四五六七八九十 | M134: 26
A135: 73303 | B135: =VLOOKUP(INT(MOD(RC[-1],1000)/100),Sheet1!R2C11:R8C12,2,FALSE)&VLOOKUP(INT(MOD(RC[-1],10000)/1000),Sheet1!R2C1:R7C4,3,FALSE)&VLOOKUP(INT(MOD(RC[-1],10)/1),Sheet1!R2C6:R9C9,3,FALSE) -> 紫品厚实会心 | C135: =INT(MOD(RC[-2],10000)/1000)*10+MOD(RC[-2],10) -> 33 | D135: =INT(MOD(RC[-3],1000)/100) -> 3 | E135: =2^RC[-1]*100 -> 800 | F135: 100|100 | G135: =VLOOKUP(INT(MOD(RC[-6],10000)/1000),Sheet1!R2C1:R7C4,4,FALSE)&"|"&VLOOKUP(INT(MOD(RC[-6],10)/1),Sheet1!R2C6:R9C9,4,FALSE) -> 4|13 | H135: =VLOOKUP(INT(MOD(RC[-7],10000)/1000),Sheet1!R2C1:R7C4,4,FALSE) -> 4 | I135: 1 | J135: =VLOOKUP(INT(MOD(RC[-9],10)/1),Sheet1!R2C6:R9C9,4,FALSE) -> 13 | K135: 100 | L135: 一二三四五六七八九十一二三四五六七八九十 | M135: 33
A136: 73304 | B136: =VLOOKUP(INT(MOD(RC[-1],1000)/100),Sheet1!R2C11:R8C12,2,FALSE)&VLOOKUP(INT(MOD(RC[-1],10000)/1000),Sheet1!R2C1:R7C4,3,FALSE)&VLOOKUP(INT(MOD(RC[-1],10)/1),Sheet1!R2C6:R9C9,3,FALSE) -> 紫品厚实坚韧 | C136: =INT(MOD(RC[-2],10000)/1000)*10+MOD(RC[-2],10) -> 34 | D136: =INT(MOD(RC[-3],1000)/100) -> 3 | E136: =2^RC[-1]*100 -> 800 | F136: 100|100 | G136: =VLOOKUP(INT(MOD(RC[-6],10000)/1000),Sheet1!R2C1:R7C4,4,FALSE)&"|"&VLOOKUP(INT(MOD(RC[-6],10)/1),Sheet1!R2C6:R9C9,4,FALSE) -> 4|14 | H136: =VLOOKUP(INT(MOD(RC[-7],10000)/1000),Sheet1!R2C1:R7C4,4,FALSE) -> 4 | I136: 1 | J136: =VLOOKUP(INT(MOD(RC[-9],10)/1),Sheet1!R2C6:R9C9,4,FALSE) -> 14 | K136: 100 | L136: 一二三四五六七八九十一二三四五六七八九十 | M136: 26
A137: 73305 | B137: =VLOOKUP(INT(MOD(RC[-1],1000)/100),Sheet1!R2C11:R8C12,2,FALSE)&VLOOKUP(INT(MOD(RC[-1],10000)/1000),Sheet1!R2C1:R7C4,3,FALSE)&VLOOKUP(INT(MOD(RC[-1],10)/1),Sheet1!R2C6:R9C9,3,FALSE) -> 紫品厚实要害 | C137: =INT(MOD(RC[-2],10000)/1000)*10+MOD(RC[-2],10) -> 35 | D137: =INT(MOD(RC[-3],1000)/100) -> 3 | E137: =2^RC[-1]*100 -> 800 | F137: 100|100 | G137: =VLOOKUP(INT(MOD(RC[-6],10000)/1000),Sheet1!R2C1:R7C4,4,FALSE)&"|"&VLOOKUP(INT(MOD(RC[-6],10)/1),Sheet1!R2C6:R9C9,4,FALSE) -> 4|7 | H137: =VLOOKUP(INT(MOD(RC[-7],10000)/1000),Sheet1!R2C1:R7C4,4,FALSE) -> 4 | I137: 1 | J137: =VLOOKUP(INT(MOD(RC[-9],10)/1),Sheet1!R2C6:R9C9,4,FALSE) -> 7 | K137: 100 | L137: 一二三四五六七八九十一二三四五六七八九十 | M137: 33
A138: 73306 | B138: =VLOOKUP(INT(MOD(RC[-1],1000)/100),Sheet1!R2C11:R8C12,2,FALSE)&VLOOKUP(INT(MOD(RC[-1],10000)/1000),Sheet1!R2C1:R7C4,3,FALSE)&VLOOKUP(INT(MOD(RC[-1],10)/1),Sheet1!R2C6:R9C9,3,FALSE) -> 紫品厚实护盾 | C138: =INT(MOD(RC[-2],10000)/1000)*10+MOD(RC[-2],10) -> 36 | D138: =INT(MOD(RC[-3],1000)/100) -> 3 | E138: =2^RC[-1]*100 -> 800 | F138: 100|100 | G138: =VLOOKUP(INT(MOD(RC[-6],10000)/1000),Sheet1!R2C1:R7C4,4,FALSE)&"|"&VLOOKUP(INT(MOD(RC[-6],10)/1),Sheet1!R2C6:R9C9,4,FALSE) -> 4|5 | H138: =VLOOKUP(INT(MOD(RC[-7],10000)/1000),Sheet1!R2C1:R7C4,4,FALSE) -> 4 | I138: 1 | J138: =VLOOKUP(INT(MOD(RC[-9],10)/1),Sheet1!R2C6:R9C9,4,FALSE) -> 5 | K138: 100 | L138: 一二三四五六七八九十一二三四五六七八九十 | M138: 26
A139: 73401 | B139: =VLOOKUP(INT(MOD(RC[-1],1000)/100),Sheet1!R2C11:R8C12,2,FALSE)&VLOOKUP(INT(MOD(RC[-1],10000)/1000),Sheet1!R2C1:R7C4,3,FALSE)&VLOOKUP(INT(MOD(RC[-1],10)/1),Sheet1!R2C6:R9C9,3,FALSE) -> 橙品厚实鹰眼 | C139: =INT(MOD(RC[-2],10000)/1000)*10+MOD(RC[-2],10) -> 31 | D139: =INT(MOD(RC[-3],1000)/100) -> 4 | E139: =2^RC[-1]*100 -> 1600 | F139: 100|100 | G139: =VLOOKUP(INT(MOD(RC[-6],10000)/1000),Sheet1!R2C1:R7C4,4,FALSE)&"|"&VLOOKUP(INT(MOD(RC[-6],10)/1),Sheet1!R2C6:R9C9,4,FALSE) -> 4|11 | H139: =VLOOKUP(INT(MOD(RC[-7],10000)/1000),Sheet1!R2C1:R7C4,4,FALSE) -> 4 | I139: 1 | J139: =VLOOKUP(INT(MOD(RC[-9],10)/1),Sheet1!R2C6:R9C9,4,FALSE) -> 11 | K139: 100 | L139: 一二三四五六七八九十一二三四五六七八九十 | M139: 33
A140: 73402 | B140: =VLOOKUP(INT(MOD(RC[-1],1000)/100),Sheet1!R2C11:R8C12,2,FALSE)&VLOOKUP(INT(MOD(RC[-1],10000)/1000),Sheet1!R2C1:R7C4,3,FALSE)&VLOOKUP(INT(MOD(RC[-1],10)/1),Sheet1!R2C6:R9C9,3,FALSE) -> 橙品厚实灵巧 | C140: =INT(MOD(RC[-2],10000)/1000)*10+MOD(RC[-2],10) -> 32 | D140: =INT(MOD(RC[-3],1000)/100) -> 4 | E140: =2^RC[-1]*100 -> 1600 | F140: 100|100 | G140: =VLOOKUP(INT(MOD(RC[-6],10000)/1000),Sheet1!R2C1:R7C4,4,FALSE)&"|"&VLOOKUP(INT(MOD(RC[-6],10)/1),Sheet1!R2C6:R9C9,4,FALSE) -> 4|12 | H140: =VLOOKUP(INT(MOD(RC[-7],10000)/1000),Sheet1!R2C1:R7C4,4,FALSE) -> 4 | I140: 1 | J140: =VLOOKUP(INT(MOD(RC[-9],10)/1),Sheet1!R2C6:R9C9,4,FALSE) -> 12 | K140: 100 | L140: 一二三四五六七八九十一二三四五六七八九十 | M140: 26
A141: 73403 | B141: =VLOOKUP(INT(MOD(RC[-1],1000)/100),Sheet1!R2C11:R8C12,2,FALSE)&VLOOKUP(INT(MOD(RC[-1],10000)/1000),Sheet1!R2C1:R7C4,3,FALSE)&VLOOKUP(INT(MOD(RC[-1],10)/1),Sheet1!R2C6:R9C9,3,FALSE) -> 橙品厚实会心 | C141: =INT(MOD(RC[-2],10000)/1000)*10+MOD(RC[-2],10) -> 33 | D141: =INT(MOD(RC[-3],1000)/100) -> 4 | E141: =2^RC[-1]*100 -> 1600 | F141: 100|100 | G141: =VLOOKUP(INT(MOD(RC[-6],10000)/1000),Sheet1!R2C1:R7C4,4,FALSE)&"|"&VLOOKUP(INT(MOD(RC[-6],10)/1),Sheet1!R2C6:R9C9,4,FALSE) -> 4|13 | H141: =VLOOKUP(INT(MOD(RC[-7],10000)/1000),Sheet1!R2C1:R7C4,4,FALSE) -> 4 | I141: 1 | J141: =VLOOKUP(INT(MOD(RC[-9],10)/1),Sheet1!R2C6:R9C9,4,FALSE) -> 13 | K141: 100 | L141: 一二三四五六七八九十一二三四五六七八九十 | M141: 33
A142: 73404 | B142: =VLOOKUP(INT(MOD(RC[-1],1000)/100),Sheet1!R2C11:R8C12,2,FALSE)&VLOOKUP(INT(MOD(RC[-1],10000)/1000),Sheet1!R2C1:R7C4,3,FALSE)&VLOOKUP(INT(MOD(RC[-1],10)/1),Sheet1!R2C6:R9C9,3,FALSE) -> 橙品厚实坚韧 | C142: =INT(MOD(RC[-2],10000)/1000)*10+MOD(RC[-2],10) -> 34 | D142: =INT(MOD(RC[-3],1000)/100) -> 4 | E142: =2^RC[-1]*100 -> 1600 | F142: 100|100 | G142: =VLOOKUP(INT(MOD(RC[-6],10000)/1000),Sheet1!R2C1:R7C4,4,FALSE)&"|"&VLOOKUP(INT(MOD(RC[-6],10)/1),Sheet1!R2C6:R9C9,4,FALSE) -> 4|14 | H142: =VLOOKUP(INT(MOD(RC[-7],10000)/1000),Sheet1!R2C1:R7C4,4,FALSE) -> 4 | I142: 1 | J142: =VLOOKUP(INT(MOD(RC[-9],10)/1),Sheet1!R2C6:R9C9,4,FALSE) -> 14 | K142: 100 | L142: 一二三四五六七八九十一二三四五六七八九十 | M142: 26
A143: 73405 | B143: =VLOOKUP(INT(MOD(RC[-1],1000)/100),Sheet1!R2C11:R8C12,2,FALSE)&VLOOKUP(INT(MOD(RC[-1],10000)/1000),Sheet1!R2C1:R7C4,3,FALSE)&VLOOKUP(INT(MOD(RC[-1],10)/1),Sheet1!R2C6:R9C9,3,FALSE) -> 橙品厚实要害 | C143: =INT(MOD(RC[-2],10000)/1000)*10+MOD(RC[-2],10) -> 35 | D143: =INT(MOD(RC[-3],1000)/100) -> 4 | E143: =2^RC[-1]*100 -> 1600 | F143: 100|100 | G143: =VLOOKUP(INT(MOD(RC[-6],10000)/1000),Sheet1!R2C1:R7C4,4,FALSE)&"|"&VLOOKUP(INT(MOD(RC[-6],10)/1),Sheet1!R2C6:R9C9,4,FALSE) -> 4|7 | H143: =VLOOKUP(INT(MOD(RC[-7],10000)/1000),Sheet1!R2C1:R7C4,4,FALSE) -> 4 | I143: 1 | J143: =VLOOKUP(INT(MOD(RC[-9],10)/1),Sheet1!R2C6:R9C9,4,FALSE) -> 7 | K143: 100 | L143: 一二三四五六七八九十一二三四五六七八九十 | M143: 33
A144: 73406 | B144: =VLOOKUP(INT(MOD(RC[-1],1000)/100),Sheet1!R2C11:R8C12,2,FALSE)&VLOOKUP(INT(MOD(RC[-1],10000)/1000),Sheet1!R2C1:R7C4,3,FALSE)&VLOOKUP(INT(MOD(RC[-1],10)/1),Sheet1!R2C6:R9C9,3,FALSE) -> 橙品厚实护盾 | C144: =INT(MOD(RC[-2],10000)/1000)*10+MOD(RC[-2],10) -> 36 | D144: =INT(MOD(RC[-3],1000)/100) -> 4 | E144: =2^RC[-1]*100 -> 1600 | F144: 100|100 | G144: =VLOOKUP(INT(MOD(RC[-6],10000)/1000),Sheet1!R2C1:R7C4,4,FALSE)&"|"&VLOOKUP(INT(MOD(RC[-6],10)/1),Sheet1!R2C6:R9C9,4,FALSE) -> 4|5 | H144: =VLOOKUP(INT(MOD(RC[-7],10000)/1000),Sheet1!R2C1:R7C4,4,FALSE) -> 4 | I144: 1 | J144: =VLOOKUP(INT(MOD(RC[-9],10)/1),Sheet1!R2C6:R9C9,4,FALSE) -> 5 | K144: 100 | L144: 一二三四五六七八九十一二三四五六七八九十 | M144: 26
A145: 73501 | B145: =VLOOKUP(INT(MOD(RC[-1],1000)/100),Sheet1!R2C11:R8C12,2,FALSE)&VLOOKUP(INT(MOD(RC[-1],10000)/1000),Sheet1!R2C1:R7C4,3,FALSE)&VLOOKUP(INT(MOD(RC[-1],10)/1),Sheet1!R2C6:R9C9,3,FALSE) -> 红品厚实鹰眼 | C145: =INT(MOD(RC[-2],10000)/1000)*10+MOD(RC[-2],10) -> 31 | D145: =INT(MOD(RC[-3],1000)/100) -> 5 | E145: =2^RC[-1]*100 -> 3200 | F145: 100|100 | G145: =VLOOKUP(INT(MOD(RC[-6],10000)/1000),Sheet1!R2C1:R7C4,4,FALSE)&"|"&VLOOKUP(INT(MOD(RC[-6],10)/1),Sheet1!R2C6:R9C9,4,FALSE) -> 4|11 | H145: =VLOOKUP(INT(MOD(RC[-7],10000)/1000),Sheet1!R2C1:R7C4,4,FALSE) -> 4 | I145: 1 | J145: =VLOOKUP(INT(MOD(RC[-9],10)/1),Sheet1!R2C6:R9C9,4,FALSE) -> 11 | K145: 100 | L145: 一二三四五六七八九十一二三四五六七八九十 | M145: 33
A146: 73502 | B146: =VLOOKUP(INT(MOD(RC[-1],1000)/100),Sheet1!R2C11:R8C12,2,FALSE)&VLOOKUP(INT(MOD(RC[-1],10000)/1000),Sheet1!R2C1:R7C4,3,FALSE)&VLOOKUP(INT(MOD(RC[-1],10)/1),Sheet1!R2C6:R9C9,3,FALSE) -> 红品厚实灵巧 | C146: =INT(MOD(RC[-2],10000)/1000)*10+MOD(RC[-2],10) -> 32 | D146: =INT(MOD(RC[-3],1000)/100) -> 5 | E146: =2^RC[-1]*100 -> 3200 | F146: 100|100 | G146: =VLOOKUP(INT(MOD(RC[-6],10000)/1000),Sheet1!R2C1:R7C4,4,FALSE)&"|"&VLOOKUP(INT(MOD(RC[-6],10)/1),Sheet1!R2C6:R9C9,4,FALSE) -> 4|12 | H146: =VLOOKUP(INT(MOD(RC[-7],10000)/1000),Sheet1!R2C1:R7C4,4,FALSE) -> 4 | I146: 1 | J146: =VLOOKUP(INT(MOD(RC[-9],10)/1),Sheet1!R2C6:R9C9,4,FALSE) -> 12 | K146: 100 | L146: 一二三四五六七八九十一二三四五六七八九十 | M146: 26
A147: 73503 | B147: =VLOOKUP(INT(MOD(RC[-1],1000)/100),Sheet1!R2C11:R8C12,2,FALSE)&VLOOKUP(INT(MOD(RC[-1],10000)/1000),Sheet1!R2C1:R7C4,3,FALSE)&VLOOKUP(INT(MOD(RC[-1],10)/1),Sheet1!R2C6:R9C9,3,FALSE) -> 红品厚实会心 | C147: =INT(MOD(RC[-2],10000)/1000)*10+MOD(RC[-2],10) -> 33 | D147: =INT(MOD(RC[-3],1000)/100) -> 5 | E147: =2^RC[-1]*100 -> 3200 | F147: 100|100 | G147: =VLOOKUP(INT(MOD(RC[-6],10000)/1000),Sheet1!R2C1:R7C4,4,FALSE)&"|"&VLOOKUP(INT(MOD(RC[-6],10)/1),Sheet1!R2C6:R9C9,4,FALSE) -> 4|13 | H147: =VLOOKUP(INT(MOD(RC[-7],10000)/1000),Sheet1!R2C1:R7C4,4,FALSE) -> 4 | I147: 1 | J147: =VLOOKUP(INT(MOD(RC[-9],10)/1),Sheet1!R2C6:R9C9,4,FALSE) -> 13 | K147: 100 | L147: 一二三四五六七八九十一二三四五六七八九十 | M147: 33
A148: 73504 | B148: =VLOOKUP(INT(MOD(RC[-1],1000)/100),Sheet1!R2C11:R8C12,2,FALSE)&VLOOKUP(INT(MOD(RC[-1],10000)/1000),Sheet1!R2C1:R7C4,3,FALSE)&VLOOKUP(INT(MOD(RC[-1],10)/1),Sheet1!R2C6:R9C9,3,FALSE) -> 红品厚实坚韧 | C148: =INT(MOD(RC[-2],10000)/1000)*10+MOD(RC[-2],10) -> 34 | D148: =INT(MOD(RC[-3],1000)/100) -> 5 | E148: =2^RC[-1]*100 -> 3200 | F148: 100|100 | G148: =VLOOKUP(INT(MOD(RC[-6],10000)/1000),Sheet1!R2C1:R7C4,4,FALSE)&"|"&VLOOKUP(INT(MOD(RC[-6],10)/1),Sheet1!R2C6:R9C9,4,FALSE) -> 4|14 | H148: =VLOOKUP(INT(MOD(RC[-7],10000)/1000),Sheet1!R2C1:R7C4,4,FALSE) -> 4 | I148: 1 | J148: =VLOOKUP(INT(MOD(RC[-9],10)/1),Sheet1!R2C6:R9C9,4,FALSE) -> 14 | K148: 100 | L148: 一二三四五六七八九十一二三四五六七八九十 | M148: 26
A149: 73505 | B149: =VLOOKUP(INT(MOD(RC[-1],1000)/100),Sheet1!R2C11:R8C12,2,FALSE)&VLOOKUP(INT(MOD(RC[-1],10000)/1000),Sheet1!R2C1:R7C4,3,FALSE)&VLOOKUP(INT(MOD(RC[-1],10)/1),Sheet1!R2C6:R9C9,3,FALSE) -> 红品厚实要害 | C149: =INT(MOD(RC[-2],10000)/1000)*10+MOD(RC[-2],10) -> 35 | D149: =INT(MOD(RC[-3],1000)/100) -> 5 | E149: =2^RC[-1]*100 -> 3200 | F149: 100|100 | G149: =VLOOKUP(INT(MOD(RC[-6],10000)/1000),Sheet1!R2C1:R7C4,4,FALSE)&"|"&VLOOKUP(INT(MOD(RC[-6],10)/1),Sheet1!R2C6:R9C9,4,FALSE) -> 4|7 | H149: =VLOOKUP(INT(MOD(RC[-7],10000)/1000),Sheet1!R2C1:R7C4,4,FALSE) -> 4 | I149: 1 | J149: =VLOOKUP(INT(MOD(RC[-9],10)/1),Sheet1!R2C6:R9C9,4,FALSE) -> 7 | K149: 100 | L149: 一二三四五六七八九十一二三四五六七八九十 | M149: 33
A150: 73506 | B150: =VLOOKUP(INT(MOD(RC[-1],1000)/100),Sheet1!R2C11:R8C12,2,FALSE)&VLOOKUP(INT(MOD(RC[-1],10000)/1000),Sheet1!R2C1:R7C4,3,FALSE)&VLOOKUP(INT(MOD(RC[-1],10)/1),Sheet1!R2C6:R9C9,3,FALSE) -> 红品厚实护盾 | C150: =INT(MOD(RC[-2],10000)/1000)*10+MOD(RC[-2],10) -> 36 | D150: =INT(MOD(RC[-3],1000)/100) -> 5 | E150: =2^RC[-1]*100 -> 3200 | F150: 100|100 | G150: =VLOOKUP(INT(MOD(RC[-6],10000)/1000),Sheet1!R2C1:R7C4,4,FALSE)&"|"&VLOOKUP(INT(MOD(RC[-6],10)/1),Sheet1!R2C6:R9C9,4,FALSE) -> 4|5 | H150: =VLOOKUP(INT(MOD(RC[-7],10000)/1000),Sheet1!R2C1:R7C4,4,FALSE) -> 4 | I150: 1 | J150: =VLOOKUP(INT(MOD(RC[-9],10)/1),Sheet1!R2C6:R9C9,4,FALSE) -> 5 | K150: 100 | L150: 一二三四五六七八九十一二三四五六七八九十 | M150: 26
A151: 74000 | B151: =VLOOKUP(INT(MOD(RC[-1],1000)/100),Sheet1!R2C11:R8C12,2,FALSE)&VLOOKUP(INT(MOD(RC[-1],10000)/1000),Sheet1!R2C1:R7C4,3,FALSE)&VLOOKUP(INT(MOD(RC[-1],10)/1),Sheet1!R2C6:R9C9,3,FALSE) -> 白品经验鱼 | C151: 0 | D151: =INT(MOD(RC[-3],1000)/100) -> 0 | E151: =2^RC[-1]*100 -> 100 | F151: 0|0 | G151: =VLOOKUP(INT(MOD(RC[-6],10000)/1000),Sheet1!R2C1:R7C4,4,FALSE)&"|"&VLOOKUP(INT(MOD(RC[-6],10)/1),Sheet1!R2C6:R9C9,4,FALSE) -> 0|0 | H151: =VLOOKUP(INT(MOD(RC[-7],10000)/1000),Sheet1!R2C1:R7C4,4,FALSE) -> 0 | I151: 1 | J151: =VLOOKUP(INT(MOD(RC[-9],10)/1),Sheet1!R2C6:R9C9,4,FALSE) -> 0 | K151: 0 | L151: 一二三四五六七八九十一二三四五六七八九十 | M151: 33
A152: 74100 | B152: =VLOOKUP(INT(MOD(RC[-1],1000)/100),Sheet1!R2C11:R8C12,2,FALSE)&VLOOKUP(INT(MOD(RC[-1],10000)/1000),Sheet1!R2C1:R7C4,3,FALSE)&VLOOKUP(INT(MOD(RC[-1],10)/1),Sheet1!R2C6:R9C9,3,FALSE) -> 绿品经验鱼 | C152: 0 | D152: =INT(MOD(RC[-3],1000)/100) -> 1 | E152: =2^RC[-1]*100 -> 200 | F152: 0|0 | G152: =VLOOKUP(INT(MOD(RC[-6],10000)/1000),Sheet1!R2C1:R7C4,4,FALSE)&"|"&VLOOKUP(INT(MOD(RC[-6],10)/1),Sheet1!R2C6:R9C9,4,FALSE) -> 0|0 | H152: =VLOOKUP(INT(MOD(RC[-7],10000)/1000),Sheet1!R2C1:R7C4,4,FALSE) -> 0 | I152: 1 | J152: =VLOOKUP(INT(MOD(RC[-9],10)/1),Sheet1!R2C6:R9C9,4,FALSE) -> 0 | K152: 0 | L152: 一二三四五六七八九十一二三四五六七八九十 | M152: 26
A153: 74200 | B153: =VLOOKUP(INT(MOD(RC[-1],1000)/100),Sheet1!R2C11:R8C12,2,FALSE)&VLOOKUP(INT(MOD(RC[-1],10000)/1000),Sheet1!R2C1:R7C4,3,FALSE)&VLOOKUP(INT(MOD(RC[-1],10)/1),Sheet1!R2C6:R9C9,3,FALSE) -> 蓝品经验鱼 | C153: 0 | D153: =INT(MOD(RC[-3],1000)/100) -> 2 | E153: =2^RC[-1]*100 -> 400 | F153: 0|0 | G153: =VLOOKUP(INT(MOD(RC[-6],10000)/1000),Sheet1!R2C1:R7C4,4,FALSE)&"|"&VLOOKUP(INT(MOD(RC[-6],10)/1),Sheet1!R2C6:R9C9,4,FALSE) -> 0|0 | H153: =VLOOKUP(INT(MOD(RC[-7],10000)/1000),Sheet1!R2C1:R7C4,4,FALSE) -> 0 | I153: 1 | J153: =VLOOKUP(INT(MOD(RC[-9],10)/1),Sheet1!R2C6:R9C9,4,FALSE) -> 0 | K153: 0 | L153: 一二三四五六七八九十一二三四五六七八九十 | M153: 33
A154: 74300 | B154: =VLOOKUP(INT(MOD(RC[-1],1000)/100),Sheet1!R2C11:R8C12,2,FALSE)&VLOOKUP(INT(MOD(RC[-1],10000)/1000),Sheet1!R2C1:R7C4,3,FALSE)&VLOOKUP(INT(MOD(RC[-1],10)/1),Sheet1!R2C6:R9C9,3,FALSE) -> 紫品经验鱼 | C154: 0 | D154: =INT(MOD(RC[-3],1000)/100) -> 3 | E154: =2^RC[-1]*100 -> 800 | F154: 0|0 | G154: =VLOOKUP(INT(MOD(RC[-6],10000)/1000),Sheet1!R2C1:R7C4,4,FALSE)&"|"&VLOOKUP(INT(MOD(RC[-6],10)/1),Sheet1!R2C6:R9C9,4,FALSE) -> 0|0 | H154: =VLOOKUP(INT(MOD(RC[-7],10000)/1000),Sheet1!R2C1:R7C4,4,FALSE) -> 0 | I154: 1 | J154: =VLOOKUP(INT(MOD(RC[-9],10)/1),Sheet1!R2C6:R9C9,4,FALSE) -> 0 | K154: 0 | L154: 一二三四五六七八九十一二三四五六七八九十 | M154: 26

Sheet: 3.升级
A1: quality|quality | B1: level|level | C1: exp|exp | D1: total_exp|total_exp | E1: need_role_level|need_role_level
A2: 不可空 | B2: 不可空 | C2: 不可空 | D2: 不可空 | E2: 不可空
A3: 数字 | B3: 数字 | C3: 数字 | D3: 数字 | E3: 数字
A6: 品质 | B6: 等级 | C6: 升级经验 | D6: 升级总经验 | E6: 需要的战队等级
A7: 0 | B7: 0 | C7: 100 | D7: 0 | E7: 0
A8: 0 | B8: 1 | C8: 200 | D8: =SUM(R7C[-1]:R[-1]C[-1]) -> 100 | E8: 0
A9: 0 | B9: 2 | C9: 300 | D9: =SUM(R7C[-1]:R[-1]C[-1]) -> 300 | E9: 0
A10: 0 | B10: 3 | C10: 400 | D10: =SUM(R7C[-1]:R[-1]C[-1]) -> 600 | E10: 0
A11: 0 | B11: 4 | C11: 500 | D11: =SUM(R7C[-1]:R[-1]C[-1]) -> 1000 | E11: 0
A12: 0 | B12: 5 | C12: 600 | D12: =SUM(R7C[-1]:R[-1]C[-1]) -> 1500 | E12: 0
A13: 0 | B13: 6 | C13: 700 | D13: =SUM(R7C[-1]:R[-1]C[-1]) -> 2100 | E13: 0
A14: 0 | B14: 7 | C14: 800 | D14: =SUM(R7C[-1]:R[-1]C[-1]) -> 2800 | E14: 0
A15: 0 | B15: 8 | C15: 900 | D15: =SUM(R7C[-1]:R[-1]C[-1]) -> 3600 | E15: 0
A16: 0 | B16: 9 | C16: 1000 | D16: =SUM(R7C[-1]:R[-1]C[-1]) -> 4500 | E16: 0
A17: 0 | B17: 10 | C17: 0 | D17: =SUM(R7C[-1]:R[-1]C[-1]) -> 5500 | E17: 0
A18: 1 | B18: 0 | C18: 200 | D18: 0 | E18: 0
A19: 1 | B19: 1 | C19: 400 | D19: =SUM(R18C[-1]:R[-1]C[-1]) -> 200 | E19: 0
A20: 1 | B20: 2 | C20: 600 | D20: =SUM(R18C[-1]:R[-1]C[-1]) -> 600 | E20: 0
A21: 1 | B21: 3 | C21: 800 | D21: =SUM(R18C[-1]:R[-1]C[-1]) -> 1200 | E21: 0
A22: 1 | B22: 4 | C22: 1000 | D22: =SUM(R18C[-1]:R[-1]C[-1]) -> 2000 | E22: 0
A23: 1 | B23: 5 | C23: 1200 | D23: =SUM(R18C[-1]:R[-1]C[-1]) -> 3000 | E23: 0
A24: 1 | B24: 6 | C24: 1400 | D24: =SUM(R18C[-1]:R[-1]C[-1]) -> 4200 | E24: 0
A25: 1 | B25: 7 | C25: 1600 | D25: =SUM(R18C[-1]:R[-1]C[-1]) -> 5600 | E25: 0
A26: 1 | B26: 8 | C26: 1800 | D26: =SUM(R18C[-1]:R[-1]C[-1]) -> 7200 | E26: 0
A27: 1 | B27: 9 | C27: 2000 | D27: =SUM(R18C[-1]:R[-1]C[-1]) -> 9000 | E27: 0
A28: 1 | B28: 10 | C28: 2200 | D28: =SUM(R18C[-1]:R[-1]C[-1]) -> 11000 | E28: 0
A29: 1 | B29: 11 | C29: 2400 | D29: =SUM(R18C[-1]:R[-1]C[-1]) -> 13200 | E29: 0
A30: 1 | B30: 12 | C30: 2600 | D30: =SUM(R18C[-1]:R[-1]C[-1]) -> 15600 | E30: 0
A31: 1 | B31: 13 | C31: 2800 | D31: =SUM(R18C[-1]:R[-1]C[-1]) -> 18200 | E31: 0
A32: 1 | B32: 14 | C32: 3000 | D32: =SUM(R18C[-1]:R[-1]C[-1]) -> 21000 | E32: 0
A33: 1 | B33: 15 | C33: 3200 | D33: =SUM(R18C[-1]:R[-1]C[-1]) -> 24000 | E33: 0
A34: 1 | B34: 16 | C34: 3400 | D34: =SUM(R18C[-1]:R[-1]C[-1]) -> 27200 | E34: 0
A35: 1 | B35: 17 | C35: 3600 | D35: =SUM(R18C[-1]:R[-1]C[-1]) -> 30600 | E35: 0
A36: 1 | B36: 18 | C36: 3800 | D36: =SUM(R18C[-1]:R[-1]C[-1]) -> 34200 | E36: 0
A37: 1 | B37: 19 | C37: 4000 | D37: =SUM(R18C[-1]:R[-1]C[-1]) -> 38000 | E37: 0
A38: 1 | B38: 20 | C38: 0 | D38: =SUM(R18C[-1]:R[-1]C[-1]) -> 42000 | E38: 0
A39: 2 | B39: 0 | C39: 400 | D39: 0 | E39: 0
A40: 2 | B40: 1 | C40: 800 | D40: =SUM(R39C[-1]:R[-1]C[-1]) -> 400 | E40: 0
A41: 2 | B41: 2 | C41: 1200 | D41: =SUM(R39C[-1]:R[-1]C[-1]) -> 1200 | E41: 0
A42: 2 | B42: 3 | C42: 1600 | D42: =SUM(R39C[-1]:R[-1]C[-1]) -> 2400 | E42: 0
A43: 2 | B43: 4 | C43: 2000 | D43: =SUM(R39C[-1]:R[-1]C[-1]) -> 4000 | E43: 0
A44: 2 | B44: 5 | C44: 2400 | D44: =SUM(R39C[-1]:R[-1]C[-1]) -> 6000 | E44: 0
A45: 2 | B45: 6 | C45: 2800 | D45: =SUM(R39C[-1]:R[-1]C[-1]) -> 8400 | E45: 0
A46: 2 | B46: 7 | C46: 3200 | D46: =SUM(R39C[-1]:R[-1]C[-1]) -> 11200 | E46: 0
A47: 2 | B47: 8 | C47: 3600 | D47: =SUM(R39C[-1]:R[-1]C[-1]) -> 14400 | E47: 0
A48: 2 | B48: 9 | C48: 4000 | D48: =SUM(R39C[-1]:R[-1]C[-1]) -> 18000 | E48: 0
A49: 2 | B49: 10 | C49: 4400 | D49: =SUM(R39C[-1]:R[-1]C[-1]) -> 22000 | E49: 0
A50: 2 | B50: 11 | C50: 4800 | D50: =SUM(R39C[-1]:R[-1]C[-1]) -> 26400 | E50: 0
A51: 2 | B51: 12 | C51: 5200 | D51: =SUM(R39C[-1]:R[-1]C[-1]) -> 31200 | E51: 0
A52: 2 | B52: 13 | C52: 5600 | D52: =SUM(R39C[-1]:R[-1]C[-1]) -> 36400 | E52: 0
A53: 2 | B53: 14 | C53: 6000 | D53: =SUM(R39C[-1]:R[-1]C[-1]) -> 42000 | E53: 0
A54: 2 | B54: 15 | C54: 6400 | D54: =SUM(R39C[-1]:R[-1]C[-1]) -> 48000 | E54: 0
A55: 2 | B55: 16 | C55: 6800 | D55: =SUM(R39C[-1]:R[-1]C[-1]) -> 54400 | E55: 0
A56: 2 | B56: 17 | C56: 7200 | D56: =SUM(R39C[-1]:R[-1]C[-1]) -> 61200 | E56: 0
A57: 2 | B57: 18 | C57: 7600 | D57: =SUM(R39C[-1]:R[-1]C[-1]) -> 68400 | E57: 0
A58: 2 | B58: 19 | C58: 8000 | D58: =SUM(R39C[-1]:R[-1]C[-1]) -> 76000 | E58: 0
A59: 2 | B59: 20 | C59: 8400 | D59: =SUM(R39C[-1]:R[-1]C[-1]) -> 84000 | E59: 0
A60: 2 | B60: 21 | C60: 8800 | D60: =SUM(R39C[-1]:R[-1]C[-1]) -> 92400 | E60: 0
A61: 2 | B61: 22 | C61: 9200 | D61: =SUM(R39C[-1]:R[-1]C[-1]) -> 101200 | E61: 0
A62: 2 | B62: 23 | C62: 9600 | D62: =SUM(R39C[-1]:R[-1]C[-1]) -> 110400 | E62: 0
A63: 2 | B63: 24 | C63: 10000 | D63: =SUM(R39C[-1]:R[-1]C[-1]) -> 120000 | E63: 0
A64: 2 | B64: 25 | C64: 10400 | D64: =SUM(R39C[-1]:R[-1]C[-1]) -> 130000 | E64: 0
A65: 2 | B65: 26 | C65: 10800 | D65: =SUM(R39C[-1]:R[-1]C[-1]) -> 140400 | E65: 0
A66: 2 | B66: 27 | C66: 11200 | D66: =SUM(R39C[-1]:R[-1]C[-1]) -> 151200 | E66: 0
A67: 2 | B67: 28 | C67: 11600 | D67: =SUM(R39C[-1]:R[-1]C[-1]) -> 162400 | E67: 0
A68: 2 | B68: 29 | C68: 12000 | D68: =SUM(R39C[-1]:R[-1]C[-1]) -> 174000 | E68: 0
A69: 2 | B69: 30 | C69: 12400 | D69: =SUM(R39C[-1]:R[-1]C[-1]) -> 186000 | E69: 0
A70: 2 | B70: 31 | C70: 12800 | D70: =SUM(R39C[-1]:R[-1]C[-1]) -> 198400 | E70: 0
A71: 2 | B71: 32 | C71: 13200 | D71: =SUM(R39C[-1]:R[-1]C[-1]) -> 211200 | E71: 0
A72: 2 | B72: 33 | C72: 13600 | D72: =SUM(R39C[-1]:R[-1]C[-1]) -> 224400 | E72: 0
A73: 2 | B73: 34 | C73: 14000 | D73: =SUM(R39C[-1]:R[-1]C[-1]) -> 238000 | E73: 0
A74: 2 | B74: 35 | C74: 14400 | D74: =SUM(R39C[-1]:R[-1]C[-1]) -> 252000 | E74: 0
A75: 2 | B75: 36 | C75: 14800 | D75: =SUM(R39C[-1]:R[-1]C[-1]) -> 266400 | E75: 0
A76: 2 | B76: 37 | C76: 15200 | D76: =SUM(R39C[-1]:R[-1]C[-1]) -> 281200 | E76: 0
A77: 2 | B77: 38 | C77: 15600 | D77: =SUM(R39C[-1]:R[-1]C[-1]) -> 296400 | E77: 0
A78: 2 | B78: 39 | C78: 16000 | D78: =SUM(R39C[-1]:R[-1]C[-1]) -> 312000 | E78: 0
A79: 2 | B79: 40 | C79: 0 | D79: =SUM(R39C[-1]:R[-1]C[-1]) -> 328000 | E79: 0
A80: 3 | B80: 0 | C80: 800 | D80: 0 | E80: 0
A81: 3 | B81: 1 | C81: 1600 | D81: =SUM(R80C[-1]:R[-1]C[-1]) -> 800 | E81: 0
A82: 3 | B82: 2 | C82: 2400 | D82: =SUM(R80C[-1]:R[-1]C[-1]) -> 2400 | E82: 0
A83: 3 | B83: 3 | C83: 3200 | D83: =SUM(R80C[-1]:R[-1]C[-1]) -> 4800 | E83: 0
A84: 3 | B84: 4 | C84: 4000 | D84: =SUM(R80C[-1]:R[-1]C[-1]) -> 8000 | E84: 0
A85: 3 | B85: 5 | C85: 4800 | D85: =SUM(R80C[-1]:R[-1]C[-1]) -> 12000 | E85: 0
A86: 3 | B86: 6 | C86: 5600 | D86: =SUM(R80C[-1]:R[-1]C[-1]) -> 16800 | E86: 0
A87: 3 | B87: 7 | C87: 6400 | D87: =SUM(R80C[-1]:R[-1]C[-1]) -> 22400 | E87: 0
A88: 3 | B88: 8 | C88: 7200 | D88: =SUM(R80C[-1]:R[-1]C[-1]) -> 28800 | E88: 0
A89: 3 | B89: 9 | C89: 8000 | D89: =SUM(R80C[-1]:R[-1]C[-1]) -> 36000 | E89: 0
A90: 3 | B90: 10 | C90: 8800 | D90: =SUM(R80C[-1]:R[-1]C[-1]) -> 44000 | E90: 0
A91: 3 | B91: 11 | C91: 9600 | D91: =SUM(R80C[-1]:R[-1]C[-1]) -> 52800 | E91: 0
A92: 3 | B92: 12 | C92: 10400 | D92: =SUM(R80C[-1]:R[-1]C[-1]) -> 62400 | E92: 0
A93: 3 | B93: 13 | C93: 11200 | D93: =SUM(R80C[-1]:R[-1]C[-1]) -> 72800 | E93: 0
A94: 3 | B94: 14 | C94: 12000 | D94: =SUM(R80C[-1]:R[-1]C[-1]) -> 84000 | E94: 0
A95: 3 | B95: 15 | C95: 12800 | D95: =SUM(R80C[-1]:R[-1]C[-1]) -> 96000 | E95: 0
A96: 3 | B96: 16 | C96: 13600 | D96: =SUM(R80C[-1]:R[-1]C[-1]) -> 108800 | E96: 0
A97: 3 | B97: 17 | C97: 14400 | D97: =SUM(R80C[-1]:R[-1]C[-1]) -> 122400 | E97: 0
A98: 3 | B98: 18 | C98: 15200 | D98: =SUM(R80C[-1]:R[-1]C[-1]) -> 136800 | E98: 0
A99: 3 | B99: 19 | C99: 16000 | D99: =SUM(R80C[-1]:R[-1]C[-1]) -> 152000 | E99: 0
A100: 3 | B100: 20 | C100: 16800 | D100: =SUM(R80C[-1]:R[-1]C[-1]) -> 168000 | E100: 0
A101: 3 | B101: 21 | C101: 17600 | D101: =SUM(R80C[-1]:R[-1]C[-1]) -> 184800 | E101: 0
A102: 3 | B102: 22 | C102: 18400 | D102: =SUM(R80C[-1]:R[-1]C[-1]) -> 202400 | E102: 0
A103: 3 | B103: 23 | C103: 19200 | D103: =SUM(R80C[-1]:R[-1]C[-1]) -> 220800 | E103: 0
A104: 3 | B104: 24 | C104: 20000 | D104: =SUM(R80C[-1]:R[-1]C[-1]) -> 240000 | E104: 0
A105: 3 | B105: 25 | C105: 20800 | D105: =SUM(R80C[-1]:R[-1]C[-1]) -> 260000 | E105: 0
A106: 3 | B106: 26 | C106: 21600 | D106: =SUM(R80C[-1]:R[-1]C[-1]) -> 280800 | E106: 0
A107: 3 | B107: 27 | C107: 22400 | D107: =SUM(R80C[-1]:R[-1]C[-1]) -> 302400 | E107: 0
A108: 3 | B108: 28 | C108: 23200 | D108: =SUM(R80C[-1]:R[-1]C[-1]) -> 324800 | E108: 0
A109: 3 | B109: 29 | C109: 24000 | D109: =SUM(R80C[-1]:R[-1]C[-1]) -> 348000 | E109: 0
A110: 3 | B110: 30 | C110: 24800 | D110: =SUM(R80C[-1]:R[-1]C[-1]) -> 372000 | E110: 0
A111: 3 | B111: 31 | C111: 25600 | D111: =SUM(R80C[-1]:R[-1]C[-1]) -> 396800 | E111: 0
A112: 3 | B112: 32 | C112: 26400 | D112: =SUM(R80C[-1]:R[-1]C[-1]) -> 422400 | E112: 0
A113: 3 | B113: 33 | C113: 27200 | D113: =SUM(R80C[-1]:R[-1]C[-1]) -> 448800 | E113: 0
A114: 3 | B114: 34 | C114: 28000 | D114: =SUM(R80C[-1]:R[-1]C[-1]) -> 476000 | E114: 0
A115: 3 | B115: 35 | C115: 28800 | D115: =SUM(R80C[-1]:R[-1]C[-1]) -> 504000 | E115: 0
A116: 3 | B116: 36 | C116: 29600 | D116: =SUM(R80C[-1]:R[-1]C[-1]) -> 532800 | E116: 0
A117: 3 | B117: 37 | C117: 30400 | D117: =SUM(R80C[-1]:R[-1]C[-1]) -> 562400 | E117: 0
A118: 3 | B118: 38 | C118: 31200 | D118: =SUM(R80C[-1]:R[-1]C[-1]) -> 592800 | E118: 0
A119: 3 | B119: 39 | C119: 32000 | D119: =SUM(R80C[-1]:R[-1]C[-1]) -> 624000 | E119: 0
A120: 3 | B120: 40 | C120: 32800 | D120: =SUM(R80C[-1]:R[-1]C[-1]) -> 656000 | E120: 60
A121: 3 | B121: 41 | C121: 33600 | D121: =SUM(R80C[-1]:R[-1]C[-1]) -> 688800 | E121: 60
A122: 3 | B122: 42 | C122: 34400 | D122: =SUM(R80C[-1]:R[-1]C[-1]) -> 722400 | E122: 60
A123: 3 | B123: 43 | C123: 35200 | D123: =SUM(R80C[-1]:R[-1]C[-1]) -> 756800 | E123: 60
A124: 3 | B124: 44 | C124: 36000 | D124: =SUM(R80C[-1]:R[-1]C[-1]) -> 792000 | E124: 60
A125: 3 | B125: 45 | C125: 36800 | D125: =SUM(R80C[-1]:R[-1]C[-1]) -> 828000 | E125: 60
A126: 3 | B126: 46 | C126: 37600 | D126: =SUM(R80C[-1]:R[-1]C[-1]) -> 864800 | E126: 60
A127: 3 | B127: 47 | C127: 38400 | D127: =SUM(R80C[-1]:R[-1]C[-1]) -> 902400 | E127: 60
A128: 3 | B128: 48 | C128: 39200 | D128: =SUM(R80C[-1]:R[-1]C[-1]) -> 940800 | E128: 60
A129: 3 | B129: 49 | C129: 40000 | D129: =SUM(R80C[-1]:R[-1]C[-1]) -> 980000 | E129: 60
A130: 3 | B130: 50 | C130: 40800 | D130: =SUM(R80C[-1]:R[-1]C[-1]) -> 1020000 | E130: 70
A131: 3 | B131: 51 | C131: 41600 | D131: =SUM(R80C[-1]:R[-1]C[-1]) -> 1060800 | E131: 70
A132: 3 | B132: 52 | C132: 42400 | D132: =SUM(R80C[-1]:R[-1]C[-1]) -> 1102400 | E132: 70
A133: 3 | B133: 53 | C133: 43200 | D133: =SUM(R80C[-1]:R[-1]C[-1]) -> 1144800 | E133: 70
A134: 3 | B134: 54 | C134: 44000 | D134: =SUM(R80C[-1]:R[-1]C[-1]) -> 1188000 | E134: 70
A135: 3 | B135: 55 | C135: 44800 | D135: =SUM(R80C[-1]:R[-1]C[-1]) -> 1232000 | E135: 70
A136: 3 | B136: 56 | C136: 45600 | D136: =SUM(R80C[-1]:R[-1]C[-1]) -> 1276800 | E136: 70
A137: 3 | B137: 57 | C137: 46400 | D137: =SUM(R80C[-1]:R[-1]C[-1]) -> 1322400 | E137: 70
A138: 3 | B138: 58 | C138: 47200 | D138: =SUM(R80C[-1]:R[-1]C[-1]) -> 1368800 | E138: 70
A139: 3 | B139: 59 | C139: 48000 | D139: =SUM(R80C[-1]:R[-1]C[-1]) -> 1416000 | E139: 70
A140: 3 | B140: 60 | C140: 48800 | D140: =SUM(R80C[-1]:R[-1]C[-1]) -> 1464000 | E140: 80
A141: 3 | B141: 61 | C141: 49600 | D141: =SUM(R80C[-1]:R[-1]C[-1]) -> 1512800 | E141: 80
A142: 3 | B142: 62 | C142: 50400 | D142: =SUM(R80C[-1]:R[-1]C[-1]) -> 1562400 | E142: 80
A143: 3 | B143: 63 | C143: 51200 | D143: =SUM(R80C[-1]:R[-1]C[-1]) -> 1612800 | E143: 80
A144: 3 | B144: 64 | C144: 52000 | D144: =SUM(R80C[-1]:R[-1]C[-1]) -> 1664000 | E144: 80
A145: 3 | B145: 65 | C145: 52800 | D145: =SUM(R80C[-1]:R[-1]C[-1]) -> 1716000 | E145: 80
A146: 3 | B146: 66 | C146: 53600 | D146: =SUM(R80C[-1]:R[-1]C[-1]) -> 1768800 | E146: 80
A147: 3 | B147: 67 | C147: 54400 | D147: =SUM(R80C[-1]:R[-1]C[-1]) -> 1822400 | E147: 80
A148: 3 | B148: 68 | C148: 55200 | D148: =SUM(R80C[-1]:R[-1]C[-1]) -> 1876800 | E148: 80
A149: 3 | B149: 69 | C149: 56000 | D149: =SUM(R80C[-1]:R[-1]C[-1]) -> 1932000 | E149: 80
A150: 3 | B150: 70 | C150: 56800 | D150: =SUM(R80C[-1]:R[-1]C[-1]) -> 1988000 | E150: 90
A151: 3 | B151: 71 | C151: 57600 | D151: =SUM(R80C[-1]:R[-1]C[-1]) -> 2044800 | E151: 90
A152: 3 | B152: 72 | C152: 58400 | D152: =SUM(R80C[-1]:R[-1]C[-1]) -> 2102400 | E152: 90
A153: 3 | B153: 73 | C153: 59200 | D153: =SUM(R80C[-1]:R[-1]C[-1]) -> 2160800 | E153: 90
A154: 3 | B154: 74 | C154: 60000 | D154: =SUM(R80C[-1]:R[-1]C[-1]) -> 2220000 | E154: 90
A155: 3 | B155: 75 | C155: 60800 | D155: =SUM(R80C[-1]:R[-1]C[-1]) -> 2280000 | E155: 90
A156: 3 | B156: 76 | C156: 61600 | D156: =SUM(R80C[-1]:R[-1]C[-1]) -> 2340800 | E156: 90
A157: 3 | B157: 77 | C157: 62400 | D157: =SUM(R80C[-1]:R[-1]C[-1]) -> 2402400 | E157: 90
A158: 3 | B158: 78 | C158: 63200 | D158: =SUM(R80C[-1]:R[-1]C[-1]) -> 2464800 | E158: 90
A159: 3 | B159: 79 | C159: 64000 | D159: =SUM(R80C[-1]:R[-1]C[-1]) -> 2528000 | E159: 90
A160: 3 | B160: 80 | C160: 64800 | D160: =SUM(R80C[-1]:R[-1]C[-1]) -> 2592000 | E160: 100
A161: 3 | B161: 81 | C161: 65600 | D161: =SUM(R80C[-1]:R[-1]C[-1]) -> 2656800 | E161: 100
A162: 3 | B162: 82 | C162: 66400 | D162: =SUM(R80C[-1]:R[-1]C[-1]) -> 2722400 | E162: 100
A163: 3 | B163: 83 | C163: 67200 | D163: =SUM(R80C[-1]:R[-1]C[-1]) -> 2788800 | E163: 100
A164: 3 | B164: 84 | C164: 68000 | D164: =SUM(R80C[-1]:R[-1]C[-1]) -> 2856000 | E164: 100
A165: 3 | B165: 85 | C165: 68800 | D165: =SUM(R80C[-1]:R[-1]C[-1]) -> 2924000 | E165: 100
A166: 3 | B166: 86 | C166: 69600 | D166: =SUM(R80C[-1]:R[-1]C[-1]) -> 2992800 | E166: 100
A167: 3 | B167: 87 | C167: 70400 | D167: =SUM(R80C[-1]:R[-1]C[-1]) -> 3062400 | E167: 100
A168: 3 | B168: 88 | C168: 71200 | D168: =SUM(R80C[-1]:R[-1]C[-1]) -> 3132800 | E168: 100
A169: 3 | B169: 89 | C169: 72000 | D169: =SUM(R80C[-1]:R[-1]C[-1]) -> 3204000 | E169: 100
A170: 3 | B170: 90 | C170: 72800 | D170: =SUM(R80C[-1]:R[-1]C[-1]) -> 3276000 | E170: 100
A171: 3 | B171: 91 | C171: 73600 | D171: =SUM(R80C[-1]:R[-1]C[-1]) -> 3348800 | E171: 100
A172: 3 | B172: 92 | C172: 74400 | D172: =SUM(R80C[-1]:R[-1]C[-1]) -> 3422400 | E172: 100
A173: 3 | B173: 93 | C173: 75200 | D173: =SUM(R80C[-1]:R[-1]C[-1]) -> 3496800 | E173: 100
A174: 3 | B174: 94 | C174: 76000 | D174: =SUM(R80C[-1]:R[-1]C[-1]) -> 3572000 | E174: 100
A175: 3 | B175: 95 | C175: 76800 | D175: =SUM(R80C[-1]:R[-1]C[-1]) -> 3648000 | E175: 100
A176: 3 | B176: 96 | C176: 77600 | D176: =SUM(R80C[-1]:R[-1]C[-1]) -> 3724800 | E176: 100
A177: 3 | B177: 97 | C177: 78400 | D177: =SUM(R80C[-1]:R[-1]C[-1]) -> 3802400 | E177: 100
A178: 3 | B178: 98 | C178: 79200 | D178: =SUM(R80C[-1]:R[-1]C[-1]) -> 3880800 | E178: 100
A179: 3 | B179: 99 | C179: 80000 | D179: =SUM(R80C[-1]:R[-1]C[-1]) -> 3960000 | E179: 100
A180: 3 | B180: 100 | C180: 0 | D180: =SUM(R80C[-1]:R[-1]C[-1]) -> 4040000 | E180: 100
A181: 4 | B181: 0 | C181: 1600 | D181: 0 | E181: 0
A182: 4 | B182: 1 | C182: 3200 | D182: =SUM(R181C[-1]:R[-1]C[-1]) -> 1600 | E182: 0
A183: 4 | B183: 2 | C183: 4800 | D183: =SUM(R181C[-1]:R[-1]C[-1]) -> 4800 | E183: 0
A184: 4 | B184: 3 | C184: 6400 | D184: =SUM(R181C[-1]:R[-1]C[-1]) -> 9600 | E184: 0
A185: 4 | B185: 4 | C185: 8000 | D185: =SUM(R181C[-1]:R[-1]C[-1]) -> 16000 | E185: 0
A186: 4 | B186: 5 | C186: 9600 | D186: =SUM(R181C[-1]:R[-1]C[-1]) -> 24000 | E186: 0
A187: 4 | B187: 6 | C187: 11200 | D187: =SUM(R181C[-1]:R[-1]C[-1]) -> 33600 | E187: 0
A188: 4 | B188: 7 | C188: 12800 | D188: =SUM(R181C[-1]:R[-1]C[-1]) -> 44800 | E188: 0
A189: 4 | B189: 8 | C189: 14400 | D189: =SUM(R181C[-1]:R[-1]C[-1]) -> 57600 | E189: 0
A190: 4 | B190: 9 | C190: 16000 | D190: =SUM(R181C[-1]:R[-1]C[-1]) -> 72000 | E190: 0
A191: 4 | B191: 10 | C191: 17600 | D191: =SUM(R181C[-1]:R[-1]C[-1]) -> 88000 | E191: 0
A192: 4 | B192: 11 | C192: 19200 | D192: =SUM(R181C[-1]:R[-1]C[-1]) -> 105600 | E192: 0
A193: 4 | B193: 12 | C193: 20800 | D193: =SUM(R181C[-1]:R[-1]C[-1]) -> 124800 | E193: 0
A194: 4 | B194: 13 | C194: 22400 | D194: =SUM(R181C[-1]:R[-1]C[-1]) -> 145600 | E194: 0
A195: 4 | B195: 14 | C195: 24000 | D195: =SUM(R181C[-1]:R[-1]C[-1]) -> 168000 | E195: 0
A196: 4 | B196: 15 | C196: 25600 | D196: =SUM(R181C[-1]:R[-1]C[-1]) -> 192000 | E196: 0
A197: 4 | B197: 16 | C197: 27200 | D197: =SUM(R181C[-1]:R[-1]C[-1]) -> 217600 | E197: 0
A198: 4 | B198: 17 | C198: 28800 | D198: =SUM(R181C[-1]:R[-1]C[-1]) -> 244800 | E198: 0
A199: 4 | B199: 18 | C199: 30400 | D199: =SUM(R181C[-1]:R[-1]C[-1]) -> 273600 | E199: 0
A200: 4 | B200: 19 | C200: 32000 | D200: =SUM(R181C[-1]:R[-1]C[-1]) -> 304000 | E200: 0
A201: 4 | B201: 20 | C201: 33600 | D201: =SUM(R181C[-1]:R[-1]C[-1]) -> 336000 | E201: 0
A202: 4 | B202: 21 | C202: 35200 | D202: =SUM(R181C[-1]:R[-1]C[-1]) -> 369600 | E202: 0
A203: 4 | B203: 22 | C203: 36800 | D203: =SUM(R181C[-1]:R[-1]C[-1]) -> 404800 | E203: 0
A204: 4 | B204: 23 | C204: 38400 | D204: =SUM(R181C[-1]:R[-1]C[-1]) -> 441600 | E204: 0
A205: 4 | B205: 24 | C205: 40000 | D205: =SUM(R181C[-1]:R[-1]C[-1]) -> 480000 | E205: 0
A206: 4 | B206: 25 | C206: 41600 | D206: =SUM(R181C[-1]:R[-1]C[-1]) -> 520000 | E206: 0
A207: 4 | B207: 26 | C207: 43200 | D207: =SUM(R181C[-1]:R[-1]C[-1]) -> 561600 | E207: 0
A208: 4 | B208: 27 | C208: 44800 | D208: =SUM(R181C[-1]:R[-1]C[-1]) -> 604800 | E208: 0
A209: 4 | B209: 28 | C209: 46400 | D209: =SUM(R181C[-1]:R[-1]C[-1]) -> 649600 | E209: 0
A210: 4 | B210: 29 | C210: 48000 | D210: =SUM(R181C[-1]:R[-1]C[-1]) -> 696000 | E210: 0
A211: 4 | B211: 30 | C211: 49600 | D211: =SUM(R181C[-1]:R[-1]C[-1]) -> 744000 | E211: 0
A212: 4 | B212: 31 | C212: 51200 | D212: =SUM(R181C[-1]:R[-1]C[-1]) -> 793600 | E212: 0
A213: 4 | B213: 32 | C213: 52800 | D213: =SUM(R181C[-1]:R[-1]C[-1]) -> 844800 | E213: 0
A214: 4 | B214: 33 | C214: 54400 | D214: =SUM(R181C[-1]:R[-1]C[-1]) -> 897600 | E214: 0
A215: 4 | B215: 34 | C215: 56000 | D215: =SUM(R181C[-1]:R[-1]C[-1]) -> 952000 | E215: 0
A216: 4 | B216: 35 | C216: 57600 | D216: =SUM(R181C[-1]:R[-1]C[-1]) -> 1008000 | E216: 0
A217: 4 | B217: 36 | C217: 59200 | D217: =SUM(R181C[-1]:R[-1]C[-1]) -> 1065600 | E217: 0
A218: 4 | B218: 37 | C218: 60800 | D218: =SUM(R181C[-1]:R[-1]C[-1]) -> 1124800 | E218: 0
A219: 4 | B219: 38 | C219: 62400 | D219: =SUM(R181C[-1]:R[-1]C[-1]) -> 1185600 | E219: 0
A220: 4 | B220: 39 | C220: 64000 | D220: =SUM(R181C[-1]:R[-1]C[-1]) -> 1248000 | E220: 0
A221: 4 | B221: 40 | C221: 65600 | D221: =SUM(R181C[-1]:R[-1]C[-1]) -> 1312000 | E221: 60
A222: 4 | B222: 41 | C222: 67200 | D222: =SUM(R181C[-1]:R[-1]C[-1]) -> 1377600 | E222: 60
A223: 4 | B223: 42 | C223: 68800 | D223: =SUM(R181C[-1]:R[-1]C[-1]) -> 1444800 | E223: 60
A224: 4 | B224: 43 | C224: 70400 | D224: =SUM(R181C[-1]:R[-1]C[-1]) -> 1513600 | E224: 60
A225: 4 | B225: 44 | C225: 72000 | D225: =SUM(R181C[-1]:R[-1]C[-1]) -> 1584000 | E225: 60
A226: 4 | B226: 45 | C226: 73600 | D226: =SUM(R181C[-1]:R[-1]C[-1]) -> 1656000 | E226: 60
A227: 4 | B227: 46 | C227: 75200 | D227: =SUM(R181C[-1]:R[-1]C[-1]) -> 1729600 | E227: 60
A228: 4 | B228: 47 | C228: 76800 | D228: =SUM(R181C[-1]:R[-1]C[-1]) -> 1804800 | E228: 60
A229: 4 | B229: 48 | C229: 78400 | D229: =SUM(R181C[-1]:R[-1]C[-1]) -> 1881600 | E229: 60
A230: 4 | B230: 49 | C230: 80000 | D230: =SUM(R181C[-1]:R[-1]C[-1]) -> 1960000 | E230: 60
A231: 4 | B231: 50 | C231: 81600 | D231: =SUM(R181C[-1]:R[-1]C[-1]) -> 2040000 | E231: 70
A232: 4 | B232: 51 | C232: 83200 | D232: =SUM(R181C[-1]:R[-1]C[-1]) -> 2121600 | E232: 70
A233: 4 | B233: 52 | C233: 84800 | D233: =SUM(R181C[-1]:R[-1]C[-1]) -> 2204800 | E233: 70
A234: 4 | B234: 53 | C234: 86400 | D234: =SUM(R181C[-1]:R[-1]C[-1]) -> 2289600 | E234: 70
A235: 4 | B235: 54 | C235: 88000 | D235: =SUM(R181C[-1]:R[-1]C[-1]) -> 2376000 | E235: 70
A236: 4 | B236: 55 | C236: 89600 | D236: =SUM(R181C[-1]:R[-1]C[-1]) -> 2464000 | E236: 70
A237: 4 | B237: 56 | C237: 91200 | D237: =SUM(R181C[-1]:R[-1]C[-1]) -> 2553600 | E237: 70
A238: 4 | B238: 57 | C238: 92800 | D238: =SUM(R181C[-1]:R[-1]C[-1]) -> 2644800 | E238: 70
A239: 4 | B239: 58 | C239: 94400 | D239: =SUM(R181C[-1]:R[-1]C[-1]) -> 2737600 | E239: 70
A240: 4 | B240: 59 | C240: 96000 | D240: =SUM(R181C[-1]:R[-1]C[-1]) -> 2832000 | E240: 70
A241: 4 | B241: 60 | C241: 97600 | D241: =SUM(R181C[-1]:R[-1]C[-1]) -> 2928000 | E241: 80
A242: 4 | B242: 61 | C242: 99200 | D242: =SUM(R181C[-1]:R[-1]C[-1]) -> 3025600 | E242: 80
A243: 4 | B243: 62 | C243: 100800 | D243: =SUM(R181C[-1]:R[-1]C[-1]) -> 3124800 | E243: 80
A244: 4 | B244: 63 | C244: 102400 | D244: =SUM(R181C[-1]:R[-1]C[-1]) -> 3225600 | E244: 80
A245: 4 | B245: 64 | C245: 104000 | D245: =SUM(R181C[-1]:R[-1]C[-1]) -> 3328000 | E245: 80
A246: 4 | B246: 65 | C246: 105600 | D246: =SUM(R181C[-1]:R[-1]C[-1]) -> 3432000 | E246: 80
A247: 4 | B247: 66 | C247: 107200 | D247: =SUM(R181C[-1]:R[-1]C[-1]) -> 3537600 | E247: 80
A248: 4 | B248: 67 | C248: 108800 | D248: =SUM(R181C[-1]:R[-1]C[-1]) -> 3644800 | E248: 80
A249: 4 | B249: 68 | C249: 110400 | D249: =SUM(R181C[-1]:R[-1]C[-1]) -> 3753600 | E249: 80
A250: 4 | B250: 69 | C250: 112000 | D250: =SUM(R181C[-1]:R[-1]C[-1]) -> 3864000 | E250: 80
A251: 4 | B251: 70 | C251: 113600 | D251: =SUM(R181C[-1]:R[-1]C[-1]) -> 3976000 | E251: 90
A252: 4 | B252: 71 | C252: 115200 | D252: =SUM(R181C[-1]:R[-1]C[-1]) -> 4089600 | E252: 90
A253: 4 | B253: 72 | C253: 116800 | D253: =SUM(R181C[-1]:R[-1]C[-1]) -> 4204800 | E253: 90
A254: 4 | B254: 73 | C254: 118400 | D254: =SUM(R181C[-1]:R[-1]C[-1]) -> 4321600 | E254: 90
A255: 4 | B255: 74 | C255: 120000 | D255: =SUM(R181C[-1]:R[-1]C[-1]) -> 4440000 | E255: 90
A256: 4 | B256: 75 | C256: 121600 | D256: =SUM(R181C[-1]:R[-1]C[-1]) -> 4560000 | E256: 90
A257: 4 | B257: 76 | C257: 123200 | D257: =SUM(R181C[-1]:R[-1]C[-1]) -> 4681600 | E257: 90
A258: 4 | B258: 77 | C258: 124800 | D258: =SUM(R181C[-1]:R[-1]C[-1]) -> 4804800 | E258: 90
A259: 4 | B259: 78 | C259: 126400 | D259: =SUM(R181C[-1]:R[-1]C[-1]) -> 4929600 | E259: 90
A260: 4 | B260: 79 | C260: 128000 | D260: =SUM(R181C[-1]:R[-1]C[-1]) -> 5056000 | E260: 90
A261: 4 | B261: 80 | C261: 129600 | D261: =SUM(R181C[-1]:R[-1]C[-1]) -> 5184000 | E261: 100
A262: 4 | B262: 81 | C262: 131200 | D262: =SUM(R181C[-1]:R[-1]C[-1]) -> 5313600 | E262: 100
A263: 4 | B263: 82 | C263: 132800 | D263: =SUM(R181C[-1]:R[-1]C[-1]) -> 5444800 | E263: 100
A264: 4 | B264: 83 | C264: 134400 | D264: =SUM(R181C[-1]:R[-1]C[-1]) -> 5577600 | E264: 100
A265: 4 | B265: 84 | C265: 136000 | D265: =SUM(R181C[-1]:R[-1]C[-1]) -> 5712000 | E265: 100
A266: 4 | B266: 85 | C266: 137600 | D266: =SUM(R181C[-1]:R[-1]C[-1]) -> 5848000 | E266: 100
A267: 4 | B267: 86 | C267: 139200 | D267: =SUM(R181C[-1]:R[-1]C[-1]) -> 5985600 | E267: 100
A268: 4 | B268: 87 | C268: 140800 | D268: =SUM(R181C[-1]:R[-1]C[-1]) -> 6124800 | E268: 100
A269: 4 | B269: 88 | C269: 142400 | D269: =SUM(R181C[-1]:R[-1]C[-1]) -> 6265600 | E269: 100
A270: 4 | B270: 89 | C270: 144000 | D270: =SUM(R181C[-1]:R[-1]C[-1]) -> 6408000 | E270: 100
A271: 4 | B271: 90 | C271: 145600 | D271: =SUM(R181C[-1]:R[-1]C[-1]) -> 6552000 | E271: 100
A272: 4 | B272: 91 | C272: 147200 | D272: =SUM(R181C[-1]:R[-1]C[-1]) -> 6697600 | E272: 100
A273: 4 | B273: 92 | C273: 148800 | D273: =SUM(R181C[-1]:R[-1]C[-1]) -> 6844800 | E273: 100
A274: 4 | B274: 93 | C274: 150400 | D274: =SUM(R181C[-1]:R[-1]C[-1]) -> 6993600 | E274: 100
A275: 4 | B275: 94 | C275: 152000 | D275: =SUM(R181C[-1]:R[-1]C[-1]) -> 7144000 | E275: 100
A276: 4 | B276: 95 | C276: 153600 | D276: =SUM(R181C[-1]:R[-1]C[-1]) -> 7296000 | E276: 100
A277: 4 | B277: 96 | C277: 155200 | D277: =SUM(R181C[-1]:R[-1]C[-1]) -> 7449600 | E277: 100
A278: 4 | B278: 97 | C278: 156800 | D278: =SUM(R181C[-1]:R[-1]C[-1]) -> 7604800 | E278: 100
A279: 4 | B279: 98 | C279: 158400 | D279: =SUM(R181C[-1]:R[-1]C[-1]) -> 7761600 | E279: 100
A280: 4 | B280: 99 | C280: 160000 | D280: =SUM(R181C[-1]:R[-1]C[-1]) -> 7920000 | E280: 100
A281: 4 | B281: 100 | C281: 0 | D281: =SUM(R181C[-1]:R[-1]C[-1]) -> 8080000 | E281: 100
A282: 5 | B282: 0 | C282: 3200 | D282: 0 | E282: 0
A283: 5 | B283: 1 | C283: 6400 | D283: =SUM(R282C[-1]:R[-1]C[-1]) -> 3200 | E283: 0
A284: 5 | B284: 2 | C284: 9600 | D284: =SUM(R282C[-1]:R[-1]C[-1]) -> 9600 | E284: 0
A285: 5 | B285: 3 | C285: 12800 | D285: =SUM(R282C[-1]:R[-1]C[-1]) -> 19200 | E285: 0
A286: 5 | B286: 4 | C286: 16000 | D286: =SUM(R282C[-1]:R[-1]C[-1]) -> 32000 | E286: 0
A287: 5 | B287: 5 | C287: 19200 | D287: =SUM(R282C[-1]:R[-1]C[-1]) -> 48000 | E287: 0
A288: 5 | B288: 6 | C288: 22400 | D288: =SUM(R282C[-1]:R[-1]C[-1]) -> 67200 | E288: 0
A289: 5 | B289: 7 | C289: 25600 | D289: =SUM(R282C[-1]:R[-1]C[-1]) -> 89600 | E289: 0
A290: 5 | B290: 8 | C290: 28800 | D290: =SUM(R282C[-1]:R[-1]C[-1]) -> 115200 | E290: 0
A291: 5 | B291: 9 | C291: 32000 | D291: =SUM(R282C[-1]:R[-1]C[-1]) -> 144000 | E291: 0
A292: 5 | B292: 10 | C292: 35200 | D292: =SUM(R282C[-1]:R[-1]C[-1]) -> 176000 | E292: 0
A293: 5 | B293: 11 | C293: 38400 | D293: =SUM(R282C[-1]:R[-1]C[-1]) -> 211200 | E293: 0
A294: 5 | B294: 12 | C294: 41600 | D294: =SUM(R282C[-1]:R[-1]C[-1]) -> 249600 | E294: 0
A295: 5 | B295: 13 | C295: 44800 | D295: =SUM(R282C[-1]:R[-1]C[-1]) -> 291200 | E295: 0
A296: 5 | B296: 14 | C296: 48000 | D296: =SUM(R282C[-1]:R[-1]C[-1]) -> 336000 | E296: 0
A297: 5 | B297: 15 | C297: 51200 | D297: =SUM(R282C[-1]:R[-1]C[-1]) -> 384000 | E297: 0
A298: 5 | B298: 16 | C298: 54400 | D298: =SUM(R282C[-1]:R[-1]C[-1]) -> 435200 | E298: 0
A299: 5 | B299: 17 | C299: 57600 | D299: =SUM(R282C[-1]:R[-1]C[-1]) -> 489600 | E299: 0
A300: 5 | B300: 18 | C300: 60800 | D300: =SUM(R282C[-1]:R[-1]C[-1]) -> 547200 | E300: 0
A301: 5 | B301: 19 | C301: 64000 | D301: =SUM(R282C[-1]:R[-1]C[-1]) -> 608000 | E301: 0
A302: 5 | B302: 20 | C302: 67200 | D302: =SUM(R282C[-1]:R[-1]C[-1]) -> 672000 | E302: 0
A303: 5 | B303: 21 | C303: 70400 | D303: =SUM(R282C[-1]:R[-1]C[-1]) -> 739200 | E303: 0
A304: 5 | B304: 22 | C304: 73600 | D304: =SUM(R282C[-1]:R[-1]C[-1]) -> 809600 | E304: 0
A305: 5 | B305: 23 | C305: 76800 | D305: =SUM(R282C[-1]:R[-1]C[-1]) -> 883200 | E305: 0
A306: 5 | B306: 24 | C306: 80000 | D306: =SUM(R282C[-1]:R[-1]C[-1]) -> 960000 | E306: 0
A307: 5 | B307: 25 | C307: 83200 | D307: =SUM(R282C[-1]:R[-1]C[-1]) -> 1040000 | E307: 0
A308: 5 | B308: 26 | C308: 86400 | D308: =SUM(R282C[-1]:R[-1]C[-1]) -> 1123200 | E308: 0
A309: 5 | B309: 27 | C309: 89600 | D309: =SUM(R282C[-1]:R[-1]C[-1]) -> 1209600 | E309: 0
A310: 5 | B310: 28 | C310: 92800 | D310: =SUM(R282C[-1]:R[-1]C[-1]) -> 1299200 | E310: 0
A311: 5 | B311: 29 | C311: 96000 | D311: =SUM(R282C[-1]:R[-1]C[-1]) -> 1392000 | E311: 0
A312: 5 | B312: 30 | C312: 99200 | D312: =SUM(R282C[-1]:R[-1]C[-1]) -> 1488000 | E312: 0
A313: 5 | B313: 31 | C313: 102400 | D313: =SUM(R282C[-1]:R[-1]C[-1]) -> 1587200 | E313: 0
A314: 5 | B314: 32 | C314: 105600 | D314: =SUM(R282C[-1]:R[-1]C[-1]) -> 1689600 | E314: 0
A315: 5 | B315: 33 | C315: 108800 | D315: =SUM(R282C[-1]:R[-1]C[-1]) -> 1795200 | E315: 0
A316: 5 | B316: 34 | C316: 112000 | D316: =SUM(R282C[-1]:R[-1]C[-1]) -> 1904000 | E316: 0
A317: 5 | B317: 35 | C317: 115200 | D317: =SUM(R282C[-1]:R[-1]C[-1]) -> 2016000 | E317: 0
A318: 5 | B318: 36 | C318: 118400 | D318: =SUM(R282C[-1]:R[-1]C[-1]) -> 2131200 | E318: 0
A319: 5 | B319: 37 | C319: 121600 | D319: =SUM(R282C[-1]:R[-1]C[-1]) -> 2249600 | E319: 0
A320: 5 | B320: 38 | C320: 124800 | D320: =SUM(R282C[-1]:R[-1]C[-1]) -> 2371200 | E320: 0
A321: 5 | B321: 39 | C321: 128000 | D321: =SUM(R282C[-1]:R[-1]C[-1]) -> 2496000 | E321: 0
A322: 5 | B322: 40 | C322: 131200 | D322: =SUM(R282C[-1]:R[-1]C[-1]) -> 2624000 | E322: 60
A323: 5 | B323: 41 | C323: 134400 | D323: =SUM(R282C[-1]:R[-1]C[-1]) -> 2755200 | E323: 60
A324: 5 | B324: 42 | C324: 137600 | D324: =SUM(R282C[-1]:R[-1]C[-1]) -> 2889600 | E324: 60
A325: 5 | B325: 43 | C325: 140800 | D325: =SUM(R282C[-1]:R[-1]C[-1]) -> 3027200 | E325: 60
A326: 5 | B326: 44 | C326: 144000 | D326: =SUM(R282C[-1]:R[-1]C[-1]) -> 3168000 | E326: 60
A327: 5 | B327: 45 | C327: 147200 | D327: =SUM(R282C[-1]:R[-1]C[-1]) -> 3312000 | E327: 60
A328: 5 | B328: 46 | C328: 150400 | D328: =SUM(R282C[-1]:R[-1]C[-1]) -> 3459200 | E328: 60
A329: 5 | B329: 47 | C329: 153600 | D329: =SUM(R282C[-1]:R[-1]C[-1]) -> 3609600 | E329: 60
A330: 5 | B330: 48 | C330: 156800 | D330: =SUM(R282C[-1]:R[-1]C[-1]) -> 3763200 | E330: 60
A331: 5 | B331: 49 | C331: 160000 | D331: =SUM(R282C[-1]:R[-1]C[-1]) -> 3920000 | E331: 60
A332: 5 | B332: 50 | C332: 163200 | D332: =SUM(R282C[-1]:R[-1]C[-1]) -> 4080000 | E332: 70
A333: 5 | B333: 51 | C333: 166400 | D333: =SUM(R282C[-1]:R[-1]C[-1]) -> 4243200 | E333: 70
A334: 5 | B334: 52 | C334: 169600 | D334: =SUM(R282C[-1]:R[-1]C[-1]) -> 4409600 | E334: 70
A335: 5 | B335: 53 | C335: 172800 | D335: =SUM(R282C[-1]:R[-1]C[-1]) -> 4579200 | E335: 70
A336: 5 | B336: 54 | C336: 176000 | D336: =SUM(R282C[-1]:R[-1]C[-1]) -> 4752000 | E336: 70
A337: 5 | B337: 55 | C337: 179200 | D337: =SUM(R282C[-1]:R[-1]C[-1]) -> 4928000 | E337: 70
A338: 5 | B338: 56 | C338: 182400 | D338: =SUM(R282C[-1]:R[-1]C[-1]) -> 5107200 | E338: 70
A339: 5 | B339: 57 | C339: 185600 | D339: =SUM(R282C[-1]:R[-1]C[-1]) -> 5289600 | E339: 70
A340: 5 | B340: 58 | C340: 188800 | D340: =SUM(R282C[-1]:R[-1]C[-1]) -> 5475200 | E340: 70
A341: 5 | B341: 59 | C341: 192000 | D341: =SUM(R282C[-1]:R[-1]C[-1]) -> 5664000 | E341: 70
A342: 5 | B342: 60 | C342: 195200 | D342: =SUM(R282C[-1]:R[-1]C[-1]) -> 5856000 | E342: 80
A343: 5 | B343: 61 | C343: 198400 | D343: =SUM(R282C[-1]:R[-1]C[-1]) -> 6051200 | E343: 80
A344: 5 | B344: 62 | C344: 201600 | D344: =SUM(R282C[-1]:R[-1]C[-1]) -> 6249600 | E344: 80
A345: 5 | B345: 63 | C345: 204800 | D345: =SUM(R282C[-1]:R[-1]C[-1]) -> 6451200 | E345: 80
A346: 5 | B346: 64 | C346: 208000 | D346: =SUM(R282C[-1]:R[-1]C[-1]) -> 6656000 | E346: 80
A347: 5 | B347: 65 | C347: 211200 | D347: =SUM(R282C[-1]:R[-1]C[-1]) -> 6864000 | E347: 80
A348: 5 | B348: 66 | C348: 214400 | D348: =SUM(R282C[-1]:R[-1]C[-1]) -> 7075200 | E348: 80
A349: 5 | B349: 67 | C349: 217600 | D349: =SUM(R282C[-1]:R[-1]C[-1]) -> 7289600 | E349: 80
A350: 5 | B350: 68 | C350: 220800 | D350: =SUM(R282C[-1]:R[-1]C[-1]) -> 7507200 | E350: 80
A351: 5 | B351: 69 | C351: 224000 | D351: =SUM(R282C[-1]:R[-1]C[-1]) -> 7728000 | E351: 80
A352: 5 | B352: 70 | C352: 227200 | D352: =SUM(R282C[-1]:R[-1]C[-1]) -> 7952000 | E352: 90
A353: 5 | B353: 71 | C353: 230400 | D353: =SUM(R282C[-1]:R[-1]C[-1]) -> 8179200 | E353: 90
A354: 5 | B354: 72 | C354: 233600 | D354: =SUM(R282C[-1]:R[-1]C[-1]) -> 8409600 | E354: 90
A355: 5 | B355: 73 | C355: 236800 | D355: =SUM(R282C[-1]:R[-1]C[-1]) -> 8643200 | E355: 90
A356: 5 | B356: 74 | C356: 240000 | D356: =SUM(R282C[-1]:R[-1]C[-1]) -> 8880000 | E356: 90
A357: 5 | B357: 75 | C357: 243200 | D357: =SUM(R282C[-1]:R[-1]C[-1]) -> 9120000 | E357: 90
A358: 5 | B358: 76 | C358: 246400 | D358: =SUM(R282C[-1]:R[-1]C[-1]) -> 9363200 | E358: 90
A359: 5 | B359: 77 | C359: 249600 | D359: =SUM(R282C[-1]:R[-1]C[-1]) -> 9609600 | E359: 90
A360: 5 | B360: 78 | C360: 252800 | D360: =SUM(R282C[-1]:R[-1]C[-1]) -> 9859200 | E360: 90
A361: 5 | B361: 79 | C361: 256000 | D361: =SUM(R282C[-1]:R[-1]C[-1]) -> 10112000 | E361: 90
A362: 5 | B362: 80 | C362: 259200 | D362: =SUM(R282C[-1]:R[-1]C[-1]) -> 10368000 | E362: 100
A363: 5 | B363: 81 | C363: 262400 | D363: =SUM(R282C[-1]:R[-1]C[-1]) -> 10627200 | E363: 100
A364: 5 | B364: 82 | C364: 265600 | D364: =SUM(R282C[-1]:R[-1]C[-1]) -> 10889600 | E364: 100
A365: 5 | B365: 83 | C365: 268800 | D365: =SUM(R282C[-1]:R[-1]C[-1]) -> 11155200 | E365: 100
A366: 5 | B366: 84 | C366: 272000 | D366: =SUM(R282C[-1]:R[-1]C[-1]) -> 11424000 | E366: 100
A367: 5 | B367: 85 | C367: 275200 | D367: =SUM(R282C[-1]:R[-1]C[-1]) -> 11696000 | E367: 100
A368: 5 | B368: 86 | C368: 278400 | D368: =SUM(R282C[-1]:R[-1]C[-1]) -> 11971200 | E368: 100
A369: 5 | B369: 87 | C369: 281600 | D369: =SUM(R282C[-1]:R[-1]C[-1]) -> 12249600 | E369: 100
A370: 5 | B370: 88 | C370: 284800 | D370: =SUM(R282C[-1]:R[-1]C[-1]) -> 12531200 | E370: 100
A371: 5 | B371: 89 | C371: 288000 | D371: =SUM(R282C[-1]:R[-1]C[-1]) -> 12816000 | E371: 100
A372: 5 | B372: 90 | C372: 291200 | D372: =SUM(R282C[-1]:R[-1]C[-1]) -> 13104000 | E372: 100
A373: 5 | B373: 91 | C373: 294400 | D373: =SUM(R282C[-1]:R[-1]C[-1]) -> 13395200 | E373: 100
A374: 5 | B374: 92 | C374: 297600 | D374: =SUM(R282C[-1]:R[-1]C[-1]) -> 13689600 | E374: 100
A375: 5 | B375: 93 | C375: 300800 | D375: =SUM(R282C[-1]:R[-1]C[-1]) -> 13987200 | E375: 100
A376: 5 | B376: 94 | C376: 304000 | D376: =SUM(R282C[-1]:R[-1]C[-1]) -> 14288000 | E376: 100
A377: 5 | B377: 95 | C377: 307200 | D377: =SUM(R282C[-1]:R[-1]C[-1]) -> 14592000 | E377: 100
A378: 5 | B378: 96 | C378: 310400 | D378: =SUM(R282C[-1]:R[-1]C[-1]) -> 14899200 | E378: 100
A379: 5 | B379: 97 | C379: 313600 | D379: =SUM(R282C[-1]:R[-1]C[-1]) -> 15209600 | E379: 100
A380: 5 | B380: 98 | C380: 316800 | D380: =SUM(R282C[-1]:R[-1]C[-1]) -> 15523200 | E380: 100
A381: 5 | B381: 99 | C381: 320000 | D381: =SUM(R282C[-1]:R[-1]C[-1]) -> 15840000 | E381: 100
A382: 5 | B382: 100 | C382: 0 | D382: =SUM(R282C[-1]:R[-1]C[-1]) -> 16160000 | E382: 100

Sheet: 4.突破
A1: quality|quality | B1: break_level|break_level | C1: need_fairy_level|need_fairy_level | D1: cost_type_list|cost_type_list | E1: cost_value_list|cost_value_list | F1: cost_item_id_list|cost_item_id_list | G1: cost_item_num_list|cost_item_num_list
A2: 不可空 | B2: 不可空 | C2: 不可空 | D2: 可空#不需字段 | E2: 可空#不需字段 | F2: 可空#不需字段 | G2: 可空#不需字段
A3: 数字 | B3: 数字 | C3: 数字 | D3: 一维数组 | E3: 一维数组 | F3: 一维数组 | G3: 一维数组
D4: 不定长 | E4: 不定长 | F4: 不定长 | G4: 不定长
A6: 品质 | B6: 突破等级 | C6: 需要将灵等级 | D6: 突破消耗类型列表(货币) | E6: 突破消耗值列表(货币) | F6: 消耗的物品ID列表 | G6: 消耗的物品数量列表
A7: 0 | B7: 0 | C7: =R[1]C[-1]*10 -> 10 | D7: 3 | E7: =R[1]C[-3]*50000 -> 50000 | F7: 10009 | G7: =R[1]C[-5]*5 -> 5
A8: 0 | B8: 1 | C8: =R[1]C[-1]*10 -> 0 | D8: 3 | E8: =R[1]C[-3]*50000 -> 0 | F8: 10009 | G8: =R[1]C[-5]*5 -> 0
A9: 1 | B9: 0 | C9: =R[1]C[-1]*10 -> 10 | D9: 3 | E9: =R[1]C[-3]*50000 -> 50000 | F9: 10009 | G9: =R[1]C[-5]*5 -> 5
A10: 1 | B10: 1 | C10: =R[1]C[-1]*10 -> 20 | D10: 3 | E10: =R[1]C[-3]*50000 -> 100000 | F10: 10009 | G10: =R[1]C[-5]*5 -> 10
A11: 1 | B11: 2 | C11: =R[1]C[-1]*10 -> 0 | D11: 3 | E11: =R[1]C[-3]*50000 -> 0 | F11: 10009 | G11: =R[1]C[-5]*5 -> 0
A12: 2 | B12: 0 | C12: =R[1]C[-1]*10 -> 10 | D12: 3 | E12: =R[1]C[-3]*50000 -> 50000 | F12: 10009 | G12: =R[1]C[-5]*5 -> 5
A13: 2 | B13: 1 | C13: =R[1]C[-1]*10 -> 20 | D13: 3 | E13: =R[1]C[-3]*50000 -> 100000 | F13: 10009 | G13: =R[1]C[-5]*5 -> 10
A14: 2 | B14: 2 | C14: =R[1]C[-1]*10 -> 30 | D14: 3 | E14: =R[1]C[-3]*50000 -> 150000 | F14: 10009 | G14: =R[1]C[-5]*5 -> 15
A15: 2 | B15: 3 | C15: =R[1]C[-1]*10 -> 40 | D15: 3 | E15: =R[1]C[-3]*50000 -> 200000 | F15: 10009 | G15: =R[1]C[-5]*5 -> 20
A16: 2 | B16: 4 | C16: =R[1]C[-1]*10 -> 0 | D16: 3 | E16: =R[1]C[-3]*50000 -> 0 | F16: 10009 | G16: =R[1]C[-5]*5 -> 0
A17: 3 | B17: 0 | C17: =R[1]C[-1]*10 -> 10 | D17: 3 | E17: =R[1]C[-3]*50000 -> 50000 | F17: 10009 | G17: =R[1]C[-5]*5 -> 5
A18: 3 | B18: 1 | C18: =R[1]C[-1]*10 -> 20 | D18: 3 | E18: =R[1]C[-3]*50000 -> 100000 | F18: 10009 | G18: =R[1]C[-5]*5 -> 10
A19: 3 | B19: 2 | C19: =R[1]C[-1]*10 -> 30 | D19: 3 | E19: =R[1]C[-3]*50000 -> 150000 | F19: 10009 | G19: =R[1]C[-5]*5 -> 15
A20: 3 | B20: 3 | C20: =R[1]C[-1]*10 -> 40 | D20: 3 | E20: =R[1]C[-3]*50000 -> 200000 | F20: 10009 | G20: =R[1]C[-5]*5 -> 20
A21: 3 | B21: 4 | C21: =R[1]C[-1]*10 -> 50 | D21: 3 | E21: =R[1]C[-3]*50000 -> 250000 | F21: 10009 | G21: =R[1]C[-5]*5 -> 25
A22: 3 | B22: 5 | C22: =R[1]C[-1]*10 -> 60 | D22: 3 | E22: =R[1]C[-3]*50000 -> 300000 | F22: 10009 | G22: =R[1]C[-5]*5 -> 30
A23: 3 | B23: 6 | C23: =R[1]C[-1]*10 -> 70 | D23: 3 | E23: =R[1]C[-3]*50000 -> 350000 | F23: 10009 | G23: =R[1]C[-5]*5 -> 35
A24: 3 | B24: 7 | C24: =R[1]C[-1]*10 -> 80 | D24: 3 | E24: =R[1]C[-3]*50000 -> 400000 | F24: 10009 | G24: =R[1]C[-5]*5 -> 40
A25: 3 | B25: 8 | C25: =R[1]C[-1]*10 -> 90 | D25: 3 | E25: =R[1]C[-3]*50000 -> 450000 | F25: 10009 | G25: =R[1]C[-5]*5 -> 45
A26: 3 | B26: 9 | C26: =R[1]C[-1]*10 -> 100 | D26: 3 | E26: =R[1]C[-3]*50000 -> 500000 | F26: 10009 | G26: =R[1]C[-5]*5 -> 50
A27: 3 | B27: 10 | C27: =R[1]C[-1]*10 -> 0 | D27: 3 | E27: =R[1]C[-3]*50000 -> 0 | F27: 10009 | G27: =R[1]C[-5]*5 -> 0
A28: 4 | B28: 0 | C28: =R[1]C[-1]*10 -> 10 | D28: 3 | E28: =R[1]C[-3]*50000 -> 50000 | F28: 10009 | G28: =R[1]C[-5]*5 -> 5
A29: 4 | B29: 1 | C29: =R[1]C[-1]*10 -> 20 | D29: 3 | E29: =R[1]C[-3]*50000 -> 100000 | F29: 10009 | G29: =R[1]C[-5]*5 -> 10
A30: 4 | B30: 2 | C30: =R[1]C[-1]*10 -> 30 | D30: 3 | E30: =R[1]C[-3]*50000 -> 150000 | F30: 10009 | G30: =R[1]C[-5]*5 -> 15
A31: 4 | B31: 3 | C31: =R[1]C[-1]*10 -> 40 | D31: 3 | E31: =R[1]C[-3]*50000 -> 200000 | F31: 10009 | G31: =R[1]C[-5]*5 -> 20
A32: 4 | B32: 4 | C32: =R[1]C[-1]*10 -> 50 | D32: 3 | E32: =R[1]C[-3]*50000 -> 250000 | F32: 10009 | G32: =R[1]C[-5]*5 -> 25
A33: 4 | B33: 5 | C33: =R[1]C[-1]*10 -> 60 | D33: 3 | E33: =R[1]C[-3]*50000 -> 300000 | F33: 10009 | G33: =R[1]C[-5]*5 -> 30
A34: 4 | B34: 6 | C34: =R[1]C[-1]*10 -> 70 | D34: 3 | E34: =R[1]C[-3]*50000 -> 350000 | F34: 10009 | G34: =R[1]C[-5]*5 -> 35
A35: 4 | B35: 7 | C35: =R[1]C[-1]*10 -> 80 | D35: 3 | E35: =R[1]C[-3]*50000 -> 400000 | F35: 10009 | G35: =R[1]C[-5]*5 -> 40
A36: 4 | B36: 8 | C36: =R[1]C[-1]*10 -> 90 | D36: 3 | E36: =R[1]C[-3]*50000 -> 450000 | F36: 10009 | G36: =R[1]C[-5]*5 -> 45
A37: 4 | B37: 9 | C37: =R[1]C[-1]*10 -> 100 | D37: 3 | E37: =R[1]C[-3]*50000 -> 500000 | F37: 10009 | G37: =R[1]C[-5]*5 -> 50
A38: 4 | B38: 10 | C38: =R[1]C[-1]*10 -> 0 | D38: 3 | E38: =R[1]C[-3]*50000 -> 0 | F38: 10009 | G38: =R[1]C[-5]*5 -> 0
A39: 5 | B39: 0 | C39: =R[1]C[-1]*10 -> 10 | D39: 3 | E39: =R[1]C[-3]*50000 -> 50000 | F39: 10009 | G39: =R[1]C[-5]*5 -> 5
A40: 5 | B40: 1 | C40: =R[1]C[-1]*10 -> 20 | D40: 3 | E40: =R[1]C[-3]*50000 -> 100000 | F40: 10009 | G40: =R[1]C[-5]*5 -> 10
A41: 5 | B41: 2 | C41: =R[1]C[-1]*10 -> 30 | D41: 3 | E41: =R[1]C[-3]*50000 -> 150000 | F41: 10009 | G41: =R[1]C[-5]*5 -> 15
A42: 5 | B42: 3 | C42: =R[1]C[-1]*10 -> 40 | D42: 3 | E42: =R[1]C[-3]*50000 -> 200000 | F42: 10009 | G42: =R[1]C[-5]*5 -> 20
A43: 5 | B43: 4 | C43: =R[1]C[-1]*10 -> 50 | D43: 3 | E43: =R[1]C[-3]*50000 -> 250000 | F43: 10009 | G43: =R[1]C[-5]*5 -> 25
A44: 5 | B44: 5 | C44: =R[1]C[-1]*10 -> 60 | D44: 3 | E44: =R[1]C[-3]*50000 -> 300000 | F44: 10009 | G44: =R[1]C[-5]*5 -> 30
A45: 5 | B45: 6 | C45: =R[1]C[-1]*10 -> 70 | D45: 3 | E45: =R[1]C[-3]*50000 -> 350000 | F45: 10009 | G45: =R[1]C[-5]*5 -> 35
A46: 5 | B46: 7 | C46: =R[1]C[-1]*10 -> 80 | D46: 3 | E46: =R[1]C[-3]*50000 -> 400000 | F46: 10009 | G46: =R[1]C[-5]*5 -> 40
A47: 5 | B47: 8 | C47: =R[1]C[-1]*10 -> 90 | D47: 3 | E47: =R[1]C[-3]*50000 -> 450000 | F47: 10009 | G47: =R[1]C[-5]*5 -> 45
A48: 5 | B48: 9 | C48: =R[1]C[-1]*10 -> 100 | D48: 3 | E48: =R[1]C[-3]*50000 -> 500000 | F48: 10009 | G48: =R[1]C[-5]*5 -> 50
A49: 5 | B49: 10 | C49: =R[1]C[-1]*10 -> 0 | D49: 3 | E49: =R[1]C[-3]*50000 -> 0 | F49: 10009 | G49: =R[1]C[-5]*5 -> 0

Sheet: 5.仙灵副本
A1: |map_id | B1: |rate
A2: 不可空 | B2: 不可空
A3: 数字 | B3: 数字
A6: 关卡ID | B6: 刷出概率
A7: 1 | B7: 100
A8: 2 | B8: 100
A9: 3 | B9: 100
A10: 4 | B10: 100
A11: 5 | B11: 100
A12: 6 | B12: 100
A13: 7 | B13: 100
A14: 8 | B14: 100
A15: 9 | B15: 100
A16: 10 | B16: 100

Sheet: 6.招募
A1: type|type | B1: name| | C1: do_times|do_times | D1: is_high_recruit|is_high_recruit | E1: free_times|free_times | F1: cost_currency_type|cost_currency_type | G1: cost_currency_value|cost_currency_value | H1: daily_times_max|daily_times_max | I1: purple_need_times|purple_need_times
A2: 不可空 | B2: 不可空 | C2: 不可空 | D2: 不可空 | E2: 不可空 | F2: 不可空 | G2: 不可空 | H2: 不可空 | I2: 不可空
A3: 数字 | B3: 字符串 | C3: 数字 | D3: 数字 | E3: 数字 | F3: 数字 | G3: 数字 | H3: 数字 | I3: 数字
A6: 招募类型 | B6: 招募名称 | C6: 招募一次执行的次数 | D6: 是否高级招募 | E6: 每日可免费招募的次数 | F6: 消耗货币类型 | G6: 消耗货币值 | H6: 每日招募次数上限(0=表示无限制) | I6: 紫色品质需要的招募次数(0=表示无此功能)
A7: 0 | B7: 普通召唤一次 | C7: 1 | D7: 0 | E7: 1 | F7: 3 | G7: 50000 | H7: 10 | I7: 0
A8: 1 | B8: 普通召唤十次 | C8: 10 | D8: 0 | E8: 0 | F8: 3 | G8: 450000 | H8: 10 | I8: 0
A9: 2 | B9: 高级召唤一次 | C9: 1 | D9: 1 | E9: 1 | F9: 5 | G9: 200 | H9: 0 | I9: 0
A10: 3 | B10: 高级召唤五次 | C10: 5 | D10: 1 | E10: 0 | F10: 5 | G10: 888 | H10: 0 | I10: 0

Sheet: 7.普通招募库
A1: id|id | B1: |rate
A2: 不可空 | B2: 不可空
A3: 数字 | B3: 数字
G5: =LCM(R[2]C:R[5]C) -> 25 | I5: =SUMPRODUCT(R[2]C:R[5]C,R[2]C[-2]:R[5]C[-2]) -> 2500
A6: 仙灵Id | B6: 召唤权值 | D6: 品质 | E6: 权值 | F6: 品质 | G6: 数量 | H6: 期望几率 | I6: 转换权值 | J6: 10000
A7: 70001 | B7: 50 | D7: =MOD(INT(RC[-3]/100),10) -> 0 | E7: =VLOOKUP(RC[-1],R7C6:R10C9,4,FALSE) -> 60 | F7: 0 | G7: =COUNTIF(C[-3],RC[-1]) -> 25 | H7: 60 | I7: =RC[-1]/RC[-2]*R5C7 -> 60
A8: 70002 | B8: 50 | D8: =MOD(INT(RC[-3]/100),10) -> 0 | E8: =VLOOKUP(RC[-1],R7C6:R10C9,4,FALSE) -> 60 | F8: 1 | G8: =COUNTIF(C[-3],RC[-1]) -> 25 | H8: 34 | I8: =RC[-1]/RC[-2]*R5C7 -> 34
A9: 70003 | B9: 50 | D9: =MOD(INT(RC[-3]/100),10) -> 0 | E9: =VLOOKUP(RC[-1],R7C6:R10C9,4,FALSE) -> 60 | F9: 2 | G9: =COUNTIF(C[-3],RC[-1]) -> 25 | H9: 5 | I9: =RC[-1]/RC[-2]*R5C7 -> 5
A10: 70004 | B10: 50 | D10: =MOD(INT(RC[-3]/100),10) -> 0 | E10: =VLOOKUP(RC[-1],R7C6:R10C9,4,FALSE) -> 60 | F10: 3 | G10: =COUNTIF(C[-3],RC[-1]) -> 25 | H10: 1 | I10: =RC[-1]/RC[-2]*R5C7 -> 1
A11: 70005 | B11: 50 | D11: =MOD(INT(RC[-3]/100),10) -> 0 | E11: =VLOOKUP(RC[-1],R7C6:R10C9,4,FALSE) -> 60
A12: 70006 | B12: 50 | D12: =MOD(INT(RC[-3]/100),10) -> 0 | E12: =VLOOKUP(RC[-1],R7C6:R10C9,4,FALSE) -> 60
A13: 70101 | B13: 39 | D13: =MOD(INT(RC[-3]/100),10) -> 1 | E13: =VLOOKUP(RC[-1],R7C6:R10C9,4,FALSE) -> 34
A14: 70102 | B14: 39 | D14: =MOD(INT(RC[-3]/100),10) -> 1 | E14: =VLOOKUP(RC[-1],R7C6:R10C9,4,FALSE) -> 34
A15: 70103 | B15: 39 | D15: =MOD(INT(RC[-3]/100),10) -> 1 | E15: =VLOOKUP(RC[-1],R7C6:R10C9,4,FALSE) -> 34
A16: 70104 | B16: 39 | D16: =MOD(INT(RC[-3]/100),10) -> 1 | E16: =VLOOKUP(RC[-1],R7C6:R10C9,4,FALSE) -> 34
A17: 70105 | B17: 39 | D17: =MOD(INT(RC[-3]/100),10) -> 1 | E17: =VLOOKUP(RC[-1],R7C6:R10C9,4,FALSE) -> 34
A18: 70106 | B18: 39 | D18: =MOD(INT(RC[-3]/100),10) -> 1 | E18: =VLOOKUP(RC[-1],R7C6:R10C9,4,FALSE) -> 34
A19: 70201 | B19: 10 | D19: =MOD(INT(RC[-3]/100),10) -> 2 | E19: =VLOOKUP(RC[-1],R7C6:R10C9,4,FALSE) -> 5
A20: 70202 | B20: 10 | D20: =MOD(INT(RC[-3]/100),10) -> 2 | E20: =VLOOKUP(RC[-1],R7C6:R10C9,4,FALSE) -> 5
A21: 70203 | B21: 10 | D21: =MOD(INT(RC[-3]/100),10) -> 2 | E21: =VLOOKUP(RC[-1],R7C6:R10C9,4,FALSE) -> 5
A22: 70204 | B22: 10 | D22: =MOD(INT(RC[-3]/100),10) -> 2 | E22: =VLOOKUP(RC[-1],R7C6:R10C9,4,FALSE) -> 5
A23: 70205 | B23: 10 | D23: =MOD(INT(RC[-3]/100),10) -> 2 | E23: =VLOOKUP(RC[-1],R7C6:R10C9,4,FALSE) -> 5
A24: 70206 | B24: 10 | D24: =MOD(INT(RC[-3]/100),10) -> 2 | E24: =VLOOKUP(RC[-1],R7C6:R10C9,4,FALSE) -> 5
A25: 70301 | B25: 1 | D25: =MOD(INT(RC[-3]/100),10) -> 3 | E25: =VLOOKUP(RC[-1],R7C6:R10C9,4,FALSE) -> 1
A26: 70302 | B26: 1 | D26: =MOD(INT(RC[-3]/100),10) -> 3 | E26: =VLOOKUP(RC[-1],R7C6:R10C9,4,FALSE) -> 1
A27: 70303 | B27: 1 | D27: =MOD(INT(RC[-3]/100),10) -> 3 | E27: =VLOOKUP(RC[-1],R7C6:R10C9,4,FALSE) -> 1
A28: 70304 | B28: 1 | D28: =MOD(INT(RC[-3]/100),10) -> 3 | E28: =VLOOKUP(RC[-1],R7C6:R10C9,4,FALSE) -> 1
A29: 70305 | B29: 1 | D29: =MOD(INT(RC[-3]/100),10) -> 3 | E29: =VLOOKUP(RC[-1],R7C6:R10C9,4,FALSE) -> 1
A30: 70306 | B30: 1 | D30: =MOD(INT(RC[-3]/100),10) -> 3 | E30: =VLOOKUP(RC[-1],R7C6:R10C9,4,FALSE) -> 1
A31: 71001 | B31: 50 | D31: =MOD(INT(RC[-3]/100),10) -> 0 | E31: =VLOOKUP(RC[-1],R7C6:R10C9,4,FALSE) -> 60
A32: 71002 | B32: 50 | D32: =MOD(INT(RC[-3]/100),10) -> 0 | E32: =VLOOKUP(RC[-1],R7C6:R10C9,4,FALSE) -> 60
A33: 71003 | B33: 50 | D33: =MOD(INT(RC[-3]/100),10) -> 0 | E33: =VLOOKUP(RC[-1],R7C6:R10C9,4,FALSE) -> 60
A34: 71004 | B34: 50 | D34: =MOD(INT(RC[-3]/100),10) -> 0 | E34: =VLOOKUP(RC[-1],R7C6:R10C9,4,FALSE) -> 60
A35: 71005 | B35: 50 | D35: =MOD(INT(RC[-3]/100),10) -> 0 | E35: =VLOOKUP(RC[-1],R7C6:R10C9,4,FALSE) -> 60
A36: 71006 | B36: 50 | D36: =MOD(INT(RC[-3]/100),10) -> 0 | E36: =VLOOKUP(RC[-1],R7C6:R10C9,4,FALSE) -> 60
A37: 71101 | B37: 39 | D37: =MOD(INT(RC[-3]/100),10) -> 1 | E37: =VLOOKUP(RC[-1],R7C6:R10C9,4,FALSE) -> 34
A38: 71102 | B38: 39 | D38: =MOD(INT(RC[-3]/100),10) -> 1 | E38: =VLOOKUP(RC[-1],R7C6:R10C9,4,FALSE) -> 34
A39: 71103 | B39: 39 | D39: =MOD(INT(RC[-3]/100),10) -> 1 | E39: =VLOOKUP(RC[-1],R7C6:R10C9,4,FALSE) -> 34
A40: 71104 | B40: 39 | D40: =MOD(INT(RC[-3]/100),10) -> 1 | E40: =VLOOKUP(RC[-1],R7C6:R10C9,4,FALSE) -> 34
A41: 71105 | B41: 39 | D41: =MOD(INT(RC[-3]/100),10) -> 1 | E41: =VLOOKUP(RC[-1],R7C6:R10C9,4,FALSE) -> 34
A42: 71106 | B42: 39 | D42: =MOD(INT(RC[-3]/100),10) -> 1 | E42: =VLOOKUP(RC[-1],R7C6:R10C9,4,FALSE) -> 34
A43: 71201 | B43: 10 | D43: =MOD(INT(RC[-3]/100),10) -> 2 | E43: =VLOOKUP(RC[-1],R7C6:R10C9,4,FALSE) -> 5
A44: 71202 | B44: 10 | D44: =MOD(INT(RC[-3]/100),10) -> 2 | E44: =VLOOKUP(RC[-1],R7C6:R10C9,4,FALSE) -> 5
A45: 71203 | B45: 10 | D45: =MOD(INT(RC[-3]/100),10) -> 2 | E45: =VLOOKUP(RC[-1],R7C6:R10C9,4,FALSE) -> 5
A46: 71204 | B46: 10 | D46: =MOD(INT(RC[-3]/100),10) -> 2 | E46: =VLOOKUP(RC[-1],R7C6:R10C9,4,FALSE) -> 5
A47: 71205 | B47: 10 | D47: =MOD(INT(RC[-3]/100),10) -> 2 | E47: =VLOOKUP(RC[-1],R7C6:R10C9,4,FALSE) -> 5
A48: 71206 | B48: 10 | D48: =MOD(INT(RC[-3]/100),10) -> 2 | E48: =VLOOKUP(RC[-1],R7C6:R10C9,4,FALSE) -> 5
A49: 71301 | B49: 1 | D49: =MOD(INT(RC[-3]/100),10) -> 3 | E49: =VLOOKUP(RC[-1],R7C6:R10C9,4,FALSE) -> 1
A50: 71302 | B50: 1 | D50: =MOD(INT(RC[-3]/100),10) -> 3 | E50: =VLOOKUP(RC[-1],R7C6:R10C9,4,FALSE) -> 1
A51: 71303 | B51: 1 | D51: =MOD(INT(RC[-3]/100),10) -> 3 | E51: =VLOOKUP(RC[-1],R7C6:R10C9,4,FALSE) -> 1
A52: 71304 | B52: 1 | D52: =MOD(INT(RC[-3]/100),10) -> 3 | E52: =VLOOKUP(RC[-1],R7C6:R10C9,4,FALSE) -> 1
A53: 71305 | B53: 1 | D53: =MOD(INT(RC[-3]/100),10) -> 3 | E53: =VLOOKUP(RC[-1],R7C6:R10C9,4,FALSE) -> 1
A54: 71306 | B54: 1 | D54: =MOD(INT(RC[-3]/100),10) -> 3 | E54: =VLOOKUP(RC[-1],R7C6:R10C9,4,FALSE) -> 1
A55: 72001 | B55: 50 | D55: =MOD(INT(RC[-3]/100),10) -> 0 | E55: =VLOOKUP(RC[-1],R7C6:R10C9,4,FALSE) -> 60
A56: 72002 | B56: 50 | D56: =MOD(INT(RC[-3]/100),10) -> 0 | E56: =VLOOKUP(RC[-1],R7C6:R10C9,4,FALSE) -> 60
A57: 72003 | B57: 50 | D57: =MOD(INT(RC[-3]/100),10) -> 0 | E57: =VLOOKUP(RC[-1],R7C6:R10C9,4,FALSE) -> 60
A58: 72004 | B58: 50 | D58: =MOD(INT(RC[-3]/100),10) -> 0 | E58: =VLOOKUP(RC[-1],R7C6:R10C9,4,FALSE) -> 60
A59: 72005 | B59: 50 | D59: =MOD(INT(RC[-3]/100),10) -> 0 | E59: =VLOOKUP(RC[-1],R7C6:R10C9,4,FALSE) -> 60
A60: 72006 | B60: 50 | D60: =MOD(INT(RC[-3]/100),10) -> 0 | E60: =VLOOKUP(RC[-1],R7C6:R10C9,4,FALSE) -> 60
A61: 72101 | B61: 39 | D61: =MOD(INT(RC[-3]/100),10) -> 1 | E61: =VLOOKUP(RC[-1],R7C6:R10C9,4,FALSE) -> 34
A62: 72102 | B62: 39 | D62: =MOD(INT(RC[-3]/100),10) -> 1 | E62: =VLOOKUP(RC[-1],R7C6:R10C9,4,FALSE) -> 34
A63: 72103 | B63: 39 | D63: =MOD(INT(RC[-3]/100),10) -> 1 | E63: =VLOOKUP(RC[-1],R7C6:R10C9,4,FALSE) -> 34
A64: 72104 | B64: 39 | D64: =MOD(INT(RC[-3]/100),10) -> 1 | E64: =VLOOKUP(RC[-1],R7C6:R10C9,4,FALSE) -> 34
A65: 72105 | B65: 39 | D65: =MOD(INT(RC[-3]/100),10) -> 1 | E65: =VLOOKUP(RC[-1],R7C6:R10C9,4,FALSE) -> 34
A66: 72106 | B66: 39 | D66: =MOD(INT(RC[-3]/100),10) -> 1 | E66: =VLOOKUP(RC[-1],R7C6:R10C9,4,FALSE) -> 34
A67: 72201 | B67: 10 | D67: =MOD(INT(RC[-3]/100),10) -> 2 | E67: =VLOOKUP(RC[-1],R7C6:R10C9,4,FALSE) -> 5
A68: 72202 | B68: 10 | D68: =MOD(INT(RC[-3]/100),10) -> 2 | E68: =VLOOKUP(RC[-1],R7C6:R10C9,4,FALSE) -> 5
A69: 72203 | B69: 10 | D69: =MOD(INT(RC[-3]/100),10) -> 2 | E69: =VLOOKUP(RC[-1],R7C6:R10C9,4,FALSE) -> 5
A70: 72204 | B70: 10 | D70: =MOD(INT(RC[-3]/100),10) -> 2 | E70: =VLOOKUP(RC[-1],R7C6:R10C9,4,FALSE) -> 5
A71: 72205 | B71: 10 | D71: =MOD(INT(RC[-3]/100),10) -> 2 | E71: =VLOOKUP(RC[-1],R7C6:R10C9,4,FALSE) -> 5
A72: 72206 | B72: 10 | D72: =MOD(INT(RC[-3]/100),10) -> 2 | E72: =VLOOKUP(RC[-1],R7C6:R10C9,4,FALSE) -> 5
A73: 72301 | B73: 1 | D73: =MOD(INT(RC[-3]/100),10) -> 3 | E73: =VLOOKUP(RC[-1],R7C6:R10C9,4,FALSE) -> 1
A74: 72302 | B74: 1 | D74: =MOD(INT(RC[-3]/100),10) -> 3 | E74: =VLOOKUP(RC[-1],R7C6:R10C9,4,FALSE) -> 1
A75: 72303 | B75: 1 | D75: =MOD(INT(RC[-3]/100),10) -> 3 | E75: =VLOOKUP(RC[-1],R7C6:R10C9,4,FALSE) -> 1
A76: 72304 | B76: 1 | D76: =MOD(INT(RC[-3]/100),10) -> 3 | E76: =VLOOKUP(RC[-1],R7C6:R10C9,4,FALSE) -> 1
A77: 72305 | B77: 1 | D77: =MOD(INT(RC[-3]/100),10) -> 3 | E77: =VLOOKUP(RC[-1],R7C6:R10C9,4,FALSE) -> 1
A78: 72306 | B78: 1 | D78: =MOD(INT(RC[-3]/100),10) -> 3 | E78: =VLOOKUP(RC[-1],R7C6:R10C9,4,FALSE) -> 1
A79: 73001 | B79: 50 | D79: =MOD(INT(RC[-3]/100),10) -> 0 | E79: =VLOOKUP(RC[-1],R7C6:R10C9,4,FALSE) -> 60
A80: 73002 | B80: 50 | D80: =MOD(INT(RC[-3]/100),10) -> 0 | E80: =VLOOKUP(RC[-1],R7C6:R10C9,4,FALSE) -> 60
A81: 73003 | B81: 50 | D81: =MOD(INT(RC[-3]/100),10) -> 0 | E81: =VLOOKUP(RC[-1],R7C6:R10C9,4,FALSE) -> 60
A82: 73004 | B82: 50 | D82: =MOD(INT(RC[-3]/100),10) -> 0 | E82: =VLOOKUP(RC[-1],R7C6:R10C9,4,FALSE) -> 60
A83: 73005 | B83: 50 | D83: =MOD(INT(RC[-3]/100),10) -> 0 | E83: =VLOOKUP(RC[-1],R7C6:R10C9,4,FALSE) -> 60
A84: 73006 | B84: 50 | D84: =MOD(INT(RC[-3]/100),10) -> 0 | E84: =VLOOKUP(RC[-1],R7C6:R10C9,4,FALSE) -> 60
A85: 73101 | B85: 39 | D85: =MOD(INT(RC[-3]/100),10) -> 1 | E85: =VLOOKUP(RC[-1],R7C6:R10C9,4,FALSE) -> 34
A86: 73102 | B86: 39 | D86: =MOD(INT(RC[-3]/100),10) -> 1 | E86: =VLOOKUP(RC[-1],R7C6:R10C9,4,FALSE) -> 34
A87: 73103 | B87: 39 | D87: =MOD(INT(RC[-3]/100),10) -> 1 | E87: =VLOOKUP(RC[-1],R7C6:R10C9,4,FALSE) -> 34
A88: 73104 | B88: 39 | D88: =MOD(INT(RC[-3]/100),10) -> 1 | E88: =VLOOKUP(RC[-1],R7C6:R10C9,4,FALSE) -> 34
A89: 73105 | B89: 39 | D89: =MOD(INT(RC[-3]/100),10) -> 1 | E89: =VLOOKUP(RC[-1],R7C6:R10C9,4,FALSE) -> 34
A90: 73106 | B90: 39 | D90: =MOD(INT(RC[-3]/100),10) -> 1 | E90: =VLOOKUP(RC[-1],R7C6:R10C9,4,FALSE) -> 34
A91: 73201 | B91: 10 | D91: =MOD(INT(RC[-3]/100),10) -> 2 | E91: =VLOOKUP(RC[-1],R7C6:R10C9,4,FALSE) -> 5
A92: 73202 | B92: 10 | D92: =MOD(INT(RC[-3]/100),10) -> 2 | E92: =VLOOKUP(RC[-1],R7C6:R10C9,4,FALSE) -> 5
A93: 73203 | B93: 10 | D93: =MOD(INT(RC[-3]/100),10) -> 2 | E93: =VLOOKUP(RC[-1],R7C6:R10C9,4,FALSE) -> 5
A94: 73204 | B94: 10 | D94: =MOD(INT(RC[-3]/100),10) -> 2 | E94: =VLOOKUP(RC[-1],R7C6:R10C9,4,FALSE) -> 5
A95: 73205 | B95: 10 | D95: =MOD(INT(RC[-3]/100),10) -> 2 | E95: =VLOOKUP(RC[-1],R7C6:R10C9,4,FALSE) -> 5
A96: 73206 | B96: 10 | D96: =MOD(INT(RC[-3]/100),10) -> 2 | E96: =VLOOKUP(RC[-1],R7C6:R10C9,4,FALSE) -> 5
A97: 73301 | B97: 1 | D97: =MOD(INT(RC[-3]/100),10) -> 3 | E97: =VLOOKUP(RC[-1],R7C6:R10C9,4,FALSE) -> 1
A98: 73302 | B98: 1 | D98: =MOD(INT(RC[-3]/100),10) -> 3 | E98: =VLOOKUP(RC[-1],R7C6:R10C9,4,FALSE) -> 1
A99: 73303 | B99: 1 | D99: =MOD(INT(RC[-3]/100),10) -> 3 | E99: =VLOOKUP(RC[-1],R7C6:R10C9,4,FALSE) -> 1
A100: 73304 | B100: 1 | D100: =MOD(INT(RC[-3]/100),10) -> 3 | E100: =VLOOKUP(RC[-1],R7C6:R10C9,4,FALSE) -> 1
A101: 73305 | B101: 1 | D101: =MOD(INT(RC[-3]/100),10) -> 3 | E101: =VLOOKUP(RC[-1],R7C6:R10C9,4,FALSE) -> 1
A102: 73306 | B102: 1 | D102: =MOD(INT(RC[-3]/100),10) -> 3 | E102: =VLOOKUP(RC[-1],R7C6:R10C9,4,FALSE) -> 1
A103: 74000 | B103: 50 | D103: =MOD(INT(RC[-3]/100),10) -> 0 | E103: =VLOOKUP(RC[-1],R7C6:R10C9,4,FALSE) -> 60
A104: 74100 | B104: 39 | D104: =MOD(INT(RC[-3]/100),10) -> 1 | E104: =VLOOKUP(RC[-1],R7C6:R10C9,4,FALSE) -> 34
A105: 74200 | B105: 10 | D105: =MOD(INT(RC[-3]/100),10) -> 2 | E105: =VLOOKUP(RC[-1],R7C6:R10C9,4,FALSE) -> 5
A106: 74300 | B106: 1 | D106: =MOD(INT(RC[-3]/100),10) -> 3 | E106: =VLOOKUP(RC[-1],R7C6:R10C9,4,FALSE) -> 1

Sheet: 8.高级招募库
A1: id|id | B1: |rate | C1: |rate_ex
A2: 不可空 | B2: 不可空 | C2: 不可空
A3: 数字 | B3: 数字 | C3: 数字
H5: =LCM(R[2]C:R[7]C) -> 600 | J5: =SUMPRODUCT(R[2]C:R[7]C,R[2]C[-2]:R[7]C[-2]) -> 60000
A6: 仙灵Id | B6: 召唤权值 | C6: n次必出权值 | E6: 品质 | F6: 权值 | G6: 品质 | H6: 数量 | I6: 期望几率 | J6: 转换权值
A7: 70001 | B7: 576 | C7: 0 | E7: =MOD(INT(RC[-4]/100),10) -> 0 | F7: =VLOOKUP(RC[-1],R7C7:R12C10,4,FALSE) -> 576 | G7: 0 | H7: =COUNTIF(C[-3],RC[-1]) -> 25 | I7: 24 | J7: =RC[-1]/RC[-2]*R5C8 -> 576
A8: 70002 | B8: 576 | C8: 0 | E8: =MOD(INT(RC[-4]/100),10) -> 0 | F8: =VLOOKUP(RC[-1],R7C7:R12C10,4,FALSE) -> 576 | G8: 1 | H8: =COUNTIF(C[-3],RC[-1]) -> 25 | I8: 60 | J8: =RC[-1]/RC[-2]*R5C8 -> 1440
A9: 70003 | B9: 576 | C9: 0 | E9: =MOD(INT(RC[-4]/100),10) -> 0 | F9: =VLOOKUP(RC[-1],R7C7:R12C10,4,FALSE) -> 576 | G9: 2 | H9: =COUNTIF(C[-3],RC[-1]) -> 25 | I9: 10 | J9: =RC[-1]/RC[-2]*R5C8 -> 240
A10: 70004 | B10: 576 | C10: 0 | E10: =MOD(INT(RC[-4]/100),10) -> 0 | F10: =VLOOKUP(RC[-1],R7C7:R12C10,4,FALSE) -> 576 | G10: 3 | H10: =COUNTIF(C[-3],RC[-1]) -> 25 | I10: 5 | J10: =RC[-1]/RC[-2]*R5C8 -> 120
A11: 70005 | B11: 576 | C11: 0 | E11: =MOD(INT(RC[-4]/100),10) -> 0 | F11: =VLOOKUP(RC[-1],R7C7:R12C10,4,FALSE) -> 576 | G11: 4 | H11: =COUNTIF(C[-3],RC[-1]) -> 24 | I11: 1 | J11: =RC[-1]/RC[-2]*R5C8 -> 25
A12: 70006 | B12: 576 | C12: 0 | E12: =MOD(INT(RC[-4]/100),10) -> 0 | F12: =VLOOKUP(RC[-1],R7C7:R12C10,4,FALSE) -> 576 | G12: 5 | H12: =COUNTIF(C[-3],RC[-1]) -> 24 | I12: 0 | J12: =RC[-1]/RC[-2]*R5C8 -> 0
A13: 70101 | B13: 1440 | C13: 0 | E13: =MOD(INT(RC[-4]/100),10) -> 1 | F13: =VLOOKUP(RC[-1],R7C7:R12C10,4,FALSE) -> 1440
A14: 70102 | B14: 1440 | C14: 0 | E14: =MOD(INT(RC[-4]/100),10) -> 1 | F14: =VLOOKUP(RC[-1],R7C7:R12C10,4,FALSE) -> 1440
A15: 70103 | B15: 1440 | C15: 0 | E15: =MOD(INT(RC[-4]/100),10) -> 1 | F15: =VLOOKUP(RC[-1],R7C7:R12C10,4,FALSE) -> 1440
A16: 70104 | B16: 1440 | C16: 0 | E16: =MOD(INT(RC[-4]/100),10) -> 1 | F16: =VLOOKUP(RC[-1],R7C7:R12C10,4,FALSE) -> 1440
A17: 70105 | B17: 1440 | C17: 0 | E17: =MOD(INT(RC[-4]/100),10) -> 1 | F17: =VLOOKUP(RC[-1],R7C7:R12C10,4,FALSE) -> 1440
A18: 70106 | B18: 1440 | C18: 0 | E18: =MOD(INT(RC[-4]/100),10) -> 1 | F18: =VLOOKUP(RC[-1],R7C7:R12C10,4,FALSE) -> 1440
A19: 70201 | B19: 240 | C19: 0 | E19: =MOD(INT(RC[-4]/100),10) -> 2 | F19: =VLOOKUP(RC[-1],R7C7:R12C10,4,FALSE) -> 240
A20: 70202 | B20: 240 | C20: 0 | E20: =MOD(INT(RC[-4]/100),10) -> 2 | F20: =VLOOKUP(RC[-1],R7C7:R12C10,4,FALSE) -> 240
A21: 70203 | B21: 240 | C21: 0 | E21: =MOD(INT(RC[-4]/100),10) -> 2 | F21: =VLOOKUP(RC[-1],R7C7:R12C10,4,FALSE) -> 240
A22: 70204 | B22: 240 | C22: 0 | E22: =MOD(INT(RC[-4]/100),10) -> 2 | F22: =VLOOKUP(RC[-1],R7C7:R12C10,4,FALSE) -> 240
A23: 70205 | B23: 240 | C23: 0 | E23: =MOD(INT(RC[-4]/100),10) -> 2 | F23: =VLOOKUP(RC[-1],R7C7:R12C10,4,FALSE) -> 240
A24: 70206 | B24: 240 | C24: 0 | E24: =MOD(INT(RC[-4]/100),10) -> 2 | F24: =VLOOKUP(RC[-1],R7C7:R12C10,4,FALSE) -> 240
A25: 70301 | B25: 120 | C25: 0 | E25: =MOD(INT(RC[-4]/100),10) -> 3 | F25: =VLOOKUP(RC[-1],R7C7:R12C10,4,FALSE) -> 120
A26: 70302 | B26: 120 | C26: 0 | E26: =MOD(INT(RC[-4]/100),10) -> 3 | F26: =VLOOKUP(RC[-1],R7C7:R12C10,4,FALSE) -> 120
A27: 70303 | B27: 120 | C27: 0 | E27: =MOD(INT(RC[-4]/100),10) -> 3 | F27: =VLOOKUP(RC[-1],R7C7:R12C10,4,FALSE) -> 120
A28: 70304 | B28: 120 | C28: 0 | E28: =MOD(INT(RC[-4]/100),10) -> 3 | F28: =VLOOKUP(RC[-1],R7C7:R12C10,4,FALSE) -> 120
A29: 70305 | B29: 120 | C29: 0 | E29: =MOD(INT(RC[-4]/100),10) -> 3 | F29: =VLOOKUP(RC[-1],R7C7:R12C10,4,FALSE) -> 120
A30: 70306 | B30: 120 | C30: 0 | E30: =MOD(INT(RC[-4]/100),10) -> 3 | F30: =VLOOKUP(RC[-1],R7C7:R12C10,4,FALSE) -> 120
A31: 70401 | B31: 25 | C31: 0 | E31: =MOD(INT(RC[-4]/100),10) -> 4 | F31: =VLOOKUP(RC[-1],R7C7:R12C10,4,FALSE) -> 25
A32: 70402 | B32: 25 | C32: 0 | E32: =MOD(INT(RC[-4]/100),10) -> 4 | F32: =VLOOKUP(RC[-1],R7C7:R12C10,4,FALSE) -> 25
A33: 70403 | B33: 25 | C33: 0 | E33: =MOD(INT(RC[-4]/100),10) -> 4 | F33: =VLOOKUP(RC[-1],R7C7:R12C10,4,FALSE) -> 25
A34: 70404 | B34: 25 | C34: 0 | E34: =MOD(INT(RC[-4]/100),10) -> 4 | F34: =VLOOKUP(RC[-1],R7C7:R12C10,4,FALSE) -> 25
A35: 70405 | B35: 25 | C35: 0 | E35: =MOD(INT(RC[-4]/100),10) -> 4 | F35: =VLOOKUP(RC[-1],R7C7:R12C10,4,FALSE) -> 25
A36: 70406 | B36: 25 | C36: 0 | E36: =MOD(INT(RC[-4]/100),10) -> 4 | F36: =VLOOKUP(RC[-1],R7C7:R12C10,4,FALSE) -> 25
A37: 70501 | B37: 0 | C37: 0 | E37: =MOD(INT(RC[-4]/100),10) -> 5 | F37: =VLOOKUP(RC[-1],R7C7:R12C10,4,FALSE) -> 0
A38: 70502 | B38: 0 | C38: 0 | E38: =MOD(INT(RC[-4]/100),10) -> 5 | F38: =VLOOKUP(RC[-1],R7C7:R12C10,4,FALSE) -> 0
A39: 70503 | B39: 0 | C39: 0 | E39: =MOD(INT(RC[-4]/100),10) -> 5 | F39: =VLOOKUP(RC[-1],R7C7:R12C10,4,FALSE) -> 0
A40: 70504 | B40: 0 | C40: 0 | E40: =MOD(INT(RC[-4]/100),10) -> 5 | F40: =VLOOKUP(RC[-1],R7C7:R12C10,4,FALSE) -> 0
A41: 70505 | B41: 0 | C41: 0 | E41: =MOD(INT(RC[-4]/100),10) -> 5 | F41: =VLOOKUP(RC[-1],R7C7:R12C10,4,FALSE) -> 0
A42: 70506 | B42: 0 | C42: 0 | E42: =MOD(INT(RC[-4]/100),10) -> 5 | F42: =VLOOKUP(RC[-1],R7C7:R12C10,4,FALSE) -> 0
A43: 71001 | B43: 576 | C43: 0 | E43: =MOD(INT(RC[-4]/100),10) -> 0 | F43: =VLOOKUP(RC[-1],R7C7:R12C10,4,FALSE) -> 576
A44: 71002 | B44: 576 | C44: 0 | E44: =MOD(INT(RC[-4]/100),10) -> 0 | F44: =VLOOKUP(RC[-1],R7C7:R12C10,4,FALSE) -> 576
A45: 71003 | B45: 576 | C45: 0 | E45: =MOD(INT(RC[-4]/100),10) -> 0 | F45: =VLOOKUP(RC[-1],R7C7:R12C10,4,FALSE) -> 576
A46: 71004 | B46: 576 | C46: 0 | E46: =MOD(INT(RC[-4]/100),10) -> 0 | F46: =VLOOKUP(RC[-1],R7C7:R12C10,4,FALSE) -> 576
A47: 71005 | B47: 576 | C47: 0 | E47: =MOD(INT(RC[-4]/100),10) -> 0 | F47: =VLOOKUP(RC[-1],R7C7:R12C10,4,FALSE) -> 576
A48: 71006 | B48: 576 | C48: 0 | E48: =MOD(INT(RC[-4]/100),10) -> 0 | F48: =VLOOKUP(RC[-1],R7C7:R12C10,4,FALSE) -> 576
A49: 71101 | B49: 1440 | C49: 0 | E49: =MOD(INT(RC[-4]/100),10) -> 1 | F49: =VLOOKUP(RC[-1],R7C7:R12C10,4,FALSE) -> 1440
A50: 71102 | B50: 1440 | C50: 0 | E50: =MOD(INT(RC[-4]/100),10) -> 1 | F50: =VLOOKUP(RC[-1],R7C7:R12C10,4,FALSE) -> 1440
A51: 71103 | B51: 1440 | C51: 0 | E51: =MOD(INT(RC[-4]/100),10) -> 1 | F51: =VLOOKUP(RC[-1],R7C7:R12C10,4,FALSE) -> 1440
A52: 71104 | B52: 1440 | C52: 0 | E52: =MOD(INT(RC[-4]/100),10) -> 1 | F52: =VLOOKUP(RC[-1],R7C7:R12C10,4,FALSE) -> 1440
A53: 71105 | B53: 1440 | C53: 0 | E53: =MOD(INT(RC[-4]/100),10) -> 1 | F53: =VLOOKUP(RC[-1],R7C7:R12C10,4,FALSE) -> 1440
A54: 71106 | B54: 1440 | C54: 0 | E54: =MOD(INT(RC[-4]/100),10) -> 1 | F54: =VLOOKUP(RC[-1],R7C7:R12C10,4,FALSE) -> 1440
A55: 71201 | B55: 240 | C55: 0 | E55: =MOD(INT(RC[-4]/100),10) -> 2 | F55: =VLOOKUP(RC[-1],R7C7:R12C10,4,FALSE) -> 240
A56: 71202 | B56: 240 | C56: 0 | E56: =MOD(INT(RC[-4]/100),10) -> 2 | F56: =VLOOKUP(RC[-1],R7C7:R12C10,4,FALSE) -> 240
A57: 71203 | B57: 240 | C57: 0 | E57: =MOD(INT(RC[-4]/100),10) -> 2 | F57: =VLOOKUP(RC[-1],R7C7:R12C10,4,FALSE) -> 240
A58: 71204 | B58: 240 | C58: 0 | E58: =MOD(INT(RC[-4]/100),10) -> 2 | F58: =VLOOKUP(RC[-1],R7C7:R12C10,4,FALSE) -> 240
A59: 71205 | B59: 240 | C59: 0 | E59: =MOD(INT(RC[-4]/100),10) -> 2 | F59: =VLOOKUP(RC[-1],R7C7:R12C10,4,FALSE) -> 240
A60: 71206 | B60: 240 | C60: 0 | E60: =MOD(INT(RC[-4]/100),10) -> 2 | F60: =VLOOKUP(RC[-1],R7C7:R12C10,4,FALSE) -> 240
A61: 71301 | B61: 120 | C61: 0 | E61: =MOD(INT(RC[-4]/100),10) -> 3 | F61: =VLOOKUP(RC[-1],R7C7:R12C10,4,FALSE) -> 120
A62: 71302 | B62: 120 | C62: 0 | E62: =MOD(INT(RC[-4]/100),10) -> 3 | F62: =VLOOKUP(RC[-1],R7C7:R12C10,4,FALSE) -> 120
A63: 71303 | B63: 120 | C63: 0 | E63: =MOD(INT(RC[-4]/100),10) -> 3 | F63: =VLOOKUP(RC[-1],R7C7:R12C10,4,FALSE) -> 120
A64: 71304 | B64: 120 | C64: 0 | E64: =MOD(INT(RC[-4]/100),10) -> 3 | F64: =VLOOKUP(RC[-1],R7C7:R12C10,4,FALSE) -> 120
A65: 71305 | B65: 120 | C65: 0 | E65: =MOD(INT(RC[-4]/100),10) -> 3 | F65: =VLOOKUP(RC[-1],R7C7:R12C10,4,FALSE) -> 120
A66: 71306 | B66: 120 | C66: 0 | E66: =MOD(INT(RC[-4]/100),10) -> 3 | F66: =VLOOKUP(RC[-1],R7C7:R12C10,4,FALSE) -> 120
A67: 71401 | B67: 25 | C67: 0 | E67: =MOD(INT(RC[-4]/100),10) -> 4 | F67: =VLOOKUP(RC[-1],R7C7:R12C10,4,FALSE) -> 25
A68: 71402 | B68: 25 | C68: 0 | E68: =MOD(INT(RC[-4]/100),10) -> 4 | F68: =VLOOKUP(RC[-1],R7C7:R12C10,4,FALSE) -> 25
A69: 71403 | B69: 25 | C69: 0 | E69: =MOD(INT(RC[-4]/100),10) -> 4 | F69: =VLOOKUP(RC[-1],R7C7:R12C10,4,FALSE) -> 25
A70: 71404 | B70: 25 | C70: 0 | E70: =MOD(INT(RC[-4]/100),10) -> 4 | F70: =VLOOKUP(RC[-1],R7C7:R12C10,4,FALSE) -> 25
A71: 71405 | B71: 25 | C71: 0 | E71: =MOD(INT(RC[-4]/100),10) -> 4 | F71: =VLOOKUP(RC[-1],R7C7:R12C10,4,FALSE) -> 25
A72: 71406 | B72: 25 | C72: 0 | E72: =MOD(INT(RC[-4]/100),10) -> 4 | F72: =VLOOKUP(RC[-1],R7C7:R12C10,4,FALSE) -> 25
A73: 71501 | B73: 0 | C73: 0 | E73: =MOD(INT(RC[-4]/100),10) -> 5 | F73: =VLOOKUP(RC[-1],R7C7:R12C10,4,FALSE) -> 0
A74: 71502 | B74: 0 | C74: 0 | E74: =MOD(INT(RC[-4]/100),10) -> 5 | F74: =VLOOKUP(RC[-1],R7C7:R12C10,4,FALSE) -> 0
A75: 71503 | B75: 0 | C75: 0 | E75: =MOD(INT(RC[-4]/100),10) -> 5 | F75: =VLOOKUP(RC[-1],R7C7:R12C10,4,FALSE) -> 0
A76: 71504 | B76: 0 | C76: 0 | E76: =MOD(INT(RC[-4]/100),10) -> 5 | F76: =VLOOKUP(RC[-1],R7C7:R12C10,4,FALSE) -> 0
A77: 71505 | B77: 0 | C77: 0 | E77: =MOD(INT(RC[-4]/100),10) -> 5 | F77: =VLOOKUP(RC[-1],R7C7:R12C10,4,FALSE) -> 0
A78: 71506 | B78: 0 | C78: 0 | E78: =MOD(INT(RC[-4]/100),10) -> 5 | F78: =VLOOKUP(RC[-1],R7C7:R12C10,4,FALSE) -> 0
A79: 72001 | B79: 576 | C79: 0 | E79: =MOD(INT(RC[-4]/100),10) -> 0 | F79: =VLOOKUP(RC[-1],R7C7:R12C10,4,FALSE) -> 576
A80: 72002 | B80: 576 | C80: 0 | E80: =MOD(INT(RC[-4]/100),10) -> 0 | F80: =VLOOKUP(RC[-1],R7C7:R12C10,4,FALSE) -> 576
A81: 72003 | B81: 576 | C81: 0 | E81: =MOD(INT(RC[-4]/100),10) -> 0 | F81: =VLOOKUP(RC[-1],R7C7:R12C10,4,FALSE) -> 576
A82: 72004 | B82: 576 | C82: 0 | E82: =MOD(INT(RC[-4]/100),10) -> 0 | F82: =VLOOKUP(RC[-1],R7C7:R12C10,4,FALSE) -> 576
A83: 72005 | B83: 576 | C83: 0 | E83: =MOD(INT(RC[-4]/100),10) -> 0 | F83: =VLOOKUP(RC[-1],R7C7:R12C10,4,FALSE) -> 576
A84: 72006 | B84: 576 | C84: 0 | E84: =MOD(INT(RC[-4]/100),10) -> 0 | F84: =VLOOKUP(RC[-1],R7C7:R12C10,4,FALSE) -> 576
A85: 72101 | B85: 1440 | C85: 0 | E85: =MOD(INT(RC[-4]/100),10) -> 1 | F85: =VLOOKUP(RC[-1],R7C7:R12C10,4,FALSE) -> 1440
A86: 72102 | B86: 1440 | C86: 0 | E86: =MOD(INT(RC[-4]/100),10) -> 1 | F86: =VLOOKUP(RC[-1],R7C7:R12C10,4,FALSE) -> 1440
A87: 72103 | B87: 1440 | C87: 0 | E87: =MOD(INT(RC[-4]/100),10) -> 1 | F87: =VLOOKUP(RC[-1],R7C7:R12C10,4,FALSE) -> 1440
A88: 72104 | B88: 1440 | C88: 0 | E88: =MOD(INT(RC[-4]/100),10) -> 1 | F88: =VLOOKUP(RC[-1],R7C7:R12C10,4,FALSE) -> 1440
A89: 72105 | B89: 1440 | C89: 0 | E89: =MOD(INT(RC[-4]/100),10) -> 1 | F89: =VLOOKUP(RC[-1],R7C7:R12C10,4,FALSE) -> 1440
A90: 72106 | B90: 1440 | C90: 0 | E90: =MOD(INT(RC[-4]/100),10) -> 1 | F90: =VLOOKUP(RC[-1],R7C7:R12C10,4,FALSE) -> 1440
A91: 72201 | B91: 240 | C91: 0 | E91: =MOD(INT(RC[-4]/100),10) -> 2 | F91: =VLOOKUP(RC[-1],R7C7:R12C10,4,FALSE) -> 240
A92: 72202 | B92: 240 | C92: 0 | E92: =MOD(INT(RC[-4]/100),10) -> 2 | F92: =VLOOKUP(RC[-1],R7C7:R12C10,4,FALSE) -> 240
A93: 72203 | B93: 240 | C93: 0 | E93: =MOD(INT(RC[-4]/100),10) -> 2 | F93: =VLOOKUP(RC[-1],R7C7:R12C10,4,FALSE) -> 240
A94: 72204 | B94: 240 | C94: 0 | E94: =MOD(INT(RC[-4]/100),10) -> 2 | F94: =VLOOKUP(RC[-1],R7C7:R12C10,4,FALSE) -> 240
A95: 72205 | B95: 240 | C95: 0 | E95: =MOD(INT(RC[-4]/100),10) -> 2 | F95: =VLOOKUP(RC[-1],R7C7:R12C10,4,FALSE) -> 240
A96: 72206 | B96: 240 | C96: 0 | E96: =MOD(INT(RC[-4]/100),10) -> 2 | F96: =VLOOKUP(RC[-1],R7C7:R12C10,4,FALSE) -> 240
A97: 72301 | B97: 120 | C97: 0 | E97: =MOD(INT(RC[-4]/100),10) -> 3 | F97: =VLOOKUP(RC[-1],R7C7:R12C10,4,FALSE) -> 120
A98: 72302 | B98: 120 | C98: 0 | E98: =MOD(INT(RC[-4]/100),10) -> 3 | F98: =VLOOKUP(RC[-1],R7C7:R12C10,4,FALSE) -> 120
A99: 72303 | B99: 120 | C99: 0 | E99: =MOD(INT(RC[-4]/100),10) -> 3 | F99: =VLOOKUP(RC[-1],R7C7:R12C10,4,FALSE) -> 120
A100: 72304 | B100: 120 | C100: 0 | E100: =MOD(INT(RC[-4]/100),10) -> 3 | F100: =VLOOKUP(RC[-1],R7C7:R12C10,4,FALSE) -> 120
A101: 72305 | B101: 120 | C101: 0 | E101: =MOD(INT(RC[-4]/100),10) -> 3 | F101: =VLOOKUP(RC[-1],R7C7:R12C10,4,FALSE) -> 120
A102: 72306 | B102: 120 | C102: 0 | E102: =MOD(INT(RC[-4]/100),10) -> 3 | F102: =VLOOKUP(RC[-1],R7C7:R12C10,4,FALSE) -> 120
A103: 72401 | B103: 25 | C103: 0 | E103: =MOD(INT(RC[-4]/100),10) -> 4 | F103: =VLOOKUP(RC[-1],R7C7:R12C10,4,FALSE) -> 25
A104: 72402 | B104: 25 | C104: 0 | E104: =MOD(INT(RC[-4]/100),10) -> 4 | F104: =VLOOKUP(RC[-1],R7C7:R12C10,4,FALSE) -> 25
A105: 72403 | B105: 25 | C105: 0 | E105: =MOD(INT(RC[-4]/100),10) -> 4 | F105: =VLOOKUP(RC[-1],R7C7:R12C10,4,FALSE) -> 25
A106: 72404 | B106: 25 | C106: 0 | E106: =MOD(INT(RC[-4]/100),10) -> 4 | F106: =VLOOKUP(RC[-1],R7C7:R12C10,4,FALSE) -> 25
A107: 72405 | B107: 25 | C107: 0 | E107: =MOD(INT(RC[-4]/100),10) -> 4 | F107: =VLOOKUP(RC[-1],R7C7:R12C10,4,FALSE) -> 25
A108: 72406 | B108: 25 | C108: 0 | E108: =MOD(INT(RC[-4]/100),10) -> 4 | F108: =VLOOKUP(RC[-1],R7C7:R12C10,4,FALSE) -> 25
A109: 72501 | B109: 0 | C109: 0 | E109: =MOD(INT(RC[-4]/100),10) -> 5 | F109: =VLOOKUP(RC[-1],R7C7:R12C10,4,FALSE) -> 0
A110: 72502 | B110: 0 | C110: 0 | E110: =MOD(INT(RC[-4]/100),10) -> 5 | F110: =VLOOKUP(RC[-1],R7C7:R12C10,4,FALSE) -> 0
A111: 72503 | B111: 0 | C111: 0 | E111: =MOD(INT(RC[-4]/100),10) -> 5 | F111: =VLOOKUP(RC[-1],R7C7:R12C10,4,FALSE) -> 0
A112: 72504 | B112: 0 | C112: 0 | E112: =MOD(INT(RC[-4]/100),10) -> 5 | F112: =VLOOKUP(RC[-1],R7C7:R12C10,4,FALSE) -> 0
A113: 72505 | B113: 0 | C113: 0 | E113: =MOD(INT(RC[-4]/100),10) -> 5 | F113: =VLOOKUP(RC[-1],R7C7:R12C10,4,FALSE) -> 0
A114: 72506 | B114: 0 | C114: 0 | E114: =MOD(INT(RC[-4]/100),10) -> 5 | F114: =VLOOKUP(RC[-1],R7C7:R12C10,4,FALSE) -> 0
A115: 73001 | B115: 576 | C115: 0 | E115: =MOD(INT(RC[-4]/100),10) -> 0 | F115: =VLOOKUP(RC[-1],R7C7:R12C10,4,FALSE) -> 576
A116: 73002 | B116: 576 | C116: 0 | E116: =MOD(INT(RC[-4]/100),10) -> 0 | F116: =VLOOKUP(RC[-1],R7C7:R12C10,4,FALSE) -> 576
A117: 73003 | B117: 576 | C117: 0 | E117: =MOD(INT(RC[-4]/100),10) -> 0 | F117: =VLOOKUP(RC[-1],R7C7:R12C10,4,FALSE) -> 576
A118: 73004 | B118: 576 | C118: 0 | E118: =MOD(INT(RC[-4]/100),10) -> 0 | F118: =VLOOKUP(RC[-1],R7C7:R12C10,4,FALSE) -> 576
A119: 73005 | B119: 576 | C119: 0 | E119: =MOD(INT(RC[-4]/100),10) -> 0 | F119: =VLOOKUP(RC[-1],R7C7:R12C10,4,FALSE) -> 576
A120: 73006 | B120: 576 | C120: 0 | E120: =MOD(INT(RC[-4]/100),10) -> 0 | F120: =VLOOKUP(RC[-1],R7C7:R12C10,4,FALSE) -> 576
A121: 73101 | B121: 1440 | C121: 0 | E121: =MOD(INT(RC[-4]/100),10) -> 1 | F121: =VLOOKUP(RC[-1],R7C7:R12C10,4,FALSE) -> 1440
A122: 73102 | B122: 1440 | C122: 0 | E122: =MOD(INT(RC[-4]/100),10) -> 1 | F122: =VLOOKUP(RC[-1],R7C7:R12C10,4,FALSE) -> 1440
A123: 73103 | B123: 1440 | C123: 0 | E123: =MOD(INT(RC[-4]/100),10) -> 1 | F123: =VLOOKUP(RC[-1],R7C7:R12C10,4,FALSE) -> 1440
A124: 73104 | B124: 1440 | C124: 0 | E124: =MOD(INT(RC[-4]/100),10) -> 1 | F124: =VLOOKUP(RC[-1],R7C7:R12C10,4,FALSE) -> 1440
A125: 73105 | B125: 1440 | C125: 0 | E125: =MOD(INT(RC[-4]/100),10) -> 1 | F125: =VLOOKUP(RC[-1],R7C7:R12C10,4,FALSE) -> 1440
A126: 73106 | B126: 1440 | C126: 0 | E126: =MOD(INT(RC[-4]/100),10) -> 1 | F126: =VLOOKUP(RC[-1],R7C7:R12C10,4,FALSE) -> 1440
A127: 73201 | B127: 240 | C127: 0 | E127: =MOD(INT(RC[-4]/100),10) -> 2 | F127: =VLOOKUP(RC[-1],R7C7:R12C10,4,FALSE) -> 240
A128: 73202 | B128: 240 | C128: 0 | E128: =MOD(INT(RC[-4]/100),10) -> 2 | F128: =VLOOKUP(RC[-1],R7C7:R12C10,4,FALSE) -> 240
A129: 73203 | B129: 240 | C129: 0 | E129: =MOD(INT(RC[-4]/100),10) -> 2 | F129: =VLOOKUP(RC[-1],R7C7:R12C10,4,FALSE) -> 240
A130: 73204 | B130: 240 | C130: 0 | E130: =MOD(INT(RC[-4]/100),10) -> 2 | F130: =VLOOKUP(RC[-1],R7C7:R12C10,4,FALSE) -> 240
A131: 73205 | B131: 240 | C131: 0 | E131: =MOD(INT(RC[-4]/100),10) -> 2 | F131: =VLOOKUP(RC[-1],R7C7:R12C10,4,FALSE) -> 240
A132: 73206 | B132: 240 | C132: 0 | E132: =MOD(INT(RC[-4]/100),10) -> 2 | F132: =VLOOKUP(RC[-1],R7C7:R12C10,4,FALSE) -> 240
A133: 73301 | B133: 120 | C133: 0 | E133: =MOD(INT(RC[-4]/100),10) -> 3 | F133: =VLOOKUP(RC[-1],R7C7:R12C10,4,FALSE) -> 120
A134: 73302 | B134: 120 | C134: 0 | E134: =MOD(INT(RC[-4]/100),10) -> 3 | F134: =VLOOKUP(RC[-1],R7C7:R12C10,4,FALSE) -> 120
A135: 73303 | B135: 120 | C135: 0 | E135: =MOD(INT(RC[-4]/100),10) -> 3 | F135: =VLOOKUP(RC[-1],R7C7:R12C10,4,FALSE) -> 120
A136: 73304 | B136: 120 | C136: 0 | E136: =MOD(INT(RC[-4]/100),10) -> 3 | F136: =VLOOKUP(RC[-1],R7C7:R12C10,4,FALSE) -> 120
A137: 73305 | B137: 120 | C137: 0 | E137: =MOD(INT(RC[-4]/100),10) -> 3 | F137: =VLOOKUP(RC[-1],R7C7:R12C10,4,FALSE) -> 120
A138: 73306 | B138: 120 | C138: 0 | E138: =MOD(INT(RC[-4]/100),10) -> 3 | F138: =VLOOKUP(RC[-1],R7C7:R12C10,4,FALSE) -> 120
A139: 73401 | B139: 25 | C139: 0 | E139: =MOD(INT(RC[-4]/100),10) -> 4 | F139: =VLOOKUP(RC[-1],R7C7:R12C10,4,FALSE) -> 25
A140: 73402 | B140: 25 | C140: 0 | E140: =MOD(INT(RC[-4]/100),10) -> 4 | F140: =VLOOKUP(RC[-1],R7C7:R12C10,4,FALSE) -> 25
A141: 73403 | B141: 25 | C141: 0 | E141: =MOD(INT(RC[-4]/100),10) -> 4 | F141: =VLOOKUP(RC[-1],R7C7:R12C10,4,FALSE) -> 25
A142: 73404 | B142: 25 | C142: 0 | E142: =MOD(INT(RC[-4]/100),10) -> 4 | F142: =VLOOKUP(RC[-1],R7C7:R12C10,4,FALSE) -> 25
A143: 73405 | B143: 25 | C143: 0 | E143: =MOD(INT(RC[-4]/100),10) -> 4 | F143: =VLOOKUP(RC[-1],R7C7:R12C10,4,FALSE) -> 25
A144: 73406 | B144: 25 | C144: 0 | E144: =MOD(INT(RC[-4]/100),10) -> 4 | F144: =VLOOKUP(RC[-1],R7C7:R12C10,4,FALSE) -> 25
A145: 73501 | B145: 0 | C145: 0 | E145: =MOD(INT(RC[-4]/100),10) -> 5 | F145: =VLOOKUP(RC[-1],R7C7:R12C10,4,FALSE) -> 0
A146: 73502 | B146: 0 | C146: 0 | E146: =MOD(INT(RC[-4]/100),10) -> 5 | F146: =VLOOKUP(RC[-1],R7C7:R12C10,4,FALSE) -> 0
A147: 73503 | B147: 0 | C147: 0 | E147: =MOD(INT(RC[-4]/100),10) -> 5 | F147: =VLOOKUP(RC[-1],R7C7:R12C10,4,FALSE) -> 0
A148: 73504 | B148: 0 | C148: 0 | E148: =MOD(INT(RC[-4]/100),10) -> 5 | F148: =VLOOKUP(RC[-1],R7C7:R12C10,4,FALSE) -> 0
A149: 73505 | B149: 0 | C149: 0 | E149: =MOD(INT(RC[-4]/100),10) -> 5 | F149: =VLOOKUP(RC[-1],R7C7:R12C10,4,FALSE) -> 0
A150: 73506 | B150: 0 | C150: 0 | E150: =MOD(INT(RC[-4]/100),10) -> 5 | F150: =VLOOKUP(RC[-1],R7C7:R12C10,4,FALSE) -> 0
A151: 74000 | B151: 576 | C151: 0 | E151: =MOD(INT(RC[-4]/100),10) -> 0 | F151: =VLOOKUP(RC[-1],R7C7:R12C10,4,FALSE) -> 576
A152: 74100 | B152: 1440 | C152: 0 | E152: =MOD(INT(RC[-4]/100),10) -> 1 | F152: =VLOOKUP(RC[-1],R7C7:R12C10,4,FALSE) -> 1440
A153: 74200 | B153: 240 | C153: 0 | E153: =MOD(INT(RC[-4]/100),10) -> 2 | F153: =VLOOKUP(RC[-1],R7C7:R12C10,4,FALSE) -> 240
A154: 74300 | B154: 120 | C154: 0 | E154: =MOD(INT(RC[-4]/100),10) -> 3 | F154: =VLOOKUP(RC[-1],R7C7:R12C10,4,FALSE) -> 120

Sheet: 9.图鉴成就
A1: level|level | B1: need_pokedex_value|need_pokedex_value | C1: pro_type_list|pro_type_list | D1: pro_value_list|pro_value_list
A2: 不可空 | B2: 不可空 | C2: 不可空 | D2: 不可空
A3: 数字 | B3: 数字 | C3: 一维数组 | D3: 一维数组
C4: 不定长 | D4: 不定长
A6: 成就等级 | B6: 需要的图鉴值(0=表示已达上限) | C6: 添加的属性类型列表 | D6: 添加的基础属性值列表
A7: 0 | B7: 0 | C7: 0 | D7: 0
A8: 1 | B8: 25 | C8: 7|5 | D8: 100|100
A9: 2 | B9: 50 | C9: 7|5 | D9: 200|200
A10: 3 | B10: 75 | C10: 7|5 | D10: 300|300
A11: 4 | B11: 100 | C11: 7|5 | D11: 400|400
A12: 5 | B12: 125 | C12: 7|5 | D12: 500|500
A13: 6 | B13: 150 | C13: 7|5 | D13: 600|600
A14: 7 | B14: 175 | C14: 7|5 | D14: 700|700
A15: 8 | B15: 200 | C15: 7|5 | D15: 800|800
A16: 9 | B16: 250 | C16: 7|5 | D16: 900|900
A17: 10 | B17: 300 | C17: 7|5 | D17: 1000|1000
A18: 11 | B18: 350 | C18: 7|5 | D18: 1100|1100
A19: 12 | B19: 400 | C19: 7|5 | D19: 1200|1200
A20: 13 | B20: 450 | C20: 7|5 | D20: 1300|1300
A21: 14 | B21: 500 | C21: 7|5 | D21: 1400|1400
A22: 15 | B22: 550 | C22: 7|5 | D22: 1500|1500
A23: 16 | B23: 600 | C23: 7|5 | D23: 1600|1600
A24: 17 | B24: 650 | C24: 7|5 | D24: 1700|1700
A25: 18 | B25: 700 | C25: 7|5 | D25: 1800|1800
A26: 19 | B26: 750 | C26: 7|5 | D26: 1900|1900
A27: 20 | B27: 800 | C27: 7|5 | D27: 2000|2000

Sheet: Sheet1
A2: 编号 | B2: 主属性类型 | D2: 属性类型 | F2: 编号 | G2: 副属性类型 | I2: 属性类型 | K2: 编号 | L2: 品质
A3: 0 | B3: 攻击 | C3: 尖锐 | D3: 1 | F3: 0 | G3: 经验 | H3: 鱼 | I3: 0 | K3: 0 | L3: 白品
A4: 1 | B4: 物防 | C4: 圆润 | D4: 2 | F4: 1 | G4: 命中率 | H4: 鹰眼 | I4: 11 | K4: 1 | L4: 绿品
A5: 2 | B5: 法防 | C5: 丰满 | D5: 3 | F5: 2 | G5: 闪避率 | H5: 灵巧 | I5: 12 | K5: 2 | L5: 蓝品
A6: 3 | B6: 血量 | C6: 厚实 | D6: 4 | F6: 3 | G6: 暴击率 | H6: 会心 | I6: 13 | K6: 3 | L6: 紫品
A7: 4 | B7: 经验 | C7: 经验 | D7: 0 | F7: 4 | G7: 抗暴率 | H7: 坚韧 | I7: 14 | K7: 4 | L7: 橙品
F8: 5 | G8: 伤害加成 | H8: 要害 | I8: 7 | K8: 5 | L8: 红品
F9: 6 | G9: 伤害减免 | H9: 护盾 | I9: 5