Sheet: 配置
A1: 服务端文件名 | B1: 服务端对应工作表号 | C1: 客户端文件名 | D1: 客户端对应工作表号 | E1: erl头部 | F1: erl内容格式 | G1: erl尾部 | H1: 客户端特殊处理
A2: config_card.txt | B2: 1 | C2: config_card.cnf|Card | D2: 1 | F2: get(id) -> #$ | H2: 2=>id
A3: config_card_level_up.txt | B3: 2 | C3: config_card_level_up.cnf|CardLevelUp | D3: 2 | F3: get(id) -> #$ | H3: 1=>quality,level|level_list
A4: config_card_break.txt | B4: 3 | C4: config_card_break.cnf|CardBreak | D4: 3 | F4: get(id) -> #$ | H4: 1=>quality,break_level|break_level_list
A5: config_low_card_group.txt | B5: 4 | C5: config_low_card_group.cnf|LowCardGroup | D5: 4 | F5: get(id) -> #$ | H5: 1=>group_id,card_id|card_group_list
A6: config_high_card_group.txt | B6: 5 | C6: config_high_card_group.cnf|HighCardGroup | D6: 5 | F6: get(id) -> #$ | H6: 2=>card_id
A7: config_card_group_map.txt | B7: 6 | C7: config_card_group_map.cnf|CardGroupMap | D7: 6 | F7: get(id) -> #$ | H7: 2=>map_idx
A8: config_destiny_shop.txt | B8: 7 | C8: config_destiny_shop.cnf|DestinyShop | D8: 7 | F8: get(id) -> #$ | H8: 2=>id
A9: config_card_slot.txt | B9: 8 | C9: config_divination_hole.cnf|DivinationHole | D9: 8 | F9: get(id) -> #$ | H9: 2=>hole
A10: config_collection_book.txt | B10: 9 | C10: config_collection_book.cnf|CollectionBook | D10: 9 | F10: get(id) -> #$ | H10: 2=>id
A11: config_collection_group.txt | B11: 10 | C11: config_collection_group.cnf|CollectionGroup | D11: 10 | F11: get(id) -> #$ | H11: 2=>id
C12: config_collection_info.cnf|CollectionInfo | D12: 11 | F12: get(id) -> #$ | H12: 2=>card_group_id
A13: config_star_soul_shop_slot.txt | B13: 12 | F13: get(id) -> #$
A14: config_star_soul_shop.txt | B14: 13 | C14: config_star_soul_shop.cnf|StarSoulShop | D14: 13 | F14: get(goods_id) -> #$ | H14: 2=>goods_id
A15: config_zhanbu_achievement.txt | B15: 14 | C15: config_zhanbu_achievement.cnf|ZhanBuAchievement | D15: 14 | F15: get(level) -> #$ | H15: 2=>level
C16: config_card_handbook.cnf|CardHandBook | D16: 15 | F16: get(index) -> #$ | H16: 2=>index

Sheet: 1.卡牌
A1: id|id | B1: name| | C1: bigicon| | D1: icon| | E1: type|type | F1: type2| | G1: level_max|level_max | H1: quality|quality | I1: is_can_decompose|is_can_decompose | J1: to_exp|to_exp | K1: reset_cost_diamond|reset_cost_diamond | L1: |decompose_return_star_soul | M1: base_pro_type_list|base_pro_type_list | N1: base_pro_value_list|base_pro_value_list | O1: level_up_pro_type_list|level_up_pro_type_list | P1: level_up_pro_value_list|level_up_pro_value_list | Q1: break_pro_type_list|break_pro_type_list | R1: break_pro_value_list|break_pro_value_list | S1: description| | T1: systemid|
A2: 不可空 | B2: 不可空 | C2: 不可空 | D2: 不可空 | E2: 不可空 | F2: 不可空 | G2: 不可空 | H2: 不可空 | I2: 不可空 | J2: 不可空 | K2: 不可空 | L2: 不可空 | M2: 不可空 | N2: 不可空 | O2: 不可空 | P2: 不可空 | Q2: 不可空 | R2: 不可空 | S2: 不可空 | T2: 可空#不需字段
A3: 数字 | B3: 字符串 | C3: 数字 | D3: 数字 | E3: 数字 | F3: 数字 | G3: 数字 | H3: 数字 | I3: 数字 | J3: 数字 | K3: 数字 | L3: 数字 | M3: 一维数组 | N3: 一维数组 | O3: 一维数组 | P3: 一维数组 | Q3: 一维数组 | R3: 一维数组 | S3: 字符串 | T3: 一维数组
M4: 不定长 | N4: 不定长 | O4: 不定长 | P4: 不定长 | Q4: 不定长 | R4: 不定长 | T4: 不定长
A6: 将灵ID | B6: 名称 | C6: 卡面 | D6: 图标 | E6: 类型 | F6: 类型2 | G6: 等级上限 | H6: 品质 | I6: 是否可以分解 | J6: 作为升级材料获得的经验 | K6: 重生消耗钻石 | L6: 分解返还的星魂 | M6: 基础属性类型列表 | N6: 基础属性值列表 | O6: 升级属性类型列表 | P6: 升级属性值列表 | Q6: 突破属性类型列表 | R6: 突破属性值列表 | S6: 描述 | T6: 整装获取途径
A7: 70000 | B7: 愚者的起点 | C7: =MID(RC[-2],1,2)*1000+MID(RC[-2],4,2) -> 70000 | D7: 70000 | E7: =MOD(RC[-4],100) -> 0 | F7: 0 | G7: 1 | H7: =INT(MOD(RC[-7],1000)/100) -> 0 | I7: 0 | J7: 100 | K7: 50 | L7: 1 | M7: 0 | N7: 0 | O7: 0 | P7: 0 | Q7: 0 | R7: 0 | S7: 这是踏出的第一步，万物的起点。 | T7: 117|116|113
A8: 70022 | B8: 基础权杖 | C8: =MID(RC[-2],1,2)*1000+MID(RC[-2],4,2) -> 70022 | D8: 70022 | E8: =MOD(RC[-4],100) -> 22 | F8: 3 | G8: 100 | H8: =INT(MOD(RC[-7],1000)/100) -> 0 | I8: 0 | J8: 50 | K8: 50 | L8: 1 | M8: 2 | N8: 60 | O8: 2 | P8: 3 | Q8: 2 | R8: 20 | S8: 有力量与勇气，去着手于新的未来，并如此渴求着。 | T8: 117|116|113
A9: 70023 | B9: 基础圣杯 | C9: =MID(RC[-2],1,2)*1000+MID(RC[-2],4,2) -> 70023 | D9: 70023 | E9: =MOD(RC[-4],100) -> 23 | F9: 2 | G9: 100 | H9: =INT(MOD(RC[-7],1000)/100) -> 0 | I9: 0 | J9: 50 | K9: 50 | L9: 1 | M9: 3 | N9: 60 | O9: 3 | P9: 3 | Q9: 3 | R9: 20 | S9: 快乐、爱和喜悦，它们将赋予你满足，而你将敞开心扉。 | T9: 117|116|113
A10: 70024 | B10: 基础宝剑 | C10: =MID(RC[-2],1,2)*1000+MID(RC[-2],4,2) -> 70024 | D10: 70024 | E10: =MOD(RC[-4],100) -> 24 | F10: 1 | G10: 100 | H10: =INT(MOD(RC[-7],1000)/100) -> 0 | I10: 0 | J10: 50 | K10: 50 | L10: 1 | M10: 1 | N10: 60 | O10: 1 | P10: 3 | Q10: 1 | R10: 20 | S10: 所有的冒险起源于思索与勇气，你必须去贯穿这个世界。 | T10: 117|116|113
A11: 70025 | B11: 基础星币 | C11: =MID(RC[-2],1,2)*1000+MID(RC[-2],4,2) -> 70025 | D11: 70025 | E11: =MOD(RC[-4],100) -> 25 | F11: 4 | G11: 100 | H11: =INT(MOD(RC[-7],1000)/100) -> 0 | I11: 0 | J11: 50 | K11: 50 | L11: 1 | M11: 4 | N11: 600 | O11: 4 | P11: 30 | Q11: 4 | R11: 200 | S11: 前往未来的坦途已经展开，现在，踏上这新的阶梯。 | T11: 117|116|113
A12: 70100 | B12: 愚者的行囊 | C12: =MID(RC[-2],1,2)*1000+MID(RC[-2],4,2) -> 70000 | D12: 70000 | E12: =MOD(RC[-4],100) -> 0 | F12: 0 | G12: 1 | H12: =INT(MOD(RC[-7],1000)/100) -> 1 | I12: 0 | J12: 200 | K12: 50 | L12: 1 | M12: 0 | N12: 0 | O12: 0 | P12: 0 | Q12: 0 | R12: 0 | S12: 这是踏出的第一步，万物的起点。 | T12: 117|116|113
A13: 70122 | B13: 权杖·高举 | C13: =MID(RC[-2],1,2)*1000+MID(RC[-2],4,2) -> 70022 | D13: 70022 | E13: =MOD(RC[-4],100) -> 22 | F13: 3 | G13: 100 | H13: =INT(MOD(RC[-7],1000)/100) -> 1 | I13: 0 | J13: 100 | K13: 50 | L13: 1 | M13: 2 | N13: 120 | O13: 2 | P13: 6 | Q13: 2 | R13: 40 | S13: 有力量与勇气，去着手于新的未来，并如此渴求着。 | T13: 117|116|113
A14: 70123 | B14: 圣杯·银 | C14: =MID(RC[-2],1,2)*1000+MID(RC[-2],4,2) -> 70023 | D14: 70023 | E14: =MOD(RC[-4],100) -> 23 | F14: 2 | G14: 100 | H14: =INT(MOD(RC[-7],1000)/100) -> 1 | I14: 0 | J14: 100 | K14: 50 | L14: 1 | M14: 3 | N14: 120 | O14: 3 | P14: 6 | Q14: 3 | R14: 40 | S14: 快乐、爱和喜悦，它们将赋予你满足，而你将敞开心扉。 | T14: 117|116|113
A15: 70124 | B15: 宝剑·锋利 | C15: =MID(RC[-2],1,2)*1000+MID(RC[-2],4,2) -> 70024 | D15: 70024 | E15: =MOD(RC[-4],100) -> 24 | F15: 1 | G15: 100 | H15: =INT(MOD(RC[-7],1000)/100) -> 1 | I15: 0 | J15: 100 | K15: 50 | L15: 1 | M15: 1 | N15: 120 | O15: 1 | P15: 6 | Q15: 1 | R15: 40 | S15: 所有的冒险起源于你的思索与勇气，你必须去贯穿这个世界。 | T15: 117|116|113
A16: 70125 | B16: 星币·静止 | C16: =MID(RC[-2],1,2)*1000+MID(RC[-2],4,2) -> 70025 | D16: 70025 | E16: =MOD(RC[-4],100) -> 25 | F16: 4 | G16: 100 | H16: =INT(MOD(RC[-7],1000)/100) -> 1 | I16: 0 | J16: 100 | K16: 50 | L16: 1 | M16: 4 | N16: 1200 | O16: 4 | P16: 60 | Q16: 4 | R16: 400 | S16: 前往未来的坦途已经展开，现在，踏上这新的阶梯。 | T16: 117|116|113
A17: 70200 | B17: 愚者的迈步 | C17: =MID(RC[-2],1,2)*1000+MID(RC[-2],4,2) -> 70000 | D17: 70000 | E17: =MOD(RC[-4],100) -> 0 | F17: 0 | G17: 1 | H17: =INT(MOD(RC[-7],1000)/100) -> 2 | I17: 0 | J17: 400 | K17: 50 | L17: 1 | M17: 0 | N17: 0 | O17: 0 | P17: 0 | Q17: 0 | R17: 0 | S17: 无拘无束地迈开步子，走自己的路让别人说去吧。 | T17: 117|116|113
A18: 70201 | B18: 魔术师·技巧 | C18: =MID(RC[-2],1,2)*1000+MID(RC[-2],4,2) -> 70001 | D18: 70001 | E18: =MOD(RC[-4],100) -> 1 | F18: 2 | G18: 100 | H18: =INT(MOD(RC[-7],1000)/100) -> 2 | I18: 1 | J18: 300 | K18: 50 | L18: 30 | M18: 3|8 | N18: 180|300 | O18: 3 | P18: 9 | Q18: 3|8 | R18: 60|50 | S18: 智慧没有尽头，所有神奇的技巧皆是其所映衬。 | T18: 117|116|113
A19: 70202 | B19: 女祭司·祈祷 | C19: =MID(RC[-2],1,2)*1000+MID(RC[-2],4,2) -> 70002 | D19: 70002 | E19: =MOD(RC[-4],100) -> 2 | F19: 4 | G19: 100 | H19: =INT(MOD(RC[-7],1000)/100) -> 2 | I19: 1 | J19: 300 | K19: 50 | L19: 30 | M19: 4|25 | N19: 1800|300 | O19: 4 | P19: 90 | Q19: 4|25 | R19: 600|50 | S19: 祈祷并非祈求帮助，而是自我探索的沉思。 | T19: 117|116|113
A20: 70203 | B20: 女皇·优越 | C20: =MID(RC[-2],1,2)*1000+MID(RC[-2],4,2) -> 70003 | D20: 70003 | E20: =MOD(RC[-4],100) -> 3 | F20: 2 | G20: 100 | H20: =INT(MOD(RC[-7],1000)/100) -> 2 | I20: 1 | J20: 300 | K20: 50 | L20: 30 | M20: 3|24 | N20: 180|300 | O20: 3 | P20: 9 | Q20: 3|24 | R20: 60|50 | S20: 你将在这路上更加顺利地获得成功。 | T20: 117|116|113
A21: 70204 | B21: 皇帝·狮子 | C21: =MID(RC[-2],1,2)*1000+MID(RC[-2],4,2) -> 70004 | D21: 70004 | E21: =MOD(RC[-4],100) -> 4 | F21: 3 | G21: 100 | H21: =INT(MOD(RC[-7],1000)/100) -> 2 | I21: 1 | J21: 300 | K21: 50 | L21: 30 | M21: 2|23 | N21: 180|300 | O21: 2 | P21: 9 | Q21: 2|23 | R21: 60|50 | S21: 皇帝时刻准备着应对挑战，如同雄狮捍卫自己的一切。 | T21: 117|116|113
A22: 70205 | B22: 教皇·救助 | C22: =MID(RC[-2],1,2)*1000+MID(RC[-2],4,2) -> 70005 | D22: 70005 | E22: =MOD(RC[-4],100) -> 5 | F22: 4 | G22: 100 | H22: =INT(MOD(RC[-7],1000)/100) -> 2 | I22: 1 | J22: 300 | K22: 50 | L22: 30 | M22: 4|6 | N22: 1800|300 | O22: 4 | P22: 90 | Q22: 4|6 | R22: 600|50 | S22: 给予其方向，只要其遵循，便可得救。 | T22: 117|116|113
A23: 70206 | B23: 恋人·选择 | C23: =MID(RC[-2],1,2)*1000+MID(RC[-2],4,2) -> 70006 | D23: 70006 | E23: =MOD(RC[-4],100) -> 6 | F23: 3 | G23: 100 | H23: =INT(MOD(RC[-7],1000)/100) -> 2 | I23: 1 | J23: 300 | K23: 50 | L23: 30 | M23: 2|17 | N23: 180|300 | O23: 2 | P23: 9 | Q23: 2|17 | R23: 60|50 | S23: 人生总是充满选择的，却是须得这么做的。 | T23: 117|116|113
A24: 70207 | B24: 战车·驰骋 | C24: =MID(RC[-2],1,2)*1000+MID(RC[-2],4,2) -> 70007 | D24: 70007 | E24: =MOD(RC[-4],100) -> 7 | F24: 4 | G24: 100 | H24: =INT(MOD(RC[-7],1000)/100) -> 2 | I24: 1 | J24: 300 | K24: 50 | L24: 30 | M24: 4|26 | N24: 1800|6 | O24: 4 | P24: 90 | Q24: 4|26 | R24: 600|1 | S24: 你必须控制自己的本能，并以此驰骋于大地。 | T24: 117|116|113
A25: 70208 | B25: 力量·恐惧 | C25: =MID(RC[-2],1,2)*1000+MID(RC[-2],4,2) -> 70008 | D25: 70008 | E25: =MOD(RC[-4],100) -> 8 | F25: 1 | G25: 100 | H25: =INT(MOD(RC[-7],1000)/100) -> 2 | I25: 1 | J25: 300 | K25: 50 | L25: 30 | M25: 1|22 | N25: 180|300 | O25: 1 | P25: 9 | Q25: 1|22 | R25: 60|50 | S25: 彰显力量只是在隐藏你的恐惧。 | T25: 117|116|113
A26: 70209 | B26: 隐者·沉默 | C26: =MID(RC[-2],1,2)*1000+MID(RC[-2],4,2) -> 70009 | D26: 70009 | E26: =MOD(RC[-4],100) -> 9 | F26: 3 | G26: 100 | H26: =INT(MOD(RC[-7],1000)/100) -> 2 | I26: 1 | J26: 300 | K26: 50 | L26: 30 | M26: 2|12 | N26: 180|300 | O26: 2 | P26: 9 | Q26: 2|12 | R26: 60|50 | S26: 你的心智必须保持寂静，才能听见内心的声音。 | T26: 117|116|113
A27: 70210 | B27: 命运之轮·启 | C27: =MID(RC[-2],1,2)*1000+MID(RC[-2],4,2) -> 70010 | D27: 70010 | E27: =MOD(RC[-4],100) -> 10 | F27: 4 | G27: 100 | H27: =INT(MOD(RC[-7],1000)/100) -> 2 | I27: 1 | J27: 300 | K27: 50 | L27: 30 | M27: 4|18 | N27: 1800|300 | O27: 4 | P27: 90 | Q27: 4|18 | R27: 600|50 | S27: 已经启动的轮转，再难阻拦。 | T27: 117|116|113
A28: 70211 | B28: 正义·执行 | C28: =MID(RC[-2],1,2)*1000+MID(RC[-2],4,2) -> 70011 | D28: 70011 | E28: =MOD(RC[-4],100) -> 11 | F28: 1 | G28: 100 | H28: =INT(MOD(RC[-7],1000)/100) -> 2 | I28: 1 | J28: 300 | K28: 50 | L28: 30 | M28: 1|11 | N28: 180|300 | O28: 1 | P28: 9 | Q28: 1|11 | R28: 60|50 | S28: 将其处理，付起应付的责任。 | T28: 117|116|113
A29: 70212 | B29: 倒吊人·沉着 | C29: =MID(RC[-2],1,2)*1000+MID(RC[-2],4,2) -> 70012 | D29: 70012 | E29: =MOD(RC[-4],100) -> 12 | F29: 1 | G29: 100 | H29: =INT(MOD(RC[-7],1000)/100) -> 2 | I29: 1 | J29: 300 | K29: 50 | L29: 30 | M29: 1|9 | N29: 180|300 | O29: 1 | P29: 9 | Q29: 1|9 | R29: 60|50 | S29: 时机未到，沉着使你思绪清晰。 | T29: 117|116|113
A30: 70213 | B30: 死神·收割 | C30: =MID(RC[-2],1,2)*1000+MID(RC[-2],4,2) -> 70013 | D30: 70013 | E30: =MOD(RC[-4],100) -> 13 | F30: 1 | G30: 100 | H30: =INT(MOD(RC[-7],1000)/100) -> 2 | I30: 1 | J30: 300 | K30: 50 | L30: 30 | M30: 1|7 | N30: 180|300 | O30: 1 | P30: 9 | Q30: 1|7 | R30: 60|50 | S30: 有人已经倒下，也有人在做无谓的反抗。 | T30: 117|116|113
A31: 70214 | B31: 节制·平静 | C31: =MID(RC[-2],1,2)*1000+MID(RC[-2],4,2) -> 70014 | D31: 70014 | E31: =MOD(RC[-4],100) -> 14 | F31: 2 | G31: 100 | H31: =INT(MOD(RC[-7],1000)/100) -> 2 | I31: 1 | J31: 300 | K31: 50 | L31: 30 | M31: 3|20 | N31: 180|300 | O31: 3 | P31: 9 | Q31: 3|20 | R31: 60|50 | S31: 自我调和可以带来内心的平静。 | T31: 117|116|113
A32: 70215 | B32: 恶魔·欢乐 | C32: =MID(RC[-2],1,2)*1000+MID(RC[-2],4,2) -> 70015 | D32: 70015 | E32: =MOD(RC[-4],100) -> 15 | F32: 3 | G32: 100 | H32: =INT(MOD(RC[-7],1000)/100) -> 2 | I32: 1 | J32: 300 | K32: 50 | L32: 30 | M32: 2|19 | N32: 180|300 | O32: 2 | P32: 9 | Q32: 2|19 | R32: 60|50 | S32: 沉迷于物质层面的欢乐，结局就是永远的沉沦。 | T32: 117|116|113
A33: 70216 | B33: 塔·高傲 | C33: =MID(RC[-2],1,2)*1000+MID(RC[-2],4,2) -> 70016 | D33: 70016 | E33: =MOD(RC[-4],100) -> 16 | F33: 2 | G33: 100 | H33: =INT(MOD(RC[-7],1000)/100) -> 2 | I33: 1 | J33: 300 | K33: 50 | L33: 30 | M33: 3|5 | N33: 180|300 | O33: 3 | P33: 9 | Q33: 3|5 | R33: 60|50 | S33: 再高傲的人类也无法与自然的强大相提并论。 | T33: 117|116|113
A34: 70217 | B34: 星星·空虚 | C34: =MID(RC[-2],1,2)*1000+MID(RC[-2],4,2) -> 70017 | D34: 70017 | E34: =MOD(RC[-4],100) -> 17 | F34: 1 | G34: 100 | H34: =INT(MOD(RC[-7],1000)/100) -> 2 | I34: 1 | J34: 300 | K34: 50 | L34: 30 | M34: 1|13 | N34: 180|300 | O34: 1 | P34: 9 | Q34: 1|13 | R34: 60|50 | S34: 空虚并不一定是负面的，放空自己才能追求真正的目的。 | T34: 117|116|113
A35: 70218 | B35: 月亮·倾听 | C35: =MID(RC[-2],1,2)*1000+MID(RC[-2],4,2) -> 70018 | D35: 70018 | E35: =MOD(RC[-4],100) -> 18 | F35: 4 | G35: 100 | H35: =INT(MOD(RC[-7],1000)/100) -> 2 | I35: 1 | J35: 300 | K35: 50 | L35: 30 | M35: 4|14 | N35: 1800|300 | O35: 4 | P35: 90 | Q35: 4|14 | R35: 600|50 | S35: 倾听你的梦，找到内心世界的平静。 | T35: 117|116|113
A36: 70219 | B36: 太阳·愉悦 | C36: =MID(RC[-2],1,2)*1000+MID(RC[-2],4,2) -> 70019 | D36: 70019 | E36: =MOD(RC[-4],100) -> 19 | F36: 1 | G36: 100 | H36: =INT(MOD(RC[-7],1000)/100) -> 2 | I36: 1 | J36: 300 | K36: 50 | L36: 30 | M36: 1|15 | N36: 180|300 | O36: 1 | P36: 9 | Q36: 1|15 | R36: 60|50 | S36: 觉醒与解脱令人愉悦。 | T36: 117|116|113
A37: 70220 | B37: 审判·号角 | C37: =MID(RC[-2],1,2)*1000+MID(RC[-2],4,2) -> 70020 | D37: 70020 | E37: =MOD(RC[-4],100) -> 20 | F37: 3 | G37: 100 | H37: =INT(MOD(RC[-7],1000)/100) -> 2 | I37: 1 | J37: 300 | K37: 50 | L37: 30 | M37: 2|10 | N37: 180|300 | O37: 2 | P37: 9 | Q37: 2|10 | R37: 60|50 | S37: 天使吹奏号角，死者得以救赎。 | T37: 117|116|113
A38: 70221 | B38: 世界·持续 | C38: =MID(RC[-2],1,2)*1000+MID(RC[-2],4,2) -> 70021 | D38: 70021 | E38: =MOD(RC[-4],100) -> 21 | F38: 2 | G38: 100 | H38: =INT(MOD(RC[-7],1000)/100) -> 2 | I38: 1 | J38: 300 | K38: 50 | L38: 30 | M38: 3|16 | N38: 180|300 | O38: 3 | P38: 9 | Q38: 3|16 | R38: 60|50 | S38: 协调与和谐才能带来持续的成功。 | T38: 117|116|113
A39: 70222 | B39: 权杖·圣名 | C39: =MID(RC[-2],1,2)*1000+MID(RC[-2],4,2) -> 70022 | D39: 70022 | E39: =MOD(RC[-4],100) -> 22 | F39: 3 | G39: 100 | H39: =INT(MOD(RC[-7],1000)/100) -> 2 | I39: 1 | J39: 200 | K39: 50 | L39: 20 | M39: 2 | N39: 180 | O39: 2 | P39: 9 | Q39: 2 | R39: 60 | S39: 去做吧，这是值得你追逐的目标，圣名指引着你。 | T39: 117|116|113
A40: 70223 | B40: 圣杯·金 | C40: =MID(RC[-2],1,2)*1000+MID(RC[-2],4,2) -> 70023 | D40: 70023 | E40: =MOD(RC[-4],100) -> 23 | F40: 2 | G40: 100 | H40: =INT(MOD(RC[-7],1000)/100) -> 2 | I40: 1 | J40: 200 | K40: 50 | L40: 20 | M40: 3 | N40: 180 | O40: 3 | P40: 9 | Q40: 3 | R40: 60 | S40: 享受更丰盛的感情，与万物更为契合。 | T40: 117|116|113
A41: 70224 | B41: 宝剑·藏锋 | C41: =MID(RC[-2],1,2)*1000+MID(RC[-2],4,2) -> 70024 | D41: 70024 | E41: =MOD(RC[-4],100) -> 24 | F41: 1 | G41: 100 | H41: =INT(MOD(RC[-7],1000)/100) -> 2 | I41: 1 | J41: 200 | K41: 50 | L41: 20 | M41: 1 | N41: 180 | O41: 1 | P41: 9 | Q41: 1 | R41: 60 | S41: 理智而中立，不偏不倚。 | T41: 117|116|113
A42: 70225 | B42: 星币·勇往 | C42: =MID(RC[-2],1,2)*1000+MID(RC[-2],4,2) -> 70025 | D42: 70025 | E42: =MOD(RC[-4],100) -> 25 | F42: 4 | G42: 100 | H42: =INT(MOD(RC[-7],1000)/100) -> 2 | I42: 1 | J42: 200 | K42: 50 | L42: 20 | M42: 4 | N42: 1800 | O42: 4 | P42: 90 | Q42: 4 | R42: 600 | S42: 你需得勇往直前，未来伸手可得。 | T42: 117|116|113
A43: 70300 | B43: 愚者的喜悦 | C43: =MID(RC[-2],1,2)*1000+MID(RC[-2],4,2) -> 70000 | D43: 70000 | E43: =MOD(RC[-4],100) -> 0 | F43: 0 | G43: 1 | H43: =INT(MOD(RC[-7],1000)/100) -> 3 | I43: 0 | J43: 800 | K43: 50 | L43: 1 | M43: 0 | N43: 0 | O43: 0 | P43: 0 | Q43: 0 | R43: 0 | S43: 当你开始欢喜时，你就要小心脚下了。 | T43: 117|116|113
A44: 70301 | B44: 魔术师·变化 | C44: =MID(RC[-2],1,2)*1000+MID(RC[-2],4,2) -> 70001 | D44: 70001 | E44: =MOD(RC[-4],100) -> 1 | F44: 2 | G44: 100 | H44: =INT(MOD(RC[-7],1000)/100) -> 3 | I44: 1 | J44: 4500 | K44: 50 | L44: 450 | M44: 3|8 | N44: 240|600 | O44: 3 | P44: 12 | Q44: 3|8 | R44: 80|100 | S44: 变化莫测的神奇力量尽在你的掌握之间。 | T44: 117|116|113
A45: 70302 | B45: 女祭司·吟唱 | C45: =MID(RC[-2],1,2)*1000+MID(RC[-2],4,2) -> 70002 | D45: 70002 | E45: =MOD(RC[-4],100) -> 2 | F45: 4 | G45: 100 | H45: =INT(MOD(RC[-7],1000)/100) -> 3 | I45: 1 | J45: 4500 | K45: 50 | L45: 450 | M45: 4|25 | N45: 2400|600 | O45: 4 | P45: 120 | Q45: 4|25 | R45: 800|100 | S45: 这轻声的吟唱中，或者正蕴涵着你所渴求的—— | T45: 117|116|113
A46: 70303 | B46: 女皇·奢侈 | C46: =MID(RC[-2],1,2)*1000+MID(RC[-2],4,2) -> 70003 | D46: 70003 | E46: =MOD(RC[-4],100) -> 3 | F46: 2 | G46: 100 | H46: =INT(MOD(RC[-7],1000)/100) -> 3 | I46: 1 | J46: 4500 | K46: 50 | L46: 450 | M46: 3|24 | N46: 240|600 | O46: 3 | P46: 12 | Q46: 3|24 | R46: 80|100 | S46: 优越的物质生活不应导致奢侈和懈怠。 | T46: 117|116|113
A47: 70304 | B47: 皇帝·领袖 | C47: =MID(RC[-2],1,2)*1000+MID(RC[-2],4,2) -> 70004 | D47: 70004 | E47: =MOD(RC[-4],100) -> 4 | F47: 3 | G47: 100 | H47: =INT(MOD(RC[-7],1000)/100) -> 3 | I47: 1 | J47: 4500 | K47: 50 | L47: 450 | M47: 2|23 | N47: 240|600 | O47: 2 | P47: 12 | Q47: 2|23 | R47: 80|100 | S47: 他拥有不容怀疑的权威，正直、公平且实际。 | T47: 117|116|113
A48: 70305 | B48: 教皇·十字 | C48: =MID(RC[-2],1,2)*1000+MID(RC[-2],4,2) -> 70005 | D48: 70005 | E48: =MOD(RC[-4],100) -> 5 | F48: 4 | G48: 100 | H48: =INT(MOD(RC[-7],1000)/100) -> 3 | I48: 1 | J48: 4500 | K48: 50 | L48: 450 | M48: 4|6 | N48: 2400|600 | O48: 4 | P48: 120 | Q48: 4|6 | R48: 800|100 | S48: 这是上帝对人的爱与救赎。 | T48: 117|116|113
A49: 70306 | B49: 恋人·取舍 | C49: =MID(RC[-2],1,2)*1000+MID(RC[-2],4,2) -> 70006 | D49: 70006 | E49: =MOD(RC[-4],100) -> 6 | F49: 3 | G49: 100 | H49: =INT(MOD(RC[-7],1000)/100) -> 3 | I49: 1 | J49: 4500 | K49: 50 | L49: 450 | M49: 2|17 | N49: 240|600 | O49: 2 | P49: 12 | Q49: 2|17 | R49: 80|100 | S49: 你无法从别人身边或生活本身孤立出来，你需要选择。 | T49: 117|116|113
A50: 70307 | B50: 战车·突破 | C50: =MID(RC[-2],1,2)*1000+MID(RC[-2],4,2) -> 70007 | D50: 70007 | E50: =MOD(RC[-4],100) -> 7 | F50: 4 | G50: 100 | H50: =INT(MOD(RC[-7],1000)/100) -> 3 | I50: 1 | J50: 4500 | K50: 50 | L50: 450 | M50: 4|26 | N50: 2400|12 | O50: 4 | P50: 120 | Q50: 4|26 | R50: 800|2 | S50: 你须得突破自我，去掌握这一切。 | T50: 117|116|113
A51: 70308 | B51: 力量·不屈 | C51: =MID(RC[-2],1,2)*1000+MID(RC[-2],4,2) -> 70008 | D51: 70008 | E51: =MOD(RC[-4],100) -> 8 | F51: 1 | G51: 100 | H51: =INT(MOD(RC[-7],1000)/100) -> 3 | I51: 1 | J51: 4500 | K51: 50 | L51: 450 | M51: 1|22 | N51: 240|600 | O51: 1 | P51: 12 | Q51: 1|22 | R51: 80|100 | S51: 不屈不挠的精神是你最强大的力量之一。 | T51: 117|116|113
A52: 70309 | B52: 隐者·引导 | C52: =MID(RC[-2],1,2)*1000+MID(RC[-2],4,2) -> 70009 | D52: 70009 | E52: =MOD(RC[-4],100) -> 9 | F52: 3 | G52: 100 | H52: =INT(MOD(RC[-7],1000)/100) -> 3 | I52: 1 | J52: 4500 | K52: 50 | L52: 450 | M52: 2|12 | N52: 240|600 | O52: 2 | P52: 12 | Q52: 2|12 | R52: 80|100 | S52: 心灵上的引导是未来的明灯。 | T52: 117|116|113
A53: 70310 | B53: 命运之轮·时 | C53: =MID(RC[-2],1,2)*1000+MID(RC[-2],4,2) -> 70010 | D53: 70010 | E53: =MOD(RC[-4],100) -> 10 | F53: 4 | G53: 100 | H53: =INT(MOD(RC[-7],1000)/100) -> 3 | I53: 1 | J53: 4500 | K53: 50 | L53: 450 | M53: 4|18 | N53: 2400|600 | O53: 4 | P53: 120 | Q53: 4|18 | R53: 800|100 | S53: 时间流逝，命运如初。 | T53: 117|116|113
A54: 70311 | B54: 正义·责任 | C54: =MID(RC[-2],1,2)*1000+MID(RC[-2],4,2) -> 70011 | D54: 70011 | E54: =MOD(RC[-4],100) -> 11 | F54: 1 | G54: 100 | H54: =INT(MOD(RC[-7],1000)/100) -> 3 | I54: 1 | J54: 4500 | K54: 50 | L54: 450 | M54: 1|11 | N54: 240|600 | O54: 1 | P54: 12 | Q54: 1|11 | R54: 80|100 | S54: 正义是责任而不是追求。 | T54: 117|116|113
A55: 70312 | B55: 倒吊人·坚忍 | C55: =MID(RC[-2],1,2)*1000+MID(RC[-2],4,2) -> 70012 | D55: 70012 | E55: =MOD(RC[-4],100) -> 12 | F55: 1 | G55: 100 | H55: =INT(MOD(RC[-7],1000)/100) -> 3 | I55: 1 | J55: 4500 | K55: 50 | L55: 450 | M55: 1|9 | N55: 240|600 | O55: 1 | P55: 12 | Q55: 1|9 | R55: 80|100 | S55: 沉着、顺从而坚忍，洞察人生所代表的真义。 | T55: 117|116|113
A56: 70313 | B56: 死神·畏惧 | C56: =MID(RC[-2],1,2)*1000+MID(RC[-2],4,2) -> 70013 | D56: 70013 | E56: =MOD(RC[-4],100) -> 13 | F56: 1 | G56: 100 | H56: =INT(MOD(RC[-7],1000)/100) -> 3 | I56: 1 | J56: 4500 | K56: 50 | L56: 450 | M56: 1|7 | N56: 240|600 | O56: 1 | P56: 12 | Q56: 1|7 | R56: 80|100 | S56: 恐惧会导致你紧抓着生命不放，这本身无异于某种死亡。 | T56: 117|116|113
A57: 70314 | B57: 节制·调和 | C57: =MID(RC[-2],1,2)*1000+MID(RC[-2],4,2) -> 70014 | D57: 70014 | E57: =MOD(RC[-4],100) -> 14 | F57: 2 | G57: 100 | H57: =INT(MOD(RC[-7],1000)/100) -> 3 | I57: 1 | J57: 4500 | K57: 50 | L57: 450 | M57: 3|20 | N57: 240|600 | O57: 3 | P57: 12 | Q57: 3|20 | R57: 80|100 | S57: 现实与潜意识的融合，感性与理性的调和。 | T57: 117|116|113
A58: 70315 | B58: 恶魔·沉迷 | C58: =MID(RC[-2],1,2)*1000+MID(RC[-2],4,2) -> 70015 | D58: 70015 | E58: =MOD(RC[-4],100) -> 15 | F58: 3 | G58: 100 | H58: =INT(MOD(RC[-7],1000)/100) -> 3 | I58: 1 | J58: 4500 | K58: 50 | L58: 450 | M58: 2|19 | N58: 240|600 | O58: 2 | P58: 12 | Q58: 2|19 | R58: 80|100 | S58: 不要沉迷于物质财富。 | T58: 117|116|113
A59: 70316 | B59: 塔·致命 | C59: =MID(RC[-2],1,2)*1000+MID(RC[-2],4,2) -> 70016 | D59: 70016 | E59: =MOD(RC[-4],100) -> 16 | F59: 2 | G59: 100 | H59: =INT(MOD(RC[-7],1000)/100) -> 3 | I59: 1 | J59: 4500 | K59: 50 | L59: 450 | M59: 3|5 | N59: 240|600 | O59: 3 | P59: 12 | Q59: 3|5 | R59: 80|100 | S59: 不做改变是非常致命的。 | T59: 117|116|113
A60: 70317 | B60: 星星·治疗 | C60: =MID(RC[-2],1,2)*1000+MID(RC[-2],4,2) -> 70017 | D60: 70017 | E60: =MOD(RC[-4],100) -> 17 | F60: 1 | G60: 100 | H60: =INT(MOD(RC[-7],1000)/100) -> 3 | I60: 1 | J60: 4500 | K60: 50 | L60: 450 | M60: 1|13 | N60: 240|600 | O60: 1 | P60: 12 | Q60: 1|13 | R60: 80|100 | S60: 你已有追求你真正目的的自由了。 | T60: 117|116|113
A61: 70318 | B61: 月亮·梦 | C61: =MID(RC[-2],1,2)*1000+MID(RC[-2],4,2) -> 70018 | D61: 70018 | E61: =MOD(RC[-4],100) -> 18 | F61: 4 | G61: 100 | H61: =INT(MOD(RC[-7],1000)/100) -> 3 | I61: 1 | J61: 4500 | K61: 50 | L61: 450 | M61: 4|14 | N61: 2400|600 | O61: 4 | P61: 120 | Q61: 4|14 | R61: 800|100 | S61: 你将会发现你所要找寻的答案——在你的梦里。 | T61: 117|116|113
A62: 70319 | B62: 太阳·活跃 | C62: =MID(RC[-2],1,2)*1000+MID(RC[-2],4,2) -> 70019 | D62: 70019 | E62: =MOD(RC[-4],100) -> 19 | F62: 1 | G62: 100 | H62: =INT(MOD(RC[-7],1000)/100) -> 3 | I62: 1 | J62: 4500 | K62: 50 | L62: 450 | M62: 1|15 | N62: 240|600 | O62: 1 | P62: 12 | Q62: 1|15 | R62: 80|100 | S62: 你须得解放自己，奔向自由，活跃而欢快。 | T62: 117|116|113
A63: 70320 | B63: 审判·坦白 | C63: =MID(RC[-2],1,2)*1000+MID(RC[-2],4,2) -> 70020 | D63: 70020 | E63: =MOD(RC[-4],100) -> 20 | F63: 3 | G63: 100 | H63: =INT(MOD(RC[-7],1000)/100) -> 3 | I63: 1 | J63: 4500 | K63: 50 | L63: 450 | M63: 2|10 | N63: 240|600 | O63: 2 | P63: 12 | Q63: 2|10 | R63: 80|100 | S63: 这也是战胜自我，是踏出成功的第一步。 | T63: 117|116|113
A64: 70321 | B64: 世界·运转 | C64: =MID(RC[-2],1,2)*1000+MID(RC[-2],4,2) -> 70021 | D64: 70021 | E64: =MOD(RC[-4],100) -> 21 | F64: 2 | G64: 100 | H64: =INT(MOD(RC[-7],1000)/100) -> 3 | I64: 1 | J64: 4500 | K64: 50 | L64: 450 | M64: 3|16 | N64: 240|600 | O64: 3 | P64: 12 | Q64: 3|16 | R64: 80|100 | S64: 世界的运转是如此缓慢而坚定，无法被阻止。 | T64: 117|116|113
A65: 70322 | B65: 权杖·神圣 | C65: =MID(RC[-2],1,2)*1000+MID(RC[-2],4,2) -> 70022 | D65: 70022 | E65: =MOD(RC[-4],100) -> 22 | F65: 3 | G65: 100 | H65: =INT(MOD(RC[-7],1000)/100) -> 3 | I65: 1 | J65: 3000 | K65: 50 | L65: 300 | M65: 2 | N65: 240 | O65: 2 | P65: 12 | Q65: 2 | R65: 80 | S65: 目的可能会出错，但追逐目的的勇气和力量是神圣且绝对正确的。 | T65: 117|116|113
A66: 70323 | B66: 圣杯·祭祀 | C66: =MID(RC[-2],1,2)*1000+MID(RC[-2],4,2) -> 70023 | D66: 70023 | E66: =MOD(RC[-4],100) -> 23 | F66: 2 | G66: 100 | H66: =INT(MOD(RC[-7],1000)/100) -> 3 | I66: 1 | J66: 3000 | K66: 50 | L66: 300 | M66: 3 | N66: 240 | O66: 3 | P66: 12 | Q66: 3 | R66: 80 | S66: 祭祀如同将杯中的水汇入河流，以此换取心灵的丰盛。 | T66: 117|116|113
A67: 70324 | B67: 宝剑·斩铁 | C67: =MID(RC[-2],1,2)*1000+MID(RC[-2],4,2) -> 70024 | D67: 70024 | E67: =MOD(RC[-4],100) -> 24 | F67: 1 | G67: 100 | H67: =INT(MOD(RC[-7],1000)/100) -> 3 | I67: 1 | J67: 3000 | K67: 50 | L67: 300 | M67: 1 | N67: 240 | O67: 1 | P67: 12 | Q67: 1 | R67: 80 | S67: 看清一切，这剑便能如你心灵，斩钢断铁。 | T67: 117|116|113
A68: 70325 | B68: 星币·飞舞 | C68: =MID(RC[-2],1,2)*1000+MID(RC[-2],4,2) -> 70025 | D68: 70025 | E68: =MOD(RC[-4],100) -> 25 | F68: 4 | G68: 100 | H68: =INT(MOD(RC[-7],1000)/100) -> 3 | I68: 1 | J68: 3000 | K68: 50 | L68: 300 | M68: 4 | N68: 2400 | O68: 4 | P68: 120 | Q68: 4 | R68: 800 | S68: 分散而蕴含着自然的规律，平衡且稳固。 | T68: 117|116|113
A69: 70400 | B69: 愚者的末路 | C69: =MID(RC[-2],1,2)*1000+MID(RC[-2],4,2) -> 70000 | D69: =RC[-1]+1000 -> 71000 | E69: =MOD(RC[-4],100) -> 0 | F69: 0 | G69: 1 | H69: =INT(MOD(RC[-7],1000)/100) -> 4 | I69: 0 | J69: 100000 | K69: 50 | L69: 1 | M69: 0 | N69: 0 | O69: 0 | P69: 0 | Q69: 0 | R69: 0 | S69: 行至悬崖边上不一定是无路可走，也有可能只是你的盲目。 | T69: 117|116|113
A70: 70401 | B70: 魔术师·魔法 | C70: =MID(RC[-2],1,2)*1000+MID(RC[-2],4,2) -> 70001 | D70: =RC[-1]+1000 -> 71001 | E70: =MOD(RC[-4],100) -> 1 | F70: 2 | G70: 100 | H70: =INT(MOD(RC[-7],1000)/100) -> 4 | I70: 1 | J70: 30000 | K70: 50 | L70: 3000 | M70: 3|8 | N70: 600|1200 | O70: 3 | P70: 30 | Q70: 3|8 | R70: 200|200 | S70: 祈求上天赐与力量，唤起魔法——于这虚无间。 | T70: 117|116|113
A71: 70402 | B71: 女祭司·神乐 | C71: =MID(RC[-2],1,2)*1000+MID(RC[-2],4,2) -> 70002 | D71: =RC[-1]+1000 -> 71002 | E71: =MOD(RC[-4],100) -> 2 | F71: 4 | G71: 100 | H71: =INT(MOD(RC[-7],1000)/100) -> 4 | I71: 1 | J71: 30000 | K71: 50 | L71: 3000 | M71: 4|25 | N71: 6000|1200 | O71: 4 | P71: 300 | Q71: 4|25 | R71: 2000|200 | S71: 如倾城之音，神亦倾耳聆听。 | T71: 117|116|113
A72: 70403 | B72: 女皇·生命 | C72: =MID(RC[-2],1,2)*1000+MID(RC[-2],4,2) -> 70003 | D72: =RC[-1]+1000 -> 71003 | E72: =MOD(RC[-4],100) -> 3 | F72: 2 | G72: 100 | H72: =INT(MOD(RC[-7],1000)/100) -> 4 | I72: 1 | J72: 30000 | K72: 50 | L72: 3000 | M72: 3|24 | N72: 600|1200 | O72: 3 | P72: 30 | Q72: 3|24 | R72: 200|200 | S72: 生命的诞生、孕育和大地的丰收，万物和谐。 | T72: 117|116|113
A73: 70404 | B73: 皇帝·威严 | C73: =MID(RC[-2],1,2)*1000+MID(RC[-2],4,2) -> 70004 | D73: =RC[-1]+1000 -> 71004 | E73: =MOD(RC[-4],100) -> 4 | F73: 3 | G73: 100 | H73: =INT(MOD(RC[-7],1000)/100) -> 4 | I73: 1 | J73: 30000 | K73: 50 | L73: 3000 | M73: 2|23 | N73: 600|1200 | O73: 2 | P73: 30 | Q73: 2|23 | R73: 200|200 | S73: 端坐于王座，威严不容冒犯。 | T73: 117|116|113
A74: 70405 | B74: 教皇·圣灵 | C74: =MID(RC[-2],1,2)*1000+MID(RC[-2],4,2) -> 70005 | D74: =RC[-1]+1000 -> 71005 | E74: =MOD(RC[-4],100) -> 5 | F74: 4 | G74: 100 | H74: =INT(MOD(RC[-7],1000)/100) -> 4 | I74: 1 | J74: 30000 | K74: 50 | L74: 3000 | M74: 4|6 | N74: 6000|1200 | O74: 4 | P74: 300 | Q74: 4|6 | R74: 2000|200 | S74: 圣灵引导我们进入一切的真理，并用公义和审判显明世人的罪。 | T74: 117|116|113
A75: 70406 | B75: 恋人·天使 | C75: =MID(RC[-2],1,2)*1000+MID(RC[-2],4,2) -> 70006 | D75: =RC[-1]+1000 -> 71006 | E75: =MOD(RC[-4],100) -> 6 | F75: 3 | G75: 100 | H75: =INT(MOD(RC[-7],1000)/100) -> 4 | I75: 1 | J75: 30000 | K75: 50 | L75: 3000 | M75: 2|17 | N75: 600|1200 | O75: 2 | P75: 30 | Q75: 2|17 | R75: 200|200 | S75: 将理性与热情加以调和，则更接近天使与真实的自我。 | T75: 117|116|113
A76: 70407 | B76: 战车·胜利 | C76: =MID(RC[-2],1,2)*1000+MID(RC[-2],4,2) -> 70007 | D76: =RC[-1]+1000 -> 71007 | E76: =MOD(RC[-4],100) -> 7 | F76: 4 | G76: 100 | H76: =INT(MOD(RC[-7],1000)/100) -> 4 | I76: 1 | J76: 30000 | K76: 50 | L76: 3000 | M76: 4|26 | N76: 6000|24 | O76: 4 | P76: 300 | Q76: 4|26 | R76: 2000|4 | S76: 克服障碍、获得胜利，这是你道路上必经的一环。 | T76: 117|116|113
A77: 70408 | B77: 力量·搏斗 | C77: =MID(RC[-2],1,2)*1000+MID(RC[-2],4,2) -> 70008 | D77: =RC[-1]+1000 -> 71008 | E77: =MOD(RC[-4],100) -> 8 | F77: 1 | G77: 100 | H77: =INT(MOD(RC[-7],1000)/100) -> 4 | I77: 1 | J77: 30000 | K77: 50 | L77: 3000 | M77: 1|22 | N77: 600|1200 | O77: 1 | P77: 30 | Q77: 1|22 | R77: 200|200 | S77: 拥有与狮虎搏斗的力量还不够，你得有那勇气。 | T77: 117|116|113
A78: 70409 | B78: 隐者·寻求 | C78: =MID(RC[-2],1,2)*1000+MID(RC[-2],4,2) -> 70009 | D78: =RC[-1]+1000 -> 71009 | E78: =MOD(RC[-4],100) -> 9 | F78: 3 | G78: 100 | H78: =INT(MOD(RC[-7],1000)/100) -> 4 | I78: 1 | J78: 30000 | K78: 50 | L78: 3000 | M78: 2|12 | N78: 600|1200 | O78: 2 | P78: 30 | Q78: 2|12 | R78: 200|200 | S78: 黑暗中孤独地摸索前进，你在寻求什么？ | T78: 117|116|113
A79: 70410 | B79: 命运之轮·末 | C79: =MID(RC[-2],1,2)*1000+MID(RC[-2],4,2) -> 70010 | D79: =RC[-1]+1000 -> 71010 | E79: =MOD(RC[-4],100) -> 10 | F79: 4 | G79: 100 | H79: =INT(MOD(RC[-7],1000)/100) -> 4 | I79: 1 | J79: 30000 | K79: 50 | L79: 3000 | M79: 4|18 | N79: 6000|1200 | O79: 4 | P79: 300 | Q79: 4|18 | R79: 2000|200 | S79: 在命运与时间的终末寻找最终的结局。 | T79: 117|116|113
A80: 70411 | B80: 正义·公平 | C80: =MID(RC[-2],1,2)*1000+MID(RC[-2],4,2) -> 70011 | D80: =RC[-1]+1000 -> 71011 | E80: =MOD(RC[-4],100) -> 11 | F80: 1 | G80: 100 | H80: =INT(MOD(RC[-7],1000)/100) -> 4 | I80: 1 | J80: 30000 | K80: 50 | L80: 3000 | M80: 1|11 | N80: 600|1200 | O80: 1 | P80: 30 | Q80: 1|11 | R80: 200|200 | S80: 公平是坚持正义的基础。 | T80: 117|116|113
A81: 70412 | B81: 倒吊人·省思 | C81: =MID(RC[-2],1,2)*1000+MID(RC[-2],4,2) -> 70012 | D81: =RC[-1]+1000 -> 71012 | E81: =MOD(RC[-4],100) -> 12 | F81: 1 | G81: 100 | H81: =INT(MOD(RC[-7],1000)/100) -> 4 | I81: 1 | J81: 30000 | K81: 50 | L81: 3000 | M81: 1|9 | N81: 600|1200 | O81: 1 | P81: 30 | Q81: 1|9 | R81: 200|200 | S81: 省思能令你更深刻地了解你是谁，以及你应该怎么做。 | T81: 117|116|113
A82: 70413 | B82: 死神·亡者 | C82: =MID(RC[-2],1,2)*1000+MID(RC[-2],4,2) -> 70013 | D82: =RC[-1]+1000 -> 71013 | E82: =MOD(RC[-4],100) -> 13 | F82: 1 | G82: 100 | H82: =INT(MOD(RC[-7],1000)/100) -> 4 | I82: 1 | J82: 30000 | K82: 50 | L82: 3000 | M82: 1|7 | N82: 600|1200 | O82: 1 | P82: 30 | Q82: 1|7 | R82: 200|200 | S82: 试着接纳它，迎接新的阶段来临。 | T82: 117|116|113
A83: 70414 | B83: 节制·明确 | C83: =MID(RC[-2],1,2)*1000+MID(RC[-2],4,2) -> 70014 | D83: =RC[-1]+1000 -> 71014 | E83: =MOD(RC[-4],100) -> 14 | F83: 2 | G83: 100 | H83: =INT(MOD(RC[-7],1000)/100) -> 4 | I83: 1 | J83: 30000 | K83: 50 | L83: 3000 | M83: 3|20 | N83: 600|1200 | O83: 3 | P83: 30 | Q83: 3|20 | R83: 200|200 | S83: 你必须对你的道路及目的有明确的认识。 | T83: 117|116|113
A84: 70415 | B84: 恶魔·束缚 | C84: =MID(RC[-2],1,2)*1000+MID(RC[-2],4,2) -> 70015 | D84: =RC[-1]+1000 -> 71015 | E84: =MOD(RC[-4],100) -> 15 | F84: 3 | G84: 100 | H84: =INT(MOD(RC[-7],1000)/100) -> 4 | I84: 1 | J84: 30000 | K84: 50 | L84: 3000 | M84: 2|19 | N84: 600|1200 | O84: 2 | P84: 30 | Q84: 2|19 | R84: 200|200 | S84: 这是你的自我束缚，你没有打破这锁链的力量。 | T84: 117|116|113
A85: 70416 | B85: 塔·挑战 | C85: =MID(RC[-2],1,2)*1000+MID(RC[-2],4,2) -> 70016 | D85: =RC[-1]+1000 -> 71016 | E85: =MOD(RC[-4],100) -> 16 | F85: 2 | G85: 100 | H85: =INT(MOD(RC[-7],1000)/100) -> 4 | I85: 1 | J85: 30000 | K85: 50 | L85: 3000 | M85: 3|5 | N85: 600|1200 | O85: 3 | P85: 30 | Q85: 3|5 | R85: 200|200 | S85: 不要妄图挑战神灵，你会于此坠落。 | T85: 117|116|113
A86: 70417 | B86: 星星·信心 | C86: =MID(RC[-2],1,2)*1000+MID(RC[-2],4,2) -> 70017 | D86: =RC[-1]+1000 -> 71017 | E86: =MOD(RC[-4],100) -> 17 | F86: 1 | G86: 100 | H86: =INT(MOD(RC[-7],1000)/100) -> 4 | I86: 1 | J86: 30000 | K86: 50 | L86: 3000 | M86: 1|13 | N86: 600|1200 | O86: 1 | P86: 30 | Q86: 1|13 | R86: 200|200 | S86: 信心如星辰，是夜里的光，前进的动力与帮助。 | T86: 117|116|113
A87: 70418 | B87: 月亮·不安 | C87: =MID(RC[-2],1,2)*1000+MID(RC[-2],4,2) -> 70018 | D87: =RC[-1]+1000 -> 71018 | E87: =MOD(RC[-4],100) -> 18 | F87: 4 | G87: 100 | H87: =INT(MOD(RC[-7],1000)/100) -> 4 | I87: 1 | J87: 30000 | K87: 50 | L87: 3000 | M87: 4|14 | N87: 6000|1200 | O87: 4 | P87: 300 | Q87: 4|14 | R87: 2000|200 | S87: 我们必须单独去面对这恐惧与不安——在心灵得到平静之前。 | T87: 117|116|113
A88: 70419 | B88: 太阳·满足 | C88: =MID(RC[-2],1,2)*1000+MID(RC[-2],4,2) -> 70019 | D88: =RC[-1]+1000 -> 71019 | E88: =MOD(RC[-4],100) -> 19 | F88: 1 | G88: 100 | H88: =INT(MOD(RC[-7],1000)/100) -> 4 | I88: 1 | J88: 30000 | K88: 50 | L88: 3000 | M88: 1|15 | N88: 600|1200 | O88: 1 | P88: 30 | Q88: 1|15 | R88: 200|200 | S88: 容易满足是幸福的，但这并不简单。 | T88: 117|116|113
A89: 70420 | B89: 审判·超越 | C89: =MID(RC[-2],1,2)*1000+MID(RC[-2],4,2) -> 70020 | D89: =RC[-1]+1000 -> 71020 | E89: =MOD(RC[-4],100) -> 20 | F89: 3 | G89: 100 | H89: =INT(MOD(RC[-7],1000)/100) -> 4 | I89: 1 | J89: 30000 | K89: 50 | L89: 3000 | M89: 2|10 | N89: 600|1200 | O89: 2 | P89: 30 | Q89: 2|10 | R89: 200|200 | S89: 将过去经验做出结论，以此作为超越它的步骤。 | T89: 117|116|113
A90: 70421 | B90: 世界·久远 | C90: =MID(RC[-2],1,2)*1000+MID(RC[-2],4,2) -> 70021 | D90: =RC[-1]+1000 -> 71021 | E90: =MOD(RC[-4],100) -> 21 | F90: 2 | G90: 100 | H90: =INT(MOD(RC[-7],1000)/100) -> 4 | I90: 1 | J90: 30000 | K90: 50 | L90: 3000 | M90: 3|16 | N90: 600|1200 | O90: 3 | P90: 30 | Q90: 3|16 | R90: 200|200 | S90: 世界是如此古老，找不到尽头。 | T90: 117|116|113
A91: 70422 | B91: 权杖·神权 | C91: =MID(RC[-2],1,2)*1000+MID(RC[-2],4,2) -> 70022 | D91: =RC[-1]+1000 -> 71022 | E91: =MOD(RC[-4],100) -> 22 | F91: 3 | G91: 100 | H91: =INT(MOD(RC[-7],1000)/100) -> 4 | I91: 1 | J91: 20000 | K91: 50 | L91: 2000 | M91: 2 | N91: 600 | O91: 2 | P91: 30 | Q91: 2 | R91: 200 | S91: 意志的自由如神的神权，不可亵渎与剥夺。 | T91: 117|116|113
A92: 70423 | B92: 圣杯·神血 | C92: =MID(RC[-2],1,2)*1000+MID(RC[-2],4,2) -> 70023 | D92: =RC[-1]+1000 -> 71023 | E92: =MOD(RC[-4],100) -> 23 | F92: 2 | G92: 100 | H92: =INT(MOD(RC[-7],1000)/100) -> 4 | I92: 1 | J92: 20000 | K92: 50 | L92: 2000 | M92: 3 | N92: 600 | O92: 3 | P92: 30 | Q92: 3 | R92: 200 | S92: 透过这一缕连接，须得看到其后那心灵与灵魂的契合。 | T92: 117|116|113
A93: 70424 | B93: 宝剑·辉煌 | C93: =MID(RC[-2],1,2)*1000+MID(RC[-2],4,2) -> 70024 | D93: =RC[-1]+1000 -> 71024 | E93: =MOD(RC[-4],100) -> 24 | F93: 1 | G93: 100 | H93: =INT(MOD(RC[-7],1000)/100) -> 4 | I93: 1 | J93: 20000 | K93: 50 | L93: 2000 | M93: 1 | N93: 600 | O93: 1 | P93: 30 | Q93: 1 | R93: 200 | S93: 当你的剑刺穿皇冠，你的思绪也贯穿了这个世界的一切辉煌。 | T93: 117|116|113
A94: 70425 | B94: 星币·守护 | C94: =MID(RC[-2],1,2)*1000+MID(RC[-2],4,2) -> 70025 | D94: =RC[-1]+1000 -> 71025 | E94: =MOD(RC[-4],100) -> 25 | F94: 4 | G94: 100 | H94: =INT(MOD(RC[-7],1000)/100) -> 4 | I94: 1 | J94: 20000 | K94: 50 | L94: 2000 | M94: 4 | N94: 6000 | O94: 4 | P94: 300 | Q94: 4 | R94: 2000 | S94: 守护不能给予你未来，暂时的避风港也需要走出去的一天。 | T94: 117|116|113
A95: 70500 | B95: 愚者的终焉 | C95: =MID(RC[-2],1,2)*1000+MID(RC[-2],4,2) -> 70000 | D95: =RC[-1]+1000 -> 71000 | E95: =MOD(RC[-4],100) -> 0 | F95: 0 | G95: 1 | H95: =INT(MOD(RC[-7],1000)/100) -> 5 | I95: 0 | J95: 1000000 | K95: 50 | L95: 1 | M95: 0 | N95: 0 | O95: 0 | P95: 0 | Q95: 0 | R95: 0 | S95: 你应当走至天空还是跌落悬崖？这并非愚蠢，只是选择了方向而已。 | T95: 117|116|113
A96: 70501 | B96: 魔术师·创造 | C96: =MID(RC[-2],1,2)*1000+MID(RC[-2],4,2) -> 70001 | D96: =RC[-1]+1000 -> 71001 | E96: =MOD(RC[-4],100) -> 1 | F96: 2 | G96: 100 | H96: =INT(MOD(RC[-7],1000)/100) -> 5 | I96: 1 | J96: 60000 | K96: 50 | L96: 6000 | M96: 3|8 | N96: 900|2000 | O96: 3 | P96: 45 | Q96: 3|8 | R96: 300|300 | S96: 拥有无限的能力，操纵宇宙的力量无所不能。 | T96: 117|116|113
A97: 70502 | B97: 女祭司·圣母 | C97: =MID(RC[-2],1,2)*1000+MID(RC[-2],4,2) -> 70002 | D97: =RC[-1]+1000 -> 71002 | E97: =MOD(RC[-4],100) -> 2 | F97: 4 | G97: 100 | H97: =INT(MOD(RC[-7],1000)/100) -> 5 | I97: 1 | J97: 60000 | K97: 50 | L97: 6000 | M97: 4|25 | N97: 9000|2000 | O97: 4 | P97: 450 | Q97: 4|25 | R97: 3000|300 | S97: 每个人都在各自人生中耕耘与收获，而其则散播着这些种子。 | T97: 117|116|113
A98: 70503 | B98: 女皇·完美 | C98: =MID(RC[-2],1,2)*1000+MID(RC[-2],4,2) -> 70003 | D98: =RC[-1]+1000 -> 71003 | E98: =MOD(RC[-4],100) -> 3 | F98: 2 | G98: 100 | H98: =INT(MOD(RC[-7],1000)/100) -> 5 | I98: 1 | J98: 60000 | K98: 50 | L98: 6000 | M98: 3|24 | N98: 900|2000 | O98: 3 | P98: 45 | Q98: 3|24 | R98: 300|300 | S98: 你已经完美地获得了这一切—— | T98: 117|116|113
A99: 70504 | B99: 皇帝·主宰 | C99: =MID(RC[-2],1,2)*1000+MID(RC[-2],4,2) -> 70004 | D99: =RC[-1]+1000 -> 71004 | E99: =MOD(RC[-4],100) -> 4 | F99: 3 | G99: 100 | H99: =INT(MOD(RC[-7],1000)/100) -> 5 | I99: 1 | J99: 60000 | K99: 50 | L99: 6000 | M99: 2|23 | N99: 900|2000 | O99: 2 | P99: 45 | Q99: 2|23 | R99: 300|300 | S99: 他统治着一切，拥有了一切，武断且自律，不容反驳。 | T99: 117|116|113
A100: 70505 | B100: 教皇·上帝 | C100: =MID(RC[-2],1,2)*1000+MID(RC[-2],4,2) -> 70005 | D100: =RC[-1]+1000 -> 71005 | E100: =MOD(RC[-4],100) -> 5 | F100: 4 | G100: 100 | H100: =INT(MOD(RC[-7],1000)/100) -> 5 | I100: 1 | J100: 60000 | K100: 50 | L100: 6000 | M100: 4|6 | N100: 9000|2000 | O100: 4 | P100: 450 | Q100: 4|6 | R100: 3000|300 | S100: 上帝是永恒的存在，创造和治理世界，是至高无上统治者。 | T100: 117|116|113
A101: 70506 | B101: 恋人·伊甸 | C101: =MID(RC[-2],1,2)*1000+MID(RC[-2],4,2) -> 70006 | D101: =RC[-1]+1000 -> 71006 | E101: =MOD(RC[-4],100) -> 6 | F101: 3 | G101: 100 | H101: =INT(MOD(RC[-7],1000)/100) -> 5 | I101: 1 | J101: 60000 | K101: 50 | L101: 6000 | M101: 2|17 | N101: 900|2000 | O101: 2 | P101: 45 | Q101: 2|17 | R101: 300|300 | S101: 伊甸园一样存在着诸多考验，美丽且残酷。 | T101: 117|116|113
A102: 70507 | B102: 战车·凌驾 | C102: =MID(RC[-2],1,2)*1000+MID(RC[-2],4,2) -> 70007 | D102: =RC[-1]+1000 -> 71007 | E102: =MOD(RC[-4],100) -> 7 | F102: 4 | G102: 100 | H102: =INT(MOD(RC[-7],1000)/100) -> 5 | I102: 1 | J102: 60000 | K102: 50 | L102: 6000 | M102: 4|26 | N102: 9000|40 | O102: 4 | P102: 450 | Q102: 4|26 | R102: 3000|6 | S102: 你须得凌驾于道路与自我的欲望之上。 | T102: 117|116|113
A103: 70508 | B103: 力量·意志 | C103: =MID(RC[-2],1,2)*1000+MID(RC[-2],4,2) -> 70008 | D103: =RC[-1]+1000 -> 71008 | E103: =MOD(RC[-4],100) -> 8 | F103: 1 | G103: 100 | H103: =INT(MOD(RC[-7],1000)/100) -> 5 | I103: 1 | J103: 60000 | K103: 50 | L103: 6000 | M103: 1|22 | N103: 900|2000 | O103: 1 | P103: 45 | Q103: 1|22 | R103: 300|300 | S103: 你超凡的力量与意志足以突破任何困难。 | T103: 117|116|113
A104: 70509 | B104: 隐者·旅途 | C104: =MID(RC[-2],1,2)*1000+MID(RC[-2],4,2) -> 70009 | D104: =RC[-1]+1000 -> 71009 | E104: =MOD(RC[-4],100) -> 9 | F104: 3 | G104: 100 | H104: =INT(MOD(RC[-7],1000)/100) -> 5 | I104: 1 | J104: 60000 | K104: 50 | L104: 6000 | M104: 2|12 | N104: 900|2000 | O104: 2 | P104: 45 | Q104: 2|12 | R104: 300|300 | S104: 这是你必须踏上的旅途，一个人默默无闻的旅途，它属于你的。 | T104: 117|116|113
A105: 70510 | B105: 命运之轮·环 | C105: =MID(RC[-2],1,2)*1000+MID(RC[-2],4,2) -> 70010 | D105: =RC[-1]+1000 -> 71010 | E105: =MOD(RC[-4],100) -> 10 | F105: 4 | G105: 100 | H105: =INT(MOD(RC[-7],1000)/100) -> 5 | I105: 1 | J105: 60000 | K105: 50 | L105: 6000 | M105: 4|18 | N105: 9000|2000 | O105: 4 | P105: 450 | Q105: 4|18 | R105: 3000|300 | S105: 人生是一个环，无穷无尽、无休无止轮回，不是谁都能始终如一。 | T105: 117|116|113
A106: 70511 | B106: 正义·权衡 | C106: =MID(RC[-2],1,2)*1000+MID(RC[-2],4,2) -> 70011 | D106: =RC[-1]+1000 -> 71011 | E106: =MOD(RC[-4],100) -> 11 | F106: 1 | G106: 100 | H106: =INT(MOD(RC[-7],1000)/100) -> 5 | I106: 1 | J106: 60000 | K106: 50 | L106: 6000 | M106: 1|11 | N106: 900|2000 | O106: 1 | P106: 45 | Q106: 1|11 | R106: 300|300 | S106: 权衡并做出公平而正当的决定，如此行使正义。 | T106: 117|116|113
A107: 70512 | B107: 倒吊人·牺牲 | C107: =MID(RC[-2],1,2)*1000+MID(RC[-2],4,2) -> 70012 | D107: =RC[-1]+1000 -> 71012 | E107: =MOD(RC[-4],100) -> 12 | F107: 1 | G107: 100 | H107: =INT(MOD(RC[-7],1000)/100) -> 5 | I107: 1 | J107: 60000 | K107: 50 | L107: 6000 | M107: 1|9 | N107: 900|2000 | O107: 1 | P107: 45 | Q107: 1|9 | R107: 300|300 | S107: 放弃你所拥有的东西，才能够去做你这辈子真正应该去做的事。 | T107: 117|116|113
A108: 70513 | B108: 死神·终末 | C108: =MID(RC[-2],1,2)*1000+MID(RC[-2],4,2) -> 70013 | D108: =RC[-1]+1000 -> 71013 | E108: =MOD(RC[-4],100) -> 13 | F108: 1 | G108: 100 | H108: =INT(MOD(RC[-7],1000)/100) -> 5 | I108: 1 | J108: 60000 | K108: 50 | L108: 6000 | M108: 1|7 | N108: 900|2000 | O108: 1 | P108: 45 | Q108: 1|7 | R108: 300|300 | S108: 如果没有死亡，就不可能有任何新事物出现于这世界上。 | T108: 117|116|113
A109: 70514 | B109: 节制·净化 | C109: =MID(RC[-2],1,2)*1000+MID(RC[-2],4,2) -> 70014 | D109: =RC[-1]+1000 -> 71014 | E109: =MOD(RC[-4],100) -> 14 | F109: 2 | G109: 100 | H109: =INT(MOD(RC[-7],1000)/100) -> 5 | I109: 1 | J109: 60000 | K109: 50 | L109: 6000 | M109: 3|20 | N109: 900|2000 | O109: 3 | P109: 45 | Q109: 3|20 | R109: 300|300 | S109: 控制好自己的欲望是最重要的，你须得净化自己。 | T109: 117|116|113
A110: 70515 | B110: 恶魔·控制 | C110: =MID(RC[-2],1,2)*1000+MID(RC[-2],4,2) -> 70015 | D110: =RC[-1]+1000 -> 71015 | E110: =MOD(RC[-4],100) -> 15 | F110: 3 | G110: 100 | H110: =INT(MOD(RC[-7],1000)/100) -> 5 | I110: 1 | J110: 60000 | K110: 50 | L110: 6000 | M110: 2|19 | N110: 900|2000 | O110: 2 | P110: 45 | Q110: 2|19 | R110: 300|300 | S110: 如同魔鬼，企图将一切玩弄于股掌之间，控制着一切。 | T110: 117|116|113
A111: 70516 | B111: 塔·毁灭 | C111: =MID(RC[-2],1,2)*1000+MID(RC[-2],4,2) -> 70016 | D111: =RC[-1]+1000 -> 71016 | E111: =MOD(RC[-4],100) -> 16 | F111: 2 | G111: 100 | H111: =INT(MOD(RC[-7],1000)/100) -> 5 | I111: 1 | J111: 60000 | K111: 50 | L111: 6000 | M111: 3|5 | N111: 900|2000 | O111: 3 | P111: 45 | Q111: 3|5 | R111: 300|300 | S111: 招致毁灭到来的，是你的高傲与固执。 | T111: 117|116|113
A112: 70517 | B112: 星星·希望 | C112: =MID(RC[-2],1,2)*1000+MID(RC[-2],4,2) -> 70017 | D112: =RC[-1]+1000 -> 71017 | E112: =MOD(RC[-4],100) -> 17 | F112: 1 | G112: 100 | H112: =INT(MOD(RC[-7],1000)/100) -> 5 | I112: 1 | J112: 60000 | K112: 50 | L112: 6000 | M112: 1|13 | N112: 900|2000 | O112: 1 | P112: 45 | Q112: 1|13 | R112: 300|300 | S112: 人们是如此地需要希望，这是一切的动力。 | T112: 117|116|113
A113: 70518 | B113: 月亮·欺骗 | C113: =MID(RC[-2],1,2)*1000+MID(RC[-2],4,2) -> 70018 | D113: =RC[-1]+1000 -> 71018 | E113: =MOD(RC[-4],100) -> 18 | F113: 4 | G113: 100 | H113: =INT(MOD(RC[-7],1000)/100) -> 5 | I113: 1 | J113: 60000 | K113: 50 | L113: 6000 | M113: 4|14 | N113: 9000|2000 | O113: 4 | P113: 450 | Q113: 4|14 | R113: 3000|300 | S113: 当你无法理解和吸收这些时，欺骗与疯狂也自然而然地产生了。 | T113: 117|116|113
A114: 70519 | B114: 太阳·全知 | C114: =MID(RC[-2],1,2)*1000+MID(RC[-2],4,2) -> 70019 | D114: =RC[-1]+1000 -> 71019 | E114: =MOD(RC[-4],100) -> 19 | F114: 1 | G114: 100 | H114: =INT(MOD(RC[-7],1000)/100) -> 5 | I114: 1 | J114: 60000 | K114: 50 | L114: 6000 | M114: 1|15 | N114: 900|2000 | O114: 1 | P114: 45 | Q114: 1|15 | R114: 300|300 | S114: 高悬于空中，不偏不倚，散播喜悦，观察万物的变化，全知且无虑。 | T114: 117|116|113
A115: 70520 | B115: 审判·重生 | C115: =MID(RC[-2],1,2)*1000+MID(RC[-2],4,2) -> 70020 | D115: =RC[-1]+1000 -> 71020 | E115: =MOD(RC[-4],100) -> 20 | F115: 3 | G115: 100 | H115: =INT(MOD(RC[-7],1000)/100) -> 5 | I115: 1 | J115: 60000 | K115: 50 | L115: 6000 | M115: 2|10 | N115: 900|2000 | O115: 2 | P115: 45 | Q115: 2|10 | R115: 300|300 | S115: 超脱你对生命的局限想法，看清生命的本质，以此踏出最后一步。 | T115: 117|116|113
A116: 70521 | B116: 世界·永恒 | C116: =MID(RC[-2],1,2)*1000+MID(RC[-2],4,2) -> 70021 | D116: =RC[-1]+1000 -> 71021 | E116: =MOD(RC[-4],100) -> 21 | F116: 2 | G116: 100 | H116: =INT(MOD(RC[-7],1000)/100) -> 5 | I116: 1 | J116: 60000 | K116: 50 | L116: 6000 | M116: 3|16 | N116: 900|2000 | O116: 3 | P116: 45 | Q116: 3|16 | R116: 300|300 | S116: 没有所谓的开始和结束，所有的事情都是环环相扣而永恒的。 | T116: 117|116|113
A117: 70522 | B117: 权杖·至高 | C117: =MID(RC[-2],1,2)*1000+MID(RC[-2],4,2) -> 70022 | D117: =RC[-1]+1000 -> 71022 | E117: =MOD(RC[-4],100) -> 22 | F117: 3 | G117: 100 | H117: =INT(MOD(RC[-7],1000)/100) -> 5 | I117: 1 | J117: 60000 | K117: 50 | L117: 6000 | M117: 2 | N117: 900 | O117: 2 | P117: 45 | Q117: 2 | R117: 300 | S117: 你的渴望、你的力量与勇气，这一切都是至高无上的。 | T117: 117|116|113
A118: 70523 | B118: 圣杯·万能 | C118: =MID(RC[-2],1,2)*1000+MID(RC[-2],4,2) -> 70023 | D118: =RC[-1]+1000 -> 71023 | E118: =MOD(RC[-4],100) -> 23 | F118: 2 | G118: 100 | H118: =INT(MOD(RC[-7],1000)/100) -> 5 | I118: 1 | J118: 60000 | K118: 50 | L118: 6000 | M118: 3 | N118: 900 | O118: 3 | P118: 45 | Q118: 3 | R118: 300 | S118: 万能之人将其高举，万事万物尽在掌握。 | T118: 117|116|113
A119: 70524 | B119: 宝剑·神威 | C119: =MID(RC[-2],1,2)*1000+MID(RC[-2],4,2) -> 70024 | D119: =RC[-1]+1000 -> 71024 | E119: =MOD(RC[-4],100) -> 24 | F119: 1 | G119: 100 | H119: =INT(MOD(RC[-7],1000)/100) -> 5 | I119: 1 | J119: 60000 | K119: 50 | L119: 6000 | M119: 1 | N119: 900 | O119: 1 | P119: 45 | Q119: 1 | R119: 300 | S119: 这代表了神的权威，无有奖赏，仅有结局，而我们也需如此追寻。 | T119: 117|116|113
A120: 70525 | B120: 星币·未来 | C120: =MID(RC[-2],1,2)*1000+MID(RC[-2],4,2) -> 70025 | D120: =RC[-1]+1000 -> 71025 | E120: =MOD(RC[-4],100) -> 25 | F120: 4 | G120: 100 | H120: =INT(MOD(RC[-7],1000)/100) -> 5 | I120: 1 | J120: 60000 | K120: 50 | L120: 6000 | M120: 4 | N120: 9000 | O120: 4 | P120: 450 | Q120: 4 | R120: 3000 | S120: 延伸至远方，这道路是你与未来的连接。 | T120: 117|116|113

Sheet: 2.升级
A1: quality|quality | B1: level|level | C1: exp|exp | D1: total_exp|total_exp | E1: need_role_level|need_role_level
A2: 不可空 | B2: 不可空 | C2: 不可空 | D2: 不可空 | E2: 不可空
A3: 数字 | B3: 数字 | C3: 数字 | D3: 数字 | E3: 数字
A6: 品质 | B6: 等级 | C6: 升级经验 | D6: 升级总经验 | E6: 需要的战队等级
A7: 0 | B7: 1 | C7: 108 | D7: 0 | E7: 0
A8: 0 | B8: 2 | C8: 116 | D8: =SUM(R7C[-1]:R[-1]C[-1]) -> 108 | E8: 0
A9: 0 | B9: 3 | C9: 124 | D9: =SUM(R7C[-1]:R[-1]C[-1]) -> 224 | E9: 0
A10: 0 | B10: 4 | C10: 132 | D10: =SUM(R7C[-1]:R[-1]C[-1]) -> 348 | E10: 0
A11: 0 | B11: 5 | C11: 140 | D11: =SUM(R7C[-1]:R[-1]C[-1]) -> 480 | E11: 0
A12: 0 | B12: 6 | C12: 148 | D12: =SUM(R7C[-1]:R[-1]C[-1]) -> 620 | E12: 0
A13: 0 | B13: 7 | C13: 156 | D13: =SUM(R7C[-1]:R[-1]C[-1]) -> 768 | E13: 0
A14: 0 | B14: 8 | C14: 164 | D14: =SUM(R7C[-1]:R[-1]C[-1]) -> 924 | E14: 0
A15: 0 | B15: 9 | C15: 172 | D15: =SUM(R7C[-1]:R[-1]C[-1]) -> 1088 | E15: 0
A16: 0 | B16: 10 | C16: 180 | D16: =SUM(R7C[-1]:R[-1]C[-1]) -> 1260 | E16: 0
A17: 0 | B17: 11 | C17: 196 | D17: =SUM(R7C[-1]:R[-1]C[-1]) -> 1440 | E17: 0
A18: 0 | B18: 12 | C18: 212 | D18: =SUM(R7C[-1]:R[-1]C[-1]) -> 1636 | E18: 0
A19: 0 | B19: 13 | C19: 228 | D19: =SUM(R7C[-1]:R[-1]C[-1]) -> 1848 | E19: 0
A20: 0 | B20: 14 | C20: 244 | D20: =SUM(R7C[-1]:R[-1]C[-1]) -> 2076 | E20: 0
A21: 0 | B21: 15 | C21: 260 | D21: =SUM(R7C[-1]:R[-1]C[-1]) -> 2320 | E21: 0
A22: 0 | B22: 16 | C22: 276 | D22: =SUM(R7C[-1]:R[-1]C[-1]) -> 2580 | E22: 0
A23: 0 | B23: 17 | C23: 292 | D23: =SUM(R7C[-1]:R[-1]C[-1]) -> 2856 | E23: 0
A24: 0 | B24: 18 | C24: 308 | D24: =SUM(R7C[-1]:R[-1]C[-1]) -> 3148 | E24: 0
A25: 0 | B25: 19 | C25: 324 | D25: =SUM(R7C[-1]:R[-1]C[-1]) -> 3456 | E25: 0
A26: 0 | B26: 20 | C26: 340 | D26: =SUM(R7C[-1]:R[-1]C[-1]) -> 3780 | E26: 0
A27: 0 | B27: 21 | C27: 364 | D27: =SUM(R7C[-1]:R[-1]C[-1]) -> 4120 | E27: 0
A28: 0 | B28: 22 | C28: 388 | D28: =SUM(R7C[-1]:R[-1]C[-1]) -> 4484 | E28: 0
A29: 0 | B29: 23 | C29: 412 | D29: =SUM(R7C[-1]:R[-1]C[-1]) -> 4872 | E29: 0
A30: 0 | B30: 24 | C30: 436 | D30: =SUM(R7C[-1]:R[-1]C[-1]) -> 5284 | E30: 0
A31: 0 | B31: 25 | C31: 460 | D31: =SUM(R7C[-1]:R[-1]C[-1]) -> 5720 | E31: 0
A32: 0 | B32: 26 | C32: 484 | D32: =SUM(R7C[-1]:R[-1]C[-1]) -> 6180 | E32: 0
A33: 0 | B33: 27 | C33: 508 | D33: =SUM(R7C[-1]:R[-1]C[-1]) -> 6664 | E33: 0
A34: 0 | B34: 28 | C34: 532 | D34: =SUM(R7C[-1]:R[-1]C[-1]) -> 7172 | E34: 0
A35: 0 | B35: 29 | C35: 556 | D35: =SUM(R7C[-1]:R[-1]C[-1]) -> 7704 | E35: 0
A36: 0 | B36: 30 | C36: 580 | D36: =SUM(R7C[-1]:R[-1]C[-1]) -> 8260 | E36: 60
A37: 0 | B37: 31 | C37: 612 | D37: =SUM(R7C[-1]:R[-1]C[-1]) -> 8840 | E37: 60
A38: 0 | B38: 32 | C38: 644 | D38: =SUM(R7C[-1]:R[-1]C[-1]) -> 9452 | E38: 60
A39: 0 | B39: 33 | C39: 676 | D39: =SUM(R7C[-1]:R[-1]C[-1]) -> 10096 | E39: 60
A40: 0 | B40: 34 | C40: 708 | D40: =SUM(R7C[-1]:R[-1]C[-1]) -> 10772 | E40: 60
A41: 0 | B41: 35 | C41: 740 | D41: =SUM(R7C[-1]:R[-1]C[-1]) -> 11480 | E41: 60
A42: 0 | B42: 36 | C42: 772 | D42: =SUM(R7C[-1]:R[-1]C[-1]) -> 12220 | E42: 60
A43: 0 | B43: 37 | C43: 804 | D43: =SUM(R7C[-1]:R[-1]C[-1]) -> 12992 | E43: 60
A44: 0 | B44: 38 | C44: 836 | D44: =SUM(R7C[-1]:R[-1]C[-1]) -> 13796 | E44: 60
A45: 0 | B45: 39 | C45: 868 | D45: =SUM(R7C[-1]:R[-1]C[-1]) -> 14632 | E45: 60
A46: 0 | B46: 40 | C46: 900 | D46: =SUM(R7C[-1]:R[-1]C[-1]) -> 15500 | E46: 70
A47: 0 | B47: 41 | C47: 940 | D47: =SUM(R7C[-1]:R[-1]C[-1]) -> 16400 | E47: 70
A48: 0 | B48: 42 | C48: 980 | D48: =SUM(R7C[-1]:R[-1]C[-1]) -> 17340 | E48: 70
A49: 0 | B49: 43 | C49: 1020 | D49: =SUM(R7C[-1]:R[-1]C[-1]) -> 18320 | E49: 70
A50: 0 | B50: 44 | C50: 1060 | D50: =SUM(R7C[-1]:R[-1]C[-1]) -> 19340 | E50: 70
A51: 0 | B51: 45 | C51: 1100 | D51: =SUM(R7C[-1]:R[-1]C[-1]) -> 20400 | E51: 70
A52: 0 | B52: 46 | C52: 1140 | D52: =SUM(R7C[-1]:R[-1]C[-1]) -> 21500 | E52: 70
A53: 0 | B53: 47 | C53: 1180 | D53: =SUM(R7C[-1]:R[-1]C[-1]) -> 22640 | E53: 70
A54: 0 | B54: 48 | C54: 1220 | D54: =SUM(R7C[-1]:R[-1]C[-1]) -> 23820 | E54: 70
A55: 0 | B55: 49 | C55: 1260 | D55: =SUM(R7C[-1]:R[-1]C[-1]) -> 25040 | E55: 70
A56: 0 | B56: 50 | C56: 1300 | D56: =SUM(R7C[-1]:R[-1]C[-1]) -> 26300 | E56: 80
A57: 0 | B57: 51 | C57: 1348 | D57: =SUM(R7C[-1]:R[-1]C[-1]) -> 27600 | E57: 80
A58: 0 | B58: 52 | C58: 1396 | D58: =SUM(R7C[-1]:R[-1]C[-1]) -> 28948 | E58: 80
A59: 0 | B59: 53 | C59: 1444 | D59: =SUM(R7C[-1]:R[-1]C[-1]) -> 30344 | E59: 80
A60: 0 | B60: 54 | C60: 1492 | D60: =SUM(R7C[-1]:R[-1]C[-1]) -> 31788 | E60: 80
A61: 0 | B61: 55 | C61: 1540 | D61: =SUM(R7C[-1]:R[-1]C[-1]) -> 33280 | E61: 80
A62: 0 | B62: 56 | C62: 1588 | D62: =SUM(R7C[-1]:R[-1]C[-1]) -> 34820 | E62: 80
A63: 0 | B63: 57 | C63: 1636 | D63: =SUM(R7C[-1]:R[-1]C[-1]) -> 36408 | E63: 80
A64: 0 | B64: 58 | C64: 1684 | D64: =SUM(R7C[-1]:R[-1]C[-1]) -> 38044 | E64: 80
A65: 0 | B65: 59 | C65: 1732 | D65: =SUM(R7C[-1]:R[-1]C[-1]) -> 39728 | E65: 80
A66: 0 | B66: 60 | C66: 1780 | D66: =SUM(R7C[-1]:R[-1]C[-1]) -> 41460 | E66: 90
A67: 0 | B67: 61 | C67: 1836 | D67: =SUM(R7C[-1]:R[-1]C[-1]) -> 43240 | E67: 90
A68: 0 | B68: 62 | C68: 1892 | D68: =SUM(R7C[-1]:R[-1]C[-1]) -> 45076 | E68: 90
A69: 0 | B69: 63 | C69: 1948 | D69: =SUM(R7C[-1]:R[-1]C[-1]) -> 46968 | E69: 90
A70: 0 | B70: 64 | C70: 2004 | D70: =SUM(R7C[-1]:R[-1]C[-1]) -> 48916 | E70: 90
A71: 0 | B71: 65 | C71: 2060 | D71: =SUM(R7C[-1]:R[-1]C[-1]) -> 50920 | E71: 90
A72: 0 | B72: 66 | C72: 2116 | D72: =SUM(R7C[-1]:R[-1]C[-1]) -> 52980 | E72: 90
A73: 0 | B73: 67 | C73: 2172 | D73: =SUM(R7C[-1]:R[-1]C[-1]) -> 55096 | E73: 90
A74: 0 | B74: 68 | C74: 2228 | D74: =SUM(R7C[-1]:R[-1]C[-1]) -> 57268 | E74: 90
A75: 0 | B75: 69 | C75: 2284 | D75: =SUM(R7C[-1]:R[-1]C[-1]) -> 59496 | E75: 90
A76: 0 | B76: 70 | C76: 2340 | D76: =SUM(R7C[-1]:R[-1]C[-1]) -> 61780 | E76: 100
A77: 0 | B77: 71 | C77: 2404 | D77: =SUM(R7C[-1]:R[-1]C[-1]) -> 64120 | E77: 100
A78: 0 | B78: 72 | C78: 2468 | D78: =SUM(R7C[-1]:R[-1]C[-1]) -> 66524 | E78: 100
A79: 0 | B79: 73 | C79: 2532 | D79: =SUM(R7C[-1]:R[-1]C[-1]) -> 68992 | E79: 100
A80: 0 | B80: 74 | C80: 2596 | D80: =SUM(R7C[-1]:R[-1]C[-1]) -> 71524 | E80: 100
A81: 0 | B81: 75 | C81: 2660 | D81: =SUM(R7C[-1]:R[-1]C[-1]) -> 74120 | E81: 100
A82: 0 | B82: 76 | C82: 2724 | D82: =SUM(R7C[-1]:R[-1]C[-1]) -> 76780 | E82: 100
A83: 0 | B83: 77 | C83: 2788 | D83: =SUM(R7C[-1]:R[-1]C[-1]) -> 79504 | E83: 100
A84: 0 | B84: 78 | C84: 2852 | D84: =SUM(R7C[-1]:R[-1]C[-1]) -> 82292 | E84: 100
A85: 0 | B85: 79 | C85: 2916 | D85: =SUM(R7C[-1]:R[-1]C[-1]) -> 85144 | E85: 100
A86: 0 | B86: 80 | C86: 2980 | D86: =SUM(R7C[-1]:R[-1]C[-1]) -> 88060 | E86: 110
A87: 0 | B87: 81 | C87: 3052 | D87: =SUM(R7C[-1]:R[-1]C[-1]) -> 91040 | E87: 110
A88: 0 | B88: 82 | C88: 3124 | D88: =SUM(R7C[-1]:R[-1]C[-1]) -> 94092 | E88: 110
A89: 0 | B89: 83 | C89: 3196 | D89: =SUM(R7C[-1]:R[-1]C[-1]) -> 97216 | E89: 110
A90: 0 | B90: 84 | C90: 3268 | D90: =SUM(R7C[-1]:R[-1]C[-1]) -> 100412 | E90: 110
A91: 0 | B91: 85 | C91: 3340 | D91: =SUM(R7C[-1]:R[-1]C[-1]) -> 103680 | E91: 110
A92: 0 | B92: 86 | C92: 3412 | D92: =SUM(R7C[-1]:R[-1]C[-1]) -> 107020 | E92: 110
A93: 0 | B93: 87 | C93: 3484 | D93: =SUM(R7C[-1]:R[-1]C[-1]) -> 110432 | E93: 110
A94: 0 | B94: 88 | C94: 3556 | D94: =SUM(R7C[-1]:R[-1]C[-1]) -> 113916 | E94: 110
A95: 0 | B95: 89 | C95: 3628 | D95: =SUM(R7C[-1]:R[-1]C[-1]) -> 117472 | E95: 110
A96: 0 | B96: 90 | C96: 3700 | D96: =SUM(R7C[-1]:R[-1]C[-1]) -> 121100 | E96: 120
A97: 0 | B97: 91 | C97: 3780 | D97: =SUM(R7C[-1]:R[-1]C[-1]) -> 124800 | E97: 120
A98: 0 | B98: 92 | C98: 3860 | D98: =SUM(R7C[-1]:R[-1]C[-1]) -> 128580 | E98: 120
A99: 0 | B99: 93 | C99: 3940 | D99: =SUM(R7C[-1]:R[-1]C[-1]) -> 132440 | E99: 120
A100: 0 | B100: 94 | C100: 4020 | D100: =SUM(R7C[-1]:R[-1]C[-1]) -> 136380 | E100: 120
A101: 0 | B101: 95 | C101: 4100 | D101: =SUM(R7C[-1]:R[-1]C[-1]) -> 140400 | E101: 120
A102: 0 | B102: 96 | C102: 4180 | D102: =SUM(R7C[-1]:R[-1]C[-1]) -> 144500 | E102: 120
A103: 0 | B103: 97 | C103: 4260 | D103: =SUM(R7C[-1]:R[-1]C[-1]) -> 148680 | E103: 120
A104: 0 | B104: 98 | C104: 4340 | D104: =SUM(R7C[-1]:R[-1]C[-1]) -> 152940 | E104: 120
A105: 0 | B105: 99 | C105: 4420 | D105: =SUM(R7C[-1]:R[-1]C[-1]) -> 157280 | E105: 120
A106: 0 | B106: 100 | C106: 0 | D106: =SUM(R7C[-1]:R[-1]C[-1]) -> 161700 | E106: 130
A107: 1 | B107: 1 | C107: 216 | D107: 0 | E107: =R[-100]C -> 0
A108: 1 | B108: 2 | C108: 232 | D108: =SUM(R107C[-1]:R[-1]C[-1]) -> 216 | E108: =R[-100]C -> 0
A109: 1 | B109: 3 | C109: 248 | D109: =SUM(R107C[-1]:R[-1]C[-1]) -> 448 | E109: =R[-100]C -> 0
A110: 1 | B110: 4 | C110: 264 | D110: =SUM(R107C[-1]:R[-1]C[-1]) -> 696 | E110: =R[-100]C -> 0
A111: 1 | B111: 5 | C111: 280 | D111: =SUM(R107C[-1]:R[-1]C[-1]) -> 960 | E111: =R[-100]C -> 0
A112: 1 | B112: 6 | C112: 296 | D112: =SUM(R107C[-1]:R[-1]C[-1]) -> 1240 | E112: =R[-100]C -> 0
A113: 1 | B113: 7 | C113: 312 | D113: =SUM(R107C[-1]:R[-1]C[-1]) -> 1536 | E113: =R[-100]C -> 0
A114: 1 | B114: 8 | C114: 328 | D114: =SUM(R107C[-1]:R[-1]C[-1]) -> 1848 | E114: =R[-100]C -> 0
A115: 1 | B115: 9 | C115: 344 | D115: =SUM(R107C[-1]:R[-1]C[-1]) -> 2176 | E115: =R[-100]C -> 0
A116: 1 | B116: 10 | C116: 360 | D116: =SUM(R107C[-1]:R[-1]C[-1]) -> 2520 | E116: =R[-100]C -> 0
A117: 1 | B117: 11 | C117: 392 | D117: =SUM(R107C[-1]:R[-1]C[-1]) -> 2880 | E117: =R[-100]C -> 0
A118: 1 | B118: 12 | C118: 424 | D118: =SUM(R107C[-1]:R[-1]C[-1]) -> 3272 | E118: =R[-100]C -> 0
A119: 1 | B119: 13 | C119: 456 | D119: =SUM(R107C[-1]:R[-1]C[-1]) -> 3696 | E119: =R[-100]C -> 0
A120: 1 | B120: 14 | C120: 488 | D120: =SUM(R107C[-1]:R[-1]C[-1]) -> 4152 | E120: =R[-100]C -> 0
A121: 1 | B121: 15 | C121: 520 | D121: =SUM(R107C[-1]:R[-1]C[-1]) -> 4640 | E121: =R[-100]C -> 0
A122: 1 | B122: 16 | C122: 552 | D122: =SUM(R107C[-1]:R[-1]C[-1]) -> 5160 | E122: =R[-100]C -> 0
A123: 1 | B123: 17 | C123: 584 | D123: =SUM(R107C[-1]:R[-1]C[-1]) -> 5712 | E123: =R[-100]C -> 0
A124: 1 | B124: 18 | C124: 616 | D124: =SUM(R107C[-1]:R[-1]C[-1]) -> 6296 | E124: =R[-100]C -> 0
A125: 1 | B125: 19 | C125: 648 | D125: =SUM(R107C[-1]:R[-1]C[-1]) -> 6912 | E125: =R[-100]C -> 0
A126: 1 | B126: 20 | C126: 680 | D126: =SUM(R107C[-1]:R[-1]C[-1]) -> 7560 | E126: =R[-100]C -> 0
A127: 1 | B127: 21 | C127: 728 | D127: =SUM(R107C[-1]:R[-1]C[-1]) -> 8240 | E127: =R[-100]C -> 0
A128: 1 | B128: 22 | C128: 776 | D128: =SUM(R107C[-1]:R[-1]C[-1]) -> 8968 | E128: =R[-100]C -> 0
A129: 1 | B129: 23 | C129: 824 | D129: =SUM(R107C[-1]:R[-1]C[-1]) -> 9744 | E129: =R[-100]C -> 0
A130: 1 | B130: 24 | C130: 872 | D130: =SUM(R107C[-1]:R[-1]C[-1]) -> 10568 | E130: =R[-100]C -> 0
A131: 1 | B131: 25 | C131: 920 | D131: =SUM(R107C[-1]:R[-1]C[-1]) -> 11440 | E131: =R[-100]C -> 0
A132: 1 | B132: 26 | C132: 968 | D132: =SUM(R107C[-1]:R[-1]C[-1]) -> 12360 | E132: =R[-100]C -> 0
A133: 1 | B133: 27 | C133: 1016 | D133: =SUM(R107C[-1]:R[-1]C[-1]) -> 13328 | E133: =R[-100]C -> 0
A134: 1 | B134: 28 | C134: 1064 | D134: =SUM(R107C[-1]:R[-1]C[-1]) -> 14344 | E134: =R[-100]C -> 0
A135: 1 | B135: 29 | C135: 1112 | D135: =SUM(R107C[-1]:R[-1]C[-1]) -> 15408 | E135: =R[-100]C -> 0
A136: 1 | B136: 30 | C136: 1160 | D136: =SUM(R107C[-1]:R[-1]C[-1]) -> 16520 | E136: =R[-100]C -> 60
A137: 1 | B137: 31 | C137: 1224 | D137: =SUM(R107C[-1]:R[-1]C[-1]) -> 17680 | E137: =R[-100]C -> 60
A138: 1 | B138: 32 | C138: 1288 | D138: =SUM(R107C[-1]:R[-1]C[-1]) -> 18904 | E138: =R[-100]C -> 60
A139: 1 | B139: 33 | C139: 1352 | D139: =SUM(R107C[-1]:R[-1]C[-1]) -> 20192 | E139: =R[-100]C -> 60
A140: 1 | B140: 34 | C140: 1416 | D140: =SUM(R107C[-1]:R[-1]C[-1]) -> 21544 | E140: =R[-100]C -> 60
A141: 1 | B141: 35 | C141: 1480 | D141: =SUM(R107C[-1]:R[-1]C[-1]) -> 22960 | E141: =R[-100]C -> 60
A142: 1 | B142: 36 | C142: 1544 | D142: =SUM(R107C[-1]:R[-1]C[-1]) -> 24440 | E142: =R[-100]C -> 60
A143: 1 | B143: 37 | C143: 1608 | D143: =SUM(R107C[-1]:R[-1]C[-1]) -> 25984 | E143: =R[-100]C -> 60
A144: 1 | B144: 38 | C144: 1672 | D144: =SUM(R107C[-1]:R[-1]C[-1]) -> 27592 | E144: =R[-100]C -> 60
A145: 1 | B145: 39 | C145: 1736 | D145: =SUM(R107C[-1]:R[-1]C[-1]) -> 29264 | E145: =R[-100]C -> 60
A146: 1 | B146: 40 | C146: 1800 | D146: =SUM(R107C[-1]:R[-1]C[-1]) -> 31000 | E146: =R[-100]C -> 70
A147: 1 | B147: 41 | C147: 1880 | D147: =SUM(R107C[-1]:R[-1]C[-1]) -> 32800 | E147: =R[-100]C -> 70
A148: 1 | B148: 42 | C148: 1960 | D148: =SUM(R107C[-1]:R[-1]C[-1]) -> 34680 | E148: =R[-100]C -> 70
A149: 1 | B149: 43 | C149: 2040 | D149: =SUM(R107C[-1]:R[-1]C[-1]) -> 36640 | E149: =R[-100]C -> 70
A150: 1 | B150: 44 | C150: 2120 | D150: =SUM(R107C[-1]:R[-1]C[-1]) -> 38680 | E150: =R[-100]C -> 70
A151: 1 | B151: 45 | C151: 2200 | D151: =SUM(R107C[-1]:R[-1]C[-1]) -> 40800 | E151: =R[-100]C -> 70
A152: 1 | B152: 46 | C152: 2280 | D152: =SUM(R107C[-1]:R[-1]C[-1]) -> 43000 | E152: =R[-100]C -> 70
A153: 1 | B153: 47 | C153: 2360 | D153: =SUM(R107C[-1]:R[-1]C[-1]) -> 45280 | E153: =R[-100]C -> 70
A154: 1 | B154: 48 | C154: 2440 | D154: =SUM(R107C[-1]:R[-1]C[-1]) -> 47640 | E154: =R[-100]C -> 70
A155: 1 | B155: 49 | C155: 2520 | D155: =SUM(R107C[-1]:R[-1]C[-1]) -> 50080 | E155: =R[-100]C -> 70
A156: 1 | B156: 50 | C156: 2600 | D156: =SUM(R107C[-1]:R[-1]C[-1]) -> 52600 | E156: =R[-100]C -> 80
A157: 1 | B157: 51 | C157: 2696 | D157: =SUM(R107C[-1]:R[-1]C[-1]) -> 55200 | E157: =R[-100]C -> 80
A158: 1 | B158: 52 | C158: 2792 | D158: =SUM(R107C[-1]:R[-1]C[-1]) -> 57896 | E158: =R[-100]C -> 80
A159: 1 | B159: 53 | C159: 2888 | D159: =SUM(R107C[-1]:R[-1]C[-1]) -> 60688 | E159: =R[-100]C -> 80
A160: 1 | B160: 54 | C160: 2984 | D160: =SUM(R107C[-1]:R[-1]C[-1]) -> 63576 | E160: =R[-100]C -> 80
A161: 1 | B161: 55 | C161: 3080 | D161: =SUM(R107C[-1]:R[-1]C[-1]) -> 66560 | E161: =R[-100]C -> 80
A162: 1 | B162: 56 | C162: 3176 | D162: =SUM(R107C[-1]:R[-1]C[-1]) -> 69640 | E162: =R[-100]C -> 80
A163: 1 | B163: 57 | C163: 3272 | D163: =SUM(R107C[-1]:R[-1]C[-1]) -> 72816 | E163: =R[-100]C -> 80
A164: 1 | B164: 58 | C164: 3368 | D164: =SUM(R107C[-1]:R[-1]C[-1]) -> 76088 | E164: =R[-100]C -> 80
A165: 1 | B165: 59 | C165: 3464 | D165: =SUM(R107C[-1]:R[-1]C[-1]) -> 79456 | E165: =R[-100]C -> 80
A166: 1 | B166: 60 | C166: 3560 | D166: =SUM(R107C[-1]:R[-1]C[-1]) -> 82920 | E166: =R[-100]C -> 90
A167: 1 | B167: 61 | C167: 3672 | D167: =SUM(R107C[-1]:R[-1]C[-1]) -> 86480 | E167: =R[-100]C -> 90
A168: 1 | B168: 62 | C168: 3784 | D168: =SUM(R107C[-1]:R[-1]C[-1]) -> 90152 | E168: =R[-100]C -> 90
A169: 1 | B169: 63 | C169: 3896 | D169: =SUM(R107C[-1]:R[-1]C[-1]) -> 93936 | E169: =R[-100]C -> 90
A170: 1 | B170: 64 | C170: 4008 | D170: =SUM(R107C[-1]:R[-1]C[-1]) -> 97832 | E170: =R[-100]C -> 90
A171: 1 | B171: 65 | C171: 4120 | D171: =SUM(R107C[-1]:R[-1]C[-1]) -> 101840 | E171: =R[-100]C -> 90
A172: 1 | B172: 66 | C172: 4232 | D172: =SUM(R107C[-1]:R[-1]C[-1]) -> 105960 | E172: =R[-100]C -> 90
A173: 1 | B173: 67 | C173: 4344 | D173: =SUM(R107C[-1]:R[-1]C[-1]) -> 110192 | E173: =R[-100]C -> 90
A174: 1 | B174: 68 | C174: 4456 | D174: =SUM(R107C[-1]:R[-1]C[-1]) -> 114536 | E174: =R[-100]C -> 90
A175: 1 | B175: 69 | C175: 4568 | D175: =SUM(R107C[-1]:R[-1]C[-1]) -> 118992 | E175: =R[-100]C -> 90
A176: 1 | B176: 70 | C176: 4680 | D176: =SUM(R107C[-1]:R[-1]C[-1]) -> 123560 | E176: =R[-100]C -> 100
A177: 1 | B177: 71 | C177: 4808 | D177: =SUM(R107C[-1]:R[-1]C[-1]) -> 128240 | E177: =R[-100]C -> 100
A178: 1 | B178: 72 | C178: 4936 | D178: =SUM(R107C[-1]:R[-1]C[-1]) -> 133048 | E178: =R[-100]C -> 100
A179: 1 | B179: 73 | C179: 5064 | D179: =SUM(R107C[-1]:R[-1]C[-1]) -> 137984 | E179: =R[-100]C -> 100
A180: 1 | B180: 74 | C180: 5192 | D180: =SUM(R107C[-1]:R[-1]C[-1]) -> 143048 | E180: =R[-100]C -> 100
A181: 1 | B181: 75 | C181: 5320 | D181: =SUM(R107C[-1]:R[-1]C[-1]) -> 148240 | E181: =R[-100]C -> 100
A182: 1 | B182: 76 | C182: 5448 | D182: =SUM(R107C[-1]:R[-1]C[-1]) -> 153560 | E182: =R[-100]C -> 100
A183: 1 | B183: 77 | C183: 5576 | D183: =SUM(R107C[-1]:R[-1]C[-1]) -> 159008 | E183: =R[-100]C -> 100
A184: 1 | B184: 78 | C184: 5704 | D184: =SUM(R107C[-1]:R[-1]C[-1]) -> 164584 | E184: =R[-100]C -> 100
A185: 1 | B185: 79 | C185: 5832 | D185: =SUM(R107C[-1]:R[-1]C[-1]) -> 170288 | E185: =R[-100]C -> 100
A186: 1 | B186: 80 | C186: 5960 | D186: =SUM(R107C[-1]:R[-1]C[-1]) -> 176120 | E186: =R[-100]C -> 110
A187: 1 | B187: 81 | C187: 6104 | D187: =SUM(R107C[-1]:R[-1]C[-1]) -> 182080 | E187: =R[-100]C -> 110
A188: 1 | B188: 82 | C188: 6248 | D188: =SUM(R107C[-1]:R[-1]C[-1]) -> 188184 | E188: =R[-100]C -> 110
A189: 1 | B189: 83 | C189: 6392 | D189: =SUM(R107C[-1]:R[-1]C[-1]) -> 194432 | E189: =R[-100]C -> 110
A190: 1 | B190: 84 | C190: 6536 | D190: =SUM(R107C[-1]:R[-1]C[-1]) -> 200824 | E190: =R[-100]C -> 110
A191: 1 | B191: 85 | C191: 6680 | D191: =SUM(R107C[-1]:R[-1]C[-1]) -> 207360 | E191: =R[-100]C -> 110
A192: 1 | B192: 86 | C192: 6824 | D192: =SUM(R107C[-1]:R[-1]C[-1]) -> 214040 | E192: =R[-100]C -> 110
A193: 1 | B193: 87 | C193: 6968 | D193: =SUM(R107C[-1]:R[-1]C[-1]) -> 220864 | E193: =R[-100]C -> 110
A194: 1 | B194: 88 | C194: 7112 | D194: =SUM(R107C[-1]:R[-1]C[-1]) -> 227832 | E194: =R[-100]C -> 110
A195: 1 | B195: 89 | C195: 7256 | D195: =SUM(R107C[-1]:R[-1]C[-1]) -> 234944 | E195: =R[-100]C -> 110
A196: 1 | B196: 90 | C196: 7400 | D196: =SUM(R107C[-1]:R[-1]C[-1]) -> 242200 | E196: =R[-100]C -> 120
A197: 1 | B197: 91 | C197: 7560 | D197: =SUM(R107C[-1]:R[-1]C[-1]) -> 249600 | E197: =R[-100]C -> 120
A198: 1 | B198: 92 | C198: 7720 | D198: =SUM(R107C[-1]:R[-1]C[-1]) -> 257160 | E198: =R[-100]C -> 120
A199: 1 | B199: 93 | C199: 7880 | D199: =SUM(R107C[-1]:R[-1]C[-1]) -> 264880 | E199: =R[-100]C -> 120
A200: 1 | B200: 94 | C200: 8040 | D200: =SUM(R107C[-1]:R[-1]C[-1]) -> 272760 | E200: =R[-100]C -> 120
A201: 1 | B201: 95 | C201: 8200 | D201: =SUM(R107C[-1]:R[-1]C[-1]) -> 280800 | E201: =R[-100]C -> 120
A202: 1 | B202: 96 | C202: 8360 | D202: =SUM(R107C[-1]:R[-1]C[-1]) -> 289000 | E202: =R[-100]C -> 120
A203: 1 | B203: 97 | C203: 8520 | D203: =SUM(R107C[-1]:R[-1]C[-1]) -> 297360 | E203: =R[-100]C -> 120
A204: 1 | B204: 98 | C204: 8680 | D204: =SUM(R107C[-1]:R[-1]C[-1]) -> 305880 | E204: =R[-100]C -> 120
A205: 1 | B205: 99 | C205: 8840 | D205: =SUM(R107C[-1]:R[-1]C[-1]) -> 314560 | E205: =R[-100]C -> 120
A206: 1 | B206: 100 | C206: 0 | D206: =SUM(R107C[-1]:R[-1]C[-1]) -> 323400 | E206: =R[-100]C -> 130
A207: 2 | B207: 1 | C207: 324 | D207: 0 | E207: =R[-100]C -> 0
A208: 2 | B208: 2 | C208: 348 | D208: =SUM(R207C[-1]:R[-1]C[-1]) -> 324 | E208: =R[-100]C -> 0
A209: 2 | B209: 3 | C209: 372 | D209: =SUM(R207C[-1]:R[-1]C[-1]) -> 672 | E209: =R[-100]C -> 0
A210: 2 | B210: 4 | C210: 396 | D210: =SUM(R207C[-1]:R[-1]C[-1]) -> 1044 | E210: =R[-100]C -> 0
A211: 2 | B211: 5 | C211: 420 | D211: =SUM(R207C[-1]:R[-1]C[-1]) -> 1440 | E211: =R[-100]C -> 0
A212: 2 | B212: 6 | C212: 444 | D212: =SUM(R207C[-1]:R[-1]C[-1]) -> 1860 | E212: =R[-100]C -> 0
A213: 2 | B213: 7 | C213: 468 | D213: =SUM(R207C[-1]:R[-1]C[-1]) -> 2304 | E213: =R[-100]C -> 0
A214: 2 | B214: 8 | C214: 492 | D214: =SUM(R207C[-1]:R[-1]C[-1]) -> 2772 | E214: =R[-100]C -> 0
A215: 2 | B215: 9 | C215: 516 | D215: =SUM(R207C[-1]:R[-1]C[-1]) -> 3264 | E215: =R[-100]C -> 0
A216: 2 | B216: 10 | C216: 540 | D216: =SUM(R207C[-1]:R[-1]C[-1]) -> 3780 | E216: =R[-100]C -> 0
A217: 2 | B217: 11 | C217: 588 | D217: =SUM(R207C[-1]:R[-1]C[-1]) -> 4320 | E217: =R[-100]C -> 0
A218: 2 | B218: 12 | C218: 636 | D218: =SUM(R207C[-1]:R[-1]C[-1]) -> 4908 | E218: =R[-100]C -> 0
A219: 2 | B219: 13 | C219: 684 | D219: =SUM(R207C[-1]:R[-1]C[-1]) -> 5544 | E219: =R[-100]C -> 0
A220: 2 | B220: 14 | C220: 732 | D220: =SUM(R207C[-1]:R[-1]C[-1]) -> 6228 | E220: =R[-100]C -> 0
A221: 2 | B221: 15 | C221: 780 | D221: =SUM(R207C[-1]:R[-1]C[-1]) -> 6960 | E221: =R[-100]C -> 0
A222: 2 | B222: 16 | C222: 828 | D222: =SUM(R207C[-1]:R[-1]C[-1]) -> 7740 | E222: =R[-100]C -> 0
A223: 2 | B223: 17 | C223: 876 | D223: =SUM(R207C[-1]:R[-1]C[-1]) -> 8568 | E223: =R[-100]C -> 0
A224: 2 | B224: 18 | C224: 924 | D224: =SUM(R207C[-1]:R[-1]C[-1]) -> 9444 | E224: =R[-100]C -> 0
A225: 2 | B225: 19 | C225: 972 | D225: =SUM(R207C[-1]:R[-1]C[-1]) -> 10368 | E225: =R[-100]C -> 0
A226: 2 | B226: 20 | C226: 1020 | D226: =SUM(R207C[-1]:R[-1]C[-1]) -> 11340 | E226: =R[-100]C -> 0
A227: 2 | B227: 21 | C227: 1092 | D227: =SUM(R207C[-1]:R[-1]C[-1]) -> 12360 | E227: =R[-100]C -> 0
A228: 2 | B228: 22 | C228: 1164 | D228: =SUM(R207C[-1]:R[-1]C[-1]) -> 13452 | E228: =R[-100]C -> 0
A229: 2 | B229: 23 | C229: 1236 | D229: =SUM(R207C[-1]:R[-1]C[-1]) -> 14616 | E229: =R[-100]C -> 0
A230: 2 | B230: 24 | C230: 1308 | D230: =SUM(R207C[-1]:R[-1]C[-1]) -> 15852 | E230: =R[-100]C -> 0
A231: 2 | B231: 25 | C231: 1380 | D231: =SUM(R207C[-1]:R[-1]C[-1]) -> 17160 | E231: =R[-100]C -> 0
A232: 2 | B232: 26 | C232: 1452 | D232: =SUM(R207C[-1]:R[-1]C[-1]) -> 18540 | E232: =R[-100]C -> 0
A233: 2 | B233: 27 | C233: 1524 | D233: =SUM(R207C[-1]:R[-1]C[-1]) -> 19992 | E233: =R[-100]C -> 0
A234: 2 | B234: 28 | C234: 1596 | D234: =SUM(R207C[-1]:R[-1]C[-1]) -> 21516 | E234: =R[-100]C -> 0
A235: 2 | B235: 29 | C235: 1668 | D235: =SUM(R207C[-1]:R[-1]C[-1]) -> 23112 | E235: =R[-100]C -> 0
A236: 2 | B236: 30 | C236: 1740 | D236: =SUM(R207C[-1]:R[-1]C[-1]) -> 24780 | E236: =R[-100]C -> 60
A237: 2 | B237: 31 | C237: 1836 | D237: =SUM(R207C[-1]:R[-1]C[-1]) -> 26520 | E237: =R[-100]C -> 60
A238: 2 | B238: 32 | C238: 1932 | D238: =SUM(R207C[-1]:R[-1]C[-1]) -> 28356 | E238: =R[-100]C -> 60
A239: 2 | B239: 33 | C239: 2028 | D239: =SUM(R207C[-1]:R[-1]C[-1]) -> 30288 | E239: =R[-100]C -> 60
A240: 2 | B240: 34 | C240: 2124 | D240: =SUM(R207C[-1]:R[-1]C[-1]) -> 32316 | E240: =R[-100]C -> 60
A241: 2 | B241: 35 | C241: 2220 | D241: =SUM(R207C[-1]:R[-1]C[-1]) -> 34440 | E241: =R[-100]C -> 60
A242: 2 | B242: 36 | C242: 2316 | D242: =SUM(R207C[-1]:R[-1]C[-1]) -> 36660 | E242: =R[-100]C -> 60
A243: 2 | B243: 37 | C243: 2412 | D243: =SUM(R207C[-1]:R[-1]C[-1]) -> 38976 | E243: =R[-100]C -> 60
A244: 2 | B244: 38 | C244: 2508 | D244: =SUM(R207C[-1]:R[-1]C[-1]) -> 41388 | E244: =R[-100]C -> 60
A245: 2 | B245: 39 | C245: 2604 | D245: =SUM(R207C[-1]:R[-1]C[-1]) -> 43896 | E245: =R[-100]C -> 60
A246: 2 | B246: 40 | C246: 2700 | D246: =SUM(R207C[-1]:R[-1]C[-1]) -> 46500 | E246: =R[-100]C -> 70
A247: 2 | B247: 41 | C247: 2820 | D247: =SUM(R207C[-1]:R[-1]C[-1]) -> 49200 | E247: =R[-100]C -> 70
A248: 2 | B248: 42 | C248: 2940 | D248: =SUM(R207C[-1]:R[-1]C[-1]) -> 52020 | E248: =R[-100]C -> 70
A249: 2 | B249: 43 | C249: 3060 | D249: =SUM(R207C[-1]:R[-1]C[-1]) -> 54960 | E249: =R[-100]C -> 70
A250: 2 | B250: 44 | C250: 3180 | D250: =SUM(R207C[-1]:R[-1]C[-1]) -> 58020 | E250: =R[-100]C -> 70
A251: 2 | B251: 45 | C251: 3300 | D251: =SUM(R207C[-1]:R[-1]C[-1]) -> 61200 | E251: =R[-100]C -> 70
A252: 2 | B252: 46 | C252: 3420 | D252: =SUM(R207C[-1]:R[-1]C[-1]) -> 64500 | E252: =R[-100]C -> 70
A253: 2 | B253: 47 | C253: 3540 | D253: =SUM(R207C[-1]:R[-1]C[-1]) -> 67920 | E253: =R[-100]C -> 70
A254: 2 | B254: 48 | C254: 3660 | D254: =SUM(R207C[-1]:R[-1]C[-1]) -> 71460 | E254: =R[-100]C -> 70
A255: 2 | B255: 49 | C255: 3780 | D255: =SUM(R207C[-1]:R[-1]C[-1]) -> 75120 | E255: =R[-100]C -> 70
A256: 2 | B256: 50 | C256: 3900 | D256: =SUM(R207C[-1]:R[-1]C[-1]) -> 78900 | E256: =R[-100]C -> 80
A257: 2 | B257: 51 | C257: 4044 | D257: =SUM(R207C[-1]:R[-1]C[-1]) -> 82800 | E257: =R[-100]C -> 80
A258: 2 | B258: 52 | C258: 4188 | D258: =SUM(R207C[-1]:R[-1]C[-1]) -> 86844 | E258: =R[-100]C -> 80
A259: 2 | B259: 53 | C259: 4332 | D259: =SUM(R207C[-1]:R[-1]C[-1]) -> 91032 | E259: =R[-100]C -> 80
A260: 2 | B260: 54 | C260: 4476 | D260: =SUM(R207C[-1]:R[-1]C[-1]) -> 95364 | E260: =R[-100]C -> 80
A261: 2 | B261: 55 | C261: 4620 | D261: =SUM(R207C[-1]:R[-1]C[-1]) -> 99840 | E261: =R[-100]C -> 80
A262: 2 | B262: 56 | C262: 4764 | D262: =SUM(R207C[-1]:R[-1]C[-1]) -> 104460 | E262: =R[-100]C -> 80
A263: 2 | B263: 57 | C263: 4908 | D263: =SUM(R207C[-1]:R[-1]C[-1]) -> 109224 | E263: =R[-100]C -> 80
A264: 2 | B264: 58 | C264: 5052 | D264: =SUM(R207C[-1]:R[-1]C[-1]) -> 114132 | E264: =R[-100]C -> 80
A265: 2 | B265: 59 | C265: 5196 | D265: =SUM(R207C[-1]:R[-1]C[-1]) -> 119184 | E265: =R[-100]C -> 80
A266: 2 | B266: 60 | C266: 5340 | D266: =SUM(R207C[-1]:R[-1]C[-1]) -> 124380 | E266: =R[-100]C -> 90
A267: 2 | B267: 61 | C267: 5508 | D267: =SUM(R207C[-1]:R[-1]C[-1]) -> 129720 | E267: =R[-100]C -> 90
A268: 2 | B268: 62 | C268: 5676 | D268: =SUM(R207C[-1]:R[-1]C[-1]) -> 135228 | E268: =R[-100]C -> 90
A269: 2 | B269: 63 | C269: 5844 | D269: =SUM(R207C[-1]:R[-1]C[-1]) -> 140904 | E269: =R[-100]C -> 90
A270: 2 | B270: 64 | C270: 6012 | D270: =SUM(R207C[-1]:R[-1]C[-1]) -> 146748 | E270: =R[-100]C -> 90
A271: 2 | B271: 65 | C271: 6180 | D271: =SUM(R207C[-1]:R[-1]C[-1]) -> 152760 | E271: =R[-100]C -> 90
A272: 2 | B272: 66 | C272: 6348 | D272: =SUM(R207C[-1]:R[-1]C[-1]) -> 158940 | E272: =R[-100]C -> 90
A273: 2 | B273: 67 | C273: 6516 | D273: =SUM(R207C[-1]:R[-1]C[-1]) -> 165288 | E273: =R[-100]C -> 90
A274: 2 | B274: 68 | C274: 6684 | D274: =SUM(R207C[-1]:R[-1]C[-1]) -> 171804 | E274: =R[-100]C -> 90
A275: 2 | B275: 69 | C275: 6852 | D275: =SUM(R207C[-1]:R[-1]C[-1]) -> 178488 | E275: =R[-100]C -> 90
A276: 2 | B276: 70 | C276: 7020 | D276: =SUM(R207C[-1]:R[-1]C[-1]) -> 185340 | E276: =R[-100]C -> 100
A277: 2 | B277: 71 | C277: 7212 | D277: =SUM(R207C[-1]:R[-1]C[-1]) -> 192360 | E277: =R[-100]C -> 100
A278: 2 | B278: 72 | C278: 7404 | D278: =SUM(R207C[-1]:R[-1]C[-1]) -> 199572 | E278: =R[-100]C -> 100
A279: 2 | B279: 73 | C279: 7596 | D279: =SUM(R207C[-1]:R[-1]C[-1]) -> 206976 | E279: =R[-100]C -> 100
A280: 2 | B280: 74 | C280: 7788 | D280: =SUM(R207C[-1]:R[-1]C[-1]) -> 214572 | E280: =R[-100]C -> 100
A281: 2 | B281: 75 | C281: 7980 | D281: =SUM(R207C[-1]:R[-1]C[-1]) -> 222360 | E281: =R[-100]C -> 100
A282: 2 | B282: 76 | C282: 8172 | D282: =SUM(R207C[-1]:R[-1]C[-1]) -> 230340 | E282: =R[-100]C -> 100
A283: 2 | B283: 77 | C283: 8364 | D283: =SUM(R207C[-1]:R[-1]C[-1]) -> 238512 | E283: =R[-100]C -> 100
A284: 2 | B284: 78 | C284: 8556 | D284: =SUM(R207C[-1]:R[-1]C[-1]) -> 246876 | E284: =R[-100]C -> 100
A285: 2 | B285: 79 | C285: 8748 | D285: =SUM(R207C[-1]:R[-1]C[-1]) -> 255432 | E285: =R[-100]C -> 100
A286: 2 | B286: 80 | C286: 8940 | D286: =SUM(R207C[-1]:R[-1]C[-1]) -> 264180 | E286: =R[-100]C -> 110
A287: 2 | B287: 81 | C287: 9156 | D287: =SUM(R207C[-1]:R[-1]C[-1]) -> 273120 | E287: =R[-100]C -> 110
A288: 2 | B288: 82 | C288: 9372 | D288: =SUM(R207C[-1]:R[-1]C[-1]) -> 282276 | E288: =R[-100]C -> 110
A289: 2 | B289: 83 | C289: 9588 | D289: =SUM(R207C[-1]:R[-1]C[-1]) -> 291648 | E289: =R[-100]C -> 110
A290: 2 | B290: 84 | C290: 9804 | D290: =SUM(R207C[-1]:R[-1]C[-1]) -> 301236 | E290: =R[-100]C -> 110
A291: 2 | B291: 85 | C291: 10020 | D291: =SUM(R207C[-1]:R[-1]C[-1]) -> 311040 | E291: =R[-100]C -> 110
A292: 2 | B292: 86 | C292: 10236 | D292: =SUM(R207C[-1]:R[-1]C[-1]) -> 321060 | E292: =R[-100]C -> 110
A293: 2 | B293: 87 | C293: 10452 | D293: =SUM(R207C[-1]:R[-1]C[-1]) -> 331296 | E293: =R[-100]C -> 110
A294: 2 | B294: 88 | C294: 10668 | D294: =SUM(R207C[-1]:R[-1]C[-1]) -> 341748 | E294: =R[-100]C -> 110
A295: 2 | B295: 89 | C295: 10884 | D295: =SUM(R207C[-1]:R[-1]C[-1]) -> 352416 | E295: =R[-100]C -> 110
A296: 2 | B296: 90 | C296: 11100 | D296: =SUM(R207C[-1]:R[-1]C[-1]) -> 363300 | E296: =R[-100]C -> 120
A297: 2 | B297: 91 | C297: 11340 | D297: =SUM(R207C[-1]:R[-1]C[-1]) -> 374400 | E297: =R[-100]C -> 120
A298: 2 | B298: 92 | C298: 11580 | D298: =SUM(R207C[-1]:R[-1]C[-1]) -> 385740 | E298: =R[-100]C -> 120
A299: 2 | B299: 93 | C299: 11820 | D299: =SUM(R207C[-1]:R[-1]C[-1]) -> 397320 | E299: =R[-100]C -> 120
A300: 2 | B300: 94 | C300: 12060 | D300: =SUM(R207C[-1]:R[-1]C[-1]) -> 409140 | E300: =R[-100]C -> 120
A301: 2 | B301: 95 | C301: 12300 | D301: =SUM(R207C[-1]:R[-1]C[-1]) -> 421200 | E301: =R[-100]C -> 120
A302: 2 | B302: 96 | C302: 12540 | D302: =SUM(R207C[-1]:R[-1]C[-1]) -> 433500 | E302: =R[-100]C -> 120
A303: 2 | B303: 97 | C303: 12780 | D303: =SUM(R207C[-1]:R[-1]C[-1]) -> 446040 | E303: =R[-100]C -> 120
A304: 2 | B304: 98 | C304: 13020 | D304: =SUM(R207C[-1]:R[-1]C[-1]) -> 458820 | E304: =R[-100]C -> 120
A305: 2 | B305: 99 | C305: 13260 | D305: =SUM(R207C[-1]:R[-1]C[-1]) -> 471840 | E305: =R[-100]C -> 120
A306: 2 | B306: 100 | C306: 0 | D306: =SUM(R207C[-1]:R[-1]C[-1]) -> 485100 | E306: =R[-100]C -> 130
A307: 3 | B307: 1 | C307: 432 | D307: 0 | E307: =R[-100]C -> 0
A308: 3 | B308: 2 | C308: 464 | D308: =SUM(R307C[-1]:R[-1]C[-1]) -> 432 | E308: =R[-100]C -> 0
A309: 3 | B309: 3 | C309: 496 | D309: =SUM(R307C[-1]:R[-1]C[-1]) -> 896 | E309: =R[-100]C -> 0
A310: 3 | B310: 4 | C310: 528 | D310: =SUM(R307C[-1]:R[-1]C[-1]) -> 1392 | E310: =R[-100]C -> 0
A311: 3 | B311: 5 | C311: 560 | D311: =SUM(R307C[-1]:R[-1]C[-1]) -> 1920 | E311: =R[-100]C -> 0
A312: 3 | B312: 6 | C312: 592 | D312: =SUM(R307C[-1]:R[-1]C[-1]) -> 2480 | E312: =R[-100]C -> 0
A313: 3 | B313: 7 | C313: 624 | D313: =SUM(R307C[-1]:R[-1]C[-1]) -> 3072 | E313: =R[-100]C -> 0
A314: 3 | B314: 8 | C314: 656 | D314: =SUM(R307C[-1]:R[-1]C[-1]) -> 3696 | E314: =R[-100]C -> 0
A315: 3 | B315: 9 | C315: 688 | D315: =SUM(R307C[-1]:R[-1]C[-1]) -> 4352 | E315: =R[-100]C -> 0
A316: 3 | B316: 10 | C316: 720 | D316: =SUM(R307C[-1]:R[-1]C[-1]) -> 5040 | E316: =R[-100]C -> 0
A317: 3 | B317: 11 | C317: 784 | D317: =SUM(R307C[-1]:R[-1]C[-1]) -> 5760 | E317: =R[-100]C -> 0
A318: 3 | B318: 12 | C318: 848 | D318: =SUM(R307C[-1]:R[-1]C[-1]) -> 6544 | E318: =R[-100]C -> 0
A319: 3 | B319: 13 | C319: 912 | D319: =SUM(R307C[-1]:R[-1]C[-1]) -> 7392 | E319: =R[-100]C -> 0
A320: 3 | B320: 14 | C320: 976 | D320: =SUM(R307C[-1]:R[-1]C[-1]) -> 8304 | E320: =R[-100]C -> 0
A321: 3 | B321: 15 | C321: 1040 | D321: =SUM(R307C[-1]:R[-1]C[-1]) -> 9280 | E321: =R[-100]C -> 0
A322: 3 | B322: 16 | C322: 1104 | D322: =SUM(R307C[-1]:R[-1]C[-1]) -> 10320 | E322: =R[-100]C -> 0
A323: 3 | B323: 17 | C323: 1168 | D323: =SUM(R307C[-1]:R[-1]C[-1]) -> 11424 | E323: =R[-100]C -> 0
A324: 3 | B324: 18 | C324: 1232 | D324: =SUM(R307C[-1]:R[-1]C[-1]) -> 12592 | E324: =R[-100]C -> 0
A325: 3 | B325: 19 | C325: 1296 | D325: =SUM(R307C[-1]:R[-1]C[-1]) -> 13824 | E325: =R[-100]C -> 0
A326: 3 | B326: 20 | C326: 1360 | D326: =SUM(R307C[-1]:R[-1]C[-1]) -> 15120 | E326: =R[-100]C -> 0
A327: 3 | B327: 21 | C327: 1456 | D327: =SUM(R307C[-1]:R[-1]C[-1]) -> 16480 | E327: =R[-100]C -> 0
A328: 3 | B328: 22 | C328: 1552 | D328: =SUM(R307C[-1]:R[-1]C[-1]) -> 17936 | E328: =R[-100]C -> 0
A329: 3 | B329: 23 | C329: 1648 | D329: =SUM(R307C[-1]:R[-1]C[-1]) -> 19488 | E329: =R[-100]C -> 0
A330: 3 | B330: 24 | C330: 1744 | D330: =SUM(R307C[-1]:R[-1]C[-1]) -> 21136 | E330: =R[-100]C -> 0
A331: 3 | B331: 25 | C331: 1840 | D331: =SUM(R307C[-1]:R[-1]C[-1]) -> 22880 | E331: =R[-100]C -> 0
A332: 3 | B332: 26 | C332: 1936 | D332: =SUM(R307C[-1]:R[-1]C[-1]) -> 24720 | E332: =R[-100]C -> 0
A333: 3 | B333: 27 | C333: 2032 | D333: =SUM(R307C[-1]:R[-1]C[-1]) -> 26656 | E333: =R[-100]C -> 0
A334: 3 | B334: 28 | C334: 2128 | D334: =SUM(R307C[-1]:R[-1]C[-1]) -> 28688 | E334: =R[-100]C -> 0
A335: 3 | B335: 29 | C335: 2224 | D335: =SUM(R307C[-1]:R[-1]C[-1]) -> 30816 | E335: =R[-100]C -> 0
A336: 3 | B336: 30 | C336: 2320 | D336: =SUM(R307C[-1]:R[-1]C[-1]) -> 33040 | E336: =R[-100]C -> 60
A337: 3 | B337: 31 | C337: 2448 | D337: =SUM(R307C[-1]:R[-1]C[-1]) -> 35360 | E337: =R[-100]C -> 60
A338: 3 | B338: 32 | C338: 2576 | D338: =SUM(R307C[-1]:R[-1]C[-1]) -> 37808 | E338: =R[-100]C -> 60
A339: 3 | B339: 33 | C339: 2704 | D339: =SUM(R307C[-1]:R[-1]C[-1]) -> 40384 | E339: =R[-100]C -> 60
A340: 3 | B340: 34 | C340: 2832 | D340: =SUM(R307C[-1]:R[-1]C[-1]) -> 43088 | E340: =R[-100]C -> 60
A341: 3 | B341: 35 | C341: 2960 | D341: =SUM(R307C[-1]:R[-1]C[-1]) -> 45920 | E341: =R[-100]C -> 60
A342: 3 | B342: 36 | C342: 3088 | D342: =SUM(R307C[-1]:R[-1]C[-1]) -> 48880 | E342: =R[-100]C -> 60
A343: 3 | B343: 37 | C343: 3216 | D343: =SUM(R307C[-1]:R[-1]C[-1]) -> 51968 | E343: =R[-100]C -> 60
A344: 3 | B344: 38 | C344: 3344 | D344: =SUM(R307C[-1]:R[-1]C[-1]) -> 55184 | E344: =R[-100]C -> 60
A345: 3 | B345: 39 | C345: 3472 | D345: =SUM(R307C[-1]:R[-1]C[-1]) -> 58528 | E345: =R[-100]C -> 60
A346: 3 | B346: 40 | C346: 3600 | D346: =SUM(R307C[-1]:R[-1]C[-1]) -> 62000 | E346: =R[-100]C -> 70
A347: 3 | B347: 41 | C347: 3760 | D347: =SUM(R307C[-1]:R[-1]C[-1]) -> 65600 | E347: =R[-100]C -> 70
A348: 3 | B348: 42 | C348: 3920 | D348: =SUM(R307C[-1]:R[-1]C[-1]) -> 69360 | E348: =R[-100]C -> 70
A349: 3 | B349: 43 | C349: 4080 | D349: =SUM(R307C[-1]:R[-1]C[-1]) -> 73280 | E349: =R[-100]C -> 70
A350: 3 | B350: 44 | C350: 4240 | D350: =SUM(R307C[-1]:R[-1]C[-1]) -> 77360 | E350: =R[-100]C -> 70
A351: 3 | B351: 45 | C351: 4400 | D351: =SUM(R307C[-1]:R[-1]C[-1]) -> 81600 | E351: =R[-100]C -> 70
A352: 3 | B352: 46 | C352: 4560 | D352: =SUM(R307C[-1]:R[-1]C[-1]) -> 86000 | E352: =R[-100]C -> 70
A353: 3 | B353: 47 | C353: 4720 | D353: =SUM(R307C[-1]:R[-1]C[-1]) -> 90560 | E353: =R[-100]C -> 70
A354: 3 | B354: 48 | C354: 4880 | D354: =SUM(R307C[-1]:R[-1]C[-1]) -> 95280 | E354: =R[-100]C -> 70
A355: 3 | B355: 49 | C355: 5040 | D355: =SUM(R307C[-1]:R[-1]C[-1]) -> 100160 | E355: =R[-100]C -> 70
A356: 3 | B356: 50 | C356: 5200 | D356: =SUM(R307C[-1]:R[-1]C[-1]) -> 105200 | E356: =R[-100]C -> 80
A357: 3 | B357: 51 | C357: 5392 | D357: =SUM(R307C[-1]:R[-1]C[-1]) -> 110400 | E357: =R[-100]C -> 80
A358: 3 | B358: 52 | C358: 5584 | D358: =SUM(R307C[-1]:R[-1]C[-1]) -> 115792 | E358: =R[-100]C -> 80
A359: 3 | B359: 53 | C359: 5776 | D359: =SUM(R307C[-1]:R[-1]C[-1]) -> 121376 | E359: =R[-100]C -> 80
A360: 3 | B360: 54 | C360: 5968 | D360: =SUM(R307C[-1]:R[-1]C[-1]) -> 127152 | E360: =R[-100]C -> 80
A361: 3 | B361: 55 | C361: 6160 | D361: =SUM(R307C[-1]:R[-1]C[-1]) -> 133120 | E361: =R[-100]C -> 80
A362: 3 | B362: 56 | C362: 6352 | D362: =SUM(R307C[-1]:R[-1]C[-1]) -> 139280 | E362: =R[-100]C -> 80
A363: 3 | B363: 57 | C363: 6544 | D363: =SUM(R307C[-1]:R[-1]C[-1]) -> 145632 | E363: =R[-100]C -> 80
A364: 3 | B364: 58 | C364: 6736 | D364: =SUM(R307C[-1]:R[-1]C[-1]) -> 152176 | E364: =R[-100]C -> 80
A365: 3 | B365: 59 | C365: 6928 | D365: =SUM(R307C[-1]:R[-1]C[-1]) -> 158912 | E365: =R[-100]C -> 80
A366: 3 | B366: 60 | C366: 7120 | D366: =SUM(R307C[-1]:R[-1]C[-1]) -> 165840 | E366: =R[-100]C -> 90
A367: 3 | B367: 61 | C367: 7344 | D367: =SUM(R307C[-1]:R[-1]C[-1]) -> 172960 | E367: =R[-100]C -> 90
A368: 3 | B368: 62 | C368: 7568 | D368: =SUM(R307C[-1]:R[-1]C[-1]) -> 180304 | E368: =R[-100]C -> 90
A369: 3 | B369: 63 | C369: 7792 | D369: =SUM(R307C[-1]:R[-1]C[-1]) -> 187872 | E369: =R[-100]C -> 90
A370: 3 | B370: 64 | C370: 8016 | D370: =SUM(R307C[-1]:R[-1]C[-1]) -> 195664 | E370: =R[-100]C -> 90
A371: 3 | B371: 65 | C371: 8240 | D371: =SUM(R307C[-1]:R[-1]C[-1]) -> 203680 | E371: =R[-100]C -> 90
A372: 3 | B372: 66 | C372: 8464 | D372: =SUM(R307C[-1]:R[-1]C[-1]) -> 211920 | E372: =R[-100]C -> 90
A373: 3 | B373: 67 | C373: 8688 | D373: =SUM(R307C[-1]:R[-1]C[-1]) -> 220384 | E373: =R[-100]C -> 90
A374: 3 | B374: 68 | C374: 8912 | D374: =SUM(R307C[-1]:R[-1]C[-1]) -> 229072 | E374: =R[-100]C -> 90
A375: 3 | B375: 69 | C375: 9136 | D375: =SUM(R307C[-1]:R[-1]C[-1]) -> 237984 | E375: =R[-100]C -> 90
A376: 3 | B376: 70 | C376: 9360 | D376: =SUM(R307C[-1]:R[-1]C[-1]) -> 247120 | E376: =R[-100]C -> 100
A377: 3 | B377: 71 | C377: 9616 | D377: =SUM(R307C[-1]:R[-1]C[-1]) -> 256480 | E377: =R[-100]C -> 100
A378: 3 | B378: 72 | C378: 9872 | D378: =SUM(R307C[-1]:R[-1]C[-1]) -> 266096 | E378: =R[-100]C -> 100
A379: 3 | B379: 73 | C379: 10128 | D379: =SUM(R307C[-1]:R[-1]C[-1]) -> 275968 | E379: =R[-100]C -> 100
A380: 3 | B380: 74 | C380: 10384 | D380: =SUM(R307C[-1]:R[-1]C[-1]) -> 286096 | E380: =R[-100]C -> 100
A381: 3 | B381: 75 | C381: 10640 | D381: =SUM(R307C[-1]:R[-1]C[-1]) -> 296480 | E381: =R[-100]C -> 100
A382: 3 | B382: 76 | C382: 10896 | D382: =SUM(R307C[-1]:R[-1]C[-1]) -> 307120 | E382: =R[-100]C -> 100
A383: 3 | B383: 77 | C383: 11152 | D383: =SUM(R307C[-1]:R[-1]C[-1]) -> 318016 | E383: =R[-100]C -> 100
A384: 3 | B384: 78 | C384: 11408 | D384: =SUM(R307C[-1]:R[-1]C[-1]) -> 329168 | E384: =R[-100]C -> 100
A385: 3 | B385: 79 | C385: 11664 | D385: =SUM(R307C[-1]:R[-1]C[-1]) -> 340576 | E385: =R[-100]C -> 100
A386: 3 | B386: 80 | C386: 11920 | D386: =SUM(R307C[-1]:R[-1]C[-1]) -> 352240 | E386: =R[-100]C -> 110
A387: 3 | B387: 81 | C387: 12208 | D387: =SUM(R307C[-1]:R[-1]C[-1]) -> 364160 | E387: =R[-100]C -> 110
A388: 3 | B388: 82 | C388: 12496 | D388: =SUM(R307C[-1]:R[-1]C[-1]) -> 376368 | E388: =R[-100]C -> 110
A389: 3 | B389: 83 | C389: 12784 | D389: =SUM(R307C[-1]:R[-1]C[-1]) -> 388864 | E389: =R[-100]C -> 110
A390: 3 | B390: 84 | C390: 13072 | D390: =SUM(R307C[-1]:R[-1]C[-1]) -> 401648 | E390: =R[-100]C -> 110
A391: 3 | B391: 85 | C391: 13360 | D391: =SUM(R307C[-1]:R[-1]C[-1]) -> 414720 | E391: =R[-100]C -> 110
A392: 3 | B392: 86 | C392: 13648 | D392: =SUM(R307C[-1]:R[-1]C[-1]) -> 428080 | E392: =R[-100]C -> 110
A393: 3 | B393: 87 | C393: 13936 | D393: =SUM(R307C[-1]:R[-1]C[-1]) -> 441728 | E393: =R[-100]C -> 110
A394: 3 | B394: 88 | C394: 14224 | D394: =SUM(R307C[-1]:R[-1]C[-1]) -> 455664 | E394: =R[-100]C -> 110
A395: 3 | B395: 89 | C395: 14512 | D395: =SUM(R307C[-1]:R[-1]C[-1]) -> 469888 | E395: =R[-100]C -> 110
A396: 3 | B396: 90 | C396: 14800 | D396: =SUM(R307C[-1]:R[-1]C[-1]) -> 484400 | E396: =R[-100]C -> 120
A397: 3 | B397: 91 | C397: 15120 | D397: =SUM(R307C[-1]:R[-1]C[-1]) -> 499200 | E397: =R[-100]C -> 120
A398: 3 | B398: 92 | C398: 15440 | D398: =SUM(R307C[-1]:R[-1]C[-1]) -> 514320 | E398: =R[-100]C -> 120
A399: 3 | B399: 93 | C399: 15760 | D399: =SUM(R307C[-1]:R[-1]C[-1]) -> 529760 | E399: =R[-100]C -> 120
A400: 3 | B400: 94 | C400: 16080 | D400: =SUM(R307C[-1]:R[-1]C[-1]) -> 545520 | E400: =R[-100]C -> 120
A401: 3 | B401: 95 | C401: 16400 | D401: =SUM(R307C[-1]:R[-1]C[-1]) -> 561600 | E401: =R[-100]C -> 120
A402: 3 | B402: 96 | C402: 16720 | D402: =SUM(R307C[-1]:R[-1]C[-1]) -> 578000 | E402: =R[-100]C -> 120
A403: 3 | B403: 97 | C403: 17040 | D403: =SUM(R307C[-1]:R[-1]C[-1]) -> 594720 | E403: =R[-100]C -> 120
A404: 3 | B404: 98 | C404: 17360 | D404: =SUM(R307C[-1]:R[-1]C[-1]) -> 611760 | E404: =R[-100]C -> 120
A405: 3 | B405: 99 | C405: 17680 | D405: =SUM(R307C[-1]:R[-1]C[-1]) -> 629120 | E405: =R[-100]C -> 120
A406: 3 | B406: 100 | C406: 0 | D406: =SUM(R307C[-1]:R[-1]C[-1]) -> 646800 | E406: =R[-100]C -> 130
A407: 4 | B407: 1 | C407: 540 | D407: 0 | E407: =R[-100]C -> 0
A408: 4 | B408: 2 | C408: 580 | D408: =SUM(R407C[-1]:R[-1]C[-1]) -> 540 | E408: =R[-100]C -> 0
A409: 4 | B409: 3 | C409: 620 | D409: =SUM(R407C[-1]:R[-1]C[-1]) -> 1120 | E409: =R[-100]C -> 0
A410: 4 | B410: 4 | C410: 660 | D410: =SUM(R407C[-1]:R[-1]C[-1]) -> 1740 | E410: =R[-100]C -> 0
A411: 4 | B411: 5 | C411: 700 | D411: =SUM(R407C[-1]:R[-1]C[-1]) -> 2400 | E411: =R[-100]C -> 0
A412: 4 | B412: 6 | C412: 740 | D412: =SUM(R407C[-1]:R[-1]C[-1]) -> 3100 | E412: =R[-100]C -> 0
A413: 4 | B413: 7 | C413: 780 | D413: =SUM(R407C[-1]:R[-1]C[-1]) -> 3840 | E413: =R[-100]C -> 0
A414: 4 | B414: 8 | C414: 820 | D414: =SUM(R407C[-1]:R[-1]C[-1]) -> 4620 | E414: =R[-100]C -> 0
A415: 4 | B415: 9 | C415: 860 | D415: =SUM(R407C[-1]:R[-1]C[-1]) -> 5440 | E415: =R[-100]C -> 0
A416: 4 | B416: 10 | C416: 900 | D416: =SUM(R407C[-1]:R[-1]C[-1]) -> 6300 | E416: =R[-100]C -> 0
A417: 4 | B417: 11 | C417: 980 | D417: =SUM(R407C[-1]:R[-1]C[-1]) -> 7200 | E417: =R[-100]C -> 0
A418: 4 | B418: 12 | C418: 1060 | D418: =SUM(R407C[-1]:R[-1]C[-1]) -> 8180 | E418: =R[-100]C -> 0
A419: 4 | B419: 13 | C419: 1140 | D419: =SUM(R407C[-1]:R[-1]C[-1]) -> 9240 | E419: =R[-100]C -> 0
A420: 4 | B420: 14 | C420: 1220 | D420: =SUM(R407C[-1]:R[-1]C[-1]) -> 10380 | E420: =R[-100]C -> 0
A421: 4 | B421: 15 | C421: 1300 | D421: =SUM(R407C[-1]:R[-1]C[-1]) -> 11600 | E421: =R[-100]C -> 0
A422: 4 | B422: 16 | C422: 1380 | D422: =SUM(R407C[-1]:R[-1]C[-1]) -> 12900 | E422: =R[-100]C -> 0
A423: 4 | B423: 17 | C423: 1460 | D423: =SUM(R407C[-1]:R[-1]C[-1]) -> 14280 | E423: =R[-100]C -> 0
A424: 4 | B424: 18 | C424: 1540 | D424: =SUM(R407C[-1]:R[-1]C[-1]) -> 15740 | E424: =R[-100]C -> 0
A425: 4 | B425: 19 | C425: 1620 | D425: =SUM(R407C[-1]:R[-1]C[-1]) -> 17280 | E425: =R[-100]C -> 0
A426: 4 | B426: 20 | C426: 1700 | D426: =SUM(R407C[-1]:R[-1]C[-1]) -> 18900 | E426: =R[-100]C -> 0
A427: 4 | B427: 21 | C427: 1820 | D427: =SUM(R407C[-1]:R[-1]C[-1]) -> 20600 | E427: =R[-100]C -> 0
A428: 4 | B428: 22 | C428: 1940 | D428: =SUM(R407C[-1]:R[-1]C[-1]) -> 22420 | E428: =R[-100]C -> 0
A429: 4 | B429: 23 | C429: 2060 | D429: =SUM(R407C[-1]:R[-1]C[-1]) -> 24360 | E429: =R[-100]C -> 0
A430: 4 | B430: 24 | C430: 2180 | D430: =SUM(R407C[-1]:R[-1]C[-1]) -> 26420 | E430: =R[-100]C -> 0
A431: 4 | B431: 25 | C431: 2300 | D431: =SUM(R407C[-1]:R[-1]C[-1]) -> 28600 | E431: =R[-100]C -> 0
A432: 4 | B432: 26 | C432: 2420 | D432: =SUM(R407C[-1]:R[-1]C[-1]) -> 30900 | E432: =R[-100]C -> 0
A433: 4 | B433: 27 | C433: 2540 | D433: =SUM(R407C[-1]:R[-1]C[-1]) -> 33320 | E433: =R[-100]C -> 0
A434: 4 | B434: 28 | C434: 2660 | D434: =SUM(R407C[-1]:R[-1]C[-1]) -> 35860 | E434: =R[-100]C -> 0
A435: 4 | B435: 29 | C435: 2780 | D435: =SUM(R407C[-1]:R[-1]C[-1]) -> 38520 | E435: =R[-100]C -> 0
A436: 4 | B436: 30 | C436: 2900 | D436: =SUM(R407C[-1]:R[-1]C[-1]) -> 41300 | E436: =R[-100]C -> 60
A437: 4 | B437: 31 | C437: 3060 | D437: =SUM(R407C[-1]:R[-1]C[-1]) -> 44200 | E437: =R[-100]C -> 60
A438: 4 | B438: 32 | C438: 3220 | D438: =SUM(R407C[-1]:R[-1]C[-1]) -> 47260 | E438: =R[-100]C -> 60
A439: 4 | B439: 33 | C439: 3380 | D439: =SUM(R407C[-1]:R[-1]C[-1]) -> 50480 | E439: =R[-100]C -> 60
A440: 4 | B440: 34 | C440: 3540 | D440: =SUM(R407C[-1]:R[-1]C[-1]) -> 53860 | E440: =R[-100]C -> 60
A441: 4 | B441: 35 | C441: 3700 | D441: =SUM(R407C[-1]:R[-1]C[-1]) -> 57400 | E441: =R[-100]C -> 60
A442: 4 | B442: 36 | C442: 3860 | D442: =SUM(R407C[-1]:R[-1]C[-1]) -> 61100 | E442: =R[-100]C -> 60
A443: 4 | B443: 37 | C443: 4020 | D443: =SUM(R407C[-1]:R[-1]C[-1]) -> 64960 | E443: =R[-100]C -> 60
A444: 4 | B444: 38 | C444: 4180 | D444: =SUM(R407C[-1]:R[-1]C[-1]) -> 68980 | E444: =R[-100]C -> 60
A445: 4 | B445: 39 | C445: 4340 | D445: =SUM(R407C[-1]:R[-1]C[-1]) -> 73160 | E445: =R[-100]C -> 60
A446: 4 | B446: 40 | C446: 4500 | D446: =SUM(R407C[-1]:R[-1]C[-1]) -> 77500 | E446: =R[-100]C -> 70
A447: 4 | B447: 41 | C447: 4700 | D447: =SUM(R407C[-1]:R[-1]C[-1]) -> 82000 | E447: =R[-100]C -> 70
A448: 4 | B448: 42 | C448: 4900 | D448: =SUM(R407C[-1]:R[-1]C[-1]) -> 86700 | E448: =R[-100]C -> 70
A449: 4 | B449: 43 | C449: 5100 | D449: =SUM(R407C[-1]:R[-1]C[-1]) -> 91600 | E449: =R[-100]C -> 70
A450: 4 | B450: 44 | C450: 5300 | D450: =SUM(R407C[-1]:R[-1]C[-1]) -> 96700 | E450: =R[-100]C -> 70
A451: 4 | B451: 45 | C451: 5500 | D451: =SUM(R407C[-1]:R[-1]C[-1]) -> 102000 | E451: =R[-100]C -> 70
A452: 4 | B452: 46 | C452: 5700 | D452: =SUM(R407C[-1]:R[-1]C[-1]) -> 107500 | E452: =R[-100]C -> 70
A453: 4 | B453: 47 | C453: 5900 | D453: =SUM(R407C[-1]:R[-1]C[-1]) -> 113200 | E453: =R[-100]C -> 70
A454: 4 | B454: 48 | C454: 6100 | D454: =SUM(R407C[-1]:R[-1]C[-1]) -> 119100 | E454: =R[-100]C -> 70
A455: 4 | B455: 49 | C455: 6300 | D455: =SUM(R407C[-1]:R[-1]C[-1]) -> 125200 | E455: =R[-100]C -> 70
A456: 4 | B456: 50 | C456: 6500 | D456: =SUM(R407C[-1]:R[-1]C[-1]) -> 131500 | E456: =R[-100]C -> 80
A457: 4 | B457: 51 | C457: 6740 | D457: =SUM(R407C[-1]:R[-1]C[-1]) -> 138000 | E457: =R[-100]C -> 80
A458: 4 | B458: 52 | C458: 6980 | D458: =SUM(R407C[-1]:R[-1]C[-1]) -> 144740 | E458: =R[-100]C -> 80
A459: 4 | B459: 53 | C459: 7220 | D459: =SUM(R407C[-1]:R[-1]C[-1]) -> 151720 | E459: =R[-100]C -> 80
A460: 4 | B460: 54 | C460: 7460 | D460: =SUM(R407C[-1]:R[-1]C[-1]) -> 158940 | E460: =R[-100]C -> 80
A461: 4 | B461: 55 | C461: 7700 | D461: =SUM(R407C[-1]:R[-1]C[-1]) -> 166400 | E461: =R[-100]C -> 80
A462: 4 | B462: 56 | C462: 7940 | D462: =SUM(R407C[-1]:R[-1]C[-1]) -> 174100 | E462: =R[-100]C -> 80
A463: 4 | B463: 57 | C463: 8180 | D463: =SUM(R407C[-1]:R[-1]C[-1]) -> 182040 | E463: =R[-100]C -> 80
A464: 4 | B464: 58 | C464: 8420 | D464: =SUM(R407C[-1]:R[-1]C[-1]) -> 190220 | E464: =R[-100]C -> 80
A465: 4 | B465: 59 | C465: 8660 | D465: =SUM(R407C[-1]:R[-1]C[-1]) -> 198640 | E465: =R[-100]C -> 80
A466: 4 | B466: 60 | C466: 8900 | D466: =SUM(R407C[-1]:R[-1]C[-1]) -> 207300 | E466: =R[-100]C -> 90
A467: 4 | B467: 61 | C467: 9180 | D467: =SUM(R407C[-1]:R[-1]C[-1]) -> 216200 | E467: =R[-100]C -> 90
A468: 4 | B468: 62 | C468: 9460 | D468: =SUM(R407C[-1]:R[-1]C[-1]) -> 225380 | E468: =R[-100]C -> 90
A469: 4 | B469: 63 | C469: 9740 | D469: =SUM(R407C[-1]:R[-1]C[-1]) -> 234840 | E469: =R[-100]C -> 90
A470: 4 | B470: 64 | C470: 10020 | D470: =SUM(R407C[-1]:R[-1]C[-1]) -> 244580 | E470: =R[-100]C -> 90
A471: 4 | B471: 65 | C471: 10300 | D471: =SUM(R407C[-1]:R[-1]C[-1]) -> 254600 | E471: =R[-100]C -> 90
A472: 4 | B472: 66 | C472: 10580 | D472: =SUM(R407C[-1]:R[-1]C[-1]) -> 264900 | E472: =R[-100]C -> 90
A473: 4 | B473: 67 | C473: 10860 | D473: =SUM(R407C[-1]:R[-1]C[-1]) -> 275480 | E473: =R[-100]C -> 90
A474: 4 | B474: 68 | C474: 11140 | D474: =SUM(R407C[-1]:R[-1]C[-1]) -> 286340 | E474: =R[-100]C -> 90
A475: 4 | B475: 69 | C475: 11420 | D475: =SUM(R407C[-1]:R[-1]C[-1]) -> 297480 | E475: =R[-100]C -> 90
A476: 4 | B476: 70 | C476: 11700 | D476: =SUM(R407C[-1]:R[-1]C[-1]) -> 308900 | E476: =R[-100]C -> 100
A477: 4 | B477: 71 | C477: 12020 | D477: =SUM(R407C[-1]:R[-1]C[-1]) -> 320600 | E477: =R[-100]C -> 100
A478: 4 | B478: 72 | C478: 12340 | D478: =SUM(R407C[-1]:R[-1]C[-1]) -> 332620 | E478: =R[-100]C -> 100
A479: 4 | B479: 73 | C479: 12660 | D479: =SUM(R407C[-1]:R[-1]C[-1]) -> 344960 | E479: =R[-100]C -> 100
A480: 4 | B480: 74 | C480: 12980 | D480: =SUM(R407C[-1]:R[-1]C[-1]) -> 357620 | E480: =R[-100]C -> 100
A481: 4 | B481: 75 | C481: 13300 | D481: =SUM(R407C[-1]:R[-1]C[-1]) -> 370600 | E481: =R[-100]C -> 100
A482: 4 | B482: 76 | C482: 13620 | D482: =SUM(R407C[-1]:R[-1]C[-1]) -> 383900 | E482: =R[-100]C -> 100
A483: 4 | B483: 77 | C483: 13940 | D483: =SUM(R407C[-1]:R[-1]C[-1]) -> 397520 | E483: =R[-100]C -> 100
A484: 4 | B484: 78 | C484: 14260 | D484: =SUM(R407C[-1]:R[-1]C[-1]) -> 411460 | E484: =R[-100]C -> 100
A485: 4 | B485: 79 | C485: 14580 | D485: =SUM(R407C[-1]:R[-1]C[-1]) -> 425720 | E485: =R[-100]C -> 100
A486: 4 | B486: 80 | C486: 14900 | D486: =SUM(R407C[-1]:R[-1]C[-1]) -> 440300 | E486: =R[-100]C -> 110
A487: 4 | B487: 81 | C487: 15260 | D487: =SUM(R407C[-1]:R[-1]C[-1]) -> 455200 | E487: =R[-100]C -> 110
A488: 4 | B488: 82 | C488: 15620 | D488: =SUM(R407C[-1]:R[-1]C[-1]) -> 470460 | E488: =R[-100]C -> 110
A489: 4 | B489: 83 | C489: 15980 | D489: =SUM(R407C[-1]:R[-1]C[-1]) -> 486080 | E489: =R[-100]C -> 110
A490: 4 | B490: 84 | C490: 16340 | D490: =SUM(R407C[-1]:R[-1]C[-1]) -> 502060 | E490: =R[-100]C -> 110
A491: 4 | B491: 85 | C491: 16700 | D491: =SUM(R407C[-1]:R[-1]C[-1]) -> 518400 | E491: =R[-100]C -> 110
A492: 4 | B492: 86 | C492: 17060 | D492: =SUM(R407C[-1]:R[-1]C[-1]) -> 535100 | E492: =R[-100]C -> 110
A493: 4 | B493: 87 | C493: 17420 | D493: =SUM(R407C[-1]:R[-1]C[-1]) -> 552160 | E493: =R[-100]C -> 110
A494: 4 | B494: 88 | C494: 17780 | D494: =SUM(R407C[-1]:R[-1]C[-1]) -> 569580 | E494: =R[-100]C -> 110
A495: 4 | B495: 89 | C495: 18140 | D495: =SUM(R407C[-1]:R[-1]C[-1]) -> 587360 | E495: =R[-100]C -> 110
A496: 4 | B496: 90 | C496: 18500 | D496: =SUM(R407C[-1]:R[-1]C[-1]) -> 605500 | E496: =R[-100]C -> 120
A497: 4 | B497: 91 | C497: 18900 | D497: =SUM(R407C[-1]:R[-1]C[-1]) -> 624000 | E497: =R[-100]C -> 120
A498: 4 | B498: 92 | C498: 19300 | D498: =SUM(R407C[-1]:R[-1]C[-1]) -> 642900 | E498: =R[-100]C -> 120
A499: 4 | B499: 93 | C499: 19700 | D499: =SUM(R407C[-1]:R[-1]C[-1]) -> 662200 | E499: =R[-100]C -> 120
A500: 4 | B500: 94 | C500: 20100 | D500: =SUM(R407C[-1]:R[-1]C[-1]) -> 681900 | E500: =R[-100]C -> 120
A501: 4 | B501: 95 | C501: 20500 | D501: =SUM(R407C[-1]:R[-1]C[-1]) -> 702000 | E501: =R[-100]C -> 120
A502: 4 | B502: 96 | C502: 20900 | D502: =SUM(R407C[-1]:R[-1]C[-1]) -> 722500 | E502: =R[-100]C -> 120
A503: 4 | B503: 97 | C503: 21300 | D503: =SUM(R407C[-1]:R[-1]C[-1]) -> 743400 | E503: =R[-100]C -> 120
A504: 4 | B504: 98 | C504: 21700 | D504: =SUM(R407C[-1]:R[-1]C[-1]) -> 764700 | E504: =R[-100]C -> 120
A505: 4 | B505: 99 | C505: 22100 | D505: =SUM(R407C[-1]:R[-1]C[-1]) -> 786400 | E505: =R[-100]C -> 120
A506: 4 | B506: 100 | C506: 0 | D506: =SUM(R407C[-1]:R[-1]C[-1]) -> 808500 | E506: =R[-100]C -> 130
A507: 5 | B507: 1 | C507: 648 | D507: 0 | E507: =R[-100]C -> 0
A508: 5 | B508: 2 | C508: 696 | D508: =SUM(R507C[-1]:R[-1]C[-1]) -> 648 | E508: =R[-100]C -> 0
A509: 5 | B509: 3 | C509: 744 | D509: =SUM(R507C[-1]:R[-1]C[-1]) -> 1344 | E509: =R[-100]C -> 0
A510: 5 | B510: 4 | C510: 792 | D510: =SUM(R507C[-1]:R[-1]C[-1]) -> 2088 | E510: =R[-100]C -> 0
A511: 5 | B511: 5 | C511: 840 | D511: =SUM(R507C[-1]:R[-1]C[-1]) -> 2880 | E511: =R[-100]C -> 0
A512: 5 | B512: 6 | C512: 888 | D512: =SUM(R507C[-1]:R[-1]C[-1]) -> 3720 | E512: =R[-100]C -> 0
A513: 5 | B513: 7 | C513: 936 | D513: =SUM(R507C[-1]:R[-1]C[-1]) -> 4608 | E513: =R[-100]C -> 0
A514: 5 | B514: 8 | C514: 984 | D514: =SUM(R507C[-1]:R[-1]C[-1]) -> 5544 | E514: =R[-100]C -> 0
A515: 5 | B515: 9 | C515: 1032 | D515: =SUM(R507C[-1]:R[-1]C[-1]) -> 6528 | E515: =R[-100]C -> 0
A516: 5 | B516: 10 | C516: 1080 | D516: =SUM(R507C[-1]:R[-1]C[-1]) -> 7560 | E516: =R[-100]C -> 0
A517: 5 | B517: 11 | C517: 1176 | D517: =SUM(R507C[-1]:R[-1]C[-1]) -> 8640 | E517: =R[-100]C -> 0
A518: 5 | B518: 12 | C518: 1272 | D518: =SUM(R507C[-1]:R[-1]C[-1]) -> 9816 | E518: =R[-100]C -> 0
A519: 5 | B519: 13 | C519: 1368 | D519: =SUM(R507C[-1]:R[-1]C[-1]) -> 11088 | E519: =R[-100]C -> 0
A520: 5 | B520: 14 | C520: 1464 | D520: =SUM(R507C[-1]:R[-1]C[-1]) -> 12456 | E520: =R[-100]C -> 0
A521: 5 | B521: 15 | C521: 1560 | D521: =SUM(R507C[-1]:R[-1]C[-1]) -> 13920 | E521: =R[-100]C -> 0
A522: 5 | B522: 16 | C522: 1656 | D522: =SUM(R507C[-1]:R[-1]C[-1]) -> 15480 | E522: =R[-100]C -> 0
A523: 5 | B523: 17 | C523: 1752 | D523: =SUM(R507C[-1]:R[-1]C[-1]) -> 17136 | E523: =R[-100]C -> 0
A524: 5 | B524: 18 | C524: 1848 | D524: =SUM(R507C[-1]:R[-1]C[-1]) -> 18888 | E524: =R[-100]C -> 0
A525: 5 | B525: 19 | C525: 1944 | D525: =SUM(R507C[-1]:R[-1]C[-1]) -> 20736 | E525: =R[-100]C -> 0
A526: 5 | B526: 20 | C526: 2040 | D526: =SUM(R507C[-1]:R[-1]C[-1]) -> 22680 | E526: =R[-100]C -> 0
A527: 5 | B527: 21 | C527: 2184 | D527: =SUM(R507C[-1]:R[-1]C[-1]) -> 24720 | E527: =R[-100]C -> 0
A528: 5 | B528: 22 | C528: 2328 | D528: =SUM(R507C[-1]:R[-1]C[-1]) -> 26904 | E528: =R[-100]C -> 0
A529: 5 | B529: 23 | C529: 2472 | D529: =SUM(R507C[-1]:R[-1]C[-1]) -> 29232 | E529: =R[-100]C -> 0
A530: 5 | B530: 24 | C530: 2616 | D530: =SUM(R507C[-1]:R[-1]C[-1]) -> 31704 | E530: =R[-100]C -> 0
A531: 5 | B531: 25 | C531: 2760 | D531: =SUM(R507C[-1]:R[-1]C[-1]) -> 34320 | E531: =R[-100]C -> 0
A532: 5 | B532: 26 | C532: 2904 | D532: =SUM(R507C[-1]:R[-1]C[-1]) -> 37080 | E532: =R[-100]C -> 0
A533: 5 | B533: 27 | C533: 3048 | D533: =SUM(R507C[-1]:R[-1]C[-1]) -> 39984 | E533: =R[-100]C -> 0
A534: 5 | B534: 28 | C534: 3192 | D534: =SUM(R507C[-1]:R[-1]C[-1]) -> 43032 | E534: =R[-100]C -> 0
A535: 5 | B535: 29 | C535: 3336 | D535: =SUM(R507C[-1]:R[-1]C[-1]) -> 46224 | E535: =R[-100]C -> 0
A536: 5 | B536: 30 | C536: 3480 | D536: =SUM(R507C[-1]:R[-1]C[-1]) -> 49560 | E536: =R[-100]C -> 60
A537: 5 | B537: 31 | C537: 3672 | D537: =SUM(R507C[-1]:R[-1]C[-1]) -> 53040 | E537: =R[-100]C -> 60
A538: 5 | B538: 32 | C538: 3864 | D538: =SUM(R507C[-1]:R[-1]C[-1]) -> 56712 | E538: =R[-100]C -> 60
A539: 5 | B539: 33 | C539: 4056 | D539: =SUM(R507C[-1]:R[-1]C[-1]) -> 60576 | E539: =R[-100]C -> 60
A540: 5 | B540: 34 | C540: 4248 | D540: =SUM(R507C[-1]:R[-1]C[-1]) -> 64632 | E540: =R[-100]C -> 60
A541: 5 | B541: 35 | C541: 4440 | D541: =SUM(R507C[-1]:R[-1]C[-1]) -> 68880 | E541: =R[-100]C -> 60
A542: 5 | B542: 36 | C542: 4632 | D542: =SUM(R507C[-1]:R[-1]C[-1]) -> 73320 | E542: =R[-100]C -> 60
A543: 5 | B543: 37 | C543: 4824 | D543: =SUM(R507C[-1]:R[-1]C[-1]) -> 77952 | E543: =R[-100]C -> 60
A544: 5 | B544: 38 | C544: 5016 | D544: =SUM(R507C[-1]:R[-1]C[-1]) -> 82776 | E544: =R[-100]C -> 60
A545: 5 | B545: 39 | C545: 5208 | D545: =SUM(R507C[-1]:R[-1]C[-1]) -> 87792 | E545: =R[-100]C -> 60
A546: 5 | B546: 40 | C546: 5400 | D546: =SUM(R507C[-1]:R[-1]C[-1]) -> 93000 | E546: =R[-100]C -> 70
A547: 5 | B547: 41 | C547: 5640 | D547: =SUM(R507C[-1]:R[-1]C[-1]) -> 98400 | E547: =R[-100]C -> 70
A548: 5 | B548: 42 | C548: 5880 | D548: =SUM(R507C[-1]:R[-1]C[-1]) -> 104040 | E548: =R[-100]C -> 70
A549: 5 | B549: 43 | C549: 6120 | D549: =SUM(R507C[-1]:R[-1]C[-1]) -> 109920 | E549: =R[-100]C -> 70
A550: 5 | B550: 44 | C550: 6360 | D550: =SUM(R507C[-1]:R[-1]C[-1]) -> 116040 | E550: =R[-100]C -> 70
A551: 5 | B551: 45 | C551: 6600 | D551: =SUM(R507C[-1]:R[-1]C[-1]) -> 122400 | E551: =R[-100]C -> 70
A552: 5 | B552: 46 | C552: 6840 | D552: =SUM(R507C[-1]:R[-1]C[-1]) -> 129000 | E552: =R[-100]C -> 70
A553: 5 | B553: 47 | C553: 7080 | D553: =SUM(R507C[-1]:R[-1]C[-1]) -> 135840 | E553: =R[-100]C -> 70
A554: 5 | B554: 48 | C554: 7320 | D554: =SUM(R507C[-1]:R[-1]C[-1]) -> 142920 | E554: =R[-100]C -> 70
A555: 5 | B555: 49 | C555: 7560 | D555: =SUM(R507C[-1]:R[-1]C[-1]) -> 150240 | E555: =R[-100]C -> 70
A556: 5 | B556: 50 | C556: 7800 | D556: =SUM(R507C[-1]:R[-1]C[-1]) -> 157800 | E556: =R[-100]C -> 80
A557: 5 | B557: 51 | C557: 8088 | D557: =SUM(R507C[-1]:R[-1]C[-1]) -> 165600 | E557: =R[-100]C -> 80
A558: 5 | B558: 52 | C558: 8376 | D558: =SUM(R507C[-1]:R[-1]C[-1]) -> 173688 | E558: =R[-100]C -> 80
A559: 5 | B559: 53 | C559: 8664 | D559: =SUM(R507C[-1]:R[-1]C[-1]) -> 182064 | E559: =R[-100]C -> 80
A560: 5 | B560: 54 | C560: 8952 | D560: =SUM(R507C[-1]:R[-1]C[-1]) -> 190728 | E560: =R[-100]C -> 80
A561: 5 | B561: 55 | C561: 9240 | D561: =SUM(R507C[-1]:R[-1]C[-1]) -> 199680 | E561: =R[-100]C -> 80
A562: 5 | B562: 56 | C562: 9528 | D562: =SUM(R507C[-1]:R[-1]C[-1]) -> 208920 | E562: =R[-100]C -> 80
A563: 5 | B563: 57 | C563: 9816 | D563: =SUM(R507C[-1]:R[-1]C[-1]) -> 218448 | E563: =R[-100]C -> 80
A564: 5 | B564: 58 | C564: 10104 | D564: =SUM(R507C[-1]:R[-1]C[-1]) -> 228264 | E564: =R[-100]C -> 80
A565: 5 | B565: 59 | C565: 10392 | D565: =SUM(R507C[-1]:R[-1]C[-1]) -> 238368 | E565: =R[-100]C -> 80
A566: 5 | B566: 60 | C566: 10680 | D566: =SUM(R507C[-1]:R[-1]C[-1]) -> 248760 | E566: =R[-100]C -> 90
A567: 5 | B567: 61 | C567: 11016 | D567: =SUM(R507C[-1]:R[-1]C[-1]) -> 259440 | E567: =R[-100]C -> 90
A568: 5 | B568: 62 | C568: 11352 | D568: =SUM(R507C[-1]:R[-1]C[-1]) -> 270456 | E568: =R[-100]C -> 90
A569: 5 | B569: 63 | C569: 11688 | D569: =SUM(R507C[-1]:R[-1]C[-1]) -> 281808 | E569: =R[-100]C -> 90
A570: 5 | B570: 64 | C570: 12024 | D570: =SUM(R507C[-1]:R[-1]C[-1]) -> 293496 | E570: =R[-100]C -> 90
A571: 5 | B571: 65 | C571: 12360 | D571: =SUM(R507C[-1]:R[-1]C[-1]) -> 305520 | E571: =R[-100]C -> 90
A572: 5 | B572: 66 | C572: 12696 | D572: =SUM(R507C[-1]:R[-1]C[-1]) -> 317880 | E572: =R[-100]C -> 90
A573: 5 | B573: 67 | C573: 13032 | D573: =SUM(R507C[-1]:R[-1]C[-1]) -> 330576 | E573: =R[-100]C -> 90
A574: 5 | B574: 68 | C574: 13368 | D574: =SUM(R507C[-1]:R[-1]C[-1]) -> 343608 | E574: =R[-100]C -> 90
A575: 5 | B575: 69 | C575: 13704 | D575: =SUM(R507C[-1]:R[-1]C[-1]) -> 356976 | E575: =R[-100]C -> 90
A576: 5 | B576: 70 | C576: 14040 | D576: =SUM(R507C[-1]:R[-1]C[-1]) -> 370680 | E576: =R[-100]C -> 100
A577: 5 | B577: 71 | C577: 14424 | D577: =SUM(R507C[-1]:R[-1]C[-1]) -> 384720 | E577: =R[-100]C -> 100
A578: 5 | B578: 72 | C578: 14808 | D578: =SUM(R507C[-1]:R[-1]C[-1]) -> 399144 | E578: =R[-100]C -> 100
A579: 5 | B579: 73 | C579: 15192 | D579: =SUM(R507C[-1]:R[-1]C[-1]) -> 413952 | E579: =R[-100]C -> 100
A580: 5 | B580: 74 | C580: 15576 | D580: =SUM(R507C[-1]:R[-1]C[-1]) -> 429144 | E580: =R[-100]C -> 100
A581: 5 | B581: 75 | C581: 15960 | D581: =SUM(R507C[-1]:R[-1]C[-1]) -> 444720 | E581: =R[-100]C -> 100
A582: 5 | B582: 76 | C582: 16344 | D582: =SUM(R507C[-1]:R[-1]C[-1]) -> 460680 | E582: =R[-100]C -> 100
A583: 5 | B583: 77 | C583: 16728 | D583: =SUM(R507C[-1]:R[-1]C[-1]) -> 477024 | E583: =R[-100]C -> 100
A584: 5 | B584: 78 | C584: 17112 | D584: =SUM(R507C[-1]:R[-1]C[-1]) -> 493752 | E584: =R[-100]C -> 100
A585: 5 | B585: 79 | C585: 17496 | D585: =SUM(R507C[-1]:R[-1]C[-1]) -> 510864 | E585: =R[-100]C -> 100
A586: 5 | B586: 80 | C586: 17880 | D586: =SUM(R507C[-1]:R[-1]C[-1]) -> 528360 | E586: =R[-100]C -> 110
A587: 5 | B587: 81 | C587: 18312 | D587: =SUM(R507C[-1]:R[-1]C[-1]) -> 546240 | E587: =R[-100]C -> 110
A588: 5 | B588: 82 | C588: 18744 | D588: =SUM(R507C[-1]:R[-1]C[-1]) -> 564552 | E588: =R[-100]C -> 110
A589: 5 | B589: 83 | C589: 19176 | D589: =SUM(R507C[-1]:R[-1]C[-1]) -> 583296 | E589: =R[-100]C -> 110
A590: 5 | B590: 84 | C590: 19608 | D590: =SUM(R507C[-1]:R[-1]C[-1]) -> 602472 | E590: =R[-100]C -> 110
A591: 5 | B591: 85 | C591: 20040 | D591: =SUM(R507C[-1]:R[-1]C[-1]) -> 622080 | E591: =R[-100]C -> 110
A592: 5 | B592: 86 | C592: 20472 | D592: =SUM(R507C[-1]:R[-1]C[-1]) -> 642120 | E592: =R[-100]C -> 110
A593: 5 | B593: 87 | C593: 20904 | D593: =SUM(R507C[-1]:R[-1]C[-1]) -> 662592 | E593: =R[-100]C -> 110
A594: 5 | B594: 88 | C594: 21336 | D594: =SUM(R507C[-1]:R[-1]C[-1]) -> 683496 | E594: =R[-100]C -> 110
A595: 5 | B595: 89 | C595: 21768 | D595: =SUM(R507C[-1]:R[-1]C[-1]) -> 704832 | E595: =R[-100]C -> 110
A596: 5 | B596: 90 | C596: 22200 | D596: =SUM(R507C[-1]:R[-1]C[-1]) -> 726600 | E596: =R[-100]C -> 120
A597: 5 | B597: 91 | C597: 22680 | D597: =SUM(R507C[-1]:R[-1]C[-1]) -> 748800 | E597: =R[-100]C -> 120
A598: 5 | B598: 92 | C598: 23160 | D598: =SUM(R507C[-1]:R[-1]C[-1]) -> 771480 | E598: =R[-100]C -> 120
A599: 5 | B599: 93 | C599: 23640 | D599: =SUM(R507C[-1]:R[-1]C[-1]) -> 794640 | E599: =R[-100]C -> 120
A600: 5 | B600: 94 | C600: 24120 | D600: =SUM(R507C[-1]:R[-1]C[-1]) -> 818280 | E600: =R[-100]C -> 120
A601: 5 | B601: 95 | C601: 24600 | D601: =SUM(R507C[-1]:R[-1]C[-1]) -> 842400 | E601: =R[-100]C -> 120
A602: 5 | B602: 96 | C602: 25080 | D602: =SUM(R507C[-1]:R[-1]C[-1]) -> 867000 | E602: =R[-100]C -> 120
A603: 5 | B603: 97 | C603: 25560 | D603: =SUM(R507C[-1]:R[-1]C[-1]) -> 892080 | E603: =R[-100]C -> 120
A604: 5 | B604: 98 | C604: 26040 | D604: =SUM(R507C[-1]:R[-1]C[-1]) -> 917640 | E604: =R[-100]C -> 120
A605: 5 | B605: 99 | C605: 26520 | D605: =SUM(R507C[-1]:R[-1]C[-1]) -> 943680 | E605: =R[-100]C -> 120
A606: 5 | B606: 100 | C606: 0 | D606: =SUM(R507C[-1]:R[-1]C[-1]) -> 970200 | E606: =R[-100]C -> 130

Sheet: 3.突破
A1: quality|quality | B1: break_level|break_level | C1: need_card_level|need_card_level | D1: cost_type_list|cost_type_list | E1: cost_value_list|cost_value_list | F1: cost_item_id_list|cost_item_id_list | G1: cost_item_num_list|cost_item_num_list | H1: cost_same_card_num|cost_same_card_num
A2: 不可空 | B2: 不可空 | C2: 不可空 | D2: 可空#不需字段 | E2: 可空#不需字段 | F2: 可空#不需字段 | G2: 可空#不需字段 | H2: 不可空
A3: 数字 | B3: 数字 | C3: 数字 | D3: 一维数组 | E3: 一维数组 | F3: 一维数组 | G3: 一维数组 | H3: 数字
D4: 不定长 | E4: 不定长 | F4: 不定长 | G4: 不定长
A6: 品质 | B6: 突破等级 | C6: 需要卡牌等级 | D6: 突破消耗类型列表(货币) | E6: 突破消耗值列表(货币) | F6: 消耗的物品ID列表 | G6: 消耗的物品数量列表 | H6: 消耗同名卡牌数量
A7: 0 | B7: 0 | C7: =R[1]C[-1]*10 -> 10 | D7: 3 | E7: =R[1]C[-3]*50000 -> 50000 | F7: 10009 | G7: 10 | H7: 0
A8: 0 | B8: 1 | C8: =R[1]C[-1]*10 -> 20 | D8: 3 | E8: =R[1]C[-3]*50000 -> 100000 | F8: 10009 | G8: 15 | H8: 0
A9: 0 | B9: 2 | C9: =R[1]C[-1]*10 -> 30 | D9: 3 | E9: =R[1]C[-3]*50000 -> 150000 | F9: 10009 | G9: 20 | H9: 0
A10: 0 | B10: 3 | C10: =R[1]C[-1]*10 -> 40 | D10: 3 | E10: =R[1]C[-3]*50000 -> 200000 | F10: 10009 | G10: 30 | H10: 0
A11: 0 | B11: 4 | C11: =R[1]C[-1]*10 -> 50 | D11: 3 | E11: =R[1]C[-3]*50000 -> 250000 | F11: 10009 | G11: 40 | H11: 0
A12: 0 | B12: 5 | C12: =R[1]C[-1]*10 -> 60 | D12: 3 | E12: =R[1]C[-3]*50000 -> 300000 | F12: 10009 | G12: 50 | H12: 1
A13: 0 | B13: 6 | C13: =R[1]C[-1]*10 -> 70 | D13: 3 | E13: =R[1]C[-3]*50000 -> 350000 | F13: 10009 | G13: 60 | H13: 1
A14: 0 | B14: 7 | C14: =R[1]C[-1]*10 -> 80 | D14: 3 | E14: =R[1]C[-3]*50000 -> 400000 | F14: 10009 | G14: 70 | H14: 1
A15: 0 | B15: 8 | C15: =R[1]C[-1]*10 -> 90 | D15: 3 | E15: =R[1]C[-3]*50000 -> 450000 | F15: 10009 | G15: 80 | H15: 1
A16: 0 | B16: 9 | C16: =R[1]C[-1]*10 -> 100 | D16: 3 | E16: =R[1]C[-3]*50000 -> 500000 | F16: 10009 | G16: 90 | H16: 1
A17: 0 | B17: 10 | C17: =R[1]C[-1]*10 -> 0 | D17: 3 | E17: =R[1]C[-3]*50000 -> 0 | F17: 10009 | G17: 0 | H17: 0
A18: =R[-11]C+1 -> 1 | B18: =R[-11]C -> 0 | C18: =R[1]C[-1]*10 -> 10 | D18: =R[-11]C -> 3 | E18: =R[-11]C -> 50000 | F18: =R[-11]C -> 10009 | G18: =R[-11]C -> 10 | H18: =R[-11]C -> 0
A19: =R[-11]C+1 -> 1 | B19: =R[-11]C -> 1 | C19: =R[1]C[-1]*10 -> 20 | D19: =R[-11]C -> 3 | E19: =R[-11]C -> 100000 | F19: =R[-11]C -> 10009 | G19: =R[-11]C -> 15 | H19: =R[-11]C -> 0
A20: =R[-11]C+1 -> 1 | B20: =R[-11]C -> 2 | C20: =R[1]C[-1]*10 -> 30 | D20: =R[-11]C -> 3 | E20: =R[-11]C -> 150000 | F20: =R[-11]C -> 10009 | G20: =R[-11]C -> 20 | H20: =R[-11]C -> 0
A21: =R[-11]C+1 -> 1 | B21: =R[-11]C -> 3 | C21: =R[1]C[-1]*10 -> 40 | D21: =R[-11]C -> 3 | E21: =R[-11]C -> 200000 | F21: =R[-11]C -> 10009 | G21: =R[-11]C -> 30 | H21: =R[-11]C -> 0
A22: =R[-11]C+1 -> 1 | B22: =R[-11]C -> 4 | C22: =R[1]C[-1]*10 -> 50 | D22: =R[-11]C -> 3 | E22: =R[-11]C -> 250000 | F22: =R[-11]C -> 10009 | G22: =R[-11]C -> 40 | H22: =R[-11]C -> 0
A23: =R[-11]C+1 -> 1 | B23: =R[-11]C -> 5 | C23: =R[1]C[-1]*10 -> 60 | D23: =R[-11]C -> 3 | E23: =R[-11]C -> 300000 | F23: =R[-11]C -> 10009 | G23: =R[-11]C -> 50 | H23: =R[-11]C -> 1
A24: =R[-11]C+1 -> 1 | B24: =R[-11]C -> 6 | C24: =R[1]C[-1]*10 -> 70 | D24: =R[-11]C -> 3 | E24: =R[-11]C -> 350000 | F24: =R[-11]C -> 10009 | G24: =R[-11]C -> 60 | H24: =R[-11]C -> 1
A25: =R[-11]C+1 -> 1 | B25: =R[-11]C -> 7 | C25: =R[1]C[-1]*10 -> 80 | D25: =R[-11]C -> 3 | E25: =R[-11]C -> 400000 | F25: =R[-11]C -> 10009 | G25: =R[-11]C -> 70 | H25: =R[-11]C -> 1
A26: =R[-11]C+1 -> 1 | B26: =R[-11]C -> 8 | C26: =R[1]C[-1]*10 -> 90 | D26: =R[-11]C -> 3 | E26: =R[-11]C -> 450000 | F26: =R[-11]C -> 10009 | G26: =R[-11]C -> 80 | H26: =R[-11]C -> 1
A27: =R[-11]C+1 -> 1 | B27: =R[-11]C -> 9 | C27: =R[1]C[-1]*10 -> 100 | D27: =R[-11]C -> 3 | E27: =R[-11]C -> 500000 | F27: =R[-11]C -> 10009 | G27: =R[-11]C -> 90 | H27: =R[-11]C -> 1
A28: =R[-11]C+1 -> 1 | B28: =R[-11]C -> 10 | C28: =R[1]C[-1]*10 -> 0 | D28: =R[-11]C -> 3 | E28: =R[-11]C -> 0 | F28: =R[-11]C -> 10009 | G28: =R[-11]C -> 0 | H28: =R[-11]C -> 0
A29: =R[-11]C+1 -> 2 | B29: =R[-11]C -> 0 | C29: =R[1]C[-1]*10 -> 10 | D29: =R[-11]C -> 3 | E29: =R[-11]C -> 50000 | F29: =R[-11]C -> 10009 | G29: =R[-11]C -> 10 | H29: =R[-11]C -> 0
A30: =R[-11]C+1 -> 2 | B30: =R[-11]C -> 1 | C30: =R[1]C[-1]*10 -> 20 | D30: =R[-11]C -> 3 | E30: =R[-11]C -> 100000 | F30: =R[-11]C -> 10009 | G30: =R[-11]C -> 15 | H30: =R[-11]C -> 0
A31: =R[-11]C+1 -> 2 | B31: =R[-11]C -> 2 | C31: =R[1]C[-1]*10 -> 30 | D31: =R[-11]C -> 3 | E31: =R[-11]C -> 150000 | F31: =R[-11]C -> 10009 | G31: =R[-11]C -> 20 | H31: =R[-11]C -> 0
A32: =R[-11]C+1 -> 2 | B32: =R[-11]C -> 3 | C32: =R[1]C[-1]*10 -> 40 | D32: =R[-11]C -> 3 | E32: =R[-11]C -> 200000 | F32: =R[-11]C -> 10009 | G32: =R[-11]C -> 30 | H32: =R[-11]C -> 0
A33: =R[-11]C+1 -> 2 | B33: =R[-11]C -> 4 | C33: =R[1]C[-1]*10 -> 50 | D33: =R[-11]C -> 3 | E33: =R[-11]C -> 250000 | F33: =R[-11]C -> 10009 | G33: =R[-11]C -> 40 | H33: =R[-11]C -> 0
A34: =R[-11]C+1 -> 2 | B34: =R[-11]C -> 5 | C34: =R[1]C[-1]*10 -> 60 | D34: =R[-11]C -> 3 | E34: =R[-11]C -> 300000 | F34: =R[-11]C -> 10009 | G34: =R[-11]C -> 50 | H34: =R[-11]C -> 1
A35: =R[-11]C+1 -> 2 | B35: =R[-11]C -> 6 | C35: =R[1]C[-1]*10 -> 70 | D35: =R[-11]C -> 3 | E35: =R[-11]C -> 350000 | F35: =R[-11]C -> 10009 | G35: =R[-11]C -> 60 | H35: =R[-11]C -> 1
A36: =R[-11]C+1 -> 2 | B36: =R[-11]C -> 7 | C36: =R[1]C[-1]*10 -> 80 | D36: =R[-11]C -> 3 | E36: =R[-11]C -> 400000 | F36: =R[-11]C -> 10009 | G36: =R[-11]C -> 70 | H36: =R[-11]C -> 1
A37: =R[-11]C+1 -> 2 | B37: =R[-11]C -> 8 | C37: =R[1]C[-1]*10 -> 90 | D37: =R[-11]C -> 3 | E37: =R[-11]C -> 450000 | F37: =R[-11]C -> 10009 | G37: =R[-11]C -> 80 | H37: =R[-11]C -> 1
A38: =R[-11]C+1 -> 2 | B38: =R[-11]C -> 9 | C38: =R[1]C[-1]*10 -> 100 | D38: =R[-11]C -> 3 | E38: =R[-11]C -> 500000 | F38: =R[-11]C -> 10009 | G38: =R[-11]C -> 90 | H38: =R[-11]C -> 1
A39: =R[-11]C+1 -> 2 | B39: =R[-11]C -> 10 | C39: =R[1]C[-1]*10 -> 0 | D39: =R[-11]C -> 3 | E39: =R[-11]C -> 0 | F39: =R[-11]C -> 10009 | G39: =R[-11]C -> 0 | H39: =R[-11]C -> 0
A40: =R[-11]C+1 -> 3 | B40: =R[-11]C -> 0 | C40: =R[1]C[-1]*10 -> 10 | D40: =R[-11]C -> 3 | E40: =R[-11]C -> 50000 | F40: =R[-11]C -> 10009 | G40: =R[-11]C -> 10 | H40: =R[-11]C -> 0
A41: =R[-11]C+1 -> 3 | B41: =R[-11]C -> 1 | C41: =R[1]C[-1]*10 -> 20 | D41: =R[-11]C -> 3 | E41: =R[-11]C -> 100000 | F41: =R[-11]C -> 10009 | G41: =R[-11]C -> 15 | H41: =R[-11]C -> 0
A42: =R[-11]C+1 -> 3 | B42: =R[-11]C -> 2 | C42: =R[1]C[-1]*10 -> 30 | D42: =R[-11]C -> 3 | E42: =R[-11]C -> 150000 | F42: =R[-11]C -> 10009 | G42: =R[-11]C -> 20 | H42: =R[-11]C -> 0
A43: =R[-11]C+1 -> 3 | B43: =R[-11]C -> 3 | C43: =R[1]C[-1]*10 -> 40 | D43: =R[-11]C -> 3 | E43: =R[-11]C -> 200000 | F43: =R[-11]C -> 10009 | G43: =R[-11]C -> 30 | H43: =R[-11]C -> 0
A44: =R[-11]C+1 -> 3 | B44: =R[-11]C -> 4 | C44: =R[1]C[-1]*10 -> 50 | D44: =R[-11]C -> 3 | E44: =R[-11]C -> 250000 | F44: =R[-11]C -> 10009 | G44: =R[-11]C -> 40 | H44: =R[-11]C -> 0
A45: =R[-11]C+1 -> 3 | B45: =R[-11]C -> 5 | C45: =R[1]C[-1]*10 -> 60 | D45: =R[-11]C -> 3 | E45: =R[-11]C -> 300000 | F45: =R[-11]C -> 10009 | G45: =R[-11]C -> 50 | H45: =R[-11]C -> 1
A46: =R[-11]C+1 -> 3 | B46: =R[-11]C -> 6 | C46: =R[1]C[-1]*10 -> 70 | D46: =R[-11]C -> 3 | E46: =R[-11]C -> 350000 | F46: =R[-11]C -> 10009 | G46: =R[-11]C -> 60 | H46: =R[-11]C -> 1
A47: =R[-11]C+1 -> 3 | B47: =R[-11]C -> 7 | C47: =R[1]C[-1]*10 -> 80 | D47: =R[-11]C -> 3 | E47: =R[-11]C -> 400000 | F47: =R[-11]C -> 10009 | G47: =R[-11]C -> 70 | H47: =R[-11]C -> 1
A48: =R[-11]C+1 -> 3 | B48: =R[-11]C -> 8 | C48: =R[1]C[-1]*10 -> 90 | D48: =R[-11]C -> 3 | E48: =R[-11]C -> 450000 | F48: =R[-11]C -> 10009 | G48: =R[-11]C -> 80 | H48: =R[-11]C -> 1
A49: =R[-11]C+1 -> 3 | B49: =R[-11]C -> 9 | C49: =R[1]C[-1]*10 -> 100 | D49: =R[-11]C -> 3 | E49: =R[-11]C -> 500000 | F49: =R[-11]C -> 10009 | G49: =R[-11]C -> 90 | H49: =R[-11]C -> 1
A50: =R[-11]C+1 -> 3 | B50: =R[-11]C -> 10 | C50: =R[1]C[-1]*10 -> 0 | D50: =R[-11]C -> 3 | E50: =R[-11]C -> 0 | F50: =R[-11]C -> 10009 | G50: =R[-11]C -> 0 | H50: =R[-11]C -> 0
A51: =R[-11]C+1 -> 4 | B51: =R[-11]C -> 0 | C51: =R[1]C[-1]*10 -> 10 | D51: =R[-11]C -> 3 | E51: =R[-11]C -> 50000 | F51: =R[-11]C -> 10009 | G51: =R[-11]C -> 10 | H51: =R[-11]C -> 0
A52: =R[-11]C+1 -> 4 | B52: =R[-11]C -> 1 | C52: =R[1]C[-1]*10 -> 20 | D52: =R[-11]C -> 3 | E52: =R[-11]C -> 100000 | F52: =R[-11]C -> 10009 | G52: =R[-11]C -> 15 | H52: =R[-11]C -> 0
A53: =R[-11]C+1 -> 4 | B53: =R[-11]C -> 2 | C53: =R[1]C[-1]*10 -> 30 | D53: =R[-11]C -> 3 | E53: =R[-11]C -> 150000 | F53: =R[-11]C -> 10009 | G53: =R[-11]C -> 20 | H53: =R[-11]C -> 0
A54: =R[-11]C+1 -> 4 | B54: =R[-11]C -> 3 | C54: =R[1]C[-1]*10 -> 40 | D54: =R[-11]C -> 3 | E54: =R[-11]C -> 200000 | F54: =R[-11]C -> 10009 | G54: =R[-11]C -> 30 | H54: =R[-11]C -> 0
A55: =R[-11]C+1 -> 4 | B55: =R[-11]C -> 4 | C55: =R[1]C[-1]*10 -> 50 | D55: =R[-11]C -> 3 | E55: =R[-11]C -> 250000 | F55: =R[-11]C -> 10009 | G55: =R[-11]C -> 40 | H55: =R[-11]C -> 0
A56: =R[-11]C+1 -> 4 | B56: =R[-11]C -> 5 | C56: =R[1]C[-1]*10 -> 60 | D56: =R[-11]C -> 3 | E56: =R[-11]C -> 300000 | F56: =R[-11]C -> 10009 | G56: =R[-11]C -> 50 | H56: =R[-11]C -> 1
A57: =R[-11]C+1 -> 4 | B57: =R[-11]C -> 6 | C57: =R[1]C[-1]*10 -> 70 | D57: =R[-11]C -> 3 | E57: =R[-11]C -> 350000 | F57: =R[-11]C -> 10009 | G57: =R[-11]C -> 60 | H57: =R[-11]C -> 1
A58: =R[-11]C+1 -> 4 | B58: =R[-11]C -> 7 | C58: =R[1]C[-1]*10 -> 80 | D58: =R[-11]C -> 3 | E58: =R[-11]C -> 400000 | F58: =R[-11]C -> 10009 | G58: =R[-11]C -> 70 | H58: =R[-11]C -> 1
A59: =R[-11]C+1 -> 4 | B59: =R[-11]C -> 8 | C59: =R[1]C[-1]*10 -> 90 | D59: =R[-11]C -> 3 | E59: =R[-11]C -> 450000 | F59: =R[-11]C -> 10009 | G59: =R[-11]C -> 80 | H59: =R[-11]C -> 1
A60: =R[-11]C+1 -> 4 | B60: =R[-11]C -> 9 | C60: =R[1]C[-1]*10 -> 100 | D60: =R[-11]C -> 3 | E60: =R[-11]C -> 500000 | F60: =R[-11]C -> 10009 | G60: =R[-11]C -> 90 | H60: =R[-11]C -> 1
A61: =R[-11]C+1 -> 4 | B61: =R[-11]C -> 10 | C61: =R[1]C[-1]*10 -> 0 | D61: =R[-11]C -> 3 | E61: =R[-11]C -> 0 | F61: =R[-11]C -> 10009 | G61: =R[-11]C -> 0 | H61: =R[-11]C -> 0
A62: =R[-11]C+1 -> 5 | B62: =R[-11]C -> 0 | C62: =R[1]C[-1]*10 -> 10 | D62: =R[-11]C -> 3 | E62: =R[-11]C -> 50000 | F62: =R[-11]C -> 10009 | G62: =R[-11]C -> 10 | H62: =R[-11]C -> 0
A63: =R[-11]C+1 -> 5 | B63: =R[-11]C -> 1 | C63: =R[1]C[-1]*10 -> 20 | D63: =R[-11]C -> 3 | E63: =R[-11]C -> 100000 | F63: =R[-11]C -> 10009 | G63: =R[-11]C -> 15 | H63: =R[-11]C -> 0
A64: =R[-11]C+1 -> 5 | B64: =R[-11]C -> 2 | C64: =R[1]C[-1]*10 -> 30 | D64: =R[-11]C -> 3 | E64: =R[-11]C -> 150000 | F64: =R[-11]C -> 10009 | G64: =R[-11]C -> 20 | H64: =R[-11]C -> 0
A65: =R[-11]C+1 -> 5 | B65: =R[-11]C -> 3 | C65: =R[1]C[-1]*10 -> 40 | D65: =R[-11]C -> 3 | E65: =R[-11]C -> 200000 | F65: =R[-11]C -> 10009 | G65: =R[-11]C -> 30 | H65: =R[-11]C -> 0
A66: =R[-11]C+1 -> 5 | B66: =R[-11]C -> 4 | C66: =R[1]C[-1]*10 -> 50 | D66: =R[-11]C -> 3 | E66: =R[-11]C -> 250000 | F66: =R[-11]C -> 10009 | G66: =R[-11]C -> 40 | H66: =R[-11]C -> 0
A67: =R[-11]C+1 -> 5 | B67: =R[-11]C -> 5 | C67: =R[1]C[-1]*10 -> 60 | D67: =R[-11]C -> 3 | E67: =R[-11]C -> 300000 | F67: =R[-11]C -> 10009 | G67: =R[-11]C -> 50 | H67: =R[-11]C -> 1
A68: =R[-11]C+1 -> 5 | B68: =R[-11]C -> 6 | C68: =R[1]C[-1]*10 -> 70 | D68: =R[-11]C -> 3 | E68: =R[-11]C -> 350000 | F68: =R[-11]C -> 10009 | G68: =R[-11]C -> 60 | H68: =R[-11]C -> 1
A69: =R[-11]C+1 -> 5 | B69: =R[-11]C -> 7 | C69: =R[1]C[-1]*10 -> 80 | D69: =R[-11]C -> 3 | E69: =R[-11]C -> 400000 | F69: =R[-11]C -> 10009 | G69: =R[-11]C -> 70 | H69: =R[-11]C -> 1
A70: =R[-11]C+1 -> 5 | B70: =R[-11]C -> 8 | C70: =R[1]C[-1]*10 -> 90 | D70: =R[-11]C -> 3 | E70: =R[-11]C -> 450000 | F70: =R[-11]C -> 10009 | G70: =R[-11]C -> 80 | H70: =R[-11]C -> 1
A71: =R[-11]C+1 -> 5 | B71: =R[-11]C -> 9 | C71: =R[1]C[-1]*10 -> 100 | D71: =R[-11]C -> 3 | E71: =R[-11]C -> 500000 | F71: =R[-11]C -> 10009 | G71: =R[-11]C -> 90 | H71: =R[-11]C -> 1
A72: =R[-11]C+1 -> 5 | B72: =R[-11]C -> 10 | C72: =R[1]C[-1]*10 -> 0 | D72: =R[-11]C -> 3 | E72: =R[-11]C -> 0 | F72: =R[-11]C -> 10009 | G72: =R[-11]C -> 0 | H72: =R[-11]C -> 0

Sheet: 4.低级卡组
A1: group_id|group_id | B1: card_id|card_id | C1: |weight | D1: quality|
A2: 不可空 | B2: 不可空 | C2: 不可空 | D2: 不可空
A3: 数字 | B3: 数字 | C3: 数字 | D3: 数字
G5: 10 | H5: 20 | I5: 56 | J5: 822 | K5: 5529 | L5: 12000
A6: 卡组Id | B6: 卡牌Id | C6: 抽中权值 | D6: 品质 | F6: 卡组 | G6: 白几率 | H6: 绿几率 | I6: 蓝几率 | J6: 紫几率 | K6: 橙几率 | L6: 红几率 | M6: 单抽价值
A7: 1 | B7: 70000 | C7: =ROUND(VLOOKUP(RC[-2],R6C6:R14C11,RC[1]+2,FALSE)*10000/COUNTIFS(C[1],RC[1],C[-2],RC[-2]),0) -> 1000 | D7: =INT(MOD(RC[-2],1000)/100) -> 0 | F7: 1 | G7: =1-SUM(RC[1]:RC[5]) -> 0.5 | H7: 0.3 | I7: 0.2 | M7: =SUMPRODUCT(R5C7:R5C12,RC[-6]:RC[-1]) -> 22.2
A8: 1 | B8: 70022 | C8: =ROUND(VLOOKUP(RC[-2],R6C6:R14C11,RC[1]+2,FALSE)*10000/COUNTIFS(C[1],RC[1],C[-2],RC[-2]),0) -> 1000 | D8: =INT(MOD(RC[-2],1000)/100) -> 0 | F8: 2 | G8: =1-SUM(RC[1]:RC[5]) -> 0.495 | H8: 0.3 | I8: 0.2 | J8: 0.005 | M8: =SUMPRODUCT(R5C7:R5C12,RC[-6]:RC[-1]) -> 26.26 | N8: =RC[-1]-R[-1]C[-1] -> 4.06 | O8: 最高可抽到 <COLOR VALUE=FFf041dd>紫品卡牌</COLOR>
A9: 1 | B9: 70023 | C9: =ROUND(VLOOKUP(RC[-2],R6C6:R14C11,RC[1]+2,FALSE)*10000/COUNTIFS(C[1],RC[1],C[-2],RC[-2]),0) -> 1000 | D9: =INT(MOD(RC[-2],1000)/100) -> 0 | F9: 3 | G9: =1-SUM(RC[1]:RC[5]) -> 0.44 | H9: 0.35 | I9: 0.2 | J9: 0.01 | M9: =SUMPRODUCT(R5C7:R5C12,RC[-6]:RC[-1]) -> 30.82 | N9: =RC[-1]-R[-1]C[-1] -> 4.56 | O9: 抽到 <COLOR VALUE=FFf041dd>紫品卡牌</COLOR> 和<COLOR VALUE=FF6ef12d>绿品卡牌</COLOR>的几率提升
A10: 1 | B10: 70024 | C10: =ROUND(VLOOKUP(RC[-2],R6C6:R14C11,RC[1]+2,FALSE)*10000/COUNTIFS(C[1],RC[1],C[-2],RC[-2]),0) -> 1000 | D10: =INT(MOD(RC[-2],1000)/100) -> 0 | F10: 4 | G10: =1-SUM(RC[1]:RC[5]) -> 0.415 | H10: 0.35 | I10: 0.22 | J10: 0.015 | M10: =SUMPRODUCT(R5C7:R5C12,RC[-6]:RC[-1]) -> 35.8 | N10: =RC[-1]-R[-1]C[-1] -> 4.98 | O10: 抽到 <COLOR VALUE=FFf041dd>紫品卡牌</COLOR> 和 <COLOR VALUE=FF00b4ff>蓝品卡牌</COLOR> 的几率提升
A11: 1 | B11: 70025 | C11: =ROUND(VLOOKUP(RC[-2],R6C6:R14C11,RC[1]+2,FALSE)*10000/COUNTIFS(C[1],RC[1],C[-2],RC[-2]),0) -> 1000 | D11: =INT(MOD(RC[-2],1000)/100) -> 0 | F11: 5 | G11: =1-SUM(RC[1]:RC[5]) -> 0.31 | H11: 0.45 | I11: 0.22 | J11: 0.02 | M11: =SUMPRODUCT(R5C7:R5C12,RC[-6]:RC[-1]) -> 40.86 | N11: =RC[-1]-R[-1]C[-1] -> 5.06 | O11: 抽到 <COLOR VALUE=FFf041dd>紫品卡牌</COLOR> 和<COLOR VALUE=FF6ef12d>绿品卡牌</COLOR>的几率提升
A12: 1 | B12: 70100 | C12: =ROUND(VLOOKUP(RC[-2],R6C6:R14C11,RC[1]+2,FALSE)*10000/COUNTIFS(C[1],RC[1],C[-2],RC[-2]),0) -> 600 | D12: =INT(MOD(RC[-2],1000)/100) -> 1 | F12: 6 | G12: =1-SUM(RC[1]:RC[5]) -> 0.27 | H12: 0.45 | I12: 0.25 | J12: 0.03 | M12: =SUMPRODUCT(R5C7:R5C12,RC[-6]:RC[-1]) -> 50.36 | N12: =RC[-1]-R[-1]C[-1] -> 9.5 | O12: 抽到 <COLOR VALUE=FFf041dd>紫品卡牌</COLOR> 和 <COLOR VALUE=FF00b4ff>蓝品卡牌</COLOR> 的几率提升
A13: 1 | B13: 70122 | C13: =ROUND(VLOOKUP(RC[-2],R6C6:R14C11,RC[1]+2,FALSE)*10000/COUNTIFS(C[1],RC[1],C[-2],RC[-2]),0) -> 600 | D13: =INT(MOD(RC[-2],1000)/100) -> 1 | F13: 7 | G13: =1-SUM(RC[1]:RC[5]) -> 0.11 | H13: 0.6 | I13: 0.25 | J13: 0.04 | M13: =SUMPRODUCT(R5C7:R5C12,RC[-6]:RC[-1]) -> 59.98 | N13: =RC[-1]-R[-1]C[-1] -> 9.62 | O13: 抽到 <COLOR VALUE=FFf041dd>紫品卡牌</COLOR> 和<COLOR VALUE=FF6ef12d>绿品卡牌</COLOR>的几率提升
A14: 1 | B14: 70123 | C14: =ROUND(VLOOKUP(RC[-2],R6C6:R14C11,RC[1]+2,FALSE)*10000/COUNTIFS(C[1],RC[1],C[-2],RC[-2]),0) -> 600 | D14: =INT(MOD(RC[-2],1000)/100) -> 1 | F14: 8 | G14: =1-SUM(RC[1]:RC[5]) -> 0.098 | H14: 0.6 | I14: 0.25 | J14: 0.05 | K14: 0.002 | M14: =SUMPRODUCT(R5C7:R5C12,RC[-6]:RC[-1]) -> 79.138 | N14: =RC[-1]-R[-1]C[-1] -> 19.158 | O14: 最高可抽到 <COLOR VALUE=FFff993f>橙品卡牌</COLOR>，抽到 <COLOR VALUE=FFf041dd>紫品卡牌</COLOR> 的几率提升
A15: 1 | B15: 70124 | C15: =ROUND(VLOOKUP(RC[-2],R6C6:R14C11,RC[1]+2,FALSE)*10000/COUNTIFS(C[1],RC[1],C[-2],RC[-2]),0) -> 600 | D15: =INT(MOD(RC[-2],1000)/100) -> 1 | F15: 高级 | G15: =1-SUM(RC[1]:RC[5]) -> 0 | H15: 0.54 | I15: 0.4 | J15: 0.05 | K15: 0.01 | M15: =SUMPRODUCT(R5C7:R5C12,RC[-6]:RC[-1]) -> 129.59
A16: 1 | B16: 70125 | C16: =ROUND(VLOOKUP(RC[-2],R6C6:R14C11,RC[1]+2,FALSE)*10000/COUNTIFS(C[1],RC[1],C[-2],RC[-2]),0) -> 600 | D16: =INT(MOD(RC[-2],1000)/100) -> 1
A17: 1 | B17: 70200 | C17: =ROUND(VLOOKUP(RC[-2],R6C6:R14C11,RC[1]+2,FALSE)*10000/COUNTIFS(C[1],RC[1],C[-2],RC[-2]),0) -> 77 | D17: =INT(MOD(RC[-2],1000)/100) -> 2
A18: 1 | B18: 70201 | C18: =ROUND(VLOOKUP(RC[-2],R6C6:R14C11,RC[1]+2,FALSE)*10000/COUNTIFS(C[1],RC[1],C[-2],RC[-2]),0) -> 77 | D18: =INT(MOD(RC[-2],1000)/100) -> 2
A19: 1 | B19: 70202 | C19: =ROUND(VLOOKUP(RC[-2],R6C6:R14C11,RC[1]+2,FALSE)*10000/COUNTIFS(C[1],RC[1],C[-2],RC[-2]),0) -> 77 | D19: =INT(MOD(RC[-2],1000)/100) -> 2
A20: 1 | B20: 70203 | C20: =ROUND(VLOOKUP(RC[-2],R6C6:R14C11,RC[1]+2,FALSE)*10000/COUNTIFS(C[1],RC[1],C[-2],RC[-2]),0) -> 77 | D20: =INT(MOD(RC[-2],1000)/100) -> 2
A21: 1 | B21: 70204 | C21: =ROUND(VLOOKUP(RC[-2],R6C6:R14C11,RC[1]+2,FALSE)*10000/COUNTIFS(C[1],RC[1],C[-2],RC[-2]),0) -> 77 | D21: =INT(MOD(RC[-2],1000)/100) -> 2
A22: 1 | B22: 70205 | C22: =ROUND(VLOOKUP(RC[-2],R6C6:R14C11,RC[1]+2,FALSE)*10000/COUNTIFS(C[1],RC[1],C[-2],RC[-2]),0) -> 77 | D22: =INT(MOD(RC[-2],1000)/100) -> 2
A23: 1 | B23: 70206 | C23: =ROUND(VLOOKUP(RC[-2],R6C6:R14C11,RC[1]+2,FALSE)*10000/COUNTIFS(C[1],RC[1],C[-2],RC[-2]),0) -> 77 | D23: =INT(MOD(RC[-2],1000)/100) -> 2
A24: 1 | B24: 70207 | C24: =ROUND(VLOOKUP(RC[-2],R6C6:R14C11,RC[1]+2,FALSE)*10000/COUNTIFS(C[1],RC[1],C[-2],RC[-2]),0) -> 77 | D24: =INT(MOD(RC[-2],1000)/100) -> 2
A25: 1 | B25: 70208 | C25: =ROUND(VLOOKUP(RC[-2],R6C6:R14C11,RC[1]+2,FALSE)*10000/COUNTIFS(C[1],RC[1],C[-2],RC[-2]),0) -> 77 | D25: =INT(MOD(RC[-2],1000)/100) -> 2
A26: 1 | B26: 70209 | C26: =ROUND(VLOOKUP(RC[-2],R6C6:R14C11,RC[1]+2,FALSE)*10000/COUNTIFS(C[1],RC[1],C[-2],RC[-2]),0) -> 77 | D26: =INT(MOD(RC[-2],1000)/100) -> 2
A27: 1 | B27: 70210 | C27: =ROUND(VLOOKUP(RC[-2],R6C6:R14C11,RC[1]+2,FALSE)*10000/COUNTIFS(C[1],RC[1],C[-2],RC[-2]),0) -> 77 | D27: =INT(MOD(RC[-2],1000)/100) -> 2
A28: 1 | B28: 70211 | C28: =ROUND(VLOOKUP(RC[-2],R6C6:R14C11,RC[1]+2,FALSE)*10000/COUNTIFS(C[1],RC[1],C[-2],RC[-2]),0) -> 77 | D28: =INT(MOD(RC[-2],1000)/100) -> 2
A29: 1 | B29: 70212 | C29: =ROUND(VLOOKUP(RC[-2],R6C6:R14C11,RC[1]+2,FALSE)*10000/COUNTIFS(C[1],RC[1],C[-2],RC[-2]),0) -> 77 | D29: =INT(MOD(RC[-2],1000)/100) -> 2
A30: 1 | B30: 70213 | C30: =ROUND(VLOOKUP(RC[-2],R6C6:R14C11,RC[1]+2,FALSE)*10000/COUNTIFS(C[1],RC[1],C[-2],RC[-2]),0) -> 77 | D30: =INT(MOD(RC[-2],1000)/100) -> 2
A31: 1 | B31: 70214 | C31: =ROUND(VLOOKUP(RC[-2],R6C6:R14C11,RC[1]+2,FALSE)*10000/COUNTIFS(C[1],RC[1],C[-2],RC[-2]),0) -> 77 | D31: =INT(MOD(RC[-2],1000)/100) -> 2
A32: 1 | B32: 70215 | C32: =ROUND(VLOOKUP(RC[-2],R6C6:R14C11,RC[1]+2,FALSE)*10000/COUNTIFS(C[1],RC[1],C[-2],RC[-2]),0) -> 77 | D32: =INT(MOD(RC[-2],1000)/100) -> 2
A33: 1 | B33: 70216 | C33: =ROUND(VLOOKUP(RC[-2],R6C6:R14C11,RC[1]+2,FALSE)*10000/COUNTIFS(C[1],RC[1],C[-2],RC[-2]),0) -> 77 | D33: =INT(MOD(RC[-2],1000)/100) -> 2
A34: 1 | B34: 70217 | C34: =ROUND(VLOOKUP(RC[-2],R6C6:R14C11,RC[1]+2,FALSE)*10000/COUNTIFS(C[1],RC[1],C[-2],RC[-2]),0) -> 77 | D34: =INT(MOD(RC[-2],1000)/100) -> 2
A35: 1 | B35: 70218 | C35: =ROUND(VLOOKUP(RC[-2],R6C6:R14C11,RC[1]+2,FALSE)*10000/COUNTIFS(C[1],RC[1],C[-2],RC[-2]),0) -> 77 | D35: =INT(MOD(RC[-2],1000)/100) -> 2
A36: 1 | B36: 70219 | C36: =ROUND(VLOOKUP(RC[-2],R6C6:R14C11,RC[1]+2,FALSE)*10000/COUNTIFS(C[1],RC[1],C[-2],RC[-2]),0) -> 77 | D36: =INT(MOD(RC[-2],1000)/100) -> 2
A37: 1 | B37: 70220 | C37: =ROUND(VLOOKUP(RC[-2],R6C6:R14C11,RC[1]+2,FALSE)*10000/COUNTIFS(C[1],RC[1],C[-2],RC[-2]),0) -> 77 | D37: =INT(MOD(RC[-2],1000)/100) -> 2
A38: 1 | B38: 70221 | C38: =ROUND(VLOOKUP(RC[-2],R6C6:R14C11,RC[1]+2,FALSE)*10000/COUNTIFS(C[1],RC[1],C[-2],RC[-2]),0) -> 77 | D38: =INT(MOD(RC[-2],1000)/100) -> 2
A39: 1 | B39: 70222 | C39: =ROUND(VLOOKUP(RC[-2],R6C6:R14C11,RC[1]+2,FALSE)*10000/COUNTIFS(C[1],RC[1],C[-2],RC[-2]),0) -> 77 | D39: =INT(MOD(RC[-2],1000)/100) -> 2
A40: 1 | B40: 70223 | C40: =ROUND(VLOOKUP(RC[-2],R6C6:R14C11,RC[1]+2,FALSE)*10000/COUNTIFS(C[1],RC[1],C[-2],RC[-2]),0) -> 77 | D40: =INT(MOD(RC[-2],1000)/100) -> 2
A41: 1 | B41: 70224 | C41: =ROUND(VLOOKUP(RC[-2],R6C6:R14C11,RC[1]+2,FALSE)*10000/COUNTIFS(C[1],RC[1],C[-2],RC[-2]),0) -> 77 | D41: =INT(MOD(RC[-2],1000)/100) -> 2
A42: 1 | B42: 70225 | C42: =ROUND(VLOOKUP(RC[-2],R6C6:R14C11,RC[1]+2,FALSE)*10000/COUNTIFS(C[1],RC[1],C[-2],RC[-2]),0) -> 77 | D42: =INT(MOD(RC[-2],1000)/100) -> 2
A43: 2 | B43: 70000 | C43: =ROUND(VLOOKUP(RC[-2],R6C6:R14C11,RC[1]+2,FALSE)*10000/COUNTIFS(C[1],RC[1],C[-2],RC[-2]),0) -> 990 | D43: =INT(MOD(RC[-2],1000)/100) -> 0
A44: 2 | B44: 70022 | C44: =ROUND(VLOOKUP(RC[-2],R6C6:R14C11,RC[1]+2,FALSE)*10000/COUNTIFS(C[1],RC[1],C[-2],RC[-2]),0) -> 990 | D44: =INT(MOD(RC[-2],1000)/100) -> 0
A45: 2 | B45: 70023 | C45: =ROUND(VLOOKUP(RC[-2],R6C6:R14C11,RC[1]+2,FALSE)*10000/COUNTIFS(C[1],RC[1],C[-2],RC[-2]),0) -> 990 | D45: =INT(MOD(RC[-2],1000)/100) -> 0
A46: 2 | B46: 70024 | C46: =ROUND(VLOOKUP(RC[-2],R6C6:R14C11,RC[1]+2,FALSE)*10000/COUNTIFS(C[1],RC[1],C[-2],RC[-2]),0) -> 990 | D46: =INT(MOD(RC[-2],1000)/100) -> 0
A47: 2 | B47: 70025 | C47: =ROUND(VLOOKUP(RC[-2],R6C6:R14C11,RC[1]+2,FALSE)*10000/COUNTIFS(C[1],RC[1],C[-2],RC[-2]),0) -> 990 | D47: =INT(MOD(RC[-2],1000)/100) -> 0
A48: 2 | B48: 70100 | C48: =ROUND(VLOOKUP(RC[-2],R6C6:R14C11,RC[1]+2,FALSE)*10000/COUNTIFS(C[1],RC[1],C[-2],RC[-2]),0) -> 600 | D48: =INT(MOD(RC[-2],1000)/100) -> 1
A49: 2 | B49: 70122 | C49: =ROUND(VLOOKUP(RC[-2],R6C6:R14C11,RC[1]+2,FALSE)*10000/COUNTIFS(C[1],RC[1],C[-2],RC[-2]),0) -> 600 | D49: =INT(MOD(RC[-2],1000)/100) -> 1
A50: 2 | B50: 70123 | C50: =ROUND(VLOOKUP(RC[-2],R6C6:R14C11,RC[1]+2,FALSE)*10000/COUNTIFS(C[1],RC[1],C[-2],RC[-2]),0) -> 600 | D50: =INT(MOD(RC[-2],1000)/100) -> 1
A51: 2 | B51: 70124 | C51: =ROUND(VLOOKUP(RC[-2],R6C6:R14C11,RC[1]+2,FALSE)*10000/COUNTIFS(C[1],RC[1],C[-2],RC[-2]),0) -> 600 | D51: =INT(MOD(RC[-2],1000)/100) -> 1
A52: 2 | B52: 70125 | C52: =ROUND(VLOOKUP(RC[-2],R6C6:R14C11,RC[1]+2,FALSE)*10000/COUNTIFS(C[1],RC[1],C[-2],RC[-2]),0) -> 600 | D52: =INT(MOD(RC[-2],1000)/100) -> 1
A53: 2 | B53: 70200 | C53: =ROUND(VLOOKUP(RC[-2],R6C6:R14C11,RC[1]+2,FALSE)*10000/COUNTIFS(C[1],RC[1],C[-2],RC[-2]),0) -> 77 | D53: =INT(MOD(RC[-2],1000)/100) -> 2
A54: 2 | B54: 70201 | C54: =ROUND(VLOOKUP(RC[-2],R6C6:R14C11,RC[1]+2,FALSE)*10000/COUNTIFS(C[1],RC[1],C[-2],RC[-2]),0) -> 77 | D54: =INT(MOD(RC[-2],1000)/100) -> 2
A55: 2 | B55: 70202 | C55: =ROUND(VLOOKUP(RC[-2],R6C6:R14C11,RC[1]+2,FALSE)*10000/COUNTIFS(C[1],RC[1],C[-2],RC[-2]),0) -> 77 | D55: =INT(MOD(RC[-2],1000)/100) -> 2
A56: 2 | B56: 70203 | C56: =ROUND(VLOOKUP(RC[-2],R6C6:R14C11,RC[1]+2,FALSE)*10000/COUNTIFS(C[1],RC[1],C[-2],RC[-2]),0) -> 77 | D56: =INT(MOD(RC[-2],1000)/100) -> 2
A57: 2 | B57: 70204 | C57: =ROUND(VLOOKUP(RC[-2],R6C6:R14C11,RC[1]+2,FALSE)*10000/COUNTIFS(C[1],RC[1],C[-2],RC[-2]),0) -> 77 | D57: =INT(MOD(RC[-2],1000)/100) -> 2
A58: 2 | B58: 70205 | C58: =ROUND(VLOOKUP(RC[-2],R6C6:R14C11,RC[1]+2,FALSE)*10000/COUNTIFS(C[1],RC[1],C[-2],RC[-2]),0) -> 77 | D58: =INT(MOD(RC[-2],1000)/100) -> 2
A59: 2 | B59: 70206 | C59: =ROUND(VLOOKUP(RC[-2],R6C6:R14C11,RC[1]+2,FALSE)*10000/COUNTIFS(C[1],RC[1],C[-2],RC[-2]),0) -> 77 | D59: =INT(MOD(RC[-2],1000)/100) -> 2
A60: 2 | B60: 70207 | C60: =ROUND(VLOOKUP(RC[-2],R6C6:R14C11,RC[1]+2,FALSE)*10000/COUNTIFS(C[1],RC[1],C[-2],RC[-2]),0) -> 77 | D60: =INT(MOD(RC[-2],1000)/100) -> 2
A61: 2 | B61: 70208 | C61: =ROUND(VLOOKUP(RC[-2],R6C6:R14C11,RC[1]+2,FALSE)*10000/COUNTIFS(C[1],RC[1],C[-2],RC[-2]),0) -> 77 | D61: =INT(MOD(RC[-2],1000)/100) -> 2
A62: 2 | B62: 70209 | C62: =ROUND(VLOOKUP(RC[-2],R6C6:R14C11,RC[1]+2,FALSE)*10000/COUNTIFS(C[1],RC[1],C[-2],RC[-2]),0) -> 77 | D62: =INT(MOD(RC[-2],1000)/100) -> 2
A63: 2 | B63: 70210 | C63: =ROUND(VLOOKUP(RC[-2],R6C6:R14C11,RC[1]+2,FALSE)*10000/COUNTIFS(C[1],RC[1],C[-2],RC[-2]),0) -> 77 | D63: =INT(MOD(RC[-2],1000)/100) -> 2
A64: 2 | B64: 70211 | C64: =ROUND(VLOOKUP(RC[-2],R6C6:R14C11,RC[1]+2,FALSE)*10000/COUNTIFS(C[1],RC[1],C[-2],RC[-2]),0) -> 77 | D64: =INT(MOD(RC[-2],1000)/100) -> 2
A65: 2 | B65: 70212 | C65: =ROUND(VLOOKUP(RC[-2],R6C6:R14C11,RC[1]+2,FALSE)*10000/COUNTIFS(C[1],RC[1],C[-2],RC[-2]),0) -> 77 | D65: =INT(MOD(RC[-2],1000)/100) -> 2
A66: 2 | B66: 70213 | C66: =ROUND(VLOOKUP(RC[-2],R6C6:R14C11,RC[1]+2,FALSE)*10000/COUNTIFS(C[1],RC[1],C[-2],RC[-2]),0) -> 77 | D66: =INT(MOD(RC[-2],1000)/100) -> 2
A67: 2 | B67: 70214 | C67: =ROUND(VLOOKUP(RC[-2],R6C6:R14C11,RC[1]+2,FALSE)*10000/COUNTIFS(C[1],RC[1],C[-2],RC[-2]),0) -> 77 | D67: =INT(MOD(RC[-2],1000)/100) -> 2
A68: 2 | B68: 70215 | C68: =ROUND(VLOOKUP(RC[-2],R6C6:R14C11,RC[1]+2,FALSE)*10000/COUNTIFS(C[1],RC[1],C[-2],RC[-2]),0) -> 77 | D68: =INT(MOD(RC[-2],1000)/100) -> 2
A69: 2 | B69: 70216 | C69: =ROUND(VLOOKUP(RC[-2],R6C6:R14C11,RC[1]+2,FALSE)*10000/COUNTIFS(C[1],RC[1],C[-2],RC[-2]),0) -> 77 | D69: =INT(MOD(RC[-2],1000)/100) -> 2
A70: 2 | B70: 70217 | C70: =ROUND(VLOOKUP(RC[-2],R6C6:R14C11,RC[1]+2,FALSE)*10000/COUNTIFS(C[1],RC[1],C[-2],RC[-2]),0) -> 77 | D70: =INT(MOD(RC[-2],1000)/100) -> 2
A71: 2 | B71: 70218 | C71: =ROUND(VLOOKUP(RC[-2],R6C6:R14C11,RC[1]+2,FALSE)*10000/COUNTIFS(C[1],RC[1],C[-2],RC[-2]),0) -> 77 | D71: =INT(MOD(RC[-2],1000)/100) -> 2
A72: 2 | B72: 70219 | C72: =ROUND(VLOOKUP(RC[-2],R6C6:R14C11,RC[1]+2,FALSE)*10000/COUNTIFS(C[1],RC[1],C[-2],RC[-2]),0) -> 77 | D72: =INT(MOD(RC[-2],1000)/100) -> 2
A73: 2 | B73: 70220 | C73: =ROUND(VLOOKUP(RC[-2],R6C6:R14C11,RC[1]+2,FALSE)*10000/COUNTIFS(C[1],RC[1],C[-2],RC[-2]),0) -> 77 | D73: =INT(MOD(RC[-2],1000)/100) -> 2
A74: 2 | B74: 70221 | C74: =ROUND(VLOOKUP(RC[-2],R6C6:R14C11,RC[1]+2,FALSE)*10000/COUNTIFS(C[1],RC[1],C[-2],RC[-2]),0) -> 77 | D74: =INT(MOD(RC[-2],1000)/100) -> 2
A75: 2 | B75: 70222 | C75: =ROUND(VLOOKUP(RC[-2],R6C6:R14C11,RC[1]+2,FALSE)*10000/COUNTIFS(C[1],RC[1],C[-2],RC[-2]),0) -> 77 | D75: =INT(MOD(RC[-2],1000)/100) -> 2
A76: 2 | B76: 70223 | C76: =ROUND(VLOOKUP(RC[-2],R6C6:R14C11,RC[1]+2,FALSE)*10000/COUNTIFS(C[1],RC[1],C[-2],RC[-2]),0) -> 77 | D76: =INT(MOD(RC[-2],1000)/100) -> 2
A77: 2 | B77: 70224 | C77: =ROUND(VLOOKUP(RC[-2],R6C6:R14C11,RC[1]+2,FALSE)*10000/COUNTIFS(C[1],RC[1],C[-2],RC[-2]),0) -> 77 | D77: =INT(MOD(RC[-2],1000)/100) -> 2
A78: 2 | B78: 70225 | C78: =ROUND(VLOOKUP(RC[-2],R6C6:R14C11,RC[1]+2,FALSE)*10000/COUNTIFS(C[1],RC[1],C[-2],RC[-2]),0) -> 77 | D78: =INT(MOD(RC[-2],1000)/100) -> 2
A79: 2 | B79: 70300 | C79: =ROUND(VLOOKUP(RC[-2],R6C6:R14C11,RC[1]+2,FALSE)*10000/COUNTIFS(C[1],RC[1],C[-2],RC[-2]),0) -> 2 | D79: =INT(MOD(RC[-2],1000)/100) -> 3
A80: 2 | B80: 70301 | C80: =ROUND(VLOOKUP(RC[-2],R6C6:R14C11,RC[1]+2,FALSE)*10000/COUNTIFS(C[1],RC[1],C[-2],RC[-2]),0) -> 2 | D80: =INT(MOD(RC[-2],1000)/100) -> 3
A81: 2 | B81: 70302 | C81: =ROUND(VLOOKUP(RC[-2],R6C6:R14C11,RC[1]+2,FALSE)*10000/COUNTIFS(C[1],RC[1],C[-2],RC[-2]),0) -> 2 | D81: =INT(MOD(RC[-2],1000)/100) -> 3
A82: 2 | B82: 70303 | C82: =ROUND(VLOOKUP(RC[-2],R6C6:R14C11,RC[1]+2,FALSE)*10000/COUNTIFS(C[1],RC[1],C[-2],RC[-2]),0) -> 2 | D82: =INT(MOD(RC[-2],1000)/100) -> 3
A83: 2 | B83: 70304 | C83: =ROUND(VLOOKUP(RC[-2],R6C6:R14C11,RC[1]+2,FALSE)*10000/COUNTIFS(C[1],RC[1],C[-2],RC[-2]),0) -> 2 | D83: =INT(MOD(RC[-2],1000)/100) -> 3
A84: 2 | B84: 70305 | C84: =ROUND(VLOOKUP(RC[-2],R6C6:R14C11,RC[1]+2,FALSE)*10000/COUNTIFS(C[1],RC[1],C[-2],RC[-2]),0) -> 2 | D84: =INT(MOD(RC[-2],1000)/100) -> 3
A85: 2 | B85: 70306 | C85: =ROUND(VLOOKUP(RC[-2],R6C6:R14C11,RC[1]+2,FALSE)*10000/COUNTIFS(C[1],RC[1],C[-2],RC[-2]),0) -> 2 | D85: =INT(MOD(RC[-2],1000)/100) -> 3
A86: 2 | B86: 70307 | C86: =ROUND(VLOOKUP(RC[-2],R6C6:R14C11,RC[1]+2,FALSE)*10000/COUNTIFS(C[1],RC[1],C[-2],RC[-2]),0) -> 2 | D86: =INT(MOD(RC[-2],1000)/100) -> 3
A87: 2 | B87: 70308 | C87: =ROUND(VLOOKUP(RC[-2],R6C6:R14C11,RC[1]+2,FALSE)*10000/COUNTIFS(C[1],RC[1],C[-2],RC[-2]),0) -> 2 | D87: =INT(MOD(RC[-2],1000)/100) -> 3
A88: 2 | B88: 70309 | C88: =ROUND(VLOOKUP(RC[-2],R6C6:R14C11,RC[1]+2,FALSE)*10000/COUNTIFS(C[1],RC[1],C[-2],RC[-2]),0) -> 2 | D88: =INT(MOD(RC[-2],1000)/100) -> 3
A89: 2 | B89: 70310 | C89: =ROUND(VLOOKUP(RC[-2],R6C6:R14C11,RC[1]+2,FALSE)*10000/COUNTIFS(C[1],RC[1],C[-2],RC[-2]),0) -> 2 | D89: =INT(MOD(RC[-2],1000)/100) -> 3
A90: 2 | B90: 70311 | C90: =ROUND(VLOOKUP(RC[-2],R6C6:R14C11,RC[1]+2,FALSE)*10000/COUNTIFS(C[1],RC[1],C[-2],RC[-2]),0) -> 2 | D90: =INT(MOD(RC[-2],1000)/100) -> 3
A91: 2 | B91: 70312 | C91: =ROUND(VLOOKUP(RC[-2],R6C6:R14C11,RC[1]+2,FALSE)*10000/COUNTIFS(C[1],RC[1],C[-2],RC[-2]),0) -> 2 | D91: =INT(MOD(RC[-2],1000)/100) -> 3
A92: 2 | B92: 70313 | C92: =ROUND(VLOOKUP(RC[-2],R6C6:R14C11,RC[1]+2,FALSE)*10000/COUNTIFS(C[1],RC[1],C[-2],RC[-2]),0) -> 2 | D92: =INT(MOD(RC[-2],1000)/100) -> 3
A93: 2 | B93: 70314 | C93: =ROUND(VLOOKUP(RC[-2],R6C6:R14C11,RC[1]+2,FALSE)*10000/COUNTIFS(C[1],RC[1],C[-2],RC[-2]),0) -> 2 | D93: =INT(MOD(RC[-2],1000)/100) -> 3
A94: 2 | B94: 70315 | C94: =ROUND(VLOOKUP(RC[-2],R6C6:R14C11,RC[1]+2,FALSE)*10000/COUNTIFS(C[1],RC[1],C[-2],RC[-2]),0) -> 2 | D94: =INT(MOD(RC[-2],1000)/100) -> 3
A95: 2 | B95: 70316 | C95: =ROUND(VLOOKUP(RC[-2],R6C6:R14C11,RC[1]+2,FALSE)*10000/COUNTIFS(C[1],RC[1],C[-2],RC[-2]),0) -> 2 | D95: =INT(MOD(RC[-2],1000)/100) -> 3
A96: 2 | B96: 70317 | C96: =ROUND(VLOOKUP(RC[-2],R6C6:R14C11,RC[1]+2,FALSE)*10000/COUNTIFS(C[1],RC[1],C[-2],RC[-2]),0) -> 2 | D96: =INT(MOD(RC[-2],1000)/100) -> 3
A97: 2 | B97: 70318 | C97: =ROUND(VLOOKUP(RC[-2],R6C6:R14C11,RC[1]+2,FALSE)*10000/COUNTIFS(C[1],RC[1],C[-2],RC[-2]),0) -> 2 | D97: =INT(MOD(RC[-2],1000)/100) -> 3
A98: 2 | B98: 70319 | C98: =ROUND(VLOOKUP(RC[-2],R6C6:R14C11,RC[1]+2,FALSE)*10000/COUNTIFS(C[1],RC[1],C[-2],RC[-2]),0) -> 2 | D98: =INT(MOD(RC[-2],1000)/100) -> 3
A99: 2 | B99: 70320 | C99: =ROUND(VLOOKUP(RC[-2],R6C6:R14C11,RC[1]+2,FALSE)*10000/COUNTIFS(C[1],RC[1],C[-2],RC[-2]),0) -> 2 | D99: =INT(MOD(RC[-2],1000)/100) -> 3
A100: 2 | B100: 70321 | C100: =ROUND(VLOOKUP(RC[-2],R6C6:R14C11,RC[1]+2,FALSE)*10000/COUNTIFS(C[1],RC[1],C[-2],RC[-2]),0) -> 2 | D100: =INT(MOD(RC[-2],1000)/100) -> 3
A101: 2 | B101: 70322 | C101: =ROUND(VLOOKUP(RC[-2],R6C6:R14C11,RC[1]+2,FALSE)*10000/COUNTIFS(C[1],RC[1],C[-2],RC[-2]),0) -> 2 | D101: =INT(MOD(RC[-2],1000)/100) -> 3
A102: 2 | B102: 70323 | C102: =ROUND(VLOOKUP(RC[-2],R6C6:R14C11,RC[1]+2,FALSE)*10000/COUNTIFS(C[1],RC[1],C[-2],RC[-2]),0) -> 2 | D102: =INT(MOD(RC[-2],1000)/100) -> 3
A103: 2 | B103: 70324 | C103: =ROUND(VLOOKUP(RC[-2],R6C6:R14C11,RC[1]+2,FALSE)*10000/COUNTIFS(C[1],RC[1],C[-2],RC[-2]),0) -> 2 | D103: =INT(MOD(RC[-2],1000)/100) -> 3
A104: 2 | B104: 70325 | C104: =ROUND(VLOOKUP(RC[-2],R6C6:R14C11,RC[1]+2,FALSE)*10000/COUNTIFS(C[1],RC[1],C[-2],RC[-2]),0) -> 2 | D104: =INT(MOD(RC[-2],1000)/100) -> 3
A105: 3 | B105: 70000 | C105: =ROUND(VLOOKUP(RC[-2],R6C6:R14C11,RC[1]+2,FALSE)*10000/COUNTIFS(C[1],RC[1],C[-2],RC[-2]),0) -> 880 | D105: =INT(MOD(RC[-2],1000)/100) -> 0
A106: 3 | B106: 70022 | C106: =ROUND(VLOOKUP(RC[-2],R6C6:R14C11,RC[1]+2,FALSE)*10000/COUNTIFS(C[1],RC[1],C[-2],RC[-2]),0) -> 880 | D106: =INT(MOD(RC[-2],1000)/100) -> 0
A107: 3 | B107: 70023 | C107: =ROUND(VLOOKUP(RC[-2],R6C6:R14C11,RC[1]+2,FALSE)*10000/COUNTIFS(C[1],RC[1],C[-2],RC[-2]),0) -> 880 | D107: =INT(MOD(RC[-2],1000)/100) -> 0
A108: 3 | B108: 70024 | C108: =ROUND(VLOOKUP(RC[-2],R6C6:R14C11,RC[1]+2,FALSE)*10000/COUNTIFS(C[1],RC[1],C[-2],RC[-2]),0) -> 880 | D108: =INT(MOD(RC[-2],1000)/100) -> 0
A109: 3 | B109: 70025 | C109: =ROUND(VLOOKUP(RC[-2],R6C6:R14C11,RC[1]+2,FALSE)*10000/COUNTIFS(C[1],RC[1],C[-2],RC[-2]),0) -> 880 | D109: =INT(MOD(RC[-2],1000)/100) -> 0
A110: 3 | B110: 70100 | C110: =ROUND(VLOOKUP(RC[-2],R6C6:R14C11,RC[1]+2,FALSE)*10000/COUNTIFS(C[1],RC[1],C[-2],RC[-2]),0) -> 700 | D110: =INT(MOD(RC[-2],1000)/100) -> 1
A111: 3 | B111: 70122 | C111: =ROUND(VLOOKUP(RC[-2],R6C6:R14C11,RC[1]+2,FALSE)*10000/COUNTIFS(C[1],RC[1],C[-2],RC[-2]),0) -> 700 | D111: =INT(MOD(RC[-2],1000)/100) -> 1
A112: 3 | B112: 70123 | C112: =ROUND(VLOOKUP(RC[-2],R6C6:R14C11,RC[1]+2,FALSE)*10000/COUNTIFS(C[1],RC[1],C[-2],RC[-2]),0) -> 700 | D112: =INT(MOD(RC[-2],1000)/100) -> 1
A113: 3 | B113: 70124 | C113: =ROUND(VLOOKUP(RC[-2],R6C6:R14C11,RC[1]+2,FALSE)*10000/COUNTIFS(C[1],RC[1],C[-2],RC[-2]),0) -> 700 | D113: =INT(MOD(RC[-2],1000)/100) -> 1
A114: 3 | B114: 70125 | C114: =ROUND(VLOOKUP(RC[-2],R6C6:R14C11,RC[1]+2,FALSE)*10000/COUNTIFS(C[1],RC[1],C[-2],RC[-2]),0) -> 700 | D114: =INT(MOD(RC[-2],1000)/100) -> 1
A115: 3 | B115: 70200 | C115: =ROUND(VLOOKUP(RC[-2],R6C6:R14C11,RC[1]+2,FALSE)*10000/COUNTIFS(C[1],RC[1],C[-2],RC[-2]),0) -> 77 | D115: =INT(MOD(RC[-2],1000)/100) -> 2
A116: 3 | B116: 70201 | C116: =ROUND(VLOOKUP(RC[-2],R6C6:R14C11,RC[1]+2,FALSE)*10000/COUNTIFS(C[1],RC[1],C[-2],RC[-2]),0) -> 77 | D116: =INT(MOD(RC[-2],1000)/100) -> 2
A117: 3 | B117: 70202 | C117: =ROUND(VLOOKUP(RC[-2],R6C6:R14C11,RC[1]+2,FALSE)*10000/COUNTIFS(C[1],RC[1],C[-2],RC[-2]),0) -> 77 | D117: =INT(MOD(RC[-2],1000)/100) -> 2
A118: 3 | B118: 70203 | C118: =ROUND(VLOOKUP(RC[-2],R6C6:R14C11,RC[1]+2,FALSE)*10000/COUNTIFS(C[1],RC[1],C[-2],RC[-2]),0) -> 77 | D118: =INT(MOD(RC[-2],1000)/100) -> 2
A119: 3 | B119: 70204 | C119: =ROUND(VLOOKUP(RC[-2],R6C6:R14C11,RC[1]+2,FALSE)*10000/COUNTIFS(C[1],RC[1],C[-2],RC[-2]),0) -> 77 | D119: =INT(MOD(RC[-2],1000)/100) -> 2
A120: 3 | B120: 70205 | C120: =ROUND(VLOOKUP(RC[-2],R6C6:R14C11,RC[1]+2,FALSE)*10000/COUNTIFS(C[1],RC[1],C[-2],RC[-2]),0) -> 77 | D120: =INT(MOD(RC[-2],1000)/100) -> 2
A121: 3 | B121: 70206 | C121: =ROUND(VLOOKUP(RC[-2],R6C6:R14C11,RC[1]+2,FALSE)*10000/COUNTIFS(C[1],RC[1],C[-2],RC[-2]),0) -> 77 | D121: =INT(MOD(RC[-2],1000)/100) -> 2
A122: 3 | B122: 70207 | C122: =ROUND(VLOOKUP(RC[-2],R6C6:R14C11,RC[1]+2,FALSE)*10000/COUNTIFS(C[1],RC[1],C[-2],RC[-2]),0) -> 77 | D122: =INT(MOD(RC[-2],1000)/100) -> 2
A123: 3 | B123: 70208 | C123: =ROUND(VLOOKUP(RC[-2],R6C6:R14C11,RC[1]+2,FALSE)*10000/COUNTIFS(C[1],RC[1],C[-2],RC[-2]),0) -> 77 | D123: =INT(MOD(RC[-2],1000)/100) -> 2
A124: 3 | B124: 70209 | C124: =ROUND(VLOOKUP(RC[-2],R6C6:R14C11,RC[1]+2,FALSE)*10000/COUNTIFS(C[1],RC[1],C[-2],RC[-2]),0) -> 77 | D124: =INT(MOD(RC[-2],1000)/100) -> 2
A125: 3 | B125: 70210 | C125: =ROUND(VLOOKUP(RC[-2],R6C6:R14C11,RC[1]+2,FALSE)*10000/COUNTIFS(C[1],RC[1],C[-2],RC[-2]),0) -> 77 | D125: =INT(MOD(RC[-2],1000)/100) -> 2
A126: 3 | B126: 70211 | C126: =ROUND(VLOOKUP(RC[-2],R6C6:R14C11,RC[1]+2,FALSE)*10000/COUNTIFS(C[1],RC[1],C[-2],RC[-2]),0) -> 77 | D126: =INT(MOD(RC[-2],1000)/100) -> 2
A127: 3 | B127: 70212 | C127: =ROUND(VLOOKUP(RC[-2],R6C6:R14C11,RC[1]+2,FALSE)*10000/COUNTIFS(C[1],RC[1],C[-2],RC[-2]),0) -> 77 | D127: =INT(MOD(RC[-2],1000)/100) -> 2
A128: 3 | B128: 70213 | C128: =ROUND(VLOOKUP(RC[-2],R6C6:R14C11,RC[1]+2,FALSE)*10000/COUNTIFS(C[1],RC[1],C[-2],RC[-2]),0) -> 77 | D128: =INT(MOD(RC[-2],1000)/100) -> 2
A129: 3 | B129: 70214 | C129: =ROUND(VLOOKUP(RC[-2],R6C6:R14C11,RC[1]+2,FALSE)*10000/COUNTIFS(C[1],RC[1],C[-2],RC[-2]),0) -> 77 | D129: =INT(MOD(RC[-2],1000)/100) -> 2
A130: 3 | B130: 70215 | C130: =ROUND(VLOOKUP(RC[-2],R6C6:R14C11,RC[1]+2,FALSE)*10000/COUNTIFS(C[1],RC[1],C[-2],RC[-2]),0) -> 77 | D130: =INT(MOD(RC[-2],1000)/100) -> 2
A131: 3 | B131: 70216 | C131: =ROUND(VLOOKUP(RC[-2],R6C6:R14C11,RC[1]+2,FALSE)*10000/COUNTIFS(C[1],RC[1],C[-2],RC[-2]),0) -> 77 | D131: =INT(MOD(RC[-2],1000)/100) -> 2
A132: 3 | B132: 70217 | C132: =ROUND(VLOOKUP(RC[-2],R6C6:R14C11,RC[1]+2,FALSE)*10000/COUNTIFS(C[1],RC[1],C[-2],RC[-2]),0) -> 77 | D132: =INT(MOD(RC[-2],1000)/100) -> 2
A133: 3 | B133: 70218 | C133: =ROUND(VLOOKUP(RC[-2],R6C6:R14C11,RC[1]+2,FALSE)*10000/COUNTIFS(C[1],RC[1],C[-2],RC[-2]),0) -> 77 | D133: =INT(MOD(RC[-2],1000)/100) -> 2
A134: 3 | B134: 70219 | C134: =ROUND(VLOOKUP(RC[-2],R6C6:R14C11,RC[1]+2,FALSE)*10000/COUNTIFS(C[1],RC[1],C[-2],RC[-2]),0) -> 77 | D134: =INT(MOD(RC[-2],1000)/100) -> 2
A135: 3 | B135: 70220 | C135: =ROUND(VLOOKUP(RC[-2],R6C6:R14C11,RC[1]+2,FALSE)*10000/COUNTIFS(C[1],RC[1],C[-2],RC[-2]),0) -> 77 | D135: =INT(MOD(RC[-2],1000)/100) -> 2
A136: 3 | B136: 70221 | C136: =ROUND(VLOOKUP(RC[-2],R6C6:R14C11,RC[1]+2,FALSE)*10000/COUNTIFS(C[1],RC[1],C[-2],RC[-2]),0) -> 77 | D136: =INT(MOD(RC[-2],1000)/100) -> 2
A137: 3 | B137: 70222 | C137: =ROUND(VLOOKUP(RC[-2],R6C6:R14C11,RC[1]+2,FALSE)*10000/COUNTIFS(C[1],RC[1],C[-2],RC[-2]),0) -> 77 | D137: =INT(MOD(RC[-2],1000)/100) -> 2
A138: 3 | B138: 70223 | C138: =ROUND(VLOOKUP(RC[-2],R6C6:R14C11,RC[1]+2,FALSE)*10000/COUNTIFS(C[1],RC[1],C[-2],RC[-2]),0) -> 77 | D138: =INT(MOD(RC[-2],1000)/100) -> 2
A139: 3 | B139: 70224 | C139: =ROUND(VLOOKUP(RC[-2],R6C6:R14C11,RC[1]+2,FALSE)*10000/COUNTIFS(C[1],RC[1],C[-2],RC[-2]),0) -> 77 | D139: =INT(MOD(RC[-2],1000)/100) -> 2
A140: 3 | B140: 70225 | C140: =ROUND(VLOOKUP(RC[-2],R6C6:R14C11,RC[1]+2,FALSE)*10000/COUNTIFS(C[1],RC[1],C[-2],RC[-2]),0) -> 77 | D140: =INT(MOD(RC[-2],1000)/100) -> 2
A141: 3 | B141: 70300 | C141: =ROUND(VLOOKUP(RC[-2],R6C6:R14C11,RC[1]+2,FALSE)*10000/COUNTIFS(C[1],RC[1],C[-2],RC[-2]),0) -> 4 | D141: =INT(MOD(RC[-2],1000)/100) -> 3
A142: 3 | B142: 70301 | C142: =ROUND(VLOOKUP(RC[-2],R6C6:R14C11,RC[1]+2,FALSE)*10000/COUNTIFS(C[1],RC[1],C[-2],RC[-2]),0) -> 4 | D142: =INT(MOD(RC[-2],1000)/100) -> 3
A143: 3 | B143: 70302 | C143: =ROUND(VLOOKUP(RC[-2],R6C6:R14C11,RC[1]+2,FALSE)*10000/COUNTIFS(C[1],RC[1],C[-2],RC[-2]),0) -> 4 | D143: =INT(MOD(RC[-2],1000)/100) -> 3
A144: 3 | B144: 70303 | C144: =ROUND(VLOOKUP(RC[-2],R6C6:R14C11,RC[1]+2,FALSE)*10000/COUNTIFS(C[1],RC[1],C[-2],RC[-2]),0) -> 4 | D144: =INT(MOD(RC[-2],1000)/100) -> 3
A145: 3 | B145: 70304 | C145: =ROUND(VLOOKUP(RC[-2],R6C6:R14C11,RC[1]+2,FALSE)*10000/COUNTIFS(C[1],RC[1],C[-2],RC[-2]),0) -> 4 | D145: =INT(MOD(RC[-2],1000)/100) -> 3
A146: 3 | B146: 70305 | C146: =ROUND(VLOOKUP(RC[-2],R6C6:R14C11,RC[1]+2,FALSE)*10000/COUNTIFS(C[1],RC[1],C[-2],RC[-2]),0) -> 4 | D146: =INT(MOD(RC[-2],1000)/100) -> 3
A147: 3 | B147: 70306 | C147: =ROUND(VLOOKUP(RC[-2],R6C6:R14C11,RC[1]+2,FALSE)*10000/COUNTIFS(C[1],RC[1],C[-2],RC[-2]),0) -> 4 | D147: =INT(MOD(RC[-2],1000)/100) -> 3
A148: 3 | B148: 70307 | C148: =ROUND(VLOOKUP(RC[-2],R6C6:R14C11,RC[1]+2,FALSE)*10000/COUNTIFS(C[1],RC[1],C[-2],RC[-2]),0) -> 4 | D148: =INT(MOD(RC[-2],1000)/100) -> 3
A149: 3 | B149: 70308 | C149: =ROUND(VLOOKUP(RC[-2],R6C6:R14C11,RC[1]+2,FALSE)*10000/COUNTIFS(C[1],RC[1],C[-2],RC[-2]),0) -> 4 | D149: =INT(MOD(RC[-2],1000)/100) -> 3
A150: 3 | B150: 70309 | C150: =ROUND(VLOOKUP(RC[-2],R6C6:R14C11,RC[1]+2,FALSE)*10000/COUNTIFS(C[1],RC[1],C[-2],RC[-2]),0) -> 4 | D150: =INT(MOD(RC[-2],1000)/100) -> 3
A151: 3 | B151: 70310 | C151: =ROUND(VLOOKUP(RC[-2],R6C6:R14C11,RC[1]+2,FALSE)*10000/COUNTIFS(C[1],RC[1],C[-2],RC[-2]),0) -> 4 | D151: =INT(MOD(RC[-2],1000)/100) -> 3
A152: 3 | B152: 70311 | C152: =ROUND(VLOOKUP(RC[-2],R6C6:R14C11,RC[1]+2,FALSE)*10000/COUNTIFS(C[1],RC[1],C[-2],RC[-2]),0) -> 4 | D152: =INT(MOD(RC[-2],1000)/100) -> 3
A153: 3 | B153: 70312 | C153: =ROUND(VLOOKUP(RC[-2],R6C6:R14C11,RC[1]+2,FALSE)*10000/COUNTIFS(C[1],RC[1],C[-2],RC[-2]),0) -> 4 | D153: =INT(MOD(RC[-2],1000)/100) -> 3
A154: 3 | B154: 70313 | C154: =ROUND(VLOOKUP(RC[-2],R6C6:R14C11,RC[1]+2,FALSE)*10000/COUNTIFS(C[1],RC[1],C[-2],RC[-2]),0) -> 4 | D154: =INT(MOD(RC[-2],1000)/100) -> 3
A155: 3 | B155: 70314 | C155: =ROUND(VLOOKUP(RC[-2],R6C6:R14C11,RC[1]+2,FALSE)*10000/COUNTIFS(C[1],RC[1],C[-2],RC[-2]),0) -> 4 | D155: =INT(MOD(RC[-2],1000)/100) -> 3
A156: 3 | B156: 70315 | C156: =ROUND(VLOOKUP(RC[-2],R6C6:R14C11,RC[1]+2,FALSE)*10000/COUNTIFS(C[1],RC[1],C[-2],RC[-2]),0) -> 4 | D156: =INT(MOD(RC[-2],1000)/100) -> 3
A157: 3 | B157: 70316 | C157: =ROUND(VLOOKUP(RC[-2],R6C6:R14C11,RC[1]+2,FALSE)*10000/COUNTIFS(C[1],RC[1],C[-2],RC[-2]),0) -> 4 | D157: =INT(MOD(RC[-2],1000)/100) -> 3
A158: 3 | B158: 70317 | C158: =ROUND(VLOOKUP(RC[-2],R6C6:R14C11,RC[1]+2,FALSE)*10000/COUNTIFS(C[1],RC[1],C[-2],RC[-2]),0) -> 4 | D158: =INT(MOD(RC[-2],1000)/100) -> 3
A159: 3 | B159: 70318 | C159: =ROUND(VLOOKUP(RC[-2],R6C6:R14C11,RC[1]+2,FALSE)*10000/COUNTIFS(C[1],RC[1],C[-2],RC[-2]),0) -> 4 | D159: =INT(MOD(RC[-2],1000)/100) -> 3
A160: 3 | B160: 70319 | C160: =ROUND(VLOOKUP(RC[-2],R6C6:R14C11,RC[1]+2,FALSE)*10000/COUNTIFS(C[1],RC[1],C[-2],RC[-2]),0) -> 4 | D160: =INT(MOD(RC[-2],1000)/100) -> 3
A161: 3 | B161: 70320 | C161: =ROUND(VLOOKUP(RC[-2],R6C6:R14C11,RC[1]+2,FALSE)*10000/COUNTIFS(C[1],RC[1],C[-2],RC[-2]),0) -> 4 | D161: =INT(MOD(RC[-2],1000)/100) -> 3
A162: 3 | B162: 70321 | C162: =ROUND(VLOOKUP(RC[-2],R6C6:R14C11,RC[1]+2,FALSE)*10000/COUNTIFS(C[1],RC[1],C[-2],RC[-2]),0) -> 4 | D162: =INT(MOD(RC[-2],1000)/100) -> 3
A163: 3 | B163: 70322 | C163: =ROUND(VLOOKUP(RC[-2],R6C6:R14C11,RC[1]+2,FALSE)*10000/COUNTIFS(C[1],RC[1],C[-2],RC[-2]),0) -> 4 | D163: =INT(MOD(RC[-2],1000)/100) -> 3
A164: 3 | B164: 70323 | C164: =ROUND(VLOOKUP(RC[-2],R6C6:R14C11,RC[1]+2,FALSE)*10000/COUNTIFS(C[1],RC[1],C[-2],RC[-2]),0) -> 4 | D164: =INT(MOD(RC[-2],1000)/100) -> 3
A165: 3 | B165: 70324 | C165: =ROUND(VLOOKUP(RC[-2],R6C6:R14C11,RC[1]+2,FALSE)*10000/COUNTIFS(C[1],RC[1],C[-2],RC[-2]),0) -> 4 | D165: =INT(MOD(RC[-2],1000)/100) -> 3
A166: 3 | B166: 70325 | C166: =ROUND(VLOOKUP(RC[-2],R6C6:R14C11,RC[1]+2,FALSE)*10000/COUNTIFS(C[1],RC[1],C[-2],RC[-2]),0) -> 4 | D166: =INT(MOD(RC[-2],1000)/100) -> 3
A167: 4 | B167: 70000 | C167: =ROUND(VLOOKUP(RC[-2],R6C6:R14C11,RC[1]+2,FALSE)*10000/COUNTIFS(C[1],RC[1],C[-2],RC[-2]),0) -> 830 | D167: =INT(MOD(RC[-2],1000)/100) -> 0
A168: 4 | B168: 70022 | C168: =ROUND(VLOOKUP(RC[-2],R6C6:R14C11,RC[1]+2,FALSE)*10000/COUNTIFS(C[1],RC[1],C[-2],RC[-2]),0) -> 830 | D168: =INT(MOD(RC[-2],1000)/100) -> 0
A169: 4 | B169: 70023 | C169: =ROUND(VLOOKUP(RC[-2],R6C6:R14C11,RC[1]+2,FALSE)*10000/COUNTIFS(C[1],RC[1],C[-2],RC[-2]),0) -> 830 | D169: =INT(MOD(RC[-2],1000)/100) -> 0
A170: 4 | B170: 70024 | C170: =ROUND(VLOOKUP(RC[-2],R6C6:R14C11,RC[1]+2,FALSE)*10000/COUNTIFS(C[1],RC[1],C[-2],RC[-2]),0) -> 830 | D170: =INT(MOD(RC[-2],1000)/100) -> 0
A171: 4 | B171: 70025 | C171: =ROUND(VLOOKUP(RC[-2],R6C6:R14C11,RC[1]+2,FALSE)*10000/COUNTIFS(C[1],RC[1],C[-2],RC[-2]),0) -> 830 | D171: =INT(MOD(RC[-2],1000)/100) -> 0
A172: 4 | B172: 70100 | C172: =ROUND(VLOOKUP(RC[-2],R6C6:R14C11,RC[1]+2,FALSE)*10000/COUNTIFS(C[1],RC[1],C[-2],RC[-2]),0) -> 700 | D172: =INT(MOD(RC[-2],1000)/100) -> 1
A173: 4 | B173: 70122 | C173: =ROUND(VLOOKUP(RC[-2],R6C6:R14C11,RC[1]+2,FALSE)*10000/COUNTIFS(C[1],RC[1],C[-2],RC[-2]),0) -> 700 | D173: =INT(MOD(RC[-2],1000)/100) -> 1
A174: 4 | B174: 70123 | C174: =ROUND(VLOOKUP(RC[-2],R6C6:R14C11,RC[1]+2,FALSE)*10000/COUNTIFS(C[1],RC[1],C[-2],RC[-2]),0) -> 700 | D174: =INT(MOD(RC[-2],1000)/100) -> 1
A175: 4 | B175: 70124 | C175: =ROUND(VLOOKUP(RC[-2],R6C6:R14C11,RC[1]+2,FALSE)*10000/COUNTIFS(C[1],RC[1],C[-2],RC[-2]),0) -> 700 | D175: =INT(MOD(RC[-2],1000)/100) -> 1
A176: 4 | B176: 70125 | C176: =ROUND(VLOOKUP(RC[-2],R6C6:R14C11,RC[1]+2,FALSE)*10000/COUNTIFS(C[1],RC[1],C[-2],RC[-2]),0) -> 700 | D176: =INT(MOD(RC[-2],1000)/100) -> 1
A177: 4 | B177: 70200 | C177: =ROUND(VLOOKUP(RC[-2],R6C6:R14C11,RC[1]+2,FALSE)*10000/COUNTIFS(C[1],RC[1],C[-2],RC[-2]),0) -> 85 | D177: =INT(MOD(RC[-2],1000)/100) -> 2
A178: 4 | B178: 70201 | C178: =ROUND(VLOOKUP(RC[-2],R6C6:R14C11,RC[1]+2,FALSE)*10000/COUNTIFS(C[1],RC[1],C[-2],RC[-2]),0) -> 85 | D178: =INT(MOD(RC[-2],1000)/100) -> 2
A179: 4 | B179: 70202 | C179: =ROUND(VLOOKUP(RC[-2],R6C6:R14C11,RC[1]+2,FALSE)*10000/COUNTIFS(C[1],RC[1],C[-2],RC[-2]),0) -> 85 | D179: =INT(MOD(RC[-2],1000)/100) -> 2
A180: 4 | B180: 70203 | C180: =ROUND(VLOOKUP(RC[-2],R6C6:R14C11,RC[1]+2,FALSE)*10000/COUNTIFS(C[1],RC[1],C[-2],RC[-2]),0) -> 85 | D180: =INT(MOD(RC[-2],1000)/100) -> 2
A181: 4 | B181: 70204 | C181: =ROUND(VLOOKUP(RC[-2],R6C6:R14C11,RC[1]+2,FALSE)*10000/COUNTIFS(C[1],RC[1],C[-2],RC[-2]),0) -> 85 | D181: =INT(MOD(RC[-2],1000)/100) -> 2
A182: 4 | B182: 70205 | C182: =ROUND(VLOOKUP(RC[-2],R6C6:R14C11,RC[1]+2,FALSE)*10000/COUNTIFS(C[1],RC[1],C[-2],RC[-2]),0) -> 85 | D182: =INT(MOD(RC[-2],1000)/100) -> 2
A183: 4 | B183: 70206 | C183: =ROUND(VLOOKUP(RC[-2],R6C6:R14C11,RC[1]+2,FALSE)*10000/COUNTIFS(C[1],RC[1],C[-2],RC[-2]),0) -> 85 | D183: =INT(MOD(RC[-2],1000)/100) -> 2
A184: 4 | B184: 70207 | C184: =ROUND(VLOOKUP(RC[-2],R6C6:R14C11,RC[1]+2,FALSE)*10000/COUNTIFS(C[1],RC[1],C[-2],RC[-2]),0) -> 85 | D184: =INT(MOD(RC[-2],1000)/100) -> 2
A185: 4 | B185: 70208 | C185: =ROUND(VLOOKUP(RC[-2],R6C6:R14C11,RC[1]+2,FALSE)*10000/COUNTIFS(C[1],RC[1],C[-2],RC[-2]),0) -> 85 | D185: =INT(MOD(RC[-2],1000)/100) -> 2
A186: 4 | B186: 70209 | C186: =ROUND(VLOOKUP(RC[-2],R6C6:R14C11,RC[1]+2,FALSE)*10000/COUNTIFS(C[1],RC[1],C[-2],RC[-2]),0) -> 85 | D186: =INT(MOD(RC[-2],1000)/100) -> 2
A187: 4 | B187: 70210 | C187: =ROUND(VLOOKUP(RC[-2],R6C6:R14C11,RC[1]+2,FALSE)*10000/COUNTIFS(C[1],RC[1],C[-2],RC[-2]),0) -> 85 | D187: =INT(MOD(RC[-2],1000)/100) -> 2
A188: 4 | B188: 70211 | C188: =ROUND(VLOOKUP(RC[-2],R6C6:R14C11,RC[1]+2,FALSE)*10000/COUNTIFS(C[1],RC[1],C[-2],RC[-2]),0) -> 85 | D188: =INT(MOD(RC[-2],1000)/100) -> 2
A189: 4 | B189: 70212 | C189: =ROUND(VLOOKUP(RC[-2],R6C6:R14C11,RC[1]+2,FALSE)*10000/COUNTIFS(C[1],RC[1],C[-2],RC[-2]),0) -> 85 | D189: =INT(MOD(RC[-2],1000)/100) -> 2
A190: 4 | B190: 70213 | C190: =ROUND(VLOOKUP(RC[-2],R6C6:R14C11,RC[1]+2,FALSE)*10000/COUNTIFS(C[1],RC[1],C[-2],RC[-2]),0) -> 85 | D190: =INT(MOD(RC[-2],1000)/100) -> 2
A191: 4 | B191: 70214 | C191: =ROUND(VLOOKUP(RC[-2],R6C6:R14C11,RC[1]+2,FALSE)*10000/COUNTIFS(C[1],RC[1],C[-2],RC[-2]),0) -> 85 | D191: =INT(MOD(RC[-2],1000)/100) -> 2
A192: 4 | B192: 70215 | C192: =ROUND(VLOOKUP(RC[-2],R6C6:R14C11,RC[1]+2,FALSE)*10000/COUNTIFS(C[1],RC[1],C[-2],RC[-2]),0) -> 85 | D192: =INT(MOD(RC[-2],1000)/100) -> 2
A193: 4 | B193: 70216 | C193: =ROUND(VLOOKUP(RC[-2],R6C6:R14C11,RC[1]+2,FALSE)*10000/COUNTIFS(C[1],RC[1],C[-2],RC[-2]),0) -> 85 | D193: =INT(MOD(RC[-2],1000)/100) -> 2
A194: 4 | B194: 70217 | C194: =ROUND(VLOOKUP(RC[-2],R6C6:R14C11,RC[1]+2,FALSE)*10000/COUNTIFS(C[1],RC[1],C[-2],RC[-2]),0) -> 85 | D194: =INT(MOD(RC[-2],1000)/100) -> 2
A195: 4 | B195: 70218 | C195: =ROUND(VLOOKUP(RC[-2],R6C6:R14C11,RC[1]+2,FALSE)*10000/COUNTIFS(C[1],RC[1],C[-2],RC[-2]),0) -> 85 | D195: =INT(MOD(RC[-2],1000)/100) -> 2
A196: 4 | B196: 70219 | C196: =ROUND(VLOOKUP(RC[-2],R6C6:R14C11,RC[1]+2,FALSE)*10000/COUNTIFS(C[1],RC[1],C[-2],RC[-2]),0) -> 85 | D196: =INT(MOD(RC[-2],1000)/100) -> 2
A197: 4 | B197: 70220 | C197: =ROUND(VLOOKUP(RC[-2],R6C6:R14C11,RC[1]+2,FALSE)*10000/COUNTIFS(C[1],RC[1],C[-2],RC[-2]),0) -> 85 | D197: =INT(MOD(RC[-2],1000)/100) -> 2
A198: 4 | B198: 70221 | C198: =ROUND(VLOOKUP(RC[-2],R6C6:R14C11,RC[1]+2,FALSE)*10000/COUNTIFS(C[1],RC[1],C[-2],RC[-2]),0) -> 85 | D198: =INT(MOD(RC[-2],1000)/100) -> 2
A199: 4 | B199: 70222 | C199: =ROUND(VLOOKUP(RC[-2],R6C6:R14C11,RC[1]+2,FALSE)*10000/COUNTIFS(C[1],RC[1],C[-2],RC[-2]),0) -> 85 | D199: =INT(MOD(RC[-2],1000)/100) -> 2
A200: 4 | B200: 70223 | C200: =ROUND(VLOOKUP(RC[-2],R6C6:R14C11,RC[1]+2,FALSE)*10000/COUNTIFS(C[1],RC[1],C[-2],RC[-2]),0) -> 85 | D200: =INT(MOD(RC[-2],1000)/100) -> 2
A201: 4 | B201: 70224 | C201: =ROUND(VLOOKUP(RC[-2],R6C6:R14C11,RC[1]+2,FALSE)*10000/COUNTIFS(C[1],RC[1],C[-2],RC[-2]),0) -> 85 | D201: =INT(MOD(RC[-2],1000)/100) -> 2
A202: 4 | B202: 70225 | C202: =ROUND(VLOOKUP(RC[-2],R6C6:R14C11,RC[1]+2,FALSE)*10000/COUNTIFS(C[1],RC[1],C[-2],RC[-2]),0) -> 85 | D202: =INT(MOD(RC[-2],1000)/100) -> 2
A203: 4 | B203: 70300 | C203: =ROUND(VLOOKUP(RC[-2],R6C6:R14C11,RC[1]+2,FALSE)*10000/COUNTIFS(C[1],RC[1],C[-2],RC[-2]),0) -> 6 | D203: =INT(MOD(RC[-2],1000)/100) -> 3
A204: 4 | B204: 70301 | C204: =ROUND(VLOOKUP(RC[-2],R6C6:R14C11,RC[1]+2,FALSE)*10000/COUNTIFS(C[1],RC[1],C[-2],RC[-2]),0) -> 6 | D204: =INT(MOD(RC[-2],1000)/100) -> 3
A205: 4 | B205: 70302 | C205: =ROUND(VLOOKUP(RC[-2],R6C6:R14C11,RC[1]+2,FALSE)*10000/COUNTIFS(C[1],RC[1],C[-2],RC[-2]),0) -> 6 | D205: =INT(MOD(RC[-2],1000)/100) -> 3
A206: 4 | B206: 70303 | C206: =ROUND(VLOOKUP(RC[-2],R6C6:R14C11,RC[1]+2,FALSE)*10000/COUNTIFS(C[1],RC[1],C[-2],RC[-2]),0) -> 6 | D206: =INT(MOD(RC[-2],1000)/100) -> 3
A207: 4 | B207: 70304 | C207: =ROUND(VLOOKUP(RC[-2],R6C6:R14C11,RC[1]+2,FALSE)*10000/COUNTIFS(C[1],RC[1],C[-2],RC[-2]),0) -> 6 | D207: =INT(MOD(RC[-2],1000)/100) -> 3
A208: 4 | B208: 70305 | C208: =ROUND(VLOOKUP(RC[-2],R6C6:R14C11,RC[1]+2,FALSE)*10000/COUNTIFS(C[1],RC[1],C[-2],RC[-2]),0) -> 6 | D208: =INT(MOD(RC[-2],1000)/100) -> 3
A209: 4 | B209: 70306 | C209: =ROUND(VLOOKUP(RC[-2],R6C6:R14C11,RC[1]+2,FALSE)*10000/COUNTIFS(C[1],RC[1],C[-2],RC[-2]),0) -> 6 | D209: =INT(MOD(RC[-2],1000)/100) -> 3
A210: 4 | B210: 70307 | C210: =ROUND(VLOOKUP(RC[-2],R6C6:R14C11,RC[1]+2,FALSE)*10000/COUNTIFS(C[1],RC[1],C[-2],RC[-2]),0) -> 6 | D210: =INT(MOD(RC[-2],1000)/100) -> 3
A211: 4 | B211: 70308 | C211: =ROUND(VLOOKUP(RC[-2],R6C6:R14C11,RC[1]+2,FALSE)*10000/COUNTIFS(C[1],RC[1],C[-2],RC[-2]),0) -> 6 | D211: =INT(MOD(RC[-2],1000)/100) -> 3
A212: 4 | B212: 70309 | C212: =ROUND(VLOOKUP(RC[-2],R6C6:R14C11,RC[1]+2,FALSE)*10000/COUNTIFS(C[1],RC[1],C[-2],RC[-2]),0) -> 6 | D212: =INT(MOD(RC[-2],1000)/100) -> 3
A213: 4 | B213: 70310 | C213: =ROUND(VLOOKUP(RC[-2],R6C6:R14C11,RC[1]+2,FALSE)*10000/COUNTIFS(C[1],RC[1],C[-2],RC[-2]),0) -> 6 | D213: =INT(MOD(RC[-2],1000)/100) -> 3
A214: 4 | B214: 70311 | C214: =ROUND(VLOOKUP(RC[-2],R6C6:R14C11,RC[1]+2,FALSE)*10000/COUNTIFS(C[1],RC[1],C[-2],RC[-2]),0) -> 6 | D214: =INT(MOD(RC[-2],1000)/100) -> 3
A215: 4 | B215: 70312 | C215: =ROUND(VLOOKUP(RC[-2],R6C6:R14C11,RC[1]+2,FALSE)*10000/COUNTIFS(C[1],RC[1],C[-2],RC[-2]),0) -> 6 | D215: =INT(MOD(RC[-2],1000)/100) -> 3
A216: 4 | B216: 70313 | C216: =ROUND(VLOOKUP(RC[-2],R6C6:R14C11,RC[1]+2,FALSE)*10000/COUNTIFS(C[1],RC[1],C[-2],RC[-2]),0) -> 6 | D216: =INT(MOD(RC[-2],1000)/100) -> 3
A217: 4 | B217: 70314 | C217: =ROUND(VLOOKUP(RC[-2],R6C6:R14C11,RC[1]+2,FALSE)*10000/COUNTIFS(C[1],RC[1],C[-2],RC[-2]),0) -> 6 | D217: =INT(MOD(RC[-2],1000)/100) -> 3
A218: 4 | B218: 70315 | C218: =ROUND(VLOOKUP(RC[-2],R6C6:R14C11,RC[1]+2,FALSE)*10000/COUNTIFS(C[1],RC[1],C[-2],RC[-2]),0) -> 6 | D218: =INT(MOD(RC[-2],1000)/100) -> 3
A219: 4 | B219: 70316 | C219: =ROUND(VLOOKUP(RC[-2],R6C6:R14C11,RC[1]+2,FALSE)*10000/COUNTIFS(C[1],RC[1],C[-2],RC[-2]),0) -> 6 | D219: =INT(MOD(RC[-2],1000)/100) -> 3
A220: 4 | B220: 70317 | C220: =ROUND(VLOOKUP(RC[-2],R6C6:R14C11,RC[1]+2,FALSE)*10000/COUNTIFS(C[1],RC[1],C[-2],RC[-2]),0) -> 6 | D220: =INT(MOD(RC[-2],1000)/100) -> 3
A221: 4 | B221: 70318 | C221: =ROUND(VLOOKUP(RC[-2],R6C6:R14C11,RC[1]+2,FALSE)*10000/COUNTIFS(C[1],RC[1],C[-2],RC[-2]),0) -> 6 | D221: =INT(MOD(RC[-2],1000)/100) -> 3
A222: 4 | B222: 70319 | C222: =ROUND(VLOOKUP(RC[-2],R6C6:R14C11,RC[1]+2,FALSE)*10000/COUNTIFS(C[1],RC[1],C[-2],RC[-2]),0) -> 6 | D222: =INT(MOD(RC[-2],1000)/100) -> 3
A223: 4 | B223: 70320 | C223: =ROUND(VLOOKUP(RC[-2],R6C6:R14C11,RC[1]+2,FALSE)*10000/COUNTIFS(C[1],RC[1],C[-2],RC[-2]),0) -> 6 | D223: =INT(MOD(RC[-2],1000)/100) -> 3
A224: 4 | B224: 70321 | C224: =ROUND(VLOOKUP(RC[-2],R6C6:R14C11,RC[1]+2,FALSE)*10000/COUNTIFS(C[1],RC[1],C[-2],RC[-2]),0) -> 6 | D224: =INT(MOD(RC[-2],1000)/100) -> 3
A225: 4 | B225: 70322 | C225: =ROUND(VLOOKUP(RC[-2],R6C6:R14C11,RC[1]+2,FALSE)*10000/COUNTIFS(C[1],RC[1],C[-2],RC[-2]),0) -> 6 | D225: =INT(MOD(RC[-2],1000)/100) -> 3
A226: 4 | B226: 70323 | C226: =ROUND(VLOOKUP(RC[-2],R6C6:R14C11,RC[1]+2,FALSE)*10000/COUNTIFS(C[1],RC[1],C[-2],RC[-2]),0) -> 6 | D226: =INT(MOD(RC[-2],1000)/100) -> 3
A227: 4 | B227: 70324 | C227: =ROUND(VLOOKUP(RC[-2],R6C6:R14C11,RC[1]+2,FALSE)*10000/COUNTIFS(C[1],RC[1],C[-2],RC[-2]),0) -> 6 | D227: =INT(MOD(RC[-2],1000)/100) -> 3
A228: 4 | B228: 70325 | C228: =ROUND(VLOOKUP(RC[-2],R6C6:R14C11,RC[1]+2,FALSE)*10000/COUNTIFS(C[1],RC[1],C[-2],RC[-2]),0) -> 6 | D228: =INT(MOD(RC[-2],1000)/100) -> 3
A229: 5 | B229: 70000 | C229: =ROUND(VLOOKUP(RC[-2],R6C6:R14C11,RC[1]+2,FALSE)*10000/COUNTIFS(C[1],RC[1],C[-2],RC[-2]),0) -> 620 | D229: =INT(MOD(RC[-2],1000)/100) -> 0
A230: 5 | B230: 70022 | C230: =ROUND(VLOOKUP(RC[-2],R6C6:R14C11,RC[1]+2,FALSE)*10000/COUNTIFS(C[1],RC[1],C[-2],RC[-2]),0) -> 620 | D230: =INT(MOD(RC[-2],1000)/100) -> 0
A231: 5 | B231: 70023 | C231: =ROUND(VLOOKUP(RC[-2],R6C6:R14C11,RC[1]+2,FALSE)*10000/COUNTIFS(C[1],RC[1],C[-2],RC[-2]),0) -> 620 | D231: =INT(MOD(RC[-2],1000)/100) -> 0
A232: 5 | B232: 70024 | C232: =ROUND(VLOOKUP(RC[-2],R6C6:R14C11,RC[1]+2,FALSE)*10000/COUNTIFS(C[1],RC[1],C[-2],RC[-2]),0) -> 620 | D232: =INT(MOD(RC[-2],1000)/100) -> 0
A233: 5 | B233: 70025 | C233: =ROUND(VLOOKUP(RC[-2],R6C6:R14C11,RC[1]+2,FALSE)*10000/COUNTIFS(C[1],RC[1],C[-2],RC[-2]),0) -> 620 | D233: =INT(MOD(RC[-2],1000)/100) -> 0
A234: 5 | B234: 70100 | C234: =ROUND(VLOOKUP(RC[-2],R6C6:R14C11,RC[1]+2,FALSE)*10000/COUNTIFS(C[1],RC[1],C[-2],RC[-2]),0) -> 900 | D234: =INT(MOD(RC[-2],1000)/100) -> 1
A235: 5 | B235: 70122 | C235: =ROUND(VLOOKUP(RC[-2],R6C6:R14C11,RC[1]+2,FALSE)*10000/COUNTIFS(C[1],RC[1],C[-2],RC[-2]),0) -> 900 | D235: =INT(MOD(RC[-2],1000)/100) -> 1
A236: 5 | B236: 70123 | C236: =ROUND(VLOOKUP(RC[-2],R6C6:R14C11,RC[1]+2,FALSE)*10000/COUNTIFS(C[1],RC[1],C[-2],RC[-2]),0) -> 900 | D236: =INT(MOD(RC[-2],1000)/100) -> 1
A237: 5 | B237: 70124 | C237: =ROUND(VLOOKUP(RC[-2],R6C6:R14C11,RC[1]+2,FALSE)*10000/COUNTIFS(C[1],RC[1],C[-2],RC[-2]),0) -> 900 | D237: =INT(MOD(RC[-2],1000)/100) -> 1
A238: 5 | B238: 70125 | C238: =ROUND(VLOOKUP(RC[-2],R6C6:R14C11,RC[1]+2,FALSE)*10000/COUNTIFS(C[1],RC[1],C[-2],RC[-2]),0) -> 900 | D238: =INT(MOD(RC[-2],1000)/100) -> 1
A239: 5 | B239: 70200 | C239: =ROUND(VLOOKUP(RC[-2],R6C6:R14C11,RC[1]+2,FALSE)*10000/COUNTIFS(C[1],RC[1],C[-2],RC[-2]),0) -> 85 | D239: =INT(MOD(RC[-2],1000)/100) -> 2
A240: 5 | B240: 70201 | C240: =ROUND(VLOOKUP(RC[-2],R6C6:R14C11,RC[1]+2,FALSE)*10000/COUNTIFS(C[1],RC[1],C[-2],RC[-2]),0) -> 85 | D240: =INT(MOD(RC[-2],1000)/100) -> 2
A241: 5 | B241: 70202 | C241: =ROUND(VLOOKUP(RC[-2],R6C6:R14C11,RC[1]+2,FALSE)*10000/COUNTIFS(C[1],RC[1],C[-2],RC[-2]),0) -> 85 | D241: =INT(MOD(RC[-2],1000)/100) -> 2
A242: 5 | B242: 70203 | C242: =ROUND(VLOOKUP(RC[-2],R6C6:R14C11,RC[1]+2,FALSE)*10000/COUNTIFS(C[1],RC[1],C[-2],RC[-2]),0) -> 85 | D242: =INT(MOD(RC[-2],1000)/100) -> 2
A243: 5 | B243: 70204 | C243: =ROUND(VLOOKUP(RC[-2],R6C6:R14C11,RC[1]+2,FALSE)*10000/COUNTIFS(C[1],RC[1],C[-2],RC[-2]),0) -> 85 | D243: =INT(MOD(RC[-2],1000)/100) -> 2
A244: 5 | B244: 70205 | C244: =ROUND(VLOOKUP(RC[-2],R6C6:R14C11,RC[1]+2,FALSE)*10000/COUNTIFS(C[1],RC[1],C[-2],RC[-2]),0) -> 85 | D244: =INT(MOD(RC[-2],1000)/100) -> 2
A245: 5 | B245: 70206 | C245: =ROUND(VLOOKUP(RC[-2],R6C6:R14C11,RC[1]+2,FALSE)*10000/COUNTIFS(C[1],RC[1],C[-2],RC[-2]),0) -> 85 | D245: =INT(MOD(RC[-2],1000)/100) -> 2
A246: 5 | B246: 70207 | C246: =ROUND(VLOOKUP(RC[-2],R6C6:R14C11,RC[1]+2,FALSE)*10000/COUNTIFS(C[1],RC[1],C[-2],RC[-2]),0) -> 85 | D246: =INT(MOD(RC[-2],1000)/100) -> 2
A247: 5 | B247: 70208 | C247: =ROUND(VLOOKUP(RC[-2],R6C6:R14C11,RC[1]+2,FALSE)*10000/COUNTIFS(C[1],RC[1],C[-2],RC[-2]),0) -> 85 | D247: =INT(MOD(RC[-2],1000)/100) -> 2
A248: 5 | B248: 70209 | C248: =ROUND(VLOOKUP(RC[-2],R6C6:R14C11,RC[1]+2,FALSE)*10000/COUNTIFS(C[1],RC[1],C[-2],RC[-2]),0) -> 85 | D248: =INT(MOD(RC[-2],1000)/100) -> 2
A249: 5 | B249: 70210 | C249: =ROUND(VLOOKUP(RC[-2],R6C6:R14C11,RC[1]+2,FALSE)*10000/COUNTIFS(C[1],RC[1],C[-2],RC[-2]),0) -> 85 | D249: =INT(MOD(RC[-2],1000)/100) -> 2
A250: 5 | B250: 70211 | C250: =ROUND(VLOOKUP(RC[-2],R6C6:R14C11,RC[1]+2,FALSE)*10000/COUNTIFS(C[1],RC[1],C[-2],RC[-2]),0) -> 85 | D250: =INT(MOD(RC[-2],1000)/100) -> 2
A251: 5 | B251: 70212 | C251: =ROUND(VLOOKUP(RC[-2],R6C6:R14C11,RC[1]+2,FALSE)*10000/COUNTIFS(C[1],RC[1],C[-2],RC[-2]),0) -> 85 | D251: =INT(MOD(RC[-2],1000)/100) -> 2
A252: 5 | B252: 70213 | C252: =ROUND(VLOOKUP(RC[-2],R6C6:R14C11,RC[1]+2,FALSE)*10000/COUNTIFS(C[1],RC[1],C[-2],RC[-2]),0) -> 85 | D252: =INT(MOD(RC[-2],1000)/100) -> 2
A253: 5 | B253: 70214 | C253: =ROUND(VLOOKUP(RC[-2],R6C6:R14C11,RC[1]+2,FALSE)*10000/COUNTIFS(C[1],RC[1],C[-2],RC[-2]),0) -> 85 | D253: =INT(MOD(RC[-2],1000)/100) -> 2
A254: 5 | B254: 70215 | C254: =ROUND(VLOOKUP(RC[-2],R6C6:R14C11,RC[1]+2,FALSE)*10000/COUNTIFS(C[1],RC[1],C[-2],RC[-2]),0) -> 85 | D254: =INT(MOD(RC[-2],1000)/100) -> 2
A255: 5 | B255: 70216 | C255: =ROUND(VLOOKUP(RC[-2],R6C6:R14C11,RC[1]+2,FALSE)*10000/COUNTIFS(C[1],RC[1],C[-2],RC[-2]),0) -> 85 | D255: =INT(MOD(RC[-2],1000)/100) -> 2
A256: 5 | B256: 70217 | C256: =ROUND(VLOOKUP(RC[-2],R6C6:R14C11,RC[1]+2,FALSE)*10000/COUNTIFS(C[1],RC[1],C[-2],RC[-2]),0) -> 85 | D256: =INT(MOD(RC[-2],1000)/100) -> 2
A257: 5 | B257: 70218 | C257: =ROUND(VLOOKUP(RC[-2],R6C6:R14C11,RC[1]+2,FALSE)*10000/COUNTIFS(C[1],RC[1],C[-2],RC[-2]),0) -> 85 | D257: =INT(MOD(RC[-2],1000)/100) -> 2
A258: 5 | B258: 70219 | C258: =ROUND(VLOOKUP(RC[-2],R6C6:R14C11,RC[1]+2,FALSE)*10000/COUNTIFS(C[1],RC[1],C[-2],RC[-2]),0) -> 85 | D258: =INT(MOD(RC[-2],1000)/100) -> 2
A259: 5 | B259: 70220 | C259: =ROUND(VLOOKUP(RC[-2],R6C6:R14C11,RC[1]+2,FALSE)*10000/COUNTIFS(C[1],RC[1],C[-2],RC[-2]),0) -> 85 | D259: =INT(MOD(RC[-2],1000)/100) -> 2
A260: 5 | B260: 70221 | C260: =ROUND(VLOOKUP(RC[-2],R6C6:R14C11,RC[1]+2,FALSE)*10000/COUNTIFS(C[1],RC[1],C[-2],RC[-2]),0) -> 85 | D260: =INT(MOD(RC[-2],1000)/100) -> 2
A261: 5 | B261: 70222 | C261: =ROUND(VLOOKUP(RC[-2],R6C6:R14C11,RC[1]+2,FALSE)*10000/COUNTIFS(C[1],RC[1],C[-2],RC[-2]),0) -> 85 | D261: =INT(MOD(RC[-2],1000)/100) -> 2
A262: 5 | B262: 70223 | C262: =ROUND(VLOOKUP(RC[-2],R6C6:R14C11,RC[1]+2,FALSE)*10000/COUNTIFS(C[1],RC[1],C[-2],RC[-2]),0) -> 85 | D262: =INT(MOD(RC[-2],1000)/100) -> 2
A263: 5 | B263: 70224 | C263: =ROUND(VLOOKUP(RC[-2],R6C6:R14C11,RC[1]+2,FALSE)*10000/COUNTIFS(C[1],RC[1],C[-2],RC[-2]),0) -> 85 | D263: =INT(MOD(RC[-2],1000)/100) -> 2
A264: 5 | B264: 70225 | C264: =ROUND(VLOOKUP(RC[-2],R6C6:R14C11,RC[1]+2,FALSE)*10000/COUNTIFS(C[1],RC[1],C[-2],RC[-2]),0) -> 85 | D264: =INT(MOD(RC[-2],1000)/100) -> 2
A265: 5 | B265: 70300 | C265: =ROUND(VLOOKUP(RC[-2],R6C6:R14C11,RC[1]+2,FALSE)*10000/COUNTIFS(C[1],RC[1],C[-2],RC[-2]),0) -> 8 | D265: =INT(MOD(RC[-2],1000)/100) -> 3
A266: 5 | B266: 70301 | C266: =ROUND(VLOOKUP(RC[-2],R6C6:R14C11,RC[1]+2,FALSE)*10000/COUNTIFS(C[1],RC[1],C[-2],RC[-2]),0) -> 8 | D266: =INT(MOD(RC[-2],1000)/100) -> 3
A267: 5 | B267: 70302 | C267: =ROUND(VLOOKUP(RC[-2],R6C6:R14C11,RC[1]+2,FALSE)*10000/COUNTIFS(C[1],RC[1],C[-2],RC[-2]),0) -> 8 | D267: =INT(MOD(RC[-2],1000)/100) -> 3
A268: 5 | B268: 70303 | C268: =ROUND(VLOOKUP(RC[-2],R6C6:R14C11,RC[1]+2,FALSE)*10000/COUNTIFS(C[1],RC[1],C[-2],RC[-2]),0) -> 8 | D268: =INT(MOD(RC[-2],1000)/100) -> 3
A269: 5 | B269: 70304 | C269: =ROUND(VLOOKUP(RC[-2],R6C6:R14C11,RC[1]+2,FALSE)*10000/COUNTIFS(C[1],RC[1],C[-2],RC[-2]),0) -> 8 | D269: =INT(MOD(RC[-2],1000)/100) -> 3
A270: 5 | B270: 70305 | C270: =ROUND(VLOOKUP(RC[-2],R6C6:R14C11,RC[1]+2,FALSE)*10000/COUNTIFS(C[1],RC[1],C[-2],RC[-2]),0) -> 8 | D270: =INT(MOD(RC[-2],1000)/100) -> 3
A271: 5 | B271: 70306 | C271: =ROUND(VLOOKUP(RC[-2],R6C6:R14C11,RC[1]+2,FALSE)*10000/COUNTIFS(C[1],RC[1],C[-2],RC[-2]),0) -> 8 | D271: =INT(MOD(RC[-2],1000)/100) -> 3
A272: 5 | B272: 70307 | C272: =ROUND(VLOOKUP(RC[-2],R6C6:R14C11,RC[1]+2,FALSE)*10000/COUNTIFS(C[1],RC[1],C[-2],RC[-2]),0) -> 8 | D272: =INT(MOD(RC[-2],1000)/100) -> 3
A273: 5 | B273: 70308 | C273: =ROUND(VLOOKUP(RC[-2],R6C6:R14C11,RC[1]+2,FALSE)*10000/COUNTIFS(C[1],RC[1],C[-2],RC[-2]),0) -> 8 | D273: =INT(MOD(RC[-2],1000)/100) -> 3
A274: 5 | B274: 70309 | C274: =ROUND(VLOOKUP(RC[-2],R6C6:R14C11,RC[1]+2,FALSE)*10000/COUNTIFS(C[1],RC[1],C[-2],RC[-2]),0) -> 8 | D274: =INT(MOD(RC[-2],1000)/100) -> 3
A275: 5 | B275: 70310 | C275: =ROUND(VLOOKUP(RC[-2],R6C6:R14C11,RC[1]+2,FALSE)*10000/COUNTIFS(C[1],RC[1],C[-2],RC[-2]),0) -> 8 | D275: =INT(MOD(RC[-2],1000)/100) -> 3
A276: 5 | B276: 70311 | C276: =ROUND(VLOOKUP(RC[-2],R6C6:R14C11,RC[1]+2,FALSE)*10000/COUNTIFS(C[1],RC[1],C[-2],RC[-2]),0) -> 8 | D276: =INT(MOD(RC[-2],1000)/100) -> 3
A277: 5 | B277: 70312 | C277: =ROUND(VLOOKUP(RC[-2],R6C6:R14C11,RC[1]+2,FALSE)*10000/COUNTIFS(C[1],RC[1],C[-2],RC[-2]),0) -> 8 | D277: =INT(MOD(RC[-2],1000)/100) -> 3
A278: 5 | B278: 70313 | C278: =ROUND(VLOOKUP(RC[-2],R6C6:R14C11,RC[1]+2,FALSE)*10000/COUNTIFS(C[1],RC[1],C[-2],RC[-2]),0) -> 8 | D278: =INT(MOD(RC[-2],1000)/100) -> 3
A279: 5 | B279: 70314 | C279: =ROUND(VLOOKUP(RC[-2],R6C6:R14C11,RC[1]+2,FALSE)*10000/COUNTIFS(C[1],RC[1],C[-2],RC[-2]),0) -> 8 | D279: =INT(MOD(RC[-2],1000)/100) -> 3
A280: 5 | B280: 70315 | C280: =ROUND(VLOOKUP(RC[-2],R6C6:R14C11,RC[1]+2,FALSE)*10000/COUNTIFS(C[1],RC[1],C[-2],RC[-2]),0) -> 8 | D280: =INT(MOD(RC[-2],1000)/100) -> 3
A281: 5 | B281: 70316 | C281: =ROUND(VLOOKUP(RC[-2],R6C6:R14C11,RC[1]+2,FALSE)*10000/COUNTIFS(C[1],RC[1],C[-2],RC[-2]),0) -> 8 | D281: =INT(MOD(RC[-2],1000)/100) -> 3
A282: 5 | B282: 70317 | C282: =ROUND(VLOOKUP(RC[-2],R6C6:R14C11,RC[1]+2,FALSE)*10000/COUNTIFS(C[1],RC[1],C[-2],RC[-2]),0) -> 8 | D282: =INT(MOD(RC[-2],1000)/100) -> 3
A283: 5 | B283: 70318 | C283: =ROUND(VLOOKUP(RC[-2],R6C6:R14C11,RC[1]+2,FALSE)*10000/COUNTIFS(C[1],RC[1],C[-2],RC[-2]),0) -> 8 | D283: =INT(MOD(RC[-2],1000)/100) -> 3
A284: 5 | B284: 70319 | C284: =ROUND(VLOOKUP(RC[-2],R6C6:R14C11,RC[1]+2,FALSE)*10000/COUNTIFS(C[1],RC[1],C[-2],RC[-2]),0) -> 8 | D284: =INT(MOD(RC[-2],1000)/100) -> 3
A285: 5 | B285: 70320 | C285: =ROUND(VLOOKUP(RC[-2],R6C6:R14C11,RC[1]+2,FALSE)*10000/COUNTIFS(C[1],RC[1],C[-2],RC[-2]),0) -> 8 | D285: =INT(MOD(RC[-2],1000)/100) -> 3
A286: 5 | B286: 70321 | C286: =ROUND(VLOOKUP(RC[-2],R6C6:R14C11,RC[1]+2,FALSE)*10000/COUNTIFS(C[1],RC[1],C[-2],RC[-2]),0) -> 8 | D286: =INT(MOD(RC[-2],1000)/100) -> 3
A287: 5 | B287: 70322 | C287: =ROUND(VLOOKUP(RC[-2],R6C6:R14C11,RC[1]+2,FALSE)*10000/COUNTIFS(C[1],RC[1],C[-2],RC[-2]),0) -> 8 | D287: =INT(MOD(RC[-2],1000)/100) -> 3
A288: 5 | B288: 70323 | C288: =ROUND(VLOOKUP(RC[-2],R6C6:R14C11,RC[1]+2,FALSE)*10000/COUNTIFS(C[1],RC[1],C[-2],RC[-2]),0) -> 8 | D288: =INT(MOD(RC[-2],1000)/100) -> 3
A289: 5 | B289: 70324 | C289: =ROUND(VLOOKUP(RC[-2],R6C6:R14C11,RC[1]+2,FALSE)*10000/COUNTIFS(C[1],RC[1],C[-2],RC[-2]),0) -> 8 | D289: =INT(MOD(RC[-2],1000)/100) -> 3
A290: 5 | B290: 70325 | C290: =ROUND(VLOOKUP(RC[-2],R6C6:R14C11,RC[1]+2,FALSE)*10000/COUNTIFS(C[1],RC[1],C[-2],RC[-2]),0) -> 8 | D290: =INT(MOD(RC[-2],1000)/100) -> 3
A291: 6 | B291: 70000 | C291: =ROUND(VLOOKUP(RC[-2],R6C6:R14C11,RC[1]+2,FALSE)*10000/COUNTIFS(C[1],RC[1],C[-2],RC[-2]),0) -> 540 | D291: =INT(MOD(RC[-2],1000)/100) -> 0
A292: 6 | B292: 70022 | C292: =ROUND(VLOOKUP(RC[-2],R6C6:R14C11,RC[1]+2,FALSE)*10000/COUNTIFS(C[1],RC[1],C[-2],RC[-2]),0) -> 540 | D292: =INT(MOD(RC[-2],1000)/100) -> 0
A293: 6 | B293: 70023 | C293: =ROUND(VLOOKUP(RC[-2],R6C6:R14C11,RC[1]+2,FALSE)*10000/COUNTIFS(C[1],RC[1],C[-2],RC[-2]),0) -> 540 | D293: =INT(MOD(RC[-2],1000)/100) -> 0
A294: 6 | B294: 70024 | C294: =ROUND(VLOOKUP(RC[-2],R6C6:R14C11,RC[1]+2,FALSE)*10000/COUNTIFS(C[1],RC[1],C[-2],RC[-2]),0) -> 540 | D294: =INT(MOD(RC[-2],1000)/100) -> 0
A295: 6 | B295: 70025 | C295: =ROUND(VLOOKUP(RC[-2],R6C6:R14C11,RC[1]+2,FALSE)*10000/COUNTIFS(C[1],RC[1],C[-2],RC[-2]),0) -> 540 | D295: =INT(MOD(RC[-2],1000)/100) -> 0
A296: 6 | B296: 70100 | C296: =ROUND(VLOOKUP(RC[-2],R6C6:R14C11,RC[1]+2,FALSE)*10000/COUNTIFS(C[1],RC[1],C[-2],RC[-2]),0) -> 900 | D296: =INT(MOD(RC[-2],1000)/100) -> 1
A297: 6 | B297: 70122 | C297: =ROUND(VLOOKUP(RC[-2],R6C6:R14C11,RC[1]+2,FALSE)*10000/COUNTIFS(C[1],RC[1],C[-2],RC[-2]),0) -> 900 | D297: =INT(MOD(RC[-2],1000)/100) -> 1
A298: 6 | B298: 70123 | C298: =ROUND(VLOOKUP(RC[-2],R6C6:R14C11,RC[1]+2,FALSE)*10000/COUNTIFS(C[1],RC[1],C[-2],RC[-2]),0) -> 900 | D298: =INT(MOD(RC[-2],1000)/100) -> 1
A299: 6 | B299: 70124 | C299: =ROUND(VLOOKUP(RC[-2],R6C6:R14C11,RC[1]+2,FALSE)*10000/COUNTIFS(C[1],RC[1],C[-2],RC[-2]),0) -> 900 | D299: =INT(MOD(RC[-2],1000)/100) -> 1
A300: 6 | B300: 70125 | C300: =ROUND(VLOOKUP(RC[-2],R6C6:R14C11,RC[1]+2,FALSE)*10000/COUNTIFS(C[1],RC[1],C[-2],RC[-2]),0) -> 900 | D300: =INT(MOD(RC[-2],1000)/100) -> 1
A301: 6 | B301: 70200 | C301: =ROUND(VLOOKUP(RC[-2],R6C6:R14C11,RC[1]+2,FALSE)*10000/COUNTIFS(C[1],RC[1],C[-2],RC[-2]),0) -> 96 | D301: =INT(MOD(RC[-2],1000)/100) -> 2
A302: 6 | B302: 70201 | C302: =ROUND(VLOOKUP(RC[-2],R6C6:R14C11,RC[1]+2,FALSE)*10000/COUNTIFS(C[1],RC[1],C[-2],RC[-2]),0) -> 96 | D302: =INT(MOD(RC[-2],1000)/100) -> 2
A303: 6 | B303: 70202 | C303: =ROUND(VLOOKUP(RC[-2],R6C6:R14C11,RC[1]+2,FALSE)*10000/COUNTIFS(C[1],RC[1],C[-2],RC[-2]),0) -> 96 | D303: =INT(MOD(RC[-2],1000)/100) -> 2
A304: 6 | B304: 70203 | C304: =ROUND(VLOOKUP(RC[-2],R6C6:R14C11,RC[1]+2,FALSE)*10000/COUNTIFS(C[1],RC[1],C[-2],RC[-2]),0) -> 96 | D304: =INT(MOD(RC[-2],1000)/100) -> 2
A305: 6 | B305: 70204 | C305: =ROUND(VLOOKUP(RC[-2],R6C6:R14C11,RC[1]+2,FALSE)*10000/COUNTIFS(C[1],RC[1],C[-2],RC[-2]),0) -> 96 | D305: =INT(MOD(RC[-2],1000)/100) -> 2
A306: 6 | B306: 70205 | C306: =ROUND(VLOOKUP(RC[-2],R6C6:R14C11,RC[1]+2,FALSE)*10000/COUNTIFS(C[1],RC[1],C[-2],RC[-2]),0) -> 96 | D306: =INT(MOD(RC[-2],1000)/100) -> 2
A307: 6 | B307: 70206 | C307: =ROUND(VLOOKUP(RC[-2],R6C6:R14C11,RC[1]+2,FALSE)*10000/COUNTIFS(C[1],RC[1],C[-2],RC[-2]),0) -> 96 | D307: =INT(MOD(RC[-2],1000)/100) -> 2
A308: 6 | B308: 70207 | C308: =ROUND(VLOOKUP(RC[-2],R6C6:R14C11,RC[1]+2,FALSE)*10000/COUNTIFS(C[1],RC[1],C[-2],RC[-2]),0) -> 96 | D308: =INT(MOD(RC[-2],1000)/100) -> 2
A309: 6 | B309: 70208 | C309: =ROUND(VLOOKUP(RC[-2],R6C6:R14C11,RC[1]+2,FALSE)*10000/COUNTIFS(C[1],RC[1],C[-2],RC[-2]),0) -> 96 | D309: =INT(MOD(RC[-2],1000)/100) -> 2
A310: 6 | B310: 70209 | C310: =ROUND(VLOOKUP(RC[-2],R6C6:R14C11,RC[1]+2,FALSE)*10000/COUNTIFS(C[1],RC[1],C[-2],RC[-2]),0) -> 96 | D310: =INT(MOD(RC[-2],1000)/100) -> 2
A311: 6 | B311: 70210 | C311: =ROUND(VLOOKUP(RC[-2],R6C6:R14C11,RC[1]+2,FALSE)*10000/COUNTIFS(C[1],RC[1],C[-2],RC[-2]),0) -> 96 | D311: =INT(MOD(RC[-2],1000)/100) -> 2
A312: 6 | B312: 70211 | C312: =ROUND(VLOOKUP(RC[-2],R6C6:R14C11,RC[1]+2,FALSE)*10000/COUNTIFS(C[1],RC[1],C[-2],RC[-2]),0) -> 96 | D312: =INT(MOD(RC[-2],1000)/100) -> 2
A313: 6 | B313: 70212 | C313: =ROUND(VLOOKUP(RC[-2],R6C6:R14C11,RC[1]+2,FALSE)*10000/COUNTIFS(C[1],RC[1],C[-2],RC[-2]),0) -> 96 | D313: =INT(MOD(RC[-2],1000)/100) -> 2
A314: 6 | B314: 70213 | C314: =ROUND(VLOOKUP(RC[-2],R6C6:R14C11,RC[1]+2,FALSE)*10000/COUNTIFS(C[1],RC[1],C[-2],RC[-2]),0) -> 96 | D314: =INT(MOD(RC[-2],1000)/100) -> 2
A315: 6 | B315: 70214 | C315: =ROUND(VLOOKUP(RC[-2],R6C6:R14C11,RC[1]+2,FALSE)*10000/COUNTIFS(C[1],RC[1],C[-2],RC[-2]),0) -> 96 | D315: =INT(MOD(RC[-2],1000)/100) -> 2
A316: 6 | B316: 70215 | C316: =ROUND(VLOOKUP(RC[-2],R6C6:R14C11,RC[1]+2,FALSE)*10000/COUNTIFS(C[1],RC[1],C[-2],RC[-2]),0) -> 96 | D316: =INT(MOD(RC[-2],1000)/100) -> 2
A317: 6 | B317: 70216 | C317: =ROUND(VLOOKUP(RC[-2],R6C6:R14C11,RC[1]+2,FALSE)*10000/COUNTIFS(C[1],RC[1],C[-2],RC[-2]),0) -> 96 | D317: =INT(MOD(RC[-2],1000)/100) -> 2
A318: 6 | B318: 70217 | C318: =ROUND(VLOOKUP(RC[-2],R6C6:R14C11,RC[1]+2,FALSE)*10000/COUNTIFS(C[1],RC[1],C[-2],RC[-2]),0) -> 96 | D318: =INT(MOD(RC[-2],1000)/100) -> 2
A319: 6 | B319: 70218 | C319: =ROUND(VLOOKUP(RC[-2],R6C6:R14C11,RC[1]+2,FALSE)*10000/COUNTIFS(C[1],RC[1],C[-2],RC[-2]),0) -> 96 | D319: =INT(MOD(RC[-2],1000)/100) -> 2
A320: 6 | B320: 70219 | C320: =ROUND(VLOOKUP(RC[-2],R6C6:R14C11,RC[1]+2,FALSE)*10000/COUNTIFS(C[1],RC[1],C[-2],RC[-2]),0) -> 96 | D320: =INT(MOD(RC[-2],1000)/100) -> 2
A321: 6 | B321: 70220 | C321: =ROUND(VLOOKUP(RC[-2],R6C6:R14C11,RC[1]+2,FALSE)*10000/COUNTIFS(C[1],RC[1],C[-2],RC[-2]),0) -> 96 | D321: =INT(MOD(RC[-2],1000)/100) -> 2
A322: 6 | B322: 70221 | C322: =ROUND(VLOOKUP(RC[-2],R6C6:R14C11,RC[1]+2,FALSE)*10000/COUNTIFS(C[1],RC[1],C[-2],RC[-2]),0) -> 96 | D322: =INT(MOD(RC[-2],1000)/100) -> 2
A323: 6 | B323: 70222 | C323: =ROUND(VLOOKUP(RC[-2],R6C6:R14C11,RC[1]+2,FALSE)*10000/COUNTIFS(C[1],RC[1],C[-2],RC[-2]),0) -> 96 | D323: =INT(MOD(RC[-2],1000)/100) -> 2
A324: 6 | B324: 70223 | C324: =ROUND(VLOOKUP(RC[-2],R6C6:R14C11,RC[1]+2,FALSE)*10000/COUNTIFS(C[1],RC[1],C[-2],RC[-2]),0) -> 96 | D324: =INT(MOD(RC[-2],1000)/100) -> 2
A325: 6 | B325: 70224 | C325: =ROUND(VLOOKUP(RC[-2],R6C6:R14C11,RC[1]+2,FALSE)*10000/COUNTIFS(C[1],RC[1],C[-2],RC[-2]),0) -> 96 | D325: =INT(MOD(RC[-2],1000)/100) -> 2
A326: 6 | B326: 70225 | C326: =ROUND(VLOOKUP(RC[-2],R6C6:R14C11,RC[1]+2,FALSE)*10000/COUNTIFS(C[1],RC[1],C[-2],RC[-2]),0) -> 96 | D326: =INT(MOD(RC[-2],1000)/100) -> 2
A327: 6 | B327: 70300 | C327: =ROUND(VLOOKUP(RC[-2],R6C6:R14C11,RC[1]+2,FALSE)*10000/COUNTIFS(C[1],RC[1],C[-2],RC[-2]),0) -> 12 | D327: =INT(MOD(RC[-2],1000)/100) -> 3
A328: 6 | B328: 70301 | C328: =ROUND(VLOOKUP(RC[-2],R6C6:R14C11,RC[1]+2,FALSE)*10000/COUNTIFS(C[1],RC[1],C[-2],RC[-2]),0) -> 12 | D328: =INT(MOD(RC[-2],1000)/100) -> 3
A329: 6 | B329: 70302 | C329: =ROUND(VLOOKUP(RC[-2],R6C6:R14C11,RC[1]+2,FALSE)*10000/COUNTIFS(C[1],RC[1],C[-2],RC[-2]),0) -> 12 | D329: =INT(MOD(RC[-2],1000)/100) -> 3
A330: 6 | B330: 70303 | C330: =ROUND(VLOOKUP(RC[-2],R6C6:R14C11,RC[1]+2,FALSE)*10000/COUNTIFS(C[1],RC[1],C[-2],RC[-2]),0) -> 12 | D330: =INT(MOD(RC[-2],1000)/100) -> 3
A331: 6 | B331: 70304 | C331: =ROUND(VLOOKUP(RC[-2],R6C6:R14C11,RC[1]+2,FALSE)*10000/COUNTIFS(C[1],RC[1],C[-2],RC[-2]),0) -> 12 | D331: =INT(MOD(RC[-2],1000)/100) -> 3
A332: 6 | B332: 70305 | C332: =ROUND(VLOOKUP(RC[-2],R6C6:R14C11,RC[1]+2,FALSE)*10000/COUNTIFS(C[1],RC[1],C[-2],RC[-2]),0) -> 12 | D332: =INT(MOD(RC[-2],1000)/100) -> 3
A333: 6 | B333: 70306 | C333: =ROUND(VLOOKUP(RC[-2],R6C6:R14C11,RC[1]+2,FALSE)*10000/COUNTIFS(C[1],RC[1],C[-2],RC[-2]),0) -> 12 | D333: =INT(MOD(RC[-2],1000)/100) -> 3
A334: 6 | B334: 70307 | C334: =ROUND(VLOOKUP(RC[-2],R6C6:R14C11,RC[1]+2,FALSE)*10000/COUNTIFS(C[1],RC[1],C[-2],RC[-2]),0) -> 12 | D334: =INT(MOD(RC[-2],1000)/100) -> 3
A335: 6 | B335: 70308 | C335: =ROUND(VLOOKUP(RC[-2],R6C6:R14C11,RC[1]+2,FALSE)*10000/COUNTIFS(C[1],RC[1],C[-2],RC[-2]),0) -> 12 | D335: =INT(MOD(RC[-2],1000)/100) -> 3
A336: 6 | B336: 70309 | C336: =ROUND(VLOOKUP(RC[-2],R6C6:R14C11,RC[1]+2,FALSE)*10000/COUNTIFS(C[1],RC[1],C[-2],RC[-2]),0) -> 12 | D336: =INT(MOD(RC[-2],1000)/100) -> 3
A337: 6 | B337: 70310 | C337: =ROUND(VLOOKUP(RC[-2],R6C6:R14C11,RC[1]+2,FALSE)*10000/COUNTIFS(C[1],RC[1],C[-2],RC[-2]),0) -> 12 | D337: =INT(MOD(RC[-2],1000)/100) -> 3
A338: 6 | B338: 70311 | C338: =ROUND(VLOOKUP(RC[-2],R6C6:R14C11,RC[1]+2,FALSE)*10000/COUNTIFS(C[1],RC[1],C[-2],RC[-2]),0) -> 12 | D338: =INT(MOD(RC[-2],1000)/100) -> 3
A339: 6 | B339: 70312 | C339: =ROUND(VLOOKUP(RC[-2],R6C6:R14C11,RC[1]+2,FALSE)*10000/COUNTIFS(C[1],RC[1],C[-2],RC[-2]),0) -> 12 | D339: =INT(MOD(RC[-2],1000)/100) -> 3
A340: 6 | B340: 70313 | C340: =ROUND(VLOOKUP(RC[-2],R6C6:R14C11,RC[1]+2,FALSE)*10000/COUNTIFS(C[1],RC[1],C[-2],RC[-2]),0) -> 12 | D340: =INT(MOD(RC[-2],1000)/100) -> 3
A341: 6 | B341: 70314 | C341: =ROUND(VLOOKUP(RC[-2],R6C6:R14C11,RC[1]+2,FALSE)*10000/COUNTIFS(C[1],RC[1],C[-2],RC[-2]),0) -> 12 | D341: =INT(MOD(RC[-2],1000)/100) -> 3
A342: 6 | B342: 70315 | C342: =ROUND(VLOOKUP(RC[-2],R6C6:R14C11,RC[1]+2,FALSE)*10000/COUNTIFS(C[1],RC[1],C[-2],RC[-2]),0) -> 12 | D342: =INT(MOD(RC[-2],1000)/100) -> 3
A343: 6 | B343: 70316 | C343: =ROUND(VLOOKUP(RC[-2],R6C6:R14C11,RC[1]+2,FALSE)*10000/COUNTIFS(C[1],RC[1],C[-2],RC[-2]),0) -> 12 | D343: =INT(MOD(RC[-2],1000)/100) -> 3
A344: 6 | B344: 70317 | C344: =ROUND(VLOOKUP(RC[-2],R6C6:R14C11,RC[1]+2,FALSE)*10000/COUNTIFS(C[1],RC[1],C[-2],RC[-2]),0) -> 12 | D344: =INT(MOD(RC[-2],1000)/100) -> 3
A345: 6 | B345: 70318 | C345: =ROUND(VLOOKUP(RC[-2],R6C6:R14C11,RC[1]+2,FALSE)*10000/COUNTIFS(C[1],RC[1],C[-2],RC[-2]),0) -> 12 | D345: =INT(MOD(RC[-2],1000)/100) -> 3
A346: 6 | B346: 70319 | C346: =ROUND(VLOOKUP(RC[-2],R6C6:R14C11,RC[1]+2,FALSE)*10000/COUNTIFS(C[1],RC[1],C[-2],RC[-2]),0) -> 12 | D346: =INT(MOD(RC[-2],1000)/100) -> 3
A347: 6 | B347: 70320 | C347: =ROUND(VLOOKUP(RC[-2],R6C6:R14C11,RC[1]+2,FALSE)*10000/COUNTIFS(C[1],RC[1],C[-2],RC[-2]),0) -> 12 | D347: =INT(MOD(RC[-2],1000)/100) -> 3
A348: 6 | B348: 70321 | C348: =ROUND(VLOOKUP(RC[-2],R6C6:R14C11,RC[1]+2,FALSE)*10000/COUNTIFS(C[1],RC[1],C[-2],RC[-2]),0) -> 12 | D348: =INT(MOD(RC[-2],1000)/100) -> 3
A349: 6 | B349: 70322 | C349: =ROUND(VLOOKUP(RC[-2],R6C6:R14C11,RC[1]+2,FALSE)*10000/COUNTIFS(C[1],RC[1],C[-2],RC[-2]),0) -> 12 | D349: =INT(MOD(RC[-2],1000)/100) -> 3
A350: 6 | B350: 70323 | C350: =ROUND(VLOOKUP(RC[-2],R6C6:R14C11,RC[1]+2,FALSE)*10000/COUNTIFS(C[1],RC[1],C[-2],RC[-2]),0) -> 12 | D350: =INT(MOD(RC[-2],1000)/100) -> 3
A351: 6 | B351: 70324 | C351: =ROUND(VLOOKUP(RC[-2],R6C6:R14C11,RC[1]+2,FALSE)*10000/COUNTIFS(C[1],RC[1],C[-2],RC[-2]),0) -> 12 | D351: =INT(MOD(RC[-2],1000)/100) -> 3
A352: 6 | B352: 70325 | C352: =ROUND(VLOOKUP(RC[-2],R6C6:R14C11,RC[1]+2,FALSE)*10000/COUNTIFS(C[1],RC[1],C[-2],RC[-2]),0) -> 12 | D352: =INT(MOD(RC[-2],1000)/100) -> 3
A353: 7 | B353: 70000 | C353: =ROUND(VLOOKUP(RC[-2],R6C6:R14C11,RC[1]+2,FALSE)*10000/COUNTIFS(C[1],RC[1],C[-2],RC[-2]),0) -> 220 | D353: =INT(MOD(RC[-2],1000)/100) -> 0
A354: 7 | B354: 70022 | C354: =ROUND(VLOOKUP(RC[-2],R6C6:R14C11,RC[1]+2,FALSE)*10000/COUNTIFS(C[1],RC[1],C[-2],RC[-2]),0) -> 220 | D354: =INT(MOD(RC[-2],1000)/100) -> 0
A355: 7 | B355: 70023 | C355: =ROUND(VLOOKUP(RC[-2],R6C6:R14C11,RC[1]+2,FALSE)*10000/COUNTIFS(C[1],RC[1],C[-2],RC[-2]),0) -> 220 | D355: =INT(MOD(RC[-2],1000)/100) -> 0
A356: 7 | B356: 70024 | C356: =ROUND(VLOOKUP(RC[-2],R6C6:R14C11,RC[1]+2,FALSE)*10000/COUNTIFS(C[1],RC[1],C[-2],RC[-2]),0) -> 220 | D356: =INT(MOD(RC[-2],1000)/100) -> 0
A357: 7 | B357: 70025 | C357: =ROUND(VLOOKUP(RC[-2],R6C6:R14C11,RC[1]+2,FALSE)*10000/COUNTIFS(C[1],RC[1],C[-2],RC[-2]),0) -> 220 | D357: =INT(MOD(RC[-2],1000)/100) -> 0
A358: 7 | B358: 70100 | C358: =ROUND(VLOOKUP(RC[-2],R6C6:R14C11,RC[1]+2,FALSE)*10000/COUNTIFS(C[1],RC[1],C[-2],RC[-2]),0) -> 1200 | D358: =INT(MOD(RC[-2],1000)/100) -> 1
A359: 7 | B359: 70122 | C359: =ROUND(VLOOKUP(RC[-2],R6C6:R14C11,RC[1]+2,FALSE)*10000/COUNTIFS(C[1],RC[1],C[-2],RC[-2]),0) -> 1200 | D359: =INT(MOD(RC[-2],1000)/100) -> 1
A360: 7 | B360: 70123 | C360: =ROUND(VLOOKUP(RC[-2],R6C6:R14C11,RC[1]+2,FALSE)*10000/COUNTIFS(C[1],RC[1],C[-2],RC[-2]),0) -> 1200 | D360: =INT(MOD(RC[-2],1000)/100) -> 1
A361: 7 | B361: 70124 | C361: =ROUND(VLOOKUP(RC[-2],R6C6:R14C11,RC[1]+2,FALSE)*10000/COUNTIFS(C[1],RC[1],C[-2],RC[-2]),0) -> 1200 | D361: =INT(MOD(RC[-2],1000)/100) -> 1
A362: 7 | B362: 70125 | C362: =ROUND(VLOOKUP(RC[-2],R6C6:R14C11,RC[1]+2,FALSE)*10000/COUNTIFS(C[1],RC[1],C[-2],RC[-2]),0) -> 1200 | D362: =INT(MOD(RC[-2],1000)/100) -> 1
A363: 7 | B363: 70200 | C363: =ROUND(VLOOKUP(RC[-2],R6C6:R14C11,RC[1]+2,FALSE)*10000/COUNTIFS(C[1],RC[1],C[-2],RC[-2]),0) -> 96 | D363: =INT(MOD(RC[-2],1000)/100) -> 2
A364: 7 | B364: 70201 | C364: =ROUND(VLOOKUP(RC[-2],R6C6:R14C11,RC[1]+2,FALSE)*10000/COUNTIFS(C[1],RC[1],C[-2],RC[-2]),0) -> 96 | D364: =INT(MOD(RC[-2],1000)/100) -> 2
A365: 7 | B365: 70202 | C365: =ROUND(VLOOKUP(RC[-2],R6C6:R14C11,RC[1]+2,FALSE)*10000/COUNTIFS(C[1],RC[1],C[-2],RC[-2]),0) -> 96 | D365: =INT(MOD(RC[-2],1000)/100) -> 2
A366: 7 | B366: 70203 | C366: =ROUND(VLOOKUP(RC[-2],R6C6:R14C11,RC[1]+2,FALSE)*10000/COUNTIFS(C[1],RC[1],C[-2],RC[-2]),0) -> 96 | D366: =INT(MOD(RC[-2],1000)/100) -> 2
A367: 7 | B367: 70204 | C367: =ROUND(VLOOKUP(RC[-2],R6C6:R14C11,RC[1]+2,FALSE)*10000/COUNTIFS(C[1],RC[1],C[-2],RC[-2]),0) -> 96 | D367: =INT(MOD(RC[-2],1000)/100) -> 2
A368: 7 | B368: 70205 | C368: =ROUND(VLOOKUP(RC[-2],R6C6:R14C11,RC[1]+2,FALSE)*10000/COUNTIFS(C[1],RC[1],C[-2],RC[-2]),0) -> 96 | D368: =INT(MOD(RC[-2],1000)/100) -> 2
A369: 7 | B369: 70206 | C369: =ROUND(VLOOKUP(RC[-2],R6C6:R14C11,RC[1]+2,FALSE)*10000/COUNTIFS(C[1],RC[1],C[-2],RC[-2]),0) -> 96 | D369: =INT(MOD(RC[-2],1000)/100) -> 2
A370: 7 | B370: 70207 | C370: =ROUND(VLOOKUP(RC[-2],R6C6:R14C11,RC[1]+2,FALSE)*10000/COUNTIFS(C[1],RC[1],C[-2],RC[-2]),0) -> 96 | D370: =INT(MOD(RC[-2],1000)/100) -> 2
A371: 7 | B371: 70208 | C371: =ROUND(VLOOKUP(RC[-2],R6C6:R14C11,RC[1]+2,FALSE)*10000/COUNTIFS(C[1],RC[1],C[-2],RC[-2]),0) -> 96 | D371: =INT(MOD(RC[-2],1000)/100) -> 2
A372: 7 | B372: 70209 | C372: =ROUND(VLOOKUP(RC[-2],R6C6:R14C11,RC[1]+2,FALSE)*10000/COUNTIFS(C[1],RC[1],C[-2],RC[-2]),0) -> 96 | D372: =INT(MOD(RC[-2],1000)/100) -> 2
A373: 7 | B373: 70210 | C373: =ROUND(VLOOKUP(RC[-2],R6C6:R14C11,RC[1]+2,FALSE)*10000/COUNTIFS(C[1],RC[1],C[-2],RC[-2]),0) -> 96 | D373: =INT(MOD(RC[-2],1000)/100) -> 2
A374: 7 | B374: 70211 | C374: =ROUND(VLOOKUP(RC[-2],R6C6:R14C11,RC[1]+2,FALSE)*10000/COUNTIFS(C[1],RC[1],C[-2],RC[-2]),0) -> 96 | D374: =INT(MOD(RC[-2],1000)/100) -> 2
A375: 7 | B375: 70212 | C375: =ROUND(VLOOKUP(RC[-2],R6C6:R14C11,RC[1]+2,FALSE)*10000/COUNTIFS(C[1],RC[1],C[-2],RC[-2]),0) -> 96 | D375: =INT(MOD(RC[-2],1000)/100) -> 2
A376: 7 | B376: 70213 | C376: =ROUND(VLOOKUP(RC[-2],R6C6:R14C11,RC[1]+2,FALSE)*10000/COUNTIFS(C[1],RC[1],C[-2],RC[-2]),0) -> 96 | D376: =INT(MOD(RC[-2],1000)/100) -> 2
A377: 7 | B377: 70214 | C377: =ROUND(VLOOKUP(RC[-2],R6C6:R14C11,RC[1]+2,FALSE)*10000/COUNTIFS(C[1],RC[1],C[-2],RC[-2]),0) -> 96 | D377: =INT(MOD(RC[-2],1000)/100) -> 2
A378: 7 | B378: 70215 | C378: =ROUND(VLOOKUP(RC[-2],R6C6:R14C11,RC[1]+2,FALSE)*10000/COUNTIFS(C[1],RC[1],C[-2],RC[-2]),0) -> 96 | D378: =INT(MOD(RC[-2],1000)/100) -> 2
A379: 7 | B379: 70216 | C379: =ROUND(VLOOKUP(RC[-2],R6C6:R14C11,RC[1]+2,FALSE)*10000/COUNTIFS(C[1],RC[1],C[-2],RC[-2]),0) -> 96 | D379: =INT(MOD(RC[-2],1000)/100) -> 2
A380: 7 | B380: 70217 | C380: =ROUND(VLOOKUP(RC[-2],R6C6:R14C11,RC[1]+2,FALSE)*10000/COUNTIFS(C[1],RC[1],C[-2],RC[-2]),0) -> 96 | D380: =INT(MOD(RC[-2],1000)/100) -> 2
A381: 7 | B381: 70218 | C381: =ROUND(VLOOKUP(RC[-2],R6C6:R14C11,RC[1]+2,FALSE)*10000/COUNTIFS(C[1],RC[1],C[-2],RC[-2]),0) -> 96 | D381: =INT(MOD(RC[-2],1000)/100) -> 2
A382: 7 | B382: 70219 | C382: =ROUND(VLOOKUP(RC[-2],R6C6:R14C11,RC[1]+2,FALSE)*10000/COUNTIFS(C[1],RC[1],C[-2],RC[-2]),0) -> 96 | D382: =INT(MOD(RC[-2],1000)/100) -> 2
A383: 7 | B383: 70220 | C383: =ROUND(VLOOKUP(RC[-2],R6C6:R14C11,RC[1]+2,FALSE)*10000/COUNTIFS(C[1],RC[1],C[-2],RC[-2]),0) -> 96 | D383: =INT(MOD(RC[-2],1000)/100) -> 2
A384: 7 | B384: 70221 | C384: =ROUND(VLOOKUP(RC[-2],R6C6:R14C11,RC[1]+2,FALSE)*10000/COUNTIFS(C[1],RC[1],C[-2],RC[-2]),0) -> 96 | D384: =INT(MOD(RC[-2],1000)/100) -> 2
A385: 7 | B385: 70222 | C385: =ROUND(VLOOKUP(RC[-2],R6C6:R14C11,RC[1]+2,FALSE)*10000/COUNTIFS(C[1],RC[1],C[-2],RC[-2]),0) -> 96 | D385: =INT(MOD(RC[-2],1000)/100) -> 2
A386: 7 | B386: 70223 | C386: =ROUND(VLOOKUP(RC[-2],R6C6:R14C11,RC[1]+2,FALSE)*10000/COUNTIFS(C[1],RC[1],C[-2],RC[-2]),0) -> 96 | D386: =INT(MOD(RC[-2],1000)/100) -> 2
A387: 7 | B387: 70224 | C387: =ROUND(VLOOKUP(RC[-2],R6C6:R14C11,RC[1]+2,FALSE)*10000/COUNTIFS(C[1],RC[1],C[-2],RC[-2]),0) -> 96 | D387: =INT(MOD(RC[-2],1000)/100) -> 2
A388: 7 | B388: 70225 | C388: =ROUND(VLOOKUP(RC[-2],R6C6:R14C11,RC[1]+2,FALSE)*10000/COUNTIFS(C[1],RC[1],C[-2],RC[-2]),0) -> 96 | D388: =INT(MOD(RC[-2],1000)/100) -> 2
A389: 7 | B389: 70300 | C389: =ROUND(VLOOKUP(RC[-2],R6C6:R14C11,RC[1]+2,FALSE)*10000/COUNTIFS(C[1],RC[1],C[-2],RC[-2]),0) -> 15 | D389: =INT(MOD(RC[-2],1000)/100) -> 3
A390: 7 | B390: 70301 | C390: =ROUND(VLOOKUP(RC[-2],R6C6:R14C11,RC[1]+2,FALSE)*10000/COUNTIFS(C[1],RC[1],C[-2],RC[-2]),0) -> 15 | D390: =INT(MOD(RC[-2],1000)/100) -> 3
A391: 7 | B391: 70302 | C391: =ROUND(VLOOKUP(RC[-2],R6C6:R14C11,RC[1]+2,FALSE)*10000/COUNTIFS(C[1],RC[1],C[-2],RC[-2]),0) -> 15 | D391: =INT(MOD(RC[-2],1000)/100) -> 3
A392: 7 | B392: 70303 | C392: =ROUND(VLOOKUP(RC[-2],R6C6:R14C11,RC[1]+2,FALSE)*10000/COUNTIFS(C[1],RC[1],C[-2],RC[-2]),0) -> 15 | D392: =INT(MOD(RC[-2],1000)/100) -> 3
A393: 7 | B393: 70304 | C393: =ROUND(VLOOKUP(RC[-2],R6C6:R14C11,RC[1]+2,FALSE)*10000/COUNTIFS(C[1],RC[1],C[-2],RC[-2]),0) -> 15 | D393: =INT(MOD(RC[-2],1000)/100) -> 3
A394: 7 | B394: 70305 | C394: =ROUND(VLOOKUP(RC[-2],R6C6:R14C11,RC[1]+2,FALSE)*10000/COUNTIFS(C[1],RC[1],C[-2],RC[-2]),0) -> 15 | D394: =INT(MOD(RC[-2],1000)/100) -> 3
A395: 7 | B395: 70306 | C395: =ROUND(VLOOKUP(RC[-2],R6C6:R14C11,RC[1]+2,FALSE)*10000/COUNTIFS(C[1],RC[1],C[-2],RC[-2]),0) -> 15 | D395: =INT(MOD(RC[-2],1000)/100) -> 3
A396: 7 | B396: 70307 | C396: =ROUND(VLOOKUP(RC[-2],R6C6:R14C11,RC[1]+2,FALSE)*10000/COUNTIFS(C[1],RC[1],C[-2],RC[-2]),0) -> 15 | D396: =INT(MOD(RC[-2],1000)/100) -> 3
A397: 7 | B397: 70308 | C397: =ROUND(VLOOKUP(RC[-2],R6C6:R14C11,RC[1]+2,FALSE)*10000/COUNTIFS(C[1],RC[1],C[-2],RC[-2]),0) -> 15 | D397: =INT(MOD(RC[-2],1000)/100) -> 3
A398: 7 | B398: 70309 | C398: =ROUND(VLOOKUP(RC[-2],R6C6:R14C11,RC[1]+2,FALSE)*10000/COUNTIFS(C[1],RC[1],C[-2],RC[-2]),0) -> 15 | D398: =INT(MOD(RC[-2],1000)/100) -> 3
A399: 7 | B399: 70310 | C399: =ROUND(VLOOKUP(RC[-2],R6C6:R14C11,RC[1]+2,FALSE)*10000/COUNTIFS(C[1],RC[1],C[-2],RC[-2]),0) -> 15 | D399: =INT(MOD(RC[-2],1000)/100) -> 3
A400: 7 | B400: 70311 | C400: =ROUND(VLOOKUP(RC[-2],R6C6:R14C11,RC[1]+2,FALSE)*10000/COUNTIFS(C[1],RC[1],C[-2],RC[-2]),0) -> 15 | D400: =INT(MOD(RC[-2],1000)/100) -> 3
A401: 7 | B401: 70312 | C401: =ROUND(VLOOKUP(RC[-2],R6C6:R14C11,RC[1]+2,FALSE)*10000/COUNTIFS(C[1],RC[1],C[-2],RC[-2]),0) -> 15 | D401: =INT(MOD(RC[-2],1000)/100) -> 3
A402: 7 | B402: 70313 | C402: =ROUND(VLOOKUP(RC[-2],R6C6:R14C11,RC[1]+2,FALSE)*10000/COUNTIFS(C[1],RC[1],C[-2],RC[-2]),0) -> 15 | D402: =INT(MOD(RC[-2],1000)/100) -> 3
A403: 7 | B403: 70314 | C403: =ROUND(VLOOKUP(RC[-2],R6C6:R14C11,RC[1]+2,FALSE)*10000/COUNTIFS(C[1],RC[1],C[-2],RC[-2]),0) -> 15 | D403: =INT(MOD(RC[-2],1000)/100) -> 3
A404: 7 | B404: 70315 | C404: =ROUND(VLOOKUP(RC[-2],R6C6:R14C11,RC[1]+2,FALSE)*10000/COUNTIFS(C[1],RC[1],C[-2],RC[-2]),0) -> 15 | D404: =INT(MOD(RC[-2],1000)/100) -> 3
A405: 7 | B405: 70316 | C405: =ROUND(VLOOKUP(RC[-2],R6C6:R14C11,RC[1]+2,FALSE)*10000/COUNTIFS(C[1],RC[1],C[-2],RC[-2]),0) -> 15 | D405: =INT(MOD(RC[-2],1000)/100) -> 3
A406: 7 | B406: 70317 | C406: =ROUND(VLOOKUP(RC[-2],R6C6:R14C11,RC[1]+2,FALSE)*10000/COUNTIFS(C[1],RC[1],C[-2],RC[-2]),0) -> 15 | D406: =INT(MOD(RC[-2],1000)/100) -> 3
A407: 7 | B407: 70318 | C407: =ROUND(VLOOKUP(RC[-2],R6C6:R14C11,RC[1]+2,FALSE)*10000/COUNTIFS(C[1],RC[1],C[-2],RC[-2]),0) -> 15 | D407: =INT(MOD(RC[-2],1000)/100) -> 3
A408: 7 | B408: 70319 | C408: =ROUND(VLOOKUP(RC[-2],R6C6:R14C11,RC[1]+2,FALSE)*10000/COUNTIFS(C[1],RC[1],C[-2],RC[-2]),0) -> 15 | D408: =INT(MOD(RC[-2],1000)/100) -> 3
A409: 7 | B409: 70320 | C409: =ROUND(VLOOKUP(RC[-2],R6C6:R14C11,RC[1]+2,FALSE)*10000/COUNTIFS(C[1],RC[1],C[-2],RC[-2]),0) -> 15 | D409: =INT(MOD(RC[-2],1000)/100) -> 3
A410: 7 | B410: 70321 | C410: =ROUND(VLOOKUP(RC[-2],R6C6:R14C11,RC[1]+2,FALSE)*10000/COUNTIFS(C[1],RC[1],C[-2],RC[-2]),0) -> 15 | D410: =INT(MOD(RC[-2],1000)/100) -> 3
A411: 7 | B411: 70322 | C411: =ROUND(VLOOKUP(RC[-2],R6C6:R14C11,RC[1]+2,FALSE)*10000/COUNTIFS(C[1],RC[1],C[-2],RC[-2]),0) -> 15 | D411: =INT(MOD(RC[-2],1000)/100) -> 3
A412: 7 | B412: 70323 | C412: =ROUND(VLOOKUP(RC[-2],R6C6:R14C11,RC[1]+2,FALSE)*10000/COUNTIFS(C[1],RC[1],C[-2],RC[-2]),0) -> 15 | D412: =INT(MOD(RC[-2],1000)/100) -> 3
A413: 7 | B413: 70324 | C413: =ROUND(VLOOKUP(RC[-2],R6C6:R14C11,RC[1]+2,FALSE)*10000/COUNTIFS(C[1],RC[1],C[-2],RC[-2]),0) -> 15 | D413: =INT(MOD(RC[-2],1000)/100) -> 3
A414: 7 | B414: 70325 | C414: =ROUND(VLOOKUP(RC[-2],R6C6:R14C11,RC[1]+2,FALSE)*10000/COUNTIFS(C[1],RC[1],C[-2],RC[-2]),0) -> 15 | D414: =INT(MOD(RC[-2],1000)/100) -> 3
A415: 8 | B415: 70000 | C415: =ROUND(VLOOKUP(RC[-2],R6C6:R14C11,RC[1]+2,FALSE)*10000/COUNTIFS(C[1],RC[1],C[-2],RC[-2]),0) -> 196 | D415: =INT(MOD(RC[-2],1000)/100) -> 0
A416: 8 | B416: 70022 | C416: =ROUND(VLOOKUP(RC[-2],R6C6:R14C11,RC[1]+2,FALSE)*10000/COUNTIFS(C[1],RC[1],C[-2],RC[-2]),0) -> 196 | D416: =INT(MOD(RC[-2],1000)/100) -> 0
A417: 8 | B417: 70023 | C417: =ROUND(VLOOKUP(RC[-2],R6C6:R14C11,RC[1]+2,FALSE)*10000/COUNTIFS(C[1],RC[1],C[-2],RC[-2]),0) -> 196 | D417: =INT(MOD(RC[-2],1000)/100) -> 0
A418: 8 | B418: 70024 | C418: =ROUND(VLOOKUP(RC[-2],R6C6:R14C11,RC[1]+2,FALSE)*10000/COUNTIFS(C[1],RC[1],C[-2],RC[-2]),0) -> 196 | D418: =INT(MOD(RC[-2],1000)/100) -> 0
A419: 8 | B419: 70025 | C419: =ROUND(VLOOKUP(RC[-2],R6C6:R14C11,RC[1]+2,FALSE)*10000/COUNTIFS(C[1],RC[1],C[-2],RC[-2]),0) -> 196 | D419: =INT(MOD(RC[-2],1000)/100) -> 0
A420: 8 | B420: 70100 | C420: =ROUND(VLOOKUP(RC[-2],R6C6:R14C11,RC[1]+2,FALSE)*10000/COUNTIFS(C[1],RC[1],C[-2],RC[-2]),0) -> 1200 | D420: =INT(MOD(RC[-2],1000)/100) -> 1
A421: 8 | B421: 70122 | C421: =ROUND(VLOOKUP(RC[-2],R6C6:R14C11,RC[1]+2,FALSE)*10000/COUNTIFS(C[1],RC[1],C[-2],RC[-2]),0) -> 1200 | D421: =INT(MOD(RC[-2],1000)/100) -> 1
A422: 8 | B422: 70123 | C422: =ROUND(VLOOKUP(RC[-2],R6C6:R14C11,RC[1]+2,FALSE)*10000/COUNTIFS(C[1],RC[1],C[-2],RC[-2]),0) -> 1200 | D422: =INT(MOD(RC[-2],1000)/100) -> 1
A423: 8 | B423: 70124 | C423: =ROUND(VLOOKUP(RC[-2],R6C6:R14C11,RC[1]+2,FALSE)*10000/COUNTIFS(C[1],RC[1],C[-2],RC[-2]),0) -> 1200 | D423: =INT(MOD(RC[-2],1000)/100) -> 1
A424: 8 | B424: 70125 | C424: =ROUND(VLOOKUP(RC[-2],R6C6:R14C11,RC[1]+2,FALSE)*10000/COUNTIFS(C[1],RC[1],C[-2],RC[-2]),0) -> 1200 | D424: =INT(MOD(RC[-2],1000)/100) -> 1
A425: 8 | B425: 70200 | C425: =ROUND(VLOOKUP(RC[-2],R6C6:R14C11,RC[1]+2,FALSE)*10000/COUNTIFS(C[1],RC[1],C[-2],RC[-2]),0) -> 96 | D425: =INT(MOD(RC[-2],1000)/100) -> 2
A426: 8 | B426: 70201 | C426: =ROUND(VLOOKUP(RC[-2],R6C6:R14C11,RC[1]+2,FALSE)*10000/COUNTIFS(C[1],RC[1],C[-2],RC[-2]),0) -> 96 | D426: =INT(MOD(RC[-2],1000)/100) -> 2
A427: 8 | B427: 70202 | C427: =ROUND(VLOOKUP(RC[-2],R6C6:R14C11,RC[1]+2,FALSE)*10000/COUNTIFS(C[1],RC[1],C[-2],RC[-2]),0) -> 96 | D427: =INT(MOD(RC[-2],1000)/100) -> 2
A428: 8 | B428: 70203 | C428: =ROUND(VLOOKUP(RC[-2],R6C6:R14C11,RC[1]+2,FALSE)*10000/COUNTIFS(C[1],RC[1],C[-2],RC[-2]),0) -> 96 | D428: =INT(MOD(RC[-2],1000)/100) -> 2
A429: 8 | B429: 70204 | C429: =ROUND(VLOOKUP(RC[-2],R6C6:R14C11,RC[1]+2,FALSE)*10000/COUNTIFS(C[1],RC[1],C[-2],RC[-2]),0) -> 96 | D429: =INT(MOD(RC[-2],1000)/100) -> 2
A430: 8 | B430: 70205 | C430: =ROUND(VLOOKUP(RC[-2],R6C6:R14C11,RC[1]+2,FALSE)*10000/COUNTIFS(C[1],RC[1],C[-2],RC[-2]),0) -> 96 | D430: =INT(MOD(RC[-2],1000)/100) -> 2
A431: 8 | B431: 70206 | C431: =ROUND(VLOOKUP(RC[-2],R6C6:R14C11,RC[1]+2,FALSE)*10000/COUNTIFS(C[1],RC[1],C[-2],RC[-2]),0) -> 96 | D431: =INT(MOD(RC[-2],1000)/100) -> 2
A432: 8 | B432: 70207 | C432: =ROUND(VLOOKUP(RC[-2],R6C6:R14C11,RC[1]+2,FALSE)*10000/COUNTIFS(C[1],RC[1],C[-2],RC[-2]),0) -> 96 | D432: =INT(MOD(RC[-2],1000)/100) -> 2
A433: 8 | B433: 70208 | C433: =ROUND(VLOOKUP(RC[-2],R6C6:R14C11,RC[1]+2,FALSE)*10000/COUNTIFS(C[1],RC[1],C[-2],RC[-2]),0) -> 96 | D433: =INT(MOD(RC[-2],1000)/100) -> 2
A434: 8 | B434: 70209 | C434: =ROUND(VLOOKUP(RC[-2],R6C6:R14C11,RC[1]+2,FALSE)*10000/COUNTIFS(C[1],RC[1],C[-2],RC[-2]),0) -> 96 | D434: =INT(MOD(RC[-2],1000)/100) -> 2
A435: 8 | B435: 70210 | C435: =ROUND(VLOOKUP(RC[-2],R6C6:R14C11,RC[1]+2,FALSE)*10000/COUNTIFS(C[1],RC[1],C[-2],RC[-2]),0) -> 96 | D435: =INT(MOD(RC[-2],1000)/100) -> 2
A436: 8 | B436: 70211 | C436: =ROUND(VLOOKUP(RC[-2],R6C6:R14C11,RC[1]+2,FALSE)*10000/COUNTIFS(C[1],RC[1],C[-2],RC[-2]),0) -> 96 | D436: =INT(MOD(RC[-2],1000)/100) -> 2
A437: 8 | B437: 70212 | C437: =ROUND(VLOOKUP(RC[-2],R6C6:R14C11,RC[1]+2,FALSE)*10000/COUNTIFS(C[1],RC[1],C[-2],RC[-2]),0) -> 96 | D437: =INT(MOD(RC[-2],1000)/100) -> 2
A438: 8 | B438: 70213 | C438: =ROUND(VLOOKUP(RC[-2],R6C6:R14C11,RC[1]+2,FALSE)*10000/COUNTIFS(C[1],RC[1],C[-2],RC[-2]),0) -> 96 | D438: =INT(MOD(RC[-2],1000)/100) -> 2
A439: 8 | B439: 70214 | C439: =ROUND(VLOOKUP(RC[-2],R6C6:R14C11,RC[1]+2,FALSE)*10000/COUNTIFS(C[1],RC[1],C[-2],RC[-2]),0) -> 96 | D439: =INT(MOD(RC[-2],1000)/100) -> 2
A440: 8 | B440: 70215 | C440: =ROUND(VLOOKUP(RC[-2],R6C6:R14C11,RC[1]+2,FALSE)*10000/COUNTIFS(C[1],RC[1],C[-2],RC[-2]),0) -> 96 | D440: =INT(MOD(RC[-2],1000)/100) -> 2
A441: 8 | B441: 70216 | C441: =ROUND(VLOOKUP(RC[-2],R6C6:R14C11,RC[1]+2,FALSE)*10000/COUNTIFS(C[1],RC[1],C[-2],RC[-2]),0) -> 96 | D441: =INT(MOD(RC[-2],1000)/100) -> 2
A442: 8 | B442: 70217 | C442: =ROUND(VLOOKUP(RC[-2],R6C6:R14C11,RC[1]+2,FALSE)*10000/COUNTIFS(C[1],RC[1],C[-2],RC[-2]),0) -> 96 | D442: =INT(MOD(RC[-2],1000)/100) -> 2
A443: 8 | B443: 70218 | C443: =ROUND(VLOOKUP(RC[-2],R6C6:R14C11,RC[1]+2,FALSE)*10000/COUNTIFS(C[1],RC[1],C[-2],RC[-2]),0) -> 96 | D443: =INT(MOD(RC[-2],1000)/100) -> 2
A444: 8 | B444: 70219 | C444: =ROUND(VLOOKUP(RC[-2],R6C6:R14C11,RC[1]+2,FALSE)*10000/COUNTIFS(C[1],RC[1],C[-2],RC[-2]),0) -> 96 | D444: =INT(MOD(RC[-2],1000)/100) -> 2
A445: 8 | B445: 70220 | C445: =ROUND(VLOOKUP(RC[-2],R6C6:R14C11,RC[1]+2,FALSE)*10000/COUNTIFS(C[1],RC[1],C[-2],RC[-2]),0) -> 96 | D445: =INT(MOD(RC[-2],1000)/100) -> 2
A446: 8 | B446: 70221 | C446: =ROUND(VLOOKUP(RC[-2],R6C6:R14C11,RC[1]+2,FALSE)*10000/COUNTIFS(C[1],RC[1],C[-2],RC[-2]),0) -> 96 | D446: =INT(MOD(RC[-2],1000)/100) -> 2
A447: 8 | B447: 70222 | C447: =ROUND(VLOOKUP(RC[-2],R6C6:R14C11,RC[1]+2,FALSE)*10000/COUNTIFS(C[1],RC[1],C[-2],RC[-2]),0) -> 96 | D447: =INT(MOD(RC[-2],1000)/100) -> 2
A448: 8 | B448: 70223 | C448: =ROUND(VLOOKUP(RC[-2],R6C6:R14C11,RC[1]+2,FALSE)*10000/COUNTIFS(C[1],RC[1],C[-2],RC[-2]),0) -> 96 | D448: =INT(MOD(RC[-2],1000)/100) -> 2
A449: 8 | B449: 70224 | C449: =ROUND(VLOOKUP(RC[-2],R6C6:R14C11,RC[1]+2,FALSE)*10000/COUNTIFS(C[1],RC[1],C[-2],RC[-2]),0) -> 96 | D449: =INT(MOD(RC[-2],1000)/100) -> 2
A450: 8 | B450: 70225 | C450: =ROUND(VLOOKUP(RC[-2],R6C6:R14C11,RC[1]+2,FALSE)*10000/COUNTIFS(C[1],RC[1],C[-2],RC[-2]),0) -> 96 | D450: =INT(MOD(RC[-2],1000)/100) -> 2
A451: 8 | B451: 70300 | C451: =ROUND(VLOOKUP(RC[-2],R6C6:R14C11,RC[1]+2,FALSE)*10000/COUNTIFS(C[1],RC[1],C[-2],RC[-2]),0) -> 19 | D451: =INT(MOD(RC[-2],1000)/100) -> 3
A452: 8 | B452: 70301 | C452: =ROUND(VLOOKUP(RC[-2],R6C6:R14C11,RC[1]+2,FALSE)*10000/COUNTIFS(C[1],RC[1],C[-2],RC[-2]),0) -> 19 | D452: =INT(MOD(RC[-2],1000)/100) -> 3
A453: 8 | B453: 70302 | C453: =ROUND(VLOOKUP(RC[-2],R6C6:R14C11,RC[1]+2,FALSE)*10000/COUNTIFS(C[1],RC[1],C[-2],RC[-2]),0) -> 19 | D453: =INT(MOD(RC[-2],1000)/100) -> 3
A454: 8 | B454: 70303 | C454: =ROUND(VLOOKUP(RC[-2],R6C6:R14C11,RC[1]+2,FALSE)*10000/COUNTIFS(C[1],RC[1],C[-2],RC[-2]),0) -> 19 | D454: =INT(MOD(RC[-2],1000)/100) -> 3
A455: 8 | B455: 70304 | C455: =ROUND(VLOOKUP(RC[-2],R6C6:R14C11,RC[1]+2,FALSE)*10000/COUNTIFS(C[1],RC[1],C[-2],RC[-2]),0) -> 19 | D455: =INT(MOD(RC[-2],1000)/100) -> 3
A456: 8 | B456: 70305 | C456: =ROUND(VLOOKUP(RC[-2],R6C6:R14C11,RC[1]+2,FALSE)*10000/COUNTIFS(C[1],RC[1],C[-2],RC[-2]),0) -> 19 | D456: =INT(MOD(RC[-2],1000)/100) -> 3
A457: 8 | B457: 70306 | C457: =ROUND(VLOOKUP(RC[-2],R6C6:R14C11,RC[1]+2,FALSE)*10000/COUNTIFS(C[1],RC[1],C[-2],RC[-2]),0) -> 19 | D457: =INT(MOD(RC[-2],1000)/100) -> 3
A458: 8 | B458: 70307 | C458: =ROUND(VLOOKUP(RC[-2],R6C6:R14C11,RC[1]+2,FALSE)*10000/COUNTIFS(C[1],RC[1],C[-2],RC[-2]),0) -> 19 | D458: =INT(MOD(RC[-2],1000)/100) -> 3
A459: 8 | B459: 70308 | C459: =ROUND(VLOOKUP(RC[-2],R6C6:R14C11,RC[1]+2,FALSE)*10000/COUNTIFS(C[1],RC[1],C[-2],RC[-2]),0) -> 19 | D459: =INT(MOD(RC[-2],1000)/100) -> 3
A460: 8 | B460: 70309 | C460: =ROUND(VLOOKUP(RC[-2],R6C6:R14C11,RC[1]+2,FALSE)*10000/COUNTIFS(C[1],RC[1],C[-2],RC[-2]),0) -> 19 | D460: =INT(MOD(RC[-2],1000)/100) -> 3
A461: 8 | B461: 70310 | C461: =ROUND(VLOOKUP(RC[-2],R6C6:R14C11,RC[1]+2,FALSE)*10000/COUNTIFS(C[1],RC[1],C[-2],RC[-2]),0) -> 19 | D461: =INT(MOD(RC[-2],1000)/100) -> 3
A462: 8 | B462: 70311 | C462: =ROUND(VLOOKUP(RC[-2],R6C6:R14C11,RC[1]+2,FALSE)*10000/COUNTIFS(C[1],RC[1],C[-2],RC[-2]),0) -> 19 | D462: =INT(MOD(RC[-2],1000)/100) -> 3
A463: 8 | B463: 70312 | C463: =ROUND(VLOOKUP(RC[-2],R6C6:R14C11,RC[1]+2,FALSE)*10000/COUNTIFS(C[1],RC[1],C[-2],RC[-2]),0) -> 19 | D463: =INT(MOD(RC[-2],1000)/100) -> 3
A464: 8 | B464: 70313 | C464: =ROUND(VLOOKUP(RC[-2],R6C6:R14C11,RC[1]+2,FALSE)*10000/COUNTIFS(C[1],RC[1],C[-2],RC[-2]),0) -> 19 | D464: =INT(MOD(RC[-2],1000)/100) -> 3
A465: 8 | B465: 70314 | C465: =ROUND(VLOOKUP(RC[-2],R6C6:R14C11,RC[1]+2,FALSE)*10000/COUNTIFS(C[1],RC[1],C[-2],RC[-2]),0) -> 19 | D465: =INT(MOD(RC[-2],1000)/100) -> 3
A466: 8 | B466: 70315 | C466: =ROUND(VLOOKUP(RC[-2],R6C6:R14C11,RC[1]+2,FALSE)*10000/COUNTIFS(C[1],RC[1],C[-2],RC[-2]),0) -> 19 | D466: =INT(MOD(RC[-2],1000)/100) -> 3
A467: 8 | B467: 70316 | C467: =ROUND(VLOOKUP(RC[-2],R6C6:R14C11,RC[1]+2,FALSE)*10000/COUNTIFS(C[1],RC[1],C[-2],RC[-2]),0) -> 19 | D467: =INT(MOD(RC[-2],1000)/100) -> 3
A468: 8 | B468: 70317 | C468: =ROUND(VLOOKUP(RC[-2],R6C6:R14C11,RC[1]+2,FALSE)*10000/COUNTIFS(C[1],RC[1],C[-2],RC[-2]),0) -> 19 | D468: =INT(MOD(RC[-2],1000)/100) -> 3
A469: 8 | B469: 70318 | C469: =ROUND(VLOOKUP(RC[-2],R6C6:R14C11,RC[1]+2,FALSE)*10000/COUNTIFS(C[1],RC[1],C[-2],RC[-2]),0) -> 19 | D469: =INT(MOD(RC[-2],1000)/100) -> 3
A470: 8 | B470: 70319 | C470: =ROUND(VLOOKUP(RC[-2],R6C6:R14C11,RC[1]+2,FALSE)*10000/COUNTIFS(C[1],RC[1],C[-2],RC[-2]),0) -> 19 | D470: =INT(MOD(RC[-2],1000)/100) -> 3
A471: 8 | B471: 70320 | C471: =ROUND(VLOOKUP(RC[-2],R6C6:R14C11,RC[1]+2,FALSE)*10000/COUNTIFS(C[1],RC[1],C[-2],RC[-2]),0) -> 19 | D471: =INT(MOD(RC[-2],1000)/100) -> 3
A472: 8 | B472: 70321 | C472: =ROUND(VLOOKUP(RC[-2],R6C6:R14C11,RC[1]+2,FALSE)*10000/COUNTIFS(C[1],RC[1],C[-2],RC[-2]),0) -> 19 | D472: =INT(MOD(RC[-2],1000)/100) -> 3
A473: 8 | B473: 70322 | C473: =ROUND(VLOOKUP(RC[-2],R6C6:R14C11,RC[1]+2,FALSE)*10000/COUNTIFS(C[1],RC[1],C[-2],RC[-2]),0) -> 19 | D473: =INT(MOD(RC[-2],1000)/100) -> 3
A474: 8 | B474: 70323 | C474: =ROUND(VLOOKUP(RC[-2],R6C6:R14C11,RC[1]+2,FALSE)*10000/COUNTIFS(C[1],RC[1],C[-2],RC[-2]),0) -> 19 | D474: =INT(MOD(RC[-2],1000)/100) -> 3
A475: 8 | B475: 70324 | C475: =ROUND(VLOOKUP(RC[-2],R6C6:R14C11,RC[1]+2,FALSE)*10000/COUNTIFS(C[1],RC[1],C[-2],RC[-2]),0) -> 19 | D475: =INT(MOD(RC[-2],1000)/100) -> 3
A476: 8 | B476: 70325 | C476: =ROUND(VLOOKUP(RC[-2],R6C6:R14C11,RC[1]+2,FALSE)*10000/COUNTIFS(C[1],RC[1],C[-2],RC[-2]),0) -> 19 | D476: =INT(MOD(RC[-2],1000)/100) -> 3
A477: 8 | B477: 70401 | C477: =ROUND(VLOOKUP(RC[-2],R6C6:R14C11,RC[1]+2,FALSE)*10000/COUNTIFS(C[1],RC[1],C[-2],RC[-2]),0) -> 1 | D477: =INT(MOD(RC[-2],1000)/100) -> 4
A478: 8 | B478: 70402 | C478: =ROUND(VLOOKUP(RC[-2],R6C6:R14C11,RC[1]+2,FALSE)*10000/COUNTIFS(C[1],RC[1],C[-2],RC[-2]),0) -> 1 | D478: =INT(MOD(RC[-2],1000)/100) -> 4
A479: 8 | B479: 70403 | C479: =ROUND(VLOOKUP(RC[-2],R6C6:R14C11,RC[1]+2,FALSE)*10000/COUNTIFS(C[1],RC[1],C[-2],RC[-2]),0) -> 1 | D479: =INT(MOD(RC[-2],1000)/100) -> 4
A480: 8 | B480: 70404 | C480: =ROUND(VLOOKUP(RC[-2],R6C6:R14C11,RC[1]+2,FALSE)*10000/COUNTIFS(C[1],RC[1],C[-2],RC[-2]),0) -> 1 | D480: =INT(MOD(RC[-2],1000)/100) -> 4
A481: 8 | B481: 70405 | C481: =ROUND(VLOOKUP(RC[-2],R6C6:R14C11,RC[1]+2,FALSE)*10000/COUNTIFS(C[1],RC[1],C[-2],RC[-2]),0) -> 1 | D481: =INT(MOD(RC[-2],1000)/100) -> 4
A482: 8 | B482: 70408 | C482: =ROUND(VLOOKUP(RC[-2],R6C6:R14C11,RC[1]+2,FALSE)*10000/COUNTIFS(C[1],RC[1],C[-2],RC[-2]),0) -> 1 | D482: =INT(MOD(RC[-2],1000)/100) -> 4
A483: 8 | B483: 70409 | C483: =ROUND(VLOOKUP(RC[-2],R6C6:R14C11,RC[1]+2,FALSE)*10000/COUNTIFS(C[1],RC[1],C[-2],RC[-2]),0) -> 1 | D483: =INT(MOD(RC[-2],1000)/100) -> 4
A484: 8 | B484: 70411 | C484: =ROUND(VLOOKUP(RC[-2],R6C6:R14C11,RC[1]+2,FALSE)*10000/COUNTIFS(C[1],RC[1],C[-2],RC[-2]),0) -> 1 | D484: =INT(MOD(RC[-2],1000)/100) -> 4
A485: 8 | B485: 70413 | C485: =ROUND(VLOOKUP(RC[-2],R6C6:R14C11,RC[1]+2,FALSE)*10000/COUNTIFS(C[1],RC[1],C[-2],RC[-2]),0) -> 1 | D485: =INT(MOD(RC[-2],1000)/100) -> 4
A486: 8 | B486: 70416 | C486: =ROUND(VLOOKUP(RC[-2],R6C6:R14C11,RC[1]+2,FALSE)*10000/COUNTIFS(C[1],RC[1],C[-2],RC[-2]),0) -> 1 | D486: =INT(MOD(RC[-2],1000)/100) -> 4
A487: 8 | B487: 70417 | C487: =ROUND(VLOOKUP(RC[-2],R6C6:R14C11,RC[1]+2,FALSE)*10000/COUNTIFS(C[1],RC[1],C[-2],RC[-2]),0) -> 1 | D487: =INT(MOD(RC[-2],1000)/100) -> 4
A488: 8 | B488: 70418 | C488: =ROUND(VLOOKUP(RC[-2],R6C6:R14C11,RC[1]+2,FALSE)*10000/COUNTIFS(C[1],RC[1],C[-2],RC[-2]),0) -> 1 | D488: =INT(MOD(RC[-2],1000)/100) -> 4
A489: 8 | B489: 70420 | C489: =ROUND(VLOOKUP(RC[-2],R6C6:R14C11,RC[1]+2,FALSE)*10000/COUNTIFS(C[1],RC[1],C[-2],RC[-2]),0) -> 1 | D489: =INT(MOD(RC[-2],1000)/100) -> 4
A490: 8 | B490: 70422 | C490: =ROUND(VLOOKUP(RC[-2],R6C6:R14C11,RC[1]+2,FALSE)*10000/COUNTIFS(C[1],RC[1],C[-2],RC[-2]),0) -> 1 | D490: =INT(MOD(RC[-2],1000)/100) -> 4
A491: 8 | B491: 70423 | C491: =ROUND(VLOOKUP(RC[-2],R6C6:R14C11,RC[1]+2,FALSE)*10000/COUNTIFS(C[1],RC[1],C[-2],RC[-2]),0) -> 1 | D491: =INT(MOD(RC[-2],1000)/100) -> 4
A492: 8 | B492: 70424 | C492: =ROUND(VLOOKUP(RC[-2],R6C6:R14C11,RC[1]+2,FALSE)*10000/COUNTIFS(C[1],RC[1],C[-2],RC[-2]),0) -> 1 | D492: =INT(MOD(RC[-2],1000)/100) -> 4
A493: 8 | B493: 70425 | C493: =ROUND(VLOOKUP(RC[-2],R6C6:R14C11,RC[1]+2,FALSE)*10000/COUNTIFS(C[1],RC[1],C[-2],RC[-2]),0) -> 1 | D493: =INT(MOD(RC[-2],1000)/100) -> 4

Sheet: 5.高级卡组
A1: card_id|card_id | B1: |normal_weight | C1: |must_weight | D1: quality|
A2: 不可空 | B2: 不可空 | C2: 不可空 | D2: 不可空
A3: 数字 | B3: 数字 | C3: 数字 | D3: 数字
A6: 卡牌Id | B6: 正常权值 | C6: 保底权值 | D6: 品质
A7: 70100 | B7: =ROUND(VLOOKUP('4.低级卡组'!R15C6,'4.低级卡组'!R6C6:R15C11,RC[2]+2,FALSE)*10000/COUNTIF(C[2],RC[2]),0) -> 1080 | C7: 0 | D7: =INT(MOD(RC[-3],1000)/100) -> 1
A8: 70122 | B8: =ROUND(VLOOKUP('4.低级卡组'!R15C6,'4.低级卡组'!R6C6:R15C11,RC[2]+2,FALSE)*10000/COUNTIF(C[2],RC[2]),0) -> 1080 | C8: 0 | D8: =INT(MOD(RC[-3],1000)/100) -> 1
A9: 70123 | B9: =ROUND(VLOOKUP('4.低级卡组'!R15C6,'4.低级卡组'!R6C6:R15C11,RC[2]+2,FALSE)*10000/COUNTIF(C[2],RC[2]),0) -> 1080 | C9: 0 | D9: =INT(MOD(RC[-3],1000)/100) -> 1
A10: 70124 | B10: =ROUND(VLOOKUP('4.低级卡组'!R15C6,'4.低级卡组'!R6C6:R15C11,RC[2]+2,FALSE)*10000/COUNTIF(C[2],RC[2]),0) -> 1080 | C10: 0 | D10: =INT(MOD(RC[-3],1000)/100) -> 1
A11: 70125 | B11: =ROUND(VLOOKUP('4.低级卡组'!R15C6,'4.低级卡组'!R6C6:R15C11,RC[2]+2,FALSE)*10000/COUNTIF(C[2],RC[2]),0) -> 1080 | C11: 0 | D11: =INT(MOD(RC[-3],1000)/100) -> 1
A12: 70200 | B12: =ROUND(VLOOKUP('4.低级卡组'!R15C6,'4.低级卡组'!R6C6:R15C11,RC[2]+2,FALSE)*10000/COUNTIF(C[2],RC[2]),0) -> 154 | C12: 0 | D12: =INT(MOD(RC[-3],1000)/100) -> 2
A13: 70201 | B13: =ROUND(VLOOKUP('4.低级卡组'!R15C6,'4.低级卡组'!R6C6:R15C11,RC[2]+2,FALSE)*10000/COUNTIF(C[2],RC[2]),0) -> 154 | C13: 0 | D13: =INT(MOD(RC[-3],1000)/100) -> 2
A14: 70202 | B14: =ROUND(VLOOKUP('4.低级卡组'!R15C6,'4.低级卡组'!R6C6:R15C11,RC[2]+2,FALSE)*10000/COUNTIF(C[2],RC[2]),0) -> 154 | C14: 0 | D14: =INT(MOD(RC[-3],1000)/100) -> 2
A15: 70203 | B15: =ROUND(VLOOKUP('4.低级卡组'!R15C6,'4.低级卡组'!R6C6:R15C11,RC[2]+2,FALSE)*10000/COUNTIF(C[2],RC[2]),0) -> 154 | C15: 0 | D15: =INT(MOD(RC[-3],1000)/100) -> 2
A16: 70204 | B16: =ROUND(VLOOKUP('4.低级卡组'!R15C6,'4.低级卡组'!R6C6:R15C11,RC[2]+2,FALSE)*10000/COUNTIF(C[2],RC[2]),0) -> 154 | C16: 0 | D16: =INT(MOD(RC[-3],1000)/100) -> 2
A17: 70205 | B17: =ROUND(VLOOKUP('4.低级卡组'!R15C6,'4.低级卡组'!R6C6:R15C11,RC[2]+2,FALSE)*10000/COUNTIF(C[2],RC[2]),0) -> 154 | C17: 0 | D17: =INT(MOD(RC[-3],1000)/100) -> 2
A18: 70206 | B18: =ROUND(VLOOKUP('4.低级卡组'!R15C6,'4.低级卡组'!R6C6:R15C11,RC[2]+2,FALSE)*10000/COUNTIF(C[2],RC[2]),0) -> 154 | C18: 0 | D18: =INT(MOD(RC[-3],1000)/100) -> 2
A19: 70207 | B19: =ROUND(VLOOKUP('4.低级卡组'!R15C6,'4.低级卡组'!R6C6:R15C11,RC[2]+2,FALSE)*10000/COUNTIF(C[2],RC[2]),0) -> 154 | C19: 0 | D19: =INT(MOD(RC[-3],1000)/100) -> 2
A20: 70208 | B20: =ROUND(VLOOKUP('4.低级卡组'!R15C6,'4.低级卡组'!R6C6:R15C11,RC[2]+2,FALSE)*10000/COUNTIF(C[2],RC[2]),0) -> 154 | C20: 0 | D20: =INT(MOD(RC[-3],1000)/100) -> 2
A21: 70209 | B21: =ROUND(VLOOKUP('4.低级卡组'!R15C6,'4.低级卡组'!R6C6:R15C11,RC[2]+2,FALSE)*10000/COUNTIF(C[2],RC[2]),0) -> 154 | C21: 0 | D21: =INT(MOD(RC[-3],1000)/100) -> 2
A22: 70210 | B22: =ROUND(VLOOKUP('4.低级卡组'!R15C6,'4.低级卡组'!R6C6:R15C11,RC[2]+2,FALSE)*10000/COUNTIF(C[2],RC[2]),0) -> 154 | C22: 0 | D22: =INT(MOD(RC[-3],1000)/100) -> 2
A23: 70211 | B23: =ROUND(VLOOKUP('4.低级卡组'!R15C6,'4.低级卡组'!R6C6:R15C11,RC[2]+2,FALSE)*10000/COUNTIF(C[2],RC[2]),0) -> 154 | C23: 0 | D23: =INT(MOD(RC[-3],1000)/100) -> 2
A24: 70212 | B24: =ROUND(VLOOKUP('4.低级卡组'!R15C6,'4.低级卡组'!R6C6:R15C11,RC[2]+2,FALSE)*10000/COUNTIF(C[2],RC[2]),0) -> 154 | C24: 0 | D24: =INT(MOD(RC[-3],1000)/100) -> 2
A25: 70213 | B25: =ROUND(VLOOKUP('4.低级卡组'!R15C6,'4.低级卡组'!R6C6:R15C11,RC[2]+2,FALSE)*10000/COUNTIF(C[2],RC[2]),0) -> 154 | C25: 0 | D25: =INT(MOD(RC[-3],1000)/100) -> 2
A26: 70214 | B26: =ROUND(VLOOKUP('4.低级卡组'!R15C6,'4.低级卡组'!R6C6:R15C11,RC[2]+2,FALSE)*10000/COUNTIF(C[2],RC[2]),0) -> 154 | C26: 0 | D26: =INT(MOD(RC[-3],1000)/100) -> 2
A27: 70215 | B27: =ROUND(VLOOKUP('4.低级卡组'!R15C6,'4.低级卡组'!R6C6:R15C11,RC[2]+2,FALSE)*10000/COUNTIF(C[2],RC[2]),0) -> 154 | C27: 0 | D27: =INT(MOD(RC[-3],1000)/100) -> 2
A28: 70216 | B28: =ROUND(VLOOKUP('4.低级卡组'!R15C6,'4.低级卡组'!R6C6:R15C11,RC[2]+2,FALSE)*10000/COUNTIF(C[2],RC[2]),0) -> 154 | C28: 0 | D28: =INT(MOD(RC[-3],1000)/100) -> 2
A29: 70217 | B29: =ROUND(VLOOKUP('4.低级卡组'!R15C6,'4.低级卡组'!R6C6:R15C11,RC[2]+2,FALSE)*10000/COUNTIF(C[2],RC[2]),0) -> 154 | C29: 0 | D29: =INT(MOD(RC[-3],1000)/100) -> 2
A30: 70218 | B30: =ROUND(VLOOKUP('4.低级卡组'!R15C6,'4.低级卡组'!R6C6:R15C11,RC[2]+2,FALSE)*10000/COUNTIF(C[2],RC[2]),0) -> 154 | C30: 0 | D30: =INT(MOD(RC[-3],1000)/100) -> 2
A31: 70219 | B31: =ROUND(VLOOKUP('4.低级卡组'!R15C6,'4.低级卡组'!R6C6:R15C11,RC[2]+2,FALSE)*10000/COUNTIF(C[2],RC[2]),0) -> 154 | C31: 0 | D31: =INT(MOD(RC[-3],1000)/100) -> 2
A32: 70220 | B32: =ROUND(VLOOKUP('4.低级卡组'!R15C6,'4.低级卡组'!R6C6:R15C11,RC[2]+2,FALSE)*10000/COUNTIF(C[2],RC[2]),0) -> 154 | C32: 0 | D32: =INT(MOD(RC[-3],1000)/100) -> 2
A33: 70221 | B33: =ROUND(VLOOKUP('4.低级卡组'!R15C6,'4.低级卡组'!R6C6:R15C11,RC[2]+2,FALSE)*10000/COUNTIF(C[2],RC[2]),0) -> 154 | C33: 0 | D33: =INT(MOD(RC[-3],1000)/100) -> 2
A34: 70222 | B34: =ROUND(VLOOKUP('4.低级卡组'!R15C6,'4.低级卡组'!R6C6:R15C11,RC[2]+2,FALSE)*10000/COUNTIF(C[2],RC[2]),0) -> 154 | C34: 0 | D34: =INT(MOD(RC[-3],1000)/100) -> 2
A35: 70223 | B35: =ROUND(VLOOKUP('4.低级卡组'!R15C6,'4.低级卡组'!R6C6:R15C11,RC[2]+2,FALSE)*10000/COUNTIF(C[2],RC[2]),0) -> 154 | C35: 0 | D35: =INT(MOD(RC[-3],1000)/100) -> 2
A36: 70224 | B36: =ROUND(VLOOKUP('4.低级卡组'!R15C6,'4.低级卡组'!R6C6:R15C11,RC[2]+2,FALSE)*10000/COUNTIF(C[2],RC[2]),0) -> 154 | C36: 0 | D36: =INT(MOD(RC[-3],1000)/100) -> 2
A37: 70225 | B37: =ROUND(VLOOKUP('4.低级卡组'!R15C6,'4.低级卡组'!R6C6:R15C11,RC[2]+2,FALSE)*10000/COUNTIF(C[2],RC[2]),0) -> 154 | C37: 0 | D37: =INT(MOD(RC[-3],1000)/100) -> 2
A38: 70300 | B38: =ROUND(VLOOKUP('4.低级卡组'!R15C6,'4.低级卡组'!R6C6:R15C11,RC[2]+2,FALSE)*10000/COUNTIF(C[2],RC[2]),0) -> 19 | C38: 0 | D38: =INT(MOD(RC[-3],1000)/100) -> 3
A39: 70301 | B39: =ROUND(VLOOKUP('4.低级卡组'!R15C6,'4.低级卡组'!R6C6:R15C11,RC[2]+2,FALSE)*10000/COUNTIF(C[2],RC[2]),0) -> 19 | C39: =ROUND((SUM(R7C2:R75C2)/SUM(R64C2:R75C2)*SUM(R64C3:R75C3)-SUM(R64C3:R75C3))/COUNTA(R39C1:R63C1),0) -> 99 | D39: =INT(MOD(RC[-3],1000)/100) -> 3
A40: 70302 | B40: =ROUND(VLOOKUP('4.低级卡组'!R15C6,'4.低级卡组'!R6C6:R15C11,RC[2]+2,FALSE)*10000/COUNTIF(C[2],RC[2]),0) -> 19 | C40: =ROUND((SUM(R7C2:R75C2)/SUM(R64C2:R75C2)*SUM(R64C3:R75C3)-SUM(R64C3:R75C3))/COUNTA(R39C1:R63C1),0) -> 99 | D40: =INT(MOD(RC[-3],1000)/100) -> 3
A41: 70303 | B41: =ROUND(VLOOKUP('4.低级卡组'!R15C6,'4.低级卡组'!R6C6:R15C11,RC[2]+2,FALSE)*10000/COUNTIF(C[2],RC[2]),0) -> 19 | C41: =ROUND((SUM(R7C2:R75C2)/SUM(R64C2:R75C2)*SUM(R64C3:R75C3)-SUM(R64C3:R75C3))/COUNTA(R39C1:R63C1),0) -> 99 | D41: =INT(MOD(RC[-3],1000)/100) -> 3
A42: 70304 | B42: =ROUND(VLOOKUP('4.低级卡组'!R15C6,'4.低级卡组'!R6C6:R15C11,RC[2]+2,FALSE)*10000/COUNTIF(C[2],RC[2]),0) -> 19 | C42: =ROUND((SUM(R7C2:R75C2)/SUM(R64C2:R75C2)*SUM(R64C3:R75C3)-SUM(R64C3:R75C3))/COUNTA(R39C1:R63C1),0) -> 99 | D42: =INT(MOD(RC[-3],1000)/100) -> 3
A43: 70305 | B43: =ROUND(VLOOKUP('4.低级卡组'!R15C6,'4.低级卡组'!R6C6:R15C11,RC[2]+2,FALSE)*10000/COUNTIF(C[2],RC[2]),0) -> 19 | C43: =ROUND((SUM(R7C2:R75C2)/SUM(R64C2:R75C2)*SUM(R64C3:R75C3)-SUM(R64C3:R75C3))/COUNTA(R39C1:R63C1),0) -> 99 | D43: =INT(MOD(RC[-3],1000)/100) -> 3
A44: 70306 | B44: =ROUND(VLOOKUP('4.低级卡组'!R15C6,'4.低级卡组'!R6C6:R15C11,RC[2]+2,FALSE)*10000/COUNTIF(C[2],RC[2]),0) -> 19 | C44: =ROUND((SUM(R7C2:R75C2)/SUM(R64C2:R75C2)*SUM(R64C3:R75C3)-SUM(R64C3:R75C3))/COUNTA(R39C1:R63C1),0) -> 99 | D44: =INT(MOD(RC[-3],1000)/100) -> 3
A45: 70307 | B45: =ROUND(VLOOKUP('4.低级卡组'!R15C6,'4.低级卡组'!R6C6:R15C11,RC[2]+2,FALSE)*10000/COUNTIF(C[2],RC[2]),0) -> 19 | C45: =ROUND((SUM(R7C2:R75C2)/SUM(R64C2:R75C2)*SUM(R64C3:R75C3)-SUM(R64C3:R75C3))/COUNTA(R39C1:R63C1),0) -> 99 | D45: =INT(MOD(RC[-3],1000)/100) -> 3
A46: 70308 | B46: =ROUND(VLOOKUP('4.低级卡组'!R15C6,'4.低级卡组'!R6C6:R15C11,RC[2]+2,FALSE)*10000/COUNTIF(C[2],RC[2]),0) -> 19 | C46: =ROUND((SUM(R7C2:R75C2)/SUM(R64C2:R75C2)*SUM(R64C3:R75C3)-SUM(R64C3:R75C3))/COUNTA(R39C1:R63C1),0) -> 99 | D46: =INT(MOD(RC[-3],1000)/100) -> 3
A47: 70309 | B47: =ROUND(VLOOKUP('4.低级卡组'!R15C6,'4.低级卡组'!R6C6:R15C11,RC[2]+2,FALSE)*10000/COUNTIF(C[2],RC[2]),0) -> 19 | C47: =ROUND((SUM(R7C2:R75C2)/SUM(R64C2:R75C2)*SUM(R64C3:R75C3)-SUM(R64C3:R75C3))/COUNTA(R39C1:R63C1),0) -> 99 | D47: =INT(MOD(RC[-3],1000)/100) -> 3
A48: 70310 | B48: =ROUND(VLOOKUP('4.低级卡组'!R15C6,'4.低级卡组'!R6C6:R15C11,RC[2]+2,FALSE)*10000/COUNTIF(C[2],RC[2]),0) -> 19 | C48: =ROUND((SUM(R7C2:R75C2)/SUM(R64C2:R75C2)*SUM(R64C3:R75C3)-SUM(R64C3:R75C3))/COUNTA(R39C1:R63C1),0) -> 99 | D48: =INT(MOD(RC[-3],1000)/100) -> 3
A49: 70311 | B49: =ROUND(VLOOKUP('4.低级卡组'!R15C6,'4.低级卡组'!R6C6:R15C11,RC[2]+2,FALSE)*10000/COUNTIF(C[2],RC[2]),0) -> 19 | C49: =ROUND((SUM(R7C2:R75C2)/SUM(R64C2:R75C2)*SUM(R64C3:R75C3)-SUM(R64C3:R75C3))/COUNTA(R39C1:R63C1),0) -> 99 | D49: =INT(MOD(RC[-3],1000)/100) -> 3
A50: 70312 | B50: =ROUND(VLOOKUP('4.低级卡组'!R15C6,'4.低级卡组'!R6C6:R15C11,RC[2]+2,FALSE)*10000/COUNTIF(C[2],RC[2]),0) -> 19 | C50: =ROUND((SUM(R7C2:R75C2)/SUM(R64C2:R75C2)*SUM(R64C3:R75C3)-SUM(R64C3:R75C3))/COUNTA(R39C1:R63C1),0) -> 99 | D50: =INT(MOD(RC[-3],1000)/100) -> 3
A51: 70313 | B51: =ROUND(VLOOKUP('4.低级卡组'!R15C6,'4.低级卡组'!R6C6:R15C11,RC[2]+2,FALSE)*10000/COUNTIF(C[2],RC[2]),0) -> 19 | C51: =ROUND((SUM(R7C2:R75C2)/SUM(R64C2:R75C2)*SUM(R64C3:R75C3)-SUM(R64C3:R75C3))/COUNTA(R39C1:R63C1),0) -> 99 | D51: =INT(MOD(RC[-3],1000)/100) -> 3
A52: 70314 | B52: =ROUND(VLOOKUP('4.低级卡组'!R15C6,'4.低级卡组'!R6C6:R15C11,RC[2]+2,FALSE)*10000/COUNTIF(C[2],RC[2]),0) -> 19 | C52: =ROUND((SUM(R7C2:R75C2)/SUM(R64C2:R75C2)*SUM(R64C3:R75C3)-SUM(R64C3:R75C3))/COUNTA(R39C1:R63C1),0) -> 99 | D52: =INT(MOD(RC[-3],1000)/100) -> 3
A53: 70315 | B53: =ROUND(VLOOKUP('4.低级卡组'!R15C6,'4.低级卡组'!R6C6:R15C11,RC[2]+2,FALSE)*10000/COUNTIF(C[2],RC[2]),0) -> 19 | C53: =ROUND((SUM(R7C2:R75C2)/SUM(R64C2:R75C2)*SUM(R64C3:R75C3)-SUM(R64C3:R75C3))/COUNTA(R39C1:R63C1),0) -> 99 | D53: =INT(MOD(RC[-3],1000)/100) -> 3
A54: 70316 | B54: =ROUND(VLOOKUP('4.低级卡组'!R15C6,'4.低级卡组'!R6C6:R15C11,RC[2]+2,FALSE)*10000/COUNTIF(C[2],RC[2]),0) -> 19 | C54: =ROUND((SUM(R7C2:R75C2)/SUM(R64C2:R75C2)*SUM(R64C3:R75C3)-SUM(R64C3:R75C3))/COUNTA(R39C1:R63C1),0) -> 99 | D54: =INT(MOD(RC[-3],1000)/100) -> 3
A55: 70317 | B55: =ROUND(VLOOKUP('4.低级卡组'!R15C6,'4.低级卡组'!R6C6:R15C11,RC[2]+2,FALSE)*10000/COUNTIF(C[2],RC[2]),0) -> 19 | C55: =ROUND((SUM(R7C2:R75C2)/SUM(R64C2:R75C2)*SUM(R64C3:R75C3)-SUM(R64C3:R75C3))/COUNTA(R39C1:R63C1),0) -> 99 | D55: =INT(MOD(RC[-3],1000)/100) -> 3
A56: 70318 | B56: =ROUND(VLOOKUP('4.低级卡组'!R15C6,'4.低级卡组'!R6C6:R15C11,RC[2]+2,FALSE)*10000/COUNTIF(C[2],RC[2]),0) -> 19 | C56: =ROUND((SUM(R7C2:R75C2)/SUM(R64C2:R75C2)*SUM(R64C3:R75C3)-SUM(R64C3:R75C3))/COUNTA(R39C1:R63C1),0) -> 99 | D56: =INT(MOD(RC[-3],1000)/100) -> 3
A57: 70319 | B57: =ROUND(VLOOKUP('4.低级卡组'!R15C6,'4.低级卡组'!R6C6:R15C11,RC[2]+2,FALSE)*10000/COUNTIF(C[2],RC[2]),0) -> 19 | C57: =ROUND((SUM(R7C2:R75C2)/SUM(R64C2:R75C2)*SUM(R64C3:R75C3)-SUM(R64C3:R75C3))/COUNTA(R39C1:R63C1),0) -> 99 | D57: =INT(MOD(RC[-3],1000)/100) -> 3
A58: 70320 | B58: =ROUND(VLOOKUP('4.低级卡组'!R15C6,'4.低级卡组'!R6C6:R15C11,RC[2]+2,FALSE)*10000/COUNTIF(C[2],RC[2]),0) -> 19 | C58: =ROUND((SUM(R7C2:R75C2)/SUM(R64C2:R75C2)*SUM(R64C3:R75C3)-SUM(R64C3:R75C3))/COUNTA(R39C1:R63C1),0) -> 99 | D58: =INT(MOD(RC[-3],1000)/100) -> 3
A59: 70321 | B59: =ROUND(VLOOKUP('4.低级卡组'!R15C6,'4.低级卡组'!R6C6:R15C11,RC[2]+2,FALSE)*10000/COUNTIF(C[2],RC[2]),0) -> 19 | C59: =ROUND((SUM(R7C2:R75C2)/SUM(R64C2:R75C2)*SUM(R64C3:R75C3)-SUM(R64C3:R75C3))/COUNTA(R39C1:R63C1),0) -> 99 | D59: =INT(MOD(RC[-3],1000)/100) -> 3
A60: 70322 | B60: =ROUND(VLOOKUP('4.低级卡组'!R15C6,'4.低级卡组'!R6C6:R15C11,RC[2]+2,FALSE)*10000/COUNTIF(C[2],RC[2]),0) -> 19 | C60: =ROUND((SUM(R7C2:R75C2)/SUM(R64C2:R75C2)*SUM(R64C3:R75C3)-SUM(R64C3:R75C3))/COUNTA(R39C1:R63C1),0) -> 99 | D60: =INT(MOD(RC[-3],1000)/100) -> 3
A61: 70323 | B61: =ROUND(VLOOKUP('4.低级卡组'!R15C6,'4.低级卡组'!R6C6:R15C11,RC[2]+2,FALSE)*10000/COUNTIF(C[2],RC[2]),0) -> 19 | C61: =ROUND((SUM(R7C2:R75C2)/SUM(R64C2:R75C2)*SUM(R64C3:R75C3)-SUM(R64C3:R75C3))/COUNTA(R39C1:R63C1),0) -> 99 | D61: =INT(MOD(RC[-3],1000)/100) -> 3
A62: 70324 | B62: =ROUND(VLOOKUP('4.低级卡组'!R15C6,'4.低级卡组'!R6C6:R15C11,RC[2]+2,FALSE)*10000/COUNTIF(C[2],RC[2]),0) -> 19 | C62: =ROUND((SUM(R7C2:R75C2)/SUM(R64C2:R75C2)*SUM(R64C3:R75C3)-SUM(R64C3:R75C3))/COUNTA(R39C1:R63C1),0) -> 99 | D62: =INT(MOD(RC[-3],1000)/100) -> 3
A63: 70325 | B63: =ROUND(VLOOKUP('4.低级卡组'!R15C6,'4.低级卡组'!R6C6:R15C11,RC[2]+2,FALSE)*10000/COUNTIF(C[2],RC[2]),0) -> 19 | C63: =ROUND((SUM(R7C2:R75C2)/SUM(R64C2:R75C2)*SUM(R64C3:R75C3)-SUM(R64C3:R75C3))/COUNTA(R39C1:R63C1),0) -> 99 | D63: =INT(MOD(RC[-3],1000)/100) -> 3
A64: 70422 | B64: =ROUND(VLOOKUP('4.低级卡组'!R15C6,'4.低级卡组'!R6C6:R15C11,RC[2]+2,FALSE)*10000/COUNTIF(C[2],RC[2])+4,0) -> 12 | C64: 3 | D64: =INT(MOD(RC[-3],1000)/100) -> 4
A65: 70423 | B65: =ROUND(VLOOKUP('4.低级卡组'!R15C6,'4.低级卡组'!R6C6:R15C11,RC[2]+2,FALSE)*10000/COUNTIF(C[2],RC[2])+4,0) -> 12 | C65: 3 | D65: =INT(MOD(RC[-3],1000)/100) -> 4
A66: 70424 | B66: =ROUND(VLOOKUP('4.低级卡组'!R15C6,'4.低级卡组'!R6C6:R15C11,RC[2]+2,FALSE)*10000/COUNTIF(C[2],RC[2])+4,0) -> 12 | C66: 3 | D66: =INT(MOD(RC[-3],1000)/100) -> 4
A67: 70425 | B67: =ROUND(VLOOKUP('4.低级卡组'!R15C6,'4.低级卡组'!R6C6:R15C11,RC[2]+2,FALSE)*10000/COUNTIF(C[2],RC[2])+4,0) -> 12 | C67: 3 | D67: =INT(MOD(RC[-3],1000)/100) -> 4
A68: 70408 | B68: =ROUND(VLOOKUP('4.低级卡组'!R15C6,'4.低级卡组'!R6C6:R15C11,RC[2]+2,FALSE)*10000/COUNTIF(C[2],RC[2]),0) -> 8 | C68: 2 | D68: =INT(MOD(RC[-3],1000)/100) -> 4
A69: 70402 | B69: =ROUND(VLOOKUP('4.低级卡组'!R15C6,'4.低级卡组'!R6C6:R15C11,RC[2]+2,FALSE)*10000/COUNTIF(C[2],RC[2]),0) -> 8 | C69: 2 | D69: =INT(MOD(RC[-3],1000)/100) -> 4
A70: 70403 | B70: =ROUND(VLOOKUP('4.低级卡组'!R15C6,'4.低级卡组'!R6C6:R15C11,RC[2]+2,FALSE)*10000/COUNTIF(C[2],RC[2]),0) -> 8 | C70: 2 | D70: =INT(MOD(RC[-3],1000)/100) -> 4
A71: 70404 | B71: =ROUND(VLOOKUP('4.低级卡组'!R15C6,'4.低级卡组'!R6C6:R15C11,RC[2]+2,FALSE)*10000/COUNTIF(C[2],RC[2]),0) -> 8 | C71: 2 | D71: =INT(MOD(RC[-3],1000)/100) -> 4
A72: 70411 | B72: =ROUND(VLOOKUP('4.低级卡组'!R15C6,'4.低级卡组'!R6C6:R15C11,RC[2]+2,FALSE)*10000/COUNTIF(C[2],RC[2])-4,0) -> 4 | C72: 1 | D72: =INT(MOD(RC[-3],1000)/100) -> 4
A73: 70409 | B73: =ROUND(VLOOKUP('4.低级卡组'!R15C6,'4.低级卡组'!R6C6:R15C11,RC[2]+2,FALSE)*10000/COUNTIF(C[2],RC[2])-4,0) -> 4 | C73: 1 | D73: =INT(MOD(RC[-3],1000)/100) -> 4
A74: 70417 | B74: =ROUND(VLOOKUP('4.低级卡组'!R15C6,'4.低级卡组'!R6C6:R15C11,RC[2]+2,FALSE)*10000/COUNTIF(C[2],RC[2])-4,0) -> 4 | C74: 1 | D74: =INT(MOD(RC[-3],1000)/100) -> 4
A75: 70418 | B75: =ROUND(VLOOKUP('4.低级卡组'!R15C6,'4.低级卡组'!R6C6:R15C11,RC[2]+2,FALSE)*10000/COUNTIF(C[2],RC[2])-4,0) -> 4 | C75: 1 | D75: =INT(MOD(RC[-3],1000)/100) -> 4

Sheet: 6.卡组关卡
A1: map_idx|map_idx | B1: card_group_id|card_group_id | C1: is_the_last|is_the_last | D1: name| | E1: map_id|map_id | F1: describe|
A2: 不可空 | B2: 不可空 | C2: 不可空 | D2: 可空#不需字段 | E2: 可空#不需字段 | F2: 可空#不需字段
A3: 数字 | B3: 数字 | C3: 数字 | D3: 字符串 | E3: 数字 | F3: 字符串
A6: 关卡顺序 | B6: 卡组ID | C6: 是否卡组上限 | D6: 名字 | E6: 关卡ID | F6: 描述
A7: 1 | B7: 1 | C7: 0 | D7: 自然翡翠 | E7: 11 | F7: 最高可抽到 <COLOR VALUE=FF00b4ff>蓝品卡牌</COLOR> → <COLOR VALUE=FFf041dd>紫品卡牌</COLOR>
A8: 2 | B8: 2 | C8: 0 | D8: 冰封万里 | E8: 12 | F8: 抽到 <COLOR VALUE=FFf041dd>紫品卡牌</COLOR> 和 <COLOR VALUE=FF6ef12d>绿品卡牌</COLOR> 的几率提升
A9: 3 | B9: 3 | C9: 0 | D9: 海洋之星 | E9: 13 | F9: 抽到 <COLOR VALUE=FFf041dd>紫品卡牌</COLOR> 和 <COLOR VALUE=FF00b4ff>蓝品卡牌</COLOR> 的几率提升
A10: 4 | B10: 4 | C10: 0 | D10: 紫月之灾 | E10: 14 | F10: 抽到 <COLOR VALUE=FFf041dd>紫品卡牌</COLOR> 和 <COLOR VALUE=FF6ef12d>绿品卡牌</COLOR> 的几率提升
A11: 5 | B11: 5 | C11: 0 | D11: 时空漩涡 | E11: 15 | F11: 抽到 <COLOR VALUE=FFf041dd>紫品卡牌</COLOR> 和 <COLOR VALUE=FF00b4ff>蓝品卡牌</COLOR> 的几率提升
A12: 6 | B12: 6 | C12: 0 | D12: 罪之十字 | E12: 16 | F12: 抽到 <COLOR VALUE=FFf041dd>紫品卡牌</COLOR> 和 <COLOR VALUE=FF6ef12d>绿品卡牌</COLOR> 的几率提升
A13: 7 | B13: 7 | C13: 0 | D13: 灼热大地 | E13: 17 | F13: 最高可抽到 <COLOR VALUE=FFf041dd>紫品卡牌</COLOR> → <COLOR VALUE=FFff993f>橙品卡牌</COLOR><GH>抽到 <COLOR VALUE=FFf041dd>紫品卡牌</COLOR> 的几率提升
A14: 8 | B14: 8 | C14: 1

Sheet: 7.命运商店
A1: id|id | B1: type|type | C1: object_id|object_id | D1: object_num|object_num | E1: cost_type_list|cost_type_list | F1: cost_value_list|cost_value_list
A2: 不可空 | B2: 不可空 | C2: 不可空 | D2: 不可空 | E2: 可空#不需字段 | F2: 可空#不需字段
A3: 数字 | B3: 数字 | C3: 数字 | D3: 数字 | E3: 一维数组 | F3: 一维数组
E4: 不定长 | F4: 不定长
A6: 商品ID | B6: 类型 | C6: 商品对象ID | D6: 商品对象数量 | E6: 消耗类型列表 | F6: 消耗值列表
A7: 1 | B7: 1 | C7: 70300 | D7: 1 | E7: 31 | F7: 80
A8: 2 | B8: 1 | C8: 70200 | D8: 1 | E8: 31 | F8: 40
A9: 3 | B9: 1 | C9: 70100 | D9: 1 | E9: 31 | F9: 20
A10: 4 | B10: 1 | C10: 70201 | D10: 1 | E10: 31 | F10: 60
A11: 5 | B11: 1 | C11: 70202 | D11: 1 | E11: 31 | F11: 60
A12: 6 | B12: 1 | C12: 70203 | D12: 1 | E12: 31 | F12: 60
A13: 7 | B13: 1 | C13: 70204 | D13: 1 | E13: 31 | F13: 60
A14: 8 | B14: 1 | C14: 70205 | D14: 1 | E14: 31 | F14: 60
A15: 9 | B15: 1 | C15: 70206 | D15: 1 | E15: 31 | F15: 60
A16: 10 | B16: 1 | C16: 70207 | D16: 1 | E16: 31 | F16: 60
A17: 11 | B17: 1 | C17: 70208 | D17: 1 | E17: 31 | F17: 60
A18: 12 | B18: 1 | C18: 70209 | D18: 1 | E18: 31 | F18: 60
A19: 13 | B19: 1 | C19: 70210 | D19: 1 | E19: 31 | F19: 60
A20: 14 | B20: 1 | C20: 70211 | D20: 1 | E20: 31 | F20: 60
A21: 15 | B21: 1 | C21: 70212 | D21: 1 | E21: 31 | F21: 60
A22: 16 | B22: 1 | C22: 70213 | D22: 1 | E22: 31 | F22: 60
A23: 17 | B23: 1 | C23: 70214 | D23: 1 | E23: 31 | F23: 60
A24: 18 | B24: 1 | C24: 70215 | D24: 1 | E24: 31 | F24: 60
A25: 19 | B25: 1 | C25: 70216 | D25: 1 | E25: 31 | F25: 60
A26: 20 | B26: 1 | C26: 70217 | D26: 1 | E26: 31 | F26: 60
A27: 21 | B27: 1 | C27: 70218 | D27: 1 | E27: 31 | F27: 60
A28: 22 | B28: 1 | C28: 70219 | D28: 1 | E28: 31 | F28: 60
A29: 23 | B29: 1 | C29: 70220 | D29: 1 | E29: 31 | F29: 60
A30: 24 | B30: 1 | C30: 70221 | D30: 1 | E30: 31 | F30: 60
A31: 25 | B31: 1 | C31: 70222 | D31: 1 | E31: 31 | F31: 40
A32: 26 | B32: 1 | C32: 70223 | D32: 1 | E32: 31 | F32: 40
A33: 27 | B33: 1 | C33: 70224 | D33: 1 | E33: 31 | F33: 40
A34: 28 | B34: 1 | C34: 70225 | D34: 1 | E34: 31 | F34: 40
A35: 101 | B35: 2 | C35: 70301 | D35: 1 | E35: 31 | F35: 900
A36: 102 | B36: 2 | C36: 70302 | D36: 1 | E36: 31 | F36: 900
A37: 103 | B37: 2 | C37: 70303 | D37: 1 | E37: 31 | F37: 900
A38: 104 | B38: 2 | C38: 70304 | D38: 1 | E38: 31 | F38: 900
A39: 105 | B39: 2 | C39: 70305 | D39: 1 | E39: 31 | F39: 900
A40: 106 | B40: 2 | C40: 70306 | D40: 1 | E40: 31 | F40: 900
A41: 107 | B41: 2 | C41: 70307 | D41: 1 | E41: 31 | F41: 900
A42: 108 | B42: 2 | C42: 70308 | D42: 1 | E42: 31 | F42: 900
A43: 109 | B43: 2 | C43: 70309 | D43: 1 | E43: 31 | F43: 900
A44: 110 | B44: 2 | C44: 70310 | D44: 1 | E44: 31 | F44: 900
A45: 111 | B45: 2 | C45: 70311 | D45: 1 | E45: 31 | F45: 900
A46: 112 | B46: 2 | C46: 70312 | D46: 1 | E46: 31 | F46: 900
A47: 113 | B47: 2 | C47: 70313 | D47: 1 | E47: 31 | F47: 900
A48: 114 | B48: 2 | C48: 70314 | D48: 1 | E48: 31 | F48: 900
A49: 115 | B49: 2 | C49: 70315 | D49: 1 | E49: 31 | F49: 900
A50: 116 | B50: 2 | C50: 70316 | D50: 1 | E50: 31 | F50: 900
A51: 117 | B51: 2 | C51: 70317 | D51: 1 | E51: 31 | F51: 900
A52: 118 | B52: 2 | C52: 70318 | D52: 1 | E52: 31 | F52: 900
A53: 119 | B53: 2 | C53: 70319 | D53: 1 | E53: 31 | F53: 900
A54: 120 | B54: 2 | C54: 70320 | D54: 1 | E54: 31 | F54: 900
A55: 121 | B55: 2 | C55: 70321 | D55: 1 | E55: 31 | F55: 900
A56: 122 | B56: 2 | C56: 70322 | D56: 1 | E56: 31 | F56: 600
A57: 123 | B57: 2 | C57: 70323 | D57: 1 | E57: 31 | F57: 600
A58: 124 | B58: 2 | C58: 70324 | D58: 1 | E58: 31 | F58: 600
A59: 125 | B59: 2 | C59: 70325 | D59: 1 | E59: 31 | F59: 600
A60: 201 | B60: 3 | C60: 70422 | D60: 1 | E60: 31 | F60: 4000
A61: 202 | B61: 3 | C61: 70423 | D61: 1 | E61: 31 | F61: 4000
A62: 203 | B62: 3 | C62: 70424 | D62: 1 | E62: 31 | F62: 4000
A63: 204 | B63: 3 | C63: 70425 | D63: 1 | E63: 31 | F63: 4000

Sheet: 8.占卜牌孔位
A1: hole|slot | B1: role_level|role_level
A2: 不可空 | B2: 不可空
A3: 数字 | B3: 数字
A6: 孔 | B6: 需要的角色等级
A7: 1 | B7: 50
A8: 2 | B8: 50
A9: 3 | B9: 55
A10: 4 | B10: 60
A11: 5 | B11: 65
A12: 6 | B12: 70
A13: 7 | B13: 75
A14: 8 | B14: 80

Sheet: 9.收藏室
A1: id|id | C1: collection_value|collection_value | D1: collection_group_list|collection_group_list
A2: 不可空 | C2: 不可空 | D2: 可空#不需字段
A3: 数字 | C3: 数字 | D3: 一维数组
D4: 不定长
A6: 书本ID | B6: 备注 | C6: 需要的收藏值 | D6: 收藏组列表
A7: 1 | B7: 入门收藏全册 | C7: 0 | D7: 1|2|3|4|5|6|7|8|9|10|11|12|13|14|15|16|17|18|19|20|21|22|23|24|25|26|27|28|29|30|31|32|33|34|35|36|37|38|39|40|41|42|43|44|45|46|47|48|49|50|51|52|53|54|55|56|57|58|59|60|61|62|63|64|65|66|67|68|69|70|71|72|73|74|75|76|77|78|79
A8: 2 | B8: 万物进阶全书 | C8: 20 | D8: 136|137|138|139|140|141|142|143|144|145|146|147|148|149|150|151|152|153|154|155|156|157|158|159|160|161|162|163|164|165|166|167|168|169|170|171|172|173|174|175|176|177|178|179|180|181|182|183|184|185
A9: 3 | B9: 沉默铜翼之书 | C9: 20 | D9: 80|81|82|83|84|85|86|87|88|89|90|91|92|93|94|95|96|97|98|99|100|101|102|103|104|105|106|107|108|109|110|111|112|113|114|115|116|117|118|119|120|121|122|123|124|125|126|127|128|129|130|131|132|133|134|135
A10: 4 | B10: 散落银叶之书 | C10: 50 | D10: 186|187|188|189|190|191|192|193|194|195|196|197|198|199|200|201|202|203|204|205|206|207|208|209|210|211|212|213|214|215|216|217|218|219|220|221|222|223|224|225|226|227|228|229|230|231|232|233|234|235|236|237|238|239|240|241|242|243|244|245|246|247|248|249|250|251|252|253|254|255|256|257|258|259|260
A11: 5 | B11: 辉煌金冠之书 | C11: 100 | D11: 261|262|263|264|265|266|267|268|269|270|271|272|273|274|275|276|277|278|279|280|281|282|283|284|285|286|287|288|289|290|291|292|293|294|295|296|297|298|299|300|301|302|303|304|305|306|307|308|309|310|311|312|313|314|315|316|317|318|319|320|321|322|323|324|325|326|327|328|329|330|331|332|333|334|335
A12: 6 | B12: 永恒阳辉典藏 | C12: 999999 | D12: 336|337|338|339|340|341|342|343|344|345|346|347|348|349|350|351|352|353|354|355|356|357|358|359|360|361|362|363|364|365|366|367|368|369|370|371|372|373|374|375|376|377|378|379|380|381|382|383|384|385

Sheet: 10.收藏组
A1: id|id | B1: name| | C1: cost_card_list|cost_card_list | F1: activate_pro_type_list|activate_pro_type_list | G1: activate_pro_value_list|activate_pro_value_list | H1: upgrade_pro_value_list|upgrade_pro_value_list | I1: activate_collection_value|activate_collection_value | J1: upgrade_collection_value|upgrade_collection_value | K1: max_star|max_star
A2: 不可空 | B2: 不可空 | C2: 可空#不需字段 | F2: 可空#不需字段 | G2: 可空#不需字段 | H2: 可空#不需字段 | I2: 不可空 | J2: 不可空 | K2: 不可空
A3: 数字 | B3: 字符串 | C3: 一维数组 | F3: 一维数组 | G3: 一维数组 | H3: 一维数组 | I3: 数字 | J3: 数字 | K3: 数字
C4: 不定长 | F4: 不定长 | G4: 不定长 | H4: 不定长
A6: 收藏组ID | B6: 名字 | C6: 收藏或升星消耗的的卡牌列表 | E6: 备注 | F6: 激活属性类型列表 | G6: 激活属性值列表 | H6: 升级属性值列表 | I6: 激活获得的收藏值 | J6: 升级获得的收藏值 | K6: 能升到的最星
A7: 1 | B7: 魔术 | C7: 70301 | D7: =RC[-3] -> 1 | E7: 紫品单张 | F7: 4|1 | G7: 360|36 | H7: 180|18 | I7: 2 | J7: 1 | K7: 7
A8: 2 | B8: 吟唱 | C8: 70302 | D8: =R[-1]C&"|"&RC[-3] -> 1|2 | F8: 4|2 | G8: 360|36 | H8: 180|18 | I8: 2 | J8: 1 | K8: 7
A9: 3 | B9: 奢侈 | C9: 70303 | D9: =R[-1]C&"|"&RC[-3] -> 1|2|3 | F9: 4|3 | G9: 360|36 | H9: 180|18 | I9: 2 | J9: 1 | K9: 7
A10: 4 | B10: 领袖 | C10: 70304 | D10: =R[-1]C&"|"&RC[-3] -> 1|2|3|4 | F10: 1|2 | G10: 54|18 | H10: 27|9 | I10: 2 | J10: 1 | K10: 7
A11: 5 | B11: 十字 | C11: 70305 | D11: =R[-1]C&"|"&RC[-3] -> 1|2|3|4|5 | F11: 1|3 | G11: 54|18 | H11: 27|9 | I11: 2 | J11: 1 | K11: 7
A12: 6 | B12: 取舍 | C12: 70306 | D12: =R[-1]C&"|"&RC[-3] -> 1|2|3|4|5|6 | F12: 2|3 | G12: 36|36 | H12: 18|18 | I12: 2 | J12: 1 | K12: 7
A13: 7 | B13: 突破 | C13: 70307 | D13: =R[-1]C&"|"&RC[-3] -> 1|2|3|4|5|6|7 | F13: 4|1 | G13: 360|36 | H13: 180|18 | I13: 2 | J13: 1 | K13: 7
A14: 8 | B14: 不屈 | C14: 70308 | D14: =R[-1]C&"|"&RC[-3] -> 1|2|3|4|5|6|7|8 | F14: 4|2 | G14: 360|36 | H14: 180|18 | I14: 2 | J14: 1 | K14: 7
A15: 9 | B15: 引导 | C15: 70309 | D15: =R[-1]C&"|"&RC[-3] -> 1|2|3|4|5|6|7|8|9 | F15: 4|3 | G15: 360|36 | H15: 180|18 | I15: 2 | J15: 1 | K15: 7
A16: 10 | B16: 时间 | C16: 70310 | D16: =R[-1]C&"|"&RC[-3] -> 1|2|3|4|5|6|7|8|9|10 | F16: 1|2 | G16: 54|18 | H16: 27|9 | I16: 2 | J16: 1 | K16: 7
A17: 11 | B17: 责任 | C17: 70311 | D17: =R[-1]C&"|"&RC[-3] -> 1|2|3|4|5|6|7|8|9|10|11 | F17: 1|3 | G17: 54|18 | H17: 27|9 | I17: 2 | J17: 1 | K17: 7
A18: 12 | B18: 坚忍 | C18: 70312 | D18: =R[-1]C&"|"&RC[-3] -> 1|2|3|4|5|6|7|8|9|10|11|12 | F18: 2|3 | G18: 36|36 | H18: 18|18 | I18: 2 | J18: 1 | K18: 7
A19: 13 | B19: 畏惧 | C19: 70313 | D19: =R[-1]C&"|"&RC[-3] -> 1|2|3|4|5|6|7|8|9|10|11|12|13 | F19: 4|1 | G19: 360|36 | H19: 180|18 | I19: 2 | J19: 1 | K19: 7
A20: 14 | B20: 调和 | C20: 70314 | D20: =R[-1]C&"|"&RC[-3] -> 1|2|3|4|5|6|7|8|9|10|11|12|13|14 | F20: 4|2 | G20: 360|36 | H20: 180|18 | I20: 2 | J20: 1 | K20: 7
A21: 15 | B21: 沉迷 | C21: 70315 | D21: =R[-1]C&"|"&RC[-3] -> 1|2|3|4|5|6|7|8|9|10|11|12|13|14|15 | F21: 4|3 | G21: 360|36 | H21: 180|18 | I21: 2 | J21: 1 | K21: 7
A22: 16 | B22: 致命 | C22: 70316 | D22: =R[-1]C&"|"&RC[-3] -> 1|2|3|4|5|6|7|8|9|10|11|12|13|14|15|16 | F22: 1|2 | G22: 54|18 | H22: 27|9 | I22: 2 | J22: 1 | K22: 7
A23: 17 | B23: 治疗 | C23: 70317 | D23: =R[-1]C&"|"&RC[-3] -> 1|2|3|4|5|6|7|8|9|10|11|12|13|14|15|16|17 | F23: 1|3 | G23: 54|18 | H23: 27|9 | I23: 2 | J23: 1 | K23: 7
A24: 18 | B24: 幽梦 | C24: 70318 | D24: =R[-1]C&"|"&RC[-3] -> 1|2|3|4|5|6|7|8|9|10|11|12|13|14|15|16|17|18 | F24: 2|3 | G24: 36|36 | H24: 18|18 | I24: 2 | J24: 1 | K24: 7
A25: 19 | B25: 活跃 | C25: 70319 | D25: =R[-1]C&"|"&RC[-3] -> 1|2|3|4|5|6|7|8|9|10|11|12|13|14|15|16|17|18|19 | F25: 4|1 | G25: 360|36 | H25: 180|18 | I25: 2 | J25: 1 | K25: 7
A26: 20 | B26: 坦白 | C26: 70320 | D26: =R[-1]C&"|"&RC[-3] -> 1|2|3|4|5|6|7|8|9|10|11|12|13|14|15|16|17|18|19|20 | F26: 4|2 | G26: 360|36 | H26: 180|18 | I26: 2 | J26: 1 | K26: 7
A27: 21 | B27: 运转 | C27: 70321 | D27: =R[-1]C&"|"&RC[-3] -> 1|2|3|4|5|6|7|8|9|10|11|12|13|14|15|16|17|18|19|20|21 | F27: 4|3 | G27: 360|36 | H27: 180|18 | I27: 2 | J27: 1 | K27: 7
A28: 22 | B28: 神圣 | C28: 70322 | D28: =R[-1]C&"|"&RC[-3] -> 1|2|3|4|5|6|7|8|9|10|11|12|13|14|15|16|17|18|19|20|21|22 | F28: 1|2 | G28: 54|18 | H28: 27|9 | I28: 2 | J28: 1 | K28: 7
A29: 23 | B29: 祭祀 | C29: 70323 | D29: =R[-1]C&"|"&RC[-3] -> 1|2|3|4|5|6|7|8|9|10|11|12|13|14|15|16|17|18|19|20|21|22|23 | F29: 1|3 | G29: 54|18 | H29: 27|9 | I29: 2 | J29: 1 | K29: 7
A30: 24 | B30: 斩铁 | C30: 70324 | D30: =R[-1]C&"|"&RC[-3] -> 1|2|3|4|5|6|7|8|9|10|11|12|13|14|15|16|17|18|19|20|21|22|23|24 | F30: 2|3 | G30: 36|36 | H30: 18|18 | I30: 2 | J30: 1 | K30: 7
A31: 25 | B31: 飞舞 | C31: 70325 | D31: =R[-1]C&"|"&RC[-3] -> 1|2|3|4|5|6|7|8|9|10|11|12|13|14|15|16|17|18|19|20|21|22|23|24|25 | F31: 4|1 | G31: 360|36 | H31: 180|18 | I31: 2 | J31: 1 | K31: 7
A32: 26 | B32: 隐藏 | C32: 70301|70209 | D32: =R[-1]C&"|"&RC[-3] -> 1|2|3|4|5|6|7|8|9|10|11|12|13|14|15|16|17|18|19|20|21|22|23|24|25|26 | E32: 紫+蓝 | F32: 4|2 | G32: 360|36 | H32: 180|18 | I32: 2 | J32: 1 | K32: 7
A33: 27 | B33: 祈祷 | C33: 70302|70223 | D33: =R[-1]C&"|"&RC[-3] -> 1|2|3|4|5|6|7|8|9|10|11|12|13|14|15|16|17|18|19|20|21|22|23|24|25|26|27 | F33: 4|3 | G33: 360|36 | H33: 180|18 | I33: 2 | J33: 1 | K33: 7
A34: 28 | B34: 红月 | C34: 70303|70218 | D34: =R[-1]C&"|"&RC[-3] -> 1|2|3|4|5|6|7|8|9|10|11|12|13|14|15|16|17|18|19|20|21|22|23|24|25|26|27|28 | F34: 1|2 | G34: 54|18 | H34: 27|9 | I34: 2 | J34: 1 | K34: 7
A35: 29 | B35: 皇权 | C35: 70304|70222 | D35: =R[-1]C&"|"&RC[-3] -> 1|2|3|4|5|6|7|8|9|10|11|12|13|14|15|16|17|18|19|20|21|22|23|24|25|26|27|28|29 | F35: 1|3 | G35: 54|18 | H35: 27|9 | I35: 2 | J35: 1 | K35: 7
A36: 30 | B36: 冠冕 | C36: 70305|70225 | D36: =R[-1]C&"|"&RC[-3] -> 1|2|3|4|5|6|7|8|9|10|11|12|13|14|15|16|17|18|19|20|21|22|23|24|25|26|27|28|29|30 | F36: 2|3 | G36: 36|36 | H36: 18|18 | I36: 2 | J36: 1 | K36: 7
A37: 31 | B37: 灼热 | C37: 70306|70219 | D37: =R[-1]C&"|"&RC[-3] -> 1|2|3|4|5|6|7|8|9|10|11|12|13|14|15|16|17|18|19|20|21|22|23|24|25|26|27|28|29|30|31 | F37: 4|1 | G37: 360|36 | H37: 180|18 | I37: 2 | J37: 1 | K37: 7
A38: 32 | B38: 撞毁 | C38: 70307|70216 | D38: =R[-1]C&"|"&RC[-3] -> 1|2|3|4|5|6|7|8|9|10|11|12|13|14|15|16|17|18|19|20|21|22|23|24|25|26|27|28|29|30|31|32 | F38: 4|2 | G38: 360|36 | H38: 180|18 | I38: 2 | J38: 1 | K38: 7
A39: 33 | B39: 碾压 | C39: 70308|70207 | D39: =R[-1]C&"|"&RC[-3] -> 1|2|3|4|5|6|7|8|9|10|11|12|13|14|15|16|17|18|19|20|21|22|23|24|25|26|27|28|29|30|31|32|33 | F39: 4|3 | G39: 360|36 | H39: 180|18 | I39: 2 | J39: 1 | K39: 7
A40: 34 | B40: 挣扎 | C40: 70309|70210 | D40: =R[-1]C&"|"&RC[-3] -> 1|2|3|4|5|6|7|8|9|10|11|12|13|14|15|16|17|18|19|20|21|22|23|24|25|26|27|28|29|30|31|32|33|34 | F40: 1|2 | G40: 54|18 | H40: 27|9 | I40: 2 | J40: 1 | K40: 7
A41: 35 | B41: 命运 | C41: 70310|70212 | D41: =R[-1]C&"|"&RC[-3] -> 1|2|3|4|5|6|7|8|9|10|11|12|13|14|15|16|17|18|19|20|21|22|23|24|25|26|27|28|29|30|31|32|33|34|35 | F41: 1|3 | G41: 54|18 | H41: 27|9 | I41: 2 | J41: 1 | K41: 7
A42: 36 | B42: 义举 | C42: 70311|70220 | D42: =R[-1]C&"|"&RC[-3] -> 1|2|3|4|5|6|7|8|9|10|11|12|13|14|15|16|17|18|19|20|21|22|23|24|25|26|27|28|29|30|31|32|33|34|35|36 | F42: 2|3 | G42: 36|36 | H42: 18|18 | I42: 2 | J42: 1 | K42: 7
A43: 37 | B43: 祭神 | C43: 70312|70212 | D43: =R[-1]C&"|"&RC[-3] -> 1|2|3|4|5|6|7|8|9|10|11|12|13|14|15|16|17|18|19|20|21|22|23|24|25|26|27|28|29|30|31|32|33|34|35|36|37 | F43: 4|1 | G43: 360|36 | H43: 180|18 | I43: 2 | J43: 1 | K43: 7
A44: 38 | B44: 索命 | C44: 70313|70221 | D44: =R[-1]C&"|"&RC[-3] -> 1|2|3|4|5|6|7|8|9|10|11|12|13|14|15|16|17|18|19|20|21|22|23|24|25|26|27|28|29|30|31|32|33|34|35|36|37|38 | F44: 4|2 | G44: 360|36 | H44: 180|18 | I44: 2 | J44: 1 | K44: 7
A45: 39 | B45: 白衣 | C45: 70314|70205 | D45: =R[-1]C&"|"&RC[-3] -> 1|2|3|4|5|6|7|8|9|10|11|12|13|14|15|16|17|18|19|20|21|22|23|24|25|26|27|28|29|30|31|32|33|34|35|36|37|38|39 | F45: 4|3 | G45: 360|36 | H45: 180|18 | I45: 2 | J45: 1 | K45: 7
A46: 40 | B46: 魔法 | C46: 70315|70201 | D46: =R[-1]C&"|"&RC[-3] -> 1|2|3|4|5|6|7|8|9|10|11|12|13|14|15|16|17|18|19|20|21|22|23|24|25|26|27|28|29|30|31|32|33|34|35|36|37|38|39|40 | F46: 1|2 | G46: 54|18 | H46: 27|9 | I46: 2 | J46: 1 | K46: 7
A47: 41 | B47: 坍塌 | C47: 70316|70204 | D47: =R[-1]C&"|"&RC[-3] -> 1|2|3|4|5|6|7|8|9|10|11|12|13|14|15|16|17|18|19|20|21|22|23|24|25|26|27|28|29|30|31|32|33|34|35|36|37|38|39|40|41 | F47: 1|3 | G47: 54|18 | H47: 27|9 | I47: 2 | J47: 1 | K47: 7
A48: 42 | B48: 魂魄 | C48: 70317|70213 | D48: =R[-1]C&"|"&RC[-3] -> 1|2|3|4|5|6|7|8|9|10|11|12|13|14|15|16|17|18|19|20|21|22|23|24|25|26|27|28|29|30|31|32|33|34|35|36|37|38|39|40|41|42 | F48: 2|3 | G48: 36|36 | H48: 18|18 | I48: 2 | J48: 1 | K48: 7
A49: 43 | B49: 星月 | C49: 70318|70217 | D49: =R[-1]C&"|"&RC[-3] -> 1|2|3|4|5|6|7|8|9|10|11|12|13|14|15|16|17|18|19|20|21|22|23|24|25|26|27|28|29|30|31|32|33|34|35|36|37|38|39|40|41|42|43 | F49: 4|1 | G49: 360|36 | H49: 180|18 | I49: 2 | J49: 1 | K49: 7
A50: 44 | B50: 映衬 | C50: 70319|70218 | D50: =R[-1]C&"|"&RC[-3] -> 1|2|3|4|5|6|7|8|9|10|11|12|13|14|15|16|17|18|19|20|21|22|23|24|25|26|27|28|29|30|31|32|33|34|35|36|37|38|39|40|41|42|43|44 | F50: 4|2 | G50: 360|36 | H50: 180|18 | I50: 2 | J50: 1 | K50: 7
A51: 45 | B51: 火刑 | C51: 70320|70219 | D51: =R[-1]C&"|"&RC[-3] -> 1|2|3|4|5|6|7|8|9|10|11|12|13|14|15|16|17|18|19|20|21|22|23|24|25|26|27|28|29|30|31|32|33|34|35|36|37|38|39|40|41|42|43|44|45 | F51: 4|3 | G51: 360|36 | H51: 180|18 | I51: 2 | J51: 1 | K51: 7
A52: 46 | B52: 轮转 | C52: 70321|70310 | D52: =R[-1]C&"|"&RC[-3] -> 1|2|3|4|5|6|7|8|9|10|11|12|13|14|15|16|17|18|19|20|21|22|23|24|25|26|27|28|29|30|31|32|33|34|35|36|37|38|39|40|41|42|43|44|45|46 | F52: 1|2 | G52: 72|24 | H52: 36|12 | I52: 2 | J52: 1 | K52: 7
A53: 47 | B53: 献祭 | C53: 70319|70202 | D53: =R[-1]C&"|"&RC[-3] -> 1|2|3|4|5|6|7|8|9|10|11|12|13|14|15|16|17|18|19|20|21|22|23|24|25|26|27|28|29|30|31|32|33|34|35|36|37|38|39|40|41|42|43|44|45|46|47 | F53: 1|3 | G53: 54|18 | H53: 27|9 | I53: 2 | J53: 1 | K53: 7
A54: 48 | B54: 共治 | C54: 70304|70203 | D54: =R[-1]C&"|"&RC[-3] -> 1|2|3|4|5|6|7|8|9|10|11|12|13|14|15|16|17|18|19|20|21|22|23|24|25|26|27|28|29|30|31|32|33|34|35|36|37|38|39|40|41|42|43|44|45|46|47|48 | F54: 2|3 | G54: 36|36 | H54: 18|18 | I54: 2 | J54: 1 | K54: 7
A55: 49 | B55: 诱惑 | C55: 70315|70206 | D55: =R[-1]C&"|"&RC[-3] -> 1|2|3|4|5|6|7|8|9|10|11|12|13|14|15|16|17|18|19|20|21|22|23|24|25|26|27|28|29|30|31|32|33|34|35|36|37|38|39|40|41|42|43|44|45|46|47|48|49 | F55: 4|1 | G55: 360|36 | H55: 180|18 | I55: 2 | J55: 1 | K55: 7
A56: 50 | B56: 斩断 | C56: 70324|70208 | D56: =R[-1]C&"|"&RC[-3] -> 1|2|3|4|5|6|7|8|9|10|11|12|13|14|15|16|17|18|19|20|21|22|23|24|25|26|27|28|29|30|31|32|33|34|35|36|37|38|39|40|41|42|43|44|45|46|47|48|49|50 | F56: 4|2 | G56: 360|36 | H56: 180|18 | I56: 2 | J56: 1 | K56: 7
A57: 51 | B57: 扭曲 | C57: 70322|70211 | D57: =R[-1]C&"|"&RC[-3] -> 1|2|3|4|5|6|7|8|9|10|11|12|13|14|15|16|17|18|19|20|21|22|23|24|25|26|27|28|29|30|31|32|33|34|35|36|37|38|39|40|41|42|43|44|45|46|47|48|49|50|51 | F57: 4|3 | G57: 360|36 | H57: 180|18 | I57: 2 | J57: 1 | K57: 7
A58: 52 | B58: 饥渴 | C58: 70312|70214 | D58: =R[-1]C&"|"&RC[-3] -> 1|2|3|4|5|6|7|8|9|10|11|12|13|14|15|16|17|18|19|20|21|22|23|24|25|26|27|28|29|30|31|32|33|34|35|36|37|38|39|40|41|42|43|44|45|46|47|48|49|50|51|52 | F58: 1|2 | G58: 54|18 | H58: 27|9 | I58: 2 | J58: 1 | K58: 7
A59: 53 | B59: 毁灭 | C59: 70316|70215 | D59: =R[-1]C&"|"&RC[-3] -> 1|2|3|4|5|6|7|8|9|10|11|12|13|14|15|16|17|18|19|20|21|22|23|24|25|26|27|28|29|30|31|32|33|34|35|36|37|38|39|40|41|42|43|44|45|46|47|48|49|50|51|52|53 | F59: 1|3 | G59: 54|18 | H59: 27|9 | I59: 2 | J59: 1 | K59: 7
A60: 54 | B60: 武力 | C60: 70308|70224 | D60: =R[-1]C&"|"&RC[-3] -> 1|2|3|4|5|6|7|8|9|10|11|12|13|14|15|16|17|18|19|20|21|22|23|24|25|26|27|28|29|30|31|32|33|34|35|36|37|38|39|40|41|42|43|44|45|46|47|48|49|50|51|52|53|54 | F60: 2|3 | G60: 36|36 | H60: 18|18 | I60: 2 | J60: 1 | K60: 7
A61: 55 | B61: 火魔法 | C61: 70301|70319 | D61: =R[-1]C&"|"&RC[-3] -> 1|2|3|4|5|6|7|8|9|10|11|12|13|14|15|16|17|18|19|20|21|22|23|24|25|26|27|28|29|30|31|32|33|34|35|36|37|38|39|40|41|42|43|44|45|46|47|48|49|50|51|52|53|54|55 | E61: 紫+紫 | F61: 4|1 | G61: 480|48 | H61: 240|24 | I61: 2 | J61: 1 | K61: 7
A62: 56 | B62: 神恩 | C62: 70302|70305 | D62: =R[-1]C&"|"&RC[-3] -> 1|2|3|4|5|6|7|8|9|10|11|12|13|14|15|16|17|18|19|20|21|22|23|24|25|26|27|28|29|30|31|32|33|34|35|36|37|38|39|40|41|42|43|44|45|46|47|48|49|50|51|52|53|54|55|56 | F62: 4|2 | G62: 480|48 | H62: 240|24 | I62: 2 | J62: 1 | K62: 7
A63: 57 | B63: 祈愿术 | C63: 70303|70325 | D63: =R[-1]C&"|"&RC[-3] -> 1|2|3|4|5|6|7|8|9|10|11|12|13|14|15|16|17|18|19|20|21|22|23|24|25|26|27|28|29|30|31|32|33|34|35|36|37|38|39|40|41|42|43|44|45|46|47|48|49|50|51|52|53|54|55|56|57 | F63: 4|3 | G63: 480|48 | H63: 240|24 | I63: 2 | J63: 1 | K63: 7
A64: 58 | B64: 藐视 | C64: 70304|70307 | D64: =R[-1]C&"|"&RC[-3] -> 1|2|3|4|5|6|7|8|9|10|11|12|13|14|15|16|17|18|19|20|21|22|23|24|25|26|27|28|29|30|31|32|33|34|35|36|37|38|39|40|41|42|43|44|45|46|47|48|49|50|51|52|53|54|55|56|57|58 | F64: 1|2 | G64: 72|24 | H64: 36|12 | I64: 2 | J64: 1 | K64: 7
A65: 59 | B65: 神权 | C65: 70305|70322 | D65: =R[-1]C&"|"&RC[-3] -> 1|2|3|4|5|6|7|8|9|10|11|12|13|14|15|16|17|18|19|20|21|22|23|24|25|26|27|28|29|30|31|32|33|34|35|36|37|38|39|40|41|42|43|44|45|46|47|48|49|50|51|52|53|54|55|56|57|58|59 | F65: 1|3 | G65: 72|24 | H65: 36|12 | I65: 2 | J65: 1 | K65: 7
A66: 60 | B66: 禁果 | C66: 70306|70314 | D66: =R[-1]C&"|"&RC[-3] -> 1|2|3|4|5|6|7|8|9|10|11|12|13|14|15|16|17|18|19|20|21|22|23|24|25|26|27|28|29|30|31|32|33|34|35|36|37|38|39|40|41|42|43|44|45|46|47|48|49|50|51|52|53|54|55|56|57|58|59|60 | F66: 2|3 | G66: 48|48 | H66: 24|24 | I66: 2 | J66: 1 | K66: 7
A67: 61 | B67: 征服 | C67: 70307|70321 | D67: =R[-1]C&"|"&RC[-3] -> 1|2|3|4|5|6|7|8|9|10|11|12|13|14|15|16|17|18|19|20|21|22|23|24|25|26|27|28|29|30|31|32|33|34|35|36|37|38|39|40|41|42|43|44|45|46|47|48|49|50|51|52|53|54|55|56|57|58|59|60|61 | F67: 4|1 | G67: 480|48 | H67: 240|24 | I67: 2 | J67: 1 | K67: 7
A68: 62 | B68: 裁决 | C68: 70308|70320 | D68: =R[-1]C&"|"&RC[-3] -> 1|2|3|4|5|6|7|8|9|10|11|12|13|14|15|16|17|18|19|20|21|22|23|24|25|26|27|28|29|30|31|32|33|34|35|36|37|38|39|40|41|42|43|44|45|46|47|48|49|50|51|52|53|54|55|56|57|58|59|60|61|62 | F68: 4|2 | G68: 480|48 | H68: 240|24 | I68: 2 | J68: 1 | K68: 7
A69: 63 | B69: 披星 | C69: 70309|70317 | D69: =R[-1]C&"|"&RC[-3] -> 1|2|3|4|5|6|7|8|9|10|11|12|13|14|15|16|17|18|19|20|21|22|23|24|25|26|27|28|29|30|31|32|33|34|35|36|37|38|39|40|41|42|43|44|45|46|47|48|49|50|51|52|53|54|55|56|57|58|59|60|61|62|63 | F69: 4|3 | G69: 480|48 | H69: 240|24 | I69: 2 | J69: 1 | K69: 7
A70: 64 | B70: 七彩泉 | C70: 70310|70323 | D70: =R[-1]C&"|"&RC[-3] -> 1|2|3|4|5|6|7|8|9|10|11|12|13|14|15|16|17|18|19|20|21|22|23|24|25|26|27|28|29|30|31|32|33|34|35|36|37|38|39|40|41|42|43|44|45|46|47|48|49|50|51|52|53|54|55|56|57|58|59|60|61|62|63|64 | F70: 1|2 | G70: 72|24 | H70: 36|12 | I70: 2 | J70: 1 | K70: 7
A71: 65 | B71: 去恶 | C71: 70311|70324 | D71: =R[-1]C&"|"&RC[-3] -> 1|2|3|4|5|6|7|8|9|10|11|12|13|14|15|16|17|18|19|20|21|22|23|24|25|26|27|28|29|30|31|32|33|34|35|36|37|38|39|40|41|42|43|44|45|46|47|48|49|50|51|52|53|54|55|56|57|58|59|60|61|62|63|64|65 | F71: 1|3 | G71: 72|24 | H71: 36|12 | I71: 2 | J71: 1 | K71: 7
A72: 66 | B72: 月影 | C72: 70312|70318 | D72: =R[-1]C&"|"&RC[-3] -> 1|2|3|4|5|6|7|8|9|10|11|12|13|14|15|16|17|18|19|20|21|22|23|24|25|26|27|28|29|30|31|32|33|34|35|36|37|38|39|40|41|42|43|44|45|46|47|48|49|50|51|52|53|54|55|56|57|58|59|60|61|62|63|64|65|66 | F72: 2|3 | G72: 48|48 | H72: 24|24 | I72: 2 | J72: 1 | K72: 7
A73: 67 | B73: 生死别 | C73: 70313|70306 | D73: =R[-1]C&"|"&RC[-3] -> 1|2|3|4|5|6|7|8|9|10|11|12|13|14|15|16|17|18|19|20|21|22|23|24|25|26|27|28|29|30|31|32|33|34|35|36|37|38|39|40|41|42|43|44|45|46|47|48|49|50|51|52|53|54|55|56|57|58|59|60|61|62|63|64|65|66|67 | F73: 4|1 | G73: 480|48 | H73: 240|24 | I73: 2 | J73: 1 | K73: 7
A74: 68 | B74: 克制 | C74: 70314|70309 | D74: =R[-1]C&"|"&RC[-3] -> 1|2|3|4|5|6|7|8|9|10|11|12|13|14|15|16|17|18|19|20|21|22|23|24|25|26|27|28|29|30|31|32|33|34|35|36|37|38|39|40|41|42|43|44|45|46|47|48|49|50|51|52|53|54|55|56|57|58|59|60|61|62|63|64|65|66|67|68 | F74: 4|2 | G74: 480|48 | H74: 240|24 | I74: 2 | J74: 1 | K74: 7
A75: 69 | B75: 星火 | C75: 70315|70325 | D75: =R[-1]C&"|"&RC[-3] -> 1|2|3|4|5|6|7|8|9|10|11|12|13|14|15|16|17|18|19|20|21|22|23|24|25|26|27|28|29|30|31|32|33|34|35|36|37|38|39|40|41|42|43|44|45|46|47|48|49|50|51|52|53|54|55|56|57|58|59|60|61|62|63|64|65|66|67|68|69 | F75: 4|3 | G75: 480|48 | H75: 240|24 | I75: 2 | J75: 1 | K75: 7
A76: 70 | B76: 陨星 | C76: 70316|70317 | D76: =R[-1]C&"|"&RC[-3] -> 1|2|3|4|5|6|7|8|9|10|11|12|13|14|15|16|17|18|19|20|21|22|23|24|25|26|27|28|29|30|31|32|33|34|35|36|37|38|39|40|41|42|43|44|45|46|47|48|49|50|51|52|53|54|55|56|57|58|59|60|61|62|63|64|65|66|67|68|69|70 | F76: 1|2 | G76: 72|24 | H76: 36|12 | I76: 2 | J76: 1 | K76: 7
A77: 71 | B77: 星露 | C77: 70317|70323 | D77: =R[-1]C&"|"&RC[-3] -> 1|2|3|4|5|6|7|8|9|10|11|12|13|14|15|16|17|18|19|20|21|22|23|24|25|26|27|28|29|30|31|32|33|34|35|36|37|38|39|40|41|42|43|44|45|46|47|48|49|50|51|52|53|54|55|56|57|58|59|60|61|62|63|64|65|66|67|68|69|70|71 | F77: 1|3 | G77: 72|24 | H77: 36|12 | I77: 2 | J77: 1 | K77: 7
A78: 72 | B78: 祭月 | C78: 70318|70302 | D78: =R[-1]C&"|"&RC[-3] -> 1|2|3|4|5|6|7|8|9|10|11|12|13|14|15|16|17|18|19|20|21|22|23|24|25|26|27|28|29|30|31|32|33|34|35|36|37|38|39|40|41|42|43|44|45|46|47|48|49|50|51|52|53|54|55|56|57|58|59|60|61|62|63|64|65|66|67|68|69|70|71|72 | F78: 2|3 | G78: 48|48 | H78: 24|24 | I78: 2 | J78: 1 | K78: 7
A79: 73 | B79: 正午 | C79: 70319|70311 | D79: =R[-1]C&"|"&RC[-3] -> 1|2|3|4|5|6|7|8|9|10|11|12|13|14|15|16|17|18|19|20|21|22|23|24|25|26|27|28|29|30|31|32|33|34|35|36|37|38|39|40|41|42|43|44|45|46|47|48|49|50|51|52|53|54|55|56|57|58|59|60|61|62|63|64|65|66|67|68|69|70|71|72|73 | F79: 4|1 | G79: 480|48 | H79: 240|24 | I79: 2 | J79: 1 | K79: 7
A80: 74 | B80: 拷问 | C80: 70320|70301 | D80: =R[-1]C&"|"&RC[-3] -> 1|2|3|4|5|6|7|8|9|10|11|12|13|14|15|16|17|18|19|20|21|22|23|24|25|26|27|28|29|30|31|32|33|34|35|36|37|38|39|40|41|42|43|44|45|46|47|48|49|50|51|52|53|54|55|56|57|58|59|60|61|62|63|64|65|66|67|68|69|70|71|72|73|74 | F80: 4|2 | G80: 480|48 | H80: 240|24 | I80: 2 | J80: 1 | K80: 7
A81: 75 | B81: 逃避 | C81: 70321|70313 | D81: =R[-1]C&"|"&RC[-3] -> 1|2|3|4|5|6|7|8|9|10|11|12|13|14|15|16|17|18|19|20|21|22|23|24|25|26|27|28|29|30|31|32|33|34|35|36|37|38|39|40|41|42|43|44|45|46|47|48|49|50|51|52|53|54|55|56|57|58|59|60|61|62|63|64|65|66|67|68|69|70|71|72|73|74|75 | F81: 4|3 | G81: 480|48 | H81: 240|24 | I81: 2 | J81: 1 | K81: 7
A82: 76 | B82: 女权 | C82: 70322|70303 | D82: =R[-1]C&"|"&RC[-3] -> 1|2|3|4|5|6|7|8|9|10|11|12|13|14|15|16|17|18|19|20|21|22|23|24|25|26|27|28|29|30|31|32|33|34|35|36|37|38|39|40|41|42|43|44|45|46|47|48|49|50|51|52|53|54|55|56|57|58|59|60|61|62|63|64|65|66|67|68|69|70|71|72|73|74|75|76 | F82: 1|2 | G82: 72|24 | H82: 36|12 | I82: 2 | J82: 1 | K82: 7
A83: 77 | B83: 月亮泉 | C83: 70323|70318 | D83: =R[-1]C&"|"&RC[-3] -> 1|2|3|4|5|6|7|8|9|10|11|12|13|14|15|16|17|18|19|20|21|22|23|24|25|26|27|28|29|30|31|32|33|34|35|36|37|38|39|40|41|42|43|44|45|46|47|48|49|50|51|52|53|54|55|56|57|58|59|60|61|62|63|64|65|66|67|68|69|70|71|72|73|74|75|76|77 | F83: 1|3 | G83: 72|24 | H83: 36|12 | I83: 2 | J83: 1 | K83: 7
A84: 78 | B84: 抉择 | C84: 70324|70310 | D84: =R[-1]C&"|"&RC[-3] -> 1|2|3|4|5|6|7|8|9|10|11|12|13|14|15|16|17|18|19|20|21|22|23|24|25|26|27|28|29|30|31|32|33|34|35|36|37|38|39|40|41|42|43|44|45|46|47|48|49|50|51|52|53|54|55|56|57|58|59|60|61|62|63|64|65|66|67|68|69|70|71|72|73|74|75|76|77|78 | F84: 2|3 | G84: 48|48 | H84: 24|24 | I84: 2 | J84: 1 | K84: 7
A85: 79 | B85: 夜行 | C85: 70325|70307 | D85: =R[-1]C&"|"&RC[-3] -> 1|2|3|4|5|6|7|8|9|10|11|12|13|14|15|16|17|18|19|20|21|22|23|24|25|26|27|28|29|30|31|32|33|34|35|36|37|38|39|40|41|42|43|44|45|46|47|48|49|50|51|52|53|54|55|56|57|58|59|60|61|62|63|64|65|66|67|68|69|70|71|72|73|74|75|76|77|78|79 | F85: 4|1 | G85: 480|48 | H85: 240|24 | I85: 2 | J85: 1 | K85: 7
A86: 80 | B86: 权术 | C86: 70301|70304|70222 | D86: =RC[-3] -> 80 | E86: 紫+紫+蓝 | F86: 4|2 | G86: 480|48 | H86: 240|24 | I86: 2 | J86: 1 | K86: 7
A87: 81 | B87: 正与反 | C87: 70302|70310|70212 | D87: =R[-1]C&"|"&RC[-3] -> 80|81 | F87: 4|3 | G87: 480|48 | H87: 240|24 | I87: 2 | J87: 1 | K87: 7
A88: 82 | B88: 深爱 | C88: 70303|70306|70204 | D88: =R[-1]C&"|"&RC[-3] -> 80|81|82 | F88: 1|2 | G88: 72|24 | H88: 36|12 | I88: 2 | J88: 1 | K88: 7
A89: 83 | B89: 权势 | C89: 70304|70322|70215 | D89: =R[-1]C&"|"&RC[-3] -> 80|81|82|83 | F89: 1|3 | G89: 72|24 | H89: 36|12 | I89: 2 | J89: 1 | K89: 7
A90: 84 | B90: 信仰 | C90: 70305|70323|70202 | D90: =R[-1]C&"|"&RC[-3] -> 80|81|82|83|84 | F90: 2|3 | G90: 48|48 | H90: 24|24 | I90: 2 | J90: 1 | K90: 7
A91: 85 | B91: 沉沦 | C91: 70306|70316|70213 | D91: =R[-1]C&"|"&RC[-3] -> 80|81|82|83|84|85 | F91: 4|1 | G91: 480|48 | H91: 240|24 | I91: 2 | J91: 1 | K91: 7
A92: 86 | B92: 日轮 | C92: 70307|70319|70210 | D92: =R[-1]C&"|"&RC[-3] -> 80|81|82|83|84|85|86 | F92: 4|2 | G92: 480|48 | H92: 240|24 | I92: 2 | J92: 1 | K92: 7
A93: 87 | B93: 自制力 | C93: 70308|70314|70220 | D93: =R[-1]C&"|"&RC[-3] -> 80|81|82|83|84|85|86|87 | F93: 4|3 | G93: 480|48 | H93: 240|24 | I93: 2 | J93: 1 | K93: 7
A94: 88 | B94: 悄然 | C94: 70309|70313|70224 | D94: =R[-1]C&"|"&RC[-3] -> 80|81|82|83|84|85|86|87|88 | F94: 1|2 | G94: 72|24 | H94: 36|12 | I94: 2 | J94: 1 | K94: 7
A95: 89 | B95: 粉碎 | C95: 70310|70308|70211 | D95: =R[-1]C&"|"&RC[-3] -> 80|81|82|83|84|85|86|87|88|89 | F95: 1|3 | G95: 72|24 | H95: 36|12 | I95: 2 | J95: 1 | K95: 7
A96: 90 | B96: 执行 | C96: 70311|70324|70214 | D96: =R[-1]C&"|"&RC[-3] -> 80|81|82|83|84|85|86|87|88|89|90 | F96: 2|3 | G96: 48|48 | H96: 24|24 | I96: 2 | J96: 1 | K96: 7
A97: 91 | B97: 反省 | C97: 70312|70320|70205 | D97: =R[-1]C&"|"&RC[-3] -> 80|81|82|83|84|85|86|87|88|89|90|91 | F97: 4|1 | G97: 480|48 | H97: 240|24 | I97: 2 | J97: 1 | K97: 7
A98: 92 | B98: 死星 | C98: 70313|70325|70221 | D98: =R[-1]C&"|"&RC[-3] -> 80|81|82|83|84|85|86|87|88|89|90|91|92 | F98: 4|2 | G98: 480|48 | H98: 240|24 | I98: 2 | J98: 1 | K98: 7
A99: 93 | B99: 归隐 | C99: 70314|70309|70217 | D99: =R[-1]C&"|"&RC[-3] -> 80|81|82|83|84|85|86|87|88|89|90|91|92|93 | F99: 4|3 | G99: 480|48 | H99: 240|24 | I99: 2 | J99: 1 | K99: 7
A100: 94 | B100: 黑魔法 | C100: 70315|70301|70208 | D100: =R[-1]C&"|"&RC[-3] -> 80|81|82|83|84|85|86|87|88|89|90|91|92|93|94 | F100: 1|2 | G100: 72|24 | H100: 36|12 | I100: 2 | J100: 1 | K100: 7
A101: 95 | B101: 崩塌 | C101: 70316|70315|70207 | D101: =R[-1]C&"|"&RC[-3] -> 80|81|82|83|84|85|86|87|88|89|90|91|92|93|94|95 | F101: 1|3 | G101: 72|24 | H101: 36|12 | I101: 2 | J101: 1 | K101: 7
A102: 96 | B102: 指引 | C102: 70317|70321|70225 | D102: =R[-1]C&"|"&RC[-3] -> 80|81|82|83|84|85|86|87|88|89|90|91|92|93|94|95|96 | F102: 2|3 | G102: 48|48 | H102: 24|24 | I102: 2 | J102: 1 | K102: 7
A103: 97 | B103: 心愿 | C103: 70318|70303|70223 | D103: =R[-1]C&"|"&RC[-3] -> 80|81|82|83|84|85|86|87|88|89|90|91|92|93|94|95|96|97 | F103: 4|1 | G103: 480|48 | H103: 240|24 | I103: 2 | J103: 1 | K103: 7
A104: 98 | B104: 自恃 | C104: 70319|70305|70216 | D104: =R[-1]C&"|"&RC[-3] -> 80|81|82|83|84|85|86|87|88|89|90|91|92|93|94|95|96|97|98 | F104: 4|2 | G104: 480|48 | H104: 240|24 | I104: 2 | J104: 1 | K104: 7
A105: 99 | B105: 夜行者 | C105: 70320|70311|70209 | D105: =R[-1]C&"|"&RC[-3] -> 80|81|82|83|84|85|86|87|88|89|90|91|92|93|94|95|96|97|98|99 | F105: 4|3 | G105: 480|48 | H105: 240|24 | I105: 2 | J105: 1 | K105: 7
A106: 100 | B106: 混乱 | C106: 70321|70312|70201 | D106: =R[-1]C&"|"&RC[-3] -> 80|81|82|83|84|85|86|87|88|89|90|91|92|93|94|95|96|97|98|99|100 | F106: 1|2 | G106: 72|24 | H106: 36|12 | I106: 2 | J106: 1 | K106: 7
A107: 101 | B107: 威严 | C107: 70322|70302|70203 | D107: =R[-1]C&"|"&RC[-3] -> 80|81|82|83|84|85|86|87|88|89|90|91|92|93|94|95|96|97|98|99|100|101 | F107: 1|3 | G107: 72|24 | H107: 36|12 | I107: 2 | J107: 1 | K107: 7
A108: 102 | B108: 始终 | C108: 70323|70314|70221 | D108: =R[-1]C&"|"&RC[-3] -> 80|81|82|83|84|85|86|87|88|89|90|91|92|93|94|95|96|97|98|99|100|101|102 | F108: 2|3 | G108: 48|48 | H108: 24|24 | I108: 2 | J108: 1 | K108: 7
A109: 103 | B109: 冲锋 | C109: 70324|70307|70213 | D109: =R[-1]C&"|"&RC[-3] -> 80|81|82|83|84|85|86|87|88|89|90|91|92|93|94|95|96|97|98|99|100|101|102|103 | F109: 4|1 | G109: 480|48 | H109: 240|24 | I109: 2 | J109: 1 | K109: 7
A110: 104 | B110: 祈愿 | C110: 70325|70317|70206 | D110: =R[-1]C&"|"&RC[-3] -> 80|81|82|83|84|85|86|87|88|89|90|91|92|93|94|95|96|97|98|99|100|101|102|103|104 | F110: 4|2 | G110: 480|48 | H110: 240|24 | I110: 2 | J110: 1 | K110: 7
A111: 105 | B111: 恶魔召唤 | C111: 70301|70315|70308 | D111: =R[-1]C&"|"&RC[-3] -> 80|81|82|83|84|85|86|87|88|89|90|91|92|93|94|95|96|97|98|99|100|101|102|103|104|105 | E111: 紫+紫+紫 | F111: 4|3 | G111: 600|60 | H111: 300|30 | I111: 2 | J111: 1 | K111: 7
A112: 106 | B112: 神临 | C112: 70302|70305|70323 | D112: =R[-1]C&"|"&RC[-3] -> 80|81|82|83|84|85|86|87|88|89|90|91|92|93|94|95|96|97|98|99|100|101|102|103|104|105|106 | F112: 1|2 | G112: 90|30 | H112: 45|15 | I112: 2 | J112: 1 | K112: 7
A113: 107 | B113: 洗礼 | C113: 70303|70325|70314 | D113: =R[-1]C&"|"&RC[-3] -> 80|81|82|83|84|85|86|87|88|89|90|91|92|93|94|95|96|97|98|99|100|101|102|103|104|105|106|107 | F113: 1|3 | G113: 90|30 | H113: 45|15 | I113: 2 | J113: 1 | K113: 7
A114: 108 | B114: 征服者 | C114: 70304|70307|70321 | D114: =R[-1]C&"|"&RC[-3] -> 80|81|82|83|84|85|86|87|88|89|90|91|92|93|94|95|96|97|98|99|100|101|102|103|104|105|106|107|108 | F114: 2|3 | G114: 60|60 | H114: 30|30 | I114: 2 | J114: 1 | K114: 7
A115: 109 | B115: 圣光笼罩 | C115: 70305|70320|70319 | D115: =R[-1]C&"|"&RC[-3] -> 80|81|82|83|84|85|86|87|88|89|90|91|92|93|94|95|96|97|98|99|100|101|102|103|104|105|106|107|108|109 | F115: 4|1 | G115: 600|60 | H115: 300|30 | I115: 2 | J115: 1 | K115: 7
A116: 110 | B116: 逐出伊甸 | C116: 70306|70315|70310 | D116: =R[-1]C&"|"&RC[-3] -> 80|81|82|83|84|85|86|87|88|89|90|91|92|93|94|95|96|97|98|99|100|101|102|103|104|105|106|107|108|109|110 | F116: 4|2 | G116: 600|60 | H116: 300|30 | I116: 2 | J116: 1 | K116: 7
A117: 111 | B117: 垂死挣扎 | C117: 70307|70312|70315 | D117: =R[-1]C&"|"&RC[-3] -> 80|81|82|83|84|85|86|87|88|89|90|91|92|93|94|95|96|97|98|99|100|101|102|103|104|105|106|107|108|109|110|111 | F117: 4|3 | G117: 600|60 | H117: 300|30 | I117: 2 | J117: 1 | K117: 7
A118: 112 | B118: 守护终末 | C118: 70308|70322|70325 | D118: =R[-1]C&"|"&RC[-3] -> 80|81|82|83|84|85|86|87|88|89|90|91|92|93|94|95|96|97|98|99|100|101|102|103|104|105|106|107|108|109|110|111|112 | F118: 1|2 | G118: 90|30 | H118: 45|15 | I118: 2 | J118: 1 | K118: 7
A119: 113 | B119: 重新认知 | C119: 70309|70312|70323 | D119: =R[-1]C&"|"&RC[-3] -> 80|81|82|83|84|85|86|87|88|89|90|91|92|93|94|95|96|97|98|99|100|101|102|103|104|105|106|107|108|109|110|111|112|113 | F119: 1|3 | G119: 90|30 | H119: 45|15 | I119: 2 | J119: 1 | K119: 7
A120: 114 | B120: 命运长河 | C120: 70310|70302|70309 | D120: =R[-1]C&"|"&RC[-3] -> 80|81|82|83|84|85|86|87|88|89|90|91|92|93|94|95|96|97|98|99|100|101|102|103|104|105|106|107|108|109|110|111|112|113|114 | F120: 2|3 | G120: 60|60 | H120: 30|30 | I120: 2 | J120: 1 | K120: 7
A121: 115 | B121: 光之泪 | C121: 70311|70316|70318 | D121: =R[-1]C&"|"&RC[-3] -> 80|81|82|83|84|85|86|87|88|89|90|91|92|93|94|95|96|97|98|99|100|101|102|103|104|105|106|107|108|109|110|111|112|113|114|115 | F121: 4|1 | G121: 600|60 | H121: 300|30 | I121: 2 | J121: 1 | K121: 7
A122: 116 | B122: 灵视 | C122: 70312|70301|70313 | D122: =R[-1]C&"|"&RC[-3] -> 80|81|82|83|84|85|86|87|88|89|90|91|92|93|94|95|96|97|98|99|100|101|102|103|104|105|106|107|108|109|110|111|112|113|114|115|116 | F122: 4|2 | G122: 600|60 | H122: 300|30 | I122: 2 | J122: 1 | K122: 7
A123: 117 | B123: 难逃一死 | C123: 70313|70303|70304 | D123: =R[-1]C&"|"&RC[-3] -> 80|81|82|83|84|85|86|87|88|89|90|91|92|93|94|95|96|97|98|99|100|101|102|103|104|105|106|107|108|109|110|111|112|113|114|115|116|117 | F123: 4|3 | G123: 600|60 | H123: 300|30 | I123: 2 | J123: 1 | K123: 7
A124: 118 | B124: 安于一隅 | C124: 70314|70306|70317 | D124: =R[-1]C&"|"&RC[-3] -> 80|81|82|83|84|85|86|87|88|89|90|91|92|93|94|95|96|97|98|99|100|101|102|103|104|105|106|107|108|109|110|111|112|113|114|115|116|117|118 | F124: 1|2 | G124: 90|30 | H124: 45|15 | I124: 2 | J124: 1 | K124: 7
A125: 119 | B125: 堕落之人 | C125: 70315|70311|70324 | D125: =R[-1]C&"|"&RC[-3] -> 80|81|82|83|84|85|86|87|88|89|90|91|92|93|94|95|96|97|98|99|100|101|102|103|104|105|106|107|108|109|110|111|112|113|114|115|116|117|118|119 | F125: 1|3 | G125: 90|30 | H125: 45|15 | I125: 2 | J125: 1 | K125: 7
A126: 120 | B126: 神罚 | C126: 70316|70305|70320 | D126: =R[-1]C&"|"&RC[-3] -> 80|81|82|83|84|85|86|87|88|89|90|91|92|93|94|95|96|97|98|99|100|101|102|103|104|105|106|107|108|109|110|111|112|113|114|115|116|117|118|119|120 | F126: 2|3 | G126: 60|60 | H126: 30|30 | I126: 2 | J126: 1 | K126: 7
A127: 121 | B127: 神威 | C127: 70317|70322|70302 | D127: =R[-1]C&"|"&RC[-3] -> 80|81|82|83|84|85|86|87|88|89|90|91|92|93|94|95|96|97|98|99|100|101|102|103|104|105|106|107|108|109|110|111|112|113|114|115|116|117|118|119|120|121 | F127: 4|1 | G127: 600|60 | H127: 300|30 | I127: 2 | J127: 1 | K127: 7
A128: 122 | B128: 贪婪之欲 | C128: 70318|70308|70303 | D128: =R[-1]C&"|"&RC[-3] -> 80|81|82|83|84|85|86|87|88|89|90|91|92|93|94|95|96|97|98|99|100|101|102|103|104|105|106|107|108|109|110|111|112|113|114|115|116|117|118|119|120|121|122 | F128: 4|2 | G128: 600|60 | H128: 300|30 | I128: 2 | J128: 1 | K128: 7
A129: 123 | B129: 焦土 | C129: 70319|70311|70321 | D129: =R[-1]C&"|"&RC[-3] -> 80|81|82|83|84|85|86|87|88|89|90|91|92|93|94|95|96|97|98|99|100|101|102|103|104|105|106|107|108|109|110|111|112|113|114|115|116|117|118|119|120|121|122|123 | F129: 4|3 | G129: 600|60 | H129: 300|30 | I129: 2 | J129: 1 | K129: 7
A130: 124 | B130: 有罪 | C130: 70320|70306|70313 | D130: =R[-1]C&"|"&RC[-3] -> 80|81|82|83|84|85|86|87|88|89|90|91|92|93|94|95|96|97|98|99|100|101|102|103|104|105|106|107|108|109|110|111|112|113|114|115|116|117|118|119|120|121|122|123|124 | F130: 1|2 | G130: 90|30 | H130: 45|15 | I130: 2 | J130: 1 | K130: 7
A131: 125 | B131: 不问世事 | C131: 70321|70309|70304 | D131: =R[-1]C&"|"&RC[-3] -> 80|81|82|83|84|85|86|87|88|89|90|91|92|93|94|95|96|97|98|99|100|101|102|103|104|105|106|107|108|109|110|111|112|113|114|115|116|117|118|119|120|121|122|123|124|125 | F131: 1|3 | G131: 90|30 | H131: 45|15 | I131: 2 | J131: 1 | K131: 7
A132: 126 | B132: 紫月之灾 | C132: 70322|70318|70301 | D132: =R[-1]C&"|"&RC[-3] -> 80|81|82|83|84|85|86|87|88|89|90|91|92|93|94|95|96|97|98|99|100|101|102|103|104|105|106|107|108|109|110|111|112|113|114|115|116|117|118|119|120|121|122|123|124|125|126 | F132: 2|3 | G132: 60|60 | H132: 30|30 | I132: 2 | J132: 1 | K132: 7
A133: 127 | B133: 宝物 | C133: 70323|70324|70325 | D133: =R[-1]C&"|"&RC[-3] -> 80|81|82|83|84|85|86|87|88|89|90|91|92|93|94|95|96|97|98|99|100|101|102|103|104|105|106|107|108|109|110|111|112|113|114|115|116|117|118|119|120|121|122|123|124|125|126|127 | F133: 4|1 | G133: 600|60 | H133: 300|30 | I133: 2 | J133: 1 | K133: 7
A134: 128 | B134: 王剑 | C134: 70324|70304|70319 | D134: =R[-1]C&"|"&RC[-3] -> 80|81|82|83|84|85|86|87|88|89|90|91|92|93|94|95|96|97|98|99|100|101|102|103|104|105|106|107|108|109|110|111|112|113|114|115|116|117|118|119|120|121|122|123|124|125|126|127|128 | F134: 4|2 | G134: 600|60 | H134: 300|30 | I134: 2 | J134: 1 | K134: 7
A135: 129 | B135: 守护 | C135: 70325|70318|70306 | D135: =R[-1]C&"|"&RC[-3] -> 80|81|82|83|84|85|86|87|88|89|90|91|92|93|94|95|96|97|98|99|100|101|102|103|104|105|106|107|108|109|110|111|112|113|114|115|116|117|118|119|120|121|122|123|124|125|126|127|128|129 | F135: 4|3 | G135: 600|60 | H135: 300|30 | I135: 2 | J135: 1 | K135: 7
A136: 130 | B136: 毁灭之地 | C136: 70316|70313|70321 | D136: =R[-1]C&"|"&RC[-3] -> 80|81|82|83|84|85|86|87|88|89|90|91|92|93|94|95|96|97|98|99|100|101|102|103|104|105|106|107|108|109|110|111|112|113|114|115|116|117|118|119|120|121|122|123|124|125|126|127|128|129|130 | F136: 1|2 | G136: 90|30 | H136: 45|15 | I136: 2 | J136: 1 | K136: 7
A137: 131 | B137: 星剑 | C137: 70324|70303|70317 | D137: =R[-1]C&"|"&RC[-3] -> 80|81|82|83|84|85|86|87|88|89|90|91|92|93|94|95|96|97|98|99|100|101|102|103|104|105|106|107|108|109|110|111|112|113|114|115|116|117|118|119|120|121|122|123|124|125|126|127|128|129|130|131 | F137: 1|3 | G137: 90|30 | H137: 45|15 | I137: 2 | J137: 1 | K137: 7
A138: 132 | B138: 救赎 | C138: 70323|70312|70310 | D138: =R[-1]C&"|"&RC[-3] -> 80|81|82|83|84|85|86|87|88|89|90|91|92|93|94|95|96|97|98|99|100|101|102|103|104|105|106|107|108|109|110|111|112|113|114|115|116|117|118|119|120|121|122|123|124|125|126|127|128|129|130|131|132 | F138: 2|3 | G138: 60|60 | H138: 30|30 | I138: 2 | J138: 1 | K138: 7
A139: 133 | B139: 宣判 | C139: 70322|70305|70311 | D139: =R[-1]C&"|"&RC[-3] -> 80|81|82|83|84|85|86|87|88|89|90|91|92|93|94|95|96|97|98|99|100|101|102|103|104|105|106|107|108|109|110|111|112|113|114|115|116|117|118|119|120|121|122|123|124|125|126|127|128|129|130|131|132|133 | F139: 4|1 | G139: 600|60 | H139: 300|30 | I139: 2 | J139: 1 | K139: 7
A140: 134 | B140: 冲撞 | C140: 70320|70316|70307 | D140: =R[-1]C&"|"&RC[-3] -> 80|81|82|83|84|85|86|87|88|89|90|91|92|93|94|95|96|97|98|99|100|101|102|103|104|105|106|107|108|109|110|111|112|113|114|115|116|117|118|119|120|121|122|123|124|125|126|127|128|129|130|131|132|133|134 | F140: 4|2 | G140: 600|60 | H140: 300|30 | I140: 2 | J140: 1 | K140: 7
A141: 135 | B141: 默默无闻 | C141: 70301|70309|70308 | D141: =R[-1]C&"|"&RC[-3] -> 80|81|82|83|84|85|86|87|88|89|90|91|92|93|94|95|96|97|98|99|100|101|102|103|104|105|106|107|108|109|110|111|112|113|114|115|116|117|118|119|120|121|122|123|124|125|126|127|128|129|130|131|132|133|134|135 | F141: 4|3 | G141: 600|60 | H141: 300|30 | I141: 2 | J141: 1 | K141: 7
A142: 136 | B142: 魔术师 | C142: 70401 | D142: =RC[-3] -> 136 | E142: 橙 | F142: 1|2 | G142: 72|24 | H142: 36|12 | I142: 2 | J142: 1 | K142: 7
A143: 137 | B143: 女祭司 | C143: 70402 | D143: =R[-1]C&"|"&RC[-3] -> 136|137 | F143: 1|3 | G143: 72|24 | H143: 36|12 | I143: 2 | J143: 1 | K143: 7
A144: 138 | B144: 女皇 | C144: 70403 | D144: =R[-1]C&"|"&RC[-3] -> 136|137|138 | F144: 2|3 | G144: 48|48 | H144: 24|24 | I144: 2 | J144: 1 | K144: 7
A145: 139 | B145: 皇帝 | C145: 70404 | D145: =R[-1]C&"|"&RC[-3] -> 136|137|138|139 | F145: 4|1 | G145: 480|48 | H145: 240|24 | I145: 2 | J145: 1 | K145: 7
A146: 140 | B146: 教皇 | C146: 70405 | D146: =R[-1]C&"|"&RC[-3] -> 136|137|138|139|140 | F146: 4|2 | G146: 480|48 | H146: 240|24 | I146: 2 | J146: 1 | K146: 7
A147: 141 | B147: 恋人 | C147: 70406 | D147: =R[-1]C&"|"&RC[-3] -> 136|137|138|139|140|141 | F147: 4|3 | G147: 480|48 | H147: 240|24 | I147: 2 | J147: 1 | K147: 7
A148: 142 | B148: 战车 | C148: 70407 | D148: =R[-1]C&"|"&RC[-3] -> 136|137|138|139|140|141|142 | F148: 1|2 | G148: 72|24 | H148: 36|12 | I148: 2 | J148: 1 | K148: 7
A149: 143 | B149: 力量 | C149: 70408 | D149: =R[-1]C&"|"&RC[-3] -> 136|137|138|139|140|141|142|143 | F149: 1|3 | G149: 72|24 | H149: 36|12 | I149: 2 | J149: 1 | K149: 7
A150: 144 | B150: 隐者 | C150: 70409 | D150: =R[-1]C&"|"&RC[-3] -> 136|137|138|139|140|141|142|143|144 | F150: 2|3 | G150: 48|48 | H150: 24|24 | I150: 2 | J150: 1 | K150: 7
A151: 145 | B151: 命运之轮 | C151: 70410 | D151: =R[-1]C&"|"&RC[-3] -> 136|137|138|139|140|141|142|143|144|145 | F151: 4|1 | G151: 480|48 | H151: 240|24 | I151: 2 | J151: 1 | K151: 7
A152: 146 | B152: 正义 | C152: 70411 | D152: =R[-1]C&"|"&RC[-3] -> 136|137|138|139|140|141|142|143|144|145|146 | F152: 4|2 | G152: 480|48 | H152: 240|24 | I152: 2 | J152: 1 | K152: 7
A153: 147 | B153: 倒吊人 | C153: 70412 | D153: =R[-1]C&"|"&RC[-3] -> 136|137|138|139|140|141|142|143|144|145|146|147 | F153: 4|3 | G153: 480|48 | H153: 240|24 | I153: 2 | J153: 1 | K153: 7
A154: 148 | B154: 死神 | C154: 70413 | D154: =R[-1]C&"|"&RC[-3] -> 136|137|138|139|140|141|142|143|144|145|146|147|148 | F154: 1|2 | G154: 72|24 | H154: 36|12 | I154: 2 | J154: 1 | K154: 7
A155: 149 | B155: 节制 | C155: 70414 | D155: =R[-1]C&"|"&RC[-3] -> 136|137|138|139|140|141|142|143|144|145|146|147|148|149 | F155: 1|3 | G155: 72|24 | H155: 36|12 | I155: 2 | J155: 1 | K155: 7
A156: 150 | B156: 恶魔 | C156: 70415 | D156: =R[-1]C&"|"&RC[-3] -> 136|137|138|139|140|141|142|143|144|145|146|147|148|149|150 | F156: 2|3 | G156: 48|48 | H156: 24|24 | I156: 2 | J156: 1 | K156: 7
A157: 151 | B157: 塔 | C157: 70416 | D157: =R[-1]C&"|"&RC[-3] -> 136|137|138|139|140|141|142|143|144|145|146|147|148|149|150|151 | F157: 4|1 | G157: 480|48 | H157: 240|24 | I157: 2 | J157: 1 | K157: 7
A158: 152 | B158: 星星 | C158: 70417 | D158: =R[-1]C&"|"&RC[-3] -> 136|137|138|139|140|141|142|143|144|145|146|147|148|149|150|151|152 | F158: 4|2 | G158: 480|48 | H158: 240|24 | I158: 2 | J158: 1 | K158: 7
A159: 153 | B159: 月亮 | C159: 70418 | D159: =R[-1]C&"|"&RC[-3] -> 136|137|138|139|140|141|142|143|144|145|146|147|148|149|150|151|152|153 | F159: 4|3 | G159: 480|48 | H159: 240|24 | I159: 2 | J159: 1 | K159: 7
A160: 154 | B160: 太阳 | C160: 70419 | D160: =R[-1]C&"|"&RC[-3] -> 136|137|138|139|140|141|142|143|144|145|146|147|148|149|150|151|152|153|154 | F160: 1|2 | G160: 72|24 | H160: 36|12 | I160: 2 | J160: 1 | K160: 7
A161: 155 | B161: 审判 | C161: 70420 | D161: =R[-1]C&"|"&RC[-3] -> 136|137|138|139|140|141|142|143|144|145|146|147|148|149|150|151|152|153|154|155 | F161: 1|3 | G161: 72|24 | H161: 36|12 | I161: 2 | J161: 1 | K161: 7
A162: 156 | B162: 世界 | C162: 70421 | D162: =R[-1]C&"|"&RC[-3] -> 136|137|138|139|140|141|142|143|144|145|146|147|148|149|150|151|152|153|154|155|156 | F162: 2|3 | G162: 48|48 | H162: 24|24 | I162: 2 | J162: 1 | K162: 7
A163: 157 | B163: 权杖 | C163: 70422 | D163: =R[-1]C&"|"&RC[-3] -> 136|137|138|139|140|141|142|143|144|145|146|147|148|149|150|151|152|153|154|155|156|157 | F163: 4|1 | G163: 480|48 | H163: 240|24 | I163: 2 | J163: 1 | K163: 7
A164: 158 | B164: 圣杯 | C164: 70423 | D164: =R[-1]C&"|"&RC[-3] -> 136|137|138|139|140|141|142|143|144|145|146|147|148|149|150|151|152|153|154|155|156|157|158 | F164: 4|2 | G164: 480|48 | H164: 240|24 | I164: 2 | J164: 1 | K164: 7
A165: 159 | B165: 宝剑 | C165: 70424 | D165: =R[-1]C&"|"&RC[-3] -> 136|137|138|139|140|141|142|143|144|145|146|147|148|149|150|151|152|153|154|155|156|157|158|159 | F165: 4|3 | G165: 480|48 | H165: 240|24 | I165: 2 | J165: 1 | K165: 7
A166: 160 | B166: 星币 | C166: 70425 | D166: =R[-1]C&"|"&RC[-3] -> 136|137|138|139|140|141|142|143|144|145|146|147|148|149|150|151|152|153|154|155|156|157|158|159|160 | F166: 1|2 | G166: 72|24 | H166: 36|12 | I166: 2 | J166: 1 | K166: 7
A167: 161 | B167: 魔法师 | C167: 70401|70301|70201 | D167: =R[-1]C&"|"&RC[-3] -> 136|137|138|139|140|141|142|143|144|145|146|147|148|149|150|151|152|153|154|155|156|157|158|159|160|161 | E167: 同种类一套 | F167: 1|3 | G167: 90|30 | H167: 45|15 | I167: 2 | J167: 1 | K167: 7
A168: 162 | B168: 圣女 | C168: 70402|70302|70202 | D168: =R[-1]C&"|"&RC[-3] -> 136|137|138|139|140|141|142|143|144|145|146|147|148|149|150|151|152|153|154|155|156|157|158|159|160|161|162 | F168: 2|3 | G168: 60|60 | H168: 30|30 | I168: 2 | J168: 1 | K168: 7
A169: 163 | B169: 女帝 | C169: 70403|70303|70203 | D169: =R[-1]C&"|"&RC[-3] -> 136|137|138|139|140|141|142|143|144|145|146|147|148|149|150|151|152|153|154|155|156|157|158|159|160|161|162|163 | F169: 4|1 | G169: 600|60 | H169: 300|30 | I169: 2 | J169: 1 | K169: 7
A170: 164 | B170: 神帝 | C170: 70404|70304|70204 | D170: =R[-1]C&"|"&RC[-3] -> 136|137|138|139|140|141|142|143|144|145|146|147|148|149|150|151|152|153|154|155|156|157|158|159|160|161|162|163|164 | F170: 4|2 | G170: 600|60 | H170: 300|30 | I170: 2 | J170: 1 | K170: 7
A171: 165 | B171: 上帝 | C171: 70405|70305|70205 | D171: =R[-1]C&"|"&RC[-3] -> 136|137|138|139|140|141|142|143|144|145|146|147|148|149|150|151|152|153|154|155|156|157|158|159|160|161|162|163|164|165 | F171: 4|3 | G171: 600|60 | H171: 300|30 | I171: 2 | J171: 1 | K171: 7
A172: 166 | B172: 爱情 | C172: 70406|70306|70206 | D172: =R[-1]C&"|"&RC[-3] -> 136|137|138|139|140|141|142|143|144|145|146|147|148|149|150|151|152|153|154|155|156|157|158|159|160|161|162|163|164|165|166 | F172: 1|2 | G172: 90|30 | H172: 45|15 | I172: 2 | J172: 1 | K172: 7
A173: 167 | B173: 龙车 | C173: 70407|70307|70207 | D173: =R[-1]C&"|"&RC[-3] -> 136|137|138|139|140|141|142|143|144|145|146|147|148|149|150|151|152|153|154|155|156|157|158|159|160|161|162|163|164|165|166|167 | F173: 1|3 | G173: 90|30 | H173: 45|15 | I173: 2 | J173: 1 | K173: 7
A174: 168 | B174: 巨力 | C174: 70408|70308|70208 | D174: =R[-1]C&"|"&RC[-3] -> 136|137|138|139|140|141|142|143|144|145|146|147|148|149|150|151|152|153|154|155|156|157|158|159|160|161|162|163|164|165|166|167|168 | F174: 2|3 | G174: 60|60 | H174: 30|30 | I174: 2 | J174: 1 | K174: 7
A175: 169 | B175: 无名 | C175: 70409|70309|70209 | D175: =R[-1]C&"|"&RC[-3] -> 136|137|138|139|140|141|142|143|144|145|146|147|148|149|150|151|152|153|154|155|156|157|158|159|160|161|162|163|164|165|166|167|168|169 | F175: 4|1 | G175: 600|60 | H175: 300|30 | I175: 2 | J175: 1 | K175: 7
A176: 170 | B176: 万物之轮 | C176: 70410|70310|70210 | D176: =R[-1]C&"|"&RC[-3] -> 136|137|138|139|140|141|142|143|144|145|146|147|148|149|150|151|152|153|154|155|156|157|158|159|160|161|162|163|164|165|166|167|168|169|170 | F176: 4|2 | G176: 600|60 | H176: 300|30 | I176: 2 | J176: 1 | K176: 7
A177: 171 | B177: 绝对正义 | C177: 70411|70311|70211 | D177: =R[-1]C&"|"&RC[-3] -> 136|137|138|139|140|141|142|143|144|145|146|147|148|149|150|151|152|153|154|155|156|157|158|159|160|161|162|163|164|165|166|167|168|169|170|171 | F177: 4|3 | G177: 600|60 | H177: 300|30 | I177: 2 | J177: 1 | K177: 7
A178: 172 | B178: 颠倒 | C178: 70412|70312|70212 | D178: =R[-1]C&"|"&RC[-3] -> 136|137|138|139|140|141|142|143|144|145|146|147|148|149|150|151|152|153|154|155|156|157|158|159|160|161|162|163|164|165|166|167|168|169|170|171|172 | F178: 1|2 | G178: 90|30 | H178: 45|15 | I178: 2 | J178: 1 | K178: 7
A179: 173 | B179: 冥府之王 | C179: 70413|70313|70213 | D179: =R[-1]C&"|"&RC[-3] -> 136|137|138|139|140|141|142|143|144|145|146|147|148|149|150|151|152|153|154|155|156|157|158|159|160|161|162|163|164|165|166|167|168|169|170|171|172|173 | F179: 1|3 | G179: 90|30 | H179: 45|15 | I179: 2 | J179: 1 | K179: 7
A180: 174 | B180: 不染尘埃 | C180: 70414|70314|70214 | D180: =R[-1]C&"|"&RC[-3] -> 136|137|138|139|140|141|142|143|144|145|146|147|148|149|150|151|152|153|154|155|156|157|158|159|160|161|162|163|164|165|166|167|168|169|170|171|172|173|174 | F180: 2|3 | G180: 60|60 | H180: 30|30 | I180: 2 | J180: 1 | K180: 7
A181: 175 | B181: 魔王 | C181: 70415|70315|70215 | D181: =R[-1]C&"|"&RC[-3] -> 136|137|138|139|140|141|142|143|144|145|146|147|148|149|150|151|152|153|154|155|156|157|158|159|160|161|162|163|164|165|166|167|168|169|170|171|172|173|174|175 | F181: 4|1 | G181: 600|60 | H181: 300|30 | I181: 2 | J181: 1 | K181: 7
A182: 176 | B182: 高傲之塔 | C182: 70416|70316|70216 | D182: =R[-1]C&"|"&RC[-3] -> 136|137|138|139|140|141|142|143|144|145|146|147|148|149|150|151|152|153|154|155|156|157|158|159|160|161|162|163|164|165|166|167|168|169|170|171|172|173|174|175|176 | F182: 4|2 | G182: 600|60 | H182: 300|30 | I182: 2 | J182: 1 | K182: 7
A183: 177 | B183: 星河 | C183: 70417|70317|70217 | D183: =R[-1]C&"|"&RC[-3] -> 136|137|138|139|140|141|142|143|144|145|146|147|148|149|150|151|152|153|154|155|156|157|158|159|160|161|162|163|164|165|166|167|168|169|170|171|172|173|174|175|176|177 | F183: 4|3 | G183: 600|60 | H183: 300|30 | I183: 2 | J183: 1 | K183: 7
A184: 178 | B184: 圆月 | C184: 70418|70318|70218 | D184: =R[-1]C&"|"&RC[-3] -> 136|137|138|139|140|141|142|143|144|145|146|147|148|149|150|151|152|153|154|155|156|157|158|159|160|161|162|163|164|165|166|167|168|169|170|171|172|173|174|175|176|177|178 | F184: 1|2 | G184: 90|30 | H184: 45|15 | I184: 2 | J184: 1 | K184: 7
A185: 179 | B185: 太阳风暴 | C185: 70419|70319|70219 | D185: =R[-1]C&"|"&RC[-3] -> 136|137|138|139|140|141|142|143|144|145|146|147|148|149|150|151|152|153|154|155|156|157|158|159|160|161|162|163|164|165|166|167|168|169|170|171|172|173|174|175|176|177|178|179 | F185: 1|3 | G185: 90|30 | H185: 45|15 | I185: 2 | J185: 1 | K185: 7
A186: 180 | B186: 审判雷霆 | C186: 70420|70320|70220 | D186: =R[-1]C&"|"&RC[-3] -> 136|137|138|139|140|141|142|143|144|145|146|147|148|149|150|151|152|153|154|155|156|157|158|159|160|161|162|163|164|165|166|167|168|169|170|171|172|173|174|175|176|177|178|179|180 | F186: 2|3 | G186: 60|60 | H186: 30|30 | I186: 2 | J186: 1 | K186: 7
A187: 181 | B187: 世界尽头 | C187: 70421|70321|70221 | D187: =R[-1]C&"|"&RC[-3] -> 136|137|138|139|140|141|142|143|144|145|146|147|148|149|150|151|152|153|154|155|156|157|158|159|160|161|162|163|164|165|166|167|168|169|170|171|172|173|174|175|176|177|178|179|180|181 | F187: 4|1 | G187: 600|60 | H187: 300|30 | I187: 2 | J187: 1 | K187: 7
A188: 182 | B188: 至高权柄 | C188: 70422|70322|70222 | D188: =R[-1]C&"|"&RC[-3] -> 136|137|138|139|140|141|142|143|144|145|146|147|148|149|150|151|152|153|154|155|156|157|158|159|160|161|162|163|164|165|166|167|168|169|170|171|172|173|174|175|176|177|178|179|180|181|182 | F188: 4|2 | G188: 600|60 | H188: 300|30 | I188: 2 | J188: 1 | K188: 7
A189: 183 | B189: 神圣之血 | C189: 70423|70323|70223 | D189: =R[-1]C&"|"&RC[-3] -> 136|137|138|139|140|141|142|143|144|145|146|147|148|149|150|151|152|153|154|155|156|157|158|159|160|161|162|163|164|165|166|167|168|169|170|171|172|173|174|175|176|177|178|179|180|181|182|183 | F189: 4|3 | G189: 600|60 | H189: 300|30 | I189: 2 | J189: 1 | K189: 7
A190: 184 | B190: 剑斩心灵 | C190: 70424|70324|70224 | D190: =R[-1]C&"|"&RC[-3] -> 136|137|138|139|140|141|142|143|144|145|146|147|148|149|150|151|152|153|154|155|156|157|158|159|160|161|162|163|164|165|166|167|168|169|170|171|172|173|174|175|176|177|178|179|180|181|182|183|184 | F190: 1|2 | G190: 90|30 | H190: 45|15 | I190: 2 | J190: 1 | K190: 7
A191: 185 | B191: 守护之心 | C191: 70425|70325|70225 | D191: =R[-1]C&"|"&RC[-3] -> 136|137|138|139|140|141|142|143|144|145|146|147|148|149|150|151|152|153|154|155|156|157|158|159|160|161|162|163|164|165|166|167|168|169|170|171|172|173|174|175|176|177|178|179|180|181|182|183|184|185 | F191: 1|3 | G191: 90|30 | H191: 45|15 | I191: 2 | J191: 1 | K191: 7
A192: 186 | B192: 月亮魔术 | C192: 70401|70318 | D192: =RC[-3] -> 186 | E192: 橙+紫 | F192: 2|3 | G192: 60|60 | H192: 30|30 | I192: 2 | J192: 1 | K192: 7
A193: 187 | B193: 神降 | C193: 70402|70320 | D193: =R[-1]C&"|"&RC[-3] -> 186|187 | F193: 4|1 | G193: 600|60 | H193: 300|30 | I193: 2 | J193: 1 | K193: 7
A194: 188 | B194: 女皇威严 | C194: 70403|70322 | D194: =R[-1]C&"|"&RC[-3] -> 186|187|188 | F194: 4|2 | G194: 600|60 | H194: 300|30 | I194: 2 | J194: 1 | K194: 7
A195: 189 | B195: 力量至上 | C195: 70404|70308 | D195: =R[-1]C&"|"&RC[-3] -> 186|187|188|189 | F195: 4|3 | G195: 600|60 | H195: 300|30 | I195: 2 | J195: 1 | K195: 7
A196: 190 | B196: 行走世间 | C196: 70405|70309 | D196: =R[-1]C&"|"&RC[-3] -> 186|187|188|189|190 | F196: 1|2 | G196: 90|30 | H196: 45|15 | I196: 2 | J196: 1 | K196: 7
A197: 191 | B197: 守护之恋 | C197: 70406|70325 | D197: =R[-1]C&"|"&RC[-3] -> 186|187|188|189|190|191 | F197: 1|3 | G197: 90|30 | H197: 45|15 | I197: 2 | J197: 1 | K197: 7
A198: 192 | B198: 历史车轮 | C198: 70407|70310 | D198: =R[-1]C&"|"&RC[-3] -> 186|187|188|189|190|191|192 | F198: 2|3 | G198: 60|60 | H198: 30|30 | I198: 2 | J198: 1 | K198: 7
A199: 193 | B199: 压抑本能 | C199: 70408|70314 | D199: =R[-1]C&"|"&RC[-3] -> 186|187|188|189|190|191|192|193 | F199: 4|1 | G199: 600|60 | H199: 300|30 | I199: 2 | J199: 1 | K199: 7
A200: 194 | B200: 潜伏 | C200: 70409|70312 | D200: =R[-1]C&"|"&RC[-3] -> 186|187|188|189|190|191|192|193|194 | F200: 4|2 | G200: 600|60 | H200: 300|30 | I200: 2 | J200: 1 | K200: 7
A201: 195 | B201: 永恒 | C201: 70410|70319 | D201: =R[-1]C&"|"&RC[-3] -> 186|187|188|189|190|191|192|193|194|195 | F201: 4|3 | G201: 600|60 | H201: 300|30 | I201: 2 | J201: 1 | K201: 7
A202: 196 | B202: 严守格律 | C202: 70411|70305 | D202: =R[-1]C&"|"&RC[-3] -> 186|187|188|189|190|191|192|193|194|195|196 | F202: 1|2 | G202: 90|30 | H202: 45|15 | I202: 2 | J202: 1 | K202: 7
A203: 197 | B203: 抹杀 | C203: 70412|70313 | D203: =R[-1]C&"|"&RC[-3] -> 186|187|188|189|190|191|192|193|194|195|196|197 | F203: 1|3 | G203: 90|30 | H203: 45|15 | I203: 2 | J203: 1 | K203: 7
A204: 198 | B204: 侍奉死亡 | C204: 70413|70302 | D204: =R[-1]C&"|"&RC[-3] -> 186|187|188|189|190|191|192|193|194|195|196|197|198 | F204: 2|3 | G204: 60|60 | H204: 30|30 | I204: 2 | J204: 1 | K204: 7
A205: 199 | B205: 流浪 | C205: 70414|70317 | D205: =R[-1]C&"|"&RC[-3] -> 186|187|188|189|190|191|192|193|194|195|196|197|198|199 | F205: 4|1 | G205: 600|60 | H205: 300|30 | I205: 2 | J205: 1 | K205: 7
A206: 200 | B206: 堕落 | C206: 70415|70314 | D206: =R[-1]C&"|"&RC[-3] -> 186|187|188|189|190|191|192|193|194|195|196|197|198|199|200 | F206: 4|2 | G206: 600|60 | H206: 300|30 | I206: 2 | J206: 1 | K206: 7
A207: 201 | B207: 帝国末日 | C207: 70416|70304 | D207: =R[-1]C&"|"&RC[-3] -> 186|187|188|189|190|191|192|193|194|195|196|197|198|199|200|201 | F207: 4|3 | G207: 600|60 | H207: 300|30 | I207: 2 | J207: 1 | K207: 7
A208: 202 | B208: 星河奔腾 | C208: 70417|70307 | D208: =R[-1]C&"|"&RC[-3] -> 186|187|188|189|190|191|192|193|194|195|196|197|198|199|200|201|202 | F208: 1|2 | G208: 90|30 | H208: 45|15 | I208: 2 | J208: 1 | K208: 7
A209: 203 | B209: 月女祭司 | C209: 70418|70302 | D209: =R[-1]C&"|"&RC[-3] -> 186|187|188|189|190|191|192|193|194|195|196|197|198|199|200|201|202|203 | F209: 1|3 | G209: 90|30 | H209: 45|15 | I209: 2 | J209: 1 | K209: 7
A210: 204 | B210: 熔岩浴 | C210: 70419|70315 | D210: =R[-1]C&"|"&RC[-3] -> 186|187|188|189|190|191|192|193|194|195|196|197|198|199|200|201|202|203|204 | F210: 2|3 | G210: 60|60 | H210: 30|30 | I210: 2 | J210: 1 | K210: 7
A211: 205 | B211: 判决 | C211: 70420|70303 | D211: =R[-1]C&"|"&RC[-3] -> 186|187|188|189|190|191|192|193|194|195|196|197|198|199|200|201|202|203|204|205 | F211: 4|1 | G211: 600|60 | H211: 300|30 | I211: 2 | J211: 1 | K211: 7
A212: 206 | B212: 大魔法 | C212: 70421|70301 | D212: =R[-1]C&"|"&RC[-3] -> 186|187|188|189|190|191|192|193|194|195|196|197|198|199|200|201|202|203|204|205|206 | F212: 4|2 | G212: 600|60 | H212: 300|30 | I212: 2 | J212: 1 | K212: 7
A213: 207 | B213: 正义权柄 | C213: 70422|70311 | D213: =R[-1]C&"|"&RC[-3] -> 186|187|188|189|190|191|192|193|194|195|196|197|198|199|200|201|202|203|204|205|206|207 | F213: 4|3 | G213: 600|60 | H213: 300|30 | I213: 2 | J213: 1 | K213: 7
A214: 208 | B214: 祝愿 | C214: 70423|70306 | D214: =R[-1]C&"|"&RC[-3] -> 186|187|188|189|190|191|192|193|194|195|196|197|198|199|200|201|202|203|204|205|206|207|208 | F214: 1|2 | G214: 90|30 | H214: 45|15 | I214: 2 | J214: 1 | K214: 7
A215: 209 | B215: 贯穿世界 | C215: 70424|70321 | D215: =R[-1]C&"|"&RC[-3] -> 186|187|188|189|190|191|192|193|194|195|196|197|198|199|200|201|202|203|204|205|206|207|208|209 | F215: 1|3 | G215: 90|30 | H215: 45|15 | I215: 2 | J215: 1 | K215: 7
A216: 210 | B216: 守护之剑 | C216: 70425|70324 | D216: =R[-1]C&"|"&RC[-3] -> 186|187|188|189|190|191|192|193|194|195|196|197|198|199|200|201|202|203|204|205|206|207|208|209|210 | F216: 2|3 | G216: 60|60 | H216: 30|30 | I216: 2 | J216: 1 | K216: 7
A217: 211 | B217: 魔法高塔 | C217: 70401|70316 | D217: =R[-1]C&"|"&RC[-3] -> 186|187|188|189|190|191|192|193|194|195|196|197|198|199|200|201|202|203|204|205|206|207|208|209|210|211 | F217: 4|1 | G217: 600|60 | H217: 300|30 | I217: 2 | J217: 1 | K217: 7
A218: 212 | B218: 圣水 | C218: 70402|70323 | D218: =R[-1]C&"|"&RC[-3] -> 186|187|188|189|190|191|192|193|194|195|196|197|198|199|200|201|202|203|204|205|206|207|208|209|210|211|212 | F218: 4|2 | G218: 600|60 | H218: 300|30 | I218: 2 | J218: 1 | K218: 7
A219: 213 | B219: 凤凰 | C219: 70403|70301 | D219: =R[-1]C&"|"&RC[-3] -> 186|187|188|189|190|191|192|193|194|195|196|197|198|199|200|201|202|203|204|205|206|207|208|209|210|211|212|213 | F219: 4|3 | G219: 600|60 | H219: 300|30 | I219: 2 | J219: 1 | K219: 7
A220: 214 | B220: 祭天 | C220: 70404|70302 | D220: =R[-1]C&"|"&RC[-3] -> 186|187|188|189|190|191|192|193|194|195|196|197|198|199|200|201|202|203|204|205|206|207|208|209|210|211|212|213|214 | F220: 1|2 | G220: 90|30 | H220: 45|15 | I220: 2 | J220: 1 | K220: 7
A221: 215 | B221: 君权神授 | C221: 70405|70303 | D221: =R[-1]C&"|"&RC[-3] -> 186|187|188|189|190|191|192|193|194|195|196|197|198|199|200|201|202|203|204|205|206|207|208|209|210|211|212|213|214|215 | F221: 1|3 | G221: 90|30 | H221: 45|15 | I221: 2 | J221: 1 | K221: 7
A222: 216 | B222: 王子 | C222: 70406|70304 | D222: =R[-1]C&"|"&RC[-3] -> 186|187|188|189|190|191|192|193|194|195|196|197|198|199|200|201|202|203|204|205|206|207|208|209|210|211|212|213|214|215|216 | F222: 2|3 | G222: 60|60 | H222: 30|30 | I222: 2 | J222: 1 | K222: 7
A223: 217 | B223: 圣车 | C223: 70407|70305 | D223: =R[-1]C&"|"&RC[-3] -> 186|187|188|189|190|191|192|193|194|195|196|197|198|199|200|201|202|203|204|205|206|207|208|209|210|211|212|213|214|215|216|217 | F223: 4|1 | G223: 600|60 | H223: 300|30 | I223: 2 | J223: 1 | K223: 7
A224: 218 | B224: 力量眷恋 | C224: 70408|70306 | D224: =R[-1]C&"|"&RC[-3] -> 186|187|188|189|190|191|192|193|194|195|196|197|198|199|200|201|202|203|204|205|206|207|208|209|210|211|212|213|214|215|216|217|218 | F224: 4|2 | G224: 600|60 | H224: 300|30 | I224: 2 | J224: 1 | K224: 7
A225: 219 | B225: 无形轨迹 | C225: 70409|70307 | D225: =R[-1]C&"|"&RC[-3] -> 186|187|188|189|190|191|192|193|194|195|196|197|198|199|200|201|202|203|204|205|206|207|208|209|210|211|212|213|214|215|216|217|218|219 | F225: 4|3 | G225: 600|60 | H225: 300|30 | I225: 2 | J225: 1 | K225: 7
A226: 220 | B226: 逆转 | C226: 70410|70308 | D226: =R[-1]C&"|"&RC[-3] -> 186|187|188|189|190|191|192|193|194|195|196|197|198|199|200|201|202|203|204|205|206|207|208|209|210|211|212|213|214|215|216|217|218|219|220 | F226: 1|2 | G226: 90|30 | H226: 45|15 | I226: 2 | J226: 1 | K226: 7
A227: 221 | B227: 义贼 | C227: 70411|70309 | D227: =R[-1]C&"|"&RC[-3] -> 186|187|188|189|190|191|192|193|194|195|196|197|198|199|200|201|202|203|204|205|206|207|208|209|210|211|212|213|214|215|216|217|218|219|220|221 | F227: 1|3 | G227: 90|30 | H227: 45|15 | I227: 2 | J227: 1 | K227: 7
A228: 222 | B228: 倒计时 | C228: 70412|70310 | D228: =R[-1]C&"|"&RC[-3] -> 186|187|188|189|190|191|192|193|194|195|196|197|198|199|200|201|202|203|204|205|206|207|208|209|210|211|212|213|214|215|216|217|218|219|220|221|222 | F228: 2|3 | G228: 60|60 | H228: 30|30 | I228: 2 | J228: 1 | K228: 7
A229: 223 | B229: 风之旅 | C229: 70401|70407 | D229: =R[-1]C&"|"&RC[-3] -> 186|187|188|189|190|191|192|193|194|195|196|197|198|199|200|201|202|203|204|205|206|207|208|209|210|211|212|213|214|215|216|217|218|219|220|221|222|223 | E229: 橙+橙 | F229: 4|1 | G229: 720|72 | H229: 360|36 | I229: 2 | J229: 1 | K229: 7
A230: 224 | B230: 救赎之时 | C230: 70402|70410 | D230: =R[-1]C&"|"&RC[-3] -> 186|187|188|189|190|191|192|193|194|195|196|197|198|199|200|201|202|203|204|205|206|207|208|209|210|211|212|213|214|215|216|217|218|219|220|221|222|223|224 | F230: 4|2 | G230: 720|72 | H230: 360|36 | I230: 2 | J230: 1 | K230: 7
A231: 225 | B231: 凭仗 | C231: 70403|70408 | D231: =R[-1]C&"|"&RC[-3] -> 186|187|188|189|190|191|192|193|194|195|196|197|198|199|200|201|202|203|204|205|206|207|208|209|210|211|212|213|214|215|216|217|218|219|220|221|222|223|224|225 | F231: 4|3 | G231: 720|72 | H231: 360|36 | I231: 2 | J231: 1 | K231: 7
A232: 226 | B232: 帝星 | C232: 70404|70417 | D232: =R[-1]C&"|"&RC[-3] -> 186|187|188|189|190|191|192|193|194|195|196|197|198|199|200|201|202|203|204|205|206|207|208|209|210|211|212|213|214|215|216|217|218|219|220|221|222|223|224|225|226 | F232: 1|2 | G232: 108|36 | H232: 54|18 | I232: 2 | J232: 1 | K232: 7
A233: 227 | B233: 黑暗教父 | C233: 70405|70415 | D233: =R[-1]C&"|"&RC[-3] -> 186|187|188|189|190|191|192|193|194|195|196|197|198|199|200|201|202|203|204|205|206|207|208|209|210|211|212|213|214|215|216|217|218|219|220|221|222|223|224|225|226|227 | F233: 1|3 | G233: 108|36 | H233: 54|18 | I233: 2 | J233: 1 | K233: 7
A234: 228 | B234: 赴死 | C234: 70406|70412 | D234: =R[-1]C&"|"&RC[-3] -> 186|187|188|189|190|191|192|193|194|195|196|197|198|199|200|201|202|203|204|205|206|207|208|209|210|211|212|213|214|215|216|217|218|219|220|221|222|223|224|225|226|227|228 | F234: 2|3 | G234: 72|72 | H234: 36|36 | I234: 2 | J234: 1 | K234: 7
A235: 229 | B235: 巡夜 | C235: 70407|70418 | D235: =R[-1]C&"|"&RC[-3] -> 186|187|188|189|190|191|192|193|194|195|196|197|198|199|200|201|202|203|204|205|206|207|208|209|210|211|212|213|214|215|216|217|218|219|220|221|222|223|224|225|226|227|228|229 | F235: 4|1 | G235: 720|72 | H235: 360|36 | I235: 2 | J235: 1 | K235: 7
A236: 230 | B236: 丛林法则 | C236: 70408|70421 | D236: =R[-1]C&"|"&RC[-3] -> 186|187|188|189|190|191|192|193|194|195|196|197|198|199|200|201|202|203|204|205|206|207|208|209|210|211|212|213|214|215|216|217|218|219|220|221|222|223|224|225|226|227|228|229|230 | F236: 4|2 | G236: 720|72 | H236: 360|36 | I236: 2 | J236: 1 | K236: 7
A237: 231 | B237: 皇女 | C237: 70409|70403 | D237: =R[-1]C&"|"&RC[-3] -> 186|187|188|189|190|191|192|193|194|195|196|197|198|199|200|201|202|203|204|205|206|207|208|209|210|211|212|213|214|215|216|217|218|219|220|221|222|223|224|225|226|227|228|229|230|231 | F237: 4|3 | G237: 720|72 | H237: 360|36 | I237: 2 | J237: 1 | K237: 7
A238: 232 | B238: 无处可逃 | C238: 70410|70413 | D238: =R[-1]C&"|"&RC[-3] -> 186|187|188|189|190|191|192|193|194|195|196|197|198|199|200|201|202|203|204|205|206|207|208|209|210|211|212|213|214|215|216|217|218|219|220|221|222|223|224|225|226|227|228|229|230|231|232 | F238: 1|2 | G238: 108|36 | H238: 54|18 | I238: 2 | J238: 1 | K238: 7
A239: 233 | B239: 煌煌 | C239: 70411|70419 | D239: =R[-1]C&"|"&RC[-3] -> 186|187|188|189|190|191|192|193|194|195|196|197|198|199|200|201|202|203|204|205|206|207|208|209|210|211|212|213|214|215|216|217|218|219|220|221|222|223|224|225|226|227|228|229|230|231|232|233 | F239: 1|3 | G239: 108|36 | H239: 54|18 | I239: 2 | J239: 1 | K239: 7
A240: 234 | B240: 致命魔术 | C240: 70412|70401 | D240: =R[-1]C&"|"&RC[-3] -> 186|187|188|189|190|191|192|193|194|195|196|197|198|199|200|201|202|203|204|205|206|207|208|209|210|211|212|213|214|215|216|217|218|219|220|221|222|223|224|225|226|227|228|229|230|231|232|233|234 | F240: 2|3 | G240: 72|72 | H240: 36|36 | I240: 2 | J240: 1 | K240: 7
A241: 235 | B241: 冥王 | C241: 70413|70404 | D241: =R[-1]C&"|"&RC[-3] -> 186|187|188|189|190|191|192|193|194|195|196|197|198|199|200|201|202|203|204|205|206|207|208|209|210|211|212|213|214|215|216|217|218|219|220|221|222|223|224|225|226|227|228|229|230|231|232|233|234|235 | F241: 4|1 | G241: 720|72 | H241: 360|36 | I241: 2 | J241: 1 | K241: 7
A242: 236 | B242: 挥霍者 | C242: 70414|70420 | D242: =R[-1]C&"|"&RC[-3] -> 186|187|188|189|190|191|192|193|194|195|196|197|198|199|200|201|202|203|204|205|206|207|208|209|210|211|212|213|214|215|216|217|218|219|220|221|222|223|224|225|226|227|228|229|230|231|232|233|234|235|236 | F242: 4|2 | G242: 720|72 | H242: 360|36 | I242: 2 | J242: 1 | K242: 7
A243: 237 | B243: 燃烧巨剑 | C243: 70415|70424 | D243: =R[-1]C&"|"&RC[-3] -> 186|187|188|189|190|191|192|193|194|195|196|197|198|199|200|201|202|203|204|205|206|207|208|209|210|211|212|213|214|215|216|217|218|219|220|221|222|223|224|225|226|227|228|229|230|231|232|233|234|235|236|237 | F243: 4|3 | G243: 720|72 | H243: 360|36 | I243: 2 | J243: 1 | K243: 7
A244: 238 | B244: 神灵之怒 | C244: 70416|70422 | D244: =R[-1]C&"|"&RC[-3] -> 186|187|188|189|190|191|192|193|194|195|196|197|198|199|200|201|202|203|204|205|206|207|208|209|210|211|212|213|214|215|216|217|218|219|220|221|222|223|224|225|226|227|228|229|230|231|232|233|234|235|236|237|238 | F244: 1|2 | G244: 108|36 | H244: 54|18 | I244: 2 | J244: 1 | K244: 7
A245: 239 | B245: 星光 | C245: 70417|70414 | D245: =R[-1]C&"|"&RC[-3] -> 186|187|188|189|190|191|192|193|194|195|196|197|198|199|200|201|202|203|204|205|206|207|208|209|210|211|212|213|214|215|216|217|218|219|220|221|222|223|224|225|226|227|228|229|230|231|232|233|234|235|236|237|238|239 | F245: 1|3 | G245: 108|36 | H245: 54|18 | I245: 2 | J245: 1 | K245: 7
A246: 240 | B246: 星月相伴 | C246: 70418|70425 | D246: =R[-1]C&"|"&RC[-3] -> 186|187|188|189|190|191|192|193|194|195|196|197|198|199|200|201|202|203|204|205|206|207|208|209|210|211|212|213|214|215|216|217|218|219|220|221|222|223|224|225|226|227|228|229|230|231|232|233|234|235|236|237|238|239|240 | F246: 2|3 | G246: 72|72 | H246: 36|36 | I246: 2 | J246: 1 | K246: 7
A247: 241 | B247: 神圣祭祀 | C247: 70419|70402 | D247: =R[-1]C&"|"&RC[-3] -> 186|187|188|189|190|191|192|193|194|195|196|197|198|199|200|201|202|203|204|205|206|207|208|209|210|211|212|213|214|215|216|217|218|219|220|221|222|223|224|225|226|227|228|229|230|231|232|233|234|235|236|237|238|239|240|241 | F247: 4|1 | G247: 720|72 | H247: 360|36 | I247: 2 | J247: 1 | K247: 7
A248: 242 | B248: 罪人之血 | C248: 70420|70423 | D248: =R[-1]C&"|"&RC[-3] -> 186|187|188|189|190|191|192|193|194|195|196|197|198|199|200|201|202|203|204|205|206|207|208|209|210|211|212|213|214|215|216|217|218|219|220|221|222|223|224|225|226|227|228|229|230|231|232|233|234|235|236|237|238|239|240|241|242 | F248: 4|2 | G248: 720|72 | H248: 360|36 | I248: 2 | J248: 1 | K248: 7
A249: 243 | B249: 唯一至高 | C249: 70421|70405 | D249: =R[-1]C&"|"&RC[-3] -> 186|187|188|189|190|191|192|193|194|195|196|197|198|199|200|201|202|203|204|205|206|207|208|209|210|211|212|213|214|215|216|217|218|219|220|221|222|223|224|225|226|227|228|229|230|231|232|233|234|235|236|237|238|239|240|241|242|243 | F249: 4|3 | G249: 720|72 | H249: 360|36 | I249: 2 | J249: 1 | K249: 7
A250: 244 | B250: 苦行者 | C250: 70422|70409 | D250: =R[-1]C&"|"&RC[-3] -> 186|187|188|189|190|191|192|193|194|195|196|197|198|199|200|201|202|203|204|205|206|207|208|209|210|211|212|213|214|215|216|217|218|219|220|221|222|223|224|225|226|227|228|229|230|231|232|233|234|235|236|237|238|239|240|241|242|243|244 | F250: 1|2 | G250: 108|36 | H250: 54|18 | I250: 2 | J250: 1 | K250: 7
A251: 245 | B251: 理所应当 | C251: 70423|70411 | D251: =R[-1]C&"|"&RC[-3] -> 186|187|188|189|190|191|192|193|194|195|196|197|198|199|200|201|202|203|204|205|206|207|208|209|210|211|212|213|214|215|216|217|218|219|220|221|222|223|224|225|226|227|228|229|230|231|232|233|234|235|236|237|238|239|240|241|242|243|244|245 | F251: 1|3 | G251: 108|36 | H251: 54|18 | I251: 2 | J251: 1 | K251: 7
A252: 246 | B252: 春之刃 | C252: 70424|70406 | D252: =R[-1]C&"|"&RC[-3] -> 186|187|188|189|190|191|192|193|194|195|196|197|198|199|200|201|202|203|204|205|206|207|208|209|210|211|212|213|214|215|216|217|218|219|220|221|222|223|224|225|226|227|228|229|230|231|232|233|234|235|236|237|238|239|240|241|242|243|244|245|246 | F252: 2|3 | G252: 72|72 | H252: 36|36 | I252: 2 | J252: 1 | K252: 7
A253: 247 | B253: 星辰高塔 | C253: 70425|70416 | D253: =R[-1]C&"|"&RC[-3] -> 186|187|188|189|190|191|192|193|194|195|196|197|198|199|200|201|202|203|204|205|206|207|208|209|210|211|212|213|214|215|216|217|218|219|220|221|222|223|224|225|226|227|228|229|230|231|232|233|234|235|236|237|238|239|240|241|242|243|244|245|246|247 | F253: 4|1 | G253: 720|72 | H253: 360|36 | I253: 2 | J253: 1 | K253: 7
A254: 248 | B254: 亡者守护 | C254: 70413|70425 | D254: =R[-1]C&"|"&RC[-3] -> 186|187|188|189|190|191|192|193|194|195|196|197|198|199|200|201|202|203|204|205|206|207|208|209|210|211|212|213|214|215|216|217|218|219|220|221|222|223|224|225|226|227|228|229|230|231|232|233|234|235|236|237|238|239|240|241|242|243|244|245|246|247|248 | F254: 4|2 | G254: 720|72 | H254: 360|36 | I254: 2 | J254: 1 | K254: 7
A255: 249 | B255: 贫穷誓约 | C255: 70414|70424 | D255: =R[-1]C&"|"&RC[-3] -> 186|187|188|189|190|191|192|193|194|195|196|197|198|199|200|201|202|203|204|205|206|207|208|209|210|211|212|213|214|215|216|217|218|219|220|221|222|223|224|225|226|227|228|229|230|231|232|233|234|235|236|237|238|239|240|241|242|243|244|245|246|247|248|249 | F255: 4|3 | G255: 720|72 | H255: 360|36 | I255: 2 | J255: 1 | K255: 7
A256: 250 | B256: 污染之杯 | C256: 70415|70423 | D256: =R[-1]C&"|"&RC[-3] -> 186|187|188|189|190|191|192|193|194|195|196|197|198|199|200|201|202|203|204|205|206|207|208|209|210|211|212|213|214|215|216|217|218|219|220|221|222|223|224|225|226|227|228|229|230|231|232|233|234|235|236|237|238|239|240|241|242|243|244|245|246|247|248|249|250 | F256: 1|2 | G256: 108|36 | H256: 54|18 | I256: 2 | J256: 1 | K256: 7
A257: 251 | B257: 世界末日 | C257: 70416|70421 | D257: =R[-1]C&"|"&RC[-3] -> 186|187|188|189|190|191|192|193|194|195|196|197|198|199|200|201|202|203|204|205|206|207|208|209|210|211|212|213|214|215|216|217|218|219|220|221|222|223|224|225|226|227|228|229|230|231|232|233|234|235|236|237|238|239|240|241|242|243|244|245|246|247|248|249|250|251 | F257: 1|3 | G257: 108|36 | H257: 54|18 | I257: 2 | J257: 1 | K257: 7
A258: 252 | B258: 星光权杖 | C258: 70417|70422 | D258: =R[-1]C&"|"&RC[-3] -> 186|187|188|189|190|191|192|193|194|195|196|197|198|199|200|201|202|203|204|205|206|207|208|209|210|211|212|213|214|215|216|217|218|219|220|221|222|223|224|225|226|227|228|229|230|231|232|233|234|235|236|237|238|239|240|241|242|243|244|245|246|247|248|249|250|251|252 | F258: 2|3 | G258: 72|72 | H258: 36|36 | I258: 2 | J258: 1 | K258: 7
A259: 253 | B259: 月亮审判 | C259: 70418|70420 | D259: =R[-1]C&"|"&RC[-3] -> 186|187|188|189|190|191|192|193|194|195|196|197|198|199|200|201|202|203|204|205|206|207|208|209|210|211|212|213|214|215|216|217|218|219|220|221|222|223|224|225|226|227|228|229|230|231|232|233|234|235|236|237|238|239|240|241|242|243|244|245|246|247|248|249|250|251|252|253 | F259: 4|1 | G259: 720|72 | H259: 360|36 | I259: 2 | J259: 1 | K259: 7
A260: 254 | B260: 天外 | C260: 70419|70418 | D260: =R[-1]C&"|"&RC[-3] -> 186|187|188|189|190|191|192|193|194|195|196|197|198|199|200|201|202|203|204|205|206|207|208|209|210|211|212|213|214|215|216|217|218|219|220|221|222|223|224|225|226|227|228|229|230|231|232|233|234|235|236|237|238|239|240|241|242|243|244|245|246|247|248|249|250|251|252|253|254 | F260: 4|2 | G260: 720|72 | H260: 360|36 | I260: 2 | J260: 1 | K260: 7
A261: 255 | B261: 审判日 | C261: 70420|70419 | D261: =R[-1]C&"|"&RC[-3] -> 186|187|188|189|190|191|192|193|194|195|196|197|198|199|200|201|202|203|204|205|206|207|208|209|210|211|212|213|214|215|216|217|218|219|220|221|222|223|224|225|226|227|228|229|230|231|232|233|234|235|236|237|238|239|240|241|242|243|244|245|246|247|248|249|250|251|252|253|254|255 | F261: 4|3 | G261: 720|72 | H261: 360|36 | I261: 2 | J261: 1 | K261: 7
A262: 256 | B262: 宇宙 | C262: 70421|70417 | D262: =R[-1]C&"|"&RC[-3] -> 186|187|188|189|190|191|192|193|194|195|196|197|198|199|200|201|202|203|204|205|206|207|208|209|210|211|212|213|214|215|216|217|218|219|220|221|222|223|224|225|226|227|228|229|230|231|232|233|234|235|236|237|238|239|240|241|242|243|244|245|246|247|248|249|250|251|252|253|254|255|256 | F262: 1|2 | G262: 108|36 | H262: 54|18 | I262: 2 | J262: 1 | K262: 7
A263: 257 | B263: 恶魔权杖 | C263: 70422|70415 | D263: =R[-1]C&"|"&RC[-3] -> 186|187|188|189|190|191|192|193|194|195|196|197|198|199|200|201|202|203|204|205|206|207|208|209|210|211|212|213|214|215|216|217|218|219|220|221|222|223|224|225|226|227|228|229|230|231|232|233|234|235|236|237|238|239|240|241|242|243|244|245|246|247|248|249|250|251|252|253|254|255|256|257 | F263: 1|3 | G263: 108|36 | H263: 54|18 | I263: 2 | J263: 1 | K263: 7
A264: 258 | B264: 毁灭誓言 | C264: 70423|70416 | D264: =R[-1]C&"|"&RC[-3] -> 186|187|188|189|190|191|192|193|194|195|196|197|198|199|200|201|202|203|204|205|206|207|208|209|210|211|212|213|214|215|216|217|218|219|220|221|222|223|224|225|226|227|228|229|230|231|232|233|234|235|236|237|238|239|240|241|242|243|244|245|246|247|248|249|250|251|252|253|254|255|256|257|258 | F264: 2|3 | G264: 72|72 | H264: 36|36 | I264: 2 | J264: 1 | K264: 7
A265: 259 | B265: 死之剑 | C265: 70424|70413 | D265: =R[-1]C&"|"&RC[-3] -> 186|187|188|189|190|191|192|193|194|195|196|197|198|199|200|201|202|203|204|205|206|207|208|209|210|211|212|213|214|215|216|217|218|219|220|221|222|223|224|225|226|227|228|229|230|231|232|233|234|235|236|237|238|239|240|241|242|243|244|245|246|247|248|249|250|251|252|253|254|255|256|257|258|259 | F265: 4|1 | G265: 720|72 | H265: 360|36 | I265: 2 | J265: 1 | K265: 7
A266: 260 | B266: 积少成多 | C266: 70425|70414 | D266: =R[-1]C&"|"&RC[-3] -> 186|187|188|189|190|191|192|193|194|195|196|197|198|199|200|201|202|203|204|205|206|207|208|209|210|211|212|213|214|215|216|217|218|219|220|221|222|223|224|225|226|227|228|229|230|231|232|233|234|235|236|237|238|239|240|241|242|243|244|245|246|247|248|249|250|251|252|253|254|255|256|257|258|259|260 | F266: 4|2 | G266: 720|72 | H266: 360|36 | I266: 2 | J266: 1 | K266: 7
A267: 261 | B267: 神圣魔法 | C267: 70401|70402|70311 | D267: =RC[-3] -> 261 | E267: 橙+橙+紫 | F267: 4|3 | G267: 840|84 | H267: 420|42 | I267: 2 | J267: 1 | K267: 7
A268: 262 | B268: 圣人受刑 | C268: 70402|70420|70312 | D268: =R[-1]C&"|"&RC[-3] -> 261|262 | F268: 1|2 | G268: 126|42 | H268: 63|21 | I268: 2 | J268: 1 | K268: 7
A269: 263 | B269: 死之守护 | C269: 70403|70425|70313 | D269: =R[-1]C&"|"&RC[-3] -> 261|262|263 | F269: 1|3 | G269: 126|42 | H269: 63|21 | I269: 2 | J269: 1 | K269: 7
A270: 264 | B270: 帝王之剑 | C270: 70404|70424|70314 | D270: =R[-1]C&"|"&RC[-3] -> 261|262|263|264 | F270: 2|3 | G270: 84|84 | H270: 42|42 | I270: 2 | J270: 1 | K270: 7
A271: 265 | B271: 月夜之光 | C271: 70405|70418|70315 | D271: =R[-1]C&"|"&RC[-3] -> 261|262|263|264|265 | F271: 4|1 | G271: 840|84 | H271: 420|42 | I271: 2 | J271: 1 | K271: 7
A272: 266 | B272: 毁灭前夕 | C272: 70406|70419|70316 | D272: =R[-1]C&"|"&RC[-3] -> 261|262|263|264|265|266 | F272: 4|2 | G272: 840|84 | H272: 420|42 | I272: 2 | J272: 1 | K272: 7
A273: 267 | B273: 奔赴天堂 | C273: 70407|70411|70317 | D273: =R[-1]C&"|"&RC[-3] -> 261|262|263|264|265|266|267 | F273: 4|3 | G273: 840|84 | H273: 420|42 | I273: 2 | J273: 1 | K273: 7
A274: 268 | B274: 钓月人 | C274: 70408|70412|70318 | D274: =R[-1]C&"|"&RC[-3] -> 261|262|263|264|265|266|267|268 | F274: 1|2 | G274: 126|42 | H274: 63|21 | I274: 2 | J274: 1 | K274: 7
A275: 269 | B275: 无光之日 | C275: 70409|70408|70319 | D275: =R[-1]C&"|"&RC[-3] -> 261|262|263|264|265|266|267|268|269 | F275: 1|3 | G275: 126|42 | H275: 63|21 | I275: 2 | J275: 1 | K275: 7
A276: 270 | B276: 终焉之轮 | C276: 70410|70409|70320 | D276: =R[-1]C&"|"&RC[-3] -> 261|262|263|264|265|266|267|268|269|270 | F276: 2|3 | G276: 84|84 | H276: 42|42 | I276: 2 | J276: 1 | K276: 7
A277: 271 | B277: 救世主 | C277: 70411|70401|70321 | D277: =R[-1]C&"|"&RC[-3] -> 261|262|263|264|265|266|267|268|269|270|271 | F277: 4|1 | G277: 840|84 | H277: 420|42 | I277: 2 | J277: 1 | K277: 7
A278: 272 | B278: 皇权落幕 | C278: 70412|70404|70322 | D278: =R[-1]C&"|"&RC[-3] -> 261|262|263|264|265|266|267|268|269|270|271|272 | F278: 4|2 | G278: 840|84 | H278: 420|42 | I278: 2 | J278: 1 | K278: 7
A279: 273 | B279: 痛苦的抉择 | C279: 70413|70406|70323 | D279: =R[-1]C&"|"&RC[-3] -> 261|262|263|264|265|266|267|268|269|270|271|272|273 | F279: 4|3 | G279: 840|84 | H279: 420|42 | I279: 2 | J279: 1 | K279: 7
A280: 274 | B280: 永无停歇 | C280: 70414|70407|70324 | D280: =R[-1]C&"|"&RC[-3] -> 261|262|263|264|265|266|267|268|269|270|271|272|273|274 | F280: 1|2 | G280: 126|42 | H280: 63|21 | I280: 2 | J280: 1 | K280: 7
A281: 275 | B281: 厄运诅咒 | C281: 70415|70410|70325 | D281: =R[-1]C&"|"&RC[-3] -> 261|262|263|264|265|266|267|268|269|270|271|272|273|274|275 | F281: 1|3 | G281: 126|42 | H281: 63|21 | I281: 2 | J281: 1 | K281: 7
A282: 276 | B282: 神秘毁灭者 | C282: 70416|70403|70301 | D282: =R[-1]C&"|"&RC[-3] -> 261|262|263|264|265|266|267|268|269|270|271|272|273|274|275|276 | F282: 2|3 | G282: 84|84 | H282: 42|42 | I282: 2 | J282: 1 | K282: 7
A283: 277 | B283: 神国 | C283: 70417|70405|70302 | D283: =R[-1]C&"|"&RC[-3] -> 261|262|263|264|265|266|267|268|269|270|271|272|273|274|275|276|277 | F283: 4|1 | G283: 840|84 | H283: 420|42 | I283: 2 | J283: 1 | K283: 7
A284: 278 | B284: 倾诉 | C284: 70418|70406|70303 | D284: =R[-1]C&"|"&RC[-3] -> 261|262|263|264|265|266|267|268|269|270|271|272|273|274|275|276|277|278 | F284: 4|2 | G284: 840|84 | H284: 420|42 | I284: 2 | J284: 1 | K284: 7
A285: 279 | B285: 太阳魔法 | C285: 70419|70401|70304 | D285: =R[-1]C&"|"&RC[-3] -> 261|262|263|264|265|266|267|268|269|270|271|272|273|274|275|276|277|278|279 | F285: 4|3 | G285: 840|84 | H285: 420|42 | I285: 2 | J285: 1 | K285: 7
A286: 280 | B286: 光辉审判 | C286: 70420|70402|70305 | D286: =R[-1]C&"|"&RC[-3] -> 261|262|263|264|265|266|267|268|269|270|271|272|273|274|275|276|277|278|279|280 | F286: 1|2 | G286: 126|42 | H286: 63|21 | I286: 2 | J286: 1 | K286: 7
A287: 281 | B287: 无私之爱 | C287: 70421|70403|70306 | D287: =R[-1]C&"|"&RC[-3] -> 261|262|263|264|265|266|267|268|269|270|271|272|273|274|275|276|277|278|279|280|281 | F287: 1|3 | G287: 126|42 | H287: 63|21 | I287: 2 | J287: 1 | K287: 7
A288: 282 | B288: 征服之王 | C288: 70422|70404|70307 | D288: =R[-1]C&"|"&RC[-3] -> 261|262|263|264|265|266|267|268|269|270|271|272|273|274|275|276|277|278|279|280|281|282 | F288: 2|3 | G288: 84|84 | H288: 42|42 | I288: 2 | J288: 1 | K288: 7
A289: 283 | B289: 信仰之力 | C289: 70423|70405|70308 | D289: =R[-1]C&"|"&RC[-3] -> 261|262|263|264|265|266|267|268|269|270|271|272|273|274|275|276|277|278|279|280|281|282|283 | F289: 4|1 | G289: 840|84 | H289: 420|42 | I289: 2 | J289: 1 | K289: 7
A290: 284 | B290: 湮没 | C290: 70424|70407|70309 | D290: =R[-1]C&"|"&RC[-3] -> 261|262|263|264|265|266|267|268|269|270|271|272|273|274|275|276|277|278|279|280|281|282|283|284 | F290: 4|2 | G290: 840|84 | H290: 420|42 | I290: 2 | J290: 1 | K290: 7
A291: 285 | B291: 命运眷顾 | C291: 70425|70408|70310 | D291: =R[-1]C&"|"&RC[-3] -> 261|262|263|264|265|266|267|268|269|270|271|272|273|274|275|276|277|278|279|280|281|282|283|284|285 | F291: 4|3 | G291: 840|84 | H291: 420|42 | I291: 2 | J291: 1 | K291: 7
A292: 286 | B292: 魔导师 | C292: 70401|70409|70311 | D292: =R[-1]C&"|"&RC[-3] -> 261|262|263|264|265|266|267|268|269|270|271|272|273|274|275|276|277|278|279|280|281|282|283|284|285|286 | F292: 1|2 | G292: 126|42 | H292: 63|21 | I292: 2 | J292: 1 | K292: 7
A293: 287 | B293: 神赐 | C293: 70402|70410|70312 | D293: =R[-1]C&"|"&RC[-3] -> 261|262|263|264|265|266|267|268|269|270|271|272|273|274|275|276|277|278|279|280|281|282|283|284|285|286|287 | F293: 1|3 | G293: 126|42 | H293: 63|21 | I293: 2 | J293: 1 | K293: 7
A294: 288 | B294: 无所畏惧 | C294: 70403|70411|70313 | D294: =R[-1]C&"|"&RC[-3] -> 261|262|263|264|265|266|267|268|269|270|271|272|273|274|275|276|277|278|279|280|281|282|283|284|285|286|287|288 | F294: 2|3 | G294: 84|84 | H294: 42|42 | I294: 2 | J294: 1 | K294: 7
A295: 289 | B295: 围城 | C295: 70404|70412|70314 | D295: =R[-1]C&"|"&RC[-3] -> 261|262|263|264|265|266|267|268|269|270|271|272|273|274|275|276|277|278|279|280|281|282|283|284|285|286|287|288|289 | F295: 4|1 | G295: 840|84 | H295: 420|42 | I295: 2 | J295: 1 | K295: 7
A296: 290 | B296: 巫妖王 | C296: 70405|70413|70315 | D296: =R[-1]C&"|"&RC[-3] -> 261|262|263|264|265|266|267|268|269|270|271|272|273|274|275|276|277|278|279|280|281|282|283|284|285|286|287|288|289|290 | F296: 4|2 | G296: 840|84 | H296: 420|42 | I296: 2 | J296: 1 | K296: 7
A297: 291 | B297: 坚持 | C297: 70406|70414|70316 | D297: =R[-1]C&"|"&RC[-3] -> 261|262|263|264|265|266|267|268|269|270|271|272|273|274|275|276|277|278|279|280|281|282|283|284|285|286|287|288|289|290|291 | F297: 4|3 | G297: 840|84 | H297: 420|42 | I297: 2 | J297: 1 | K297: 7
A298: 292 | B298: 地狱火 | C298: 70407|70415|70317 | D298: =R[-1]C&"|"&RC[-3] -> 261|262|263|264|265|266|267|268|269|270|271|272|273|274|275|276|277|278|279|280|281|282|283|284|285|286|287|288|289|290|291|292 | F298: 1|2 | G298: 126|42 | H298: 63|21 | I298: 2 | J298: 1 | K298: 7
A299: 293 | B299: 月亮的终末 | C299: 70408|70416|70318 | D299: =R[-1]C&"|"&RC[-3] -> 261|262|263|264|265|266|267|268|269|270|271|272|273|274|275|276|277|278|279|280|281|282|283|284|285|286|287|288|289|290|291|292|293 | F299: 1|3 | G299: 126|42 | H299: 63|21 | I299: 2 | J299: 1 | K299: 7
A300: 294 | B300: 意志磨练 | C300: 70409|70417|70319 | D300: =R[-1]C&"|"&RC[-3] -> 261|262|263|264|265|266|267|268|269|270|271|272|273|274|275|276|277|278|279|280|281|282|283|284|285|286|287|288|289|290|291|292|293|294 | F300: 2|3 | G300: 84|84 | H300: 42|42 | I300: 2 | J300: 1 | K300: 7
A301: 295 | B301: 命运宣告 | C301: 70410|70422|70320 | D301: =R[-1]C&"|"&RC[-3] -> 261|262|263|264|265|266|267|268|269|270|271|272|273|274|275|276|277|278|279|280|281|282|283|284|285|286|287|288|289|290|291|292|293|294|295 | F301: 4|1 | G301: 840|84 | H301: 420|42 | I301: 2 | J301: 1 | K301: 7
A302: 296 | B302: 宫廷法师 | C302: 70401|70421|70403 | D302: =R[-1]C&"|"&RC[-3] -> 261|262|263|264|265|266|267|268|269|270|271|272|273|274|275|276|277|278|279|280|281|282|283|284|285|286|287|288|289|290|291|292|293|294|295|296 | E302: 橙+橙+橙 | F302: 4|2 | G302: 960|96 | H302: 480|48 | I302: 2 | J302: 1 | K302: 7
A303: 297 | B303: 万能的魔法 | C303: 70402|70423|70401 | D303: =R[-1]C&"|"&RC[-3] -> 261|262|263|264|265|266|267|268|269|270|271|272|273|274|275|276|277|278|279|280|281|282|283|284|285|286|287|288|289|290|291|292|293|294|295|296|297 | F303: 4|3 | G303: 960|96 | H303: 480|48 | I303: 2 | J303: 1 | K303: 7
A304: 298 | B304: 魅魔 | C304: 70403|70415|70405 | D304: =R[-1]C&"|"&RC[-3] -> 261|262|263|264|265|266|267|268|269|270|271|272|273|274|275|276|277|278|279|280|281|282|283|284|285|286|287|288|289|290|291|292|293|294|295|296|297|298 | F304: 1|2 | G304: 144|48 | H304: 72|24 | I304: 2 | J304: 1 | K304: 7
A305: 299 | B305: 征服与毁灭 | C305: 70404|70416|70407 | D305: =R[-1]C&"|"&RC[-3] -> 261|262|263|264|265|266|267|268|269|270|271|272|273|274|275|276|277|278|279|280|281|282|283|284|285|286|287|288|289|290|291|292|293|294|295|296|297|298|299 | F305: 1|3 | G305: 144|48 | H305: 72|24 | I305: 2 | J305: 1 | K305: 7
A306: 300 | B306: 披星戴月 | C306: 70405|70417|70409 | D306: =R[-1]C&"|"&RC[-3] -> 261|262|263|264|265|266|267|268|269|270|271|272|273|274|275|276|277|278|279|280|281|282|283|284|285|286|287|288|289|290|291|292|293|294|295|296|297|298|299|300 | F306: 2|3 | G306: 96|96 | H306: 48|48 | I306: 2 | J306: 1 | K306: 7
A307: 301 | B307: 许愿 | C307: 70406|70418|70411 | D307: =R[-1]C&"|"&RC[-3] -> 261|262|263|264|265|266|267|268|269|270|271|272|273|274|275|276|277|278|279|280|281|282|283|284|285|286|287|288|289|290|291|292|293|294|295|296|297|298|299|300|301 | F307: 4|1 | G307: 960|96 | H307: 480|48 | I307: 2 | J307: 1 | K307: 7
A308: 302 | B308: 干枯的大地 | C308: 70407|70419|70413 | D308: =R[-1]C&"|"&RC[-3] -> 261|262|263|264|265|266|267|268|269|270|271|272|273|274|275|276|277|278|279|280|281|282|283|284|285|286|287|288|289|290|291|292|293|294|295|296|297|298|299|300|301|302 | F308: 4|2 | G308: 960|96 | H308: 480|48 | I308: 2 | J308: 1 | K308: 7
A309: 303 | B309: 恶魔审判 | C309: 70408|70420|70415 | D309: =R[-1]C&"|"&RC[-3] -> 261|262|263|264|265|266|267|268|269|270|271|272|273|274|275|276|277|278|279|280|281|282|283|284|285|286|287|288|289|290|291|292|293|294|295|296|297|298|299|300|301|302|303 | F309: 4|3 | G309: 960|96 | H309: 480|48 | I309: 2 | J309: 1 | K309: 7
A310: 304 | B310: 气息屏蔽 | C310: 70409|70421|70417 | D310: =R[-1]C&"|"&RC[-3] -> 261|262|263|264|265|266|267|268|269|270|271|272|273|274|275|276|277|278|279|280|281|282|283|284|285|286|287|288|289|290|291|292|293|294|295|296|297|298|299|300|301|302|303|304 | F310: 1|2 | G310: 144|48 | H310: 72|24 | I310: 2 | J310: 1 | K310: 7
A311: 305 | B311: 永恒之日 | C311: 70410|70422|70419 | D311: =R[-1]C&"|"&RC[-3] -> 261|262|263|264|265|266|267|268|269|270|271|272|273|274|275|276|277|278|279|280|281|282|283|284|285|286|287|288|289|290|291|292|293|294|295|296|297|298|299|300|301|302|303|304|305 | F311: 1|3 | G311: 144|48 | H311: 72|24 | I311: 2 | J311: 1 | K311: 7
A312: 306 | B312: 正义守护 | C312: 70411|70423|70425 | D312: =R[-1]C&"|"&RC[-3] -> 261|262|263|264|265|266|267|268|269|270|271|272|273|274|275|276|277|278|279|280|281|282|283|284|285|286|287|288|289|290|291|292|293|294|295|296|297|298|299|300|301|302|303|304|305|306 | F312: 2|3 | G312: 96|96 | H312: 48|48 | I312: 2 | J312: 1 | K312: 7
A313: 307 | B313: 守护者 | C313: 70412|70424|70425 | D313: =R[-1]C&"|"&RC[-3] -> 261|262|263|264|265|266|267|268|269|270|271|272|273|274|275|276|277|278|279|280|281|282|283|284|285|286|287|288|289|290|291|292|293|294|295|296|297|298|299|300|301|302|303|304|305|306|307 | F313: 4|1 | G313: 960|96 | H313: 480|48 | I313: 2 | J313: 1 | K313: 7
A314: 308 | B314: 死神祭祀 | C314: 70413|70402|70401 | D314: =R[-1]C&"|"&RC[-3] -> 261|262|263|264|265|266|267|268|269|270|271|272|273|274|275|276|277|278|279|280|281|282|283|284|285|286|287|288|289|290|291|292|293|294|295|296|297|298|299|300|301|302|303|304|305|306|307|308 | F314: 4|2 | G314: 960|96 | H314: 480|48 | I314: 2 | J314: 1 | K314: 7
A315: 309 | B315: 祷告 | C315: 70414|70404|70402 | D315: =R[-1]C&"|"&RC[-3] -> 261|262|263|264|265|266|267|268|269|270|271|272|273|274|275|276|277|278|279|280|281|282|283|284|285|286|287|288|289|290|291|292|293|294|295|296|297|298|299|300|301|302|303|304|305|306|307|308|309 | F315: 4|3 | G315: 960|96 | H315: 480|48 | I315: 2 | J315: 1 | K315: 7
A316: 310 | B316: 禁忌 | C316: 70415|70406|70403 | D316: =R[-1]C&"|"&RC[-3] -> 261|262|263|264|265|266|267|268|269|270|271|272|273|274|275|276|277|278|279|280|281|282|283|284|285|286|287|288|289|290|291|292|293|294|295|296|297|298|299|300|301|302|303|304|305|306|307|308|309|310 | F316: 1|2 | G316: 144|48 | H316: 72|24 | I316: 2 | J316: 1 | K316: 7
A317: 311 | B317: 毁灭者 | C317: 70416|70408|70404 | D317: =R[-1]C&"|"&RC[-3] -> 261|262|263|264|265|266|267|268|269|270|271|272|273|274|275|276|277|278|279|280|281|282|283|284|285|286|287|288|289|290|291|292|293|294|295|296|297|298|299|300|301|302|303|304|305|306|307|308|309|310|311 | F317: 1|3 | G317: 144|48 | H317: 72|24 | I317: 2 | J317: 1 | K317: 7
A318: 312 | B318: 占星 | C318: 70417|70410|70405 | D318: =R[-1]C&"|"&RC[-3] -> 261|262|263|264|265|266|267|268|269|270|271|272|273|274|275|276|277|278|279|280|281|282|283|284|285|286|287|288|289|290|291|292|293|294|295|296|297|298|299|300|301|302|303|304|305|306|307|308|309|310|311|312 | F318: 2|3 | G318: 96|96 | H318: 48|48 | I318: 2 | J318: 1 | K318: 7
A319: 313 | B319: 月亮之上 | C319: 70418|70412|70406 | D319: =R[-1]C&"|"&RC[-3] -> 261|262|263|264|265|266|267|268|269|270|271|272|273|274|275|276|277|278|279|280|281|282|283|284|285|286|287|288|289|290|291|292|293|294|295|296|297|298|299|300|301|302|303|304|305|306|307|308|309|310|311|312|313 | F319: 4|1 | G319: 960|96 | H319: 480|48 | I319: 2 | J319: 1 | K319: 7
A320: 314 | B320: 阳光大道 | C320: 70419|70414|70407 | D320: =R[-1]C&"|"&RC[-3] -> 261|262|263|264|265|266|267|268|269|270|271|272|273|274|275|276|277|278|279|280|281|282|283|284|285|286|287|288|289|290|291|292|293|294|295|296|297|298|299|300|301|302|303|304|305|306|307|308|309|310|311|312|313|314 | F320: 4|2 | G320: 960|96 | H320: 480|48 | I320: 2 | J320: 1 | K320: 7
A321: 315 | B321: 暴力裁决 | C321: 70420|70416|70408 | D321: =R[-1]C&"|"&RC[-3] -> 261|262|263|264|265|266|267|268|269|270|271|272|273|274|275|276|277|278|279|280|281|282|283|284|285|286|287|288|289|290|291|292|293|294|295|296|297|298|299|300|301|302|303|304|305|306|307|308|309|310|311|312|313|314|315 | F321: 4|3 | G321: 960|96 | H321: 480|48 | I321: 2 | J321: 1 | K321: 7
A322: 316 | B322: 隐没之月 | C322: 70421|70418|70409 | D322: =R[-1]C&"|"&RC[-3] -> 261|262|263|264|265|266|267|268|269|270|271|272|273|274|275|276|277|278|279|280|281|282|283|284|285|286|287|288|289|290|291|292|293|294|295|296|297|298|299|300|301|302|303|304|305|306|307|308|309|310|311|312|313|314|315|316 | F322: 1|2 | G322: 144|48 | H322: 72|24 | I322: 2 | J322: 1 | K322: 7
A323: 317 | B323: 命运权柄 | C323: 70422|70420|70410 | D323: =R[-1]C&"|"&RC[-3] -> 261|262|263|264|265|266|267|268|269|270|271|272|273|274|275|276|277|278|279|280|281|282|283|284|285|286|287|288|289|290|291|292|293|294|295|296|297|298|299|300|301|302|303|304|305|306|307|308|309|310|311|312|313|314|315|316|317 | F323: 1|3 | G323: 144|48 | H323: 72|24 | I323: 2 | J323: 1 | K323: 7
A324: 318 | B324: 一切美好之物 | C324: 70423|70421|70411 | D324: =R[-1]C&"|"&RC[-3] -> 261|262|263|264|265|266|267|268|269|270|271|272|273|274|275|276|277|278|279|280|281|282|283|284|285|286|287|288|289|290|291|292|293|294|295|296|297|298|299|300|301|302|303|304|305|306|307|308|309|310|311|312|313|314|315|316|317|318 | F324: 2|3 | G324: 96|96 | H324: 48|48 | I324: 2 | J324: 1 | K324: 7
A325: 319 | B325: 无双 | C325: 70424|70422|70412 | D325: =R[-1]C&"|"&RC[-3] -> 261|262|263|264|265|266|267|268|269|270|271|272|273|274|275|276|277|278|279|280|281|282|283|284|285|286|287|288|289|290|291|292|293|294|295|296|297|298|299|300|301|302|303|304|305|306|307|308|309|310|311|312|313|314|315|316|317|318|319 | F325: 4|1 | G325: 960|96 | H325: 480|48 | I325: 2 | J325: 1 | K325: 7
A326: 320 | B326: 亡者的归途 | C326: 70425|70423|70413 | D326: =R[-1]C&"|"&RC[-3] -> 261|262|263|264|265|266|267|268|269|270|271|272|273|274|275|276|277|278|279|280|281|282|283|284|285|286|287|288|289|290|291|292|293|294|295|296|297|298|299|300|301|302|303|304|305|306|307|308|309|310|311|312|313|314|315|316|317|318|319|320 | F326: 4|2 | G326: 960|96 | H326: 480|48 | I326: 2 | J326: 1 | K326: 7
A327: 321 | B327: 行义 | C327: 70411|70424|70414 | D327: =R[-1]C&"|"&RC[-3] -> 261|262|263|264|265|266|267|268|269|270|271|272|273|274|275|276|277|278|279|280|281|282|283|284|285|286|287|288|289|290|291|292|293|294|295|296|297|298|299|300|301|302|303|304|305|306|307|308|309|310|311|312|313|314|315|316|317|318|319|320|321 | F327: 4|3 | G327: 960|96 | H327: 480|48 | I327: 2 | J327: 1 | K327: 7
A328: 322 | B328: 搏斗的观赏者 | C328: 70412|70401|70415 | D328: =R[-1]C&"|"&RC[-3] -> 261|262|263|264|265|266|267|268|269|270|271|272|273|274|275|276|277|278|279|280|281|282|283|284|285|286|287|288|289|290|291|292|293|294|295|296|297|298|299|300|301|302|303|304|305|306|307|308|309|310|311|312|313|314|315|316|317|318|319|320|321|322 | F328: 1|2 | G328: 144|48 | H328: 72|24 | I328: 2 | J328: 1 | K328: 7
A329: 323 | B329: 毁灭之时到来 | C329: 70413|70402|70416 | D329: =R[-1]C&"|"&RC[-3] -> 261|262|263|264|265|266|267|268|269|270|271|272|273|274|275|276|277|278|279|280|281|282|283|284|285|286|287|288|289|290|291|292|293|294|295|296|297|298|299|300|301|302|303|304|305|306|307|308|309|310|311|312|313|314|315|316|317|318|319|320|321|322|323 | F329: 1|3 | G329: 144|48 | H329: 72|24 | I329: 2 | J329: 1 | K329: 7
A330: 324 | B330: 仰望星空 | C330: 70414|70403|70417 | D330: =R[-1]C&"|"&RC[-3] -> 261|262|263|264|265|266|267|268|269|270|271|272|273|274|275|276|277|278|279|280|281|282|283|284|285|286|287|288|289|290|291|292|293|294|295|296|297|298|299|300|301|302|303|304|305|306|307|308|309|310|311|312|313|314|315|316|317|318|319|320|321|322|323|324 | F330: 2|3 | G330: 96|96 | H330: 48|48 | I330: 2 | J330: 1 | K330: 7
A331: 325 | B331: 月下的对话 | C331: 70415|70404|70418 | D331: =R[-1]C&"|"&RC[-3] -> 261|262|263|264|265|266|267|268|269|270|271|272|273|274|275|276|277|278|279|280|281|282|283|284|285|286|287|288|289|290|291|292|293|294|295|296|297|298|299|300|301|302|303|304|305|306|307|308|309|310|311|312|313|314|315|316|317|318|319|320|321|322|323|324|325 | F331: 4|1 | G331: 960|96 | H331: 480|48 | I331: 2 | J331: 1 | K331: 7
A332: 326 | B332: 迎接毁灭 | C332: 70416|70405|70419 | D332: =R[-1]C&"|"&RC[-3] -> 261|262|263|264|265|266|267|268|269|270|271|272|273|274|275|276|277|278|279|280|281|282|283|284|285|286|287|288|289|290|291|292|293|294|295|296|297|298|299|300|301|302|303|304|305|306|307|308|309|310|311|312|313|314|315|316|317|318|319|320|321|322|323|324|325|326 | F332: 4|2 | G332: 960|96 | H332: 480|48 | I332: 2 | J332: 1 | K332: 7
A333: 327 | B333: 相拥奔赴死亡 | C333: 70417|70406|70420 | D333: =R[-1]C&"|"&RC[-3] -> 261|262|263|264|265|266|267|268|269|270|271|272|273|274|275|276|277|278|279|280|281|282|283|284|285|286|287|288|289|290|291|292|293|294|295|296|297|298|299|300|301|302|303|304|305|306|307|308|309|310|311|312|313|314|315|316|317|318|319|320|321|322|323|324|325|326|327 | F333: 4|3 | G333: 960|96 | H333: 480|48 | I333: 2 | J333: 1 | K333: 7
A334: 328 | B334: 月亮坠落 | C334: 70418|70407|70421 | D334: =R[-1]C&"|"&RC[-3] -> 261|262|263|264|265|266|267|268|269|270|271|272|273|274|275|276|277|278|279|280|281|282|283|284|285|286|287|288|289|290|291|292|293|294|295|296|297|298|299|300|301|302|303|304|305|306|307|308|309|310|311|312|313|314|315|316|317|318|319|320|321|322|323|324|325|326|327|328 | F334: 1|2 | G334: 144|48 | H334: 72|24 | I334: 2 | J334: 1 | K334: 7
A335: 329 | B335: 太阳的庇护 | C335: 70419|70408|70422 | D335: =R[-1]C&"|"&RC[-3] -> 261|262|263|264|265|266|267|268|269|270|271|272|273|274|275|276|277|278|279|280|281|282|283|284|285|286|287|288|289|290|291|292|293|294|295|296|297|298|299|300|301|302|303|304|305|306|307|308|309|310|311|312|313|314|315|316|317|318|319|320|321|322|323|324|325|326|327|328|329 | F335: 1|3 | G335: 144|48 | H335: 72|24 | I335: 2 | J335: 1 | K335: 7
A336: 330 | B336: 最后一刻 | C336: 70420|70409|70423 | D336: =R[-1]C&"|"&RC[-3] -> 261|262|263|264|265|266|267|268|269|270|271|272|273|274|275|276|277|278|279|280|281|282|283|284|285|286|287|288|289|290|291|292|293|294|295|296|297|298|299|300|301|302|303|304|305|306|307|308|309|310|311|312|313|314|315|316|317|318|319|320|321|322|323|324|325|326|327|328|329|330 | F336: 2|3 | G336: 96|96 | H336: 48|48 | I336: 2 | J336: 1 | K336: 7
A337: 331 | B337: 世界逆转 | C337: 70421|70410|70424 | D337: =R[-1]C&"|"&RC[-3] -> 261|262|263|264|265|266|267|268|269|270|271|272|273|274|275|276|277|278|279|280|281|282|283|284|285|286|287|288|289|290|291|292|293|294|295|296|297|298|299|300|301|302|303|304|305|306|307|308|309|310|311|312|313|314|315|316|317|318|319|320|321|322|323|324|325|326|327|328|329|330|331 | F337: 4|1 | G337: 960|96 | H337: 480|48 | I337: 2 | J337: 1 | K337: 7
A338: 332 | B338: 守护正义 | C338: 70422|70411|70425 | D338: =R[-1]C&"|"&RC[-3] -> 261|262|263|264|265|266|267|268|269|270|271|272|273|274|275|276|277|278|279|280|281|282|283|284|285|286|287|288|289|290|291|292|293|294|295|296|297|298|299|300|301|302|303|304|305|306|307|308|309|310|311|312|313|314|315|316|317|318|319|320|321|322|323|324|325|326|327|328|329|330|331|332 | F338: 4|2 | G338: 960|96 | H338: 480|48 | I338: 2 | J338: 1 | K338: 7
A339: 333 | B339: 死神的赐予 | C339: 70423|70412|70413 | D339: =R[-1]C&"|"&RC[-3] -> 261|262|263|264|265|266|267|268|269|270|271|272|273|274|275|276|277|278|279|280|281|282|283|284|285|286|287|288|289|290|291|292|293|294|295|296|297|298|299|300|301|302|303|304|305|306|307|308|309|310|311|312|313|314|315|316|317|318|319|320|321|322|323|324|325|326|327|328|329|330|331|332|333 | F339: 4|3 | G339: 960|96 | H339: 480|48 | I339: 2 | J339: 1 | K339: 7
A340: 334 | B340: 不死之人 | C340: 70424|70413|70414 | D340: =R[-1]C&"|"&RC[-3] -> 261|262|263|264|265|266|267|268|269|270|271|272|273|274|275|276|277|278|279|280|281|282|283|284|285|286|287|288|289|290|291|292|293|294|295|296|297|298|299|300|301|302|303|304|305|306|307|308|309|310|311|312|313|314|315|316|317|318|319|320|321|322|323|324|325|326|327|328|329|330|331|332|333|334 | F340: 1|2 | G340: 144|48 | H340: 72|24 | I340: 2 | J340: 1 | K340: 7
A341: 335 | B341: 魔鬼的守护 | C341: 70425|70414|70415 | D341: =R[-1]C&"|"&RC[-3] -> 261|262|263|264|265|266|267|268|269|270|271|272|273|274|275|276|277|278|279|280|281|282|283|284|285|286|287|288|289|290|291|292|293|294|295|296|297|298|299|300|301|302|303|304|305|306|307|308|309|310|311|312|313|314|315|316|317|318|319|320|321|322|323|324|325|326|327|328|329|330|331|332|333|334|335 | F341: 1|3 | G341: 144|48 | H341: 72|24 | I341: 2 | J341: 1 | K341: 7
A342: 336 | B342: 未开放 | C342: 70501 | D342: =RC[-3] -> 336 | F342: 2|3 | G342: 60|60 | H342: 30|30 | I342: 2 | J342: 1 | K342: 7
A343: 337 | B343: 未开放 | C343: 70502 | D343: =R[-1]C&"|"&RC[-3] -> 336|337 | F343: 4|1 | G343: 600|60 | H343: 300|30 | I343: 2 | J343: 1 | K343: 7
A344: 338 | B344: 未开放 | C344: 70503 | D344: =R[-1]C&"|"&RC[-3] -> 336|337|338 | F344: 4|2 | G344: 600|60 | H344: 300|30 | I344: 2 | J344: 1 | K344: 7
A345: 339 | B345: 未开放 | C345: 70504 | D345: =R[-1]C&"|"&RC[-3] -> 336|337|338|339 | F345: 4|3 | G345: 600|60 | H345: 300|30 | I345: 2 | J345: 1 | K345: 7
A346: 340 | B346: 未开放 | C346: 70505 | D346: =R[-1]C&"|"&RC[-3] -> 336|337|338|339|340 | F346: 1|2 | G346: 90|30 | H346: 45|15 | I346: 2 | J346: 1 | K346: 7
A347: 341 | B347: 未开放 | C347: 70506 | D347: =R[-1]C&"|"&RC[-3] -> 336|337|338|339|340|341 | F347: 1|3 | G347: 90|30 | H347: 45|15 | I347: 2 | J347: 1 | K347: 7
A348: 342 | B348: 未开放 | C348: 70507 | D348: =R[-1]C&"|"&RC[-3] -> 336|337|338|339|340|341|342 | F348: 2|3 | G348: 60|60 | H348: 30|30 | I348: 2 | J348: 1 | K348: 7
A349: 343 | B349: 未开放 | C349: 70508 | D349: =R[-1]C&"|"&RC[-3] -> 336|337|338|339|340|341|342|343 | F349: 4|1 | G349: 600|60 | H349: 300|30 | I349: 2 | J349: 1 | K349: 7
A350: 344 | B350: 未开放 | C350: 70509 | D350: =R[-1]C&"|"&RC[-3] -> 336|337|338|339|340|341|342|343|344 | F350: 4|2 | G350: 600|60 | H350: 300|30 | I350: 2 | J350: 1 | K350: 7
A351: 345 | B351: 未开放 | C351: 70510 | D351: =R[-1]C&"|"&RC[-3] -> 336|337|338|339|340|341|342|343|344|345 | F351: 4|3 | G351: 600|60 | H351: 300|30 | I351: 2 | J351: 1 | K351: 7
A352: 346 | B352: 未开放 | C352: 70511 | D352: =R[-1]C&"|"&RC[-3] -> 336|337|338|339|340|341|342|343|344|345|346 | F352: 1|2 | G352: 90|30 | H352: 45|15 | I352: 2 | J352: 1 | K352: 7
A353: 347 | B353: 未开放 | C353: 70512 | D353: =R[-1]C&"|"&RC[-3] -> 336|337|338|339|340|341|342|343|344|345|346|347 | F353: 1|3 | G353: 90|30 | H353: 45|15 | I353: 2 | J353: 1 | K353: 7
A354: 348 | B354: 未开放 | C354: 70513 | D354: =R[-1]C&"|"&RC[-3] -> 336|337|338|339|340|341|342|343|344|345|346|347|348 | F354: 2|3 | G354: 60|60 | H354: 30|30 | I354: 2 | J354: 1 | K354: 7
A355: 349 | B355: 未开放 | C355: 70514 | D355: =R[-1]C&"|"&RC[-3] -> 336|337|338|339|340|341|342|343|344|345|346|347|348|349 | F355: 4|1 | G355: 600|60 | H355: 300|30 | I355: 2 | J355: 1 | K355: 7
A356: 350 | B356: 未开放 | C356: 70515 | D356: =R[-1]C&"|"&RC[-3] -> 336|337|338|339|340|341|342|343|344|345|346|347|348|349|350 | F356: 4|2 | G356: 600|60 | H356: 300|30 | I356: 2 | J356: 1 | K356: 7
A357: 351 | B357: 未开放 | C357: 70516 | D357: =R[-1]C&"|"&RC[-3] -> 336|337|338|339|340|341|342|343|344|345|346|347|348|349|350|351 | F357: 4|3 | G357: 600|60 | H357: 300|30 | I357: 2 | J357: 1 | K357: 7
A358: 352 | B358: 未开放 | C358: 70517 | D358: =R[-1]C&"|"&RC[-3] -> 336|337|338|339|340|341|342|343|344|345|346|347|348|349|350|351|352 | F358: 1|2 | G358: 90|30 | H358: 45|15 | I358: 2 | J358: 1 | K358: 7
A359: 353 | B359: 未开放 | C359: 70518 | D359: =R[-1]C&"|"&RC[-3] -> 336|337|338|339|340|341|342|343|344|345|346|347|348|349|350|351|352|353 | F359: 1|3 | G359: 90|30 | H359: 45|15 | I359: 2 | J359: 1 | K359: 7
A360: 354 | B360: 未开放 | C360: 70519 | D360: =R[-1]C&"|"&RC[-3] -> 336|337|338|339|340|341|342|343|344|345|346|347|348|349|350|351|352|353|354 | F360: 2|3 | G360: 60|60 | H360: 30|30 | I360: 2 | J360: 1 | K360: 7
A361: 355 | B361: 未开放 | C361: 70520 | D361: =R[-1]C&"|"&RC[-3] -> 336|337|338|339|340|341|342|343|344|345|346|347|348|349|350|351|352|353|354|355 | F361: 4|1 | G361: 600|60 | H361: 300|30 | I361: 2 | J361: 1 | K361: 7
A362: 356 | B362: 未开放 | C362: 70521 | D362: =R[-1]C&"|"&RC[-3] -> 336|337|338|339|340|341|342|343|344|345|346|347|348|349|350|351|352|353|354|355|356 | F362: 4|2 | G362: 600|60 | H362: 300|30 | I362: 2 | J362: 1 | K362: 7
A363: 357 | B363: 未开放 | C363: 70522 | D363: =R[-1]C&"|"&RC[-3] -> 336|337|338|339|340|341|342|343|344|345|346|347|348|349|350|351|352|353|354|355|356|357 | F363: 4|3 | G363: 600|60 | H363: 300|30 | I363: 2 | J363: 1 | K363: 7
A364: 358 | B364: 未开放 | C364: 70523 | D364: =R[-1]C&"|"&RC[-3] -> 336|337|338|339|340|341|342|343|344|345|346|347|348|349|350|351|352|353|354|355|356|357|358 | F364: 1|2 | G364: 90|30 | H364: 45|15 | I364: 2 | J364: 1 | K364: 7
A365: 359 | B365: 未开放 | C365: 70524 | D365: =R[-1]C&"|"&RC[-3] -> 336|337|338|339|340|341|342|343|344|345|346|347|348|349|350|351|352|353|354|355|356|357|358|359 | F365: 1|3 | G365: 90|30 | H365: 45|15 | I365: 2 | J365: 1 | K365: 7
A366: 360 | B366: 未开放 | C366: 70525 | D366: =R[-1]C&"|"&RC[-3] -> 336|337|338|339|340|341|342|343|344|345|346|347|348|349|350|351|352|353|354|355|356|357|358|359|360 | F366: 2|3 | G366: 60|60 | H366: 30|30 | I366: 2 | J366: 1 | K366: 7
A367: 361 | B367: 未开放 | C367: 70501|70416 | D367: =R[-1]C&"|"&RC[-3] -> 336|337|338|339|340|341|342|343|344|345|346|347|348|349|350|351|352|353|354|355|356|357|358|359|360|361 | F367: 4|1 | G367: 840|84 | H367: 420|42 | I367: 2 | J367: 1 | K367: 7
A368: 362 | B368: 未开放 | C368: 70502|70417 | D368: =R[-1]C&"|"&RC[-3] -> 336|337|338|339|340|341|342|343|344|345|346|347|348|349|350|351|352|353|354|355|356|357|358|359|360|361|362 | F368: 4|2 | G368: 840|84 | H368: 420|42 | I368: 2 | J368: 1 | K368: 7
A369: 363 | B369: 未开放 | C369: 70503|70418 | D369: =R[-1]C&"|"&RC[-3] -> 336|337|338|339|340|341|342|343|344|345|346|347|348|349|350|351|352|353|354|355|356|357|358|359|360|361|362|363 | F369: 4|3 | G369: 840|84 | H369: 420|42 | I369: 2 | J369: 1 | K369: 7
A370: 364 | B370: 未开放 | C370: 70504|70419 | D370: =R[-1]C&"|"&RC[-3] -> 336|337|338|339|340|341|342|343|344|345|346|347|348|349|350|351|352|353|354|355|356|357|358|359|360|361|362|363|364 | F370: 1|2 | G370: 126|42 | H370: 63|21 | I370: 2 | J370: 1 | K370: 7
A371: 365 | B371: 未开放 | C371: 70505|70420 | D371: =R[-1]C&"|"&RC[-3] -> 336|337|338|339|340|341|342|343|344|345|346|347|348|349|350|351|352|353|354|355|356|357|358|359|360|361|362|363|364|365 | F371: 1|3 | G371: 126|42 | H371: 63|21 | I371: 2 | J371: 1 | K371: 7
A372: 366 | B372: 未开放 | C372: 70506|70421 | D372: =R[-1]C&"|"&RC[-3] -> 336|337|338|339|340|341|342|343|344|345|346|347|348|349|350|351|352|353|354|355|356|357|358|359|360|361|362|363|364|365|366 | F372: 2|3 | G372: 84|84 | H372: 42|42 | I372: 2 | J372: 1 | K372: 7
A373: 367 | B373: 未开放 | C373: 70507|70422 | D373: =R[-1]C&"|"&RC[-3] -> 336|337|338|339|340|341|342|343|344|345|346|347|348|349|350|351|352|353|354|355|356|357|358|359|360|361|362|363|364|365|366|367 | F373: 4|1 | G373: 840|84 | H373: 420|42 | I373: 2 | J373: 1 | K373: 7
A374: 368 | B374: 未开放 | C374: 70508|70423 | D374: =R[-1]C&"|"&RC[-3] -> 336|337|338|339|340|341|342|343|344|345|346|347|348|349|350|351|352|353|354|355|356|357|358|359|360|361|362|363|364|365|366|367|368 | F374: 4|2 | G374: 840|84 | H374: 420|42 | I374: 2 | J374: 1 | K374: 7
A375: 369 | B375: 未开放 | C375: 70509|70424 | D375: =R[-1]C&"|"&RC[-3] -> 336|337|338|339|340|341|342|343|344|345|346|347|348|349|350|351|352|353|354|355|356|357|358|359|360|361|362|363|364|365|366|367|368|369 | F375: 4|3 | G375: 840|84 | H375: 420|42 | I375: 2 | J375: 1 | K375: 7
A376: 370 | B376: 未开放 | C376: 70510|70425 | D376: =R[-1]C&"|"&RC[-3] -> 336|337|338|339|340|341|342|343|344|345|346|347|348|349|350|351|352|353|354|355|356|357|358|359|360|361|362|363|364|365|366|367|368|369|370 | F376: 1|2 | G376: 126|42 | H376: 63|21 | I376: 2 | J376: 1 | K376: 7
A377: 371 | B377: 未开放 | C377: 70511|70401 | D377: =R[-1]C&"|"&RC[-3] -> 336|337|338|339|340|341|342|343|344|345|346|347|348|349|350|351|352|353|354|355|356|357|358|359|360|361|362|363|364|365|366|367|368|369|370|371 | F377: 1|3 | G377: 126|42 | H377: 63|21 | I377: 2 | J377: 1 | K377: 7
A378: 372 | B378: 未开放 | C378: 70512|70402 | D378: =R[-1]C&"|"&RC[-3] -> 336|337|338|339|340|341|342|343|344|345|346|347|348|349|350|351|352|353|354|355|356|357|358|359|360|361|362|363|364|365|366|367|368|369|370|371|372 | F378: 2|3 | G378: 84|84 | H378: 42|42 | I378: 2 | J378: 1 | K378: 7
A379: 373 | B379: 未开放 | C379: 70513|70403 | D379: =R[-1]C&"|"&RC[-3] -> 336|337|338|339|340|341|342|343|344|345|346|347|348|349|350|351|352|353|354|355|356|357|358|359|360|361|362|363|364|365|366|367|368|369|370|371|372|373 | F379: 4|1 | G379: 840|84 | H379: 420|42 | I379: 2 | J379: 1 | K379: 7
A380: 374 | B380: 未开放 | C380: 70514|70404 | D380: =R[-1]C&"|"&RC[-3] -> 336|337|338|339|340|341|342|343|344|345|346|347|348|349|350|351|352|353|354|355|356|357|358|359|360|361|362|363|364|365|366|367|368|369|370|371|372|373|374 | F380: 4|2 | G380: 840|84 | H380: 420|42 | I380: 2 | J380: 1 | K380: 7
A381: 375 | B381: 未开放 | C381: 70515|70405 | D381: =R[-1]C&"|"&RC[-3] -> 336|337|338|339|340|341|342|343|344|345|346|347|348|349|350|351|352|353|354|355|356|357|358|359|360|361|362|363|364|365|366|367|368|369|370|371|372|373|374|375 | F381: 4|3 | G381: 840|84 | H381: 420|42 | I381: 2 | J381: 1 | K381: 7
A382: 376 | B382: 未开放 | C382: 70516|70406 | D382: =R[-1]C&"|"&RC[-3] -> 336|337|338|339|340|341|342|343|344|345|346|347|348|349|350|351|352|353|354|355|356|357|358|359|360|361|362|363|364|365|366|367|368|369|370|371|372|373|374|375|376 | F382: 1|2 | G382: 126|42 | H382: 63|21 | I382: 2 | J382: 1 | K382: 7
A383: 377 | B383: 未开放 | C383: 70517|70407 | D383: =R[-1]C&"|"&RC[-3] -> 336|337|338|339|340|341|342|343|344|345|346|347|348|349|350|351|352|353|354|355|356|357|358|359|360|361|362|363|364|365|366|367|368|369|370|371|372|373|374|375|376|377 | F383: 1|3 | G383: 126|42 | H383: 63|21 | I383: 2 | J383: 1 | K383: 7
A384: 378 | B384: 未开放 | C384: 70518|70408 | D384: =R[-1]C&"|"&RC[-3] -> 336|337|338|339|340|341|342|343|344|345|346|347|348|349|350|351|352|353|354|355|356|357|358|359|360|361|362|363|364|365|366|367|368|369|370|371|372|373|374|375|376|377|378 | F384: 2|3 | G384: 84|84 | H384: 42|42 | I384: 2 | J384: 1 | K384: 7
A385: 379 | B385: 未开放 | C385: 70519|70409 | D385: =R[-1]C&"|"&RC[-3] -> 336|337|338|339|340|341|342|343|344|345|346|347|348|349|350|351|352|353|354|355|356|357|358|359|360|361|362|363|364|365|366|367|368|369|370|371|372|373|374|375|376|377|378|379 | F385: 4|1 | G385: 840|84 | H385: 420|42 | I385: 2 | J385: 1 | K385: 7
A386: 380 | B386: 未开放 | C386: 70520|70410 | D386: =R[-1]C&"|"&RC[-3] -> 336|337|338|339|340|341|342|343|344|345|346|347|348|349|350|351|352|353|354|355|356|357|358|359|360|361|362|363|364|365|366|367|368|369|370|371|372|373|374|375|376|377|378|379|380 | F386: 4|2 | G386: 840|84 | H386: 420|42 | I386: 2 | J386: 1 | K386: 7
A387: 381 | B387: 未开放 | C387: 70521|70411 | D387: =R[-1]C&"|"&RC[-3] -> 336|337|338|339|340|341|342|343|344|345|346|347|348|349|350|351|352|353|354|355|356|357|358|359|360|361|362|363|364|365|366|367|368|369|370|371|372|373|374|375|376|377|378|379|380|381 | F387: 4|3 | G387: 840|84 | H387: 420|42 | I387: 2 | J387: 1 | K387: 7
A388: 382 | B388: 未开放 | C388: 70522|70412 | D388: =R[-1]C&"|"&RC[-3] -> 336|337|338|339|340|341|342|343|344|345|346|347|348|349|350|351|352|353|354|355|356|357|358|359|360|361|362|363|364|365|366|367|368|369|370|371|372|373|374|375|376|377|378|379|380|381|382 | F388: 1|2 | G388: 126|42 | H388: 63|21 | I388: 2 | J388: 1 | K388: 7
A389: 383 | B389: 未开放 | C389: 70523|70401 | D389: =R[-1]C&"|"&RC[-3] -> 336|337|338|339|340|341|342|343|344|345|346|347|348|349|350|351|352|353|354|355|356|357|358|359|360|361|362|363|364|365|366|367|368|369|370|371|372|373|374|375|376|377|378|379|380|381|382|383 | F389: 1|3 | G389: 126|42 | H389: 63|21 | I389: 2 | J389: 1 | K389: 7
A390: 384 | B390: 未开放 | C390: 70524|70402 | D390: =R[-1]C&"|"&RC[-3] -> 336|337|338|339|340|341|342|343|344|345|346|347|348|349|350|351|352|353|354|355|356|357|358|359|360|361|362|363|364|365|366|367|368|369|370|371|372|373|374|375|376|377|378|379|380|381|382|383|384 | F390: 2|3 | G390: 84|84 | H390: 42|42 | I390: 2 | J390: 1 | K390: 7
A391: 385 | B391: 未开放 | C391: 70525|70403 | D391: =R[-1]C&"|"&RC[-3] -> 336|337|338|339|340|341|342|343|344|345|346|347|348|349|350|351|352|353|354|355|356|357|358|359|360|361|362|363|364|365|366|367|368|369|370|371|372|373|374|375|376|377|378|379|380|381|382|383|384|385 | F391: 4|1 | G391: 840|84 | H391: 420|42 | I391: 2 | J391: 1 | K391: 7

Sheet: 11.卡组信息
A1: card_group_id|card_group_id | C1: icon| | D1: deviation| | E1: low_describe| | F1: tall_describe| | G1: speak_pos| | H1: speak| | I1: speak_challenge|
A2: 不可空 | C2: 不可空 | D2: 不可空 | E2: 不可空 | F2: 不可空 | G2: 可空#不需字段 | H2: 可空#不需字段 | I2: 可空#不需字段
A3: 数字 | C3: 数字 | D3: 数字 | E3: 字符串 | F3: 字符串 | G3: 一维数组 | H3: 一维数组 | I3: 字符串
G4: 不定长 | H4: 不定长
A6: 卡组ID | C6: 卡组形象 | D6: 卡组形象偏移 | E6: 低级描述 | F6: 高级描述 | G6: 喊话偏移 | H6: 随机喊话 | I6: 固定喊话 | J6: 战力低于下一关的推荐战力时，用随机喊话，高于时，用固定喊话
A7: 1 | B7: 圣女贞德 | C7: 31440 | D7: -50 | E7: <COLOR VALUE=FF00b4ff>蓝品卡牌</COLOR> | F7: <COLOR VALUE=FFff993f>橙品卡牌</COLOR>（十张中至少有一张<COLOR VALUE=FFf041dd>紫品或以上卡牌</COLOR>） | G7: 0|210 | H7: "<COLOR VALUE=FF553923>想要升级高级卡组？那就向我发起挑战吧！</COLOR><COLOR VALUE=FFff993f>推荐战力：505万</COLOR>"|"<COLOR VALUE=FF553923>点击卡牌可以翻开并获得，当然，这是需要消耗金币的</COLOR>"|"<COLOR VALUE=FF553923>全部卡牌翻完后，可以点击“占卜”重新发牌</COLOR>" | I7: <COLOR VALUE=FF553923>想要升级高级卡组？那就向我发起挑战吧！</COLOR><COLOR VALUE=FFff993f>推荐战力：505w</COLOR>
A8: 2 | B8: 血源牧师 | C8: 32341 | D8: -50 | E8: <COLOR VALUE=FFf041dd>紫品卡牌</COLOR> | F8: <COLOR VALUE=FFff993f>橙品卡牌</COLOR>（十张中至少有一张<COLOR VALUE=FFf041dd>紫品或以上卡牌</COLOR>） | G8: 0|210 | H8: "<COLOR VALUE=FF553923>想要升级高级卡组？那就向我发起挑战吧！</COLOR><COLOR VALUE=FFff993f>推荐战力：931万</COLOR>"|"<COLOR VALUE=FF553923>点击卡牌可以翻开并获得，当然，这是需要消耗金币的</COLOR>"|"<COLOR VALUE=FF553923>全部卡牌翻完后，可以点击“占卜”重新发牌</COLOR>" | I8: <COLOR VALUE=FF553923>想要升级高级卡组？那就向我发起挑战吧！</COLOR><COLOR VALUE=FFff993f>推荐战力：931w</COLOR>
A9: 3 | B9: 水元素领主 | C9: 32340 | D9: -50 | E9: <COLOR VALUE=FFf041dd>紫品卡牌</COLOR> | F9: <COLOR VALUE=FFff993f>橙品卡牌</COLOR>（十张中至少有一张<COLOR VALUE=FFf041dd>紫品或以上卡牌</COLOR>） | G9: 0|210 | H9: "<COLOR VALUE=FF553923>想要升级高级卡组？那就向我发起挑战吧！</COLOR><COLOR VALUE=FFff993f>推荐战力：1779万</COLOR>"|"<COLOR VALUE=FF553923>点击卡牌可以翻开并获得，当然，这是需要消耗金币的</COLOR>"|"<COLOR VALUE=FF553923>全部卡牌翻完后，可以点击“占卜”重新发牌</COLOR>" | I9: <COLOR VALUE=FF553923>想要升级高级卡组？那就向我发起挑战吧！</COLOR><COLOR VALUE=FFff993f>推荐战力：1779万</COLOR>
A10: 4 | B10: 超凡博士 | C10: 30438 | D10: -50 | E10: <COLOR VALUE=FFf041dd>紫品卡牌</COLOR> | F10: <COLOR VALUE=FFff993f>橙品卡牌</COLOR>（十张中至少有一张<COLOR VALUE=FFf041dd>紫品或以上卡牌</COLOR>） | G10: 0|210 | H10: "<COLOR VALUE=FF553923>想要升级高级卡组？那就向我发起挑战吧！</COLOR><COLOR VALUE=FFff993f>推荐战力：3135万</COLOR>"|"<COLOR VALUE=FF553923>点击卡牌可以翻开并获得，当然，这是需要消耗金币的</COLOR>"|"<COLOR VALUE=FF553923>全部卡牌翻完后，可以点击“占卜”重新发牌</COLOR>" | I10: <COLOR VALUE=FF553923>想要升级高级卡组？那就向我发起挑战吧！</COLOR><COLOR VALUE=FFff993f>推荐战力：3135万</COLOR>
A11: 5 | B11: 狩猎女神 | C11: 31431 | D11: -50 | E11: <COLOR VALUE=FFf041dd>紫品卡牌</COLOR> | F11: <COLOR VALUE=FFff993f>橙品卡牌</COLOR>（十张中至少有一张<COLOR VALUE=FFf041dd>紫品或以上卡牌</COLOR>） | G11: 0|210 | H11: "<COLOR VALUE=FF553923>想要升级高级卡组？那就向我发起挑战吧！</COLOR><COLOR VALUE=FFff993f>推荐战力：5241万</COLOR>"|"<COLOR VALUE=FF553923>点击卡牌可以翻开并获得，当然，这是需要消耗金币的</COLOR>"|"<COLOR VALUE=FF553923>全部卡牌翻完后，可以点击“占卜”重新发牌</COLOR>" | I11: <COLOR VALUE=FF553923>想要升级高级卡组？那就向我发起挑战吧！</COLOR><COLOR VALUE=FFff993f>推荐战力：5241万</COLOR>
A12: 6 | B12: 雅典娜 | C12: 31441 | D12: -50 | E12: <COLOR VALUE=FFf041dd>紫品卡牌</COLOR> | F12: <COLOR VALUE=FFff993f>橙品卡牌</COLOR>（十张中至少有一张<COLOR VALUE=FFf041dd>紫品或以上卡牌</COLOR>） | G12: 0|210 | H12: "<COLOR VALUE=FF553923>想要升级高级卡组？那就向我发起挑战吧！</COLOR><COLOR VALUE=FFff993f>推荐战力：8586万</COLOR>"|"<COLOR VALUE=FF553923>点击卡牌可以翻开并获得，当然，这是需要消耗金币的</COLOR>"|"<COLOR VALUE=FF553923>全部卡牌翻完后，可以点击“占卜”重新发牌</COLOR>" | I12: <COLOR VALUE=FF553923>想要升级高级卡组？那就向我发起挑战吧！</COLOR><COLOR VALUE=FFff993f>推荐战力：8586万</COLOR>
A13: 7 | B13: 神圣牧师 | C13: 32449 | D13: -50 | E13: <COLOR VALUE=FFf041dd>紫品卡牌</COLOR> | F13: <COLOR VALUE=FFff993f>橙品卡牌</COLOR>（十张中至少有一张<COLOR VALUE=FFf041dd>紫品或以上卡牌</COLOR>） | G13: 0|210 | H13: "<COLOR VALUE=FF553923>想要升级高级卡组？那就向我发起挑战吧！</COLOR><COLOR VALUE=FFff993f>推荐战力：13944万</COLOR>"|"<COLOR VALUE=FF553923>点击卡牌可以翻开并获得，当然，这是需要消耗金币的</COLOR>"|"<COLOR VALUE=FF553923>全部卡牌翻完后，可以点击“占卜”重新发牌</COLOR>" | I13: <COLOR VALUE=FF553923>想要升级高级卡组？那就向我发起挑战吧！</COLOR><COLOR VALUE=FFff993f>推荐战力：13944万</COLOR>
A14: 8 | B14: 火女 | C14: 32430 | D14: -50 | E14: <COLOR VALUE=FFff993f>橙品卡牌</COLOR> | F14: <COLOR VALUE=FFff993f>橙品卡牌</COLOR>（十张中至少有一张<COLOR VALUE=FFf041dd>紫品或以上卡牌</COLOR>） | G14: 0|210 | H14: "<COLOR VALUE=FF553923>点击卡牌可以翻开并获得，当然，这是需要消耗金币的</COLOR>"|"<COLOR VALUE=FF553923>全部卡牌翻完后，可以点击“占卜”重新发牌</COLOR>"
A15: 9 | B15: 潘多拉 | C15: 31530 | D15: -50 | E15: <COLOR VALUE=FFff993f>橙品卡牌</COLOR>（十张中至少有一张<COLOR VALUE=FFf041dd>紫品或以上卡牌</COLOR>） | F15: <COLOR VALUE=FFff993f>橙品卡牌</COLOR>（十张中至少有一张<COLOR VALUE=FFf041dd>紫品或以上卡牌</COLOR>） | G15: 0|210 | H15: "<COLOR VALUE=FF553923>点击卡牌可以翻开并获得，当然，这是需要消耗金币的</COLOR>"|"<COLOR VALUE=FF553923>全部卡牌翻完后，可以点击“占卜”重新发牌</COLOR>"

Sheet: 12.商店槽位配置
A1: |slot | B1: |goods_list
A2: 不可空 | B2: 不可空
A3: 数字 | B3: 一维数组
B4: 不定长
A6: 商店槽位 | B6: 商品随机列表
A7: 1 | B7: 1001|1002|1003|1004|1005|1006|1007|1008|1009|1010|1011|1012|1013|1014|1015|1016|1017|1018|1019|1020|1021|1022|1023|1024|1025 | C7: 随机紫卡
A8: 2 | B8: 2001|2002|2003|2004|2005|2006|2007|2008|2009|2010|2011|2012|2013|2014|2015|2016|2017|2018|2019|2020|2021|2022|2023|2024|2025|2101|2102|2103|2104|2105|2106|2107|2108 | C8: 随机紫卡/橙卡
A9: 3 | B9: 3001|3002|3003|3004|3005|3006|3007|3008|3009|3010|3011|3012|3013|3014|3015 | C9: 愚者（绿/蓝/紫）
A10: 4 | B10: 4001|4002|4003|4004|4005|4006|4007|4008|4009|4010 | C10: 预言星徽/愚者（绿）
A11: 5 | B11: 5001|5002|5003|5004|5005|5006|5007|5008|5009|5010 | C11: 预言星徽/愚者（蓝）
A12: 6 | B12: 6001|6002|6003|6004|6005|6006|6007|6008|6009|6010 | C12: 预言星徽/愚者（紫）

Sheet: 13.商品
A1: goods_id|goods_id | B1: item_id|item_id | C1: item_num|item_num | D1: buy_num_max|buy_num_max | E1: need_role_level|need_role_level | F1: rate|rate | G1: cost_type_list|cost_type_list | H1: cost_value_list|cost_value_list
A2: 不可空 | B2: 不可空 | C2: 不可空 | D2: 不可空 | E2: 不可空 | F2: 不可空 | G2: 可空#不需字段 | H2: 可空#不需字段
A3: 数字 | B3: 数字 | C3: 数字 | D3: 数字 | E3: 数字 | F3: 数字 | G3: 一维数组 | H3: 一维数组
G4: 不定长 | H4: 不定长
A6: 商品ID | B6: 物品ID | C6: 物品数量 | D6: 购买数量上限(0=表示无上限) | E6: 等级限制 | F6: 刷出概率 | G6: 消耗类型列表 | H6: 消耗值列表
A7: 1001 | B7: 70301 | C7: 1 | D7: 1 | E7: 1 | F7: 1 | G7: 32 | H7: 900 | I7: =RC[-8] -> 1001
A8: 1002 | B8: 70302 | C8: 1 | D8: 1 | E8: 1 | F8: 1 | G8: 32 | H8: 900 | I8: =R[-1]C&"|"&RC[-8] -> 1001|1002
A9: 1003 | B9: 70303 | C9: 1 | D9: 1 | E9: 1 | F9: 1 | G9: 32 | H9: 900 | I9: =R[-1]C&"|"&RC[-8] -> 1001|1002|1003
A10: 1004 | B10: 70304 | C10: 1 | D10: 1 | E10: 1 | F10: 1 | G10: 32 | H10: 900 | I10: =R[-1]C&"|"&RC[-8] -> 1001|1002|1003|1004
A11: 1005 | B11: 70305 | C11: 1 | D11: 1 | E11: 1 | F11: 1 | G11: 32 | H11: 900 | I11: =R[-1]C&"|"&RC[-8] -> 1001|1002|1003|1004|1005
A12: 1006 | B12: 70306 | C12: 1 | D12: 1 | E12: 1 | F12: 1 | G12: 32 | H12: 900 | I12: =R[-1]C&"|"&RC[-8] -> 1001|1002|1003|1004|1005|1006
A13: 1007 | B13: 70307 | C13: 1 | D13: 1 | E13: 1 | F13: 1 | G13: 32 | H13: 900 | I13: =R[-1]C&"|"&RC[-8] -> 1001|1002|1003|1004|1005|1006|1007
A14: 1008 | B14: 70308 | C14: 1 | D14: 1 | E14: 1 | F14: 1 | G14: 32 | H14: 900 | I14: =R[-1]C&"|"&RC[-8] -> 1001|1002|1003|1004|1005|1006|1007|1008
A15: 1009 | B15: 70309 | C15: 1 | D15: 1 | E15: 1 | F15: 1 | G15: 32 | H15: 900 | I15: =R[-1]C&"|"&RC[-8] -> 1001|1002|1003|1004|1005|1006|1007|1008|1009
A16: 1010 | B16: 70310 | C16: 1 | D16: 1 | E16: 1 | F16: 1 | G16: 32 | H16: 900 | I16: =R[-1]C&"|"&RC[-8] -> 1001|1002|1003|1004|1005|1006|1007|1008|1009|1010
A17: 1011 | B17: 70311 | C17: 1 | D17: 1 | E17: 1 | F17: 1 | G17: 32 | H17: 900 | I17: =R[-1]C&"|"&RC[-8] -> 1001|1002|1003|1004|1005|1006|1007|1008|1009|1010|1011
A18: 1012 | B18: 70312 | C18: 1 | D18: 1 | E18: 1 | F18: 1 | G18: 32 | H18: 900 | I18: =R[-1]C&"|"&RC[-8] -> 1001|1002|1003|1004|1005|1006|1007|1008|1009|1010|1011|1012
A19: 1013 | B19: 70313 | C19: 1 | D19: 1 | E19: 1 | F19: 1 | G19: 32 | H19: 900 | I19: =R[-1]C&"|"&RC[-8] -> 1001|1002|1003|1004|1005|1006|1007|1008|1009|1010|1011|1012|1013
A20: 1014 | B20: 70314 | C20: 1 | D20: 1 | E20: 1 | F20: 1 | G20: 32 | H20: 900 | I20: =R[-1]C&"|"&RC[-8] -> 1001|1002|1003|1004|1005|1006|1007|1008|1009|1010|1011|1012|1013|1014
A21: 1015 | B21: 70315 | C21: 1 | D21: 1 | E21: 1 | F21: 1 | G21: 32 | H21: 900 | I21: =R[-1]C&"|"&RC[-8] -> 1001|1002|1003|1004|1005|1006|1007|1008|1009|1010|1011|1012|1013|1014|1015
A22: 1016 | B22: 70316 | C22: 1 | D22: 1 | E22: 1 | F22: 1 | G22: 32 | H22: 900 | I22: =R[-1]C&"|"&RC[-8] -> 1001|1002|1003|1004|1005|1006|1007|1008|1009|1010|1011|1012|1013|1014|1015|1016
A23: 1017 | B23: 70317 | C23: 1 | D23: 1 | E23: 1 | F23: 1 | G23: 32 | H23: 900 | I23: =R[-1]C&"|"&RC[-8] -> 1001|1002|1003|1004|1005|1006|1007|1008|1009|1010|1011|1012|1013|1014|1015|1016|1017
A24: 1018 | B24: 70318 | C24: 1 | D24: 1 | E24: 1 | F24: 1 | G24: 32 | H24: 900 | I24: =R[-1]C&"|"&RC[-8] -> 1001|1002|1003|1004|1005|1006|1007|1008|1009|1010|1011|1012|1013|1014|1015|1016|1017|1018
A25: 1019 | B25: 70319 | C25: 1 | D25: 1 | E25: 1 | F25: 1 | G25: 32 | H25: 900 | I25: =R[-1]C&"|"&RC[-8] -> 1001|1002|1003|1004|1005|1006|1007|1008|1009|1010|1011|1012|1013|1014|1015|1016|1017|1018|1019
A26: 1020 | B26: 70320 | C26: 1 | D26: 1 | E26: 1 | F26: 1 | G26: 32 | H26: 900 | I26: =R[-1]C&"|"&RC[-8] -> 1001|1002|1003|1004|1005|1006|1007|1008|1009|1010|1011|1012|1013|1014|1015|1016|1017|1018|1019|1020
A27: 1021 | B27: 70321 | C27: 1 | D27: 1 | E27: 1 | F27: 1 | G27: 32 | H27: 900 | I27: =R[-1]C&"|"&RC[-8] -> 1001|1002|1003|1004|1005|1006|1007|1008|1009|1010|1011|1012|1013|1014|1015|1016|1017|1018|1019|1020|1021
A28: 1022 | B28: 70322 | C28: 1 | D28: 1 | E28: 1 | F28: 1 | G28: 32 | H28: 600 | I28: =R[-1]C&"|"&RC[-8] -> 1001|1002|1003|1004|1005|1006|1007|1008|1009|1010|1011|1012|1013|1014|1015|1016|1017|1018|1019|1020|1021|1022
A29: 1023 | B29: 70323 | C29: 1 | D29: 1 | E29: 1 | F29: 1 | G29: 32 | H29: 600 | I29: =R[-1]C&"|"&RC[-8] -> 1001|1002|1003|1004|1005|1006|1007|1008|1009|1010|1011|1012|1013|1014|1015|1016|1017|1018|1019|1020|1021|1022|1023
A30: 1024 | B30: 70324 | C30: 1 | D30: 1 | E30: 1 | F30: 1 | G30: 32 | H30: 600 | I30: =R[-1]C&"|"&RC[-8] -> 1001|1002|1003|1004|1005|1006|1007|1008|1009|1010|1011|1012|1013|1014|1015|1016|1017|1018|1019|1020|1021|1022|1023|1024
A31: 1025 | B31: 70325 | C31: 1 | D31: 1 | E31: 1 | F31: 1 | G31: 32 | H31: 600 | I31: =R[-1]C&"|"&RC[-8] -> 1001|1002|1003|1004|1005|1006|1007|1008|1009|1010|1011|1012|1013|1014|1015|1016|1017|1018|1019|1020|1021|1022|1023|1024|1025
A32: 2001 | B32: 70301 | C32: 1 | D32: 1 | E32: 1 | F32: 108 | G32: 32 | H32: 900 | I32: =RC[-8] -> 2001
A33: 2002 | B33: 70302 | C33: 1 | D33: 1 | E33: 1 | F33: 108 | G33: 32 | H33: 900 | I33: =R[-1]C&"|"&RC[-8] -> 2001|2002
A34: 2003 | B34: 70303 | C34: 1 | D34: 1 | E34: 1 | F34: 108 | G34: 32 | H34: 900 | I34: =R[-1]C&"|"&RC[-8] -> 2001|2002|2003
A35: 2004 | B35: 70304 | C35: 1 | D35: 1 | E35: 1 | F35: 108 | G35: 32 | H35: 900 | I35: =R[-1]C&"|"&RC[-8] -> 2001|2002|2003|2004
A36: 2005 | B36: 70305 | C36: 1 | D36: 1 | E36: 1 | F36: 108 | G36: 32 | H36: 900 | I36: =R[-1]C&"|"&RC[-8] -> 2001|2002|2003|2004|2005
A37: 2006 | B37: 70306 | C37: 1 | D37: 1 | E37: 1 | F37: 108 | G37: 32 | H37: 900 | I37: =R[-1]C&"|"&RC[-8] -> 2001|2002|2003|2004|2005|2006
A38: 2007 | B38: 70307 | C38: 1 | D38: 1 | E38: 1 | F38: 108 | G38: 32 | H38: 900 | I38: =R[-1]C&"|"&RC[-8] -> 2001|2002|2003|2004|2005|2006|2007
A39: 2008 | B39: 70308 | C39: 1 | D39: 1 | E39: 1 | F39: 108 | G39: 32 | H39: 900 | I39: =R[-1]C&"|"&RC[-8] -> 2001|2002|2003|2004|2005|2006|2007|2008
A40: 2009 | B40: 70309 | C40: 1 | D40: 1 | E40: 1 | F40: 108 | G40: 32 | H40: 900 | I40: =R[-1]C&"|"&RC[-8] -> 2001|2002|2003|2004|2005|2006|2007|2008|2009
A41: 2010 | B41: 70310 | C41: 1 | D41: 1 | E41: 1 | F41: 108 | G41: 32 | H41: 900 | I41: =R[-1]C&"|"&RC[-8] -> 2001|2002|2003|2004|2005|2006|2007|2008|2009|2010
A42: 2011 | B42: 70311 | C42: 1 | D42: 1 | E42: 1 | F42: 108 | G42: 32 | H42: 900 | I42: =R[-1]C&"|"&RC[-8] -> 2001|2002|2003|2004|2005|2006|2007|2008|2009|2010|2011
A43: 2012 | B43: 70312 | C43: 1 | D43: 1 | E43: 1 | F43: 108 | G43: 32 | H43: 900 | I43: =R[-1]C&"|"&RC[-8] -> 2001|2002|2003|2004|2005|2006|2007|2008|2009|2010|2011|2012
A44: 2013 | B44: 70313 | C44: 1 | D44: 1 | E44: 1 | F44: 108 | G44: 32 | H44: 900 | I44: =R[-1]C&"|"&RC[-8] -> 2001|2002|2003|2004|2005|2006|2007|2008|2009|2010|2011|2012|2013
A45: 2014 | B45: 70314 | C45: 1 | D45: 1 | E45: 1 | F45: 108 | G45: 32 | H45: 900 | I45: =R[-1]C&"|"&RC[-8] -> 2001|2002|2003|2004|2005|2006|2007|2008|2009|2010|2011|2012|2013|2014
A46: 2015 | B46: 70315 | C46: 1 | D46: 1 | E46: 1 | F46: 108 | G46: 32 | H46: 900 | I46: =R[-1]C&"|"&RC[-8] -> 2001|2002|2003|2004|2005|2006|2007|2008|2009|2010|2011|2012|2013|2014|2015
A47: 2016 | B47: 70316 | C47: 1 | D47: 1 | E47: 1 | F47: 108 | G47: 32 | H47: 900 | I47: =R[-1]C&"|"&RC[-8] -> 2001|2002|2003|2004|2005|2006|2007|2008|2009|2010|2011|2012|2013|2014|2015|2016
A48: 2017 | B48: 70317 | C48: 1 | D48: 1 | E48: 1 | F48: 108 | G48: 32 | H48: 900 | I48: =R[-1]C&"|"&RC[-8] -> 2001|2002|2003|2004|2005|2006|2007|2008|2009|2010|2011|2012|2013|2014|2015|2016|2017
A49: 2018 | B49: 70318 | C49: 1 | D49: 1 | E49: 1 | F49: 108 | G49: 32 | H49: 900 | I49: =R[-1]C&"|"&RC[-8] -> 2001|2002|2003|2004|2005|2006|2007|2008|2009|2010|2011|2012|2013|2014|2015|2016|2017|2018
A50: 2019 | B50: 70319 | C50: 1 | D50: 1 | E50: 1 | F50: 108 | G50: 32 | H50: 900 | I50: =R[-1]C&"|"&RC[-8] -> 2001|2002|2003|2004|2005|2006|2007|2008|2009|2010|2011|2012|2013|2014|2015|2016|2017|2018|2019
A51: 2020 | B51: 70320 | C51: 1 | D51: 1 | E51: 1 | F51: 108 | G51: 32 | H51: 900 | I51: =R[-1]C&"|"&RC[-8] -> 2001|2002|2003|2004|2005|2006|2007|2008|2009|2010|2011|2012|2013|2014|2015|2016|2017|2018|2019|2020
A52: 2021 | B52: 70321 | C52: 1 | D52: 1 | E52: 1 | F52: 108 | G52: 32 | H52: 900 | I52: =R[-1]C&"|"&RC[-8] -> 2001|2002|2003|2004|2005|2006|2007|2008|2009|2010|2011|2012|2013|2014|2015|2016|2017|2018|2019|2020|2021
A53: 2022 | B53: 70322 | C53: 1 | D53: 1 | E53: 1 | F53: 108 | G53: 32 | H53: 600 | I53: =R[-1]C&"|"&RC[-8] -> 2001|2002|2003|2004|2005|2006|2007|2008|2009|2010|2011|2012|2013|2014|2015|2016|2017|2018|2019|2020|2021|2022
A54: 2023 | B54: 70323 | C54: 1 | D54: 1 | E54: 1 | F54: 108 | G54: 32 | H54: 600 | I54: =R[-1]C&"|"&RC[-8] -> 2001|2002|2003|2004|2005|2006|2007|2008|2009|2010|2011|2012|2013|2014|2015|2016|2017|2018|2019|2020|2021|2022|2023
A55: 2024 | B55: 70324 | C55: 1 | D55: 1 | E55: 1 | F55: 108 | G55: 32 | H55: 600 | I55: =R[-1]C&"|"&RC[-8] -> 2001|2002|2003|2004|2005|2006|2007|2008|2009|2010|2011|2012|2013|2014|2015|2016|2017|2018|2019|2020|2021|2022|2023|2024
A56: 2025 | B56: 70325 | C56: 1 | D56: 1 | E56: 1 | F56: 108 | G56: 32 | H56: 600 | I56: =R[-1]C&"|"&RC[-8] -> 2001|2002|2003|2004|2005|2006|2007|2008|2009|2010|2011|2012|2013|2014|2015|2016|2017|2018|2019|2020|2021|2022|2023|2024|2025
A57: 2101 | B57: 70422 | C57: 1 | D57: 1 | E57: 1 | F57: 50 | G57: 32 | H57: 4000 | I57: =R[-1]C&"|"&RC[-8] -> 2001|2002|2003|2004|2005|2006|2007|2008|2009|2010|2011|2012|2013|2014|2015|2016|2017|2018|2019|2020|2021|2022|2023|2024|2025|2101
A58: 2102 | B58: 70423 | C58: 1 | D58: 1 | E58: 1 | F58: 50 | G58: 32 | H58: 4000 | I58: =R[-1]C&"|"&RC[-8] -> 2001|2002|2003|2004|2005|2006|2007|2008|2009|2010|2011|2012|2013|2014|2015|2016|2017|2018|2019|2020|2021|2022|2023|2024|2025|2101|2102
A59: 2103 | B59: 70424 | C59: 1 | D59: 1 | E59: 1 | F59: 50 | G59: 32 | H59: 4000 | I59: =R[-1]C&"|"&RC[-8] -> 2001|2002|2003|2004|2005|2006|2007|2008|2009|2010|2011|2012|2013|2014|2015|2016|2017|2018|2019|2020|2021|2022|2023|2024|2025|2101|2102|2103
A60: 2104 | B60: 70425 | C60: 1 | D60: 1 | E60: 1 | F60: 50 | G60: 32 | H60: 4000 | I60: =R[-1]C&"|"&RC[-8] -> 2001|2002|2003|2004|2005|2006|2007|2008|2009|2010|2011|2012|2013|2014|2015|2016|2017|2018|2019|2020|2021|2022|2023|2024|2025|2101|2102|2103|2104
A61: 2105 | B61: 70408 | C61: 1 | D61: 1 | E61: 1 | F61: 25 | G61: 32 | H61: 6000 | I61: =R[-1]C&"|"&RC[-8] -> 2001|2002|2003|2004|2005|2006|2007|2008|2009|2010|2011|2012|2013|2014|2015|2016|2017|2018|2019|2020|2021|2022|2023|2024|2025|2101|2102|2103|2104|2105
A62: 2106 | B62: 70402 | C62: 1 | D62: 1 | E62: 1 | F62: 25 | G62: 32 | H62: 6000 | I62: =R[-1]C&"|"&RC[-8] -> 2001|2002|2003|2004|2005|2006|2007|2008|2009|2010|2011|2012|2013|2014|2015|2016|2017|2018|2019|2020|2021|2022|2023|2024|2025|2101|2102|2103|2104|2105|2106
A63: 2107 | B63: 70403 | C63: 1 | D63: 1 | E63: 1 | F63: 25 | G63: 32 | H63: 6000 | I63: =R[-1]C&"|"&RC[-8] -> 2001|2002|2003|2004|2005|2006|2007|2008|2009|2010|2011|2012|2013|2014|2015|2016|2017|2018|2019|2020|2021|2022|2023|2024|2025|2101|2102|2103|2104|2105|2106|2107
A64: 2108 | B64: 70404 | C64: 1 | D64: 1 | E64: 1 | F64: 25 | G64: 32 | H64: 6000 | I64: =R[-1]C&"|"&RC[-8] -> 2001|2002|2003|2004|2005|2006|2007|2008|2009|2010|2011|2012|2013|2014|2015|2016|2017|2018|2019|2020|2021|2022|2023|2024|2025|2101|2102|2103|2104|2105|2106|2107|2108
A65: 3001 | B65: 70100 | C65: 1 | D65: 1 | E65: 1 | F65: 1 | G65: 32 | H65: 20 | I65: =RC[-8] -> 3001
A66: 3002 | B66: 70100 | C66: 2 | D66: 1 | E66: 1 | F66: 1 | G66: 32 | H66: 40 | I66: =R[-1]C&"|"&RC[-8] -> 3001|3002
A67: 3003 | B67: 70100 | C67: 3 | D67: 1 | E67: 1 | F67: 1 | G67: 32 | H67: 60 | I67: =R[-1]C&"|"&RC[-8] -> 3001|3002|3003
A68: 3004 | B68: 70100 | C68: 4 | D68: 1 | E68: 1 | F68: 1 | G68: 32 | H68: 80 | I68: =R[-1]C&"|"&RC[-8] -> 3001|3002|3003|3004
A69: 3005 | B69: 70100 | C69: 5 | D69: 1 | E69: 1 | F69: 1 | G69: 32 | H69: 100 | I69: =R[-1]C&"|"&RC[-8] -> 3001|3002|3003|3004|3005
A70: 3006 | B70: 70200 | C70: 1 | D70: 1 | E70: 1 | F70: 1 | G70: 32 | H70: 40 | I70: =R[-1]C&"|"&RC[-8] -> 3001|3002|3003|3004|3005|3006
A71: 3007 | B71: 70200 | C71: 2 | D71: 1 | E71: 1 | F71: 1 | G71: 32 | H71: 80 | I71: =R[-1]C&"|"&RC[-8] -> 3001|3002|3003|3004|3005|3006|3007
A72: 3008 | B72: 70200 | C72: 3 | D72: 1 | E72: 1 | F72: 1 | G72: 32 | H72: 120 | I72: =R[-1]C&"|"&RC[-8] -> 3001|3002|3003|3004|3005|3006|3007|3008
A73: 3009 | B73: 70200 | C73: 4 | D73: 1 | E73: 1 | F73: 1 | G73: 32 | H73: 160 | I73: =R[-1]C&"|"&RC[-8] -> 3001|3002|3003|3004|3005|3006|3007|3008|3009
A74: 3010 | B74: 70200 | C74: 5 | D74: 1 | E74: 1 | F74: 1 | G74: 32 | H74: 200 | I74: =R[-1]C&"|"&RC[-8] -> 3001|3002|3003|3004|3005|3006|3007|3008|3009|3010
A75: 3011 | B75: 70300 | C75: 1 | D75: 1 | E75: 1 | F75: 1 | G75: 32 | H75: 80 | I75: =R[-1]C&"|"&RC[-8] -> 3001|3002|3003|3004|3005|3006|3007|3008|3009|3010|3011
A76: 3012 | B76: 70300 | C76: 2 | D76: 1 | E76: 1 | F76: 1 | G76: 32 | H76: 160 | I76: =R[-1]C&"|"&RC[-8] -> 3001|3002|3003|3004|3005|3006|3007|3008|3009|3010|3011|3012
A77: 3013 | B77: 70300 | C77: 3 | D77: 1 | E77: 1 | F77: 1 | G77: 32 | H77: 240 | I77: =R[-1]C&"|"&RC[-8] -> 3001|3002|3003|3004|3005|3006|3007|3008|3009|3010|3011|3012|3013
A78: 3014 | B78: 70300 | C78: 4 | D78: 1 | E78: 1 | F78: 1 | G78: 32 | H78: 320 | I78: =R[-1]C&"|"&RC[-8] -> 3001|3002|3003|3004|3005|3006|3007|3008|3009|3010|3011|3012|3013|3014
A79: 3015 | B79: 70300 | C79: 5 | D79: 1 | E79: 1 | F79: 1 | G79: 32 | H79: 400 | I79: =R[-1]C&"|"&RC[-8] -> 3001|3002|3003|3004|3005|3006|3007|3008|3009|3010|3011|3012|3013|3014|3015
A80: 4001 | B80: 10009 | C80: 1 | D80: 1 | E80: 1 | F80: 1 | G80: 32 | H80: 50 | I80: =RC[-8] -> 4001
A81: 4002 | B81: 10009 | C81: 2 | D81: 1 | E81: 1 | F81: 1 | G81: 32 | H81: 100 | I81: =R[-1]C&"|"&RC[-8] -> 4001|4002
A82: 4003 | B82: 10009 | C82: 5 | D82: 1 | E82: 1 | F82: 1 | G82: 32 | H82: 250 | I82: =R[-1]C&"|"&RC[-8] -> 4001|4002|4003
A83: 4004 | B83: 10009 | C83: 10 | D83: 1 | E83: 1 | F83: 1 | G83: 32 | H83: 500 | I83: =R[-1]C&"|"&RC[-8] -> 4001|4002|4003|4004
A84: 4005 | B84: 10009 | C84: 15 | D84: 1 | E84: 1 | F84: 1 | G84: 32 | H84: 750 | I84: =R[-1]C&"|"&RC[-8] -> 4001|4002|4003|4004|4005
A85: 4006 | B85: 70100 | C85: 1 | D85: 1 | E85: 1 | F85: 1 | G85: 32 | H85: 20 | I85: =R[-1]C&"|"&RC[-8] -> 4001|4002|4003|4004|4005|4006
A86: 4007 | B86: 70100 | C86: 2 | D86: 1 | E86: 1 | F86: 1 | G86: 32 | H86: 40 | I86: =R[-1]C&"|"&RC[-8] -> 4001|4002|4003|4004|4005|4006|4007
A87: 4008 | B87: 70100 | C87: 3 | D87: 1 | E87: 1 | F87: 1 | G87: 32 | H87: 60 | I87: =R[-1]C&"|"&RC[-8] -> 4001|4002|4003|4004|4005|4006|4007|4008
A88: 4009 | B88: 70100 | C88: 4 | D88: 1 | E88: 1 | F88: 1 | G88: 32 | H88: 80 | I88: =R[-1]C&"|"&RC[-8] -> 4001|4002|4003|4004|4005|4006|4007|4008|4009
A89: 4010 | B89: 70100 | C89: 5 | D89: 1 | E89: 1 | F89: 1 | G89: 32 | H89: 100 | I89: =R[-1]C&"|"&RC[-8] -> 4001|4002|4003|4004|4005|4006|4007|4008|4009|4010
A90: 5001 | B90: 10009 | C90: 1 | D90: 1 | E90: 1 | F90: 1 | G90: 32 | H90: 50 | I90: =RC[-8] -> 5001
A91: 5002 | B91: 10009 | C91: 2 | D91: 1 | E91: 1 | F91: 1 | G91: 32 | H91: 100 | I91: =R[-1]C&"|"&RC[-8] -> 5001|5002
A92: 5003 | B92: 10009 | C92: 5 | D92: 1 | E92: 1 | F92: 1 | G92: 32 | H92: 250 | I92: =R[-1]C&"|"&RC[-8] -> 5001|5002|5003
A93: 5004 | B93: 10009 | C93: 10 | D93: 1 | E93: 1 | F93: 1 | G93: 32 | H93: 500 | I93: =R[-1]C&"|"&RC[-8] -> 5001|5002|5003|5004
A94: 5005 | B94: 10009 | C94: 15 | D94: 1 | E94: 1 | F94: 1 | G94: 32 | H94: 750 | I94: =R[-1]C&"|"&RC[-8] -> 5001|5002|5003|5004|5005
A95: 5006 | B95: 70200 | C95: 1 | D95: 1 | E95: 1 | F95: 1 | G95: 32 | H95: 40 | I95: =R[-1]C&"|"&RC[-8] -> 5001|5002|5003|5004|5005|5006
A96: 5007 | B96: 70200 | C96: 2 | D96: 1 | E96: 1 | F96: 1 | G96: 32 | H96: 80 | I96: =R[-1]C&"|"&RC[-8] -> 5001|5002|5003|5004|5005|5006|5007
A97: 5008 | B97: 70200 | C97: 3 | D97: 1 | E97: 1 | F97: 1 | G97: 32 | H97: 120 | I97: =R[-1]C&"|"&RC[-8] -> 5001|5002|5003|5004|5005|5006|5007|5008
A98: 5009 | B98: 70200 | C98: 4 | D98: 1 | E98: 1 | F98: 1 | G98: 32 | H98: 160 | I98: =R[-1]C&"|"&RC[-8] -> 5001|5002|5003|5004|5005|5006|5007|5008|5009
A99: 5010 | B99: 70200 | C99: 5 | D99: 1 | E99: 1 | F99: 1 | G99: 32 | H99: 200 | I99: =R[-1]C&"|"&RC[-8] -> 5001|5002|5003|5004|5005|5006|5007|5008|5009|5010
A100: 6001 | B100: 10009 | C100: 1 | D100: 1 | E100: 1 | F100: 1 | G100: 32 | H100: 50 | I100: =RC[-8] -> 6001
A101: 6002 | B101: 10009 | C101: 2 | D101: 1 | E101: 1 | F101: 1 | G101: 32 | H101: 100 | I101: =R[-1]C&"|"&RC[-8] -> 6001|6002
A102: 6003 | B102: 10009 | C102: 5 | D102: 1 | E102: 1 | F102: 1 | G102: 32 | H102: 250 | I102: =R[-1]C&"|"&RC[-8] -> 6001|6002|6003
A103: 6004 | B103: 10009 | C103: 10 | D103: 1 | E103: 1 | F103: 1 | G103: 32 | H103: 500 | I103: =R[-1]C&"|"&RC[-8] -> 6001|6002|6003|6004
A104: 6005 | B104: 10009 | C104: 15 | D104: 1 | E104: 1 | F104: 1 | G104: 32 | H104: 750 | I104: =R[-1]C&"|"&RC[-8] -> 6001|6002|6003|6004|6005
A105: 6006 | B105: 70300 | C105: 1 | D105: 1 | E105: 1 | F105: 1 | G105: 32 | H105: 80 | I105: =R[-1]C&"|"&RC[-8] -> 6001|6002|6003|6004|6005|6006
A106: 6007 | B106: 70300 | C106: 2 | D106: 1 | E106: 1 | F106: 1 | G106: 32 | H106: 160 | I106: =R[-1]C&"|"&RC[-8] -> 6001|6002|6003|6004|6005|6006|6007
A107: 6008 | B107: 70300 | C107: 3 | D107: 1 | E107: 1 | F107: 1 | G107: 32 | H107: 240 | I107: =R[-1]C&"|"&RC[-8] -> 6001|6002|6003|6004|6005|6006|6007|6008
A108: 6009 | B108: 70300 | C108: 4 | D108: 1 | E108: 1 | F108: 1 | G108: 32 | H108: 320 | I108: =R[-1]C&"|"&RC[-8] -> 6001|6002|6003|6004|6005|6006|6007|6008|6009
A109: 6010 | B109: 70300 | C109: 5 | D109: 1 | E109: 1 | F109: 1 | G109: 32 | H109: 400 | I109: =R[-1]C&"|"&RC[-8] -> 6001|6002|6003|6004|6005|6006|6007|6008|6009|6010

Sheet: 14.占卜成就
A1: level|level | B1: need_collection_value|need_collection_value | C1: pro_type_list|pro_type_list | D1: pro_value_list|pro_value_list | E1: desc| | F1: icon| | G1: name|
A2: 不可空 | B2: 不可空 | C2: 可空#不需字段 | D2: 可空#不需字段 | E2: 不可空 | F2: 不可空 | G2: 不可空
A3: 数字 | B3: 数字 | C3: 一维数组 | D3: 一维数组 | E3: 字符串 | F3: 数字 | G3: 字符串
C4: 不定长 | D4: 不定长
A6: 成就等级 | B6: 需要的收藏值 | C6: 属性类型列表 | D6: 属性值列表 | E6: 描述 | F6: 成就使用卡面 | G6: 名字
A7: 1 | B7: 25 | C7: 25|22|23|24 | D7: 100|0|0|0 | E7: 生命+1% | F7: 70001 | G7: 魔术师
A8: 2 | B8: 50 | C8: 25|22|23|24 | D8: 100|100|0|0 | E8: 攻击+1% | F8: 70002 | G8: 女祭司
A9: 3 | B9: 75 | C9: 25|22|23|24 | D9: 100|100|100|0 | E9: 物防+1% | F9: 70003 | G9: 女皇
A10: 4 | B10: 100 | C10: 25|22|23|24 | D10: 100|100|100|100 | E10: 法防+1% | F10: 70004 | G10: 皇帝
A11: 5 | B11: 150 | C11: 25|22|23|24 | D11: 200|100|100|100 | E11: 生命+1% | F11: 70005 | G11: 教皇
A12: 6 | B12: 200 | C12: 25|22|23|24 | D12: 200|200|100|100 | E12: 攻击+1% | F12: 70006 | G12: 恋人
A13: 7 | B13: 250 | C13: 25|22|23|24 | D13: 200|200|200|100 | E13: 物防+1% | F13: 70007 | G13: 战车
A14: 8 | B14: 300 | C14: 25|22|23|24 | D14: 200|200|200|200 | E14: 法防+1% | F14: 70008 | G14: 力量
A15: 9 | B15: 350 | C15: 25|22|23|24 | D15: 300|200|200|200 | E15: 生命+1% | F15: 70009 | G15: 隐者
A16: 10 | B16: 400 | C16: 25|22|23|24 | D16: 300|300|200|200 | E16: 攻击+1% | F16: 70010 | G16: 命运之轮
A17: 11 | B17: 450 | C17: 25|22|23|24 | D17: 300|300|300|200 | E17: 物防+1% | F17: 70011 | G17: 正义
A18: 12 | B18: 500 | C18: 25|22|23|24 | D18: 300|300|300|300 | E18: 法防+1% | F18: 70012 | G18: 倒吊人
A19: 13 | B19: 600 | C19: 25|22|23|24 | D19: 400|300|300|300 | E19: 生命+1% | F19: 70013 | G19: 死神
A20: 14 | B20: 700 | C20: 25|22|23|24 | D20: 400|400|300|300 | E20: 攻击+1% | F20: 70014 | G20: 节制
A21: 15 | B21: 800 | C21: 25|22|23|24 | D21: 400|400|400|300 | E21: 物防+1% | F21: 70015 | G21: 恶魔
A22: 16 | B22: 900 | C22: 25|22|23|24 | D22: 400|400|400|400 | E22: 法防+1% | F22: 70016 | G22: 塔
A23: 17 | B23: 1000 | C23: 25|22|23|24 | D23: 500|400|400|400 | E23: 生命+1% | F23: 70017 | G23: 星星
A24: 18 | B24: 1100 | C24: 25|22|23|24 | D24: 500|500|400|400 | E24: 攻击+1% | F24: 70018 | G24: 月亮
A25: 19 | B25: 1200 | C25: 25|22|23|24 | D25: 500|500|500|400 | E25: 物防+1% | F25: 70019 | G25: 太阳
A26: 20 | B26: 1300 | C26: 25|22|23|24 | D26: 500|500|500|500 | E26: 法防+1% | F26: 70020 | G26: 审判
A27: 21 | B27: 1400 | C27: 25|22|23|24 | D27: 600|500|500|500 | E27: 生命+1% | F27: 70021 | G27: 世界
A28: 22 | B28: 1500 | C28: 25|22|23|24 | D28: 600|600|500|500 | E28: 攻击+1% | F28: 70001 | G28: 神秘学的末日
A29: 23 | B29: 1600 | C29: 25|22|23|24 | D29: 600|600|600|500 | E29: 物防+1% | F29: 70002 | G29: 为了救赎
A30: 24 | B30: 1700 | C30: 25|22|23|24 | D30: 600|600|600|600 | E30: 法防+1% | F30: 70003 | G30: 最后的权威
A31: 25 | B31: 1800 | C31: 25|22|23|24 | D31: 700|600|600|600 | E31: 生命+1% | F31: 70004 | G31: 不容冒犯 | H31: 闪耀的微光
A32: 26 | B32: 1900 | C32: 25|22|23|24 | D32: 700|700|600|600 | E32: 攻击+1% | F32: 70005 | G32: 神圣的光辉 | H32: 月亮倒影
A33: 27 | B33: 2000 | C33: 25|22|23|24 | D33: 700|700|700|600 | E33: 物防+1% | F33: 70006 | G33: 伊甸的苹果 | H33: 不会陨落
A34: 28 | B34: 2100 | C34: 25|22|23|24 | D34: 700|700|700|700 | E34: 法防+1% | F34: 70007 | G34: 勇往直前 | H34: 神灵的注视
A35: 29 | B35: 2200 | C35: 25|22|23|24 | D35: 800|700|700|700 | E35: 生命+1% | F35: 70008 | G35: 击碎一切 | H35: 世界意志所在
A36: 30 | B36: 2300 | C36: 25|22|23|24 | D36: 800|800|700|700 | E36: 攻击+1% | F36: 70009 | G36: 藏身于山林 | H36: 最后的法师
A37: 31 | B37: 2400 | C37: 25|22|23|24 | D37: 800|800|800|700 | E37: 物防+1% | F37: 70010 | G37: 命运的终点 | H37: 神圣挽歌
A38: 32 | B38: 2500 | C38: 25|22|23|24 | D38: 800|800|800|800 | E38: 法防+1% | F38: 70011 | G38: 灵魂制衡 | H38: 第一夫人
A39: 33 | B39: 2600 | C39: 25|22|23|24 | D39: 900|800|800|800 | E39: 生命+1% | F39: 70012 | G39: 只是稍作歇息 | H39: 君临天下
A40: 34 | B40: 2700 | C40: 25|22|23|24 | D40: 900|900|800|800 | E40: 攻击+1% | F40: 70013 | G40: 你需畏惧死亡 | H40: 跌落神座
A41: 35 | B41: 2800 | C41: 25|22|23|24 | D41: 900|900|900|800 | E41: 物防+1% | F41: 70014 | G41: 无穷无尽 | H41: 生命起源
A42: 36 | B42: 2900 | C42: 25|22|23|24 | D42: 900|900|900|900 | E42: 法防+1% | F42: 70015 | G42: 醉生梦死 | H42: 碾压性胜利
A43: 37 | B43: 3000 | C43: 25|22|23|24 | D43: 1000|900|900|900 | E43: 生命+1% | F43: 70016 | G43: 没有未来的路 | H43: 不屈的意志

Sheet: 15.卡牌图鉴
A1: index| | B1: title| | C1: card_list|
A2: 不可空 | B2: 不可空 | C2: 不可空
A3: 数字 | B3: 字符串 | C3: 一维数组
C4: 不定长
A6: 序号 | B6: 标题 | C6: 卡牌列表
A7: 1 | B7: 橙品卡牌 | C7: 70422|70423|70424|70425|70401|70402|70403|70404|70405|70406|70407|70408|70409|70410|70411|70412|70413|70414|70415|70416|70417|70418|70419|70420|70421
A8: 2 | B8: 紫品卡牌 | C8: 70322|70323|70324|70325|70301|70302|70303|70304|70305|70306|70307|70308|70309|70310|70311|70312|70313|70314|70315|70316|70317|70318|70319|70320|70321
A9: 3 | B9: 蓝品卡牌 | C9: 70222|70223|70224|70225|70201|70202|70203|70204|70205|70206|70207|70208|70209|70210|70211|70212|70213|70214|70215|70216|70217|70218|70219|70220|70221
A10: 4 | B10: 绿品卡牌 | C10: 70122|70123|70124|70125
A11: 5 | B11: 白品卡牌 | C11: 70022|70023|70024|70025