Sheet: 配置
A1: 服务端文件名 | B1: 服务端对应工作表号 | C1: 客户端文件名 | D1: 客户端对应工作表号 | E1: erl头部 | F1: erl内容格式 | G1: erl尾部 | H1: 客户端特殊处理
A2: config_battle.txt | B2: 1 | C2: config_battle.cnf|Battle | D2: 1 | F2: get(id) -> #$ | H2: 2=>id

Sheet: 战役
A1: id|id | B1: representativeId| | C1: moster_1|moster_1 | D1: moster_2|moster_2 | E1: moster_3|moster_3 | F1: moster_4|moster_4 | G1: moster_5|moster_5 | H1: hide_monster_list| | I1: boss_warning_time| | J1: boss_info_time| | K1: skip_time|
A2: 不可空 | B2: 不可空 | C2: 不可空 | D2: 不可空 | E2: 不可空 | F2: 不可空 | G2: 不可空 | H2: 可空#不需字段 | I2: 可空#不需字段 | J2: 可空#不需字段 | K2: 可空#不需字段
A3: 数字 | B3: 数字 | C3: 数字 | D3: 数字 | E3: 数字 | F3: 数字 | G3: 数字 | H3: 一维数组 | I3: 数字 | J3: 数字 | K3: 数字
C4: 记得添英雄Id | H4: 不定长
A6: 战役ID | B6: 战役代表形象Id | C6: 战位1怪物 | D6: 战位2怪物 | E6: 战位3怪物 | F6: 战位4怪物 | G6: 战位5怪物 | H6: 战位怪物隐藏列表 | I6: BOSS预警特效出现时间 | J6: BOSS信息出现时间 | K6: X秒后可跳过
A7: 101 | B7: 305200 | C7: 305200 | D7: 304200 | E7: 305000 | F7: 304400 | G7: 304110 | M7: 黑暗骑士 | N7: 地狱怪客 | O7: 狼叔 | P7: 红女巫 | Q7: 美队
A8: 102 | B8: 304210 | C8: 304210 | D8: 304000 | E8: 304010 | F8: 304300 | G8: 304100 | M8: 铁人 | N8: 死亡武士 | O8: 幽灵骑士 | P8: 雷神 | Q8: 野蛮浩克
A9: 103 | B9: 315300 | C9: 315300 | D9: 314100 | E9: 315000 | F9: 314310 | G9: 314010 | M9: 潘多拉 | N9: 大力神 | O9: 奎爷 | P9: 冥王哈迪斯 | Q9: 阿努比斯
A10: 104 | B10: 314010 | C10: 314400 | D10: 314300 | E10: 314020 | F10: 314320 | G10: 314000 | M10: 雅典娜 | N10: 美杜莎 | O10: 德古拉伯爵 | P10: 狩猎女神 | Q10: 查理大帝
A11: 105 | B11: 325000 | C11: 324300 | D11: 324100 | E11: 324200 | F11: 324020 | G11: 324400 | M11: 火女 | N11: 熊阿宝 | O11: 小黑 | P11: 血色指挥官 | Q11: 大检察官
A12: 106 | B12: 324010 | C12: 325000 | D12: 324000 | E12: 325100 | F12: 324410 | G12: 324010 | M12: 巫妖之王 | N12: 恶魔猎手 | O12: 钢铁酋长 | P12: 神圣牧师 | Q12: 牛头人
A13: 99999 | B13: =RC[1] -> 199999 | C13: 199999 | D13: 199998 | E13: 0 | F13: 0 | G13: 0 | I13: 0.1 | L13: 测试战役
A14: 999990 | B14: 999991 | C14: 999991 | D14: 999992 | E14: 999993 | F14: 999994 | G14: 999995 | L14: 出生副本
A15: 999991 | B15: 999999 | C15: 999999 | D15: 999994 | E15: 999995 | F15: 0 | G15: 0 | H15: 1 | L15: 出生副本
A16: 1 | B16: 11 | C16: 11 | D16: 12 | E16: 13 | F16: 14 | G16: 15 | K16: 30 | L16: 领地战役
A17: 2 | B17: 21 | C17: 21 | D17: 22 | E17: 23 | F17: 24 | G17: 25 | K17: 30
A18: 3 | B18: 31 | C18: 31 | D18: 32 | E18: 33 | F18: 34 | G18: 35 | K18: 30
A19: 4 | B19: 41 | C19: 41 | D19: 42 | E19: 43 | F19: 44 | G19: 45 | K19: 30
A20: 5 | B20: 51 | C20: 51 | D20: 52 | E20: 53 | F20: 54 | G20: 55 | K20: 30
A21: 11 | B21: 1101 | C21: 1101 | D21: 1102 | E21: 1103 | F21: 1104 | G21: 1105 | L21: 占卜师1
A22: 12 | B22: 1201 | C22: 1201 | D22: 1202 | E22: 1203 | F22: 1204 | G22: 1205 | L22: 占卜师2
A23: 13 | B23: 1301 | C23: 1301 | D23: 1302 | E23: 1303 | F23: 1304 | G23: 1305 | L23: 占卜师3
A24: 14 | B24: 1401 | C24: 1401 | D24: 1402 | E24: 1403 | F24: 1404 | G24: 1405 | L24: 占卜师4
A25: 15 | B25: 1501 | C25: 1501 | D25: 1502 | E25: 1503 | F25: 1504 | G25: 1505 | L25: 占卜师5
A26: 16 | B26: 1601 | C26: 1601 | D26: 1602 | E26: 1603 | F26: 1604 | G26: 1605 | L26: 占卜师6
A27: 17 | B27: 1701 | C27: 1701 | D27: 1702 | E27: 1703 | F27: 1704 | G27: 1705 | L27: 占卜师7
A28: 18 | B28: 1801 | C28: 1801 | D28: 1802 | E28: 1803 | F28: 1804 | G28: 1805 | L28: 占卜师8
A29: 31 | B29: 3101 | C29: 3101 | D29: 3102 | E29: 3103 | F29: 3104 | G29: 3105 | L29: 顶级资源
A30: 32 | B30: 3201 | C30: 3201 | D30: 3202 | E30: 3203 | F30: 3204 | G30: 3205 | L30: 超级资源
A31: 33 | B31: 3301 | C31: 3301 | D31: 3302 | E31: 3303 | F31: 3304 | G31: 3305 | L31: 高级资源
A32: 34 | B32: 3401 | C32: 3401 | D32: 3402 | E32: 3403 | F32: 3404 | G32: 3405 | L32: 中级资源
A33: 35 | B33: 3501 | C33: 3501 | D33: 3502 | E33: 3503 | F33: 3504 | G33: 3505 | L33: 初级资源
A34: 36 | B34: 3601 | C34: 3601 | D34: 3602 | E34: 3603 | F34: 3604 | G34: 3605 | L34: 低级资源
A35: 995 | B35: 9951 | C35: 9951 | D35: 9952 | E35: 9953 | F35: 9954 | G35: 9955 | K35: 3 | L35: 前排阵容叛军
A36: 996 | B36: 9965 | C36: 9961 | D36: 9962 | E36: 9963 | F36: 9964 | G36: 9965 | K36: 3 | L36: 后排阵容叛军
A37: 997 | B37: 9971 | C37: 9971 | D37: 9972 | E37: 9973 | F37: 9974 | G37: 9975 | K37: 3 | L37: 均衡阵容叛军
A38: 998 | B38: 9981 | C38: 9981 | D38: 0 | E38: 0 | F38: 0 | G38: 0 | K38: 3 | L38: 物理BOSS叛军
A39: 999 | B39: 9991 | C39: 9991 | D39: 0 | E39: 0 | F39: 0 | G39: 0 | K39: 3 | L39: 魔法BOSS叛军
A40: 3010 | B40: =RC[1] -> 30101 | C40: =RC[-2]*10+1 -> 30101 | D40: =RC[-1]+1 -> 30102 | E40: =RC[-1]+1 -> 30103 | F40: =RC[-1]+1 -> 30104 | G40: =RC[-1]+1 -> 30105 | K40: 3 | L40: 星球战
A41: 3020 | B41: =RC[1] -> 30201 | C41: =RC[-2]*10+1 -> 30201 | D41: =RC[-1]+1 -> 30202 | E41: =RC[-1]+1 -> 30203 | F41: =RC[-1]+1 -> 30204 | G41: =RC[-1]+1 -> 30205 | K41: 3
A42: 3030 | B42: =RC[1] -> 30301 | C42: =RC[-2]*10+1 -> 30301 | D42: =RC[-1]+1 -> 30302 | E42: =RC[-1]+1 -> 30303 | F42: =RC[-1]+1 -> 30304 | G42: =RC[-1]+1 -> 30305 | K42: 3
A43: 3040 | B43: =RC[1] -> 30401 | C43: =RC[-2]*10+1 -> 30401 | D43: =RC[-1]+1 -> 30402 | E43: =RC[-1]+1 -> 30403 | F43: =RC[-1]+1 -> 30404 | G43: =RC[-1]+1 -> 30405 | K43: 3
A44: 3050 | B44: =RC[1] -> 30501 | C44: =RC[-2]*10+1 -> 30501 | D44: =RC[-1]+1 -> 30502 | E44: =RC[-1]+1 -> 30503 | F44: =RC[-1]+1 -> 30504 | G44: =RC[-1]+1 -> 30505 | K44: 3
A45: 3060 | B45: =RC[1] -> 30601 | C45: =RC[-2]*10+1 -> 30601 | D45: =RC[-1]+1 -> 30602 | E45: =RC[-1]+1 -> 30603 | F45: =RC[-1]+1 -> 30604 | G45: =RC[-1]+1 -> 30605 | K45: 3
A46: 3070 | B46: =RC[1] -> 30701 | C46: =RC[-2]*10+1 -> 30701 | D46: =RC[-1]+1 -> 30702 | E46: =RC[-1]+1 -> 30703 | F46: =RC[-1]+1 -> 30704 | G46: =RC[-1]+1 -> 30705 | K46: 3
A47: 3071 | B47: =RC[1] -> 30711 | C47: =RC[-2]*10+1 -> 30711 | D47: =RC[-1]+1 -> 30712 | E47: =RC[-1]+1 -> 30713 | F47: =RC[-1]+1 -> 30714 | G47: =RC[-1]+1 -> 30715 | K47: 3
A48: 3072 | B48: =RC[1] -> 30721 | C48: =RC[-2]*10+1 -> 30721 | D48: =RC[-1]+1 -> 30722 | E48: =RC[-1]+1 -> 30723 | F48: =RC[-1]+1 -> 30724 | G48: =RC[-1]+1 -> 30725 | K48: 3
A49: 3073 | B49: =RC[1] -> 30731 | C49: =RC[-2]*10+1 -> 30731 | D49: =RC[-1]+1 -> 30732 | E49: =RC[-1]+1 -> 30733 | F49: =RC[-1]+1 -> 30734 | G49: =RC[-1]+1 -> 30735 | K49: 3
A50: 3080 | B50: =RC[1] -> 30801 | C50: =RC[-2]*10+1 -> 30801 | D50: =RC[-1]+1 -> 30802 | E50: =RC[-1]+1 -> 30803 | F50: =RC[-1]+1 -> 30804 | G50: =RC[-1]+1 -> 30805 | K50: 3
A51: 3081 | B51: =RC[1] -> 30811 | C51: =RC[-2]*10+1 -> 30811 | D51: =RC[-1]+1 -> 30812 | E51: =RC[-1]+1 -> 30813 | F51: =RC[-1]+1 -> 30814 | G51: =RC[-1]+1 -> 30815 | K51: 3
A52: 3082 | B52: =RC[1] -> 30821 | C52: =RC[-2]*10+1 -> 30821 | D52: =RC[-1]+1 -> 30822 | E52: =RC[-1]+1 -> 30823 | F52: =RC[-1]+1 -> 30824 | G52: =RC[-1]+1 -> 30825 | K52: 3
A53: 3083 | B53: =RC[1] -> 30831 | C53: =RC[-2]*10+1 -> 30831 | D53: =RC[-1]+1 -> 30832 | E53: =RC[-1]+1 -> 30833 | F53: =RC[-1]+1 -> 30834 | G53: =RC[-1]+1 -> 30835 | K53: 3
A54: 3090 | B54: =RC[1] -> 30901 | C54: =RC[-2]*10+1 -> 30901 | D54: =RC[-1]+1 -> 30902 | E54: =RC[-1]+1 -> 30903 | F54: =RC[-1]+1 -> 30904 | G54: =RC[-1]+1 -> 30905 | K54: 3
A55: 3091 | B55: =RC[1] -> 30911 | C55: =RC[-2]*10+1 -> 30911 | D55: =RC[-1]+1 -> 30912 | E55: =RC[-1]+1 -> 30913 | F55: =RC[-1]+1 -> 30914 | G55: =RC[-1]+1 -> 30915 | K55: 3
A56: 3092 | B56: =RC[1] -> 30921 | C56: =RC[-2]*10+1 -> 30921 | D56: =RC[-1]+1 -> 30922 | E56: =RC[-1]+1 -> 30923 | F56: =RC[-1]+1 -> 30924 | G56: =RC[-1]+1 -> 30925 | K56: 3
A57: 3093 | B57: =RC[1] -> 30931 | C57: =RC[-2]*10+1 -> 30931 | D57: =RC[-1]+1 -> 30932 | E57: =RC[-1]+1 -> 30933 | F57: =RC[-1]+1 -> 30934 | G57: =RC[-1]+1 -> 30935 | K57: 3
A58: 3100 | B58: =RC[1] -> 31001 | C58: =RC[-2]*10+1 -> 31001 | D58: =RC[-1]+1 -> 31002 | E58: =RC[-1]+1 -> 31003 | F58: =RC[-1]+1 -> 31004 | G58: =RC[-1]+1 -> 31005 | K58: 3
A59: 3101 | B59: =RC[1] -> 31011 | C59: =RC[-2]*10+1 -> 31011 | D59: =RC[-1]+1 -> 31012 | E59: =RC[-1]+1 -> 31013 | F59: =RC[-1]+1 -> 31014 | G59: =RC[-1]+1 -> 31015 | K59: 3
A60: 3102 | B60: =RC[1] -> 31021 | C60: =RC[-2]*10+1 -> 31021 | D60: =RC[-1]+1 -> 31022 | E60: =RC[-1]+1 -> 31023 | F60: =RC[-1]+1 -> 31024 | G60: =RC[-1]+1 -> 31025 | K60: 3
A61: 3103 | B61: =RC[1] -> 31031 | C61: =RC[-2]*10+1 -> 31031 | D61: =RC[-1]+1 -> 31032 | E61: =RC[-1]+1 -> 31033 | F61: =RC[-1]+1 -> 31034 | G61: =RC[-1]+1 -> 31035 | K61: 3
A62: 10000 | B62: 10003 | C62: 10000 | D62: 10000 | E62: 10001 | F62: 10002 | G62: 10003 | K62: 3
A63: 10010 | B63: 10013 | C63: 10010 | D63: 10010 | E63: 10011 | F63: 10012 | G63: 10013 | K63: 3
A64: 10020 | B64: 10023 | C64: 10020 | D64: 10020 | E64: 10021 | F64: 10022 | G64: 10023 | K64: 3
A65: 10100 | B65: 10100 | C65: 10100 | D65: 10101 | E65: 10102 | F65: 10102 | G65: 10103 | K65: 3
A66: 10110 | B66: 10110 | C66: 10110 | D66: 10111 | E66: 10112 | F66: 10112 | G66: 10113 | K66: 3
A67: 10120 | B67: 10120 | C67: 10120 | D67: 10121 | E67: 10122 | F67: 10122 | G67: 10123 | K67: 3
A68: 10200 | B68: 10202 | C68: 10200 | D68: 10201 | E68: 10201 | F68: 10202 | G68: 10203 | K68: 3
A69: 10210 | B69: 10212 | C69: 10210 | D69: 10211 | E69: 10211 | F69: 10212 | G69: 10213 | K69: 3
A70: 10220 | B70: 10222 | C70: 10220 | D70: 10221 | E70: 10221 | F70: 10222 | G70: 10223 | K70: 3
A71: 10300 | B71: 10301 | C71: 10300 | D71: 10300 | E71: 10301 | F71: 10302 | G71: 10303 | K71: 3
A72: 10310 | B72: 10311 | C72: 10310 | D72: 10310 | E72: 10311 | F72: 10312 | G72: 10313 | K72: 3
A73: 10320 | B73: 10321 | C73: 10320 | D73: 10320 | E73: 10321 | F73: 10322 | G73: 10323 | K73: 3
A74: 10400 | B74: 10400 | C74: 10400 | D74: 10401 | E74: 10402 | F74: 10403 | G74: 10403 | K74: 3
A75: 10410 | B75: 10410 | C75: 10410 | D75: 10411 | E75: 10412 | F75: 10413 | G75: 10413 | K75: 3
A76: 10420 | B76: 10420 | C76: 10420 | D76: 10421 | E76: 10422 | F76: 10423 | G76: 10423 | K76: 3
A77: 10500 | B77: 10504 | C77: 10500 | D77: 10501 | E77: 10502 | F77: 10503 | G77: 10504 | K77: 3
A78: 10510 | B78: 10514 | C78: 10510 | D78: 10511 | E78: 10512 | F78: 10513 | G78: 10514 | K78: 3
A79: 10520 | B79: 10524 | C79: 10520 | D79: 10521 | E79: 10522 | F79: 10523 | G79: 10524 | K79: 3
A80: 10600 | B80: 10604 | C80: 10600 | D80: 10601 | E80: 10602 | F80: 10603 | G80: 10604 | K80: 3
A81: 10610 | B81: 10614 | C81: 10610 | D81: 10611 | E81: 10612 | F81: 10613 | G81: 10614 | K81: 3
A82: 10620 | B82: 10624 | C82: 10620 | D82: 10621 | E82: 10622 | F82: 10623 | G82: 10624 | K82: 3
A83: 10700 | B83: 10704 | C83: 10700 | D83: 10701 | E83: 10702 | F83: 10703 | G83: 10704 | K83: 3
A84: 10710 | B84: 10714 | C84: 10710 | D84: 10711 | E84: 10712 | F84: 10713 | G84: 10714 | K84: 3
A85: 10720 | B85: 10724 | C85: 10720 | D85: 10721 | E85: 10722 | F85: 10723 | G85: 10724 | K85: 3
A86: 10800 | B86: 10804 | C86: 10800 | D86: 10801 | E86: 10802 | F86: 10803 | G86: 10804 | K86: 3
A87: 10810 | B87: 10814 | C87: 10810 | D87: 10811 | E87: 10812 | F87: 10813 | G87: 10814 | K87: 3
A88: 10820 | B88: 10824 | C88: 10820 | D88: 10821 | E88: 10822 | F88: 10823 | G88: 10824 | K88: 3
A89: 10900 | B89: 10904 | C89: 10900 | D89: 10901 | E89: 10902 | F89: 10903 | G89: 10904 | K89: 3
A90: 10910 | B90: 10914 | C90: 10910 | D90: 10911 | E90: 10912 | F90: 10913 | G90: 10914 | K90: 3
A91: 10920 | B91: 10924 | C91: 10920 | D91: 10921 | E91: 10922 | F91: 10923 | G91: 10924 | K91: 3
A92: 11000 | B92: 11004 | C92: 11000 | D92: 11001 | E92: 11002 | F92: 11003 | G92: 11004 | K92: 3
A93: 11010 | B93: 11014 | C93: 11010 | D93: 11011 | E93: 11012 | F93: 11013 | G93: 11014 | K93: 3
A94: 11020 | B94: 11024 | C94: 11020 | D94: 11021 | E94: 11022 | F94: 11023 | G94: 11024 | K94: 3
A95: 11100 | B95: 11104 | C95: 11100 | D95: 11101 | E95: 11102 | F95: 11103 | G95: 11104 | K95: 3
A96: 11110 | B96: 11114 | C96: 11110 | D96: 11111 | E96: 11112 | F96: 11113 | G96: 11114 | K96: 3
A97: 11120 | B97: 11124 | C97: 11120 | D97: 11121 | E97: 11122 | F97: 11123 | G97: 11124 | K97: 3
A98: 11200 | B98: 11204 | C98: 11200 | D98: 11201 | E98: 11202 | F98: 11203 | G98: 11204 | K98: 3
A99: 11210 | B99: 11214 | C99: 11210 | D99: 11211 | E99: 11212 | F99: 11213 | G99: 11214 | K99: 3
A100: 11220 | B100: 11224 | C100: 11220 | D100: 11221 | E100: 11222 | F100: 11223 | G100: 11224 | K100: 3
A101: 11300 | B101: 11304 | C101: 11300 | D101: 11301 | E101: 11302 | F101: 11303 | G101: 11304 | K101: 3
A102: 11310 | B102: 11314 | C102: 11310 | D102: 11311 | E102: 11312 | F102: 11313 | G102: 11314 | K102: 3
A103: 11320 | B103: 11324 | C103: 11320 | D103: 11321 | E103: 11322 | F103: 11323 | G103: 11324 | K103: 3
A104: 11400 | B104: 11404 | C104: 11400 | D104: 11401 | E104: 11402 | F104: 11403 | G104: 11404 | K104: 3
A105: 11410 | B105: 11414 | C105: 11410 | D105: 11411 | E105: 11412 | F105: 11413 | G105: 11414 | K105: 3
A106: 11420 | B106: 11424 | C106: 11420 | D106: 11421 | E106: 11422 | F106: 11423 | G106: 11424 | K106: 3
A107: 11500 | B107: 11504 | C107: 11500 | D107: 11501 | E107: 11502 | F107: 11503 | G107: 11504 | K107: 3
A108: 11510 | B108: 11514 | C108: 11510 | D108: 11511 | E108: 11512 | F108: 11513 | G108: 11514 | K108: 3
A109: 11520 | B109: 11524 | C109: 11520 | D109: 11521 | E109: 11522 | F109: 11523 | G109: 11524 | K109: 3
A110: 11600 | B110: 11604 | C110: 11600 | D110: 11601 | E110: 11602 | F110: 11603 | G110: 11604 | K110: 3
A111: 11610 | B111: 11614 | C111: 11610 | D111: 11611 | E111: 11612 | F111: 11613 | G111: 11614 | K111: 3
A112: 11620 | B112: 11624 | C112: 11620 | D112: 11621 | E112: 11622 | F112: 11623 | G112: 11624 | K112: 3
A113: 11700 | B113: 11704 | C113: 11700 | D113: 11701 | E113: 11702 | F113: 11703 | G113: 11704 | K113: 3
A114: 11710 | B114: 11714 | C114: 11710 | D114: 11711 | E114: 11712 | F114: 11713 | G114: 11714 | K114: 3
A115: 11720 | B115: 11724 | C115: 11720 | D115: 11721 | E115: 11722 | F115: 11723 | G115: 11724 | K115: 3
A116: 11800 | B116: 11804 | C116: 11800 | D116: 11801 | E116: 11802 | F116: 11803 | G116: 11804 | K116: 3
A117: 11810 | B117: 11814 | C117: 11810 | D117: 11811 | E117: 11812 | F117: 11813 | G117: 11814 | K117: 3
A118: 11820 | B118: 11824 | C118: 11820 | D118: 11821 | E118: 11822 | F118: 11823 | G118: 11824 | K118: 3
A119: 11900 | B119: 11904 | C119: 11900 | D119: 11901 | E119: 11902 | F119: 11903 | G119: 11904 | K119: 3
A120: 11910 | B120: 11914 | C120: 11910 | D120: 11911 | E120: 11912 | F120: 11913 | G120: 11914 | K120: 3
A121: 11920 | B121: 11924 | C121: 11920 | D121: 11921 | E121: 11922 | F121: 11923 | G121: 11924 | K121: 3
A122: 12000 | B122: 12004 | C122: 12000 | D122: 12001 | E122: 12002 | F122: 12003 | G122: 12004 | K122: 3
A123: 12010 | B123: 12014 | C123: 12010 | D123: 12011 | E123: 12012 | F123: 12013 | G123: 12014 | K123: 3
A124: 12020 | B124: 12024 | C124: 12020 | D124: 12021 | E124: 12022 | F124: 12023 | G124: 12024 | K124: 3
A125: 12100 | B125: 12104 | C125: 12100 | D125: 12101 | E125: 12102 | F125: 12103 | G125: 12104 | K125: 3
A126: 12110 | B126: 12114 | C126: 12110 | D126: 12111 | E126: 12112 | F126: 12113 | G126: 12114 | K126: 3
A127: 12120 | B127: 12124 | C127: 12120 | D127: 12121 | E127: 12122 | F127: 12123 | G127: 12124 | K127: 3
A128: 12200 | B128: 12204 | C128: 12200 | D128: 12201 | E128: 12202 | F128: 12203 | G128: 12204 | K128: 3
A129: 12210 | B129: 12214 | C129: 12210 | D129: 12211 | E129: 12212 | F129: 12213 | G129: 12214 | K129: 3
A130: 12220 | B130: 12224 | C130: 12220 | D130: 12221 | E130: 12222 | F130: 12223 | G130: 12224 | K130: 3
A131: 12300 | B131: 12304 | C131: 12300 | D131: 12301 | E131: 12302 | F131: 12303 | G131: 12304 | K131: 3
A132: 12310 | B132: 12314 | C132: 12310 | D132: 12311 | E132: 12312 | F132: 12313 | G132: 12314 | K132: 3
A133: 12320 | B133: 12324 | C133: 12320 | D133: 12321 | E133: 12322 | F133: 12323 | G133: 12324 | K133: 3
A134: 12400 | B134: 12404 | C134: 12400 | D134: 12401 | E134: 12402 | F134: 12403 | G134: 12404 | K134: 3
A135: 12410 | B135: 12414 | C135: 12410 | D135: 12411 | E135: 12412 | F135: 12413 | G135: 12414 | K135: 3
A136: 12420 | B136: 12424 | C136: 12420 | D136: 12421 | E136: 12422 | F136: 12423 | G136: 12424 | K136: 3
A137: 12500 | B137: 12504 | C137: 12500 | D137: 12501 | E137: 12502 | F137: 12503 | G137: 12504 | K137: 3
A138: 12510 | B138: 12514 | C138: 12510 | D138: 12511 | E138: 12512 | F138: 12513 | G138: 12514 | K138: 3
A139: 12520 | B139: 12524 | C139: 12520 | D139: 12521 | E139: 12522 | F139: 12523 | G139: 12524 | K139: 3
A140: 12600 | B140: 12604 | C140: 12600 | D140: 12601 | E140: 12602 | F140: 12603 | G140: 12604 | K140: 3
A141: 12610 | B141: 12614 | C141: 12610 | D141: 12611 | E141: 12612 | F141: 12613 | G141: 12614 | K141: 3
A142: 12620 | B142: 12624 | C142: 12620 | D142: 12621 | E142: 12622 | F142: 12623 | G142: 12624 | K142: 3
A143: 12700 | B143: 12704 | C143: 12700 | D143: 12701 | E143: 12702 | F143: 12703 | G143: 12704 | K143: 3
A144: 12710 | B144: 12714 | C144: 12710 | D144: 12711 | E144: 12712 | F144: 12713 | G144: 12714 | K144: 3
A145: 12720 | B145: 12724 | C145: 12720 | D145: 12721 | E145: 12722 | F145: 12723 | G145: 12724 | K145: 3
A146: 12800 | B146: 12804 | C146: 12800 | D146: 12801 | E146: 12802 | F146: 12803 | G146: 12804 | K146: 3
A147: 12810 | B147: 12814 | C147: 12810 | D147: 12811 | E147: 12812 | F147: 12813 | G147: 12814 | K147: 3
A148: 12820 | B148: 12824 | C148: 12820 | D148: 12821 | E148: 12822 | F148: 12823 | G148: 12824 | K148: 3
A149: 12900 | B149: 12904 | C149: 12900 | D149: 12901 | E149: 12902 | F149: 12903 | G149: 12904 | K149: 3
A150: 12910 | B150: 12914 | C150: 12910 | D150: 12911 | E150: 12912 | F150: 12913 | G150: 12914 | K150: 3
A151: 12920 | B151: 12924 | C151: 12920 | D151: 12921 | E151: 12922 | F151: 12923 | G151: 12924 | K151: 3
A152: 13000 | B152: 13004 | C152: 13000 | D152: 13001 | E152: 13002 | F152: 13003 | G152: 13004 | K152: 3
A153: 13010 | B153: 13014 | C153: 13010 | D153: 13011 | E153: 13012 | F153: 13013 | G153: 13014 | K153: 3
A154: 13020 | B154: 13024 | C154: 13020 | D154: 13021 | E154: 13022 | F154: 13023 | G154: 13024 | K154: 3
A155: 13100 | B155: 13104 | C155: 13100 | D155: 13101 | E155: 13102 | F155: 13103 | G155: 13104 | K155: 3
A156: 13110 | B156: 13114 | C156: 13110 | D156: 13111 | E156: 13112 | F156: 13113 | G156: 13114 | K156: 3
A157: 13120 | B157: 13124 | C157: 13120 | D157: 13121 | E157: 13122 | F157: 13123 | G157: 13124 | K157: 3
A158: 13200 | B158: 13204 | C158: 13200 | D158: 13201 | E158: 13202 | F158: 13203 | G158: 13204 | K158: 3
A159: 13210 | B159: 13214 | C159: 13210 | D159: 13211 | E159: 13212 | F159: 13213 | G159: 13214 | K159: 3
A160: 13220 | B160: 13224 | C160: 13220 | D160: 13221 | E160: 13222 | F160: 13223 | G160: 13224 | K160: 3
A161: 13300 | B161: 13304 | C161: 13300 | D161: 13301 | E161: 13302 | F161: 13303 | G161: 13304 | K161: 3
A162: 13310 | B162: 13314 | C162: 13310 | D162: 13311 | E162: 13312 | F162: 13313 | G162: 13314 | K162: 3
A163: 13320 | B163: 13324 | C163: 13320 | D163: 13321 | E163: 13322 | F163: 13323 | G163: 13324 | K163: 3
A164: 13400 | B164: 13404 | C164: 13400 | D164: 13401 | E164: 13402 | F164: 13403 | G164: 13404 | K164: 3
A165: 13410 | B165: 13414 | C165: 13410 | D165: 13411 | E165: 13412 | F165: 13413 | G165: 13414 | K165: 3
A166: 13420 | B166: 13424 | C166: 13420 | D166: 13421 | E166: 13422 | F166: 13423 | G166: 13424 | K166: 3
A167: 13500 | B167: 13504 | C167: 13500 | D167: 13501 | E167: 13502 | F167: 13503 | G167: 13504 | K167: 3
A168: 13510 | B168: 13514 | C168: 13510 | D168: 13511 | E168: 13512 | F168: 13513 | G168: 13514 | K168: 3
A169: 13520 | B169: 13524 | C169: 13520 | D169: 13521 | E169: 13522 | F169: 13523 | G169: 13524 | K169: 3
A170: 13600 | B170: 13604 | C170: 13600 | D170: 13601 | E170: 13602 | F170: 13603 | G170: 13604 | K170: 3
A171: 13610 | B171: 13614 | C171: 13610 | D171: 13611 | E171: 13612 | F171: 13613 | G171: 13614 | K171: 3
A172: 13620 | B172: 13624 | C172: 13620 | D172: 13621 | E172: 13622 | F172: 13623 | G172: 13624 | K172: 3
A173: 13700 | B173: 13704 | C173: 13700 | D173: 13701 | E173: 13702 | F173: 13703 | G173: 13704 | K173: 3
A174: 13710 | B174: 13714 | C174: 13710 | D174: 13711 | E174: 13712 | F174: 13713 | G174: 13714 | K174: 3
A175: 13720 | B175: 13724 | C175: 13720 | D175: 13721 | E175: 13722 | F175: 13723 | G175: 13724 | K175: 3
A176: 13800 | B176: 13804 | C176: 13800 | D176: 13801 | E176: 13802 | F176: 13803 | G176: 13804 | K176: 3
A177: 13810 | B177: 13814 | C177: 13810 | D177: 13811 | E177: 13812 | F177: 13813 | G177: 13814 | K177: 3
A178: 13820 | B178: 13824 | C178: 13820 | D178: 13821 | E178: 13822 | F178: 13823 | G178: 13824 | K178: 3
A179: 13900 | B179: 13904 | C179: 13900 | D179: 13901 | E179: 13902 | F179: 13903 | G179: 13904 | K179: 3
A180: 13910 | B180: 13914 | C180: 13910 | D180: 13911 | E180: 13912 | F180: 13913 | G180: 13914 | K180: 3
A181: 13920 | B181: 13924 | C181: 13920 | D181: 13921 | E181: 13922 | F181: 13923 | G181: 13924 | K181: 3
A182: 14000 | B182: 14004 | C182: 14000 | D182: 14001 | E182: 14002 | F182: 14003 | G182: 14004 | K182: 3
A183: 14010 | B183: 14014 | C183: 14010 | D183: 14011 | E183: 14012 | F183: 14013 | G183: 14014 | K183: 3
A184: 14020 | B184: 14024 | C184: 14020 | D184: 14021 | E184: 14022 | F184: 14023 | G184: 14024 | K184: 3
A185: 14100 | B185: 14104 | C185: 14100 | D185: 14101 | E185: 14102 | F185: 14103 | G185: 14104 | K185: 3
A186: 14110 | B186: 14114 | C186: 14110 | D186: 14111 | E186: 14112 | F186: 14113 | G186: 14114 | K186: 3
A187: 14120 | B187: 14124 | C187: 14120 | D187: 14121 | E187: 14122 | F187: 14123 | G187: 14124 | K187: 3
A188: 14200 | B188: 14204 | C188: 14200 | D188: 14201 | E188: 14202 | F188: 14203 | G188: 14204 | K188: 3
A189: 14210 | B189: 14214 | C189: 14210 | D189: 14211 | E189: 14212 | F189: 14213 | G189: 14214 | K189: 3
A190: 14220 | B190: 14224 | C190: 14220 | D190: 14221 | E190: 14222 | F190: 14223 | G190: 14224 | K190: 3
A191: 14300 | B191: 14304 | C191: 14300 | D191: 14301 | E191: 14302 | F191: 14303 | G191: 14304 | K191: 3
A192: 14310 | B192: 14314 | C192: 14310 | D192: 14311 | E192: 14312 | F192: 14313 | G192: 14314 | K192: 3
A193: 14320 | B193: 14324 | C193: 14320 | D193: 14321 | E193: 14322 | F193: 14323 | G193: 14324 | K193: 3
A194: 14400 | B194: 14404 | C194: 14400 | D194: 14401 | E194: 14402 | F194: 14403 | G194: 14404 | K194: 3
A195: 14410 | B195: 14414 | C195: 14410 | D195: 14411 | E195: 14412 | F195: 14413 | G195: 14414 | K195: 3
A196: 14420 | B196: 14424 | C196: 14420 | D196: 14421 | E196: 14422 | F196: 14423 | G196: 14424 | K196: 3
A197: 14500 | B197: 14504 | C197: 14500 | D197: 14501 | E197: 14502 | F197: 14503 | G197: 14504 | K197: 3
A198: 14510 | B198: 14514 | C198: 14510 | D198: 14511 | E198: 14512 | F198: 14513 | G198: 14514 | K198: 3
A199: 14520 | B199: 14524 | C199: 14520 | D199: 14521 | E199: 14522 | F199: 14523 | G199: 14524 | K199: 3
A200: 14600 | B200: 14604 | C200: 14600 | D200: 14601 | E200: 14602 | F200: 14603 | G200: 14604 | K200: 3
A201: 14610 | B201: 14614 | C201: 14610 | D201: 14611 | E201: 14612 | F201: 14613 | G201: 14614 | K201: 3
A202: 14620 | B202: 14624 | C202: 14620 | D202: 14621 | E202: 14622 | F202: 14623 | G202: 14624 | K202: 3
A203: 14700 | B203: 14704 | C203: 14700 | D203: 14701 | E203: 14702 | F203: 14703 | G203: 14704 | K203: 3
A204: 14710 | B204: 14714 | C204: 14710 | D204: 14711 | E204: 14712 | F204: 14713 | G204: 14714 | K204: 3
A205: 14720 | B205: 14724 | C205: 14720 | D205: 14721 | E205: 14722 | F205: 14723 | G205: 14724 | K205: 3
A206: 14800 | B206: 14804 | C206: 14800 | D206: 14801 | E206: 14802 | F206: 14803 | G206: 14804 | K206: 3
A207: 14810 | B207: 14814 | C207: 14810 | D207: 14811 | E207: 14812 | F207: 14813 | G207: 14814 | K207: 3
A208: 14820 | B208: 14824 | C208: 14820 | D208: 14821 | E208: 14822 | F208: 14823 | G208: 14824 | K208: 3
A209: 14900 | B209: 14904 | C209: 14900 | D209: 14901 | E209: 14902 | F209: 14903 | G209: 14904 | K209: 3
A210: 14910 | B210: 14914 | C210: 14910 | D210: 14911 | E210: 14912 | F210: 14913 | G210: 14914 | K210: 3
A211: 14920 | B211: 14924 | C211: 14920 | D211: 14921 | E211: 14922 | F211: 14923 | G211: 14924 | K211: 3
A212: 40001 | B212: 40001 | C212: 40001 | D212: 0 | E212: 0 | F212: 0 | G212: 0 | K212: 3 | L212: 世界BOSS
A213: 40002 | B213: 40002 | C213: 40002 | D213: 0 | E213: 0 | F213: 0 | G213: 0 | K213: 3
A214: 40003 | B214: 40003 | C214: 40003 | D214: 0 | E214: 0 | F214: 0 | G214: 0 | K214: 3
A215: 40004 | B215: 40004 | C215: 40004 | D215: 0 | E215: 0 | F215: 0 | G215: 0 | K215: 3
A216: 40005 | B216: 40005 | C216: 40005 | D216: 0 | E216: 0 | F216: 0 | G216: 0 | K216: 3
A217: 40006 | B217: 40006 | C217: 40006 | D217: 0 | E217: 0 | F217: 0 | G217: 0 | K217: 3
A218: 40007 | B218: 40007 | C218: 40007 | D218: 0 | E218: 0 | F218: 0 | G218: 0 | K218: 3
A219: 40008 | B219: 40008 | C219: 40008 | D219: 0 | E219: 0 | F219: 0 | G219: 0 | K219: 3
A220: 40009 | B220: 40009 | C220: 40009 | D220: 0 | E220: 0 | F220: 0 | G220: 0 | K220: 3
A221: 40010 | B221: 40010 | C221: 40010 | D221: 0 | E221: 0 | F221: 0 | G221: 0 | K221: 3
A222: 40011 | B222: 40011 | C222: 40011 | D222: 0 | E222: 0 | F222: 0 | G222: 0 | K222: 3
A223: 40012 | B223: 40012 | C223: 40012 | D223: 0 | E223: 0 | F223: 0 | G223: 0 | K223: 3
A224: 40013 | B224: 40013 | C224: 40013 | D224: 0 | E224: 0 | F224: 0 | G224: 0 | K224: 3
A225: 40014 | B225: 40014 | C225: 40014 | D225: 0 | E225: 0 | F225: 0 | G225: 0 | K225: 3
A226: 40015 | B226: 40015 | C226: 40015 | D226: 0 | E226: 0 | F226: 0 | G226: 0 | K226: 3
A227: 40016 | B227: 40016 | C227: 40016 | D227: 0 | E227: 0 | F227: 0 | G227: 0 | K227: 3
A228: 40017 | B228: 40017 | C228: 40017 | D228: 0 | E228: 0 | F228: 0 | G228: 0 | K228: 3
A229: 40018 | B229: 40018 | C229: 40018 | D229: 0 | E229: 0 | F229: 0 | G229: 0 | K229: 3
A230: 40019 | B230: 40019 | C230: 40019 | D230: 0 | E230: 0 | F230: 0 | G230: 0 | K230: 3
A231: 40020 | B231: 40020 | C231: 40020 | D231: 0 | E231: 0 | F231: 0 | G231: 0 | K231: 3
A232: 40021 | B232: 40021 | C232: 40021 | D232: 0 | E232: 0 | F232: 0 | G232: 0 | K232: 3
A233: 40022 | B233: 40022 | C233: 40022 | D233: 0 | E233: 0 | F233: 0 | G233: 0 | K233: 3
A234: 40023 | B234: 40023 | C234: 40023 | D234: 0 | E234: 0 | F234: 0 | G234: 0 | K234: 3
A235: 40024 | B235: 40024 | C235: 40024 | D235: 0 | E235: 0 | F235: 0 | G235: 0 | K235: 3
A236: 40025 | B236: 40025 | C236: 40025 | D236: 0 | E236: 0 | F236: 0 | G236: 0 | K236: 3
A237: 40026 | B237: 40026 | C237: 40026 | D237: 0 | E237: 0 | F237: 0 | G237: 0 | K237: 3
A238: 40027 | B238: 40027 | C238: 40027 | D238: 0 | E238: 0 | F238: 0 | G238: 0 | K238: 3
A239: 40028 | B239: 40028 | C239: 40028 | D239: 0 | E239: 0 | F239: 0 | G239: 0 | K239: 3
A240: 40029 | B240: 40029 | C240: 40029 | D240: 0 | E240: 0 | F240: 0 | G240: 0 | K240: 3
A241: 40030 | B241: 40030 | C241: 40030 | D241: 0 | E241: 0 | F241: 0 | G241: 0 | K241: 3
A242: 40031 | B242: 40031 | C242: 40031 | D242: 0 | E242: 0 | F242: 0 | G242: 0 | K242: 3
A243: 40032 | B243: 40032 | C243: 40032 | D243: 0 | E243: 0 | F243: 0 | G243: 0 | K243: 3
A244: 40033 | B244: 40033 | C244: 40033 | D244: 0 | E244: 0 | F244: 0 | G244: 0 | K244: 3
A245: 40034 | B245: 40034 | C245: 40034 | D245: 0 | E245: 0 | F245: 0 | G245: 0 | K245: 3
A246: 40035 | B246: 40035 | C246: 40035 | D246: 0 | E246: 0 | F246: 0 | G246: 0 | K246: 3
A247: 40036 | B247: 40036 | C247: 40036 | D247: 0 | E247: 0 | F247: 0 | G247: 0 | K247: 3
A248: 40037 | B248: 40037 | C248: 40037 | D248: 0 | E248: 0 | F248: 0 | G248: 0 | K248: 3
A249: 40038 | B249: 40038 | C249: 40038 | D249: 0 | E249: 0 | F249: 0 | G249: 0 | K249: 3
A250: 40039 | B250: 40039 | C250: 40039 | D250: 0 | E250: 0 | F250: 0 | G250: 0 | K250: 3
A251: 40040 | B251: 40040 | C251: 40040 | D251: 0 | E251: 0 | F251: 0 | G251: 0 | K251: 3
A252: 40041 | B252: 40041 | C252: 40041 | D252: 0 | E252: 0 | F252: 0 | G252: 0 | K252: 3
A253: 40042 | B253: 40042 | C253: 40042 | D253: 0 | E253: 0 | F253: 0 | G253: 0 | K253: 3
A254: 40043 | B254: 40043 | C254: 40043 | D254: 0 | E254: 0 | F254: 0 | G254: 0 | K254: 3
A255: 40044 | B255: 40044 | C255: 40044 | D255: 0 | E255: 0 | F255: 0 | G255: 0 | K255: 3
A256: 40045 | B256: 40045 | C256: 40045 | D256: 0 | E256: 0 | F256: 0 | G256: 0 | K256: 3
A257: 40046 | B257: 40046 | C257: 40046 | D257: 0 | E257: 0 | F257: 0 | G257: 0 | K257: 3
A258: 40047 | B258: 40047 | C258: 40047 | D258: 0 | E258: 0 | F258: 0 | G258: 0 | K258: 3
A259: 40048 | B259: 40048 | C259: 40048 | D259: 0 | E259: 0 | F259: 0 | G259: 0 | K259: 3
A260: 40049 | B260: 40049 | C260: 40049 | D260: 0 | E260: 0 | F260: 0 | G260: 0 | K260: 3
A261: 40050 | B261: 40050 | C261: 40050 | D261: 0 | E261: 0 | F261: 0 | G261: 0 | K261: 3
A262: 40051 | B262: 40051 | C262: 40051 | D262: 0 | E262: 0 | F262: 0 | G262: 0 | K262: 3
A263: 40052 | B263: 40052 | C263: 40052 | D263: 0 | E263: 0 | F263: 0 | G263: 0 | K263: 3
A264: 40053 | B264: 40053 | C264: 40053 | D264: 0 | E264: 0 | F264: 0 | G264: 0 | K264: 3
A265: 40054 | B265: 40054 | C265: 40054 | D265: 0 | E265: 0 | F265: 0 | G265: 0 | K265: 3
A266: 40055 | B266: 40055 | C266: 40055 | D266: 0 | E266: 0 | F266: 0 | G266: 0 | K266: 3
A267: 40056 | B267: 40056 | C267: 40056 | D267: 0 | E267: 0 | F267: 0 | G267: 0 | K267: 3
A268: 40057 | B268: 40057 | C268: 40057 | D268: 0 | E268: 0 | F268: 0 | G268: 0 | K268: 3
A269: 40058 | B269: 40058 | C269: 40058 | D269: 0 | E269: 0 | F269: 0 | G269: 0 | K269: 3
A270: 40059 | B270: 40059 | C270: 40059 | D270: 0 | E270: 0 | F270: 0 | G270: 0 | K270: 3
A271: 40060 | B271: 40060 | C271: 40060 | D271: 0 | E271: 0 | F271: 0 | G271: 0 | K271: 3
A272: 40061 | B272: 40061 | C272: 40061 | D272: 0 | E272: 0 | F272: 0 | G272: 0 | K272: 3
A273: 40062 | B273: 40062 | C273: 40062 | D273: 0 | E273: 0 | F273: 0 | G273: 0 | K273: 3
A274: 40063 | B274: 40063 | C274: 40063 | D274: 0 | E274: 0 | F274: 0 | G274: 0 | K274: 3
A275: 40064 | B275: 40064 | C275: 40064 | D275: 0 | E275: 0 | F275: 0 | G275: 0 | K275: 3
A276: 40065 | B276: 40065 | C276: 40065 | D276: 0 | E276: 0 | F276: 0 | G276: 0 | K276: 3
A277: 40066 | B277: 40066 | C277: 40066 | D277: 0 | E277: 0 | F277: 0 | G277: 0 | K277: 3
A278: 40067 | B278: 40067 | C278: 40067 | D278: 0 | E278: 0 | F278: 0 | G278: 0 | K278: 3
A279: 40068 | B279: 40068 | C279: 40068 | D279: 0 | E279: 0 | F279: 0 | G279: 0 | K279: 3
A280: 40069 | B280: 40069 | C280: 40069 | D280: 0 | E280: 0 | F280: 0 | G280: 0 | K280: 3
A281: 40070 | B281: 40070 | C281: 40070 | D281: 0 | E281: 0 | F281: 0 | G281: 0 | K281: 3
A282: 40071 | B282: 40071 | C282: 40071 | D282: 0 | E282: 0 | F282: 0 | G282: 0 | K282: 3
A283: 40072 | B283: 40072 | C283: 40072 | D283: 0 | E283: 0 | F283: 0 | G283: 0 | K283: 3
A284: 40073 | B284: 40073 | C284: 40073 | D284: 0 | E284: 0 | F284: 0 | G284: 0 | K284: 3
A285: 40074 | B285: 40074 | C285: 40074 | D285: 0 | E285: 0 | F285: 0 | G285: 0 | K285: 3
A286: 40075 | B286: 40075 | C286: 40075 | D286: 0 | E286: 0 | F286: 0 | G286: 0 | K286: 3
A287: 40076 | B287: 40076 | C287: 40076 | D287: 0 | E287: 0 | F287: 0 | G287: 0 | K287: 3
A288: 40077 | B288: 40077 | C288: 40077 | D288: 0 | E288: 0 | F288: 0 | G288: 0 | K288: 3
A289: 40078 | B289: 40078 | C289: 40078 | D289: 0 | E289: 0 | F289: 0 | G289: 0 | K289: 3
A290: 40079 | B290: 40079 | C290: 40079 | D290: 0 | E290: 0 | F290: 0 | G290: 0 | K290: 3
A291: 40080 | B291: 40080 | C291: 40080 | D291: 0 | E291: 0 | F291: 0 | G291: 0 | K291: 3
A292: 40081 | B292: 40081 | C292: 40081 | D292: 0 | E292: 0 | F292: 0 | G292: 0 | K292: 3
A293: 40082 | B293: 40082 | C293: 40082 | D293: 0 | E293: 0 | F293: 0 | G293: 0 | K293: 3
A294: 40083 | B294: 40083 | C294: 40083 | D294: 0 | E294: 0 | F294: 0 | G294: 0 | K294: 3
A295: 40084 | B295: 40084 | C295: 40084 | D295: 0 | E295: 0 | F295: 0 | G295: 0 | K295: 3
A296: 40085 | B296: 40085 | C296: 40085 | D296: 0 | E296: 0 | F296: 0 | G296: 0 | K296: 3
A297: 40086 | B297: 40086 | C297: 40086 | D297: 0 | E297: 0 | F297: 0 | G297: 0 | K297: 3
A298: 40087 | B298: 40087 | C298: 40087 | D298: 0 | E298: 0 | F298: 0 | G298: 0 | K298: 3
A299: 40088 | B299: 40088 | C299: 40088 | D299: 0 | E299: 0 | F299: 0 | G299: 0 | K299: 3
A300: 40089 | B300: 40089 | C300: 40089 | D300: 0 | E300: 0 | F300: 0 | G300: 0 | K300: 3
A301: 40090 | B301: 40090 | C301: 40090 | D301: 0 | E301: 0 | F301: 0 | G301: 0 | K301: 3
A302: 40091 | B302: 40091 | C302: 40091 | D302: 0 | E302: 0 | F302: 0 | G302: 0 | K302: 3
A303: 40092 | B303: 40092 | C303: 40092 | D303: 0 | E303: 0 | F303: 0 | G303: 0 | K303: 3
A304: 40093 | B304: 40093 | C304: 40093 | D304: 0 | E304: 0 | F304: 0 | G304: 0 | K304: 3
A305: 40094 | B305: 40094 | C305: 40094 | D305: 0 | E305: 0 | F305: 0 | G305: 0 | K305: 3
A306: 40095 | B306: 40095 | C306: 40095 | D306: 0 | E306: 0 | F306: 0 | G306: 0 | K306: 3
A307: 40096 | B307: 40096 | C307: 40096 | D307: 0 | E307: 0 | F307: 0 | G307: 0 | K307: 3
A308: 40097 | B308: 40097 | C308: 40097 | D308: 0 | E308: 0 | F308: 0 | G308: 0 | K308: 3
A309: 40098 | B309: 40098 | C309: 40098 | D309: 0 | E309: 0 | F309: 0 | G309: 0 | K309: 3
A310: 40099 | B310: 40099 | C310: 40099 | D310: 0 | E310: 0 | F310: 0 | G310: 0 | K310: 3
A311: 40100 | B311: 40100 | C311: 40100 | D311: 0 | E311: 0 | F311: 0 | G311: 0 | K311: 3
A312: 40101 | B312: 40101 | C312: 40101 | D312: 0 | E312: 0 | F312: 0 | G312: 0 | K312: 3
A313: 40102 | B313: 40102 | C313: 40102 | D313: 0 | E313: 0 | F313: 0 | G313: 0 | K313: 3
A314: 40103 | B314: 40103 | C314: 40103 | D314: 0 | E314: 0 | F314: 0 | G314: 0 | K314: 3
A315: 40104 | B315: 40104 | C315: 40104 | D315: 0 | E315: 0 | F315: 0 | G315: 0 | K315: 3
A316: 40105 | B316: 40105 | C316: 40105 | D316: 0 | E316: 0 | F316: 0 | G316: 0 | K316: 3
A317: 40106 | B317: 40106 | C317: 40106 | D317: 0 | E317: 0 | F317: 0 | G317: 0 | K317: 3
A318: 40107 | B318: 40107 | C318: 40107 | D318: 0 | E318: 0 | F318: 0 | G318: 0 | K318: 3
A319: 40108 | B319: 40108 | C319: 40108 | D319: 0 | E319: 0 | F319: 0 | G319: 0 | K319: 3
A320: 40109 | B320: 40109 | C320: 40109 | D320: 0 | E320: 0 | F320: 0 | G320: 0 | K320: 3
A321: 40110 | B321: 40110 | C321: 40110 | D321: 0 | E321: 0 | F321: 0 | G321: 0 | K321: 3
A322: 40111 | B322: 40111 | C322: 40111 | D322: 0 | E322: 0 | F322: 0 | G322: 0 | K322: 3
A323: 40112 | B323: 40112 | C323: 40112 | D323: 0 | E323: 0 | F323: 0 | G323: 0 | K323: 3
A324: 40113 | B324: 40113 | C324: 40113 | D324: 0 | E324: 0 | F324: 0 | G324: 0 | K324: 3
A325: 40114 | B325: 40114 | C325: 40114 | D325: 0 | E325: 0 | F325: 0 | G325: 0 | K325: 3
A326: 40115 | B326: 40115 | C326: 40115 | D326: 0 | E326: 0 | F326: 0 | G326: 0 | K326: 3
A327: 40116 | B327: 40116 | C327: 40116 | D327: 0 | E327: 0 | F327: 0 | G327: 0 | K327: 3
A328: 40117 | B328: 40117 | C328: 40117 | D328: 0 | E328: 0 | F328: 0 | G328: 0 | K328: 3
A329: 40118 | B329: 40118 | C329: 40118 | D329: 0 | E329: 0 | F329: 0 | G329: 0 | K329: 3
A330: 40119 | B330: 40119 | C330: 40119 | D330: 0 | E330: 0 | F330: 0 | G330: 0 | K330: 3
A331: 40120 | B331: 40120 | C331: 40120 | D331: 0 | E331: 0 | F331: 0 | G331: 0 | K331: 3
A332: 40121 | B332: 40121 | C332: 40121 | D332: 0 | E332: 0 | F332: 0 | G332: 0 | K332: 3
A333: 40122 | B333: 40122 | C333: 40122 | D333: 0 | E333: 0 | F333: 0 | G333: 0 | K333: 3
A334: 40123 | B334: 40123 | C334: 40123 | D334: 0 | E334: 0 | F334: 0 | G334: 0 | K334: 3
A335: 40124 | B335: 40124 | C335: 40124 | D335: 0 | E335: 0 | F335: 0 | G335: 0 | K335: 3
A336: 40125 | B336: 40125 | C336: 40125 | D336: 0 | E336: 0 | F336: 0 | G336: 0 | K336: 3
A337: 40126 | B337: 40126 | C337: 40126 | D337: 0 | E337: 0 | F337: 0 | G337: 0 | K337: 3
A338: 40127 | B338: 40127 | C338: 40127 | D338: 0 | E338: 0 | F338: 0 | G338: 0 | K338: 3
A339: 40128 | B339: 40128 | C339: 40128 | D339: 0 | E339: 0 | F339: 0 | G339: 0 | K339: 3
A340: 40129 | B340: 40129 | C340: 40129 | D340: 0 | E340: 0 | F340: 0 | G340: 0 | K340: 3
A341: 40130 | B341: 40130 | C341: 40130 | D341: 0 | E341: 0 | F341: 0 | G341: 0 | K341: 3
A342: 40131 | B342: 40131 | C342: 40131 | D342: 0 | E342: 0 | F342: 0 | G342: 0 | K342: 3
A343: 40132 | B343: 40132 | C343: 40132 | D343: 0 | E343: 0 | F343: 0 | G343: 0 | K343: 3
A344: 40133 | B344: 40133 | C344: 40133 | D344: 0 | E344: 0 | F344: 0 | G344: 0 | K344: 3
A345: 40134 | B345: 40134 | C345: 40134 | D345: 0 | E345: 0 | F345: 0 | G345: 0 | K345: 3
A346: 40135 | B346: 40135 | C346: 40135 | D346: 0 | E346: 0 | F346: 0 | G346: 0 | K346: 3
A347: 40136 | B347: 40136 | C347: 40136 | D347: 0 | E347: 0 | F347: 0 | G347: 0 | K347: 3
A348: 40137 | B348: 40137 | C348: 40137 | D348: 0 | E348: 0 | F348: 0 | G348: 0 | K348: 3
A349: 40138 | B349: 40138 | C349: 40138 | D349: 0 | E349: 0 | F349: 0 | G349: 0 | K349: 3
A350: 40139 | B350: 40139 | C350: 40139 | D350: 0 | E350: 0 | F350: 0 | G350: 0 | K350: 3
A351: 40140 | B351: 40140 | C351: 40140 | D351: 0 | E351: 0 | F351: 0 | G351: 0 | K351: 3
A352: 40141 | B352: 40141 | C352: 40141 | D352: 0 | E352: 0 | F352: 0 | G352: 0 | K352: 3
A353: 40142 | B353: 40142 | C353: 40142 | D353: 0 | E353: 0 | F353: 0 | G353: 0 | K353: 3
A354: 40143 | B354: 40143 | C354: 40143 | D354: 0 | E354: 0 | F354: 0 | G354: 0 | K354: 3
A355: 40144 | B355: 40144 | C355: 40144 | D355: 0 | E355: 0 | F355: 0 | G355: 0 | K355: 3
A356: 40145 | B356: 40145 | C356: 40145 | D356: 0 | E356: 0 | F356: 0 | G356: 0 | K356: 3
A357: 40146 | B357: 40146 | C357: 40146 | D357: 0 | E357: 0 | F357: 0 | G357: 0 | K357: 3
A358: 40147 | B358: 40147 | C358: 40147 | D358: 0 | E358: 0 | F358: 0 | G358: 0 | K358: 3
A359: 40148 | B359: 40148 | C359: 40148 | D359: 0 | E359: 0 | F359: 0 | G359: 0 | K359: 3
A360: 40149 | B360: 40149 | C360: 40149 | D360: 0 | E360: 0 | F360: 0 | G360: 0 | K360: 3
A361: 40150 | B361: 40150 | C361: 40150 | D361: 0 | E361: 0 | F361: 0 | G361: 0 | K361: 3
A362: 40151 | B362: 40151 | C362: 40151 | D362: 0 | E362: 0 | F362: 0 | G362: 0 | K362: 3
A363: 40152 | B363: 40152 | C363: 40152 | D363: 0 | E363: 0 | F363: 0 | G363: 0 | K363: 3
A364: 40153 | B364: 40153 | C364: 40153 | D364: 0 | E364: 0 | F364: 0 | G364: 0 | K364: 3
A365: 40154 | B365: 40154 | C365: 40154 | D365: 0 | E365: 0 | F365: 0 | G365: 0 | K365: 3
A366: 40155 | B366: 40155 | C366: 40155 | D366: 0 | E366: 0 | F366: 0 | G366: 0 | K366: 3
A367: 40156 | B367: 40156 | C367: 40156 | D367: 0 | E367: 0 | F367: 0 | G367: 0 | K367: 3
A368: 40157 | B368: 40157 | C368: 40157 | D368: 0 | E368: 0 | F368: 0 | G368: 0 | K368: 3
A369: 40158 | B369: 40158 | C369: 40158 | D369: 0 | E369: 0 | F369: 0 | G369: 0 | K369: 3
A370: 40159 | B370: 40159 | C370: 40159 | D370: 0 | E370: 0 | F370: 0 | G370: 0 | K370: 3
A371: 40160 | B371: 40160 | C371: 40160 | D371: 0 | E371: 0 | F371: 0 | G371: 0 | K371: 3
A372: 40161 | B372: 40161 | C372: 40161 | D372: 0 | E372: 0 | F372: 0 | G372: 0 | K372: 3
A373: 40162 | B373: 40162 | C373: 40162 | D373: 0 | E373: 0 | F373: 0 | G373: 0 | K373: 3
A374: 40163 | B374: 40163 | C374: 40163 | D374: 0 | E374: 0 | F374: 0 | G374: 0 | K374: 3
A375: 40164 | B375: 40164 | C375: 40164 | D375: 0 | E375: 0 | F375: 0 | G375: 0 | K375: 3
A376: 40165 | B376: 40165 | C376: 40165 | D376: 0 | E376: 0 | F376: 0 | G376: 0 | K376: 3
A377: 40166 | B377: 40166 | C377: 40166 | D377: 0 | E377: 0 | F377: 0 | G377: 0 | K377: 3
A378: 40167 | B378: 40167 | C378: 40167 | D378: 0 | E378: 0 | F378: 0 | G378: 0 | K378: 3
A379: 40168 | B379: 40168 | C379: 40168 | D379: 0 | E379: 0 | F379: 0 | G379: 0 | K379: 3
A380: 40169 | B380: 40169 | C380: 40169 | D380: 0 | E380: 0 | F380: 0 | G380: 0 | K380: 3
A381: 40170 | B381: 40170 | C381: 40170 | D381: 0 | E381: 0 | F381: 0 | G381: 0 | K381: 3
A382: 40171 | B382: 40171 | C382: 40171 | D382: 0 | E382: 0 | F382: 0 | G382: 0 | K382: 3
A383: 40172 | B383: 40172 | C383: 40172 | D383: 0 | E383: 0 | F383: 0 | G383: 0 | K383: 3
A384: 40173 | B384: 40173 | C384: 40173 | D384: 0 | E384: 0 | F384: 0 | G384: 0 | K384: 3
A385: 40174 | B385: 40174 | C385: 40174 | D385: 0 | E385: 0 | F385: 0 | G385: 0 | K385: 3
A386: 40175 | B386: 40175 | C386: 40175 | D386: 0 | E386: 0 | F386: 0 | G386: 0 | K386: 3
A387: 40176 | B387: 40176 | C387: 40176 | D387: 0 | E387: 0 | F387: 0 | G387: 0 | K387: 3
A388: 40177 | B388: 40177 | C388: 40177 | D388: 0 | E388: 0 | F388: 0 | G388: 0 | K388: 3
A389: 40178 | B389: 40178 | C389: 40178 | D389: 0 | E389: 0 | F389: 0 | G389: 0 | K389: 3
A390: 40179 | B390: 40179 | C390: 40179 | D390: 0 | E390: 0 | F390: 0 | G390: 0 | K390: 3
A391: 40180 | B391: 40180 | C391: 40180 | D391: 0 | E391: 0 | F391: 0 | G391: 0 | K391: 3
A392: 40181 | B392: 40181 | C392: 40181 | D392: 0 | E392: 0 | F392: 0 | G392: 0 | K392: 3
A393: 40182 | B393: 40182 | C393: 40182 | D393: 0 | E393: 0 | F393: 0 | G393: 0 | K393: 3
A394: 40183 | B394: 40183 | C394: 40183 | D394: 0 | E394: 0 | F394: 0 | G394: 0 | K394: 3
A395: 40184 | B395: 40184 | C395: 40184 | D395: 0 | E395: 0 | F395: 0 | G395: 0 | K395: 3
A396: 40185 | B396: 40185 | C396: 40185 | D396: 0 | E396: 0 | F396: 0 | G396: 0 | K396: 3
A397: 40186 | B397: 40186 | C397: 40186 | D397: 0 | E397: 0 | F397: 0 | G397: 0 | K397: 3
A398: 40187 | B398: 40187 | C398: 40187 | D398: 0 | E398: 0 | F398: 0 | G398: 0 | K398: 3
A399: 40188 | B399: 40188 | C399: 40188 | D399: 0 | E399: 0 | F399: 0 | G399: 0 | K399: 3
A400: 40189 | B400: 40189 | C400: 40189 | D400: 0 | E400: 0 | F400: 0 | G400: 0 | K400: 3
A401: 40190 | B401: 40190 | C401: 40190 | D401: 0 | E401: 0 | F401: 0 | G401: 0 | K401: 3
A402: 40191 | B402: 40191 | C402: 40191 | D402: 0 | E402: 0 | F402: 0 | G402: 0 | K402: 3
A403: 40192 | B403: 40192 | C403: 40192 | D403: 0 | E403: 0 | F403: 0 | G403: 0 | K403: 3
A404: 40193 | B404: 40193 | C404: 40193 | D404: 0 | E404: 0 | F404: 0 | G404: 0 | K404: 3
A405: 40194 | B405: 40194 | C405: 40194 | D405: 0 | E405: 0 | F405: 0 | G405: 0 | K405: 3
A406: 40195 | B406: 40195 | C406: 40195 | D406: 0 | E406: 0 | F406: 0 | G406: 0 | K406: 3
A407: 40196 | B407: 40196 | C407: 40196 | D407: 0 | E407: 0 | F407: 0 | G407: 0 | K407: 3
A408: 40197 | B408: 40197 | C408: 40197 | D408: 0 | E408: 0 | F408: 0 | G408: 0 | K408: 3
A409: 40198 | B409: 40198 | C409: 40198 | D409: 0 | E409: 0 | F409: 0 | G409: 0 | K409: 3
A410: 40199 | B410: 40199 | C410: 40199 | D410: 0 | E410: 0 | F410: 0 | G410: 0 | K410: 3
A411: 40200 | B411: 40200 | C411: 40200 | D411: 0 | E411: 0 | F411: 0 | G411: 0 | K411: 3
A412: 45001 | B412: 45001 | C412: 45001 | D412: 45001 | E412: 45002 | F412: 45003 | G412: 45004 | K412: 3
A413: 45002 | B413: 45002 | C413: 45002 | D413: 45001 | E413: 45002 | F413: 45003 | G413: 45004 | K413: 3
A414: 45003 | B414: 45003 | C414: 45003 | D414: 45001 | E414: 45002 | F414: 45003 | G414: 45004 | K414: 3
A415: 45004 | B415: 45004 | C415: 45004 | D415: 45001 | E415: 45002 | F415: 45003 | G415: 45004 | K415: 3
A416: 45011 | B416: 45011 | C416: 45011 | D416: 45011 | E416: 45012 | F416: 45013 | G416: 45014 | K416: 3
A417: 45012 | B417: 45012 | C417: 45012 | D417: 45011 | E417: 45012 | F417: 45013 | G417: 45014 | K417: 3
A418: 45013 | B418: 45013 | C418: 45013 | D418: 45011 | E418: 45012 | F418: 45013 | G418: 45014 | K418: 3
A419: 45014 | B419: 45014 | C419: 45014 | D419: 45011 | E419: 45012 | F419: 45013 | G419: 45014 | K419: 3
A420: 45021 | B420: 45021 | C420: 45021 | D420: 45021 | E420: 45022 | F420: 45023 | G420: 45024 | K420: 3
A421: 45022 | B421: 45022 | C421: 45022 | D421: 45021 | E421: 45022 | F421: 45023 | G421: 45024 | K421: 3
A422: 45023 | B422: 45023 | C422: 45023 | D422: 45021 | E422: 45022 | F422: 45023 | G422: 45024 | K422: 3
A423: 45024 | B423: 45024 | C423: 45024 | D423: 45021 | E423: 45022 | F423: 45023 | G423: 45024 | K423: 3
A424: 45101 | B424: 45101 | C424: 45101 | D424: 0 | E424: 0 | F424: 0 | G424: 0 | K424: 3
A425: 45102 | B425: 45102 | C425: 45102 | D425: 0 | E425: 0 | F425: 0 | G425: 0 | K425: 3
A426: 45111 | B426: 45111 | C426: 45111 | D426: 0 | E426: 0 | F426: 0 | G426: 0 | K426: 3
A427: 45121 | B427: 45121 | C427: 45121 | D427: 0 | E427: 0 | F427: 0 | G427: 0 | K427: 3
A428: 45131 | B428: 45131 | C428: 45131 | D428: 0 | E428: 0 | F428: 0 | G428: 0 | K428: 3
A429: 45132 | B429: 45132 | C429: 45132 | D429: 0 | E429: 0 | F429: 0 | G429: 0 | K429: 3
A430: 45201 | B430: =RC[1] -> 45201 | C430: 45201 | D430: 45001 | E430: 45002 | F430: 45003 | G430: 45004 | K430: 3
A431: 45202 | B431: =RC[1] -> 45202 | C431: 45202 | D431: 45001 | E431: 45002 | F431: 45003 | G431: 45004 | K431: 3
A432: 45203 | B432: =RC[1] -> 45203 | C432: 45203 | D432: 45001 | E432: 45002 | F432: 45003 | G432: 45004 | K432: 3
A433: 45204 | B433: =RC[1] -> 45204 | C433: 45204 | D433: 45001 | E433: 45002 | F433: 45003 | G433: 45004 | K433: 3
A434: 45205 | B434: =RC[1] -> 45205 | C434: 45205 | D434: 45001 | E434: 45002 | F434: 45003 | G434: 45004 | K434: 3
A435: 45206 | B435: =RC[1] -> 45206 | C435: 45206 | D435: 45001 | E435: 45002 | F435: 45003 | G435: 45004 | K435: 3
A436: 45207 | B436: =RC[1] -> 45207 | C436: 45207 | D436: 45001 | E436: 45002 | F436: 45003 | G436: 45004 | K436: 3
A437: 45208 | B437: =RC[1] -> 45208 | C437: 45208 | D437: 45001 | E437: 45002 | F437: 45003 | G437: 45004 | K437: 3
A438: 45209 | B438: =RC[1] -> 45209 | C438: 45209 | D438: 45001 | E438: 45002 | F438: 45003 | G438: 45004 | K438: 3
A439: 45210 | B439: =RC[1] -> 45210 | C439: 45210 | D439: 45001 | E439: 45002 | F439: 45003 | G439: 45004 | K439: 3
A440: 45211 | B440: =RC[1] -> 45211 | C440: 45211 | D440: 45001 | E440: 45002 | F440: 45003 | G440: 45004 | K440: 3
A441: 45212 | B441: =RC[1] -> 45212 | C441: 45212 | D441: 45001 | E441: 45002 | F441: 45003 | G441: 45004 | K441: 3
A442: 45213 | B442: =RC[1] -> 45213 | C442: 45213 | D442: 45001 | E442: 45002 | F442: 45003 | G442: 45004 | K442: 3
A443: 45214 | B443: =RC[1] -> 45214 | C443: 45214 | D443: 45001 | E443: 45002 | F443: 45003 | G443: 45004 | K443: 3
A444: 45221 | B444: =RC[1] -> 45221 | C444: 45221 | D444: 45011 | E444: 45012 | F444: 45013 | G444: 45014 | K444: 3
A445: 45222 | B445: =RC[1] -> 45222 | C445: 45222 | D445: 45011 | E445: 45012 | F445: 45013 | G445: 45014 | K445: 3
A446: 45223 | B446: =RC[1] -> 45223 | C446: 45223 | D446: 45011 | E446: 45012 | F446: 45013 | G446: 45014 | K446: 3
A447: 45224 | B447: =RC[1] -> 45224 | C447: 45224 | D447: 45011 | E447: 45012 | F447: 45013 | G447: 45014 | K447: 3
A448: 45225 | B448: =RC[1] -> 45225 | C448: 45225 | D448: 45011 | E448: 45012 | F448: 45013 | G448: 45014 | K448: 3
A449: 45226 | B449: =RC[1] -> 45226 | C449: 45226 | D449: 45011 | E449: 45012 | F449: 45013 | G449: 45014 | K449: 3
A450: 45227 | B450: =RC[1] -> 45227 | C450: 45227 | D450: 45011 | E450: 45012 | F450: 45013 | G450: 45014 | K450: 3
A451: 45228 | B451: =RC[1] -> 45228 | C451: 45228 | D451: 45011 | E451: 45012 | F451: 45013 | G451: 45014 | K451: 3
A452: 45229 | B452: =RC[1] -> 45229 | C452: 45229 | D452: 45011 | E452: 45012 | F452: 45013 | G452: 45014 | K452: 3
A453: 45230 | B453: =RC[1] -> 45230 | C453: 45230 | D453: 45011 | E453: 45012 | F453: 45013 | G453: 45014 | K453: 3
A454: 45231 | B454: =RC[1] -> 45231 | C454: 45231 | D454: 45011 | E454: 45012 | F454: 45013 | G454: 45014 | K454: 3
A455: 45232 | B455: =RC[1] -> 45232 | C455: 45232 | D455: 45011 | E455: 45012 | F455: 45013 | G455: 45014 | K455: 3
A456: 45233 | B456: =RC[1] -> 45233 | C456: 45233 | D456: 45011 | E456: 45012 | F456: 45013 | G456: 45014 | K456: 3
A457: 45241 | B457: =RC[1] -> 45241 | C457: 45241 | D457: 45021 | E457: 45022 | F457: 45023 | G457: 45024 | K457: 3
A458: 45242 | B458: =RC[1] -> 45242 | C458: 45242 | D458: 45021 | E458: 45022 | F458: 45023 | G458: 45024 | K458: 3
A459: 45243 | B459: =RC[1] -> 45243 | C459: 45243 | D459: 45021 | E459: 45022 | F459: 45023 | G459: 45024 | K459: 3
A460: 45244 | B460: =RC[1] -> 45244 | C460: 45244 | D460: 45021 | E460: 45022 | F460: 45023 | G460: 45024 | K460: 3
A461: 45245 | B461: =RC[1] -> 45245 | C461: 45245 | D461: 45021 | E461: 45022 | F461: 45023 | G461: 45024 | K461: 3
A462: 45246 | B462: =RC[1] -> 45246 | C462: 45246 | D462: 45021 | E462: 45022 | F462: 45023 | G462: 45024 | K462: 3
A463: 45247 | B463: =RC[1] -> 45247 | C463: 45247 | D463: 45021 | E463: 45022 | F463: 45023 | G463: 45024 | K463: 3
A464: 45248 | B464: =RC[1] -> 45248 | C464: 45248 | D464: 45021 | E464: 45022 | F464: 45023 | G464: 45024 | K464: 3
A465: 45249 | B465: =RC[1] -> 45249 | C465: 45249 | D465: 45021 | E465: 45022 | F465: 45023 | G465: 45024 | K465: 3
A466: 45250 | B466: =RC[1] -> 45250 | C466: 45250 | D466: 45021 | E466: 45022 | F466: 45023 | G466: 45024 | K466: 3
A467: 45251 | B467: =RC[1] -> 45251 | C467: 45251 | D467: 45021 | E467: 45022 | F467: 45023 | G467: 45024 | K467: 3
A468: 45252 | B468: =RC[1] -> 45252 | C468: 45252 | D468: 45021 | E468: 45022 | F468: 45023 | G468: 45024 | K468: 3
A469: 45253 | B469: =RC[1] -> 45253 | C469: 45253 | D469: 45021 | E469: 45022 | F469: 45023 | G469: 45024 | K469: 3
A470: 2001 | B470: 2001 | C470: 2001 | D470: 2001 | E470: 2001 | F470: 2002 | G470: 2002 | K470: 3
A471: 2002 | B471: 2002 | C471: 2001 | D471: 2001 | E471: 2002 | F471: 2002 | G471: 2002 | K471: 3
A472: 2003 | B472: 2004 | C472: 2004 | D472: 2004 | E472: 2001 | F472: 2002 | G472: 2003 | K472: 3
A473: 2004 | B473: 2003 | C473: 2003 | D473: 2003 | E473: 2003 | F473: 2004 | G473: 2004 | K473: 3
A474: 2005 | B474: 2022 | C474: 2022 | D474: 2022 | E474: 2022 | F474: 2014 | G474: 2014 | K474: 3
A475: 2011 | B475: 2011 | C475: 2011 | D475: 2011 | E475: 2012 | F475: 2013 | G475: 2014 | K475: 3
A476: 2012 | B476: 2001 | C476: 2011 | D476: 2011 | E476: 2001 | F476: 2002 | G476: 2003 | K476: 3
A477: 2013 | B477: 2005 | C477: 2005 | D477: 2022 | E477: 2022 | F477: 2022 | G477: 2022 | K477: 3
A478: 2014 | B478: 2025 | C478: 2025 | D478: 2025 | E478: 2025 | F478: 2026 | G478: 2026 | K478: 3
A479: 2015 | B479: 2026 | C479: 2025 | D479: 2025 | E479: 2026 | F479: 2026 | G479: 2026 | K479: 3
A480: 2022 | B480: 2022 | C480: 2022 | D480: 2021 | E480: 2022 | F480: 2023 | G480: 2024 | K480: 3
A481: 2023 | B481: 2023 | C481: 2023 | D481: 2021 | E481: 2022 | F481: 2023 | G481: 2024 | K481: 3
A482: 2024 | B482: 2024 | C482: 2024 | D482: 2021 | E482: 2022 | F482: 2023 | G482: 2024 | K482: 3
A483: 2997 | B483: 2997 | C483: 2997 | D483: 0 | E483: 0 | F483: 0 | G483: 0 | K483: 5
A484: 2998 | B484: 2998 | C484: 2998 | D484: 0 | E484: 0 | F484: 0 | G484: 0 | K484: 5
A485: 2999 | B485: 2999 | C485: 2999 | D485: 0 | E485: 0 | F485: 0 | G485: 0 | K485: 5
A486: 10001 | B486: 99999 | C486: 99999 | D486: 99999 | E486: 99999 | F486: 99999 | G486: 99999 | K486: 3 | L486: 竞技场
A487: 10002 | B487: 99999 | C487: 99999 | D487: 99999 | E487: 99999 | F487: 99999 | G487: 99999 | L487: 英雄对决
A488: 10003 | B488: 99999 | C488: 99999 | D488: 99999 | E488: 99999 | F488: 99999 | G488: 99999 | L488: ...
A489: 10004 | B489: 99999 | C489: 99999 | D489: 99999 | E489: 99999 | F489: 99999 | G489: 99999 | L489: ...
A490: 10005 | B490: 99999 | C490: 99999 | D490: 99999 | E490: 99999 | F490: 99999 | G490: 99999 | L490: ...
A491: 10006 | B491: 99999 | C491: 99999 | D491: 99999 | E491: 99999 | F491: 99999 | G491: 99999 | L491: ...
A492: 10007 | B492: 99999 | C492: 99999 | D492: 99999 | E492: 99999 | F492: 99999 | G492: 99999 | L492: 无尽之地
A493: 10008 | B493: 99999 | C493: 99999 | D493: 99999 | E493: 99999 | F493: 99999 | G493: 99999 | K493: 3 | L493: 王者赛
A494: 200000 | B494: =RC[5] -> 200004 | C494: 200000 | D494: 200001 | E494: 200002 | F494: 200003 | G494: 200004 | L494: 爬塔战役
A495: 200010 | B495: =RC[5] -> 200014 | C495: 200010 | D495: 200011 | E495: 200012 | F495: 200013 | G495: 200014
A496: 200020 | B496: =RC[5] -> 200024 | C496: 200020 | D496: 200021 | E496: 200022 | F496: 200023 | G496: 200024
A497: 200030 | B497: =RC[5] -> 200034 | C497: 200030 | D497: 200031 | E497: 200032 | F497: 200033 | G497: 200034
A498: 200040 | B498: =RC[5] -> 200044 | C498: 200040 | D498: 200041 | E498: 200042 | F498: 200043 | G498: 200044
A499: 200050 | B499: =RC[5] -> 200054 | C499: 200050 | D499: 200051 | E499: 200052 | F499: 200053 | G499: 200054
A500: 200060 | B500: =RC[5] -> 200064 | C500: 200060 | D500: 200061 | E500: 200062 | F500: 200063 | G500: 200064
A501: 200070 | B501: =RC[5] -> 200074 | C501: 200070 | D501: 200071 | E501: 200072 | F501: 200073 | G501: 200074
A502: 200080 | B502: =RC[5] -> 200084 | C502: 200080 | D502: 200081 | E502: 200082 | F502: 200083 | G502: 200084
A503: 200090 | B503: =RC[5] -> 200094 | C503: 200090 | D503: 200091 | E503: 200092 | F503: 200093 | G503: 200094
A504: 200100 | B504: =RC[5] -> 200104 | C504: 200100 | D504: 200101 | E504: 200102 | F504: 200103 | G504: 200104
A505: 200110 | B505: =RC[5] -> 200114 | C505: 200110 | D505: 200111 | E505: 200112 | F505: 200113 | G505: 200114
A506: 200120 | B506: =RC[5] -> 200124 | C506: 200120 | D506: 200121 | E506: 200122 | F506: 200123 | G506: 200124
A507: 200130 | B507: =RC[5] -> 200134 | C507: 200130 | D507: 200131 | E507: 200132 | F507: 200133 | G507: 200134
A508: 200140 | B508: =RC[5] -> 200144 | C508: 200140 | D508: 200141 | E508: 200142 | F508: 200143 | G508: 200144
A509: 200150 | B509: =RC[5] -> 200154 | C509: 200150 | D509: 200151 | E509: 200152 | F509: 200153 | G509: 200154
A510: 200160 | B510: =RC[5] -> 200164 | C510: 200160 | D510: 200161 | E510: 200162 | F510: 200163 | G510: 200164
A511: 200170 | B511: =RC[5] -> 200174 | C511: 200170 | D511: 200171 | E511: 200172 | F511: 200173 | G511: 200174
A512: 200180 | B512: =RC[5] -> 200184 | C512: 200180 | D512: 200181 | E512: 200182 | F512: 200183 | G512: 200184
A513: 200190 | B513: =RC[5] -> 200194 | C513: 200190 | D513: 200191 | E513: 200192 | F513: 200193 | G513: 200194
A514: 200200 | B514: =RC[5] -> 200204 | C514: 200200 | D514: 200201 | E514: 200202 | F514: 200203 | G514: 200204
A515: 200210 | B515: =RC[5] -> 200214 | C515: 200210 | D515: 200211 | E515: 200212 | F515: 200213 | G515: 200214
A516: 200220 | B516: =RC[5] -> 200224 | C516: 200220 | D516: 200221 | E516: 200222 | F516: 200223 | G516: 200224
A517: 200230 | B517: =RC[5] -> 200234 | C517: 200230 | D517: 200231 | E517: 200232 | F517: 200233 | G517: 200234
A518: 200240 | B518: =RC[5] -> 200244 | C518: 200240 | D518: 200241 | E518: 200242 | F518: 200243 | G518: 200244
A519: 200250 | B519: =RC[5] -> 200254 | C519: 200250 | D519: 200251 | E519: 200252 | F519: 200253 | G519: 200254
A520: 200260 | B520: =RC[5] -> 200264 | C520: 200260 | D520: 200261 | E520: 200262 | F520: 200263 | G520: 200264
A521: 200270 | B521: =RC[5] -> 200274 | C521: 200270 | D521: 200271 | E521: 200272 | F521: 200273 | G521: 200274
A522: 200280 | B522: =RC[5] -> 200284 | C522: 200280 | D522: 200281 | E522: 200282 | F522: 200283 | G522: 200284
A523: 200290 | B523: =RC[5] -> 200294 | C523: 200290 | D523: 200291 | E523: 200292 | F523: 200293 | G523: 200294
A524: 200300 | B524: =RC[5] -> 200304 | C524: 200300 | D524: 200301 | E524: 200302 | F524: 200303 | G524: 200304
A525: 200310 | B525: =RC[5] -> 200314 | C525: 200310 | D525: 200311 | E525: 200312 | F525: 200313 | G525: 200314
A526: 200320 | B526: =RC[5] -> 200324 | C526: 200320 | D526: 200321 | E526: 200322 | F526: 200323 | G526: 200324
A527: 200330 | B527: =RC[5] -> 200334 | C527: 200330 | D527: 200331 | E527: 200332 | F527: 200333 | G527: 200334
A528: 200340 | B528: =RC[5] -> 200344 | C528: 200340 | D528: 200341 | E528: 200342 | F528: 200343 | G528: 200344
A529: 200350 | B529: =RC[5] -> 200354 | C529: 200350 | D529: 200351 | E529: 200352 | F529: 200353 | G529: 200354
A530: 200360 | B530: =RC[5] -> 200364 | C530: 200360 | D530: 200361 | E530: 200362 | F530: 200363 | G530: 200364
A531: 200370 | B531: =RC[5] -> 200374 | C531: 200370 | D531: 200371 | E531: 200372 | F531: 200373 | G531: 200374
A532: 200380 | B532: =RC[5] -> 200384 | C532: 200380 | D532: 200381 | E532: 200382 | F532: 200383 | G532: 200384
A533: 200390 | B533: =RC[5] -> 200394 | C533: 200390 | D533: 200391 | E533: 200392 | F533: 200393 | G533: 200394
A534: 200400 | B534: =RC[5] -> 200404 | C534: 200400 | D534: 200401 | E534: 200402 | F534: 200403 | G534: 200404
A535: 200410 | B535: =RC[5] -> 200414 | C535: 200410 | D535: 200411 | E535: 200412 | F535: 200413 | G535: 200414
A536: 200420 | B536: =RC[5] -> 200424 | C536: 200420 | D536: 200421 | E536: 200422 | F536: 200423 | G536: 200424
A537: 200430 | B537: =RC[5] -> 200434 | C537: 200430 | D537: 200431 | E537: 200432 | F537: 200433 | G537: 200434
A538: 200440 | B538: =RC[5] -> 200444 | C538: 200440 | D538: 200441 | E538: 200442 | F538: 200443 | G538: 200444
A539: 200450 | B539: =RC[5] -> 200454 | C539: 200450 | D539: 200451 | E539: 200452 | F539: 200453 | G539: 200454
A540: 200460 | B540: =RC[5] -> 200464 | C540: 200460 | D540: 200461 | E540: 200462 | F540: 200463 | G540: 200464
A541: 200470 | B541: =RC[5] -> 200474 | C541: 200470 | D541: 200471 | E541: 200472 | F541: 200473 | G541: 200474
A542: 200480 | B542: =RC[5] -> 200484 | C542: 200480 | D542: 200481 | E542: 200482 | F542: 200483 | G542: 200484
A543: 200490 | B543: =RC[5] -> 200494 | C543: 200490 | D543: 200491 | E543: 200492 | F543: 200493 | G543: 200494
A544: 200500 | B544: =RC[5] -> 200504 | C544: 200500 | D544: 200501 | E544: 200502 | F544: 200503 | G544: 200504
A545: 200510 | B545: =RC[5] -> 200514 | C545: 200510 | D545: 200511 | E545: 200512 | F545: 200513 | G545: 200514
A546: 200520 | B546: =RC[5] -> 200524 | C546: 200520 | D546: 200521 | E546: 200522 | F546: 200523 | G546: 200524
A547: 200530 | B547: =RC[5] -> 200534 | C547: 200530 | D547: 200531 | E547: 200532 | F547: 200533 | G547: 200534
A548: 200540 | B548: =RC[5] -> 200544 | C548: 200540 | D548: 200541 | E548: 200542 | F548: 200543 | G548: 200544
A549: 200550 | B549: =RC[5] -> 200554 | C549: 200550 | D549: 200551 | E549: 200552 | F549: 200553 | G549: 200554
A550: 200560 | B550: =RC[5] -> 200564 | C550: 200560 | D550: 200561 | E550: 200562 | F550: 200563 | G550: 200564
A551: 200570 | B551: =RC[5] -> 200574 | C551: 200570 | D551: 200571 | E551: 200572 | F551: 200573 | G551: 200574
A552: 200580 | B552: =RC[5] -> 200584 | C552: 200580 | D552: 200581 | E552: 200582 | F552: 200583 | G552: 200584
A553: 200590 | B553: =RC[5] -> 200594 | C553: 200590 | D553: 200591 | E553: 200592 | F553: 200593 | G553: 200594
A554: 200600 | B554: =RC[5] -> 200604 | C554: 200600 | D554: 200601 | E554: 200602 | F554: 200603 | G554: 200604
A555: 200610 | B555: =RC[5] -> 200614 | C555: 200610 | D555: 200611 | E555: 200612 | F555: 200613 | G555: 200614
A556: 200620 | B556: =RC[5] -> 200624 | C556: 200620 | D556: 200621 | E556: 200622 | F556: 200623 | G556: 200624
A557: 200630 | B557: =RC[5] -> 200634 | C557: 200630 | D557: 200631 | E557: 200632 | F557: 200633 | G557: 200634
A558: 200640 | B558: =RC[5] -> 200644 | C558: 200640 | D558: 200641 | E558: 200642 | F558: 200643 | G558: 200644
A559: 200650 | B559: =RC[5] -> 200654 | C559: 200650 | D559: 200651 | E559: 200652 | F559: 200653 | G559: 200654
A560: 200660 | B560: =RC[5] -> 200664 | C560: 200660 | D560: 200661 | E560: 200662 | F560: 200663 | G560: 200664
A561: 200670 | B561: =RC[5] -> 200674 | C561: 200670 | D561: 200671 | E561: 200672 | F561: 200673 | G561: 200674
A562: 200680 | B562: =RC[5] -> 200684 | C562: 200680 | D562: 200681 | E562: 200682 | F562: 200683 | G562: 200684
A563: 200690 | B563: =RC[5] -> 200694 | C563: 200690 | D563: 200691 | E563: 200692 | F563: 200693 | G563: 200694
A564: 200700 | B564: =RC[5] -> 200704 | C564: 200700 | D564: 200701 | E564: 200702 | F564: 200703 | G564: 200704
A565: 200710 | B565: =RC[5] -> 200714 | C565: 200710 | D565: 200711 | E565: 200712 | F565: 200713 | G565: 200714
A566: 200720 | B566: =RC[5] -> 200724 | C566: 200720 | D566: 200721 | E566: 200722 | F566: 200723 | G566: 200724
A567: 200730 | B567: =RC[5] -> 200734 | C567: 200730 | D567: 200731 | E567: 200732 | F567: 200733 | G567: 200734
A568: 200740 | B568: =RC[5] -> 200744 | C568: 200740 | D568: 200741 | E568: 200742 | F568: 200743 | G568: 200744
A569: 200750 | B569: =RC[5] -> 200754 | C569: 200750 | D569: 200751 | E569: 200752 | F569: 200753 | G569: 200754
A570: 200760 | B570: =RC[5] -> 200764 | C570: 200760 | D570: 200761 | E570: 200762 | F570: 200763 | G570: 200764
A571: 200770 | B571: =RC[5] -> 200774 | C571: 200770 | D571: 200771 | E571: 200772 | F571: 200773 | G571: 200774
A572: 200780 | B572: =RC[5] -> 200784 | C572: 200780 | D572: 200781 | E572: 200782 | F572: 200783 | G572: 200784
A573: 200790 | B573: =RC[5] -> 200794 | C573: 200790 | D573: 200791 | E573: 200792 | F573: 200793 | G573: 200794
A574: 200800 | B574: =RC[5] -> 200804 | C574: 200800 | D574: 200801 | E574: 200802 | F574: 200803 | G574: 200804
A575: 200810 | B575: =RC[5] -> 200814 | C575: 200810 | D575: 200811 | E575: 200812 | F575: 200813 | G575: 200814
A576: 200820 | B576: =RC[5] -> 200824 | C576: 200820 | D576: 200821 | E576: 200822 | F576: 200823 | G576: 200824
A577: 200830 | B577: =RC[5] -> 200834 | C577: 200830 | D577: 200831 | E577: 200832 | F577: 200833 | G577: 200834
A578: 200840 | B578: =RC[5] -> 200844 | C578: 200840 | D578: 200841 | E578: 200842 | F578: 200843 | G578: 200844
A579: 200850 | B579: =RC[5] -> 200854 | C579: 200850 | D579: 200851 | E579: 200852 | F579: 200853 | G579: 200854
A580: 200860 | B580: =RC[5] -> 200864 | C580: 200860 | D580: 200861 | E580: 200862 | F580: 200863 | G580: 200864
A581: 200870 | B581: =RC[5] -> 200874 | C581: 200870 | D581: 200871 | E581: 200872 | F581: 200873 | G581: 200874
A582: 200880 | B582: =RC[5] -> 200884 | C582: 200880 | D582: 200881 | E582: 200882 | F582: 200883 | G582: 200884
A583: 200890 | B583: =RC[5] -> 200894 | C583: 200890 | D583: 200891 | E583: 200892 | F583: 200893 | G583: 200894
A584: 200900 | B584: =RC[5] -> 200904 | C584: 200900 | D584: 200901 | E584: 200902 | F584: 200903 | G584: 200904
A585: 200910 | B585: =RC[5] -> 200914 | C585: 200910 | D585: 200911 | E585: 200912 | F585: 200913 | G585: 200914
A586: 200920 | B586: =RC[5] -> 200924 | C586: 200920 | D586: 200921 | E586: 200922 | F586: 200923 | G586: 200924
A587: 200930 | B587: =RC[5] -> 200934 | C587: 200930 | D587: 200931 | E587: 200932 | F587: 200933 | G587: 200934
A588: 200940 | B588: =RC[5] -> 200944 | C588: 200940 | D588: 200941 | E588: 200942 | F588: 200943 | G588: 200944
A589: 200950 | B589: =RC[5] -> 200954 | C589: 200950 | D589: 200951 | E589: 200952 | F589: 200953 | G589: 200954
A590: 200960 | B590: =RC[5] -> 200964 | C590: 200960 | D590: 200961 | E590: 200962 | F590: 200963 | G590: 200964
A591: 200970 | B591: =RC[5] -> 200974 | C591: 200970 | D591: 200971 | E591: 200972 | F591: 200973 | G591: 200974
A592: 200980 | B592: =RC[5] -> 200984 | C592: 200980 | D592: 200981 | E592: 200982 | F592: 200983 | G592: 200984
A593: 200990 | B593: =RC[5] -> 200994 | C593: 200990 | D593: 200991 | E593: 200992 | F593: 200993 | G593: 200994
A594: 201000 | B594: =RC[5] -> 201004 | C594: 201000 | D594: 201001 | E594: 201002 | F594: 201003 | G594: 201004
A595: 201010 | B595: =RC[5] -> 201014 | C595: 201010 | D595: 201011 | E595: 201012 | F595: 201013 | G595: 201014
A596: 201020 | B596: =RC[5] -> 201024 | C596: 201020 | D596: 201021 | E596: 201022 | F596: 201023 | G596: 201024
A597: 201030 | B597: =RC[5] -> 201034 | C597: 201030 | D597: 201031 | E597: 201032 | F597: 201033 | G597: 201034
A598: 201040 | B598: =RC[5] -> 201044 | C598: 201040 | D598: 201041 | E598: 201042 | F598: 201043 | G598: 201044
A599: 201050 | B599: =RC[5] -> 201054 | C599: 201050 | D599: 201051 | E599: 201052 | F599: 201053 | G599: 201054
A600: 201060 | B600: =RC[5] -> 201064 | C600: 201060 | D600: 201061 | E600: 201062 | F600: 201063 | G600: 201064
A601: 201070 | B601: =RC[5] -> 201074 | C601: 201070 | D601: 201071 | E601: 201072 | F601: 201073 | G601: 201074
A602: 201080 | B602: =RC[5] -> 201084 | C602: 201080 | D602: 201081 | E602: 201082 | F602: 201083 | G602: 201084
A603: 201090 | B603: =RC[5] -> 201094 | C603: 201090 | D603: 201091 | E603: 201092 | F603: 201093 | G603: 201094
A604: 201100 | B604: =RC[5] -> 201104 | C604: 201100 | D604: 201101 | E604: 201102 | F604: 201103 | G604: 201104
A605: 201110 | B605: =RC[5] -> 201114 | C605: 201110 | D605: 201111 | E605: 201112 | F605: 201113 | G605: 201114
A606: 201120 | B606: =RC[5] -> 201124 | C606: 201120 | D606: 201121 | E606: 201122 | F606: 201123 | G606: 201124
A607: 201130 | B607: =RC[5] -> 201134 | C607: 201130 | D607: 201131 | E607: 201132 | F607: 201133 | G607: 201134
A608: 201140 | B608: =RC[5] -> 201144 | C608: 201140 | D608: 201141 | E608: 201142 | F608: 201143 | G608: 201144
A609: 201150 | B609: =RC[5] -> 201154 | C609: 201150 | D609: 201151 | E609: 201152 | F609: 201153 | G609: 201154
A610: 201160 | B610: =RC[5] -> 201164 | C610: 201160 | D610: 201161 | E610: 201162 | F610: 201163 | G610: 201164
A611: 201170 | B611: =RC[5] -> 201174 | C611: 201170 | D611: 201171 | E611: 201172 | F611: 201173 | G611: 201174
A612: 201180 | B612: =RC[5] -> 201184 | C612: 201180 | D612: 201181 | E612: 201182 | F612: 201183 | G612: 201184
A613: 201190 | B613: =RC[5] -> 201194 | C613: 201190 | D613: 201191 | E613: 201192 | F613: 201193 | G613: 201194
A614: 201200 | B614: =RC[5] -> 201204 | C614: 201200 | D614: 201201 | E614: 201202 | F614: 201203 | G614: 201204
A615: 201210 | B615: =RC[5] -> 201214 | C615: 201210 | D615: 201211 | E615: 201212 | F615: 201213 | G615: 201214
A616: 201220 | B616: =RC[5] -> 201224 | C616: 201220 | D616: 201221 | E616: 201222 | F616: 201223 | G616: 201224
A617: 201230 | B617: =RC[5] -> 201234 | C617: 201230 | D617: 201231 | E617: 201232 | F617: 201233 | G617: 201234
A618: 201240 | B618: =RC[5] -> 201244 | C618: 201240 | D618: 201241 | E618: 201242 | F618: 201243 | G618: 201244
A619: 201250 | B619: =RC[5] -> 201254 | C619: 201250 | D619: 201251 | E619: 201252 | F619: 201253 | G619: 201254
A620: 201260 | B620: =RC[5] -> 201264 | C620: 201260 | D620: 201261 | E620: 201262 | F620: 201263 | G620: 201264
A621: 201270 | B621: =RC[5] -> 201274 | C621: 201270 | D621: 201271 | E621: 201272 | F621: 201273 | G621: 201274
A622: 201280 | B622: =RC[5] -> 201284 | C622: 201280 | D622: 201281 | E622: 201282 | F622: 201283 | G622: 201284
A623: 201290 | B623: =RC[5] -> 201294 | C623: 201290 | D623: 201291 | E623: 201292 | F623: 201293 | G623: 201294
A624: 201300 | B624: =RC[5] -> 201304 | C624: 201300 | D624: 201301 | E624: 201302 | F624: 201303 | G624: 201304
A625: 201310 | B625: =RC[5] -> 201314 | C625: 201310 | D625: 201311 | E625: 201312 | F625: 201313 | G625: 201314
A626: 201320 | B626: =RC[5] -> 201324 | C626: 201320 | D626: 201321 | E626: 201322 | F626: 201323 | G626: 201324
A627: 201330 | B627: =RC[5] -> 201334 | C627: 201330 | D627: 201331 | E627: 201332 | F627: 201333 | G627: 201334
A628: 201340 | B628: =RC[5] -> 201344 | C628: 201340 | D628: 201341 | E628: 201342 | F628: 201343 | G628: 201344
A629: 201350 | B629: =RC[5] -> 201354 | C629: 201350 | D629: 201351 | E629: 201352 | F629: 201353 | G629: 201354
A630: 201360 | B630: =RC[5] -> 201364 | C630: 201360 | D630: 201361 | E630: 201362 | F630: 201363 | G630: 201364
A631: 201370 | B631: =RC[5] -> 201374 | C631: 201370 | D631: 201371 | E631: 201372 | F631: 201373 | G631: 201374
A632: 201380 | B632: =RC[5] -> 201384 | C632: 201380 | D632: 201381 | E632: 201382 | F632: 201383 | G632: 201384
A633: 201390 | B633: =RC[5] -> 201394 | C633: 201390 | D633: 201391 | E633: 201392 | F633: 201393 | G633: 201394
A634: 201400 | B634: =RC[5] -> 201404 | C634: 201400 | D634: 201401 | E634: 201402 | F634: 201403 | G634: 201404
A635: 201410 | B635: =RC[5] -> 201414 | C635: 201410 | D635: 201411 | E635: 201412 | F635: 201413 | G635: 201414
A636: 201420 | B636: =RC[5] -> 201424 | C636: 201420 | D636: 201421 | E636: 201422 | F636: 201423 | G636: 201424
A637: 201430 | B637: =RC[5] -> 201434 | C637: 201430 | D637: 201431 | E637: 201432 | F637: 201433 | G637: 201434
A638: 201440 | B638: =RC[5] -> 201444 | C638: 201440 | D638: 201441 | E638: 201442 | F638: 201443 | G638: 201444
A639: 201450 | B639: =RC[5] -> 201454 | C639: 201450 | D639: 201451 | E639: 201452 | F639: 201453 | G639: 201454
A640: 201460 | B640: =RC[5] -> 201464 | C640: 201460 | D640: 201461 | E640: 201462 | F640: 201463 | G640: 201464
A641: 201470 | B641: =RC[5] -> 201474 | C641: 201470 | D641: 201471 | E641: 201472 | F641: 201473 | G641: 201474
A642: 201480 | B642: =RC[5] -> 201484 | C642: 201480 | D642: 201481 | E642: 201482 | F642: 201483 | G642: 201484
A643: 201490 | B643: =RC[5] -> 201494 | C643: 201490 | D643: 201491 | E643: 201492 | F643: 201493 | G643: 201494
A644: 201500 | B644: =RC[5] -> 201504 | C644: 201500 | D644: 201501 | E644: 201502 | F644: 201503 | G644: 201504
A645: 201510 | B645: =RC[5] -> 201514 | C645: 201510 | D645: 201511 | E645: 201512 | F645: 201513 | G645: 201514
A646: 201520 | B646: =RC[5] -> 201524 | C646: 201520 | D646: 201521 | E646: 201522 | F646: 201523 | G646: 201524
A647: 201530 | B647: =RC[5] -> 201534 | C647: 201530 | D647: 201531 | E647: 201532 | F647: 201533 | G647: 201534
A648: 201540 | B648: =RC[5] -> 201544 | C648: 201540 | D648: 201541 | E648: 201542 | F648: 201543 | G648: 201544
A649: 201550 | B649: =RC[5] -> 201554 | C649: 201550 | D649: 201551 | E649: 201552 | F649: 201553 | G649: 201554
A650: 201560 | B650: =RC[5] -> 201564 | C650: 201560 | D650: 201561 | E650: 201562 | F650: 201563 | G650: 201564
A651: 201570 | B651: =RC[5] -> 201574 | C651: 201570 | D651: 201571 | E651: 201572 | F651: 201573 | G651: 201574
A652: 201580 | B652: =RC[5] -> 201584 | C652: 201580 | D652: 201581 | E652: 201582 | F652: 201583 | G652: 201584
A653: 201590 | B653: =RC[5] -> 201594 | C653: 201590 | D653: 201591 | E653: 201592 | F653: 201593 | G653: 201594
A654: 201600 | B654: =RC[5] -> 201604 | C654: 201600 | D654: 201601 | E654: 201602 | F654: 201603 | G654: 201604
A655: 201610 | B655: =RC[5] -> 201614 | C655: 201610 | D655: 201611 | E655: 201612 | F655: 201613 | G655: 201614
A656: 201620 | B656: =RC[5] -> 201624 | C656: 201620 | D656: 201621 | E656: 201622 | F656: 201623 | G656: 201624
A657: 201630 | B657: =RC[5] -> 201634 | C657: 201630 | D657: 201631 | E657: 201632 | F657: 201633 | G657: 201634
A658: 201640 | B658: =RC[5] -> 201644 | C658: 201640 | D658: 201641 | E658: 201642 | F658: 201643 | G658: 201644
A659: 201650 | B659: =RC[5] -> 201654 | C659: 201650 | D659: 201651 | E659: 201652 | F659: 201653 | G659: 201654
A660: 201660 | B660: =RC[5] -> 201664 | C660: 201660 | D660: 201661 | E660: 201662 | F660: 201663 | G660: 201664
A661: 201670 | B661: =RC[5] -> 201674 | C661: 201670 | D661: 201671 | E661: 201672 | F661: 201673 | G661: 201674
A662: 201680 | B662: =RC[5] -> 201684 | C662: 201680 | D662: 201681 | E662: 201682 | F662: 201683 | G662: 201684
A663: 201690 | B663: =RC[5] -> 201694 | C663: 201690 | D663: 201691 | E663: 201692 | F663: 201693 | G663: 201694
A664: 201700 | B664: =RC[5] -> 201704 | C664: 201700 | D664: 201701 | E664: 201702 | F664: 201703 | G664: 201704
A665: 201710 | B665: =RC[5] -> 201714 | C665: 201710 | D665: 201711 | E665: 201712 | F665: 201713 | G665: 201714
A666: 201720 | B666: =RC[5] -> 201724 | C666: 201720 | D666: 201721 | E666: 201722 | F666: 201723 | G666: 201724
A667: 201730 | B667: =RC[5] -> 201734 | C667: 201730 | D667: 201731 | E667: 201732 | F667: 201733 | G667: 201734
A668: 201740 | B668: =RC[5] -> 201744 | C668: 201740 | D668: 201741 | E668: 201742 | F668: 201743 | G668: 201744
A669: 201750 | B669: =RC[5] -> 201754 | C669: 201750 | D669: 201751 | E669: 201752 | F669: 201753 | G669: 201754
A670: 201760 | B670: =RC[5] -> 201764 | C670: 201760 | D670: 201761 | E670: 201762 | F670: 201763 | G670: 201764
A671: 201770 | B671: =RC[5] -> 201774 | C671: 201770 | D671: 201771 | E671: 201772 | F671: 201773 | G671: 201774
A672: 201780 | B672: =RC[5] -> 201784 | C672: 201780 | D672: 201781 | E672: 201782 | F672: 201783 | G672: 201784
A673: 201790 | B673: =RC[5] -> 201794 | C673: 201790 | D673: 201791 | E673: 201792 | F673: 201793 | G673: 201794
A674: 201800 | B674: =RC[5] -> 201804 | C674: 201800 | D674: 201801 | E674: 201802 | F674: 201803 | G674: 201804
A675: 201810 | B675: =RC[5] -> 201814 | C675: 201810 | D675: 201811 | E675: 201812 | F675: 201813 | G675: 201814
A676: 201820 | B676: =RC[5] -> 201824 | C676: 201820 | D676: 201821 | E676: 201822 | F676: 201823 | G676: 201824
A677: 201830 | B677: =RC[5] -> 201834 | C677: 201830 | D677: 201831 | E677: 201832 | F677: 201833 | G677: 201834
A678: 201840 | B678: =RC[5] -> 201844 | C678: 201840 | D678: 201841 | E678: 201842 | F678: 201843 | G678: 201844
A679: 201850 | B679: =RC[5] -> 201854 | C679: 201850 | D679: 201851 | E679: 201852 | F679: 201853 | G679: 201854
A680: 201860 | B680: =RC[5] -> 201864 | C680: 201860 | D680: 201861 | E680: 201862 | F680: 201863 | G680: 201864
A681: 201870 | B681: =RC[5] -> 201874 | C681: 201870 | D681: 201871 | E681: 201872 | F681: 201873 | G681: 201874
A682: 201880 | B682: =RC[5] -> 201884 | C682: 201880 | D682: 201881 | E682: 201882 | F682: 201883 | G682: 201884
A683: 201890 | B683: =RC[5] -> 201894 | C683: 201890 | D683: 201891 | E683: 201892 | F683: 201893 | G683: 201894
A684: 201900 | B684: =RC[5] -> 201904 | C684: 201900 | D684: 201901 | E684: 201902 | F684: 201903 | G684: 201904
A685: 201910 | B685: =RC[5] -> 201914 | C685: 201910 | D685: 201911 | E685: 201912 | F685: 201913 | G685: 201914
A686: 201920 | B686: =RC[5] -> 201924 | C686: 201920 | D686: 201921 | E686: 201922 | F686: 201923 | G686: 201924
A687: 201930 | B687: =RC[5] -> 201934 | C687: 201930 | D687: 201931 | E687: 201932 | F687: 201933 | G687: 201934
A688: 201940 | B688: =RC[5] -> 201944 | C688: 201940 | D688: 201941 | E688: 201942 | F688: 201943 | G688: 201944
A689: 201950 | B689: =RC[5] -> 201954 | C689: 201950 | D689: 201951 | E689: 201952 | F689: 201953 | G689: 201954
A690: 201960 | B690: =RC[5] -> 201964 | C690: 201960 | D690: 201961 | E690: 201962 | F690: 201963 | G690: 201964
A691: 201970 | B691: =RC[5] -> 201974 | C691: 201970 | D691: 201971 | E691: 201972 | F691: 201973 | G691: 201974
A692: 201980 | B692: =RC[5] -> 201984 | C692: 201980 | D692: 201981 | E692: 201982 | F692: 201983 | G692: 201984
A693: 201990 | B693: =RC[5] -> 201994 | C693: 201990 | D693: 201991 | E693: 201992 | F693: 201993 | G693: 201994
A694: 202000 | B694: =RC[5] -> 202004 | C694: 202000 | D694: 202001 | E694: 202002 | F694: 202003 | G694: 202004
A695: 202010 | B695: =RC[5] -> 202014 | C695: 202010 | D695: 202011 | E695: 202012 | F695: 202013 | G695: 202014
A696: 202020 | B696: =RC[5] -> 202024 | C696: 202020 | D696: 202021 | E696: 202022 | F696: 202023 | G696: 202024
A697: 202030 | B697: =RC[5] -> 202034 | C697: 202030 | D697: 202031 | E697: 202032 | F697: 202033 | G697: 202034
A698: 202040 | B698: =RC[5] -> 202044 | C698: 202040 | D698: 202041 | E698: 202042 | F698: 202043 | G698: 202044
A699: 202050 | B699: =RC[5] -> 202054 | C699: 202050 | D699: 202051 | E699: 202052 | F699: 202053 | G699: 202054
A700: 202060 | B700: =RC[5] -> 202064 | C700: 202060 | D700: 202061 | E700: 202062 | F700: 202063 | G700: 202064
A701: 202070 | B701: =RC[5] -> 202074 | C701: 202070 | D701: 202071 | E701: 202072 | F701: 202073 | G701: 202074
A702: 202080 | B702: =RC[5] -> 202084 | C702: 202080 | D702: 202081 | E702: 202082 | F702: 202083 | G702: 202084
A703: 202090 | B703: =RC[5] -> 202094 | C703: 202090 | D703: 202091 | E703: 202092 | F703: 202093 | G703: 202094
A704: 202100 | B704: =RC[5] -> 202104 | C704: 202100 | D704: 202101 | E704: 202102 | F704: 202103 | G704: 202104
A705: 202110 | B705: =RC[5] -> 202114 | C705: 202110 | D705: 202111 | E705: 202112 | F705: 202113 | G705: 202114
A706: 202120 | B706: =RC[5] -> 202124 | C706: 202120 | D706: 202121 | E706: 202122 | F706: 202123 | G706: 202124
A707: 202130 | B707: =RC[5] -> 202134 | C707: 202130 | D707: 202131 | E707: 202132 | F707: 202133 | G707: 202134
A708: 202140 | B708: =RC[5] -> 202144 | C708: 202140 | D708: 202141 | E708: 202142 | F708: 202143 | G708: 202144
A709: 202150 | B709: =RC[5] -> 202154 | C709: 202150 | D709: 202151 | E709: 202152 | F709: 202153 | G709: 202154
A710: 202160 | B710: =RC[5] -> 202164 | C710: 202160 | D710: 202161 | E710: 202162 | F710: 202163 | G710: 202164
A711: 202170 | B711: =RC[5] -> 202174 | C711: 202170 | D711: 202171 | E711: 202172 | F711: 202173 | G711: 202174
A712: 202180 | B712: =RC[5] -> 202184 | C712: 202180 | D712: 202181 | E712: 202182 | F712: 202183 | G712: 202184
A713: 202190 | B713: =RC[5] -> 202194 | C713: 202190 | D713: 202191 | E713: 202192 | F713: 202193 | G713: 202194
A714: 202200 | B714: =RC[5] -> 202204 | C714: 202200 | D714: 202201 | E714: 202202 | F714: 202203 | G714: 202204
A715: 202210 | B715: =RC[5] -> 202214 | C715: 202210 | D715: 202211 | E715: 202212 | F715: 202213 | G715: 202214
A716: 202220 | B716: =RC[5] -> 202224 | C716: 202220 | D716: 202221 | E716: 202222 | F716: 202223 | G716: 202224
A717: 202230 | B717: =RC[5] -> 202234 | C717: 202230 | D717: 202231 | E717: 202232 | F717: 202233 | G717: 202234
A718: 202240 | B718: =RC[5] -> 202244 | C718: 202240 | D718: 202241 | E718: 202242 | F718: 202243 | G718: 202244
A719: 202250 | B719: =RC[5] -> 202254 | C719: 202250 | D719: 202251 | E719: 202252 | F719: 202253 | G719: 202254
A720: 202260 | B720: =RC[5] -> 202264 | C720: 202260 | D720: 202261 | E720: 202262 | F720: 202263 | G720: 202264
A721: 202270 | B721: =RC[5] -> 202274 | C721: 202270 | D721: 202271 | E721: 202272 | F721: 202273 | G721: 202274
A722: 202280 | B722: =RC[5] -> 202284 | C722: 202280 | D722: 202281 | E722: 202282 | F722: 202283 | G722: 202284
A723: 202290 | B723: =RC[5] -> 202294 | C723: 202290 | D723: 202291 | E723: 202292 | F723: 202293 | G723: 202294
A724: 202300 | B724: =RC[5] -> 202304 | C724: 202300 | D724: 202301 | E724: 202302 | F724: 202303 | G724: 202304
A725: 202310 | B725: =RC[5] -> 202314 | C725: 202310 | D725: 202311 | E725: 202312 | F725: 202313 | G725: 202314
A726: 202320 | B726: =RC[5] -> 202324 | C726: 202320 | D726: 202321 | E726: 202322 | F726: 202323 | G726: 202324
A727: 202330 | B727: =RC[5] -> 202334 | C727: 202330 | D727: 202331 | E727: 202332 | F727: 202333 | G727: 202334
A728: 202340 | B728: =RC[5] -> 202344 | C728: 202340 | D728: 202341 | E728: 202342 | F728: 202343 | G728: 202344
A729: 202350 | B729: =RC[5] -> 202354 | C729: 202350 | D729: 202351 | E729: 202352 | F729: 202353 | G729: 202354
A730: 202360 | B730: =RC[5] -> 202364 | C730: 202360 | D730: 202361 | E730: 202362 | F730: 202363 | G730: 202364
A731: 202370 | B731: =RC[5] -> 202374 | C731: 202370 | D731: 202371 | E731: 202372 | F731: 202373 | G731: 202374
A732: 202380 | B732: =RC[5] -> 202384 | C732: 202380 | D732: 202381 | E732: 202382 | F732: 202383 | G732: 202384
A733: 202390 | B733: =RC[5] -> 202394 | C733: 202390 | D733: 202391 | E733: 202392 | F733: 202393 | G733: 202394
A734: 202400 | B734: =RC[5] -> 202404 | C734: 202400 | D734: 202401 | E734: 202402 | F734: 202403 | G734: 202404
A735: 202410 | B735: =RC[5] -> 202414 | C735: 202410 | D735: 202411 | E735: 202412 | F735: 202413 | G735: 202414
A736: 202420 | B736: =RC[5] -> 202424 | C736: 202420 | D736: 202421 | E736: 202422 | F736: 202423 | G736: 202424
A737: 202430 | B737: =RC[5] -> 202434 | C737: 202430 | D737: 202431 | E737: 202432 | F737: 202433 | G737: 202434
A738: 202440 | B738: =RC[5] -> 202444 | C738: 202440 | D738: 202441 | E738: 202442 | F738: 202443 | G738: 202444
A739: 202450 | B739: =RC[5] -> 202454 | C739: 202450 | D739: 202451 | E739: 202452 | F739: 202453 | G739: 202454
A740: 202460 | B740: =RC[5] -> 202464 | C740: 202460 | D740: 202461 | E740: 202462 | F740: 202463 | G740: 202464
A741: 202470 | B741: =RC[5] -> 202474 | C741: 202470 | D741: 202471 | E741: 202472 | F741: 202473 | G741: 202474
A742: 202480 | B742: =RC[5] -> 202484 | C742: 202480 | D742: 202481 | E742: 202482 | F742: 202483 | G742: 202484
A743: 202490 | B743: =RC[5] -> 202494 | C743: 202490 | D743: 202491 | E743: 202492 | F743: 202493 | G743: 202494
A744: 202500 | B744: =RC[5] -> 202504 | C744: 202500 | D744: 202501 | E744: 202502 | F744: 202503 | G744: 202504
A745: 202510 | B745: =RC[5] -> 202514 | C745: 202510 | D745: 202511 | E745: 202512 | F745: 202513 | G745: 202514
A746: 202520 | B746: =RC[5] -> 202524 | C746: 202520 | D746: 202521 | E746: 202522 | F746: 202523 | G746: 202524
A747: 202530 | B747: =RC[5] -> 202534 | C747: 202530 | D747: 202531 | E747: 202532 | F747: 202533 | G747: 202534
A748: 202540 | B748: =RC[5] -> 202544 | C748: 202540 | D748: 202541 | E748: 202542 | F748: 202543 | G748: 202544
A749: 202550 | B749: =RC[5] -> 202554 | C749: 202550 | D749: 202551 | E749: 202552 | F749: 202553 | G749: 202554
A750: 202560 | B750: =RC[5] -> 202564 | C750: 202560 | D750: 202561 | E750: 202562 | F750: 202563 | G750: 202564
A751: 202570 | B751: =RC[5] -> 202574 | C751: 202570 | D751: 202571 | E751: 202572 | F751: 202573 | G751: 202574
A752: 202580 | B752: =RC[5] -> 202584 | C752: 202580 | D752: 202581 | E752: 202582 | F752: 202583 | G752: 202584
A753: 202590 | B753: =RC[5] -> 202594 | C753: 202590 | D753: 202591 | E753: 202592 | F753: 202593 | G753: 202594
A754: 202600 | B754: =RC[5] -> 202604 | C754: 202600 | D754: 202601 | E754: 202602 | F754: 202603 | G754: 202604
A755: 202610 | B755: =RC[5] -> 202614 | C755: 202610 | D755: 202611 | E755: 202612 | F755: 202613 | G755: 202614
A756: 202620 | B756: =RC[5] -> 202624 | C756: 202620 | D756: 202621 | E756: 202622 | F756: 202623 | G756: 202624
A757: 202630 | B757: =RC[5] -> 202634 | C757: 202630 | D757: 202631 | E757: 202632 | F757: 202633 | G757: 202634
A758: 202640 | B758: =RC[5] -> 202644 | C758: 202640 | D758: 202641 | E758: 202642 | F758: 202643 | G758: 202644
A759: 202650 | B759: =RC[5] -> 202654 | C759: 202650 | D759: 202651 | E759: 202652 | F759: 202653 | G759: 202654
A760: 202660 | B760: =RC[5] -> 202664 | C760: 202660 | D760: 202661 | E760: 202662 | F760: 202663 | G760: 202664
A761: 202670 | B761: =RC[5] -> 202674 | C761: 202670 | D761: 202671 | E761: 202672 | F761: 202673 | G761: 202674
A762: 202680 | B762: =RC[5] -> 202684 | C762: 202680 | D762: 202681 | E762: 202682 | F762: 202683 | G762: 202684
A763: 202690 | B763: =RC[5] -> 202694 | C763: 202690 | D763: 202691 | E763: 202692 | F763: 202693 | G763: 202694
A764: 202700 | B764: =RC[5] -> 202704 | C764: 202700 | D764: 202701 | E764: 202702 | F764: 202703 | G764: 202704
A765: 202710 | B765: =RC[5] -> 202714 | C765: 202710 | D765: 202711 | E765: 202712 | F765: 202713 | G765: 202714
A766: 202720 | B766: =RC[5] -> 202724 | C766: 202720 | D766: 202721 | E766: 202722 | F766: 202723 | G766: 202724
A767: 202730 | B767: =RC[5] -> 202734 | C767: 202730 | D767: 202731 | E767: 202732 | F767: 202733 | G767: 202734
A768: 202740 | B768: =RC[5] -> 202744 | C768: 202740 | D768: 202741 | E768: 202742 | F768: 202743 | G768: 202744
A769: 202750 | B769: =RC[5] -> 202754 | C769: 202750 | D769: 202751 | E769: 202752 | F769: 202753 | G769: 202754
A770: 202760 | B770: =RC[5] -> 202764 | C770: 202760 | D770: 202761 | E770: 202762 | F770: 202763 | G770: 202764
A771: 202770 | B771: =RC[5] -> 202774 | C771: 202770 | D771: 202771 | E771: 202772 | F771: 202773 | G771: 202774
A772: 202780 | B772: =RC[5] -> 202784 | C772: 202780 | D772: 202781 | E772: 202782 | F772: 202783 | G772: 202784
A773: 202790 | B773: =RC[5] -> 202794 | C773: 202790 | D773: 202791 | E773: 202792 | F773: 202793 | G773: 202794
A774: 202800 | B774: =RC[5] -> 202804 | C774: 202800 | D774: 202801 | E774: 202802 | F774: 202803 | G774: 202804
A775: 202810 | B775: =RC[5] -> 202814 | C775: 202810 | D775: 202811 | E775: 202812 | F775: 202813 | G775: 202814
A776: 202820 | B776: =RC[5] -> 202824 | C776: 202820 | D776: 202821 | E776: 202822 | F776: 202823 | G776: 202824
A777: 202830 | B777: =RC[5] -> 202834 | C777: 202830 | D777: 202831 | E777: 202832 | F777: 202833 | G777: 202834
A778: 202840 | B778: =RC[5] -> 202844 | C778: 202840 | D778: 202841 | E778: 202842 | F778: 202843 | G778: 202844
A779: 202850 | B779: =RC[5] -> 202854 | C779: 202850 | D779: 202851 | E779: 202852 | F779: 202853 | G779: 202854
A780: 202860 | B780: =RC[5] -> 202864 | C780: 202860 | D780: 202861 | E780: 202862 | F780: 202863 | G780: 202864
A781: 202870 | B781: =RC[5] -> 202874 | C781: 202870 | D781: 202871 | E781: 202872 | F781: 202873 | G781: 202874
A782: 202880 | B782: =RC[5] -> 202884 | C782: 202880 | D782: 202881 | E782: 202882 | F782: 202883 | G782: 202884
A783: 202890 | B783: =RC[5] -> 202894 | C783: 202890 | D783: 202891 | E783: 202892 | F783: 202893 | G783: 202894
A784: 202900 | B784: =RC[5] -> 202904 | C784: 202900 | D784: 202901 | E784: 202902 | F784: 202903 | G784: 202904
A785: 202910 | B785: =RC[5] -> 202914 | C785: 202910 | D785: 202911 | E785: 202912 | F785: 202913 | G785: 202914
A786: 202920 | B786: =RC[5] -> 202924 | C786: 202920 | D786: 202921 | E786: 202922 | F786: 202923 | G786: 202924
A787: 202930 | B787: =RC[5] -> 202934 | C787: 202930 | D787: 202931 | E787: 202932 | F787: 202933 | G787: 202934
A788: 202940 | B788: =RC[5] -> 202944 | C788: 202940 | D788: 202941 | E788: 202942 | F788: 202943 | G788: 202944
A789: 202950 | B789: =RC[5] -> 202954 | C789: 202950 | D789: 202951 | E789: 202952 | F789: 202953 | G789: 202954
A790: 202960 | B790: =RC[5] -> 202964 | C790: 202960 | D790: 202961 | E790: 202962 | F790: 202963 | G790: 202964
A791: 202970 | B791: =RC[5] -> 202974 | C791: 202970 | D791: 202971 | E791: 202972 | F791: 202973 | G791: 202974
A792: 202980 | B792: =RC[5] -> 202984 | C792: 202980 | D792: 202981 | E792: 202982 | F792: 202983 | G792: 202984
A793: 202990 | B793: =RC[5] -> 202994 | C793: 202990 | D793: 202991 | E793: 202992 | F793: 202993 | G793: 202994
A794: 203000 | B794: =RC[5] -> 203004 | C794: 203000 | D794: 203001 | E794: 203002 | F794: 203003 | G794: 203004
A795: 203010 | B795: =RC[5] -> 203014 | C795: 203010 | D795: 203011 | E795: 203012 | F795: 203013 | G795: 203014
A796: 203020 | B796: =RC[5] -> 203024 | C796: 203020 | D796: 203021 | E796: 203022 | F796: 203023 | G796: 203024
A797: 203030 | B797: =RC[5] -> 203034 | C797: 203030 | D797: 203031 | E797: 203032 | F797: 203033 | G797: 203034
A798: 203040 | B798: =RC[5] -> 203044 | C798: 203040 | D798: 203041 | E798: 203042 | F798: 203043 | G798: 203044
A799: 203050 | B799: =RC[5] -> 203054 | C799: 203050 | D799: 203051 | E799: 203052 | F799: 203053 | G799: 203054
A800: 203060 | B800: =RC[5] -> 203064 | C800: 203060 | D800: 203061 | E800: 203062 | F800: 203063 | G800: 203064
A801: 203070 | B801: =RC[5] -> 203074 | C801: 203070 | D801: 203071 | E801: 203072 | F801: 203073 | G801: 203074
A802: 203080 | B802: =RC[5] -> 203084 | C802: 203080 | D802: 203081 | E802: 203082 | F802: 203083 | G802: 203084
A803: 203090 | B803: =RC[5] -> 203094 | C803: 203090 | D803: 203091 | E803: 203092 | F803: 203093 | G803: 203094
A804: 203100 | B804: =RC[5] -> 203104 | C804: 203100 | D804: 203101 | E804: 203102 | F804: 203103 | G804: 203104
A805: 203110 | B805: =RC[5] -> 203114 | C805: 203110 | D805: 203111 | E805: 203112 | F805: 203113 | G805: 203114
A806: 203120 | B806: =RC[5] -> 203124 | C806: 203120 | D806: 203121 | E806: 203122 | F806: 203123 | G806: 203124
A807: 203130 | B807: =RC[5] -> 203134 | C807: 203130 | D807: 203131 | E807: 203132 | F807: 203133 | G807: 203134
A808: 203140 | B808: =RC[5] -> 203144 | C808: 203140 | D808: 203141 | E808: 203142 | F808: 203143 | G808: 203144
A809: 203150 | B809: =RC[5] -> 203154 | C809: 203150 | D809: 203151 | E809: 203152 | F809: 203153 | G809: 203154
A810: 203160 | B810: =RC[5] -> 203164 | C810: 203160 | D810: 203161 | E810: 203162 | F810: 203163 | G810: 203164
A811: 203170 | B811: =RC[5] -> 203174 | C811: 203170 | D811: 203171 | E811: 203172 | F811: 203173 | G811: 203174
A812: 203180 | B812: =RC[5] -> 203184 | C812: 203180 | D812: 203181 | E812: 203182 | F812: 203183 | G812: 203184
A813: 203190 | B813: =RC[5] -> 203194 | C813: 203190 | D813: 203191 | E813: 203192 | F813: 203193 | G813: 203194
A814: 203200 | B814: =RC[5] -> 203204 | C814: 203200 | D814: 203201 | E814: 203202 | F814: 203203 | G814: 203204
A815: 203210 | B815: =RC[5] -> 203214 | C815: 203210 | D815: 203211 | E815: 203212 | F815: 203213 | G815: 203214
A816: 203220 | B816: =RC[5] -> 203224 | C816: 203220 | D816: 203221 | E816: 203222 | F816: 203223 | G816: 203224
A817: 203230 | B817: =RC[5] -> 203234 | C817: 203230 | D817: 203231 | E817: 203232 | F817: 203233 | G817: 203234
A818: 203240 | B818: =RC[5] -> 203244 | C818: 203240 | D818: 203241 | E818: 203242 | F818: 203243 | G818: 203244
A819: 203250 | B819: =RC[5] -> 203254 | C819: 203250 | D819: 203251 | E819: 203252 | F819: 203253 | G819: 203254
A820: 203260 | B820: =RC[5] -> 203264 | C820: 203260 | D820: 203261 | E820: 203262 | F820: 203263 | G820: 203264
A821: 203270 | B821: =RC[5] -> 203274 | C821: 203270 | D821: 203271 | E821: 203272 | F821: 203273 | G821: 203274
A822: 203280 | B822: =RC[5] -> 203284 | C822: 203280 | D822: 203281 | E822: 203282 | F822: 203283 | G822: 203284
A823: 203290 | B823: =RC[5] -> 203294 | C823: 203290 | D823: 203291 | E823: 203292 | F823: 203293 | G823: 203294
A824: 203300 | B824: =RC[5] -> 203304 | C824: 203300 | D824: 203301 | E824: 203302 | F824: 203303 | G824: 203304
A825: 203310 | B825: =RC[5] -> 203314 | C825: 203310 | D825: 203311 | E825: 203312 | F825: 203313 | G825: 203314
A826: 203320 | B826: =RC[5] -> 203324 | C826: 203320 | D826: 203321 | E826: 203322 | F826: 203323 | G826: 203324
A827: 203330 | B827: =RC[5] -> 203334 | C827: 203330 | D827: 203331 | E827: 203332 | F827: 203333 | G827: 203334
A828: 203340 | B828: =RC[5] -> 203344 | C828: 203340 | D828: 203341 | E828: 203342 | F828: 203343 | G828: 203344
A829: 203350 | B829: =RC[5] -> 203354 | C829: 203350 | D829: 203351 | E829: 203352 | F829: 203353 | G829: 203354
A830: 203360 | B830: =RC[5] -> 203364 | C830: 203360 | D830: 203361 | E830: 203362 | F830: 203363 | G830: 203364
A831: 203370 | B831: =RC[5] -> 203374 | C831: 203370 | D831: 203371 | E831: 203372 | F831: 203373 | G831: 203374
A832: 203380 | B832: =RC[5] -> 203384 | C832: 203380 | D832: 203381 | E832: 203382 | F832: 203383 | G832: 203384
A833: 203390 | B833: =RC[5] -> 203394 | C833: 203390 | D833: 203391 | E833: 203392 | F833: 203393 | G833: 203394
A834: 203400 | B834: =RC[5] -> 203404 | C834: 203400 | D834: 203401 | E834: 203402 | F834: 203403 | G834: 203404
A835: 203410 | B835: =RC[5] -> 203414 | C835: 203410 | D835: 203411 | E835: 203412 | F835: 203413 | G835: 203414
A836: 203420 | B836: =RC[5] -> 203424 | C836: 203420 | D836: 203421 | E836: 203422 | F836: 203423 | G836: 203424
A837: 203430 | B837: =RC[5] -> 203434 | C837: 203430 | D837: 203431 | E837: 203432 | F837: 203433 | G837: 203434
A838: 203440 | B838: =RC[5] -> 203444 | C838: 203440 | D838: 203441 | E838: 203442 | F838: 203443 | G838: 203444
A839: 203450 | B839: =RC[5] -> 203454 | C839: 203450 | D839: 203451 | E839: 203452 | F839: 203453 | G839: 203454
A840: 203460 | B840: =RC[5] -> 203464 | C840: 203460 | D840: 203461 | E840: 203462 | F840: 203463 | G840: 203464
A841: 203470 | B841: =RC[5] -> 203474 | C841: 203470 | D841: 203471 | E841: 203472 | F841: 203473 | G841: 203474
A842: 203480 | B842: =RC[5] -> 203484 | C842: 203480 | D842: 203481 | E842: 203482 | F842: 203483 | G842: 203484
A843: 203490 | B843: =RC[5] -> 203494 | C843: 203490 | D843: 203491 | E843: 203492 | F843: 203493 | G843: 203494
A844: 203500 | B844: =RC[5] -> 203504 | C844: 203500 | D844: 203501 | E844: 203502 | F844: 203503 | G844: 203504
A845: 203510 | B845: =RC[5] -> 203514 | C845: 203510 | D845: 203511 | E845: 203512 | F845: 203513 | G845: 203514
A846: 203520 | B846: =RC[5] -> 203524 | C846: 203520 | D846: 203521 | E846: 203522 | F846: 203523 | G846: 203524
A847: 203530 | B847: =RC[5] -> 203534 | C847: 203530 | D847: 203531 | E847: 203532 | F847: 203533 | G847: 203534
A848: 203540 | B848: =RC[5] -> 203544 | C848: 203540 | D848: 203541 | E848: 203542 | F848: 203543 | G848: 203544
A849: 203550 | B849: =RC[5] -> 203554 | C849: 203550 | D849: 203551 | E849: 203552 | F849: 203553 | G849: 203554
A850: 203560 | B850: =RC[5] -> 203564 | C850: 203560 | D850: 203561 | E850: 203562 | F850: 203563 | G850: 203564
A851: 203570 | B851: =RC[5] -> 203574 | C851: 203570 | D851: 203571 | E851: 203572 | F851: 203573 | G851: 203574
A852: 203580 | B852: =RC[5] -> 203584 | C852: 203580 | D852: 203581 | E852: 203582 | F852: 203583 | G852: 203584
A853: 203590 | B853: =RC[5] -> 203594 | C853: 203590 | D853: 203591 | E853: 203592 | F853: 203593 | G853: 203594
A854: 203600 | B854: =RC[5] -> 203604 | C854: 203600 | D854: 203601 | E854: 203602 | F854: 203603 | G854: 203604
A855: 203610 | B855: =RC[5] -> 203614 | C855: 203610 | D855: 203611 | E855: 203612 | F855: 203613 | G855: 203614
A856: 203620 | B856: =RC[5] -> 203624 | C856: 203620 | D856: 203621 | E856: 203622 | F856: 203623 | G856: 203624
A857: 203630 | B857: =RC[5] -> 203634 | C857: 203630 | D857: 203631 | E857: 203632 | F857: 203633 | G857: 203634
A858: 203640 | B858: =RC[5] -> 203644 | C858: 203640 | D858: 203641 | E858: 203642 | F858: 203643 | G858: 203644
A859: 203650 | B859: =RC[5] -> 203654 | C859: 203650 | D859: 203651 | E859: 203652 | F859: 203653 | G859: 203654
A860: 203660 | B860: =RC[5] -> 203664 | C860: 203660 | D860: 203661 | E860: 203662 | F860: 203663 | G860: 203664
A861: 203670 | B861: =RC[5] -> 203674 | C861: 203670 | D861: 203671 | E861: 203672 | F861: 203673 | G861: 203674
A862: 203680 | B862: =RC[5] -> 203684 | C862: 203680 | D862: 203681 | E862: 203682 | F862: 203683 | G862: 203684
A863: 203690 | B863: =RC[5] -> 203694 | C863: 203690 | D863: 203691 | E863: 203692 | F863: 203693 | G863: 203694
A864: 203700 | B864: =RC[5] -> 203704 | C864: 203700 | D864: 203701 | E864: 203702 | F864: 203703 | G864: 203704
A865: 203710 | B865: =RC[5] -> 203714 | C865: 203710 | D865: 203711 | E865: 203712 | F865: 203713 | G865: 203714
A866: 203720 | B866: =RC[5] -> 203724 | C866: 203720 | D866: 203721 | E866: 203722 | F866: 203723 | G866: 203724
A867: 203730 | B867: =RC[5] -> 203734 | C867: 203730 | D867: 203731 | E867: 203732 | F867: 203733 | G867: 203734
A868: 203740 | B868: =RC[5] -> 203744 | C868: 203740 | D868: 203741 | E868: 203742 | F868: 203743 | G868: 203744
A869: 203750 | B869: =RC[5] -> 203754 | C869: 203750 | D869: 203751 | E869: 203752 | F869: 203753 | G869: 203754
A870: 203760 | B870: =RC[5] -> 203764 | C870: 203760 | D870: 203761 | E870: 203762 | F870: 203763 | G870: 203764
A871: 203770 | B871: =RC[5] -> 203774 | C871: 203770 | D871: 203771 | E871: 203772 | F871: 203773 | G871: 203774
A872: 203780 | B872: =RC[5] -> 203784 | C872: 203780 | D872: 203781 | E872: 203782 | F872: 203783 | G872: 203784
A873: 203790 | B873: =RC[5] -> 203794 | C873: 203790 | D873: 203791 | E873: 203792 | F873: 203793 | G873: 203794
A874: 203800 | B874: =RC[5] -> 203804 | C874: 203800 | D874: 203801 | E874: 203802 | F874: 203803 | G874: 203804
A875: 203810 | B875: =RC[5] -> 203814 | C875: 203810 | D875: 203811 | E875: 203812 | F875: 203813 | G875: 203814
A876: 203820 | B876: =RC[5] -> 203824 | C876: 203820 | D876: 203821 | E876: 203822 | F876: 203823 | G876: 203824
A877: 203830 | B877: =RC[5] -> 203834 | C877: 203830 | D877: 203831 | E877: 203832 | F877: 203833 | G877: 203834
A878: 203840 | B878: =RC[5] -> 203844 | C878: 203840 | D878: 203841 | E878: 203842 | F878: 203843 | G878: 203844
A879: 203850 | B879: =RC[5] -> 203854 | C879: 203850 | D879: 203851 | E879: 203852 | F879: 203853 | G879: 203854
A880: 203860 | B880: =RC[5] -> 203864 | C880: 203860 | D880: 203861 | E880: 203862 | F880: 203863 | G880: 203864
A881: 203870 | B881: =RC[5] -> 203874 | C881: 203870 | D881: 203871 | E881: 203872 | F881: 203873 | G881: 203874
A882: 203880 | B882: =RC[5] -> 203884 | C882: 203880 | D882: 203881 | E882: 203882 | F882: 203883 | G882: 203884
A883: 203890 | B883: =RC[5] -> 203894 | C883: 203890 | D883: 203891 | E883: 203892 | F883: 203893 | G883: 203894
A884: 203900 | B884: =RC[5] -> 203904 | C884: 203900 | D884: 203901 | E884: 203902 | F884: 203903 | G884: 203904
A885: 203910 | B885: =RC[5] -> 203914 | C885: 203910 | D885: 203911 | E885: 203912 | F885: 203913 | G885: 203914
A886: 203920 | B886: =RC[5] -> 203924 | C886: 203920 | D886: 203921 | E886: 203922 | F886: 203923 | G886: 203924
A887: 203930 | B887: =RC[5] -> 203934 | C887: 203930 | D887: 203931 | E887: 203932 | F887: 203933 | G887: 203934
A888: 203940 | B888: =RC[5] -> 203944 | C888: 203940 | D888: 203941 | E888: 203942 | F888: 203943 | G888: 203944
A889: 203950 | B889: =RC[5] -> 203954 | C889: 203950 | D889: 203951 | E889: 203952 | F889: 203953 | G889: 203954
A890: 203960 | B890: =RC[5] -> 203964 | C890: 203960 | D890: 203961 | E890: 203962 | F890: 203963 | G890: 203964
A891: 203970 | B891: =RC[5] -> 203974 | C891: 203970 | D891: 203971 | E891: 203972 | F891: 203973 | G891: 203974
A892: 203980 | B892: =RC[5] -> 203984 | C892: 203980 | D892: 203981 | E892: 203982 | F892: 203983 | G892: 203984
A893: 203990 | B893: =RC[5] -> 203994 | C893: 203990 | D893: 203991 | E893: 203992 | F893: 203993 | G893: 203994
A894: 204000 | B894: =RC[5] -> 204004 | C894: 204000 | D894: 204001 | E894: 204002 | F894: 204003 | G894: 204004
A895: 204010 | B895: =RC[5] -> 204014 | C895: 204010 | D895: 204011 | E895: 204012 | F895: 204013 | G895: 204014
A896: 204020 | B896: =RC[5] -> 204024 | C896: 204020 | D896: 204021 | E896: 204022 | F896: 204023 | G896: 204024
A897: 204030 | B897: =RC[5] -> 204034 | C897: 204030 | D897: 204031 | E897: 204032 | F897: 204033 | G897: 204034
A898: 204040 | B898: =RC[5] -> 204044 | C898: 204040 | D898: 204041 | E898: 204042 | F898: 204043 | G898: 204044
A899: 204050 | B899: =RC[5] -> 204054 | C899: 204050 | D899: 204051 | E899: 204052 | F899: 204053 | G899: 204054
A900: 204060 | B900: =RC[5] -> 204064 | C900: 204060 | D900: 204061 | E900: 204062 | F900: 204063 | G900: 204064
A901: 204070 | B901: =RC[5] -> 204074 | C901: 204070 | D901: 204071 | E901: 204072 | F901: 204073 | G901: 204074
A902: 204080 | B902: =RC[5] -> 204084 | C902: 204080 | D902: 204081 | E902: 204082 | F902: 204083 | G902: 204084
A903: 204090 | B903: =RC[5] -> 204094 | C903: 204090 | D903: 204091 | E903: 204092 | F903: 204093 | G903: 204094
A904: 204100 | B904: =RC[5] -> 204104 | C904: 204100 | D904: 204101 | E904: 204102 | F904: 204103 | G904: 204104
A905: 204110 | B905: =RC[5] -> 204114 | C905: 204110 | D905: 204111 | E905: 204112 | F905: 204113 | G905: 204114
A906: 204120 | B906: =RC[5] -> 204124 | C906: 204120 | D906: 204121 | E906: 204122 | F906: 204123 | G906: 204124
A907: 204130 | B907: =RC[5] -> 204134 | C907: 204130 | D907: 204131 | E907: 204132 | F907: 204133 | G907: 204134
A908: 204140 | B908: =RC[5] -> 204144 | C908: 204140 | D908: 204141 | E908: 204142 | F908: 204143 | G908: 204144
A909: 204150 | B909: =RC[5] -> 204154 | C909: 204150 | D909: 204151 | E909: 204152 | F909: 204153 | G909: 204154
A910: 204160 | B910: =RC[5] -> 204164 | C910: 204160 | D910: 204161 | E910: 204162 | F910: 204163 | G910: 204164
A911: 204170 | B911: =RC[5] -> 204174 | C911: 204170 | D911: 204171 | E911: 204172 | F911: 204173 | G911: 204174
A912: 204180 | B912: =RC[5] -> 204184 | C912: 204180 | D912: 204181 | E912: 204182 | F912: 204183 | G912: 204184
A913: 204190 | B913: =RC[5] -> 204194 | C913: 204190 | D913: 204191 | E913: 204192 | F913: 204193 | G913: 204194
A914: 204200 | B914: =RC[5] -> 204204 | C914: 204200 | D914: 204201 | E914: 204202 | F914: 204203 | G914: 204204
A915: 204210 | B915: =RC[5] -> 204214 | C915: 204210 | D915: 204211 | E915: 204212 | F915: 204213 | G915: 204214
A916: 204220 | B916: =RC[5] -> 204224 | C916: 204220 | D916: 204221 | E916: 204222 | F916: 204223 | G916: 204224
A917: 204230 | B917: =RC[5] -> 204234 | C917: 204230 | D917: 204231 | E917: 204232 | F917: 204233 | G917: 204234
A918: 204240 | B918: =RC[5] -> 204244 | C918: 204240 | D918: 204241 | E918: 204242 | F918: 204243 | G918: 204244
A919: 204250 | B919: =RC[5] -> 204254 | C919: 204250 | D919: 204251 | E919: 204252 | F919: 204253 | G919: 204254
A920: 204260 | B920: =RC[5] -> 204264 | C920: 204260 | D920: 204261 | E920: 204262 | F920: 204263 | G920: 204264
A921: 204270 | B921: =RC[5] -> 204274 | C921: 204270 | D921: 204271 | E921: 204272 | F921: 204273 | G921: 204274
A922: 204280 | B922: =RC[5] -> 204284 | C922: 204280 | D922: 204281 | E922: 204282 | F922: 204283 | G922: 204284
A923: 204290 | B923: =RC[5] -> 204294 | C923: 204290 | D923: 204291 | E923: 204292 | F923: 204293 | G923: 204294
A924: 204300 | B924: =RC[5] -> 204304 | C924: 204300 | D924: 204301 | E924: 204302 | F924: 204303 | G924: 204304
A925: 204310 | B925: =RC[5] -> 204314 | C925: 204310 | D925: 204311 | E925: 204312 | F925: 204313 | G925: 204314
A926: 204320 | B926: =RC[5] -> 204324 | C926: 204320 | D926: 204321 | E926: 204322 | F926: 204323 | G926: 204324
A927: 204330 | B927: =RC[5] -> 204334 | C927: 204330 | D927: 204331 | E927: 204332 | F927: 204333 | G927: 204334
A928: 204340 | B928: =RC[5] -> 204344 | C928: 204340 | D928: 204341 | E928: 204342 | F928: 204343 | G928: 204344
A929: 204350 | B929: =RC[5] -> 204354 | C929: 204350 | D929: 204351 | E929: 204352 | F929: 204353 | G929: 204354
A930: 204360 | B930: =RC[5] -> 204364 | C930: 204360 | D930: 204361 | E930: 204362 | F930: 204363 | G930: 204364
A931: 204370 | B931: =RC[5] -> 204374 | C931: 204370 | D931: 204371 | E931: 204372 | F931: 204373 | G931: 204374
A932: 204380 | B932: =RC[5] -> 204384 | C932: 204380 | D932: 204381 | E932: 204382 | F932: 204383 | G932: 204384
A933: 204390 | B933: =RC[5] -> 204394 | C933: 204390 | D933: 204391 | E933: 204392 | F933: 204393 | G933: 204394
A934: 204400 | B934: =RC[5] -> 204404 | C934: 204400 | D934: 204401 | E934: 204402 | F934: 204403 | G934: 204404
A935: 204410 | B935: =RC[5] -> 204414 | C935: 204410 | D935: 204411 | E935: 204412 | F935: 204413 | G935: 204414
A936: 204420 | B936: =RC[5] -> 204424 | C936: 204420 | D936: 204421 | E936: 204422 | F936: 204423 | G936: 204424
A937: 204430 | B937: =RC[5] -> 204434 | C937: 204430 | D937: 204431 | E937: 204432 | F937: 204433 | G937: 204434
A938: 204440 | B938: =RC[5] -> 204444 | C938: 204440 | D938: 204441 | E938: 204442 | F938: 204443 | G938: 204444
A939: 204450 | B939: =RC[5] -> 204454 | C939: 204450 | D939: 204451 | E939: 204452 | F939: 204453 | G939: 204454
A940: 204460 | B940: =RC[5] -> 204464 | C940: 204460 | D940: 204461 | E940: 204462 | F940: 204463 | G940: 204464
A941: 204470 | B941: =RC[5] -> 204474 | C941: 204470 | D941: 204471 | E941: 204472 | F941: 204473 | G941: 204474
A942: 204480 | B942: =RC[5] -> 204484 | C942: 204480 | D942: 204481 | E942: 204482 | F942: 204483 | G942: 204484
A943: 204490 | B943: =RC[5] -> 204494 | C943: 204490 | D943: 204491 | E943: 204492 | F943: 204493 | G943: 204494
A944: 204500 | B944: =RC[5] -> 204504 | C944: 204500 | D944: 204501 | E944: 204502 | F944: 204503 | G944: 204504
A945: 204510 | B945: =RC[5] -> 204514 | C945: 204510 | D945: 204511 | E945: 204512 | F945: 204513 | G945: 204514
A946: 204520 | B946: =RC[5] -> 204524 | C946: 204520 | D946: 204521 | E946: 204522 | F946: 204523 | G946: 204524
A947: 204530 | B947: =RC[5] -> 204534 | C947: 204530 | D947: 204531 | E947: 204532 | F947: 204533 | G947: 204534
A948: 204540 | B948: =RC[5] -> 204544 | C948: 204540 | D948: 204541 | E948: 204542 | F948: 204543 | G948: 204544
A949: 204550 | B949: =RC[5] -> 204554 | C949: 204550 | D949: 204551 | E949: 204552 | F949: 204553 | G949: 204554
A950: 204560 | B950: =RC[5] -> 204564 | C950: 204560 | D950: 204561 | E950: 204562 | F950: 204563 | G950: 204564
A951: 204570 | B951: =RC[5] -> 204574 | C951: 204570 | D951: 204571 | E951: 204572 | F951: 204573 | G951: 204574
A952: 204580 | B952: =RC[5] -> 204584 | C952: 204580 | D952: 204581 | E952: 204582 | F952: 204583 | G952: 204584
A953: 204590 | B953: =RC[5] -> 204594 | C953: 204590 | D953: 204591 | E953: 204592 | F953: 204593 | G953: 204594
A954: 204600 | B954: =RC[5] -> 204604 | C954: 204600 | D954: 204601 | E954: 204602 | F954: 204603 | G954: 204604
A955: 204610 | B955: =RC[5] -> 204614 | C955: 204610 | D955: 204611 | E955: 204612 | F955: 204613 | G955: 204614
A956: 204620 | B956: =RC[5] -> 204624 | C956: 204620 | D956: 204621 | E956: 204622 | F956: 204623 | G956: 204624
A957: 204630 | B957: =RC[5] -> 204634 | C957: 204630 | D957: 204631 | E957: 204632 | F957: 204633 | G957: 204634
A958: 204640 | B958: =RC[5] -> 204644 | C958: 204640 | D958: 204641 | E958: 204642 | F958: 204643 | G958: 204644
A959: 204650 | B959: =RC[5] -> 204654 | C959: 204650 | D959: 204651 | E959: 204652 | F959: 204653 | G959: 204654
A960: 204660 | B960: =RC[5] -> 204664 | C960: 204660 | D960: 204661 | E960: 204662 | F960: 204663 | G960: 204664
A961: 204670 | B961: =RC[5] -> 204674 | C961: 204670 | D961: 204671 | E961: 204672 | F961: 204673 | G961: 204674
A962: 204680 | B962: =RC[5] -> 204684 | C962: 204680 | D962: 204681 | E962: 204682 | F962: 204683 | G962: 204684
A963: 204690 | B963: =RC[5] -> 204694 | C963: 204690 | D963: 204691 | E963: 204692 | F963: 204693 | G963: 204694
A964: 204700 | B964: =RC[5] -> 204704 | C964: 204700 | D964: 204701 | E964: 204702 | F964: 204703 | G964: 204704
A965: 204710 | B965: =RC[5] -> 204714 | C965: 204710 | D965: 204711 | E965: 204712 | F965: 204713 | G965: 204714
A966: 204720 | B966: =RC[5] -> 204724 | C966: 204720 | D966: 204721 | E966: 204722 | F966: 204723 | G966: 204724
A967: 204730 | B967: =RC[5] -> 204734 | C967: 204730 | D967: 204731 | E967: 204732 | F967: 204733 | G967: 204734
A968: 204740 | B968: =RC[5] -> 204744 | C968: 204740 | D968: 204741 | E968: 204742 | F968: 204743 | G968: 204744
A969: 204750 | B969: =RC[5] -> 204754 | C969: 204750 | D969: 204751 | E969: 204752 | F969: 204753 | G969: 204754
A970: 204760 | B970: =RC[5] -> 204764 | C970: 204760 | D970: 204761 | E970: 204762 | F970: 204763 | G970: 204764
A971: 204770 | B971: =RC[5] -> 204774 | C971: 204770 | D971: 204771 | E971: 204772 | F971: 204773 | G971: 204774
A972: 204780 | B972: =RC[5] -> 204784 | C972: 204780 | D972: 204781 | E972: 204782 | F972: 204783 | G972: 204784
A973: 204790 | B973: =RC[5] -> 204794 | C973: 204790 | D973: 204791 | E973: 204792 | F973: 204793 | G973: 204794
A974: 204800 | B974: =RC[5] -> 204804 | C974: 204800 | D974: 204801 | E974: 204802 | F974: 204803 | G974: 204804
A975: 204810 | B975: =RC[5] -> 204814 | C975: 204810 | D975: 204811 | E975: 204812 | F975: 204813 | G975: 204814
A976: 204820 | B976: =RC[5] -> 204824 | C976: 204820 | D976: 204821 | E976: 204822 | F976: 204823 | G976: 204824
A977: 204830 | B977: =RC[5] -> 204834 | C977: 204830 | D977: 204831 | E977: 204832 | F977: 204833 | G977: 204834
A978: 204840 | B978: =RC[5] -> 204844 | C978: 204840 | D978: 204841 | E978: 204842 | F978: 204843 | G978: 204844
A979: 204850 | B979: =RC[5] -> 204854 | C979: 204850 | D979: 204851 | E979: 204852 | F979: 204853 | G979: 204854
A980: 204860 | B980: =RC[5] -> 204864 | C980: 204860 | D980: 204861 | E980: 204862 | F980: 204863 | G980: 204864
A981: 204870 | B981: =RC[5] -> 204874 | C981: 204870 | D981: 204871 | E981: 204872 | F981: 204873 | G981: 204874
A982: 204880 | B982: =RC[5] -> 204884 | C982: 204880 | D982: 204881 | E982: 204882 | F982: 204883 | G982: 204884
A983: 204890 | B983: =RC[5] -> 204894 | C983: 204890 | D983: 204891 | E983: 204892 | F983: 204893 | G983: 204894
A984: 204900 | B984: =RC[5] -> 204904 | C984: 204900 | D984: 204901 | E984: 204902 | F984: 204903 | G984: 204904
A985: 204910 | B985: =RC[5] -> 204914 | C985: 204910 | D985: 204911 | E985: 204912 | F985: 204913 | G985: 204914
A986: 204920 | B986: =RC[5] -> 204924 | C986: 204920 | D986: 204921 | E986: 204922 | F986: 204923 | G986: 204924
A987: 204930 | B987: =RC[5] -> 204934 | C987: 204930 | D987: 204931 | E987: 204932 | F987: 204933 | G987: 204934
A988: 204940 | B988: =RC[5] -> 204944 | C988: 204940 | D988: 204941 | E988: 204942 | F988: 204943 | G988: 204944
A989: 204950 | B989: =RC[5] -> 204954 | C989: 204950 | D989: 204951 | E989: 204952 | F989: 204953 | G989: 204954
A990: 204960 | B990: =RC[5] -> 204964 | C990: 204960 | D990: 204961 | E990: 204962 | F990: 204963 | G990: 204964
A991: 204970 | B991: =RC[5] -> 204974 | C991: 204970 | D991: 204971 | E991: 204972 | F991: 204973 | G991: 204974
A992: 204980 | B992: =RC[5] -> 204984 | C992: 204980 | D992: 204981 | E992: 204982 | F992: 204983 | G992: 204984
A993: 204990 | B993: =RC[5] -> 204994 | C993: 204990 | D993: 204991 | E993: 204992 | F993: 204993 | G993: 204994
A994: 205000 | B994: =RC[5] -> 205004 | C994: 205000 | D994: 205001 | E994: 205002 | F994: 205003 | G994: 205004
A995: 205010 | B995: =RC[5] -> 205014 | C995: 205010 | D995: 205011 | E995: 205012 | F995: 205013 | G995: 205014
A996: 205020 | B996: =RC[5] -> 205024 | C996: 205020 | D996: 205021 | E996: 205022 | F996: 205023 | G996: 205024
A997: 205030 | B997: =RC[5] -> 205034 | C997: 205030 | D997: 205031 | E997: 205032 | F997: 205033 | G997: 205034
A998: 205040 | B998: =RC[5] -> 205044 | C998: 205040 | D998: 205041 | E998: 205042 | F998: 205043 | G998: 205044
A999: 205050 | B999: =RC[5] -> 205054 | C999: 205050 | D999: 205051 | E999: 205052 | F999: 205053 | G999: 205054
A1000: 205060 | B1000: =RC[5] -> 205064 | C1000: 205060 | D1000: 205061 | E1000: 205062 | F1000: 205063 | G1000: 205064
A1001: 205070 | B1001: =RC[5] -> 205074 | C1001: 205070 | D1001: 205071 | E1001: 205072 | F1001: 205073 | G1001: 205074
A1002: 205080 | B1002: =RC[5] -> 205084 | C1002: 205080 | D1002: 205081 | E1002: 205082 | F1002: 205083 | G1002: 205084
A1003: 205090 | B1003: =RC[5] -> 205094 | C1003: 205090 | D1003: 205091 | E1003: 205092 | F1003: 205093 | G1003: 205094
A1004: 205100 | B1004: =RC[5] -> 205104 | C1004: 205100 | D1004: 205101 | E1004: 205102 | F1004: 205103 | G1004: 205104
A1005: 205110 | B1005: =RC[5] -> 205114 | C1005: 205110 | D1005: 205111 | E1005: 205112 | F1005: 205113 | G1005: 205114
A1006: 205120 | B1006: =RC[5] -> 205124 | C1006: 205120 | D1006: 205121 | E1006: 205122 | F1006: 205123 | G1006: 205124
A1007: 205130 | B1007: =RC[5] -> 205134 | C1007: 205130 | D1007: 205131 | E1007: 205132 | F1007: 205133 | G1007: 205134
A1008: 205140 | B1008: =RC[5] -> 205144 | C1008: 205140 | D1008: 205141 | E1008: 205142 | F1008: 205143 | G1008: 205144
A1009: 205150 | B1009: =RC[5] -> 205154 | C1009: 205150 | D1009: 205151 | E1009: 205152 | F1009: 205153 | G1009: 205154
A1010: 205160 | B1010: =RC[5] -> 205164 | C1010: 205160 | D1010: 205161 | E1010: 205162 | F1010: 205163 | G1010: 205164
A1011: 205170 | B1011: =RC[5] -> 205174 | C1011: 205170 | D1011: 205171 | E1011: 205172 | F1011: 205173 | G1011: 205174
A1012: 205180 | B1012: =RC[5] -> 205184 | C1012: 205180 | D1012: 205181 | E1012: 205182 | F1012: 205183 | G1012: 205184
A1013: 205190 | B1013: =RC[5] -> 205194 | C1013: 205190 | D1013: 205191 | E1013: 205192 | F1013: 205193 | G1013: 205194
A1014: 205200 | B1014: =RC[5] -> 205204 | C1014: 205200 | D1014: 205201 | E1014: 205202 | F1014: 205203 | G1014: 205204
A1015: 205210 | B1015: =RC[5] -> 205214 | C1015: 205210 | D1015: 205211 | E1015: 205212 | F1015: 205213 | G1015: 205214
A1016: 205220 | B1016: =RC[5] -> 205224 | C1016: 205220 | D1016: 205221 | E1016: 205222 | F1016: 205223 | G1016: 205224
A1017: 205230 | B1017: =RC[5] -> 205234 | C1017: 205230 | D1017: 205231 | E1017: 205232 | F1017: 205233 | G1017: 205234
A1018: 205240 | B1018: =RC[5] -> 205244 | C1018: 205240 | D1018: 205241 | E1018: 205242 | F1018: 205243 | G1018: 205244
A1019: 205250 | B1019: =RC[5] -> 205254 | C1019: 205250 | D1019: 205251 | E1019: 205252 | F1019: 205253 | G1019: 205254
A1020: 205260 | B1020: =RC[5] -> 205264 | C1020: 205260 | D1020: 205261 | E1020: 205262 | F1020: 205263 | G1020: 205264
A1021: 205270 | B1021: =RC[5] -> 205274 | C1021: 205270 | D1021: 205271 | E1021: 205272 | F1021: 205273 | G1021: 205274
A1022: 205280 | B1022: =RC[5] -> 205284 | C1022: 205280 | D1022: 205281 | E1022: 205282 | F1022: 205283 | G1022: 205284
A1023: 205290 | B1023: =RC[5] -> 205294 | C1023: 205290 | D1023: 205291 | E1023: 205292 | F1023: 205293 | G1023: 205294
A1024: 205300 | B1024: =RC[5] -> 205304 | C1024: 205300 | D1024: 205301 | E1024: 205302 | F1024: 205303 | G1024: 205304
A1025: 205310 | B1025: =RC[5] -> 205314 | C1025: 205310 | D1025: 205311 | E1025: 205312 | F1025: 205313 | G1025: 205314
A1026: 205320 | B1026: =RC[5] -> 205324 | C1026: 205320 | D1026: 205321 | E1026: 205322 | F1026: 205323 | G1026: 205324
A1027: 205330 | B1027: =RC[5] -> 205334 | C1027: 205330 | D1027: 205331 | E1027: 205332 | F1027: 205333 | G1027: 205334
A1028: 205340 | B1028: =RC[5] -> 205344 | C1028: 205340 | D1028: 205341 | E1028: 205342 | F1028: 205343 | G1028: 205344
A1029: 205350 | B1029: =RC[5] -> 205354 | C1029: 205350 | D1029: 205351 | E1029: 205352 | F1029: 205353 | G1029: 205354
A1030: 205360 | B1030: =RC[5] -> 205364 | C1030: 205360 | D1030: 205361 | E1030: 205362 | F1030: 205363 | G1030: 205364
A1031: 205370 | B1031: =RC[5] -> 205374 | C1031: 205370 | D1031: 205371 | E1031: 205372 | F1031: 205373 | G1031: 205374
A1032: 205380 | B1032: =RC[5] -> 205384 | C1032: 205380 | D1032: 205381 | E1032: 205382 | F1032: 205383 | G1032: 205384
A1033: 205390 | B1033: =RC[5] -> 205394 | C1033: 205390 | D1033: 205391 | E1033: 205392 | F1033: 205393 | G1033: 205394
A1034: 205400 | B1034: =RC[5] -> 205404 | C1034: 205400 | D1034: 205401 | E1034: 205402 | F1034: 205403 | G1034: 205404
A1035: 205410 | B1035: =RC[5] -> 205414 | C1035: 205410 | D1035: 205411 | E1035: 205412 | F1035: 205413 | G1035: 205414
A1036: 205420 | B1036: =RC[5] -> 205424 | C1036: 205420 | D1036: 205421 | E1036: 205422 | F1036: 205423 | G1036: 205424
A1037: 205430 | B1037: =RC[5] -> 205434 | C1037: 205430 | D1037: 205431 | E1037: 205432 | F1037: 205433 | G1037: 205434
A1038: 205440 | B1038: =RC[5] -> 205444 | C1038: 205440 | D1038: 205441 | E1038: 205442 | F1038: 205443 | G1038: 205444
A1039: 205450 | B1039: =RC[5] -> 205454 | C1039: 205450 | D1039: 205451 | E1039: 205452 | F1039: 205453 | G1039: 205454
A1040: 205460 | B1040: =RC[5] -> 205464 | C1040: 205460 | D1040: 205461 | E1040: 205462 | F1040: 205463 | G1040: 205464
A1041: 205470 | B1041: =RC[5] -> 205474 | C1041: 205470 | D1041: 205471 | E1041: 205472 | F1041: 205473 | G1041: 205474
A1042: 205480 | B1042: =RC[5] -> 205484 | C1042: 205480 | D1042: 205481 | E1042: 205482 | F1042: 205483 | G1042: 205484
A1043: 205490 | B1043: =RC[5] -> 205494 | C1043: 205490 | D1043: 205491 | E1043: 205492 | F1043: 205493 | G1043: 205494
A1044: 205500 | B1044: =RC[5] -> 205504 | C1044: 205500 | D1044: 205501 | E1044: 205502 | F1044: 205503 | G1044: 205504
A1045: 205510 | B1045: =RC[5] -> 205514 | C1045: 205510 | D1045: 205511 | E1045: 205512 | F1045: 205513 | G1045: 205514
A1046: 205520 | B1046: =RC[5] -> 205524 | C1046: 205520 | D1046: 205521 | E1046: 205522 | F1046: 205523 | G1046: 205524
A1047: 205530 | B1047: =RC[5] -> 205534 | C1047: 205530 | D1047: 205531 | E1047: 205532 | F1047: 205533 | G1047: 205534
A1048: 205540 | B1048: =RC[5] -> 205544 | C1048: 205540 | D1048: 205541 | E1048: 205542 | F1048: 205543 | G1048: 205544
A1049: 205550 | B1049: =RC[5] -> 205554 | C1049: 205550 | D1049: 205551 | E1049: 205552 | F1049: 205553 | G1049: 205554
A1050: 205560 | B1050: =RC[5] -> 205564 | C1050: 205560 | D1050: 205561 | E1050: 205562 | F1050: 205563 | G1050: 205564
A1051: 205570 | B1051: =RC[5] -> 205574 | C1051: 205570 | D1051: 205571 | E1051: 205572 | F1051: 205573 | G1051: 205574
A1052: 205580 | B1052: =RC[5] -> 205584 | C1052: 205580 | D1052: 205581 | E1052: 205582 | F1052: 205583 | G1052: 205584
A1053: 205590 | B1053: =RC[5] -> 205594 | C1053: 205590 | D1053: 205591 | E1053: 205592 | F1053: 205593 | G1053: 205594
A1054: 205600 | B1054: =RC[5] -> 205604 | C1054: 205600 | D1054: 205601 | E1054: 205602 | F1054: 205603 | G1054: 205604
A1055: 205610 | B1055: =RC[5] -> 205614 | C1055: 205610 | D1055: 205611 | E1055: 205612 | F1055: 205613 | G1055: 205614
A1056: 205620 | B1056: =RC[5] -> 205624 | C1056: 205620 | D1056: 205621 | E1056: 205622 | F1056: 205623 | G1056: 205624
A1057: 205630 | B1057: =RC[5] -> 205634 | C1057: 205630 | D1057: 205631 | E1057: 205632 | F1057: 205633 | G1057: 205634
A1058: 205640 | B1058: =RC[5] -> 205644 | C1058: 205640 | D1058: 205641 | E1058: 205642 | F1058: 205643 | G1058: 205644
A1059: 205650 | B1059: =RC[5] -> 205654 | C1059: 205650 | D1059: 205651 | E1059: 205652 | F1059: 205653 | G1059: 205654
A1060: 205660 | B1060: =RC[5] -> 205664 | C1060: 205660 | D1060: 205661 | E1060: 205662 | F1060: 205663 | G1060: 205664
A1061: 205670 | B1061: =RC[5] -> 205674 | C1061: 205670 | D1061: 205671 | E1061: 205672 | F1061: 205673 | G1061: 205674
A1062: 205680 | B1062: =RC[5] -> 205684 | C1062: 205680 | D1062: 205681 | E1062: 205682 | F1062: 205683 | G1062: 205684
A1063: 205690 | B1063: =RC[5] -> 205694 | C1063: 205690 | D1063: 205691 | E1063: 205692 | F1063: 205693 | G1063: 205694
A1064: 205700 | B1064: =RC[5] -> 205704 | C1064: 205700 | D1064: 205701 | E1064: 205702 | F1064: 205703 | G1064: 205704
A1065: 205710 | B1065: =RC[5] -> 205714 | C1065: 205710 | D1065: 205711 | E1065: 205712 | F1065: 205713 | G1065: 205714
A1066: 205720 | B1066: =RC[5] -> 205724 | C1066: 205720 | D1066: 205721 | E1066: 205722 | F1066: 205723 | G1066: 205724
A1067: 205730 | B1067: =RC[5] -> 205734 | C1067: 205730 | D1067: 205731 | E1067: 205732 | F1067: 205733 | G1067: 205734
A1068: 205740 | B1068: =RC[5] -> 205744 | C1068: 205740 | D1068: 205741 | E1068: 205742 | F1068: 205743 | G1068: 205744
A1069: 205750 | B1069: =RC[5] -> 205754 | C1069: 205750 | D1069: 205751 | E1069: 205752 | F1069: 205753 | G1069: 205754
A1070: 205760 | B1070: =RC[5] -> 205764 | C1070: 205760 | D1070: 205761 | E1070: 205762 | F1070: 205763 | G1070: 205764
A1071: 205770 | B1071: =RC[5] -> 205774 | C1071: 205770 | D1071: 205771 | E1071: 205772 | F1071: 205773 | G1071: 205774
A1072: 205780 | B1072: =RC[5] -> 205784 | C1072: 205780 | D1072: 205781 | E1072: 205782 | F1072: 205783 | G1072: 205784
A1073: 205790 | B1073: =RC[5] -> 205794 | C1073: 205790 | D1073: 205791 | E1073: 205792 | F1073: 205793 | G1073: 205794
A1074: 205800 | B1074: =RC[5] -> 205804 | C1074: 205800 | D1074: 205801 | E1074: 205802 | F1074: 205803 | G1074: 205804
A1075: 205810 | B1075: =RC[5] -> 205814 | C1075: 205810 | D1075: 205811 | E1075: 205812 | F1075: 205813 | G1075: 205814
A1076: 205820 | B1076: =RC[5] -> 205824 | C1076: 205820 | D1076: 205821 | E1076: 205822 | F1076: 205823 | G1076: 205824
A1077: 205830 | B1077: =RC[5] -> 205834 | C1077: 205830 | D1077: 205831 | E1077: 205832 | F1077: 205833 | G1077: 205834
A1078: 205840 | B1078: =RC[5] -> 205844 | C1078: 205840 | D1078: 205841 | E1078: 205842 | F1078: 205843 | G1078: 205844
A1079: 205850 | B1079: =RC[5] -> 205854 | C1079: 205850 | D1079: 205851 | E1079: 205852 | F1079: 205853 | G1079: 205854
A1080: 205860 | B1080: =RC[5] -> 205864 | C1080: 205860 | D1080: 205861 | E1080: 205862 | F1080: 205863 | G1080: 205864
A1081: 205870 | B1081: =RC[5] -> 205874 | C1081: 205870 | D1081: 205871 | E1081: 205872 | F1081: 205873 | G1081: 205874
A1082: 205880 | B1082: =RC[5] -> 205884 | C1082: 205880 | D1082: 205881 | E1082: 205882 | F1082: 205883 | G1082: 205884
A1083: 205890 | B1083: =RC[5] -> 205894 | C1083: 205890 | D1083: 205891 | E1083: 205892 | F1083: 205893 | G1083: 205894
A1084: 205900 | B1084: =RC[5] -> 205904 | C1084: 205900 | D1084: 205901 | E1084: 205902 | F1084: 205903 | G1084: 205904
A1085: 205910 | B1085: =RC[5] -> 205914 | C1085: 205910 | D1085: 205911 | E1085: 205912 | F1085: 205913 | G1085: 205914
A1086: 205920 | B1086: =RC[5] -> 205924 | C1086: 205920 | D1086: 205921 | E1086: 205922 | F1086: 205923 | G1086: 205924
A1087: 205930 | B1087: =RC[5] -> 205934 | C1087: 205930 | D1087: 205931 | E1087: 205932 | F1087: 205933 | G1087: 205934
A1088: 205940 | B1088: =RC[5] -> 205944 | C1088: 205940 | D1088: 205941 | E1088: 205942 | F1088: 205943 | G1088: 205944
A1089: 205950 | B1089: =RC[5] -> 205954 | C1089: 205950 | D1089: 205951 | E1089: 205952 | F1089: 205953 | G1089: 205954
A1090: 205960 | B1090: =RC[5] -> 205964 | C1090: 205960 | D1090: 205961 | E1090: 205962 | F1090: 205963 | G1090: 205964
A1091: 205970 | B1091: =RC[5] -> 205974 | C1091: 205970 | D1091: 205971 | E1091: 205972 | F1091: 205973 | G1091: 205974
A1092: 205980 | B1092: =RC[5] -> 205984 | C1092: 205980 | D1092: 205981 | E1092: 205982 | F1092: 205983 | G1092: 205984
A1093: 205990 | B1093: =RC[5] -> 205994 | C1093: 205990 | D1093: 205991 | E1093: 205992 | F1093: 205993 | G1093: 205994
A1094: 206000 | B1094: =RC[5] -> 206004 | C1094: 206000 | D1094: 206001 | E1094: 206002 | F1094: 206003 | G1094: 206004
A1095: 206010 | B1095: =RC[5] -> 206014 | C1095: 206010 | D1095: 206011 | E1095: 206012 | F1095: 206013 | G1095: 206014
A1096: 206020 | B1096: =RC[5] -> 206024 | C1096: 206020 | D1096: 206021 | E1096: 206022 | F1096: 206023 | G1096: 206024
A1097: 206030 | B1097: =RC[5] -> 206034 | C1097: 206030 | D1097: 206031 | E1097: 206032 | F1097: 206033 | G1097: 206034
A1098: 206040 | B1098: =RC[5] -> 206044 | C1098: 206040 | D1098: 206041 | E1098: 206042 | F1098: 206043 | G1098: 206044
A1099: 206050 | B1099: =RC[5] -> 206054 | C1099: 206050 | D1099: 206051 | E1099: 206052 | F1099: 206053 | G1099: 206054
A1100: 206060 | B1100: =RC[5] -> 206064 | C1100: 206060 | D1100: 206061 | E1100: 206062 | F1100: 206063 | G1100: 206064
A1101: 206070 | B1101: =RC[5] -> 206074 | C1101: 206070 | D1101: 206071 | E1101: 206072 | F1101: 206073 | G1101: 206074
A1102: 206080 | B1102: =RC[5] -> 206084 | C1102: 206080 | D1102: 206081 | E1102: 206082 | F1102: 206083 | G1102: 206084
A1103: 206090 | B1103: =RC[5] -> 206094 | C1103: 206090 | D1103: 206091 | E1103: 206092 | F1103: 206093 | G1103: 206094
A1104: 206100 | B1104: =RC[5] -> 206104 | C1104: 206100 | D1104: 206101 | E1104: 206102 | F1104: 206103 | G1104: 206104
A1105: 206110 | B1105: =RC[5] -> 206114 | C1105: 206110 | D1105: 206111 | E1105: 206112 | F1105: 206113 | G1105: 206114
A1106: 206120 | B1106: =RC[5] -> 206124 | C1106: 206120 | D1106: 206121 | E1106: 206122 | F1106: 206123 | G1106: 206124
A1107: 206130 | B1107: =RC[5] -> 206134 | C1107: 206130 | D1107: 206131 | E1107: 206132 | F1107: 206133 | G1107: 206134
A1108: 206140 | B1108: =RC[5] -> 206144 | C1108: 206140 | D1108: 206141 | E1108: 206142 | F1108: 206143 | G1108: 206144
A1109: 206150 | B1109: =RC[5] -> 206154 | C1109: 206150 | D1109: 206151 | E1109: 206152 | F1109: 206153 | G1109: 206154
A1110: 206160 | B1110: =RC[5] -> 206164 | C1110: 206160 | D1110: 206161 | E1110: 206162 | F1110: 206163 | G1110: 206164
A1111: 206170 | B1111: =RC[5] -> 206174 | C1111: 206170 | D1111: 206171 | E1111: 206172 | F1111: 206173 | G1111: 206174
A1112: 206180 | B1112: =RC[5] -> 206184 | C1112: 206180 | D1112: 206181 | E1112: 206182 | F1112: 206183 | G1112: 206184
A1113: 206190 | B1113: =RC[5] -> 206194 | C1113: 206190 | D1113: 206191 | E1113: 206192 | F1113: 206193 | G1113: 206194
A1114: 206200 | B1114: =RC[5] -> 206204 | C1114: 206200 | D1114: 206201 | E1114: 206202 | F1114: 206203 | G1114: 206204
A1115: 206210 | B1115: =RC[5] -> 206214 | C1115: 206210 | D1115: 206211 | E1115: 206212 | F1115: 206213 | G1115: 206214
A1116: 206220 | B1116: =RC[5] -> 206224 | C1116: 206220 | D1116: 206221 | E1116: 206222 | F1116: 206223 | G1116: 206224
A1117: 206230 | B1117: =RC[5] -> 206234 | C1117: 206230 | D1117: 206231 | E1117: 206232 | F1117: 206233 | G1117: 206234
A1118: 206240 | B1118: =RC[5] -> 206244 | C1118: 206240 | D1118: 206241 | E1118: 206242 | F1118: 206243 | G1118: 206244
A1119: 206250 | B1119: =RC[5] -> 206254 | C1119: 206250 | D1119: 206251 | E1119: 206252 | F1119: 206253 | G1119: 206254
A1120: 206260 | B1120: =RC[5] -> 206264 | C1120: 206260 | D1120: 206261 | E1120: 206262 | F1120: 206263 | G1120: 206264
A1121: 206270 | B1121: =RC[5] -> 206274 | C1121: 206270 | D1121: 206271 | E1121: 206272 | F1121: 206273 | G1121: 206274
A1122: 206280 | B1122: =RC[5] -> 206284 | C1122: 206280 | D1122: 206281 | E1122: 206282 | F1122: 206283 | G1122: 206284
A1123: 206290 | B1123: =RC[5] -> 206294 | C1123: 206290 | D1123: 206291 | E1123: 206292 | F1123: 206293 | G1123: 206294
A1124: 206300 | B1124: =RC[5] -> 206304 | C1124: 206300 | D1124: 206301 | E1124: 206302 | F1124: 206303 | G1124: 206304
A1125: 206310 | B1125: =RC[5] -> 206314 | C1125: 206310 | D1125: 206311 | E1125: 206312 | F1125: 206313 | G1125: 206314
A1126: 206320 | B1126: =RC[5] -> 206324 | C1126: 206320 | D1126: 206321 | E1126: 206322 | F1126: 206323 | G1126: 206324
A1127: 206330 | B1127: =RC[5] -> 206334 | C1127: 206330 | D1127: 206331 | E1127: 206332 | F1127: 206333 | G1127: 206334
A1128: 206340 | B1128: =RC[5] -> 206344 | C1128: 206340 | D1128: 206341 | E1128: 206342 | F1128: 206343 | G1128: 206344
A1129: 206350 | B1129: =RC[5] -> 206354 | C1129: 206350 | D1129: 206351 | E1129: 206352 | F1129: 206353 | G1129: 206354
A1130: 206360 | B1130: =RC[5] -> 206364 | C1130: 206360 | D1130: 206361 | E1130: 206362 | F1130: 206363 | G1130: 206364
A1131: 206370 | B1131: =RC[5] -> 206374 | C1131: 206370 | D1131: 206371 | E1131: 206372 | F1131: 206373 | G1131: 206374
A1132: 206380 | B1132: =RC[5] -> 206384 | C1132: 206380 | D1132: 206381 | E1132: 206382 | F1132: 206383 | G1132: 206384
A1133: 206390 | B1133: =RC[5] -> 206394 | C1133: 206390 | D1133: 206391 | E1133: 206392 | F1133: 206393 | G1133: 206394
A1134: 206400 | B1134: =RC[5] -> 206404 | C1134: 206400 | D1134: 206401 | E1134: 206402 | F1134: 206403 | G1134: 206404
A1135: 206410 | B1135: =RC[5] -> 206414 | C1135: 206410 | D1135: 206411 | E1135: 206412 | F1135: 206413 | G1135: 206414
A1136: 206420 | B1136: =RC[5] -> 206424 | C1136: 206420 | D1136: 206421 | E1136: 206422 | F1136: 206423 | G1136: 206424
A1137: 206430 | B1137: =RC[5] -> 206434 | C1137: 206430 | D1137: 206431 | E1137: 206432 | F1137: 206433 | G1137: 206434
A1138: 206440 | B1138: =RC[5] -> 206444 | C1138: 206440 | D1138: 206441 | E1138: 206442 | F1138: 206443 | G1138: 206444
A1139: 206450 | B1139: =RC[5] -> 206454 | C1139: 206450 | D1139: 206451 | E1139: 206452 | F1139: 206453 | G1139: 206454
A1140: 206460 | B1140: =RC[5] -> 206464 | C1140: 206460 | D1140: 206461 | E1140: 206462 | F1140: 206463 | G1140: 206464
A1141: 206470 | B1141: =RC[5] -> 206474 | C1141: 206470 | D1141: 206471 | E1141: 206472 | F1141: 206473 | G1141: 206474
A1142: 206480 | B1142: =RC[5] -> 206484 | C1142: 206480 | D1142: 206481 | E1142: 206482 | F1142: 206483 | G1142: 206484
A1143: 206490 | B1143: =RC[5] -> 206494 | C1143: 206490 | D1143: 206491 | E1143: 206492 | F1143: 206493 | G1143: 206494
A1144: 206500 | B1144: =RC[5] -> 206504 | C1144: 206500 | D1144: 206501 | E1144: 206502 | F1144: 206503 | G1144: 206504
A1145: 206510 | B1145: =RC[5] -> 206514 | C1145: 206510 | D1145: 206511 | E1145: 206512 | F1145: 206513 | G1145: 206514
A1146: 206520 | B1146: =RC[5] -> 206524 | C1146: 206520 | D1146: 206521 | E1146: 206522 | F1146: 206523 | G1146: 206524
A1147: 206530 | B1147: =RC[5] -> 206534 | C1147: 206530 | D1147: 206531 | E1147: 206532 | F1147: 206533 | G1147: 206534
A1148: 206540 | B1148: =RC[5] -> 206544 | C1148: 206540 | D1148: 206541 | E1148: 206542 | F1148: 206543 | G1148: 206544
A1149: 206550 | B1149: =RC[5] -> 206554 | C1149: 206550 | D1149: 206551 | E1149: 206552 | F1149: 206553 | G1149: 206554
A1150: 206560 | B1150: =RC[5] -> 206564 | C1150: 206560 | D1150: 206561 | E1150: 206562 | F1150: 206563 | G1150: 206564
A1151: 206570 | B1151: =RC[5] -> 206574 | C1151: 206570 | D1151: 206571 | E1151: 206572 | F1151: 206573 | G1151: 206574
A1152: 206580 | B1152: =RC[5] -> 206584 | C1152: 206580 | D1152: 206581 | E1152: 206582 | F1152: 206583 | G1152: 206584
A1153: 206590 | B1153: =RC[5] -> 206594 | C1153: 206590 | D1153: 206591 | E1153: 206592 | F1153: 206593 | G1153: 206594
A1154: 206600 | B1154: =RC[5] -> 206604 | C1154: 206600 | D1154: 206601 | E1154: 206602 | F1154: 206603 | G1154: 206604
A1155: 206610 | B1155: =RC[5] -> 206614 | C1155: 206610 | D1155: 206611 | E1155: 206612 | F1155: 206613 | G1155: 206614
A1156: 206620 | B1156: =RC[5] -> 206624 | C1156: 206620 | D1156: 206621 | E1156: 206622 | F1156: 206623 | G1156: 206624
A1157: 206630 | B1157: =RC[5] -> 206634 | C1157: 206630 | D1157: 206631 | E1157: 206632 | F1157: 206633 | G1157: 206634
A1158: 206640 | B1158: =RC[5] -> 206644 | C1158: 206640 | D1158: 206641 | E1158: 206642 | F1158: 206643 | G1158: 206644
A1159: 206650 | B1159: =RC[5] -> 206654 | C1159: 206650 | D1159: 206651 | E1159: 206652 | F1159: 206653 | G1159: 206654
A1160: 206660 | B1160: =RC[5] -> 206664 | C1160: 206660 | D1160: 206661 | E1160: 206662 | F1160: 206663 | G1160: 206664
A1161: 206670 | B1161: =RC[5] -> 206674 | C1161: 206670 | D1161: 206671 | E1161: 206672 | F1161: 206673 | G1161: 206674
A1162: 206680 | B1162: =RC[5] -> 206684 | C1162: 206680 | D1162: 206681 | E1162: 206682 | F1162: 206683 | G1162: 206684
A1163: 206690 | B1163: =RC[5] -> 206694 | C1163: 206690 | D1163: 206691 | E1163: 206692 | F1163: 206693 | G1163: 206694
A1164: 206700 | B1164: =RC[5] -> 206704 | C1164: 206700 | D1164: 206701 | E1164: 206702 | F1164: 206703 | G1164: 206704
A1165: 206710 | B1165: =RC[5] -> 206714 | C1165: 206710 | D1165: 206711 | E1165: 206712 | F1165: 206713 | G1165: 206714
A1166: 206720 | B1166: =RC[5] -> 206724 | C1166: 206720 | D1166: 206721 | E1166: 206722 | F1166: 206723 | G1166: 206724
A1167: 206730 | B1167: =RC[5] -> 206734 | C1167: 206730 | D1167: 206731 | E1167: 206732 | F1167: 206733 | G1167: 206734
A1168: 206740 | B1168: =RC[5] -> 206744 | C1168: 206740 | D1168: 206741 | E1168: 206742 | F1168: 206743 | G1168: 206744
A1169: 206750 | B1169: =RC[5] -> 206754 | C1169: 206750 | D1169: 206751 | E1169: 206752 | F1169: 206753 | G1169: 206754
A1170: 206760 | B1170: =RC[5] -> 206764 | C1170: 206760 | D1170: 206761 | E1170: 206762 | F1170: 206763 | G1170: 206764
A1171: 206770 | B1171: =RC[5] -> 206774 | C1171: 206770 | D1171: 206771 | E1171: 206772 | F1171: 206773 | G1171: 206774
A1172: 206780 | B1172: =RC[5] -> 206784 | C1172: 206780 | D1172: 206781 | E1172: 206782 | F1172: 206783 | G1172: 206784
A1173: 206790 | B1173: =RC[5] -> 206794 | C1173: 206790 | D1173: 206791 | E1173: 206792 | F1173: 206793 | G1173: 206794
A1174: 206800 | B1174: =RC[5] -> 206804 | C1174: 206800 | D1174: 206801 | E1174: 206802 | F1174: 206803 | G1174: 206804
A1175: 206810 | B1175: =RC[5] -> 206814 | C1175: 206810 | D1175: 206811 | E1175: 206812 | F1175: 206813 | G1175: 206814
A1176: 206820 | B1176: =RC[5] -> 206824 | C1176: 206820 | D1176: 206821 | E1176: 206822 | F1176: 206823 | G1176: 206824
A1177: 206830 | B1177: =RC[5] -> 206834 | C1177: 206830 | D1177: 206831 | E1177: 206832 | F1177: 206833 | G1177: 206834
A1178: 206840 | B1178: =RC[5] -> 206844 | C1178: 206840 | D1178: 206841 | E1178: 206842 | F1178: 206843 | G1178: 206844
A1179: 206850 | B1179: =RC[5] -> 206854 | C1179: 206850 | D1179: 206851 | E1179: 206852 | F1179: 206853 | G1179: 206854
A1180: 206860 | B1180: =RC[5] -> 206864 | C1180: 206860 | D1180: 206861 | E1180: 206862 | F1180: 206863 | G1180: 206864
A1181: 206870 | B1181: =RC[5] -> 206874 | C1181: 206870 | D1181: 206871 | E1181: 206872 | F1181: 206873 | G1181: 206874
A1182: 206880 | B1182: =RC[5] -> 206884 | C1182: 206880 | D1182: 206881 | E1182: 206882 | F1182: 206883 | G1182: 206884
A1183: 206890 | B1183: =RC[5] -> 206894 | C1183: 206890 | D1183: 206891 | E1183: 206892 | F1183: 206893 | G1183: 206894
A1184: 206900 | B1184: =RC[5] -> 206904 | C1184: 206900 | D1184: 206901 | E1184: 206902 | F1184: 206903 | G1184: 206904
A1185: 206910 | B1185: =RC[5] -> 206914 | C1185: 206910 | D1185: 206911 | E1185: 206912 | F1185: 206913 | G1185: 206914
A1186: 206920 | B1186: =RC[5] -> 206924 | C1186: 206920 | D1186: 206921 | E1186: 206922 | F1186: 206923 | G1186: 206924
A1187: 206930 | B1187: =RC[5] -> 206934 | C1187: 206930 | D1187: 206931 | E1187: 206932 | F1187: 206933 | G1187: 206934
A1188: 206940 | B1188: =RC[5] -> 206944 | C1188: 206940 | D1188: 206941 | E1188: 206942 | F1188: 206943 | G1188: 206944
A1189: 206950 | B1189: =RC[5] -> 206954 | C1189: 206950 | D1189: 206951 | E1189: 206952 | F1189: 206953 | G1189: 206954
A1190: 206960 | B1190: =RC[5] -> 206964 | C1190: 206960 | D1190: 206961 | E1190: 206962 | F1190: 206963 | G1190: 206964
A1191: 206970 | B1191: =RC[5] -> 206974 | C1191: 206970 | D1191: 206971 | E1191: 206972 | F1191: 206973 | G1191: 206974
A1192: 206980 | B1192: =RC[5] -> 206984 | C1192: 206980 | D1192: 206981 | E1192: 206982 | F1192: 206983 | G1192: 206984
A1193: 206990 | B1193: =RC[5] -> 206994 | C1193: 206990 | D1193: 206991 | E1193: 206992 | F1193: 206993 | G1193: 206994
A1194: 207000 | B1194: =RC[5] -> 207004 | C1194: 207000 | D1194: 207001 | E1194: 207002 | F1194: 207003 | G1194: 207004
A1195: 207010 | B1195: =RC[5] -> 207014 | C1195: 207010 | D1195: 207011 | E1195: 207012 | F1195: 207013 | G1195: 207014
A1196: 207020 | B1196: =RC[5] -> 207024 | C1196: 207020 | D1196: 207021 | E1196: 207022 | F1196: 207023 | G1196: 207024
A1197: 207030 | B1197: =RC[5] -> 207034 | C1197: 207030 | D1197: 207031 | E1197: 207032 | F1197: 207033 | G1197: 207034
A1198: 207040 | B1198: =RC[5] -> 207044 | C1198: 207040 | D1198: 207041 | E1198: 207042 | F1198: 207043 | G1198: 207044
A1199: 207050 | B1199: =RC[5] -> 207054 | C1199: 207050 | D1199: 207051 | E1199: 207052 | F1199: 207053 | G1199: 207054
A1200: 207060 | B1200: =RC[5] -> 207064 | C1200: 207060 | D1200: 207061 | E1200: 207062 | F1200: 207063 | G1200: 207064
A1201: 207070 | B1201: =RC[5] -> 207074 | C1201: 207070 | D1201: 207071 | E1201: 207072 | F1201: 207073 | G1201: 207074
A1202: 207080 | B1202: =RC[5] -> 207084 | C1202: 207080 | D1202: 207081 | E1202: 207082 | F1202: 207083 | G1202: 207084
A1203: 207090 | B1203: =RC[5] -> 207094 | C1203: 207090 | D1203: 207091 | E1203: 207092 | F1203: 207093 | G1203: 207094
A1204: 207100 | B1204: =RC[5] -> 207104 | C1204: 207100 | D1204: 207101 | E1204: 207102 | F1204: 207103 | G1204: 207104
A1205: 207110 | B1205: =RC[5] -> 207114 | C1205: 207110 | D1205: 207111 | E1205: 207112 | F1205: 207113 | G1205: 207114
A1206: 207120 | B1206: =RC[5] -> 207124 | C1206: 207120 | D1206: 207121 | E1206: 207122 | F1206: 207123 | G1206: 207124
A1207: 207130 | B1207: =RC[5] -> 207134 | C1207: 207130 | D1207: 207131 | E1207: 207132 | F1207: 207133 | G1207: 207134
A1208: 207140 | B1208: =RC[5] -> 207144 | C1208: 207140 | D1208: 207141 | E1208: 207142 | F1208: 207143 | G1208: 207144
A1209: 207150 | B1209: =RC[5] -> 207154 | C1209: 207150 | D1209: 207151 | E1209: 207152 | F1209: 207153 | G1209: 207154
A1210: 207160 | B1210: =RC[5] -> 207164 | C1210: 207160 | D1210: 207161 | E1210: 207162 | F1210: 207163 | G1210: 207164
A1211: 207170 | B1211: =RC[5] -> 207174 | C1211: 207170 | D1211: 207171 | E1211: 207172 | F1211: 207173 | G1211: 207174
A1212: 207180 | B1212: =RC[5] -> 207184 | C1212: 207180 | D1212: 207181 | E1212: 207182 | F1212: 207183 | G1212: 207184
A1213: 207190 | B1213: =RC[5] -> 207194 | C1213: 207190 | D1213: 207191 | E1213: 207192 | F1213: 207193 | G1213: 207194
A1214: 207200 | B1214: =RC[5] -> 207204 | C1214: 207200 | D1214: 207201 | E1214: 207202 | F1214: 207203 | G1214: 207204
A1215: 207210 | B1215: =RC[5] -> 207214 | C1215: 207210 | D1215: 207211 | E1215: 207212 | F1215: 207213 | G1215: 207214
A1216: 207220 | B1216: =RC[5] -> 207224 | C1216: 207220 | D1216: 207221 | E1216: 207222 | F1216: 207223 | G1216: 207224
A1217: 207230 | B1217: =RC[5] -> 207234 | C1217: 207230 | D1217: 207231 | E1217: 207232 | F1217: 207233 | G1217: 207234
A1218: 207240 | B1218: =RC[5] -> 207244 | C1218: 207240 | D1218: 207241 | E1218: 207242 | F1218: 207243 | G1218: 207244
A1219: 207250 | B1219: =RC[5] -> 207254 | C1219: 207250 | D1219: 207251 | E1219: 207252 | F1219: 207253 | G1219: 207254
A1220: 207260 | B1220: =RC[5] -> 207264 | C1220: 207260 | D1220: 207261 | E1220: 207262 | F1220: 207263 | G1220: 207264
A1221: 207270 | B1221: =RC[5] -> 207274 | C1221: 207270 | D1221: 207271 | E1221: 207272 | F1221: 207273 | G1221: 207274
A1222: 207280 | B1222: =RC[5] -> 207284 | C1222: 207280 | D1222: 207281 | E1222: 207282 | F1222: 207283 | G1222: 207284
A1223: 207290 | B1223: =RC[5] -> 207294 | C1223: 207290 | D1223: 207291 | E1223: 207292 | F1223: 207293 | G1223: 207294
A1224: 207300 | B1224: =RC[5] -> 207304 | C1224: 207300 | D1224: 207301 | E1224: 207302 | F1224: 207303 | G1224: 207304
A1225: 207310 | B1225: =RC[5] -> 207314 | C1225: 207310 | D1225: 207311 | E1225: 207312 | F1225: 207313 | G1225: 207314
A1226: 207320 | B1226: =RC[5] -> 207324 | C1226: 207320 | D1226: 207321 | E1226: 207322 | F1226: 207323 | G1226: 207324
A1227: 207330 | B1227: =RC[5] -> 207334 | C1227: 207330 | D1227: 207331 | E1227: 207332 | F1227: 207333 | G1227: 207334
A1228: 207340 | B1228: =RC[5] -> 207344 | C1228: 207340 | D1228: 207341 | E1228: 207342 | F1228: 207343 | G1228: 207344
A1229: 207350 | B1229: =RC[5] -> 207354 | C1229: 207350 | D1229: 207351 | E1229: 207352 | F1229: 207353 | G1229: 207354
A1230: 207360 | B1230: =RC[5] -> 207364 | C1230: 207360 | D1230: 207361 | E1230: 207362 | F1230: 207363 | G1230: 207364
A1231: 207370 | B1231: =RC[5] -> 207374 | C1231: 207370 | D1231: 207371 | E1231: 207372 | F1231: 207373 | G1231: 207374
A1232: 207380 | B1232: =RC[5] -> 207384 | C1232: 207380 | D1232: 207381 | E1232: 207382 | F1232: 207383 | G1232: 207384
A1233: 207390 | B1233: =RC[5] -> 207394 | C1233: 207390 | D1233: 207391 | E1233: 207392 | F1233: 207393 | G1233: 207394
A1234: 207400 | B1234: =RC[5] -> 207404 | C1234: 207400 | D1234: 207401 | E1234: 207402 | F1234: 207403 | G1234: 207404
A1235: 207410 | B1235: =RC[5] -> 207414 | C1235: 207410 | D1235: 207411 | E1235: 207412 | F1235: 207413 | G1235: 207414
A1236: 207420 | B1236: =RC[5] -> 207424 | C1236: 207420 | D1236: 207421 | E1236: 207422 | F1236: 207423 | G1236: 207424
A1237: 207430 | B1237: =RC[5] -> 207434 | C1237: 207430 | D1237: 207431 | E1237: 207432 | F1237: 207433 | G1237: 207434
A1238: 207440 | B1238: =RC[5] -> 207444 | C1238: 207440 | D1238: 207441 | E1238: 207442 | F1238: 207443 | G1238: 207444
A1239: 207450 | B1239: =RC[5] -> 207454 | C1239: 207450 | D1239: 207451 | E1239: 207452 | F1239: 207453 | G1239: 207454
A1240: 207460 | B1240: =RC[5] -> 207464 | C1240: 207460 | D1240: 207461 | E1240: 207462 | F1240: 207463 | G1240: 207464
A1241: 207470 | B1241: =RC[5] -> 207474 | C1241: 207470 | D1241: 207471 | E1241: 207472 | F1241: 207473 | G1241: 207474
A1242: 207480 | B1242: =RC[5] -> 207484 | C1242: 207480 | D1242: 207481 | E1242: 207482 | F1242: 207483 | G1242: 207484
A1243: 207490 | B1243: =RC[5] -> 207494 | C1243: 207490 | D1243: 207491 | E1243: 207492 | F1243: 207493 | G1243: 207494
A1244: 207500 | B1244: =RC[5] -> 207504 | C1244: 207500 | D1244: 207501 | E1244: 207502 | F1244: 207503 | G1244: 207504
A1245: 207510 | B1245: =RC[5] -> 207514 | C1245: 207510 | D1245: 207511 | E1245: 207512 | F1245: 207513 | G1245: 207514
A1246: 207520 | B1246: =RC[5] -> 207524 | C1246: 207520 | D1246: 207521 | E1246: 207522 | F1246: 207523 | G1246: 207524
A1247: 207530 | B1247: =RC[5] -> 207534 | C1247: 207530 | D1247: 207531 | E1247: 207532 | F1247: 207533 | G1247: 207534
A1248: 207540 | B1248: =RC[5] -> 207544 | C1248: 207540 | D1248: 207541 | E1248: 207542 | F1248: 207543 | G1248: 207544
A1249: 207550 | B1249: =RC[5] -> 207554 | C1249: 207550 | D1249: 207551 | E1249: 207552 | F1249: 207553 | G1249: 207554
A1250: 207560 | B1250: =RC[5] -> 207564 | C1250: 207560 | D1250: 207561 | E1250: 207562 | F1250: 207563 | G1250: 207564
A1251: 207570 | B1251: =RC[5] -> 207574 | C1251: 207570 | D1251: 207571 | E1251: 207572 | F1251: 207573 | G1251: 207574
A1252: 207580 | B1252: =RC[5] -> 207584 | C1252: 207580 | D1252: 207581 | E1252: 207582 | F1252: 207583 | G1252: 207584
A1253: 207590 | B1253: =RC[5] -> 207594 | C1253: 207590 | D1253: 207591 | E1253: 207592 | F1253: 207593 | G1253: 207594
A1254: 207600 | B1254: =RC[5] -> 207604 | C1254: 207600 | D1254: 207601 | E1254: 207602 | F1254: 207603 | G1254: 207604
A1255: 207610 | B1255: =RC[5] -> 207614 | C1255: 207610 | D1255: 207611 | E1255: 207612 | F1255: 207613 | G1255: 207614
A1256: 207620 | B1256: =RC[5] -> 207624 | C1256: 207620 | D1256: 207621 | E1256: 207622 | F1256: 207623 | G1256: 207624
A1257: 207630 | B1257: =RC[5] -> 207634 | C1257: 207630 | D1257: 207631 | E1257: 207632 | F1257: 207633 | G1257: 207634
A1258: 207640 | B1258: =RC[5] -> 207644 | C1258: 207640 | D1258: 207641 | E1258: 207642 | F1258: 207643 | G1258: 207644
A1259: 207650 | B1259: =RC[5] -> 207654 | C1259: 207650 | D1259: 207651 | E1259: 207652 | F1259: 207653 | G1259: 207654
A1260: 207660 | B1260: =RC[5] -> 207664 | C1260: 207660 | D1260: 207661 | E1260: 207662 | F1260: 207663 | G1260: 207664
A1261: 207670 | B1261: =RC[5] -> 207674 | C1261: 207670 | D1261: 207671 | E1261: 207672 | F1261: 207673 | G1261: 207674
A1262: 207680 | B1262: =RC[5] -> 207684 | C1262: 207680 | D1262: 207681 | E1262: 207682 | F1262: 207683 | G1262: 207684
A1263: 207690 | B1263: =RC[5] -> 207694 | C1263: 207690 | D1263: 207691 | E1263: 207692 | F1263: 207693 | G1263: 207694
A1264: 207700 | B1264: =RC[5] -> 207704 | C1264: 207700 | D1264: 207701 | E1264: 207702 | F1264: 207703 | G1264: 207704
A1265: 207710 | B1265: =RC[5] -> 207714 | C1265: 207710 | D1265: 207711 | E1265: 207712 | F1265: 207713 | G1265: 207714
A1266: 207720 | B1266: =RC[5] -> 207724 | C1266: 207720 | D1266: 207721 | E1266: 207722 | F1266: 207723 | G1266: 207724
A1267: 207730 | B1267: =RC[5] -> 207734 | C1267: 207730 | D1267: 207731 | E1267: 207732 | F1267: 207733 | G1267: 207734
A1268: 207740 | B1268: =RC[5] -> 207744 | C1268: 207740 | D1268: 207741 | E1268: 207742 | F1268: 207743 | G1268: 207744
A1269: 207750 | B1269: =RC[5] -> 207754 | C1269: 207750 | D1269: 207751 | E1269: 207752 | F1269: 207753 | G1269: 207754
A1270: 207760 | B1270: =RC[5] -> 207764 | C1270: 207760 | D1270: 207761 | E1270: 207762 | F1270: 207763 | G1270: 207764
A1271: 207770 | B1271: =RC[5] -> 207774 | C1271: 207770 | D1271: 207771 | E1271: 207772 | F1271: 207773 | G1271: 207774
A1272: 207780 | B1272: =RC[5] -> 207784 | C1272: 207780 | D1272: 207781 | E1272: 207782 | F1272: 207783 | G1272: 207784
A1273: 207790 | B1273: =RC[5] -> 207794 | C1273: 207790 | D1273: 207791 | E1273: 207792 | F1273: 207793 | G1273: 207794
A1274: 207800 | B1274: =RC[5] -> 207804 | C1274: 207800 | D1274: 207801 | E1274: 207802 | F1274: 207803 | G1274: 207804
A1275: 207810 | B1275: =RC[5] -> 207814 | C1275: 207810 | D1275: 207811 | E1275: 207812 | F1275: 207813 | G1275: 207814
A1276: 207820 | B1276: =RC[5] -> 207824 | C1276: 207820 | D1276: 207821 | E1276: 207822 | F1276: 207823 | G1276: 207824
A1277: 207830 | B1277: =RC[5] -> 207834 | C1277: 207830 | D1277: 207831 | E1277: 207832 | F1277: 207833 | G1277: 207834
A1278: 207840 | B1278: =RC[5] -> 207844 | C1278: 207840 | D1278: 207841 | E1278: 207842 | F1278: 207843 | G1278: 207844
A1279: 207850 | B1279: =RC[5] -> 207854 | C1279: 207850 | D1279: 207851 | E1279: 207852 | F1279: 207853 | G1279: 207854
A1280: 207860 | B1280: =RC[5] -> 207864 | C1280: 207860 | D1280: 207861 | E1280: 207862 | F1280: 207863 | G1280: 207864
A1281: 207870 | B1281: =RC[5] -> 207874 | C1281: 207870 | D1281: 207871 | E1281: 207872 | F1281: 207873 | G1281: 207874
A1282: 207880 | B1282: =RC[5] -> 207884 | C1282: 207880 | D1282: 207881 | E1282: 207882 | F1282: 207883 | G1282: 207884
A1283: 207890 | B1283: =RC[5] -> 207894 | C1283: 207890 | D1283: 207891 | E1283: 207892 | F1283: 207893 | G1283: 207894
A1284: 207900 | B1284: =RC[5] -> 207904 | C1284: 207900 | D1284: 207901 | E1284: 207902 | F1284: 207903 | G1284: 207904
A1285: 207910 | B1285: =RC[5] -> 207914 | C1285: 207910 | D1285: 207911 | E1285: 207912 | F1285: 207913 | G1285: 207914
A1286: 207920 | B1286: =RC[5] -> 207924 | C1286: 207920 | D1286: 207921 | E1286: 207922 | F1286: 207923 | G1286: 207924
A1287: 207930 | B1287: =RC[5] -> 207934 | C1287: 207930 | D1287: 207931 | E1287: 207932 | F1287: 207933 | G1287: 207934
A1288: 207940 | B1288: =RC[5] -> 207944 | C1288: 207940 | D1288: 207941 | E1288: 207942 | F1288: 207943 | G1288: 207944
A1289: 207950 | B1289: =RC[5] -> 207954 | C1289: 207950 | D1289: 207951 | E1289: 207952 | F1289: 207953 | G1289: 207954
A1290: 207960 | B1290: =RC[5] -> 207964 | C1290: 207960 | D1290: 207961 | E1290: 207962 | F1290: 207963 | G1290: 207964
A1291: 207970 | B1291: =RC[5] -> 207974 | C1291: 207970 | D1291: 207971 | E1291: 207972 | F1291: 207973 | G1291: 207974
A1292: 207980 | B1292: =RC[5] -> 207984 | C1292: 207980 | D1292: 207981 | E1292: 207982 | F1292: 207983 | G1292: 207984
A1293: 207990 | B1293: =RC[5] -> 207994 | C1293: 207990 | D1293: 207991 | E1293: 207992 | F1293: 207993 | G1293: 207994
A1294: 208000 | B1294: =RC[5] -> 208004 | C1294: 208000 | D1294: 208001 | E1294: 208002 | F1294: 208003 | G1294: 208004
A1295: 208010 | B1295: =RC[5] -> 208014 | C1295: 208010 | D1295: 208011 | E1295: 208012 | F1295: 208013 | G1295: 208014
A1296: 208020 | B1296: =RC[5] -> 208024 | C1296: 208020 | D1296: 208021 | E1296: 208022 | F1296: 208023 | G1296: 208024
A1297: 208030 | B1297: =RC[5] -> 208034 | C1297: 208030 | D1297: 208031 | E1297: 208032 | F1297: 208033 | G1297: 208034
A1298: 208040 | B1298: =RC[5] -> 208044 | C1298: 208040 | D1298: 208041 | E1298: 208042 | F1298: 208043 | G1298: 208044
A1299: 208050 | B1299: =RC[5] -> 208054 | C1299: 208050 | D1299: 208051 | E1299: 208052 | F1299: 208053 | G1299: 208054
A1300: 208060 | B1300: =RC[5] -> 208064 | C1300: 208060 | D1300: 208061 | E1300: 208062 | F1300: 208063 | G1300: 208064
A1301: 208070 | B1301: =RC[5] -> 208074 | C1301: 208070 | D1301: 208071 | E1301: 208072 | F1301: 208073 | G1301: 208074
A1302: 208080 | B1302: =RC[5] -> 208084 | C1302: 208080 | D1302: 208081 | E1302: 208082 | F1302: 208083 | G1302: 208084
A1303: 208090 | B1303: =RC[5] -> 208094 | C1303: 208090 | D1303: 208091 | E1303: 208092 | F1303: 208093 | G1303: 208094
A1304: 208100 | B1304: =RC[5] -> 208104 | C1304: 208100 | D1304: 208101 | E1304: 208102 | F1304: 208103 | G1304: 208104
A1305: 208110 | B1305: =RC[5] -> 208114 | C1305: 208110 | D1305: 208111 | E1305: 208112 | F1305: 208113 | G1305: 208114
A1306: 208120 | B1306: =RC[5] -> 208124 | C1306: 208120 | D1306: 208121 | E1306: 208122 | F1306: 208123 | G1306: 208124
A1307: 208130 | B1307: =RC[5] -> 208134 | C1307: 208130 | D1307: 208131 | E1307: 208132 | F1307: 208133 | G1307: 208134
A1308: 208140 | B1308: =RC[5] -> 208144 | C1308: 208140 | D1308: 208141 | E1308: 208142 | F1308: 208143 | G1308: 208144
A1309: 208150 | B1309: =RC[5] -> 208154 | C1309: 208150 | D1309: 208151 | E1309: 208152 | F1309: 208153 | G1309: 208154
A1310: 208160 | B1310: =RC[5] -> 208164 | C1310: 208160 | D1310: 208161 | E1310: 208162 | F1310: 208163 | G1310: 208164
A1311: 208170 | B1311: =RC[5] -> 208174 | C1311: 208170 | D1311: 208171 | E1311: 208172 | F1311: 208173 | G1311: 208174
A1312: 208180 | B1312: =RC[5] -> 208184 | C1312: 208180 | D1312: 208181 | E1312: 208182 | F1312: 208183 | G1312: 208184
A1313: 208190 | B1313: =RC[5] -> 208194 | C1313: 208190 | D1313: 208191 | E1313: 208192 | F1313: 208193 | G1313: 208194
A1314: 208200 | B1314: =RC[5] -> 208204 | C1314: 208200 | D1314: 208201 | E1314: 208202 | F1314: 208203 | G1314: 208204
A1315: 208210 | B1315: =RC[5] -> 208214 | C1315: 208210 | D1315: 208211 | E1315: 208212 | F1315: 208213 | G1315: 208214
A1316: 208220 | B1316: =RC[5] -> 208224 | C1316: 208220 | D1316: 208221 | E1316: 208222 | F1316: 208223 | G1316: 208224
A1317: 208230 | B1317: =RC[5] -> 208234 | C1317: 208230 | D1317: 208231 | E1317: 208232 | F1317: 208233 | G1317: 208234
A1318: 208240 | B1318: =RC[5] -> 208244 | C1318: 208240 | D1318: 208241 | E1318: 208242 | F1318: 208243 | G1318: 208244
A1319: 208250 | B1319: =RC[5] -> 208254 | C1319: 208250 | D1319: 208251 | E1319: 208252 | F1319: 208253 | G1319: 208254
A1320: 208260 | B1320: =RC[5] -> 208264 | C1320: 208260 | D1320: 208261 | E1320: 208262 | F1320: 208263 | G1320: 208264
A1321: 208270 | B1321: =RC[5] -> 208274 | C1321: 208270 | D1321: 208271 | E1321: 208272 | F1321: 208273 | G1321: 208274
A1322: 208280 | B1322: =RC[5] -> 208284 | C1322: 208280 | D1322: 208281 | E1322: 208282 | F1322: 208283 | G1322: 208284
A1323: 208290 | B1323: =RC[5] -> 208294 | C1323: 208290 | D1323: 208291 | E1323: 208292 | F1323: 208293 | G1323: 208294
A1324: 208300 | B1324: =RC[5] -> 208304 | C1324: 208300 | D1324: 208301 | E1324: 208302 | F1324: 208303 | G1324: 208304
A1325: 208310 | B1325: =RC[5] -> 208314 | C1325: 208310 | D1325: 208311 | E1325: 208312 | F1325: 208313 | G1325: 208314
A1326: 208320 | B1326: =RC[5] -> 208324 | C1326: 208320 | D1326: 208321 | E1326: 208322 | F1326: 208323 | G1326: 208324
A1327: 208330 | B1327: =RC[5] -> 208334 | C1327: 208330 | D1327: 208331 | E1327: 208332 | F1327: 208333 | G1327: 208334
A1328: 208340 | B1328: =RC[5] -> 208344 | C1328: 208340 | D1328: 208341 | E1328: 208342 | F1328: 208343 | G1328: 208344
A1329: 208350 | B1329: =RC[5] -> 208354 | C1329: 208350 | D1329: 208351 | E1329: 208352 | F1329: 208353 | G1329: 208354
A1330: 208360 | B1330: =RC[5] -> 208364 | C1330: 208360 | D1330: 208361 | E1330: 208362 | F1330: 208363 | G1330: 208364
A1331: 208370 | B1331: =RC[5] -> 208374 | C1331: 208370 | D1331: 208371 | E1331: 208372 | F1331: 208373 | G1331: 208374
A1332: 208380 | B1332: =RC[5] -> 208384 | C1332: 208380 | D1332: 208381 | E1332: 208382 | F1332: 208383 | G1332: 208384
A1333: 208390 | B1333: =RC[5] -> 208394 | C1333: 208390 | D1333: 208391 | E1333: 208392 | F1333: 208393 | G1333: 208394
A1334: 208400 | B1334: =RC[5] -> 208404 | C1334: 208400 | D1334: 208401 | E1334: 208402 | F1334: 208403 | G1334: 208404
A1335: 208410 | B1335: =RC[5] -> 208414 | C1335: 208410 | D1335: 208411 | E1335: 208412 | F1335: 208413 | G1335: 208414
A1336: 208420 | B1336: =RC[5] -> 208424 | C1336: 208420 | D1336: 208421 | E1336: 208422 | F1336: 208423 | G1336: 208424
A1337: 208430 | B1337: =RC[5] -> 208434 | C1337: 208430 | D1337: 208431 | E1337: 208432 | F1337: 208433 | G1337: 208434
A1338: 208440 | B1338: =RC[5] -> 208444 | C1338: 208440 | D1338: 208441 | E1338: 208442 | F1338: 208443 | G1338: 208444
A1339: 208450 | B1339: =RC[5] -> 208454 | C1339: 208450 | D1339: 208451 | E1339: 208452 | F1339: 208453 | G1339: 208454
A1340: 208460 | B1340: =RC[5] -> 208464 | C1340: 208460 | D1340: 208461 | E1340: 208462 | F1340: 208463 | G1340: 208464
A1341: 208470 | B1341: =RC[5] -> 208474 | C1341: 208470 | D1341: 208471 | E1341: 208472 | F1341: 208473 | G1341: 208474
A1342: 208480 | B1342: =RC[5] -> 208484 | C1342: 208480 | D1342: 208481 | E1342: 208482 | F1342: 208483 | G1342: 208484
A1343: 208490 | B1343: =RC[5] -> 208494 | C1343: 208490 | D1343: 208491 | E1343: 208492 | F1343: 208493 | G1343: 208494
A1344: 208500 | B1344: =RC[5] -> 208504 | C1344: 208500 | D1344: 208501 | E1344: 208502 | F1344: 208503 | G1344: 208504
A1345: 208510 | B1345: =RC[5] -> 208514 | C1345: 208510 | D1345: 208511 | E1345: 208512 | F1345: 208513 | G1345: 208514
A1346: 208520 | B1346: =RC[5] -> 208524 | C1346: 208520 | D1346: 208521 | E1346: 208522 | F1346: 208523 | G1346: 208524
A1347: 208530 | B1347: =RC[5] -> 208534 | C1347: 208530 | D1347: 208531 | E1347: 208532 | F1347: 208533 | G1347: 208534
A1348: 208540 | B1348: =RC[5] -> 208544 | C1348: 208540 | D1348: 208541 | E1348: 208542 | F1348: 208543 | G1348: 208544
A1349: 208550 | B1349: =RC[5] -> 208554 | C1349: 208550 | D1349: 208551 | E1349: 208552 | F1349: 208553 | G1349: 208554
A1350: 208560 | B1350: =RC[5] -> 208564 | C1350: 208560 | D1350: 208561 | E1350: 208562 | F1350: 208563 | G1350: 208564
A1351: 208570 | B1351: =RC[5] -> 208574 | C1351: 208570 | D1351: 208571 | E1351: 208572 | F1351: 208573 | G1351: 208574
A1352: 208580 | B1352: =RC[5] -> 208584 | C1352: 208580 | D1352: 208581 | E1352: 208582 | F1352: 208583 | G1352: 208584
A1353: 208590 | B1353: =RC[5] -> 208594 | C1353: 208590 | D1353: 208591 | E1353: 208592 | F1353: 208593 | G1353: 208594
A1354: 208600 | B1354: =RC[5] -> 208604 | C1354: 208600 | D1354: 208601 | E1354: 208602 | F1354: 208603 | G1354: 208604
A1355: 208610 | B1355: =RC[5] -> 208614 | C1355: 208610 | D1355: 208611 | E1355: 208612 | F1355: 208613 | G1355: 208614
A1356: 208620 | B1356: =RC[5] -> 208624 | C1356: 208620 | D1356: 208621 | E1356: 208622 | F1356: 208623 | G1356: 208624
A1357: 208630 | B1357: =RC[5] -> 208634 | C1357: 208630 | D1357: 208631 | E1357: 208632 | F1357: 208633 | G1357: 208634
A1358: 208640 | B1358: =RC[5] -> 208644 | C1358: 208640 | D1358: 208641 | E1358: 208642 | F1358: 208643 | G1358: 208644
A1359: 208650 | B1359: =RC[5] -> 208654 | C1359: 208650 | D1359: 208651 | E1359: 208652 | F1359: 208653 | G1359: 208654
A1360: 208660 | B1360: =RC[5] -> 208664 | C1360: 208660 | D1360: 208661 | E1360: 208662 | F1360: 208663 | G1360: 208664
A1361: 208670 | B1361: =RC[5] -> 208674 | C1361: 208670 | D1361: 208671 | E1361: 208672 | F1361: 208673 | G1361: 208674
A1362: 208680 | B1362: =RC[5] -> 208684 | C1362: 208680 | D1362: 208681 | E1362: 208682 | F1362: 208683 | G1362: 208684
A1363: 208690 | B1363: =RC[5] -> 208694 | C1363: 208690 | D1363: 208691 | E1363: 208692 | F1363: 208693 | G1363: 208694
A1364: 208700 | B1364: =RC[5] -> 208704 | C1364: 208700 | D1364: 208701 | E1364: 208702 | F1364: 208703 | G1364: 208704
A1365: 208710 | B1365: =RC[5] -> 208714 | C1365: 208710 | D1365: 208711 | E1365: 208712 | F1365: 208713 | G1365: 208714
A1366: 208720 | B1366: =RC[5] -> 208724 | C1366: 208720 | D1366: 208721 | E1366: 208722 | F1366: 208723 | G1366: 208724
A1367: 208730 | B1367: =RC[5] -> 208734 | C1367: 208730 | D1367: 208731 | E1367: 208732 | F1367: 208733 | G1367: 208734
A1368: 208740 | B1368: =RC[5] -> 208744 | C1368: 208740 | D1368: 208741 | E1368: 208742 | F1368: 208743 | G1368: 208744
A1369: 208750 | B1369: =RC[5] -> 208754 | C1369: 208750 | D1369: 208751 | E1369: 208752 | F1369: 208753 | G1369: 208754
A1370: 208760 | B1370: =RC[5] -> 208764 | C1370: 208760 | D1370: 208761 | E1370: 208762 | F1370: 208763 | G1370: 208764
A1371: 208770 | B1371: =RC[5] -> 208774 | C1371: 208770 | D1371: 208771 | E1371: 208772 | F1371: 208773 | G1371: 208774
A1372: 208780 | B1372: =RC[5] -> 208784 | C1372: 208780 | D1372: 208781 | E1372: 208782 | F1372: 208783 | G1372: 208784
A1373: 208790 | B1373: =RC[5] -> 208794 | C1373: 208790 | D1373: 208791 | E1373: 208792 | F1373: 208793 | G1373: 208794
A1374: 208800 | B1374: =RC[5] -> 208804 | C1374: 208800 | D1374: 208801 | E1374: 208802 | F1374: 208803 | G1374: 208804
A1375: 208810 | B1375: =RC[5] -> 208814 | C1375: 208810 | D1375: 208811 | E1375: 208812 | F1375: 208813 | G1375: 208814
A1376: 208820 | B1376: =RC[5] -> 208824 | C1376: 208820 | D1376: 208821 | E1376: 208822 | F1376: 208823 | G1376: 208824
A1377: 208830 | B1377: =RC[5] -> 208834 | C1377: 208830 | D1377: 208831 | E1377: 208832 | F1377: 208833 | G1377: 208834
A1378: 208840 | B1378: =RC[5] -> 208844 | C1378: 208840 | D1378: 208841 | E1378: 208842 | F1378: 208843 | G1378: 208844
A1379: 208850 | B1379: =RC[5] -> 208854 | C1379: 208850 | D1379: 208851 | E1379: 208852 | F1379: 208853 | G1379: 208854
A1380: 208860 | B1380: =RC[5] -> 208864 | C1380: 208860 | D1380: 208861 | E1380: 208862 | F1380: 208863 | G1380: 208864
A1381: 208870 | B1381: =RC[5] -> 208874 | C1381: 208870 | D1381: 208871 | E1381: 208872 | F1381: 208873 | G1381: 208874
A1382: 208880 | B1382: =RC[5] -> 208884 | C1382: 208880 | D1382: 208881 | E1382: 208882 | F1382: 208883 | G1382: 208884
A1383: 208890 | B1383: =RC[5] -> 208894 | C1383: 208890 | D1383: 208891 | E1383: 208892 | F1383: 208893 | G1383: 208894
A1384: 208900 | B1384: =RC[5] -> 208904 | C1384: 208900 | D1384: 208901 | E1384: 208902 | F1384: 208903 | G1384: 208904
A1385: 208910 | B1385: =RC[5] -> 208914 | C1385: 208910 | D1385: 208911 | E1385: 208912 | F1385: 208913 | G1385: 208914
A1386: 208920 | B1386: =RC[5] -> 208924 | C1386: 208920 | D1386: 208921 | E1386: 208922 | F1386: 208923 | G1386: 208924
A1387: 208930 | B1387: =RC[5] -> 208934 | C1387: 208930 | D1387: 208931 | E1387: 208932 | F1387: 208933 | G1387: 208934
A1388: 208940 | B1388: =RC[5] -> 208944 | C1388: 208940 | D1388: 208941 | E1388: 208942 | F1388: 208943 | G1388: 208944
A1389: 208950 | B1389: =RC[5] -> 208954 | C1389: 208950 | D1389: 208951 | E1389: 208952 | F1389: 208953 | G1389: 208954
A1390: 208960 | B1390: =RC[5] -> 208964 | C1390: 208960 | D1390: 208961 | E1390: 208962 | F1390: 208963 | G1390: 208964
A1391: 208970 | B1391: =RC[5] -> 208974 | C1391: 208970 | D1391: 208971 | E1391: 208972 | F1391: 208973 | G1391: 208974
A1392: 208980 | B1392: =RC[5] -> 208984 | C1392: 208980 | D1392: 208981 | E1392: 208982 | F1392: 208983 | G1392: 208984
A1393: 208990 | B1393: =RC[5] -> 208994 | C1393: 208990 | D1393: 208991 | E1393: 208992 | F1393: 208993 | G1393: 208994
A1394: 210010 | B1394: =RC[5] -> 210014 | C1394: 210010 | D1394: 210011 | E1394: 210012 | F1394: 210013 | G1394: 210014 | K1394: 3 | L1394: 爬塔精英战役
A1395: 210020 | B1395: =RC[5] -> 210024 | C1395: 210020 | D1395: 210021 | E1395: 210022 | F1395: 210023 | G1395: 210024 | K1395: 3
A1396: 210030 | B1396: =RC[5] -> 210034 | C1396: 210030 | D1396: 210031 | E1396: 210032 | F1396: 210033 | G1396: 210034 | K1396: 3
A1397: 210040 | B1397: =RC[5] -> 210044 | C1397: 210040 | D1397: 210041 | E1397: 210042 | F1397: 210043 | G1397: 210044 | K1397: 3
A1398: 210050 | B1398: =RC[5] -> 210054 | C1398: 210050 | D1398: 210051 | E1398: 210052 | F1398: 210053 | G1398: 210054 | K1398: 3
A1399: 210060 | B1399: =RC[5] -> 210064 | C1399: 210060 | D1399: 210061 | E1399: 210062 | F1399: 210063 | G1399: 210064 | K1399: 3
A1400: 210070 | B1400: =RC[5] -> 210074 | C1400: 210070 | D1400: 210071 | E1400: 210072 | F1400: 210073 | G1400: 210074 | K1400: 3
A1401: 210080 | B1401: =RC[5] -> 210084 | C1401: 210080 | D1401: 210081 | E1401: 210082 | F1401: 210083 | G1401: 210084 | K1401: 3
A1402: 210090 | B1402: =RC[5] -> 210094 | C1402: 210090 | D1402: 210091 | E1402: 210092 | F1402: 210093 | G1402: 210094 | K1402: 3
A1403: 210100 | B1403: =RC[5] -> 210104 | C1403: 210100 | D1403: 210101 | E1403: 210102 | F1403: 210103 | G1403: 210104 | K1403: 3
A1404: 210110 | B1404: =RC[5] -> 210114 | C1404: 210110 | D1404: 210111 | E1404: 210112 | F1404: 210113 | G1404: 210114 | K1404: 3
A1405: 210120 | B1405: =RC[5] -> 210124 | C1405: 210120 | D1405: 210121 | E1405: 210122 | F1405: 210123 | G1405: 210124 | K1405: 3
A1406: 210130 | B1406: =RC[5] -> 210134 | C1406: 210130 | D1406: 210131 | E1406: 210132 | F1406: 210133 | G1406: 210134 | K1406: 3
A1407: 210140 | B1407: =RC[5] -> 210144 | C1407: 210140 | D1407: 210141 | E1407: 210142 | F1407: 210143 | G1407: 210144 | K1407: 3
A1408: 210150 | B1408: =RC[5] -> 210154 | C1408: 210150 | D1408: 210151 | E1408: 210152 | F1408: 210153 | G1408: 210154 | K1408: 3
A1409: 210160 | B1409: =RC[5] -> 210164 | C1409: 210160 | D1409: 210161 | E1409: 210162 | F1409: 210163 | G1409: 210164 | K1409: 3
A1410: 210170 | B1410: =RC[5] -> 210174 | C1410: 210170 | D1410: 210171 | E1410: 210172 | F1410: 210173 | G1410: 210174 | K1410: 3
A1411: 210180 | B1411: =RC[5] -> 210184 | C1411: 210180 | D1411: 210181 | E1411: 210182 | F1411: 210183 | G1411: 210184 | K1411: 3
A1412: 210190 | B1412: =RC[5] -> 210194 | C1412: 210190 | D1412: 210191 | E1412: 210192 | F1412: 210193 | G1412: 210194 | K1412: 3
A1413: 210200 | B1413: =RC[5] -> 210204 | C1413: 210200 | D1413: 210201 | E1413: 210202 | F1413: 210203 | G1413: 210204 | K1413: 3
A1414: 210210 | B1414: =RC[5] -> 210214 | C1414: 210210 | D1414: 210211 | E1414: 210212 | F1414: 210213 | G1414: 210214 | K1414: 3
A1415: 210220 | B1415: =RC[5] -> 210224 | C1415: 210220 | D1415: 210221 | E1415: 210222 | F1415: 210223 | G1415: 210224 | K1415: 3
A1416: 210230 | B1416: =RC[5] -> 210234 | C1416: 210230 | D1416: 210231 | E1416: 210232 | F1416: 210233 | G1416: 210234 | K1416: 3
A1417: 210240 | B1417: =RC[5] -> 210244 | C1417: 210240 | D1417: 210241 | E1417: 210242 | F1417: 210243 | G1417: 210244 | K1417: 3
A1418: 210250 | B1418: =RC[5] -> 210254 | C1418: 210250 | D1418: 210251 | E1418: 210252 | F1418: 210253 | G1418: 210254 | K1418: 3
A1419: 210260 | B1419: =RC[5] -> 210264 | C1419: 210260 | D1419: 210261 | E1419: 210262 | F1419: 210263 | G1419: 210264 | K1419: 3
A1420: 210270 | B1420: =RC[5] -> 210274 | C1420: 210270 | D1420: 210271 | E1420: 210272 | F1420: 210273 | G1420: 210274 | K1420: 3
A1421: 210280 | B1421: =RC[5] -> 210284 | C1421: 210280 | D1421: 210281 | E1421: 210282 | F1421: 210283 | G1421: 210284 | K1421: 3
A1422: 210290 | B1422: =RC[5] -> 210294 | C1422: 210290 | D1422: 210291 | E1422: 210292 | F1422: 210293 | G1422: 210294 | K1422: 3
A1423: 210300 | B1423: =RC[5] -> 210304 | C1423: 210300 | D1423: 210301 | E1423: 210302 | F1423: 210303 | G1423: 210304 | K1423: 3
A1424: 210310 | B1424: =RC[5] -> 210314 | C1424: 210310 | D1424: 210311 | E1424: 210312 | F1424: 210313 | G1424: 210314 | K1424: 3
A1425: 210320 | B1425: =RC[5] -> 210324 | C1425: 210320 | D1425: 210321 | E1425: 210322 | F1425: 210323 | G1425: 210324 | K1425: 3
A1426: 210330 | B1426: =RC[5] -> 210334 | C1426: 210330 | D1426: 210331 | E1426: 210332 | F1426: 210333 | G1426: 210334 | K1426: 3
A1427: 210340 | B1427: =RC[5] -> 210344 | C1427: 210340 | D1427: 210341 | E1427: 210342 | F1427: 210343 | G1427: 210344 | K1427: 3
A1428: 210350 | B1428: =RC[5] -> 210354 | C1428: 210350 | D1428: 210351 | E1428: 210352 | F1428: 210353 | G1428: 210354 | K1428: 3
A1429: 210360 | B1429: =RC[5] -> 210364 | C1429: 210360 | D1429: 210361 | E1429: 210362 | F1429: 210363 | G1429: 210364 | K1429: 3
A1430: 210370 | B1430: =RC[5] -> 210374 | C1430: 210370 | D1430: 210371 | E1430: 210372 | F1430: 210373 | G1430: 210374 | K1430: 3
A1431: 210380 | B1431: =RC[5] -> 210384 | C1431: 210380 | D1431: 210381 | E1431: 210382 | F1431: 210383 | G1431: 210384 | K1431: 3
A1432: 210390 | B1432: =RC[5] -> 210394 | C1432: 210390 | D1432: 210391 | E1432: 210392 | F1432: 210393 | G1432: 210394 | K1432: 3
A1433: 210400 | B1433: =RC[5] -> 210404 | C1433: 210400 | D1433: 210401 | E1433: 210402 | F1433: 210403 | G1433: 210404 | K1433: 3
A1434: 210410 | B1434: =RC[5] -> 210414 | C1434: 210410 | D1434: 210411 | E1434: 210412 | F1434: 210413 | G1434: 210414 | K1434: 3
A1435: 210420 | B1435: =RC[5] -> 210424 | C1435: 210420 | D1435: 210421 | E1435: 210422 | F1435: 210423 | G1435: 210424 | K1435: 3
A1436: 210430 | B1436: =RC[5] -> 210434 | C1436: 210430 | D1436: 210431 | E1436: 210432 | F1436: 210433 | G1436: 210434 | K1436: 3
A1437: 210440 | B1437: =RC[5] -> 210444 | C1437: 210440 | D1437: 210441 | E1437: 210442 | F1437: 210443 | G1437: 210444 | K1437: 3
A1438: 210450 | B1438: =RC[5] -> 210454 | C1438: 210450 | D1438: 210451 | E1438: 210452 | F1438: 210453 | G1438: 210454 | K1438: 3
A1439: 210460 | B1439: =RC[5] -> 210464 | C1439: 210460 | D1439: 210461 | E1439: 210462 | F1439: 210463 | G1439: 210464 | K1439: 3
A1440: 210470 | B1440: =RC[5] -> 210474 | C1440: 210470 | D1440: 210471 | E1440: 210472 | F1440: 210473 | G1440: 210474 | K1440: 3
A1441: 210480 | B1441: =RC[5] -> 210484 | C1441: 210480 | D1441: 210481 | E1441: 210482 | F1441: 210483 | G1441: 210484 | K1441: 3
A1442: 210490 | B1442: =RC[5] -> 210494 | C1442: 210490 | D1442: 210491 | E1442: 210492 | F1442: 210493 | G1442: 210494 | K1442: 3
A1443: 210500 | B1443: =RC[5] -> 210504 | C1443: 210500 | D1443: 210501 | E1443: 210502 | F1443: 210503 | G1443: 210504 | K1443: 3
A1444: 30000 | B1444: =RC[1] -> 303010 | C1444: =HLOOKUP(Sheet1!R2C1,Sheet1!R2C1:R49C1,INT(MOD(RC1,1000)/62)*16+RC[10],FALSE) -> 303010 | D1444: =HLOOKUP(Sheet1!R2C1,Sheet1!R2C1:R49C1,INT(MOD(RC1,1000)/62)*16+RC[10],FALSE) -> 303020 | E1444: =HLOOKUP(Sheet1!R2C1,Sheet1!R2C1:R49C1,INT(MOD(RC1,1000)/62)*16+RC[10],FALSE) -> 304300 | F1444: =HLOOKUP(Sheet1!R2C1,Sheet1!R2C1:R49C1,INT(MOD(RC1,1000)/62)*16+RC[10],FALSE) -> 304000 | G1444: =HLOOKUP(Sheet1!R2C1,Sheet1!R2C1:R49C1,INT(MOD(RC1,1000)/62)*16+RC[10],FALSE) -> 304310 | K1444: 1 | L1444: 机器人 | M1444: 1 | N1444: 2 | O1444: 3 | P1444: 4 | Q1444: 5
A1445: 30001 | B1445: =RC[1] -> 303020 | C1445: =HLOOKUP(Sheet1!R2C1,Sheet1!R2C1:R49C1,INT(MOD(RC1,1000)/62)*16+RC[10],FALSE) -> 303020 | D1445: =HLOOKUP(Sheet1!R2C1,Sheet1!R2C1:R49C1,INT(MOD(RC1,1000)/62)*16+RC[10],FALSE) -> 304300 | E1445: =HLOOKUP(Sheet1!R2C1,Sheet1!R2C1:R49C1,INT(MOD(RC1,1000)/62)*16+RC[10],FALSE) -> 304000 | F1445: =HLOOKUP(Sheet1!R2C1,Sheet1!R2C1:R49C1,INT(MOD(RC1,1000)/62)*16+RC[10],FALSE) -> 304310 | G1445: =HLOOKUP(Sheet1!R2C1,Sheet1!R2C1:R49C1,INT(MOD(RC1,1000)/62)*16+RC[10],FALSE) -> 304100 | K1445: 1 | M1445: 2 | N1445: 3 | O1445: 4 | P1445: 5 | Q1445: 6
A1446: 30002 | B1446: =RC[1] -> 304300 | C1446: =HLOOKUP(Sheet1!R2C1,Sheet1!R2C1:R49C1,INT(MOD(RC1,1000)/62)*16+RC[10],FALSE) -> 304300 | D1446: =HLOOKUP(Sheet1!R2C1,Sheet1!R2C1:R49C1,INT(MOD(RC1,1000)/62)*16+RC[10],FALSE) -> 304000 | E1446: =HLOOKUP(Sheet1!R2C1,Sheet1!R2C1:R49C1,INT(MOD(RC1,1000)/62)*16+RC[10],FALSE) -> 304310 | F1446: =HLOOKUP(Sheet1!R2C1,Sheet1!R2C1:R49C1,INT(MOD(RC1,1000)/62)*16+RC[10],FALSE) -> 304100 | G1446: =HLOOKUP(Sheet1!R2C1,Sheet1!R2C1:R49C1,INT(MOD(RC1,1000)/62)*16+RC[10],FALSE) -> 303010 | K1446: 1 | M1446: 3 | N1446: 4 | O1446: 5 | P1446: 6 | Q1446: 1
A1447: 30003 | B1447: =RC[1] -> 304000 | C1447: =HLOOKUP(Sheet1!R2C1,Sheet1!R2C1:R49C1,INT(MOD(RC1,1000)/62)*16+RC[10],FALSE) -> 304000 | D1447: =HLOOKUP(Sheet1!R2C1,Sheet1!R2C1:R49C1,INT(MOD(RC1,1000)/62)*16+RC[10],FALSE) -> 304310 | E1447: =HLOOKUP(Sheet1!R2C1,Sheet1!R2C1:R49C1,INT(MOD(RC1,1000)/62)*16+RC[10],FALSE) -> 304100 | F1447: =HLOOKUP(Sheet1!R2C1,Sheet1!R2C1:R49C1,INT(MOD(RC1,1000)/62)*16+RC[10],FALSE) -> 303010 | G1447: =HLOOKUP(Sheet1!R2C1,Sheet1!R2C1:R49C1,INT(MOD(RC1,1000)/62)*16+RC[10],FALSE) -> 303020 | K1447: 1 | M1447: 4 | N1447: 5 | O1447: 6 | P1447: 1 | Q1447: 2
A1448: 30004 | B1448: =RC[1] -> 304310 | C1448: =HLOOKUP(Sheet1!R2C1,Sheet1!R2C1:R49C1,INT(MOD(RC1,1000)/62)*16+RC[10],FALSE) -> 304310 | D1448: =HLOOKUP(Sheet1!R2C1,Sheet1!R2C1:R49C1,INT(MOD(RC1,1000)/62)*16+RC[10],FALSE) -> 304100 | E1448: =HLOOKUP(Sheet1!R2C1,Sheet1!R2C1:R49C1,INT(MOD(RC1,1000)/62)*16+RC[10],FALSE) -> 303010 | F1448: =HLOOKUP(Sheet1!R2C1,Sheet1!R2C1:R49C1,INT(MOD(RC1,1000)/62)*16+RC[10],FALSE) -> 303020 | G1448: =HLOOKUP(Sheet1!R2C1,Sheet1!R2C1:R49C1,INT(MOD(RC1,1000)/62)*16+RC[10],FALSE) -> 304300 | K1448: 1 | M1448: 5 | N1448: 6 | O1448: 1 | P1448: 2 | Q1448: 3
A1449: 30005 | B1449: =RC[1] -> 304100 | C1449: =HLOOKUP(Sheet1!R2C1,Sheet1!R2C1:R49C1,INT(MOD(RC1,1000)/62)*16+RC[10],FALSE) -> 304100 | D1449: =HLOOKUP(Sheet1!R2C1,Sheet1!R2C1:R49C1,INT(MOD(RC1,1000)/62)*16+RC[10],FALSE) -> 303010 | E1449: =HLOOKUP(Sheet1!R2C1,Sheet1!R2C1:R49C1,INT(MOD(RC1,1000)/62)*16+RC[10],FALSE) -> 303020 | F1449: =HLOOKUP(Sheet1!R2C1,Sheet1!R2C1:R49C1,INT(MOD(RC1,1000)/62)*16+RC[10],FALSE) -> 304300 | G1449: =HLOOKUP(Sheet1!R2C1,Sheet1!R2C1:R49C1,INT(MOD(RC1,1000)/62)*16+RC[10],FALSE) -> 304000 | K1449: 1 | M1449: 6 | N1449: 1 | O1449: 2 | P1449: 3 | Q1449: 4
A1450: 30006 | B1450: =RC[1] -> 304010 | C1450: =HLOOKUP(Sheet1!R2C1,Sheet1!R2C1:R49C1,INT(MOD(RC1,1000)/62)*16+RC[10],FALSE) -> 304010 | D1450: =HLOOKUP(Sheet1!R2C1,Sheet1!R2C1:R49C1,INT(MOD(RC1,1000)/62)*16+RC[10],FALSE) -> 304200 | E1450: =HLOOKUP(Sheet1!R2C1,Sheet1!R2C1:R49C1,INT(MOD(RC1,1000)/62)*16+RC[10],FALSE) -> 304020 | F1450: =HLOOKUP(Sheet1!R2C1,Sheet1!R2C1:R49C1,INT(MOD(RC1,1000)/62)*16+RC[10],FALSE) -> 304030 | G1450: =HLOOKUP(Sheet1!R2C1,Sheet1!R2C1:R49C1,INT(MOD(RC1,1000)/62)*16+RC[10],FALSE) -> 304280 | K1450: 1 | M1450: 7 | N1450: 8 | O1450: 9 | P1450: 10 | Q1450: 11
A1451: 30007 | B1451: =RC[1] -> 304010 | C1451: =HLOOKUP(Sheet1!R2C1,Sheet1!R2C1:R49C1,INT(MOD(RC1,1000)/62)*16+RC[10],FALSE) -> 304010 | D1451: =HLOOKUP(Sheet1!R2C1,Sheet1!R2C1:R49C1,INT(MOD(RC1,1000)/62)*16+RC[10],FALSE) -> 304200 | E1451: =HLOOKUP(Sheet1!R2C1,Sheet1!R2C1:R49C1,INT(MOD(RC1,1000)/62)*16+RC[10],FALSE) -> 304020 | F1451: =HLOOKUP(Sheet1!R2C1,Sheet1!R2C1:R49C1,INT(MOD(RC1,1000)/62)*16+RC[10],FALSE) -> 304030 | G1451: =HLOOKUP(Sheet1!R2C1,Sheet1!R2C1:R49C1,INT(MOD(RC1,1000)/62)*16+RC[10],FALSE) -> 304110 | K1451: 1 | M1451: 7 | N1451: 8 | O1451: 9 | P1451: 10 | Q1451: 12
A1452: 30008 | B1452: =RC[1] -> 304010 | C1452: =HLOOKUP(Sheet1!R2C1,Sheet1!R2C1:R49C1,INT(MOD(RC1,1000)/62)*16+RC[10],FALSE) -> 304010 | D1452: =HLOOKUP(Sheet1!R2C1,Sheet1!R2C1:R49C1,INT(MOD(RC1,1000)/62)*16+RC[10],FALSE) -> 304200 | E1452: =HLOOKUP(Sheet1!R2C1,Sheet1!R2C1:R49C1,INT(MOD(RC1,1000)/62)*16+RC[10],FALSE) -> 304020 | F1452: =HLOOKUP(Sheet1!R2C1,Sheet1!R2C1:R49C1,INT(MOD(RC1,1000)/62)*16+RC[10],FALSE) -> 304030 | G1452: =HLOOKUP(Sheet1!R2C1,Sheet1!R2C1:R49C1,INT(MOD(RC1,1000)/62)*16+RC[10],FALSE) -> 304380 | K1452: 1 | M1452: 7 | N1452: 8 | O1452: 9 | P1452: 10 | Q1452: 13
A1453: 30009 | B1453: =RC[1] -> 304010 | C1453: =HLOOKUP(Sheet1!R2C1,Sheet1!R2C1:R49C1,INT(MOD(RC1,1000)/62)*16+RC[10],FALSE) -> 304010 | D1453: =HLOOKUP(Sheet1!R2C1,Sheet1!R2C1:R49C1,INT(MOD(RC1,1000)/62)*16+RC[10],FALSE) -> 304200 | E1453: =HLOOKUP(Sheet1!R2C1,Sheet1!R2C1:R49C1,INT(MOD(RC1,1000)/62)*16+RC[10],FALSE) -> 304020 | F1453: =HLOOKUP(Sheet1!R2C1,Sheet1!R2C1:R49C1,INT(MOD(RC1,1000)/62)*16+RC[10],FALSE) -> 304030 | G1453: =HLOOKUP(Sheet1!R2C1,Sheet1!R2C1:R49C1,INT(MOD(RC1,1000)/62)*16+RC[10],FALSE) -> 304400 | K1453: 1 | M1453: 7 | N1453: 8 | O1453: 9 | P1453: 10 | Q1453: 14
A1454: 30010 | B1454: =RC[1] -> 304010 | C1454: =HLOOKUP(Sheet1!R2C1,Sheet1!R2C1:R49C1,INT(MOD(RC1,1000)/62)*16+RC[10],FALSE) -> 304010 | D1454: =HLOOKUP(Sheet1!R2C1,Sheet1!R2C1:R49C1,INT(MOD(RC1,1000)/62)*16+RC[10],FALSE) -> 304200 | E1454: =HLOOKUP(Sheet1!R2C1,Sheet1!R2C1:R49C1,INT(MOD(RC1,1000)/62)*16+RC[10],FALSE) -> 304020 | F1454: =HLOOKUP(Sheet1!R2C1,Sheet1!R2C1:R49C1,INT(MOD(RC1,1000)/62)*16+RC[10],FALSE) -> 304280 | G1454: =HLOOKUP(Sheet1!R2C1,Sheet1!R2C1:R49C1,INT(MOD(RC1,1000)/62)*16+RC[10],FALSE) -> 304110 | K1454: 1 | M1454: 7 | N1454: 8 | O1454: 9 | P1454: 11 | Q1454: 12
A1455: 30011 | B1455: =RC[1] -> 304010 | C1455: =HLOOKUP(Sheet1!R2C1,Sheet1!R2C1:R49C1,INT(MOD(RC1,1000)/62)*16+RC[10],FALSE) -> 304010 | D1455: =HLOOKUP(Sheet1!R2C1,Sheet1!R2C1:R49C1,INT(MOD(RC1,1000)/62)*16+RC[10],FALSE) -> 304200 | E1455: =HLOOKUP(Sheet1!R2C1,Sheet1!R2C1:R49C1,INT(MOD(RC1,1000)/62)*16+RC[10],FALSE) -> 304020 | F1455: =HLOOKUP(Sheet1!R2C1,Sheet1!R2C1:R49C1,INT(MOD(RC1,1000)/62)*16+RC[10],FALSE) -> 304280 | G1455: =HLOOKUP(Sheet1!R2C1,Sheet1!R2C1:R49C1,INT(MOD(RC1,1000)/62)*16+RC[10],FALSE) -> 304380 | K1455: 1 | M1455: 7 | N1455: 8 | O1455: 9 | P1455: 11 | Q1455: 13
A1456: 30012 | B1456: =RC[1] -> 304010 | C1456: =HLOOKUP(Sheet1!R2C1,Sheet1!R2C1:R49C1,INT(MOD(RC1,1000)/62)*16+RC[10],FALSE) -> 304010 | D1456: =HLOOKUP(Sheet1!R2C1,Sheet1!R2C1:R49C1,INT(MOD(RC1,1000)/62)*16+RC[10],FALSE) -> 304200 | E1456: =HLOOKUP(Sheet1!R2C1,Sheet1!R2C1:R49C1,INT(MOD(RC1,1000)/62)*16+RC[10],FALSE) -> 304020 | F1456: =HLOOKUP(Sheet1!R2C1,Sheet1!R2C1:R49C1,INT(MOD(RC1,1000)/62)*16+RC[10],FALSE) -> 304280 | G1456: =HLOOKUP(Sheet1!R2C1,Sheet1!R2C1:R49C1,INT(MOD(RC1,1000)/62)*16+RC[10],FALSE) -> 304400 | K1456: 1 | M1456: 7 | N1456: 8 | O1456: 9 | P1456: 11 | Q1456: 14
A1457: 30013 | B1457: =RC[1] -> 304010 | C1457: =HLOOKUP(Sheet1!R2C1,Sheet1!R2C1:R49C1,INT(MOD(RC1,1000)/62)*16+RC[10],FALSE) -> 304010 | D1457: =HLOOKUP(Sheet1!R2C1,Sheet1!R2C1:R49C1,INT(MOD(RC1,1000)/62)*16+RC[10],FALSE) -> 304200 | E1457: =HLOOKUP(Sheet1!R2C1,Sheet1!R2C1:R49C1,INT(MOD(RC1,1000)/62)*16+RC[10],FALSE) -> 304020 | F1457: =HLOOKUP(Sheet1!R2C1,Sheet1!R2C1:R49C1,INT(MOD(RC1,1000)/62)*16+RC[10],FALSE) -> 304110 | G1457: =HLOOKUP(Sheet1!R2C1,Sheet1!R2C1:R49C1,INT(MOD(RC1,1000)/62)*16+RC[10],FALSE) -> 304380 | K1457: 1 | M1457: 7 | N1457: 8 | O1457: 9 | P1457: 12 | Q1457: 13
A1458: 30014 | B1458: =RC[1] -> 304010 | C1458: =HLOOKUP(Sheet1!R2C1,Sheet1!R2C1:R49C1,INT(MOD(RC1,1000)/62)*16+RC[10],FALSE) -> 304010 | D1458: =HLOOKUP(Sheet1!R2C1,Sheet1!R2C1:R49C1,INT(MOD(RC1,1000)/62)*16+RC[10],FALSE) -> 304200 | E1458: =HLOOKUP(Sheet1!R2C1,Sheet1!R2C1:R49C1,INT(MOD(RC1,1000)/62)*16+RC[10],FALSE) -> 304020 | F1458: =HLOOKUP(Sheet1!R2C1,Sheet1!R2C1:R49C1,INT(MOD(RC1,1000)/62)*16+RC[10],FALSE) -> 304110 | G1458: =HLOOKUP(Sheet1!R2C1,Sheet1!R2C1:R49C1,INT(MOD(RC1,1000)/62)*16+RC[10],FALSE) -> 304400 | K1458: 1 | M1458: 7 | N1458: 8 | O1458: 9 | P1458: 12 | Q1458: 14
A1459: 30015 | B1459: =RC[1] -> 304010 | C1459: =HLOOKUP(Sheet1!R2C1,Sheet1!R2C1:R49C1,INT(MOD(RC1,1000)/62)*16+RC[10],FALSE) -> 304010 | D1459: =HLOOKUP(Sheet1!R2C1,Sheet1!R2C1:R49C1,INT(MOD(RC1,1000)/62)*16+RC[10],FALSE) -> 304200 | E1459: =HLOOKUP(Sheet1!R2C1,Sheet1!R2C1:R49C1,INT(MOD(RC1,1000)/62)*16+RC[10],FALSE) -> 304020 | F1459: =HLOOKUP(Sheet1!R2C1,Sheet1!R2C1:R49C1,INT(MOD(RC1,1000)/62)*16+RC[10],FALSE) -> 304380 | G1459: =HLOOKUP(Sheet1!R2C1,Sheet1!R2C1:R49C1,INT(MOD(RC1,1000)/62)*16+RC[10],FALSE) -> 304400 | K1459: 1 | M1459: 7 | N1459: 8 | O1459: 9 | P1459: 13 | Q1459: 14
A1460: 30016 | B1460: =RC[1] -> 304010 | C1460: =HLOOKUP(Sheet1!R2C1,Sheet1!R2C1:R49C1,INT(MOD(RC1,1000)/62)*16+RC[10],FALSE) -> 304010 | D1460: =HLOOKUP(Sheet1!R2C1,Sheet1!R2C1:R49C1,INT(MOD(RC1,1000)/62)*16+RC[10],FALSE) -> 304200 | E1460: =HLOOKUP(Sheet1!R2C1,Sheet1!R2C1:R49C1,INT(MOD(RC1,1000)/62)*16+RC[10],FALSE) -> 304030 | F1460: =HLOOKUP(Sheet1!R2C1,Sheet1!R2C1:R49C1,INT(MOD(RC1,1000)/62)*16+RC[10],FALSE) -> 304280 | G1460: =HLOOKUP(Sheet1!R2C1,Sheet1!R2C1:R49C1,INT(MOD(RC1,1000)/62)*16+RC[10],FALSE) -> 304110 | K1460: 1 | M1460: 7 | N1460: 8 | O1460: 10 | P1460: 11 | Q1460: 12
A1461: 30017 | B1461: =RC[1] -> 304010 | C1461: =HLOOKUP(Sheet1!R2C1,Sheet1!R2C1:R49C1,INT(MOD(RC1,1000)/62)*16+RC[10],FALSE) -> 304010 | D1461: =HLOOKUP(Sheet1!R2C1,Sheet1!R2C1:R49C1,INT(MOD(RC1,1000)/62)*16+RC[10],FALSE) -> 304200 | E1461: =HLOOKUP(Sheet1!R2C1,Sheet1!R2C1:R49C1,INT(MOD(RC1,1000)/62)*16+RC[10],FALSE) -> 304030 | F1461: =HLOOKUP(Sheet1!R2C1,Sheet1!R2C1:R49C1,INT(MOD(RC1,1000)/62)*16+RC[10],FALSE) -> 304280 | G1461: =HLOOKUP(Sheet1!R2C1,Sheet1!R2C1:R49C1,INT(MOD(RC1,1000)/62)*16+RC[10],FALSE) -> 304380 | K1461: 1 | M1461: 7 | N1461: 8 | O1461: 10 | P1461: 11 | Q1461: 13
A1462: 30018 | B1462: =RC[1] -> 304010 | C1462: =HLOOKUP(Sheet1!R2C1,Sheet1!R2C1:R49C1,INT(MOD(RC1,1000)/62)*16+RC[10],FALSE) -> 304010 | D1462: =HLOOKUP(Sheet1!R2C1,Sheet1!R2C1:R49C1,INT(MOD(RC1,1000)/62)*16+RC[10],FALSE) -> 304200 | E1462: =HLOOKUP(Sheet1!R2C1,Sheet1!R2C1:R49C1,INT(MOD(RC1,1000)/62)*16+RC[10],FALSE) -> 304030 | F1462: =HLOOKUP(Sheet1!R2C1,Sheet1!R2C1:R49C1,INT(MOD(RC1,1000)/62)*16+RC[10],FALSE) -> 304280 | G1462: =HLOOKUP(Sheet1!R2C1,Sheet1!R2C1:R49C1,INT(MOD(RC1,1000)/62)*16+RC[10],FALSE) -> 304400 | K1462: 1 | M1462: 7 | N1462: 8 | O1462: 10 | P1462: 11 | Q1462: 14
A1463: 30019 | B1463: =RC[1] -> 304010 | C1463: =HLOOKUP(Sheet1!R2C1,Sheet1!R2C1:R49C1,INT(MOD(RC1,1000)/62)*16+RC[10],FALSE) -> 304010 | D1463: =HLOOKUP(Sheet1!R2C1,Sheet1!R2C1:R49C1,INT(MOD(RC1,1000)/62)*16+RC[10],FALSE) -> 304200 | E1463: =HLOOKUP(Sheet1!R2C1,Sheet1!R2C1:R49C1,INT(MOD(RC1,1000)/62)*16+RC[10],FALSE) -> 304030 | F1463: =HLOOKUP(Sheet1!R2C1,Sheet1!R2C1:R49C1,INT(MOD(RC1,1000)/62)*16+RC[10],FALSE) -> 304110 | G1463: =HLOOKUP(Sheet1!R2C1,Sheet1!R2C1:R49C1,INT(MOD(RC1,1000)/62)*16+RC[10],FALSE) -> 304380 | K1463: 1 | M1463: 7 | N1463: 8 | O1463: 10 | P1463: 12 | Q1463: 13
A1464: 30020 | B1464: =RC[1] -> 304010 | C1464: =HLOOKUP(Sheet1!R2C1,Sheet1!R2C1:R49C1,INT(MOD(RC1,1000)/62)*16+RC[10],FALSE) -> 304010 | D1464: =HLOOKUP(Sheet1!R2C1,Sheet1!R2C1:R49C1,INT(MOD(RC1,1000)/62)*16+RC[10],FALSE) -> 304200 | E1464: =HLOOKUP(Sheet1!R2C1,Sheet1!R2C1:R49C1,INT(MOD(RC1,1000)/62)*16+RC[10],FALSE) -> 304030 | F1464: =HLOOKUP(Sheet1!R2C1,Sheet1!R2C1:R49C1,INT(MOD(RC1,1000)/62)*16+RC[10],FALSE) -> 304110 | G1464: =HLOOKUP(Sheet1!R2C1,Sheet1!R2C1:R49C1,INT(MOD(RC1,1000)/62)*16+RC[10],FALSE) -> 304400 | K1464: 1 | M1464: 7 | N1464: 8 | O1464: 10 | P1464: 12 | Q1464: 14
A1465: 30021 | B1465: =RC[1] -> 304010 | C1465: =HLOOKUP(Sheet1!R2C1,Sheet1!R2C1:R49C1,INT(MOD(RC1,1000)/62)*16+RC[10],FALSE) -> 304010 | D1465: =HLOOKUP(Sheet1!R2C1,Sheet1!R2C1:R49C1,INT(MOD(RC1,1000)/62)*16+RC[10],FALSE) -> 304200 | E1465: =HLOOKUP(Sheet1!R2C1,Sheet1!R2C1:R49C1,INT(MOD(RC1,1000)/62)*16+RC[10],FALSE) -> 304030 | F1465: =HLOOKUP(Sheet1!R2C1,Sheet1!R2C1:R49C1,INT(MOD(RC1,1000)/62)*16+RC[10],FALSE) -> 304380 | G1465: =HLOOKUP(Sheet1!R2C1,Sheet1!R2C1:R49C1,INT(MOD(RC1,1000)/62)*16+RC[10],FALSE) -> 304400 | K1465: 1 | M1465: 7 | N1465: 8 | O1465: 10 | P1465: 13 | Q1465: 14
A1466: 30022 | B1466: =RC[1] -> 304010 | C1466: =HLOOKUP(Sheet1!R2C1,Sheet1!R2C1:R49C1,INT(MOD(RC1,1000)/62)*16+RC[10],FALSE) -> 304010 | D1466: =HLOOKUP(Sheet1!R2C1,Sheet1!R2C1:R49C1,INT(MOD(RC1,1000)/62)*16+RC[10],FALSE) -> 304200 | E1466: =HLOOKUP(Sheet1!R2C1,Sheet1!R2C1:R49C1,INT(MOD(RC1,1000)/62)*16+RC[10],FALSE) -> 304280 | F1466: =HLOOKUP(Sheet1!R2C1,Sheet1!R2C1:R49C1,INT(MOD(RC1,1000)/62)*16+RC[10],FALSE) -> 304110 | G1466: =HLOOKUP(Sheet1!R2C1,Sheet1!R2C1:R49C1,INT(MOD(RC1,1000)/62)*16+RC[10],FALSE) -> 304380 | K1466: 1 | M1466: 7 | N1466: 8 | O1466: 11 | P1466: 12 | Q1466: 13
A1467: 30023 | B1467: =RC[1] -> 304010 | C1467: =HLOOKUP(Sheet1!R2C1,Sheet1!R2C1:R49C1,INT(MOD(RC1,1000)/62)*16+RC[10],FALSE) -> 304010 | D1467: =HLOOKUP(Sheet1!R2C1,Sheet1!R2C1:R49C1,INT(MOD(RC1,1000)/62)*16+RC[10],FALSE) -> 304200 | E1467: =HLOOKUP(Sheet1!R2C1,Sheet1!R2C1:R49C1,INT(MOD(RC1,1000)/62)*16+RC[10],FALSE) -> 304280 | F1467: =HLOOKUP(Sheet1!R2C1,Sheet1!R2C1:R49C1,INT(MOD(RC1,1000)/62)*16+RC[10],FALSE) -> 304110 | G1467: =HLOOKUP(Sheet1!R2C1,Sheet1!R2C1:R49C1,INT(MOD(RC1,1000)/62)*16+RC[10],FALSE) -> 304400 | K1467: 1 | M1467: 7 | N1467: 8 | O1467: 11 | P1467: 12 | Q1467: 14
A1468: 30024 | B1468: =RC[1] -> 304010 | C1468: =HLOOKUP(Sheet1!R2C1,Sheet1!R2C1:R49C1,INT(MOD(RC1,1000)/62)*16+RC[10],FALSE) -> 304010 | D1468: =HLOOKUP(Sheet1!R2C1,Sheet1!R2C1:R49C1,INT(MOD(RC1,1000)/62)*16+RC[10],FALSE) -> 304200 | E1468: =HLOOKUP(Sheet1!R2C1,Sheet1!R2C1:R49C1,INT(MOD(RC1,1000)/62)*16+RC[10],FALSE) -> 304280 | F1468: =HLOOKUP(Sheet1!R2C1,Sheet1!R2C1:R49C1,INT(MOD(RC1,1000)/62)*16+RC[10],FALSE) -> 304380 | G1468: =HLOOKUP(Sheet1!R2C1,Sheet1!R2C1:R49C1,INT(MOD(RC1,1000)/62)*16+RC[10],FALSE) -> 304400 | K1468: 1 | M1468: 7 | N1468: 8 | O1468: 11 | P1468: 13 | Q1468: 14
A1469: 30025 | B1469: =RC[1] -> 304010 | C1469: =HLOOKUP(Sheet1!R2C1,Sheet1!R2C1:R49C1,INT(MOD(RC1,1000)/62)*16+RC[10],FALSE) -> 304010 | D1469: =HLOOKUP(Sheet1!R2C1,Sheet1!R2C1:R49C1,INT(MOD(RC1,1000)/62)*16+RC[10],FALSE) -> 304200 | E1469: =HLOOKUP(Sheet1!R2C1,Sheet1!R2C1:R49C1,INT(MOD(RC1,1000)/62)*16+RC[10],FALSE) -> 304110 | F1469: =HLOOKUP(Sheet1!R2C1,Sheet1!R2C1:R49C1,INT(MOD(RC1,1000)/62)*16+RC[10],FALSE) -> 304380 | G1469: =HLOOKUP(Sheet1!R2C1,Sheet1!R2C1:R49C1,INT(MOD(RC1,1000)/62)*16+RC[10],FALSE) -> 304400 | K1469: 1 | M1469: 7 | N1469: 8 | O1469: 12 | P1469: 13 | Q1469: 14
A1470: 30026 | B1470: =RC[1] -> 304010 | C1470: =HLOOKUP(Sheet1!R2C1,Sheet1!R2C1:R49C1,INT(MOD(RC1,1000)/62)*16+RC[10],FALSE) -> 304010 | D1470: =HLOOKUP(Sheet1!R2C1,Sheet1!R2C1:R49C1,INT(MOD(RC1,1000)/62)*16+RC[10],FALSE) -> 304020 | E1470: =HLOOKUP(Sheet1!R2C1,Sheet1!R2C1:R49C1,INT(MOD(RC1,1000)/62)*16+RC[10],FALSE) -> 304030 | F1470: =HLOOKUP(Sheet1!R2C1,Sheet1!R2C1:R49C1,INT(MOD(RC1,1000)/62)*16+RC[10],FALSE) -> 304280 | G1470: =HLOOKUP(Sheet1!R2C1,Sheet1!R2C1:R49C1,INT(MOD(RC1,1000)/62)*16+RC[10],FALSE) -> 304110 | K1470: 1 | M1470: 7 | N1470: 9 | O1470: 10 | P1470: 11 | Q1470: 12
A1471: 30027 | B1471: =RC[1] -> 304010 | C1471: =HLOOKUP(Sheet1!R2C1,Sheet1!R2C1:R49C1,INT(MOD(RC1,1000)/62)*16+RC[10],FALSE) -> 304010 | D1471: =HLOOKUP(Sheet1!R2C1,Sheet1!R2C1:R49C1,INT(MOD(RC1,1000)/62)*16+RC[10],FALSE) -> 304020 | E1471: =HLOOKUP(Sheet1!R2C1,Sheet1!R2C1:R49C1,INT(MOD(RC1,1000)/62)*16+RC[10],FALSE) -> 304030 | F1471: =HLOOKUP(Sheet1!R2C1,Sheet1!R2C1:R49C1,INT(MOD(RC1,1000)/62)*16+RC[10],FALSE) -> 304280 | G1471: =HLOOKUP(Sheet1!R2C1,Sheet1!R2C1:R49C1,INT(MOD(RC1,1000)/62)*16+RC[10],FALSE) -> 304380 | K1471: 1 | M1471: 7 | N1471: 9 | O1471: 10 | P1471: 11 | Q1471: 13
A1472: 30028 | B1472: =RC[1] -> 304010 | C1472: =HLOOKUP(Sheet1!R2C1,Sheet1!R2C1:R49C1,INT(MOD(RC1,1000)/62)*16+RC[10],FALSE) -> 304010 | D1472: =HLOOKUP(Sheet1!R2C1,Sheet1!R2C1:R49C1,INT(MOD(RC1,1000)/62)*16+RC[10],FALSE) -> 304020 | E1472: =HLOOKUP(Sheet1!R2C1,Sheet1!R2C1:R49C1,INT(MOD(RC1,1000)/62)*16+RC[10],FALSE) -> 304030 | F1472: =HLOOKUP(Sheet1!R2C1,Sheet1!R2C1:R49C1,INT(MOD(RC1,1000)/62)*16+RC[10],FALSE) -> 304280 | G1472: =HLOOKUP(Sheet1!R2C1,Sheet1!R2C1:R49C1,INT(MOD(RC1,1000)/62)*16+RC[10],FALSE) -> 304400 | K1472: 1 | M1472: 7 | N1472: 9 | O1472: 10 | P1472: 11 | Q1472: 14
A1473: 30029 | B1473: =RC[1] -> 304010 | C1473: =HLOOKUP(Sheet1!R2C1,Sheet1!R2C1:R49C1,INT(MOD(RC1,1000)/62)*16+RC[10],FALSE) -> 304010 | D1473: =HLOOKUP(Sheet1!R2C1,Sheet1!R2C1:R49C1,INT(MOD(RC1,1000)/62)*16+RC[10],FALSE) -> 304020 | E1473: =HLOOKUP(Sheet1!R2C1,Sheet1!R2C1:R49C1,INT(MOD(RC1,1000)/62)*16+RC[10],FALSE) -> 304030 | F1473: =HLOOKUP(Sheet1!R2C1,Sheet1!R2C1:R49C1,INT(MOD(RC1,1000)/62)*16+RC[10],FALSE) -> 304110 | G1473: =HLOOKUP(Sheet1!R2C1,Sheet1!R2C1:R49C1,INT(MOD(RC1,1000)/62)*16+RC[10],FALSE) -> 304380 | K1473: 1 | M1473: 7 | N1473: 9 | O1473: 10 | P1473: 12 | Q1473: 13
A1474: 30030 | B1474: =RC[1] -> 304010 | C1474: =HLOOKUP(Sheet1!R2C1,Sheet1!R2C1:R49C1,INT(MOD(RC1,1000)/62)*16+RC[10],FALSE) -> 304010 | D1474: =HLOOKUP(Sheet1!R2C1,Sheet1!R2C1:R49C1,INT(MOD(RC1,1000)/62)*16+RC[10],FALSE) -> 304020 | E1474: =HLOOKUP(Sheet1!R2C1,Sheet1!R2C1:R49C1,INT(MOD(RC1,1000)/62)*16+RC[10],FALSE) -> 304030 | F1474: =HLOOKUP(Sheet1!R2C1,Sheet1!R2C1:R49C1,INT(MOD(RC1,1000)/62)*16+RC[10],FALSE) -> 304110 | G1474: =HLOOKUP(Sheet1!R2C1,Sheet1!R2C1:R49C1,INT(MOD(RC1,1000)/62)*16+RC[10],FALSE) -> 304400 | K1474: 1 | M1474: 7 | N1474: 9 | O1474: 10 | P1474: 12 | Q1474: 14
A1475: 30031 | B1475: =RC[1] -> 304010 | C1475: =HLOOKUP(Sheet1!R2C1,Sheet1!R2C1:R49C1,INT(MOD(RC1,1000)/62)*16+RC[10],FALSE) -> 304010 | D1475: =HLOOKUP(Sheet1!R2C1,Sheet1!R2C1:R49C1,INT(MOD(RC1,1000)/62)*16+RC[10],FALSE) -> 304020 | E1475: =HLOOKUP(Sheet1!R2C1,Sheet1!R2C1:R49C1,INT(MOD(RC1,1000)/62)*16+RC[10],FALSE) -> 304030 | F1475: =HLOOKUP(Sheet1!R2C1,Sheet1!R2C1:R49C1,INT(MOD(RC1,1000)/62)*16+RC[10],FALSE) -> 304380 | G1475: =HLOOKUP(Sheet1!R2C1,Sheet1!R2C1:R49C1,INT(MOD(RC1,1000)/62)*16+RC[10],FALSE) -> 304400 | K1475: 1 | M1475: 7 | N1475: 9 | O1475: 10 | P1475: 13 | Q1475: 14
A1476: 30032 | B1476: =RC[1] -> 304010 | C1476: =HLOOKUP(Sheet1!R2C1,Sheet1!R2C1:R49C1,INT(MOD(RC1,1000)/62)*16+RC[10],FALSE) -> 304010 | D1476: =HLOOKUP(Sheet1!R2C1,Sheet1!R2C1:R49C1,INT(MOD(RC1,1000)/62)*16+RC[10],FALSE) -> 304020 | E1476: =HLOOKUP(Sheet1!R2C1,Sheet1!R2C1:R49C1,INT(MOD(RC1,1000)/62)*16+RC[10],FALSE) -> 304280 | F1476: =HLOOKUP(Sheet1!R2C1,Sheet1!R2C1:R49C1,INT(MOD(RC1,1000)/62)*16+RC[10],FALSE) -> 304110 | G1476: =HLOOKUP(Sheet1!R2C1,Sheet1!R2C1:R49C1,INT(MOD(RC1,1000)/62)*16+RC[10],FALSE) -> 304380 | K1476: 1 | M1476: 7 | N1476: 9 | O1476: 11 | P1476: 12 | Q1476: 13
A1477: 30033 | B1477: =RC[1] -> 304010 | C1477: =HLOOKUP(Sheet1!R2C1,Sheet1!R2C1:R49C1,INT(MOD(RC1,1000)/62)*16+RC[10],FALSE) -> 304010 | D1477: =HLOOKUP(Sheet1!R2C1,Sheet1!R2C1:R49C1,INT(MOD(RC1,1000)/62)*16+RC[10],FALSE) -> 304020 | E1477: =HLOOKUP(Sheet1!R2C1,Sheet1!R2C1:R49C1,INT(MOD(RC1,1000)/62)*16+RC[10],FALSE) -> 304280 | F1477: =HLOOKUP(Sheet1!R2C1,Sheet1!R2C1:R49C1,INT(MOD(RC1,1000)/62)*16+RC[10],FALSE) -> 304110 | G1477: =HLOOKUP(Sheet1!R2C1,Sheet1!R2C1:R49C1,INT(MOD(RC1,1000)/62)*16+RC[10],FALSE) -> 304400 | K1477: 1 | M1477: 7 | N1477: 9 | O1477: 11 | P1477: 12 | Q1477: 14
A1478: 30034 | B1478: =RC[1] -> 304010 | C1478: =HLOOKUP(Sheet1!R2C1,Sheet1!R2C1:R49C1,INT(MOD(RC1,1000)/62)*16+RC[10],FALSE) -> 304010 | D1478: =HLOOKUP(Sheet1!R2C1,Sheet1!R2C1:R49C1,INT(MOD(RC1,1000)/62)*16+RC[10],FALSE) -> 304020 | E1478: =HLOOKUP(Sheet1!R2C1,Sheet1!R2C1:R49C1,INT(MOD(RC1,1000)/62)*16+RC[10],FALSE) -> 304280 | F1478: =HLOOKUP(Sheet1!R2C1,Sheet1!R2C1:R49C1,INT(MOD(RC1,1000)/62)*16+RC[10],FALSE) -> 304380 | G1478: =HLOOKUP(Sheet1!R2C1,Sheet1!R2C1:R49C1,INT(MOD(RC1,1000)/62)*16+RC[10],FALSE) -> 304400 | K1478: 1 | M1478: 7 | N1478: 9 | O1478: 11 | P1478: 13 | Q1478: 14
A1479: 30035 | B1479: =RC[1] -> 304010 | C1479: =HLOOKUP(Sheet1!R2C1,Sheet1!R2C1:R49C1,INT(MOD(RC1,1000)/62)*16+RC[10],FALSE) -> 304010 | D1479: =HLOOKUP(Sheet1!R2C1,Sheet1!R2C1:R49C1,INT(MOD(RC1,1000)/62)*16+RC[10],FALSE) -> 304020 | E1479: =HLOOKUP(Sheet1!R2C1,Sheet1!R2C1:R49C1,INT(MOD(RC1,1000)/62)*16+RC[10],FALSE) -> 304110 | F1479: =HLOOKUP(Sheet1!R2C1,Sheet1!R2C1:R49C1,INT(MOD(RC1,1000)/62)*16+RC[10],FALSE) -> 304380 | G1479: =HLOOKUP(Sheet1!R2C1,Sheet1!R2C1:R49C1,INT(MOD(RC1,1000)/62)*16+RC[10],FALSE) -> 304400 | K1479: 1 | M1479: 7 | N1479: 9 | O1479: 12 | P1479: 13 | Q1479: 14
A1480: 30036 | B1480: =RC[1] -> 304010 | C1480: =HLOOKUP(Sheet1!R2C1,Sheet1!R2C1:R49C1,INT(MOD(RC1,1000)/62)*16+RC[10],FALSE) -> 304010 | D1480: =HLOOKUP(Sheet1!R2C1,Sheet1!R2C1:R49C1,INT(MOD(RC1,1000)/62)*16+RC[10],FALSE) -> 304030 | E1480: =HLOOKUP(Sheet1!R2C1,Sheet1!R2C1:R49C1,INT(MOD(RC1,1000)/62)*16+RC[10],FALSE) -> 304280 | F1480: =HLOOKUP(Sheet1!R2C1,Sheet1!R2C1:R49C1,INT(MOD(RC1,1000)/62)*16+RC[10],FALSE) -> 304110 | G1480: =HLOOKUP(Sheet1!R2C1,Sheet1!R2C1:R49C1,INT(MOD(RC1,1000)/62)*16+RC[10],FALSE) -> 304380 | K1480: 1 | M1480: 7 | N1480: 10 | O1480: 11 | P1480: 12 | Q1480: 13
A1481: 30037 | B1481: =RC[1] -> 304010 | C1481: =HLOOKUP(Sheet1!R2C1,Sheet1!R2C1:R49C1,INT(MOD(RC1,1000)/62)*16+RC[10],FALSE) -> 304010 | D1481: =HLOOKUP(Sheet1!R2C1,Sheet1!R2C1:R49C1,INT(MOD(RC1,1000)/62)*16+RC[10],FALSE) -> 304030 | E1481: =HLOOKUP(Sheet1!R2C1,Sheet1!R2C1:R49C1,INT(MOD(RC1,1000)/62)*16+RC[10],FALSE) -> 304280 | F1481: =HLOOKUP(Sheet1!R2C1,Sheet1!R2C1:R49C1,INT(MOD(RC1,1000)/62)*16+RC[10],FALSE) -> 304110 | G1481: =HLOOKUP(Sheet1!R2C1,Sheet1!R2C1:R49C1,INT(MOD(RC1,1000)/62)*16+RC[10],FALSE) -> 304400 | K1481: 1 | M1481: 7 | N1481: 10 | O1481: 11 | P1481: 12 | Q1481: 14
A1482: 30038 | B1482: =RC[1] -> 304010 | C1482: =HLOOKUP(Sheet1!R2C1,Sheet1!R2C1:R49C1,INT(MOD(RC1,1000)/62)*16+RC[10],FALSE) -> 304010 | D1482: =HLOOKUP(Sheet1!R2C1,Sheet1!R2C1:R49C1,INT(MOD(RC1,1000)/62)*16+RC[10],FALSE) -> 304030 | E1482: =HLOOKUP(Sheet1!R2C1,Sheet1!R2C1:R49C1,INT(MOD(RC1,1000)/62)*16+RC[10],FALSE) -> 304280 | F1482: =HLOOKUP(Sheet1!R2C1,Sheet1!R2C1:R49C1,INT(MOD(RC1,1000)/62)*16+RC[10],FALSE) -> 304380 | G1482: =HLOOKUP(Sheet1!R2C1,Sheet1!R2C1:R49C1,INT(MOD(RC1,1000)/62)*16+RC[10],FALSE) -> 304400 | K1482: 1 | M1482: 7 | N1482: 10 | O1482: 11 | P1482: 13 | Q1482: 14
A1483: 30039 | B1483: =RC[1] -> 304010 | C1483: =HLOOKUP(Sheet1!R2C1,Sheet1!R2C1:R49C1,INT(MOD(RC1,1000)/62)*16+RC[10],FALSE) -> 304010 | D1483: =HLOOKUP(Sheet1!R2C1,Sheet1!R2C1:R49C1,INT(MOD(RC1,1000)/62)*16+RC[10],FALSE) -> 304030 | E1483: =HLOOKUP(Sheet1!R2C1,Sheet1!R2C1:R49C1,INT(MOD(RC1,1000)/62)*16+RC[10],FALSE) -> 304110 | F1483: =HLOOKUP(Sheet1!R2C1,Sheet1!R2C1:R49C1,INT(MOD(RC1,1000)/62)*16+RC[10],FALSE) -> 304380 | G1483: =HLOOKUP(Sheet1!R2C1,Sheet1!R2C1:R49C1,INT(MOD(RC1,1000)/62)*16+RC[10],FALSE) -> 304400 | K1483: 1 | M1483: 7 | N1483: 10 | O1483: 12 | P1483: 13 | Q1483: 14
A1484: 30040 | B1484: =RC[1] -> 304010 | C1484: =HLOOKUP(Sheet1!R2C1,Sheet1!R2C1:R49C1,INT(MOD(RC1,1000)/62)*16+RC[10],FALSE) -> 304010 | D1484: =HLOOKUP(Sheet1!R2C1,Sheet1!R2C1:R49C1,INT(MOD(RC1,1000)/62)*16+RC[10],FALSE) -> 304280 | E1484: =HLOOKUP(Sheet1!R2C1,Sheet1!R2C1:R49C1,INT(MOD(RC1,1000)/62)*16+RC[10],FALSE) -> 304110 | F1484: =HLOOKUP(Sheet1!R2C1,Sheet1!R2C1:R49C1,INT(MOD(RC1,1000)/62)*16+RC[10],FALSE) -> 304380 | G1484: =HLOOKUP(Sheet1!R2C1,Sheet1!R2C1:R49C1,INT(MOD(RC1,1000)/62)*16+RC[10],FALSE) -> 304400 | K1484: 1 | M1484: 7 | N1484: 11 | O1484: 12 | P1484: 13 | Q1484: 14
A1485: 30041 | B1485: =RC[1] -> 304200 | C1485: =HLOOKUP(Sheet1!R2C1,Sheet1!R2C1:R49C1,INT(MOD(RC1,1000)/62)*16+RC[10],FALSE) -> 304200 | D1485: =HLOOKUP(Sheet1!R2C1,Sheet1!R2C1:R49C1,INT(MOD(RC1,1000)/62)*16+RC[10],FALSE) -> 304020 | E1485: =HLOOKUP(Sheet1!R2C1,Sheet1!R2C1:R49C1,INT(MOD(RC1,1000)/62)*16+RC[10],FALSE) -> 304030 | F1485: =HLOOKUP(Sheet1!R2C1,Sheet1!R2C1:R49C1,INT(MOD(RC1,1000)/62)*16+RC[10],FALSE) -> 304280 | G1485: =HLOOKUP(Sheet1!R2C1,Sheet1!R2C1:R49C1,INT(MOD(RC1,1000)/62)*16+RC[10],FALSE) -> 304110 | K1485: 1 | M1485: 8 | N1485: 9 | O1485: 10 | P1485: 11 | Q1485: 12
A1486: 30042 | B1486: =RC[1] -> 304200 | C1486: =HLOOKUP(Sheet1!R2C1,Sheet1!R2C1:R49C1,INT(MOD(RC1,1000)/62)*16+RC[10],FALSE) -> 304200 | D1486: =HLOOKUP(Sheet1!R2C1,Sheet1!R2C1:R49C1,INT(MOD(RC1,1000)/62)*16+RC[10],FALSE) -> 304020 | E1486: =HLOOKUP(Sheet1!R2C1,Sheet1!R2C1:R49C1,INT(MOD(RC1,1000)/62)*16+RC[10],FALSE) -> 304030 | F1486: =HLOOKUP(Sheet1!R2C1,Sheet1!R2C1:R49C1,INT(MOD(RC1,1000)/62)*16+RC[10],FALSE) -> 304280 | G1486: =HLOOKUP(Sheet1!R2C1,Sheet1!R2C1:R49C1,INT(MOD(RC1,1000)/62)*16+RC[10],FALSE) -> 304380 | K1486: 1 | M1486: 8 | N1486: 9 | O1486: 10 | P1486: 11 | Q1486: 13
A1487: 30043 | B1487: =RC[1] -> 304200 | C1487: =HLOOKUP(Sheet1!R2C1,Sheet1!R2C1:R49C1,INT(MOD(RC1,1000)/62)*16+RC[10],FALSE) -> 304200 | D1487: =HLOOKUP(Sheet1!R2C1,Sheet1!R2C1:R49C1,INT(MOD(RC1,1000)/62)*16+RC[10],FALSE) -> 304020 | E1487: =HLOOKUP(Sheet1!R2C1,Sheet1!R2C1:R49C1,INT(MOD(RC1,1000)/62)*16+RC[10],FALSE) -> 304030 | F1487: =HLOOKUP(Sheet1!R2C1,Sheet1!R2C1:R49C1,INT(MOD(RC1,1000)/62)*16+RC[10],FALSE) -> 304280 | G1487: =HLOOKUP(Sheet1!R2C1,Sheet1!R2C1:R49C1,INT(MOD(RC1,1000)/62)*16+RC[10],FALSE) -> 304400 | K1487: 1 | M1487: 8 | N1487: 9 | O1487: 10 | P1487: 11 | Q1487: 14
A1488: 30044 | B1488: =RC[1] -> 304200 | C1488: =HLOOKUP(Sheet1!R2C1,Sheet1!R2C1:R49C1,INT(MOD(RC1,1000)/62)*16+RC[10],FALSE) -> 304200 | D1488: =HLOOKUP(Sheet1!R2C1,Sheet1!R2C1:R49C1,INT(MOD(RC1,1000)/62)*16+RC[10],FALSE) -> 304020 | E1488: =HLOOKUP(Sheet1!R2C1,Sheet1!R2C1:R49C1,INT(MOD(RC1,1000)/62)*16+RC[10],FALSE) -> 304030 | F1488: =HLOOKUP(Sheet1!R2C1,Sheet1!R2C1:R49C1,INT(MOD(RC1,1000)/62)*16+RC[10],FALSE) -> 304110 | G1488: =HLOOKUP(Sheet1!R2C1,Sheet1!R2C1:R49C1,INT(MOD(RC1,1000)/62)*16+RC[10],FALSE) -> 304380 | K1488: 1 | M1488: 8 | N1488: 9 | O1488: 10 | P1488: 12 | Q1488: 13
A1489: 30045 | B1489: =RC[1] -> 304200 | C1489: =HLOOKUP(Sheet1!R2C1,Sheet1!R2C1:R49C1,INT(MOD(RC1,1000)/62)*16+RC[10],FALSE) -> 304200 | D1489: =HLOOKUP(Sheet1!R2C1,Sheet1!R2C1:R49C1,INT(MOD(RC1,1000)/62)*16+RC[10],FALSE) -> 304020 | E1489: =HLOOKUP(Sheet1!R2C1,Sheet1!R2C1:R49C1,INT(MOD(RC1,1000)/62)*16+RC[10],FALSE) -> 304030 | F1489: =HLOOKUP(Sheet1!R2C1,Sheet1!R2C1:R49C1,INT(MOD(RC1,1000)/62)*16+RC[10],FALSE) -> 304110 | G1489: =HLOOKUP(Sheet1!R2C1,Sheet1!R2C1:R49C1,INT(MOD(RC1,1000)/62)*16+RC[10],FALSE) -> 304400 | K1489: 1 | M1489: 8 | N1489: 9 | O1489: 10 | P1489: 12 | Q1489: 14
A1490: 30046 | B1490: =RC[1] -> 304200 | C1490: =HLOOKUP(Sheet1!R2C1,Sheet1!R2C1:R49C1,INT(MOD(RC1,1000)/62)*16+RC[10],FALSE) -> 304200 | D1490: =HLOOKUP(Sheet1!R2C1,Sheet1!R2C1:R49C1,INT(MOD(RC1,1000)/62)*16+RC[10],FALSE) -> 304020 | E1490: =HLOOKUP(Sheet1!R2C1,Sheet1!R2C1:R49C1,INT(MOD(RC1,1000)/62)*16+RC[10],FALSE) -> 304030 | F1490: =HLOOKUP(Sheet1!R2C1,Sheet1!R2C1:R49C1,INT(MOD(RC1,1000)/62)*16+RC[10],FALSE) -> 304380 | G1490: =HLOOKUP(Sheet1!R2C1,Sheet1!R2C1:R49C1,INT(MOD(RC1,1000)/62)*16+RC[10],FALSE) -> 304400 | K1490: 1 | M1490: 8 | N1490: 9 | O1490: 10 | P1490: 13 | Q1490: 14
A1491: 30047 | B1491: =RC[1] -> 304200 | C1491: =HLOOKUP(Sheet1!R2C1,Sheet1!R2C1:R49C1,INT(MOD(RC1,1000)/62)*16+RC[10],FALSE) -> 304200 | D1491: =HLOOKUP(Sheet1!R2C1,Sheet1!R2C1:R49C1,INT(MOD(RC1,1000)/62)*16+RC[10],FALSE) -> 304020 | E1491: =HLOOKUP(Sheet1!R2C1,Sheet1!R2C1:R49C1,INT(MOD(RC1,1000)/62)*16+RC[10],FALSE) -> 304280 | F1491: =HLOOKUP(Sheet1!R2C1,Sheet1!R2C1:R49C1,INT(MOD(RC1,1000)/62)*16+RC[10],FALSE) -> 304110 | G1491: =HLOOKUP(Sheet1!R2C1,Sheet1!R2C1:R49C1,INT(MOD(RC1,1000)/62)*16+RC[10],FALSE) -> 304380 | K1491: 1 | M1491: 8 | N1491: 9 | O1491: 11 | P1491: 12 | Q1491: 13
A1492: 30048 | B1492: =RC[1] -> 304200 | C1492: =HLOOKUP(Sheet1!R2C1,Sheet1!R2C1:R49C1,INT(MOD(RC1,1000)/62)*16+RC[10],FALSE) -> 304200 | D1492: =HLOOKUP(Sheet1!R2C1,Sheet1!R2C1:R49C1,INT(MOD(RC1,1000)/62)*16+RC[10],FALSE) -> 304020 | E1492: =HLOOKUP(Sheet1!R2C1,Sheet1!R2C1:R49C1,INT(MOD(RC1,1000)/62)*16+RC[10],FALSE) -> 304280 | F1492: =HLOOKUP(Sheet1!R2C1,Sheet1!R2C1:R49C1,INT(MOD(RC1,1000)/62)*16+RC[10],FALSE) -> 304110 | G1492: =HLOOKUP(Sheet1!R2C1,Sheet1!R2C1:R49C1,INT(MOD(RC1,1000)/62)*16+RC[10],FALSE) -> 304400 | K1492: 1 | M1492: 8 | N1492: 9 | O1492: 11 | P1492: 12 | Q1492: 14
A1493: 30049 | B1493: =RC[1] -> 304200 | C1493: =HLOOKUP(Sheet1!R2C1,Sheet1!R2C1:R49C1,INT(MOD(RC1,1000)/62)*16+RC[10],FALSE) -> 304200 | D1493: =HLOOKUP(Sheet1!R2C1,Sheet1!R2C1:R49C1,INT(MOD(RC1,1000)/62)*16+RC[10],FALSE) -> 304020 | E1493: =HLOOKUP(Sheet1!R2C1,Sheet1!R2C1:R49C1,INT(MOD(RC1,1000)/62)*16+RC[10],FALSE) -> 304280 | F1493: =HLOOKUP(Sheet1!R2C1,Sheet1!R2C1:R49C1,INT(MOD(RC1,1000)/62)*16+RC[10],FALSE) -> 304380 | G1493: =HLOOKUP(Sheet1!R2C1,Sheet1!R2C1:R49C1,INT(MOD(RC1,1000)/62)*16+RC[10],FALSE) -> 304400 | K1493: 1 | M1493: 8 | N1493: 9 | O1493: 11 | P1493: 13 | Q1493: 14
A1494: 30050 | B1494: =RC[1] -> 304200 | C1494: =HLOOKUP(Sheet1!R2C1,Sheet1!R2C1:R49C1,INT(MOD(RC1,1000)/62)*16+RC[10],FALSE) -> 304200 | D1494: =HLOOKUP(Sheet1!R2C1,Sheet1!R2C1:R49C1,INT(MOD(RC1,1000)/62)*16+RC[10],FALSE) -> 304020 | E1494: =HLOOKUP(Sheet1!R2C1,Sheet1!R2C1:R49C1,INT(MOD(RC1,1000)/62)*16+RC[10],FALSE) -> 304110 | F1494: =HLOOKUP(Sheet1!R2C1,Sheet1!R2C1:R49C1,INT(MOD(RC1,1000)/62)*16+RC[10],FALSE) -> 304380 | G1494: =HLOOKUP(Sheet1!R2C1,Sheet1!R2C1:R49C1,INT(MOD(RC1,1000)/62)*16+RC[10],FALSE) -> 304400 | K1494: 1 | M1494: 8 | N1494: 9 | O1494: 12 | P1494: 13 | Q1494: 14
A1495: 30051 | B1495: =RC[1] -> 304200 | C1495: =HLOOKUP(Sheet1!R2C1,Sheet1!R2C1:R49C1,INT(MOD(RC1,1000)/62)*16+RC[10],FALSE) -> 304200 | D1495: =HLOOKUP(Sheet1!R2C1,Sheet1!R2C1:R49C1,INT(MOD(RC1,1000)/62)*16+RC[10],FALSE) -> 304030 | E1495: =HLOOKUP(Sheet1!R2C1,Sheet1!R2C1:R49C1,INT(MOD(RC1,1000)/62)*16+RC[10],FALSE) -> 304280 | F1495: =HLOOKUP(Sheet1!R2C1,Sheet1!R2C1:R49C1,INT(MOD(RC1,1000)/62)*16+RC[10],FALSE) -> 304110 | G1495: =HLOOKUP(Sheet1!R2C1,Sheet1!R2C1:R49C1,INT(MOD(RC1,1000)/62)*16+RC[10],FALSE) -> 304380 | K1495: 1 | M1495: 8 | N1495: 10 | O1495: 11 | P1495: 12 | Q1495: 13
A1496: 30052 | B1496: =RC[1] -> 304200 | C1496: =HLOOKUP(Sheet1!R2C1,Sheet1!R2C1:R49C1,INT(MOD(RC1,1000)/62)*16+RC[10],FALSE) -> 304200 | D1496: =HLOOKUP(Sheet1!R2C1,Sheet1!R2C1:R49C1,INT(MOD(RC1,1000)/62)*16+RC[10],FALSE) -> 304030 | E1496: =HLOOKUP(Sheet1!R2C1,Sheet1!R2C1:R49C1,INT(MOD(RC1,1000)/62)*16+RC[10],FALSE) -> 304280 | F1496: =HLOOKUP(Sheet1!R2C1,Sheet1!R2C1:R49C1,INT(MOD(RC1,1000)/62)*16+RC[10],FALSE) -> 304110 | G1496: =HLOOKUP(Sheet1!R2C1,Sheet1!R2C1:R49C1,INT(MOD(RC1,1000)/62)*16+RC[10],FALSE) -> 304400 | K1496: 1 | M1496: 8 | N1496: 10 | O1496: 11 | P1496: 12 | Q1496: 14
A1497: 30053 | B1497: =RC[1] -> 304200 | C1497: =HLOOKUP(Sheet1!R2C1,Sheet1!R2C1:R49C1,INT(MOD(RC1,1000)/62)*16+RC[10],FALSE) -> 304200 | D1497: =HLOOKUP(Sheet1!R2C1,Sheet1!R2C1:R49C1,INT(MOD(RC1,1000)/62)*16+RC[10],FALSE) -> 304030 | E1497: =HLOOKUP(Sheet1!R2C1,Sheet1!R2C1:R49C1,INT(MOD(RC1,1000)/62)*16+RC[10],FALSE) -> 304280 | F1497: =HLOOKUP(Sheet1!R2C1,Sheet1!R2C1:R49C1,INT(MOD(RC1,1000)/62)*16+RC[10],FALSE) -> 304380 | G1497: =HLOOKUP(Sheet1!R2C1,Sheet1!R2C1:R49C1,INT(MOD(RC1,1000)/62)*16+RC[10],FALSE) -> 304400 | K1497: 1 | M1497: 8 | N1497: 10 | O1497: 11 | P1497: 13 | Q1497: 14
A1498: 30054 | B1498: =RC[1] -> 304200 | C1498: =HLOOKUP(Sheet1!R2C1,Sheet1!R2C1:R49C1,INT(MOD(RC1,1000)/62)*16+RC[10],FALSE) -> 304200 | D1498: =HLOOKUP(Sheet1!R2C1,Sheet1!R2C1:R49C1,INT(MOD(RC1,1000)/62)*16+RC[10],FALSE) -> 304030 | E1498: =HLOOKUP(Sheet1!R2C1,Sheet1!R2C1:R49C1,INT(MOD(RC1,1000)/62)*16+RC[10],FALSE) -> 304110 | F1498: =HLOOKUP(Sheet1!R2C1,Sheet1!R2C1:R49C1,INT(MOD(RC1,1000)/62)*16+RC[10],FALSE) -> 304380 | G1498: =HLOOKUP(Sheet1!R2C1,Sheet1!R2C1:R49C1,INT(MOD(RC1,1000)/62)*16+RC[10],FALSE) -> 304400 | K1498: 1 | M1498: 8 | N1498: 10 | O1498: 12 | P1498: 13 | Q1498: 14
A1499: 30055 | B1499: =RC[1] -> 304200 | C1499: =HLOOKUP(Sheet1!R2C1,Sheet1!R2C1:R49C1,INT(MOD(RC1,1000)/62)*16+RC[10],FALSE) -> 304200 | D1499: =HLOOKUP(Sheet1!R2C1,Sheet1!R2C1:R49C1,INT(MOD(RC1,1000)/62)*16+RC[10],FALSE) -> 304280 | E1499: =HLOOKUP(Sheet1!R2C1,Sheet1!R2C1:R49C1,INT(MOD(RC1,1000)/62)*16+RC[10],FALSE) -> 304110 | F1499: =HLOOKUP(Sheet1!R2C1,Sheet1!R2C1:R49C1,INT(MOD(RC1,1000)/62)*16+RC[10],FALSE) -> 304380 | G1499: =HLOOKUP(Sheet1!R2C1,Sheet1!R2C1:R49C1,INT(MOD(RC1,1000)/62)*16+RC[10],FALSE) -> 304400 | K1499: 1 | M1499: 8 | N1499: 11 | O1499: 12 | P1499: 13 | Q1499: 14
A1500: 30056 | B1500: =RC[1] -> 304020 | C1500: =HLOOKUP(Sheet1!R2C1,Sheet1!R2C1:R49C1,INT(MOD(RC1,1000)/62)*16+RC[10],FALSE) -> 304020 | D1500: =HLOOKUP(Sheet1!R2C1,Sheet1!R2C1:R49C1,INT(MOD(RC1,1000)/62)*16+RC[10],FALSE) -> 304030 | E1500: =HLOOKUP(Sheet1!R2C1,Sheet1!R2C1:R49C1,INT(MOD(RC1,1000)/62)*16+RC[10],FALSE) -> 304280 | F1500: =HLOOKUP(Sheet1!R2C1,Sheet1!R2C1:R49C1,INT(MOD(RC1,1000)/62)*16+RC[10],FALSE) -> 304110 | G1500: =HLOOKUP(Sheet1!R2C1,Sheet1!R2C1:R49C1,INT(MOD(RC1,1000)/62)*16+RC[10],FALSE) -> 304380 | K1500: 1 | M1500: 9 | N1500: 10 | O1500: 11 | P1500: 12 | Q1500: 13
A1501: 30057 | B1501: =RC[1] -> 304020 | C1501: =HLOOKUP(Sheet1!R2C1,Sheet1!R2C1:R49C1,INT(MOD(RC1,1000)/62)*16+RC[10],FALSE) -> 304020 | D1501: =HLOOKUP(Sheet1!R2C1,Sheet1!R2C1:R49C1,INT(MOD(RC1,1000)/62)*16+RC[10],FALSE) -> 304030 | E1501: =HLOOKUP(Sheet1!R2C1,Sheet1!R2C1:R49C1,INT(MOD(RC1,1000)/62)*16+RC[10],FALSE) -> 304280 | F1501: =HLOOKUP(Sheet1!R2C1,Sheet1!R2C1:R49C1,INT(MOD(RC1,1000)/62)*16+RC[10],FALSE) -> 304110 | G1501: =HLOOKUP(Sheet1!R2C1,Sheet1!R2C1:R49C1,INT(MOD(RC1,1000)/62)*16+RC[10],FALSE) -> 304400 | K1501: 1 | M1501: 9 | N1501: 10 | O1501: 11 | P1501: 12 | Q1501: 14
A1502: 30058 | B1502: =RC[1] -> 304020 | C1502: =HLOOKUP(Sheet1!R2C1,Sheet1!R2C1:R49C1,INT(MOD(RC1,1000)/62)*16+RC[10],FALSE) -> 304020 | D1502: =HLOOKUP(Sheet1!R2C1,Sheet1!R2C1:R49C1,INT(MOD(RC1,1000)/62)*16+RC[10],FALSE) -> 304030 | E1502: =HLOOKUP(Sheet1!R2C1,Sheet1!R2C1:R49C1,INT(MOD(RC1,1000)/62)*16+RC[10],FALSE) -> 304280 | F1502: =HLOOKUP(Sheet1!R2C1,Sheet1!R2C1:R49C1,INT(MOD(RC1,1000)/62)*16+RC[10],FALSE) -> 304380 | G1502: =HLOOKUP(Sheet1!R2C1,Sheet1!R2C1:R49C1,INT(MOD(RC1,1000)/62)*16+RC[10],FALSE) -> 304400 | K1502: 1 | M1502: 9 | N1502: 10 | O1502: 11 | P1502: 13 | Q1502: 14
A1503: 30059 | B1503: =RC[1] -> 304020 | C1503: =HLOOKUP(Sheet1!R2C1,Sheet1!R2C1:R49C1,INT(MOD(RC1,1000)/62)*16+RC[10],FALSE) -> 304020 | D1503: =HLOOKUP(Sheet1!R2C1,Sheet1!R2C1:R49C1,INT(MOD(RC1,1000)/62)*16+RC[10],FALSE) -> 304030 | E1503: =HLOOKUP(Sheet1!R2C1,Sheet1!R2C1:R49C1,INT(MOD(RC1,1000)/62)*16+RC[10],FALSE) -> 304110 | F1503: =HLOOKUP(Sheet1!R2C1,Sheet1!R2C1:R49C1,INT(MOD(RC1,1000)/62)*16+RC[10],FALSE) -> 304380 | G1503: =HLOOKUP(Sheet1!R2C1,Sheet1!R2C1:R49C1,INT(MOD(RC1,1000)/62)*16+RC[10],FALSE) -> 304400 | K1503: 1 | M1503: 9 | N1503: 10 | O1503: 12 | P1503: 13 | Q1503: 14
A1504: 30060 | B1504: =RC[1] -> 304020 | C1504: =HLOOKUP(Sheet1!R2C1,Sheet1!R2C1:R49C1,INT(MOD(RC1,1000)/62)*16+RC[10],FALSE) -> 304020 | D1504: =HLOOKUP(Sheet1!R2C1,Sheet1!R2C1:R49C1,INT(MOD(RC1,1000)/62)*16+RC[10],FALSE) -> 304280 | E1504: =HLOOKUP(Sheet1!R2C1,Sheet1!R2C1:R49C1,INT(MOD(RC1,1000)/62)*16+RC[10],FALSE) -> 304110 | F1504: =HLOOKUP(Sheet1!R2C1,Sheet1!R2C1:R49C1,INT(MOD(RC1,1000)/62)*16+RC[10],FALSE) -> 304380 | G1504: =HLOOKUP(Sheet1!R2C1,Sheet1!R2C1:R49C1,INT(MOD(RC1,1000)/62)*16+RC[10],FALSE) -> 304400 | K1504: 1 | M1504: 9 | N1504: 11 | O1504: 12 | P1504: 13 | Q1504: 14
A1505: 30061 | B1505: =RC[1] -> 304030 | C1505: =HLOOKUP(Sheet1!R2C1,Sheet1!R2C1:R49C1,INT(MOD(RC1,1000)/62)*16+RC[10],FALSE) -> 304030 | D1505: =HLOOKUP(Sheet1!R2C1,Sheet1!R2C1:R49C1,INT(MOD(RC1,1000)/62)*16+RC[10],FALSE) -> 304280 | E1505: =HLOOKUP(Sheet1!R2C1,Sheet1!R2C1:R49C1,INT(MOD(RC1,1000)/62)*16+RC[10],FALSE) -> 304110 | F1505: =HLOOKUP(Sheet1!R2C1,Sheet1!R2C1:R49C1,INT(MOD(RC1,1000)/62)*16+RC[10],FALSE) -> 304380 | G1505: =HLOOKUP(Sheet1!R2C1,Sheet1!R2C1:R49C1,INT(MOD(RC1,1000)/62)*16+RC[10],FALSE) -> 304400 | K1505: 1 | M1505: 10 | N1505: 11 | O1505: 12 | P1505: 13 | Q1505: 14
A1506: 30062 | B1506: =RC[1] -> 313010 | C1506: =HLOOKUP(Sheet1!R2C1,Sheet1!R2C1:R49C1,INT(MOD(RC1,1000)/62)*16+RC[10],FALSE) -> 313010 | D1506: =HLOOKUP(Sheet1!R2C1,Sheet1!R2C1:R49C1,INT(MOD(RC1,1000)/62)*16+RC[10],FALSE) -> 313410 | E1506: =HLOOKUP(Sheet1!R2C1,Sheet1!R2C1:R49C1,INT(MOD(RC1,1000)/62)*16+RC[10],FALSE) -> 314000 | F1506: =HLOOKUP(Sheet1!R2C1,Sheet1!R2C1:R49C1,INT(MOD(RC1,1000)/62)*16+RC[10],FALSE) -> 314400 | G1506: =HLOOKUP(Sheet1!R2C1,Sheet1!R2C1:R49C1,INT(MOD(RC1,1000)/62)*16+RC[10],FALSE) -> 314300 | K1506: 1 | M1506: =R[-62]C -> 1 | N1506: =R[-62]C -> 2 | O1506: =R[-62]C -> 3 | P1506: =R[-62]C -> 4 | Q1506: =R[-62]C -> 5
A1507: 30063 | B1507: =RC[1] -> 313410 | C1507: =HLOOKUP(Sheet1!R2C1,Sheet1!R2C1:R49C1,INT(MOD(RC1,1000)/62)*16+RC[10],FALSE) -> 313410 | D1507: =HLOOKUP(Sheet1!R2C1,Sheet1!R2C1:R49C1,INT(MOD(RC1,1000)/62)*16+RC[10],FALSE) -> 314000 | E1507: =HLOOKUP(Sheet1!R2C1,Sheet1!R2C1:R49C1,INT(MOD(RC1,1000)/62)*16+RC[10],FALSE) -> 314400 | F1507: =HLOOKUP(Sheet1!R2C1,Sheet1!R2C1:R49C1,INT(MOD(RC1,1000)/62)*16+RC[10],FALSE) -> 314300 | G1507: =HLOOKUP(Sheet1!R2C1,Sheet1!R2C1:R49C1,INT(MOD(RC1,1000)/62)*16+RC[10],FALSE) -> 314010 | K1507: 1 | M1507: =R[-62]C -> 2 | N1507: =R[-62]C -> 3 | O1507: =R[-62]C -> 4 | P1507: =R[-62]C -> 5 | Q1507: =R[-62]C -> 6
A1508: 30064 | B1508: =RC[1] -> 314000 | C1508: =HLOOKUP(Sheet1!R2C1,Sheet1!R2C1:R49C1,INT(MOD(RC1,1000)/62)*16+RC[10],FALSE) -> 314000 | D1508: =HLOOKUP(Sheet1!R2C1,Sheet1!R2C1:R49C1,INT(MOD(RC1,1000)/62)*16+RC[10],FALSE) -> 314400 | E1508: =HLOOKUP(Sheet1!R2C1,Sheet1!R2C1:R49C1,INT(MOD(RC1,1000)/62)*16+RC[10],FALSE) -> 314300 | F1508: =HLOOKUP(Sheet1!R2C1,Sheet1!R2C1:R49C1,INT(MOD(RC1,1000)/62)*16+RC[10],FALSE) -> 314010 | G1508: =HLOOKUP(Sheet1!R2C1,Sheet1!R2C1:R49C1,INT(MOD(RC1,1000)/62)*16+RC[10],FALSE) -> 313010 | K1508: 1 | M1508: =R[-62]C -> 3 | N1508: =R[-62]C -> 4 | O1508: =R[-62]C -> 5 | P1508: =R[-62]C -> 6 | Q1508: =R[-62]C -> 1
A1509: 30065 | B1509: =RC[1] -> 314400 | C1509: =HLOOKUP(Sheet1!R2C1,Sheet1!R2C1:R49C1,INT(MOD(RC1,1000)/62)*16+RC[10],FALSE) -> 314400 | D1509: =HLOOKUP(Sheet1!R2C1,Sheet1!R2C1:R49C1,INT(MOD(RC1,1000)/62)*16+RC[10],FALSE) -> 314300 | E1509: =HLOOKUP(Sheet1!R2C1,Sheet1!R2C1:R49C1,INT(MOD(RC1,1000)/62)*16+RC[10],FALSE) -> 314010 | F1509: =HLOOKUP(Sheet1!R2C1,Sheet1!R2C1:R49C1,INT(MOD(RC1,1000)/62)*16+RC[10],FALSE) -> 313010 | G1509: =HLOOKUP(Sheet1!R2C1,Sheet1!R2C1:R49C1,INT(MOD(RC1,1000)/62)*16+RC[10],FALSE) -> 313410 | K1509: 1 | M1509: =R[-62]C -> 4 | N1509: =R[-62]C -> 5 | O1509: =R[-62]C -> 6 | P1509: =R[-62]C -> 1 | Q1509: =R[-62]C -> 2
A1510: 30066 | B1510: =RC[1] -> 314300 | C1510: =HLOOKUP(Sheet1!R2C1,Sheet1!R2C1:R49C1,INT(MOD(RC1,1000)/62)*16+RC[10],FALSE) -> 314300 | D1510: =HLOOKUP(Sheet1!R2C1,Sheet1!R2C1:R49C1,INT(MOD(RC1,1000)/62)*16+RC[10],FALSE) -> 314010 | E1510: =HLOOKUP(Sheet1!R2C1,Sheet1!R2C1:R49C1,INT(MOD(RC1,1000)/62)*16+RC[10],FALSE) -> 313010 | F1510: =HLOOKUP(Sheet1!R2C1,Sheet1!R2C1:R49C1,INT(MOD(RC1,1000)/62)*16+RC[10],FALSE) -> 313410 | G1510: =HLOOKUP(Sheet1!R2C1,Sheet1!R2C1:R49C1,INT(MOD(RC1,1000)/62)*16+RC[10],FALSE) -> 314000 | K1510: 1 | M1510: =R[-62]C -> 5 | N1510: =R[-62]C -> 6 | O1510: =R[-62]C -> 1 | P1510: =R[-62]C -> 2 | Q1510: =R[-62]C -> 3
A1511: 30067 | B1511: =RC[1] -> 314010 | C1511: =HLOOKUP(Sheet1!R2C1,Sheet1!R2C1:R49C1,INT(MOD(RC1,1000)/62)*16+RC[10],FALSE) -> 314010 | D1511: =HLOOKUP(Sheet1!R2C1,Sheet1!R2C1:R49C1,INT(MOD(RC1,1000)/62)*16+RC[10],FALSE) -> 313010 | E1511: =HLOOKUP(Sheet1!R2C1,Sheet1!R2C1:R49C1,INT(MOD(RC1,1000)/62)*16+RC[10],FALSE) -> 313410 | F1511: =HLOOKUP(Sheet1!R2C1,Sheet1!R2C1:R49C1,INT(MOD(RC1,1000)/62)*16+RC[10],FALSE) -> 314000 | G1511: =HLOOKUP(Sheet1!R2C1,Sheet1!R2C1:R49C1,INT(MOD(RC1,1000)/62)*16+RC[10],FALSE) -> 314400 | K1511: 1 | M1511: =R[-62]C -> 6 | N1511: =R[-62]C -> 1 | O1511: =R[-62]C -> 2 | P1511: =R[-62]C -> 3 | Q1511: =R[-62]C -> 4
A1512: 30068 | B1512: =RC[1] -> 314310 | C1512: =HLOOKUP(Sheet1!R2C1,Sheet1!R2C1:R49C1,INT(MOD(RC1,1000)/62)*16+RC[10],FALSE) -> 314310 | D1512: =HLOOKUP(Sheet1!R2C1,Sheet1!R2C1:R49C1,INT(MOD(RC1,1000)/62)*16+RC[10],FALSE) -> 314020 | E1512: =HLOOKUP(Sheet1!R2C1,Sheet1!R2C1:R49C1,INT(MOD(RC1,1000)/62)*16+RC[10],FALSE) -> 314030 | F1512: =HLOOKUP(Sheet1!R2C1,Sheet1!R2C1:R49C1,INT(MOD(RC1,1000)/62)*16+RC[10],FALSE) -> 314200 | G1512: =HLOOKUP(Sheet1!R2C1,Sheet1!R2C1:R49C1,INT(MOD(RC1,1000)/62)*16+RC[10],FALSE) -> 314380 | K1512: 1 | M1512: =R[-62]C -> 7 | N1512: =R[-62]C -> 8 | O1512: =R[-62]C -> 9 | P1512: =R[-62]C -> 10 | Q1512: =R[-62]C -> 11
A1513: 30069 | B1513: =RC[1] -> 314310 | C1513: =HLOOKUP(Sheet1!R2C1,Sheet1!R2C1:R49C1,INT(MOD(RC1,1000)/62)*16+RC[10],FALSE) -> 314310 | D1513: =HLOOKUP(Sheet1!R2C1,Sheet1!R2C1:R49C1,INT(MOD(RC1,1000)/62)*16+RC[10],FALSE) -> 314020 | E1513: =HLOOKUP(Sheet1!R2C1,Sheet1!R2C1:R49C1,INT(MOD(RC1,1000)/62)*16+RC[10],FALSE) -> 314030 | F1513: =HLOOKUP(Sheet1!R2C1,Sheet1!R2C1:R49C1,INT(MOD(RC1,1000)/62)*16+RC[10],FALSE) -> 314200 | G1513: =HLOOKUP(Sheet1!R2C1,Sheet1!R2C1:R49C1,INT(MOD(RC1,1000)/62)*16+RC[10],FALSE) -> 314100 | K1513: 1 | M1513: =R[-62]C -> 7 | N1513: =R[-62]C -> 8 | O1513: =R[-62]C -> 9 | P1513: =R[-62]C -> 10 | Q1513: =R[-62]C -> 12
A1514: 30070 | B1514: =RC[1] -> 314310 | C1514: =HLOOKUP(Sheet1!R2C1,Sheet1!R2C1:R49C1,INT(MOD(RC1,1000)/62)*16+RC[10],FALSE) -> 314310 | D1514: =HLOOKUP(Sheet1!R2C1,Sheet1!R2C1:R49C1,INT(MOD(RC1,1000)/62)*16+RC[10],FALSE) -> 314020 | E1514: =HLOOKUP(Sheet1!R2C1,Sheet1!R2C1:R49C1,INT(MOD(RC1,1000)/62)*16+RC[10],FALSE) -> 314030 | F1514: =HLOOKUP(Sheet1!R2C1,Sheet1!R2C1:R49C1,INT(MOD(RC1,1000)/62)*16+RC[10],FALSE) -> 314200 | G1514: =HLOOKUP(Sheet1!R2C1,Sheet1!R2C1:R49C1,INT(MOD(RC1,1000)/62)*16+RC[10],FALSE) -> 314080 | K1514: 1 | M1514: =R[-62]C -> 7 | N1514: =R[-62]C -> 8 | O1514: =R[-62]C -> 9 | P1514: =R[-62]C -> 10 | Q1514: =R[-62]C -> 13
A1515: 30071 | B1515: =RC[1] -> 314310 | C1515: =HLOOKUP(Sheet1!R2C1,Sheet1!R2C1:R49C1,INT(MOD(RC1,1000)/62)*16+RC[10],FALSE) -> 314310 | D1515: =HLOOKUP(Sheet1!R2C1,Sheet1!R2C1:R49C1,INT(MOD(RC1,1000)/62)*16+RC[10],FALSE) -> 314020 | E1515: =HLOOKUP(Sheet1!R2C1,Sheet1!R2C1:R49C1,INT(MOD(RC1,1000)/62)*16+RC[10],FALSE) -> 314030 | F1515: =HLOOKUP(Sheet1!R2C1,Sheet1!R2C1:R49C1,INT(MOD(RC1,1000)/62)*16+RC[10],FALSE) -> 314200 | G1515: =HLOOKUP(Sheet1!R2C1,Sheet1!R2C1:R49C1,INT(MOD(RC1,1000)/62)*16+RC[10],FALSE) -> 314410 | K1515: 1 | M1515: =R[-62]C -> 7 | N1515: =R[-62]C -> 8 | O1515: =R[-62]C -> 9 | P1515: =R[-62]C -> 10 | Q1515: =R[-62]C -> 14
A1516: 30072 | B1516: =RC[1] -> 314310 | C1516: =HLOOKUP(Sheet1!R2C1,Sheet1!R2C1:R49C1,INT(MOD(RC1,1000)/62)*16+RC[10],FALSE) -> 314310 | D1516: =HLOOKUP(Sheet1!R2C1,Sheet1!R2C1:R49C1,INT(MOD(RC1,1000)/62)*16+RC[10],FALSE) -> 314020 | E1516: =HLOOKUP(Sheet1!R2C1,Sheet1!R2C1:R49C1,INT(MOD(RC1,1000)/62)*16+RC[10],FALSE) -> 314030 | F1516: =HLOOKUP(Sheet1!R2C1,Sheet1!R2C1:R49C1,INT(MOD(RC1,1000)/62)*16+RC[10],FALSE) -> 314380 | G1516: =HLOOKUP(Sheet1!R2C1,Sheet1!R2C1:R49C1,INT(MOD(RC1,1000)/62)*16+RC[10],FALSE) -> 314100 | K1516: 1 | M1516: =R[-62]C -> 7 | N1516: =R[-62]C -> 8 | O1516: =R[-62]C -> 9 | P1516: =R[-62]C -> 11 | Q1516: =R[-62]C -> 12
A1517: 30073 | B1517: =RC[1] -> 314310 | C1517: =HLOOKUP(Sheet1!R2C1,Sheet1!R2C1:R49C1,INT(MOD(RC1,1000)/62)*16+RC[10],FALSE) -> 314310 | D1517: =HLOOKUP(Sheet1!R2C1,Sheet1!R2C1:R49C1,INT(MOD(RC1,1000)/62)*16+RC[10],FALSE) -> 314020 | E1517: =HLOOKUP(Sheet1!R2C1,Sheet1!R2C1:R49C1,INT(MOD(RC1,1000)/62)*16+RC[10],FALSE) -> 314030 | F1517: =HLOOKUP(Sheet1!R2C1,Sheet1!R2C1:R49C1,INT(MOD(RC1,1000)/62)*16+RC[10],FALSE) -> 314380 | G1517: =HLOOKUP(Sheet1!R2C1,Sheet1!R2C1:R49C1,INT(MOD(RC1,1000)/62)*16+RC[10],FALSE) -> 314080 | K1517: 1 | M1517: =R[-62]C -> 7 | N1517: =R[-62]C -> 8 | O1517: =R[-62]C -> 9 | P1517: =R[-62]C -> 11 | Q1517: =R[-62]C -> 13
A1518: 30074 | B1518: =RC[1] -> 314310 | C1518: =HLOOKUP(Sheet1!R2C1,Sheet1!R2C1:R49C1,INT(MOD(RC1,1000)/62)*16+RC[10],FALSE) -> 314310 | D1518: =HLOOKUP(Sheet1!R2C1,Sheet1!R2C1:R49C1,INT(MOD(RC1,1000)/62)*16+RC[10],FALSE) -> 314020 | E1518: =HLOOKUP(Sheet1!R2C1,Sheet1!R2C1:R49C1,INT(MOD(RC1,1000)/62)*16+RC[10],FALSE) -> 314030 | F1518: =HLOOKUP(Sheet1!R2C1,Sheet1!R2C1:R49C1,INT(MOD(RC1,1000)/62)*16+RC[10],FALSE) -> 314380 | G1518: =HLOOKUP(Sheet1!R2C1,Sheet1!R2C1:R49C1,INT(MOD(RC1,1000)/62)*16+RC[10],FALSE) -> 314410 | K1518: 1 | M1518: =R[-62]C -> 7 | N1518: =R[-62]C -> 8 | O1518: =R[-62]C -> 9 | P1518: =R[-62]C -> 11 | Q1518: =R[-62]C -> 14
A1519: 30075 | B1519: =RC[1] -> 314310 | C1519: =HLOOKUP(Sheet1!R2C1,Sheet1!R2C1:R49C1,INT(MOD(RC1,1000)/62)*16+RC[10],FALSE) -> 314310 | D1519: =HLOOKUP(Sheet1!R2C1,Sheet1!R2C1:R49C1,INT(MOD(RC1,1000)/62)*16+RC[10],FALSE) -> 314020 | E1519: =HLOOKUP(Sheet1!R2C1,Sheet1!R2C1:R49C1,INT(MOD(RC1,1000)/62)*16+RC[10],FALSE) -> 314030 | F1519: =HLOOKUP(Sheet1!R2C1,Sheet1!R2C1:R49C1,INT(MOD(RC1,1000)/62)*16+RC[10],FALSE) -> 314100 | G1519: =HLOOKUP(Sheet1!R2C1,Sheet1!R2C1:R49C1,INT(MOD(RC1,1000)/62)*16+RC[10],FALSE) -> 314080 | K1519: 1 | M1519: =R[-62]C -> 7 | N1519: =R[-62]C -> 8 | O1519: =R[-62]C -> 9 | P1519: =R[-62]C -> 12 | Q1519: =R[-62]C -> 13
A1520: 30076 | B1520: =RC[1] -> 314310 | C1520: =HLOOKUP(Sheet1!R2C1,Sheet1!R2C1:R49C1,INT(MOD(RC1,1000)/62)*16+RC[10],FALSE) -> 314310 | D1520: =HLOOKUP(Sheet1!R2C1,Sheet1!R2C1:R49C1,INT(MOD(RC1,1000)/62)*16+RC[10],FALSE) -> 314020 | E1520: =HLOOKUP(Sheet1!R2C1,Sheet1!R2C1:R49C1,INT(MOD(RC1,1000)/62)*16+RC[10],FALSE) -> 314030 | F1520: =HLOOKUP(Sheet1!R2C1,Sheet1!R2C1:R49C1,INT(MOD(RC1,1000)/62)*16+RC[10],FALSE) -> 314100 | G1520: =HLOOKUP(Sheet1!R2C1,Sheet1!R2C1:R49C1,INT(MOD(RC1,1000)/62)*16+RC[10],FALSE) -> 314410 | K1520: 1 | M1520: =R[-62]C -> 7 | N1520: =R[-62]C -> 8 | O1520: =R[-62]C -> 9 | P1520: =R[-62]C -> 12 | Q1520: =R[-62]C -> 14
A1521: 30077 | B1521: =RC[1] -> 314310 | C1521: =HLOOKUP(Sheet1!R2C1,Sheet1!R2C1:R49C1,INT(MOD(RC1,1000)/62)*16+RC[10],FALSE) -> 314310 | D1521: =HLOOKUP(Sheet1!R2C1,Sheet1!R2C1:R49C1,INT(MOD(RC1,1000)/62)*16+RC[10],FALSE) -> 314020 | E1521: =HLOOKUP(Sheet1!R2C1,Sheet1!R2C1:R49C1,INT(MOD(RC1,1000)/62)*16+RC[10],FALSE) -> 314030 | F1521: =HLOOKUP(Sheet1!R2C1,Sheet1!R2C1:R49C1,INT(MOD(RC1,1000)/62)*16+RC[10],FALSE) -> 314080 | G1521: =HLOOKUP(Sheet1!R2C1,Sheet1!R2C1:R49C1,INT(MOD(RC1,1000)/62)*16+RC[10],FALSE) -> 314410 | K1521: 1 | M1521: =R[-62]C -> 7 | N1521: =R[-62]C -> 8 | O1521: =R[-62]C -> 9 | P1521: =R[-62]C -> 13 | Q1521: =R[-62]C -> 14
A1522: 30078 | B1522: =RC[1] -> 314310 | C1522: =HLOOKUP(Sheet1!R2C1,Sheet1!R2C1:R49C1,INT(MOD(RC1,1000)/62)*16+RC[10],FALSE) -> 314310 | D1522: =HLOOKUP(Sheet1!R2C1,Sheet1!R2C1:R49C1,INT(MOD(RC1,1000)/62)*16+RC[10],FALSE) -> 314020 | E1522: =HLOOKUP(Sheet1!R2C1,Sheet1!R2C1:R49C1,INT(MOD(RC1,1000)/62)*16+RC[10],FALSE) -> 314200 | F1522: =HLOOKUP(Sheet1!R2C1,Sheet1!R2C1:R49C1,INT(MOD(RC1,1000)/62)*16+RC[10],FALSE) -> 314380 | G1522: =HLOOKUP(Sheet1!R2C1,Sheet1!R2C1:R49C1,INT(MOD(RC1,1000)/62)*16+RC[10],FALSE) -> 314100 | K1522: 1 | M1522: =R[-62]C -> 7 | N1522: =R[-62]C -> 8 | O1522: =R[-62]C -> 10 | P1522: =R[-62]C -> 11 | Q1522: =R[-62]C -> 12
A1523: 30079 | B1523: =RC[1] -> 314310 | C1523: =HLOOKUP(Sheet1!R2C1,Sheet1!R2C1:R49C1,INT(MOD(RC1,1000)/62)*16+RC[10],FALSE) -> 314310 | D1523: =HLOOKUP(Sheet1!R2C1,Sheet1!R2C1:R49C1,INT(MOD(RC1,1000)/62)*16+RC[10],FALSE) -> 314020 | E1523: =HLOOKUP(Sheet1!R2C1,Sheet1!R2C1:R49C1,INT(MOD(RC1,1000)/62)*16+RC[10],FALSE) -> 314200 | F1523: =HLOOKUP(Sheet1!R2C1,Sheet1!R2C1:R49C1,INT(MOD(RC1,1000)/62)*16+RC[10],FALSE) -> 314380 | G1523: =HLOOKUP(Sheet1!R2C1,Sheet1!R2C1:R49C1,INT(MOD(RC1,1000)/62)*16+RC[10],FALSE) -> 314080 | K1523: 1 | M1523: =R[-62]C -> 7 | N1523: =R[-62]C -> 8 | O1523: =R[-62]C -> 10 | P1523: =R[-62]C -> 11 | Q1523: =R[-62]C -> 13
A1524: 30080 | B1524: =RC[1] -> 314310 | C1524: =HLOOKUP(Sheet1!R2C1,Sheet1!R2C1:R49C1,INT(MOD(RC1,1000)/62)*16+RC[10],FALSE) -> 314310 | D1524: =HLOOKUP(Sheet1!R2C1,Sheet1!R2C1:R49C1,INT(MOD(RC1,1000)/62)*16+RC[10],FALSE) -> 314020 | E1524: =HLOOKUP(Sheet1!R2C1,Sheet1!R2C1:R49C1,INT(MOD(RC1,1000)/62)*16+RC[10],FALSE) -> 314200 | F1524: =HLOOKUP(Sheet1!R2C1,Sheet1!R2C1:R49C1,INT(MOD(RC1,1000)/62)*16+RC[10],FALSE) -> 314380 | G1524: =HLOOKUP(Sheet1!R2C1,Sheet1!R2C1:R49C1,INT(MOD(RC1,1000)/62)*16+RC[10],FALSE) -> 314410 | K1524: 1 | M1524: =R[-62]C -> 7 | N1524: =R[-62]C -> 8 | O1524: =R[-62]C -> 10 | P1524: =R[-62]C -> 11 | Q1524: =R[-62]C -> 14
A1525: 30081 | B1525: =RC[1] -> 314310 | C1525: =HLOOKUP(Sheet1!R2C1,Sheet1!R2C1:R49C1,INT(MOD(RC1,1000)/62)*16+RC[10],FALSE) -> 314310 | D1525: =HLOOKUP(Sheet1!R2C1,Sheet1!R2C1:R49C1,INT(MOD(RC1,1000)/62)*16+RC[10],FALSE) -> 314020 | E1525: =HLOOKUP(Sheet1!R2C1,Sheet1!R2C1:R49C1,INT(MOD(RC1,1000)/62)*16+RC[10],FALSE) -> 314200 | F1525: =HLOOKUP(Sheet1!R2C1,Sheet1!R2C1:R49C1,INT(MOD(RC1,1000)/62)*16+RC[10],FALSE) -> 314100 | G1525: =HLOOKUP(Sheet1!R2C1,Sheet1!R2C1:R49C1,INT(MOD(RC1,1000)/62)*16+RC[10],FALSE) -> 314080 | K1525: 1 | M1525: =R[-62]C -> 7 | N1525: =R[-62]C -> 8 | O1525: =R[-62]C -> 10 | P1525: =R[-62]C -> 12 | Q1525: =R[-62]C -> 13
A1526: 30082 | B1526: =RC[1] -> 314310 | C1526: =HLOOKUP(Sheet1!R2C1,Sheet1!R2C1:R49C1,INT(MOD(RC1,1000)/62)*16+RC[10],FALSE) -> 314310 | D1526: =HLOOKUP(Sheet1!R2C1,Sheet1!R2C1:R49C1,INT(MOD(RC1,1000)/62)*16+RC[10],FALSE) -> 314020 | E1526: =HLOOKUP(Sheet1!R2C1,Sheet1!R2C1:R49C1,INT(MOD(RC1,1000)/62)*16+RC[10],FALSE) -> 314200 | F1526: =HLOOKUP(Sheet1!R2C1,Sheet1!R2C1:R49C1,INT(MOD(RC1,1000)/62)*16+RC[10],FALSE) -> 314100 | G1526: =HLOOKUP(Sheet1!R2C1,Sheet1!R2C1:R49C1,INT(MOD(RC1,1000)/62)*16+RC[10],FALSE) -> 314410 | K1526: 1 | M1526: =R[-62]C -> 7 | N1526: =R[-62]C -> 8 | O1526: =R[-62]C -> 10 | P1526: =R[-62]C -> 12 | Q1526: =R[-62]C -> 14
A1527: 30083 | B1527: =RC[1] -> 314310 | C1527: =HLOOKUP(Sheet1!R2C1,Sheet1!R2C1:R49C1,INT(MOD(RC1,1000)/62)*16+RC[10],FALSE) -> 314310 | D1527: =HLOOKUP(Sheet1!R2C1,Sheet1!R2C1:R49C1,INT(MOD(RC1,1000)/62)*16+RC[10],FALSE) -> 314020 | E1527: =HLOOKUP(Sheet1!R2C1,Sheet1!R2C1:R49C1,INT(MOD(RC1,1000)/62)*16+RC[10],FALSE) -> 314200 | F1527: =HLOOKUP(Sheet1!R2C1,Sheet1!R2C1:R49C1,INT(MOD(RC1,1000)/62)*16+RC[10],FALSE) -> 314080 | G1527: =HLOOKUP(Sheet1!R2C1,Sheet1!R2C1:R49C1,INT(MOD(RC1,1000)/62)*16+RC[10],FALSE) -> 314410 | K1527: 1 | M1527: =R[-62]C -> 7 | N1527: =R[-62]C -> 8 | O1527: =R[-62]C -> 10 | P1527: =R[-62]C -> 13 | Q1527: =R[-62]C -> 14
A1528: 30084 | B1528: =RC[1] -> 314310 | C1528: =HLOOKUP(Sheet1!R2C1,Sheet1!R2C1:R49C1,INT(MOD(RC1,1000)/62)*16+RC[10],FALSE) -> 314310 | D1528: =HLOOKUP(Sheet1!R2C1,Sheet1!R2C1:R49C1,INT(MOD(RC1,1000)/62)*16+RC[10],FALSE) -> 314020 | E1528: =HLOOKUP(Sheet1!R2C1,Sheet1!R2C1:R49C1,INT(MOD(RC1,1000)/62)*16+RC[10],FALSE) -> 314380 | F1528: =HLOOKUP(Sheet1!R2C1,Sheet1!R2C1:R49C1,INT(MOD(RC1,1000)/62)*16+RC[10],FALSE) -> 314100 | G1528: =HLOOKUP(Sheet1!R2C1,Sheet1!R2C1:R49C1,INT(MOD(RC1,1000)/62)*16+RC[10],FALSE) -> 314080 | K1528: 1 | M1528: =R[-62]C -> 7 | N1528: =R[-62]C -> 8 | O1528: =R[-62]C -> 11 | P1528: =R[-62]C -> 12 | Q1528: =R[-62]C -> 13
A1529: 30085 | B1529: =RC[1] -> 314310 | C1529: =HLOOKUP(Sheet1!R2C1,Sheet1!R2C1:R49C1,INT(MOD(RC1,1000)/62)*16+RC[10],FALSE) -> 314310 | D1529: =HLOOKUP(Sheet1!R2C1,Sheet1!R2C1:R49C1,INT(MOD(RC1,1000)/62)*16+RC[10],FALSE) -> 314020 | E1529: =HLOOKUP(Sheet1!R2C1,Sheet1!R2C1:R49C1,INT(MOD(RC1,1000)/62)*16+RC[10],FALSE) -> 314380 | F1529: =HLOOKUP(Sheet1!R2C1,Sheet1!R2C1:R49C1,INT(MOD(RC1,1000)/62)*16+RC[10],FALSE) -> 314100 | G1529: =HLOOKUP(Sheet1!R2C1,Sheet1!R2C1:R49C1,INT(MOD(RC1,1000)/62)*16+RC[10],FALSE) -> 314410 | K1529: 1 | M1529: =R[-62]C -> 7 | N1529: =R[-62]C -> 8 | O1529: =R[-62]C -> 11 | P1529: =R[-62]C -> 12 | Q1529: =R[-62]C -> 14
A1530: 30086 | B1530: =RC[1] -> 314310 | C1530: =HLOOKUP(Sheet1!R2C1,Sheet1!R2C1:R49C1,INT(MOD(RC1,1000)/62)*16+RC[10],FALSE) -> 314310 | D1530: =HLOOKUP(Sheet1!R2C1,Sheet1!R2C1:R49C1,INT(MOD(RC1,1000)/62)*16+RC[10],FALSE) -> 314020 | E1530: =HLOOKUP(Sheet1!R2C1,Sheet1!R2C1:R49C1,INT(MOD(RC1,1000)/62)*16+RC[10],FALSE) -> 314380 | F1530: =HLOOKUP(Sheet1!R2C1,Sheet1!R2C1:R49C1,INT(MOD(RC1,1000)/62)*16+RC[10],FALSE) -> 314080 | G1530: =HLOOKUP(Sheet1!R2C1,Sheet1!R2C1:R49C1,INT(MOD(RC1,1000)/62)*16+RC[10],FALSE) -> 314410 | K1530: 1 | M1530: =R[-62]C -> 7 | N1530: =R[-62]C -> 8 | O1530: =R[-62]C -> 11 | P1530: =R[-62]C -> 13 | Q1530: =R[-62]C -> 14
A1531: 30087 | B1531: =RC[1] -> 314310 | C1531: =HLOOKUP(Sheet1!R2C1,Sheet1!R2C1:R49C1,INT(MOD(RC1,1000)/62)*16+RC[10],FALSE) -> 314310 | D1531: =HLOOKUP(Sheet1!R2C1,Sheet1!R2C1:R49C1,INT(MOD(RC1,1000)/62)*16+RC[10],FALSE) -> 314020 | E1531: =HLOOKUP(Sheet1!R2C1,Sheet1!R2C1:R49C1,INT(MOD(RC1,1000)/62)*16+RC[10],FALSE) -> 314100 | F1531: =HLOOKUP(Sheet1!R2C1,Sheet1!R2C1:R49C1,INT(MOD(RC1,1000)/62)*16+RC[10],FALSE) -> 314080 | G1531: =HLOOKUP(Sheet1!R2C1,Sheet1!R2C1:R49C1,INT(MOD(RC1,1000)/62)*16+RC[10],FALSE) -> 314410 | K1531: 1 | M1531: =R[-62]C -> 7 | N1531: =R[-62]C -> 8 | O1531: =R[-62]C -> 12 | P1531: =R[-62]C -> 13 | Q1531: =R[-62]C -> 14
A1532: 30088 | B1532: =RC[1] -> 314310 | C1532: =HLOOKUP(Sheet1!R2C1,Sheet1!R2C1:R49C1,INT(MOD(RC1,1000)/62)*16+RC[10],FALSE) -> 314310 | D1532: =HLOOKUP(Sheet1!R2C1,Sheet1!R2C1:R49C1,INT(MOD(RC1,1000)/62)*16+RC[10],FALSE) -> 314030 | E1532: =HLOOKUP(Sheet1!R2C1,Sheet1!R2C1:R49C1,INT(MOD(RC1,1000)/62)*16+RC[10],FALSE) -> 314200 | F1532: =HLOOKUP(Sheet1!R2C1,Sheet1!R2C1:R49C1,INT(MOD(RC1,1000)/62)*16+RC[10],FALSE) -> 314380 | G1532: =HLOOKUP(Sheet1!R2C1,Sheet1!R2C1:R49C1,INT(MOD(RC1,1000)/62)*16+RC[10],FALSE) -> 314100 | K1532: 1 | M1532: =R[-62]C -> 7 | N1532: =R[-62]C -> 9 | O1532: =R[-62]C -> 10 | P1532: =R[-62]C -> 11 | Q1532: =R[-62]C -> 12
A1533: 30089 | B1533: =RC[1] -> 314310 | C1533: =HLOOKUP(Sheet1!R2C1,Sheet1!R2C1:R49C1,INT(MOD(RC1,1000)/62)*16+RC[10],FALSE) -> 314310 | D1533: =HLOOKUP(Sheet1!R2C1,Sheet1!R2C1:R49C1,INT(MOD(RC1,1000)/62)*16+RC[10],FALSE) -> 314030 | E1533: =HLOOKUP(Sheet1!R2C1,Sheet1!R2C1:R49C1,INT(MOD(RC1,1000)/62)*16+RC[10],FALSE) -> 314200 | F1533: =HLOOKUP(Sheet1!R2C1,Sheet1!R2C1:R49C1,INT(MOD(RC1,1000)/62)*16+RC[10],FALSE) -> 314380 | G1533: =HLOOKUP(Sheet1!R2C1,Sheet1!R2C1:R49C1,INT(MOD(RC1,1000)/62)*16+RC[10],FALSE) -> 314080 | K1533: 1 | M1533: =R[-62]C -> 7 | N1533: =R[-62]C -> 9 | O1533: =R[-62]C -> 10 | P1533: =R[-62]C -> 11 | Q1533: =R[-62]C -> 13
A1534: 30090 | B1534: =RC[1] -> 314310 | C1534: =HLOOKUP(Sheet1!R2C1,Sheet1!R2C1:R49C1,INT(MOD(RC1,1000)/62)*16+RC[10],FALSE) -> 314310 | D1534: =HLOOKUP(Sheet1!R2C1,Sheet1!R2C1:R49C1,INT(MOD(RC1,1000)/62)*16+RC[10],FALSE) -> 314030 | E1534: =HLOOKUP(Sheet1!R2C1,Sheet1!R2C1:R49C1,INT(MOD(RC1,1000)/62)*16+RC[10],FALSE) -> 314200 | F1534: =HLOOKUP(Sheet1!R2C1,Sheet1!R2C1:R49C1,INT(MOD(RC1,1000)/62)*16+RC[10],FALSE) -> 314380 | G1534: =HLOOKUP(Sheet1!R2C1,Sheet1!R2C1:R49C1,INT(MOD(RC1,1000)/62)*16+RC[10],FALSE) -> 314410 | K1534: 1 | M1534: =R[-62]C -> 7 | N1534: =R[-62]C -> 9 | O1534: =R[-62]C -> 10 | P1534: =R[-62]C -> 11 | Q1534: =R[-62]C -> 14
A1535: 30091 | B1535: =RC[1] -> 314310 | C1535: =HLOOKUP(Sheet1!R2C1,Sheet1!R2C1:R49C1,INT(MOD(RC1,1000)/62)*16+RC[10],FALSE) -> 314310 | D1535: =HLOOKUP(Sheet1!R2C1,Sheet1!R2C1:R49C1,INT(MOD(RC1,1000)/62)*16+RC[10],FALSE) -> 314030 | E1535: =HLOOKUP(Sheet1!R2C1,Sheet1!R2C1:R49C1,INT(MOD(RC1,1000)/62)*16+RC[10],FALSE) -> 314200 | F1535: =HLOOKUP(Sheet1!R2C1,Sheet1!R2C1:R49C1,INT(MOD(RC1,1000)/62)*16+RC[10],FALSE) -> 314100 | G1535: =HLOOKUP(Sheet1!R2C1,Sheet1!R2C1:R49C1,INT(MOD(RC1,1000)/62)*16+RC[10],FALSE) -> 314080 | K1535: 1 | M1535: =R[-62]C -> 7 | N1535: =R[-62]C -> 9 | O1535: =R[-62]C -> 10 | P1535: =R[-62]C -> 12 | Q1535: =R[-62]C -> 13
A1536: 30092 | B1536: =RC[1] -> 314310 | C1536: =HLOOKUP(Sheet1!R2C1,Sheet1!R2C1:R49C1,INT(MOD(RC1,1000)/62)*16+RC[10],FALSE) -> 314310 | D1536: =HLOOKUP(Sheet1!R2C1,Sheet1!R2C1:R49C1,INT(MOD(RC1,1000)/62)*16+RC[10],FALSE) -> 314030 | E1536: =HLOOKUP(Sheet1!R2C1,Sheet1!R2C1:R49C1,INT(MOD(RC1,1000)/62)*16+RC[10],FALSE) -> 314200 | F1536: =HLOOKUP(Sheet1!R2C1,Sheet1!R2C1:R49C1,INT(MOD(RC1,1000)/62)*16+RC[10],FALSE) -> 314100 | G1536: =HLOOKUP(Sheet1!R2C1,Sheet1!R2C1:R49C1,INT(MOD(RC1,1000)/62)*16+RC[10],FALSE) -> 314410 | K1536: 1 | M1536: =R[-62]C -> 7 | N1536: =R[-62]C -> 9 | O1536: =R[-62]C -> 10 | P1536: =R[-62]C -> 12 | Q1536: =R[-62]C -> 14
A1537: 30093 | B1537: =RC[1] -> 314310 | C1537: =HLOOKUP(Sheet1!R2C1,Sheet1!R2C1:R49C1,INT(MOD(RC1,1000)/62)*16+RC[10],FALSE) -> 314310 | D1537: =HLOOKUP(Sheet1!R2C1,Sheet1!R2C1:R49C1,INT(MOD(RC1,1000)/62)*16+RC[10],FALSE) -> 314030 | E1537: =HLOOKUP(Sheet1!R2C1,Sheet1!R2C1:R49C1,INT(MOD(RC1,1000)/62)*16+RC[10],FALSE) -> 314200 | F1537: =HLOOKUP(Sheet1!R2C1,Sheet1!R2C1:R49C1,INT(MOD(RC1,1000)/62)*16+RC[10],FALSE) -> 314080 | G1537: =HLOOKUP(Sheet1!R2C1,Sheet1!R2C1:R49C1,INT(MOD(RC1,1000)/62)*16+RC[10],FALSE) -> 314410 | K1537: 1 | M1537: =R[-62]C -> 7 | N1537: =R[-62]C -> 9 | O1537: =R[-62]C -> 10 | P1537: =R[-62]C -> 13 | Q1537: =R[-62]C -> 14
A1538: 30094 | B1538: =RC[1] -> 314310 | C1538: =HLOOKUP(Sheet1!R2C1,Sheet1!R2C1:R49C1,INT(MOD(RC1,1000)/62)*16+RC[10],FALSE) -> 314310 | D1538: =HLOOKUP(Sheet1!R2C1,Sheet1!R2C1:R49C1,INT(MOD(RC1,1000)/62)*16+RC[10],FALSE) -> 314030 | E1538: =HLOOKUP(Sheet1!R2C1,Sheet1!R2C1:R49C1,INT(MOD(RC1,1000)/62)*16+RC[10],FALSE) -> 314380 | F1538: =HLOOKUP(Sheet1!R2C1,Sheet1!R2C1:R49C1,INT(MOD(RC1,1000)/62)*16+RC[10],FALSE) -> 314100 | G1538: =HLOOKUP(Sheet1!R2C1,Sheet1!R2C1:R49C1,INT(MOD(RC1,1000)/62)*16+RC[10],FALSE) -> 314080 | K1538: 1 | M1538: =R[-62]C -> 7 | N1538: =R[-62]C -> 9 | O1538: =R[-62]C -> 11 | P1538: =R[-62]C -> 12 | Q1538: =R[-62]C -> 13
A1539: 30095 | B1539: =RC[1] -> 314310 | C1539: =HLOOKUP(Sheet1!R2C1,Sheet1!R2C1:R49C1,INT(MOD(RC1,1000)/62)*16+RC[10],FALSE) -> 314310 | D1539: =HLOOKUP(Sheet1!R2C1,Sheet1!R2C1:R49C1,INT(MOD(RC1,1000)/62)*16+RC[10],FALSE) -> 314030 | E1539: =HLOOKUP(Sheet1!R2C1,Sheet1!R2C1:R49C1,INT(MOD(RC1,1000)/62)*16+RC[10],FALSE) -> 314380 | F1539: =HLOOKUP(Sheet1!R2C1,Sheet1!R2C1:R49C1,INT(MOD(RC1,1000)/62)*16+RC[10],FALSE) -> 314100 | G1539: =HLOOKUP(Sheet1!R2C1,Sheet1!R2C1:R49C1,INT(MOD(RC1,1000)/62)*16+RC[10],FALSE) -> 314410 | K1539: 1 | M1539: =R[-62]C -> 7 | N1539: =R[-62]C -> 9 | O1539: =R[-62]C -> 11 | P1539: =R[-62]C -> 12 | Q1539: =R[-62]C -> 14
A1540: 30096 | B1540: =RC[1] -> 314310 | C1540: =HLOOKUP(Sheet1!R2C1,Sheet1!R2C1:R49C1,INT(MOD(RC1,1000)/62)*16+RC[10],FALSE) -> 314310 | D1540: =HLOOKUP(Sheet1!R2C1,Sheet1!R2C1:R49C1,INT(MOD(RC1,1000)/62)*16+RC[10],FALSE) -> 314030 | E1540: =HLOOKUP(Sheet1!R2C1,Sheet1!R2C1:R49C1,INT(MOD(RC1,1000)/62)*16+RC[10],FALSE) -> 314380 | F1540: =HLOOKUP(Sheet1!R2C1,Sheet1!R2C1:R49C1,INT(MOD(RC1,1000)/62)*16+RC[10],FALSE) -> 314080 | G1540: =HLOOKUP(Sheet1!R2C1,Sheet1!R2C1:R49C1,INT(MOD(RC1,1000)/62)*16+RC[10],FALSE) -> 314410 | K1540: 1 | M1540: =R[-62]C -> 7 | N1540: =R[-62]C -> 9 | O1540: =R[-62]C -> 11 | P1540: =R[-62]C -> 13 | Q1540: =R[-62]C -> 14
A1541: 30097 | B1541: =RC[1] -> 314310 | C1541: =HLOOKUP(Sheet1!R2C1,Sheet1!R2C1:R49C1,INT(MOD(RC1,1000)/62)*16+RC[10],FALSE) -> 314310 | D1541: =HLOOKUP(Sheet1!R2C1,Sheet1!R2C1:R49C1,INT(MOD(RC1,1000)/62)*16+RC[10],FALSE) -> 314030 | E1541: =HLOOKUP(Sheet1!R2C1,Sheet1!R2C1:R49C1,INT(MOD(RC1,1000)/62)*16+RC[10],FALSE) -> 314100 | F1541: =HLOOKUP(Sheet1!R2C1,Sheet1!R2C1:R49C1,INT(MOD(RC1,1000)/62)*16+RC[10],FALSE) -> 314080 | G1541: =HLOOKUP(Sheet1!R2C1,Sheet1!R2C1:R49C1,INT(MOD(RC1,1000)/62)*16+RC[10],FALSE) -> 314410 | K1541: 1 | M1541: =R[-62]C -> 7 | N1541: =R[-62]C -> 9 | O1541: =R[-62]C -> 12 | P1541: =R[-62]C -> 13 | Q1541: =R[-62]C -> 14
A1542: 30098 | B1542: =RC[1] -> 314310 | C1542: =HLOOKUP(Sheet1!R2C1,Sheet1!R2C1:R49C1,INT(MOD(RC1,1000)/62)*16+RC[10],FALSE) -> 314310 | D1542: =HLOOKUP(Sheet1!R2C1,Sheet1!R2C1:R49C1,INT(MOD(RC1,1000)/62)*16+RC[10],FALSE) -> 314200 | E1542: =HLOOKUP(Sheet1!R2C1,Sheet1!R2C1:R49C1,INT(MOD(RC1,1000)/62)*16+RC[10],FALSE) -> 314380 | F1542: =HLOOKUP(Sheet1!R2C1,Sheet1!R2C1:R49C1,INT(MOD(RC1,1000)/62)*16+RC[10],FALSE) -> 314100 | G1542: =HLOOKUP(Sheet1!R2C1,Sheet1!R2C1:R49C1,INT(MOD(RC1,1000)/62)*16+RC[10],FALSE) -> 314080 | K1542: 1 | M1542: =R[-62]C -> 7 | N1542: =R[-62]C -> 10 | O1542: =R[-62]C -> 11 | P1542: =R[-62]C -> 12 | Q1542: =R[-62]C -> 13
A1543: 30099 | B1543: =RC[1] -> 314310 | C1543: =HLOOKUP(Sheet1!R2C1,Sheet1!R2C1:R49C1,INT(MOD(RC1,1000)/62)*16+RC[10],FALSE) -> 314310 | D1543: =HLOOKUP(Sheet1!R2C1,Sheet1!R2C1:R49C1,INT(MOD(RC1,1000)/62)*16+RC[10],FALSE) -> 314200 | E1543: =HLOOKUP(Sheet1!R2C1,Sheet1!R2C1:R49C1,INT(MOD(RC1,1000)/62)*16+RC[10],FALSE) -> 314380 | F1543: =HLOOKUP(Sheet1!R2C1,Sheet1!R2C1:R49C1,INT(MOD(RC1,1000)/62)*16+RC[10],FALSE) -> 314100 | G1543: =HLOOKUP(Sheet1!R2C1,Sheet1!R2C1:R49C1,INT(MOD(RC1,1000)/62)*16+RC[10],FALSE) -> 314410 | K1543: 1 | M1543: =R[-62]C -> 7 | N1543: =R[-62]C -> 10 | O1543: =R[-62]C -> 11 | P1543: =R[-62]C -> 12 | Q1543: =R[-62]C -> 14
A1544: 30100 | B1544: =RC[1] -> 314310 | C1544: =HLOOKUP(Sheet1!R2C1,Sheet1!R2C1:R49C1,INT(MOD(RC1,1000)/62)*16+RC[10],FALSE) -> 314310 | D1544: =HLOOKUP(Sheet1!R2C1,Sheet1!R2C1:R49C1,INT(MOD(RC1,1000)/62)*16+RC[10],FALSE) -> 314200 | E1544: =HLOOKUP(Sheet1!R2C1,Sheet1!R2C1:R49C1,INT(MOD(RC1,1000)/62)*16+RC[10],FALSE) -> 314380 | F1544: =HLOOKUP(Sheet1!R2C1,Sheet1!R2C1:R49C1,INT(MOD(RC1,1000)/62)*16+RC[10],FALSE) -> 314080 | G1544: =HLOOKUP(Sheet1!R2C1,Sheet1!R2C1:R49C1,INT(MOD(RC1,1000)/62)*16+RC[10],FALSE) -> 314410 | K1544: 1 | M1544: =R[-62]C -> 7 | N1544: =R[-62]C -> 10 | O1544: =R[-62]C -> 11 | P1544: =R[-62]C -> 13 | Q1544: =R[-62]C -> 14
A1545: 30101 | B1545: =RC[1] -> 314310 | C1545: =HLOOKUP(Sheet1!R2C1,Sheet1!R2C1:R49C1,INT(MOD(RC1,1000)/62)*16+RC[10],FALSE) -> 314310 | D1545: =HLOOKUP(Sheet1!R2C1,Sheet1!R2C1:R49C1,INT(MOD(RC1,1000)/62)*16+RC[10],FALSE) -> 314200 | E1545: =HLOOKUP(Sheet1!R2C1,Sheet1!R2C1:R49C1,INT(MOD(RC1,1000)/62)*16+RC[10],FALSE) -> 314100 | F1545: =HLOOKUP(Sheet1!R2C1,Sheet1!R2C1:R49C1,INT(MOD(RC1,1000)/62)*16+RC[10],FALSE) -> 314080 | G1545: =HLOOKUP(Sheet1!R2C1,Sheet1!R2C1:R49C1,INT(MOD(RC1,1000)/62)*16+RC[10],FALSE) -> 314410 | K1545: 1 | M1545: =R[-62]C -> 7 | N1545: =R[-62]C -> 10 | O1545: =R[-62]C -> 12 | P1545: =R[-62]C -> 13 | Q1545: =R[-62]C -> 14
A1546: 30102 | B1546: =RC[1] -> 314310 | C1546: =HLOOKUP(Sheet1!R2C1,Sheet1!R2C1:R49C1,INT(MOD(RC1,1000)/62)*16+RC[10],FALSE) -> 314310 | D1546: =HLOOKUP(Sheet1!R2C1,Sheet1!R2C1:R49C1,INT(MOD(RC1,1000)/62)*16+RC[10],FALSE) -> 314380 | E1546: =HLOOKUP(Sheet1!R2C1,Sheet1!R2C1:R49C1,INT(MOD(RC1,1000)/62)*16+RC[10],FALSE) -> 314100 | F1546: =HLOOKUP(Sheet1!R2C1,Sheet1!R2C1:R49C1,INT(MOD(RC1,1000)/62)*16+RC[10],FALSE) -> 314080 | G1546: =HLOOKUP(Sheet1!R2C1,Sheet1!R2C1:R49C1,INT(MOD(RC1,1000)/62)*16+RC[10],FALSE) -> 314410 | K1546: 1 | M1546: =R[-62]C -> 7 | N1546: =R[-62]C -> 11 | O1546: =R[-62]C -> 12 | P1546: =R[-62]C -> 13 | Q1546: =R[-62]C -> 14
A1547: 30103 | B1547: =RC[1] -> 314020 | C1547: =HLOOKUP(Sheet1!R2C1,Sheet1!R2C1:R49C1,INT(MOD(RC1,1000)/62)*16+RC[10],FALSE) -> 314020 | D1547: =HLOOKUP(Sheet1!R2C1,Sheet1!R2C1:R49C1,INT(MOD(RC1,1000)/62)*16+RC[10],FALSE) -> 314030 | E1547: =HLOOKUP(Sheet1!R2C1,Sheet1!R2C1:R49C1,INT(MOD(RC1,1000)/62)*16+RC[10],FALSE) -> 314200 | F1547: =HLOOKUP(Sheet1!R2C1,Sheet1!R2C1:R49C1,INT(MOD(RC1,1000)/62)*16+RC[10],FALSE) -> 314380 | G1547: =HLOOKUP(Sheet1!R2C1,Sheet1!R2C1:R49C1,INT(MOD(RC1,1000)/62)*16+RC[10],FALSE) -> 314100 | K1547: 1 | M1547: =R[-62]C -> 8 | N1547: =R[-62]C -> 9 | O1547: =R[-62]C -> 10 | P1547: =R[-62]C -> 11 | Q1547: =R[-62]C -> 12
A1548: 30104 | B1548: =RC[1] -> 314020 | C1548: =HLOOKUP(Sheet1!R2C1,Sheet1!R2C1:R49C1,INT(MOD(RC1,1000)/62)*16+RC[10],FALSE) -> 314020 | D1548: =HLOOKUP(Sheet1!R2C1,Sheet1!R2C1:R49C1,INT(MOD(RC1,1000)/62)*16+RC[10],FALSE) -> 314030 | E1548: =HLOOKUP(Sheet1!R2C1,Sheet1!R2C1:R49C1,INT(MOD(RC1,1000)/62)*16+RC[10],FALSE) -> 314200 | F1548: =HLOOKUP(Sheet1!R2C1,Sheet1!R2C1:R49C1,INT(MOD(RC1,1000)/62)*16+RC[10],FALSE) -> 314380 | G1548: =HLOOKUP(Sheet1!R2C1,Sheet1!R2C1:R49C1,INT(MOD(RC1,1000)/62)*16+RC[10],FALSE) -> 314080 | K1548: 1 | M1548: =R[-62]C -> 8 | N1548: =R[-62]C -> 9 | O1548: =R[-62]C -> 10 | P1548: =R[-62]C -> 11 | Q1548: =R[-62]C -> 13
A1549: 30105 | B1549: =RC[1] -> 314020 | C1549: =HLOOKUP(Sheet1!R2C1,Sheet1!R2C1:R49C1,INT(MOD(RC1,1000)/62)*16+RC[10],FALSE) -> 314020 | D1549: =HLOOKUP(Sheet1!R2C1,Sheet1!R2C1:R49C1,INT(MOD(RC1,1000)/62)*16+RC[10],FALSE) -> 314030 | E1549: =HLOOKUP(Sheet1!R2C1,Sheet1!R2C1:R49C1,INT(MOD(RC1,1000)/62)*16+RC[10],FALSE) -> 314200 | F1549: =HLOOKUP(Sheet1!R2C1,Sheet1!R2C1:R49C1,INT(MOD(RC1,1000)/62)*16+RC[10],FALSE) -> 314380 | G1549: =HLOOKUP(Sheet1!R2C1,Sheet1!R2C1:R49C1,INT(MOD(RC1,1000)/62)*16+RC[10],FALSE) -> 314410 | K1549: 1 | M1549: =R[-62]C -> 8 | N1549: =R[-62]C -> 9 | O1549: =R[-62]C -> 10 | P1549: =R[-62]C -> 11 | Q1549: =R[-62]C -> 14
A1550: 30106 | B1550: =RC[1] -> 314020 | C1550: =HLOOKUP(Sheet1!R2C1,Sheet1!R2C1:R49C1,INT(MOD(RC1,1000)/62)*16+RC[10],FALSE) -> 314020 | D1550: =HLOOKUP(Sheet1!R2C1,Sheet1!R2C1:R49C1,INT(MOD(RC1,1000)/62)*16+RC[10],FALSE) -> 314030 | E1550: =HLOOKUP(Sheet1!R2C1,Sheet1!R2C1:R49C1,INT(MOD(RC1,1000)/62)*16+RC[10],FALSE) -> 314200 | F1550: =HLOOKUP(Sheet1!R2C1,Sheet1!R2C1:R49C1,INT(MOD(RC1,1000)/62)*16+RC[10],FALSE) -> 314100 | G1550: =HLOOKUP(Sheet1!R2C1,Sheet1!R2C1:R49C1,INT(MOD(RC1,1000)/62)*16+RC[10],FALSE) -> 314080 | K1550: 1 | M1550: =R[-62]C -> 8 | N1550: =R[-62]C -> 9 | O1550: =R[-62]C -> 10 | P1550: =R[-62]C -> 12 | Q1550: =R[-62]C -> 13
A1551: 30107 | B1551: =RC[1] -> 314020 | C1551: =HLOOKUP(Sheet1!R2C1,Sheet1!R2C1:R49C1,INT(MOD(RC1,1000)/62)*16+RC[10],FALSE) -> 314020 | D1551: =HLOOKUP(Sheet1!R2C1,Sheet1!R2C1:R49C1,INT(MOD(RC1,1000)/62)*16+RC[10],FALSE) -> 314030 | E1551: =HLOOKUP(Sheet1!R2C1,Sheet1!R2C1:R49C1,INT(MOD(RC1,1000)/62)*16+RC[10],FALSE) -> 314200 | F1551: =HLOOKUP(Sheet1!R2C1,Sheet1!R2C1:R49C1,INT(MOD(RC1,1000)/62)*16+RC[10],FALSE) -> 314100 | G1551: =HLOOKUP(Sheet1!R2C1,Sheet1!R2C1:R49C1,INT(MOD(RC1,1000)/62)*16+RC[10],FALSE) -> 314410 | K1551: 1 | M1551: =R[-62]C -> 8 | N1551: =R[-62]C -> 9 | O1551: =R[-62]C -> 10 | P1551: =R[-62]C -> 12 | Q1551: =R[-62]C -> 14
A1552: 30108 | B1552: =RC[1] -> 314020 | C1552: =HLOOKUP(Sheet1!R2C1,Sheet1!R2C1:R49C1,INT(MOD(RC1,1000)/62)*16+RC[10],FALSE) -> 314020 | D1552: =HLOOKUP(Sheet1!R2C1,Sheet1!R2C1:R49C1,INT(MOD(RC1,1000)/62)*16+RC[10],FALSE) -> 314030 | E1552: =HLOOKUP(Sheet1!R2C1,Sheet1!R2C1:R49C1,INT(MOD(RC1,1000)/62)*16+RC[10],FALSE) -> 314200 | F1552: =HLOOKUP(Sheet1!R2C1,Sheet1!R2C1:R49C1,INT(MOD(RC1,1000)/62)*16+RC[10],FALSE) -> 314080 | G1552: =HLOOKUP(Sheet1!R2C1,Sheet1!R2C1:R49C1,INT(MOD(RC1,1000)/62)*16+RC[10],FALSE) -> 314410 | K1552: 1 | M1552: =R[-62]C -> 8 | N1552: =R[-62]C -> 9 | O1552: =R[-62]C -> 10 | P1552: =R[-62]C -> 13 | Q1552: =R[-62]C -> 14
A1553: 30109 | B1553: =RC[1] -> 314020 | C1553: =HLOOKUP(Sheet1!R2C1,Sheet1!R2C1:R49C1,INT(MOD(RC1,1000)/62)*16+RC[10],FALSE) -> 314020 | D1553: =HLOOKUP(Sheet1!R2C1,Sheet1!R2C1:R49C1,INT(MOD(RC1,1000)/62)*16+RC[10],FALSE) -> 314030 | E1553: =HLOOKUP(Sheet1!R2C1,Sheet1!R2C1:R49C1,INT(MOD(RC1,1000)/62)*16+RC[10],FALSE) -> 314380 | F1553: =HLOOKUP(Sheet1!R2C1,Sheet1!R2C1:R49C1,INT(MOD(RC1,1000)/62)*16+RC[10],FALSE) -> 314100 | G1553: =HLOOKUP(Sheet1!R2C1,Sheet1!R2C1:R49C1,INT(MOD(RC1,1000)/62)*16+RC[10],FALSE) -> 314080 | K1553: 1 | M1553: =R[-62]C -> 8 | N1553: =R[-62]C -> 9 | O1553: =R[-62]C -> 11 | P1553: =R[-62]C -> 12 | Q1553: =R[-62]C -> 13
A1554: 30110 | B1554: =RC[1] -> 314020 | C1554: =HLOOKUP(Sheet1!R2C1,Sheet1!R2C1:R49C1,INT(MOD(RC1,1000)/62)*16+RC[10],FALSE) -> 314020 | D1554: =HLOOKUP(Sheet1!R2C1,Sheet1!R2C1:R49C1,INT(MOD(RC1,1000)/62)*16+RC[10],FALSE) -> 314030 | E1554: =HLOOKUP(Sheet1!R2C1,Sheet1!R2C1:R49C1,INT(MOD(RC1,1000)/62)*16+RC[10],FALSE) -> 314380 | F1554: =HLOOKUP(Sheet1!R2C1,Sheet1!R2C1:R49C1,INT(MOD(RC1,1000)/62)*16+RC[10],FALSE) -> 314100 | G1554: =HLOOKUP(Sheet1!R2C1,Sheet1!R2C1:R49C1,INT(MOD(RC1,1000)/62)*16+RC[10],FALSE) -> 314410 | K1554: 1 | M1554: =R[-62]C -> 8 | N1554: =R[-62]C -> 9 | O1554: =R[-62]C -> 11 | P1554: =R[-62]C -> 12 | Q1554: =R[-62]C -> 14
A1555: 30111 | B1555: =RC[1] -> 314020 | C1555: =HLOOKUP(Sheet1!R2C1,Sheet1!R2C1:R49C1,INT(MOD(RC1,1000)/62)*16+RC[10],FALSE) -> 314020 | D1555: =HLOOKUP(Sheet1!R2C1,Sheet1!R2C1:R49C1,INT(MOD(RC1,1000)/62)*16+RC[10],FALSE) -> 314030 | E1555: =HLOOKUP(Sheet1!R2C1,Sheet1!R2C1:R49C1,INT(MOD(RC1,1000)/62)*16+RC[10],FALSE) -> 314380 | F1555: =HLOOKUP(Sheet1!R2C1,Sheet1!R2C1:R49C1,INT(MOD(RC1,1000)/62)*16+RC[10],FALSE) -> 314080 | G1555: =HLOOKUP(Sheet1!R2C1,Sheet1!R2C1:R49C1,INT(MOD(RC1,1000)/62)*16+RC[10],FALSE) -> 314410 | K1555: 1 | M1555: =R[-62]C -> 8 | N1555: =R[-62]C -> 9 | O1555: =R[-62]C -> 11 | P1555: =R[-62]C -> 13 | Q1555: =R[-62]C -> 14
A1556: 30112 | B1556: =RC[1] -> 314020 | C1556: =HLOOKUP(Sheet1!R2C1,Sheet1!R2C1:R49C1,INT(MOD(RC1,1000)/62)*16+RC[10],FALSE) -> 314020 | D1556: =HLOOKUP(Sheet1!R2C1,Sheet1!R2C1:R49C1,INT(MOD(RC1,1000)/62)*16+RC[10],FALSE) -> 314030 | E1556: =HLOOKUP(Sheet1!R2C1,Sheet1!R2C1:R49C1,INT(MOD(RC1,1000)/62)*16+RC[10],FALSE) -> 314100 | F1556: =HLOOKUP(Sheet1!R2C1,Sheet1!R2C1:R49C1,INT(MOD(RC1,1000)/62)*16+RC[10],FALSE) -> 314080 | G1556: =HLOOKUP(Sheet1!R2C1,Sheet1!R2C1:R49C1,INT(MOD(RC1,1000)/62)*16+RC[10],FALSE) -> 314410 | K1556: 1 | M1556: =R[-62]C -> 8 | N1556: =R[-62]C -> 9 | O1556: =R[-62]C -> 12 | P1556: =R[-62]C -> 13 | Q1556: =R[-62]C -> 14
A1557: 30113 | B1557: =RC[1] -> 314020 | C1557: =HLOOKUP(Sheet1!R2C1,Sheet1!R2C1:R49C1,INT(MOD(RC1,1000)/62)*16+RC[10],FALSE) -> 314020 | D1557: =HLOOKUP(Sheet1!R2C1,Sheet1!R2C1:R49C1,INT(MOD(RC1,1000)/62)*16+RC[10],FALSE) -> 314200 | E1557: =HLOOKUP(Sheet1!R2C1,Sheet1!R2C1:R49C1,INT(MOD(RC1,1000)/62)*16+RC[10],FALSE) -> 314380 | F1557: =HLOOKUP(Sheet1!R2C1,Sheet1!R2C1:R49C1,INT(MOD(RC1,1000)/62)*16+RC[10],FALSE) -> 314100 | G1557: =HLOOKUP(Sheet1!R2C1,Sheet1!R2C1:R49C1,INT(MOD(RC1,1000)/62)*16+RC[10],FALSE) -> 314080 | K1557: 1 | M1557: =R[-62]C -> 8 | N1557: =R[-62]C -> 10 | O1557: =R[-62]C -> 11 | P1557: =R[-62]C -> 12 | Q1557: =R[-62]C -> 13
A1558: 30114 | B1558: =RC[1] -> 314020 | C1558: =HLOOKUP(Sheet1!R2C1,Sheet1!R2C1:R49C1,INT(MOD(RC1,1000)/62)*16+RC[10],FALSE) -> 314020 | D1558: =HLOOKUP(Sheet1!R2C1,Sheet1!R2C1:R49C1,INT(MOD(RC1,1000)/62)*16+RC[10],FALSE) -> 314200 | E1558: =HLOOKUP(Sheet1!R2C1,Sheet1!R2C1:R49C1,INT(MOD(RC1,1000)/62)*16+RC[10],FALSE) -> 314380 | F1558: =HLOOKUP(Sheet1!R2C1,Sheet1!R2C1:R49C1,INT(MOD(RC1,1000)/62)*16+RC[10],FALSE) -> 314100 | G1558: =HLOOKUP(Sheet1!R2C1,Sheet1!R2C1:R49C1,INT(MOD(RC1,1000)/62)*16+RC[10],FALSE) -> 314410 | K1558: 1 | M1558: =R[-62]C -> 8 | N1558: =R[-62]C -> 10 | O1558: =R[-62]C -> 11 | P1558: =R[-62]C -> 12 | Q1558: =R[-62]C -> 14
A1559: 30115 | B1559: =RC[1] -> 314020 | C1559: =HLOOKUP(Sheet1!R2C1,Sheet1!R2C1:R49C1,INT(MOD(RC1,1000)/62)*16+RC[10],FALSE) -> 314020 | D1559: =HLOOKUP(Sheet1!R2C1,Sheet1!R2C1:R49C1,INT(MOD(RC1,1000)/62)*16+RC[10],FALSE) -> 314200 | E1559: =HLOOKUP(Sheet1!R2C1,Sheet1!R2C1:R49C1,INT(MOD(RC1,1000)/62)*16+RC[10],FALSE) -> 314380 | F1559: =HLOOKUP(Sheet1!R2C1,Sheet1!R2C1:R49C1,INT(MOD(RC1,1000)/62)*16+RC[10],FALSE) -> 314080 | G1559: =HLOOKUP(Sheet1!R2C1,Sheet1!R2C1:R49C1,INT(MOD(RC1,1000)/62)*16+RC[10],FALSE) -> 314410 | K1559: 1 | M1559: =R[-62]C -> 8 | N1559: =R[-62]C -> 10 | O1559: =R[-62]C -> 11 | P1559: =R[-62]C -> 13 | Q1559: =R[-62]C -> 14
A1560: 30116 | B1560: =RC[1] -> 314020 | C1560: =HLOOKUP(Sheet1!R2C1,Sheet1!R2C1:R49C1,INT(MOD(RC1,1000)/62)*16+RC[10],FALSE) -> 314020 | D1560: =HLOOKUP(Sheet1!R2C1,Sheet1!R2C1:R49C1,INT(MOD(RC1,1000)/62)*16+RC[10],FALSE) -> 314200 | E1560: =HLOOKUP(Sheet1!R2C1,Sheet1!R2C1:R49C1,INT(MOD(RC1,1000)/62)*16+RC[10],FALSE) -> 314100 | F1560: =HLOOKUP(Sheet1!R2C1,Sheet1!R2C1:R49C1,INT(MOD(RC1,1000)/62)*16+RC[10],FALSE) -> 314080 | G1560: =HLOOKUP(Sheet1!R2C1,Sheet1!R2C1:R49C1,INT(MOD(RC1,1000)/62)*16+RC[10],FALSE) -> 314410 | K1560: 1 | M1560: =R[-62]C -> 8 | N1560: =R[-62]C -> 10 | O1560: =R[-62]C -> 12 | P1560: =R[-62]C -> 13 | Q1560: =R[-62]C -> 14
A1561: 30117 | B1561: =RC[1] -> 314020 | C1561: =HLOOKUP(Sheet1!R2C1,Sheet1!R2C1:R49C1,INT(MOD(RC1,1000)/62)*16+RC[10],FALSE) -> 314020 | D1561: =HLOOKUP(Sheet1!R2C1,Sheet1!R2C1:R49C1,INT(MOD(RC1,1000)/62)*16+RC[10],FALSE) -> 314380 | E1561: =HLOOKUP(Sheet1!R2C1,Sheet1!R2C1:R49C1,INT(MOD(RC1,1000)/62)*16+RC[10],FALSE) -> 314100 | F1561: =HLOOKUP(Sheet1!R2C1,Sheet1!R2C1:R49C1,INT(MOD(RC1,1000)/62)*16+RC[10],FALSE) -> 314080 | G1561: =HLOOKUP(Sheet1!R2C1,Sheet1!R2C1:R49C1,INT(MOD(RC1,1000)/62)*16+RC[10],FALSE) -> 314410 | K1561: 1 | M1561: =R[-62]C -> 8 | N1561: =R[-62]C -> 11 | O1561: =R[-62]C -> 12 | P1561: =R[-62]C -> 13 | Q1561: =R[-62]C -> 14
A1562: 30118 | B1562: =RC[1] -> 314030 | C1562: =HLOOKUP(Sheet1!R2C1,Sheet1!R2C1:R49C1,INT(MOD(RC1,1000)/62)*16+RC[10],FALSE) -> 314030 | D1562: =HLOOKUP(Sheet1!R2C1,Sheet1!R2C1:R49C1,INT(MOD(RC1,1000)/62)*16+RC[10],FALSE) -> 314200 | E1562: =HLOOKUP(Sheet1!R2C1,Sheet1!R2C1:R49C1,INT(MOD(RC1,1000)/62)*16+RC[10],FALSE) -> 314380 | F1562: =HLOOKUP(Sheet1!R2C1,Sheet1!R2C1:R49C1,INT(MOD(RC1,1000)/62)*16+RC[10],FALSE) -> 314100 | G1562: =HLOOKUP(Sheet1!R2C1,Sheet1!R2C1:R49C1,INT(MOD(RC1,1000)/62)*16+RC[10],FALSE) -> 314080 | K1562: 1 | M1562: =R[-62]C -> 9 | N1562: =R[-62]C -> 10 | O1562: =R[-62]C -> 11 | P1562: =R[-62]C -> 12 | Q1562: =R[-62]C -> 13
A1563: 30119 | B1563: =RC[1] -> 314030 | C1563: =HLOOKUP(Sheet1!R2C1,Sheet1!R2C1:R49C1,INT(MOD(RC1,1000)/62)*16+RC[10],FALSE) -> 314030 | D1563: =HLOOKUP(Sheet1!R2C1,Sheet1!R2C1:R49C1,INT(MOD(RC1,1000)/62)*16+RC[10],FALSE) -> 314200 | E1563: =HLOOKUP(Sheet1!R2C1,Sheet1!R2C1:R49C1,INT(MOD(RC1,1000)/62)*16+RC[10],FALSE) -> 314380 | F1563: =HLOOKUP(Sheet1!R2C1,Sheet1!R2C1:R49C1,INT(MOD(RC1,1000)/62)*16+RC[10],FALSE) -> 314100 | G1563: =HLOOKUP(Sheet1!R2C1,Sheet1!R2C1:R49C1,INT(MOD(RC1,1000)/62)*16+RC[10],FALSE) -> 314410 | K1563: 1 | M1563: =R[-62]C -> 9 | N1563: =R[-62]C -> 10 | O1563: =R[-62]C -> 11 | P1563: =R[-62]C -> 12 | Q1563: =R[-62]C -> 14
A1564: 30120 | B1564: =RC[1] -> 314030 | C1564: =HLOOKUP(Sheet1!R2C1,Sheet1!R2C1:R49C1,INT(MOD(RC1,1000)/62)*16+RC[10],FALSE) -> 314030 | D1564: =HLOOKUP(Sheet1!R2C1,Sheet1!R2C1:R49C1,INT(MOD(RC1,1000)/62)*16+RC[10],FALSE) -> 314200 | E1564: =HLOOKUP(Sheet1!R2C1,Sheet1!R2C1:R49C1,INT(MOD(RC1,1000)/62)*16+RC[10],FALSE) -> 314380 | F1564: =HLOOKUP(Sheet1!R2C1,Sheet1!R2C1:R49C1,INT(MOD(RC1,1000)/62)*16+RC[10],FALSE) -> 314080 | G1564: =HLOOKUP(Sheet1!R2C1,Sheet1!R2C1:R49C1,INT(MOD(RC1,1000)/62)*16+RC[10],FALSE) -> 314410 | K1564: 1 | M1564: =R[-62]C -> 9 | N1564: =R[-62]C -> 10 | O1564: =R[-62]C -> 11 | P1564: =R[-62]C -> 13 | Q1564: =R[-62]C -> 14
A1565: 30121 | B1565: =RC[1] -> 314030 | C1565: =HLOOKUP(Sheet1!R2C1,Sheet1!R2C1:R49C1,INT(MOD(RC1,1000)/62)*16+RC[10],FALSE) -> 314030 | D1565: =HLOOKUP(Sheet1!R2C1,Sheet1!R2C1:R49C1,INT(MOD(RC1,1000)/62)*16+RC[10],FALSE) -> 314200 | E1565: =HLOOKUP(Sheet1!R2C1,Sheet1!R2C1:R49C1,INT(MOD(RC1,1000)/62)*16+RC[10],FALSE) -> 314100 | F1565: =HLOOKUP(Sheet1!R2C1,Sheet1!R2C1:R49C1,INT(MOD(RC1,1000)/62)*16+RC[10],FALSE) -> 314080 | G1565: =HLOOKUP(Sheet1!R2C1,Sheet1!R2C1:R49C1,INT(MOD(RC1,1000)/62)*16+RC[10],FALSE) -> 314410 | K1565: 1 | M1565: =R[-62]C -> 9 | N1565: =R[-62]C -> 10 | O1565: =R[-62]C -> 12 | P1565: =R[-62]C -> 13 | Q1565: =R[-62]C -> 14
A1566: 30122 | B1566: =RC[1] -> 314030 | C1566: =HLOOKUP(Sheet1!R2C1,Sheet1!R2C1:R49C1,INT(MOD(RC1,1000)/62)*16+RC[10],FALSE) -> 314030 | D1566: =HLOOKUP(Sheet1!R2C1,Sheet1!R2C1:R49C1,INT(MOD(RC1,1000)/62)*16+RC[10],FALSE) -> 314380 | E1566: =HLOOKUP(Sheet1!R2C1,Sheet1!R2C1:R49C1,INT(MOD(RC1,1000)/62)*16+RC[10],FALSE) -> 314100 | F1566: =HLOOKUP(Sheet1!R2C1,Sheet1!R2C1:R49C1,INT(MOD(RC1,1000)/62)*16+RC[10],FALSE) -> 314080 | G1566: =HLOOKUP(Sheet1!R2C1,Sheet1!R2C1:R49C1,INT(MOD(RC1,1000)/62)*16+RC[10],FALSE) -> 314410 | K1566: 1 | M1566: =R[-62]C -> 9 | N1566: =R[-62]C -> 11 | O1566: =R[-62]C -> 12 | P1566: =R[-62]C -> 13 | Q1566: =R[-62]C -> 14
A1567: 30123 | B1567: =RC[1] -> 314200 | C1567: =HLOOKUP(Sheet1!R2C1,Sheet1!R2C1:R49C1,INT(MOD(RC1,1000)/62)*16+RC[10],FALSE) -> 314200 | D1567: =HLOOKUP(Sheet1!R2C1,Sheet1!R2C1:R49C1,INT(MOD(RC1,1000)/62)*16+RC[10],FALSE) -> 314380 | E1567: =HLOOKUP(Sheet1!R2C1,Sheet1!R2C1:R49C1,INT(MOD(RC1,1000)/62)*16+RC[10],FALSE) -> 314100 | F1567: =HLOOKUP(Sheet1!R2C1,Sheet1!R2C1:R49C1,INT(MOD(RC1,1000)/62)*16+RC[10],FALSE) -> 314080 | G1567: =HLOOKUP(Sheet1!R2C1,Sheet1!R2C1:R49C1,INT(MOD(RC1,1000)/62)*16+RC[10],FALSE) -> 314410 | K1567: 1 | M1567: =R[-62]C -> 10 | N1567: =R[-62]C -> 11 | O1567: =R[-62]C -> 12 | P1567: =R[-62]C -> 13 | Q1567: =R[-62]C -> 14
A1568: 30124 | B1568: =RC[1] -> 323110 | C1568: =HLOOKUP(Sheet1!R2C1,Sheet1!R2C1:R49C1,INT(MOD(RC1,1000)/62)*16+RC[10],FALSE) -> 323110 | D1568: =HLOOKUP(Sheet1!R2C1,Sheet1!R2C1:R49C1,INT(MOD(RC1,1000)/62)*16+RC[10],FALSE) -> 323410 | E1568: =HLOOKUP(Sheet1!R2C1,Sheet1!R2C1:R49C1,INT(MOD(RC1,1000)/62)*16+RC[10],FALSE) -> 324100 | F1568: =HLOOKUP(Sheet1!R2C1,Sheet1!R2C1:R49C1,INT(MOD(RC1,1000)/62)*16+RC[10],FALSE) -> 324110 | G1568: =HLOOKUP(Sheet1!R2C1,Sheet1!R2C1:R49C1,INT(MOD(RC1,1000)/62)*16+RC[10],FALSE) -> 324000 | K1568: 1 | M1568: =R[-62]C -> 1 | N1568: =R[-62]C -> 2 | O1568: =R[-62]C -> 3 | P1568: =R[-62]C -> 4 | Q1568: =R[-62]C -> 5
A1569: 30125 | B1569: =RC[1] -> 323410 | C1569: =HLOOKUP(Sheet1!R2C1,Sheet1!R2C1:R49C1,INT(MOD(RC1,1000)/62)*16+RC[10],FALSE) -> 323410 | D1569: =HLOOKUP(Sheet1!R2C1,Sheet1!R2C1:R49C1,INT(MOD(RC1,1000)/62)*16+RC[10],FALSE) -> 324100 | E1569: =HLOOKUP(Sheet1!R2C1,Sheet1!R2C1:R49C1,INT(MOD(RC1,1000)/62)*16+RC[10],FALSE) -> 324110 | F1569: =HLOOKUP(Sheet1!R2C1,Sheet1!R2C1:R49C1,INT(MOD(RC1,1000)/62)*16+RC[10],FALSE) -> 324000 | G1569: =HLOOKUP(Sheet1!R2C1,Sheet1!R2C1:R49C1,INT(MOD(RC1,1000)/62)*16+RC[10],FALSE) -> 324300 | K1569: 1 | M1569: =R[-62]C -> 2 | N1569: =R[-62]C -> 3 | O1569: =R[-62]C -> 4 | P1569: =R[-62]C -> 5 | Q1569: =R[-62]C -> 6
A1570: 30126 | B1570: =RC[1] -> 324100 | C1570: =HLOOKUP(Sheet1!R2C1,Sheet1!R2C1:R49C1,INT(MOD(RC1,1000)/62)*16+RC[10],FALSE) -> 324100 | D1570: =HLOOKUP(Sheet1!R2C1,Sheet1!R2C1:R49C1,INT(MOD(RC1,1000)/62)*16+RC[10],FALSE) -> 324110 | E1570: =HLOOKUP(Sheet1!R2C1,Sheet1!R2C1:R49C1,INT(MOD(RC1,1000)/62)*16+RC[10],FALSE) -> 324000 | F1570: =HLOOKUP(Sheet1!R2C1,Sheet1!R2C1:R49C1,INT(MOD(RC1,1000)/62)*16+RC[10],FALSE) -> 324300 | G1570: =HLOOKUP(Sheet1!R2C1,Sheet1!R2C1:R49C1,INT(MOD(RC1,1000)/62)*16+RC[10],FALSE) -> 323110 | K1570: 1 | M1570: =R[-62]C -> 3 | N1570: =R[-62]C -> 4 | O1570: =R[-62]C -> 5 | P1570: =R[-62]C -> 6 | Q1570: =R[-62]C -> 1
A1571: 30127 | B1571: =RC[1] -> 324110 | C1571: =HLOOKUP(Sheet1!R2C1,Sheet1!R2C1:R49C1,INT(MOD(RC1,1000)/62)*16+RC[10],FALSE) -> 324110 | D1571: =HLOOKUP(Sheet1!R2C1,Sheet1!R2C1:R49C1,INT(MOD(RC1,1000)/62)*16+RC[10],FALSE) -> 324000 | E1571: =HLOOKUP(Sheet1!R2C1,Sheet1!R2C1:R49C1,INT(MOD(RC1,1000)/62)*16+RC[10],FALSE) -> 324300 | F1571: =HLOOKUP(Sheet1!R2C1,Sheet1!R2C1:R49C1,INT(MOD(RC1,1000)/62)*16+RC[10],FALSE) -> 323110 | G1571: =HLOOKUP(Sheet1!R2C1,Sheet1!R2C1:R49C1,INT(MOD(RC1,1000)/62)*16+RC[10],FALSE) -> 323410 | K1571: 1 | M1571: =R[-62]C -> 4 | N1571: =R[-62]C -> 5 | O1571: =R[-62]C -> 6 | P1571: =R[-62]C -> 1 | Q1571: =R[-62]C -> 2
A1572: 30128 | B1572: =RC[1] -> 324000 | C1572: =HLOOKUP(Sheet1!R2C1,Sheet1!R2C1:R49C1,INT(MOD(RC1,1000)/62)*16+RC[10],FALSE) -> 324000 | D1572: =HLOOKUP(Sheet1!R2C1,Sheet1!R2C1:R49C1,INT(MOD(RC1,1000)/62)*16+RC[10],FALSE) -> 324300 | E1572: =HLOOKUP(Sheet1!R2C1,Sheet1!R2C1:R49C1,INT(MOD(RC1,1000)/62)*16+RC[10],FALSE) -> 323110 | F1572: =HLOOKUP(Sheet1!R2C1,Sheet1!R2C1:R49C1,INT(MOD(RC1,1000)/62)*16+RC[10],FALSE) -> 323410 | G1572: =HLOOKUP(Sheet1!R2C1,Sheet1!R2C1:R49C1,INT(MOD(RC1,1000)/62)*16+RC[10],FALSE) -> 324100 | K1572: 1 | M1572: =R[-62]C -> 5 | N1572: =R[-62]C -> 6 | O1572: =R[-62]C -> 1 | P1572: =R[-62]C -> 2 | Q1572: =R[-62]C -> 3
A1573: 30129 | B1573: =RC[1] -> 324300 | C1573: =HLOOKUP(Sheet1!R2C1,Sheet1!R2C1:R49C1,INT(MOD(RC1,1000)/62)*16+RC[10],FALSE) -> 324300 | D1573: =HLOOKUP(Sheet1!R2C1,Sheet1!R2C1:R49C1,INT(MOD(RC1,1000)/62)*16+RC[10],FALSE) -> 323110 | E1573: =HLOOKUP(Sheet1!R2C1,Sheet1!R2C1:R49C1,INT(MOD(RC1,1000)/62)*16+RC[10],FALSE) -> 323410 | F1573: =HLOOKUP(Sheet1!R2C1,Sheet1!R2C1:R49C1,INT(MOD(RC1,1000)/62)*16+RC[10],FALSE) -> 324100 | G1573: =HLOOKUP(Sheet1!R2C1,Sheet1!R2C1:R49C1,INT(MOD(RC1,1000)/62)*16+RC[10],FALSE) -> 324110 | K1573: 1 | M1573: =R[-62]C -> 6 | N1573: =R[-62]C -> 1 | O1573: =R[-62]C -> 2 | P1573: =R[-62]C -> 3 | Q1573: =R[-62]C -> 4
A1574: 30130 | B1574: =RC[1] -> 324010 | C1574: =HLOOKUP(Sheet1!R2C1,Sheet1!R2C1:R49C1,INT(MOD(RC1,1000)/62)*16+RC[10],FALSE) -> 324010 | D1574: =HLOOKUP(Sheet1!R2C1,Sheet1!R2C1:R49C1,INT(MOD(RC1,1000)/62)*16+RC[10],FALSE) -> 324310 | E1574: =HLOOKUP(Sheet1!R2C1,Sheet1!R2C1:R49C1,INT(MOD(RC1,1000)/62)*16+RC[10],FALSE) -> 324020 | F1574: =HLOOKUP(Sheet1!R2C1,Sheet1!R2C1:R49C1,INT(MOD(RC1,1000)/62)*16+RC[10],FALSE) -> 324200 | G1574: =HLOOKUP(Sheet1!R2C1,Sheet1!R2C1:R49C1,INT(MOD(RC1,1000)/62)*16+RC[10],FALSE) -> 324280 | K1574: 1 | M1574: =R[-62]C -> 7 | N1574: =R[-62]C -> 8 | O1574: =R[-62]C -> 9 | P1574: =R[-62]C -> 10 | Q1574: =R[-62]C -> 11
A1575: 30131 | B1575: =RC[1] -> 324010 | C1575: =HLOOKUP(Sheet1!R2C1,Sheet1!R2C1:R49C1,INT(MOD(RC1,1000)/62)*16+RC[10],FALSE) -> 324010 | D1575: =HLOOKUP(Sheet1!R2C1,Sheet1!R2C1:R49C1,INT(MOD(RC1,1000)/62)*16+RC[10],FALSE) -> 324310 | E1575: =HLOOKUP(Sheet1!R2C1,Sheet1!R2C1:R49C1,INT(MOD(RC1,1000)/62)*16+RC[10],FALSE) -> 324020 | F1575: =HLOOKUP(Sheet1!R2C1,Sheet1!R2C1:R49C1,INT(MOD(RC1,1000)/62)*16+RC[10],FALSE) -> 324200 | G1575: =HLOOKUP(Sheet1!R2C1,Sheet1!R2C1:R49C1,INT(MOD(RC1,1000)/62)*16+RC[10],FALSE) -> 324120 | K1575: 1 | M1575: =R[-62]C -> 7 | N1575: =R[-62]C -> 8 | O1575: =R[-62]C -> 9 | P1575: =R[-62]C -> 10 | Q1575: =R[-62]C -> 12
A1576: 30132 | B1576: =RC[1] -> 324010 | C1576: =HLOOKUP(Sheet1!R2C1,Sheet1!R2C1:R49C1,INT(MOD(RC1,1000)/62)*16+RC[10],FALSE) -> 324010 | D1576: =HLOOKUP(Sheet1!R2C1,Sheet1!R2C1:R49C1,INT(MOD(RC1,1000)/62)*16+RC[10],FALSE) -> 324310 | E1576: =HLOOKUP(Sheet1!R2C1,Sheet1!R2C1:R49C1,INT(MOD(RC1,1000)/62)*16+RC[10],FALSE) -> 324020 | F1576: =HLOOKUP(Sheet1!R2C1,Sheet1!R2C1:R49C1,INT(MOD(RC1,1000)/62)*16+RC[10],FALSE) -> 324200 | G1576: =HLOOKUP(Sheet1!R2C1,Sheet1!R2C1:R49C1,INT(MOD(RC1,1000)/62)*16+RC[10],FALSE) -> 324080 | K1576: 1 | M1576: =R[-62]C -> 7 | N1576: =R[-62]C -> 8 | O1576: =R[-62]C -> 9 | P1576: =R[-62]C -> 10 | Q1576: =R[-62]C -> 13
A1577: 30133 | B1577: =RC[1] -> 324010 | C1577: =HLOOKUP(Sheet1!R2C1,Sheet1!R2C1:R49C1,INT(MOD(RC1,1000)/62)*16+RC[10],FALSE) -> 324010 | D1577: =HLOOKUP(Sheet1!R2C1,Sheet1!R2C1:R49C1,INT(MOD(RC1,1000)/62)*16+RC[10],FALSE) -> 324310 | E1577: =HLOOKUP(Sheet1!R2C1,Sheet1!R2C1:R49C1,INT(MOD(RC1,1000)/62)*16+RC[10],FALSE) -> 324020 | F1577: =HLOOKUP(Sheet1!R2C1,Sheet1!R2C1:R49C1,INT(MOD(RC1,1000)/62)*16+RC[10],FALSE) -> 324200 | G1577: =HLOOKUP(Sheet1!R2C1,Sheet1!R2C1:R49C1,INT(MOD(RC1,1000)/62)*16+RC[10],FALSE) -> 324400 | K1577: 1 | M1577: =R[-62]C -> 7 | N1577: =R[-62]C -> 8 | O1577: =R[-62]C -> 9 | P1577: =R[-62]C -> 10 | Q1577: =R[-62]C -> 14
A1578: 30134 | B1578: =RC[1] -> 324010 | C1578: =HLOOKUP(Sheet1!R2C1,Sheet1!R2C1:R49C1,INT(MOD(RC1,1000)/62)*16+RC[10],FALSE) -> 324010 | D1578: =HLOOKUP(Sheet1!R2C1,Sheet1!R2C1:R49C1,INT(MOD(RC1,1000)/62)*16+RC[10],FALSE) -> 324310 | E1578: =HLOOKUP(Sheet1!R2C1,Sheet1!R2C1:R49C1,INT(MOD(RC1,1000)/62)*16+RC[10],FALSE) -> 324020 | F1578: =HLOOKUP(Sheet1!R2C1,Sheet1!R2C1:R49C1,INT(MOD(RC1,1000)/62)*16+RC[10],FALSE) -> 324280 | G1578: =HLOOKUP(Sheet1!R2C1,Sheet1!R2C1:R49C1,INT(MOD(RC1,1000)/62)*16+RC[10],FALSE) -> 324120 | K1578: 1 | M1578: =R[-62]C -> 7 | N1578: =R[-62]C -> 8 | O1578: =R[-62]C -> 9 | P1578: =R[-62]C -> 11 | Q1578: =R[-62]C -> 12
A1579: 30135 | B1579: =RC[1] -> 324010 | C1579: =HLOOKUP(Sheet1!R2C1,Sheet1!R2C1:R49C1,INT(MOD(RC1,1000)/62)*16+RC[10],FALSE) -> 324010 | D1579: =HLOOKUP(Sheet1!R2C1,Sheet1!R2C1:R49C1,INT(MOD(RC1,1000)/62)*16+RC[10],FALSE) -> 324310 | E1579: =HLOOKUP(Sheet1!R2C1,Sheet1!R2C1:R49C1,INT(MOD(RC1,1000)/62)*16+RC[10],FALSE) -> 324020 | F1579: =HLOOKUP(Sheet1!R2C1,Sheet1!R2C1:R49C1,INT(MOD(RC1,1000)/62)*16+RC[10],FALSE) -> 324280 | G1579: =HLOOKUP(Sheet1!R2C1,Sheet1!R2C1:R49C1,INT(MOD(RC1,1000)/62)*16+RC[10],FALSE) -> 324080 | K1579: 1 | M1579: =R[-62]C -> 7 | N1579: =R[-62]C -> 8 | O1579: =R[-62]C -> 9 | P1579: =R[-62]C -> 11 | Q1579: =R[-62]C -> 13
A1580: 30136 | B1580: =RC[1] -> 324010 | C1580: =HLOOKUP(Sheet1!R2C1,Sheet1!R2C1:R49C1,INT(MOD(RC1,1000)/62)*16+RC[10],FALSE) -> 324010 | D1580: =HLOOKUP(Sheet1!R2C1,Sheet1!R2C1:R49C1,INT(MOD(RC1,1000)/62)*16+RC[10],FALSE) -> 324310 | E1580: =HLOOKUP(Sheet1!R2C1,Sheet1!R2C1:R49C1,INT(MOD(RC1,1000)/62)*16+RC[10],FALSE) -> 324020 | F1580: =HLOOKUP(Sheet1!R2C1,Sheet1!R2C1:R49C1,INT(MOD(RC1,1000)/62)*16+RC[10],FALSE) -> 324280 | G1580: =HLOOKUP(Sheet1!R2C1,Sheet1!R2C1:R49C1,INT(MOD(RC1,1000)/62)*16+RC[10],FALSE) -> 324400 | K1580: 1 | M1580: =R[-62]C -> 7 | N1580: =R[-62]C -> 8 | O1580: =R[-62]C -> 9 | P1580: =R[-62]C -> 11 | Q1580: =R[-62]C -> 14
A1581: 30137 | B1581: =RC[1] -> 324010 | C1581: =HLOOKUP(Sheet1!R2C1,Sheet1!R2C1:R49C1,INT(MOD(RC1,1000)/62)*16+RC[10],FALSE) -> 324010 | D1581: =HLOOKUP(Sheet1!R2C1,Sheet1!R2C1:R49C1,INT(MOD(RC1,1000)/62)*16+RC[10],FALSE) -> 324310 | E1581: =HLOOKUP(Sheet1!R2C1,Sheet1!R2C1:R49C1,INT(MOD(RC1,1000)/62)*16+RC[10],FALSE) -> 324020 | F1581: =HLOOKUP(Sheet1!R2C1,Sheet1!R2C1:R49C1,INT(MOD(RC1,1000)/62)*16+RC[10],FALSE) -> 324120 | G1581: =HLOOKUP(Sheet1!R2C1,Sheet1!R2C1:R49C1,INT(MOD(RC1,1000)/62)*16+RC[10],FALSE) -> 324080 | K1581: 1 | M1581: =R[-62]C -> 7 | N1581: =R[-62]C -> 8 | O1581: =R[-62]C -> 9 | P1581: =R[-62]C -> 12 | Q1581: =R[-62]C -> 13
A1582: 30138 | B1582: =RC[1] -> 324010 | C1582: =HLOOKUP(Sheet1!R2C1,Sheet1!R2C1:R49C1,INT(MOD(RC1,1000)/62)*16+RC[10],FALSE) -> 324010 | D1582: =HLOOKUP(Sheet1!R2C1,Sheet1!R2C1:R49C1,INT(MOD(RC1,1000)/62)*16+RC[10],FALSE) -> 324310 | E1582: =HLOOKUP(Sheet1!R2C1,Sheet1!R2C1:R49C1,INT(MOD(RC1,1000)/62)*16+RC[10],FALSE) -> 324020 | F1582: =HLOOKUP(Sheet1!R2C1,Sheet1!R2C1:R49C1,INT(MOD(RC1,1000)/62)*16+RC[10],FALSE) -> 324120 | G1582: =HLOOKUP(Sheet1!R2C1,Sheet1!R2C1:R49C1,INT(MOD(RC1,1000)/62)*16+RC[10],FALSE) -> 324400 | K1582: 1 | M1582: =R[-62]C -> 7 | N1582: =R[-62]C -> 8 | O1582: =R[-62]C -> 9 | P1582: =R[-62]C -> 12 | Q1582: =R[-62]C -> 14
A1583: 30139 | B1583: =RC[1] -> 324010 | C1583: =HLOOKUP(Sheet1!R2C1,Sheet1!R2C1:R49C1,INT(MOD(RC1,1000)/62)*16+RC[10],FALSE) -> 324010 | D1583: =HLOOKUP(Sheet1!R2C1,Sheet1!R2C1:R49C1,INT(MOD(RC1,1000)/62)*16+RC[10],FALSE) -> 324310 | E1583: =HLOOKUP(Sheet1!R2C1,Sheet1!R2C1:R49C1,INT(MOD(RC1,1000)/62)*16+RC[10],FALSE) -> 324020 | F1583: =HLOOKUP(Sheet1!R2C1,Sheet1!R2C1:R49C1,INT(MOD(RC1,1000)/62)*16+RC[10],FALSE) -> 324080 | G1583: =HLOOKUP(Sheet1!R2C1,Sheet1!R2C1:R49C1,INT(MOD(RC1,1000)/62)*16+RC[10],FALSE) -> 324400 | K1583: 1 | M1583: =R[-62]C -> 7 | N1583: =R[-62]C -> 8 | O1583: =R[-62]C -> 9 | P1583: =R[-62]C -> 13 | Q1583: =R[-62]C -> 14
A1584: 30140 | B1584: =RC[1] -> 324010 | C1584: =HLOOKUP(Sheet1!R2C1,Sheet1!R2C1:R49C1,INT(MOD(RC1,1000)/62)*16+RC[10],FALSE) -> 324010 | D1584: =HLOOKUP(Sheet1!R2C1,Sheet1!R2C1:R49C1,INT(MOD(RC1,1000)/62)*16+RC[10],FALSE) -> 324310 | E1584: =HLOOKUP(Sheet1!R2C1,Sheet1!R2C1:R49C1,INT(MOD(RC1,1000)/62)*16+RC[10],FALSE) -> 324200 | F1584: =HLOOKUP(Sheet1!R2C1,Sheet1!R2C1:R49C1,INT(MOD(RC1,1000)/62)*16+RC[10],FALSE) -> 324280 | G1584: =HLOOKUP(Sheet1!R2C1,Sheet1!R2C1:R49C1,INT(MOD(RC1,1000)/62)*16+RC[10],FALSE) -> 324120 | K1584: 1 | M1584: =R[-62]C -> 7 | N1584: =R[-62]C -> 8 | O1584: =R[-62]C -> 10 | P1584: =R[-62]C -> 11 | Q1584: =R[-62]C -> 12
A1585: 30141 | B1585: =RC[1] -> 324010 | C1585: =HLOOKUP(Sheet1!R2C1,Sheet1!R2C1:R49C1,INT(MOD(RC1,1000)/62)*16+RC[10],FALSE) -> 324010 | D1585: =HLOOKUP(Sheet1!R2C1,Sheet1!R2C1:R49C1,INT(MOD(RC1,1000)/62)*16+RC[10],FALSE) -> 324310 | E1585: =HLOOKUP(Sheet1!R2C1,Sheet1!R2C1:R49C1,INT(MOD(RC1,1000)/62)*16+RC[10],FALSE) -> 324200 | F1585: =HLOOKUP(Sheet1!R2C1,Sheet1!R2C1:R49C1,INT(MOD(RC1,1000)/62)*16+RC[10],FALSE) -> 324280 | G1585: =HLOOKUP(Sheet1!R2C1,Sheet1!R2C1:R49C1,INT(MOD(RC1,1000)/62)*16+RC[10],FALSE) -> 324080 | K1585: 1 | M1585: =R[-62]C -> 7 | N1585: =R[-62]C -> 8 | O1585: =R[-62]C -> 10 | P1585: =R[-62]C -> 11 | Q1585: =R[-62]C -> 13
A1586: 30142 | B1586: =RC[1] -> 324010 | C1586: =HLOOKUP(Sheet1!R2C1,Sheet1!R2C1:R49C1,INT(MOD(RC1,1000)/62)*16+RC[10],FALSE) -> 324010 | D1586: =HLOOKUP(Sheet1!R2C1,Sheet1!R2C1:R49C1,INT(MOD(RC1,1000)/62)*16+RC[10],FALSE) -> 324310 | E1586: =HLOOKUP(Sheet1!R2C1,Sheet1!R2C1:R49C1,INT(MOD(RC1,1000)/62)*16+RC[10],FALSE) -> 324200 | F1586: =HLOOKUP(Sheet1!R2C1,Sheet1!R2C1:R49C1,INT(MOD(RC1,1000)/62)*16+RC[10],FALSE) -> 324280 | G1586: =HLOOKUP(Sheet1!R2C1,Sheet1!R2C1:R49C1,INT(MOD(RC1,1000)/62)*16+RC[10],FALSE) -> 324400 | K1586: 1 | M1586: =R[-62]C -> 7 | N1586: =R[-62]C -> 8 | O1586: =R[-62]C -> 10 | P1586: =R[-62]C -> 11 | Q1586: =R[-62]C -> 14
A1587: 30143 | B1587: =RC[1] -> 324010 | C1587: =HLOOKUP(Sheet1!R2C1,Sheet1!R2C1:R49C1,INT(MOD(RC1,1000)/62)*16+RC[10],FALSE) -> 324010 | D1587: =HLOOKUP(Sheet1!R2C1,Sheet1!R2C1:R49C1,INT(MOD(RC1,1000)/62)*16+RC[10],FALSE) -> 324310 | E1587: =HLOOKUP(Sheet1!R2C1,Sheet1!R2C1:R49C1,INT(MOD(RC1,1000)/62)*16+RC[10],FALSE) -> 324200 | F1587: =HLOOKUP(Sheet1!R2C1,Sheet1!R2C1:R49C1,INT(MOD(RC1,1000)/62)*16+RC[10],FALSE) -> 324120 | G1587: =HLOOKUP(Sheet1!R2C1,Sheet1!R2C1:R49C1,INT(MOD(RC1,1000)/62)*16+RC[10],FALSE) -> 324080 | K1587: 1 | M1587: =R[-62]C -> 7 | N1587: =R[-62]C -> 8 | O1587: =R[-62]C -> 10 | P1587: =R[-62]C -> 12 | Q1587: =R[-62]C -> 13
A1588: 30144 | B1588: =RC[1] -> 324010 | C1588: =HLOOKUP(Sheet1!R2C1,Sheet1!R2C1:R49C1,INT(MOD(RC1,1000)/62)*16+RC[10],FALSE) -> 324010 | D1588: =HLOOKUP(Sheet1!R2C1,Sheet1!R2C1:R49C1,INT(MOD(RC1,1000)/62)*16+RC[10],FALSE) -> 324310 | E1588: =HLOOKUP(Sheet1!R2C1,Sheet1!R2C1:R49C1,INT(MOD(RC1,1000)/62)*16+RC[10],FALSE) -> 324200 | F1588: =HLOOKUP(Sheet1!R2C1,Sheet1!R2C1:R49C1,INT(MOD(RC1,1000)/62)*16+RC[10],FALSE) -> 324120 | G1588: =HLOOKUP(Sheet1!R2C1,Sheet1!R2C1:R49C1,INT(MOD(RC1,1000)/62)*16+RC[10],FALSE) -> 324400 | K1588: 1 | M1588: =R[-62]C -> 7 | N1588: =R[-62]C -> 8 | O1588: =R[-62]C -> 10 | P1588: =R[-62]C -> 12 | Q1588: =R[-62]C -> 14
A1589: 30145 | B1589: =RC[1] -> 324010 | C1589: =HLOOKUP(Sheet1!R2C1,Sheet1!R2C1:R49C1,INT(MOD(RC1,1000)/62)*16+RC[10],FALSE) -> 324010 | D1589: =HLOOKUP(Sheet1!R2C1,Sheet1!R2C1:R49C1,INT(MOD(RC1,1000)/62)*16+RC[10],FALSE) -> 324310 | E1589: =HLOOKUP(Sheet1!R2C1,Sheet1!R2C1:R49C1,INT(MOD(RC1,1000)/62)*16+RC[10],FALSE) -> 324200 | F1589: =HLOOKUP(Sheet1!R2C1,Sheet1!R2C1:R49C1,INT(MOD(RC1,1000)/62)*16+RC[10],FALSE) -> 324080 | G1589: =HLOOKUP(Sheet1!R2C1,Sheet1!R2C1:R49C1,INT(MOD(RC1,1000)/62)*16+RC[10],FALSE) -> 324400 | K1589: 1 | M1589: =R[-62]C -> 7 | N1589: =R[-62]C -> 8 | O1589: =R[-62]C -> 10 | P1589: =R[-62]C -> 13 | Q1589: =R[-62]C -> 14
A1590: 30146 | B1590: =RC[1] -> 324010 | C1590: =HLOOKUP(Sheet1!R2C1,Sheet1!R2C1:R49C1,INT(MOD(RC1,1000)/62)*16+RC[10],FALSE) -> 324010 | D1590: =HLOOKUP(Sheet1!R2C1,Sheet1!R2C1:R49C1,INT(MOD(RC1,1000)/62)*16+RC[10],FALSE) -> 324310 | E1590: =HLOOKUP(Sheet1!R2C1,Sheet1!R2C1:R49C1,INT(MOD(RC1,1000)/62)*16+RC[10],FALSE) -> 324280 | F1590: =HLOOKUP(Sheet1!R2C1,Sheet1!R2C1:R49C1,INT(MOD(RC1,1000)/62)*16+RC[10],FALSE) -> 324120 | G1590: =HLOOKUP(Sheet1!R2C1,Sheet1!R2C1:R49C1,INT(MOD(RC1,1000)/62)*16+RC[10],FALSE) -> 324080 | K1590: 1 | M1590: =R[-62]C -> 7 | N1590: =R[-62]C -> 8 | O1590: =R[-62]C -> 11 | P1590: =R[-62]C -> 12 | Q1590: =R[-62]C -> 13
A1591: 30147 | B1591: =RC[1] -> 324010 | C1591: =HLOOKUP(Sheet1!R2C1,Sheet1!R2C1:R49C1,INT(MOD(RC1,1000)/62)*16+RC[10],FALSE) -> 324010 | D1591: =HLOOKUP(Sheet1!R2C1,Sheet1!R2C1:R49C1,INT(MOD(RC1,1000)/62)*16+RC[10],FALSE) -> 324310 | E1591: =HLOOKUP(Sheet1!R2C1,Sheet1!R2C1:R49C1,INT(MOD(RC1,1000)/62)*16+RC[10],FALSE) -> 324280 | F1591: =HLOOKUP(Sheet1!R2C1,Sheet1!R2C1:R49C1,INT(MOD(RC1,1000)/62)*16+RC[10],FALSE) -> 324120 | G1591: =HLOOKUP(Sheet1!R2C1,Sheet1!R2C1:R49C1,INT(MOD(RC1,1000)/62)*16+RC[10],FALSE) -> 324400 | K1591: 1 | M1591: =R[-62]C -> 7 | N1591: =R[-62]C -> 8 | O1591: =R[-62]C -> 11 | P1591: =R[-62]C -> 12 | Q1591: =R[-62]C -> 14
A1592: 30148 | B1592: =RC[1] -> 324010 | C1592: =HLOOKUP(Sheet1!R2C1,Sheet1!R2C1:R49C1,INT(MOD(RC1,1000)/62)*16+RC[10],FALSE) -> 324010 | D1592: =HLOOKUP(Sheet1!R2C1,Sheet1!R2C1:R49C1,INT(MOD(RC1,1000)/62)*16+RC[10],FALSE) -> 324310 | E1592: =HLOOKUP(Sheet1!R2C1,Sheet1!R2C1:R49C1,INT(MOD(RC1,1000)/62)*16+RC[10],FALSE) -> 324280 | F1592: =HLOOKUP(Sheet1!R2C1,Sheet1!R2C1:R49C1,INT(MOD(RC1,1000)/62)*16+RC[10],FALSE) -> 324080 | G1592: =HLOOKUP(Sheet1!R2C1,Sheet1!R2C1:R49C1,INT(MOD(RC1,1000)/62)*16+RC[10],FALSE) -> 324400 | K1592: 1 | M1592: =R[-62]C -> 7 | N1592: =R[-62]C -> 8 | O1592: =R[-62]C -> 11 | P1592: =R[-62]C -> 13 | Q1592: =R[-62]C -> 14
A1593: 30149 | B1593: =RC[1] -> 324010 | C1593: =HLOOKUP(Sheet1!R2C1,Sheet1!R2C1:R49C1,INT(MOD(RC1,1000)/62)*16+RC[10],FALSE) -> 324010 | D1593: =HLOOKUP(Sheet1!R2C1,Sheet1!R2C1:R49C1,INT(MOD(RC1,1000)/62)*16+RC[10],FALSE) -> 324310 | E1593: =HLOOKUP(Sheet1!R2C1,Sheet1!R2C1:R49C1,INT(MOD(RC1,1000)/62)*16+RC[10],FALSE) -> 324120 | F1593: =HLOOKUP(Sheet1!R2C1,Sheet1!R2C1:R49C1,INT(MOD(RC1,1000)/62)*16+RC[10],FALSE) -> 324080 | G1593: =HLOOKUP(Sheet1!R2C1,Sheet1!R2C1:R49C1,INT(MOD(RC1,1000)/62)*16+RC[10],FALSE) -> 324400 | K1593: 1 | M1593: =R[-62]C -> 7 | N1593: =R[-62]C -> 8 | O1593: =R[-62]C -> 12 | P1593: =R[-62]C -> 13 | Q1593: =R[-62]C -> 14
A1594: 30150 | B1594: =RC[1] -> 324010 | C1594: =HLOOKUP(Sheet1!R2C1,Sheet1!R2C1:R49C1,INT(MOD(RC1,1000)/62)*16+RC[10],FALSE) -> 324010 | D1594: =HLOOKUP(Sheet1!R2C1,Sheet1!R2C1:R49C1,INT(MOD(RC1,1000)/62)*16+RC[10],FALSE) -> 324020 | E1594: =HLOOKUP(Sheet1!R2C1,Sheet1!R2C1:R49C1,INT(MOD(RC1,1000)/62)*16+RC[10],FALSE) -> 324200 | F1594: =HLOOKUP(Sheet1!R2C1,Sheet1!R2C1:R49C1,INT(MOD(RC1,1000)/62)*16+RC[10],FALSE) -> 324280 | G1594: =HLOOKUP(Sheet1!R2C1,Sheet1!R2C1:R49C1,INT(MOD(RC1,1000)/62)*16+RC[10],FALSE) -> 324120 | K1594: 1 | M1594: =R[-62]C -> 7 | N1594: =R[-62]C -> 9 | O1594: =R[-62]C -> 10 | P1594: =R[-62]C -> 11 | Q1594: =R[-62]C -> 12
A1595: 30151 | B1595: =RC[1] -> 324010 | C1595: =HLOOKUP(Sheet1!R2C1,Sheet1!R2C1:R49C1,INT(MOD(RC1,1000)/62)*16+RC[10],FALSE) -> 324010 | D1595: =HLOOKUP(Sheet1!R2C1,Sheet1!R2C1:R49C1,INT(MOD(RC1,1000)/62)*16+RC[10],FALSE) -> 324020 | E1595: =HLOOKUP(Sheet1!R2C1,Sheet1!R2C1:R49C1,INT(MOD(RC1,1000)/62)*16+RC[10],FALSE) -> 324200 | F1595: =HLOOKUP(Sheet1!R2C1,Sheet1!R2C1:R49C1,INT(MOD(RC1,1000)/62)*16+RC[10],FALSE) -> 324280 | G1595: =HLOOKUP(Sheet1!R2C1,Sheet1!R2C1:R49C1,INT(MOD(RC1,1000)/62)*16+RC[10],FALSE) -> 324080 | K1595: 1 | M1595: =R[-62]C -> 7 | N1595: =R[-62]C -> 9 | O1595: =R[-62]C -> 10 | P1595: =R[-62]C -> 11 | Q1595: =R[-62]C -> 13
A1596: 30152 | B1596: =RC[1] -> 324010 | C1596: =HLOOKUP(Sheet1!R2C1,Sheet1!R2C1:R49C1,INT(MOD(RC1,1000)/62)*16+RC[10],FALSE) -> 324010 | D1596: =HLOOKUP(Sheet1!R2C1,Sheet1!R2C1:R49C1,INT(MOD(RC1,1000)/62)*16+RC[10],FALSE) -> 324020 | E1596: =HLOOKUP(Sheet1!R2C1,Sheet1!R2C1:R49C1,INT(MOD(RC1,1000)/62)*16+RC[10],FALSE) -> 324200 | F1596: =HLOOKUP(Sheet1!R2C1,Sheet1!R2C1:R49C1,INT(MOD(RC1,1000)/62)*16+RC[10],FALSE) -> 324280 | G1596: =HLOOKUP(Sheet1!R2C1,Sheet1!R2C1:R49C1,INT(MOD(RC1,1000)/62)*16+RC[10],FALSE) -> 324400 | K1596: 1 | M1596: =R[-62]C -> 7 | N1596: =R[-62]C -> 9 | O1596: =R[-62]C -> 10 | P1596: =R[-62]C -> 11 | Q1596: =R[-62]C -> 14
A1597: 30153 | B1597: =RC[1] -> 324010 | C1597: =HLOOKUP(Sheet1!R2C1,Sheet1!R2C1:R49C1,INT(MOD(RC1,1000)/62)*16+RC[10],FALSE) -> 324010 | D1597: =HLOOKUP(Sheet1!R2C1,Sheet1!R2C1:R49C1,INT(MOD(RC1,1000)/62)*16+RC[10],FALSE) -> 324020 | E1597: =HLOOKUP(Sheet1!R2C1,Sheet1!R2C1:R49C1,INT(MOD(RC1,1000)/62)*16+RC[10],FALSE) -> 324200 | F1597: =HLOOKUP(Sheet1!R2C1,Sheet1!R2C1:R49C1,INT(MOD(RC1,1000)/62)*16+RC[10],FALSE) -> 324120 | G1597: =HLOOKUP(Sheet1!R2C1,Sheet1!R2C1:R49C1,INT(MOD(RC1,1000)/62)*16+RC[10],FALSE) -> 324080 | K1597: 1 | M1597: =R[-62]C -> 7 | N1597: =R[-62]C -> 9 | O1597: =R[-62]C -> 10 | P1597: =R[-62]C -> 12 | Q1597: =R[-62]C -> 13
A1598: 30154 | B1598: =RC[1] -> 324010 | C1598: =HLOOKUP(Sheet1!R2C1,Sheet1!R2C1:R49C1,INT(MOD(RC1,1000)/62)*16+RC[10],FALSE) -> 324010 | D1598: =HLOOKUP(Sheet1!R2C1,Sheet1!R2C1:R49C1,INT(MOD(RC1,1000)/62)*16+RC[10],FALSE) -> 324020 | E1598: =HLOOKUP(Sheet1!R2C1,Sheet1!R2C1:R49C1,INT(MOD(RC1,1000)/62)*16+RC[10],FALSE) -> 324200 | F1598: =HLOOKUP(Sheet1!R2C1,Sheet1!R2C1:R49C1,INT(MOD(RC1,1000)/62)*16+RC[10],FALSE) -> 324120 | G1598: =HLOOKUP(Sheet1!R2C1,Sheet1!R2C1:R49C1,INT(MOD(RC1,1000)/62)*16+RC[10],FALSE) -> 324400 | K1598: 1 | M1598: =R[-62]C -> 7 | N1598: =R[-62]C -> 9 | O1598: =R[-62]C -> 10 | P1598: =R[-62]C -> 12 | Q1598: =R[-62]C -> 14
A1599: 30155 | B1599: =RC[1] -> 324010 | C1599: =HLOOKUP(Sheet1!R2C1,Sheet1!R2C1:R49C1,INT(MOD(RC1,1000)/62)*16+RC[10],FALSE) -> 324010 | D1599: =HLOOKUP(Sheet1!R2C1,Sheet1!R2C1:R49C1,INT(MOD(RC1,1000)/62)*16+RC[10],FALSE) -> 324020 | E1599: =HLOOKUP(Sheet1!R2C1,Sheet1!R2C1:R49C1,INT(MOD(RC1,1000)/62)*16+RC[10],FALSE) -> 324200 | F1599: =HLOOKUP(Sheet1!R2C1,Sheet1!R2C1:R49C1,INT(MOD(RC1,1000)/62)*16+RC[10],FALSE) -> 324080 | G1599: =HLOOKUP(Sheet1!R2C1,Sheet1!R2C1:R49C1,INT(MOD(RC1,1000)/62)*16+RC[10],FALSE) -> 324400 | K1599: 1 | M1599: =R[-62]C -> 7 | N1599: =R[-62]C -> 9 | O1599: =R[-62]C -> 10 | P1599: =R[-62]C -> 13 | Q1599: =R[-62]C -> 14
A1600: 30156 | B1600: =RC[1] -> 324010 | C1600: =HLOOKUP(Sheet1!R2C1,Sheet1!R2C1:R49C1,INT(MOD(RC1,1000)/62)*16+RC[10],FALSE) -> 324010 | D1600: =HLOOKUP(Sheet1!R2C1,Sheet1!R2C1:R49C1,INT(MOD(RC1,1000)/62)*16+RC[10],FALSE) -> 324020 | E1600: =HLOOKUP(Sheet1!R2C1,Sheet1!R2C1:R49C1,INT(MOD(RC1,1000)/62)*16+RC[10],FALSE) -> 324280 | F1600: =HLOOKUP(Sheet1!R2C1,Sheet1!R2C1:R49C1,INT(MOD(RC1,1000)/62)*16+RC[10],FALSE) -> 324120 | G1600: =HLOOKUP(Sheet1!R2C1,Sheet1!R2C1:R49C1,INT(MOD(RC1,1000)/62)*16+RC[10],FALSE) -> 324080 | K1600: 1 | M1600: =R[-62]C -> 7 | N1600: =R[-62]C -> 9 | O1600: =R[-62]C -> 11 | P1600: =R[-62]C -> 12 | Q1600: =R[-62]C -> 13
A1601: 30157 | B1601: =RC[1] -> 324010 | C1601: =HLOOKUP(Sheet1!R2C1,Sheet1!R2C1:R49C1,INT(MOD(RC1,1000)/62)*16+RC[10],FALSE) -> 324010 | D1601: =HLOOKUP(Sheet1!R2C1,Sheet1!R2C1:R49C1,INT(MOD(RC1,1000)/62)*16+RC[10],FALSE) -> 324020 | E1601: =HLOOKUP(Sheet1!R2C1,Sheet1!R2C1:R49C1,INT(MOD(RC1,1000)/62)*16+RC[10],FALSE) -> 324280 | F1601: =HLOOKUP(Sheet1!R2C1,Sheet1!R2C1:R49C1,INT(MOD(RC1,1000)/62)*16+RC[10],FALSE) -> 324120 | G1601: =HLOOKUP(Sheet1!R2C1,Sheet1!R2C1:R49C1,INT(MOD(RC1,1000)/62)*16+RC[10],FALSE) -> 324400 | K1601: 1 | M1601: =R[-62]C -> 7 | N1601: =R[-62]C -> 9 | O1601: =R[-62]C -> 11 | P1601: =R[-62]C -> 12 | Q1601: =R[-62]C -> 14
A1602: 30158 | B1602: =RC[1] -> 324010 | C1602: =HLOOKUP(Sheet1!R2C1,Sheet1!R2C1:R49C1,INT(MOD(RC1,1000)/62)*16+RC[10],FALSE) -> 324010 | D1602: =HLOOKUP(Sheet1!R2C1,Sheet1!R2C1:R49C1,INT(MOD(RC1,1000)/62)*16+RC[10],FALSE) -> 324020 | E1602: =HLOOKUP(Sheet1!R2C1,Sheet1!R2C1:R49C1,INT(MOD(RC1,1000)/62)*16+RC[10],FALSE) -> 324280 | F1602: =HLOOKUP(Sheet1!R2C1,Sheet1!R2C1:R49C1,INT(MOD(RC1,1000)/62)*16+RC[10],FALSE) -> 324080 | G1602: =HLOOKUP(Sheet1!R2C1,Sheet1!R2C1:R49C1,INT(MOD(RC1,1000)/62)*16+RC[10],FALSE) -> 324400 | K1602: 1 | M1602: =R[-62]C -> 7 | N1602: =R[-62]C -> 9 | O1602: =R[-62]C -> 11 | P1602: =R[-62]C -> 13 | Q1602: =R[-62]C -> 14
A1603: 30159 | B1603: =RC[1] -> 324010 | C1603: =HLOOKUP(Sheet1!R2C1,Sheet1!R2C1:R49C1,INT(MOD(RC1,1000)/62)*16+RC[10],FALSE) -> 324010 | D1603: =HLOOKUP(Sheet1!R2C1,Sheet1!R2C1:R49C1,INT(MOD(RC1,1000)/62)*16+RC[10],FALSE) -> 324020 | E1603: =HLOOKUP(Sheet1!R2C1,Sheet1!R2C1:R49C1,INT(MOD(RC1,1000)/62)*16+RC[10],FALSE) -> 324120 | F1603: =HLOOKUP(Sheet1!R2C1,Sheet1!R2C1:R49C1,INT(MOD(RC1,1000)/62)*16+RC[10],FALSE) -> 324080 | G1603: =HLOOKUP(Sheet1!R2C1,Sheet1!R2C1:R49C1,INT(MOD(RC1,1000)/62)*16+RC[10],FALSE) -> 324400 | K1603: 1 | M1603: =R[-62]C -> 7 | N1603: =R[-62]C -> 9 | O1603: =R[-62]C -> 12 | P1603: =R[-62]C -> 13 | Q1603: =R[-62]C -> 14
A1604: 30160 | B1604: =RC[1] -> 324010 | C1604: =HLOOKUP(Sheet1!R2C1,Sheet1!R2C1:R49C1,INT(MOD(RC1,1000)/62)*16+RC[10],FALSE) -> 324010 | D1604: =HLOOKUP(Sheet1!R2C1,Sheet1!R2C1:R49C1,INT(MOD(RC1,1000)/62)*16+RC[10],FALSE) -> 324200 | E1604: =HLOOKUP(Sheet1!R2C1,Sheet1!R2C1:R49C1,INT(MOD(RC1,1000)/62)*16+RC[10],FALSE) -> 324280 | F1604: =HLOOKUP(Sheet1!R2C1,Sheet1!R2C1:R49C1,INT(MOD(RC1,1000)/62)*16+RC[10],FALSE) -> 324120 | G1604: =HLOOKUP(Sheet1!R2C1,Sheet1!R2C1:R49C1,INT(MOD(RC1,1000)/62)*16+RC[10],FALSE) -> 324080 | K1604: 1 | M1604: =R[-62]C -> 7 | N1604: =R[-62]C -> 10 | O1604: =R[-62]C -> 11 | P1604: =R[-62]C -> 12 | Q1604: =R[-62]C -> 13
A1605: 30161 | B1605: =RC[1] -> 324010 | C1605: =HLOOKUP(Sheet1!R2C1,Sheet1!R2C1:R49C1,INT(MOD(RC1,1000)/62)*16+RC[10],FALSE) -> 324010 | D1605: =HLOOKUP(Sheet1!R2C1,Sheet1!R2C1:R49C1,INT(MOD(RC1,1000)/62)*16+RC[10],FALSE) -> 324200 | E1605: =HLOOKUP(Sheet1!R2C1,Sheet1!R2C1:R49C1,INT(MOD(RC1,1000)/62)*16+RC[10],FALSE) -> 324280 | F1605: =HLOOKUP(Sheet1!R2C1,Sheet1!R2C1:R49C1,INT(MOD(RC1,1000)/62)*16+RC[10],FALSE) -> 324120 | G1605: =HLOOKUP(Sheet1!R2C1,Sheet1!R2C1:R49C1,INT(MOD(RC1,1000)/62)*16+RC[10],FALSE) -> 324400 | K1605: 1 | M1605: =R[-62]C -> 7 | N1605: =R[-62]C -> 10 | O1605: =R[-62]C -> 11 | P1605: =R[-62]C -> 12 | Q1605: =R[-62]C -> 14
A1606: 30162 | B1606: =RC[1] -> 324010 | C1606: =HLOOKUP(Sheet1!R2C1,Sheet1!R2C1:R49C1,INT(MOD(RC1,1000)/62)*16+RC[10],FALSE) -> 324010 | D1606: =HLOOKUP(Sheet1!R2C1,Sheet1!R2C1:R49C1,INT(MOD(RC1,1000)/62)*16+RC[10],FALSE) -> 324200 | E1606: =HLOOKUP(Sheet1!R2C1,Sheet1!R2C1:R49C1,INT(MOD(RC1,1000)/62)*16+RC[10],FALSE) -> 324280 | F1606: =HLOOKUP(Sheet1!R2C1,Sheet1!R2C1:R49C1,INT(MOD(RC1,1000)/62)*16+RC[10],FALSE) -> 324080 | G1606: =HLOOKUP(Sheet1!R2C1,Sheet1!R2C1:R49C1,INT(MOD(RC1,1000)/62)*16+RC[10],FALSE) -> 324400 | K1606: 1 | M1606: =R[-62]C -> 7 | N1606: =R[-62]C -> 10 | O1606: =R[-62]C -> 11 | P1606: =R[-62]C -> 13 | Q1606: =R[-62]C -> 14
A1607: 30163 | B1607: =RC[1] -> 324010 | C1607: =HLOOKUP(Sheet1!R2C1,Sheet1!R2C1:R49C1,INT(MOD(RC1,1000)/62)*16+RC[10],FALSE) -> 324010 | D1607: =HLOOKUP(Sheet1!R2C1,Sheet1!R2C1:R49C1,INT(MOD(RC1,1000)/62)*16+RC[10],FALSE) -> 324200 | E1607: =HLOOKUP(Sheet1!R2C1,Sheet1!R2C1:R49C1,INT(MOD(RC1,1000)/62)*16+RC[10],FALSE) -> 324120 | F1607: =HLOOKUP(Sheet1!R2C1,Sheet1!R2C1:R49C1,INT(MOD(RC1,1000)/62)*16+RC[10],FALSE) -> 324080 | G1607: =HLOOKUP(Sheet1!R2C1,Sheet1!R2C1:R49C1,INT(MOD(RC1,1000)/62)*16+RC[10],FALSE) -> 324400 | K1607: 1 | M1607: =R[-62]C -> 7 | N1607: =R[-62]C -> 10 | O1607: =R[-62]C -> 12 | P1607: =R[-62]C -> 13 | Q1607: =R[-62]C -> 14
A1608: 30164 | B1608: =RC[1] -> 324010 | C1608: =HLOOKUP(Sheet1!R2C1,Sheet1!R2C1:R49C1,INT(MOD(RC1,1000)/62)*16+RC[10],FALSE) -> 324010 | D1608: =HLOOKUP(Sheet1!R2C1,Sheet1!R2C1:R49C1,INT(MOD(RC1,1000)/62)*16+RC[10],FALSE) -> 324280 | E1608: =HLOOKUP(Sheet1!R2C1,Sheet1!R2C1:R49C1,INT(MOD(RC1,1000)/62)*16+RC[10],FALSE) -> 324120 | F1608: =HLOOKUP(Sheet1!R2C1,Sheet1!R2C1:R49C1,INT(MOD(RC1,1000)/62)*16+RC[10],FALSE) -> 324080 | G1608: =HLOOKUP(Sheet1!R2C1,Sheet1!R2C1:R49C1,INT(MOD(RC1,1000)/62)*16+RC[10],FALSE) -> 324400 | K1608: 1 | M1608: =R[-62]C -> 7 | N1608: =R[-62]C -> 11 | O1608: =R[-62]C -> 12 | P1608: =R[-62]C -> 13 | Q1608: =R[-62]C -> 14
A1609: 30165 | B1609: =RC[1] -> 324310 | C1609: =HLOOKUP(Sheet1!R2C1,Sheet1!R2C1:R49C1,INT(MOD(RC1,1000)/62)*16+RC[10],FALSE) -> 324310 | D1609: =HLOOKUP(Sheet1!R2C1,Sheet1!R2C1:R49C1,INT(MOD(RC1,1000)/62)*16+RC[10],FALSE) -> 324020 | E1609: =HLOOKUP(Sheet1!R2C1,Sheet1!R2C1:R49C1,INT(MOD(RC1,1000)/62)*16+RC[10],FALSE) -> 324200 | F1609: =HLOOKUP(Sheet1!R2C1,Sheet1!R2C1:R49C1,INT(MOD(RC1,1000)/62)*16+RC[10],FALSE) -> 324280 | G1609: =HLOOKUP(Sheet1!R2C1,Sheet1!R2C1:R49C1,INT(MOD(RC1,1000)/62)*16+RC[10],FALSE) -> 324120 | K1609: 1 | M1609: =R[-62]C -> 8 | N1609: =R[-62]C -> 9 | O1609: =R[-62]C -> 10 | P1609: =R[-62]C -> 11 | Q1609: =R[-62]C -> 12
A1610: 30166 | B1610: =RC[1] -> 324310 | C1610: =HLOOKUP(Sheet1!R2C1,Sheet1!R2C1:R49C1,INT(MOD(RC1,1000)/62)*16+RC[10],FALSE) -> 324310 | D1610: =HLOOKUP(Sheet1!R2C1,Sheet1!R2C1:R49C1,INT(MOD(RC1,1000)/62)*16+RC[10],FALSE) -> 324020 | E1610: =HLOOKUP(Sheet1!R2C1,Sheet1!R2C1:R49C1,INT(MOD(RC1,1000)/62)*16+RC[10],FALSE) -> 324200 | F1610: =HLOOKUP(Sheet1!R2C1,Sheet1!R2C1:R49C1,INT(MOD(RC1,1000)/62)*16+RC[10],FALSE) -> 324280 | G1610: =HLOOKUP(Sheet1!R2C1,Sheet1!R2C1:R49C1,INT(MOD(RC1,1000)/62)*16+RC[10],FALSE) -> 324080 | K1610: 1 | M1610: =R[-62]C -> 8 | N1610: =R[-62]C -> 9 | O1610: =R[-62]C -> 10 | P1610: =R[-62]C -> 11 | Q1610: =R[-62]C -> 13
A1611: 30167 | B1611: =RC[1] -> 324310 | C1611: =HLOOKUP(Sheet1!R2C1,Sheet1!R2C1:R49C1,INT(MOD(RC1,1000)/62)*16+RC[10],FALSE) -> 324310 | D1611: =HLOOKUP(Sheet1!R2C1,Sheet1!R2C1:R49C1,INT(MOD(RC1,1000)/62)*16+RC[10],FALSE) -> 324020 | E1611: =HLOOKUP(Sheet1!R2C1,Sheet1!R2C1:R49C1,INT(MOD(RC1,1000)/62)*16+RC[10],FALSE) -> 324200 | F1611: =HLOOKUP(Sheet1!R2C1,Sheet1!R2C1:R49C1,INT(MOD(RC1,1000)/62)*16+RC[10],FALSE) -> 324280 | G1611: =HLOOKUP(Sheet1!R2C1,Sheet1!R2C1:R49C1,INT(MOD(RC1,1000)/62)*16+RC[10],FALSE) -> 324400 | K1611: 1 | M1611: =R[-62]C -> 8 | N1611: =R[-62]C -> 9 | O1611: =R[-62]C -> 10 | P1611: =R[-62]C -> 11 | Q1611: =R[-62]C -> 14
A1612: 30168 | B1612: =RC[1] -> 324310 | C1612: =HLOOKUP(Sheet1!R2C1,Sheet1!R2C1:R49C1,INT(MOD(RC1,1000)/62)*16+RC[10],FALSE) -> 324310 | D1612: =HLOOKUP(Sheet1!R2C1,Sheet1!R2C1:R49C1,INT(MOD(RC1,1000)/62)*16+RC[10],FALSE) -> 324020 | E1612: =HLOOKUP(Sheet1!R2C1,Sheet1!R2C1:R49C1,INT(MOD(RC1,1000)/62)*16+RC[10],FALSE) -> 324200 | F1612: =HLOOKUP(Sheet1!R2C1,Sheet1!R2C1:R49C1,INT(MOD(RC1,1000)/62)*16+RC[10],FALSE) -> 324120 | G1612: =HLOOKUP(Sheet1!R2C1,Sheet1!R2C1:R49C1,INT(MOD(RC1,1000)/62)*16+RC[10],FALSE) -> 324080 | K1612: 1 | M1612: =R[-62]C -> 8 | N1612: =R[-62]C -> 9 | O1612: =R[-62]C -> 10 | P1612: =R[-62]C -> 12 | Q1612: =R[-62]C -> 13
A1613: 30169 | B1613: =RC[1] -> 324310 | C1613: =HLOOKUP(Sheet1!R2C1,Sheet1!R2C1:R49C1,INT(MOD(RC1,1000)/62)*16+RC[10],FALSE) -> 324310 | D1613: =HLOOKUP(Sheet1!R2C1,Sheet1!R2C1:R49C1,INT(MOD(RC1,1000)/62)*16+RC[10],FALSE) -> 324020 | E1613: =HLOOKUP(Sheet1!R2C1,Sheet1!R2C1:R49C1,INT(MOD(RC1,1000)/62)*16+RC[10],FALSE) -> 324200 | F1613: =HLOOKUP(Sheet1!R2C1,Sheet1!R2C1:R49C1,INT(MOD(RC1,1000)/62)*16+RC[10],FALSE) -> 324120 | G1613: =HLOOKUP(Sheet1!R2C1,Sheet1!R2C1:R49C1,INT(MOD(RC1,1000)/62)*16+RC[10],FALSE) -> 324400 | K1613: 1 | M1613: =R[-62]C -> 8 | N1613: =R[-62]C -> 9 | O1613: =R[-62]C -> 10 | P1613: =R[-62]C -> 12 | Q1613: =R[-62]C -> 14
A1614: 30170 | B1614: =RC[1] -> 324310 | C1614: =HLOOKUP(Sheet1!R2C1,Sheet1!R2C1:R49C1,INT(MOD(RC1,1000)/62)*16+RC[10],FALSE) -> 324310 | D1614: =HLOOKUP(Sheet1!R2C1,Sheet1!R2C1:R49C1,INT(MOD(RC1,1000)/62)*16+RC[10],FALSE) -> 324020 | E1614: =HLOOKUP(Sheet1!R2C1,Sheet1!R2C1:R49C1,INT(MOD(RC1,1000)/62)*16+RC[10],FALSE) -> 324200 | F1614: =HLOOKUP(Sheet1!R2C1,Sheet1!R2C1:R49C1,INT(MOD(RC1,1000)/62)*16+RC[10],FALSE) -> 324080 | G1614: =HLOOKUP(Sheet1!R2C1,Sheet1!R2C1:R49C1,INT(MOD(RC1,1000)/62)*16+RC[10],FALSE) -> 324400 | K1614: 1 | M1614: =R[-62]C -> 8 | N1614: =R[-62]C -> 9 | O1614: =R[-62]C -> 10 | P1614: =R[-62]C -> 13 | Q1614: =R[-62]C -> 14
A1615: 30171 | B1615: =RC[1] -> 324310 | C1615: =HLOOKUP(Sheet1!R2C1,Sheet1!R2C1:R49C1,INT(MOD(RC1,1000)/62)*16+RC[10],FALSE) -> 324310 | D1615: =HLOOKUP(Sheet1!R2C1,Sheet1!R2C1:R49C1,INT(MOD(RC1,1000)/62)*16+RC[10],FALSE) -> 324020 | E1615: =HLOOKUP(Sheet1!R2C1,Sheet1!R2C1:R49C1,INT(MOD(RC1,1000)/62)*16+RC[10],FALSE) -> 324280 | F1615: =HLOOKUP(Sheet1!R2C1,Sheet1!R2C1:R49C1,INT(MOD(RC1,1000)/62)*16+RC[10],FALSE) -> 324120 | G1615: =HLOOKUP(Sheet1!R2C1,Sheet1!R2C1:R49C1,INT(MOD(RC1,1000)/62)*16+RC[10],FALSE) -> 324080 | K1615: 1 | M1615: =R[-62]C -> 8 | N1615: =R[-62]C -> 9 | O1615: =R[-62]C -> 11 | P1615: =R[-62]C -> 12 | Q1615: =R[-62]C -> 13
A1616: 30172 | B1616: =RC[1] -> 324310 | C1616: =HLOOKUP(Sheet1!R2C1,Sheet1!R2C1:R49C1,INT(MOD(RC1,1000)/62)*16+RC[10],FALSE) -> 324310 | D1616: =HLOOKUP(Sheet1!R2C1,Sheet1!R2C1:R49C1,INT(MOD(RC1,1000)/62)*16+RC[10],FALSE) -> 324020 | E1616: =HLOOKUP(Sheet1!R2C1,Sheet1!R2C1:R49C1,INT(MOD(RC1,1000)/62)*16+RC[10],FALSE) -> 324280 | F1616: =HLOOKUP(Sheet1!R2C1,Sheet1!R2C1:R49C1,INT(MOD(RC1,1000)/62)*16+RC[10],FALSE) -> 324120 | G1616: =HLOOKUP(Sheet1!R2C1,Sheet1!R2C1:R49C1,INT(MOD(RC1,1000)/62)*16+RC[10],FALSE) -> 324400 | K1616: 1 | M1616: =R[-62]C -> 8 | N1616: =R[-62]C -> 9 | O1616: =R[-62]C -> 11 | P1616: =R[-62]C -> 12 | Q1616: =R[-62]C -> 14
A1617: 30173 | B1617: =RC[1] -> 324310 | C1617: =HLOOKUP(Sheet1!R2C1,Sheet1!R2C1:R49C1,INT(MOD(RC1,1000)/62)*16+RC[10],FALSE) -> 324310 | D1617: =HLOOKUP(Sheet1!R2C1,Sheet1!R2C1:R49C1,INT(MOD(RC1,1000)/62)*16+RC[10],FALSE) -> 324020 | E1617: =HLOOKUP(Sheet1!R2C1,Sheet1!R2C1:R49C1,INT(MOD(RC1,1000)/62)*16+RC[10],FALSE) -> 324280 | F1617: =HLOOKUP(Sheet1!R2C1,Sheet1!R2C1:R49C1,INT(MOD(RC1,1000)/62)*16+RC[10],FALSE) -> 324080 | G1617: =HLOOKUP(Sheet1!R2C1,Sheet1!R2C1:R49C1,INT(MOD(RC1,1000)/62)*16+RC[10],FALSE) -> 324400 | K1617: 1 | M1617: =R[-62]C -> 8 | N1617: =R[-62]C -> 9 | O1617: =R[-62]C -> 11 | P1617: =R[-62]C -> 13 | Q1617: =R[-62]C -> 14
A1618: 30174 | B1618: =RC[1] -> 324310 | C1618: =HLOOKUP(Sheet1!R2C1,Sheet1!R2C1:R49C1,INT(MOD(RC1,1000)/62)*16+RC[10],FALSE) -> 324310 | D1618: =HLOOKUP(Sheet1!R2C1,Sheet1!R2C1:R49C1,INT(MOD(RC1,1000)/62)*16+RC[10],FALSE) -> 324020 | E1618: =HLOOKUP(Sheet1!R2C1,Sheet1!R2C1:R49C1,INT(MOD(RC1,1000)/62)*16+RC[10],FALSE) -> 324120 | F1618: =HLOOKUP(Sheet1!R2C1,Sheet1!R2C1:R49C1,INT(MOD(RC1,1000)/62)*16+RC[10],FALSE) -> 324080 | G1618: =HLOOKUP(Sheet1!R2C1,Sheet1!R2C1:R49C1,INT(MOD(RC1,1000)/62)*16+RC[10],FALSE) -> 324400 | K1618: 1 | M1618: =R[-62]C -> 8 | N1618: =R[-62]C -> 9 | O1618: =R[-62]C -> 12 | P1618: =R[-62]C -> 13 | Q1618: =R[-62]C -> 14
A1619: 30175 | B1619: =RC[1] -> 324310 | C1619: =HLOOKUP(Sheet1!R2C1,Sheet1!R2C1:R49C1,INT(MOD(RC1,1000)/62)*16+RC[10],FALSE) -> 324310 | D1619: =HLOOKUP(Sheet1!R2C1,Sheet1!R2C1:R49C1,INT(MOD(RC1,1000)/62)*16+RC[10],FALSE) -> 324200 | E1619: =HLOOKUP(Sheet1!R2C1,Sheet1!R2C1:R49C1,INT(MOD(RC1,1000)/62)*16+RC[10],FALSE) -> 324280 | F1619: =HLOOKUP(Sheet1!R2C1,Sheet1!R2C1:R49C1,INT(MOD(RC1,1000)/62)*16+RC[10],FALSE) -> 324120 | G1619: =HLOOKUP(Sheet1!R2C1,Sheet1!R2C1:R49C1,INT(MOD(RC1,1000)/62)*16+RC[10],FALSE) -> 324080 | K1619: 1 | M1619: =R[-62]C -> 8 | N1619: =R[-62]C -> 10 | O1619: =R[-62]C -> 11 | P1619: =R[-62]C -> 12 | Q1619: =R[-62]C -> 13
A1620: 30176 | B1620: =RC[1] -> 324310 | C1620: =HLOOKUP(Sheet1!R2C1,Sheet1!R2C1:R49C1,INT(MOD(RC1,1000)/62)*16+RC[10],FALSE) -> 324310 | D1620: =HLOOKUP(Sheet1!R2C1,Sheet1!R2C1:R49C1,INT(MOD(RC1,1000)/62)*16+RC[10],FALSE) -> 324200 | E1620: =HLOOKUP(Sheet1!R2C1,Sheet1!R2C1:R49C1,INT(MOD(RC1,1000)/62)*16+RC[10],FALSE) -> 324280 | F1620: =HLOOKUP(Sheet1!R2C1,Sheet1!R2C1:R49C1,INT(MOD(RC1,1000)/62)*16+RC[10],FALSE) -> 324120 | G1620: =HLOOKUP(Sheet1!R2C1,Sheet1!R2C1:R49C1,INT(MOD(RC1,1000)/62)*16+RC[10],FALSE) -> 324400 | K1620: 1 | M1620: =R[-62]C -> 8 | N1620: =R[-62]C -> 10 | O1620: =R[-62]C -> 11 | P1620: =R[-62]C -> 12 | Q1620: =R[-62]C -> 14
A1621: 30177 | B1621: =RC[1] -> 324310 | C1621: =HLOOKUP(Sheet1!R2C1,Sheet1!R2C1:R49C1,INT(MOD(RC1,1000)/62)*16+RC[10],FALSE) -> 324310 | D1621: =HLOOKUP(Sheet1!R2C1,Sheet1!R2C1:R49C1,INT(MOD(RC1,1000)/62)*16+RC[10],FALSE) -> 324200 | E1621: =HLOOKUP(Sheet1!R2C1,Sheet1!R2C1:R49C1,INT(MOD(RC1,1000)/62)*16+RC[10],FALSE) -> 324280 | F1621: =HLOOKUP(Sheet1!R2C1,Sheet1!R2C1:R49C1,INT(MOD(RC1,1000)/62)*16+RC[10],FALSE) -> 324080 | G1621: =HLOOKUP(Sheet1!R2C1,Sheet1!R2C1:R49C1,INT(MOD(RC1,1000)/62)*16+RC[10],FALSE) -> 324400 | K1621: 1 | M1621: =R[-62]C -> 8 | N1621: =R[-62]C -> 10 | O1621: =R[-62]C -> 11 | P1621: =R[-62]C -> 13 | Q1621: =R[-62]C -> 14
A1622: 30178 | B1622: =RC[1] -> 324310 | C1622: =HLOOKUP(Sheet1!R2C1,Sheet1!R2C1:R49C1,INT(MOD(RC1,1000)/62)*16+RC[10],FALSE) -> 324310 | D1622: =HLOOKUP(Sheet1!R2C1,Sheet1!R2C1:R49C1,INT(MOD(RC1,1000)/62)*16+RC[10],FALSE) -> 324200 | E1622: =HLOOKUP(Sheet1!R2C1,Sheet1!R2C1:R49C1,INT(MOD(RC1,1000)/62)*16+RC[10],FALSE) -> 324120 | F1622: =HLOOKUP(Sheet1!R2C1,Sheet1!R2C1:R49C1,INT(MOD(RC1,1000)/62)*16+RC[10],FALSE) -> 324080 | G1622: =HLOOKUP(Sheet1!R2C1,Sheet1!R2C1:R49C1,INT(MOD(RC1,1000)/62)*16+RC[10],FALSE) -> 324400 | K1622: 1 | M1622: =R[-62]C -> 8 | N1622: =R[-62]C -> 10 | O1622: =R[-62]C -> 12 | P1622: =R[-62]C -> 13 | Q1622: =R[-62]C -> 14
A1623: 30179 | B1623: =RC[1] -> 324310 | C1623: =HLOOKUP(Sheet1!R2C1,Sheet1!R2C1:R49C1,INT(MOD(RC1,1000)/62)*16+RC[10],FALSE) -> 324310 | D1623: =HLOOKUP(Sheet1!R2C1,Sheet1!R2C1:R49C1,INT(MOD(RC1,1000)/62)*16+RC[10],FALSE) -> 324280 | E1623: =HLOOKUP(Sheet1!R2C1,Sheet1!R2C1:R49C1,INT(MOD(RC1,1000)/62)*16+RC[10],FALSE) -> 324120 | F1623: =HLOOKUP(Sheet1!R2C1,Sheet1!R2C1:R49C1,INT(MOD(RC1,1000)/62)*16+RC[10],FALSE) -> 324080 | G1623: =HLOOKUP(Sheet1!R2C1,Sheet1!R2C1:R49C1,INT(MOD(RC1,1000)/62)*16+RC[10],FALSE) -> 324400 | K1623: 1 | M1623: =R[-62]C -> 8 | N1623: =R[-62]C -> 11 | O1623: =R[-62]C -> 12 | P1623: =R[-62]C -> 13 | Q1623: =R[-62]C -> 14
A1624: 30180 | B1624: =RC[1] -> 324020 | C1624: =HLOOKUP(Sheet1!R2C1,Sheet1!R2C1:R49C1,INT(MOD(RC1,1000)/62)*16+RC[10],FALSE) -> 324020 | D1624: =HLOOKUP(Sheet1!R2C1,Sheet1!R2C1:R49C1,INT(MOD(RC1,1000)/62)*16+RC[10],FALSE) -> 324200 | E1624: =HLOOKUP(Sheet1!R2C1,Sheet1!R2C1:R49C1,INT(MOD(RC1,1000)/62)*16+RC[10],FALSE) -> 324280 | F1624: =HLOOKUP(Sheet1!R2C1,Sheet1!R2C1:R49C1,INT(MOD(RC1,1000)/62)*16+RC[10],FALSE) -> 324120 | G1624: =HLOOKUP(Sheet1!R2C1,Sheet1!R2C1:R49C1,INT(MOD(RC1,1000)/62)*16+RC[10],FALSE) -> 324080 | K1624: 1 | M1624: =R[-62]C -> 9 | N1624: =R[-62]C -> 10 | O1624: =R[-62]C -> 11 | P1624: =R[-62]C -> 12 | Q1624: =R[-62]C -> 13
A1625: 30181 | B1625: =RC[1] -> 324020 | C1625: =HLOOKUP(Sheet1!R2C1,Sheet1!R2C1:R49C1,INT(MOD(RC1,1000)/62)*16+RC[10],FALSE) -> 324020 | D1625: =HLOOKUP(Sheet1!R2C1,Sheet1!R2C1:R49C1,INT(MOD(RC1,1000)/62)*16+RC[10],FALSE) -> 324200 | E1625: =HLOOKUP(Sheet1!R2C1,Sheet1!R2C1:R49C1,INT(MOD(RC1,1000)/62)*16+RC[10],FALSE) -> 324280 | F1625: =HLOOKUP(Sheet1!R2C1,Sheet1!R2C1:R49C1,INT(MOD(RC1,1000)/62)*16+RC[10],FALSE) -> 324120 | G1625: =HLOOKUP(Sheet1!R2C1,Sheet1!R2C1:R49C1,INT(MOD(RC1,1000)/62)*16+RC[10],FALSE) -> 324400 | K1625: 1 | M1625: =R[-62]C -> 9 | N1625: =R[-62]C -> 10 | O1625: =R[-62]C -> 11 | P1625: =R[-62]C -> 12 | Q1625: =R[-62]C -> 14
A1626: 30182 | B1626: =RC[1] -> 324020 | C1626: =HLOOKUP(Sheet1!R2C1,Sheet1!R2C1:R49C1,INT(MOD(RC1,1000)/62)*16+RC[10],FALSE) -> 324020 | D1626: =HLOOKUP(Sheet1!R2C1,Sheet1!R2C1:R49C1,INT(MOD(RC1,1000)/62)*16+RC[10],FALSE) -> 324200 | E1626: =HLOOKUP(Sheet1!R2C1,Sheet1!R2C1:R49C1,INT(MOD(RC1,1000)/62)*16+RC[10],FALSE) -> 324280 | F1626: =HLOOKUP(Sheet1!R2C1,Sheet1!R2C1:R49C1,INT(MOD(RC1,1000)/62)*16+RC[10],FALSE) -> 324080 | G1626: =HLOOKUP(Sheet1!R2C1,Sheet1!R2C1:R49C1,INT(MOD(RC1,1000)/62)*16+RC[10],FALSE) -> 324400 | K1626: 1 | M1626: =R[-62]C -> 9 | N1626: =R[-62]C -> 10 | O1626: =R[-62]C -> 11 | P1626: =R[-62]C -> 13 | Q1626: =R[-62]C -> 14
A1627: 30183 | B1627: =RC[1] -> 324020 | C1627: =HLOOKUP(Sheet1!R2C1,Sheet1!R2C1:R49C1,INT(MOD(RC1,1000)/62)*16+RC[10],FALSE) -> 324020 | D1627: =HLOOKUP(Sheet1!R2C1,Sheet1!R2C1:R49C1,INT(MOD(RC1,1000)/62)*16+RC[10],FALSE) -> 324200 | E1627: =HLOOKUP(Sheet1!R2C1,Sheet1!R2C1:R49C1,INT(MOD(RC1,1000)/62)*16+RC[10],FALSE) -> 324120 | F1627: =HLOOKUP(Sheet1!R2C1,Sheet1!R2C1:R49C1,INT(MOD(RC1,1000)/62)*16+RC[10],FALSE) -> 324080 | G1627: =HLOOKUP(Sheet1!R2C1,Sheet1!R2C1:R49C1,INT(MOD(RC1,1000)/62)*16+RC[10],FALSE) -> 324400 | K1627: 1 | M1627: =R[-62]C -> 9 | N1627: =R[-62]C -> 10 | O1627: =R[-62]C -> 12 | P1627: =R[-62]C -> 13 | Q1627: =R[-62]C -> 14
A1628: 30184 | B1628: =RC[1] -> 324020 | C1628: =HLOOKUP(Sheet1!R2C1,Sheet1!R2C1:R49C1,INT(MOD(RC1,1000)/62)*16+RC[10],FALSE) -> 324020 | D1628: =HLOOKUP(Sheet1!R2C1,Sheet1!R2C1:R49C1,INT(MOD(RC1,1000)/62)*16+RC[10],FALSE) -> 324280 | E1628: =HLOOKUP(Sheet1!R2C1,Sheet1!R2C1:R49C1,INT(MOD(RC1,1000)/62)*16+RC[10],FALSE) -> 324120 | F1628: =HLOOKUP(Sheet1!R2C1,Sheet1!R2C1:R49C1,INT(MOD(RC1,1000)/62)*16+RC[10],FALSE) -> 324080 | G1628: =HLOOKUP(Sheet1!R2C1,Sheet1!R2C1:R49C1,INT(MOD(RC1,1000)/62)*16+RC[10],FALSE) -> 324400 | K1628: 1 | M1628: =R[-62]C -> 9 | N1628: =R[-62]C -> 11 | O1628: =R[-62]C -> 12 | P1628: =R[-62]C -> 13 | Q1628: =R[-62]C -> 14
A1629: 30185 | B1629: =RC[1] -> 324200 | C1629: =HLOOKUP(Sheet1!R2C1,Sheet1!R2C1:R49C1,INT(MOD(RC1,1000)/62)*16+RC[10],FALSE) -> 324200 | D1629: =HLOOKUP(Sheet1!R2C1,Sheet1!R2C1:R49C1,INT(MOD(RC1,1000)/62)*16+RC[10],FALSE) -> 324280 | E1629: =HLOOKUP(Sheet1!R2C1,Sheet1!R2C1:R49C1,INT(MOD(RC1,1000)/62)*16+RC[10],FALSE) -> 324120 | F1629: =HLOOKUP(Sheet1!R2C1,Sheet1!R2C1:R49C1,INT(MOD(RC1,1000)/62)*16+RC[10],FALSE) -> 324080 | G1629: =HLOOKUP(Sheet1!R2C1,Sheet1!R2C1:R49C1,INT(MOD(RC1,1000)/62)*16+RC[10],FALSE) -> 324400 | K1629: 1 | M1629: =R[-62]C -> 10 | N1629: =R[-62]C -> 11 | O1629: =R[-62]C -> 12 | P1629: =R[-62]C -> 13 | Q1629: =R[-62]C -> 14
A1630: 5101 | B1630: 50001 | C1630: 50001 | D1630: 0 | E1630: 0 | F1630: 0 | G1630: 0 | K1630: 3 | L1630: 日常副本
A1631: 5102 | B1631: 50006 | C1631: 50006 | D1631: 0 | E1631: 0 | F1631: 0 | G1631: 0 | K1631: 3
A1632: 5103 | B1632: 50011 | C1632: 50011 | D1632: 0 | E1632: 0 | F1632: 0 | G1632: 0 | K1632: 3
A1633: 5104 | B1633: 50016 | C1633: 50016 | D1633: 0 | E1633: 0 | F1633: 0 | G1633: 0 | K1633: 3
A1634: 5105 | B1634: 50021 | C1634: 50021 | D1634: 0 | E1634: 0 | F1634: 0 | G1634: 0 | K1634: 3
A1635: 5106 | B1635: 50026 | C1635: 50026 | D1635: 0 | E1635: 0 | F1635: 0 | G1635: 0 | K1635: 3
A1636: 5107 | B1636: 50031 | C1636: 50031 | D1636: 0 | E1636: 0 | F1636: 0 | G1636: 0 | K1636: 3
A1637: 5108 | B1637: 50036 | C1637: 50036 | D1637: 0 | E1637: 0 | F1637: 0 | G1637: 0 | K1637: 3
A1638: 5109 | B1638: 50041 | C1638: 50041 | D1638: 0 | E1638: 0 | F1638: 0 | G1638: 0 | K1638: 3
A1639: 5110 | B1639: 50046 | C1639: 50046 | D1639: 0 | E1639: 0 | F1639: 0 | G1639: 0 | K1639: 3
A1640: 5111 | B1640: 50051 | C1640: 50051 | D1640: 0 | E1640: 0 | F1640: 0 | G1640: 0 | K1640: 3
A1641: 5112 | B1641: 50056 | C1641: 50056 | D1641: 0 | E1641: 0 | F1641: 0 | G1641: 0 | K1641: 3
A1642: 5201 | B1642: 50101 | C1642: 50101 | D1642: 0 | E1642: 0 | F1642: 0 | G1642: 0 | K1642: 3
A1643: 5202 | B1643: 50106 | C1643: 50106 | D1643: 0 | E1643: 0 | F1643: 0 | G1643: 0 | K1643: 3
A1644: 5203 | B1644: 50111 | C1644: 50111 | D1644: 0 | E1644: 0 | F1644: 0 | G1644: 0 | K1644: 3
A1645: 5204 | B1645: 50116 | C1645: 50116 | D1645: 0 | E1645: 0 | F1645: 0 | G1645: 0 | K1645: 3
A1646: 5205 | B1646: 50121 | C1646: 50121 | D1646: 0 | E1646: 0 | F1646: 0 | G1646: 0 | K1646: 3
A1647: 5206 | B1647: 50126 | C1647: 50126 | D1647: 0 | E1647: 0 | F1647: 0 | G1647: 0 | K1647: 3
A1648: 5207 | B1648: 50131 | C1648: 50131 | D1648: 0 | E1648: 0 | F1648: 0 | G1648: 0 | K1648: 3
A1649: 5208 | B1649: 50136 | C1649: 50136 | D1649: 0 | E1649: 0 | F1649: 0 | G1649: 0 | K1649: 3
A1650: 5209 | B1650: 50141 | C1650: 50141 | D1650: 0 | E1650: 0 | F1650: 0 | G1650: 0 | K1650: 3
A1651: 5210 | B1651: 50146 | C1651: 50146 | D1651: 0 | E1651: 0 | F1651: 0 | G1651: 0 | K1651: 3
A1652: 5211 | B1652: 50151 | C1652: 50151 | D1652: 0 | E1652: 0 | F1652: 0 | G1652: 0 | K1652: 3
A1653: 5212 | B1653: 50156 | C1653: 50156 | D1653: 0 | E1653: 0 | F1653: 0 | G1653: 0 | K1653: 3
A1654: 5301 | B1654: 50201 | C1654: 50201 | D1654: 50202 | E1654: 50203 | F1654: 50204 | G1654: 50205 | K1654: 3
A1655: 5302 | B1655: 50206 | C1655: 50206 | D1655: 50207 | E1655: 50208 | F1655: 50209 | G1655: 50210 | K1655: 3
A1656: 5303 | B1656: 50211 | C1656: 50211 | D1656: 50212 | E1656: 50213 | F1656: 50214 | G1656: 50215 | K1656: 3
A1657: 5304 | B1657: 50216 | C1657: 50216 | D1657: 50217 | E1657: 50218 | F1657: 50219 | G1657: 50220 | K1657: 3
A1658: 5305 | B1658: 50221 | C1658: 50221 | D1658: 50222 | E1658: 50223 | F1658: 50224 | G1658: 50225 | K1658: 3
A1659: 5306 | B1659: 50226 | C1659: 50226 | D1659: 50227 | E1659: 50228 | F1659: 50229 | G1659: 50230 | K1659: 3
A1660: 5307 | B1660: 50231 | C1660: 50231 | D1660: 50232 | E1660: 50233 | F1660: 50234 | G1660: 50235 | K1660: 3
A1661: 5308 | B1661: 50236 | C1661: 50236 | D1661: 50237 | E1661: 50238 | F1661: 50239 | G1661: 50240 | K1661: 3
A1662: 5309 | B1662: 50241 | C1662: 50241 | D1662: 50242 | E1662: 50243 | F1662: 50244 | G1662: 50245 | K1662: 3
A1663: 5310 | B1663: 50246 | C1663: 50246 | D1663: 50247 | E1663: 50248 | F1663: 50249 | G1663: 50250 | K1663: 3
A1664: 5311 | B1664: 50251 | C1664: 50251 | D1664: 50252 | E1664: 50253 | F1664: 50254 | G1664: 50255 | K1664: 3
A1665: 5312 | B1665: 50256 | C1665: 50256 | D1665: 50257 | E1665: 50258 | F1665: 50259 | G1665: 50260 | K1665: 3
A1666: 5401 | B1666: 50301 | C1666: 50301 | D1666: 0 | E1666: 0 | F1666: 0 | G1666: 0 | K1666: 3
A1667: 5402 | B1667: 50306 | C1667: 50306 | D1667: 0 | E1667: 0 | F1667: 0 | G1667: 0 | K1667: 3
A1668: 5403 | B1668: 50311 | C1668: 50311 | D1668: 0 | E1668: 0 | F1668: 0 | G1668: 0 | K1668: 3
A1669: 5404 | B1669: 50316 | C1669: 50316 | D1669: 0 | E1669: 0 | F1669: 0 | G1669: 0 | K1669: 3
A1670: 5405 | B1670: 50321 | C1670: 50321 | D1670: 0 | E1670: 0 | F1670: 0 | G1670: 0 | K1670: 3
A1671: 5406 | B1671: 50326 | C1671: 50326 | D1671: 0 | E1671: 0 | F1671: 0 | G1671: 0 | K1671: 3
A1672: 5407 | B1672: 50331 | C1672: 50331 | D1672: 0 | E1672: 0 | F1672: 0 | G1672: 0 | K1672: 3
A1673: 5408 | B1673: 50336 | C1673: 50336 | D1673: 0 | E1673: 0 | F1673: 0 | G1673: 0 | K1673: 3
A1674: 5409 | B1674: 50341 | C1674: 50341 | D1674: 0 | E1674: 0 | F1674: 0 | G1674: 0 | K1674: 3
A1675: 5410 | B1675: 50346 | C1675: 50346 | D1675: 0 | E1675: 0 | F1675: 0 | G1675: 0 | K1675: 3
A1676: 5411 | B1676: 50351 | C1676: 50351 | D1676: 0 | E1676: 0 | F1676: 0 | G1676: 0 | K1676: 3
A1677: 5412 | B1677: 50356 | C1677: 50356 | D1677: 0 | E1677: 0 | F1677: 0 | G1677: 0 | K1677: 3
A1678: 5501 | B1678: 50401 | C1678: 50401 | D1678: 0 | E1678: 0 | F1678: 0 | G1678: 0 | K1678: 3
A1679: 5502 | B1679: 50406 | C1679: 50406 | D1679: 0 | E1679: 0 | F1679: 0 | G1679: 0 | K1679: 3
A1680: 5503 | B1680: 50411 | C1680: 50411 | D1680: 0 | E1680: 0 | F1680: 0 | G1680: 0 | K1680: 3
A1681: 5504 | B1681: 50416 | C1681: 50416 | D1681: 0 | E1681: 0 | F1681: 0 | G1681: 0 | K1681: 3
A1682: 5505 | B1682: 50421 | C1682: 50421 | D1682: 0 | E1682: 0 | F1682: 0 | G1682: 0 | K1682: 3
A1683: 5506 | B1683: 50426 | C1683: 50426 | D1683: 0 | E1683: 0 | F1683: 0 | G1683: 0 | K1683: 3
A1684: 5507 | B1684: 50431 | C1684: 50431 | D1684: 0 | E1684: 0 | F1684: 0 | G1684: 0 | K1684: 3
A1685: 5508 | B1685: 50436 | C1685: 50436 | D1685: 0 | E1685: 0 | F1685: 0 | G1685: 0 | K1685: 3
A1686: 5509 | B1686: 50441 | C1686: 50441 | D1686: 0 | E1686: 0 | F1686: 0 | G1686: 0 | K1686: 3
A1687: 5510 | B1687: 50446 | C1687: 50446 | D1687: 0 | E1687: 0 | F1687: 0 | G1687: 0 | K1687: 3
A1688: 5511 | B1688: 50451 | C1688: 50451 | D1688: 0 | E1688: 0 | F1688: 0 | G1688: 0 | K1688: 3
A1689: 5512 | B1689: 50456 | C1689: 50456 | D1689: 0 | E1689: 0 | F1689: 0 | G1689: 0 | K1689: 3
A1690: 5601 | B1690: 50501 | C1690: 50501 | D1690: 50502 | E1690: 50503 | F1690: 50504 | G1690: 50505 | K1690: 3
A1691: 5602 | B1691: 50506 | C1691: 50506 | D1691: 50507 | E1691: 50508 | F1691: 50509 | G1691: 50510 | K1691: 3
A1692: 5603 | B1692: 50511 | C1692: 50511 | D1692: 50512 | E1692: 50513 | F1692: 50514 | G1692: 50515 | K1692: 3
A1693: 5604 | B1693: 50516 | C1693: 50516 | D1693: 50517 | E1693: 50518 | F1693: 50519 | G1693: 50520 | K1693: 3
A1694: 5605 | B1694: 50521 | C1694: 50521 | D1694: 50522 | E1694: 50523 | F1694: 50524 | G1694: 50525 | K1694: 3
A1695: 5606 | B1695: 50526 | C1695: 50526 | D1695: 50527 | E1695: 50528 | F1695: 50529 | G1695: 50530 | K1695: 3
A1696: 5607 | B1696: 50531 | C1696: 50531 | D1696: 50532 | E1696: 50533 | F1696: 50534 | G1696: 50535 | K1696: 3
A1697: 5608 | B1697: 50536 | C1697: 50536 | D1697: 50537 | E1697: 50538 | F1697: 50539 | G1697: 50540 | K1697: 3
A1698: 5609 | B1698: 50541 | C1698: 50541 | D1698: 50542 | E1698: 50543 | F1698: 50544 | G1698: 50545 | K1698: 3
A1699: 5610 | B1699: 50546 | C1699: 50546 | D1699: 50547 | E1699: 50548 | F1699: 50549 | G1699: 50550 | K1699: 3
A1700: 5611 | B1700: 50551 | C1700: 50551 | D1700: 50552 | E1700: 50553 | F1700: 50554 | G1700: 50555 | K1700: 3
A1701: 5612 | B1701: 50556 | C1701: 50556 | D1701: 50557 | E1701: 50558 | F1701: 50559 | G1701: 50560 | K1701: 3
A1702: 60011 | B1702: =RC[-1]*10+RC[12] -> 600111 | C1702: 600111 | D1702: 600112 | E1702: 600113 | F1702: 600114 | G1702: 600115 | K1702: 3 | L1702: 英雄副本 | M1702: 防暴警察 | N1702: =VLOOKUP(RC[-1],Sheet1!R3C6:R129C7,2,FALSE) -> 1
A1703: 60012 | B1703: =RC[-1]*10+RC[12] -> 600124 | C1703: 600121 | D1703: 600122 | E1703: 600123 | F1703: 600124 | G1703: 600125 | K1703: 3 | M1703: 炮火智能机 | N1703: =VLOOKUP(RC[-1],Sheet1!R3C6:R129C7,2,FALSE) -> 4
A1704: 60013 | B1704: =RC[-1]*10+RC[12] -> 600132 | C1704: 600131 | D1704: 600132 | E1704: 600133 | F1704: 600134 | G1704: 600135 | K1704: 3 | M1704: 战争机甲 | N1704: =VLOOKUP(RC[-1],Sheet1!R3C6:R129C7,2,FALSE) -> 2
A1705: 60014 | B1705: =RC[-1]*10+RC[12] -> 600142 | C1705: 600141 | D1705: 600142 | E1705: 600143 | F1705: 600144 | G1705: 600145 | K1705: 3 | M1705: 树人 | N1705: =VLOOKUP(RC[-1],Sheet1!R3C6:R129C7,2,FALSE) -> 2
A1706: 60021 | B1706: =RC[-1]*10+RC[12] -> 600211 | C1706: 600211 | D1706: 600212 | E1706: 600213 | F1706: 600214 | G1706: 600215 | K1706: 3 | M1706: 地精盗贼 | N1706: =VLOOKUP(RC[-1],Sheet1!R3C6:R129C7,2,FALSE) -> 1
A1707: 60022 | B1707: =RC[-1]*10+RC[12] -> 600222 | C1707: 600221 | D1707: 600222 | E1707: 600223 | F1707: 600224 | G1707: 600225 | K1707: 3 | M1707: 骷髅战士 | N1707: =VLOOKUP(RC[-1],Sheet1!R3C6:R129C7,2,FALSE) -> 2
A1708: 60023 | B1708: =RC[-1]*10+RC[12] -> 600233 | C1708: 600231 | D1708: 600232 | E1708: 600233 | F1708: 600234 | G1708: 600235 | K1708: 3 | M1708: 矮人火枪手 | N1708: =VLOOKUP(RC[-1],Sheet1!R3C6:R129C7,2,FALSE) -> 3
A1709: 60024 | B1709: =RC[-1]*10+RC[12] -> 600241 | C1709: 600241 | D1709: 600242 | E1709: 600243 | F1709: 600244 | G1709: 600245 | K1709: 3 | M1709: 半人马 | N1709: =VLOOKUP(RC[-1],Sheet1!R3C6:R129C7,2,FALSE) -> 1
A1710: 60031 | B1710: =RC[-1]*10+RC[12] -> 600312 | C1710: 600311 | D1710: 600312 | E1710: 600313 | F1710: 600314 | G1710: 600315 | K1710: 3 | M1710: 盔甲武士 | N1710: =VLOOKUP(RC[-1],Sheet1!R3C6:R129C7,2,FALSE) -> 2
A1711: 60032 | B1711: =RC[-1]*10+RC[12] -> 600323 | C1711: 600321 | D1711: 600322 | E1711: 600323 | F1711: 600324 | G1711: 600325 | K1711: 3 | M1711: 弓弩刺客 | N1711: =VLOOKUP(RC[-1],Sheet1!R3C6:R129C7,2,FALSE) -> 3
A1712: 60033 | B1712: =RC[-1]*10+RC[12] -> 600331 | C1712: 600331 | D1712: 600332 | E1712: 600333 | F1712: 600334 | G1712: 600335 | K1712: 3 | M1712: 角斗士 | N1712: =VLOOKUP(RC[-1],Sheet1!R3C6:R129C7,2,FALSE) -> 1
A1713: 60034 | B1713: =RC[-1]*10+RC[12] -> 600343 | C1713: 600341 | D1713: 600342 | E1713: 600343 | F1713: 600344 | G1713: 600345 | K1713: 3 | M1713: 亚马逊女王 | N1713: =VLOOKUP(RC[-1],Sheet1!R3C6:R129C7,2,FALSE) -> 3
A1714: 60035 | B1714: =RC[-1]*10+RC[12] -> 600354 | C1714: 600351 | D1714: 600352 | E1714: 600353 | F1714: 600354 | G1714: 600355 | K1714: 3 | M1714: 狩猎女神 | N1714: =VLOOKUP(RC[-1],Sheet1!R3C6:R129C7,2,FALSE) -> 4
A1715: 60041 | B1715: =RC[-1]*10+RC[12] -> 600412 | C1715: 600411 | D1715: 600412 | E1715: 600413 | F1715: 600414 | G1715: 600415 | K1715: 3 | M1715: 盔甲武士 | N1715: =VLOOKUP(RC[-1],Sheet1!R3C6:R129C7,2,FALSE) -> 2
A1716: 60042 | B1716: =RC[-1]*10+RC[12] -> 600421 | C1716: 600421 | D1716: 600422 | E1716: 600423 | F1716: 600424 | G1716: 600425 | K1716: 3 | M1716: 角斗士 | N1716: =VLOOKUP(RC[-1],Sheet1!R3C6:R129C7,2,FALSE) -> 1
A1717: 60043 | B1717: =RC[-1]*10+RC[12] -> 600433 | C1717: 600431 | D1717: 600432 | E1717: 600433 | F1717: 600434 | G1717: 600435 | K1717: 3 | M1717: 亚马逊女王 | N1717: =VLOOKUP(RC[-1],Sheet1!R3C6:R129C7,2,FALSE) -> 3
A1718: 60044 | B1718: =RC[-1]*10+RC[12] -> 600442 | C1718: 600441 | D1718: 600442 | E1718: 600443 | F1718: 600444 | G1718: 600445 | K1718: 3 | M1718: 斯巴达 | N1718: =VLOOKUP(RC[-1],Sheet1!R3C6:R129C7,2,FALSE) -> 2
A1719: 60051 | B1719: =RC[-1]*10+RC[12] -> 600511 | C1719: 600511 | D1719: 600512 | E1719: 600513 | F1719: 600514 | G1719: 600515 | K1719: 3 | M1719: 防暴警察 | N1719: =VLOOKUP(RC[-1],Sheet1!R3C6:R129C7,2,FALSE) -> 1
A1720: 60052 | B1720: =RC[-1]*10+RC[12] -> 600523 | C1720: 600521 | D1720: 600522 | E1720: 600523 | F1720: 600524 | G1720: 600525 | K1720: 3 | M1720: 激光智能机 | N1720: =VLOOKUP(RC[-1],Sheet1!R3C6:R129C7,2,FALSE) -> 3
A1721: 60053 | B1721: =RC[-1]*10+RC[12] -> 600532 | C1721: 600531 | D1721: 600532 | E1721: 600533 | F1721: 600534 | G1721: 600535 | K1721: 3 | M1721: 树人 | N1721: =VLOOKUP(RC[-1],Sheet1!R3C6:R129C7,2,FALSE) -> 2
A1722: 60054 | B1722: =RC[-1]*10+RC[12] -> 600543 | C1722: 600541 | D1722: 600542 | E1722: 600543 | F1722: 600544 | G1722: 600545 | K1722: 3 | M1722: 鹰眸 | N1722: =VLOOKUP(RC[-1],Sheet1!R3C6:R129C7,2,FALSE) -> 3
A1723: 60061 | B1723: =RC[-1]*10+RC[12] -> 600611 | C1723: 600611 | D1723: 600612 | E1723: 600613 | F1723: 600614 | G1723: 600615 | K1723: 3 | M1723: 地精盗贼 | N1723: =VLOOKUP(RC[-1],Sheet1!R3C6:R129C7,2,FALSE) -> 1
A1724: 60062 | B1724: =RC[-1]*10+RC[12] -> 600623 | C1724: 600621 | D1724: 600622 | E1724: 600623 | F1724: 600624 | G1724: 600625 | K1724: 3 | M1724: 矮人火枪手 | N1724: =VLOOKUP(RC[-1],Sheet1!R3C6:R129C7,2,FALSE) -> 3
A1725: 60063 | B1725: =RC[-1]*10+RC[12] -> 600631 | C1725: 600631 | D1725: 600632 | E1725: 600633 | F1725: 600634 | G1725: 600635 | K1725: 3 | M1725: 半人马 | N1725: =VLOOKUP(RC[-1],Sheet1!R3C6:R129C7,2,FALSE) -> 1
A1726: 60064 | B1726: =RC[-1]*10+RC[12] -> 600641 | C1726: 600641 | D1726: 600642 | E1726: 600643 | F1726: 600644 | G1726: 600645 | K1726: 3 | M1726: 基伦 | N1726: =VLOOKUP(RC[-1],Sheet1!R3C6:R129C7,2,FALSE) -> 1
A1727: 60065 | B1727: =RC[-1]*10+RC[12] -> 600651 | C1727: 600651 | D1727: 600652 | E1727: 600653 | F1727: 600654 | G1727: 600655 | K1727: 3 | M1727: 血色指挥官 | N1727: =VLOOKUP(RC[-1],Sheet1!R3C6:R129C7,2,FALSE) -> 1
A1728: 60071 | B1728: =RC[-1]*10+RC[12] -> 600715 | C1728: 600711 | D1728: 600712 | E1728: 600713 | F1728: 600714 | G1728: 600715 | K1728: 3 | M1728: 牧师 | N1728: =VLOOKUP(RC[-1],Sheet1!R3C6:R129C7,2,FALSE) -> 5
A1729: 60072 | B1729: =RC[-1]*10+RC[12] -> 600725 | C1729: 600721 | D1729: 600722 | E1729: 600723 | F1729: 600724 | G1729: 600725 | K1729: 3 | M1729: 圣女贞德 | N1729: =VLOOKUP(RC[-1],Sheet1!R3C6:R129C7,2,FALSE) -> 5
A1730: 60073 | B1730: =RC[-1]*10+RC[12] -> 600735 | C1730: 600731 | D1730: 600732 | E1730: 600733 | F1730: 600734 | G1730: 600735 | K1730: 3 | M1730: 天使长 | N1730: =VLOOKUP(RC[-1],Sheet1!R3C6:R129C7,2,FALSE) -> 5
A1731: 60074 | B1731: =RC[-1]*10+RC[12] -> 600745 | C1731: 600741 | D1731: 600742 | E1731: 600743 | F1731: 600744 | G1731: 600745 | K1731: 3 | M1731: 雅典娜 | N1731: =VLOOKUP(RC[-1],Sheet1!R3C6:R129C7,2,FALSE) -> 5
A1732: 60081 | B1732: =RC[-1]*10+RC[12] -> 600812 | C1732: 600811 | D1732: 600812 | E1732: 600813 | F1732: 600814 | G1732: 600815 | K1732: 3 | M1732: 骷髅战士 | N1732: =VLOOKUP(RC[-1],Sheet1!R3C6:R129C7,2,FALSE) -> 2
A1733: 60082 | B1733: =RC[-1]*10+RC[12] -> 600824 | C1733: 600821 | D1733: 600822 | E1733: 600823 | F1733: 600824 | G1733: 600825 | K1733: 3 | M1733: 食人魔 | N1733: =VLOOKUP(RC[-1],Sheet1!R3C6:R129C7,2,FALSE) -> 4
A1734: 60083 | B1734: =RC[-1]*10+RC[12] -> 600832 | C1734: 600831 | D1734: 600832 | E1734: 600833 | F1734: 600834 | G1734: 600835 | K1734: 3 | M1734: 石头人 | N1734: =VLOOKUP(RC[-1],Sheet1!R3C6:R129C7,2,FALSE) -> 2
A1735: 60084 | B1735: =RC[-1]*10+RC[12] -> 600841 | C1735: 600841 | D1735: 600842 | E1735: 600843 | F1735: 600844 | G1735: 600845 | K1735: 3 | M1735: 牛头人 | N1735: =VLOOKUP(RC[-1],Sheet1!R3C6:R129C7,2,FALSE) -> 1
A1736: 60091 | B1736: =RC[-1]*10+RC[12] -> 600912 | C1736: 600911 | D1736: 600912 | E1736: 600913 | F1736: 600914 | G1736: 600915 | K1736: 3 | M1736: 战争机甲 | N1736: =VLOOKUP(RC[-1],Sheet1!R3C6:R129C7,2,FALSE) -> 2
A1737: 60092 | B1737: =RC[-1]*10+RC[12] -> 600921 | C1737: 600921 | D1737: 600922 | E1737: 600923 | F1737: 600924 | G1737: 600925 | K1737: 3 | M1737: 致命特工 | N1737: =VLOOKUP(RC[-1],Sheet1!R3C6:R129C7,2,FALSE) -> 1
A1738: 60093 | B1738: =RC[-1]*10+RC[12] -> 600931 | C1738: 600931 | D1738: 600932 | E1738: 600933 | F1738: 600934 | G1738: 600935 | K1738: 3 | M1738: 刀锋猎人 | N1738: =VLOOKUP(RC[-1],Sheet1!R3C6:R129C7,2,FALSE) -> 1
A1739: 60094 | B1739: =RC[-1]*10+RC[12] -> 600943 | C1739: 600941 | D1739: 600942 | E1739: 600943 | F1739: 600944 | G1739: 600945 | K1739: 3 | M1739: 铁人 | N1739: =VLOOKUP(RC[-1],Sheet1!R3C6:R129C7,2,FALSE) -> 3
A1740: 60095 | B1740: =RC[-1]*10+RC[12] -> 600954 | C1740: 600951 | D1740: 600952 | E1740: 600953 | F1740: 600954 | G1740: 600955 | K1740: 3 | M1740: 超凡博士 | N1740: =VLOOKUP(RC[-1],Sheet1!R3C6:R129C7,2,FALSE) -> 4
A1741: 60101 | B1741: =RC[-1]*10+RC[12] -> 601015 | C1741: 601011 | D1741: 601012 | E1741: 601013 | F1741: 601014 | G1741: 601015 | K1741: 3 | M1741: 血源牧师 | N1741: =VLOOKUP(RC[-1],Sheet1!R3C6:R129C7,2,FALSE) -> 5
A1742: 60102 | B1742: =RC[-1]*10+RC[12] -> 601025 | C1742: 601021 | D1742: 601022 | E1742: 601023 | F1742: 601024 | G1742: 601025 | K1742: 3 | M1742: 白凤凰 | N1742: =VLOOKUP(RC[-1],Sheet1!R3C6:R129C7,2,FALSE) -> 5
A1743: 60103 | B1743: =RC[-1]*10+RC[12] -> 601034 | C1743: 601031 | D1743: 601032 | E1743: 601033 | F1743: 601034 | G1743: 601035 | K1743: 3 | M1743: 食人魔 | N1743: =VLOOKUP(RC[-1],Sheet1!R3C6:R129C7,2,FALSE) -> 4
A1744: 60104 | B1744: =RC[-1]*10+RC[12] -> 601041 | C1744: 601041 | D1744: 601042 | E1744: 601043 | F1744: 601044 | G1744: 601045 | K1744: 3 | M1744: 地狱骑士 | N1744: =VLOOKUP(RC[-1],Sheet1!R3C6:R129C7,2,FALSE) -> 1
A1745: 60111 | B1745: =RC[-1]*10+RC[12] -> 601111 | C1745: 601111 | D1745: 601112 | E1745: 601113 | F1745: 601114 | G1745: 601115 | K1745: 3 | M1745: 致命特工 | N1745: =VLOOKUP(RC[-1],Sheet1!R3C6:R129C7,2,FALSE) -> 1
A1746: 60112 | B1746: =RC[-1]*10+RC[12] -> 601121 | C1746: 601121 | D1746: 601122 | E1746: 601123 | F1746: 601124 | G1746: 601125 | K1746: 3 | M1746: 杰克船长 | N1746: =VLOOKUP(RC[-1],Sheet1!R3C6:R129C7,2,FALSE) -> 1
A1747: 60113 | B1747: =RC[-1]*10+RC[12] -> 601133 | C1747: 601131 | D1747: 601132 | E1747: 601133 | F1747: 601134 | G1747: 601135 | K1747: 3 | M1747: 鹰眸 | N1747: =VLOOKUP(RC[-1],Sheet1!R3C6:R129C7,2,FALSE) -> 3
A1748: 60114 | B1748: =RC[-1]*10+RC[12] -> 601143 | C1748: 601141 | D1748: 601142 | E1748: 601143 | F1748: 601144 | G1748: 601145 | K1748: 3 | M1748: 小黑 | N1748: =VLOOKUP(RC[-1],Sheet1!R3C6:R129C7,2,FALSE) -> 3
A1749: 60121 | B1749: =RC[-1]*10+RC[12] -> 601211 | C1749: 601211 | D1749: 601212 | E1749: 601213 | F1749: 601214 | G1749: 601215 | K1749: 3 | M1749: 基伦 | N1749: =VLOOKUP(RC[-1],Sheet1!R3C6:R129C7,2,FALSE) -> 1
A1750: 60122 | B1750: =RC[-1]*10+RC[12] -> 601225 | C1750: 601221 | D1750: 601222 | E1750: 601223 | F1750: 601224 | G1750: 601225 | K1750: 3 | M1750: 圣女贞德 | N1750: =VLOOKUP(RC[-1],Sheet1!R3C6:R129C7,2,FALSE) -> 5
A1751: 60123 | B1751: =RC[-1]*10+RC[12] -> 601231 | C1751: 601231 | D1751: 601232 | E1751: 601233 | F1751: 601234 | G1751: 601235 | K1751: 3 | M1751: 佐罗 | N1751: =VLOOKUP(RC[-1],Sheet1!R3C6:R129C7,2,FALSE) -> 1
A1752: 60124 | B1752: =RC[-1]*10+RC[12] -> 601242 | C1752: 601241 | D1752: 601242 | E1752: 601243 | F1752: 601244 | G1752: 601245 | K1752: 3 | M1752: 大力神 | N1752: =VLOOKUP(RC[-1],Sheet1!R3C6:R129C7,2,FALSE) -> 2
A1753: 60125 | B1753: =RC[-1]*10+RC[12] -> 601251 | C1753: 601251 | D1753: 601252 | E1753: 601253 | F1753: 601254 | G1753: 601255 | K1753: 3 | M1753: 恶魔猎手 | N1753: =VLOOKUP(RC[-1],Sheet1!R3C6:R129C7,2,FALSE) -> 1
A1754: 60131 | B1754: =RC[-1]*10+RC[12] -> 601314 | C1754: 601311 | D1754: 601312 | E1754: 601313 | F1754: 601314 | G1754: 601315 | K1754: 3 | M1754: 食人魔 | N1754: =VLOOKUP(RC[-1],Sheet1!R3C6:R129C7,2,FALSE) -> 4
A1755: 60132 | B1755: =RC[-1]*10+RC[12] -> 601324 | C1755: 601321 | D1755: 601322 | E1755: 601323 | F1755: 601324 | G1755: 601325 | K1755: 3 | M1755: 超凡博士 | N1755: =VLOOKUP(RC[-1],Sheet1!R3C6:R129C7,2,FALSE) -> 4
A1756: 60133 | B1756: =RC[-1]*10+RC[12] -> 601333 | C1756: 601331 | D1756: 601332 | E1756: 601333 | F1756: 601334 | G1756: 601335 | K1756: 3 | M1756: 亚马逊女王 | N1756: =VLOOKUP(RC[-1],Sheet1!R3C6:R129C7,2,FALSE) -> 3
A1757: 60134 | B1757: =RC[-1]*10+RC[12] -> 601344 | C1757: 601341 | D1757: 601342 | E1757: 601343 | F1757: 601344 | G1757: 601345 | K1757: 3 | M1757: 火女 | N1757: =VLOOKUP(RC[-1],Sheet1!R3C6:R129C7,2,FALSE) -> 4
A1758: 60141 | B1758: =RC[-1]*10+RC[12] -> 601413 | C1758: 601411 | D1758: 601412 | E1758: 601413 | F1758: 601414 | G1758: 601415 | K1758: 3 | M1758: 女警 | N1758: =VLOOKUP(RC[-1],Sheet1!R3C6:R129C7,2,FALSE) -> 3
A1759: 60142 | B1759: =RC[-1]*10+RC[12] -> 601421 | C1759: 601421 | D1759: 601422 | E1759: 601423 | F1759: 601424 | G1759: 601425 | K1759: 3 | M1759: 致命特工 | N1759: =VLOOKUP(RC[-1],Sheet1!R3C6:R129C7,2,FALSE) -> 1
A1760: 60143 | B1760: =RC[-1]*10+RC[12] -> 601435 | C1760: 601431 | D1760: 601432 | E1760: 601433 | F1760: 601434 | G1760: 601435 | K1760: 3 | M1760: 血源牧师 | N1760: =VLOOKUP(RC[-1],Sheet1!R3C6:R129C7,2,FALSE) -> 5
A1761: 60144 | B1761: =RC[-1]*10+RC[12] -> 601444 | C1761: 601441 | D1761: 601442 | E1761: 601443 | F1761: 601444 | G1761: 601445 | K1761: 3 | M1761: 美杜莎 | N1761: =VLOOKUP(RC[-1],Sheet1!R3C6:R129C7,2,FALSE) -> 4
A1762: 60151 | B1762: =RC[-1]*10+RC[12] -> 601512 | C1762: 601511 | D1762: 601512 | E1762: 601513 | F1762: 601514 | G1762: 601515 | K1762: 3 | M1762: 石头人 | N1762: =VLOOKUP(RC[-1],Sheet1!R3C6:R129C7,2,FALSE) -> 2
A1763: 60152 | B1763: =RC[-1]*10+RC[12] -> 601522 | C1763: 601521 | D1763: 601522 | E1763: 601523 | F1763: 601524 | G1763: 601525 | K1763: 3 | M1763: 斯巴达 | N1763: =VLOOKUP(RC[-1],Sheet1!R3C6:R129C7,2,FALSE) -> 2
A1764: 60153 | B1764: =RC[-1]*10+RC[12] -> 601532 | C1764: 601531 | D1764: 601532 | E1764: 601533 | F1764: 601534 | G1764: 601535 | K1764: 3 | M1764: 树人 | N1764: =VLOOKUP(RC[-1],Sheet1!R3C6:R129C7,2,FALSE) -> 2
A1765: 60154 | B1765: =RC[-1]*10+RC[12] -> 601541 | C1765: 601541 | D1765: 601542 | E1765: 601543 | F1765: 601544 | G1765: 601545 | K1765: 3 | M1765: 超级队长 | N1765: =VLOOKUP(RC[-1],Sheet1!R3C6:R129C7,2,FALSE) -> 1
A1766: 60155 | B1766: =RC[-1]*10+RC[12] -> 601554 | C1766: 601551 | D1766: 601552 | E1766: 601553 | F1766: 601554 | G1766: 601555 | K1766: 3 | M1766: 红骷髅 | N1766: =VLOOKUP(RC[-1],Sheet1!R3C6:R129C7,2,FALSE) -> 4
A1767: 60161 | B1767: =RC[-1]*10+RC[12] -> 601613 | C1767: 601611 | D1767: 601612 | E1767: 601613 | F1767: 601614 | G1767: 601615 | K1767: 3 | M1767: 亚马逊女王 | N1767: =VLOOKUP(RC[-1],Sheet1!R3C6:R129C7,2,FALSE) -> 3
A1768: 60162 | B1768: =RC[-1]*10+RC[12] -> 601621 | C1768: 601621 | D1768: 601622 | E1768: 601623 | F1768: 601624 | G1768: 601625 | K1768: 3 | M1768: 杰克船长 | N1768: =VLOOKUP(RC[-1],Sheet1!R3C6:R129C7,2,FALSE) -> 1
A1769: 60163 | B1769: =RC[-1]*10+RC[12] -> 601631 | C1769: 601631 | D1769: 601632 | E1769: 601633 | F1769: 601634 | G1769: 601635 | K1769: 3 | M1769: 半人马 | N1769: =VLOOKUP(RC[-1],Sheet1!R3C6:R129C7,2,FALSE) -> 1
A1770: 60164 | B1770: =RC[-1]*10+RC[12] -> 601641 | C1770: 601641 | D1770: 601642 | E1770: 601643 | F1770: 601644 | G1770: 601645 | K1770: 3 | M1770: 查理大帝 | N1770: =VLOOKUP(RC[-1],Sheet1!R3C6:R129C7,2,FALSE) -> 1
A1771: 60171 | B1771: =RC[-1]*10+RC[12] -> 601713 | C1771: 601711 | D1771: 601712 | E1771: 601713 | F1771: 601714 | G1771: 601715 | K1771: 3 | M1771: 鹰眸 | N1771: =VLOOKUP(RC[-1],Sheet1!R3C6:R129C7,2,FALSE) -> 3
A1772: 60172 | B1772: =RC[-1]*10+RC[12] -> 601724 | C1772: 601721 | D1772: 601722 | E1772: 601723 | F1772: 601724 | G1772: 601725 | K1772: 3 | M1772: 食人魔 | N1772: =VLOOKUP(RC[-1],Sheet1!R3C6:R129C7,2,FALSE) -> 4
A1773: 60173 | B1773: =RC[-1]*10+RC[12] -> 601731 | C1773: 601731 | D1773: 601732 | E1773: 601733 | F1773: 601734 | G1773: 601735 | K1773: 3 | M1773: 刀锋猎人 | N1773: =VLOOKUP(RC[-1],Sheet1!R3C6:R129C7,2,FALSE) -> 1
A1774: 60174 | B1774: =RC[-1]*10+RC[12] -> 601741 | C1774: 601741 | D1774: 601742 | E1774: 601743 | F1774: 601744 | G1774: 601745 | K1774: 3 | M1774: 死亡武士 | N1774: =VLOOKUP(RC[-1],Sheet1!R3C6:R129C7,2,FALSE) -> 1
A1775: 60181 | B1775: =RC[-1]*10+RC[12] -> 601815 | C1775: 601811 | D1775: 601812 | E1775: 601813 | F1775: 601814 | G1775: 601815 | K1775: 3 | M1775: 圣女贞德 | N1775: =VLOOKUP(RC[-1],Sheet1!R3C6:R129C7,2,FALSE) -> 5
A1776: 60182 | B1776: =RC[-1]*10+RC[12] -> 601825 | C1776: 601821 | D1776: 601822 | E1776: 601823 | F1776: 601824 | G1776: 601825 | K1776: 3 | M1776: 白凤凰 | N1776: =VLOOKUP(RC[-1],Sheet1!R3C6:R129C7,2,FALSE) -> 5
A1777: 60183 | B1777: =RC[-1]*10+RC[12] -> 601835 | C1777: 601831 | D1777: 601832 | E1777: 601833 | F1777: 601834 | G1777: 601835 | K1777: 3 | M1777: 天使长 | N1777: =VLOOKUP(RC[-1],Sheet1!R3C6:R129C7,2,FALSE) -> 5
A1778: 60184 | B1778: =RC[-1]*10+RC[12] -> 601845 | C1778: 601841 | D1778: 601842 | E1778: 601843 | F1778: 601844 | G1778: 601845 | K1778: 3 | M1778: 神圣牧师 | N1778: =VLOOKUP(RC[-1],Sheet1!R3C6:R129C7,2,FALSE) -> 5
A1779: 60185 | B1779: =RC[-1]*10+RC[12] -> 601851 | C1779: 601851 | D1779: 601852 | E1779: 601853 | F1779: 601854 | G1779: 601855 | K1779: 3 | M1779: 德古拉伯爵 | N1779: =VLOOKUP(RC[-1],Sheet1!R3C6:R129C7,2,FALSE) -> 1
A1780: 60191 | B1780: =RC[-1]*10+RC[12] -> 601911 | C1780: 601911 | D1780: 601912 | E1780: 601913 | F1780: 601914 | G1780: 601915 | K1780: 3 | M1780: 佐罗 | N1780: =VLOOKUP(RC[-1],Sheet1!R3C6:R129C7,2,FALSE) -> 1
A1781: 60192 | B1781: =RC[-1]*10+RC[12] -> 601921 | C1781: 601921 | D1781: 601922 | E1781: 601923 | F1781: 601924 | G1781: 601925 | K1781: 3 | M1781: 半人马 | N1781: =VLOOKUP(RC[-1],Sheet1!R3C6:R129C7,2,FALSE) -> 1
A1782: 60193 | B1782: =RC[-1]*10+RC[12] -> 601933 | C1782: 601931 | D1782: 601932 | E1782: 601933 | F1782: 601934 | G1782: 601935 | K1782: 3 | M1782: 鹰眸 | N1782: =VLOOKUP(RC[-1],Sheet1!R3C6:R129C7,2,FALSE) -> 3
A1783: 60194 | B1783: =RC[-1]*10+RC[12] -> 601942 | C1783: 601941 | D1783: 601942 | E1783: 601943 | F1783: 601944 | G1783: 601945 | K1783: 3 | M1783: 熊阿宝 | N1783: =VLOOKUP(RC[-1],Sheet1!R3C6:R129C7,2,FALSE) -> 2
A1784: 60201 | B1784: =RC[-1]*10+RC[12] -> 602011 | C1784: 602011 | D1784: 602012 | E1784: 602013 | F1784: 602014 | G1784: 602015 | K1784: 3 | M1784: 杰克船长 | N1784: =VLOOKUP(RC[-1],Sheet1!R3C6:R129C7,2,FALSE) -> 1
A1785: 60202 | B1785: =RC[-1]*10+RC[12] -> 602024 | C1785: 602021 | D1785: 602022 | E1785: 602023 | F1785: 602024 | G1785: 602025 | K1785: 3 | M1785: 超凡博士 | N1785: =VLOOKUP(RC[-1],Sheet1!R3C6:R129C7,2,FALSE) -> 4
A1786: 60203 | B1786: =RC[-1]*10+RC[12] -> 602034 | C1786: 602031 | D1786: 602032 | E1786: 602033 | F1786: 602034 | G1786: 602035 | K1786: 3 | M1786: 食人魔 | N1786: =VLOOKUP(RC[-1],Sheet1!R3C6:R129C7,2,FALSE) -> 4
A1787: 60204 | B1787: =RC[-1]*10+RC[12] -> 602041 | C1787: 602041 | D1787: 602042 | E1787: 602043 | F1787: 602044 | G1787: 602045 | K1787: 3 | M1787: 阿努比斯 | N1787: =VLOOKUP(RC[-1],Sheet1!R3C6:R129C7,2,FALSE) -> 1
A1788: 60211 | B1788: =RC[-1]*10+RC[12] -> 602112 | C1788: 602111 | D1788: 602112 | E1788: 602113 | F1788: 602114 | G1788: 602115 | K1788: 3 | M1788: 斯巴达 | N1788: =VLOOKUP(RC[-1],Sheet1!R3C6:R129C7,2,FALSE) -> 2
A1789: 60212 | B1789: =RC[-1]*10+RC[12] -> 602122 | C1789: 602121 | D1789: 602122 | E1789: 602123 | F1789: 602124 | G1789: 602125 | K1789: 3 | M1789: 石头人 | N1789: =VLOOKUP(RC[-1],Sheet1!R3C6:R129C7,2,FALSE) -> 2
A1790: 60213 | B1790: =RC[-1]*10+RC[12] -> 602132 | C1790: 602131 | D1790: 602132 | E1790: 602133 | F1790: 602134 | G1790: 602135 | K1790: 3 | M1790: 树人 | N1790: =VLOOKUP(RC[-1],Sheet1!R3C6:R129C7,2,FALSE) -> 2
A1791: 60214 | B1791: =RC[-1]*10+RC[12] -> 602142 | C1791: 602141 | D1791: 602142 | E1791: 602143 | F1791: 602144 | G1791: 602145 | K1791: 3 | M1791: 野蛮巨人 | N1791: =VLOOKUP(RC[-1],Sheet1!R3C6:R129C7,2,FALSE) -> 2
A1792: 60215 | B1792: =RC[-1]*10+RC[12] -> 602152 | C1792: 602151 | D1792: 602152 | E1792: 602153 | F1792: 602154 | G1792: 602155 | K1792: 3 | M1792: 大力神 | N1792: =VLOOKUP(RC[-1],Sheet1!R3C6:R129C7,2,FALSE) -> 2
A1793: 60221 | B1793: =RC[-1]*10+RC[12] -> 602211 | C1793: 602211 | D1793: 602212 | E1793: 602213 | F1793: 602214 | G1793: 602215 | K1793: 3 | M1793: 死亡武士 | N1793: =VLOOKUP(RC[-1],Sheet1!R3C6:R129C7,2,FALSE) -> 1
A1794: 60222 | B1794: =RC[-1]*10+RC[12] -> 602223 | C1794: 602221 | D1794: 602222 | E1794: 602223 | F1794: 602224 | G1794: 602225 | K1794: 3 | M1794: 鹰眸 | N1794: =VLOOKUP(RC[-1],Sheet1!R3C6:R129C7,2,FALSE) -> 3
A1795: 60223 | B1795: =RC[-1]*10+RC[12] -> 602231 | C1795: 602231 | D1795: 602232 | E1795: 602233 | F1795: 602234 | G1795: 602235 | K1795: 3 | M1795: 基伦 | N1795: =VLOOKUP(RC[-1],Sheet1!R3C6:R129C7,2,FALSE) -> 1
A1796: 60224 | B1796: =RC[-1]*10+RC[12] -> 602244 | C1796: 602241 | D1796: 602242 | E1796: 602243 | F1796: 602244 | G1796: 602245 | K1796: 3 | M1796: 狩猎女神 | N1796: =VLOOKUP(RC[-1],Sheet1!R3C6:R129C7,2,FALSE) -> 4
A1797: 60231 | B1797: =RC[-1]*10+RC[12] -> 602311 | C1797: 602311 | D1797: 602312 | E1797: 602313 | F1797: 602314 | G1797: 602315 | K1797: 3 | M1797: 半人马 | N1797: =VLOOKUP(RC[-1],Sheet1!R3C6:R129C7,2,FALSE) -> 1
A1798: 60232 | B1798: =RC[-1]*10+RC[12] -> 602321 | C1798: 602321 | D1798: 602322 | E1798: 602323 | F1798: 602324 | G1798: 602325 | K1798: 3 | M1798: 致命特工 | N1798: =VLOOKUP(RC[-1],Sheet1!R3C6:R129C7,2,FALSE) -> 1
A1799: 60233 | B1799: =RC[-1]*10+RC[12] -> 602331 | C1799: 602331 | D1799: 602332 | E1799: 602333 | F1799: 602334 | G1799: 602335 | K1799: 3 | M1799: 牛头人 | N1799: =VLOOKUP(RC[-1],Sheet1!R3C6:R129C7,2,FALSE) -> 1
A1800: 60234 | B1800: =RC[-1]*10+RC[12] -> 602344 | C1800: 602341 | D1800: 602342 | E1800: 602343 | F1800: 602344 | G1800: 602345 | K1800: 3 | M1800: 红颅鬼 | N1800: =VLOOKUP(RC[-1],Sheet1!R3C6:R129C7,2,FALSE) -> 4
A1801: 60241 | B1801: =RC[-1]*10+RC[12] -> 602414 | C1801: 602411 | D1801: 602412 | E1801: 602413 | F1801: 602414 | G1801: 602415 | K1801: 3 | M1801: 雷神 | N1801: =VLOOKUP(RC[-1],Sheet1!R3C6:R129C7,2,FALSE) -> 4
A1802: 60242 | B1802: =RC[-1]*10+RC[12] -> 602425 | C1802: 602421 | D1802: 602422 | E1802: 602423 | F1802: 602424 | G1802: 602425 | K1802: 3 | M1802: 白凤凰 | N1802: =VLOOKUP(RC[-1],Sheet1!R3C6:R129C7,2,FALSE) -> 5
A1803: 60243 | B1803: =RC[-1]*10+RC[12] -> 602435 | C1803: 602431 | D1803: 602432 | E1803: 602433 | F1803: 602434 | G1803: 602435 | K1803: 3 | M1803: 大检察官 | N1803: =VLOOKUP(RC[-1],Sheet1!R3C6:R129C7,2,FALSE) -> 5
A1804: 60244 | B1804: =RC[-1]*10+RC[12] -> 602441 | C1804: 602441 | D1804: 602442 | E1804: 602443 | F1804: 602444 | G1804: 602445 | K1804: 3 | M1804: 德古拉伯爵 | N1804: =VLOOKUP(RC[-1],Sheet1!R3C6:R129C7,2,FALSE) -> 1
A1805: 60245 | B1805: =RC[-1]*10+RC[12] -> 602451 | C1805: 602451 | D1805: 602452 | E1805: 602453 | F1805: 602454 | G1805: 602455 | K1805: 3 | M1805: 刀锋猎人 | N1805: =VLOOKUP(RC[-1],Sheet1!R3C6:R129C7,2,FALSE) -> 1
A1806: 60251 | B1806: =RC[-1]*10+RC[12] -> 602515 | C1806: 602511 | D1806: 602512 | E1806: 602513 | F1806: 602514 | G1806: 602515 | K1806: 3 | M1806: 雅典娜 | N1806: =VLOOKUP(RC[-1],Sheet1!R3C6:R129C7,2,FALSE) -> 5
A1807: 60252 | B1807: =RC[-1]*10+RC[12] -> 602521 | C1807: 602521 | D1807: 602522 | E1807: 602523 | F1807: 602524 | G1807: 602525 | K1807: 3 | M1807: 阿努比斯 | N1807: =VLOOKUP(RC[-1],Sheet1!R3C6:R129C7,2,FALSE) -> 1
A1808: 60253 | B1808: =RC[-1]*10+RC[12] -> 602534 | C1808: 602531 | D1808: 602532 | E1808: 602533 | F1808: 602534 | G1808: 602535 | K1808: 3 | M1808: 冥王哈迪斯 | N1808: =VLOOKUP(RC[-1],Sheet1!R3C6:R129C7,2,FALSE) -> 4
A1809: 60254 | B1809: =RC[-1]*10+RC[12] -> 602541 | C1809: 602541 | D1809: 602542 | E1809: 602543 | F1809: 602544 | G1809: 602545 | K1809: 3 | M1809: 查理大帝 | N1809: =VLOOKUP(RC[-1],Sheet1!R3C6:R129C7,2,FALSE) -> 1
A1810: 60261 | B1810: =RC[-1]*10+RC[12] -> 602615 | C1810: 602611 | D1810: 602612 | E1810: 602613 | F1810: 602614 | G1810: 602615 | K1810: 3 | M1810: 血源牧师 | N1810: =VLOOKUP(RC[-1],Sheet1!R3C6:R129C7,2,FALSE) -> 5
A1811: 60262 | B1811: =RC[-1]*10+RC[12] -> 602621 | C1811: 602621 | D1811: 602622 | E1811: 602623 | F1811: 602624 | G1811: 602625 | K1811: 3 | M1811: 德古拉伯爵 | N1811: =VLOOKUP(RC[-1],Sheet1!R3C6:R129C7,2,FALSE) -> 1
A1812: 60263 | B1812: =RC[-1]*10+RC[12] -> 602631 | C1812: 602631 | D1812: 602632 | E1812: 602633 | F1812: 602634 | G1812: 602635 | K1812: 3 | M1812: 死亡武士 | N1812: =VLOOKUP(RC[-1],Sheet1!R3C6:R129C7,2,FALSE) -> 1
A1813: 60264 | B1813: =RC[-1]*10+RC[12] -> 602641 | C1813: 602641 | D1813: 602642 | E1813: 602643 | F1813: 602644 | G1813: 602645 | K1813: 3 | M1813: 血色指挥官 | N1813: =VLOOKUP(RC[-1],Sheet1!R3C6:R129C7,2,FALSE) -> 1
A1814: 60271 | B1814: =RC[-1]*10+RC[12] -> 602712 | C1814: 602711 | D1814: 602712 | E1814: 602713 | F1814: 602714 | G1814: 602715 | K1814: 3 | M1814: 骷髅王 | N1814: =VLOOKUP(RC[-1],Sheet1!R3C6:R129C7,2,FALSE) -> 2
A1815: 60272 | B1815: =RC[-1]*10+RC[12] -> 602724 | C1815: 602721 | D1815: 602722 | E1815: 602723 | F1815: 602724 | G1815: 602725 | K1815: 3 | M1815: 冥王哈迪斯 | N1815: =VLOOKUP(RC[-1],Sheet1!R3C6:R129C7,2,FALSE) -> 4
A1816: 60273 | B1816: =RC[-1]*10+RC[12] -> 602731 | C1816: 602731 | D1816: 602732 | E1816: 602733 | F1816: 602734 | G1816: 602735 | K1816: 3 | M1816: 地狱骑士 | N1816: =VLOOKUP(RC[-1],Sheet1!R3C6:R129C7,2,FALSE) -> 1
A1817: 60274 | B1817: =RC[-1]*10+RC[12] -> 602743 | C1817: 602741 | D1817: 602742 | E1817: 602743 | F1817: 602744 | G1817: 602745 | K1817: 3 | M1817: 小黑 | N1817: =VLOOKUP(RC[-1],Sheet1!R3C6:R129C7,2,FALSE) -> 3
A1818: 60275 | B1818: =RC[-1]*10+RC[12] -> 602751 | C1818: 602751 | D1818: 602752 | E1818: 602753 | F1818: 602754 | G1818: 602755 | K1818: 3 | M1818: 憎恶 | N1818: =VLOOKUP(RC[-1],Sheet1!R3C6:R129C7,2,FALSE) -> 1
A1819: 60281 | B1819: =RC[-1]*10+RC[12] -> 602812 | C1819: 602811 | D1819: 602812 | E1819: 602813 | F1819: 602814 | G1819: 602815 | K1819: 3 | M1819: 熊阿宝 | N1819: =VLOOKUP(RC[-1],Sheet1!R3C6:R129C7,2,FALSE) -> 2
A1820: 60282 | B1820: =RC[-1]*10+RC[12] -> 602822 | C1820: 602821 | D1820: 602822 | E1820: 602823 | F1820: 602824 | G1820: 602825 | K1820: 3 | M1820: 野蛮巨人 | N1820: =VLOOKUP(RC[-1],Sheet1!R3C6:R129C7,2,FALSE) -> 2
A1821: 60283 | B1821: =RC[-1]*10+RC[12] -> 602831 | C1821: 602831 | D1821: 602832 | E1821: 602833 | F1821: 602834 | G1821: 602835 | K1821: 3 | M1821: 牛头人 | N1821: =VLOOKUP(RC[-1],Sheet1!R3C6:R129C7,2,FALSE) -> 1
A1822: 60284 | B1822: =RC[-1]*10+RC[12] -> 602841 | C1822: 602841 | D1822: 602842 | E1822: 602843 | F1822: 602844 | G1822: 602845 | K1822: 3 | M1822: 独眼巨人 | N1822: =VLOOKUP(RC[-1],Sheet1!R3C6:R129C7,2,FALSE) -> 1
A1823: 60291 | B1823: =RC[-1]*10+RC[12] -> 602912 | C1823: 602911 | D1823: 602912 | E1823: 602913 | F1823: 602914 | G1823: 602915 | K1823: 3 | M1823: 石头人 | N1823: =VLOOKUP(RC[-1],Sheet1!R3C6:R129C7,2,FALSE) -> 2
A1824: 60292 | B1824: =RC[-1]*10+RC[12] -> 602921 | C1824: 602921 | D1824: 602922 | E1824: 602923 | F1824: 602924 | G1824: 602925 | K1824: 3 | M1824: 基伦 | N1824: =VLOOKUP(RC[-1],Sheet1!R3C6:R129C7,2,FALSE) -> 1
A1825: 60293 | B1825: =RC[-1]*10+RC[12] -> 602931 | C1825: 602931 | D1825: 602932 | E1825: 602933 | F1825: 602934 | G1825: 602935 | K1825: 3 | M1825: 终极队长 | N1825: =VLOOKUP(RC[-1],Sheet1!R3C6:R129C7,2,FALSE) -> 1
A1826: 60294 | B1826: =RC[-1]*10+RC[12] -> 602942 | C1826: 602941 | D1826: 602942 | E1826: 602943 | F1826: 602944 | G1826: 602945 | K1826: 3 | M1826: 斯巴达 | N1826: =VLOOKUP(RC[-1],Sheet1!R3C6:R129C7,2,FALSE) -> 2
A1827: 60301 | B1827: =RC[-1]*10+RC[12] -> 603011 | C1827: 603011 | D1827: 603012 | E1827: 603013 | F1827: 603014 | G1827: 603015 | K1827: 3 | M1827: 德古拉伯爵 | N1827: =VLOOKUP(RC[-1],Sheet1!R3C6:R129C7,2,FALSE) -> 1
A1828: 60302 | B1828: =RC[-1]*10+RC[12] -> 603024 | C1828: 603021 | D1828: 603022 | E1828: 603023 | F1828: 603024 | G1828: 603025 | K1828: 3 | M1828: 红颅鬼 | N1828: =VLOOKUP(RC[-1],Sheet1!R3C6:R129C7,2,FALSE) -> 4
A1829: 60303 | B1829: =RC[-1]*10+RC[12] -> 603031 | C1829: 603031 | D1829: 603032 | E1829: 603033 | F1829: 603034 | G1829: 603035 | K1829: 3 | M1829: 憎恶 | N1829: =VLOOKUP(RC[-1],Sheet1!R3C6:R129C7,2,FALSE) -> 1
A1830: 60304 | B1830: =RC[-1]*10+RC[12] -> 603044 | C1830: 603041 | D1830: 603042 | E1830: 603043 | F1830: 603044 | G1830: 603045 | K1830: 3 | M1830: 火女 | N1830: =VLOOKUP(RC[-1],Sheet1!R3C6:R129C7,2,FALSE) -> 4
A1831: 60305 | B1831: =RC[-1]*10+RC[12] -> 603052 | C1831: 603051 | D1831: 603052 | E1831: 603053 | F1831: 603054 | G1831: 603055 | K1831: 3 | M1831: 野蛮巨人 | N1831: =VLOOKUP(RC[-1],Sheet1!R3C6:R129C7,2,FALSE) -> 2
A1832: 60311 | B1832: =RC[-1]*10+RC[12] -> 603111 | C1832: 603111 | D1832: 603112 | E1832: 603113 | F1832: 603114 | G1832: 603115 | K1832: 3 | M1832: 基伦 | N1832: =VLOOKUP(RC[-1],Sheet1!R3C6:R129C7,2,FALSE) -> 1
A1833: 60312 | B1833: =RC[-1]*10+RC[12] -> 603121 | C1833: 603121 | D1833: 603122 | E1833: 603123 | F1833: 603124 | G1833: 603125 | K1833: 3 | M1833: 地狱骑士 | N1833: =VLOOKUP(RC[-1],Sheet1!R3C6:R129C7,2,FALSE) -> 1
A1834: 60313 | B1834: =RC[-1]*10+RC[12] -> 603133 | C1834: 603131 | D1834: 603132 | E1834: 603133 | F1834: 603134 | G1834: 603135 | K1834: 3 | M1834: 地狱铁拳 | N1834: =VLOOKUP(RC[-1],Sheet1!R3C6:R129C7,2,FALSE) -> 3
A1835: 60314 | B1835: =RC[-1]*10+RC[12] -> 603143 | C1835: 603141 | D1835: 603142 | E1835: 603143 | F1835: 603144 | G1835: 603145 | K1835: 3 | M1835: 铁人 | N1835: =VLOOKUP(RC[-1],Sheet1!R3C6:R129C7,2,FALSE) -> 3
A1836: 60321 | B1836: =RC[-1]*10+RC[12] -> 603213 | C1836: 603211 | D1836: 603212 | E1836: 603213 | F1836: 603214 | G1836: 603215 | K1836: 3 | M1836: 亚马逊女王 | N1836: =VLOOKUP(RC[-1],Sheet1!R3C6:R129C7,2,FALSE) -> 3
A1837: 60322 | B1837: =RC[-1]*10+RC[12] -> 603222 | C1837: 603221 | D1837: 603222 | E1837: 603223 | F1837: 603224 | G1837: 603225 | K1837: 3 | M1837: 石头人 | N1837: =VLOOKUP(RC[-1],Sheet1!R3C6:R129C7,2,FALSE) -> 2
A1838: 60323 | B1838: =RC[-1]*10+RC[12] -> 603232 | C1838: 603231 | D1838: 603232 | E1838: 603233 | F1838: 603234 | G1838: 603235 | K1838: 3 | M1838: 熊阿宝 | N1838: =VLOOKUP(RC[-1],Sheet1!R3C6:R129C7,2,FALSE) -> 2
A1839: 60324 | B1839: =RC[-1]*10+RC[12] -> 603242 | C1839: 603241 | D1839: 603242 | E1839: 603243 | F1839: 603244 | G1839: 603245 | K1839: 3 | M1839: 树精 | N1839: =VLOOKUP(RC[-1],Sheet1!R3C6:R129C7,2,FALSE) -> 2
A1840: 60331 | B1840: =RC[-1]*10+RC[12] -> 603311 | C1840: 603311 | D1840: 603312 | E1840: 603313 | F1840: 603314 | G1840: 603315 | K1840: 3 | M1840: 佐罗 | N1840: =VLOOKUP(RC[-1],Sheet1!R3C6:R129C7,2,FALSE) -> 1
A1841: 60332 | B1841: =RC[-1]*10+RC[12] -> 603321 | C1841: 603321 | D1841: 603322 | E1841: 603323 | F1841: 603324 | G1841: 603325 | K1841: 3 | M1841: 致命特工 | N1841: =VLOOKUP(RC[-1],Sheet1!R3C6:R129C7,2,FALSE) -> 1
A1842: 60333 | B1842: =RC[-1]*10+RC[12] -> 603334 | C1842: 603331 | D1842: 603332 | E1842: 603333 | F1842: 603334 | G1842: 603335 | K1842: 3 | M1842: 雷神 | N1842: =VLOOKUP(RC[-1],Sheet1!R3C6:R129C7,2,FALSE) -> 4
A1843: 60334 | B1843: =RC[-1]*10+RC[12] -> 603341 | C1843: 603341 | D1843: 603342 | E1843: 603343 | F1843: 603344 | G1843: 603345 | K1843: 3 | M1843: 恶魔猎手 | N1843: =VLOOKUP(RC[-1],Sheet1!R3C6:R129C7,2,FALSE) -> 1
A1844: 60335 | B1844: =RC[-1]*10+RC[12] -> 603354 | C1844: 603351 | D1844: 603352 | E1844: 603353 | F1844: 603354 | G1844: 603355 | K1844: 3 | M1844: 宙斯 | N1844: =VLOOKUP(RC[-1],Sheet1!R3C6:R129C7,2,FALSE) -> 4
A1845: 60341 | B1845: 603414 | C1845: 603411 | D1845: 603412 | E1845: 603413 | F1845: 603414 | G1845: 603415 | K1845: 3
A1846: 60342 | B1846: 603423 | C1846: 603421 | D1846: 603422 | E1846: 603423 | F1846: 603424 | G1846: 603425 | K1846: 3
A1847: 60343 | B1847: 603432 | C1847: 603431 | D1847: 603432 | E1847: 603433 | F1847: 603434 | G1847: 603435 | K1847: 3
A1848: 60344 | B1848: 603441 | C1848: 603441 | D1848: 603442 | E1848: 603443 | F1848: 603444 | G1848: 603445 | K1848: 3
A1849: 60351 | B1849: 603514 | C1849: 603511 | D1849: 603512 | E1849: 603513 | F1849: 603514 | G1849: 603515 | K1849: 3
A1850: 60352 | B1850: 603523 | C1850: 603521 | D1850: 603522 | E1850: 603523 | F1850: 603524 | G1850: 603525 | K1850: 3
A1851: 60353 | B1851: 603532 | C1851: 603531 | D1851: 603532 | E1851: 603533 | F1851: 603534 | G1851: 603535 | K1851: 3
A1852: 60354 | B1852: 603541 | C1852: 603541 | D1852: 603542 | E1852: 603543 | F1852: 603544 | G1852: 603545 | K1852: 3
A1853: 60361 | B1853: 603614 | C1853: 603611 | D1853: 603612 | E1853: 603613 | F1853: 603614 | G1853: 603615 | K1853: 3
A1854: 60362 | B1854: 603623 | C1854: 603621 | D1854: 603622 | E1854: 603623 | F1854: 603624 | G1854: 603625 | K1854: 3
A1855: 60363 | B1855: 603632 | C1855: 603631 | D1855: 603632 | E1855: 603633 | F1855: 603634 | G1855: 603635 | K1855: 3
A1856: 60364 | B1856: 603641 | C1856: 603641 | D1856: 603642 | E1856: 603643 | F1856: 603644 | G1856: 603645 | K1856: 3
A1857: 60365 | B1857: 603651 | C1857: 603651 | D1857: 603652 | E1857: 603653 | F1857: 603654 | G1857: 603655 | K1857: 3
A1858: 60371 | B1858: 603714 | C1858: 603711 | D1858: 603712 | E1858: 603713 | F1858: 603714 | G1858: 603715 | K1858: 3
A1859: 60372 | B1859: 603723 | C1859: 603721 | D1859: 603722 | E1859: 603723 | F1859: 603724 | G1859: 603725 | K1859: 3
A1860: 60373 | B1860: 603732 | C1860: 603731 | D1860: 603732 | E1860: 603733 | F1860: 603734 | G1860: 603735 | K1860: 3
A1861: 60374 | B1861: 603741 | C1861: 603741 | D1861: 603742 | E1861: 603743 | F1861: 603744 | G1861: 603745 | K1861: 3
A1862: 60381 | B1862: 603814 | C1862: 603811 | D1862: 603812 | E1862: 603813 | F1862: 603814 | G1862: 603815 | K1862: 3
A1863: 60382 | B1863: 603823 | C1863: 603821 | D1863: 603822 | E1863: 603823 | F1863: 603824 | G1863: 603825 | K1863: 3
A1864: 60383 | B1864: 603832 | C1864: 603831 | D1864: 603832 | E1864: 603833 | F1864: 603834 | G1864: 603835 | K1864: 3
A1865: 60384 | B1865: 603841 | C1865: 603841 | D1865: 603842 | E1865: 603843 | F1865: 603844 | G1865: 603845 | K1865: 3
A1866: 60391 | B1866: 603914 | C1866: 603911 | D1866: 603912 | E1866: 603913 | F1866: 603914 | G1866: 603915 | K1866: 3
A1867: 60392 | B1867: 603923 | C1867: 603921 | D1867: 603922 | E1867: 603923 | F1867: 603924 | G1867: 603925 | K1867: 3
A1868: 60393 | B1868: 603932 | C1868: 603931 | D1868: 603932 | E1868: 603933 | F1868: 603934 | G1868: 603935 | K1868: 3
A1869: 60394 | B1869: 603941 | C1869: 603941 | D1869: 603942 | E1869: 603943 | F1869: 603944 | G1869: 603945 | K1869: 3
A1870: 60395 | B1870: 603954 | C1870: 603951 | D1870: 603952 | E1870: 603953 | F1870: 603954 | G1870: 603955 | K1870: 3
A1871: 60401 | B1871: 604014 | C1871: 604011 | D1871: 604012 | E1871: 604013 | F1871: 604014 | G1871: 604015 | K1871: 3
A1872: 60402 | B1872: 604023 | C1872: 604021 | D1872: 604022 | E1872: 604023 | F1872: 604024 | G1872: 604025 | K1872: 3
A1873: 60403 | B1873: 604032 | C1873: 604031 | D1873: 604032 | E1873: 604033 | F1873: 604034 | G1873: 604035 | K1873: 3
A1874: 60404 | B1874: 604041 | C1874: 604041 | D1874: 604042 | E1874: 604043 | F1874: 604044 | G1874: 604045 | K1874: 3
A1875: 60411 | B1875: 604114 | C1875: 604111 | D1875: 604112 | E1875: 604113 | F1875: 604114 | G1875: 604115 | K1875: 3
A1876: 60412 | B1876: 604123 | C1876: 604121 | D1876: 604122 | E1876: 604123 | F1876: 604124 | G1876: 604125 | K1876: 3
A1877: 60413 | B1877: 604132 | C1877: 604131 | D1877: 604132 | E1877: 604133 | F1877: 604134 | G1877: 604135 | K1877: 3
A1878: 60414 | B1878: 604141 | C1878: 604141 | D1878: 604142 | E1878: 604143 | F1878: 604144 | G1878: 604145 | K1878: 3
A1879: 60421 | B1879: 604214 | C1879: 604211 | D1879: 604212 | E1879: 604213 | F1879: 604214 | G1879: 604215 | K1879: 3
A1880: 60422 | B1880: 604223 | C1880: 604221 | D1880: 604222 | E1880: 604223 | F1880: 604224 | G1880: 604225 | K1880: 3
A1881: 60423 | B1881: 604232 | C1881: 604231 | D1881: 604232 | E1881: 604233 | F1881: 604234 | G1881: 604235 | K1881: 3
A1882: 60424 | B1882: 604241 | C1882: 604241 | D1882: 604242 | E1882: 604243 | F1882: 604244 | G1882: 604245 | K1882: 3
A1883: 60425 | B1883: 604253 | C1883: 604251 | D1883: 604252 | E1883: 604253 | F1883: 604254 | G1883: 604255 | K1883: 3
A1884: 60431 | B1884: 604314 | C1884: 604311 | D1884: 604312 | E1884: 604313 | F1884: 604314 | G1884: 604315 | K1884: 3
A1885: 60432 | B1885: 604323 | C1885: 604321 | D1885: 604322 | E1885: 604323 | F1885: 604324 | G1885: 604325 | K1885: 3
A1886: 60433 | B1886: 604332 | C1886: 604331 | D1886: 604332 | E1886: 604333 | F1886: 604334 | G1886: 604335 | K1886: 3
A1887: 60434 | B1887: 604341 | C1887: 604341 | D1887: 604342 | E1887: 604343 | F1887: 604344 | G1887: 604345 | K1887: 3
A1888: 60441 | B1888: 604414 | C1888: 604411 | D1888: 604412 | E1888: 604413 | F1888: 604414 | G1888: 604415 | K1888: 3
A1889: 60442 | B1889: 604423 | C1889: 604421 | D1889: 604422 | E1889: 604423 | F1889: 604424 | G1889: 604425 | K1889: 3
A1890: 60443 | B1890: 604432 | C1890: 604431 | D1890: 604432 | E1890: 604433 | F1890: 604434 | G1890: 604435 | K1890: 3
A1891: 60444 | B1891: 604441 | C1891: 604441 | D1891: 604442 | E1891: 604443 | F1891: 604444 | G1891: 604445 | K1891: 3
A1892: 60451 | B1892: 604514 | C1892: 604511 | D1892: 604512 | E1892: 604513 | F1892: 604514 | G1892: 604515 | K1892: 3
A1893: 60452 | B1893: 604523 | C1893: 604521 | D1893: 604522 | E1893: 604523 | F1893: 604524 | G1893: 604525 | K1893: 3
A1894: 60453 | B1894: 604532 | C1894: 604531 | D1894: 604532 | E1894: 604533 | F1894: 604534 | G1894: 604535 | K1894: 3
A1895: 60454 | B1895: 604541 | C1895: 604541 | D1895: 604542 | E1895: 604543 | F1895: 604544 | G1895: 604545 | K1895: 3
A1896: 60455 | B1896: 604552 | C1896: 604551 | D1896: 604552 | E1896: 604553 | F1896: 604554 | G1896: 604555 | K1896: 3
A1897: 60461 | B1897: 604614 | C1897: 604611 | D1897: 604612 | E1897: 604613 | F1897: 604614 | G1897: 604615 | K1897: 3
A1898: 60462 | B1898: 604623 | C1898: 604621 | D1898: 604622 | E1898: 604623 | F1898: 604624 | G1898: 604625 | K1898: 3
A1899: 60463 | B1899: 604632 | C1899: 604631 | D1899: 604632 | E1899: 604633 | F1899: 604634 | G1899: 604635 | K1899: 3
A1900: 60464 | B1900: 604641 | C1900: 604641 | D1900: 604642 | E1900: 604643 | F1900: 604644 | G1900: 604645 | K1900: 3
A1901: 60471 | B1901: 604714 | C1901: 604711 | D1901: 604712 | E1901: 604713 | F1901: 604714 | G1901: 604715 | K1901: 3
A1902: 60472 | B1902: 604723 | C1902: 604721 | D1902: 604722 | E1902: 604723 | F1902: 604724 | G1902: 604725 | K1902: 3
A1903: 60473 | B1903: 604732 | C1903: 604731 | D1903: 604732 | E1903: 604733 | F1903: 604734 | G1903: 604735 | K1903: 3
A1904: 60474 | B1904: 604741 | C1904: 604741 | D1904: 604742 | E1904: 604743 | F1904: 604744 | G1904: 604745 | K1904: 3
A1905: 60481 | B1905: 604814 | C1905: 604811 | D1905: 604812 | E1905: 604813 | F1905: 604814 | G1905: 604815 | K1905: 3
A1906: 60482 | B1906: 604823 | C1906: 604821 | D1906: 604822 | E1906: 604823 | F1906: 604824 | G1906: 604825 | K1906: 3
A1907: 60483 | B1907: 604832 | C1907: 604831 | D1907: 604832 | E1907: 604833 | F1907: 604834 | G1907: 604835 | K1907: 3
A1908: 60484 | B1908: 604841 | C1908: 604841 | D1908: 604842 | E1908: 604843 | F1908: 604844 | G1908: 604845 | K1908: 3
A1909: 60485 | B1909: 604851 | C1909: 604851 | D1909: 604852 | E1909: 604853 | F1909: 604854 | G1909: 604855 | K1909: 3
A1910: 60491 | B1910: 604914 | C1910: 604911 | D1910: 604912 | E1910: 604913 | F1910: 604914 | G1910: 604915 | K1910: 3
A1911: 60492 | B1911: 604923 | C1911: 604921 | D1911: 604922 | E1911: 604923 | F1911: 604924 | G1911: 604925 | K1911: 3
A1912: 60493 | B1912: 604932 | C1912: 604931 | D1912: 604932 | E1912: 604933 | F1912: 604934 | G1912: 604935 | K1912: 3
A1913: 60494 | B1913: 604941 | C1913: 604941 | D1913: 604942 | E1913: 604943 | F1913: 604944 | G1913: 604945 | K1913: 3
A1914: 60501 | B1914: 605014 | C1914: 605011 | D1914: 605012 | E1914: 605013 | F1914: 605014 | G1914: 605015 | K1914: 3
A1915: 60502 | B1915: 605023 | C1915: 605021 | D1915: 605022 | E1915: 605023 | F1915: 605024 | G1915: 605025 | K1915: 3
A1916: 60503 | B1916: 605032 | C1916: 605031 | D1916: 605032 | E1916: 605033 | F1916: 605034 | G1916: 605035 | K1916: 3
A1917: 60504 | B1917: 605041 | C1917: 605041 | D1917: 605042 | E1917: 605043 | F1917: 605044 | G1917: 605045 | K1917: 3
A1918: 60511 | B1918: 605114 | C1918: 605111 | D1918: 605112 | E1918: 605113 | F1918: 605114 | G1918: 605115 | K1918: 3
A1919: 60512 | B1919: 605123 | C1919: 605121 | D1919: 605122 | E1919: 605123 | F1919: 605124 | G1919: 605125 | K1919: 3
A1920: 60513 | B1920: 605132 | C1920: 605131 | D1920: 605132 | E1920: 605133 | F1920: 605134 | G1920: 605135 | K1920: 3
A1921: 60514 | B1921: 605141 | C1921: 605141 | D1921: 605142 | E1921: 605143 | F1921: 605144 | G1921: 605145 | K1921: 3
A1922: 60515 | B1922: 605154 | C1922: 605151 | D1922: 605152 | E1922: 605153 | F1922: 605154 | G1922: 605155 | K1922: 3
A1923: 60521 | B1923: 605214 | C1923: 605211 | D1923: 605212 | E1923: 605213 | F1923: 605214 | G1923: 605215 | K1923: 3
A1924: 60522 | B1924: 605223 | C1924: 605221 | D1924: 605222 | E1924: 605223 | F1924: 605224 | G1924: 605225 | K1924: 3
A1925: 60523 | B1925: 605232 | C1925: 605231 | D1925: 605232 | E1925: 605233 | F1925: 605234 | G1925: 605235 | K1925: 3
A1926: 60524 | B1926: 605241 | C1926: 605241 | D1926: 605242 | E1926: 605243 | F1926: 605244 | G1926: 605245 | K1926: 3
A1927: 60531 | B1927: 605314 | C1927: 605311 | D1927: 605312 | E1927: 605313 | F1927: 605314 | G1927: 605315 | K1927: 3
A1928: 60532 | B1928: 605323 | C1928: 605321 | D1928: 605322 | E1928: 605323 | F1928: 605324 | G1928: 605325 | K1928: 3
A1929: 60533 | B1929: 605332 | C1929: 605331 | D1929: 605332 | E1929: 605333 | F1929: 605334 | G1929: 605335 | K1929: 3
A1930: 60534 | B1930: 605341 | C1930: 605341 | D1930: 605342 | E1930: 605343 | F1930: 605344 | G1930: 605345 | K1930: 3
A1931: 60541 | B1931: 605414 | C1931: 605411 | D1931: 605412 | E1931: 605413 | F1931: 605414 | G1931: 605415 | K1931: 3
A1932: 60542 | B1932: 605423 | C1932: 605421 | D1932: 605422 | E1932: 605423 | F1932: 605424 | G1932: 605425 | K1932: 3
A1933: 60543 | B1933: 605432 | C1933: 605431 | D1933: 605432 | E1933: 605433 | F1933: 605434 | G1933: 605435 | K1933: 3
A1934: 60544 | B1934: 605441 | C1934: 605441 | D1934: 605442 | E1934: 605443 | F1934: 605444 | G1934: 605445 | K1934: 3
A1935: 60545 | B1935: 605453 | C1935: 605451 | D1935: 605452 | E1935: 605453 | F1935: 605454 | G1935: 605455 | K1935: 3
A1936: 60551 | B1936: 605514 | C1936: 605511 | D1936: 605512 | E1936: 605513 | F1936: 605514 | G1936: 605515 | K1936: 3
A1937: 60552 | B1937: 605523 | C1937: 605521 | D1937: 605522 | E1937: 605523 | F1937: 605524 | G1937: 605525 | K1937: 3
A1938: 60553 | B1938: 605532 | C1938: 605531 | D1938: 605532 | E1938: 605533 | F1938: 605534 | G1938: 605535 | K1938: 3
A1939: 60554 | B1939: 605541 | C1939: 605541 | D1939: 605542 | E1939: 605543 | F1939: 605544 | G1939: 605545 | K1939: 3
A1940: 60561 | B1940: 605614 | C1940: 605611 | D1940: 605612 | E1940: 605613 | F1940: 605614 | G1940: 605615 | K1940: 3
A1941: 60562 | B1941: 605623 | C1941: 605621 | D1941: 605622 | E1941: 605623 | F1941: 605624 | G1941: 605625 | K1941: 3
A1942: 60563 | B1942: 605632 | C1942: 605631 | D1942: 605632 | E1942: 605633 | F1942: 605634 | G1942: 605635 | K1942: 3
A1943: 60564 | B1943: 605641 | C1943: 605641 | D1943: 605642 | E1943: 605643 | F1943: 605644 | G1943: 605645 | K1943: 3
A1944: 60571 | B1944: 605714 | C1944: 605711 | D1944: 605712 | E1944: 605713 | F1944: 605714 | G1944: 605715 | K1944: 3
A1945: 60572 | B1945: 605723 | C1945: 605721 | D1945: 605722 | E1945: 605723 | F1945: 605724 | G1945: 605725 | K1945: 3
A1946: 60573 | B1946: 605732 | C1946: 605731 | D1946: 605732 | E1946: 605733 | F1946: 605734 | G1946: 605735 | K1946: 3
A1947: 60574 | B1947: 605741 | C1947: 605741 | D1947: 605742 | E1947: 605743 | F1947: 605744 | G1947: 605745 | K1947: 3
A1948: 60575 | B1948: 605752 | C1948: 605751 | D1948: 605752 | E1948: 605753 | F1948: 605754 | G1948: 605755 | K1948: 3
A1949: 60581 | B1949: 605814 | C1949: 605811 | D1949: 605812 | E1949: 605813 | F1949: 605814 | G1949: 605815 | K1949: 3
A1950: 60582 | B1950: 605823 | C1950: 605821 | D1950: 605822 | E1950: 605823 | F1950: 605824 | G1950: 605825 | K1950: 3
A1951: 60583 | B1951: 605832 | C1951: 605831 | D1951: 605832 | E1951: 605833 | F1951: 605834 | G1951: 605835 | K1951: 3
A1952: 60584 | B1952: 605841 | C1952: 605841 | D1952: 605842 | E1952: 605843 | F1952: 605844 | G1952: 605845 | K1952: 3
A1953: 60591 | B1953: 605914 | C1953: 605911 | D1953: 605912 | E1953: 605913 | F1953: 605914 | G1953: 605915 | K1953: 3
A1954: 60592 | B1954: 605923 | C1954: 605921 | D1954: 605922 | E1954: 605923 | F1954: 605924 | G1954: 605925 | K1954: 3
A1955: 60593 | B1955: 605932 | C1955: 605931 | D1955: 605932 | E1955: 605933 | F1955: 605934 | G1955: 605935 | K1955: 3
A1956: 60594 | B1956: 605941 | C1956: 605941 | D1956: 605942 | E1956: 605943 | F1956: 605944 | G1956: 605945 | K1956: 3
A1957: 60601 | B1957: 606014 | C1957: 606011 | D1957: 606012 | E1957: 606013 | F1957: 606014 | G1957: 606015 | K1957: 3
A1958: 60602 | B1958: 606023 | C1958: 606021 | D1958: 606022 | E1958: 606023 | F1958: 606024 | G1958: 606025 | K1958: 3
A1959: 60603 | B1959: 606032 | C1959: 606031 | D1959: 606032 | E1959: 606033 | F1959: 606034 | G1959: 606035 | K1959: 3
A1960: 60604 | B1960: 606041 | C1960: 606041 | D1960: 606042 | E1960: 606043 | F1960: 606044 | G1960: 606045 | K1960: 3
A1961: 60605 | B1961: 606051 | C1961: 606051 | D1961: 606052 | E1961: 606053 | F1961: 606054 | G1961: 606055 | K1961: 3
A1962: 60611 | B1962: 606114 | C1962: 606111 | D1962: 606112 | E1962: 606113 | F1962: 606114 | G1962: 606115 | K1962: 3
A1963: 60612 | B1963: 606123 | C1963: 606121 | D1963: 606122 | E1963: 606123 | F1963: 606124 | G1963: 606125 | K1963: 3
A1964: 60613 | B1964: 606132 | C1964: 606131 | D1964: 606132 | E1964: 606133 | F1964: 606134 | G1964: 606135 | K1964: 3
A1965: 60614 | B1965: 606141 | C1965: 606141 | D1965: 606142 | E1965: 606143 | F1965: 606144 | G1965: 606145 | K1965: 3
A1966: 60621 | B1966: 606214 | C1966: 606211 | D1966: 606212 | E1966: 606213 | F1966: 606214 | G1966: 606215 | K1966: 3
A1967: 60622 | B1967: 606223 | C1967: 606221 | D1967: 606222 | E1967: 606223 | F1967: 606224 | G1967: 606225 | K1967: 3
A1968: 60623 | B1968: 606232 | C1968: 606231 | D1968: 606232 | E1968: 606233 | F1968: 606234 | G1968: 606235 | K1968: 3
A1969: 60624 | B1969: 606241 | C1969: 606241 | D1969: 606242 | E1969: 606243 | F1969: 606244 | G1969: 606245 | K1969: 3
A1970: 60631 | B1970: 606314 | C1970: 606311 | D1970: 606312 | E1970: 606313 | F1970: 606314 | G1970: 606315 | K1970: 3
A1971: 60632 | B1971: 606323 | C1971: 606321 | D1971: 606322 | E1971: 606323 | F1971: 606324 | G1971: 606325 | K1971: 3
A1972: 60633 | B1972: 606332 | C1972: 606331 | D1972: 606332 | E1972: 606333 | F1972: 606334 | G1972: 606335 | K1972: 3
A1973: 60634 | B1973: 606341 | C1973: 606341 | D1973: 606342 | E1973: 606343 | F1973: 606344 | G1973: 606345 | K1973: 3
A1974: 60635 | B1974: 606354 | C1974: 606351 | D1974: 606352 | E1974: 606353 | F1974: 606354 | G1974: 606355 | K1974: 3
A1975: 60641 | B1975: 606414 | C1975: 606411 | D1975: 606412 | E1975: 606413 | F1975: 606414 | G1975: 606415 | K1975: 3
A1976: 60642 | B1976: 606423 | C1976: 606421 | D1976: 606422 | E1976: 606423 | F1976: 606424 | G1976: 606425 | K1976: 3
A1977: 60643 | B1977: 606432 | C1977: 606431 | D1977: 606432 | E1977: 606433 | F1977: 606434 | G1977: 606435 | K1977: 3
A1978: 60644 | B1978: 606441 | C1978: 606441 | D1978: 606442 | E1978: 606443 | F1978: 606444 | G1978: 606445 | K1978: 3
A1979: 60651 | B1979: 606514 | C1979: 606511 | D1979: 606512 | E1979: 606513 | F1979: 606514 | G1979: 606515 | K1979: 3
A1980: 60652 | B1980: 606523 | C1980: 606521 | D1980: 606522 | E1980: 606523 | F1980: 606524 | G1980: 606525 | K1980: 3
A1981: 60653 | B1981: 606532 | C1981: 606531 | D1981: 606532 | E1981: 606533 | F1981: 606534 | G1981: 606535 | K1981: 3
A1982: 60654 | B1982: 606541 | C1982: 606541 | D1982: 606542 | E1982: 606543 | F1982: 606544 | G1982: 606545 | K1982: 3
A1983: 60661 | B1983: 606614 | C1983: 606611 | D1983: 606612 | E1983: 606613 | F1983: 606614 | G1983: 606615 | K1983: 3
A1984: 60662 | B1984: 606623 | C1984: 606621 | D1984: 606622 | E1984: 606623 | F1984: 606624 | G1984: 606625 | K1984: 3
A1985: 60663 | B1985: 606632 | C1985: 606631 | D1985: 606632 | E1985: 606633 | F1985: 606634 | G1985: 606635 | K1985: 3
A1986: 60664 | B1986: 606641 | C1986: 606641 | D1986: 606642 | E1986: 606643 | F1986: 606644 | G1986: 606645 | K1986: 3
A1987: 60665 | B1987: 606653 | C1987: 606651 | D1987: 606652 | E1987: 606653 | F1987: 606654 | G1987: 606655 | K1987: 3
A1988: 60671 | B1988: 606714 | C1988: 606711 | D1988: 606712 | E1988: 606713 | F1988: 606714 | G1988: 606715 | K1988: 3
A1989: 60672 | B1989: 606723 | C1989: 606721 | D1989: 606722 | E1989: 606723 | F1989: 606724 | G1989: 606725 | K1989: 3
A1990: 60673 | B1990: 606732 | C1990: 606731 | D1990: 606732 | E1990: 606733 | F1990: 606734 | G1990: 606735 | K1990: 3
A1991: 60674 | B1991: 606741 | C1991: 606741 | D1991: 606742 | E1991: 606743 | F1991: 606744 | G1991: 606745 | K1991: 3
A1992: 60681 | B1992: 606814 | C1992: 606811 | D1992: 606812 | E1992: 606813 | F1992: 606814 | G1992: 606815 | K1992: 3
A1993: 60682 | B1993: 606823 | C1993: 606821 | D1993: 606822 | E1993: 606823 | F1993: 606824 | G1993: 606825 | K1993: 3
A1994: 60683 | B1994: 606832 | C1994: 606831 | D1994: 606832 | E1994: 606833 | F1994: 606834 | G1994: 606835 | K1994: 3
A1995: 60684 | B1995: 606841 | C1995: 606841 | D1995: 606842 | E1995: 606843 | F1995: 606844 | G1995: 606845 | K1995: 3
A1996: 60691 | B1996: 606914 | C1996: 606911 | D1996: 606912 | E1996: 606913 | F1996: 606914 | G1996: 606915 | K1996: 3
A1997: 60692 | B1997: 606923 | C1997: 606921 | D1997: 606922 | E1997: 606923 | F1997: 606924 | G1997: 606925 | K1997: 3
A1998: 60693 | B1998: 606932 | C1998: 606931 | D1998: 606932 | E1998: 606933 | F1998: 606934 | G1998: 606935 | K1998: 3
A1999: 60694 | B1999: 606941 | C1999: 606941 | D1999: 606942 | E1999: 606943 | F1999: 606944 | G1999: 606945 | K1999: 3
A2000: 60695 | B2000: 606952 | C2000: 606951 | D2000: 606952 | E2000: 606953 | F2000: 606954 | G2000: 606955 | K2000: 3
A2001: 60701 | B2001: 607014 | C2001: 607011 | D2001: 607012 | E2001: 607013 | F2001: 607014 | G2001: 607015 | K2001: 3
A2002: 60702 | B2002: 607023 | C2002: 607021 | D2002: 607022 | E2002: 607023 | F2002: 607024 | G2002: 607025 | K2002: 3
A2003: 60703 | B2003: 607032 | C2003: 607031 | D2003: 607032 | E2003: 607033 | F2003: 607034 | G2003: 607035 | K2003: 3
A2004: 60704 | B2004: 607041 | C2004: 607041 | D2004: 607042 | E2004: 607043 | F2004: 607044 | G2004: 607045 | K2004: 3
A2005: 60711 | B2005: 607114 | C2005: 607111 | D2005: 607112 | E2005: 607113 | F2005: 607114 | G2005: 607115 | K2005: 3
A2006: 60712 | B2006: 607123 | C2006: 607121 | D2006: 607122 | E2006: 607123 | F2006: 607124 | G2006: 607125 | K2006: 3
A2007: 60713 | B2007: 607132 | C2007: 607131 | D2007: 607132 | E2007: 607133 | F2007: 607134 | G2007: 607135 | K2007: 3
A2008: 60714 | B2008: 607141 | C2008: 607141 | D2008: 607142 | E2008: 607143 | F2008: 607144 | G2008: 607145 | K2008: 3
A2009: 60721 | B2009: 607214 | C2009: 607211 | D2009: 607212 | E2009: 607213 | F2009: 607214 | G2009: 607215 | K2009: 3
A2010: 60722 | B2010: 607223 | C2010: 607221 | D2010: 607222 | E2010: 607223 | F2010: 607224 | G2010: 607225 | K2010: 3
A2011: 60723 | B2011: 607232 | C2011: 607231 | D2011: 607232 | E2011: 607233 | F2011: 607234 | G2011: 607235 | K2011: 3
A2012: 60724 | B2012: 607241 | C2012: 607241 | D2012: 607242 | E2012: 607243 | F2012: 607244 | G2012: 607245 | K2012: 3
A2013: 60725 | B2013: 607251 | C2013: 607251 | D2013: 607252 | E2013: 607253 | F2013: 607254 | G2013: 607255 | K2013: 3
A2014: 60731 | B2014: 607314 | C2014: 607311 | D2014: 607312 | E2014: 607313 | F2014: 607314 | G2014: 607315 | K2014: 3
A2015: 60732 | B2015: 607323 | C2015: 607321 | D2015: 607322 | E2015: 607323 | F2015: 607324 | G2015: 607325 | K2015: 3
A2016: 60733 | B2016: 607332 | C2016: 607331 | D2016: 607332 | E2016: 607333 | F2016: 607334 | G2016: 607335 | K2016: 3
A2017: 60734 | B2017: 607341 | C2017: 607341 | D2017: 607342 | E2017: 607343 | F2017: 607344 | G2017: 607345 | K2017: 3
A2018: 60741 | B2018: 607414 | C2018: 607411 | D2018: 607412 | E2018: 607413 | F2018: 607414 | G2018: 607415 | K2018: 3
A2019: 60742 | B2019: 607423 | C2019: 607421 | D2019: 607422 | E2019: 607423 | F2019: 607424 | G2019: 607425 | K2019: 3
A2020: 60743 | B2020: 607432 | C2020: 607431 | D2020: 607432 | E2020: 607433 | F2020: 607434 | G2020: 607435 | K2020: 3
A2021: 60744 | B2021: 607441 | C2021: 607441 | D2021: 607442 | E2021: 607443 | F2021: 607444 | G2021: 607445 | K2021: 3
A2022: 60751 | B2022: 607514 | C2022: 607511 | D2022: 607512 | E2022: 607513 | F2022: 607514 | G2022: 607515 | K2022: 3
A2023: 60752 | B2023: 607523 | C2023: 607521 | D2023: 607522 | E2023: 607523 | F2023: 607524 | G2023: 607525 | K2023: 3
A2024: 60753 | B2024: 607532 | C2024: 607531 | D2024: 607532 | E2024: 607533 | F2024: 607534 | G2024: 607535 | K2024: 3
A2025: 60754 | B2025: 607541 | C2025: 607541 | D2025: 607542 | E2025: 607543 | F2025: 607544 | G2025: 607545 | K2025: 3
A2026: 60755 | B2026: 607554 | C2026: 607551 | D2026: 607552 | E2026: 607553 | F2026: 607554 | G2026: 607555 | K2026: 3
A2027: 60761 | B2027: 607614 | C2027: 607611 | D2027: 607612 | E2027: 607613 | F2027: 607614 | G2027: 607615 | K2027: 3
A2028: 60762 | B2028: 607623 | C2028: 607621 | D2028: 607622 | E2028: 607623 | F2028: 607624 | G2028: 607625 | K2028: 3
A2029: 60763 | B2029: 607632 | C2029: 607631 | D2029: 607632 | E2029: 607633 | F2029: 607634 | G2029: 607635 | K2029: 3
A2030: 60764 | B2030: 607641 | C2030: 607641 | D2030: 607642 | E2030: 607643 | F2030: 607644 | G2030: 607645 | K2030: 3
A2031: 60771 | B2031: 607714 | C2031: 607711 | D2031: 607712 | E2031: 607713 | F2031: 607714 | G2031: 607715 | K2031: 3
A2032: 60772 | B2032: 607723 | C2032: 607721 | D2032: 607722 | E2032: 607723 | F2032: 607724 | G2032: 607725 | K2032: 3
A2033: 60773 | B2033: 607732 | C2033: 607731 | D2033: 607732 | E2033: 607733 | F2033: 607734 | G2033: 607735 | K2033: 3
A2034: 60774 | B2034: 607741 | C2034: 607741 | D2034: 607742 | E2034: 607743 | F2034: 607744 | G2034: 607745 | K2034: 3
A2035: 60781 | B2035: 607814 | C2035: 607811 | D2035: 607812 | E2035: 607813 | F2035: 607814 | G2035: 607815 | K2035: 3
A2036: 60782 | B2036: 607823 | C2036: 607821 | D2036: 607822 | E2036: 607823 | F2036: 607824 | G2036: 607825 | K2036: 3
A2037: 60783 | B2037: 607832 | C2037: 607831 | D2037: 607832 | E2037: 607833 | F2037: 607834 | G2037: 607835 | K2037: 3
A2038: 60784 | B2038: 607841 | C2038: 607841 | D2038: 607842 | E2038: 607843 | F2038: 607844 | G2038: 607845 | K2038: 3
A2039: 60785 | B2039: 607853 | C2039: 607851 | D2039: 607852 | E2039: 607853 | F2039: 607854 | G2039: 607855 | K2039: 3
A2040: 60791 | B2040: 607914 | C2040: 607911 | D2040: 607912 | E2040: 607913 | F2040: 607914 | G2040: 607915 | K2040: 3
A2041: 60792 | B2041: 607923 | C2041: 607921 | D2041: 607922 | E2041: 607923 | F2041: 607924 | G2041: 607925 | K2041: 3
A2042: 60793 | B2042: 607932 | C2042: 607931 | D2042: 607932 | E2042: 607933 | F2042: 607934 | G2042: 607935 | K2042: 3
A2043: 60794 | B2043: 607941 | C2043: 607941 | D2043: 607942 | E2043: 607943 | F2043: 607944 | G2043: 607945 | K2043: 3
A2044: 60801 | B2044: 608014 | C2044: 608011 | D2044: 608012 | E2044: 608013 | F2044: 608014 | G2044: 608015 | K2044: 3
A2045: 60802 | B2045: 608023 | C2045: 608021 | D2045: 608022 | E2045: 608023 | F2045: 608024 | G2045: 608025 | K2045: 3
A2046: 60803 | B2046: 608032 | C2046: 608031 | D2046: 608032 | E2046: 608033 | F2046: 608034 | G2046: 608035 | K2046: 3
A2047: 60804 | B2047: 608041 | C2047: 608041 | D2047: 608042 | E2047: 608043 | F2047: 608044 | G2047: 608045 | K2047: 3
A2048: 60811 | B2048: 608114 | C2048: 608111 | D2048: 608112 | E2048: 608113 | F2048: 608114 | G2048: 608115 | K2048: 3
A2049: 60812 | B2049: 608123 | C2049: 608121 | D2049: 608122 | E2049: 608123 | F2049: 608124 | G2049: 608125 | K2049: 3
A2050: 60813 | B2050: 608132 | C2050: 608131 | D2050: 608132 | E2050: 608133 | F2050: 608134 | G2050: 608135 | K2050: 3
A2051: 60814 | B2051: 608141 | C2051: 608141 | D2051: 608142 | E2051: 608143 | F2051: 608144 | G2051: 608145 | K2051: 3
A2052: 60815 | B2052: 608152 | C2052: 608151 | D2052: 608152 | E2052: 608153 | F2052: 608154 | G2052: 608155 | K2052: 3
A2053: 60821 | B2053: 608214 | C2053: 608211 | D2053: 608212 | E2053: 608213 | F2053: 608214 | G2053: 608215 | K2053: 3
A2054: 60822 | B2054: 608223 | C2054: 608221 | D2054: 608222 | E2054: 608223 | F2054: 608224 | G2054: 608225 | K2054: 3
A2055: 60823 | B2055: 608232 | C2055: 608231 | D2055: 608232 | E2055: 608233 | F2055: 608234 | G2055: 608235 | K2055: 3
A2056: 60824 | B2056: 608241 | C2056: 608241 | D2056: 608242 | E2056: 608243 | F2056: 608244 | G2056: 608245 | K2056: 3
A2057: 60831 | B2057: 608314 | C2057: 608311 | D2057: 608312 | E2057: 608313 | F2057: 608314 | G2057: 608315 | K2057: 3
A2058: 60832 | B2058: 608323 | C2058: 608321 | D2058: 608322 | E2058: 608323 | F2058: 608324 | G2058: 608325 | K2058: 3
A2059: 60833 | B2059: 608332 | C2059: 608331 | D2059: 608332 | E2059: 608333 | F2059: 608334 | G2059: 608335 | K2059: 3
A2060: 60834 | B2060: 608341 | C2060: 608341 | D2060: 608342 | E2060: 608343 | F2060: 608344 | G2060: 608345 | K2060: 3
A2061: 60841 | B2061: 608414 | C2061: 608411 | D2061: 608412 | E2061: 608413 | F2061: 608414 | G2061: 608415 | K2061: 3
A2062: 60842 | B2062: 608423 | C2062: 608421 | D2062: 608422 | E2062: 608423 | F2062: 608424 | G2062: 608425 | K2062: 3
A2063: 60843 | B2063: 608432 | C2063: 608431 | D2063: 608432 | E2063: 608433 | F2063: 608434 | G2063: 608435 | K2063: 3
A2064: 60844 | B2064: 608441 | C2064: 608441 | D2064: 608442 | E2064: 608443 | F2064: 608444 | G2064: 608445 | K2064: 3
A2065: 60845 | B2065: 608451 | C2065: 608451 | D2065: 608452 | E2065: 608453 | F2065: 608454 | G2065: 608455 | K2065: 3
A2066: 60851 | B2066: 608514 | C2066: 608511 | D2066: 608512 | E2066: 608513 | F2066: 608514 | G2066: 608515 | K2066: 3
A2067: 60852 | B2067: 608523 | C2067: 608521 | D2067: 608522 | E2067: 608523 | F2067: 608524 | G2067: 608525 | K2067: 3
A2068: 60853 | B2068: 608532 | C2068: 608531 | D2068: 608532 | E2068: 608533 | F2068: 608534 | G2068: 608535 | K2068: 3
A2069: 60854 | B2069: 608541 | C2069: 608541 | D2069: 608542 | E2069: 608543 | F2069: 608544 | G2069: 608545 | K2069: 3
A2070: 60861 | B2070: 608614 | C2070: 608611 | D2070: 608612 | E2070: 608613 | F2070: 608614 | G2070: 608615 | K2070: 3
A2071: 60862 | B2071: 608623 | C2071: 608621 | D2071: 608622 | E2071: 608623 | F2071: 608624 | G2071: 608625 | K2071: 3
A2072: 60863 | B2072: 608632 | C2072: 608631 | D2072: 608632 | E2072: 608633 | F2072: 608634 | G2072: 608635 | K2072: 3
A2073: 60864 | B2073: 608641 | C2073: 608641 | D2073: 608642 | E2073: 608643 | F2073: 608644 | G2073: 608645 | K2073: 3
A2074: 60871 | B2074: 608714 | C2074: 608711 | D2074: 608712 | E2074: 608713 | F2074: 608714 | G2074: 608715 | K2074: 3
A2075: 60872 | B2075: 608723 | C2075: 608721 | D2075: 608722 | E2075: 608723 | F2075: 608724 | G2075: 608725 | K2075: 3
A2076: 60873 | B2076: 608732 | C2076: 608731 | D2076: 608732 | E2076: 608733 | F2076: 608734 | G2076: 608735 | K2076: 3
A2077: 60874 | B2077: 608741 | C2077: 608741 | D2077: 608742 | E2077: 608743 | F2077: 608744 | G2077: 608745 | K2077: 3
A2078: 60875 | B2078: 608754 | C2078: 608751 | D2078: 608752 | E2078: 608753 | F2078: 608754 | G2078: 608755 | K2078: 3
A2079: 60881 | B2079: 608814 | C2079: 608811 | D2079: 608812 | E2079: 608813 | F2079: 608814 | G2079: 608815 | K2079: 3
A2080: 60882 | B2080: 608823 | C2080: 608821 | D2080: 608822 | E2080: 608823 | F2080: 608824 | G2080: 608825 | K2080: 3
A2081: 60883 | B2081: 608832 | C2081: 608831 | D2081: 608832 | E2081: 608833 | F2081: 608834 | G2081: 608835 | K2081: 3
A2082: 60884 | B2082: 608841 | C2082: 608841 | D2082: 608842 | E2082: 608843 | F2082: 608844 | G2082: 608845 | K2082: 3
A2083: 60891 | B2083: 608914 | C2083: 608911 | D2083: 608912 | E2083: 608913 | F2083: 608914 | G2083: 608915 | K2083: 3
A2084: 60892 | B2084: 608923 | C2084: 608921 | D2084: 608922 | E2084: 608923 | F2084: 608924 | G2084: 608925 | K2084: 3
A2085: 60893 | B2085: 608932 | C2085: 608931 | D2085: 608932 | E2085: 608933 | F2085: 608934 | G2085: 608935 | K2085: 3
A2086: 60894 | B2086: 608941 | C2086: 608941 | D2086: 608942 | E2086: 608943 | F2086: 608944 | G2086: 608945 | K2086: 3
A2087: 60901 | B2087: 609014 | C2087: 609011 | D2087: 609012 | E2087: 609013 | F2087: 609014 | G2087: 609015 | K2087: 3
A2088: 60902 | B2088: 609023 | C2088: 609021 | D2088: 609022 | E2088: 609023 | F2088: 609024 | G2088: 609025 | K2088: 3
A2089: 60903 | B2089: 609032 | C2089: 609031 | D2089: 609032 | E2089: 609033 | F2089: 609034 | G2089: 609035 | K2089: 3
A2090: 60904 | B2090: 609041 | C2090: 609041 | D2090: 609042 | E2090: 609043 | F2090: 609044 | G2090: 609045 | K2090: 3
A2091: 60905 | B2091: 609053 | C2091: 609051 | D2091: 609052 | E2091: 609053 | F2091: 609054 | G2091: 609055 | K2091: 3
A2092: 60911 | B2092: 609114 | C2092: 609111 | D2092: 609112 | E2092: 609113 | F2092: 609114 | G2092: 609115 | K2092: 3
A2093: 60912 | B2093: 609123 | C2093: 609121 | D2093: 609122 | E2093: 609123 | F2093: 609124 | G2093: 609125 | K2093: 3
A2094: 60913 | B2094: 609132 | C2094: 609131 | D2094: 609132 | E2094: 609133 | F2094: 609134 | G2094: 609135 | K2094: 3
A2095: 60914 | B2095: 609141 | C2095: 609141 | D2095: 609142 | E2095: 609143 | F2095: 609144 | G2095: 609145 | K2095: 3
A2096: 60921 | B2096: 609214 | C2096: 609211 | D2096: 609212 | E2096: 609213 | F2096: 609214 | G2096: 609215 | K2096: 3
A2097: 60922 | B2097: 609223 | C2097: 609221 | D2097: 609222 | E2097: 609223 | F2097: 609224 | G2097: 609225 | K2097: 3
A2098: 60923 | B2098: 609232 | C2098: 609231 | D2098: 609232 | E2098: 609233 | F2098: 609234 | G2098: 609235 | K2098: 3
A2099: 60924 | B2099: 609241 | C2099: 609241 | D2099: 609242 | E2099: 609243 | F2099: 609244 | G2099: 609245 | K2099: 3
A2100: 60931 | B2100: 609314 | C2100: 609311 | D2100: 609312 | E2100: 609313 | F2100: 609314 | G2100: 609315 | K2100: 3
A2101: 60932 | B2101: 609323 | C2101: 609321 | D2101: 609322 | E2101: 609323 | F2101: 609324 | G2101: 609325 | K2101: 3
A2102: 60933 | B2102: 609332 | C2102: 609331 | D2102: 609332 | E2102: 609333 | F2102: 609334 | G2102: 609335 | K2102: 3
A2103: 60934 | B2103: 609341 | C2103: 609341 | D2103: 609342 | E2103: 609343 | F2103: 609344 | G2103: 609345 | K2103: 3
A2104: 60935 | B2104: 609352 | C2104: 609351 | D2104: 609352 | E2104: 609353 | F2104: 609354 | G2104: 609355 | K2104: 3
A2105: 60941 | B2105: 609414 | C2105: 609411 | D2105: 609412 | E2105: 609413 | F2105: 609414 | G2105: 609415 | K2105: 3
A2106: 60942 | B2106: 609423 | C2106: 609421 | D2106: 609422 | E2106: 609423 | F2106: 609424 | G2106: 609425 | K2106: 3
A2107: 60943 | B2107: 609432 | C2107: 609431 | D2107: 609432 | E2107: 609433 | F2107: 609434 | G2107: 609435 | K2107: 3
A2108: 60944 | B2108: 609441 | C2108: 609441 | D2108: 609442 | E2108: 609443 | F2108: 609444 | G2108: 609445 | K2108: 3
A2109: 60951 | B2109: 609514 | C2109: 609511 | D2109: 609512 | E2109: 609513 | F2109: 609514 | G2109: 609515 | K2109: 3
A2110: 60952 | B2110: 609523 | C2110: 609521 | D2110: 609522 | E2110: 609523 | F2110: 609524 | G2110: 609525 | K2110: 3
A2111: 60953 | B2111: 609532 | C2111: 609531 | D2111: 609532 | E2111: 609533 | F2111: 609534 | G2111: 609535 | K2111: 3
A2112: 60954 | B2112: 609541 | C2112: 609541 | D2112: 609542 | E2112: 609543 | F2112: 609544 | G2112: 609545 | K2112: 3
A2113: 60961 | B2113: 609614 | C2113: 609611 | D2113: 609612 | E2113: 609613 | F2113: 609614 | G2113: 609615 | K2113: 3
A2114: 60962 | B2114: 609623 | C2114: 609621 | D2114: 609622 | E2114: 609623 | F2114: 609624 | G2114: 609625 | K2114: 3
A2115: 60963 | B2115: 609632 | C2115: 609631 | D2115: 609632 | E2115: 609633 | F2115: 609634 | G2115: 609635 | K2115: 3
A2116: 60964 | B2116: 609641 | C2116: 609641 | D2116: 609642 | E2116: 609643 | F2116: 609644 | G2116: 609645 | K2116: 3
A2117: 60965 | B2117: 609651 | C2117: 609651 | D2117: 609652 | E2117: 609653 | F2117: 609654 | G2117: 609655 | K2117: 3
A2118: 60971 | B2118: 609714 | C2118: 609711 | D2118: 609712 | E2118: 609713 | F2118: 609714 | G2118: 609715 | K2118: 3
A2119: 60972 | B2119: 609723 | C2119: 609721 | D2119: 609722 | E2119: 609723 | F2119: 609724 | G2119: 609725 | K2119: 3
A2120: 60973 | B2120: 609732 | C2120: 609731 | D2120: 609732 | E2120: 609733 | F2120: 609734 | G2120: 609735 | K2120: 3
A2121: 60974 | B2121: 609741 | C2121: 609741 | D2121: 609742 | E2121: 609743 | F2121: 609744 | G2121: 609745 | K2121: 3
A2122: 60981 | B2122: 609814 | C2122: 609811 | D2122: 609812 | E2122: 609813 | F2122: 609814 | G2122: 609815 | K2122: 3
A2123: 60982 | B2123: 609823 | C2123: 609821 | D2123: 609822 | E2123: 609823 | F2123: 609824 | G2123: 609825 | K2123: 3
A2124: 60983 | B2124: 609832 | C2124: 609831 | D2124: 609832 | E2124: 609833 | F2124: 609834 | G2124: 609835 | K2124: 3
A2125: 60984 | B2125: 609841 | C2125: 609841 | D2125: 609842 | E2125: 609843 | F2125: 609844 | G2125: 609845 | K2125: 3
A2126: 60991 | B2126: 609914 | C2126: 609911 | D2126: 609912 | E2126: 609913 | F2126: 609914 | G2126: 609915 | K2126: 3
A2127: 60992 | B2127: 609923 | C2127: 609921 | D2127: 609922 | E2127: 609923 | F2127: 609924 | G2127: 609925 | K2127: 3
A2128: 60993 | B2128: 609932 | C2128: 609931 | D2128: 609932 | E2128: 609933 | F2128: 609934 | G2128: 609935 | K2128: 3
A2129: 60994 | B2129: 609941 | C2129: 609941 | D2129: 609942 | E2129: 609943 | F2129: 609944 | G2129: 609945 | K2129: 3
A2130: 60995 | B2130: 609954 | C2130: 609951 | D2130: 609952 | E2130: 609953 | F2130: 609954 | G2130: 609955 | K2130: 3
A2131: 61001 | B2131: 610014 | C2131: 610011 | D2131: 610012 | E2131: 610013 | F2131: 610014 | G2131: 610015 | K2131: 3
A2132: 61002 | B2132: 610023 | C2132: 610021 | D2132: 610022 | E2132: 610023 | F2132: 610024 | G2132: 610025 | K2132: 3
A2133: 61003 | B2133: 610032 | C2133: 610031 | D2133: 610032 | E2133: 610033 | F2133: 610034 | G2133: 610035 | K2133: 3
A2134: 61004 | B2134: 610041 | C2134: 610041 | D2134: 610042 | E2134: 610043 | F2134: 610044 | G2134: 610045 | K2134: 3
A2135: 501010 | B2135: =RC[-1]+5 -> 501015 | C2135: =RC[-2]+1 -> 501011 | D2135: =RC[-1]+1 -> 501012 | E2135: =RC[-1]+1 -> 501013 | F2135: =RC[-1]+1 -> 501014 | G2135: =RC[-1]+1 -> 501015 | K2135: 3 | L2135: 精英战役
A2136: 501020 | B2136: =RC[-1]+5 -> 501025 | C2136: =RC[-2]+1 -> 501021 | D2136: =RC[-1]+1 -> 501022 | E2136: =RC[-1]+1 -> 501023 | F2136: =RC[-1]+1 -> 501024 | G2136: =RC[-1]+1 -> 501025 | K2136: 3
A2137: 501030 | B2137: =RC[-1]+5 -> 501035 | C2137: =RC[-2]+1 -> 501031 | D2137: =RC[-1]+1 -> 501032 | E2137: =RC[-1]+1 -> 501033 | F2137: =RC[-1]+1 -> 501034 | G2137: =RC[-1]+1 -> 501035 | K2137: 3
A2138: 501040 | B2138: =RC[-1]+5 -> 501045 | C2138: =RC[-2]+1 -> 501041 | D2138: =RC[-1]+1 -> 501042 | E2138: =RC[-1]+1 -> 501043 | F2138: =RC[-1]+1 -> 501044 | G2138: =RC[-1]+1 -> 501045 | K2138: 3
A2139: 502010 | B2139: =RC[-1]+5 -> 502015 | C2139: =RC[-2]+1 -> 502011 | D2139: =RC[-1]+1 -> 502012 | E2139: =RC[-1]+1 -> 502013 | F2139: =RC[-1]+1 -> 502014 | G2139: =RC[-1]+1 -> 502015 | K2139: 3
A2140: 502020 | B2140: =RC[-1]+5 -> 502025 | C2140: =RC[-2]+1 -> 502021 | D2140: =RC[-1]+1 -> 502022 | E2140: =RC[-1]+1 -> 502023 | F2140: =RC[-1]+1 -> 502024 | G2140: =RC[-1]+1 -> 502025 | K2140: 3
A2141: 502030 | B2141: =RC[-1]+5 -> 502035 | C2141: =RC[-2]+1 -> 502031 | D2141: =RC[-1]+1 -> 502032 | E2141: =RC[-1]+1 -> 502033 | F2141: =RC[-1]+1 -> 502034 | G2141: =RC[-1]+1 -> 502035 | K2141: 3
A2142: 502040 | B2142: =RC[-1]+5 -> 502045 | C2142: =RC[-2]+1 -> 502041 | D2142: =RC[-1]+1 -> 502042 | E2142: =RC[-1]+1 -> 502043 | F2142: =RC[-1]+1 -> 502044 | G2142: =RC[-1]+1 -> 502045 | K2142: 3
A2143: 503010 | B2143: =RC[-1]+5 -> 503015 | C2143: =RC[-2]+1 -> 503011 | D2143: =RC[-1]+1 -> 503012 | E2143: =RC[-1]+1 -> 503013 | F2143: =RC[-1]+1 -> 503014 | G2143: =RC[-1]+1 -> 503015 | K2143: 3
A2144: 503020 | B2144: =RC[-1]+5 -> 503025 | C2144: =RC[-2]+1 -> 503021 | D2144: =RC[-1]+1 -> 503022 | E2144: =RC[-1]+1 -> 503023 | F2144: =RC[-1]+1 -> 503024 | G2144: =RC[-1]+1 -> 503025 | K2144: 3
A2145: 503030 | B2145: =RC[-1]+5 -> 503035 | C2145: =RC[-2]+1 -> 503031 | D2145: =RC[-1]+1 -> 503032 | E2145: =RC[-1]+1 -> 503033 | F2145: =RC[-1]+1 -> 503034 | G2145: =RC[-1]+1 -> 503035 | K2145: 3
A2146: 503040 | B2146: =RC[-1]+5 -> 503045 | C2146: =RC[-2]+1 -> 503041 | D2146: =RC[-1]+1 -> 503042 | E2146: =RC[-1]+1 -> 503043 | F2146: =RC[-1]+1 -> 503044 | G2146: =RC[-1]+1 -> 503045 | K2146: 3
A2147: 504010 | B2147: =RC[-1]+5 -> 504015 | C2147: =RC[-2]+1 -> 504011 | D2147: =RC[-1]+1 -> 504012 | E2147: =RC[-1]+1 -> 504013 | F2147: =RC[-1]+1 -> 504014 | G2147: =RC[-1]+1 -> 504015 | K2147: 3
A2148: 504020 | B2148: =RC[-1]+5 -> 504025 | C2148: =RC[-2]+1 -> 504021 | D2148: =RC[-1]+1 -> 504022 | E2148: =RC[-1]+1 -> 504023 | F2148: =RC[-1]+1 -> 504024 | G2148: =RC[-1]+1 -> 504025 | K2148: 3
A2149: 504030 | B2149: =RC[-1]+5 -> 504035 | C2149: =RC[-2]+1 -> 504031 | D2149: =RC[-1]+1 -> 504032 | E2149: =RC[-1]+1 -> 504033 | F2149: =RC[-1]+1 -> 504034 | G2149: =RC[-1]+1 -> 504035 | K2149: 3
A2150: 504040 | B2150: =RC[-1]+5 -> 504045 | C2150: =RC[-2]+1 -> 504041 | D2150: =RC[-1]+1 -> 504042 | E2150: =RC[-1]+1 -> 504043 | F2150: =RC[-1]+1 -> 504044 | G2150: =RC[-1]+1 -> 504045 | K2150: 3
A2151: 505010 | B2151: =RC[-1]+5 -> 505015 | C2151: =RC[-2]+1 -> 505011 | D2151: =RC[-1]+1 -> 505012 | E2151: =RC[-1]+1 -> 505013 | F2151: =RC[-1]+1 -> 505014 | G2151: =RC[-1]+1 -> 505015 | K2151: 3
A2152: 505020 | B2152: =RC[-1]+5 -> 505025 | C2152: =RC[-2]+1 -> 505021 | D2152: =RC[-1]+1 -> 505022 | E2152: =RC[-1]+1 -> 505023 | F2152: =RC[-1]+1 -> 505024 | G2152: =RC[-1]+1 -> 505025 | K2152: 3
A2153: 505030 | B2153: =RC[-1]+5 -> 505035 | C2153: =RC[-2]+1 -> 505031 | D2153: =RC[-1]+1 -> 505032 | E2153: =RC[-1]+1 -> 505033 | F2153: =RC[-1]+1 -> 505034 | G2153: =RC[-1]+1 -> 505035 | K2153: 3
A2154: 505040 | B2154: =RC[-1]+5 -> 505045 | C2154: =RC[-2]+1 -> 505041 | D2154: =RC[-1]+1 -> 505042 | E2154: =RC[-1]+1 -> 505043 | F2154: =RC[-1]+1 -> 505044 | G2154: =RC[-1]+1 -> 505045 | K2154: 3
A2155: 506010 | B2155: =RC[-1]+5 -> 506015 | C2155: =RC[-2]+1 -> 506011 | D2155: =RC[-1]+1 -> 506012 | E2155: =RC[-1]+1 -> 506013 | F2155: =RC[-1]+1 -> 506014 | G2155: =RC[-1]+1 -> 506015 | K2155: 3
A2156: 506020 | B2156: =RC[-1]+5 -> 506025 | C2156: =RC[-2]+1 -> 506021 | D2156: =RC[-1]+1 -> 506022 | E2156: =RC[-1]+1 -> 506023 | F2156: =RC[-1]+1 -> 506024 | G2156: =RC[-1]+1 -> 506025 | K2156: 3
A2157: 506030 | B2157: =RC[-1]+5 -> 506035 | C2157: =RC[-2]+1 -> 506031 | D2157: =RC[-1]+1 -> 506032 | E2157: =RC[-1]+1 -> 506033 | F2157: =RC[-1]+1 -> 506034 | G2157: =RC[-1]+1 -> 506035 | K2157: 3
A2158: 506040 | B2158: =RC[-1]+5 -> 506045 | C2158: =RC[-2]+1 -> 506041 | D2158: =RC[-1]+1 -> 506042 | E2158: =RC[-1]+1 -> 506043 | F2158: =RC[-1]+1 -> 506044 | G2158: =RC[-1]+1 -> 506045 | K2158: 3
A2159: 507010 | B2159: =RC[-1]+5 -> 507015 | C2159: =RC[-2]+1 -> 507011 | D2159: =RC[-1]+1 -> 507012 | E2159: =RC[-1]+1 -> 507013 | F2159: =RC[-1]+1 -> 507014 | G2159: =RC[-1]+1 -> 507015 | K2159: 3
A2160: 507020 | B2160: =RC[-1]+5 -> 507025 | C2160: =RC[-2]+1 -> 507021 | D2160: =RC[-1]+1 -> 507022 | E2160: =RC[-1]+1 -> 507023 | F2160: =RC[-1]+1 -> 507024 | G2160: =RC[-1]+1 -> 507025 | K2160: 3
A2161: 507030 | B2161: =RC[-1]+5 -> 507035 | C2161: =RC[-2]+1 -> 507031 | D2161: =RC[-1]+1 -> 507032 | E2161: =RC[-1]+1 -> 507033 | F2161: =RC[-1]+1 -> 507034 | G2161: =RC[-1]+1 -> 507035 | K2161: 3
A2162: 507040 | B2162: =RC[-1]+5 -> 507045 | C2162: =RC[-2]+1 -> 507041 | D2162: =RC[-1]+1 -> 507042 | E2162: =RC[-1]+1 -> 507043 | F2162: =RC[-1]+1 -> 507044 | G2162: =RC[-1]+1 -> 507045 | K2162: 3
A2163: 508010 | B2163: =RC[-1]+5 -> 508015 | C2163: =RC[-2]+1 -> 508011 | D2163: =RC[-1]+1 -> 508012 | E2163: =RC[-1]+1 -> 508013 | F2163: =RC[-1]+1 -> 508014 | G2163: =RC[-1]+1 -> 508015 | K2163: 3
A2164: 508020 | B2164: =RC[-1]+5 -> 508025 | C2164: =RC[-2]+1 -> 508021 | D2164: =RC[-1]+1 -> 508022 | E2164: =RC[-1]+1 -> 508023 | F2164: =RC[-1]+1 -> 508024 | G2164: =RC[-1]+1 -> 508025 | K2164: 3
A2165: 508030 | B2165: =RC[-1]+5 -> 508035 | C2165: =RC[-2]+1 -> 508031 | D2165: =RC[-1]+1 -> 508032 | E2165: =RC[-1]+1 -> 508033 | F2165: =RC[-1]+1 -> 508034 | G2165: =RC[-1]+1 -> 508035 | K2165: 3
A2166: 508040 | B2166: =RC[-1]+5 -> 508045 | C2166: =RC[-2]+1 -> 508041 | D2166: =RC[-1]+1 -> 508042 | E2166: =RC[-1]+1 -> 508043 | F2166: =RC[-1]+1 -> 508044 | G2166: =RC[-1]+1 -> 508045 | K2166: 3
A2167: 509010 | B2167: =RC[-1]+5 -> 509015 | C2167: =RC[-2]+1 -> 509011 | D2167: =RC[-1]+1 -> 509012 | E2167: =RC[-1]+1 -> 509013 | F2167: =RC[-1]+1 -> 509014 | G2167: =RC[-1]+1 -> 509015 | K2167: 3
A2168: 509020 | B2168: =RC[-1]+5 -> 509025 | C2168: =RC[-2]+1 -> 509021 | D2168: =RC[-1]+1 -> 509022 | E2168: =RC[-1]+1 -> 509023 | F2168: =RC[-1]+1 -> 509024 | G2168: =RC[-1]+1 -> 509025 | K2168: 3
A2169: 509030 | B2169: =RC[-1]+5 -> 509035 | C2169: =RC[-2]+1 -> 509031 | D2169: =RC[-1]+1 -> 509032 | E2169: =RC[-1]+1 -> 509033 | F2169: =RC[-1]+1 -> 509034 | G2169: =RC[-1]+1 -> 509035 | K2169: 3
A2170: 509040 | B2170: =RC[-1]+5 -> 509045 | C2170: =RC[-2]+1 -> 509041 | D2170: =RC[-1]+1 -> 509042 | E2170: =RC[-1]+1 -> 509043 | F2170: =RC[-1]+1 -> 509044 | G2170: =RC[-1]+1 -> 509045 | K2170: 3
A2171: 510010 | B2171: =RC[-1]+5 -> 510015 | C2171: =RC[-2]+1 -> 510011 | D2171: =RC[-1]+1 -> 510012 | E2171: =RC[-1]+1 -> 510013 | F2171: =RC[-1]+1 -> 510014 | G2171: =RC[-1]+1 -> 510015 | K2171: 3
A2172: 510020 | B2172: =RC[-1]+5 -> 510025 | C2172: =RC[-2]+1 -> 510021 | D2172: =RC[-1]+1 -> 510022 | E2172: =RC[-1]+1 -> 510023 | F2172: =RC[-1]+1 -> 510024 | G2172: =RC[-1]+1 -> 510025 | K2172: 3
A2173: 510030 | B2173: =RC[-1]+5 -> 510035 | C2173: =RC[-2]+1 -> 510031 | D2173: =RC[-1]+1 -> 510032 | E2173: =RC[-1]+1 -> 510033 | F2173: =RC[-1]+1 -> 510034 | G2173: =RC[-1]+1 -> 510035 | K2173: 3
A2174: 510040 | B2174: =RC[-1]+5 -> 510045 | C2174: =RC[-2]+1 -> 510041 | D2174: =RC[-1]+1 -> 510042 | E2174: =RC[-1]+1 -> 510043 | F2174: =RC[-1]+1 -> 510044 | G2174: =RC[-1]+1 -> 510045 | K2174: 3
A2175: 511010 | B2175: =RC[-1]+5 -> 511015 | C2175: =RC[-2]+1 -> 511011 | D2175: =RC[-1]+1 -> 511012 | E2175: =RC[-1]+1 -> 511013 | F2175: =RC[-1]+1 -> 511014 | G2175: =RC[-1]+1 -> 511015 | K2175: 3
A2176: 511020 | B2176: =RC[-1]+5 -> 511025 | C2176: =RC[-2]+1 -> 511021 | D2176: =RC[-1]+1 -> 511022 | E2176: =RC[-1]+1 -> 511023 | F2176: =RC[-1]+1 -> 511024 | G2176: =RC[-1]+1 -> 511025 | K2176: 3
A2177: 511030 | B2177: =RC[-1]+5 -> 511035 | C2177: =RC[-2]+1 -> 511031 | D2177: =RC[-1]+1 -> 511032 | E2177: =RC[-1]+1 -> 511033 | F2177: =RC[-1]+1 -> 511034 | G2177: =RC[-1]+1 -> 511035 | K2177: 3
A2178: 511040 | B2178: =RC[-1]+5 -> 511045 | C2178: =RC[-2]+1 -> 511041 | D2178: =RC[-1]+1 -> 511042 | E2178: =RC[-1]+1 -> 511043 | F2178: =RC[-1]+1 -> 511044 | G2178: =RC[-1]+1 -> 511045 | K2178: 3
A2179: 512010 | B2179: =RC[-1]+5 -> 512015 | C2179: =RC[-2]+1 -> 512011 | D2179: =RC[-1]+1 -> 512012 | E2179: =RC[-1]+1 -> 512013 | F2179: =RC[-1]+1 -> 512014 | G2179: =RC[-1]+1 -> 512015 | K2179: 3
A2180: 512020 | B2180: =RC[-1]+5 -> 512025 | C2180: =RC[-2]+1 -> 512021 | D2180: =RC[-1]+1 -> 512022 | E2180: =RC[-1]+1 -> 512023 | F2180: =RC[-1]+1 -> 512024 | G2180: =RC[-1]+1 -> 512025 | K2180: 3
A2181: 512030 | B2181: =RC[-1]+5 -> 512035 | C2181: =RC[-2]+1 -> 512031 | D2181: =RC[-1]+1 -> 512032 | E2181: =RC[-1]+1 -> 512033 | F2181: =RC[-1]+1 -> 512034 | G2181: =RC[-1]+1 -> 512035 | K2181: 3
A2182: 512040 | B2182: =RC[-1]+5 -> 512045 | C2182: =RC[-2]+1 -> 512041 | D2182: =RC[-1]+1 -> 512042 | E2182: =RC[-1]+1 -> 512043 | F2182: =RC[-1]+1 -> 512044 | G2182: =RC[-1]+1 -> 512045 | K2182: 3
A2183: 513010 | B2183: =RC[-1]+5 -> 513015 | C2183: =RC[-2]+1 -> 513011 | D2183: =RC[-1]+1 -> 513012 | E2183: =RC[-1]+1 -> 513013 | F2183: =RC[-1]+1 -> 513014 | G2183: =RC[-1]+1 -> 513015 | K2183: 3
A2184: 513020 | B2184: =RC[-1]+5 -> 513025 | C2184: =RC[-2]+1 -> 513021 | D2184: =RC[-1]+1 -> 513022 | E2184: =RC[-1]+1 -> 513023 | F2184: =RC[-1]+1 -> 513024 | G2184: =RC[-1]+1 -> 513025 | K2184: 3
A2185: 513030 | B2185: =RC[-1]+5 -> 513035 | C2185: =RC[-2]+1 -> 513031 | D2185: =RC[-1]+1 -> 513032 | E2185: =RC[-1]+1 -> 513033 | F2185: =RC[-1]+1 -> 513034 | G2185: =RC[-1]+1 -> 513035 | K2185: 3
A2186: 513040 | B2186: =RC[-1]+5 -> 513045 | C2186: =RC[-2]+1 -> 513041 | D2186: =RC[-1]+1 -> 513042 | E2186: =RC[-1]+1 -> 513043 | F2186: =RC[-1]+1 -> 513044 | G2186: =RC[-1]+1 -> 513045 | K2186: 3
A2187: 514010 | B2187: =RC[-1]+5 -> 514015 | C2187: =RC[-2]+1 -> 514011 | D2187: =RC[-1]+1 -> 514012 | E2187: =RC[-1]+1 -> 514013 | F2187: =RC[-1]+1 -> 514014 | G2187: =RC[-1]+1 -> 514015 | K2187: 3
A2188: 514020 | B2188: =RC[-1]+5 -> 514025 | C2188: =RC[-2]+1 -> 514021 | D2188: =RC[-1]+1 -> 514022 | E2188: =RC[-1]+1 -> 514023 | F2188: =RC[-1]+1 -> 514024 | G2188: =RC[-1]+1 -> 514025 | K2188: 3
A2189: 514030 | B2189: =RC[-1]+5 -> 514035 | C2189: =RC[-2]+1 -> 514031 | D2189: =RC[-1]+1 -> 514032 | E2189: =RC[-1]+1 -> 514033 | F2189: =RC[-1]+1 -> 514034 | G2189: =RC[-1]+1 -> 514035 | K2189: 3
A2190: 514040 | B2190: =RC[-1]+5 -> 514045 | C2190: =RC[-2]+1 -> 514041 | D2190: =RC[-1]+1 -> 514042 | E2190: =RC[-1]+1 -> 514043 | F2190: =RC[-1]+1 -> 514044 | G2190: =RC[-1]+1 -> 514045 | K2190: 3
A2191: 515010 | B2191: =RC[-1]+5 -> 515015 | C2191: =RC[-2]+1 -> 515011 | D2191: =RC[-1]+1 -> 515012 | E2191: =RC[-1]+1 -> 515013 | F2191: =RC[-1]+1 -> 515014 | G2191: =RC[-1]+1 -> 515015 | K2191: 3
A2192: 515020 | B2192: =RC[-1]+5 -> 515025 | C2192: =RC[-2]+1 -> 515021 | D2192: =RC[-1]+1 -> 515022 | E2192: =RC[-1]+1 -> 515023 | F2192: =RC[-1]+1 -> 515024 | G2192: =RC[-1]+1 -> 515025 | K2192: 3
A2193: 515030 | B2193: =RC[-1]+5 -> 515035 | C2193: =RC[-2]+1 -> 515031 | D2193: =RC[-1]+1 -> 515032 | E2193: =RC[-1]+1 -> 515033 | F2193: =RC[-1]+1 -> 515034 | G2193: =RC[-1]+1 -> 515035 | K2193: 3
A2194: 515040 | B2194: =RC[-1]+5 -> 515045 | C2194: =RC[-2]+1 -> 515041 | D2194: =RC[-1]+1 -> 515042 | E2194: =RC[-1]+1 -> 515043 | F2194: =RC[-1]+1 -> 515044 | G2194: =RC[-1]+1 -> 515045 | K2194: 3
A2195: 516010 | B2195: =RC[-1]+5 -> 516015 | C2195: =RC[-2]+1 -> 516011 | D2195: =RC[-1]+1 -> 516012 | E2195: =RC[-1]+1 -> 516013 | F2195: =RC[-1]+1 -> 516014 | G2195: =RC[-1]+1 -> 516015 | K2195: 3
A2196: 516020 | B2196: =RC[-1]+5 -> 516025 | C2196: =RC[-2]+1 -> 516021 | D2196: =RC[-1]+1 -> 516022 | E2196: =RC[-1]+1 -> 516023 | F2196: =RC[-1]+1 -> 516024 | G2196: =RC[-1]+1 -> 516025 | K2196: 3
A2197: 516030 | B2197: =RC[-1]+5 -> 516035 | C2197: =RC[-2]+1 -> 516031 | D2197: =RC[-1]+1 -> 516032 | E2197: =RC[-1]+1 -> 516033 | F2197: =RC[-1]+1 -> 516034 | G2197: =RC[-1]+1 -> 516035 | K2197: 3
A2198: 516040 | B2198: =RC[-1]+5 -> 516045 | C2198: =RC[-2]+1 -> 516041 | D2198: =RC[-1]+1 -> 516042 | E2198: =RC[-1]+1 -> 516043 | F2198: =RC[-1]+1 -> 516044 | G2198: =RC[-1]+1 -> 516045 | K2198: 3
A2199: 517010 | B2199: =RC[-1]+5 -> 517015 | C2199: =RC[-2]+1 -> 517011 | D2199: =RC[-1]+1 -> 517012 | E2199: =RC[-1]+1 -> 517013 | F2199: =RC[-1]+1 -> 517014 | G2199: =RC[-1]+1 -> 517015 | K2199: 3
A2200: 517020 | B2200: =RC[-1]+5 -> 517025 | C2200: =RC[-2]+1 -> 517021 | D2200: =RC[-1]+1 -> 517022 | E2200: =RC[-1]+1 -> 517023 | F2200: =RC[-1]+1 -> 517024 | G2200: =RC[-1]+1 -> 517025 | K2200: 3
A2201: 517030 | B2201: =RC[-1]+5 -> 517035 | C2201: =RC[-2]+1 -> 517031 | D2201: =RC[-1]+1 -> 517032 | E2201: =RC[-1]+1 -> 517033 | F2201: =RC[-1]+1 -> 517034 | G2201: =RC[-1]+1 -> 517035 | K2201: 3
A2202: 517040 | B2202: =RC[-1]+5 -> 517045 | C2202: =RC[-2]+1 -> 517041 | D2202: =RC[-1]+1 -> 517042 | E2202: =RC[-1]+1 -> 517043 | F2202: =RC[-1]+1 -> 517044 | G2202: =RC[-1]+1 -> 517045 | K2202: 3
A2203: 518010 | B2203: =RC[-1]+5 -> 518015 | C2203: =RC[-2]+1 -> 518011 | D2203: =RC[-1]+1 -> 518012 | E2203: =RC[-1]+1 -> 518013 | F2203: =RC[-1]+1 -> 518014 | G2203: =RC[-1]+1 -> 518015 | K2203: 3
A2204: 518020 | B2204: =RC[-1]+5 -> 518025 | C2204: =RC[-2]+1 -> 518021 | D2204: =RC[-1]+1 -> 518022 | E2204: =RC[-1]+1 -> 518023 | F2204: =RC[-1]+1 -> 518024 | G2204: =RC[-1]+1 -> 518025 | K2204: 3
A2205: 518030 | B2205: =RC[-1]+5 -> 518035 | C2205: =RC[-2]+1 -> 518031 | D2205: =RC[-1]+1 -> 518032 | E2205: =RC[-1]+1 -> 518033 | F2205: =RC[-1]+1 -> 518034 | G2205: =RC[-1]+1 -> 518035 | K2205: 3
A2206: 518040 | B2206: =RC[-1]+5 -> 518045 | C2206: =RC[-2]+1 -> 518041 | D2206: =RC[-1]+1 -> 518042 | E2206: =RC[-1]+1 -> 518043 | F2206: =RC[-1]+1 -> 518044 | G2206: =RC[-1]+1 -> 518045 | K2206: 3
A2207: 519010 | B2207: =RC[-1]+5 -> 519015 | C2207: =RC[-2]+1 -> 519011 | D2207: =RC[-1]+1 -> 519012 | E2207: =RC[-1]+1 -> 519013 | F2207: =RC[-1]+1 -> 519014 | G2207: =RC[-1]+1 -> 519015 | K2207: 3
A2208: 519020 | B2208: =RC[-1]+5 -> 519025 | C2208: =RC[-2]+1 -> 519021 | D2208: =RC[-1]+1 -> 519022 | E2208: =RC[-1]+1 -> 519023 | F2208: =RC[-1]+1 -> 519024 | G2208: =RC[-1]+1 -> 519025 | K2208: 3
A2209: 519030 | B2209: =RC[-1]+5 -> 519035 | C2209: =RC[-2]+1 -> 519031 | D2209: =RC[-1]+1 -> 519032 | E2209: =RC[-1]+1 -> 519033 | F2209: =RC[-1]+1 -> 519034 | G2209: =RC[-1]+1 -> 519035 | K2209: 3
A2210: 519040 | B2210: =RC[-1]+5 -> 519045 | C2210: =RC[-2]+1 -> 519041 | D2210: =RC[-1]+1 -> 519042 | E2210: =RC[-1]+1 -> 519043 | F2210: =RC[-1]+1 -> 519044 | G2210: =RC[-1]+1 -> 519045 | K2210: 3
A2211: 520010 | B2211: =RC[-1]+5 -> 520015 | C2211: =RC[-2]+1 -> 520011 | D2211: =RC[-1]+1 -> 520012 | E2211: =RC[-1]+1 -> 520013 | F2211: =RC[-1]+1 -> 520014 | G2211: =RC[-1]+1 -> 520015 | K2211: 3
A2212: 520020 | B2212: =RC[-1]+5 -> 520025 | C2212: =RC[-2]+1 -> 520021 | D2212: =RC[-1]+1 -> 520022 | E2212: =RC[-1]+1 -> 520023 | F2212: =RC[-1]+1 -> 520024 | G2212: =RC[-1]+1 -> 520025 | K2212: 3
A2213: 520030 | B2213: =RC[-1]+5 -> 520035 | C2213: =RC[-2]+1 -> 520031 | D2213: =RC[-1]+1 -> 520032 | E2213: =RC[-1]+1 -> 520033 | F2213: =RC[-1]+1 -> 520034 | G2213: =RC[-1]+1 -> 520035 | K2213: 3
A2214: 520040 | B2214: =RC[-1]+5 -> 520045 | C2214: =RC[-2]+1 -> 520041 | D2214: =RC[-1]+1 -> 520042 | E2214: =RC[-1]+1 -> 520043 | F2214: =RC[-1]+1 -> 520044 | G2214: =RC[-1]+1 -> 520045 | K2214: 3
A2215: 521010 | B2215: =RC[-1]+5 -> 521015 | C2215: =RC[-2]+1 -> 521011 | D2215: =RC[-1]+1 -> 521012 | E2215: =RC[-1]+1 -> 521013 | F2215: =RC[-1]+1 -> 521014 | G2215: =RC[-1]+1 -> 521015 | K2215: 3
A2216: 521020 | B2216: =RC[-1]+5 -> 521025 | C2216: =RC[-2]+1 -> 521021 | D2216: =RC[-1]+1 -> 521022 | E2216: =RC[-1]+1 -> 521023 | F2216: =RC[-1]+1 -> 521024 | G2216: =RC[-1]+1 -> 521025 | K2216: 3
A2217: 521030 | B2217: =RC[-1]+5 -> 521035 | C2217: =RC[-2]+1 -> 521031 | D2217: =RC[-1]+1 -> 521032 | E2217: =RC[-1]+1 -> 521033 | F2217: =RC[-1]+1 -> 521034 | G2217: =RC[-1]+1 -> 521035 | K2217: 3
A2218: 521040 | B2218: =RC[-1]+5 -> 521045 | C2218: =RC[-2]+1 -> 521041 | D2218: =RC[-1]+1 -> 521042 | E2218: =RC[-1]+1 -> 521043 | F2218: =RC[-1]+1 -> 521044 | G2218: =RC[-1]+1 -> 521045 | K2218: 3
A2219: 522010 | B2219: =RC[-1]+5 -> 522015 | C2219: =RC[-2]+1 -> 522011 | D2219: =RC[-1]+1 -> 522012 | E2219: =RC[-1]+1 -> 522013 | F2219: =RC[-1]+1 -> 522014 | G2219: =RC[-1]+1 -> 522015 | K2219: 3
A2220: 522020 | B2220: =RC[-1]+5 -> 522025 | C2220: =RC[-2]+1 -> 522021 | D2220: =RC[-1]+1 -> 522022 | E2220: =RC[-1]+1 -> 522023 | F2220: =RC[-1]+1 -> 522024 | G2220: =RC[-1]+1 -> 522025 | K2220: 3
A2221: 522030 | B2221: =RC[-1]+5 -> 522035 | C2221: =RC[-2]+1 -> 522031 | D2221: =RC[-1]+1 -> 522032 | E2221: =RC[-1]+1 -> 522033 | F2221: =RC[-1]+1 -> 522034 | G2221: =RC[-1]+1 -> 522035 | K2221: 3
A2222: 522040 | B2222: =RC[-1]+5 -> 522045 | C2222: =RC[-2]+1 -> 522041 | D2222: =RC[-1]+1 -> 522042 | E2222: =RC[-1]+1 -> 522043 | F2222: =RC[-1]+1 -> 522044 | G2222: =RC[-1]+1 -> 522045 | K2222: 3
A2223: 523010 | B2223: =RC[-1]+5 -> 523015 | C2223: =RC[-2]+1 -> 523011 | D2223: =RC[-1]+1 -> 523012 | E2223: =RC[-1]+1 -> 523013 | F2223: =RC[-1]+1 -> 523014 | G2223: =RC[-1]+1 -> 523015 | K2223: 3
A2224: 523020 | B2224: =RC[-1]+5 -> 523025 | C2224: =RC[-2]+1 -> 523021 | D2224: =RC[-1]+1 -> 523022 | E2224: =RC[-1]+1 -> 523023 | F2224: =RC[-1]+1 -> 523024 | G2224: =RC[-1]+1 -> 523025 | K2224: 3
A2225: 523030 | B2225: =RC[-1]+5 -> 523035 | C2225: =RC[-2]+1 -> 523031 | D2225: =RC[-1]+1 -> 523032 | E2225: =RC[-1]+1 -> 523033 | F2225: =RC[-1]+1 -> 523034 | G2225: =RC[-1]+1 -> 523035 | K2225: 3
A2226: 523040 | B2226: =RC[-1]+5 -> 523045 | C2226: =RC[-2]+1 -> 523041 | D2226: =RC[-1]+1 -> 523042 | E2226: =RC[-1]+1 -> 523043 | F2226: =RC[-1]+1 -> 523044 | G2226: =RC[-1]+1 -> 523045 | K2226: 3
A2227: 524010 | B2227: =RC[-1]+5 -> 524015 | C2227: =RC[-2]+1 -> 524011 | D2227: =RC[-1]+1 -> 524012 | E2227: =RC[-1]+1 -> 524013 | F2227: =RC[-1]+1 -> 524014 | G2227: =RC[-1]+1 -> 524015 | K2227: 3
A2228: 524020 | B2228: =RC[-1]+5 -> 524025 | C2228: =RC[-2]+1 -> 524021 | D2228: =RC[-1]+1 -> 524022 | E2228: =RC[-1]+1 -> 524023 | F2228: =RC[-1]+1 -> 524024 | G2228: =RC[-1]+1 -> 524025 | K2228: 3
A2229: 524030 | B2229: =RC[-1]+5 -> 524035 | C2229: =RC[-2]+1 -> 524031 | D2229: =RC[-1]+1 -> 524032 | E2229: =RC[-1]+1 -> 524033 | F2229: =RC[-1]+1 -> 524034 | G2229: =RC[-1]+1 -> 524035 | K2229: 3
A2230: 524040 | B2230: =RC[-1]+5 -> 524045 | C2230: =RC[-2]+1 -> 524041 | D2230: =RC[-1]+1 -> 524042 | E2230: =RC[-1]+1 -> 524043 | F2230: =RC[-1]+1 -> 524044 | G2230: =RC[-1]+1 -> 524045 | K2230: 3
A2231: 525010 | B2231: =RC[-1]+5 -> 525015 | C2231: =RC[-2]+1 -> 525011 | D2231: =RC[-1]+1 -> 525012 | E2231: =RC[-1]+1 -> 525013 | F2231: =RC[-1]+1 -> 525014 | G2231: =RC[-1]+1 -> 525015 | K2231: 3
A2232: 525020 | B2232: =RC[-1]+5 -> 525025 | C2232: =RC[-2]+1 -> 525021 | D2232: =RC[-1]+1 -> 525022 | E2232: =RC[-1]+1 -> 525023 | F2232: =RC[-1]+1 -> 525024 | G2232: =RC[-1]+1 -> 525025 | K2232: 3
A2233: 525030 | B2233: =RC[-1]+5 -> 525035 | C2233: =RC[-2]+1 -> 525031 | D2233: =RC[-1]+1 -> 525032 | E2233: =RC[-1]+1 -> 525033 | F2233: =RC[-1]+1 -> 525034 | G2233: =RC[-1]+1 -> 525035 | K2233: 3
A2234: 525040 | B2234: =RC[-1]+5 -> 525045 | C2234: =RC[-2]+1 -> 525041 | D2234: =RC[-1]+1 -> 525042 | E2234: =RC[-1]+1 -> 525043 | F2234: =RC[-1]+1 -> 525044 | G2234: =RC[-1]+1 -> 525045 | K2234: 3
A2235: 526010 | B2235: =RC[-1]+5 -> 526015 | C2235: =RC[-2]+1 -> 526011 | D2235: =RC[-1]+1 -> 526012 | E2235: =RC[-1]+1 -> 526013 | F2235: =RC[-1]+1 -> 526014 | G2235: =RC[-1]+1 -> 526015 | K2235: 3
A2236: 526020 | B2236: =RC[-1]+5 -> 526025 | C2236: =RC[-2]+1 -> 526021 | D2236: =RC[-1]+1 -> 526022 | E2236: =RC[-1]+1 -> 526023 | F2236: =RC[-1]+1 -> 526024 | G2236: =RC[-1]+1 -> 526025 | K2236: 3
A2237: 526030 | B2237: =RC[-1]+5 -> 526035 | C2237: =RC[-2]+1 -> 526031 | D2237: =RC[-1]+1 -> 526032 | E2237: =RC[-1]+1 -> 526033 | F2237: =RC[-1]+1 -> 526034 | G2237: =RC[-1]+1 -> 526035 | K2237: 3
A2238: 526040 | B2238: =RC[-1]+5 -> 526045 | C2238: =RC[-2]+1 -> 526041 | D2238: =RC[-1]+1 -> 526042 | E2238: =RC[-1]+1 -> 526043 | F2238: =RC[-1]+1 -> 526044 | G2238: =RC[-1]+1 -> 526045 | K2238: 3
A2239: 527010 | B2239: =RC[-1]+5 -> 527015 | C2239: =RC[-2]+1 -> 527011 | D2239: =RC[-1]+1 -> 527012 | E2239: =RC[-1]+1 -> 527013 | F2239: =RC[-1]+1 -> 527014 | G2239: =RC[-1]+1 -> 527015 | K2239: 3
A2240: 527020 | B2240: =RC[-1]+5 -> 527025 | C2240: =RC[-2]+1 -> 527021 | D2240: =RC[-1]+1 -> 527022 | E2240: =RC[-1]+1 -> 527023 | F2240: =RC[-1]+1 -> 527024 | G2240: =RC[-1]+1 -> 527025 | K2240: 3
A2241: 527030 | B2241: =RC[-1]+5 -> 527035 | C2241: =RC[-2]+1 -> 527031 | D2241: =RC[-1]+1 -> 527032 | E2241: =RC[-1]+1 -> 527033 | F2241: =RC[-1]+1 -> 527034 | G2241: =RC[-1]+1 -> 527035 | K2241: 3
A2242: 527040 | B2242: =RC[-1]+5 -> 527045 | C2242: =RC[-2]+1 -> 527041 | D2242: =RC[-1]+1 -> 527042 | E2242: =RC[-1]+1 -> 527043 | F2242: =RC[-1]+1 -> 527044 | G2242: =RC[-1]+1 -> 527045 | K2242: 3
A2243: 528010 | B2243: =RC[-1]+5 -> 528015 | C2243: =RC[-2]+1 -> 528011 | D2243: =RC[-1]+1 -> 528012 | E2243: =RC[-1]+1 -> 528013 | F2243: =RC[-1]+1 -> 528014 | G2243: =RC[-1]+1 -> 528015 | K2243: 3
A2244: 528020 | B2244: =RC[-1]+5 -> 528025 | C2244: =RC[-2]+1 -> 528021 | D2244: =RC[-1]+1 -> 528022 | E2244: =RC[-1]+1 -> 528023 | F2244: =RC[-1]+1 -> 528024 | G2244: =RC[-1]+1 -> 528025 | K2244: 3
A2245: 528030 | B2245: =RC[-1]+5 -> 528035 | C2245: =RC[-2]+1 -> 528031 | D2245: =RC[-1]+1 -> 528032 | E2245: =RC[-1]+1 -> 528033 | F2245: =RC[-1]+1 -> 528034 | G2245: =RC[-1]+1 -> 528035 | K2245: 3
A2246: 528040 | B2246: =RC[-1]+5 -> 528045 | C2246: =RC[-2]+1 -> 528041 | D2246: =RC[-1]+1 -> 528042 | E2246: =RC[-1]+1 -> 528043 | F2246: =RC[-1]+1 -> 528044 | G2246: =RC[-1]+1 -> 528045 | K2246: 3
A2247: 529010 | B2247: =RC[-1]+5 -> 529015 | C2247: =RC[-2]+1 -> 529011 | D2247: =RC[-1]+1 -> 529012 | E2247: =RC[-1]+1 -> 529013 | F2247: =RC[-1]+1 -> 529014 | G2247: =RC[-1]+1 -> 529015 | K2247: 3
A2248: 529020 | B2248: =RC[-1]+5 -> 529025 | C2248: =RC[-2]+1 -> 529021 | D2248: =RC[-1]+1 -> 529022 | E2248: =RC[-1]+1 -> 529023 | F2248: =RC[-1]+1 -> 529024 | G2248: =RC[-1]+1 -> 529025 | K2248: 3
A2249: 529030 | B2249: =RC[-1]+5 -> 529035 | C2249: =RC[-2]+1 -> 529031 | D2249: =RC[-1]+1 -> 529032 | E2249: =RC[-1]+1 -> 529033 | F2249: =RC[-1]+1 -> 529034 | G2249: =RC[-1]+1 -> 529035 | K2249: 3
A2250: 529040 | B2250: =RC[-1]+5 -> 529045 | C2250: =RC[-2]+1 -> 529041 | D2250: =RC[-1]+1 -> 529042 | E2250: =RC[-1]+1 -> 529043 | F2250: =RC[-1]+1 -> 529044 | G2250: =RC[-1]+1 -> 529045 | K2250: 3
A2251: 530010 | B2251: =RC[-1]+5 -> 530015 | C2251: =RC[-2]+1 -> 530011 | D2251: =RC[-1]+1 -> 530012 | E2251: =RC[-1]+1 -> 530013 | F2251: =RC[-1]+1 -> 530014 | G2251: =RC[-1]+1 -> 530015 | K2251: 3
A2252: 530020 | B2252: =RC[-1]+5 -> 530025 | C2252: =RC[-2]+1 -> 530021 | D2252: =RC[-1]+1 -> 530022 | E2252: =RC[-1]+1 -> 530023 | F2252: =RC[-1]+1 -> 530024 | G2252: =RC[-1]+1 -> 530025 | K2252: 3
A2253: 530030 | B2253: =RC[-1]+5 -> 530035 | C2253: =RC[-2]+1 -> 530031 | D2253: =RC[-1]+1 -> 530032 | E2253: =RC[-1]+1 -> 530033 | F2253: =RC[-1]+1 -> 530034 | G2253: =RC[-1]+1 -> 530035 | K2253: 3
A2254: 530040 | B2254: =RC[-1]+5 -> 530045 | C2254: =RC[-2]+1 -> 530041 | D2254: =RC[-1]+1 -> 530042 | E2254: =RC[-1]+1 -> 530043 | F2254: =RC[-1]+1 -> 530044 | G2254: =RC[-1]+1 -> 530045 | K2254: 3
A2255: 531010 | B2255: =RC[-1]+5 -> 531015 | C2255: =RC[-2]+1 -> 531011 | D2255: =RC[-1]+1 -> 531012 | E2255: =RC[-1]+1 -> 531013 | F2255: =RC[-1]+1 -> 531014 | G2255: =RC[-1]+1 -> 531015 | K2255: 3
A2256: 531020 | B2256: =RC[-1]+5 -> 531025 | C2256: =RC[-2]+1 -> 531021 | D2256: =RC[-1]+1 -> 531022 | E2256: =RC[-1]+1 -> 531023 | F2256: =RC[-1]+1 -> 531024 | G2256: =RC[-1]+1 -> 531025 | K2256: 3
A2257: 531030 | B2257: =RC[-1]+5 -> 531035 | C2257: =RC[-2]+1 -> 531031 | D2257: =RC[-1]+1 -> 531032 | E2257: =RC[-1]+1 -> 531033 | F2257: =RC[-1]+1 -> 531034 | G2257: =RC[-1]+1 -> 531035 | K2257: 3
A2258: 531040 | B2258: =RC[-1]+5 -> 531045 | C2258: =RC[-2]+1 -> 531041 | D2258: =RC[-1]+1 -> 531042 | E2258: =RC[-1]+1 -> 531043 | F2258: =RC[-1]+1 -> 531044 | G2258: =RC[-1]+1 -> 531045 | K2258: 3
A2259: 532010 | B2259: =RC[-1]+5 -> 532015 | C2259: =RC[-2]+1 -> 532011 | D2259: =RC[-1]+1 -> 532012 | E2259: =RC[-1]+1 -> 532013 | F2259: =RC[-1]+1 -> 532014 | G2259: =RC[-1]+1 -> 532015 | K2259: 3
A2260: 532020 | B2260: =RC[-1]+5 -> 532025 | C2260: =RC[-2]+1 -> 532021 | D2260: =RC[-1]+1 -> 532022 | E2260: =RC[-1]+1 -> 532023 | F2260: =RC[-1]+1 -> 532024 | G2260: =RC[-1]+1 -> 532025 | K2260: 3
A2261: 532030 | B2261: =RC[-1]+5 -> 532035 | C2261: =RC[-2]+1 -> 532031 | D2261: =RC[-1]+1 -> 532032 | E2261: =RC[-1]+1 -> 532033 | F2261: =RC[-1]+1 -> 532034 | G2261: =RC[-1]+1 -> 532035 | K2261: 3
A2262: 532040 | B2262: =RC[-1]+5 -> 532045 | C2262: =RC[-2]+1 -> 532041 | D2262: =RC[-1]+1 -> 532042 | E2262: =RC[-1]+1 -> 532043 | F2262: =RC[-1]+1 -> 532044 | G2262: =RC[-1]+1 -> 532045 | K2262: 3
A2263: 533010 | B2263: =RC[-1]+5 -> 533015 | C2263: =RC[-2]+1 -> 533011 | D2263: =RC[-1]+1 -> 533012 | E2263: =RC[-1]+1 -> 533013 | F2263: =RC[-1]+1 -> 533014 | G2263: =RC[-1]+1 -> 533015 | K2263: 3
A2264: 533020 | B2264: =RC[-1]+5 -> 533025 | C2264: =RC[-2]+1 -> 533021 | D2264: =RC[-1]+1 -> 533022 | E2264: =RC[-1]+1 -> 533023 | F2264: =RC[-1]+1 -> 533024 | G2264: =RC[-1]+1 -> 533025 | K2264: 3
A2265: 533030 | B2265: =RC[-1]+5 -> 533035 | C2265: =RC[-2]+1 -> 533031 | D2265: =RC[-1]+1 -> 533032 | E2265: =RC[-1]+1 -> 533033 | F2265: =RC[-1]+1 -> 533034 | G2265: =RC[-1]+1 -> 533035 | K2265: 3
A2266: 533040 | B2266: =RC[-1]+5 -> 533045 | C2266: =RC[-2]+1 -> 533041 | D2266: =RC[-1]+1 -> 533042 | E2266: =RC[-1]+1 -> 533043 | F2266: =RC[-1]+1 -> 533044 | G2266: =RC[-1]+1 -> 533045 | K2266: 3
A2267: 534010 | B2267: =RC[-1]+5 -> 534015 | C2267: =RC[-2]+1 -> 534011 | D2267: =RC[-1]+1 -> 534012 | E2267: =RC[-1]+1 -> 534013 | F2267: =RC[-1]+1 -> 534014 | G2267: =RC[-1]+1 -> 534015 | K2267: 3
A2268: 534020 | B2268: =RC[-1]+5 -> 534025 | C2268: =RC[-2]+1 -> 534021 | D2268: =RC[-1]+1 -> 534022 | E2268: =RC[-1]+1 -> 534023 | F2268: =RC[-1]+1 -> 534024 | G2268: =RC[-1]+1 -> 534025 | K2268: 3
A2269: 534030 | B2269: =RC[-1]+5 -> 534035 | C2269: =RC[-2]+1 -> 534031 | D2269: =RC[-1]+1 -> 534032 | E2269: =RC[-1]+1 -> 534033 | F2269: =RC[-1]+1 -> 534034 | G2269: =RC[-1]+1 -> 534035 | K2269: 3
A2270: 534040 | B2270: =RC[-1]+5 -> 534045 | C2270: =RC[-2]+1 -> 534041 | D2270: =RC[-1]+1 -> 534042 | E2270: =RC[-1]+1 -> 534043 | F2270: =RC[-1]+1 -> 534044 | G2270: =RC[-1]+1 -> 534045 | K2270: 3
A2271: 535010 | B2271: =RC[-1]+5 -> 535015 | C2271: =RC[-2]+1 -> 535011 | D2271: =RC[-1]+1 -> 535012 | E2271: =RC[-1]+1 -> 535013 | F2271: =RC[-1]+1 -> 535014 | G2271: =RC[-1]+1 -> 535015 | K2271: 3
A2272: 535020 | B2272: =RC[-1]+5 -> 535025 | C2272: =RC[-2]+1 -> 535021 | D2272: =RC[-1]+1 -> 535022 | E2272: =RC[-1]+1 -> 535023 | F2272: =RC[-1]+1 -> 535024 | G2272: =RC[-1]+1 -> 535025 | K2272: 3
A2273: 535030 | B2273: =RC[-1]+5 -> 535035 | C2273: =RC[-2]+1 -> 535031 | D2273: =RC[-1]+1 -> 535032 | E2273: =RC[-1]+1 -> 535033 | F2273: =RC[-1]+1 -> 535034 | G2273: =RC[-1]+1 -> 535035 | K2273: 3
A2274: 535040 | B2274: =RC[-1]+5 -> 535045 | C2274: =RC[-2]+1 -> 535041 | D2274: =RC[-1]+1 -> 535042 | E2274: =RC[-1]+1 -> 535043 | F2274: =RC[-1]+1 -> 535044 | G2274: =RC[-1]+1 -> 535045 | K2274: 3
A2275: 536010 | B2275: =RC[-1]+5 -> 536015 | C2275: =RC[-2]+1 -> 536011 | D2275: =RC[-1]+1 -> 536012 | E2275: =RC[-1]+1 -> 536013 | F2275: =RC[-1]+1 -> 536014 | G2275: =RC[-1]+1 -> 536015 | K2275: 3
A2276: 536020 | B2276: =RC[-1]+5 -> 536025 | C2276: =RC[-2]+1 -> 536021 | D2276: =RC[-1]+1 -> 536022 | E2276: =RC[-1]+1 -> 536023 | F2276: =RC[-1]+1 -> 536024 | G2276: =RC[-1]+1 -> 536025 | K2276: 3
A2277: 536030 | B2277: =RC[-1]+5 -> 536035 | C2277: =RC[-2]+1 -> 536031 | D2277: =RC[-1]+1 -> 536032 | E2277: =RC[-1]+1 -> 536033 | F2277: =RC[-1]+1 -> 536034 | G2277: =RC[-1]+1 -> 536035 | K2277: 3
A2278: 536040 | B2278: =RC[-1]+5 -> 536045 | C2278: =RC[-2]+1 -> 536041 | D2278: =RC[-1]+1 -> 536042 | E2278: =RC[-1]+1 -> 536043 | F2278: =RC[-1]+1 -> 536044 | G2278: =RC[-1]+1 -> 536045 | K2278: 3
A2279: 537010 | B2279: =RC[-1]+5 -> 537015 | C2279: =RC[-2]+1 -> 537011 | D2279: =RC[-1]+1 -> 537012 | E2279: =RC[-1]+1 -> 537013 | F2279: =RC[-1]+1 -> 537014 | G2279: =RC[-1]+1 -> 537015 | K2279: 3
A2280: 537020 | B2280: =RC[-1]+5 -> 537025 | C2280: =RC[-2]+1 -> 537021 | D2280: =RC[-1]+1 -> 537022 | E2280: =RC[-1]+1 -> 537023 | F2280: =RC[-1]+1 -> 537024 | G2280: =RC[-1]+1 -> 537025 | K2280: 3
A2281: 537030 | B2281: =RC[-1]+5 -> 537035 | C2281: =RC[-2]+1 -> 537031 | D2281: =RC[-1]+1 -> 537032 | E2281: =RC[-1]+1 -> 537033 | F2281: =RC[-1]+1 -> 537034 | G2281: =RC[-1]+1 -> 537035 | K2281: 3
A2282: 537040 | B2282: =RC[-1]+5 -> 537045 | C2282: =RC[-2]+1 -> 537041 | D2282: =RC[-1]+1 -> 537042 | E2282: =RC[-1]+1 -> 537043 | F2282: =RC[-1]+1 -> 537044 | G2282: =RC[-1]+1 -> 537045 | K2282: 3
A2283: 538010 | B2283: =RC[-1]+5 -> 538015 | C2283: =RC[-2]+1 -> 538011 | D2283: =RC[-1]+1 -> 538012 | E2283: =RC[-1]+1 -> 538013 | F2283: =RC[-1]+1 -> 538014 | G2283: =RC[-1]+1 -> 538015 | K2283: 3
A2284: 538020 | B2284: =RC[-1]+5 -> 538025 | C2284: =RC[-2]+1 -> 538021 | D2284: =RC[-1]+1 -> 538022 | E2284: =RC[-1]+1 -> 538023 | F2284: =RC[-1]+1 -> 538024 | G2284: =RC[-1]+1 -> 538025 | K2284: 3
A2285: 538030 | B2285: =RC[-1]+5 -> 538035 | C2285: =RC[-2]+1 -> 538031 | D2285: =RC[-1]+1 -> 538032 | E2285: =RC[-1]+1 -> 538033 | F2285: =RC[-1]+1 -> 538034 | G2285: =RC[-1]+1 -> 538035 | K2285: 3
A2286: 538040 | B2286: =RC[-1]+5 -> 538045 | C2286: =RC[-2]+1 -> 538041 | D2286: =RC[-1]+1 -> 538042 | E2286: =RC[-1]+1 -> 538043 | F2286: =RC[-1]+1 -> 538044 | G2286: =RC[-1]+1 -> 538045 | K2286: 3
A2287: 539010 | B2287: =RC[-1]+5 -> 539015 | C2287: =RC[-2]+1 -> 539011 | D2287: =RC[-1]+1 -> 539012 | E2287: =RC[-1]+1 -> 539013 | F2287: =RC[-1]+1 -> 539014 | G2287: =RC[-1]+1 -> 539015 | K2287: 3
A2288: 539020 | B2288: =RC[-1]+5 -> 539025 | C2288: =RC[-2]+1 -> 539021 | D2288: =RC[-1]+1 -> 539022 | E2288: =RC[-1]+1 -> 539023 | F2288: =RC[-1]+1 -> 539024 | G2288: =RC[-1]+1 -> 539025 | K2288: 3
A2289: 539030 | B2289: =RC[-1]+5 -> 539035 | C2289: =RC[-2]+1 -> 539031 | D2289: =RC[-1]+1 -> 539032 | E2289: =RC[-1]+1 -> 539033 | F2289: =RC[-1]+1 -> 539034 | G2289: =RC[-1]+1 -> 539035 | K2289: 3
A2290: 539040 | B2290: =RC[-1]+5 -> 539045 | C2290: =RC[-2]+1 -> 539041 | D2290: =RC[-1]+1 -> 539042 | E2290: =RC[-1]+1 -> 539043 | F2290: =RC[-1]+1 -> 539044 | G2290: =RC[-1]+1 -> 539045 | K2290: 3
A2291: 540010 | B2291: =RC[-1]+5 -> 540015 | C2291: =RC[-2]+1 -> 540011 | D2291: =RC[-1]+1 -> 540012 | E2291: =RC[-1]+1 -> 540013 | F2291: =RC[-1]+1 -> 540014 | G2291: =RC[-1]+1 -> 540015 | K2291: 3
A2292: 540020 | B2292: =RC[-1]+5 -> 540025 | C2292: =RC[-2]+1 -> 540021 | D2292: =RC[-1]+1 -> 540022 | E2292: =RC[-1]+1 -> 540023 | F2292: =RC[-1]+1 -> 540024 | G2292: =RC[-1]+1 -> 540025 | K2292: 3
A2293: 540030 | B2293: =RC[-1]+5 -> 540035 | C2293: =RC[-2]+1 -> 540031 | D2293: =RC[-1]+1 -> 540032 | E2293: =RC[-1]+1 -> 540033 | F2293: =RC[-1]+1 -> 540034 | G2293: =RC[-1]+1 -> 540035 | K2293: 3
A2294: 540040 | B2294: =RC[-1]+5 -> 540045 | C2294: =RC[-2]+1 -> 540041 | D2294: =RC[-1]+1 -> 540042 | E2294: =RC[-1]+1 -> 540043 | F2294: =RC[-1]+1 -> 540044 | G2294: =RC[-1]+1 -> 540045 | K2294: 3
A2295: 541010 | B2295: =RC[-1]+5 -> 541015 | C2295: =RC[-2]+1 -> 541011 | D2295: =RC[-1]+1 -> 541012 | E2295: =RC[-1]+1 -> 541013 | F2295: =RC[-1]+1 -> 541014 | G2295: =RC[-1]+1 -> 541015 | K2295: 3
A2296: 541020 | B2296: =RC[-1]+5 -> 541025 | C2296: =RC[-2]+1 -> 541021 | D2296: =RC[-1]+1 -> 541022 | E2296: =RC[-1]+1 -> 541023 | F2296: =RC[-1]+1 -> 541024 | G2296: =RC[-1]+1 -> 541025 | K2296: 3
A2297: 541030 | B2297: =RC[-1]+5 -> 541035 | C2297: =RC[-2]+1 -> 541031 | D2297: =RC[-1]+1 -> 541032 | E2297: =RC[-1]+1 -> 541033 | F2297: =RC[-1]+1 -> 541034 | G2297: =RC[-1]+1 -> 541035 | K2297: 3
A2298: 541040 | B2298: =RC[-1]+5 -> 541045 | C2298: =RC[-2]+1 -> 541041 | D2298: =RC[-1]+1 -> 541042 | E2298: =RC[-1]+1 -> 541043 | F2298: =RC[-1]+1 -> 541044 | G2298: =RC[-1]+1 -> 541045 | K2298: 3
A2299: 542010 | B2299: =RC[-1]+5 -> 542015 | C2299: =RC[-2]+1 -> 542011 | D2299: =RC[-1]+1 -> 542012 | E2299: =RC[-1]+1 -> 542013 | F2299: =RC[-1]+1 -> 542014 | G2299: =RC[-1]+1 -> 542015 | K2299: 3
A2300: 542020 | B2300: =RC[-1]+5 -> 542025 | C2300: =RC[-2]+1 -> 542021 | D2300: =RC[-1]+1 -> 542022 | E2300: =RC[-1]+1 -> 542023 | F2300: =RC[-1]+1 -> 542024 | G2300: =RC[-1]+1 -> 542025 | K2300: 3
A2301: 542030 | B2301: =RC[-1]+5 -> 542035 | C2301: =RC[-2]+1 -> 542031 | D2301: =RC[-1]+1 -> 542032 | E2301: =RC[-1]+1 -> 542033 | F2301: =RC[-1]+1 -> 542034 | G2301: =RC[-1]+1 -> 542035 | K2301: 3
A2302: 542040 | B2302: =RC[-1]+5 -> 542045 | C2302: =RC[-2]+1 -> 542041 | D2302: =RC[-1]+1 -> 542042 | E2302: =RC[-1]+1 -> 542043 | F2302: =RC[-1]+1 -> 542044 | G2302: =RC[-1]+1 -> 542045 | K2302: 3
A2303: 543010 | B2303: =RC[-1]+5 -> 543015 | C2303: =RC[-2]+1 -> 543011 | D2303: =RC[-1]+1 -> 543012 | E2303: =RC[-1]+1 -> 543013 | F2303: =RC[-1]+1 -> 543014 | G2303: =RC[-1]+1 -> 543015 | K2303: 3
A2304: 543020 | B2304: =RC[-1]+5 -> 543025 | C2304: =RC[-2]+1 -> 543021 | D2304: =RC[-1]+1 -> 543022 | E2304: =RC[-1]+1 -> 543023 | F2304: =RC[-1]+1 -> 543024 | G2304: =RC[-1]+1 -> 543025 | K2304: 3
A2305: 543030 | B2305: =RC[-1]+5 -> 543035 | C2305: =RC[-2]+1 -> 543031 | D2305: =RC[-1]+1 -> 543032 | E2305: =RC[-1]+1 -> 543033 | F2305: =RC[-1]+1 -> 543034 | G2305: =RC[-1]+1 -> 543035 | K2305: 3
A2306: 543040 | B2306: =RC[-1]+5 -> 543045 | C2306: =RC[-2]+1 -> 543041 | D2306: =RC[-1]+1 -> 543042 | E2306: =RC[-1]+1 -> 543043 | F2306: =RC[-1]+1 -> 543044 | G2306: =RC[-1]+1 -> 543045 | K2306: 3
A2307: 544010 | B2307: =RC[-1]+5 -> 544015 | C2307: =RC[-2]+1 -> 544011 | D2307: =RC[-1]+1 -> 544012 | E2307: =RC[-1]+1 -> 544013 | F2307: =RC[-1]+1 -> 544014 | G2307: =RC[-1]+1 -> 544015 | K2307: 3
A2308: 544020 | B2308: =RC[-1]+5 -> 544025 | C2308: =RC[-2]+1 -> 544021 | D2308: =RC[-1]+1 -> 544022 | E2308: =RC[-1]+1 -> 544023 | F2308: =RC[-1]+1 -> 544024 | G2308: =RC[-1]+1 -> 544025 | K2308: 3
A2309: 544030 | B2309: =RC[-1]+5 -> 544035 | C2309: =RC[-2]+1 -> 544031 | D2309: =RC[-1]+1 -> 544032 | E2309: =RC[-1]+1 -> 544033 | F2309: =RC[-1]+1 -> 544034 | G2309: =RC[-1]+1 -> 544035 | K2309: 3
A2310: 544040 | B2310: =RC[-1]+5 -> 544045 | C2310: =RC[-2]+1 -> 544041 | D2310: =RC[-1]+1 -> 544042 | E2310: =RC[-1]+1 -> 544043 | F2310: =RC[-1]+1 -> 544044 | G2310: =RC[-1]+1 -> 544045 | K2310: 3
A2311: 545010 | B2311: =RC[-1]+5 -> 545015 | C2311: =RC[-2]+1 -> 545011 | D2311: =RC[-1]+1 -> 545012 | E2311: =RC[-1]+1 -> 545013 | F2311: =RC[-1]+1 -> 545014 | G2311: =RC[-1]+1 -> 545015 | K2311: 3
A2312: 545020 | B2312: =RC[-1]+5 -> 545025 | C2312: =RC[-2]+1 -> 545021 | D2312: =RC[-1]+1 -> 545022 | E2312: =RC[-1]+1 -> 545023 | F2312: =RC[-1]+1 -> 545024 | G2312: =RC[-1]+1 -> 545025 | K2312: 3
A2313: 545030 | B2313: =RC[-1]+5 -> 545035 | C2313: =RC[-2]+1 -> 545031 | D2313: =RC[-1]+1 -> 545032 | E2313: =RC[-1]+1 -> 545033 | F2313: =RC[-1]+1 -> 545034 | G2313: =RC[-1]+1 -> 545035 | K2313: 3
A2314: 545040 | B2314: =RC[-1]+5 -> 545045 | C2314: =RC[-2]+1 -> 545041 | D2314: =RC[-1]+1 -> 545042 | E2314: =RC[-1]+1 -> 545043 | F2314: =RC[-1]+1 -> 545044 | G2314: =RC[-1]+1 -> 545045 | K2314: 3
A2315: 546010 | B2315: =RC[-1]+5 -> 546015 | C2315: =RC[-2]+1 -> 546011 | D2315: =RC[-1]+1 -> 546012 | E2315: =RC[-1]+1 -> 546013 | F2315: =RC[-1]+1 -> 546014 | G2315: =RC[-1]+1 -> 546015 | K2315: 3
A2316: 546020 | B2316: =RC[-1]+5 -> 546025 | C2316: =RC[-2]+1 -> 546021 | D2316: =RC[-1]+1 -> 546022 | E2316: =RC[-1]+1 -> 546023 | F2316: =RC[-1]+1 -> 546024 | G2316: =RC[-1]+1 -> 546025 | K2316: 3
A2317: 546030 | B2317: =RC[-1]+5 -> 546035 | C2317: =RC[-2]+1 -> 546031 | D2317: =RC[-1]+1 -> 546032 | E2317: =RC[-1]+1 -> 546033 | F2317: =RC[-1]+1 -> 546034 | G2317: =RC[-1]+1 -> 546035 | K2317: 3
A2318: 546040 | B2318: =RC[-1]+5 -> 546045 | C2318: =RC[-2]+1 -> 546041 | D2318: =RC[-1]+1 -> 546042 | E2318: =RC[-1]+1 -> 546043 | F2318: =RC[-1]+1 -> 546044 | G2318: =RC[-1]+1 -> 546045 | K2318: 3
A2319: 547010 | B2319: =RC[-1]+5 -> 547015 | C2319: =RC[-2]+1 -> 547011 | D2319: =RC[-1]+1 -> 547012 | E2319: =RC[-1]+1 -> 547013 | F2319: =RC[-1]+1 -> 547014 | G2319: =RC[-1]+1 -> 547015 | K2319: 3
A2320: 547020 | B2320: =RC[-1]+5 -> 547025 | C2320: =RC[-2]+1 -> 547021 | D2320: =RC[-1]+1 -> 547022 | E2320: =RC[-1]+1 -> 547023 | F2320: =RC[-1]+1 -> 547024 | G2320: =RC[-1]+1 -> 547025 | K2320: 3
A2321: 547030 | B2321: =RC[-1]+5 -> 547035 | C2321: =RC[-2]+1 -> 547031 | D2321: =RC[-1]+1 -> 547032 | E2321: =RC[-1]+1 -> 547033 | F2321: =RC[-1]+1 -> 547034 | G2321: =RC[-1]+1 -> 547035 | K2321: 3
A2322: 547040 | B2322: =RC[-1]+5 -> 547045 | C2322: =RC[-2]+1 -> 547041 | D2322: =RC[-1]+1 -> 547042 | E2322: =RC[-1]+1 -> 547043 | F2322: =RC[-1]+1 -> 547044 | G2322: =RC[-1]+1 -> 547045 | K2322: 3
A2323: 548010 | B2323: =RC[-1]+5 -> 548015 | C2323: =RC[-2]+1 -> 548011 | D2323: =RC[-1]+1 -> 548012 | E2323: =RC[-1]+1 -> 548013 | F2323: =RC[-1]+1 -> 548014 | G2323: =RC[-1]+1 -> 548015 | K2323: 3
A2324: 548020 | B2324: =RC[-1]+5 -> 548025 | C2324: =RC[-2]+1 -> 548021 | D2324: =RC[-1]+1 -> 548022 | E2324: =RC[-1]+1 -> 548023 | F2324: =RC[-1]+1 -> 548024 | G2324: =RC[-1]+1 -> 548025 | K2324: 3
A2325: 548030 | B2325: =RC[-1]+5 -> 548035 | C2325: =RC[-2]+1 -> 548031 | D2325: =RC[-1]+1 -> 548032 | E2325: =RC[-1]+1 -> 548033 | F2325: =RC[-1]+1 -> 548034 | G2325: =RC[-1]+1 -> 548035 | K2325: 3
A2326: 548040 | B2326: =RC[-1]+5 -> 548045 | C2326: =RC[-2]+1 -> 548041 | D2326: =RC[-1]+1 -> 548042 | E2326: =RC[-1]+1 -> 548043 | F2326: =RC[-1]+1 -> 548044 | G2326: =RC[-1]+1 -> 548045 | K2326: 3
A2327: 549010 | B2327: =RC[-1]+5 -> 549015 | C2327: =RC[-2]+1 -> 549011 | D2327: =RC[-1]+1 -> 549012 | E2327: =RC[-1]+1 -> 549013 | F2327: =RC[-1]+1 -> 549014 | G2327: =RC[-1]+1 -> 549015 | K2327: 3
A2328: 549020 | B2328: =RC[-1]+5 -> 549025 | C2328: =RC[-2]+1 -> 549021 | D2328: =RC[-1]+1 -> 549022 | E2328: =RC[-1]+1 -> 549023 | F2328: =RC[-1]+1 -> 549024 | G2328: =RC[-1]+1 -> 549025 | K2328: 3
A2329: 549030 | B2329: =RC[-1]+5 -> 549035 | C2329: =RC[-2]+1 -> 549031 | D2329: =RC[-1]+1 -> 549032 | E2329: =RC[-1]+1 -> 549033 | F2329: =RC[-1]+1 -> 549034 | G2329: =RC[-1]+1 -> 549035 | K2329: 3
A2330: 549040 | B2330: =RC[-1]+5 -> 549045 | C2330: =RC[-2]+1 -> 549041 | D2330: =RC[-1]+1 -> 549042 | E2330: =RC[-1]+1 -> 549043 | F2330: =RC[-1]+1 -> 549044 | G2330: =RC[-1]+1 -> 549045 | K2330: 3
A2331: 550010 | B2331: =RC[-1]+5 -> 550015 | C2331: =RC[-2]+1 -> 550011 | D2331: =RC[-1]+1 -> 550012 | E2331: =RC[-1]+1 -> 550013 | F2331: =RC[-1]+1 -> 550014 | G2331: =RC[-1]+1 -> 550015 | K2331: 3
A2332: 550020 | B2332: =RC[-1]+5 -> 550025 | C2332: =RC[-2]+1 -> 550021 | D2332: =RC[-1]+1 -> 550022 | E2332: =RC[-1]+1 -> 550023 | F2332: =RC[-1]+1 -> 550024 | G2332: =RC[-1]+1 -> 550025 | K2332: 3
A2333: 550030 | B2333: =RC[-1]+5 -> 550035 | C2333: =RC[-2]+1 -> 550031 | D2333: =RC[-1]+1 -> 550032 | E2333: =RC[-1]+1 -> 550033 | F2333: =RC[-1]+1 -> 550034 | G2333: =RC[-1]+1 -> 550035 | K2333: 3
A2334: 550040 | B2334: =RC[-1]+5 -> 550045 | C2334: =RC[-2]+1 -> 550041 | D2334: =RC[-1]+1 -> 550042 | E2334: =RC[-1]+1 -> 550043 | F2334: =RC[-1]+1 -> 550044 | G2334: =RC[-1]+1 -> 550045 | K2334: 3
A2335: 501050 | B2335: =RC[-1]+5 -> 501055 | C2335: =RC[-2]+1 -> 501051 | D2335: =RC[-1]+1 -> 501052 | E2335: =RC[-1]+1 -> 501053 | F2335: =RC[-1]+1 -> 501054 | G2335: =RC[-1]+1 -> 501055 | K2335: 3 | L2335: 精英外敌战役
A2336: 501060 | B2336: =RC[-1]+5 -> 501065 | C2336: =RC[-2]+1 -> 501061 | D2336: =RC[-1]+1 -> 501062 | E2336: =RC[-1]+1 -> 501063 | F2336: =RC[-1]+1 -> 501064 | G2336: =RC[-1]+1 -> 501065 | K2336: 3
A2337: 501070 | B2337: =RC[-1]+5 -> 501075 | C2337: =RC[-2]+1 -> 501071 | D2337: =RC[-1]+1 -> 501072 | E2337: =RC[-1]+1 -> 501073 | F2337: =RC[-1]+1 -> 501074 | G2337: =RC[-1]+1 -> 501075 | K2337: 3
A2338: 501080 | B2338: =RC[-1]+5 -> 501085 | C2338: =RC[-2]+1 -> 501081 | D2338: =RC[-1]+1 -> 501082 | E2338: =RC[-1]+1 -> 501083 | F2338: =RC[-1]+1 -> 501084 | G2338: =RC[-1]+1 -> 501085 | K2338: 3
A2339: 502050 | B2339: =RC[-1]+5 -> 502055 | C2339: =RC[-2]+1 -> 502051 | D2339: =RC[-1]+1 -> 502052 | E2339: =RC[-1]+1 -> 502053 | F2339: =RC[-1]+1 -> 502054 | G2339: =RC[-1]+1 -> 502055 | K2339: 3
A2340: 502060 | B2340: =RC[-1]+5 -> 502065 | C2340: =RC[-2]+1 -> 502061 | D2340: =RC[-1]+1 -> 502062 | E2340: =RC[-1]+1 -> 502063 | F2340: =RC[-1]+1 -> 502064 | G2340: =RC[-1]+1 -> 502065 | K2340: 3
A2341: 502070 | B2341: =RC[-1]+5 -> 502075 | C2341: =RC[-2]+1 -> 502071 | D2341: =RC[-1]+1 -> 502072 | E2341: =RC[-1]+1 -> 502073 | F2341: =RC[-1]+1 -> 502074 | G2341: =RC[-1]+1 -> 502075 | K2341: 3
A2342: 502080 | B2342: =RC[-1]+5 -> 502085 | C2342: =RC[-2]+1 -> 502081 | D2342: =RC[-1]+1 -> 502082 | E2342: =RC[-1]+1 -> 502083 | F2342: =RC[-1]+1 -> 502084 | G2342: =RC[-1]+1 -> 502085 | K2342: 3
A2343: 503050 | B2343: =RC[-1]+5 -> 503055 | C2343: =RC[-2]+1 -> 503051 | D2343: =RC[-1]+1 -> 503052 | E2343: =RC[-1]+1 -> 503053 | F2343: =RC[-1]+1 -> 503054 | G2343: =RC[-1]+1 -> 503055 | K2343: 3
A2344: 503060 | B2344: =RC[-1]+5 -> 503065 | C2344: =RC[-2]+1 -> 503061 | D2344: =RC[-1]+1 -> 503062 | E2344: =RC[-1]+1 -> 503063 | F2344: =RC[-1]+1 -> 503064 | G2344: =RC[-1]+1 -> 503065 | K2344: 3
A2345: 503070 | B2345: =RC[-1]+5 -> 503075 | C2345: =RC[-2]+1 -> 503071 | D2345: =RC[-1]+1 -> 503072 | E2345: =RC[-1]+1 -> 503073 | F2345: =RC[-1]+1 -> 503074 | G2345: =RC[-1]+1 -> 503075 | K2345: 3
A2346: 503080 | B2346: =RC[-1]+5 -> 503085 | C2346: =RC[-2]+1 -> 503081 | D2346: =RC[-1]+1 -> 503082 | E2346: =RC[-1]+1 -> 503083 | F2346: =RC[-1]+1 -> 503084 | G2346: =RC[-1]+1 -> 503085 | K2346: 3
A2347: 504050 | B2347: =RC[-1]+5 -> 504055 | C2347: =RC[-2]+1 -> 504051 | D2347: =RC[-1]+1 -> 504052 | E2347: =RC[-1]+1 -> 504053 | F2347: =RC[-1]+1 -> 504054 | G2347: =RC[-1]+1 -> 504055 | K2347: 3
A2348: 504060 | B2348: =RC[-1]+5 -> 504065 | C2348: =RC[-2]+1 -> 504061 | D2348: =RC[-1]+1 -> 504062 | E2348: =RC[-1]+1 -> 504063 | F2348: =RC[-1]+1 -> 504064 | G2348: =RC[-1]+1 -> 504065 | K2348: 3
A2349: 504070 | B2349: =RC[-1]+5 -> 504075 | C2349: =RC[-2]+1 -> 504071 | D2349: =RC[-1]+1 -> 504072 | E2349: =RC[-1]+1 -> 504073 | F2349: =RC[-1]+1 -> 504074 | G2349: =RC[-1]+1 -> 504075 | K2349: 3
A2350: 504080 | B2350: =RC[-1]+5 -> 504085 | C2350: =RC[-2]+1 -> 504081 | D2350: =RC[-1]+1 -> 504082 | E2350: =RC[-1]+1 -> 504083 | F2350: =RC[-1]+1 -> 504084 | G2350: =RC[-1]+1 -> 504085 | K2350: 3
A2351: 505050 | B2351: =RC[-1]+5 -> 505055 | C2351: =RC[-2]+1 -> 505051 | D2351: =RC[-1]+1 -> 505052 | E2351: =RC[-1]+1 -> 505053 | F2351: =RC[-1]+1 -> 505054 | G2351: =RC[-1]+1 -> 505055 | K2351: 3
A2352: 505060 | B2352: =RC[-1]+5 -> 505065 | C2352: =RC[-2]+1 -> 505061 | D2352: =RC[-1]+1 -> 505062 | E2352: =RC[-1]+1 -> 505063 | F2352: =RC[-1]+1 -> 505064 | G2352: =RC[-1]+1 -> 505065 | K2352: 3
A2353: 505070 | B2353: =RC[-1]+5 -> 505075 | C2353: =RC[-2]+1 -> 505071 | D2353: =RC[-1]+1 -> 505072 | E2353: =RC[-1]+1 -> 505073 | F2353: =RC[-1]+1 -> 505074 | G2353: =RC[-1]+1 -> 505075 | K2353: 3
A2354: 505080 | B2354: =RC[-1]+5 -> 505085 | C2354: =RC[-2]+1 -> 505081 | D2354: =RC[-1]+1 -> 505082 | E2354: =RC[-1]+1 -> 505083 | F2354: =RC[-1]+1 -> 505084 | G2354: =RC[-1]+1 -> 505085 | K2354: 3
A2355: 506050 | B2355: =RC[-1]+5 -> 506055 | C2355: =RC[-2]+1 -> 506051 | D2355: =RC[-1]+1 -> 506052 | E2355: =RC[-1]+1 -> 506053 | F2355: =RC[-1]+1 -> 506054 | G2355: =RC[-1]+1 -> 506055 | K2355: 3
A2356: 506060 | B2356: =RC[-1]+5 -> 506065 | C2356: =RC[-2]+1 -> 506061 | D2356: =RC[-1]+1 -> 506062 | E2356: =RC[-1]+1 -> 506063 | F2356: =RC[-1]+1 -> 506064 | G2356: =RC[-1]+1 -> 506065 | K2356: 3
A2357: 506070 | B2357: =RC[-1]+5 -> 506075 | C2357: =RC[-2]+1 -> 506071 | D2357: =RC[-1]+1 -> 506072 | E2357: =RC[-1]+1 -> 506073 | F2357: =RC[-1]+1 -> 506074 | G2357: =RC[-1]+1 -> 506075 | K2357: 3
A2358: 506080 | B2358: =RC[-1]+5 -> 506085 | C2358: =RC[-2]+1 -> 506081 | D2358: =RC[-1]+1 -> 506082 | E2358: =RC[-1]+1 -> 506083 | F2358: =RC[-1]+1 -> 506084 | G2358: =RC[-1]+1 -> 506085 | K2358: 3
A2359: 507050 | B2359: =RC[-1]+5 -> 507055 | C2359: =RC[-2]+1 -> 507051 | D2359: =RC[-1]+1 -> 507052 | E2359: =RC[-1]+1 -> 507053 | F2359: =RC[-1]+1 -> 507054 | G2359: =RC[-1]+1 -> 507055 | K2359: 3
A2360: 507060 | B2360: =RC[-1]+5 -> 507065 | C2360: =RC[-2]+1 -> 507061 | D2360: =RC[-1]+1 -> 507062 | E2360: =RC[-1]+1 -> 507063 | F2360: =RC[-1]+1 -> 507064 | G2360: =RC[-1]+1 -> 507065 | K2360: 3
A2361: 507070 | B2361: =RC[-1]+5 -> 507075 | C2361: =RC[-2]+1 -> 507071 | D2361: =RC[-1]+1 -> 507072 | E2361: =RC[-1]+1 -> 507073 | F2361: =RC[-1]+1 -> 507074 | G2361: =RC[-1]+1 -> 507075 | K2361: 3
A2362: 507080 | B2362: =RC[-1]+5 -> 507085 | C2362: =RC[-2]+1 -> 507081 | D2362: =RC[-1]+1 -> 507082 | E2362: =RC[-1]+1 -> 507083 | F2362: =RC[-1]+1 -> 507084 | G2362: =RC[-1]+1 -> 507085 | K2362: 3
A2363: 508050 | B2363: =RC[-1]+5 -> 508055 | C2363: =RC[-2]+1 -> 508051 | D2363: =RC[-1]+1 -> 508052 | E2363: =RC[-1]+1 -> 508053 | F2363: =RC[-1]+1 -> 508054 | G2363: =RC[-1]+1 -> 508055 | K2363: 3
A2364: 508060 | B2364: =RC[-1]+5 -> 508065 | C2364: =RC[-2]+1 -> 508061 | D2364: =RC[-1]+1 -> 508062 | E2364: =RC[-1]+1 -> 508063 | F2364: =RC[-1]+1 -> 508064 | G2364: =RC[-1]+1 -> 508065 | K2364: 3
A2365: 508070 | B2365: =RC[-1]+5 -> 508075 | C2365: =RC[-2]+1 -> 508071 | D2365: =RC[-1]+1 -> 508072 | E2365: =RC[-1]+1 -> 508073 | F2365: =RC[-1]+1 -> 508074 | G2365: =RC[-1]+1 -> 508075 | K2365: 3
A2366: 508080 | B2366: =RC[-1]+5 -> 508085 | C2366: =RC[-2]+1 -> 508081 | D2366: =RC[-1]+1 -> 508082 | E2366: =RC[-1]+1 -> 508083 | F2366: =RC[-1]+1 -> 508084 | G2366: =RC[-1]+1 -> 508085 | K2366: 3
A2367: 509050 | B2367: =RC[-1]+5 -> 509055 | C2367: =RC[-2]+1 -> 509051 | D2367: =RC[-1]+1 -> 509052 | E2367: =RC[-1]+1 -> 509053 | F2367: =RC[-1]+1 -> 509054 | G2367: =RC[-1]+1 -> 509055 | K2367: 3
A2368: 509060 | B2368: =RC[-1]+5 -> 509065 | C2368: =RC[-2]+1 -> 509061 | D2368: =RC[-1]+1 -> 509062 | E2368: =RC[-1]+1 -> 509063 | F2368: =RC[-1]+1 -> 509064 | G2368: =RC[-1]+1 -> 509065 | K2368: 3
A2369: 509070 | B2369: =RC[-1]+5 -> 509075 | C2369: =RC[-2]+1 -> 509071 | D2369: =RC[-1]+1 -> 509072 | E2369: =RC[-1]+1 -> 509073 | F2369: =RC[-1]+1 -> 509074 | G2369: =RC[-1]+1 -> 509075 | K2369: 3
A2370: 509080 | B2370: =RC[-1]+5 -> 509085 | C2370: =RC[-2]+1 -> 509081 | D2370: =RC[-1]+1 -> 509082 | E2370: =RC[-1]+1 -> 509083 | F2370: =RC[-1]+1 -> 509084 | G2370: =RC[-1]+1 -> 509085 | K2370: 3
A2371: 510050 | B2371: =RC[-1]+5 -> 510055 | C2371: =RC[-2]+1 -> 510051 | D2371: =RC[-1]+1 -> 510052 | E2371: =RC[-1]+1 -> 510053 | F2371: =RC[-1]+1 -> 510054 | G2371: =RC[-1]+1 -> 510055 | K2371: 3
A2372: 510060 | B2372: =RC[-1]+5 -> 510065 | C2372: =RC[-2]+1 -> 510061 | D2372: =RC[-1]+1 -> 510062 | E2372: =RC[-1]+1 -> 510063 | F2372: =RC[-1]+1 -> 510064 | G2372: =RC[-1]+1 -> 510065 | K2372: 3
A2373: 510070 | B2373: =RC[-1]+5 -> 510075 | C2373: =RC[-2]+1 -> 510071 | D2373: =RC[-1]+1 -> 510072 | E2373: =RC[-1]+1 -> 510073 | F2373: =RC[-1]+1 -> 510074 | G2373: =RC[-1]+1 -> 510075 | K2373: 3
A2374: 510080 | B2374: =RC[-1]+5 -> 510085 | C2374: =RC[-2]+1 -> 510081 | D2374: =RC[-1]+1 -> 510082 | E2374: =RC[-1]+1 -> 510083 | F2374: =RC[-1]+1 -> 510084 | G2374: =RC[-1]+1 -> 510085 | K2374: 3
A2375: 511050 | B2375: =RC[-1]+5 -> 511055 | C2375: =RC[-2]+1 -> 511051 | D2375: =RC[-1]+1 -> 511052 | E2375: =RC[-1]+1 -> 511053 | F2375: =RC[-1]+1 -> 511054 | G2375: =RC[-1]+1 -> 511055 | K2375: 3
A2376: 511060 | B2376: =RC[-1]+5 -> 511065 | C2376: =RC[-2]+1 -> 511061 | D2376: =RC[-1]+1 -> 511062 | E2376: =RC[-1]+1 -> 511063 | F2376: =RC[-1]+1 -> 511064 | G2376: =RC[-1]+1 -> 511065 | K2376: 3
A2377: 511070 | B2377: =RC[-1]+5 -> 511075 | C2377: =RC[-2]+1 -> 511071 | D2377: =RC[-1]+1 -> 511072 | E2377: =RC[-1]+1 -> 511073 | F2377: =RC[-1]+1 -> 511074 | G2377: =RC[-1]+1 -> 511075 | K2377: 3
A2378: 511080 | B2378: =RC[-1]+5 -> 511085 | C2378: =RC[-2]+1 -> 511081 | D2378: =RC[-1]+1 -> 511082 | E2378: =RC[-1]+1 -> 511083 | F2378: =RC[-1]+1 -> 511084 | G2378: =RC[-1]+1 -> 511085 | K2378: 3
A2379: 512050 | B2379: =RC[-1]+5 -> 512055 | C2379: =RC[-2]+1 -> 512051 | D2379: =RC[-1]+1 -> 512052 | E2379: =RC[-1]+1 -> 512053 | F2379: =RC[-1]+1 -> 512054 | G2379: =RC[-1]+1 -> 512055 | K2379: 3
A2380: 512060 | B2380: =RC[-1]+5 -> 512065 | C2380: =RC[-2]+1 -> 512061 | D2380: =RC[-1]+1 -> 512062 | E2380: =RC[-1]+1 -> 512063 | F2380: =RC[-1]+1 -> 512064 | G2380: =RC[-1]+1 -> 512065 | K2380: 3
A2381: 512070 | B2381: =RC[-1]+5 -> 512075 | C2381: =RC[-2]+1 -> 512071 | D2381: =RC[-1]+1 -> 512072 | E2381: =RC[-1]+1 -> 512073 | F2381: =RC[-1]+1 -> 512074 | G2381: =RC[-1]+1 -> 512075 | K2381: 3
A2382: 512080 | B2382: =RC[-1]+5 -> 512085 | C2382: =RC[-2]+1 -> 512081 | D2382: =RC[-1]+1 -> 512082 | E2382: =RC[-1]+1 -> 512083 | F2382: =RC[-1]+1 -> 512084 | G2382: =RC[-1]+1 -> 512085 | K2382: 3
A2383: 513050 | B2383: =RC[-1]+5 -> 513055 | C2383: =RC[-2]+1 -> 513051 | D2383: =RC[-1]+1 -> 513052 | E2383: =RC[-1]+1 -> 513053 | F2383: =RC[-1]+1 -> 513054 | G2383: =RC[-1]+1 -> 513055 | K2383: 3
A2384: 513060 | B2384: =RC[-1]+5 -> 513065 | C2384: =RC[-2]+1 -> 513061 | D2384: =RC[-1]+1 -> 513062 | E2384: =RC[-1]+1 -> 513063 | F2384: =RC[-1]+1 -> 513064 | G2384: =RC[-1]+1 -> 513065 | K2384: 3
A2385: 513070 | B2385: =RC[-1]+5 -> 513075 | C2385: =RC[-2]+1 -> 513071 | D2385: =RC[-1]+1 -> 513072 | E2385: =RC[-1]+1 -> 513073 | F2385: =RC[-1]+1 -> 513074 | G2385: =RC[-1]+1 -> 513075 | K2385: 3
A2386: 513080 | B2386: =RC[-1]+5 -> 513085 | C2386: =RC[-2]+1 -> 513081 | D2386: =RC[-1]+1 -> 513082 | E2386: =RC[-1]+1 -> 513083 | F2386: =RC[-1]+1 -> 513084 | G2386: =RC[-1]+1 -> 513085 | K2386: 3
A2387: 514050 | B2387: =RC[-1]+5 -> 514055 | C2387: =RC[-2]+1 -> 514051 | D2387: =RC[-1]+1 -> 514052 | E2387: =RC[-1]+1 -> 514053 | F2387: =RC[-1]+1 -> 514054 | G2387: =RC[-1]+1 -> 514055 | K2387: 3
A2388: 514060 | B2388: =RC[-1]+5 -> 514065 | C2388: =RC[-2]+1 -> 514061 | D2388: =RC[-1]+1 -> 514062 | E2388: =RC[-1]+1 -> 514063 | F2388: =RC[-1]+1 -> 514064 | G2388: =RC[-1]+1 -> 514065 | K2388: 3
A2389: 514070 | B2389: =RC[-1]+5 -> 514075 | C2389: =RC[-2]+1 -> 514071 | D2389: =RC[-1]+1 -> 514072 | E2389: =RC[-1]+1 -> 514073 | F2389: =RC[-1]+1 -> 514074 | G2389: =RC[-1]+1 -> 514075 | K2389: 3
A2390: 514080 | B2390: =RC[-1]+5 -> 514085 | C2390: =RC[-2]+1 -> 514081 | D2390: =RC[-1]+1 -> 514082 | E2390: =RC[-1]+1 -> 514083 | F2390: =RC[-1]+1 -> 514084 | G2390: =RC[-1]+1 -> 514085 | K2390: 3
A2391: 515050 | B2391: =RC[-1]+5 -> 515055 | C2391: =RC[-2]+1 -> 515051 | D2391: =RC[-1]+1 -> 515052 | E2391: =RC[-1]+1 -> 515053 | F2391: =RC[-1]+1 -> 515054 | G2391: =RC[-1]+1 -> 515055 | K2391: 3
A2392: 515060 | B2392: =RC[-1]+5 -> 515065 | C2392: =RC[-2]+1 -> 515061 | D2392: =RC[-1]+1 -> 515062 | E2392: =RC[-1]+1 -> 515063 | F2392: =RC[-1]+1 -> 515064 | G2392: =RC[-1]+1 -> 515065 | K2392: 3
A2393: 515070 | B2393: =RC[-1]+5 -> 515075 | C2393: =RC[-2]+1 -> 515071 | D2393: =RC[-1]+1 -> 515072 | E2393: =RC[-1]+1 -> 515073 | F2393: =RC[-1]+1 -> 515074 | G2393: =RC[-1]+1 -> 515075 | K2393: 3
A2394: 515080 | B2394: =RC[-1]+5 -> 515085 | C2394: =RC[-2]+1 -> 515081 | D2394: =RC[-1]+1 -> 515082 | E2394: =RC[-1]+1 -> 515083 | F2394: =RC[-1]+1 -> 515084 | G2394: =RC[-1]+1 -> 515085 | K2394: 3
A2395: 516050 | B2395: =RC[-1]+5 -> 516055 | C2395: =RC[-2]+1 -> 516051 | D2395: =RC[-1]+1 -> 516052 | E2395: =RC[-1]+1 -> 516053 | F2395: =RC[-1]+1 -> 516054 | G2395: =RC[-1]+1 -> 516055 | K2395: 3
A2396: 516060 | B2396: =RC[-1]+5 -> 516065 | C2396: =RC[-2]+1 -> 516061 | D2396: =RC[-1]+1 -> 516062 | E2396: =RC[-1]+1 -> 516063 | F2396: =RC[-1]+1 -> 516064 | G2396: =RC[-1]+1 -> 516065 | K2396: 3
A2397: 516070 | B2397: =RC[-1]+5 -> 516075 | C2397: =RC[-2]+1 -> 516071 | D2397: =RC[-1]+1 -> 516072 | E2397: =RC[-1]+1 -> 516073 | F2397: =RC[-1]+1 -> 516074 | G2397: =RC[-1]+1 -> 516075 | K2397: 3
A2398: 516080 | B2398: =RC[-1]+5 -> 516085 | C2398: =RC[-2]+1 -> 516081 | D2398: =RC[-1]+1 -> 516082 | E2398: =RC[-1]+1 -> 516083 | F2398: =RC[-1]+1 -> 516084 | G2398: =RC[-1]+1 -> 516085 | K2398: 3
A2399: 517050 | B2399: =RC[-1]+5 -> 517055 | C2399: =RC[-2]+1 -> 517051 | D2399: =RC[-1]+1 -> 517052 | E2399: =RC[-1]+1 -> 517053 | F2399: =RC[-1]+1 -> 517054 | G2399: =RC[-1]+1 -> 517055 | K2399: 3
A2400: 517060 | B2400: =RC[-1]+5 -> 517065 | C2400: =RC[-2]+1 -> 517061 | D2400: =RC[-1]+1 -> 517062 | E2400: =RC[-1]+1 -> 517063 | F2400: =RC[-1]+1 -> 517064 | G2400: =RC[-1]+1 -> 517065 | K2400: 3
A2401: 517070 | B2401: =RC[-1]+5 -> 517075 | C2401: =RC[-2]+1 -> 517071 | D2401: =RC[-1]+1 -> 517072 | E2401: =RC[-1]+1 -> 517073 | F2401: =RC[-1]+1 -> 517074 | G2401: =RC[-1]+1 -> 517075 | K2401: 3
A2402: 517080 | B2402: =RC[-1]+5 -> 517085 | C2402: =RC[-2]+1 -> 517081 | D2402: =RC[-1]+1 -> 517082 | E2402: =RC[-1]+1 -> 517083 | F2402: =RC[-1]+1 -> 517084 | G2402: =RC[-1]+1 -> 517085 | K2402: 3
A2403: 518050 | B2403: =RC[-1]+5 -> 518055 | C2403: =RC[-2]+1 -> 518051 | D2403: =RC[-1]+1 -> 518052 | E2403: =RC[-1]+1 -> 518053 | F2403: =RC[-1]+1 -> 518054 | G2403: =RC[-1]+1 -> 518055 | K2403: 3
A2404: 518060 | B2404: =RC[-1]+5 -> 518065 | C2404: =RC[-2]+1 -> 518061 | D2404: =RC[-1]+1 -> 518062 | E2404: =RC[-1]+1 -> 518063 | F2404: =RC[-1]+1 -> 518064 | G2404: =RC[-1]+1 -> 518065 | K2404: 3
A2405: 518070 | B2405: =RC[-1]+5 -> 518075 | C2405: =RC[-2]+1 -> 518071 | D2405: =RC[-1]+1 -> 518072 | E2405: =RC[-1]+1 -> 518073 | F2405: =RC[-1]+1 -> 518074 | G2405: =RC[-1]+1 -> 518075 | K2405: 3
A2406: 518080 | B2406: =RC[-1]+5 -> 518085 | C2406: =RC[-2]+1 -> 518081 | D2406: =RC[-1]+1 -> 518082 | E2406: =RC[-1]+1 -> 518083 | F2406: =RC[-1]+1 -> 518084 | G2406: =RC[-1]+1 -> 518085 | K2406: 3
A2407: 519050 | B2407: =RC[-1]+5 -> 519055 | C2407: =RC[-2]+1 -> 519051 | D2407: =RC[-1]+1 -> 519052 | E2407: =RC[-1]+1 -> 519053 | F2407: =RC[-1]+1 -> 519054 | G2407: =RC[-1]+1 -> 519055 | K2407: 3
A2408: 519060 | B2408: =RC[-1]+5 -> 519065 | C2408: =RC[-2]+1 -> 519061 | D2408: =RC[-1]+1 -> 519062 | E2408: =RC[-1]+1 -> 519063 | F2408: =RC[-1]+1 -> 519064 | G2408: =RC[-1]+1 -> 519065 | K2408: 3
A2409: 519070 | B2409: =RC[-1]+5 -> 519075 | C2409: =RC[-2]+1 -> 519071 | D2409: =RC[-1]+1 -> 519072 | E2409: =RC[-1]+1 -> 519073 | F2409: =RC[-1]+1 -> 519074 | G2409: =RC[-1]+1 -> 519075 | K2409: 3
A2410: 519080 | B2410: =RC[-1]+5 -> 519085 | C2410: =RC[-2]+1 -> 519081 | D2410: =RC[-1]+1 -> 519082 | E2410: =RC[-1]+1 -> 519083 | F2410: =RC[-1]+1 -> 519084 | G2410: =RC[-1]+1 -> 519085 | K2410: 3
A2411: 520050 | B2411: =RC[-1]+5 -> 520055 | C2411: =RC[-2]+1 -> 520051 | D2411: =RC[-1]+1 -> 520052 | E2411: =RC[-1]+1 -> 520053 | F2411: =RC[-1]+1 -> 520054 | G2411: =RC[-1]+1 -> 520055 | K2411: 3
A2412: 520060 | B2412: =RC[-1]+5 -> 520065 | C2412: =RC[-2]+1 -> 520061 | D2412: =RC[-1]+1 -> 520062 | E2412: =RC[-1]+1 -> 520063 | F2412: =RC[-1]+1 -> 520064 | G2412: =RC[-1]+1 -> 520065 | K2412: 3
A2413: 520070 | B2413: =RC[-1]+5 -> 520075 | C2413: =RC[-2]+1 -> 520071 | D2413: =RC[-1]+1 -> 520072 | E2413: =RC[-1]+1 -> 520073 | F2413: =RC[-1]+1 -> 520074 | G2413: =RC[-1]+1 -> 520075 | K2413: 3
A2414: 520080 | B2414: =RC[-1]+5 -> 520085 | C2414: =RC[-2]+1 -> 520081 | D2414: =RC[-1]+1 -> 520082 | E2414: =RC[-1]+1 -> 520083 | F2414: =RC[-1]+1 -> 520084 | G2414: =RC[-1]+1 -> 520085 | K2414: 3
A2415: 521050 | B2415: =RC[-1]+5 -> 521055 | C2415: =RC[-2]+1 -> 521051 | D2415: =RC[-1]+1 -> 521052 | E2415: =RC[-1]+1 -> 521053 | F2415: =RC[-1]+1 -> 521054 | G2415: =RC[-1]+1 -> 521055 | K2415: 3
A2416: 521060 | B2416: =RC[-1]+5 -> 521065 | C2416: =RC[-2]+1 -> 521061 | D2416: =RC[-1]+1 -> 521062 | E2416: =RC[-1]+1 -> 521063 | F2416: =RC[-1]+1 -> 521064 | G2416: =RC[-1]+1 -> 521065 | K2416: 3
A2417: 521070 | B2417: =RC[-1]+5 -> 521075 | C2417: =RC[-2]+1 -> 521071 | D2417: =RC[-1]+1 -> 521072 | E2417: =RC[-1]+1 -> 521073 | F2417: =RC[-1]+1 -> 521074 | G2417: =RC[-1]+1 -> 521075 | K2417: 3
A2418: 521080 | B2418: =RC[-1]+5 -> 521085 | C2418: =RC[-2]+1 -> 521081 | D2418: =RC[-1]+1 -> 521082 | E2418: =RC[-1]+1 -> 521083 | F2418: =RC[-1]+1 -> 521084 | G2418: =RC[-1]+1 -> 521085 | K2418: 3
A2419: 522050 | B2419: =RC[-1]+5 -> 522055 | C2419: =RC[-2]+1 -> 522051 | D2419: =RC[-1]+1 -> 522052 | E2419: =RC[-1]+1 -> 522053 | F2419: =RC[-1]+1 -> 522054 | G2419: =RC[-1]+1 -> 522055 | K2419: 3
A2420: 522060 | B2420: =RC[-1]+5 -> 522065 | C2420: =RC[-2]+1 -> 522061 | D2420: =RC[-1]+1 -> 522062 | E2420: =RC[-1]+1 -> 522063 | F2420: =RC[-1]+1 -> 522064 | G2420: =RC[-1]+1 -> 522065 | K2420: 3
A2421: 522070 | B2421: =RC[-1]+5 -> 522075 | C2421: =RC[-2]+1 -> 522071 | D2421: =RC[-1]+1 -> 522072 | E2421: =RC[-1]+1 -> 522073 | F2421: =RC[-1]+1 -> 522074 | G2421: =RC[-1]+1 -> 522075 | K2421: 3
A2422: 522080 | B2422: =RC[-1]+5 -> 522085 | C2422: =RC[-2]+1 -> 522081 | D2422: =RC[-1]+1 -> 522082 | E2422: =RC[-1]+1 -> 522083 | F2422: =RC[-1]+1 -> 522084 | G2422: =RC[-1]+1 -> 522085 | K2422: 3
A2423: 523050 | B2423: =RC[-1]+5 -> 523055 | C2423: =RC[-2]+1 -> 523051 | D2423: =RC[-1]+1 -> 523052 | E2423: =RC[-1]+1 -> 523053 | F2423: =RC[-1]+1 -> 523054 | G2423: =RC[-1]+1 -> 523055 | K2423: 3
A2424: 523060 | B2424: =RC[-1]+5 -> 523065 | C2424: =RC[-2]+1 -> 523061 | D2424: =RC[-1]+1 -> 523062 | E2424: =RC[-1]+1 -> 523063 | F2424: =RC[-1]+1 -> 523064 | G2424: =RC[-1]+1 -> 523065 | K2424: 3
A2425: 523070 | B2425: =RC[-1]+5 -> 523075 | C2425: =RC[-2]+1 -> 523071 | D2425: =RC[-1]+1 -> 523072 | E2425: =RC[-1]+1 -> 523073 | F2425: =RC[-1]+1 -> 523074 | G2425: =RC[-1]+1 -> 523075 | K2425: 3
A2426: 523080 | B2426: =RC[-1]+5 -> 523085 | C2426: =RC[-2]+1 -> 523081 | D2426: =RC[-1]+1 -> 523082 | E2426: =RC[-1]+1 -> 523083 | F2426: =RC[-1]+1 -> 523084 | G2426: =RC[-1]+1 -> 523085 | K2426: 3
A2427: 524050 | B2427: =RC[-1]+5 -> 524055 | C2427: =RC[-2]+1 -> 524051 | D2427: =RC[-1]+1 -> 524052 | E2427: =RC[-1]+1 -> 524053 | F2427: =RC[-1]+1 -> 524054 | G2427: =RC[-1]+1 -> 524055 | K2427: 3
A2428: 524060 | B2428: =RC[-1]+5 -> 524065 | C2428: =RC[-2]+1 -> 524061 | D2428: =RC[-1]+1 -> 524062 | E2428: =RC[-1]+1 -> 524063 | F2428: =RC[-1]+1 -> 524064 | G2428: =RC[-1]+1 -> 524065 | K2428: 3
A2429: 524070 | B2429: =RC[-1]+5 -> 524075 | C2429: =RC[-2]+1 -> 524071 | D2429: =RC[-1]+1 -> 524072 | E2429: =RC[-1]+1 -> 524073 | F2429: =RC[-1]+1 -> 524074 | G2429: =RC[-1]+1 -> 524075 | K2429: 3
A2430: 524080 | B2430: =RC[-1]+5 -> 524085 | C2430: =RC[-2]+1 -> 524081 | D2430: =RC[-1]+1 -> 524082 | E2430: =RC[-1]+1 -> 524083 | F2430: =RC[-1]+1 -> 524084 | G2430: =RC[-1]+1 -> 524085 | K2430: 3
A2431: 525050 | B2431: =RC[-1]+5 -> 525055 | C2431: =RC[-2]+1 -> 525051 | D2431: =RC[-1]+1 -> 525052 | E2431: =RC[-1]+1 -> 525053 | F2431: =RC[-1]+1 -> 525054 | G2431: =RC[-1]+1 -> 525055 | K2431: 3
A2432: 525060 | B2432: =RC[-1]+5 -> 525065 | C2432: =RC[-2]+1 -> 525061 | D2432: =RC[-1]+1 -> 525062 | E2432: =RC[-1]+1 -> 525063 | F2432: =RC[-1]+1 -> 525064 | G2432: =RC[-1]+1 -> 525065 | K2432: 3
A2433: 525070 | B2433: =RC[-1]+5 -> 525075 | C2433: =RC[-2]+1 -> 525071 | D2433: =RC[-1]+1 -> 525072 | E2433: =RC[-1]+1 -> 525073 | F2433: =RC[-1]+1 -> 525074 | G2433: =RC[-1]+1 -> 525075 | K2433: 3
A2434: 525080 | B2434: =RC[-1]+5 -> 525085 | C2434: =RC[-2]+1 -> 525081 | D2434: =RC[-1]+1 -> 525082 | E2434: =RC[-1]+1 -> 525083 | F2434: =RC[-1]+1 -> 525084 | G2434: =RC[-1]+1 -> 525085 | K2434: 3
A2435: 526050 | B2435: =RC[-1]+5 -> 526055 | C2435: =RC[-2]+1 -> 526051 | D2435: =RC[-1]+1 -> 526052 | E2435: =RC[-1]+1 -> 526053 | F2435: =RC[-1]+1 -> 526054 | G2435: =RC[-1]+1 -> 526055 | K2435: 3
A2436: 526060 | B2436: =RC[-1]+5 -> 526065 | C2436: =RC[-2]+1 -> 526061 | D2436: =RC[-1]+1 -> 526062 | E2436: =RC[-1]+1 -> 526063 | F2436: =RC[-1]+1 -> 526064 | G2436: =RC[-1]+1 -> 526065 | K2436: 3
A2437: 526070 | B2437: =RC[-1]+5 -> 526075 | C2437: =RC[-2]+1 -> 526071 | D2437: =RC[-1]+1 -> 526072 | E2437: =RC[-1]+1 -> 526073 | F2437: =RC[-1]+1 -> 526074 | G2437: =RC[-1]+1 -> 526075 | K2437: 3
A2438: 526080 | B2438: =RC[-1]+5 -> 526085 | C2438: =RC[-2]+1 -> 526081 | D2438: =RC[-1]+1 -> 526082 | E2438: =RC[-1]+1 -> 526083 | F2438: =RC[-1]+1 -> 526084 | G2438: =RC[-1]+1 -> 526085 | K2438: 3
A2439: 527050 | B2439: =RC[-1]+5 -> 527055 | C2439: =RC[-2]+1 -> 527051 | D2439: =RC[-1]+1 -> 527052 | E2439: =RC[-1]+1 -> 527053 | F2439: =RC[-1]+1 -> 527054 | G2439: =RC[-1]+1 -> 527055 | K2439: 3
A2440: 527060 | B2440: =RC[-1]+5 -> 527065 | C2440: =RC[-2]+1 -> 527061 | D2440: =RC[-1]+1 -> 527062 | E2440: =RC[-1]+1 -> 527063 | F2440: =RC[-1]+1 -> 527064 | G2440: =RC[-1]+1 -> 527065 | K2440: 3
A2441: 527070 | B2441: =RC[-1]+5 -> 527075 | C2441: =RC[-2]+1 -> 527071 | D2441: =RC[-1]+1 -> 527072 | E2441: =RC[-1]+1 -> 527073 | F2441: =RC[-1]+1 -> 527074 | G2441: =RC[-1]+1 -> 527075 | K2441: 3
A2442: 527080 | B2442: =RC[-1]+5 -> 527085 | C2442: =RC[-2]+1 -> 527081 | D2442: =RC[-1]+1 -> 527082 | E2442: =RC[-1]+1 -> 527083 | F2442: =RC[-1]+1 -> 527084 | G2442: =RC[-1]+1 -> 527085 | K2442: 3
A2443: 528050 | B2443: =RC[-1]+5 -> 528055 | C2443: =RC[-2]+1 -> 528051 | D2443: =RC[-1]+1 -> 528052 | E2443: =RC[-1]+1 -> 528053 | F2443: =RC[-1]+1 -> 528054 | G2443: =RC[-1]+1 -> 528055 | K2443: 3
A2444: 528060 | B2444: =RC[-1]+5 -> 528065 | C2444: =RC[-2]+1 -> 528061 | D2444: =RC[-1]+1 -> 528062 | E2444: =RC[-1]+1 -> 528063 | F2444: =RC[-1]+1 -> 528064 | G2444: =RC[-1]+1 -> 528065 | K2444: 3
A2445: 528070 | B2445: =RC[-1]+5 -> 528075 | C2445: =RC[-2]+1 -> 528071 | D2445: =RC[-1]+1 -> 528072 | E2445: =RC[-1]+1 -> 528073 | F2445: =RC[-1]+1 -> 528074 | G2445: =RC[-1]+1 -> 528075 | K2445: 3
A2446: 528080 | B2446: =RC[-1]+5 -> 528085 | C2446: =RC[-2]+1 -> 528081 | D2446: =RC[-1]+1 -> 528082 | E2446: =RC[-1]+1 -> 528083 | F2446: =RC[-1]+1 -> 528084 | G2446: =RC[-1]+1 -> 528085 | K2446: 3
A2447: 529050 | B2447: =RC[-1]+5 -> 529055 | C2447: =RC[-2]+1 -> 529051 | D2447: =RC[-1]+1 -> 529052 | E2447: =RC[-1]+1 -> 529053 | F2447: =RC[-1]+1 -> 529054 | G2447: =RC[-1]+1 -> 529055 | K2447: 3
A2448: 529060 | B2448: =RC[-1]+5 -> 529065 | C2448: =RC[-2]+1 -> 529061 | D2448: =RC[-1]+1 -> 529062 | E2448: =RC[-1]+1 -> 529063 | F2448: =RC[-1]+1 -> 529064 | G2448: =RC[-1]+1 -> 529065 | K2448: 3
A2449: 529070 | B2449: =RC[-1]+5 -> 529075 | C2449: =RC[-2]+1 -> 529071 | D2449: =RC[-1]+1 -> 529072 | E2449: =RC[-1]+1 -> 529073 | F2449: =RC[-1]+1 -> 529074 | G2449: =RC[-1]+1 -> 529075 | K2449: 3
A2450: 529080 | B2450: =RC[-1]+5 -> 529085 | C2450: =RC[-2]+1 -> 529081 | D2450: =RC[-1]+1 -> 529082 | E2450: =RC[-1]+1 -> 529083 | F2450: =RC[-1]+1 -> 529084 | G2450: =RC[-1]+1 -> 529085 | K2450: 3
A2451: 530050 | B2451: =RC[-1]+5 -> 530055 | C2451: =RC[-2]+1 -> 530051 | D2451: =RC[-1]+1 -> 530052 | E2451: =RC[-1]+1 -> 530053 | F2451: =RC[-1]+1 -> 530054 | G2451: =RC[-1]+1 -> 530055 | K2451: 3
A2452: 530060 | B2452: =RC[-1]+5 -> 530065 | C2452: =RC[-2]+1 -> 530061 | D2452: =RC[-1]+1 -> 530062 | E2452: =RC[-1]+1 -> 530063 | F2452: =RC[-1]+1 -> 530064 | G2452: =RC[-1]+1 -> 530065 | K2452: 3
A2453: 530070 | B2453: =RC[-1]+5 -> 530075 | C2453: =RC[-2]+1 -> 530071 | D2453: =RC[-1]+1 -> 530072 | E2453: =RC[-1]+1 -> 530073 | F2453: =RC[-1]+1 -> 530074 | G2453: =RC[-1]+1 -> 530075 | K2453: 3
A2454: 530080 | B2454: =RC[-1]+5 -> 530085 | C2454: =RC[-2]+1 -> 530081 | D2454: =RC[-1]+1 -> 530082 | E2454: =RC[-1]+1 -> 530083 | F2454: =RC[-1]+1 -> 530084 | G2454: =RC[-1]+1 -> 530085 | K2454: 3
A2455: 531050 | B2455: =RC[-1]+5 -> 531055 | C2455: =RC[-2]+1 -> 531051 | D2455: =RC[-1]+1 -> 531052 | E2455: =RC[-1]+1 -> 531053 | F2455: =RC[-1]+1 -> 531054 | G2455: =RC[-1]+1 -> 531055 | K2455: 3
A2456: 531060 | B2456: =RC[-1]+5 -> 531065 | C2456: =RC[-2]+1 -> 531061 | D2456: =RC[-1]+1 -> 531062 | E2456: =RC[-1]+1 -> 531063 | F2456: =RC[-1]+1 -> 531064 | G2456: =RC[-1]+1 -> 531065 | K2456: 3
A2457: 531070 | B2457: =RC[-1]+5 -> 531075 | C2457: =RC[-2]+1 -> 531071 | D2457: =RC[-1]+1 -> 531072 | E2457: =RC[-1]+1 -> 531073 | F2457: =RC[-1]+1 -> 531074 | G2457: =RC[-1]+1 -> 531075 | K2457: 3
A2458: 531080 | B2458: =RC[-1]+5 -> 531085 | C2458: =RC[-2]+1 -> 531081 | D2458: =RC[-1]+1 -> 531082 | E2458: =RC[-1]+1 -> 531083 | F2458: =RC[-1]+1 -> 531084 | G2458: =RC[-1]+1 -> 531085 | K2458: 3
A2459: 532050 | B2459: =RC[-1]+5 -> 532055 | C2459: =RC[-2]+1 -> 532051 | D2459: =RC[-1]+1 -> 532052 | E2459: =RC[-1]+1 -> 532053 | F2459: =RC[-1]+1 -> 532054 | G2459: =RC[-1]+1 -> 532055 | K2459: 3
A2460: 532060 | B2460: =RC[-1]+5 -> 532065 | C2460: =RC[-2]+1 -> 532061 | D2460: =RC[-1]+1 -> 532062 | E2460: =RC[-1]+1 -> 532063 | F2460: =RC[-1]+1 -> 532064 | G2460: =RC[-1]+1 -> 532065 | K2460: 3
A2461: 532070 | B2461: =RC[-1]+5 -> 532075 | C2461: =RC[-2]+1 -> 532071 | D2461: =RC[-1]+1 -> 532072 | E2461: =RC[-1]+1 -> 532073 | F2461: =RC[-1]+1 -> 532074 | G2461: =RC[-1]+1 -> 532075 | K2461: 3
A2462: 532080 | B2462: =RC[-1]+5 -> 532085 | C2462: =RC[-2]+1 -> 532081 | D2462: =RC[-1]+1 -> 532082 | E2462: =RC[-1]+1 -> 532083 | F2462: =RC[-1]+1 -> 532084 | G2462: =RC[-1]+1 -> 532085 | K2462: 3
A2463: 533050 | B2463: =RC[-1]+5 -> 533055 | C2463: =RC[-2]+1 -> 533051 | D2463: =RC[-1]+1 -> 533052 | E2463: =RC[-1]+1 -> 533053 | F2463: =RC[-1]+1 -> 533054 | G2463: =RC[-1]+1 -> 533055 | K2463: 3
A2464: 533060 | B2464: =RC[-1]+5 -> 533065 | C2464: =RC[-2]+1 -> 533061 | D2464: =RC[-1]+1 -> 533062 | E2464: =RC[-1]+1 -> 533063 | F2464: =RC[-1]+1 -> 533064 | G2464: =RC[-1]+1 -> 533065 | K2464: 3
A2465: 533070 | B2465: =RC[-1]+5 -> 533075 | C2465: =RC[-2]+1 -> 533071 | D2465: =RC[-1]+1 -> 533072 | E2465: =RC[-1]+1 -> 533073 | F2465: =RC[-1]+1 -> 533074 | G2465: =RC[-1]+1 -> 533075 | K2465: 3
A2466: 533080 | B2466: =RC[-1]+5 -> 533085 | C2466: =RC[-2]+1 -> 533081 | D2466: =RC[-1]+1 -> 533082 | E2466: =RC[-1]+1 -> 533083 | F2466: =RC[-1]+1 -> 533084 | G2466: =RC[-1]+1 -> 533085 | K2466: 3
A2467: 534050 | B2467: =RC[-1]+5 -> 534055 | C2467: =RC[-2]+1 -> 534051 | D2467: =RC[-1]+1 -> 534052 | E2467: =RC[-1]+1 -> 534053 | F2467: =RC[-1]+1 -> 534054 | G2467: =RC[-1]+1 -> 534055 | K2467: 3
A2468: 534060 | B2468: =RC[-1]+5 -> 534065 | C2468: =RC[-2]+1 -> 534061 | D2468: =RC[-1]+1 -> 534062 | E2468: =RC[-1]+1 -> 534063 | F2468: =RC[-1]+1 -> 534064 | G2468: =RC[-1]+1 -> 534065 | K2468: 3
A2469: 534070 | B2469: =RC[-1]+5 -> 534075 | C2469: =RC[-2]+1 -> 534071 | D2469: =RC[-1]+1 -> 534072 | E2469: =RC[-1]+1 -> 534073 | F2469: =RC[-1]+1 -> 534074 | G2469: =RC[-1]+1 -> 534075 | K2469: 3
A2470: 534080 | B2470: =RC[-1]+5 -> 534085 | C2470: =RC[-2]+1 -> 534081 | D2470: =RC[-1]+1 -> 534082 | E2470: =RC[-1]+1 -> 534083 | F2470: =RC[-1]+1 -> 534084 | G2470: =RC[-1]+1 -> 534085 | K2470: 3
A2471: 535050 | B2471: =RC[-1]+5 -> 535055 | C2471: =RC[-2]+1 -> 535051 | D2471: =RC[-1]+1 -> 535052 | E2471: =RC[-1]+1 -> 535053 | F2471: =RC[-1]+1 -> 535054 | G2471: =RC[-1]+1 -> 535055 | K2471: 3
A2472: 535060 | B2472: =RC[-1]+5 -> 535065 | C2472: =RC[-2]+1 -> 535061 | D2472: =RC[-1]+1 -> 535062 | E2472: =RC[-1]+1 -> 535063 | F2472: =RC[-1]+1 -> 535064 | G2472: =RC[-1]+1 -> 535065 | K2472: 3
A2473: 535070 | B2473: =RC[-1]+5 -> 535075 | C2473: =RC[-2]+1 -> 535071 | D2473: =RC[-1]+1 -> 535072 | E2473: =RC[-1]+1 -> 535073 | F2473: =RC[-1]+1 -> 535074 | G2473: =RC[-1]+1 -> 535075 | K2473: 3
A2474: 535080 | B2474: =RC[-1]+5 -> 535085 | C2474: =RC[-2]+1 -> 535081 | D2474: =RC[-1]+1 -> 535082 | E2474: =RC[-1]+1 -> 535083 | F2474: =RC[-1]+1 -> 535084 | G2474: =RC[-1]+1 -> 535085 | K2474: 3
A2475: 536050 | B2475: =RC[-1]+5 -> 536055 | C2475: =RC[-2]+1 -> 536051 | D2475: =RC[-1]+1 -> 536052 | E2475: =RC[-1]+1 -> 536053 | F2475: =RC[-1]+1 -> 536054 | G2475: =RC[-1]+1 -> 536055 | K2475: 3
A2476: 536060 | B2476: =RC[-1]+5 -> 536065 | C2476: =RC[-2]+1 -> 536061 | D2476: =RC[-1]+1 -> 536062 | E2476: =RC[-1]+1 -> 536063 | F2476: =RC[-1]+1 -> 536064 | G2476: =RC[-1]+1 -> 536065 | K2476: 3
A2477: 536070 | B2477: =RC[-1]+5 -> 536075 | C2477: =RC[-2]+1 -> 536071 | D2477: =RC[-1]+1 -> 536072 | E2477: =RC[-1]+1 -> 536073 | F2477: =RC[-1]+1 -> 536074 | G2477: =RC[-1]+1 -> 536075 | K2477: 3
A2478: 536080 | B2478: =RC[-1]+5 -> 536085 | C2478: =RC[-2]+1 -> 536081 | D2478: =RC[-1]+1 -> 536082 | E2478: =RC[-1]+1 -> 536083 | F2478: =RC[-1]+1 -> 536084 | G2478: =RC[-1]+1 -> 536085 | K2478: 3
A2479: 537050 | B2479: =RC[-1]+5 -> 537055 | C2479: =RC[-2]+1 -> 537051 | D2479: =RC[-1]+1 -> 537052 | E2479: =RC[-1]+1 -> 537053 | F2479: =RC[-1]+1 -> 537054 | G2479: =RC[-1]+1 -> 537055 | K2479: 3
A2480: 537060 | B2480: =RC[-1]+5 -> 537065 | C2480: =RC[-2]+1 -> 537061 | D2480: =RC[-1]+1 -> 537062 | E2480: =RC[-1]+1 -> 537063 | F2480: =RC[-1]+1 -> 537064 | G2480: =RC[-1]+1 -> 537065 | K2480: 3
A2481: 537070 | B2481: =RC[-1]+5 -> 537075 | C2481: =RC[-2]+1 -> 537071 | D2481: =RC[-1]+1 -> 537072 | E2481: =RC[-1]+1 -> 537073 | F2481: =RC[-1]+1 -> 537074 | G2481: =RC[-1]+1 -> 537075 | K2481: 3
A2482: 537080 | B2482: =RC[-1]+5 -> 537085 | C2482: =RC[-2]+1 -> 537081 | D2482: =RC[-1]+1 -> 537082 | E2482: =RC[-1]+1 -> 537083 | F2482: =RC[-1]+1 -> 537084 | G2482: =RC[-1]+1 -> 537085 | K2482: 3
A2483: 538050 | B2483: =RC[-1]+5 -> 538055 | C2483: =RC[-2]+1 -> 538051 | D2483: =RC[-1]+1 -> 538052 | E2483: =RC[-1]+1 -> 538053 | F2483: =RC[-1]+1 -> 538054 | G2483: =RC[-1]+1 -> 538055 | K2483: 3
A2484: 538060 | B2484: =RC[-1]+5 -> 538065 | C2484: =RC[-2]+1 -> 538061 | D2484: =RC[-1]+1 -> 538062 | E2484: =RC[-1]+1 -> 538063 | F2484: =RC[-1]+1 -> 538064 | G2484: =RC[-1]+1 -> 538065 | K2484: 3
A2485: 538070 | B2485: =RC[-1]+5 -> 538075 | C2485: =RC[-2]+1 -> 538071 | D2485: =RC[-1]+1 -> 538072 | E2485: =RC[-1]+1 -> 538073 | F2485: =RC[-1]+1 -> 538074 | G2485: =RC[-1]+1 -> 538075 | K2485: 3
A2486: 538080 | B2486: =RC[-1]+5 -> 538085 | C2486: =RC[-2]+1 -> 538081 | D2486: =RC[-1]+1 -> 538082 | E2486: =RC[-1]+1 -> 538083 | F2486: =RC[-1]+1 -> 538084 | G2486: =RC[-1]+1 -> 538085 | K2486: 3
A2487: 539050 | B2487: =RC[-1]+5 -> 539055 | C2487: =RC[-2]+1 -> 539051 | D2487: =RC[-1]+1 -> 539052 | E2487: =RC[-1]+1 -> 539053 | F2487: =RC[-1]+1 -> 539054 | G2487: =RC[-1]+1 -> 539055 | K2487: 3
A2488: 539060 | B2488: =RC[-1]+5 -> 539065 | C2488: =RC[-2]+1 -> 539061 | D2488: =RC[-1]+1 -> 539062 | E2488: =RC[-1]+1 -> 539063 | F2488: =RC[-1]+1 -> 539064 | G2488: =RC[-1]+1 -> 539065 | K2488: 3
A2489: 539070 | B2489: =RC[-1]+5 -> 539075 | C2489: =RC[-2]+1 -> 539071 | D2489: =RC[-1]+1 -> 539072 | E2489: =RC[-1]+1 -> 539073 | F2489: =RC[-1]+1 -> 539074 | G2489: =RC[-1]+1 -> 539075 | K2489: 3
A2490: 539080 | B2490: =RC[-1]+5 -> 539085 | C2490: =RC[-2]+1 -> 539081 | D2490: =RC[-1]+1 -> 539082 | E2490: =RC[-1]+1 -> 539083 | F2490: =RC[-1]+1 -> 539084 | G2490: =RC[-1]+1 -> 539085 | K2490: 3
A2491: 540050 | B2491: =RC[-1]+5 -> 540055 | C2491: =RC[-2]+1 -> 540051 | D2491: =RC[-1]+1 -> 540052 | E2491: =RC[-1]+1 -> 540053 | F2491: =RC[-1]+1 -> 540054 | G2491: =RC[-1]+1 -> 540055 | K2491: 3
A2492: 540060 | B2492: =RC[-1]+5 -> 540065 | C2492: =RC[-2]+1 -> 540061 | D2492: =RC[-1]+1 -> 540062 | E2492: =RC[-1]+1 -> 540063 | F2492: =RC[-1]+1 -> 540064 | G2492: =RC[-1]+1 -> 540065 | K2492: 3
A2493: 540070 | B2493: =RC[-1]+5 -> 540075 | C2493: =RC[-2]+1 -> 540071 | D2493: =RC[-1]+1 -> 540072 | E2493: =RC[-1]+1 -> 540073 | F2493: =RC[-1]+1 -> 540074 | G2493: =RC[-1]+1 -> 540075 | K2493: 3
A2494: 540080 | B2494: =RC[-1]+5 -> 540085 | C2494: =RC[-2]+1 -> 540081 | D2494: =RC[-1]+1 -> 540082 | E2494: =RC[-1]+1 -> 540083 | F2494: =RC[-1]+1 -> 540084 | G2494: =RC[-1]+1 -> 540085 | K2494: 3
A2495: 541050 | B2495: =RC[-1]+5 -> 541055 | C2495: =RC[-2]+1 -> 541051 | D2495: =RC[-1]+1 -> 541052 | E2495: =RC[-1]+1 -> 541053 | F2495: =RC[-1]+1 -> 541054 | G2495: =RC[-1]+1 -> 541055 | K2495: 3
A2496: 541060 | B2496: =RC[-1]+5 -> 541065 | C2496: =RC[-2]+1 -> 541061 | D2496: =RC[-1]+1 -> 541062 | E2496: =RC[-1]+1 -> 541063 | F2496: =RC[-1]+1 -> 541064 | G2496: =RC[-1]+1 -> 541065 | K2496: 3
A2497: 541070 | B2497: =RC[-1]+5 -> 541075 | C2497: =RC[-2]+1 -> 541071 | D2497: =RC[-1]+1 -> 541072 | E2497: =RC[-1]+1 -> 541073 | F2497: =RC[-1]+1 -> 541074 | G2497: =RC[-1]+1 -> 541075 | K2497: 3
A2498: 541080 | B2498: =RC[-1]+5 -> 541085 | C2498: =RC[-2]+1 -> 541081 | D2498: =RC[-1]+1 -> 541082 | E2498: =RC[-1]+1 -> 541083 | F2498: =RC[-1]+1 -> 541084 | G2498: =RC[-1]+1 -> 541085 | K2498: 3
A2499: 542050 | B2499: =RC[-1]+5 -> 542055 | C2499: =RC[-2]+1 -> 542051 | D2499: =RC[-1]+1 -> 542052 | E2499: =RC[-1]+1 -> 542053 | F2499: =RC[-1]+1 -> 542054 | G2499: =RC[-1]+1 -> 542055 | K2499: 3
A2500: 542060 | B2500: =RC[-1]+5 -> 542065 | C2500: =RC[-2]+1 -> 542061 | D2500: =RC[-1]+1 -> 542062 | E2500: =RC[-1]+1 -> 542063 | F2500: =RC[-1]+1 -> 542064 | G2500: =RC[-1]+1 -> 542065 | K2500: 3
A2501: 542070 | B2501: =RC[-1]+5 -> 542075 | C2501: =RC[-2]+1 -> 542071 | D2501: =RC[-1]+1 -> 542072 | E2501: =RC[-1]+1 -> 542073 | F2501: =RC[-1]+1 -> 542074 | G2501: =RC[-1]+1 -> 542075 | K2501: 3
A2502: 542080 | B2502: =RC[-1]+5 -> 542085 | C2502: =RC[-2]+1 -> 542081 | D2502: =RC[-1]+1 -> 542082 | E2502: =RC[-1]+1 -> 542083 | F2502: =RC[-1]+1 -> 542084 | G2502: =RC[-1]+1 -> 542085 | K2502: 3
A2503: 543050 | B2503: =RC[-1]+5 -> 543055 | C2503: =RC[-2]+1 -> 543051 | D2503: =RC[-1]+1 -> 543052 | E2503: =RC[-1]+1 -> 543053 | F2503: =RC[-1]+1 -> 543054 | G2503: =RC[-1]+1 -> 543055 | K2503: 3
A2504: 543060 | B2504: =RC[-1]+5 -> 543065 | C2504: =RC[-2]+1 -> 543061 | D2504: =RC[-1]+1 -> 543062 | E2504: =RC[-1]+1 -> 543063 | F2504: =RC[-1]+1 -> 543064 | G2504: =RC[-1]+1 -> 543065 | K2504: 3
A2505: 543070 | B2505: =RC[-1]+5 -> 543075 | C2505: =RC[-2]+1 -> 543071 | D2505: =RC[-1]+1 -> 543072 | E2505: =RC[-1]+1 -> 543073 | F2505: =RC[-1]+1 -> 543074 | G2505: =RC[-1]+1 -> 543075 | K2505: 3
A2506: 543080 | B2506: =RC[-1]+5 -> 543085 | C2506: =RC[-2]+1 -> 543081 | D2506: =RC[-1]+1 -> 543082 | E2506: =RC[-1]+1 -> 543083 | F2506: =RC[-1]+1 -> 543084 | G2506: =RC[-1]+1 -> 543085 | K2506: 3
A2507: 544050 | B2507: =RC[-1]+5 -> 544055 | C2507: =RC[-2]+1 -> 544051 | D2507: =RC[-1]+1 -> 544052 | E2507: =RC[-1]+1 -> 544053 | F2507: =RC[-1]+1 -> 544054 | G2507: =RC[-1]+1 -> 544055 | K2507: 3
A2508: 544060 | B2508: =RC[-1]+5 -> 544065 | C2508: =RC[-2]+1 -> 544061 | D2508: =RC[-1]+1 -> 544062 | E2508: =RC[-1]+1 -> 544063 | F2508: =RC[-1]+1 -> 544064 | G2508: =RC[-1]+1 -> 544065 | K2508: 3
A2509: 544070 | B2509: =RC[-1]+5 -> 544075 | C2509: =RC[-2]+1 -> 544071 | D2509: =RC[-1]+1 -> 544072 | E2509: =RC[-1]+1 -> 544073 | F2509: =RC[-1]+1 -> 544074 | G2509: =RC[-1]+1 -> 544075 | K2509: 3
A2510: 544080 | B2510: =RC[-1]+5 -> 544085 | C2510: =RC[-2]+1 -> 544081 | D2510: =RC[-1]+1 -> 544082 | E2510: =RC[-1]+1 -> 544083 | F2510: =RC[-1]+1 -> 544084 | G2510: =RC[-1]+1 -> 544085 | K2510: 3
A2511: 545050 | B2511: =RC[-1]+5 -> 545055 | C2511: =RC[-2]+1 -> 545051 | D2511: =RC[-1]+1 -> 545052 | E2511: =RC[-1]+1 -> 545053 | F2511: =RC[-1]+1 -> 545054 | G2511: =RC[-1]+1 -> 545055 | K2511: 3
A2512: 545060 | B2512: =RC[-1]+5 -> 545065 | C2512: =RC[-2]+1 -> 545061 | D2512: =RC[-1]+1 -> 545062 | E2512: =RC[-1]+1 -> 545063 | F2512: =RC[-1]+1 -> 545064 | G2512: =RC[-1]+1 -> 545065 | K2512: 3
A2513: 545070 | B2513: =RC[-1]+5 -> 545075 | C2513: =RC[-2]+1 -> 545071 | D2513: =RC[-1]+1 -> 545072 | E2513: =RC[-1]+1 -> 545073 | F2513: =RC[-1]+1 -> 545074 | G2513: =RC[-1]+1 -> 545075 | K2513: 3
A2514: 545080 | B2514: =RC[-1]+5 -> 545085 | C2514: =RC[-2]+1 -> 545081 | D2514: =RC[-1]+1 -> 545082 | E2514: =RC[-1]+1 -> 545083 | F2514: =RC[-1]+1 -> 545084 | G2514: =RC[-1]+1 -> 545085 | K2514: 3
A2515: 546050 | B2515: =RC[-1]+5 -> 546055 | C2515: =RC[-2]+1 -> 546051 | D2515: =RC[-1]+1 -> 546052 | E2515: =RC[-1]+1 -> 546053 | F2515: =RC[-1]+1 -> 546054 | G2515: =RC[-1]+1 -> 546055 | K2515: 3
A2516: 546060 | B2516: =RC[-1]+5 -> 546065 | C2516: =RC[-2]+1 -> 546061 | D2516: =RC[-1]+1 -> 546062 | E2516: =RC[-1]+1 -> 546063 | F2516: =RC[-1]+1 -> 546064 | G2516: =RC[-1]+1 -> 546065 | K2516: 3
A2517: 546070 | B2517: =RC[-1]+5 -> 546075 | C2517: =RC[-2]+1 -> 546071 | D2517: =RC[-1]+1 -> 546072 | E2517: =RC[-1]+1 -> 546073 | F2517: =RC[-1]+1 -> 546074 | G2517: =RC[-1]+1 -> 546075 | K2517: 3
A2518: 546080 | B2518: =RC[-1]+5 -> 546085 | C2518: =RC[-2]+1 -> 546081 | D2518: =RC[-1]+1 -> 546082 | E2518: =RC[-1]+1 -> 546083 | F2518: =RC[-1]+1 -> 546084 | G2518: =RC[-1]+1 -> 546085 | K2518: 3
A2519: 547050 | B2519: =RC[-1]+5 -> 547055 | C2519: =RC[-2]+1 -> 547051 | D2519: =RC[-1]+1 -> 547052 | E2519: =RC[-1]+1 -> 547053 | F2519: =RC[-1]+1 -> 547054 | G2519: =RC[-1]+1 -> 547055 | K2519: 3
A2520: 547060 | B2520: =RC[-1]+5 -> 547065 | C2520: =RC[-2]+1 -> 547061 | D2520: =RC[-1]+1 -> 547062 | E2520: =RC[-1]+1 -> 547063 | F2520: =RC[-1]+1 -> 547064 | G2520: =RC[-1]+1 -> 547065 | K2520: 3
A2521: 547070 | B2521: =RC[-1]+5 -> 547075 | C2521: =RC[-2]+1 -> 547071 | D2521: =RC[-1]+1 -> 547072 | E2521: =RC[-1]+1 -> 547073 | F2521: =RC[-1]+1 -> 547074 | G2521: =RC[-1]+1 -> 547075 | K2521: 3
A2522: 547080 | B2522: =RC[-1]+5 -> 547085 | C2522: =RC[-2]+1 -> 547081 | D2522: =RC[-1]+1 -> 547082 | E2522: =RC[-1]+1 -> 547083 | F2522: =RC[-1]+1 -> 547084 | G2522: =RC[-1]+1 -> 547085 | K2522: 3
A2523: 548050 | B2523: =RC[-1]+5 -> 548055 | C2523: =RC[-2]+1 -> 548051 | D2523: =RC[-1]+1 -> 548052 | E2523: =RC[-1]+1 -> 548053 | F2523: =RC[-1]+1 -> 548054 | G2523: =RC[-1]+1 -> 548055 | K2523: 3
A2524: 548060 | B2524: =RC[-1]+5 -> 548065 | C2524: =RC[-2]+1 -> 548061 | D2524: =RC[-1]+1 -> 548062 | E2524: =RC[-1]+1 -> 548063 | F2524: =RC[-1]+1 -> 548064 | G2524: =RC[-1]+1 -> 548065 | K2524: 3
A2525: 548070 | B2525: =RC[-1]+5 -> 548075 | C2525: =RC[-2]+1 -> 548071 | D2525: =RC[-1]+1 -> 548072 | E2525: =RC[-1]+1 -> 548073 | F2525: =RC[-1]+1 -> 548074 | G2525: =RC[-1]+1 -> 548075 | K2525: 3
A2526: 548080 | B2526: =RC[-1]+5 -> 548085 | C2526: =RC[-2]+1 -> 548081 | D2526: =RC[-1]+1 -> 548082 | E2526: =RC[-1]+1 -> 548083 | F2526: =RC[-1]+1 -> 548084 | G2526: =RC[-1]+1 -> 548085 | K2526: 3
A2527: 549050 | B2527: =RC[-1]+5 -> 549055 | C2527: =RC[-2]+1 -> 549051 | D2527: =RC[-1]+1 -> 549052 | E2527: =RC[-1]+1 -> 549053 | F2527: =RC[-1]+1 -> 549054 | G2527: =RC[-1]+1 -> 549055 | K2527: 3
A2528: 549060 | B2528: =RC[-1]+5 -> 549065 | C2528: =RC[-2]+1 -> 549061 | D2528: =RC[-1]+1 -> 549062 | E2528: =RC[-1]+1 -> 549063 | F2528: =RC[-1]+1 -> 549064 | G2528: =RC[-1]+1 -> 549065 | K2528: 3
A2529: 549070 | B2529: =RC[-1]+5 -> 549075 | C2529: =RC[-2]+1 -> 549071 | D2529: =RC[-1]+1 -> 549072 | E2529: =RC[-1]+1 -> 549073 | F2529: =RC[-1]+1 -> 549074 | G2529: =RC[-1]+1 -> 549075 | K2529: 3
A2530: 549080 | B2530: =RC[-1]+5 -> 549085 | C2530: =RC[-2]+1 -> 549081 | D2530: =RC[-1]+1 -> 549082 | E2530: =RC[-1]+1 -> 549083 | F2530: =RC[-1]+1 -> 549084 | G2530: =RC[-1]+1 -> 549085 | K2530: 3
A2531: 550050 | B2531: =RC[-1]+5 -> 550055 | C2531: =RC[-2]+1 -> 550051 | D2531: =RC[-1]+1 -> 550052 | E2531: =RC[-1]+1 -> 550053 | F2531: =RC[-1]+1 -> 550054 | G2531: =RC[-1]+1 -> 550055 | K2531: 3
A2532: 550060 | B2532: =RC[-1]+5 -> 550065 | C2532: =RC[-2]+1 -> 550061 | D2532: =RC[-1]+1 -> 550062 | E2532: =RC[-1]+1 -> 550063 | F2532: =RC[-1]+1 -> 550064 | G2532: =RC[-1]+1 -> 550065 | K2532: 3
A2533: 550070 | B2533: =RC[-1]+5 -> 550075 | C2533: =RC[-2]+1 -> 550071 | D2533: =RC[-1]+1 -> 550072 | E2533: =RC[-1]+1 -> 550073 | F2533: =RC[-1]+1 -> 550074 | G2533: =RC[-1]+1 -> 550075 | K2533: 3
A2534: 550080 | B2534: =RC[-1]+5 -> 550085 | C2534: =RC[-2]+1 -> 550081 | D2534: =RC[-1]+1 -> 550082 | E2534: =RC[-1]+1 -> 550083 | F2534: =RC[-1]+1 -> 550084 | G2534: =RC[-1]+1 -> 550085 | K2534: 3
A2535: 101010 | B2535: 100000 | C2535: 100000 | D2535: 100001 | E2535: 0 | F2535: 0 | G2535: 0 | J2535: =IF(MOD(RC[-9],10)=2,3,"") ->  | K2535: 3 | L2535: 主线战役 | M2535: 1 | N2535: 死亡武士 | P2535: =COUNTIF(RC[-13]:RC[-9],"<>"&0) -> 2 | Q2535: 1
A2536: 101020 | B2536: 100012 | C2536: 100012 | D2536: 100010 | E2536: 100011 | F2536: 0 | G2536: 0 | I2536: 0.1 | J2536: 3 | K2536: 3 | M2536: 2 | N2536: 半人马 | P2536: =COUNTIF(RC[-13]:RC[-9],"<>"&0) -> 3 | Q2536: 2
A2537: 102010 | B2537: 100100 | C2537: 100100 | D2537: 100101 | E2537: 100101 | F2537: 0 | G2537: 0 | J2537: =IF(MOD(RC[-9],10)=2,3,"") ->  | K2537: 3 | M2537: 3 | P2537: =COUNTIF(RC[-13]:RC[-9],"<>"&0) -> 3 | Q2537: 3
A2538: 102020 | B2538: 100111 | C2538: 100110 | D2538: 100110 | E2538: 100111 | F2538: 0 | G2538: 0 | J2538: =IF(MOD(RC[-9],10)=2,3,"") ->  | K2538: 3 | M2538: 3 | N2538: 亚马逊女王 | P2538: =COUNTIF(RC[-13]:RC[-9],"<>"&0) -> 3 | Q2538: 3
A2539: 102030 | B2539: 100120 | C2539: 100120 | D2539: 100120 | E2539: 100121 | F2539: 0 | G2539: 0 | J2539: =IF(MOD(RC[-9],10)=2,3,"") ->  | K2539: 3 | M2539: 3 | P2539: =COUNTIF(RC[-13]:RC[-9],"<>"&0) -> 3 | Q2539: 3
A2540: 102040 | B2540: 100132 | C2540: 100130 | D2540: 100131 | E2540: 100132 | F2540: 0 | G2540: 0 | I2540: 0.1 | J2540: 3 | K2540: 3 | M2540: 3 | N2540: 食人魔 | P2540: =COUNTIF(RC[-13]:RC[-9],"<>"&0) -> 3 | Q2540: 3
A2541: 103010 | B2541: 100200 | C2541: 100200 | D2541: 100200 | E2541: 100201 | F2541: 0 | G2541: 0 | J2541: =IF(MOD(RC[-9],10)=2,3,"") ->  | K2541: 3 | M2541: 3 | P2541: =COUNTIF(RC[-13]:RC[-9],"<>"&0) -> 3 | Q2541: 3
A2542: 103020 | B2542: 100211 | C2542: 100210 | D2542: 100211 | E2542: 100211 | F2542: 0 | G2542: 0 | J2542: =IF(MOD(RC[-9],10)=2,3,"") ->  | K2542: 3 | M2542: 3 | P2542: =COUNTIF(RC[-13]:RC[-9],"<>"&0) -> 3 | Q2542: 3
A2543: 103030 | B2543: 100222 | C2543: 100222 | D2543: 100221 | E2543: 100220 | F2543: 0 | G2543: 0 | J2543: =IF(MOD(RC[-9],10)=2,3,"") ->  | K2543: 3 | M2543: 3 | N2543: 杰克船长 | P2543: =COUNTIF(RC[-13]:RC[-9],"<>"&0) -> 3 | Q2543: 3
A2544: 103040 | B2544: 100230 | C2544: 100230 | D2544: 100231 | E2544: 100231 | F2544: 0 | G2544: 0 | J2544: =IF(MOD(RC[-9],10)=2,3,"") ->  | K2544: 3 | M2544: 3 | P2544: =COUNTIF(RC[-13]:RC[-9],"<>"&0) -> 3 | Q2544: 3
A2545: 103050 | B2545: 100240 | C2545: 100240 | D2545: 100240 | E2545: 100241 | F2545: 0 | G2545: 0 | J2545: =IF(MOD(RC[-9],10)=2,3,"") ->  | K2545: 3 | M2545: 3 | P2545: =COUNTIF(RC[-13]:RC[-9],"<>"&0) -> 3 | Q2545: 3
A2546: 103060 | B2546: 100250 | C2546: 100250 | D2546: 100251 | E2546: 0 | F2546: 0 | G2546: 0 | J2546: =IF(MOD(RC[-9],10)=2,3,"") ->  | K2546: 3 | M2546: 2 | P2546: =COUNTIF(RC[-13]:RC[-9],"<>"&0) -> 2 | Q2546: 2
A2547: 103061 | B2547: 100253 | C2547: 100253 | D2547: 100252 | E2547: 0 | F2547: 0 | G2547: 0 | I2547: 0.1 | J2547: 3 | K2547: 3 | M2547: 2 | N2547: 基伦 | P2547: =COUNTIF(RC[-13]:RC[-9],"<>"&0) -> 2 | Q2547: 2
A2548: 104010 | B2548: 100300 | C2548: 100300 | D2548: 100300 | E2548: 100300 | F2548: 0 | G2548: 0 | J2548: =IF(MOD(RC[-9],10)=2,3,"") ->  | K2548: 3 | M2548: 3 | P2548: =COUNTIF(RC[-13]:RC[-9],"<>"&0) -> 3 | Q2548: 3
A2549: 104020 | B2549: 100311 | C2549: 100311 | D2549: 100310 | E2549: 100310 | F2549: 0 | G2549: 0 | J2549: =IF(MOD(RC[-9],10)=2,3,"") ->  | K2549: 3 | M2549: 3 | N2549: 半人马 | P2549: =COUNTIF(RC[-13]:RC[-9],"<>"&0) -> 3 | Q2549: 3
A2550: 104030 | B2550: 100320 | C2550: 100320 | D2550: 100321 | E2550: 100322 | F2550: 0 | G2550: 0 | J2550: =IF(MOD(RC[-9],10)=2,3,"") ->  | K2550: 3 | M2550: 3 | P2550: =COUNTIF(RC[-13]:RC[-9],"<>"&0) -> 3 | Q2550: 3
A2551: 104040 | B2551: 100332 | C2551: 100330 | D2551: 100331 | E2551: 100332 | F2551: 0 | G2551: 0 | J2551: =IF(MOD(RC[-9],10)=2,3,"") ->  | K2551: 3 | M2551: 3 | N2551: 女警 | P2551: =COUNTIF(RC[-13]:RC[-9],"<>"&0) -> 3 | Q2551: 3
A2552: 104050 | B2552: 100340 | C2552: 100340 | D2552: 100340 | E2552: 100341 | F2552: 0 | G2552: 0 | J2552: =IF(MOD(RC[-9],10)=2,3,"") ->  | K2552: 3 | M2552: 3 | P2552: =COUNTIF(RC[-13]:RC[-9],"<>"&0) -> 3 | Q2552: 3
A2553: 104060 | B2553: 100351 | C2553: 100350 | D2553: 100351 | E2553: 100352 | F2553: 0 | G2553: 0 | J2553: =IF(MOD(RC[-9],10)=2,3,"") ->  | K2553: 3 | M2553: 3 | P2553: =COUNTIF(RC[-13]:RC[-9],"<>"&0) -> 3 | Q2553: 3
A2554: 104070 | B2554: 100362 | C2554: 100360 | D2554: 100360 | E2554: 100361 | F2554: 100362 | G2554: 0 | J2554: =IF(MOD(RC[-9],10)=2,3,"") ->  | K2554: 3 | M2554: 4 | N2554: 致命特工 | P2554: =COUNTIF(RC[-13]:RC[-9],"<>"&0) -> 4 | Q2554: 4
A2555: 104080 | B2555: 100370 | C2555: 100370 | D2555: 100370 | E2555: 100371 | F2555: 0 | G2555: 0 | J2555: =IF(MOD(RC[-9],10)=2,3,"") ->  | K2555: 3 | M2555: 3 | P2555: =COUNTIF(RC[-13]:RC[-9],"<>"&0) -> 3 | Q2555: 3
A2556: 104081 | B2556: 100372 | C2556: 100370 | D2556: 100371 | E2556: 100372 | F2556: 0 | G2556: 0 | I2556: 0.1 | J2556: 3 | K2556: 3 | M2556: 3 | N2556: 天使长 | P2556: =COUNTIF(RC[-13]:RC[-9],"<>"&0) -> 3 | Q2556: 3
A2557: 105010 | B2557: 100400 | C2557: 100400 | D2557: 100400 | E2557: 100401 | F2557: 100401 | G2557: 0 | J2557: =IF(MOD(RC[-9],10)=2,3,"") ->  | K2557: 3 | P2557: =COUNTIF(RC[-13]:RC[-9],"<>"&0) -> 4 | Q2557: 4
A2558: 105020 | B2558: 100411 | C2558: 100410 | D2558: 100410 | E2558: 100411 | F2558: 100411 | G2558: 0 | J2558: =IF(MOD(RC[-9],10)=2,3,"") ->  | K2558: 3 | P2558: =COUNTIF(RC[-13]:RC[-9],"<>"&0) -> 4 | Q2558: 4
A2559: 105030 | B2559: 100420 | C2559: 100420 | D2559: 100420 | E2559: 100421 | F2559: 0 | G2559: 0 | J2559: =IF(MOD(RC[-9],10)=2,3,"") ->  | K2559: 3 | P2559: =COUNTIF(RC[-13]:RC[-9],"<>"&0) -> 3 | Q2559: 3
A2560: 105031 | B2560: 100422 | C2560: 100422 | D2560: 100420 | E2560: 100421 | F2560: 0 | G2560: 0 | J2560: =IF(MOD(RC[-9],10)=2,3,"") ->  | K2560: 3 | N2560: 血源牧师 | P2560: =COUNTIF(RC[-13]:RC[-9],"<>"&0) -> 3 | Q2560: 3
A2561: 105040 | B2561: 100430 | C2561: 100430 | D2561: 100430 | E2561: 100431 | F2561: 100431 | G2561: 0 | J2561: =IF(MOD(RC[-9],10)=2,3,"") ->  | K2561: 3 | P2561: =COUNTIF(RC[-13]:RC[-9],"<>"&0) -> 4 | Q2561: 4
A2562: 105050 | B2562: 100440 | C2562: 100440 | D2562: 100441 | E2562: 100441 | F2562: 100441 | G2562: 0 | J2562: =IF(MOD(RC[-9],10)=2,3,"") ->  | K2562: 3 | P2562: =COUNTIF(RC[-13]:RC[-9],"<>"&0) -> 4 | Q2562: 4
A2563: 105060 | B2563: 100450 | C2563: 100450 | D2563: 100450 | E2563: 100451 | F2563: 0 | G2563: 0 | J2563: =IF(MOD(RC[-9],10)=2,3,"") ->  | K2563: 3 | P2563: =COUNTIF(RC[-13]:RC[-9],"<>"&0) -> 3 | Q2563: 3
A2564: 105061 | B2564: 100453 | C2564: 100453 | D2564: 100452 | E2564: 100450 | F2564: 0 | G2564: 0 | J2564: =IF(MOD(RC[-9],10)=2,3,"") ->  | K2564: 3 | N2564: 德古拉伯爵 | P2564: =COUNTIF(RC[-13]:RC[-9],"<>"&0) -> 3 | Q2564: 3
A2565: 105070 | B2565: 100462 | C2565: 100460 | D2565: 100461 | E2565: 100462 | F2565: 100462 | G2565: 0 | J2565: =IF(MOD(RC[-9],10)=2,3,"") ->  | K2565: 3 | P2565: =COUNTIF(RC[-13]:RC[-9],"<>"&0) -> 4 | Q2565: 4
A2566: 105080 | B2566: 100470 | C2566: 100470 | D2566: 100470 | E2566: 100470 | F2566: 100471 | G2566: 0 | J2566: =IF(MOD(RC[-9],10)=2,3,"") ->  | K2566: 3 | P2566: =COUNTIF(RC[-13]:RC[-9],"<>"&0) -> 4 | Q2566: 4
A2567: 105090 | B2567: 100480 | C2567: 100480 | D2567: 100481 | E2567: 100482 | F2567: 0 | G2567: 0 | J2567: =IF(MOD(RC[-9],10)=2,3,"") ->  | K2567: 3 | P2567: =COUNTIF(RC[-13]:RC[-9],"<>"&0) -> 3 | Q2567: 3
A2568: 105091 | B2568: 100483 | C2568: 100483 | D2568: 100480 | E2568: 100482 | F2568: 0 | G2568: 0 | J2568: =IF(MOD(RC[-9],10)=2,3,"") ->  | K2568: 3 | N2568: 混沌女巫 | P2568: =COUNTIF(RC[-13]:RC[-9],"<>"&0) -> 3 | Q2568: 3
A2569: 105100 | B2569: 100490 | C2569: 100490 | D2569: 100491 | E2569: 100492 | F2569: 0 | G2569: 0 | J2569: =IF(MOD(RC[-9],10)=2,3,"") ->  | K2569: 3 | P2569: =COUNTIF(RC[-13]:RC[-9],"<>"&0) -> 3 | Q2569: 3
A2570: 105101 | B2570: 100494 | C2570: 100494 | D2570: 100493 | E2570: 100490 | F2570: 0 | G2570: 0 | I2570: 0.1 | J2570: 3 | K2570: 3 | N2570: 红骷髅 | P2570: =COUNTIF(RC[-13]:RC[-9],"<>"&0) -> 3 | Q2570: 3
A2571: 106010 | B2571: 100500 | C2571: 100500 | D2571: 100500 | E2571: 100501 | F2571: 100501 | G2571: 0 | J2571: =IF(MOD(RC[-9],10)=2,3,"") ->  | K2571: 3 | P2571: =COUNTIF(RC[-13]:RC[-9],"<>"&0) -> 4 | Q2571: 4
A2572: 106020 | B2572: 100510 | C2572: 100510 | D2572: 100510 | E2572: 100511 | F2572: 100512 | G2572: 0 | J2572: =IF(MOD(RC[-9],10)=2,3,"") ->  | K2572: 3 | P2572: =COUNTIF(RC[-13]:RC[-9],"<>"&0) -> 4 | Q2572: 4
A2573: 106030 | B2573: 100520 | C2573: 100520 | D2573: 100521 | E2573: 100522 | F2573: 0 | G2573: 0 | J2573: =IF(MOD(RC[-9],10)=2,3,"") ->  | K2573: 3 | P2573: =COUNTIF(RC[-13]:RC[-9],"<>"&0) -> 3 | Q2573: 3
A2574: 106031 | B2574: 100523 | C2574: 100523 | D2574: 100520 | E2574: 100522 | F2574: 0 | G2574: 0 | J2574: =IF(MOD(RC[-9],10)=2,3,"") ->  | K2574: 3 | N2574: 鹰眸 | P2574: =COUNTIF(RC[-13]:RC[-9],"<>"&0) -> 3 | Q2574: 3
A2575: 106040 | B2575: 100530 | C2575: 100530 | D2575: 100530 | E2575: 100531 | F2575: 100532 | G2575: 0 | J2575: =IF(MOD(RC[-9],10)=2,3,"") ->  | K2575: 3 | P2575: =COUNTIF(RC[-13]:RC[-9],"<>"&0) -> 4 | Q2575: 4
A2576: 106050 | B2576: 100540 | C2576: 100540 | D2576: 100541 | E2576: 100541 | F2576: 100542 | G2576: 0 | J2576: =IF(MOD(RC[-9],10)=2,3,"") ->  | K2576: 3 | P2576: =COUNTIF(RC[-13]:RC[-9],"<>"&0) -> 4 | Q2576: 4
A2577: 106060 | B2577: 100551 | C2577: 100550 | D2577: 100551 | E2577: 100552 | F2577: 0 | G2577: 0 | J2577: =IF(MOD(RC[-9],10)=2,3,"") ->  | K2577: 3 | P2577: =COUNTIF(RC[-13]:RC[-9],"<>"&0) -> 3 | Q2577: 3
A2578: 106061 | B2578: 100553 | C2578: 100553 | D2578: 100550 | E2578: 100551 | F2578: 0 | G2578: 0 | J2578: =IF(MOD(RC[-9],10)=2,3,"") ->  | K2578: 3 | N2578: 死亡武士 | P2578: =COUNTIF(RC[-13]:RC[-9],"<>"&0) -> 3 | Q2578: 3
A2579: 106070 | B2579: 100561 | C2579: 100560 | D2579: 100560 | E2579: 100561 | F2579: 100561 | G2579: 0 | J2579: =IF(MOD(RC[-9],10)=2,3,"") ->  | K2579: 3 | P2579: =COUNTIF(RC[-13]:RC[-9],"<>"&0) -> 4 | Q2579: 4
A2580: 106080 | B2580: 100570 | C2580: 100570 | D2580: 100570 | E2580: 100571 | F2580: 100572 | G2580: 0 | J2580: =IF(MOD(RC[-9],10)=2,3,"") ->  | K2580: 3 | P2580: =COUNTIF(RC[-13]:RC[-9],"<>"&0) -> 4 | Q2580: 4
A2581: 106090 | B2581: 100580 | C2581: 100580 | D2581: 100581 | E2581: 100582 | F2581: 0 | G2581: 0 | J2581: =IF(MOD(RC[-9],10)=2,3,"") ->  | K2581: 3 | P2581: =COUNTIF(RC[-13]:RC[-9],"<>"&0) -> 3 | Q2581: 3
A2582: 106091 | B2582: 100583 | C2582: 100583 | D2582: 100580 | E2582: 100582 | F2582: 0 | G2582: 0 | J2582: =IF(MOD(RC[-9],10)=2,3,"") ->  | K2582: 3 | N2582: 白凤凰 | P2582: =COUNTIF(RC[-13]:RC[-9],"<>"&0) -> 3 | Q2582: 3
A2583: 106100 | B2583: 100590 | C2583: 100590 | D2583: 100590 | E2583: 100592 | F2583: 0 | G2583: 0 | J2583: =IF(MOD(RC[-9],10)=2,3,"") ->  | K2583: 3 | P2583: =COUNTIF(RC[-13]:RC[-9],"<>"&0) -> 3 | Q2583: 3
A2584: 106101 | B2584: 100593 | C2584: 100593 | D2584: 100590 | E2584: 100591 | F2584: 0 | G2584: 0 | I2584: 0.1 | J2584: 3 | K2584: 3 | N2584: 超级队长 | P2584: =COUNTIF(RC[-13]:RC[-9],"<>"&0) -> 3 | Q2584: 3
A2585: 107010 | B2585: 100600 | C2585: 100600 | D2585: 100600 | E2585: 100600 | F2585: 100600 | G2585: 0 | J2585: =IF(MOD(RC[-9],10)=2,3,"") ->  | K2585: 3 | P2585: =COUNTIF(RC[-13]:RC[-9],"<>"&0) -> 4 | Q2585: 4
A2586: 107020 | B2586: 100610 | C2586: 100610 | D2586: 100610 | E2586: 100611 | F2586: 100611 | G2586: 0 | J2586: =IF(MOD(RC[-9],10)=2,3,"") ->  | K2586: 3 | P2586: =COUNTIF(RC[-13]:RC[-9],"<>"&0) -> 4 | Q2586: 4
A2587: 107030 | B2587: 100620 | C2587: 100620 | D2587: 100620 | E2587: 100621 | F2587: 0 | G2587: 0 | J2587: =IF(MOD(RC[-9],10)=2,3,"") ->  | K2587: 3 | P2587: =COUNTIF(RC[-13]:RC[-9],"<>"&0) -> 3 | Q2587: 3
A2588: 107031 | B2588: 100622 | C2588: 100622 | D2588: 100620 | E2588: 100621 | F2588: 0 | G2588: 0 | J2588: =IF(MOD(RC[-9],10)=2,3,"") ->  | K2588: 3 | N2588: 石头人 | P2588: =COUNTIF(RC[-13]:RC[-9],"<>"&0) -> 3 | Q2588: 3
A2589: 107040 | B2589: 100630 | C2589: 100630 | D2589: 100630 | E2589: 100631 | F2589: 100631 | G2589: 0 | J2589: =IF(MOD(RC[-9],10)=2,3,"") ->  | K2589: 3 | P2589: =COUNTIF(RC[-13]:RC[-9],"<>"&0) -> 4 | Q2589: 4
A2590: 107050 | B2590: 100640 | C2590: 100640 | D2590: 100640 | E2590: 100640 | F2590: 100640 | G2590: 0 | J2590: =IF(MOD(RC[-9],10)=2,3,"") ->  | K2590: 3 | P2590: =COUNTIF(RC[-13]:RC[-9],"<>"&0) -> 4 | Q2590: 4
A2591: 107060 | B2591: 100650 | C2591: 100650 | D2591: 100651 | E2591: 100652 | F2591: 0 | G2591: 0 | J2591: =IF(MOD(RC[-9],10)=2,3,"") ->  | K2591: 3 | P2591: =COUNTIF(RC[-13]:RC[-9],"<>"&0) -> 3 | Q2591: 3
A2592: 107061 | B2592: 100653 | C2592: 100653 | D2592: 100650 | E2592: 100651 | F2592: 0 | G2592: 0 | J2592: =IF(MOD(RC[-9],10)=2,3,"") ->  | K2592: 3 | N2592: 佐罗 | P2592: =COUNTIF(RC[-13]:RC[-9],"<>"&0) -> 3 | Q2592: 3
A2593: 107070 | B2593: 100661 | C2593: 100660 | D2593: 100660 | E2593: 100661 | F2593: 100661 | G2593: 0 | J2593: =IF(MOD(RC[-9],10)=2,3,"") ->  | K2593: 3 | P2593: =COUNTIF(RC[-13]:RC[-9],"<>"&0) -> 4 | Q2593: 4
A2594: 107080 | B2594: 100672 | C2594: 100670 | D2594: 100670 | E2594: 100671 | F2594: 100672 | G2594: 0 | J2594: =IF(MOD(RC[-9],10)=2,3,"") ->  | K2594: 3 | P2594: =COUNTIF(RC[-13]:RC[-9],"<>"&0) -> 4 | Q2594: 4
A2595: 107090 | B2595: 100680 | C2595: 100680 | D2595: 100680 | E2595: 100681 | F2595: 0 | G2595: 0 | J2595: =IF(MOD(RC[-9],10)=2,3,"") ->  | K2595: 3 | P2595: =COUNTIF(RC[-13]:RC[-9],"<>"&0) -> 3 | Q2595: 3
A2596: 107091 | B2596: 100682 | C2596: 100682 | D2596: 100680 | E2596: 100681 | F2596: 0 | G2596: 0 | J2596: =IF(MOD(RC[-9],10)=2,3,"") ->  | K2596: 3 | N2596: 斯巴达 | P2596: =COUNTIF(RC[-13]:RC[-9],"<>"&0) -> 3 | Q2596: 3
A2597: 107100 | B2597: 100690 | C2597: 100690 | D2597: 100691 | E2597: 100692 | F2597: 0 | G2597: 0 | J2597: =IF(MOD(RC[-9],10)=2,3,"") ->  | K2597: 3 | P2597: =COUNTIF(RC[-13]:RC[-9],"<>"&0) -> 3 | Q2597: 3
A2598: 107101 | B2598: 100693 | C2598: 100693 | D2598: 100691 | E2598: 100692 | F2598: 0 | G2598: 0 | J2598: =IF(MOD(RC[-9],10)=2,3,"") ->  | K2598: 3 | P2598: =COUNTIF(RC[-13]:RC[-9],"<>"&0) -> 3 | Q2598: 3
A2599: 107102 | B2599: 100695 | C2599: 100695 | D2599: 100694 | E2599: 100692 | F2599: 0 | G2599: 0 | I2599: 0.1 | J2599: =IF(MOD(RC[-9],10)=2,3,"") -> 3 | K2599: 3 | N2599: 贞德 | P2599: =COUNTIF(RC[-13]:RC[-9],"<>"&0) -> 3 | Q2599: 3
A2600: 108010 | B2600: 100700 | C2600: 100700 | D2600: 100700 | E2600: 100700 | F2600: 100701 | G2600: 0 | J2600: =IF(MOD(RC[-9],10)=2,3,"") ->  | K2600: 3 | P2600: =COUNTIF(RC[-13]:RC[-9],"<>"&0) -> 4 | Q2600: 4
A2601: 108020 | B2601: 100710 | C2601: 100710 | D2601: 100710 | E2601: 100711 | F2601: 100712 | G2601: 0 | J2601: =IF(MOD(RC[-9],10)=2,3,"") ->  | K2601: 3 | P2601: =COUNTIF(RC[-13]:RC[-9],"<>"&0) -> 4 | Q2601: 4
A2602: 108030 | B2602: 100720 | C2602: 100720 | D2602: 100721 | E2602: 100722 | F2602: 0 | G2602: 0 | J2602: =IF(MOD(RC[-9],10)=2,3,"") ->  | K2602: 3 | P2602: =COUNTIF(RC[-13]:RC[-9],"<>"&0) -> 3 | Q2602: 3
A2603: 108031 | B2603: 100723 | C2603: 100723 | D2603: 100720 | E2603: 100722 | F2603: 0 | G2603: 0 | J2603: =IF(MOD(RC[-9],10)=2,3,"") ->  | K2603: 3 | N2603: 食人魔 | P2603: =COUNTIF(RC[-13]:RC[-9],"<>"&0) -> 3 | Q2603: 3
A2604: 108040 | B2604: 100731 | C2604: 100730 | D2604: 100730 | E2604: 100731 | F2604: 100731 | G2604: 0 | J2604: =IF(MOD(RC[-9],10)=2,3,"") ->  | K2604: 3 | P2604: =COUNTIF(RC[-13]:RC[-9],"<>"&0) -> 4 | Q2604: 4
A2605: 108050 | B2605: 100740 | C2605: 100740 | D2605: 100740 | E2605: 100740 | F2605: 100741 | G2605: 0 | J2605: =IF(MOD(RC[-9],10)=2,3,"") ->  | K2605: 3 | P2605: =COUNTIF(RC[-13]:RC[-9],"<>"&0) -> 4 | Q2605: 4
A2606: 108060 | B2606: 100750 | C2606: 100750 | D2606: 100751 | E2606: 100752 | F2606: 0 | G2606: 0 | J2606: =IF(MOD(RC[-9],10)=2,3,"") ->  | K2606: 3 | P2606: =COUNTIF(RC[-13]:RC[-9],"<>"&0) -> 3 | Q2606: 3
A2607: 108061 | B2607: 100753 | C2607: 100753 | D2607: 100750 | E2607: 100752 | F2607: 0 | G2607: 0 | J2607: =IF(MOD(RC[-9],10)=2,3,"") ->  | K2607: 3 | N2607: 杰克船长 | P2607: =COUNTIF(RC[-13]:RC[-9],"<>"&0) -> 3 | Q2607: 3
A2608: 108070 | B2608: 100761 | C2608: 100760 | D2608: 100761 | E2608: 100761 | F2608: 100762 | G2608: 0 | J2608: =IF(MOD(RC[-9],10)=2,3,"") ->  | K2608: 3 | P2608: =COUNTIF(RC[-13]:RC[-9],"<>"&0) -> 4 | Q2608: 4
A2609: 108080 | B2609: 100771 | C2609: 100770 | D2609: 100771 | E2609: 100771 | F2609: 100772 | G2609: 0 | J2609: =IF(MOD(RC[-9],10)=2,3,"") ->  | K2609: 3 | P2609: =COUNTIF(RC[-13]:RC[-9],"<>"&0) -> 4 | Q2609: 4
A2610: 108090 | B2610: 100780 | C2610: 100780 | D2610: 100780 | E2610: 100781 | F2610: 0 | G2610: 0 | J2610: =IF(MOD(RC[-9],10)=2,3,"") ->  | K2610: 3 | P2610: =COUNTIF(RC[-13]:RC[-9],"<>"&0) -> 3 | Q2610: 3
A2611: 108091 | B2611: 100783 | C2611: 100783 | D2611: 100781 | E2611: 100782 | F2611: 0 | G2611: 0 | J2611: =IF(MOD(RC[-9],10)=2,3,"") ->  | K2611: 3 | N2611: 牛头人 | P2611: =COUNTIF(RC[-13]:RC[-9],"<>"&0) -> 3 | Q2611: 3
A2612: 108100 | B2612: 100790 | C2612: 100790 | D2612: 100791 | E2612: 100792 | F2612: 0 | G2612: 0 | J2612: =IF(MOD(RC[-9],10)=2,3,"") ->  | K2612: 3 | P2612: =COUNTIF(RC[-13]:RC[-9],"<>"&0) -> 3 | Q2612: 3
A2613: 108101 | B2613: 100790 | C2613: 100790 | D2613: 100793 | E2613: 100791 | F2613: 0 | G2613: 0 | J2613: =IF(MOD(RC[-9],10)=2,3,"") ->  | K2613: 3 | P2613: =COUNTIF(RC[-13]:RC[-9],"<>"&0) -> 3 | Q2613: 3
A2614: 108102 | B2614: 100794 | C2614: 100794 | D2614: 100790 | E2614: 100792 | F2614: 0 | G2614: 0 | I2614: 0.1 | J2614: =IF(MOD(RC[-9],10)=2,3,"") -> 3 | K2614: 3 | N2614: 阿努比斯 | P2614: =COUNTIF(RC[-13]:RC[-9],"<>"&0) -> 3 | Q2614: 3
A2615: 109010 | B2615: 100800 | C2615: 100800 | D2615: 100800 | E2615: 100801 | F2615: 100802 | G2615: 100802 | J2615: =IF(MOD(RC[-9],10)=2,3,"") ->  | K2615: 3 | P2615: =COUNTIF(RC[-13]:RC[-9],"<>"&0) -> 5 | Q2615: 5
A2616: 109020 | B2616: 100810 | C2616: 100810 | D2616: 100810 | E2616: 100810 | F2616: 100811 | G2616: 100811 | J2616: =IF(MOD(RC[-9],10)=2,3,"") ->  | K2616: 3 | P2616: =COUNTIF(RC[-13]:RC[-9],"<>"&0) -> 5 | Q2616: 5
A2617: 109030 | B2617: 100820 | C2617: 100820 | D2617: 100821 | E2617: 100821 | F2617: 100822 | G2617: 0 | J2617: =IF(MOD(RC[-9],10)=2,3,"") ->  | K2617: 3 | P2617: =COUNTIF(RC[-13]:RC[-9],"<>"&0) -> 4 | Q2617: 4
A2618: 109031 | B2618: 100823 | C2618: 100823 | D2618: 100820 | E2618: 100821 | F2618: 100822 | G2618: 0 | J2618: =IF(MOD(RC[-9],10)=2,3,"") ->  | K2618: 3 | N2618: 致命特工 | P2618: =COUNTIF(RC[-13]:RC[-9],"<>"&0) -> 4 | Q2618: 4
A2619: 109040 | B2619: 100830 | C2619: 100830 | D2619: 100830 | E2619: 100830 | F2619: 100831 | G2619: 100831 | J2619: =IF(MOD(RC[-9],10)=2,3,"") ->  | K2619: 3 | P2619: =COUNTIF(RC[-13]:RC[-9],"<>"&0) -> 5 | Q2619: 5
A2620: 109050 | B2620: 100840 | C2620: 100840 | D2620: 100840 | E2620: 100840 | F2620: 100841 | G2620: 100842 | J2620: =IF(MOD(RC[-9],10)=2,3,"") ->  | K2620: 3 | P2620: =COUNTIF(RC[-13]:RC[-9],"<>"&0) -> 5 | Q2620: 5
A2621: 109060 | B2621: 100850 | C2621: 100850 | D2621: 100853 | E2621: 100852 | F2621: 100851 | G2621: 0 | J2621: =IF(MOD(RC[-9],10)=2,3,"") ->  | K2621: 3 | P2621: =COUNTIF(RC[-13]:RC[-9],"<>"&0) -> 4 | Q2621: 4
A2622: 109061 | B2622: 100854 | C2622: 100854 | D2622: 100850 | E2622: 100851 | F2622: 100853 | G2622: 0 | J2622: =IF(MOD(RC[-9],10)=2,3,"") ->  | K2622: 3 | N2622: 女警 | P2622: =COUNTIF(RC[-13]:RC[-9],"<>"&0) -> 4 | Q2622: 4
A2623: 109070 | B2623: 100860 | C2623: 100860 | D2623: 100860 | E2623: 100862 | F2623: 100861 | G2623: 100861 | J2623: =IF(MOD(RC[-9],10)=2,3,"") ->  | K2623: 3 | P2623: =COUNTIF(RC[-13]:RC[-9],"<>"&0) -> 5 | Q2623: 5
A2624: 109080 | B2624: 100870 | C2624: 100870 | D2624: 100870 | E2624: 100870 | F2624: 100871 | G2624: 100871 | J2624: =IF(MOD(RC[-9],10)=2,3,"") ->  | K2624: 3 | P2624: =COUNTIF(RC[-13]:RC[-9],"<>"&0) -> 5 | Q2624: 5
A2625: 109090 | B2625: 100880 | C2625: 100880 | D2625: 100881 | E2625: 100882 | F2625: 100882 | G2625: 0 | J2625: =IF(MOD(RC[-9],10)=2,3,"") ->  | K2625: 3 | P2625: =COUNTIF(RC[-13]:RC[-9],"<>"&0) -> 4 | Q2625: 4
A2626: 109091 | B2626: 100884 | C2626: 100884 | D2626: 100883 | E2626: 100880 | F2626: 100882 | G2626: 0 | J2626: =IF(MOD(RC[-9],10)=2,3,"") ->  | K2626: 3 | N2626: 基伦 | P2626: =COUNTIF(RC[-13]:RC[-9],"<>"&0) -> 4 | Q2626: 4
A2627: 109100 | B2627: 100890 | C2627: 100890 | D2627: 100891 | E2627: 100892 | F2627: 100893 | G2627: 0 | J2627: =IF(MOD(RC[-9],10)=2,3,"") ->  | K2627: 3 | P2627: =COUNTIF(RC[-13]:RC[-9],"<>"&0) -> 4 | Q2627: 4
A2628: 109101 | B2628: 100893 | C2628: 100890 | D2628: 100891 | E2628: 100893 | F2628: 100891 | G2628: 0 | J2628: =IF(MOD(RC[-9],10)=2,3,"") ->  | K2628: 3 | P2628: =COUNTIF(RC[-13]:RC[-9],"<>"&0) -> 4 | Q2628: 4
A2629: 109102 | B2629: 100894 | C2629: 100894 | D2629: 100890 | E2629: 100892 | F2629: 100891 | G2629: 0 | I2629: 0.1 | J2629: =IF(MOD(RC[-9],10)=2,3,"") -> 3 | K2629: 3 | N2629: 火女 | P2629: =COUNTIF(RC[-13]:RC[-9],"<>"&0) -> 4 | Q2629: 4
A2630: 110010 | B2630: 100900 | C2630: 100900 | D2630: 100900 | E2630: 100900 | F2630: 100901 | G2630: 100901 | J2630: =IF(MOD(RC[-9],10)=2,3,"") ->  | K2630: 3 | P2630: =COUNTIF(RC[-13]:RC[-9],"<>"&0) -> 5 | Q2630: 5
A2631: 110020 | B2631: 100910 | C2631: 100910 | D2631: 100910 | E2631: 100911 | F2631: 100912 | G2631: 100912 | J2631: =IF(MOD(RC[-9],10)=2,3,"") ->  | K2631: 3 | P2631: =COUNTIF(RC[-13]:RC[-9],"<>"&0) -> 5 | Q2631: 5
A2632: 110030 | B2632: 100921 | C2632: 100920 | D2632: 100920 | E2632: 100921 | F2632: 100921 | G2632: 0 | J2632: =IF(MOD(RC[-9],10)=2,3,"") ->  | K2632: 3 | P2632: =COUNTIF(RC[-13]:RC[-9],"<>"&0) -> 4 | Q2632: 4
A2633: 110031 | B2633: 100923 | C2633: 100923 | D2633: 100920 | E2633: 100921 | F2633: 100922 | G2633: 0 | J2633: =IF(MOD(RC[-9],10)=2,3,"") ->  | K2633: 3 | N2633: 熊阿宝 | P2633: =COUNTIF(RC[-13]:RC[-9],"<>"&0) -> 4 | Q2633: 4
A2634: 110040 | B2634: 100930 | C2634: 100930 | D2634: 100930 | E2634: 100931 | F2634: 100931 | G2634: 100931 | J2634: =IF(MOD(RC[-9],10)=2,3,"") ->  | K2634: 3 | P2634: =COUNTIF(RC[-13]:RC[-9],"<>"&0) -> 5 | Q2634: 5
A2635: 110050 | B2635: 100942 | C2635: 100940 | D2635: 100940 | E2635: 100941 | F2635: 100942 | G2635: 100942 | J2635: =IF(MOD(RC[-9],10)=2,3,"") ->  | K2635: 3 | P2635: =COUNTIF(RC[-13]:RC[-9],"<>"&0) -> 5 | Q2635: 5
A2636: 110060 | B2636: 100950 | C2636: 100950 | D2636: 100950 | E2636: 100952 | F2636: 100953 | G2636: 0 | J2636: =IF(MOD(RC[-9],10)=2,3,"") ->  | K2636: 3 | P2636: =COUNTIF(RC[-13]:RC[-9],"<>"&0) -> 4 | Q2636: 4
A2637: 110061 | B2637: 100954 | C2637: 100954 | D2637: 100950 | E2637: 100951 | F2637: 100953 | G2637: 0 | J2637: =IF(MOD(RC[-9],10)=2,3,"") ->  | K2637: 3 | N2637: 亚马逊女王 | P2637: =COUNTIF(RC[-13]:RC[-9],"<>"&0) -> 4 | Q2637: 4
A2638: 110070 | B2638: 100960 | C2638: 100960 | D2638: 100960 | E2638: 100960 | F2638: 100961 | G2638: 100961 | J2638: =IF(MOD(RC[-9],10)=2,3,"") ->  | K2638: 3 | P2638: =COUNTIF(RC[-13]:RC[-9],"<>"&0) -> 5 | Q2638: 5
A2639: 110080 | B2639: 100970 | C2639: 100970 | D2639: 100970 | E2639: 100971 | F2639: 100971 | G2639: 100971 | J2639: =IF(MOD(RC[-9],10)=2,3,"") ->  | K2639: 3 | P2639: =COUNTIF(RC[-13]:RC[-9],"<>"&0) -> 5 | Q2639: 5
A2640: 110090 | B2640: 100980 | C2640: 100980 | D2640: 100980 | E2640: 100982 | F2640: 100983 | G2640: 0 | J2640: =IF(MOD(RC[-9],10)=2,3,"") ->  | K2640: 3 | P2640: =COUNTIF(RC[-13]:RC[-9],"<>"&0) -> 4 | Q2640: 4
A2641: 110091 | B2641: 100984 | C2641: 100984 | D2641: 100980 | E2641: 100981 | F2641: 100982 | G2641: 0 | J2641: =IF(MOD(RC[-9],10)=2,3,"") ->  | K2641: 3 | N2641: 美杜莎 | P2641: =COUNTIF(RC[-13]:RC[-9],"<>"&0) -> 4 | Q2641: 4
A2642: 110100 | B2642: 100990 | C2642: 100990 | D2642: 100990 | E2642: 100991 | F2642: 100992 | G2642: 0 | J2642: =IF(MOD(RC[-9],10)=2,3,"") ->  | K2642: 3 | P2642: =COUNTIF(RC[-13]:RC[-9],"<>"&0) -> 4 | Q2642: 4
A2643: 110101 | B2643: 100991 | C2643: 100990 | D2643: 100991 | E2643: 100991 | F2643: 100992 | G2643: 0 | J2643: =IF(MOD(RC[-9],10)=2,3,"") ->  | K2643: 3 | P2643: =COUNTIF(RC[-13]:RC[-9],"<>"&0) -> 4 | Q2643: 4
A2644: 110102 | B2644: 100994 | C2644: 100994 | D2644: 100993 | E2644: 100990 | F2644: 100992 | G2644: 0 | I2644: 0.1 | J2644: =IF(MOD(RC[-9],10)=2,3,"") -> 3 | K2644: 3 | N2644: 德古拉 | P2644: =COUNTIF(RC[-13]:RC[-9],"<>"&0) -> 4 | Q2644: 4
A2645: 111010 | B2645: 101000 | C2645: 101000 | D2645: 101000 | E2645: 101001 | F2645: 101001 | G2645: 101001 | J2645: =IF(MOD(RC[-9],10)=2,3,"") ->  | K2645: 3 | P2645: =COUNTIF(RC[-13]:RC[-9],"<>"&0) -> 5 | Q2645: 5
A2646: 111020 | B2646: 101010 | C2646: 101010 | D2646: 101010 | E2646: 101010 | F2646: 101011 | G2646: 101011 | J2646: =IF(MOD(RC[-9],10)=2,3,"") ->  | K2646: 3 | P2646: =COUNTIF(RC[-13]:RC[-9],"<>"&0) -> 5 | Q2646: 5
A2647: 111030 | B2647: 101020 | C2647: 101020 | D2647: 101020 | E2647: 101021 | F2647: 101022 | G2647: 0 | J2647: =IF(MOD(RC[-9],10)=2,3,"") ->  | K2647: 3 | P2647: =COUNTIF(RC[-13]:RC[-9],"<>"&0) -> 4 | Q2647: 4
A2648: 111031 | B2648: 101023 | C2648: 101023 | D2648: 101020 | E2648: 101021 | F2648: 101022 | G2648: 0 | J2648: =IF(MOD(RC[-9],10)=2,3,"") ->  | K2648: 3 | N2648: 石头人 | P2648: =COUNTIF(RC[-13]:RC[-9],"<>"&0) -> 4 | Q2648: 4
A2649: 111040 | B2649: 101031 | C2649: 101030 | D2649: 101030 | E2649: 101031 | F2649: 101032 | G2649: 101032 | J2649: =IF(MOD(RC[-9],10)=2,3,"") ->  | K2649: 3 | P2649: =COUNTIF(RC[-13]:RC[-9],"<>"&0) -> 5 | Q2649: 5
A2650: 111050 | B2650: 101041 | C2650: 101040 | D2650: 101040 | E2650: 101041 | F2650: 101042 | G2650: 101042 | J2650: =IF(MOD(RC[-9],10)=2,3,"") ->  | K2650: 3 | P2650: =COUNTIF(RC[-13]:RC[-9],"<>"&0) -> 5 | Q2650: 5
A2651: 111060 | B2651: 101050 | C2651: 101050 | D2651: 101051 | E2651: 101052 | F2651: 101053 | G2651: 0 | J2651: =IF(MOD(RC[-9],10)=2,3,"") ->  | K2651: 3 | P2651: =COUNTIF(RC[-13]:RC[-9],"<>"&0) -> 4 | Q2651: 4
A2652: 111061 | B2652: 101054 | C2652: 101054 | D2652: 101050 | E2652: 101050 | F2652: 101053 | G2652: 0 | J2652: =IF(MOD(RC[-9],10)=2,3,"") ->  | K2652: 3 | N2652: 食人魔 | P2652: =COUNTIF(RC[-13]:RC[-9],"<>"&0) -> 4 | Q2652: 4
A2653: 111070 | B2653: 101060 | C2653: 101060 | D2653: 101060 | E2653: 101061 | F2653: 101062 | G2653: 101062 | J2653: =IF(MOD(RC[-9],10)=2,3,"") ->  | K2653: 3 | P2653: =COUNTIF(RC[-13]:RC[-9],"<>"&0) -> 5 | Q2653: 5
A2654: 111080 | B2654: 101070 | C2654: 101070 | D2654: 101070 | E2654: 101071 | F2654: 101072 | G2654: 101072 | J2654: =IF(MOD(RC[-9],10)=2,3,"") ->  | K2654: 3 | P2654: =COUNTIF(RC[-13]:RC[-9],"<>"&0) -> 5 | Q2654: 5
A2655: 111090 | B2655: 101080 | C2655: 101080 | D2655: 101081 | E2655: 101082 | F2655: 101083 | G2655: 0 | J2655: =IF(MOD(RC[-9],10)=2,3,"") ->  | K2655: 3 | P2655: =COUNTIF(RC[-13]:RC[-9],"<>"&0) -> 4 | Q2655: 4
A2656: 111091 | B2656: 101084 | C2656: 101084 | D2656: 101080 | E2656: 101080 | F2656: 101083 | G2656: 0 | J2656: =IF(MOD(RC[-9],10)=2,3,"") ->  | K2656: 3 | N2656: 地狱铁拳 | P2656: =COUNTIF(RC[-13]:RC[-9],"<>"&0) -> 4 | Q2656: 4
A2657: 111100 | B2657: 101090 | C2657: 101090 | D2657: 101090 | E2657: 101091 | F2657: 101092 | G2657: 0 | J2657: =IF(MOD(RC[-9],10)=2,3,"") ->  | K2657: 3 | P2657: =COUNTIF(RC[-13]:RC[-9],"<>"&0) -> 4 | Q2657: 4
A2658: 111101 | B2658: 101090 | C2658: 101090 | D2658: 101090 | E2658: 101091 | F2658: 101092 | G2658: 0 | J2658: =IF(MOD(RC[-9],10)=2,3,"") ->  | K2658: 3 | P2658: =COUNTIF(RC[-13]:RC[-9],"<>"&0) -> 4 | Q2658: 4
A2659: 111102 | B2659: 101094 | C2659: 101094 | D2659: 101091 | E2659: 101092 | F2659: 101093 | G2659: 0 | I2659: 0.1 | J2659: =IF(MOD(RC[-9],10)=2,3,"") -> 3 | K2659: 3 | N2659: 大力神 | P2659: =COUNTIF(RC[-13]:RC[-9],"<>"&0) -> 4 | Q2659: 4
A2660: 112010 | B2660: 101101 | C2660: 101100 | D2660: 101100 | E2660: 101101 | F2660: 101101 | G2660: 101101 | J2660: =IF(MOD(RC[-9],10)=2,3,"") ->  | K2660: 3 | P2660: =COUNTIF(RC[-13]:RC[-9],"<>"&0) -> 5 | Q2660: 5
A2661: 112020 | B2661: 101110 | C2661: 101110 | D2661: 101110 | E2661: 101111 | F2661: 101112 | G2661: 101112 | J2661: =IF(MOD(RC[-9],10)=2,3,"") ->  | K2661: 3 | P2661: =COUNTIF(RC[-13]:RC[-9],"<>"&0) -> 5 | Q2661: 5
A2662: 112030 | B2662: 101120 | C2662: 101120 | D2662: 101121 | E2662: 101122 | F2662: 101123 | G2662: 0 | J2662: =IF(MOD(RC[-9],10)=2,3,"") ->  | K2662: 3 | P2662: =COUNTIF(RC[-13]:RC[-9],"<>"&0) -> 4 | Q2662: 4
A2663: 112031 | B2663: 101124 | C2663: 101124 | D2663: 101120 | E2663: 101121 | F2663: 101122 | G2663: 0 | J2663: =IF(MOD(RC[-9],10)=2,3,"") ->  | K2663: 3 | N2663: 圣女贞德 | P2663: =COUNTIF(RC[-13]:RC[-9],"<>"&0) -> 4 | Q2663: 4
A2664: 112040 | B2664: 101130 | C2664: 101130 | D2664: 101130 | E2664: 101131 | F2664: 101132 | G2664: 101133 | J2664: =IF(MOD(RC[-9],10)=2,3,"") ->  | K2664: 3 | P2664: =COUNTIF(RC[-13]:RC[-9],"<>"&0) -> 5 | Q2664: 5
A2665: 112050 | B2665: 101141 | C2665: 101140 | D2665: 101140 | E2665: 101141 | F2665: 101141 | G2665: 101142 | J2665: =IF(MOD(RC[-9],10)=2,3,"") ->  | K2665: 3 | P2665: =COUNTIF(RC[-13]:RC[-9],"<>"&0) -> 5 | Q2665: 5
A2666: 112060 | B2666: 101150 | C2666: 101150 | D2666: 101150 | E2666: 101151 | F2666: 101153 | G2666: 0 | J2666: =IF(MOD(RC[-9],10)=2,3,"") ->  | K2666: 3 | P2666: =COUNTIF(RC[-13]:RC[-9],"<>"&0) -> 4 | Q2666: 4
A2667: 112061 | B2667: 101154 | C2667: 101154 | D2667: 101150 | E2667: 101152 | F2667: 101153 | G2667: 0 | J2667: =IF(MOD(RC[-9],10)=2,3,"") ->  | K2667: 3 | N2667: 恶魔猎手 | P2667: =COUNTIF(RC[-13]:RC[-9],"<>"&0) -> 4 | Q2667: 4
A2668: 112070 | B2668: 101160 | C2668: 101160 | D2668: 101160 | E2668: 101161 | F2668: 101161 | G2668: 101162 | J2668: =IF(MOD(RC[-9],10)=2,3,"") ->  | K2668: 3 | P2668: =COUNTIF(RC[-13]:RC[-9],"<>"&0) -> 5 | Q2668: 5
A2669: 112080 | B2669: 101170 | C2669: 101170 | D2669: 101170 | E2669: 101170 | F2669: 101171 | G2669: 101171 | J2669: =IF(MOD(RC[-9],10)=2,3,"") ->  | K2669: 3 | P2669: =COUNTIF(RC[-13]:RC[-9],"<>"&0) -> 5 | Q2669: 5
A2670: 112090 | B2670: 101180 | C2670: 101180 | D2670: 101181 | E2670: 101182 | F2670: 101183 | G2670: 0 | J2670: =IF(MOD(RC[-9],10)=2,3,"") ->  | K2670: 3 | P2670: =COUNTIF(RC[-13]:RC[-9],"<>"&0) -> 4 | Q2670: 4
A2671: 112091 | B2671: 101184 | C2671: 101184 | D2671: 101180 | E2671: 101181 | F2671: 101182 | G2671: 0 | J2671: =IF(MOD(RC[-9],10)=2,3,"") ->  | K2671: 3 | N2671: 牛头人 | P2671: =COUNTIF(RC[-13]:RC[-9],"<>"&0) -> 4 | Q2671: 4
A2672: 112100 | B2672: 101190 | C2672: 101190 | D2672: 0 | E2672: 0 | F2672: 0 | G2672: 0 | I2672: 0.1 | J2672: 3 | K2672: 3 | N2672: 野蛮巨人 | P2672: =COUNTIF(RC[-13]:RC[-9],"<>"&0) -> 1 | Q2672: 1
A2673: 113010 | B2673: 101200 | C2673: 101200 | D2673: 101200 | E2673: 101201 | F2673: 101202 | G2673: 101203 | J2673: =IF(MOD(RC[-9],10)=2,3,"") ->  | K2673: 3 | P2673: =COUNTIF(RC[-13]:RC[-9],"<>"&0) -> 5 | Q2673: 5
A2674: 113020 | B2674: 101211 | C2674: 101210 | D2674: 101210 | E2674: 101211 | F2674: 101211 | G2674: 101212 | J2674: =IF(MOD(RC[-9],10)=2,3,"") ->  | K2674: 3 | P2674: =COUNTIF(RC[-13]:RC[-9],"<>"&0) -> 5 | Q2674: 5
A2675: 113030 | B2675: 101220 | C2675: 101220 | D2675: 101222 | E2675: 101223 | F2675: 101224 | G2675: 0 | J2675: =IF(MOD(RC[-9],10)=2,3,"") ->  | K2675: 3 | P2675: =COUNTIF(RC[-13]:RC[-9],"<>"&0) -> 4 | Q2675: 4
A2676: 113031 | B2676: 101225 | C2676: 101225 | D2676: 101220 | E2676: 101221 | F2676: 101224 | G2676: 0 | J2676: =IF(MOD(RC[-9],10)=2,3,"") ->  | K2676: 3 | N2676: 鹰眸 | P2676: =COUNTIF(RC[-13]:RC[-9],"<>"&0) -> 4 | Q2676: 4
A2677: 113040 | B2677: 101230 | C2677: 101230 | D2677: 101230 | E2677: 101231 | F2677: 101232 | G2677: 101232 | J2677: =IF(MOD(RC[-9],10)=2,3,"") ->  | K2677: 3 | P2677: =COUNTIF(RC[-13]:RC[-9],"<>"&0) -> 5 | Q2677: 5
A2678: 113050 | B2678: 101240 | C2678: 101240 | D2678: 101240 | E2678: 101241 | F2678: 101242 | G2678: 101242 | J2678: =IF(MOD(RC[-9],10)=2,3,"") ->  | K2678: 3 | P2678: =COUNTIF(RC[-13]:RC[-9],"<>"&0) -> 5 | Q2678: 5
A2679: 113060 | B2679: 101250 | C2679: 101250 | D2679: 101250 | E2679: 101251 | F2679: 101252 | G2679: 0 | J2679: =IF(MOD(RC[-9],10)=2,3,"") ->  | K2679: 3 | P2679: =COUNTIF(RC[-13]:RC[-9],"<>"&0) -> 4 | Q2679: 4
A2680: 113061 | B2680: 101253 | C2680: 101253 | D2680: 101250 | E2680: 101251 | F2680: 101252 | G2680: 0 | J2680: =IF(MOD(RC[-9],10)=2,3,"") ->  | K2680: 3 | N2680: 致命特工 | P2680: =COUNTIF(RC[-13]:RC[-9],"<>"&0) -> 4 | Q2680: 4
A2681: 113070 | B2681: 101260 | C2681: 101260 | D2681: 101260 | E2681: 101260 | F2681: 101261 | G2681: 101262 | J2681: =IF(MOD(RC[-9],10)=2,3,"") ->  | K2681: 3 | P2681: =COUNTIF(RC[-13]:RC[-9],"<>"&0) -> 5 | Q2681: 5
A2682: 113080 | B2682: 101271 | C2682: 101270 | D2682: 101270 | E2682: 101271 | F2682: 101271 | G2682: 101271 | J2682: =IF(MOD(RC[-9],10)=2,3,"") ->  | K2682: 3 | P2682: =COUNTIF(RC[-13]:RC[-9],"<>"&0) -> 5 | Q2682: 5
A2683: 113090 | B2683: 101280 | C2683: 101280 | D2683: 101281 | E2683: 101282 | F2683: 101283 | G2683: 0 | J2683: =IF(MOD(RC[-9],10)=2,3,"") ->  | K2683: 3 | P2683: =COUNTIF(RC[-13]:RC[-9],"<>"&0) -> 4 | Q2683: 4
A2684: 113091 | B2684: 101284 | C2684: 101284 | D2684: 101280 | E2684: 101280 | F2684: 101282 | G2684: 0 | J2684: =IF(MOD(RC[-9],10)=2,3,"") ->  | K2684: 3 | N2684: 白凤凰 | P2684: =COUNTIF(RC[-13]:RC[-9],"<>"&0) -> 4 | Q2684: 4
A2685: 113100 | B2685: 101290 | C2685: 101290 | D2685: 101291 | E2685: 101292 | F2685: 101293 | G2685: 0 | J2685: =IF(MOD(RC[-9],10)=2,3,"") ->  | K2685: 3 | P2685: =COUNTIF(RC[-13]:RC[-9],"<>"&0) -> 4 | Q2685: 4
A2686: 113101 | B2686: 101290 | C2686: 101290 | D2686: 101290 | E2686: 101290 | F2686: 101293 | G2686: 0 | J2686: =IF(MOD(RC[-9],10)=2,3,"") ->  | K2686: 3 | P2686: =COUNTIF(RC[-13]:RC[-9],"<>"&0) -> 4 | Q2686: 4
A2687: 113102 | B2687: 101295 | C2687: 101295 | D2687: 101294 | E2687: 101290 | F2687: 101292 | G2687: 0 | I2687: 0.1 | J2687: =IF(MOD(RC[-9],10)=2,3,"") -> 3 | K2687: 3 | N2687: 超凡博士 | P2687: =COUNTIF(RC[-13]:RC[-9],"<>"&0) -> 4 | Q2687: 4
A2688: 114010 | B2688: 101300 | C2688: 101300 | D2688: 101300 | E2688: 101300 | F2688: 101301 | G2688: 101301 | J2688: =IF(MOD(RC[-9],10)=2,3,"") ->  | K2688: 3 | P2688: =COUNTIF(RC[-13]:RC[-9],"<>"&0) -> 5 | Q2688: 5
A2689: 114020 | B2689: 101311 | C2689: 101310 | D2689: 101311 | E2689: 101311 | F2689: 101312 | G2689: 101313 | J2689: =IF(MOD(RC[-9],10)=2,3,"") ->  | K2689: 3 | P2689: =COUNTIF(RC[-13]:RC[-9],"<>"&0) -> 5 | Q2689: 5
A2690: 114030 | B2690: 101320 | C2690: 101320 | D2690: 101321 | E2690: 101322 | F2690: 101323 | G2690: 0 | J2690: =IF(MOD(RC[-9],10)=2,3,"") ->  | K2690: 3 | P2690: =COUNTIF(RC[-13]:RC[-9],"<>"&0) -> 4 | Q2690: 4
A2691: 114031 | B2691: 101324 | C2691: 101324 | D2691: 101320 | E2691: 101321 | F2691: 101322 | G2691: 0 | J2691: =IF(MOD(RC[-9],10)=2,3,"") ->  | K2691: 3 | N2691: 斯巴达 | P2691: =COUNTIF(RC[-13]:RC[-9],"<>"&0) -> 4 | Q2691: 4
A2692: 114040 | B2692: 101331 | C2692: 101330 | D2692: 101331 | E2692: 101331 | F2692: 101332 | G2692: 101332 | J2692: =IF(MOD(RC[-9],10)=2,3,"") ->  | K2692: 3 | P2692: =COUNTIF(RC[-13]:RC[-9],"<>"&0) -> 5 | Q2692: 5
A2693: 114050 | B2693: 101340 | C2693: 101340 | D2693: 101340 | E2693: 101341 | F2693: 101342 | G2693: 101342 | J2693: =IF(MOD(RC[-9],10)=2,3,"") ->  | K2693: 3 | P2693: =COUNTIF(RC[-13]:RC[-9],"<>"&0) -> 5 | Q2693: 5
A2694: 114060 | B2694: 101350 | C2694: 101350 | D2694: 101350 | E2694: 101351 | F2694: 101352 | G2694: 0 | J2694: =IF(MOD(RC[-9],10)=2,3,"") ->  | K2694: 3 | P2694: =COUNTIF(RC[-13]:RC[-9],"<>"&0) -> 4 | Q2694: 4
A2695: 114061 | B2695: 101353 | C2695: 101353 | D2695: 101350 | E2695: 101351 | F2695: 101352 | G2695: 0 | J2695: =IF(MOD(RC[-9],10)=2,3,"") ->  | K2695: 3 | N2695: 血源牧师 | P2695: =COUNTIF(RC[-13]:RC[-9],"<>"&0) -> 4 | Q2695: 4
A2696: 114070 | B2696: 101360 | C2696: 101360 | D2696: 101360 | E2696: 101360 | F2696: 101361 | G2696: 101362 | J2696: =IF(MOD(RC[-9],10)=2,3,"") ->  | K2696: 3 | P2696: =COUNTIF(RC[-13]:RC[-9],"<>"&0) -> 5 | Q2696: 5
A2697: 114080 | B2697: 101370 | C2697: 101370 | D2697: 101370 | E2697: 101371 | F2697: 101372 | G2697: 101373 | J2697: =IF(MOD(RC[-9],10)=2,3,"") ->  | K2697: 3 | P2697: =COUNTIF(RC[-13]:RC[-9],"<>"&0) -> 5 | Q2697: 5
A2698: 114090 | B2698: 101380 | C2698: 101380 | D2698: 101380 | E2698: 101381 | F2698: 101382 | G2698: 0 | J2698: =IF(MOD(RC[-9],10)=2,3,"") ->  | K2698: 3 | P2698: =COUNTIF(RC[-13]:RC[-9],"<>"&0) -> 4 | Q2698: 4
A2699: 114091 | B2699: 101383 | C2699: 101383 | D2699: 101380 | E2699: 101381 | F2699: 101382 | G2699: 0 | J2699: =IF(MOD(RC[-9],10)=2,3,"") ->  | K2699: 3 | N2699: 章鱼博士 | P2699: =COUNTIF(RC[-13]:RC[-9],"<>"&0) -> 4 | Q2699: 4
A2700: 114100 | B2700: 101390 | C2700: 101390 | D2700: 101390 | E2700: 101391 | F2700: 101392 | G2700: 0 | J2700: =IF(MOD(RC[-9],10)=2,3,"") ->  | K2700: 3 | P2700: =COUNTIF(RC[-13]:RC[-9],"<>"&0) -> 4 | Q2700: 4
A2701: 114101 | B2701: 101392 | C2701: 101390 | D2701: 101390 | E2701: 101391 | F2701: 101392 | G2701: 0 | J2701: =IF(MOD(RC[-9],10)=2,3,"") ->  | K2701: 3 | P2701: =COUNTIF(RC[-13]:RC[-9],"<>"&0) -> 4 | Q2701: 4
A2702: 114102 | B2702: 101393 | C2702: 101393 | D2702: 101390 | E2702: 101391 | F2702: 101392 | G2702: 0 | I2702: 0.1 | J2702: =IF(MOD(RC[-9],10)=2,3,"") -> 3 | K2702: 3 | N2702: 雷神 | P2702: =COUNTIF(RC[-13]:RC[-9],"<>"&0) -> 4 | Q2702: 4
A2703: 115010 | B2703: 101400 | C2703: 101400 | D2703: 101400 | E2703: 101401 | F2703: 101401 | G2703: 101402 | J2703: =IF(MOD(RC[-9],10)=2,3,"") ->  | K2703: 3 | P2703: =COUNTIF(RC[-13]:RC[-9],"<>"&0) -> 5 | Q2703: 5
A2704: 115020 | B2704: 101410 | C2704: 101410 | D2704: 101410 | E2704: 101411 | F2704: 101412 | G2704: 101412 | J2704: =IF(MOD(RC[-9],10)=2,3,"") ->  | K2704: 3 | P2704: =COUNTIF(RC[-13]:RC[-9],"<>"&0) -> 5 | Q2704: 5
A2705: 115030 | B2705: 101420 | C2705: 101420 | D2705: 101421 | E2705: 101422 | F2705: 101422 | G2705: 101423 | J2705: =IF(MOD(RC[-9],10)=2,3,"") ->  | K2705: 3 | P2705: =COUNTIF(RC[-13]:RC[-9],"<>"&0) -> 5 | Q2705: 4
A2706: 115031 | B2706: 101424 | C2706: 101424 | D2706: 101420 | E2706: 101421 | F2706: 101422 | G2706: 101423 | J2706: =IF(MOD(RC[-9],10)=2,3,"") ->  | K2706: 3 | N2706: 刀锋猎人 | P2706: =COUNTIF(RC[-13]:RC[-9],"<>"&0) -> 5 | Q2706: 4
A2707: 115040 | B2707: 101431 | C2707: 101430 | D2707: 101430 | E2707: 101431 | F2707: 101431 | G2707: 101431 | J2707: =IF(MOD(RC[-9],10)=2,3,"") ->  | K2707: 3 | P2707: =COUNTIF(RC[-13]:RC[-9],"<>"&0) -> 5 | Q2707: 5
A2708: 115050 | B2708: 101440 | C2708: 101440 | D2708: 101440 | E2708: 101441 | F2708: 101441 | G2708: 101442 | J2708: =IF(MOD(RC[-9],10)=2,3,"") ->  | K2708: 3 | P2708: =COUNTIF(RC[-13]:RC[-9],"<>"&0) -> 5 | Q2708: 5
A2709: 115060 | B2709: 101450 | C2709: 101450 | D2709: 101450 | E2709: 101451 | F2709: 101452 | G2709: 101452 | J2709: =IF(MOD(RC[-9],10)=2,3,"") ->  | K2709: 3 | P2709: =COUNTIF(RC[-13]:RC[-9],"<>"&0) -> 5 | Q2709: 4
A2710: 115061 | B2710: 101453 | C2710: 101453 | D2710: 101450 | E2710: 101451 | F2710: 101451 | G2710: 101452 | J2710: =IF(MOD(RC[-9],10)=2,3,"") ->  | K2710: 3 | N2710: 树人 | P2710: =COUNTIF(RC[-13]:RC[-9],"<>"&0) -> 5 | Q2710: 4
A2711: 115070 | B2711: 101460 | C2711: 101460 | D2711: 101460 | E2711: 101460 | F2711: 101461 | G2711: 101461 | J2711: =IF(MOD(RC[-9],10)=2,3,"") ->  | K2711: 3 | P2711: =COUNTIF(RC[-13]:RC[-9],"<>"&0) -> 5 | Q2711: 5
A2712: 115080 | B2712: 101471 | C2712: 101470 | D2712: 101471 | E2712: 101471 | F2712: 101472 | G2712: 101472 | J2712: =IF(MOD(RC[-9],10)=2,3,"") ->  | K2712: 3 | P2712: =COUNTIF(RC[-13]:RC[-9],"<>"&0) -> 5 | Q2712: 5
A2713: 115090 | B2713: 101480 | C2713: 101480 | D2713: 101480 | E2713: 101481 | F2713: 101482 | G2713: 101482 | J2713: =IF(MOD(RC[-9],10)=2,3,"") ->  | K2713: 3 | P2713: =COUNTIF(RC[-13]:RC[-9],"<>"&0) -> 5 | Q2713: 4
A2714: 115091 | B2714: 101483 | C2714: 101483 | D2714: 101480 | E2714: 101481 | F2714: 101481 | G2714: 101482 | J2714: =IF(MOD(RC[-9],10)=2,3,"") ->  | K2714: 3 | N2714: 铁人 | P2714: =COUNTIF(RC[-13]:RC[-9],"<>"&0) -> 5 | Q2714: 4
A2715: 115100 | B2715: 101490 | C2715: 101490 | D2715: 0 | E2715: 0 | F2715: 0 | G2715: 0 | I2715: 0.1 | J2715: 3 | K2715: 3 | N2715: 战争泰坦 | P2715: =COUNTIF(RC[-13]:RC[-9],"<>"&0) -> 1 | Q2715: 1
A2716: 116010 | B2716: 101500 | C2716: 101500 | D2716: 101500 | E2716: 101501 | F2716: 101502 | G2716: 101502 | J2716: =IF(MOD(RC[-9],10)=2,3,"") ->  | K2716: 3 | P2716: =COUNTIF(RC[-13]:RC[-9],"<>"&0) -> 5 | Q2716: 5
A2717: 116020 | B2717: 101510 | C2717: 101510 | D2717: 101510 | E2717: 101510 | F2717: 101511 | G2717: 101512 | J2717: =IF(MOD(RC[-9],10)=2,3,"") ->  | K2717: 3 | P2717: =COUNTIF(RC[-13]:RC[-9],"<>"&0) -> 5 | Q2717: 5
A2718: 116030 | B2718: 101520 | C2718: 101520 | D2718: 101521 | E2718: 101522 | F2718: 101522 | G2718: 101523 | J2718: =IF(MOD(RC[-9],10)=2,3,"") ->  | K2718: 3 | P2718: =COUNTIF(RC[-13]:RC[-9],"<>"&0) -> 5 | Q2718: 4
A2719: 116031 | B2719: 101524 | C2719: 101524 | D2719: 101520 | E2719: 101521 | F2719: 101522 | G2719: 101523 | J2719: =IF(MOD(RC[-9],10)=2,3,"") ->  | K2719: 3 | N2719: 食人魔 | P2719: =COUNTIF(RC[-13]:RC[-9],"<>"&0) -> 5 | Q2719: 4
A2720: 116040 | B2720: 101531 | C2720: 101530 | D2720: 101530 | E2720: 101531 | F2720: 101531 | G2720: 101531 | J2720: =IF(MOD(RC[-9],10)=2,3,"") ->  | K2720: 3 | P2720: =COUNTIF(RC[-13]:RC[-9],"<>"&0) -> 5 | Q2720: 5
A2721: 116050 | B2721: 101541 | C2721: 101540 | D2721: 101541 | E2721: 101541 | F2721: 101542 | G2721: 101542 | J2721: =IF(MOD(RC[-9],10)=2,3,"") ->  | K2721: 3 | P2721: =COUNTIF(RC[-13]:RC[-9],"<>"&0) -> 5 | Q2721: 5
A2722: 116060 | B2722: 101550 | C2722: 101550 | D2722: 101550 | E2722: 101551 | F2722: 101552 | G2722: 101552 | J2722: =IF(MOD(RC[-9],10)=2,3,"") ->  | K2722: 3 | P2722: =COUNTIF(RC[-13]:RC[-9],"<>"&0) -> 5 | Q2722: 4
A2723: 116061 | B2723: 101554 | C2723: 101554 | D2723: 101553 | E2723: 101550 | F2723: 101552 | G2723: 101551 | J2723: =IF(MOD(RC[-9],10)=2,3,"") ->  | K2723: 3 | N2723: 半人马 | P2723: =COUNTIF(RC[-13]:RC[-9],"<>"&0) -> 5 | Q2723: 4
A2724: 116070 | B2724: 101560 | C2724: 101560 | D2724: 101560 | E2724: 101560 | F2724: 101561 | G2724: 101561 | J2724: =IF(MOD(RC[-9],10)=2,3,"") ->  | K2724: 3 | P2724: =COUNTIF(RC[-13]:RC[-9],"<>"&0) -> 5 | Q2724: 5
A2725: 116080 | B2725: 101570 | C2725: 101570 | D2725: 101570 | E2725: 101570 | F2725: 101571 | G2725: 101571 | J2725: =IF(MOD(RC[-9],10)=2,3,"") ->  | K2725: 3 | P2725: =COUNTIF(RC[-13]:RC[-9],"<>"&0) -> 5 | Q2725: 5
A2726: 116090 | B2726: 101580 | C2726: 101580 | D2726: 101581 | E2726: 101582 | F2726: 101582 | G2726: 101581 | J2726: =IF(MOD(RC[-9],10)=2,3,"") ->  | K2726: 3 | P2726: =COUNTIF(RC[-13]:RC[-9],"<>"&0) -> 5 | Q2726: 4
A2727: 116091 | B2727: 101584 | C2727: 101584 | D2727: 101580 | E2727: 101581 | F2727: 101582 | G2727: 101583 | J2727: =IF(MOD(RC[-9],10)=2,3,"") ->  | K2727: 3 | N2727: 大检察官 | P2727: =COUNTIF(RC[-13]:RC[-9],"<>"&0) -> 5 | Q2727: 4
A2728: 116100 | B2728: 101590 | C2728: 101590 | D2728: 101590 | E2728: 101591 | F2728: 101592 | G2728: 0 | J2728: =IF(MOD(RC[-9],10)=2,3,"") ->  | K2728: 3 | P2728: =COUNTIF(RC[-13]:RC[-9],"<>"&0) -> 4 | Q2728: 4
A2729: 116101 | B2729: 101590 | C2729: 101590 | D2729: 101590 | E2729: 101591 | F2729: 101592 | G2729: 0 | J2729: =IF(MOD(RC[-9],10)=2,3,"") ->  | K2729: 3 | P2729: =COUNTIF(RC[-13]:RC[-9],"<>"&0) -> 4 | Q2729: 4
A2730: 116102 | B2730: 101594 | C2730: 101594 | D2730: 101593 | E2730: 101590 | F2730: 101591 | G2730: 0 | I2730: 0.1 | J2730: =IF(MOD(RC[-9],10)=2,3,"") -> 3 | K2730: 3 | N2730: 血色指挥官 | P2730: =COUNTIF(RC[-13]:RC[-9],"<>"&0) -> 4 | Q2730: 4
A2731: 117010 | B2731: 101600 | C2731: 101600 | D2731: 101600 | E2731: 101600 | F2731: 101601 | G2731: 101601 | J2731: =IF(MOD(RC[-9],10)=2,3,"") ->  | K2731: 3 | P2731: =COUNTIF(RC[-13]:RC[-9],"<>"&0) -> 5 | Q2731: 5
A2732: 117020 | B2732: 101611 | C2732: 101610 | D2732: 101610 | E2732: 101611 | F2732: 101611 | G2732: 101612 | J2732: =IF(MOD(RC[-9],10)=2,3,"") ->  | K2732: 3 | P2732: =COUNTIF(RC[-13]:RC[-9],"<>"&0) -> 5 | Q2732: 5
A2733: 117030 | B2733: 101620 | C2733: 101620 | D2733: 101621 | E2733: 101622 | F2733: 101622 | G2733: 101623 | J2733: =IF(MOD(RC[-9],10)=2,3,"") ->  | K2733: 3 | P2733: =COUNTIF(RC[-13]:RC[-9],"<>"&0) -> 5 | Q2733: 4
A2734: 117031 | B2734: 101624 | C2734: 101624 | D2734: 101620 | E2734: 101621 | F2734: 101622 | G2734: 101623 | J2734: =IF(MOD(RC[-9],10)=2,3,"") ->  | K2734: 3 | N2734: 小黑 | P2734: =COUNTIF(RC[-13]:RC[-9],"<>"&0) -> 5 | Q2734: 4
A2735: 117040 | B2735: 101632 | C2735: 101630 | D2735: 101630 | E2735: 101631 | F2735: 101632 | G2735: 101632 | J2735: =IF(MOD(RC[-9],10)=2,3,"") ->  | K2735: 3 | P2735: =COUNTIF(RC[-13]:RC[-9],"<>"&0) -> 5 | Q2735: 5
A2736: 117050 | B2736: 101641 | C2736: 101640 | D2736: 101641 | E2736: 101641 | F2736: 101642 | G2736: 101642 | J2736: =IF(MOD(RC[-9],10)=2,3,"") ->  | K2736: 3 | P2736: =COUNTIF(RC[-13]:RC[-9],"<>"&0) -> 5 | Q2736: 5
A2737: 117060 | B2737: 101650 | C2737: 101650 | D2737: 101651 | E2737: 101652 | F2737: 101652 | G2737: 101653 | J2737: =IF(MOD(RC[-9],10)=2,3,"") ->  | K2737: 3 | P2737: =COUNTIF(RC[-13]:RC[-9],"<>"&0) -> 5 | Q2737: 4
A2738: 117061 | B2738: 101654 | C2738: 101654 | D2738: 101650 | E2738: 101651 | F2738: 101652 | G2738: 101653 | J2738: =IF(MOD(RC[-9],10)=2,3,"") ->  | K2738: 3 | N2738: 雅典娜 | P2738: =COUNTIF(RC[-13]:RC[-9],"<>"&0) -> 5 | Q2738: 4
A2739: 117070 | B2739: 101660 | C2739: 101660 | D2739: 101660 | E2739: 101661 | F2739: 101661 | G2739: 101662 | J2739: =IF(MOD(RC[-9],10)=2,3,"") ->  | K2739: 3 | P2739: =COUNTIF(RC[-13]:RC[-9],"<>"&0) -> 5 | Q2739: 5
A2740: 117080 | B2740: 101670 | C2740: 101670 | D2740: 101670 | E2740: 101670 | F2740: 101671 | G2740: 101671 | J2740: =IF(MOD(RC[-9],10)=2,3,"") ->  | K2740: 3 | P2740: =COUNTIF(RC[-13]:RC[-9],"<>"&0) -> 5 | Q2740: 5
A2741: 117090 | B2741: 101680 | C2741: 101680 | D2741: 101681 | E2741: 101682 | F2741: 101682 | G2741: 101683 | J2741: =IF(MOD(RC[-9],10)=2,3,"") ->  | K2741: 3 | P2741: =COUNTIF(RC[-13]:RC[-9],"<>"&0) -> 5 | Q2741: 4
A2742: 117091 | B2742: 101684 | C2742: 101684 | D2742: 101680 | E2742: 101681 | F2742: 101682 | G2742: 101683 | J2742: =IF(MOD(RC[-9],10)=2,3,"") ->  | K2742: 3 | N2742: 狩猎女神 | P2742: =COUNTIF(RC[-13]:RC[-9],"<>"&0) -> 5 | Q2742: 4
A2743: 117100 | B2743: 101690 | C2743: 101690 | D2743: 0 | E2743: 0 | F2743: 0 | G2743: 0 | I2743: 0.1 | J2743: 3 | K2743: 3 | N2743: 独眼巨人 | P2743: =COUNTIF(RC[-13]:RC[-9],"<>"&0) -> 1 | Q2743: 1
A2744: 118010 | B2744: 101700 | C2744: 101700 | D2744: 101700 | E2744: 101700 | F2744: 101701 | G2744: 101701 | J2744: =IF(MOD(RC[-9],10)=2,3,"") ->  | K2744: 3 | P2744: =COUNTIF(RC[-13]:RC[-9],"<>"&0) -> 5 | Q2744: 5
A2745: 118020 | B2745: 101710 | C2745: 101710 | D2745: 101710 | E2745: 101711 | F2745: 101712 | G2745: 101712 | J2745: =IF(MOD(RC[-9],10)=2,3,"") ->  | K2745: 3 | P2745: =COUNTIF(RC[-13]:RC[-9],"<>"&0) -> 5 | Q2745: 5
A2746: 118030 | B2746: 101720 | C2746: 101720 | D2746: 101720 | E2746: 101721 | F2746: 101721 | G2746: 101722 | J2746: =IF(MOD(RC[-9],10)=2,3,"") ->  | K2746: 3 | P2746: =COUNTIF(RC[-13]:RC[-9],"<>"&0) -> 5 | Q2746: 4
A2747: 118031 | B2747: 101723 | C2747: 101723 | D2747: 101720 | E2747: 101721 | F2747: 101722 | G2747: 101722 | J2747: =IF(MOD(RC[-9],10)=2,3,"") ->  | K2747: 3 | N2747: 死亡武士 | P2747: =COUNTIF(RC[-13]:RC[-9],"<>"&0) -> 5 | Q2747: 4
A2748: 118040 | B2748: 101730 | C2748: 101730 | D2748: 101730 | E2748: 101730 | F2748: 101731 | G2748: 101731 | J2748: =IF(MOD(RC[-9],10)=2,3,"") ->  | K2748: 3 | P2748: =COUNTIF(RC[-13]:RC[-9],"<>"&0) -> 5 | Q2748: 5
A2749: 118050 | B2749: 101740 | C2749: 101740 | D2749: 101740 | E2749: 101741 | F2749: 101742 | G2749: 101743 | J2749: =IF(MOD(RC[-9],10)=2,3,"") ->  | K2749: 3 | P2749: =COUNTIF(RC[-13]:RC[-9],"<>"&0) -> 5 | Q2749: 5
A2750: 118060 | B2750: 101750 | C2750: 101750 | D2750: 101750 | E2750: 101751 | F2750: 101751 | G2750: 101752 | J2750: =IF(MOD(RC[-9],10)=2,3,"") ->  | K2750: 3 | P2750: =COUNTIF(RC[-13]:RC[-9],"<>"&0) -> 5 | Q2750: 4
A2751: 118061 | B2751: 101753 | C2751: 101753 | D2751: 101750 | E2751: 101751 | F2751: 101752 | G2751: 101752 | J2751: =IF(MOD(RC[-9],10)=2,3,"") ->  | K2751: 3 | N2751: 野蛮巨人 | P2751: =COUNTIF(RC[-13]:RC[-9],"<>"&0) -> 5 | Q2751: 4
A2752: 118070 | B2752: 101761 | C2752: 101760 | D2752: 101760 | E2752: 101761 | F2752: 101761 | G2752: 101761 | J2752: =IF(MOD(RC[-9],10)=2,3,"") ->  | K2752: 3 | P2752: =COUNTIF(RC[-13]:RC[-9],"<>"&0) -> 5 | Q2752: 5
A2753: 118080 | B2753: 101771 | C2753: 101770 | D2753: 101771 | E2753: 101771 | F2753: 101772 | G2753: 101772 | J2753: =IF(MOD(RC[-9],10)=2,3,"") ->  | K2753: 3 | P2753: =COUNTIF(RC[-13]:RC[-9],"<>"&0) -> 5 | Q2753: 5
A2754: 118090 | B2754: 101780 | C2754: 101780 | D2754: 101780 | E2754: 101781 | F2754: 101781 | G2754: 101782 | J2754: =IF(MOD(RC[-9],10)=2,3,"") ->  | K2754: 3 | P2754: =COUNTIF(RC[-13]:RC[-9],"<>"&0) -> 5 | Q2754: 4
A2755: 118091 | B2755: 101783 | C2755: 101783 | D2755: 101780 | E2755: 101781 | F2755: 101782 | G2755: 101782 | J2755: =IF(MOD(RC[-9],10)=2,3,"") ->  | K2755: 3 | N2755: 火女 | P2755: =COUNTIF(RC[-13]:RC[-9],"<>"&0) -> 5 | Q2755: 4
A2756: 118100 | B2756: 101790 | C2756: 101790 | D2756: 101790 | E2756: 101791 | F2756: 101792 | G2756: 0 | J2756: =IF(MOD(RC[-9],10)=2,3,"") ->  | K2756: 3 | P2756: =COUNTIF(RC[-13]:RC[-9],"<>"&0) -> 4 | Q2756: 4
A2757: 118101 | B2757: 101790 | C2757: 101790 | D2757: 101790 | E2757: 101791 | F2757: 101792 | G2757: 0 | J2757: =IF(MOD(RC[-9],10)=2,3,"") ->  | K2757: 3 | P2757: =COUNTIF(RC[-13]:RC[-9],"<>"&0) -> 4 | Q2757: 4
A2758: 118102 | B2758: 101794 | C2758: 101794 | D2758: 101793 | E2758: 101790 | F2758: 101791 | G2758: 0 | I2758: 0.1 | J2758: =IF(MOD(RC[-9],10)=2,3,"") -> 3 | K2758: 3 | N2758: 牛头人 | P2758: =COUNTIF(RC[-13]:RC[-9],"<>"&0) -> 4 | Q2758: 4
A2759: 119010 | B2759: 101800 | C2759: 101800 | D2759: 101800 | E2759: 101800 | F2759: 101801 | G2759: 101801 | J2759: =IF(MOD(RC[-9],10)=2,3,"") ->  | K2759: 3 | P2759: =COUNTIF(RC[-13]:RC[-9],"<>"&0) -> 5 | Q2759: 5
A2760: 119020 | B2760: 101810 | C2760: 101810 | D2760: 101810 | E2760: 101811 | F2760: 101812 | G2760: 101812 | J2760: =IF(MOD(RC[-9],10)=2,3,"") ->  | K2760: 3 | P2760: =COUNTIF(RC[-13]:RC[-9],"<>"&0) -> 5 | Q2760: 5
A2761: 119030 | B2761: 101820 | C2761: 101820 | D2761: 101820 | E2761: 101821 | F2761: 101821 | G2761: 101822 | J2761: =IF(MOD(RC[-9],10)=2,3,"") ->  | K2761: 3 | P2761: =COUNTIF(RC[-13]:RC[-9],"<>"&0) -> 5 | Q2761: 4
A2762: 119031 | B2762: 101823 | C2762: 101823 | D2762: 101820 | E2762: 101820 | F2762: 101821 | G2762: 101822 | J2762: =IF(MOD(RC[-9],10)=2,3,"") ->  | K2762: 3 | N2762: 血源牧师 | P2762: =COUNTIF(RC[-13]:RC[-9],"<>"&0) -> 5 | Q2762: 4
A2763: 119040 | B2763: 101830 | C2763: 101830 | D2763: 101830 | E2763: 101830 | F2763: 101831 | G2763: 101832 | J2763: =IF(MOD(RC[-9],10)=2,3,"") ->  | K2763: 3 | P2763: =COUNTIF(RC[-13]:RC[-9],"<>"&0) -> 5 | Q2763: 5
A2764: 119050 | B2764: 101840 | C2764: 101840 | D2764: 101840 | E2764: 101840 | F2764: 101841 | G2764: 101841 | J2764: =IF(MOD(RC[-9],10)=2,3,"") ->  | K2764: 3 | P2764: =COUNTIF(RC[-13]:RC[-9],"<>"&0) -> 5 | Q2764: 5
A2765: 119060 | B2765: 101850 | C2765: 101850 | D2765: 101850 | E2765: 101850 | F2765: 101851 | G2765: 101851 | J2765: =IF(MOD(RC[-9],10)=2,3,"") ->  | K2765: 3 | P2765: =COUNTIF(RC[-13]:RC[-9],"<>"&0) -> 5 | Q2765: 4
A2766: 119061 | B2766: 101852 | C2766: 101852 | D2766: 101850 | E2766: 101850 | F2766: 101851 | G2766: 101851 | J2766: =IF(MOD(RC[-9],10)=2,3,"") ->  | K2766: 3 | N2766: 巨大骷髅 | P2766: =COUNTIF(RC[-13]:RC[-9],"<>"&0) -> 5 | Q2766: 4
A2767: 119070 | B2767: 101861 | C2767: 101860 | D2767: 101861 | E2767: 101861 | F2767: 101862 | G2767: 101863 | J2767: =IF(MOD(RC[-9],10)=2,3,"") ->  | K2767: 3 | P2767: =COUNTIF(RC[-13]:RC[-9],"<>"&0) -> 5 | Q2767: 5
A2768: 119080 | B2768: 101873 | C2768: 101870 | D2768: 101870 | E2768: 101871 | F2768: 101872 | G2768: 101873 | J2768: =IF(MOD(RC[-9],10)=2,3,"") ->  | K2768: 3 | P2768: =COUNTIF(RC[-13]:RC[-9],"<>"&0) -> 5 | Q2768: 5
A2769: 119090 | B2769: 101880 | C2769: 101880 | D2769: 101881 | E2769: 101882 | F2769: 101882 | G2769: 101883 | J2769: =IF(MOD(RC[-9],10)=2,3,"") ->  | K2769: 3 | P2769: =COUNTIF(RC[-13]:RC[-9],"<>"&0) -> 5 | Q2769: 4
A2770: 119091 | B2770: 101884 | C2770: 101884 | D2770: 101880 | E2770: 101881 | F2770: 101882 | G2770: 101883 | J2770: =IF(MOD(RC[-9],10)=2,3,"") ->  | K2770: 3 | N2770: 恶魔猎手 | P2770: =COUNTIF(RC[-13]:RC[-9],"<>"&0) -> 5 | Q2770: 4
A2771: 119100 | B2771: 101890 | C2771: 101890 | D2771: 101891 | E2771: 101892 | F2771: 101893 | G2771: 0 | J2771: =IF(MOD(RC[-9],10)=2,3,"") ->  | K2771: 3 | P2771: =COUNTIF(RC[-13]:RC[-9],"<>"&0) -> 4 | Q2771: 4
A2772: 119101 | B2772: 101890 | C2772: 101890 | D2772: 101891 | E2772: 101892 | F2772: 101893 | G2772: 0 | J2772: =IF(MOD(RC[-9],10)=2,3,"") ->  | K2772: 3 | P2772: =COUNTIF(RC[-13]:RC[-9],"<>"&0) -> 4 | Q2772: 4
A2773: 119102 | B2773: 101894 | C2773: 101894 | D2773: 0 | E2773: 0 | F2773: 0 | G2773: 0 | I2773: 0.1 | J2773: =IF(MOD(RC[-9],10)=2,3,"") -> 3 | K2773: 3 | N2773: 憎恶 | P2773: =COUNTIF(RC[-13]:RC[-9],"<>"&0) -> 1 | Q2773: 4
A2774: 120010 | B2774: 101900 | C2774: 101900 | D2774: 101900 | E2774: 101901 | F2774: 101902 | G2774: 101902 | J2774: =IF(MOD(RC[-9],10)=2,3,"") ->  | K2774: 3 | P2774: =COUNTIF(RC[-13]:RC[-9],"<>"&0) -> 5 | Q2774: 5
A2775: 120020 | B2775: 101911 | C2775: 101910 | D2775: 101911 | E2775: 101911 | F2775: 101912 | G2775: 101913 | J2775: =IF(MOD(RC[-9],10)=2,3,"") ->  | K2775: 3 | P2775: =COUNTIF(RC[-13]:RC[-9],"<>"&0) -> 5 | Q2775: 5
A2776: 120030 | B2776: 101920 | C2776: 101920 | D2776: 101921 | E2776: 101922 | F2776: 101923 | G2776: 101923 | J2776: =IF(MOD(RC[-9],10)=2,3,"") ->  | K2776: 3 | P2776: =COUNTIF(RC[-13]:RC[-9],"<>"&0) -> 5 | Q2776: 4
A2777: 120031 | B2777: 101924 | C2777: 101924 | D2777: 101920 | E2777: 101921 | F2777: 101922 | G2777: 101923 | J2777: =IF(MOD(RC[-9],10)=2,3,"") ->  | K2777: 3 | N2777: 致命特工 | P2777: =COUNTIF(RC[-13]:RC[-9],"<>"&0) -> 5 | Q2777: 4
A2778: 120040 | B2778: 101930 | C2778: 101930 | D2778: 101930 | E2778: 101930 | F2778: 101931 | G2778: 101931 | J2778: =IF(MOD(RC[-9],10)=2,3,"") ->  | K2778: 3 | P2778: =COUNTIF(RC[-13]:RC[-9],"<>"&0) -> 5 | Q2778: 5
A2779: 120050 | B2779: 101940 | C2779: 101940 | D2779: 101940 | E2779: 101941 | F2779: 101941 | G2779: 101942 | J2779: =IF(MOD(RC[-9],10)=2,3,"") ->  | K2779: 3 | P2779: =COUNTIF(RC[-13]:RC[-9],"<>"&0) -> 5 | Q2779: 5
A2780: 120060 | B2780: 101950 | C2780: 101950 | D2780: 101951 | E2780: 101952 | F2780: 101952 | G2780: 101953 | J2780: =IF(MOD(RC[-9],10)=2,3,"") ->  | K2780: 3 | P2780: =COUNTIF(RC[-13]:RC[-9],"<>"&0) -> 5 | Q2780: 4
A2781: 120061 | B2781: 101954 | C2781: 101954 | D2781: 101950 | E2781: 101951 | F2781: 101952 | G2781: 101953 | J2781: =IF(MOD(RC[-9],10)=2,3,"") ->  | K2781: 3 | N2781: 雷神 | P2781: =COUNTIF(RC[-13]:RC[-9],"<>"&0) -> 5 | Q2781: 4
A2782: 120070 | B2782: 101961 | C2782: 101960 | D2782: 101961 | E2782: 101961 | F2782: 101962 | G2782: 101962 | J2782: =IF(MOD(RC[-9],10)=2,3,"") ->  | K2782: 3 | P2782: =COUNTIF(RC[-13]:RC[-9],"<>"&0) -> 5 | Q2782: 5
A2783: 120080 | B2783: 101970 | C2783: 101970 | D2783: 101970 | E2783: 101971 | F2783: 101972 | G2783: 101972 | J2783: =IF(MOD(RC[-9],10)=2,3,"") ->  | K2783: 3 | P2783: =COUNTIF(RC[-13]:RC[-9],"<>"&0) -> 5 | Q2783: 5
A2784: 120090 | B2784: 101980 | C2784: 101980 | D2784: 101981 | E2784: 101982 | F2784: 101982 | G2784: 101983 | J2784: =IF(MOD(RC[-9],10)=2,3,"") ->  | K2784: 3 | P2784: =COUNTIF(RC[-13]:RC[-9],"<>"&0) -> 5 | Q2784: 4
A2785: 120091 | B2785: 101984 | C2785: 101984 | D2785: 101980 | E2785: 101981 | F2785: 101982 | G2785: 101983 | J2785: =IF(MOD(RC[-9],10)=2,3,"") ->  | K2785: 3 | N2785: 树人 | P2785: =COUNTIF(RC[-13]:RC[-9],"<>"&0) -> 5 | Q2785: 4
A2786: 120100 | B2786: 101990 | C2786: 101990 | D2786: 101991 | E2786: 101992 | F2786: 101993 | G2786: 0 | K2786: 3 | P2786: =COUNTIF(RC[-13]:RC[-9],"<>"&0) -> 4 | Q2786: 4
A2787: 120101 | B2787: 101991 | C2787: 101990 | D2787: 101991 | E2787: 101992 | F2787: 101993 | G2787: 0 | K2787: 3 | P2787: =COUNTIF(RC[-13]:RC[-9],"<>"&0) -> 4 | Q2787: 4
A2788: 120102 | B2788: 101995 | C2788: 101995 | D2788: 101994 | E2788: 101990 | F2788: 101992 | G2788: 0 | I2788: 0.1 | J2788: 3 | K2788: 3 | N2788: 雷神 | P2788: =COUNTIF(RC[-13]:RC[-9],"<>"&0) -> 4 | Q2788: 4
A2789: 121010 | B2789: 102000 | C2789: 102000 | D2789: 102000 | E2789: 102001 | F2789: 102002 | G2789: 102002 | J2789: =IF(MOD(RC[-9],10)=2,3,"") ->  | K2789: 3 | P2789: =COUNTIF(RC[-13]:RC[-9],"<>"&0) -> 5 | Q2789: 5
A2790: 121020 | B2790: 102010 | C2790: 102010 | D2790: 102010 | E2790: 102010 | F2790: 102011 | G2790: 102012 | J2790: =IF(MOD(RC[-9],10)=2,3,"") ->  | K2790: 3 | P2790: =COUNTIF(RC[-13]:RC[-9],"<>"&0) -> 5 | Q2790: 5
A2791: 121030 | B2791: 102020 | C2791: 102020 | D2791: 102021 | E2791: 102021 | F2791: 102022 | G2791: 102023 | J2791: =IF(MOD(RC[-9],10)=2,3,"") ->  | K2791: 3 | P2791: =COUNTIF(RC[-13]:RC[-9],"<>"&0) -> 5 | Q2791: 4
A2792: 121031 | B2792: 102024 | C2792: 102024 | D2792: 102020 | E2792: 102021 | F2792: 102022 | G2792: 102023 | J2792: =IF(MOD(RC[-9],10)=2,3,"") ->  | K2792: 3 | N2792: 佐罗 | P2792: =COUNTIF(RC[-13]:RC[-9],"<>"&0) -> 5 | Q2792: 4
A2793: 121040 | B2793: 102030 | C2793: 102030 | D2793: 102030 | E2793: 102031 | F2793: 102032 | G2793: 102033 | J2793: =IF(MOD(RC[-9],10)=2,3,"") ->  | K2793: 3 | P2793: =COUNTIF(RC[-13]:RC[-9],"<>"&0) -> 5 | Q2793: 5
A2794: 121050 | B2794: 102041 | C2794: 102040 | D2794: 102040 | E2794: 102041 | F2794: 102041 | G2794: 102042 | J2794: =IF(MOD(RC[-9],10)=2,3,"") ->  | K2794: 3 | P2794: =COUNTIF(RC[-13]:RC[-9],"<>"&0) -> 5 | Q2794: 5
A2795: 121060 | B2795: 102050 | C2795: 102050 | D2795: 102050 | E2795: 102051 | F2795: 102051 | G2795: 102052 | J2795: =IF(MOD(RC[-9],10)=2,3,"") ->  | K2795: 3 | P2795: =COUNTIF(RC[-13]:RC[-9],"<>"&0) -> 5 | Q2795: 4
A2796: 121061 | B2796: 102053 | C2796: 102053 | D2796: 102050 | E2796: 102050 | F2796: 102051 | G2796: 102052 | J2796: =IF(MOD(RC[-9],10)=2,3,"") ->  | K2796: 3 | N2796: 斯巴达 | P2796: =COUNTIF(RC[-13]:RC[-9],"<>"&0) -> 5 | Q2796: 4
A2797: 121070 | B2797: 102061 | C2797: 102060 | D2797: 102061 | E2797: 102061 | F2797: 102062 | G2797: 102063 | J2797: =IF(MOD(RC[-9],10)=2,3,"") ->  | K2797: 3 | P2797: =COUNTIF(RC[-13]:RC[-9],"<>"&0) -> 5 | Q2797: 5
A2798: 121080 | B2798: 102072 | C2798: 102070 | D2798: 102071 | E2798: 102072 | F2798: 102072 | G2798: 102073 | J2798: =IF(MOD(RC[-9],10)=2,3,"") ->  | K2798: 3 | P2798: =COUNTIF(RC[-13]:RC[-9],"<>"&0) -> 5 | Q2798: 5
A2799: 121090 | B2799: 102081 | C2799: 102080 | D2799: 102080 | E2799: 102081 | F2799: 102081 | G2799: 102082 | J2799: =IF(MOD(RC[-9],10)=2,3,"") ->  | K2799: 3 | P2799: =COUNTIF(RC[-13]:RC[-9],"<>"&0) -> 5 | Q2799: 4
A2800: 121091 | B2800: 102083 | C2800: 102083 | D2800: 102080 | E2800: 102081 | F2800: 102082 | G2800: 102082 | J2800: =IF(MOD(RC[-9],10)=2,3,"") ->  | K2800: 3 | N2800: 狩猎女神 | P2800: =COUNTIF(RC[-13]:RC[-9],"<>"&0) -> 5 | Q2800: 4
A2801: 121100 | B2801: 102090 | C2801: 102090 | D2801: 102090 | E2801: 102091 | F2801: 102092 | G2801: 0 | J2801: =IF(MOD(RC[-9],10)=2,3,"") ->  | K2801: 3 | P2801: =COUNTIF(RC[-13]:RC[-9],"<>"&0) -> 4 | Q2801: 4
A2802: 121101 | B2802: 102092 | C2802: 102090 | D2802: 102090 | E2802: 102091 | F2802: 102092 | G2802: 0 | J2802: =IF(MOD(RC[-9],10)=2,3,"") ->  | K2802: 3 | P2802: =COUNTIF(RC[-13]:RC[-9],"<>"&0) -> 4 | Q2802: 4
A2803: 121102 | B2803: 102094 | C2803: 102094 | D2803: 102093 | E2803: 102090 | F2803: 102091 | G2803: 0 | I2803: 0.1 | J2803: =IF(MOD(RC[-9],10)=2,3,"") -> 3 | K2803: 3 | N2803: 查理大帝 | P2803: =COUNTIF(RC[-13]:RC[-9],"<>"&0) -> 4 | Q2803: 4
A2804: 122010 | B2804: 102100 | C2804: 102100 | D2804: 102100 | E2804: 102100 | F2804: 102101 | G2804: 102102 | J2804: =IF(MOD(RC[-9],10)=2,3,"") ->  | K2804: 3 | P2804: =COUNTIF(RC[-13]:RC[-9],"<>"&0) -> 5 | Q2804: 5
A2805: 122020 | B2805: 102110 | C2805: 102110 | D2805: 102110 | E2805: 102111 | F2805: 102112 | G2805: 102112 | J2805: =IF(MOD(RC[-9],10)=2,3,"") ->  | K2805: 3 | P2805: =COUNTIF(RC[-13]:RC[-9],"<>"&0) -> 5 | Q2805: 5
A2806: 122030 | B2806: 102120 | C2806: 102120 | D2806: 102120 | E2806: 102120 | F2806: 102121 | G2806: 102122 | J2806: =IF(MOD(RC[-9],10)=2,3,"") ->  | K2806: 3 | P2806: =COUNTIF(RC[-13]:RC[-9],"<>"&0) -> 5 | Q2806: 4
A2807: 122031 | B2807: 102123 | C2807: 102123 | D2807: 102120 | E2807: 102121 | F2807: 102122 | G2807: 102122 | J2807: =IF(MOD(RC[-9],10)=2,3,"") ->  | K2807: 3 | N2807: 半人马 | P2807: =COUNTIF(RC[-13]:RC[-9],"<>"&0) -> 5 | Q2807: 4
A2808: 122040 | B2808: 102130 | C2808: 102130 | D2808: 102130 | E2808: 102131 | F2808: 102132 | G2808: 102132 | J2808: =IF(MOD(RC[-9],10)=2,3,"") ->  | K2808: 3 | P2808: =COUNTIF(RC[-13]:RC[-9],"<>"&0) -> 5 | Q2808: 5
A2809: 122050 | B2809: 102140 | C2809: 102140 | D2809: 102140 | E2809: 102141 | F2809: 102142 | G2809: 102142 | J2809: =IF(MOD(RC[-9],10)=2,3,"") ->  | K2809: 3 | P2809: =COUNTIF(RC[-13]:RC[-9],"<>"&0) -> 5 | Q2809: 5
A2810: 122060 | B2810: 102150 | C2810: 102150 | D2810: 102150 | E2810: 102151 | F2810: 102151 | G2810: 102152 | J2810: =IF(MOD(RC[-9],10)=2,3,"") ->  | K2810: 3 | P2810: =COUNTIF(RC[-13]:RC[-9],"<>"&0) -> 5 | Q2810: 4
A2811: 122061 | B2811: 102153 | C2811: 102153 | D2811: 102150 | E2811: 102151 | F2811: 102152 | G2811: 102152 | J2811: =IF(MOD(RC[-9],10)=2,3,"") ->  | K2811: 3 | N2811: 美杜莎 | P2811: =COUNTIF(RC[-13]:RC[-9],"<>"&0) -> 5 | Q2811: 4
A2812: 122070 | B2812: 102160 | C2812: 102160 | D2812: 102160 | E2812: 102160 | F2812: 102161 | G2812: 102161 | J2812: =IF(MOD(RC[-9],10)=2,3,"") ->  | K2812: 3 | P2812: =COUNTIF(RC[-13]:RC[-9],"<>"&0) -> 5 | Q2812: 5
A2813: 122080 | B2813: 102171 | C2813: 102170 | D2813: 102170 | E2813: 102171 | F2813: 102171 | G2813: 102172 | J2813: =IF(MOD(RC[-9],10)=2,3,"") ->  | K2813: 3 | P2813: =COUNTIF(RC[-13]:RC[-9],"<>"&0) -> 5 | Q2813: 5
A2814: 122090 | B2814: 102180 | C2814: 102180 | D2814: 102180 | E2814: 102181 | F2814: 102181 | G2814: 102182 | J2814: =IF(MOD(RC[-9],10)=2,3,"") ->  | K2814: 3 | P2814: =COUNTIF(RC[-13]:RC[-9],"<>"&0) -> 5 | Q2814: 4
A2815: 122091 | B2815: 102183 | C2815: 102183 | D2815: 102180 | E2815: 102180 | F2815: 102181 | G2815: 102182 | J2815: =IF(MOD(RC[-9],10)=2,3,"") ->  | K2815: 3 | N2815: 天使长 | P2815: =COUNTIF(RC[-13]:RC[-9],"<>"&0) -> 5 | Q2815: 4
A2816: 122100 | B2816: 102190 | C2816: 102190 | D2816: 102191 | E2816: 102192 | F2816: 102194 | G2816: 0 | J2816: =IF(MOD(RC[-9],10)=2,3,"") ->  | K2816: 3 | P2816: =COUNTIF(RC[-13]:RC[-9],"<>"&0) -> 4 | Q2816: 4
A2817: 122101 | B2817: 102190 | C2817: 102190 | D2817: 102191 | E2817: 102193 | F2817: 102194 | G2817: 0 | J2817: =IF(MOD(RC[-9],10)=2,3,"") ->  | K2817: 3 | P2817: =COUNTIF(RC[-13]:RC[-9],"<>"&0) -> 4 | Q2817: 4
A2818: 122102 | B2818: 102195 | C2818: 102195 | D2818: 102190 | E2818: 102191 | F2818: 102194 | G2818: 0 | I2818: 0.1 | J2818: =IF(MOD(RC[-9],10)=2,3,"") -> 3 | K2818: 3 | N2818: 潘多拉 | P2818: =COUNTIF(RC[-13]:RC[-9],"<>"&0) -> 4 | Q2818: 4
A2819: 123010 | B2819: 102201 | C2819: 102200 | D2819: 102200 | E2819: 102201 | F2819: 102201 | G2819: 102202 | J2819: =IF(MOD(RC[-9],10)=2,3,"") ->  | K2819: 3 | P2819: =COUNTIF(RC[-13]:RC[-9],"<>"&0) -> 5 | Q2819: 5
A2820: 123020 | B2820: 102210 | C2820: 102210 | D2820: 102210 | E2820: 102210 | F2820: 102211 | G2820: 102211 | J2820: =IF(MOD(RC[-9],10)=2,3,"") ->  | K2820: 3 | P2820: =COUNTIF(RC[-13]:RC[-9],"<>"&0) -> 5 | Q2820: 5
A2821: 123030 | B2821: 102220 | C2821: 102220 | D2821: 102221 | E2821: 102222 | F2821: 102223 | G2821: 102223 | J2821: =IF(MOD(RC[-9],10)=2,3,"") ->  | K2821: 3 | P2821: =COUNTIF(RC[-13]:RC[-9],"<>"&0) -> 5 | Q2821: 4
A2822: 123031 | B2822: 102224 | C2822: 102224 | D2822: 102220 | E2822: 102221 | F2822: 102222 | G2822: 102223 | J2822: =IF(MOD(RC[-9],10)=2,3,"") ->  | K2822: 3 | N2822: 死亡武士 | P2822: =COUNTIF(RC[-13]:RC[-9],"<>"&0) -> 5 | Q2822: 4
A2823: 123040 | B2823: 102231 | C2823: 102230 | D2823: 102231 | E2823: 102231 | F2823: 102232 | G2823: 102232 | J2823: =IF(MOD(RC[-9],10)=2,3,"") ->  | K2823: 3 | P2823: =COUNTIF(RC[-13]:RC[-9],"<>"&0) -> 5 | Q2823: 5
A2824: 123050 | B2824: 102240 | C2824: 102240 | D2824: 102240 | E2824: 102240 | F2824: 102241 | G2824: 102241 | J2824: =IF(MOD(RC[-9],10)=2,3,"") ->  | K2824: 3 | P2824: =COUNTIF(RC[-13]:RC[-9],"<>"&0) -> 5 | Q2824: 5
A2825: 123060 | B2825: 102250 | C2825: 102250 | D2825: 102251 | E2825: 102251 | F2825: 102252 | G2825: 102253 | J2825: =IF(MOD(RC[-9],10)=2,3,"") ->  | K2825: 3 | P2825: =COUNTIF(RC[-13]:RC[-9],"<>"&0) -> 5 | Q2825: 4
A2826: 123061 | B2826: 102254 | C2826: 102254 | D2826: 102250 | E2826: 102251 | F2826: 102252 | G2826: 102253 | J2826: =IF(MOD(RC[-9],10)=2,3,"") ->  | K2826: 3 | N2826: 刀锋猎人 | P2826: =COUNTIF(RC[-13]:RC[-9],"<>"&0) -> 5 | Q2826: 4
A2827: 123070 | B2827: 102261 | C2827: 102260 | D2827: 102260 | E2827: 102261 | F2827: 102261 | G2827: 102261 | J2827: =IF(MOD(RC[-9],10)=2,3,"") ->  | K2827: 3 | P2827: =COUNTIF(RC[-13]:RC[-9],"<>"&0) -> 5 | Q2827: 5
A2828: 123080 | B2828: 102270 | C2828: 102270 | D2828: 102270 | E2828: 102271 | F2828: 102272 | G2828: 102273 | J2828: =IF(MOD(RC[-9],10)=2,3,"") ->  | K2828: 3 | P2828: =COUNTIF(RC[-13]:RC[-9],"<>"&0) -> 5 | Q2828: 5
A2829: 123090 | B2829: 102280 | C2829: 102280 | D2829: 102281 | E2829: 102282 | F2829: 102283 | G2829: 102283 | J2829: =IF(MOD(RC[-9],10)=2,3,"") ->  | K2829: 3 | P2829: =COUNTIF(RC[-13]:RC[-9],"<>"&0) -> 5 | Q2829: 4
A2830: 123091 | B2830: 102284 | C2830: 102284 | D2830: 102280 | E2830: 102281 | F2830: 102282 | G2830: 102283 | J2830: =IF(MOD(RC[-9],10)=2,3,"") ->  | K2830: 3 | N2830: 章鱼博士 | P2830: =COUNTIF(RC[-13]:RC[-9],"<>"&0) -> 5 | Q2830: 4
A2831: 123100 | B2831: 102290 | C2831: 102290 | D2831: 0 | E2831: 0 | F2831: 0 | G2831: 0 | I2831: 0.1 | J2831: 3 | K2831: 3 | N2831: 战争泰坦 | P2831: =COUNTIF(RC[-13]:RC[-9],"<>"&0) -> 1 | Q2831: 1
A2832: 124010 | B2832: 102301 | C2832: 102300 | D2832: 102301 | E2832: 102301 | F2832: 102302 | G2832: 102302 | J2832: =IF(MOD(RC[-9],10)=2,3,"") ->  | K2832: 3 | P2832: =COUNTIF(RC[-13]:RC[-9],"<>"&0) -> 5 | Q2832: 5
A2833: 124020 | B2833: 102310 | C2833: 102310 | D2833: 102310 | E2833: 102310 | F2833: 102311 | G2833: 102312 | J2833: =IF(MOD(RC[-9],10)=2,3,"") ->  | K2833: 3 | P2833: =COUNTIF(RC[-13]:RC[-9],"<>"&0) -> 5 | Q2833: 5
A2834: 124030 | B2834: 102321 | C2834: 102320 | D2834: 102320 | E2834: 102321 | F2834: 102321 | G2834: 102322 | J2834: =IF(MOD(RC[-9],10)=2,3,"") ->  | K2834: 3 | P2834: =COUNTIF(RC[-13]:RC[-9],"<>"&0) -> 5 | Q2834: 4
A2835: 124031 | B2835: 102323 | C2835: 102323 | D2835: 102320 | E2835: 102321 | F2835: 102322 | G2835: 102322 | J2835: =IF(MOD(RC[-9],10)=2,3,"") ->  | K2835: 3 | N2835: 铁人 | P2835: =COUNTIF(RC[-13]:RC[-9],"<>"&0) -> 5 | Q2835: 4
A2836: 124040 | B2836: 102330 | C2836: 102330 | D2836: 102330 | E2836: 102330 | F2836: 102331 | G2836: 102331 | J2836: =IF(MOD(RC[-9],10)=2,3,"") ->  | K2836: 3 | P2836: =COUNTIF(RC[-13]:RC[-9],"<>"&0) -> 5 | Q2836: 5
A2837: 124050 | B2837: 102340 | C2837: 102340 | D2837: 102340 | E2837: 102341 | F2837: 102342 | G2837: 102343 | J2837: =IF(MOD(RC[-9],10)=2,3,"") ->  | K2837: 3 | P2837: =COUNTIF(RC[-13]:RC[-9],"<>"&0) -> 5 | Q2837: 5
A2838: 124060 | B2838: 102350 | C2838: 102350 | D2838: 102351 | E2838: 102352 | F2838: 102353 | G2838: 102353 | J2838: =IF(MOD(RC[-9],10)=2,3,"") ->  | K2838: 3 | P2838: =COUNTIF(RC[-13]:RC[-9],"<>"&0) -> 5 | Q2838: 4
A2839: 124061 | B2839: 102354 | C2839: 102354 | D2839: 102350 | E2839: 102351 | F2839: 102352 | G2839: 102353 | J2839: =IF(MOD(RC[-9],10)=2,3,"") ->  | K2839: 3 | N2839: 基伦 | P2839: =COUNTIF(RC[-13]:RC[-9],"<>"&0) -> 5 | Q2839: 4
A2840: 124070 | B2840: 102361 | C2840: 102360 | D2840: 102361 | E2840: 102361 | F2840: 102362 | G2840: 102362 | J2840: =IF(MOD(RC[-9],10)=2,3,"") ->  | K2840: 3 | P2840: =COUNTIF(RC[-13]:RC[-9],"<>"&0) -> 5 | Q2840: 5
A2841: 124080 | B2841: 102370 | C2841: 102370 | D2841: 102370 | E2841: 102371 | F2841: 102372 | G2841: 102372 | J2841: =IF(MOD(RC[-9],10)=2,3,"") ->  | K2841: 3 | P2841: =COUNTIF(RC[-13]:RC[-9],"<>"&0) -> 5 | Q2841: 5
A2842: 124090 | B2842: 102380 | C2842: 102380 | D2842: 102380 | E2842: 102381 | F2842: 102381 | G2842: 102382 | J2842: =IF(MOD(RC[-9],10)=2,3,"") ->  | K2842: 3 | P2842: =COUNTIF(RC[-13]:RC[-9],"<>"&0) -> 5 | Q2842: 4
A2843: 124091 | B2843: 102383 | C2843: 102383 | D2843: 102380 | E2843: 102381 | F2843: 102381 | G2843: 102382 | J2843: =IF(MOD(RC[-9],10)=2,3,"") ->  | K2843: 3 | N2843: 神圣牧师 | P2843: =COUNTIF(RC[-13]:RC[-9],"<>"&0) -> 5 | Q2843: 4
A2844: 124100 | B2844: 102390 | C2844: 102390 | D2844: 102391 | E2844: 102392 | F2844: 102393 | G2844: 0 | J2844: =IF(MOD(RC[-9],10)=2,3,"") ->  | K2844: 3 | P2844: =COUNTIF(RC[-13]:RC[-9],"<>"&0) -> 4 | Q2844: 4
A2845: 124101 | B2845: 102390 | C2845: 102390 | D2845: 102391 | E2845: 102392 | F2845: 102393 | G2845: 0 | J2845: =IF(MOD(RC[-9],10)=2,3,"") ->  | K2845: 3 | P2845: =COUNTIF(RC[-13]:RC[-9],"<>"&0) -> 4 | Q2845: 4
A2846: 124102 | B2846: 102394 | C2846: 102394 | D2846: 102390 | E2846: 102391 | F2846: 102392 | G2846: 0 | I2846: 0.1 | J2846: =IF(MOD(RC[-9],10)=2,3,"") -> 3 | K2846: 3 | N2846: 雅典娜 | P2846: =COUNTIF(RC[-13]:RC[-9],"<>"&0) -> 4 | Q2846: 4
A2847: 125010 | B2847: 102400 | C2847: 102400 | D2847: 102400 | E2847: 102401 | F2847: 102402 | G2847: 102403 | J2847: =IF(MOD(RC[-9],10)=2,3,"") ->  | K2847: 3 | P2847: =COUNTIF(RC[-13]:RC[-9],"<>"&0) -> 5 | Q2847: 5
A2848: 125020 | B2848: 102410 | C2848: 102410 | D2848: 102410 | E2848: 102410 | F2848: 102411 | G2848: 102411 | J2848: =IF(MOD(RC[-9],10)=2,3,"") ->  | K2848: 3 | P2848: =COUNTIF(RC[-13]:RC[-9],"<>"&0) -> 5 | Q2848: 5
A2849: 125030 | B2849: 102420 | C2849: 102420 | D2849: 102421 | E2849: 102422 | F2849: 102423 | G2849: 102423 | J2849: =IF(MOD(RC[-9],10)=2,3,"") ->  | K2849: 3 | P2849: =COUNTIF(RC[-13]:RC[-9],"<>"&0) -> 5 | Q2849: 4
A2850: 125031 | B2850: 102424 | C2850: 102424 | D2850: 102420 | E2850: 102421 | F2850: 102422 | G2850: 102423 | J2850: =IF(MOD(RC[-9],10)=2,3,"") ->  | K2850: 3 | N2850: 石头人 | P2850: =COUNTIF(RC[-13]:RC[-9],"<>"&0) -> 5 | Q2850: 4
A2851: 125040 | B2851: 102430 | C2851: 102430 | D2851: 102430 | E2851: 102431 | F2851: 102432 | G2851: 102432 | J2851: =IF(MOD(RC[-9],10)=2,3,"") ->  | K2851: 3 | P2851: =COUNTIF(RC[-13]:RC[-9],"<>"&0) -> 5 | Q2851: 5
A2852: 125050 | B2852: 102440 | C2852: 102440 | D2852: 102440 | E2852: 102440 | F2852: 102441 | G2852: 102442 | J2852: =IF(MOD(RC[-9],10)=2,3,"") ->  | K2852: 3 | P2852: =COUNTIF(RC[-13]:RC[-9],"<>"&0) -> 5 | Q2852: 5
A2853: 125060 | B2853: 102450 | C2853: 102450 | D2853: 102451 | E2853: 102452 | F2853: 102453 | G2853: 102453 | J2853: =IF(MOD(RC[-9],10)=2,3,"") ->  | K2853: 3 | P2853: =COUNTIF(RC[-13]:RC[-9],"<>"&0) -> 5 | Q2853: 4
A2854: 125061 | B2854: 102454 | C2854: 102454 | D2854: 102450 | E2854: 102451 | F2854: 102452 | G2854: 102453 | J2854: =IF(MOD(RC[-9],10)=2,3,"") ->  | K2854: 3 | N2854: 大检察官 | P2854: =COUNTIF(RC[-13]:RC[-9],"<>"&0) -> 5 | Q2854: 4
A2855: 125070 | B2855: 102460 | C2855: 102460 | D2855: 102460 | E2855: 102460 | F2855: 102461 | G2855: 102462 | J2855: =IF(MOD(RC[-9],10)=2,3,"") ->  | K2855: 3 | P2855: =COUNTIF(RC[-13]:RC[-9],"<>"&0) -> 5 | Q2855: 5
A2856: 125080 | B2856: 102471 | C2856: 102470 | D2856: 102471 | E2856: 102471 | F2856: 102472 | G2856: 102472 | J2856: =IF(MOD(RC[-9],10)=2,3,"") ->  | K2856: 3 | P2856: =COUNTIF(RC[-13]:RC[-9],"<>"&0) -> 5 | Q2856: 5
A2857: 125090 | B2857: 102481 | C2857: 102480 | D2857: 102481 | E2857: 102482 | F2857: 102483 | G2857: 102483 | J2857: =IF(MOD(RC[-9],10)=2,3,"") ->  | K2857: 3 | P2857: =COUNTIF(RC[-13]:RC[-9],"<>"&0) -> 5 | Q2857: 4
A2858: 125091 | B2858: 102484 | C2858: 102484 | D2858: 102480 | E2858: 102481 | F2858: 102482 | G2858: 102483 | J2858: =IF(MOD(RC[-9],10)=2,3,"") ->  | K2858: 3 | N2858: 恶魔猎手 | P2858: =COUNTIF(RC[-13]:RC[-9],"<>"&0) -> 5 | Q2858: 4
A2859: 125100 | B2859: 102490 | C2859: 102490 | D2859: 102490 | E2859: 102491 | F2859: 102492 | G2859: 0 | J2859: =IF(MOD(RC[-9],10)=2,3,"") ->  | K2859: 3 | P2859: =COUNTIF(RC[-13]:RC[-9],"<>"&0) -> 4 | Q2859: 4
A2860: 125101 | B2860: 102490 | C2860: 102490 | D2860: 102491 | E2860: 102491 | F2860: 102492 | G2860: 0 | J2860: =IF(MOD(RC[-9],10)=2,3,"") ->  | K2860: 3 | P2860: =COUNTIF(RC[-13]:RC[-9],"<>"&0) -> 4 | Q2860: 4
A2861: 125102 | B2861: 102494 | C2861: 102494 | D2861: 102493 | E2861: 102490 | F2861: 102491 | G2861: 0 | I2861: 0.1 | J2861: =IF(MOD(RC[-9],10)=2,3,"") -> 3 | K2861: 3 | N2861: 血色指挥官 | P2861: =COUNTIF(RC[-13]:RC[-9],"<>"&0) -> 4 | Q2861: 4
A2862: 126010 | B2862: 102500 | C2862: 102500 | D2862: 102500 | E2862: 102501 | F2862: 102502 | G2862: 102503 | J2862: =IF(MOD(RC[-9],10)=2,3,"") ->  | K2862: 3
A2863: 126020 | B2863: 102510 | C2863: 102510 | D2863: 102510 | E2863: 102511 | F2863: 102512 | G2863: 102513 | J2863: =IF(MOD(RC[-9],10)=2,3,"") ->  | K2863: 3
A2864: 126030 | B2864: 102523 | C2864: 102520 | D2864: 102521 | E2864: 102522 | F2864: 102523 | G2864: 102523 | J2864: =IF(MOD(RC[-9],10)=2,3,"") ->  | K2864: 3
A2865: 126031 | B2865: 102524 | C2865: 102521 | D2865: 102522 | E2865: 102523 | F2865: 102524 | G2865: 102523 | J2865: =IF(MOD(RC[-9],10)=2,3,"") ->  | K2865: 3 | N2865: 半人马
A2866: 126040 | B2866: 102531 | C2866: 102530 | D2866: 102530 | E2866: 102531 | F2866: 102531 | G2866: 102532 | J2866: =IF(MOD(RC[-9],10)=2,3,"") ->  | K2866: 3
A2867: 126050 | B2867: 102540 | C2867: 102540 | D2867: 102540 | E2867: 102540 | F2867: 102541 | G2867: 102541 | J2867: =IF(MOD(RC[-9],10)=2,3,"") ->  | K2867: 3
A2868: 126060 | B2868: 102552 | C2868: 102550 | D2868: 102551 | E2868: 102552 | F2868: 102553 | G2868: 102553 | J2868: =IF(MOD(RC[-9],10)=2,3,"") ->  | K2868: 3
A2869: 126061 | B2869: 102554 | C2869: 102550 | D2869: 102551 | E2869: 102553 | F2869: 102551 | G2869: 102554 | J2869: =IF(MOD(RC[-9],10)=2,3,"") ->  | K2869: 3 | N2869: 小黑
A2870: 126070 | B2870: 102560 | C2870: 102560 | D2870: 102560 | E2870: 102560 | F2870: 102561 | G2870: 102562 | J2870: =IF(MOD(RC[-9],10)=2,3,"") ->  | K2870: 3
A2871: 126080 | B2871: 102571 | C2871: 102570 | D2871: 102571 | E2871: 102571 | F2871: 102572 | G2871: 102573 | J2871: =IF(MOD(RC[-9],10)=2,3,"") ->  | K2871: 3
A2872: 126090 | B2872: 102583 | C2872: 102580 | D2872: 102581 | E2872: 102582 | F2872: 102583 | G2872: 102580 | J2872: =IF(MOD(RC[-9],10)=2,3,"") ->  | K2872: 3
A2873: 126091 | B2873: 102584 | C2873: 102580 | D2873: 102581 | E2873: 102583 | F2873: 102584 | G2873: 102583 | J2873: =IF(MOD(RC[-9],10)=2,3,"") ->  | K2873: 3 | N2873: 火女
A2874: 126100 | B2874: 102590 | C2874: 102590 | D2874: 102591 | E2874: 102592 | F2874: 102593 | G2874: 0 | J2874: =IF(MOD(RC[-9],10)=2,3,"") ->  | K2874: 3
A2875: 126101 | B2875: 102591 | C2875: 102591 | D2875: 102592 | E2875: 102593 | F2875: 102594 | G2875: 0 | J2875: =IF(MOD(RC[-9],10)=2,3,"") ->  | K2875: 3
A2876: 126102 | B2876: 102596 | C2876: 102591 | D2876: 102594 | E2876: 102595 | F2876: 102596 | G2876: 0 | I2876: 0.1 | J2876: =IF(MOD(RC[-9],10)=2,3,"") -> 3 | K2876: 3 | N2876: 牛头人
A2877: 127010 | B2877: 102600 | C2877: 102600 | D2877: 102600 | E2877: 102601 | F2877: 102602 | G2877: 102603 | J2877: =IF(MOD(RC[-9],10)=2,3,"") ->  | K2877: 3
A2878: 127020 | B2878: 102610 | C2878: 102610 | D2878: 102610 | E2878: 102610 | F2878: 102611 | G2878: 102611 | J2878: =IF(MOD(RC[-9],10)=2,3,"") ->  | K2878: 3
A2879: 127030 | B2879: 102621 | C2879: 102620 | D2879: 102621 | E2879: 102622 | F2879: 102623 | G2879: 102623 | J2879: =IF(MOD(RC[-9],10)=2,3,"") ->  | K2879: 3
A2880: 127031 | B2880: 102625 | C2880: 102625 | D2880: 102624 | E2880: 102620 | F2880: 102622 | G2880: 102623 | J2880: =IF(MOD(RC[-9],10)=2,3,"") ->  | K2880: 3 | N2880: 致命特工
A2881: 127040 | B2881: 102630 | C2881: 102630 | D2881: 102630 | E2881: 102631 | F2881: 102632 | G2881: 102632 | J2881: =IF(MOD(RC[-9],10)=2,3,"") ->  | K2881: 3
A2882: 127050 | B2882: 102642 | C2882: 102640 | D2882: 102640 | E2882: 102641 | F2882: 102642 | G2882: 102642 | J2882: =IF(MOD(RC[-9],10)=2,3,"") ->  | K2882: 3
A2883: 127060 | B2883: 102650 | C2883: 102650 | D2883: 102650 | E2883: 102652 | F2883: 102653 | G2883: 102651 | J2883: =IF(MOD(RC[-9],10)=2,3,"") ->  | K2883: 3
A2884: 127061 | B2884: 102654 | C2884: 102650 | D2884: 102651 | E2884: 102653 | F2884: 102654 | G2884: 102652 | J2884: =IF(MOD(RC[-9],10)=2,3,"") ->  | K2884: 3 | N2884: 亚马逊女王
A2885: 127070 | B2885: 102660 | C2885: 102660 | D2885: 102660 | E2885: 102660 | F2885: 102661 | G2885: 102662 | J2885: =IF(MOD(RC[-9],10)=2,3,"") ->  | K2885: 3
A2886: 127080 | B2886: 102671 | C2886: 102670 | D2886: 102670 | E2886: 102671 | F2886: 102671 | G2886: 102672 | J2886: =IF(MOD(RC[-9],10)=2,3,"") ->  | K2886: 3
A2887: 127090 | B2887: 102683 | C2887: 102680 | D2887: 102681 | E2887: 102682 | F2887: 102683 | G2887: 102682 | J2887: =IF(MOD(RC[-9],10)=2,3,"") ->  | K2887: 3
A2888: 127091 | B2888: 102684 | C2888: 102680 | D2888: 102682 | E2888: 102683 | F2888: 102684 | G2888: 102681 | J2888: =IF(MOD(RC[-9],10)=2,3,"") ->  | K2888: 3 | N2888: 斯巴达
A2889: 127100 | B2889: 102692 | C2889: 102690 | D2889: 102691 | E2889: 102692 | F2889: 102694 | G2889: 0 | J2889: =IF(MOD(RC[-9],10)=2,3,"") ->  | K2889: 3
A2890: 127101 | B2890: 102693 | C2890: 102690 | D2890: 102691 | E2890: 102693 | F2890: 102694 | G2890: 0 | J2890: =IF(MOD(RC[-9],10)=2,3,"") ->  | K2890: 3
A2891: 127102 | B2891: 102695 | C2891: 102690 | D2891: 102692 | E2891: 102694 | F2891: 102695 | G2891: 0 | I2891: 0.1 | J2891: =IF(MOD(RC[-9],10)=2,3,"") -> 3 | K2891: 3 | N2891: 树人
A2892: 128010 | B2892: 102700 | C2892: 102700 | D2892: 102700 | E2892: 102700 | F2892: 102701 | G2892: 102701 | J2892: =IF(MOD(RC[-9],10)=2,3,"") ->  | K2892: 3
A2893: 128020 | B2893: 102710 | C2893: 102710 | D2893: 102710 | E2893: 102710 | F2893: 102711 | G2893: 102712 | J2893: =IF(MOD(RC[-9],10)=2,3,"") ->  | K2893: 3
A2894: 128030 | B2894: 102720 | C2894: 102720 | D2894: 102720 | E2894: 102721 | F2894: 102723 | G2894: 102722 | J2894: =IF(MOD(RC[-9],10)=2,3,"") ->  | K2894: 3
A2895: 128031 | B2895: 102724 | C2895: 102720 | D2895: 102722 | E2895: 102723 | F2895: 102724 | G2895: 102723 | J2895: =IF(MOD(RC[-9],10)=2,3,"") ->  | K2895: 3 | N2895: 佐罗
A2896: 128040 | B2896: 102730 | C2896: 102730 | D2896: 102730 | E2896: 102730 | F2896: 102731 | G2896: 102731 | J2896: =IF(MOD(RC[-9],10)=2,3,"") ->  | K2896: 3
A2897: 128050 | B2897: 102740 | C2897: 102740 | D2897: 102740 | E2897: 102740 | F2897: 102741 | G2897: 102742 | J2897: =IF(MOD(RC[-9],10)=2,3,"") ->  | K2897: 3
A2898: 128060 | B2898: 102750 | C2898: 102750 | D2898: 102751 | E2898: 102752 | F2898: 102753 | G2898: 102752 | J2898: =IF(MOD(RC[-9],10)=2,3,"") ->  | K2898: 3
A2899: 128061 | B2899: 102754 | C2899: 102750 | D2899: 102752 | E2899: 102753 | F2899: 102754 | G2899: 102751 | J2899: =IF(MOD(RC[-9],10)=2,3,"") ->  | K2899: 3 | N2899: 死亡武士
A2900: 128070 | B2900: 102761 | C2900: 102760 | D2900: 102760 | E2900: 102761 | F2900: 102761 | G2900: 102762 | J2900: =IF(MOD(RC[-9],10)=2,3,"") ->  | K2900: 3
A2901: 128080 | B2901: 102771 | C2901: 102770 | D2901: 102770 | E2901: 102771 | F2901: 102771 | G2901: 102771 | J2901: =IF(MOD(RC[-9],10)=2,3,"") ->  | K2901: 3
A2902: 128090 | B2902: 102780 | C2902: 102780 | D2902: 102781 | E2902: 102782 | F2902: 102783 | G2902: 102781 | J2902: =IF(MOD(RC[-9],10)=2,3,"") ->  | K2902: 3
A2903: 128091 | B2903: 102784 | C2903: 102780 | D2903: 102783 | E2903: 102783 | F2903: 102784 | G2903: 102782 | J2903: =IF(MOD(RC[-9],10)=2,3,"") ->  | K2903: 3 | N2903: 杰克船长
A2904: 128100 | B2904: 102792 | C2904: 102790 | D2904: 102791 | E2904: 102792 | F2904: 102793 | G2904: 0 | J2904: =IF(MOD(RC[-9],10)=2,3,"") ->  | K2904: 3
A2905: 128101 | B2905: 102794 | C2905: 102791 | D2905: 102792 | E2905: 102793 | F2905: 102794 | G2905: 0 | J2905: =IF(MOD(RC[-9],10)=2,3,"") ->  | K2905: 3
A2906: 128102 | B2906: 102795 | C2906: 102790 | D2906: 102791 | E2906: 102794 | F2906: 102795 | G2906: 0 | I2906: 0.1 | J2906: =IF(MOD(RC[-9],10)=2,3,"") -> 3 | K2906: 3 | N2906: 冥王哈迪斯
A2907: 129010 | B2907: 102802 | C2907: 102800 | D2907: 102800 | E2907: 102801 | F2907: 102802 | G2907: 102802 | J2907: =IF(MOD(RC[-9],10)=2,3,"") ->  | K2907: 3
A2908: 129020 | B2908: 102812 | C2908: 102810 | D2908: 102810 | E2908: 102811 | F2908: 102812 | G2908: 102812 | J2908: =IF(MOD(RC[-9],10)=2,3,"") ->  | K2908: 3
A2909: 129030 | B2909: 102823 | C2909: 102820 | D2909: 102821 | E2909: 102822 | F2909: 102823 | G2909: 102822 | J2909: =IF(MOD(RC[-9],10)=2,3,"") ->  | K2909: 3
A2910: 129031 | B2910: 102824 | C2910: 102820 | D2910: 102821 | E2910: 102823 | F2910: 102824 | G2910: 102822 | J2910: =IF(MOD(RC[-9],10)=2,3,"") ->  | K2910: 3 | N2910: 混沌女巫
A2911: 129040 | B2911: 102830 | C2911: 102830 | D2911: 102831 | E2911: 102832 | F2911: 102833 | G2911: 102834 | J2911: =IF(MOD(RC[-9],10)=2,3,"") ->  | K2911: 3
A2912: 129050 | B2912: 102841 | C2912: 102840 | D2912: 102840 | E2912: 102840 | F2912: 102841 | G2912: 102841 | J2912: =IF(MOD(RC[-9],10)=2,3,"") ->  | K2912: 3
A2913: 129060 | B2913: 102850 | C2913: 102850 | D2913: 102850 | E2913: 102851 | F2913: 102851 | G2913: 102852 | J2913: =IF(MOD(RC[-9],10)=2,3,"") ->  | K2913: 3
A2914: 129061 | B2914: 102853 | C2914: 102850 | D2914: 102851 | E2914: 102852 | F2914: 102853 | G2914: 102852 | J2914: =IF(MOD(RC[-9],10)=2,3,"") ->  | K2914: 3 | N2914: 超级队长
A2915: 129070 | B2915: 102861 | C2915: 102860 | D2915: 102860 | E2915: 102861 | F2915: 102861 | G2915: 102862 | J2915: =IF(MOD(RC[-9],10)=2,3,"") ->  | K2915: 3
A2916: 129080 | B2916: 102871 | C2916: 102870 | D2916: 102870 | E2916: 102871 | F2916: 102871 | G2916: 102872 | J2916: =IF(MOD(RC[-9],10)=2,3,"") ->  | K2916: 3
A2917: 129090 | B2917: 102880 | C2917: 102880 | D2917: 102880 | E2917: 102881 | F2917: 102881 | G2917: 102882 | J2917: =IF(MOD(RC[-9],10)=2,3,"") ->  | K2917: 3
A2918: 129091 | B2918: 102883 | C2918: 102880 | D2918: 102880 | E2918: 102882 | F2918: 102883 | G2918: 102881 | J2918: =IF(MOD(RC[-9],10)=2,3,"") ->  | K2918: 3 | N2918: 白凤凰
A2919: 129100 | B2919: 102893 | C2919: 102890 | D2919: 102891 | E2919: 102892 | F2919: 102893 | G2919: 0 | J2919: =IF(MOD(RC[-9],10)=2,3,"") ->  | K2919: 3
A2920: 129101 | B2920: 102890 | C2920: 102890 | D2920: 102890 | E2920: 102891 | F2920: 102893 | G2920: 0 | J2920: =IF(MOD(RC[-9],10)=2,3,"") ->  | K2920: 3
A2921: 129102 | B2921: 102895 | C2921: 102890 | D2921: 102891 | E2921: 102894 | F2921: 102895 | G2921: 0 | I2921: 0.1 | J2921: =IF(MOD(RC[-9],10)=2,3,"") -> 3 | K2921: 3 | N2921: 超凡博士
A2922: 130010 | B2922: 102900 | C2922: 102900 | D2922: 102900 | E2922: 102901 | F2922: 102902 | G2922: 102902 | J2922: =IF(MOD(RC[-9],10)=2,3,"") ->  | K2922: 3
A2923: 130020 | B2923: 102911 | C2923: 102910 | D2923: 102910 | E2923: 102911 | F2923: 102911 | G2923: 102912 | J2923: =IF(MOD(RC[-9],10)=2,3,"") ->  | K2923: 3
A2924: 130030 | B2924: 102922 | C2924: 102920 | D2924: 102921 | E2924: 102922 | F2924: 102923 | G2924: 102923 | J2924: =IF(MOD(RC[-9],10)=2,3,"") ->  | K2924: 3
A2925: 130031 | B2925: 102924 | C2925: 102920 | D2925: 102921 | E2925: 102923 | F2925: 102924 | G2925: 102922 | J2925: =IF(MOD(RC[-9],10)=2,3,"") ->  | K2925: 3 | N2925: 铁人
A2926: 130040 | B2926: 102930 | C2926: 102930 | D2926: 102930 | E2926: 102930 | F2926: 102931 | G2926: 102932 | J2926: =IF(MOD(RC[-9],10)=2,3,"") ->  | K2926: 3
A2927: 130050 | B2927: 102940 | C2927: 102940 | D2927: 102940 | E2927: 102941 | F2927: 102942 | G2927: 102943 | J2927: =IF(MOD(RC[-9],10)=2,3,"") ->  | K2927: 3
A2928: 130060 | B2928: 102950 | C2928: 102950 | D2928: 102951 | E2928: 102952 | F2928: 102953 | G2928: 102952 | J2928: =IF(MOD(RC[-9],10)=2,3,"") ->  | K2928: 3
A2929: 130061 | B2929: 102954 | C2929: 102951 | D2929: 102951 | E2929: 102953 | F2929: 102954 | G2929: 102952 | J2929: =IF(MOD(RC[-9],10)=2,3,"") ->  | K2929: 3 | N2929: 地狱铁拳
A2930: 130070 | B2930: 102962 | C2930: 102960 | D2930: 102960 | E2930: 102961 | F2930: 102962 | G2930: 102962 | J2930: =IF(MOD(RC[-9],10)=2,3,"") ->  | K2930: 3
A2931: 130080 | B2931: 102970 | C2931: 102970 | D2931: 102970 | E2931: 102971 | F2931: 102971 | G2931: 102972 | J2931: =IF(MOD(RC[-9],10)=2,3,"") ->  | K2931: 3
A2932: 130090 | B2932: 102980 | C2932: 102980 | D2932: 102981 | E2932: 102982 | F2932: 102983 | G2932: 102982 | J2932: =IF(MOD(RC[-9],10)=2,3,"") ->  | K2932: 3
A2933: 130091 | B2933: 102984 | C2933: 102980 | D2933: 102981 | E2933: 102983 | F2933: 102984 | G2933: 102982 | J2933: =IF(MOD(RC[-9],10)=2,3,"") ->  | K2933: 3 | N2933: 刀锋猎人
A2934: 130100 | B2934: 102990 | C2934: 102990 | D2934: 102991 | E2934: 102992 | F2934: 102993 | G2934: 0 | J2934: =IF(MOD(RC[-9],10)=2,3,"") ->  | K2934: 3
A2935: 130101 | B2935: 102991 | C2935: 102990 | D2935: 102991 | E2935: 102993 | F2935: 102994 | G2935: 0 | J2935: =IF(MOD(RC[-9],10)=2,3,"") ->  | K2935: 3
A2936: 130102 | B2936: 102996 | C2936: 102993 | D2936: 102994 | E2936: 102995 | F2936: 102996 | G2936: 0 | I2936: 0.1 | J2936: =IF(MOD(RC[-9],10)=2,3,"") -> 3 | K2936: 3 | N2936: 地狱骑士
A2937: 131010 | B2937: 103000 | C2937: 103000 | D2937: 103000 | E2937: 103001 | F2937: 103002 | G2937: 103003 | J2937: =IF(MOD(RC[-9],10)=2,3,"") ->  | K2937: 3
A2938: 131020 | B2938: 103012 | C2938: 103010 | D2938: 103011 | E2938: 103012 | F2938: 103013 | G2938: 103014 | J2938: =IF(MOD(RC[-9],10)=2,3,"") ->  | K2938: 3
A2939: 131030 | B2939: 103020 | C2939: 103020 | D2939: 103020 | E2939: 103021 | F2939: 103022 | G2939: 103022 | J2939: =IF(MOD(RC[-9],10)=2,3,"") ->  | K2939: 3
A2940: 131031 | B2940: 103023 | C2940: 103020 | D2940: 103021 | E2940: 103022 | F2940: 103023 | G2940: 103021 | J2940: =IF(MOD(RC[-9],10)=2,3,"") ->  | K2940: 3 | N2940: 斯巴达
A2941: 131040 | B2941: 103030 | C2941: 103030 | D2941: 103030 | E2941: 103030 | F2941: 103031 | G2941: 103031 | J2941: =IF(MOD(RC[-9],10)=2,3,"") ->  | K2941: 3
A2942: 131050 | B2942: 103041 | C2942: 103040 | D2942: 103040 | E2942: 103041 | F2942: 103041 | G2942: 103042 | J2942: =IF(MOD(RC[-9],10)=2,3,"") ->  | K2942: 3
A2943: 131060 | B2943: 103051 | C2943: 103050 | D2943: 103050 | E2943: 103051 | F2943: 103051 | G2943: 103052 | J2943: =IF(MOD(RC[-9],10)=2,3,"") ->  | K2943: 3
A2944: 131061 | B2944: 103054 | C2944: 103050 | D2944: 103052 | E2944: 103053 | F2944: 103054 | G2944: 103051 | J2944: =IF(MOD(RC[-9],10)=2,3,"") ->  | K2944: 3 | N2944: 恶魔猎手
A2945: 131070 | B2945: 103061 | C2945: 103060 | D2945: 103060 | E2945: 103061 | F2945: 103061 | G2945: 103062 | J2945: =IF(MOD(RC[-9],10)=2,3,"") ->  | K2945: 3
A2946: 131080 | B2946: 103072 | C2946: 103070 | D2946: 103070 | E2946: 103071 | F2946: 103072 | G2946: 103072 | J2946: =IF(MOD(RC[-9],10)=2,3,"") ->  | K2946: 3
A2947: 131090 | B2947: 103080 | C2947: 103080 | D2947: 103080 | E2947: 103081 | F2947: 103082 | G2947: 103082 | J2947: =IF(MOD(RC[-9],10)=2,3,"") ->  | K2947: 3
A2948: 131091 | B2948: 103083 | C2948: 103080 | D2948: 103081 | E2948: 103082 | F2948: 103083 | G2948: 103081 | J2948: =IF(MOD(RC[-9],10)=2,3,"") ->  | K2948: 3 | N2948: 熊阿宝
A2949: 131100 | B2949: 103090 | C2949: 103090 | D2949: 103090 | E2949: 103091 | F2949: 103092 | G2949: 0 | J2949: =IF(MOD(RC[-9],10)=2,3,"") ->  | K2949: 3
A2950: 131101 | B2950: 103091 | C2950: 103090 | D2950: 103090 | E2950: 103091 | F2950: 103092 | G2950: 0 | J2950: =IF(MOD(RC[-9],10)=2,3,"") ->  | K2950: 3
A2951: 131102 | B2951: 103094 | C2951: 103090 | D2951: 103092 | E2951: 103093 | F2951: 103094 | G2951: 0 | I2951: 0.1 | J2951: =IF(MOD(RC[-9],10)=2,3,"") -> 3 | K2951: 3 | N2951: 小黑
A2952: 132010 | B2952: 103100 | C2952: 103100 | D2952: 103101 | E2952: 103102 | F2952: 103103 | G2952: 103104 | J2952: =IF(MOD(RC[-9],10)=2,3,"") ->  | K2952: 3
A2953: 132020 | B2953: 103110 | C2953: 103110 | D2953: 103110 | E2953: 103111 | F2953: 103111 | G2953: 103112 | J2953: =IF(MOD(RC[-9],10)=2,3,"") ->  | K2953: 3
A2954: 132030 | B2954: 103120 | C2954: 103120 | D2954: 103121 | E2954: 103122 | F2954: 103123 | G2954: 103123 | J2954: =IF(MOD(RC[-9],10)=2,3,"") ->  | K2954: 3
A2955: 132031 | B2955: 103124 | C2955: 103121 | D2955: 103122 | E2955: 103123 | F2955: 103124 | G2955: 103122 | J2955: =IF(MOD(RC[-9],10)=2,3,"") ->  | K2955: 3 | N2955: 佐罗
A2956: 132040 | B2956: 103130 | C2956: 103130 | D2956: 103130 | E2956: 103130 | F2956: 103131 | G2956: 103132 | J2956: =IF(MOD(RC[-9],10)=2,3,"") ->  | K2956: 3
A2957: 132050 | B2957: 103140 | C2957: 103140 | D2957: 103140 | E2957: 103140 | F2957: 103141 | G2957: 103142 | J2957: =IF(MOD(RC[-9],10)=2,3,"") ->  | K2957: 3
A2958: 132060 | B2958: 103150 | C2958: 103150 | D2958: 103150 | E2958: 103151 | F2958: 103152 | G2958: 103152 | J2958: =IF(MOD(RC[-9],10)=2,3,"") ->  | K2958: 3
A2959: 132061 | B2959: 103153 | C2959: 103150 | D2959: 103150 | E2959: 103152 | F2959: 103153 | G2959: 103151 | J2959: =IF(MOD(RC[-9],10)=2,3,"") ->  | K2959: 3 | N2959: 食人魔
A2960: 132070 | B2960: 103160 | C2960: 103160 | D2960: 103160 | E2960: 103161 | F2960: 103162 | G2960: 103163 | J2960: =IF(MOD(RC[-9],10)=2,3,"") ->  | K2960: 3
A2961: 132080 | B2961: 103171 | C2961: 103170 | D2961: 103170 | E2961: 103171 | F2961: 103171 | G2961: 103172 | J2961: =IF(MOD(RC[-9],10)=2,3,"") ->  | K2961: 3
A2962: 132090 | B2962: 103182 | C2962: 103180 | D2962: 103181 | E2962: 103182 | F2962: 103183 | G2962: 103183 | J2962: =IF(MOD(RC[-9],10)=2,3,"") ->  | K2962: 3
A2963: 132091 | B2963: 103184 | C2963: 103181 | D2963: 103182 | E2963: 103183 | F2963: 103184 | G2963: 103181 | J2963: =IF(MOD(RC[-9],10)=2,3,"") ->  | K2963: 3 | N2963: 德古拉伯爵
A2964: 132100 | B2964: 103190 | C2964: 103190 | D2964: 103191 | E2964: 103192 | F2964: 103193 | G2964: 0 | J2964: =IF(MOD(RC[-9],10)=2,3,"") ->  | K2964: 3
A2965: 132101 | B2965: 103192 | C2965: 103190 | D2965: 103191 | E2965: 103192 | F2965: 103193 | G2965: 0 | J2965: =IF(MOD(RC[-9],10)=2,3,"") ->  | K2965: 3
A2966: 132102 | B2966: 103195 | C2966: 103191 | D2966: 103193 | E2966: 103194 | F2966: 103195 | G2966: 0 | I2966: 0.1 | J2966: =IF(MOD(RC[-9],10)=2,3,"") -> 3 | K2966: 3 | N2966: 美杜莎
A2967: 133010 | B2967: 103200 | C2967: 103200 | D2967: 103200 | E2967: 103200 | F2967: 103201 | G2967: 103202 | J2967: =IF(MOD(RC[-9],10)=2,3,"") ->  | K2967: 3
A2968: 133020 | B2968: 103211 | C2968: 103210 | D2968: 103210 | E2968: 103211 | F2968: 103211 | G2968: 103212 | J2968: =IF(MOD(RC[-9],10)=2,3,"") ->  | K2968: 3
A2969: 133030 | B2969: 103221 | C2969: 103220 | D2969: 103220 | E2969: 103221 | F2969: 103222 | G2969: 103222 | J2969: =IF(MOD(RC[-9],10)=2,3,"") ->  | K2969: 3
A2970: 133031 | B2970: 103223 | C2970: 103220 | D2970: 103221 | E2970: 103222 | F2970: 103223 | G2970: 103221 | J2970: =IF(MOD(RC[-9],10)=2,3,"") ->  | K2970: 3 | N2970: 天使长
A2971: 133040 | B2971: 103230 | C2971: 103230 | D2971: 103230 | E2971: 103231 | F2971: 103232 | G2971: 103233 | J2971: =IF(MOD(RC[-9],10)=2,3,"") ->  | K2971: 3
A2972: 133050 | B2972: 103240 | C2972: 103240 | D2972: 103240 | E2972: 103241 | F2972: 103242 | G2972: 103242 | J2972: =IF(MOD(RC[-9],10)=2,3,"") ->  | K2972: 3
A2973: 133060 | B2973: 103250 | C2973: 103250 | D2973: 103250 | E2973: 103251 | F2973: 103252 | G2973: 103252 | J2973: =IF(MOD(RC[-9],10)=2,3,"") ->  | K2973: 3
A2974: 133061 | B2974: 103253 | C2974: 103250 | D2974: 103251 | E2974: 103252 | F2974: 103253 | G2974: 103251 | J2974: =IF(MOD(RC[-9],10)=2,3,"") ->  | K2974: 3 | N2974: 半人马
A2975: 133070 | B2975: 103262 | C2975: 103260 | D2975: 103261 | E2975: 103262 | F2975: 103263 | G2975: 103264 | J2975: =IF(MOD(RC[-9],10)=2,3,"") ->  | K2975: 3
A2976: 133080 | B2976: 103271 | C2976: 103270 | D2976: 103270 | E2976: 103271 | F2976: 103271 | G2976: 103272 | J2976: =IF(MOD(RC[-9],10)=2,3,"") ->  | K2976: 3
A2977: 133090 | B2977: 103280 | C2977: 103280 | D2977: 103280 | E2977: 103281 | F2977: 103282 | G2977: 103282 | J2977: =IF(MOD(RC[-9],10)=2,3,"") ->  | K2977: 3
A2978: 133091 | B2978: 103283 | C2978: 103280 | D2978: 103281 | E2978: 103282 | F2978: 103283 | G2978: 103281 | J2978: =IF(MOD(RC[-9],10)=2,3,"") ->  | K2978: 3 | N2978: 野蛮巨人
A2979: 133100 | B2979: 103291 | C2979: 103290 | D2979: 103290 | E2979: 103291 | F2979: 103292 | G2979: 0 | J2979: =IF(MOD(RC[-9],10)=2,3,"") ->  | K2979: 3
A2980: 133101 | B2980: 103290 | C2980: 103290 | D2980: 103290 | E2980: 103291 | F2980: 103292 | G2980: 0 | J2980: =IF(MOD(RC[-9],10)=2,3,"") ->  | K2980: 3
A2981: 133102 | B2981: 103294 | C2981: 103290 | D2981: 103292 | E2981: 103293 | F2981: 103294 | G2981: 0 | I2981: 0.1 | J2981: =IF(MOD(RC[-9],10)=2,3,"") -> 3 | K2981: 3 | N2981: 雷神
A2982: 134010 | B2982: 103300 | C2982: 103300 | D2982: 103300 | E2982: 103301 | F2982: 103302 | G2982: 103303 | J2982: =IF(MOD(RC[-9],10)=2,3,"") ->  | K2982: 3
A2983: 134020 | B2983: 103312 | C2983: 103310 | D2983: 103310 | E2983: 103311 | F2983: 103312 | G2983: 103312 | J2983: =IF(MOD(RC[-9],10)=2,3,"") ->  | K2983: 3
A2984: 134030 | B2984: 103320 | C2984: 103320 | D2984: 103320 | E2984: 103321 | F2984: 103322 | G2984: 103322 | J2984: =IF(MOD(RC[-9],10)=2,3,"") ->  | K2984: 3
A2985: 134031 | B2985: 103323 | C2985: 103320 | D2985: 103321 | E2985: 103322 | F2985: 103323 | G2985: 103321 | J2985: =IF(MOD(RC[-9],10)=2,3,"") ->  | K2985: 3 | N2985: 地狱骑士
A2986: 134040 | B2986: 103333 | C2986: 103330 | D2986: 103331 | E2986: 103332 | F2986: 103333 | G2986: 103333 | J2986: =IF(MOD(RC[-9],10)=2,3,"") ->  | K2986: 3
A2987: 134050 | B2987: 103341 | C2987: 103340 | D2987: 103341 | E2987: 103342 | F2987: 103343 | G2987: 103344 | J2987: =IF(MOD(RC[-9],10)=2,3,"") ->  | K2987: 3
A2988: 134060 | B2988: 103351 | C2988: 103350 | D2988: 103350 | E2988: 103351 | F2988: 103352 | G2988: 103352 | J2988: =IF(MOD(RC[-9],10)=2,3,"") ->  | K2988: 3
A2989: 134061 | B2989: 103353 | C2989: 103350 | D2989: 103351 | E2989: 103352 | F2989: 103353 | G2989: 103351 | J2989: =IF(MOD(RC[-9],10)=2,3,"") ->  | K2989: 3 | N2989: 基伦
A2990: 134070 | B2990: 103360 | C2990: 103360 | D2990: 103360 | E2990: 103361 | F2990: 103361 | G2990: 103362 | J2990: =IF(MOD(RC[-9],10)=2,3,"") ->  | K2990: 3
A2991: 134080 | B2991: 103371 | C2991: 103370 | D2991: 103370 | E2991: 103371 | F2991: 103371 | G2991: 103372 | J2991: =IF(MOD(RC[-9],10)=2,3,"") ->  | K2991: 3
A2992: 134090 | B2992: 103380 | C2992: 103380 | D2992: 103381 | E2992: 103382 | F2992: 103383 | G2992: 103383 | J2992: =IF(MOD(RC[-9],10)=2,3,"") ->  | K2992: 3
A2993: 134091 | B2993: 103384 | C2993: 103381 | D2993: 103382 | E2993: 103383 | F2993: 103384 | G2993: 103380 | J2993: =IF(MOD(RC[-9],10)=2,3,"") ->  | K2993: 3 | N2993: 章鱼博士
A2994: 134100 | B2994: 103391 | C2994: 103390 | D2994: 103391 | E2994: 103392 | F2994: 103393 | G2994: 0 | J2994: =IF(MOD(RC[-9],10)=2,3,"") ->  | K2994: 3
A2995: 134101 | B2995: 103390 | C2995: 103390 | D2995: 103391 | E2995: 103392 | F2995: 103393 | G2995: 0 | J2995: =IF(MOD(RC[-9],10)=2,3,"") ->  | K2995: 3
A2996: 134102 | B2996: 103394 | C2996: 103394 | D2996: 0 | E2996: 0 | F2996: 0 | G2996: 0 | I2996: 0.1 | J2996: =IF(MOD(RC[-9],10)=2,3,"") -> 3 | K2996: 3 | N2996: 战争主宰
A2997: 135010 | B2997: 103400 | C2997: 103400 | D2997: 103401 | E2997: 103402 | F2997: 103403 | G2997: 103404 | J2997: =IF(MOD(RC[-9],10)=2,3,"") ->  | K2997: 3
A2998: 135020 | B2998: 103411 | C2998: 103410 | D2998: 103410 | E2998: 103411 | F2998: 103411 | G2998: 103411 | J2998: =IF(MOD(RC[-9],10)=2,3,"") ->  | K2998: 3
A2999: 135030 | B2999: 103421 | C2999: 103420 | D2999: 103421 | E2999: 103422 | F2999: 103423 | G2999: 103423 | J2999: =IF(MOD(RC[-9],10)=2,3,"") ->  | K2999: 3
A3000: 135031 | B3000: 103424 | C3000: 103420 | D3000: 103421 | E3000: 103423 | F3000: 103424 | G3000: 103421 | J3000: =IF(MOD(RC[-9],10)=2,3,"") ->  | K3000: 3 | N3000: 女警
A3001: 135040 | B3001: 103430 | C3001: 103430 | D3001: 103430 | E3001: 103431 | F3001: 103432 | G3001: 103432 | J3001: =IF(MOD(RC[-9],10)=2,3,"") ->  | K3001: 3
A3002: 135050 | B3002: 103441 | C3002: 103440 | D3002: 103440 | E3002: 103441 | F3002: 103441 | G3002: 103441 | J3002: =IF(MOD(RC[-9],10)=2,3,"") ->  | K3002: 3
A3003: 135060 | B3003: 103451 | C3003: 103450 | D3003: 103450 | E3003: 103451 | F3003: 103452 | G3003: 103452 | J3003: =IF(MOD(RC[-9],10)=2,3,"") ->  | K3003: 3
A3004: 135061 | B3004: 103453 | C3004: 103450 | D3004: 103451 | E3004: 103452 | F3004: 103453 | G3004: 103451 | J3004: =IF(MOD(RC[-9],10)=2,3,"") ->  | K3004: 3 | N3004: 石头人
A3005: 135070 | B3005: 103461 | C3005: 103460 | D3005: 103460 | E3005: 103461 | F3005: 103461 | G3005: 103461 | J3005: =IF(MOD(RC[-9],10)=2,3,"") ->  | K3005: 3
A3006: 135080 | B3006: 103470 | C3006: 103470 | D3006: 103471 | E3006: 103472 | F3006: 103473 | G3006: 103474 | J3006: =IF(MOD(RC[-9],10)=2,3,"") ->  | K3006: 3
A3007: 135090 | B3007: 103482 | C3007: 103480 | D3007: 103481 | E3007: 103482 | F3007: 103483 | G3007: 103481 | J3007: =IF(MOD(RC[-9],10)=2,3,"") ->  | K3007: 3
A3008: 135091 | B3008: 103484 | C3008: 103480 | D3008: 103482 | E3008: 103483 | F3008: 103484 | G3008: 103481 | J3008: =IF(MOD(RC[-9],10)=2,3,"") ->  | K3008: 3 | N3008: 杰克船长
A3009: 135100 | B3009: 103493 | C3009: 103490 | D3009: 103491 | E3009: 103492 | F3009: 103493 | G3009: 0 | J3009: =IF(MOD(RC[-9],10)=2,3,"") ->  | K3009: 3
A3010: 135101 | B3010: 103493 | C3010: 103490 | D3010: 103491 | E3010: 103493 | F3010: 103494 | G3010: 0 | J3010: =IF(MOD(RC[-9],10)=2,3,"") ->  | K3010: 3
A3011: 135102 | B3011: 103495 | C3011: 103491 | D3011: 103493 | E3011: 103494 | F3011: 103495 | G3011: 0 | I3011: 0.1 | J3011: =IF(MOD(RC[-9],10)=2,3,"") -> 3 | K3011: 3 | N3011: 阿努比斯
A3012: 136010 | B3012: 103500 | C3012: 103500 | D3012: 103501 | E3012: 103502 | F3012: 103503 | G3012: 103504 | J3012: =IF(MOD(RC[-9],10)=2,3,"") ->  | K3012: 3
A3013: 136020 | B3013: 103511 | C3013: 103511 | D3013: 103511 | E3013: 103512 | F3013: 103512 | G3013: 103514 | J3013: =IF(MOD(RC[-9],10)=2,3,"") ->  | K3013: 3
A3014: 136030 | B3014: 103524 | C3014: 103520 | D3014: 103521 | E3014: 103522 | F3014: 103523 | G3014: 103523 | J3014: =IF(MOD(RC[-9],10)=2,3,"") ->  | K3014: 3
A3015: 136031 | B3015: 103525 | C3015: 103521 | D3015: 103522 | E3015: 103523 | F3015: 103525 | G3015: 103524 | J3015: =IF(MOD(RC[-9],10)=2,3,"") ->  | K3015: 3 | N3015: 超级队长
A3016: 136040 | B3016: 103531 | C3016: 103531 | D3016: 103531 | E3016: 103531 | F3016: 103532 | G3016: 103532 | J3016: =IF(MOD(RC[-9],10)=2,3,"") ->  | K3016: 3
A3017: 136050 | B3017: 103543 | C3017: 103540 | D3017: 103540 | E3017: 103543 | F3017: 103543 | G3017: 103544 | J3017: =IF(MOD(RC[-9],10)=2,3,"") ->  | K3017: 3
A3018: 136060 | B3018: 103550 | C3018: 103550 | D3018: 103550 | E3018: 103551 | F3018: 103553 | G3018: 103554 | J3018: =IF(MOD(RC[-9],10)=2,3,"") ->  | K3018: 3
A3019: 136061 | B3019: 103555 | C3019: 103551 | D3019: 103552 | E3019: 103553 | F3019: 103555 | G3019: 103554 | J3019: =IF(MOD(RC[-9],10)=2,3,"") ->  | K3019: 3 | N3019: 鹰眸
A3020: 136070 | B3020: 103562 | C3020: 103561 | D3020: 103561 | E3020: 103562 | F3020: 103562 | G3020: 103564 | J3020: =IF(MOD(RC[-9],10)=2,3,"") ->  | K3020: 3
A3021: 136080 | B3021: 103570 | C3021: 103570 | D3021: 103570 | E3021: 103570 | F3021: 103573 | G3021: 103574 | J3021: =IF(MOD(RC[-9],10)=2,3,"") ->  | K3021: 3
A3022: 136090 | B3022: 103584 | C3022: 103580 | D3022: 103581 | E3022: 103582 | F3022: 103583 | G3022: 103583 | J3022: =IF(MOD(RC[-9],10)=2,3,"") ->  | K3022: 3
A3023: 136091 | B3023: 103585 | C3023: 103581 | D3023: 103582 | E3023: 103583 | F3023: 103585 | G3023: 103584 | J3023: =IF(MOD(RC[-9],10)=2,3,"") ->  | K3023: 3 | N3023: 刀锋猎人
A3024: 136100 | B3024: 103590 | C3024: 103590 | D3024: 103590 | E3024: 103592 | F3024: 103594 | G3024: 0 | J3024: =IF(MOD(RC[-9],10)=2,3,"") ->  | K3024: 3
A3025: 136101 | B3025: 103591 | C3025: 103591 | D3025: 103591 | E3025: 103592 | F3025: 103593 | G3025: 0 | J3025: =IF(MOD(RC[-9],10)=2,3,"") ->  | K3025: 3
A3026: 136102 | B3026: 103595 | C3026: 103590 | D3026: 103591 | E3026: 103594 | F3026: 103595 | G3026: 0 | I3026: 0.1 | J3026: =IF(MOD(RC[-9],10)=2,3,"") -> 3 | K3026: 3 | N3026: 红颅鬼
A3027: 137010 | B3027: 103601 | C3027: 103600 | D3027: 103601 | E3027: 103601 | F3027: 103603 | G3027: 103604 | J3027: =IF(MOD(RC[-9],10)=2,3,"") ->  | K3027: 3
A3028: 137020 | B3028: 103611 | C3028: 103611 | D3028: 103611 | E3028: 103612 | F3028: 103612 | G3028: 103614 | J3028: =IF(MOD(RC[-9],10)=2,3,"") ->  | K3028: 3
A3029: 137030 | B3029: 103623 | C3029: 103620 | D3029: 103621 | E3029: 103622 | F3029: 103623 | G3029: 103622 | J3029: =IF(MOD(RC[-9],10)=2,3,"") ->  | K3029: 3
A3030: 137031 | B3030: 103625 | C3030: 103620 | D3030: 103621 | E3030: 103622 | F3030: 103623 | G3030: 103625 | J3030: =IF(MOD(RC[-9],10)=2,3,"") ->  | K3030: 3 | N3030: 神圣牧师
A3031: 137040 | B3031: 103631 | C3031: 103631 | D3031: 103631 | E3031: 103631 | F3031: 103632 | G3031: 103632 | J3031: =IF(MOD(RC[-9],10)=2,3,"") ->  | K3031: 3
A3032: 137050 | B3032: 103643 | C3032: 103640 | D3032: 103640 | E3032: 103643 | F3032: 103643 | G3032: 103644 | J3032: =IF(MOD(RC[-9],10)=2,3,"") ->  | K3032: 3
A3033: 137060 | B3033: 103650 | C3033: 103650 | D3033: 103650 | E3033: 103651 | F3033: 103653 | G3033: 103654 | J3033: =IF(MOD(RC[-9],10)=2,3,"") ->  | K3033: 3
A3034: 137061 | B3034: 103655 | C3034: 103650 | D3034: 103651 | E3034: 103651 | F3034: 103655 | G3034: 103654 | J3034: =IF(MOD(RC[-9],10)=2,3,"") ->  | K3034: 3 | N3034: 圣女贞德
A3035: 137070 | B3035: 103662 | C3035: 103661 | D3035: 103661 | E3035: 103662 | F3035: 103662 | G3035: 103664 | J3035: =IF(MOD(RC[-9],10)=2,3,"") ->  | K3035: 3
A3036: 137080 | B3036: 103670 | C3036: 103670 | D3036: 103670 | E3036: 103670 | F3036: 103673 | G3036: 103674 | J3036: =IF(MOD(RC[-9],10)=2,3,"") ->  | K3036: 3
A3037: 137090 | B3037: 103684 | C3037: 103680 | D3037: 103681 | E3037: 103682 | F3037: 103683 | G3037: 103683 | J3037: =IF(MOD(RC[-9],10)=2,3,"") ->  | K3037: 3
A3038: 137091 | B3038: 103685 | C3038: 103681 | D3038: 103681 | E3038: 103683 | F3038: 103685 | G3038: 103684 | J3038: =IF(MOD(RC[-9],10)=2,3,"") ->  | K3038: 3 | N3038: 雅典娜
A3039: 137100 | B3039: 103690 | C3039: 103690 | D3039: 103690 | E3039: 103692 | F3039: 103691 | G3039: 0 | J3039: =IF(MOD(RC[-9],10)=2,3,"") ->  | K3039: 3
A3040: 137101 | B3040: 103691 | C3040: 103691 | D3040: 103691 | E3040: 103692 | F3040: 103693 | G3040: 0 | J3040: =IF(MOD(RC[-9],10)=2,3,"") ->  | K3040: 3
A3041: 137102 | B3041: 103695 | C3041: 103690 | D3041: 103694 | E3041: 103694 | F3041: 103695 | G3041: 0 | I3041: 0.1 | J3041: =IF(MOD(RC[-9],10)=2,3,"") -> 3 | K3041: 3 | N3041: 佐罗
A3042: 138010 | B3042: 103700 | C3042: 103700 | D3042: 103700 | E3042: 103701 | F3042: 103702 | G3042: 103704 | J3042: =IF(MOD(RC[-9],10)=2,3,"") ->  | K3042: 3
A3043: 138020 | B3043: 103711 | C3043: 103711 | D3043: 103711 | E3043: 103712 | F3043: 103713 | G3043: 103714 | J3043: =IF(MOD(RC[-9],10)=2,3,"") ->  | K3043: 3
A3044: 138030 | B3044: 103724 | C3044: 103720 | D3044: 103721 | E3044: 103722 | F3044: 103723 | G3044: 103723 | J3044: =IF(MOD(RC[-9],10)=2,3,"") ->  | K3044: 3
A3045: 138031 | B3045: 103725 | C3045: 103721 | D3045: 103721 | E3045: 103722 | F3045: 103723 | G3045: 103725 | J3045: =IF(MOD(RC[-9],10)=2,3,"") ->  | K3045: 3 | N3045: 血源牧师
A3046: 138040 | B3046: 103731 | C3046: 103731 | D3046: 103731 | E3046: 103731 | F3046: 103732 | G3046: 103732 | J3046: =IF(MOD(RC[-9],10)=2,3,"") ->  | K3046: 3
A3047: 138050 | B3047: 103742 | C3047: 103740 | D3047: 103741 | E3047: 103742 | F3047: 103742 | G3047: 103744 | J3047: =IF(MOD(RC[-9],10)=2,3,"") ->  | K3047: 3
A3048: 138060 | B3048: 103750 | C3048: 103750 | D3048: 103750 | E3048: 103751 | F3048: 103753 | G3048: 103754 | J3048: =IF(MOD(RC[-9],10)=2,3,"") ->  | K3048: 3
A3049: 138061 | B3049: 103755 | C3049: 103750 | D3049: 103751 | E3049: 103753 | F3049: 103755 | G3049: 103754 | J3049: =IF(MOD(RC[-9],10)=2,3,"") ->  | K3049: 3 | N3049: 食人魔
A3050: 138070 | B3050: 103762 | C3050: 103761 | D3050: 103761 | E3050: 103762 | F3050: 103762 | G3050: 103764 | J3050: =IF(MOD(RC[-9],10)=2,3,"") ->  | K3050: 3
A3051: 138080 | B3051: 103770 | C3051: 103770 | D3051: 103770 | E3051: 103770 | F3051: 103773 | G3051: 103774 | J3051: =IF(MOD(RC[-9],10)=2,3,"") ->  | K3051: 3
A3052: 138090 | B3052: 103784 | C3052: 103780 | D3052: 103781 | E3052: 103782 | F3052: 103783 | G3052: 103783 | J3052: =IF(MOD(RC[-9],10)=2,3,"") ->  | K3052: 3
A3053: 138091 | B3053: 103785 | C3053: 103781 | D3053: 103782 | E3053: 103783 | F3053: 103785 | G3053: 103784 | J3053: =IF(MOD(RC[-9],10)=2,3,"") ->  | K3053: 3 | N3053: 地精万夫长
A3054: 138100 | B3054: 103790 | C3054: 103790 | D3054: 0 | E3054: 0 | F3054: 0 | G3054: 0 | I3054: 0.1 | J3054: 3 | K3054: 3 | N3054: 独眼巨人
A3055: 139010 | B3055: 103800 | C3055: 103800 | D3055: 103800 | E3055: 103800 | F3055: 103803 | G3055: 103803 | J3055: =IF(MOD(RC[-9],10)=2,3,"") ->  | K3055: 3
A3056: 139020 | B3056: 103811 | C3056: 103811 | D3056: 103811 | E3056: 103812 | F3056: 103813 | G3056: 103814 | J3056: =IF(MOD(RC[-9],10)=2,3,"") ->  | K3056: 3
A3057: 139030 | B3057: 103820 | C3057: 103820 | D3057: 103820 | E3057: 103821 | F3057: 103823 | G3057: 103823 | J3057: =IF(MOD(RC[-9],10)=2,3,"") ->  | K3057: 3
A3058: 139031 | B3058: 103825 | C3058: 103821 | D3058: 103821 | E3058: 103821 | F3058: 103823 | G3058: 103825 | J3058: =IF(MOD(RC[-9],10)=2,3,"") ->  | K3058: 3 | N3058: 矮人火枪手之王
A3059: 139040 | B3059: 103830 | C3059: 103830 | D3059: 103830 | E3059: 103830 | F3059: 103832 | G3059: 103834 | J3059: =IF(MOD(RC[-9],10)=2,3,"") ->  | K3059: 3
A3060: 139050 | B3060: 103843 | C3060: 103840 | D3060: 103841 | E3060: 103843 | F3060: 103843 | G3060: 103844 | J3060: =IF(MOD(RC[-9],10)=2,3,"") ->  | K3060: 3
A3061: 139060 | B3061: 103850 | C3061: 103850 | D3061: 103850 | E3061: 103851 | F3061: 103853 | G3061: 103854 | J3061: =IF(MOD(RC[-9],10)=2,3,"") ->  | K3061: 3
A3062: 139061 | B3062: 103855 | C3062: 103851 | D3062: 103852 | E3062: 103853 | F3062: 103855 | G3062: 103854 | J3062: =IF(MOD(RC[-9],10)=2,3,"") ->  | K3062: 3 | N3062: 角斗之王
A3063: 139070 | B3063: 103862 | C3063: 103861 | D3063: 103861 | E3063: 103862 | F3063: 103863 | G3063: 103864 | J3063: =IF(MOD(RC[-9],10)=2,3,"") ->  | K3063: 3
A3064: 139080 | B3064: 103870 | C3064: 103870 | D3064: 103870 | E3064: 103872 | F3064: 103873 | G3064: 103874 | J3064: =IF(MOD(RC[-9],10)=2,3,"") ->  | K3064: 3
A3065: 139090 | B3065: 103884 | C3065: 103880 | D3065: 103881 | E3065: 103882 | F3065: 103884 | G3065: 103883 | J3065: =IF(MOD(RC[-9],10)=2,3,"") ->  | K3065: 3
A3066: 139091 | B3066: 103885 | C3066: 103881 | D3066: 103881 | E3066: 103882 | F3066: 103883 | G3066: 103885 | J3066: =IF(MOD(RC[-9],10)=2,3,"") ->  | K3066: 3 | N3066: 圣女贞德
A3067: 139100 | B3067: 103890 | C3067: 103890 | D3067: 103890 | E3067: 103892 | F3067: 103894 | G3067: 0 | J3067: =IF(MOD(RC[-9],10)=2,3,"") ->  | K3067: 3
A3068: 139101 | B3068: 103891 | C3068: 103890 | D3068: 103891 | E3068: 103891 | F3068: 103893 | G3068: 0 | J3068: =IF(MOD(RC[-9],10)=2,3,"") ->  | K3068: 3
A3069: 139102 | B3069: 103896 | C3069: 103890 | D3069: 103892 | E3069: 103895 | F3069: 103896 | G3069: 0 | I3069: 0.1 | J3069: =IF(MOD(RC[-9],10)=2,3,"") -> 3 | K3069: 3 | N3069: 斯巴达
A3070: 140010 | B3070: 103900 | C3070: 103900 | D3070: 103900 | E3070: 103901 | F3070: 103903 | G3070: 103904 | J3070: =IF(MOD(RC[-9],10)=2,3,"") ->  | K3070: 3
A3071: 140020 | B3071: 103911 | C3071: 103911 | D3071: 103911 | E3071: 103912 | F3071: 103912 | G3071: 103914 | J3071: =IF(MOD(RC[-9],10)=2,3,"") ->  | K3071: 3
A3072: 140030 | B3072: 103922 | C3072: 103920 | D3072: 103921 | E3072: 103922 | F3072: 103922 | G3072: 103923 | J3072: =IF(MOD(RC[-9],10)=2,3,"") ->  | K3072: 3
A3073: 140031 | B3073: 103925 | C3073: 103921 | D3073: 103922 | E3073: 103923 | F3073: 103925 | G3073: 103924 | J3073: =IF(MOD(RC[-9],10)=2,3,"") ->  | K3073: 3 | N3073: 铁骨骷髅
A3074: 140040 | B3074: 103931 | C3074: 103931 | D3074: 103931 | E3074: 103931 | F3074: 103932 | G3074: 103932 | J3074: =IF(MOD(RC[-9],10)=2,3,"") ->  | K3074: 3
A3075: 140050 | B3075: 103940 | C3075: 103940 | D3075: 103940 | E3075: 103940 | F3075: 103943 | G3075: 103944 | J3075: =IF(MOD(RC[-9],10)=2,3,"") ->  | K3075: 3
A3076: 140060 | B3076: 103951 | C3076: 103950 | D3076: 103951 | E3076: 103951 | F3076: 103953 | G3076: 103954 | J3076: =IF(MOD(RC[-9],10)=2,3,"") ->  | K3076: 3
A3077: 140061 | B3077: 103955 | C3077: 103951 | D3077: 103952 | E3077: 103953 | F3077: 103955 | G3077: 103954 | J3077: =IF(MOD(RC[-9],10)=2,3,"") ->  | K3077: 3 | N3077: 火女
A3078: 140070 | B3078: 103962 | C3078: 103961 | D3078: 103961 | E3078: 103962 | F3078: 103962 | G3078: 103964 | J3078: =IF(MOD(RC[-9],10)=2,3,"") ->  | K3078: 3
A3079: 140080 | B3079: 103973 | C3079: 103970 | D3079: 103970 | E3079: 103973 | F3079: 103973 | G3079: 103974 | J3079: =IF(MOD(RC[-9],10)=2,3,"") ->  | K3079: 3
A3080: 140090 | B3080: 103983 | C3080: 103980 | D3080: 103981 | E3080: 103982 | F3080: 103983 | G3080: 103984 | J3080: =IF(MOD(RC[-9],10)=2,3,"") ->  | K3080: 3
A3081: 140091 | B3081: 103985 | C3081: 103981 | D3081: 103981 | E3081: 103983 | F3081: 103985 | G3081: 103984 | J3081: =IF(MOD(RC[-9],10)=2,3,"") ->  | K3081: 3 | N3081: 地狱铁拳
A3082: 140100 | B3082: 103990 | C3082: 103990 | D3082: 0 | E3082: 0 | F3082: 0 | G3082: 0 | I3082: 0.1 | J3082: 3 | K3082: 3 | N3082: 大地泰坦
A3083: 141010 | B3083: 104001 | C3083: 104001 | D3083: 104001 | E3083: 104002 | F3083: 104003 | G3083: 104004 | J3083: =IF(MOD(RC[-9],10)=2,3,"") ->  | K3083: 3
A3084: 141020 | B3084: 104010 | C3084: 104010 | D3084: 104010 | E3084: 104010 | F3084: 104012 | G3084: 104014 | J3084: =IF(MOD(RC[-9],10)=2,3,"") ->  | K3084: 3
A3085: 141030 | B3085: 104023 | C3085: 104020 | D3085: 104021 | E3085: 104022 | F3085: 104023 | G3085: 104022 | J3085: =IF(MOD(RC[-9],10)=2,3,"") ->  | K3085: 3
A3086: 141031 | B3086: 104025 | C3086: 104021 | D3086: 104022 | E3086: 104023 | F3086: 104025 | G3086: 104024 | J3086: =IF(MOD(RC[-9],10)=2,3,"") ->  | K3086: 3 | N3086: 致命特工
A3087: 141040 | B3087: 104032 | C3087: 104030 | D3087: 104031 | E3087: 104031 | F3087: 104032 | G3087: 104032 | J3087: =IF(MOD(RC[-9],10)=2,3,"") ->  | K3087: 3
A3088: 141050 | B3088: 104043 | C3088: 104040 | D3088: 104040 | E3088: 104043 | F3088: 104043 | G3088: 104044 | J3088: =IF(MOD(RC[-9],10)=2,3,"") ->  | K3088: 3
A3089: 141060 | B3089: 104050 | C3089: 104050 | D3089: 104050 | E3089: 104051 | F3089: 104053 | G3089: 104054 | J3089: =IF(MOD(RC[-9],10)=2,3,"") ->  | K3089: 3
A3090: 141061 | B3090: 104055 | C3090: 104051 | D3090: 104050 | E3090: 104053 | F3090: 104055 | G3090: 104054 | J3090: =IF(MOD(RC[-9],10)=2,3,"") ->  | K3090: 3 | N3090: 鹰眸
A3091: 141070 | B3091: 104062 | C3091: 104061 | D3091: 104061 | E3091: 104062 | F3091: 104062 | G3091: 104064 | J3091: =IF(MOD(RC[-9],10)=2,3,"") ->  | K3091: 3
A3092: 141080 | B3092: 104070 | C3092: 104070 | D3092: 104070 | E3092: 104073 | F3092: 104073 | G3092: 104074 | J3092: =IF(MOD(RC[-9],10)=2,3,"") ->  | K3092: 3
A3093: 141090 | B3093: 104084 | C3093: 104080 | D3093: 104081 | E3093: 104082 | F3093: 104083 | G3093: 104083 | J3093: =IF(MOD(RC[-9],10)=2,3,"") ->  | K3093: 3
A3094: 141091 | B3094: 104085 | C3094: 104081 | D3094: 104082 | E3094: 104083 | F3094: 104085 | G3094: 104080 | J3094: =IF(MOD(RC[-9],10)=2,3,"") ->  | K3094: 3 | N3094: 混沌女巫
A3095: 141100 | B3095: 104090 | C3095: 104090 | D3095: 104090 | E3095: 104092 | F3095: 104094 | G3095: 0 | J3095: =IF(MOD(RC[-9],10)=2,3,"") ->  | K3095: 3
A3096: 141101 | B3096: 104091 | C3096: 104091 | D3096: 104091 | E3096: 104092 | F3096: 104093 | G3096: 0 | J3096: =IF(MOD(RC[-9],10)=2,3,"") ->  | K3096: 3
A3097: 141102 | B3097: 104095 | C3097: 104090 | D3097: 104092 | E3097: 104094 | F3097: 104095 | G3097: 0 | I3097: 0.1 | J3097: =IF(MOD(RC[-9],10)=2,3,"") -> 3 | K3097: 3 | N3097: 野蛮巨人
A3098: 142010 | B3098: 104100 | C3098: 104100 | D3098: 104101 | E3098: 104102 | F3098: 104103 | G3098: 104104 | J3098: =IF(MOD(RC[-9],10)=2,3,"") ->  | K3098: 3
A3099: 142020 | B3099: 104111 | C3099: 104111 | D3099: 104111 | E3099: 104112 | F3099: 104112 | G3099: 104114 | J3099: =IF(MOD(RC[-9],10)=2,3,"") ->  | K3099: 3
A3100: 142030 | B3100: 104123 | C3100: 104120 | D3100: 104121 | E3100: 104122 | F3100: 104123 | G3100: 104122 | J3100: =IF(MOD(RC[-9],10)=2,3,"") ->  | K3100: 3
A3101: 142031 | B3101: 104125 | C3101: 104121 | D3101: 104122 | E3101: 104123 | F3101: 104125 | G3101: 104124 | J3101: =IF(MOD(RC[-9],10)=2,3,"") ->  | K3101: 3 | N3101: 超级队长
A3102: 142040 | B3102: 104131 | C3102: 104131 | D3102: 104131 | E3102: 104131 | F3102: 104132 | G3102: 104132 | J3102: =IF(MOD(RC[-9],10)=2,3,"") ->  | K3102: 3
A3103: 142050 | B3103: 104143 | C3103: 104140 | D3103: 104140 | E3103: 104143 | F3103: 104143 | G3103: 104144 | J3103: =IF(MOD(RC[-9],10)=2,3,"") ->  | K3103: 3
A3104: 142060 | B3104: 104150 | C3104: 104150 | D3104: 104150 | E3104: 104151 | F3104: 104153 | G3104: 104154 | J3104: =IF(MOD(RC[-9],10)=2,3,"") ->  | K3104: 3
A3105: 142061 | B3105: 104155 | C3105: 104151 | D3105: 104152 | E3105: 104153 | F3105: 104155 | G3105: 104154 | J3105: =IF(MOD(RC[-9],10)=2,3,"") ->  | K3105: 3 | N3105: 树人
A3106: 142070 | B3106: 104162 | C3106: 104161 | D3106: 104161 | E3106: 104162 | F3106: 104162 | G3106: 104164 | J3106: =IF(MOD(RC[-9],10)=2,3,"") ->  | K3106: 3
A3107: 142080 | B3107: 104170 | C3107: 104170 | D3107: 104170 | E3107: 104170 | F3107: 104173 | G3107: 104174 | J3107: =IF(MOD(RC[-9],10)=2,3,"") ->  | K3107: 3
A3108: 142090 | B3108: 104184 | C3108: 104180 | D3108: 104181 | E3108: 104182 | F3108: 104183 | G3108: 104183 | J3108: =IF(MOD(RC[-9],10)=2,3,"") ->  | K3108: 3
A3109: 142091 | B3109: 104185 | C3109: 104181 | D3109: 104180 | E3109: 104183 | F3109: 104185 | G3109: 104184 | J3109: =IF(MOD(RC[-9],10)=2,3,"") ->  | K3109: 3 | N3109: 铁人
A3110: 142100 | B3110: 104190 | C3110: 104190 | D3110: 104190 | E3110: 104192 | F3110: 104194 | G3110: 0 | J3110: =IF(MOD(RC[-9],10)=2,3,"") ->  | K3110: 3
A3111: 142101 | B3111: 104191 | C3111: 104191 | D3111: 104191 | E3111: 104192 | F3111: 104193 | G3111: 0 | J3111: =IF(MOD(RC[-9],10)=2,3,"") ->  | K3111: 3
A3112: 142102 | B3112: 104195 | C3112: 104190 | D3112: 104191 | E3112: 104194 | F3112: 104195 | G3112: 0 | I3112: 0.1 | J3112: =IF(MOD(RC[-9],10)=2,3,"") -> 3 | K3112: 3 | N3112: 刀锋猎人
A3113: 143010 | B3113: 104200 | C3113: 104200 | D3113: 104201 | E3113: 104202 | F3113: 104203 | G3113: 104204 | J3113: =IF(MOD(RC[-9],10)=2,3,"") ->  | K3113: 3
A3114: 143020 | B3114: 104212 | C3114: 104211 | D3114: 104211 | E3114: 104212 | F3114: 104212 | G3114: 104214 | J3114: =IF(MOD(RC[-9],10)=2,3,"") ->  | K3114: 3
A3115: 143030 | B3115: 104223 | C3115: 104220 | D3115: 104221 | E3115: 104222 | F3115: 104223 | G3115: 104222 | J3115: =IF(MOD(RC[-9],10)=2,3,"") ->  | K3115: 3
A3116: 143031 | B3116: 104225 | C3116: 104220 | D3116: 104221 | E3116: 104223 | F3116: 104225 | G3116: 104224 | J3116: =IF(MOD(RC[-9],10)=2,3,"") ->  | K3116: 3 | N3116: 女警
A3117: 143040 | B3117: 104231 | C3117: 104231 | D3117: 104231 | E3117: 104231 | F3117: 104232 | G3117: 104232 | J3117: =IF(MOD(RC[-9],10)=2,3,"") ->  | K3117: 3
A3118: 143050 | B3118: 104243 | C3118: 104240 | D3118: 104240 | E3118: 104243 | F3118: 104243 | G3118: 104244 | J3118: =IF(MOD(RC[-9],10)=2,3,"") ->  | K3118: 3
A3119: 143060 | B3119: 104250 | C3119: 104250 | D3119: 104250 | E3119: 104251 | F3119: 104253 | G3119: 104254 | J3119: =IF(MOD(RC[-9],10)=2,3,"") ->  | K3119: 3
A3120: 143061 | B3120: 104255 | C3120: 104251 | D3120: 104252 | E3120: 104253 | F3120: 104255 | G3120: 104254 | J3120: =IF(MOD(RC[-9],10)=2,3,"") ->  | K3120: 3 | N3120: 半人马
A3121: 143070 | B3121: 104262 | C3121: 104261 | D3121: 104261 | E3121: 104262 | F3121: 104262 | G3121: 104264 | J3121: =IF(MOD(RC[-9],10)=2,3,"") ->  | K3121: 3
A3122: 143080 | B3122: 104270 | C3122: 104270 | D3122: 104270 | E3122: 104270 | F3122: 104273 | G3122: 104274 | J3122: =IF(MOD(RC[-9],10)=2,3,"") ->  | K3122: 3
A3123: 143090 | B3123: 104284 | C3123: 104280 | D3123: 104281 | E3123: 104282 | F3123: 104283 | G3123: 104283 | J3123: =IF(MOD(RC[-9],10)=2,3,"") ->  | K3123: 3
A3124: 143091 | B3124: 104285 | C3124: 104281 | D3124: 104282 | E3124: 104283 | F3124: 104285 | G3124: 104284 | J3124: =IF(MOD(RC[-9],10)=2,3,"") ->  | K3124: 3 | N3124: 熊阿宝
A3125: 143100 | B3125: 104290 | C3125: 104290 | D3125: 104290 | E3125: 104292 | F3125: 104294 | G3125: 0 | J3125: =IF(MOD(RC[-9],10)=2,3,"") ->  | K3125: 3
A3126: 143101 | B3126: 104291 | C3126: 104291 | D3126: 104291 | E3126: 104292 | F3126: 104293 | G3126: 0 | J3126: =IF(MOD(RC[-9],10)=2,3,"") ->  | K3126: 3
A3127: 143102 | B3127: 104296 | C3127: 104290 | D3127: 104294 | E3127: 104295 | F3127: 104296 | G3127: 0 | I3127: 0.1 | J3127: =IF(MOD(RC[-9],10)=2,3,"") -> 3 | K3127: 3 | N3127: 小黑
A3128: 144010 | B3128: 104303 | C3128: 104300 | D3128: 104301 | E3128: 104302 | F3128: 104303 | G3128: 104304 | J3128: =IF(MOD(RC[-9],10)=2,3,"") ->  | K3128: 3
A3129: 144020 | B3129: 104312 | C3129: 104311 | D3129: 104311 | E3129: 104312 | F3129: 104312 | G3129: 104314 | J3129: =IF(MOD(RC[-9],10)=2,3,"") ->  | K3129: 3
A3130: 144030 | B3130: 104323 | C3130: 104320 | D3130: 104321 | E3130: 104322 | F3130: 104323 | G3130: 104322 | J3130: =IF(MOD(RC[-9],10)=2,3,"") ->  | K3130: 3
A3131: 144031 | B3131: 104325 | C3131: 104321 | D3131: 104322 | E3131: 104323 | F3131: 104325 | G3131: 104324 | J3131: =IF(MOD(RC[-9],10)=2,3,"") ->  | K3131: 3 | N3131: 石头人
A3132: 144040 | B3132: 104332 | C3132: 104331 | D3132: 104331 | E3132: 104332 | F3132: 104332 | G3132: 104334 | J3132: =IF(MOD(RC[-9],10)=2,3,"") ->  | K3132: 3
A3133: 144050 | B3133: 104340 | C3133: 104340 | D3133: 104340 | E3133: 104343 | F3133: 104343 | G3133: 104344 | J3133: =IF(MOD(RC[-9],10)=2,3,"") ->  | K3133: 3
A3134: 144060 | B3134: 104350 | C3134: 104350 | D3134: 104350 | E3134: 104351 | F3134: 104353 | G3134: 104354 | J3134: =IF(MOD(RC[-9],10)=2,3,"") ->  | K3134: 3
A3135: 144061 | B3135: 104355 | C3135: 104351 | D3135: 104352 | E3135: 104353 | F3135: 104355 | G3135: 104354 | J3135: =IF(MOD(RC[-9],10)=2,3,"") ->  | K3135: 3 | N3135: 基伦
A3136: 144070 | B3136: 104361 | C3136: 104361 | D3136: 104361 | E3136: 104362 | F3136: 104362 | G3136: 104364 | J3136: =IF(MOD(RC[-9],10)=2,3,"") ->  | K3136: 3
A3137: 144080 | B3137: 104370 | C3137: 104370 | D3137: 104370 | E3137: 104370 | F3137: 104373 | G3137: 104374 | J3137: =IF(MOD(RC[-9],10)=2,3,"") ->  | K3137: 3
A3138: 144090 | B3138: 104383 | C3138: 104380 | D3138: 104381 | E3138: 104382 | F3138: 104383 | G3138: 104384 | J3138: =IF(MOD(RC[-9],10)=2,3,"") ->  | K3138: 3
A3139: 144091 | B3139: 104385 | C3139: 104381 | D3139: 104382 | E3139: 104383 | F3139: 104385 | G3139: 104384 | J3139: =IF(MOD(RC[-9],10)=2,3,"") ->  | K3139: 3 | N3139: 血色指挥官
A3140: 144100 | B3140: 104390 | C3140: 104390 | D3140: 104390 | E3140: 104392 | F3140: 104394 | G3140: 0 | J3140: =IF(MOD(RC[-9],10)=2,3,"") ->  | K3140: 3
A3141: 144101 | B3141: 104391 | C3141: 104391 | D3141: 104391 | E3141: 104392 | F3141: 104393 | G3141: 0 | J3141: =IF(MOD(RC[-9],10)=2,3,"") ->  | K3141: 3
A3142: 144102 | B3142: 104395 | C3142: 104390 | D3142: 104392 | E3142: 104394 | F3142: 104395 | G3142: 0 | I3142: 0.1 | J3142: =IF(MOD(RC[-9],10)=2,3,"") -> 3 | K3142: 3 | N3142: 恶魔猎手
A3143: 145010 | B3143: 104400 | C3143: 104400 | D3143: 104401 | E3143: 104402 | F3143: 104403 | G3143: 104404 | J3143: =IF(MOD(RC[-9],10)=2,3,"") ->  | K3143: 3
A3144: 145020 | B3144: 104411 | C3144: 104411 | D3144: 104411 | E3144: 104412 | F3144: 104412 | G3144: 104414 | J3144: =IF(MOD(RC[-9],10)=2,3,"") ->  | K3144: 3
A3145: 145030 | B3145: 104423 | C3145: 104420 | D3145: 104421 | E3145: 104422 | F3145: 104423 | G3145: 104422 | J3145: =IF(MOD(RC[-9],10)=2,3,"") ->  | K3145: 3
A3146: 145031 | B3146: 104425 | C3146: 104420 | D3146: 104421 | E3146: 104422 | F3146: 104423 | G3146: 104425 | J3146: =IF(MOD(RC[-9],10)=2,3,"") ->  | K3146: 3 | N3146: 血源牧师
A3147: 145040 | B3147: 104431 | C3147: 104431 | D3147: 104431 | E3147: 104431 | F3147: 104432 | G3147: 104432 | J3147: =IF(MOD(RC[-9],10)=2,3,"") ->  | K3147: 3
A3148: 145050 | B3148: 104443 | C3148: 104440 | D3148: 104440 | E3148: 104443 | F3148: 104443 | G3148: 104444 | J3148: =IF(MOD(RC[-9],10)=2,3,"") ->  | K3148: 3
A3149: 145060 | B3149: 104450 | C3149: 104450 | D3149: 104450 | E3149: 104451 | F3149: 104453 | G3149: 104454 | J3149: =IF(MOD(RC[-9],10)=2,3,"") ->  | K3149: 3
A3150: 145061 | B3150: 104455 | C3150: 104451 | D3150: 104452 | E3150: 104453 | F3150: 104455 | G3150: 104454 | J3150: =IF(MOD(RC[-9],10)=2,3,"") ->  | K3150: 3 | N3150: 牛头人
A3151: 145070 | B3151: 104462 | C3151: 104461 | D3151: 104461 | E3151: 104462 | F3151: 104462 | G3151: 104464 | J3151: =IF(MOD(RC[-9],10)=2,3,"") ->  | K3151: 3
A3152: 145080 | B3152: 104470 | C3152: 104470 | D3152: 104470 | E3152: 104470 | F3152: 104473 | G3152: 104474 | J3152: =IF(MOD(RC[-9],10)=2,3,"") ->  | K3152: 3
A3153: 145090 | B3153: 104484 | C3153: 104480 | D3153: 104481 | E3153: 104482 | F3153: 104483 | G3153: 104483 | J3153: =IF(MOD(RC[-9],10)=2,3,"") ->  | K3153: 3
A3154: 145091 | B3154: 104485 | C3154: 104480 | D3154: 104481 | E3154: 104483 | F3154: 104485 | G3154: 104484 | J3154: =IF(MOD(RC[-9],10)=2,3,"") ->  | K3154: 3 | N3154: 小黑
A3155: 145100 | B3155: 104490 | C3155: 104490 | D3155: 104490 | E3155: 104492 | F3155: 104494 | G3155: 0 | J3155: =IF(MOD(RC[-9],10)=2,3,"") ->  | K3155: 3
A3156: 145101 | B3156: 104491 | C3156: 104491 | D3156: 104491 | E3156: 104492 | F3156: 104493 | G3156: 0 | J3156: =IF(MOD(RC[-9],10)=2,3,"") ->  | K3156: 3
A3157: 145102 | B3157: 104495 | C3157: 104490 | D3157: 104492 | E3157: 104494 | F3157: 104495 | G3157: 0 | I3157: 0.1 | J3157: =IF(MOD(RC[-9],10)=2,3,"") -> 3 | K3157: 3 | N3157: 巫妖之王
A3158: 146010 | B3158: 104503 | C3158: 104500 | D3158: 104501 | E3158: 104503 | F3158: 104503 | G3158: 104504 | J3158: =IF(MOD(RC[-9],10)=2,3,"") ->  | K3158: 3
A3159: 146020 | B3159: 104512 | C3159: 104511 | D3159: 104511 | E3159: 104513 | F3159: 104513 | G3159: 104514 | J3159: =IF(MOD(RC[-9],10)=2,3,"") ->  | K3159: 3
A3160: 146030 | B3160: 104524 | C3160: 104520 | D3160: 104521 | E3160: 104521 | F3160: 104523 | G3160: 104523 | J3160: =IF(MOD(RC[-9],10)=2,3,"") ->  | K3160: 3
A3161: 146031 | B3161: 104525 | C3161: 104520 | D3161: 104521 | E3161: 104521 | F3161: 104525 | G3161: 104524 | J3161: =IF(MOD(RC[-9],10)=2,3,"") ->  | K3161: 3 | N3161: 女警
A3162: 146040 | B3162: 104531 | C3162: 104531 | D3162: 104531 | E3162: 104531 | F3162: 104532 | G3162: 104532 | J3162: =IF(MOD(RC[-9],10)=2,3,"") ->  | K3162: 3
A3163: 146050 | B3163: 104540 | C3163: 104540 | D3163: 104540 | E3163: 104542 | F3163: 104543 | G3163: 104544 | J3163: =IF(MOD(RC[-9],10)=2,3,"") ->  | K3163: 3
A3164: 146060 | B3164: 104550 | C3164: 104550 | D3164: 104550 | E3164: 104551 | F3164: 104553 | G3164: 104554 | J3164: =IF(MOD(RC[-9],10)=2,3,"") ->  | K3164: 3
A3165: 146061 | B3165: 104555 | C3165: 104551 | D3165: 104552 | E3165: 104553 | F3165: 104555 | G3165: 104554 | J3165: =IF(MOD(RC[-9],10)=2,3,"") ->  | K3165: 3 | N3165: 半人马
A3166: 146070 | B3166: 104560 | C3166: 104560 | D3166: 104560 | E3166: 104561 | F3166: 104562 | G3166: 104564 | J3166: =IF(MOD(RC[-9],10)=2,3,"") ->  | K3166: 3
A3167: 146080 | B3167: 104573 | C3167: 104570 | D3167: 104571 | E3167: 104572 | F3167: 104573 | G3167: 104574 | J3167: =IF(MOD(RC[-9],10)=2,3,"") ->  | K3167: 3
A3168: 146090 | B3168: 104583 | C3168: 104580 | D3168: 104581 | E3168: 104582 | F3168: 104583 | G3168: 104583 | J3168: =IF(MOD(RC[-9],10)=2,3,"") ->  | K3168: 3
A3169: 146091 | B3169: 104585 | C3169: 104580 | D3169: 104581 | E3169: 104583 | F3169: 104585 | G3169: 104584 | J3169: =IF(MOD(RC[-9],10)=2,3,"") ->  | K3169: 3 | N3169: 食人魔
A3170: 146100 | B3170: 104590 | C3170: 104590 | D3170: 0 | E3170: 0 | F3170: 0 | G3170: 0 | I3170: 0.1 | J3170: =IF(MOD(RC[-9],10)=2,3,"") ->  | K3170: 3 | N3170: 憎恶 | O3170: 幻想前哨
A3171: 147010 | B3171: 104600 | C3171: 104600 | D3171: 104601 | E3171: 104600 | F3171: 104603 | G3171: 104604 | J3171: =IF(MOD(RC[-9],10)=2,3,"") ->  | K3171: 3
A3172: 147020 | B3172: 104612 | C3172: 104611 | D3172: 104611 | E3172: 104612 | F3172: 104612 | G3172: 104614 | J3172: =IF(MOD(RC[-9],10)=2,3,"") ->  | K3172: 3
A3173: 147030 | B3173: 104624 | C3173: 104620 | D3173: 104621 | E3173: 104622 | F3173: 104623 | G3173: 104623 | J3173: =IF(MOD(RC[-9],10)=2,3,"") ->  | K3173: 3
A3174: 147031 | B3174: 104625 | C3174: 104621 | D3174: 104622 | E3174: 104623 | F3174: 104625 | G3174: 104624 | J3174: =IF(MOD(RC[-9],10)=2,3,"") ->  | K3174: 3 | N3174: 佐罗
A3175: 147040 | B3175: 104631 | C3175: 104630 | D3175: 104631 | E3175: 104631 | F3175: 104632 | G3175: 104632 | J3175: =IF(MOD(RC[-9],10)=2,3,"") ->  | K3175: 3
A3176: 147050 | B3176: 104644 | C3176: 104640 | D3176: 104641 | E3176: 104643 | F3176: 104644 | G3176: 104644 | J3176: =IF(MOD(RC[-9],10)=2,3,"") ->  | K3176: 3
A3177: 147060 | B3177: 104650 | C3177: 104650 | D3177: 104650 | E3177: 104651 | F3177: 104653 | G3177: 104654 | J3177: =IF(MOD(RC[-9],10)=2,3,"") ->  | K3177: 3
A3178: 147061 | B3178: 104655 | C3178: 104651 | D3178: 104652 | E3178: 104653 | F3178: 104655 | G3178: 104654 | J3178: =IF(MOD(RC[-9],10)=2,3,"") ->  | K3178: 3 | N3178: 杰克船长
A3179: 147070 | B3179: 104661 | C3179: 104660 | D3179: 104661 | E3179: 104661 | F3179: 104662 | G3179: 104664 | J3179: =IF(MOD(RC[-9],10)=2,3,"") ->  | K3179: 3
A3180: 147080 | B3180: 104670 | C3180: 104670 | D3180: 104670 | E3180: 104672 | F3180: 104673 | G3180: 104674 | J3180: =IF(MOD(RC[-9],10)=2,3,"") ->  | K3180: 3
A3181: 147090 | B3181: 104683 | C3181: 104680 | D3181: 104681 | E3181: 104682 | F3181: 104683 | G3181: 104684 | J3181: =IF(MOD(RC[-9],10)=2,3,"") ->  | K3181: 3
A3182: 147091 | B3182: 104685 | C3182: 104681 | D3182: 104681 | E3182: 104683 | F3182: 104685 | G3182: 104684 | J3182: =IF(MOD(RC[-9],10)=2,3,"") ->  | K3182: 3 | N3182: 鹰眸
A3183: 147100 | B3183: 104690 | C3183: 104690 | D3183: 104690 | E3183: 104692 | F3183: 104694 | G3183: 0 | K3183: 3
A3184: 147101 | B3184: 104693 | C3184: 104691 | D3184: 104691 | E3184: 104693 | F3184: 104693 | G3184: 0 | K3184: 3
A3185: 147102 | B3185: 104695 | C3185: 104690 | D3185: 104691 | E3185: 104694 | F3185: 104695 | G3185: 0 | I3185: 0.1 | J3185: =IF(MOD(RC[-9],10)=2,3,"") -> 3 | K3185: 3 | N3185: 美杜莎 | O3185: 阴影之刺
A3186: 148010 | B3186: 104700 | C3186: 104700 | D3186: 104700 | E3186: 104703 | F3186: 104703 | G3186: 104704 | J3186: =IF(MOD(RC[-9],10)=2,3,"") ->  | K3186: 3
A3187: 148020 | B3187: 104712 | C3187: 104710 | D3187: 104711 | E3187: 104712 | F3187: 104712 | G3187: 104714 | J3187: =IF(MOD(RC[-9],10)=2,3,"") ->  | K3187: 3
A3188: 148030 | B3188: 104721 | C3188: 104720 | D3188: 104721 | E3188: 104722 | F3188: 104723 | G3188: 104724 | J3188: =IF(MOD(RC[-9],10)=2,3,"") ->  | K3188: 3
A3189: 148031 | B3189: 104725 | C3189: 104721 | D3189: 104722 | E3189: 104723 | F3189: 104725 | G3189: 104724 | J3189: =IF(MOD(RC[-9],10)=2,3,"") ->  | K3189: 3 | N3189: 超级队长
A3190: 148040 | B3190: 104732 | C3190: 104731 | D3190: 104731 | E3190: 104732 | F3190: 104732 | G3190: 104734 | J3190: =IF(MOD(RC[-9],10)=2,3,"") ->  | K3190: 3
A3191: 148050 | B3191: 104740 | C3191: 104740 | D3191: 104740 | E3191: 104741 | F3191: 104743 | G3191: 104744 | J3191: =IF(MOD(RC[-9],10)=2,3,"") ->  | K3191: 3
A3192: 148060 | B3192: 104751 | C3192: 104750 | D3192: 104751 | E3192: 104751 | F3192: 104753 | G3192: 104754 | J3192: =IF(MOD(RC[-9],10)=2,3,"") ->  | K3192: 3
A3193: 148061 | B3193: 104755 | C3193: 104751 | D3193: 104752 | E3193: 104753 | F3193: 104755 | G3193: 104754 | J3193: =IF(MOD(RC[-9],10)=2,3,"") ->  | K3193: 3 | N3193: 致命特工
A3194: 148070 | B3194: 104762 | C3194: 104761 | D3194: 104761 | E3194: 104762 | F3194: 104762 | G3194: 104764 | J3194: =IF(MOD(RC[-9],10)=2,3,"") ->  | K3194: 3
A3195: 148080 | B3195: 104770 | C3195: 104770 | D3195: 104770 | E3195: 104773 | F3195: 104773 | G3195: 104774 | J3195: =IF(MOD(RC[-9],10)=2,3,"") ->  | K3195: 3
A3196: 148090 | B3196: 104783 | C3196: 104780 | D3196: 104781 | E3196: 104782 | F3196: 104783 | G3196: 104783 | J3196: =IF(MOD(RC[-9],10)=2,3,"") ->  | K3196: 3
A3197: 148091 | B3197: 104785 | C3197: 104781 | D3197: 104781 | E3197: 104783 | F3197: 104783 | G3197: 104785 | J3197: =IF(MOD(RC[-9],10)=2,3,"") ->  | K3197: 3 | N3197: 混沌女巫
A3198: 148100 | B3198: 104790 | C3198: 104790 | D3198: 104790 | E3198: 104792 | F3198: 104794 | G3198: 0 | J3198: =IF(MOD(RC[-9],10)=2,3,"") ->  | K3198: 3
A3199: 148101 | B3199: 104793 | C3199: 104791 | D3199: 104791 | E3199: 104793 | F3199: 104793 | G3199: 0 | J3199: =IF(MOD(RC[-9],10)=2,3,"") ->  | K3199: 3
A3200: 148102 | B3200: 104795 | C3200: 104790 | D3200: 104792 | E3200: 104794 | F3200: 104795 | G3200: 0 | I3200: 0.1 | J3200: =IF(MOD(RC[-9],10)=2,3,"") -> 3 | K3200: 3 | N3200: 地狱骑士 | O3200: 阴影傀儡
A3201: 149010 | B3201: 104801 | C3201: 104800 | D3201: 104801 | E3201: 104802 | F3201: 104803 | G3201: 104804 | J3201: =IF(MOD(RC[-9],10)=2,3,"") ->  | K3201: 3
A3202: 149020 | B3202: 104812 | C3202: 104811 | D3202: 104811 | E3202: 104812 | F3202: 104812 | G3202: 104814 | J3202: =IF(MOD(RC[-9],10)=2,3,"") ->  | K3202: 3
A3203: 149030 | B3203: 104820 | C3203: 104820 | D3203: 104821 | E3203: 104822 | F3203: 104823 | G3203: 104824 | J3203: =IF(MOD(RC[-9],10)=2,3,"") ->  | K3203: 3
A3204: 149031 | B3204: 104825 | C3204: 104821 | D3204: 104822 | E3204: 104823 | F3204: 104825 | G3204: 104824 | J3204: =IF(MOD(RC[-9],10)=2,3,"") ->  | K3204: 3 | N3204: 斯巴达
A3205: 149040 | B3205: 104831 | C3205: 104831 | D3205: 104831 | E3205: 104831 | F3205: 104832 | G3205: 104832 | J3205: =IF(MOD(RC[-9],10)=2,3,"") ->  | K3205: 3
A3206: 149050 | B3206: 104843 | C3206: 104840 | D3206: 104840 | E3206: 104843 | F3206: 104843 | G3206: 104844 | J3206: =IF(MOD(RC[-9],10)=2,3,"") ->  | K3206: 3
A3207: 149060 | B3207: 104850 | C3207: 104850 | D3207: 104850 | E3207: 104851 | F3207: 104853 | G3207: 104854 | J3207: =IF(MOD(RC[-9],10)=2,3,"") ->  | K3207: 3
A3208: 149061 | B3208: 104855 | C3208: 104851 | D3208: 104852 | E3208: 104853 | F3208: 104855 | G3208: 104854 | J3208: =IF(MOD(RC[-9],10)=2,3,"") ->  | K3208: 3 | N3208: 死亡武士
A3209: 149070 | B3209: 104862 | C3209: 104861 | D3209: 104861 | E3209: 104862 | F3209: 104862 | G3209: 104864 | J3209: =IF(MOD(RC[-9],10)=2,3,"") ->  | K3209: 3
A3210: 149080 | B3210: 104873 | C3210: 104870 | D3210: 104870 | E3210: 104873 | F3210: 104873 | G3210: 104874 | J3210: =IF(MOD(RC[-9],10)=2,3,"") ->  | K3210: 3
A3211: 149090 | B3211: 104883 | C3211: 104880 | D3211: 104881 | E3211: 104882 | F3211: 104883 | G3211: 104883 | J3211: =IF(MOD(RC[-9],10)=2,3,"") ->  | K3211: 3
A3212: 149091 | B3212: 104885 | C3212: 104881 | D3212: 104882 | E3212: 104883 | F3212: 104885 | G3212: 104884 | J3212: =IF(MOD(RC[-9],10)=2,3,"") ->  | K3212: 3 | N3212: 刀锋猎人
A3213: 149100 | B3213: 104890 | C3213: 104890 | D3213: 104890 | E3213: 104892 | F3213: 104894 | G3213: 0 | J3213: =IF(MOD(RC[-9],10)=2,3,"") ->  | K3213: 3
A3214: 149101 | B3214: 104891 | C3214: 104891 | D3214: 104891 | E3214: 104892 | F3214: 104893 | G3214: 0 | J3214: =IF(MOD(RC[-9],10)=2,3,"") ->  | K3214: 3
A3215: 149102 | B3215: 104895 | C3215: 104890 | D3215: 104893 | E3215: 104894 | F3215: 104895 | G3215: 0 | I3215: 0.1 | J3215: =IF(MOD(RC[-9],10)=2,3,"") -> 3 | K3215: 3 | N3215: 德古拉伯爵 | O3215: 阴影眷属
A3216: 150010 | B3216: 104900 | C3216: 104900 | D3216: 104901 | E3216: 104902 | F3216: 104903 | G3216: 104904 | J3216: =IF(MOD(RC[-9],10)=2,3,"") ->  | K3216: 3
A3217: 150020 | B3217: 104911 | C3217: 104911 | D3217: 104911 | E3217: 104912 | F3217: 104912 | G3217: 104914 | J3217: =IF(MOD(RC[-9],10)=2,3,"") ->  | K3217: 3
A3218: 150030 | B3218: 104921 | C3218: 104920 | D3218: 104921 | E3218: 104921 | F3218: 104923 | G3218: 104923 | J3218: =IF(MOD(RC[-9],10)=2,3,"") ->  | K3218: 3
A3219: 150031 | B3219: 104925 | C3219: 104921 | D3219: 104922 | E3219: 104923 | F3219: 104925 | G3219: 104924 | J3219: =IF(MOD(RC[-9],10)=2,3,"") ->  | K3219: 3 | N3219: 石头人
A3220: 150040 | B3220: 104931 | C3220: 104931 | D3220: 104931 | E3220: 104931 | F3220: 104932 | G3220: 104932 | J3220: =IF(MOD(RC[-9],10)=2,3,"") ->  | K3220: 3
A3221: 150050 | B3221: 104943 | C3221: 104940 | D3221: 104940 | E3221: 104943 | F3221: 104943 | G3221: 104944 | J3221: =IF(MOD(RC[-9],10)=2,3,"") ->  | K3221: 3
A3222: 150060 | B3222: 104950 | C3222: 104950 | D3222: 104950 | E3222: 104951 | F3222: 104953 | G3222: 104954 | J3222: =IF(MOD(RC[-9],10)=2,3,"") ->  | K3222: 3
A3223: 150061 | B3223: 104955 | C3223: 104951 | D3223: 104951 | E3223: 104953 | F3223: 104955 | G3223: 104954 | J3223: =IF(MOD(RC[-9],10)=2,3,"") ->  | K3223: 3 | N3223: 亚马逊女王
A3224: 150070 | B3224: 104962 | C3224: 104961 | D3224: 104961 | E3224: 104962 | F3224: 104962 | G3224: 104964 | J3224: =IF(MOD(RC[-9],10)=2,3,"") ->  | K3224: 3
A3225: 150080 | B3225: 104973 | C3225: 104970 | D3225: 104971 | E3225: 104973 | F3225: 104973 | G3225: 104974 | J3225: =IF(MOD(RC[-9],10)=2,3,"") ->  | K3225: 3
A3226: 150090 | B3226: 104983 | C3226: 104980 | D3226: 104981 | E3226: 104982 | F3226: 104983 | G3226: 104983 | J3226: =IF(MOD(RC[-9],10)=2,3,"") ->  | K3226: 3
A3227: 150091 | B3227: 104985 | C3227: 104981 | D3227: 104981 | E3227: 104983 | F3227: 104985 | G3227: 104983 | J3227: =IF(MOD(RC[-9],10)=2,3,"") ->  | K3227: 3 | N3227: 天使长
A3228: 150100 | B3228: 104990 | C3228: 104990 | D3228: 104990 | E3228: 104992 | F3228: 104994 | G3228: 0 | J3228: =IF(MOD(RC[-9],10)=2,3,"") ->  | K3228: 3
A3229: 150101 | B3229: 104991 | C3229: 104991 | D3229: 104991 | E3229: 104992 | F3229: 104993 | G3229: 0 | J3229: =IF(MOD(RC[-9],10)=2,3,"") ->  | K3229: 3
A3230: 150102 | B3230: 104995 | C3230: 104990 | D3230: 104993 | E3230: 104994 | F3230: 104995 | G3230: 0 | I3230: 0.1 | J3230: =IF(MOD(RC[-9],10)=2,3,"") -> 3 | K3230: 3 | N3230: 树人 | O3230: 返程
A3231: 151010 | B3231: 105003 | C3231: 105000 | D3231: 105001 | E3231: 105002 | F3231: 105003 | G3231: 105004 | J3231: =IF(MOD(RC[-9],10)=2,3,"") ->  | K3231: 3
A3232: 151020 | B3232: 105010 | C3232: 105010 | D3232: 105010 | E3232: 105010 | F3232: 105012 | G3232: 105012 | J3232: =IF(MOD(RC[-9],10)=2,3,"") ->  | K3232: 3
A3233: 151030 | B3233: 105024 | C3233: 105020 | D3233: 105020 | E3233: 105023 | F3233: 105024 | G3233: 105024 | J3233: =IF(MOD(RC[-9],10)=2,3,"") ->  | K3233: 3
A3234: 151031 | B3234: 105025 | C3234: 105021 | D3234: 105022 | E3234: 105023 | F3234: 105025 | G3234: 105024 | J3234: =IF(MOD(RC[-9],10)=2,3,"") ->  | K3234: 3 | N3234: 树精
A3235: 151040 | B3235: 105031 | C3235: 105031 | D3235: 105031 | E3235: 105031 | F3235: 105032 | G3235: 105032 | J3235: =IF(MOD(RC[-9],10)=2,3,"") ->  | K3235: 3
A3236: 151050 | B3236: 105043 | C3236: 105040 | D3236: 105040 | E3236: 105043 | F3236: 105043 | G3236: 105044 | J3236: =IF(MOD(RC[-9],10)=2,3,"") ->  | K3236: 3
A3237: 151060 | B3237: 105050 | C3237: 105050 | D3237: 105050 | E3237: 105051 | F3237: 105053 | G3237: 105054 | J3237: =IF(MOD(RC[-9],10)=2,3,"") ->  | K3237: 3
A3238: 151061 | B3238: 105055 | C3238: 105051 | D3238: 105052 | E3238: 105053 | F3238: 105055 | G3238: 105054 | J3238: =IF(MOD(RC[-9],10)=2,3,"") ->  | K3238: 3 | N3238: 熊阿宝
A3239: 151070 | B3239: 105062 | C3239: 105061 | D3239: 105061 | E3239: 105062 | F3239: 105062 | G3239: 105064 | J3239: =IF(MOD(RC[-9],10)=2,3,"") ->  | K3239: 3
A3240: 151080 | B3240: 105070 | C3240: 105070 | D3240: 105070 | E3240: 105071 | F3240: 105073 | G3240: 105074 | J3240: =IF(MOD(RC[-9],10)=2,3,"") ->  | K3240: 3
A3241: 151090 | B3241: 105083 | C3241: 105080 | D3241: 105081 | E3241: 105081 | F3241: 105083 | G3241: 105083 | J3241: =IF(MOD(RC[-9],10)=2,3,"") ->  | K3241: 3
A3242: 151091 | B3242: 105085 | C3242: 105080 | D3242: 105081 | E3242: 105081 | F3242: 105085 | G3242: 105084 | J3242: =IF(MOD(RC[-9],10)=2,3,"") ->  | K3242: 3 | N3242: 火女
A3243: 151100 | B3243: 105090 | C3243: 105090 | D3243: 105093 | E3243: 105094 | F3243: 105094 | G3243: 0 | J3243: =IF(MOD(RC[-9],10)=2,3,"") ->  | K3243: 3
A3244: 151101 | B3244: 105091 | C3244: 105091 | D3244: 105093 | E3244: 105093 | F3244: 105094 | G3244: 0 | J3244: =IF(MOD(RC[-9],10)=2,3,"") ->  | K3244: 3
A3245: 151102 | B3245: 105095 | C3245: 105091 | D3245: 105091 | E3245: 105094 | F3245: 105095 | G3245: 0 | I3245: 0.1 | J3245: =IF(MOD(RC[-9],10)=2,3,"") -> 3 | K3245: 3 | N3245: 海元素领主
A3246: 152010 | B3246: 105100 | C3246: 105100 | D3246: 105100 | E3246: 105100 | F3246: 105103 | G3246: 105104 | J3246: =IF(MOD(RC[-9],10)=2,3,"") ->  | K3246: 3
A3247: 152020 | B3247: 105112 | C3247: 105111 | D3247: 105111 | E3247: 105112 | F3247: 105112 | G3247: 105114 | J3247: =IF(MOD(RC[-9],10)=2,3,"") ->  | K3247: 3
A3248: 152030 | B3248: 105121 | C3248: 105120 | D3248: 105121 | E3248: 105122 | F3248: 105123 | G3248: 105123 | J3248: =IF(MOD(RC[-9],10)=2,3,"") ->  | K3248: 3
A3249: 152031 | B3249: 105125 | C3249: 105121 | D3249: 105121 | E3249: 105123 | F3249: 105125 | G3249: 105124 | J3249: =IF(MOD(RC[-9],10)=2,3,"") ->  | K3249: 3 | N3249: 致命特工
A3250: 152040 | B3250: 105131 | C3250: 105131 | D3250: 105131 | E3250: 105131 | F3250: 105132 | G3250: 105132 | J3250: =IF(MOD(RC[-9],10)=2,3,"") ->  | K3250: 3
A3251: 152050 | B3251: 105143 | C3251: 105140 | D3251: 105141 | E3251: 105143 | F3251: 105143 | G3251: 105144 | J3251: =IF(MOD(RC[-9],10)=2,3,"") ->  | K3251: 3
A3252: 152060 | B3252: 105151 | C3252: 105150 | D3252: 105151 | E3252: 105151 | F3252: 105153 | G3252: 105154 | J3252: =IF(MOD(RC[-9],10)=2,3,"") ->  | K3252: 3
A3253: 152061 | B3253: 105155 | C3253: 105151 | D3253: 105152 | E3253: 105153 | F3253: 105155 | G3253: 105154 | J3253: =IF(MOD(RC[-9],10)=2,3,"") ->  | K3253: 3 | N3253: 刀锋猎人
A3254: 152070 | B3254: 105162 | C3254: 105161 | D3254: 105161 | E3254: 105162 | F3254: 105162 | G3254: 105164 | J3254: =IF(MOD(RC[-9],10)=2,3,"") ->  | K3254: 3
A3255: 152080 | B3255: 105170 | C3255: 105170 | D3255: 105170 | E3255: 105170 | F3255: 105173 | G3255: 105174 | J3255: =IF(MOD(RC[-9],10)=2,3,"") ->  | K3255: 3
A3256: 152090 | B3256: 105183 | C3256: 105180 | D3256: 105181 | E3256: 105182 | F3256: 105183 | G3256: 105183 | J3256: =IF(MOD(RC[-9],10)=2,3,"") ->  | K3256: 3
A3257: 152091 | B3257: 105185 | C3257: 105180 | D3257: 105181 | E3257: 105181 | F3257: 105185 | G3257: 105184 | J3257: =IF(MOD(RC[-9],10)=2,3,"") ->  | K3257: 3 | N3257: 鹰眸
A3258: 152100 | B3258: 105190 | C3258: 105190 | D3258: 105190 | E3258: 105192 | F3258: 105194 | G3258: 0 | J3258: =IF(MOD(RC[-9],10)=2,3,"") ->  | K3258: 3
A3259: 152101 | B3259: 105191 | C3259: 105191 | D3259: 105191 | E3259: 105192 | F3259: 105193 | G3259: 0 | J3259: =IF(MOD(RC[-9],10)=2,3,"") ->  | K3259: 3
A3260: 152102 | B3260: 105195 | C3260: 105190 | D3260: 105193 | E3260: 105194 | F3260: 105195 | G3260: 0 | I3260: 0.1 | J3260: =IF(MOD(RC[-9],10)=2,3,"") -> 3 | K3260: 3 | N3260: 终极队长
A3261: 153010 | B3261: 105200 | C3261: 105200 | D3261: 105201 | E3261: 105202 | F3261: 105203 | G3261: 105204 | J3261: =IF(MOD(RC[-9],10)=2,3,"") ->  | K3261: 3
A3262: 153020 | B3262: 105211 | C3262: 105211 | D3262: 105211 | E3262: 105212 | F3262: 105212 | G3262: 105214 | J3262: =IF(MOD(RC[-9],10)=2,3,"") ->  | K3262: 3
A3263: 153030 | B3263: 105223 | C3263: 105220 | D3263: 105221 | E3263: 105222 | F3263: 105223 | G3263: 105223 | J3263: =IF(MOD(RC[-9],10)=2,3,"") ->  | K3263: 3
A3264: 153031 | B3264: 105225 | C3264: 105221 | D3264: 105222 | E3264: 105223 | F3264: 105225 | G3264: 105224 | J3264: =IF(MOD(RC[-9],10)=2,3,"") ->  | K3264: 3 | N3264: 牛头人
A3265: 153040 | B3265: 105232 | C3265: 105231 | D3265: 105231 | E3265: 105232 | F3265: 105232 | G3265: 105234 | J3265: =IF(MOD(RC[-9],10)=2,3,"") ->  | K3265: 3
A3266: 153050 | B3266: 105243 | C3266: 105240 | D3266: 105240 | E3266: 105243 | F3266: 105243 | G3266: 105244 | J3266: =IF(MOD(RC[-9],10)=2,3,"") ->  | K3266: 3
A3267: 153060 | B3267: 105250 | C3267: 105250 | D3267: 105250 | E3267: 105251 | F3267: 105253 | G3267: 105254 | J3267: =IF(MOD(RC[-9],10)=2,3,"") ->  | K3267: 3
A3268: 153061 | B3268: 105255 | C3268: 105250 | D3268: 105251 | E3268: 105253 | F3268: 105255 | G3268: 105254 | J3268: =IF(MOD(RC[-9],10)=2,3,"") ->  | K3268: 3 | N3268: 恶魔猎手
A3269: 153070 | B3269: 105262 | C3269: 105261 | D3269: 105261 | E3269: 105262 | F3269: 105262 | G3269: 105264 | J3269: =IF(MOD(RC[-9],10)=2,3,"") ->  | K3269: 3
A3270: 153080 | B3270: 105270 | C3270: 105270 | D3270: 105270 | E3270: 105270 | F3270: 105273 | G3270: 105274 | J3270: =IF(MOD(RC[-9],10)=2,3,"") ->  | K3270: 3
A3271: 153090 | B3271: 105281 | C3271: 105280 | D3271: 105281 | E3271: 105281 | F3271: 105282 | G3271: 105283 | J3271: =IF(MOD(RC[-9],10)=2,3,"") ->  | K3271: 3
A3272: 153091 | B3272: 105285 | C3272: 105280 | D3272: 105281 | E3272: 105281 | F3272: 105285 | G3272: 105284 | J3272: =IF(MOD(RC[-9],10)=2,3,"") ->  | K3272: 3 | N3272: 食人魔
A3273: 153100 | B3273: 105290 | C3273: 105290 | D3273: 105291 | E3273: 105292 | F3273: 105294 | G3273: 0 | J3273: =IF(MOD(RC[-9],10)=2,3,"") ->  | K3273: 3
A3274: 153101 | B3274: 105291 | C3274: 105290 | D3274: 105291 | E3274: 105292 | F3274: 105293 | G3274: 0 | J3274: =IF(MOD(RC[-9],10)=2,3,"") ->  | K3274: 3
A3275: 153102 | B3275: 105295 | C3275: 105291 | D3275: 105293 | E3275: 105294 | F3275: 105295 | G3275: 0 | I3275: 0.1 | J3275: =IF(MOD(RC[-9],10)=2,3,"") -> 3 | K3275: 3 | N3275: 半人马
A3276: 154010 | B3276: 105300 | C3276: 105300 | D3276: 105301 | E3276: 105302 | F3276: 105303 | G3276: 105304 | J3276: =IF(MOD(RC[-9],10)=2,3,"") ->  | K3276: 3
A3277: 154020 | B3277: 105311 | C3277: 105311 | D3277: 105311 | E3277: 105312 | F3277: 105312 | G3277: 105314 | J3277: =IF(MOD(RC[-9],10)=2,3,"") ->  | K3277: 3
A3278: 154030 | B3278: 105324 | C3278: 105320 | D3278: 105321 | E3278: 105322 | F3278: 105323 | G3278: 105323 | J3278: =IF(MOD(RC[-9],10)=2,3,"") ->  | K3278: 3
A3279: 154031 | B3279: 105325 | C3279: 105321 | D3279: 105322 | E3279: 105323 | F3279: 105325 | G3279: 105324 | J3279: =IF(MOD(RC[-9],10)=2,3,"") ->  | K3279: 3 | N3279: 斯巴达
A3280: 154040 | B3280: 105331 | C3280: 105331 | D3280: 105331 | E3280: 105331 | F3280: 105332 | G3280: 105332 | J3280: =IF(MOD(RC[-9],10)=2,3,"") ->  | K3280: 3
A3281: 154050 | B3281: 105340 | C3281: 105340 | D3281: 105340 | E3281: 105343 | F3281: 105343 | G3281: 105344 | J3281: =IF(MOD(RC[-9],10)=2,3,"") ->  | K3281: 3
A3282: 154060 | B3282: 105350 | C3282: 105350 | D3282: 105350 | E3282: 105351 | F3282: 105353 | G3282: 105354 | J3282: =IF(MOD(RC[-9],10)=2,3,"") ->  | K3282: 3
A3283: 154061 | B3283: 105355 | C3283: 105350 | D3283: 105351 | E3283: 105351 | F3283: 105353 | G3283: 105355 | J3283: =IF(MOD(RC[-9],10)=2,3,"") ->  | K3283: 3 | N3283: 圣女贞德
A3284: 154070 | B3284: 105362 | C3284: 105361 | D3284: 105361 | E3284: 105362 | F3284: 105362 | G3284: 105364 | J3284: =IF(MOD(RC[-9],10)=2,3,"") ->  | K3284: 3
A3285: 154080 | B3285: 105370 | C3285: 105370 | D3285: 105370 | E3285: 105370 | F3285: 105373 | G3285: 105374 | J3285: =IF(MOD(RC[-9],10)=2,3,"") ->  | K3285: 3
A3286: 154090 | B3286: 105380 | C3286: 105380 | D3286: 105380 | E3286: 105381 | F3286: 105382 | G3286: 105383 | J3286: =IF(MOD(RC[-9],10)=2,3,"") ->  | K3286: 3
A3287: 154091 | B3287: 105385 | C3287: 105380 | D3287: 105380 | E3287: 105383 | F3287: 105385 | G3287: 105384 | J3287: =IF(MOD(RC[-9],10)=2,3,"") ->  | K3287: 3 | N3287: 佐罗
A3288: 154100 | B3288: 105390 | C3288: 105390 | D3288: 105390 | E3288: 105392 | F3288: 105394 | G3288: 0 | J3288: =IF(MOD(RC[-9],10)=2,3,"") ->  | K3288: 3
A3289: 154101 | B3289: 105391 | C3289: 105391 | D3289: 105391 | E3289: 105392 | F3289: 105394 | G3289: 0 | J3289: =IF(MOD(RC[-9],10)=2,3,"") ->  | K3289: 3
A3290: 154102 | B3290: 105395 | C3290: 105390 | D3290: 105392 | E3290: 105394 | F3290: 105395 | G3290: 0 | I3290: 0.1 | J3290: =IF(MOD(RC[-9],10)=2,3,"") -> 3 | K3290: 3 | N3290: 大力神
A3291: 155010 | B3291: 105400 | C3291: 105400 | D3291: 105401 | E3291: 105402 | F3291: 105403 | G3291: 105404 | J3291: =IF(MOD(RC[-9],10)=2,3,"") ->  | K3291: 3
A3292: 155020 | B3292: 105412 | C3292: 105411 | D3292: 105411 | E3292: 105412 | F3292: 105412 | G3292: 105414 | J3292: =IF(MOD(RC[-9],10)=2,3,"") ->  | K3292: 3
A3293: 155030 | B3293: 105421 | C3293: 105420 | D3293: 105421 | E3293: 105421 | F3293: 105422 | G3293: 105423 | J3293: =IF(MOD(RC[-9],10)=2,3,"") ->  | K3293: 3
A3294: 155031 | B3294: 105425 | C3294: 105421 | D3294: 105421 | E3294: 105423 | F3294: 105425 | G3294: 105424 | J3294: =IF(MOD(RC[-9],10)=2,3,"") ->  | K3294: 3 | N3294: 红颅鬼
A3295: 155040 | B3295: 105431 | C3295: 105431 | D3295: 105431 | E3295: 105431 | F3295: 105432 | G3295: 105432 | J3295: =IF(MOD(RC[-9],10)=2,3,"") ->  | K3295: 3
A3296: 155050 | B3296: 105443 | C3296: 105440 | D3296: 105440 | E3296: 105443 | F3296: 105443 | G3296: 105444 | J3296: =IF(MOD(RC[-9],10)=2,3,"") ->  | K3296: 3
A3297: 155060 | B3297: 105450 | C3297: 105450 | D3297: 105450 | E3297: 105451 | F3297: 105453 | G3297: 105454 | J3297: =IF(MOD(RC[-9],10)=2,3,"") ->  | K3297: 3
A3298: 155061 | B3298: 105455 | C3298: 105451 | D3298: 105452 | E3298: 105453 | F3298: 105455 | G3298: 105454 | J3298: =IF(MOD(RC[-9],10)=2,3,"") ->  | K3298: 3 | N3298: 野蛮巨人
A3299: 155070 | B3299: 105461 | C3299: 105461 | D3299: 105461 | E3299: 105462 | F3299: 105462 | G3299: 105464 | J3299: =IF(MOD(RC[-9],10)=2,3,"") ->  | K3299: 3
A3300: 155080 | B3300: 105470 | C3300: 105470 | D3300: 105470 | E3300: 105470 | F3300: 105473 | G3300: 105474 | J3300: =IF(MOD(RC[-9],10)=2,3,"") ->  | K3300: 3
A3301: 155090 | B3301: 105481 | C3301: 105480 | D3301: 105481 | E3301: 105481 | F3301: 105483 | G3301: 105483 | J3301: =IF(MOD(RC[-9],10)=2,3,"") ->  | K3301: 3
A3302: 155091 | B3302: 105485 | C3302: 105481 | D3302: 105482 | E3302: 105483 | F3302: 105485 | G3302: 105484 | J3302: =IF(MOD(RC[-9],10)=2,3,"") ->  | K3302: 3 | N3302: 地狱铁拳
A3303: 155100 | B3303: 105490 | C3303: 105490 | D3303: 105490 | E3303: 105492 | F3303: 105494 | G3303: 0 | J3303: =IF(MOD(RC[-9],10)=2,3,"") ->  | K3303: 3
A3304: 155101 | B3304: 105491 | C3304: 105491 | D3304: 105491 | E3304: 105492 | F3304: 105493 | G3304: 0 | J3304: =IF(MOD(RC[-9],10)=2,3,"") ->  | K3304: 3
A3305: 155102 | B3305: 105495 | C3305: 105491 | D3305: 105492 | E3305: 105494 | F3305: 105495 | G3305: 0 | I3305: 0.1 | J3305: =IF(MOD(RC[-9],10)=2,3,"") -> 3 | K3305: 3 | N3305: 死亡武士
A3306: 156010 | B3306: 105503 | C3306: 105500 | D3306: 105501 | E3306: 105502 | F3306: 105503 | G3306: 105504 | J3306: =IF(MOD(RC[-9],10)=2,3,"") ->  | K3306: 3
A3307: 156020 | B3307: 105511 | C3307: 105510 | D3307: 105511 | E3307: 105512 | F3307: 105513 | G3307: 105514 | J3307: =IF(MOD(RC[-9],10)=2,3,"") ->  | K3307: 3
A3308: 156030 | B3308: 105522 | C3308: 105521 | D3308: 105521 | E3308: 105522 | F3308: 105523 | G3308: 105524 | J3308: =IF(MOD(RC[-9],10)=2,3,"") ->  | K3308: 3
A3309: 156031 | B3309: 105525 | C3309: 105521 | D3309: 105522 | E3309: 105523 | F3309: 105525 | G3309: 105524 | J3309: =IF(MOD(RC[-9],10)=2,3,"") ->  | K3309: 3
A3310: 156040 | B3310: 105533 | C3310: 105530 | D3310: 105531 | E3310: 105532 | F3310: 105533 | G3310: 105534 | J3310: =IF(MOD(RC[-9],10)=2,3,"") ->  | K3310: 3
A3311: 156050 | B3311: 105541 | C3311: 105540 | D3311: 105541 | E3311: 105542 | F3311: 105543 | G3311: 105544 | J3311: =IF(MOD(RC[-9],10)=2,3,"") ->  | K3311: 3
A3312: 156060 | B3312: 105554 | C3312: 105550 | D3312: 105551 | E3312: 105552 | F3312: 105553 | G3312: 105554 | J3312: =IF(MOD(RC[-9],10)=2,3,"") ->  | K3312: 3
A3313: 156061 | B3313: 105555 | C3313: 105551 | D3313: 105552 | E3313: 105553 | F3313: 105554 | G3313: 105555 | J3313: =IF(MOD(RC[-9],10)=2,3,"") ->  | K3313: 3
A3314: 156070 | B3314: 105561 | C3314: 105560 | D3314: 105561 | E3314: 105562 | F3314: 105563 | G3314: 105564 | J3314: =IF(MOD(RC[-9],10)=2,3,"") ->  | K3314: 3
A3315: 156080 | B3315: 105570 | C3315: 105570 | D3315: 105571 | E3315: 105572 | F3315: 105573 | G3315: 105574 | J3315: =IF(MOD(RC[-9],10)=2,3,"") ->  | K3315: 3
A3316: 156090 | B3316: 105580 | C3316: 105580 | D3316: 105581 | E3316: 105582 | F3316: 105583 | G3316: 105584 | J3316: =IF(MOD(RC[-9],10)=2,3,"") ->  | K3316: 3
A3317: 156091 | B3317: 105585 | C3317: 105581 | D3317: 105582 | E3317: 105583 | F3317: 105584 | G3317: 105585 | J3317: =IF(MOD(RC[-9],10)=2,3,"") ->  | K3317: 3
A3318: 156100 | B3318: 105590 | C3318: 105590 | D3318: 0 | E3318: 0 | F3318: 0 | G3318: 0 | J3318: =IF(MOD(RC[-9],10)=2,3,"") ->  | K3318: 3
A3319: 157010 | B3319: 105604 | C3319: 105600 | D3319: 105601 | E3319: 105602 | F3319: 105603 | G3319: 105604 | J3319: =IF(MOD(RC[-9],10)=2,3,"") ->  | K3319: 3
A3320: 157020 | B3320: 105612 | C3320: 105610 | D3320: 105611 | E3320: 105612 | F3320: 105613 | G3320: 105614 | J3320: =IF(MOD(RC[-9],10)=2,3,"") ->  | K3320: 3
A3321: 157030 | B3321: 105624 | C3321: 105620 | D3321: 105621 | E3321: 105622 | F3321: 105623 | G3321: 105624 | J3321: =IF(MOD(RC[-9],10)=2,3,"") ->  | K3321: 3
A3322: 157031 | B3322: 105625 | C3322: 105621 | D3322: 105622 | E3322: 105623 | F3322: 105624 | G3322: 105625 | J3322: =IF(MOD(RC[-9],10)=2,3,"") ->  | K3322: 3
A3323: 157040 | B3323: 105631 | C3323: 105630 | D3323: 105631 | E3323: 105632 | F3323: 105633 | G3323: 105634 | J3323: =IF(MOD(RC[-9],10)=2,3,"") ->  | K3323: 3
A3324: 157050 | B3324: 105640 | C3324: 105640 | D3324: 105641 | E3324: 105642 | F3324: 105643 | G3324: 105644 | J3324: =IF(MOD(RC[-9],10)=2,3,"") ->  | K3324: 3
A3325: 157060 | B3325: 105654 | C3325: 105650 | D3325: 105651 | E3325: 105652 | F3325: 105653 | G3325: 105654 | J3325: =IF(MOD(RC[-9],10)=2,3,"") ->  | K3325: 3
A3326: 157061 | B3326: 105655 | C3326: 105651 | D3326: 105652 | E3326: 105653 | F3326: 105654 | G3326: 105655 | J3326: =IF(MOD(RC[-9],10)=2,3,"") ->  | K3326: 3
A3327: 157070 | B3327: 105661 | C3327: 105660 | D3327: 105661 | E3327: 105662 | F3327: 105663 | G3327: 105664 | J3327: =IF(MOD(RC[-9],10)=2,3,"") ->  | K3327: 3
A3328: 157080 | B3328: 105671 | C3328: 105670 | D3328: 105671 | E3328: 105672 | F3328: 105673 | G3328: 105674 | J3328: =IF(MOD(RC[-9],10)=2,3,"") ->  | K3328: 3
A3329: 157090 | B3329: 105684 | C3329: 105680 | D3329: 105681 | E3329: 105682 | F3329: 105683 | G3329: 105684 | J3329: =IF(MOD(RC[-9],10)=2,3,"") ->  | K3329: 3
A3330: 157091 | B3330: 105685 | C3330: 105681 | D3330: 105682 | E3330: 105683 | F3330: 105684 | G3330: 105685 | J3330: =IF(MOD(RC[-9],10)=2,3,"") ->  | K3330: 3
A3331: 157100 | B3331: 105690 | C3331: 105690 | D3331: 105692 | E3331: 105692 | F3331: 105693 | G3331: 105693 | J3331: =IF(MOD(RC[-9],10)=2,3,"") ->  | K3331: 3
A3332: 157101 | B3332: 105694 | C3332: 105690 | D3332: 105690 | E3332: 105692 | F3332: 105694 | G3332: 105694 | J3332: =IF(MOD(RC[-9],10)=2,3,"") ->  | K3332: 3
A3333: 157102 | B3333: 105695 | C3333: 105691 | D3333: 105692 | E3333: 105693 | F3333: 105694 | G3333: 105695 | I3333: 0.1 | J3333: =IF(MOD(RC[-9],10)=2,3,"") -> 3 | K3333: 3
A3334: 158010 | B3334: 105700 | C3334: 105700 | D3334: 105701 | E3334: 105702 | F3334: 105703 | G3334: 105704 | J3334: =IF(MOD(RC[-9],10)=2,3,"") ->  | K3334: 3
A3335: 158020 | B3335: 105713 | C3335: 105710 | D3335: 105711 | E3335: 105712 | F3335: 105713 | G3335: 105714 | J3335: =IF(MOD(RC[-9],10)=2,3,"") ->  | K3335: 3
A3336: 158030 | B3336: 105724 | C3336: 105720 | D3336: 105721 | E3336: 105722 | F3336: 105723 | G3336: 105724 | J3336: =IF(MOD(RC[-9],10)=2,3,"") ->  | K3336: 3
A3337: 158031 | B3337: 105725 | C3337: 105721 | D3337: 105722 | E3337: 105723 | F3337: 105724 | G3337: 105725 | J3337: =IF(MOD(RC[-9],10)=2,3,"") ->  | K3337: 3
A3338: 158040 | B3338: 105731 | C3338: 105730 | D3338: 105731 | E3338: 105732 | F3338: 105733 | G3338: 105734 | J3338: =IF(MOD(RC[-9],10)=2,3,"") ->  | K3338: 3
A3339: 158050 | B3339: 105743 | C3339: 105740 | D3339: 105740 | E3339: 105743 | F3339: 105743 | G3339: 105744 | J3339: =IF(MOD(RC[-9],10)=2,3,"") ->  | K3339: 3
A3340: 158060 | B3340: 105753 | C3340: 105750 | D3340: 105751 | E3340: 105752 | F3340: 105753 | G3340: 105754 | J3340: =IF(MOD(RC[-9],10)=2,3,"") ->  | K3340: 3
A3341: 158061 | B3341: 105755 | C3341: 105751 | D3341: 105752 | E3341: 105753 | F3341: 105754 | G3341: 105755 | J3341: =IF(MOD(RC[-9],10)=2,3,"") ->  | K3341: 3
A3342: 158070 | B3342: 105761 | C3342: 105760 | D3342: 105761 | E3342: 105762 | F3342: 105763 | G3342: 105764 | J3342: =IF(MOD(RC[-9],10)=2,3,"") ->  | K3342: 3
A3343: 158080 | B3343: 105773 | C3343: 105770 | D3343: 105771 | E3343: 105772 | F3343: 105773 | G3343: 105774 | J3343: =IF(MOD(RC[-9],10)=2,3,"") ->  | K3343: 3
A3344: 158090 | B3344: 105780 | C3344: 105780 | D3344: 105781 | E3344: 105782 | F3344: 105783 | G3344: 105784 | J3344: =IF(MOD(RC[-9],10)=2,3,"") ->  | K3344: 3
A3345: 158091 | B3345: 105785 | C3345: 105781 | D3345: 105782 | E3345: 105783 | F3345: 105784 | G3345: 105785 | J3345: =IF(MOD(RC[-9],10)=2,3,"") ->  | K3345: 3
A3346: 158100 | B3346: 105790 | C3346: 105790 | D3346: 105791 | E3346: 105792 | F3346: 105793 | G3346: 105792 | J3346: =IF(MOD(RC[-9],10)=2,3,"") ->  | K3346: 3
A3347: 158101 | B3347: 105793 | C3347: 105790 | D3347: 105792 | E3347: 105792 | F3347: 105793 | G3347: 105793 | J3347: =IF(MOD(RC[-9],10)=2,3,"") ->  | K3347: 3
A3348: 158102 | B3348: 105795 | C3348: 105791 | D3348: 105792 | E3348: 105793 | F3348: 105794 | G3348: 105795 | I3348: 0.1 | J3348: =IF(MOD(RC[-9],10)=2,3,"") -> 3 | K3348: 3
A3349: 159010 | B3349: 105801 | C3349: 105800 | D3349: 105801 | E3349: 105802 | F3349: 105803 | G3349: 105804 | J3349: =IF(MOD(RC[-9],10)=2,3,"") ->  | K3349: 3
A3350: 159020 | B3350: 105810 | C3350: 105810 | D3350: 105811 | E3350: 105812 | F3350: 105813 | G3350: 105814 | J3350: =IF(MOD(RC[-9],10)=2,3,"") ->  | K3350: 3
A3351: 159030 | B3351: 105822 | C3351: 105820 | D3351: 105821 | E3351: 105822 | F3351: 105823 | G3351: 105824 | J3351: =IF(MOD(RC[-9],10)=2,3,"") ->  | K3351: 3
A3352: 159031 | B3352: 105825 | C3352: 105821 | D3352: 105822 | E3352: 105823 | F3352: 105824 | G3352: 105825 | J3352: =IF(MOD(RC[-9],10)=2,3,"") ->  | K3352: 3
A3353: 159040 | B3353: 105834 | C3353: 105830 | D3353: 105831 | E3353: 105832 | F3353: 105833 | G3353: 105834 | J3353: =IF(MOD(RC[-9],10)=2,3,"") ->  | K3353: 3
A3354: 159050 | B3354: 105840 | C3354: 105840 | D3354: 105841 | E3354: 105842 | F3354: 105843 | G3354: 105844 | J3354: =IF(MOD(RC[-9],10)=2,3,"") ->  | K3354: 3
A3355: 159060 | B3355: 105852 | C3355: 105850 | D3355: 105851 | E3355: 105852 | F3355: 105853 | G3355: 105854 | J3355: =IF(MOD(RC[-9],10)=2,3,"") ->  | K3355: 3
A3356: 159061 | B3356: 105855 | C3356: 105851 | D3356: 105852 | E3356: 105853 | F3356: 105854 | G3356: 105855 | J3356: =IF(MOD(RC[-9],10)=2,3,"") ->  | K3356: 3
A3357: 159070 | B3357: 105864 | C3357: 105860 | D3357: 105861 | E3357: 105862 | F3357: 105863 | G3357: 105864 | J3357: =IF(MOD(RC[-9],10)=2,3,"") ->  | K3357: 3
A3358: 159080 | B3358: 105872 | C3358: 105870 | D3358: 105871 | E3358: 105872 | F3358: 105873 | G3358: 105874 | J3358: =IF(MOD(RC[-9],10)=2,3,"") ->  | K3358: 3
A3359: 159090 | B3359: 105882 | C3359: 105880 | D3359: 105881 | E3359: 105882 | F3359: 105883 | G3359: 105884 | J3359: =IF(MOD(RC[-9],10)=2,3,"") ->  | K3359: 3
A3360: 159091 | B3360: 105885 | C3360: 105881 | D3360: 105882 | E3360: 105883 | F3360: 105884 | G3360: 105885 | J3360: =IF(MOD(RC[-9],10)=2,3,"") ->  | K3360: 3
A3361: 159100 | B3361: 105894 | C3361: 105890 | D3361: 105891 | E3361: 105892 | F3361: 105893 | G3361: 105894 | J3361: =IF(MOD(RC[-9],10)=2,3,"") ->  | K3361: 3
A3362: 159101 | B3362: 105894 | C3362: 105890 | D3362: 105891 | E3362: 105892 | F3362: 105893 | G3362: 105894 | J3362: =IF(MOD(RC[-9],10)=2,3,"") ->  | K3362: 3
A3363: 159102 | B3363: 105896 | C3363: 105892 | D3363: 105893 | E3363: 105894 | F3363: 105895 | G3363: 105896 | I3363: 0.1 | J3363: =IF(MOD(RC[-9],10)=2,3,"") -> 3 | K3363: 3
A3364: 160010 | B3364: 105902 | C3364: 105900 | D3364: 105901 | E3364: 105902 | F3364: 105903 | G3364: 105904 | J3364: =IF(MOD(RC[-9],10)=2,3,"") ->  | K3364: 3
A3365: 160020 | B3365: 105912 | C3365: 105910 | D3365: 105911 | E3365: 105912 | F3365: 105913 | G3365: 105914 | J3365: =IF(MOD(RC[-9],10)=2,3,"") ->  | K3365: 3
A3366: 160030 | B3366: 105924 | C3366: 105920 | D3366: 105921 | E3366: 105922 | F3366: 105923 | G3366: 105924 | J3366: =IF(MOD(RC[-9],10)=2,3,"") ->  | K3366: 3
A3367: 160031 | B3367: 105925 | C3367: 105921 | D3367: 105922 | E3367: 105923 | F3367: 105924 | G3367: 105925 | J3367: =IF(MOD(RC[-9],10)=2,3,"") ->  | K3367: 3
A3368: 160040 | B3368: 105930 | C3368: 105930 | D3368: 105931 | E3368: 105932 | F3368: 105933 | G3368: 105934 | J3368: =IF(MOD(RC[-9],10)=2,3,"") ->  | K3368: 3
A3369: 160050 | B3369: 105943 | C3369: 105940 | D3369: 105941 | E3369: 105942 | F3369: 105943 | G3369: 105944 | J3369: =IF(MOD(RC[-9],10)=2,3,"") ->  | K3369: 3
A3370: 160060 | B3370: 105950 | C3370: 105950 | D3370: 105951 | E3370: 105952 | F3370: 105953 | G3370: 105954 | J3370: =IF(MOD(RC[-9],10)=2,3,"") ->  | K3370: 3
A3371: 160061 | B3371: 105955 | C3371: 105951 | D3371: 105952 | E3371: 105953 | F3371: 105954 | G3371: 105955 | J3371: =IF(MOD(RC[-9],10)=2,3,"") ->  | K3371: 3
A3372: 160070 | B3372: 105963 | C3372: 105960 | D3372: 105961 | E3372: 105962 | F3372: 105963 | G3372: 105964 | J3372: =IF(MOD(RC[-9],10)=2,3,"") ->  | K3372: 3
A3373: 160080 | B3373: 105970 | C3373: 105970 | D3373: 105971 | E3373: 105972 | F3373: 105973 | G3373: 105974 | J3373: =IF(MOD(RC[-9],10)=2,3,"") ->  | K3373: 3
A3374: 160090 | B3374: 105981 | C3374: 105980 | D3374: 105981 | E3374: 105982 | F3374: 105983 | G3374: 105984 | J3374: =IF(MOD(RC[-9],10)=2,3,"") ->  | K3374: 3
A3375: 160091 | B3375: 105985 | C3375: 105981 | D3375: 105982 | E3375: 105983 | F3375: 105984 | G3375: 105985 | J3375: =IF(MOD(RC[-9],10)=2,3,"") ->  | K3375: 3
A3376: 160100 | B3376: 105994 | C3376: 105990 | D3376: 105991 | E3376: 105992 | F3376: 105993 | G3376: 105994 | J3376: =IF(MOD(RC[-9],10)=2,3,"") ->  | K3376: 3
A3377: 160101 | B3377: 105993 | C3377: 105991 | D3377: 105991 | E3377: 105992 | F3377: 105993 | G3377: 105993 | J3377: =IF(MOD(RC[-9],10)=2,3,"") ->  | K3377: 3
A3378: 160102 | B3378: 105995 | C3378: 105991 | D3378: 105992 | E3378: 105993 | F3378: 105994 | G3378: 105995 | I3378: 0.1 | J3378: =IF(MOD(RC[-9],10)=2,3,"") -> 3 | K3378: 3
A3379: 161010 | B3379: 106003 | C3379: 106000 | D3379: 106001 | E3379: 106002 | F3379: 106003 | G3379: 106003 | J3379: =IF(MOD(RC[-9],10)=2,3,"") ->  | K3379: 3
A3380: 161020 | B3380: 106012 | C3380: 106010 | D3380: 106011 | E3380: 106012 | F3380: 106013 | G3380: 106014 | J3380: =IF(MOD(RC[-9],10)=2,3,"") ->  | K3380: 3
A3381: 161030 | B3381: 106022 | C3381: 106020 | D3381: 106021 | E3381: 106022 | F3381: 106022 | G3381: 106022 | J3381: =IF(MOD(RC[-9],10)=2,3,"") ->  | K3381: 3
A3382: 161031 | B3382: 106023 | C3382: 106020 | D3382: 106021 | E3382: 106022 | F3382: 106022 | G3382: 106023 | J3382: =IF(MOD(RC[-9],10)=2,3,"") ->  | K3382: 3
A3383: 161040 | B3383: 106042 | C3383: 106030 | D3383: 106031 | E3383: 106040 | F3383: 106041 | G3383: 106042 | J3383: =IF(MOD(RC[-9],10)=2,3,"") ->  | K3383: 3
A3384: 161050 | B3384: 106042 | C3384: 106040 | D3384: 106041 | E3384: 106042 | F3384: 106041 | G3384: 106042 | J3384: =IF(MOD(RC[-9],10)=2,3,"") ->  | K3384: 3
A3385: 161060 | B3385: 106053 | C3385: 106050 | D3385: 106051 | E3385: 106052 | F3385: 106053 | G3385: 106053 | J3385: =IF(MOD(RC[-9],10)=2,3,"") ->  | K3385: 3
A3386: 161061 | B3386: 106054 | C3386: 106050 | D3386: 106051 | E3386: 106052 | F3386: 106053 | G3386: 106054 | J3386: =IF(MOD(RC[-9],10)=2,3,"") ->  | K3386: 3
A3387: 161070 | B3387: 106060 | C3387: 106060 | D3387: 106061 | E3387: 106062 | F3387: 106061 | G3387: 106062 | J3387: =IF(MOD(RC[-9],10)=2,3,"") ->  | K3387: 3
A3388: 161080 | B3388: 106070 | C3388: 106070 | D3388: 106071 | E3388: 106072 | F3388: 106071 | G3388: 106072 | J3388: =IF(MOD(RC[-9],10)=2,3,"") ->  | K3388: 3
A3389: 161090 | B3389: 106081 | C3389: 106080 | D3389: 106081 | E3389: 106082 | F3389: 106081 | G3389: 106082 | J3389: =IF(MOD(RC[-9],10)=2,3,"") ->  | K3389: 3
A3390: 161091 | B3390: 106083 | C3390: 106080 | D3390: 106081 | E3390: 106082 | F3390: 106083 | G3390: 106083 | J3390: =IF(MOD(RC[-9],10)=2,3,"") ->  | K3390: 3
A3391: 161100 | B3391: 106090 | C3391: 106090 | D3391: 106091 | E3391: 106092 | F3391: 106091 | G3391: 106092 | J3391: =IF(MOD(RC[-9],10)=2,3,"") ->  | K3391: 3
A3392: 161101 | B3392: 106092 | C3392: 106090 | D3392: 106092 | E3392: 106091 | F3392: 106091 | G3392: 106092 | J3392: =IF(MOD(RC[-9],10)=2,3,"") ->  | K3392: 3
A3393: 161102 | B3393: 106094 | C3393: 106090 | D3393: 106091 | E3393: 106092 | F3393: 106093 | G3393: 106094 | I3393: 0.1 | J3393: =IF(MOD(RC[-9],10)=2,3,"") -> 3 | K3393: 3
A3394: 162010 | B3394: 106100 | C3394: 106100 | D3394: 106101 | E3394: 106102 | F3394: 106103 | G3394: 106104 | J3394: =IF(MOD(RC[-9],10)=2,3,"") ->  | K3394: 3
A3395: 162020 | B3395: 106111 | C3395: 106110 | D3395: 106111 | E3395: 106112 | F3395: 106111 | G3395: 106112 | J3395: =IF(MOD(RC[-9],10)=2,3,"") ->  | K3395: 3
A3396: 162030 | B3396: 106122 | C3396: 106120 | D3396: 106121 | E3396: 106122 | F3396: 106123 | G3396: 106122 | J3396: =IF(MOD(RC[-9],10)=2,3,"") ->  | K3396: 3
A3397: 162031 | B3397: 106124 | C3397: 106120 | D3397: 106121 | E3397: 106122 | F3397: 106123 | G3397: 106124 | J3397: =IF(MOD(RC[-9],10)=2,3,"") ->  | K3397: 3
A3398: 162040 | B3398: 106132 | C3398: 106130 | D3398: 106131 | E3398: 106132 | F3398: 106131 | G3398: 106132 | J3398: =IF(MOD(RC[-9],10)=2,3,"") ->  | K3398: 3
A3399: 162050 | B3399: 106142 | C3399: 106140 | D3399: 106141 | E3399: 106142 | F3399: 106141 | G3399: 106142 | J3399: =IF(MOD(RC[-9],10)=2,3,"") ->  | K3399: 3
A3400: 162060 | B3400: 106150 | C3400: 106150 | D3400: 106151 | E3400: 106152 | F3400: 106150 | G3400: 106151 | J3400: =IF(MOD(RC[-9],10)=2,3,"") ->  | K3400: 3
A3401: 162061 | B3401: 106153 | C3401: 106150 | D3401: 106151 | E3401: 106152 | F3401: 106153 | G3401: 106152 | J3401: =IF(MOD(RC[-9],10)=2,3,"") ->  | K3401: 3
A3402: 162070 | B3402: 106163 | C3402: 106160 | D3402: 106161 | E3402: 106162 | F3402: 106163 | G3402: 106163 | J3402: =IF(MOD(RC[-9],10)=2,3,"") ->  | K3402: 3
A3403: 162080 | B3403: 106171 | C3403: 106170 | D3403: 106171 | E3403: 106172 | F3403: 106171 | G3403: 106172 | J3403: =IF(MOD(RC[-9],10)=2,3,"") ->  | K3403: 3
A3404: 162090 | B3404: 106183 | C3404: 106180 | D3404: 106181 | E3404: 106182 | F3404: 106183 | G3404: 106183 | J3404: =IF(MOD(RC[-9],10)=2,3,"") ->  | K3404: 3
A3405: 162091 | B3405: 106184 | C3405: 106180 | D3405: 106181 | E3405: 106182 | F3405: 106183 | G3405: 106184 | J3405: =IF(MOD(RC[-9],10)=2,3,"") ->  | K3405: 3
A3406: 162100 | B3406: 106193 | C3406: 106190 | D3406: 106191 | E3406: 106192 | F3406: 106193 | G3406: 106193 | J3406: =IF(MOD(RC[-9],10)=2,3,"") ->  | K3406: 3
A3407: 162101 | B3407: 106193 | C3407: 106190 | D3407: 106190 | E3407: 106192 | F3407: 106193 | G3407: 106192 | J3407: =IF(MOD(RC[-9],10)=2,3,"") ->  | K3407: 3
A3408: 162102 | B3408: 106195 | C3408: 106191 | D3408: 106192 | E3408: 106193 | F3408: 106194 | G3408: 106195 | I3408: 0.1 | J3408: =IF(MOD(RC[-9],10)=2,3,"") -> 3 | K3408: 3
A3409: 163010 | B3409: 106202 | C3409: 106200 | D3409: 106201 | E3409: 106202 | F3409: 106201 | G3409: 106202 | J3409: =IF(MOD(RC[-9],10)=2,3,"") ->  | K3409: 3
A3410: 163020 | B3410: 106211 | C3410: 106210 | D3410: 106211 | E3410: 106212 | F3410: 106211 | G3410: 106212 | J3410: =IF(MOD(RC[-9],10)=2,3,"") ->  | K3410: 3
A3411: 163030 | B3411: 106222 | C3411: 106220 | D3411: 106221 | E3411: 106222 | F3411: 106221 | G3411: 106222 | J3411: =IF(MOD(RC[-9],10)=2,3,"") ->  | K3411: 3
A3412: 163031 | B3412: 106223 | C3412: 106220 | D3412: 106221 | E3412: 106222 | F3412: 106223 | G3412: 106222 | J3412: =IF(MOD(RC[-9],10)=2,3,"") ->  | K3412: 3
A3413: 163040 | B3413: 106232 | C3413: 106230 | D3413: 106231 | E3413: 106232 | F3413: 106233 | G3413: 106233 | J3413: =IF(MOD(RC[-9],10)=2,3,"") ->  | K3413: 3
A3414: 163050 | B3414: 106240 | C3414: 106240 | D3414: 106241 | E3414: 106242 | F3414: 106240 | G3414: 106241 | J3414: =IF(MOD(RC[-9],10)=2,3,"") ->  | K3414: 3
A3415: 163060 | B3415: 106251 | C3415: 106250 | D3415: 106251 | E3415: 106252 | F3415: 106251 | G3415: 106252 | J3415: =IF(MOD(RC[-9],10)=2,3,"") ->  | K3415: 3
A3416: 163061 | B3416: 106253 | C3416: 106250 | D3416: 106251 | E3416: 106252 | F3416: 106253 | G3416: 106252 | J3416: =IF(MOD(RC[-9],10)=2,3,"") ->  | K3416: 3
A3417: 163070 | B3417: 106261 | C3417: 106260 | D3417: 106261 | E3417: 106262 | F3417: 106263 | G3417: 106264 | J3417: =IF(MOD(RC[-9],10)=2,3,"") ->  | K3417: 3
A3418: 163080 | B3418: 106272 | C3418: 106270 | D3418: 106271 | E3418: 106272 | F3418: 106271 | G3418: 106272 | J3418: =IF(MOD(RC[-9],10)=2,3,"") ->  | K3418: 3
A3419: 163090 | B3419: 106280 | C3419: 106280 | D3419: 106281 | E3419: 106282 | F3419: 106280 | G3419: 106281 | J3419: =IF(MOD(RC[-9],10)=2,3,"") ->  | K3419: 3
A3420: 163091 | B3420: 106283 | C3420: 106280 | D3420: 106281 | E3420: 106282 | F3420: 106283 | G3420: 106282 | J3420: =IF(MOD(RC[-9],10)=2,3,"") ->  | K3420: 3
A3421: 163100 | B3421: 106290 | C3421: 106290 | D3421: 106291 | E3421: 106292 | F3421: 106291 | G3421: 106292 | J3421: =IF(MOD(RC[-9],10)=2,3,"") ->  | K3421: 3
A3422: 163101 | B3422: 106292 | C3422: 106290 | D3422: 106290 | E3422: 106290 | F3422: 106291 | G3422: 106292 | J3422: =IF(MOD(RC[-9],10)=2,3,"") ->  | K3422: 3
A3423: 163102 | B3423: 106294 | C3423: 106290 | D3423: 106291 | E3423: 106292 | F3423: 106293 | G3423: 106294 | I3423: 0.1 | J3423: =IF(MOD(RC[-9],10)=2,3,"") -> 3 | K3423: 3
A3424: 164010 | B3424: 106303 | C3424: 106300 | D3424: 106301 | E3424: 106302 | F3424: 106303 | G3424: 106303 | J3424: =IF(MOD(RC[-9],10)=2,3,"") ->  | K3424: 3
A3425: 164020 | B3425: 106312 | C3425: 106311 | D3425: 106312 | E3425: 106310 | F3425: 106311 | G3425: 106312 | J3425: =IF(MOD(RC[-9],10)=2,3,"") ->  | K3425: 3
A3426: 164030 | B3426: 106321 | C3426: 106320 | D3426: 106321 | E3426: 106322 | F3426: 106321 | G3426: 106322 | J3426: =IF(MOD(RC[-9],10)=2,3,"") ->  | K3426: 3
A3427: 164031 | B3427: 106323 | C3427: 106320 | D3427: 106321 | E3427: 106322 | F3427: 106323 | G3427: 106321 | J3427: =IF(MOD(RC[-9],10)=2,3,"") ->  | K3427: 3
A3428: 164040 | B3428: 106333 | C3428: 106330 | D3428: 106331 | E3428: 106332 | F3428: 106333 | G3428: 106333 | J3428: =IF(MOD(RC[-9],10)=2,3,"") ->  | K3428: 3
A3429: 164050 | B3429: 106342 | C3429: 106340 | D3429: 106341 | E3429: 106342 | F3429: 106343 | G3429: 106344 | J3429: =IF(MOD(RC[-9],10)=2,3,"") ->  | K3429: 3
A3430: 164060 | B3430: 106350 | C3430: 106350 | D3430: 106351 | E3430: 106352 | F3430: 106350 | G3430: 106351 | J3430: =IF(MOD(RC[-9],10)=2,3,"") ->  | K3430: 3
A3431: 164061 | B3431: 106353 | C3431: 106350 | D3431: 106351 | E3431: 106352 | F3431: 106353 | G3431: 106352 | J3431: =IF(MOD(RC[-9],10)=2,3,"") ->  | K3431: 3
A3432: 164070 | B3432: 106361 | C3432: 106360 | D3432: 106361 | E3432: 106362 | F3432: 106361 | G3432: 106362 | J3432: =IF(MOD(RC[-9],10)=2,3,"") ->  | K3432: 3
A3433: 164080 | B3433: 106371 | C3433: 106370 | D3433: 106371 | E3433: 106372 | F3433: 106371 | G3433: 106372 | J3433: =IF(MOD(RC[-9],10)=2,3,"") ->  | K3433: 3
A3434: 164090 | B3434: 106382 | C3434: 106380 | D3434: 106381 | E3434: 106382 | F3434: 106383 | G3434: 106382 | J3434: =IF(MOD(RC[-9],10)=2,3,"") ->  | K3434: 3
A3435: 164091 | B3435: 106384 | C3435: 106380 | D3435: 106381 | E3435: 106382 | F3435: 106383 | G3435: 106384 | J3435: =IF(MOD(RC[-9],10)=2,3,"") ->  | K3435: 3
A3436: 164100 | B3436: 106390 | C3436: 106390 | D3436: 106391 | E3436: 106392 | F3436: 106393 | G3436: 106393 | J3436: =IF(MOD(RC[-9],10)=2,3,"") ->  | K3436: 3
A3437: 164101 | B3437: 106392 | C3437: 106390 | D3437: 106390 | E3437: 106392 | F3437: 106392 | G3437: 106392 | J3437: =IF(MOD(RC[-9],10)=2,3,"") ->  | K3437: 3
A3438: 164102 | B3438: 106394 | C3438: 106390 | D3438: 106391 | E3438: 106392 | F3438: 106393 | G3438: 106394 | I3438: 0.1 | J3438: =IF(MOD(RC[-9],10)=2,3,"") -> 3 | K3438: 3
A3439: 165010 | B3439: 106400 | C3439: 106400 | D3439: 106401 | E3439: 106402 | F3439: 106403 | G3439: 106404 | J3439: =IF(MOD(RC[-9],10)=2,3,"") ->  | K3439: 3
A3440: 165020 | B3440: 106410 | C3440: 106410 | D3440: 106411 | E3440: 106410 | F3440: 106411 | G3440: 106410 | J3440: =IF(MOD(RC[-9],10)=2,3,"") ->  | K3440: 3
A3441: 165030 | B3441: 106420 | C3441: 106420 | D3441: 106421 | E3441: 106422 | F3441: 106423 | G3441: 106423 | J3441: =IF(MOD(RC[-9],10)=2,3,"") ->  | K3441: 3
A3442: 165031 | B3442: 106424 | C3442: 106420 | D3442: 106421 | E3442: 106422 | F3442: 106423 | G3442: 106424 | J3442: =IF(MOD(RC[-9],10)=2,3,"") ->  | K3442: 3
A3443: 165040 | B3443: 106430 | C3443: 106430 | D3443: 106431 | E3443: 106432 | F3443: 106430 | G3443: 106431 | J3443: =IF(MOD(RC[-9],10)=2,3,"") ->  | K3443: 3
A3444: 165050 | B3444: 106440 | C3444: 106440 | D3444: 106441 | E3444: 106440 | F3444: 106441 | G3444: 106441 | J3444: =IF(MOD(RC[-9],10)=2,3,"") ->  | K3444: 3
A3445: 165060 | B3445: 106452 | C3445: 106450 | D3445: 106451 | E3445: 106452 | F3445: 106450 | G3445: 106452 | J3445: =IF(MOD(RC[-9],10)=2,3,"") ->  | K3445: 3
A3446: 165061 | B3446: 106453 | C3446: 106450 | D3446: 106451 | E3446: 106452 | F3446: 106453 | G3446: 106452 | J3446: =IF(MOD(RC[-9],10)=2,3,"") ->  | K3446: 3
A3447: 165070 | B3447: 106460 | C3447: 106460 | D3447: 106461 | E3447: 106460 | F3447: 106461 | G3447: 106461 | J3447: =IF(MOD(RC[-9],10)=2,3,"") ->  | K3447: 3
A3448: 165080 | B3448: 106472 | C3448: 106470 | D3448: 106471 | E3448: 106472 | F3448: 106473 | G3448: 106474 | J3448: =IF(MOD(RC[-9],10)=2,3,"") ->  | K3448: 3
A3449: 165090 | B3449: 106483 | C3449: 106480 | D3449: 106481 | E3449: 106482 | F3449: 106483 | G3449: 106483 | J3449: =IF(MOD(RC[-9],10)=2,3,"") ->  | K3449: 3
A3450: 165091 | B3450: 106484 | C3450: 106480 | D3450: 106481 | E3450: 106482 | F3450: 106483 | G3450: 106484 | J3450: =IF(MOD(RC[-9],10)=2,3,"") ->  | K3450: 3
A3451: 165100 | B3451: 106494 | C3451: 106490 | D3451: 106491 | E3451: 106492 | F3451: 106493 | G3451: 106494 | J3451: =IF(MOD(RC[-9],10)=2,3,"") ->  | K3451: 3
A3452: 165101 | B3452: 106494 | C3452: 106490 | D3452: 106490 | E3452: 106490 | F3452: 106493 | G3452: 106494 | J3452: =IF(MOD(RC[-9],10)=2,3,"") ->  | K3452: 3
A3453: 165102 | B3453: 106495 | C3453: 106491 | D3453: 106492 | E3453: 106493 | F3453: 106494 | G3453: 106495 | I3453: 0.1 | J3453: =IF(MOD(RC[-9],10)=2,3,"") -> 3 | K3453: 3
A3454: 166010 | B3454: 106500 | C3454: 106500 | D3454: 106500 | E3454: 106500 | F3454: 106501 | G3454: 106501 | J3454: =IF(MOD(RC[-9],10)=2,3,"") ->  | K3454: 3
A3455: 166020 | B3455: 106511 | C3455: 106510 | D3455: 106510 | E3455: 106511 | F3455: 106511 | G3455: 106512 | J3455: =IF(MOD(RC[-9],10)=2,3,"") ->  | K3455: 3
A3456: 166030 | B3456: 106520 | C3456: 106520 | D3456: 106521 | E3456: 106522 | F3456: 106522 | G3456: 106523 | J3456: =IF(MOD(RC[-9],10)=2,3,"") ->  | K3456: 3
A3457: 166031 | B3457: 106524 | C3457: 106524 | D3457: 106520 | E3457: 106521 | F3457: 106522 | G3457: 106523 | J3457: =IF(MOD(RC[-9],10)=2,3,"") ->  | K3457: 3
A3458: 166040 | B3458: 106532 | C3458: 106530 | D3458: 106530 | E3458: 106531 | F3458: 106532 | G3458: 106532 | J3458: =IF(MOD(RC[-9],10)=2,3,"") ->  | K3458: 3
A3459: 166050 | B3459: 106541 | C3459: 106540 | D3459: 106541 | E3459: 106541 | F3459: 106542 | G3459: 106542 | J3459: =IF(MOD(RC[-9],10)=2,3,"") ->  | K3459: 3
A3460: 166060 | B3460: 106550 | C3460: 106550 | D3460: 106551 | E3460: 106552 | F3460: 106552 | G3460: 106553 | J3460: =IF(MOD(RC[-9],10)=2,3,"") ->  | K3460: 3
A3461: 166061 | B3461: 106554 | C3461: 106554 | D3461: 106550 | E3461: 106551 | F3461: 106552 | G3461: 106553 | J3461: =IF(MOD(RC[-9],10)=2,3,"") ->  | K3461: 3
A3462: 166070 | B3462: 106560 | C3462: 106560 | D3462: 106560 | E3462: 106561 | F3462: 106561 | G3462: 106562 | J3462: =IF(MOD(RC[-9],10)=2,3,"") ->  | K3462: 3
A3463: 166080 | B3463: 106570 | C3463: 106570 | D3463: 106570 | E3463: 106570 | F3463: 106571 | G3463: 106571 | J3463: =IF(MOD(RC[-9],10)=2,3,"") ->  | K3463: 3
A3464: 166090 | B3464: 106580 | C3464: 106580 | D3464: 106581 | E3464: 106582 | F3464: 106582 | G3464: 106583 | J3464: =IF(MOD(RC[-9],10)=2,3,"") ->  | K3464: 3
A3465: 166091 | B3465: 106584 | C3465: 106584 | D3465: 106580 | E3465: 106581 | F3465: 106582 | G3465: 106583 | J3465: =IF(MOD(RC[-9],10)=2,3,"") ->  | K3465: 3
A3466: 166100 | B3466: 106590 | C3466: 106590 | D3466: 0 | E3466: 0 | F3466: 0 | G3466: 0 | I3466: 0.1 | J3466: 3 | K3466: 3
A3467: 167010 | B3467: 106600 | C3467: 106600 | D3467: 106600 | E3467: 106600 | F3467: 106601 | G3467: 106601 | J3467: =IF(MOD(RC[-9],10)=2,3,"") ->  | K3467: 3
A3468: 167020 | B3468: 106610 | C3468: 106610 | D3468: 106610 | E3468: 106611 | F3468: 106612 | G3468: 106612 | J3468: =IF(MOD(RC[-9],10)=2,3,"") ->  | K3468: 3
A3469: 167030 | B3469: 106620 | C3469: 106620 | D3469: 106620 | E3469: 106621 | F3469: 106621 | G3469: 106622 | J3469: =IF(MOD(RC[-9],10)=2,3,"") ->  | K3469: 3
A3470: 167031 | B3470: 106623 | C3470: 106623 | D3470: 106620 | E3470: 106621 | F3470: 106622 | G3470: 106622 | J3470: =IF(MOD(RC[-9],10)=2,3,"") ->  | K3470: 3
A3471: 167040 | B3471: 106630 | C3471: 106630 | D3471: 106630 | E3471: 106630 | F3471: 106631 | G3471: 106631 | J3471: =IF(MOD(RC[-9],10)=2,3,"") ->  | K3471: 3
A3472: 167050 | B3472: 106640 | C3472: 106640 | D3472: 106640 | E3472: 106641 | F3472: 106642 | G3472: 106643 | J3472: =IF(MOD(RC[-9],10)=2,3,"") ->  | K3472: 3
A3473: 167060 | B3473: 106650 | C3473: 106650 | D3473: 106650 | E3473: 106651 | F3473: 106651 | G3473: 106652 | J3473: =IF(MOD(RC[-9],10)=2,3,"") ->  | K3473: 3
A3474: 167061 | B3474: 106653 | C3474: 106653 | D3474: 106650 | E3474: 106651 | F3474: 106652 | G3474: 106652 | J3474: =IF(MOD(RC[-9],10)=2,3,"") ->  | K3474: 3
A3475: 167070 | B3475: 106661 | C3475: 106660 | D3475: 106660 | E3475: 106661 | F3475: 106661 | G3475: 106661 | J3475: =IF(MOD(RC[-9],10)=2,3,"") ->  | K3475: 3
A3476: 167080 | B3476: 106671 | C3476: 106670 | D3476: 106671 | E3476: 106671 | F3476: 106672 | G3476: 106672 | J3476: =IF(MOD(RC[-9],10)=2,3,"") ->  | K3476: 3
A3477: 167090 | B3477: 106680 | C3477: 106680 | D3477: 106680 | E3477: 106681 | F3477: 106681 | G3477: 106682 | J3477: =IF(MOD(RC[-9],10)=2,3,"") ->  | K3477: 3
A3478: 167091 | B3478: 106683 | C3478: 106683 | D3478: 106680 | E3478: 106681 | F3478: 106682 | G3478: 106682 | J3478: =IF(MOD(RC[-9],10)=2,3,"") ->  | K3478: 3
A3479: 167100 | B3479: 106690 | C3479: 106690 | D3479: 106690 | E3479: 106691 | F3479: 106692 | G3479: 0 | J3479: =IF(MOD(RC[-9],10)=2,3,"") ->  | K3479: 3
A3480: 167101 | B3480: 106690 | C3480: 106690 | D3480: 106690 | E3480: 106691 | F3480: 106692 | G3480: 0 | J3480: =IF(MOD(RC[-9],10)=2,3,"") ->  | K3480: 3
A3481: 167102 | B3481: 106694 | C3481: 106694 | D3481: 106693 | E3481: 106690 | F3481: 106691 | G3481: 0 | I3481: 0.1 | J3481: =IF(MOD(RC[-9],10)=2,3,"") -> 3 | K3481: 3
A3482: 168010 | B3482: 106700 | C3482: 106700 | D3482: 106700 | E3482: 106700 | F3482: 106701 | G3482: 106701 | J3482: =IF(MOD(RC[-9],10)=2,3,"") ->  | K3482: 3
A3483: 168020 | B3483: 106710 | C3483: 106710 | D3483: 106710 | E3483: 106711 | F3483: 106712 | G3483: 106712 | J3483: =IF(MOD(RC[-9],10)=2,3,"") ->  | K3483: 3
A3484: 168030 | B3484: 106720 | C3484: 106720 | D3484: 106720 | E3484: 106721 | F3484: 106721 | G3484: 106722 | J3484: =IF(MOD(RC[-9],10)=2,3,"") ->  | K3484: 3
A3485: 168031 | B3485: 106723 | C3485: 106723 | D3485: 106720 | E3485: 106720 | F3485: 106721 | G3485: 106722 | J3485: =IF(MOD(RC[-9],10)=2,3,"") ->  | K3485: 3
A3486: 168040 | B3486: 106730 | C3486: 106730 | D3486: 106730 | E3486: 106730 | F3486: 106731 | G3486: 106732 | J3486: =IF(MOD(RC[-9],10)=2,3,"") ->  | K3486: 3
A3487: 168050 | B3487: 106740 | C3487: 106740 | D3487: 106740 | E3487: 106740 | F3487: 106741 | G3487: 106741 | J3487: =IF(MOD(RC[-9],10)=2,3,"") ->  | K3487: 3
A3488: 168060 | B3488: 106750 | C3488: 106750 | D3488: 106750 | E3488: 106750 | F3488: 106751 | G3488: 106751 | J3488: =IF(MOD(RC[-9],10)=2,3,"") ->  | K3488: 3
A3489: 168061 | B3489: 106752 | C3489: 106752 | D3489: 106750 | E3489: 106750 | F3489: 106751 | G3489: 106751 | J3489: =IF(MOD(RC[-9],10)=2,3,"") ->  | K3489: 3
A3490: 168070 | B3490: 106761 | C3490: 106760 | D3490: 106761 | E3490: 106761 | F3490: 106762 | G3490: 106763 | J3490: =IF(MOD(RC[-9],10)=2,3,"") ->  | K3490: 3
A3491: 168080 | B3491: 106773 | C3491: 106770 | D3491: 106770 | E3491: 106771 | F3491: 106772 | G3491: 106773 | J3491: =IF(MOD(RC[-9],10)=2,3,"") ->  | K3491: 3
A3492: 168090 | B3492: 106780 | C3492: 106780 | D3492: 106781 | E3492: 106782 | F3492: 106782 | G3492: 106783 | J3492: =IF(MOD(RC[-9],10)=2,3,"") ->  | K3492: 3
A3493: 168091 | B3493: 106784 | C3493: 106784 | D3493: 106780 | E3493: 106781 | F3493: 106782 | G3493: 106783 | J3493: =IF(MOD(RC[-9],10)=2,3,"") ->  | K3493: 3
A3494: 168100 | B3494: 106790 | C3494: 106790 | D3494: 106791 | E3494: 106792 | F3494: 106793 | G3494: 0 | J3494: =IF(MOD(RC[-9],10)=2,3,"") ->  | K3494: 3
A3495: 168101 | B3495: 106790 | C3495: 106790 | D3495: 106791 | E3495: 106792 | F3495: 106793 | G3495: 0 | J3495: =IF(MOD(RC[-9],10)=2,3,"") ->  | K3495: 3
A3496: 168102 | B3496: 106794 | C3496: 106794 | D3496: 0 | E3496: 0 | F3496: 0 | G3496: 0 | I3496: 0.1 | J3496: =IF(MOD(RC[-9],10)=2,3,"") -> 3 | K3496: 3
A3497: 169010 | B3497: 106800 | C3497: 106800 | D3497: 106800 | E3497: 106801 | F3497: 106802 | G3497: 106802 | J3497: =IF(MOD(RC[-9],10)=2,3,"") ->  | K3497: 3
A3498: 169020 | B3498: 106811 | C3498: 106810 | D3498: 106811 | E3498: 106811 | F3498: 106812 | G3498: 106813 | J3498: =IF(MOD(RC[-9],10)=2,3,"") ->  | K3498: 3
A3499: 169030 | B3499: 106820 | C3499: 106820 | D3499: 106821 | E3499: 106822 | F3499: 106823 | G3499: 106823 | J3499: =IF(MOD(RC[-9],10)=2,3,"") ->  | K3499: 3
A3500: 169031 | B3500: 106824 | C3500: 106824 | D3500: 106820 | E3500: 106821 | F3500: 106822 | G3500: 106823 | J3500: =IF(MOD(RC[-9],10)=2,3,"") ->  | K3500: 3
A3501: 169040 | B3501: 106830 | C3501: 106830 | D3501: 106830 | E3501: 106830 | F3501: 106831 | G3501: 106831 | J3501: =IF(MOD(RC[-9],10)=2,3,"") ->  | K3501: 3
A3502: 169050 | B3502: 106840 | C3502: 106840 | D3502: 106840 | E3502: 106841 | F3502: 106841 | G3502: 106842 | J3502: =IF(MOD(RC[-9],10)=2,3,"") ->  | K3502: 3
A3503: 169060 | B3503: 106850 | C3503: 106850 | D3503: 106851 | E3503: 106852 | F3503: 106852 | G3503: 106853 | J3503: =IF(MOD(RC[-9],10)=2,3,"") ->  | K3503: 3
A3504: 169061 | B3504: 106854 | C3504: 106854 | D3504: 106850 | E3504: 106851 | F3504: 106852 | G3504: 106853 | J3504: =IF(MOD(RC[-9],10)=2,3,"") ->  | K3504: 3
A3505: 169070 | B3505: 106861 | C3505: 106860 | D3505: 106861 | E3505: 106861 | F3505: 106862 | G3505: 106862 | J3505: =IF(MOD(RC[-9],10)=2,3,"") ->  | K3505: 3
A3506: 169080 | B3506: 106870 | C3506: 106870 | D3506: 106870 | E3506: 106871 | F3506: 106872 | G3506: 106872 | J3506: =IF(MOD(RC[-9],10)=2,3,"") ->  | K3506: 3
A3507: 169090 | B3507: 106880 | C3507: 106880 | D3507: 106881 | E3507: 106882 | F3507: 106882 | G3507: 106883 | J3507: =IF(MOD(RC[-9],10)=2,3,"") ->  | K3507: 3
A3508: 169091 | B3508: 106884 | C3508: 106884 | D3508: 106880 | E3508: 106881 | F3508: 106882 | G3508: 106883 | J3508: =IF(MOD(RC[-9],10)=2,3,"") ->  | K3508: 3
A3509: 169100 | B3509: 106890 | C3509: 106890 | D3509: 106891 | E3509: 106892 | F3509: 106893 | G3509: 0 | J3509: =IF(MOD(RC[-9],10)=2,3,"") ->  | K3509: 3
A3510: 169101 | B3510: 106891 | C3510: 106890 | D3510: 106891 | E3510: 106892 | F3510: 106893 | G3510: 0 | J3510: =IF(MOD(RC[-9],10)=2,3,"") ->  | K3510: 3
A3511: 169102 | B3511: 106895 | C3511: 106895 | D3511: 106894 | E3511: 106890 | F3511: 106892 | G3511: 0 | I3511: 0.1 | J3511: =IF(MOD(RC[-9],10)=2,3,"") -> 3 | K3511: 3
A3512: 170010 | B3512: 106900 | C3512: 106900 | D3512: 106900 | E3512: 106901 | F3512: 106902 | G3512: 106902 | J3512: =IF(MOD(RC[-9],10)=2,3,"") ->  | K3512: 3
A3513: 170020 | B3513: 106910 | C3513: 106910 | D3513: 106910 | E3513: 106910 | F3513: 106911 | G3513: 106912 | J3513: =IF(MOD(RC[-9],10)=2,3,"") ->  | K3513: 3
A3514: 170030 | B3514: 106920 | C3514: 106920 | D3514: 106921 | E3514: 106921 | F3514: 106922 | G3514: 106923 | J3514: =IF(MOD(RC[-9],10)=2,3,"") ->  | K3514: 3
A3515: 170031 | B3515: 106924 | C3515: 106924 | D3515: 106920 | E3515: 106921 | F3515: 106922 | G3515: 106923 | J3515: =IF(MOD(RC[-9],10)=2,3,"") ->  | K3515: 3
A3516: 170040 | B3516: 106930 | C3516: 106930 | D3516: 106930 | E3516: 106931 | F3516: 106932 | G3516: 106933 | J3516: =IF(MOD(RC[-9],10)=2,3,"") ->  | K3516: 3
A3517: 170050 | B3517: 106941 | C3517: 106940 | D3517: 106940 | E3517: 106941 | F3517: 106941 | G3517: 106942 | J3517: =IF(MOD(RC[-9],10)=2,3,"") ->  | K3517: 3
A3518: 170060 | B3518: 106950 | C3518: 106950 | D3518: 106950 | E3518: 106951 | F3518: 106951 | G3518: 106952 | J3518: =IF(MOD(RC[-9],10)=2,3,"") ->  | K3518: 3
A3519: 170061 | B3519: 106953 | C3519: 106953 | D3519: 106950 | E3519: 106950 | F3519: 106951 | G3519: 106952 | J3519: =IF(MOD(RC[-9],10)=2,3,"") ->  | K3519: 3
A3520: 170070 | B3520: 106961 | C3520: 106960 | D3520: 106961 | E3520: 106961 | F3520: 106962 | G3520: 106963 | J3520: =IF(MOD(RC[-9],10)=2,3,"") ->  | K3520: 3
A3521: 170080 | B3521: 106972 | C3521: 106970 | D3521: 106971 | E3521: 106972 | F3521: 106972 | G3521: 106973 | J3521: =IF(MOD(RC[-9],10)=2,3,"") ->  | K3521: 3
A3522: 170090 | B3522: 106981 | C3522: 106980 | D3522: 106980 | E3522: 106981 | F3522: 106981 | G3522: 106982 | J3522: =IF(MOD(RC[-9],10)=2,3,"") ->  | K3522: 3
A3523: 170091 | B3523: 106983 | C3523: 106983 | D3523: 106980 | E3523: 106981 | F3523: 106982 | G3523: 106982 | J3523: =IF(MOD(RC[-9],10)=2,3,"") ->  | K3523: 3
A3524: 170100 | B3524: 106990 | C3524: 106990 | D3524: 106990 | E3524: 106991 | F3524: 106992 | G3524: 0 | J3524: =IF(MOD(RC[-9],10)=2,3,"") ->  | K3524: 3
A3525: 170101 | B3525: 106992 | C3525: 106990 | D3525: 106990 | E3525: 106991 | F3525: 106992 | G3525: 0 | J3525: =IF(MOD(RC[-9],10)=2,3,"") ->  | K3525: 3
A3526: 170102 | B3526: 106994 | C3526: 106994 | D3526: 106993 | E3526: 106990 | F3526: 106991 | G3526: 0 | I3526: 0.1 | J3526: =IF(MOD(RC[-9],10)=2,3,"") -> 3 | K3526: 3
A3527: 171010 | B3527: 107000 | C3527: 107000 | D3527: 107000 | E3527: 107000 | F3527: 107001 | G3527: 107002 | J3527: =IF(MOD(RC[-9],10)=2,3,"") ->  | K3527: 3
A3528: 171020 | B3528: 107010 | C3528: 107010 | D3528: 107010 | E3528: 107011 | F3528: 107012 | G3528: 107012 | J3528: =IF(MOD(RC[-9],10)=2,3,"") ->  | K3528: 3
A3529: 171030 | B3529: 107020 | C3529: 107020 | D3529: 107020 | E3529: 107020 | F3529: 107021 | G3529: 107022 | J3529: =IF(MOD(RC[-9],10)=2,3,"") ->  | K3529: 3
A3530: 171031 | B3530: 107023 | C3530: 107023 | D3530: 107020 | E3530: 107021 | F3530: 107022 | G3530: 107022 | J3530: =IF(MOD(RC[-9],10)=2,3,"") ->  | K3530: 3
A3531: 171040 | B3531: 107030 | C3531: 107030 | D3531: 107030 | E3531: 107031 | F3531: 107032 | G3531: 107032 | J3531: =IF(MOD(RC[-9],10)=2,3,"") ->  | K3531: 3
A3532: 171050 | B3532: 107040 | C3532: 107040 | D3532: 107040 | E3532: 107041 | F3532: 107042 | G3532: 107042 | J3532: =IF(MOD(RC[-9],10)=2,3,"") ->  | K3532: 3
A3533: 171060 | B3533: 107050 | C3533: 107050 | D3533: 107050 | E3533: 107051 | F3533: 107051 | G3533: 107052 | J3533: =IF(MOD(RC[-9],10)=2,3,"") ->  | K3533: 3
A3534: 171061 | B3534: 107053 | C3534: 107053 | D3534: 107050 | E3534: 107051 | F3534: 107052 | G3534: 107052 | J3534: =IF(MOD(RC[-9],10)=2,3,"") ->  | K3534: 3
A3535: 171070 | B3535: 107060 | C3535: 107060 | D3535: 107060 | E3535: 107060 | F3535: 107061 | G3535: 107061 | J3535: =IF(MOD(RC[-9],10)=2,3,"") ->  | K3535: 3
A3536: 171080 | B3536: 107071 | C3536: 107070 | D3536: 107070 | E3536: 107071 | F3536: 107071 | G3536: 107072 | J3536: =IF(MOD(RC[-9],10)=2,3,"") ->  | K3536: 3
A3537: 171090 | B3537: 107080 | C3537: 107080 | D3537: 107080 | E3537: 107081 | F3537: 107081 | G3537: 107082 | J3537: =IF(MOD(RC[-9],10)=2,3,"") ->  | K3537: 3
A3538: 171091 | B3538: 107083 | C3538: 107083 | D3538: 107080 | E3538: 107080 | F3538: 107081 | G3538: 107082 | J3538: =IF(MOD(RC[-9],10)=2,3,"") ->  | K3538: 3
A3539: 171100 | B3539: 107090 | C3539: 107090 | D3539: 107091 | E3539: 107092 | F3539: 107094 | G3539: 0 | J3539: =IF(MOD(RC[-9],10)=2,3,"") ->  | K3539: 3
A3540: 171101 | B3540: 107090 | C3540: 107090 | D3540: 107091 | E3540: 107093 | F3540: 107094 | G3540: 0 | J3540: =IF(MOD(RC[-9],10)=2,3,"") ->  | K3540: 3
A3541: 171102 | B3541: 107095 | C3541: 107095 | D3541: 107090 | E3541: 107091 | F3541: 107094 | G3541: 0 | I3541: 0.1 | J3541: =IF(MOD(RC[-9],10)=2,3,"") -> 3 | K3541: 3
A3542: 172010 | B3542: 107101 | C3542: 107100 | D3542: 107100 | E3542: 107101 | F3542: 107101 | G3542: 107102 | J3542: =IF(MOD(RC[-9],10)=2,3,"") ->  | K3542: 3
A3543: 172020 | B3543: 107110 | C3543: 107110 | D3543: 107110 | E3543: 107110 | F3543: 107111 | G3543: 107111 | J3543: =IF(MOD(RC[-9],10)=2,3,"") ->  | K3543: 3
A3544: 172030 | B3544: 107120 | C3544: 107120 | D3544: 107121 | E3544: 107122 | F3544: 107123 | G3544: 107123 | J3544: =IF(MOD(RC[-9],10)=2,3,"") ->  | K3544: 3
A3545: 172031 | B3545: 107124 | C3545: 107124 | D3545: 107120 | E3545: 107121 | F3545: 107122 | G3545: 107123 | J3545: =IF(MOD(RC[-9],10)=2,3,"") ->  | K3545: 3
A3546: 172040 | B3546: 107131 | C3546: 107130 | D3546: 107131 | E3546: 107131 | F3546: 107132 | G3546: 107132 | J3546: =IF(MOD(RC[-9],10)=2,3,"") ->  | K3546: 3
A3547: 172050 | B3547: 107140 | C3547: 107140 | D3547: 107140 | E3547: 107140 | F3547: 107141 | G3547: 107141 | J3547: =IF(MOD(RC[-9],10)=2,3,"") ->  | K3547: 3
A3548: 172060 | B3548: 107150 | C3548: 107150 | D3548: 107151 | E3548: 107151 | F3548: 107152 | G3548: 107153 | J3548: =IF(MOD(RC[-9],10)=2,3,"") ->  | K3548: 3
A3549: 172061 | B3549: 107154 | C3549: 107154 | D3549: 107150 | E3549: 107151 | F3549: 107152 | G3549: 107153 | J3549: =IF(MOD(RC[-9],10)=2,3,"") ->  | K3549: 3
A3550: 172070 | B3550: 107161 | C3550: 107160 | D3550: 107160 | E3550: 107161 | F3550: 107161 | G3550: 107161 | J3550: =IF(MOD(RC[-9],10)=2,3,"") ->  | K3550: 3
A3551: 172080 | B3551: 107170 | C3551: 107170 | D3551: 107170 | E3551: 107171 | F3551: 107172 | G3551: 107173 | J3551: =IF(MOD(RC[-9],10)=2,3,"") ->  | K3551: 3
A3552: 172090 | B3552: 107180 | C3552: 107180 | D3552: 107181 | E3552: 107182 | F3552: 107183 | G3552: 107183 | J3552: =IF(MOD(RC[-9],10)=2,3,"") ->  | K3552: 3
A3553: 172091 | B3553: 107184 | C3553: 107184 | D3553: 107180 | E3553: 107181 | F3553: 107182 | G3553: 107183 | J3553: =IF(MOD(RC[-9],10)=2,3,"") ->  | K3553: 3
A3554: 172100 | B3554: 107190 | C3554: 107190 | D3554: 0 | E3554: 0 | F3554: 0 | G3554: 0 | I3554: 0.1 | J3554: 3 | K3554: 3
A3555: 173010 | B3555: 107201 | C3555: 107200 | D3555: 107201 | E3555: 107201 | F3555: 107202 | G3555: 107202 | J3555: =IF(MOD(RC[-9],10)=2,3,"") ->  | K3555: 3
A3556: 173020 | B3556: 107210 | C3556: 107210 | D3556: 107210 | E3556: 107210 | F3556: 107211 | G3556: 107212 | J3556: =IF(MOD(RC[-9],10)=2,3,"") ->  | K3556: 3
A3557: 173030 | B3557: 107221 | C3557: 107220 | D3557: 107220 | E3557: 107221 | F3557: 107221 | G3557: 107222 | J3557: =IF(MOD(RC[-9],10)=2,3,"") ->  | K3557: 3
A3558: 173031 | B3558: 107223 | C3558: 107223 | D3558: 107220 | E3558: 107221 | F3558: 107222 | G3558: 107222 | J3558: =IF(MOD(RC[-9],10)=2,3,"") ->  | K3558: 3
A3559: 173040 | B3559: 107230 | C3559: 107230 | D3559: 107230 | E3559: 107230 | F3559: 107231 | G3559: 107231 | J3559: =IF(MOD(RC[-9],10)=2,3,"") ->  | K3559: 3
A3560: 173050 | B3560: 107240 | C3560: 107240 | D3560: 107240 | E3560: 107241 | F3560: 107242 | G3560: 107243 | J3560: =IF(MOD(RC[-9],10)=2,3,"") ->  | K3560: 3
A3561: 173060 | B3561: 107250 | C3561: 107250 | D3561: 107251 | E3561: 107252 | F3561: 107253 | G3561: 107253 | J3561: =IF(MOD(RC[-9],10)=2,3,"") ->  | K3561: 3
A3562: 173061 | B3562: 107254 | C3562: 107254 | D3562: 107250 | E3562: 107251 | F3562: 107252 | G3562: 107253 | J3562: =IF(MOD(RC[-9],10)=2,3,"") ->  | K3562: 3
A3563: 173070 | B3563: 107261 | C3563: 107260 | D3563: 107261 | E3563: 107261 | F3563: 107262 | G3563: 107262 | J3563: =IF(MOD(RC[-9],10)=2,3,"") ->  | K3563: 3
A3564: 173080 | B3564: 107270 | C3564: 107270 | D3564: 107270 | E3564: 107271 | F3564: 107272 | G3564: 107272 | J3564: =IF(MOD(RC[-9],10)=2,3,"") ->  | K3564: 3
A3565: 173090 | B3565: 107280 | C3565: 107280 | D3565: 107280 | E3565: 107281 | F3565: 107281 | G3565: 107282 | J3565: =IF(MOD(RC[-9],10)=2,3,"") ->  | K3565: 3
A3566: 173091 | B3566: 107283 | C3566: 107283 | D3566: 107280 | E3566: 107281 | F3566: 107281 | G3566: 107282 | J3566: =IF(MOD(RC[-9],10)=2,3,"") ->  | K3566: 3
A3567: 173100 | B3567: 107290 | C3567: 107290 | D3567: 107291 | E3567: 107292 | F3567: 107293 | G3567: 0 | J3567: =IF(MOD(RC[-9],10)=2,3,"") ->  | K3567: 3
A3568: 173101 | B3568: 107290 | C3568: 107290 | D3568: 107291 | E3568: 107292 | F3568: 107293 | G3568: 0 | J3568: =IF(MOD(RC[-9],10)=2,3,"") ->  | K3568: 3
A3569: 173102 | B3569: 107294 | C3569: 107294 | D3569: 107290 | E3569: 107291 | F3569: 107292 | G3569: 0 | I3569: 0.1 | J3569: =IF(MOD(RC[-9],10)=2,3,"") -> 3 | K3569: 3
A3570: 174010 | B3570: 107300 | C3570: 107300 | D3570: 107300 | E3570: 107301 | F3570: 107302 | G3570: 107303 | J3570: =IF(MOD(RC[-9],10)=2,3,"") ->  | K3570: 3
A3571: 174020 | B3571: 107310 | C3571: 107310 | D3571: 107310 | E3571: 107310 | F3571: 107311 | G3571: 107311 | J3571: =IF(MOD(RC[-9],10)=2,3,"") ->  | K3571: 3
A3572: 174030 | B3572: 107320 | C3572: 107320 | D3572: 107321 | E3572: 107322 | F3572: 107323 | G3572: 107323 | J3572: =IF(MOD(RC[-9],10)=2,3,"") ->  | K3572: 3
A3573: 174031 | B3573: 107324 | C3573: 107324 | D3573: 107320 | E3573: 107321 | F3573: 107322 | G3573: 107323 | J3573: =IF(MOD(RC[-9],10)=2,3,"") ->  | K3573: 3
A3574: 174040 | B3574: 107330 | C3574: 107330 | D3574: 107330 | E3574: 107331 | F3574: 107332 | G3574: 107332 | J3574: =IF(MOD(RC[-9],10)=2,3,"") ->  | K3574: 3
A3575: 174050 | B3575: 107340 | C3575: 107340 | D3575: 107340 | E3575: 107340 | F3575: 107341 | G3575: 107342 | J3575: =IF(MOD(RC[-9],10)=2,3,"") ->  | K3575: 3
A3576: 174060 | B3576: 107350 | C3576: 107350 | D3576: 107351 | E3576: 107352 | F3576: 107353 | G3576: 107353 | J3576: =IF(MOD(RC[-9],10)=2,3,"") ->  | K3576: 3
A3577: 174061 | B3577: 107354 | C3577: 107354 | D3577: 107350 | E3577: 107351 | F3577: 107352 | G3577: 107353 | J3577: =IF(MOD(RC[-9],10)=2,3,"") ->  | K3577: 3
A3578: 174070 | B3578: 107360 | C3578: 107360 | D3578: 107360 | E3578: 107360 | F3578: 107361 | G3578: 107362 | J3578: =IF(MOD(RC[-9],10)=2,3,"") ->  | K3578: 3
A3579: 174080 | B3579: 107371 | C3579: 107370 | D3579: 107371 | E3579: 107371 | F3579: 107372 | G3579: 107372 | J3579: =IF(MOD(RC[-9],10)=2,3,"") ->  | K3579: 3
A3580: 174090 | B3580: 107381 | C3580: 107380 | D3580: 107381 | E3580: 107382 | F3580: 107383 | G3580: 107383 | J3580: =IF(MOD(RC[-9],10)=2,3,"") ->  | K3580: 3
A3581: 174091 | B3581: 107384 | C3581: 107384 | D3581: 107380 | E3581: 107381 | F3581: 107382 | G3581: 107383 | J3581: =IF(MOD(RC[-9],10)=2,3,"") ->  | K3581: 3
A3582: 174100 | B3582: 107390 | C3582: 107390 | D3582: 107390 | E3582: 107391 | F3582: 107392 | G3582: 0 | J3582: =IF(MOD(RC[-9],10)=2,3,"") ->  | K3582: 3
A3583: 174101 | B3583: 107390 | C3583: 107390 | D3583: 107391 | E3583: 107391 | F3583: 107392 | G3583: 0 | J3583: =IF(MOD(RC[-9],10)=2,3,"") ->  | K3583: 3
A3584: 174102 | B3584: 107394 | C3584: 107394 | D3584: 107393 | E3584: 107390 | F3584: 107391 | G3584: 0 | I3584: 0.1 | J3584: =IF(MOD(RC[-9],10)=2,3,"") -> 3 | K3584: 3
A3585: 175010 | B3585: 107400 | C3585: 107400 | D3585: 107400 | E3585: 107401 | F3585: 107402 | G3585: 107403 | J3585: =IF(MOD(RC[-9],10)=2,3,"") ->  | K3585: 3
A3586: 175020 | B3586: 107410 | C3586: 107410 | D3586: 107410 | E3586: 107411 | F3586: 107412 | G3586: 107413 | J3586: =IF(MOD(RC[-9],10)=2,3,"") ->  | K3586: 3
A3587: 175030 | B3587: 107423 | C3587: 107420 | D3587: 107421 | E3587: 107422 | F3587: 107423 | G3587: 107423 | J3587: =IF(MOD(RC[-9],10)=2,3,"") ->  | K3587: 3
A3588: 175031 | B3588: 107424 | C3588: 107421 | D3588: 107422 | E3588: 107423 | F3588: 107424 | G3588: 107423 | J3588: =IF(MOD(RC[-9],10)=2,3,"") ->  | K3588: 3
A3589: 175040 | B3589: 107431 | C3589: 107430 | D3589: 107430 | E3589: 107431 | F3589: 107431 | G3589: 107432 | J3589: =IF(MOD(RC[-9],10)=2,3,"") ->  | K3589: 3
A3590: 175050 | B3590: 107440 | C3590: 107440 | D3590: 107440 | E3590: 107440 | F3590: 107441 | G3590: 107441 | J3590: =IF(MOD(RC[-9],10)=2,3,"") ->  | K3590: 3
A3591: 175060 | B3591: 107452 | C3591: 107450 | D3591: 107451 | E3591: 107452 | F3591: 107453 | G3591: 107453 | J3591: =IF(MOD(RC[-9],10)=2,3,"") ->  | K3591: 3
A3592: 175061 | B3592: 107454 | C3592: 107450 | D3592: 107451 | E3592: 107453 | F3592: 107451 | G3592: 107454 | J3592: =IF(MOD(RC[-9],10)=2,3,"") ->  | K3592: 3
A3593: 175070 | B3593: 107460 | C3593: 107460 | D3593: 107460 | E3593: 107460 | F3593: 107461 | G3593: 107462 | J3593: =IF(MOD(RC[-9],10)=2,3,"") ->  | K3593: 3
A3594: 175080 | B3594: 107471 | C3594: 107470 | D3594: 107471 | E3594: 107471 | F3594: 107472 | G3594: 107473 | J3594: =IF(MOD(RC[-9],10)=2,3,"") ->  | K3594: 3
A3595: 175090 | B3595: 107483 | C3595: 107480 | D3595: 107481 | E3595: 107482 | F3595: 107483 | G3595: 107480 | J3595: =IF(MOD(RC[-9],10)=2,3,"") ->  | K3595: 3
A3596: 175091 | B3596: 107484 | C3596: 107480 | D3596: 107481 | E3596: 107483 | F3596: 107484 | G3596: 107483 | J3596: =IF(MOD(RC[-9],10)=2,3,"") ->  | K3596: 3
A3597: 175100 | B3597: 107490 | C3597: 107490 | D3597: 107491 | E3597: 107492 | F3597: 107493 | G3597: 0 | J3597: =IF(MOD(RC[-9],10)=2,3,"") ->  | K3597: 3
A3598: 175101 | B3598: 107491 | C3598: 107491 | D3598: 107492 | E3598: 107493 | F3598: 107494 | G3598: 0 | J3598: =IF(MOD(RC[-9],10)=2,3,"") ->  | K3598: 3
A3599: 175102 | B3599: 107496 | C3599: 107491 | D3599: 107494 | E3599: 107495 | F3599: 107496 | G3599: 0 | I3599: 0.1 | J3599: =IF(MOD(RC[-9],10)=2,3,"") -> 3 | K3599: 3
A3600: 176010 | B3600: 107500 | C3600: 107500 | D3600: 107501 | E3600: 107502 | F3600: 107503 | G3600: 107504 | J3600: =IF(MOD(RC[-9],10)=2,3,"") ->  | K3600: 3
A3601: 176020 | B3601: 107511 | C3601: 107511 | D3601: 107511 | E3601: 107512 | F3601: 107512 | G3601: 107514 | J3601: =IF(MOD(RC[-9],10)=2,3,"") ->  | K3601: 3
A3602: 176030 | B3602: 107524 | C3602: 107520 | D3602: 107521 | E3602: 107522 | F3602: 107523 | G3602: 107523 | J3602: =IF(MOD(RC[-9],10)=2,3,"") ->  | K3602: 3
A3603: 176031 | B3603: 107525 | C3603: 107521 | D3603: 107522 | E3603: 107523 | F3603: 107525 | G3603: 107524 | J3603: =IF(MOD(RC[-9],10)=2,3,"") ->  | K3603: 3
A3604: 176040 | B3604: 107531 | C3604: 107531 | D3604: 107531 | E3604: 107531 | F3604: 107532 | G3604: 107532 | J3604: =IF(MOD(RC[-9],10)=2,3,"") ->  | K3604: 3
A3605: 176050 | B3605: 107543 | C3605: 107540 | D3605: 107540 | E3605: 107543 | F3605: 107543 | G3605: 107544 | J3605: =IF(MOD(RC[-9],10)=2,3,"") ->  | K3605: 3
A3606: 176060 | B3606: 107550 | C3606: 107550 | D3606: 107550 | E3606: 107551 | F3606: 107553 | G3606: 107554 | J3606: =IF(MOD(RC[-9],10)=2,3,"") ->  | K3606: 3
A3607: 176061 | B3607: 107555 | C3607: 107551 | D3607: 107552 | E3607: 107553 | F3607: 107555 | G3607: 107554 | J3607: =IF(MOD(RC[-9],10)=2,3,"") ->  | K3607: 3
A3608: 176070 | B3608: 107562 | C3608: 107561 | D3608: 107561 | E3608: 107562 | F3608: 107562 | G3608: 107564 | J3608: =IF(MOD(RC[-9],10)=2,3,"") ->  | K3608: 3
A3609: 176080 | B3609: 107570 | C3609: 107570 | D3609: 107570 | E3609: 107570 | F3609: 107573 | G3609: 107574 | J3609: =IF(MOD(RC[-9],10)=2,3,"") ->  | K3609: 3
A3610: 176090 | B3610: 107584 | C3610: 107580 | D3610: 107581 | E3610: 107582 | F3610: 107583 | G3610: 107583 | J3610: =IF(MOD(RC[-9],10)=2,3,"") ->  | K3610: 3
A3611: 176091 | B3611: 107585 | C3611: 107581 | D3611: 107582 | E3611: 107583 | F3611: 107585 | G3611: 107584 | J3611: =IF(MOD(RC[-9],10)=2,3,"") ->  | K3611: 3
A3612: 176100 | B3612: 107590 | C3612: 107590 | D3612: 107590 | E3612: 107592 | F3612: 107594 | G3612: 0 | J3612: =IF(MOD(RC[-9],10)=2,3,"") ->  | K3612: 3
A3613: 176101 | B3613: 107591 | C3613: 107591 | D3613: 107591 | E3613: 107592 | F3613: 107593 | G3613: 0 | J3613: =IF(MOD(RC[-9],10)=2,3,"") ->  | K3613: 3
A3614: 176102 | B3614: 107595 | C3614: 107590 | D3614: 107591 | E3614: 107594 | F3614: 107595 | G3614: 0 | I3614: 0.1 | J3614: =IF(MOD(RC[-9],10)=2,3,"") -> 3 | K3614: 3
A3615: 177010 | B3615: 107600 | C3615: 107600 | D3615: 107601 | E3615: 107602 | F3615: 107603 | G3615: 107604 | J3615: =IF(MOD(RC[-9],10)=2,3,"") ->  | K3615: 3
A3616: 177020 | B3616: 107611 | C3616: 107611 | D3616: 107611 | E3616: 107612 | F3616: 107612 | G3616: 107614 | J3616: =IF(MOD(RC[-9],10)=2,3,"") ->  | K3616: 3
A3617: 177030 | B3617: 107624 | C3617: 107620 | D3617: 107621 | E3617: 107622 | F3617: 107623 | G3617: 107623 | J3617: =IF(MOD(RC[-9],10)=2,3,"") ->  | K3617: 3
A3618: 177031 | B3618: 107625 | C3618: 107621 | D3618: 107622 | E3618: 107623 | F3618: 107625 | G3618: 107624 | J3618: =IF(MOD(RC[-9],10)=2,3,"") ->  | K3618: 3
A3619: 177040 | B3619: 107631 | C3619: 107631 | D3619: 107631 | E3619: 107631 | F3619: 107632 | G3619: 107632 | J3619: =IF(MOD(RC[-9],10)=2,3,"") ->  | K3619: 3
A3620: 177050 | B3620: 107643 | C3620: 107640 | D3620: 107640 | E3620: 107643 | F3620: 107643 | G3620: 107644 | J3620: =IF(MOD(RC[-9],10)=2,3,"") ->  | K3620: 3
A3621: 177060 | B3621: 107650 | C3621: 107650 | D3621: 107650 | E3621: 107651 | F3621: 107653 | G3621: 107654 | J3621: =IF(MOD(RC[-9],10)=2,3,"") ->  | K3621: 3
A3622: 177061 | B3622: 107655 | C3622: 107651 | D3622: 107652 | E3622: 107653 | F3622: 107655 | G3622: 107654 | J3622: =IF(MOD(RC[-9],10)=2,3,"") ->  | K3622: 3
A3623: 177070 | B3623: 107662 | C3623: 107661 | D3623: 107661 | E3623: 107662 | F3623: 107662 | G3623: 107664 | J3623: =IF(MOD(RC[-9],10)=2,3,"") ->  | K3623: 3
A3624: 177080 | B3624: 107670 | C3624: 107670 | D3624: 107670 | E3624: 107670 | F3624: 107673 | G3624: 107674 | J3624: =IF(MOD(RC[-9],10)=2,3,"") ->  | K3624: 3
A3625: 177090 | B3625: 107684 | C3625: 107680 | D3625: 107681 | E3625: 107682 | F3625: 107683 | G3625: 107683 | J3625: =IF(MOD(RC[-9],10)=2,3,"") ->  | K3625: 3
A3626: 177091 | B3626: 107685 | C3626: 107681 | D3626: 107682 | E3626: 107683 | F3626: 107685 | G3626: 107684 | J3626: =IF(MOD(RC[-9],10)=2,3,"") ->  | K3626: 3
A3627: 177100 | B3627: 107690 | C3627: 107690 | D3627: 107690 | E3627: 107692 | F3627: 107694 | G3627: 0 | J3627: =IF(MOD(RC[-9],10)=2,3,"") ->  | K3627: 3
A3628: 177101 | B3628: 107691 | C3628: 107691 | D3628: 107691 | E3628: 107692 | F3628: 107693 | G3628: 0 | J3628: =IF(MOD(RC[-9],10)=2,3,"") ->  | K3628: 3
A3629: 177102 | B3629: 107695 | C3629: 107690 | D3629: 107691 | E3629: 107694 | F3629: 107695 | G3629: 0 | I3629: 0.1 | J3629: =IF(MOD(RC[-9],10)=2,3,"") -> 3 | K3629: 3
A3630: 178010 | B3630: 107700 | C3630: 107700 | D3630: 107701 | E3630: 107702 | F3630: 107703 | G3630: 107704 | J3630: =IF(MOD(RC[-9],10)=2,3,"") ->  | K3630: 3
A3631: 178020 | B3631: 107711 | C3631: 107711 | D3631: 107711 | E3631: 107712 | F3631: 107712 | G3631: 107714 | J3631: =IF(MOD(RC[-9],10)=2,3,"") ->  | K3631: 3
A3632: 178030 | B3632: 107724 | C3632: 107720 | D3632: 107721 | E3632: 107722 | F3632: 107723 | G3632: 107723 | J3632: =IF(MOD(RC[-9],10)=2,3,"") ->  | K3632: 3
A3633: 178031 | B3633: 107725 | C3633: 107721 | D3633: 107722 | E3633: 107723 | F3633: 107725 | G3633: 107724 | J3633: =IF(MOD(RC[-9],10)=2,3,"") ->  | K3633: 3
A3634: 178040 | B3634: 107731 | C3634: 107731 | D3634: 107731 | E3634: 107731 | F3634: 107732 | G3634: 107732 | J3634: =IF(MOD(RC[-9],10)=2,3,"") ->  | K3634: 3
A3635: 178050 | B3635: 107743 | C3635: 107740 | D3635: 107740 | E3635: 107743 | F3635: 107743 | G3635: 107744 | J3635: =IF(MOD(RC[-9],10)=2,3,"") ->  | K3635: 3
A3636: 178060 | B3636: 107750 | C3636: 107750 | D3636: 107750 | E3636: 107751 | F3636: 107753 | G3636: 107754 | J3636: =IF(MOD(RC[-9],10)=2,3,"") ->  | K3636: 3
A3637: 178061 | B3637: 107755 | C3637: 107751 | D3637: 107752 | E3637: 107753 | F3637: 107755 | G3637: 107754 | J3637: =IF(MOD(RC[-9],10)=2,3,"") ->  | K3637: 3
A3638: 178070 | B3638: 107762 | C3638: 107761 | D3638: 107761 | E3638: 107762 | F3638: 107762 | G3638: 107764 | J3638: =IF(MOD(RC[-9],10)=2,3,"") ->  | K3638: 3
A3639: 178080 | B3639: 107770 | C3639: 107770 | D3639: 107770 | E3639: 107770 | F3639: 107773 | G3639: 107774 | J3639: =IF(MOD(RC[-9],10)=2,3,"") ->  | K3639: 3
A3640: 178090 | B3640: 107784 | C3640: 107780 | D3640: 107781 | E3640: 107782 | F3640: 107783 | G3640: 107783 | J3640: =IF(MOD(RC[-9],10)=2,3,"") ->  | K3640: 3
A3641: 178091 | B3641: 107785 | C3641: 107781 | D3641: 107782 | E3641: 107783 | F3641: 107785 | G3641: 107784 | J3641: =IF(MOD(RC[-9],10)=2,3,"") ->  | K3641: 3
A3642: 178100 | B3642: 107790 | C3642: 107790 | D3642: 107790 | E3642: 107792 | F3642: 107794 | G3642: 0 | J3642: =IF(MOD(RC[-9],10)=2,3,"") ->  | K3642: 3
A3643: 178101 | B3643: 107791 | C3643: 107791 | D3643: 107791 | E3643: 107792 | F3643: 107793 | G3643: 0 | J3643: =IF(MOD(RC[-9],10)=2,3,"") ->  | K3643: 3
A3644: 178102 | B3644: 107795 | C3644: 107790 | D3644: 107791 | E3644: 107794 | F3644: 107795 | G3644: 0 | I3644: 0.1 | J3644: =IF(MOD(RC[-9],10)=2,3,"") -> 3 | K3644: 3
A3645: 179010 | B3645: 107800 | C3645: 107800 | D3645: 107801 | E3645: 107802 | F3645: 107803 | G3645: 107804 | J3645: =IF(MOD(RC[-9],10)=2,3,"") ->  | K3645: 3
A3646: 179020 | B3646: 107811 | C3646: 107811 | D3646: 107811 | E3646: 107812 | F3646: 107812 | G3646: 107814 | J3646: =IF(MOD(RC[-9],10)=2,3,"") ->  | K3646: 3
A3647: 179030 | B3647: 107824 | C3647: 107820 | D3647: 107821 | E3647: 107822 | F3647: 107823 | G3647: 107823 | J3647: =IF(MOD(RC[-9],10)=2,3,"") ->  | K3647: 3
A3648: 179031 | B3648: 107825 | C3648: 107821 | D3648: 107822 | E3648: 107823 | F3648: 107825 | G3648: 107824 | J3648: =IF(MOD(RC[-9],10)=2,3,"") ->  | K3648: 3
A3649: 179040 | B3649: 107831 | C3649: 107831 | D3649: 107831 | E3649: 107831 | F3649: 107832 | G3649: 107832 | J3649: =IF(MOD(RC[-9],10)=2,3,"") ->  | K3649: 3
A3650: 179050 | B3650: 107843 | C3650: 107840 | D3650: 107840 | E3650: 107843 | F3650: 107843 | G3650: 107844 | J3650: =IF(MOD(RC[-9],10)=2,3,"") ->  | K3650: 3
A3651: 179060 | B3651: 107850 | C3651: 107850 | D3651: 107850 | E3651: 107851 | F3651: 107853 | G3651: 107854 | J3651: =IF(MOD(RC[-9],10)=2,3,"") ->  | K3651: 3
A3652: 179061 | B3652: 107855 | C3652: 107851 | D3652: 107852 | E3652: 107853 | F3652: 107855 | G3652: 107854 | J3652: =IF(MOD(RC[-9],10)=2,3,"") ->  | K3652: 3
A3653: 179070 | B3653: 107862 | C3653: 107861 | D3653: 107861 | E3653: 107862 | F3653: 107862 | G3653: 107864 | J3653: =IF(MOD(RC[-9],10)=2,3,"") ->  | K3653: 3
A3654: 179080 | B3654: 107870 | C3654: 107870 | D3654: 107870 | E3654: 107870 | F3654: 107873 | G3654: 107874 | J3654: =IF(MOD(RC[-9],10)=2,3,"") ->  | K3654: 3
A3655: 179090 | B3655: 107884 | C3655: 107880 | D3655: 107881 | E3655: 107882 | F3655: 107883 | G3655: 107883 | J3655: =IF(MOD(RC[-9],10)=2,3,"") ->  | K3655: 3
A3656: 179091 | B3656: 107885 | C3656: 107881 | D3656: 107882 | E3656: 107883 | F3656: 107885 | G3656: 107884 | J3656: =IF(MOD(RC[-9],10)=2,3,"") ->  | K3656: 3
A3657: 179100 | B3657: 107890 | C3657: 107890 | D3657: 107890 | E3657: 107892 | F3657: 107894 | G3657: 0 | J3657: =IF(MOD(RC[-9],10)=2,3,"") ->  | K3657: 3
A3658: 179101 | B3658: 107891 | C3658: 107891 | D3658: 107891 | E3658: 107892 | F3658: 107893 | G3658: 0 | J3658: =IF(MOD(RC[-9],10)=2,3,"") ->  | K3658: 3
A3659: 179102 | B3659: 107895 | C3659: 107890 | D3659: 107891 | E3659: 107894 | F3659: 107895 | G3659: 0 | I3659: 0.1 | J3659: =IF(MOD(RC[-9],10)=2,3,"") -> 3 | K3659: 3
A3660: 180010 | B3660: 107900 | C3660: 107900 | D3660: 107901 | E3660: 107902 | F3660: 107903 | G3660: 107904 | J3660: =IF(MOD(RC[-9],10)=2,3,"") ->  | K3660: 3
A3661: 180020 | B3661: 107911 | C3661: 107911 | D3661: 107911 | E3661: 107912 | F3661: 107912 | G3661: 107914 | J3661: =IF(MOD(RC[-9],10)=2,3,"") ->  | K3661: 3
A3662: 180030 | B3662: 107924 | C3662: 107920 | D3662: 107921 | E3662: 107922 | F3662: 107923 | G3662: 107923 | J3662: =IF(MOD(RC[-9],10)=2,3,"") ->  | K3662: 3
A3663: 180031 | B3663: 107925 | C3663: 107921 | D3663: 107922 | E3663: 107923 | F3663: 107925 | G3663: 107924 | J3663: =IF(MOD(RC[-9],10)=2,3,"") ->  | K3663: 3
A3664: 180040 | B3664: 107931 | C3664: 107931 | D3664: 107931 | E3664: 107931 | F3664: 107932 | G3664: 107932 | J3664: =IF(MOD(RC[-9],10)=2,3,"") ->  | K3664: 3
A3665: 180050 | B3665: 107943 | C3665: 107940 | D3665: 107940 | E3665: 107943 | F3665: 107943 | G3665: 107944 | J3665: =IF(MOD(RC[-9],10)=2,3,"") ->  | K3665: 3
A3666: 180060 | B3666: 107950 | C3666: 107950 | D3666: 107950 | E3666: 107951 | F3666: 107953 | G3666: 107954 | J3666: =IF(MOD(RC[-9],10)=2,3,"") ->  | K3666: 3
A3667: 180061 | B3667: 107955 | C3667: 107951 | D3667: 107952 | E3667: 107953 | F3667: 107955 | G3667: 107954 | J3667: =IF(MOD(RC[-9],10)=2,3,"") ->  | K3667: 3
A3668: 180070 | B3668: 107962 | C3668: 107961 | D3668: 107961 | E3668: 107962 | F3668: 107962 | G3668: 107964 | J3668: =IF(MOD(RC[-9],10)=2,3,"") ->  | K3668: 3
A3669: 180080 | B3669: 107970 | C3669: 107970 | D3669: 107970 | E3669: 107970 | F3669: 107973 | G3669: 107974 | J3669: =IF(MOD(RC[-9],10)=2,3,"") ->  | K3669: 3
A3670: 180090 | B3670: 107984 | C3670: 107980 | D3670: 107981 | E3670: 107982 | F3670: 107983 | G3670: 107983 | J3670: =IF(MOD(RC[-9],10)=2,3,"") ->  | K3670: 3
A3671: 180091 | B3671: 107985 | C3671: 107981 | D3671: 107982 | E3671: 107983 | F3671: 107985 | G3671: 107984 | J3671: =IF(MOD(RC[-9],10)=2,3,"") ->  | K3671: 3
A3672: 180100 | B3672: 107990 | C3672: 107990 | D3672: 107990 | E3672: 107992 | F3672: 107994 | G3672: 0 | J3672: =IF(MOD(RC[-9],10)=2,3,"") ->  | K3672: 3
A3673: 180101 | B3673: 107991 | C3673: 107991 | D3673: 107991 | E3673: 107992 | F3673: 107993 | G3673: 0 | J3673: =IF(MOD(RC[-9],10)=2,3,"") ->  | K3673: 3
A3674: 180102 | B3674: 107995 | C3674: 107990 | D3674: 107991 | E3674: 107994 | F3674: 107995 | G3674: 0 | I3674: 0.1 | J3674: =IF(MOD(RC[-9],10)=2,3,"") -> 3 | K3674: 3
A3675: 181010 | B3675: 108000 | C3675: 108000 | D3675: 108001 | E3675: 108002 | F3675: 108003 | G3675: 108004 | J3675: =IF(MOD(RC[-9],10)=2,3,"") ->  | K3675: 3
A3676: 181020 | B3676: 108011 | C3676: 108011 | D3676: 108011 | E3676: 108012 | F3676: 108012 | G3676: 108014 | J3676: =IF(MOD(RC[-9],10)=2,3,"") ->  | K3676: 3
A3677: 181030 | B3677: 108024 | C3677: 108020 | D3677: 108021 | E3677: 108022 | F3677: 108023 | G3677: 108023 | J3677: =IF(MOD(RC[-9],10)=2,3,"") ->  | K3677: 3
A3678: 181031 | B3678: 108025 | C3678: 108021 | D3678: 108022 | E3678: 108023 | F3678: 108025 | G3678: 108024 | J3678: =IF(MOD(RC[-9],10)=2,3,"") ->  | K3678: 3
A3679: 181040 | B3679: 108031 | C3679: 108031 | D3679: 108031 | E3679: 108031 | F3679: 108032 | G3679: 108032 | J3679: =IF(MOD(RC[-9],10)=2,3,"") ->  | K3679: 3
A3680: 181050 | B3680: 108043 | C3680: 108040 | D3680: 108040 | E3680: 108043 | F3680: 108043 | G3680: 108044 | J3680: =IF(MOD(RC[-9],10)=2,3,"") ->  | K3680: 3
A3681: 181060 | B3681: 108050 | C3681: 108050 | D3681: 108050 | E3681: 108051 | F3681: 108053 | G3681: 108054 | J3681: =IF(MOD(RC[-9],10)=2,3,"") ->  | K3681: 3
A3682: 181061 | B3682: 108055 | C3682: 108051 | D3682: 108052 | E3682: 108053 | F3682: 108055 | G3682: 108054 | J3682: =IF(MOD(RC[-9],10)=2,3,"") ->  | K3682: 3
A3683: 181070 | B3683: 108062 | C3683: 108061 | D3683: 108061 | E3683: 108062 | F3683: 108062 | G3683: 108064 | J3683: =IF(MOD(RC[-9],10)=2,3,"") ->  | K3683: 3
A3684: 181080 | B3684: 108070 | C3684: 108070 | D3684: 108070 | E3684: 108070 | F3684: 108073 | G3684: 108074 | J3684: =IF(MOD(RC[-9],10)=2,3,"") ->  | K3684: 3
A3685: 181090 | B3685: 108084 | C3685: 108080 | D3685: 108081 | E3685: 108082 | F3685: 108083 | G3685: 108083 | J3685: =IF(MOD(RC[-9],10)=2,3,"") ->  | K3685: 3
A3686: 181091 | B3686: 108085 | C3686: 108081 | D3686: 108082 | E3686: 108083 | F3686: 108085 | G3686: 108084 | J3686: =IF(MOD(RC[-9],10)=2,3,"") ->  | K3686: 3
A3687: 181100 | B3687: 108090 | C3687: 108090 | D3687: 108090 | E3687: 108092 | F3687: 108094 | G3687: 0 | J3687: =IF(MOD(RC[-9],10)=2,3,"") ->  | K3687: 3
A3688: 181101 | B3688: 108091 | C3688: 108091 | D3688: 108091 | E3688: 108092 | F3688: 108093 | G3688: 0 | J3688: =IF(MOD(RC[-9],10)=2,3,"") ->  | K3688: 3
A3689: 181102 | B3689: 108095 | C3689: 108090 | D3689: 108091 | E3689: 108094 | F3689: 108095 | G3689: 0 | I3689: 0.1 | J3689: =IF(MOD(RC[-9],10)=2,3,"") -> 3 | K3689: 3
A3690: 182010 | B3690: 108100 | C3690: 108100 | D3690: 108101 | E3690: 108102 | F3690: 108103 | G3690: 108104 | J3690: =IF(MOD(RC[-9],10)=2,3,"") ->  | K3690: 3
A3691: 182020 | B3691: 108111 | C3691: 108111 | D3691: 108111 | E3691: 108112 | F3691: 108112 | G3691: 108114 | J3691: =IF(MOD(RC[-9],10)=2,3,"") ->  | K3691: 3
A3692: 182030 | B3692: 108124 | C3692: 108120 | D3692: 108121 | E3692: 108122 | F3692: 108123 | G3692: 108123 | J3692: =IF(MOD(RC[-9],10)=2,3,"") ->  | K3692: 3
A3693: 182031 | B3693: 108125 | C3693: 108121 | D3693: 108122 | E3693: 108123 | F3693: 108125 | G3693: 108124 | J3693: =IF(MOD(RC[-9],10)=2,3,"") ->  | K3693: 3
A3694: 182040 | B3694: 108131 | C3694: 108131 | D3694: 108131 | E3694: 108131 | F3694: 108132 | G3694: 108132 | J3694: =IF(MOD(RC[-9],10)=2,3,"") ->  | K3694: 3
A3695: 182050 | B3695: 108143 | C3695: 108140 | D3695: 108140 | E3695: 108143 | F3695: 108143 | G3695: 108144 | J3695: =IF(MOD(RC[-9],10)=2,3,"") ->  | K3695: 3
A3696: 182060 | B3696: 108150 | C3696: 108150 | D3696: 108150 | E3696: 108151 | F3696: 108153 | G3696: 108154 | J3696: =IF(MOD(RC[-9],10)=2,3,"") ->  | K3696: 3
A3697: 182061 | B3697: 108155 | C3697: 108151 | D3697: 108152 | E3697: 108153 | F3697: 108155 | G3697: 108154 | J3697: =IF(MOD(RC[-9],10)=2,3,"") ->  | K3697: 3
A3698: 182070 | B3698: 108162 | C3698: 108161 | D3698: 108161 | E3698: 108162 | F3698: 108162 | G3698: 108164 | J3698: =IF(MOD(RC[-9],10)=2,3,"") ->  | K3698: 3
A3699: 182080 | B3699: 108170 | C3699: 108170 | D3699: 108170 | E3699: 108170 | F3699: 108173 | G3699: 108174 | J3699: =IF(MOD(RC[-9],10)=2,3,"") ->  | K3699: 3
A3700: 182090 | B3700: 108184 | C3700: 108180 | D3700: 108181 | E3700: 108182 | F3700: 108183 | G3700: 108183 | J3700: =IF(MOD(RC[-9],10)=2,3,"") ->  | K3700: 3
A3701: 182091 | B3701: 108185 | C3701: 108181 | D3701: 108182 | E3701: 108183 | F3701: 108185 | G3701: 108184 | J3701: =IF(MOD(RC[-9],10)=2,3,"") ->  | K3701: 3
A3702: 182100 | B3702: 108190 | C3702: 108190 | D3702: 108190 | E3702: 108192 | F3702: 108194 | G3702: 0 | J3702: =IF(MOD(RC[-9],10)=2,3,"") ->  | K3702: 3
A3703: 182101 | B3703: 108191 | C3703: 108191 | D3703: 108191 | E3703: 108192 | F3703: 108193 | G3703: 0 | J3703: =IF(MOD(RC[-9],10)=2,3,"") ->  | K3703: 3
A3704: 182102 | B3704: 108195 | C3704: 108190 | D3704: 108191 | E3704: 108194 | F3704: 108195 | G3704: 0 | I3704: 0.1 | J3704: =IF(MOD(RC[-9],10)=2,3,"") -> 3 | K3704: 3
A3705: 183010 | B3705: 108200 | C3705: 108200 | D3705: 108201 | E3705: 108202 | F3705: 108203 | G3705: 108204 | J3705: =IF(MOD(RC[-9],10)=2,3,"") ->  | K3705: 3
A3706: 183020 | B3706: 108211 | C3706: 108211 | D3706: 108211 | E3706: 108212 | F3706: 108212 | G3706: 108214 | J3706: =IF(MOD(RC[-9],10)=2,3,"") ->  | K3706: 3
A3707: 183030 | B3707: 108224 | C3707: 108220 | D3707: 108221 | E3707: 108222 | F3707: 108223 | G3707: 108223 | J3707: =IF(MOD(RC[-9],10)=2,3,"") ->  | K3707: 3
A3708: 183031 | B3708: 108225 | C3708: 108221 | D3708: 108222 | E3708: 108223 | F3708: 108225 | G3708: 108224 | J3708: =IF(MOD(RC[-9],10)=2,3,"") ->  | K3708: 3
A3709: 183040 | B3709: 108231 | C3709: 108231 | D3709: 108231 | E3709: 108231 | F3709: 108232 | G3709: 108232 | J3709: =IF(MOD(RC[-9],10)=2,3,"") ->  | K3709: 3
A3710: 183050 | B3710: 108243 | C3710: 108240 | D3710: 108240 | E3710: 108243 | F3710: 108243 | G3710: 108244 | J3710: =IF(MOD(RC[-9],10)=2,3,"") ->  | K3710: 3
A3711: 183060 | B3711: 108250 | C3711: 108250 | D3711: 108250 | E3711: 108251 | F3711: 108253 | G3711: 108254 | J3711: =IF(MOD(RC[-9],10)=2,3,"") ->  | K3711: 3
A3712: 183061 | B3712: 108255 | C3712: 108251 | D3712: 108252 | E3712: 108253 | F3712: 108255 | G3712: 108254 | J3712: =IF(MOD(RC[-9],10)=2,3,"") ->  | K3712: 3
A3713: 183070 | B3713: 108262 | C3713: 108261 | D3713: 108261 | E3713: 108262 | F3713: 108262 | G3713: 108264 | J3713: =IF(MOD(RC[-9],10)=2,3,"") ->  | K3713: 3
A3714: 183080 | B3714: 108270 | C3714: 108270 | D3714: 108270 | E3714: 108270 | F3714: 108273 | G3714: 108274 | J3714: =IF(MOD(RC[-9],10)=2,3,"") ->  | K3714: 3
A3715: 183090 | B3715: 108284 | C3715: 108280 | D3715: 108281 | E3715: 108282 | F3715: 108283 | G3715: 108283 | J3715: =IF(MOD(RC[-9],10)=2,3,"") ->  | K3715: 3
A3716: 183091 | B3716: 108285 | C3716: 108281 | D3716: 108282 | E3716: 108283 | F3716: 108285 | G3716: 108284 | J3716: =IF(MOD(RC[-9],10)=2,3,"") ->  | K3716: 3
A3717: 183100 | B3717: 108290 | C3717: 108290 | D3717: 108290 | E3717: 108292 | F3717: 108294 | G3717: 0 | J3717: =IF(MOD(RC[-9],10)=2,3,"") ->  | K3717: 3
A3718: 183101 | B3718: 108291 | C3718: 108291 | D3718: 108291 | E3718: 108292 | F3718: 108293 | G3718: 0 | J3718: =IF(MOD(RC[-9],10)=2,3,"") ->  | K3718: 3
A3719: 183102 | B3719: 108295 | C3719: 108290 | D3719: 108291 | E3719: 108294 | F3719: 108295 | G3719: 0 | I3719: 0.1 | J3719: =IF(MOD(RC[-9],10)=2,3,"") -> 3 | K3719: 3
A3720: 184010 | B3720: 108300 | C3720: 108300 | D3720: 108301 | E3720: 108302 | F3720: 108303 | G3720: 108304 | J3720: =IF(MOD(RC[-9],10)=2,3,"") ->  | K3720: 3
A3721: 184020 | B3721: 108311 | C3721: 108311 | D3721: 108311 | E3721: 108312 | F3721: 108312 | G3721: 108314 | J3721: =IF(MOD(RC[-9],10)=2,3,"") ->  | K3721: 3
A3722: 184030 | B3722: 108324 | C3722: 108320 | D3722: 108321 | E3722: 108322 | F3722: 108323 | G3722: 108323 | J3722: =IF(MOD(RC[-9],10)=2,3,"") ->  | K3722: 3
A3723: 184031 | B3723: 108325 | C3723: 108321 | D3723: 108322 | E3723: 108323 | F3723: 108325 | G3723: 108324 | J3723: =IF(MOD(RC[-9],10)=2,3,"") ->  | K3723: 3
A3724: 184040 | B3724: 108331 | C3724: 108331 | D3724: 108331 | E3724: 108331 | F3724: 108332 | G3724: 108332 | J3724: =IF(MOD(RC[-9],10)=2,3,"") ->  | K3724: 3
A3725: 184050 | B3725: 108343 | C3725: 108340 | D3725: 108340 | E3725: 108343 | F3725: 108343 | G3725: 108344 | J3725: =IF(MOD(RC[-9],10)=2,3,"") ->  | K3725: 3
A3726: 184060 | B3726: 108350 | C3726: 108350 | D3726: 108350 | E3726: 108351 | F3726: 108353 | G3726: 108354 | J3726: =IF(MOD(RC[-9],10)=2,3,"") ->  | K3726: 3
A3727: 184061 | B3727: 108355 | C3727: 108351 | D3727: 108352 | E3727: 108353 | F3727: 108355 | G3727: 108354 | J3727: =IF(MOD(RC[-9],10)=2,3,"") ->  | K3727: 3
A3728: 184070 | B3728: 108362 | C3728: 108361 | D3728: 108361 | E3728: 108362 | F3728: 108362 | G3728: 108364 | J3728: =IF(MOD(RC[-9],10)=2,3,"") ->  | K3728: 3
A3729: 184080 | B3729: 108370 | C3729: 108370 | D3729: 108370 | E3729: 108370 | F3729: 108373 | G3729: 108374 | J3729: =IF(MOD(RC[-9],10)=2,3,"") ->  | K3729: 3
A3730: 184090 | B3730: 108384 | C3730: 108380 | D3730: 108381 | E3730: 108382 | F3730: 108383 | G3730: 108383 | J3730: =IF(MOD(RC[-9],10)=2,3,"") ->  | K3730: 3
A3731: 184091 | B3731: 108385 | C3731: 108381 | D3731: 108382 | E3731: 108383 | F3731: 108385 | G3731: 108384 | J3731: =IF(MOD(RC[-9],10)=2,3,"") ->  | K3731: 3
A3732: 184100 | B3732: 108390 | C3732: 108390 | D3732: 108390 | E3732: 108392 | F3732: 108394 | G3732: 0 | J3732: =IF(MOD(RC[-9],10)=2,3,"") ->  | K3732: 3
A3733: 184101 | B3733: 108391 | C3733: 108391 | D3733: 108391 | E3733: 108392 | F3733: 108393 | G3733: 0 | J3733: =IF(MOD(RC[-9],10)=2,3,"") ->  | K3733: 3
A3734: 184102 | B3734: 108395 | C3734: 108390 | D3734: 108391 | E3734: 108394 | F3734: 108395 | G3734: 0 | I3734: 0.1 | J3734: =IF(MOD(RC[-9],10)=2,3,"") -> 3 | K3734: 3
A3735: 185010 | B3735: 108400 | C3735: 108400 | D3735: 108401 | E3735: 108402 | F3735: 108403 | G3735: 108404 | J3735: =IF(MOD(RC[-9],10)=2,3,"") ->  | K3735: 3
A3736: 185020 | B3736: 108411 | C3736: 108411 | D3736: 108411 | E3736: 108412 | F3736: 108412 | G3736: 108414 | J3736: =IF(MOD(RC[-9],10)=2,3,"") ->  | K3736: 3
A3737: 185030 | B3737: 108424 | C3737: 108420 | D3737: 108421 | E3737: 108422 | F3737: 108423 | G3737: 108423 | J3737: =IF(MOD(RC[-9],10)=2,3,"") ->  | K3737: 3
A3738: 185031 | B3738: 108425 | C3738: 108421 | D3738: 108422 | E3738: 108423 | F3738: 108425 | G3738: 108424 | J3738: =IF(MOD(RC[-9],10)=2,3,"") ->  | K3738: 3
A3739: 185040 | B3739: 108431 | C3739: 108431 | D3739: 108431 | E3739: 108431 | F3739: 108432 | G3739: 108432 | J3739: =IF(MOD(RC[-9],10)=2,3,"") ->  | K3739: 3
A3740: 185050 | B3740: 108443 | C3740: 108440 | D3740: 108440 | E3740: 108443 | F3740: 108443 | G3740: 108444 | J3740: =IF(MOD(RC[-9],10)=2,3,"") ->  | K3740: 3
A3741: 185060 | B3741: 108450 | C3741: 108450 | D3741: 108450 | E3741: 108451 | F3741: 108453 | G3741: 108454 | J3741: =IF(MOD(RC[-9],10)=2,3,"") ->  | K3741: 3
A3742: 185061 | B3742: 108455 | C3742: 108451 | D3742: 108452 | E3742: 108453 | F3742: 108455 | G3742: 108454 | J3742: =IF(MOD(RC[-9],10)=2,3,"") ->  | K3742: 3
A3743: 185070 | B3743: 108462 | C3743: 108461 | D3743: 108461 | E3743: 108462 | F3743: 108462 | G3743: 108464 | J3743: =IF(MOD(RC[-9],10)=2,3,"") ->  | K3743: 3
A3744: 185080 | B3744: 108470 | C3744: 108470 | D3744: 108470 | E3744: 108470 | F3744: 108473 | G3744: 108474 | J3744: =IF(MOD(RC[-9],10)=2,3,"") ->  | K3744: 3
A3745: 185090 | B3745: 108484 | C3745: 108480 | D3745: 108481 | E3745: 108482 | F3745: 108483 | G3745: 108483 | J3745: =IF(MOD(RC[-9],10)=2,3,"") ->  | K3745: 3
A3746: 185091 | B3746: 108485 | C3746: 108481 | D3746: 108482 | E3746: 108483 | F3746: 108485 | G3746: 108484 | J3746: =IF(MOD(RC[-9],10)=2,3,"") ->  | K3746: 3
A3747: 185100 | B3747: 108490 | C3747: 108490 | D3747: 108490 | E3747: 108492 | F3747: 108494 | G3747: 0 | J3747: =IF(MOD(RC[-9],10)=2,3,"") ->  | K3747: 3
A3748: 185101 | B3748: 108491 | C3748: 108491 | D3748: 108491 | E3748: 108492 | F3748: 108493 | G3748: 0 | J3748: =IF(MOD(RC[-9],10)=2,3,"") ->  | K3748: 3
A3749: 185102 | B3749: 108495 | C3749: 108490 | D3749: 108491 | E3749: 108494 | F3749: 108495 | G3749: 0 | I3749: 0.1 | J3749: =IF(MOD(RC[-9],10)=2,3,"") -> 3 | K3749: 3
A3750: 186010 | B3750: 108500 | C3750: 108500 | D3750: 108501 | E3750: 108502 | F3750: 108503 | G3750: 108504 | J3750: =IF(MOD(RC[-9],10)=2,3,"") ->  | K3750: 3
A3751: 186020 | B3751: 108511 | C3751: 108511 | D3751: 108511 | E3751: 108512 | F3751: 108512 | G3751: 108514 | J3751: =IF(MOD(RC[-9],10)=2,3,"") ->  | K3751: 3
A3752: 186030 | B3752: 108524 | C3752: 108520 | D3752: 108521 | E3752: 108522 | F3752: 108523 | G3752: 108523 | J3752: =IF(MOD(RC[-9],10)=2,3,"") ->  | K3752: 3
A3753: 186031 | B3753: 108525 | C3753: 108521 | D3753: 108522 | E3753: 108523 | F3753: 108525 | G3753: 108524 | J3753: =IF(MOD(RC[-9],10)=2,3,"") ->  | K3753: 3
A3754: 186040 | B3754: 108531 | C3754: 108531 | D3754: 108531 | E3754: 108531 | F3754: 108532 | G3754: 108532 | J3754: =IF(MOD(RC[-9],10)=2,3,"") ->  | K3754: 3
A3755: 186050 | B3755: 108543 | C3755: 108540 | D3755: 108540 | E3755: 108543 | F3755: 108543 | G3755: 108544 | J3755: =IF(MOD(RC[-9],10)=2,3,"") ->  | K3755: 3
A3756: 186060 | B3756: 108550 | C3756: 108550 | D3756: 108550 | E3756: 108551 | F3756: 108553 | G3756: 108554 | J3756: =IF(MOD(RC[-9],10)=2,3,"") ->  | K3756: 3
A3757: 186061 | B3757: 108555 | C3757: 108551 | D3757: 108552 | E3757: 108553 | F3757: 108555 | G3757: 108554 | J3757: =IF(MOD(RC[-9],10)=2,3,"") ->  | K3757: 3
A3758: 186070 | B3758: 108562 | C3758: 108561 | D3758: 108561 | E3758: 108562 | F3758: 108562 | G3758: 108564 | J3758: =IF(MOD(RC[-9],10)=2,3,"") ->  | K3758: 3
A3759: 186080 | B3759: 108570 | C3759: 108570 | D3759: 108570 | E3759: 108570 | F3759: 108573 | G3759: 108574 | J3759: =IF(MOD(RC[-9],10)=2,3,"") ->  | K3759: 3
A3760: 186090 | B3760: 108584 | C3760: 108580 | D3760: 108581 | E3760: 108582 | F3760: 108583 | G3760: 108583 | J3760: =IF(MOD(RC[-9],10)=2,3,"") ->  | K3760: 3
A3761: 186091 | B3761: 108585 | C3761: 108581 | D3761: 108582 | E3761: 108583 | F3761: 108585 | G3761: 108584 | J3761: =IF(MOD(RC[-9],10)=2,3,"") ->  | K3761: 3
A3762: 186100 | B3762: 108590 | C3762: 108590 | D3762: 108590 | E3762: 108592 | F3762: 108594 | G3762: 0 | J3762: =IF(MOD(RC[-9],10)=2,3,"") ->  | K3762: 3
A3763: 186101 | B3763: 108591 | C3763: 108591 | D3763: 108591 | E3763: 108592 | F3763: 108593 | G3763: 0 | J3763: =IF(MOD(RC[-9],10)=2,3,"") ->  | K3763: 3
A3764: 186102 | B3764: 108595 | C3764: 108590 | D3764: 108591 | E3764: 108594 | F3764: 108595 | G3764: 0 | I3764: 0.1 | J3764: =IF(MOD(RC[-9],10)=2,3,"") -> 3 | K3764: 3
A3765: 187010 | B3765: 108600 | C3765: 108600 | D3765: 108601 | E3765: 108602 | F3765: 108603 | G3765: 108604 | J3765: =IF(MOD(RC[-9],10)=2,3,"") ->  | K3765: 3
A3766: 187020 | B3766: 108611 | C3766: 108611 | D3766: 108611 | E3766: 108612 | F3766: 108612 | G3766: 108614 | J3766: =IF(MOD(RC[-9],10)=2,3,"") ->  | K3766: 3
A3767: 187030 | B3767: 108624 | C3767: 108620 | D3767: 108621 | E3767: 108622 | F3767: 108623 | G3767: 108623 | J3767: =IF(MOD(RC[-9],10)=2,3,"") ->  | K3767: 3
A3768: 187031 | B3768: 108625 | C3768: 108621 | D3768: 108622 | E3768: 108623 | F3768: 108625 | G3768: 108624 | J3768: =IF(MOD(RC[-9],10)=2,3,"") ->  | K3768: 3
A3769: 187040 | B3769: 108631 | C3769: 108631 | D3769: 108631 | E3769: 108631 | F3769: 108632 | G3769: 108632 | J3769: =IF(MOD(RC[-9],10)=2,3,"") ->  | K3769: 3
A3770: 187050 | B3770: 108643 | C3770: 108640 | D3770: 108640 | E3770: 108643 | F3770: 108643 | G3770: 108644 | J3770: =IF(MOD(RC[-9],10)=2,3,"") ->  | K3770: 3
A3771: 187060 | B3771: 108650 | C3771: 108650 | D3771: 108650 | E3771: 108651 | F3771: 108653 | G3771: 108654 | J3771: =IF(MOD(RC[-9],10)=2,3,"") ->  | K3771: 3
A3772: 187061 | B3772: 108655 | C3772: 108651 | D3772: 108652 | E3772: 108653 | F3772: 108655 | G3772: 108654 | J3772: =IF(MOD(RC[-9],10)=2,3,"") ->  | K3772: 3
A3773: 187070 | B3773: 108662 | C3773: 108661 | D3773: 108661 | E3773: 108662 | F3773: 108662 | G3773: 108664 | J3773: =IF(MOD(RC[-9],10)=2,3,"") ->  | K3773: 3
A3774: 187080 | B3774: 108670 | C3774: 108670 | D3774: 108670 | E3774: 108670 | F3774: 108673 | G3774: 108674 | J3774: =IF(MOD(RC[-9],10)=2,3,"") ->  | K3774: 3
A3775: 187090 | B3775: 108684 | C3775: 108680 | D3775: 108681 | E3775: 108682 | F3775: 108683 | G3775: 108683 | J3775: =IF(MOD(RC[-9],10)=2,3,"") ->  | K3775: 3
A3776: 187091 | B3776: 108685 | C3776: 108681 | D3776: 108682 | E3776: 108683 | F3776: 108685 | G3776: 108684 | J3776: =IF(MOD(RC[-9],10)=2,3,"") ->  | K3776: 3
A3777: 187100 | B3777: 108690 | C3777: 108690 | D3777: 108690 | E3777: 108692 | F3777: 108694 | G3777: 0 | J3777: =IF(MOD(RC[-9],10)=2,3,"") ->  | K3777: 3
A3778: 187101 | B3778: 108691 | C3778: 108691 | D3778: 108691 | E3778: 108692 | F3778: 108693 | G3778: 0 | J3778: =IF(MOD(RC[-9],10)=2,3,"") ->  | K3778: 3
A3779: 187102 | B3779: 108695 | C3779: 108690 | D3779: 108691 | E3779: 108694 | F3779: 108695 | G3779: 0 | I3779: 0.1 | J3779: =IF(MOD(RC[-9],10)=2,3,"") -> 3 | K3779: 3
A3780: 188010 | B3780: 108700 | C3780: 108700 | D3780: 108701 | E3780: 108702 | F3780: 108703 | G3780: 108704 | J3780: =IF(MOD(RC[-9],10)=2,3,"") ->  | K3780: 3
A3781: 188020 | B3781: 108711 | C3781: 108711 | D3781: 108711 | E3781: 108712 | F3781: 108712 | G3781: 108714 | J3781: =IF(MOD(RC[-9],10)=2,3,"") ->  | K3781: 3
A3782: 188030 | B3782: 108724 | C3782: 108720 | D3782: 108721 | E3782: 108722 | F3782: 108723 | G3782: 108723 | J3782: =IF(MOD(RC[-9],10)=2,3,"") ->  | K3782: 3
A3783: 188031 | B3783: 108725 | C3783: 108721 | D3783: 108722 | E3783: 108723 | F3783: 108725 | G3783: 108724 | J3783: =IF(MOD(RC[-9],10)=2,3,"") ->  | K3783: 3
A3784: 188040 | B3784: 108731 | C3784: 108731 | D3784: 108731 | E3784: 108731 | F3784: 108732 | G3784: 108732 | J3784: =IF(MOD(RC[-9],10)=2,3,"") ->  | K3784: 3
A3785: 188050 | B3785: 108743 | C3785: 108740 | D3785: 108740 | E3785: 108743 | F3785: 108743 | G3785: 108744 | J3785: =IF(MOD(RC[-9],10)=2,3,"") ->  | K3785: 3
A3786: 188060 | B3786: 108750 | C3786: 108750 | D3786: 108750 | E3786: 108751 | F3786: 108753 | G3786: 108754 | J3786: =IF(MOD(RC[-9],10)=2,3,"") ->  | K3786: 3
A3787: 188061 | B3787: 108755 | C3787: 108751 | D3787: 108752 | E3787: 108753 | F3787: 108755 | G3787: 108754 | J3787: =IF(MOD(RC[-9],10)=2,3,"") ->  | K3787: 3
A3788: 188070 | B3788: 108762 | C3788: 108761 | D3788: 108761 | E3788: 108762 | F3788: 108762 | G3788: 108764 | J3788: =IF(MOD(RC[-9],10)=2,3,"") ->  | K3788: 3
A3789: 188080 | B3789: 108770 | C3789: 108770 | D3789: 108770 | E3789: 108770 | F3789: 108773 | G3789: 108774 | J3789: =IF(MOD(RC[-9],10)=2,3,"") ->  | K3789: 3
A3790: 188090 | B3790: 108784 | C3790: 108780 | D3790: 108781 | E3790: 108782 | F3790: 108783 | G3790: 108783 | J3790: =IF(MOD(RC[-9],10)=2,3,"") ->  | K3790: 3
A3791: 188091 | B3791: 108785 | C3791: 108781 | D3791: 108782 | E3791: 108783 | F3791: 108785 | G3791: 108784 | J3791: =IF(MOD(RC[-9],10)=2,3,"") ->  | K3791: 3
A3792: 188100 | B3792: 108790 | C3792: 108790 | D3792: 108790 | E3792: 108792 | F3792: 108794 | G3792: 0 | J3792: =IF(MOD(RC[-9],10)=2,3,"") ->  | K3792: 3
A3793: 188101 | B3793: 108791 | C3793: 108791 | D3793: 108791 | E3793: 108792 | F3793: 108793 | G3793: 0 | J3793: =IF(MOD(RC[-9],10)=2,3,"") ->  | K3793: 3
A3794: 188102 | B3794: 108795 | C3794: 108790 | D3794: 108791 | E3794: 108794 | F3794: 108795 | G3794: 0 | I3794: 0.1 | J3794: =IF(MOD(RC[-9],10)=2,3,"") -> 3 | K3794: 3
A3795: 189010 | B3795: 108800 | C3795: 108800 | D3795: 108801 | E3795: 108802 | F3795: 108803 | G3795: 108804 | J3795: =IF(MOD(RC[-9],10)=2,3,"") ->  | K3795: 3
A3796: 189020 | B3796: 108811 | C3796: 108811 | D3796: 108811 | E3796: 108812 | F3796: 108812 | G3796: 108814 | J3796: =IF(MOD(RC[-9],10)=2,3,"") ->  | K3796: 3
A3797: 189030 | B3797: 108824 | C3797: 108820 | D3797: 108821 | E3797: 108822 | F3797: 108823 | G3797: 108823 | J3797: =IF(MOD(RC[-9],10)=2,3,"") ->  | K3797: 3
A3798: 189031 | B3798: 108825 | C3798: 108821 | D3798: 108822 | E3798: 108823 | F3798: 108825 | G3798: 108824 | J3798: =IF(MOD(RC[-9],10)=2,3,"") ->  | K3798: 3
A3799: 189040 | B3799: 108831 | C3799: 108831 | D3799: 108831 | E3799: 108831 | F3799: 108832 | G3799: 108832 | J3799: =IF(MOD(RC[-9],10)=2,3,"") ->  | K3799: 3
A3800: 189050 | B3800: 108843 | C3800: 108840 | D3800: 108840 | E3800: 108843 | F3800: 108843 | G3800: 108844 | J3800: =IF(MOD(RC[-9],10)=2,3,"") ->  | K3800: 3
A3801: 189060 | B3801: 108850 | C3801: 108850 | D3801: 108850 | E3801: 108851 | F3801: 108853 | G3801: 108854 | J3801: =IF(MOD(RC[-9],10)=2,3,"") ->  | K3801: 3
A3802: 189061 | B3802: 108855 | C3802: 108851 | D3802: 108852 | E3802: 108853 | F3802: 108855 | G3802: 108854 | J3802: =IF(MOD(RC[-9],10)=2,3,"") ->  | K3802: 3
A3803: 189070 | B3803: 108862 | C3803: 108861 | D3803: 108861 | E3803: 108862 | F3803: 108862 | G3803: 108864 | J3803: =IF(MOD(RC[-9],10)=2,3,"") ->  | K3803: 3
A3804: 189080 | B3804: 108870 | C3804: 108870 | D3804: 108870 | E3804: 108870 | F3804: 108873 | G3804: 108874 | J3804: =IF(MOD(RC[-9],10)=2,3,"") ->  | K3804: 3
A3805: 189090 | B3805: 108884 | C3805: 108880 | D3805: 108881 | E3805: 108882 | F3805: 108883 | G3805: 108883 | J3805: =IF(MOD(RC[-9],10)=2,3,"") ->  | K3805: 3
A3806: 189091 | B3806: 108885 | C3806: 108881 | D3806: 108882 | E3806: 108883 | F3806: 108885 | G3806: 108884 | J3806: =IF(MOD(RC[-9],10)=2,3,"") ->  | K3806: 3
A3807: 189100 | B3807: 108890 | C3807: 108890 | D3807: 108890 | E3807: 108892 | F3807: 108894 | G3807: 0 | J3807: =IF(MOD(RC[-9],10)=2,3,"") ->  | K3807: 3
A3808: 189101 | B3808: 108891 | C3808: 108891 | D3808: 108891 | E3808: 108892 | F3808: 108893 | G3808: 0 | J3808: =IF(MOD(RC[-9],10)=2,3,"") ->  | K3808: 3
A3809: 189102 | B3809: 108895 | C3809: 108890 | D3809: 108891 | E3809: 108894 | F3809: 108895 | G3809: 0 | I3809: 0.1 | J3809: =IF(MOD(RC[-9],10)=2,3,"") -> 3 | K3809: 3
A3810: 190010 | B3810: 108900 | C3810: 108900 | D3810: 108901 | E3810: 108902 | F3810: 108903 | G3810: 108904 | J3810: =IF(MOD(RC[-9],10)=2,3,"") ->  | K3810: 3
A3811: 190020 | B3811: 108911 | C3811: 108911 | D3811: 108911 | E3811: 108912 | F3811: 108912 | G3811: 108914 | J3811: =IF(MOD(RC[-9],10)=2,3,"") ->  | K3811: 3
A3812: 190030 | B3812: 108924 | C3812: 108920 | D3812: 108921 | E3812: 108922 | F3812: 108923 | G3812: 108923 | J3812: =IF(MOD(RC[-9],10)=2,3,"") ->  | K3812: 3
A3813: 190031 | B3813: 108925 | C3813: 108921 | D3813: 108922 | E3813: 108923 | F3813: 108925 | G3813: 108924 | J3813: =IF(MOD(RC[-9],10)=2,3,"") ->  | K3813: 3
A3814: 190040 | B3814: 108931 | C3814: 108931 | D3814: 108931 | E3814: 108931 | F3814: 108932 | G3814: 108932 | J3814: =IF(MOD(RC[-9],10)=2,3,"") ->  | K3814: 3
A3815: 190050 | B3815: 108943 | C3815: 108940 | D3815: 108940 | E3815: 108943 | F3815: 108943 | G3815: 108944 | J3815: =IF(MOD(RC[-9],10)=2,3,"") ->  | K3815: 3
A3816: 190060 | B3816: 108950 | C3816: 108950 | D3816: 108950 | E3816: 108951 | F3816: 108953 | G3816: 108954 | J3816: =IF(MOD(RC[-9],10)=2,3,"") ->  | K3816: 3
A3817: 190061 | B3817: 108955 | C3817: 108951 | D3817: 108952 | E3817: 108953 | F3817: 108955 | G3817: 108954 | J3817: =IF(MOD(RC[-9],10)=2,3,"") ->  | K3817: 3
A3818: 190070 | B3818: 108962 | C3818: 108961 | D3818: 108961 | E3818: 108962 | F3818: 108962 | G3818: 108964 | J3818: =IF(MOD(RC[-9],10)=2,3,"") ->  | K3818: 3
A3819: 190080 | B3819: 108970 | C3819: 108970 | D3819: 108970 | E3819: 108970 | F3819: 108973 | G3819: 108974 | J3819: =IF(MOD(RC[-9],10)=2,3,"") ->  | K3819: 3
A3820: 190090 | B3820: 108984 | C3820: 108980 | D3820: 108981 | E3820: 108982 | F3820: 108983 | G3820: 108983 | J3820: =IF(MOD(RC[-9],10)=2,3,"") ->  | K3820: 3
A3821: 190091 | B3821: 108985 | C3821: 108981 | D3821: 108982 | E3821: 108983 | F3821: 108985 | G3821: 108984 | J3821: =IF(MOD(RC[-9],10)=2,3,"") ->  | K3821: 3
A3822: 190100 | B3822: 108990 | C3822: 108990 | D3822: 108990 | E3822: 108992 | F3822: 108994 | G3822: 0 | J3822: =IF(MOD(RC[-9],10)=2,3,"") ->  | K3822: 3
A3823: 190101 | B3823: 108991 | C3823: 108991 | D3823: 108991 | E3823: 108992 | F3823: 108993 | G3823: 0 | J3823: =IF(MOD(RC[-9],10)=2,3,"") ->  | K3823: 3
A3824: 190102 | B3824: 108995 | C3824: 108990 | D3824: 108991 | E3824: 108994 | F3824: 108995 | G3824: 0 | I3824: 0.1 | J3824: =IF(MOD(RC[-9],10)=2,3,"") -> 3 | K3824: 3
A3825: 191010 | B3825: 109000 | C3825: 109000 | D3825: 109001 | E3825: 109002 | F3825: 109003 | G3825: 109004 | J3825: =IF(MOD(RC[-9],10)=2,3,"") ->  | K3825: 3
A3826: 191020 | B3826: 109011 | C3826: 109011 | D3826: 109011 | E3826: 109012 | F3826: 109012 | G3826: 109014 | J3826: =IF(MOD(RC[-9],10)=2,3,"") ->  | K3826: 3
A3827: 191030 | B3827: 109024 | C3827: 109020 | D3827: 109021 | E3827: 109022 | F3827: 109023 | G3827: 109023 | J3827: =IF(MOD(RC[-9],10)=2,3,"") ->  | K3827: 3
A3828: 191031 | B3828: 109025 | C3828: 109021 | D3828: 109022 | E3828: 109023 | F3828: 109025 | G3828: 109024 | J3828: =IF(MOD(RC[-9],10)=2,3,"") ->  | K3828: 3
A3829: 191040 | B3829: 109031 | C3829: 109031 | D3829: 109031 | E3829: 109031 | F3829: 109032 | G3829: 109032 | J3829: =IF(MOD(RC[-9],10)=2,3,"") ->  | K3829: 3
A3830: 191050 | B3830: 109043 | C3830: 109040 | D3830: 109040 | E3830: 109043 | F3830: 109043 | G3830: 109044 | J3830: =IF(MOD(RC[-9],10)=2,3,"") ->  | K3830: 3
A3831: 191060 | B3831: 109050 | C3831: 109050 | D3831: 109050 | E3831: 109051 | F3831: 109053 | G3831: 109054 | J3831: =IF(MOD(RC[-9],10)=2,3,"") ->  | K3831: 3
A3832: 191061 | B3832: 109055 | C3832: 109051 | D3832: 109052 | E3832: 109053 | F3832: 109055 | G3832: 109054 | J3832: =IF(MOD(RC[-9],10)=2,3,"") ->  | K3832: 3
A3833: 191070 | B3833: 109062 | C3833: 109061 | D3833: 109061 | E3833: 109062 | F3833: 109062 | G3833: 109064 | J3833: =IF(MOD(RC[-9],10)=2,3,"") ->  | K3833: 3
A3834: 191080 | B3834: 109070 | C3834: 109070 | D3834: 109070 | E3834: 109070 | F3834: 109073 | G3834: 109074 | J3834: =IF(MOD(RC[-9],10)=2,3,"") ->  | K3834: 3
A3835: 191090 | B3835: 109084 | C3835: 109080 | D3835: 109081 | E3835: 109082 | F3835: 109083 | G3835: 109083 | J3835: =IF(MOD(RC[-9],10)=2,3,"") ->  | K3835: 3
A3836: 191091 | B3836: 109085 | C3836: 109081 | D3836: 109082 | E3836: 109083 | F3836: 109085 | G3836: 109084 | J3836: =IF(MOD(RC[-9],10)=2,3,"") ->  | K3836: 3
A3837: 191100 | B3837: 109090 | C3837: 109090 | D3837: 109090 | E3837: 109092 | F3837: 109094 | G3837: 0 | J3837: =IF(MOD(RC[-9],10)=2,3,"") ->  | K3837: 3
A3838: 191101 | B3838: 109091 | C3838: 109091 | D3838: 109091 | E3838: 109092 | F3838: 109093 | G3838: 0 | J3838: =IF(MOD(RC[-9],10)=2,3,"") ->  | K3838: 3
A3839: 191102 | B3839: 109095 | C3839: 109090 | D3839: 109091 | E3839: 109094 | F3839: 109095 | G3839: 0 | I3839: 0.1 | J3839: =IF(MOD(RC[-9],10)=2,3,"") -> 3 | K3839: 3
A3840: 192010 | B3840: 109100 | C3840: 109100 | D3840: 109101 | E3840: 109102 | F3840: 109103 | G3840: 109104 | J3840: =IF(MOD(RC[-9],10)=2,3,"") ->  | K3840: 3
A3841: 192020 | B3841: 109111 | C3841: 109111 | D3841: 109111 | E3841: 109112 | F3841: 109112 | G3841: 109114 | J3841: =IF(MOD(RC[-9],10)=2,3,"") ->  | K3841: 3
A3842: 192030 | B3842: 109124 | C3842: 109120 | D3842: 109121 | E3842: 109122 | F3842: 109123 | G3842: 109123 | J3842: =IF(MOD(RC[-9],10)=2,3,"") ->  | K3842: 3
A3843: 192031 | B3843: 109125 | C3843: 109121 | D3843: 109122 | E3843: 109123 | F3843: 109125 | G3843: 109124 | J3843: =IF(MOD(RC[-9],10)=2,3,"") ->  | K3843: 3
A3844: 192040 | B3844: 109131 | C3844: 109131 | D3844: 109131 | E3844: 109131 | F3844: 109132 | G3844: 109132 | J3844: =IF(MOD(RC[-9],10)=2,3,"") ->  | K3844: 3
A3845: 192050 | B3845: 109143 | C3845: 109140 | D3845: 109140 | E3845: 109143 | F3845: 109143 | G3845: 109144 | J3845: =IF(MOD(RC[-9],10)=2,3,"") ->  | K3845: 3
A3846: 192060 | B3846: 109150 | C3846: 109150 | D3846: 109150 | E3846: 109151 | F3846: 109153 | G3846: 109154 | J3846: =IF(MOD(RC[-9],10)=2,3,"") ->  | K3846: 3
A3847: 192061 | B3847: 109155 | C3847: 109151 | D3847: 109152 | E3847: 109153 | F3847: 109155 | G3847: 109154 | J3847: =IF(MOD(RC[-9],10)=2,3,"") ->  | K3847: 3
A3848: 192070 | B3848: 109162 | C3848: 109161 | D3848: 109161 | E3848: 109162 | F3848: 109162 | G3848: 109164 | J3848: =IF(MOD(RC[-9],10)=2,3,"") ->  | K3848: 3
A3849: 192080 | B3849: 109170 | C3849: 109170 | D3849: 109170 | E3849: 109170 | F3849: 109173 | G3849: 109174 | J3849: =IF(MOD(RC[-9],10)=2,3,"") ->  | K3849: 3
A3850: 192090 | B3850: 109184 | C3850: 109180 | D3850: 109181 | E3850: 109182 | F3850: 109183 | G3850: 109183 | J3850: =IF(MOD(RC[-9],10)=2,3,"") ->  | K3850: 3
A3851: 192091 | B3851: 109185 | C3851: 109181 | D3851: 109182 | E3851: 109183 | F3851: 109185 | G3851: 109184 | J3851: =IF(MOD(RC[-9],10)=2,3,"") ->  | K3851: 3
A3852: 192100 | B3852: 109190 | C3852: 109190 | D3852: 109190 | E3852: 109192 | F3852: 109194 | G3852: 0 | J3852: =IF(MOD(RC[-9],10)=2,3,"") ->  | K3852: 3
A3853: 192101 | B3853: 109191 | C3853: 109191 | D3853: 109191 | E3853: 109192 | F3853: 109193 | G3853: 0 | J3853: =IF(MOD(RC[-9],10)=2,3,"") ->  | K3853: 3
A3854: 192102 | B3854: 109195 | C3854: 109190 | D3854: 109191 | E3854: 109194 | F3854: 109195 | G3854: 0 | I3854: 0.1 | J3854: =IF(MOD(RC[-9],10)=2,3,"") -> 3 | K3854: 3
A3855: 193010 | B3855: 109200 | C3855: 109200 | D3855: 109201 | E3855: 109202 | F3855: 109203 | G3855: 109204 | J3855: =IF(MOD(RC[-9],10)=2,3,"") ->  | K3855: 3
A3856: 193020 | B3856: 109211 | C3856: 109211 | D3856: 109211 | E3856: 109212 | F3856: 109212 | G3856: 109214 | J3856: =IF(MOD(RC[-9],10)=2,3,"") ->  | K3856: 3
A3857: 193030 | B3857: 109224 | C3857: 109220 | D3857: 109221 | E3857: 109222 | F3857: 109223 | G3857: 109223 | J3857: =IF(MOD(RC[-9],10)=2,3,"") ->  | K3857: 3
A3858: 193031 | B3858: 109225 | C3858: 109221 | D3858: 109222 | E3858: 109223 | F3858: 109225 | G3858: 109224 | J3858: =IF(MOD(RC[-9],10)=2,3,"") ->  | K3858: 3
A3859: 193040 | B3859: 109231 | C3859: 109231 | D3859: 109231 | E3859: 109231 | F3859: 109232 | G3859: 109232 | J3859: =IF(MOD(RC[-9],10)=2,3,"") ->  | K3859: 3
A3860: 193050 | B3860: 109243 | C3860: 109240 | D3860: 109240 | E3860: 109243 | F3860: 109243 | G3860: 109244 | J3860: =IF(MOD(RC[-9],10)=2,3,"") ->  | K3860: 3
A3861: 193060 | B3861: 109250 | C3861: 109250 | D3861: 109250 | E3861: 109251 | F3861: 109253 | G3861: 109254 | J3861: =IF(MOD(RC[-9],10)=2,3,"") ->  | K3861: 3
A3862: 193061 | B3862: 109255 | C3862: 109251 | D3862: 109252 | E3862: 109253 | F3862: 109255 | G3862: 109254 | J3862: =IF(MOD(RC[-9],10)=2,3,"") ->  | K3862: 3
A3863: 193070 | B3863: 109262 | C3863: 109261 | D3863: 109261 | E3863: 109262 | F3863: 109262 | G3863: 109264 | J3863: =IF(MOD(RC[-9],10)=2,3,"") ->  | K3863: 3
A3864: 193080 | B3864: 109270 | C3864: 109270 | D3864: 109270 | E3864: 109270 | F3864: 109273 | G3864: 109274 | J3864: =IF(MOD(RC[-9],10)=2,3,"") ->  | K3864: 3
A3865: 193090 | B3865: 109284 | C3865: 109280 | D3865: 109281 | E3865: 109282 | F3865: 109283 | G3865: 109283 | J3865: =IF(MOD(RC[-9],10)=2,3,"") ->  | K3865: 3
A3866: 193091 | B3866: 109285 | C3866: 109281 | D3866: 109282 | E3866: 109283 | F3866: 109285 | G3866: 109284 | J3866: =IF(MOD(RC[-9],10)=2,3,"") ->  | K3866: 3
A3867: 193100 | B3867: 109290 | C3867: 109290 | D3867: 109290 | E3867: 109292 | F3867: 109294 | G3867: 0 | J3867: =IF(MOD(RC[-9],10)=2,3,"") ->  | K3867: 3
A3868: 193101 | B3868: 109291 | C3868: 109291 | D3868: 109291 | E3868: 109292 | F3868: 109293 | G3868: 0 | J3868: =IF(MOD(RC[-9],10)=2,3,"") ->  | K3868: 3
A3869: 193102 | B3869: 109295 | C3869: 109290 | D3869: 109291 | E3869: 109294 | F3869: 109295 | G3869: 0 | I3869: 0.1 | J3869: =IF(MOD(RC[-9],10)=2,3,"") -> 3 | K3869: 3
A3870: 194010 | B3870: 109300 | C3870: 109300 | D3870: 109301 | E3870: 109302 | F3870: 109303 | G3870: 109304 | J3870: =IF(MOD(RC[-9],10)=2,3,"") ->  | K3870: 3
A3871: 194020 | B3871: 109311 | C3871: 109311 | D3871: 109311 | E3871: 109312 | F3871: 109312 | G3871: 109314 | J3871: =IF(MOD(RC[-9],10)=2,3,"") ->  | K3871: 3
A3872: 194030 | B3872: 109324 | C3872: 109320 | D3872: 109321 | E3872: 109322 | F3872: 109323 | G3872: 109323 | J3872: =IF(MOD(RC[-9],10)=2,3,"") ->  | K3872: 3
A3873: 194031 | B3873: 109325 | C3873: 109321 | D3873: 109322 | E3873: 109323 | F3873: 109325 | G3873: 109324 | J3873: =IF(MOD(RC[-9],10)=2,3,"") ->  | K3873: 3
A3874: 194040 | B3874: 109331 | C3874: 109331 | D3874: 109331 | E3874: 109331 | F3874: 109332 | G3874: 109332 | J3874: =IF(MOD(RC[-9],10)=2,3,"") ->  | K3874: 3
A3875: 194050 | B3875: 109343 | C3875: 109340 | D3875: 109340 | E3875: 109343 | F3875: 109343 | G3875: 109344 | J3875: =IF(MOD(RC[-9],10)=2,3,"") ->  | K3875: 3
A3876: 194060 | B3876: 109350 | C3876: 109350 | D3876: 109350 | E3876: 109351 | F3876: 109353 | G3876: 109354 | J3876: =IF(MOD(RC[-9],10)=2,3,"") ->  | K3876: 3
A3877: 194061 | B3877: 109355 | C3877: 109351 | D3877: 109352 | E3877: 109353 | F3877: 109355 | G3877: 109354 | J3877: =IF(MOD(RC[-9],10)=2,3,"") ->  | K3877: 3
A3878: 194070 | B3878: 109362 | C3878: 109361 | D3878: 109361 | E3878: 109362 | F3878: 109362 | G3878: 109364 | J3878: =IF(MOD(RC[-9],10)=2,3,"") ->  | K3878: 3
A3879: 194080 | B3879: 109370 | C3879: 109370 | D3879: 109370 | E3879: 109370 | F3879: 109373 | G3879: 109374 | J3879: =IF(MOD(RC[-9],10)=2,3,"") ->  | K3879: 3
A3880: 194090 | B3880: 109384 | C3880: 109380 | D3880: 109381 | E3880: 109382 | F3880: 109383 | G3880: 109383 | J3880: =IF(MOD(RC[-9],10)=2,3,"") ->  | K3880: 3
A3881: 194091 | B3881: 109385 | C3881: 109381 | D3881: 109382 | E3881: 109383 | F3881: 109385 | G3881: 109384 | J3881: =IF(MOD(RC[-9],10)=2,3,"") ->  | K3881: 3
A3882: 194100 | B3882: 109390 | C3882: 109390 | D3882: 109390 | E3882: 109392 | F3882: 109394 | G3882: 0 | J3882: =IF(MOD(RC[-9],10)=2,3,"") ->  | K3882: 3
A3883: 194101 | B3883: 109391 | C3883: 109391 | D3883: 109391 | E3883: 109392 | F3883: 109393 | G3883: 0 | J3883: =IF(MOD(RC[-9],10)=2,3,"") ->  | K3883: 3
A3884: 194102 | B3884: 109395 | C3884: 109390 | D3884: 109391 | E3884: 109394 | F3884: 109395 | G3884: 0 | I3884: 0.1 | J3884: =IF(MOD(RC[-9],10)=2,3,"") -> 3 | K3884: 3
A3885: 195010 | B3885: 109400 | C3885: 109400 | D3885: 109401 | E3885: 109402 | F3885: 109403 | G3885: 109404 | J3885: =IF(MOD(RC[-9],10)=2,3,"") ->  | K3885: 3
A3886: 195020 | B3886: 109411 | C3886: 109411 | D3886: 109411 | E3886: 109412 | F3886: 109412 | G3886: 109414 | J3886: =IF(MOD(RC[-9],10)=2,3,"") ->  | K3886: 3
A3887: 195030 | B3887: 109424 | C3887: 109420 | D3887: 109421 | E3887: 109422 | F3887: 109423 | G3887: 109423 | J3887: =IF(MOD(RC[-9],10)=2,3,"") ->  | K3887: 3
A3888: 195031 | B3888: 109425 | C3888: 109421 | D3888: 109422 | E3888: 109423 | F3888: 109425 | G3888: 109424 | J3888: =IF(MOD(RC[-9],10)=2,3,"") ->  | K3888: 3
A3889: 195040 | B3889: 109431 | C3889: 109431 | D3889: 109431 | E3889: 109431 | F3889: 109432 | G3889: 109432 | J3889: =IF(MOD(RC[-9],10)=2,3,"") ->  | K3889: 3
A3890: 195050 | B3890: 109443 | C3890: 109440 | D3890: 109440 | E3890: 109443 | F3890: 109443 | G3890: 109444 | J3890: =IF(MOD(RC[-9],10)=2,3,"") ->  | K3890: 3
A3891: 195060 | B3891: 109450 | C3891: 109450 | D3891: 109450 | E3891: 109451 | F3891: 109453 | G3891: 109454 | J3891: =IF(MOD(RC[-9],10)=2,3,"") ->  | K3891: 3
A3892: 195061 | B3892: 109455 | C3892: 109451 | D3892: 109452 | E3892: 109453 | F3892: 109455 | G3892: 109454 | J3892: =IF(MOD(RC[-9],10)=2,3,"") ->  | K3892: 3
A3893: 195070 | B3893: 109462 | C3893: 109461 | D3893: 109461 | E3893: 109462 | F3893: 109462 | G3893: 109464 | J3893: =IF(MOD(RC[-9],10)=2,3,"") ->  | K3893: 3
A3894: 195080 | B3894: 109470 | C3894: 109470 | D3894: 109470 | E3894: 109470 | F3894: 109473 | G3894: 109474 | J3894: =IF(MOD(RC[-9],10)=2,3,"") ->  | K3894: 3
A3895: 195090 | B3895: 109484 | C3895: 109480 | D3895: 109481 | E3895: 109482 | F3895: 109483 | G3895: 109483 | J3895: =IF(MOD(RC[-9],10)=2,3,"") ->  | K3895: 3
A3896: 195091 | B3896: 109485 | C3896: 109481 | D3896: 109482 | E3896: 109483 | F3896: 109485 | G3896: 109484 | J3896: =IF(MOD(RC[-9],10)=2,3,"") ->  | K3896: 3
A3897: 195100 | B3897: 109490 | C3897: 109490 | D3897: 109490 | E3897: 109492 | F3897: 109494 | G3897: 0 | J3897: =IF(MOD(RC[-9],10)=2,3,"") ->  | K3897: 3
A3898: 195101 | B3898: 109491 | C3898: 109491 | D3898: 109491 | E3898: 109492 | F3898: 109493 | G3898: 0 | J3898: =IF(MOD(RC[-9],10)=2,3,"") ->  | K3898: 3
A3899: 195102 | B3899: 109495 | C3899: 109490 | D3899: 109491 | E3899: 109494 | F3899: 109495 | G3899: 0 | I3899: 0.1 | J3899: =IF(MOD(RC[-9],10)=2,3,"") -> 3 | K3899: 3
A3900: 196010 | B3900: 109500 | C3900: 109500 | D3900: 109501 | E3900: 109502 | F3900: 109503 | G3900: 109504 | J3900: =IF(MOD(RC[-9],10)=2,3,"") ->  | K3900: 3
A3901: 196020 | B3901: 109511 | C3901: 109511 | D3901: 109511 | E3901: 109512 | F3901: 109512 | G3901: 109514 | J3901: =IF(MOD(RC[-9],10)=2,3,"") ->  | K3901: 3
A3902: 196030 | B3902: 109524 | C3902: 109520 | D3902: 109521 | E3902: 109522 | F3902: 109523 | G3902: 109523 | J3902: =IF(MOD(RC[-9],10)=2,3,"") ->  | K3902: 3
A3903: 196031 | B3903: 109525 | C3903: 109521 | D3903: 109522 | E3903: 109523 | F3903: 109525 | G3903: 109524 | J3903: =IF(MOD(RC[-9],10)=2,3,"") ->  | K3903: 3
A3904: 196040 | B3904: 109531 | C3904: 109531 | D3904: 109531 | E3904: 109531 | F3904: 109532 | G3904: 109532 | J3904: =IF(MOD(RC[-9],10)=2,3,"") ->  | K3904: 3
A3905: 196050 | B3905: 109543 | C3905: 109540 | D3905: 109540 | E3905: 109543 | F3905: 109543 | G3905: 109544 | J3905: =IF(MOD(RC[-9],10)=2,3,"") ->  | K3905: 3
A3906: 196060 | B3906: 109550 | C3906: 109550 | D3906: 109550 | E3906: 109551 | F3906: 109553 | G3906: 109554 | J3906: =IF(MOD(RC[-9],10)=2,3,"") ->  | K3906: 3
A3907: 196061 | B3907: 109555 | C3907: 109551 | D3907: 109552 | E3907: 109553 | F3907: 109555 | G3907: 109554 | J3907: =IF(MOD(RC[-9],10)=2,3,"") ->  | K3907: 3
A3908: 196070 | B3908: 109562 | C3908: 109561 | D3908: 109561 | E3908: 109562 | F3908: 109562 | G3908: 109564 | J3908: =IF(MOD(RC[-9],10)=2,3,"") ->  | K3908: 3
A3909: 196080 | B3909: 109570 | C3909: 109570 | D3909: 109570 | E3909: 109570 | F3909: 109573 | G3909: 109574 | J3909: =IF(MOD(RC[-9],10)=2,3,"") ->  | K3909: 3
A3910: 196090 | B3910: 109584 | C3910: 109580 | D3910: 109581 | E3910: 109582 | F3910: 109583 | G3910: 109583 | J3910: =IF(MOD(RC[-9],10)=2,3,"") ->  | K3910: 3
A3911: 196091 | B3911: 109585 | C3911: 109581 | D3911: 109582 | E3911: 109583 | F3911: 109585 | G3911: 109584 | J3911: =IF(MOD(RC[-9],10)=2,3,"") ->  | K3911: 3
A3912: 196100 | B3912: 109590 | C3912: 109590 | D3912: 109590 | E3912: 109592 | F3912: 109594 | G3912: 0 | J3912: =IF(MOD(RC[-9],10)=2,3,"") ->  | K3912: 3
A3913: 196101 | B3913: 109591 | C3913: 109591 | D3913: 109591 | E3913: 109592 | F3913: 109593 | G3913: 0 | J3913: =IF(MOD(RC[-9],10)=2,3,"") ->  | K3913: 3
A3914: 196102 | B3914: 109595 | C3914: 109590 | D3914: 109591 | E3914: 109594 | F3914: 109595 | G3914: 0 | I3914: 0.1 | J3914: =IF(MOD(RC[-9],10)=2,3,"") -> 3 | K3914: 3
A3915: 197010 | B3915: 109600 | C3915: 109600 | D3915: 109601 | E3915: 109602 | F3915: 109603 | G3915: 109604 | J3915: =IF(MOD(RC[-9],10)=2,3,"") ->  | K3915: 3
A3916: 197020 | B3916: 109611 | C3916: 109611 | D3916: 109611 | E3916: 109612 | F3916: 109612 | G3916: 109614 | J3916: =IF(MOD(RC[-9],10)=2,3,"") ->  | K3916: 3
A3917: 197030 | B3917: 109624 | C3917: 109620 | D3917: 109621 | E3917: 109622 | F3917: 109623 | G3917: 109623 | J3917: =IF(MOD(RC[-9],10)=2,3,"") ->  | K3917: 3
A3918: 197031 | B3918: 109625 | C3918: 109621 | D3918: 109622 | E3918: 109623 | F3918: 109625 | G3918: 109624 | J3918: =IF(MOD(RC[-9],10)=2,3,"") ->  | K3918: 3
A3919: 197040 | B3919: 109631 | C3919: 109631 | D3919: 109631 | E3919: 109631 | F3919: 109632 | G3919: 109632 | J3919: =IF(MOD(RC[-9],10)=2,3,"") ->  | K3919: 3
A3920: 197050 | B3920: 109643 | C3920: 109640 | D3920: 109640 | E3920: 109643 | F3920: 109643 | G3920: 109644 | J3920: =IF(MOD(RC[-9],10)=2,3,"") ->  | K3920: 3
A3921: 197060 | B3921: 109650 | C3921: 109650 | D3921: 109650 | E3921: 109651 | F3921: 109653 | G3921: 109654 | J3921: =IF(MOD(RC[-9],10)=2,3,"") ->  | K3921: 3
A3922: 197061 | B3922: 109655 | C3922: 109651 | D3922: 109652 | E3922: 109653 | F3922: 109655 | G3922: 109654 | J3922: =IF(MOD(RC[-9],10)=2,3,"") ->  | K3922: 3
A3923: 197070 | B3923: 109662 | C3923: 109661 | D3923: 109661 | E3923: 109662 | F3923: 109662 | G3923: 109664 | J3923: =IF(MOD(RC[-9],10)=2,3,"") ->  | K3923: 3
A3924: 197080 | B3924: 109670 | C3924: 109670 | D3924: 109670 | E3924: 109670 | F3924: 109673 | G3924: 109674 | J3924: =IF(MOD(RC[-9],10)=2,3,"") ->  | K3924: 3
A3925: 197090 | B3925: 109684 | C3925: 109680 | D3925: 109681 | E3925: 109682 | F3925: 109683 | G3925: 109683 | J3925: =IF(MOD(RC[-9],10)=2,3,"") ->  | K3925: 3
A3926: 197091 | B3926: 109685 | C3926: 109681 | D3926: 109682 | E3926: 109683 | F3926: 109685 | G3926: 109684 | J3926: =IF(MOD(RC[-9],10)=2,3,"") ->  | K3926: 3
A3927: 197100 | B3927: 109690 | C3927: 109690 | D3927: 109690 | E3927: 109692 | F3927: 109694 | G3927: 0 | J3927: =IF(MOD(RC[-9],10)=2,3,"") ->  | K3927: 3
A3928: 197101 | B3928: 109691 | C3928: 109691 | D3928: 109691 | E3928: 109692 | F3928: 109693 | G3928: 0 | J3928: =IF(MOD(RC[-9],10)=2,3,"") ->  | K3928: 3
A3929: 197102 | B3929: 109695 | C3929: 109690 | D3929: 109691 | E3929: 109694 | F3929: 109695 | G3929: 0 | I3929: 0.1 | J3929: =IF(MOD(RC[-9],10)=2,3,"") -> 3 | K3929: 3
A3930: 198010 | B3930: 109700 | C3930: 109700 | D3930: 109701 | E3930: 109702 | F3930: 109703 | G3930: 109704 | J3930: =IF(MOD(RC[-9],10)=2,3,"") ->  | K3930: 3
A3931: 198020 | B3931: 109711 | C3931: 109711 | D3931: 109711 | E3931: 109712 | F3931: 109712 | G3931: 109714 | J3931: =IF(MOD(RC[-9],10)=2,3,"") ->  | K3931: 3
A3932: 198030 | B3932: 109724 | C3932: 109720 | D3932: 109721 | E3932: 109722 | F3932: 109723 | G3932: 109723 | J3932: =IF(MOD(RC[-9],10)=2,3,"") ->  | K3932: 3
A3933: 198031 | B3933: 109725 | C3933: 109721 | D3933: 109722 | E3933: 109723 | F3933: 109725 | G3933: 109724 | J3933: =IF(MOD(RC[-9],10)=2,3,"") ->  | K3933: 3
A3934: 198040 | B3934: 109731 | C3934: 109731 | D3934: 109731 | E3934: 109731 | F3934: 109732 | G3934: 109732 | J3934: =IF(MOD(RC[-9],10)=2,3,"") ->  | K3934: 3
A3935: 198050 | B3935: 109743 | C3935: 109740 | D3935: 109740 | E3935: 109743 | F3935: 109743 | G3935: 109744 | J3935: =IF(MOD(RC[-9],10)=2,3,"") ->  | K3935: 3
A3936: 198060 | B3936: 109750 | C3936: 109750 | D3936: 109750 | E3936: 109751 | F3936: 109753 | G3936: 109754 | J3936: =IF(MOD(RC[-9],10)=2,3,"") ->  | K3936: 3
A3937: 198061 | B3937: 109755 | C3937: 109751 | D3937: 109752 | E3937: 109753 | F3937: 109755 | G3937: 109754 | J3937: =IF(MOD(RC[-9],10)=2,3,"") ->  | K3937: 3
A3938: 198070 | B3938: 109762 | C3938: 109761 | D3938: 109761 | E3938: 109762 | F3938: 109762 | G3938: 109764 | J3938: =IF(MOD(RC[-9],10)=2,3,"") ->  | K3938: 3
A3939: 198080 | B3939: 109770 | C3939: 109770 | D3939: 109770 | E3939: 109770 | F3939: 109773 | G3939: 109774 | J3939: =IF(MOD(RC[-9],10)=2,3,"") ->  | K3939: 3
A3940: 198090 | B3940: 109784 | C3940: 109780 | D3940: 109781 | E3940: 109782 | F3940: 109783 | G3940: 109783 | J3940: =IF(MOD(RC[-9],10)=2,3,"") ->  | K3940: 3
A3941: 198091 | B3941: 109785 | C3941: 109781 | D3941: 109782 | E3941: 109783 | F3941: 109785 | G3941: 109784 | J3941: =IF(MOD(RC[-9],10)=2,3,"") ->  | K3941: 3
A3942: 198100 | B3942: 109790 | C3942: 109790 | D3942: 109790 | E3942: 109792 | F3942: 109794 | G3942: 0 | J3942: =IF(MOD(RC[-9],10)=2,3,"") ->  | K3942: 3
A3943: 198101 | B3943: 109791 | C3943: 109791 | D3943: 109791 | E3943: 109792 | F3943: 109793 | G3943: 0 | J3943: =IF(MOD(RC[-9],10)=2,3,"") ->  | K3943: 3
A3944: 198102 | B3944: 109795 | C3944: 109790 | D3944: 109791 | E3944: 109794 | F3944: 109795 | G3944: 0 | I3944: 0.1 | J3944: =IF(MOD(RC[-9],10)=2,3,"") -> 3 | K3944: 3
A3945: 199010 | B3945: 109800 | C3945: 109800 | D3945: 109801 | E3945: 109802 | F3945: 109803 | G3945: 109804 | J3945: =IF(MOD(RC[-9],10)=2,3,"") ->  | K3945: 3
A3946: 199020 | B3946: 109811 | C3946: 109811 | D3946: 109811 | E3946: 109812 | F3946: 109812 | G3946: 109814 | J3946: =IF(MOD(RC[-9],10)=2,3,"") ->  | K3946: 3
A3947: 199030 | B3947: 109824 | C3947: 109820 | D3947: 109821 | E3947: 109822 | F3947: 109823 | G3947: 109823 | J3947: =IF(MOD(RC[-9],10)=2,3,"") ->  | K3947: 3
A3948: 199031 | B3948: 109825 | C3948: 109821 | D3948: 109822 | E3948: 109823 | F3948: 109825 | G3948: 109824 | J3948: =IF(MOD(RC[-9],10)=2,3,"") ->  | K3948: 3
A3949: 199040 | B3949: 109831 | C3949: 109831 | D3949: 109831 | E3949: 109831 | F3949: 109832 | G3949: 109832 | J3949: =IF(MOD(RC[-9],10)=2,3,"") ->  | K3949: 3
A3950: 199050 | B3950: 109843 | C3950: 109840 | D3950: 109840 | E3950: 109843 | F3950: 109843 | G3950: 109844 | J3950: =IF(MOD(RC[-9],10)=2,3,"") ->  | K3950: 3
A3951: 199060 | B3951: 109850 | C3951: 109850 | D3951: 109850 | E3951: 109851 | F3951: 109853 | G3951: 109854 | J3951: =IF(MOD(RC[-9],10)=2,3,"") ->  | K3951: 3
A3952: 199061 | B3952: 109855 | C3952: 109851 | D3952: 109852 | E3952: 109853 | F3952: 109855 | G3952: 109854 | J3952: =IF(MOD(RC[-9],10)=2,3,"") ->  | K3952: 3
A3953: 199070 | B3953: 109862 | C3953: 109861 | D3953: 109861 | E3953: 109862 | F3953: 109862 | G3953: 109864 | J3953: =IF(MOD(RC[-9],10)=2,3,"") ->  | K3953: 3
A3954: 199080 | B3954: 109870 | C3954: 109870 | D3954: 109870 | E3954: 109870 | F3954: 109873 | G3954: 109874 | J3954: =IF(MOD(RC[-9],10)=2,3,"") ->  | K3954: 3
A3955: 199090 | B3955: 109884 | C3955: 109880 | D3955: 109881 | E3955: 109882 | F3955: 109883 | G3955: 109883 | J3955: =IF(MOD(RC[-9],10)=2,3,"") ->  | K3955: 3
A3956: 199091 | B3956: 109885 | C3956: 109881 | D3956: 109882 | E3956: 109883 | F3956: 109885 | G3956: 109884 | J3956: =IF(MOD(RC[-9],10)=2,3,"") ->  | K3956: 3
A3957: 199100 | B3957: 109890 | C3957: 109890 | D3957: 109890 | E3957: 109892 | F3957: 109894 | G3957: 0 | J3957: =IF(MOD(RC[-9],10)=2,3,"") ->  | K3957: 3
A3958: 199101 | B3958: 109891 | C3958: 109891 | D3958: 109891 | E3958: 109892 | F3958: 109893 | G3958: 0 | J3958: =IF(MOD(RC[-9],10)=2,3,"") ->  | K3958: 3
A3959: 199102 | B3959: 109895 | C3959: 109890 | D3959: 109891 | E3959: 109894 | F3959: 109895 | G3959: 0 | I3959: 0.1 | J3959: =IF(MOD(RC[-9],10)=2,3,"") -> 3 | K3959: 3

Sheet: Sheet1
A2: 303010 | F2: 英雄名称 | G2: 职业
A3: 303020 | F3: 红骷髅 | G3: 4
A4: 304300 | F4: 章鱼博士 | G4: 1
A5: 304000 | F5: 独眼巨人 | G5: 1
A6: 304310 | F6: 憎恶 | G6: 1
A7: 304100 | F7: 战争泰坦 | G7: 3
A8: 304010 | F8: 大地泰坦 | G8: 4
A9: 304200 | F9: 金鱼佬广广 | G9: 3
A10: 304020 | F10: 万圣节之影 | G10: 1
A11: 304030 | F11: 绿品传承核心 | G11: 1
A12: 304280 | F12: 蓝品传承核心 | G12: 1
A13: 304110 | F13: 紫品传承核心 | G13: 1
A14: 304380 | F14: 橙品传承核心 | G14: 1
A15: 304400 | F15: 红品传承核心 | G15: 1
A16: 304290 | F16: 见习警察 | G16: 1
A17: 304490 | F17: 机甲Ⅰ型 | G17: 2
A18: 313010 | F18: 激光Ⅰ型机 | G18: 3
A19: 313410 | F19: 炮火Ⅰ型机 | G19: 4
A20: 314000 | F20: 见习护士 | G20: 5
A21: 314400 | F21: 防暴警察 | G21: 1
A22: 314300 | F22: 机甲Ⅱ型 | G22: 2
A23: 314010 | F23: 激光Ⅱ型机 | G23: 3
A24: 314310 | F24: 炮火Ⅱ型机 | G24: 4
A25: 314020 | F25: 战地护士 | G25: 5
A26: 314030 | F26: 精英特警 | G26: 1
A27: 314200 | F27: 战争机甲 | G27: 2
A28: 314380 | F28: 激光Ⅲ型机 | G28: 3
A29: 314100 | F29: 炮火Ⅲ型机 | G29: 4
A30: 314080 | F30: 精英护士 | G30: 5
A31: 314410 | F31: 王牌特警 | G31: 1
A32: 314190 | F32: 新星机甲 | G32: 2
A33: 314390 | F33: 激光智能机 | G33: 3
A34: 323110 | F34: 炮火智能机 | G34: 4
A35: 323410 | F35: 白衣天使 | G35: 5
A36: 324100 | F36: 超级队长 | G36: 1
A37: 324110 | F37: 死亡武士 | G37: 1
A38: 324000 | F38: 红颅鬼 | G38: 4
A39: 324300 | F39: 终极队长 | G39: 1
A40: 324010 | F40: 雷神 | G40: 4
A41: 324310 | F41: 野蛮巨人 | G41: 2
A42: 324020 | F42: 致命特工 | G42: 1
A43: 324200 | F43: 鹰眸 | G43: 3
A44: 324280 | F44: 刀锋猎人 | G44: 1
A45: 324120 | F45: 地狱骑士 | G45: 1
A46: 324080 | F46: 铁人 | G46: 3
A47: 324400 | F47: 树人 | G47: 2
A48: 324090 | F48: 超凡博士 | G48: 4
A49: 324490 | F49: 白凤凰 | G49: 5
F50: 地狱铁拳 | G50: 3
F51: 混沌女巫 | G51: 5
F52: 黑暗骑士 | G52: 3
F53: 狼叔 | G53: 1
F54: 角斗士 | G54: 1
F55: 见习武士 | G55: 2
F56: 见习刺客 | G56: 3
F57: 黑魔学徒 | G57: 4
F58: 牧师学徒 | G58: 5
F59: 剑斗士 | G59: 1
F60: 高级武士 | G60: 2
F61: 高级刺客 | G61: 3
F62: 黑魔法师 | G62: 4
F63: 牧师 | G63: 5
F64: 百胜者 | G64: 1
F65: 盔甲武士 | G65: 2
F66: 弓弩刺客 | G66: 3
F67: 黑魔导师 | G67: 4
F68: 光明牧师 | G68: 5
F69: 角斗之王 | G69: 1
F70: 重甲武士 | G70: 2
F71: 阴影行者 | G71: 3
F72: 黑暗之手 | G72: 4
F73: 光明主教 | G73: 5
F74: 杰克船长 | G74: 1
F75: 天使长 | G75: 5
F76: 独眼巨人 | G76: 1
F77: 圣女贞德 | G77: 5
F78: 美杜莎 | G78: 4
F79: 德古拉伯爵 | G79: 1
F80: 狩猎女神 | G80: 4
F81: 查理大帝 | G81: 1
F82: 佐罗 | G82: 1
F83: 亚马逊女王 | G83: 3
F84: 宙斯 | G84: 4
F85: 斯巴达 | G85: 2
F86: 阿努比斯 | G86: 1
F87: 雅典娜 | G87: 5
F88: 大力神 | G88: 2
F89: 冥王哈迪斯 | G89: 4
F90: 潘多拉 | G90: 4
F91: 奎爷 | G91: 1
F92: 恶劣地精 | G92: 1
F93: 新生骷髅 | G93: 2
F94: 矮人民兵 | G94: 3
F95: 海元素 | G95: 4
F96: 水元素 | G96: 5
F97: 地精盗贼 | G97: 1
F98: 骷髅战士 | G98: 2
F99: 矮人火枪手 | G99: 3
F100: 高级海元素 | G100: 4
F101: 高级水元素 | G101: 5
F102: 地精大盗 | G102: 1
F103: 骷髅勇士 | G103: 2
F104: 精英火枪手 | G104: 3
F105: 海元素长老 | G105: 4
F106: 水元素长老 | G106: 5
F107: 窃神者 | G107: 1
F108: 骷髅王 | G108: 2
F109: 火枪之王 | G109: 3
F110: 海元素领主 | G110: 4
F111: 水元素领主 | G111: 5
F112: 石头人 | G112: 2
F113: 血源牧师 | G113: 5
F114: 憎恶 | G114: 2
F115: 树精 | G115: 2
F116: 牛头人 | G116: 1
F117: 火女 | G117: 4
F118: 半人马 | G118: 1
F119: 食人魔 | G119: 4
F120: 基伦 | G120: 1
F121: 女警 | G121: 3
F122: 小黑 | G122: 3
F123: 熊阿宝 | G123: 2
F124: 血色指挥官 | G124: 1
F125: 大检察官 | G125: 5
F126: 恶魔猎手 | G126: 1
F127: 神圣牧师 | G127: 5
F128: 巫妖之王 | G128: 1
F129: 钢铁酋长 | G129: 2