Sheet: Sheet1
A1: 服务端文件名 | B1: 服务端对应工作表号 | C1: 客户端文件名 | D1: 客户端对应工作表号 | E1: erl头部 | F1: erl内容格式 | G1: erl尾部 | H1: 客户端特殊处理
C2: config_up_prevue.cnf|UpPrevue | D2: 1 | F2: get(id) -> #$ | H2: 2=>id

Sheet: 升级预告
A1: id| | B1: team_lv| | C1: system_name| | D1: text| | E1: open_lv| | F1: system_type| | G1: icon_zoom|
A2: 不可空 | B2: 不可空 | C2: 不可空 | D2: 不可空 | E2: 不可空 | F2: 不可空 | G2: 不可空
A3: 数字 | B3: 数字 | C3: 一维数组 | D3: 一维数组 | E3: 一维数组 | F3: 一维数组 | G3: 数字
C4: 不定长 | D4: 不定长 | E4: 不定长 | F4: 不定长
A6: 编号 | B6: 队伍等级 | C6: 功能名 | D6: 功能描述 | E6: 开启等级 | F6: 功能类型 | G6: 图标缩放比例
A7: 1 | B7: 1 | C7: "英雄召唤"|"第三阵位"|"世界之心" | D7: "召唤强力新英雄，组成最佳战队！"|"第三阵位开启，队伍初显雏形！"|"收集世界之心碎片，全体强化！" | E7: 2|2|3 | F7: 9|8|18 | G7: 0.6
A8: 2 | B8: 2 | C8: "英雄召唤"|"第三阵位"|"世界之心" | D8: "召唤强力新英雄，组成最佳战队！"|"第三阵位开启，队伍初显雏形！"|"收集世界之心碎片，全体强化！" | E8: 2|2|3 | F8: 9|8|18 | G8: 0.6
A9: 3 | B9: 3 | C9: "世界之心"|"英雄升级"|"英雄进阶" | D9: "收集世界之心碎片，全体强化！"|"可以升级英雄，大幅提升属性！"|"进阶英雄，提升属性，激活天赋！" | E9: 3|4|5 | F9: 18|8|8 | G9: 0.6
A10: 4 | B10: 4 | C10: "英雄升级"|"英雄进阶"|"好友助战" | D10: "可以升级英雄，大幅提升属性！"|"进阶英雄，提升属性，激活天赋！"|"好友助战，随时登场，推图无忧！" | E10: 4|5|6 | F10: 8|8|1 | G10: 0.6
A11: 5 | B11: 5 | C11: "英雄进阶"|"好友助战"|"装备" | D11: "进阶英雄，提升属性，激活天赋！"|"好友助战，随时登场，推图无忧！"|"装备系统开启，全副武装！" | E11: 5|6|7 | F11: 8|1|8 | G11: 0.6
A12: 6 | B12: 6 | C12: "好友助战"|"装备"|"英雄培养" | D12: "好友助战，随时登场，推图无忧！"|"装备系统开启，全副武装！"|"英雄培养开启，属性全面提升！" | E12: 6|7|9 | F12: 1|8|8 | G12: 0.6
A13: 7 | B13: 7 | C13: "装备"|"英雄培养"|"竞技场" | D13: "装备系统开启，全副武装！"|"英雄培养开启，属性全面提升！"|"竞技场开放，无数英雄，共争高下！" | E13: 7|9|10 | F13: 8|8|21 | G13: 0.6
A14: 8 | B14: 8 | C14: "英雄培养"|"竞技场"|"英雄商店" | D14: "英雄培养开启，属性全面提升！"|"竞技场开放，无数英雄，共争高下！"|"英雄商店开启，兑换心仪英雄！" | E14: 9|10|11 | F14: 8|21|11 | G14: 0.6
A15: 9 | B15: 9 | C15: "英雄培养"|"竞技场"|"英雄商店" | D15: "英雄培养开启，属性全面提升！"|"竞技场开放，无数英雄，共争高下！"|"英雄商店开启，兑换心仪英雄！" | E15: 9|10|11 | F15: 8|21|11 | G15: 0.6
A16: 10 | B16: 10 | C16: "竞技场"|"英雄商店"|"日常任务" | D16: "竞技场开放，无数英雄，共争高下！"|"英雄商店开启，兑换心仪英雄！"|"完成每日任务，每日领钻石！" | E16: 10|11|12 | F16: 21|11|3 | G16: 0.6
A17: 11 | B17: 11 | C17: "英雄商店"|"日常任务"|"圣器争夺" | D17: "英雄商店开启，兑换心仪英雄！"|"完成每日任务，每日领钻石！"|"收集圣器，英雄实力再提升！" | E17: 11|12|13 | F17: 11|3|19 | G17: 0.6
A18: 12 | B18: 12 | C18: "日常任务"|"圣器争夺"|"第四阵位" | D18: "完成每日任务，每日领钻石！"|"收集圣器，英雄实力再提升！"|"第四阵位开启，队伍再次壮大！" | E18: 12|13|15 | F18: 3|19|8 | G18: 0.6
A19: 13 | B19: 13 | C19: "圣器争夺"|"第四阵位"|"回收" | D19: "收集圣器，英雄实力再提升！"|"第四阵位开启，队伍再次壮大！"|"回收再利用，再无后顾之忧！" | E19: 13|15|17 | F19: 19|8|23 | G19: 0.6
A20: 14 | B20: 14 | C20: "第四阵位"|"回收"|"副本扫荡" | D20: "第四阵位开启，队伍再次壮大！"|"回收再利用，再无后顾之忧！"|"扫荡功能开启，副本扫荡省心省力！" | E20: 15|17|17 | F20: 8|23|1 | G20: 0.6
A21: 15 | B21: 15 | C21: "第四阵位"|"回收"|"副本扫荡" | D21: "第四阵位开启，队伍再次壮大！"|"回收再利用，再无后顾之忧！"|"扫荡功能开启，副本扫荡省心省力！" | E21: 15|17|17 | F21: 8|23|1 | G21: 0.6
A22: 16 | B22: 16 | C22: "回收"|"副本扫荡"|"勋章" | D22: "回收再利用，再无后顾之忧！"|"扫荡功能开启，副本扫荡省心省力！"|"实力的证明，战争的荣光！" | E22: 17|17|18 | F22: 23|1|92 | G22: 0.6
A23: 17 | B23: 17 | C23: "回收"|"副本扫荡"|"勋章" | D23: "回收再利用，再无后顾之忧！"|"扫荡功能开启，副本扫荡省心省力！"|"实力的证明，战争的荣光！" | E23: 17|17|18 | F23: 23|1|92 | G23: 0.6
A24: 18 | B24: 18 | C24: "勋章"|"勇者试练"|"第五阵位" | D24: "实力的证明，战争的荣光！"|"勇者试练开启，获取高阶装备！"|"第五阵位开启，强力阵容成型！" | E24: 18|20|22 | F24: 92|17|8 | G24: 0.6
A25: 19 | B25: 19 | C25: "勇者试练"|"第五阵位"|"精灵" | D25: "勇者试练开启，获取高阶装备！"|"第五阵位开启，强力阵容成型！"|"精灵助战，强力BUFF效果！" | E25: 20|22|23 | F25: 17|8|63 | G25: 0.6
A26: 20 | B26: 20 | C26: "勇者试练"|"第五阵位"|"精灵" | D26: "勇者试练开启，获取高阶装备！"|"第五阵位开启，强力阵容成型！"|"精灵助战，强力BUFF效果！" | E26: 20|22|23 | F26: 17|8|63 | G26: 0.6
A27: 21 | B27: 21 | C27: "第五阵位"|"精灵"|"军团" | D27: "第五阵位开启，强力阵容成型！"|"精灵助战，强力BUFF效果！"|"军团开启，并肩作战！" | E27: 22|23|23 | F27: 8|63|22 | G27: 0.6
A28: 22 | B28: 22 | C28: "第五阵位"|"精灵"|"军团" | D28: "第五阵位开启，强力阵容成型！"|"精灵助战，强力BUFF效果！"|"军团开启，并肩作战！" | E28: 22|23|23 | F28: 8|63|22 | G28: 0.6
A29: 23 | B29: 23 | C29: "精灵"|"军团"|"精灵升级" | D29: "精灵助战，强力BUFF效果！"|"军团开启，并肩作战！"|"精灵升级，更进一步！" | E29: 23|23|23 | F29: 63|22|64 | G29: 0.6
A30: 24 | B30: 24 | C30: "日常副本-传承核心"|"寻访遗迹"|"怪物攻城" | D30: "通关日常副本，每日领取大量奖励！"|"遗迹开启，无限的宝物等待你挖掘！"|"参与怪物攻城，赢取大量材料！" | E30: 24|25|25 | F30: 2|20|84 | G30: 0.6
A31: 25 | B31: 25 | C31: "寻访遗迹"|"怪物攻城"|"援军" | D31: "遗迹开启，无限的宝物等待你挖掘！"|"参与怪物攻城，赢取大量材料！"|"援军一号位开启，激活额外宿命！" | E31: 25|25|26 | F31: 20|84|8 | G31: 0.6
A32: 26 | B32: 26 | C32: "援军"|"日常副本-金币"|"英雄副本" | D32: "援军一号位开启，激活额外宿命！"|"通关日常副本，每日领取大量奖励！"|"英雄副本开启，挑战获得钻石奖励！" | E32: 26|26|27 | F32: 8|2|27 | G32: 0.6
A33: 27 | B33: 27 | C33: "英雄副本"|"勇者试练-精英挑战"|"装备精炼" | D33: "英雄副本开启，挑战获得钻石奖励！"|"前往挑战精英，赢取大量威名！"|"装备精炼开启，进一步提升装备！" | E33: 27|28|29 | F33: 27|105|8 | G33: 0.6
A34: 28 | B34: 28 | C34: "勇者试练-精英挑战"|"装备精炼"|"日常副本-装备精炼石" | D34: "前往挑战精英，赢取大量威名！"|"装备精炼开启，进一步提升装备！"|"通关日常副本，每日领取大量奖励！" | E34: 28|29|29 | F34: 105|8|2 | G34: 0.6
A35: 29 | B35: 29 | C35: "装备精炼"|"日常副本-装备精炼石"|"援军阵位2" | D35: "装备精炼开启，进一步提升装备！"|"通关日常副本，每日领取大量奖励！"|"援军二号位开启，激活额外宿命！" | E35: 29|29|30 | F35: 8|2|8 | G35: 0.6
A36: 30 | B36: 30 | C36: "援军阵位2"|"日常副本-进阶石"|"称号" | D36: "援军二号位开启，激活额外宿命！"|"通关日常副本，每日领取大量奖励！"|"称号系统开放，逼格上升100%！" | E36: 30|31|31 | F36: 8|2|83 | G36: 0.6
A37: 31 | B37: 31 | C37: "日常副本-进阶石"|"称号"|"精灵祝福" | D37: "通关日常副本，每日领取大量奖励！"|"称号系统开放，逼格上升100%！"|"精灵祝福开启，精灵助战效果提升！" | E37: 31|31|32 | F37: 2|83|63 | G37: 0.6
A38: 32 | B38: 32 | C38: "精灵祝福"|"援军阵位3"|"日常副本-圣器水晶" | D38: "精灵祝福开启，精灵助战效果提升！"|"援军三号位开启，激活额外宿命！"|"通关日常副本，每日领取大量奖励！" | E38: 32|34|34 | F38: 63|8|2 | G38: 0.6
A39: 33 | B39: 33 | C39: "援军阵位3"|"日常副本-圣器水晶"|"潜能" | D39: "援军三号位开启，激活额外宿命！"|"通关日常副本，每日领取大量奖励！"|"英雄潜能可提升，实力增长百分百！" | E39: 34|34|35 | F39: 8|2|8 | G39: 0.6
A40: 34 | B40: 34 | C40: "援军阵位3"|"日常副本-圣器水晶"|"潜能" | D40: "援军三号位开启，激活额外宿命！"|"通关日常副本，每日领取大量奖励！"|"英雄潜能可提升，实力增长百分百！" | E40: 34|34|35 | F40: 8|2|8 | G40: 0.6
A41: 35 | B41: 35 | C41: "潜能"|"世界BOSS"|"异度入侵" | D41: "英雄潜能可提升，实力增长百分百！"|"深渊魔王来袭，全世界一起推倒！"|"击退入侵者，赢取大量潜能合剂！" | E41: 35|35|35 | F41: 8|47|16 | G41: 0.6
A42: 36 | B42: 36 | C42: "无尽深渊"|"精灵升华"|"援军阵位4" | D42: "闯荡无尽深渊，获取精灵升华材料！"|"精灵可升华，形象大变化！"|"援军四号位开启，激活额外宿命！" | E42: 37|37|38 | F42: 88|28|8 | G42: 0.6
A43: 37 | B43: 37 | C43: "无尽深渊"|"精灵升华"|"援军阵位4" | D43: "闯荡无尽深渊，获取精灵升华材料！"|"精灵可升华，形象大变化！"|"援军四号位开启，激活额外宿命！" | E43: 37|37|38 | F43: 88|28|8 | G43: 0.6
A44: 38 | B44: 38 | C44: "援军阵位4"|"勇者试炼-一键扫荡"|"圣器精炼" | D44: "援军四号位开启，激活额外宿命！"|"一键扫荡所有已通关试练，轻松更愉悦。"|"圣器精炼,进一步提升圣器属性！" | E44: 38|38|39 | F44: 8|17|8 | G44: 0.6
A45: 39 | B45: 39 | C45: "圣器精炼"|"日常副本-圣器精炼石"|"援军阵位5" | D45: "圣器精炼,进一步提升圣器属性！"|"通关日常副本，每日领取大量奖励！"|"援军五号位开启，激活额外宿命！" | E45: 39|39|42 | F45: 8|2|8 | G45: 0.6
A46: 40 | B46: 40 | C46: "援军阵位5"|"英雄觉醒"|"一键夺宝" | D46: "援军五号位开启，激活额外宿命！"|"英雄可觉醒，前进的意志无可阻挡！"|"一键抢夺所有圣器碎片，轻松更愉悦。" | E46: 42|45|45 | F46: 8|8|19 | G46: 0.6
A47: 41 | B47: 41 | C47: "援军阵位5"|"英雄觉醒"|"一键夺宝" | D47: "援军五号位开启，激活额外宿命！"|"英雄可觉醒，前进的意志无可阻挡！"|"一键抢夺所有圣器碎片，轻松更愉悦。" | E47: 42|45|45 | F47: 8|8|19 | G47: 0.6
A48: 42 | B48: 42 | C48: "援军阵位5"|"英雄觉醒"|"一键夺宝" | D48: "援军五号位开启，激活额外宿命！"|"英雄可觉醒，前进的意志无可阻挡！"|"一键抢夺所有圣器碎片，轻松更愉悦。" | E48: 42|45|45 | F48: 8|8|19 | G48: 0.6
A49: 43 | B49: 43 | C49: "英雄觉醒"|"一键夺宝"|"精英副本" | D49: "英雄可觉醒，前进的意志无可阻挡！"|"一键抢夺所有圣器碎片，轻松更愉悦。"|"挑战精英副本，获取大量觉醒材料！" | E49: 45|45|45 | F49: 8|19|28 | G49: 0.6
A50: 44 | B50: 44 | C50: "英雄觉醒"|"一键夺宝"|"精英副本" | D50: "英雄可觉醒，前进的意志无可阻挡！"|"一键抢夺所有圣器碎片，轻松更愉悦。"|"挑战精英副本，获取大量觉醒材料！" | E50: 45|45|45 | F50: 8|19|28 | G50: 0.6
A51: 45 | B51: 45 | C51: "英雄觉醒"|"一键夺宝"|"精英副本" | D51: "英雄可觉醒，前进的意志无可阻挡！"|"一键抢夺所有圣器碎片，轻松更愉悦。"|"挑战精英副本，获取大量觉醒材料！" | E51: 45|45|45 | F51: 8|19|28 | G51: 0.6
A52: 46 | B52: 46 | C52: "援军阵位6"|"援军阵位7"|"援军阵位8" | D52: "援军六号位开启，激活额外宿命！"|"援军七号位开启，激活额外宿命！"|"援军八号位开启，激活额外宿命！" | E52: 46|50|54 | F52: 8|8|8 | G52: 0.6
A53: 47 | B53: 47 | C53: "援军阵位7"|"援军阵位8"|"暂无后续" | D53: "援军七号位开启，激活额外宿命！"|"援军八号位开启，激活额外宿命！"|"敬请期待" | E53: 50|54|150 | F53: 8|8|49 | G53: 0.6
A54: 48 | B54: 48 | C54: "援军阵位7"|"援军阵位8"|"暂无后续" | D54: "援军七号位开启，激活额外宿命！"|"援军八号位开启，激活额外宿命！"|"敬请期待" | E54: 50|54|150 | F54: 8|8|49 | G54: 0.6
A55: 49 | B55: 49 | C55: "援军阵位7"|"援军阵位8"|"暂无后续" | D55: "援军七号位开启，激活额外宿命！"|"援军八号位开启，激活额外宿命！"|"敬请期待" | E55: 50|54|150 | F55: 8|8|49 | G55: 0.6
A56: 50 | B56: 50 | C56: "援军阵位7"|"援军阵位8"|"暂无后续" | D56: "援军七号位开启，激活额外宿命！"|"援军八号位开启，激活额外宿命！"|"敬请期待" | E56: 50|54|150 | F56: 8|8|49 | G56: 0.6
A57: 51 | B57: 51 | C57: "援军阵位8"|"暂无后续"|"暂无后续" | D57: "援军八号位开启，激活额外宿命！"|"敬请期待"|"敬请期待" | E57: 54|150|150 | F57: 8|49|49 | G57: 0.6
A58: 52 | B58: 52 | C58: "援军阵位8"|"暂无后续"|"暂无后续" | D58: "援军八号位开启，激活额外宿命！"|"敬请期待"|"敬请期待" | E58: 54|150|150 | F58: 8|49|49 | G58: 0.6
A59: 53 | B59: 53 | C59: "援军阵位8"|"暂无后续"|"暂无后续" | D59: "援军八号位开启，激活额外宿命！"|"敬请期待"|"敬请期待" | E59: 54|150|150 | F59: 8|49|49 | G59: 0.6
A60: 54 | B60: 54 | C60: "援军阵位8"|"暂无后续"|"暂无后续" | D60: "援军八号位开启，激活额外宿命！"|"敬请期待"|"敬请期待" | E60: 54|150|150 | F60: 8|49|49 | G60: 0.6
A61: 55 | B61: 55 | C61: "暂无后续"|"暂无后续"|"暂无后续" | D61: "敬请期待"|"敬请期待"|"敬请期待" | E61: 150|150|150 | F61: 49|49|49 | G61: 0.6
A62: 56 | B62: 56 | C62: "暂无后续"|"暂无后续"|"暂无后续" | D62: "敬请期待"|"敬请期待"|"敬请期待" | E62: 150|150|150 | F62: 49|49|49 | G62: 0.6
A63: 57 | B63: 57 | C63: "暂无后续"|"暂无后续"|"暂无后续" | D63: "敬请期待"|"敬请期待"|"敬请期待" | E63: 150|150|150 | F63: 49|49|49 | G63: 0.6
A64: 58 | B64: 58 | C64: "暂无后续"|"暂无后续"|"暂无后续" | D64: "敬请期待"|"敬请期待"|"敬请期待" | E64: 150|150|150 | F64: 49|49|49 | G64: 0.6
A65: 59 | B65: 59 | C65: "暂无后续"|"暂无后续"|"暂无后续" | D65: "敬请期待"|"敬请期待"|"敬请期待" | E65: 150|150|150 | F65: 49|49|49 | G65: 0.6
A66: 60 | B66: 60 | C66: "暂无后续"|"暂无后续"|"暂无后续" | D66: "敬请期待"|"敬请期待"|"敬请期待" | E66: 150|150|150 | F66: 49|49|49 | G66: 0.6
A67: 61 | B67: 61 | C67: "暂无后续"|"暂无后续"|"暂无后续" | D67: "敬请期待"|"敬请期待"|"敬请期待" | E67: 150|150|150 | F67: 49|49|49 | G67: 0.6
A68: 62 | B68: 62 | C68: "暂无后续"|"暂无后续"|"暂无后续" | D68: "敬请期待"|"敬请期待"|"敬请期待" | E68: 150|150|150 | F68: 49|49|49 | G68: 0.6
A69: 63 | B69: 63 | C69: "暂无后续"|"暂无后续"|"暂无后续" | D69: "敬请期待"|"敬请期待"|"敬请期待" | E69: 150|150|150 | F69: 49|49|49 | G69: 0.6
A70: 64 | B70: 64 | C70: "暂无后续"|"暂无后续"|"暂无后续" | D70: "敬请期待"|"敬请期待"|"敬请期待" | E70: 150|150|150 | F70: 49|49|49 | G70: 0.6
A71: 65 | B71: 65 | C71: "暂无后续"|"暂无后续"|"暂无后续" | D71: "敬请期待"|"敬请期待"|"敬请期待" | E71: 150|150|150 | F71: 49|49|49 | G71: 0.6
A72: 66 | B72: 66 | C72: "暂无后续"|"暂无后续"|"暂无后续" | D72: "敬请期待"|"敬请期待"|"敬请期待" | E72: 150|150|150 | F72: 49|49|49 | G72: 0.6
A73: 67 | B73: 67 | C73: "暂无后续"|"暂无后续"|"暂无后续" | D73: "敬请期待"|"敬请期待"|"敬请期待" | E73: 150|150|150 | F73: 49|49|49 | G73: 0.6
A74: 68 | B74: 68 | C74: "暂无后续"|"暂无后续"|"暂无后续" | D74: "敬请期待"|"敬请期待"|"敬请期待" | E74: 150|150|150 | F74: 49|49|49 | G74: 0.6
A75: 69 | B75: 69 | C75: "暂无后续"|"暂无后续"|"暂无后续" | D75: "敬请期待"|"敬请期待"|"敬请期待" | E75: 150|150|150 | F75: 49|49|49 | G75: 0.6
A76: 70 | B76: 70 | C76: "暂无后续"|"暂无后续"|"暂无后续" | D76: "敬请期待"|"敬请期待"|"敬请期待" | E76: 150|150|150 | F76: 49|49|49 | G76: 0.6
A77: 71 | B77: 71 | C77: "暂无后续"|"暂无后续"|"暂无后续" | D77: "敬请期待"|"敬请期待"|"敬请期待" | E77: 150|150|150 | F77: 49|49|49 | G77: 0.6
A78: 72 | B78: 72 | C78: "暂无后续"|"暂无后续"|"暂无后续" | D78: "敬请期待"|"敬请期待"|"敬请期待" | E78: 150|150|150 | F78: 49|49|49 | G78: 0.6
A79: 73 | B79: 73 | C79: "暂无后续"|"暂无后续"|"暂无后续" | D79: "敬请期待"|"敬请期待"|"敬请期待" | E79: 150|150|150 | F79: 49|49|49 | G79: 0.6
A80: 74 | B80: 74 | C80: "暂无后续"|"暂无后续"|"暂无后续" | D80: "敬请期待"|"敬请期待"|"敬请期待" | E80: 150|150|150 | F80: 49|49|49 | G80: 0.6
A81: 75 | B81: 75 | C81: "暂无后续"|"暂无后续"|"暂无后续" | D81: "敬请期待"|"敬请期待"|"敬请期待" | E81: 150|150|150 | F81: 49|49|49 | G81: 0.6
A82: 76 | B82: 76 | C82: "暂无后续"|"暂无后续"|"暂无后续" | D82: "敬请期待"|"敬请期待"|"敬请期待" | E82: 150|150|150 | F82: 49|49|49 | G82: 0.6
A83: 77 | B83: 77 | C83: "暂无后续"|"暂无后续"|"暂无后续" | D83: "敬请期待"|"敬请期待"|"敬请期待" | E83: 150|150|150 | F83: 49|49|49 | G83: 0.6
A84: 78 | B84: 78 | C84: "暂无后续"|"暂无后续"|"暂无后续" | D84: "敬请期待"|"敬请期待"|"敬请期待" | E84: 150|150|150 | F84: 49|49|49 | G84: 0.6
A85: 79 | B85: 79 | C85: "暂无后续"|"暂无后续"|"暂无后续" | D85: "敬请期待"|"敬请期待"|"敬请期待" | E85: 150|150|150 | F85: 49|49|49 | G85: 0.6
A86: 80 | B86: 80 | C86: "暂无后续"|"暂无后续"|"暂无后续" | D86: "敬请期待"|"敬请期待"|"敬请期待" | E86: 150|150|150 | F86: 49|49|49 | G86: 0.6
A87: 81 | B87: 81 | C87: "暂无后续"|"暂无后续"|"暂无后续" | D87: "敬请期待"|"敬请期待"|"敬请期待" | E87: 150|150|150 | F87: 49|49|49 | G87: 0.6
A88: 82 | B88: 82 | C88: "暂无后续"|"暂无后续"|"暂无后续" | D88: "敬请期待"|"敬请期待"|"敬请期待" | E88: 150|150|150 | F88: 49|49|49 | G88: 0.6
A89: 83 | B89: 83 | C89: "暂无后续"|"暂无后续"|"暂无后续" | D89: "敬请期待"|"敬请期待"|"敬请期待" | E89: 150|150|150 | F89: 49|49|49 | G89: 0.6
A90: 84 | B90: 84 | C90: "暂无后续"|"暂无后续"|"暂无后续" | D90: "敬请期待"|"敬请期待"|"敬请期待" | E90: 150|150|150 | F90: 49|49|49 | G90: 0.6
A91: 85 | B91: 85 | C91: "暂无后续"|"暂无后续"|"暂无后续" | D91: "敬请期待"|"敬请期待"|"敬请期待" | E91: 150|150|150 | F91: 49|49|49 | G91: 0.6
A92: 86 | B92: 86 | C92: "暂无后续"|"暂无后续"|"暂无后续" | D92: "敬请期待"|"敬请期待"|"敬请期待" | E92: 150|150|150 | F92: 49|49|49 | G92: 0.6
A93: 87 | B93: 87 | C93: "暂无后续"|"暂无后续"|"暂无后续" | D93: "敬请期待"|"敬请期待"|"敬请期待" | E93: 150|150|150 | F93: 49|49|49 | G93: 0.6
A94: 88 | B94: 88 | C94: "暂无后续"|"暂无后续"|"暂无后续" | D94: "敬请期待"|"敬请期待"|"敬请期待" | E94: 150|150|150 | F94: 49|49|49 | G94: 0.6
A95: 89 | B95: 89 | C95: "暂无后续"|"暂无后续"|"暂无后续" | D95: "敬请期待"|"敬请期待"|"敬请期待" | E95: 150|150|150 | F95: 49|49|49 | G95: 0.6
A96: 90 | B96: 90 | C96: "暂无后续"|"暂无后续"|"暂无后续" | D96: "敬请期待"|"敬请期待"|"敬请期待" | E96: 150|150|150 | F96: 49|49|49 | G96: 0.6
A97: 91 | B97: 91 | C97: "暂无后续"|"暂无后续"|"暂无后续" | D97: "敬请期待"|"敬请期待"|"敬请期待" | E97: 150|150|150 | F97: 49|49|49 | G97: 0.6
A98: 92 | B98: 92 | C98: "暂无后续"|"暂无后续"|"暂无后续" | D98: "敬请期待"|"敬请期待"|"敬请期待" | E98: 150|150|150 | F98: 49|49|49 | G98: 0.6
A99: 93 | B99: 93 | C99: "暂无后续"|"暂无后续"|"暂无后续" | D99: "敬请期待"|"敬请期待"|"敬请期待" | E99: 150|150|150 | F99: 49|49|49 | G99: 0.6
A100: 94 | B100: 94 | C100: "暂无后续"|"暂无后续"|"暂无后续" | D100: "敬请期待"|"敬请期待"|"敬请期待" | E100: 150|150|150 | F100: 49|49|49 | G100: 0.6
A101: 95 | B101: 95 | C101: "暂无后续"|"暂无后续"|"暂无后续" | D101: "敬请期待"|"敬请期待"|"敬请期待" | E101: 150|150|150 | F101: 49|49|49 | G101: 0.6
A102: 96 | B102: 96 | C102: "暂无后续"|"暂无后续"|"暂无后续" | D102: "敬请期待"|"敬请期待"|"敬请期待" | E102: 150|150|150 | F102: 49|49|49 | G102: 0.6
A103: 97 | B103: 97 | C103: "暂无后续"|"暂无后续"|"暂无后续" | D103: "敬请期待"|"敬请期待"|"敬请期待" | E103: 150|150|150 | F103: 49|49|49 | G103: 0.6
A104: 98 | B104: 98 | C104: "暂无后续"|"暂无后续"|"暂无后续" | D104: "敬请期待"|"敬请期待"|"敬请期待" | E104: 150|150|150 | F104: 49|49|49 | G104: 0.6
A105: 99 | B105: 99 | C105: "暂无后续"|"暂无后续"|"暂无后续" | D105: "敬请期待"|"敬请期待"|"敬请期待" | E105: 150|150|150 | F105: 49|49|49 | G105: 0.6
A106: 100 | B106: 100 | C106: "暂无后续"|"暂无后续"|"暂无后续" | D106: "敬请期待"|"敬请期待"|"敬请期待" | E106: 150|150|150 | F106: 49|49|49 | G106: 0.6
A107: 101 | B107: 101 | C107: "暂无后续"|"暂无后续"|"暂无后续" | D107: "敬请期待"|"敬请期待"|"敬请期待" | E107: 150|150|150 | F107: 49|49|49 | G107: 0.6
A108: 102 | B108: 102 | C108: "暂无后续"|"暂无后续"|"暂无后续" | D108: "敬请期待"|"敬请期待"|"敬请期待" | E108: 150|150|150 | F108: 49|49|49 | G108: 0.6
A109: 103 | B109: 103 | C109: "暂无后续"|"暂无后续"|"暂无后续" | D109: "敬请期待"|"敬请期待"|"敬请期待" | E109: 150|150|150 | F109: 49|49|49 | G109: 0.6
A110: 104 | B110: 104 | C110: "暂无后续"|"暂无后续"|"暂无后续" | D110: "敬请期待"|"敬请期待"|"敬请期待" | E110: 150|150|150 | F110: 49|49|49 | G110: 0.6
A111: 105 | B111: 105 | C111: "暂无后续"|"暂无后续"|"暂无后续" | D111: "敬请期待"|"敬请期待"|"敬请期待" | E111: 150|150|150 | F111: 49|49|49 | G111: 0.6
A112: 106 | B112: 106 | C112: "暂无后续"|"暂无后续"|"暂无后续" | D112: "敬请期待"|"敬请期待"|"敬请期待" | E112: 150|150|150 | F112: 49|49|49 | G112: 0.6
A113: 107 | B113: 107 | C113: "暂无后续"|"暂无后续"|"暂无后续" | D113: "敬请期待"|"敬请期待"|"敬请期待" | E113: 150|150|150 | F113: 49|49|49 | G113: 0.6
A114: 108 | B114: 108 | C114: "暂无后续"|"暂无后续"|"暂无后续" | D114: "敬请期待"|"敬请期待"|"敬请期待" | E114: 150|150|150 | F114: 49|49|49 | G114: 0.6
A115: 109 | B115: 109 | C115: "暂无后续"|"暂无后续"|"暂无后续" | D115: "敬请期待"|"敬请期待"|"敬请期待" | E115: 150|150|150 | F115: 49|49|49 | G115: 0.6
A116: 110 | B116: 110 | C116: "暂无后续"|"暂无后续"|"暂无后续" | D116: "敬请期待"|"敬请期待"|"敬请期待" | E116: 150|150|150 | F116: 49|49|49 | G116: 0.6
A117: 111 | B117: 111 | C117: "暂无后续"|"暂无后续"|"暂无后续" | D117: "敬请期待"|"敬请期待"|"敬请期待" | E117: 150|150|150 | F117: 49|49|49 | G117: 0.6
A118: 112 | B118: 112 | C118: "暂无后续"|"暂无后续"|"暂无后续" | D118: "敬请期待"|"敬请期待"|"敬请期待" | E118: 150|150|150 | F118: 49|49|49 | G118: 0.6
A119: 113 | B119: 113 | C119: "暂无后续"|"暂无后续"|"暂无后续" | D119: "敬请期待"|"敬请期待"|"敬请期待" | E119: 150|150|150 | F119: 49|49|49 | G119: 0.6
A120: 114 | B120: 114 | C120: "暂无后续"|"暂无后续"|"暂无后续" | D120: "敬请期待"|"敬请期待"|"敬请期待" | E120: 150|150|150 | F120: 49|49|49 | G120: 0.6
A121: 115 | B121: 115 | C121: "暂无后续"|"暂无后续"|"暂无后续" | D121: "敬请期待"|"敬请期待"|"敬请期待" | E121: 150|150|150 | F121: 49|49|49 | G121: 0.6
A122: 116 | B122: 116 | C122: "暂无后续"|"暂无后续"|"暂无后续" | D122: "敬请期待"|"敬请期待"|"敬请期待" | E122: 150|150|150 | F122: 49|49|49 | G122: 0.6
A123: 117 | B123: 117 | C123: "暂无后续"|"暂无后续"|"暂无后续" | D123: "敬请期待"|"敬请期待"|"敬请期待" | E123: 150|150|150 | F123: 49|49|49 | G123: 0.6
A124: 118 | B124: 118 | C124: "暂无后续"|"暂无后续"|"暂无后续" | D124: "敬请期待"|"敬请期待"|"敬请期待" | E124: 150|150|150 | F124: 49|49|49 | G124: 0.6
A125: 119 | B125: 119 | C125: "暂无后续"|"暂无后续"|"暂无后续" | D125: "敬请期待"|"敬请期待"|"敬请期待" | E125: 150|150|150 | F125: 49|49|49 | G125: 0.6
A126: 120 | B126: 120 | C126: "暂无后续"|"暂无后续"|"暂无后续" | D126: "敬请期待"|"敬请期待"|"敬请期待" | E126: 150|150|150 | F126: 49|49|49 | G126: 0.6
A127: 121 | B127: 121 | C127: "暂无后续"|"暂无后续"|"暂无后续" | D127: "敬请期待"|"敬请期待"|"敬请期待" | E127: 150|150|150 | F127: 49|49|49 | G127: 0.6
A128: 122 | B128: 122 | C128: "暂无后续"|"暂无后续"|"暂无后续" | D128: "敬请期待"|"敬请期待"|"敬请期待" | E128: 150|150|150 | F128: 49|49|49 | G128: 0.6
A129: 123 | B129: 123 | C129: "暂无后续"|"暂无后续"|"暂无后续" | D129: "敬请期待"|"敬请期待"|"敬请期待" | E129: 150|150|150 | F129: 49|49|49 | G129: 0.6
A130: 124 | B130: 124 | C130: "暂无后续"|"暂无后续"|"暂无后续" | D130: "敬请期待"|"敬请期待"|"敬请期待" | E130: 150|150|150 | F130: 49|49|49 | G130: 0.6
A131: 125 | B131: 125 | C131: "暂无后续"|"暂无后续"|"暂无后续" | D131: "敬请期待"|"敬请期待"|"敬请期待" | E131: 150|150|150 | F131: 49|49|49 | G131: 0.6
A132: 126 | B132: 126 | C132: "暂无后续"|"暂无后续"|"暂无后续" | D132: "敬请期待"|"敬请期待"|"敬请期待" | E132: 150|150|150 | F132: 49|49|49 | G132: 0.6
A133: 127 | B133: 127 | C133: "暂无后续"|"暂无后续"|"暂无后续" | D133: "敬请期待"|"敬请期待"|"敬请期待" | E133: 150|150|150 | F133: 49|49|49 | G133: 0.6
A134: 128 | B134: 128 | C134: "暂无后续"|"暂无后续"|"暂无后续" | D134: "敬请期待"|"敬请期待"|"敬请期待" | E134: 150|150|150 | F134: 49|49|49 | G134: 0.6
A135: 129 | B135: 129 | C135: "暂无后续"|"暂无后续"|"暂无后续" | D135: "敬请期待"|"敬请期待"|"敬请期待" | E135: 150|150|150 | F135: 49|49|49 | G135: 0.6
A136: 130 | B136: 130 | C136: "暂无后续"|"暂无后续"|"暂无后续" | D136: "敬请期待"|"敬请期待"|"敬请期待" | E136: 150|150|150 | F136: 49|49|49 | G136: 0.6
A137: 131 | B137: 131 | C137: "暂无后续"|"暂无后续"|"暂无后续" | D137: "敬请期待"|"敬请期待"|"敬请期待" | E137: 150|150|150 | F137: 49|49|49 | G137: 0.6
A138: 132 | B138: 132 | C138: "暂无后续"|"暂无后续"|"暂无后续" | D138: "敬请期待"|"敬请期待"|"敬请期待" | E138: 150|150|150 | F138: 49|49|49 | G138: 0.6
A139: 133 | B139: 133 | C139: "暂无后续"|"暂无后续"|"暂无后续" | D139: "敬请期待"|"敬请期待"|"敬请期待" | E139: 150|150|150 | F139: 49|49|49 | G139: 0.6
A140: 134 | B140: 134 | C140: "暂无后续"|"暂无后续"|"暂无后续" | D140: "敬请期待"|"敬请期待"|"敬请期待" | E140: 150|150|150 | F140: 49|49|49 | G140: 0.6
A141: 135 | B141: 135 | C141: "暂无后续"|"暂无后续"|"暂无后续" | D141: "敬请期待"|"敬请期待"|"敬请期待" | E141: 150|150|150 | F141: 49|49|49 | G141: 0.6
A142: 136 | B142: 136 | C142: "暂无后续"|"暂无后续"|"暂无后续" | D142: "敬请期待"|"敬请期待"|"敬请期待" | E142: 150|150|150 | F142: 49|49|49 | G142: 0.6
A143: 137 | B143: 137 | C143: "暂无后续"|"暂无后续"|"暂无后续" | D143: "敬请期待"|"敬请期待"|"敬请期待" | E143: 150|150|150 | F143: 49|49|49 | G143: 0.6
A144: 138 | B144: 138 | C144: "暂无后续"|"暂无后续"|"暂无后续" | D144: "敬请期待"|"敬请期待"|"敬请期待" | E144: 150|150|150 | F144: 49|49|49 | G144: 0.6
A145: 139 | B145: 139 | C145: "暂无后续"|"暂无后续"|"暂无后续" | D145: "敬请期待"|"敬请期待"|"敬请期待" | E145: 150|150|150 | F145: 49|49|49 | G145: 0.6
A146: 140 | B146: 140 | C146: "暂无后续"|"暂无后续"|"暂无后续" | D146: "敬请期待"|"敬请期待"|"敬请期待" | E146: 150|150|150 | F146: 49|49|49 | G146: 0.6
A147: 141 | B147: 141 | C147: "暂无后续"|"暂无后续"|"暂无后续" | D147: "敬请期待"|"敬请期待"|"敬请期待" | E147: 150|150|150 | F147: 49|49|49 | G147: 0.6
A148: 142 | B148: 142 | C148: "暂无后续"|"暂无后续"|"暂无后续" | D148: "敬请期待"|"敬请期待"|"敬请期待" | E148: 150|150|150 | F148: 49|49|49 | G148: 0.6
A149: 143 | B149: 143 | C149: "暂无后续"|"暂无后续"|"暂无后续" | D149: "敬请期待"|"敬请期待"|"敬请期待" | E149: 150|150|150 | F149: 49|49|49 | G149: 0.6
A150: 144 | B150: 144 | C150: "暂无后续"|"暂无后续"|"暂无后续" | D150: "敬请期待"|"敬请期待"|"敬请期待" | E150: 150|150|150 | F150: 49|49|49 | G150: 0.6
A151: 145 | B151: 145 | C151: "暂无后续"|"暂无后续"|"暂无后续" | D151: "敬请期待"|"敬请期待"|"敬请期待" | E151: 150|150|150 | F151: 49|49|49 | G151: 0.6
A152: 146 | B152: 146 | C152: "暂无后续"|"暂无后续"|"暂无后续" | D152: "敬请期待"|"敬请期待"|"敬请期待" | E152: 150|150|150 | F152: 49|49|49 | G152: 0.6
A153: 147 | B153: 147 | C153: "暂无后续"|"暂无后续"|"暂无后续" | D153: "敬请期待"|"敬请期待"|"敬请期待" | E153: 150|150|150 | F153: 49|49|49 | G153: 0.6
A154: 148 | B154: 148 | C154: "暂无后续"|"暂无后续"|"暂无后续" | D154: "敬请期待"|"敬请期待"|"敬请期待" | E154: 150|150|150 | F154: 49|49|49 | G154: 0.6
A155: 149 | B155: 149 | C155: "暂无后续"|"暂无后续"|"暂无后续" | D155: "敬请期待"|"敬请期待"|"敬请期待" | E155: 150|150|150 | F155: 49|49|49 | G155: 0.6
A156: 150 | B156: 150 | C156: "暂无后续"|"暂无后续"|"暂无后续" | D156: "敬请期待"|"敬请期待"|"敬请期待" | E156: 150|150|150 | F156: 49|49|49 | G156: 0.6

Sheet: Sheet2
A2: 等级 | B2: 排序 | C2: 功能名 | D2: 对应描述 | E2: 等级 | F2: 对应系统入口 | G2: " | H2: 队伍等级
A3: 0 | B3: =ROW()-3 -> 0 | E3: =INT(RC[-4]) -> 0 | G3: =VLOOKUP(RC[1]-0.1,C1:C2,2,TRUE)+1 -> 1 | H3: 1 | I3: =R2C7&HLOOKUP(R2C[-6],R2C[-6]:R150C[-6],RC7+2,FALSE)&R2C7&"|"&R2C7&HLOOKUP(R2C[-6],R2C[-6]:R150C[-6],RC7+3,FALSE)&R2C7&"|"&R2C7&HLOOKUP(R2C[-6],R2C[-6]:R150C[-6],RC7+4,FALSE)&R2C7 -> "英雄召唤"|"第三阵位"|"世界之心" | J3: =R2C7&HLOOKUP(R2C[-6],R2C[-6]:R150C[-6],RC7+2,FALSE)&R2C7&"|"&R2C7&HLOOKUP(R2C[-6],R2C[-6]:R150C[-6],RC7+3,FALSE)&R2C7&"|"&R2C7&HLOOKUP(R2C[-6],R2C[-6]:R150C[-6],RC7+4,FALSE)&R2C7 -> "召唤强力新英雄，组成最佳战队！"|"第三阵位开启，队伍初显雏形！"|"收集世界之心碎片，全体强化！" | K3: =HLOOKUP(R2C[-6],R2C[-6]:R150C[-6],RC7+2,FALSE)&"|"&HLOOKUP(R2C[-6],R2C[-6]:R150C[-6],RC7+3,FALSE)&"|"&HLOOKUP(R2C[-6],R2C[-6]:R150C[-6],RC7+4,FALSE) -> 2|2|3 | L3: =HLOOKUP(R2C[-6],R2C[-6]:R150C[-6],RC7+2,FALSE)&"|"&HLOOKUP(R2C[-6],R2C[-6]:R150C[-6],RC7+3,FALSE)&"|"&HLOOKUP(R2C[-6],R2C[-6]:R150C[-6],RC7+4,FALSE) -> 9|8|18
A4: 2 | B4: =ROW()-3 -> 1 | C4: 英雄召唤 | D4: 召唤强力新英雄，组成最佳战队！ | E4: =INT(RC[-4]) -> 2 | F4: 9 | G4: =VLOOKUP(RC[1]-0.1,C1:C2,2,TRUE)+1 -> 1 | H4: 2 | I4: =R2C7&HLOOKUP(R2C[-6],R2C[-6]:R150C[-6],RC7+2,FALSE)&R2C7&"|"&R2C7&HLOOKUP(R2C[-6],R2C[-6]:R150C[-6],RC7+3,FALSE)&R2C7&"|"&R2C7&HLOOKUP(R2C[-6],R2C[-6]:R150C[-6],RC7+4,FALSE)&R2C7 -> "英雄召唤"|"第三阵位"|"世界之心" | J4: =R2C7&HLOOKUP(R2C[-6],R2C[-6]:R150C[-6],RC7+2,FALSE)&R2C7&"|"&R2C7&HLOOKUP(R2C[-6],R2C[-6]:R150C[-6],RC7+3,FALSE)&R2C7&"|"&R2C7&HLOOKUP(R2C[-6],R2C[-6]:R150C[-6],RC7+4,FALSE)&R2C7 -> "召唤强力新英雄，组成最佳战队！"|"第三阵位开启，队伍初显雏形！"|"收集世界之心碎片，全体强化！" | K4: =HLOOKUP(R2C[-6],R2C[-6]:R150C[-6],RC7+2,FALSE)&"|"&HLOOKUP(R2C[-6],R2C[-6]:R150C[-6],RC7+3,FALSE)&"|"&HLOOKUP(R2C[-6],R2C[-6]:R150C[-6],RC7+4,FALSE) -> 2|2|3 | L4: =HLOOKUP(R2C[-6],R2C[-6]:R150C[-6],RC7+2,FALSE)&"|"&HLOOKUP(R2C[-6],R2C[-6]:R150C[-6],RC7+3,FALSE)&"|"&HLOOKUP(R2C[-6],R2C[-6]:R150C[-6],RC7+4,FALSE) -> 9|8|18
A5: 2.1 | B5: =ROW()-3 -> 2 | C5: 第三阵位 | D5: 第三阵位开启，队伍初显雏形！ | E5: =INT(RC[-4]) -> 2 | F5: 8 | G5: =VLOOKUP(RC[1]-0.1,C1:C2,2,TRUE)+1 -> 3 | H5: 3 | I5: =R2C7&HLOOKUP(R2C[-6],R2C[-6]:R150C[-6],RC7+2,FALSE)&R2C7&"|"&R2C7&HLOOKUP(R2C[-6],R2C[-6]:R150C[-6],RC7+3,FALSE)&R2C7&"|"&R2C7&HLOOKUP(R2C[-6],R2C[-6]:R150C[-6],RC7+4,FALSE)&R2C7 -> "世界之心"|"英雄升级"|"英雄进阶" | J5: =R2C7&HLOOKUP(R2C[-6],R2C[-6]:R150C[-6],RC7+2,FALSE)&R2C7&"|"&R2C7&HLOOKUP(R2C[-6],R2C[-6]:R150C[-6],RC7+3,FALSE)&R2C7&"|"&R2C7&HLOOKUP(R2C[-6],R2C[-6]:R150C[-6],RC7+4,FALSE)&R2C7 -> "收集世界之心碎片，全体强化！"|"可以升级英雄，大幅提升属性！"|"进阶英雄，提升属性，激活天赋！" | K5: =HLOOKUP(R2C[-6],R2C[-6]:R150C[-6],RC7+2,FALSE)&"|"&HLOOKUP(R2C[-6],R2C[-6]:R150C[-6],RC7+3,FALSE)&"|"&HLOOKUP(R2C[-6],R2C[-6]:R150C[-6],RC7+4,FALSE) -> 3|4|5 | L5: =HLOOKUP(R2C[-6],R2C[-6]:R150C[-6],RC7+2,FALSE)&"|"&HLOOKUP(R2C[-6],R2C[-6]:R150C[-6],RC7+3,FALSE)&"|"&HLOOKUP(R2C[-6],R2C[-6]:R150C[-6],RC7+4,FALSE) -> 18|8|8
A6: 3 | B6: =ROW()-3 -> 3 | C6: 世界之心 | D6: 收集世界之心碎片，全体强化！ | E6: =INT(RC[-4]) -> 3 | F6: 18 | G6: =VLOOKUP(RC[1]-0.1,C1:C2,2,TRUE)+1 -> 4 | H6: 4 | I6: =R2C7&HLOOKUP(R2C[-6],R2C[-6]:R150C[-6],RC7+2,FALSE)&R2C7&"|"&R2C7&HLOOKUP(R2C[-6],R2C[-6]:R150C[-6],RC7+3,FALSE)&R2C7&"|"&R2C7&HLOOKUP(R2C[-6],R2C[-6]:R150C[-6],RC7+4,FALSE)&R2C7 -> "英雄升级"|"英雄进阶"|"好友助战" | J6: =R2C7&HLOOKUP(R2C[-6],R2C[-6]:R150C[-6],RC7+2,FALSE)&R2C7&"|"&R2C7&HLOOKUP(R2C[-6],R2C[-6]:R150C[-6],RC7+3,FALSE)&R2C7&"|"&R2C7&HLOOKUP(R2C[-6],R2C[-6]:R150C[-6],RC7+4,FALSE)&R2C7 -> "可以升级英雄，大幅提升属性！"|"进阶英雄，提升属性，激活天赋！"|"好友助战，随时登场，推图无忧！" | K6: =HLOOKUP(R2C[-6],R2C[-6]:R150C[-6],RC7+2,FALSE)&"|"&HLOOKUP(R2C[-6],R2C[-6]:R150C[-6],RC7+3,FALSE)&"|"&HLOOKUP(R2C[-6],R2C[-6]:R150C[-6],RC7+4,FALSE) -> 4|5|6 | L6: =HLOOKUP(R2C[-6],R2C[-6]:R150C[-6],RC7+2,FALSE)&"|"&HLOOKUP(R2C[-6],R2C[-6]:R150C[-6],RC7+3,FALSE)&"|"&HLOOKUP(R2C[-6],R2C[-6]:R150C[-6],RC7+4,FALSE) -> 8|8|1
A7: 4 | B7: =ROW()-3 -> 4 | C7: 英雄升级 | D7: 可以升级英雄，大幅提升属性！ | E7: =INT(RC[-4]) -> 4 | F7: 8 | G7: =VLOOKUP(RC[1]-0.1,C1:C2,2,TRUE)+1 -> 5 | H7: 5 | I7: =R2C7&HLOOKUP(R2C[-6],R2C[-6]:R150C[-6],RC7+2,FALSE)&R2C7&"|"&R2C7&HLOOKUP(R2C[-6],R2C[-6]:R150C[-6],RC7+3,FALSE)&R2C7&"|"&R2C7&HLOOKUP(R2C[-6],R2C[-6]:R150C[-6],RC7+4,FALSE)&R2C7 -> "英雄进阶"|"好友助战"|"装备" | J7: =R2C7&HLOOKUP(R2C[-6],R2C[-6]:R150C[-6],RC7+2,FALSE)&R2C7&"|"&R2C7&HLOOKUP(R2C[-6],R2C[-6]:R150C[-6],RC7+3,FALSE)&R2C7&"|"&R2C7&HLOOKUP(R2C[-6],R2C[-6]:R150C[-6],RC7+4,FALSE)&R2C7 -> "进阶英雄，提升属性，激活天赋！"|"好友助战，随时登场，推图无忧！"|"装备系统开启，全副武装！" | K7: =HLOOKUP(R2C[-6],R2C[-6]:R150C[-6],RC7+2,FALSE)&"|"&HLOOKUP(R2C[-6],R2C[-6]:R150C[-6],RC7+3,FALSE)&"|"&HLOOKUP(R2C[-6],R2C[-6]:R150C[-6],RC7+4,FALSE) -> 5|6|7 | L7: =HLOOKUP(R2C[-6],R2C[-6]:R150C[-6],RC7+2,FALSE)&"|"&HLOOKUP(R2C[-6],R2C[-6]:R150C[-6],RC7+3,FALSE)&"|"&HLOOKUP(R2C[-6],R2C[-6]:R150C[-6],RC7+4,FALSE) -> 8|1|8
A8: 5 | B8: =ROW()-3 -> 5 | C8: 英雄进阶 | D8: 进阶英雄，提升属性，激活天赋！ | E8: =INT(RC[-4]) -> 5 | F8: 8 | G8: =VLOOKUP(RC[1]-0.1,C1:C2,2,TRUE)+1 -> 6 | H8: 6 | I8: =R2C7&HLOOKUP(R2C[-6],R2C[-6]:R150C[-6],RC7+2,FALSE)&R2C7&"|"&R2C7&HLOOKUP(R2C[-6],R2C[-6]:R150C[-6],RC7+3,FALSE)&R2C7&"|"&R2C7&HLOOKUP(R2C[-6],R2C[-6]:R150C[-6],RC7+4,FALSE)&R2C7 -> "好友助战"|"装备"|"英雄培养" | J8: =R2C7&HLOOKUP(R2C[-6],R2C[-6]:R150C[-6],RC7+2,FALSE)&R2C7&"|"&R2C7&HLOOKUP(R2C[-6],R2C[-6]:R150C[-6],RC7+3,FALSE)&R2C7&"|"&R2C7&HLOOKUP(R2C[-6],R2C[-6]:R150C[-6],RC7+4,FALSE)&R2C7 -> "好友助战，随时登场，推图无忧！"|"装备系统开启，全副武装！"|"英雄培养开启，属性全面提升！" | K8: =HLOOKUP(R2C[-6],R2C[-6]:R150C[-6],RC7+2,FALSE)&"|"&HLOOKUP(R2C[-6],R2C[-6]:R150C[-6],RC7+3,FALSE)&"|"&HLOOKUP(R2C[-6],R2C[-6]:R150C[-6],RC7+4,FALSE) -> 6|7|9 | L8: =HLOOKUP(R2C[-6],R2C[-6]:R150C[-6],RC7+2,FALSE)&"|"&HLOOKUP(R2C[-6],R2C[-6]:R150C[-6],RC7+3,FALSE)&"|"&HLOOKUP(R2C[-6],R2C[-6]:R150C[-6],RC7+4,FALSE) -> 1|8|8
A9: 6 | B9: =ROW()-3 -> 6 | C9: 好友助战 | D9: 好友助战，随时登场，推图无忧！ | E9: =INT(RC[-4]) -> 6 | F9: 1 | G9: =VLOOKUP(RC[1]-0.1,C1:C2,2,TRUE)+1 -> 7 | H9: 7 | I9: =R2C7&HLOOKUP(R2C[-6],R2C[-6]:R150C[-6],RC7+2,FALSE)&R2C7&"|"&R2C7&HLOOKUP(R2C[-6],R2C[-6]:R150C[-6],RC7+3,FALSE)&R2C7&"|"&R2C7&HLOOKUP(R2C[-6],R2C[-6]:R150C[-6],RC7+4,FALSE)&R2C7 -> "装备"|"英雄培养"|"竞技场" | J9: =R2C7&HLOOKUP(R2C[-6],R2C[-6]:R150C[-6],RC7+2,FALSE)&R2C7&"|"&R2C7&HLOOKUP(R2C[-6],R2C[-6]:R150C[-6],RC7+3,FALSE)&R2C7&"|"&R2C7&HLOOKUP(R2C[-6],R2C[-6]:R150C[-6],RC7+4,FALSE)&R2C7 -> "装备系统开启，全副武装！"|"英雄培养开启，属性全面提升！"|"竞技场开放，无数英雄，共争高下！" | K9: =HLOOKUP(R2C[-6],R2C[-6]:R150C[-6],RC7+2,FALSE)&"|"&HLOOKUP(R2C[-6],R2C[-6]:R150C[-6],RC7+3,FALSE)&"|"&HLOOKUP(R2C[-6],R2C[-6]:R150C[-6],RC7+4,FALSE) -> 7|9|10 | L9: =HLOOKUP(R2C[-6],R2C[-6]:R150C[-6],RC7+2,FALSE)&"|"&HLOOKUP(R2C[-6],R2C[-6]:R150C[-6],RC7+3,FALSE)&"|"&HLOOKUP(R2C[-6],R2C[-6]:R150C[-6],RC7+4,FALSE) -> 8|8|21
A10: 7 | B10: =ROW()-3 -> 7 | C10: 装备 | D10: 装备系统开启，全副武装！ | E10: =INT(RC[-4]) -> 7 | F10: 8 | G10: =VLOOKUP(RC[1]-0.1,C1:C2,2,TRUE)+1 -> 8 | H10: 8 | I10: =R2C7&HLOOKUP(R2C[-6],R2C[-6]:R150C[-6],RC7+2,FALSE)&R2C7&"|"&R2C7&HLOOKUP(R2C[-6],R2C[-6]:R150C[-6],RC7+3,FALSE)&R2C7&"|"&R2C7&HLOOKUP(R2C[-6],R2C[-6]:R150C[-6],RC7+4,FALSE)&R2C7 -> "英雄培养"|"竞技场"|"英雄商店" | J10: =R2C7&HLOOKUP(R2C[-6],R2C[-6]:R150C[-6],RC7+2,FALSE)&R2C7&"|"&R2C7&HLOOKUP(R2C[-6],R2C[-6]:R150C[-6],RC7+3,FALSE)&R2C7&"|"&R2C7&HLOOKUP(R2C[-6],R2C[-6]:R150C[-6],RC7+4,FALSE)&R2C7 -> "英雄培养开启，属性全面提升！"|"竞技场开放，无数英雄，共争高下！"|"英雄商店开启，兑换心仪英雄！" | K10: =HLOOKUP(R2C[-6],R2C[-6]:R150C[-6],RC7+2,FALSE)&"|"&HLOOKUP(R2C[-6],R2C[-6]:R150C[-6],RC7+3,FALSE)&"|"&HLOOKUP(R2C[-6],R2C[-6]:R150C[-6],RC7+4,FALSE) -> 9|10|11 | L10: =HLOOKUP(R2C[-6],R2C[-6]:R150C[-6],RC7+2,FALSE)&"|"&HLOOKUP(R2C[-6],R2C[-6]:R150C[-6],RC7+3,FALSE)&"|"&HLOOKUP(R2C[-6],R2C[-6]:R150C[-6],RC7+4,FALSE) -> 8|21|11
A11: 9 | B11: =ROW()-3 -> 8 | C11: 英雄培养 | D11: 英雄培养开启，属性全面提升！ | E11: =INT(RC[-4]) -> 9 | F11: 8 | G11: =VLOOKUP(RC[1]-0.1,C1:C2,2,TRUE)+1 -> 8 | H11: 9 | I11: =R2C7&HLOOKUP(R2C[-6],R2C[-6]:R150C[-6],RC7+2,FALSE)&R2C7&"|"&R2C7&HLOOKUP(R2C[-6],R2C[-6]:R150C[-6],RC7+3,FALSE)&R2C7&"|"&R2C7&HLOOKUP(R2C[-6],R2C[-6]:R150C[-6],RC7+4,FALSE)&R2C7 -> "英雄培养"|"竞技场"|"英雄商店" | J11: =R2C7&HLOOKUP(R2C[-6],R2C[-6]:R150C[-6],RC7+2,FALSE)&R2C7&"|"&R2C7&HLOOKUP(R2C[-6],R2C[-6]:R150C[-6],RC7+3,FALSE)&R2C7&"|"&R2C7&HLOOKUP(R2C[-6],R2C[-6]:R150C[-6],RC7+4,FALSE)&R2C7 -> "英雄培养开启，属性全面提升！"|"竞技场开放，无数英雄，共争高下！"|"英雄商店开启，兑换心仪英雄！" | K11: =HLOOKUP(R2C[-6],R2C[-6]:R150C[-6],RC7+2,FALSE)&"|"&HLOOKUP(R2C[-6],R2C[-6]:R150C[-6],RC7+3,FALSE)&"|"&HLOOKUP(R2C[-6],R2C[-6]:R150C[-6],RC7+4,FALSE) -> 9|10|11 | L11: =HLOOKUP(R2C[-6],R2C[-6]:R150C[-6],RC7+2,FALSE)&"|"&HLOOKUP(R2C[-6],R2C[-6]:R150C[-6],RC7+3,FALSE)&"|"&HLOOKUP(R2C[-6],R2C[-6]:R150C[-6],RC7+4,FALSE) -> 8|21|11
A12: 10 | B12: =ROW()-3 -> 9 | C12: 竞技场 | D12: 竞技场开放，无数英雄，共争高下！ | E12: =INT(RC[-4]) -> 10 | F12: 21 | G12: =VLOOKUP(RC[1]-0.1,C1:C2,2,TRUE)+1 -> 9 | H12: 10 | I12: =R2C7&HLOOKUP(R2C[-6],R2C[-6]:R150C[-6],RC7+2,FALSE)&R2C7&"|"&R2C7&HLOOKUP(R2C[-6],R2C[-6]:R150C[-6],RC7+3,FALSE)&R2C7&"|"&R2C7&HLOOKUP(R2C[-6],R2C[-6]:R150C[-6],RC7+4,FALSE)&R2C7 -> "竞技场"|"英雄商店"|"日常任务" | J12: =R2C7&HLOOKUP(R2C[-6],R2C[-6]:R150C[-6],RC7+2,FALSE)&R2C7&"|"&R2C7&HLOOKUP(R2C[-6],R2C[-6]:R150C[-6],RC7+3,FALSE)&R2C7&"|"&R2C7&HLOOKUP(R2C[-6],R2C[-6]:R150C[-6],RC7+4,FALSE)&R2C7 -> "竞技场开放，无数英雄，共争高下！"|"英雄商店开启，兑换心仪英雄！"|"完成每日任务，每日领钻石！" | K12: =HLOOKUP(R2C[-6],R2C[-6]:R150C[-6],RC7+2,FALSE)&"|"&HLOOKUP(R2C[-6],R2C[-6]:R150C[-6],RC7+3,FALSE)&"|"&HLOOKUP(R2C[-6],R2C[-6]:R150C[-6],RC7+4,FALSE) -> 10|11|12 | L12: =HLOOKUP(R2C[-6],R2C[-6]:R150C[-6],RC7+2,FALSE)&"|"&HLOOKUP(R2C[-6],R2C[-6]:R150C[-6],RC7+3,FALSE)&"|"&HLOOKUP(R2C[-6],R2C[-6]:R150C[-6],RC7+4,FALSE) -> 21|11|3
A13: 11 | B13: =ROW()-3 -> 10 | C13: 英雄商店 | D13: 英雄商店开启，兑换心仪英雄！ | E13: =INT(RC[-4]) -> 11 | F13: 11 | G13: =VLOOKUP(RC[1]-0.1,C1:C2,2,TRUE)+1 -> 10 | H13: 11 | I13: =R2C7&HLOOKUP(R2C[-6],R2C[-6]:R150C[-6],RC7+2,FALSE)&R2C7&"|"&R2C7&HLOOKUP(R2C[-6],R2C[-6]:R150C[-6],RC7+3,FALSE)&R2C7&"|"&R2C7&HLOOKUP(R2C[-6],R2C[-6]:R150C[-6],RC7+4,FALSE)&R2C7 -> "英雄商店"|"日常任务"|"圣器争夺" | J13: =R2C7&HLOOKUP(R2C[-6],R2C[-6]:R150C[-6],RC7+2,FALSE)&R2C7&"|"&R2C7&HLOOKUP(R2C[-6],R2C[-6]:R150C[-6],RC7+3,FALSE)&R2C7&"|"&R2C7&HLOOKUP(R2C[-6],R2C[-6]:R150C[-6],RC7+4,FALSE)&R2C7 -> "英雄商店开启，兑换心仪英雄！"|"完成每日任务，每日领钻石！"|"收集圣器，英雄实力再提升！" | K13: =HLOOKUP(R2C[-6],R2C[-6]:R150C[-6],RC7+2,FALSE)&"|"&HLOOKUP(R2C[-6],R2C[-6]:R150C[-6],RC7+3,FALSE)&"|"&HLOOKUP(R2C[-6],R2C[-6]:R150C[-6],RC7+4,FALSE) -> 11|12|13 | L13: =HLOOKUP(R2C[-6],R2C[-6]:R150C[-6],RC7+2,FALSE)&"|"&HLOOKUP(R2C[-6],R2C[-6]:R150C[-6],RC7+3,FALSE)&"|"&HLOOKUP(R2C[-6],R2C[-6]:R150C[-6],RC7+4,FALSE) -> 11|3|19
A14: 12 | B14: =ROW()-3 -> 11 | C14: 日常任务 | D14: 完成每日任务，每日领钻石！ | E14: =INT(RC[-4]) -> 12 | F14: 3 | G14: =VLOOKUP(RC[1]-0.1,C1:C2,2,TRUE)+1 -> 11 | H14: 12 | I14: =R2C7&HLOOKUP(R2C[-6],R2C[-6]:R150C[-6],RC7+2,FALSE)&R2C7&"|"&R2C7&HLOOKUP(R2C[-6],R2C[-6]:R150C[-6],RC7+3,FALSE)&R2C7&"|"&R2C7&HLOOKUP(R2C[-6],R2C[-6]:R150C[-6],RC7+4,FALSE)&R2C7 -> "日常任务"|"圣器争夺"|"第四阵位" | J14: =R2C7&HLOOKUP(R2C[-6],R2C[-6]:R150C[-6],RC7+2,FALSE)&R2C7&"|"&R2C7&HLOOKUP(R2C[-6],R2C[-6]:R150C[-6],RC7+3,FALSE)&R2C7&"|"&R2C7&HLOOKUP(R2C[-6],R2C[-6]:R150C[-6],RC7+4,FALSE)&R2C7 -> "完成每日任务，每日领钻石！"|"收集圣器，英雄实力再提升！"|"第四阵位开启，队伍再次壮大！" | K14: =HLOOKUP(R2C[-6],R2C[-6]:R150C[-6],RC7+2,FALSE)&"|"&HLOOKUP(R2C[-6],R2C[-6]:R150C[-6],RC7+3,FALSE)&"|"&HLOOKUP(R2C[-6],R2C[-6]:R150C[-6],RC7+4,FALSE) -> 12|13|15 | L14: =HLOOKUP(R2C[-6],R2C[-6]:R150C[-6],RC7+2,FALSE)&"|"&HLOOKUP(R2C[-6],R2C[-6]:R150C[-6],RC7+3,FALSE)&"|"&HLOOKUP(R2C[-6],R2C[-6]:R150C[-6],RC7+4,FALSE) -> 3|19|8
A15: 13 | B15: =ROW()-3 -> 12 | C15: 圣器争夺 | D15: 收集圣器，英雄实力再提升！ | E15: =INT(RC[-4]) -> 13 | F15: 19 | G15: =VLOOKUP(RC[1]-0.1,C1:C2,2,TRUE)+1 -> 12 | H15: 13 | I15: =R2C7&HLOOKUP(R2C[-6],R2C[-6]:R150C[-6],RC7+2,FALSE)&R2C7&"|"&R2C7&HLOOKUP(R2C[-6],R2C[-6]:R150C[-6],RC7+3,FALSE)&R2C7&"|"&R2C7&HLOOKUP(R2C[-6],R2C[-6]:R150C[-6],RC7+4,FALSE)&R2C7 -> "圣器争夺"|"第四阵位"|"回收" | J15: =R2C7&HLOOKUP(R2C[-6],R2C[-6]:R150C[-6],RC7+2,FALSE)&R2C7&"|"&R2C7&HLOOKUP(R2C[-6],R2C[-6]:R150C[-6],RC7+3,FALSE)&R2C7&"|"&R2C7&HLOOKUP(R2C[-6],R2C[-6]:R150C[-6],RC7+4,FALSE)&R2C7 -> "收集圣器，英雄实力再提升！"|"第四阵位开启，队伍再次壮大！"|"回收再利用，再无后顾之忧！" | K15: =HLOOKUP(R2C[-6],R2C[-6]:R150C[-6],RC7+2,FALSE)&"|"&HLOOKUP(R2C[-6],R2C[-6]:R150C[-6],RC7+3,FALSE)&"|"&HLOOKUP(R2C[-6],R2C[-6]:R150C[-6],RC7+4,FALSE) -> 13|15|17 | L15: =HLOOKUP(R2C[-6],R2C[-6]:R150C[-6],RC7+2,FALSE)&"|"&HLOOKUP(R2C[-6],R2C[-6]:R150C[-6],RC7+3,FALSE)&"|"&HLOOKUP(R2C[-6],R2C[-6]:R150C[-6],RC7+4,FALSE) -> 19|8|23
A16: 15 | B16: =ROW()-3 -> 13 | C16: 第四阵位 | D16: 第四阵位开启，队伍再次壮大！ | E16: =INT(RC[-4]) -> 15 | F16: 8 | G16: =VLOOKUP(RC[1]-0.1,C1:C2,2,TRUE)+1 -> 13 | H16: 14 | I16: =R2C7&HLOOKUP(R2C[-6],R2C[-6]:R150C[-6],RC7+2,FALSE)&R2C7&"|"&R2C7&HLOOKUP(R2C[-6],R2C[-6]:R150C[-6],RC7+3,FALSE)&R2C7&"|"&R2C7&HLOOKUP(R2C[-6],R2C[-6]:R150C[-6],RC7+4,FALSE)&R2C7 -> "第四阵位"|"回收"|"副本扫荡" | J16: =R2C7&HLOOKUP(R2C[-6],R2C[-6]:R150C[-6],RC7+2,FALSE)&R2C7&"|"&R2C7&HLOOKUP(R2C[-6],R2C[-6]:R150C[-6],RC7+3,FALSE)&R2C7&"|"&R2C7&HLOOKUP(R2C[-6],R2C[-6]:R150C[-6],RC7+4,FALSE)&R2C7 -> "第四阵位开启，队伍再次壮大！"|"回收再利用，再无后顾之忧！"|"扫荡功能开启，副本扫荡省心省力！" | K16: =HLOOKUP(R2C[-6],R2C[-6]:R150C[-6],RC7+2,FALSE)&"|"&HLOOKUP(R2C[-6],R2C[-6]:R150C[-6],RC7+3,FALSE)&"|"&HLOOKUP(R2C[-6],R2C[-6]:R150C[-6],RC7+4,FALSE) -> 15|17|17 | L16: =HLOOKUP(R2C[-6],R2C[-6]:R150C[-6],RC7+2,FALSE)&"|"&HLOOKUP(R2C[-6],R2C[-6]:R150C[-6],RC7+3,FALSE)&"|"&HLOOKUP(R2C[-6],R2C[-6]:R150C[-6],RC7+4,FALSE) -> 8|23|1
A17: 17 | B17: =ROW()-3 -> 14 | C17: 回收 | D17: 回收再利用，再无后顾之忧！ | E17: =INT(RC[-4]) -> 17 | F17: 23 | G17: =VLOOKUP(RC[1]-0.1,C1:C2,2,TRUE)+1 -> 13 | H17: 15 | I17: =R2C7&HLOOKUP(R2C[-6],R2C[-6]:R150C[-6],RC7+2,FALSE)&R2C7&"|"&R2C7&HLOOKUP(R2C[-6],R2C[-6]:R150C[-6],RC7+3,FALSE)&R2C7&"|"&R2C7&HLOOKUP(R2C[-6],R2C[-6]:R150C[-6],RC7+4,FALSE)&R2C7 -> "第四阵位"|"回收"|"副本扫荡" | J17: =R2C7&HLOOKUP(R2C[-6],R2C[-6]:R150C[-6],RC7+2,FALSE)&R2C7&"|"&R2C7&HLOOKUP(R2C[-6],R2C[-6]:R150C[-6],RC7+3,FALSE)&R2C7&"|"&R2C7&HLOOKUP(R2C[-6],R2C[-6]:R150C[-6],RC7+4,FALSE)&R2C7 -> "第四阵位开启，队伍再次壮大！"|"回收再利用，再无后顾之忧！"|"扫荡功能开启，副本扫荡省心省力！" | K17: =HLOOKUP(R2C[-6],R2C[-6]:R150C[-6],RC7+2,FALSE)&"|"&HLOOKUP(R2C[-6],R2C[-6]:R150C[-6],RC7+3,FALSE)&"|"&HLOOKUP(R2C[-6],R2C[-6]:R150C[-6],RC7+4,FALSE) -> 15|17|17 | L17: =HLOOKUP(R2C[-6],R2C[-6]:R150C[-6],RC7+2,FALSE)&"|"&HLOOKUP(R2C[-6],R2C[-6]:R150C[-6],RC7+3,FALSE)&"|"&HLOOKUP(R2C[-6],R2C[-6]:R150C[-6],RC7+4,FALSE) -> 8|23|1
A18: 17.1 | B18: =ROW()-3 -> 15 | C18: 副本扫荡 | D18: 扫荡功能开启，副本扫荡省心省力！ | E18: =INT(RC[-4]) -> 17 | F18: 1 | G18: =VLOOKUP(RC[1]-0.1,C1:C2,2,TRUE)+1 -> 14 | H18: 16 | I18: =R2C7&HLOOKUP(R2C[-6],R2C[-6]:R150C[-6],RC7+2,FALSE)&R2C7&"|"&R2C7&HLOOKUP(R2C[-6],R2C[-6]:R150C[-6],RC7+3,FALSE)&R2C7&"|"&R2C7&HLOOKUP(R2C[-6],R2C[-6]:R150C[-6],RC7+4,FALSE)&R2C7 -> "回收"|"副本扫荡"|"勋章" | J18: =R2C7&HLOOKUP(R2C[-6],R2C[-6]:R150C[-6],RC7+2,FALSE)&R2C7&"|"&R2C7&HLOOKUP(R2C[-6],R2C[-6]:R150C[-6],RC7+3,FALSE)&R2C7&"|"&R2C7&HLOOKUP(R2C[-6],R2C[-6]:R150C[-6],RC7+4,FALSE)&R2C7 -> "回收再利用，再无后顾之忧！"|"扫荡功能开启，副本扫荡省心省力！"|"实力的证明，战争的荣光！" | K18: =HLOOKUP(R2C[-6],R2C[-6]:R150C[-6],RC7+2,FALSE)&"|"&HLOOKUP(R2C[-6],R2C[-6]:R150C[-6],RC7+3,FALSE)&"|"&HLOOKUP(R2C[-6],R2C[-6]:R150C[-6],RC7+4,FALSE) -> 17|17|18 | L18: =HLOOKUP(R2C[-6],R2C[-6]:R150C[-6],RC7+2,FALSE)&"|"&HLOOKUP(R2C[-6],R2C[-6]:R150C[-6],RC7+3,FALSE)&"|"&HLOOKUP(R2C[-6],R2C[-6]:R150C[-6],RC7+4,FALSE) -> 23|1|92
A19: 18 | B19: =ROW()-3 -> 16 | C19: 勋章 | D19: 实力的证明，战争的荣光！ | E19: =INT(RC[-4]) -> 18 | F19: 92 | G19: =VLOOKUP(RC[1]-0.1,C1:C2,2,TRUE)+1 -> 14 | H19: 17 | I19: =R2C7&HLOOKUP(R2C[-6],R2C[-6]:R150C[-6],RC7+2,FALSE)&R2C7&"|"&R2C7&HLOOKUP(R2C[-6],R2C[-6]:R150C[-6],RC7+3,FALSE)&R2C7&"|"&R2C7&HLOOKUP(R2C[-6],R2C[-6]:R150C[-6],RC7+4,FALSE)&R2C7 -> "回收"|"副本扫荡"|"勋章" | J19: =R2C7&HLOOKUP(R2C[-6],R2C[-6]:R150C[-6],RC7+2,FALSE)&R2C7&"|"&R2C7&HLOOKUP(R2C[-6],R2C[-6]:R150C[-6],RC7+3,FALSE)&R2C7&"|"&R2C7&HLOOKUP(R2C[-6],R2C[-6]:R150C[-6],RC7+4,FALSE)&R2C7 -> "回收再利用，再无后顾之忧！"|"扫荡功能开启，副本扫荡省心省力！"|"实力的证明，战争的荣光！" | K19: =HLOOKUP(R2C[-6],R2C[-6]:R150C[-6],RC7+2,FALSE)&"|"&HLOOKUP(R2C[-6],R2C[-6]:R150C[-6],RC7+3,FALSE)&"|"&HLOOKUP(R2C[-6],R2C[-6]:R150C[-6],RC7+4,FALSE) -> 17|17|18 | L19: =HLOOKUP(R2C[-6],R2C[-6]:R150C[-6],RC7+2,FALSE)&"|"&HLOOKUP(R2C[-6],R2C[-6]:R150C[-6],RC7+3,FALSE)&"|"&HLOOKUP(R2C[-6],R2C[-6]:R150C[-6],RC7+4,FALSE) -> 23|1|92
A20: 20 | B20: =ROW()-3 -> 17 | C20: 勇者试练 | D20: 勇者试练开启，获取高阶装备！ | E20: =INT(RC[-4]) -> 20 | F20: 17 | G20: =VLOOKUP(RC[1]-0.1,C1:C2,2,TRUE)+1 -> 16 | H20: 18 | I20: =R2C7&HLOOKUP(R2C[-6],R2C[-6]:R150C[-6],RC7+2,FALSE)&R2C7&"|"&R2C7&HLOOKUP(R2C[-6],R2C[-6]:R150C[-6],RC7+3,FALSE)&R2C7&"|"&R2C7&HLOOKUP(R2C[-6],R2C[-6]:R150C[-6],RC7+4,FALSE)&R2C7 -> "勋章"|"勇者试练"|"第五阵位" | J20: =R2C7&HLOOKUP(R2C[-6],R2C[-6]:R150C[-6],RC7+2,FALSE)&R2C7&"|"&R2C7&HLOOKUP(R2C[-6],R2C[-6]:R150C[-6],RC7+3,FALSE)&R2C7&"|"&R2C7&HLOOKUP(R2C[-6],R2C[-6]:R150C[-6],RC7+4,FALSE)&R2C7 -> "实力的证明，战争的荣光！"|"勇者试练开启，获取高阶装备！"|"第五阵位开启，强力阵容成型！" | K20: =HLOOKUP(R2C[-6],R2C[-6]:R150C[-6],RC7+2,FALSE)&"|"&HLOOKUP(R2C[-6],R2C[-6]:R150C[-6],RC7+3,FALSE)&"|"&HLOOKUP(R2C[-6],R2C[-6]:R150C[-6],RC7+4,FALSE) -> 18|20|22 | L20: =HLOOKUP(R2C[-6],R2C[-6]:R150C[-6],RC7+2,FALSE)&"|"&HLOOKUP(R2C[-6],R2C[-6]:R150C[-6],RC7+3,FALSE)&"|"&HLOOKUP(R2C[-6],R2C[-6]:R150C[-6],RC7+4,FALSE) -> 92|17|8
A21: 22 | B21: =ROW()-3 -> 18 | C21: 第五阵位 | D21: 第五阵位开启，强力阵容成型！ | E21: =INT(RC[-4]) -> 22 | F21: 8 | G21: =VLOOKUP(RC[1]-0.1,C1:C2,2,TRUE)+1 -> 17 | H21: 19 | I21: =R2C7&HLOOKUP(R2C[-6],R2C[-6]:R150C[-6],RC7+2,FALSE)&R2C7&"|"&R2C7&HLOOKUP(R2C[-6],R2C[-6]:R150C[-6],RC7+3,FALSE)&R2C7&"|"&R2C7&HLOOKUP(R2C[-6],R2C[-6]:R150C[-6],RC7+4,FALSE)&R2C7 -> "勇者试练"|"第五阵位"|"精灵" | J21: =R2C7&HLOOKUP(R2C[-6],R2C[-6]:R150C[-6],RC7+2,FALSE)&R2C7&"|"&R2C7&HLOOKUP(R2C[-6],R2C[-6]:R150C[-6],RC7+3,FALSE)&R2C7&"|"&R2C7&HLOOKUP(R2C[-6],R2C[-6]:R150C[-6],RC7+4,FALSE)&R2C7 -> "勇者试练开启，获取高阶装备！"|"第五阵位开启，强力阵容成型！"|"精灵助战，强力BUFF效果！" | K21: =HLOOKUP(R2C[-6],R2C[-6]:R150C[-6],RC7+2,FALSE)&"|"&HLOOKUP(R2C[-6],R2C[-6]:R150C[-6],RC7+3,FALSE)&"|"&HLOOKUP(R2C[-6],R2C[-6]:R150C[-6],RC7+4,FALSE) -> 20|22|23 | L21: =HLOOKUP(R2C[-6],R2C[-6]:R150C[-6],RC7+2,FALSE)&"|"&HLOOKUP(R2C[-6],R2C[-6]:R150C[-6],RC7+3,FALSE)&"|"&HLOOKUP(R2C[-6],R2C[-6]:R150C[-6],RC7+4,FALSE) -> 17|8|63
A22: 23 | B22: =ROW()-3 -> 19 | C22: 精灵 | D22: 精灵助战，强力BUFF效果！ | E22: =INT(RC[-4]) -> 23 | F22: 63 | G22: =VLOOKUP(RC[1]-0.1,C1:C2,2,TRUE)+1 -> 17 | H22: 20 | I22: =R2C7&HLOOKUP(R2C[-6],R2C[-6]:R150C[-6],RC7+2,FALSE)&R2C7&"|"&R2C7&HLOOKUP(R2C[-6],R2C[-6]:R150C[-6],RC7+3,FALSE)&R2C7&"|"&R2C7&HLOOKUP(R2C[-6],R2C[-6]:R150C[-6],RC7+4,FALSE)&R2C7 -> "勇者试练"|"第五阵位"|"精灵" | J22: =R2C7&HLOOKUP(R2C[-6],R2C[-6]:R150C[-6],RC7+2,FALSE)&R2C7&"|"&R2C7&HLOOKUP(R2C[-6],R2C[-6]:R150C[-6],RC7+3,FALSE)&R2C7&"|"&R2C7&HLOOKUP(R2C[-6],R2C[-6]:R150C[-6],RC7+4,FALSE)&R2C7 -> "勇者试练开启，获取高阶装备！"|"第五阵位开启，强力阵容成型！"|"精灵助战，强力BUFF效果！" | K22: =HLOOKUP(R2C[-6],R2C[-6]:R150C[-6],RC7+2,FALSE)&"|"&HLOOKUP(R2C[-6],R2C[-6]:R150C[-6],RC7+3,FALSE)&"|"&HLOOKUP(R2C[-6],R2C[-6]:R150C[-6],RC7+4,FALSE) -> 20|22|23 | L22: =HLOOKUP(R2C[-6],R2C[-6]:R150C[-6],RC7+2,FALSE)&"|"&HLOOKUP(R2C[-6],R2C[-6]:R150C[-6],RC7+3,FALSE)&"|"&HLOOKUP(R2C[-6],R2C[-6]:R150C[-6],RC7+4,FALSE) -> 17|8|63
A23: 23.1 | B23: =ROW()-3 -> 20 | C23: 军团 | D23: 军团开启，并肩作战！ | E23: =INT(RC[-4]) -> 23 | F23: 22 | G23: =VLOOKUP(RC[1]-0.1,C1:C2,2,TRUE)+1 -> 18 | H23: 21 | I23: =R2C7&HLOOKUP(R2C[-6],R2C[-6]:R150C[-6],RC7+2,FALSE)&R2C7&"|"&R2C7&HLOOKUP(R2C[-6],R2C[-6]:R150C[-6],RC7+3,FALSE)&R2C7&"|"&R2C7&HLOOKUP(R2C[-6],R2C[-6]:R150C[-6],RC7+4,FALSE)&R2C7 -> "第五阵位"|"精灵"|"军团" | J23: =R2C7&HLOOKUP(R2C[-6],R2C[-6]:R150C[-6],RC7+2,FALSE)&R2C7&"|"&R2C7&HLOOKUP(R2C[-6],R2C[-6]:R150C[-6],RC7+3,FALSE)&R2C7&"|"&R2C7&HLOOKUP(R2C[-6],R2C[-6]:R150C[-6],RC7+4,FALSE)&R2C7 -> "第五阵位开启，强力阵容成型！"|"精灵助战，强力BUFF效果！"|"军团开启，并肩作战！" | K23: =HLOOKUP(R2C[-6],R2C[-6]:R150C[-6],RC7+2,FALSE)&"|"&HLOOKUP(R2C[-6],R2C[-6]:R150C[-6],RC7+3,FALSE)&"|"&HLOOKUP(R2C[-6],R2C[-6]:R150C[-6],RC7+4,FALSE) -> 22|23|23 | L23: =HLOOKUP(R2C[-6],R2C[-6]:R150C[-6],RC7+2,FALSE)&"|"&HLOOKUP(R2C[-6],R2C[-6]:R150C[-6],RC7+3,FALSE)&"|"&HLOOKUP(R2C[-6],R2C[-6]:R150C[-6],RC7+4,FALSE) -> 8|63|22
A24: 23.2 | B24: =ROW()-3 -> 21 | C24: 精灵升级 | D24: 精灵升级，更进一步！ | E24: =INT(RC[-4]) -> 23 | F24: 64 | G24: =VLOOKUP(RC[1]-0.1,C1:C2,2,TRUE)+1 -> 18 | H24: 22 | I24: =R2C7&HLOOKUP(R2C[-6],R2C[-6]:R150C[-6],RC7+2,FALSE)&R2C7&"|"&R2C7&HLOOKUP(R2C[-6],R2C[-6]:R150C[-6],RC7+3,FALSE)&R2C7&"|"&R2C7&HLOOKUP(R2C[-6],R2C[-6]:R150C[-6],RC7+4,FALSE)&R2C7 -> "第五阵位"|"精灵"|"军团" | J24: =R2C7&HLOOKUP(R2C[-6],R2C[-6]:R150C[-6],RC7+2,FALSE)&R2C7&"|"&R2C7&HLOOKUP(R2C[-6],R2C[-6]:R150C[-6],RC7+3,FALSE)&R2C7&"|"&R2C7&HLOOKUP(R2C[-6],R2C[-6]:R150C[-6],RC7+4,FALSE)&R2C7 -> "第五阵位开启，强力阵容成型！"|"精灵助战，强力BUFF效果！"|"军团开启，并肩作战！" | K24: =HLOOKUP(R2C[-6],R2C[-6]:R150C[-6],RC7+2,FALSE)&"|"&HLOOKUP(R2C[-6],R2C[-6]:R150C[-6],RC7+3,FALSE)&"|"&HLOOKUP(R2C[-6],R2C[-6]:R150C[-6],RC7+4,FALSE) -> 22|23|23 | L24: =HLOOKUP(R2C[-6],R2C[-6]:R150C[-6],RC7+2,FALSE)&"|"&HLOOKUP(R2C[-6],R2C[-6]:R150C[-6],RC7+3,FALSE)&"|"&HLOOKUP(R2C[-6],R2C[-6]:R150C[-6],RC7+4,FALSE) -> 8|63|22
A25: 24 | B25: =ROW()-3 -> 22 | C25: 日常副本-传承核心 | D25: 通关日常副本，每日领取大量奖励！ | E25: =INT(RC[-4]) -> 24 | F25: 2 | G25: =VLOOKUP(RC[1]-0.1,C1:C2,2,TRUE)+1 -> 19 | H25: 23 | I25: =R2C7&HLOOKUP(R2C[-6],R2C[-6]:R150C[-6],RC7+2,FALSE)&R2C7&"|"&R2C7&HLOOKUP(R2C[-6],R2C[-6]:R150C[-6],RC7+3,FALSE)&R2C7&"|"&R2C7&HLOOKUP(R2C[-6],R2C[-6]:R150C[-6],RC7+4,FALSE)&R2C7 -> "精灵"|"军团"|"精灵升级" | J25: =R2C7&HLOOKUP(R2C[-6],R2C[-6]:R150C[-6],RC7+2,FALSE)&R2C7&"|"&R2C7&HLOOKUP(R2C[-6],R2C[-6]:R150C[-6],RC7+3,FALSE)&R2C7&"|"&R2C7&HLOOKUP(R2C[-6],R2C[-6]:R150C[-6],RC7+4,FALSE)&R2C7 -> "精灵助战，强力BUFF效果！"|"军团开启，并肩作战！"|"精灵升级，更进一步！" | K25: =HLOOKUP(R2C[-6],R2C[-6]:R150C[-6],RC7+2,FALSE)&"|"&HLOOKUP(R2C[-6],R2C[-6]:R150C[-6],RC7+3,FALSE)&"|"&HLOOKUP(R2C[-6],R2C[-6]:R150C[-6],RC7+4,FALSE) -> 23|23|23 | L25: =HLOOKUP(R2C[-6],R2C[-6]:R150C[-6],RC7+2,FALSE)&"|"&HLOOKUP(R2C[-6],R2C[-6]:R150C[-6],RC7+3,FALSE)&"|"&HLOOKUP(R2C[-6],R2C[-6]:R150C[-6],RC7+4,FALSE) -> 63|22|64
A26: 25 | B26: =ROW()-3 -> 23 | C26: 寻访遗迹 | D26: 遗迹开启，无限的宝物等待你挖掘！ | E26: =INT(RC[-4]) -> 25 | F26: 20 | G26: =VLOOKUP(RC[1]-0.1,C1:C2,2,TRUE)+1 -> 22 | H26: 24 | I26: =R2C7&HLOOKUP(R2C[-6],R2C[-6]:R150C[-6],RC7+2,FALSE)&R2C7&"|"&R2C7&HLOOKUP(R2C[-6],R2C[-6]:R150C[-6],RC7+3,FALSE)&R2C7&"|"&R2C7&HLOOKUP(R2C[-6],R2C[-6]:R150C[-6],RC7+4,FALSE)&R2C7 -> "日常副本-传承核心"|"寻访遗迹"|"怪物攻城" | J26: =R2C7&HLOOKUP(R2C[-6],R2C[-6]:R150C[-6],RC7+2,FALSE)&R2C7&"|"&R2C7&HLOOKUP(R2C[-6],R2C[-6]:R150C[-6],RC7+3,FALSE)&R2C7&"|"&R2C7&HLOOKUP(R2C[-6],R2C[-6]:R150C[-6],RC7+4,FALSE)&R2C7 -> "通关日常副本，每日领取大量奖励！"|"遗迹开启，无限的宝物等待你挖掘！"|"参与怪物攻城，赢取大量材料！" | K26: =HLOOKUP(R2C[-6],R2C[-6]:R150C[-6],RC7+2,FALSE)&"|"&HLOOKUP(R2C[-6],R2C[-6]:R150C[-6],RC7+3,FALSE)&"|"&HLOOKUP(R2C[-6],R2C[-6]:R150C[-6],RC7+4,FALSE) -> 24|25|25 | L26: =HLOOKUP(R2C[-6],R2C[-6]:R150C[-6],RC7+2,FALSE)&"|"&HLOOKUP(R2C[-6],R2C[-6]:R150C[-6],RC7+3,FALSE)&"|"&HLOOKUP(R2C[-6],R2C[-6]:R150C[-6],RC7+4,FALSE) -> 2|20|84
A27: 25.1 | B27: =ROW()-3 -> 24 | C27: 怪物攻城 | D27: 参与怪物攻城，赢取大量材料！ | E27: =INT(RC[-4]) -> 25 | F27: 84 | G27: =VLOOKUP(RC[1]-0.1,C1:C2,2,TRUE)+1 -> 23 | H27: 25 | I27: =R2C7&HLOOKUP(R2C[-6],R2C[-6]:R150C[-6],RC7+2,FALSE)&R2C7&"|"&R2C7&HLOOKUP(R2C[-6],R2C[-6]:R150C[-6],RC7+3,FALSE)&R2C7&"|"&R2C7&HLOOKUP(R2C[-6],R2C[-6]:R150C[-6],RC7+4,FALSE)&R2C7 -> "寻访遗迹"|"怪物攻城"|"援军" | J27: =R2C7&HLOOKUP(R2C[-6],R2C[-6]:R150C[-6],RC7+2,FALSE)&R2C7&"|"&R2C7&HLOOKUP(R2C[-6],R2C[-6]:R150C[-6],RC7+3,FALSE)&R2C7&"|"&R2C7&HLOOKUP(R2C[-6],R2C[-6]:R150C[-6],RC7+4,FALSE)&R2C7 -> "遗迹开启，无限的宝物等待你挖掘！"|"参与怪物攻城，赢取大量材料！"|"援军一号位开启，激活额外宿命！" | K27: =HLOOKUP(R2C[-6],R2C[-6]:R150C[-6],RC7+2,FALSE)&"|"&HLOOKUP(R2C[-6],R2C[-6]:R150C[-6],RC7+3,FALSE)&"|"&HLOOKUP(R2C[-6],R2C[-6]:R150C[-6],RC7+4,FALSE) -> 25|25|26 | L27: =HLOOKUP(R2C[-6],R2C[-6]:R150C[-6],RC7+2,FALSE)&"|"&HLOOKUP(R2C[-6],R2C[-6]:R150C[-6],RC7+3,FALSE)&"|"&HLOOKUP(R2C[-6],R2C[-6]:R150C[-6],RC7+4,FALSE) -> 20|84|8
A28: 26 | B28: =ROW()-3 -> 25 | C28: 援军 | D28: 援军一号位开启，激活额外宿命！ | E28: =INT(RC[-4]) -> 26 | F28: 8 | G28: =VLOOKUP(RC[1]-0.1,C1:C2,2,TRUE)+1 -> 25 | H28: 26 | I28: =R2C7&HLOOKUP(R2C[-6],R2C[-6]:R150C[-6],RC7+2,FALSE)&R2C7&"|"&R2C7&HLOOKUP(R2C[-6],R2C[-6]:R150C[-6],RC7+3,FALSE)&R2C7&"|"&R2C7&HLOOKUP(R2C[-6],R2C[-6]:R150C[-6],RC7+4,FALSE)&R2C7 -> "援军"|"日常副本-金币"|"英雄副本" | J28: =R2C7&HLOOKUP(R2C[-6],R2C[-6]:R150C[-6],RC7+2,FALSE)&R2C7&"|"&R2C7&HLOOKUP(R2C[-6],R2C[-6]:R150C[-6],RC7+3,FALSE)&R2C7&"|"&R2C7&HLOOKUP(R2C[-6],R2C[-6]:R150C[-6],RC7+4,FALSE)&R2C7 -> "援军一号位开启，激活额外宿命！"|"通关日常副本，每日领取大量奖励！"|"英雄副本开启，挑战获得钻石奖励！" | K28: =HLOOKUP(R2C[-6],R2C[-6]:R150C[-6],RC7+2,FALSE)&"|"&HLOOKUP(R2C[-6],R2C[-6]:R150C[-6],RC7+3,FALSE)&"|"&HLOOKUP(R2C[-6],R2C[-6]:R150C[-6],RC7+4,FALSE) -> 26|26|27 | L28: =HLOOKUP(R2C[-6],R2C[-6]:R150C[-6],RC7+2,FALSE)&"|"&HLOOKUP(R2C[-6],R2C[-6]:R150C[-6],RC7+3,FALSE)&"|"&HLOOKUP(R2C[-6],R2C[-6]:R150C[-6],RC7+4,FALSE) -> 8|2|27
A29: 26.1 | B29: =ROW()-3 -> 26 | C29: 日常副本-金币 | D29: 通关日常副本，每日领取大量奖励！ | E29: =INT(RC[-4]) -> 26 | F29: 2 | G29: =VLOOKUP(RC[1]-0.1,C1:C2,2,TRUE)+1 -> 27 | H29: 27 | I29: =R2C7&HLOOKUP(R2C[-6],R2C[-6]:R150C[-6],RC7+2,FALSE)&R2C7&"|"&R2C7&HLOOKUP(R2C[-6],R2C[-6]:R150C[-6],RC7+3,FALSE)&R2C7&"|"&R2C7&HLOOKUP(R2C[-6],R2C[-6]:R150C[-6],RC7+4,FALSE)&R2C7 -> "英雄副本"|"勇者试练-精英挑战"|"装备精炼" | J29: =R2C7&HLOOKUP(R2C[-6],R2C[-6]:R150C[-6],RC7+2,FALSE)&R2C7&"|"&R2C7&HLOOKUP(R2C[-6],R2C[-6]:R150C[-6],RC7+3,FALSE)&R2C7&"|"&R2C7&HLOOKUP(R2C[-6],R2C[-6]:R150C[-6],RC7+4,FALSE)&R2C7 -> "英雄副本开启，挑战获得钻石奖励！"|"前往挑战精英，赢取大量威名！"|"装备精炼开启，进一步提升装备！" | K29: =HLOOKUP(R2C[-6],R2C[-6]:R150C[-6],RC7+2,FALSE)&"|"&HLOOKUP(R2C[-6],R2C[-6]:R150C[-6],RC7+3,FALSE)&"|"&HLOOKUP(R2C[-6],R2C[-6]:R150C[-6],RC7+4,FALSE) -> 27|28|29 | L29: =HLOOKUP(R2C[-6],R2C[-6]:R150C[-6],RC7+2,FALSE)&"|"&HLOOKUP(R2C[-6],R2C[-6]:R150C[-6],RC7+3,FALSE)&"|"&HLOOKUP(R2C[-6],R2C[-6]:R150C[-6],RC7+4,FALSE) -> 27|105|8
A30: 27 | B30: =ROW()-3 -> 27 | C30: 英雄副本 | D30: 英雄副本开启，挑战获得钻石奖励！ | E30: =INT(RC[-4]) -> 27 | F30: 27 | G30: =VLOOKUP(RC[1]-0.1,C1:C2,2,TRUE)+1 -> 28 | H30: 28 | I30: =R2C7&HLOOKUP(R2C[-6],R2C[-6]:R150C[-6],RC7+2,FALSE)&R2C7&"|"&R2C7&HLOOKUP(R2C[-6],R2C[-6]:R150C[-6],RC7+3,FALSE)&R2C7&"|"&R2C7&HLOOKUP(R2C[-6],R2C[-6]:R150C[-6],RC7+4,FALSE)&R2C7 -> "勇者试练-精英挑战"|"装备精炼"|"日常副本-装备精炼石" | J30: =R2C7&HLOOKUP(R2C[-6],R2C[-6]:R150C[-6],RC7+2,FALSE)&R2C7&"|"&R2C7&HLOOKUP(R2C[-6],R2C[-6]:R150C[-6],RC7+3,FALSE)&R2C7&"|"&R2C7&HLOOKUP(R2C[-6],R2C[-6]:R150C[-6],RC7+4,FALSE)&R2C7 -> "前往挑战精英，赢取大量威名！"|"装备精炼开启，进一步提升装备！"|"通关日常副本，每日领取大量奖励！" | K30: =HLOOKUP(R2C[-6],R2C[-6]:R150C[-6],RC7+2,FALSE)&"|"&HLOOKUP(R2C[-6],R2C[-6]:R150C[-6],RC7+3,FALSE)&"|"&HLOOKUP(R2C[-6],R2C[-6]:R150C[-6],RC7+4,FALSE) -> 28|29|29 | L30: =HLOOKUP(R2C[-6],R2C[-6]:R150C[-6],RC7+2,FALSE)&"|"&HLOOKUP(R2C[-6],R2C[-6]:R150C[-6],RC7+3,FALSE)&"|"&HLOOKUP(R2C[-6],R2C[-6]:R150C[-6],RC7+4,FALSE) -> 105|8|2
A31: 28 | B31: =ROW()-3 -> 28 | C31: 勇者试练-精英挑战 | D31: 前往挑战精英，赢取大量威名！ | E31: =INT(RC[-4]) -> 28 | F31: 105 | G31: =VLOOKUP(RC[1]-0.1,C1:C2,2,TRUE)+1 -> 29 | H31: 29 | I31: =R2C7&HLOOKUP(R2C[-6],R2C[-6]:R150C[-6],RC7+2,FALSE)&R2C7&"|"&R2C7&HLOOKUP(R2C[-6],R2C[-6]:R150C[-6],RC7+3,FALSE)&R2C7&"|"&R2C7&HLOOKUP(R2C[-6],R2C[-6]:R150C[-6],RC7+4,FALSE)&R2C7 -> "装备精炼"|"日常副本-装备精炼石"|"援军阵位2" | J31: =R2C7&HLOOKUP(R2C[-6],R2C[-6]:R150C[-6],RC7+2,FALSE)&R2C7&"|"&R2C7&HLOOKUP(R2C[-6],R2C[-6]:R150C[-6],RC7+3,FALSE)&R2C7&"|"&R2C7&HLOOKUP(R2C[-6],R2C[-6]:R150C[-6],RC7+4,FALSE)&R2C7 -> "装备精炼开启，进一步提升装备！"|"通关日常副本，每日领取大量奖励！"|"援军二号位开启，激活额外宿命！" | K31: =HLOOKUP(R2C[-6],R2C[-6]:R150C[-6],RC7+2,FALSE)&"|"&HLOOKUP(R2C[-6],R2C[-6]:R150C[-6],RC7+3,FALSE)&"|"&HLOOKUP(R2C[-6],R2C[-6]:R150C[-6],RC7+4,FALSE) -> 29|29|30 | L31: =HLOOKUP(R2C[-6],R2C[-6]:R150C[-6],RC7+2,FALSE)&"|"&HLOOKUP(R2C[-6],R2C[-6]:R150C[-6],RC7+3,FALSE)&"|"&HLOOKUP(R2C[-6],R2C[-6]:R150C[-6],RC7+4,FALSE) -> 8|2|8
A32: 29 | B32: =ROW()-3 -> 29 | C32: 装备精炼 | D32: 装备精炼开启，进一步提升装备！ | E32: =INT(RC[-4]) -> 29 | F32: 8 | G32: =VLOOKUP(RC[1]-0.1,C1:C2,2,TRUE)+1 -> 31 | H32: 30 | I32: =R2C7&HLOOKUP(R2C[-6],R2C[-6]:R150C[-6],RC7+2,FALSE)&R2C7&"|"&R2C7&HLOOKUP(R2C[-6],R2C[-6]:R150C[-6],RC7+3,FALSE)&R2C7&"|"&R2C7&HLOOKUP(R2C[-6],R2C[-6]:R150C[-6],RC7+4,FALSE)&R2C7 -> "援军阵位2"|"日常副本-进阶石"|"称号" | J32: =R2C7&HLOOKUP(R2C[-6],R2C[-6]:R150C[-6],RC7+2,FALSE)&R2C7&"|"&R2C7&HLOOKUP(R2C[-6],R2C[-6]:R150C[-6],RC7+3,FALSE)&R2C7&"|"&R2C7&HLOOKUP(R2C[-6],R2C[-6]:R150C[-6],RC7+4,FALSE)&R2C7 -> "援军二号位开启，激活额外宿命！"|"通关日常副本，每日领取大量奖励！"|"称号系统开放，逼格上升100%！" | K32: =HLOOKUP(R2C[-6],R2C[-6]:R150C[-6],RC7+2,FALSE)&"|"&HLOOKUP(R2C[-6],R2C[-6]:R150C[-6],RC7+3,FALSE)&"|"&HLOOKUP(R2C[-6],R2C[-6]:R150C[-6],RC7+4,FALSE) -> 30|31|31 | L32: =HLOOKUP(R2C[-6],R2C[-6]:R150C[-6],RC7+2,FALSE)&"|"&HLOOKUP(R2C[-6],R2C[-6]:R150C[-6],RC7+3,FALSE)&"|"&HLOOKUP(R2C[-6],R2C[-6]:R150C[-6],RC7+4,FALSE) -> 8|2|83
A33: 29.1 | B33: =ROW()-3 -> 30 | C33: 日常副本-装备精炼石 | D33: 通关日常副本，每日领取大量奖励！ | E33: =INT(RC[-4]) -> 29 | F33: 2 | G33: =VLOOKUP(RC[1]-0.1,C1:C2,2,TRUE)+1 -> 32 | H33: 31 | I33: =R2C7&HLOOKUP(R2C[-6],R2C[-6]:R150C[-6],RC7+2,FALSE)&R2C7&"|"&R2C7&HLOOKUP(R2C[-6],R2C[-6]:R150C[-6],RC7+3,FALSE)&R2C7&"|"&R2C7&HLOOKUP(R2C[-6],R2C[-6]:R150C[-6],RC7+4,FALSE)&R2C7 -> "日常副本-进阶石"|"称号"|"精灵祝福" | J33: =R2C7&HLOOKUP(R2C[-6],R2C[-6]:R150C[-6],RC7+2,FALSE)&R2C7&"|"&R2C7&HLOOKUP(R2C[-6],R2C[-6]:R150C[-6],RC7+3,FALSE)&R2C7&"|"&R2C7&HLOOKUP(R2C[-6],R2C[-6]:R150C[-6],RC7+4,FALSE)&R2C7 -> "通关日常副本，每日领取大量奖励！"|"称号系统开放，逼格上升100%！"|"精灵祝福开启，精灵助战效果提升！" | K33: =HLOOKUP(R2C[-6],R2C[-6]:R150C[-6],RC7+2,FALSE)&"|"&HLOOKUP(R2C[-6],R2C[-6]:R150C[-6],RC7+3,FALSE)&"|"&HLOOKUP(R2C[-6],R2C[-6]:R150C[-6],RC7+4,FALSE) -> 31|31|32 | L33: =HLOOKUP(R2C[-6],R2C[-6]:R150C[-6],RC7+2,FALSE)&"|"&HLOOKUP(R2C[-6],R2C[-6]:R150C[-6],RC7+3,FALSE)&"|"&HLOOKUP(R2C[-6],R2C[-6]:R150C[-6],RC7+4,FALSE) -> 2|83|63
A34: 30 | B34: =ROW()-3 -> 31 | C34: 援军阵位2 | D34: 援军二号位开启，激活额外宿命！ | E34: =INT(RC[-4]) -> 30 | F34: 8 | G34: =VLOOKUP(RC[1]-0.1,C1:C2,2,TRUE)+1 -> 34 | H34: 32 | I34: =R2C7&HLOOKUP(R2C[-6],R2C[-6]:R150C[-6],RC7+2,FALSE)&R2C7&"|"&R2C7&HLOOKUP(R2C[-6],R2C[-6]:R150C[-6],RC7+3,FALSE)&R2C7&"|"&R2C7&HLOOKUP(R2C[-6],R2C[-6]:R150C[-6],RC7+4,FALSE)&R2C7 -> "精灵祝福"|"援军阵位3"|"日常副本-圣器水晶" | J34: =R2C7&HLOOKUP(R2C[-6],R2C[-6]:R150C[-6],RC7+2,FALSE)&R2C7&"|"&R2C7&HLOOKUP(R2C[-6],R2C[-6]:R150C[-6],RC7+3,FALSE)&R2C7&"|"&R2C7&HLOOKUP(R2C[-6],R2C[-6]:R150C[-6],RC7+4,FALSE)&R2C7 -> "精灵祝福开启，精灵助战效果提升！"|"援军三号位开启，激活额外宿命！"|"通关日常副本，每日领取大量奖励！" | K34: =HLOOKUP(R2C[-6],R2C[-6]:R150C[-6],RC7+2,FALSE)&"|"&HLOOKUP(R2C[-6],R2C[-6]:R150C[-6],RC7+3,FALSE)&"|"&HLOOKUP(R2C[-6],R2C[-6]:R150C[-6],RC7+4,FALSE) -> 32|34|34 | L34: =HLOOKUP(R2C[-6],R2C[-6]:R150C[-6],RC7+2,FALSE)&"|"&HLOOKUP(R2C[-6],R2C[-6]:R150C[-6],RC7+3,FALSE)&"|"&HLOOKUP(R2C[-6],R2C[-6]:R150C[-6],RC7+4,FALSE) -> 63|8|2
A35: 31 | B35: =ROW()-3 -> 32 | C35: 日常副本-进阶石 | D35: 通关日常副本，每日领取大量奖励！ | E35: =INT(RC[-4]) -> 31 | F35: 2 | G35: =VLOOKUP(RC[1]-0.1,C1:C2,2,TRUE)+1 -> 35 | H35: 33 | I35: =R2C7&HLOOKUP(R2C[-6],R2C[-6]:R150C[-6],RC7+2,FALSE)&R2C7&"|"&R2C7&HLOOKUP(R2C[-6],R2C[-6]:R150C[-6],RC7+3,FALSE)&R2C7&"|"&R2C7&HLOOKUP(R2C[-6],R2C[-6]:R150C[-6],RC7+4,FALSE)&R2C7 -> "援军阵位3"|"日常副本-圣器水晶"|"潜能" | J35: =R2C7&HLOOKUP(R2C[-6],R2C[-6]:R150C[-6],RC7+2,FALSE)&R2C7&"|"&R2C7&HLOOKUP(R2C[-6],R2C[-6]:R150C[-6],RC7+3,FALSE)&R2C7&"|"&R2C7&HLOOKUP(R2C[-6],R2C[-6]:R150C[-6],RC7+4,FALSE)&R2C7 -> "援军三号位开启，激活额外宿命！"|"通关日常副本，每日领取大量奖励！"|"英雄潜能可提升，实力增长百分百！" | K35: =HLOOKUP(R2C[-6],R2C[-6]:R150C[-6],RC7+2,FALSE)&"|"&HLOOKUP(R2C[-6],R2C[-6]:R150C[-6],RC7+3,FALSE)&"|"&HLOOKUP(R2C[-6],R2C[-6]:R150C[-6],RC7+4,FALSE) -> 34|34|35 | L35: =HLOOKUP(R2C[-6],R2C[-6]:R150C[-6],RC7+2,FALSE)&"|"&HLOOKUP(R2C[-6],R2C[-6]:R150C[-6],RC7+3,FALSE)&"|"&HLOOKUP(R2C[-6],R2C[-6]:R150C[-6],RC7+4,FALSE) -> 8|2|8
A36: 31.1 | B36: =ROW()-3 -> 33 | C36: 称号 | D36: 称号系统开放，逼格上升100%！ | E36: =INT(RC[-4]) -> 31 | F36: 83 | G36: =VLOOKUP(RC[1]-0.1,C1:C2,2,TRUE)+1 -> 35 | H36: 34 | I36: =R2C7&HLOOKUP(R2C[-6],R2C[-6]:R150C[-6],RC7+2,FALSE)&R2C7&"|"&R2C7&HLOOKUP(R2C[-6],R2C[-6]:R150C[-6],RC7+3,FALSE)&R2C7&"|"&R2C7&HLOOKUP(R2C[-6],R2C[-6]:R150C[-6],RC7+4,FALSE)&R2C7 -> "援军阵位3"|"日常副本-圣器水晶"|"潜能" | J36: =R2C7&HLOOKUP(R2C[-6],R2C[-6]:R150C[-6],RC7+2,FALSE)&R2C7&"|"&R2C7&HLOOKUP(R2C[-6],R2C[-6]:R150C[-6],RC7+3,FALSE)&R2C7&"|"&R2C7&HLOOKUP(R2C[-6],R2C[-6]:R150C[-6],RC7+4,FALSE)&R2C7 -> "援军三号位开启，激活额外宿命！"|"通关日常副本，每日领取大量奖励！"|"英雄潜能可提升，实力增长百分百！" | K36: =HLOOKUP(R2C[-6],R2C[-6]:R150C[-6],RC7+2,FALSE)&"|"&HLOOKUP(R2C[-6],R2C[-6]:R150C[-6],RC7+3,FALSE)&"|"&HLOOKUP(R2C[-6],R2C[-6]:R150C[-6],RC7+4,FALSE) -> 34|34|35 | L36: =HLOOKUP(R2C[-6],R2C[-6]:R150C[-6],RC7+2,FALSE)&"|"&HLOOKUP(R2C[-6],R2C[-6]:R150C[-6],RC7+3,FALSE)&"|"&HLOOKUP(R2C[-6],R2C[-6]:R150C[-6],RC7+4,FALSE) -> 8|2|8
A37: 32 | B37: =ROW()-3 -> 34 | C37: 精灵祝福 | D37: 精灵祝福开启，精灵助战效果提升！ | E37: =INT(RC[-4]) -> 32 | F37: 63 | G37: =VLOOKUP(RC[1]-0.1,C1:C2,2,TRUE)+1 -> 37 | H37: 35 | I37: =R2C7&HLOOKUP(R2C[-6],R2C[-6]:R150C[-6],RC7+2,FALSE)&R2C7&"|"&R2C7&HLOOKUP(R2C[-6],R2C[-6]:R150C[-6],RC7+3,FALSE)&R2C7&"|"&R2C7&HLOOKUP(R2C[-6],R2C[-6]:R150C[-6],RC7+4,FALSE)&R2C7 -> "潜能"|"世界BOSS"|"异度入侵" | J37: =R2C7&HLOOKUP(R2C[-6],R2C[-6]:R150C[-6],RC7+2,FALSE)&R2C7&"|"&R2C7&HLOOKUP(R2C[-6],R2C[-6]:R150C[-6],RC7+3,FALSE)&R2C7&"|"&R2C7&HLOOKUP(R2C[-6],R2C[-6]:R150C[-6],RC7+4,FALSE)&R2C7 -> "英雄潜能可提升，实力增长百分百！"|"深渊魔王来袭，全世界一起推倒！"|"击退入侵者，赢取大量潜能合剂！" | K37: =HLOOKUP(R2C[-6],R2C[-6]:R150C[-6],RC7+2,FALSE)&"|"&HLOOKUP(R2C[-6],R2C[-6]:R150C[-6],RC7+3,FALSE)&"|"&HLOOKUP(R2C[-6],R2C[-6]:R150C[-6],RC7+4,FALSE) -> 35|35|35 | L37: =HLOOKUP(R2C[-6],R2C[-6]:R150C[-6],RC7+2,FALSE)&"|"&HLOOKUP(R2C[-6],R2C[-6]:R150C[-6],RC7+3,FALSE)&"|"&HLOOKUP(R2C[-6],R2C[-6]:R150C[-6],RC7+4,FALSE) -> 8|47|16
A38: 34 | B38: =ROW()-3 -> 35 | C38: 援军阵位3 | D38: 援军三号位开启，激活额外宿命！ | E38: =INT(RC[-4]) -> 34 | F38: 8 | G38: =VLOOKUP(RC[1]-0.1,C1:C2,2,TRUE)+1 -> 40 | H38: 36 | I38: =R2C7&HLOOKUP(R2C[-6],R2C[-6]:R150C[-6],RC7+2,FALSE)&R2C7&"|"&R2C7&HLOOKUP(R2C[-6],R2C[-6]:R150C[-6],RC7+3,FALSE)&R2C7&"|"&R2C7&HLOOKUP(R2C[-6],R2C[-6]:R150C[-6],RC7+4,FALSE)&R2C7 -> "无尽深渊"|"精灵升华"|"援军阵位4" | J38: =R2C7&HLOOKUP(R2C[-6],R2C[-6]:R150C[-6],RC7+2,FALSE)&R2C7&"|"&R2C7&HLOOKUP(R2C[-6],R2C[-6]:R150C[-6],RC7+3,FALSE)&R2C7&"|"&R2C7&HLOOKUP(R2C[-6],R2C[-6]:R150C[-6],RC7+4,FALSE)&R2C7 -> "闯荡无尽深渊，获取精灵升华材料！"|"精灵可升华，形象大变化！"|"援军四号位开启，激活额外宿命！" | K38: =HLOOKUP(R2C[-6],R2C[-6]:R150C[-6],RC7+2,FALSE)&"|"&HLOOKUP(R2C[-6],R2C[-6]:R150C[-6],RC7+3,FALSE)&"|"&HLOOKUP(R2C[-6],R2C[-6]:R150C[-6],RC7+4,FALSE) -> 37|37|38 | L38: =HLOOKUP(R2C[-6],R2C[-6]:R150C[-6],RC7+2,FALSE)&"|"&HLOOKUP(R2C[-6],R2C[-6]:R150C[-6],RC7+3,FALSE)&"|"&HLOOKUP(R2C[-6],R2C[-6]:R150C[-6],RC7+4,FALSE) -> 88|28|8
A39: 34.1 | B39: =ROW()-3 -> 36 | C39: 日常副本-圣器水晶 | D39: 通关日常副本，每日领取大量奖励！ | E39: =INT(RC[-4]) -> 34 | F39: 2 | G39: =VLOOKUP(RC[1]-0.1,C1:C2,2,TRUE)+1 -> 40 | H39: 37 | I39: =R2C7&HLOOKUP(R2C[-6],R2C[-6]:R150C[-6],RC7+2,FALSE)&R2C7&"|"&R2C7&HLOOKUP(R2C[-6],R2C[-6]:R150C[-6],RC7+3,FALSE)&R2C7&"|"&R2C7&HLOOKUP(R2C[-6],R2C[-6]:R150C[-6],RC7+4,FALSE)&R2C7 -> "无尽深渊"|"精灵升华"|"援军阵位4" | J39: =R2C7&HLOOKUP(R2C[-6],R2C[-6]:R150C[-6],RC7+2,FALSE)&R2C7&"|"&R2C7&HLOOKUP(R2C[-6],R2C[-6]:R150C[-6],RC7+3,FALSE)&R2C7&"|"&R2C7&HLOOKUP(R2C[-6],R2C[-6]:R150C[-6],RC7+4,FALSE)&R2C7 -> "闯荡无尽深渊，获取精灵升华材料！"|"精灵可升华，形象大变化！"|"援军四号位开启，激活额外宿命！" | K39: =HLOOKUP(R2C[-6],R2C[-6]:R150C[-6],RC7+2,FALSE)&"|"&HLOOKUP(R2C[-6],R2C[-6]:R150C[-6],RC7+3,FALSE)&"|"&HLOOKUP(R2C[-6],R2C[-6]:R150C[-6],RC7+4,FALSE) -> 37|37|38 | L39: =HLOOKUP(R2C[-6],R2C[-6]:R150C[-6],RC7+2,FALSE)&"|"&HLOOKUP(R2C[-6],R2C[-6]:R150C[-6],RC7+3,FALSE)&"|"&HLOOKUP(R2C[-6],R2C[-6]:R150C[-6],RC7+4,FALSE) -> 88|28|8
A40: 35 | B40: =ROW()-3 -> 37 | C40: 潜能 | D40: 英雄潜能可提升，实力增长百分百！ | E40: =INT(RC[-4]) -> 35 | F40: 8 | G40: =VLOOKUP(RC[1]-0.1,C1:C2,2,TRUE)+1 -> 42 | H40: 38 | I40: =R2C7&HLOOKUP(R2C[-6],R2C[-6]:R150C[-6],RC7+2,FALSE)&R2C7&"|"&R2C7&HLOOKUP(R2C[-6],R2C[-6]:R150C[-6],RC7+3,FALSE)&R2C7&"|"&R2C7&HLOOKUP(R2C[-6],R2C[-6]:R150C[-6],RC7+4,FALSE)&R2C7 -> "援军阵位4"|"勇者试炼-一键扫荡"|"圣器精炼" | J40: =R2C7&HLOOKUP(R2C[-6],R2C[-6]:R150C[-6],RC7+2,FALSE)&R2C7&"|"&R2C7&HLOOKUP(R2C[-6],R2C[-6]:R150C[-6],RC7+3,FALSE)&R2C7&"|"&R2C7&HLOOKUP(R2C[-6],R2C[-6]:R150C[-6],RC7+4,FALSE)&R2C7 -> "援军四号位开启，激活额外宿命！"|"一键扫荡所有已通关试练，轻松更愉悦。"|"圣器精炼,进一步提升圣器属性！" | K40: =HLOOKUP(R2C[-6],R2C[-6]:R150C[-6],RC7+2,FALSE)&"|"&HLOOKUP(R2C[-6],R2C[-6]:R150C[-6],RC7+3,FALSE)&"|"&HLOOKUP(R2C[-6],R2C[-6]:R150C[-6],RC7+4,FALSE) -> 38|38|39 | L40: =HLOOKUP(R2C[-6],R2C[-6]:R150C[-6],RC7+2,FALSE)&"|"&HLOOKUP(R2C[-6],R2C[-6]:R150C[-6],RC7+3,FALSE)&"|"&HLOOKUP(R2C[-6],R2C[-6]:R150C[-6],RC7+4,FALSE) -> 8|17|8
A41: 35.1 | B41: =ROW()-3 -> 38 | C41: 世界BOSS | D41: 深渊魔王来袭，全世界一起推倒！ | E41: =INT(RC[-4]) -> 35 | F41: 47 | G41: =VLOOKUP(RC[1]-0.1,C1:C2,2,TRUE)+1 -> 44 | H41: 39 | I41: =R2C7&HLOOKUP(R2C[-6],R2C[-6]:R150C[-6],RC7+2,FALSE)&R2C7&"|"&R2C7&HLOOKUP(R2C[-6],R2C[-6]:R150C[-6],RC7+3,FALSE)&R2C7&"|"&R2C7&HLOOKUP(R2C[-6],R2C[-6]:R150C[-6],RC7+4,FALSE)&R2C7 -> "圣器精炼"|"日常副本-圣器精炼石"|"援军阵位5" | J41: =R2C7&HLOOKUP(R2C[-6],R2C[-6]:R150C[-6],RC7+2,FALSE)&R2C7&"|"&R2C7&HLOOKUP(R2C[-6],R2C[-6]:R150C[-6],RC7+3,FALSE)&R2C7&"|"&R2C7&HLOOKUP(R2C[-6],R2C[-6]:R150C[-6],RC7+4,FALSE)&R2C7 -> "圣器精炼,进一步提升圣器属性！"|"通关日常副本，每日领取大量奖励！"|"援军五号位开启，激活额外宿命！" | K41: =HLOOKUP(R2C[-6],R2C[-6]:R150C[-6],RC7+2,FALSE)&"|"&HLOOKUP(R2C[-6],R2C[-6]:R150C[-6],RC7+3,FALSE)&"|"&HLOOKUP(R2C[-6],R2C[-6]:R150C[-6],RC7+4,FALSE) -> 39|39|42 | L41: =HLOOKUP(R2C[-6],R2C[-6]:R150C[-6],RC7+2,FALSE)&"|"&HLOOKUP(R2C[-6],R2C[-6]:R150C[-6],RC7+3,FALSE)&"|"&HLOOKUP(R2C[-6],R2C[-6]:R150C[-6],RC7+4,FALSE) -> 8|2|8
A42: 35.2 | B42: =ROW()-3 -> 39 | C42: 异度入侵 | D42: 击退入侵者，赢取大量潜能合剂！ | E42: =INT(RC[-4]) -> 35 | F42: 16 | G42: =VLOOKUP(RC[1]-0.1,C1:C2,2,TRUE)+1 -> 46 | H42: 40 | I42: =R2C7&HLOOKUP(R2C[-6],R2C[-6]:R150C[-6],RC7+2,FALSE)&R2C7&"|"&R2C7&HLOOKUP(R2C[-6],R2C[-6]:R150C[-6],RC7+3,FALSE)&R2C7&"|"&R2C7&HLOOKUP(R2C[-6],R2C[-6]:R150C[-6],RC7+4,FALSE)&R2C7 -> "援军阵位5"|"英雄觉醒"|"一键夺宝" | J42: =R2C7&HLOOKUP(R2C[-6],R2C[-6]:R150C[-6],RC7+2,FALSE)&R2C7&"|"&R2C7&HLOOKUP(R2C[-6],R2C[-6]:R150C[-6],RC7+3,FALSE)&R2C7&"|"&R2C7&HLOOKUP(R2C[-6],R2C[-6]:R150C[-6],RC7+4,FALSE)&R2C7 -> "援军五号位开启，激活额外宿命！"|"英雄可觉醒，前进的意志无可阻挡！"|"一键抢夺所有圣器碎片，轻松更愉悦。" | K42: =HLOOKUP(R2C[-6],R2C[-6]:R150C[-6],RC7+2,FALSE)&"|"&HLOOKUP(R2C[-6],R2C[-6]:R150C[-6],RC7+3,FALSE)&"|"&HLOOKUP(R2C[-6],R2C[-6]:R150C[-6],RC7+4,FALSE) -> 42|45|45 | L42: =HLOOKUP(R2C[-6],R2C[-6]:R150C[-6],RC7+2,FALSE)&"|"&HLOOKUP(R2C[-6],R2C[-6]:R150C[-6],RC7+3,FALSE)&"|"&HLOOKUP(R2C[-6],R2C[-6]:R150C[-6],RC7+4,FALSE) -> 8|8|19
A43: 37 | B43: =ROW()-3 -> 40 | C43: 无尽深渊 | D43: 闯荡无尽深渊，获取精灵升华材料！ | E43: =INT(RC[-4]) -> 37 | F43: 88 | G43: =VLOOKUP(RC[1]-0.1,C1:C2,2,TRUE)+1 -> 46 | H43: 41 | I43: =R2C7&HLOOKUP(R2C[-6],R2C[-6]:R150C[-6],RC7+2,FALSE)&R2C7&"|"&R2C7&HLOOKUP(R2C[-6],R2C[-6]:R150C[-6],RC7+3,FALSE)&R2C7&"|"&R2C7&HLOOKUP(R2C[-6],R2C[-6]:R150C[-6],RC7+4,FALSE)&R2C7 -> "援军阵位5"|"英雄觉醒"|"一键夺宝" | J43: =R2C7&HLOOKUP(R2C[-6],R2C[-6]:R150C[-6],RC7+2,FALSE)&R2C7&"|"&R2C7&HLOOKUP(R2C[-6],R2C[-6]:R150C[-6],RC7+3,FALSE)&R2C7&"|"&R2C7&HLOOKUP(R2C[-6],R2C[-6]:R150C[-6],RC7+4,FALSE)&R2C7 -> "援军五号位开启，激活额外宿命！"|"英雄可觉醒，前进的意志无可阻挡！"|"一键抢夺所有圣器碎片，轻松更愉悦。" | K43: =HLOOKUP(R2C[-6],R2C[-6]:R150C[-6],RC7+2,FALSE)&"|"&HLOOKUP(R2C[-6],R2C[-6]:R150C[-6],RC7+3,FALSE)&"|"&HLOOKUP(R2C[-6],R2C[-6]:R150C[-6],RC7+4,FALSE) -> 42|45|45 | L43: =HLOOKUP(R2C[-6],R2C[-6]:R150C[-6],RC7+2,FALSE)&"|"&HLOOKUP(R2C[-6],R2C[-6]:R150C[-6],RC7+3,FALSE)&"|"&HLOOKUP(R2C[-6],R2C[-6]:R150C[-6],RC7+4,FALSE) -> 8|8|19
A44: 37.1 | B44: =ROW()-3 -> 41 | C44: 精灵升华 | D44: 精灵可升华，形象大变化！ | E44: =INT(RC[-4]) -> 37 | F44: 28 | G44: =VLOOKUP(RC[1]-0.1,C1:C2,2,TRUE)+1 -> 46 | H44: 42 | I44: =R2C7&HLOOKUP(R2C[-6],R2C[-6]:R150C[-6],RC7+2,FALSE)&R2C7&"|"&R2C7&HLOOKUP(R2C[-6],R2C[-6]:R150C[-6],RC7+3,FALSE)&R2C7&"|"&R2C7&HLOOKUP(R2C[-6],R2C[-6]:R150C[-6],RC7+4,FALSE)&R2C7 -> "援军阵位5"|"英雄觉醒"|"一键夺宝" | J44: =R2C7&HLOOKUP(R2C[-6],R2C[-6]:R150C[-6],RC7+2,FALSE)&R2C7&"|"&R2C7&HLOOKUP(R2C[-6],R2C[-6]:R150C[-6],RC7+3,FALSE)&R2C7&"|"&R2C7&HLOOKUP(R2C[-6],R2C[-6]:R150C[-6],RC7+4,FALSE)&R2C7 -> "援军五号位开启，激活额外宿命！"|"英雄可觉醒，前进的意志无可阻挡！"|"一键抢夺所有圣器碎片，轻松更愉悦。" | K44: =HLOOKUP(R2C[-6],R2C[-6]:R150C[-6],RC7+2,FALSE)&"|"&HLOOKUP(R2C[-6],R2C[-6]:R150C[-6],RC7+3,FALSE)&"|"&HLOOKUP(R2C[-6],R2C[-6]:R150C[-6],RC7+4,FALSE) -> 42|45|45 | L44: =HLOOKUP(R2C[-6],R2C[-6]:R150C[-6],RC7+2,FALSE)&"|"&HLOOKUP(R2C[-6],R2C[-6]:R150C[-6],RC7+3,FALSE)&"|"&HLOOKUP(R2C[-6],R2C[-6]:R150C[-6],RC7+4,FALSE) -> 8|8|19
A45: 38 | B45: =ROW()-3 -> 42 | C45: 援军阵位4 | D45: 援军四号位开启，激活额外宿命！ | E45: =INT(RC[-4]) -> 38 | F45: 8 | G45: =VLOOKUP(RC[1]-0.1,C1:C2,2,TRUE)+1 -> 47 | H45: 43 | I45: =R2C7&HLOOKUP(R2C[-6],R2C[-6]:R150C[-6],RC7+2,FALSE)&R2C7&"|"&R2C7&HLOOKUP(R2C[-6],R2C[-6]:R150C[-6],RC7+3,FALSE)&R2C7&"|"&R2C7&HLOOKUP(R2C[-6],R2C[-6]:R150C[-6],RC7+4,FALSE)&R2C7 -> "英雄觉醒"|"一键夺宝"|"精英副本" | J45: =R2C7&HLOOKUP(R2C[-6],R2C[-6]:R150C[-6],RC7+2,FALSE)&R2C7&"|"&R2C7&HLOOKUP(R2C[-6],R2C[-6]:R150C[-6],RC7+3,FALSE)&R2C7&"|"&R2C7&HLOOKUP(R2C[-6],R2C[-6]:R150C[-6],RC7+4,FALSE)&R2C7 -> "英雄可觉醒，前进的意志无可阻挡！"|"一键抢夺所有圣器碎片，轻松更愉悦。"|"挑战精英副本，获取大量觉醒材料！" | K45: =HLOOKUP(R2C[-6],R2C[-6]:R150C[-6],RC7+2,FALSE)&"|"&HLOOKUP(R2C[-6],R2C[-6]:R150C[-6],RC7+3,FALSE)&"|"&HLOOKUP(R2C[-6],R2C[-6]:R150C[-6],RC7+4,FALSE) -> 45|45|45 | L45: =HLOOKUP(R2C[-6],R2C[-6]:R150C[-6],RC7+2,FALSE)&"|"&HLOOKUP(R2C[-6],R2C[-6]:R150C[-6],RC7+3,FALSE)&"|"&HLOOKUP(R2C[-6],R2C[-6]:R150C[-6],RC7+4,FALSE) -> 8|19|28
A46: 38.1 | B46: =ROW()-3 -> 43 | C46: 勇者试炼-一键扫荡 | D46: 一键扫荡所有已通关试练，轻松更愉悦。 | E46: =INT(RC[-4]) -> 38 | F46: 17 | G46: =VLOOKUP(RC[1]-0.1,C1:C2,2,TRUE)+1 -> 47 | H46: 44 | I46: =R2C7&HLOOKUP(R2C[-6],R2C[-6]:R150C[-6],RC7+2,FALSE)&R2C7&"|"&R2C7&HLOOKUP(R2C[-6],R2C[-6]:R150C[-6],RC7+3,FALSE)&R2C7&"|"&R2C7&HLOOKUP(R2C[-6],R2C[-6]:R150C[-6],RC7+4,FALSE)&R2C7 -> "英雄觉醒"|"一键夺宝"|"精英副本" | J46: =R2C7&HLOOKUP(R2C[-6],R2C[-6]:R150C[-6],RC7+2,FALSE)&R2C7&"|"&R2C7&HLOOKUP(R2C[-6],R2C[-6]:R150C[-6],RC7+3,FALSE)&R2C7&"|"&R2C7&HLOOKUP(R2C[-6],R2C[-6]:R150C[-6],RC7+4,FALSE)&R2C7 -> "英雄可觉醒，前进的意志无可阻挡！"|"一键抢夺所有圣器碎片，轻松更愉悦。"|"挑战精英副本，获取大量觉醒材料！" | K46: =HLOOKUP(R2C[-6],R2C[-6]:R150C[-6],RC7+2,FALSE)&"|"&HLOOKUP(R2C[-6],R2C[-6]:R150C[-6],RC7+3,FALSE)&"|"&HLOOKUP(R2C[-6],R2C[-6]:R150C[-6],RC7+4,FALSE) -> 45|45|45 | L46: =HLOOKUP(R2C[-6],R2C[-6]:R150C[-6],RC7+2,FALSE)&"|"&HLOOKUP(R2C[-6],R2C[-6]:R150C[-6],RC7+3,FALSE)&"|"&HLOOKUP(R2C[-6],R2C[-6]:R150C[-6],RC7+4,FALSE) -> 8|19|28
A47: 39 | B47: =ROW()-3 -> 44 | C47: 圣器精炼 | D47: 圣器精炼,进一步提升圣器属性！ | E47: =INT(RC[-4]) -> 39 | F47: 8 | G47: =VLOOKUP(RC[1]-0.1,C1:C2,2,TRUE)+1 -> 47 | H47: 45 | I47: =R2C7&HLOOKUP(R2C[-6],R2C[-6]:R150C[-6],RC7+2,FALSE)&R2C7&"|"&R2C7&HLOOKUP(R2C[-6],R2C[-6]:R150C[-6],RC7+3,FALSE)&R2C7&"|"&R2C7&HLOOKUP(R2C[-6],R2C[-6]:R150C[-6],RC7+4,FALSE)&R2C7 -> "英雄觉醒"|"一键夺宝"|"精英副本" | J47: =R2C7&HLOOKUP(R2C[-6],R2C[-6]:R150C[-6],RC7+2,FALSE)&R2C7&"|"&R2C7&HLOOKUP(R2C[-6],R2C[-6]:R150C[-6],RC7+3,FALSE)&R2C7&"|"&R2C7&HLOOKUP(R2C[-6],R2C[-6]:R150C[-6],RC7+4,FALSE)&R2C7 -> "英雄可觉醒，前进的意志无可阻挡！"|"一键抢夺所有圣器碎片，轻松更愉悦。"|"挑战精英副本，获取大量觉醒材料！" | K47: =HLOOKUP(R2C[-6],R2C[-6]:R150C[-6],RC7+2,FALSE)&"|"&HLOOKUP(R2C[-6],R2C[-6]:R150C[-6],RC7+3,FALSE)&"|"&HLOOKUP(R2C[-6],R2C[-6]:R150C[-6],RC7+4,FALSE) -> 45|45|45 | L47: =HLOOKUP(R2C[-6],R2C[-6]:R150C[-6],RC7+2,FALSE)&"|"&HLOOKUP(R2C[-6],R2C[-6]:R150C[-6],RC7+3,FALSE)&"|"&HLOOKUP(R2C[-6],R2C[-6]:R150C[-6],RC7+4,FALSE) -> 8|19|28
A48: 39.1 | B48: =ROW()-3 -> 45 | C48: 日常副本-圣器精炼石 | D48: 通关日常副本，每日领取大量奖励！ | E48: =INT(RC[-4]) -> 39 | F48: 2 | G48: =VLOOKUP(RC[1]-0.1,C1:C2,2,TRUE)+1 -> 50 | H48: 46 | I48: =R2C7&HLOOKUP(R2C[-6],R2C[-6]:R150C[-6],RC7+2,FALSE)&R2C7&"|"&R2C7&HLOOKUP(R2C[-6],R2C[-6]:R150C[-6],RC7+3,FALSE)&R2C7&"|"&R2C7&HLOOKUP(R2C[-6],R2C[-6]:R150C[-6],RC7+4,FALSE)&R2C7 -> "援军阵位6"|"援军阵位7"|"援军阵位8" | J48: =R2C7&HLOOKUP(R2C[-6],R2C[-6]:R150C[-6],RC7+2,FALSE)&R2C7&"|"&R2C7&HLOOKUP(R2C[-6],R2C[-6]:R150C[-6],RC7+3,FALSE)&R2C7&"|"&R2C7&HLOOKUP(R2C[-6],R2C[-6]:R150C[-6],RC7+4,FALSE)&R2C7 -> "援军六号位开启，激活额外宿命！"|"援军七号位开启，激活额外宿命！"|"援军八号位开启，激活额外宿命！" | K48: =HLOOKUP(R2C[-6],R2C[-6]:R150C[-6],RC7+2,FALSE)&"|"&HLOOKUP(R2C[-6],R2C[-6]:R150C[-6],RC7+3,FALSE)&"|"&HLOOKUP(R2C[-6],R2C[-6]:R150C[-6],RC7+4,FALSE) -> 46|50|54 | L48: =HLOOKUP(R2C[-6],R2C[-6]:R150C[-6],RC7+2,FALSE)&"|"&HLOOKUP(R2C[-6],R2C[-6]:R150C[-6],RC7+3,FALSE)&"|"&HLOOKUP(R2C[-6],R2C[-6]:R150C[-6],RC7+4,FALSE) -> 8|8|8
A49: 42 | B49: =ROW()-3 -> 46 | C49: 援军阵位5 | D49: 援军五号位开启，激活额外宿命！ | E49: =INT(RC[-4]) -> 42 | F49: 8 | G49: =VLOOKUP(RC[1]-0.1,C1:C2,2,TRUE)+1 -> 51 | H49: 47 | I49: =R2C7&HLOOKUP(R2C[-6],R2C[-6]:R150C[-6],RC7+2,FALSE)&R2C7&"|"&R2C7&HLOOKUP(R2C[-6],R2C[-6]:R150C[-6],RC7+3,FALSE)&R2C7&"|"&R2C7&HLOOKUP(R2C[-6],R2C[-6]:R150C[-6],RC7+4,FALSE)&R2C7 -> "援军阵位7"|"援军阵位8"|"暂无后续" | J49: =R2C7&HLOOKUP(R2C[-6],R2C[-6]:R150C[-6],RC7+2,FALSE)&R2C7&"|"&R2C7&HLOOKUP(R2C[-6],R2C[-6]:R150C[-6],RC7+3,FALSE)&R2C7&"|"&R2C7&HLOOKUP(R2C[-6],R2C[-6]:R150C[-6],RC7+4,FALSE)&R2C7 -> "援军七号位开启，激活额外宿命！"|"援军八号位开启，激活额外宿命！"|"敬请期待" | K49: =HLOOKUP(R2C[-6],R2C[-6]:R150C[-6],RC7+2,FALSE)&"|"&HLOOKUP(R2C[-6],R2C[-6]:R150C[-6],RC7+3,FALSE)&"|"&HLOOKUP(R2C[-6],R2C[-6]:R150C[-6],RC7+4,FALSE) -> 50|54|150 | L49: =HLOOKUP(R2C[-6],R2C[-6]:R150C[-6],RC7+2,FALSE)&"|"&HLOOKUP(R2C[-6],R2C[-6]:R150C[-6],RC7+3,FALSE)&"|"&HLOOKUP(R2C[-6],R2C[-6]:R150C[-6],RC7+4,FALSE) -> 8|8|49
A50: 45 | B50: =ROW()-3 -> 47 | C50: 英雄觉醒 | D50: 英雄可觉醒，前进的意志无可阻挡！ | E50: =INT(RC[-4]) -> 45 | F50: 8 | G50: =VLOOKUP(RC[1]-0.1,C1:C2,2,TRUE)+1 -> 51 | H50: 48 | I50: =R2C7&HLOOKUP(R2C[-6],R2C[-6]:R150C[-6],RC7+2,FALSE)&R2C7&"|"&R2C7&HLOOKUP(R2C[-6],R2C[-6]:R150C[-6],RC7+3,FALSE)&R2C7&"|"&R2C7&HLOOKUP(R2C[-6],R2C[-6]:R150C[-6],RC7+4,FALSE)&R2C7 -> "援军阵位7"|"援军阵位8"|"暂无后续" | J50: =R2C7&HLOOKUP(R2C[-6],R2C[-6]:R150C[-6],RC7+2,FALSE)&R2C7&"|"&R2C7&HLOOKUP(R2C[-6],R2C[-6]:R150C[-6],RC7+3,FALSE)&R2C7&"|"&R2C7&HLOOKUP(R2C[-6],R2C[-6]:R150C[-6],RC7+4,FALSE)&R2C7 -> "援军七号位开启，激活额外宿命！"|"援军八号位开启，激活额外宿命！"|"敬请期待" | K50: =HLOOKUP(R2C[-6],R2C[-6]:R150C[-6],RC7+2,FALSE)&"|"&HLOOKUP(R2C[-6],R2C[-6]:R150C[-6],RC7+3,FALSE)&"|"&HLOOKUP(R2C[-6],R2C[-6]:R150C[-6],RC7+4,FALSE) -> 50|54|150 | L50: =HLOOKUP(R2C[-6],R2C[-6]:R150C[-6],RC7+2,FALSE)&"|"&HLOOKUP(R2C[-6],R2C[-6]:R150C[-6],RC7+3,FALSE)&"|"&HLOOKUP(R2C[-6],R2C[-6]:R150C[-6],RC7+4,FALSE) -> 8|8|49
A51: 45.1 | B51: =ROW()-3 -> 48 | C51: 一键夺宝 | D51: 一键抢夺所有圣器碎片，轻松更愉悦。 | E51: =INT(RC[-4]) -> 45 | F51: 19 | G51: =VLOOKUP(RC[1]-0.1,C1:C2,2,TRUE)+1 -> 51 | H51: 49 | I51: =R2C7&HLOOKUP(R2C[-6],R2C[-6]:R150C[-6],RC7+2,FALSE)&R2C7&"|"&R2C7&HLOOKUP(R2C[-6],R2C[-6]:R150C[-6],RC7+3,FALSE)&R2C7&"|"&R2C7&HLOOKUP(R2C[-6],R2C[-6]:R150C[-6],RC7+4,FALSE)&R2C7 -> "援军阵位7"|"援军阵位8"|"暂无后续" | J51: =R2C7&HLOOKUP(R2C[-6],R2C[-6]:R150C[-6],RC7+2,FALSE)&R2C7&"|"&R2C7&HLOOKUP(R2C[-6],R2C[-6]:R150C[-6],RC7+3,FALSE)&R2C7&"|"&R2C7&HLOOKUP(R2C[-6],R2C[-6]:R150C[-6],RC7+4,FALSE)&R2C7 -> "援军七号位开启，激活额外宿命！"|"援军八号位开启，激活额外宿命！"|"敬请期待" | K51: =HLOOKUP(R2C[-6],R2C[-6]:R150C[-6],RC7+2,FALSE)&"|"&HLOOKUP(R2C[-6],R2C[-6]:R150C[-6],RC7+3,FALSE)&"|"&HLOOKUP(R2C[-6],R2C[-6]:R150C[-6],RC7+4,FALSE) -> 50|54|150 | L51: =HLOOKUP(R2C[-6],R2C[-6]:R150C[-6],RC7+2,FALSE)&"|"&HLOOKUP(R2C[-6],R2C[-6]:R150C[-6],RC7+3,FALSE)&"|"&HLOOKUP(R2C[-6],R2C[-6]:R150C[-6],RC7+4,FALSE) -> 8|8|49
A52: 45.2 | B52: =ROW()-3 -> 49 | C52: 精英副本 | D52: 挑战精英副本，获取大量觉醒材料！ | E52: =INT(RC[-4]) -> 45 | F52: 28 | G52: =VLOOKUP(RC[1]-0.1,C1:C2,2,TRUE)+1 -> 51 | H52: 50 | I52: =R2C7&HLOOKUP(R2C[-6],R2C[-6]:R150C[-6],RC7+2,FALSE)&R2C7&"|"&R2C7&HLOOKUP(R2C[-6],R2C[-6]:R150C[-6],RC7+3,FALSE)&R2C7&"|"&R2C7&HLOOKUP(R2C[-6],R2C[-6]:R150C[-6],RC7+4,FALSE)&R2C7 -> "援军阵位7"|"援军阵位8"|"暂无后续" | J52: =R2C7&HLOOKUP(R2C[-6],R2C[-6]:R150C[-6],RC7+2,FALSE)&R2C7&"|"&R2C7&HLOOKUP(R2C[-6],R2C[-6]:R150C[-6],RC7+3,FALSE)&R2C7&"|"&R2C7&HLOOKUP(R2C[-6],R2C[-6]:R150C[-6],RC7+4,FALSE)&R2C7 -> "援军七号位开启，激活额外宿命！"|"援军八号位开启，激活额外宿命！"|"敬请期待" | K52: =HLOOKUP(R2C[-6],R2C[-6]:R150C[-6],RC7+2,FALSE)&"|"&HLOOKUP(R2C[-6],R2C[-6]:R150C[-6],RC7+3,FALSE)&"|"&HLOOKUP(R2C[-6],R2C[-6]:R150C[-6],RC7+4,FALSE) -> 50|54|150 | L52: =HLOOKUP(R2C[-6],R2C[-6]:R150C[-6],RC7+2,FALSE)&"|"&HLOOKUP(R2C[-6],R2C[-6]:R150C[-6],RC7+3,FALSE)&"|"&HLOOKUP(R2C[-6],R2C[-6]:R150C[-6],RC7+4,FALSE) -> 8|8|49
A53: 46 | B53: =ROW()-3 -> 50 | C53: 援军阵位6 | D53: 援军六号位开启，激活额外宿命！ | E53: =INT(RC[-4]) -> 46 | F53: 8 | G53: =VLOOKUP(RC[1]-0.1,C1:C2,2,TRUE)+1 -> 52 | H53: 51 | I53: =R2C7&HLOOKUP(R2C[-6],R2C[-6]:R150C[-6],RC7+2,FALSE)&R2C7&"|"&R2C7&HLOOKUP(R2C[-6],R2C[-6]:R150C[-6],RC7+3,FALSE)&R2C7&"|"&R2C7&HLOOKUP(R2C[-6],R2C[-6]:R150C[-6],RC7+4,FALSE)&R2C7 -> "援军阵位8"|"暂无后续"|"暂无后续" | J53: =R2C7&HLOOKUP(R2C[-6],R2C[-6]:R150C[-6],RC7+2,FALSE)&R2C7&"|"&R2C7&HLOOKUP(R2C[-6],R2C[-6]:R150C[-6],RC7+3,FALSE)&R2C7&"|"&R2C7&HLOOKUP(R2C[-6],R2C[-6]:R150C[-6],RC7+4,FALSE)&R2C7 -> "援军八号位开启，激活额外宿命！"|"敬请期待"|"敬请期待" | K53: =HLOOKUP(R2C[-6],R2C[-6]:R150C[-6],RC7+2,FALSE)&"|"&HLOOKUP(R2C[-6],R2C[-6]:R150C[-6],RC7+3,FALSE)&"|"&HLOOKUP(R2C[-6],R2C[-6]:R150C[-6],RC7+4,FALSE) -> 54|150|150 | L53: =HLOOKUP(R2C[-6],R2C[-6]:R150C[-6],RC7+2,FALSE)&"|"&HLOOKUP(R2C[-6],R2C[-6]:R150C[-6],RC7+3,FALSE)&"|"&HLOOKUP(R2C[-6],R2C[-6]:R150C[-6],RC7+4,FALSE) -> 8|49|49
A54: 50 | B54: =ROW()-3 -> 51 | C54: 援军阵位7 | D54: 援军七号位开启，激活额外宿命！ | E54: =INT(RC[-4]) -> 50 | F54: 8 | G54: =VLOOKUP(RC[1]-0.1,C1:C2,2,TRUE)+1 -> 52 | H54: 52 | I54: =R2C7&HLOOKUP(R2C[-6],R2C[-6]:R150C[-6],RC7+2,FALSE)&R2C7&"|"&R2C7&HLOOKUP(R2C[-6],R2C[-6]:R150C[-6],RC7+3,FALSE)&R2C7&"|"&R2C7&HLOOKUP(R2C[-6],R2C[-6]:R150C[-6],RC7+4,FALSE)&R2C7 -> "援军阵位8"|"暂无后续"|"暂无后续" | J54: =R2C7&HLOOKUP(R2C[-6],R2C[-6]:R150C[-6],RC7+2,FALSE)&R2C7&"|"&R2C7&HLOOKUP(R2C[-6],R2C[-6]:R150C[-6],RC7+3,FALSE)&R2C7&"|"&R2C7&HLOOKUP(R2C[-6],R2C[-6]:R150C[-6],RC7+4,FALSE)&R2C7 -> "援军八号位开启，激活额外宿命！"|"敬请期待"|"敬请期待" | K54: =HLOOKUP(R2C[-6],R2C[-6]:R150C[-6],RC7+2,FALSE)&"|"&HLOOKUP(R2C[-6],R2C[-6]:R150C[-6],RC7+3,FALSE)&"|"&HLOOKUP(R2C[-6],R2C[-6]:R150C[-6],RC7+4,FALSE) -> 54|150|150 | L54: =HLOOKUP(R2C[-6],R2C[-6]:R150C[-6],RC7+2,FALSE)&"|"&HLOOKUP(R2C[-6],R2C[-6]:R150C[-6],RC7+3,FALSE)&"|"&HLOOKUP(R2C[-6],R2C[-6]:R150C[-6],RC7+4,FALSE) -> 8|49|49
A55: 54 | B55: =ROW()-3 -> 52 | C55: 援军阵位8 | D55: 援军八号位开启，激活额外宿命！ | E55: =INT(RC[-4]) -> 54 | F55: 8 | G55: =VLOOKUP(RC[1]-0.1,C1:C2,2,TRUE)+1 -> 52 | H55: 53 | I55: =R2C7&HLOOKUP(R2C[-6],R2C[-6]:R150C[-6],RC7+2,FALSE)&R2C7&"|"&R2C7&HLOOKUP(R2C[-6],R2C[-6]:R150C[-6],RC7+3,FALSE)&R2C7&"|"&R2C7&HLOOKUP(R2C[-6],R2C[-6]:R150C[-6],RC7+4,FALSE)&R2C7 -> "援军阵位8"|"暂无后续"|"暂无后续" | J55: =R2C7&HLOOKUP(R2C[-6],R2C[-6]:R150C[-6],RC7+2,FALSE)&R2C7&"|"&R2C7&HLOOKUP(R2C[-6],R2C[-6]:R150C[-6],RC7+3,FALSE)&R2C7&"|"&R2C7&HLOOKUP(R2C[-6],R2C[-6]:R150C[-6],RC7+4,FALSE)&R2C7 -> "援军八号位开启，激活额外宿命！"|"敬请期待"|"敬请期待" | K55: =HLOOKUP(R2C[-6],R2C[-6]:R150C[-6],RC7+2,FALSE)&"|"&HLOOKUP(R2C[-6],R2C[-6]:R150C[-6],RC7+3,FALSE)&"|"&HLOOKUP(R2C[-6],R2C[-6]:R150C[-6],RC7+4,FALSE) -> 54|150|150 | L55: =HLOOKUP(R2C[-6],R2C[-6]:R150C[-6],RC7+2,FALSE)&"|"&HLOOKUP(R2C[-6],R2C[-6]:R150C[-6],RC7+3,FALSE)&"|"&HLOOKUP(R2C[-6],R2C[-6]:R150C[-6],RC7+4,FALSE) -> 8|49|49
A56: 150 | B56: =ROW()-3 -> 53 | C56: 暂无后续 | D56: 敬请期待 | E56: =INT(RC[-4]) -> 150 | F56: 49 | G56: =VLOOKUP(RC[1]-0.1,C1:C2,2,TRUE)+1 -> 52 | H56: 54 | I56: =R2C7&HLOOKUP(R2C[-6],R2C[-6]:R150C[-6],RC7+2,FALSE)&R2C7&"|"&R2C7&HLOOKUP(R2C[-6],R2C[-6]:R150C[-6],RC7+3,FALSE)&R2C7&"|"&R2C7&HLOOKUP(R2C[-6],R2C[-6]:R150C[-6],RC7+4,FALSE)&R2C7 -> "援军阵位8"|"暂无后续"|"暂无后续" | J56: =R2C7&HLOOKUP(R2C[-6],R2C[-6]:R150C[-6],RC7+2,FALSE)&R2C7&"|"&R2C7&HLOOKUP(R2C[-6],R2C[-6]:R150C[-6],RC7+3,FALSE)&R2C7&"|"&R2C7&HLOOKUP(R2C[-6],R2C[-6]:R150C[-6],RC7+4,FALSE)&R2C7 -> "援军八号位开启，激活额外宿命！"|"敬请期待"|"敬请期待" | K56: =HLOOKUP(R2C[-6],R2C[-6]:R150C[-6],RC7+2,FALSE)&"|"&HLOOKUP(R2C[-6],R2C[-6]:R150C[-6],RC7+3,FALSE)&"|"&HLOOKUP(R2C[-6],R2C[-6]:R150C[-6],RC7+4,FALSE) -> 54|150|150 | L56: =HLOOKUP(R2C[-6],R2C[-6]:R150C[-6],RC7+2,FALSE)&"|"&HLOOKUP(R2C[-6],R2C[-6]:R150C[-6],RC7+3,FALSE)&"|"&HLOOKUP(R2C[-6],R2C[-6]:R150C[-6],RC7+4,FALSE) -> 8|49|49
A57: 150.1 | B57: =ROW()-3 -> 54 | C57: 暂无后续 | D57: 敬请期待 | E57: =INT(RC[-4]) -> 150 | F57: 49 | G57: =VLOOKUP(RC[1]-0.1,C1:C2,2,TRUE)+1 -> 53 | H57: 55 | I57: =R2C7&HLOOKUP(R2C[-6],R2C[-6]:R150C[-6],RC7+2,FALSE)&R2C7&"|"&R2C7&HLOOKUP(R2C[-6],R2C[-6]:R150C[-6],RC7+3,FALSE)&R2C7&"|"&R2C7&HLOOKUP(R2C[-6],R2C[-6]:R150C[-6],RC7+4,FALSE)&R2C7 -> "暂无后续"|"暂无后续"|"暂无后续" | J57: =R2C7&HLOOKUP(R2C[-6],R2C[-6]:R150C[-6],RC7+2,FALSE)&R2C7&"|"&R2C7&HLOOKUP(R2C[-6],R2C[-6]:R150C[-6],RC7+3,FALSE)&R2C7&"|"&R2C7&HLOOKUP(R2C[-6],R2C[-6]:R150C[-6],RC7+4,FALSE)&R2C7 -> "敬请期待"|"敬请期待"|"敬请期待" | K57: =HLOOKUP(R2C[-6],R2C[-6]:R150C[-6],RC7+2,FALSE)&"|"&HLOOKUP(R2C[-6],R2C[-6]:R150C[-6],RC7+3,FALSE)&"|"&HLOOKUP(R2C[-6],R2C[-6]:R150C[-6],RC7+4,FALSE) -> 150|150|150 | L57: =HLOOKUP(R2C[-6],R2C[-6]:R150C[-6],RC7+2,FALSE)&"|"&HLOOKUP(R2C[-6],R2C[-6]:R150C[-6],RC7+3,FALSE)&"|"&HLOOKUP(R2C[-6],R2C[-6]:R150C[-6],RC7+4,FALSE) -> 49|49|49
A58: 150.2 | B58: =ROW()-3 -> 55 | C58: 暂无后续 | D58: 敬请期待 | E58: =INT(RC[-4]) -> 150 | F58: 49 | G58: =VLOOKUP(RC[1]-0.1,C1:C2,2,TRUE)+1 -> 53 | H58: 56 | I58: =R2C7&HLOOKUP(R2C[-6],R2C[-6]:R150C[-6],RC7+2,FALSE)&R2C7&"|"&R2C7&HLOOKUP(R2C[-6],R2C[-6]:R150C[-6],RC7+3,FALSE)&R2C7&"|"&R2C7&HLOOKUP(R2C[-6],R2C[-6]:R150C[-6],RC7+4,FALSE)&R2C7 -> "暂无后续"|"暂无后续"|"暂无后续" | J58: =R2C7&HLOOKUP(R2C[-6],R2C[-6]:R150C[-6],RC7+2,FALSE)&R2C7&"|"&R2C7&HLOOKUP(R2C[-6],R2C[-6]:R150C[-6],RC7+3,FALSE)&R2C7&"|"&R2C7&HLOOKUP(R2C[-6],R2C[-6]:R150C[-6],RC7+4,FALSE)&R2C7 -> "敬请期待"|"敬请期待"|"敬请期待" | K58: =HLOOKUP(R2C[-6],R2C[-6]:R150C[-6],RC7+2,FALSE)&"|"&HLOOKUP(R2C[-6],R2C[-6]:R150C[-6],RC7+3,FALSE)&"|"&HLOOKUP(R2C[-6],R2C[-6]:R150C[-6],RC7+4,FALSE) -> 150|150|150 | L58: =HLOOKUP(R2C[-6],R2C[-6]:R150C[-6],RC7+2,FALSE)&"|"&HLOOKUP(R2C[-6],R2C[-6]:R150C[-6],RC7+3,FALSE)&"|"&HLOOKUP(R2C[-6],R2C[-6]:R150C[-6],RC7+4,FALSE) -> 49|49|49
A59: 922.1 | B59: =ROW()-3 -> 56 | C59: 跨服对决 | D59: 参与跨服对决，胜利即是荣耀！ | E59: =INT(RC[-4]) -> 922 | F59: 72 | G59: =VLOOKUP(RC[1]-0.1,C1:C2,2,TRUE)+1 -> 53 | H59: 57 | I59: =R2C7&HLOOKUP(R2C[-6],R2C[-6]:R150C[-6],RC7+2,FALSE)&R2C7&"|"&R2C7&HLOOKUP(R2C[-6],R2C[-6]:R150C[-6],RC7+3,FALSE)&R2C7&"|"&R2C7&HLOOKUP(R2C[-6],R2C[-6]:R150C[-6],RC7+4,FALSE)&R2C7 -> "暂无后续"|"暂无后续"|"暂无后续" | J59: =R2C7&HLOOKUP(R2C[-6],R2C[-6]:R150C[-6],RC7+2,FALSE)&R2C7&"|"&R2C7&HLOOKUP(R2C[-6],R2C[-6]:R150C[-6],RC7+3,FALSE)&R2C7&"|"&R2C7&HLOOKUP(R2C[-6],R2C[-6]:R150C[-6],RC7+4,FALSE)&R2C7 -> "敬请期待"|"敬请期待"|"敬请期待" | K59: =HLOOKUP(R2C[-6],R2C[-6]:R150C[-6],RC7+2,FALSE)&"|"&HLOOKUP(R2C[-6],R2C[-6]:R150C[-6],RC7+3,FALSE)&"|"&HLOOKUP(R2C[-6],R2C[-6]:R150C[-6],RC7+4,FALSE) -> 150|150|150 | L59: =HLOOKUP(R2C[-6],R2C[-6]:R150C[-6],RC7+2,FALSE)&"|"&HLOOKUP(R2C[-6],R2C[-6]:R150C[-6],RC7+3,FALSE)&"|"&HLOOKUP(R2C[-6],R2C[-6]:R150C[-6],RC7+4,FALSE) -> 49|49|49
A60: 941 | B60: =ROW()-3 -> 57 | C60: 跨服组队 | D60: 前往空间管理局，穿越拯救世界！ | E60: =INT(RC[-4]) -> 941 | F60: 110 | G60: =VLOOKUP(RC[1]-0.1,C1:C2,2,TRUE)+1 -> 53 | H60: 58 | I60: =R2C7&HLOOKUP(R2C[-6],R2C[-6]:R150C[-6],RC7+2,FALSE)&R2C7&"|"&R2C7&HLOOKUP(R2C[-6],R2C[-6]:R150C[-6],RC7+3,FALSE)&R2C7&"|"&R2C7&HLOOKUP(R2C[-6],R2C[-6]:R150C[-6],RC7+4,FALSE)&R2C7 -> "暂无后续"|"暂无后续"|"暂无后续" | J60: =R2C7&HLOOKUP(R2C[-6],R2C[-6]:R150C[-6],RC7+2,FALSE)&R2C7&"|"&R2C7&HLOOKUP(R2C[-6],R2C[-6]:R150C[-6],RC7+3,FALSE)&R2C7&"|"&R2C7&HLOOKUP(R2C[-6],R2C[-6]:R150C[-6],RC7+4,FALSE)&R2C7 -> "敬请期待"|"敬请期待"|"敬请期待" | K60: =HLOOKUP(R2C[-6],R2C[-6]:R150C[-6],RC7+2,FALSE)&"|"&HLOOKUP(R2C[-6],R2C[-6]:R150C[-6],RC7+3,FALSE)&"|"&HLOOKUP(R2C[-6],R2C[-6]:R150C[-6],RC7+4,FALSE) -> 150|150|150 | L60: =HLOOKUP(R2C[-6],R2C[-6]:R150C[-6],RC7+2,FALSE)&"|"&HLOOKUP(R2C[-6],R2C[-6]:R150C[-6],RC7+3,FALSE)&"|"&HLOOKUP(R2C[-6],R2C[-6]:R150C[-6],RC7+4,FALSE) -> 49|49|49
A61: 950 | B61: =ROW()-3 -> 58 | C61: 占卜 | D61: 占卜开放，收集卡牌，大幅提升属性！ | E61: =INT(RC[-4]) -> 950 | F61: 113 | G61: =VLOOKUP(RC[1]-0.1,C1:C2,2,TRUE)+1 -> 53 | H61: 59 | I61: =R2C7&HLOOKUP(R2C[-6],R2C[-6]:R150C[-6],RC7+2,FALSE)&R2C7&"|"&R2C7&HLOOKUP(R2C[-6],R2C[-6]:R150C[-6],RC7+3,FALSE)&R2C7&"|"&R2C7&HLOOKUP(R2C[-6],R2C[-6]:R150C[-6],RC7+4,FALSE)&R2C7 -> "暂无后续"|"暂无后续"|"暂无后续" | J61: =R2C7&HLOOKUP(R2C[-6],R2C[-6]:R150C[-6],RC7+2,FALSE)&R2C7&"|"&R2C7&HLOOKUP(R2C[-6],R2C[-6]:R150C[-6],RC7+3,FALSE)&R2C7&"|"&R2C7&HLOOKUP(R2C[-6],R2C[-6]:R150C[-6],RC7+4,FALSE)&R2C7 -> "敬请期待"|"敬请期待"|"敬请期待" | K61: =HLOOKUP(R2C[-6],R2C[-6]:R150C[-6],RC7+2,FALSE)&"|"&HLOOKUP(R2C[-6],R2C[-6]:R150C[-6],RC7+3,FALSE)&"|"&HLOOKUP(R2C[-6],R2C[-6]:R150C[-6],RC7+4,FALSE) -> 150|150|150 | L61: =HLOOKUP(R2C[-6],R2C[-6]:R150C[-6],RC7+2,FALSE)&"|"&HLOOKUP(R2C[-6],R2C[-6]:R150C[-6],RC7+3,FALSE)&"|"&HLOOKUP(R2C[-6],R2C[-6]:R150C[-6],RC7+4,FALSE) -> 49|49|49
A62: 950.1 | B62: =ROW()-3 -> 59 | C62: 卡牌携带 | D62: 英雄携带卡牌，大幅提升属性！ | E62: =INT(RC[-4]) -> 950 | F62: 8 | G62: =VLOOKUP(RC[1]-0.1,C1:C2,2,TRUE)+1 -> 53 | H62: 60 | I62: =R2C7&HLOOKUP(R2C[-6],R2C[-6]:R150C[-6],RC7+2,FALSE)&R2C7&"|"&R2C7&HLOOKUP(R2C[-6],R2C[-6]:R150C[-6],RC7+3,FALSE)&R2C7&"|"&R2C7&HLOOKUP(R2C[-6],R2C[-6]:R150C[-6],RC7+4,FALSE)&R2C7 -> "暂无后续"|"暂无后续"|"暂无后续" | J62: =R2C7&HLOOKUP(R2C[-6],R2C[-6]:R150C[-6],RC7+2,FALSE)&R2C7&"|"&R2C7&HLOOKUP(R2C[-6],R2C[-6]:R150C[-6],RC7+3,FALSE)&R2C7&"|"&R2C7&HLOOKUP(R2C[-6],R2C[-6]:R150C[-6],RC7+4,FALSE)&R2C7 -> "敬请期待"|"敬请期待"|"敬请期待" | K62: =HLOOKUP(R2C[-6],R2C[-6]:R150C[-6],RC7+2,FALSE)&"|"&HLOOKUP(R2C[-6],R2C[-6]:R150C[-6],RC7+3,FALSE)&"|"&HLOOKUP(R2C[-6],R2C[-6]:R150C[-6],RC7+4,FALSE) -> 150|150|150 | L62: =HLOOKUP(R2C[-6],R2C[-6]:R150C[-6],RC7+2,FALSE)&"|"&HLOOKUP(R2C[-6],R2C[-6]:R150C[-6],RC7+3,FALSE)&"|"&HLOOKUP(R2C[-6],R2C[-6]:R150C[-6],RC7+4,FALSE) -> 49|49|49
A63: 955 | B63: =ROW()-3 -> 60 | C63: 卡牌槽位3 | D63: 携带更多卡牌，提升更多属性！ | E63: =INT(RC[-4]) -> 955 | F63: 8 | G63: =VLOOKUP(RC[1]-0.1,C1:C2,2,TRUE)+1 -> 53 | H63: 61 | I63: =R2C7&HLOOKUP(R2C[-6],R2C[-6]:R150C[-6],RC7+2,FALSE)&R2C7&"|"&R2C7&HLOOKUP(R2C[-6],R2C[-6]:R150C[-6],RC7+3,FALSE)&R2C7&"|"&R2C7&HLOOKUP(R2C[-6],R2C[-6]:R150C[-6],RC7+4,FALSE)&R2C7 -> "暂无后续"|"暂无后续"|"暂无后续" | J63: =R2C7&HLOOKUP(R2C[-6],R2C[-6]:R150C[-6],RC7+2,FALSE)&R2C7&"|"&R2C7&HLOOKUP(R2C[-6],R2C[-6]:R150C[-6],RC7+3,FALSE)&R2C7&"|"&R2C7&HLOOKUP(R2C[-6],R2C[-6]:R150C[-6],RC7+4,FALSE)&R2C7 -> "敬请期待"|"敬请期待"|"敬请期待" | K63: =HLOOKUP(R2C[-6],R2C[-6]:R150C[-6],RC7+2,FALSE)&"|"&HLOOKUP(R2C[-6],R2C[-6]:R150C[-6],RC7+3,FALSE)&"|"&HLOOKUP(R2C[-6],R2C[-6]:R150C[-6],RC7+4,FALSE) -> 150|150|150 | L63: =HLOOKUP(R2C[-6],R2C[-6]:R150C[-6],RC7+2,FALSE)&"|"&HLOOKUP(R2C[-6],R2C[-6]:R150C[-6],RC7+3,FALSE)&"|"&HLOOKUP(R2C[-6],R2C[-6]:R150C[-6],RC7+4,FALSE) -> 49|49|49
A64: 960 | B64: =ROW()-3 -> 61 | C64: 卡牌槽位4 | D64: 携带更多卡牌，提升更多属性！ | E64: =INT(RC[-4]) -> 960 | F64: 8 | G64: =VLOOKUP(RC[1]-0.1,C1:C2,2,TRUE)+1 -> 53 | H64: 62 | I64: =R2C7&HLOOKUP(R2C[-6],R2C[-6]:R150C[-6],RC7+2,FALSE)&R2C7&"|"&R2C7&HLOOKUP(R2C[-6],R2C[-6]:R150C[-6],RC7+3,FALSE)&R2C7&"|"&R2C7&HLOOKUP(R2C[-6],R2C[-6]:R150C[-6],RC7+4,FALSE)&R2C7 -> "暂无后续"|"暂无后续"|"暂无后续" | J64: =R2C7&HLOOKUP(R2C[-6],R2C[-6]:R150C[-6],RC7+2,FALSE)&R2C7&"|"&R2C7&HLOOKUP(R2C[-6],R2C[-6]:R150C[-6],RC7+3,FALSE)&R2C7&"|"&R2C7&HLOOKUP(R2C[-6],R2C[-6]:R150C[-6],RC7+4,FALSE)&R2C7 -> "敬请期待"|"敬请期待"|"敬请期待" | K64: =HLOOKUP(R2C[-6],R2C[-6]:R150C[-6],RC7+2,FALSE)&"|"&HLOOKUP(R2C[-6],R2C[-6]:R150C[-6],RC7+3,FALSE)&"|"&HLOOKUP(R2C[-6],R2C[-6]:R150C[-6],RC7+4,FALSE) -> 150|150|150 | L64: =HLOOKUP(R2C[-6],R2C[-6]:R150C[-6],RC7+2,FALSE)&"|"&HLOOKUP(R2C[-6],R2C[-6]:R150C[-6],RC7+3,FALSE)&"|"&HLOOKUP(R2C[-6],R2C[-6]:R150C[-6],RC7+4,FALSE) -> 49|49|49
A65: 965 | B65: =ROW()-3 -> 62 | C65: 卡牌槽位5 | D65: 携带更多卡牌，提升更多属性！ | E65: =INT(RC[-4]) -> 965 | F65: 8 | G65: =VLOOKUP(RC[1]-0.1,C1:C2,2,TRUE)+1 -> 53 | H65: 63 | I65: =R2C7&HLOOKUP(R2C[-6],R2C[-6]:R150C[-6],RC7+2,FALSE)&R2C7&"|"&R2C7&HLOOKUP(R2C[-6],R2C[-6]:R150C[-6],RC7+3,FALSE)&R2C7&"|"&R2C7&HLOOKUP(R2C[-6],R2C[-6]:R150C[-6],RC7+4,FALSE)&R2C7 -> "暂无后续"|"暂无后续"|"暂无后续" | J65: =R2C7&HLOOKUP(R2C[-6],R2C[-6]:R150C[-6],RC7+2,FALSE)&R2C7&"|"&R2C7&HLOOKUP(R2C[-6],R2C[-6]:R150C[-6],RC7+3,FALSE)&R2C7&"|"&R2C7&HLOOKUP(R2C[-6],R2C[-6]:R150C[-6],RC7+4,FALSE)&R2C7 -> "敬请期待"|"敬请期待"|"敬请期待" | K65: =HLOOKUP(R2C[-6],R2C[-6]:R150C[-6],RC7+2,FALSE)&"|"&HLOOKUP(R2C[-6],R2C[-6]:R150C[-6],RC7+3,FALSE)&"|"&HLOOKUP(R2C[-6],R2C[-6]:R150C[-6],RC7+4,FALSE) -> 150|150|150 | L65: =HLOOKUP(R2C[-6],R2C[-6]:R150C[-6],RC7+2,FALSE)&"|"&HLOOKUP(R2C[-6],R2C[-6]:R150C[-6],RC7+3,FALSE)&"|"&HLOOKUP(R2C[-6],R2C[-6]:R150C[-6],RC7+4,FALSE) -> 49|49|49
A66: 970 | B66: =ROW()-3 -> 63 | C66: 卡牌槽位6 | D66: 携带更多卡牌，提升更多属性！ | E66: =INT(RC[-4]) -> 970 | F66: 8 | G66: =VLOOKUP(RC[1]-0.1,C1:C2,2,TRUE)+1 -> 53 | H66: 64 | I66: =R2C7&HLOOKUP(R2C[-6],R2C[-6]:R150C[-6],RC7+2,FALSE)&R2C7&"|"&R2C7&HLOOKUP(R2C[-6],R2C[-6]:R150C[-6],RC7+3,FALSE)&R2C7&"|"&R2C7&HLOOKUP(R2C[-6],R2C[-6]:R150C[-6],RC7+4,FALSE)&R2C7 -> "暂无后续"|"暂无后续"|"暂无后续" | J66: =R2C7&HLOOKUP(R2C[-6],R2C[-6]:R150C[-6],RC7+2,FALSE)&R2C7&"|"&R2C7&HLOOKUP(R2C[-6],R2C[-6]:R150C[-6],RC7+3,FALSE)&R2C7&"|"&R2C7&HLOOKUP(R2C[-6],R2C[-6]:R150C[-6],RC7+4,FALSE)&R2C7 -> "敬请期待"|"敬请期待"|"敬请期待" | K66: =HLOOKUP(R2C[-6],R2C[-6]:R150C[-6],RC7+2,FALSE)&"|"&HLOOKUP(R2C[-6],R2C[-6]:R150C[-6],RC7+3,FALSE)&"|"&HLOOKUP(R2C[-6],R2C[-6]:R150C[-6],RC7+4,FALSE) -> 150|150|150 | L66: =HLOOKUP(R2C[-6],R2C[-6]:R150C[-6],RC7+2,FALSE)&"|"&HLOOKUP(R2C[-6],R2C[-6]:R150C[-6],RC7+3,FALSE)&"|"&HLOOKUP(R2C[-6],R2C[-6]:R150C[-6],RC7+4,FALSE) -> 49|49|49
A67: 975 | B67: =ROW()-3 -> 64 | C67: 卡牌槽位7 | D67: 携带更多卡牌，提升更多属性！ | E67: =INT(RC[-4]) -> 975 | F67: 8 | G67: =VLOOKUP(RC[1]-0.1,C1:C2,2,TRUE)+1 -> 53 | H67: 65 | I67: =R2C7&HLOOKUP(R2C[-6],R2C[-6]:R150C[-6],RC7+2,FALSE)&R2C7&"|"&R2C7&HLOOKUP(R2C[-6],R2C[-6]:R150C[-6],RC7+3,FALSE)&R2C7&"|"&R2C7&HLOOKUP(R2C[-6],R2C[-6]:R150C[-6],RC7+4,FALSE)&R2C7 -> "暂无后续"|"暂无后续"|"暂无后续" | J67: =R2C7&HLOOKUP(R2C[-6],R2C[-6]:R150C[-6],RC7+2,FALSE)&R2C7&"|"&R2C7&HLOOKUP(R2C[-6],R2C[-6]:R150C[-6],RC7+3,FALSE)&R2C7&"|"&R2C7&HLOOKUP(R2C[-6],R2C[-6]:R150C[-6],RC7+4,FALSE)&R2C7 -> "敬请期待"|"敬请期待"|"敬请期待" | K67: =HLOOKUP(R2C[-6],R2C[-6]:R150C[-6],RC7+2,FALSE)&"|"&HLOOKUP(R2C[-6],R2C[-6]:R150C[-6],RC7+3,FALSE)&"|"&HLOOKUP(R2C[-6],R2C[-6]:R150C[-6],RC7+4,FALSE) -> 150|150|150 | L67: =HLOOKUP(R2C[-6],R2C[-6]:R150C[-6],RC7+2,FALSE)&"|"&HLOOKUP(R2C[-6],R2C[-6]:R150C[-6],RC7+3,FALSE)&"|"&HLOOKUP(R2C[-6],R2C[-6]:R150C[-6],RC7+4,FALSE) -> 49|49|49
A68: 980 | B68: =ROW()-3 -> 65 | C68: 卡牌槽位8 | D68: 携带更多卡牌，提升更多属性！ | E68: =INT(RC[-4]) -> 980 | F68: 8 | G68: =VLOOKUP(RC[1]-0.1,C1:C2,2,TRUE)+1 -> 53 | H68: 66 | I68: =R2C7&HLOOKUP(R2C[-6],R2C[-6]:R150C[-6],RC7+2,FALSE)&R2C7&"|"&R2C7&HLOOKUP(R2C[-6],R2C[-6]:R150C[-6],RC7+3,FALSE)&R2C7&"|"&R2C7&HLOOKUP(R2C[-6],R2C[-6]:R150C[-6],RC7+4,FALSE)&R2C7 -> "暂无后续"|"暂无后续"|"暂无后续" | J68: =R2C7&HLOOKUP(R2C[-6],R2C[-6]:R150C[-6],RC7+2,FALSE)&R2C7&"|"&R2C7&HLOOKUP(R2C[-6],R2C[-6]:R150C[-6],RC7+3,FALSE)&R2C7&"|"&R2C7&HLOOKUP(R2C[-6],R2C[-6]:R150C[-6],RC7+4,FALSE)&R2C7 -> "敬请期待"|"敬请期待"|"敬请期待" | K68: =HLOOKUP(R2C[-6],R2C[-6]:R150C[-6],RC7+2,FALSE)&"|"&HLOOKUP(R2C[-6],R2C[-6]:R150C[-6],RC7+3,FALSE)&"|"&HLOOKUP(R2C[-6],R2C[-6]:R150C[-6],RC7+4,FALSE) -> 150|150|150 | L68: =HLOOKUP(R2C[-6],R2C[-6]:R150C[-6],RC7+2,FALSE)&"|"&HLOOKUP(R2C[-6],R2C[-6]:R150C[-6],RC7+3,FALSE)&"|"&HLOOKUP(R2C[-6],R2C[-6]:R150C[-6],RC7+4,FALSE) -> 49|49|49
G69: =VLOOKUP(RC[1]-0.1,C1:C2,2,TRUE)+1 -> 53 | H69: 67 | I69: =R2C7&HLOOKUP(R2C[-6],R2C[-6]:R150C[-6],RC7+2,FALSE)&R2C7&"|"&R2C7&HLOOKUP(R2C[-6],R2C[-6]:R150C[-6],RC7+3,FALSE)&R2C7&"|"&R2C7&HLOOKUP(R2C[-6],R2C[-6]:R150C[-6],RC7+4,FALSE)&R2C7 -> "暂无后续"|"暂无后续"|"暂无后续" | J69: =R2C7&HLOOKUP(R2C[-6],R2C[-6]:R150C[-6],RC7+2,FALSE)&R2C7&"|"&R2C7&HLOOKUP(R2C[-6],R2C[-6]:R150C[-6],RC7+3,FALSE)&R2C7&"|"&R2C7&HLOOKUP(R2C[-6],R2C[-6]:R150C[-6],RC7+4,FALSE)&R2C7 -> "敬请期待"|"敬请期待"|"敬请期待" | K69: =HLOOKUP(R2C[-6],R2C[-6]:R150C[-6],RC7+2,FALSE)&"|"&HLOOKUP(R2C[-6],R2C[-6]:R150C[-6],RC7+3,FALSE)&"|"&HLOOKUP(R2C[-6],R2C[-6]:R150C[-6],RC7+4,FALSE) -> 150|150|150 | L69: =HLOOKUP(R2C[-6],R2C[-6]:R150C[-6],RC7+2,FALSE)&"|"&HLOOKUP(R2C[-6],R2C[-6]:R150C[-6],RC7+3,FALSE)&"|"&HLOOKUP(R2C[-6],R2C[-6]:R150C[-6],RC7+4,FALSE) -> 49|49|49
G70: =VLOOKUP(RC[1]-0.1,C1:C2,2,TRUE)+1 -> 53 | H70: 68 | I70: =R2C7&HLOOKUP(R2C[-6],R2C[-6]:R150C[-6],RC7+2,FALSE)&R2C7&"|"&R2C7&HLOOKUP(R2C[-6],R2C[-6]:R150C[-6],RC7+3,FALSE)&R2C7&"|"&R2C7&HLOOKUP(R2C[-6],R2C[-6]:R150C[-6],RC7+4,FALSE)&R2C7 -> "暂无后续"|"暂无后续"|"暂无后续" | J70: =R2C7&HLOOKUP(R2C[-6],R2C[-6]:R150C[-6],RC7+2,FALSE)&R2C7&"|"&R2C7&HLOOKUP(R2C[-6],R2C[-6]:R150C[-6],RC7+3,FALSE)&R2C7&"|"&R2C7&HLOOKUP(R2C[-6],R2C[-6]:R150C[-6],RC7+4,FALSE)&R2C7 -> "敬请期待"|"敬请期待"|"敬请期待" | K70: =HLOOKUP(R2C[-6],R2C[-6]:R150C[-6],RC7+2,FALSE)&"|"&HLOOKUP(R2C[-6],R2C[-6]:R150C[-6],RC7+3,FALSE)&"|"&HLOOKUP(R2C[-6],R2C[-6]:R150C[-6],RC7+4,FALSE) -> 150|150|150 | L70: =HLOOKUP(R2C[-6],R2C[-6]:R150C[-6],RC7+2,FALSE)&"|"&HLOOKUP(R2C[-6],R2C[-6]:R150C[-6],RC7+3,FALSE)&"|"&HLOOKUP(R2C[-6],R2C[-6]:R150C[-6],RC7+4,FALSE) -> 49|49|49
G71: =VLOOKUP(RC[1]-0.1,C1:C2,2,TRUE)+1 -> 53 | H71: 69 | I71: =R2C7&HLOOKUP(R2C[-6],R2C[-6]:R150C[-6],RC7+2,FALSE)&R2C7&"|"&R2C7&HLOOKUP(R2C[-6],R2C[-6]:R150C[-6],RC7+3,FALSE)&R2C7&"|"&R2C7&HLOOKUP(R2C[-6],R2C[-6]:R150C[-6],RC7+4,FALSE)&R2C7 -> "暂无后续"|"暂无后续"|"暂无后续" | J71: =R2C7&HLOOKUP(R2C[-6],R2C[-6]:R150C[-6],RC7+2,FALSE)&R2C7&"|"&R2C7&HLOOKUP(R2C[-6],R2C[-6]:R150C[-6],RC7+3,FALSE)&R2C7&"|"&R2C7&HLOOKUP(R2C[-6],R2C[-6]:R150C[-6],RC7+4,FALSE)&R2C7 -> "敬请期待"|"敬请期待"|"敬请期待" | K71: =HLOOKUP(R2C[-6],R2C[-6]:R150C[-6],RC7+2,FALSE)&"|"&HLOOKUP(R2C[-6],R2C[-6]:R150C[-6],RC7+3,FALSE)&"|"&HLOOKUP(R2C[-6],R2C[-6]:R150C[-6],RC7+4,FALSE) -> 150|150|150 | L71: =HLOOKUP(R2C[-6],R2C[-6]:R150C[-6],RC7+2,FALSE)&"|"&HLOOKUP(R2C[-6],R2C[-6]:R150C[-6],RC7+3,FALSE)&"|"&HLOOKUP(R2C[-6],R2C[-6]:R150C[-6],RC7+4,FALSE) -> 49|49|49
G72: =VLOOKUP(RC[1]-0.1,C1:C2,2,TRUE)+1 -> 53 | H72: 70 | I72: =R2C7&HLOOKUP(R2C[-6],R2C[-6]:R150C[-6],RC7+2,FALSE)&R2C7&"|"&R2C7&HLOOKUP(R2C[-6],R2C[-6]:R150C[-6],RC7+3,FALSE)&R2C7&"|"&R2C7&HLOOKUP(R2C[-6],R2C[-6]:R150C[-6],RC7+4,FALSE)&R2C7 -> "暂无后续"|"暂无后续"|"暂无后续" | J72: =R2C7&HLOOKUP(R2C[-6],R2C[-6]:R150C[-6],RC7+2,FALSE)&R2C7&"|"&R2C7&HLOOKUP(R2C[-6],R2C[-6]:R150C[-6],RC7+3,FALSE)&R2C7&"|"&R2C7&HLOOKUP(R2C[-6],R2C[-6]:R150C[-6],RC7+4,FALSE)&R2C7 -> "敬请期待"|"敬请期待"|"敬请期待" | K72: =HLOOKUP(R2C[-6],R2C[-6]:R150C[-6],RC7+2,FALSE)&"|"&HLOOKUP(R2C[-6],R2C[-6]:R150C[-6],RC7+3,FALSE)&"|"&HLOOKUP(R2C[-6],R2C[-6]:R150C[-6],RC7+4,FALSE) -> 150|150|150 | L72: =HLOOKUP(R2C[-6],R2C[-6]:R150C[-6],RC7+2,FALSE)&"|"&HLOOKUP(R2C[-6],R2C[-6]:R150C[-6],RC7+3,FALSE)&"|"&HLOOKUP(R2C[-6],R2C[-6]:R150C[-6],RC7+4,FALSE) -> 49|49|49
G73: =VLOOKUP(RC[1]-0.1,C1:C2,2,TRUE)+1 -> 53 | H73: 71 | I73: =R2C7&HLOOKUP(R2C[-6],R2C[-6]:R150C[-6],RC7+2,FALSE)&R2C7&"|"&R2C7&HLOOKUP(R2C[-6],R2C[-6]:R150C[-6],RC7+3,FALSE)&R2C7&"|"&R2C7&HLOOKUP(R2C[-6],R2C[-6]:R150C[-6],RC7+4,FALSE)&R2C7 -> "暂无后续"|"暂无后续"|"暂无后续" | J73: =R2C7&HLOOKUP(R2C[-6],R2C[-6]:R150C[-6],RC7+2,FALSE)&R2C7&"|"&R2C7&HLOOKUP(R2C[-6],R2C[-6]:R150C[-6],RC7+3,FALSE)&R2C7&"|"&R2C7&HLOOKUP(R2C[-6],R2C[-6]:R150C[-6],RC7+4,FALSE)&R2C7 -> "敬请期待"|"敬请期待"|"敬请期待" | K73: =HLOOKUP(R2C[-6],R2C[-6]:R150C[-6],RC7+2,FALSE)&"|"&HLOOKUP(R2C[-6],R2C[-6]:R150C[-6],RC7+3,FALSE)&"|"&HLOOKUP(R2C[-6],R2C[-6]:R150C[-6],RC7+4,FALSE) -> 150|150|150 | L73: =HLOOKUP(R2C[-6],R2C[-6]:R150C[-6],RC7+2,FALSE)&"|"&HLOOKUP(R2C[-6],R2C[-6]:R150C[-6],RC7+3,FALSE)&"|"&HLOOKUP(R2C[-6],R2C[-6]:R150C[-6],RC7+4,FALSE) -> 49|49|49
G74: =VLOOKUP(RC[1]-0.1,C1:C2,2,TRUE)+1 -> 53 | H74: 72 | I74: =R2C7&HLOOKUP(R2C[-6],R2C[-6]:R150C[-6],RC7+2,FALSE)&R2C7&"|"&R2C7&HLOOKUP(R2C[-6],R2C[-6]:R150C[-6],RC7+3,FALSE)&R2C7&"|"&R2C7&HLOOKUP(R2C[-6],R2C[-6]:R150C[-6],RC7+4,FALSE)&R2C7 -> "暂无后续"|"暂无后续"|"暂无后续" | J74: =R2C7&HLOOKUP(R2C[-6],R2C[-6]:R150C[-6],RC7+2,FALSE)&R2C7&"|"&R2C7&HLOOKUP(R2C[-6],R2C[-6]:R150C[-6],RC7+3,FALSE)&R2C7&"|"&R2C7&HLOOKUP(R2C[-6],R2C[-6]:R150C[-6],RC7+4,FALSE)&R2C7 -> "敬请期待"|"敬请期待"|"敬请期待" | K74: =HLOOKUP(R2C[-6],R2C[-6]:R150C[-6],RC7+2,FALSE)&"|"&HLOOKUP(R2C[-6],R2C[-6]:R150C[-6],RC7+3,FALSE)&"|"&HLOOKUP(R2C[-6],R2C[-6]:R150C[-6],RC7+4,FALSE) -> 150|150|150 | L74: =HLOOKUP(R2C[-6],R2C[-6]:R150C[-6],RC7+2,FALSE)&"|"&HLOOKUP(R2C[-6],R2C[-6]:R150C[-6],RC7+3,FALSE)&"|"&HLOOKUP(R2C[-6],R2C[-6]:R150C[-6],RC7+4,FALSE) -> 49|49|49
G75: =VLOOKUP(RC[1]-0.1,C1:C2,2,TRUE)+1 -> 53 | H75: 73 | I75: =R2C7&HLOOKUP(R2C[-6],R2C[-6]:R150C[-6],RC7+2,FALSE)&R2C7&"|"&R2C7&HLOOKUP(R2C[-6],R2C[-6]:R150C[-6],RC7+3,FALSE)&R2C7&"|"&R2C7&HLOOKUP(R2C[-6],R2C[-6]:R150C[-6],RC7+4,FALSE)&R2C7 -> "暂无后续"|"暂无后续"|"暂无后续" | J75: =R2C7&HLOOKUP(R2C[-6],R2C[-6]:R150C[-6],RC7+2,FALSE)&R2C7&"|"&R2C7&HLOOKUP(R2C[-6],R2C[-6]:R150C[-6],RC7+3,FALSE)&R2C7&"|"&R2C7&HLOOKUP(R2C[-6],R2C[-6]:R150C[-6],RC7+4,FALSE)&R2C7 -> "敬请期待"|"敬请期待"|"敬请期待" | K75: =HLOOKUP(R2C[-6],R2C[-6]:R150C[-6],RC7+2,FALSE)&"|"&HLOOKUP(R2C[-6],R2C[-6]:R150C[-6],RC7+3,FALSE)&"|"&HLOOKUP(R2C[-6],R2C[-6]:R150C[-6],RC7+4,FALSE) -> 150|150|150 | L75: =HLOOKUP(R2C[-6],R2C[-6]:R150C[-6],RC7+2,FALSE)&"|"&HLOOKUP(R2C[-6],R2C[-6]:R150C[-6],RC7+3,FALSE)&"|"&HLOOKUP(R2C[-6],R2C[-6]:R150C[-6],RC7+4,FALSE) -> 49|49|49
G76: =VLOOKUP(RC[1]-0.1,C1:C2,2,TRUE)+1 -> 53 | H76: 74 | I76: =R2C7&HLOOKUP(R2C[-6],R2C[-6]:R150C[-6],RC7+2,FALSE)&R2C7&"|"&R2C7&HLOOKUP(R2C[-6],R2C[-6]:R150C[-6],RC7+3,FALSE)&R2C7&"|"&R2C7&HLOOKUP(R2C[-6],R2C[-6]:R150C[-6],RC7+4,FALSE)&R2C7 -> "暂无后续"|"暂无后续"|"暂无后续" | J76: =R2C7&HLOOKUP(R2C[-6],R2C[-6]:R150C[-6],RC7+2,FALSE)&R2C7&"|"&R2C7&HLOOKUP(R2C[-6],R2C[-6]:R150C[-6],RC7+3,FALSE)&R2C7&"|"&R2C7&HLOOKUP(R2C[-6],R2C[-6]:R150C[-6],RC7+4,FALSE)&R2C7 -> "敬请期待"|"敬请期待"|"敬请期待" | K76: =HLOOKUP(R2C[-6],R2C[-6]:R150C[-6],RC7+2,FALSE)&"|"&HLOOKUP(R2C[-6],R2C[-6]:R150C[-6],RC7+3,FALSE)&"|"&HLOOKUP(R2C[-6],R2C[-6]:R150C[-6],RC7+4,FALSE) -> 150|150|150 | L76: =HLOOKUP(R2C[-6],R2C[-6]:R150C[-6],RC7+2,FALSE)&"|"&HLOOKUP(R2C[-6],R2C[-6]:R150C[-6],RC7+3,FALSE)&"|"&HLOOKUP(R2C[-6],R2C[-6]:R150C[-6],RC7+4,FALSE) -> 49|49|49
G77: =VLOOKUP(RC[1]-0.1,C1:C2,2,TRUE)+1 -> 53 | H77: 75 | I77: =R2C7&HLOOKUP(R2C[-6],R2C[-6]:R150C[-6],RC7+2,FALSE)&R2C7&"|"&R2C7&HLOOKUP(R2C[-6],R2C[-6]:R150C[-6],RC7+3,FALSE)&R2C7&"|"&R2C7&HLOOKUP(R2C[-6],R2C[-6]:R150C[-6],RC7+4,FALSE)&R2C7 -> "暂无后续"|"暂无后续"|"暂无后续" | J77: =R2C7&HLOOKUP(R2C[-6],R2C[-6]:R150C[-6],RC7+2,FALSE)&R2C7&"|"&R2C7&HLOOKUP(R2C[-6],R2C[-6]:R150C[-6],RC7+3,FALSE)&R2C7&"|"&R2C7&HLOOKUP(R2C[-6],R2C[-6]:R150C[-6],RC7+4,FALSE)&R2C7 -> "敬请期待"|"敬请期待"|"敬请期待" | K77: =HLOOKUP(R2C[-6],R2C[-6]:R150C[-6],RC7+2,FALSE)&"|"&HLOOKUP(R2C[-6],R2C[-6]:R150C[-6],RC7+3,FALSE)&"|"&HLOOKUP(R2C[-6],R2C[-6]:R150C[-6],RC7+4,FALSE) -> 150|150|150 | L77: =HLOOKUP(R2C[-6],R2C[-6]:R150C[-6],RC7+2,FALSE)&"|"&HLOOKUP(R2C[-6],R2C[-6]:R150C[-6],RC7+3,FALSE)&"|"&HLOOKUP(R2C[-6],R2C[-6]:R150C[-6],RC7+4,FALSE) -> 49|49|49
G78: =VLOOKUP(RC[1]-0.1,C1:C2,2,TRUE)+1 -> 53 | H78: 76 | I78: =R2C7&HLOOKUP(R2C[-6],R2C[-6]:R150C[-6],RC7+2,FALSE)&R2C7&"|"&R2C7&HLOOKUP(R2C[-6],R2C[-6]:R150C[-6],RC7+3,FALSE)&R2C7&"|"&R2C7&HLOOKUP(R2C[-6],R2C[-6]:R150C[-6],RC7+4,FALSE)&R2C7 -> "暂无后续"|"暂无后续"|"暂无后续" | J78: =R2C7&HLOOKUP(R2C[-6],R2C[-6]:R150C[-6],RC7+2,FALSE)&R2C7&"|"&R2C7&HLOOKUP(R2C[-6],R2C[-6]:R150C[-6],RC7+3,FALSE)&R2C7&"|"&R2C7&HLOOKUP(R2C[-6],R2C[-6]:R150C[-6],RC7+4,FALSE)&R2C7 -> "敬请期待"|"敬请期待"|"敬请期待" | K78: =HLOOKUP(R2C[-6],R2C[-6]:R150C[-6],RC7+2,FALSE)&"|"&HLOOKUP(R2C[-6],R2C[-6]:R150C[-6],RC7+3,FALSE)&"|"&HLOOKUP(R2C[-6],R2C[-6]:R150C[-6],RC7+4,FALSE) -> 150|150|150 | L78: =HLOOKUP(R2C[-6],R2C[-6]:R150C[-6],RC7+2,FALSE)&"|"&HLOOKUP(R2C[-6],R2C[-6]:R150C[-6],RC7+3,FALSE)&"|"&HLOOKUP(R2C[-6],R2C[-6]:R150C[-6],RC7+4,FALSE) -> 49|49|49
G79: =VLOOKUP(RC[1]-0.1,C1:C2,2,TRUE)+1 -> 53 | H79: 77 | I79: =R2C7&HLOOKUP(R2C[-6],R2C[-6]:R150C[-6],RC7+2,FALSE)&R2C7&"|"&R2C7&HLOOKUP(R2C[-6],R2C[-6]:R150C[-6],RC7+3,FALSE)&R2C7&"|"&R2C7&HLOOKUP(R2C[-6],R2C[-6]:R150C[-6],RC7+4,FALSE)&R2C7 -> "暂无后续"|"暂无后续"|"暂无后续" | J79: =R2C7&HLOOKUP(R2C[-6],R2C[-6]:R150C[-6],RC7+2,FALSE)&R2C7&"|"&R2C7&HLOOKUP(R2C[-6],R2C[-6]:R150C[-6],RC7+3,FALSE)&R2C7&"|"&R2C7&HLOOKUP(R2C[-6],R2C[-6]:R150C[-6],RC7+4,FALSE)&R2C7 -> "敬请期待"|"敬请期待"|"敬请期待" | K79: =HLOOKUP(R2C[-6],R2C[-6]:R150C[-6],RC7+2,FALSE)&"|"&HLOOKUP(R2C[-6],R2C[-6]:R150C[-6],RC7+3,FALSE)&"|"&HLOOKUP(R2C[-6],R2C[-6]:R150C[-6],RC7+4,FALSE) -> 150|150|150 | L79: =HLOOKUP(R2C[-6],R2C[-6]:R150C[-6],RC7+2,FALSE)&"|"&HLOOKUP(R2C[-6],R2C[-6]:R150C[-6],RC7+3,FALSE)&"|"&HLOOKUP(R2C[-6],R2C[-6]:R150C[-6],RC7+4,FALSE) -> 49|49|49
G80: =VLOOKUP(RC[1]-0.1,C1:C2,2,TRUE)+1 -> 53 | H80: 78 | I80: =R2C7&HLOOKUP(R2C[-6],R2C[-6]:R150C[-6],RC7+2,FALSE)&R2C7&"|"&R2C7&HLOOKUP(R2C[-6],R2C[-6]:R150C[-6],RC7+3,FALSE)&R2C7&"|"&R2C7&HLOOKUP(R2C[-6],R2C[-6]:R150C[-6],RC7+4,FALSE)&R2C7 -> "暂无后续"|"暂无后续"|"暂无后续" | J80: =R2C7&HLOOKUP(R2C[-6],R2C[-6]:R150C[-6],RC7+2,FALSE)&R2C7&"|"&R2C7&HLOOKUP(R2C[-6],R2C[-6]:R150C[-6],RC7+3,FALSE)&R2C7&"|"&R2C7&HLOOKUP(R2C[-6],R2C[-6]:R150C[-6],RC7+4,FALSE)&R2C7 -> "敬请期待"|"敬请期待"|"敬请期待" | K80: =HLOOKUP(R2C[-6],R2C[-6]:R150C[-6],RC7+2,FALSE)&"|"&HLOOKUP(R2C[-6],R2C[-6]:R150C[-6],RC7+3,FALSE)&"|"&HLOOKUP(R2C[-6],R2C[-6]:R150C[-6],RC7+4,FALSE) -> 150|150|150 | L80: =HLOOKUP(R2C[-6],R2C[-6]:R150C[-6],RC7+2,FALSE)&"|"&HLOOKUP(R2C[-6],R2C[-6]:R150C[-6],RC7+3,FALSE)&"|"&HLOOKUP(R2C[-6],R2C[-6]:R150C[-6],RC7+4,FALSE) -> 49|49|49
G81: =VLOOKUP(RC[1]-0.1,C1:C2,2,TRUE)+1 -> 53 | H81: 79 | I81: =R2C7&HLOOKUP(R2C[-6],R2C[-6]:R150C[-6],RC7+2,FALSE)&R2C7&"|"&R2C7&HLOOKUP(R2C[-6],R2C[-6]:R150C[-6],RC7+3,FALSE)&R2C7&"|"&R2C7&HLOOKUP(R2C[-6],R2C[-6]:R150C[-6],RC7+4,FALSE)&R2C7 -> "暂无后续"|"暂无后续"|"暂无后续" | J81: =R2C7&HLOOKUP(R2C[-6],R2C[-6]:R150C[-6],RC7+2,FALSE)&R2C7&"|"&R2C7&HLOOKUP(R2C[-6],R2C[-6]:R150C[-6],RC7+3,FALSE)&R2C7&"|"&R2C7&HLOOKUP(R2C[-6],R2C[-6]:R150C[-6],RC7+4,FALSE)&R2C7 -> "敬请期待"|"敬请期待"|"敬请期待" | K81: =HLOOKUP(R2C[-6],R2C[-6]:R150C[-6],RC7+2,FALSE)&"|"&HLOOKUP(R2C[-6],R2C[-6]:R150C[-6],RC7+3,FALSE)&"|"&HLOOKUP(R2C[-6],R2C[-6]:R150C[-6],RC7+4,FALSE) -> 150|150|150 | L81: =HLOOKUP(R2C[-6],R2C[-6]:R150C[-6],RC7+2,FALSE)&"|"&HLOOKUP(R2C[-6],R2C[-6]:R150C[-6],RC7+3,FALSE)&"|"&HLOOKUP(R2C[-6],R2C[-6]:R150C[-6],RC7+4,FALSE) -> 49|49|49
G82: =VLOOKUP(RC[1]-0.1,C1:C2,2,TRUE)+1 -> 53 | H82: 80 | I82: =R2C7&HLOOKUP(R2C[-6],R2C[-6]:R150C[-6],RC7+2,FALSE)&R2C7&"|"&R2C7&HLOOKUP(R2C[-6],R2C[-6]:R150C[-6],RC7+3,FALSE)&R2C7&"|"&R2C7&HLOOKUP(R2C[-6],R2C[-6]:R150C[-6],RC7+4,FALSE)&R2C7 -> "暂无后续"|"暂无后续"|"暂无后续" | J82: =R2C7&HLOOKUP(R2C[-6],R2C[-6]:R150C[-6],RC7+2,FALSE)&R2C7&"|"&R2C7&HLOOKUP(R2C[-6],R2C[-6]:R150C[-6],RC7+3,FALSE)&R2C7&"|"&R2C7&HLOOKUP(R2C[-6],R2C[-6]:R150C[-6],RC7+4,FALSE)&R2C7 -> "敬请期待"|"敬请期待"|"敬请期待" | K82: =HLOOKUP(R2C[-6],R2C[-6]:R150C[-6],RC7+2,FALSE)&"|"&HLOOKUP(R2C[-6],R2C[-6]:R150C[-6],RC7+3,FALSE)&"|"&HLOOKUP(R2C[-6],R2C[-6]:R150C[-6],RC7+4,FALSE) -> 150|150|150 | L82: =HLOOKUP(R2C[-6],R2C[-6]:R150C[-6],RC7+2,FALSE)&"|"&HLOOKUP(R2C[-6],R2C[-6]:R150C[-6],RC7+3,FALSE)&"|"&HLOOKUP(R2C[-6],R2C[-6]:R150C[-6],RC7+4,FALSE) -> 49|49|49
G83: =VLOOKUP(RC[1]-0.1,C1:C2,2,TRUE)+1 -> 53 | H83: 81 | I83: =R2C7&HLOOKUP(R2C[-6],R2C[-6]:R150C[-6],RC7+2,FALSE)&R2C7&"|"&R2C7&HLOOKUP(R2C[-6],R2C[-6]:R150C[-6],RC7+3,FALSE)&R2C7&"|"&R2C7&HLOOKUP(R2C[-6],R2C[-6]:R150C[-6],RC7+4,FALSE)&R2C7 -> "暂无后续"|"暂无后续"|"暂无后续" | J83: =R2C7&HLOOKUP(R2C[-6],R2C[-6]:R150C[-6],RC7+2,FALSE)&R2C7&"|"&R2C7&HLOOKUP(R2C[-6],R2C[-6]:R150C[-6],RC7+3,FALSE)&R2C7&"|"&R2C7&HLOOKUP(R2C[-6],R2C[-6]:R150C[-6],RC7+4,FALSE)&R2C7 -> "敬请期待"|"敬请期待"|"敬请期待" | K83: =HLOOKUP(R2C[-6],R2C[-6]:R150C[-6],RC7+2,FALSE)&"|"&HLOOKUP(R2C[-6],R2C[-6]:R150C[-6],RC7+3,FALSE)&"|"&HLOOKUP(R2C[-6],R2C[-6]:R150C[-6],RC7+4,FALSE) -> 150|150|150 | L83: =HLOOKUP(R2C[-6],R2C[-6]:R150C[-6],RC7+2,FALSE)&"|"&HLOOKUP(R2C[-6],R2C[-6]:R150C[-6],RC7+3,FALSE)&"|"&HLOOKUP(R2C[-6],R2C[-6]:R150C[-6],RC7+4,FALSE) -> 49|49|49
G84: =VLOOKUP(RC[1]-0.1,C1:C2,2,TRUE)+1 -> 53 | H84: 82 | I84: =R2C7&HLOOKUP(R2C[-6],R2C[-6]:R150C[-6],RC7+2,FALSE)&R2C7&"|"&R2C7&HLOOKUP(R2C[-6],R2C[-6]:R150C[-6],RC7+3,FALSE)&R2C7&"|"&R2C7&HLOOKUP(R2C[-6],R2C[-6]:R150C[-6],RC7+4,FALSE)&R2C7 -> "暂无后续"|"暂无后续"|"暂无后续" | J84: =R2C7&HLOOKUP(R2C[-6],R2C[-6]:R150C[-6],RC7+2,FALSE)&R2C7&"|"&R2C7&HLOOKUP(R2C[-6],R2C[-6]:R150C[-6],RC7+3,FALSE)&R2C7&"|"&R2C7&HLOOKUP(R2C[-6],R2C[-6]:R150C[-6],RC7+4,FALSE)&R2C7 -> "敬请期待"|"敬请期待"|"敬请期待" | K84: =HLOOKUP(R2C[-6],R2C[-6]:R150C[-6],RC7+2,FALSE)&"|"&HLOOKUP(R2C[-6],R2C[-6]:R150C[-6],RC7+3,FALSE)&"|"&HLOOKUP(R2C[-6],R2C[-6]:R150C[-6],RC7+4,FALSE) -> 150|150|150 | L84: =HLOOKUP(R2C[-6],R2C[-6]:R150C[-6],RC7+2,FALSE)&"|"&HLOOKUP(R2C[-6],R2C[-6]:R150C[-6],RC7+3,FALSE)&"|"&HLOOKUP(R2C[-6],R2C[-6]:R150C[-6],RC7+4,FALSE) -> 49|49|49
G85: =VLOOKUP(RC[1]-0.1,C1:C2,2,TRUE)+1 -> 53 | H85: 83 | I85: =R2C7&HLOOKUP(R2C[-6],R2C[-6]:R150C[-6],RC7+2,FALSE)&R2C7&"|"&R2C7&HLOOKUP(R2C[-6],R2C[-6]:R150C[-6],RC7+3,FALSE)&R2C7&"|"&R2C7&HLOOKUP(R2C[-6],R2C[-6]:R150C[-6],RC7+4,FALSE)&R2C7 -> "暂无后续"|"暂无后续"|"暂无后续" | J85: =R2C7&HLOOKUP(R2C[-6],R2C[-6]:R150C[-6],RC7+2,FALSE)&R2C7&"|"&R2C7&HLOOKUP(R2C[-6],R2C[-6]:R150C[-6],RC7+3,FALSE)&R2C7&"|"&R2C7&HLOOKUP(R2C[-6],R2C[-6]:R150C[-6],RC7+4,FALSE)&R2C7 -> "敬请期待"|"敬请期待"|"敬请期待" | K85: =HLOOKUP(R2C[-6],R2C[-6]:R150C[-6],RC7+2,FALSE)&"|"&HLOOKUP(R2C[-6],R2C[-6]:R150C[-6],RC7+3,FALSE)&"|"&HLOOKUP(R2C[-6],R2C[-6]:R150C[-6],RC7+4,FALSE) -> 150|150|150 | L85: =HLOOKUP(R2C[-6],R2C[-6]:R150C[-6],RC7+2,FALSE)&"|"&HLOOKUP(R2C[-6],R2C[-6]:R150C[-6],RC7+3,FALSE)&"|"&HLOOKUP(R2C[-6],R2C[-6]:R150C[-6],RC7+4,FALSE) -> 49|49|49
G86: =VLOOKUP(RC[1]-0.1,C1:C2,2,TRUE)+1 -> 53 | H86: 84 | I86: =R2C7&HLOOKUP(R2C[-6],R2C[-6]:R150C[-6],RC7+2,FALSE)&R2C7&"|"&R2C7&HLOOKUP(R2C[-6],R2C[-6]:R150C[-6],RC7+3,FALSE)&R2C7&"|"&R2C7&HLOOKUP(R2C[-6],R2C[-6]:R150C[-6],RC7+4,FALSE)&R2C7 -> "暂无后续"|"暂无后续"|"暂无后续" | J86: =R2C7&HLOOKUP(R2C[-6],R2C[-6]:R150C[-6],RC7+2,FALSE)&R2C7&"|"&R2C7&HLOOKUP(R2C[-6],R2C[-6]:R150C[-6],RC7+3,FALSE)&R2C7&"|"&R2C7&HLOOKUP(R2C[-6],R2C[-6]:R150C[-6],RC7+4,FALSE)&R2C7 -> "敬请期待"|"敬请期待"|"敬请期待" | K86: =HLOOKUP(R2C[-6],R2C[-6]:R150C[-6],RC7+2,FALSE)&"|"&HLOOKUP(R2C[-6],R2C[-6]:R150C[-6],RC7+3,FALSE)&"|"&HLOOKUP(R2C[-6],R2C[-6]:R150C[-6],RC7+4,FALSE) -> 150|150|150 | L86: =HLOOKUP(R2C[-6],R2C[-6]:R150C[-6],RC7+2,FALSE)&"|"&HLOOKUP(R2C[-6],R2C[-6]:R150C[-6],RC7+3,FALSE)&"|"&HLOOKUP(R2C[-6],R2C[-6]:R150C[-6],RC7+4,FALSE) -> 49|49|49
G87: =VLOOKUP(RC[1]-0.1,C1:C2,2,TRUE)+1 -> 53 | H87: 85 | I87: =R2C7&HLOOKUP(R2C[-6],R2C[-6]:R150C[-6],RC7+2,FALSE)&R2C7&"|"&R2C7&HLOOKUP(R2C[-6],R2C[-6]:R150C[-6],RC7+3,FALSE)&R2C7&"|"&R2C7&HLOOKUP(R2C[-6],R2C[-6]:R150C[-6],RC7+4,FALSE)&R2C7 -> "暂无后续"|"暂无后续"|"暂无后续" | J87: =R2C7&HLOOKUP(R2C[-6],R2C[-6]:R150C[-6],RC7+2,FALSE)&R2C7&"|"&R2C7&HLOOKUP(R2C[-6],R2C[-6]:R150C[-6],RC7+3,FALSE)&R2C7&"|"&R2C7&HLOOKUP(R2C[-6],R2C[-6]:R150C[-6],RC7+4,FALSE)&R2C7 -> "敬请期待"|"敬请期待"|"敬请期待" | K87: =HLOOKUP(R2C[-6],R2C[-6]:R150C[-6],RC7+2,FALSE)&"|"&HLOOKUP(R2C[-6],R2C[-6]:R150C[-6],RC7+3,FALSE)&"|"&HLOOKUP(R2C[-6],R2C[-6]:R150C[-6],RC7+4,FALSE) -> 150|150|150 | L87: =HLOOKUP(R2C[-6],R2C[-6]:R150C[-6],RC7+2,FALSE)&"|"&HLOOKUP(R2C[-6],R2C[-6]:R150C[-6],RC7+3,FALSE)&"|"&HLOOKUP(R2C[-6],R2C[-6]:R150C[-6],RC7+4,FALSE) -> 49|49|49
G88: =VLOOKUP(RC[1]-0.1,C1:C2,2,TRUE)+1 -> 53 | H88: 86 | I88: =R2C7&HLOOKUP(R2C[-6],R2C[-6]:R150C[-6],RC7+2,FALSE)&R2C7&"|"&R2C7&HLOOKUP(R2C[-6],R2C[-6]:R150C[-6],RC7+3,FALSE)&R2C7&"|"&R2C7&HLOOKUP(R2C[-6],R2C[-6]:R150C[-6],RC7+4,FALSE)&R2C7 -> "暂无后续"|"暂无后续"|"暂无后续" | J88: =R2C7&HLOOKUP(R2C[-6],R2C[-6]:R150C[-6],RC7+2,FALSE)&R2C7&"|"&R2C7&HLOOKUP(R2C[-6],R2C[-6]:R150C[-6],RC7+3,FALSE)&R2C7&"|"&R2C7&HLOOKUP(R2C[-6],R2C[-6]:R150C[-6],RC7+4,FALSE)&R2C7 -> "敬请期待"|"敬请期待"|"敬请期待" | K88: =HLOOKUP(R2C[-6],R2C[-6]:R150C[-6],RC7+2,FALSE)&"|"&HLOOKUP(R2C[-6],R2C[-6]:R150C[-6],RC7+3,FALSE)&"|"&HLOOKUP(R2C[-6],R2C[-6]:R150C[-6],RC7+4,FALSE) -> 150|150|150 | L88: =HLOOKUP(R2C[-6],R2C[-6]:R150C[-6],RC7+2,FALSE)&"|"&HLOOKUP(R2C[-6],R2C[-6]:R150C[-6],RC7+3,FALSE)&"|"&HLOOKUP(R2C[-6],R2C[-6]:R150C[-6],RC7+4,FALSE) -> 49|49|49
G89: =VLOOKUP(RC[1]-0.1,C1:C2,2,TRUE)+1 -> 53 | H89: 87 | I89: =R2C7&HLOOKUP(R2C[-6],R2C[-6]:R150C[-6],RC7+2,FALSE)&R2C7&"|"&R2C7&HLOOKUP(R2C[-6],R2C[-6]:R150C[-6],RC7+3,FALSE)&R2C7&"|"&R2C7&HLOOKUP(R2C[-6],R2C[-6]:R150C[-6],RC7+4,FALSE)&R2C7 -> "暂无后续"|"暂无后续"|"暂无后续" | J89: =R2C7&HLOOKUP(R2C[-6],R2C[-6]:R150C[-6],RC7+2,FALSE)&R2C7&"|"&R2C7&HLOOKUP(R2C[-6],R2C[-6]:R150C[-6],RC7+3,FALSE)&R2C7&"|"&R2C7&HLOOKUP(R2C[-6],R2C[-6]:R150C[-6],RC7+4,FALSE)&R2C7 -> "敬请期待"|"敬请期待"|"敬请期待" | K89: =HLOOKUP(R2C[-6],R2C[-6]:R150C[-6],RC7+2,FALSE)&"|"&HLOOKUP(R2C[-6],R2C[-6]:R150C[-6],RC7+3,FALSE)&"|"&HLOOKUP(R2C[-6],R2C[-6]:R150C[-6],RC7+4,FALSE) -> 150|150|150 | L89: =HLOOKUP(R2C[-6],R2C[-6]:R150C[-6],RC7+2,FALSE)&"|"&HLOOKUP(R2C[-6],R2C[-6]:R150C[-6],RC7+3,FALSE)&"|"&HLOOKUP(R2C[-6],R2C[-6]:R150C[-6],RC7+4,FALSE) -> 49|49|49
G90: =VLOOKUP(RC[1]-0.1,C1:C2,2,TRUE)+1 -> 53 | H90: 88 | I90: =R2C7&HLOOKUP(R2C[-6],R2C[-6]:R150C[-6],RC7+2,FALSE)&R2C7&"|"&R2C7&HLOOKUP(R2C[-6],R2C[-6]:R150C[-6],RC7+3,FALSE)&R2C7&"|"&R2C7&HLOOKUP(R2C[-6],R2C[-6]:R150C[-6],RC7+4,FALSE)&R2C7 -> "暂无后续"|"暂无后续"|"暂无后续" | J90: =R2C7&HLOOKUP(R2C[-6],R2C[-6]:R150C[-6],RC7+2,FALSE)&R2C7&"|"&R2C7&HLOOKUP(R2C[-6],R2C[-6]:R150C[-6],RC7+3,FALSE)&R2C7&"|"&R2C7&HLOOKUP(R2C[-6],R2C[-6]:R150C[-6],RC7+4,FALSE)&R2C7 -> "敬请期待"|"敬请期待"|"敬请期待" | K90: =HLOOKUP(R2C[-6],R2C[-6]:R150C[-6],RC7+2,FALSE)&"|"&HLOOKUP(R2C[-6],R2C[-6]:R150C[-6],RC7+3,FALSE)&"|"&HLOOKUP(R2C[-6],R2C[-6]:R150C[-6],RC7+4,FALSE) -> 150|150|150 | L90: =HLOOKUP(R2C[-6],R2C[-6]:R150C[-6],RC7+2,FALSE)&"|"&HLOOKUP(R2C[-6],R2C[-6]:R150C[-6],RC7+3,FALSE)&"|"&HLOOKUP(R2C[-6],R2C[-6]:R150C[-6],RC7+4,FALSE) -> 49|49|49
G91: =VLOOKUP(RC[1]-0.1,C1:C2,2,TRUE)+1 -> 53 | H91: 89 | I91: =R2C7&HLOOKUP(R2C[-6],R2C[-6]:R150C[-6],RC7+2,FALSE)&R2C7&"|"&R2C7&HLOOKUP(R2C[-6],R2C[-6]:R150C[-6],RC7+3,FALSE)&R2C7&"|"&R2C7&HLOOKUP(R2C[-6],R2C[-6]:R150C[-6],RC7+4,FALSE)&R2C7 -> "暂无后续"|"暂无后续"|"暂无后续" | J91: =R2C7&HLOOKUP(R2C[-6],R2C[-6]:R150C[-6],RC7+2,FALSE)&R2C7&"|"&R2C7&HLOOKUP(R2C[-6],R2C[-6]:R150C[-6],RC7+3,FALSE)&R2C7&"|"&R2C7&HLOOKUP(R2C[-6],R2C[-6]:R150C[-6],RC7+4,FALSE)&R2C7 -> "敬请期待"|"敬请期待"|"敬请期待" | K91: =HLOOKUP(R2C[-6],R2C[-6]:R150C[-6],RC7+2,FALSE)&"|"&HLOOKUP(R2C[-6],R2C[-6]:R150C[-6],RC7+3,FALSE)&"|"&HLOOKUP(R2C[-6],R2C[-6]:R150C[-6],RC7+4,FALSE) -> 150|150|150 | L91: =HLOOKUP(R2C[-6],R2C[-6]:R150C[-6],RC7+2,FALSE)&"|"&HLOOKUP(R2C[-6],R2C[-6]:R150C[-6],RC7+3,FALSE)&"|"&HLOOKUP(R2C[-6],R2C[-6]:R150C[-6],RC7+4,FALSE) -> 49|49|49
G92: =VLOOKUP(RC[1]-0.1,C1:C2,2,TRUE)+1 -> 53 | H92: 90 | I92: =R2C7&HLOOKUP(R2C[-6],R2C[-6]:R150C[-6],RC7+2,FALSE)&R2C7&"|"&R2C7&HLOOKUP(R2C[-6],R2C[-6]:R150C[-6],RC7+3,FALSE)&R2C7&"|"&R2C7&HLOOKUP(R2C[-6],R2C[-6]:R150C[-6],RC7+4,FALSE)&R2C7 -> "暂无后续"|"暂无后续"|"暂无后续" | J92: =R2C7&HLOOKUP(R2C[-6],R2C[-6]:R150C[-6],RC7+2,FALSE)&R2C7&"|"&R2C7&HLOOKUP(R2C[-6],R2C[-6]:R150C[-6],RC7+3,FALSE)&R2C7&"|"&R2C7&HLOOKUP(R2C[-6],R2C[-6]:R150C[-6],RC7+4,FALSE)&R2C7 -> "敬请期待"|"敬请期待"|"敬请期待" | K92: =HLOOKUP(R2C[-6],R2C[-6]:R150C[-6],RC7+2,FALSE)&"|"&HLOOKUP(R2C[-6],R2C[-6]:R150C[-6],RC7+3,FALSE)&"|"&HLOOKUP(R2C[-6],R2C[-6]:R150C[-6],RC7+4,FALSE) -> 150|150|150 | L92: =HLOOKUP(R2C[-6],R2C[-6]:R150C[-6],RC7+2,FALSE)&"|"&HLOOKUP(R2C[-6],R2C[-6]:R150C[-6],RC7+3,FALSE)&"|"&HLOOKUP(R2C[-6],R2C[-6]:R150C[-6],RC7+4,FALSE) -> 49|49|49
G93: =VLOOKUP(RC[1]-0.1,C1:C2,2,TRUE)+1 -> 53 | H93: 91 | I93: =R2C7&HLOOKUP(R2C[-6],R2C[-6]:R150C[-6],RC7+2,FALSE)&R2C7&"|"&R2C7&HLOOKUP(R2C[-6],R2C[-6]:R150C[-6],RC7+3,FALSE)&R2C7&"|"&R2C7&HLOOKUP(R2C[-6],R2C[-6]:R150C[-6],RC7+4,FALSE)&R2C7 -> "暂无后续"|"暂无后续"|"暂无后续" | J93: =R2C7&HLOOKUP(R2C[-6],R2C[-6]:R150C[-6],RC7+2,FALSE)&R2C7&"|"&R2C7&HLOOKUP(R2C[-6],R2C[-6]:R150C[-6],RC7+3,FALSE)&R2C7&"|"&R2C7&HLOOKUP(R2C[-6],R2C[-6]:R150C[-6],RC7+4,FALSE)&R2C7 -> "敬请期待"|"敬请期待"|"敬请期待" | K93: =HLOOKUP(R2C[-6],R2C[-6]:R150C[-6],RC7+2,FALSE)&"|"&HLOOKUP(R2C[-6],R2C[-6]:R150C[-6],RC7+3,FALSE)&"|"&HLOOKUP(R2C[-6],R2C[-6]:R150C[-6],RC7+4,FALSE) -> 150|150|150 | L93: =HLOOKUP(R2C[-6],R2C[-6]:R150C[-6],RC7+2,FALSE)&"|"&HLOOKUP(R2C[-6],R2C[-6]:R150C[-6],RC7+3,FALSE)&"|"&HLOOKUP(R2C[-6],R2C[-6]:R150C[-6],RC7+4,FALSE) -> 49|49|49
G94: =VLOOKUP(RC[1]-0.1,C1:C2,2,TRUE)+1 -> 53 | H94: 92 | I94: =R2C7&HLOOKUP(R2C[-6],R2C[-6]:R150C[-6],RC7+2,FALSE)&R2C7&"|"&R2C7&HLOOKUP(R2C[-6],R2C[-6]:R150C[-6],RC7+3,FALSE)&R2C7&"|"&R2C7&HLOOKUP(R2C[-6],R2C[-6]:R150C[-6],RC7+4,FALSE)&R2C7 -> "暂无后续"|"暂无后续"|"暂无后续" | J94: =R2C7&HLOOKUP(R2C[-6],R2C[-6]:R150C[-6],RC7+2,FALSE)&R2C7&"|"&R2C7&HLOOKUP(R2C[-6],R2C[-6]:R150C[-6],RC7+3,FALSE)&R2C7&"|"&R2C7&HLOOKUP(R2C[-6],R2C[-6]:R150C[-6],RC7+4,FALSE)&R2C7 -> "敬请期待"|"敬请期待"|"敬请期待" | K94: =HLOOKUP(R2C[-6],R2C[-6]:R150C[-6],RC7+2,FALSE)&"|"&HLOOKUP(R2C[-6],R2C[-6]:R150C[-6],RC7+3,FALSE)&"|"&HLOOKUP(R2C[-6],R2C[-6]:R150C[-6],RC7+4,FALSE) -> 150|150|150 | L94: =HLOOKUP(R2C[-6],R2C[-6]:R150C[-6],RC7+2,FALSE)&"|"&HLOOKUP(R2C[-6],R2C[-6]:R150C[-6],RC7+3,FALSE)&"|"&HLOOKUP(R2C[-6],R2C[-6]:R150C[-6],RC7+4,FALSE) -> 49|49|49
G95: =VLOOKUP(RC[1]-0.1,C1:C2,2,TRUE)+1 -> 53 | H95: 93 | I95: =R2C7&HLOOKUP(R2C[-6],R2C[-6]:R150C[-6],RC7+2,FALSE)&R2C7&"|"&R2C7&HLOOKUP(R2C[-6],R2C[-6]:R150C[-6],RC7+3,FALSE)&R2C7&"|"&R2C7&HLOOKUP(R2C[-6],R2C[-6]:R150C[-6],RC7+4,FALSE)&R2C7 -> "暂无后续"|"暂无后续"|"暂无后续" | J95: =R2C7&HLOOKUP(R2C[-6],R2C[-6]:R150C[-6],RC7+2,FALSE)&R2C7&"|"&R2C7&HLOOKUP(R2C[-6],R2C[-6]:R150C[-6],RC7+3,FALSE)&R2C7&"|"&R2C7&HLOOKUP(R2C[-6],R2C[-6]:R150C[-6],RC7+4,FALSE)&R2C7 -> "敬请期待"|"敬请期待"|"敬请期待" | K95: =HLOOKUP(R2C[-6],R2C[-6]:R150C[-6],RC7+2,FALSE)&"|"&HLOOKUP(R2C[-6],R2C[-6]:R150C[-6],RC7+3,FALSE)&"|"&HLOOKUP(R2C[-6],R2C[-6]:R150C[-6],RC7+4,FALSE) -> 150|150|150 | L95: =HLOOKUP(R2C[-6],R2C[-6]:R150C[-6],RC7+2,FALSE)&"|"&HLOOKUP(R2C[-6],R2C[-6]:R150C[-6],RC7+3,FALSE)&"|"&HLOOKUP(R2C[-6],R2C[-6]:R150C[-6],RC7+4,FALSE) -> 49|49|49
G96: =VLOOKUP(RC[1]-0.1,C1:C2,2,TRUE)+1 -> 53 | H96: 94 | I96: =R2C7&HLOOKUP(R2C[-6],R2C[-6]:R150C[-6],RC7+2,FALSE)&R2C7&"|"&R2C7&HLOOKUP(R2C[-6],R2C[-6]:R150C[-6],RC7+3,FALSE)&R2C7&"|"&R2C7&HLOOKUP(R2C[-6],R2C[-6]:R150C[-6],RC7+4,FALSE)&R2C7 -> "暂无后续"|"暂无后续"|"暂无后续" | J96: =R2C7&HLOOKUP(R2C[-6],R2C[-6]:R150C[-6],RC7+2,FALSE)&R2C7&"|"&R2C7&HLOOKUP(R2C[-6],R2C[-6]:R150C[-6],RC7+3,FALSE)&R2C7&"|"&R2C7&HLOOKUP(R2C[-6],R2C[-6]:R150C[-6],RC7+4,FALSE)&R2C7 -> "敬请期待"|"敬请期待"|"敬请期待" | K96: =HLOOKUP(R2C[-6],R2C[-6]:R150C[-6],RC7+2,FALSE)&"|"&HLOOKUP(R2C[-6],R2C[-6]:R150C[-6],RC7+3,FALSE)&"|"&HLOOKUP(R2C[-6],R2C[-6]:R150C[-6],RC7+4,FALSE) -> 150|150|150 | L96: =HLOOKUP(R2C[-6],R2C[-6]:R150C[-6],RC7+2,FALSE)&"|"&HLOOKUP(R2C[-6],R2C[-6]:R150C[-6],RC7+3,FALSE)&"|"&HLOOKUP(R2C[-6],R2C[-6]:R150C[-6],RC7+4,FALSE) -> 49|49|49
G97: =VLOOKUP(RC[1]-0.1,C1:C2,2,TRUE)+1 -> 53 | H97: 95 | I97: =R2C7&HLOOKUP(R2C[-6],R2C[-6]:R150C[-6],RC7+2,FALSE)&R2C7&"|"&R2C7&HLOOKUP(R2C[-6],R2C[-6]:R150C[-6],RC7+3,FALSE)&R2C7&"|"&R2C7&HLOOKUP(R2C[-6],R2C[-6]:R150C[-6],RC7+4,FALSE)&R2C7 -> "暂无后续"|"暂无后续"|"暂无后续" | J97: =R2C7&HLOOKUP(R2C[-6],R2C[-6]:R150C[-6],RC7+2,FALSE)&R2C7&"|"&R2C7&HLOOKUP(R2C[-6],R2C[-6]:R150C[-6],RC7+3,FALSE)&R2C7&"|"&R2C7&HLOOKUP(R2C[-6],R2C[-6]:R150C[-6],RC7+4,FALSE)&R2C7 -> "敬请期待"|"敬请期待"|"敬请期待" | K97: =HLOOKUP(R2C[-6],R2C[-6]:R150C[-6],RC7+2,FALSE)&"|"&HLOOKUP(R2C[-6],R2C[-6]:R150C[-6],RC7+3,FALSE)&"|"&HLOOKUP(R2C[-6],R2C[-6]:R150C[-6],RC7+4,FALSE) -> 150|150|150 | L97: =HLOOKUP(R2C[-6],R2C[-6]:R150C[-6],RC7+2,FALSE)&"|"&HLOOKUP(R2C[-6],R2C[-6]:R150C[-6],RC7+3,FALSE)&"|"&HLOOKUP(R2C[-6],R2C[-6]:R150C[-6],RC7+4,FALSE) -> 49|49|49
G98: =VLOOKUP(RC[1]-0.1,C1:C2,2,TRUE)+1 -> 53 | H98: 96 | I98: =R2C7&HLOOKUP(R2C[-6],R2C[-6]:R150C[-6],RC7+2,FALSE)&R2C7&"|"&R2C7&HLOOKUP(R2C[-6],R2C[-6]:R150C[-6],RC7+3,FALSE)&R2C7&"|"&R2C7&HLOOKUP(R2C[-6],R2C[-6]:R150C[-6],RC7+4,FALSE)&R2C7 -> "暂无后续"|"暂无后续"|"暂无后续" | J98: =R2C7&HLOOKUP(R2C[-6],R2C[-6]:R150C[-6],RC7+2,FALSE)&R2C7&"|"&R2C7&HLOOKUP(R2C[-6],R2C[-6]:R150C[-6],RC7+3,FALSE)&R2C7&"|"&R2C7&HLOOKUP(R2C[-6],R2C[-6]:R150C[-6],RC7+4,FALSE)&R2C7 -> "敬请期待"|"敬请期待"|"敬请期待" | K98: =HLOOKUP(R2C[-6],R2C[-6]:R150C[-6],RC7+2,FALSE)&"|"&HLOOKUP(R2C[-6],R2C[-6]:R150C[-6],RC7+3,FALSE)&"|"&HLOOKUP(R2C[-6],R2C[-6]:R150C[-6],RC7+4,FALSE) -> 150|150|150 | L98: =HLOOKUP(R2C[-6],R2C[-6]:R150C[-6],RC7+2,FALSE)&"|"&HLOOKUP(R2C[-6],R2C[-6]:R150C[-6],RC7+3,FALSE)&"|"&HLOOKUP(R2C[-6],R2C[-6]:R150C[-6],RC7+4,FALSE) -> 49|49|49
G99: =VLOOKUP(RC[1]-0.1,C1:C2,2,TRUE)+1 -> 53 | H99: 97 | I99: =R2C7&HLOOKUP(R2C[-6],R2C[-6]:R150C[-6],RC7+2,FALSE)&R2C7&"|"&R2C7&HLOOKUP(R2C[-6],R2C[-6]:R150C[-6],RC7+3,FALSE)&R2C7&"|"&R2C7&HLOOKUP(R2C[-6],R2C[-6]:R150C[-6],RC7+4,FALSE)&R2C7 -> "暂无后续"|"暂无后续"|"暂无后续" | J99: =R2C7&HLOOKUP(R2C[-6],R2C[-6]:R150C[-6],RC7+2,FALSE)&R2C7&"|"&R2C7&HLOOKUP(R2C[-6],R2C[-6]:R150C[-6],RC7+3,FALSE)&R2C7&"|"&R2C7&HLOOKUP(R2C[-6],R2C[-6]:R150C[-6],RC7+4,FALSE)&R2C7 -> "敬请期待"|"敬请期待"|"敬请期待" | K99: =HLOOKUP(R2C[-6],R2C[-6]:R150C[-6],RC7+2,FALSE)&"|"&HLOOKUP(R2C[-6],R2C[-6]:R150C[-6],RC7+3,FALSE)&"|"&HLOOKUP(R2C[-6],R2C[-6]:R150C[-6],RC7+4,FALSE) -> 150|150|150 | L99: =HLOOKUP(R2C[-6],R2C[-6]:R150C[-6],RC7+2,FALSE)&"|"&HLOOKUP(R2C[-6],R2C[-6]:R150C[-6],RC7+3,FALSE)&"|"&HLOOKUP(R2C[-6],R2C[-6]:R150C[-6],RC7+4,FALSE) -> 49|49|49
G100: =VLOOKUP(RC[1]-0.1,C1:C2,2,TRUE)+1 -> 53 | H100: 98 | I100: =R2C7&HLOOKUP(R2C[-6],R2C[-6]:R150C[-6],RC7+2,FALSE)&R2C7&"|"&R2C7&HLOOKUP(R2C[-6],R2C[-6]:R150C[-6],RC7+3,FALSE)&R2C7&"|"&R2C7&HLOOKUP(R2C[-6],R2C[-6]:R150C[-6],RC7+4,FALSE)&R2C7 -> "暂无后续"|"暂无后续"|"暂无后续" | J100: =R2C7&HLOOKUP(R2C[-6],R2C[-6]:R150C[-6],RC7+2,FALSE)&R2C7&"|"&R2C7&HLOOKUP(R2C[-6],R2C[-6]:R150C[-6],RC7+3,FALSE)&R2C7&"|"&R2C7&HLOOKUP(R2C[-6],R2C[-6]:R150C[-6],RC7+4,FALSE)&R2C7 -> "敬请期待"|"敬请期待"|"敬请期待" | K100: =HLOOKUP(R2C[-6],R2C[-6]:R150C[-6],RC7+2,FALSE)&"|"&HLOOKUP(R2C[-6],R2C[-6]:R150C[-6],RC7+3,FALSE)&"|"&HLOOKUP(R2C[-6],R2C[-6]:R150C[-6],RC7+4,FALSE) -> 150|150|150 | L100: =HLOOKUP(R2C[-6],R2C[-6]:R150C[-6],RC7+2,FALSE)&"|"&HLOOKUP(R2C[-6],R2C[-6]:R150C[-6],RC7+3,FALSE)&"|"&HLOOKUP(R2C[-6],R2C[-6]:R150C[-6],RC7+4,FALSE) -> 49|49|49
G101: =VLOOKUP(RC[1]-0.1,C1:C2,2,TRUE)+1 -> 53 | H101: 99 | I101: =R2C7&HLOOKUP(R2C[-6],R2C[-6]:R150C[-6],RC7+2,FALSE)&R2C7&"|"&R2C7&HLOOKUP(R2C[-6],R2C[-6]:R150C[-6],RC7+3,FALSE)&R2C7&"|"&R2C7&HLOOKUP(R2C[-6],R2C[-6]:R150C[-6],RC7+4,FALSE)&R2C7 -> "暂无后续"|"暂无后续"|"暂无后续" | J101: =R2C7&HLOOKUP(R2C[-6],R2C[-6]:R150C[-6],RC7+2,FALSE)&R2C7&"|"&R2C7&HLOOKUP(R2C[-6],R2C[-6]:R150C[-6],RC7+3,FALSE)&R2C7&"|"&R2C7&HLOOKUP(R2C[-6],R2C[-6]:R150C[-6],RC7+4,FALSE)&R2C7 -> "敬请期待"|"敬请期待"|"敬请期待" | K101: =HLOOKUP(R2C[-6],R2C[-6]:R150C[-6],RC7+2,FALSE)&"|"&HLOOKUP(R2C[-6],R2C[-6]:R150C[-6],RC7+3,FALSE)&"|"&HLOOKUP(R2C[-6],R2C[-6]:R150C[-6],RC7+4,FALSE) -> 150|150|150 | L101: =HLOOKUP(R2C[-6],R2C[-6]:R150C[-6],RC7+2,FALSE)&"|"&HLOOKUP(R2C[-6],R2C[-6]:R150C[-6],RC7+3,FALSE)&"|"&HLOOKUP(R2C[-6],R2C[-6]:R150C[-6],RC7+4,FALSE) -> 49|49|49
G102: =VLOOKUP(RC[1]-0.1,C1:C2,2,TRUE)+1 -> 53 | H102: 100 | I102: =R2C7&HLOOKUP(R2C[-6],R2C[-6]:R150C[-6],RC7+2,FALSE)&R2C7&"|"&R2C7&HLOOKUP(R2C[-6],R2C[-6]:R150C[-6],RC7+3,FALSE)&R2C7&"|"&R2C7&HLOOKUP(R2C[-6],R2C[-6]:R150C[-6],RC7+4,FALSE)&R2C7 -> "暂无后续"|"暂无后续"|"暂无后续" | J102: =R2C7&HLOOKUP(R2C[-6],R2C[-6]:R150C[-6],RC7+2,FALSE)&R2C7&"|"&R2C7&HLOOKUP(R2C[-6],R2C[-6]:R150C[-6],RC7+3,FALSE)&R2C7&"|"&R2C7&HLOOKUP(R2C[-6],R2C[-6]:R150C[-6],RC7+4,FALSE)&R2C7 -> "敬请期待"|"敬请期待"|"敬请期待" | K102: =HLOOKUP(R2C[-6],R2C[-6]:R150C[-6],RC7+2,FALSE)&"|"&HLOOKUP(R2C[-6],R2C[-6]:R150C[-6],RC7+3,FALSE)&"|"&HLOOKUP(R2C[-6],R2C[-6]:R150C[-6],RC7+4,FALSE) -> 150|150|150 | L102: =HLOOKUP(R2C[-6],R2C[-6]:R150C[-6],RC7+2,FALSE)&"|"&HLOOKUP(R2C[-6],R2C[-6]:R150C[-6],RC7+3,FALSE)&"|"&HLOOKUP(R2C[-6],R2C[-6]:R150C[-6],RC7+4,FALSE) -> 49|49|49
G103: =VLOOKUP(RC[1]-0.1,C1:C2,2,TRUE)+1 -> 53 | H103: 101 | I103: =R2C7&HLOOKUP(R2C[-6],R2C[-6]:R150C[-6],RC7+2,FALSE)&R2C7&"|"&R2C7&HLOOKUP(R2C[-6],R2C[-6]:R150C[-6],RC7+3,FALSE)&R2C7&"|"&R2C7&HLOOKUP(R2C[-6],R2C[-6]:R150C[-6],RC7+4,FALSE)&R2C7 -> "暂无后续"|"暂无后续"|"暂无后续" | J103: =R2C7&HLOOKUP(R2C[-6],R2C[-6]:R150C[-6],RC7+2,FALSE)&R2C7&"|"&R2C7&HLOOKUP(R2C[-6],R2C[-6]:R150C[-6],RC7+3,FALSE)&R2C7&"|"&R2C7&HLOOKUP(R2C[-6],R2C[-6]:R150C[-6],RC7+4,FALSE)&R2C7 -> "敬请期待"|"敬请期待"|"敬请期待" | K103: =HLOOKUP(R2C[-6],R2C[-6]:R150C[-6],RC7+2,FALSE)&"|"&HLOOKUP(R2C[-6],R2C[-6]:R150C[-6],RC7+3,FALSE)&"|"&HLOOKUP(R2C[-6],R2C[-6]:R150C[-6],RC7+4,FALSE) -> 150|150|150 | L103: =HLOOKUP(R2C[-6],R2C[-6]:R150C[-6],RC7+2,FALSE)&"|"&HLOOKUP(R2C[-6],R2C[-6]:R150C[-6],RC7+3,FALSE)&"|"&HLOOKUP(R2C[-6],R2C[-6]:R150C[-6],RC7+4,FALSE) -> 49|49|49
G104: =VLOOKUP(RC[1]-0.1,C1:C2,2,TRUE)+1 -> 53 | H104: 102 | I104: =R2C7&HLOOKUP(R2C[-6],R2C[-6]:R150C[-6],RC7+2,FALSE)&R2C7&"|"&R2C7&HLOOKUP(R2C[-6],R2C[-6]:R150C[-6],RC7+3,FALSE)&R2C7&"|"&R2C7&HLOOKUP(R2C[-6],R2C[-6]:R150C[-6],RC7+4,FALSE)&R2C7 -> "暂无后续"|"暂无后续"|"暂无后续" | J104: =R2C7&HLOOKUP(R2C[-6],R2C[-6]:R150C[-6],RC7+2,FALSE)&R2C7&"|"&R2C7&HLOOKUP(R2C[-6],R2C[-6]:R150C[-6],RC7+3,FALSE)&R2C7&"|"&R2C7&HLOOKUP(R2C[-6],R2C[-6]:R150C[-6],RC7+4,FALSE)&R2C7 -> "敬请期待"|"敬请期待"|"敬请期待" | K104: =HLOOKUP(R2C[-6],R2C[-6]:R150C[-6],RC7+2,FALSE)&"|"&HLOOKUP(R2C[-6],R2C[-6]:R150C[-6],RC7+3,FALSE)&"|"&HLOOKUP(R2C[-6],R2C[-6]:R150C[-6],RC7+4,FALSE) -> 150|150|150 | L104: =HLOOKUP(R2C[-6],R2C[-6]:R150C[-6],RC7+2,FALSE)&"|"&HLOOKUP(R2C[-6],R2C[-6]:R150C[-6],RC7+3,FALSE)&"|"&HLOOKUP(R2C[-6],R2C[-6]:R150C[-6],RC7+4,FALSE) -> 49|49|49
G105: =VLOOKUP(RC[1]-0.1,C1:C2,2,TRUE)+1 -> 53 | H105: 103 | I105: =R2C7&HLOOKUP(R2C[-6],R2C[-6]:R150C[-6],RC7+2,FALSE)&R2C7&"|"&R2C7&HLOOKUP(R2C[-6],R2C[-6]:R150C[-6],RC7+3,FALSE)&R2C7&"|"&R2C7&HLOOKUP(R2C[-6],R2C[-6]:R150C[-6],RC7+4,FALSE)&R2C7 -> "暂无后续"|"暂无后续"|"暂无后续" | J105: =R2C7&HLOOKUP(R2C[-6],R2C[-6]:R150C[-6],RC7+2,FALSE)&R2C7&"|"&R2C7&HLOOKUP(R2C[-6],R2C[-6]:R150C[-6],RC7+3,FALSE)&R2C7&"|"&R2C7&HLOOKUP(R2C[-6],R2C[-6]:R150C[-6],RC7+4,FALSE)&R2C7 -> "敬请期待"|"敬请期待"|"敬请期待" | K105: =HLOOKUP(R2C[-6],R2C[-6]:R150C[-6],RC7+2,FALSE)&"|"&HLOOKUP(R2C[-6],R2C[-6]:R150C[-6],RC7+3,FALSE)&"|"&HLOOKUP(R2C[-6],R2C[-6]:R150C[-6],RC7+4,FALSE) -> 150|150|150 | L105: =HLOOKUP(R2C[-6],R2C[-6]:R150C[-6],RC7+2,FALSE)&"|"&HLOOKUP(R2C[-6],R2C[-6]:R150C[-6],RC7+3,FALSE)&"|"&HLOOKUP(R2C[-6],R2C[-6]:R150C[-6],RC7+4,FALSE) -> 49|49|49
G106: =VLOOKUP(RC[1]-0.1,C1:C2,2,TRUE)+1 -> 53 | H106: 104 | I106: =R2C7&HLOOKUP(R2C[-6],R2C[-6]:R150C[-6],RC7+2,FALSE)&R2C7&"|"&R2C7&HLOOKUP(R2C[-6],R2C[-6]:R150C[-6],RC7+3,FALSE)&R2C7&"|"&R2C7&HLOOKUP(R2C[-6],R2C[-6]:R150C[-6],RC7+4,FALSE)&R2C7 -> "暂无后续"|"暂无后续"|"暂无后续" | J106: =R2C7&HLOOKUP(R2C[-6],R2C[-6]:R150C[-6],RC7+2,FALSE)&R2C7&"|"&R2C7&HLOOKUP(R2C[-6],R2C[-6]:R150C[-6],RC7+3,FALSE)&R2C7&"|"&R2C7&HLOOKUP(R2C[-6],R2C[-6]:R150C[-6],RC7+4,FALSE)&R2C7 -> "敬请期待"|"敬请期待"|"敬请期待" | K106: =HLOOKUP(R2C[-6],R2C[-6]:R150C[-6],RC7+2,FALSE)&"|"&HLOOKUP(R2C[-6],R2C[-6]:R150C[-6],RC7+3,FALSE)&"|"&HLOOKUP(R2C[-6],R2C[-6]:R150C[-6],RC7+4,FALSE) -> 150|150|150 | L106: =HLOOKUP(R2C[-6],R2C[-6]:R150C[-6],RC7+2,FALSE)&"|"&HLOOKUP(R2C[-6],R2C[-6]:R150C[-6],RC7+3,FALSE)&"|"&HLOOKUP(R2C[-6],R2C[-6]:R150C[-6],RC7+4,FALSE) -> 49|49|49
G107: =VLOOKUP(RC[1]-0.1,C1:C2,2,TRUE)+1 -> 53 | H107: 105 | I107: =R2C7&HLOOKUP(R2C[-6],R2C[-6]:R150C[-6],RC7+2,FALSE)&R2C7&"|"&R2C7&HLOOKUP(R2C[-6],R2C[-6]:R150C[-6],RC7+3,FALSE)&R2C7&"|"&R2C7&HLOOKUP(R2C[-6],R2C[-6]:R150C[-6],RC7+4,FALSE)&R2C7 -> "暂无后续"|"暂无后续"|"暂无后续" | J107: =R2C7&HLOOKUP(R2C[-6],R2C[-6]:R150C[-6],RC7+2,FALSE)&R2C7&"|"&R2C7&HLOOKUP(R2C[-6],R2C[-6]:R150C[-6],RC7+3,FALSE)&R2C7&"|"&R2C7&HLOOKUP(R2C[-6],R2C[-6]:R150C[-6],RC7+4,FALSE)&R2C7 -> "敬请期待"|"敬请期待"|"敬请期待" | K107: =HLOOKUP(R2C[-6],R2C[-6]:R150C[-6],RC7+2,FALSE)&"|"&HLOOKUP(R2C[-6],R2C[-6]:R150C[-6],RC7+3,FALSE)&"|"&HLOOKUP(R2C[-6],R2C[-6]:R150C[-6],RC7+4,FALSE) -> 150|150|150 | L107: =HLOOKUP(R2C[-6],R2C[-6]:R150C[-6],RC7+2,FALSE)&"|"&HLOOKUP(R2C[-6],R2C[-6]:R150C[-6],RC7+3,FALSE)&"|"&HLOOKUP(R2C[-6],R2C[-6]:R150C[-6],RC7+4,FALSE) -> 49|49|49
G108: =VLOOKUP(RC[1]-0.1,C1:C2,2,TRUE)+1 -> 53 | H108: 106 | I108: =R2C7&HLOOKUP(R2C[-6],R2C[-6]:R150C[-6],RC7+2,FALSE)&R2C7&"|"&R2C7&HLOOKUP(R2C[-6],R2C[-6]:R150C[-6],RC7+3,FALSE)&R2C7&"|"&R2C7&HLOOKUP(R2C[-6],R2C[-6]:R150C[-6],RC7+4,FALSE)&R2C7 -> "暂无后续"|"暂无后续"|"暂无后续" | J108: =R2C7&HLOOKUP(R2C[-6],R2C[-6]:R150C[-6],RC7+2,FALSE)&R2C7&"|"&R2C7&HLOOKUP(R2C[-6],R2C[-6]:R150C[-6],RC7+3,FALSE)&R2C7&"|"&R2C7&HLOOKUP(R2C[-6],R2C[-6]:R150C[-6],RC7+4,FALSE)&R2C7 -> "敬请期待"|"敬请期待"|"敬请期待" | K108: =HLOOKUP(R2C[-6],R2C[-6]:R150C[-6],RC7+2,FALSE)&"|"&HLOOKUP(R2C[-6],R2C[-6]:R150C[-6],RC7+3,FALSE)&"|"&HLOOKUP(R2C[-6],R2C[-6]:R150C[-6],RC7+4,FALSE) -> 150|150|150 | L108: =HLOOKUP(R2C[-6],R2C[-6]:R150C[-6],RC7+2,FALSE)&"|"&HLOOKUP(R2C[-6],R2C[-6]:R150C[-6],RC7+3,FALSE)&"|"&HLOOKUP(R2C[-6],R2C[-6]:R150C[-6],RC7+4,FALSE) -> 49|49|49
G109: =VLOOKUP(RC[1]-0.1,C1:C2,2,TRUE)+1 -> 53 | H109: 107 | I109: =R2C7&HLOOKUP(R2C[-6],R2C[-6]:R150C[-6],RC7+2,FALSE)&R2C7&"|"&R2C7&HLOOKUP(R2C[-6],R2C[-6]:R150C[-6],RC7+3,FALSE)&R2C7&"|"&R2C7&HLOOKUP(R2C[-6],R2C[-6]:R150C[-6],RC7+4,FALSE)&R2C7 -> "暂无后续"|"暂无后续"|"暂无后续" | J109: =R2C7&HLOOKUP(R2C[-6],R2C[-6]:R150C[-6],RC7+2,FALSE)&R2C7&"|"&R2C7&HLOOKUP(R2C[-6],R2C[-6]:R150C[-6],RC7+3,FALSE)&R2C7&"|"&R2C7&HLOOKUP(R2C[-6],R2C[-6]:R150C[-6],RC7+4,FALSE)&R2C7 -> "敬请期待"|"敬请期待"|"敬请期待" | K109: =HLOOKUP(R2C[-6],R2C[-6]:R150C[-6],RC7+2,FALSE)&"|"&HLOOKUP(R2C[-6],R2C[-6]:R150C[-6],RC7+3,FALSE)&"|"&HLOOKUP(R2C[-6],R2C[-6]:R150C[-6],RC7+4,FALSE) -> 150|150|150 | L109: =HLOOKUP(R2C[-6],R2C[-6]:R150C[-6],RC7+2,FALSE)&"|"&HLOOKUP(R2C[-6],R2C[-6]:R150C[-6],RC7+3,FALSE)&"|"&HLOOKUP(R2C[-6],R2C[-6]:R150C[-6],RC7+4,FALSE) -> 49|49|49
G110: =VLOOKUP(RC[1]-0.1,C1:C2,2,TRUE)+1 -> 53 | H110: 108 | I110: =R2C7&HLOOKUP(R2C[-6],R2C[-6]:R150C[-6],RC7+2,FALSE)&R2C7&"|"&R2C7&HLOOKUP(R2C[-6],R2C[-6]:R150C[-6],RC7+3,FALSE)&R2C7&"|"&R2C7&HLOOKUP(R2C[-6],R2C[-6]:R150C[-6],RC7+4,FALSE)&R2C7 -> "暂无后续"|"暂无后续"|"暂无后续" | J110: =R2C7&HLOOKUP(R2C[-6],R2C[-6]:R150C[-6],RC7+2,FALSE)&R2C7&"|"&R2C7&HLOOKUP(R2C[-6],R2C[-6]:R150C[-6],RC7+3,FALSE)&R2C7&"|"&R2C7&HLOOKUP(R2C[-6],R2C[-6]:R150C[-6],RC7+4,FALSE)&R2C7 -> "敬请期待"|"敬请期待"|"敬请期待" | K110: =HLOOKUP(R2C[-6],R2C[-6]:R150C[-6],RC7+2,FALSE)&"|"&HLOOKUP(R2C[-6],R2C[-6]:R150C[-6],RC7+3,FALSE)&"|"&HLOOKUP(R2C[-6],R2C[-6]:R150C[-6],RC7+4,FALSE) -> 150|150|150 | L110: =HLOOKUP(R2C[-6],R2C[-6]:R150C[-6],RC7+2,FALSE)&"|"&HLOOKUP(R2C[-6],R2C[-6]:R150C[-6],RC7+3,FALSE)&"|"&HLOOKUP(R2C[-6],R2C[-6]:R150C[-6],RC7+4,FALSE) -> 49|49|49
G111: =VLOOKUP(RC[1]-0.1,C1:C2,2,TRUE)+1 -> 53 | H111: 109 | I111: =R2C7&HLOOKUP(R2C[-6],R2C[-6]:R150C[-6],RC7+2,FALSE)&R2C7&"|"&R2C7&HLOOKUP(R2C[-6],R2C[-6]:R150C[-6],RC7+3,FALSE)&R2C7&"|"&R2C7&HLOOKUP(R2C[-6],R2C[-6]:R150C[-6],RC7+4,FALSE)&R2C7 -> "暂无后续"|"暂无后续"|"暂无后续" | J111: =R2C7&HLOOKUP(R2C[-6],R2C[-6]:R150C[-6],RC7+2,FALSE)&R2C7&"|"&R2C7&HLOOKUP(R2C[-6],R2C[-6]:R150C[-6],RC7+3,FALSE)&R2C7&"|"&R2C7&HLOOKUP(R2C[-6],R2C[-6]:R150C[-6],RC7+4,FALSE)&R2C7 -> "敬请期待"|"敬请期待"|"敬请期待" | K111: =HLOOKUP(R2C[-6],R2C[-6]:R150C[-6],RC7+2,FALSE)&"|"&HLOOKUP(R2C[-6],R2C[-6]:R150C[-6],RC7+3,FALSE)&"|"&HLOOKUP(R2C[-6],R2C[-6]:R150C[-6],RC7+4,FALSE) -> 150|150|150 | L111: =HLOOKUP(R2C[-6],R2C[-6]:R150C[-6],RC7+2,FALSE)&"|"&HLOOKUP(R2C[-6],R2C[-6]:R150C[-6],RC7+3,FALSE)&"|"&HLOOKUP(R2C[-6],R2C[-6]:R150C[-6],RC7+4,FALSE) -> 49|49|49
G112: =VLOOKUP(RC[1]-0.1,C1:C2,2,TRUE)+1 -> 53 | H112: 110 | I112: =R2C7&HLOOKUP(R2C[-6],R2C[-6]:R150C[-6],RC7+2,FALSE)&R2C7&"|"&R2C7&HLOOKUP(R2C[-6],R2C[-6]:R150C[-6],RC7+3,FALSE)&R2C7&"|"&R2C7&HLOOKUP(R2C[-6],R2C[-6]:R150C[-6],RC7+4,FALSE)&R2C7 -> "暂无后续"|"暂无后续"|"暂无后续" | J112: =R2C7&HLOOKUP(R2C[-6],R2C[-6]:R150C[-6],RC7+2,FALSE)&R2C7&"|"&R2C7&HLOOKUP(R2C[-6],R2C[-6]:R150C[-6],RC7+3,FALSE)&R2C7&"|"&R2C7&HLOOKUP(R2C[-6],R2C[-6]:R150C[-6],RC7+4,FALSE)&R2C7 -> "敬请期待"|"敬请期待"|"敬请期待" | K112: =HLOOKUP(R2C[-6],R2C[-6]:R150C[-6],RC7+2,FALSE)&"|"&HLOOKUP(R2C[-6],R2C[-6]:R150C[-6],RC7+3,FALSE)&"|"&HLOOKUP(R2C[-6],R2C[-6]:R150C[-6],RC7+4,FALSE) -> 150|150|150 | L112: =HLOOKUP(R2C[-6],R2C[-6]:R150C[-6],RC7+2,FALSE)&"|"&HLOOKUP(R2C[-6],R2C[-6]:R150C[-6],RC7+3,FALSE)&"|"&HLOOKUP(R2C[-6],R2C[-6]:R150C[-6],RC7+4,FALSE) -> 49|49|49
G113: =VLOOKUP(RC[1]-0.1,C1:C2,2,TRUE)+1 -> 53 | H113: 111 | I113: =R2C7&HLOOKUP(R2C[-6],R2C[-6]:R150C[-6],RC7+2,FALSE)&R2C7&"|"&R2C7&HLOOKUP(R2C[-6],R2C[-6]:R150C[-6],RC7+3,FALSE)&R2C7&"|"&R2C7&HLOOKUP(R2C[-6],R2C[-6]:R150C[-6],RC7+4,FALSE)&R2C7 -> "暂无后续"|"暂无后续"|"暂无后续" | J113: =R2C7&HLOOKUP(R2C[-6],R2C[-6]:R150C[-6],RC7+2,FALSE)&R2C7&"|"&R2C7&HLOOKUP(R2C[-6],R2C[-6]:R150C[-6],RC7+3,FALSE)&R2C7&"|"&R2C7&HLOOKUP(R2C[-6],R2C[-6]:R150C[-6],RC7+4,FALSE)&R2C7 -> "敬请期待"|"敬请期待"|"敬请期待" | K113: =HLOOKUP(R2C[-6],R2C[-6]:R150C[-6],RC7+2,FALSE)&"|"&HLOOKUP(R2C[-6],R2C[-6]:R150C[-6],RC7+3,FALSE)&"|"&HLOOKUP(R2C[-6],R2C[-6]:R150C[-6],RC7+4,FALSE) -> 150|150|150 | L113: =HLOOKUP(R2C[-6],R2C[-6]:R150C[-6],RC7+2,FALSE)&"|"&HLOOKUP(R2C[-6],R2C[-6]:R150C[-6],RC7+3,FALSE)&"|"&HLOOKUP(R2C[-6],R2C[-6]:R150C[-6],RC7+4,FALSE) -> 49|49|49
G114: =VLOOKUP(RC[1]-0.1,C1:C2,2,TRUE)+1 -> 53 | H114: 112 | I114: =R2C7&HLOOKUP(R2C[-6],R2C[-6]:R150C[-6],RC7+2,FALSE)&R2C7&"|"&R2C7&HLOOKUP(R2C[-6],R2C[-6]:R150C[-6],RC7+3,FALSE)&R2C7&"|"&R2C7&HLOOKUP(R2C[-6],R2C[-6]:R150C[-6],RC7+4,FALSE)&R2C7 -> "暂无后续"|"暂无后续"|"暂无后续" | J114: =R2C7&HLOOKUP(R2C[-6],R2C[-6]:R150C[-6],RC7+2,FALSE)&R2C7&"|"&R2C7&HLOOKUP(R2C[-6],R2C[-6]:R150C[-6],RC7+3,FALSE)&R2C7&"|"&R2C7&HLOOKUP(R2C[-6],R2C[-6]:R150C[-6],RC7+4,FALSE)&R2C7 -> "敬请期待"|"敬请期待"|"敬请期待" | K114: =HLOOKUP(R2C[-6],R2C[-6]:R150C[-6],RC7+2,FALSE)&"|"&HLOOKUP(R2C[-6],R2C[-6]:R150C[-6],RC7+3,FALSE)&"|"&HLOOKUP(R2C[-6],R2C[-6]:R150C[-6],RC7+4,FALSE) -> 150|150|150 | L114: =HLOOKUP(R2C[-6],R2C[-6]:R150C[-6],RC7+2,FALSE)&"|"&HLOOKUP(R2C[-6],R2C[-6]:R150C[-6],RC7+3,FALSE)&"|"&HLOOKUP(R2C[-6],R2C[-6]:R150C[-6],RC7+4,FALSE) -> 49|49|49
G115: =VLOOKUP(RC[1]-0.1,C1:C2,2,TRUE)+1 -> 53 | H115: 113 | I115: =R2C7&HLOOKUP(R2C[-6],R2C[-6]:R150C[-6],RC7+2,FALSE)&R2C7&"|"&R2C7&HLOOKUP(R2C[-6],R2C[-6]:R150C[-6],RC7+3,FALSE)&R2C7&"|"&R2C7&HLOOKUP(R2C[-6],R2C[-6]:R150C[-6],RC7+4,FALSE)&R2C7 -> "暂无后续"|"暂无后续"|"暂无后续" | J115: =R2C7&HLOOKUP(R2C[-6],R2C[-6]:R150C[-6],RC7+2,FALSE)&R2C7&"|"&R2C7&HLOOKUP(R2C[-6],R2C[-6]:R150C[-6],RC7+3,FALSE)&R2C7&"|"&R2C7&HLOOKUP(R2C[-6],R2C[-6]:R150C[-6],RC7+4,FALSE)&R2C7 -> "敬请期待"|"敬请期待"|"敬请期待" | K115: =HLOOKUP(R2C[-6],R2C[-6]:R150C[-6],RC7+2,FALSE)&"|"&HLOOKUP(R2C[-6],R2C[-6]:R150C[-6],RC7+3,FALSE)&"|"&HLOOKUP(R2C[-6],R2C[-6]:R150C[-6],RC7+4,FALSE) -> 150|150|150 | L115: =HLOOKUP(R2C[-6],R2C[-6]:R150C[-6],RC7+2,FALSE)&"|"&HLOOKUP(R2C[-6],R2C[-6]:R150C[-6],RC7+3,FALSE)&"|"&HLOOKUP(R2C[-6],R2C[-6]:R150C[-6],RC7+4,FALSE) -> 49|49|49
G116: =VLOOKUP(RC[1]-0.1,C1:C2,2,TRUE)+1 -> 53 | H116: 114 | I116: =R2C7&HLOOKUP(R2C[-6],R2C[-6]:R150C[-6],RC7+2,FALSE)&R2C7&"|"&R2C7&HLOOKUP(R2C[-6],R2C[-6]:R150C[-6],RC7+3,FALSE)&R2C7&"|"&R2C7&HLOOKUP(R2C[-6],R2C[-6]:R150C[-6],RC7+4,FALSE)&R2C7 -> "暂无后续"|"暂无后续"|"暂无后续" | J116: =R2C7&HLOOKUP(R2C[-6],R2C[-6]:R150C[-6],RC7+2,FALSE)&R2C7&"|"&R2C7&HLOOKUP(R2C[-6],R2C[-6]:R150C[-6],RC7+3,FALSE)&R2C7&"|"&R2C7&HLOOKUP(R2C[-6],R2C[-6]:R150C[-6],RC7+4,FALSE)&R2C7 -> "敬请期待"|"敬请期待"|"敬请期待" | K116: =HLOOKUP(R2C[-6],R2C[-6]:R150C[-6],RC7+2,FALSE)&"|"&HLOOKUP(R2C[-6],R2C[-6]:R150C[-6],RC7+3,FALSE)&"|"&HLOOKUP(R2C[-6],R2C[-6]:R150C[-6],RC7+4,FALSE) -> 150|150|150 | L116: =HLOOKUP(R2C[-6],R2C[-6]:R150C[-6],RC7+2,FALSE)&"|"&HLOOKUP(R2C[-6],R2C[-6]:R150C[-6],RC7+3,FALSE)&"|"&HLOOKUP(R2C[-6],R2C[-6]:R150C[-6],RC7+4,FALSE) -> 49|49|49
G117: =VLOOKUP(RC[1]-0.1,C1:C2,2,TRUE)+1 -> 53 | H117: 115 | I117: =R2C7&HLOOKUP(R2C[-6],R2C[-6]:R150C[-6],RC7+2,FALSE)&R2C7&"|"&R2C7&HLOOKUP(R2C[-6],R2C[-6]:R150C[-6],RC7+3,FALSE)&R2C7&"|"&R2C7&HLOOKUP(R2C[-6],R2C[-6]:R150C[-6],RC7+4,FALSE)&R2C7 -> "暂无后续"|"暂无后续"|"暂无后续" | J117: =R2C7&HLOOKUP(R2C[-6],R2C[-6]:R150C[-6],RC7+2,FALSE)&R2C7&"|"&R2C7&HLOOKUP(R2C[-6],R2C[-6]:R150C[-6],RC7+3,FALSE)&R2C7&"|"&R2C7&HLOOKUP(R2C[-6],R2C[-6]:R150C[-6],RC7+4,FALSE)&R2C7 -> "敬请期待"|"敬请期待"|"敬请期待" | K117: =HLOOKUP(R2C[-6],R2C[-6]:R150C[-6],RC7+2,FALSE)&"|"&HLOOKUP(R2C[-6],R2C[-6]:R150C[-6],RC7+3,FALSE)&"|"&HLOOKUP(R2C[-6],R2C[-6]:R150C[-6],RC7+4,FALSE) -> 150|150|150 | L117: =HLOOKUP(R2C[-6],R2C[-6]:R150C[-6],RC7+2,FALSE)&"|"&HLOOKUP(R2C[-6],R2C[-6]:R150C[-6],RC7+3,FALSE)&"|"&HLOOKUP(R2C[-6],R2C[-6]:R150C[-6],RC7+4,FALSE) -> 49|49|49
G118: =VLOOKUP(RC[1]-0.1,C1:C2,2,TRUE)+1 -> 53 | H118: 116 | I118: =R2C7&HLOOKUP(R2C[-6],R2C[-6]:R150C[-6],RC7+2,FALSE)&R2C7&"|"&R2C7&HLOOKUP(R2C[-6],R2C[-6]:R150C[-6],RC7+3,FALSE)&R2C7&"|"&R2C7&HLOOKUP(R2C[-6],R2C[-6]:R150C[-6],RC7+4,FALSE)&R2C7 -> "暂无后续"|"暂无后续"|"暂无后续" | J118: =R2C7&HLOOKUP(R2C[-6],R2C[-6]:R150C[-6],RC7+2,FALSE)&R2C7&"|"&R2C7&HLOOKUP(R2C[-6],R2C[-6]:R150C[-6],RC7+3,FALSE)&R2C7&"|"&R2C7&HLOOKUP(R2C[-6],R2C[-6]:R150C[-6],RC7+4,FALSE)&R2C7 -> "敬请期待"|"敬请期待"|"敬请期待" | K118: =HLOOKUP(R2C[-6],R2C[-6]:R150C[-6],RC7+2,FALSE)&"|"&HLOOKUP(R2C[-6],R2C[-6]:R150C[-6],RC7+3,FALSE)&"|"&HLOOKUP(R2C[-6],R2C[-6]:R150C[-6],RC7+4,FALSE) -> 150|150|150 | L118: =HLOOKUP(R2C[-6],R2C[-6]:R150C[-6],RC7+2,FALSE)&"|"&HLOOKUP(R2C[-6],R2C[-6]:R150C[-6],RC7+3,FALSE)&"|"&HLOOKUP(R2C[-6],R2C[-6]:R150C[-6],RC7+4,FALSE) -> 49|49|49
G119: =VLOOKUP(RC[1]-0.1,C1:C2,2,TRUE)+1 -> 53 | H119: 117 | I119: =R2C7&HLOOKUP(R2C[-6],R2C[-6]:R150C[-6],RC7+2,FALSE)&R2C7&"|"&R2C7&HLOOKUP(R2C[-6],R2C[-6]:R150C[-6],RC7+3,FALSE)&R2C7&"|"&R2C7&HLOOKUP(R2C[-6],R2C[-6]:R150C[-6],RC7+4,FALSE)&R2C7 -> "暂无后续"|"暂无后续"|"暂无后续" | J119: =R2C7&HLOOKUP(R2C[-6],R2C[-6]:R150C[-6],RC7+2,FALSE)&R2C7&"|"&R2C7&HLOOKUP(R2C[-6],R2C[-6]:R150C[-6],RC7+3,FALSE)&R2C7&"|"&R2C7&HLOOKUP(R2C[-6],R2C[-6]:R150C[-6],RC7+4,FALSE)&R2C7 -> "敬请期待"|"敬请期待"|"敬请期待" | K119: =HLOOKUP(R2C[-6],R2C[-6]:R150C[-6],RC7+2,FALSE)&"|"&HLOOKUP(R2C[-6],R2C[-6]:R150C[-6],RC7+3,FALSE)&"|"&HLOOKUP(R2C[-6],R2C[-6]:R150C[-6],RC7+4,FALSE) -> 150|150|150 | L119: =HLOOKUP(R2C[-6],R2C[-6]:R150C[-6],RC7+2,FALSE)&"|"&HLOOKUP(R2C[-6],R2C[-6]:R150C[-6],RC7+3,FALSE)&"|"&HLOOKUP(R2C[-6],R2C[-6]:R150C[-6],RC7+4,FALSE) -> 49|49|49
G120: =VLOOKUP(RC[1]-0.1,C1:C2,2,TRUE)+1 -> 53 | H120: 118 | I120: =R2C7&HLOOKUP(R2C[-6],R2C[-6]:R150C[-6],RC7+2,FALSE)&R2C7&"|"&R2C7&HLOOKUP(R2C[-6],R2C[-6]:R150C[-6],RC7+3,FALSE)&R2C7&"|"&R2C7&HLOOKUP(R2C[-6],R2C[-6]:R150C[-6],RC7+4,FALSE)&R2C7 -> "暂无后续"|"暂无后续"|"暂无后续" | J120: =R2C7&HLOOKUP(R2C[-6],R2C[-6]:R150C[-6],RC7+2,FALSE)&R2C7&"|"&R2C7&HLOOKUP(R2C[-6],R2C[-6]:R150C[-6],RC7+3,FALSE)&R2C7&"|"&R2C7&HLOOKUP(R2C[-6],R2C[-6]:R150C[-6],RC7+4,FALSE)&R2C7 -> "敬请期待"|"敬请期待"|"敬请期待" | K120: =HLOOKUP(R2C[-6],R2C[-6]:R150C[-6],RC7+2,FALSE)&"|"&HLOOKUP(R2C[-6],R2C[-6]:R150C[-6],RC7+3,FALSE)&"|"&HLOOKUP(R2C[-6],R2C[-6]:R150C[-6],RC7+4,FALSE) -> 150|150|150 | L120: =HLOOKUP(R2C[-6],R2C[-6]:R150C[-6],RC7+2,FALSE)&"|"&HLOOKUP(R2C[-6],R2C[-6]:R150C[-6],RC7+3,FALSE)&"|"&HLOOKUP(R2C[-6],R2C[-6]:R150C[-6],RC7+4,FALSE) -> 49|49|49
G121: =VLOOKUP(RC[1]-0.1,C1:C2,2,TRUE)+1 -> 53 | H121: 119 | I121: =R2C7&HLOOKUP(R2C[-6],R2C[-6]:R150C[-6],RC7+2,FALSE)&R2C7&"|"&R2C7&HLOOKUP(R2C[-6],R2C[-6]:R150C[-6],RC7+3,FALSE)&R2C7&"|"&R2C7&HLOOKUP(R2C[-6],R2C[-6]:R150C[-6],RC7+4,FALSE)&R2C7 -> "暂无后续"|"暂无后续"|"暂无后续" | J121: =R2C7&HLOOKUP(R2C[-6],R2C[-6]:R150C[-6],RC7+2,FALSE)&R2C7&"|"&R2C7&HLOOKUP(R2C[-6],R2C[-6]:R150C[-6],RC7+3,FALSE)&R2C7&"|"&R2C7&HLOOKUP(R2C[-6],R2C[-6]:R150C[-6],RC7+4,FALSE)&R2C7 -> "敬请期待"|"敬请期待"|"敬请期待" | K121: =HLOOKUP(R2C[-6],R2C[-6]:R150C[-6],RC7+2,FALSE)&"|"&HLOOKUP(R2C[-6],R2C[-6]:R150C[-6],RC7+3,FALSE)&"|"&HLOOKUP(R2C[-6],R2C[-6]:R150C[-6],RC7+4,FALSE) -> 150|150|150 | L121: =HLOOKUP(R2C[-6],R2C[-6]:R150C[-6],RC7+2,FALSE)&"|"&HLOOKUP(R2C[-6],R2C[-6]:R150C[-6],RC7+3,FALSE)&"|"&HLOOKUP(R2C[-6],R2C[-6]:R150C[-6],RC7+4,FALSE) -> 49|49|49
G122: =VLOOKUP(RC[1]-0.1,C1:C2,2,TRUE)+1 -> 53 | H122: 120 | I122: =R2C7&HLOOKUP(R2C[-6],R2C[-6]:R150C[-6],RC7+2,FALSE)&R2C7&"|"&R2C7&HLOOKUP(R2C[-6],R2C[-6]:R150C[-6],RC7+3,FALSE)&R2C7&"|"&R2C7&HLOOKUP(R2C[-6],R2C[-6]:R150C[-6],RC7+4,FALSE)&R2C7 -> "暂无后续"|"暂无后续"|"暂无后续" | J122: =R2C7&HLOOKUP(R2C[-6],R2C[-6]:R150C[-6],RC7+2,FALSE)&R2C7&"|"&R2C7&HLOOKUP(R2C[-6],R2C[-6]:R150C[-6],RC7+3,FALSE)&R2C7&"|"&R2C7&HLOOKUP(R2C[-6],R2C[-6]:R150C[-6],RC7+4,FALSE)&R2C7 -> "敬请期待"|"敬请期待"|"敬请期待" | K122: =HLOOKUP(R2C[-6],R2C[-6]:R150C[-6],RC7+2,FALSE)&"|"&HLOOKUP(R2C[-6],R2C[-6]:R150C[-6],RC7+3,FALSE)&"|"&HLOOKUP(R2C[-6],R2C[-6]:R150C[-6],RC7+4,FALSE) -> 150|150|150 | L122: =HLOOKUP(R2C[-6],R2C[-6]:R150C[-6],RC7+2,FALSE)&"|"&HLOOKUP(R2C[-6],R2C[-6]:R150C[-6],RC7+3,FALSE)&"|"&HLOOKUP(R2C[-6],R2C[-6]:R150C[-6],RC7+4,FALSE) -> 49|49|49
G123: =VLOOKUP(RC[1]-0.1,C1:C2,2,TRUE)+1 -> 53 | H123: 121 | I123: =R2C7&HLOOKUP(R2C[-6],R2C[-6]:R150C[-6],RC7+2,FALSE)&R2C7&"|"&R2C7&HLOOKUP(R2C[-6],R2C[-6]:R150C[-6],RC7+3,FALSE)&R2C7&"|"&R2C7&HLOOKUP(R2C[-6],R2C[-6]:R150C[-6],RC7+4,FALSE)&R2C7 -> "暂无后续"|"暂无后续"|"暂无后续" | J123: =R2C7&HLOOKUP(R2C[-6],R2C[-6]:R150C[-6],RC7+2,FALSE)&R2C7&"|"&R2C7&HLOOKUP(R2C[-6],R2C[-6]:R150C[-6],RC7+3,FALSE)&R2C7&"|"&R2C7&HLOOKUP(R2C[-6],R2C[-6]:R150C[-6],RC7+4,FALSE)&R2C7 -> "敬请期待"|"敬请期待"|"敬请期待" | K123: =HLOOKUP(R2C[-6],R2C[-6]:R150C[-6],RC7+2,FALSE)&"|"&HLOOKUP(R2C[-6],R2C[-6]:R150C[-6],RC7+3,FALSE)&"|"&HLOOKUP(R2C[-6],R2C[-6]:R150C[-6],RC7+4,FALSE) -> 150|150|150 | L123: =HLOOKUP(R2C[-6],R2C[-6]:R150C[-6],RC7+2,FALSE)&"|"&HLOOKUP(R2C[-6],R2C[-6]:R150C[-6],RC7+3,FALSE)&"|"&HLOOKUP(R2C[-6],R2C[-6]:R150C[-6],RC7+4,FALSE) -> 49|49|49
G124: =VLOOKUP(RC[1]-0.1,C1:C2,2,TRUE)+1 -> 53 | H124: 122 | I124: =R2C7&HLOOKUP(R2C[-6],R2C[-6]:R150C[-6],RC7+2,FALSE)&R2C7&"|"&R2C7&HLOOKUP(R2C[-6],R2C[-6]:R150C[-6],RC7+3,FALSE)&R2C7&"|"&R2C7&HLOOKUP(R2C[-6],R2C[-6]:R150C[-6],RC7+4,FALSE)&R2C7 -> "暂无后续"|"暂无后续"|"暂无后续" | J124: =R2C7&HLOOKUP(R2C[-6],R2C[-6]:R150C[-6],RC7+2,FALSE)&R2C7&"|"&R2C7&HLOOKUP(R2C[-6],R2C[-6]:R150C[-6],RC7+3,FALSE)&R2C7&"|"&R2C7&HLOOKUP(R2C[-6],R2C[-6]:R150C[-6],RC7+4,FALSE)&R2C7 -> "敬请期待"|"敬请期待"|"敬请期待" | K124: =HLOOKUP(R2C[-6],R2C[-6]:R150C[-6],RC7+2,FALSE)&"|"&HLOOKUP(R2C[-6],R2C[-6]:R150C[-6],RC7+3,FALSE)&"|"&HLOOKUP(R2C[-6],R2C[-6]:R150C[-6],RC7+4,FALSE) -> 150|150|150 | L124: =HLOOKUP(R2C[-6],R2C[-6]:R150C[-6],RC7+2,FALSE)&"|"&HLOOKUP(R2C[-6],R2C[-6]:R150C[-6],RC7+3,FALSE)&"|"&HLOOKUP(R2C[-6],R2C[-6]:R150C[-6],RC7+4,FALSE) -> 49|49|49
G125: =VLOOKUP(RC[1]-0.1,C1:C2,2,TRUE)+1 -> 53 | H125: 123 | I125: =R2C7&HLOOKUP(R2C[-6],R2C[-6]:R150C[-6],RC7+2,FALSE)&R2C7&"|"&R2C7&HLOOKUP(R2C[-6],R2C[-6]:R150C[-6],RC7+3,FALSE)&R2C7&"|"&R2C7&HLOOKUP(R2C[-6],R2C[-6]:R150C[-6],RC7+4,FALSE)&R2C7 -> "暂无后续"|"暂无后续"|"暂无后续" | J125: =R2C7&HLOOKUP(R2C[-6],R2C[-6]:R150C[-6],RC7+2,FALSE)&R2C7&"|"&R2C7&HLOOKUP(R2C[-6],R2C[-6]:R150C[-6],RC7+3,FALSE)&R2C7&"|"&R2C7&HLOOKUP(R2C[-6],R2C[-6]:R150C[-6],RC7+4,FALSE)&R2C7 -> "敬请期待"|"敬请期待"|"敬请期待" | K125: =HLOOKUP(R2C[-6],R2C[-6]:R150C[-6],RC7+2,FALSE)&"|"&HLOOKUP(R2C[-6],R2C[-6]:R150C[-6],RC7+3,FALSE)&"|"&HLOOKUP(R2C[-6],R2C[-6]:R150C[-6],RC7+4,FALSE) -> 150|150|150 | L125: =HLOOKUP(R2C[-6],R2C[-6]:R150C[-6],RC7+2,FALSE)&"|"&HLOOKUP(R2C[-6],R2C[-6]:R150C[-6],RC7+3,FALSE)&"|"&HLOOKUP(R2C[-6],R2C[-6]:R150C[-6],RC7+4,FALSE) -> 49|49|49
G126: =VLOOKUP(RC[1]-0.1,C1:C2,2,TRUE)+1 -> 53 | H126: 124 | I126: =R2C7&HLOOKUP(R2C[-6],R2C[-6]:R150C[-6],RC7+2,FALSE)&R2C7&"|"&R2C7&HLOOKUP(R2C[-6],R2C[-6]:R150C[-6],RC7+3,FALSE)&R2C7&"|"&R2C7&HLOOKUP(R2C[-6],R2C[-6]:R150C[-6],RC7+4,FALSE)&R2C7 -> "暂无后续"|"暂无后续"|"暂无后续" | J126: =R2C7&HLOOKUP(R2C[-6],R2C[-6]:R150C[-6],RC7+2,FALSE)&R2C7&"|"&R2C7&HLOOKUP(R2C[-6],R2C[-6]:R150C[-6],RC7+3,FALSE)&R2C7&"|"&R2C7&HLOOKUP(R2C[-6],R2C[-6]:R150C[-6],RC7+4,FALSE)&R2C7 -> "敬请期待"|"敬请期待"|"敬请期待" | K126: =HLOOKUP(R2C[-6],R2C[-6]:R150C[-6],RC7+2,FALSE)&"|"&HLOOKUP(R2C[-6],R2C[-6]:R150C[-6],RC7+3,FALSE)&"|"&HLOOKUP(R2C[-6],R2C[-6]:R150C[-6],RC7+4,FALSE) -> 150|150|150 | L126: =HLOOKUP(R2C[-6],R2C[-6]:R150C[-6],RC7+2,FALSE)&"|"&HLOOKUP(R2C[-6],R2C[-6]:R150C[-6],RC7+3,FALSE)&"|"&HLOOKUP(R2C[-6],R2C[-6]:R150C[-6],RC7+4,FALSE) -> 49|49|49
G127: =VLOOKUP(RC[1]-0.1,C1:C2,2,TRUE)+1 -> 53 | H127: 125 | I127: =R2C7&HLOOKUP(R2C[-6],R2C[-6]:R150C[-6],RC7+2,FALSE)&R2C7&"|"&R2C7&HLOOKUP(R2C[-6],R2C[-6]:R150C[-6],RC7+3,FALSE)&R2C7&"|"&R2C7&HLOOKUP(R2C[-6],R2C[-6]:R150C[-6],RC7+4,FALSE)&R2C7 -> "暂无后续"|"暂无后续"|"暂无后续" | J127: =R2C7&HLOOKUP(R2C[-6],R2C[-6]:R150C[-6],RC7+2,FALSE)&R2C7&"|"&R2C7&HLOOKUP(R2C[-6],R2C[-6]:R150C[-6],RC7+3,FALSE)&R2C7&"|"&R2C7&HLOOKUP(R2C[-6],R2C[-6]:R150C[-6],RC7+4,FALSE)&R2C7 -> "敬请期待"|"敬请期待"|"敬请期待" | K127: =HLOOKUP(R2C[-6],R2C[-6]:R150C[-6],RC7+2,FALSE)&"|"&HLOOKUP(R2C[-6],R2C[-6]:R150C[-6],RC7+3,FALSE)&"|"&HLOOKUP(R2C[-6],R2C[-6]:R150C[-6],RC7+4,FALSE) -> 150|150|150 | L127: =HLOOKUP(R2C[-6],R2C[-6]:R150C[-6],RC7+2,FALSE)&"|"&HLOOKUP(R2C[-6],R2C[-6]:R150C[-6],RC7+3,FALSE)&"|"&HLOOKUP(R2C[-6],R2C[-6]:R150C[-6],RC7+4,FALSE) -> 49|49|49
G128: =VLOOKUP(RC[1]-0.1,C1:C2,2,TRUE)+1 -> 53 | H128: 126 | I128: =R2C7&HLOOKUP(R2C[-6],R2C[-6]:R150C[-6],RC7+2,FALSE)&R2C7&"|"&R2C7&HLOOKUP(R2C[-6],R2C[-6]:R150C[-6],RC7+3,FALSE)&R2C7&"|"&R2C7&HLOOKUP(R2C[-6],R2C[-6]:R150C[-6],RC7+4,FALSE)&R2C7 -> "暂无后续"|"暂无后续"|"暂无后续" | J128: =R2C7&HLOOKUP(R2C[-6],R2C[-6]:R150C[-6],RC7+2,FALSE)&R2C7&"|"&R2C7&HLOOKUP(R2C[-6],R2C[-6]:R150C[-6],RC7+3,FALSE)&R2C7&"|"&R2C7&HLOOKUP(R2C[-6],R2C[-6]:R150C[-6],RC7+4,FALSE)&R2C7 -> "敬请期待"|"敬请期待"|"敬请期待" | K128: =HLOOKUP(R2C[-6],R2C[-6]:R150C[-6],RC7+2,FALSE)&"|"&HLOOKUP(R2C[-6],R2C[-6]:R150C[-6],RC7+3,FALSE)&"|"&HLOOKUP(R2C[-6],R2C[-6]:R150C[-6],RC7+4,FALSE) -> 150|150|150 | L128: =HLOOKUP(R2C[-6],R2C[-6]:R150C[-6],RC7+2,FALSE)&"|"&HLOOKUP(R2C[-6],R2C[-6]:R150C[-6],RC7+3,FALSE)&"|"&HLOOKUP(R2C[-6],R2C[-6]:R150C[-6],RC7+4,FALSE) -> 49|49|49
G129: =VLOOKUP(RC[1]-0.1,C1:C2,2,TRUE)+1 -> 53 | H129: 127 | I129: =R2C7&HLOOKUP(R2C[-6],R2C[-6]:R150C[-6],RC7+2,FALSE)&R2C7&"|"&R2C7&HLOOKUP(R2C[-6],R2C[-6]:R150C[-6],RC7+3,FALSE)&R2C7&"|"&R2C7&HLOOKUP(R2C[-6],R2C[-6]:R150C[-6],RC7+4,FALSE)&R2C7 -> "暂无后续"|"暂无后续"|"暂无后续" | J129: =R2C7&HLOOKUP(R2C[-6],R2C[-6]:R150C[-6],RC7+2,FALSE)&R2C7&"|"&R2C7&HLOOKUP(R2C[-6],R2C[-6]:R150C[-6],RC7+3,FALSE)&R2C7&"|"&R2C7&HLOOKUP(R2C[-6],R2C[-6]:R150C[-6],RC7+4,FALSE)&R2C7 -> "敬请期待"|"敬请期待"|"敬请期待" | K129: =HLOOKUP(R2C[-6],R2C[-6]:R150C[-6],RC7+2,FALSE)&"|"&HLOOKUP(R2C[-6],R2C[-6]:R150C[-6],RC7+3,FALSE)&"|"&HLOOKUP(R2C[-6],R2C[-6]:R150C[-6],RC7+4,FALSE) -> 150|150|150 | L129: =HLOOKUP(R2C[-6],R2C[-6]:R150C[-6],RC7+2,FALSE)&"|"&HLOOKUP(R2C[-6],R2C[-6]:R150C[-6],RC7+3,FALSE)&"|"&HLOOKUP(R2C[-6],R2C[-6]:R150C[-6],RC7+4,FALSE) -> 49|49|49
G130: =VLOOKUP(RC[1]-0.1,C1:C2,2,TRUE)+1 -> 53 | H130: 128 | I130: =R2C7&HLOOKUP(R2C[-6],R2C[-6]:R150C[-6],RC7+2,FALSE)&R2C7&"|"&R2C7&HLOOKUP(R2C[-6],R2C[-6]:R150C[-6],RC7+3,FALSE)&R2C7&"|"&R2C7&HLOOKUP(R2C[-6],R2C[-6]:R150C[-6],RC7+4,FALSE)&R2C7 -> "暂无后续"|"暂无后续"|"暂无后续" | J130: =R2C7&HLOOKUP(R2C[-6],R2C[-6]:R150C[-6],RC7+2,FALSE)&R2C7&"|"&R2C7&HLOOKUP(R2C[-6],R2C[-6]:R150C[-6],RC7+3,FALSE)&R2C7&"|"&R2C7&HLOOKUP(R2C[-6],R2C[-6]:R150C[-6],RC7+4,FALSE)&R2C7 -> "敬请期待"|"敬请期待"|"敬请期待" | K130: =HLOOKUP(R2C[-6],R2C[-6]:R150C[-6],RC7+2,FALSE)&"|"&HLOOKUP(R2C[-6],R2C[-6]:R150C[-6],RC7+3,FALSE)&"|"&HLOOKUP(R2C[-6],R2C[-6]:R150C[-6],RC7+4,FALSE) -> 150|150|150 | L130: =HLOOKUP(R2C[-6],R2C[-6]:R150C[-6],RC7+2,FALSE)&"|"&HLOOKUP(R2C[-6],R2C[-6]:R150C[-6],RC7+3,FALSE)&"|"&HLOOKUP(R2C[-6],R2C[-6]:R150C[-6],RC7+4,FALSE) -> 49|49|49
G131: =VLOOKUP(RC[1]-0.1,C1:C2,2,TRUE)+1 -> 53 | H131: 129 | I131: =R2C7&HLOOKUP(R2C[-6],R2C[-6]:R150C[-6],RC7+2,FALSE)&R2C7&"|"&R2C7&HLOOKUP(R2C[-6],R2C[-6]:R150C[-6],RC7+3,FALSE)&R2C7&"|"&R2C7&HLOOKUP(R2C[-6],R2C[-6]:R150C[-6],RC7+4,FALSE)&R2C7 -> "暂无后续"|"暂无后续"|"暂无后续" | J131: =R2C7&HLOOKUP(R2C[-6],R2C[-6]:R150C[-6],RC7+2,FALSE)&R2C7&"|"&R2C7&HLOOKUP(R2C[-6],R2C[-6]:R150C[-6],RC7+3,FALSE)&R2C7&"|"&R2C7&HLOOKUP(R2C[-6],R2C[-6]:R150C[-6],RC7+4,FALSE)&R2C7 -> "敬请期待"|"敬请期待"|"敬请期待" | K131: =HLOOKUP(R2C[-6],R2C[-6]:R150C[-6],RC7+2,FALSE)&"|"&HLOOKUP(R2C[-6],R2C[-6]:R150C[-6],RC7+3,FALSE)&"|"&HLOOKUP(R2C[-6],R2C[-6]:R150C[-6],RC7+4,FALSE) -> 150|150|150 | L131: =HLOOKUP(R2C[-6],R2C[-6]:R150C[-6],RC7+2,FALSE)&"|"&HLOOKUP(R2C[-6],R2C[-6]:R150C[-6],RC7+3,FALSE)&"|"&HLOOKUP(R2C[-6],R2C[-6]:R150C[-6],RC7+4,FALSE) -> 49|49|49
G132: =VLOOKUP(RC[1]-0.1,C1:C2,2,TRUE)+1 -> 53 | H132: 130 | I132: =R2C7&HLOOKUP(R2C[-6],R2C[-6]:R150C[-6],RC7+2,FALSE)&R2C7&"|"&R2C7&HLOOKUP(R2C[-6],R2C[-6]:R150C[-6],RC7+3,FALSE)&R2C7&"|"&R2C7&HLOOKUP(R2C[-6],R2C[-6]:R150C[-6],RC7+4,FALSE)&R2C7 -> "暂无后续"|"暂无后续"|"暂无后续" | J132: =R2C7&HLOOKUP(R2C[-6],R2C[-6]:R150C[-6],RC7+2,FALSE)&R2C7&"|"&R2C7&HLOOKUP(R2C[-6],R2C[-6]:R150C[-6],RC7+3,FALSE)&R2C7&"|"&R2C7&HLOOKUP(R2C[-6],R2C[-6]:R150C[-6],RC7+4,FALSE)&R2C7 -> "敬请期待"|"敬请期待"|"敬请期待" | K132: =HLOOKUP(R2C[-6],R2C[-6]:R150C[-6],RC7+2,FALSE)&"|"&HLOOKUP(R2C[-6],R2C[-6]:R150C[-6],RC7+3,FALSE)&"|"&HLOOKUP(R2C[-6],R2C[-6]:R150C[-6],RC7+4,FALSE) -> 150|150|150 | L132: =HLOOKUP(R2C[-6],R2C[-6]:R150C[-6],RC7+2,FALSE)&"|"&HLOOKUP(R2C[-6],R2C[-6]:R150C[-6],RC7+3,FALSE)&"|"&HLOOKUP(R2C[-6],R2C[-6]:R150C[-6],RC7+4,FALSE) -> 49|49|49
G133: =VLOOKUP(RC[1]-0.1,C1:C2,2,TRUE)+1 -> 53 | H133: 131 | I133: =R2C7&HLOOKUP(R2C[-6],R2C[-6]:R150C[-6],RC7+2,FALSE)&R2C7&"|"&R2C7&HLOOKUP(R2C[-6],R2C[-6]:R150C[-6],RC7+3,FALSE)&R2C7&"|"&R2C7&HLOOKUP(R2C[-6],R2C[-6]:R150C[-6],RC7+4,FALSE)&R2C7 -> "暂无后续"|"暂无后续"|"暂无后续" | J133: =R2C7&HLOOKUP(R2C[-6],R2C[-6]:R150C[-6],RC7+2,FALSE)&R2C7&"|"&R2C7&HLOOKUP(R2C[-6],R2C[-6]:R150C[-6],RC7+3,FALSE)&R2C7&"|"&R2C7&HLOOKUP(R2C[-6],R2C[-6]:R150C[-6],RC7+4,FALSE)&R2C7 -> "敬请期待"|"敬请期待"|"敬请期待" | K133: =HLOOKUP(R2C[-6],R2C[-6]:R150C[-6],RC7+2,FALSE)&"|"&HLOOKUP(R2C[-6],R2C[-6]:R150C[-6],RC7+3,FALSE)&"|"&HLOOKUP(R2C[-6],R2C[-6]:R150C[-6],RC7+4,FALSE) -> 150|150|150 | L133: =HLOOKUP(R2C[-6],R2C[-6]:R150C[-6],RC7+2,FALSE)&"|"&HLOOKUP(R2C[-6],R2C[-6]:R150C[-6],RC7+3,FALSE)&"|"&HLOOKUP(R2C[-6],R2C[-6]:R150C[-6],RC7+4,FALSE) -> 49|49|49
G134: =VLOOKUP(RC[1]-0.1,C1:C2,2,TRUE)+1 -> 53 | H134: 132 | I134: =R2C7&HLOOKUP(R2C[-6],R2C[-6]:R150C[-6],RC7+2,FALSE)&R2C7&"|"&R2C7&HLOOKUP(R2C[-6],R2C[-6]:R150C[-6],RC7+3,FALSE)&R2C7&"|"&R2C7&HLOOKUP(R2C[-6],R2C[-6]:R150C[-6],RC7+4,FALSE)&R2C7 -> "暂无后续"|"暂无后续"|"暂无后续" | J134: =R2C7&HLOOKUP(R2C[-6],R2C[-6]:R150C[-6],RC7+2,FALSE)&R2C7&"|"&R2C7&HLOOKUP(R2C[-6],R2C[-6]:R150C[-6],RC7+3,FALSE)&R2C7&"|"&R2C7&HLOOKUP(R2C[-6],R2C[-6]:R150C[-6],RC7+4,FALSE)&R2C7 -> "敬请期待"|"敬请期待"|"敬请期待" | K134: =HLOOKUP(R2C[-6],R2C[-6]:R150C[-6],RC7+2,FALSE)&"|"&HLOOKUP(R2C[-6],R2C[-6]:R150C[-6],RC7+3,FALSE)&"|"&HLOOKUP(R2C[-6],R2C[-6]:R150C[-6],RC7+4,FALSE) -> 150|150|150 | L134: =HLOOKUP(R2C[-6],R2C[-6]:R150C[-6],RC7+2,FALSE)&"|"&HLOOKUP(R2C[-6],R2C[-6]:R150C[-6],RC7+3,FALSE)&"|"&HLOOKUP(R2C[-6],R2C[-6]:R150C[-6],RC7+4,FALSE) -> 49|49|49
G135: =VLOOKUP(RC[1]-0.1,C1:C2,2,TRUE)+1 -> 53 | H135: 133 | I135: =R2C7&HLOOKUP(R2C[-6],R2C[-6]:R150C[-6],RC7+2,FALSE)&R2C7&"|"&R2C7&HLOOKUP(R2C[-6],R2C[-6]:R150C[-6],RC7+3,FALSE)&R2C7&"|"&R2C7&HLOOKUP(R2C[-6],R2C[-6]:R150C[-6],RC7+4,FALSE)&R2C7 -> "暂无后续"|"暂无后续"|"暂无后续" | J135: =R2C7&HLOOKUP(R2C[-6],R2C[-6]:R150C[-6],RC7+2,FALSE)&R2C7&"|"&R2C7&HLOOKUP(R2C[-6],R2C[-6]:R150C[-6],RC7+3,FALSE)&R2C7&"|"&R2C7&HLOOKUP(R2C[-6],R2C[-6]:R150C[-6],RC7+4,FALSE)&R2C7 -> "敬请期待"|"敬请期待"|"敬请期待" | K135: =HLOOKUP(R2C[-6],R2C[-6]:R150C[-6],RC7+2,FALSE)&"|"&HLOOKUP(R2C[-6],R2C[-6]:R150C[-6],RC7+3,FALSE)&"|"&HLOOKUP(R2C[-6],R2C[-6]:R150C[-6],RC7+4,FALSE) -> 150|150|150 | L135: =HLOOKUP(R2C[-6],R2C[-6]:R150C[-6],RC7+2,FALSE)&"|"&HLOOKUP(R2C[-6],R2C[-6]:R150C[-6],RC7+3,FALSE)&"|"&HLOOKUP(R2C[-6],R2C[-6]:R150C[-6],RC7+4,FALSE) -> 49|49|49
G136: =VLOOKUP(RC[1]-0.1,C1:C2,2,TRUE)+1 -> 53 | H136: 134 | I136: =R2C7&HLOOKUP(R2C[-6],R2C[-6]:R150C[-6],RC7+2,FALSE)&R2C7&"|"&R2C7&HLOOKUP(R2C[-6],R2C[-6]:R150C[-6],RC7+3,FALSE)&R2C7&"|"&R2C7&HLOOKUP(R2C[-6],R2C[-6]:R150C[-6],RC7+4,FALSE)&R2C7 -> "暂无后续"|"暂无后续"|"暂无后续" | J136: =R2C7&HLOOKUP(R2C[-6],R2C[-6]:R150C[-6],RC7+2,FALSE)&R2C7&"|"&R2C7&HLOOKUP(R2C[-6],R2C[-6]:R150C[-6],RC7+3,FALSE)&R2C7&"|"&R2C7&HLOOKUP(R2C[-6],R2C[-6]:R150C[-6],RC7+4,FALSE)&R2C7 -> "敬请期待"|"敬请期待"|"敬请期待" | K136: =HLOOKUP(R2C[-6],R2C[-6]:R150C[-6],RC7+2,FALSE)&"|"&HLOOKUP(R2C[-6],R2C[-6]:R150C[-6],RC7+3,FALSE)&"|"&HLOOKUP(R2C[-6],R2C[-6]:R150C[-6],RC7+4,FALSE) -> 150|150|150 | L136: =HLOOKUP(R2C[-6],R2C[-6]:R150C[-6],RC7+2,FALSE)&"|"&HLOOKUP(R2C[-6],R2C[-6]:R150C[-6],RC7+3,FALSE)&"|"&HLOOKUP(R2C[-6],R2C[-6]:R150C[-6],RC7+4,FALSE) -> 49|49|49
G137: =VLOOKUP(RC[1]-0.1,C1:C2,2,TRUE)+1 -> 53 | H137: 135 | I137: =R2C7&HLOOKUP(R2C[-6],R2C[-6]:R150C[-6],RC7+2,FALSE)&R2C7&"|"&R2C7&HLOOKUP(R2C[-6],R2C[-6]:R150C[-6],RC7+3,FALSE)&R2C7&"|"&R2C7&HLOOKUP(R2C[-6],R2C[-6]:R150C[-6],RC7+4,FALSE)&R2C7 -> "暂无后续"|"暂无后续"|"暂无后续" | J137: =R2C7&HLOOKUP(R2C[-6],R2C[-6]:R150C[-6],RC7+2,FALSE)&R2C7&"|"&R2C7&HLOOKUP(R2C[-6],R2C[-6]:R150C[-6],RC7+3,FALSE)&R2C7&"|"&R2C7&HLOOKUP(R2C[-6],R2C[-6]:R150C[-6],RC7+4,FALSE)&R2C7 -> "敬请期待"|"敬请期待"|"敬请期待" | K137: =HLOOKUP(R2C[-6],R2C[-6]:R150C[-6],RC7+2,FALSE)&"|"&HLOOKUP(R2C[-6],R2C[-6]:R150C[-6],RC7+3,FALSE)&"|"&HLOOKUP(R2C[-6],R2C[-6]:R150C[-6],RC7+4,FALSE) -> 150|150|150 | L137: =HLOOKUP(R2C[-6],R2C[-6]:R150C[-6],RC7+2,FALSE)&"|"&HLOOKUP(R2C[-6],R2C[-6]:R150C[-6],RC7+3,FALSE)&"|"&HLOOKUP(R2C[-6],R2C[-6]:R150C[-6],RC7+4,FALSE) -> 49|49|49
G138: =VLOOKUP(RC[1]-0.1,C1:C2,2,TRUE)+1 -> 53 | H138: 136 | I138: =R2C7&HLOOKUP(R2C[-6],R2C[-6]:R150C[-6],RC7+2,FALSE)&R2C7&"|"&R2C7&HLOOKUP(R2C[-6],R2C[-6]:R150C[-6],RC7+3,FALSE)&R2C7&"|"&R2C7&HLOOKUP(R2C[-6],R2C[-6]:R150C[-6],RC7+4,FALSE)&R2C7 -> "暂无后续"|"暂无后续"|"暂无后续" | J138: =R2C7&HLOOKUP(R2C[-6],R2C[-6]:R150C[-6],RC7+2,FALSE)&R2C7&"|"&R2C7&HLOOKUP(R2C[-6],R2C[-6]:R150C[-6],RC7+3,FALSE)&R2C7&"|"&R2C7&HLOOKUP(R2C[-6],R2C[-6]:R150C[-6],RC7+4,FALSE)&R2C7 -> "敬请期待"|"敬请期待"|"敬请期待" | K138: =HLOOKUP(R2C[-6],R2C[-6]:R150C[-6],RC7+2,FALSE)&"|"&HLOOKUP(R2C[-6],R2C[-6]:R150C[-6],RC7+3,FALSE)&"|"&HLOOKUP(R2C[-6],R2C[-6]:R150C[-6],RC7+4,FALSE) -> 150|150|150 | L138: =HLOOKUP(R2C[-6],R2C[-6]:R150C[-6],RC7+2,FALSE)&"|"&HLOOKUP(R2C[-6],R2C[-6]:R150C[-6],RC7+3,FALSE)&"|"&HLOOKUP(R2C[-6],R2C[-6]:R150C[-6],RC7+4,FALSE) -> 49|49|49
G139: =VLOOKUP(RC[1]-0.1,C1:C2,2,TRUE)+1 -> 53 | H139: 137 | I139: =R2C7&HLOOKUP(R2C[-6],R2C[-6]:R150C[-6],RC7+2,FALSE)&R2C7&"|"&R2C7&HLOOKUP(R2C[-6],R2C[-6]:R150C[-6],RC7+3,FALSE)&R2C7&"|"&R2C7&HLOOKUP(R2C[-6],R2C[-6]:R150C[-6],RC7+4,FALSE)&R2C7 -> "暂无后续"|"暂无后续"|"暂无后续" | J139: =R2C7&HLOOKUP(R2C[-6],R2C[-6]:R150C[-6],RC7+2,FALSE)&R2C7&"|"&R2C7&HLOOKUP(R2C[-6],R2C[-6]:R150C[-6],RC7+3,FALSE)&R2C7&"|"&R2C7&HLOOKUP(R2C[-6],R2C[-6]:R150C[-6],RC7+4,FALSE)&R2C7 -> "敬请期待"|"敬请期待"|"敬请期待" | K139: =HLOOKUP(R2C[-6],R2C[-6]:R150C[-6],RC7+2,FALSE)&"|"&HLOOKUP(R2C[-6],R2C[-6]:R150C[-6],RC7+3,FALSE)&"|"&HLOOKUP(R2C[-6],R2C[-6]:R150C[-6],RC7+4,FALSE) -> 150|150|150 | L139: =HLOOKUP(R2C[-6],R2C[-6]:R150C[-6],RC7+2,FALSE)&"|"&HLOOKUP(R2C[-6],R2C[-6]:R150C[-6],RC7+3,FALSE)&"|"&HLOOKUP(R2C[-6],R2C[-6]:R150C[-6],RC7+4,FALSE) -> 49|49|49
G140: =VLOOKUP(RC[1]-0.1,C1:C2,2,TRUE)+1 -> 53 | H140: 138 | I140: =R2C7&HLOOKUP(R2C[-6],R2C[-6]:R150C[-6],RC7+2,FALSE)&R2C7&"|"&R2C7&HLOOKUP(R2C[-6],R2C[-6]:R150C[-6],RC7+3,FALSE)&R2C7&"|"&R2C7&HLOOKUP(R2C[-6],R2C[-6]:R150C[-6],RC7+4,FALSE)&R2C7 -> "暂无后续"|"暂无后续"|"暂无后续" | J140: =R2C7&HLOOKUP(R2C[-6],R2C[-6]:R150C[-6],RC7+2,FALSE)&R2C7&"|"&R2C7&HLOOKUP(R2C[-6],R2C[-6]:R150C[-6],RC7+3,FALSE)&R2C7&"|"&R2C7&HLOOKUP(R2C[-6],R2C[-6]:R150C[-6],RC7+4,FALSE)&R2C7 -> "敬请期待"|"敬请期待"|"敬请期待" | K140: =HLOOKUP(R2C[-6],R2C[-6]:R150C[-6],RC7+2,FALSE)&"|"&HLOOKUP(R2C[-6],R2C[-6]:R150C[-6],RC7+3,FALSE)&"|"&HLOOKUP(R2C[-6],R2C[-6]:R150C[-6],RC7+4,FALSE) -> 150|150|150 | L140: =HLOOKUP(R2C[-6],R2C[-6]:R150C[-6],RC7+2,FALSE)&"|"&HLOOKUP(R2C[-6],R2C[-6]:R150C[-6],RC7+3,FALSE)&"|"&HLOOKUP(R2C[-6],R2C[-6]:R150C[-6],RC7+4,FALSE) -> 49|49|49
G141: =VLOOKUP(RC[1]-0.1,C1:C2,2,TRUE)+1 -> 53 | H141: 139 | I141: =R2C7&HLOOKUP(R2C[-6],R2C[-6]:R150C[-6],RC7+2,FALSE)&R2C7&"|"&R2C7&HLOOKUP(R2C[-6],R2C[-6]:R150C[-6],RC7+3,FALSE)&R2C7&"|"&R2C7&HLOOKUP(R2C[-6],R2C[-6]:R150C[-6],RC7+4,FALSE)&R2C7 -> "暂无后续"|"暂无后续"|"暂无后续" | J141: =R2C7&HLOOKUP(R2C[-6],R2C[-6]:R150C[-6],RC7+2,FALSE)&R2C7&"|"&R2C7&HLOOKUP(R2C[-6],R2C[-6]:R150C[-6],RC7+3,FALSE)&R2C7&"|"&R2C7&HLOOKUP(R2C[-6],R2C[-6]:R150C[-6],RC7+4,FALSE)&R2C7 -> "敬请期待"|"敬请期待"|"敬请期待" | K141: =HLOOKUP(R2C[-6],R2C[-6]:R150C[-6],RC7+2,FALSE)&"|"&HLOOKUP(R2C[-6],R2C[-6]:R150C[-6],RC7+3,FALSE)&"|"&HLOOKUP(R2C[-6],R2C[-6]:R150C[-6],RC7+4,FALSE) -> 150|150|150 | L141: =HLOOKUP(R2C[-6],R2C[-6]:R150C[-6],RC7+2,FALSE)&"|"&HLOOKUP(R2C[-6],R2C[-6]:R150C[-6],RC7+3,FALSE)&"|"&HLOOKUP(R2C[-6],R2C[-6]:R150C[-6],RC7+4,FALSE) -> 49|49|49
G142: =VLOOKUP(RC[1]-0.1,C1:C2,2,TRUE)+1 -> 53 | H142: 140 | I142: =R2C7&HLOOKUP(R2C[-6],R2C[-6]:R150C[-6],RC7+2,FALSE)&R2C7&"|"&R2C7&HLOOKUP(R2C[-6],R2C[-6]:R150C[-6],RC7+3,FALSE)&R2C7&"|"&R2C7&HLOOKUP(R2C[-6],R2C[-6]:R150C[-6],RC7+4,FALSE)&R2C7 -> "暂无后续"|"暂无后续"|"暂无后续" | J142: =R2C7&HLOOKUP(R2C[-6],R2C[-6]:R150C[-6],RC7+2,FALSE)&R2C7&"|"&R2C7&HLOOKUP(R2C[-6],R2C[-6]:R150C[-6],RC7+3,FALSE)&R2C7&"|"&R2C7&HLOOKUP(R2C[-6],R2C[-6]:R150C[-6],RC7+4,FALSE)&R2C7 -> "敬请期待"|"敬请期待"|"敬请期待" | K142: =HLOOKUP(R2C[-6],R2C[-6]:R150C[-6],RC7+2,FALSE)&"|"&HLOOKUP(R2C[-6],R2C[-6]:R150C[-6],RC7+3,FALSE)&"|"&HLOOKUP(R2C[-6],R2C[-6]:R150C[-6],RC7+4,FALSE) -> 150|150|150 | L142: =HLOOKUP(R2C[-6],R2C[-6]:R150C[-6],RC7+2,FALSE)&"|"&HLOOKUP(R2C[-6],R2C[-6]:R150C[-6],RC7+3,FALSE)&"|"&HLOOKUP(R2C[-6],R2C[-6]:R150C[-6],RC7+4,FALSE) -> 49|49|49
G143: =VLOOKUP(RC[1]-0.1,C1:C2,2,TRUE)+1 -> 53 | H143: 141 | I143: =R2C7&HLOOKUP(R2C[-6],R2C[-6]:R150C[-6],RC7+2,FALSE)&R2C7&"|"&R2C7&HLOOKUP(R2C[-6],R2C[-6]:R150C[-6],RC7+3,FALSE)&R2C7&"|"&R2C7&HLOOKUP(R2C[-6],R2C[-6]:R150C[-6],RC7+4,FALSE)&R2C7 -> "暂无后续"|"暂无后续"|"暂无后续" | J143: =R2C7&HLOOKUP(R2C[-6],R2C[-6]:R150C[-6],RC7+2,FALSE)&R2C7&"|"&R2C7&HLOOKUP(R2C[-6],R2C[-6]:R150C[-6],RC7+3,FALSE)&R2C7&"|"&R2C7&HLOOKUP(R2C[-6],R2C[-6]:R150C[-6],RC7+4,FALSE)&R2C7 -> "敬请期待"|"敬请期待"|"敬请期待" | K143: =HLOOKUP(R2C[-6],R2C[-6]:R150C[-6],RC7+2,FALSE)&"|"&HLOOKUP(R2C[-6],R2C[-6]:R150C[-6],RC7+3,FALSE)&"|"&HLOOKUP(R2C[-6],R2C[-6]:R150C[-6],RC7+4,FALSE) -> 150|150|150 | L143: =HLOOKUP(R2C[-6],R2C[-6]:R150C[-6],RC7+2,FALSE)&"|"&HLOOKUP(R2C[-6],R2C[-6]:R150C[-6],RC7+3,FALSE)&"|"&HLOOKUP(R2C[-6],R2C[-6]:R150C[-6],RC7+4,FALSE) -> 49|49|49
G144: =VLOOKUP(RC[1]-0.1,C1:C2,2,TRUE)+1 -> 53 | H144: 142 | I144: =R2C7&HLOOKUP(R2C[-6],R2C[-6]:R150C[-6],RC7+2,FALSE)&R2C7&"|"&R2C7&HLOOKUP(R2C[-6],R2C[-6]:R150C[-6],RC7+3,FALSE)&R2C7&"|"&R2C7&HLOOKUP(R2C[-6],R2C[-6]:R150C[-6],RC7+4,FALSE)&R2C7 -> "暂无后续"|"暂无后续"|"暂无后续" | J144: =R2C7&HLOOKUP(R2C[-6],R2C[-6]:R150C[-6],RC7+2,FALSE)&R2C7&"|"&R2C7&HLOOKUP(R2C[-6],R2C[-6]:R150C[-6],RC7+3,FALSE)&R2C7&"|"&R2C7&HLOOKUP(R2C[-6],R2C[-6]:R150C[-6],RC7+4,FALSE)&R2C7 -> "敬请期待"|"敬请期待"|"敬请期待" | K144: =HLOOKUP(R2C[-6],R2C[-6]:R150C[-6],RC7+2,FALSE)&"|"&HLOOKUP(R2C[-6],R2C[-6]:R150C[-6],RC7+3,FALSE)&"|"&HLOOKUP(R2C[-6],R2C[-6]:R150C[-6],RC7+4,FALSE) -> 150|150|150 | L144: =HLOOKUP(R2C[-6],R2C[-6]:R150C[-6],RC7+2,FALSE)&"|"&HLOOKUP(R2C[-6],R2C[-6]:R150C[-6],RC7+3,FALSE)&"|"&HLOOKUP(R2C[-6],R2C[-6]:R150C[-6],RC7+4,FALSE) -> 49|49|49
G145: =VLOOKUP(RC[1]-0.1,C1:C2,2,TRUE)+1 -> 53 | H145: 143 | I145: =R2C7&HLOOKUP(R2C[-6],R2C[-6]:R150C[-6],RC7+2,FALSE)&R2C7&"|"&R2C7&HLOOKUP(R2C[-6],R2C[-6]:R150C[-6],RC7+3,FALSE)&R2C7&"|"&R2C7&HLOOKUP(R2C[-6],R2C[-6]:R150C[-6],RC7+4,FALSE)&R2C7 -> "暂无后续"|"暂无后续"|"暂无后续" | J145: =R2C7&HLOOKUP(R2C[-6],R2C[-6]:R150C[-6],RC7+2,FALSE)&R2C7&"|"&R2C7&HLOOKUP(R2C[-6],R2C[-6]:R150C[-6],RC7+3,FALSE)&R2C7&"|"&R2C7&HLOOKUP(R2C[-6],R2C[-6]:R150C[-6],RC7+4,FALSE)&R2C7 -> "敬请期待"|"敬请期待"|"敬请期待" | K145: =HLOOKUP(R2C[-6],R2C[-6]:R150C[-6],RC7+2,FALSE)&"|"&HLOOKUP(R2C[-6],R2C[-6]:R150C[-6],RC7+3,FALSE)&"|"&HLOOKUP(R2C[-6],R2C[-6]:R150C[-6],RC7+4,FALSE) -> 150|150|150 | L145: =HLOOKUP(R2C[-6],R2C[-6]:R150C[-6],RC7+2,FALSE)&"|"&HLOOKUP(R2C[-6],R2C[-6]:R150C[-6],RC7+3,FALSE)&"|"&HLOOKUP(R2C[-6],R2C[-6]:R150C[-6],RC7+4,FALSE) -> 49|49|49
G146: =VLOOKUP(RC[1]-0.1,C1:C2,2,TRUE)+1 -> 53 | H146: 144 | I146: =R2C7&HLOOKUP(R2C[-6],R2C[-6]:R150C[-6],RC7+2,FALSE)&R2C7&"|"&R2C7&HLOOKUP(R2C[-6],R2C[-6]:R150C[-6],RC7+3,FALSE)&R2C7&"|"&R2C7&HLOOKUP(R2C[-6],R2C[-6]:R150C[-6],RC7+4,FALSE)&R2C7 -> "暂无后续"|"暂无后续"|"暂无后续" | J146: =R2C7&HLOOKUP(R2C[-6],R2C[-6]:R150C[-6],RC7+2,FALSE)&R2C7&"|"&R2C7&HLOOKUP(R2C[-6],R2C[-6]:R150C[-6],RC7+3,FALSE)&R2C7&"|"&R2C7&HLOOKUP(R2C[-6],R2C[-6]:R150C[-6],RC7+4,FALSE)&R2C7 -> "敬请期待"|"敬请期待"|"敬请期待" | K146: =HLOOKUP(R2C[-6],R2C[-6]:R150C[-6],RC7+2,FALSE)&"|"&HLOOKUP(R2C[-6],R2C[-6]:R150C[-6],RC7+3,FALSE)&"|"&HLOOKUP(R2C[-6],R2C[-6]:R150C[-6],RC7+4,FALSE) -> 150|150|150 | L146: =HLOOKUP(R2C[-6],R2C[-6]:R150C[-6],RC7+2,FALSE)&"|"&HLOOKUP(R2C[-6],R2C[-6]:R150C[-6],RC7+3,FALSE)&"|"&HLOOKUP(R2C[-6],R2C[-6]:R150C[-6],RC7+4,FALSE) -> 49|49|49
G147: =VLOOKUP(RC[1]-0.1,C1:C2,2,TRUE)+1 -> 53 | H147: 145 | I147: =R2C7&HLOOKUP(R2C[-6],R2C[-6]:R150C[-6],RC7+2,FALSE)&R2C7&"|"&R2C7&HLOOKUP(R2C[-6],R2C[-6]:R150C[-6],RC7+3,FALSE)&R2C7&"|"&R2C7&HLOOKUP(R2C[-6],R2C[-6]:R150C[-6],RC7+4,FALSE)&R2C7 -> "暂无后续"|"暂无后续"|"暂无后续" | J147: =R2C7&HLOOKUP(R2C[-6],R2C[-6]:R150C[-6],RC7+2,FALSE)&R2C7&"|"&R2C7&HLOOKUP(R2C[-6],R2C[-6]:R150C[-6],RC7+3,FALSE)&R2C7&"|"&R2C7&HLOOKUP(R2C[-6],R2C[-6]:R150C[-6],RC7+4,FALSE)&R2C7 -> "敬请期待"|"敬请期待"|"敬请期待" | K147: =HLOOKUP(R2C[-6],R2C[-6]:R150C[-6],RC7+2,FALSE)&"|"&HLOOKUP(R2C[-6],R2C[-6]:R150C[-6],RC7+3,FALSE)&"|"&HLOOKUP(R2C[-6],R2C[-6]:R150C[-6],RC7+4,FALSE) -> 150|150|150 | L147: =HLOOKUP(R2C[-6],R2C[-6]:R150C[-6],RC7+2,FALSE)&"|"&HLOOKUP(R2C[-6],R2C[-6]:R150C[-6],RC7+3,FALSE)&"|"&HLOOKUP(R2C[-6],R2C[-6]:R150C[-6],RC7+4,FALSE) -> 49|49|49
G148: =VLOOKUP(RC[1]-0.1,C1:C2,2,TRUE)+1 -> 53 | H148: 146 | I148: =R2C7&HLOOKUP(R2C[-6],R2C[-6]:R150C[-6],RC7+2,FALSE)&R2C7&"|"&R2C7&HLOOKUP(R2C[-6],R2C[-6]:R150C[-6],RC7+3,FALSE)&R2C7&"|"&R2C7&HLOOKUP(R2C[-6],R2C[-6]:R150C[-6],RC7+4,FALSE)&R2C7 -> "暂无后续"|"暂无后续"|"暂无后续" | J148: =R2C7&HLOOKUP(R2C[-6],R2C[-6]:R150C[-6],RC7+2,FALSE)&R2C7&"|"&R2C7&HLOOKUP(R2C[-6],R2C[-6]:R150C[-6],RC7+3,FALSE)&R2C7&"|"&R2C7&HLOOKUP(R2C[-6],R2C[-6]:R150C[-6],RC7+4,FALSE)&R2C7 -> "敬请期待"|"敬请期待"|"敬请期待" | K148: =HLOOKUP(R2C[-6],R2C[-6]:R150C[-6],RC7+2,FALSE)&"|"&HLOOKUP(R2C[-6],R2C[-6]:R150C[-6],RC7+3,FALSE)&"|"&HLOOKUP(R2C[-6],R2C[-6]:R150C[-6],RC7+4,FALSE) -> 150|150|150 | L148: =HLOOKUP(R2C[-6],R2C[-6]:R150C[-6],RC7+2,FALSE)&"|"&HLOOKUP(R2C[-6],R2C[-6]:R150C[-6],RC7+3,FALSE)&"|"&HLOOKUP(R2C[-6],R2C[-6]:R150C[-6],RC7+4,FALSE) -> 49|49|49
G149: =VLOOKUP(RC[1]-0.1,C1:C2,2,TRUE)+1 -> 53 | H149: 147 | I149: =R2C7&HLOOKUP(R2C[-6],R2C[-6]:R150C[-6],RC7+2,FALSE)&R2C7&"|"&R2C7&HLOOKUP(R2C[-6],R2C[-6]:R150C[-6],RC7+3,FALSE)&R2C7&"|"&R2C7&HLOOKUP(R2C[-6],R2C[-6]:R150C[-6],RC7+4,FALSE)&R2C7 -> "暂无后续"|"暂无后续"|"暂无后续" | J149: =R2C7&HLOOKUP(R2C[-6],R2C[-6]:R150C[-6],RC7+2,FALSE)&R2C7&"|"&R2C7&HLOOKUP(R2C[-6],R2C[-6]:R150C[-6],RC7+3,FALSE)&R2C7&"|"&R2C7&HLOOKUP(R2C[-6],R2C[-6]:R150C[-6],RC7+4,FALSE)&R2C7 -> "敬请期待"|"敬请期待"|"敬请期待" | K149: =HLOOKUP(R2C[-6],R2C[-6]:R150C[-6],RC7+2,FALSE)&"|"&HLOOKUP(R2C[-6],R2C[-6]:R150C[-6],RC7+3,FALSE)&"|"&HLOOKUP(R2C[-6],R2C[-6]:R150C[-6],RC7+4,FALSE) -> 150|150|150 | L149: =HLOOKUP(R2C[-6],R2C[-6]:R150C[-6],RC7+2,FALSE)&"|"&HLOOKUP(R2C[-6],R2C[-6]:R150C[-6],RC7+3,FALSE)&"|"&HLOOKUP(R2C[-6],R2C[-6]:R150C[-6],RC7+4,FALSE) -> 49|49|49
G150: =VLOOKUP(RC[1]-0.1,C1:C2,2,TRUE)+1 -> 53 | H150: 148 | I150: =R2C7&HLOOKUP(R2C[-6],R2C[-6]:R150C[-6],RC7+2,FALSE)&R2C7&"|"&R2C7&HLOOKUP(R2C[-6],R2C[-6]:R150C[-6],RC7+3,FALSE)&R2C7&"|"&R2C7&HLOOKUP(R2C[-6],R2C[-6]:R150C[-6],RC7+4,FALSE)&R2C7 -> "暂无后续"|"暂无后续"|"暂无后续" | J150: =R2C7&HLOOKUP(R2C[-6],R2C[-6]:R150C[-6],RC7+2,FALSE)&R2C7&"|"&R2C7&HLOOKUP(R2C[-6],R2C[-6]:R150C[-6],RC7+3,FALSE)&R2C7&"|"&R2C7&HLOOKUP(R2C[-6],R2C[-6]:R150C[-6],RC7+4,FALSE)&R2C7 -> "敬请期待"|"敬请期待"|"敬请期待" | K150: =HLOOKUP(R2C[-6],R2C[-6]:R150C[-6],RC7+2,FALSE)&"|"&HLOOKUP(R2C[-6],R2C[-6]:R150C[-6],RC7+3,FALSE)&"|"&HLOOKUP(R2C[-6],R2C[-6]:R150C[-6],RC7+4,FALSE) -> 150|150|150 | L150: =HLOOKUP(R2C[-6],R2C[-6]:R150C[-6],RC7+2,FALSE)&"|"&HLOOKUP(R2C[-6],R2C[-6]:R150C[-6],RC7+3,FALSE)&"|"&HLOOKUP(R2C[-6],R2C[-6]:R150C[-6],RC7+4,FALSE) -> 49|49|49
G151: =VLOOKUP(RC[1]-0.1,C1:C2,2,TRUE)+1 -> 53 | H151: 149 | I151: =R2C7&HLOOKUP(R2C[-6],R2C[-6]:R150C[-6],RC7+2,FALSE)&R2C7&"|"&R2C7&HLOOKUP(R2C[-6],R2C[-6]:R150C[-6],RC7+3,FALSE)&R2C7&"|"&R2C7&HLOOKUP(R2C[-6],R2C[-6]:R150C[-6],RC7+4,FALSE)&R2C7 -> "暂无后续"|"暂无后续"|"暂无后续" | J151: =R2C7&HLOOKUP(R2C[-6],R2C[-6]:R150C[-6],RC7+2,FALSE)&R2C7&"|"&R2C7&HLOOKUP(R2C[-6],R2C[-6]:R150C[-6],RC7+3,FALSE)&R2C7&"|"&R2C7&HLOOKUP(R2C[-6],R2C[-6]:R150C[-6],RC7+4,FALSE)&R2C7 -> "敬请期待"|"敬请期待"|"敬请期待" | K151: =HLOOKUP(R2C[-6],R2C[-6]:R150C[-6],RC7+2,FALSE)&"|"&HLOOKUP(R2C[-6],R2C[-6]:R150C[-6],RC7+3,FALSE)&"|"&HLOOKUP(R2C[-6],R2C[-6]:R150C[-6],RC7+4,FALSE) -> 150|150|150 | L151: =HLOOKUP(R2C[-6],R2C[-6]:R150C[-6],RC7+2,FALSE)&"|"&HLOOKUP(R2C[-6],R2C[-6]:R150C[-6],RC7+3,FALSE)&"|"&HLOOKUP(R2C[-6],R2C[-6]:R150C[-6],RC7+4,FALSE) -> 49|49|49
G152: =VLOOKUP(RC[1]-0.1,C1:C2,2,TRUE)+1 -> 53 | H152: 150 | I152: =R2C7&HLOOKUP(R2C[-6],R2C[-6]:R150C[-6],RC7+2,FALSE)&R2C7&"|"&R2C7&HLOOKUP(R2C[-6],R2C[-6]:R150C[-6],RC7+3,FALSE)&R2C7&"|"&R2C7&HLOOKUP(R2C[-6],R2C[-6]:R150C[-6],RC7+4,FALSE)&R2C7 -> "暂无后续"|"暂无后续"|"暂无后续" | J152: =R2C7&HLOOKUP(R2C[-6],R2C[-6]:R150C[-6],RC7+2,FALSE)&R2C7&"|"&R2C7&HLOOKUP(R2C[-6],R2C[-6]:R150C[-6],RC7+3,FALSE)&R2C7&"|"&R2C7&HLOOKUP(R2C[-6],R2C[-6]:R150C[-6],RC7+4,FALSE)&R2C7 -> "敬请期待"|"敬请期待"|"敬请期待" | K152: =HLOOKUP(R2C[-6],R2C[-6]:R150C[-6],RC7+2,FALSE)&"|"&HLOOKUP(R2C[-6],R2C[-6]:R150C[-6],RC7+3,FALSE)&"|"&HLOOKUP(R2C[-6],R2C[-6]:R150C[-6],RC7+4,FALSE) -> 150|150|150 | L152: =HLOOKUP(R2C[-6],R2C[-6]:R150C[-6],RC7+2,FALSE)&"|"&HLOOKUP(R2C[-6],R2C[-6]:R150C[-6],RC7+3,FALSE)&"|"&HLOOKUP(R2C[-6],R2C[-6]:R150C[-6],RC7+4,FALSE) -> 49|49|49