Sheet: 配置
A1: 服务端文件名 | B1: 服务端对应工作表号 | C1: 客户端文件名 | D1: 客户端对应工作表号 | E1: erl头部 | F1: erl内容格式 | G1: erl尾部 | H1: 客户端特殊处理
A2: team_dungeon.txt | B2: 1 | C2: config_team_fb_chapter.cnf|TeamFBChapter | D2: 1 | F2: get(id) -> #$ | H2: 2=>dungeon_id
A3: team_dungeon_shop.txt | B3: 2 | C3: config_raw_gemstone_shop.cnf|RawGemstoneShop | D3: 2 | F3: get(id) -> #$ | H3: 2=>goods_id
A4: team_dungeon_lottery.txt | B4: 3 | C4: config_team_dungeon_lottery.cnf|TeamDungeonLottery | D4: 3 | F4: get(item_id) -> #$ | H4: 2=>item_id
A5: team_dungeon_task_link.txt | B5: 4 | C5: config_team_dungeon_task_link.cnf|TeamDungeonTaskLink | D5: 4 | F5: get(id) -> #$ | H5: 2=>id
A6: team_dungeon_task.txt | B6: 5 | C6: config_team_dungeon_task.cnf|TeamDungeonTask | D6: 5 | F6: get(id) -> #$ | H6: 2=>id
A7: team_dungeon_boss_reward.txt | B7: 6 | C7: config_team_dungeon_boss_reward.cnf|TeamDungeonBossReward | D7: 6 | F7: get(dungeon_id) -> #$ | H7: 1=>dungeon_id,index|energy_list
C8: config_team_npc_data.cnf|TeamNPCData | D8: 7 | H8: 2=>npc_id
C9: config_team_question_data.cnf|TeamQuestionData | D9: 8 | H9: 2=>question_id
C10: config_team_dungeon_quick_chat.cnf|TeamDungeonQuickChat | D10: 9 | H10: 2=>id
C11: config_team_dungeon_lottery_reward.cnf|TeamDungeonLotteryReward | D11: 10 | H11: 2=>id

Sheet: 1.组队副本
A1: dungeon_id|dungeon_id | B1: gamelevel_id| | C1: dungeon_name| | D1: dungeon_des| | E1: reward_prelook_list| | F1: recommend_level|recommend_level | G1: map_id|map_id | H1: task_list|task_list | I1: energy_limit| | J1: show_reward_list|
A2: 不可空 | B2: 不可空 | C2: 不可空 | D2: 不可空 | E2: 不可空 | F2: 不可空 | G2: 不可空 | H2: 不可空 | I2: 不可空 | J2: 不可空
A3: 数字 | B3: 数字 | C3: 字符串 | D3: 字符串 | E3: 一维数组 | F3: 一维数组 | G3: 数字 | H3: 一维数组 | I3: 一维数组 | J3: 二维数组
E4: 不定长 | F4: 不定长 | H4: 不定长 | I4: 不定长 | J4: 不定长
A6: 副本ID | B6: 副本图片 | C6: 副本名 | D6: 副本描述 | E6: 副本奖励预览 | F6: 推荐等级段 | G6: 世界地图ID | H6: 任务链ID列表 | I6: 法阵能量上限 | J6: 奖励展示
A7: 1 | B7: 7000 | C7: 钢铁末日 | D7: 当钢铁的身影淹没了所有生存之地，仅存的生灵们将渺茫的希望汇聚于这最后一战…… | E7: 10014|10101|19003|19030 | F7: 31|40 | G7: 1 | H7: 201 | I7: 30|60|90 | J7: 10011|19003|19030|10101#10011|19003|19030|10101#10012|19003|19030|10101#10012|19003|19030|10101
A8: 2 | B8: 8000 | C8: 起源火种 | D8: 这是一片新生的大陆，旧日的神祗企图覆灭这里所有智慧的火种，我们必须阻止它—— | E8: 80000|80010|19003|19030 | F8: 41|59 | G8: 1 | H8: 101|102|103 | I8: 30|60|90 | J8: 80000|80010|19030|10101#80000|80010|19030|10101#80000|80010|19030|10101#80000|80010|19030|10101

Sheet: 2.商店
A1: goods_id|goods_id | B1: goods_type|goods_type | C1: item_id|item_id | D1: item_num|item_num | E1: cost_type_list|cost_type_list | F1: cost_value_list|cost_value_list | G1: need_pass_dungeonid|need_pass_dungeonid | H1: buy_num_max|buy_num_max
A2: 不可空 | B2: 不可空 | C2: 不可空 | D2: 不可空 | E2: 可空#不需字段 | F2: 可空#不需字段 | G2: 不可空 | H2: 不可空
A3: 数字 | B3: 数字 | C3: 数字 | D3: 数字 | E3: 一维数组 | F3: 一维数组 | G3: 数字 | H3: 数字
E4: 不定长 | F4: 不定长
A6: 商品ID | B6: 商品类型 | C6: 物品ID | D6: 物品数量 | E6: 消耗货币类型列表 | F6: 消耗货币值列表 | G6: 需要通关副本ID | H6: 购买次数上限
A7: 1 | B7: 1 | C7: 80000 | D7: 1 | E7: 30 | F7: 1000 | G7: 2 | H7: 1
A8: 2 | B8: 1 | C8: 80010 | D8: 1 | E8: 30 | F8: 1000 | G8: 2 | H8: 1
A9: 3 | B9: 1 | C9: 10101 | D9: 1 | E9: 30 | F9: 2000 | G9: 1 | H9: 5
A10: 4 | B10: 1 | C10: 10101 | D10: 1 | E10: 5 | F10: 200 | G10: 1 | H10: 5
A11: 5 | B11: 1 | C11: 10100 | D11: 1 | E11: 30 | F11: 5000 | G11: 2 | H11: 10
A12: 6 | B12: 1 | C12: 19103 | D12: 5 | E12: 30 | F12: 450 | G12: 2 | H12: 10
A13: 7 | B13: 1 | C13: 10011 | D13: 1 | E13: 30 | F13: 20 | G13: 0 | H13: 100
A14: 8 | B14: 1 | C14: 10012 | D14: 1 | E14: 30 | F14: 40 | G14: 0 | H14: 100
A15: 9 | B15: 1 | C15: 10013 | D15: 1 | E15: 30 | F15: 100 | G15: 0 | H15: 100
A16: 10 | B16: 1 | C16: 10014 | D16: 1 | E16: 30 | F16: 200 | G16: 0 | H16: 100
A17: 1001 | B17: 2 | C17: 80000 | D17: 1 | E17: 30 | F17: 100 | G17: 1 | H17: 1
A18: 1002 | B18: 2 | C18: 80010 | D18: 1 | E18: 30 | F18: 100 | G18: 1 | H18: 1
A19: 1003 | B19: 2 | C19: 19005 | D19: 500 | E19: 30 | F19: 500 | G19: 1 | H19: 1
A20: 1004 | B20: 2 | C20: 10100 | D20: 2 | E20: 30 | F20: 1000 | G20: 1 | H20: 1

Sheet: 3.抽奖
A1: item_id|item_id | B1: item_num|item_num | C1: |weight | D1: |is_need_record
A2: 不可空 | B2: 不可空 | C2: 不可空 | D2: 不可空
A3: 数字 | B3: 数字 | C3: 数字 | D3: 数字
A6: 物品Id | B6: 物品数量 | C6: 权值 | D6: 是否需要记录
A7: 80000 | B7: 1 | C7: 500 | D7: 0
A8: 80010 | B8: 1 | C8: 500 | D8: 0
A9: 80100 | B9: 1 | C9: 2 | D9: 1
A10: 12400 | B10: 5 | C10: 100 | D10: 0
A11: 12401 | B11: 5 | C11: 100 | D11: 0
A12: 12402 | B12: 5 | C12: 100 | D12: 0
A13: 12403 | B13: 5 | C13: 100 | D13: 0
A14: 12404 | B14: 5 | C14: 100 | D14: 0
A15: 12405 | B15: 5 | C15: 100 | D15: 0
A16: 12406 | B16: 5 | C16: 100 | D16: 0
A17: 12407 | B17: 5 | C17: 100 | D17: 0
A18: 12408 | B18: 5 | C18: 100 | D18: 0
A19: 12409 | B19: 5 | C19: 100 | D19: 0
A20: 12410 | B20: 5 | C20: 100 | D20: 0
A21: 12411 | B21: 5 | C21: 100 | D21: 0
A22: 12412 | B22: 5 | C22: 100 | D22: 0
A23: 12413 | B23: 5 | C23: 100 | D23: 0
A24: 12430 | B24: 5 | C24: 100 | D24: 0
A25: 12431 | B25: 5 | C25: 100 | D25: 0
A26: 12432 | B26: 5 | C26: 100 | D26: 0
A27: 12433 | B27: 5 | C27: 100 | D27: 0
A28: 12434 | B28: 5 | C28: 100 | D28: 0
A29: 12435 | B29: 5 | C29: 100 | D29: 0
A30: 12436 | B30: 5 | C30: 100 | D30: 0
A31: 12437 | B31: 5 | C31: 100 | D31: 0
A32: 12438 | B32: 5 | C32: 100 | D32: 0
A33: 12439 | B33: 5 | C33: 100 | D33: 0
A34: 12440 | B34: 5 | C34: 100 | D34: 0
A35: 12441 | B35: 5 | C35: 100 | D35: 0
A36: 12442 | B36: 5 | C36: 100 | D36: 0
A37: 12443 | B37: 5 | C37: 100 | D37: 0
A38: 12460 | B38: 5 | C38: 100 | D38: 0
A39: 12461 | B39: 5 | C39: 100 | D39: 0
A40: 12462 | B40: 5 | C40: 100 | D40: 0
A41: 12463 | B41: 5 | C41: 100 | D41: 0
A42: 12464 | B42: 5 | C42: 100 | D42: 0
A43: 12465 | B43: 5 | C43: 100 | D43: 0
A44: 12466 | B44: 5 | C44: 100 | D44: 0
A45: 12467 | B45: 5 | C45: 100 | D45: 0
A46: 12468 | B46: 5 | C46: 100 | D46: 0
A47: 12469 | B47: 5 | C47: 100 | D47: 0
A48: 12470 | B48: 5 | C48: 100 | D48: 0
A49: 12471 | B49: 5 | C49: 100 | D49: 0
A50: 12472 | B50: 5 | C50: 100 | D50: 0
A51: 12473 | B51: 5 | C51: 100 | D51: 0
A52: 12400 | B52: 20 | C52: 5 | D52: 1
A53: 12401 | B53: 20 | C53: 5 | D53: 1
A54: 12402 | B54: 20 | C54: 5 | D54: 1
A55: 12403 | B55: 20 | C55: 5 | D55: 1
A56: 12404 | B56: 20 | C56: 5 | D56: 1
A57: 12405 | B57: 20 | C57: 5 | D57: 1
A58: 12406 | B58: 20 | C58: 5 | D58: 1
A59: 12407 | B59: 20 | C59: 5 | D59: 1
A60: 12408 | B60: 20 | C60: 5 | D60: 1
A61: 12409 | B61: 20 | C61: 5 | D61: 1
A62: 12410 | B62: 20 | C62: 5 | D62: 1
A63: 12411 | B63: 20 | C63: 5 | D63: 1
A64: 12412 | B64: 20 | C64: 5 | D64: 1
A65: 12413 | B65: 20 | C65: 5 | D65: 1
A66: 12430 | B66: 20 | C66: 5 | D66: 1
A67: 12431 | B67: 20 | C67: 5 | D67: 1
A68: 12432 | B68: 20 | C68: 5 | D68: 1
A69: 12433 | B69: 20 | C69: 5 | D69: 1
A70: 12434 | B70: 20 | C70: 5 | D70: 1
A71: 12435 | B71: 20 | C71: 5 | D71: 1
A72: 12436 | B72: 20 | C72: 5 | D72: 1
A73: 12437 | B73: 20 | C73: 5 | D73: 1
A74: 12438 | B74: 20 | C74: 5 | D74: 1
A75: 12439 | B75: 20 | C75: 5 | D75: 1
A76: 12440 | B76: 20 | C76: 5 | D76: 1
A77: 12441 | B77: 20 | C77: 5 | D77: 1
A78: 12442 | B78: 20 | C78: 5 | D78: 1
A79: 12443 | B79: 20 | C79: 5 | D79: 1
A80: 12460 | B80: 20 | C80: 5 | D80: 1
A81: 12461 | B81: 20 | C81: 5 | D81: 1
A82: 12462 | B82: 20 | C82: 5 | D82: 1
A83: 12463 | B83: 20 | C83: 5 | D83: 1
A84: 12464 | B84: 20 | C84: 5 | D84: 1
A85: 12465 | B85: 20 | C85: 5 | D85: 1
A86: 12466 | B86: 20 | C86: 5 | D86: 1
A87: 12467 | B87: 20 | C87: 5 | D87: 1
A88: 12468 | B88: 20 | C88: 5 | D88: 1
A89: 12469 | B89: 20 | C89: 5 | D89: 1
A90: 12470 | B90: 20 | C90: 5 | D90: 1
A91: 12471 | B91: 20 | C91: 5 | D91: 1
A92: 12472 | B92: 20 | C92: 5 | D92: 1
A93: 12473 | B93: 20 | C93: 5 | D93: 1
A94: 19003 | B94: 100000 | C94: 2000 | D94: 0
A95: 19003 | B95: 666666 | C95: 200 | D95: 1
A96: 10002 | B96: 100 | C96: 1000 | D96: 0
A97: 10003 | B97: 30 | C97: 1000 | D97: 0
A98: 10003 | B98: 100 | C98: 200 | D98: 1
A99: 10004 | B99: 10 | C99: 1000 | D99: 0
A100: 10004 | B100: 50 | C100: 200 | D100: 1
A101: 10008 | B101: 40 | C101: 1000 | D101: 0

Sheet: 4.任务链
A1: id|id | B1: player_map_pos| | C1: player_map_spacing| | D1: boss_map_id|boss_map_id | E1: body_effect| | F1: back_effect| | G1: boss_skill_id| | H1: die_position| | I1: horz_dir| | J1: scene_id|scene_id | K1: task_time|task_time | L1: |boss_kill_reward_list | M1: |mvp_reward_list | N1: boss_world_map_pos|boss_map_pos | O1: |boss_scene_pos | P1: task_num|task_num | Q1: task_list|task_list | R1: task_content| | S1: boss_task_content| | T1: time_end_tips|
A2: 不可空 | B2: 不可空 | C2: 不可空 | D2: 不可空 | E2: 可空#不需字段 | F2: 可空#不需字段 | G2: 不可空 | H2: 不可空 | I2: 不可空 | J2: 不可空 | K2: 不可空 | L2: 不可空 | M2: 不可空 | N2: 不可空 | O2: 不可空 | P2: 不可空 | Q2: 可空#不需字段 | R2: 不可空 | S2: 不可空 | T2: 不可空
A3: 数字 | B3: 一维数组 | C3: 一维数组 | D3: 数字 | E3: 数字 | F3: 数字 | G3: 数字 | H3: 一维数组 | I3: 数字 | J3: 数字 | K3: 数字 | L3: 一维数组 | M3: 一维数组 | N3: 一维数组 | O3: 一维数组 | P3: 数字 | Q3: 二维数组 | R3: 字符串 | S3: 字符串 | T3: 字符串
B4: 不定长 | C4: 不定长 | H4: 不定长 | L4: 不定长 | M4: 不定长 | N4: 不定长 | O4: 不定长 | Q4: 不定长
A6: 任务链ID | B6: 玩家初始位置 | C6: 玩家之间初始间距 | D6: BOSS关卡 | E6: BOSS身上特效 | F6: BOSS底下特效 | G6: BOSS出场技能ID | H6: BOSS结算位置 | I6: BOSS面向 | J6: 场景地图ID | K6: 任务限时（秒） | L6: BOSS击杀奖励列表 | M6: MVP奖励列表 | N6: BOSS在世界地图上的坐标 | O6: BOSS在场景上的坐标 | P6: 任务数 | Q6: 任务列表 | R6: 任务标题 | S6: BOSS战阶段任务内容 | T6: 时间结束提示
A7: 101 | B7: 505|550 | C7: -50|-20 | D7: 2997 | E7: 210011 | F7: 210013 | G7: 400029 | H7: 0|0 | I7: -1 | J7: 101 | K7: 360 | L7: 13109|13109|13109|13110|13110|13110|13111|13111|13111|13111|13112 | M7: 13109|13109|13109|13110|13110|13110|13111|13111|13111|13111|13112 | N7: 1435|525 | O7: 1000|185 | P7: 6 | Q7: 10101#10102#10103#10104#10105#10106 | R7: 驱逐<COLOR VALUE=FFFF993F>熔岩巨神</COLOR> | S7: <COLOR VALUE=FFFF993F>魔法阵已激活，熔岩巨神受创</COLOR>，请尽快驱逐它！ | T7: 未能做好战前准备，熔岩巨神已经暴动！
A8: 102 | B8: 1160|339 | C8: -50|-20 | D8: 2997 | E8: 210011 | F8: 210013 | G8: 400029 | H8: 0|0 | I8: -1 | J8: 101 | K8: 360 | L8: 13109|13109|13109|13110|13110|13110|13111|13111|13111|13111|13112 | M8: 13109|13109|13109|13110|13110|13110|13111|13111|13111|13111|13112 | N8: 1435|525 | O8: 1000|185 | P8: 5 | Q8: 10201#10204#10205|102051#10206#10207 | R8: 驱逐<COLOR VALUE=FFFF993F>熔岩巨神</COLOR> | S8: 万事俱备，<COLOR VALUE=FFFF993F>驱逐熔岩巨神</COLOR>！ | T8: 未能做好战前准备，熔岩巨神已经暴动！
A9: 103 | B9: 505|550 | C9: -50|-20 | D9: 2997 | E9: 210011 | F9: 210013 | G9: 400029 | H9: 0|0 | I9: -1 | J9: 101 | K9: 360 | L9: 13109|13109|13109|13110|13110|13110|13111|13111|13111|13111|13112 | M9: 13109|13109|13109|13110|13110|13110|13111|13111|13111|13111|13112 | N9: 1435|525 | O9: 1000|185 | P9: 6 | Q9: 10301#10302#10303|103031|103032|103033|103034#10304#10305#10306 | R9: 驱逐<COLOR VALUE=FFFF993F>熔岩巨神</COLOR> | S9: 再无后顾之忧，<COLOR VALUE=FFFF993F>驱逐熔岩巨神</COLOR>！ | T9: 未能做好战前准备，熔岩巨神已经暴动！
A10: 201 | B10: 1090|770 | C10: 50|10 | D10: 2998 | E10: 210011 | F10: 210014 | G10: 400052 | H10: -5|90 | I10: 1 | J10: 101 | K10: 360 | L10: 13129|13129|13129|13130|13130|13130|13131|13131|13131|13131|13132 | M10: 13129|13129|13129|13130|13130|13130|13131|13131|13131|13131|13132 | N10: 370|270 | O10: 1000|185 | P10: 5 | Q10: 20101#20102|201021|201022#20103#20104#20106 | R10: 击败<COLOR VALUE=FFFF993F>机械首脑</COLOR> | S10: 准备就绪，<COLOR VALUE=FFFF993F>击败机械首脑</COLOR>！ | T10: 未能做好战前准备，反攻已经开始！

Sheet: 5.任务数据
A1: id|id | B1: type|type | C1: scene_id|scene_id | D1: extra_reward_id|extra_reward_id | E1: task_npc|task_npc | F1: task_param1|task_param1 | G1: task_param2| | H1: task_param3| | I1: score_list|score_list | J1: energy_list|energy_list | K1: reward_item_list|reward_item_list | L1: desc| | M1: desc2|
A2: 不可空 | B2: 不可空 | C2: 不可空 | D2: 不可空 | E2: 不可空 | F2: 不可空 | G2: 可空#不需字段 | H2: 可空#不需字段 | I2: 不可空 | J2: 不可空 | K2: 不可空 | L2: 不可空 | M2: 不可空
A3: 数字 | B3: 数字 | C3: 数字 | D3: 数字 | E3: 数字 | F3: 一维数组 | G3: 一维数组 | H3: 一维数组 | I3: 一维数组 | J3: 一维数组 | K3: 一维数组 | L3: 字符串 | M3: 字符串
F4: 不定长 | G4: 不定长 | H4: 不定长 | I4: 不定长 | J4: 不定长 | K4: 不定长
A6: 任务Id | B6: 任务类型 | C6: 场景地图ID | D6: 额外奖励ID | E6: 任务NPC | F6: 任务参数1 | G6: 任务参数2 | H6: 任务参数3 | I6: 评分列表 | J6: 法阵能量列表 | K6: 任务奖励物品 | L6: 任务描述（接任务前 | M6: 任务描述（接任务后
A7: 10101 | B7: 2 | C7: 201 | D7: 13113 | E7: 1 | F7: 1|8 | G7: 1001 | H7: 320|670 | I7: 15|30|45|9999 | J7: 20|15|10|5 | K7: 13108|13107|13106|13105 | L7: 与<COLOR VALUE=FF28871E>亚莱特之王</COLOR>对话。 | M7: 前往采集<COLOR VALUE=FF28871E>药草</COLOR>。
A8: 10102 | B8: 4 | C8: 0 | D8: 13113 | E8: 2 | F8: 3|4|5 | G8: 1002|1003|1004|1005 | I8: 10|20|30|9999 | J8: 20|15|10|5 | K8: 13108|13107|13106|13105 | L8: 将药草交给<COLOR VALUE=FF28871E>医师</COLOR> | M8: 将药剂交给<COLOR VALUE=FF28871E>伤员</COLOR>。
A9: 10103 | B9: 3 | C9: 301 | D9: 13113 | E9: 1 | F9: 2001|6 | G9: 1006 | H9: 833|577 | I9: 60|120|180|9999 | J9: 20|15|10|5 | K9: 13108|13107|13106|13105 | L9: 返回与<COLOR VALUE=FF28871E>亚莱特之王</COLOR>对话。 | M9: 清理路上的<COLOR VALUE=FF28871E>古神爪牙</COLOR>。
A10: 10104 | B10: 1 | C10: 0 | D10: 13113 | E10: 6 | F10: 1001|1002|1003|1004|1005|1006|1007|1008|1009|1010|1011|1012|1013|1014|1015|1016|1017|1018|1019|1020|1021|1022|1023|1024|1025|1026|1027|1028|1029|1030|1031|1032|1033|1034|1035|1036|2001|2002|2003|2004|2005|2006|2007|2008|2009|2010|2011|2012|2013|2014|2015|2016|2017|2018|2019|2020|2021|2022|2023|2024|2025|2035|2036|2037|2038|2039|2040|2041|2042|2043|2044|3001|3002|3003|3004|3005|3006|3007|3008|3009|3010|3011|3012|3013|3014|3015|4001|4002|4003|4004|4005|4006|4007|4008|4009 | G10: 1007 | I10: 1|3|5|9999 | J10: 20|15|10|5 | K10: 13108|13107|13106|13105 | L10: 找到<COLOR VALUE=FF28871E>传奇魔法师</COLOR>。 | M10: 回答<COLOR VALUE=FF28871E>传奇魔法师</COLOR>提出的<COLOR VALUE=FF28871E>问题</COLOR>。
A11: 10105 | B11: 2 | C11: 202 | D11: 13113 | E11: 6 | F11: 2|8 | G11: 1008 | H11: 1081|754 | I11: 15|30|45|9999 | J11: 20|15|10|5 | K11: 13108|13107|13106|13105 | L11: 与<COLOR VALUE=FF28871E>传奇魔法师</COLOR>对话。 | M11: 前往收集<COLOR VALUE=FF28871E>冰玉</COLOR>。
A12: 10106 | B12: 3 | C12: 302 | D12: 13113 | E12: 6 | F12: 2002|6 | G12: 1009 | H12: 543|304 | I12: 60|120|180|9999 | J12: 20|15|10|5 | K12: 13108|13107|13106|13105 | L12: 与<COLOR VALUE=FF28871E>传奇魔法师</COLOR>对话。 | M12: 清理<COLOR VALUE=FF28871E>古神爪牙</COLOR>，布置<COLOR VALUE=FF28871E>魔法信标</COLOR>。
A13: 10107 | B13: 3 | C13: 303 | D13: 13113 | E13: 6 | F13: 2003|6 | G13: 1010 | H13: 1413|99 | I13: 60|120|180|9999 | J13: 20|15|10|5 | K13: 13108|13107|13106|13105 | L13: 找<COLOR VALUE=FF28871E>传奇魔法师</COLOR>拿到第二个魔法信标。 | M13: 清理<COLOR VALUE=FF28871E>古神爪牙</COLOR>，布置<COLOR VALUE=FF28871E>第二个魔法信标</COLOR>。
A14: 10108 | B14: 3 | C14: 304 | D14: 13113 | E14: 6 | F14: 2004|6 | G14: 1011 | H14: 1256|787 | I14: 60|120|180|9999 | J14: 20|15|10|5 | K14: 13108|13107|13106|13105 | L14: 找<COLOR VALUE=FF28871E>传奇魔法师</COLOR>拿到最后一个魔法信标。 | M14: 清理<COLOR VALUE=FF28871E>古神爪牙</COLOR>，布置<COLOR VALUE=FF28871E>最后一个魔法信标</COLOR>。
A15: 10109 | B15: 4 | C15: 0 | D15: 13113 | E15: 1 | F15: 7|8|6 | G15: 1012|1013|1014|1015 | I15: 10|20|30|9999 | J15: 20|15|10|5 | K15: 13108|13107|13106|13105 | L15: 将<COLOR VALUE=FF28871E>即将发动反攻</COLOR>的信息<COLOR VALUE=FF28871E>通知各个势力</COLOR>。 | M15: 将<COLOR VALUE=FF28871E>即将发动反攻</COLOR>的信息<COLOR VALUE=FF28871E>通知各个势力</COLOR>。
A16: 10110 | B16: 1 | C16: 0 | D16: 13113 | E16: 9 | F16: 1001|1002|1003|1004|1005|1006|1007|1008|1009|1010|1011|1012|1013|1014|1015|1016|1017|1018|1019|1020|1021|1022|1023|1024|1025|1026|1027|1028|1029|1030|1031|1032|1033|1034|1035|1036|2001|2002|2003|2004|2005|2006|2007|2008|2009|2010|2011|2012|2013|2014|2015|2016|2017|2018|2019|2020|2021|2022|2023|2024|2025|2035|2036|2037|2038|2039|2040|2041|2042|2043|2044|3001|3002|3003|3004|3005|3006|3007|3008|3009|3010|3011|3012|3013|3014|3015|4001|4002|4003|4004|4005|4006|4007|4008|4009 | G16: 1016 | I16: 1|3|5|9999 | J16: 20|15|10|5 | K16: 13108|13107|13106|13105 | L16: 找到<COLOR VALUE=FF28871E>能给予古神最后一击的武器</COLOR>。 | M16: <COLOR VALUE=FF28871E>回答问题</COLOR>，获得<COLOR VALUE=FF28871E>能给予古神最后一击的武器</COLOR>。
A17: 10201 | B17: 4 | C17: 0 | D17: 13113 | E17: 9 | F17: 1|8|7 | G17: 1101|1102|1103|1104 | I17: 10|20|30|9999 | J17: 20|15|10|5 | K17: 13108|13107|13106|13105 | L17: 与<COLOR VALUE=FF28871E>智慧女神</COLOR>对话。 | M17: <COLOR VALUE=FF28871E>将信交给各大势力首领</COLOR>。
A18: 10202 | B18: 3 | C18: 302 | D18: 13113 | E18: 7 | F18: 2002|6 | G18: 1105 | H18: 495|252 | I18: 60|120|180|9999 | J18: 20|15|10|5 | K18: 13108|13107|13106|13105 | L18: 与<COLOR VALUE=FF28871E>暗影行者</COLOR>对话。 | M18: 清理<COLOR VALUE=FF28871E>古神爪牙</COLOR>，获取<COLOR VALUE=FF28871E>暗影行者的信任</COLOR>。
A19: 10203 | B19: 2 | C19: 201 | D19: 13113 | E19: 7 | F19: 1|8 | G19: 1106 | H19: 320|670 | I19: 15|30|45|9999 | J19: 20|15|10|5 | K19: 13108|13107|13106|13105 | L19: 与<COLOR VALUE=FF28871E>暗影行者</COLOR>对话。 | M19: 前往采集<COLOR VALUE=FF28871E>药草</COLOR>。
A20: 102031 | B20: 2 | C20: 202 | D20: 13113 | E20: 7 | F20: 2|8 | G20: 1106 | H20: 1081|754 | I20: 15|30|45|9999 | J20: 20|15|10|5 | K20: 13108|13107|13106|13105 | L20: 与<COLOR VALUE=FF28871E>暗影行者</COLOR>对话。 | M20: 前往采集<COLOR VALUE=FF28871E>冰玉</COLOR>。
A21: 10204 | B21: 1 | C21: 0 | D21: 13113 | E21: 6 | F21: 1001|1002|1003|1004|1005|1006|1007|1008|1009|1010|1011|1012|1013|1014|1015|1016|1017|1018|1019|1020|1021|1022|1023|1024|1025|1026|1027|1028|1029|1030|1031|1032|1033|1034|1035|1036|2001|2002|2003|2004|2005|2006|2007|2008|2009|2010|2011|2012|2013|2014|2015|2016|2017|2018|2019|2020|2021|2022|2023|2024|2025|2035|2036|2037|2038|2039|2040|2041|2042|2043|2044|3001|3002|3003|3004|3005|3006|3007|3008|3009|3010|3011|3012|3013|3014|3015|4001|4002|4003|4004|4005|4006|4007|4008|4009 | G21: 1107 | I21: 1|3|5|9999 | J21: 20|15|10|5 | K21: 13108|13107|13106|13105 | L21: 与<COLOR VALUE=FF28871E>传奇魔法师</COLOR>对话。 | M21: <COLOR VALUE=FF28871E>回答传奇魔法师的问题</COLOR>，获得<COLOR VALUE=FF28871E>他的信任</COLOR>。
A22: 10205 | B22: 3 | C22: 301 | D22: 13113 | E22: 6 | F22: 2001|6 | G22: 1108 | H22: 279|512 | I22: 60|120|180|9999 | J22: 20|15|10|5 | K22: 13108|13107|13106|13105 | L22: 与<COLOR VALUE=FF28871E>传奇魔法师</COLOR>对话。 | M22: 清理<COLOR VALUE=FF28871E>古神爪牙并收集材料</COLOR>。
A23: 102051 | B23: 3 | C23: 304 | D23: 13113 | E23: 6 | F23: 2004|6 | G23: 1108 | H23: 1061|548 | I23: 60|120|180|9999 | J23: 20|15|10|5 | K23: 13108|13107|13106|13105 | L23: 与<COLOR VALUE=FF28871E>传奇魔法师</COLOR>对话。 | M23: 清理<COLOR VALUE=FF28871E>古神爪牙并收集材料</COLOR>。
A24: 10206 | B24: 3 | C24: 303 | D24: 13113 | E24: 9 | F24: 2003|6 | G24: 1109 | H24: 800|557 | I24: 60|120|180|9999 | J24: 20|15|10|5 | K24: 13108|13107|13106|13105 | L24: 与<COLOR VALUE=FF28871E>智慧女神</COLOR>对话。 | M24: 清理路上的<COLOR VALUE=FF28871E>古神爪牙</COLOR>。
A25: 10207 | B25: 1 | C25: 0 | D25: 13113 | E25: 10 | F25: 1001|1002|1003|1004|1005|1006|1007|1008|1009|1010|1011|1012|1013|1014|1015|1016|1017|1018|1019|1020|1021|1022|1023|1024|1025|1026|1027|1028|1029|1030|1031|1032|1033|1034|1035|1036|2001|2002|2003|2004|2005|2006|2007|2008|2009|2010|2011|2012|2013|2014|2015|2016|2017|2018|2019|2020|2021|2022|2023|2024|2025|2035|2036|2037|2038|2039|2040|2041|2042|2043|2044|3001|3002|3003|3004|3005|3006|3007|3008|3009|3010|3011|3012|3013|3014|3015|4001|4002|4003|4004|4005|4006|4007|4008|4009 | G25: 1110 | I25: 1|3|5|9999 | J25: 20|15|10|5 | K25: 13108|13107|13106|13105 | L25: 找到<COLOR VALUE=FF28871E>传承古树</COLOR>。 | M25: <COLOR VALUE=FF28871E>回答问题</COLOR>，取得<COLOR VALUE=FF28871E>史诗武器</COLOR>。
A26: 10208 | B26: 2 | C26: 203 | D26: 13113 | E26: 9 | F26: 3|8 | G26: 1111 | H26: 1320|437 | I26: 15|30|45|9999 | J26: 20|15|10|5 | K26: 13108|13107|13106|13105 | L26: 回复<COLOR VALUE=FF28871E>智慧女神</COLOR>。 | M26: 前往采集<COLOR VALUE=FF28871E>熔岩宝石</COLOR>。
A27: 10209 | B27: 2 | C27: 202 | D27: 13113 | E27: 6 | F27: 2|8 | G27: 1112 | H27: 1081|754 | I27: 15|30|45|9999 | J27: 20|15|10|5 | K27: 13108|13107|13106|13105 | L27: 将<COLOR VALUE=FF28871E>熔岩宝石</COLOR>交给<COLOR VALUE=FF28871E>传奇魔法师</COLOR>。 | M27: 前往采集<COLOR VALUE=FF28871E>冰玉</COLOR>。
A28: 10210 | B28: 4 | C28: 0 | D28: 13113 | E28: 6 | F28: 1|7|8|9 | G28: 1113|1114|1115|1116|1117 | I28: 10|20|30|9999 | J28: 20|15|10|5 | K28: 13108|13107|13106|13105 | L28: 将<COLOR VALUE=FF28871E>冰玉</COLOR>交给<COLOR VALUE=FF28871E>传奇魔法师</COLOR>。 | M28: 将通讯水晶送给<COLOR VALUE=FF28871E>各势力首领</COLOR>，回去找<COLOR VALUE=FF28871E>智慧女神</COLOR>。
A29: 10301 | B29: 3 | C29: 303 | D29: 13113 | E29: 1 | F29: 2003|6 | G29: 1201 | H29: 360|428 | I29: 60|120|180|9999 | J29: 20|15|10|5 | K29: 13108|13107|13106|13105 | L29: 与<COLOR VALUE=FF28871E>亚莱特之王</COLOR>对话。 | M29: 清理<COLOR VALUE=FF28871E>古神爪牙</COLOR>。
A30: 10302 | B30: 3 | C30: 305 | D30: 13113 | E30: 7 | F30: 2005|6 | G30: 1202 | H30: 326|657 | I30: 60|120|180|9999 | J30: 20|15|10|5 | K30: 13108|13107|13106|13105 | L30: 找到<COLOR VALUE=FF28871E>暗影行者</COLOR>。 | M30: 帮助“孤影”击退<COLOR VALUE=FF28871E>复苏之骨</COLOR>。
A31: 10303 | B31: 2 | C31: 204 | D31: 13113 | E31: 7 | F31: 4|8 | G31: 1203 | H31: 207|506 | I31: 15|30|45|9999 | J31: 20|15|10|5 | K31: 13108|13107|13106|13105 | L31: 与<COLOR VALUE=FF28871E>暗影行者</COLOR>对话。 | M31: 前往采集<COLOR VALUE=FF28871E>地穴之花</COLOR>。
A32: 103031 | B32: 2 | C32: 205 | D32: 13113 | E32: 7 | F32: 5|8 | G32: 1203 | H32: 866|321 | I32: 15|30|45|9999 | J32: 20|15|10|5 | K32: 13108|13107|13106|13105 | L32: 与<COLOR VALUE=FF28871E>暗影行者</COLOR>对话。 | M32: 前往采集<COLOR VALUE=FF28871E>黄昏茉莉</COLOR>。
A33: 103032 | B33: 2 | C33: 206 | D33: 13113 | E33: 7 | F33: 6|8 | G33: 1203 | H33: 578|827 | I33: 15|30|45|9999 | J33: 20|15|10|5 | K33: 13108|13107|13106|13105 | L33: 与<COLOR VALUE=FF28871E>暗影行者</COLOR>对话。 | M33: 前往采集<COLOR VALUE=FF28871E>幽草</COLOR>。
A34: 103033 | B34: 2 | C34: 207 | D34: 13113 | E34: 7 | F34: 7|8 | G34: 1203 | H34: 1416|744 | I34: 15|30|45|9999 | J34: 20|15|10|5 | K34: 13108|13107|13106|13105 | L34: 与<COLOR VALUE=FF28871E>暗影行者</COLOR>对话。 | M34: 前往采集<COLOR VALUE=FF28871E>海之花</COLOR>。
A35: 103034 | B35: 2 | C35: 208 | D35: 13113 | E35: 7 | F35: 8|8 | G35: 1203 | H35: 842|126 | I35: 15|30|45|9999 | J35: 20|15|10|5 | K35: 13108|13107|13106|13105 | L35: 与<COLOR VALUE=FF28871E>暗影行者</COLOR>对话。 | M35: 前往采集<COLOR VALUE=FF28871E>枯萎草</COLOR>。
A36: 10304 | B36: 4 | C36: 0 | D36: 13113 | E36: 7 | F36: 11|12|13 | G36: 1204|1205|1206|1207 | I36: 10|20|30|9999 | J36: 20|15|10|5 | K36: 13108|13107|13106|13105 | L36: 将材料交给<COLOR VALUE=FF28871E>暗影行者。 | M36: 前往联合<COLOR VALUE=FF28871E>各大黑暗势力</COLOR>。
A37: 10305 | B37: 1 | C37: 0 | D37: 13113 | E37: 8 | F37: 1001|1002|1003|1004|1005|1006|1007|1008|1009|1010|1011|1012|1013|1014|1015|1016|1017|1018|1019|1020|1021|1022|1023|1024|1025|1026|1027|1028|1029|1030|1031|1032|1033|1034|1035|1036|2001|2002|2003|2004|2005|2006|2007|2008|2009|2010|2011|2012|2013|2014|2015|2016|2017|2018|2019|2020|2021|2022|2023|2024|2025|2035|2036|2037|2038|2039|2040|2041|2042|2043|2044|3001|3002|3003|3004|3005|3006|3007|3008|3009|3010|3011|3012|3013|3014|3015|4001|4002|4003|4004|4005|4006|4007|4008|4009 | G37: 1208 | I37: 1|3|5|9999 | J37: 20|15|10|5 | K37: 13108|13107|13106|13105 | L37: 与<COLOR VALUE=FF28871E>大海之主</COLOR>对话。 | M37: 回答<COLOR VALUE=FF28871E>大海之主</COLOR>的问题。
A38: 10306 | B38: 3 | C38: 305 | D38: 13113 | E38: 8 | F38: 2012|6 | G38: 1209 | H38: 1391|387 | I38: 60|120|180|9999 | J38: 20|15|10|5 | K38: 13108|13107|13106|13105 | L38: 与<COLOR VALUE=FF28871E>大海之主</COLOR>对话。 | M38: 击退<COLOR VALUE=FF28871E>古神爪牙</COLOR>。
A39: 10307 | B39: 2 | C39: 209 | D39: 13113 | E39: 7 | F39: 9|8 | G39: 1210 | H39: 543|304 | I39: 15|30|45|9999 | J39: 20|15|10|5 | K39: 13108|13107|13106|13105 | L39: 与<COLOR VALUE=FF28871E>暗影行者</COLOR>对话。 | M39: 采集<COLOR VALUE=FF28871E>幽魂寒冰</COLOR>。
A40: 10308 | B40: 1 | C40: 0 | D40: 13113 | E40: 6 | F40: 1001|1002|1003|1004|1005|1006|1007|1008|1009|1010|1011|1012|1013|1014|1015|1016|1017|1018|1019|1020|1021|1022|1023|1024|1025|1026|1027|1028|1029|1030|1031|1032|1033|1034|1035|1036|2001|2002|2003|2004|2005|2006|2007|2008|2009|2010|2011|2012|2013|2014|2015|2016|2017|2018|2019|2020|2021|2022|2023|2024|2025|2035|2036|2037|2038|2039|2040|2041|2042|2043|2044|3001|3002|3003|3004|3005|3006|3007|3008|3009|3010|3011|3012|3013|3014|3015|4001|4002|4003|4004|4005|4006|4007|4008|4009 | G40: 1211 | I40: 1|3|5|9999 | J40: 20|15|10|5 | K40: 13108|13107|13106|13105 | L40: 将幽魂寒冰交给<COLOR VALUE=FF28871E>传奇魔法师</COLOR>。 | M40: 回答<COLOR VALUE=FF28871E>传奇魔法师的问题</COLOR>。
A41: 10309 | B41: 3 | C41: 306 | D41: 13113 | E41: 6 | F41: 2013|4 | G41: 1212 | H41: 375|219 | I41: 60|120|180|9999 | J41: 20|15|10|5 | K41: 13108|13107|13106|13105 | L41: 与<COLOR VALUE=FF28871E>传奇魔法师</COLOR>对话。 | M41: 击杀<COLOR VALUE=FF28871E>骷髅王</COLOR>。
A42: 20101 | B42: 4 | C42: 0 | D42: 13113 | E42: 14 | F42: 15|16|17 | G42: 2001|2002|2003|2004 | I42: 10|20|30|9999 | J42: 20|15|10|5 | K42: 13128|13127|13126|13125 | L42: 与<COLOR VALUE=FF28871E>反抗军大统领</COLOR>对话。 | M42: <COLOR VALUE=FF28871E>通知各人</COLOR>，准备全面反攻。
A43: 20102 | B43: 2 | C43: 205 | D43: 13113 | E43: 14 | F43: 5|8 | G43: 2005 | H43: 1385|85 | I43: 15|30|45|9999 | J43: 20|15|10|5 | K43: 13128|13127|13126|13125 | L43: 回复<COLOR VALUE=FF28871E>反抗军大统领</COLOR>。 | M43: 前往采集<COLOR VALUE=FF28871E>黄昏茉莉</COLOR>。
A44: 201021 | B44: 2 | C44: 208 | D44: 13113 | E44: 14 | F44: 8|8 | G44: 2005 | H44: 842|126 | I44: 15|30|45|9999 | J44: 20|15|10|5 | K44: 13128|13127|13126|13125 | L44: 回复<COLOR VALUE=FF28871E>反抗军大统领</COLOR>。 | M44: 前往采集<COLOR VALUE=FF28871E>枯萎草</COLOR>。
A45: 201022 | B45: 2 | C45: 209 | D45: 13113 | E45: 14 | F45: 9|8 | G45: 2005 | H45: 543|304 | I45: 15|30|45|9999 | J45: 20|15|10|5 | K45: 13128|13127|13126|13125 | L45: 回复<COLOR VALUE=FF28871E>反抗军大统领</COLOR>。 | M45: 前往采集<COLOR VALUE=FF28871E>幽魂寒冰</COLOR>。
A46: 20103 | B46: 3 | C46: 301 | D46: 13113 | E46: 14 | F46: 2014|6 | G46: 2006 | H46: 1275|488 | I46: 60|120|180|9999 | J46: 20|15|10|5 | K46: 13128|13127|13126|13125 | L46: 回复<COLOR VALUE=FF28871E>反抗军大统领</COLOR>。 | M46: 解决路上的<COLOR VALUE=FF28871E>机械军团</COLOR>。
A47: 20104 | B47: 1 | C47: 0 | D47: 13113 | E47: 18 | F47: 1001|1002|1003|1004|1005|1006|1007|1008|1009|1010|1011|1012|1013|1014|1015|1016|1017|1018|1019|1020|1021|1022|1023|1024|1025|1026|1027|1028|1029|1030|1031|1032|1033|1034|1035|1036|2001|2002|2003|2004|2005|2006|2007|2008|2009|2010|2011|2012|2013|2014|2015|2016|2017|2018|2019|2020|2021|2022|2023|2024|2025|2035|2036|2037|2038|2039|2040|2041|2042|2043|2044|3001|3002|3003|3004|3005|3006|3007|3008|3009|3010|3011|3012|3013|3014|3015|4001|4002|4003|4004|4005|4006|4007|4008|4009 | G47: 2007 | I47: 1|3|5|9999 | J47: 20|15|10|5 | K47: 13128|13127|13126|13125 | L47: 与<COLOR VALUE=FF28871E>机械大师</COLOR>对话。 | M47: 完成<COLOR VALUE=FF28871E>机械大师</COLOR>的考验。
A48: 20105 | B48: 4 | C48: 0 | D48: 13113 | E48: 18 | F48: 14|16|18 | G48: 2008|2009|2010|2011 | I48: 10|20|30|9999 | J48: 20|15|10|5 | K48: 13128|13127|13126|13125 | L48: 与<COLOR VALUE=FF28871E>机械大师</COLOR>对话。 | M48: 找反抗军取得<COLOR VALUE=FF28871E>制造终极武器的材料</COLOR>。
A49: 20106 | B49: 3 | C49: 304 | D49: 13113 | E49: 18 | F49: 2014|6 | G49: 2012 | H49: 1074|273 | I49: 60|120|180|9999 | J49: 20|15|10|5 | K49: 13128|13127|13126|13125 | L49: 与<COLOR VALUE=FF28871E>机械大师</COLOR>对话。 | M49: 清理目标地点的<COLOR VALUE=FF28871E>机械军团</COLOR>。
A50: 20107 | B50: 3 | C50: 307 | D50: 13113 | E50: 18 | F50: 2015|6 | G50: 2013 | H50: 327|662 | I50: 60|120|180|9999 | J50: 20|15|10|5 | K50: 13128|13127|13126|13125 | L50: 与<COLOR VALUE=FF28871E>机械大师</COLOR>对话。 | M50: 清理目标地点的<COLOR VALUE=FF28871E>机械军团</COLOR>。

Sheet: 6.BOSS奖励
A1: dungeon_id|dungeon_id | B1: index| | C1: energy_min|energy_min | D1: energy_max|energy_max | E1: damage_rate_min|damage_rate_min | F1: damage_rate_max|damage_rate_max | G1: reward_item_id_list|reward_item_id_list | H1: reward_item_num_list|reward_item_num_list
A2: 不可空 | B2: 不可空 | C2: 不可空 | D2: 不可空 | E2: 不可空 | F2: 不可空 | G2: 不可空 | H2: 不可空
A3: 数字 | B3: 数字 | C3: 数字 | D3: 数字 | E3: 数字 | F3: 数字 | G3: 一维数组 | H3: 一维数组
G4: 不定长 | H4: 不定长
A6: 副本ID | B6: 序列 | C6: 能量下限 | D6: 能量上限 | E6: Boss伤害比例下限 | F6: Boss伤害比例上限 | G6: 奖励的物品ID | H6: 奖励的物品数量
A7: 1 | B7: 1 | C7: 0 | D7: 29 | E7: 0 | F7: 24 | G7: 13121 | H7: 1
A8: 1 | B8: 2 | C8: 0 | D8: 29 | E8: 25 | F8: 49 | G8: 13121 | H8: 2
A9: 1 | B9: 3 | C9: 0 | D9: 29 | E9: 50 | F9: 74 | G9: 13121 | H9: 3
A10: 1 | B10: 4 | C10: 0 | D10: 29 | E10: 75 | F10: 99 | G10: 13121 | H10: 4
A11: 1 | B11: 5 | C11: 0 | D11: 29 | E11: 100 | F11: 100 | G11: 13121 | H11: 5
A12: 1 | B12: 6 | C12: =R[-5]C[1]+1 -> 30 | D12: =R[-5]C+30 -> 59 | E12: =R[-5]C -> 0 | F12: =R[-5]C -> 24 | G12: 13122 | H12: =R[-5]C -> 1
A13: 1 | B13: 7 | C13: =R[-5]C[1]+1 -> 30 | D13: =R[-5]C+30 -> 59 | E13: =R[-5]C -> 25 | F13: =R[-5]C -> 49 | G13: 13122 | H13: =R[-5]C -> 2
A14: 1 | B14: 8 | C14: =R[-5]C[1]+1 -> 30 | D14: =R[-5]C+30 -> 59 | E14: =R[-5]C -> 50 | F14: =R[-5]C -> 74 | G14: 13122 | H14: =R[-5]C -> 3
A15: 1 | B15: 9 | C15: =R[-5]C[1]+1 -> 30 | D15: =R[-5]C+30 -> 59 | E15: =R[-5]C -> 75 | F15: =R[-5]C -> 99 | G15: 13122 | H15: =R[-5]C -> 4
A16: 1 | B16: 10 | C16: =R[-5]C[1]+1 -> 30 | D16: =R[-5]C+30 -> 59 | E16: =R[-5]C -> 100 | F16: =R[-5]C -> 100 | G16: 13122 | H16: =R[-5]C -> 5
A17: 1 | B17: 11 | C17: =R[-5]C[1]+1 -> 60 | D17: =R[-5]C+30 -> 89 | E17: =R[-5]C -> 0 | F17: =R[-5]C -> 24 | G17: 13123 | H17: =R[-5]C -> 1
A18: 1 | B18: 12 | C18: =R[-5]C[1]+1 -> 60 | D18: =R[-5]C+30 -> 89 | E18: =R[-5]C -> 25 | F18: =R[-5]C -> 49 | G18: 13123 | H18: =R[-5]C -> 2
A19: 1 | B19: 13 | C19: =R[-5]C[1]+1 -> 60 | D19: =R[-5]C+30 -> 89 | E19: =R[-5]C -> 50 | F19: =R[-5]C -> 74 | G19: 13123 | H19: =R[-5]C -> 3
A20: 1 | B20: 14 | C20: =R[-5]C[1]+1 -> 60 | D20: =R[-5]C+30 -> 89 | E20: =R[-5]C -> 75 | F20: =R[-5]C -> 99 | G20: 13123 | H20: =R[-5]C -> 4
A21: 1 | B21: 15 | C21: =R[-5]C[1]+1 -> 60 | D21: =R[-5]C+30 -> 89 | E21: =R[-5]C -> 100 | F21: =R[-5]C -> 100 | G21: 13123 | H21: =R[-5]C -> 5
A22: 1 | B22: 16 | C22: =R[-5]C[1]+1 -> 90 | D22: 999 | E22: =R[-5]C -> 0 | F22: =R[-5]C -> 24 | G22: 13124 | H22: =R[-5]C -> 1
A23: 1 | B23: 17 | C23: =R[-5]C[1]+1 -> 90 | D23: 999 | E23: =R[-5]C -> 25 | F23: =R[-5]C -> 49 | G23: 13124 | H23: =R[-5]C -> 2
A24: 1 | B24: 18 | C24: =R[-5]C[1]+1 -> 90 | D24: 999 | E24: =R[-5]C -> 50 | F24: =R[-5]C -> 74 | G24: 13124 | H24: =R[-5]C -> 3
A25: 1 | B25: 19 | C25: =R[-5]C[1]+1 -> 90 | D25: 999 | E25: =R[-5]C -> 75 | F25: =R[-5]C -> 99 | G25: 13124 | H25: =R[-5]C -> 4
A26: 1 | B26: 20 | C26: =R[-5]C[1]+1 -> 90 | D26: 999 | E26: =R[-5]C -> 100 | F26: =R[-5]C -> 100 | G26: 13124 | H26: =R[-5]C -> 5
A27: 2 | B27: 1 | C27: 0 | D27: 29 | E27: 0 | F27: 24 | G27: 13101 | H27: =R[-5]C -> 1
A28: 2 | B28: 2 | C28: 0 | D28: 29 | E28: 25 | F28: 49 | G28: 13101 | H28: =R[-5]C -> 2
A29: 2 | B29: 3 | C29: 0 | D29: 29 | E29: 50 | F29: 74 | G29: 13101 | H29: =R[-5]C -> 3
A30: 2 | B30: 4 | C30: 0 | D30: 29 | E30: 75 | F30: 99 | G30: 13101 | H30: =R[-5]C -> 4
A31: 2 | B31: 5 | C31: 0 | D31: 29 | E31: 100 | F31: 100 | G31: 13101 | H31: =R[-5]C -> 5
A32: 2 | B32: 6 | C32: =R[-5]C[1]+1 -> 30 | D32: =R[-5]C+30 -> 59 | E32: =R[-5]C -> 0 | F32: =R[-5]C -> 24 | G32: 13102 | H32: =R[-5]C -> 1
A33: 2 | B33: 7 | C33: =R[-5]C[1]+1 -> 30 | D33: =R[-5]C+30 -> 59 | E33: =R[-5]C -> 25 | F33: =R[-5]C -> 49 | G33: 13102 | H33: =R[-5]C -> 2
A34: 2 | B34: 8 | C34: =R[-5]C[1]+1 -> 30 | D34: =R[-5]C+30 -> 59 | E34: =R[-5]C -> 50 | F34: =R[-5]C -> 74 | G34: 13102 | H34: =R[-5]C -> 3
A35: 2 | B35: 9 | C35: =R[-5]C[1]+1 -> 30 | D35: =R[-5]C+30 -> 59 | E35: =R[-5]C -> 75 | F35: =R[-5]C -> 99 | G35: 13102 | H35: =R[-5]C -> 4
A36: 2 | B36: 10 | C36: =R[-5]C[1]+1 -> 30 | D36: =R[-5]C+30 -> 59 | E36: =R[-5]C -> 100 | F36: =R[-5]C -> 100 | G36: 13102 | H36: =R[-5]C -> 5
A37: 2 | B37: 11 | C37: =R[-5]C[1]+1 -> 60 | D37: =R[-5]C+30 -> 89 | E37: =R[-5]C -> 0 | F37: =R[-5]C -> 24 | G37: 13103 | H37: =R[-5]C -> 1
A38: 2 | B38: 12 | C38: =R[-5]C[1]+1 -> 60 | D38: =R[-5]C+30 -> 89 | E38: =R[-5]C -> 25 | F38: =R[-5]C -> 49 | G38: 13103 | H38: =R[-5]C -> 2
A39: 2 | B39: 13 | C39: =R[-5]C[1]+1 -> 60 | D39: =R[-5]C+30 -> 89 | E39: =R[-5]C -> 50 | F39: =R[-5]C -> 74 | G39: 13103 | H39: =R[-5]C -> 3
A40: 2 | B40: 14 | C40: =R[-5]C[1]+1 -> 60 | D40: =R[-5]C+30 -> 89 | E40: =R[-5]C -> 75 | F40: =R[-5]C -> 99 | G40: 13103 | H40: =R[-5]C -> 4
A41: 2 | B41: 15 | C41: =R[-5]C[1]+1 -> 60 | D41: =R[-5]C+30 -> 89 | E41: =R[-5]C -> 100 | F41: =R[-5]C -> 100 | G41: 13103 | H41: =R[-5]C -> 5
A42: 2 | B42: 16 | C42: =R[-5]C[1]+1 -> 90 | D42: 999 | E42: =R[-5]C -> 0 | F42: =R[-5]C -> 24 | G42: 13104 | H42: =R[-5]C -> 1
A43: 2 | B43: 17 | C43: =R[-5]C[1]+1 -> 90 | D43: 999 | E43: =R[-5]C -> 25 | F43: =R[-5]C -> 49 | G43: 13104 | H43: =R[-5]C -> 2
A44: 2 | B44: 18 | C44: =R[-5]C[1]+1 -> 90 | D44: 999 | E44: =R[-5]C -> 50 | F44: =R[-5]C -> 74 | G44: 13104 | H44: =R[-5]C -> 3
A45: 2 | B45: 19 | C45: =R[-5]C[1]+1 -> 90 | D45: 999 | E45: =R[-5]C -> 75 | F45: =R[-5]C -> 99 | G45: 13104 | H45: =R[-5]C -> 4
A46: 2 | B46: 20 | C46: =R[-5]C[1]+1 -> 90 | D46: 999 | E46: =R[-5]C -> 100 | F46: =R[-5]C -> 100 | G46: 13104 | H46: =R[-5]C -> 5

Sheet: 7.NPC
A1: npc_id| | B1: npc_name| | C1: model_type| | D1: model_id| | E1: model_scale| | F1: npc_pos| | G1: bubble_str_list|
A2: 不可空 | B2: 不可空 | C2: 不可空 | D2: 不可空 | E2: 不可空 | F2: 不可空 | G2: 不可空
A3: 数字 | B3: 字符串 | C3: 数字 | D3: 数字 | E3: 数字 | F3: 一维数组 | G3: 一维数组
F4: 不定长 | G4: 不定长
A6: ID | B6: 名字 | C6: 模型类型 | D6: 模型ID | E6: 模型缩放比例 | F6: 坐标 | G6: 气泡飘字
A7: 1 | B7: 亚莱特之王 | C7: 1 | D7: 31402 | E7: 0.4 | F7: 680|480 | G7: "我们的故土……决不屈服！"
A8: 2 | B8: 医师 | C8: 1 | D8: 30340 | E8: 0.4 | F8: 695|474 | G8: "还缺好多药草……"
A9: 3 | B9: 伤员 | C9: 1 | D9: 32320 | E9: 0.4 | F9: 390|421 | G9: "哈……我还能再打一场！"
A10: 4 | B10: 伤员 | C10: 1 | D10: 31300 | E10: 0.4 | F10: 641|287 | G10: "我怎么会倒下——"
A11: 5 | B11: 伤员 | C11: 1 | D11: 30300 | E11: 0.4 | F11: 861|434 | G11: "敌人太多了……"
A12: 6 | B12: 传奇魔法师 | C12: 1 | D12: 30438 | E12: 0.4 | F12: 762|664 | G12: "这个问题我很感兴趣。"
A13: 7 | B13: 暗影行者 | C13: 1 | D13: 32428 | E13: 0.4 | F13: 326|657 | G13: "古神也是我的敌人……"
A14: 8 | B14: 大海之主 | C14: 1 | D14: 32330 | E14: 0.4 | F14: 989|657 | G14: "没有谁能让大海屈服——"
A15: 9 | B15: 智慧女神 | C15: 1 | D15: 31441 | E15: 0.4 | F15: 1015|370 | G15: "你终于来了……"
A16: 10 | B16: 传承古树 | C16: 1 | D16: 32411 | E16: 0.4 | F16: 1260|788 | G16: "知识会一直传承下去。"
A17: 11 | B17: 牛头人酋长 | C17: 1 | D17: 32400 | E17: 0.4 | F17: 1377|98 | G17: "英勇是不会被击退的。"
A18: 12 | B18: 巨人王 | C18: 1 | D18: 31999 | E18: 0.4 | F18: 573|842 | G18: "巨人的勇气！是大地的赋予！"
A19: 13 | B19: 荒漠游侠 | C19: 1 | D19: 31403 | E19: 0.4 | F19: 362|267 | G19: "维护正义是责任而不是选择！"
A20: 14 | B20: 反抗军大统领 | C20: 1 | D20: 30301 | E20: 0.4 | F20: 975|640 | G20: "必须彻底击垮它们！"
A21: 15 | B21: 抗战圣女 | C21: 1 | D21: 31440 | E21: 0.4 | F21: 1385|115 | G21: "我们会获得自由的，毫无疑问。"
A22: 16 | B22: 雷霆锻造者 | C22: 1 | D22: 30431 | E22: 0.4 | F22: 1440|590 | G22: "我来为你们提供装备！"
A23: 17 | B23: 鹰之翼 | C23: 1 | D23: 30420 | E23: 0.4 | F23: 460|680 | G23: "我看到了希望——"
A24: 18 | B24: 机械大师 | C24: 1 | D24: 30402 | E24: 0.4 | F24: 1500|520 | G24: "钢铁的艺术在于精巧。"

Sheet: 8.答题
A1: question_id| | B1: question_content| | C1: question_answer| | D1: right_answer|
A2: 不可空 | B2: 不可空 | C2: 不可空 | D2: 不可空
A3: 数字 | B3: 字符串 | C3: 一维数组 | D3: 数字
C4: 不定长
A6: ID | B6: 问题 | C6: 答案 | D6: 正确答案
A7: 1001 | B7: 以下哪个魔法是“非元素系魔法”？ | C7: "火球术"|"冰箭术"|"重力增强"|"支配人类" | D7: 4 | E7: =RC[-4] -> 1001 | F7: =RC[-5] -> 1001
A8: 1002 | B8: 以下哪个地区不是西方神秘学的源头之一？ | C8: "古埃及"|"巴比伦"|"希伯来"|"希腊罗马" | D8: 2 | E8: =R[-1]C&"|"&RC[-4] -> 1001|1002 | F8: =R[-1]C&"|"&RC[-5] -> 1001|1002
A9: 1003 | B9: 宙斯出自哪里？ | C9: "北欧神话"|"埃及神话"|"希腊神话"|"凯尔特神话" | D9: 3 | E9: =R[-1]C&"|"&RC[-4] -> 1001|1002|1003 | F9: =R[-1]C&"|"&RC[-5] -> 1001|1002|1003
A10: 1004 | B10: 以下哪个人物出自北欧神话？ | C10: "托尔"|"波塞冬"|"雅典娜"|"宙斯" | D10: 1 | E10: =R[-1]C&"|"&RC[-4] -> 1001|1002|1003|1004 | F10: =R[-1]C&"|"&RC[-5] -> 1001|1002|1003|1004
A11: 1005 | B11: 阿努比斯的别名包括？ | C11: "冥界之王"|"死神"|"沙漠神"|"狼神" | D11: 1 | E11: =R[-1]C&"|"&RC[-4] -> 1001|1002|1003|1004|1005 | F11: =R[-1]C&"|"&RC[-5] -> 1001|1002|1003|1004|1005
A12: 1006 | B12: 以下哪个不是阿努比斯的神职？ | C12: "墓地守护"|"转生指引"|"木乃伊制作"|"守密" | D12: 2 | E12: =R[-1]C&"|"&RC[-4] -> 1001|1002|1003|1004|1005|1006 | F12: =R[-1]C&"|"&RC[-5] -> 1001|1002|1003|1004|1005|1006
A13: 1007 | B13: 阿努比斯俗称什么？ | C13: "木乃伊之神"|"狗头"|"胡狼神"|"天平守护者" | D13: 3 | E13: =R[-1]C&"|"&RC[-4] -> 1001|1002|1003|1004|1005|1006|1007 | F13: =R[-1]C&"|"&RC[-5] -> 1001|1002|1003|1004|1005|1006|1007
A14: 1008 | B14: 阿努比斯出自哪里？ | C14: "北欧神话"|"希腊神话"|"凯尔特神话"|"埃及神话" | D14: 4 | E14: =R[-1]C&"|"&RC[-4] -> 1001|1002|1003|1004|1005|1006|1007|1008 | F14: =R[-1]C&"|"&RC[-5] -> 1001|1002|1003|1004|1005|1006|1007|1008
A15: 1009 | B15: 大力神海格力斯是谁所生？ | C15: "阿尔克墨涅"|"奥丁"|"波塞冬"|"赫拉" | D15: 1 | E15: =R[-1]C&"|"&RC[-4] -> 1001|1002|1003|1004|1005|1006|1007|1008|1009 | F15: =R[-1]C&"|"&RC[-5] -> 1001|1002|1003|1004|1005|1006|1007|1008|1009
A16: 1010 | B16: 海格力斯完成的12项被誉为“不可能完成”的任务不包括以下哪一项？ | C16: "打扫牛棚"|"斩杀美杜莎"|"制服公牛"|"制服食人马" | D16: 2 | E16: =R[-1]C&"|"&RC[-4] -> 1001|1002|1003|1004|1005|1006|1007|1008|1009|1010 | F16: =R[-1]C&"|"&RC[-5] -> 1001|1002|1003|1004|1005|1006|1007|1008|1009|1010
A17: 1011 | B17: 大力神海格力斯死于谁的阴谋？ | C17: "天后赫拉"|"美杜莎"|"半人马涅索斯"|"赫柏" | D17: 3 | E17: =R[-1]C&"|"&RC[-4] -> 1001|1002|1003|1004|1005|1006|1007|1008|1009|1010|1011 | F17: =R[-1]C&"|"&RC[-5] -> 1001|1002|1003|1004|1005|1006|1007|1008|1009|1010|1011
A18: 1012 | B18: 以下哪一个不曾教导过大力神海格力斯？ | C18: "喀戎"|"卡斯托耳尔"|"里诺斯"|"拉达曼提斯" | D18: 4 | E18: =R[-1]C&"|"&RC[-4] -> 1001|1002|1003|1004|1005|1006|1007|1008|1009|1010|1011|1012 | F18: =R[-1]C&"|"&RC[-5] -> 1001|1002|1003|1004|1005|1006|1007|1008|1009|1010|1011|1012
A19: 1013 | B19: 美杜莎和丝西娜、尤瑞艾莉并称什么？ | C19: "戈耳工三女妖"|"格赖埃三姐妹"|"美杜莎女妖"|"石化女妖" | D19: 1 | E19: =R[-1]C&"|"&RC[-4] -> 1001|1002|1003|1004|1005|1006|1007|1008|1009|1010|1011|1012|1013 | F19: =R[-1]C&"|"&RC[-5] -> 1001|1002|1003|1004|1005|1006|1007|1008|1009|1010|1011|1012|1013
A20: 1014 | B20: 珀伽索斯和谁都是美杜莎的儿子？ | C20: "丝西娜"|"克律萨俄耳"|"刻托"|"佩佛瑞多" | D20: 2 | E20: =R[-1]C&"|"&RC[-4] -> 1001|1002|1003|1004|1005|1006|1007|1008|1009|1010|1011|1012|1013|1014 | F20: =R[-1]C&"|"&RC[-5] -> 1001|1002|1003|1004|1005|1006|1007|1008|1009|1010|1011|1012|1013|1014
A21: 1015 | B21: 根据诗人奥维德的《变形记》所述，美杜莎是被谁诅咒变成了怪物？ | C21: "宙斯"|"波塞冬"|"雅典娜"|"珀耳修斯" | D21: 3 | E21: =R[-1]C&"|"&RC[-4] -> 1001|1002|1003|1004|1005|1006|1007|1008|1009|1010|1011|1012|1013|1014|1015 | F21: =R[-1]C&"|"&RC[-5] -> 1001|1002|1003|1004|1005|1006|1007|1008|1009|1010|1011|1012|1013|1014|1015
A22: 1016 | B22: 美杜莎出自哪个神话体系？ | C22: "北欧神话"|"埃及神话"|"凯尔特神话"|"希腊神话" | D22: 4 | E22: =R[-1]C&"|"&RC[-4] -> 1001|1002|1003|1004|1005|1006|1007|1008|1009|1010|1011|1012|1013|1014|1015|1016 | F22: =R[-1]C&"|"&RC[-5] -> 1001|1002|1003|1004|1005|1006|1007|1008|1009|1010|1011|1012|1013|1014|1015|1016
A23: 1017 | B23: 贞德是什么派别的圣人？ | C23: "天主教"|"东正教"|"佛教"|"新教" | D23: 1 | E23: =R[-1]C&"|"&RC[-4] -> 1001|1002|1003|1004|1005|1006|1007|1008|1009|1010|1011|1012|1013|1014|1015|1016|1017 | F23: =R[-1]C&"|"&RC[-5] -> 1001|1002|1003|1004|1005|1006|1007|1008|1009|1010|1011|1012|1013|1014|1015|1016|1017
A24: 1018 | B24: 以下哪一项描述不符合贞德？ | C24: "天主教圣人"|"战败而死"|"军事家"|"民族英雄" | D24: 2 | E24: =R[-1]C&"|"&RC[-4] -> 1001|1002|1003|1004|1005|1006|1007|1008|1009|1010|1011|1012|1013|1014|1015|1016|1017|1018 | F24: =R[-1]C&"|"&RC[-5] -> 1001|1002|1003|1004|1005|1006|1007|1008|1009|1010|1011|1012|1013|1014|1015|1016|1017|1018
A25: 1019 | B25: 贞德属于哪个国家？ | C25: "美国"|"德国"|"法国"|"英国" | D25: 3 | E25: =R[-1]C&"|"&RC[-4] -> 1001|1002|1003|1004|1005|1006|1007|1008|1009|1010|1011|1012|1013|1014|1015|1016|1017|1018|1019 | F25: =R[-1]C&"|"&RC[-5] -> 1001|1002|1003|1004|1005|1006|1007|1008|1009|1010|1011|1012|1013|1014|1015|1016|1017|1018|1019
A26: 1020 | B26: 扑克牌里哪张牌的形象是查理大帝？ | C26: "梅花J"|"方块K"|"黑桃K"|"红桃K" | D26: 4 | E26: =R[-1]C&"|"&RC[-4] -> 1001|1002|1003|1004|1005|1006|1007|1008|1009|1010|1011|1012|1013|1014|1015|1016|1017|1018|1019|1020 | F26: =R[-1]C&"|"&RC[-5] -> 1001|1002|1003|1004|1005|1006|1007|1008|1009|1010|1011|1012|1013|1014|1015|1016|1017|1018|1019|1020
A27: 1021 | B27: 以下哪个称呼不是用于查理大帝？ | C27: "查里德"|"伟大的野蛮人"|"卡尔大帝"|"欧洲之父" | D27: 1 | E27: =R[-1]C&"|"&RC[-4] -> 1001|1002|1003|1004|1005|1006|1007|1008|1009|1010|1011|1012|1013|1014|1015|1016|1017|1018|1019|1020|1021 | F27: =R[-1]C&"|"&RC[-5] -> 1001|1002|1003|1004|1005|1006|1007|1008|1009|1010|1011|1012|1013|1014|1015|1016|1017|1018|1019|1020|1021
A28: 1022 | B28: 史诗叙事诗《罗兰之歌》中，查理大帝的佩刀名为咎瓦尤斯，以下哪个名称不是用于称呼它？ | C28: "黄金之剑"|"辉煌之剑"|"欢悦之剑"|"地球之剑" | D28: 2 | E28: =R[-1]C&"|"&RC[-4] -> 1001|1002|1003|1004|1005|1006|1007|1008|1009|1010|1011|1012|1013|1014|1015|1016|1017|1018|1019|1020|1021|1022 | F28: =R[-1]C&"|"&RC[-5] -> 1001|1002|1003|1004|1005|1006|1007|1008|1009|1010|1011|1012|1013|1014|1015|1016|1017|1018|1019|1020|1021|1022
A29: 1023 | B29: 斯巴达国王列奥尼达在哪场著名战役中率领300斯巴达勇士死战不退，最终全部战死？ | C29: "马拉松战役"|"萨拉米湾海战"|"温泉关战役"|"布匿战争" | D29: 3 | E29: =R[-1]C&"|"&RC[-4] -> 1001|1002|1003|1004|1005|1006|1007|1008|1009|1010|1011|1012|1013|1014|1015|1016|1017|1018|1019|1020|1021|1022|1023 | F29: =R[-1]C&"|"&RC[-5] -> 1001|1002|1003|1004|1005|1006|1007|1008|1009|1010|1011|1012|1013|1014|1015|1016|1017|1018|1019|1020|1021|1022|1023
A30: 1024 | B30: 斯巴达国王列奥尼达一世在传说中是谁的后裔？ | C30: "阿瑞斯"|"阿波罗"|"狄俄尼索斯"|"海格力斯" | D30: 4 | E30: =R[-1]C&"|"&RC[-4] -> 1001|1002|1003|1004|1005|1006|1007|1008|1009|1010|1011|1012|1013|1014|1015|1016|1017|1018|1019|1020|1021|1022|1023|1024 | F30: =R[-1]C&"|"&RC[-5] -> 1001|1002|1003|1004|1005|1006|1007|1008|1009|1010|1011|1012|1013|1014|1015|1016|1017|1018|1019|1020|1021|1022|1023|1024
A31: 1025 | B31: 以下四位女神，哪一位不属于“三处女神”？ | C31: "瑞亚"|"雅典娜"|"赫斯提亚"|"阿耳忒弥斯" | D31: 1 | E31: =R[-1]C&"|"&RC[-4] -> 1001|1002|1003|1004|1005|1006|1007|1008|1009|1010|1011|1012|1013|1014|1015|1016|1017|1018|1019|1020|1021|1022|1023|1024|1025 | F31: =R[-1]C&"|"&RC[-5] -> 1001|1002|1003|1004|1005|1006|1007|1008|1009|1010|1011|1012|1013|1014|1015|1016|1017|1018|1019|1020|1021|1022|1023|1024|1025
A32: 1026 | B32: 以下哪个不是描述狩猎女神阿尔忒弥斯？ | C32: "野兽的女主人"|"阿波罗的妹妹"|"荒野的女领主"|"反对男女婚姻" | D32: 2 | E32: =R[-1]C&"|"&RC[-4] -> 1001|1002|1003|1004|1005|1006|1007|1008|1009|1010|1011|1012|1013|1014|1015|1016|1017|1018|1019|1020|1021|1022|1023|1024|1025|1026 | F32: =R[-1]C&"|"&RC[-5] -> 1001|1002|1003|1004|1005|1006|1007|1008|1009|1010|1011|1012|1013|1014|1015|1016|1017|1018|1019|1020|1021|1022|1023|1024|1025|1026
A33: 1027 | B33: 以下哪个事物不在狩猎女神阿尔忒弥斯的司掌范围内？ | C33: "月亮"|"森林"|"贞节"|"孕育" | D33: 3 | E33: =R[-1]C&"|"&RC[-4] -> 1001|1002|1003|1004|1005|1006|1007|1008|1009|1010|1011|1012|1013|1014|1015|1016|1017|1018|1019|1020|1021|1022|1023|1024|1025|1026|1027 | F33: =R[-1]C&"|"&RC[-5] -> 1001|1002|1003|1004|1005|1006|1007|1008|1009|1010|1011|1012|1013|1014|1015|1016|1017|1018|1019|1020|1021|1022|1023|1024|1025|1026|1027
A34: 1028 | B34: 狩猎女神阿尔忒弥斯视作最为神圣的动物是什么？ | C34: "野猪"|"金角战马"|"黑色猎犬"|"金角鹿" | D34: 4 | E34: =R[-1]C&"|"&RC[-4] -> 1001|1002|1003|1004|1005|1006|1007|1008|1009|1010|1011|1012|1013|1014|1015|1016|1017|1018|1019|1020|1021|1022|1023|1024|1025|1026|1027|1028 | F34: =R[-1]C&"|"&RC[-5] -> 1001|1002|1003|1004|1005|1006|1007|1008|1009|1010|1011|1012|1013|1014|1015|1016|1017|1018|1019|1020|1021|1022|1023|1024|1025|1026|1027|1028
A35: 1029 | B35: 吸血鬼德古拉的原型，弗拉德三世被称作“德古拉”意为什么？ | C35: "龙之子"|"龙之大公"|"穿刺公"|"吸血鬼" | D35: 1 | E35: =R[-1]C&"|"&RC[-4] -> 1001|1002|1003|1004|1005|1006|1007|1008|1009|1010|1011|1012|1013|1014|1015|1016|1017|1018|1019|1020|1021|1022|1023|1024|1025|1026|1027|1028|1029 | F35: =R[-1]C&"|"&RC[-5] -> 1001|1002|1003|1004|1005|1006|1007|1008|1009|1010|1011|1012|1013|1014|1015|1016|1017|1018|1019|1020|1021|1022|1023|1024|1025|1026|1027|1028|1029
A36: 1030 | B36: 弗拉德三世因为用尖木桩虐杀战俘的残忍行为，被称作什么？ | C36: "德古拉"|"穿刺公"|"龙之大公"|"吸血鬼" | D36: 2 | E36: =R[-1]C&"|"&RC[-4] -> 1001|1002|1003|1004|1005|1006|1007|1008|1009|1010|1011|1012|1013|1014|1015|1016|1017|1018|1019|1020|1021|1022|1023|1024|1025|1026|1027|1028|1029|1030 | F36: =R[-1]C&"|"&RC[-5] -> 1001|1002|1003|1004|1005|1006|1007|1008|1009|1010|1011|1012|1013|1014|1015|1016|1017|1018|1019|1020|1021|1022|1023|1024|1025|1026|1027|1028|1029|1030
A37: 1031 | B37: 传说中的独眼巨人不具备以下哪个特点？ | C37: "擅长锻造"|"擅长使用工具"|"百臂巨人之子"|"感情冲动" | D37: 3 | E37: =R[-1]C&"|"&RC[-4] -> 1001|1002|1003|1004|1005|1006|1007|1008|1009|1010|1011|1012|1013|1014|1015|1016|1017|1018|1019|1020|1021|1022|1023|1024|1025|1026|1027|1028|1029|1030|1031 | F37: =R[-1]C&"|"&RC[-5] -> 1001|1002|1003|1004|1005|1006|1007|1008|1009|1010|1011|1012|1013|1014|1015|1016|1017|1018|1019|1020|1021|1022|1023|1024|1025|1026|1027|1028|1029|1030|1031
A38: 1032 | B38: 佐罗名字的本意是什么？ | C38: "剑客"|"蒙面"|"锄强扶弱"|"狐狸" | D38: 4 | E38: =R[-1]C&"|"&RC[-4] -> 1001|1002|1003|1004|1005|1006|1007|1008|1009|1010|1011|1012|1013|1014|1015|1016|1017|1018|1019|1020|1021|1022|1023|1024|1025|1026|1027|1028|1029|1030|1031|1032 | F38: =R[-1]C&"|"&RC[-5] -> 1001|1002|1003|1004|1005|1006|1007|1008|1009|1010|1011|1012|1013|1014|1015|1016|1017|1018|1019|1020|1021|1022|1023|1024|1025|1026|1027|1028|1029|1030|1031|1032
A39: 1033 | B39: 传说中，亚马逊女王彭忒西勒亚死于谁的手里？ | C39: "阿喀琉斯"|"埃阿斯"|"狄俄墨得斯"|"特拉蒙" | D39: 1 | E39: =R[-1]C&"|"&RC[-4] -> 1001|1002|1003|1004|1005|1006|1007|1008|1009|1010|1011|1012|1013|1014|1015|1016|1017|1018|1019|1020|1021|1022|1023|1024|1025|1026|1027|1028|1029|1030|1031|1032|1033 | F39: =R[-1]C&"|"&RC[-5] -> 1001|1002|1003|1004|1005|1006|1007|1008|1009|1010|1011|1012|1013|1014|1015|1016|1017|1018|1019|1020|1021|1022|1023|1024|1025|1026|1027|1028|1029|1030|1031|1032|1033
A40: 1034 | B40: 雅典娜出生于宙斯的头颅，是因为宙斯将谁吞进了肚子里？ | C40: "波洛斯"|"墨提斯"|"赫耳墨斯"|"泰西斯" | D40: 2 | E40: =R[-1]C&"|"&RC[-4] -> 1001|1002|1003|1004|1005|1006|1007|1008|1009|1010|1011|1012|1013|1014|1015|1016|1017|1018|1019|1020|1021|1022|1023|1024|1025|1026|1027|1028|1029|1030|1031|1032|1033|1034 | F40: =R[-1]C&"|"&RC[-5] -> 1001|1002|1003|1004|1005|1006|1007|1008|1009|1010|1011|1012|1013|1014|1015|1016|1017|1018|1019|1020|1021|1022|1023|1024|1025|1026|1027|1028|1029|1030|1031|1032|1033|1034
A41: 1035 | B41: 传说中，独眼巨人为宙斯锻造了闪电长矛，为波塞冬锻造了三叉戟，为哈迪斯锻造了什么？ | C41: "隐形头盔"|"镰刀"|"双股叉"|"长剑" | D41: 3 | E41: =R[-1]C&"|"&RC[-4] -> 1001|1002|1003|1004|1005|1006|1007|1008|1009|1010|1011|1012|1013|1014|1015|1016|1017|1018|1019|1020|1021|1022|1023|1024|1025|1026|1027|1028|1029|1030|1031|1032|1033|1034|1035 | F41: =R[-1]C&"|"&RC[-5] -> 1001|1002|1003|1004|1005|1006|1007|1008|1009|1010|1011|1012|1013|1014|1015|1016|1017|1018|1019|1020|1021|1022|1023|1024|1025|1026|1027|1028|1029|1030|1031|1032|1033|1034|1035
A42: 1036 | B42: 潘多拉打开盒子，所有灾难、瘟疫和祸害都飞了出来，惊慌万分的潘多拉把盒子关上，唯独什么东西没来得及飞出盒子？ | C42: "理智"|"绝望"|"智慧"|"希望" | D42: 4 | E42: =R[-1]C&"|"&RC[-4] -> 1001|1002|1003|1004|1005|1006|1007|1008|1009|1010|1011|1012|1013|1014|1015|1016|1017|1018|1019|1020|1021|1022|1023|1024|1025|1026|1027|1028|1029|1030|1031|1032|1033|1034|1035|1036 | F42: =R[-1]C&"|"&RC[-5] -> 1001|1002|1003|1004|1005|1006|1007|1008|1009|1010|1011|1012|1013|1014|1015|1016|1017|1018|1019|1020|1021|1022|1023|1024|1025|1026|1027|1028|1029|1030|1031|1032|1033|1034|1035|1036
A43: 2001 | B43: 什么材料可用于精灵升级？ | C43: "世界气息"|"灵魂精魄"|"世界之心碎片"|"灵性精粹" | D43: 4 | E43: =RC[-4] -> 2001 | F43: =R[-1]C&"|"&RC[-5] -> 1001|1002|1003|1004|1005|1006|1007|1008|1009|1010|1011|1012|1013|1014|1015|1016|1017|1018|1019|1020|1021|1022|1023|1024|1025|1026|1027|1028|1029|1030|1031|1032|1033|1034|1035|1036|2001
A44: 2002 | B44: 以下哪个不属于军团技能？ | C44: "攻击强化"|"物防强化"|"格挡强化"|"生命强化" | D44: 3 | E44: =R[-1]C&"|"&RC[-4] -> 2001|2002 | F44: =R[-1]C&"|"&RC[-5] -> 1001|1002|1003|1004|1005|1006|1007|1008|1009|1010|1011|1012|1013|1014|1015|1016|1017|1018|1019|1020|1021|1022|1023|1024|1025|1026|1027|1028|1029|1030|1031|1032|1033|1034|1035|1036|2001|2002
A45: 2003 | B45: 以下哪个称号可以在王者赛中获得？ | C45: "破坏王者"|"骑士王者"|"荣誉王者"|"毁灭王者" | D45: 2 | E45: =R[-1]C&"|"&RC[-4] -> 2001|2002|2003 | F45: =R[-1]C&"|"&RC[-5] -> 1001|1002|1003|1004|1005|1006|1007|1008|1009|1010|1011|1012|1013|1014|1015|1016|1017|1018|1019|1020|1021|1022|1023|1024|1025|1026|1027|1028|1029|1030|1031|1032|1033|1034|1035|1036|2001|2002|2003
A46: 2004 | B46: 英雄分解无法获得什么？ | C46: "英雄碎片"|"金币"|"传承核心"|"魂晶" | D46: 1 | E46: =R[-1]C&"|"&RC[-4] -> 2001|2002|2003|2004 | F46: =R[-1]C&"|"&RC[-5] -> 1001|1002|1003|1004|1005|1006|1007|1008|1009|1010|1011|1012|1013|1014|1015|1016|1017|1018|1019|1020|1021|1022|1023|1024|1025|1026|1027|1028|1029|1030|1031|1032|1033|1034|1035|1036|2001|2002|2003|2004
A47: 2005 | B47: 英雄进阶到+7需要多少级？ | C47: "45"|"50"|"55"|"60" | D47: 3 | E47: =R[-1]C&"|"&RC[-4] -> 2001|2002|2003|2004|2005 | F47: =R[-1]C&"|"&RC[-5] -> 1001|1002|1003|1004|1005|1006|1007|1008|1009|1010|1011|1012|1013|1014|1015|1016|1017|1018|1019|1020|1021|1022|1023|1024|1025|1026|1027|1028|1029|1030|1031|1032|1033|1034|1035|1036|2001|2002|2003|2004|2005
A48: 2006 | B48: 物品背包储存的物品上限是多少？ | C48: "100"|"150"|"200"|"无上限" | D48: 4 | E48: =R[-1]C&"|"&RC[-4] -> 2001|2002|2003|2004|2005|2006 | F48: =R[-1]C&"|"&RC[-5] -> 1001|1002|1003|1004|1005|1006|1007|1008|1009|1010|1011|1012|1013|1014|1015|1016|1017|1018|1019|1020|1021|1022|1023|1024|1025|1026|1027|1028|1029|1030|1031|1032|1033|1034|1035|1036|2001|2002|2003|2004|2005|2006
A49: 2007 | B49: 王者赛中，黄金段位升段后是什么段位？ | C49: "王者"|"钻石"|"铂金"|"黄金" | D49: 3 | E49: =R[-1]C&"|"&RC[-4] -> 2001|2002|2003|2004|2005|2006|2007 | F49: =R[-1]C&"|"&RC[-5] -> 1001|1002|1003|1004|1005|1006|1007|1008|1009|1010|1011|1012|1013|1014|1015|1016|1017|1018|1019|1020|1021|1022|1023|1024|1025|1026|1027|1028|1029|1030|1031|1032|1033|1034|1035|1036|2001|2002|2003|2004|2005|2006|2007
A50: 2008 | B50: 神装商店的购买需要消耗什么？ | C50: "威名"|"装备碎片"|"钻石"|"声望" | D50: 1 | E50: =R[-1]C&"|"&RC[-4] -> 2001|2002|2003|2004|2005|2006|2007|2008 | F50: =R[-1]C&"|"&RC[-5] -> 1001|1002|1003|1004|1005|1006|1007|1008|1009|1010|1011|1012|1013|1014|1015|1016|1017|1018|1019|1020|1021|1022|1023|1024|1025|1026|1027|1028|1029|1030|1031|1032|1033|1034|1035|1036|2001|2002|2003|2004|2005|2006|2007|2008
A51: 2009 | B51: 英雄初级召唤每天有多少次免费次数？ | C51: "1"|"3"|"没有"|"无数次" | D51: 2 | E51: =R[-1]C&"|"&RC[-4] -> 2001|2002|2003|2004|2005|2006|2007|2008|2009 | F51: =R[-1]C&"|"&RC[-5] -> 1001|1002|1003|1004|1005|1006|1007|1008|1009|1010|1011|1012|1013|1014|1015|1016|1017|1018|1019|1020|1021|1022|1023|1024|1025|1026|1027|1028|1029|1030|1031|1032|1033|1034|1035|1036|2001|2002|2003|2004|2005|2006|2007|2008|2009
A52: 2010 | B52: 每日从几点开始可以挑战军团副本？ | C52: "10:30"|"10:00"|"9:30"|"9:00" | D52: 1 | E52: =R[-1]C&"|"&RC[-4] -> 2001|2002|2003|2004|2005|2006|2007|2008|2009|2010 | F52: =R[-1]C&"|"&RC[-5] -> 1001|1002|1003|1004|1005|1006|1007|1008|1009|1010|1011|1012|1013|1014|1015|1016|1017|1018|1019|1020|1021|1022|1023|1024|1025|1026|1027|1028|1029|1030|1031|1032|1033|1034|1035|1036|2001|2002|2003|2004|2005|2006|2007|2008|2009|2010
A53: 2011 | B53: 合成紫色圣器需要几个圣器碎片？ | C53: "3"|"4"|"5"|"6" | D53: 2 | E53: =R[-1]C&"|"&RC[-4] -> 2001|2002|2003|2004|2005|2006|2007|2008|2009|2010|2011 | F53: =R[-1]C&"|"&RC[-5] -> 1001|1002|1003|1004|1005|1006|1007|1008|1009|1010|1011|1012|1013|1014|1015|1016|1017|1018|1019|1020|1021|1022|1023|1024|1025|1026|1027|1028|1029|1030|1031|1032|1033|1034|1035|1036|2001|2002|2003|2004|2005|2006|2007|2008|2009|2010|2011
A54: 2012 | B54: 合成蓝色圣器需要几个圣器碎片？ | C54: "3"|"4"|"5"|"6" | D54: 1 | E54: =R[-1]C&"|"&RC[-4] -> 2001|2002|2003|2004|2005|2006|2007|2008|2009|2010|2011|2012 | F54: =R[-1]C&"|"&RC[-5] -> 1001|1002|1003|1004|1005|1006|1007|1008|1009|1010|1011|1012|1013|1014|1015|1016|1017|1018|1019|1020|1021|1022|1023|1024|1025|1026|1027|1028|1029|1030|1031|1032|1033|1034|1035|1036|2001|2002|2003|2004|2005|2006|2007|2008|2009|2010|2011|2012
A55: 2013 | B55: 合成橙色圣器需要几个圣器碎片？ | C55: "3"|"4"|"5"|"6" | D55: 3 | E55: =R[-1]C&"|"&RC[-4] -> 2001|2002|2003|2004|2005|2006|2007|2008|2009|2010|2011|2012|2013 | F55: =R[-1]C&"|"&RC[-5] -> 1001|1002|1003|1004|1005|1006|1007|1008|1009|1010|1011|1012|1013|1014|1015|1016|1017|1018|1019|1020|1021|1022|1023|1024|1025|1026|1027|1028|1029|1030|1031|1032|1033|1034|1035|1036|2001|2002|2003|2004|2005|2006|2007|2008|2009|2010|2011|2012|2013
A56: 2014 | B56: 竞技场每次挑战消耗多少点精力？ | C56: "1"|"2"|"3"|"5" | D56: 2 | E56: =R[-1]C&"|"&RC[-4] -> 2001|2002|2003|2004|2005|2006|2007|2008|2009|2010|2011|2012|2013|2014 | F56: =R[-1]C&"|"&RC[-5] -> 1001|1002|1003|1004|1005|1006|1007|1008|1009|1010|1011|1012|1013|1014|1015|1016|1017|1018|1019|1020|1021|1022|1023|1024|1025|1026|1027|1028|1029|1030|1031|1032|1033|1034|1035|1036|2001|2002|2003|2004|2005|2006|2007|2008|2009|2010|2011|2012|2013|2014
A57: 2015 | B57: 每次帮好友镇压遗迹暴动可以获得多少钻石？ | C57: "20"|"10"|"5"|"2" | D57: 3 | E57: =R[-1]C&"|"&RC[-4] -> 2001|2002|2003|2004|2005|2006|2007|2008|2009|2010|2011|2012|2013|2014|2015 | F57: =R[-1]C&"|"&RC[-5] -> 1001|1002|1003|1004|1005|1006|1007|1008|1009|1010|1011|1012|1013|1014|1015|1016|1017|1018|1019|1020|1021|1022|1023|1024|1025|1026|1027|1028|1029|1030|1031|1032|1033|1034|1035|1036|2001|2002|2003|2004|2005|2006|2007|2008|2009|2010|2011|2012|2013|2014|2015
A58: 2016 | B58: 抢夺圣器每次消耗多少点精力？ | C58: "3"|"1"|"5"|"2" | D58: 4 | E58: =R[-1]C&"|"&RC[-4] -> 2001|2002|2003|2004|2005|2006|2007|2008|2009|2010|2011|2012|2013|2014|2015|2016 | F58: =R[-1]C&"|"&RC[-5] -> 1001|1002|1003|1004|1005|1006|1007|1008|1009|1010|1011|1012|1013|1014|1015|1016|1017|1018|1019|1020|1021|1022|1023|1024|1025|1026|1027|1028|1029|1030|1031|1032|1033|1034|1035|1036|2001|2002|2003|2004|2005|2006|2007|2008|2009|2010|2011|2012|2013|2014|2015|2016
A59: 2017 | B59: 十次英雄初级召唤需要消耗多少友情点？ | C59: "10"|"2700"|"2000"|"3000" | D59: 3 | E59: =R[-1]C&"|"&RC[-4] -> 2001|2002|2003|2004|2005|2006|2007|2008|2009|2010|2011|2012|2013|2014|2015|2016|2017 | F59: =R[-1]C&"|"&RC[-5] -> 1001|1002|1003|1004|1005|1006|1007|1008|1009|1010|1011|1012|1013|1014|1015|1016|1017|1018|1019|1020|1021|1022|1023|1024|1025|1026|1027|1028|1029|1030|1031|1032|1033|1034|1035|1036|2001|2002|2003|2004|2005|2006|2007|2008|2009|2010|2011|2012|2013|2014|2015|2016|2017
A60: 2018 | B60: 英雄高级召唤的“召唤十次”需要消耗多少钻石？ | C60: "10"|"2700"|"2000"|"3000" | D60: 2 | E60: =R[-1]C&"|"&RC[-4] -> 2001|2002|2003|2004|2005|2006|2007|2008|2009|2010|2011|2012|2013|2014|2015|2016|2017|2018 | F60: =R[-1]C&"|"&RC[-5] -> 1001|1002|1003|1004|1005|1006|1007|1008|1009|1010|1011|1012|1013|1014|1015|1016|1017|1018|1019|1020|1021|1022|1023|1024|1025|1026|1027|1028|1029|1030|1031|1032|1033|1034|1035|1036|2001|2002|2003|2004|2005|2006|2007|2008|2009|2010|2011|2012|2013|2014|2015|2016|2017|2018
A61: 2019 | B61: 每次赠送精力会为好友增加多少点精力？ | C61: "1"|"2"|"3"|"5" | D61: 1 | E61: =R[-1]C&"|"&RC[-4] -> 2001|2002|2003|2004|2005|2006|2007|2008|2009|2010|2011|2012|2013|2014|2015|2016|2017|2018|2019 | F61: =R[-1]C&"|"&RC[-5] -> 1001|1002|1003|1004|1005|1006|1007|1008|1009|1010|1011|1012|1013|1014|1015|1016|1017|1018|1019|1020|1021|1022|1023|1024|1025|1026|1027|1028|1029|1030|1031|1032|1033|1034|1035|1036|2001|2002|2003|2004|2005|2006|2007|2008|2009|2010|2011|2012|2013|2014|2015|2016|2017|2018|2019
A62: 2020 | B62: 以下哪些英雄的怒气技能命中目标为“敌方全体”？ | C62: "雷神"|"查理大帝"|"牛头人"|"神圣牧师" | D62: 2 | E62: =R[-1]C&"|"&RC[-4] -> 2001|2002|2003|2004|2005|2006|2007|2008|2009|2010|2011|2012|2013|2014|2015|2016|2017|2018|2019|2020 | F62: =R[-1]C&"|"&RC[-5] -> 1001|1002|1003|1004|1005|1006|1007|1008|1009|1010|1011|1012|1013|1014|1015|1016|1017|1018|1019|1020|1021|1022|1023|1024|1025|1026|1027|1028|1029|1030|1031|1032|1033|1034|1035|1036|2001|2002|2003|2004|2005|2006|2007|2008|2009|2010|2011|2012|2013|2014|2015|2016|2017|2018|2019|2020
A63: 2021 | B63: “愤怒符文”是什么？ | C63: "英雄技能"|"护腕"|"攻击型圣器"|"精灵技能" | D63: 3 | E63: =R[-1]C&"|"&RC[-4] -> 2001|2002|2003|2004|2005|2006|2007|2008|2009|2010|2011|2012|2013|2014|2015|2016|2017|2018|2019|2020|2021 | F63: =R[-1]C&"|"&RC[-5] -> 1001|1002|1003|1004|1005|1006|1007|1008|1009|1010|1011|1012|1013|1014|1015|1016|1017|1018|1019|1020|1021|1022|1023|1024|1025|1026|1027|1028|1029|1030|1031|1032|1033|1034|1035|1036|2001|2002|2003|2004|2005|2006|2007|2008|2009|2010|2011|2012|2013|2014|2015|2016|2017|2018|2019|2020|2021
A64: 2022 | B64: 希望精灵的升华道具是什么？ | C64: "希望之心"|"希望宝石"|"生命结晶"|"自然宝石" | D64: 1 | E64: =R[-1]C&"|"&RC[-4] -> 2001|2002|2003|2004|2005|2006|2007|2008|2009|2010|2011|2012|2013|2014|2015|2016|2017|2018|2019|2020|2021|2022 | F64: =R[-1]C&"|"&RC[-5] -> 1001|1002|1003|1004|1005|1006|1007|1008|1009|1010|1011|1012|1013|1014|1015|1016|1017|1018|1019|1020|1021|1022|1023|1024|1025|1026|1027|1028|1029|1030|1031|1032|1033|1034|1035|1036|2001|2002|2003|2004|2005|2006|2007|2008|2009|2010|2011|2012|2013|2014|2015|2016|2017|2018|2019|2020|2021|2022
A65: 2023 | B65: 英雄初级召唤，同一天内两次免费召唤次数间的间隔时间是多少？ | C65: "3分钟"|"5分钟"|"10分钟"|"无间隔" | D65: 3 | E65: =R[-1]C&"|"&RC[-4] -> 2001|2002|2003|2004|2005|2006|2007|2008|2009|2010|2011|2012|2013|2014|2015|2016|2017|2018|2019|2020|2021|2022|2023 | F65: =R[-1]C&"|"&RC[-5] -> 1001|1002|1003|1004|1005|1006|1007|1008|1009|1010|1011|1012|1013|1014|1015|1016|1017|1018|1019|1020|1021|1022|1023|1024|1025|1026|1027|1028|1029|1030|1031|1032|1033|1034|1035|1036|2001|2002|2003|2004|2005|2006|2007|2008|2009|2010|2011|2012|2013|2014|2015|2016|2017|2018|2019|2020|2021|2022|2023
A66: 2024 | B66: 哪个英雄和半人马达成合击效果？ | C66: "基伦"|"食人魔"|"火女"|"牛头人" | D66: 2 | E66: =R[-1]C&"|"&RC[-4] -> 2001|2002|2003|2004|2005|2006|2007|2008|2009|2010|2011|2012|2013|2014|2015|2016|2017|2018|2019|2020|2021|2022|2023|2024 | F66: =R[-1]C&"|"&RC[-5] -> 1001|1002|1003|1004|1005|1006|1007|1008|1009|1010|1011|1012|1013|1014|1015|1016|1017|1018|1019|1020|1021|1022|1023|1024|1025|1026|1027|1028|1029|1030|1031|1032|1033|1034|1035|1036|2001|2002|2003|2004|2005|2006|2007|2008|2009|2010|2011|2012|2013|2014|2015|2016|2017|2018|2019|2020|2021|2022|2023|2024
A67: 2025 | B67: 一级军团最多可以容纳多少成员？ | C67: "25"|"30"|"32"|"35" | D67: 2 | E67: =R[-1]C&"|"&RC[-4] -> 2001|2002|2003|2004|2005|2006|2007|2008|2009|2010|2011|2012|2013|2014|2015|2016|2017|2018|2019|2020|2021|2022|2023|2024|2025 | F67: =R[-1]C&"|"&RC[-5] -> 1001|1002|1003|1004|1005|1006|1007|1008|1009|1010|1011|1012|1013|1014|1015|1016|1017|1018|1019|1020|1021|1022|1023|1024|1025|1026|1027|1028|1029|1030|1031|1032|1033|1034|1035|1036|2001|2002|2003|2004|2005|2006|2007|2008|2009|2010|2011|2012|2013|2014|2015|2016|2017|2018|2019|2020|2021|2022|2023|2024|2025
A68: 2035 | B68: 王者赛的结算时间是什么时候？ | C68: "每个星期一"|"每个月最后一天"|"每个星期天"|"每个星期二" | D68: 4 | E68: =R[-1]C&"|"&RC[-4] -> 2001|2002|2003|2004|2005|2006|2007|2008|2009|2010|2011|2012|2013|2014|2015|2016|2017|2018|2019|2020|2021|2022|2023|2024|2025|2035 | F68: =R[-1]C&"|"&RC[-5] -> 1001|1002|1003|1004|1005|1006|1007|1008|1009|1010|1011|1012|1013|1014|1015|1016|1017|1018|1019|1020|1021|1022|1023|1024|1025|1026|1027|1028|1029|1030|1031|1032|1033|1034|1035|1036|2001|2002|2003|2004|2005|2006|2007|2008|2009|2010|2011|2012|2013|2014|2015|2016|2017|2018|2019|2020|2021|2022|2023|2024|2025|2035
A69: 2036 | B69: 死亡武士的资质是多少？ | C69: "10"|"12"|"15"|"20" | D69: 2 | E69: =R[-1]C&"|"&RC[-4] -> 2001|2002|2003|2004|2005|2006|2007|2008|2009|2010|2011|2012|2013|2014|2015|2016|2017|2018|2019|2020|2021|2022|2023|2024|2025|2035|2036 | F69: =R[-1]C&"|"&RC[-5] -> 1001|1002|1003|1004|1005|1006|1007|1008|1009|1010|1011|1012|1013|1014|1015|1016|1017|1018|1019|1020|1021|1022|1023|1024|1025|1026|1027|1028|1029|1030|1031|1032|1033|1034|1035|1036|2001|2002|2003|2004|2005|2006|2007|2008|2009|2010|2011|2012|2013|2014|2015|2016|2017|2018|2019|2020|2021|2022|2023|2024|2025|2035|2036
A70: 2037 | B70: 亚马逊女王的资质是多少？ | C70: "10"|"12"|"20"|"25" | D70: 3 | E70: =R[-1]C&"|"&RC[-4] -> 2001|2002|2003|2004|2005|2006|2007|2008|2009|2010|2011|2012|2013|2014|2015|2016|2017|2018|2019|2020|2021|2022|2023|2024|2025|2035|2036|2037 | F70: =R[-1]C&"|"&RC[-5] -> 1001|1002|1003|1004|1005|1006|1007|1008|1009|1010|1011|1012|1013|1014|1015|1016|1017|1018|1019|1020|1021|1022|1023|1024|1025|1026|1027|1028|1029|1030|1031|1032|1033|1034|1035|1036|2001|2002|2003|2004|2005|2006|2007|2008|2009|2010|2011|2012|2013|2014|2015|2016|2017|2018|2019|2020|2021|2022|2023|2024|2025|2035|2036|2037
A71: 2038 | B71: 血色指挥官的资质是多少？ | C71: "10"|"12"|"20"|"25" | D71: 4 | E71: =R[-1]C&"|"&RC[-4] -> 2001|2002|2003|2004|2005|2006|2007|2008|2009|2010|2011|2012|2013|2014|2015|2016|2017|2018|2019|2020|2021|2022|2023|2024|2025|2035|2036|2037|2038 | F71: =R[-1]C&"|"&RC[-5] -> 1001|1002|1003|1004|1005|1006|1007|1008|1009|1010|1011|1012|1013|1014|1015|1016|1017|1018|1019|1020|1021|1022|1023|1024|1025|1026|1027|1028|1029|1030|1031|1032|1033|1034|1035|1036|2001|2002|2003|2004|2005|2006|2007|2008|2009|2010|2011|2012|2013|2014|2015|2016|2017|2018|2019|2020|2021|2022|2023|2024|2025|2035|2036|2037|2038
A72: 2039 | B72: 以下哪个英雄的怒气技能带有“眩晕”效果？ | C72: "牛头人"|"美杜莎"|"大力神"|"树人" | D72: 1 | E72: =R[-1]C&"|"&RC[-4] -> 2001|2002|2003|2004|2005|2006|2007|2008|2009|2010|2011|2012|2013|2014|2015|2016|2017|2018|2019|2020|2021|2022|2023|2024|2025|2035|2036|2037|2038|2039 | F72: =R[-1]C&"|"&RC[-5] -> 1001|1002|1003|1004|1005|1006|1007|1008|1009|1010|1011|1012|1013|1014|1015|1016|1017|1018|1019|1020|1021|1022|1023|1024|1025|1026|1027|1028|1029|1030|1031|1032|1033|1034|1035|1036|2001|2002|2003|2004|2005|2006|2007|2008|2009|2010|2011|2012|2013|2014|2015|2016|2017|2018|2019|2020|2021|2022|2023|2024|2025|2035|2036|2037|2038|2039
A73: 2040 | B73: 以下哪个英雄的怒气技能带有“放逐”效果？ | C73: "混沌女巫"|"超凡博士"|"狩猎女神"|"神圣牧师" | D73: 2 | E73: =R[-1]C&"|"&RC[-4] -> 2001|2002|2003|2004|2005|2006|2007|2008|2009|2010|2011|2012|2013|2014|2015|2016|2017|2018|2019|2020|2021|2022|2023|2024|2025|2035|2036|2037|2038|2039|2040 | F73: =R[-1]C&"|"&RC[-5] -> 1001|1002|1003|1004|1005|1006|1007|1008|1009|1010|1011|1012|1013|1014|1015|1016|1017|1018|1019|1020|1021|1022|1023|1024|1025|1026|1027|1028|1029|1030|1031|1032|1033|1034|1035|1036|2001|2002|2003|2004|2005|2006|2007|2008|2009|2010|2011|2012|2013|2014|2015|2016|2017|2018|2019|2020|2021|2022|2023|2024|2025|2035|2036|2037|2038|2039|2040
A74: 2041 | B74: 以下哪个英雄的怒气技能带有“击退”效果？ | C74: "半人马"|"终极队长"|"斯巴达"|"熊阿宝" | D74: 3 | E74: =R[-1]C&"|"&RC[-4] -> 2001|2002|2003|2004|2005|2006|2007|2008|2009|2010|2011|2012|2013|2014|2015|2016|2017|2018|2019|2020|2021|2022|2023|2024|2025|2035|2036|2037|2038|2039|2040|2041 | F74: =R[-1]C&"|"&RC[-5] -> 1001|1002|1003|1004|1005|1006|1007|1008|1009|1010|1011|1012|1013|1014|1015|1016|1017|1018|1019|1020|1021|1022|1023|1024|1025|1026|1027|1028|1029|1030|1031|1032|1033|1034|1035|1036|2001|2002|2003|2004|2005|2006|2007|2008|2009|2010|2011|2012|2013|2014|2015|2016|2017|2018|2019|2020|2021|2022|2023|2024|2025|2035|2036|2037|2038|2039|2040|2041
A75: 2042 | B75: 以下哪个英雄没有合击技能？ | C75: "半人马"|"大力神"|"树人"|"终极队长" | D75: 4 | E75: =R[-1]C&"|"&RC[-4] -> 2001|2002|2003|2004|2005|2006|2007|2008|2009|2010|2011|2012|2013|2014|2015|2016|2017|2018|2019|2020|2021|2022|2023|2024|2025|2035|2036|2037|2038|2039|2040|2041|2042 | F75: =R[-1]C&"|"&RC[-5] -> 1001|1002|1003|1004|1005|1006|1007|1008|1009|1010|1011|1012|1013|1014|1015|1016|1017|1018|1019|1020|1021|1022|1023|1024|1025|1026|1027|1028|1029|1030|1031|1032|1033|1034|1035|1036|2001|2002|2003|2004|2005|2006|2007|2008|2009|2010|2011|2012|2013|2014|2015|2016|2017|2018|2019|2020|2021|2022|2023|2024|2025|2035|2036|2037|2038|2039|2040|2041|2042
A76: 2043 | B76: 每次帮好友镇压遗迹暴动，好友可以获得什么？ | C76: "2点精力值"|"1瓶精力药剂"|"1点精力值"|"没有" | D76: 1 | E76: =R[-1]C&"|"&RC[-4] -> 2001|2002|2003|2004|2005|2006|2007|2008|2009|2010|2011|2012|2013|2014|2015|2016|2017|2018|2019|2020|2021|2022|2023|2024|2025|2035|2036|2037|2038|2039|2040|2041|2042|2043 | F76: =R[-1]C&"|"&RC[-5] -> 1001|1002|1003|1004|1005|1006|1007|1008|1009|1010|1011|1012|1013|1014|1015|1016|1017|1018|1019|1020|1021|1022|1023|1024|1025|1026|1027|1028|1029|1030|1031|1032|1033|1034|1035|1036|2001|2002|2003|2004|2005|2006|2007|2008|2009|2010|2011|2012|2013|2014|2015|2016|2017|2018|2019|2020|2021|2022|2023|2024|2025|2035|2036|2037|2038|2039|2040|2041|2042|2043
A77: 2044 | B77: 遗迹“荒漠古迹”的名称是什么？ | C77: "无艮荒原"|"克莱斯的瑰宝"|"史克赛博"|"死亡沙漠" | D77: 2 | E77: =R[-1]C&"|"&RC[-4] -> 2001|2002|2003|2004|2005|2006|2007|2008|2009|2010|2011|2012|2013|2014|2015|2016|2017|2018|2019|2020|2021|2022|2023|2024|2025|2035|2036|2037|2038|2039|2040|2041|2042|2043|2044 | F77: =R[-1]C&"|"&RC[-5] -> 1001|1002|1003|1004|1005|1006|1007|1008|1009|1010|1011|1012|1013|1014|1015|1016|1017|1018|1019|1020|1021|1022|1023|1024|1025|1026|1027|1028|1029|1030|1031|1032|1033|1034|1035|1036|2001|2002|2003|2004|2005|2006|2007|2008|2009|2010|2011|2012|2013|2014|2015|2016|2017|2018|2019|2020|2021|2022|2023|2024|2025|2035|2036|2037|2038|2039|2040|2041|2042|2043|2044
A78: 3001 | B78: 钢铁侠出生于哪里？ | C78: "纽约"|"洛杉矶"|"芝加哥"|"华盛顿" | D78: 1 | E78: =RC[-4] -> 3001 | F78: =R[-1]C&"|"&RC[-5] -> 1001|1002|1003|1004|1005|1006|1007|1008|1009|1010|1011|1012|1013|1014|1015|1016|1017|1018|1019|1020|1021|1022|1023|1024|1025|1026|1027|1028|1029|1030|1031|1032|1033|1034|1035|1036|2001|2002|2003|2004|2005|2006|2007|2008|2009|2010|2011|2012|2013|2014|2015|2016|2017|2018|2019|2020|2021|2022|2023|2024|2025|2035|2036|2037|2038|2039|2040|2041|2042|2043|2044|3001
A79: 3002 | B79: 奇异博士原本的职业是什么？ | C79: "教授"|"医生"|"商人"|"无业人员" | D79: 2 | E79: =R[-1]C&"|"&RC[-4] -> 3001|3002 | F79: =R[-1]C&"|"&RC[-5] -> 1001|1002|1003|1004|1005|1006|1007|1008|1009|1010|1011|1012|1013|1014|1015|1016|1017|1018|1019|1020|1021|1022|1023|1024|1025|1026|1027|1028|1029|1030|1031|1032|1033|1034|1035|1036|2001|2002|2003|2004|2005|2006|2007|2008|2009|2010|2011|2012|2013|2014|2015|2016|2017|2018|2019|2020|2021|2022|2023|2024|2025|2035|2036|2037|2038|2039|2040|2041|2042|2043|2044|3001|3002
A80: 3003 | B80: 奇异博士从谁那里继承了“至尊魔法师”的名号？ | C80: "多玛姆"|"莫多"|"史蒂芬"|"古一" | D80: 4 | E80: =R[-1]C&"|"&RC[-4] -> 3001|3002|3003 | F80: =R[-1]C&"|"&RC[-5] -> 1001|1002|1003|1004|1005|1006|1007|1008|1009|1010|1011|1012|1013|1014|1015|1016|1017|1018|1019|1020|1021|1022|1023|1024|1025|1026|1027|1028|1029|1030|1031|1032|1033|1034|1035|1036|2001|2002|2003|2004|2005|2006|2007|2008|2009|2010|2011|2012|2013|2014|2015|2016|2017|2018|2019|2020|2021|2022|2023|2024|2025|2035|2036|2037|2038|2039|2040|2041|2042|2043|2044|3001|3002|3003
A81: 3004 | B81: 班纳博士是因为什么而发生了变异成为绿巨人？ | C81: "核辐射"|"宇宙射线辐射"|"伽玛射线辐射"|"自然死亡" | D81: 3 | E81: =R[-1]C&"|"&RC[-4] -> 3001|3002|3003|3004 | F81: =R[-1]C&"|"&RC[-5] -> 1001|1002|1003|1004|1005|1006|1007|1008|1009|1010|1011|1012|1013|1014|1015|1016|1017|1018|1019|1020|1021|1022|1023|1024|1025|1026|1027|1028|1029|1030|1031|1032|1033|1034|1035|1036|2001|2002|2003|2004|2005|2006|2007|2008|2009|2010|2011|2012|2013|2014|2015|2016|2017|2018|2019|2020|2021|2022|2023|2024|2025|2035|2036|2037|2038|2039|2040|2041|2042|2043|2044|3001|3002|3003|3004
A82: 3005 | B82: 班纳博士会因为什么原因变身为绿巨人浩克？（仅限电影中） | C82: "太阳下山"|"愤怒"|"睡眠"|"咆哮" | D82: 2 | E82: =R[-1]C&"|"&RC[-4] -> 3001|3002|3003|3004|3005 | F82: =R[-1]C&"|"&RC[-5] -> 1001|1002|1003|1004|1005|1006|1007|1008|1009|1010|1011|1012|1013|1014|1015|1016|1017|1018|1019|1020|1021|1022|1023|1024|1025|1026|1027|1028|1029|1030|1031|1032|1033|1034|1035|1036|2001|2002|2003|2004|2005|2006|2007|2008|2009|2010|2011|2012|2013|2014|2015|2016|2017|2018|2019|2020|2021|2022|2023|2024|2025|2035|2036|2037|2038|2039|2040|2041|2042|2043|2044|3001|3002|3003|3004|3005
A83: 3006 | B83: 黑寡妇在加入复仇者联盟之前，服务于哪个组织？ | C83: "红房"|"九头蛇"|"A.I.M."|"利维坦" | D83: 1 | E83: =R[-1]C&"|"&RC[-4] -> 3001|3002|3003|3004|3005|3006 | F83: =R[-1]C&"|"&RC[-5] -> 1001|1002|1003|1004|1005|1006|1007|1008|1009|1010|1011|1012|1013|1014|1015|1016|1017|1018|1019|1020|1021|1022|1023|1024|1025|1026|1027|1028|1029|1030|1031|1032|1033|1034|1035|1036|2001|2002|2003|2004|2005|2006|2007|2008|2009|2010|2011|2012|2013|2014|2015|2016|2017|2018|2019|2020|2021|2022|2023|2024|2025|2035|2036|2037|2038|2039|2040|2041|2042|2043|2044|3001|3002|3003|3004|3005|3006
A84: 3007 | B84: 红骷髅的名号最早来源于什么？ | C84: "红骷髅般的头颅"|"红色骷髅面具"|"死亡之尘"|"血腥手段" | D84: 2 | E84: =R[-1]C&"|"&RC[-4] -> 3001|3002|3003|3004|3005|3006|3007 | F84: =R[-1]C&"|"&RC[-5] -> 1001|1002|1003|1004|1005|1006|1007|1008|1009|1010|1011|1012|1013|1014|1015|1016|1017|1018|1019|1020|1021|1022|1023|1024|1025|1026|1027|1028|1029|1030|1031|1032|1033|1034|1035|1036|2001|2002|2003|2004|2005|2006|2007|2008|2009|2010|2011|2012|2013|2014|2015|2016|2017|2018|2019|2020|2021|2022|2023|2024|2025|2035|2036|2037|2038|2039|2040|2041|2042|2043|2044|3001|3002|3003|3004|3005|3006|3007
A85: 3008 | B85: 漫威漫画下的雷神托尔，其生母是谁？ | C85: "泰西斯"|"弗丽嘉"|"盖亚"|"瑞亚" | D85: 3 | E85: =R[-1]C&"|"&RC[-4] -> 3001|3002|3003|3004|3005|3006|3007|3008 | F85: =R[-1]C&"|"&RC[-5] -> 1001|1002|1003|1004|1005|1006|1007|1008|1009|1010|1011|1012|1013|1014|1015|1016|1017|1018|1019|1020|1021|1022|1023|1024|1025|1026|1027|1028|1029|1030|1031|1032|1033|1034|1035|1036|2001|2002|2003|2004|2005|2006|2007|2008|2009|2010|2011|2012|2013|2014|2015|2016|2017|2018|2019|2020|2021|2022|2023|2024|2025|2035|2036|2037|2038|2039|2040|2041|2042|2043|2044|3001|3002|3003|3004|3005|3006|3007|3008
A86: 3009 | B86: 超级英雄鹰眼师从剑客和谁？ | C86: "贾维斯"|"黑寡妇"|"钢铁侠"|"捷射" | D86: 4 | E86: =R[-1]C&"|"&RC[-4] -> 3001|3002|3003|3004|3005|3006|3007|3008|3009 | F86: =R[-1]C&"|"&RC[-5] -> 1001|1002|1003|1004|1005|1006|1007|1008|1009|1010|1011|1012|1013|1014|1015|1016|1017|1018|1019|1020|1021|1022|1023|1024|1025|1026|1027|1028|1029|1030|1031|1032|1033|1034|1035|1036|2001|2002|2003|2004|2005|2006|2007|2008|2009|2010|2011|2012|2013|2014|2015|2016|2017|2018|2019|2020|2021|2022|2023|2024|2025|2035|2036|2037|2038|2039|2040|2041|2042|2043|2044|3001|3002|3003|3004|3005|3006|3007|3008|3009
A87: 3010 | B87: 刀锋战士是一名吸血鬼猎人，他拥有什么血统？ | C87: "半人类半吸血鬼"|"半狼人半吸血鬼"|"纯种吸血鬼"|"半人类半狼人" | D87: 1 | E87: =R[-1]C&"|"&RC[-4] -> 3001|3002|3003|3004|3005|3006|3007|3008|3009|3010 | F87: =R[-1]C&"|"&RC[-5] -> 1001|1002|1003|1004|1005|1006|1007|1008|1009|1010|1011|1012|1013|1014|1015|1016|1017|1018|1019|1020|1021|1022|1023|1024|1025|1026|1027|1028|1029|1030|1031|1032|1033|1034|1035|1036|2001|2002|2003|2004|2005|2006|2007|2008|2009|2010|2011|2012|2013|2014|2015|2016|2017|2018|2019|2020|2021|2022|2023|2024|2025|2035|2036|2037|2038|2039|2040|2041|2042|2043|2044|3001|3002|3003|3004|3005|3006|3007|3008|3009|3010
A88: 3011 | B88: 初代恶灵骑士乔纳森·布雷泽，在成为恶灵骑士之前，他的职业是什么？ | C88: "摩托车赛车手"|"摩托车特技车手"|"摩托车修理员"|"摩托车销售员" | D88: 2 | E88: =R[-1]C&"|"&RC[-4] -> 3001|3002|3003|3004|3005|3006|3007|3008|3009|3010|3011 | F88: =R[-1]C&"|"&RC[-5] -> 1001|1002|1003|1004|1005|1006|1007|1008|1009|1010|1011|1012|1013|1014|1015|1016|1017|1018|1019|1020|1021|1022|1023|1024|1025|1026|1027|1028|1029|1030|1031|1032|1033|1034|1035|1036|2001|2002|2003|2004|2005|2006|2007|2008|2009|2010|2011|2012|2013|2014|2015|2016|2017|2018|2019|2020|2021|2022|2023|2024|2025|2035|2036|2037|2038|2039|2040|2041|2042|2043|2044|3001|3002|3003|3004|3005|3006|3007|3008|3009|3010|3011
A89: 3012 | B89: 树人格鲁特的种族是？ | C89: "枯木树人族"|"巨树人族"|"花神巨像族"|"枯木巨像族" | D89: 3 | E89: =R[-1]C&"|"&RC[-4] -> 3001|3002|3003|3004|3005|3006|3007|3008|3009|3010|3011|3012 | F89: =R[-1]C&"|"&RC[-5] -> 1001|1002|1003|1004|1005|1006|1007|1008|1009|1010|1011|1012|1013|1014|1015|1016|1017|1018|1019|1020|1021|1022|1023|1024|1025|1026|1027|1028|1029|1030|1031|1032|1033|1034|1035|1036|2001|2002|2003|2004|2005|2006|2007|2008|2009|2010|2011|2012|2013|2014|2015|2016|2017|2018|2019|2020|2021|2022|2023|2024|2025|2035|2036|2037|2038|2039|2040|2041|2042|2043|2044|3001|3002|3003|3004|3005|3006|3007|3008|3009|3010|3011|3012
A90: 3013 | B90: 变种人弥赛亚，白凤凰，霍普·萨默斯，这个名字是谁为她取的？ | C90: "玛德琳·普赖尔"|"琴·葛蕾"|"镭射眼"|"电索" | D90: 4 | E90: =R[-1]C&"|"&RC[-4] -> 3001|3002|3003|3004|3005|3006|3007|3008|3009|3010|3011|3012|3013 | F90: =R[-1]C&"|"&RC[-5] -> 1001|1002|1003|1004|1005|1006|1007|1008|1009|1010|1011|1012|1013|1014|1015|1016|1017|1018|1019|1020|1021|1022|1023|1024|1025|1026|1027|1028|1029|1030|1031|1032|1033|1034|1035|1036|2001|2002|2003|2004|2005|2006|2007|2008|2009|2010|2011|2012|2013|2014|2015|2016|2017|2018|2019|2020|2021|2022|2023|2024|2025|2035|2036|2037|2038|2039|2040|2041|2042|2043|2044|3001|3002|3003|3004|3005|3006|3007|3008|3009|3010|3011|3012|3013
A91: 3014 | B91: 地狱男爵最早是因为谁想要扭转战局而将他从地狱召唤来？ | C91: "纳粹党"|"美国鹰派"|"法国"|"日本" | D91: 1 | E91: =R[-1]C&"|"&RC[-4] -> 3001|3002|3003|3004|3005|3006|3007|3008|3009|3010|3011|3012|3013|3014 | F91: =R[-1]C&"|"&RC[-5] -> 1001|1002|1003|1004|1005|1006|1007|1008|1009|1010|1011|1012|1013|1014|1015|1016|1017|1018|1019|1020|1021|1022|1023|1024|1025|1026|1027|1028|1029|1030|1031|1032|1033|1034|1035|1036|2001|2002|2003|2004|2005|2006|2007|2008|2009|2010|2011|2012|2013|2014|2015|2016|2017|2018|2019|2020|2021|2022|2023|2024|2025|2035|2036|2037|2038|2039|2040|2041|2042|2043|2044|3001|3002|3003|3004|3005|3006|3007|3008|3009|3010|3011|3012|3013|3014
A92: 3015 | B92: 在漫画中，绯红女巫可以修改现实，是由混沌魔法和哪种能力融合而做到的？ | C92: "精准计算"|"修改概率"|"改变存在"|"改变形态" | D92: 2 | E92: =R[-1]C&"|"&RC[-4] -> 3001|3002|3003|3004|3005|3006|3007|3008|3009|3010|3011|3012|3013|3014|3015 | F92: =R[-1]C&"|"&RC[-5] -> 1001|1002|1003|1004|1005|1006|1007|1008|1009|1010|1011|1012|1013|1014|1015|1016|1017|1018|1019|1020|1021|1022|1023|1024|1025|1026|1027|1028|1029|1030|1031|1032|1033|1034|1035|1036|2001|2002|2003|2004|2005|2006|2007|2008|2009|2010|2011|2012|2013|2014|2015|2016|2017|2018|2019|2020|2021|2022|2023|2024|2025|2035|2036|2037|2038|2039|2040|2041|2042|2043|2044|3001|3002|3003|3004|3005|3006|3007|3008|3009|3010|3011|3012|3013|3014|3015
A93: 4001 | B93: 行动缓慢并且不断的流出血液、发出另人作呕的恶臭的憎恶，是由什么组成的？ | C93: "活人"|"肉块"|"尸体"|"骨头" | D93: 3 | E93: =RC[-4] -> 4001 | F93: =R[-1]C&"|"&RC[-5] -> 1001|1002|1003|1004|1005|1006|1007|1008|1009|1010|1011|1012|1013|1014|1015|1016|1017|1018|1019|1020|1021|1022|1023|1024|1025|1026|1027|1028|1029|1030|1031|1032|1033|1034|1035|1036|2001|2002|2003|2004|2005|2006|2007|2008|2009|2010|2011|2012|2013|2014|2015|2016|2017|2018|2019|2020|2021|2022|2023|2024|2025|2035|2036|2037|2038|2039|2040|2041|2042|2043|2044|3001|3002|3003|3004|3005|3006|3007|3008|3009|3010|3011|3012|3013|3014|3015|4001
A94: 4002 | B94: 魔兽世界中的牛头人居住于大陆中部草原，他们崇尚什么？ | C94: "战斗"|"英勇"|"力量"|"和平" | D94: 4 | E94: =R[-1]C&"|"&RC[-4] -> 4001|4002 | F94: =R[-1]C&"|"&RC[-5] -> 1001|1002|1003|1004|1005|1006|1007|1008|1009|1010|1011|1012|1013|1014|1015|1016|1017|1018|1019|1020|1021|1022|1023|1024|1025|1026|1027|1028|1029|1030|1031|1032|1033|1034|1035|1036|2001|2002|2003|2004|2005|2006|2007|2008|2009|2010|2011|2012|2013|2014|2015|2016|2017|2018|2019|2020|2021|2022|2023|2024|2025|2035|2036|2037|2038|2039|2040|2041|2042|2043|2044|3001|3002|3003|3004|3005|3006|3007|3008|3009|3010|3011|3012|3013|3014|3015|4001|4002
A95: 4003 | B95: dota中秀逗魔导师承诺帮助近卫军团摧毁冰封王座，是为了什么？ | C95: "巨额报酬"|"反抗天灾军团"|"锻炼自己"|"保护平民" | D95: 1 | E95: =R[-1]C&"|"&RC[-4] -> 4001|4002|4003 | F95: =R[-1]C&"|"&RC[-5] -> 1001|1002|1003|1004|1005|1006|1007|1008|1009|1010|1011|1012|1013|1014|1015|1016|1017|1018|1019|1020|1021|1022|1023|1024|1025|1026|1027|1028|1029|1030|1031|1032|1033|1034|1035|1036|2001|2002|2003|2004|2005|2006|2007|2008|2009|2010|2011|2012|2013|2014|2015|2016|2017|2018|2019|2020|2021|2022|2023|2024|2025|2035|2036|2037|2038|2039|2040|2041|2042|2043|2044|3001|3002|3003|3004|3005|3006|3007|3008|3009|3010|3011|3012|3013|3014|3015|4001|4002|4003
A96: 4004 | B96: 魔兽世界中，半人马部落始终和哪个种族进行着无休止的斗争？ | C96: "食人魔"|"牛头人"|"暗夜精灵"|"树妖" | D96: 2 | E96: =R[-1]C&"|"&RC[-4] -> 4001|4002|4003|4004 | F96: =R[-1]C&"|"&RC[-5] -> 1001|1002|1003|1004|1005|1006|1007|1008|1009|1010|1011|1012|1013|1014|1015|1016|1017|1018|1019|1020|1021|1022|1023|1024|1025|1026|1027|1028|1029|1030|1031|1032|1033|1034|1035|1036|2001|2002|2003|2004|2005|2006|2007|2008|2009|2010|2011|2012|2013|2014|2015|2016|2017|2018|2019|2020|2021|2022|2023|2024|2025|2035|2036|2037|2038|2039|2040|2041|2042|2043|2044|3001|3002|3003|3004|3005|3006|3007|3008|3009|3010|3011|3012|3013|3014|3015|4001|4002|4003|4004
A97: 4005 | B97: 双头食人魔和单头食人魔最大的区别在哪里？ | C97: "力量"|"饭量"|"智商"|"地位" | D97: 3 | E97: =R[-1]C&"|"&RC[-4] -> 4001|4002|4003|4004|4005 | F97: =R[-1]C&"|"&RC[-5] -> 1001|1002|1003|1004|1005|1006|1007|1008|1009|1010|1011|1012|1013|1014|1015|1016|1017|1018|1019|1020|1021|1022|1023|1024|1025|1026|1027|1028|1029|1030|1031|1032|1033|1034|1035|1036|2001|2002|2003|2004|2005|2006|2007|2008|2009|2010|2011|2012|2013|2014|2015|2016|2017|2018|2019|2020|2021|2022|2023|2024|2025|2035|2036|2037|2038|2039|2040|2041|2042|2043|2044|3001|3002|3003|3004|3005|3006|3007|3008|3009|3010|3011|3012|3013|3014|3015|4001|4002|4003|4004|4005
A98: 4006 | B98: 英雄联盟中，盖伦是哪个军团的领袖？ | C98: "德玛西亚之力"|"雷瑟守备军团"|"钢铁烈阳"|"无畏先锋军团" | D98: 4 | E98: =R[-1]C&"|"&RC[-4] -> 4001|4002|4003|4004|4005|4006 | F98: =R[-1]C&"|"&RC[-5] -> 1001|1002|1003|1004|1005|1006|1007|1008|1009|1010|1011|1012|1013|1014|1015|1016|1017|1018|1019|1020|1021|1022|1023|1024|1025|1026|1027|1028|1029|1030|1031|1032|1033|1034|1035|1036|2001|2002|2003|2004|2005|2006|2007|2008|2009|2010|2011|2012|2013|2014|2015|2016|2017|2018|2019|2020|2021|2022|2023|2024|2025|2035|2036|2037|2038|2039|2040|2041|2042|2043|2044|3001|3002|3003|3004|3005|3006|3007|3008|3009|3010|3011|3012|3013|3014|3015|4001|4002|4003|4004|4005|4006
A99: 4007 | B99: 以下哪一项不是用于称呼希尔瓦纳斯？ | C99: "亡灵之王"|"被遗忘者"|"黑暗女王"|"女妖之王" | D99: 1 | E99: =R[-1]C&"|"&RC[-4] -> 4001|4002|4003|4004|4005|4006|4007 | F99: =R[-1]C&"|"&RC[-5] -> 1001|1002|1003|1004|1005|1006|1007|1008|1009|1010|1011|1012|1013|1014|1015|1016|1017|1018|1019|1020|1021|1022|1023|1024|1025|1026|1027|1028|1029|1030|1031|1032|1033|1034|1035|1036|2001|2002|2003|2004|2005|2006|2007|2008|2009|2010|2011|2012|2013|2014|2015|2016|2017|2018|2019|2020|2021|2022|2023|2024|2025|2035|2036|2037|2038|2039|2040|2041|2042|2043|2044|3001|3002|3003|3004|3005|3006|3007|3008|3009|3010|3011|3012|3013|3014|3015|4001|4002|4003|4004|4005|4006|4007
A100: 4008 | B100: 魔兽世界的熊猫人王国名为？ | C100: "卡利姆多"|"潘达利亚"|"加基森"|"埃索达" | D100: 2 | E100: =R[-1]C&"|"&RC[-4] -> 4001|4002|4003|4004|4005|4006|4007|4008 | F100: =R[-1]C&"|"&RC[-5] -> 1001|1002|1003|1004|1005|1006|1007|1008|1009|1010|1011|1012|1013|1014|1015|1016|1017|1018|1019|1020|1021|1022|1023|1024|1025|1026|1027|1028|1029|1030|1031|1032|1033|1034|1035|1036|2001|2002|2003|2004|2005|2006|2007|2008|2009|2010|2011|2012|2013|2014|2015|2016|2017|2018|2019|2020|2021|2022|2023|2024|2025|2035|2036|2037|2038|2039|2040|2041|2042|2043|2044|3001|3002|3003|3004|3005|3006|3007|3008|3009|3010|3011|3012|3013|3014|3015|4001|4002|4003|4004|4005|4006|4007|4008
A101: 4009 | B101: 伊利丹由始至终的目标是什么？ | C101: "毁灭世界"|"追求力量"|"摧毁燃烧军团"|"统领暗夜精灵" | D101: 3 | E101: =R[-1]C&"|"&RC[-4] -> 4001|4002|4003|4004|4005|4006|4007|4008|4009 | F101: =R[-1]C&"|"&RC[-5] -> 1001|1002|1003|1004|1005|1006|1007|1008|1009|1010|1011|1012|1013|1014|1015|1016|1017|1018|1019|1020|1021|1022|1023|1024|1025|1026|1027|1028|1029|1030|1031|1032|1033|1034|1035|1036|2001|2002|2003|2004|2005|2006|2007|2008|2009|2010|2011|2012|2013|2014|2015|2016|2017|2018|2019|2020|2021|2022|2023|2024|2025|2035|2036|2037|2038|2039|2040|2041|2042|2043|2044|3001|3002|3003|3004|3005|3006|3007|3008|3009|3010|3011|3012|3013|3014|3015|4001|4002|4003|4004|4005|4006|4007|4008|4009

Sheet: 9.快捷聊天
A1: id| | B1: text|
A2: 不可空 | B2: 不可空
A3: 数字 | B3: 字符串
A6: ID | B6: 文本内容
A7: 1 | B7: 快点吧，时间决定奖励啊！
A8: 2 | B8: 队长快跑起来！
A9: 3 | B9: 跟你们合作很有意思。
A10: 4 | B10: 这一把很愉悦。
A11: 5 | B11: 不要站着不动！
A12: 6 | B12: 萌新求带！！
A13: 7 | B13: 跟着我选一样的！
A14: 8 | B14: 我是大神，听指挥。

Sheet: 10.奖励预览
A1: id| | B1: type| | C1: item_id| | D1: num|
A2: 不可空 | B2: 不可空 | C2: 不可空 | D2: 不可空
A3: 数字 | B3: 数字 | C3: 数字 | D3: 数字
A6: ID | B6: 类型 | C6: 物品ID | D6: 数量
A7: 1 | B7: 1 | C7: 80100 | D7: 1
A8: 2 | B8: 1 | C8: 10097 | D8: 20
A9: 3 | B9: 1 | C9: 19003 | D9: 666666
A10: 4 | B10: 1 | C10: 10003 | D10: 100
A11: 5 | B11: 1 | C11: 10004 | D11: 50
A12: 6 | B12: 2 | C12: 80000 | D12: 1
A13: 7 | B13: 2 | C13: 80010 | D13: 1
A14: 8 | B14: 2 | C14: 19003 | D14: 100000
A15: 9 | B15: 2 | C15: 10097 | D15: 5
A16: 10 | B16: 2 | C16: 10002 | D16: 100
A17: 11 | B17: 2 | C17: 10003 | D17: 30
A18: 12 | B18: 2 | C18: 10004 | D18: 10
A19: 13 | B19: 2 | C19: 10008 | D19: 40