Sheet: 配置
A1: 服务端文件名 | B1: 服务端对应工作表号 | C1: 客户端文件名 | D1: 客户端对应工作表号 | E1: erl头部 | F1: erl内容格式 | G1: erl尾部 | H1: 客户端特殊处理
A2: config_equipment.txt | B2: 1 | C2: config_equipment.cnf|Equipment | D2: 1 | F2: get(id) -> #$ | H2: 2=>id
A3: config_equipment_strengthen.txt | B3: 2 | C3: config_equipment_strengthen.cnf|EquipmentStrenthen | D3: 2 | F3: get(id) -> #$ | H3: 1=>quality,strength_level|level_list
A4: config_equipment_refine.txt | B4: 3 | C4: config_equipment_refine.cnf|EquipmentRefine | D4: 3 | F4: get(quality) -> #$ | H4: 1=>quality,refine_level|level_list
A5: config_equipment_compose.txt | B5: 4 | C5: config_equipment_compose.cnf|EquipmentCompose | D5: 4 | F5: get(id) -> #$ | H5: 2=>id
A6: config_equipment_strengthen_forge.txt | B6: 5 | C6: config_equipment_strengthen_forge.cnf|EquipmentStrengthenForge | D6: 5 | F6: get(id) -> #$ | H6: 2=>strengthen_level
A7: config_equipment_refine_forge.txt | B7: 6 | C7: config_equipment_refine_forging.cnf|EquipmentRefineForge | D7: 6 | F7: get(id) -> #$ | H7: 2=>refine_level
A8: config_equipment_suit.txt | B8: 7 | C8: config_equipment_suit.cnf|EquipmentSuit | D8: 7 | F8: get(id) -> #$ | H8: 2=>id
A9: config_equipment_talent.txt | B9: 8 | C9: config_equipment_talent.cnf|EquipmentTalent | D9: 8 | F9: get(id) -> #$ | H9: 1=>id,talent_level|level_list
A10: config_equipment_star_up.txt | B10: 9 | C10: config_equipment_star_up.cnf|EquipmentStarUp | D10: 9 | F10: get(type) -> #$ | H10: 1=>type,sort_lst|sort_lst
A11: config_equipment_quality_up.txt | B11: 10 | C11: config_equipment_quality_up.cnf|EquipmentQualityUp | D11: 10 | F11: get(quality) -> #$ | H11: 2=>quality

Sheet: 1.装备
A1: id|id | B1: name| | C1: item_type|item_type | D1: taste| | E1: talent|talent_id | F1: next_quality_equipment_id|next_quality_equipment_id | G1: star_max|star_max | H1: star_up_cost_item_id|star_up_cost_item_id | I1: streng_level_max|streng_level_max | J1: refine_level_max|refine_level_max | K1: quality|quality | L1: price|price | M1: reset_cost_diamond|reset_cost_diamond | N1: tower_prestige|tower_prestige | O1: suit_id|suit_id | P1: res_id| | Q1: description| | R1: strengthen_init_pro|strengthen_init_pro | S1: strengthen_add_pro|strengthen_add_pro | T1: refine_pro_type_list|refine_pro_type_list | U1: refine_pro_value_list|refine_pro_value_list | V1: systemid| | W1: equipid| | X1: suit_effect| | Y1: new|
A2: 不可空 | B2: 不可空 | C2: 不可空 | D2: 不可空 | E2: 可空#不需字段 | F2: 可空#不需字段 | G2: 可空#不需字段 | H2: 可空#不需字段 | I2: 不可空 | J2: 不可空 | K2: 不可空 | L2: 不可空 | M2: 不可空 | N2: 不可空 | O2: 可空#不需字段 | P2: 不可空 | Q2: 不可空 | R2: 不可空 | S2: 不可空 | T2: 不可空 | U2: 不可空 | V2: 可空#不需字段 | W2: 可空#不需字段 | X2: 可空#不需字段 | Y2: 可空#不需字段
A3: 数字 | B3: 字符串 | C3: 数字 | D3: 数字 | E3: 数字 | F3: 数字 | G3: 数字 | H3: 数字 | I3: 数字 | J3: 数字 | K3: 数字 | L3: 数字 | M3: 数字 | N3: 数字 | O3: 数字 | P3: 数字 | Q3: 字符串 | R3: 一维数组 | S3: 数字 | T3: 一维数组 | U3: 一维数组 | V3: 一维数组 | W3: 一维数组 | X3: 字符串 | Y3: 数字
R4: 不定长 | T4: 不定长 | U4: 不定长 | V4: 不定长 | W4: 不定长
A6: 装备ID | B6: 装备名称 | C6: 装备类型 | D6: 品级 | E6: 天赋ID | F6: 升品后的装备ID(0表示不可升) | G6: 升星上限 | H6: 升星消耗碎片ID | I6: 强化等级上限 | J6: 精炼等级上限 | K6: 装备品质 | L6: 价钱(金币) | M6: 重生消耗钻石 | N6: 回收获得威名 | O6: 套装ID | P6: 资源id | Q6: 描述 | R6: 装备初始属性 | S6: 强化每级增加属性 | T6: 精炼属性类型列表 | U6: 精炼属性值列表 | V6: 整装获取途径 | W6: 更强装备ID | X6: 装备特效名 | Y6: 是否显示new
A7: 20101 | B7: 长剑 | C7: 0 | D7: 1 | F7: 0 | I7: 300 | J7: 50 | K7: 1 | L7: 100 | M7: 100 | N7: 50 | P7: 20101 | Q7: 很常见的长剑。 | R7: =VLOOKUP(RC3,Sheet1!R2C2:R6C6,2,FALSE)&"|"&VLOOKUP(MOD(RC1,1000),Sheet1!R2C9:R27C13,MATCH(VLOOKUP(RC3,Sheet1!R2C2:R6C6,2,FALSE),Sheet1!R2C9:R2C13,FALSE),FALSE)+VLOOKUP(MOD(RC1,1000),Sheet1!R2C16:R27C20,MATCH(VLOOKUP(RC3,Sheet1!R2C2:R6C6,3,FALSE),Sheet1!R2C16:R2C20,FALSE),FALSE) -> 1|72 | S7: =VLOOKUP(MOD(RC1,1000),Sheet1!R2C16:R27C20,MATCH(VLOOKUP(RC3,Sheet1!R2C2:R6C6,3,FALSE),Sheet1!R2C16:R2C20,FALSE),FALSE) -> 2 | T7: =VLOOKUP(RC3,Sheet1!R2C2:R6C6,4,FALSE)&"|"&VLOOKUP(RC3,Sheet1!R2C2:R6C6,5,FALSE) -> 1|13 | U7: =VLOOKUP(MOD(RC1,1000),Sheet1!R2C23:R27C31,MATCH(VLOOKUP(RC3,Sheet1!R2C2:R6C6,4,FALSE),Sheet1!R2C23:R2C31,FALSE),FALSE)&"|"&VLOOKUP(MOD(RC1,1000),Sheet1!R2C23:R27C31,MATCH(VLOOKUP(RC3,Sheet1!R2C2:R6C6,5,FALSE),Sheet1!R2C23:R2C31,FALSE),FALSE) -> 25|100 | V7: 26 | W7: =IF(AND(RC[-18]="",RC[-8]=""),INT(RC[-22]/1000)*1000+302,"") -> 20302 | Y7: 1
A8: 20102 | B8: 精致战刃 | C8: 0 | D8: 2 | F8: 0 | I8: 300 | J8: 50 | K8: 1 | L8: 100 | M8: 100 | N8: 60 | O8: 101 | P8: 20102 | Q8: 【套装】铁匠多次淬炼最终才打造出来的精致战刃。 | R8: =VLOOKUP(RC3,Sheet1!R2C2:R6C6,2,FALSE)&"|"&VLOOKUP(MOD(RC1,1000),Sheet1!R2C9:R27C13,MATCH(VLOOKUP(RC3,Sheet1!R2C2:R6C6,2,FALSE),Sheet1!R2C9:R2C13,FALSE),FALSE)+VLOOKUP(MOD(RC1,1000),Sheet1!R2C16:R27C20,MATCH(VLOOKUP(RC3,Sheet1!R2C2:R6C6,3,FALSE),Sheet1!R2C16:R2C20,FALSE),FALSE) -> 1|72 | S8: =VLOOKUP(MOD(RC1,1000),Sheet1!R2C16:R27C20,MATCH(VLOOKUP(RC3,Sheet1!R2C2:R6C6,3,FALSE),Sheet1!R2C16:R2C20,FALSE),FALSE) -> 2 | T8: =VLOOKUP(RC3,Sheet1!R2C2:R6C6,4,FALSE)&"|"&VLOOKUP(RC3,Sheet1!R2C2:R6C6,5,FALSE) -> 1|13 | U8: =VLOOKUP(MOD(RC1,1000),Sheet1!R2C23:R27C31,MATCH(VLOOKUP(RC3,Sheet1!R2C2:R6C6,4,FALSE),Sheet1!R2C23:R2C31,FALSE),FALSE)&"|"&VLOOKUP(MOD(RC1,1000),Sheet1!R2C23:R27C31,MATCH(VLOOKUP(RC3,Sheet1!R2C2:R6C6,5,FALSE),Sheet1!R2C23:R2C31,FALSE),FALSE) -> 25|100 | V8: 33 | W8: =IF(AND(RC[-18]="",RC[-8]=""),INT(RC[-22]/1000)*1000+302,"") ->  | X8: UI_taozhuang_lvse | Y8: 1
A9: 20201 | B9: 战争权杖 | C9: 0 | D9: 4 | F9: 0 | I9: 300 | J9: 50 | K9: 2 | L9: 1000 | M9: 100 | N9: 900 | P9: 20201 | Q9: 一柄沉重的权杖，某些暴力的牧师会用它敲爆敌人的脑壳。 | R9: =VLOOKUP(RC3,Sheet1!R2C2:R6C6,2,FALSE)&"|"&VLOOKUP(MOD(RC1,1000),Sheet1!R2C9:R27C13,MATCH(VLOOKUP(RC3,Sheet1!R2C2:R6C6,2,FALSE),Sheet1!R2C9:R2C13,FALSE),FALSE)+VLOOKUP(MOD(RC1,1000),Sheet1!R2C16:R27C20,MATCH(VLOOKUP(RC3,Sheet1!R2C2:R6C6,3,FALSE),Sheet1!R2C16:R2C20,FALSE),FALSE) -> 1|149 | S9: =VLOOKUP(MOD(RC1,1000),Sheet1!R2C16:R27C20,MATCH(VLOOKUP(RC3,Sheet1!R2C2:R6C6,3,FALSE),Sheet1!R2C16:R2C20,FALSE),FALSE) -> 4 | T9: =VLOOKUP(RC3,Sheet1!R2C2:R6C6,4,FALSE)&"|"&VLOOKUP(RC3,Sheet1!R2C2:R6C6,5,FALSE) -> 1|13 | U9: =VLOOKUP(MOD(RC1,1000),Sheet1!R2C23:R27C31,MATCH(VLOOKUP(RC3,Sheet1!R2C2:R6C6,4,FALSE),Sheet1!R2C23:R2C31,FALSE),FALSE)&"|"&VLOOKUP(MOD(RC1,1000),Sheet1!R2C23:R27C31,MATCH(VLOOKUP(RC3,Sheet1!R2C2:R6C6,5,FALSE),Sheet1!R2C23:R2C31,FALSE),FALSE) -> 40|100 | W9: =IF(AND(RC[-18]="",RC[-8]=""),INT(RC[-22]/1000)*1000+302,"") -> 20302 | Y9: 1
A10: 20202 | B10: 骑士长剑 | C10: 0 | D10: 5 | F10: 0 | I10: 300 | J10: 50 | K10: 2 | L10: 1000 | M10: 100 | N10: 1200 | O10: 202 | P10: 20202 | Q10: 【套装】骑士的制式装备之一，一般来说造价更贵。 | R10: =VLOOKUP(RC3,Sheet1!R2C2:R6C6,2,FALSE)&"|"&VLOOKUP(MOD(RC1,1000),Sheet1!R2C9:R27C13,MATCH(VLOOKUP(RC3,Sheet1!R2C2:R6C6,2,FALSE),Sheet1!R2C9:R2C13,FALSE),FALSE)+VLOOKUP(MOD(RC1,1000),Sheet1!R2C16:R27C20,MATCH(VLOOKUP(RC3,Sheet1!R2C2:R6C6,3,FALSE),Sheet1!R2C16:R2C20,FALSE),FALSE) -> 1|185 | S10: =VLOOKUP(MOD(RC1,1000),Sheet1!R2C16:R27C20,MATCH(VLOOKUP(RC3,Sheet1!R2C2:R6C6,3,FALSE),Sheet1!R2C16:R2C20,FALSE),FALSE) -> 5 | T10: =VLOOKUP(RC3,Sheet1!R2C2:R6C6,4,FALSE)&"|"&VLOOKUP(RC3,Sheet1!R2C2:R6C6,5,FALSE) -> 1|13 | U10: =VLOOKUP(MOD(RC1,1000),Sheet1!R2C23:R27C31,MATCH(VLOOKUP(RC3,Sheet1!R2C2:R6C6,4,FALSE),Sheet1!R2C23:R2C31,FALSE),FALSE)&"|"&VLOOKUP(MOD(RC1,1000),Sheet1!R2C23:R27C31,MATCH(VLOOKUP(RC3,Sheet1!R2C2:R6C6,5,FALSE),Sheet1!R2C23:R2C31,FALSE),FALSE) -> 50|100 | W10: =IF(AND(RC[-18]="",RC[-8]=""),INT(RC[-22]/1000)*1000+302,"") ->  | X10: UI_taozhuang_lanse | Y10: 1
A11: 20300 | B11: 审判者 | C11: 0 | D11: 10 | F11: 0 | I11: 300 | J11: 50 | K11: 3 | L11: 10000 | M11: 100 | N11: 6000 | P11: 20300 | Q11: 我将审判不公的一切，审判不义的一切，我是——万恶的终结者、审判者。 | R11: =VLOOKUP(RC3,Sheet1!R2C2:R6C6,2,FALSE)&"|"&VLOOKUP(MOD(RC1,1000),Sheet1!R2C9:R27C13,MATCH(VLOOKUP(RC3,Sheet1!R2C2:R6C6,2,FALSE),Sheet1!R2C9:R2C13,FALSE),FALSE)+VLOOKUP(MOD(RC1,1000),Sheet1!R2C16:R27C20,MATCH(VLOOKUP(RC3,Sheet1!R2C2:R6C6,3,FALSE),Sheet1!R2C16:R2C20,FALSE),FALSE) -> 1|296 | S11: =VLOOKUP(MOD(RC1,1000),Sheet1!R2C16:R27C20,MATCH(VLOOKUP(RC3,Sheet1!R2C2:R6C6,3,FALSE),Sheet1!R2C16:R2C20,FALSE),FALSE) -> 11 | T11: =VLOOKUP(RC3,Sheet1!R2C2:R6C6,4,FALSE)&"|"&VLOOKUP(RC3,Sheet1!R2C2:R6C6,5,FALSE) -> 1|13 | U11: =VLOOKUP(MOD(RC1,1000),Sheet1!R2C23:R27C31,MATCH(VLOOKUP(RC3,Sheet1!R2C2:R6C6,4,FALSE),Sheet1!R2C23:R2C31,FALSE),FALSE)&"|"&VLOOKUP(MOD(RC1,1000),Sheet1!R2C23:R27C31,MATCH(VLOOKUP(RC3,Sheet1!R2C2:R6C6,5,FALSE),Sheet1!R2C23:R2C31,FALSE),FALSE) -> 70|100 | W11: =IF(AND(RC[-18]="",RC[-8]=""),INT(RC[-22]/1000)*1000+302,"") -> 20302 | Y11: 1
A12: 20301 | B12: 掠夺弯刀 | C12: 0 | D12: 10 | F12: 0 | I12: 300 | J12: 50 | K12: 3 | L12: 10000 | M12: 100 | N12: 6000 | P12: 20301 | Q12: 海盗最常用的武器，沾染了许多鲜血的弯刀会令所有看到它的人胆寒。 | R12: =VLOOKUP(RC3,Sheet1!R2C2:R6C6,2,FALSE)&"|"&VLOOKUP(MOD(RC1,1000),Sheet1!R2C9:R27C13,MATCH(VLOOKUP(RC3,Sheet1!R2C2:R6C6,2,FALSE),Sheet1!R2C9:R2C13,FALSE),FALSE)+VLOOKUP(MOD(RC1,1000),Sheet1!R2C16:R27C20,MATCH(VLOOKUP(RC3,Sheet1!R2C2:R6C6,3,FALSE),Sheet1!R2C16:R2C20,FALSE),FALSE) -> 1|296 | S12: =VLOOKUP(MOD(RC1,1000),Sheet1!R2C16:R27C20,MATCH(VLOOKUP(RC3,Sheet1!R2C2:R6C6,3,FALSE),Sheet1!R2C16:R2C20,FALSE),FALSE) -> 11 | T12: =VLOOKUP(RC3,Sheet1!R2C2:R6C6,4,FALSE)&"|"&VLOOKUP(RC3,Sheet1!R2C2:R6C6,5,FALSE) -> 1|13 | U12: =VLOOKUP(MOD(RC1,1000),Sheet1!R2C23:R27C31,MATCH(VLOOKUP(RC3,Sheet1!R2C2:R6C6,4,FALSE),Sheet1!R2C23:R2C31,FALSE),FALSE)&"|"&VLOOKUP(MOD(RC1,1000),Sheet1!R2C23:R27C31,MATCH(VLOOKUP(RC3,Sheet1!R2C2:R6C6,5,FALSE),Sheet1!R2C23:R2C31,FALSE),FALSE) -> 70|100 | W12: =IF(AND(RC[-18]="",RC[-8]=""),INT(RC[-22]/1000)*1000+302,"") -> 20302 | Y12: 1
A13: 20302 | B13: 绞首双剑 | C13: 0 | D13: 11 | E13: =RC[-4]-20000 -> 302 | F13: 0 | I13: 300 | J13: 50 | K13: 3 | L13: 10000 | M13: 100 | N13: 10000 | P13: 20302 | Q13: 比较少见的成对武器，蔓延着凶戾的气息，看来它砍下过不少脑袋。 | R13: =VLOOKUP(RC3,Sheet1!R2C2:R6C6,2,FALSE)&"|"&VLOOKUP(MOD(RC1,1000),Sheet1!R2C9:R27C13,MATCH(VLOOKUP(RC3,Sheet1!R2C2:R6C6,2,FALSE),Sheet1!R2C9:R2C13,FALSE),FALSE)+VLOOKUP(MOD(RC1,1000),Sheet1!R2C16:R27C20,MATCH(VLOOKUP(RC3,Sheet1!R2C2:R6C6,3,FALSE),Sheet1!R2C16:R2C20,FALSE),FALSE) -> 1|322 | S13: =VLOOKUP(MOD(RC1,1000),Sheet1!R2C16:R27C20,MATCH(VLOOKUP(RC3,Sheet1!R2C2:R6C6,3,FALSE),Sheet1!R2C16:R2C20,FALSE),FALSE) -> 12 | T13: =VLOOKUP(RC3,Sheet1!R2C2:R6C6,4,FALSE)&"|"&VLOOKUP(RC3,Sheet1!R2C2:R6C6,5,FALSE) -> 1|13 | U13: =VLOOKUP(MOD(RC1,1000),Sheet1!R2C23:R27C31,MATCH(VLOOKUP(RC3,Sheet1!R2C2:R6C6,4,FALSE),Sheet1!R2C23:R2C31,FALSE),FALSE)&"|"&VLOOKUP(MOD(RC1,1000),Sheet1!R2C23:R27C31,MATCH(VLOOKUP(RC3,Sheet1!R2C2:R6C6,5,FALSE),Sheet1!R2C23:R2C31,FALSE),FALSE) -> 75|100 | W13: =IF(AND(RC[-18]="",RC[-8]=""),INT(RC[-22]/1000)*1000+302,"") ->  | X13: UI_zhuangbei_xingxing | Y13: 1
A14: 20303 | B14: 荣耀权杖 | C14: 0 | D14: 12 | E14: =RC[-4]-20000 -> 303 | F14: 20406 | I14: 300 | J14: 50 | K14: 3 | L14: 10000 | M14: 100 | N14: 12000 | O14: 303 | P14: 20303 | Q14: 【套装】【可改造】象征荣耀的权杖，厚重而结实，击中敌人有可能造成粉碎打击的效果。 | R14: =VLOOKUP(RC3,Sheet1!R2C2:R6C6,2,FALSE)&"|"&VLOOKUP(MOD(RC1,1000),Sheet1!R2C9:R27C13,MATCH(VLOOKUP(RC3,Sheet1!R2C2:R6C6,2,FALSE),Sheet1!R2C9:R2C13,FALSE),FALSE)+VLOOKUP(MOD(RC1,1000),Sheet1!R2C16:R27C20,MATCH(VLOOKUP(RC3,Sheet1!R2C2:R6C6,3,FALSE),Sheet1!R2C16:R2C20,FALSE),FALSE) -> 1|353 | S14: =VLOOKUP(MOD(RC1,1000),Sheet1!R2C16:R27C20,MATCH(VLOOKUP(RC3,Sheet1!R2C2:R6C6,3,FALSE),Sheet1!R2C16:R2C20,FALSE),FALSE) -> 13 | T14: =VLOOKUP(RC3,Sheet1!R2C2:R6C6,4,FALSE)&"|"&VLOOKUP(RC3,Sheet1!R2C2:R6C6,5,FALSE) -> 1|13 | U14: =VLOOKUP(MOD(RC1,1000),Sheet1!R2C23:R27C31,MATCH(VLOOKUP(RC3,Sheet1!R2C2:R6C6,4,FALSE),Sheet1!R2C23:R2C31,FALSE),FALSE)&"|"&VLOOKUP(MOD(RC1,1000),Sheet1!R2C23:R27C31,MATCH(VLOOKUP(RC3,Sheet1!R2C2:R6C6,5,FALSE),Sheet1!R2C23:R2C31,FALSE),FALSE) -> 85|100 | W14: =IF(AND(RC[-18]="",RC[-8]=""),INT(RC[-22]/1000)*1000+302,"") ->  | X14: UI_taozhuang_zise1 | Y14: 1
A15: 20304 | B15: 烈焰晶杖 | C15: 0 | D15: 13 | E15: =RC[-4]-20000 -> 304 | F15: 20407 | I15: 300 | J15: 50 | K15: 3 | L15: 10000 | M15: 100 | N15: 13000 | O15: 304 | P15: 20304 | Q15: 【套装】【可改造】以各种珍贵材料熔炼成的法杖，逼人的热浪给人以巨大的威胁感。 | R15: =VLOOKUP(RC3,Sheet1!R2C2:R6C6,2,FALSE)&"|"&VLOOKUP(MOD(RC1,1000),Sheet1!R2C9:R27C13,MATCH(VLOOKUP(RC3,Sheet1!R2C2:R6C6,2,FALSE),Sheet1!R2C9:R2C13,FALSE),FALSE)+VLOOKUP(MOD(RC1,1000),Sheet1!R2C16:R27C20,MATCH(VLOOKUP(RC3,Sheet1!R2C2:R6C6,3,FALSE),Sheet1!R2C16:R2C20,FALSE),FALSE) -> 1|384 | S15: =VLOOKUP(MOD(RC1,1000),Sheet1!R2C16:R27C20,MATCH(VLOOKUP(RC3,Sheet1!R2C2:R6C6,3,FALSE),Sheet1!R2C16:R2C20,FALSE),FALSE) -> 14 | T15: =VLOOKUP(RC3,Sheet1!R2C2:R6C6,4,FALSE)&"|"&VLOOKUP(RC3,Sheet1!R2C2:R6C6,5,FALSE) -> 1|13 | U15: =VLOOKUP(MOD(RC1,1000),Sheet1!R2C23:R27C31,MATCH(VLOOKUP(RC3,Sheet1!R2C2:R6C6,4,FALSE),Sheet1!R2C23:R2C31,FALSE),FALSE)&"|"&VLOOKUP(MOD(RC1,1000),Sheet1!R2C23:R27C31,MATCH(VLOOKUP(RC3,Sheet1!R2C2:R6C6,5,FALSE),Sheet1!R2C23:R2C31,FALSE),FALSE) -> 90|100 | W15: =IF(AND(RC[-18]="",RC[-8]=""),INT(RC[-22]/1000)*1000+302,"") ->  | X15: UI_taozhuang_zise1 | Y15: 1
A16: 20305 | B16: 青鸟法球 | C16: 0 | D16: 12 | E16: =RC[-4]-20000 -> 305 | F16: 20408 | I16: 300 | J16: 50 | K16: 3 | L16: 10000 | M16: 100 | N16: 12000 | O16: 305 | P16: 20305 | Q16: 【套装】【可改造】囚禁了青鸟之魂的法球，如同青鸟注视着你，所有的风都服从于你。 | R16: =VLOOKUP(RC3,Sheet1!R2C2:R6C6,2,FALSE)&"|"&VLOOKUP(MOD(RC1,1000),Sheet1!R2C9:R27C13,MATCH(VLOOKUP(RC3,Sheet1!R2C2:R6C6,2,FALSE),Sheet1!R2C9:R2C13,FALSE),FALSE)+VLOOKUP(MOD(RC1,1000),Sheet1!R2C16:R27C20,MATCH(VLOOKUP(RC3,Sheet1!R2C2:R6C6,3,FALSE),Sheet1!R2C16:R2C20,FALSE),FALSE) -> 1|353 | S16: =VLOOKUP(MOD(RC1,1000),Sheet1!R2C16:R27C20,MATCH(VLOOKUP(RC3,Sheet1!R2C2:R6C6,3,FALSE),Sheet1!R2C16:R2C20,FALSE),FALSE) -> 13 | T16: =VLOOKUP(RC3,Sheet1!R2C2:R6C6,4,FALSE)&"|"&VLOOKUP(RC3,Sheet1!R2C2:R6C6,5,FALSE) -> 1|13 | U16: =VLOOKUP(MOD(RC1,1000),Sheet1!R2C23:R27C31,MATCH(VLOOKUP(RC3,Sheet1!R2C2:R6C6,4,FALSE),Sheet1!R2C23:R2C31,FALSE),FALSE)&"|"&VLOOKUP(MOD(RC1,1000),Sheet1!R2C23:R27C31,MATCH(VLOOKUP(RC3,Sheet1!R2C2:R6C6,5,FALSE),Sheet1!R2C23:R2C31,FALSE),FALSE) -> 85|100 | X16: UI_taozhuang_zise1 | Y16: 1
A17: 20400 | B17: 裁决者 | C17: 0 | D17: 15 | F17: 0 | I17: 300 | J17: 50 | K17: 4 | L17: 100000 | M17: 100 | N17: 22500 | P17: 20400 | Q17: 我将裁决不公的一切，裁决不义的一切，我是——万恶的终结者、裁决者。 | R17: =VLOOKUP(RC3,Sheet1!R2C2:R6C6,2,FALSE)&"|"&VLOOKUP(MOD(RC1,1000),Sheet1!R2C9:R27C13,MATCH(VLOOKUP(RC3,Sheet1!R2C2:R6C6,2,FALSE),Sheet1!R2C9:R2C13,FALSE),FALSE)+VLOOKUP(MOD(RC1,1000),Sheet1!R2C16:R27C20,MATCH(VLOOKUP(RC3,Sheet1!R2C2:R6C6,3,FALSE),Sheet1!R2C16:R2C20,FALSE),FALSE) -> 1|455 | S17: =VLOOKUP(MOD(RC1,1000),Sheet1!R2C16:R27C20,MATCH(VLOOKUP(RC3,Sheet1!R2C2:R6C6,3,FALSE),Sheet1!R2C16:R2C20,FALSE),FALSE) -> 20 | T17: =VLOOKUP(RC3,Sheet1!R2C2:R6C6,4,FALSE)&"|"&VLOOKUP(RC3,Sheet1!R2C2:R6C6,5,FALSE) -> 1|13 | U17: =VLOOKUP(MOD(RC1,1000),Sheet1!R2C23:R27C31,MATCH(VLOOKUP(RC3,Sheet1!R2C2:R6C6,4,FALSE),Sheet1!R2C23:R2C31,FALSE),FALSE)&"|"&VLOOKUP(MOD(RC1,1000),Sheet1!R2C23:R27C31,MATCH(VLOOKUP(RC3,Sheet1!R2C2:R6C6,5,FALSE),Sheet1!R2C23:R2C31,FALSE),FALSE) -> 90|100 | W17: 20401 | Y17: 1
A18: 20401 | B18: 正义巨剑 | C18: 0 | D18: 18 | E18: =RC[-4]-20000 -> 401 | F18: 0 | I18: 300 | J18: 50 | K18: 4 | L18: 100000 | M18: 100 | N18: 24600 | P18: 20401 | Q18: 它被冠以“正义”之名，只有正义之人才能获得它的承认而将它高举。 | R18: =VLOOKUP(RC3,Sheet1!R2C2:R6C6,2,FALSE)&"|"&VLOOKUP(MOD(RC1,1000),Sheet1!R2C9:R27C13,MATCH(VLOOKUP(RC3,Sheet1!R2C2:R6C6,2,FALSE),Sheet1!R2C9:R2C13,FALSE),FALSE)+VLOOKUP(MOD(RC1,1000),Sheet1!R2C16:R27C20,MATCH(VLOOKUP(RC3,Sheet1!R2C2:R6C6,3,FALSE),Sheet1!R2C16:R2C20,FALSE),FALSE) -> 1|512 | S18: =VLOOKUP(MOD(RC1,1000),Sheet1!R2C16:R27C20,MATCH(VLOOKUP(RC3,Sheet1!R2C2:R6C6,3,FALSE),Sheet1!R2C16:R2C20,FALSE),FALSE) -> 22 | T18: =VLOOKUP(RC3,Sheet1!R2C2:R6C6,4,FALSE)&"|"&VLOOKUP(RC3,Sheet1!R2C2:R6C6,5,FALSE) -> 1|13 | U18: =VLOOKUP(MOD(RC1,1000),Sheet1!R2C23:R27C31,MATCH(VLOOKUP(RC3,Sheet1!R2C2:R6C6,4,FALSE),Sheet1!R2C23:R2C31,FALSE),FALSE)&"|"&VLOOKUP(MOD(RC1,1000),Sheet1!R2C23:R27C31,MATCH(VLOOKUP(RC3,Sheet1!R2C2:R6C6,5,FALSE),Sheet1!R2C23:R2C31,FALSE),FALSE) -> 100|100 | W18: =IF(AND(RC[-18]="",RC[-8]=""),INT(RC[-22]/1000)*1000+302,"") ->  | Y18: 1
A19: 20402 | B19: 金龙权杖 | C19: 0 | D19: 20 | E19: =RC[-4]-20000 -> 402 | F19: 0 | I19: 300 | J19: 50 | K19: 4 | L19: 100000 | M19: 100 | N19: 33000 | P19: 20402 | Q19: 这柄权杖曾浸泡在龙血池中，其上散发着摄人的龙威。 | R19: =VLOOKUP(RC3,Sheet1!R2C2:R6C6,2,FALSE)&"|"&VLOOKUP(MOD(RC1,1000),Sheet1!R2C9:R27C13,MATCH(VLOOKUP(RC3,Sheet1!R2C2:R6C6,2,FALSE),Sheet1!R2C9:R2C13,FALSE),FALSE)+VLOOKUP(MOD(RC1,1000),Sheet1!R2C16:R27C20,MATCH(VLOOKUP(RC3,Sheet1!R2C2:R6C6,3,FALSE),Sheet1!R2C16:R2C20,FALSE),FALSE) -> 1|569 | S19: =VLOOKUP(MOD(RC1,1000),Sheet1!R2C16:R27C20,MATCH(VLOOKUP(RC3,Sheet1!R2C2:R6C6,3,FALSE),Sheet1!R2C16:R2C20,FALSE),FALSE) -> 24 | T19: =VLOOKUP(RC3,Sheet1!R2C2:R6C6,4,FALSE)&"|"&VLOOKUP(RC3,Sheet1!R2C2:R6C6,5,FALSE) -> 1|13 | U19: =VLOOKUP(MOD(RC1,1000),Sheet1!R2C23:R27C31,MATCH(VLOOKUP(RC3,Sheet1!R2C2:R6C6,4,FALSE),Sheet1!R2C23:R2C31,FALSE),FALSE)&"|"&VLOOKUP(MOD(RC1,1000),Sheet1!R2C23:R27C31,MATCH(VLOOKUP(RC3,Sheet1!R2C2:R6C6,5,FALSE),Sheet1!R2C23:R2C31,FALSE),FALSE) -> 110|100 | W19: =IF(AND(RC[-18]="",RC[-8]=""),INT(RC[-22]/1000)*1000+302,"") ->  | X19: UI_zhuangbei_xingxing | Y19: 1
A20: 20403 | B20: 巨像重击 | C20: 0 | D20: 22 | E20: =RC[-4]-20000 -> 403 | F20: 20503 | I20: 300 | J20: 50 | K20: 4 | L20: 100000 | M20: 100 | N20: 42000 | O20: 403 | P20: 20403 | Q20: 【套装】【可改造】远古苍蓝巨像的拳头，就算被制成了武器，一样拥有极强的粉碎能力。 | R20: =VLOOKUP(RC3,Sheet1!R2C2:R6C6,2,FALSE)&"|"&VLOOKUP(MOD(RC1,1000),Sheet1!R2C9:R27C13,MATCH(VLOOKUP(RC3,Sheet1!R2C2:R6C6,2,FALSE),Sheet1!R2C9:R2C13,FALSE),FALSE)+VLOOKUP(MOD(RC1,1000),Sheet1!R2C16:R27C20,MATCH(VLOOKUP(RC3,Sheet1!R2C2:R6C6,3,FALSE),Sheet1!R2C16:R2C20,FALSE),FALSE) -> 1|627 | S20: =VLOOKUP(MOD(RC1,1000),Sheet1!R2C16:R27C20,MATCH(VLOOKUP(RC3,Sheet1!R2C2:R6C6,3,FALSE),Sheet1!R2C16:R2C20,FALSE),FALSE) -> 27 | T20: =VLOOKUP(RC3,Sheet1!R2C2:R6C6,4,FALSE)&"|"&VLOOKUP(RC3,Sheet1!R2C2:R6C6,5,FALSE) -> 1|13 | U20: =VLOOKUP(MOD(RC1,1000),Sheet1!R2C23:R27C31,MATCH(VLOOKUP(RC3,Sheet1!R2C2:R6C6,4,FALSE),Sheet1!R2C23:R2C31,FALSE),FALSE)&"|"&VLOOKUP(MOD(RC1,1000),Sheet1!R2C23:R27C31,MATCH(VLOOKUP(RC3,Sheet1!R2C2:R6C6,5,FALSE),Sheet1!R2C23:R2C31,FALSE),FALSE) -> 120|100 | W20: =IF(AND(RC[-18]="",RC[-8]=""),INT(RC[-22]/1000)*1000+302,"") ->  | X20: UI_taozhuang_chengse1 | Y20: 1
A21: 20404 | B21: 幽冥收割 | C21: 0 | D21: 23 | E21: =RC[-4]-20000 -> 404 | F21: 20504 | I21: 300 | J21: 50 | K21: 4 | L21: 100000 | M21: 100 | N21: 43500 | O21: 404 | P21: 20404 | Q21: 【套装】【可改造】用无数生命堆起来的赫赫杀名，谁都不希望成为它的持有者的敌人。 | R21: =VLOOKUP(RC3,Sheet1!R2C2:R6C6,2,FALSE)&"|"&VLOOKUP(MOD(RC1,1000),Sheet1!R2C9:R27C13,MATCH(VLOOKUP(RC3,Sheet1!R2C2:R6C6,2,FALSE),Sheet1!R2C9:R2C13,FALSE),FALSE)+VLOOKUP(MOD(RC1,1000),Sheet1!R2C16:R27C20,MATCH(VLOOKUP(RC3,Sheet1!R2C2:R6C6,3,FALSE),Sheet1!R2C16:R2C20,FALSE),FALSE) -> 1|658 | S21: =VLOOKUP(MOD(RC1,1000),Sheet1!R2C16:R27C20,MATCH(VLOOKUP(RC3,Sheet1!R2C2:R6C6,3,FALSE),Sheet1!R2C16:R2C20,FALSE),FALSE) -> 28 | T21: =VLOOKUP(RC3,Sheet1!R2C2:R6C6,4,FALSE)&"|"&VLOOKUP(RC3,Sheet1!R2C2:R6C6,5,FALSE) -> 1|13 | U21: =VLOOKUP(MOD(RC1,1000),Sheet1!R2C23:R27C31,MATCH(VLOOKUP(RC3,Sheet1!R2C2:R6C6,4,FALSE),Sheet1!R2C23:R2C31,FALSE),FALSE)&"|"&VLOOKUP(MOD(RC1,1000),Sheet1!R2C23:R27C31,MATCH(VLOOKUP(RC3,Sheet1!R2C2:R6C6,5,FALSE),Sheet1!R2C23:R2C31,FALSE),FALSE) -> 125|100 | W21: =IF(AND(RC[-18]="",RC[-8]=""),INT(RC[-22]/1000)*1000+302,"") ->  | X21: UI_taozhuang_chengse1 | Y21: 1
A22: 20405 | B22: 大地祝福 | C22: 0 | D22: 22 | E22: =RC[-4]-20000 -> 405 | F22: 20505 | I22: 300 | J22: 50 | K22: 4 | L22: 100000 | M22: 100 | N22: 42000 | O22: 405 | P22: 20405 | Q22: 【套装】【可改造】所有生灵皆为大地之子，大地会平等地给予他们祝福。 | R22: =VLOOKUP(RC3,Sheet1!R2C2:R6C6,2,FALSE)&"|"&VLOOKUP(MOD(RC1,1000),Sheet1!R2C9:R27C13,MATCH(VLOOKUP(RC3,Sheet1!R2C2:R6C6,2,FALSE),Sheet1!R2C9:R2C13,FALSE),FALSE)+VLOOKUP(MOD(RC1,1000),Sheet1!R2C16:R27C20,MATCH(VLOOKUP(RC3,Sheet1!R2C2:R6C6,3,FALSE),Sheet1!R2C16:R2C20,FALSE),FALSE) -> 1|627 | S22: =VLOOKUP(MOD(RC1,1000),Sheet1!R2C16:R27C20,MATCH(VLOOKUP(RC3,Sheet1!R2C2:R6C6,3,FALSE),Sheet1!R2C16:R2C20,FALSE),FALSE) -> 27 | T22: =VLOOKUP(RC3,Sheet1!R2C2:R6C6,4,FALSE)&"|"&VLOOKUP(RC3,Sheet1!R2C2:R6C6,5,FALSE) -> 1|13 | U22: =VLOOKUP(MOD(RC1,1000),Sheet1!R2C23:R27C31,MATCH(VLOOKUP(RC3,Sheet1!R2C2:R6C6,4,FALSE),Sheet1!R2C23:R2C31,FALSE),FALSE)&"|"&VLOOKUP(MOD(RC1,1000),Sheet1!R2C23:R27C31,MATCH(VLOOKUP(RC3,Sheet1!R2C2:R6C6,5,FALSE),Sheet1!R2C23:R2C31,FALSE),FALSE) -> 120|100 | X22: UI_taozhuang_chengse1 | Y22: 1
A23: 20406 | B23: 圣光权杖 | C23: 0 | D23: 20 | E23: =RC[-4]-20000 -> 406 | F23: 0 | I23: 300 | J23: 50 | K23: 4 | L23: 100000 | M23: 100 | N23: 39000 | O23: 406 | P23: 20406 | Q23: 【套装】散发浓郁圣光的权杖，击中敌人有可能造成粉碎打击的效果。 | R23: =VLOOKUP(RC3,Sheet1!R2C2:R6C6,2,FALSE)&"|"&VLOOKUP(MOD(RC1,1000),Sheet1!R2C9:R27C13,MATCH(VLOOKUP(RC3,Sheet1!R2C2:R6C6,2,FALSE),Sheet1!R2C9:R2C13,FALSE),FALSE)+VLOOKUP(MOD(RC1,1000),Sheet1!R2C16:R27C20,MATCH(VLOOKUP(RC3,Sheet1!R2C2:R6C6,3,FALSE),Sheet1!R2C16:R2C20,FALSE),FALSE) -> 1|569 | S23: =VLOOKUP(MOD(RC1,1000),Sheet1!R2C16:R27C20,MATCH(VLOOKUP(RC3,Sheet1!R2C2:R6C6,3,FALSE),Sheet1!R2C16:R2C20,FALSE),FALSE) -> 24 | T23: =VLOOKUP(RC3,Sheet1!R2C2:R6C6,4,FALSE)&"|"&VLOOKUP(RC3,Sheet1!R2C2:R6C6,5,FALSE) -> 1|13 | U23: =VLOOKUP(MOD(RC1,1000),Sheet1!R2C23:R27C31,MATCH(VLOOKUP(RC3,Sheet1!R2C2:R6C6,4,FALSE),Sheet1!R2C23:R2C31,FALSE),FALSE)&"|"&VLOOKUP(MOD(RC1,1000),Sheet1!R2C23:R27C31,MATCH(VLOOKUP(RC3,Sheet1!R2C2:R6C6,5,FALSE),Sheet1!R2C23:R2C31,FALSE),FALSE) -> 110|100 | W23: =IF(AND(RC[-18]="",RC[-8]=""),INT(RC[-22]/1000)*1000+302,"") ->  | X23: UI_taozhuang_chengse1 | Y23: 1
A24: 20407 | B24: 熔岩法杖 | C24: 0 | D24: 21 | E24: =RC[-4]-20000 -> 407 | F24: 0 | I24: 300 | J24: 50 | K24: 4 | L24: 100000 | M24: 100 | N24: 40500 | O24: 407 | P24: 20407 | Q24: 【套装】以各种珍贵材料熔炼成的法杖，逼人的热浪给人以巨大的威胁感。 | R24: =VLOOKUP(RC3,Sheet1!R2C2:R6C6,2,FALSE)&"|"&VLOOKUP(MOD(RC1,1000),Sheet1!R2C9:R27C13,MATCH(VLOOKUP(RC3,Sheet1!R2C2:R6C6,2,FALSE),Sheet1!R2C9:R2C13,FALSE),FALSE)+VLOOKUP(MOD(RC1,1000),Sheet1!R2C16:R27C20,MATCH(VLOOKUP(RC3,Sheet1!R2C2:R6C6,3,FALSE),Sheet1!R2C16:R2C20,FALSE),FALSE) -> 1|601 | S24: =VLOOKUP(MOD(RC1,1000),Sheet1!R2C16:R27C20,MATCH(VLOOKUP(RC3,Sheet1!R2C2:R6C6,3,FALSE),Sheet1!R2C16:R2C20,FALSE),FALSE) -> 26 | T24: =VLOOKUP(RC3,Sheet1!R2C2:R6C6,4,FALSE)&"|"&VLOOKUP(RC3,Sheet1!R2C2:R6C6,5,FALSE) -> 1|13 | U24: =VLOOKUP(MOD(RC1,1000),Sheet1!R2C23:R27C31,MATCH(VLOOKUP(RC3,Sheet1!R2C2:R6C6,4,FALSE),Sheet1!R2C23:R2C31,FALSE),FALSE)&"|"&VLOOKUP(MOD(RC1,1000),Sheet1!R2C23:R27C31,MATCH(VLOOKUP(RC3,Sheet1!R2C2:R6C6,5,FALSE),Sheet1!R2C23:R2C31,FALSE),FALSE) -> 115|100 | W24: =IF(AND(RC[-18]="",RC[-8]=""),INT(RC[-22]/1000)*1000+302,"") ->  | X24: UI_taozhuang_chengse1 | Y24: 1
A25: 20408 | B25: 苍鹰魔珠 | C25: 0 | D25: 20 | E25: =RC[-4]-20000 -> 408 | F25: 0 | I25: 300 | J25: 50 | K25: 4 | L25: 100000 | M25: 100 | N25: 39000 | O25: 408 | P25: 20408 | Q25: 【套装】禁锢着苍鹰之魂的魔珠，如同青鸟注视着你，所有的风都服从于你。 | R25: =VLOOKUP(RC3,Sheet1!R2C2:R6C6,2,FALSE)&"|"&VLOOKUP(MOD(RC1,1000),Sheet1!R2C9:R27C13,MATCH(VLOOKUP(RC3,Sheet1!R2C2:R6C6,2,FALSE),Sheet1!R2C9:R2C13,FALSE),FALSE)+VLOOKUP(MOD(RC1,1000),Sheet1!R2C16:R27C20,MATCH(VLOOKUP(RC3,Sheet1!R2C2:R6C6,3,FALSE),Sheet1!R2C16:R2C20,FALSE),FALSE) -> 1|569 | S25: =VLOOKUP(MOD(RC1,1000),Sheet1!R2C16:R27C20,MATCH(VLOOKUP(RC3,Sheet1!R2C2:R6C6,3,FALSE),Sheet1!R2C16:R2C20,FALSE),FALSE) -> 24 | T25: =VLOOKUP(RC3,Sheet1!R2C2:R6C6,4,FALSE)&"|"&VLOOKUP(RC3,Sheet1!R2C2:R6C6,5,FALSE) -> 1|13 | U25: =VLOOKUP(MOD(RC1,1000),Sheet1!R2C23:R27C31,MATCH(VLOOKUP(RC3,Sheet1!R2C2:R6C6,4,FALSE),Sheet1!R2C23:R2C31,FALSE),FALSE)&"|"&VLOOKUP(MOD(RC1,1000),Sheet1!R2C23:R27C31,MATCH(VLOOKUP(RC3,Sheet1!R2C2:R6C6,5,FALSE),Sheet1!R2C23:R2C31,FALSE),FALSE) -> 110|100 | X25: UI_taozhuang_chengse1 | Y25: 1
A26: 20501 | B26: 神圣复仇 | C26: 0 | D26: 32 | E26: =RC[-4]-20000 -> 501 | F26: 0 | G26: 5 | H26: 11501 | I26: 300 | J26: 50 | K26: 5 | L26: 1000000 | M26: 100 | N26: 80000 | P26: 20501 | Q26: “只有正义是无法维护正义的。”于是就此追逐力量，这是神圣的复仇。 | R26: =VLOOKUP(RC3,Sheet1!R2C2:R6C6,2,FALSE)&"|"&VLOOKUP(MOD(RC1,1000),Sheet1!R2C9:R27C13,MATCH(VLOOKUP(RC3,Sheet1!R2C2:R6C6,2,FALSE),Sheet1!R2C9:R2C13,FALSE),FALSE)+VLOOKUP(MOD(RC1,1000),Sheet1!R2C16:R27C20,MATCH(VLOOKUP(RC3,Sheet1!R2C2:R6C6,3,FALSE),Sheet1!R2C16:R2C20,FALSE),FALSE) -> 1|953 | S26: =VLOOKUP(MOD(RC1,1000),Sheet1!R2C16:R27C20,MATCH(VLOOKUP(RC3,Sheet1!R2C2:R6C6,3,FALSE),Sheet1!R2C16:R2C20,FALSE),FALSE) -> 48 | T26: =VLOOKUP(RC3,Sheet1!R2C2:R6C6,4,FALSE)&"|"&VLOOKUP(RC3,Sheet1!R2C2:R6C6,5,FALSE) -> 1|13 | U26: =VLOOKUP(MOD(RC1,1000),Sheet1!R2C23:R27C31,MATCH(VLOOKUP(RC3,Sheet1!R2C2:R6C6,4,FALSE),Sheet1!R2C23:R2C31,FALSE),FALSE)&"|"&VLOOKUP(MOD(RC1,1000),Sheet1!R2C23:R27C31,MATCH(VLOOKUP(RC3,Sheet1!R2C2:R6C6,5,FALSE),Sheet1!R2C23:R2C31,FALSE),FALSE) -> 150|100 | W26: =IF(AND(RC[-18]="",RC[-8]=""),INT(RC[-22]/1000)*1000+302,"") ->  | Y26: 1
A27: 20502 | B27: 永恒破碎 | C27: 0 | D27: 36 | E27: =RC[-4]-20000 -> 502 | F27: 0 | G27: 5 | H27: 11505 | I27: 300 | J27: 50 | K27: 5 | L27: 1000000 | M27: 100 | N27: 100000 | O27: 502 | P27: 20502 | Q27: 【套装】传说神枪库艾特刺穿永恒虚空创造了世界，这把枪的名字便是借鉴于此。 | R27: =VLOOKUP(RC3,Sheet1!R2C2:R6C6,2,FALSE)&"|"&VLOOKUP(MOD(RC1,1000),Sheet1!R2C9:R27C13,MATCH(VLOOKUP(RC3,Sheet1!R2C2:R6C6,2,FALSE),Sheet1!R2C9:R2C13,FALSE),FALSE)+VLOOKUP(MOD(RC1,1000),Sheet1!R2C16:R27C20,MATCH(VLOOKUP(RC3,Sheet1!R2C2:R6C6,3,FALSE),Sheet1!R2C16:R2C20,FALSE),FALSE) -> 1|1074 | S27: =VLOOKUP(MOD(RC1,1000),Sheet1!R2C16:R27C20,MATCH(VLOOKUP(RC3,Sheet1!R2C2:R6C6,3,FALSE),Sheet1!R2C16:R2C20,FALSE),FALSE) -> 54 | T27: =VLOOKUP(RC3,Sheet1!R2C2:R6C6,4,FALSE)&"|"&VLOOKUP(RC3,Sheet1!R2C2:R6C6,5,FALSE) -> 1|13 | U27: =VLOOKUP(MOD(RC1,1000),Sheet1!R2C23:R27C31,MATCH(VLOOKUP(RC3,Sheet1!R2C2:R6C6,4,FALSE),Sheet1!R2C23:R2C31,FALSE),FALSE)&"|"&VLOOKUP(MOD(RC1,1000),Sheet1!R2C23:R27C31,MATCH(VLOOKUP(RC3,Sheet1!R2C2:R6C6,5,FALSE),Sheet1!R2C23:R2C31,FALSE),FALSE) -> 170|100 | W27: =IF(AND(RC[-18]="",RC[-8]=""),INT(RC[-22]/1000)*1000+302,"") ->  | X27: UI_taozhuang_hongse1 | Y27: 1
A28: 20503 | B28: 巨擘之握 | C28: 0 | D28: 32 | E28: =RC[-4]-20000 -> 503 | F28: 0 | G28: 5 | H28: 11509 | I28: 300 | J28: 50 | K28: 5 | L28: 1000000 | M28: 100 | N28: 80000 | O28: 503 | P28: 20503 | Q28: 【套装】上古巨像头领的拳头，就算被制成了武器，一样拥有极强的粉碎能力。 | R28: =VLOOKUP(RC3,Sheet1!R2C2:R6C6,2,FALSE)&"|"&VLOOKUP(MOD(RC1,1000),Sheet1!R2C9:R27C13,MATCH(VLOOKUP(RC3,Sheet1!R2C2:R6C6,2,FALSE),Sheet1!R2C9:R2C13,FALSE),FALSE)+VLOOKUP(MOD(RC1,1000),Sheet1!R2C16:R27C20,MATCH(VLOOKUP(RC3,Sheet1!R2C2:R6C6,3,FALSE),Sheet1!R2C16:R2C20,FALSE),FALSE) -> 1|953 | S28: =VLOOKUP(MOD(RC1,1000),Sheet1!R2C16:R27C20,MATCH(VLOOKUP(RC3,Sheet1!R2C2:R6C6,3,FALSE),Sheet1!R2C16:R2C20,FALSE),FALSE) -> 48 | T28: =VLOOKUP(RC3,Sheet1!R2C2:R6C6,4,FALSE)&"|"&VLOOKUP(RC3,Sheet1!R2C2:R6C6,5,FALSE) -> 1|13 | U28: =VLOOKUP(MOD(RC1,1000),Sheet1!R2C23:R27C31,MATCH(VLOOKUP(RC3,Sheet1!R2C2:R6C6,4,FALSE),Sheet1!R2C23:R2C31,FALSE),FALSE)&"|"&VLOOKUP(MOD(RC1,1000),Sheet1!R2C23:R27C31,MATCH(VLOOKUP(RC3,Sheet1!R2C2:R6C6,5,FALSE),Sheet1!R2C23:R2C31,FALSE),FALSE) -> 150|100 | W28: =IF(AND(RC[-18]="",RC[-8]=""),INT(RC[-22]/1000)*1000+302,"") ->  | X28: UI_taozhuang_hongse1 | Y28: 1
A29: 20504 | B29: 抹杀领域 | C29: 0 | D29: 34 | E29: =RC[-4]-20000 -> 504 | F29: 0 | G29: 5 | H29: 11513 | I29: 300 | J29: 50 | K29: 5 | L29: 1000000 | M29: 100 | N29: 90000 | O29: 504 | P29: 20504 | Q29: 【套装】将一切都抹杀，连回忆也不留下。 | R29: =VLOOKUP(RC3,Sheet1!R2C2:R6C6,2,FALSE)&"|"&VLOOKUP(MOD(RC1,1000),Sheet1!R2C9:R27C13,MATCH(VLOOKUP(RC3,Sheet1!R2C2:R6C6,2,FALSE),Sheet1!R2C9:R2C13,FALSE),FALSE)+VLOOKUP(MOD(RC1,1000),Sheet1!R2C16:R27C20,MATCH(VLOOKUP(RC3,Sheet1!R2C2:R6C6,3,FALSE),Sheet1!R2C16:R2C20,FALSE),FALSE) -> 1|1016 | S29: =VLOOKUP(MOD(RC1,1000),Sheet1!R2C16:R27C20,MATCH(VLOOKUP(RC3,Sheet1!R2C2:R6C6,3,FALSE),Sheet1!R2C16:R2C20,FALSE),FALSE) -> 51 | T29: =VLOOKUP(RC3,Sheet1!R2C2:R6C6,4,FALSE)&"|"&VLOOKUP(RC3,Sheet1!R2C2:R6C6,5,FALSE) -> 1|13 | U29: =VLOOKUP(MOD(RC1,1000),Sheet1!R2C23:R27C31,MATCH(VLOOKUP(RC3,Sheet1!R2C2:R6C6,4,FALSE),Sheet1!R2C23:R2C31,FALSE),FALSE)&"|"&VLOOKUP(MOD(RC1,1000),Sheet1!R2C23:R27C31,MATCH(VLOOKUP(RC3,Sheet1!R2C2:R6C6,5,FALSE),Sheet1!R2C23:R2C31,FALSE),FALSE) -> 160|100 | W29: =IF(AND(RC[-18]="",RC[-8]=""),INT(RC[-22]/1000)*1000+302,"") ->  | X29: UI_taozhuang_hongse1 | Y29: 1
A30: 20505 | B30: 盖亚之力 | C30: 0 | D30: 32 | E30: =RC[-4]-20000 -> 505 | F30: 0 | G30: 5 | H30: 11517 | I30: 300 | J30: 50 | K30: 5 | L30: 1000000 | M30: 100 | N30: 80000 | O30: 505 | P30: 20505 | Q30: 【套装】她给所有生物带来希望，也给破坏者带来毁灭。 | R30: =VLOOKUP(RC3,Sheet1!R2C2:R6C6,2,FALSE)&"|"&VLOOKUP(MOD(RC1,1000),Sheet1!R2C9:R27C13,MATCH(VLOOKUP(RC3,Sheet1!R2C2:R6C6,2,FALSE),Sheet1!R2C9:R2C13,FALSE),FALSE)+VLOOKUP(MOD(RC1,1000),Sheet1!R2C16:R27C20,MATCH(VLOOKUP(RC3,Sheet1!R2C2:R6C6,3,FALSE),Sheet1!R2C16:R2C20,FALSE),FALSE) -> 1|953 | S30: =VLOOKUP(MOD(RC1,1000),Sheet1!R2C16:R27C20,MATCH(VLOOKUP(RC3,Sheet1!R2C2:R6C6,3,FALSE),Sheet1!R2C16:R2C20,FALSE),FALSE) -> 48 | T30: =VLOOKUP(RC3,Sheet1!R2C2:R6C6,4,FALSE)&"|"&VLOOKUP(RC3,Sheet1!R2C2:R6C6,5,FALSE) -> 1|13 | U30: =VLOOKUP(MOD(RC1,1000),Sheet1!R2C23:R27C31,MATCH(VLOOKUP(RC3,Sheet1!R2C2:R6C6,4,FALSE),Sheet1!R2C23:R2C31,FALSE),FALSE)&"|"&VLOOKUP(MOD(RC1,1000),Sheet1!R2C23:R27C31,MATCH(VLOOKUP(RC3,Sheet1!R2C2:R6C6,5,FALSE),Sheet1!R2C23:R2C31,FALSE),FALSE) -> 150|100 | X30: UI_taozhuang_hongse1 | Y30: 1
A31: 21101 | B31: 铁甲 | C31: 1 | D31: 1 | F31: 0 | I31: 300 | J31: 50 | K31: 1 | L31: 100 | M31: 100 | N31: 50 | P31: 21101 | Q31: 用铁打造的普通盔甲。 | R31: =VLOOKUP(RC3,Sheet1!R2C2:R6C6,2,FALSE)&"|"&VLOOKUP(MOD(RC1,1000),Sheet1!R2C9:R27C13,MATCH(VLOOKUP(RC3,Sheet1!R2C2:R6C6,2,FALSE),Sheet1!R2C9:R2C13,FALSE),FALSE)+VLOOKUP(MOD(RC1,1000),Sheet1!R2C16:R27C20,MATCH(VLOOKUP(RC3,Sheet1!R2C2:R6C6,3,FALSE),Sheet1!R2C16:R2C20,FALSE),FALSE) -> 2|72 | S31: =VLOOKUP(MOD(RC1,1000),Sheet1!R2C16:R27C20,MATCH(VLOOKUP(RC3,Sheet1!R2C2:R6C6,3,FALSE),Sheet1!R2C16:R2C20,FALSE),FALSE) -> 2 | T31: =VLOOKUP(RC3,Sheet1!R2C2:R6C6,4,FALSE)&"|"&VLOOKUP(RC3,Sheet1!R2C2:R6C6,5,FALSE) -> 2|11 | U31: =VLOOKUP(MOD(RC1,1000),Sheet1!R2C23:R27C31,MATCH(VLOOKUP(RC3,Sheet1!R2C2:R6C6,4,FALSE),Sheet1!R2C23:R2C31,FALSE),FALSE)&"|"&VLOOKUP(MOD(RC1,1000),Sheet1!R2C23:R27C31,MATCH(VLOOKUP(RC3,Sheet1!R2C2:R6C6,5,FALSE),Sheet1!R2C23:R2C31,FALSE),FALSE) -> 25|80 | V31: 26 | W31: =IF(AND(RC[-18]="",RC[-8]=""),INT(RC[-22]/1000)*1000+302,"") -> 21302 | Y31: 1
A32: 21102 | B32: 精致战甲 | C32: 1 | D32: 2 | F32: 0 | I32: 300 | J32: 50 | K32: 1 | L32: 100 | M32: 100 | N32: 60 | O32: 101 | P32: 21102 | Q32: 【套装】精致的盔甲，可以提供更好的保护。 | R32: =VLOOKUP(RC3,Sheet1!R2C2:R6C6,2,FALSE)&"|"&VLOOKUP(MOD(RC1,1000),Sheet1!R2C9:R27C13,MATCH(VLOOKUP(RC3,Sheet1!R2C2:R6C6,2,FALSE),Sheet1!R2C9:R2C13,FALSE),FALSE)+VLOOKUP(MOD(RC1,1000),Sheet1!R2C16:R27C20,MATCH(VLOOKUP(RC3,Sheet1!R2C2:R6C6,3,FALSE),Sheet1!R2C16:R2C20,FALSE),FALSE) -> 2|72 | S32: =VLOOKUP(MOD(RC1,1000),Sheet1!R2C16:R27C20,MATCH(VLOOKUP(RC3,Sheet1!R2C2:R6C6,3,FALSE),Sheet1!R2C16:R2C20,FALSE),FALSE) -> 2 | T32: =VLOOKUP(RC3,Sheet1!R2C2:R6C6,4,FALSE)&"|"&VLOOKUP(RC3,Sheet1!R2C2:R6C6,5,FALSE) -> 2|11 | U32: =VLOOKUP(MOD(RC1,1000),Sheet1!R2C23:R27C31,MATCH(VLOOKUP(RC3,Sheet1!R2C2:R6C6,4,FALSE),Sheet1!R2C23:R2C31,FALSE),FALSE)&"|"&VLOOKUP(MOD(RC1,1000),Sheet1!R2C23:R27C31,MATCH(VLOOKUP(RC3,Sheet1!R2C2:R6C6,5,FALSE),Sheet1!R2C23:R2C31,FALSE),FALSE) -> 25|80 | V32: 33 | W32: =IF(AND(RC[-18]="",RC[-8]=""),INT(RC[-22]/1000)*1000+302,"") ->  | X32: UI_taozhuang_lvse | Y32: 1
A33: 21201 | B33: 坚韧盔甲 | C33: 1 | D33: 4 | F33: 0 | I33: 300 | J33: 50 | K33: 2 | L33: 1000 | M33: 100 | N33: 900 | P33: 21201 | Q33: 虽然硬度不高，但同时具备一定的力量缓冲作用。 | R33: =VLOOKUP(RC3,Sheet1!R2C2:R6C6,2,FALSE)&"|"&VLOOKUP(MOD(RC1,1000),Sheet1!R2C9:R27C13,MATCH(VLOOKUP(RC3,Sheet1!R2C2:R6C6,2,FALSE),Sheet1!R2C9:R2C13,FALSE),FALSE)+VLOOKUP(MOD(RC1,1000),Sheet1!R2C16:R27C20,MATCH(VLOOKUP(RC3,Sheet1!R2C2:R6C6,3,FALSE),Sheet1!R2C16:R2C20,FALSE),FALSE) -> 2|149 | S33: =VLOOKUP(MOD(RC1,1000),Sheet1!R2C16:R27C20,MATCH(VLOOKUP(RC3,Sheet1!R2C2:R6C6,3,FALSE),Sheet1!R2C16:R2C20,FALSE),FALSE) -> 4 | T33: =VLOOKUP(RC3,Sheet1!R2C2:R6C6,4,FALSE)&"|"&VLOOKUP(RC3,Sheet1!R2C2:R6C6,5,FALSE) -> 2|11 | U33: =VLOOKUP(MOD(RC1,1000),Sheet1!R2C23:R27C31,MATCH(VLOOKUP(RC3,Sheet1!R2C2:R6C6,4,FALSE),Sheet1!R2C23:R2C31,FALSE),FALSE)&"|"&VLOOKUP(MOD(RC1,1000),Sheet1!R2C23:R27C31,MATCH(VLOOKUP(RC3,Sheet1!R2C2:R6C6,5,FALSE),Sheet1!R2C23:R2C31,FALSE),FALSE) -> 40|80 | W33: =IF(AND(RC[-18]="",RC[-8]=""),INT(RC[-22]/1000)*1000+302,"") -> 21302 | Y33: 1
A34: 21202 | B34: 骑士铁甲 | C34: 1 | D34: 5 | F34: 0 | I34: 300 | J34: 50 | K34: 2 | L34: 1000 | M34: 100 | N34: 1200 | O34: 202 | P34: 21202 | Q34: 【套装】精锻的铁甲，防御力较高，可以保护住使用者的大部分躯体。 | R34: =VLOOKUP(RC3,Sheet1!R2C2:R6C6,2,FALSE)&"|"&VLOOKUP(MOD(RC1,1000),Sheet1!R2C9:R27C13,MATCH(VLOOKUP(RC3,Sheet1!R2C2:R6C6,2,FALSE),Sheet1!R2C9:R2C13,FALSE),FALSE)+VLOOKUP(MOD(RC1,1000),Sheet1!R2C16:R27C20,MATCH(VLOOKUP(RC3,Sheet1!R2C2:R6C6,3,FALSE),Sheet1!R2C16:R2C20,FALSE),FALSE) -> 2|185 | S34: =VLOOKUP(MOD(RC1,1000),Sheet1!R2C16:R27C20,MATCH(VLOOKUP(RC3,Sheet1!R2C2:R6C6,3,FALSE),Sheet1!R2C16:R2C20,FALSE),FALSE) -> 5 | T34: =VLOOKUP(RC3,Sheet1!R2C2:R6C6,4,FALSE)&"|"&VLOOKUP(RC3,Sheet1!R2C2:R6C6,5,FALSE) -> 2|11 | U34: =VLOOKUP(MOD(RC1,1000),Sheet1!R2C23:R27C31,MATCH(VLOOKUP(RC3,Sheet1!R2C2:R6C6,4,FALSE),Sheet1!R2C23:R2C31,FALSE),FALSE)&"|"&VLOOKUP(MOD(RC1,1000),Sheet1!R2C23:R27C31,MATCH(VLOOKUP(RC3,Sheet1!R2C2:R6C6,5,FALSE),Sheet1!R2C23:R2C31,FALSE),FALSE) -> 50|80 | W34: =IF(AND(RC[-18]="",RC[-8]=""),INT(RC[-22]/1000)*1000+302,"") ->  | X34: UI_taozhuang_lanse | Y34: 1
A35: 21301 | B35: 不动盔甲 | C35: 1 | D35: 10 | F35: 0 | I35: 300 | J35: 50 | K35: 3 | L35: 10000 | M35: 100 | N35: 6000 | P35: 21301 | Q35: 防护能力极强的重型铠甲，但过高的重量使得普通人很难使用它。 | R35: =VLOOKUP(RC3,Sheet1!R2C2:R6C6,2,FALSE)&"|"&VLOOKUP(MOD(RC1,1000),Sheet1!R2C9:R27C13,MATCH(VLOOKUP(RC3,Sheet1!R2C2:R6C6,2,FALSE),Sheet1!R2C9:R2C13,FALSE),FALSE)+VLOOKUP(MOD(RC1,1000),Sheet1!R2C16:R27C20,MATCH(VLOOKUP(RC3,Sheet1!R2C2:R6C6,3,FALSE),Sheet1!R2C16:R2C20,FALSE),FALSE) -> 2|296 | S35: =VLOOKUP(MOD(RC1,1000),Sheet1!R2C16:R27C20,MATCH(VLOOKUP(RC3,Sheet1!R2C2:R6C6,3,FALSE),Sheet1!R2C16:R2C20,FALSE),FALSE) -> 11 | T35: =VLOOKUP(RC3,Sheet1!R2C2:R6C6,4,FALSE)&"|"&VLOOKUP(RC3,Sheet1!R2C2:R6C6,5,FALSE) -> 2|11 | U35: =VLOOKUP(MOD(RC1,1000),Sheet1!R2C23:R27C31,MATCH(VLOOKUP(RC3,Sheet1!R2C2:R6C6,4,FALSE),Sheet1!R2C23:R2C31,FALSE),FALSE)&"|"&VLOOKUP(MOD(RC1,1000),Sheet1!R2C23:R27C31,MATCH(VLOOKUP(RC3,Sheet1!R2C2:R6C6,5,FALSE),Sheet1!R2C23:R2C31,FALSE),FALSE) -> 70|80 | W35: =IF(AND(RC[-18]="",RC[-8]=""),INT(RC[-22]/1000)*1000+302,"") -> 21302 | Y35: 1
A36: 21302 | B36: 光明战甲 | C36: 1 | D36: 11 | E36: =RC[-4]-20000 -> 1302 | F36: 0 | I36: 300 | J36: 50 | K36: 3 | L36: 10000 | M36: 100 | N36: 10000 | P36: 21302 | Q36: 这种装备经常能在高级牧师身上见到，具备很强烈的光明气息。 | R36: =VLOOKUP(RC3,Sheet1!R2C2:R6C6,2,FALSE)&"|"&VLOOKUP(MOD(RC1,1000),Sheet1!R2C9:R27C13,MATCH(VLOOKUP(RC3,Sheet1!R2C2:R6C6,2,FALSE),Sheet1!R2C9:R2C13,FALSE),FALSE)+VLOOKUP(MOD(RC1,1000),Sheet1!R2C16:R27C20,MATCH(VLOOKUP(RC3,Sheet1!R2C2:R6C6,3,FALSE),Sheet1!R2C16:R2C20,FALSE),FALSE) -> 2|322 | S36: =VLOOKUP(MOD(RC1,1000),Sheet1!R2C16:R27C20,MATCH(VLOOKUP(RC3,Sheet1!R2C2:R6C6,3,FALSE),Sheet1!R2C16:R2C20,FALSE),FALSE) -> 12 | T36: =VLOOKUP(RC3,Sheet1!R2C2:R6C6,4,FALSE)&"|"&VLOOKUP(RC3,Sheet1!R2C2:R6C6,5,FALSE) -> 2|11 | U36: =VLOOKUP(MOD(RC1,1000),Sheet1!R2C23:R27C31,MATCH(VLOOKUP(RC3,Sheet1!R2C2:R6C6,4,FALSE),Sheet1!R2C23:R2C31,FALSE),FALSE)&"|"&VLOOKUP(MOD(RC1,1000),Sheet1!R2C23:R27C31,MATCH(VLOOKUP(RC3,Sheet1!R2C2:R6C6,5,FALSE),Sheet1!R2C23:R2C31,FALSE),FALSE) -> 75|80 | W36: =IF(AND(RC[-18]="",RC[-8]=""),INT(RC[-22]/1000)*1000+302,"") ->  | X36: UI_zhuangbei_xingxing | Y36: 1
A37: 21303 | B37: 荣耀圣甲 | C37: 1 | D37: 12 | E37: =RC[-4]-20000 -> 1303 | F37: 21406 | I37: 300 | J37: 50 | K37: 3 | L37: 10000 | M37: 100 | N37: 12000 | O37: 303 | P37: 21303 | Q37: 【套装】【可改造】象征荣耀的战甲，给人以一往直前，永不停歇的信心。 | R37: =VLOOKUP(RC3,Sheet1!R2C2:R6C6,2,FALSE)&"|"&VLOOKUP(MOD(RC1,1000),Sheet1!R2C9:R27C13,MATCH(VLOOKUP(RC3,Sheet1!R2C2:R6C6,2,FALSE),Sheet1!R2C9:R2C13,FALSE),FALSE)+VLOOKUP(MOD(RC1,1000),Sheet1!R2C16:R27C20,MATCH(VLOOKUP(RC3,Sheet1!R2C2:R6C6,3,FALSE),Sheet1!R2C16:R2C20,FALSE),FALSE) -> 2|353 | S37: =VLOOKUP(MOD(RC1,1000),Sheet1!R2C16:R27C20,MATCH(VLOOKUP(RC3,Sheet1!R2C2:R6C6,3,FALSE),Sheet1!R2C16:R2C20,FALSE),FALSE) -> 13 | T37: =VLOOKUP(RC3,Sheet1!R2C2:R6C6,4,FALSE)&"|"&VLOOKUP(RC3,Sheet1!R2C2:R6C6,5,FALSE) -> 2|11 | U37: =VLOOKUP(MOD(RC1,1000),Sheet1!R2C23:R27C31,MATCH(VLOOKUP(RC3,Sheet1!R2C2:R6C6,4,FALSE),Sheet1!R2C23:R2C31,FALSE),FALSE)&"|"&VLOOKUP(MOD(RC1,1000),Sheet1!R2C23:R27C31,MATCH(VLOOKUP(RC3,Sheet1!R2C2:R6C6,5,FALSE),Sheet1!R2C23:R2C31,FALSE),FALSE) -> 85|80 | W37: =IF(AND(RC[-18]="",RC[-8]=""),INT(RC[-22]/1000)*1000+302,"") ->  | X37: UI_taozhuang_zise1 | Y37: 1
A38: 21304 | B38: 烈焰护甲 | C38: 1 | D38: 13 | E38: =RC[-4]-20000 -> 1304 | F38: 21407 | I38: 300 | J38: 50 | K38: 3 | L38: 10000 | M38: 100 | N38: 13000 | O38: 304 | P38: 21304 | Q38: 【套装】【可改造】融入了烈焰结晶粉末的皮甲，靠近就令人感觉到灼热。 | R38: =VLOOKUP(RC3,Sheet1!R2C2:R6C6,2,FALSE)&"|"&VLOOKUP(MOD(RC1,1000),Sheet1!R2C9:R27C13,MATCH(VLOOKUP(RC3,Sheet1!R2C2:R6C6,2,FALSE),Sheet1!R2C9:R2C13,FALSE),FALSE)+VLOOKUP(MOD(RC1,1000),Sheet1!R2C16:R27C20,MATCH(VLOOKUP(RC3,Sheet1!R2C2:R6C6,3,FALSE),Sheet1!R2C16:R2C20,FALSE),FALSE) -> 2|384 | S38: =VLOOKUP(MOD(RC1,1000),Sheet1!R2C16:R27C20,MATCH(VLOOKUP(RC3,Sheet1!R2C2:R6C6,3,FALSE),Sheet1!R2C16:R2C20,FALSE),FALSE) -> 14 | T38: =VLOOKUP(RC3,Sheet1!R2C2:R6C6,4,FALSE)&"|"&VLOOKUP(RC3,Sheet1!R2C2:R6C6,5,FALSE) -> 2|11 | U38: =VLOOKUP(MOD(RC1,1000),Sheet1!R2C23:R27C31,MATCH(VLOOKUP(RC3,Sheet1!R2C2:R6C6,4,FALSE),Sheet1!R2C23:R2C31,FALSE),FALSE)&"|"&VLOOKUP(MOD(RC1,1000),Sheet1!R2C23:R27C31,MATCH(VLOOKUP(RC3,Sheet1!R2C2:R6C6,5,FALSE),Sheet1!R2C23:R2C31,FALSE),FALSE) -> 90|80 | W38: =IF(AND(RC[-18]="",RC[-8]=""),INT(RC[-22]/1000)*1000+302,"") ->  | X38: UI_taozhuang_zise1 | Y38: 1
A39: 21305 | B39: 青鸟盔甲 | C39: 1 | D39: 12 | E39: =RC[-4]-20000 -> 1305 | F39: 21408 | I39: 300 | J39: 50 | K39: 3 | L39: 10000 | M39: 100 | N39: 12000 | O39: 305 | P39: 21305 | Q39: 【套装】【可改造】囚禁了青鸟之魂的盔甲，狂风会庇护这身盔甲下的人。 | R39: =VLOOKUP(RC3,Sheet1!R2C2:R6C6,2,FALSE)&"|"&VLOOKUP(MOD(RC1,1000),Sheet1!R2C9:R27C13,MATCH(VLOOKUP(RC3,Sheet1!R2C2:R6C6,2,FALSE),Sheet1!R2C9:R2C13,FALSE),FALSE)+VLOOKUP(MOD(RC1,1000),Sheet1!R2C16:R27C20,MATCH(VLOOKUP(RC3,Sheet1!R2C2:R6C6,3,FALSE),Sheet1!R2C16:R2C20,FALSE),FALSE) -> 2|353 | S39: =VLOOKUP(MOD(RC1,1000),Sheet1!R2C16:R27C20,MATCH(VLOOKUP(RC3,Sheet1!R2C2:R6C6,3,FALSE),Sheet1!R2C16:R2C20,FALSE),FALSE) -> 13 | T39: =VLOOKUP(RC3,Sheet1!R2C2:R6C6,4,FALSE)&"|"&VLOOKUP(RC3,Sheet1!R2C2:R6C6,5,FALSE) -> 2|11 | U39: =VLOOKUP(MOD(RC1,1000),Sheet1!R2C23:R27C31,MATCH(VLOOKUP(RC3,Sheet1!R2C2:R6C6,4,FALSE),Sheet1!R2C23:R2C31,FALSE),FALSE)&"|"&VLOOKUP(MOD(RC1,1000),Sheet1!R2C23:R27C31,MATCH(VLOOKUP(RC3,Sheet1!R2C2:R6C6,5,FALSE),Sheet1!R2C23:R2C31,FALSE),FALSE) -> 85|80 | X39: UI_taozhuang_zise1 | Y39: 1
A40: 21400 | B40: 堕落魔甲 | C40: 1 | D40: 15 | F40: 0 | I40: 300 | J40: 50 | K40: 4 | L40: 100000 | M40: 100 | N40: 22500 | P40: 21400 | Q40: 自身和周围的怨念变换为魔力并焚烧，直到骨髓都燃烧殆尽。 | R40: =VLOOKUP(RC3,Sheet1!R2C2:R6C6,2,FALSE)&"|"&VLOOKUP(MOD(RC1,1000),Sheet1!R2C9:R27C13,MATCH(VLOOKUP(RC3,Sheet1!R2C2:R6C6,2,FALSE),Sheet1!R2C9:R2C13,FALSE),FALSE)+VLOOKUP(MOD(RC1,1000),Sheet1!R2C16:R27C20,MATCH(VLOOKUP(RC3,Sheet1!R2C2:R6C6,3,FALSE),Sheet1!R2C16:R2C20,FALSE),FALSE) -> 2|455 | S40: =VLOOKUP(MOD(RC1,1000),Sheet1!R2C16:R27C20,MATCH(VLOOKUP(RC3,Sheet1!R2C2:R6C6,3,FALSE),Sheet1!R2C16:R2C20,FALSE),FALSE) -> 20 | T40: =VLOOKUP(RC3,Sheet1!R2C2:R6C6,4,FALSE)&"|"&VLOOKUP(RC3,Sheet1!R2C2:R6C6,5,FALSE) -> 2|11 | U40: =VLOOKUP(MOD(RC1,1000),Sheet1!R2C23:R27C31,MATCH(VLOOKUP(RC3,Sheet1!R2C2:R6C6,4,FALSE),Sheet1!R2C23:R2C31,FALSE),FALSE)&"|"&VLOOKUP(MOD(RC1,1000),Sheet1!R2C23:R27C31,MATCH(VLOOKUP(RC3,Sheet1!R2C2:R6C6,5,FALSE),Sheet1!R2C23:R2C31,FALSE),FALSE) -> 90|80 | W40: =IF(AND(RC[-18]="",RC[-8]=""),INT(RC[-22]/1000)*1000+302,"") -> 21302 | Y40: 1
A41: 21401 | B41: 死者重甲 | C41: 1 | D41: 18 | E41: =RC[-4]-20000 -> 1401 | F41: 0 | I41: 300 | J41: 50 | K41: 4 | L41: 100000 | M41: 100 | N41: 24600 | P41: 21401 | Q41: 冥河之水冲刷过的铠甲，各种死者的冤魂在其上哀嚎。 | R41: =VLOOKUP(RC3,Sheet1!R2C2:R6C6,2,FALSE)&"|"&VLOOKUP(MOD(RC1,1000),Sheet1!R2C9:R27C13,MATCH(VLOOKUP(RC3,Sheet1!R2C2:R6C6,2,FALSE),Sheet1!R2C9:R2C13,FALSE),FALSE)+VLOOKUP(MOD(RC1,1000),Sheet1!R2C16:R27C20,MATCH(VLOOKUP(RC3,Sheet1!R2C2:R6C6,3,FALSE),Sheet1!R2C16:R2C20,FALSE),FALSE) -> 2|512 | S41: =VLOOKUP(MOD(RC1,1000),Sheet1!R2C16:R27C20,MATCH(VLOOKUP(RC3,Sheet1!R2C2:R6C6,3,FALSE),Sheet1!R2C16:R2C20,FALSE),FALSE) -> 22 | T41: =VLOOKUP(RC3,Sheet1!R2C2:R6C6,4,FALSE)&"|"&VLOOKUP(RC3,Sheet1!R2C2:R6C6,5,FALSE) -> 2|11 | U41: =VLOOKUP(MOD(RC1,1000),Sheet1!R2C23:R27C31,MATCH(VLOOKUP(RC3,Sheet1!R2C2:R6C6,4,FALSE),Sheet1!R2C23:R2C31,FALSE),FALSE)&"|"&VLOOKUP(MOD(RC1,1000),Sheet1!R2C23:R27C31,MATCH(VLOOKUP(RC3,Sheet1!R2C2:R6C6,5,FALSE),Sheet1!R2C23:R2C31,FALSE),FALSE) -> 100|80 | W41: =IF(AND(RC[-18]="",RC[-8]=""),INT(RC[-22]/1000)*1000+302,"") ->  | Y41: 1
A42: 21402 | B42: 神圣之心 | C42: 1 | D42: 20 | E42: =RC[-4]-20000 -> 1402 | F42: 0 | I42: 300 | J42: 50 | K42: 4 | L42: 100000 | M42: 100 | N42: 33000 | P42: 21402 | Q42: 这件铠甲曾是天使的装备，长久沐浴在光明中让它变得极为强大。 | R42: =VLOOKUP(RC3,Sheet1!R2C2:R6C6,2,FALSE)&"|"&VLOOKUP(MOD(RC1,1000),Sheet1!R2C9:R27C13,MATCH(VLOOKUP(RC3,Sheet1!R2C2:R6C6,2,FALSE),Sheet1!R2C9:R2C13,FALSE),FALSE)+VLOOKUP(MOD(RC1,1000),Sheet1!R2C16:R27C20,MATCH(VLOOKUP(RC3,Sheet1!R2C2:R6C6,3,FALSE),Sheet1!R2C16:R2C20,FALSE),FALSE) -> 2|569 | S42: =VLOOKUP(MOD(RC1,1000),Sheet1!R2C16:R27C20,MATCH(VLOOKUP(RC3,Sheet1!R2C2:R6C6,3,FALSE),Sheet1!R2C16:R2C20,FALSE),FALSE) -> 24 | T42: =VLOOKUP(RC3,Sheet1!R2C2:R6C6,4,FALSE)&"|"&VLOOKUP(RC3,Sheet1!R2C2:R6C6,5,FALSE) -> 2|11 | U42: =VLOOKUP(MOD(RC1,1000),Sheet1!R2C23:R27C31,MATCH(VLOOKUP(RC3,Sheet1!R2C2:R6C6,4,FALSE),Sheet1!R2C23:R2C31,FALSE),FALSE)&"|"&VLOOKUP(MOD(RC1,1000),Sheet1!R2C23:R27C31,MATCH(VLOOKUP(RC3,Sheet1!R2C2:R6C6,5,FALSE),Sheet1!R2C23:R2C31,FALSE),FALSE) -> 110|80 | W42: =IF(AND(RC[-18]="",RC[-8]=""),INT(RC[-22]/1000)*1000+302,"") ->  | X42: UI_zhuangbei_xingxing | Y42: 1
A43: 21403 | B43: 巨像恐惧 | C43: 1 | D43: 22 | E43: =RC[-4]-20000 -> 1403 | F43: 21503 | I43: 300 | J43: 50 | K43: 4 | L43: 100000 | M43: 100 | N43: 42000 | O43: 403 | P43: 21403 | Q43: 【套装】【可改造】用远古苍蓝巨像的头颅熔炼而成，直视它的人会感到恐惧。 | R43: =VLOOKUP(RC3,Sheet1!R2C2:R6C6,2,FALSE)&"|"&VLOOKUP(MOD(RC1,1000),Sheet1!R2C9:R27C13,MATCH(VLOOKUP(RC3,Sheet1!R2C2:R6C6,2,FALSE),Sheet1!R2C9:R2C13,FALSE),FALSE)+VLOOKUP(MOD(RC1,1000),Sheet1!R2C16:R27C20,MATCH(VLOOKUP(RC3,Sheet1!R2C2:R6C6,3,FALSE),Sheet1!R2C16:R2C20,FALSE),FALSE) -> 2|627 | S43: =VLOOKUP(MOD(RC1,1000),Sheet1!R2C16:R27C20,MATCH(VLOOKUP(RC3,Sheet1!R2C2:R6C6,3,FALSE),Sheet1!R2C16:R2C20,FALSE),FALSE) -> 27 | T43: =VLOOKUP(RC3,Sheet1!R2C2:R6C6,4,FALSE)&"|"&VLOOKUP(RC3,Sheet1!R2C2:R6C6,5,FALSE) -> 2|11 | U43: =VLOOKUP(MOD(RC1,1000),Sheet1!R2C23:R27C31,MATCH(VLOOKUP(RC3,Sheet1!R2C2:R6C6,4,FALSE),Sheet1!R2C23:R2C31,FALSE),FALSE)&"|"&VLOOKUP(MOD(RC1,1000),Sheet1!R2C23:R27C31,MATCH(VLOOKUP(RC3,Sheet1!R2C2:R6C6,5,FALSE),Sheet1!R2C23:R2C31,FALSE),FALSE) -> 120|80 | W43: =IF(AND(RC[-18]="",RC[-8]=""),INT(RC[-22]/1000)*1000+302,"") ->  | X43: UI_taozhuang_chengse1 | Y43: 1
A44: 21404 | B44: 幽冥屠戮 | C44: 1 | D44: 23 | E44: =RC[-4]-20000 -> 1404 | F44: 21504 | I44: 300 | J44: 50 | K44: 4 | L44: 100000 | M44: 100 | N44: 43500 | O44: 404 | P44: 21404 | Q44: 【套装】【可改造】由于杀戮了过多的生命，所有站在它面前的生命都会瑟瑟发抖。 | R44: =VLOOKUP(RC3,Sheet1!R2C2:R6C6,2,FALSE)&"|"&VLOOKUP(MOD(RC1,1000),Sheet1!R2C9:R27C13,MATCH(VLOOKUP(RC3,Sheet1!R2C2:R6C6,2,FALSE),Sheet1!R2C9:R2C13,FALSE),FALSE)+VLOOKUP(MOD(RC1,1000),Sheet1!R2C16:R27C20,MATCH(VLOOKUP(RC3,Sheet1!R2C2:R6C6,3,FALSE),Sheet1!R2C16:R2C20,FALSE),FALSE) -> 2|658 | S44: =VLOOKUP(MOD(RC1,1000),Sheet1!R2C16:R27C20,MATCH(VLOOKUP(RC3,Sheet1!R2C2:R6C6,3,FALSE),Sheet1!R2C16:R2C20,FALSE),FALSE) -> 28 | T44: =VLOOKUP(RC3,Sheet1!R2C2:R6C6,4,FALSE)&"|"&VLOOKUP(RC3,Sheet1!R2C2:R6C6,5,FALSE) -> 2|11 | U44: =VLOOKUP(MOD(RC1,1000),Sheet1!R2C23:R27C31,MATCH(VLOOKUP(RC3,Sheet1!R2C2:R6C6,4,FALSE),Sheet1!R2C23:R2C31,FALSE),FALSE)&"|"&VLOOKUP(MOD(RC1,1000),Sheet1!R2C23:R27C31,MATCH(VLOOKUP(RC3,Sheet1!R2C2:R6C6,5,FALSE),Sheet1!R2C23:R2C31,FALSE),FALSE) -> 125|80 | W44: =IF(AND(RC[-18]="",RC[-8]=""),INT(RC[-22]/1000)*1000+302,"") ->  | X44: UI_taozhuang_chengse1 | Y44: 1
A45: 21405 | B45: 大地之拥 | C45: 1 | D45: 22 | E45: =RC[-4]-20000 -> 1405 | F45: 21505 | I45: 300 | J45: 50 | K45: 4 | L45: 100000 | M45: 100 | N45: 42000 | O45: 405 | P45: 21405 | Q45: 【套装】【可改造】如大地的拥抱，没有人可以毁掉它，以及它所拥抱着的你。 | R45: =VLOOKUP(RC3,Sheet1!R2C2:R6C6,2,FALSE)&"|"&VLOOKUP(MOD(RC1,1000),Sheet1!R2C9:R27C13,MATCH(VLOOKUP(RC3,Sheet1!R2C2:R6C6,2,FALSE),Sheet1!R2C9:R2C13,FALSE),FALSE)+VLOOKUP(MOD(RC1,1000),Sheet1!R2C16:R27C20,MATCH(VLOOKUP(RC3,Sheet1!R2C2:R6C6,3,FALSE),Sheet1!R2C16:R2C20,FALSE),FALSE) -> 2|627 | S45: =VLOOKUP(MOD(RC1,1000),Sheet1!R2C16:R27C20,MATCH(VLOOKUP(RC3,Sheet1!R2C2:R6C6,3,FALSE),Sheet1!R2C16:R2C20,FALSE),FALSE) -> 27 | T45: =VLOOKUP(RC3,Sheet1!R2C2:R6C6,4,FALSE)&"|"&VLOOKUP(RC3,Sheet1!R2C2:R6C6,5,FALSE) -> 2|11 | U45: =VLOOKUP(MOD(RC1,1000),Sheet1!R2C23:R27C31,MATCH(VLOOKUP(RC3,Sheet1!R2C2:R6C6,4,FALSE),Sheet1!R2C23:R2C31,FALSE),FALSE)&"|"&VLOOKUP(MOD(RC1,1000),Sheet1!R2C23:R27C31,MATCH(VLOOKUP(RC3,Sheet1!R2C2:R6C6,5,FALSE),Sheet1!R2C23:R2C31,FALSE),FALSE) -> 120|80 | X45: UI_taozhuang_chengse1 | Y45: 1
A46: 21406 | B46: 圣光战甲 | C46: 1 | D46: 20 | E46: =RC[-4]-20000 -> 1406 | F46: 0 | I46: 300 | J46: 50 | K46: 4 | L46: 100000 | M46: 100 | N46: 39000 | O46: 406 | P46: 21406 | Q46: 【套装】散发浓郁圣光的战甲，给人以一往直前，永不停歇的信心。 | R46: =VLOOKUP(RC3,Sheet1!R2C2:R6C6,2,FALSE)&"|"&VLOOKUP(MOD(RC1,1000),Sheet1!R2C9:R27C13,MATCH(VLOOKUP(RC3,Sheet1!R2C2:R6C6,2,FALSE),Sheet1!R2C9:R2C13,FALSE),FALSE)+VLOOKUP(MOD(RC1,1000),Sheet1!R2C16:R27C20,MATCH(VLOOKUP(RC3,Sheet1!R2C2:R6C6,3,FALSE),Sheet1!R2C16:R2C20,FALSE),FALSE) -> 2|569 | S46: =VLOOKUP(MOD(RC1,1000),Sheet1!R2C16:R27C20,MATCH(VLOOKUP(RC3,Sheet1!R2C2:R6C6,3,FALSE),Sheet1!R2C16:R2C20,FALSE),FALSE) -> 24 | T46: =VLOOKUP(RC3,Sheet1!R2C2:R6C6,4,FALSE)&"|"&VLOOKUP(RC3,Sheet1!R2C2:R6C6,5,FALSE) -> 2|11 | U46: =VLOOKUP(MOD(RC1,1000),Sheet1!R2C23:R27C31,MATCH(VLOOKUP(RC3,Sheet1!R2C2:R6C6,4,FALSE),Sheet1!R2C23:R2C31,FALSE),FALSE)&"|"&VLOOKUP(MOD(RC1,1000),Sheet1!R2C23:R27C31,MATCH(VLOOKUP(RC3,Sheet1!R2C2:R6C6,5,FALSE),Sheet1!R2C23:R2C31,FALSE),FALSE) -> 110|80 | W46: =IF(AND(RC[-18]="",RC[-8]=""),INT(RC[-22]/1000)*1000+302,"") ->  | X46: UI_taozhuang_chengse1 | Y46: 1
A47: 21407 | B47: 熔岩盔甲 | C47: 1 | D47: 21 | E47: =RC[-4]-20000 -> 1407 | F47: 0 | I47: 300 | J47: 50 | K47: 4 | L47: 100000 | M47: 100 | N47: 40500 | O47: 407 | P47: 21407 | Q47: 【套装】融入了大量烈焰结晶的盔甲，靠近就令人感觉到灼热。 | R47: =VLOOKUP(RC3,Sheet1!R2C2:R6C6,2,FALSE)&"|"&VLOOKUP(MOD(RC1,1000),Sheet1!R2C9:R27C13,MATCH(VLOOKUP(RC3,Sheet1!R2C2:R6C6,2,FALSE),Sheet1!R2C9:R2C13,FALSE),FALSE)+VLOOKUP(MOD(RC1,1000),Sheet1!R2C16:R27C20,MATCH(VLOOKUP(RC3,Sheet1!R2C2:R6C6,3,FALSE),Sheet1!R2C16:R2C20,FALSE),FALSE) -> 2|601 | S47: =VLOOKUP(MOD(RC1,1000),Sheet1!R2C16:R27C20,MATCH(VLOOKUP(RC3,Sheet1!R2C2:R6C6,3,FALSE),Sheet1!R2C16:R2C20,FALSE),FALSE) -> 26 | T47: =VLOOKUP(RC3,Sheet1!R2C2:R6C6,4,FALSE)&"|"&VLOOKUP(RC3,Sheet1!R2C2:R6C6,5,FALSE) -> 2|11 | U47: =VLOOKUP(MOD(RC1,1000),Sheet1!R2C23:R27C31,MATCH(VLOOKUP(RC3,Sheet1!R2C2:R6C6,4,FALSE),Sheet1!R2C23:R2C31,FALSE),FALSE)&"|"&VLOOKUP(MOD(RC1,1000),Sheet1!R2C23:R27C31,MATCH(VLOOKUP(RC3,Sheet1!R2C2:R6C6,5,FALSE),Sheet1!R2C23:R2C31,FALSE),FALSE) -> 115|80 | W47: =IF(AND(RC[-18]="",RC[-8]=""),INT(RC[-22]/1000)*1000+302,"") ->  | X47: UI_taozhuang_chengse1 | Y47: 1
A48: 21408 | B48: 苍鹰护甲 | C48: 1 | D48: 20 | E48: =RC[-4]-20000 -> 1408 | F48: 0 | I48: 300 | J48: 50 | K48: 4 | L48: 100000 | M48: 100 | N48: 39000 | O48: 408 | P48: 21408 | Q48: 【套装】禁锢着苍鹰之魂的护甲，狂风会庇护这身盔甲下的人。 | R48: =VLOOKUP(RC3,Sheet1!R2C2:R6C6,2,FALSE)&"|"&VLOOKUP(MOD(RC1,1000),Sheet1!R2C9:R27C13,MATCH(VLOOKUP(RC3,Sheet1!R2C2:R6C6,2,FALSE),Sheet1!R2C9:R2C13,FALSE),FALSE)+VLOOKUP(MOD(RC1,1000),Sheet1!R2C16:R27C20,MATCH(VLOOKUP(RC3,Sheet1!R2C2:R6C6,3,FALSE),Sheet1!R2C16:R2C20,FALSE),FALSE) -> 2|569 | S48: =VLOOKUP(MOD(RC1,1000),Sheet1!R2C16:R27C20,MATCH(VLOOKUP(RC3,Sheet1!R2C2:R6C6,3,FALSE),Sheet1!R2C16:R2C20,FALSE),FALSE) -> 24 | T48: =VLOOKUP(RC3,Sheet1!R2C2:R6C6,4,FALSE)&"|"&VLOOKUP(RC3,Sheet1!R2C2:R6C6,5,FALSE) -> 2|11 | U48: =VLOOKUP(MOD(RC1,1000),Sheet1!R2C23:R27C31,MATCH(VLOOKUP(RC3,Sheet1!R2C2:R6C6,4,FALSE),Sheet1!R2C23:R2C31,FALSE),FALSE)&"|"&VLOOKUP(MOD(RC1,1000),Sheet1!R2C23:R27C31,MATCH(VLOOKUP(RC3,Sheet1!R2C2:R6C6,5,FALSE),Sheet1!R2C23:R2C31,FALSE),FALSE) -> 110|80 | X48: UI_taozhuang_chengse1 | Y48: 1
A49: 21501 | B49: 地狱哀歌 | C49: 1 | D49: 32 | E49: =RC[-4]-20000 -> 1501 | F49: 0 | G49: 5 | H49: 11502 | I49: 300 | J49: 50 | K49: 5 | L49: 1000000 | M49: 100 | N49: 80000 | P49: 21501 | Q49: 它曾经在地狱掀起死亡的风暴，将半个地狱毁于一旦。 | R49: =VLOOKUP(RC3,Sheet1!R2C2:R6C6,2,FALSE)&"|"&VLOOKUP(MOD(RC1,1000),Sheet1!R2C9:R27C13,MATCH(VLOOKUP(RC3,Sheet1!R2C2:R6C6,2,FALSE),Sheet1!R2C9:R2C13,FALSE),FALSE)+VLOOKUP(MOD(RC1,1000),Sheet1!R2C16:R27C20,MATCH(VLOOKUP(RC3,Sheet1!R2C2:R6C6,3,FALSE),Sheet1!R2C16:R2C20,FALSE),FALSE) -> 2|953 | S49: =VLOOKUP(MOD(RC1,1000),Sheet1!R2C16:R27C20,MATCH(VLOOKUP(RC3,Sheet1!R2C2:R6C6,3,FALSE),Sheet1!R2C16:R2C20,FALSE),FALSE) -> 48 | T49: =VLOOKUP(RC3,Sheet1!R2C2:R6C6,4,FALSE)&"|"&VLOOKUP(RC3,Sheet1!R2C2:R6C6,5,FALSE) -> 2|11 | U49: =VLOOKUP(MOD(RC1,1000),Sheet1!R2C23:R27C31,MATCH(VLOOKUP(RC3,Sheet1!R2C2:R6C6,4,FALSE),Sheet1!R2C23:R2C31,FALSE),FALSE)&"|"&VLOOKUP(MOD(RC1,1000),Sheet1!R2C23:R27C31,MATCH(VLOOKUP(RC3,Sheet1!R2C2:R6C6,5,FALSE),Sheet1!R2C23:R2C31,FALSE),FALSE) -> 150|80 | W49: =IF(AND(RC[-18]="",RC[-8]=""),INT(RC[-22]/1000)*1000+302,"") ->  | Y49: 1
A50: 21502 | B50: 永恒虚无 | C50: 1 | D50: 36 | E50: =RC[-4]-20000 -> 1502 | F50: 0 | G50: 5 | H50: 11506 | I50: 300 | J50: 50 | K50: 5 | L50: 1000000 | M50: 100 | N50: 100000 | O50: 502 | P50: 21502 | Q50: 【套装】虚空是世界上最可怕的地方，但只有拥有它，虚空便对你毫无威胁。 | R50: =VLOOKUP(RC3,Sheet1!R2C2:R6C6,2,FALSE)&"|"&VLOOKUP(MOD(RC1,1000),Sheet1!R2C9:R27C13,MATCH(VLOOKUP(RC3,Sheet1!R2C2:R6C6,2,FALSE),Sheet1!R2C9:R2C13,FALSE),FALSE)+VLOOKUP(MOD(RC1,1000),Sheet1!R2C16:R27C20,MATCH(VLOOKUP(RC3,Sheet1!R2C2:R6C6,3,FALSE),Sheet1!R2C16:R2C20,FALSE),FALSE) -> 2|1074 | S50: =VLOOKUP(MOD(RC1,1000),Sheet1!R2C16:R27C20,MATCH(VLOOKUP(RC3,Sheet1!R2C2:R6C6,3,FALSE),Sheet1!R2C16:R2C20,FALSE),FALSE) -> 54 | T50: =VLOOKUP(RC3,Sheet1!R2C2:R6C6,4,FALSE)&"|"&VLOOKUP(RC3,Sheet1!R2C2:R6C6,5,FALSE) -> 2|11 | U50: =VLOOKUP(MOD(RC1,1000),Sheet1!R2C23:R27C31,MATCH(VLOOKUP(RC3,Sheet1!R2C2:R6C6,4,FALSE),Sheet1!R2C23:R2C31,FALSE),FALSE)&"|"&VLOOKUP(MOD(RC1,1000),Sheet1!R2C23:R27C31,MATCH(VLOOKUP(RC3,Sheet1!R2C2:R6C6,5,FALSE),Sheet1!R2C23:R2C31,FALSE),FALSE) -> 170|80 | W50: =IF(AND(RC[-18]="",RC[-8]=""),INT(RC[-22]/1000)*1000+302,"") ->  | X50: UI_taozhuang_hongse1 | Y50: 1
A51: 21503 | B51: 巨擘怒吼 | C51: 1 | D51: 32 | E51: =RC[-4]-20000 -> 1503 | F51: 0 | G51: 5 | H51: 11510 | I51: 300 | J51: 50 | K51: 5 | L51: 1000000 | M51: 100 | N51: 80000 | O51: 503 | P51: 21503 | Q51: 【套装】用上古巨像头领的头颅熔炼而成，仿佛在发出无声的咆哮。 | R51: =VLOOKUP(RC3,Sheet1!R2C2:R6C6,2,FALSE)&"|"&VLOOKUP(MOD(RC1,1000),Sheet1!R2C9:R27C13,MATCH(VLOOKUP(RC3,Sheet1!R2C2:R6C6,2,FALSE),Sheet1!R2C9:R2C13,FALSE),FALSE)+VLOOKUP(MOD(RC1,1000),Sheet1!R2C16:R27C20,MATCH(VLOOKUP(RC3,Sheet1!R2C2:R6C6,3,FALSE),Sheet1!R2C16:R2C20,FALSE),FALSE) -> 2|953 | S51: =VLOOKUP(MOD(RC1,1000),Sheet1!R2C16:R27C20,MATCH(VLOOKUP(RC3,Sheet1!R2C2:R6C6,3,FALSE),Sheet1!R2C16:R2C20,FALSE),FALSE) -> 48 | T51: =VLOOKUP(RC3,Sheet1!R2C2:R6C6,4,FALSE)&"|"&VLOOKUP(RC3,Sheet1!R2C2:R6C6,5,FALSE) -> 2|11 | U51: =VLOOKUP(MOD(RC1,1000),Sheet1!R2C23:R27C31,MATCH(VLOOKUP(RC3,Sheet1!R2C2:R6C6,4,FALSE),Sheet1!R2C23:R2C31,FALSE),FALSE)&"|"&VLOOKUP(MOD(RC1,1000),Sheet1!R2C23:R27C31,MATCH(VLOOKUP(RC3,Sheet1!R2C2:R6C6,5,FALSE),Sheet1!R2C23:R2C31,FALSE),FALSE) -> 150|80 | W51: =IF(AND(RC[-18]="",RC[-8]=""),INT(RC[-22]/1000)*1000+302,"") ->  | X51: UI_taozhuang_hongse1 | Y51: 1
A52: 21504 | B52: 噩梦领域 | C52: 1 | D52: 34 | E52: =RC[-4]-20000 -> 1504 | F52: 0 | G52: 5 | H52: 11514 | I52: 300 | J52: 50 | K52: 5 | L52: 1000000 | M52: 100 | N52: 90000 | O52: 504 | P52: 21504 | Q52: 【套装】给别人带来噩梦的人，往往要承载着更多的噩梦。 | R52: =VLOOKUP(RC3,Sheet1!R2C2:R6C6,2,FALSE)&"|"&VLOOKUP(MOD(RC1,1000),Sheet1!R2C9:R27C13,MATCH(VLOOKUP(RC3,Sheet1!R2C2:R6C6,2,FALSE),Sheet1!R2C9:R2C13,FALSE),FALSE)+VLOOKUP(MOD(RC1,1000),Sheet1!R2C16:R27C20,MATCH(VLOOKUP(RC3,Sheet1!R2C2:R6C6,3,FALSE),Sheet1!R2C16:R2C20,FALSE),FALSE) -> 2|1016 | S52: =VLOOKUP(MOD(RC1,1000),Sheet1!R2C16:R27C20,MATCH(VLOOKUP(RC3,Sheet1!R2C2:R6C6,3,FALSE),Sheet1!R2C16:R2C20,FALSE),FALSE) -> 51 | T52: =VLOOKUP(RC3,Sheet1!R2C2:R6C6,4,FALSE)&"|"&VLOOKUP(RC3,Sheet1!R2C2:R6C6,5,FALSE) -> 2|11 | U52: =VLOOKUP(MOD(RC1,1000),Sheet1!R2C23:R27C31,MATCH(VLOOKUP(RC3,Sheet1!R2C2:R6C6,4,FALSE),Sheet1!R2C23:R2C31,FALSE),FALSE)&"|"&VLOOKUP(MOD(RC1,1000),Sheet1!R2C23:R27C31,MATCH(VLOOKUP(RC3,Sheet1!R2C2:R6C6,5,FALSE),Sheet1!R2C23:R2C31,FALSE),FALSE) -> 160|80 | W52: =IF(AND(RC[-18]="",RC[-8]=""),INT(RC[-22]/1000)*1000+302,"") ->  | X52: UI_taozhuang_hongse1 | Y52: 1
A53: 21505 | B53: 盖亚守护 | C53: 1 | D53: 32 | E53: =RC[-4]-20000 -> 1505 | F53: 0 | G53: 5 | H53: 11518 | I53: 300 | J53: 50 | K53: 5 | L53: 1000000 | M53: 100 | N53: 80000 | O53: 505 | P53: 21505 | Q53: 【套装】再她身上，我们看到了创造与秩序。 | R53: =VLOOKUP(RC3,Sheet1!R2C2:R6C6,2,FALSE)&"|"&VLOOKUP(MOD(RC1,1000),Sheet1!R2C9:R27C13,MATCH(VLOOKUP(RC3,Sheet1!R2C2:R6C6,2,FALSE),Sheet1!R2C9:R2C13,FALSE),FALSE)+VLOOKUP(MOD(RC1,1000),Sheet1!R2C16:R27C20,MATCH(VLOOKUP(RC3,Sheet1!R2C2:R6C6,3,FALSE),Sheet1!R2C16:R2C20,FALSE),FALSE) -> 2|953 | S53: =VLOOKUP(MOD(RC1,1000),Sheet1!R2C16:R27C20,MATCH(VLOOKUP(RC3,Sheet1!R2C2:R6C6,3,FALSE),Sheet1!R2C16:R2C20,FALSE),FALSE) -> 48 | T53: =VLOOKUP(RC3,Sheet1!R2C2:R6C6,4,FALSE)&"|"&VLOOKUP(RC3,Sheet1!R2C2:R6C6,5,FALSE) -> 2|11 | U53: =VLOOKUP(MOD(RC1,1000),Sheet1!R2C23:R27C31,MATCH(VLOOKUP(RC3,Sheet1!R2C2:R6C6,4,FALSE),Sheet1!R2C23:R2C31,FALSE),FALSE)&"|"&VLOOKUP(MOD(RC1,1000),Sheet1!R2C23:R27C31,MATCH(VLOOKUP(RC3,Sheet1!R2C2:R6C6,5,FALSE),Sheet1!R2C23:R2C31,FALSE),FALSE) -> 150|80 | X53: UI_taozhuang_hongse1 | Y53: 1
A54: 22101 | B54: 兽皮靴 | C54: 2 | D54: 1 | F54: 0 | I54: 300 | J54: 50 | K54: 1 | L54: 100 | M54: 100 | N54: 50 | P54: 22101 | Q54: 用兽皮裁缝而成的普通靴子。 | R54: =VLOOKUP(RC3,Sheet1!R2C2:R6C6,2,FALSE)&"|"&VLOOKUP(MOD(RC1,1000),Sheet1!R2C9:R27C13,MATCH(VLOOKUP(RC3,Sheet1!R2C2:R6C6,2,FALSE),Sheet1!R2C9:R2C13,FALSE),FALSE)+VLOOKUP(MOD(RC1,1000),Sheet1!R2C16:R27C20,MATCH(VLOOKUP(RC3,Sheet1!R2C2:R6C6,3,FALSE),Sheet1!R2C16:R2C20,FALSE),FALSE) -> 3|72 | S54: =VLOOKUP(MOD(RC1,1000),Sheet1!R2C16:R27C20,MATCH(VLOOKUP(RC3,Sheet1!R2C2:R6C6,3,FALSE),Sheet1!R2C16:R2C20,FALSE),FALSE) -> 2 | T54: =VLOOKUP(RC3,Sheet1!R2C2:R6C6,4,FALSE)&"|"&VLOOKUP(RC3,Sheet1!R2C2:R6C6,5,FALSE) -> 3|12 | U54: =VLOOKUP(MOD(RC1,1000),Sheet1!R2C23:R27C31,MATCH(VLOOKUP(RC3,Sheet1!R2C2:R6C6,4,FALSE),Sheet1!R2C23:R2C31,FALSE),FALSE)&"|"&VLOOKUP(MOD(RC1,1000),Sheet1!R2C23:R27C31,MATCH(VLOOKUP(RC3,Sheet1!R2C2:R6C6,5,FALSE),Sheet1!R2C23:R2C31,FALSE),FALSE) -> 25|80 | V54: 26 | W54: =IF(AND(RC[-18]="",RC[-8]=""),INT(RC[-22]/1000)*1000+302,"") -> 22302 | Y54: 1
A55: 22102 | B55: 精致战靴 | C55: 2 | D55: 2 | F55: 0 | I55: 300 | J55: 50 | K55: 1 | L55: 100 | M55: 100 | N55: 60 | O55: 101 | P55: 22102 | Q55: 【套装】精致的战靴，耐用的同时还能提供一定保护。 | R55: =VLOOKUP(RC3,Sheet1!R2C2:R6C6,2,FALSE)&"|"&VLOOKUP(MOD(RC1,1000),Sheet1!R2C9:R27C13,MATCH(VLOOKUP(RC3,Sheet1!R2C2:R6C6,2,FALSE),Sheet1!R2C9:R2C13,FALSE),FALSE)+VLOOKUP(MOD(RC1,1000),Sheet1!R2C16:R27C20,MATCH(VLOOKUP(RC3,Sheet1!R2C2:R6C6,3,FALSE),Sheet1!R2C16:R2C20,FALSE),FALSE) -> 3|72 | S55: =VLOOKUP(MOD(RC1,1000),Sheet1!R2C16:R27C20,MATCH(VLOOKUP(RC3,Sheet1!R2C2:R6C6,3,FALSE),Sheet1!R2C16:R2C20,FALSE),FALSE) -> 2 | T55: =VLOOKUP(RC3,Sheet1!R2C2:R6C6,4,FALSE)&"|"&VLOOKUP(RC3,Sheet1!R2C2:R6C6,5,FALSE) -> 3|12 | U55: =VLOOKUP(MOD(RC1,1000),Sheet1!R2C23:R27C31,MATCH(VLOOKUP(RC3,Sheet1!R2C2:R6C6,4,FALSE),Sheet1!R2C23:R2C31,FALSE),FALSE)&"|"&VLOOKUP(MOD(RC1,1000),Sheet1!R2C23:R27C31,MATCH(VLOOKUP(RC3,Sheet1!R2C2:R6C6,5,FALSE),Sheet1!R2C23:R2C31,FALSE),FALSE) -> 25|80 | V55: 33 | W55: =IF(AND(RC[-18]="",RC[-8]=""),INT(RC[-22]/1000)*1000+302,"") ->  | X55: UI_taozhuang_lvse | Y55: 1
A56: 22201 | B56: 镶甲短靴 | C56: 2 | D56: 4 | F56: 0 | I56: 300 | J56: 50 | K56: 2 | L56: 1000 | M56: 100 | N56: 900 | P56: 22201 | Q56: 靴子上镶了数块甲片，不会影响足部的灵活，同时提供一定保护。 | R56: =VLOOKUP(RC3,Sheet1!R2C2:R6C6,2,FALSE)&"|"&VLOOKUP(MOD(RC1,1000),Sheet1!R2C9:R27C13,MATCH(VLOOKUP(RC3,Sheet1!R2C2:R6C6,2,FALSE),Sheet1!R2C9:R2C13,FALSE),FALSE)+VLOOKUP(MOD(RC1,1000),Sheet1!R2C16:R27C20,MATCH(VLOOKUP(RC3,Sheet1!R2C2:R6C6,3,FALSE),Sheet1!R2C16:R2C20,FALSE),FALSE) -> 3|149 | S56: =VLOOKUP(MOD(RC1,1000),Sheet1!R2C16:R27C20,MATCH(VLOOKUP(RC3,Sheet1!R2C2:R6C6,3,FALSE),Sheet1!R2C16:R2C20,FALSE),FALSE) -> 4 | T56: =VLOOKUP(RC3,Sheet1!R2C2:R6C6,4,FALSE)&"|"&VLOOKUP(RC3,Sheet1!R2C2:R6C6,5,FALSE) -> 3|12 | U56: =VLOOKUP(MOD(RC1,1000),Sheet1!R2C23:R27C31,MATCH(VLOOKUP(RC3,Sheet1!R2C2:R6C6,4,FALSE),Sheet1!R2C23:R2C31,FALSE),FALSE)&"|"&VLOOKUP(MOD(RC1,1000),Sheet1!R2C23:R27C31,MATCH(VLOOKUP(RC3,Sheet1!R2C2:R6C6,5,FALSE),Sheet1!R2C23:R2C31,FALSE),FALSE) -> 40|80 | W56: =IF(AND(RC[-18]="",RC[-8]=""),INT(RC[-22]/1000)*1000+302,"") -> 22302 | Y56: 1
A57: 22202 | B57: 骑士铁靴 | C57: 2 | D57: 5 | F57: 0 | I57: 300 | J57: 50 | K57: 2 | L57: 1000 | M57: 100 | N57: 1200 | O57: 202 | P57: 22202 | Q57: 【套装】骑士的靴子一般都是特制的，他们战斗的同时还要控制战马。 | R57: =VLOOKUP(RC3,Sheet1!R2C2:R6C6,2,FALSE)&"|"&VLOOKUP(MOD(RC1,1000),Sheet1!R2C9:R27C13,MATCH(VLOOKUP(RC3,Sheet1!R2C2:R6C6,2,FALSE),Sheet1!R2C9:R2C13,FALSE),FALSE)+VLOOKUP(MOD(RC1,1000),Sheet1!R2C16:R27C20,MATCH(VLOOKUP(RC3,Sheet1!R2C2:R6C6,3,FALSE),Sheet1!R2C16:R2C20,FALSE),FALSE) -> 3|185 | S57: =VLOOKUP(MOD(RC1,1000),Sheet1!R2C16:R27C20,MATCH(VLOOKUP(RC3,Sheet1!R2C2:R6C6,3,FALSE),Sheet1!R2C16:R2C20,FALSE),FALSE) -> 5 | T57: =VLOOKUP(RC3,Sheet1!R2C2:R6C6,4,FALSE)&"|"&VLOOKUP(RC3,Sheet1!R2C2:R6C6,5,FALSE) -> 3|12 | U57: =VLOOKUP(MOD(RC1,1000),Sheet1!R2C23:R27C31,MATCH(VLOOKUP(RC3,Sheet1!R2C2:R6C6,4,FALSE),Sheet1!R2C23:R2C31,FALSE),FALSE)&"|"&VLOOKUP(MOD(RC1,1000),Sheet1!R2C23:R27C31,MATCH(VLOOKUP(RC3,Sheet1!R2C2:R6C6,5,FALSE),Sheet1!R2C23:R2C31,FALSE),FALSE) -> 50|80 | W57: =IF(AND(RC[-18]="",RC[-8]=""),INT(RC[-22]/1000)*1000+302,"") ->  | X57: UI_taozhuang_lanse | Y57: 1
A58: 22301 | B58: 疾风长靴 | C58: 2 | D58: 10 | F58: 0 | I58: 300 | J58: 50 | K58: 3 | L58: 10000 | M58: 100 | N58: 6000 | P58: 22301 | Q58: 经过附魔的长靴，恒定的【疾风术】可以加快使用者的脚步。 | R58: =VLOOKUP(RC3,Sheet1!R2C2:R6C6,2,FALSE)&"|"&VLOOKUP(MOD(RC1,1000),Sheet1!R2C9:R27C13,MATCH(VLOOKUP(RC3,Sheet1!R2C2:R6C6,2,FALSE),Sheet1!R2C9:R2C13,FALSE),FALSE)+VLOOKUP(MOD(RC1,1000),Sheet1!R2C16:R27C20,MATCH(VLOOKUP(RC3,Sheet1!R2C2:R6C6,3,FALSE),Sheet1!R2C16:R2C20,FALSE),FALSE) -> 3|296 | S58: =VLOOKUP(MOD(RC1,1000),Sheet1!R2C16:R27C20,MATCH(VLOOKUP(RC3,Sheet1!R2C2:R6C6,3,FALSE),Sheet1!R2C16:R2C20,FALSE),FALSE) -> 11 | T58: =VLOOKUP(RC3,Sheet1!R2C2:R6C6,4,FALSE)&"|"&VLOOKUP(RC3,Sheet1!R2C2:R6C6,5,FALSE) -> 3|12 | U58: =VLOOKUP(MOD(RC1,1000),Sheet1!R2C23:R27C31,MATCH(VLOOKUP(RC3,Sheet1!R2C2:R6C6,4,FALSE),Sheet1!R2C23:R2C31,FALSE),FALSE)&"|"&VLOOKUP(MOD(RC1,1000),Sheet1!R2C23:R27C31,MATCH(VLOOKUP(RC3,Sheet1!R2C2:R6C6,5,FALSE),Sheet1!R2C23:R2C31,FALSE),FALSE) -> 70|80 | W58: =IF(AND(RC[-18]="",RC[-8]=""),INT(RC[-22]/1000)*1000+302,"") -> 22302 | Y58: 1
A59: 22302 | B59: 黑钢长靴 | C59: 2 | D59: 11 | E59: =RC[-4]-20000 -> 2302 | F59: 0 | I59: 300 | J59: 50 | K59: 3 | L59: 10000 | M59: 100 | N59: 10000 | P59: 22302 | Q59: 黑钢打造的长靴，辅以一定数量的金钢，重而有力。 | R59: =VLOOKUP(RC3,Sheet1!R2C2:R6C6,2,FALSE)&"|"&VLOOKUP(MOD(RC1,1000),Sheet1!R2C9:R27C13,MATCH(VLOOKUP(RC3,Sheet1!R2C2:R6C6,2,FALSE),Sheet1!R2C9:R2C13,FALSE),FALSE)+VLOOKUP(MOD(RC1,1000),Sheet1!R2C16:R27C20,MATCH(VLOOKUP(RC3,Sheet1!R2C2:R6C6,3,FALSE),Sheet1!R2C16:R2C20,FALSE),FALSE) -> 3|322 | S59: =VLOOKUP(MOD(RC1,1000),Sheet1!R2C16:R27C20,MATCH(VLOOKUP(RC3,Sheet1!R2C2:R6C6,3,FALSE),Sheet1!R2C16:R2C20,FALSE),FALSE) -> 12 | T59: =VLOOKUP(RC3,Sheet1!R2C2:R6C6,4,FALSE)&"|"&VLOOKUP(RC3,Sheet1!R2C2:R6C6,5,FALSE) -> 3|12 | U59: =VLOOKUP(MOD(RC1,1000),Sheet1!R2C23:R27C31,MATCH(VLOOKUP(RC3,Sheet1!R2C2:R6C6,4,FALSE),Sheet1!R2C23:R2C31,FALSE),FALSE)&"|"&VLOOKUP(MOD(RC1,1000),Sheet1!R2C23:R27C31,MATCH(VLOOKUP(RC3,Sheet1!R2C2:R6C6,5,FALSE),Sheet1!R2C23:R2C31,FALSE),FALSE) -> 75|80 | W59: =IF(AND(RC[-18]="",RC[-8]=""),INT(RC[-22]/1000)*1000+302,"") ->  | X59: UI_zhuangbei_xingxing | Y59: 1
A60: 22303 | B60: 荣耀重靴 | C60: 2 | D60: 12 | E60: =RC[-4]-20000 -> 2303 | F60: 22406 | I60: 300 | J60: 50 | K60: 3 | L60: 10000 | M60: 100 | N60: 12000 | O60: 303 | P60: 22303 | Q60: 【套装】【可改造】象征荣耀的战靴，给人以一往直前，永不停歇的动力。 | R60: =VLOOKUP(RC3,Sheet1!R2C2:R6C6,2,FALSE)&"|"&VLOOKUP(MOD(RC1,1000),Sheet1!R2C9:R27C13,MATCH(VLOOKUP(RC3,Sheet1!R2C2:R6C6,2,FALSE),Sheet1!R2C9:R2C13,FALSE),FALSE)+VLOOKUP(MOD(RC1,1000),Sheet1!R2C16:R27C20,MATCH(VLOOKUP(RC3,Sheet1!R2C2:R6C6,3,FALSE),Sheet1!R2C16:R2C20,FALSE),FALSE) -> 3|353 | S60: =VLOOKUP(MOD(RC1,1000),Sheet1!R2C16:R27C20,MATCH(VLOOKUP(RC3,Sheet1!R2C2:R6C6,3,FALSE),Sheet1!R2C16:R2C20,FALSE),FALSE) -> 13 | T60: =VLOOKUP(RC3,Sheet1!R2C2:R6C6,4,FALSE)&"|"&VLOOKUP(RC3,Sheet1!R2C2:R6C6,5,FALSE) -> 3|12 | U60: =VLOOKUP(MOD(RC1,1000),Sheet1!R2C23:R27C31,MATCH(VLOOKUP(RC3,Sheet1!R2C2:R6C6,4,FALSE),Sheet1!R2C23:R2C31,FALSE),FALSE)&"|"&VLOOKUP(MOD(RC1,1000),Sheet1!R2C23:R27C31,MATCH(VLOOKUP(RC3,Sheet1!R2C2:R6C6,5,FALSE),Sheet1!R2C23:R2C31,FALSE),FALSE) -> 85|80 | W60: =IF(AND(RC[-18]="",RC[-8]=""),INT(RC[-22]/1000)*1000+302,"") ->  | X60: UI_taozhuang_zise1 | Y60: 1
A61: 22304 | B61: 烈焰魔靴 | C61: 2 | D61: 13 | E61: =RC[-4]-20000 -> 2304 | F61: 22407 | I61: 300 | J61: 50 | K61: 3 | L61: 10000 | M61: 100 | N61: 13000 | O61: 304 | P61: 22304 | Q61: 【套装】【可改造】融入了烈焰结晶粉末的皮靴，靠近就令人感觉到灼热。 | R61: =VLOOKUP(RC3,Sheet1!R2C2:R6C6,2,FALSE)&"|"&VLOOKUP(MOD(RC1,1000),Sheet1!R2C9:R27C13,MATCH(VLOOKUP(RC3,Sheet1!R2C2:R6C6,2,FALSE),Sheet1!R2C9:R2C13,FALSE),FALSE)+VLOOKUP(MOD(RC1,1000),Sheet1!R2C16:R27C20,MATCH(VLOOKUP(RC3,Sheet1!R2C2:R6C6,3,FALSE),Sheet1!R2C16:R2C20,FALSE),FALSE) -> 3|384 | S61: =VLOOKUP(MOD(RC1,1000),Sheet1!R2C16:R27C20,MATCH(VLOOKUP(RC3,Sheet1!R2C2:R6C6,3,FALSE),Sheet1!R2C16:R2C20,FALSE),FALSE) -> 14 | T61: =VLOOKUP(RC3,Sheet1!R2C2:R6C6,4,FALSE)&"|"&VLOOKUP(RC3,Sheet1!R2C2:R6C6,5,FALSE) -> 3|12 | U61: =VLOOKUP(MOD(RC1,1000),Sheet1!R2C23:R27C31,MATCH(VLOOKUP(RC3,Sheet1!R2C2:R6C6,4,FALSE),Sheet1!R2C23:R2C31,FALSE),FALSE)&"|"&VLOOKUP(MOD(RC1,1000),Sheet1!R2C23:R27C31,MATCH(VLOOKUP(RC3,Sheet1!R2C2:R6C6,5,FALSE),Sheet1!R2C23:R2C31,FALSE),FALSE) -> 90|80 | W61: =IF(AND(RC[-18]="",RC[-8]=""),INT(RC[-22]/1000)*1000+302,"") ->  | X61: UI_taozhuang_zise1 | Y61: 1
A62: 22305 | B62: 青鸟长靴 | C62: 2 | D62: 12 | E62: =RC[-4]-20000 -> 2305 | F62: 22408 | I62: 300 | J62: 50 | K62: 3 | L62: 10000 | M62: 100 | N62: 12000 | O62: 305 | P62: 22305 | Q62: 【套装】【可改造】囚禁了青鸟之魂的长靴，令穿戴者的奔驰如乘风而行。 | R62: =VLOOKUP(RC3,Sheet1!R2C2:R6C6,2,FALSE)&"|"&VLOOKUP(MOD(RC1,1000),Sheet1!R2C9:R27C13,MATCH(VLOOKUP(RC3,Sheet1!R2C2:R6C6,2,FALSE),Sheet1!R2C9:R2C13,FALSE),FALSE)+VLOOKUP(MOD(RC1,1000),Sheet1!R2C16:R27C20,MATCH(VLOOKUP(RC3,Sheet1!R2C2:R6C6,3,FALSE),Sheet1!R2C16:R2C20,FALSE),FALSE) -> 3|353 | S62: =VLOOKUP(MOD(RC1,1000),Sheet1!R2C16:R27C20,MATCH(VLOOKUP(RC3,Sheet1!R2C2:R6C6,3,FALSE),Sheet1!R2C16:R2C20,FALSE),FALSE) -> 13 | T62: =VLOOKUP(RC3,Sheet1!R2C2:R6C6,4,FALSE)&"|"&VLOOKUP(RC3,Sheet1!R2C2:R6C6,5,FALSE) -> 3|12 | U62: =VLOOKUP(MOD(RC1,1000),Sheet1!R2C23:R27C31,MATCH(VLOOKUP(RC3,Sheet1!R2C2:R6C6,4,FALSE),Sheet1!R2C23:R2C31,FALSE),FALSE)&"|"&VLOOKUP(MOD(RC1,1000),Sheet1!R2C23:R27C31,MATCH(VLOOKUP(RC3,Sheet1!R2C2:R6C6,5,FALSE),Sheet1!R2C23:R2C31,FALSE),FALSE) -> 85|80 | X62: UI_taozhuang_zise1 | Y62: 1
A63: 22401 | B63: 踏浪长靴 | C63: 2 | D63: 18 | E63: =RC[-4]-20000 -> 2401 | F63: 0 | I63: 300 | J63: 50 | K63: 4 | L63: 100000 | M63: 100 | N63: 24600 | P63: 22401 | Q63: 穿上它可以在浪花上奔跑，当然，只要停下来你就会掉下去。 | R63: =VLOOKUP(RC3,Sheet1!R2C2:R6C6,2,FALSE)&"|"&VLOOKUP(MOD(RC1,1000),Sheet1!R2C9:R27C13,MATCH(VLOOKUP(RC3,Sheet1!R2C2:R6C6,2,FALSE),Sheet1!R2C9:R2C13,FALSE),FALSE)+VLOOKUP(MOD(RC1,1000),Sheet1!R2C16:R27C20,MATCH(VLOOKUP(RC3,Sheet1!R2C2:R6C6,3,FALSE),Sheet1!R2C16:R2C20,FALSE),FALSE) -> 3|512 | S63: =VLOOKUP(MOD(RC1,1000),Sheet1!R2C16:R27C20,MATCH(VLOOKUP(RC3,Sheet1!R2C2:R6C6,3,FALSE),Sheet1!R2C16:R2C20,FALSE),FALSE) -> 22 | T63: =VLOOKUP(RC3,Sheet1!R2C2:R6C6,4,FALSE)&"|"&VLOOKUP(RC3,Sheet1!R2C2:R6C6,5,FALSE) -> 3|12 | U63: =VLOOKUP(MOD(RC1,1000),Sheet1!R2C23:R27C31,MATCH(VLOOKUP(RC3,Sheet1!R2C2:R6C6,4,FALSE),Sheet1!R2C23:R2C31,FALSE),FALSE)&"|"&VLOOKUP(MOD(RC1,1000),Sheet1!R2C23:R27C31,MATCH(VLOOKUP(RC3,Sheet1!R2C2:R6C6,5,FALSE),Sheet1!R2C23:R2C31,FALSE),FALSE) -> 100|80 | W63: =IF(AND(RC[-18]="",RC[-8]=""),INT(RC[-22]/1000)*1000+302,"") ->  | Y63: 1
A64: 22402 | B64: 雷霆战靴 | C64: 2 | D64: 20 | E64: =RC[-4]-20000 -> 2402 | F64: 0 | I64: 300 | J64: 50 | K64: 4 | L64: 100000 | M64: 100 | N64: 33000 | P64: 22402 | Q64: 其上隐隐有雷霆闪烁，穿戴者的奔跑速度近可媲美雷霆。 | R64: =VLOOKUP(RC3,Sheet1!R2C2:R6C6,2,FALSE)&"|"&VLOOKUP(MOD(RC1,1000),Sheet1!R2C9:R27C13,MATCH(VLOOKUP(RC3,Sheet1!R2C2:R6C6,2,FALSE),Sheet1!R2C9:R2C13,FALSE),FALSE)+VLOOKUP(MOD(RC1,1000),Sheet1!R2C16:R27C20,MATCH(VLOOKUP(RC3,Sheet1!R2C2:R6C6,3,FALSE),Sheet1!R2C16:R2C20,FALSE),FALSE) -> 3|569 | S64: =VLOOKUP(MOD(RC1,1000),Sheet1!R2C16:R27C20,MATCH(VLOOKUP(RC3,Sheet1!R2C2:R6C6,3,FALSE),Sheet1!R2C16:R2C20,FALSE),FALSE) -> 24 | T64: =VLOOKUP(RC3,Sheet1!R2C2:R6C6,4,FALSE)&"|"&VLOOKUP(RC3,Sheet1!R2C2:R6C6,5,FALSE) -> 3|12 | U64: =VLOOKUP(MOD(RC1,1000),Sheet1!R2C23:R27C31,MATCH(VLOOKUP(RC3,Sheet1!R2C2:R6C6,4,FALSE),Sheet1!R2C23:R2C31,FALSE),FALSE)&"|"&VLOOKUP(MOD(RC1,1000),Sheet1!R2C23:R27C31,MATCH(VLOOKUP(RC3,Sheet1!R2C2:R6C6,5,FALSE),Sheet1!R2C23:R2C31,FALSE),FALSE) -> 110|80 | W64: =IF(AND(RC[-18]="",RC[-8]=""),INT(RC[-22]/1000)*1000+302,"") ->  | X64: UI_zhuangbei_xingxing | Y64: 1
A65: 22403 | B65: 巨像震撼 | C65: 2 | D65: 22 | E65: =RC[-4]-20000 -> 2403 | F65: 22503 | I65: 300 | J65: 50 | K65: 4 | L65: 100000 | M65: 100 | N65: 42000 | O65: 403 | P65: 22403 | Q65: 【套装】【可改造】融入了远古苍蓝巨像的一部分核心，拥有震撼大地的能力。 | R65: =VLOOKUP(RC3,Sheet1!R2C2:R6C6,2,FALSE)&"|"&VLOOKUP(MOD(RC1,1000),Sheet1!R2C9:R27C13,MATCH(VLOOKUP(RC3,Sheet1!R2C2:R6C6,2,FALSE),Sheet1!R2C9:R2C13,FALSE),FALSE)+VLOOKUP(MOD(RC1,1000),Sheet1!R2C16:R27C20,MATCH(VLOOKUP(RC3,Sheet1!R2C2:R6C6,3,FALSE),Sheet1!R2C16:R2C20,FALSE),FALSE) -> 3|627 | S65: =VLOOKUP(MOD(RC1,1000),Sheet1!R2C16:R27C20,MATCH(VLOOKUP(RC3,Sheet1!R2C2:R6C6,3,FALSE),Sheet1!R2C16:R2C20,FALSE),FALSE) -> 27 | T65: =VLOOKUP(RC3,Sheet1!R2C2:R6C6,4,FALSE)&"|"&VLOOKUP(RC3,Sheet1!R2C2:R6C6,5,FALSE) -> 3|12 | U65: =VLOOKUP(MOD(RC1,1000),Sheet1!R2C23:R27C31,MATCH(VLOOKUP(RC3,Sheet1!R2C2:R6C6,4,FALSE),Sheet1!R2C23:R2C31,FALSE),FALSE)&"|"&VLOOKUP(MOD(RC1,1000),Sheet1!R2C23:R27C31,MATCH(VLOOKUP(RC3,Sheet1!R2C2:R6C6,5,FALSE),Sheet1!R2C23:R2C31,FALSE),FALSE) -> 120|80 | W65: =IF(AND(RC[-18]="",RC[-8]=""),INT(RC[-22]/1000)*1000+302,"") ->  | X65: UI_taozhuang_chengse1 | Y65: 1
A66: 22404 | B66: 幽冥掠夺 | C66: 2 | D66: 23 | E66: =RC[-4]-20000 -> 2404 | F66: 22504 | I66: 300 | J66: 50 | K66: 4 | L66: 100000 | M66: 100 | N66: 43500 | O66: 404 | P66: 22404 | Q66: 【套装】【可改造】杀戮，掠夺，这是幽冥之地永远不会改变的主旋律。 | R66: =VLOOKUP(RC3,Sheet1!R2C2:R6C6,2,FALSE)&"|"&VLOOKUP(MOD(RC1,1000),Sheet1!R2C9:R27C13,MATCH(VLOOKUP(RC3,Sheet1!R2C2:R6C6,2,FALSE),Sheet1!R2C9:R2C13,FALSE),FALSE)+VLOOKUP(MOD(RC1,1000),Sheet1!R2C16:R27C20,MATCH(VLOOKUP(RC3,Sheet1!R2C2:R6C6,3,FALSE),Sheet1!R2C16:R2C20,FALSE),FALSE) -> 3|658 | S66: =VLOOKUP(MOD(RC1,1000),Sheet1!R2C16:R27C20,MATCH(VLOOKUP(RC3,Sheet1!R2C2:R6C6,3,FALSE),Sheet1!R2C16:R2C20,FALSE),FALSE) -> 28 | T66: =VLOOKUP(RC3,Sheet1!R2C2:R6C6,4,FALSE)&"|"&VLOOKUP(RC3,Sheet1!R2C2:R6C6,5,FALSE) -> 3|12 | U66: =VLOOKUP(MOD(RC1,1000),Sheet1!R2C23:R27C31,MATCH(VLOOKUP(RC3,Sheet1!R2C2:R6C6,4,FALSE),Sheet1!R2C23:R2C31,FALSE),FALSE)&"|"&VLOOKUP(MOD(RC1,1000),Sheet1!R2C23:R27C31,MATCH(VLOOKUP(RC3,Sheet1!R2C2:R6C6,5,FALSE),Sheet1!R2C23:R2C31,FALSE),FALSE) -> 125|80 | W66: =IF(AND(RC[-18]="",RC[-8]=""),INT(RC[-22]/1000)*1000+302,"") ->  | X66: UI_taozhuang_chengse1 | Y66: 1
A67: 22405 | B67: 大地行者 | C67: 2 | D67: 22 | E67: =RC[-4]-20000 -> 2405 | F67: 22505 | I67: 300 | J67: 50 | K67: 4 | L67: 100000 | M67: 100 | N67: 42000 | O67: 405 | P67: 22405 | Q67: 【套装】【可改造】行走于大地，坚定的脚步是一往无前的决心，无人可挡。 | R67: =VLOOKUP(RC3,Sheet1!R2C2:R6C6,2,FALSE)&"|"&VLOOKUP(MOD(RC1,1000),Sheet1!R2C9:R27C13,MATCH(VLOOKUP(RC3,Sheet1!R2C2:R6C6,2,FALSE),Sheet1!R2C9:R2C13,FALSE),FALSE)+VLOOKUP(MOD(RC1,1000),Sheet1!R2C16:R27C20,MATCH(VLOOKUP(RC3,Sheet1!R2C2:R6C6,3,FALSE),Sheet1!R2C16:R2C20,FALSE),FALSE) -> 3|627 | S67: =VLOOKUP(MOD(RC1,1000),Sheet1!R2C16:R27C20,MATCH(VLOOKUP(RC3,Sheet1!R2C2:R6C6,3,FALSE),Sheet1!R2C16:R2C20,FALSE),FALSE) -> 27 | T67: =VLOOKUP(RC3,Sheet1!R2C2:R6C6,4,FALSE)&"|"&VLOOKUP(RC3,Sheet1!R2C2:R6C6,5,FALSE) -> 3|12 | U67: =VLOOKUP(MOD(RC1,1000),Sheet1!R2C23:R27C31,MATCH(VLOOKUP(RC3,Sheet1!R2C2:R6C6,4,FALSE),Sheet1!R2C23:R2C31,FALSE),FALSE)&"|"&VLOOKUP(MOD(RC1,1000),Sheet1!R2C23:R27C31,MATCH(VLOOKUP(RC3,Sheet1!R2C2:R6C6,5,FALSE),Sheet1!R2C23:R2C31,FALSE),FALSE) -> 120|80 | X67: UI_taozhuang_chengse1 | Y67: 1
A68: 22406 | B68: 圣光战靴 | C68: 2 | D68: 20 | E68: =RC[-4]-20000 -> 2406 | F68: 0 | I68: 300 | J68: 50 | K68: 4 | L68: 100000 | M68: 100 | N68: 39000 | O68: 406 | P68: 22406 | Q68: 【套装】散发浓郁圣光的战靴，给人以一往直前，永不停歇的动力。 | R68: =VLOOKUP(RC3,Sheet1!R2C2:R6C6,2,FALSE)&"|"&VLOOKUP(MOD(RC1,1000),Sheet1!R2C9:R27C13,MATCH(VLOOKUP(RC3,Sheet1!R2C2:R6C6,2,FALSE),Sheet1!R2C9:R2C13,FALSE),FALSE)+VLOOKUP(MOD(RC1,1000),Sheet1!R2C16:R27C20,MATCH(VLOOKUP(RC3,Sheet1!R2C2:R6C6,3,FALSE),Sheet1!R2C16:R2C20,FALSE),FALSE) -> 3|569 | S68: =VLOOKUP(MOD(RC1,1000),Sheet1!R2C16:R27C20,MATCH(VLOOKUP(RC3,Sheet1!R2C2:R6C6,3,FALSE),Sheet1!R2C16:R2C20,FALSE),FALSE) -> 24 | T68: =VLOOKUP(RC3,Sheet1!R2C2:R6C6,4,FALSE)&"|"&VLOOKUP(RC3,Sheet1!R2C2:R6C6,5,FALSE) -> 3|12 | U68: =VLOOKUP(MOD(RC1,1000),Sheet1!R2C23:R27C31,MATCH(VLOOKUP(RC3,Sheet1!R2C2:R6C6,4,FALSE),Sheet1!R2C23:R2C31,FALSE),FALSE)&"|"&VLOOKUP(MOD(RC1,1000),Sheet1!R2C23:R27C31,MATCH(VLOOKUP(RC3,Sheet1!R2C2:R6C6,5,FALSE),Sheet1!R2C23:R2C31,FALSE),FALSE) -> 110|80 | W68: =IF(AND(RC[-18]="",RC[-8]=""),INT(RC[-22]/1000)*1000+302,"") ->  | X68: UI_taozhuang_chengse1 | Y68: 1
A69: 22407 | B69: 熔岩布靴 | C69: 2 | D69: 21 | E69: =RC[-4]-20000 -> 2407 | F69: 0 | I69: 300 | J69: 50 | K69: 4 | L69: 100000 | M69: 100 | N69: 40500 | O69: 407 | P69: 22407 | Q69: 【套装】融入了大量烈焰结晶的布靴，靠近就令人感觉到灼热。 | R69: =VLOOKUP(RC3,Sheet1!R2C2:R6C6,2,FALSE)&"|"&VLOOKUP(MOD(RC1,1000),Sheet1!R2C9:R27C13,MATCH(VLOOKUP(RC3,Sheet1!R2C2:R6C6,2,FALSE),Sheet1!R2C9:R2C13,FALSE),FALSE)+VLOOKUP(MOD(RC1,1000),Sheet1!R2C16:R27C20,MATCH(VLOOKUP(RC3,Sheet1!R2C2:R6C6,3,FALSE),Sheet1!R2C16:R2C20,FALSE),FALSE) -> 3|601 | S69: =VLOOKUP(MOD(RC1,1000),Sheet1!R2C16:R27C20,MATCH(VLOOKUP(RC3,Sheet1!R2C2:R6C6,3,FALSE),Sheet1!R2C16:R2C20,FALSE),FALSE) -> 26 | T69: =VLOOKUP(RC3,Sheet1!R2C2:R6C6,4,FALSE)&"|"&VLOOKUP(RC3,Sheet1!R2C2:R6C6,5,FALSE) -> 3|12 | U69: =VLOOKUP(MOD(RC1,1000),Sheet1!R2C23:R27C31,MATCH(VLOOKUP(RC3,Sheet1!R2C2:R6C6,4,FALSE),Sheet1!R2C23:R2C31,FALSE),FALSE)&"|"&VLOOKUP(MOD(RC1,1000),Sheet1!R2C23:R27C31,MATCH(VLOOKUP(RC3,Sheet1!R2C2:R6C6,5,FALSE),Sheet1!R2C23:R2C31,FALSE),FALSE) -> 115|80 | W69: =IF(AND(RC[-18]="",RC[-8]=""),INT(RC[-22]/1000)*1000+302,"") ->  | X69: UI_taozhuang_chengse1 | Y69: 1
A70: 22408 | B70: 苍鹰长靴 | C70: 2 | D70: 20 | E70: =RC[-4]-20000 -> 2408 | F70: 0 | I70: 300 | J70: 50 | K70: 4 | L70: 100000 | M70: 100 | N70: 39000 | O70: 408 | P70: 22408 | Q70: 【套装】禁锢着苍鹰之魂的长靴，令穿戴者的奔驰如乘风而行。 | R70: =VLOOKUP(RC3,Sheet1!R2C2:R6C6,2,FALSE)&"|"&VLOOKUP(MOD(RC1,1000),Sheet1!R2C9:R27C13,MATCH(VLOOKUP(RC3,Sheet1!R2C2:R6C6,2,FALSE),Sheet1!R2C9:R2C13,FALSE),FALSE)+VLOOKUP(MOD(RC1,1000),Sheet1!R2C16:R27C20,MATCH(VLOOKUP(RC3,Sheet1!R2C2:R6C6,3,FALSE),Sheet1!R2C16:R2C20,FALSE),FALSE) -> 3|569 | S70: =VLOOKUP(MOD(RC1,1000),Sheet1!R2C16:R27C20,MATCH(VLOOKUP(RC3,Sheet1!R2C2:R6C6,3,FALSE),Sheet1!R2C16:R2C20,FALSE),FALSE) -> 24 | T70: =VLOOKUP(RC3,Sheet1!R2C2:R6C6,4,FALSE)&"|"&VLOOKUP(RC3,Sheet1!R2C2:R6C6,5,FALSE) -> 3|12 | U70: =VLOOKUP(MOD(RC1,1000),Sheet1!R2C23:R27C31,MATCH(VLOOKUP(RC3,Sheet1!R2C2:R6C6,4,FALSE),Sheet1!R2C23:R2C31,FALSE),FALSE)&"|"&VLOOKUP(MOD(RC1,1000),Sheet1!R2C23:R27C31,MATCH(VLOOKUP(RC3,Sheet1!R2C2:R6C6,5,FALSE),Sheet1!R2C23:R2C31,FALSE),FALSE) -> 110|80 | X70: UI_taozhuang_chengse1 | Y70: 1
A71: 22501 | B71: 贯穿苍穹 | C71: 2 | D71: 32 | E71: =RC[-4]-20000 -> 2501 | F71: 0 | G71: 5 | H71: 11503 | I71: 300 | J71: 50 | K71: 5 | L71: 1000000 | M71: 100 | N71: 80000 | P71: 22501 | Q71: “它的速度足以贯穿苍穹，我觉得这个说法一点都不夸张。” | R71: =VLOOKUP(RC3,Sheet1!R2C2:R6C6,2,FALSE)&"|"&VLOOKUP(MOD(RC1,1000),Sheet1!R2C9:R27C13,MATCH(VLOOKUP(RC3,Sheet1!R2C2:R6C6,2,FALSE),Sheet1!R2C9:R2C13,FALSE),FALSE)+VLOOKUP(MOD(RC1,1000),Sheet1!R2C16:R27C20,MATCH(VLOOKUP(RC3,Sheet1!R2C2:R6C6,3,FALSE),Sheet1!R2C16:R2C20,FALSE),FALSE) -> 3|953 | S71: =VLOOKUP(MOD(RC1,1000),Sheet1!R2C16:R27C20,MATCH(VLOOKUP(RC3,Sheet1!R2C2:R6C6,3,FALSE),Sheet1!R2C16:R2C20,FALSE),FALSE) -> 48 | T71: =VLOOKUP(RC3,Sheet1!R2C2:R6C6,4,FALSE)&"|"&VLOOKUP(RC3,Sheet1!R2C2:R6C6,5,FALSE) -> 3|12 | U71: =VLOOKUP(MOD(RC1,1000),Sheet1!R2C23:R27C31,MATCH(VLOOKUP(RC3,Sheet1!R2C2:R6C6,4,FALSE),Sheet1!R2C23:R2C31,FALSE),FALSE)&"|"&VLOOKUP(MOD(RC1,1000),Sheet1!R2C23:R27C31,MATCH(VLOOKUP(RC3,Sheet1!R2C2:R6C6,5,FALSE),Sheet1!R2C23:R2C31,FALSE),FALSE) -> 150|80 | W71: =IF(AND(RC[-18]="",RC[-8]=""),INT(RC[-22]/1000)*1000+302,"") ->  | Y71: 1
A72: 22502 | B72: 永恒时空 | C72: 2 | D72: 36 | E72: =RC[-4]-20000 -> 2502 | F72: 0 | G72: 5 | H72: 11507 | I72: 300 | J72: 50 | K72: 5 | L72: 1000000 | M72: 100 | N72: 100000 | O72: 502 | P72: 22502 | Q72: 【套装】传说穿着它的人可以踏碎时空，当然这仅仅是传说。 | R72: =VLOOKUP(RC3,Sheet1!R2C2:R6C6,2,FALSE)&"|"&VLOOKUP(MOD(RC1,1000),Sheet1!R2C9:R27C13,MATCH(VLOOKUP(RC3,Sheet1!R2C2:R6C6,2,FALSE),Sheet1!R2C9:R2C13,FALSE),FALSE)+VLOOKUP(MOD(RC1,1000),Sheet1!R2C16:R27C20,MATCH(VLOOKUP(RC3,Sheet1!R2C2:R6C6,3,FALSE),Sheet1!R2C16:R2C20,FALSE),FALSE) -> 3|1074 | S72: =VLOOKUP(MOD(RC1,1000),Sheet1!R2C16:R27C20,MATCH(VLOOKUP(RC3,Sheet1!R2C2:R6C6,3,FALSE),Sheet1!R2C16:R2C20,FALSE),FALSE) -> 54 | T72: =VLOOKUP(RC3,Sheet1!R2C2:R6C6,4,FALSE)&"|"&VLOOKUP(RC3,Sheet1!R2C2:R6C6,5,FALSE) -> 3|12 | U72: =VLOOKUP(MOD(RC1,1000),Sheet1!R2C23:R27C31,MATCH(VLOOKUP(RC3,Sheet1!R2C2:R6C6,4,FALSE),Sheet1!R2C23:R2C31,FALSE),FALSE)&"|"&VLOOKUP(MOD(RC1,1000),Sheet1!R2C23:R27C31,MATCH(VLOOKUP(RC3,Sheet1!R2C2:R6C6,5,FALSE),Sheet1!R2C23:R2C31,FALSE),FALSE) -> 170|80 | W72: =IF(AND(RC[-18]="",RC[-8]=""),INT(RC[-22]/1000)*1000+302,"") ->  | X72: UI_taozhuang_hongse1 | Y72: 1
A73: 22503 | B73: 巨擘践踏 | C73: 2 | D73: 32 | E73: =RC[-4]-20000 -> 2503 | F73: 0 | G73: 5 | H73: 11511 | I73: 300 | J73: 50 | K73: 5 | L73: 1000000 | M73: 100 | N73: 80000 | O73: 503 | P73: 22403 | Q73: 【套装】融入了上古巨像头领的一部分核心，拥有震撼大地的能力。 | R73: =VLOOKUP(RC3,Sheet1!R2C2:R6C6,2,FALSE)&"|"&VLOOKUP(MOD(RC1,1000),Sheet1!R2C9:R27C13,MATCH(VLOOKUP(RC3,Sheet1!R2C2:R6C6,2,FALSE),Sheet1!R2C9:R2C13,FALSE),FALSE)+VLOOKUP(MOD(RC1,1000),Sheet1!R2C16:R27C20,MATCH(VLOOKUP(RC3,Sheet1!R2C2:R6C6,3,FALSE),Sheet1!R2C16:R2C20,FALSE),FALSE) -> 3|953 | S73: =VLOOKUP(MOD(RC1,1000),Sheet1!R2C16:R27C20,MATCH(VLOOKUP(RC3,Sheet1!R2C2:R6C6,3,FALSE),Sheet1!R2C16:R2C20,FALSE),FALSE) -> 48 | T73: =VLOOKUP(RC3,Sheet1!R2C2:R6C6,4,FALSE)&"|"&VLOOKUP(RC3,Sheet1!R2C2:R6C6,5,FALSE) -> 3|12 | U73: =VLOOKUP(MOD(RC1,1000),Sheet1!R2C23:R27C31,MATCH(VLOOKUP(RC3,Sheet1!R2C2:R6C6,4,FALSE),Sheet1!R2C23:R2C31,FALSE),FALSE)&"|"&VLOOKUP(MOD(RC1,1000),Sheet1!R2C23:R27C31,MATCH(VLOOKUP(RC3,Sheet1!R2C2:R6C6,5,FALSE),Sheet1!R2C23:R2C31,FALSE),FALSE) -> 150|80 | W73: =IF(AND(RC[-18]="",RC[-8]=""),INT(RC[-22]/1000)*1000+302,"") ->  | X73: UI_taozhuang_hongse1 | Y73: 1
A74: 22504 | B74: 禁锢领域 | C74: 2 | D74: 34 | E74: =RC[-4]-20000 -> 2504 | F74: 0 | G74: 5 | H74: 11515 | I74: 300 | J74: 50 | K74: 5 | L74: 1000000 | M74: 100 | N74: 90000 | O74: 504 | P74: 22404 | Q74: 【套装】作为一个无情的杀手，怎么可能让目标从眼前消失呢。 | R74: =VLOOKUP(RC3,Sheet1!R2C2:R6C6,2,FALSE)&"|"&VLOOKUP(MOD(RC1,1000),Sheet1!R2C9:R27C13,MATCH(VLOOKUP(RC3,Sheet1!R2C2:R6C6,2,FALSE),Sheet1!R2C9:R2C13,FALSE),FALSE)+VLOOKUP(MOD(RC1,1000),Sheet1!R2C16:R27C20,MATCH(VLOOKUP(RC3,Sheet1!R2C2:R6C6,3,FALSE),Sheet1!R2C16:R2C20,FALSE),FALSE) -> 3|1016 | S74: =VLOOKUP(MOD(RC1,1000),Sheet1!R2C16:R27C20,MATCH(VLOOKUP(RC3,Sheet1!R2C2:R6C6,3,FALSE),Sheet1!R2C16:R2C20,FALSE),FALSE) -> 51 | T74: =VLOOKUP(RC3,Sheet1!R2C2:R6C6,4,FALSE)&"|"&VLOOKUP(RC3,Sheet1!R2C2:R6C6,5,FALSE) -> 3|12 | U74: =VLOOKUP(MOD(RC1,1000),Sheet1!R2C23:R27C31,MATCH(VLOOKUP(RC3,Sheet1!R2C2:R6C6,4,FALSE),Sheet1!R2C23:R2C31,FALSE),FALSE)&"|"&VLOOKUP(MOD(RC1,1000),Sheet1!R2C23:R27C31,MATCH(VLOOKUP(RC3,Sheet1!R2C2:R6C6,5,FALSE),Sheet1!R2C23:R2C31,FALSE),FALSE) -> 160|80 | W74: =IF(AND(RC[-18]="",RC[-8]=""),INT(RC[-22]/1000)*1000+302,"") ->  | X74: UI_taozhuang_hongse1 | Y74: 1
A75: 22505 | B75: 盖亚能量 | C75: 2 | D75: 32 | E75: =RC[-4]-20000 -> 2505 | F75: 0 | G75: 5 | H75: 11519 | I75: 300 | J75: 50 | K75: 5 | L75: 1000000 | M75: 100 | N75: 80000 | O75: 505 | P75: 22405 | Q75: 【套装】她将万物之种撒播在土地上，浇灌以生命泉水，从此世间便孕育出了生命。 | R75: =VLOOKUP(RC3,Sheet1!R2C2:R6C6,2,FALSE)&"|"&VLOOKUP(MOD(RC1,1000),Sheet1!R2C9:R27C13,MATCH(VLOOKUP(RC3,Sheet1!R2C2:R6C6,2,FALSE),Sheet1!R2C9:R2C13,FALSE),FALSE)+VLOOKUP(MOD(RC1,1000),Sheet1!R2C16:R27C20,MATCH(VLOOKUP(RC3,Sheet1!R2C2:R6C6,3,FALSE),Sheet1!R2C16:R2C20,FALSE),FALSE) -> 3|953 | S75: =VLOOKUP(MOD(RC1,1000),Sheet1!R2C16:R27C20,MATCH(VLOOKUP(RC3,Sheet1!R2C2:R6C6,3,FALSE),Sheet1!R2C16:R2C20,FALSE),FALSE) -> 48 | T75: =VLOOKUP(RC3,Sheet1!R2C2:R6C6,4,FALSE)&"|"&VLOOKUP(RC3,Sheet1!R2C2:R6C6,5,FALSE) -> 3|12 | U75: =VLOOKUP(MOD(RC1,1000),Sheet1!R2C23:R27C31,MATCH(VLOOKUP(RC3,Sheet1!R2C2:R6C6,4,FALSE),Sheet1!R2C23:R2C31,FALSE),FALSE)&"|"&VLOOKUP(MOD(RC1,1000),Sheet1!R2C23:R27C31,MATCH(VLOOKUP(RC3,Sheet1!R2C2:R6C6,5,FALSE),Sheet1!R2C23:R2C31,FALSE),FALSE) -> 150|80 | X75: UI_taozhuang_hongse1 | Y75: 1
A76: 23101 | B76: 铁护腕 | C76: 3 | D76: 1 | F76: 0 | I76: 300 | J76: 50 | K76: 1 | L76: 100 | M76: 100 | N76: 50 | P76: 23101 | Q76: 用铁打造的护腕。 | R76: =VLOOKUP(RC3,Sheet1!R2C2:R6C6,2,FALSE)&"|"&VLOOKUP(MOD(RC1,1000),Sheet1!R2C9:R27C13,MATCH(VLOOKUP(RC3,Sheet1!R2C2:R6C6,2,FALSE),Sheet1!R2C9:R2C13,FALSE),FALSE)+VLOOKUP(MOD(RC1,1000),Sheet1!R2C16:R27C20,MATCH(VLOOKUP(RC3,Sheet1!R2C2:R6C6,3,FALSE),Sheet1!R2C16:R2C20,FALSE),FALSE) -> 4|720 | S76: =VLOOKUP(MOD(RC1,1000),Sheet1!R2C16:R27C20,MATCH(VLOOKUP(RC3,Sheet1!R2C2:R6C6,3,FALSE),Sheet1!R2C16:R2C20,FALSE),FALSE) -> 20 | T76: =VLOOKUP(RC3,Sheet1!R2C2:R6C6,4,FALSE)&"|"&VLOOKUP(RC3,Sheet1!R2C2:R6C6,5,FALSE) -> 4|14 | U76: =VLOOKUP(MOD(RC1,1000),Sheet1!R2C23:R27C31,MATCH(VLOOKUP(RC3,Sheet1!R2C2:R6C6,4,FALSE),Sheet1!R2C23:R2C31,FALSE),FALSE)&"|"&VLOOKUP(MOD(RC1,1000),Sheet1!R2C23:R27C31,MATCH(VLOOKUP(RC3,Sheet1!R2C2:R6C6,5,FALSE),Sheet1!R2C23:R2C31,FALSE),FALSE) -> 250|100 | V76: 26 | W76: =IF(AND(RC[-18]="",RC[-8]=""),INT(RC[-22]/1000)*1000+302,"") -> 23302 | Y76: 1
A77: 23102 | B77: 精致护腕 | C77: 3 | D77: 2 | F77: 0 | I77: 300 | J77: 50 | K77: 1 | L77: 100 | M77: 100 | N77: 60 | O77: 101 | P77: 23102 | Q77: 【套装】精致的护腕，一般是作为军队用品。 | R77: =VLOOKUP(RC3,Sheet1!R2C2:R6C6,2,FALSE)&"|"&VLOOKUP(MOD(RC1,1000),Sheet1!R2C9:R27C13,MATCH(VLOOKUP(RC3,Sheet1!R2C2:R6C6,2,FALSE),Sheet1!R2C9:R2C13,FALSE),FALSE)+VLOOKUP(MOD(RC1,1000),Sheet1!R2C16:R27C20,MATCH(VLOOKUP(RC3,Sheet1!R2C2:R6C6,3,FALSE),Sheet1!R2C16:R2C20,FALSE),FALSE) -> 4|720 | S77: =VLOOKUP(MOD(RC1,1000),Sheet1!R2C16:R27C20,MATCH(VLOOKUP(RC3,Sheet1!R2C2:R6C6,3,FALSE),Sheet1!R2C16:R2C20,FALSE),FALSE) -> 20 | T77: =VLOOKUP(RC3,Sheet1!R2C2:R6C6,4,FALSE)&"|"&VLOOKUP(RC3,Sheet1!R2C2:R6C6,5,FALSE) -> 4|14 | U77: =VLOOKUP(MOD(RC1,1000),Sheet1!R2C23:R27C31,MATCH(VLOOKUP(RC3,Sheet1!R2C2:R6C6,4,FALSE),Sheet1!R2C23:R2C31,FALSE),FALSE)&"|"&VLOOKUP(MOD(RC1,1000),Sheet1!R2C23:R27C31,MATCH(VLOOKUP(RC3,Sheet1!R2C2:R6C6,5,FALSE),Sheet1!R2C23:R2C31,FALSE),FALSE) -> 250|100 | V77: 33 | W77: =IF(AND(RC[-18]="",RC[-8]=""),INT(RC[-22]/1000)*1000+302,"") ->  | X77: UI_taozhuang_lvse | Y77: 1
A78: 23201 | B78: 铜纹护腕 | C78: 3 | D78: 4 | F78: 0 | I78: 300 | J78: 50 | K78: 2 | L78: 1000 | M78: 100 | N78: 900 | P78: 23201 | Q78: 特制金属打造的护腕，泛着一抹蓝光。 | R78: =VLOOKUP(RC3,Sheet1!R2C2:R6C6,2,FALSE)&"|"&VLOOKUP(MOD(RC1,1000),Sheet1!R2C9:R27C13,MATCH(VLOOKUP(RC3,Sheet1!R2C2:R6C6,2,FALSE),Sheet1!R2C9:R2C13,FALSE),FALSE)+VLOOKUP(MOD(RC1,1000),Sheet1!R2C16:R27C20,MATCH(VLOOKUP(RC3,Sheet1!R2C2:R6C6,3,FALSE),Sheet1!R2C16:R2C20,FALSE),FALSE) -> 4|1490 | S78: =VLOOKUP(MOD(RC1,1000),Sheet1!R2C16:R27C20,MATCH(VLOOKUP(RC3,Sheet1!R2C2:R6C6,3,FALSE),Sheet1!R2C16:R2C20,FALSE),FALSE) -> 40 | T78: =VLOOKUP(RC3,Sheet1!R2C2:R6C6,4,FALSE)&"|"&VLOOKUP(RC3,Sheet1!R2C2:R6C6,5,FALSE) -> 4|14 | U78: =VLOOKUP(MOD(RC1,1000),Sheet1!R2C23:R27C31,MATCH(VLOOKUP(RC3,Sheet1!R2C2:R6C6,4,FALSE),Sheet1!R2C23:R2C31,FALSE),FALSE)&"|"&VLOOKUP(MOD(RC1,1000),Sheet1!R2C23:R27C31,MATCH(VLOOKUP(RC3,Sheet1!R2C2:R6C6,5,FALSE),Sheet1!R2C23:R2C31,FALSE),FALSE) -> 400|100 | W78: =IF(AND(RC[-18]="",RC[-8]=""),INT(RC[-22]/1000)*1000+302,"") -> 23302 | Y78: 1
A79: 23202 | B79: 骑士护腕 | C79: 3 | D79: 5 | F79: 0 | I79: 300 | J79: 50 | K79: 2 | L79: 1000 | M79: 100 | N79: 1200 | O79: 202 | P79: 23202 | Q79: 【套装】骑士的制式装备之一，在马上战斗时可以有效保护自己。 | R79: =VLOOKUP(RC3,Sheet1!R2C2:R6C6,2,FALSE)&"|"&VLOOKUP(MOD(RC1,1000),Sheet1!R2C9:R27C13,MATCH(VLOOKUP(RC3,Sheet1!R2C2:R6C6,2,FALSE),Sheet1!R2C9:R2C13,FALSE),FALSE)+VLOOKUP(MOD(RC1,1000),Sheet1!R2C16:R27C20,MATCH(VLOOKUP(RC3,Sheet1!R2C2:R6C6,3,FALSE),Sheet1!R2C16:R2C20,FALSE),FALSE) -> 4|1850 | S79: =VLOOKUP(MOD(RC1,1000),Sheet1!R2C16:R27C20,MATCH(VLOOKUP(RC3,Sheet1!R2C2:R6C6,3,FALSE),Sheet1!R2C16:R2C20,FALSE),FALSE) -> 50 | T79: =VLOOKUP(RC3,Sheet1!R2C2:R6C6,4,FALSE)&"|"&VLOOKUP(RC3,Sheet1!R2C2:R6C6,5,FALSE) -> 4|14 | U79: =VLOOKUP(MOD(RC1,1000),Sheet1!R2C23:R27C31,MATCH(VLOOKUP(RC3,Sheet1!R2C2:R6C6,4,FALSE),Sheet1!R2C23:R2C31,FALSE),FALSE)&"|"&VLOOKUP(MOD(RC1,1000),Sheet1!R2C23:R27C31,MATCH(VLOOKUP(RC3,Sheet1!R2C2:R6C6,5,FALSE),Sheet1!R2C23:R2C31,FALSE),FALSE) -> 500|100 | W79: =IF(AND(RC[-18]="",RC[-8]=""),INT(RC[-22]/1000)*1000+302,"") ->  | X79: UI_taozhuang_lanse | Y79: 1
A80: 23301 | B80: 正义护腕 | C80: 3 | D80: 10 | F80: 0 | I80: 300 | J80: 50 | K80: 3 | L80: 10000 | M80: 100 | N80: 6000 | P80: 23301 | Q80: 经过圣光洗礼的护腕，备受善良阵营生命的喜爱。 | R80: =VLOOKUP(RC3,Sheet1!R2C2:R6C6,2,FALSE)&"|"&VLOOKUP(MOD(RC1,1000),Sheet1!R2C9:R27C13,MATCH(VLOOKUP(RC3,Sheet1!R2C2:R6C6,2,FALSE),Sheet1!R2C9:R2C13,FALSE),FALSE)+VLOOKUP(MOD(RC1,1000),Sheet1!R2C16:R27C20,MATCH(VLOOKUP(RC3,Sheet1!R2C2:R6C6,3,FALSE),Sheet1!R2C16:R2C20,FALSE),FALSE) -> 4|2960 | S80: =VLOOKUP(MOD(RC1,1000),Sheet1!R2C16:R27C20,MATCH(VLOOKUP(RC3,Sheet1!R2C2:R6C6,3,FALSE),Sheet1!R2C16:R2C20,FALSE),FALSE) -> 110 | T80: =VLOOKUP(RC3,Sheet1!R2C2:R6C6,4,FALSE)&"|"&VLOOKUP(RC3,Sheet1!R2C2:R6C6,5,FALSE) -> 4|14 | U80: =VLOOKUP(MOD(RC1,1000),Sheet1!R2C23:R27C31,MATCH(VLOOKUP(RC3,Sheet1!R2C2:R6C6,4,FALSE),Sheet1!R2C23:R2C31,FALSE),FALSE)&"|"&VLOOKUP(MOD(RC1,1000),Sheet1!R2C23:R27C31,MATCH(VLOOKUP(RC3,Sheet1!R2C2:R6C6,5,FALSE),Sheet1!R2C23:R2C31,FALSE),FALSE) -> 700|100 | W80: =IF(AND(RC[-18]="",RC[-8]=""),INT(RC[-22]/1000)*1000+302,"") -> 23302 | Y80: 1
A81: 23302 | B81: 咆哮护腕 | C81: 3 | D81: 11 | E81: =RC[-4]-20000 -> 3302 | F81: 0 | I81: 300 | J81: 50 | K81: 3 | L81: 10000 | M81: 100 | N81: 10000 | P81: 23302 | Q81: 传闻咆哮护腕中灌注了黄金狮子的灵魂，挥舞间可以听到咆哮声。 | R81: =VLOOKUP(RC3,Sheet1!R2C2:R6C6,2,FALSE)&"|"&VLOOKUP(MOD(RC1,1000),Sheet1!R2C9:R27C13,MATCH(VLOOKUP(RC3,Sheet1!R2C2:R6C6,2,FALSE),Sheet1!R2C9:R2C13,FALSE),FALSE)+VLOOKUP(MOD(RC1,1000),Sheet1!R2C16:R27C20,MATCH(VLOOKUP(RC3,Sheet1!R2C2:R6C6,3,FALSE),Sheet1!R2C16:R2C20,FALSE),FALSE) -> 4|3220 | S81: =VLOOKUP(MOD(RC1,1000),Sheet1!R2C16:R27C20,MATCH(VLOOKUP(RC3,Sheet1!R2C2:R6C6,3,FALSE),Sheet1!R2C16:R2C20,FALSE),FALSE) -> 120 | T81: =VLOOKUP(RC3,Sheet1!R2C2:R6C6,4,FALSE)&"|"&VLOOKUP(RC3,Sheet1!R2C2:R6C6,5,FALSE) -> 4|14 | U81: =VLOOKUP(MOD(RC1,1000),Sheet1!R2C23:R27C31,MATCH(VLOOKUP(RC3,Sheet1!R2C2:R6C6,4,FALSE),Sheet1!R2C23:R2C31,FALSE),FALSE)&"|"&VLOOKUP(MOD(RC1,1000),Sheet1!R2C23:R27C31,MATCH(VLOOKUP(RC3,Sheet1!R2C2:R6C6,5,FALSE),Sheet1!R2C23:R2C31,FALSE),FALSE) -> 750|100 | W81: =IF(AND(RC[-18]="",RC[-8]=""),INT(RC[-22]/1000)*1000+302,"") ->  | X81: UI_zhuangbei_xingxing | Y81: 1
A82: 23303 | B82: 荣耀护腕 | C82: 3 | D82: 12 | E82: =RC[-4]-20000 -> 3303 | F82: 23406 | I82: 300 | J82: 50 | K82: 3 | L82: 10000 | M82: 100 | N82: 12000 | O82: 303 | P82: 23303 | Q82: 【套装】【可改造】象征荣耀的护腕，给人以一往直前，永不停歇的力量。 | R82: =VLOOKUP(RC3,Sheet1!R2C2:R6C6,2,FALSE)&"|"&VLOOKUP(MOD(RC1,1000),Sheet1!R2C9:R27C13,MATCH(VLOOKUP(RC3,Sheet1!R2C2:R6C6,2,FALSE),Sheet1!R2C9:R2C13,FALSE),FALSE)+VLOOKUP(MOD(RC1,1000),Sheet1!R2C16:R27C20,MATCH(VLOOKUP(RC3,Sheet1!R2C2:R6C6,3,FALSE),Sheet1!R2C16:R2C20,FALSE),FALSE) -> 4|3530 | S82: =VLOOKUP(MOD(RC1,1000),Sheet1!R2C16:R27C20,MATCH(VLOOKUP(RC3,Sheet1!R2C2:R6C6,3,FALSE),Sheet1!R2C16:R2C20,FALSE),FALSE) -> 130 | T82: =VLOOKUP(RC3,Sheet1!R2C2:R6C6,4,FALSE)&"|"&VLOOKUP(RC3,Sheet1!R2C2:R6C6,5,FALSE) -> 4|14 | U82: =VLOOKUP(MOD(RC1,1000),Sheet1!R2C23:R27C31,MATCH(VLOOKUP(RC3,Sheet1!R2C2:R6C6,4,FALSE),Sheet1!R2C23:R2C31,FALSE),FALSE)&"|"&VLOOKUP(MOD(RC1,1000),Sheet1!R2C23:R27C31,MATCH(VLOOKUP(RC3,Sheet1!R2C2:R6C6,5,FALSE),Sheet1!R2C23:R2C31,FALSE),FALSE) -> 850|100 | W82: =IF(AND(RC[-18]="",RC[-8]=""),INT(RC[-22]/1000)*1000+302,"") ->  | X82: UI_taozhuang_zise1 | Y82: 1
A83: 23304 | B83: 烈焰护腕 | C83: 3 | D83: 13 | E83: =RC[-4]-20000 -> 3304 | F83: 23407 | I83: 300 | J83: 50 | K83: 3 | L83: 10000 | M83: 100 | N83: 13000 | O83: 304 | P83: 23304 | Q83: 【套装】【可改造】融入了烈焰结晶粉末的护腕，靠近就令人感觉到灼热。 | R83: =VLOOKUP(RC3,Sheet1!R2C2:R6C6,2,FALSE)&"|"&VLOOKUP(MOD(RC1,1000),Sheet1!R2C9:R27C13,MATCH(VLOOKUP(RC3,Sheet1!R2C2:R6C6,2,FALSE),Sheet1!R2C9:R2C13,FALSE),FALSE)+VLOOKUP(MOD(RC1,1000),Sheet1!R2C16:R27C20,MATCH(VLOOKUP(RC3,Sheet1!R2C2:R6C6,3,FALSE),Sheet1!R2C16:R2C20,FALSE),FALSE) -> 4|3840 | S83: =VLOOKUP(MOD(RC1,1000),Sheet1!R2C16:R27C20,MATCH(VLOOKUP(RC3,Sheet1!R2C2:R6C6,3,FALSE),Sheet1!R2C16:R2C20,FALSE),FALSE) -> 140 | T83: =VLOOKUP(RC3,Sheet1!R2C2:R6C6,4,FALSE)&"|"&VLOOKUP(RC3,Sheet1!R2C2:R6C6,5,FALSE) -> 4|14 | U83: =VLOOKUP(MOD(RC1,1000),Sheet1!R2C23:R27C31,MATCH(VLOOKUP(RC3,Sheet1!R2C2:R6C6,4,FALSE),Sheet1!R2C23:R2C31,FALSE),FALSE)&"|"&VLOOKUP(MOD(RC1,1000),Sheet1!R2C23:R27C31,MATCH(VLOOKUP(RC3,Sheet1!R2C2:R6C6,5,FALSE),Sheet1!R2C23:R2C31,FALSE),FALSE) -> 900|100 | W83: =IF(AND(RC[-18]="",RC[-8]=""),INT(RC[-22]/1000)*1000+302,"") ->  | X83: UI_taozhuang_zise1 | Y83: 1
A84: 23305 | B84: 青鸟护腕 | C84: 3 | D84: 12 | E84: =RC[-4]-20000 -> 3305 | F84: 23408 | I84: 300 | J84: 50 | K84: 3 | L84: 10000 | M84: 100 | N84: 12000 | O84: 305 | P84: 23305 | Q84: 【套装】【可改造】囚禁了青鸟之魂的护腕，穿戴者拥有操纵风暴的力量。 | R84: =VLOOKUP(RC3,Sheet1!R2C2:R6C6,2,FALSE)&"|"&VLOOKUP(MOD(RC1,1000),Sheet1!R2C9:R27C13,MATCH(VLOOKUP(RC3,Sheet1!R2C2:R6C6,2,FALSE),Sheet1!R2C9:R2C13,FALSE),FALSE)+VLOOKUP(MOD(RC1,1000),Sheet1!R2C16:R27C20,MATCH(VLOOKUP(RC3,Sheet1!R2C2:R6C6,3,FALSE),Sheet1!R2C16:R2C20,FALSE),FALSE) -> 4|3530 | S84: =VLOOKUP(MOD(RC1,1000),Sheet1!R2C16:R27C20,MATCH(VLOOKUP(RC3,Sheet1!R2C2:R6C6,3,FALSE),Sheet1!R2C16:R2C20,FALSE),FALSE) -> 130 | T84: =VLOOKUP(RC3,Sheet1!R2C2:R6C6,4,FALSE)&"|"&VLOOKUP(RC3,Sheet1!R2C2:R6C6,5,FALSE) -> 4|14 | U84: =VLOOKUP(MOD(RC1,1000),Sheet1!R2C23:R27C31,MATCH(VLOOKUP(RC3,Sheet1!R2C2:R6C6,4,FALSE),Sheet1!R2C23:R2C31,FALSE),FALSE)&"|"&VLOOKUP(MOD(RC1,1000),Sheet1!R2C23:R27C31,MATCH(VLOOKUP(RC3,Sheet1!R2C2:R6C6,5,FALSE),Sheet1!R2C23:R2C31,FALSE),FALSE) -> 850|100 | X84: UI_taozhuang_zise1 | Y84: 1
A85: 23401 | B85: 超凡之手 | C85: 3 | D85: 18 | E85: =RC[-4]-20000 -> 3401 | F85: 0 | I85: 300 | J85: 50 | K85: 4 | L85: 100000 | M85: 100 | N85: 24600 | P85: 23401 | Q85: 装备超凡之手的人会拥有更灵敏的感知，可以避免许多伤害。 | R85: =VLOOKUP(RC3,Sheet1!R2C2:R6C6,2,FALSE)&"|"&VLOOKUP(MOD(RC1,1000),Sheet1!R2C9:R27C13,MATCH(VLOOKUP(RC3,Sheet1!R2C2:R6C6,2,FALSE),Sheet1!R2C9:R2C13,FALSE),FALSE)+VLOOKUP(MOD(RC1,1000),Sheet1!R2C16:R27C20,MATCH(VLOOKUP(RC3,Sheet1!R2C2:R6C6,3,FALSE),Sheet1!R2C16:R2C20,FALSE),FALSE) -> 4|5120 | S85: =VLOOKUP(MOD(RC1,1000),Sheet1!R2C16:R27C20,MATCH(VLOOKUP(RC3,Sheet1!R2C2:R6C6,3,FALSE),Sheet1!R2C16:R2C20,FALSE),FALSE) -> 220 | T85: =VLOOKUP(RC3,Sheet1!R2C2:R6C6,4,FALSE)&"|"&VLOOKUP(RC3,Sheet1!R2C2:R6C6,5,FALSE) -> 4|14 | U85: =VLOOKUP(MOD(RC1,1000),Sheet1!R2C23:R27C31,MATCH(VLOOKUP(RC3,Sheet1!R2C2:R6C6,4,FALSE),Sheet1!R2C23:R2C31,FALSE),FALSE)&"|"&VLOOKUP(MOD(RC1,1000),Sheet1!R2C23:R27C31,MATCH(VLOOKUP(RC3,Sheet1!R2C2:R6C6,5,FALSE),Sheet1!R2C23:R2C31,FALSE),FALSE) -> 1000|100 | W85: =IF(AND(RC[-18]="",RC[-8]=""),INT(RC[-22]/1000)*1000+302,"") ->  | Y85: 1
A86: 23402 | B86: 燃烧之触 | C86: 3 | D86: 20 | E86: =RC[-4]-20000 -> 3402 | F86: 0 | I86: 300 | J86: 50 | K86: 4 | L86: 100000 | M86: 100 | N86: 33000 | P86: 23402 | Q86: 仿佛燃烧着的护腕，所以接触到你的手臂的敌人都将被烧伤。 | R86: =VLOOKUP(RC3,Sheet1!R2C2:R6C6,2,FALSE)&"|"&VLOOKUP(MOD(RC1,1000),Sheet1!R2C9:R27C13,MATCH(VLOOKUP(RC3,Sheet1!R2C2:R6C6,2,FALSE),Sheet1!R2C9:R2C13,FALSE),FALSE)+VLOOKUP(MOD(RC1,1000),Sheet1!R2C16:R27C20,MATCH(VLOOKUP(RC3,Sheet1!R2C2:R6C6,3,FALSE),Sheet1!R2C16:R2C20,FALSE),FALSE) -> 4|5690 | S86: =VLOOKUP(MOD(RC1,1000),Sheet1!R2C16:R27C20,MATCH(VLOOKUP(RC3,Sheet1!R2C2:R6C6,3,FALSE),Sheet1!R2C16:R2C20,FALSE),FALSE) -> 240 | T86: =VLOOKUP(RC3,Sheet1!R2C2:R6C6,4,FALSE)&"|"&VLOOKUP(RC3,Sheet1!R2C2:R6C6,5,FALSE) -> 4|14 | U86: =VLOOKUP(MOD(RC1,1000),Sheet1!R2C23:R27C31,MATCH(VLOOKUP(RC3,Sheet1!R2C2:R6C6,4,FALSE),Sheet1!R2C23:R2C31,FALSE),FALSE)&"|"&VLOOKUP(MOD(RC1,1000),Sheet1!R2C23:R27C31,MATCH(VLOOKUP(RC3,Sheet1!R2C2:R6C6,5,FALSE),Sheet1!R2C23:R2C31,FALSE),FALSE) -> 1100|100 | W86: =IF(AND(RC[-18]="",RC[-8]=""),INT(RC[-22]/1000)*1000+302,"") ->  | X86: UI_zhuangbei_xingxing | Y86: 1
A87: 23403 | B87: 巨像崩山 | C87: 3 | D87: 22 | E87: =RC[-4]-20000 -> 3403 | F87: 23503 | I87: 300 | J87: 50 | K87: 4 | L87: 100000 | M87: 100 | N87: 42000 | O87: 403 | P87: 23403 | Q87: 【套装】【可改造】融入了远古苍蓝巨像的一部分核心，拥有崩坏山岳的能力。 | R87: =VLOOKUP(RC3,Sheet1!R2C2:R6C6,2,FALSE)&"|"&VLOOKUP(MOD(RC1,1000),Sheet1!R2C9:R27C13,MATCH(VLOOKUP(RC3,Sheet1!R2C2:R6C6,2,FALSE),Sheet1!R2C9:R2C13,FALSE),FALSE)+VLOOKUP(MOD(RC1,1000),Sheet1!R2C16:R27C20,MATCH(VLOOKUP(RC3,Sheet1!R2C2:R6C6,3,FALSE),Sheet1!R2C16:R2C20,FALSE),FALSE) -> 4|6270 | S87: =VLOOKUP(MOD(RC1,1000),Sheet1!R2C16:R27C20,MATCH(VLOOKUP(RC3,Sheet1!R2C2:R6C6,3,FALSE),Sheet1!R2C16:R2C20,FALSE),FALSE) -> 270 | T87: =VLOOKUP(RC3,Sheet1!R2C2:R6C6,4,FALSE)&"|"&VLOOKUP(RC3,Sheet1!R2C2:R6C6,5,FALSE) -> 4|14 | U87: =VLOOKUP(MOD(RC1,1000),Sheet1!R2C23:R27C31,MATCH(VLOOKUP(RC3,Sheet1!R2C2:R6C6,4,FALSE),Sheet1!R2C23:R2C31,FALSE),FALSE)&"|"&VLOOKUP(MOD(RC1,1000),Sheet1!R2C23:R27C31,MATCH(VLOOKUP(RC3,Sheet1!R2C2:R6C6,5,FALSE),Sheet1!R2C23:R2C31,FALSE),FALSE) -> 1200|100 | W87: =IF(AND(RC[-18]="",RC[-8]=""),INT(RC[-22]/1000)*1000+302,"") ->  | X87: UI_taozhuang_chengse1 | Y87: 1
A88: 23404 | B88: 幽冥掌控 | C88: 3 | D88: 23 | E88: =RC[-4]-20000 -> 3404 | F88: 23504 | I88: 300 | J88: 50 | K88: 4 | L88: 100000 | M88: 100 | N88: 43500 | O88: 404 | P88: 23404 | Q88: 【套装】【可改造】它的拥有者曾经以杀戮掌控了整片幽冥之地。 | R88: =VLOOKUP(RC3,Sheet1!R2C2:R6C6,2,FALSE)&"|"&VLOOKUP(MOD(RC1,1000),Sheet1!R2C9:R27C13,MATCH(VLOOKUP(RC3,Sheet1!R2C2:R6C6,2,FALSE),Sheet1!R2C9:R2C13,FALSE),FALSE)+VLOOKUP(MOD(RC1,1000),Sheet1!R2C16:R27C20,MATCH(VLOOKUP(RC3,Sheet1!R2C2:R6C6,3,FALSE),Sheet1!R2C16:R2C20,FALSE),FALSE) -> 4|6580 | S88: =VLOOKUP(MOD(RC1,1000),Sheet1!R2C16:R27C20,MATCH(VLOOKUP(RC3,Sheet1!R2C2:R6C6,3,FALSE),Sheet1!R2C16:R2C20,FALSE),FALSE) -> 280 | T88: =VLOOKUP(RC3,Sheet1!R2C2:R6C6,4,FALSE)&"|"&VLOOKUP(RC3,Sheet1!R2C2:R6C6,5,FALSE) -> 4|14 | U88: =VLOOKUP(MOD(RC1,1000),Sheet1!R2C23:R27C31,MATCH(VLOOKUP(RC3,Sheet1!R2C2:R6C6,4,FALSE),Sheet1!R2C23:R2C31,FALSE),FALSE)&"|"&VLOOKUP(MOD(RC1,1000),Sheet1!R2C23:R27C31,MATCH(VLOOKUP(RC3,Sheet1!R2C2:R6C6,5,FALSE),Sheet1!R2C23:R2C31,FALSE),FALSE) -> 1250|100 | W88: =IF(AND(RC[-18]="",RC[-8]=""),INT(RC[-22]/1000)*1000+302,"") ->  | X88: UI_taozhuang_chengse1 | Y88: 1
A89: 23405 | B89: 大地庇护 | C89: 3 | D89: 22 | E89: =RC[-4]-20000 -> 3405 | F89: 23505 | I89: 300 | J89: 50 | K89: 4 | L89: 100000 | M89: 100 | N89: 42000 | O89: 405 | P89: 23405 | Q89: 【套装】【可改造】在大地的庇护之下，你将永不倒下。 | R89: =VLOOKUP(RC3,Sheet1!R2C2:R6C6,2,FALSE)&"|"&VLOOKUP(MOD(RC1,1000),Sheet1!R2C9:R27C13,MATCH(VLOOKUP(RC3,Sheet1!R2C2:R6C6,2,FALSE),Sheet1!R2C9:R2C13,FALSE),FALSE)+VLOOKUP(MOD(RC1,1000),Sheet1!R2C16:R27C20,MATCH(VLOOKUP(RC3,Sheet1!R2C2:R6C6,3,FALSE),Sheet1!R2C16:R2C20,FALSE),FALSE) -> 4|6270 | S89: =VLOOKUP(MOD(RC1,1000),Sheet1!R2C16:R27C20,MATCH(VLOOKUP(RC3,Sheet1!R2C2:R6C6,3,FALSE),Sheet1!R2C16:R2C20,FALSE),FALSE) -> 270 | T89: =VLOOKUP(RC3,Sheet1!R2C2:R6C6,4,FALSE)&"|"&VLOOKUP(RC3,Sheet1!R2C2:R6C6,5,FALSE) -> 4|14 | U89: =VLOOKUP(MOD(RC1,1000),Sheet1!R2C23:R27C31,MATCH(VLOOKUP(RC3,Sheet1!R2C2:R6C6,4,FALSE),Sheet1!R2C23:R2C31,FALSE),FALSE)&"|"&VLOOKUP(MOD(RC1,1000),Sheet1!R2C23:R27C31,MATCH(VLOOKUP(RC3,Sheet1!R2C2:R6C6,5,FALSE),Sheet1!R2C23:R2C31,FALSE),FALSE) -> 1200|100 | X89: UI_taozhuang_chengse1 | Y89: 1
A90: 23406 | B90: 圣光护臂 | C90: 3 | D90: 20 | E90: =RC[-4]-20000 -> 3406 | F90: 0 | I90: 300 | J90: 50 | K90: 4 | L90: 100000 | M90: 100 | N90: 39000 | O90: 406 | P90: 23303 | Q90: 【套装】散发浓郁圣光的护臂，给人以一往直前，永不停歇的力量。 | R90: =VLOOKUP(RC3,Sheet1!R2C2:R6C6,2,FALSE)&"|"&VLOOKUP(MOD(RC1,1000),Sheet1!R2C9:R27C13,MATCH(VLOOKUP(RC3,Sheet1!R2C2:R6C6,2,FALSE),Sheet1!R2C9:R2C13,FALSE),FALSE)+VLOOKUP(MOD(RC1,1000),Sheet1!R2C16:R27C20,MATCH(VLOOKUP(RC3,Sheet1!R2C2:R6C6,3,FALSE),Sheet1!R2C16:R2C20,FALSE),FALSE) -> 4|5690 | S90: =VLOOKUP(MOD(RC1,1000),Sheet1!R2C16:R27C20,MATCH(VLOOKUP(RC3,Sheet1!R2C2:R6C6,3,FALSE),Sheet1!R2C16:R2C20,FALSE),FALSE) -> 240 | T90: =VLOOKUP(RC3,Sheet1!R2C2:R6C6,4,FALSE)&"|"&VLOOKUP(RC3,Sheet1!R2C2:R6C6,5,FALSE) -> 4|14 | U90: =VLOOKUP(MOD(RC1,1000),Sheet1!R2C23:R27C31,MATCH(VLOOKUP(RC3,Sheet1!R2C2:R6C6,4,FALSE),Sheet1!R2C23:R2C31,FALSE),FALSE)&"|"&VLOOKUP(MOD(RC1,1000),Sheet1!R2C23:R27C31,MATCH(VLOOKUP(RC3,Sheet1!R2C2:R6C6,5,FALSE),Sheet1!R2C23:R2C31,FALSE),FALSE) -> 1100|100 | W90: =IF(AND(RC[-18]="",RC[-8]=""),INT(RC[-22]/1000)*1000+302,"") ->  | X90: UI_taozhuang_chengse1 | Y90: 1
A91: 23407 | B91: 熔岩护臂 | C91: 3 | D91: 21 | E91: =RC[-4]-20000 -> 3407 | F91: 0 | I91: 300 | J91: 50 | K91: 4 | L91: 100000 | M91: 100 | N91: 40500 | O91: 407 | P91: 23304 | Q91: 【套装】融入了大量烈焰结晶的护臂，靠近就令人感觉到灼热。 | R91: =VLOOKUP(RC3,Sheet1!R2C2:R6C6,2,FALSE)&"|"&VLOOKUP(MOD(RC1,1000),Sheet1!R2C9:R27C13,MATCH(VLOOKUP(RC3,Sheet1!R2C2:R6C6,2,FALSE),Sheet1!R2C9:R2C13,FALSE),FALSE)+VLOOKUP(MOD(RC1,1000),Sheet1!R2C16:R27C20,MATCH(VLOOKUP(RC3,Sheet1!R2C2:R6C6,3,FALSE),Sheet1!R2C16:R2C20,FALSE),FALSE) -> 4|6010 | S91: =VLOOKUP(MOD(RC1,1000),Sheet1!R2C16:R27C20,MATCH(VLOOKUP(RC3,Sheet1!R2C2:R6C6,3,FALSE),Sheet1!R2C16:R2C20,FALSE),FALSE) -> 260 | T91: =VLOOKUP(RC3,Sheet1!R2C2:R6C6,4,FALSE)&"|"&VLOOKUP(RC3,Sheet1!R2C2:R6C6,5,FALSE) -> 4|14 | U91: =VLOOKUP(MOD(RC1,1000),Sheet1!R2C23:R27C31,MATCH(VLOOKUP(RC3,Sheet1!R2C2:R6C6,4,FALSE),Sheet1!R2C23:R2C31,FALSE),FALSE)&"|"&VLOOKUP(MOD(RC1,1000),Sheet1!R2C23:R27C31,MATCH(VLOOKUP(RC3,Sheet1!R2C2:R6C6,5,FALSE),Sheet1!R2C23:R2C31,FALSE),FALSE) -> 1150|100 | W91: =IF(AND(RC[-18]="",RC[-8]=""),INT(RC[-22]/1000)*1000+302,"") ->  | X91: UI_taozhuang_chengse1 | Y91: 1
A92: 23408 | B92: 苍鹰护臂 | C92: 3 | D92: 20 | E92: =RC[-4]-20000 -> 3408 | F92: 0 | I92: 300 | J92: 50 | K92: 4 | L92: 100000 | M92: 100 | N92: 39000 | O92: 408 | P92: 23305 | Q92: 【套装】禁锢着苍鹰之魂的护臂，穿戴者拥有操纵风暴的力量。 | R92: =VLOOKUP(RC3,Sheet1!R2C2:R6C6,2,FALSE)&"|"&VLOOKUP(MOD(RC1,1000),Sheet1!R2C9:R27C13,MATCH(VLOOKUP(RC3,Sheet1!R2C2:R6C6,2,FALSE),Sheet1!R2C9:R2C13,FALSE),FALSE)+VLOOKUP(MOD(RC1,1000),Sheet1!R2C16:R27C20,MATCH(VLOOKUP(RC3,Sheet1!R2C2:R6C6,3,FALSE),Sheet1!R2C16:R2C20,FALSE),FALSE) -> 4|5690 | S92: =VLOOKUP(MOD(RC1,1000),Sheet1!R2C16:R27C20,MATCH(VLOOKUP(RC3,Sheet1!R2C2:R6C6,3,FALSE),Sheet1!R2C16:R2C20,FALSE),FALSE) -> 240 | T92: =VLOOKUP(RC3,Sheet1!R2C2:R6C6,4,FALSE)&"|"&VLOOKUP(RC3,Sheet1!R2C2:R6C6,5,FALSE) -> 4|14 | U92: =VLOOKUP(MOD(RC1,1000),Sheet1!R2C23:R27C31,MATCH(VLOOKUP(RC3,Sheet1!R2C2:R6C6,4,FALSE),Sheet1!R2C23:R2C31,FALSE),FALSE)&"|"&VLOOKUP(MOD(RC1,1000),Sheet1!R2C23:R27C31,MATCH(VLOOKUP(RC3,Sheet1!R2C2:R6C6,5,FALSE),Sheet1!R2C23:R2C31,FALSE),FALSE) -> 1100|100 | X92: UI_taozhuang_chengse1 | Y92: 1
A93: 23501 | B93: 苍白正义 | C93: 3 | D93: 32 | E93: =RC[-4]-20000 -> 3501 | F93: 0 | G93: 5 | H93: 11504 | I93: 300 | J93: 50 | K93: 5 | L93: 1000000 | M93: 100 | N93: 80000 | P93: 23501 | Q93: 正义是苍白的，是无力的，但只要坚立于此，便可以见到一切。 | R93: =VLOOKUP(RC3,Sheet1!R2C2:R6C6,2,FALSE)&"|"&VLOOKUP(MOD(RC1,1000),Sheet1!R2C9:R27C13,MATCH(VLOOKUP(RC3,Sheet1!R2C2:R6C6,2,FALSE),Sheet1!R2C9:R2C13,FALSE),FALSE)+VLOOKUP(MOD(RC1,1000),Sheet1!R2C16:R27C20,MATCH(VLOOKUP(RC3,Sheet1!R2C2:R6C6,3,FALSE),Sheet1!R2C16:R2C20,FALSE),FALSE) -> 4|9530 | S93: =VLOOKUP(MOD(RC1,1000),Sheet1!R2C16:R27C20,MATCH(VLOOKUP(RC3,Sheet1!R2C2:R6C6,3,FALSE),Sheet1!R2C16:R2C20,FALSE),FALSE) -> 480 | T93: =VLOOKUP(RC3,Sheet1!R2C2:R6C6,4,FALSE)&"|"&VLOOKUP(RC3,Sheet1!R2C2:R6C6,5,FALSE) -> 4|14 | U93: =VLOOKUP(MOD(RC1,1000),Sheet1!R2C23:R27C31,MATCH(VLOOKUP(RC3,Sheet1!R2C2:R6C6,4,FALSE),Sheet1!R2C23:R2C31,FALSE),FALSE)&"|"&VLOOKUP(MOD(RC1,1000),Sheet1!R2C23:R27C31,MATCH(VLOOKUP(RC3,Sheet1!R2C2:R6C6,5,FALSE),Sheet1!R2C23:R2C31,FALSE),FALSE) -> 1500|100 | W93: =IF(AND(RC[-18]="",RC[-8]=""),INT(RC[-22]/1000)*1000+302,"") ->  | Y93: 1
A94: 23502 | B94: 永恒光辉 | C94: 3 | D94: 36 | E94: =RC[-4]-20000 -> 3502 | F94: 0 | G94: 5 | H94: 11508 | I94: 300 | J94: 50 | K94: 5 | L94: 1000000 | M94: 100 | N94: 100000 | O94: 502 | P94: 23502 | Q94: 【套装】“永恒”是诸神的权柄，而此刻，你也有染指它的权力。 | R94: =VLOOKUP(RC3,Sheet1!R2C2:R6C6,2,FALSE)&"|"&VLOOKUP(MOD(RC1,1000),Sheet1!R2C9:R27C13,MATCH(VLOOKUP(RC3,Sheet1!R2C2:R6C6,2,FALSE),Sheet1!R2C9:R2C13,FALSE),FALSE)+VLOOKUP(MOD(RC1,1000),Sheet1!R2C16:R27C20,MATCH(VLOOKUP(RC3,Sheet1!R2C2:R6C6,3,FALSE),Sheet1!R2C16:R2C20,FALSE),FALSE) -> 4|10740 | S94: =VLOOKUP(MOD(RC1,1000),Sheet1!R2C16:R27C20,MATCH(VLOOKUP(RC3,Sheet1!R2C2:R6C6,3,FALSE),Sheet1!R2C16:R2C20,FALSE),FALSE) -> 540 | T94: =VLOOKUP(RC3,Sheet1!R2C2:R6C6,4,FALSE)&"|"&VLOOKUP(RC3,Sheet1!R2C2:R6C6,5,FALSE) -> 4|14 | U94: =VLOOKUP(MOD(RC1,1000),Sheet1!R2C23:R27C31,MATCH(VLOOKUP(RC3,Sheet1!R2C2:R6C6,4,FALSE),Sheet1!R2C23:R2C31,FALSE),FALSE)&"|"&VLOOKUP(MOD(RC1,1000),Sheet1!R2C23:R27C31,MATCH(VLOOKUP(RC3,Sheet1!R2C2:R6C6,5,FALSE),Sheet1!R2C23:R2C31,FALSE),FALSE) -> 1700|100 | W94: =IF(AND(RC[-18]="",RC[-8]=""),INT(RC[-22]/1000)*1000+302,"") ->  | X94: UI_taozhuang_hongse1 | Y94: 1
A95: 23503 | B95: 巨擘守护 | C95: 3 | D95: 32 | E95: =RC[-4]-20000 -> 3503 | F95: 0 | G95: 5 | H95: 11512 | I95: 300 | J95: 50 | K95: 5 | L95: 1000000 | M95: 100 | N95: 80000 | O95: 503 | P95: 23503 | Q95: 【套装】融入了上古巨像头领的一部分核心，带着它就仿佛得到了上古巨像的守护。 | R95: =VLOOKUP(RC3,Sheet1!R2C2:R6C6,2,FALSE)&"|"&VLOOKUP(MOD(RC1,1000),Sheet1!R2C9:R27C13,MATCH(VLOOKUP(RC3,Sheet1!R2C2:R6C6,2,FALSE),Sheet1!R2C9:R2C13,FALSE),FALSE)+VLOOKUP(MOD(RC1,1000),Sheet1!R2C16:R27C20,MATCH(VLOOKUP(RC3,Sheet1!R2C2:R6C6,3,FALSE),Sheet1!R2C16:R2C20,FALSE),FALSE) -> 4|9530 | S95: =VLOOKUP(MOD(RC1,1000),Sheet1!R2C16:R27C20,MATCH(VLOOKUP(RC3,Sheet1!R2C2:R6C6,3,FALSE),Sheet1!R2C16:R2C20,FALSE),FALSE) -> 480 | T95: =VLOOKUP(RC3,Sheet1!R2C2:R6C6,4,FALSE)&"|"&VLOOKUP(RC3,Sheet1!R2C2:R6C6,5,FALSE) -> 4|14 | U95: =VLOOKUP(MOD(RC1,1000),Sheet1!R2C23:R27C31,MATCH(VLOOKUP(RC3,Sheet1!R2C2:R6C6,4,FALSE),Sheet1!R2C23:R2C31,FALSE),FALSE)&"|"&VLOOKUP(MOD(RC1,1000),Sheet1!R2C23:R27C31,MATCH(VLOOKUP(RC3,Sheet1!R2C2:R6C6,5,FALSE),Sheet1!R2C23:R2C31,FALSE),FALSE) -> 1500|100 | W95: =IF(AND(RC[-18]="",RC[-8]=""),INT(RC[-22]/1000)*1000+302,"") ->  | X95: UI_taozhuang_hongse1 | Y95: 1
A96: 23504 | B96: 封魔领域 | C96: 3 | D96: 34 | E96: =RC[-4]-20000 -> 3504 | F96: 0 | G96: 5 | H96: 11516 | I96: 300 | J96: 50 | K96: 5 | L96: 1000000 | M96: 100 | N96: 90000 | O96: 504 | P96: 23504 | Q96: 【套装】它的拥有者曾经令所有法师闻风丧胆，可惜最终败在了某位灰袍法师手上。 | R96: =VLOOKUP(RC3,Sheet1!R2C2:R6C6,2,FALSE)&"|"&VLOOKUP(MOD(RC1,1000),Sheet1!R2C9:R27C13,MATCH(VLOOKUP(RC3,Sheet1!R2C2:R6C6,2,FALSE),Sheet1!R2C9:R2C13,FALSE),FALSE)+VLOOKUP(MOD(RC1,1000),Sheet1!R2C16:R27C20,MATCH(VLOOKUP(RC3,Sheet1!R2C2:R6C6,3,FALSE),Sheet1!R2C16:R2C20,FALSE),FALSE) -> 4|10160 | S96: =VLOOKUP(MOD(RC1,1000),Sheet1!R2C16:R27C20,MATCH(VLOOKUP(RC3,Sheet1!R2C2:R6C6,3,FALSE),Sheet1!R2C16:R2C20,FALSE),FALSE) -> 510 | T96: =VLOOKUP(RC3,Sheet1!R2C2:R6C6,4,FALSE)&"|"&VLOOKUP(RC3,Sheet1!R2C2:R6C6,5,FALSE) -> 4|14 | U96: =VLOOKUP(MOD(RC1,1000),Sheet1!R2C23:R27C31,MATCH(VLOOKUP(RC3,Sheet1!R2C2:R6C6,4,FALSE),Sheet1!R2C23:R2C31,FALSE),FALSE)&"|"&VLOOKUP(MOD(RC1,1000),Sheet1!R2C23:R27C31,MATCH(VLOOKUP(RC3,Sheet1!R2C2:R6C6,5,FALSE),Sheet1!R2C23:R2C31,FALSE),FALSE) -> 1600|100 | W96: =IF(AND(RC[-18]="",RC[-8]=""),INT(RC[-22]/1000)*1000+302,"") ->  | X96: UI_taozhuang_hongse1 | Y96: 1
A97: 23505 | B97: 盖亚庇佑 | C97: 3 | D97: 32 | E97: =RC[-4]-20000 -> 3505 | F97: 0 | G97: 5 | H97: 11520 | I97: 300 | J97: 50 | K97: 5 | L97: 1000000 | M97: 100 | N97: 80000 | O97: 505 | P97: 23505 | Q97: 【套装】她是一切的根源，她在沉睡中庇佑着一切。 | R97: =VLOOKUP(RC3,Sheet1!R2C2:R6C6,2,FALSE)&"|"&VLOOKUP(MOD(RC1,1000),Sheet1!R2C9:R27C13,MATCH(VLOOKUP(RC3,Sheet1!R2C2:R6C6,2,FALSE),Sheet1!R2C9:R2C13,FALSE),FALSE)+VLOOKUP(MOD(RC1,1000),Sheet1!R2C16:R27C20,MATCH(VLOOKUP(RC3,Sheet1!R2C2:R6C6,3,FALSE),Sheet1!R2C16:R2C20,FALSE),FALSE) -> 4|9530 | S97: =VLOOKUP(MOD(RC1,1000),Sheet1!R2C16:R27C20,MATCH(VLOOKUP(RC3,Sheet1!R2C2:R6C6,3,FALSE),Sheet1!R2C16:R2C20,FALSE),FALSE) -> 480 | T97: =VLOOKUP(RC3,Sheet1!R2C2:R6C6,4,FALSE)&"|"&VLOOKUP(RC3,Sheet1!R2C2:R6C6,5,FALSE) -> 4|14 | U97: =VLOOKUP(MOD(RC1,1000),Sheet1!R2C23:R27C31,MATCH(VLOOKUP(RC3,Sheet1!R2C2:R6C6,4,FALSE),Sheet1!R2C23:R2C31,FALSE),FALSE)&"|"&VLOOKUP(MOD(RC1,1000),Sheet1!R2C23:R27C31,MATCH(VLOOKUP(RC3,Sheet1!R2C2:R6C6,5,FALSE),Sheet1!R2C23:R2C31,FALSE),FALSE) -> 1500|100 | X97: UI_taozhuang_hongse1 | Y97: 1
A98: 20599 | B98: 屠龙宝刀 | C98: 0 | D98: 99 | F98: 0 | I98: 300 | J98: 50 | K98: 5 | L98: 99999999 | M98: 100 | N98: 999999 | O98: 999 | P98: 20101 | Q98: 点击即送！ | R98: =VLOOKUP(RC3,Sheet1!R2C2:R6C6,2,FALSE)&"|"&VLOOKUP(MOD(RC1,1000),Sheet1!R2C9:R27C13,MATCH(VLOOKUP(RC3,Sheet1!R2C2:R6C6,2,FALSE),Sheet1!R2C9:R2C13,FALSE),FALSE)+VLOOKUP(MOD(RC1,1000),Sheet1!R2C16:R27C20,MATCH(VLOOKUP(RC3,Sheet1!R2C2:R6C6,3,FALSE),Sheet1!R2C16:R2C20,FALSE),FALSE) -> 1|1100000 | S98: =VLOOKUP(MOD(RC1,1000),Sheet1!R2C16:R27C20,MATCH(VLOOKUP(RC3,Sheet1!R2C2:R6C6,3,FALSE),Sheet1!R2C16:R2C20,FALSE),FALSE) -> 100000 | T98: 1|13 | U98: =VLOOKUP(MOD(RC1,1000),Sheet1!R2C23:R27C31,MATCH(VLOOKUP(RC3,Sheet1!R2C2:R6C6,4,FALSE),Sheet1!R2C23:R2C31,FALSE),FALSE)&"|"&VLOOKUP(MOD(RC1,1000),Sheet1!R2C23:R27C31,MATCH(VLOOKUP(RC3,Sheet1!R2C2:R6C6,5,FALSE),Sheet1!R2C23:R2C31,FALSE),FALSE) -> 100000|1000 | W98: =IF(AND(RC[-18]="",RC[-8]=""),INT(RC[-22]/1000)*1000+302,"") -> 
A99: 21599 | B99: 屠龙宝甲 | C99: 1 | D99: 99 | F99: 0 | I99: 300 | J99: 50 | K99: 5 | L99: 99999999 | M99: 100 | N99: 999999 | O99: 999 | P99: 21101 | Q99: 点击即送！ | R99: =VLOOKUP(RC3,Sheet1!R2C2:R6C6,2,FALSE)&"|"&VLOOKUP(MOD(RC1,1000),Sheet1!R2C9:R27C13,MATCH(VLOOKUP(RC3,Sheet1!R2C2:R6C6,2,FALSE),Sheet1!R2C9:R2C13,FALSE),FALSE)+VLOOKUP(MOD(RC1,1000),Sheet1!R2C16:R27C20,MATCH(VLOOKUP(RC3,Sheet1!R2C2:R6C6,3,FALSE),Sheet1!R2C16:R2C20,FALSE),FALSE) -> 2|1100000 | S99: =VLOOKUP(MOD(RC1,1000),Sheet1!R2C16:R27C20,MATCH(VLOOKUP(RC3,Sheet1!R2C2:R6C6,3,FALSE),Sheet1!R2C16:R2C20,FALSE),FALSE) -> 100000 | T99: 2|11 | U99: =VLOOKUP(MOD(RC1,1000),Sheet1!R2C23:R27C31,MATCH(VLOOKUP(RC3,Sheet1!R2C2:R6C6,4,FALSE),Sheet1!R2C23:R2C31,FALSE),FALSE)&"|"&VLOOKUP(MOD(RC1,1000),Sheet1!R2C23:R27C31,MATCH(VLOOKUP(RC3,Sheet1!R2C2:R6C6,5,FALSE),Sheet1!R2C23:R2C31,FALSE),FALSE) -> 100000|1000 | W99: =IF(AND(RC[-18]="",RC[-8]=""),INT(RC[-22]/1000)*1000+302,"") -> 
A100: 22599 | B100: 屠龙宝靴 | C100: 2 | D100: 99 | F100: 0 | I100: 300 | J100: 50 | K100: 5 | L100: 99999999 | M100: 100 | N100: 999999 | O100: 999 | P100: 22101 | Q100: 点击即送！ | R100: =VLOOKUP(RC3,Sheet1!R2C2:R6C6,2,FALSE)&"|"&VLOOKUP(MOD(RC1,1000),Sheet1!R2C9:R27C13,MATCH(VLOOKUP(RC3,Sheet1!R2C2:R6C6,2,FALSE),Sheet1!R2C9:R2C13,FALSE),FALSE)+VLOOKUP(MOD(RC1,1000),Sheet1!R2C16:R27C20,MATCH(VLOOKUP(RC3,Sheet1!R2C2:R6C6,3,FALSE),Sheet1!R2C16:R2C20,FALSE),FALSE) -> 3|1100000 | S100: =VLOOKUP(MOD(RC1,1000),Sheet1!R2C16:R27C20,MATCH(VLOOKUP(RC3,Sheet1!R2C2:R6C6,3,FALSE),Sheet1!R2C16:R2C20,FALSE),FALSE) -> 100000 | T100: 3|12 | U100: =VLOOKUP(MOD(RC1,1000),Sheet1!R2C23:R27C31,MATCH(VLOOKUP(RC3,Sheet1!R2C2:R6C6,4,FALSE),Sheet1!R2C23:R2C31,FALSE),FALSE)&"|"&VLOOKUP(MOD(RC1,1000),Sheet1!R2C23:R27C31,MATCH(VLOOKUP(RC3,Sheet1!R2C2:R6C6,5,FALSE),Sheet1!R2C23:R2C31,FALSE),FALSE) -> 100000|1000 | W100: =IF(AND(RC[-18]="",RC[-8]=""),INT(RC[-22]/1000)*1000+302,"") -> 
A101: 23599 | B101: 屠龙宝镯 | C101: 3 | D101: 99 | F101: 0 | I101: 300 | J101: 50 | K101: 5 | L101: 99999999 | M101: 100 | N101: 999999 | O101: 999 | P101: 23101 | Q101: 点击即送！ | R101: =VLOOKUP(RC3,Sheet1!R2C2:R6C6,2,FALSE)&"|"&VLOOKUP(MOD(RC1,1000),Sheet1!R2C9:R27C13,MATCH(VLOOKUP(RC3,Sheet1!R2C2:R6C6,2,FALSE),Sheet1!R2C9:R2C13,FALSE),FALSE)+VLOOKUP(MOD(RC1,1000),Sheet1!R2C16:R27C20,MATCH(VLOOKUP(RC3,Sheet1!R2C2:R6C6,3,FALSE),Sheet1!R2C16:R2C20,FALSE),FALSE) -> 4|11000000 | S101: =VLOOKUP(MOD(RC1,1000),Sheet1!R2C16:R27C20,MATCH(VLOOKUP(RC3,Sheet1!R2C2:R6C6,3,FALSE),Sheet1!R2C16:R2C20,FALSE),FALSE) -> 1000000 | T101: 4|14 | U101: =VLOOKUP(MOD(RC1,1000),Sheet1!R2C23:R27C31,MATCH(VLOOKUP(RC3,Sheet1!R2C2:R6C6,4,FALSE),Sheet1!R2C23:R2C31,FALSE),FALSE)&"|"&VLOOKUP(MOD(RC1,1000),Sheet1!R2C23:R27C31,MATCH(VLOOKUP(RC3,Sheet1!R2C2:R6C6,5,FALSE),Sheet1!R2C23:R2C31,FALSE),FALSE) -> 1000000|1000 | W101: =IF(AND(RC[-18]="",RC[-8]=""),INT(RC[-22]/1000)*1000+302,"") -> 

Sheet: 2.装备强化等级信息
A1: quality|quality | B1: strength_level|strength_level | C1: cost_gold|cost_gold | D1: cost_type_list|cost_type_list | E1: cost_value_list|cost_value_list | F1: total_cost_gold|total_cost_gold
A2: 不可空 | B2: 不可空 | C2: 不可空 | D2: 可空#不需字段 | E2: 可空#不需字段 | F2: 不可空
A3: 数字 | B3: 数字 | C3: 数字 | D3: 一维数组 | E3: 一维数组 | F3: 数字
D4: 不定长 | E4: 不定长
A6: 装备品质 | B6: 强化等级 | C6: 强化消耗金币 | D6: 消耗类型列表 | E6: 消耗值列表 | F6: 强化总消耗
A7: 1 | B7: 1 | C7: 300 | D7: 3 | E7: =RC[-2] -> 300 | F7: =IF(RC[-4]=1,0,R[-1]C+R[-1]C[-3]) -> 0
A8: 1 | B8: 2 | C8: 339 | D8: 3 | E8: =RC[-2] -> 339 | F8: =IF(RC[-4]=1,0,R[-1]C+R[-1]C[-3]) -> 300
A9: 1 | B9: 3 | C9: 384 | D9: 3 | E9: =RC[-2] -> 384 | F9: =IF(RC[-4]=1,0,R[-1]C+R[-1]C[-3]) -> 639
A10: 1 | B10: 4 | C10: 435 | D10: 3 | E10: =RC[-2] -> 435 | F10: =IF(RC[-4]=1,0,R[-1]C+R[-1]C[-3]) -> 1023
A11: 1 | B11: 5 | C11: 492 | D11: 3 | E11: =RC[-2] -> 492 | F11: =IF(RC[-4]=1,0,R[-1]C+R[-1]C[-3]) -> 1458
A12: 1 | B12: 6 | C12: 555 | D12: 3 | E12: =RC[-2] -> 555 | F12: =IF(RC[-4]=1,0,R[-1]C+R[-1]C[-3]) -> 1950
A13: 1 | B13: 7 | C13: 624 | D13: 3 | E13: =RC[-2] -> 624 | F13: =IF(RC[-4]=1,0,R[-1]C+R[-1]C[-3]) -> 2505
A14: 1 | B14: 8 | C14: 699 | D14: 3 | E14: =RC[-2] -> 699 | F14: =IF(RC[-4]=1,0,R[-1]C+R[-1]C[-3]) -> 3129
A15: 1 | B15: 9 | C15: 780 | D15: 3 | E15: =RC[-2] -> 780 | F15: =IF(RC[-4]=1,0,R[-1]C+R[-1]C[-3]) -> 3828
A16: 1 | B16: 10 | C16: 867 | D16: 3 | E16: =RC[-2] -> 867 | F16: =IF(RC[-4]=1,0,R[-1]C+R[-1]C[-3]) -> 4608
A17: 1 | B17: 11 | C17: 1080 | D17: 3 | E17: =RC[-2] -> 1080 | F17: =IF(RC[-4]=1,0,R[-1]C+R[-1]C[-3]) -> 5475
A18: 1 | B18: 12 | C18: 1191 | D18: 3 | E18: =RC[-2] -> 1191 | F18: =IF(RC[-4]=1,0,R[-1]C+R[-1]C[-3]) -> 6555
A19: 1 | B19: 13 | C19: 1310 | D19: 3 | E19: =RC[-2] -> 1310 | F19: =IF(RC[-4]=1,0,R[-1]C+R[-1]C[-3]) -> 7746
A20: 1 | B20: 14 | C20: 1434 | D20: 3 | E20: =RC[-2] -> 1434 | F20: =IF(RC[-4]=1,0,R[-1]C+R[-1]C[-3]) -> 9056
A21: 1 | B21: 15 | C21: 1566 | D21: 3 | E21: =RC[-2] -> 1566 | F21: =IF(RC[-4]=1,0,R[-1]C+R[-1]C[-3]) -> 10490
A22: 1 | B22: 16 | C22: 1704 | D22: 3 | E22: =RC[-2] -> 1704 | F22: =IF(RC[-4]=1,0,R[-1]C+R[-1]C[-3]) -> 12056
A23: 1 | B23: 17 | C23: 1850 | D23: 3 | E23: =RC[-2] -> 1850 | F23: =IF(RC[-4]=1,0,R[-1]C+R[-1]C[-3]) -> 13760
A24: 1 | B24: 18 | C24: 2001 | D24: 3 | E24: =RC[-2] -> 2001 | F24: =IF(RC[-4]=1,0,R[-1]C+R[-1]C[-3]) -> 15610
A25: 1 | B25: 19 | C25: 2160 | D25: 3 | E25: =RC[-2] -> 2160 | F25: =IF(RC[-4]=1,0,R[-1]C+R[-1]C[-3]) -> 17611
A26: 1 | B26: 20 | C26: 2325 | D26: 3 | E26: =RC[-2] -> 2325 | F26: =IF(RC[-4]=1,0,R[-1]C+R[-1]C[-3]) -> 19771
A27: 1 | B27: 21 | C27: 2775 | D27: 3 | E27: =RC[-2] -> 2775 | F27: =IF(RC[-4]=1,0,R[-1]C+R[-1]C[-3]) -> 22096
A28: 1 | B28: 22 | C28: 2974 | D28: 3 | E28: =RC[-2] -> 2974 | F28: =IF(RC[-4]=1,0,R[-1]C+R[-1]C[-3]) -> 24871
A29: 1 | B29: 23 | C29: 3180 | D29: 3 | E29: =RC[-2] -> 3180 | F29: =IF(RC[-4]=1,0,R[-1]C+R[-1]C[-3]) -> 27845
A30: 1 | B30: 24 | C30: 3394 | D30: 3 | E30: =RC[-2] -> 3394 | F30: =IF(RC[-4]=1,0,R[-1]C+R[-1]C[-3]) -> 31025
A31: 1 | B31: 25 | C31: 3615 | D31: 3 | E31: =RC[-2] -> 3615 | F31: =IF(RC[-4]=1,0,R[-1]C+R[-1]C[-3]) -> 34419
A32: 1 | B32: 26 | C32: 3844 | D32: 3 | E32: =RC[-2] -> 3844 | F32: =IF(RC[-4]=1,0,R[-1]C+R[-1]C[-3]) -> 38034
A33: 1 | B33: 27 | C33: 4080 | D33: 3 | E33: =RC[-2] -> 4080 | F33: =IF(RC[-4]=1,0,R[-1]C+R[-1]C[-3]) -> 41878
A34: 1 | B34: 28 | C34: 4324 | D34: 3 | E34: =RC[-2] -> 4324 | F34: =IF(RC[-4]=1,0,R[-1]C+R[-1]C[-3]) -> 45958
A35: 1 | B35: 29 | C35: 4575 | D35: 3 | E35: =RC[-2] -> 4575 | F35: =IF(RC[-4]=1,0,R[-1]C+R[-1]C[-3]) -> 50282
A36: 1 | B36: 30 | C36: 4834 | D36: 3 | E36: =RC[-2] -> 4834 | F36: =IF(RC[-4]=1,0,R[-1]C+R[-1]C[-3]) -> 54857
A37: 1 | B37: 31 | C37: 6120 | D37: 3 | E37: =RC[-2] -> 6120 | F37: =IF(RC[-4]=1,0,R[-1]C+R[-1]C[-3]) -> 59691
A38: 1 | B38: 32 | C38: 6449 | D38: 3 | E38: =RC[-2] -> 6449 | F38: =IF(RC[-4]=1,0,R[-1]C+R[-1]C[-3]) -> 65811
A39: 1 | B39: 33 | C39: 6786 | D39: 3 | E39: =RC[-2] -> 6786 | F39: =IF(RC[-4]=1,0,R[-1]C+R[-1]C[-3]) -> 72260
A40: 1 | B40: 34 | C40: 7133 | D40: 3 | E40: =RC[-2] -> 7133 | F40: =IF(RC[-4]=1,0,R[-1]C+R[-1]C[-3]) -> 79046
A41: 1 | B41: 35 | C41: 7488 | D41: 3 | E41: =RC[-2] -> 7488 | F41: =IF(RC[-4]=1,0,R[-1]C+R[-1]C[-3]) -> 86179
A42: 1 | B42: 36 | C42: 7853 | D42: 3 | E42: =RC[-2] -> 7853 | F42: =IF(RC[-4]=1,0,R[-1]C+R[-1]C[-3]) -> 93667
A43: 1 | B43: 37 | C43: 8226 | D43: 3 | E43: =RC[-2] -> 8226 | F43: =IF(RC[-4]=1,0,R[-1]C+R[-1]C[-3]) -> 101520
A44: 1 | B44: 38 | C44: 8609 | D44: 3 | E44: =RC[-2] -> 8609 | F44: =IF(RC[-4]=1,0,R[-1]C+R[-1]C[-3]) -> 109746
A45: 1 | B45: 39 | C45: 9000 | D45: 3 | E45: =RC[-2] -> 9000 | F45: =IF(RC[-4]=1,0,R[-1]C+R[-1]C[-3]) -> 118355
A46: 1 | B46: 40 | C46: 9401 | D46: 3 | E46: =RC[-2] -> 9401 | F46: =IF(RC[-4]=1,0,R[-1]C+R[-1]C[-3]) -> 127355
A47: 1 | B47: 41 | C47: 11445 | D47: 3 | E47: =RC[-2] -> 11445 | F47: =IF(RC[-4]=1,0,R[-1]C+R[-1]C[-3]) -> 136756
A48: 1 | B48: 42 | C48: 11933 | D48: 3 | E48: =RC[-2] -> 11933 | F48: =IF(RC[-4]=1,0,R[-1]C+R[-1]C[-3]) -> 148201
A49: 1 | B49: 43 | C49: 12432 | D49: 3 | E49: =RC[-2] -> 12432 | F49: =IF(RC[-4]=1,0,R[-1]C+R[-1]C[-3]) -> 160134
A50: 1 | B50: 44 | C50: 12941 | D50: 3 | E50: =RC[-2] -> 12941 | F50: =IF(RC[-4]=1,0,R[-1]C+R[-1]C[-3]) -> 172566
A51: 1 | B51: 45 | C51: 13461 | D51: 3 | E51: =RC[-2] -> 13461 | F51: =IF(RC[-4]=1,0,R[-1]C+R[-1]C[-3]) -> 185507
A52: 1 | B52: 46 | C52: 13991 | D52: 3 | E52: =RC[-2] -> 13991 | F52: =IF(RC[-4]=1,0,R[-1]C+R[-1]C[-3]) -> 198968
A53: 1 | B53: 47 | C53: 14532 | D53: 3 | E53: =RC[-2] -> 14532 | F53: =IF(RC[-4]=1,0,R[-1]C+R[-1]C[-3]) -> 212959
A54: 1 | B54: 48 | C54: 15083 | D54: 3 | E54: =RC[-2] -> 15083 | F54: =IF(RC[-4]=1,0,R[-1]C+R[-1]C[-3]) -> 227491
A55: 1 | B55: 49 | C55: 15645 | D55: 3 | E55: =RC[-2] -> 15645 | F55: =IF(RC[-4]=1,0,R[-1]C+R[-1]C[-3]) -> 242574
A56: 1 | B56: 50 | C56: 16217 | D56: 3 | E56: =RC[-2] -> 16217 | F56: =IF(RC[-4]=1,0,R[-1]C+R[-1]C[-3]) -> 258219
A57: 1 | B57: 51 | C57: 19200 | D57: 3 | E57: =RC[-2] -> 19200 | F57: =IF(RC[-4]=1,0,R[-1]C+R[-1]C[-3]) -> 274436
A58: 1 | B58: 52 | C58: 19878 | D58: 3 | E58: =RC[-2] -> 19878 | F58: =IF(RC[-4]=1,0,R[-1]C+R[-1]C[-3]) -> 293636
A59: 1 | B59: 53 | C59: 20568 | D59: 3 | E59: =RC[-2] -> 20568 | F59: =IF(RC[-4]=1,0,R[-1]C+R[-1]C[-3]) -> 313514
A60: 1 | B60: 54 | C60: 21270 | D60: 3 | E60: =RC[-2] -> 21270 | F60: =IF(RC[-4]=1,0,R[-1]C+R[-1]C[-3]) -> 334082
A61: 1 | B61: 55 | C61: 21984 | D61: 3 | E61: =RC[-2] -> 21984 | F61: =IF(RC[-4]=1,0,R[-1]C+R[-1]C[-3]) -> 355352
A62: 1 | B62: 56 | C62: 22710 | D62: 3 | E62: =RC[-2] -> 22710 | F62: =IF(RC[-4]=1,0,R[-1]C+R[-1]C[-3]) -> 377336
A63: 1 | B63: 57 | C63: 23448 | D63: 3 | E63: =RC[-2] -> 23448 | F63: =IF(RC[-4]=1,0,R[-1]C+R[-1]C[-3]) -> 400046
A64: 1 | B64: 58 | C64: 24198 | D64: 3 | E64: =RC[-2] -> 24198 | F64: =IF(RC[-4]=1,0,R[-1]C+R[-1]C[-3]) -> 423494
A65: 1 | B65: 59 | C65: 24960 | D65: 3 | E65: =RC[-2] -> 24960 | F65: =IF(RC[-4]=1,0,R[-1]C+R[-1]C[-3]) -> 447692
A66: 1 | B66: 60 | C66: 25734 | D66: 3 | E66: =RC[-2] -> 25734 | F66: =IF(RC[-4]=1,0,R[-1]C+R[-1]C[-3]) -> 472652
A67: 1 | B67: 61 | C67: 29835 | D67: 3 | E67: =RC[-2] -> 29835 | F67: =IF(RC[-4]=1,0,R[-1]C+R[-1]C[-3]) -> 498386
A68: 1 | B68: 62 | C68: 30733 | D68: 3 | E68: =RC[-2] -> 30733 | F68: =IF(RC[-4]=1,0,R[-1]C+R[-1]C[-3]) -> 528221
A69: 1 | B69: 63 | C69: 31644 | D69: 3 | E69: =RC[-2] -> 31644 | F69: =IF(RC[-4]=1,0,R[-1]C+R[-1]C[-3]) -> 558954
A70: 1 | B70: 64 | C70: 32569 | D70: 3 | E70: =RC[-2] -> 32569 | F70: =IF(RC[-4]=1,0,R[-1]C+R[-1]C[-3]) -> 590598
A71: 1 | B71: 65 | C71: 33507 | D71: 3 | E71: =RC[-2] -> 33507 | F71: =IF(RC[-4]=1,0,R[-1]C+R[-1]C[-3]) -> 623167
A72: 1 | B72: 66 | C72: 34459 | D72: 3 | E72: =RC[-2] -> 34459 | F72: =IF(RC[-4]=1,0,R[-1]C+R[-1]C[-3]) -> 656674
A73: 1 | B73: 67 | C73: 35424 | D73: 3 | E73: =RC[-2] -> 35424 | F73: =IF(RC[-4]=1,0,R[-1]C+R[-1]C[-3]) -> 691133
A74: 1 | B74: 68 | C74: 36403 | D74: 3 | E74: =RC[-2] -> 36403 | F74: =IF(RC[-4]=1,0,R[-1]C+R[-1]C[-3]) -> 726557
A75: 1 | B75: 69 | C75: 37395 | D75: 3 | E75: =RC[-2] -> 37395 | F75: =IF(RC[-4]=1,0,R[-1]C+R[-1]C[-3]) -> 762960
A76: 1 | B76: 70 | C76: 38401 | D76: 3 | E76: =RC[-2] -> 38401 | F76: =IF(RC[-4]=1,0,R[-1]C+R[-1]C[-3]) -> 800355
A77: 1 | B77: 71 | C77: 43800 | D77: 3 | E77: =RC[-2] -> 43800 | F77: =IF(RC[-4]=1,0,R[-1]C+R[-1]C[-3]) -> 838756
A78: 1 | B78: 72 | C78: 44948 | D78: 3 | E78: =RC[-2] -> 44948 | F78: =IF(RC[-4]=1,0,R[-1]C+R[-1]C[-3]) -> 882556
A79: 1 | B79: 73 | C79: 46110 | D79: 3 | E79: =RC[-2] -> 46110 | F79: =IF(RC[-4]=1,0,R[-1]C+R[-1]C[-3]) -> 927504
A80: 1 | B80: 74 | C80: 47288 | D80: 3 | E80: =RC[-2] -> 47288 | F80: =IF(RC[-4]=1,0,R[-1]C+R[-1]C[-3]) -> 973614
A81: 1 | B81: 75 | C81: 48480 | D81: 3 | E81: =RC[-2] -> 48480 | F81: =IF(RC[-4]=1,0,R[-1]C+R[-1]C[-3]) -> 1020902
A82: 1 | B82: 76 | C82: 49688 | D82: 3 | E82: =RC[-2] -> 49688 | F82: =IF(RC[-4]=1,0,R[-1]C+R[-1]C[-3]) -> 1069382
A83: 1 | B83: 77 | C83: 50910 | D83: 3 | E83: =RC[-2] -> 50910 | F83: =IF(RC[-4]=1,0,R[-1]C+R[-1]C[-3]) -> 1119070
A84: 1 | B84: 78 | C84: 52148 | D84: 3 | E84: =RC[-2] -> 52148 | F84: =IF(RC[-4]=1,0,R[-1]C+R[-1]C[-3]) -> 1169980
A85: 1 | B85: 79 | C85: 53400 | D85: 3 | E85: =RC[-2] -> 53400 | F85: =IF(RC[-4]=1,0,R[-1]C+R[-1]C[-3]) -> 1222128
A86: 1 | B86: 80 | C86: 54668 | D86: 3 | E86: =RC[-2] -> 54668 | F86: =IF(RC[-4]=1,0,R[-1]C+R[-1]C[-3]) -> 1275528
A87: 1 | B87: 81 | C87: 55950 | D87: 3 | E87: =RC[-2] -> 55950 | F87: =IF(RC[-4]=1,0,R[-1]C+R[-1]C[-3]) -> 1330196
A88: 1 | B88: 82 | C88: 57248 | D88: 3 | E88: =RC[-2] -> 57248 | F88: =IF(RC[-4]=1,0,R[-1]C+R[-1]C[-3]) -> 1386146
A89: 1 | B89: 83 | C89: 58560 | D89: 3 | E89: =RC[-2] -> 58560 | F89: =IF(RC[-4]=1,0,R[-1]C+R[-1]C[-3]) -> 1443394
A90: 1 | B90: 84 | C90: 59888 | D90: 3 | E90: =RC[-2] -> 59888 | F90: =IF(RC[-4]=1,0,R[-1]C+R[-1]C[-3]) -> 1501954
A91: 1 | B91: 85 | C91: 61230 | D91: 3 | E91: =RC[-2] -> 61230 | F91: =IF(RC[-4]=1,0,R[-1]C+R[-1]C[-3]) -> 1561842
A92: 1 | B92: 86 | C92: 62588 | D92: 3 | E92: =RC[-2] -> 62588 | F92: =IF(RC[-4]=1,0,R[-1]C+R[-1]C[-3]) -> 1623072
A93: 1 | B93: 87 | C93: 63960 | D93: 3 | E93: =RC[-2] -> 63960 | F93: =IF(RC[-4]=1,0,R[-1]C+R[-1]C[-3]) -> 1685660
A94: 1 | B94: 88 | C94: 65348 | D94: 3 | E94: =RC[-2] -> 65348 | F94: =IF(RC[-4]=1,0,R[-1]C+R[-1]C[-3]) -> 1749620
A95: 1 | B95: 89 | C95: 66750 | D95: 3 | E95: =RC[-2] -> 66750 | F95: =IF(RC[-4]=1,0,R[-1]C+R[-1]C[-3]) -> 1814968
A96: 1 | B96: 90 | C96: 68168 | D96: 3 | E96: =RC[-2] -> 68168 | F96: =IF(RC[-4]=1,0,R[-1]C+R[-1]C[-3]) -> 1881718
A97: 1 | B97: 91 | C97: 69600 | D97: 3 | E97: =RC[-2] -> 69600 | F97: =IF(RC[-4]=1,0,R[-1]C+R[-1]C[-3]) -> 1949886
A98: 1 | B98: 92 | C98: 71048 | D98: 3 | E98: =RC[-2] -> 71048 | F98: =IF(RC[-4]=1,0,R[-1]C+R[-1]C[-3]) -> 2019486
A99: 1 | B99: 93 | C99: 72510 | D99: 3 | E99: =RC[-2] -> 72510 | F99: =IF(RC[-4]=1,0,R[-1]C+R[-1]C[-3]) -> 2090534
A100: 1 | B100: 94 | C100: 73988 | D100: 3 | E100: =RC[-2] -> 73988 | F100: =IF(RC[-4]=1,0,R[-1]C+R[-1]C[-3]) -> 2163044
A101: 1 | B101: 95 | C101: 75480 | D101: 3 | E101: =RC[-2] -> 75480 | F101: =IF(RC[-4]=1,0,R[-1]C+R[-1]C[-3]) -> 2237032
A102: 1 | B102: 96 | C102: 76988 | D102: 3 | E102: =RC[-2] -> 76988 | F102: =IF(RC[-4]=1,0,R[-1]C+R[-1]C[-3]) -> 2312512
A103: 1 | B103: 97 | C103: 78510 | D103: 3 | E103: =RC[-2] -> 78510 | F103: =IF(RC[-4]=1,0,R[-1]C+R[-1]C[-3]) -> 2389500
A104: 1 | B104: 98 | C104: 80048 | D104: 3 | E104: =RC[-2] -> 80048 | F104: =IF(RC[-4]=1,0,R[-1]C+R[-1]C[-3]) -> 2468010
A105: 1 | B105: 99 | C105: 81600 | D105: 3 | E105: =RC[-2] -> 81600 | F105: =IF(RC[-4]=1,0,R[-1]C+R[-1]C[-3]) -> 2548058
A106: 1 | B106: 100 | C106: 83168 | D106: 3 | E106: =RC[-2] -> 83168 | F106: =IF(RC[-4]=1,0,R[-1]C+R[-1]C[-3]) -> 2629658
A107: 1 | B107: 101 | C107: 84750 | D107: 3 | E107: =RC[-2] -> 84750 | F107: =IF(RC[-4]=1,0,R[-1]C+R[-1]C[-3]) -> 2712826
A108: 1 | B108: 102 | C108: 86348 | D108: 3 | E108: =RC[-2] -> 86348 | F108: =IF(RC[-4]=1,0,R[-1]C+R[-1]C[-3]) -> 2797576
A109: 1 | B109: 103 | C109: 87960 | D109: 3 | E109: =RC[-2] -> 87960 | F109: =IF(RC[-4]=1,0,R[-1]C+R[-1]C[-3]) -> 2883924
A110: 1 | B110: 104 | C110: 89588 | D110: 3 | E110: =RC[-2] -> 89588 | F110: =IF(RC[-4]=1,0,R[-1]C+R[-1]C[-3]) -> 2971884
A111: 1 | B111: 105 | C111: 91230 | D111: 3 | E111: =RC[-2] -> 91230 | F111: =IF(RC[-4]=1,0,R[-1]C+R[-1]C[-3]) -> 3061472
A112: 1 | B112: 106 | C112: 92888 | D112: 3 | E112: =RC[-2] -> 92888 | F112: =IF(RC[-4]=1,0,R[-1]C+R[-1]C[-3]) -> 3152702
A113: 1 | B113: 107 | C113: 94560 | D113: 3 | E113: =RC[-2] -> 94560 | F113: =IF(RC[-4]=1,0,R[-1]C+R[-1]C[-3]) -> 3245590
A114: 1 | B114: 108 | C114: 96248 | D114: 3 | E114: =RC[-2] -> 96248 | F114: =IF(RC[-4]=1,0,R[-1]C+R[-1]C[-3]) -> 3340150
A115: 1 | B115: 109 | C115: 97950 | D115: 3 | E115: =RC[-2] -> 97950 | F115: =IF(RC[-4]=1,0,R[-1]C+R[-1]C[-3]) -> 3436398
A116: 1 | B116: 110 | C116: 99668 | D116: 3 | E116: =RC[-2] -> 99668 | F116: =IF(RC[-4]=1,0,R[-1]C+R[-1]C[-3]) -> 3534348
A117: 1 | B117: 111 | C117: 101400 | D117: 3 | E117: =RC[-2] -> 101400 | F117: =IF(RC[-4]=1,0,R[-1]C+R[-1]C[-3]) -> 3634016
A118: 1 | B118: 112 | C118: 103148 | D118: 3 | E118: =RC[-2] -> 103148 | F118: =IF(RC[-4]=1,0,R[-1]C+R[-1]C[-3]) -> 3735416
A119: 1 | B119: 113 | C119: 104910 | D119: 3 | E119: =RC[-2] -> 104910 | F119: =IF(RC[-4]=1,0,R[-1]C+R[-1]C[-3]) -> 3838564
A120: 1 | B120: 114 | C120: 106688 | D120: 3 | E120: =RC[-2] -> 106688 | F120: =IF(RC[-4]=1,0,R[-1]C+R[-1]C[-3]) -> 3943474
A121: 1 | B121: 115 | C121: 108480 | D121: 3 | E121: =RC[-2] -> 108480 | F121: =IF(RC[-4]=1,0,R[-1]C+R[-1]C[-3]) -> 4050162
A122: 1 | B122: 116 | C122: 110288 | D122: 3 | E122: =RC[-2] -> 110288 | F122: =IF(RC[-4]=1,0,R[-1]C+R[-1]C[-3]) -> 4158642
A123: 1 | B123: 117 | C123: 112110 | D123: 3 | E123: =RC[-2] -> 112110 | F123: =IF(RC[-4]=1,0,R[-1]C+R[-1]C[-3]) -> 4268930
A124: 1 | B124: 118 | C124: 113948 | D124: 3 | E124: =RC[-2] -> 113948 | F124: =IF(RC[-4]=1,0,R[-1]C+R[-1]C[-3]) -> 4381040
A125: 1 | B125: 119 | C125: 115800 | D125: 3 | E125: =RC[-2] -> 115800 | F125: =IF(RC[-4]=1,0,R[-1]C+R[-1]C[-3]) -> 4494988
A126: 1 | B126: 120 | C126: 117668 | D126: 3 | E126: =RC[-2] -> 117668 | F126: =IF(RC[-4]=1,0,R[-1]C+R[-1]C[-3]) -> 4610788
A127: 1 | B127: 121 | C127: 119550 | D127: 3 | E127: =RC[-2] -> 119550 | F127: =IF(RC[-4]=1,0,R[-1]C+R[-1]C[-3]) -> 4728456
A128: 1 | B128: 122 | C128: 121448 | D128: 3 | E128: =RC[-2] -> 121448 | F128: =IF(RC[-4]=1,0,R[-1]C+R[-1]C[-3]) -> 4848006
A129: 1 | B129: 123 | C129: 123360 | D129: 3 | E129: =RC[-2] -> 123360 | F129: =IF(RC[-4]=1,0,R[-1]C+R[-1]C[-3]) -> 4969454
A130: 1 | B130: 124 | C130: 125288 | D130: 3 | E130: =RC[-2] -> 125288 | F130: =IF(RC[-4]=1,0,R[-1]C+R[-1]C[-3]) -> 5092814
A131: 1 | B131: 125 | C131: 127230 | D131: 3 | E131: =RC[-2] -> 127230 | F131: =IF(RC[-4]=1,0,R[-1]C+R[-1]C[-3]) -> 5218102
A132: 1 | B132: 126 | C132: 129188 | D132: 3 | E132: =RC[-2] -> 129188 | F132: =IF(RC[-4]=1,0,R[-1]C+R[-1]C[-3]) -> 5345332
A133: 1 | B133: 127 | C133: 131160 | D133: 3 | E133: =RC[-2] -> 131160 | F133: =IF(RC[-4]=1,0,R[-1]C+R[-1]C[-3]) -> 5474520
A134: 1 | B134: 128 | C134: 133148 | D134: 3 | E134: =RC[-2] -> 133148 | F134: =IF(RC[-4]=1,0,R[-1]C+R[-1]C[-3]) -> 5605680
A135: 1 | B135: 129 | C135: 135150 | D135: 3 | E135: =RC[-2] -> 135150 | F135: =IF(RC[-4]=1,0,R[-1]C+R[-1]C[-3]) -> 5738828
A136: 1 | B136: 130 | C136: 137168 | D136: 3 | E136: =RC[-2] -> 137168 | F136: =IF(RC[-4]=1,0,R[-1]C+R[-1]C[-3]) -> 5873978
A137: 1 | B137: 131 | C137: 139200 | D137: 3 | E137: =RC[-2] -> 139200 | F137: =IF(RC[-4]=1,0,R[-1]C+R[-1]C[-3]) -> 6011146
A138: 1 | B138: 132 | C138: 141248 | D138: 3 | E138: =RC[-2] -> 141248 | F138: =IF(RC[-4]=1,0,R[-1]C+R[-1]C[-3]) -> 6150346
A139: 1 | B139: 133 | C139: 143310 | D139: 3 | E139: =RC[-2] -> 143310 | F139: =IF(RC[-4]=1,0,R[-1]C+R[-1]C[-3]) -> 6291594
A140: 1 | B140: 134 | C140: 145388 | D140: 3 | E140: =RC[-2] -> 145388 | F140: =IF(RC[-4]=1,0,R[-1]C+R[-1]C[-3]) -> 6434904
A141: 1 | B141: 135 | C141: 147480 | D141: 3 | E141: =RC[-2] -> 147480 | F141: =IF(RC[-4]=1,0,R[-1]C+R[-1]C[-3]) -> 6580292
A142: 1 | B142: 136 | C142: 149588 | D142: 3 | E142: =RC[-2] -> 149588 | F142: =IF(RC[-4]=1,0,R[-1]C+R[-1]C[-3]) -> 6727772
A143: 1 | B143: 137 | C143: 151710 | D143: 3 | E143: =RC[-2] -> 151710 | F143: =IF(RC[-4]=1,0,R[-1]C+R[-1]C[-3]) -> 6877360
A144: 1 | B144: 138 | C144: 153848 | D144: 3 | E144: =RC[-2] -> 153848 | F144: =IF(RC[-4]=1,0,R[-1]C+R[-1]C[-3]) -> 7029070
A145: 1 | B145: 139 | C145: 156000 | D145: 3 | E145: =RC[-2] -> 156000 | F145: =IF(RC[-4]=1,0,R[-1]C+R[-1]C[-3]) -> 7182918
A146: 1 | B146: 140 | C146: 158168 | D146: 3 | E146: =RC[-2] -> 158168 | F146: =IF(RC[-4]=1,0,R[-1]C+R[-1]C[-3]) -> 7338918
A147: 1 | B147: 141 | C147: 160350 | D147: 3 | E147: =RC[-2] -> 160350 | F147: =IF(RC[-4]=1,0,R[-1]C+R[-1]C[-3]) -> 7497086
A148: 1 | B148: 142 | C148: 162548 | D148: 3 | E148: =RC[-2] -> 162548 | F148: =IF(RC[-4]=1,0,R[-1]C+R[-1]C[-3]) -> 7657436
A149: 1 | B149: 143 | C149: 164760 | D149: 3 | E149: =RC[-2] -> 164760 | F149: =IF(RC[-4]=1,0,R[-1]C+R[-1]C[-3]) -> 7819984
A150: 1 | B150: 144 | C150: 166988 | D150: 3 | E150: =RC[-2] -> 166988 | F150: =IF(RC[-4]=1,0,R[-1]C+R[-1]C[-3]) -> 7984744
A151: 1 | B151: 145 | C151: 169230 | D151: 3 | E151: =RC[-2] -> 169230 | F151: =IF(RC[-4]=1,0,R[-1]C+R[-1]C[-3]) -> 8151732
A152: 1 | B152: 146 | C152: 171488 | D152: 3 | E152: =RC[-2] -> 171488 | F152: =IF(RC[-4]=1,0,R[-1]C+R[-1]C[-3]) -> 8320962
A153: 1 | B153: 147 | C153: 173760 | D153: 3 | E153: =RC[-2] -> 173760 | F153: =IF(RC[-4]=1,0,R[-1]C+R[-1]C[-3]) -> 8492450
A154: 1 | B154: 148 | C154: 176048 | D154: 3 | E154: =RC[-2] -> 176048 | F154: =IF(RC[-4]=1,0,R[-1]C+R[-1]C[-3]) -> 8666210
A155: 1 | B155: 149 | C155: 178350 | D155: 3 | E155: =RC[-2] -> 178350 | F155: =IF(RC[-4]=1,0,R[-1]C+R[-1]C[-3]) -> 8842258
A156: 1 | B156: 150 | C156: 180668 | D156: 3 | E156: =RC[-2] -> 180668 | F156: =IF(RC[-4]=1,0,R[-1]C+R[-1]C[-3]) -> 9020608
A157: 1 | B157: 151 | C157: 183000 | D157: 3 | E157: =RC[-2] -> 183000 | F157: =IF(RC[-4]=1,0,R[-1]C+R[-1]C[-3]) -> 9201276
A158: 1 | B158: 152 | C158: 185348 | D158: 3 | E158: =RC[-2] -> 185348 | F158: =IF(RC[-4]=1,0,R[-1]C+R[-1]C[-3]) -> 9384276
A159: 1 | B159: 153 | C159: 187710 | D159: 3 | E159: =RC[-2] -> 187710 | F159: =IF(RC[-4]=1,0,R[-1]C+R[-1]C[-3]) -> 9569624
A160: 1 | B160: 154 | C160: 190088 | D160: 3 | E160: =RC[-2] -> 190088 | F160: =IF(RC[-4]=1,0,R[-1]C+R[-1]C[-3]) -> 9757334
A161: 1 | B161: 155 | C161: 192480 | D161: 3 | E161: =RC[-2] -> 192480 | F161: =IF(RC[-4]=1,0,R[-1]C+R[-1]C[-3]) -> 9947422
A162: 1 | B162: 156 | C162: 194888 | D162: 3 | E162: =RC[-2] -> 194888 | F162: =IF(RC[-4]=1,0,R[-1]C+R[-1]C[-3]) -> 10139902
A163: 1 | B163: 157 | C163: 197310 | D163: 3 | E163: =RC[-2] -> 197310 | F163: =IF(RC[-4]=1,0,R[-1]C+R[-1]C[-3]) -> 10334790
A164: 1 | B164: 158 | C164: 199748 | D164: 3 | E164: =RC[-2] -> 199748 | F164: =IF(RC[-4]=1,0,R[-1]C+R[-1]C[-3]) -> 10532100
A165: 1 | B165: 159 | C165: 202200 | D165: 3 | E165: =RC[-2] -> 202200 | F165: =IF(RC[-4]=1,0,R[-1]C+R[-1]C[-3]) -> 10731848
A166: 1 | B166: 160 | C166: 204668 | D166: 3 | E166: =RC[-2] -> 204668 | F166: =IF(RC[-4]=1,0,R[-1]C+R[-1]C[-3]) -> 10934048
A167: 1 | B167: 161 | C167: 207150 | D167: 3 | E167: =RC[-2] -> 207150 | F167: =IF(RC[-4]=1,0,R[-1]C+R[-1]C[-3]) -> 11138716
A168: 1 | B168: 162 | C168: 209648 | D168: 3 | E168: =RC[-2] -> 209648 | F168: =IF(RC[-4]=1,0,R[-1]C+R[-1]C[-3]) -> 11345866
A169: 1 | B169: 163 | C169: 212160 | D169: 3 | E169: =RC[-2] -> 212160 | F169: =IF(RC[-4]=1,0,R[-1]C+R[-1]C[-3]) -> 11555514
A170: 1 | B170: 164 | C170: 214688 | D170: 3 | E170: =RC[-2] -> 214688 | F170: =IF(RC[-4]=1,0,R[-1]C+R[-1]C[-3]) -> 11767674
A171: 1 | B171: 165 | C171: 217230 | D171: 3 | E171: =RC[-2] -> 217230 | F171: =IF(RC[-4]=1,0,R[-1]C+R[-1]C[-3]) -> 11982362
A172: 1 | B172: 166 | C172: 219788 | D172: 3 | E172: =RC[-2] -> 219788 | F172: =IF(RC[-4]=1,0,R[-1]C+R[-1]C[-3]) -> 12199592
A173: 1 | B173: 167 | C173: 222360 | D173: 3 | E173: =RC[-2] -> 222360 | F173: =IF(RC[-4]=1,0,R[-1]C+R[-1]C[-3]) -> 12419380
A174: 1 | B174: 168 | C174: 224948 | D174: 3 | E174: =RC[-2] -> 224948 | F174: =IF(RC[-4]=1,0,R[-1]C+R[-1]C[-3]) -> 12641740
A175: 1 | B175: 169 | C175: 227550 | D175: 3 | E175: =RC[-2] -> 227550 | F175: =IF(RC[-4]=1,0,R[-1]C+R[-1]C[-3]) -> 12866688
A176: 1 | B176: 170 | C176: 230168 | D176: 3 | E176: =RC[-2] -> 230168 | F176: =IF(RC[-4]=1,0,R[-1]C+R[-1]C[-3]) -> 13094238
A177: 1 | B177: 171 | C177: 232800 | D177: 3 | E177: =RC[-2] -> 232800 | F177: =IF(RC[-4]=1,0,R[-1]C+R[-1]C[-3]) -> 13324406
A178: 1 | B178: 172 | C178: 235448 | D178: 3 | E178: =RC[-2] -> 235448 | F178: =IF(RC[-4]=1,0,R[-1]C+R[-1]C[-3]) -> 13557206
A179: 1 | B179: 173 | C179: 238110 | D179: 3 | E179: =RC[-2] -> 238110 | F179: =IF(RC[-4]=1,0,R[-1]C+R[-1]C[-3]) -> 13792654
A180: 1 | B180: 174 | C180: 240788 | D180: 3 | E180: =RC[-2] -> 240788 | F180: =IF(RC[-4]=1,0,R[-1]C+R[-1]C[-3]) -> 14030764
A181: 1 | B181: 175 | C181: 243480 | D181: 3 | E181: =RC[-2] -> 243480 | F181: =IF(RC[-4]=1,0,R[-1]C+R[-1]C[-3]) -> 14271552
A182: 1 | B182: 176 | C182: 246188 | D182: 3 | E182: =RC[-2] -> 246188 | F182: =IF(RC[-4]=1,0,R[-1]C+R[-1]C[-3]) -> 14515032
A183: 1 | B183: 177 | C183: 248910 | D183: 3 | E183: =RC[-2] -> 248910 | F183: =IF(RC[-4]=1,0,R[-1]C+R[-1]C[-3]) -> 14761220
A184: 1 | B184: 178 | C184: 251648 | D184: 3 | E184: =RC[-2] -> 251648 | F184: =IF(RC[-4]=1,0,R[-1]C+R[-1]C[-3]) -> 15010130
A185: 1 | B185: 179 | C185: 254400 | D185: 3 | E185: =RC[-2] -> 254400 | F185: =IF(RC[-4]=1,0,R[-1]C+R[-1]C[-3]) -> 15261778
A186: 1 | B186: 180 | C186: 257168 | D186: 3 | E186: =RC[-2] -> 257168 | F186: =IF(RC[-4]=1,0,R[-1]C+R[-1]C[-3]) -> 15516178
A187: 1 | B187: 181 | C187: 259950 | D187: 3 | E187: =RC[-2] -> 259950 | F187: =IF(RC[-4]=1,0,R[-1]C+R[-1]C[-3]) -> 15773346
A188: 1 | B188: 182 | C188: 262748 | D188: 3 | E188: =RC[-2] -> 262748 | F188: =IF(RC[-4]=1,0,R[-1]C+R[-1]C[-3]) -> 16033296
A189: 1 | B189: 183 | C189: 265560 | D189: 3 | E189: =RC[-2] -> 265560 | F189: =IF(RC[-4]=1,0,R[-1]C+R[-1]C[-3]) -> 16296044
A190: 1 | B190: 184 | C190: 268388 | D190: 3 | E190: =RC[-2] -> 268388 | F190: =IF(RC[-4]=1,0,R[-1]C+R[-1]C[-3]) -> 16561604
A191: 1 | B191: 185 | C191: 271230 | D191: 3 | E191: =RC[-2] -> 271230 | F191: =IF(RC[-4]=1,0,R[-1]C+R[-1]C[-3]) -> 16829992
A192: 1 | B192: 186 | C192: 274088 | D192: 3 | E192: =RC[-2] -> 274088 | F192: =IF(RC[-4]=1,0,R[-1]C+R[-1]C[-3]) -> 17101222
A193: 1 | B193: 187 | C193: 276960 | D193: 3 | E193: =RC[-2] -> 276960 | F193: =IF(RC[-4]=1,0,R[-1]C+R[-1]C[-3]) -> 17375310
A194: 1 | B194: 188 | C194: 279848 | D194: 3 | E194: =RC[-2] -> 279848 | F194: =IF(RC[-4]=1,0,R[-1]C+R[-1]C[-3]) -> 17652270
A195: 1 | B195: 189 | C195: 282750 | D195: 3 | E195: =RC[-2] -> 282750 | F195: =IF(RC[-4]=1,0,R[-1]C+R[-1]C[-3]) -> 17932118
A196: 1 | B196: 190 | C196: 285668 | D196: 3 | E196: =RC[-2] -> 285668 | F196: =IF(RC[-4]=1,0,R[-1]C+R[-1]C[-3]) -> 18214868
A197: 1 | B197: 191 | C197: 288600 | D197: 3 | E197: =RC[-2] -> 288600 | F197: =IF(RC[-4]=1,0,R[-1]C+R[-1]C[-3]) -> 18500536
A198: 1 | B198: 192 | C198: 291548 | D198: 3 | E198: =RC[-2] -> 291548 | F198: =IF(RC[-4]=1,0,R[-1]C+R[-1]C[-3]) -> 18789136
A199: 1 | B199: 193 | C199: 294510 | D199: 3 | E199: =RC[-2] -> 294510 | F199: =IF(RC[-4]=1,0,R[-1]C+R[-1]C[-3]) -> 19080684
A200: 1 | B200: 194 | C200: 297488 | D200: 3 | E200: =RC[-2] -> 297488 | F200: =IF(RC[-4]=1,0,R[-1]C+R[-1]C[-3]) -> 19375194
A201: 1 | B201: 195 | C201: 300480 | D201: 3 | E201: =RC[-2] -> 300480 | F201: =IF(RC[-4]=1,0,R[-1]C+R[-1]C[-3]) -> 19672682
A202: 1 | B202: 196 | C202: 303488 | D202: 3 | E202: =RC[-2] -> 303488 | F202: =IF(RC[-4]=1,0,R[-1]C+R[-1]C[-3]) -> 19973162
A203: 1 | B203: 197 | C203: 306510 | D203: 3 | E203: =RC[-2] -> 306510 | F203: =IF(RC[-4]=1,0,R[-1]C+R[-1]C[-3]) -> 20276650
A204: 1 | B204: 198 | C204: 309548 | D204: 3 | E204: =RC[-2] -> 309548 | F204: =IF(RC[-4]=1,0,R[-1]C+R[-1]C[-3]) -> 20583160
A205: 1 | B205: 199 | C205: 312600 | D205: 3 | E205: =RC[-2] -> 312600 | F205: =IF(RC[-4]=1,0,R[-1]C+R[-1]C[-3]) -> 20892708
A206: 1 | B206: 200 | C206: 315668 | D206: 3 | E206: =RC[-2] -> 315668 | F206: =IF(RC[-4]=1,0,R[-1]C+R[-1]C[-3]) -> 21205308
A207: 1 | B207: 201 | C207: 318750 | D207: 3 | E207: =RC[-2] -> 318750 | F207: =IF(RC[-4]=1,0,R[-1]C+R[-1]C[-3]) -> 21520976
A208: 1 | B208: 202 | C208: 321848 | D208: 3 | E208: =RC[-2] -> 321848 | F208: =IF(RC[-4]=1,0,R[-1]C+R[-1]C[-3]) -> 21839726
A209: 1 | B209: 203 | C209: 324960 | D209: 3 | E209: =RC[-2] -> 324960 | F209: =IF(RC[-4]=1,0,R[-1]C+R[-1]C[-3]) -> 22161574
A210: 1 | B210: 204 | C210: 328088 | D210: 3 | E210: =RC[-2] -> 328088 | F210: =IF(RC[-4]=1,0,R[-1]C+R[-1]C[-3]) -> 22486534
A211: 1 | B211: 205 | C211: 331230 | D211: 3 | E211: =RC[-2] -> 331230 | F211: =IF(RC[-4]=1,0,R[-1]C+R[-1]C[-3]) -> 22814622
A212: 1 | B212: 206 | C212: 334388 | D212: 3 | E212: =RC[-2] -> 334388 | F212: =IF(RC[-4]=1,0,R[-1]C+R[-1]C[-3]) -> 23145852
A213: 1 | B213: 207 | C213: 337560 | D213: 3 | E213: =RC[-2] -> 337560 | F213: =IF(RC[-4]=1,0,R[-1]C+R[-1]C[-3]) -> 23480240
A214: 1 | B214: 208 | C214: 340748 | D214: 3 | E214: =RC[-2] -> 340748 | F214: =IF(RC[-4]=1,0,R[-1]C+R[-1]C[-3]) -> 23817800
A215: 1 | B215: 209 | C215: 343950 | D215: 3 | E215: =RC[-2] -> 343950 | F215: =IF(RC[-4]=1,0,R[-1]C+R[-1]C[-3]) -> 24158548
A216: 1 | B216: 210 | C216: 347168 | D216: 3 | E216: =RC[-2] -> 347168 | F216: =IF(RC[-4]=1,0,R[-1]C+R[-1]C[-3]) -> 24502498
A217: 1 | B217: 211 | C217: 350400 | D217: 3 | E217: =RC[-2] -> 350400 | F217: =IF(RC[-4]=1,0,R[-1]C+R[-1]C[-3]) -> 24849666
A218: 1 | B218: 212 | C218: 353648 | D218: 3 | E218: =RC[-2] -> 353648 | F218: =IF(RC[-4]=1,0,R[-1]C+R[-1]C[-3]) -> 25200066
A219: 1 | B219: 213 | C219: 356910 | D219: 3 | E219: =RC[-2] -> 356910 | F219: =IF(RC[-4]=1,0,R[-1]C+R[-1]C[-3]) -> 25553714
A220: 1 | B220: 214 | C220: 360188 | D220: 3 | E220: =RC[-2] -> 360188 | F220: =IF(RC[-4]=1,0,R[-1]C+R[-1]C[-3]) -> 25910624
A221: 1 | B221: 215 | C221: 363480 | D221: 3 | E221: =RC[-2] -> 363480 | F221: =IF(RC[-4]=1,0,R[-1]C+R[-1]C[-3]) -> 26270812
A222: 1 | B222: 216 | C222: 366788 | D222: 3 | E222: =RC[-2] -> 366788 | F222: =IF(RC[-4]=1,0,R[-1]C+R[-1]C[-3]) -> 26634292
A223: 1 | B223: 217 | C223: 370110 | D223: 3 | E223: =RC[-2] -> 370110 | F223: =IF(RC[-4]=1,0,R[-1]C+R[-1]C[-3]) -> 27001080
A224: 1 | B224: 218 | C224: 373448 | D224: 3 | E224: =RC[-2] -> 373448 | F224: =IF(RC[-4]=1,0,R[-1]C+R[-1]C[-3]) -> 27371190
A225: 1 | B225: 219 | C225: 376800 | D225: 3 | E225: =RC[-2] -> 376800 | F225: =IF(RC[-4]=1,0,R[-1]C+R[-1]C[-3]) -> 27744638
A226: 1 | B226: 220 | C226: 380168 | D226: 3 | E226: =RC[-2] -> 380168 | F226: =IF(RC[-4]=1,0,R[-1]C+R[-1]C[-3]) -> 28121438
A227: 1 | B227: 221 | C227: 383550 | D227: 3 | E227: =RC[-2] -> 383550 | F227: =IF(RC[-4]=1,0,R[-1]C+R[-1]C[-3]) -> 28501606
A228: 1 | B228: 222 | C228: 386948 | D228: 3 | E228: =RC[-2] -> 386948 | F228: =IF(RC[-4]=1,0,R[-1]C+R[-1]C[-3]) -> 28885156
A229: 1 | B229: 223 | C229: 390360 | D229: 3 | E229: =RC[-2] -> 390360 | F229: =IF(RC[-4]=1,0,R[-1]C+R[-1]C[-3]) -> 29272104
A230: 1 | B230: 224 | C230: 393788 | D230: 3 | E230: =RC[-2] -> 393788 | F230: =IF(RC[-4]=1,0,R[-1]C+R[-1]C[-3]) -> 29662464
A231: 1 | B231: 225 | C231: 397230 | D231: 3 | E231: =RC[-2] -> 397230 | F231: =IF(RC[-4]=1,0,R[-1]C+R[-1]C[-3]) -> 30056252
A232: 1 | B232: 226 | C232: 400688 | D232: 3 | E232: =RC[-2] -> 400688 | F232: =IF(RC[-4]=1,0,R[-1]C+R[-1]C[-3]) -> 30453482
A233: 1 | B233: 227 | C233: 404160 | D233: 3 | E233: =RC[-2] -> 404160 | F233: =IF(RC[-4]=1,0,R[-1]C+R[-1]C[-3]) -> 30854170
A234: 1 | B234: 228 | C234: 407648 | D234: 3 | E234: =RC[-2] -> 407648 | F234: =IF(RC[-4]=1,0,R[-1]C+R[-1]C[-3]) -> 31258330
A235: 1 | B235: 229 | C235: 411150 | D235: 3 | E235: =RC[-2] -> 411150 | F235: =IF(RC[-4]=1,0,R[-1]C+R[-1]C[-3]) -> 31665978
A236: 1 | B236: 230 | C236: 414668 | D236: 3 | E236: =RC[-2] -> 414668 | F236: =IF(RC[-4]=1,0,R[-1]C+R[-1]C[-3]) -> 32077128
A237: 1 | B237: 231 | C237: 418200 | D237: 3 | E237: =RC[-2] -> 418200 | F237: =IF(RC[-4]=1,0,R[-1]C+R[-1]C[-3]) -> 32491796
A238: 1 | B238: 232 | C238: 421748 | D238: 3 | E238: =RC[-2] -> 421748 | F238: =IF(RC[-4]=1,0,R[-1]C+R[-1]C[-3]) -> 32909996
A239: 1 | B239: 233 | C239: 425310 | D239: 3 | E239: =RC[-2] -> 425310 | F239: =IF(RC[-4]=1,0,R[-1]C+R[-1]C[-3]) -> 33331744
A240: 1 | B240: 234 | C240: 428888 | D240: 3 | E240: =RC[-2] -> 428888 | F240: =IF(RC[-4]=1,0,R[-1]C+R[-1]C[-3]) -> 33757054
A241: 1 | B241: 235 | C241: 432480 | D241: 3 | E241: =RC[-2] -> 432480 | F241: =IF(RC[-4]=1,0,R[-1]C+R[-1]C[-3]) -> 34185942
A242: 1 | B242: 236 | C242: 436088 | D242: 3 | E242: =RC[-2] -> 436088 | F242: =IF(RC[-4]=1,0,R[-1]C+R[-1]C[-3]) -> 34618422
A243: 1 | B243: 237 | C243: 439710 | D243: 3 | E243: =RC[-2] -> 439710 | F243: =IF(RC[-4]=1,0,R[-1]C+R[-1]C[-3]) -> 35054510
A244: 1 | B244: 238 | C244: 443348 | D244: 3 | E244: =RC[-2] -> 443348 | F244: =IF(RC[-4]=1,0,R[-1]C+R[-1]C[-3]) -> 35494220
A245: 1 | B245: 239 | C245: 447000 | D245: 3 | E245: =RC[-2] -> 447000 | F245: =IF(RC[-4]=1,0,R[-1]C+R[-1]C[-3]) -> 35937568
A246: 1 | B246: 240 | C246: 450668 | D246: 3 | E246: =RC[-2] -> 450668 | F246: =IF(RC[-4]=1,0,R[-1]C+R[-1]C[-3]) -> 36384568
A247: 1 | B247: 241 | C247: 454350 | D247: 3 | E247: =RC[-2] -> 454350 | F247: =IF(RC[-4]=1,0,R[-1]C+R[-1]C[-3]) -> 36835236
A248: 1 | B248: 242 | C248: 458048 | D248: 3 | E248: =RC[-2] -> 458048 | F248: =IF(RC[-4]=1,0,R[-1]C+R[-1]C[-3]) -> 37289586
A249: 1 | B249: 243 | C249: 461760 | D249: 3 | E249: =RC[-2] -> 461760 | F249: =IF(RC[-4]=1,0,R[-1]C+R[-1]C[-3]) -> 37747634
A250: 1 | B250: 244 | C250: 465488 | D250: 3 | E250: =RC[-2] -> 465488 | F250: =IF(RC[-4]=1,0,R[-1]C+R[-1]C[-3]) -> 38209394
A251: 1 | B251: 245 | C251: 469230 | D251: 3 | E251: =RC[-2] -> 469230 | F251: =IF(RC[-4]=1,0,R[-1]C+R[-1]C[-3]) -> 38674882
A252: 1 | B252: 246 | C252: 472988 | D252: 3 | E252: =RC[-2] -> 472988 | F252: =IF(RC[-4]=1,0,R[-1]C+R[-1]C[-3]) -> 39144112
A253: 1 | B253: 247 | C253: 476760 | D253: 3 | E253: =RC[-2] -> 476760 | F253: =IF(RC[-4]=1,0,R[-1]C+R[-1]C[-3]) -> 39617100
A254: 1 | B254: 248 | C254: 480548 | D254: 3 | E254: =RC[-2] -> 480548 | F254: =IF(RC[-4]=1,0,R[-1]C+R[-1]C[-3]) -> 40093860
A255: 1 | B255: 249 | C255: 484350 | D255: 3 | E255: =RC[-2] -> 484350 | F255: =IF(RC[-4]=1,0,R[-1]C+R[-1]C[-3]) -> 40574408
A256: 1 | B256: 250 | C256: 488168 | D256: 3 | E256: =RC[-2] -> 488168 | F256: =IF(RC[-4]=1,0,R[-1]C+R[-1]C[-3]) -> 41058758
A257: 1 | B257: 251 | C257: 492000 | D257: 3 | E257: =RC[-2] -> 492000 | F257: =IF(RC[-4]=1,0,R[-1]C+R[-1]C[-3]) -> 41546926
A258: 1 | B258: 252 | C258: 495848 | D258: 3 | E258: =RC[-2] -> 495848 | F258: =IF(RC[-4]=1,0,R[-1]C+R[-1]C[-3]) -> 42038926
A259: 1 | B259: 253 | C259: 499710 | D259: 3 | E259: =RC[-2] -> 499710 | F259: =IF(RC[-4]=1,0,R[-1]C+R[-1]C[-3]) -> 42534774
A260: 1 | B260: 254 | C260: 503588 | D260: 3 | E260: =RC[-2] -> 503588 | F260: =IF(RC[-4]=1,0,R[-1]C+R[-1]C[-3]) -> 43034484
A261: 1 | B261: 255 | C261: 507480 | D261: 3 | E261: =RC[-2] -> 507480 | F261: =IF(RC[-4]=1,0,R[-1]C+R[-1]C[-3]) -> 43538072
A262: 1 | B262: 256 | C262: 511388 | D262: 3 | E262: =RC[-2] -> 511388 | F262: =IF(RC[-4]=1,0,R[-1]C+R[-1]C[-3]) -> 44045552
A263: 1 | B263: 257 | C263: 515310 | D263: 3 | E263: =RC[-2] -> 515310 | F263: =IF(RC[-4]=1,0,R[-1]C+R[-1]C[-3]) -> 44556940
A264: 1 | B264: 258 | C264: 519248 | D264: 3 | E264: =RC[-2] -> 519248 | F264: =IF(RC[-4]=1,0,R[-1]C+R[-1]C[-3]) -> 45072250
A265: 1 | B265: 259 | C265: 523200 | D265: 3 | E265: =RC[-2] -> 523200 | F265: =IF(RC[-4]=1,0,R[-1]C+R[-1]C[-3]) -> 45591498
A266: 1 | B266: 260 | C266: 527168 | D266: 3 | E266: =RC[-2] -> 527168 | F266: =IF(RC[-4]=1,0,R[-1]C+R[-1]C[-3]) -> 46114698
A267: 1 | B267: 261 | C267: 531150 | D267: 3 | E267: =RC[-2] -> 531150 | F267: =IF(RC[-4]=1,0,R[-1]C+R[-1]C[-3]) -> 46641866
A268: 1 | B268: 262 | C268: 535148 | D268: 3 | E268: =RC[-2] -> 535148 | F268: =IF(RC[-4]=1,0,R[-1]C+R[-1]C[-3]) -> 47173016
A269: 1 | B269: 263 | C269: 539160 | D269: 3 | E269: =RC[-2] -> 539160 | F269: =IF(RC[-4]=1,0,R[-1]C+R[-1]C[-3]) -> 47708164
A270: 1 | B270: 264 | C270: 543188 | D270: 3 | E270: =RC[-2] -> 543188 | F270: =IF(RC[-4]=1,0,R[-1]C+R[-1]C[-3]) -> 48247324
A271: 1 | B271: 265 | C271: 547230 | D271: 3 | E271: =RC[-2] -> 547230 | F271: =IF(RC[-4]=1,0,R[-1]C+R[-1]C[-3]) -> 48790512
A272: 1 | B272: 266 | C272: 551288 | D272: 3 | E272: =RC[-2] -> 551288 | F272: =IF(RC[-4]=1,0,R[-1]C+R[-1]C[-3]) -> 49337742
A273: 1 | B273: 267 | C273: 555360 | D273: 3 | E273: =RC[-2] -> 555360 | F273: =IF(RC[-4]=1,0,R[-1]C+R[-1]C[-3]) -> 49889030
A274: 1 | B274: 268 | C274: 559448 | D274: 3 | E274: =RC[-2] -> 559448 | F274: =IF(RC[-4]=1,0,R[-1]C+R[-1]C[-3]) -> 50444390
A275: 1 | B275: 269 | C275: 563550 | D275: 3 | E275: =RC[-2] -> 563550 | F275: =IF(RC[-4]=1,0,R[-1]C+R[-1]C[-3]) -> 51003838
A276: 1 | B276: 270 | C276: 567668 | D276: 3 | E276: =RC[-2] -> 567668 | F276: =IF(RC[-4]=1,0,R[-1]C+R[-1]C[-3]) -> 51567388
A277: 1 | B277: 271 | C277: 571800 | D277: 3 | E277: =RC[-2] -> 571800 | F277: =IF(RC[-4]=1,0,R[-1]C+R[-1]C[-3]) -> 52135056
A278: 1 | B278: 272 | C278: 575948 | D278: 3 | E278: =RC[-2] -> 575948 | F278: =IF(RC[-4]=1,0,R[-1]C+R[-1]C[-3]) -> 52706856
A279: 1 | B279: 273 | C279: 580110 | D279: 3 | E279: =RC[-2] -> 580110 | F279: =IF(RC[-4]=1,0,R[-1]C+R[-1]C[-3]) -> 53282804
A280: 1 | B280: 274 | C280: 584288 | D280: 3 | E280: =RC[-2] -> 584288 | F280: =IF(RC[-4]=1,0,R[-1]C+R[-1]C[-3]) -> 53862914
A281: 1 | B281: 275 | C281: 588480 | D281: 3 | E281: =RC[-2] -> 588480 | F281: =IF(RC[-4]=1,0,R[-1]C+R[-1]C[-3]) -> 54447202
A282: 1 | B282: 276 | C282: 592688 | D282: 3 | E282: =RC[-2] -> 592688 | F282: =IF(RC[-4]=1,0,R[-1]C+R[-1]C[-3]) -> 55035682
A283: 1 | B283: 277 | C283: 596910 | D283: 3 | E283: =RC[-2] -> 596910 | F283: =IF(RC[-4]=1,0,R[-1]C+R[-1]C[-3]) -> 55628370
A284: 1 | B284: 278 | C284: 601148 | D284: 3 | E284: =RC[-2] -> 601148 | F284: =IF(RC[-4]=1,0,R[-1]C+R[-1]C[-3]) -> 56225280
A285: 1 | B285: 279 | C285: 605400 | D285: 3 | E285: =RC[-2] -> 605400 | F285: =IF(RC[-4]=1,0,R[-1]C+R[-1]C[-3]) -> 56826428
A286: 1 | B286: 280 | C286: 609668 | D286: 3 | E286: =RC[-2] -> 609668 | F286: =IF(RC[-4]=1,0,R[-1]C+R[-1]C[-3]) -> 57431828
A287: 1 | B287: 281 | C287: 613950 | D287: 3 | E287: =RC[-2] -> 613950 | F287: =IF(RC[-4]=1,0,R[-1]C+R[-1]C[-3]) -> 58041496
A288: 1 | B288: 282 | C288: 618248 | D288: 3 | E288: =RC[-2] -> 618248 | F288: =IF(RC[-4]=1,0,R[-1]C+R[-1]C[-3]) -> 58655446
A289: 1 | B289: 283 | C289: 622560 | D289: 3 | E289: =RC[-2] -> 622560 | F289: =IF(RC[-4]=1,0,R[-1]C+R[-1]C[-3]) -> 59273694
A290: 1 | B290: 284 | C290: 626888 | D290: 3 | E290: =RC[-2] -> 626888 | F290: =IF(RC[-4]=1,0,R[-1]C+R[-1]C[-3]) -> 59896254
A291: 1 | B291: 285 | C291: 631230 | D291: 3 | E291: =RC[-2] -> 631230 | F291: =IF(RC[-4]=1,0,R[-1]C+R[-1]C[-3]) -> 60523142
A292: 1 | B292: 286 | C292: 635588 | D292: 3 | E292: =RC[-2] -> 635588 | F292: =IF(RC[-4]=1,0,R[-1]C+R[-1]C[-3]) -> 61154372
A293: 1 | B293: 287 | C293: 639960 | D293: 3 | E293: =RC[-2] -> 639960 | F293: =IF(RC[-4]=1,0,R[-1]C+R[-1]C[-3]) -> 61789960
A294: 1 | B294: 288 | C294: 644348 | D294: 3 | E294: =RC[-2] -> 644348 | F294: =IF(RC[-4]=1,0,R[-1]C+R[-1]C[-3]) -> 62429920
A295: 1 | B295: 289 | C295: 648750 | D295: 3 | E295: =RC[-2] -> 648750 | F295: =IF(RC[-4]=1,0,R[-1]C+R[-1]C[-3]) -> 63074268
A296: 1 | B296: 290 | C296: 653168 | D296: 3 | E296: =RC[-2] -> 653168 | F296: =IF(RC[-4]=1,0,R[-1]C+R[-1]C[-3]) -> 63723018
A297: 1 | B297: 291 | C297: 657600 | D297: 3 | E297: =RC[-2] -> 657600 | F297: =IF(RC[-4]=1,0,R[-1]C+R[-1]C[-3]) -> 64376186
A298: 1 | B298: 292 | C298: 662048 | D298: 3 | E298: =RC[-2] -> 662048 | F298: =IF(RC[-4]=1,0,R[-1]C+R[-1]C[-3]) -> 65033786
A299: 1 | B299: 293 | C299: 666510 | D299: 3 | E299: =RC[-2] -> 666510 | F299: =IF(RC[-4]=1,0,R[-1]C+R[-1]C[-3]) -> 65695834
A300: 1 | B300: 294 | C300: 670988 | D300: 3 | E300: =RC[-2] -> 670988 | F300: =IF(RC[-4]=1,0,R[-1]C+R[-1]C[-3]) -> 66362344
A301: 1 | B301: 295 | C301: 675480 | D301: 3 | E301: =RC[-2] -> 675480 | F301: =IF(RC[-4]=1,0,R[-1]C+R[-1]C[-3]) -> 67033332
A302: 1 | B302: 296 | C302: 679988 | D302: 3 | E302: =RC[-2] -> 679988 | F302: =IF(RC[-4]=1,0,R[-1]C+R[-1]C[-3]) -> 67708812
A303: 1 | B303: 297 | C303: 684510 | D303: 3 | E303: =RC[-2] -> 684510 | F303: =IF(RC[-4]=1,0,R[-1]C+R[-1]C[-3]) -> 68388800
A304: 1 | B304: 298 | C304: 689048 | D304: 3 | E304: =RC[-2] -> 689048 | F304: =IF(RC[-4]=1,0,R[-1]C+R[-1]C[-3]) -> 69073310
A305: 1 | B305: 299 | C305: 693600 | D305: 3 | E305: =RC[-2] -> 693600 | F305: =IF(RC[-4]=1,0,R[-1]C+R[-1]C[-3]) -> 69762358
A306: 1 | B306: 300 | C306: 698168 | D306: 3 | E306: =RC[-2] -> 698168 | F306: =IF(RC[-4]=1,0,R[-1]C+R[-1]C[-3]) -> 70455958
A307: =R[-300]C+1 -> 2 | B307: =R[-300]C -> 1 | C307: 340 | D307: 3 | E307: =RC[-2] -> 340 | F307: =IF(RC[-4]=1,0,R[-1]C+R[-1]C[-3]) -> 0
A308: =R[-300]C+1 -> 2 | B308: =R[-300]C -> 2 | C308: 384 | D308: 3 | E308: =RC[-2] -> 384 | F308: =IF(RC[-4]=1,0,R[-1]C+R[-1]C[-3]) -> 340
A309: =R[-300]C+1 -> 2 | B309: =R[-300]C -> 3 | C309: 435 | D309: 3 | E309: =RC[-2] -> 435 | F309: =IF(RC[-4]=1,0,R[-1]C+R[-1]C[-3]) -> 724
A310: =R[-300]C+1 -> 2 | B310: =R[-300]C -> 4 | C310: 493 | D310: 3 | E310: =RC[-2] -> 493 | F310: =IF(RC[-4]=1,0,R[-1]C+R[-1]C[-3]) -> 1159
A311: =R[-300]C+1 -> 2 | B311: =R[-300]C -> 5 | C311: 558 | D311: 3 | E311: =RC[-2] -> 558 | F311: =IF(RC[-4]=1,0,R[-1]C+R[-1]C[-3]) -> 1652
A312: =R[-300]C+1 -> 2 | B312: =R[-300]C -> 6 | C312: 629 | D312: 3 | E312: =RC[-2] -> 629 | F312: =IF(RC[-4]=1,0,R[-1]C+R[-1]C[-3]) -> 2210
A313: =R[-300]C+1 -> 2 | B313: =R[-300]C -> 7 | C313: 707 | D313: 3 | E313: =RC[-2] -> 707 | F313: =IF(RC[-4]=1,0,R[-1]C+R[-1]C[-3]) -> 2839
A314: =R[-300]C+1 -> 2 | B314: =R[-300]C -> 8 | C314: 792 | D314: 3 | E314: =RC[-2] -> 792 | F314: =IF(RC[-4]=1,0,R[-1]C+R[-1]C[-3]) -> 3546
A315: =R[-300]C+1 -> 2 | B315: =R[-300]C -> 9 | C315: 884 | D315: 3 | E315: =RC[-2] -> 884 | F315: =IF(RC[-4]=1,0,R[-1]C+R[-1]C[-3]) -> 4338
A316: =R[-300]C+1 -> 2 | B316: =R[-300]C -> 10 | C316: 983 | D316: 3 | E316: =RC[-2] -> 983 | F316: =IF(RC[-4]=1,0,R[-1]C+R[-1]C[-3]) -> 5222
A317: =R[-300]C+1 -> 2 | B317: =R[-300]C -> 11 | C317: 1224 | D317: 3 | E317: =RC[-2] -> 1224 | F317: =IF(RC[-4]=1,0,R[-1]C+R[-1]C[-3]) -> 6205
A318: =R[-300]C+1 -> 2 | B318: =R[-300]C -> 12 | C318: 1350 | D318: 3 | E318: =RC[-2] -> 1350 | F318: =IF(RC[-4]=1,0,R[-1]C+R[-1]C[-3]) -> 7429
A319: =R[-300]C+1 -> 2 | B319: =R[-300]C -> 13 | C319: 1484 | D319: 3 | E319: =RC[-2] -> 1484 | F319: =IF(RC[-4]=1,0,R[-1]C+R[-1]C[-3]) -> 8779
A320: =R[-300]C+1 -> 2 | B320: =R[-300]C -> 14 | C320: 1626 | D320: 3 | E320: =RC[-2] -> 1626 | F320: =IF(RC[-4]=1,0,R[-1]C+R[-1]C[-3]) -> 10263
A321: =R[-300]C+1 -> 2 | B321: =R[-300]C -> 15 | C321: 1775 | D321: 3 | E321: =RC[-2] -> 1775 | F321: =IF(RC[-4]=1,0,R[-1]C+R[-1]C[-3]) -> 11889
A322: =R[-300]C+1 -> 2 | B322: =R[-300]C -> 16 | C322: 1932 | D322: 3 | E322: =RC[-2] -> 1932 | F322: =IF(RC[-4]=1,0,R[-1]C+R[-1]C[-3]) -> 13664
A323: =R[-300]C+1 -> 2 | B323: =R[-300]C -> 17 | C323: 2096 | D323: 3 | E323: =RC[-2] -> 2096 | F323: =IF(RC[-4]=1,0,R[-1]C+R[-1]C[-3]) -> 15596
A324: =R[-300]C+1 -> 2 | B324: =R[-300]C -> 18 | C324: 2268 | D324: 3 | E324: =RC[-2] -> 2268 | F324: =IF(RC[-4]=1,0,R[-1]C+R[-1]C[-3]) -> 17692
A325: =R[-300]C+1 -> 2 | B325: =R[-300]C -> 19 | C325: 2448 | D325: 3 | E325: =RC[-2] -> 2448 | F325: =IF(RC[-4]=1,0,R[-1]C+R[-1]C[-3]) -> 19960
A326: =R[-300]C+1 -> 2 | B326: =R[-300]C -> 20 | C326: 2635 | D326: 3 | E326: =RC[-2] -> 2635 | F326: =IF(RC[-4]=1,0,R[-1]C+R[-1]C[-3]) -> 22408
A327: =R[-300]C+1 -> 2 | B327: =R[-300]C -> 21 | C327: 3145 | D327: 3 | E327: =RC[-2] -> 3145 | F327: =IF(RC[-4]=1,0,R[-1]C+R[-1]C[-3]) -> 25043
A328: =R[-300]C+1 -> 2 | B328: =R[-300]C -> 22 | C328: 3370 | D328: 3 | E328: =RC[-2] -> 3370 | F328: =IF(RC[-4]=1,0,R[-1]C+R[-1]C[-3]) -> 28188
A329: =R[-300]C+1 -> 2 | B329: =R[-300]C -> 23 | C329: 3604 | D329: 3 | E329: =RC[-2] -> 3604 | F329: =IF(RC[-4]=1,0,R[-1]C+R[-1]C[-3]) -> 31558
A330: =R[-300]C+1 -> 2 | B330: =R[-300]C -> 24 | C330: 3846 | D330: 3 | E330: =RC[-2] -> 3846 | F330: =IF(RC[-4]=1,0,R[-1]C+R[-1]C[-3]) -> 35162
A331: =R[-300]C+1 -> 2 | B331: =R[-300]C -> 25 | C331: 4097 | D331: 3 | E331: =RC[-2] -> 4097 | F331: =IF(RC[-4]=1,0,R[-1]C+R[-1]C[-3]) -> 39008
A332: =R[-300]C+1 -> 2 | B332: =R[-300]C -> 26 | C332: 4356 | D332: 3 | E332: =RC[-2] -> 4356 | F332: =IF(RC[-4]=1,0,R[-1]C+R[-1]C[-3]) -> 43105
A333: =R[-300]C+1 -> 2 | B333: =R[-300]C -> 27 | C333: 4624 | D333: 3 | E333: =RC[-2] -> 4624 | F333: =IF(RC[-4]=1,0,R[-1]C+R[-1]C[-3]) -> 47461
A334: =R[-300]C+1 -> 2 | B334: =R[-300]C -> 28 | C334: 4900 | D334: 3 | E334: =RC[-2] -> 4900 | F334: =IF(RC[-4]=1,0,R[-1]C+R[-1]C[-3]) -> 52085
A335: =R[-300]C+1 -> 2 | B335: =R[-300]C -> 29 | C335: 5185 | D335: 3 | E335: =RC[-2] -> 5185 | F335: =IF(RC[-4]=1,0,R[-1]C+R[-1]C[-3]) -> 56985
A336: =R[-300]C+1 -> 2 | B336: =R[-300]C -> 30 | C336: 5478 | D336: 3 | E336: =RC[-2] -> 5478 | F336: =IF(RC[-4]=1,0,R[-1]C+R[-1]C[-3]) -> 62170
A337: =R[-300]C+1 -> 2 | B337: =R[-300]C -> 31 | C337: 6936 | D337: 3 | E337: =RC[-2] -> 6936 | F337: =IF(RC[-4]=1,0,R[-1]C+R[-1]C[-3]) -> 67648
A338: =R[-300]C+1 -> 2 | B338: =R[-300]C -> 32 | C338: 7308 | D338: 3 | E338: =RC[-2] -> 7308 | F338: =IF(RC[-4]=1,0,R[-1]C+R[-1]C[-3]) -> 74584
A339: =R[-300]C+1 -> 2 | B339: =R[-300]C -> 33 | C339: 7691 | D339: 3 | E339: =RC[-2] -> 7691 | F339: =IF(RC[-4]=1,0,R[-1]C+R[-1]C[-3]) -> 81892
A340: =R[-300]C+1 -> 2 | B340: =R[-300]C -> 34 | C340: 8084 | D340: 3 | E340: =RC[-2] -> 8084 | F340: =IF(RC[-4]=1,0,R[-1]C+R[-1]C[-3]) -> 89583
A341: =R[-300]C+1 -> 2 | B341: =R[-300]C -> 35 | C341: 8486 | D341: 3 | E341: =RC[-2] -> 8486 | F341: =IF(RC[-4]=1,0,R[-1]C+R[-1]C[-3]) -> 97667
A342: =R[-300]C+1 -> 2 | B342: =R[-300]C -> 36 | C342: 8900 | D342: 3 | E342: =RC[-2] -> 8900 | F342: =IF(RC[-4]=1,0,R[-1]C+R[-1]C[-3]) -> 106153
A343: =R[-300]C+1 -> 2 | B343: =R[-300]C -> 37 | C343: 9323 | D343: 3 | E343: =RC[-2] -> 9323 | F343: =IF(RC[-4]=1,0,R[-1]C+R[-1]C[-3]) -> 115053
A344: =R[-300]C+1 -> 2 | B344: =R[-300]C -> 38 | C344: 9756 | D344: 3 | E344: =RC[-2] -> 9756 | F344: =IF(RC[-4]=1,0,R[-1]C+R[-1]C[-3]) -> 124376
A345: =R[-300]C+1 -> 2 | B345: =R[-300]C -> 39 | C345: 10200 | D345: 3 | E345: =RC[-2] -> 10200 | F345: =IF(RC[-4]=1,0,R[-1]C+R[-1]C[-3]) -> 134132
A346: =R[-300]C+1 -> 2 | B346: =R[-300]C -> 40 | C346: 10654 | D346: 3 | E346: =RC[-2] -> 10654 | F346: =IF(RC[-4]=1,0,R[-1]C+R[-1]C[-3]) -> 144332
A347: =R[-300]C+1 -> 2 | B347: =R[-300]C -> 41 | C347: 12971 | D347: 3 | E347: =RC[-2] -> 12971 | F347: =IF(RC[-4]=1,0,R[-1]C+R[-1]C[-3]) -> 154986
A348: =R[-300]C+1 -> 2 | B348: =R[-300]C -> 42 | C348: 13524 | D348: 3 | E348: =RC[-2] -> 13524 | F348: =IF(RC[-4]=1,0,R[-1]C+R[-1]C[-3]) -> 167957
A349: =R[-300]C+1 -> 2 | B349: =R[-300]C -> 43 | C349: 14090 | D349: 3 | E349: =RC[-2] -> 14090 | F349: =IF(RC[-4]=1,0,R[-1]C+R[-1]C[-3]) -> 181481
A350: =R[-300]C+1 -> 2 | B350: =R[-300]C -> 44 | C350: 14667 | D350: 3 | E350: =RC[-2] -> 14667 | F350: =IF(RC[-4]=1,0,R[-1]C+R[-1]C[-3]) -> 195571
A351: =R[-300]C+1 -> 2 | B351: =R[-300]C -> 45 | C351: 15256 | D351: 3 | E351: =RC[-2] -> 15256 | F351: =IF(RC[-4]=1,0,R[-1]C+R[-1]C[-3]) -> 210238
A352: =R[-300]C+1 -> 2 | B352: =R[-300]C -> 46 | C352: 15857 | D352: 3 | E352: =RC[-2] -> 15857 | F352: =IF(RC[-4]=1,0,R[-1]C+R[-1]C[-3]) -> 225494
A353: =R[-300]C+1 -> 2 | B353: =R[-300]C -> 47 | C353: 16470 | D353: 3 | E353: =RC[-2] -> 16470 | F353: =IF(RC[-4]=1,0,R[-1]C+R[-1]C[-3]) -> 241351
A354: =R[-300]C+1 -> 2 | B354: =R[-300]C -> 48 | C354: 17094 | D354: 3 | E354: =RC[-2] -> 17094 | F354: =IF(RC[-4]=1,0,R[-1]C+R[-1]C[-3]) -> 257821
A355: =R[-300]C+1 -> 2 | B355: =R[-300]C -> 49 | C355: 17731 | D355: 3 | E355: =RC[-2] -> 17731 | F355: =IF(RC[-4]=1,0,R[-1]C+R[-1]C[-3]) -> 274915
A356: =R[-300]C+1 -> 2 | B356: =R[-300]C -> 50 | C356: 18380 | D356: 3 | E356: =RC[-2] -> 18380 | F356: =IF(RC[-4]=1,0,R[-1]C+R[-1]C[-3]) -> 292646
A357: =R[-300]C+1 -> 2 | B357: =R[-300]C -> 51 | C357: 21760 | D357: 3 | E357: =RC[-2] -> 21760 | F357: =IF(RC[-4]=1,0,R[-1]C+R[-1]C[-3]) -> 311026
A358: =R[-300]C+1 -> 2 | B358: =R[-300]C -> 52 | C358: 22528 | D358: 3 | E358: =RC[-2] -> 22528 | F358: =IF(RC[-4]=1,0,R[-1]C+R[-1]C[-3]) -> 332786
A359: =R[-300]C+1 -> 2 | B359: =R[-300]C -> 53 | C359: 23310 | D359: 3 | E359: =RC[-2] -> 23310 | F359: =IF(RC[-4]=1,0,R[-1]C+R[-1]C[-3]) -> 355314
A360: =R[-300]C+1 -> 2 | B360: =R[-300]C -> 54 | C360: 24106 | D360: 3 | E360: =RC[-2] -> 24106 | F360: =IF(RC[-4]=1,0,R[-1]C+R[-1]C[-3]) -> 378624
A361: =R[-300]C+1 -> 2 | B361: =R[-300]C -> 55 | C361: 24915 | D361: 3 | E361: =RC[-2] -> 24915 | F361: =IF(RC[-4]=1,0,R[-1]C+R[-1]C[-3]) -> 402730
A362: =R[-300]C+1 -> 2 | B362: =R[-300]C -> 56 | C362: 25738 | D362: 3 | E362: =RC[-2] -> 25738 | F362: =IF(RC[-4]=1,0,R[-1]C+R[-1]C[-3]) -> 427645
A363: =R[-300]C+1 -> 2 | B363: =R[-300]C -> 57 | C363: 26574 | D363: 3 | E363: =RC[-2] -> 26574 | F363: =IF(RC[-4]=1,0,R[-1]C+R[-1]C[-3]) -> 453383
A364: =R[-300]C+1 -> 2 | B364: =R[-300]C -> 58 | C364: 27424 | D364: 3 | E364: =RC[-2] -> 27424 | F364: =IF(RC[-4]=1,0,R[-1]C+R[-1]C[-3]) -> 479957
A365: =R[-300]C+1 -> 2 | B365: =R[-300]C -> 59 | C365: 28288 | D365: 3 | E365: =RC[-2] -> 28288 | F365: =IF(RC[-4]=1,0,R[-1]C+R[-1]C[-3]) -> 507381
A366: =R[-300]C+1 -> 2 | B366: =R[-300]C -> 60 | C366: 29165 | D366: 3 | E366: =RC[-2] -> 29165 | F366: =IF(RC[-4]=1,0,R[-1]C+R[-1]C[-3]) -> 535669
A367: =R[-300]C+1 -> 2 | B367: =R[-300]C -> 61 | C367: 33813 | D367: 3 | E367: =RC[-2] -> 33813 | F367: =IF(RC[-4]=1,0,R[-1]C+R[-1]C[-3]) -> 564834
A368: =R[-300]C+1 -> 2 | B368: =R[-300]C -> 62 | C368: 34830 | D368: 3 | E368: =RC[-2] -> 34830 | F368: =IF(RC[-4]=1,0,R[-1]C+R[-1]C[-3]) -> 598647
A369: =R[-300]C+1 -> 2 | B369: =R[-300]C -> 63 | C369: 35863 | D369: 3 | E369: =RC[-2] -> 35863 | F369: =IF(RC[-4]=1,0,R[-1]C+R[-1]C[-3]) -> 633477
A370: =R[-300]C+1 -> 2 | B370: =R[-300]C -> 64 | C370: 36911 | D370: 3 | E370: =RC[-2] -> 36911 | F370: =IF(RC[-4]=1,0,R[-1]C+R[-1]C[-3]) -> 669340
A371: =R[-300]C+1 -> 2 | B371: =R[-300]C -> 65 | C371: 37975 | D371: 3 | E371: =RC[-2] -> 37975 | F371: =IF(RC[-4]=1,0,R[-1]C+R[-1]C[-3]) -> 706251
A372: =R[-300]C+1 -> 2 | B372: =R[-300]C -> 66 | C372: 39053 | D372: 3 | E372: =RC[-2] -> 39053 | F372: =IF(RC[-4]=1,0,R[-1]C+R[-1]C[-3]) -> 744226
A373: =R[-300]C+1 -> 2 | B373: =R[-300]C -> 67 | C373: 40147 | D373: 3 | E373: =RC[-2] -> 40147 | F373: =IF(RC[-4]=1,0,R[-1]C+R[-1]C[-3]) -> 783279
A374: =R[-300]C+1 -> 2 | B374: =R[-300]C -> 68 | C374: 41256 | D374: 3 | E374: =RC[-2] -> 41256 | F374: =IF(RC[-4]=1,0,R[-1]C+R[-1]C[-3]) -> 823426
A375: =R[-300]C+1 -> 2 | B375: =R[-300]C -> 69 | C375: 42381 | D375: 3 | E375: =RC[-2] -> 42381 | F375: =IF(RC[-4]=1,0,R[-1]C+R[-1]C[-3]) -> 864682
A376: =R[-300]C+1 -> 2 | B376: =R[-300]C -> 70 | C376: 43521 | D376: 3 | E376: =RC[-2] -> 43521 | F376: =IF(RC[-4]=1,0,R[-1]C+R[-1]C[-3]) -> 907063
A377: =R[-300]C+1 -> 2 | B377: =R[-300]C -> 71 | C377: 49640 | D377: 3 | E377: =RC[-2] -> 49640 | F377: =IF(RC[-4]=1,0,R[-1]C+R[-1]C[-3]) -> 950584
A378: =R[-300]C+1 -> 2 | B378: =R[-300]C -> 72 | C378: 50941 | D378: 3 | E378: =RC[-2] -> 50941 | F378: =IF(RC[-4]=1,0,R[-1]C+R[-1]C[-3]) -> 1000224
A379: =R[-300]C+1 -> 2 | B379: =R[-300]C -> 73 | C379: 52258 | D379: 3 | E379: =RC[-2] -> 52258 | F379: =IF(RC[-4]=1,0,R[-1]C+R[-1]C[-3]) -> 1051165
A380: =R[-300]C+1 -> 2 | B380: =R[-300]C -> 74 | C380: 53593 | D380: 3 | E380: =RC[-2] -> 53593 | F380: =IF(RC[-4]=1,0,R[-1]C+R[-1]C[-3]) -> 1103423
A381: =R[-300]C+1 -> 2 | B381: =R[-300]C -> 75 | C381: 54944 | D381: 3 | E381: =RC[-2] -> 54944 | F381: =IF(RC[-4]=1,0,R[-1]C+R[-1]C[-3]) -> 1157016
A382: =R[-300]C+1 -> 2 | B382: =R[-300]C -> 76 | C382: 56313 | D382: 3 | E382: =RC[-2] -> 56313 | F382: =IF(RC[-4]=1,0,R[-1]C+R[-1]C[-3]) -> 1211960
A383: =R[-300]C+1 -> 2 | B383: =R[-300]C -> 77 | C383: 57698 | D383: 3 | E383: =RC[-2] -> 57698 | F383: =IF(RC[-4]=1,0,R[-1]C+R[-1]C[-3]) -> 1268273
A384: =R[-300]C+1 -> 2 | B384: =R[-300]C -> 78 | C384: 59101 | D384: 3 | E384: =RC[-2] -> 59101 | F384: =IF(RC[-4]=1,0,R[-1]C+R[-1]C[-3]) -> 1325971
A385: =R[-300]C+1 -> 2 | B385: =R[-300]C -> 79 | C385: 60520 | D385: 3 | E385: =RC[-2] -> 60520 | F385: =IF(RC[-4]=1,0,R[-1]C+R[-1]C[-3]) -> 1385072
A386: =R[-300]C+1 -> 2 | B386: =R[-300]C -> 80 | C386: 61957 | D386: 3 | E386: =RC[-2] -> 61957 | F386: =IF(RC[-4]=1,0,R[-1]C+R[-1]C[-3]) -> 1445592
A387: =R[-300]C+1 -> 2 | B387: =R[-300]C -> 81 | C387: 63410 | D387: 3 | E387: =RC[-2] -> 63410 | F387: =IF(RC[-4]=1,0,R[-1]C+R[-1]C[-3]) -> 1507549
A388: =R[-300]C+1 -> 2 | B388: =R[-300]C -> 82 | C388: 64881 | D388: 3 | E388: =RC[-2] -> 64881 | F388: =IF(RC[-4]=1,0,R[-1]C+R[-1]C[-3]) -> 1570959
A389: =R[-300]C+1 -> 2 | B389: =R[-300]C -> 83 | C389: 66368 | D389: 3 | E389: =RC[-2] -> 66368 | F389: =IF(RC[-4]=1,0,R[-1]C+R[-1]C[-3]) -> 1635840
A390: =R[-300]C+1 -> 2 | B390: =R[-300]C -> 84 | C390: 67873 | D390: 3 | E390: =RC[-2] -> 67873 | F390: =IF(RC[-4]=1,0,R[-1]C+R[-1]C[-3]) -> 1702208
A391: =R[-300]C+1 -> 2 | B391: =R[-300]C -> 85 | C391: 69394 | D391: 3 | E391: =RC[-2] -> 69394 | F391: =IF(RC[-4]=1,0,R[-1]C+R[-1]C[-3]) -> 1770081
A392: =R[-300]C+1 -> 2 | B392: =R[-300]C -> 86 | C392: 70933 | D392: 3 | E392: =RC[-2] -> 70933 | F392: =IF(RC[-4]=1,0,R[-1]C+R[-1]C[-3]) -> 1839475
A393: =R[-300]C+1 -> 2 | B393: =R[-300]C -> 87 | C393: 72488 | D393: 3 | E393: =RC[-2] -> 72488 | F393: =IF(RC[-4]=1,0,R[-1]C+R[-1]C[-3]) -> 1910408
A394: =R[-300]C+1 -> 2 | B394: =R[-300]C -> 88 | C394: 74061 | D394: 3 | E394: =RC[-2] -> 74061 | F394: =IF(RC[-4]=1,0,R[-1]C+R[-1]C[-3]) -> 1982896
A395: =R[-300]C+1 -> 2 | B395: =R[-300]C -> 89 | C395: 75650 | D395: 3 | E395: =RC[-2] -> 75650 | F395: =IF(RC[-4]=1,0,R[-1]C+R[-1]C[-3]) -> 2056957
A396: =R[-300]C+1 -> 2 | B396: =R[-300]C -> 90 | C396: 77257 | D396: 3 | E396: =RC[-2] -> 77257 | F396: =IF(RC[-4]=1,0,R[-1]C+R[-1]C[-3]) -> 2132607
A397: =R[-300]C+1 -> 2 | B397: =R[-300]C -> 91 | C397: 78880 | D397: 3 | E397: =RC[-2] -> 78880 | F397: =IF(RC[-4]=1,0,R[-1]C+R[-1]C[-3]) -> 2209864
A398: =R[-300]C+1 -> 2 | B398: =R[-300]C -> 92 | C398: 80521 | D398: 3 | E398: =RC[-2] -> 80521 | F398: =IF(RC[-4]=1,0,R[-1]C+R[-1]C[-3]) -> 2288744
A399: =R[-300]C+1 -> 2 | B399: =R[-300]C -> 93 | C399: 82178 | D399: 3 | E399: =RC[-2] -> 82178 | F399: =IF(RC[-4]=1,0,R[-1]C+R[-1]C[-3]) -> 2369265
A400: =R[-300]C+1 -> 2 | B400: =R[-300]C -> 94 | C400: 83853 | D400: 3 | E400: =RC[-2] -> 83853 | F400: =IF(RC[-4]=1,0,R[-1]C+R[-1]C[-3]) -> 2451443
A401: =R[-300]C+1 -> 2 | B401: =R[-300]C -> 95 | C401: 85544 | D401: 3 | E401: =RC[-2] -> 85544 | F401: =IF(RC[-4]=1,0,R[-1]C+R[-1]C[-3]) -> 2535296
A402: =R[-300]C+1 -> 2 | B402: =R[-300]C -> 96 | C402: 87253 | D402: 3 | E402: =RC[-2] -> 87253 | F402: =IF(RC[-4]=1,0,R[-1]C+R[-1]C[-3]) -> 2620840
A403: =R[-300]C+1 -> 2 | B403: =R[-300]C -> 97 | C403: 88978 | D403: 3 | E403: =RC[-2] -> 88978 | F403: =IF(RC[-4]=1,0,R[-1]C+R[-1]C[-3]) -> 2708093
A404: =R[-300]C+1 -> 2 | B404: =R[-300]C -> 98 | C404: 90721 | D404: 3 | E404: =RC[-2] -> 90721 | F404: =IF(RC[-4]=1,0,R[-1]C+R[-1]C[-3]) -> 2797071
A405: =R[-300]C+1 -> 2 | B405: =R[-300]C -> 99 | C405: 92480 | D405: 3 | E405: =RC[-2] -> 92480 | F405: =IF(RC[-4]=1,0,R[-1]C+R[-1]C[-3]) -> 2887792
A406: =R[-300]C+1 -> 2 | B406: =R[-300]C -> 100 | C406: 94257 | D406: 3 | E406: =RC[-2] -> 94257 | F406: =IF(RC[-4]=1,0,R[-1]C+R[-1]C[-3]) -> 2980272
A407: =R[-300]C+1 -> 2 | B407: =R[-300]C -> 101 | C407: 96050 | D407: 3 | E407: =RC[-2] -> 96050 | F407: =IF(RC[-4]=1,0,R[-1]C+R[-1]C[-3]) -> 3074529
A408: =R[-300]C+1 -> 2 | B408: =R[-300]C -> 102 | C408: 97861 | D408: 3 | E408: =RC[-2] -> 97861 | F408: =IF(RC[-4]=1,0,R[-1]C+R[-1]C[-3]) -> 3170579
A409: =R[-300]C+1 -> 2 | B409: =R[-300]C -> 103 | C409: 99688 | D409: 3 | E409: =RC[-2] -> 99688 | F409: =IF(RC[-4]=1,0,R[-1]C+R[-1]C[-3]) -> 3268440
A410: =R[-300]C+1 -> 2 | B410: =R[-300]C -> 104 | C410: 101533 | D410: 3 | E410: =RC[-2] -> 101533 | F410: =IF(RC[-4]=1,0,R[-1]C+R[-1]C[-3]) -> 3368128
A411: =R[-300]C+1 -> 2 | B411: =R[-300]C -> 105 | C411: 103394 | D411: 3 | E411: =RC[-2] -> 103394 | F411: =IF(RC[-4]=1,0,R[-1]C+R[-1]C[-3]) -> 3469661
A412: =R[-300]C+1 -> 2 | B412: =R[-300]C -> 106 | C412: 105273 | D412: 3 | E412: =RC[-2] -> 105273 | F412: =IF(RC[-4]=1,0,R[-1]C+R[-1]C[-3]) -> 3573055
A413: =R[-300]C+1 -> 2 | B413: =R[-300]C -> 107 | C413: 107168 | D413: 3 | E413: =RC[-2] -> 107168 | F413: =IF(RC[-4]=1,0,R[-1]C+R[-1]C[-3]) -> 3678328
A414: =R[-300]C+1 -> 2 | B414: =R[-300]C -> 108 | C414: 109081 | D414: 3 | E414: =RC[-2] -> 109081 | F414: =IF(RC[-4]=1,0,R[-1]C+R[-1]C[-3]) -> 3785496
A415: =R[-300]C+1 -> 2 | B415: =R[-300]C -> 109 | C415: 111010 | D415: 3 | E415: =RC[-2] -> 111010 | F415: =IF(RC[-4]=1,0,R[-1]C+R[-1]C[-3]) -> 3894577
A416: =R[-300]C+1 -> 2 | B416: =R[-300]C -> 110 | C416: 112957 | D416: 3 | E416: =RC[-2] -> 112957 | F416: =IF(RC[-4]=1,0,R[-1]C+R[-1]C[-3]) -> 4005587
A417: =R[-300]C+1 -> 2 | B417: =R[-300]C -> 111 | C417: 114920 | D417: 3 | E417: =RC[-2] -> 114920 | F417: =IF(RC[-4]=1,0,R[-1]C+R[-1]C[-3]) -> 4118544
A418: =R[-300]C+1 -> 2 | B418: =R[-300]C -> 112 | C418: 116901 | D418: 3 | E418: =RC[-2] -> 116901 | F418: =IF(RC[-4]=1,0,R[-1]C+R[-1]C[-3]) -> 4233464
A419: =R[-300]C+1 -> 2 | B419: =R[-300]C -> 113 | C419: 118898 | D419: 3 | E419: =RC[-2] -> 118898 | F419: =IF(RC[-4]=1,0,R[-1]C+R[-1]C[-3]) -> 4350365
A420: =R[-300]C+1 -> 2 | B420: =R[-300]C -> 114 | C420: 120913 | D420: 3 | E420: =RC[-2] -> 120913 | F420: =IF(RC[-4]=1,0,R[-1]C+R[-1]C[-3]) -> 4469263
A421: =R[-300]C+1 -> 2 | B421: =R[-300]C -> 115 | C421: 122944 | D421: 3 | E421: =RC[-2] -> 122944 | F421: =IF(RC[-4]=1,0,R[-1]C+R[-1]C[-3]) -> 4590176
A422: =R[-300]C+1 -> 2 | B422: =R[-300]C -> 116 | C422: 124993 | D422: 3 | E422: =RC[-2] -> 124993 | F422: =IF(RC[-4]=1,0,R[-1]C+R[-1]C[-3]) -> 4713120
A423: =R[-300]C+1 -> 2 | B423: =R[-300]C -> 117 | C423: 127058 | D423: 3 | E423: =RC[-2] -> 127058 | F423: =IF(RC[-4]=1,0,R[-1]C+R[-1]C[-3]) -> 4838113
A424: =R[-300]C+1 -> 2 | B424: =R[-300]C -> 118 | C424: 129141 | D424: 3 | E424: =RC[-2] -> 129141 | F424: =IF(RC[-4]=1,0,R[-1]C+R[-1]C[-3]) -> 4965171
A425: =R[-300]C+1 -> 2 | B425: =R[-300]C -> 119 | C425: 131240 | D425: 3 | E425: =RC[-2] -> 131240 | F425: =IF(RC[-4]=1,0,R[-1]C+R[-1]C[-3]) -> 5094312
A426: =R[-300]C+1 -> 2 | B426: =R[-300]C -> 120 | C426: 133357 | D426: 3 | E426: =RC[-2] -> 133357 | F426: =IF(RC[-4]=1,0,R[-1]C+R[-1]C[-3]) -> 5225552
A427: =R[-300]C+1 -> 2 | B427: =R[-300]C -> 121 | C427: 135490 | D427: 3 | E427: =RC[-2] -> 135490 | F427: =IF(RC[-4]=1,0,R[-1]C+R[-1]C[-3]) -> 5358909
A428: =R[-300]C+1 -> 2 | B428: =R[-300]C -> 122 | C428: 137641 | D428: 3 | E428: =RC[-2] -> 137641 | F428: =IF(RC[-4]=1,0,R[-1]C+R[-1]C[-3]) -> 5494399
A429: =R[-300]C+1 -> 2 | B429: =R[-300]C -> 123 | C429: 139808 | D429: 3 | E429: =RC[-2] -> 139808 | F429: =IF(RC[-4]=1,0,R[-1]C+R[-1]C[-3]) -> 5632040
A430: =R[-300]C+1 -> 2 | B430: =R[-300]C -> 124 | C430: 141993 | D430: 3 | E430: =RC[-2] -> 141993 | F430: =IF(RC[-4]=1,0,R[-1]C+R[-1]C[-3]) -> 5771848
A431: =R[-300]C+1 -> 2 | B431: =R[-300]C -> 125 | C431: 144194 | D431: 3 | E431: =RC[-2] -> 144194 | F431: =IF(RC[-4]=1,0,R[-1]C+R[-1]C[-3]) -> 5913841
A432: =R[-300]C+1 -> 2 | B432: =R[-300]C -> 126 | C432: 146413 | D432: 3 | E432: =RC[-2] -> 146413 | F432: =IF(RC[-4]=1,0,R[-1]C+R[-1]C[-3]) -> 6058035
A433: =R[-300]C+1 -> 2 | B433: =R[-300]C -> 127 | C433: 148648 | D433: 3 | E433: =RC[-2] -> 148648 | F433: =IF(RC[-4]=1,0,R[-1]C+R[-1]C[-3]) -> 6204448
A434: =R[-300]C+1 -> 2 | B434: =R[-300]C -> 128 | C434: 150901 | D434: 3 | E434: =RC[-2] -> 150901 | F434: =IF(RC[-4]=1,0,R[-1]C+R[-1]C[-3]) -> 6353096
A435: =R[-300]C+1 -> 2 | B435: =R[-300]C -> 129 | C435: 153170 | D435: 3 | E435: =RC[-2] -> 153170 | F435: =IF(RC[-4]=1,0,R[-1]C+R[-1]C[-3]) -> 6503997
A436: =R[-300]C+1 -> 2 | B436: =R[-300]C -> 130 | C436: 155457 | D436: 3 | E436: =RC[-2] -> 155457 | F436: =IF(RC[-4]=1,0,R[-1]C+R[-1]C[-3]) -> 6657167
A437: =R[-300]C+1 -> 2 | B437: =R[-300]C -> 131 | C437: 157760 | D437: 3 | E437: =RC[-2] -> 157760 | F437: =IF(RC[-4]=1,0,R[-1]C+R[-1]C[-3]) -> 6812624
A438: =R[-300]C+1 -> 2 | B438: =R[-300]C -> 132 | C438: 160081 | D438: 3 | E438: =RC[-2] -> 160081 | F438: =IF(RC[-4]=1,0,R[-1]C+R[-1]C[-3]) -> 6970384
A439: =R[-300]C+1 -> 2 | B439: =R[-300]C -> 133 | C439: 162418 | D439: 3 | E439: =RC[-2] -> 162418 | F439: =IF(RC[-4]=1,0,R[-1]C+R[-1]C[-3]) -> 7130465
A440: =R[-300]C+1 -> 2 | B440: =R[-300]C -> 134 | C440: 164773 | D440: 3 | E440: =RC[-2] -> 164773 | F440: =IF(RC[-4]=1,0,R[-1]C+R[-1]C[-3]) -> 7292883
A441: =R[-300]C+1 -> 2 | B441: =R[-300]C -> 135 | C441: 167144 | D441: 3 | E441: =RC[-2] -> 167144 | F441: =IF(RC[-4]=1,0,R[-1]C+R[-1]C[-3]) -> 7457656
A442: =R[-300]C+1 -> 2 | B442: =R[-300]C -> 136 | C442: 169533 | D442: 3 | E442: =RC[-2] -> 169533 | F442: =IF(RC[-4]=1,0,R[-1]C+R[-1]C[-3]) -> 7624800
A443: =R[-300]C+1 -> 2 | B443: =R[-300]C -> 137 | C443: 171938 | D443: 3 | E443: =RC[-2] -> 171938 | F443: =IF(RC[-4]=1,0,R[-1]C+R[-1]C[-3]) -> 7794333
A444: =R[-300]C+1 -> 2 | B444: =R[-300]C -> 138 | C444: 174361 | D444: 3 | E444: =RC[-2] -> 174361 | F444: =IF(RC[-4]=1,0,R[-1]C+R[-1]C[-3]) -> 7966271
A445: =R[-300]C+1 -> 2 | B445: =R[-300]C -> 139 | C445: 176800 | D445: 3 | E445: =RC[-2] -> 176800 | F445: =IF(RC[-4]=1,0,R[-1]C+R[-1]C[-3]) -> 8140632
A446: =R[-300]C+1 -> 2 | B446: =R[-300]C -> 140 | C446: 179257 | D446: 3 | E446: =RC[-2] -> 179257 | F446: =IF(RC[-4]=1,0,R[-1]C+R[-1]C[-3]) -> 8317432
A447: =R[-300]C+1 -> 2 | B447: =R[-300]C -> 141 | C447: 181730 | D447: 3 | E447: =RC[-2] -> 181730 | F447: =IF(RC[-4]=1,0,R[-1]C+R[-1]C[-3]) -> 8496689
A448: =R[-300]C+1 -> 2 | B448: =R[-300]C -> 142 | C448: 184221 | D448: 3 | E448: =RC[-2] -> 184221 | F448: =IF(RC[-4]=1,0,R[-1]C+R[-1]C[-3]) -> 8678419
A449: =R[-300]C+1 -> 2 | B449: =R[-300]C -> 143 | C449: 186728 | D449: 3 | E449: =RC[-2] -> 186728 | F449: =IF(RC[-4]=1,0,R[-1]C+R[-1]C[-3]) -> 8862640
A450: =R[-300]C+1 -> 2 | B450: =R[-300]C -> 144 | C450: 189253 | D450: 3 | E450: =RC[-2] -> 189253 | F450: =IF(RC[-4]=1,0,R[-1]C+R[-1]C[-3]) -> 9049368
A451: =R[-300]C+1 -> 2 | B451: =R[-300]C -> 145 | C451: 191794 | D451: 3 | E451: =RC[-2] -> 191794 | F451: =IF(RC[-4]=1,0,R[-1]C+R[-1]C[-3]) -> 9238621
A452: =R[-300]C+1 -> 2 | B452: =R[-300]C -> 146 | C452: 194353 | D452: 3 | E452: =RC[-2] -> 194353 | F452: =IF(RC[-4]=1,0,R[-1]C+R[-1]C[-3]) -> 9430415
A453: =R[-300]C+1 -> 2 | B453: =R[-300]C -> 147 | C453: 196928 | D453: 3 | E453: =RC[-2] -> 196928 | F453: =IF(RC[-4]=1,0,R[-1]C+R[-1]C[-3]) -> 9624768
A454: =R[-300]C+1 -> 2 | B454: =R[-300]C -> 148 | C454: 199521 | D454: 3 | E454: =RC[-2] -> 199521 | F454: =IF(RC[-4]=1,0,R[-1]C+R[-1]C[-3]) -> 9821696
A455: =R[-300]C+1 -> 2 | B455: =R[-300]C -> 149 | C455: 202130 | D455: 3 | E455: =RC[-2] -> 202130 | F455: =IF(RC[-4]=1,0,R[-1]C+R[-1]C[-3]) -> 10021217
A456: =R[-300]C+1 -> 2 | B456: =R[-300]C -> 150 | C456: 204757 | D456: 3 | E456: =RC[-2] -> 204757 | F456: =IF(RC[-4]=1,0,R[-1]C+R[-1]C[-3]) -> 10223347
A457: =R[-300]C+1 -> 2 | B457: =R[-300]C -> 151 | C457: 207400 | D457: 3 | E457: =RC[-2] -> 207400 | F457: =IF(RC[-4]=1,0,R[-1]C+R[-1]C[-3]) -> 10428104
A458: =R[-300]C+1 -> 2 | B458: =R[-300]C -> 152 | C458: 210061 | D458: 3 | E458: =RC[-2] -> 210061 | F458: =IF(RC[-4]=1,0,R[-1]C+R[-1]C[-3]) -> 10635504
A459: =R[-300]C+1 -> 2 | B459: =R[-300]C -> 153 | C459: 212738 | D459: 3 | E459: =RC[-2] -> 212738 | F459: =IF(RC[-4]=1,0,R[-1]C+R[-1]C[-3]) -> 10845565
A460: =R[-300]C+1 -> 2 | B460: =R[-300]C -> 154 | C460: 215433 | D460: 3 | E460: =RC[-2] -> 215433 | F460: =IF(RC[-4]=1,0,R[-1]C+R[-1]C[-3]) -> 11058303
A461: =R[-300]C+1 -> 2 | B461: =R[-300]C -> 155 | C461: 218144 | D461: 3 | E461: =RC[-2] -> 218144 | F461: =IF(RC[-4]=1,0,R[-1]C+R[-1]C[-3]) -> 11273736
A462: =R[-300]C+1 -> 2 | B462: =R[-300]C -> 156 | C462: 220873 | D462: 3 | E462: =RC[-2] -> 220873 | F462: =IF(RC[-4]=1,0,R[-1]C+R[-1]C[-3]) -> 11491880
A463: =R[-300]C+1 -> 2 | B463: =R[-300]C -> 157 | C463: 223618 | D463: 3 | E463: =RC[-2] -> 223618 | F463: =IF(RC[-4]=1,0,R[-1]C+R[-1]C[-3]) -> 11712753
A464: =R[-300]C+1 -> 2 | B464: =R[-300]C -> 158 | C464: 226381 | D464: 3 | E464: =RC[-2] -> 226381 | F464: =IF(RC[-4]=1,0,R[-1]C+R[-1]C[-3]) -> 11936371
A465: =R[-300]C+1 -> 2 | B465: =R[-300]C -> 159 | C465: 229160 | D465: 3 | E465: =RC[-2] -> 229160 | F465: =IF(RC[-4]=1,0,R[-1]C+R[-1]C[-3]) -> 12162752
A466: =R[-300]C+1 -> 2 | B466: =R[-300]C -> 160 | C466: 231957 | D466: 3 | E466: =RC[-2] -> 231957 | F466: =IF(RC[-4]=1,0,R[-1]C+R[-1]C[-3]) -> 12391912
A467: =R[-300]C+1 -> 2 | B467: =R[-300]C -> 161 | C467: 234770 | D467: 3 | E467: =RC[-2] -> 234770 | F467: =IF(RC[-4]=1,0,R[-1]C+R[-1]C[-3]) -> 12623869
A468: =R[-300]C+1 -> 2 | B468: =R[-300]C -> 162 | C468: 237601 | D468: 3 | E468: =RC[-2] -> 237601 | F468: =IF(RC[-4]=1,0,R[-1]C+R[-1]C[-3]) -> 12858639
A469: =R[-300]C+1 -> 2 | B469: =R[-300]C -> 163 | C469: 240448 | D469: 3 | E469: =RC[-2] -> 240448 | F469: =IF(RC[-4]=1,0,R[-1]C+R[-1]C[-3]) -> 13096240
A470: =R[-300]C+1 -> 2 | B470: =R[-300]C -> 164 | C470: 243313 | D470: 3 | E470: =RC[-2] -> 243313 | F470: =IF(RC[-4]=1,0,R[-1]C+R[-1]C[-3]) -> 13336688
A471: =R[-300]C+1 -> 2 | B471: =R[-300]C -> 165 | C471: 246194 | D471: 3 | E471: =RC[-2] -> 246194 | F471: =IF(RC[-4]=1,0,R[-1]C+R[-1]C[-3]) -> 13580001
A472: =R[-300]C+1 -> 2 | B472: =R[-300]C -> 166 | C472: 249093 | D472: 3 | E472: =RC[-2] -> 249093 | F472: =IF(RC[-4]=1,0,R[-1]C+R[-1]C[-3]) -> 13826195
A473: =R[-300]C+1 -> 2 | B473: =R[-300]C -> 167 | C473: 252008 | D473: 3 | E473: =RC[-2] -> 252008 | F473: =IF(RC[-4]=1,0,R[-1]C+R[-1]C[-3]) -> 14075288
A474: =R[-300]C+1 -> 2 | B474: =R[-300]C -> 168 | C474: 254941 | D474: 3 | E474: =RC[-2] -> 254941 | F474: =IF(RC[-4]=1,0,R[-1]C+R[-1]C[-3]) -> 14327296
A475: =R[-300]C+1 -> 2 | B475: =R[-300]C -> 169 | C475: 257890 | D475: 3 | E475: =RC[-2] -> 257890 | F475: =IF(RC[-4]=1,0,R[-1]C+R[-1]C[-3]) -> 14582237
A476: =R[-300]C+1 -> 2 | B476: =R[-300]C -> 170 | C476: 260857 | D476: 3 | E476: =RC[-2] -> 260857 | F476: =IF(RC[-4]=1,0,R[-1]C+R[-1]C[-3]) -> 14840127
A477: =R[-300]C+1 -> 2 | B477: =R[-300]C -> 171 | C477: 263840 | D477: 3 | E477: =RC[-2] -> 263840 | F477: =IF(RC[-4]=1,0,R[-1]C+R[-1]C[-3]) -> 15100984
A478: =R[-300]C+1 -> 2 | B478: =R[-300]C -> 172 | C478: 266841 | D478: 3 | E478: =RC[-2] -> 266841 | F478: =IF(RC[-4]=1,0,R[-1]C+R[-1]C[-3]) -> 15364824
A479: =R[-300]C+1 -> 2 | B479: =R[-300]C -> 173 | C479: 269858 | D479: 3 | E479: =RC[-2] -> 269858 | F479: =IF(RC[-4]=1,0,R[-1]C+R[-1]C[-3]) -> 15631665
A480: =R[-300]C+1 -> 2 | B480: =R[-300]C -> 174 | C480: 272893 | D480: 3 | E480: =RC[-2] -> 272893 | F480: =IF(RC[-4]=1,0,R[-1]C+R[-1]C[-3]) -> 15901523
A481: =R[-300]C+1 -> 2 | B481: =R[-300]C -> 175 | C481: 275944 | D481: 3 | E481: =RC[-2] -> 275944 | F481: =IF(RC[-4]=1,0,R[-1]C+R[-1]C[-3]) -> 16174416
A482: =R[-300]C+1 -> 2 | B482: =R[-300]C -> 176 | C482: 279013 | D482: 3 | E482: =RC[-2] -> 279013 | F482: =IF(RC[-4]=1,0,R[-1]C+R[-1]C[-3]) -> 16450360
A483: =R[-300]C+1 -> 2 | B483: =R[-300]C -> 177 | C483: 282098 | D483: 3 | E483: =RC[-2] -> 282098 | F483: =IF(RC[-4]=1,0,R[-1]C+R[-1]C[-3]) -> 16729373
A484: =R[-300]C+1 -> 2 | B484: =R[-300]C -> 178 | C484: 285201 | D484: 3 | E484: =RC[-2] -> 285201 | F484: =IF(RC[-4]=1,0,R[-1]C+R[-1]C[-3]) -> 17011471
A485: =R[-300]C+1 -> 2 | B485: =R[-300]C -> 179 | C485: 288320 | D485: 3 | E485: =RC[-2] -> 288320 | F485: =IF(RC[-4]=1,0,R[-1]C+R[-1]C[-3]) -> 17296672
A486: =R[-300]C+1 -> 2 | B486: =R[-300]C -> 180 | C486: 291457 | D486: 3 | E486: =RC[-2] -> 291457 | F486: =IF(RC[-4]=1,0,R[-1]C+R[-1]C[-3]) -> 17584992
A487: =R[-300]C+1 -> 2 | B487: =R[-300]C -> 181 | C487: 294610 | D487: 3 | E487: =RC[-2] -> 294610 | F487: =IF(RC[-4]=1,0,R[-1]C+R[-1]C[-3]) -> 17876449
A488: =R[-300]C+1 -> 2 | B488: =R[-300]C -> 182 | C488: 297781 | D488: 3 | E488: =RC[-2] -> 297781 | F488: =IF(RC[-4]=1,0,R[-1]C+R[-1]C[-3]) -> 18171059
A489: =R[-300]C+1 -> 2 | B489: =R[-300]C -> 183 | C489: 300968 | D489: 3 | E489: =RC[-2] -> 300968 | F489: =IF(RC[-4]=1,0,R[-1]C+R[-1]C[-3]) -> 18468840
A490: =R[-300]C+1 -> 2 | B490: =R[-300]C -> 184 | C490: 304173 | D490: 3 | E490: =RC[-2] -> 304173 | F490: =IF(RC[-4]=1,0,R[-1]C+R[-1]C[-3]) -> 18769808
A491: =R[-300]C+1 -> 2 | B491: =R[-300]C -> 185 | C491: 307394 | D491: 3 | E491: =RC[-2] -> 307394 | F491: =IF(RC[-4]=1,0,R[-1]C+R[-1]C[-3]) -> 19073981
A492: =R[-300]C+1 -> 2 | B492: =R[-300]C -> 186 | C492: 310633 | D492: 3 | E492: =RC[-2] -> 310633 | F492: =IF(RC[-4]=1,0,R[-1]C+R[-1]C[-3]) -> 19381375
A493: =R[-300]C+1 -> 2 | B493: =R[-300]C -> 187 | C493: 313888 | D493: 3 | E493: =RC[-2] -> 313888 | F493: =IF(RC[-4]=1,0,R[-1]C+R[-1]C[-3]) -> 19692008
A494: =R[-300]C+1 -> 2 | B494: =R[-300]C -> 188 | C494: 317161 | D494: 3 | E494: =RC[-2] -> 317161 | F494: =IF(RC[-4]=1,0,R[-1]C+R[-1]C[-3]) -> 20005896
A495: =R[-300]C+1 -> 2 | B495: =R[-300]C -> 189 | C495: 320450 | D495: 3 | E495: =RC[-2] -> 320450 | F495: =IF(RC[-4]=1,0,R[-1]C+R[-1]C[-3]) -> 20323057
A496: =R[-300]C+1 -> 2 | B496: =R[-300]C -> 190 | C496: 323757 | D496: 3 | E496: =RC[-2] -> 323757 | F496: =IF(RC[-4]=1,0,R[-1]C+R[-1]C[-3]) -> 20643507
A497: =R[-300]C+1 -> 2 | B497: =R[-300]C -> 191 | C497: 327080 | D497: 3 | E497: =RC[-2] -> 327080 | F497: =IF(RC[-4]=1,0,R[-1]C+R[-1]C[-3]) -> 20967264
A498: =R[-300]C+1 -> 2 | B498: =R[-300]C -> 192 | C498: 330421 | D498: 3 | E498: =RC[-2] -> 330421 | F498: =IF(RC[-4]=1,0,R[-1]C+R[-1]C[-3]) -> 21294344
A499: =R[-300]C+1 -> 2 | B499: =R[-300]C -> 193 | C499: 333778 | D499: 3 | E499: =RC[-2] -> 333778 | F499: =IF(RC[-4]=1,0,R[-1]C+R[-1]C[-3]) -> 21624765
A500: =R[-300]C+1 -> 2 | B500: =R[-300]C -> 194 | C500: 337153 | D500: 3 | E500: =RC[-2] -> 337153 | F500: =IF(RC[-4]=1,0,R[-1]C+R[-1]C[-3]) -> 21958543
A501: =R[-300]C+1 -> 2 | B501: =R[-300]C -> 195 | C501: 340544 | D501: 3 | E501: =RC[-2] -> 340544 | F501: =IF(RC[-4]=1,0,R[-1]C+R[-1]C[-3]) -> 22295696
A502: =R[-300]C+1 -> 2 | B502: =R[-300]C -> 196 | C502: 343953 | D502: 3 | E502: =RC[-2] -> 343953 | F502: =IF(RC[-4]=1,0,R[-1]C+R[-1]C[-3]) -> 22636240
A503: =R[-300]C+1 -> 2 | B503: =R[-300]C -> 197 | C503: 347378 | D503: 3 | E503: =RC[-2] -> 347378 | F503: =IF(RC[-4]=1,0,R[-1]C+R[-1]C[-3]) -> 22980193
A504: =R[-300]C+1 -> 2 | B504: =R[-300]C -> 198 | C504: 350821 | D504: 3 | E504: =RC[-2] -> 350821 | F504: =IF(RC[-4]=1,0,R[-1]C+R[-1]C[-3]) -> 23327571
A505: =R[-300]C+1 -> 2 | B505: =R[-300]C -> 199 | C505: 354280 | D505: 3 | E505: =RC[-2] -> 354280 | F505: =IF(RC[-4]=1,0,R[-1]C+R[-1]C[-3]) -> 23678392
A506: =R[-300]C+1 -> 2 | B506: =R[-300]C -> 200 | C506: 357757 | D506: 3 | E506: =RC[-2] -> 357757 | F506: =IF(RC[-4]=1,0,R[-1]C+R[-1]C[-3]) -> 24032672
A507: =R[-300]C+1 -> 2 | B507: =R[-300]C -> 201 | C507: 361250 | D507: 3 | E507: =RC[-2] -> 361250 | F507: =IF(RC[-4]=1,0,R[-1]C+R[-1]C[-3]) -> 24390429
A508: =R[-300]C+1 -> 2 | B508: =R[-300]C -> 202 | C508: 364761 | D508: 3 | E508: =RC[-2] -> 364761 | F508: =IF(RC[-4]=1,0,R[-1]C+R[-1]C[-3]) -> 24751679
A509: =R[-300]C+1 -> 2 | B509: =R[-300]C -> 203 | C509: 368288 | D509: 3 | E509: =RC[-2] -> 368288 | F509: =IF(RC[-4]=1,0,R[-1]C+R[-1]C[-3]) -> 25116440
A510: =R[-300]C+1 -> 2 | B510: =R[-300]C -> 204 | C510: 371833 | D510: 3 | E510: =RC[-2] -> 371833 | F510: =IF(RC[-4]=1,0,R[-1]C+R[-1]C[-3]) -> 25484728
A511: =R[-300]C+1 -> 2 | B511: =R[-300]C -> 205 | C511: 375394 | D511: 3 | E511: =RC[-2] -> 375394 | F511: =IF(RC[-4]=1,0,R[-1]C+R[-1]C[-3]) -> 25856561
A512: =R[-300]C+1 -> 2 | B512: =R[-300]C -> 206 | C512: 378973 | D512: 3 | E512: =RC[-2] -> 378973 | F512: =IF(RC[-4]=1,0,R[-1]C+R[-1]C[-3]) -> 26231955
A513: =R[-300]C+1 -> 2 | B513: =R[-300]C -> 207 | C513: 382568 | D513: 3 | E513: =RC[-2] -> 382568 | F513: =IF(RC[-4]=1,0,R[-1]C+R[-1]C[-3]) -> 26610928
A514: =R[-300]C+1 -> 2 | B514: =R[-300]C -> 208 | C514: 386181 | D514: 3 | E514: =RC[-2] -> 386181 | F514: =IF(RC[-4]=1,0,R[-1]C+R[-1]C[-3]) -> 26993496
A515: =R[-300]C+1 -> 2 | B515: =R[-300]C -> 209 | C515: 389810 | D515: 3 | E515: =RC[-2] -> 389810 | F515: =IF(RC[-4]=1,0,R[-1]C+R[-1]C[-3]) -> 27379677
A516: =R[-300]C+1 -> 2 | B516: =R[-300]C -> 210 | C516: 393457 | D516: 3 | E516: =RC[-2] -> 393457 | F516: =IF(RC[-4]=1,0,R[-1]C+R[-1]C[-3]) -> 27769487
A517: =R[-300]C+1 -> 2 | B517: =R[-300]C -> 211 | C517: 397120 | D517: 3 | E517: =RC[-2] -> 397120 | F517: =IF(RC[-4]=1,0,R[-1]C+R[-1]C[-3]) -> 28162944
A518: =R[-300]C+1 -> 2 | B518: =R[-300]C -> 212 | C518: 400801 | D518: 3 | E518: =RC[-2] -> 400801 | F518: =IF(RC[-4]=1,0,R[-1]C+R[-1]C[-3]) -> 28560064
A519: =R[-300]C+1 -> 2 | B519: =R[-300]C -> 213 | C519: 404498 | D519: 3 | E519: =RC[-2] -> 404498 | F519: =IF(RC[-4]=1,0,R[-1]C+R[-1]C[-3]) -> 28960865
A520: =R[-300]C+1 -> 2 | B520: =R[-300]C -> 214 | C520: 408213 | D520: 3 | E520: =RC[-2] -> 408213 | F520: =IF(RC[-4]=1,0,R[-1]C+R[-1]C[-3]) -> 29365363
A521: =R[-300]C+1 -> 2 | B521: =R[-300]C -> 215 | C521: 411944 | D521: 3 | E521: =RC[-2] -> 411944 | F521: =IF(RC[-4]=1,0,R[-1]C+R[-1]C[-3]) -> 29773576
A522: =R[-300]C+1 -> 2 | B522: =R[-300]C -> 216 | C522: 415693 | D522: 3 | E522: =RC[-2] -> 415693 | F522: =IF(RC[-4]=1,0,R[-1]C+R[-1]C[-3]) -> 30185520
A523: =R[-300]C+1 -> 2 | B523: =R[-300]C -> 217 | C523: 419458 | D523: 3 | E523: =RC[-2] -> 419458 | F523: =IF(RC[-4]=1,0,R[-1]C+R[-1]C[-3]) -> 30601213
A524: =R[-300]C+1 -> 2 | B524: =R[-300]C -> 218 | C524: 423241 | D524: 3 | E524: =RC[-2] -> 423241 | F524: =IF(RC[-4]=1,0,R[-1]C+R[-1]C[-3]) -> 31020671
A525: =R[-300]C+1 -> 2 | B525: =R[-300]C -> 219 | C525: 427040 | D525: 3 | E525: =RC[-2] -> 427040 | F525: =IF(RC[-4]=1,0,R[-1]C+R[-1]C[-3]) -> 31443912
A526: =R[-300]C+1 -> 2 | B526: =R[-300]C -> 220 | C526: 430857 | D526: 3 | E526: =RC[-2] -> 430857 | F526: =IF(RC[-4]=1,0,R[-1]C+R[-1]C[-3]) -> 31870952
A527: =R[-300]C+1 -> 2 | B527: =R[-300]C -> 221 | C527: 434690 | D527: 3 | E527: =RC[-2] -> 434690 | F527: =IF(RC[-4]=1,0,R[-1]C+R[-1]C[-3]) -> 32301809
A528: =R[-300]C+1 -> 2 | B528: =R[-300]C -> 222 | C528: 438541 | D528: 3 | E528: =RC[-2] -> 438541 | F528: =IF(RC[-4]=1,0,R[-1]C+R[-1]C[-3]) -> 32736499
A529: =R[-300]C+1 -> 2 | B529: =R[-300]C -> 223 | C529: 442408 | D529: 3 | E529: =RC[-2] -> 442408 | F529: =IF(RC[-4]=1,0,R[-1]C+R[-1]C[-3]) -> 33175040
A530: =R[-300]C+1 -> 2 | B530: =R[-300]C -> 224 | C530: 446293 | D530: 3 | E530: =RC[-2] -> 446293 | F530: =IF(RC[-4]=1,0,R[-1]C+R[-1]C[-3]) -> 33617448
A531: =R[-300]C+1 -> 2 | B531: =R[-300]C -> 225 | C531: 450194 | D531: 3 | E531: =RC[-2] -> 450194 | F531: =IF(RC[-4]=1,0,R[-1]C+R[-1]C[-3]) -> 34063741
A532: =R[-300]C+1 -> 2 | B532: =R[-300]C -> 226 | C532: 454113 | D532: 3 | E532: =RC[-2] -> 454113 | F532: =IF(RC[-4]=1,0,R[-1]C+R[-1]C[-3]) -> 34513935
A533: =R[-300]C+1 -> 2 | B533: =R[-300]C -> 227 | C533: 458048 | D533: 3 | E533: =RC[-2] -> 458048 | F533: =IF(RC[-4]=1,0,R[-1]C+R[-1]C[-3]) -> 34968048
A534: =R[-300]C+1 -> 2 | B534: =R[-300]C -> 228 | C534: 462001 | D534: 3 | E534: =RC[-2] -> 462001 | F534: =IF(RC[-4]=1,0,R[-1]C+R[-1]C[-3]) -> 35426096
A535: =R[-300]C+1 -> 2 | B535: =R[-300]C -> 229 | C535: 465970 | D535: 3 | E535: =RC[-2] -> 465970 | F535: =IF(RC[-4]=1,0,R[-1]C+R[-1]C[-3]) -> 35888097
A536: =R[-300]C+1 -> 2 | B536: =R[-300]C -> 230 | C536: 469957 | D536: 3 | E536: =RC[-2] -> 469957 | F536: =IF(RC[-4]=1,0,R[-1]C+R[-1]C[-3]) -> 36354067
A537: =R[-300]C+1 -> 2 | B537: =R[-300]C -> 231 | C537: 473960 | D537: 3 | E537: =RC[-2] -> 473960 | F537: =IF(RC[-4]=1,0,R[-1]C+R[-1]C[-3]) -> 36824024
A538: =R[-300]C+1 -> 2 | B538: =R[-300]C -> 232 | C538: 477981 | D538: 3 | E538: =RC[-2] -> 477981 | F538: =IF(RC[-4]=1,0,R[-1]C+R[-1]C[-3]) -> 37297984
A539: =R[-300]C+1 -> 2 | B539: =R[-300]C -> 233 | C539: 482018 | D539: 3 | E539: =RC[-2] -> 482018 | F539: =IF(RC[-4]=1,0,R[-1]C+R[-1]C[-3]) -> 37775965
A540: =R[-300]C+1 -> 2 | B540: =R[-300]C -> 234 | C540: 486073 | D540: 3 | E540: =RC[-2] -> 486073 | F540: =IF(RC[-4]=1,0,R[-1]C+R[-1]C[-3]) -> 38257983
A541: =R[-300]C+1 -> 2 | B541: =R[-300]C -> 235 | C541: 490144 | D541: 3 | E541: =RC[-2] -> 490144 | F541: =IF(RC[-4]=1,0,R[-1]C+R[-1]C[-3]) -> 38744056
A542: =R[-300]C+1 -> 2 | B542: =R[-300]C -> 236 | C542: 494233 | D542: 3 | E542: =RC[-2] -> 494233 | F542: =IF(RC[-4]=1,0,R[-1]C+R[-1]C[-3]) -> 39234200
A543: =R[-300]C+1 -> 2 | B543: =R[-300]C -> 237 | C543: 498338 | D543: 3 | E543: =RC[-2] -> 498338 | F543: =IF(RC[-4]=1,0,R[-1]C+R[-1]C[-3]) -> 39728433
A544: =R[-300]C+1 -> 2 | B544: =R[-300]C -> 238 | C544: 502461 | D544: 3 | E544: =RC[-2] -> 502461 | F544: =IF(RC[-4]=1,0,R[-1]C+R[-1]C[-3]) -> 40226771
A545: =R[-300]C+1 -> 2 | B545: =R[-300]C -> 239 | C545: 506600 | D545: 3 | E545: =RC[-2] -> 506600 | F545: =IF(RC[-4]=1,0,R[-1]C+R[-1]C[-3]) -> 40729232
A546: =R[-300]C+1 -> 2 | B546: =R[-300]C -> 240 | C546: 510757 | D546: 3 | E546: =RC[-2] -> 510757 | F546: =IF(RC[-4]=1,0,R[-1]C+R[-1]C[-3]) -> 41235832
A547: =R[-300]C+1 -> 2 | B547: =R[-300]C -> 241 | C547: 514930 | D547: 3 | E547: =RC[-2] -> 514930 | F547: =IF(RC[-4]=1,0,R[-1]C+R[-1]C[-3]) -> 41746589
A548: =R[-300]C+1 -> 2 | B548: =R[-300]C -> 242 | C548: 519121 | D548: 3 | E548: =RC[-2] -> 519121 | F548: =IF(RC[-4]=1,0,R[-1]C+R[-1]C[-3]) -> 42261519
A549: =R[-300]C+1 -> 2 | B549: =R[-300]C -> 243 | C549: 523328 | D549: 3 | E549: =RC[-2] -> 523328 | F549: =IF(RC[-4]=1,0,R[-1]C+R[-1]C[-3]) -> 42780640
A550: =R[-300]C+1 -> 2 | B550: =R[-300]C -> 244 | C550: 527553 | D550: 3 | E550: =RC[-2] -> 527553 | F550: =IF(RC[-4]=1,0,R[-1]C+R[-1]C[-3]) -> 43303968
A551: =R[-300]C+1 -> 2 | B551: =R[-300]C -> 245 | C551: 531794 | D551: 3 | E551: =RC[-2] -> 531794 | F551: =IF(RC[-4]=1,0,R[-1]C+R[-1]C[-3]) -> 43831521
A552: =R[-300]C+1 -> 2 | B552: =R[-300]C -> 246 | C552: 536053 | D552: 3 | E552: =RC[-2] -> 536053 | F552: =IF(RC[-4]=1,0,R[-1]C+R[-1]C[-3]) -> 44363315
A553: =R[-300]C+1 -> 2 | B553: =R[-300]C -> 247 | C553: 540328 | D553: 3 | E553: =RC[-2] -> 540328 | F553: =IF(RC[-4]=1,0,R[-1]C+R[-1]C[-3]) -> 44899368
A554: =R[-300]C+1 -> 2 | B554: =R[-300]C -> 248 | C554: 544621 | D554: 3 | E554: =RC[-2] -> 544621 | F554: =IF(RC[-4]=1,0,R[-1]C+R[-1]C[-3]) -> 45439696
A555: =R[-300]C+1 -> 2 | B555: =R[-300]C -> 249 | C555: 548930 | D555: 3 | E555: =RC[-2] -> 548930 | F555: =IF(RC[-4]=1,0,R[-1]C+R[-1]C[-3]) -> 45984317
A556: =R[-300]C+1 -> 2 | B556: =R[-300]C -> 250 | C556: 553257 | D556: 3 | E556: =RC[-2] -> 553257 | F556: =IF(RC[-4]=1,0,R[-1]C+R[-1]C[-3]) -> 46533247
A557: =R[-300]C+1 -> 2 | B557: =R[-300]C -> 251 | C557: 557600 | D557: 3 | E557: =RC[-2] -> 557600 | F557: =IF(RC[-4]=1,0,R[-1]C+R[-1]C[-3]) -> 47086504
A558: =R[-300]C+1 -> 2 | B558: =R[-300]C -> 252 | C558: 561961 | D558: 3 | E558: =RC[-2] -> 561961 | F558: =IF(RC[-4]=1,0,R[-1]C+R[-1]C[-3]) -> 47644104
A559: =R[-300]C+1 -> 2 | B559: =R[-300]C -> 253 | C559: 566338 | D559: 3 | E559: =RC[-2] -> 566338 | F559: =IF(RC[-4]=1,0,R[-1]C+R[-1]C[-3]) -> 48206065
A560: =R[-300]C+1 -> 2 | B560: =R[-300]C -> 254 | C560: 570733 | D560: 3 | E560: =RC[-2] -> 570733 | F560: =IF(RC[-4]=1,0,R[-1]C+R[-1]C[-3]) -> 48772403
A561: =R[-300]C+1 -> 2 | B561: =R[-300]C -> 255 | C561: 575144 | D561: 3 | E561: =RC[-2] -> 575144 | F561: =IF(RC[-4]=1,0,R[-1]C+R[-1]C[-3]) -> 49343136
A562: =R[-300]C+1 -> 2 | B562: =R[-300]C -> 256 | C562: 579573 | D562: 3 | E562: =RC[-2] -> 579573 | F562: =IF(RC[-4]=1,0,R[-1]C+R[-1]C[-3]) -> 49918280
A563: =R[-300]C+1 -> 2 | B563: =R[-300]C -> 257 | C563: 584018 | D563: 3 | E563: =RC[-2] -> 584018 | F563: =IF(RC[-4]=1,0,R[-1]C+R[-1]C[-3]) -> 50497853
A564: =R[-300]C+1 -> 2 | B564: =R[-300]C -> 258 | C564: 588481 | D564: 3 | E564: =RC[-2] -> 588481 | F564: =IF(RC[-4]=1,0,R[-1]C+R[-1]C[-3]) -> 51081871
A565: =R[-300]C+1 -> 2 | B565: =R[-300]C -> 259 | C565: 592960 | D565: 3 | E565: =RC[-2] -> 592960 | F565: =IF(RC[-4]=1,0,R[-1]C+R[-1]C[-3]) -> 51670352
A566: =R[-300]C+1 -> 2 | B566: =R[-300]C -> 260 | C566: 597457 | D566: 3 | E566: =RC[-2] -> 597457 | F566: =IF(RC[-4]=1,0,R[-1]C+R[-1]C[-3]) -> 52263312
A567: =R[-300]C+1 -> 2 | B567: =R[-300]C -> 261 | C567: 601970 | D567: 3 | E567: =RC[-2] -> 601970 | F567: =IF(RC[-4]=1,0,R[-1]C+R[-1]C[-3]) -> 52860769
A568: =R[-300]C+1 -> 2 | B568: =R[-300]C -> 262 | C568: 606501 | D568: 3 | E568: =RC[-2] -> 606501 | F568: =IF(RC[-4]=1,0,R[-1]C+R[-1]C[-3]) -> 53462739
A569: =R[-300]C+1 -> 2 | B569: =R[-300]C -> 263 | C569: 611048 | D569: 3 | E569: =RC[-2] -> 611048 | F569: =IF(RC[-4]=1,0,R[-1]C+R[-1]C[-3]) -> 54069240
A570: =R[-300]C+1 -> 2 | B570: =R[-300]C -> 264 | C570: 615613 | D570: 3 | E570: =RC[-2] -> 615613 | F570: =IF(RC[-4]=1,0,R[-1]C+R[-1]C[-3]) -> 54680288
A571: =R[-300]C+1 -> 2 | B571: =R[-300]C -> 265 | C571: 620194 | D571: 3 | E571: =RC[-2] -> 620194 | F571: =IF(RC[-4]=1,0,R[-1]C+R[-1]C[-3]) -> 55295901
A572: =R[-300]C+1 -> 2 | B572: =R[-300]C -> 266 | C572: 624793 | D572: 3 | E572: =RC[-2] -> 624793 | F572: =IF(RC[-4]=1,0,R[-1]C+R[-1]C[-3]) -> 55916095
A573: =R[-300]C+1 -> 2 | B573: =R[-300]C -> 267 | C573: 629408 | D573: 3 | E573: =RC[-2] -> 629408 | F573: =IF(RC[-4]=1,0,R[-1]C+R[-1]C[-3]) -> 56540888
A574: =R[-300]C+1 -> 2 | B574: =R[-300]C -> 268 | C574: 634041 | D574: 3 | E574: =RC[-2] -> 634041 | F574: =IF(RC[-4]=1,0,R[-1]C+R[-1]C[-3]) -> 57170296
A575: =R[-300]C+1 -> 2 | B575: =R[-300]C -> 269 | C575: 638690 | D575: 3 | E575: =RC[-2] -> 638690 | F575: =IF(RC[-4]=1,0,R[-1]C+R[-1]C[-3]) -> 57804337
A576: =R[-300]C+1 -> 2 | B576: =R[-300]C -> 270 | C576: 643357 | D576: 3 | E576: =RC[-2] -> 643357 | F576: =IF(RC[-4]=1,0,R[-1]C+R[-1]C[-3]) -> 58443027
A577: =R[-300]C+1 -> 2 | B577: =R[-300]C -> 271 | C577: 648040 | D577: 3 | E577: =RC[-2] -> 648040 | F577: =IF(RC[-4]=1,0,R[-1]C+R[-1]C[-3]) -> 59086384
A578: =R[-300]C+1 -> 2 | B578: =R[-300]C -> 272 | C578: 652741 | D578: 3 | E578: =RC[-2] -> 652741 | F578: =IF(RC[-4]=1,0,R[-1]C+R[-1]C[-3]) -> 59734424
A579: =R[-300]C+1 -> 2 | B579: =R[-300]C -> 273 | C579: 657458 | D579: 3 | E579: =RC[-2] -> 657458 | F579: =IF(RC[-4]=1,0,R[-1]C+R[-1]C[-3]) -> 60387165
A580: =R[-300]C+1 -> 2 | B580: =R[-300]C -> 274 | C580: 662193 | D580: 3 | E580: =RC[-2] -> 662193 | F580: =IF(RC[-4]=1,0,R[-1]C+R[-1]C[-3]) -> 61044623
A581: =R[-300]C+1 -> 2 | B581: =R[-300]C -> 275 | C581: 666944 | D581: 3 | E581: =RC[-2] -> 666944 | F581: =IF(RC[-4]=1,0,R[-1]C+R[-1]C[-3]) -> 61706816
A582: =R[-300]C+1 -> 2 | B582: =R[-300]C -> 276 | C582: 671713 | D582: 3 | E582: =RC[-2] -> 671713 | F582: =IF(RC[-4]=1,0,R[-1]C+R[-1]C[-3]) -> 62373760
A583: =R[-300]C+1 -> 2 | B583: =R[-300]C -> 277 | C583: 676498 | D583: 3 | E583: =RC[-2] -> 676498 | F583: =IF(RC[-4]=1,0,R[-1]C+R[-1]C[-3]) -> 63045473
A584: =R[-300]C+1 -> 2 | B584: =R[-300]C -> 278 | C584: 681301 | D584: 3 | E584: =RC[-2] -> 681301 | F584: =IF(RC[-4]=1,0,R[-1]C+R[-1]C[-3]) -> 63721971
A585: =R[-300]C+1 -> 2 | B585: =R[-300]C -> 279 | C585: 686120 | D585: 3 | E585: =RC[-2] -> 686120 | F585: =IF(RC[-4]=1,0,R[-1]C+R[-1]C[-3]) -> 64403272
A586: =R[-300]C+1 -> 2 | B586: =R[-300]C -> 280 | C586: 690957 | D586: 3 | E586: =RC[-2] -> 690957 | F586: =IF(RC[-4]=1,0,R[-1]C+R[-1]C[-3]) -> 65089392
A587: =R[-300]C+1 -> 2 | B587: =R[-300]C -> 281 | C587: 695810 | D587: 3 | E587: =RC[-2] -> 695810 | F587: =IF(RC[-4]=1,0,R[-1]C+R[-1]C[-3]) -> 65780349
A588: =R[-300]C+1 -> 2 | B588: =R[-300]C -> 282 | C588: 700681 | D588: 3 | E588: =RC[-2] -> 700681 | F588: =IF(RC[-4]=1,0,R[-1]C+R[-1]C[-3]) -> 66476159
A589: =R[-300]C+1 -> 2 | B589: =R[-300]C -> 283 | C589: 705568 | D589: 3 | E589: =RC[-2] -> 705568 | F589: =IF(RC[-4]=1,0,R[-1]C+R[-1]C[-3]) -> 67176840
A590: =R[-300]C+1 -> 2 | B590: =R[-300]C -> 284 | C590: 710473 | D590: 3 | E590: =RC[-2] -> 710473 | F590: =IF(RC[-4]=1,0,R[-1]C+R[-1]C[-3]) -> 67882408
A591: =R[-300]C+1 -> 2 | B591: =R[-300]C -> 285 | C591: 715394 | D591: 3 | E591: =RC[-2] -> 715394 | F591: =IF(RC[-4]=1,0,R[-1]C+R[-1]C[-3]) -> 68592881
A592: =R[-300]C+1 -> 2 | B592: =R[-300]C -> 286 | C592: 720333 | D592: 3 | E592: =RC[-2] -> 720333 | F592: =IF(RC[-4]=1,0,R[-1]C+R[-1]C[-3]) -> 69308275
A593: =R[-300]C+1 -> 2 | B593: =R[-300]C -> 287 | C593: 725288 | D593: 3 | E593: =RC[-2] -> 725288 | F593: =IF(RC[-4]=1,0,R[-1]C+R[-1]C[-3]) -> 70028608
A594: =R[-300]C+1 -> 2 | B594: =R[-300]C -> 288 | C594: 730261 | D594: 3 | E594: =RC[-2] -> 730261 | F594: =IF(RC[-4]=1,0,R[-1]C+R[-1]C[-3]) -> 70753896
A595: =R[-300]C+1 -> 2 | B595: =R[-300]C -> 289 | C595: 735250 | D595: 3 | E595: =RC[-2] -> 735250 | F595: =IF(RC[-4]=1,0,R[-1]C+R[-1]C[-3]) -> 71484157
A596: =R[-300]C+1 -> 2 | B596: =R[-300]C -> 290 | C596: 740257 | D596: 3 | E596: =RC[-2] -> 740257 | F596: =IF(RC[-4]=1,0,R[-1]C+R[-1]C[-3]) -> 72219407
A597: =R[-300]C+1 -> 2 | B597: =R[-300]C -> 291 | C597: 745280 | D597: 3 | E597: =RC[-2] -> 745280 | F597: =IF(RC[-4]=1,0,R[-1]C+R[-1]C[-3]) -> 72959664
A598: =R[-300]C+1 -> 2 | B598: =R[-300]C -> 292 | C598: 750321 | D598: 3 | E598: =RC[-2] -> 750321 | F598: =IF(RC[-4]=1,0,R[-1]C+R[-1]C[-3]) -> 73704944
A599: =R[-300]C+1 -> 2 | B599: =R[-300]C -> 293 | C599: 755378 | D599: 3 | E599: =RC[-2] -> 755378 | F599: =IF(RC[-4]=1,0,R[-1]C+R[-1]C[-3]) -> 74455265
A600: =R[-300]C+1 -> 2 | B600: =R[-300]C -> 294 | C600: 760453 | D600: 3 | E600: =RC[-2] -> 760453 | F600: =IF(RC[-4]=1,0,R[-1]C+R[-1]C[-3]) -> 75210643
A601: =R[-300]C+1 -> 2 | B601: =R[-300]C -> 295 | C601: 765544 | D601: 3 | E601: =RC[-2] -> 765544 | F601: =IF(RC[-4]=1,0,R[-1]C+R[-1]C[-3]) -> 75971096
A602: =R[-300]C+1 -> 2 | B602: =R[-300]C -> 296 | C602: 770653 | D602: 3 | E602: =RC[-2] -> 770653 | F602: =IF(RC[-4]=1,0,R[-1]C+R[-1]C[-3]) -> 76736640
A603: =R[-300]C+1 -> 2 | B603: =R[-300]C -> 297 | C603: 775778 | D603: 3 | E603: =RC[-2] -> 775778 | F603: =IF(RC[-4]=1,0,R[-1]C+R[-1]C[-3]) -> 77507293
A604: =R[-300]C+1 -> 2 | B604: =R[-300]C -> 298 | C604: 780921 | D604: 3 | E604: =RC[-2] -> 780921 | F604: =IF(RC[-4]=1,0,R[-1]C+R[-1]C[-3]) -> 78283071
A605: =R[-300]C+1 -> 2 | B605: =R[-300]C -> 299 | C605: 786080 | D605: 3 | E605: =RC[-2] -> 786080 | F605: =IF(RC[-4]=1,0,R[-1]C+R[-1]C[-3]) -> 79063992
A606: =R[-300]C+1 -> 2 | B606: =R[-300]C -> 300 | C606: 791257 | D606: 3 | E606: =RC[-2] -> 791257 | F606: =IF(RC[-4]=1,0,R[-1]C+R[-1]C[-3]) -> 79850072
A607: =R[-300]C+1 -> 3 | B607: =R[-300]C -> 1 | C607: 400 | D607: 3 | E607: =RC[-2] -> 400 | F607: =IF(RC[-4]=1,0,R[-1]C+R[-1]C[-3]) -> 0
A608: =R[-300]C+1 -> 3 | B608: =R[-300]C -> 2 | C608: 452 | D608: 3 | E608: =RC[-2] -> 452 | F608: =IF(RC[-4]=1,0,R[-1]C+R[-1]C[-3]) -> 400
A609: =R[-300]C+1 -> 3 | B609: =R[-300]C -> 3 | C609: 512 | D609: 3 | E609: =RC[-2] -> 512 | F609: =IF(RC[-4]=1,0,R[-1]C+R[-1]C[-3]) -> 852
A610: =R[-300]C+1 -> 3 | B610: =R[-300]C -> 4 | C610: 580 | D610: 3 | E610: =RC[-2] -> 580 | F610: =IF(RC[-4]=1,0,R[-1]C+R[-1]C[-3]) -> 1364
A611: =R[-300]C+1 -> 3 | B611: =R[-300]C -> 5 | C611: 656 | D611: 3 | E611: =RC[-2] -> 656 | F611: =IF(RC[-4]=1,0,R[-1]C+R[-1]C[-3]) -> 1944
A612: =R[-300]C+1 -> 3 | B612: =R[-300]C -> 6 | C612: 740 | D612: 3 | E612: =RC[-2] -> 740 | F612: =IF(RC[-4]=1,0,R[-1]C+R[-1]C[-3]) -> 2600
A613: =R[-300]C+1 -> 3 | B613: =R[-300]C -> 7 | C613: 832 | D613: 3 | E613: =RC[-2] -> 832 | F613: =IF(RC[-4]=1,0,R[-1]C+R[-1]C[-3]) -> 3340
A614: =R[-300]C+1 -> 3 | B614: =R[-300]C -> 8 | C614: 932 | D614: 3 | E614: =RC[-2] -> 932 | F614: =IF(RC[-4]=1,0,R[-1]C+R[-1]C[-3]) -> 4172
A615: =R[-300]C+1 -> 3 | B615: =R[-300]C -> 9 | C615: 1040 | D615: 3 | E615: =RC[-2] -> 1040 | F615: =IF(RC[-4]=1,0,R[-1]C+R[-1]C[-3]) -> 5104
A616: =R[-300]C+1 -> 3 | B616: =R[-300]C -> 10 | C616: 1156 | D616: 3 | E616: =RC[-2] -> 1156 | F616: =IF(RC[-4]=1,0,R[-1]C+R[-1]C[-3]) -> 6144
A617: =R[-300]C+1 -> 3 | B617: =R[-300]C -> 11 | C617: 1440 | D617: 3 | E617: =RC[-2] -> 1440 | F617: =IF(RC[-4]=1,0,R[-1]C+R[-1]C[-3]) -> 7300
A618: =R[-300]C+1 -> 3 | B618: =R[-300]C -> 12 | C618: 1589 | D618: 3 | E618: =RC[-2] -> 1589 | F618: =IF(RC[-4]=1,0,R[-1]C+R[-1]C[-3]) -> 8740
A619: =R[-300]C+1 -> 3 | B619: =R[-300]C -> 13 | C619: 1746 | D619: 3 | E619: =RC[-2] -> 1746 | F619: =IF(RC[-4]=1,0,R[-1]C+R[-1]C[-3]) -> 10329
A620: =R[-300]C+1 -> 3 | B620: =R[-300]C -> 14 | C620: 1913 | D620: 3 | E620: =RC[-2] -> 1913 | F620: =IF(RC[-4]=1,0,R[-1]C+R[-1]C[-3]) -> 12075
A621: =R[-300]C+1 -> 3 | B621: =R[-300]C -> 15 | C621: 2088 | D621: 3 | E621: =RC[-2] -> 2088 | F621: =IF(RC[-4]=1,0,R[-1]C+R[-1]C[-3]) -> 13988
A622: =R[-300]C+1 -> 3 | B622: =R[-300]C -> 16 | C622: 2273 | D622: 3 | E622: =RC[-2] -> 2273 | F622: =IF(RC[-4]=1,0,R[-1]C+R[-1]C[-3]) -> 16076
A623: =R[-300]C+1 -> 3 | B623: =R[-300]C -> 17 | C623: 2466 | D623: 3 | E623: =RC[-2] -> 2466 | F623: =IF(RC[-4]=1,0,R[-1]C+R[-1]C[-3]) -> 18349
A624: =R[-300]C+1 -> 3 | B624: =R[-300]C -> 18 | C624: 2669 | D624: 3 | E624: =RC[-2] -> 2669 | F624: =IF(RC[-4]=1,0,R[-1]C+R[-1]C[-3]) -> 20815
A625: =R[-300]C+1 -> 3 | B625: =R[-300]C -> 19 | C625: 2880 | D625: 3 | E625: =RC[-2] -> 2880 | F625: =IF(RC[-4]=1,0,R[-1]C+R[-1]C[-3]) -> 23484
A626: =R[-300]C+1 -> 3 | B626: =R[-300]C -> 20 | C626: 3101 | D626: 3 | E626: =RC[-2] -> 3101 | F626: =IF(RC[-4]=1,0,R[-1]C+R[-1]C[-3]) -> 26364
A627: =R[-300]C+1 -> 3 | B627: =R[-300]C -> 21 | C627: 3700 | D627: 3 | E627: =RC[-2] -> 3700 | F627: =IF(RC[-4]=1,0,R[-1]C+R[-1]C[-3]) -> 29465
A628: =R[-300]C+1 -> 3 | B628: =R[-300]C -> 22 | C628: 3965 | D628: 3 | E628: =RC[-2] -> 3965 | F628: =IF(RC[-4]=1,0,R[-1]C+R[-1]C[-3]) -> 33165
A629: =R[-300]C+1 -> 3 | B629: =R[-300]C -> 23 | C629: 4240 | D629: 3 | E629: =RC[-2] -> 4240 | F629: =IF(RC[-4]=1,0,R[-1]C+R[-1]C[-3]) -> 37130
A630: =R[-300]C+1 -> 3 | B630: =R[-300]C -> 24 | C630: 4525 | D630: 3 | E630: =RC[-2] -> 4525 | F630: =IF(RC[-4]=1,0,R[-1]C+R[-1]C[-3]) -> 41370
A631: =R[-300]C+1 -> 3 | B631: =R[-300]C -> 25 | C631: 4820 | D631: 3 | E631: =RC[-2] -> 4820 | F631: =IF(RC[-4]=1,0,R[-1]C+R[-1]C[-3]) -> 45895
A632: =R[-300]C+1 -> 3 | B632: =R[-300]C -> 26 | C632: 5125 | D632: 3 | E632: =RC[-2] -> 5125 | F632: =IF(RC[-4]=1,0,R[-1]C+R[-1]C[-3]) -> 50715
A633: =R[-300]C+1 -> 3 | B633: =R[-300]C -> 27 | C633: 5440 | D633: 3 | E633: =RC[-2] -> 5440 | F633: =IF(RC[-4]=1,0,R[-1]C+R[-1]C[-3]) -> 55840
A634: =R[-300]C+1 -> 3 | B634: =R[-300]C -> 28 | C634: 5765 | D634: 3 | E634: =RC[-2] -> 5765 | F634: =IF(RC[-4]=1,0,R[-1]C+R[-1]C[-3]) -> 61280
A635: =R[-300]C+1 -> 3 | B635: =R[-300]C -> 29 | C635: 6100 | D635: 3 | E635: =RC[-2] -> 6100 | F635: =IF(RC[-4]=1,0,R[-1]C+R[-1]C[-3]) -> 67045
A636: =R[-300]C+1 -> 3 | B636: =R[-300]C -> 30 | C636: 6445 | D636: 3 | E636: =RC[-2] -> 6445 | F636: =IF(RC[-4]=1,0,R[-1]C+R[-1]C[-3]) -> 73145
A637: =R[-300]C+1 -> 3 | B637: =R[-300]C -> 31 | C637: 8160 | D637: 3 | E637: =RC[-2] -> 8160 | F637: =IF(RC[-4]=1,0,R[-1]C+R[-1]C[-3]) -> 79590
A638: =R[-300]C+1 -> 3 | B638: =R[-300]C -> 32 | C638: 8598 | D638: 3 | E638: =RC[-2] -> 8598 | F638: =IF(RC[-4]=1,0,R[-1]C+R[-1]C[-3]) -> 87750
A639: =R[-300]C+1 -> 3 | B639: =R[-300]C -> 33 | C639: 9048 | D639: 3 | E639: =RC[-2] -> 9048 | F639: =IF(RC[-4]=1,0,R[-1]C+R[-1]C[-3]) -> 96348
A640: =R[-300]C+1 -> 3 | B640: =R[-300]C -> 34 | C640: 9510 | D640: 3 | E640: =RC[-2] -> 9510 | F640: =IF(RC[-4]=1,0,R[-1]C+R[-1]C[-3]) -> 105396
A641: =R[-300]C+1 -> 3 | B641: =R[-300]C -> 35 | C641: 9984 | D641: 3 | E641: =RC[-2] -> 9984 | F641: =IF(RC[-4]=1,0,R[-1]C+R[-1]C[-3]) -> 114906
A642: =R[-300]C+1 -> 3 | B642: =R[-300]C -> 36 | C642: 10470 | D642: 3 | E642: =RC[-2] -> 10470 | F642: =IF(RC[-4]=1,0,R[-1]C+R[-1]C[-3]) -> 124890
A643: =R[-300]C+1 -> 3 | B643: =R[-300]C -> 37 | C643: 10968 | D643: 3 | E643: =RC[-2] -> 10968 | F643: =IF(RC[-4]=1,0,R[-1]C+R[-1]C[-3]) -> 135360
A644: =R[-300]C+1 -> 3 | B644: =R[-300]C -> 38 | C644: 11478 | D644: 3 | E644: =RC[-2] -> 11478 | F644: =IF(RC[-4]=1,0,R[-1]C+R[-1]C[-3]) -> 146328
A645: =R[-300]C+1 -> 3 | B645: =R[-300]C -> 39 | C645: 12000 | D645: 3 | E645: =RC[-2] -> 12000 | F645: =IF(RC[-4]=1,0,R[-1]C+R[-1]C[-3]) -> 157806
A646: =R[-300]C+1 -> 3 | B646: =R[-300]C -> 40 | C646: 12534 | D646: 3 | E646: =RC[-2] -> 12534 | F646: =IF(RC[-4]=1,0,R[-1]C+R[-1]C[-3]) -> 169806
A647: =R[-300]C+1 -> 3 | B647: =R[-300]C -> 41 | C647: 15260 | D647: 3 | E647: =RC[-2] -> 15260 | F647: =IF(RC[-4]=1,0,R[-1]C+R[-1]C[-3]) -> 182340
A648: =R[-300]C+1 -> 3 | B648: =R[-300]C -> 42 | C648: 15911 | D648: 3 | E648: =RC[-2] -> 15911 | F648: =IF(RC[-4]=1,0,R[-1]C+R[-1]C[-3]) -> 197600
A649: =R[-300]C+1 -> 3 | B649: =R[-300]C -> 43 | C649: 16576 | D649: 3 | E649: =RC[-2] -> 16576 | F649: =IF(RC[-4]=1,0,R[-1]C+R[-1]C[-3]) -> 213511
A650: =R[-300]C+1 -> 3 | B650: =R[-300]C -> 44 | C650: 17255 | D650: 3 | E650: =RC[-2] -> 17255 | F650: =IF(RC[-4]=1,0,R[-1]C+R[-1]C[-3]) -> 230087
A651: =R[-300]C+1 -> 3 | B651: =R[-300]C -> 45 | C651: 17948 | D651: 3 | E651: =RC[-2] -> 17948 | F651: =IF(RC[-4]=1,0,R[-1]C+R[-1]C[-3]) -> 247342
A652: =R[-300]C+1 -> 3 | B652: =R[-300]C -> 46 | C652: 18655 | D652: 3 | E652: =RC[-2] -> 18655 | F652: =IF(RC[-4]=1,0,R[-1]C+R[-1]C[-3]) -> 265290
A653: =R[-300]C+1 -> 3 | B653: =R[-300]C -> 47 | C653: 19376 | D653: 3 | E653: =RC[-2] -> 19376 | F653: =IF(RC[-4]=1,0,R[-1]C+R[-1]C[-3]) -> 283945
A654: =R[-300]C+1 -> 3 | B654: =R[-300]C -> 48 | C654: 20111 | D654: 3 | E654: =RC[-2] -> 20111 | F654: =IF(RC[-4]=1,0,R[-1]C+R[-1]C[-3]) -> 303321
A655: =R[-300]C+1 -> 3 | B655: =R[-300]C -> 49 | C655: 20860 | D655: 3 | E655: =RC[-2] -> 20860 | F655: =IF(RC[-4]=1,0,R[-1]C+R[-1]C[-3]) -> 323432
A656: =R[-300]C+1 -> 3 | B656: =R[-300]C -> 50 | C656: 21623 | D656: 3 | E656: =RC[-2] -> 21623 | F656: =IF(RC[-4]=1,0,R[-1]C+R[-1]C[-3]) -> 344292
A657: =R[-300]C+1 -> 3 | B657: =R[-300]C -> 51 | C657: 25600 | D657: 3 | E657: =RC[-2] -> 25600 | F657: =IF(RC[-4]=1,0,R[-1]C+R[-1]C[-3]) -> 365915
A658: =R[-300]C+1 -> 3 | B658: =R[-300]C -> 52 | C658: 26504 | D658: 3 | E658: =RC[-2] -> 26504 | F658: =IF(RC[-4]=1,0,R[-1]C+R[-1]C[-3]) -> 391515
A659: =R[-300]C+1 -> 3 | B659: =R[-300]C -> 53 | C659: 27424 | D659: 3 | E659: =RC[-2] -> 27424 | F659: =IF(RC[-4]=1,0,R[-1]C+R[-1]C[-3]) -> 418019
A660: =R[-300]C+1 -> 3 | B660: =R[-300]C -> 54 | C660: 28360 | D660: 3 | E660: =RC[-2] -> 28360 | F660: =IF(RC[-4]=1,0,R[-1]C+R[-1]C[-3]) -> 445443
A661: =R[-300]C+1 -> 3 | B661: =R[-300]C -> 55 | C661: 29312 | D661: 3 | E661: =RC[-2] -> 29312 | F661: =IF(RC[-4]=1,0,R[-1]C+R[-1]C[-3]) -> 473803
A662: =R[-300]C+1 -> 3 | B662: =R[-300]C -> 56 | C662: 30280 | D662: 3 | E662: =RC[-2] -> 30280 | F662: =IF(RC[-4]=1,0,R[-1]C+R[-1]C[-3]) -> 503115
A663: =R[-300]C+1 -> 3 | B663: =R[-300]C -> 57 | C663: 31264 | D663: 3 | E663: =RC[-2] -> 31264 | F663: =IF(RC[-4]=1,0,R[-1]C+R[-1]C[-3]) -> 533395
A664: =R[-300]C+1 -> 3 | B664: =R[-300]C -> 58 | C664: 32264 | D664: 3 | E664: =RC[-2] -> 32264 | F664: =IF(RC[-4]=1,0,R[-1]C+R[-1]C[-3]) -> 564659
A665: =R[-300]C+1 -> 3 | B665: =R[-300]C -> 59 | C665: 33280 | D665: 3 | E665: =RC[-2] -> 33280 | F665: =IF(RC[-4]=1,0,R[-1]C+R[-1]C[-3]) -> 596923
A666: =R[-300]C+1 -> 3 | B666: =R[-300]C -> 60 | C666: 34312 | D666: 3 | E666: =RC[-2] -> 34312 | F666: =IF(RC[-4]=1,0,R[-1]C+R[-1]C[-3]) -> 630203
A667: =R[-300]C+1 -> 3 | B667: =R[-300]C -> 61 | C667: 39780 | D667: 3 | E667: =RC[-2] -> 39780 | F667: =IF(RC[-4]=1,0,R[-1]C+R[-1]C[-3]) -> 664515
A668: =R[-300]C+1 -> 3 | B668: =R[-300]C -> 62 | C668: 40977 | D668: 3 | E668: =RC[-2] -> 40977 | F668: =IF(RC[-4]=1,0,R[-1]C+R[-1]C[-3]) -> 704295
A669: =R[-300]C+1 -> 3 | B669: =R[-300]C -> 63 | C669: 42192 | D669: 3 | E669: =RC[-2] -> 42192 | F669: =IF(RC[-4]=1,0,R[-1]C+R[-1]C[-3]) -> 745272
A670: =R[-300]C+1 -> 3 | B670: =R[-300]C -> 64 | C670: 43425 | D670: 3 | E670: =RC[-2] -> 43425 | F670: =IF(RC[-4]=1,0,R[-1]C+R[-1]C[-3]) -> 787464
A671: =R[-300]C+1 -> 3 | B671: =R[-300]C -> 65 | C671: 44676 | D671: 3 | E671: =RC[-2] -> 44676 | F671: =IF(RC[-4]=1,0,R[-1]C+R[-1]C[-3]) -> 830889
A672: =R[-300]C+1 -> 3 | B672: =R[-300]C -> 66 | C672: 45945 | D672: 3 | E672: =RC[-2] -> 45945 | F672: =IF(RC[-4]=1,0,R[-1]C+R[-1]C[-3]) -> 875565
A673: =R[-300]C+1 -> 3 | B673: =R[-300]C -> 67 | C673: 47232 | D673: 3 | E673: =RC[-2] -> 47232 | F673: =IF(RC[-4]=1,0,R[-1]C+R[-1]C[-3]) -> 921510
A674: =R[-300]C+1 -> 3 | B674: =R[-300]C -> 68 | C674: 48537 | D674: 3 | E674: =RC[-2] -> 48537 | F674: =IF(RC[-4]=1,0,R[-1]C+R[-1]C[-3]) -> 968742
A675: =R[-300]C+1 -> 3 | B675: =R[-300]C -> 69 | C675: 49860 | D675: 3 | E675: =RC[-2] -> 49860 | F675: =IF(RC[-4]=1,0,R[-1]C+R[-1]C[-3]) -> 1017279
A676: =R[-300]C+1 -> 3 | B676: =R[-300]C -> 70 | C676: 51201 | D676: 3 | E676: =RC[-2] -> 51201 | F676: =IF(RC[-4]=1,0,R[-1]C+R[-1]C[-3]) -> 1067139
A677: =R[-300]C+1 -> 3 | B677: =R[-300]C -> 71 | C677: 58400 | D677: 3 | E677: =RC[-2] -> 58400 | F677: =IF(RC[-4]=1,0,R[-1]C+R[-1]C[-3]) -> 1118340
A678: =R[-300]C+1 -> 3 | B678: =R[-300]C -> 72 | C678: 59930 | D678: 3 | E678: =RC[-2] -> 59930 | F678: =IF(RC[-4]=1,0,R[-1]C+R[-1]C[-3]) -> 1176740
A679: =R[-300]C+1 -> 3 | B679: =R[-300]C -> 73 | C679: 61480 | D679: 3 | E679: =RC[-2] -> 61480 | F679: =IF(RC[-4]=1,0,R[-1]C+R[-1]C[-3]) -> 1236670
A680: =R[-300]C+1 -> 3 | B680: =R[-300]C -> 74 | C680: 63050 | D680: 3 | E680: =RC[-2] -> 63050 | F680: =IF(RC[-4]=1,0,R[-1]C+R[-1]C[-3]) -> 1298150
A681: =R[-300]C+1 -> 3 | B681: =R[-300]C -> 75 | C681: 64640 | D681: 3 | E681: =RC[-2] -> 64640 | F681: =IF(RC[-4]=1,0,R[-1]C+R[-1]C[-3]) -> 1361200
A682: =R[-300]C+1 -> 3 | B682: =R[-300]C -> 76 | C682: 66250 | D682: 3 | E682: =RC[-2] -> 66250 | F682: =IF(RC[-4]=1,0,R[-1]C+R[-1]C[-3]) -> 1425840
A683: =R[-300]C+1 -> 3 | B683: =R[-300]C -> 77 | C683: 67880 | D683: 3 | E683: =RC[-2] -> 67880 | F683: =IF(RC[-4]=1,0,R[-1]C+R[-1]C[-3]) -> 1492090
A684: =R[-300]C+1 -> 3 | B684: =R[-300]C -> 78 | C684: 69530 | D684: 3 | E684: =RC[-2] -> 69530 | F684: =IF(RC[-4]=1,0,R[-1]C+R[-1]C[-3]) -> 1559970
A685: =R[-300]C+1 -> 3 | B685: =R[-300]C -> 79 | C685: 71200 | D685: 3 | E685: =RC[-2] -> 71200 | F685: =IF(RC[-4]=1,0,R[-1]C+R[-1]C[-3]) -> 1629500
A686: =R[-300]C+1 -> 3 | B686: =R[-300]C -> 80 | C686: 72890 | D686: 3 | E686: =RC[-2] -> 72890 | F686: =IF(RC[-4]=1,0,R[-1]C+R[-1]C[-3]) -> 1700700
A687: =R[-300]C+1 -> 3 | B687: =R[-300]C -> 81 | C687: 74600 | D687: 3 | E687: =RC[-2] -> 74600 | F687: =IF(RC[-4]=1,0,R[-1]C+R[-1]C[-3]) -> 1773590
A688: =R[-300]C+1 -> 3 | B688: =R[-300]C -> 82 | C688: 76330 | D688: 3 | E688: =RC[-2] -> 76330 | F688: =IF(RC[-4]=1,0,R[-1]C+R[-1]C[-3]) -> 1848190
A689: =R[-300]C+1 -> 3 | B689: =R[-300]C -> 83 | C689: 78080 | D689: 3 | E689: =RC[-2] -> 78080 | F689: =IF(RC[-4]=1,0,R[-1]C+R[-1]C[-3]) -> 1924520
A690: =R[-300]C+1 -> 3 | B690: =R[-300]C -> 84 | C690: 79850 | D690: 3 | E690: =RC[-2] -> 79850 | F690: =IF(RC[-4]=1,0,R[-1]C+R[-1]C[-3]) -> 2002600
A691: =R[-300]C+1 -> 3 | B691: =R[-300]C -> 85 | C691: 81640 | D691: 3 | E691: =RC[-2] -> 81640 | F691: =IF(RC[-4]=1,0,R[-1]C+R[-1]C[-3]) -> 2082450
A692: =R[-300]C+1 -> 3 | B692: =R[-300]C -> 86 | C692: 83450 | D692: 3 | E692: =RC[-2] -> 83450 | F692: =IF(RC[-4]=1,0,R[-1]C+R[-1]C[-3]) -> 2164090
A693: =R[-300]C+1 -> 3 | B693: =R[-300]C -> 87 | C693: 85280 | D693: 3 | E693: =RC[-2] -> 85280 | F693: =IF(RC[-4]=1,0,R[-1]C+R[-1]C[-3]) -> 2247540
A694: =R[-300]C+1 -> 3 | B694: =R[-300]C -> 88 | C694: 87130 | D694: 3 | E694: =RC[-2] -> 87130 | F694: =IF(RC[-4]=1,0,R[-1]C+R[-1]C[-3]) -> 2332820
A695: =R[-300]C+1 -> 3 | B695: =R[-300]C -> 89 | C695: 89000 | D695: 3 | E695: =RC[-2] -> 89000 | F695: =IF(RC[-4]=1,0,R[-1]C+R[-1]C[-3]) -> 2419950
A696: =R[-300]C+1 -> 3 | B696: =R[-300]C -> 90 | C696: 90890 | D696: 3 | E696: =RC[-2] -> 90890 | F696: =IF(RC[-4]=1,0,R[-1]C+R[-1]C[-3]) -> 2508950
A697: =R[-300]C+1 -> 3 | B697: =R[-300]C -> 91 | C697: 92800 | D697: 3 | E697: =RC[-2] -> 92800 | F697: =IF(RC[-4]=1,0,R[-1]C+R[-1]C[-3]) -> 2599840
A698: =R[-300]C+1 -> 3 | B698: =R[-300]C -> 92 | C698: 94730 | D698: 3 | E698: =RC[-2] -> 94730 | F698: =IF(RC[-4]=1,0,R[-1]C+R[-1]C[-3]) -> 2692640
A699: =R[-300]C+1 -> 3 | B699: =R[-300]C -> 93 | C699: 96680 | D699: 3 | E699: =RC[-2] -> 96680 | F699: =IF(RC[-4]=1,0,R[-1]C+R[-1]C[-3]) -> 2787370
A700: =R[-300]C+1 -> 3 | B700: =R[-300]C -> 94 | C700: 98650 | D700: 3 | E700: =RC[-2] -> 98650 | F700: =IF(RC[-4]=1,0,R[-1]C+R[-1]C[-3]) -> 2884050
A701: =R[-300]C+1 -> 3 | B701: =R[-300]C -> 95 | C701: 100640 | D701: 3 | E701: =RC[-2] -> 100640 | F701: =IF(RC[-4]=1,0,R[-1]C+R[-1]C[-3]) -> 2982700
A702: =R[-300]C+1 -> 3 | B702: =R[-300]C -> 96 | C702: 102650 | D702: 3 | E702: =RC[-2] -> 102650 | F702: =IF(RC[-4]=1,0,R[-1]C+R[-1]C[-3]) -> 3083340
A703: =R[-300]C+1 -> 3 | B703: =R[-300]C -> 97 | C703: 104680 | D703: 3 | E703: =RC[-2] -> 104680 | F703: =IF(RC[-4]=1,0,R[-1]C+R[-1]C[-3]) -> 3185990
A704: =R[-300]C+1 -> 3 | B704: =R[-300]C -> 98 | C704: 106730 | D704: 3 | E704: =RC[-2] -> 106730 | F704: =IF(RC[-4]=1,0,R[-1]C+R[-1]C[-3]) -> 3290670
A705: =R[-300]C+1 -> 3 | B705: =R[-300]C -> 99 | C705: 108800 | D705: 3 | E705: =RC[-2] -> 108800 | F705: =IF(RC[-4]=1,0,R[-1]C+R[-1]C[-3]) -> 3397400
A706: =R[-300]C+1 -> 3 | B706: =R[-300]C -> 100 | C706: 110890 | D706: 3 | E706: =RC[-2] -> 110890 | F706: =IF(RC[-4]=1,0,R[-1]C+R[-1]C[-3]) -> 3506200
A707: =R[-300]C+1 -> 3 | B707: =R[-300]C -> 101 | C707: 113000 | D707: 3 | E707: =RC[-2] -> 113000 | F707: =IF(RC[-4]=1,0,R[-1]C+R[-1]C[-3]) -> 3617090
A708: =R[-300]C+1 -> 3 | B708: =R[-300]C -> 102 | C708: 115130 | D708: 3 | E708: =RC[-2] -> 115130 | F708: =IF(RC[-4]=1,0,R[-1]C+R[-1]C[-3]) -> 3730090
A709: =R[-300]C+1 -> 3 | B709: =R[-300]C -> 103 | C709: 117280 | D709: 3 | E709: =RC[-2] -> 117280 | F709: =IF(RC[-4]=1,0,R[-1]C+R[-1]C[-3]) -> 3845220
A710: =R[-300]C+1 -> 3 | B710: =R[-300]C -> 104 | C710: 119450 | D710: 3 | E710: =RC[-2] -> 119450 | F710: =IF(RC[-4]=1,0,R[-1]C+R[-1]C[-3]) -> 3962500
A711: =R[-300]C+1 -> 3 | B711: =R[-300]C -> 105 | C711: 121640 | D711: 3 | E711: =RC[-2] -> 121640 | F711: =IF(RC[-4]=1,0,R[-1]C+R[-1]C[-3]) -> 4081950
A712: =R[-300]C+1 -> 3 | B712: =R[-300]C -> 106 | C712: 123850 | D712: 3 | E712: =RC[-2] -> 123850 | F712: =IF(RC[-4]=1,0,R[-1]C+R[-1]C[-3]) -> 4203590
A713: =R[-300]C+1 -> 3 | B713: =R[-300]C -> 107 | C713: 126080 | D713: 3 | E713: =RC[-2] -> 126080 | F713: =IF(RC[-4]=1,0,R[-1]C+R[-1]C[-3]) -> 4327440
A714: =R[-300]C+1 -> 3 | B714: =R[-300]C -> 108 | C714: 128330 | D714: 3 | E714: =RC[-2] -> 128330 | F714: =IF(RC[-4]=1,0,R[-1]C+R[-1]C[-3]) -> 4453520
A715: =R[-300]C+1 -> 3 | B715: =R[-300]C -> 109 | C715: 130600 | D715: 3 | E715: =RC[-2] -> 130600 | F715: =IF(RC[-4]=1,0,R[-1]C+R[-1]C[-3]) -> 4581850
A716: =R[-300]C+1 -> 3 | B716: =R[-300]C -> 110 | C716: 132890 | D716: 3 | E716: =RC[-2] -> 132890 | F716: =IF(RC[-4]=1,0,R[-1]C+R[-1]C[-3]) -> 4712450
A717: =R[-300]C+1 -> 3 | B717: =R[-300]C -> 111 | C717: 135200 | D717: 3 | E717: =RC[-2] -> 135200 | F717: =IF(RC[-4]=1,0,R[-1]C+R[-1]C[-3]) -> 4845340
A718: =R[-300]C+1 -> 3 | B718: =R[-300]C -> 112 | C718: 137530 | D718: 3 | E718: =RC[-2] -> 137530 | F718: =IF(RC[-4]=1,0,R[-1]C+R[-1]C[-3]) -> 4980540
A719: =R[-300]C+1 -> 3 | B719: =R[-300]C -> 113 | C719: 139880 | D719: 3 | E719: =RC[-2] -> 139880 | F719: =IF(RC[-4]=1,0,R[-1]C+R[-1]C[-3]) -> 5118070
A720: =R[-300]C+1 -> 3 | B720: =R[-300]C -> 114 | C720: 142250 | D720: 3 | E720: =RC[-2] -> 142250 | F720: =IF(RC[-4]=1,0,R[-1]C+R[-1]C[-3]) -> 5257950
A721: =R[-300]C+1 -> 3 | B721: =R[-300]C -> 115 | C721: 144640 | D721: 3 | E721: =RC[-2] -> 144640 | F721: =IF(RC[-4]=1,0,R[-1]C+R[-1]C[-3]) -> 5400200
A722: =R[-300]C+1 -> 3 | B722: =R[-300]C -> 116 | C722: 147050 | D722: 3 | E722: =RC[-2] -> 147050 | F722: =IF(RC[-4]=1,0,R[-1]C+R[-1]C[-3]) -> 5544840
A723: =R[-300]C+1 -> 3 | B723: =R[-300]C -> 117 | C723: 149480 | D723: 3 | E723: =RC[-2] -> 149480 | F723: =IF(RC[-4]=1,0,R[-1]C+R[-1]C[-3]) -> 5691890
A724: =R[-300]C+1 -> 3 | B724: =R[-300]C -> 118 | C724: 151930 | D724: 3 | E724: =RC[-2] -> 151930 | F724: =IF(RC[-4]=1,0,R[-1]C+R[-1]C[-3]) -> 5841370
A725: =R[-300]C+1 -> 3 | B725: =R[-300]C -> 119 | C725: 154400 | D725: 3 | E725: =RC[-2] -> 154400 | F725: =IF(RC[-4]=1,0,R[-1]C+R[-1]C[-3]) -> 5993300
A726: =R[-300]C+1 -> 3 | B726: =R[-300]C -> 120 | C726: 156890 | D726: 3 | E726: =RC[-2] -> 156890 | F726: =IF(RC[-4]=1,0,R[-1]C+R[-1]C[-3]) -> 6147700
A727: =R[-300]C+1 -> 3 | B727: =R[-300]C -> 121 | C727: 159400 | D727: 3 | E727: =RC[-2] -> 159400 | F727: =IF(RC[-4]=1,0,R[-1]C+R[-1]C[-3]) -> 6304590
A728: =R[-300]C+1 -> 3 | B728: =R[-300]C -> 122 | C728: 161930 | D728: 3 | E728: =RC[-2] -> 161930 | F728: =IF(RC[-4]=1,0,R[-1]C+R[-1]C[-3]) -> 6463990
A729: =R[-300]C+1 -> 3 | B729: =R[-300]C -> 123 | C729: 164480 | D729: 3 | E729: =RC[-2] -> 164480 | F729: =IF(RC[-4]=1,0,R[-1]C+R[-1]C[-3]) -> 6625920
A730: =R[-300]C+1 -> 3 | B730: =R[-300]C -> 124 | C730: 167050 | D730: 3 | E730: =RC[-2] -> 167050 | F730: =IF(RC[-4]=1,0,R[-1]C+R[-1]C[-3]) -> 6790400
A731: =R[-300]C+1 -> 3 | B731: =R[-300]C -> 125 | C731: 169640 | D731: 3 | E731: =RC[-2] -> 169640 | F731: =IF(RC[-4]=1,0,R[-1]C+R[-1]C[-3]) -> 6957450
A732: =R[-300]C+1 -> 3 | B732: =R[-300]C -> 126 | C732: 172250 | D732: 3 | E732: =RC[-2] -> 172250 | F732: =IF(RC[-4]=1,0,R[-1]C+R[-1]C[-3]) -> 7127090
A733: =R[-300]C+1 -> 3 | B733: =R[-300]C -> 127 | C733: 174880 | D733: 3 | E733: =RC[-2] -> 174880 | F733: =IF(RC[-4]=1,0,R[-1]C+R[-1]C[-3]) -> 7299340
A734: =R[-300]C+1 -> 3 | B734: =R[-300]C -> 128 | C734: 177530 | D734: 3 | E734: =RC[-2] -> 177530 | F734: =IF(RC[-4]=1,0,R[-1]C+R[-1]C[-3]) -> 7474220
A735: =R[-300]C+1 -> 3 | B735: =R[-300]C -> 129 | C735: 180200 | D735: 3 | E735: =RC[-2] -> 180200 | F735: =IF(RC[-4]=1,0,R[-1]C+R[-1]C[-3]) -> 7651750
A736: =R[-300]C+1 -> 3 | B736: =R[-300]C -> 130 | C736: 182890 | D736: 3 | E736: =RC[-2] -> 182890 | F736: =IF(RC[-4]=1,0,R[-1]C+R[-1]C[-3]) -> 7831950
A737: =R[-300]C+1 -> 3 | B737: =R[-300]C -> 131 | C737: 185600 | D737: 3 | E737: =RC[-2] -> 185600 | F737: =IF(RC[-4]=1,0,R[-1]C+R[-1]C[-3]) -> 8014840
A738: =R[-300]C+1 -> 3 | B738: =R[-300]C -> 132 | C738: 188330 | D738: 3 | E738: =RC[-2] -> 188330 | F738: =IF(RC[-4]=1,0,R[-1]C+R[-1]C[-3]) -> 8200440
A739: =R[-300]C+1 -> 3 | B739: =R[-300]C -> 133 | C739: 191080 | D739: 3 | E739: =RC[-2] -> 191080 | F739: =IF(RC[-4]=1,0,R[-1]C+R[-1]C[-3]) -> 8388770
A740: =R[-300]C+1 -> 3 | B740: =R[-300]C -> 134 | C740: 193850 | D740: 3 | E740: =RC[-2] -> 193850 | F740: =IF(RC[-4]=1,0,R[-1]C+R[-1]C[-3]) -> 8579850
A741: =R[-300]C+1 -> 3 | B741: =R[-300]C -> 135 | C741: 196640 | D741: 3 | E741: =RC[-2] -> 196640 | F741: =IF(RC[-4]=1,0,R[-1]C+R[-1]C[-3]) -> 8773700
A742: =R[-300]C+1 -> 3 | B742: =R[-300]C -> 136 | C742: 199450 | D742: 3 | E742: =RC[-2] -> 199450 | F742: =IF(RC[-4]=1,0,R[-1]C+R[-1]C[-3]) -> 8970340
A743: =R[-300]C+1 -> 3 | B743: =R[-300]C -> 137 | C743: 202280 | D743: 3 | E743: =RC[-2] -> 202280 | F743: =IF(RC[-4]=1,0,R[-1]C+R[-1]C[-3]) -> 9169790
A744: =R[-300]C+1 -> 3 | B744: =R[-300]C -> 138 | C744: 205130 | D744: 3 | E744: =RC[-2] -> 205130 | F744: =IF(RC[-4]=1,0,R[-1]C+R[-1]C[-3]) -> 9372070
A745: =R[-300]C+1 -> 3 | B745: =R[-300]C -> 139 | C745: 208000 | D745: 3 | E745: =RC[-2] -> 208000 | F745: =IF(RC[-4]=1,0,R[-1]C+R[-1]C[-3]) -> 9577200
A746: =R[-300]C+1 -> 3 | B746: =R[-300]C -> 140 | C746: 210890 | D746: 3 | E746: =RC[-2] -> 210890 | F746: =IF(RC[-4]=1,0,R[-1]C+R[-1]C[-3]) -> 9785200
A747: =R[-300]C+1 -> 3 | B747: =R[-300]C -> 141 | C747: 213800 | D747: 3 | E747: =RC[-2] -> 213800 | F747: =IF(RC[-4]=1,0,R[-1]C+R[-1]C[-3]) -> 9996090
A748: =R[-300]C+1 -> 3 | B748: =R[-300]C -> 142 | C748: 216730 | D748: 3 | E748: =RC[-2] -> 216730 | F748: =IF(RC[-4]=1,0,R[-1]C+R[-1]C[-3]) -> 10209890
A749: =R[-300]C+1 -> 3 | B749: =R[-300]C -> 143 | C749: 219680 | D749: 3 | E749: =RC[-2] -> 219680 | F749: =IF(RC[-4]=1,0,R[-1]C+R[-1]C[-3]) -> 10426620
A750: =R[-300]C+1 -> 3 | B750: =R[-300]C -> 144 | C750: 222650 | D750: 3 | E750: =RC[-2] -> 222650 | F750: =IF(RC[-4]=1,0,R[-1]C+R[-1]C[-3]) -> 10646300
A751: =R[-300]C+1 -> 3 | B751: =R[-300]C -> 145 | C751: 225640 | D751: 3 | E751: =RC[-2] -> 225640 | F751: =IF(RC[-4]=1,0,R[-1]C+R[-1]C[-3]) -> 10868950
A752: =R[-300]C+1 -> 3 | B752: =R[-300]C -> 146 | C752: 228650 | D752: 3 | E752: =RC[-2] -> 228650 | F752: =IF(RC[-4]=1,0,R[-1]C+R[-1]C[-3]) -> 11094590
A753: =R[-300]C+1 -> 3 | B753: =R[-300]C -> 147 | C753: 231680 | D753: 3 | E753: =RC[-2] -> 231680 | F753: =IF(RC[-4]=1,0,R[-1]C+R[-1]C[-3]) -> 11323240
A754: =R[-300]C+1 -> 3 | B754: =R[-300]C -> 148 | C754: 234730 | D754: 3 | E754: =RC[-2] -> 234730 | F754: =IF(RC[-4]=1,0,R[-1]C+R[-1]C[-3]) -> 11554920
A755: =R[-300]C+1 -> 3 | B755: =R[-300]C -> 149 | C755: 237800 | D755: 3 | E755: =RC[-2] -> 237800 | F755: =IF(RC[-4]=1,0,R[-1]C+R[-1]C[-3]) -> 11789650
A756: =R[-300]C+1 -> 3 | B756: =R[-300]C -> 150 | C756: 240890 | D756: 3 | E756: =RC[-2] -> 240890 | F756: =IF(RC[-4]=1,0,R[-1]C+R[-1]C[-3]) -> 12027450
A757: =R[-300]C+1 -> 3 | B757: =R[-300]C -> 151 | C757: 244000 | D757: 3 | E757: =RC[-2] -> 244000 | F757: =IF(RC[-4]=1,0,R[-1]C+R[-1]C[-3]) -> 12268340
A758: =R[-300]C+1 -> 3 | B758: =R[-300]C -> 152 | C758: 247130 | D758: 3 | E758: =RC[-2] -> 247130 | F758: =IF(RC[-4]=1,0,R[-1]C+R[-1]C[-3]) -> 12512340
A759: =R[-300]C+1 -> 3 | B759: =R[-300]C -> 153 | C759: 250280 | D759: 3 | E759: =RC[-2] -> 250280 | F759: =IF(RC[-4]=1,0,R[-1]C+R[-1]C[-3]) -> 12759470
A760: =R[-300]C+1 -> 3 | B760: =R[-300]C -> 154 | C760: 253450 | D760: 3 | E760: =RC[-2] -> 253450 | F760: =IF(RC[-4]=1,0,R[-1]C+R[-1]C[-3]) -> 13009750
A761: =R[-300]C+1 -> 3 | B761: =R[-300]C -> 155 | C761: 256640 | D761: 3 | E761: =RC[-2] -> 256640 | F761: =IF(RC[-4]=1,0,R[-1]C+R[-1]C[-3]) -> 13263200
A762: =R[-300]C+1 -> 3 | B762: =R[-300]C -> 156 | C762: 259850 | D762: 3 | E762: =RC[-2] -> 259850 | F762: =IF(RC[-4]=1,0,R[-1]C+R[-1]C[-3]) -> 13519840
A763: =R[-300]C+1 -> 3 | B763: =R[-300]C -> 157 | C763: 263080 | D763: 3 | E763: =RC[-2] -> 263080 | F763: =IF(RC[-4]=1,0,R[-1]C+R[-1]C[-3]) -> 13779690
A764: =R[-300]C+1 -> 3 | B764: =R[-300]C -> 158 | C764: 266330 | D764: 3 | E764: =RC[-2] -> 266330 | F764: =IF(RC[-4]=1,0,R[-1]C+R[-1]C[-3]) -> 14042770
A765: =R[-300]C+1 -> 3 | B765: =R[-300]C -> 159 | C765: 269600 | D765: 3 | E765: =RC[-2] -> 269600 | F765: =IF(RC[-4]=1,0,R[-1]C+R[-1]C[-3]) -> 14309100
A766: =R[-300]C+1 -> 3 | B766: =R[-300]C -> 160 | C766: 272890 | D766: 3 | E766: =RC[-2] -> 272890 | F766: =IF(RC[-4]=1,0,R[-1]C+R[-1]C[-3]) -> 14578700
A767: =R[-300]C+1 -> 3 | B767: =R[-300]C -> 161 | C767: 276200 | D767: 3 | E767: =RC[-2] -> 276200 | F767: =IF(RC[-4]=1,0,R[-1]C+R[-1]C[-3]) -> 14851590
A768: =R[-300]C+1 -> 3 | B768: =R[-300]C -> 162 | C768: 279530 | D768: 3 | E768: =RC[-2] -> 279530 | F768: =IF(RC[-4]=1,0,R[-1]C+R[-1]C[-3]) -> 15127790
A769: =R[-300]C+1 -> 3 | B769: =R[-300]C -> 163 | C769: 282880 | D769: 3 | E769: =RC[-2] -> 282880 | F769: =IF(RC[-4]=1,0,R[-1]C+R[-1]C[-3]) -> 15407320
A770: =R[-300]C+1 -> 3 | B770: =R[-300]C -> 164 | C770: 286250 | D770: 3 | E770: =RC[-2] -> 286250 | F770: =IF(RC[-4]=1,0,R[-1]C+R[-1]C[-3]) -> 15690200
A771: =R[-300]C+1 -> 3 | B771: =R[-300]C -> 165 | C771: 289640 | D771: 3 | E771: =RC[-2] -> 289640 | F771: =IF(RC[-4]=1,0,R[-1]C+R[-1]C[-3]) -> 15976450
A772: =R[-300]C+1 -> 3 | B772: =R[-300]C -> 166 | C772: 293050 | D772: 3 | E772: =RC[-2] -> 293050 | F772: =IF(RC[-4]=1,0,R[-1]C+R[-1]C[-3]) -> 16266090
A773: =R[-300]C+1 -> 3 | B773: =R[-300]C -> 167 | C773: 296480 | D773: 3 | E773: =RC[-2] -> 296480 | F773: =IF(RC[-4]=1,0,R[-1]C+R[-1]C[-3]) -> 16559140
A774: =R[-300]C+1 -> 3 | B774: =R[-300]C -> 168 | C774: 299930 | D774: 3 | E774: =RC[-2] -> 299930 | F774: =IF(RC[-4]=1,0,R[-1]C+R[-1]C[-3]) -> 16855620
A775: =R[-300]C+1 -> 3 | B775: =R[-300]C -> 169 | C775: 303400 | D775: 3 | E775: =RC[-2] -> 303400 | F775: =IF(RC[-4]=1,0,R[-1]C+R[-1]C[-3]) -> 17155550
A776: =R[-300]C+1 -> 3 | B776: =R[-300]C -> 170 | C776: 306890 | D776: 3 | E776: =RC[-2] -> 306890 | F776: =IF(RC[-4]=1,0,R[-1]C+R[-1]C[-3]) -> 17458950
A777: =R[-300]C+1 -> 3 | B777: =R[-300]C -> 171 | C777: 310400 | D777: 3 | E777: =RC[-2] -> 310400 | F777: =IF(RC[-4]=1,0,R[-1]C+R[-1]C[-3]) -> 17765840
A778: =R[-300]C+1 -> 3 | B778: =R[-300]C -> 172 | C778: 313930 | D778: 3 | E778: =RC[-2] -> 313930 | F778: =IF(RC[-4]=1,0,R[-1]C+R[-1]C[-3]) -> 18076240
A779: =R[-300]C+1 -> 3 | B779: =R[-300]C -> 173 | C779: 317480 | D779: 3 | E779: =RC[-2] -> 317480 | F779: =IF(RC[-4]=1,0,R[-1]C+R[-1]C[-3]) -> 18390170
A780: =R[-300]C+1 -> 3 | B780: =R[-300]C -> 174 | C780: 321050 | D780: 3 | E780: =RC[-2] -> 321050 | F780: =IF(RC[-4]=1,0,R[-1]C+R[-1]C[-3]) -> 18707650
A781: =R[-300]C+1 -> 3 | B781: =R[-300]C -> 175 | C781: 324640 | D781: 3 | E781: =RC[-2] -> 324640 | F781: =IF(RC[-4]=1,0,R[-1]C+R[-1]C[-3]) -> 19028700
A782: =R[-300]C+1 -> 3 | B782: =R[-300]C -> 176 | C782: 328250 | D782: 3 | E782: =RC[-2] -> 328250 | F782: =IF(RC[-4]=1,0,R[-1]C+R[-1]C[-3]) -> 19353340
A783: =R[-300]C+1 -> 3 | B783: =R[-300]C -> 177 | C783: 331880 | D783: 3 | E783: =RC[-2] -> 331880 | F783: =IF(RC[-4]=1,0,R[-1]C+R[-1]C[-3]) -> 19681590
A784: =R[-300]C+1 -> 3 | B784: =R[-300]C -> 178 | C784: 335530 | D784: 3 | E784: =RC[-2] -> 335530 | F784: =IF(RC[-4]=1,0,R[-1]C+R[-1]C[-3]) -> 20013470
A785: =R[-300]C+1 -> 3 | B785: =R[-300]C -> 179 | C785: 339200 | D785: 3 | E785: =RC[-2] -> 339200 | F785: =IF(RC[-4]=1,0,R[-1]C+R[-1]C[-3]) -> 20349000
A786: =R[-300]C+1 -> 3 | B786: =R[-300]C -> 180 | C786: 342890 | D786: 3 | E786: =RC[-2] -> 342890 | F786: =IF(RC[-4]=1,0,R[-1]C+R[-1]C[-3]) -> 20688200
A787: =R[-300]C+1 -> 3 | B787: =R[-300]C -> 181 | C787: 346600 | D787: 3 | E787: =RC[-2] -> 346600 | F787: =IF(RC[-4]=1,0,R[-1]C+R[-1]C[-3]) -> 21031090
A788: =R[-300]C+1 -> 3 | B788: =R[-300]C -> 182 | C788: 350330 | D788: 3 | E788: =RC[-2] -> 350330 | F788: =IF(RC[-4]=1,0,R[-1]C+R[-1]C[-3]) -> 21377690
A789: =R[-300]C+1 -> 3 | B789: =R[-300]C -> 183 | C789: 354080 | D789: 3 | E789: =RC[-2] -> 354080 | F789: =IF(RC[-4]=1,0,R[-1]C+R[-1]C[-3]) -> 21728020
A790: =R[-300]C+1 -> 3 | B790: =R[-300]C -> 184 | C790: 357850 | D790: 3 | E790: =RC[-2] -> 357850 | F790: =IF(RC[-4]=1,0,R[-1]C+R[-1]C[-3]) -> 22082100
A791: =R[-300]C+1 -> 3 | B791: =R[-300]C -> 185 | C791: 361640 | D791: 3 | E791: =RC[-2] -> 361640 | F791: =IF(RC[-4]=1,0,R[-1]C+R[-1]C[-3]) -> 22439950
A792: =R[-300]C+1 -> 3 | B792: =R[-300]C -> 186 | C792: 365450 | D792: 3 | E792: =RC[-2] -> 365450 | F792: =IF(RC[-4]=1,0,R[-1]C+R[-1]C[-3]) -> 22801590
A793: =R[-300]C+1 -> 3 | B793: =R[-300]C -> 187 | C793: 369280 | D793: 3 | E793: =RC[-2] -> 369280 | F793: =IF(RC[-4]=1,0,R[-1]C+R[-1]C[-3]) -> 23167040
A794: =R[-300]C+1 -> 3 | B794: =R[-300]C -> 188 | C794: 373130 | D794: 3 | E794: =RC[-2] -> 373130 | F794: =IF(RC[-4]=1,0,R[-1]C+R[-1]C[-3]) -> 23536320
A795: =R[-300]C+1 -> 3 | B795: =R[-300]C -> 189 | C795: 377000 | D795: 3 | E795: =RC[-2] -> 377000 | F795: =IF(RC[-4]=1,0,R[-1]C+R[-1]C[-3]) -> 23909450
A796: =R[-300]C+1 -> 3 | B796: =R[-300]C -> 190 | C796: 380890 | D796: 3 | E796: =RC[-2] -> 380890 | F796: =IF(RC[-4]=1,0,R[-1]C+R[-1]C[-3]) -> 24286450
A797: =R[-300]C+1 -> 3 | B797: =R[-300]C -> 191 | C797: 384800 | D797: 3 | E797: =RC[-2] -> 384800 | F797: =IF(RC[-4]=1,0,R[-1]C+R[-1]C[-3]) -> 24667340
A798: =R[-300]C+1 -> 3 | B798: =R[-300]C -> 192 | C798: 388730 | D798: 3 | E798: =RC[-2] -> 388730 | F798: =IF(RC[-4]=1,0,R[-1]C+R[-1]C[-3]) -> 25052140
A799: =R[-300]C+1 -> 3 | B799: =R[-300]C -> 193 | C799: 392680 | D799: 3 | E799: =RC[-2] -> 392680 | F799: =IF(RC[-4]=1,0,R[-1]C+R[-1]C[-3]) -> 25440870
A800: =R[-300]C+1 -> 3 | B800: =R[-300]C -> 194 | C800: 396650 | D800: 3 | E800: =RC[-2] -> 396650 | F800: =IF(RC[-4]=1,0,R[-1]C+R[-1]C[-3]) -> 25833550
A801: =R[-300]C+1 -> 3 | B801: =R[-300]C -> 195 | C801: 400640 | D801: 3 | E801: =RC[-2] -> 400640 | F801: =IF(RC[-4]=1,0,R[-1]C+R[-1]C[-3]) -> 26230200
A802: =R[-300]C+1 -> 3 | B802: =R[-300]C -> 196 | C802: 404650 | D802: 3 | E802: =RC[-2] -> 404650 | F802: =IF(RC[-4]=1,0,R[-1]C+R[-1]C[-3]) -> 26630840
A803: =R[-300]C+1 -> 3 | B803: =R[-300]C -> 197 | C803: 408680 | D803: 3 | E803: =RC[-2] -> 408680 | F803: =IF(RC[-4]=1,0,R[-1]C+R[-1]C[-3]) -> 27035490
A804: =R[-300]C+1 -> 3 | B804: =R[-300]C -> 198 | C804: 412730 | D804: 3 | E804: =RC[-2] -> 412730 | F804: =IF(RC[-4]=1,0,R[-1]C+R[-1]C[-3]) -> 27444170
A805: =R[-300]C+1 -> 3 | B805: =R[-300]C -> 199 | C805: 416800 | D805: 3 | E805: =RC[-2] -> 416800 | F805: =IF(RC[-4]=1,0,R[-1]C+R[-1]C[-3]) -> 27856900
A806: =R[-300]C+1 -> 3 | B806: =R[-300]C -> 200 | C806: 420890 | D806: 3 | E806: =RC[-2] -> 420890 | F806: =IF(RC[-4]=1,0,R[-1]C+R[-1]C[-3]) -> 28273700
A807: =R[-300]C+1 -> 3 | B807: =R[-300]C -> 201 | C807: 425000 | D807: 3 | E807: =RC[-2] -> 425000 | F807: =IF(RC[-4]=1,0,R[-1]C+R[-1]C[-3]) -> 28694590
A808: =R[-300]C+1 -> 3 | B808: =R[-300]C -> 202 | C808: 429130 | D808: 3 | E808: =RC[-2] -> 429130 | F808: =IF(RC[-4]=1,0,R[-1]C+R[-1]C[-3]) -> 29119590
A809: =R[-300]C+1 -> 3 | B809: =R[-300]C -> 203 | C809: 433280 | D809: 3 | E809: =RC[-2] -> 433280 | F809: =IF(RC[-4]=1,0,R[-1]C+R[-1]C[-3]) -> 29548720
A810: =R[-300]C+1 -> 3 | B810: =R[-300]C -> 204 | C810: 437450 | D810: 3 | E810: =RC[-2] -> 437450 | F810: =IF(RC[-4]=1,0,R[-1]C+R[-1]C[-3]) -> 29982000
A811: =R[-300]C+1 -> 3 | B811: =R[-300]C -> 205 | C811: 441640 | D811: 3 | E811: =RC[-2] -> 441640 | F811: =IF(RC[-4]=1,0,R[-1]C+R[-1]C[-3]) -> 30419450
A812: =R[-300]C+1 -> 3 | B812: =R[-300]C -> 206 | C812: 445850 | D812: 3 | E812: =RC[-2] -> 445850 | F812: =IF(RC[-4]=1,0,R[-1]C+R[-1]C[-3]) -> 30861090
A813: =R[-300]C+1 -> 3 | B813: =R[-300]C -> 207 | C813: 450080 | D813: 3 | E813: =RC[-2] -> 450080 | F813: =IF(RC[-4]=1,0,R[-1]C+R[-1]C[-3]) -> 31306940
A814: =R[-300]C+1 -> 3 | B814: =R[-300]C -> 208 | C814: 454330 | D814: 3 | E814: =RC[-2] -> 454330 | F814: =IF(RC[-4]=1,0,R[-1]C+R[-1]C[-3]) -> 31757020
A815: =R[-300]C+1 -> 3 | B815: =R[-300]C -> 209 | C815: 458600 | D815: 3 | E815: =RC[-2] -> 458600 | F815: =IF(RC[-4]=1,0,R[-1]C+R[-1]C[-3]) -> 32211350
A816: =R[-300]C+1 -> 3 | B816: =R[-300]C -> 210 | C816: 462890 | D816: 3 | E816: =RC[-2] -> 462890 | F816: =IF(RC[-4]=1,0,R[-1]C+R[-1]C[-3]) -> 32669950
A817: =R[-300]C+1 -> 3 | B817: =R[-300]C -> 211 | C817: 467200 | D817: 3 | E817: =RC[-2] -> 467200 | F817: =IF(RC[-4]=1,0,R[-1]C+R[-1]C[-3]) -> 33132840
A818: =R[-300]C+1 -> 3 | B818: =R[-300]C -> 212 | C818: 471530 | D818: 3 | E818: =RC[-2] -> 471530 | F818: =IF(RC[-4]=1,0,R[-1]C+R[-1]C[-3]) -> 33600040
A819: =R[-300]C+1 -> 3 | B819: =R[-300]C -> 213 | C819: 475880 | D819: 3 | E819: =RC[-2] -> 475880 | F819: =IF(RC[-4]=1,0,R[-1]C+R[-1]C[-3]) -> 34071570
A820: =R[-300]C+1 -> 3 | B820: =R[-300]C -> 214 | C820: 480250 | D820: 3 | E820: =RC[-2] -> 480250 | F820: =IF(RC[-4]=1,0,R[-1]C+R[-1]C[-3]) -> 34547450
A821: =R[-300]C+1 -> 3 | B821: =R[-300]C -> 215 | C821: 484640 | D821: 3 | E821: =RC[-2] -> 484640 | F821: =IF(RC[-4]=1,0,R[-1]C+R[-1]C[-3]) -> 35027700
A822: =R[-300]C+1 -> 3 | B822: =R[-300]C -> 216 | C822: 489050 | D822: 3 | E822: =RC[-2] -> 489050 | F822: =IF(RC[-4]=1,0,R[-1]C+R[-1]C[-3]) -> 35512340
A823: =R[-300]C+1 -> 3 | B823: =R[-300]C -> 217 | C823: 493480 | D823: 3 | E823: =RC[-2] -> 493480 | F823: =IF(RC[-4]=1,0,R[-1]C+R[-1]C[-3]) -> 36001390
A824: =R[-300]C+1 -> 3 | B824: =R[-300]C -> 218 | C824: 497930 | D824: 3 | E824: =RC[-2] -> 497930 | F824: =IF(RC[-4]=1,0,R[-1]C+R[-1]C[-3]) -> 36494870
A825: =R[-300]C+1 -> 3 | B825: =R[-300]C -> 219 | C825: 502400 | D825: 3 | E825: =RC[-2] -> 502400 | F825: =IF(RC[-4]=1,0,R[-1]C+R[-1]C[-3]) -> 36992800
A826: =R[-300]C+1 -> 3 | B826: =R[-300]C -> 220 | C826: 506890 | D826: 3 | E826: =RC[-2] -> 506890 | F826: =IF(RC[-4]=1,0,R[-1]C+R[-1]C[-3]) -> 37495200
A827: =R[-300]C+1 -> 3 | B827: =R[-300]C -> 221 | C827: 511400 | D827: 3 | E827: =RC[-2] -> 511400 | F827: =IF(RC[-4]=1,0,R[-1]C+R[-1]C[-3]) -> 38002090
A828: =R[-300]C+1 -> 3 | B828: =R[-300]C -> 222 | C828: 515930 | D828: 3 | E828: =RC[-2] -> 515930 | F828: =IF(RC[-4]=1,0,R[-1]C+R[-1]C[-3]) -> 38513490
A829: =R[-300]C+1 -> 3 | B829: =R[-300]C -> 223 | C829: 520480 | D829: 3 | E829: =RC[-2] -> 520480 | F829: =IF(RC[-4]=1,0,R[-1]C+R[-1]C[-3]) -> 39029420
A830: =R[-300]C+1 -> 3 | B830: =R[-300]C -> 224 | C830: 525050 | D830: 3 | E830: =RC[-2] -> 525050 | F830: =IF(RC[-4]=1,0,R[-1]C+R[-1]C[-3]) -> 39549900
A831: =R[-300]C+1 -> 3 | B831: =R[-300]C -> 225 | C831: 529640 | D831: 3 | E831: =RC[-2] -> 529640 | F831: =IF(RC[-4]=1,0,R[-1]C+R[-1]C[-3]) -> 40074950
A832: =R[-300]C+1 -> 3 | B832: =R[-300]C -> 226 | C832: 534250 | D832: 3 | E832: =RC[-2] -> 534250 | F832: =IF(RC[-4]=1,0,R[-1]C+R[-1]C[-3]) -> 40604590
A833: =R[-300]C+1 -> 3 | B833: =R[-300]C -> 227 | C833: 538880 | D833: 3 | E833: =RC[-2] -> 538880 | F833: =IF(RC[-4]=1,0,R[-1]C+R[-1]C[-3]) -> 41138840
A834: =R[-300]C+1 -> 3 | B834: =R[-300]C -> 228 | C834: 543530 | D834: 3 | E834: =RC[-2] -> 543530 | F834: =IF(RC[-4]=1,0,R[-1]C+R[-1]C[-3]) -> 41677720
A835: =R[-300]C+1 -> 3 | B835: =R[-300]C -> 229 | C835: 548200 | D835: 3 | E835: =RC[-2] -> 548200 | F835: =IF(RC[-4]=1,0,R[-1]C+R[-1]C[-3]) -> 42221250
A836: =R[-300]C+1 -> 3 | B836: =R[-300]C -> 230 | C836: 552890 | D836: 3 | E836: =RC[-2] -> 552890 | F836: =IF(RC[-4]=1,0,R[-1]C+R[-1]C[-3]) -> 42769450
A837: =R[-300]C+1 -> 3 | B837: =R[-300]C -> 231 | C837: 557600 | D837: 3 | E837: =RC[-2] -> 557600 | F837: =IF(RC[-4]=1,0,R[-1]C+R[-1]C[-3]) -> 43322340
A838: =R[-300]C+1 -> 3 | B838: =R[-300]C -> 232 | C838: 562330 | D838: 3 | E838: =RC[-2] -> 562330 | F838: =IF(RC[-4]=1,0,R[-1]C+R[-1]C[-3]) -> 43879940
A839: =R[-300]C+1 -> 3 | B839: =R[-300]C -> 233 | C839: 567080 | D839: 3 | E839: =RC[-2] -> 567080 | F839: =IF(RC[-4]=1,0,R[-1]C+R[-1]C[-3]) -> 44442270
A840: =R[-300]C+1 -> 3 | B840: =R[-300]C -> 234 | C840: 571850 | D840: 3 | E840: =RC[-2] -> 571850 | F840: =IF(RC[-4]=1,0,R[-1]C+R[-1]C[-3]) -> 45009350
A841: =R[-300]C+1 -> 3 | B841: =R[-300]C -> 235 | C841: 576640 | D841: 3 | E841: =RC[-2] -> 576640 | F841: =IF(RC[-4]=1,0,R[-1]C+R[-1]C[-3]) -> 45581200
A842: =R[-300]C+1 -> 3 | B842: =R[-300]C -> 236 | C842: 581450 | D842: 3 | E842: =RC[-2] -> 581450 | F842: =IF(RC[-4]=1,0,R[-1]C+R[-1]C[-3]) -> 46157840
A843: =R[-300]C+1 -> 3 | B843: =R[-300]C -> 237 | C843: 586280 | D843: 3 | E843: =RC[-2] -> 586280 | F843: =IF(RC[-4]=1,0,R[-1]C+R[-1]C[-3]) -> 46739290
A844: =R[-300]C+1 -> 3 | B844: =R[-300]C -> 238 | C844: 591130 | D844: 3 | E844: =RC[-2] -> 591130 | F844: =IF(RC[-4]=1,0,R[-1]C+R[-1]C[-3]) -> 47325570
A845: =R[-300]C+1 -> 3 | B845: =R[-300]C -> 239 | C845: 596000 | D845: 3 | E845: =RC[-2] -> 596000 | F845: =IF(RC[-4]=1,0,R[-1]C+R[-1]C[-3]) -> 47916700
A846: =R[-300]C+1 -> 3 | B846: =R[-300]C -> 240 | C846: 600890 | D846: 3 | E846: =RC[-2] -> 600890 | F846: =IF(RC[-4]=1,0,R[-1]C+R[-1]C[-3]) -> 48512700
A847: =R[-300]C+1 -> 3 | B847: =R[-300]C -> 241 | C847: 605800 | D847: 3 | E847: =RC[-2] -> 605800 | F847: =IF(RC[-4]=1,0,R[-1]C+R[-1]C[-3]) -> 49113590
A848: =R[-300]C+1 -> 3 | B848: =R[-300]C -> 242 | C848: 610730 | D848: 3 | E848: =RC[-2] -> 610730 | F848: =IF(RC[-4]=1,0,R[-1]C+R[-1]C[-3]) -> 49719390
A849: =R[-300]C+1 -> 3 | B849: =R[-300]C -> 243 | C849: 615680 | D849: 3 | E849: =RC[-2] -> 615680 | F849: =IF(RC[-4]=1,0,R[-1]C+R[-1]C[-3]) -> 50330120
A850: =R[-300]C+1 -> 3 | B850: =R[-300]C -> 244 | C850: 620650 | D850: 3 | E850: =RC[-2] -> 620650 | F850: =IF(RC[-4]=1,0,R[-1]C+R[-1]C[-3]) -> 50945800
A851: =R[-300]C+1 -> 3 | B851: =R[-300]C -> 245 | C851: 625640 | D851: 3 | E851: =RC[-2] -> 625640 | F851: =IF(RC[-4]=1,0,R[-1]C+R[-1]C[-3]) -> 51566450
A852: =R[-300]C+1 -> 3 | B852: =R[-300]C -> 246 | C852: 630650 | D852: 3 | E852: =RC[-2] -> 630650 | F852: =IF(RC[-4]=1,0,R[-1]C+R[-1]C[-3]) -> 52192090
A853: =R[-300]C+1 -> 3 | B853: =R[-300]C -> 247 | C853: 635680 | D853: 3 | E853: =RC[-2] -> 635680 | F853: =IF(RC[-4]=1,0,R[-1]C+R[-1]C[-3]) -> 52822740
A854: =R[-300]C+1 -> 3 | B854: =R[-300]C -> 248 | C854: 640730 | D854: 3 | E854: =RC[-2] -> 640730 | F854: =IF(RC[-4]=1,0,R[-1]C+R[-1]C[-3]) -> 53458420
A855: =R[-300]C+1 -> 3 | B855: =R[-300]C -> 249 | C855: 645800 | D855: 3 | E855: =RC[-2] -> 645800 | F855: =IF(RC[-4]=1,0,R[-1]C+R[-1]C[-3]) -> 54099150
A856: =R[-300]C+1 -> 3 | B856: =R[-300]C -> 250 | C856: 650890 | D856: 3 | E856: =RC[-2] -> 650890 | F856: =IF(RC[-4]=1,0,R[-1]C+R[-1]C[-3]) -> 54744950
A857: =R[-300]C+1 -> 3 | B857: =R[-300]C -> 251 | C857: 656000 | D857: 3 | E857: =RC[-2] -> 656000 | F857: =IF(RC[-4]=1,0,R[-1]C+R[-1]C[-3]) -> 55395840
A858: =R[-300]C+1 -> 3 | B858: =R[-300]C -> 252 | C858: 661130 | D858: 3 | E858: =RC[-2] -> 661130 | F858: =IF(RC[-4]=1,0,R[-1]C+R[-1]C[-3]) -> 56051840
A859: =R[-300]C+1 -> 3 | B859: =R[-300]C -> 253 | C859: 666280 | D859: 3 | E859: =RC[-2] -> 666280 | F859: =IF(RC[-4]=1,0,R[-1]C+R[-1]C[-3]) -> 56712970
A860: =R[-300]C+1 -> 3 | B860: =R[-300]C -> 254 | C860: 671450 | D860: 3 | E860: =RC[-2] -> 671450 | F860: =IF(RC[-4]=1,0,R[-1]C+R[-1]C[-3]) -> 57379250
A861: =R[-300]C+1 -> 3 | B861: =R[-300]C -> 255 | C861: 676640 | D861: 3 | E861: =RC[-2] -> 676640 | F861: =IF(RC[-4]=1,0,R[-1]C+R[-1]C[-3]) -> 58050700
A862: =R[-300]C+1 -> 3 | B862: =R[-300]C -> 256 | C862: 681850 | D862: 3 | E862: =RC[-2] -> 681850 | F862: =IF(RC[-4]=1,0,R[-1]C+R[-1]C[-3]) -> 58727340
A863: =R[-300]C+1 -> 3 | B863: =R[-300]C -> 257 | C863: 687080 | D863: 3 | E863: =RC[-2] -> 687080 | F863: =IF(RC[-4]=1,0,R[-1]C+R[-1]C[-3]) -> 59409190
A864: =R[-300]C+1 -> 3 | B864: =R[-300]C -> 258 | C864: 692330 | D864: 3 | E864: =RC[-2] -> 692330 | F864: =IF(RC[-4]=1,0,R[-1]C+R[-1]C[-3]) -> 60096270
A865: =R[-300]C+1 -> 3 | B865: =R[-300]C -> 259 | C865: 697600 | D865: 3 | E865: =RC[-2] -> 697600 | F865: =IF(RC[-4]=1,0,R[-1]C+R[-1]C[-3]) -> 60788600
A866: =R[-300]C+1 -> 3 | B866: =R[-300]C -> 260 | C866: 702890 | D866: 3 | E866: =RC[-2] -> 702890 | F866: =IF(RC[-4]=1,0,R[-1]C+R[-1]C[-3]) -> 61486200
A867: =R[-300]C+1 -> 3 | B867: =R[-300]C -> 261 | C867: 708200 | D867: 3 | E867: =RC[-2] -> 708200 | F867: =IF(RC[-4]=1,0,R[-1]C+R[-1]C[-3]) -> 62189090
A868: =R[-300]C+1 -> 3 | B868: =R[-300]C -> 262 | C868: 713530 | D868: 3 | E868: =RC[-2] -> 713530 | F868: =IF(RC[-4]=1,0,R[-1]C+R[-1]C[-3]) -> 62897290
A869: =R[-300]C+1 -> 3 | B869: =R[-300]C -> 263 | C869: 718880 | D869: 3 | E869: =RC[-2] -> 718880 | F869: =IF(RC[-4]=1,0,R[-1]C+R[-1]C[-3]) -> 63610820
A870: =R[-300]C+1 -> 3 | B870: =R[-300]C -> 264 | C870: 724250 | D870: 3 | E870: =RC[-2] -> 724250 | F870: =IF(RC[-4]=1,0,R[-1]C+R[-1]C[-3]) -> 64329700
A871: =R[-300]C+1 -> 3 | B871: =R[-300]C -> 265 | C871: 729640 | D871: 3 | E871: =RC[-2] -> 729640 | F871: =IF(RC[-4]=1,0,R[-1]C+R[-1]C[-3]) -> 65053950
A872: =R[-300]C+1 -> 3 | B872: =R[-300]C -> 266 | C872: 735050 | D872: 3 | E872: =RC[-2] -> 735050 | F872: =IF(RC[-4]=1,0,R[-1]C+R[-1]C[-3]) -> 65783590
A873: =R[-300]C+1 -> 3 | B873: =R[-300]C -> 267 | C873: 740480 | D873: 3 | E873: =RC[-2] -> 740480 | F873: =IF(RC[-4]=1,0,R[-1]C+R[-1]C[-3]) -> 66518640
A874: =R[-300]C+1 -> 3 | B874: =R[-300]C -> 268 | C874: 745930 | D874: 3 | E874: =RC[-2] -> 745930 | F874: =IF(RC[-4]=1,0,R[-1]C+R[-1]C[-3]) -> 67259120
A875: =R[-300]C+1 -> 3 | B875: =R[-300]C -> 269 | C875: 751400 | D875: 3 | E875: =RC[-2] -> 751400 | F875: =IF(RC[-4]=1,0,R[-1]C+R[-1]C[-3]) -> 68005050
A876: =R[-300]C+1 -> 3 | B876: =R[-300]C -> 270 | C876: 756890 | D876: 3 | E876: =RC[-2] -> 756890 | F876: =IF(RC[-4]=1,0,R[-1]C+R[-1]C[-3]) -> 68756450
A877: =R[-300]C+1 -> 3 | B877: =R[-300]C -> 271 | C877: 762400 | D877: 3 | E877: =RC[-2] -> 762400 | F877: =IF(RC[-4]=1,0,R[-1]C+R[-1]C[-3]) -> 69513340
A878: =R[-300]C+1 -> 3 | B878: =R[-300]C -> 272 | C878: 767930 | D878: 3 | E878: =RC[-2] -> 767930 | F878: =IF(RC[-4]=1,0,R[-1]C+R[-1]C[-3]) -> 70275740
A879: =R[-300]C+1 -> 3 | B879: =R[-300]C -> 273 | C879: 773480 | D879: 3 | E879: =RC[-2] -> 773480 | F879: =IF(RC[-4]=1,0,R[-1]C+R[-1]C[-3]) -> 71043670
A880: =R[-300]C+1 -> 3 | B880: =R[-300]C -> 274 | C880: 779050 | D880: 3 | E880: =RC[-2] -> 779050 | F880: =IF(RC[-4]=1,0,R[-1]C+R[-1]C[-3]) -> 71817150
A881: =R[-300]C+1 -> 3 | B881: =R[-300]C -> 275 | C881: 784640 | D881: 3 | E881: =RC[-2] -> 784640 | F881: =IF(RC[-4]=1,0,R[-1]C+R[-1]C[-3]) -> 72596200
A882: =R[-300]C+1 -> 3 | B882: =R[-300]C -> 276 | C882: 790250 | D882: 3 | E882: =RC[-2] -> 790250 | F882: =IF(RC[-4]=1,0,R[-1]C+R[-1]C[-3]) -> 73380840
A883: =R[-300]C+1 -> 3 | B883: =R[-300]C -> 277 | C883: 795880 | D883: 3 | E883: =RC[-2] -> 795880 | F883: =IF(RC[-4]=1,0,R[-1]C+R[-1]C[-3]) -> 74171090
A884: =R[-300]C+1 -> 3 | B884: =R[-300]C -> 278 | C884: 801530 | D884: 3 | E884: =RC[-2] -> 801530 | F884: =IF(RC[-4]=1,0,R[-1]C+R[-1]C[-3]) -> 74966970
A885: =R[-300]C+1 -> 3 | B885: =R[-300]C -> 279 | C885: 807200 | D885: 3 | E885: =RC[-2] -> 807200 | F885: =IF(RC[-4]=1,0,R[-1]C+R[-1]C[-3]) -> 75768500
A886: =R[-300]C+1 -> 3 | B886: =R[-300]C -> 280 | C886: 812890 | D886: 3 | E886: =RC[-2] -> 812890 | F886: =IF(RC[-4]=1,0,R[-1]C+R[-1]C[-3]) -> 76575700
A887: =R[-300]C+1 -> 3 | B887: =R[-300]C -> 281 | C887: 818600 | D887: 3 | E887: =RC[-2] -> 818600 | F887: =IF(RC[-4]=1,0,R[-1]C+R[-1]C[-3]) -> 77388590
A888: =R[-300]C+1 -> 3 | B888: =R[-300]C -> 282 | C888: 824330 | D888: 3 | E888: =RC[-2] -> 824330 | F888: =IF(RC[-4]=1,0,R[-1]C+R[-1]C[-3]) -> 78207190
A889: =R[-300]C+1 -> 3 | B889: =R[-300]C -> 283 | C889: 830080 | D889: 3 | E889: =RC[-2] -> 830080 | F889: =IF(RC[-4]=1,0,R[-1]C+R[-1]C[-3]) -> 79031520
A890: =R[-300]C+1 -> 3 | B890: =R[-300]C -> 284 | C890: 835850 | D890: 3 | E890: =RC[-2] -> 835850 | F890: =IF(RC[-4]=1,0,R[-1]C+R[-1]C[-3]) -> 79861600
A891: =R[-300]C+1 -> 3 | B891: =R[-300]C -> 285 | C891: 841640 | D891: 3 | E891: =RC[-2] -> 841640 | F891: =IF(RC[-4]=1,0,R[-1]C+R[-1]C[-3]) -> 80697450
A892: =R[-300]C+1 -> 3 | B892: =R[-300]C -> 286 | C892: 847450 | D892: 3 | E892: =RC[-2] -> 847450 | F892: =IF(RC[-4]=1,0,R[-1]C+R[-1]C[-3]) -> 81539090
A893: =R[-300]C+1 -> 3 | B893: =R[-300]C -> 287 | C893: 853280 | D893: 3 | E893: =RC[-2] -> 853280 | F893: =IF(RC[-4]=1,0,R[-1]C+R[-1]C[-3]) -> 82386540
A894: =R[-300]C+1 -> 3 | B894: =R[-300]C -> 288 | C894: 859130 | D894: 3 | E894: =RC[-2] -> 859130 | F894: =IF(RC[-4]=1,0,R[-1]C+R[-1]C[-3]) -> 83239820
A895: =R[-300]C+1 -> 3 | B895: =R[-300]C -> 289 | C895: 865000 | D895: 3 | E895: =RC[-2] -> 865000 | F895: =IF(RC[-4]=1,0,R[-1]C+R[-1]C[-3]) -> 84098950
A896: =R[-300]C+1 -> 3 | B896: =R[-300]C -> 290 | C896: 870890 | D896: 3 | E896: =RC[-2] -> 870890 | F896: =IF(RC[-4]=1,0,R[-1]C+R[-1]C[-3]) -> 84963950
A897: =R[-300]C+1 -> 3 | B897: =R[-300]C -> 291 | C897: 876800 | D897: 3 | E897: =RC[-2] -> 876800 | F897: =IF(RC[-4]=1,0,R[-1]C+R[-1]C[-3]) -> 85834840
A898: =R[-300]C+1 -> 3 | B898: =R[-300]C -> 292 | C898: 882730 | D898: 3 | E898: =RC[-2] -> 882730 | F898: =IF(RC[-4]=1,0,R[-1]C+R[-1]C[-3]) -> 86711640
A899: =R[-300]C+1 -> 3 | B899: =R[-300]C -> 293 | C899: 888680 | D899: 3 | E899: =RC[-2] -> 888680 | F899: =IF(RC[-4]=1,0,R[-1]C+R[-1]C[-3]) -> 87594370
A900: =R[-300]C+1 -> 3 | B900: =R[-300]C -> 294 | C900: 894650 | D900: 3 | E900: =RC[-2] -> 894650 | F900: =IF(RC[-4]=1,0,R[-1]C+R[-1]C[-3]) -> 88483050
A901: =R[-300]C+1 -> 3 | B901: =R[-300]C -> 295 | C901: 900640 | D901: 3 | E901: =RC[-2] -> 900640 | F901: =IF(RC[-4]=1,0,R[-1]C+R[-1]C[-3]) -> 89377700
A902: =R[-300]C+1 -> 3 | B902: =R[-300]C -> 296 | C902: 906650 | D902: 3 | E902: =RC[-2] -> 906650 | F902: =IF(RC[-4]=1,0,R[-1]C+R[-1]C[-3]) -> 90278340
A903: =R[-300]C+1 -> 3 | B903: =R[-300]C -> 297 | C903: 912680 | D903: 3 | E903: =RC[-2] -> 912680 | F903: =IF(RC[-4]=1,0,R[-1]C+R[-1]C[-3]) -> 91184990
A904: =R[-300]C+1 -> 3 | B904: =R[-300]C -> 298 | C904: 918730 | D904: 3 | E904: =RC[-2] -> 918730 | F904: =IF(RC[-4]=1,0,R[-1]C+R[-1]C[-3]) -> 92097670
A905: =R[-300]C+1 -> 3 | B905: =R[-300]C -> 299 | C905: 924800 | D905: 3 | E905: =RC[-2] -> 924800 | F905: =IF(RC[-4]=1,0,R[-1]C+R[-1]C[-3]) -> 93016400
A906: =R[-300]C+1 -> 3 | B906: =R[-300]C -> 300 | C906: 930890 | D906: 3 | E906: =RC[-2] -> 930890 | F906: =IF(RC[-4]=1,0,R[-1]C+R[-1]C[-3]) -> 93941200
A907: =R[-300]C+1 -> 4 | B907: =R[-300]C -> 1 | C907: 500 | D907: 3 | E907: =RC[-2] -> 500 | F907: =IF(RC[-4]=1,0,R[-1]C+R[-1]C[-3]) -> 0
A908: =R[-300]C+1 -> 4 | B908: =R[-300]C -> 2 | C908: 565 | D908: 3 | E908: =RC[-2] -> 565 | F908: =IF(RC[-4]=1,0,R[-1]C+R[-1]C[-3]) -> 500
A909: =R[-300]C+1 -> 4 | B909: =R[-300]C -> 3 | C909: 640 | D909: 3 | E909: =RC[-2] -> 640 | F909: =IF(RC[-4]=1,0,R[-1]C+R[-1]C[-3]) -> 1065
A910: =R[-300]C+1 -> 4 | B910: =R[-300]C -> 4 | C910: 725 | D910: 3 | E910: =RC[-2] -> 725 | F910: =IF(RC[-4]=1,0,R[-1]C+R[-1]C[-3]) -> 1705
A911: =R[-300]C+1 -> 4 | B911: =R[-300]C -> 5 | C911: 820 | D911: 3 | E911: =RC[-2] -> 820 | F911: =IF(RC[-4]=1,0,R[-1]C+R[-1]C[-3]) -> 2430
A912: =R[-300]C+1 -> 4 | B912: =R[-300]C -> 6 | C912: 925 | D912: 3 | E912: =RC[-2] -> 925 | F912: =IF(RC[-4]=1,0,R[-1]C+R[-1]C[-3]) -> 3250
A913: =R[-300]C+1 -> 4 | B913: =R[-300]C -> 7 | C913: 1040 | D913: 3 | E913: =RC[-2] -> 1040 | F913: =IF(RC[-4]=1,0,R[-1]C+R[-1]C[-3]) -> 4175
A914: =R[-300]C+1 -> 4 | B914: =R[-300]C -> 8 | C914: 1165 | D914: 3 | E914: =RC[-2] -> 1165 | F914: =IF(RC[-4]=1,0,R[-1]C+R[-1]C[-3]) -> 5215
A915: =R[-300]C+1 -> 4 | B915: =R[-300]C -> 9 | C915: 1300 | D915: 3 | E915: =RC[-2] -> 1300 | F915: =IF(RC[-4]=1,0,R[-1]C+R[-1]C[-3]) -> 6380
A916: =R[-300]C+1 -> 4 | B916: =R[-300]C -> 10 | C916: 1445 | D916: 3 | E916: =RC[-2] -> 1445 | F916: =IF(RC[-4]=1,0,R[-1]C+R[-1]C[-3]) -> 7680
A917: =R[-300]C+1 -> 4 | B917: =R[-300]C -> 11 | C917: 1800 | D917: 3 | E917: =RC[-2] -> 1800 | F917: =IF(RC[-4]=1,0,R[-1]C+R[-1]C[-3]) -> 9125
A918: =R[-300]C+1 -> 4 | B918: =R[-300]C -> 12 | C918: 1986 | D918: 3 | E918: =RC[-2] -> 1986 | F918: =IF(RC[-4]=1,0,R[-1]C+R[-1]C[-3]) -> 10925
A919: =R[-300]C+1 -> 4 | B919: =R[-300]C -> 13 | C919: 2183 | D919: 3 | E919: =RC[-2] -> 2183 | F919: =IF(RC[-4]=1,0,R[-1]C+R[-1]C[-3]) -> 12911
A920: =R[-300]C+1 -> 4 | B920: =R[-300]C -> 14 | C920: 2391 | D920: 3 | E920: =RC[-2] -> 2391 | F920: =IF(RC[-4]=1,0,R[-1]C+R[-1]C[-3]) -> 15094
A921: =R[-300]C+1 -> 4 | B921: =R[-300]C -> 15 | C921: 2610 | D921: 3 | E921: =RC[-2] -> 2610 | F921: =IF(RC[-4]=1,0,R[-1]C+R[-1]C[-3]) -> 17485
A922: =R[-300]C+1 -> 4 | B922: =R[-300]C -> 16 | C922: 2841 | D922: 3 | E922: =RC[-2] -> 2841 | F922: =IF(RC[-4]=1,0,R[-1]C+R[-1]C[-3]) -> 20095
A923: =R[-300]C+1 -> 4 | B923: =R[-300]C -> 17 | C923: 3083 | D923: 3 | E923: =RC[-2] -> 3083 | F923: =IF(RC[-4]=1,0,R[-1]C+R[-1]C[-3]) -> 22936
A924: =R[-300]C+1 -> 4 | B924: =R[-300]C -> 18 | C924: 3336 | D924: 3 | E924: =RC[-2] -> 3336 | F924: =IF(RC[-4]=1,0,R[-1]C+R[-1]C[-3]) -> 26019
A925: =R[-300]C+1 -> 4 | B925: =R[-300]C -> 19 | C925: 3600 | D925: 3 | E925: =RC[-2] -> 3600 | F925: =IF(RC[-4]=1,0,R[-1]C+R[-1]C[-3]) -> 29355
A926: =R[-300]C+1 -> 4 | B926: =R[-300]C -> 20 | C926: 3876 | D926: 3 | E926: =RC[-2] -> 3876 | F926: =IF(RC[-4]=1,0,R[-1]C+R[-1]C[-3]) -> 32955
A927: =R[-300]C+1 -> 4 | B927: =R[-300]C -> 21 | C927: 4625 | D927: 3 | E927: =RC[-2] -> 4625 | F927: =IF(RC[-4]=1,0,R[-1]C+R[-1]C[-3]) -> 36831
A928: =R[-300]C+1 -> 4 | B928: =R[-300]C -> 22 | C928: 4956 | D928: 3 | E928: =RC[-2] -> 4956 | F928: =IF(RC[-4]=1,0,R[-1]C+R[-1]C[-3]) -> 41456
A929: =R[-300]C+1 -> 4 | B929: =R[-300]C -> 23 | C929: 5300 | D929: 3 | E929: =RC[-2] -> 5300 | F929: =IF(RC[-4]=1,0,R[-1]C+R[-1]C[-3]) -> 46412
A930: =R[-300]C+1 -> 4 | B930: =R[-300]C -> 24 | C930: 5656 | D930: 3 | E930: =RC[-2] -> 5656 | F930: =IF(RC[-4]=1,0,R[-1]C+R[-1]C[-3]) -> 51712
A931: =R[-300]C+1 -> 4 | B931: =R[-300]C -> 25 | C931: 6025 | D931: 3 | E931: =RC[-2] -> 6025 | F931: =IF(RC[-4]=1,0,R[-1]C+R[-1]C[-3]) -> 57368
A932: =R[-300]C+1 -> 4 | B932: =R[-300]C -> 26 | C932: 6406 | D932: 3 | E932: =RC[-2] -> 6406 | F932: =IF(RC[-4]=1,0,R[-1]C+R[-1]C[-3]) -> 63393
A933: =R[-300]C+1 -> 4 | B933: =R[-300]C -> 27 | C933: 6800 | D933: 3 | E933: =RC[-2] -> 6800 | F933: =IF(RC[-4]=1,0,R[-1]C+R[-1]C[-3]) -> 69799
A934: =R[-300]C+1 -> 4 | B934: =R[-300]C -> 28 | C934: 7206 | D934: 3 | E934: =RC[-2] -> 7206 | F934: =IF(RC[-4]=1,0,R[-1]C+R[-1]C[-3]) -> 76599
A935: =R[-300]C+1 -> 4 | B935: =R[-300]C -> 29 | C935: 7625 | D935: 3 | E935: =RC[-2] -> 7625 | F935: =IF(RC[-4]=1,0,R[-1]C+R[-1]C[-3]) -> 83805
A936: =R[-300]C+1 -> 4 | B936: =R[-300]C -> 30 | C936: 8056 | D936: 3 | E936: =RC[-2] -> 8056 | F936: =IF(RC[-4]=1,0,R[-1]C+R[-1]C[-3]) -> 91430
A937: =R[-300]C+1 -> 4 | B937: =R[-300]C -> 31 | C937: 10200 | D937: 3 | E937: =RC[-2] -> 10200 | F937: =IF(RC[-4]=1,0,R[-1]C+R[-1]C[-3]) -> 99486
A938: =R[-300]C+1 -> 4 | B938: =R[-300]C -> 32 | C938: 10748 | D938: 3 | E938: =RC[-2] -> 10748 | F938: =IF(RC[-4]=1,0,R[-1]C+R[-1]C[-3]) -> 109686
A939: =R[-300]C+1 -> 4 | B939: =R[-300]C -> 33 | C939: 11310 | D939: 3 | E939: =RC[-2] -> 11310 | F939: =IF(RC[-4]=1,0,R[-1]C+R[-1]C[-3]) -> 120434
A940: =R[-300]C+1 -> 4 | B940: =R[-300]C -> 34 | C940: 11888 | D940: 3 | E940: =RC[-2] -> 11888 | F940: =IF(RC[-4]=1,0,R[-1]C+R[-1]C[-3]) -> 131744
A941: =R[-300]C+1 -> 4 | B941: =R[-300]C -> 35 | C941: 12480 | D941: 3 | E941: =RC[-2] -> 12480 | F941: =IF(RC[-4]=1,0,R[-1]C+R[-1]C[-3]) -> 143632
A942: =R[-300]C+1 -> 4 | B942: =R[-300]C -> 36 | C942: 13088 | D942: 3 | E942: =RC[-2] -> 13088 | F942: =IF(RC[-4]=1,0,R[-1]C+R[-1]C[-3]) -> 156112
A943: =R[-300]C+1 -> 4 | B943: =R[-300]C -> 37 | C943: 13710 | D943: 3 | E943: =RC[-2] -> 13710 | F943: =IF(RC[-4]=1,0,R[-1]C+R[-1]C[-3]) -> 169200
A944: =R[-300]C+1 -> 4 | B944: =R[-300]C -> 38 | C944: 14348 | D944: 3 | E944: =RC[-2] -> 14348 | F944: =IF(RC[-4]=1,0,R[-1]C+R[-1]C[-3]) -> 182910
A945: =R[-300]C+1 -> 4 | B945: =R[-300]C -> 39 | C945: 15000 | D945: 3 | E945: =RC[-2] -> 15000 | F945: =IF(RC[-4]=1,0,R[-1]C+R[-1]C[-3]) -> 197258
A946: =R[-300]C+1 -> 4 | B946: =R[-300]C -> 40 | C946: 15668 | D946: 3 | E946: =RC[-2] -> 15668 | F946: =IF(RC[-4]=1,0,R[-1]C+R[-1]C[-3]) -> 212258
A947: =R[-300]C+1 -> 4 | B947: =R[-300]C -> 41 | C947: 19075 | D947: 3 | E947: =RC[-2] -> 19075 | F947: =IF(RC[-4]=1,0,R[-1]C+R[-1]C[-3]) -> 227926
A948: =R[-300]C+1 -> 4 | B948: =R[-300]C -> 42 | C948: 19889 | D948: 3 | E948: =RC[-2] -> 19889 | F948: =IF(RC[-4]=1,0,R[-1]C+R[-1]C[-3]) -> 247001
A949: =R[-300]C+1 -> 4 | B949: =R[-300]C -> 43 | C949: 20720 | D949: 3 | E949: =RC[-2] -> 20720 | F949: =IF(RC[-4]=1,0,R[-1]C+R[-1]C[-3]) -> 266890
A950: =R[-300]C+1 -> 4 | B950: =R[-300]C -> 44 | C950: 21569 | D950: 3 | E950: =RC[-2] -> 21569 | F950: =IF(RC[-4]=1,0,R[-1]C+R[-1]C[-3]) -> 287610
A951: =R[-300]C+1 -> 4 | B951: =R[-300]C -> 45 | C951: 22435 | D951: 3 | E951: =RC[-2] -> 22435 | F951: =IF(RC[-4]=1,0,R[-1]C+R[-1]C[-3]) -> 309179
A952: =R[-300]C+1 -> 4 | B952: =R[-300]C -> 46 | C952: 23319 | D952: 3 | E952: =RC[-2] -> 23319 | F952: =IF(RC[-4]=1,0,R[-1]C+R[-1]C[-3]) -> 331614
A953: =R[-300]C+1 -> 4 | B953: =R[-300]C -> 47 | C953: 24220 | D953: 3 | E953: =RC[-2] -> 24220 | F953: =IF(RC[-4]=1,0,R[-1]C+R[-1]C[-3]) -> 354933
A954: =R[-300]C+1 -> 4 | B954: =R[-300]C -> 48 | C954: 25139 | D954: 3 | E954: =RC[-2] -> 25139 | F954: =IF(RC[-4]=1,0,R[-1]C+R[-1]C[-3]) -> 379153
A955: =R[-300]C+1 -> 4 | B955: =R[-300]C -> 49 | C955: 26075 | D955: 3 | E955: =RC[-2] -> 26075 | F955: =IF(RC[-4]=1,0,R[-1]C+R[-1]C[-3]) -> 404292
A956: =R[-300]C+1 -> 4 | B956: =R[-300]C -> 50 | C956: 27029 | D956: 3 | E956: =RC[-2] -> 27029 | F956: =IF(RC[-4]=1,0,R[-1]C+R[-1]C[-3]) -> 430367
A957: =R[-300]C+1 -> 4 | B957: =R[-300]C -> 51 | C957: 32000 | D957: 3 | E957: =RC[-2] -> 32000 | F957: =IF(RC[-4]=1,0,R[-1]C+R[-1]C[-3]) -> 457396
A958: =R[-300]C+1 -> 4 | B958: =R[-300]C -> 52 | C958: 33130 | D958: 3 | E958: =RC[-2] -> 33130 | F958: =IF(RC[-4]=1,0,R[-1]C+R[-1]C[-3]) -> 489396
A959: =R[-300]C+1 -> 4 | B959: =R[-300]C -> 53 | C959: 34280 | D959: 3 | E959: =RC[-2] -> 34280 | F959: =IF(RC[-4]=1,0,R[-1]C+R[-1]C[-3]) -> 522526
A960: =R[-300]C+1 -> 4 | B960: =R[-300]C -> 54 | C960: 35450 | D960: 3 | E960: =RC[-2] -> 35450 | F960: =IF(RC[-4]=1,0,R[-1]C+R[-1]C[-3]) -> 556806
A961: =R[-300]C+1 -> 4 | B961: =R[-300]C -> 55 | C961: 36640 | D961: 3 | E961: =RC[-2] -> 36640 | F961: =IF(RC[-4]=1,0,R[-1]C+R[-1]C[-3]) -> 592256
A962: =R[-300]C+1 -> 4 | B962: =R[-300]C -> 56 | C962: 37850 | D962: 3 | E962: =RC[-2] -> 37850 | F962: =IF(RC[-4]=1,0,R[-1]C+R[-1]C[-3]) -> 628896
A963: =R[-300]C+1 -> 4 | B963: =R[-300]C -> 57 | C963: 39080 | D963: 3 | E963: =RC[-2] -> 39080 | F963: =IF(RC[-4]=1,0,R[-1]C+R[-1]C[-3]) -> 666746
A964: =R[-300]C+1 -> 4 | B964: =R[-300]C -> 58 | C964: 40330 | D964: 3 | E964: =RC[-2] -> 40330 | F964: =IF(RC[-4]=1,0,R[-1]C+R[-1]C[-3]) -> 705826
A965: =R[-300]C+1 -> 4 | B965: =R[-300]C -> 59 | C965: 41600 | D965: 3 | E965: =RC[-2] -> 41600 | F965: =IF(RC[-4]=1,0,R[-1]C+R[-1]C[-3]) -> 746156
A966: =R[-300]C+1 -> 4 | B966: =R[-300]C -> 60 | C966: 42890 | D966: 3 | E966: =RC[-2] -> 42890 | F966: =IF(RC[-4]=1,0,R[-1]C+R[-1]C[-3]) -> 787756
A967: =R[-300]C+1 -> 4 | B967: =R[-300]C -> 61 | C967: 49725 | D967: 3 | E967: =RC[-2] -> 49725 | F967: =IF(RC[-4]=1,0,R[-1]C+R[-1]C[-3]) -> 830646
A968: =R[-300]C+1 -> 4 | B968: =R[-300]C -> 62 | C968: 51221 | D968: 3 | E968: =RC[-2] -> 51221 | F968: =IF(RC[-4]=1,0,R[-1]C+R[-1]C[-3]) -> 880371
A969: =R[-300]C+1 -> 4 | B969: =R[-300]C -> 63 | C969: 52740 | D969: 3 | E969: =RC[-2] -> 52740 | F969: =IF(RC[-4]=1,0,R[-1]C+R[-1]C[-3]) -> 931592
A970: =R[-300]C+1 -> 4 | B970: =R[-300]C -> 64 | C970: 54281 | D970: 3 | E970: =RC[-2] -> 54281 | F970: =IF(RC[-4]=1,0,R[-1]C+R[-1]C[-3]) -> 984332
A971: =R[-300]C+1 -> 4 | B971: =R[-300]C -> 65 | C971: 55845 | D971: 3 | E971: =RC[-2] -> 55845 | F971: =IF(RC[-4]=1,0,R[-1]C+R[-1]C[-3]) -> 1038613
A972: =R[-300]C+1 -> 4 | B972: =R[-300]C -> 66 | C972: 57431 | D972: 3 | E972: =RC[-2] -> 57431 | F972: =IF(RC[-4]=1,0,R[-1]C+R[-1]C[-3]) -> 1094458
A973: =R[-300]C+1 -> 4 | B973: =R[-300]C -> 67 | C973: 59040 | D973: 3 | E973: =RC[-2] -> 59040 | F973: =IF(RC[-4]=1,0,R[-1]C+R[-1]C[-3]) -> 1151889
A974: =R[-300]C+1 -> 4 | B974: =R[-300]C -> 68 | C974: 60671 | D974: 3 | E974: =RC[-2] -> 60671 | F974: =IF(RC[-4]=1,0,R[-1]C+R[-1]C[-3]) -> 1210929
A975: =R[-300]C+1 -> 4 | B975: =R[-300]C -> 69 | C975: 62325 | D975: 3 | E975: =RC[-2] -> 62325 | F975: =IF(RC[-4]=1,0,R[-1]C+R[-1]C[-3]) -> 1271600
A976: =R[-300]C+1 -> 4 | B976: =R[-300]C -> 70 | C976: 64001 | D976: 3 | E976: =RC[-2] -> 64001 | F976: =IF(RC[-4]=1,0,R[-1]C+R[-1]C[-3]) -> 1333925
A977: =R[-300]C+1 -> 4 | B977: =R[-300]C -> 71 | C977: 73000 | D977: 3 | E977: =RC[-2] -> 73000 | F977: =IF(RC[-4]=1,0,R[-1]C+R[-1]C[-3]) -> 1397926
A978: =R[-300]C+1 -> 4 | B978: =R[-300]C -> 72 | C978: 74913 | D978: 3 | E978: =RC[-2] -> 74913 | F978: =IF(RC[-4]=1,0,R[-1]C+R[-1]C[-3]) -> 1470926
A979: =R[-300]C+1 -> 4 | B979: =R[-300]C -> 73 | C979: 76850 | D979: 3 | E979: =RC[-2] -> 76850 | F979: =IF(RC[-4]=1,0,R[-1]C+R[-1]C[-3]) -> 1545839
A980: =R[-300]C+1 -> 4 | B980: =R[-300]C -> 74 | C980: 78813 | D980: 3 | E980: =RC[-2] -> 78813 | F980: =IF(RC[-4]=1,0,R[-1]C+R[-1]C[-3]) -> 1622689
A981: =R[-300]C+1 -> 4 | B981: =R[-300]C -> 75 | C981: 80800 | D981: 3 | E981: =RC[-2] -> 80800 | F981: =IF(RC[-4]=1,0,R[-1]C+R[-1]C[-3]) -> 1701502
A982: =R[-300]C+1 -> 4 | B982: =R[-300]C -> 76 | C982: 82813 | D982: 3 | E982: =RC[-2] -> 82813 | F982: =IF(RC[-4]=1,0,R[-1]C+R[-1]C[-3]) -> 1782302
A983: =R[-300]C+1 -> 4 | B983: =R[-300]C -> 77 | C983: 84850 | D983: 3 | E983: =RC[-2] -> 84850 | F983: =IF(RC[-4]=1,0,R[-1]C+R[-1]C[-3]) -> 1865115
A984: =R[-300]C+1 -> 4 | B984: =R[-300]C -> 78 | C984: 86913 | D984: 3 | E984: =RC[-2] -> 86913 | F984: =IF(RC[-4]=1,0,R[-1]C+R[-1]C[-3]) -> 1949965
A985: =R[-300]C+1 -> 4 | B985: =R[-300]C -> 79 | C985: 89000 | D985: 3 | E985: =RC[-2] -> 89000 | F985: =IF(RC[-4]=1,0,R[-1]C+R[-1]C[-3]) -> 2036878
A986: =R[-300]C+1 -> 4 | B986: =R[-300]C -> 80 | C986: 91113 | D986: 3 | E986: =RC[-2] -> 91113 | F986: =IF(RC[-4]=1,0,R[-1]C+R[-1]C[-3]) -> 2125878
A987: =R[-300]C+1 -> 4 | B987: =R[-300]C -> 81 | C987: 93250 | D987: 3 | E987: =RC[-2] -> 93250 | F987: =IF(RC[-4]=1,0,R[-1]C+R[-1]C[-3]) -> 2216991
A988: =R[-300]C+1 -> 4 | B988: =R[-300]C -> 82 | C988: 95413 | D988: 3 | E988: =RC[-2] -> 95413 | F988: =IF(RC[-4]=1,0,R[-1]C+R[-1]C[-3]) -> 2310241
A989: =R[-300]C+1 -> 4 | B989: =R[-300]C -> 83 | C989: 97600 | D989: 3 | E989: =RC[-2] -> 97600 | F989: =IF(RC[-4]=1,0,R[-1]C+R[-1]C[-3]) -> 2405654
A990: =R[-300]C+1 -> 4 | B990: =R[-300]C -> 84 | C990: 99813 | D990: 3 | E990: =RC[-2] -> 99813 | F990: =IF(RC[-4]=1,0,R[-1]C+R[-1]C[-3]) -> 2503254
A991: =R[-300]C+1 -> 4 | B991: =R[-300]C -> 85 | C991: 102050 | D991: 3 | E991: =RC[-2] -> 102050 | F991: =IF(RC[-4]=1,0,R[-1]C+R[-1]C[-3]) -> 2603067
A992: =R[-300]C+1 -> 4 | B992: =R[-300]C -> 86 | C992: 104313 | D992: 3 | E992: =RC[-2] -> 104313 | F992: =IF(RC[-4]=1,0,R[-1]C+R[-1]C[-3]) -> 2705117
A993: =R[-300]C+1 -> 4 | B993: =R[-300]C -> 87 | C993: 106600 | D993: 3 | E993: =RC[-2] -> 106600 | F993: =IF(RC[-4]=1,0,R[-1]C+R[-1]C[-3]) -> 2809430
A994: =R[-300]C+1 -> 4 | B994: =R[-300]C -> 88 | C994: 108913 | D994: 3 | E994: =RC[-2] -> 108913 | F994: =IF(RC[-4]=1,0,R[-1]C+R[-1]C[-3]) -> 2916030
A995: =R[-300]C+1 -> 4 | B995: =R[-300]C -> 89 | C995: 111250 | D995: 3 | E995: =RC[-2] -> 111250 | F995: =IF(RC[-4]=1,0,R[-1]C+R[-1]C[-3]) -> 3024943
A996: =R[-300]C+1 -> 4 | B996: =R[-300]C -> 90 | C996: 113613 | D996: 3 | E996: =RC[-2] -> 113613 | F996: =IF(RC[-4]=1,0,R[-1]C+R[-1]C[-3]) -> 3136193
A997: =R[-300]C+1 -> 4 | B997: =R[-300]C -> 91 | C997: 116000 | D997: 3 | E997: =RC[-2] -> 116000 | F997: =IF(RC[-4]=1,0,R[-1]C+R[-1]C[-3]) -> 3249806
A998: =R[-300]C+1 -> 4 | B998: =R[-300]C -> 92 | C998: 118413 | D998: 3 | E998: =RC[-2] -> 118413 | F998: =IF(RC[-4]=1,0,R[-1]C+R[-1]C[-3]) -> 3365806
A999: =R[-300]C+1 -> 4 | B999: =R[-300]C -> 93 | C999: 120850 | D999: 3 | E999: =RC[-2] -> 120850 | F999: =IF(RC[-4]=1,0,R[-1]C+R[-1]C[-3]) -> 3484219
A1000: =R[-300]C+1 -> 4 | B1000: =R[-300]C -> 94 | C1000: 123313 | D1000: 3 | E1000: =RC[-2] -> 123313 | F1000: =IF(RC[-4]=1,0,R[-1]C+R[-1]C[-3]) -> 3605069
A1001: =R[-300]C+1 -> 4 | B1001: =R[-300]C -> 95 | C1001: 125800 | D1001: 3 | E1001: =RC[-2] -> 125800 | F1001: =IF(RC[-4]=1,0,R[-1]C+R[-1]C[-3]) -> 3728382
A1002: =R[-300]C+1 -> 4 | B1002: =R[-300]C -> 96 | C1002: 128313 | D1002: 3 | E1002: =RC[-2] -> 128313 | F1002: =IF(RC[-4]=1,0,R[-1]C+R[-1]C[-3]) -> 3854182
A1003: =R[-300]C+1 -> 4 | B1003: =R[-300]C -> 97 | C1003: 130850 | D1003: 3 | E1003: =RC[-2] -> 130850 | F1003: =IF(RC[-4]=1,0,R[-1]C+R[-1]C[-3]) -> 3982495
A1004: =R[-300]C+1 -> 4 | B1004: =R[-300]C -> 98 | C1004: 133413 | D1004: 3 | E1004: =RC[-2] -> 133413 | F1004: =IF(RC[-4]=1,0,R[-1]C+R[-1]C[-3]) -> 4113345
A1005: =R[-300]C+1 -> 4 | B1005: =R[-300]C -> 99 | C1005: 136000 | D1005: 3 | E1005: =RC[-2] -> 136000 | F1005: =IF(RC[-4]=1,0,R[-1]C+R[-1]C[-3]) -> 4246758
A1006: =R[-300]C+1 -> 4 | B1006: =R[-300]C -> 100 | C1006: 138613 | D1006: 3 | E1006: =RC[-2] -> 138613 | F1006: =IF(RC[-4]=1,0,R[-1]C+R[-1]C[-3]) -> 4382758
A1007: =R[-300]C+1 -> 4 | B1007: =R[-300]C -> 101 | C1007: 141250 | D1007: 3 | E1007: =RC[-2] -> 141250 | F1007: =IF(RC[-4]=1,0,R[-1]C+R[-1]C[-3]) -> 4521371
A1008: =R[-300]C+1 -> 4 | B1008: =R[-300]C -> 102 | C1008: 143913 | D1008: 3 | E1008: =RC[-2] -> 143913 | F1008: =IF(RC[-4]=1,0,R[-1]C+R[-1]C[-3]) -> 4662621
A1009: =R[-300]C+1 -> 4 | B1009: =R[-300]C -> 103 | C1009: 146600 | D1009: 3 | E1009: =RC[-2] -> 146600 | F1009: =IF(RC[-4]=1,0,R[-1]C+R[-1]C[-3]) -> 4806534
A1010: =R[-300]C+1 -> 4 | B1010: =R[-300]C -> 104 | C1010: 149313 | D1010: 3 | E1010: =RC[-2] -> 149313 | F1010: =IF(RC[-4]=1,0,R[-1]C+R[-1]C[-3]) -> 4953134
A1011: =R[-300]C+1 -> 4 | B1011: =R[-300]C -> 105 | C1011: 152050 | D1011: 3 | E1011: =RC[-2] -> 152050 | F1011: =IF(RC[-4]=1,0,R[-1]C+R[-1]C[-3]) -> 5102447
A1012: =R[-300]C+1 -> 4 | B1012: =R[-300]C -> 106 | C1012: 154813 | D1012: 3 | E1012: =RC[-2] -> 154813 | F1012: =IF(RC[-4]=1,0,R[-1]C+R[-1]C[-3]) -> 5254497
A1013: =R[-300]C+1 -> 4 | B1013: =R[-300]C -> 107 | C1013: 157600 | D1013: 3 | E1013: =RC[-2] -> 157600 | F1013: =IF(RC[-4]=1,0,R[-1]C+R[-1]C[-3]) -> 5409310
A1014: =R[-300]C+1 -> 4 | B1014: =R[-300]C -> 108 | C1014: 160413 | D1014: 3 | E1014: =RC[-2] -> 160413 | F1014: =IF(RC[-4]=1,0,R[-1]C+R[-1]C[-3]) -> 5566910
A1015: =R[-300]C+1 -> 4 | B1015: =R[-300]C -> 109 | C1015: 163250 | D1015: 3 | E1015: =RC[-2] -> 163250 | F1015: =IF(RC[-4]=1,0,R[-1]C+R[-1]C[-3]) -> 5727323
A1016: =R[-300]C+1 -> 4 | B1016: =R[-300]C -> 110 | C1016: 166113 | D1016: 3 | E1016: =RC[-2] -> 166113 | F1016: =IF(RC[-4]=1,0,R[-1]C+R[-1]C[-3]) -> 5890573
A1017: =R[-300]C+1 -> 4 | B1017: =R[-300]C -> 111 | C1017: 169000 | D1017: 3 | E1017: =RC[-2] -> 169000 | F1017: =IF(RC[-4]=1,0,R[-1]C+R[-1]C[-3]) -> 6056686
A1018: =R[-300]C+1 -> 4 | B1018: =R[-300]C -> 112 | C1018: 171913 | D1018: 3 | E1018: =RC[-2] -> 171913 | F1018: =IF(RC[-4]=1,0,R[-1]C+R[-1]C[-3]) -> 6225686
A1019: =R[-300]C+1 -> 4 | B1019: =R[-300]C -> 113 | C1019: 174850 | D1019: 3 | E1019: =RC[-2] -> 174850 | F1019: =IF(RC[-4]=1,0,R[-1]C+R[-1]C[-3]) -> 6397599
A1020: =R[-300]C+1 -> 4 | B1020: =R[-300]C -> 114 | C1020: 177813 | D1020: 3 | E1020: =RC[-2] -> 177813 | F1020: =IF(RC[-4]=1,0,R[-1]C+R[-1]C[-3]) -> 6572449
A1021: =R[-300]C+1 -> 4 | B1021: =R[-300]C -> 115 | C1021: 180800 | D1021: 3 | E1021: =RC[-2] -> 180800 | F1021: =IF(RC[-4]=1,0,R[-1]C+R[-1]C[-3]) -> 6750262
A1022: =R[-300]C+1 -> 4 | B1022: =R[-300]C -> 116 | C1022: 183813 | D1022: 3 | E1022: =RC[-2] -> 183813 | F1022: =IF(RC[-4]=1,0,R[-1]C+R[-1]C[-3]) -> 6931062
A1023: =R[-300]C+1 -> 4 | B1023: =R[-300]C -> 117 | C1023: 186850 | D1023: 3 | E1023: =RC[-2] -> 186850 | F1023: =IF(RC[-4]=1,0,R[-1]C+R[-1]C[-3]) -> 7114875
A1024: =R[-300]C+1 -> 4 | B1024: =R[-300]C -> 118 | C1024: 189913 | D1024: 3 | E1024: =RC[-2] -> 189913 | F1024: =IF(RC[-4]=1,0,R[-1]C+R[-1]C[-3]) -> 7301725
A1025: =R[-300]C+1 -> 4 | B1025: =R[-300]C -> 119 | C1025: 193000 | D1025: 3 | E1025: =RC[-2] -> 193000 | F1025: =IF(RC[-4]=1,0,R[-1]C+R[-1]C[-3]) -> 7491638
A1026: =R[-300]C+1 -> 4 | B1026: =R[-300]C -> 120 | C1026: 196113 | D1026: 3 | E1026: =RC[-2] -> 196113 | F1026: =IF(RC[-4]=1,0,R[-1]C+R[-1]C[-3]) -> 7684638
A1027: =R[-300]C+1 -> 4 | B1027: =R[-300]C -> 121 | C1027: 199250 | D1027: 3 | E1027: =RC[-2] -> 199250 | F1027: =IF(RC[-4]=1,0,R[-1]C+R[-1]C[-3]) -> 7880751
A1028: =R[-300]C+1 -> 4 | B1028: =R[-300]C -> 122 | C1028: 202413 | D1028: 3 | E1028: =RC[-2] -> 202413 | F1028: =IF(RC[-4]=1,0,R[-1]C+R[-1]C[-3]) -> 8080001
A1029: =R[-300]C+1 -> 4 | B1029: =R[-300]C -> 123 | C1029: 205600 | D1029: 3 | E1029: =RC[-2] -> 205600 | F1029: =IF(RC[-4]=1,0,R[-1]C+R[-1]C[-3]) -> 8282414
A1030: =R[-300]C+1 -> 4 | B1030: =R[-300]C -> 124 | C1030: 208813 | D1030: 3 | E1030: =RC[-2] -> 208813 | F1030: =IF(RC[-4]=1,0,R[-1]C+R[-1]C[-3]) -> 8488014
A1031: =R[-300]C+1 -> 4 | B1031: =R[-300]C -> 125 | C1031: 212050 | D1031: 3 | E1031: =RC[-2] -> 212050 | F1031: =IF(RC[-4]=1,0,R[-1]C+R[-1]C[-3]) -> 8696827
A1032: =R[-300]C+1 -> 4 | B1032: =R[-300]C -> 126 | C1032: 215313 | D1032: 3 | E1032: =RC[-2] -> 215313 | F1032: =IF(RC[-4]=1,0,R[-1]C+R[-1]C[-3]) -> 8908877
A1033: =R[-300]C+1 -> 4 | B1033: =R[-300]C -> 127 | C1033: 218600 | D1033: 3 | E1033: =RC[-2] -> 218600 | F1033: =IF(RC[-4]=1,0,R[-1]C+R[-1]C[-3]) -> 9124190
A1034: =R[-300]C+1 -> 4 | B1034: =R[-300]C -> 128 | C1034: 221913 | D1034: 3 | E1034: =RC[-2] -> 221913 | F1034: =IF(RC[-4]=1,0,R[-1]C+R[-1]C[-3]) -> 9342790
A1035: =R[-300]C+1 -> 4 | B1035: =R[-300]C -> 129 | C1035: 225250 | D1035: 3 | E1035: =RC[-2] -> 225250 | F1035: =IF(RC[-4]=1,0,R[-1]C+R[-1]C[-3]) -> 9564703
A1036: =R[-300]C+1 -> 4 | B1036: =R[-300]C -> 130 | C1036: 228613 | D1036: 3 | E1036: =RC[-2] -> 228613 | F1036: =IF(RC[-4]=1,0,R[-1]C+R[-1]C[-3]) -> 9789953
A1037: =R[-300]C+1 -> 4 | B1037: =R[-300]C -> 131 | C1037: 232000 | D1037: 3 | E1037: =RC[-2] -> 232000 | F1037: =IF(RC[-4]=1,0,R[-1]C+R[-1]C[-3]) -> 10018566
A1038: =R[-300]C+1 -> 4 | B1038: =R[-300]C -> 132 | C1038: 235413 | D1038: 3 | E1038: =RC[-2] -> 235413 | F1038: =IF(RC[-4]=1,0,R[-1]C+R[-1]C[-3]) -> 10250566
A1039: =R[-300]C+1 -> 4 | B1039: =R[-300]C -> 133 | C1039: 238850 | D1039: 3 | E1039: =RC[-2] -> 238850 | F1039: =IF(RC[-4]=1,0,R[-1]C+R[-1]C[-3]) -> 10485979
A1040: =R[-300]C+1 -> 4 | B1040: =R[-300]C -> 134 | C1040: 242313 | D1040: 3 | E1040: =RC[-2] -> 242313 | F1040: =IF(RC[-4]=1,0,R[-1]C+R[-1]C[-3]) -> 10724829
A1041: =R[-300]C+1 -> 4 | B1041: =R[-300]C -> 135 | C1041: 245800 | D1041: 3 | E1041: =RC[-2] -> 245800 | F1041: =IF(RC[-4]=1,0,R[-1]C+R[-1]C[-3]) -> 10967142
A1042: =R[-300]C+1 -> 4 | B1042: =R[-300]C -> 136 | C1042: 249313 | D1042: 3 | E1042: =RC[-2] -> 249313 | F1042: =IF(RC[-4]=1,0,R[-1]C+R[-1]C[-3]) -> 11212942
A1043: =R[-300]C+1 -> 4 | B1043: =R[-300]C -> 137 | C1043: 252850 | D1043: 3 | E1043: =RC[-2] -> 252850 | F1043: =IF(RC[-4]=1,0,R[-1]C+R[-1]C[-3]) -> 11462255
A1044: =R[-300]C+1 -> 4 | B1044: =R[-300]C -> 138 | C1044: 256413 | D1044: 3 | E1044: =RC[-2] -> 256413 | F1044: =IF(RC[-4]=1,0,R[-1]C+R[-1]C[-3]) -> 11715105
A1045: =R[-300]C+1 -> 4 | B1045: =R[-300]C -> 139 | C1045: 260000 | D1045: 3 | E1045: =RC[-2] -> 260000 | F1045: =IF(RC[-4]=1,0,R[-1]C+R[-1]C[-3]) -> 11971518
A1046: =R[-300]C+1 -> 4 | B1046: =R[-300]C -> 140 | C1046: 263613 | D1046: 3 | E1046: =RC[-2] -> 263613 | F1046: =IF(RC[-4]=1,0,R[-1]C+R[-1]C[-3]) -> 12231518
A1047: =R[-300]C+1 -> 4 | B1047: =R[-300]C -> 141 | C1047: 267250 | D1047: 3 | E1047: =RC[-2] -> 267250 | F1047: =IF(RC[-4]=1,0,R[-1]C+R[-1]C[-3]) -> 12495131
A1048: =R[-300]C+1 -> 4 | B1048: =R[-300]C -> 142 | C1048: 270913 | D1048: 3 | E1048: =RC[-2] -> 270913 | F1048: =IF(RC[-4]=1,0,R[-1]C+R[-1]C[-3]) -> 12762381
A1049: =R[-300]C+1 -> 4 | B1049: =R[-300]C -> 143 | C1049: 274600 | D1049: 3 | E1049: =RC[-2] -> 274600 | F1049: =IF(RC[-4]=1,0,R[-1]C+R[-1]C[-3]) -> 13033294
A1050: =R[-300]C+1 -> 4 | B1050: =R[-300]C -> 144 | C1050: 278313 | D1050: 3 | E1050: =RC[-2] -> 278313 | F1050: =IF(RC[-4]=1,0,R[-1]C+R[-1]C[-3]) -> 13307894
A1051: =R[-300]C+1 -> 4 | B1051: =R[-300]C -> 145 | C1051: 282050 | D1051: 3 | E1051: =RC[-2] -> 282050 | F1051: =IF(RC[-4]=1,0,R[-1]C+R[-1]C[-3]) -> 13586207
A1052: =R[-300]C+1 -> 4 | B1052: =R[-300]C -> 146 | C1052: 285813 | D1052: 3 | E1052: =RC[-2] -> 285813 | F1052: =IF(RC[-4]=1,0,R[-1]C+R[-1]C[-3]) -> 13868257
A1053: =R[-300]C+1 -> 4 | B1053: =R[-300]C -> 147 | C1053: 289600 | D1053: 3 | E1053: =RC[-2] -> 289600 | F1053: =IF(RC[-4]=1,0,R[-1]C+R[-1]C[-3]) -> 14154070
A1054: =R[-300]C+1 -> 4 | B1054: =R[-300]C -> 148 | C1054: 293413 | D1054: 3 | E1054: =RC[-2] -> 293413 | F1054: =IF(RC[-4]=1,0,R[-1]C+R[-1]C[-3]) -> 14443670
A1055: =R[-300]C+1 -> 4 | B1055: =R[-300]C -> 149 | C1055: 297250 | D1055: 3 | E1055: =RC[-2] -> 297250 | F1055: =IF(RC[-4]=1,0,R[-1]C+R[-1]C[-3]) -> 14737083
A1056: =R[-300]C+1 -> 4 | B1056: =R[-300]C -> 150 | C1056: 301113 | D1056: 3 | E1056: =RC[-2] -> 301113 | F1056: =IF(RC[-4]=1,0,R[-1]C+R[-1]C[-3]) -> 15034333
A1057: =R[-300]C+1 -> 4 | B1057: =R[-300]C -> 151 | C1057: 305000 | D1057: 3 | E1057: =RC[-2] -> 305000 | F1057: =IF(RC[-4]=1,0,R[-1]C+R[-1]C[-3]) -> 15335446
A1058: =R[-300]C+1 -> 4 | B1058: =R[-300]C -> 152 | C1058: 308913 | D1058: 3 | E1058: =RC[-2] -> 308913 | F1058: =IF(RC[-4]=1,0,R[-1]C+R[-1]C[-3]) -> 15640446
A1059: =R[-300]C+1 -> 4 | B1059: =R[-300]C -> 153 | C1059: 312850 | D1059: 3 | E1059: =RC[-2] -> 312850 | F1059: =IF(RC[-4]=1,0,R[-1]C+R[-1]C[-3]) -> 15949359
A1060: =R[-300]C+1 -> 4 | B1060: =R[-300]C -> 154 | C1060: 316813 | D1060: 3 | E1060: =RC[-2] -> 316813 | F1060: =IF(RC[-4]=1,0,R[-1]C+R[-1]C[-3]) -> 16262209
A1061: =R[-300]C+1 -> 4 | B1061: =R[-300]C -> 155 | C1061: 320800 | D1061: 3 | E1061: =RC[-2] -> 320800 | F1061: =IF(RC[-4]=1,0,R[-1]C+R[-1]C[-3]) -> 16579022
A1062: =R[-300]C+1 -> 4 | B1062: =R[-300]C -> 156 | C1062: 324813 | D1062: 3 | E1062: =RC[-2] -> 324813 | F1062: =IF(RC[-4]=1,0,R[-1]C+R[-1]C[-3]) -> 16899822
A1063: =R[-300]C+1 -> 4 | B1063: =R[-300]C -> 157 | C1063: 328850 | D1063: 3 | E1063: =RC[-2] -> 328850 | F1063: =IF(RC[-4]=1,0,R[-1]C+R[-1]C[-3]) -> 17224635
A1064: =R[-300]C+1 -> 4 | B1064: =R[-300]C -> 158 | C1064: 332913 | D1064: 3 | E1064: =RC[-2] -> 332913 | F1064: =IF(RC[-4]=1,0,R[-1]C+R[-1]C[-3]) -> 17553485
A1065: =R[-300]C+1 -> 4 | B1065: =R[-300]C -> 159 | C1065: 337000 | D1065: 3 | E1065: =RC[-2] -> 337000 | F1065: =IF(RC[-4]=1,0,R[-1]C+R[-1]C[-3]) -> 17886398
A1066: =R[-300]C+1 -> 4 | B1066: =R[-300]C -> 160 | C1066: 341113 | D1066: 3 | E1066: =RC[-2] -> 341113 | F1066: =IF(RC[-4]=1,0,R[-1]C+R[-1]C[-3]) -> 18223398
A1067: =R[-300]C+1 -> 4 | B1067: =R[-300]C -> 161 | C1067: 345250 | D1067: 3 | E1067: =RC[-2] -> 345250 | F1067: =IF(RC[-4]=1,0,R[-1]C+R[-1]C[-3]) -> 18564511
A1068: =R[-300]C+1 -> 4 | B1068: =R[-300]C -> 162 | C1068: 349413 | D1068: 3 | E1068: =RC[-2] -> 349413 | F1068: =IF(RC[-4]=1,0,R[-1]C+R[-1]C[-3]) -> 18909761
A1069: =R[-300]C+1 -> 4 | B1069: =R[-300]C -> 163 | C1069: 353600 | D1069: 3 | E1069: =RC[-2] -> 353600 | F1069: =IF(RC[-4]=1,0,R[-1]C+R[-1]C[-3]) -> 19259174
A1070: =R[-300]C+1 -> 4 | B1070: =R[-300]C -> 164 | C1070: 357813 | D1070: 3 | E1070: =RC[-2] -> 357813 | F1070: =IF(RC[-4]=1,0,R[-1]C+R[-1]C[-3]) -> 19612774
A1071: =R[-300]C+1 -> 4 | B1071: =R[-300]C -> 165 | C1071: 362050 | D1071: 3 | E1071: =RC[-2] -> 362050 | F1071: =IF(RC[-4]=1,0,R[-1]C+R[-1]C[-3]) -> 19970587
A1072: =R[-300]C+1 -> 4 | B1072: =R[-300]C -> 166 | C1072: 366313 | D1072: 3 | E1072: =RC[-2] -> 366313 | F1072: =IF(RC[-4]=1,0,R[-1]C+R[-1]C[-3]) -> 20332637
A1073: =R[-300]C+1 -> 4 | B1073: =R[-300]C -> 167 | C1073: 370600 | D1073: 3 | E1073: =RC[-2] -> 370600 | F1073: =IF(RC[-4]=1,0,R[-1]C+R[-1]C[-3]) -> 20698950
A1074: =R[-300]C+1 -> 4 | B1074: =R[-300]C -> 168 | C1074: 374913 | D1074: 3 | E1074: =RC[-2] -> 374913 | F1074: =IF(RC[-4]=1,0,R[-1]C+R[-1]C[-3]) -> 21069550
A1075: =R[-300]C+1 -> 4 | B1075: =R[-300]C -> 169 | C1075: 379250 | D1075: 3 | E1075: =RC[-2] -> 379250 | F1075: =IF(RC[-4]=1,0,R[-1]C+R[-1]C[-3]) -> 21444463
A1076: =R[-300]C+1 -> 4 | B1076: =R[-300]C -> 170 | C1076: 383613 | D1076: 3 | E1076: =RC[-2] -> 383613 | F1076: =IF(RC[-4]=1,0,R[-1]C+R[-1]C[-3]) -> 21823713
A1077: =R[-300]C+1 -> 4 | B1077: =R[-300]C -> 171 | C1077: 388000 | D1077: 3 | E1077: =RC[-2] -> 388000 | F1077: =IF(RC[-4]=1,0,R[-1]C+R[-1]C[-3]) -> 22207326
A1078: =R[-300]C+1 -> 4 | B1078: =R[-300]C -> 172 | C1078: 392413 | D1078: 3 | E1078: =RC[-2] -> 392413 | F1078: =IF(RC[-4]=1,0,R[-1]C+R[-1]C[-3]) -> 22595326
A1079: =R[-300]C+1 -> 4 | B1079: =R[-300]C -> 173 | C1079: 396850 | D1079: 3 | E1079: =RC[-2] -> 396850 | F1079: =IF(RC[-4]=1,0,R[-1]C+R[-1]C[-3]) -> 22987739
A1080: =R[-300]C+1 -> 4 | B1080: =R[-300]C -> 174 | C1080: 401313 | D1080: 3 | E1080: =RC[-2] -> 401313 | F1080: =IF(RC[-4]=1,0,R[-1]C+R[-1]C[-3]) -> 23384589
A1081: =R[-300]C+1 -> 4 | B1081: =R[-300]C -> 175 | C1081: 405800 | D1081: 3 | E1081: =RC[-2] -> 405800 | F1081: =IF(RC[-4]=1,0,R[-1]C+R[-1]C[-3]) -> 23785902
A1082: =R[-300]C+1 -> 4 | B1082: =R[-300]C -> 176 | C1082: 410313 | D1082: 3 | E1082: =RC[-2] -> 410313 | F1082: =IF(RC[-4]=1,0,R[-1]C+R[-1]C[-3]) -> 24191702
A1083: =R[-300]C+1 -> 4 | B1083: =R[-300]C -> 177 | C1083: 414850 | D1083: 3 | E1083: =RC[-2] -> 414850 | F1083: =IF(RC[-4]=1,0,R[-1]C+R[-1]C[-3]) -> 24602015
A1084: =R[-300]C+1 -> 4 | B1084: =R[-300]C -> 178 | C1084: 419413 | D1084: 3 | E1084: =RC[-2] -> 419413 | F1084: =IF(RC[-4]=1,0,R[-1]C+R[-1]C[-3]) -> 25016865
A1085: =R[-300]C+1 -> 4 | B1085: =R[-300]C -> 179 | C1085: 424000 | D1085: 3 | E1085: =RC[-2] -> 424000 | F1085: =IF(RC[-4]=1,0,R[-1]C+R[-1]C[-3]) -> 25436278
A1086: =R[-300]C+1 -> 4 | B1086: =R[-300]C -> 180 | C1086: 428613 | D1086: 3 | E1086: =RC[-2] -> 428613 | F1086: =IF(RC[-4]=1,0,R[-1]C+R[-1]C[-3]) -> 25860278
A1087: =R[-300]C+1 -> 4 | B1087: =R[-300]C -> 181 | C1087: 433250 | D1087: 3 | E1087: =RC[-2] -> 433250 | F1087: =IF(RC[-4]=1,0,R[-1]C+R[-1]C[-3]) -> 26288891
A1088: =R[-300]C+1 -> 4 | B1088: =R[-300]C -> 182 | C1088: 437913 | D1088: 3 | E1088: =RC[-2] -> 437913 | F1088: =IF(RC[-4]=1,0,R[-1]C+R[-1]C[-3]) -> 26722141
A1089: =R[-300]C+1 -> 4 | B1089: =R[-300]C -> 183 | C1089: 442600 | D1089: 3 | E1089: =RC[-2] -> 442600 | F1089: =IF(RC[-4]=1,0,R[-1]C+R[-1]C[-3]) -> 27160054
A1090: =R[-300]C+1 -> 4 | B1090: =R[-300]C -> 184 | C1090: 447313 | D1090: 3 | E1090: =RC[-2] -> 447313 | F1090: =IF(RC[-4]=1,0,R[-1]C+R[-1]C[-3]) -> 27602654
A1091: =R[-300]C+1 -> 4 | B1091: =R[-300]C -> 185 | C1091: 452050 | D1091: 3 | E1091: =RC[-2] -> 452050 | F1091: =IF(RC[-4]=1,0,R[-1]C+R[-1]C[-3]) -> 28049967
A1092: =R[-300]C+1 -> 4 | B1092: =R[-300]C -> 186 | C1092: 456813 | D1092: 3 | E1092: =RC[-2] -> 456813 | F1092: =IF(RC[-4]=1,0,R[-1]C+R[-1]C[-3]) -> 28502017
A1093: =R[-300]C+1 -> 4 | B1093: =R[-300]C -> 187 | C1093: 461600 | D1093: 3 | E1093: =RC[-2] -> 461600 | F1093: =IF(RC[-4]=1,0,R[-1]C+R[-1]C[-3]) -> 28958830
A1094: =R[-300]C+1 -> 4 | B1094: =R[-300]C -> 188 | C1094: 466413 | D1094: 3 | E1094: =RC[-2] -> 466413 | F1094: =IF(RC[-4]=1,0,R[-1]C+R[-1]C[-3]) -> 29420430
A1095: =R[-300]C+1 -> 4 | B1095: =R[-300]C -> 189 | C1095: 471250 | D1095: 3 | E1095: =RC[-2] -> 471250 | F1095: =IF(RC[-4]=1,0,R[-1]C+R[-1]C[-3]) -> 29886843
A1096: =R[-300]C+1 -> 4 | B1096: =R[-300]C -> 190 | C1096: 476113 | D1096: 3 | E1096: =RC[-2] -> 476113 | F1096: =IF(RC[-4]=1,0,R[-1]C+R[-1]C[-3]) -> 30358093
A1097: =R[-300]C+1 -> 4 | B1097: =R[-300]C -> 191 | C1097: 481000 | D1097: 3 | E1097: =RC[-2] -> 481000 | F1097: =IF(RC[-4]=1,0,R[-1]C+R[-1]C[-3]) -> 30834206
A1098: =R[-300]C+1 -> 4 | B1098: =R[-300]C -> 192 | C1098: 485913 | D1098: 3 | E1098: =RC[-2] -> 485913 | F1098: =IF(RC[-4]=1,0,R[-1]C+R[-1]C[-3]) -> 31315206
A1099: =R[-300]C+1 -> 4 | B1099: =R[-300]C -> 193 | C1099: 490850 | D1099: 3 | E1099: =RC[-2] -> 490850 | F1099: =IF(RC[-4]=1,0,R[-1]C+R[-1]C[-3]) -> 31801119
A1100: =R[-300]C+1 -> 4 | B1100: =R[-300]C -> 194 | C1100: 495813 | D1100: 3 | E1100: =RC[-2] -> 495813 | F1100: =IF(RC[-4]=1,0,R[-1]C+R[-1]C[-3]) -> 32291969
A1101: =R[-300]C+1 -> 4 | B1101: =R[-300]C -> 195 | C1101: 500800 | D1101: 3 | E1101: =RC[-2] -> 500800 | F1101: =IF(RC[-4]=1,0,R[-1]C+R[-1]C[-3]) -> 32787782
A1102: =R[-300]C+1 -> 4 | B1102: =R[-300]C -> 196 | C1102: 505813 | D1102: 3 | E1102: =RC[-2] -> 505813 | F1102: =IF(RC[-4]=1,0,R[-1]C+R[-1]C[-3]) -> 33288582
A1103: =R[-300]C+1 -> 4 | B1103: =R[-300]C -> 197 | C1103: 510850 | D1103: 3 | E1103: =RC[-2] -> 510850 | F1103: =IF(RC[-4]=1,0,R[-1]C+R[-1]C[-3]) -> 33794395
A1104: =R[-300]C+1 -> 4 | B1104: =R[-300]C -> 198 | C1104: 515913 | D1104: 3 | E1104: =RC[-2] -> 515913 | F1104: =IF(RC[-4]=1,0,R[-1]C+R[-1]C[-3]) -> 34305245
A1105: =R[-300]C+1 -> 4 | B1105: =R[-300]C -> 199 | C1105: 521000 | D1105: 3 | E1105: =RC[-2] -> 521000 | F1105: =IF(RC[-4]=1,0,R[-1]C+R[-1]C[-3]) -> 34821158
A1106: =R[-300]C+1 -> 4 | B1106: =R[-300]C -> 200 | C1106: 526113 | D1106: 3 | E1106: =RC[-2] -> 526113 | F1106: =IF(RC[-4]=1,0,R[-1]C+R[-1]C[-3]) -> 35342158
A1107: =R[-300]C+1 -> 4 | B1107: =R[-300]C -> 201 | C1107: 531250 | D1107: 3 | E1107: =RC[-2] -> 531250 | F1107: =IF(RC[-4]=1,0,R[-1]C+R[-1]C[-3]) -> 35868271
A1108: =R[-300]C+1 -> 4 | B1108: =R[-300]C -> 202 | C1108: 536413 | D1108: 3 | E1108: =RC[-2] -> 536413 | F1108: =IF(RC[-4]=1,0,R[-1]C+R[-1]C[-3]) -> 36399521
A1109: =R[-300]C+1 -> 4 | B1109: =R[-300]C -> 203 | C1109: 541600 | D1109: 3 | E1109: =RC[-2] -> 541600 | F1109: =IF(RC[-4]=1,0,R[-1]C+R[-1]C[-3]) -> 36935934
A1110: =R[-300]C+1 -> 4 | B1110: =R[-300]C -> 204 | C1110: 546813 | D1110: 3 | E1110: =RC[-2] -> 546813 | F1110: =IF(RC[-4]=1,0,R[-1]C+R[-1]C[-3]) -> 37477534
A1111: =R[-300]C+1 -> 4 | B1111: =R[-300]C -> 205 | C1111: 552050 | D1111: 3 | E1111: =RC[-2] -> 552050 | F1111: =IF(RC[-4]=1,0,R[-1]C+R[-1]C[-3]) -> 38024347
A1112: =R[-300]C+1 -> 4 | B1112: =R[-300]C -> 206 | C1112: 557313 | D1112: 3 | E1112: =RC[-2] -> 557313 | F1112: =IF(RC[-4]=1,0,R[-1]C+R[-1]C[-3]) -> 38576397
A1113: =R[-300]C+1 -> 4 | B1113: =R[-300]C -> 207 | C1113: 562600 | D1113: 3 | E1113: =RC[-2] -> 562600 | F1113: =IF(RC[-4]=1,0,R[-1]C+R[-1]C[-3]) -> 39133710
A1114: =R[-300]C+1 -> 4 | B1114: =R[-300]C -> 208 | C1114: 567913 | D1114: 3 | E1114: =RC[-2] -> 567913 | F1114: =IF(RC[-4]=1,0,R[-1]C+R[-1]C[-3]) -> 39696310
A1115: =R[-300]C+1 -> 4 | B1115: =R[-300]C -> 209 | C1115: 573250 | D1115: 3 | E1115: =RC[-2] -> 573250 | F1115: =IF(RC[-4]=1,0,R[-1]C+R[-1]C[-3]) -> 40264223
A1116: =R[-300]C+1 -> 4 | B1116: =R[-300]C -> 210 | C1116: 578613 | D1116: 3 | E1116: =RC[-2] -> 578613 | F1116: =IF(RC[-4]=1,0,R[-1]C+R[-1]C[-3]) -> 40837473
A1117: =R[-300]C+1 -> 4 | B1117: =R[-300]C -> 211 | C1117: 584000 | D1117: 3 | E1117: =RC[-2] -> 584000 | F1117: =IF(RC[-4]=1,0,R[-1]C+R[-1]C[-3]) -> 41416086
A1118: =R[-300]C+1 -> 4 | B1118: =R[-300]C -> 212 | C1118: 589413 | D1118: 3 | E1118: =RC[-2] -> 589413 | F1118: =IF(RC[-4]=1,0,R[-1]C+R[-1]C[-3]) -> 42000086
A1119: =R[-300]C+1 -> 4 | B1119: =R[-300]C -> 213 | C1119: 594850 | D1119: 3 | E1119: =RC[-2] -> 594850 | F1119: =IF(RC[-4]=1,0,R[-1]C+R[-1]C[-3]) -> 42589499
A1120: =R[-300]C+1 -> 4 | B1120: =R[-300]C -> 214 | C1120: 600313 | D1120: 3 | E1120: =RC[-2] -> 600313 | F1120: =IF(RC[-4]=1,0,R[-1]C+R[-1]C[-3]) -> 43184349
A1121: =R[-300]C+1 -> 4 | B1121: =R[-300]C -> 215 | C1121: 605800 | D1121: 3 | E1121: =RC[-2] -> 605800 | F1121: =IF(RC[-4]=1,0,R[-1]C+R[-1]C[-3]) -> 43784662
A1122: =R[-300]C+1 -> 4 | B1122: =R[-300]C -> 216 | C1122: 611313 | D1122: 3 | E1122: =RC[-2] -> 611313 | F1122: =IF(RC[-4]=1,0,R[-1]C+R[-1]C[-3]) -> 44390462
A1123: =R[-300]C+1 -> 4 | B1123: =R[-300]C -> 217 | C1123: 616850 | D1123: 3 | E1123: =RC[-2] -> 616850 | F1123: =IF(RC[-4]=1,0,R[-1]C+R[-1]C[-3]) -> 45001775
A1124: =R[-300]C+1 -> 4 | B1124: =R[-300]C -> 218 | C1124: 622413 | D1124: 3 | E1124: =RC[-2] -> 622413 | F1124: =IF(RC[-4]=1,0,R[-1]C+R[-1]C[-3]) -> 45618625
A1125: =R[-300]C+1 -> 4 | B1125: =R[-300]C -> 219 | C1125: 628000 | D1125: 3 | E1125: =RC[-2] -> 628000 | F1125: =IF(RC[-4]=1,0,R[-1]C+R[-1]C[-3]) -> 46241038
A1126: =R[-300]C+1 -> 4 | B1126: =R[-300]C -> 220 | C1126: 633613 | D1126: 3 | E1126: =RC[-2] -> 633613 | F1126: =IF(RC[-4]=1,0,R[-1]C+R[-1]C[-3]) -> 46869038
A1127: =R[-300]C+1 -> 4 | B1127: =R[-300]C -> 221 | C1127: 639250 | D1127: 3 | E1127: =RC[-2] -> 639250 | F1127: =IF(RC[-4]=1,0,R[-1]C+R[-1]C[-3]) -> 47502651
A1128: =R[-300]C+1 -> 4 | B1128: =R[-300]C -> 222 | C1128: 644913 | D1128: 3 | E1128: =RC[-2] -> 644913 | F1128: =IF(RC[-4]=1,0,R[-1]C+R[-1]C[-3]) -> 48141901
A1129: =R[-300]C+1 -> 4 | B1129: =R[-300]C -> 223 | C1129: 650600 | D1129: 3 | E1129: =RC[-2] -> 650600 | F1129: =IF(RC[-4]=1,0,R[-1]C+R[-1]C[-3]) -> 48786814
A1130: =R[-300]C+1 -> 4 | B1130: =R[-300]C -> 224 | C1130: 656313 | D1130: 3 | E1130: =RC[-2] -> 656313 | F1130: =IF(RC[-4]=1,0,R[-1]C+R[-1]C[-3]) -> 49437414
A1131: =R[-300]C+1 -> 4 | B1131: =R[-300]C -> 225 | C1131: 662050 | D1131: 3 | E1131: =RC[-2] -> 662050 | F1131: =IF(RC[-4]=1,0,R[-1]C+R[-1]C[-3]) -> 50093727
A1132: =R[-300]C+1 -> 4 | B1132: =R[-300]C -> 226 | C1132: 667813 | D1132: 3 | E1132: =RC[-2] -> 667813 | F1132: =IF(RC[-4]=1,0,R[-1]C+R[-1]C[-3]) -> 50755777
A1133: =R[-300]C+1 -> 4 | B1133: =R[-300]C -> 227 | C1133: 673600 | D1133: 3 | E1133: =RC[-2] -> 673600 | F1133: =IF(RC[-4]=1,0,R[-1]C+R[-1]C[-3]) -> 51423590
A1134: =R[-300]C+1 -> 4 | B1134: =R[-300]C -> 228 | C1134: 679413 | D1134: 3 | E1134: =RC[-2] -> 679413 | F1134: =IF(RC[-4]=1,0,R[-1]C+R[-1]C[-3]) -> 52097190
A1135: =R[-300]C+1 -> 4 | B1135: =R[-300]C -> 229 | C1135: 685250 | D1135: 3 | E1135: =RC[-2] -> 685250 | F1135: =IF(RC[-4]=1,0,R[-1]C+R[-1]C[-3]) -> 52776603
A1136: =R[-300]C+1 -> 4 | B1136: =R[-300]C -> 230 | C1136: 691113 | D1136: 3 | E1136: =RC[-2] -> 691113 | F1136: =IF(RC[-4]=1,0,R[-1]C+R[-1]C[-3]) -> 53461853
A1137: =R[-300]C+1 -> 4 | B1137: =R[-300]C -> 231 | C1137: 697000 | D1137: 3 | E1137: =RC[-2] -> 697000 | F1137: =IF(RC[-4]=1,0,R[-1]C+R[-1]C[-3]) -> 54152966
A1138: =R[-300]C+1 -> 4 | B1138: =R[-300]C -> 232 | C1138: 702913 | D1138: 3 | E1138: =RC[-2] -> 702913 | F1138: =IF(RC[-4]=1,0,R[-1]C+R[-1]C[-3]) -> 54849966
A1139: =R[-300]C+1 -> 4 | B1139: =R[-300]C -> 233 | C1139: 708850 | D1139: 3 | E1139: =RC[-2] -> 708850 | F1139: =IF(RC[-4]=1,0,R[-1]C+R[-1]C[-3]) -> 55552879
A1140: =R[-300]C+1 -> 4 | B1140: =R[-300]C -> 234 | C1140: 714813 | D1140: 3 | E1140: =RC[-2] -> 714813 | F1140: =IF(RC[-4]=1,0,R[-1]C+R[-1]C[-3]) -> 56261729
A1141: =R[-300]C+1 -> 4 | B1141: =R[-300]C -> 235 | C1141: 720800 | D1141: 3 | E1141: =RC[-2] -> 720800 | F1141: =IF(RC[-4]=1,0,R[-1]C+R[-1]C[-3]) -> 56976542
A1142: =R[-300]C+1 -> 4 | B1142: =R[-300]C -> 236 | C1142: 726813 | D1142: 3 | E1142: =RC[-2] -> 726813 | F1142: =IF(RC[-4]=1,0,R[-1]C+R[-1]C[-3]) -> 57697342
A1143: =R[-300]C+1 -> 4 | B1143: =R[-300]C -> 237 | C1143: 732850 | D1143: 3 | E1143: =RC[-2] -> 732850 | F1143: =IF(RC[-4]=1,0,R[-1]C+R[-1]C[-3]) -> 58424155
A1144: =R[-300]C+1 -> 4 | B1144: =R[-300]C -> 238 | C1144: 738913 | D1144: 3 | E1144: =RC[-2] -> 738913 | F1144: =IF(RC[-4]=1,0,R[-1]C+R[-1]C[-3]) -> 59157005
A1145: =R[-300]C+1 -> 4 | B1145: =R[-300]C -> 239 | C1145: 745000 | D1145: 3 | E1145: =RC[-2] -> 745000 | F1145: =IF(RC[-4]=1,0,R[-1]C+R[-1]C[-3]) -> 59895918
A1146: =R[-300]C+1 -> 4 | B1146: =R[-300]C -> 240 | C1146: 751113 | D1146: 3 | E1146: =RC[-2] -> 751113 | F1146: =IF(RC[-4]=1,0,R[-1]C+R[-1]C[-3]) -> 60640918
A1147: =R[-300]C+1 -> 4 | B1147: =R[-300]C -> 241 | C1147: 757250 | D1147: 3 | E1147: =RC[-2] -> 757250 | F1147: =IF(RC[-4]=1,0,R[-1]C+R[-1]C[-3]) -> 61392031
A1148: =R[-300]C+1 -> 4 | B1148: =R[-300]C -> 242 | C1148: 763413 | D1148: 3 | E1148: =RC[-2] -> 763413 | F1148: =IF(RC[-4]=1,0,R[-1]C+R[-1]C[-3]) -> 62149281
A1149: =R[-300]C+1 -> 4 | B1149: =R[-300]C -> 243 | C1149: 769600 | D1149: 3 | E1149: =RC[-2] -> 769600 | F1149: =IF(RC[-4]=1,0,R[-1]C+R[-1]C[-3]) -> 62912694
A1150: =R[-300]C+1 -> 4 | B1150: =R[-300]C -> 244 | C1150: 775813 | D1150: 3 | E1150: =RC[-2] -> 775813 | F1150: =IF(RC[-4]=1,0,R[-1]C+R[-1]C[-3]) -> 63682294
A1151: =R[-300]C+1 -> 4 | B1151: =R[-300]C -> 245 | C1151: 782050 | D1151: 3 | E1151: =RC[-2] -> 782050 | F1151: =IF(RC[-4]=1,0,R[-1]C+R[-1]C[-3]) -> 64458107
A1152: =R[-300]C+1 -> 4 | B1152: =R[-300]C -> 246 | C1152: 788313 | D1152: 3 | E1152: =RC[-2] -> 788313 | F1152: =IF(RC[-4]=1,0,R[-1]C+R[-1]C[-3]) -> 65240157
A1153: =R[-300]C+1 -> 4 | B1153: =R[-300]C -> 247 | C1153: 794600 | D1153: 3 | E1153: =RC[-2] -> 794600 | F1153: =IF(RC[-4]=1,0,R[-1]C+R[-1]C[-3]) -> 66028470
A1154: =R[-300]C+1 -> 4 | B1154: =R[-300]C -> 248 | C1154: 800913 | D1154: 3 | E1154: =RC[-2] -> 800913 | F1154: =IF(RC[-4]=1,0,R[-1]C+R[-1]C[-3]) -> 66823070
A1155: =R[-300]C+1 -> 4 | B1155: =R[-300]C -> 249 | C1155: 807250 | D1155: 3 | E1155: =RC[-2] -> 807250 | F1155: =IF(RC[-4]=1,0,R[-1]C+R[-1]C[-3]) -> 67623983
A1156: =R[-300]C+1 -> 4 | B1156: =R[-300]C -> 250 | C1156: 813613 | D1156: 3 | E1156: =RC[-2] -> 813613 | F1156: =IF(RC[-4]=1,0,R[-1]C+R[-1]C[-3]) -> 68431233
A1157: =R[-300]C+1 -> 4 | B1157: =R[-300]C -> 251 | C1157: 820000 | D1157: 3 | E1157: =RC[-2] -> 820000 | F1157: =IF(RC[-4]=1,0,R[-1]C+R[-1]C[-3]) -> 69244846
A1158: =R[-300]C+1 -> 4 | B1158: =R[-300]C -> 252 | C1158: 826413 | D1158: 3 | E1158: =RC[-2] -> 826413 | F1158: =IF(RC[-4]=1,0,R[-1]C+R[-1]C[-3]) -> 70064846
A1159: =R[-300]C+1 -> 4 | B1159: =R[-300]C -> 253 | C1159: 832850 | D1159: 3 | E1159: =RC[-2] -> 832850 | F1159: =IF(RC[-4]=1,0,R[-1]C+R[-1]C[-3]) -> 70891259
A1160: =R[-300]C+1 -> 4 | B1160: =R[-300]C -> 254 | C1160: 839313 | D1160: 3 | E1160: =RC[-2] -> 839313 | F1160: =IF(RC[-4]=1,0,R[-1]C+R[-1]C[-3]) -> 71724109
A1161: =R[-300]C+1 -> 4 | B1161: =R[-300]C -> 255 | C1161: 845800 | D1161: 3 | E1161: =RC[-2] -> 845800 | F1161: =IF(RC[-4]=1,0,R[-1]C+R[-1]C[-3]) -> 72563422
A1162: =R[-300]C+1 -> 4 | B1162: =R[-300]C -> 256 | C1162: 852313 | D1162: 3 | E1162: =RC[-2] -> 852313 | F1162: =IF(RC[-4]=1,0,R[-1]C+R[-1]C[-3]) -> 73409222
A1163: =R[-300]C+1 -> 4 | B1163: =R[-300]C -> 257 | C1163: 858850 | D1163: 3 | E1163: =RC[-2] -> 858850 | F1163: =IF(RC[-4]=1,0,R[-1]C+R[-1]C[-3]) -> 74261535
A1164: =R[-300]C+1 -> 4 | B1164: =R[-300]C -> 258 | C1164: 865413 | D1164: 3 | E1164: =RC[-2] -> 865413 | F1164: =IF(RC[-4]=1,0,R[-1]C+R[-1]C[-3]) -> 75120385
A1165: =R[-300]C+1 -> 4 | B1165: =R[-300]C -> 259 | C1165: 872000 | D1165: 3 | E1165: =RC[-2] -> 872000 | F1165: =IF(RC[-4]=1,0,R[-1]C+R[-1]C[-3]) -> 75985798
A1166: =R[-300]C+1 -> 4 | B1166: =R[-300]C -> 260 | C1166: 878613 | D1166: 3 | E1166: =RC[-2] -> 878613 | F1166: =IF(RC[-4]=1,0,R[-1]C+R[-1]C[-3]) -> 76857798
A1167: =R[-300]C+1 -> 4 | B1167: =R[-300]C -> 261 | C1167: 885250 | D1167: 3 | E1167: =RC[-2] -> 885250 | F1167: =IF(RC[-4]=1,0,R[-1]C+R[-1]C[-3]) -> 77736411
A1168: =R[-300]C+1 -> 4 | B1168: =R[-300]C -> 262 | C1168: 891913 | D1168: 3 | E1168: =RC[-2] -> 891913 | F1168: =IF(RC[-4]=1,0,R[-1]C+R[-1]C[-3]) -> 78621661
A1169: =R[-300]C+1 -> 4 | B1169: =R[-300]C -> 263 | C1169: 898600 | D1169: 3 | E1169: =RC[-2] -> 898600 | F1169: =IF(RC[-4]=1,0,R[-1]C+R[-1]C[-3]) -> 79513574
A1170: =R[-300]C+1 -> 4 | B1170: =R[-300]C -> 264 | C1170: 905313 | D1170: 3 | E1170: =RC[-2] -> 905313 | F1170: =IF(RC[-4]=1,0,R[-1]C+R[-1]C[-3]) -> 80412174
A1171: =R[-300]C+1 -> 4 | B1171: =R[-300]C -> 265 | C1171: 912050 | D1171: 3 | E1171: =RC[-2] -> 912050 | F1171: =IF(RC[-4]=1,0,R[-1]C+R[-1]C[-3]) -> 81317487
A1172: =R[-300]C+1 -> 4 | B1172: =R[-300]C -> 266 | C1172: 918813 | D1172: 3 | E1172: =RC[-2] -> 918813 | F1172: =IF(RC[-4]=1,0,R[-1]C+R[-1]C[-3]) -> 82229537
A1173: =R[-300]C+1 -> 4 | B1173: =R[-300]C -> 267 | C1173: 925600 | D1173: 3 | E1173: =RC[-2] -> 925600 | F1173: =IF(RC[-4]=1,0,R[-1]C+R[-1]C[-3]) -> 83148350
A1174: =R[-300]C+1 -> 4 | B1174: =R[-300]C -> 268 | C1174: 932413 | D1174: 3 | E1174: =RC[-2] -> 932413 | F1174: =IF(RC[-4]=1,0,R[-1]C+R[-1]C[-3]) -> 84073950
A1175: =R[-300]C+1 -> 4 | B1175: =R[-300]C -> 269 | C1175: 939250 | D1175: 3 | E1175: =RC[-2] -> 939250 | F1175: =IF(RC[-4]=1,0,R[-1]C+R[-1]C[-3]) -> 85006363
A1176: =R[-300]C+1 -> 4 | B1176: =R[-300]C -> 270 | C1176: 946113 | D1176: 3 | E1176: =RC[-2] -> 946113 | F1176: =IF(RC[-4]=1,0,R[-1]C+R[-1]C[-3]) -> 85945613
A1177: =R[-300]C+1 -> 4 | B1177: =R[-300]C -> 271 | C1177: 953000 | D1177: 3 | E1177: =RC[-2] -> 953000 | F1177: =IF(RC[-4]=1,0,R[-1]C+R[-1]C[-3]) -> 86891726
A1178: =R[-300]C+1 -> 4 | B1178: =R[-300]C -> 272 | C1178: 959913 | D1178: 3 | E1178: =RC[-2] -> 959913 | F1178: =IF(RC[-4]=1,0,R[-1]C+R[-1]C[-3]) -> 87844726
A1179: =R[-300]C+1 -> 4 | B1179: =R[-300]C -> 273 | C1179: 966850 | D1179: 3 | E1179: =RC[-2] -> 966850 | F1179: =IF(RC[-4]=1,0,R[-1]C+R[-1]C[-3]) -> 88804639
A1180: =R[-300]C+1 -> 4 | B1180: =R[-300]C -> 274 | C1180: 973813 | D1180: 3 | E1180: =RC[-2] -> 973813 | F1180: =IF(RC[-4]=1,0,R[-1]C+R[-1]C[-3]) -> 89771489
A1181: =R[-300]C+1 -> 4 | B1181: =R[-300]C -> 275 | C1181: 980800 | D1181: 3 | E1181: =RC[-2] -> 980800 | F1181: =IF(RC[-4]=1,0,R[-1]C+R[-1]C[-3]) -> 90745302
A1182: =R[-300]C+1 -> 4 | B1182: =R[-300]C -> 276 | C1182: 987813 | D1182: 3 | E1182: =RC[-2] -> 987813 | F1182: =IF(RC[-4]=1,0,R[-1]C+R[-1]C[-3]) -> 91726102
A1183: =R[-300]C+1 -> 4 | B1183: =R[-300]C -> 277 | C1183: 994850 | D1183: 3 | E1183: =RC[-2] -> 994850 | F1183: =IF(RC[-4]=1,0,R[-1]C+R[-1]C[-3]) -> 92713915
A1184: =R[-300]C+1 -> 4 | B1184: =R[-300]C -> 278 | C1184: 1001913 | D1184: 3 | E1184: =RC[-2] -> 1001913 | F1184: =IF(RC[-4]=1,0,R[-1]C+R[-1]C[-3]) -> 93708765
A1185: =R[-300]C+1 -> 4 | B1185: =R[-300]C -> 279 | C1185: 1009000 | D1185: 3 | E1185: =RC[-2] -> 1009000 | F1185: =IF(RC[-4]=1,0,R[-1]C+R[-1]C[-3]) -> 94710678
A1186: =R[-300]C+1 -> 4 | B1186: =R[-300]C -> 280 | C1186: 1016113 | D1186: 3 | E1186: =RC[-2] -> 1016113 | F1186: =IF(RC[-4]=1,0,R[-1]C+R[-1]C[-3]) -> 95719678
A1187: =R[-300]C+1 -> 4 | B1187: =R[-300]C -> 281 | C1187: 1023250 | D1187: 3 | E1187: =RC[-2] -> 1023250 | F1187: =IF(RC[-4]=1,0,R[-1]C+R[-1]C[-3]) -> 96735791
A1188: =R[-300]C+1 -> 4 | B1188: =R[-300]C -> 282 | C1188: 1030413 | D1188: 3 | E1188: =RC[-2] -> 1030413 | F1188: =IF(RC[-4]=1,0,R[-1]C+R[-1]C[-3]) -> 97759041
A1189: =R[-300]C+1 -> 4 | B1189: =R[-300]C -> 283 | C1189: 1037600 | D1189: 3 | E1189: =RC[-2] -> 1037600 | F1189: =IF(RC[-4]=1,0,R[-1]C+R[-1]C[-3]) -> 98789454
A1190: =R[-300]C+1 -> 4 | B1190: =R[-300]C -> 284 | C1190: 1044813 | D1190: 3 | E1190: =RC[-2] -> 1044813 | F1190: =IF(RC[-4]=1,0,R[-1]C+R[-1]C[-3]) -> 99827054
A1191: =R[-300]C+1 -> 4 | B1191: =R[-300]C -> 285 | C1191: 1052050 | D1191: 3 | E1191: =RC[-2] -> 1052050 | F1191: =IF(RC[-4]=1,0,R[-1]C+R[-1]C[-3]) -> 100871867
A1192: =R[-300]C+1 -> 4 | B1192: =R[-300]C -> 286 | C1192: 1059313 | D1192: 3 | E1192: =RC[-2] -> 1059313 | F1192: =IF(RC[-4]=1,0,R[-1]C+R[-1]C[-3]) -> 101923917
A1193: =R[-300]C+1 -> 4 | B1193: =R[-300]C -> 287 | C1193: 1066600 | D1193: 3 | E1193: =RC[-2] -> 1066600 | F1193: =IF(RC[-4]=1,0,R[-1]C+R[-1]C[-3]) -> 102983230
A1194: =R[-300]C+1 -> 4 | B1194: =R[-300]C -> 288 | C1194: 1073913 | D1194: 3 | E1194: =RC[-2] -> 1073913 | F1194: =IF(RC[-4]=1,0,R[-1]C+R[-1]C[-3]) -> 104049830
A1195: =R[-300]C+1 -> 4 | B1195: =R[-300]C -> 289 | C1195: 1081250 | D1195: 3 | E1195: =RC[-2] -> 1081250 | F1195: =IF(RC[-4]=1,0,R[-1]C+R[-1]C[-3]) -> 105123743
A1196: =R[-300]C+1 -> 4 | B1196: =R[-300]C -> 290 | C1196: 1088613 | D1196: 3 | E1196: =RC[-2] -> 1088613 | F1196: =IF(RC[-4]=1,0,R[-1]C+R[-1]C[-3]) -> 106204993
A1197: =R[-300]C+1 -> 4 | B1197: =R[-300]C -> 291 | C1197: 1096000 | D1197: 3 | E1197: =RC[-2] -> 1096000 | F1197: =IF(RC[-4]=1,0,R[-1]C+R[-1]C[-3]) -> 107293606
A1198: =R[-300]C+1 -> 4 | B1198: =R[-300]C -> 292 | C1198: 1103413 | D1198: 3 | E1198: =RC[-2] -> 1103413 | F1198: =IF(RC[-4]=1,0,R[-1]C+R[-1]C[-3]) -> 108389606
A1199: =R[-300]C+1 -> 4 | B1199: =R[-300]C -> 293 | C1199: 1110850 | D1199: 3 | E1199: =RC[-2] -> 1110850 | F1199: =IF(RC[-4]=1,0,R[-1]C+R[-1]C[-3]) -> 109493019
A1200: =R[-300]C+1 -> 4 | B1200: =R[-300]C -> 294 | C1200: 1118313 | D1200: 3 | E1200: =RC[-2] -> 1118313 | F1200: =IF(RC[-4]=1,0,R[-1]C+R[-1]C[-3]) -> 110603869
A1201: =R[-300]C+1 -> 4 | B1201: =R[-300]C -> 295 | C1201: 1125800 | D1201: 3 | E1201: =RC[-2] -> 1125800 | F1201: =IF(RC[-4]=1,0,R[-1]C+R[-1]C[-3]) -> 111722182
A1202: =R[-300]C+1 -> 4 | B1202: =R[-300]C -> 296 | C1202: 1133313 | D1202: 3 | E1202: =RC[-2] -> 1133313 | F1202: =IF(RC[-4]=1,0,R[-1]C+R[-1]C[-3]) -> 112847982
A1203: =R[-300]C+1 -> 4 | B1203: =R[-300]C -> 297 | C1203: 1140850 | D1203: 3 | E1203: =RC[-2] -> 1140850 | F1203: =IF(RC[-4]=1,0,R[-1]C+R[-1]C[-3]) -> 113981295
A1204: =R[-300]C+1 -> 4 | B1204: =R[-300]C -> 298 | C1204: 1148413 | D1204: 3 | E1204: =RC[-2] -> 1148413 | F1204: =IF(RC[-4]=1,0,R[-1]C+R[-1]C[-3]) -> 115122145
A1205: =R[-300]C+1 -> 4 | B1205: =R[-300]C -> 299 | C1205: 1156000 | D1205: 3 | E1205: =RC[-2] -> 1156000 | F1205: =IF(RC[-4]=1,0,R[-1]C+R[-1]C[-3]) -> 116270558
A1206: =R[-300]C+1 -> 4 | B1206: =R[-300]C -> 300 | C1206: 1163613 | D1206: 3 | E1206: =RC[-2] -> 1163613 | F1206: =IF(RC[-4]=1,0,R[-1]C+R[-1]C[-3]) -> 117426558
A1207: =R[-300]C+1 -> 5 | B1207: =R[-300]C -> 1 | C1207: 600 | D1207: 3 | E1207: =RC[-2] -> 600 | F1207: =IF(RC[-4]=1,0,R[-1]C+R[-1]C[-3]) -> 0
A1208: =R[-300]C+1 -> 5 | B1208: =R[-300]C -> 2 | C1208: 678 | D1208: 3 | E1208: =RC[-2] -> 678 | F1208: =IF(RC[-4]=1,0,R[-1]C+R[-1]C[-3]) -> 600
A1209: =R[-300]C+1 -> 5 | B1209: =R[-300]C -> 3 | C1209: 768 | D1209: 3 | E1209: =RC[-2] -> 768 | F1209: =IF(RC[-4]=1,0,R[-1]C+R[-1]C[-3]) -> 1278
A1210: =R[-300]C+1 -> 5 | B1210: =R[-300]C -> 4 | C1210: 870 | D1210: 3 | E1210: =RC[-2] -> 870 | F1210: =IF(RC[-4]=1,0,R[-1]C+R[-1]C[-3]) -> 2046
A1211: =R[-300]C+1 -> 5 | B1211: =R[-300]C -> 5 | C1211: 984 | D1211: 3 | E1211: =RC[-2] -> 984 | F1211: =IF(RC[-4]=1,0,R[-1]C+R[-1]C[-3]) -> 2916
A1212: =R[-300]C+1 -> 5 | B1212: =R[-300]C -> 6 | C1212: 1110 | D1212: 3 | E1212: =RC[-2] -> 1110 | F1212: =IF(RC[-4]=1,0,R[-1]C+R[-1]C[-3]) -> 3900
A1213: =R[-300]C+1 -> 5 | B1213: =R[-300]C -> 7 | C1213: 1248 | D1213: 3 | E1213: =RC[-2] -> 1248 | F1213: =IF(RC[-4]=1,0,R[-1]C+R[-1]C[-3]) -> 5010
A1214: =R[-300]C+1 -> 5 | B1214: =R[-300]C -> 8 | C1214: 1398 | D1214: 3 | E1214: =RC[-2] -> 1398 | F1214: =IF(RC[-4]=1,0,R[-1]C+R[-1]C[-3]) -> 6258
A1215: =R[-300]C+1 -> 5 | B1215: =R[-300]C -> 9 | C1215: 1560 | D1215: 3 | E1215: =RC[-2] -> 1560 | F1215: =IF(RC[-4]=1,0,R[-1]C+R[-1]C[-3]) -> 7656
A1216: =R[-300]C+1 -> 5 | B1216: =R[-300]C -> 10 | C1216: 1734 | D1216: 3 | E1216: =RC[-2] -> 1734 | F1216: =IF(RC[-4]=1,0,R[-1]C+R[-1]C[-3]) -> 9216
A1217: =R[-300]C+1 -> 5 | B1217: =R[-300]C -> 11 | C1217: 2160 | D1217: 3 | E1217: =RC[-2] -> 2160 | F1217: =IF(RC[-4]=1,0,R[-1]C+R[-1]C[-3]) -> 10950
A1218: =R[-300]C+1 -> 5 | B1218: =R[-300]C -> 12 | C1218: 2383 | D1218: 3 | E1218: =RC[-2] -> 2383 | F1218: =IF(RC[-4]=1,0,R[-1]C+R[-1]C[-3]) -> 13110
A1219: =R[-300]C+1 -> 5 | B1219: =R[-300]C -> 13 | C1219: 2619 | D1219: 3 | E1219: =RC[-2] -> 2619 | F1219: =IF(RC[-4]=1,0,R[-1]C+R[-1]C[-3]) -> 15493
A1220: =R[-300]C+1 -> 5 | B1220: =R[-300]C -> 14 | C1220: 2869 | D1220: 3 | E1220: =RC[-2] -> 2869 | F1220: =IF(RC[-4]=1,0,R[-1]C+R[-1]C[-3]) -> 18112
A1221: =R[-300]C+1 -> 5 | B1221: =R[-300]C -> 15 | C1221: 3132 | D1221: 3 | E1221: =RC[-2] -> 3132 | F1221: =IF(RC[-4]=1,0,R[-1]C+R[-1]C[-3]) -> 20981
A1222: =R[-300]C+1 -> 5 | B1222: =R[-300]C -> 16 | C1222: 3409 | D1222: 3 | E1222: =RC[-2] -> 3409 | F1222: =IF(RC[-4]=1,0,R[-1]C+R[-1]C[-3]) -> 24113
A1223: =R[-300]C+1 -> 5 | B1223: =R[-300]C -> 17 | C1223: 3699 | D1223: 3 | E1223: =RC[-2] -> 3699 | F1223: =IF(RC[-4]=1,0,R[-1]C+R[-1]C[-3]) -> 27522
A1224: =R[-300]C+1 -> 5 | B1224: =R[-300]C -> 18 | C1224: 4003 | D1224: 3 | E1224: =RC[-2] -> 4003 | F1224: =IF(RC[-4]=1,0,R[-1]C+R[-1]C[-3]) -> 31221
A1225: =R[-300]C+1 -> 5 | B1225: =R[-300]C -> 19 | C1225: 4320 | D1225: 3 | E1225: =RC[-2] -> 4320 | F1225: =IF(RC[-4]=1,0,R[-1]C+R[-1]C[-3]) -> 35224
A1226: =R[-300]C+1 -> 5 | B1226: =R[-300]C -> 20 | C1226: 4651 | D1226: 3 | E1226: =RC[-2] -> 4651 | F1226: =IF(RC[-4]=1,0,R[-1]C+R[-1]C[-3]) -> 39544
A1227: =R[-300]C+1 -> 5 | B1227: =R[-300]C -> 21 | C1227: 5550 | D1227: 3 | E1227: =RC[-2] -> 5550 | F1227: =IF(RC[-4]=1,0,R[-1]C+R[-1]C[-3]) -> 44195
A1228: =R[-300]C+1 -> 5 | B1228: =R[-300]C -> 22 | C1228: 5948 | D1228: 3 | E1228: =RC[-2] -> 5948 | F1228: =IF(RC[-4]=1,0,R[-1]C+R[-1]C[-3]) -> 49745
A1229: =R[-300]C+1 -> 5 | B1229: =R[-300]C -> 23 | C1229: 6360 | D1229: 3 | E1229: =RC[-2] -> 6360 | F1229: =IF(RC[-4]=1,0,R[-1]C+R[-1]C[-3]) -> 55693
A1230: =R[-300]C+1 -> 5 | B1230: =R[-300]C -> 24 | C1230: 6788 | D1230: 3 | E1230: =RC[-2] -> 6788 | F1230: =IF(RC[-4]=1,0,R[-1]C+R[-1]C[-3]) -> 62053
A1231: =R[-300]C+1 -> 5 | B1231: =R[-300]C -> 25 | C1231: 7230 | D1231: 3 | E1231: =RC[-2] -> 7230 | F1231: =IF(RC[-4]=1,0,R[-1]C+R[-1]C[-3]) -> 68841
A1232: =R[-300]C+1 -> 5 | B1232: =R[-300]C -> 26 | C1232: 7688 | D1232: 3 | E1232: =RC[-2] -> 7688 | F1232: =IF(RC[-4]=1,0,R[-1]C+R[-1]C[-3]) -> 76071
A1233: =R[-300]C+1 -> 5 | B1233: =R[-300]C -> 27 | C1233: 8160 | D1233: 3 | E1233: =RC[-2] -> 8160 | F1233: =IF(RC[-4]=1,0,R[-1]C+R[-1]C[-3]) -> 83759
A1234: =R[-300]C+1 -> 5 | B1234: =R[-300]C -> 28 | C1234: 8648 | D1234: 3 | E1234: =RC[-2] -> 8648 | F1234: =IF(RC[-4]=1,0,R[-1]C+R[-1]C[-3]) -> 91919
A1235: =R[-300]C+1 -> 5 | B1235: =R[-300]C -> 29 | C1235: 9150 | D1235: 3 | E1235: =RC[-2] -> 9150 | F1235: =IF(RC[-4]=1,0,R[-1]C+R[-1]C[-3]) -> 100567
A1236: =R[-300]C+1 -> 5 | B1236: =R[-300]C -> 30 | C1236: 9668 | D1236: 3 | E1236: =RC[-2] -> 9668 | F1236: =IF(RC[-4]=1,0,R[-1]C+R[-1]C[-3]) -> 109717
A1237: =R[-300]C+1 -> 5 | B1237: =R[-300]C -> 31 | C1237: 12240 | D1237: 3 | E1237: =RC[-2] -> 12240 | F1237: =IF(RC[-4]=1,0,R[-1]C+R[-1]C[-3]) -> 119385
A1238: =R[-300]C+1 -> 5 | B1238: =R[-300]C -> 32 | C1238: 12897 | D1238: 3 | E1238: =RC[-2] -> 12897 | F1238: =IF(RC[-4]=1,0,R[-1]C+R[-1]C[-3]) -> 131625
A1239: =R[-300]C+1 -> 5 | B1239: =R[-300]C -> 33 | C1239: 13572 | D1239: 3 | E1239: =RC[-2] -> 13572 | F1239: =IF(RC[-4]=1,0,R[-1]C+R[-1]C[-3]) -> 144522
A1240: =R[-300]C+1 -> 5 | B1240: =R[-300]C -> 34 | C1240: 14265 | D1240: 3 | E1240: =RC[-2] -> 14265 | F1240: =IF(RC[-4]=1,0,R[-1]C+R[-1]C[-3]) -> 158094
A1241: =R[-300]C+1 -> 5 | B1241: =R[-300]C -> 35 | C1241: 14976 | D1241: 3 | E1241: =RC[-2] -> 14976 | F1241: =IF(RC[-4]=1,0,R[-1]C+R[-1]C[-3]) -> 172359
A1242: =R[-300]C+1 -> 5 | B1242: =R[-300]C -> 36 | C1242: 15705 | D1242: 3 | E1242: =RC[-2] -> 15705 | F1242: =IF(RC[-4]=1,0,R[-1]C+R[-1]C[-3]) -> 187335
A1243: =R[-300]C+1 -> 5 | B1243: =R[-300]C -> 37 | C1243: 16452 | D1243: 3 | E1243: =RC[-2] -> 16452 | F1243: =IF(RC[-4]=1,0,R[-1]C+R[-1]C[-3]) -> 203040
A1244: =R[-300]C+1 -> 5 | B1244: =R[-300]C -> 38 | C1244: 17217 | D1244: 3 | E1244: =RC[-2] -> 17217 | F1244: =IF(RC[-4]=1,0,R[-1]C+R[-1]C[-3]) -> 219492
A1245: =R[-300]C+1 -> 5 | B1245: =R[-300]C -> 39 | C1245: 18000 | D1245: 3 | E1245: =RC[-2] -> 18000 | F1245: =IF(RC[-4]=1,0,R[-1]C+R[-1]C[-3]) -> 236709
A1246: =R[-300]C+1 -> 5 | B1246: =R[-300]C -> 40 | C1246: 18801 | D1246: 3 | E1246: =RC[-2] -> 18801 | F1246: =IF(RC[-4]=1,0,R[-1]C+R[-1]C[-3]) -> 254709
A1247: =R[-300]C+1 -> 5 | B1247: =R[-300]C -> 41 | C1247: 22890 | D1247: 3 | E1247: =RC[-2] -> 22890 | F1247: =IF(RC[-4]=1,0,R[-1]C+R[-1]C[-3]) -> 273510
A1248: =R[-300]C+1 -> 5 | B1248: =R[-300]C -> 42 | C1248: 23867 | D1248: 3 | E1248: =RC[-2] -> 23867 | F1248: =IF(RC[-4]=1,0,R[-1]C+R[-1]C[-3]) -> 296400
A1249: =R[-300]C+1 -> 5 | B1249: =R[-300]C -> 43 | C1249: 24864 | D1249: 3 | E1249: =RC[-2] -> 24864 | F1249: =IF(RC[-4]=1,0,R[-1]C+R[-1]C[-3]) -> 320267
A1250: =R[-300]C+1 -> 5 | B1250: =R[-300]C -> 44 | C1250: 25883 | D1250: 3 | E1250: =RC[-2] -> 25883 | F1250: =IF(RC[-4]=1,0,R[-1]C+R[-1]C[-3]) -> 345131
A1251: =R[-300]C+1 -> 5 | B1251: =R[-300]C -> 45 | C1251: 26922 | D1251: 3 | E1251: =RC[-2] -> 26922 | F1251: =IF(RC[-4]=1,0,R[-1]C+R[-1]C[-3]) -> 371014
A1252: =R[-300]C+1 -> 5 | B1252: =R[-300]C -> 46 | C1252: 27983 | D1252: 3 | E1252: =RC[-2] -> 27983 | F1252: =IF(RC[-4]=1,0,R[-1]C+R[-1]C[-3]) -> 397936
A1253: =R[-300]C+1 -> 5 | B1253: =R[-300]C -> 47 | C1253: 29064 | D1253: 3 | E1253: =RC[-2] -> 29064 | F1253: =IF(RC[-4]=1,0,R[-1]C+R[-1]C[-3]) -> 425919
A1254: =R[-300]C+1 -> 5 | B1254: =R[-300]C -> 48 | C1254: 30167 | D1254: 3 | E1254: =RC[-2] -> 30167 | F1254: =IF(RC[-4]=1,0,R[-1]C+R[-1]C[-3]) -> 454983
A1255: =R[-300]C+1 -> 5 | B1255: =R[-300]C -> 49 | C1255: 31290 | D1255: 3 | E1255: =RC[-2] -> 31290 | F1255: =IF(RC[-4]=1,0,R[-1]C+R[-1]C[-3]) -> 485150
A1256: =R[-300]C+1 -> 5 | B1256: =R[-300]C -> 50 | C1256: 32435 | D1256: 3 | E1256: =RC[-2] -> 32435 | F1256: =IF(RC[-4]=1,0,R[-1]C+R[-1]C[-3]) -> 516440
A1257: =R[-300]C+1 -> 5 | B1257: =R[-300]C -> 51 | C1257: 38400 | D1257: 3 | E1257: =RC[-2] -> 38400 | F1257: =IF(RC[-4]=1,0,R[-1]C+R[-1]C[-3]) -> 548875
A1258: =R[-300]C+1 -> 5 | B1258: =R[-300]C -> 52 | C1258: 39756 | D1258: 3 | E1258: =RC[-2] -> 39756 | F1258: =IF(RC[-4]=1,0,R[-1]C+R[-1]C[-3]) -> 587275
A1259: =R[-300]C+1 -> 5 | B1259: =R[-300]C -> 53 | C1259: 41136 | D1259: 3 | E1259: =RC[-2] -> 41136 | F1259: =IF(RC[-4]=1,0,R[-1]C+R[-1]C[-3]) -> 627031
A1260: =R[-300]C+1 -> 5 | B1260: =R[-300]C -> 54 | C1260: 42540 | D1260: 3 | E1260: =RC[-2] -> 42540 | F1260: =IF(RC[-4]=1,0,R[-1]C+R[-1]C[-3]) -> 668167
A1261: =R[-300]C+1 -> 5 | B1261: =R[-300]C -> 55 | C1261: 43968 | D1261: 3 | E1261: =RC[-2] -> 43968 | F1261: =IF(RC[-4]=1,0,R[-1]C+R[-1]C[-3]) -> 710707
A1262: =R[-300]C+1 -> 5 | B1262: =R[-300]C -> 56 | C1262: 45420 | D1262: 3 | E1262: =RC[-2] -> 45420 | F1262: =IF(RC[-4]=1,0,R[-1]C+R[-1]C[-3]) -> 754675
A1263: =R[-300]C+1 -> 5 | B1263: =R[-300]C -> 57 | C1263: 46896 | D1263: 3 | E1263: =RC[-2] -> 46896 | F1263: =IF(RC[-4]=1,0,R[-1]C+R[-1]C[-3]) -> 800095
A1264: =R[-300]C+1 -> 5 | B1264: =R[-300]C -> 58 | C1264: 48396 | D1264: 3 | E1264: =RC[-2] -> 48396 | F1264: =IF(RC[-4]=1,0,R[-1]C+R[-1]C[-3]) -> 846991
A1265: =R[-300]C+1 -> 5 | B1265: =R[-300]C -> 59 | C1265: 49920 | D1265: 3 | E1265: =RC[-2] -> 49920 | F1265: =IF(RC[-4]=1,0,R[-1]C+R[-1]C[-3]) -> 895387
A1266: =R[-300]C+1 -> 5 | B1266: =R[-300]C -> 60 | C1266: 51468 | D1266: 3 | E1266: =RC[-2] -> 51468 | F1266: =IF(RC[-4]=1,0,R[-1]C+R[-1]C[-3]) -> 945307
A1267: =R[-300]C+1 -> 5 | B1267: =R[-300]C -> 61 | C1267: 59670 | D1267: 3 | E1267: =RC[-2] -> 59670 | F1267: =IF(RC[-4]=1,0,R[-1]C+R[-1]C[-3]) -> 996775
A1268: =R[-300]C+1 -> 5 | B1268: =R[-300]C -> 62 | C1268: 61466 | D1268: 3 | E1268: =RC[-2] -> 61466 | F1268: =IF(RC[-4]=1,0,R[-1]C+R[-1]C[-3]) -> 1056445
A1269: =R[-300]C+1 -> 5 | B1269: =R[-300]C -> 63 | C1269: 63288 | D1269: 3 | E1269: =RC[-2] -> 63288 | F1269: =IF(RC[-4]=1,0,R[-1]C+R[-1]C[-3]) -> 1117911
A1270: =R[-300]C+1 -> 5 | B1270: =R[-300]C -> 64 | C1270: 65138 | D1270: 3 | E1270: =RC[-2] -> 65138 | F1270: =IF(RC[-4]=1,0,R[-1]C+R[-1]C[-3]) -> 1181199
A1271: =R[-300]C+1 -> 5 | B1271: =R[-300]C -> 65 | C1271: 67014 | D1271: 3 | E1271: =RC[-2] -> 67014 | F1271: =IF(RC[-4]=1,0,R[-1]C+R[-1]C[-3]) -> 1246337
A1272: =R[-300]C+1 -> 5 | B1272: =R[-300]C -> 66 | C1272: 68918 | D1272: 3 | E1272: =RC[-2] -> 68918 | F1272: =IF(RC[-4]=1,0,R[-1]C+R[-1]C[-3]) -> 1313351
A1273: =R[-300]C+1 -> 5 | B1273: =R[-300]C -> 67 | C1273: 70848 | D1273: 3 | E1273: =RC[-2] -> 70848 | F1273: =IF(RC[-4]=1,0,R[-1]C+R[-1]C[-3]) -> 1382269
A1274: =R[-300]C+1 -> 5 | B1274: =R[-300]C -> 68 | C1274: 72806 | D1274: 3 | E1274: =RC[-2] -> 72806 | F1274: =IF(RC[-4]=1,0,R[-1]C+R[-1]C[-3]) -> 1453117
A1275: =R[-300]C+1 -> 5 | B1275: =R[-300]C -> 69 | C1275: 74790 | D1275: 3 | E1275: =RC[-2] -> 74790 | F1275: =IF(RC[-4]=1,0,R[-1]C+R[-1]C[-3]) -> 1525923
A1276: =R[-300]C+1 -> 5 | B1276: =R[-300]C -> 70 | C1276: 76802 | D1276: 3 | E1276: =RC[-2] -> 76802 | F1276: =IF(RC[-4]=1,0,R[-1]C+R[-1]C[-3]) -> 1600713
A1277: =R[-300]C+1 -> 5 | B1277: =R[-300]C -> 71 | C1277: 87600 | D1277: 3 | E1277: =RC[-2] -> 87600 | F1277: =IF(RC[-4]=1,0,R[-1]C+R[-1]C[-3]) -> 1677515
A1278: =R[-300]C+1 -> 5 | B1278: =R[-300]C -> 72 | C1278: 89895 | D1278: 3 | E1278: =RC[-2] -> 89895 | F1278: =IF(RC[-4]=1,0,R[-1]C+R[-1]C[-3]) -> 1765115
A1279: =R[-300]C+1 -> 5 | B1279: =R[-300]C -> 73 | C1279: 92220 | D1279: 3 | E1279: =RC[-2] -> 92220 | F1279: =IF(RC[-4]=1,0,R[-1]C+R[-1]C[-3]) -> 1855010
A1280: =R[-300]C+1 -> 5 | B1280: =R[-300]C -> 74 | C1280: 94575 | D1280: 3 | E1280: =RC[-2] -> 94575 | F1280: =IF(RC[-4]=1,0,R[-1]C+R[-1]C[-3]) -> 1947230
A1281: =R[-300]C+1 -> 5 | B1281: =R[-300]C -> 75 | C1281: 96960 | D1281: 3 | E1281: =RC[-2] -> 96960 | F1281: =IF(RC[-4]=1,0,R[-1]C+R[-1]C[-3]) -> 2041805
A1282: =R[-300]C+1 -> 5 | B1282: =R[-300]C -> 76 | C1282: 99375 | D1282: 3 | E1282: =RC[-2] -> 99375 | F1282: =IF(RC[-4]=1,0,R[-1]C+R[-1]C[-3]) -> 2138765
A1283: =R[-300]C+1 -> 5 | B1283: =R[-300]C -> 77 | C1283: 101820 | D1283: 3 | E1283: =RC[-2] -> 101820 | F1283: =IF(RC[-4]=1,0,R[-1]C+R[-1]C[-3]) -> 2238140
A1284: =R[-300]C+1 -> 5 | B1284: =R[-300]C -> 78 | C1284: 104295 | D1284: 3 | E1284: =RC[-2] -> 104295 | F1284: =IF(RC[-4]=1,0,R[-1]C+R[-1]C[-3]) -> 2339960
A1285: =R[-300]C+1 -> 5 | B1285: =R[-300]C -> 79 | C1285: 106800 | D1285: 3 | E1285: =RC[-2] -> 106800 | F1285: =IF(RC[-4]=1,0,R[-1]C+R[-1]C[-3]) -> 2444255
A1286: =R[-300]C+1 -> 5 | B1286: =R[-300]C -> 80 | C1286: 109335 | D1286: 3 | E1286: =RC[-2] -> 109335 | F1286: =IF(RC[-4]=1,0,R[-1]C+R[-1]C[-3]) -> 2551055
A1287: =R[-300]C+1 -> 5 | B1287: =R[-300]C -> 81 | C1287: 111900 | D1287: 3 | E1287: =RC[-2] -> 111900 | F1287: =IF(RC[-4]=1,0,R[-1]C+R[-1]C[-3]) -> 2660390
A1288: =R[-300]C+1 -> 5 | B1288: =R[-300]C -> 82 | C1288: 114495 | D1288: 3 | E1288: =RC[-2] -> 114495 | F1288: =IF(RC[-4]=1,0,R[-1]C+R[-1]C[-3]) -> 2772290
A1289: =R[-300]C+1 -> 5 | B1289: =R[-300]C -> 83 | C1289: 117120 | D1289: 3 | E1289: =RC[-2] -> 117120 | F1289: =IF(RC[-4]=1,0,R[-1]C+R[-1]C[-3]) -> 2886785
A1290: =R[-300]C+1 -> 5 | B1290: =R[-300]C -> 84 | C1290: 119775 | D1290: 3 | E1290: =RC[-2] -> 119775 | F1290: =IF(RC[-4]=1,0,R[-1]C+R[-1]C[-3]) -> 3003905
A1291: =R[-300]C+1 -> 5 | B1291: =R[-300]C -> 85 | C1291: 122460 | D1291: 3 | E1291: =RC[-2] -> 122460 | F1291: =IF(RC[-4]=1,0,R[-1]C+R[-1]C[-3]) -> 3123680
A1292: =R[-300]C+1 -> 5 | B1292: =R[-300]C -> 86 | C1292: 125175 | D1292: 3 | E1292: =RC[-2] -> 125175 | F1292: =IF(RC[-4]=1,0,R[-1]C+R[-1]C[-3]) -> 3246140
A1293: =R[-300]C+1 -> 5 | B1293: =R[-300]C -> 87 | C1293: 127920 | D1293: 3 | E1293: =RC[-2] -> 127920 | F1293: =IF(RC[-4]=1,0,R[-1]C+R[-1]C[-3]) -> 3371315
A1294: =R[-300]C+1 -> 5 | B1294: =R[-300]C -> 88 | C1294: 130695 | D1294: 3 | E1294: =RC[-2] -> 130695 | F1294: =IF(RC[-4]=1,0,R[-1]C+R[-1]C[-3]) -> 3499235
A1295: =R[-300]C+1 -> 5 | B1295: =R[-300]C -> 89 | C1295: 133500 | D1295: 3 | E1295: =RC[-2] -> 133500 | F1295: =IF(RC[-4]=1,0,R[-1]C+R[-1]C[-3]) -> 3629930
A1296: =R[-300]C+1 -> 5 | B1296: =R[-300]C -> 90 | C1296: 136335 | D1296: 3 | E1296: =RC[-2] -> 136335 | F1296: =IF(RC[-4]=1,0,R[-1]C+R[-1]C[-3]) -> 3763430
A1297: =R[-300]C+1 -> 5 | B1297: =R[-300]C -> 91 | C1297: 139200 | D1297: 3 | E1297: =RC[-2] -> 139200 | F1297: =IF(RC[-4]=1,0,R[-1]C+R[-1]C[-3]) -> 3899765
A1298: =R[-300]C+1 -> 5 | B1298: =R[-300]C -> 92 | C1298: 142095 | D1298: 3 | E1298: =RC[-2] -> 142095 | F1298: =IF(RC[-4]=1,0,R[-1]C+R[-1]C[-3]) -> 4038965
A1299: =R[-300]C+1 -> 5 | B1299: =R[-300]C -> 93 | C1299: 145020 | D1299: 3 | E1299: =RC[-2] -> 145020 | F1299: =IF(RC[-4]=1,0,R[-1]C+R[-1]C[-3]) -> 4181060
A1300: =R[-300]C+1 -> 5 | B1300: =R[-300]C -> 94 | C1300: 147975 | D1300: 3 | E1300: =RC[-2] -> 147975 | F1300: =IF(RC[-4]=1,0,R[-1]C+R[-1]C[-3]) -> 4326080
A1301: =R[-300]C+1 -> 5 | B1301: =R[-300]C -> 95 | C1301: 150960 | D1301: 3 | E1301: =RC[-2] -> 150960 | F1301: =IF(RC[-4]=1,0,R[-1]C+R[-1]C[-3]) -> 4474055
A1302: =R[-300]C+1 -> 5 | B1302: =R[-300]C -> 96 | C1302: 153975 | D1302: 3 | E1302: =RC[-2] -> 153975 | F1302: =IF(RC[-4]=1,0,R[-1]C+R[-1]C[-3]) -> 4625015
A1303: =R[-300]C+1 -> 5 | B1303: =R[-300]C -> 97 | C1303: 157020 | D1303: 3 | E1303: =RC[-2] -> 157020 | F1303: =IF(RC[-4]=1,0,R[-1]C+R[-1]C[-3]) -> 4778990
A1304: =R[-300]C+1 -> 5 | B1304: =R[-300]C -> 98 | C1304: 160095 | D1304: 3 | E1304: =RC[-2] -> 160095 | F1304: =IF(RC[-4]=1,0,R[-1]C+R[-1]C[-3]) -> 4936010
A1305: =R[-300]C+1 -> 5 | B1305: =R[-300]C -> 99 | C1305: 163200 | D1305: 3 | E1305: =RC[-2] -> 163200 | F1305: =IF(RC[-4]=1,0,R[-1]C+R[-1]C[-3]) -> 5096105
A1306: =R[-300]C+1 -> 5 | B1306: =R[-300]C -> 100 | C1306: 166335 | D1306: 3 | E1306: =RC[-2] -> 166335 | F1306: =IF(RC[-4]=1,0,R[-1]C+R[-1]C[-3]) -> 5259305
A1307: =R[-300]C+1 -> 5 | B1307: =R[-300]C -> 101 | C1307: 169500 | D1307: 3 | E1307: =RC[-2] -> 169500 | F1307: =IF(RC[-4]=1,0,R[-1]C+R[-1]C[-3]) -> 5425640
A1308: =R[-300]C+1 -> 5 | B1308: =R[-300]C -> 102 | C1308: 172695 | D1308: 3 | E1308: =RC[-2] -> 172695 | F1308: =IF(RC[-4]=1,0,R[-1]C+R[-1]C[-3]) -> 5595140
A1309: =R[-300]C+1 -> 5 | B1309: =R[-300]C -> 103 | C1309: 175920 | D1309: 3 | E1309: =RC[-2] -> 175920 | F1309: =IF(RC[-4]=1,0,R[-1]C+R[-1]C[-3]) -> 5767835
A1310: =R[-300]C+1 -> 5 | B1310: =R[-300]C -> 104 | C1310: 179175 | D1310: 3 | E1310: =RC[-2] -> 179175 | F1310: =IF(RC[-4]=1,0,R[-1]C+R[-1]C[-3]) -> 5943755
A1311: =R[-300]C+1 -> 5 | B1311: =R[-300]C -> 105 | C1311: 182460 | D1311: 3 | E1311: =RC[-2] -> 182460 | F1311: =IF(RC[-4]=1,0,R[-1]C+R[-1]C[-3]) -> 6122930
A1312: =R[-300]C+1 -> 5 | B1312: =R[-300]C -> 106 | C1312: 185775 | D1312: 3 | E1312: =RC[-2] -> 185775 | F1312: =IF(RC[-4]=1,0,R[-1]C+R[-1]C[-3]) -> 6305390
A1313: =R[-300]C+1 -> 5 | B1313: =R[-300]C -> 107 | C1313: 189120 | D1313: 3 | E1313: =RC[-2] -> 189120 | F1313: =IF(RC[-4]=1,0,R[-1]C+R[-1]C[-3]) -> 6491165
A1314: =R[-300]C+1 -> 5 | B1314: =R[-300]C -> 108 | C1314: 192495 | D1314: 3 | E1314: =RC[-2] -> 192495 | F1314: =IF(RC[-4]=1,0,R[-1]C+R[-1]C[-3]) -> 6680285
A1315: =R[-300]C+1 -> 5 | B1315: =R[-300]C -> 109 | C1315: 195900 | D1315: 3 | E1315: =RC[-2] -> 195900 | F1315: =IF(RC[-4]=1,0,R[-1]C+R[-1]C[-3]) -> 6872780
A1316: =R[-300]C+1 -> 5 | B1316: =R[-300]C -> 110 | C1316: 199335 | D1316: 3 | E1316: =RC[-2] -> 199335 | F1316: =IF(RC[-4]=1,0,R[-1]C+R[-1]C[-3]) -> 7068680
A1317: =R[-300]C+1 -> 5 | B1317: =R[-300]C -> 111 | C1317: 202800 | D1317: 3 | E1317: =RC[-2] -> 202800 | F1317: =IF(RC[-4]=1,0,R[-1]C+R[-1]C[-3]) -> 7268015
A1318: =R[-300]C+1 -> 5 | B1318: =R[-300]C -> 112 | C1318: 206295 | D1318: 3 | E1318: =RC[-2] -> 206295 | F1318: =IF(RC[-4]=1,0,R[-1]C+R[-1]C[-3]) -> 7470815
A1319: =R[-300]C+1 -> 5 | B1319: =R[-300]C -> 113 | C1319: 209820 | D1319: 3 | E1319: =RC[-2] -> 209820 | F1319: =IF(RC[-4]=1,0,R[-1]C+R[-1]C[-3]) -> 7677110
A1320: =R[-300]C+1 -> 5 | B1320: =R[-300]C -> 114 | C1320: 213375 | D1320: 3 | E1320: =RC[-2] -> 213375 | F1320: =IF(RC[-4]=1,0,R[-1]C+R[-1]C[-3]) -> 7886930
A1321: =R[-300]C+1 -> 5 | B1321: =R[-300]C -> 115 | C1321: 216960 | D1321: 3 | E1321: =RC[-2] -> 216960 | F1321: =IF(RC[-4]=1,0,R[-1]C+R[-1]C[-3]) -> 8100305
A1322: =R[-300]C+1 -> 5 | B1322: =R[-300]C -> 116 | C1322: 220575 | D1322: 3 | E1322: =RC[-2] -> 220575 | F1322: =IF(RC[-4]=1,0,R[-1]C+R[-1]C[-3]) -> 8317265
A1323: =R[-300]C+1 -> 5 | B1323: =R[-300]C -> 117 | C1323: 224220 | D1323: 3 | E1323: =RC[-2] -> 224220 | F1323: =IF(RC[-4]=1,0,R[-1]C+R[-1]C[-3]) -> 8537840
A1324: =R[-300]C+1 -> 5 | B1324: =R[-300]C -> 118 | C1324: 227895 | D1324: 3 | E1324: =RC[-2] -> 227895 | F1324: =IF(RC[-4]=1,0,R[-1]C+R[-1]C[-3]) -> 8762060
A1325: =R[-300]C+1 -> 5 | B1325: =R[-300]C -> 119 | C1325: 231600 | D1325: 3 | E1325: =RC[-2] -> 231600 | F1325: =IF(RC[-4]=1,0,R[-1]C+R[-1]C[-3]) -> 8989955
A1326: =R[-300]C+1 -> 5 | B1326: =R[-300]C -> 120 | C1326: 235335 | D1326: 3 | E1326: =RC[-2] -> 235335 | F1326: =IF(RC[-4]=1,0,R[-1]C+R[-1]C[-3]) -> 9221555
A1327: =R[-300]C+1 -> 5 | B1327: =R[-300]C -> 121 | C1327: 239100 | D1327: 3 | E1327: =RC[-2] -> 239100 | F1327: =IF(RC[-4]=1,0,R[-1]C+R[-1]C[-3]) -> 9456890
A1328: =R[-300]C+1 -> 5 | B1328: =R[-300]C -> 122 | C1328: 242895 | D1328: 3 | E1328: =RC[-2] -> 242895 | F1328: =IF(RC[-4]=1,0,R[-1]C+R[-1]C[-3]) -> 9695990
A1329: =R[-300]C+1 -> 5 | B1329: =R[-300]C -> 123 | C1329: 246720 | D1329: 3 | E1329: =RC[-2] -> 246720 | F1329: =IF(RC[-4]=1,0,R[-1]C+R[-1]C[-3]) -> 9938885
A1330: =R[-300]C+1 -> 5 | B1330: =R[-300]C -> 124 | C1330: 250575 | D1330: 3 | E1330: =RC[-2] -> 250575 | F1330: =IF(RC[-4]=1,0,R[-1]C+R[-1]C[-3]) -> 10185605
A1331: =R[-300]C+1 -> 5 | B1331: =R[-300]C -> 125 | C1331: 254460 | D1331: 3 | E1331: =RC[-2] -> 254460 | F1331: =IF(RC[-4]=1,0,R[-1]C+R[-1]C[-3]) -> 10436180
A1332: =R[-300]C+1 -> 5 | B1332: =R[-300]C -> 126 | C1332: 258375 | D1332: 3 | E1332: =RC[-2] -> 258375 | F1332: =IF(RC[-4]=1,0,R[-1]C+R[-1]C[-3]) -> 10690640
A1333: =R[-300]C+1 -> 5 | B1333: =R[-300]C -> 127 | C1333: 262320 | D1333: 3 | E1333: =RC[-2] -> 262320 | F1333: =IF(RC[-4]=1,0,R[-1]C+R[-1]C[-3]) -> 10949015
A1334: =R[-300]C+1 -> 5 | B1334: =R[-300]C -> 128 | C1334: 266295 | D1334: 3 | E1334: =RC[-2] -> 266295 | F1334: =IF(RC[-4]=1,0,R[-1]C+R[-1]C[-3]) -> 11211335
A1335: =R[-300]C+1 -> 5 | B1335: =R[-300]C -> 129 | C1335: 270300 | D1335: 3 | E1335: =RC[-2] -> 270300 | F1335: =IF(RC[-4]=1,0,R[-1]C+R[-1]C[-3]) -> 11477630
A1336: =R[-300]C+1 -> 5 | B1336: =R[-300]C -> 130 | C1336: 274335 | D1336: 3 | E1336: =RC[-2] -> 274335 | F1336: =IF(RC[-4]=1,0,R[-1]C+R[-1]C[-3]) -> 11747930
A1337: =R[-300]C+1 -> 5 | B1337: =R[-300]C -> 131 | C1337: 278400 | D1337: 3 | E1337: =RC[-2] -> 278400 | F1337: =IF(RC[-4]=1,0,R[-1]C+R[-1]C[-3]) -> 12022265
A1338: =R[-300]C+1 -> 5 | B1338: =R[-300]C -> 132 | C1338: 282495 | D1338: 3 | E1338: =RC[-2] -> 282495 | F1338: =IF(RC[-4]=1,0,R[-1]C+R[-1]C[-3]) -> 12300665
A1339: =R[-300]C+1 -> 5 | B1339: =R[-300]C -> 133 | C1339: 286620 | D1339: 3 | E1339: =RC[-2] -> 286620 | F1339: =IF(RC[-4]=1,0,R[-1]C+R[-1]C[-3]) -> 12583160
A1340: =R[-300]C+1 -> 5 | B1340: =R[-300]C -> 134 | C1340: 290775 | D1340: 3 | E1340: =RC[-2] -> 290775 | F1340: =IF(RC[-4]=1,0,R[-1]C+R[-1]C[-3]) -> 12869780
A1341: =R[-300]C+1 -> 5 | B1341: =R[-300]C -> 135 | C1341: 294960 | D1341: 3 | E1341: =RC[-2] -> 294960 | F1341: =IF(RC[-4]=1,0,R[-1]C+R[-1]C[-3]) -> 13160555
A1342: =R[-300]C+1 -> 5 | B1342: =R[-300]C -> 136 | C1342: 299175 | D1342: 3 | E1342: =RC[-2] -> 299175 | F1342: =IF(RC[-4]=1,0,R[-1]C+R[-1]C[-3]) -> 13455515
A1343: =R[-300]C+1 -> 5 | B1343: =R[-300]C -> 137 | C1343: 303420 | D1343: 3 | E1343: =RC[-2] -> 303420 | F1343: =IF(RC[-4]=1,0,R[-1]C+R[-1]C[-3]) -> 13754690
A1344: =R[-300]C+1 -> 5 | B1344: =R[-300]C -> 138 | C1344: 307695 | D1344: 3 | E1344: =RC[-2] -> 307695 | F1344: =IF(RC[-4]=1,0,R[-1]C+R[-1]C[-3]) -> 14058110
A1345: =R[-300]C+1 -> 5 | B1345: =R[-300]C -> 139 | C1345: 312000 | D1345: 3 | E1345: =RC[-2] -> 312000 | F1345: =IF(RC[-4]=1,0,R[-1]C+R[-1]C[-3]) -> 14365805
A1346: =R[-300]C+1 -> 5 | B1346: =R[-300]C -> 140 | C1346: 316335 | D1346: 3 | E1346: =RC[-2] -> 316335 | F1346: =IF(RC[-4]=1,0,R[-1]C+R[-1]C[-3]) -> 14677805
A1347: =R[-300]C+1 -> 5 | B1347: =R[-300]C -> 141 | C1347: 320700 | D1347: 3 | E1347: =RC[-2] -> 320700 | F1347: =IF(RC[-4]=1,0,R[-1]C+R[-1]C[-3]) -> 14994140
A1348: =R[-300]C+1 -> 5 | B1348: =R[-300]C -> 142 | C1348: 325095 | D1348: 3 | E1348: =RC[-2] -> 325095 | F1348: =IF(RC[-4]=1,0,R[-1]C+R[-1]C[-3]) -> 15314840
A1349: =R[-300]C+1 -> 5 | B1349: =R[-300]C -> 143 | C1349: 329520 | D1349: 3 | E1349: =RC[-2] -> 329520 | F1349: =IF(RC[-4]=1,0,R[-1]C+R[-1]C[-3]) -> 15639935
A1350: =R[-300]C+1 -> 5 | B1350: =R[-300]C -> 144 | C1350: 333975 | D1350: 3 | E1350: =RC[-2] -> 333975 | F1350: =IF(RC[-4]=1,0,R[-1]C+R[-1]C[-3]) -> 15969455
A1351: =R[-300]C+1 -> 5 | B1351: =R[-300]C -> 145 | C1351: 338460 | D1351: 3 | E1351: =RC[-2] -> 338460 | F1351: =IF(RC[-4]=1,0,R[-1]C+R[-1]C[-3]) -> 16303430
A1352: =R[-300]C+1 -> 5 | B1352: =R[-300]C -> 146 | C1352: 342975 | D1352: 3 | E1352: =RC[-2] -> 342975 | F1352: =IF(RC[-4]=1,0,R[-1]C+R[-1]C[-3]) -> 16641890
A1353: =R[-300]C+1 -> 5 | B1353: =R[-300]C -> 147 | C1353: 347520 | D1353: 3 | E1353: =RC[-2] -> 347520 | F1353: =IF(RC[-4]=1,0,R[-1]C+R[-1]C[-3]) -> 16984865
A1354: =R[-300]C+1 -> 5 | B1354: =R[-300]C -> 148 | C1354: 352095 | D1354: 3 | E1354: =RC[-2] -> 352095 | F1354: =IF(RC[-4]=1,0,R[-1]C+R[-1]C[-3]) -> 17332385
A1355: =R[-300]C+1 -> 5 | B1355: =R[-300]C -> 149 | C1355: 356700 | D1355: 3 | E1355: =RC[-2] -> 356700 | F1355: =IF(RC[-4]=1,0,R[-1]C+R[-1]C[-3]) -> 17684480
A1356: =R[-300]C+1 -> 5 | B1356: =R[-300]C -> 150 | C1356: 361335 | D1356: 3 | E1356: =RC[-2] -> 361335 | F1356: =IF(RC[-4]=1,0,R[-1]C+R[-1]C[-3]) -> 18041180
A1357: =R[-300]C+1 -> 5 | B1357: =R[-300]C -> 151 | C1357: 366000 | D1357: 3 | E1357: =RC[-2] -> 366000 | F1357: =IF(RC[-4]=1,0,R[-1]C+R[-1]C[-3]) -> 18402515
A1358: =R[-300]C+1 -> 5 | B1358: =R[-300]C -> 152 | C1358: 370695 | D1358: 3 | E1358: =RC[-2] -> 370695 | F1358: =IF(RC[-4]=1,0,R[-1]C+R[-1]C[-3]) -> 18768515
A1359: =R[-300]C+1 -> 5 | B1359: =R[-300]C -> 153 | C1359: 375420 | D1359: 3 | E1359: =RC[-2] -> 375420 | F1359: =IF(RC[-4]=1,0,R[-1]C+R[-1]C[-3]) -> 19139210
A1360: =R[-300]C+1 -> 5 | B1360: =R[-300]C -> 154 | C1360: 380175 | D1360: 3 | E1360: =RC[-2] -> 380175 | F1360: =IF(RC[-4]=1,0,R[-1]C+R[-1]C[-3]) -> 19514630
A1361: =R[-300]C+1 -> 5 | B1361: =R[-300]C -> 155 | C1361: 384960 | D1361: 3 | E1361: =RC[-2] -> 384960 | F1361: =IF(RC[-4]=1,0,R[-1]C+R[-1]C[-3]) -> 19894805
A1362: =R[-300]C+1 -> 5 | B1362: =R[-300]C -> 156 | C1362: 389775 | D1362: 3 | E1362: =RC[-2] -> 389775 | F1362: =IF(RC[-4]=1,0,R[-1]C+R[-1]C[-3]) -> 20279765
A1363: =R[-300]C+1 -> 5 | B1363: =R[-300]C -> 157 | C1363: 394620 | D1363: 3 | E1363: =RC[-2] -> 394620 | F1363: =IF(RC[-4]=1,0,R[-1]C+R[-1]C[-3]) -> 20669540
A1364: =R[-300]C+1 -> 5 | B1364: =R[-300]C -> 158 | C1364: 399495 | D1364: 3 | E1364: =RC[-2] -> 399495 | F1364: =IF(RC[-4]=1,0,R[-1]C+R[-1]C[-3]) -> 21064160
A1365: =R[-300]C+1 -> 5 | B1365: =R[-300]C -> 159 | C1365: 404400 | D1365: 3 | E1365: =RC[-2] -> 404400 | F1365: =IF(RC[-4]=1,0,R[-1]C+R[-1]C[-3]) -> 21463655
A1366: =R[-300]C+1 -> 5 | B1366: =R[-300]C -> 160 | C1366: 409335 | D1366: 3 | E1366: =RC[-2] -> 409335 | F1366: =IF(RC[-4]=1,0,R[-1]C+R[-1]C[-3]) -> 21868055
A1367: =R[-300]C+1 -> 5 | B1367: =R[-300]C -> 161 | C1367: 414300 | D1367: 3 | E1367: =RC[-2] -> 414300 | F1367: =IF(RC[-4]=1,0,R[-1]C+R[-1]C[-3]) -> 22277390
A1368: =R[-300]C+1 -> 5 | B1368: =R[-300]C -> 162 | C1368: 419295 | D1368: 3 | E1368: =RC[-2] -> 419295 | F1368: =IF(RC[-4]=1,0,R[-1]C+R[-1]C[-3]) -> 22691690
A1369: =R[-300]C+1 -> 5 | B1369: =R[-300]C -> 163 | C1369: 424320 | D1369: 3 | E1369: =RC[-2] -> 424320 | F1369: =IF(RC[-4]=1,0,R[-1]C+R[-1]C[-3]) -> 23110985
A1370: =R[-300]C+1 -> 5 | B1370: =R[-300]C -> 164 | C1370: 429375 | D1370: 3 | E1370: =RC[-2] -> 429375 | F1370: =IF(RC[-4]=1,0,R[-1]C+R[-1]C[-3]) -> 23535305
A1371: =R[-300]C+1 -> 5 | B1371: =R[-300]C -> 165 | C1371: 434460 | D1371: 3 | E1371: =RC[-2] -> 434460 | F1371: =IF(RC[-4]=1,0,R[-1]C+R[-1]C[-3]) -> 23964680
A1372: =R[-300]C+1 -> 5 | B1372: =R[-300]C -> 166 | C1372: 439575 | D1372: 3 | E1372: =RC[-2] -> 439575 | F1372: =IF(RC[-4]=1,0,R[-1]C+R[-1]C[-3]) -> 24399140
A1373: =R[-300]C+1 -> 5 | B1373: =R[-300]C -> 167 | C1373: 444720 | D1373: 3 | E1373: =RC[-2] -> 444720 | F1373: =IF(RC[-4]=1,0,R[-1]C+R[-1]C[-3]) -> 24838715
A1374: =R[-300]C+1 -> 5 | B1374: =R[-300]C -> 168 | C1374: 449895 | D1374: 3 | E1374: =RC[-2] -> 449895 | F1374: =IF(RC[-4]=1,0,R[-1]C+R[-1]C[-3]) -> 25283435
A1375: =R[-300]C+1 -> 5 | B1375: =R[-300]C -> 169 | C1375: 455100 | D1375: 3 | E1375: =RC[-2] -> 455100 | F1375: =IF(RC[-4]=1,0,R[-1]C+R[-1]C[-3]) -> 25733330
A1376: =R[-300]C+1 -> 5 | B1376: =R[-300]C -> 170 | C1376: 460335 | D1376: 3 | E1376: =RC[-2] -> 460335 | F1376: =IF(RC[-4]=1,0,R[-1]C+R[-1]C[-3]) -> 26188430
A1377: =R[-300]C+1 -> 5 | B1377: =R[-300]C -> 171 | C1377: 465600 | D1377: 3 | E1377: =RC[-2] -> 465600 | F1377: =IF(RC[-4]=1,0,R[-1]C+R[-1]C[-3]) -> 26648765
A1378: =R[-300]C+1 -> 5 | B1378: =R[-300]C -> 172 | C1378: 470895 | D1378: 3 | E1378: =RC[-2] -> 470895 | F1378: =IF(RC[-4]=1,0,R[-1]C+R[-1]C[-3]) -> 27114365
A1379: =R[-300]C+1 -> 5 | B1379: =R[-300]C -> 173 | C1379: 476220 | D1379: 3 | E1379: =RC[-2] -> 476220 | F1379: =IF(RC[-4]=1,0,R[-1]C+R[-1]C[-3]) -> 27585260
A1380: =R[-300]C+1 -> 5 | B1380: =R[-300]C -> 174 | C1380: 481575 | D1380: 3 | E1380: =RC[-2] -> 481575 | F1380: =IF(RC[-4]=1,0,R[-1]C+R[-1]C[-3]) -> 28061480
A1381: =R[-300]C+1 -> 5 | B1381: =R[-300]C -> 175 | C1381: 486960 | D1381: 3 | E1381: =RC[-2] -> 486960 | F1381: =IF(RC[-4]=1,0,R[-1]C+R[-1]C[-3]) -> 28543055
A1382: =R[-300]C+1 -> 5 | B1382: =R[-300]C -> 176 | C1382: 492375 | D1382: 3 | E1382: =RC[-2] -> 492375 | F1382: =IF(RC[-4]=1,0,R[-1]C+R[-1]C[-3]) -> 29030015
A1383: =R[-300]C+1 -> 5 | B1383: =R[-300]C -> 177 | C1383: 497820 | D1383: 3 | E1383: =RC[-2] -> 497820 | F1383: =IF(RC[-4]=1,0,R[-1]C+R[-1]C[-3]) -> 29522390
A1384: =R[-300]C+1 -> 5 | B1384: =R[-300]C -> 178 | C1384: 503295 | D1384: 3 | E1384: =RC[-2] -> 503295 | F1384: =IF(RC[-4]=1,0,R[-1]C+R[-1]C[-3]) -> 30020210
A1385: =R[-300]C+1 -> 5 | B1385: =R[-300]C -> 179 | C1385: 508800 | D1385: 3 | E1385: =RC[-2] -> 508800 | F1385: =IF(RC[-4]=1,0,R[-1]C+R[-1]C[-3]) -> 30523505
A1386: =R[-300]C+1 -> 5 | B1386: =R[-300]C -> 180 | C1386: 514335 | D1386: 3 | E1386: =RC[-2] -> 514335 | F1386: =IF(RC[-4]=1,0,R[-1]C+R[-1]C[-3]) -> 31032305
A1387: =R[-300]C+1 -> 5 | B1387: =R[-300]C -> 181 | C1387: 519900 | D1387: 3 | E1387: =RC[-2] -> 519900 | F1387: =IF(RC[-4]=1,0,R[-1]C+R[-1]C[-3]) -> 31546640
A1388: =R[-300]C+1 -> 5 | B1388: =R[-300]C -> 182 | C1388: 525495 | D1388: 3 | E1388: =RC[-2] -> 525495 | F1388: =IF(RC[-4]=1,0,R[-1]C+R[-1]C[-3]) -> 32066540
A1389: =R[-300]C+1 -> 5 | B1389: =R[-300]C -> 183 | C1389: 531120 | D1389: 3 | E1389: =RC[-2] -> 531120 | F1389: =IF(RC[-4]=1,0,R[-1]C+R[-1]C[-3]) -> 32592035
A1390: =R[-300]C+1 -> 5 | B1390: =R[-300]C -> 184 | C1390: 536775 | D1390: 3 | E1390: =RC[-2] -> 536775 | F1390: =IF(RC[-4]=1,0,R[-1]C+R[-1]C[-3]) -> 33123155
A1391: =R[-300]C+1 -> 5 | B1391: =R[-300]C -> 185 | C1391: 542460 | D1391: 3 | E1391: =RC[-2] -> 542460 | F1391: =IF(RC[-4]=1,0,R[-1]C+R[-1]C[-3]) -> 33659930
A1392: =R[-300]C+1 -> 5 | B1392: =R[-300]C -> 186 | C1392: 548175 | D1392: 3 | E1392: =RC[-2] -> 548175 | F1392: =IF(RC[-4]=1,0,R[-1]C+R[-1]C[-3]) -> 34202390
A1393: =R[-300]C+1 -> 5 | B1393: =R[-300]C -> 187 | C1393: 553920 | D1393: 3 | E1393: =RC[-2] -> 553920 | F1393: =IF(RC[-4]=1,0,R[-1]C+R[-1]C[-3]) -> 34750565
A1394: =R[-300]C+1 -> 5 | B1394: =R[-300]C -> 188 | C1394: 559695 | D1394: 3 | E1394: =RC[-2] -> 559695 | F1394: =IF(RC[-4]=1,0,R[-1]C+R[-1]C[-3]) -> 35304485
A1395: =R[-300]C+1 -> 5 | B1395: =R[-300]C -> 189 | C1395: 565500 | D1395: 3 | E1395: =RC[-2] -> 565500 | F1395: =IF(RC[-4]=1,0,R[-1]C+R[-1]C[-3]) -> 35864180
A1396: =R[-300]C+1 -> 5 | B1396: =R[-300]C -> 190 | C1396: 571335 | D1396: 3 | E1396: =RC[-2] -> 571335 | F1396: =IF(RC[-4]=1,0,R[-1]C+R[-1]C[-3]) -> 36429680
A1397: =R[-300]C+1 -> 5 | B1397: =R[-300]C -> 191 | C1397: 577200 | D1397: 3 | E1397: =RC[-2] -> 577200 | F1397: =IF(RC[-4]=1,0,R[-1]C+R[-1]C[-3]) -> 37001015
A1398: =R[-300]C+1 -> 5 | B1398: =R[-300]C -> 192 | C1398: 583095 | D1398: 3 | E1398: =RC[-2] -> 583095 | F1398: =IF(RC[-4]=1,0,R[-1]C+R[-1]C[-3]) -> 37578215
A1399: =R[-300]C+1 -> 5 | B1399: =R[-300]C -> 193 | C1399: 589020 | D1399: 3 | E1399: =RC[-2] -> 589020 | F1399: =IF(RC[-4]=1,0,R[-1]C+R[-1]C[-3]) -> 38161310
A1400: =R[-300]C+1 -> 5 | B1400: =R[-300]C -> 194 | C1400: 594975 | D1400: 3 | E1400: =RC[-2] -> 594975 | F1400: =IF(RC[-4]=1,0,R[-1]C+R[-1]C[-3]) -> 38750330
A1401: =R[-300]C+1 -> 5 | B1401: =R[-300]C -> 195 | C1401: 600960 | D1401: 3 | E1401: =RC[-2] -> 600960 | F1401: =IF(RC[-4]=1,0,R[-1]C+R[-1]C[-3]) -> 39345305
A1402: =R[-300]C+1 -> 5 | B1402: =R[-300]C -> 196 | C1402: 606975 | D1402: 3 | E1402: =RC[-2] -> 606975 | F1402: =IF(RC[-4]=1,0,R[-1]C+R[-1]C[-3]) -> 39946265
A1403: =R[-300]C+1 -> 5 | B1403: =R[-300]C -> 197 | C1403: 613020 | D1403: 3 | E1403: =RC[-2] -> 613020 | F1403: =IF(RC[-4]=1,0,R[-1]C+R[-1]C[-3]) -> 40553240
A1404: =R[-300]C+1 -> 5 | B1404: =R[-300]C -> 198 | C1404: 619095 | D1404: 3 | E1404: =RC[-2] -> 619095 | F1404: =IF(RC[-4]=1,0,R[-1]C+R[-1]C[-3]) -> 41166260
A1405: =R[-300]C+1 -> 5 | B1405: =R[-300]C -> 199 | C1405: 625200 | D1405: 3 | E1405: =RC[-2] -> 625200 | F1405: =IF(RC[-4]=1,0,R[-1]C+R[-1]C[-3]) -> 41785355
A1406: =R[-300]C+1 -> 5 | B1406: =R[-300]C -> 200 | C1406: 631335 | D1406: 3 | E1406: =RC[-2] -> 631335 | F1406: =IF(RC[-4]=1,0,R[-1]C+R[-1]C[-3]) -> 42410555
A1407: =R[-300]C+1 -> 5 | B1407: =R[-300]C -> 201 | C1407: 637500 | D1407: 3 | E1407: =RC[-2] -> 637500 | F1407: =IF(RC[-4]=1,0,R[-1]C+R[-1]C[-3]) -> 43041890
A1408: =R[-300]C+1 -> 5 | B1408: =R[-300]C -> 202 | C1408: 643695 | D1408: 3 | E1408: =RC[-2] -> 643695 | F1408: =IF(RC[-4]=1,0,R[-1]C+R[-1]C[-3]) -> 43679390
A1409: =R[-300]C+1 -> 5 | B1409: =R[-300]C -> 203 | C1409: 649920 | D1409: 3 | E1409: =RC[-2] -> 649920 | F1409: =IF(RC[-4]=1,0,R[-1]C+R[-1]C[-3]) -> 44323085
A1410: =R[-300]C+1 -> 5 | B1410: =R[-300]C -> 204 | C1410: 656175 | D1410: 3 | E1410: =RC[-2] -> 656175 | F1410: =IF(RC[-4]=1,0,R[-1]C+R[-1]C[-3]) -> 44973005
A1411: =R[-300]C+1 -> 5 | B1411: =R[-300]C -> 205 | C1411: 662460 | D1411: 3 | E1411: =RC[-2] -> 662460 | F1411: =IF(RC[-4]=1,0,R[-1]C+R[-1]C[-3]) -> 45629180
A1412: =R[-300]C+1 -> 5 | B1412: =R[-300]C -> 206 | C1412: 668775 | D1412: 3 | E1412: =RC[-2] -> 668775 | F1412: =IF(RC[-4]=1,0,R[-1]C+R[-1]C[-3]) -> 46291640
A1413: =R[-300]C+1 -> 5 | B1413: =R[-300]C -> 207 | C1413: 675120 | D1413: 3 | E1413: =RC[-2] -> 675120 | F1413: =IF(RC[-4]=1,0,R[-1]C+R[-1]C[-3]) -> 46960415
A1414: =R[-300]C+1 -> 5 | B1414: =R[-300]C -> 208 | C1414: 681495 | D1414: 3 | E1414: =RC[-2] -> 681495 | F1414: =IF(RC[-4]=1,0,R[-1]C+R[-1]C[-3]) -> 47635535
A1415: =R[-300]C+1 -> 5 | B1415: =R[-300]C -> 209 | C1415: 687900 | D1415: 3 | E1415: =RC[-2] -> 687900 | F1415: =IF(RC[-4]=1,0,R[-1]C+R[-1]C[-3]) -> 48317030
A1416: =R[-300]C+1 -> 5 | B1416: =R[-300]C -> 210 | C1416: 694335 | D1416: 3 | E1416: =RC[-2] -> 694335 | F1416: =IF(RC[-4]=1,0,R[-1]C+R[-1]C[-3]) -> 49004930
A1417: =R[-300]C+1 -> 5 | B1417: =R[-300]C -> 211 | C1417: 700800 | D1417: 3 | E1417: =RC[-2] -> 700800 | F1417: =IF(RC[-4]=1,0,R[-1]C+R[-1]C[-3]) -> 49699265
A1418: =R[-300]C+1 -> 5 | B1418: =R[-300]C -> 212 | C1418: 707295 | D1418: 3 | E1418: =RC[-2] -> 707295 | F1418: =IF(RC[-4]=1,0,R[-1]C+R[-1]C[-3]) -> 50400065
A1419: =R[-300]C+1 -> 5 | B1419: =R[-300]C -> 213 | C1419: 713820 | D1419: 3 | E1419: =RC[-2] -> 713820 | F1419: =IF(RC[-4]=1,0,R[-1]C+R[-1]C[-3]) -> 51107360
A1420: =R[-300]C+1 -> 5 | B1420: =R[-300]C -> 214 | C1420: 720375 | D1420: 3 | E1420: =RC[-2] -> 720375 | F1420: =IF(RC[-4]=1,0,R[-1]C+R[-1]C[-3]) -> 51821180
A1421: =R[-300]C+1 -> 5 | B1421: =R[-300]C -> 215 | C1421: 726960 | D1421: 3 | E1421: =RC[-2] -> 726960 | F1421: =IF(RC[-4]=1,0,R[-1]C+R[-1]C[-3]) -> 52541555
A1422: =R[-300]C+1 -> 5 | B1422: =R[-300]C -> 216 | C1422: 733575 | D1422: 3 | E1422: =RC[-2] -> 733575 | F1422: =IF(RC[-4]=1,0,R[-1]C+R[-1]C[-3]) -> 53268515
A1423: =R[-300]C+1 -> 5 | B1423: =R[-300]C -> 217 | C1423: 740220 | D1423: 3 | E1423: =RC[-2] -> 740220 | F1423: =IF(RC[-4]=1,0,R[-1]C+R[-1]C[-3]) -> 54002090
A1424: =R[-300]C+1 -> 5 | B1424: =R[-300]C -> 218 | C1424: 746895 | D1424: 3 | E1424: =RC[-2] -> 746895 | F1424: =IF(RC[-4]=1,0,R[-1]C+R[-1]C[-3]) -> 54742310
A1425: =R[-300]C+1 -> 5 | B1425: =R[-300]C -> 219 | C1425: 753600 | D1425: 3 | E1425: =RC[-2] -> 753600 | F1425: =IF(RC[-4]=1,0,R[-1]C+R[-1]C[-3]) -> 55489205
A1426: =R[-300]C+1 -> 5 | B1426: =R[-300]C -> 220 | C1426: 760335 | D1426: 3 | E1426: =RC[-2] -> 760335 | F1426: =IF(RC[-4]=1,0,R[-1]C+R[-1]C[-3]) -> 56242805
A1427: =R[-300]C+1 -> 5 | B1427: =R[-300]C -> 221 | C1427: 767100 | D1427: 3 | E1427: =RC[-2] -> 767100 | F1427: =IF(RC[-4]=1,0,R[-1]C+R[-1]C[-3]) -> 57003140
A1428: =R[-300]C+1 -> 5 | B1428: =R[-300]C -> 222 | C1428: 773895 | D1428: 3 | E1428: =RC[-2] -> 773895 | F1428: =IF(RC[-4]=1,0,R[-1]C+R[-1]C[-3]) -> 57770240
A1429: =R[-300]C+1 -> 5 | B1429: =R[-300]C -> 223 | C1429: 780720 | D1429: 3 | E1429: =RC[-2] -> 780720 | F1429: =IF(RC[-4]=1,0,R[-1]C+R[-1]C[-3]) -> 58544135
A1430: =R[-300]C+1 -> 5 | B1430: =R[-300]C -> 224 | C1430: 787575 | D1430: 3 | E1430: =RC[-2] -> 787575 | F1430: =IF(RC[-4]=1,0,R[-1]C+R[-1]C[-3]) -> 59324855
A1431: =R[-300]C+1 -> 5 | B1431: =R[-300]C -> 225 | C1431: 794460 | D1431: 3 | E1431: =RC[-2] -> 794460 | F1431: =IF(RC[-4]=1,0,R[-1]C+R[-1]C[-3]) -> 60112430
A1432: =R[-300]C+1 -> 5 | B1432: =R[-300]C -> 226 | C1432: 801375 | D1432: 3 | E1432: =RC[-2] -> 801375 | F1432: =IF(RC[-4]=1,0,R[-1]C+R[-1]C[-3]) -> 60906890
A1433: =R[-300]C+1 -> 5 | B1433: =R[-300]C -> 227 | C1433: 808320 | D1433: 3 | E1433: =RC[-2] -> 808320 | F1433: =IF(RC[-4]=1,0,R[-1]C+R[-1]C[-3]) -> 61708265
A1434: =R[-300]C+1 -> 5 | B1434: =R[-300]C -> 228 | C1434: 815295 | D1434: 3 | E1434: =RC[-2] -> 815295 | F1434: =IF(RC[-4]=1,0,R[-1]C+R[-1]C[-3]) -> 62516585
A1435: =R[-300]C+1 -> 5 | B1435: =R[-300]C -> 229 | C1435: 822300 | D1435: 3 | E1435: =RC[-2] -> 822300 | F1435: =IF(RC[-4]=1,0,R[-1]C+R[-1]C[-3]) -> 63331880
A1436: =R[-300]C+1 -> 5 | B1436: =R[-300]C -> 230 | C1436: 829335 | D1436: 3 | E1436: =RC[-2] -> 829335 | F1436: =IF(RC[-4]=1,0,R[-1]C+R[-1]C[-3]) -> 64154180
A1437: =R[-300]C+1 -> 5 | B1437: =R[-300]C -> 231 | C1437: 836400 | D1437: 3 | E1437: =RC[-2] -> 836400 | F1437: =IF(RC[-4]=1,0,R[-1]C+R[-1]C[-3]) -> 64983515
A1438: =R[-300]C+1 -> 5 | B1438: =R[-300]C -> 232 | C1438: 843495 | D1438: 3 | E1438: =RC[-2] -> 843495 | F1438: =IF(RC[-4]=1,0,R[-1]C+R[-1]C[-3]) -> 65819915
A1439: =R[-300]C+1 -> 5 | B1439: =R[-300]C -> 233 | C1439: 850620 | D1439: 3 | E1439: =RC[-2] -> 850620 | F1439: =IF(RC[-4]=1,0,R[-1]C+R[-1]C[-3]) -> 66663410
A1440: =R[-300]C+1 -> 5 | B1440: =R[-300]C -> 234 | C1440: 857775 | D1440: 3 | E1440: =RC[-2] -> 857775 | F1440: =IF(RC[-4]=1,0,R[-1]C+R[-1]C[-3]) -> 67514030
A1441: =R[-300]C+1 -> 5 | B1441: =R[-300]C -> 235 | C1441: 864960 | D1441: 3 | E1441: =RC[-2] -> 864960 | F1441: =IF(RC[-4]=1,0,R[-1]C+R[-1]C[-3]) -> 68371805
A1442: =R[-300]C+1 -> 5 | B1442: =R[-300]C -> 236 | C1442: 872175 | D1442: 3 | E1442: =RC[-2] -> 872175 | F1442: =IF(RC[-4]=1,0,R[-1]C+R[-1]C[-3]) -> 69236765
A1443: =R[-300]C+1 -> 5 | B1443: =R[-300]C -> 237 | C1443: 879420 | D1443: 3 | E1443: =RC[-2] -> 879420 | F1443: =IF(RC[-4]=1,0,R[-1]C+R[-1]C[-3]) -> 70108940
A1444: =R[-300]C+1 -> 5 | B1444: =R[-300]C -> 238 | C1444: 886695 | D1444: 3 | E1444: =RC[-2] -> 886695 | F1444: =IF(RC[-4]=1,0,R[-1]C+R[-1]C[-3]) -> 70988360
A1445: =R[-300]C+1 -> 5 | B1445: =R[-300]C -> 239 | C1445: 894000 | D1445: 3 | E1445: =RC[-2] -> 894000 | F1445: =IF(RC[-4]=1,0,R[-1]C+R[-1]C[-3]) -> 71875055
A1446: =R[-300]C+1 -> 5 | B1446: =R[-300]C -> 240 | C1446: 901335 | D1446: 3 | E1446: =RC[-2] -> 901335 | F1446: =IF(RC[-4]=1,0,R[-1]C+R[-1]C[-3]) -> 72769055
A1447: =R[-300]C+1 -> 5 | B1447: =R[-300]C -> 241 | C1447: 908700 | D1447: 3 | E1447: =RC[-2] -> 908700 | F1447: =IF(RC[-4]=1,0,R[-1]C+R[-1]C[-3]) -> 73670390
A1448: =R[-300]C+1 -> 5 | B1448: =R[-300]C -> 242 | C1448: 916095 | D1448: 3 | E1448: =RC[-2] -> 916095 | F1448: =IF(RC[-4]=1,0,R[-1]C+R[-1]C[-3]) -> 74579090
A1449: =R[-300]C+1 -> 5 | B1449: =R[-300]C -> 243 | C1449: 923520 | D1449: 3 | E1449: =RC[-2] -> 923520 | F1449: =IF(RC[-4]=1,0,R[-1]C+R[-1]C[-3]) -> 75495185
A1450: =R[-300]C+1 -> 5 | B1450: =R[-300]C -> 244 | C1450: 930975 | D1450: 3 | E1450: =RC[-2] -> 930975 | F1450: =IF(RC[-4]=1,0,R[-1]C+R[-1]C[-3]) -> 76418705
A1451: =R[-300]C+1 -> 5 | B1451: =R[-300]C -> 245 | C1451: 938460 | D1451: 3 | E1451: =RC[-2] -> 938460 | F1451: =IF(RC[-4]=1,0,R[-1]C+R[-1]C[-3]) -> 77349680
A1452: =R[-300]C+1 -> 5 | B1452: =R[-300]C -> 246 | C1452: 945975 | D1452: 3 | E1452: =RC[-2] -> 945975 | F1452: =IF(RC[-4]=1,0,R[-1]C+R[-1]C[-3]) -> 78288140
A1453: =R[-300]C+1 -> 5 | B1453: =R[-300]C -> 247 | C1453: 953520 | D1453: 3 | E1453: =RC[-2] -> 953520 | F1453: =IF(RC[-4]=1,0,R[-1]C+R[-1]C[-3]) -> 79234115
A1454: =R[-300]C+1 -> 5 | B1454: =R[-300]C -> 248 | C1454: 961095 | D1454: 3 | E1454: =RC[-2] -> 961095 | F1454: =IF(RC[-4]=1,0,R[-1]C+R[-1]C[-3]) -> 80187635
A1455: =R[-300]C+1 -> 5 | B1455: =R[-300]C -> 249 | C1455: 968700 | D1455: 3 | E1455: =RC[-2] -> 968700 | F1455: =IF(RC[-4]=1,0,R[-1]C+R[-1]C[-3]) -> 81148730
A1456: =R[-300]C+1 -> 5 | B1456: =R[-300]C -> 250 | C1456: 976335 | D1456: 3 | E1456: =RC[-2] -> 976335 | F1456: =IF(RC[-4]=1,0,R[-1]C+R[-1]C[-3]) -> 82117430
A1457: =R[-300]C+1 -> 5 | B1457: =R[-300]C -> 251 | C1457: 984000 | D1457: 3 | E1457: =RC[-2] -> 984000 | F1457: =IF(RC[-4]=1,0,R[-1]C+R[-1]C[-3]) -> 83093765
A1458: =R[-300]C+1 -> 5 | B1458: =R[-300]C -> 252 | C1458: 991695 | D1458: 3 | E1458: =RC[-2] -> 991695 | F1458: =IF(RC[-4]=1,0,R[-1]C+R[-1]C[-3]) -> 84077765
A1459: =R[-300]C+1 -> 5 | B1459: =R[-300]C -> 253 | C1459: 999420 | D1459: 3 | E1459: =RC[-2] -> 999420 | F1459: =IF(RC[-4]=1,0,R[-1]C+R[-1]C[-3]) -> 85069460
A1460: =R[-300]C+1 -> 5 | B1460: =R[-300]C -> 254 | C1460: 1007175 | D1460: 3 | E1460: =RC[-2] -> 1007175 | F1460: =IF(RC[-4]=1,0,R[-1]C+R[-1]C[-3]) -> 86068880
A1461: =R[-300]C+1 -> 5 | B1461: =R[-300]C -> 255 | C1461: 1014960 | D1461: 3 | E1461: =RC[-2] -> 1014960 | F1461: =IF(RC[-4]=1,0,R[-1]C+R[-1]C[-3]) -> 87076055
A1462: =R[-300]C+1 -> 5 | B1462: =R[-300]C -> 256 | C1462: 1022775 | D1462: 3 | E1462: =RC[-2] -> 1022775 | F1462: =IF(RC[-4]=1,0,R[-1]C+R[-1]C[-3]) -> 88091015
A1463: =R[-300]C+1 -> 5 | B1463: =R[-300]C -> 257 | C1463: 1030620 | D1463: 3 | E1463: =RC[-2] -> 1030620 | F1463: =IF(RC[-4]=1,0,R[-1]C+R[-1]C[-3]) -> 89113790
A1464: =R[-300]C+1 -> 5 | B1464: =R[-300]C -> 258 | C1464: 1038495 | D1464: 3 | E1464: =RC[-2] -> 1038495 | F1464: =IF(RC[-4]=1,0,R[-1]C+R[-1]C[-3]) -> 90144410
A1465: =R[-300]C+1 -> 5 | B1465: =R[-300]C -> 259 | C1465: 1046400 | D1465: 3 | E1465: =RC[-2] -> 1046400 | F1465: =IF(RC[-4]=1,0,R[-1]C+R[-1]C[-3]) -> 91182905
A1466: =R[-300]C+1 -> 5 | B1466: =R[-300]C -> 260 | C1466: 1054335 | D1466: 3 | E1466: =RC[-2] -> 1054335 | F1466: =IF(RC[-4]=1,0,R[-1]C+R[-1]C[-3]) -> 92229305
A1467: =R[-300]C+1 -> 5 | B1467: =R[-300]C -> 261 | C1467: 1062300 | D1467: 3 | E1467: =RC[-2] -> 1062300 | F1467: =IF(RC[-4]=1,0,R[-1]C+R[-1]C[-3]) -> 93283640
A1468: =R[-300]C+1 -> 5 | B1468: =R[-300]C -> 262 | C1468: 1070295 | D1468: 3 | E1468: =RC[-2] -> 1070295 | F1468: =IF(RC[-4]=1,0,R[-1]C+R[-1]C[-3]) -> 94345940
A1469: =R[-300]C+1 -> 5 | B1469: =R[-300]C -> 263 | C1469: 1078320 | D1469: 3 | E1469: =RC[-2] -> 1078320 | F1469: =IF(RC[-4]=1,0,R[-1]C+R[-1]C[-3]) -> 95416235
A1470: =R[-300]C+1 -> 5 | B1470: =R[-300]C -> 264 | C1470: 1086375 | D1470: 3 | E1470: =RC[-2] -> 1086375 | F1470: =IF(RC[-4]=1,0,R[-1]C+R[-1]C[-3]) -> 96494555
A1471: =R[-300]C+1 -> 5 | B1471: =R[-300]C -> 265 | C1471: 1094460 | D1471: 3 | E1471: =RC[-2] -> 1094460 | F1471: =IF(RC[-4]=1,0,R[-1]C+R[-1]C[-3]) -> 97580930
A1472: =R[-300]C+1 -> 5 | B1472: =R[-300]C -> 266 | C1472: 1102575 | D1472: 3 | E1472: =RC[-2] -> 1102575 | F1472: =IF(RC[-4]=1,0,R[-1]C+R[-1]C[-3]) -> 98675390
A1473: =R[-300]C+1 -> 5 | B1473: =R[-300]C -> 267 | C1473: 1110720 | D1473: 3 | E1473: =RC[-2] -> 1110720 | F1473: =IF(RC[-4]=1,0,R[-1]C+R[-1]C[-3]) -> 99777965
A1474: =R[-300]C+1 -> 5 | B1474: =R[-300]C -> 268 | C1474: 1118895 | D1474: 3 | E1474: =RC[-2] -> 1118895 | F1474: =IF(RC[-4]=1,0,R[-1]C+R[-1]C[-3]) -> 100888685
A1475: =R[-300]C+1 -> 5 | B1475: =R[-300]C -> 269 | C1475: 1127100 | D1475: 3 | E1475: =RC[-2] -> 1127100 | F1475: =IF(RC[-4]=1,0,R[-1]C+R[-1]C[-3]) -> 102007580
A1476: =R[-300]C+1 -> 5 | B1476: =R[-300]C -> 270 | C1476: 1135335 | D1476: 3 | E1476: =RC[-2] -> 1135335 | F1476: =IF(RC[-4]=1,0,R[-1]C+R[-1]C[-3]) -> 103134680
A1477: =R[-300]C+1 -> 5 | B1477: =R[-300]C -> 271 | C1477: 1143600 | D1477: 3 | E1477: =RC[-2] -> 1143600 | F1477: =IF(RC[-4]=1,0,R[-1]C+R[-1]C[-3]) -> 104270015
A1478: =R[-300]C+1 -> 5 | B1478: =R[-300]C -> 272 | C1478: 1151895 | D1478: 3 | E1478: =RC[-2] -> 1151895 | F1478: =IF(RC[-4]=1,0,R[-1]C+R[-1]C[-3]) -> 105413615
A1479: =R[-300]C+1 -> 5 | B1479: =R[-300]C -> 273 | C1479: 1160220 | D1479: 3 | E1479: =RC[-2] -> 1160220 | F1479: =IF(RC[-4]=1,0,R[-1]C+R[-1]C[-3]) -> 106565510
A1480: =R[-300]C+1 -> 5 | B1480: =R[-300]C -> 274 | C1480: 1168575 | D1480: 3 | E1480: =RC[-2] -> 1168575 | F1480: =IF(RC[-4]=1,0,R[-1]C+R[-1]C[-3]) -> 107725730
A1481: =R[-300]C+1 -> 5 | B1481: =R[-300]C -> 275 | C1481: 1176960 | D1481: 3 | E1481: =RC[-2] -> 1176960 | F1481: =IF(RC[-4]=1,0,R[-1]C+R[-1]C[-3]) -> 108894305
A1482: =R[-300]C+1 -> 5 | B1482: =R[-300]C -> 276 | C1482: 1185375 | D1482: 3 | E1482: =RC[-2] -> 1185375 | F1482: =IF(RC[-4]=1,0,R[-1]C+R[-1]C[-3]) -> 110071265
A1483: =R[-300]C+1 -> 5 | B1483: =R[-300]C -> 277 | C1483: 1193820 | D1483: 3 | E1483: =RC[-2] -> 1193820 | F1483: =IF(RC[-4]=1,0,R[-1]C+R[-1]C[-3]) -> 111256640
A1484: =R[-300]C+1 -> 5 | B1484: =R[-300]C -> 278 | C1484: 1202295 | D1484: 3 | E1484: =RC[-2] -> 1202295 | F1484: =IF(RC[-4]=1,0,R[-1]C+R[-1]C[-3]) -> 112450460
A1485: =R[-300]C+1 -> 5 | B1485: =R[-300]C -> 279 | C1485: 1210800 | D1485: 3 | E1485: =RC[-2] -> 1210800 | F1485: =IF(RC[-4]=1,0,R[-1]C+R[-1]C[-3]) -> 113652755
A1486: =R[-300]C+1 -> 5 | B1486: =R[-300]C -> 280 | C1486: 1219335 | D1486: 3 | E1486: =RC[-2] -> 1219335 | F1486: =IF(RC[-4]=1,0,R[-1]C+R[-1]C[-3]) -> 114863555
A1487: =R[-300]C+1 -> 5 | B1487: =R[-300]C -> 281 | C1487: 1227900 | D1487: 3 | E1487: =RC[-2] -> 1227900 | F1487: =IF(RC[-4]=1,0,R[-1]C+R[-1]C[-3]) -> 116082890
A1488: =R[-300]C+1 -> 5 | B1488: =R[-300]C -> 282 | C1488: 1236495 | D1488: 3 | E1488: =RC[-2] -> 1236495 | F1488: =IF(RC[-4]=1,0,R[-1]C+R[-1]C[-3]) -> 117310790
A1489: =R[-300]C+1 -> 5 | B1489: =R[-300]C -> 283 | C1489: 1245120 | D1489: 3 | E1489: =RC[-2] -> 1245120 | F1489: =IF(RC[-4]=1,0,R[-1]C+R[-1]C[-3]) -> 118547285
A1490: =R[-300]C+1 -> 5 | B1490: =R[-300]C -> 284 | C1490: 1253775 | D1490: 3 | E1490: =RC[-2] -> 1253775 | F1490: =IF(RC[-4]=1,0,R[-1]C+R[-1]C[-3]) -> 119792405
A1491: =R[-300]C+1 -> 5 | B1491: =R[-300]C -> 285 | C1491: 1262460 | D1491: 3 | E1491: =RC[-2] -> 1262460 | F1491: =IF(RC[-4]=1,0,R[-1]C+R[-1]C[-3]) -> 121046180
A1492: =R[-300]C+1 -> 5 | B1492: =R[-300]C -> 286 | C1492: 1271175 | D1492: 3 | E1492: =RC[-2] -> 1271175 | F1492: =IF(RC[-4]=1,0,R[-1]C+R[-1]C[-3]) -> 122308640
A1493: =R[-300]C+1 -> 5 | B1493: =R[-300]C -> 287 | C1493: 1279920 | D1493: 3 | E1493: =RC[-2] -> 1279920 | F1493: =IF(RC[-4]=1,0,R[-1]C+R[-1]C[-3]) -> 123579815
A1494: =R[-300]C+1 -> 5 | B1494: =R[-300]C -> 288 | C1494: 1288695 | D1494: 3 | E1494: =RC[-2] -> 1288695 | F1494: =IF(RC[-4]=1,0,R[-1]C+R[-1]C[-3]) -> 124859735
A1495: =R[-300]C+1 -> 5 | B1495: =R[-300]C -> 289 | C1495: 1297500 | D1495: 3 | E1495: =RC[-2] -> 1297500 | F1495: =IF(RC[-4]=1,0,R[-1]C+R[-1]C[-3]) -> 126148430
A1496: =R[-300]C+1 -> 5 | B1496: =R[-300]C -> 290 | C1496: 1306335 | D1496: 3 | E1496: =RC[-2] -> 1306335 | F1496: =IF(RC[-4]=1,0,R[-1]C+R[-1]C[-3]) -> 127445930
A1497: =R[-300]C+1 -> 5 | B1497: =R[-300]C -> 291 | C1497: 1315200 | D1497: 3 | E1497: =RC[-2] -> 1315200 | F1497: =IF(RC[-4]=1,0,R[-1]C+R[-1]C[-3]) -> 128752265
A1498: =R[-300]C+1 -> 5 | B1498: =R[-300]C -> 292 | C1498: 1324095 | D1498: 3 | E1498: =RC[-2] -> 1324095 | F1498: =IF(RC[-4]=1,0,R[-1]C+R[-1]C[-3]) -> 130067465
A1499: =R[-300]C+1 -> 5 | B1499: =R[-300]C -> 293 | C1499: 1333020 | D1499: 3 | E1499: =RC[-2] -> 1333020 | F1499: =IF(RC[-4]=1,0,R[-1]C+R[-1]C[-3]) -> 131391560
A1500: =R[-300]C+1 -> 5 | B1500: =R[-300]C -> 294 | C1500: 1341975 | D1500: 3 | E1500: =RC[-2] -> 1341975 | F1500: =IF(RC[-4]=1,0,R[-1]C+R[-1]C[-3]) -> 132724580
A1501: =R[-300]C+1 -> 5 | B1501: =R[-300]C -> 295 | C1501: 1350960 | D1501: 3 | E1501: =RC[-2] -> 1350960 | F1501: =IF(RC[-4]=1,0,R[-1]C+R[-1]C[-3]) -> 134066555
A1502: =R[-300]C+1 -> 5 | B1502: =R[-300]C -> 296 | C1502: 1359975 | D1502: 3 | E1502: =RC[-2] -> 1359975 | F1502: =IF(RC[-4]=1,0,R[-1]C+R[-1]C[-3]) -> 135417515
A1503: =R[-300]C+1 -> 5 | B1503: =R[-300]C -> 297 | C1503: 1369020 | D1503: 3 | E1503: =RC[-2] -> 1369020 | F1503: =IF(RC[-4]=1,0,R[-1]C+R[-1]C[-3]) -> 136777490
A1504: =R[-300]C+1 -> 5 | B1504: =R[-300]C -> 298 | C1504: 1378095 | D1504: 3 | E1504: =RC[-2] -> 1378095 | F1504: =IF(RC[-4]=1,0,R[-1]C+R[-1]C[-3]) -> 138146510
A1505: =R[-300]C+1 -> 5 | B1505: =R[-300]C -> 299 | C1505: 1387200 | D1505: 3 | E1505: =RC[-2] -> 1387200 | F1505: =IF(RC[-4]=1,0,R[-1]C+R[-1]C[-3]) -> 139524605
A1506: =R[-300]C+1 -> 5 | B1506: =R[-300]C -> 300 | C1506: 1396335 | D1506: 3 | E1506: =RC[-2] -> 1396335 | F1506: =IF(RC[-4]=1,0,R[-1]C+R[-1]C[-3]) -> 140911805

Sheet: 3.装备精炼等级信息
A1: quality|quality | B1: refine_level|refine_level | C1: exp|exp | D1: need_level| | E1: total_exp|total_exp
A2: 不可空 | B2: 不可空 | C2: 不可空 | D2: 不可空 | E2: 不可空
A3: 数字 | B3: 数字 | C3: 数字 | D3: 数字 | E3: 数字
A6: 品质 | B6: 精炼等级 | C6: 经验 | D6: 需要战队等级 | E6: 精炼总经验
A7: 1 | B7: 0 | C7: 10 | D7: 0 | E7: =IF(RC[-3]=0,0,R[-1]C+R[-1]C[-2]) -> 0
A8: 1 | B8: 1 | C8: 30 | D8: 0 | E8: =IF(RC[-3]=0,0,R[-1]C+R[-1]C[-2]) -> 10
A9: 1 | B9: 2 | C9: 60 | D9: 0 | E9: =IF(RC[-3]=0,0,R[-1]C+R[-1]C[-2]) -> 40
A10: 1 | B10: 3 | C10: 110 | D10: 0 | E10: =IF(RC[-3]=0,0,R[-1]C+R[-1]C[-2]) -> 100
A11: 1 | B11: 4 | C11: 180 | D11: 0 | E11: =IF(RC[-3]=0,0,R[-1]C+R[-1]C[-2]) -> 210
A12: 1 | B12: 5 | C12: 280 | D12: 0 | E12: =IF(RC[-3]=0,0,R[-1]C+R[-1]C[-2]) -> 390
A13: 1 | B13: 6 | C13: 420 | D13: 0 | E13: =IF(RC[-3]=0,0,R[-1]C+R[-1]C[-2]) -> 670
A14: 1 | B14: 7 | C14: 600 | D14: 0 | E14: =IF(RC[-3]=0,0,R[-1]C+R[-1]C[-2]) -> 1090
A15: 1 | B15: 8 | C15: 820 | D15: 0 | E15: =IF(RC[-3]=0,0,R[-1]C+R[-1]C[-2]) -> 1690
A16: 1 | B16: 9 | C16: 1100 | D16: 0 | E16: =IF(RC[-3]=0,0,R[-1]C+R[-1]C[-2]) -> 2510
A17: 1 | B17: 10 | C17: 1430 | D17: 30 | E17: =IF(RC[-3]=0,0,R[-1]C+R[-1]C[-2]) -> 3610
A18: 1 | B18: 11 | C18: 1820 | D18: 30 | E18: =IF(RC[-3]=0,0,R[-1]C+R[-1]C[-2]) -> 5040
A19: 1 | B19: 12 | C19: 2280 | D19: 30 | E19: =IF(RC[-3]=0,0,R[-1]C+R[-1]C[-2]) -> 6860
A20: 1 | B20: 13 | C20: 2810 | D20: 30 | E20: =IF(RC[-3]=0,0,R[-1]C+R[-1]C[-2]) -> 9140
A21: 1 | B21: 14 | C21: 3420 | D21: 30 | E21: =IF(RC[-3]=0,0,R[-1]C+R[-1]C[-2]) -> 11950
A22: 1 | B22: 15 | C22: 4120 | D22: 35 | E22: =IF(RC[-3]=0,0,R[-1]C+R[-1]C[-2]) -> 15370
A23: 1 | B23: 16 | C23: 4910 | D23: 35 | E23: =IF(RC[-3]=0,0,R[-1]C+R[-1]C[-2]) -> 19490
A24: 1 | B24: 17 | C24: 5790 | D24: 35 | E24: =IF(RC[-3]=0,0,R[-1]C+R[-1]C[-2]) -> 24400
A25: 1 | B25: 18 | C25: 6770 | D25: 35 | E25: =IF(RC[-3]=0,0,R[-1]C+R[-1]C[-2]) -> 30190
A26: 1 | B26: 19 | C26: 7860 | D26: 35 | E26: =IF(RC[-3]=0,0,R[-1]C+R[-1]C[-2]) -> 36960
A27: 1 | B27: 20 | C27: 9060 | D27: 40 | E27: =IF(RC[-3]=0,0,R[-1]C+R[-1]C[-2]) -> 44820
A28: 1 | B28: 21 | C28: 10370 | D28: 40 | E28: =IF(RC[-3]=0,0,R[-1]C+R[-1]C[-2]) -> 53880
A29: 1 | B29: 22 | C29: 11800 | D29: 40 | E29: =IF(RC[-3]=0,0,R[-1]C+R[-1]C[-2]) -> 64250
A30: 1 | B30: 23 | C30: 13360 | D30: 40 | E30: =IF(RC[-3]=0,0,R[-1]C+R[-1]C[-2]) -> 76050
A31: 1 | B31: 24 | C31: 15050 | D31: 40 | E31: =IF(RC[-3]=0,0,R[-1]C+R[-1]C[-2]) -> 89410
A32: 1 | B32: 25 | C32: 16880 | D32: 45 | E32: =IF(RC[-3]=0,0,R[-1]C+R[-1]C[-2]) -> 104460
A33: 1 | B33: 26 | C33: 18850 | D33: 45 | E33: =IF(RC[-3]=0,0,R[-1]C+R[-1]C[-2]) -> 121340
A34: 1 | B34: 27 | C34: 20970 | D34: 45 | E34: =IF(RC[-3]=0,0,R[-1]C+R[-1]C[-2]) -> 140190
A35: 1 | B35: 28 | C35: 23250 | D35: 45 | E35: =IF(RC[-3]=0,0,R[-1]C+R[-1]C[-2]) -> 161160
A36: 1 | B36: 29 | C36: 25690 | D36: 45 | E36: =IF(RC[-3]=0,0,R[-1]C+R[-1]C[-2]) -> 184410
A37: 1 | B37: 30 | C37: 28290 | D37: 50 | E37: =IF(RC[-3]=0,0,R[-1]C+R[-1]C[-2]) -> 210100
A38: 1 | B38: 31 | C38: 31060 | D38: 50 | E38: =IF(RC[-3]=0,0,R[-1]C+R[-1]C[-2]) -> 238390
A39: 1 | B39: 32 | C39: 34010 | D39: 50 | E39: =IF(RC[-3]=0,0,R[-1]C+R[-1]C[-2]) -> 269450
A40: 1 | B40: 33 | C40: 37140 | D40: 50 | E40: =IF(RC[-3]=0,0,R[-1]C+R[-1]C[-2]) -> 303460
A41: 1 | B41: 34 | C41: 40450 | D41: 50 | E41: =IF(RC[-3]=0,0,R[-1]C+R[-1]C[-2]) -> 340600
A42: 1 | B42: 35 | C42: 43950 | D42: 55 | E42: =IF(RC[-3]=0,0,R[-1]C+R[-1]C[-2]) -> 381050
A43: 1 | B43: 36 | C43: 47650 | D43: 55 | E43: =IF(RC[-3]=0,0,R[-1]C+R[-1]C[-2]) -> 425000
A44: 1 | B44: 37 | C44: 51550 | D44: 55 | E44: =IF(RC[-3]=0,0,R[-1]C+R[-1]C[-2]) -> 472650
A45: 1 | B45: 38 | C45: 55660 | D45: 55 | E45: =IF(RC[-3]=0,0,R[-1]C+R[-1]C[-2]) -> 524200
A46: 1 | B46: 39 | C46: 59990 | D46: 55 | E46: =IF(RC[-3]=0,0,R[-1]C+R[-1]C[-2]) -> 579860
A47: 1 | B47: 40 | C47: 64530 | D47: 60 | E47: =IF(RC[-3]=0,0,R[-1]C+R[-1]C[-2]) -> 639850
A48: 1 | B48: 41 | C48: 69300 | D48: 60 | E48: =IF(RC[-3]=0,0,R[-1]C+R[-1]C[-2]) -> 704380
A49: 1 | B49: 42 | C49: 74300 | D49: 60 | E49: =IF(RC[-3]=0,0,R[-1]C+R[-1]C[-2]) -> 773680
A50: 1 | B50: 43 | C50: 79530 | D50: 60 | E50: =IF(RC[-3]=0,0,R[-1]C+R[-1]C[-2]) -> 847980
A51: 1 | B51: 44 | C51: 85000 | D51: 60 | E51: =IF(RC[-3]=0,0,R[-1]C+R[-1]C[-2]) -> 927510
A52: 1 | B52: 45 | C52: 90720 | D52: 65 | E52: =IF(RC[-3]=0,0,R[-1]C+R[-1]C[-2]) -> 1012510
A53: 1 | B53: 46 | C53: 96690 | D53: 65 | E53: =IF(RC[-3]=0,0,R[-1]C+R[-1]C[-2]) -> 1103230
A54: 1 | B54: 47 | C54: 102920 | D54: 65 | E54: =IF(RC[-3]=0,0,R[-1]C+R[-1]C[-2]) -> 1199920
A55: 1 | B55: 48 | C55: 109410 | D55: 65 | E55: =IF(RC[-3]=0,0,R[-1]C+R[-1]C[-2]) -> 1302840
A56: 1 | B56: 49 | C56: 116170 | D56: 65 | E56: =IF(RC[-3]=0,0,R[-1]C+R[-1]C[-2]) -> 1412250
A57: 1 | B57: 50 | C57: 0 | D57: 70 | E57: =IF(RC[-3]=0,0,R[-1]C+R[-1]C[-2]) -> 1528420
A58: =R[-51]C+1 -> 2 | B58: =R[-51]C -> 0 | C58: 20 | D58: =R[-51]C -> 0 | E58: =IF(RC[-3]=0,0,R[-1]C+R[-1]C[-2]) -> 0
A59: =R[-51]C+1 -> 2 | B59: =R[-51]C -> 1 | C59: 60 | D59: =R[-51]C -> 0 | E59: =IF(RC[-3]=0,0,R[-1]C+R[-1]C[-2]) -> 20
A60: =R[-51]C+1 -> 2 | B60: =R[-51]C -> 2 | C60: 120 | D60: =R[-51]C -> 0 | E60: =IF(RC[-3]=0,0,R[-1]C+R[-1]C[-2]) -> 80
A61: =R[-51]C+1 -> 2 | B61: =R[-51]C -> 3 | C61: 220 | D61: =R[-51]C -> 0 | E61: =IF(RC[-3]=0,0,R[-1]C+R[-1]C[-2]) -> 200
A62: =R[-51]C+1 -> 2 | B62: =R[-51]C -> 4 | C62: 360 | D62: =R[-51]C -> 0 | E62: =IF(RC[-3]=0,0,R[-1]C+R[-1]C[-2]) -> 420
A63: =R[-51]C+1 -> 2 | B63: =R[-51]C -> 5 | C63: 560 | D63: =R[-51]C -> 0 | E63: =IF(RC[-3]=0,0,R[-1]C+R[-1]C[-2]) -> 780
A64: =R[-51]C+1 -> 2 | B64: =R[-51]C -> 6 | C64: 840 | D64: =R[-51]C -> 0 | E64: =IF(RC[-3]=0,0,R[-1]C+R[-1]C[-2]) -> 1340
A65: =R[-51]C+1 -> 2 | B65: =R[-51]C -> 7 | C65: 1200 | D65: =R[-51]C -> 0 | E65: =IF(RC[-3]=0,0,R[-1]C+R[-1]C[-2]) -> 2180
A66: =R[-51]C+1 -> 2 | B66: =R[-51]C -> 8 | C66: 1640 | D66: =R[-51]C -> 0 | E66: =IF(RC[-3]=0,0,R[-1]C+R[-1]C[-2]) -> 3380
A67: =R[-51]C+1 -> 2 | B67: =R[-51]C -> 9 | C67: 2200 | D67: =R[-51]C -> 0 | E67: =IF(RC[-3]=0,0,R[-1]C+R[-1]C[-2]) -> 5020
A68: =R[-51]C+1 -> 2 | B68: =R[-51]C -> 10 | C68: 2860 | D68: =R[-51]C -> 30 | E68: =IF(RC[-3]=0,0,R[-1]C+R[-1]C[-2]) -> 7220
A69: =R[-51]C+1 -> 2 | B69: =R[-51]C -> 11 | C69: 3640 | D69: =R[-51]C -> 30 | E69: =IF(RC[-3]=0,0,R[-1]C+R[-1]C[-2]) -> 10080
A70: =R[-51]C+1 -> 2 | B70: =R[-51]C -> 12 | C70: 4560 | D70: =R[-51]C -> 30 | E70: =IF(RC[-3]=0,0,R[-1]C+R[-1]C[-2]) -> 13720
A71: =R[-51]C+1 -> 2 | B71: =R[-51]C -> 13 | C71: 5620 | D71: =R[-51]C -> 30 | E71: =IF(RC[-3]=0,0,R[-1]C+R[-1]C[-2]) -> 18280
A72: =R[-51]C+1 -> 2 | B72: =R[-51]C -> 14 | C72: 6840 | D72: =R[-51]C -> 30 | E72: =IF(RC[-3]=0,0,R[-1]C+R[-1]C[-2]) -> 23900
A73: =R[-51]C+1 -> 2 | B73: =R[-51]C -> 15 | C73: 8240 | D73: =R[-51]C -> 35 | E73: =IF(RC[-3]=0,0,R[-1]C+R[-1]C[-2]) -> 30740
A74: =R[-51]C+1 -> 2 | B74: =R[-51]C -> 16 | C74: 9820 | D74: =R[-51]C -> 35 | E74: =IF(RC[-3]=0,0,R[-1]C+R[-1]C[-2]) -> 38980
A75: =R[-51]C+1 -> 2 | B75: =R[-51]C -> 17 | C75: 11580 | D75: =R[-51]C -> 35 | E75: =IF(RC[-3]=0,0,R[-1]C+R[-1]C[-2]) -> 48800
A76: =R[-51]C+1 -> 2 | B76: =R[-51]C -> 18 | C76: 13540 | D76: =R[-51]C -> 35 | E76: =IF(RC[-3]=0,0,R[-1]C+R[-1]C[-2]) -> 60380
A77: =R[-51]C+1 -> 2 | B77: =R[-51]C -> 19 | C77: 15720 | D77: =R[-51]C -> 35 | E77: =IF(RC[-3]=0,0,R[-1]C+R[-1]C[-2]) -> 73920
A78: =R[-51]C+1 -> 2 | B78: =R[-51]C -> 20 | C78: 18120 | D78: =R[-51]C -> 40 | E78: =IF(RC[-3]=0,0,R[-1]C+R[-1]C[-2]) -> 89640
A79: =R[-51]C+1 -> 2 | B79: =R[-51]C -> 21 | C79: 20740 | D79: =R[-51]C -> 40 | E79: =IF(RC[-3]=0,0,R[-1]C+R[-1]C[-2]) -> 107760
A80: =R[-51]C+1 -> 2 | B80: =R[-51]C -> 22 | C80: 23600 | D80: =R[-51]C -> 40 | E80: =IF(RC[-3]=0,0,R[-1]C+R[-1]C[-2]) -> 128500
A81: =R[-51]C+1 -> 2 | B81: =R[-51]C -> 23 | C81: 26720 | D81: =R[-51]C -> 40 | E81: =IF(RC[-3]=0,0,R[-1]C+R[-1]C[-2]) -> 152100
A82: =R[-51]C+1 -> 2 | B82: =R[-51]C -> 24 | C82: 30100 | D82: =R[-51]C -> 40 | E82: =IF(RC[-3]=0,0,R[-1]C+R[-1]C[-2]) -> 178820
A83: =R[-51]C+1 -> 2 | B83: =R[-51]C -> 25 | C83: 33760 | D83: =R[-51]C -> 45 | E83: =IF(RC[-3]=0,0,R[-1]C+R[-1]C[-2]) -> 208920
A84: =R[-51]C+1 -> 2 | B84: =R[-51]C -> 26 | C84: 37700 | D84: =R[-51]C -> 45 | E84: =IF(RC[-3]=0,0,R[-1]C+R[-1]C[-2]) -> 242680
A85: =R[-51]C+1 -> 2 | B85: =R[-51]C -> 27 | C85: 41940 | D85: =R[-51]C -> 45 | E85: =IF(RC[-3]=0,0,R[-1]C+R[-1]C[-2]) -> 280380
A86: =R[-51]C+1 -> 2 | B86: =R[-51]C -> 28 | C86: 46500 | D86: =R[-51]C -> 45 | E86: =IF(RC[-3]=0,0,R[-1]C+R[-1]C[-2]) -> 322320
A87: =R[-51]C+1 -> 2 | B87: =R[-51]C -> 29 | C87: 51380 | D87: =R[-51]C -> 45 | E87: =IF(RC[-3]=0,0,R[-1]C+R[-1]C[-2]) -> 368820
A88: =R[-51]C+1 -> 2 | B88: =R[-51]C -> 30 | C88: 56580 | D88: =R[-51]C -> 50 | E88: =IF(RC[-3]=0,0,R[-1]C+R[-1]C[-2]) -> 420200
A89: =R[-51]C+1 -> 2 | B89: =R[-51]C -> 31 | C89: 62120 | D89: =R[-51]C -> 50 | E89: =IF(RC[-3]=0,0,R[-1]C+R[-1]C[-2]) -> 476780
A90: =R[-51]C+1 -> 2 | B90: =R[-51]C -> 32 | C90: 68020 | D90: =R[-51]C -> 50 | E90: =IF(RC[-3]=0,0,R[-1]C+R[-1]C[-2]) -> 538900
A91: =R[-51]C+1 -> 2 | B91: =R[-51]C -> 33 | C91: 74280 | D91: =R[-51]C -> 50 | E91: =IF(RC[-3]=0,0,R[-1]C+R[-1]C[-2]) -> 606920
A92: =R[-51]C+1 -> 2 | B92: =R[-51]C -> 34 | C92: 80900 | D92: =R[-51]C -> 50 | E92: =IF(RC[-3]=0,0,R[-1]C+R[-1]C[-2]) -> 681200
A93: =R[-51]C+1 -> 2 | B93: =R[-51]C -> 35 | C93: 87900 | D93: =R[-51]C -> 55 | E93: =IF(RC[-3]=0,0,R[-1]C+R[-1]C[-2]) -> 762100
A94: =R[-51]C+1 -> 2 | B94: =R[-51]C -> 36 | C94: 95300 | D94: =R[-51]C -> 55 | E94: =IF(RC[-3]=0,0,R[-1]C+R[-1]C[-2]) -> 850000
A95: =R[-51]C+1 -> 2 | B95: =R[-51]C -> 37 | C95: 103100 | D95: =R[-51]C -> 55 | E95: =IF(RC[-3]=0,0,R[-1]C+R[-1]C[-2]) -> 945300
A96: =R[-51]C+1 -> 2 | B96: =R[-51]C -> 38 | C96: 111320 | D96: =R[-51]C -> 55 | E96: =IF(RC[-3]=0,0,R[-1]C+R[-1]C[-2]) -> 1048400
A97: =R[-51]C+1 -> 2 | B97: =R[-51]C -> 39 | C97: 119980 | D97: =R[-51]C -> 55 | E97: =IF(RC[-3]=0,0,R[-1]C+R[-1]C[-2]) -> 1159720
A98: =R[-51]C+1 -> 2 | B98: =R[-51]C -> 40 | C98: 129060 | D98: =R[-51]C -> 60 | E98: =IF(RC[-3]=0,0,R[-1]C+R[-1]C[-2]) -> 1279700
A99: =R[-51]C+1 -> 2 | B99: =R[-51]C -> 41 | C99: 138600 | D99: =R[-51]C -> 60 | E99: =IF(RC[-3]=0,0,R[-1]C+R[-1]C[-2]) -> 1408760
A100: =R[-51]C+1 -> 2 | B100: =R[-51]C -> 42 | C100: 148600 | D100: =R[-51]C -> 60 | E100: =IF(RC[-3]=0,0,R[-1]C+R[-1]C[-2]) -> 1547360
A101: =R[-51]C+1 -> 2 | B101: =R[-51]C -> 43 | C101: 159060 | D101: =R[-51]C -> 60 | E101: =IF(RC[-3]=0,0,R[-1]C+R[-1]C[-2]) -> 1695960
A102: =R[-51]C+1 -> 2 | B102: =R[-51]C -> 44 | C102: 170000 | D102: =R[-51]C -> 60 | E102: =IF(RC[-3]=0,0,R[-1]C+R[-1]C[-2]) -> 1855020
A103: =R[-51]C+1 -> 2 | B103: =R[-51]C -> 45 | C103: 181440 | D103: =R[-51]C -> 65 | E103: =IF(RC[-3]=0,0,R[-1]C+R[-1]C[-2]) -> 2025020
A104: =R[-51]C+1 -> 2 | B104: =R[-51]C -> 46 | C104: 193380 | D104: =R[-51]C -> 65 | E104: =IF(RC[-3]=0,0,R[-1]C+R[-1]C[-2]) -> 2206460
A105: =R[-51]C+1 -> 2 | B105: =R[-51]C -> 47 | C105: 205840 | D105: =R[-51]C -> 65 | E105: =IF(RC[-3]=0,0,R[-1]C+R[-1]C[-2]) -> 2399840
A106: =R[-51]C+1 -> 2 | B106: =R[-51]C -> 48 | C106: 218820 | D106: =R[-51]C -> 65 | E106: =IF(RC[-3]=0,0,R[-1]C+R[-1]C[-2]) -> 2605680
A107: =R[-51]C+1 -> 2 | B107: =R[-51]C -> 49 | C107: 232340 | D107: =R[-51]C -> 65 | E107: =IF(RC[-3]=0,0,R[-1]C+R[-1]C[-2]) -> 2824500
A108: =R[-51]C+1 -> 2 | B108: =R[-51]C -> 50 | C108: 0 | D108: =R[-51]C -> 70 | E108: =IF(RC[-3]=0,0,R[-1]C+R[-1]C[-2]) -> 3056840
A109: =R[-51]C+1 -> 3 | B109: =R[-51]C -> 0 | C109: 25 | D109: =R[-51]C -> 0 | E109: =IF(RC[-3]=0,0,R[-1]C+R[-1]C[-2]) -> 0
A110: =R[-51]C+1 -> 3 | B110: =R[-51]C -> 1 | C110: 75 | D110: =R[-51]C -> 0 | E110: =IF(RC[-3]=0,0,R[-1]C+R[-1]C[-2]) -> 25
A111: =R[-51]C+1 -> 3 | B111: =R[-51]C -> 2 | C111: 150 | D111: =R[-51]C -> 0 | E111: =IF(RC[-3]=0,0,R[-1]C+R[-1]C[-2]) -> 100
A112: =R[-51]C+1 -> 3 | B112: =R[-51]C -> 3 | C112: 275 | D112: =R[-51]C -> 0 | E112: =IF(RC[-3]=0,0,R[-1]C+R[-1]C[-2]) -> 250
A113: =R[-51]C+1 -> 3 | B113: =R[-51]C -> 4 | C113: 450 | D113: =R[-51]C -> 0 | E113: =IF(RC[-3]=0,0,R[-1]C+R[-1]C[-2]) -> 525
A114: =R[-51]C+1 -> 3 | B114: =R[-51]C -> 5 | C114: 700 | D114: =R[-51]C -> 0 | E114: =IF(RC[-3]=0,0,R[-1]C+R[-1]C[-2]) -> 975
A115: =R[-51]C+1 -> 3 | B115: =R[-51]C -> 6 | C115: 1050 | D115: =R[-51]C -> 0 | E115: =IF(RC[-3]=0,0,R[-1]C+R[-1]C[-2]) -> 1675
A116: =R[-51]C+1 -> 3 | B116: =R[-51]C -> 7 | C116: 1500 | D116: =R[-51]C -> 0 | E116: =IF(RC[-3]=0,0,R[-1]C+R[-1]C[-2]) -> 2725
A117: =R[-51]C+1 -> 3 | B117: =R[-51]C -> 8 | C117: 2050 | D117: =R[-51]C -> 0 | E117: =IF(RC[-3]=0,0,R[-1]C+R[-1]C[-2]) -> 4225
A118: =R[-51]C+1 -> 3 | B118: =R[-51]C -> 9 | C118: 2750 | D118: =R[-51]C -> 0 | E118: =IF(RC[-3]=0,0,R[-1]C+R[-1]C[-2]) -> 6275
A119: =R[-51]C+1 -> 3 | B119: =R[-51]C -> 10 | C119: 3575 | D119: =R[-51]C -> 30 | E119: =IF(RC[-3]=0,0,R[-1]C+R[-1]C[-2]) -> 9025
A120: =R[-51]C+1 -> 3 | B120: =R[-51]C -> 11 | C120: 4550 | D120: =R[-51]C -> 30 | E120: =IF(RC[-3]=0,0,R[-1]C+R[-1]C[-2]) -> 12600
A121: =R[-51]C+1 -> 3 | B121: =R[-51]C -> 12 | C121: 5700 | D121: =R[-51]C -> 30 | E121: =IF(RC[-3]=0,0,R[-1]C+R[-1]C[-2]) -> 17150
A122: =R[-51]C+1 -> 3 | B122: =R[-51]C -> 13 | C122: 7025 | D122: =R[-51]C -> 30 | E122: =IF(RC[-3]=0,0,R[-1]C+R[-1]C[-2]) -> 22850
A123: =R[-51]C+1 -> 3 | B123: =R[-51]C -> 14 | C123: 8550 | D123: =R[-51]C -> 30 | E123: =IF(RC[-3]=0,0,R[-1]C+R[-1]C[-2]) -> 29875
A124: =R[-51]C+1 -> 3 | B124: =R[-51]C -> 15 | C124: 10300 | D124: =R[-51]C -> 35 | E124: =IF(RC[-3]=0,0,R[-1]C+R[-1]C[-2]) -> 38425
A125: =R[-51]C+1 -> 3 | B125: =R[-51]C -> 16 | C125: 12275 | D125: =R[-51]C -> 35 | E125: =IF(RC[-3]=0,0,R[-1]C+R[-1]C[-2]) -> 48725
A126: =R[-51]C+1 -> 3 | B126: =R[-51]C -> 17 | C126: 14475 | D126: =R[-51]C -> 35 | E126: =IF(RC[-3]=0,0,R[-1]C+R[-1]C[-2]) -> 61000
A127: =R[-51]C+1 -> 3 | B127: =R[-51]C -> 18 | C127: 16925 | D127: =R[-51]C -> 35 | E127: =IF(RC[-3]=0,0,R[-1]C+R[-1]C[-2]) -> 75475
A128: =R[-51]C+1 -> 3 | B128: =R[-51]C -> 19 | C128: 19650 | D128: =R[-51]C -> 35 | E128: =IF(RC[-3]=0,0,R[-1]C+R[-1]C[-2]) -> 92400
A129: =R[-51]C+1 -> 3 | B129: =R[-51]C -> 20 | C129: 22650 | D129: =R[-51]C -> 40 | E129: =IF(RC[-3]=0,0,R[-1]C+R[-1]C[-2]) -> 112050
A130: =R[-51]C+1 -> 3 | B130: =R[-51]C -> 21 | C130: 25925 | D130: =R[-51]C -> 40 | E130: =IF(RC[-3]=0,0,R[-1]C+R[-1]C[-2]) -> 134700
A131: =R[-51]C+1 -> 3 | B131: =R[-51]C -> 22 | C131: 29500 | D131: =R[-51]C -> 40 | E131: =IF(RC[-3]=0,0,R[-1]C+R[-1]C[-2]) -> 160625
A132: =R[-51]C+1 -> 3 | B132: =R[-51]C -> 23 | C132: 33400 | D132: =R[-51]C -> 40 | E132: =IF(RC[-3]=0,0,R[-1]C+R[-1]C[-2]) -> 190125
A133: =R[-51]C+1 -> 3 | B133: =R[-51]C -> 24 | C133: 37625 | D133: =R[-51]C -> 40 | E133: =IF(RC[-3]=0,0,R[-1]C+R[-1]C[-2]) -> 223525
A134: =R[-51]C+1 -> 3 | B134: =R[-51]C -> 25 | C134: 42200 | D134: =R[-51]C -> 45 | E134: =IF(RC[-3]=0,0,R[-1]C+R[-1]C[-2]) -> 261150
A135: =R[-51]C+1 -> 3 | B135: =R[-51]C -> 26 | C135: 47125 | D135: =R[-51]C -> 45 | E135: =IF(RC[-3]=0,0,R[-1]C+R[-1]C[-2]) -> 303350
A136: =R[-51]C+1 -> 3 | B136: =R[-51]C -> 27 | C136: 52425 | D136: =R[-51]C -> 45 | E136: =IF(RC[-3]=0,0,R[-1]C+R[-1]C[-2]) -> 350475
A137: =R[-51]C+1 -> 3 | B137: =R[-51]C -> 28 | C137: 58125 | D137: =R[-51]C -> 45 | E137: =IF(RC[-3]=0,0,R[-1]C+R[-1]C[-2]) -> 402900
A138: =R[-51]C+1 -> 3 | B138: =R[-51]C -> 29 | C138: 64225 | D138: =R[-51]C -> 45 | E138: =IF(RC[-3]=0,0,R[-1]C+R[-1]C[-2]) -> 461025
A139: =R[-51]C+1 -> 3 | B139: =R[-51]C -> 30 | C139: 70725 | D139: =R[-51]C -> 50 | E139: =IF(RC[-3]=0,0,R[-1]C+R[-1]C[-2]) -> 525250
A140: =R[-51]C+1 -> 3 | B140: =R[-51]C -> 31 | C140: 77650 | D140: =R[-51]C -> 50 | E140: =IF(RC[-3]=0,0,R[-1]C+R[-1]C[-2]) -> 595975
A141: =R[-51]C+1 -> 3 | B141: =R[-51]C -> 32 | C141: 85025 | D141: =R[-51]C -> 50 | E141: =IF(RC[-3]=0,0,R[-1]C+R[-1]C[-2]) -> 673625
A142: =R[-51]C+1 -> 3 | B142: =R[-51]C -> 33 | C142: 92850 | D142: =R[-51]C -> 50 | E142: =IF(RC[-3]=0,0,R[-1]C+R[-1]C[-2]) -> 758650
A143: =R[-51]C+1 -> 3 | B143: =R[-51]C -> 34 | C143: 101125 | D143: =R[-51]C -> 50 | E143: =IF(RC[-3]=0,0,R[-1]C+R[-1]C[-2]) -> 851500
A144: =R[-51]C+1 -> 3 | B144: =R[-51]C -> 35 | C144: 109875 | D144: =R[-51]C -> 55 | E144: =IF(RC[-3]=0,0,R[-1]C+R[-1]C[-2]) -> 952625
A145: =R[-51]C+1 -> 3 | B145: =R[-51]C -> 36 | C145: 119125 | D145: =R[-51]C -> 55 | E145: =IF(RC[-3]=0,0,R[-1]C+R[-1]C[-2]) -> 1062500
A146: =R[-51]C+1 -> 3 | B146: =R[-51]C -> 37 | C146: 128875 | D146: =R[-51]C -> 55 | E146: =IF(RC[-3]=0,0,R[-1]C+R[-1]C[-2]) -> 1181625
A147: =R[-51]C+1 -> 3 | B147: =R[-51]C -> 38 | C147: 139150 | D147: =R[-51]C -> 55 | E147: =IF(RC[-3]=0,0,R[-1]C+R[-1]C[-2]) -> 1310500
A148: =R[-51]C+1 -> 3 | B148: =R[-51]C -> 39 | C148: 149975 | D148: =R[-51]C -> 55 | E148: =IF(RC[-3]=0,0,R[-1]C+R[-1]C[-2]) -> 1449650
A149: =R[-51]C+1 -> 3 | B149: =R[-51]C -> 40 | C149: 161325 | D149: =R[-51]C -> 60 | E149: =IF(RC[-3]=0,0,R[-1]C+R[-1]C[-2]) -> 1599625
A150: =R[-51]C+1 -> 3 | B150: =R[-51]C -> 41 | C150: 173250 | D150: =R[-51]C -> 60 | E150: =IF(RC[-3]=0,0,R[-1]C+R[-1]C[-2]) -> 1760950
A151: =R[-51]C+1 -> 3 | B151: =R[-51]C -> 42 | C151: 185750 | D151: =R[-51]C -> 60 | E151: =IF(RC[-3]=0,0,R[-1]C+R[-1]C[-2]) -> 1934200
A152: =R[-51]C+1 -> 3 | B152: =R[-51]C -> 43 | C152: 198825 | D152: =R[-51]C -> 60 | E152: =IF(RC[-3]=0,0,R[-1]C+R[-1]C[-2]) -> 2119950
A153: =R[-51]C+1 -> 3 | B153: =R[-51]C -> 44 | C153: 212500 | D153: =R[-51]C -> 60 | E153: =IF(RC[-3]=0,0,R[-1]C+R[-1]C[-2]) -> 2318775
A154: =R[-51]C+1 -> 3 | B154: =R[-51]C -> 45 | C154: 226800 | D154: =R[-51]C -> 65 | E154: =IF(RC[-3]=0,0,R[-1]C+R[-1]C[-2]) -> 2531275
A155: =R[-51]C+1 -> 3 | B155: =R[-51]C -> 46 | C155: 241725 | D155: =R[-51]C -> 65 | E155: =IF(RC[-3]=0,0,R[-1]C+R[-1]C[-2]) -> 2758075
A156: =R[-51]C+1 -> 3 | B156: =R[-51]C -> 47 | C156: 257300 | D156: =R[-51]C -> 65 | E156: =IF(RC[-3]=0,0,R[-1]C+R[-1]C[-2]) -> 2999800
A157: =R[-51]C+1 -> 3 | B157: =R[-51]C -> 48 | C157: 273525 | D157: =R[-51]C -> 65 | E157: =IF(RC[-3]=0,0,R[-1]C+R[-1]C[-2]) -> 3257100
A158: =R[-51]C+1 -> 3 | B158: =R[-51]C -> 49 | C158: 290425 | D158: =R[-51]C -> 65 | E158: =IF(RC[-3]=0,0,R[-1]C+R[-1]C[-2]) -> 3530625
A159: =R[-51]C+1 -> 3 | B159: =R[-51]C -> 50 | C159: 0 | D159: =R[-51]C -> 70 | E159: =IF(RC[-3]=0,0,R[-1]C+R[-1]C[-2]) -> 3821050
A160: =R[-51]C+1 -> 4 | B160: =R[-51]C -> 0 | C160: 40 | D160: =R[-51]C -> 0 | E160: =IF(RC[-3]=0,0,R[-1]C+R[-1]C[-2]) -> 0
A161: =R[-51]C+1 -> 4 | B161: =R[-51]C -> 1 | C161: 120 | D161: =R[-51]C -> 0 | E161: =IF(RC[-3]=0,0,R[-1]C+R[-1]C[-2]) -> 40
A162: =R[-51]C+1 -> 4 | B162: =R[-51]C -> 2 | C162: 240 | D162: =R[-51]C -> 0 | E162: =IF(RC[-3]=0,0,R[-1]C+R[-1]C[-2]) -> 160
A163: =R[-51]C+1 -> 4 | B163: =R[-51]C -> 3 | C163: 440 | D163: =R[-51]C -> 0 | E163: =IF(RC[-3]=0,0,R[-1]C+R[-1]C[-2]) -> 400
A164: =R[-51]C+1 -> 4 | B164: =R[-51]C -> 4 | C164: 720 | D164: =R[-51]C -> 0 | E164: =IF(RC[-3]=0,0,R[-1]C+R[-1]C[-2]) -> 840
A165: =R[-51]C+1 -> 4 | B165: =R[-51]C -> 5 | C165: 1120 | D165: =R[-51]C -> 0 | E165: =IF(RC[-3]=0,0,R[-1]C+R[-1]C[-2]) -> 1560
A166: =R[-51]C+1 -> 4 | B166: =R[-51]C -> 6 | C166: 1680 | D166: =R[-51]C -> 0 | E166: =IF(RC[-3]=0,0,R[-1]C+R[-1]C[-2]) -> 2680
A167: =R[-51]C+1 -> 4 | B167: =R[-51]C -> 7 | C167: 2400 | D167: =R[-51]C -> 0 | E167: =IF(RC[-3]=0,0,R[-1]C+R[-1]C[-2]) -> 4360
A168: =R[-51]C+1 -> 4 | B168: =R[-51]C -> 8 | C168: 3280 | D168: =R[-51]C -> 0 | E168: =IF(RC[-3]=0,0,R[-1]C+R[-1]C[-2]) -> 6760
A169: =R[-51]C+1 -> 4 | B169: =R[-51]C -> 9 | C169: 4400 | D169: =R[-51]C -> 0 | E169: =IF(RC[-3]=0,0,R[-1]C+R[-1]C[-2]) -> 10040
A170: =R[-51]C+1 -> 4 | B170: =R[-51]C -> 10 | C170: 5720 | D170: =R[-51]C -> 30 | E170: =IF(RC[-3]=0,0,R[-1]C+R[-1]C[-2]) -> 14440
A171: =R[-51]C+1 -> 4 | B171: =R[-51]C -> 11 | C171: 7280 | D171: =R[-51]C -> 30 | E171: =IF(RC[-3]=0,0,R[-1]C+R[-1]C[-2]) -> 20160
A172: =R[-51]C+1 -> 4 | B172: =R[-51]C -> 12 | C172: 9120 | D172: =R[-51]C -> 30 | E172: =IF(RC[-3]=0,0,R[-1]C+R[-1]C[-2]) -> 27440
A173: =R[-51]C+1 -> 4 | B173: =R[-51]C -> 13 | C173: 11240 | D173: =R[-51]C -> 30 | E173: =IF(RC[-3]=0,0,R[-1]C+R[-1]C[-2]) -> 36560
A174: =R[-51]C+1 -> 4 | B174: =R[-51]C -> 14 | C174: 13680 | D174: =R[-51]C -> 30 | E174: =IF(RC[-3]=0,0,R[-1]C+R[-1]C[-2]) -> 47800
A175: =R[-51]C+1 -> 4 | B175: =R[-51]C -> 15 | C175: 16480 | D175: =R[-51]C -> 35 | E175: =IF(RC[-3]=0,0,R[-1]C+R[-1]C[-2]) -> 61480
A176: =R[-51]C+1 -> 4 | B176: =R[-51]C -> 16 | C176: 19640 | D176: =R[-51]C -> 35 | E176: =IF(RC[-3]=0,0,R[-1]C+R[-1]C[-2]) -> 77960
A177: =R[-51]C+1 -> 4 | B177: =R[-51]C -> 17 | C177: 23160 | D177: =R[-51]C -> 35 | E177: =IF(RC[-3]=0,0,R[-1]C+R[-1]C[-2]) -> 97600
A178: =R[-51]C+1 -> 4 | B178: =R[-51]C -> 18 | C178: 27080 | D178: =R[-51]C -> 35 | E178: =IF(RC[-3]=0,0,R[-1]C+R[-1]C[-2]) -> 120760
A179: =R[-51]C+1 -> 4 | B179: =R[-51]C -> 19 | C179: 31440 | D179: =R[-51]C -> 35 | E179: =IF(RC[-3]=0,0,R[-1]C+R[-1]C[-2]) -> 147840
A180: =R[-51]C+1 -> 4 | B180: =R[-51]C -> 20 | C180: 36240 | D180: =R[-51]C -> 40 | E180: =IF(RC[-3]=0,0,R[-1]C+R[-1]C[-2]) -> 179280
A181: =R[-51]C+1 -> 4 | B181: =R[-51]C -> 21 | C181: 41480 | D181: =R[-51]C -> 40 | E181: =IF(RC[-3]=0,0,R[-1]C+R[-1]C[-2]) -> 215520
A182: =R[-51]C+1 -> 4 | B182: =R[-51]C -> 22 | C182: 47200 | D182: =R[-51]C -> 40 | E182: =IF(RC[-3]=0,0,R[-1]C+R[-1]C[-2]) -> 257000
A183: =R[-51]C+1 -> 4 | B183: =R[-51]C -> 23 | C183: 53440 | D183: =R[-51]C -> 40 | E183: =IF(RC[-3]=0,0,R[-1]C+R[-1]C[-2]) -> 304200
A184: =R[-51]C+1 -> 4 | B184: =R[-51]C -> 24 | C184: 60200 | D184: =R[-51]C -> 40 | E184: =IF(RC[-3]=0,0,R[-1]C+R[-1]C[-2]) -> 357640
A185: =R[-51]C+1 -> 4 | B185: =R[-51]C -> 25 | C185: 67520 | D185: =R[-51]C -> 45 | E185: =IF(RC[-3]=0,0,R[-1]C+R[-1]C[-2]) -> 417840
A186: =R[-51]C+1 -> 4 | B186: =R[-51]C -> 26 | C186: 75400 | D186: =R[-51]C -> 45 | E186: =IF(RC[-3]=0,0,R[-1]C+R[-1]C[-2]) -> 485360
A187: =R[-51]C+1 -> 4 | B187: =R[-51]C -> 27 | C187: 83880 | D187: =R[-51]C -> 45 | E187: =IF(RC[-3]=0,0,R[-1]C+R[-1]C[-2]) -> 560760
A188: =R[-51]C+1 -> 4 | B188: =R[-51]C -> 28 | C188: 93000 | D188: =R[-51]C -> 45 | E188: =IF(RC[-3]=0,0,R[-1]C+R[-1]C[-2]) -> 644640
A189: =R[-51]C+1 -> 4 | B189: =R[-51]C -> 29 | C189: 102760 | D189: =R[-51]C -> 45 | E189: =IF(RC[-3]=0,0,R[-1]C+R[-1]C[-2]) -> 737640
A190: =R[-51]C+1 -> 4 | B190: =R[-51]C -> 30 | C190: 113160 | D190: =R[-51]C -> 50 | E190: =IF(RC[-3]=0,0,R[-1]C+R[-1]C[-2]) -> 840400
A191: =R[-51]C+1 -> 4 | B191: =R[-51]C -> 31 | C191: 124240 | D191: =R[-51]C -> 50 | E191: =IF(RC[-3]=0,0,R[-1]C+R[-1]C[-2]) -> 953560
A192: =R[-51]C+1 -> 4 | B192: =R[-51]C -> 32 | C192: 136040 | D192: =R[-51]C -> 50 | E192: =IF(RC[-3]=0,0,R[-1]C+R[-1]C[-2]) -> 1077800
A193: =R[-51]C+1 -> 4 | B193: =R[-51]C -> 33 | C193: 148560 | D193: =R[-51]C -> 50 | E193: =IF(RC[-3]=0,0,R[-1]C+R[-1]C[-2]) -> 1213840
A194: =R[-51]C+1 -> 4 | B194: =R[-51]C -> 34 | C194: 161800 | D194: =R[-51]C -> 50 | E194: =IF(RC[-3]=0,0,R[-1]C+R[-1]C[-2]) -> 1362400
A195: =R[-51]C+1 -> 4 | B195: =R[-51]C -> 35 | C195: 175800 | D195: =R[-51]C -> 55 | E195: =IF(RC[-3]=0,0,R[-1]C+R[-1]C[-2]) -> 1524200
A196: =R[-51]C+1 -> 4 | B196: =R[-51]C -> 36 | C196: 190600 | D196: =R[-51]C -> 55 | E196: =IF(RC[-3]=0,0,R[-1]C+R[-1]C[-2]) -> 1700000
A197: =R[-51]C+1 -> 4 | B197: =R[-51]C -> 37 | C197: 206200 | D197: =R[-51]C -> 55 | E197: =IF(RC[-3]=0,0,R[-1]C+R[-1]C[-2]) -> 1890600
A198: =R[-51]C+1 -> 4 | B198: =R[-51]C -> 38 | C198: 222640 | D198: =R[-51]C -> 55 | E198: =IF(RC[-3]=0,0,R[-1]C+R[-1]C[-2]) -> 2096800
A199: =R[-51]C+1 -> 4 | B199: =R[-51]C -> 39 | C199: 239960 | D199: =R[-51]C -> 55 | E199: =IF(RC[-3]=0,0,R[-1]C+R[-1]C[-2]) -> 2319440
A200: =R[-51]C+1 -> 4 | B200: =R[-51]C -> 40 | C200: 258120 | D200: =R[-51]C -> 60 | E200: =IF(RC[-3]=0,0,R[-1]C+R[-1]C[-2]) -> 2559400
A201: =R[-51]C+1 -> 4 | B201: =R[-51]C -> 41 | C201: 277200 | D201: =R[-51]C -> 60 | E201: =IF(RC[-3]=0,0,R[-1]C+R[-1]C[-2]) -> 2817520
A202: =R[-51]C+1 -> 4 | B202: =R[-51]C -> 42 | C202: 297200 | D202: =R[-51]C -> 60 | E202: =IF(RC[-3]=0,0,R[-1]C+R[-1]C[-2]) -> 3094720
A203: =R[-51]C+1 -> 4 | B203: =R[-51]C -> 43 | C203: 318120 | D203: =R[-51]C -> 60 | E203: =IF(RC[-3]=0,0,R[-1]C+R[-1]C[-2]) -> 3391920
A204: =R[-51]C+1 -> 4 | B204: =R[-51]C -> 44 | C204: 340000 | D204: =R[-51]C -> 60 | E204: =IF(RC[-3]=0,0,R[-1]C+R[-1]C[-2]) -> 3710040
A205: =R[-51]C+1 -> 4 | B205: =R[-51]C -> 45 | C205: 362880 | D205: =R[-51]C -> 65 | E205: =IF(RC[-3]=0,0,R[-1]C+R[-1]C[-2]) -> 4050040
A206: =R[-51]C+1 -> 4 | B206: =R[-51]C -> 46 | C206: 386760 | D206: =R[-51]C -> 65 | E206: =IF(RC[-3]=0,0,R[-1]C+R[-1]C[-2]) -> 4412920
A207: =R[-51]C+1 -> 4 | B207: =R[-51]C -> 47 | C207: 411680 | D207: =R[-51]C -> 65 | E207: =IF(RC[-3]=0,0,R[-1]C+R[-1]C[-2]) -> 4799680
A208: =R[-51]C+1 -> 4 | B208: =R[-51]C -> 48 | C208: 437640 | D208: =R[-51]C -> 65 | E208: =IF(RC[-3]=0,0,R[-1]C+R[-1]C[-2]) -> 5211360
A209: =R[-51]C+1 -> 4 | B209: =R[-51]C -> 49 | C209: 464680 | D209: =R[-51]C -> 65 | E209: =IF(RC[-3]=0,0,R[-1]C+R[-1]C[-2]) -> 5649000
A210: =R[-51]C+1 -> 4 | B210: =R[-51]C -> 50 | C210: 0 | D210: =R[-51]C -> 70 | E210: =IF(RC[-3]=0,0,R[-1]C+R[-1]C[-2]) -> 6113680
A211: =R[-51]C+1 -> 5 | B211: =R[-51]C -> 0 | C211: 60 | D211: =R[-51]C -> 0 | E211: =IF(RC[-3]=0,0,R[-1]C+R[-1]C[-2]) -> 0
A212: =R[-51]C+1 -> 5 | B212: =R[-51]C -> 1 | C212: 180 | D212: =R[-51]C -> 0 | E212: =IF(RC[-3]=0,0,R[-1]C+R[-1]C[-2]) -> 60
A213: =R[-51]C+1 -> 5 | B213: =R[-51]C -> 2 | C213: 360 | D213: =R[-51]C -> 0 | E213: =IF(RC[-3]=0,0,R[-1]C+R[-1]C[-2]) -> 240
A214: =R[-51]C+1 -> 5 | B214: =R[-51]C -> 3 | C214: 660 | D214: =R[-51]C -> 0 | E214: =IF(RC[-3]=0,0,R[-1]C+R[-1]C[-2]) -> 600
A215: =R[-51]C+1 -> 5 | B215: =R[-51]C -> 4 | C215: 1080 | D215: =R[-51]C -> 0 | E215: =IF(RC[-3]=0,0,R[-1]C+R[-1]C[-2]) -> 1260
A216: =R[-51]C+1 -> 5 | B216: =R[-51]C -> 5 | C216: 1680 | D216: =R[-51]C -> 0 | E216: =IF(RC[-3]=0,0,R[-1]C+R[-1]C[-2]) -> 2340
A217: =R[-51]C+1 -> 5 | B217: =R[-51]C -> 6 | C217: 2520 | D217: =R[-51]C -> 0 | E217: =IF(RC[-3]=0,0,R[-1]C+R[-1]C[-2]) -> 4020
A218: =R[-51]C+1 -> 5 | B218: =R[-51]C -> 7 | C218: 3600 | D218: =R[-51]C -> 0 | E218: =IF(RC[-3]=0,0,R[-1]C+R[-1]C[-2]) -> 6540
A219: =R[-51]C+1 -> 5 | B219: =R[-51]C -> 8 | C219: 4920 | D219: =R[-51]C -> 0 | E219: =IF(RC[-3]=0,0,R[-1]C+R[-1]C[-2]) -> 10140
A220: =R[-51]C+1 -> 5 | B220: =R[-51]C -> 9 | C220: 6600 | D220: =R[-51]C -> 0 | E220: =IF(RC[-3]=0,0,R[-1]C+R[-1]C[-2]) -> 15060
A221: =R[-51]C+1 -> 5 | B221: =R[-51]C -> 10 | C221: 8580 | D221: =R[-51]C -> 30 | E221: =IF(RC[-3]=0,0,R[-1]C+R[-1]C[-2]) -> 21660
A222: =R[-51]C+1 -> 5 | B222: =R[-51]C -> 11 | C222: 10920 | D222: =R[-51]C -> 30 | E222: =IF(RC[-3]=0,0,R[-1]C+R[-1]C[-2]) -> 30240
A223: =R[-51]C+1 -> 5 | B223: =R[-51]C -> 12 | C223: 13680 | D223: =R[-51]C -> 30 | E223: =IF(RC[-3]=0,0,R[-1]C+R[-1]C[-2]) -> 41160
A224: =R[-51]C+1 -> 5 | B224: =R[-51]C -> 13 | C224: 16860 | D224: =R[-51]C -> 30 | E224: =IF(RC[-3]=0,0,R[-1]C+R[-1]C[-2]) -> 54840
A225: =R[-51]C+1 -> 5 | B225: =R[-51]C -> 14 | C225: 20520 | D225: =R[-51]C -> 30 | E225: =IF(RC[-3]=0,0,R[-1]C+R[-1]C[-2]) -> 71700
A226: =R[-51]C+1 -> 5 | B226: =R[-51]C -> 15 | C226: 24720 | D226: =R[-51]C -> 35 | E226: =IF(RC[-3]=0,0,R[-1]C+R[-1]C[-2]) -> 92220
A227: =R[-51]C+1 -> 5 | B227: =R[-51]C -> 16 | C227: 29460 | D227: =R[-51]C -> 35 | E227: =IF(RC[-3]=0,0,R[-1]C+R[-1]C[-2]) -> 116940
A228: =R[-51]C+1 -> 5 | B228: =R[-51]C -> 17 | C228: 34740 | D228: =R[-51]C -> 35 | E228: =IF(RC[-3]=0,0,R[-1]C+R[-1]C[-2]) -> 146400
A229: =R[-51]C+1 -> 5 | B229: =R[-51]C -> 18 | C229: 40620 | D229: =R[-51]C -> 35 | E229: =IF(RC[-3]=0,0,R[-1]C+R[-1]C[-2]) -> 181140
A230: =R[-51]C+1 -> 5 | B230: =R[-51]C -> 19 | C230: 47160 | D230: =R[-51]C -> 35 | E230: =IF(RC[-3]=0,0,R[-1]C+R[-1]C[-2]) -> 221760
A231: =R[-51]C+1 -> 5 | B231: =R[-51]C -> 20 | C231: 54360 | D231: =R[-51]C -> 40 | E231: =IF(RC[-3]=0,0,R[-1]C+R[-1]C[-2]) -> 268920
A232: =R[-51]C+1 -> 5 | B232: =R[-51]C -> 21 | C232: 62220 | D232: =R[-51]C -> 40 | E232: =IF(RC[-3]=0,0,R[-1]C+R[-1]C[-2]) -> 323280
A233: =R[-51]C+1 -> 5 | B233: =R[-51]C -> 22 | C233: 70800 | D233: =R[-51]C -> 40 | E233: =IF(RC[-3]=0,0,R[-1]C+R[-1]C[-2]) -> 385500
A234: =R[-51]C+1 -> 5 | B234: =R[-51]C -> 23 | C234: 80160 | D234: =R[-51]C -> 40 | E234: =IF(RC[-3]=0,0,R[-1]C+R[-1]C[-2]) -> 456300
A235: =R[-51]C+1 -> 5 | B235: =R[-51]C -> 24 | C235: 90300 | D235: =R[-51]C -> 40 | E235: =IF(RC[-3]=0,0,R[-1]C+R[-1]C[-2]) -> 536460
A236: =R[-51]C+1 -> 5 | B236: =R[-51]C -> 25 | C236: 101280 | D236: =R[-51]C -> 45 | E236: =IF(RC[-3]=0,0,R[-1]C+R[-1]C[-2]) -> 626760
A237: =R[-51]C+1 -> 5 | B237: =R[-51]C -> 26 | C237: 113100 | D237: =R[-51]C -> 45 | E237: =IF(RC[-3]=0,0,R[-1]C+R[-1]C[-2]) -> 728040
A238: =R[-51]C+1 -> 5 | B238: =R[-51]C -> 27 | C238: 125820 | D238: =R[-51]C -> 45 | E238: =IF(RC[-3]=0,0,R[-1]C+R[-1]C[-2]) -> 841140
A239: =R[-51]C+1 -> 5 | B239: =R[-51]C -> 28 | C239: 139500 | D239: =R[-51]C -> 45 | E239: =IF(RC[-3]=0,0,R[-1]C+R[-1]C[-2]) -> 966960
A240: =R[-51]C+1 -> 5 | B240: =R[-51]C -> 29 | C240: 154140 | D240: =R[-51]C -> 45 | E240: =IF(RC[-3]=0,0,R[-1]C+R[-1]C[-2]) -> 1106460
A241: =R[-51]C+1 -> 5 | B241: =R[-51]C -> 30 | C241: 169740 | D241: =R[-51]C -> 50 | E241: =IF(RC[-3]=0,0,R[-1]C+R[-1]C[-2]) -> 1260600
A242: =R[-51]C+1 -> 5 | B242: =R[-51]C -> 31 | C242: 186360 | D242: =R[-51]C -> 50 | E242: =IF(RC[-3]=0,0,R[-1]C+R[-1]C[-2]) -> 1430340
A243: =R[-51]C+1 -> 5 | B243: =R[-51]C -> 32 | C243: 204060 | D243: =R[-51]C -> 50 | E243: =IF(RC[-3]=0,0,R[-1]C+R[-1]C[-2]) -> 1616700
A244: =R[-51]C+1 -> 5 | B244: =R[-51]C -> 33 | C244: 222840 | D244: =R[-51]C -> 50 | E244: =IF(RC[-3]=0,0,R[-1]C+R[-1]C[-2]) -> 1820760
A245: =R[-51]C+1 -> 5 | B245: =R[-51]C -> 34 | C245: 242700 | D245: =R[-51]C -> 50 | E245: =IF(RC[-3]=0,0,R[-1]C+R[-1]C[-2]) -> 2043600
A246: =R[-51]C+1 -> 5 | B246: =R[-51]C -> 35 | C246: 263700 | D246: =R[-51]C -> 55 | E246: =IF(RC[-3]=0,0,R[-1]C+R[-1]C[-2]) -> 2286300
A247: =R[-51]C+1 -> 5 | B247: =R[-51]C -> 36 | C247: 285900 | D247: =R[-51]C -> 55 | E247: =IF(RC[-3]=0,0,R[-1]C+R[-1]C[-2]) -> 2550000
A248: =R[-51]C+1 -> 5 | B248: =R[-51]C -> 37 | C248: 309300 | D248: =R[-51]C -> 55 | E248: =IF(RC[-3]=0,0,R[-1]C+R[-1]C[-2]) -> 2835900
A249: =R[-51]C+1 -> 5 | B249: =R[-51]C -> 38 | C249: 333960 | D249: =R[-51]C -> 55 | E249: =IF(RC[-3]=0,0,R[-1]C+R[-1]C[-2]) -> 3145200
A250: =R[-51]C+1 -> 5 | B250: =R[-51]C -> 39 | C250: 359940 | D250: =R[-51]C -> 55 | E250: =IF(RC[-3]=0,0,R[-1]C+R[-1]C[-2]) -> 3479160
A251: =R[-51]C+1 -> 5 | B251: =R[-51]C -> 40 | C251: 387180 | D251: =R[-51]C -> 60 | E251: =IF(RC[-3]=0,0,R[-1]C+R[-1]C[-2]) -> 3839100
A252: =R[-51]C+1 -> 5 | B252: =R[-51]C -> 41 | C252: 415800 | D252: =R[-51]C -> 60 | E252: =IF(RC[-3]=0,0,R[-1]C+R[-1]C[-2]) -> 4226280
A253: =R[-51]C+1 -> 5 | B253: =R[-51]C -> 42 | C253: 445800 | D253: =R[-51]C -> 60 | E253: =IF(RC[-3]=0,0,R[-1]C+R[-1]C[-2]) -> 4642080
A254: =R[-51]C+1 -> 5 | B254: =R[-51]C -> 43 | C254: 477180 | D254: =R[-51]C -> 60 | E254: =IF(RC[-3]=0,0,R[-1]C+R[-1]C[-2]) -> 5087880
A255: =R[-51]C+1 -> 5 | B255: =R[-51]C -> 44 | C255: 510000 | D255: =R[-51]C -> 60 | E255: =IF(RC[-3]=0,0,R[-1]C+R[-1]C[-2]) -> 5565060
A256: =R[-51]C+1 -> 5 | B256: =R[-51]C -> 45 | C256: 544320 | D256: =R[-51]C -> 65 | E256: =IF(RC[-3]=0,0,R[-1]C+R[-1]C[-2]) -> 6075060
A257: =R[-51]C+1 -> 5 | B257: =R[-51]C -> 46 | C257: 580140 | D257: =R[-51]C -> 65 | E257: =IF(RC[-3]=0,0,R[-1]C+R[-1]C[-2]) -> 6619380
A258: =R[-51]C+1 -> 5 | B258: =R[-51]C -> 47 | C258: 617520 | D258: =R[-51]C -> 65 | E258: =IF(RC[-3]=0,0,R[-1]C+R[-1]C[-2]) -> 7199520
A259: =R[-51]C+1 -> 5 | B259: =R[-51]C -> 48 | C259: 656460 | D259: =R[-51]C -> 65 | E259: =IF(RC[-3]=0,0,R[-1]C+R[-1]C[-2]) -> 7817040
A260: =R[-51]C+1 -> 5 | B260: =R[-51]C -> 49 | C260: 697020 | D260: =R[-51]C -> 65 | E260: =IF(RC[-3]=0,0,R[-1]C+R[-1]C[-2]) -> 8473500
A261: =R[-51]C+1 -> 5 | B261: =R[-51]C -> 50 | C261: 0 | D261: =R[-51]C -> 70 | E261: =IF(RC[-3]=0,0,R[-1]C+R[-1]C[-2]) -> 9170520

Sheet: 4.装备合成
A1: id|id | B1: item_id|item_id | C1: item_num|item_num
A2: 不可空 | B2: 不可空 | C2: 不可空
A3: 数字 | B3: 数字 | C3: 数字
A6: 装备ID | B6: 需要的碎片ID | C6: 需要的碎片数量 | E6: 品质 | F6: 碎片数 | H6: 碎片ID | I6: 碎片名字 | J6: 合成目标 | K6: 碎片描述 | L6: 售价 | N6: 装备 | O6: 碎片价值
A7: 20101 | B7: 11101 | C7: =VLOOKUP(INT(MOD(RC[-2],1000)/100),R7C5:R11C6,2,FALSE) -> 10 | E7: 1 | F7: 10 | H7: 11101 | I7: =VLOOKUP(VLOOKUP(RC[-1],IF({1,0},R6C2:R101C2,R6C1:R101C1),2,FALSE),'1.装备'!R6C1:R101C2,2,FALSE)&"残件" -> 长剑残件 | J7: =VLOOKUP(RC[-2],IF({1,0},R6C2:R101C2,R6C1:R101C1),2,FALSE) -> 20101 | K7: ="集齐"&VLOOKUP(INT(MOD(RC[-1],1000)/100),R6C5:R11C6,2,FALSE)&"个可以合成一件"&VLOOKUP(INT(MOD(RC[-1],1000)/100),R13C5:R18C6,2,FALSE)&IF(VLOOKUP(RC[-1],'1.装备'!R6C1:R101C15,12,FALSE)="","","套装")&VLOOKUP(INT(MOD(RC[-1],10000)/1000),R20C5:R24C6,2,FALSE)&"："&VLOOKUP(RC[-1],'1.装备'!R6C1:R101C2,2,FALSE)&"。" -> 集齐10个可以合成一件绿品套装武器：长剑。 | L7: =VLOOKUP(MOD(RC[-2],1000),R7C14:R30C15,2,FALSE) -> 5 | N7: 101 | O7: 5
A8: 20102 | B8: 11105 | C8: =VLOOKUP(INT(MOD(RC[-2],1000)/100),R7C5:R11C6,2,FALSE) -> 10 | E8: 2 | F8: 20 | H8: 11102 | I8: =VLOOKUP(VLOOKUP(RC[-1],IF({1,0},R6C2:R101C2,R6C1:R101C1),2,FALSE),'1.装备'!R6C1:R101C2,2,FALSE)&"残件" -> 铁甲残件 | J8: =VLOOKUP(RC[-2],IF({1,0},R6C2:R101C2,R6C1:R101C1),2,FALSE) -> 21101 | K8: ="集齐"&VLOOKUP(INT(MOD(RC[-1],1000)/100),R6C5:R11C6,2,FALSE)&"个可以合成一件"&VLOOKUP(INT(MOD(RC[-1],1000)/100),R13C5:R18C6,2,FALSE)&IF(VLOOKUP(RC[-1],'1.装备'!R6C1:R101C15,12,FALSE)="","","套装")&VLOOKUP(INT(MOD(RC[-1],10000)/1000),R20C5:R24C6,2,FALSE)&"："&VLOOKUP(RC[-1],'1.装备'!R6C1:R101C2,2,FALSE)&"。" -> 集齐10个可以合成一件绿品套装衣服：铁甲。 | L8: =VLOOKUP(MOD(RC[-2],1000),R7C14:R30C15,2,FALSE) -> 5 | N8: 102 | O8: 6
A9: 20201 | B9: 11201 | C9: =VLOOKUP(INT(MOD(RC[-2],1000)/100),R7C5:R11C6,2,FALSE) -> 20 | E9: 3 | F9: 40 | H9: 11103 | I9: =VLOOKUP(VLOOKUP(RC[-1],IF({1,0},R6C2:R101C2,R6C1:R101C1),2,FALSE),'1.装备'!R6C1:R101C2,2,FALSE)&"残件" -> 兽皮靴残件 | J9: =VLOOKUP(RC[-2],IF({1,0},R6C2:R101C2,R6C1:R101C1),2,FALSE) -> 22101 | K9: ="集齐"&VLOOKUP(INT(MOD(RC[-1],1000)/100),R6C5:R11C6,2,FALSE)&"个可以合成一件"&VLOOKUP(INT(MOD(RC[-1],1000)/100),R13C5:R18C6,2,FALSE)&IF(VLOOKUP(RC[-1],'1.装备'!R6C1:R101C15,12,FALSE)="","","套装")&VLOOKUP(INT(MOD(RC[-1],10000)/1000),R20C5:R24C6,2,FALSE)&"："&VLOOKUP(RC[-1],'1.装备'!R6C1:R101C2,2,FALSE)&"。" -> 集齐10个可以合成一件绿品套装鞋子：兽皮靴。 | L9: =VLOOKUP(MOD(RC[-2],1000),R7C14:R30C15,2,FALSE) -> 5 | N9: 201 | O9: 45
A10: 20202 | B10: 11205 | C10: =VLOOKUP(INT(MOD(RC[-2],1000)/100),R7C5:R11C6,2,FALSE) -> 20 | E10: 4 | F10: 60 | H10: 11104 | I10: =VLOOKUP(VLOOKUP(RC[-1],IF({1,0},R6C2:R101C2,R6C1:R101C1),2,FALSE),'1.装备'!R6C1:R101C2,2,FALSE)&"残件" -> 铁护腕残件 | J10: =VLOOKUP(RC[-2],IF({1,0},R6C2:R101C2,R6C1:R101C1),2,FALSE) -> 23101 | K10: ="集齐"&VLOOKUP(INT(MOD(RC[-1],1000)/100),R6C5:R11C6,2,FALSE)&"个可以合成一件"&VLOOKUP(INT(MOD(RC[-1],1000)/100),R13C5:R18C6,2,FALSE)&IF(VLOOKUP(RC[-1],'1.装备'!R6C1:R101C15,12,FALSE)="","","套装")&VLOOKUP(INT(MOD(RC[-1],10000)/1000),R20C5:R24C6,2,FALSE)&"："&VLOOKUP(RC[-1],'1.装备'!R6C1:R101C2,2,FALSE)&"。" -> 集齐10个可以合成一件绿品套装护腕：铁护腕。 | L10: =VLOOKUP(MOD(RC[-2],1000),R7C14:R30C15,2,FALSE) -> 5 | N10: 202 | O10: 60
A11: 20300 | B11: 11300 | C11: =VLOOKUP(INT(MOD(RC[-2],1000)/100),R7C5:R11C6,2,FALSE) -> 40 | E11: 5 | F11: 80 | H11: 11105 | I11: =VLOOKUP(VLOOKUP(RC[-1],IF({1,0},R6C2:R101C2,R6C1:R101C1),2,FALSE),'1.装备'!R6C1:R101C2,2,FALSE)&"残件" -> 精致战刃残件 | J11: =VLOOKUP(RC[-2],IF({1,0},R6C2:R101C2,R6C1:R101C1),2,FALSE) -> 20102 | K11: ="集齐"&VLOOKUP(INT(MOD(RC[-1],1000)/100),R6C5:R11C6,2,FALSE)&"个可以合成一件"&VLOOKUP(INT(MOD(RC[-1],1000)/100),R13C5:R18C6,2,FALSE)&IF(VLOOKUP(RC[-1],'1.装备'!R6C1:R101C15,12,FALSE)="","","套装")&VLOOKUP(INT(MOD(RC[-1],10000)/1000),R20C5:R24C6,2,FALSE)&"："&VLOOKUP(RC[-1],'1.装备'!R6C1:R101C2,2,FALSE)&"。" -> 集齐10个可以合成一件绿品套装武器：精致战刃。 | L11: =VLOOKUP(MOD(RC[-2],1000),R7C14:R30C15,2,FALSE) -> 6 | N11: 300 | O11: 150
A12: 20301 | B12: 11301 | C12: =VLOOKUP(INT(MOD(RC[-2],1000)/100),R7C5:R11C6,2,FALSE) -> 40 | H12: 11106 | I12: =VLOOKUP(VLOOKUP(RC[-1],IF({1,0},R6C2:R101C2,R6C1:R101C1),2,FALSE),'1.装备'!R6C1:R101C2,2,FALSE)&"残件" -> 精致战甲残件 | J12: =VLOOKUP(RC[-2],IF({1,0},R6C2:R101C2,R6C1:R101C1),2,FALSE) -> 21102 | K12: ="集齐"&VLOOKUP(INT(MOD(RC[-1],1000)/100),R6C5:R11C6,2,FALSE)&"个可以合成一件"&VLOOKUP(INT(MOD(RC[-1],1000)/100),R13C5:R18C6,2,FALSE)&IF(VLOOKUP(RC[-1],'1.装备'!R6C1:R101C15,12,FALSE)="","","套装")&VLOOKUP(INT(MOD(RC[-1],10000)/1000),R20C5:R24C6,2,FALSE)&"："&VLOOKUP(RC[-1],'1.装备'!R6C1:R101C2,2,FALSE)&"。" -> 集齐10个可以合成一件绿品套装衣服：精致战甲。 | L12: =VLOOKUP(MOD(RC[-2],1000),R7C14:R30C15,2,FALSE) -> 6 | N12: 301 | O12: 150
A13: 20302 | B13: 11305 | C13: =VLOOKUP(INT(MOD(RC[-2],1000)/100),R7C5:R11C6,2,FALSE) -> 40 | E13: 品质 | H13: 11107 | I13: =VLOOKUP(VLOOKUP(RC[-1],IF({1,0},R6C2:R101C2,R6C1:R101C1),2,FALSE),'1.装备'!R6C1:R101C2,2,FALSE)&"残件" -> 精致战靴残件 | J13: =VLOOKUP(RC[-2],IF({1,0},R6C2:R101C2,R6C1:R101C1),2,FALSE) -> 22102 | K13: ="集齐"&VLOOKUP(INT(MOD(RC[-1],1000)/100),R6C5:R11C6,2,FALSE)&"个可以合成一件"&VLOOKUP(INT(MOD(RC[-1],1000)/100),R13C5:R18C6,2,FALSE)&IF(VLOOKUP(RC[-1],'1.装备'!R6C1:R101C15,12,FALSE)="","","套装")&VLOOKUP(INT(MOD(RC[-1],10000)/1000),R20C5:R24C6,2,FALSE)&"："&VLOOKUP(RC[-1],'1.装备'!R6C1:R101C2,2,FALSE)&"。" -> 集齐10个可以合成一件绿品套装鞋子：精致战靴。 | L13: =VLOOKUP(MOD(RC[-2],1000),R7C14:R30C15,2,FALSE) -> 6 | N13: 302 | O13: 250
A14: 20303 | B14: 11309 | C14: =VLOOKUP(INT(MOD(RC[-2],1000)/100),R7C5:R11C6,2,FALSE) -> 40 | E14: 1 | F14: 绿品 | H14: 11108 | I14: =VLOOKUP(VLOOKUP(RC[-1],IF({1,0},R6C2:R101C2,R6C1:R101C1),2,FALSE),'1.装备'!R6C1:R101C2,2,FALSE)&"残件" -> 精致护腕残件 | J14: =VLOOKUP(RC[-2],IF({1,0},R6C2:R101C2,R6C1:R101C1),2,FALSE) -> 23102 | K14: ="集齐"&VLOOKUP(INT(MOD(RC[-1],1000)/100),R6C5:R11C6,2,FALSE)&"个可以合成一件"&VLOOKUP(INT(MOD(RC[-1],1000)/100),R13C5:R18C6,2,FALSE)&IF(VLOOKUP(RC[-1],'1.装备'!R6C1:R101C15,12,FALSE)="","","套装")&VLOOKUP(INT(MOD(RC[-1],10000)/1000),R20C5:R24C6,2,FALSE)&"："&VLOOKUP(RC[-1],'1.装备'!R6C1:R101C2,2,FALSE)&"。" -> 集齐10个可以合成一件绿品套装护腕：精致护腕。 | L14: =VLOOKUP(MOD(RC[-2],1000),R7C14:R30C15,2,FALSE) -> 6 | N14: 303 | O14: 300
A15: 20304 | B15: 11313 | C15: =VLOOKUP(INT(MOD(RC[-2],1000)/100),R7C5:R11C6,2,FALSE) -> 40 | E15: 2 | F15: 蓝品 | H15: 11201 | I15: =VLOOKUP(VLOOKUP(RC[-1],IF({1,0},R6C2:R101C2,R6C1:R101C1),2,FALSE),'1.装备'!R6C1:R101C2,2,FALSE)&"残件" -> 战争权杖残件 | J15: =VLOOKUP(RC[-2],IF({1,0},R6C2:R101C2,R6C1:R101C1),2,FALSE) -> 20201 | K15: ="集齐"&VLOOKUP(INT(MOD(RC[-1],1000)/100),R6C5:R11C6,2,FALSE)&"个可以合成一件"&VLOOKUP(INT(MOD(RC[-1],1000)/100),R13C5:R18C6,2,FALSE)&IF(VLOOKUP(RC[-1],'1.装备'!R6C1:R101C15,12,FALSE)="","","套装")&VLOOKUP(INT(MOD(RC[-1],10000)/1000),R20C5:R24C6,2,FALSE)&"："&VLOOKUP(RC[-1],'1.装备'!R6C1:R101C2,2,FALSE)&"。" -> 集齐20个可以合成一件蓝品套装武器：战争权杖。 | L15: =VLOOKUP(MOD(RC[-2],1000),R7C14:R30C15,2,FALSE) -> 45 | N15: 304 | O15: 325
A16: =R[-1]C+1 -> 20305 | B16: =R[-1]C+4 -> 11317 | C16: =R[-1]C -> 40 | E16: 3 | F16: 紫品 | H16: 11202 | I16: =VLOOKUP(VLOOKUP(RC[-1],IF({1,0},R6C2:R101C2,R6C1:R101C1),2,FALSE),'1.装备'!R6C1:R101C2,2,FALSE)&"残件" -> 坚韧盔甲残件 | J16: =VLOOKUP(RC[-2],IF({1,0},R6C2:R101C2,R6C1:R101C1),2,FALSE) -> 21201 | K16: ="集齐"&VLOOKUP(INT(MOD(RC[-1],1000)/100),R6C5:R11C6,2,FALSE)&"个可以合成一件"&VLOOKUP(INT(MOD(RC[-1],1000)/100),R13C5:R18C6,2,FALSE)&IF(VLOOKUP(RC[-1],'1.装备'!R6C1:R101C15,12,FALSE)="","","套装")&VLOOKUP(INT(MOD(RC[-1],10000)/1000),R20C5:R24C6,2,FALSE)&"："&VLOOKUP(RC[-1],'1.装备'!R6C1:R101C2,2,FALSE)&"。" -> 集齐20个可以合成一件蓝品套装衣服：坚韧盔甲。 | L16: =VLOOKUP(MOD(RC[-2],1000),R7C14:R30C15,2,FALSE) -> 45 | N16: 305 | O16: 300
A17: 20400 | B17: 11400 | C17: 60 | E17: 4 | F17: 橙品 | H17: 11203 | I17: =VLOOKUP(VLOOKUP(RC[-1],IF({1,0},R6C2:R101C2,R6C1:R101C1),2,FALSE),'1.装备'!R6C1:R101C2,2,FALSE)&"残件" -> 镶甲短靴残件 | J17: =VLOOKUP(RC[-2],IF({1,0},R6C2:R101C2,R6C1:R101C1),2,FALSE) -> 22201 | K17: ="集齐"&VLOOKUP(INT(MOD(RC[-1],1000)/100),R6C5:R11C6,2,FALSE)&"个可以合成一件"&VLOOKUP(INT(MOD(RC[-1],1000)/100),R13C5:R18C6,2,FALSE)&IF(VLOOKUP(RC[-1],'1.装备'!R6C1:R101C15,12,FALSE)="","","套装")&VLOOKUP(INT(MOD(RC[-1],10000)/1000),R20C5:R24C6,2,FALSE)&"："&VLOOKUP(RC[-1],'1.装备'!R6C1:R101C2,2,FALSE)&"。" -> 集齐20个可以合成一件蓝品套装鞋子：镶甲短靴。 | L17: =VLOOKUP(MOD(RC[-2],1000),R7C14:R30C15,2,FALSE) -> 45 | N17: 400 | O17: 375
A18: 20401 | B18: 11401 | C18: =VLOOKUP(INT(MOD(RC[-2],1000)/100),R7C5:R11C6,2,FALSE) -> 60 | E18: 5 | F18: 红品 | H18: 11204 | I18: =VLOOKUP(VLOOKUP(RC[-1],IF({1,0},R6C2:R101C2,R6C1:R101C1),2,FALSE),'1.装备'!R6C1:R101C2,2,FALSE)&"残件" -> 铜纹护腕残件 | J18: =VLOOKUP(RC[-2],IF({1,0},R6C2:R101C2,R6C1:R101C1),2,FALSE) -> 23201 | K18: ="集齐"&VLOOKUP(INT(MOD(RC[-1],1000)/100),R6C5:R11C6,2,FALSE)&"个可以合成一件"&VLOOKUP(INT(MOD(RC[-1],1000)/100),R13C5:R18C6,2,FALSE)&IF(VLOOKUP(RC[-1],'1.装备'!R6C1:R101C15,12,FALSE)="","","套装")&VLOOKUP(INT(MOD(RC[-1],10000)/1000),R20C5:R24C6,2,FALSE)&"："&VLOOKUP(RC[-1],'1.装备'!R6C1:R101C2,2,FALSE)&"。" -> 集齐20个可以合成一件蓝品套装护腕：铜纹护腕。 | L18: =VLOOKUP(MOD(RC[-2],1000),R7C14:R30C15,2,FALSE) -> 45 | N18: 401 | O18: 410
A19: 20402 | B19: 11405 | C19: =VLOOKUP(INT(MOD(RC[-2],1000)/100),R7C5:R11C6,2,FALSE) -> 60 | H19: 11205 | I19: =VLOOKUP(VLOOKUP(RC[-1],IF({1,0},R6C2:R101C2,R6C1:R101C1),2,FALSE),'1.装备'!R6C1:R101C2,2,FALSE)&"残件" -> 骑士长剑残件 | J19: =VLOOKUP(RC[-2],IF({1,0},R6C2:R101C2,R6C1:R101C1),2,FALSE) -> 20202 | K19: ="集齐"&VLOOKUP(INT(MOD(RC[-1],1000)/100),R6C5:R11C6,2,FALSE)&"个可以合成一件"&VLOOKUP(INT(MOD(RC[-1],1000)/100),R13C5:R18C6,2,FALSE)&IF(VLOOKUP(RC[-1],'1.装备'!R6C1:R101C15,12,FALSE)="","","套装")&VLOOKUP(INT(MOD(RC[-1],10000)/1000),R20C5:R24C6,2,FALSE)&"："&VLOOKUP(RC[-1],'1.装备'!R6C1:R101C2,2,FALSE)&"。" -> 集齐20个可以合成一件蓝品套装武器：骑士长剑。 | L19: =VLOOKUP(MOD(RC[-2],1000),R7C14:R30C15,2,FALSE) -> 60 | N19: 402 | O19: 550
A20: 20403 | B20: 11409 | C20: =VLOOKUP(INT(MOD(RC[-2],1000)/100),R7C5:R11C6,2,FALSE) -> 60 | E20: 类型 | H20: 11206 | I20: =VLOOKUP(VLOOKUP(RC[-1],IF({1,0},R6C2:R101C2,R6C1:R101C1),2,FALSE),'1.装备'!R6C1:R101C2,2,FALSE)&"残件" -> 骑士铁甲残件 | J20: =VLOOKUP(RC[-2],IF({1,0},R6C2:R101C2,R6C1:R101C1),2,FALSE) -> 21202 | K20: ="集齐"&VLOOKUP(INT(MOD(RC[-1],1000)/100),R6C5:R11C6,2,FALSE)&"个可以合成一件"&VLOOKUP(INT(MOD(RC[-1],1000)/100),R13C5:R18C6,2,FALSE)&IF(VLOOKUP(RC[-1],'1.装备'!R6C1:R101C15,12,FALSE)="","","套装")&VLOOKUP(INT(MOD(RC[-1],10000)/1000),R20C5:R24C6,2,FALSE)&"："&VLOOKUP(RC[-1],'1.装备'!R6C1:R101C2,2,FALSE)&"。" -> 集齐20个可以合成一件蓝品套装衣服：骑士铁甲。 | L20: =VLOOKUP(MOD(RC[-2],1000),R7C14:R30C15,2,FALSE) -> 60 | N20: 403 | O20: 700
A21: 20404 | B21: 11413 | C21: =VLOOKUP(INT(MOD(RC[-2],1000)/100),R7C5:R11C6,2,FALSE) -> 60 | E21: 0 | F21: 武器 | H21: 11207 | I21: =VLOOKUP(VLOOKUP(RC[-1],IF({1,0},R6C2:R101C2,R6C1:R101C1),2,FALSE),'1.装备'!R6C1:R101C2,2,FALSE)&"残件" -> 骑士铁靴残件 | J21: =VLOOKUP(RC[-2],IF({1,0},R6C2:R101C2,R6C1:R101C1),2,FALSE) -> 22202 | K21: ="集齐"&VLOOKUP(INT(MOD(RC[-1],1000)/100),R6C5:R11C6,2,FALSE)&"个可以合成一件"&VLOOKUP(INT(MOD(RC[-1],1000)/100),R13C5:R18C6,2,FALSE)&IF(VLOOKUP(RC[-1],'1.装备'!R6C1:R101C15,12,FALSE)="","","套装")&VLOOKUP(INT(MOD(RC[-1],10000)/1000),R20C5:R24C6,2,FALSE)&"："&VLOOKUP(RC[-1],'1.装备'!R6C1:R101C2,2,FALSE)&"。" -> 集齐20个可以合成一件蓝品套装鞋子：骑士铁靴。 | L21: =VLOOKUP(MOD(RC[-2],1000),R7C14:R30C15,2,FALSE) -> 60 | N21: 404 | O21: 725
A22: =R[-1]C+1 -> 20405 | B22: =R[-1]C+4 -> 11417 | C22: =R[-1]C -> 60 | E22: 1 | F22: 衣服 | H22: 11208 | I22: =VLOOKUP(VLOOKUP(RC[-1],IF({1,0},R6C2:R101C2,R6C1:R101C1),2,FALSE),'1.装备'!R6C1:R101C2,2,FALSE)&"残件" -> 骑士护腕残件 | J22: =VLOOKUP(RC[-2],IF({1,0},R6C2:R101C2,R6C1:R101C1),2,FALSE) -> 23202 | K22: ="集齐"&VLOOKUP(INT(MOD(RC[-1],1000)/100),R6C5:R11C6,2,FALSE)&"个可以合成一件"&VLOOKUP(INT(MOD(RC[-1],1000)/100),R13C5:R18C6,2,FALSE)&IF(VLOOKUP(RC[-1],'1.装备'!R6C1:R101C15,12,FALSE)="","","套装")&VLOOKUP(INT(MOD(RC[-1],10000)/1000),R20C5:R24C6,2,FALSE)&"："&VLOOKUP(RC[-1],'1.装备'!R6C1:R101C2,2,FALSE)&"。" -> 集齐20个可以合成一件蓝品套装护腕：骑士护腕。 | L22: =VLOOKUP(MOD(RC[-2],1000),R7C14:R30C15,2,FALSE) -> 60 | N22: 405 | O22: 700
A23: 20501 | B23: 11501 | C23: =VLOOKUP(INT(MOD(RC[-2],1000)/100),R7C5:R11C6,2,FALSE) -> 80 | E23: 2 | F23: 鞋子 | H23: 11300 | I23: =VLOOKUP(VLOOKUP(RC[-1],IF({1,0},R6C2:R101C2,R6C1:R101C1),2,FALSE),'1.装备'!R6C1:R101C2,2,FALSE)&"残件" -> 审判者残件 | J23: =VLOOKUP(RC[-2],IF({1,0},R6C2:R101C2,R6C1:R101C1),2,FALSE) -> 20300 | K23: ="集齐"&VLOOKUP(INT(MOD(RC[-1],1000)/100),R6C5:R11C6,2,FALSE)&"个可以合成一件"&VLOOKUP(INT(MOD(RC[-1],1000)/100),R13C5:R18C6,2,FALSE)&IF(VLOOKUP(RC[-1],'1.装备'!R6C1:R101C15,12,FALSE)="","","套装")&VLOOKUP(INT(MOD(RC[-1],10000)/1000),R20C5:R24C6,2,FALSE)&"："&VLOOKUP(RC[-1],'1.装备'!R6C1:R101C2,2,FALSE)&"。" -> 集齐40个可以合成一件紫品套装武器：审判者。 | L23: =VLOOKUP(MOD(RC[-2],1000),R7C14:R30C15,2,FALSE) -> 150 | N23: 406 | O23: 650
A24: 20502 | B24: 11505 | C24: =VLOOKUP(INT(MOD(RC[-2],1000)/100),R7C5:R11C6,2,FALSE) -> 80 | E24: 3 | F24: 护腕 | H24: 11301 | I24: =VLOOKUP(VLOOKUP(RC[-1],IF({1,0},R6C2:R101C2,R6C1:R101C1),2,FALSE),'1.装备'!R6C1:R101C2,2,FALSE)&"残件" -> 掠夺弯刀残件 | J24: =VLOOKUP(RC[-2],IF({1,0},R6C2:R101C2,R6C1:R101C1),2,FALSE) -> 20301 | K24: ="集齐"&VLOOKUP(INT(MOD(RC[-1],1000)/100),R6C5:R11C6,2,FALSE)&"个可以合成一件"&VLOOKUP(INT(MOD(RC[-1],1000)/100),R13C5:R18C6,2,FALSE)&IF(VLOOKUP(RC[-1],'1.装备'!R6C1:R101C15,12,FALSE)="","","套装")&VLOOKUP(INT(MOD(RC[-1],10000)/1000),R20C5:R24C6,2,FALSE)&"："&VLOOKUP(RC[-1],'1.装备'!R6C1:R101C2,2,FALSE)&"。" -> 集齐40个可以合成一件紫品套装武器：掠夺弯刀。 | L24: =VLOOKUP(MOD(RC[-2],1000),R7C14:R30C15,2,FALSE) -> 150 | N24: 407 | O24: 675
A25: 20503 | B25: 11509 | C25: =VLOOKUP(INT(MOD(RC[-2],1000)/100),R7C5:R11C6,2,FALSE) -> 80 | H25: 11302 | I25: =VLOOKUP(VLOOKUP(RC[-1],IF({1,0},R6C2:R101C2,R6C1:R101C1),2,FALSE),'1.装备'!R6C1:R101C2,2,FALSE)&"残件" -> 不动盔甲残件 | J25: =VLOOKUP(RC[-2],IF({1,0},R6C2:R101C2,R6C1:R101C1),2,FALSE) -> 21301 | K25: ="集齐"&VLOOKUP(INT(MOD(RC[-1],1000)/100),R6C5:R11C6,2,FALSE)&"个可以合成一件"&VLOOKUP(INT(MOD(RC[-1],1000)/100),R13C5:R18C6,2,FALSE)&IF(VLOOKUP(RC[-1],'1.装备'!R6C1:R101C15,12,FALSE)="","","套装")&VLOOKUP(INT(MOD(RC[-1],10000)/1000),R20C5:R24C6,2,FALSE)&"："&VLOOKUP(RC[-1],'1.装备'!R6C1:R101C2,2,FALSE)&"。" -> 集齐40个可以合成一件紫品套装衣服：不动盔甲。 | L25: =VLOOKUP(MOD(RC[-2],1000),R7C14:R30C15,2,FALSE) -> 150 | N25: 408 | O25: 650
A26: 20504 | B26: 11513 | C26: =VLOOKUP(INT(MOD(RC[-2],1000)/100),R7C5:R11C6,2,FALSE) -> 80 | H26: 11303 | I26: =VLOOKUP(VLOOKUP(RC[-1],IF({1,0},R6C2:R101C2,R6C1:R101C1),2,FALSE),'1.装备'!R6C1:R101C2,2,FALSE)&"残件" -> 疾风长靴残件 | J26: =VLOOKUP(RC[-2],IF({1,0},R6C2:R101C2,R6C1:R101C1),2,FALSE) -> 22301 | K26: ="集齐"&VLOOKUP(INT(MOD(RC[-1],1000)/100),R6C5:R11C6,2,FALSE)&"个可以合成一件"&VLOOKUP(INT(MOD(RC[-1],1000)/100),R13C5:R18C6,2,FALSE)&IF(VLOOKUP(RC[-1],'1.装备'!R6C1:R101C15,12,FALSE)="","","套装")&VLOOKUP(INT(MOD(RC[-1],10000)/1000),R20C5:R24C6,2,FALSE)&"："&VLOOKUP(RC[-1],'1.装备'!R6C1:R101C2,2,FALSE)&"。" -> 集齐40个可以合成一件紫品套装鞋子：疾风长靴。 | L26: =VLOOKUP(MOD(RC[-2],1000),R7C14:R30C15,2,FALSE) -> 150 | N26: 501 | O26: 1000
A27: 20505 | B27: 11517 | C27: =VLOOKUP(INT(MOD(RC[-2],1000)/100),R7C5:R11C6,2,FALSE) -> 80 | H27: 11304 | I27: =VLOOKUP(VLOOKUP(RC[-1],IF({1,0},R6C2:R101C2,R6C1:R101C1),2,FALSE),'1.装备'!R6C1:R101C2,2,FALSE)&"残件" -> 正义护腕残件 | J27: =VLOOKUP(RC[-2],IF({1,0},R6C2:R101C2,R6C1:R101C1),2,FALSE) -> 23301 | K27: ="集齐"&VLOOKUP(INT(MOD(RC[-1],1000)/100),R6C5:R11C6,2,FALSE)&"个可以合成一件"&VLOOKUP(INT(MOD(RC[-1],1000)/100),R13C5:R18C6,2,FALSE)&IF(VLOOKUP(RC[-1],'1.装备'!R6C1:R101C15,12,FALSE)="","","套装")&VLOOKUP(INT(MOD(RC[-1],10000)/1000),R20C5:R24C6,2,FALSE)&"："&VLOOKUP(RC[-1],'1.装备'!R6C1:R101C2,2,FALSE)&"。" -> 集齐40个可以合成一件紫品套装护腕：正义护腕。 | L27: =VLOOKUP(MOD(RC[-2],1000),R7C14:R30C15,2,FALSE) -> 150 | N27: 502 | O27: 1250
A28: 21101 | B28: 11102 | C28: =VLOOKUP(INT(MOD(RC[-2],1000)/100),R7C5:R11C6,2,FALSE) -> 10 | H28: 11305 | I28: =VLOOKUP(VLOOKUP(RC[-1],IF({1,0},R6C2:R101C2,R6C1:R101C1),2,FALSE),'1.装备'!R6C1:R101C2,2,FALSE)&"残件" -> 绞首双剑残件 | J28: =VLOOKUP(RC[-2],IF({1,0},R6C2:R101C2,R6C1:R101C1),2,FALSE) -> 20302 | K28: ="集齐"&VLOOKUP(INT(MOD(RC[-1],1000)/100),R6C5:R11C6,2,FALSE)&"个可以合成一件"&VLOOKUP(INT(MOD(RC[-1],1000)/100),R13C5:R18C6,2,FALSE)&IF(VLOOKUP(RC[-1],'1.装备'!R6C1:R101C15,12,FALSE)="","","套装")&VLOOKUP(INT(MOD(RC[-1],10000)/1000),R20C5:R24C6,2,FALSE)&"："&VLOOKUP(RC[-1],'1.装备'!R6C1:R101C2,2,FALSE)&"。" -> 集齐40个可以合成一件紫品套装武器：绞首双剑。 | L28: =VLOOKUP(MOD(RC[-2],1000),R7C14:R30C15,2,FALSE) -> 250 | N28: 503 | O28: 1000
A29: 21102 | B29: 11106 | C29: =VLOOKUP(INT(MOD(RC[-2],1000)/100),R7C5:R11C6,2,FALSE) -> 10 | H29: 11306 | I29: =VLOOKUP(VLOOKUP(RC[-1],IF({1,0},R6C2:R101C2,R6C1:R101C1),2,FALSE),'1.装备'!R6C1:R101C2,2,FALSE)&"残件" -> 光明战甲残件 | J29: =VLOOKUP(RC[-2],IF({1,0},R6C2:R101C2,R6C1:R101C1),2,FALSE) -> 21302 | K29: ="集齐"&VLOOKUP(INT(MOD(RC[-1],1000)/100),R6C5:R11C6,2,FALSE)&"个可以合成一件"&VLOOKUP(INT(MOD(RC[-1],1000)/100),R13C5:R18C6,2,FALSE)&IF(VLOOKUP(RC[-1],'1.装备'!R6C1:R101C15,12,FALSE)="","","套装")&VLOOKUP(INT(MOD(RC[-1],10000)/1000),R20C5:R24C6,2,FALSE)&"："&VLOOKUP(RC[-1],'1.装备'!R6C1:R101C2,2,FALSE)&"。" -> 集齐40个可以合成一件紫品套装衣服：光明战甲。 | L29: =VLOOKUP(MOD(RC[-2],1000),R7C14:R30C15,2,FALSE) -> 250 | N29: 504 | O29: 1125
A30: 21201 | B30: 11202 | C30: =VLOOKUP(INT(MOD(RC[-2],1000)/100),R7C5:R11C6,2,FALSE) -> 20 | H30: 11307 | I30: =VLOOKUP(VLOOKUP(RC[-1],IF({1,0},R6C2:R101C2,R6C1:R101C1),2,FALSE),'1.装备'!R6C1:R101C2,2,FALSE)&"残件" -> 黑钢长靴残件 | J30: =VLOOKUP(RC[-2],IF({1,0},R6C2:R101C2,R6C1:R101C1),2,FALSE) -> 22302 | K30: ="集齐"&VLOOKUP(INT(MOD(RC[-1],1000)/100),R6C5:R11C6,2,FALSE)&"个可以合成一件"&VLOOKUP(INT(MOD(RC[-1],1000)/100),R13C5:R18C6,2,FALSE)&IF(VLOOKUP(RC[-1],'1.装备'!R6C1:R101C15,12,FALSE)="","","套装")&VLOOKUP(INT(MOD(RC[-1],10000)/1000),R20C5:R24C6,2,FALSE)&"："&VLOOKUP(RC[-1],'1.装备'!R6C1:R101C2,2,FALSE)&"。" -> 集齐40个可以合成一件紫品套装鞋子：黑钢长靴。 | L30: =VLOOKUP(MOD(RC[-2],1000),R7C14:R30C15,2,FALSE) -> 250 | N30: 505 | O30: 1000
A31: 21202 | B31: 11206 | C31: =VLOOKUP(INT(MOD(RC[-2],1000)/100),R7C5:R11C6,2,FALSE) -> 20 | H31: 11308 | I31: =VLOOKUP(VLOOKUP(RC[-1],IF({1,0},R6C2:R101C2,R6C1:R101C1),2,FALSE),'1.装备'!R6C1:R101C2,2,FALSE)&"残件" -> 咆哮护腕残件 | J31: =VLOOKUP(RC[-2],IF({1,0},R6C2:R101C2,R6C1:R101C1),2,FALSE) -> 23302 | K31: ="集齐"&VLOOKUP(INT(MOD(RC[-1],1000)/100),R6C5:R11C6,2,FALSE)&"个可以合成一件"&VLOOKUP(INT(MOD(RC[-1],1000)/100),R13C5:R18C6,2,FALSE)&IF(VLOOKUP(RC[-1],'1.装备'!R6C1:R101C15,12,FALSE)="","","套装")&VLOOKUP(INT(MOD(RC[-1],10000)/1000),R20C5:R24C6,2,FALSE)&"："&VLOOKUP(RC[-1],'1.装备'!R6C1:R101C2,2,FALSE)&"。" -> 集齐40个可以合成一件紫品套装护腕：咆哮护腕。 | L31: =VLOOKUP(MOD(RC[-2],1000),R7C14:R30C15,2,FALSE) -> 250
A32: 21301 | B32: 11302 | C32: =VLOOKUP(INT(MOD(RC[-2],1000)/100),R7C5:R11C6,2,FALSE) -> 40 | H32: 11309 | I32: =VLOOKUP(VLOOKUP(RC[-1],IF({1,0},R6C2:R101C2,R6C1:R101C1),2,FALSE),'1.装备'!R6C1:R101C2,2,FALSE)&"残件" -> 荣耀权杖残件 | J32: =VLOOKUP(RC[-2],IF({1,0},R6C2:R101C2,R6C1:R101C1),2,FALSE) -> 20303 | K32: ="集齐"&VLOOKUP(INT(MOD(RC[-1],1000)/100),R6C5:R11C6,2,FALSE)&"个可以合成一件"&VLOOKUP(INT(MOD(RC[-1],1000)/100),R13C5:R18C6,2,FALSE)&IF(VLOOKUP(RC[-1],'1.装备'!R6C1:R101C15,12,FALSE)="","","套装")&VLOOKUP(INT(MOD(RC[-1],10000)/1000),R20C5:R24C6,2,FALSE)&"："&VLOOKUP(RC[-1],'1.装备'!R6C1:R101C2,2,FALSE)&"。" -> 集齐40个可以合成一件紫品套装武器：荣耀权杖。 | L32: =VLOOKUP(MOD(RC[-2],1000),R7C14:R30C15,2,FALSE) -> 300
A33: 21302 | B33: 11306 | C33: =VLOOKUP(INT(MOD(RC[-2],1000)/100),R7C5:R11C6,2,FALSE) -> 40 | H33: 11310 | I33: =VLOOKUP(VLOOKUP(RC[-1],IF({1,0},R6C2:R101C2,R6C1:R101C1),2,FALSE),'1.装备'!R6C1:R101C2,2,FALSE)&"残件" -> 荣耀圣甲残件 | J33: =VLOOKUP(RC[-2],IF({1,0},R6C2:R101C2,R6C1:R101C1),2,FALSE) -> 21303 | K33: ="集齐"&VLOOKUP(INT(MOD(RC[-1],1000)/100),R6C5:R11C6,2,FALSE)&"个可以合成一件"&VLOOKUP(INT(MOD(RC[-1],1000)/100),R13C5:R18C6,2,FALSE)&IF(VLOOKUP(RC[-1],'1.装备'!R6C1:R101C15,12,FALSE)="","","套装")&VLOOKUP(INT(MOD(RC[-1],10000)/1000),R20C5:R24C6,2,FALSE)&"："&VLOOKUP(RC[-1],'1.装备'!R6C1:R101C2,2,FALSE)&"。" -> 集齐40个可以合成一件紫品套装衣服：荣耀圣甲。 | L33: =VLOOKUP(MOD(RC[-2],1000),R7C14:R30C15,2,FALSE) -> 300
A34: 21303 | B34: 11310 | C34: =VLOOKUP(INT(MOD(RC[-2],1000)/100),R7C5:R11C6,2,FALSE) -> 40 | H34: 11311 | I34: =VLOOKUP(VLOOKUP(RC[-1],IF({1,0},R6C2:R101C2,R6C1:R101C1),2,FALSE),'1.装备'!R6C1:R101C2,2,FALSE)&"残件" -> 荣耀重靴残件 | J34: =VLOOKUP(RC[-2],IF({1,0},R6C2:R101C2,R6C1:R101C1),2,FALSE) -> 22303 | K34: ="集齐"&VLOOKUP(INT(MOD(RC[-1],1000)/100),R6C5:R11C6,2,FALSE)&"个可以合成一件"&VLOOKUP(INT(MOD(RC[-1],1000)/100),R13C5:R18C6,2,FALSE)&IF(VLOOKUP(RC[-1],'1.装备'!R6C1:R101C15,12,FALSE)="","","套装")&VLOOKUP(INT(MOD(RC[-1],10000)/1000),R20C5:R24C6,2,FALSE)&"："&VLOOKUP(RC[-1],'1.装备'!R6C1:R101C2,2,FALSE)&"。" -> 集齐40个可以合成一件紫品套装鞋子：荣耀重靴。 | L34: =VLOOKUP(MOD(RC[-2],1000),R7C14:R30C15,2,FALSE) -> 300
A35: 21304 | B35: 11314 | C35: =VLOOKUP(INT(MOD(RC[-2],1000)/100),R7C5:R11C6,2,FALSE) -> 40 | H35: 11312 | I35: =VLOOKUP(VLOOKUP(RC[-1],IF({1,0},R6C2:R101C2,R6C1:R101C1),2,FALSE),'1.装备'!R6C1:R101C2,2,FALSE)&"残件" -> 荣耀护腕残件 | J35: =VLOOKUP(RC[-2],IF({1,0},R6C2:R101C2,R6C1:R101C1),2,FALSE) -> 23303 | K35: ="集齐"&VLOOKUP(INT(MOD(RC[-1],1000)/100),R6C5:R11C6,2,FALSE)&"个可以合成一件"&VLOOKUP(INT(MOD(RC[-1],1000)/100),R13C5:R18C6,2,FALSE)&IF(VLOOKUP(RC[-1],'1.装备'!R6C1:R101C15,12,FALSE)="","","套装")&VLOOKUP(INT(MOD(RC[-1],10000)/1000),R20C5:R24C6,2,FALSE)&"："&VLOOKUP(RC[-1],'1.装备'!R6C1:R101C2,2,FALSE)&"。" -> 集齐40个可以合成一件紫品套装护腕：荣耀护腕。 | L35: =VLOOKUP(MOD(RC[-2],1000),R7C14:R30C15,2,FALSE) -> 300
A36: =R[-1]C+1 -> 21305 | B36: =R[-1]C+4 -> 11318 | C36: =R[-1]C -> 40 | H36: 11313 | I36: =VLOOKUP(VLOOKUP(RC[-1],IF({1,0},R6C2:R101C2,R6C1:R101C1),2,FALSE),'1.装备'!R6C1:R101C2,2,FALSE)&"残件" -> 烈焰晶杖残件 | J36: =VLOOKUP(RC[-2],IF({1,0},R6C2:R101C2,R6C1:R101C1),2,FALSE) -> 20304 | K36: ="集齐"&VLOOKUP(INT(MOD(RC[-1],1000)/100),R6C5:R11C6,2,FALSE)&"个可以合成一件"&VLOOKUP(INT(MOD(RC[-1],1000)/100),R13C5:R18C6,2,FALSE)&IF(VLOOKUP(RC[-1],'1.装备'!R6C1:R101C15,12,FALSE)="","","套装")&VLOOKUP(INT(MOD(RC[-1],10000)/1000),R20C5:R24C6,2,FALSE)&"："&VLOOKUP(RC[-1],'1.装备'!R6C1:R101C2,2,FALSE)&"。" -> 集齐40个可以合成一件紫品套装武器：烈焰晶杖。 | L36: =VLOOKUP(MOD(RC[-2],1000),R7C14:R30C15,2,FALSE) -> 325
A37: 21400 | B37: 11499 | C37: 60 | H37: 11314 | I37: =VLOOKUP(VLOOKUP(RC[-1],IF({1,0},R6C2:R101C2,R6C1:R101C1),2,FALSE),'1.装备'!R6C1:R101C2,2,FALSE)&"残件" -> 烈焰护甲残件 | J37: =VLOOKUP(RC[-2],IF({1,0},R6C2:R101C2,R6C1:R101C1),2,FALSE) -> 21304 | K37: ="集齐"&VLOOKUP(INT(MOD(RC[-1],1000)/100),R6C5:R11C6,2,FALSE)&"个可以合成一件"&VLOOKUP(INT(MOD(RC[-1],1000)/100),R13C5:R18C6,2,FALSE)&IF(VLOOKUP(RC[-1],'1.装备'!R6C1:R101C15,12,FALSE)="","","套装")&VLOOKUP(INT(MOD(RC[-1],10000)/1000),R20C5:R24C6,2,FALSE)&"："&VLOOKUP(RC[-1],'1.装备'!R6C1:R101C2,2,FALSE)&"。" -> 集齐40个可以合成一件紫品套装衣服：烈焰护甲。 | L37: =VLOOKUP(MOD(RC[-2],1000),R7C14:R30C15,2,FALSE) -> 325
A38: 21401 | B38: 11402 | C38: =VLOOKUP(INT(MOD(RC[-2],1000)/100),R7C5:R11C6,2,FALSE) -> 60 | H38: 11315 | I38: =VLOOKUP(VLOOKUP(RC[-1],IF({1,0},R6C2:R101C2,R6C1:R101C1),2,FALSE),'1.装备'!R6C1:R101C2,2,FALSE)&"残件" -> 烈焰魔靴残件 | J38: =VLOOKUP(RC[-2],IF({1,0},R6C2:R101C2,R6C1:R101C1),2,FALSE) -> 22304 | K38: ="集齐"&VLOOKUP(INT(MOD(RC[-1],1000)/100),R6C5:R11C6,2,FALSE)&"个可以合成一件"&VLOOKUP(INT(MOD(RC[-1],1000)/100),R13C5:R18C6,2,FALSE)&IF(VLOOKUP(RC[-1],'1.装备'!R6C1:R101C15,12,FALSE)="","","套装")&VLOOKUP(INT(MOD(RC[-1],10000)/1000),R20C5:R24C6,2,FALSE)&"："&VLOOKUP(RC[-1],'1.装备'!R6C1:R101C2,2,FALSE)&"。" -> 集齐40个可以合成一件紫品套装鞋子：烈焰魔靴。 | L38: =VLOOKUP(MOD(RC[-2],1000),R7C14:R30C15,2,FALSE) -> 325
A39: 21402 | B39: 11406 | C39: =VLOOKUP(INT(MOD(RC[-2],1000)/100),R7C5:R11C6,2,FALSE) -> 60 | H39: 11316 | I39: =VLOOKUP(VLOOKUP(RC[-1],IF({1,0},R6C2:R101C2,R6C1:R101C1),2,FALSE),'1.装备'!R6C1:R101C2,2,FALSE)&"残件" -> 烈焰护腕残件 | J39: =VLOOKUP(RC[-2],IF({1,0},R6C2:R101C2,R6C1:R101C1),2,FALSE) -> 23304 | K39: ="集齐"&VLOOKUP(INT(MOD(RC[-1],1000)/100),R6C5:R11C6,2,FALSE)&"个可以合成一件"&VLOOKUP(INT(MOD(RC[-1],1000)/100),R13C5:R18C6,2,FALSE)&IF(VLOOKUP(RC[-1],'1.装备'!R6C1:R101C15,12,FALSE)="","","套装")&VLOOKUP(INT(MOD(RC[-1],10000)/1000),R20C5:R24C6,2,FALSE)&"："&VLOOKUP(RC[-1],'1.装备'!R6C1:R101C2,2,FALSE)&"。" -> 集齐40个可以合成一件紫品套装护腕：烈焰护腕。 | L39: =VLOOKUP(MOD(RC[-2],1000),R7C14:R30C15,2,FALSE) -> 325
A40: 21403 | B40: 11410 | C40: =VLOOKUP(INT(MOD(RC[-2],1000)/100),R7C5:R11C6,2,FALSE) -> 60 | H40: 11317 | I40: =VLOOKUP(VLOOKUP(RC[-1],IF({1,0},R6C2:R101C2,R6C1:R101C1),2,FALSE),'1.装备'!R6C1:R101C2,2,FALSE)&"残件" -> 青鸟法球残件 | J40: =VLOOKUP(RC[-2],IF({1,0},R6C2:R101C2,R6C1:R101C1),2,FALSE) -> 20305 | K40: ="集齐"&VLOOKUP(INT(MOD(RC[-1],1000)/100),R6C5:R11C6,2,FALSE)&"个可以合成一件"&VLOOKUP(INT(MOD(RC[-1],1000)/100),R13C5:R18C6,2,FALSE)&IF(VLOOKUP(RC[-1],'1.装备'!R6C1:R101C15,12,FALSE)="","","套装")&VLOOKUP(INT(MOD(RC[-1],10000)/1000),R20C5:R24C6,2,FALSE)&"："&VLOOKUP(RC[-1],'1.装备'!R6C1:R101C2,2,FALSE)&"。" -> 集齐40个可以合成一件紫品套装武器：青鸟法球。 | L40: =VLOOKUP(MOD(RC[-2],1000),R7C14:R30C15,2,FALSE) -> 300
A41: 21404 | B41: 11414 | C41: =VLOOKUP(INT(MOD(RC[-2],1000)/100),R7C5:R11C6,2,FALSE) -> 60 | H41: 11318 | I41: =VLOOKUP(VLOOKUP(RC[-1],IF({1,0},R6C2:R101C2,R6C1:R101C1),2,FALSE),'1.装备'!R6C1:R101C2,2,FALSE)&"残件" -> 青鸟盔甲残件 | J41: =VLOOKUP(RC[-2],IF({1,0},R6C2:R101C2,R6C1:R101C1),2,FALSE) -> 21305 | K41: ="集齐"&VLOOKUP(INT(MOD(RC[-1],1000)/100),R6C5:R11C6,2,FALSE)&"个可以合成一件"&VLOOKUP(INT(MOD(RC[-1],1000)/100),R13C5:R18C6,2,FALSE)&IF(VLOOKUP(RC[-1],'1.装备'!R6C1:R101C15,12,FALSE)="","","套装")&VLOOKUP(INT(MOD(RC[-1],10000)/1000),R20C5:R24C6,2,FALSE)&"："&VLOOKUP(RC[-1],'1.装备'!R6C1:R101C2,2,FALSE)&"。" -> 集齐40个可以合成一件紫品套装衣服：青鸟盔甲。 | L41: =VLOOKUP(MOD(RC[-2],1000),R7C14:R30C15,2,FALSE) -> 300
A42: =R[-1]C+1 -> 21405 | B42: =R[-1]C+4 -> 11418 | C42: =R[-1]C -> 60 | H42: 11319 | I42: =VLOOKUP(VLOOKUP(RC[-1],IF({1,0},R6C2:R101C2,R6C1:R101C1),2,FALSE),'1.装备'!R6C1:R101C2,2,FALSE)&"残件" -> 青鸟长靴残件 | J42: =VLOOKUP(RC[-2],IF({1,0},R6C2:R101C2,R6C1:R101C1),2,FALSE) -> 22305 | K42: ="集齐"&VLOOKUP(INT(MOD(RC[-1],1000)/100),R6C5:R11C6,2,FALSE)&"个可以合成一件"&VLOOKUP(INT(MOD(RC[-1],1000)/100),R13C5:R18C6,2,FALSE)&IF(VLOOKUP(RC[-1],'1.装备'!R6C1:R101C15,12,FALSE)="","","套装")&VLOOKUP(INT(MOD(RC[-1],10000)/1000),R20C5:R24C6,2,FALSE)&"："&VLOOKUP(RC[-1],'1.装备'!R6C1:R101C2,2,FALSE)&"。" -> 集齐40个可以合成一件紫品套装鞋子：青鸟长靴。 | L42: =VLOOKUP(MOD(RC[-2],1000),R7C14:R30C15,2,FALSE) -> 300
A43: 21501 | B43: 11502 | C43: =VLOOKUP(INT(MOD(RC[-2],1000)/100),R7C5:R11C6,2,FALSE) -> 80 | H43: 11320 | I43: =VLOOKUP(VLOOKUP(RC[-1],IF({1,0},R6C2:R101C2,R6C1:R101C1),2,FALSE),'1.装备'!R6C1:R101C2,2,FALSE)&"残件" -> 青鸟护腕残件 | J43: =VLOOKUP(RC[-2],IF({1,0},R6C2:R101C2,R6C1:R101C1),2,FALSE) -> 23305 | K43: ="集齐"&VLOOKUP(INT(MOD(RC[-1],1000)/100),R6C5:R11C6,2,FALSE)&"个可以合成一件"&VLOOKUP(INT(MOD(RC[-1],1000)/100),R13C5:R18C6,2,FALSE)&IF(VLOOKUP(RC[-1],'1.装备'!R6C1:R101C15,12,FALSE)="","","套装")&VLOOKUP(INT(MOD(RC[-1],10000)/1000),R20C5:R24C6,2,FALSE)&"："&VLOOKUP(RC[-1],'1.装备'!R6C1:R101C2,2,FALSE)&"。" -> 集齐40个可以合成一件紫品套装护腕：青鸟护腕。 | L43: =VLOOKUP(MOD(RC[-2],1000),R7C14:R30C15,2,FALSE) -> 300
A44: 21502 | B44: 11506 | C44: =VLOOKUP(INT(MOD(RC[-2],1000)/100),R7C5:R11C6,2,FALSE) -> 80 | H44: 11400 | I44: =VLOOKUP(VLOOKUP(RC[-1],IF({1,0},R6C2:R101C2,R6C1:R101C1),2,FALSE),'1.装备'!R6C1:R101C2,2,FALSE)&"残件" -> 裁决者残件 | J44: =VLOOKUP(RC[-2],IF({1,0},R6C2:R101C2,R6C1:R101C1),2,FALSE) -> 20400 | K44: ="集齐"&VLOOKUP(INT(MOD(RC[-1],1000)/100),R6C5:R11C6,2,FALSE)&"个可以合成一件"&VLOOKUP(INT(MOD(RC[-1],1000)/100),R13C5:R18C6,2,FALSE)&IF(VLOOKUP(RC[-1],'1.装备'!R6C1:R101C15,12,FALSE)="","","套装")&VLOOKUP(INT(MOD(RC[-1],10000)/1000),R20C5:R24C6,2,FALSE)&"："&VLOOKUP(RC[-1],'1.装备'!R6C1:R101C2,2,FALSE)&"。" -> 集齐60个可以合成一件橙品套装武器：裁决者。 | L44: =VLOOKUP(MOD(RC[-2],1000),R7C14:R30C15,2,FALSE) -> 375
A45: 21503 | B45: 11510 | C45: =VLOOKUP(INT(MOD(RC[-2],1000)/100),R7C5:R11C6,2,FALSE) -> 80 | H45: 11401 | I45: =VLOOKUP(VLOOKUP(RC[-1],IF({1,0},R6C2:R101C2,R6C1:R101C1),2,FALSE),'1.装备'!R6C1:R101C2,2,FALSE)&"残件" -> 正义巨剑残件 | J45: =VLOOKUP(RC[-2],IF({1,0},R6C2:R101C2,R6C1:R101C1),2,FALSE) -> 20401 | K45: ="集齐"&VLOOKUP(INT(MOD(RC[-1],1000)/100),R6C5:R11C6,2,FALSE)&"个可以合成一件"&VLOOKUP(INT(MOD(RC[-1],1000)/100),R13C5:R18C6,2,FALSE)&IF(VLOOKUP(RC[-1],'1.装备'!R6C1:R101C15,12,FALSE)="","","套装")&VLOOKUP(INT(MOD(RC[-1],10000)/1000),R20C5:R24C6,2,FALSE)&"："&VLOOKUP(RC[-1],'1.装备'!R6C1:R101C2,2,FALSE)&"。" -> 集齐60个可以合成一件橙品套装武器：正义巨剑。 | L45: =VLOOKUP(MOD(RC[-2],1000),R7C14:R30C15,2,FALSE) -> 410
A46: 21504 | B46: 11514 | C46: =VLOOKUP(INT(MOD(RC[-2],1000)/100),R7C5:R11C6,2,FALSE) -> 80 | H46: 11402 | I46: =VLOOKUP(VLOOKUP(RC[-1],IF({1,0},R6C2:R101C2,R6C1:R101C1),2,FALSE),'1.装备'!R6C1:R101C2,2,FALSE)&"残件" -> 死者重甲残件 | J46: =VLOOKUP(RC[-2],IF({1,0},R6C2:R101C2,R6C1:R101C1),2,FALSE) -> 21401 | K46: ="集齐"&VLOOKUP(INT(MOD(RC[-1],1000)/100),R6C5:R11C6,2,FALSE)&"个可以合成一件"&VLOOKUP(INT(MOD(RC[-1],1000)/100),R13C5:R18C6,2,FALSE)&IF(VLOOKUP(RC[-1],'1.装备'!R6C1:R101C15,12,FALSE)="","","套装")&VLOOKUP(INT(MOD(RC[-1],10000)/1000),R20C5:R24C6,2,FALSE)&"："&VLOOKUP(RC[-1],'1.装备'!R6C1:R101C2,2,FALSE)&"。" -> 集齐60个可以合成一件橙品套装衣服：死者重甲。 | L46: =VLOOKUP(MOD(RC[-2],1000),R7C14:R30C15,2,FALSE) -> 410
A47: 21505 | B47: 11518 | C47: =VLOOKUP(INT(MOD(RC[-2],1000)/100),R7C5:R11C6,2,FALSE) -> 80 | H47: 11403 | I47: =VLOOKUP(VLOOKUP(RC[-1],IF({1,0},R6C2:R101C2,R6C1:R101C1),2,FALSE),'1.装备'!R6C1:R101C2,2,FALSE)&"残件" -> 踏浪长靴残件 | J47: =VLOOKUP(RC[-2],IF({1,0},R6C2:R101C2,R6C1:R101C1),2,FALSE) -> 22401 | K47: ="集齐"&VLOOKUP(INT(MOD(RC[-1],1000)/100),R6C5:R11C6,2,FALSE)&"个可以合成一件"&VLOOKUP(INT(MOD(RC[-1],1000)/100),R13C5:R18C6,2,FALSE)&IF(VLOOKUP(RC[-1],'1.装备'!R6C1:R101C15,12,FALSE)="","","套装")&VLOOKUP(INT(MOD(RC[-1],10000)/1000),R20C5:R24C6,2,FALSE)&"："&VLOOKUP(RC[-1],'1.装备'!R6C1:R101C2,2,FALSE)&"。" -> 集齐60个可以合成一件橙品套装鞋子：踏浪长靴。 | L47: =VLOOKUP(MOD(RC[-2],1000),R7C14:R30C15,2,FALSE) -> 410
A48: 22101 | B48: 11103 | C48: =VLOOKUP(INT(MOD(RC[-2],1000)/100),R7C5:R11C6,2,FALSE) -> 10 | H48: 11404 | I48: =VLOOKUP(VLOOKUP(RC[-1],IF({1,0},R6C2:R101C2,R6C1:R101C1),2,FALSE),'1.装备'!R6C1:R101C2,2,FALSE)&"残件" -> 超凡之手残件 | J48: =VLOOKUP(RC[-2],IF({1,0},R6C2:R101C2,R6C1:R101C1),2,FALSE) -> 23401 | K48: ="集齐"&VLOOKUP(INT(MOD(RC[-1],1000)/100),R6C5:R11C6,2,FALSE)&"个可以合成一件"&VLOOKUP(INT(MOD(RC[-1],1000)/100),R13C5:R18C6,2,FALSE)&IF(VLOOKUP(RC[-1],'1.装备'!R6C1:R101C15,12,FALSE)="","","套装")&VLOOKUP(INT(MOD(RC[-1],10000)/1000),R20C5:R24C6,2,FALSE)&"："&VLOOKUP(RC[-1],'1.装备'!R6C1:R101C2,2,FALSE)&"。" -> 集齐60个可以合成一件橙品套装护腕：超凡之手。 | L48: =VLOOKUP(MOD(RC[-2],1000),R7C14:R30C15,2,FALSE) -> 410
A49: 22102 | B49: 11107 | C49: =VLOOKUP(INT(MOD(RC[-2],1000)/100),R7C5:R11C6,2,FALSE) -> 10 | H49: 11405 | I49: =VLOOKUP(VLOOKUP(RC[-1],IF({1,0},R6C2:R101C2,R6C1:R101C1),2,FALSE),'1.装备'!R6C1:R101C2,2,FALSE)&"残件" -> 金龙权杖残件 | J49: =VLOOKUP(RC[-2],IF({1,0},R6C2:R101C2,R6C1:R101C1),2,FALSE) -> 20402 | K49: ="集齐"&VLOOKUP(INT(MOD(RC[-1],1000)/100),R6C5:R11C6,2,FALSE)&"个可以合成一件"&VLOOKUP(INT(MOD(RC[-1],1000)/100),R13C5:R18C6,2,FALSE)&IF(VLOOKUP(RC[-1],'1.装备'!R6C1:R101C15,12,FALSE)="","","套装")&VLOOKUP(INT(MOD(RC[-1],10000)/1000),R20C5:R24C6,2,FALSE)&"："&VLOOKUP(RC[-1],'1.装备'!R6C1:R101C2,2,FALSE)&"。" -> 集齐60个可以合成一件橙品套装武器：金龙权杖。 | L49: =VLOOKUP(MOD(RC[-2],1000),R7C14:R30C15,2,FALSE) -> 550
A50: 22201 | B50: 11203 | C50: =VLOOKUP(INT(MOD(RC[-2],1000)/100),R7C5:R11C6,2,FALSE) -> 20 | H50: 11406 | I50: =VLOOKUP(VLOOKUP(RC[-1],IF({1,0},R6C2:R101C2,R6C1:R101C1),2,FALSE),'1.装备'!R6C1:R101C2,2,FALSE)&"残件" -> 神圣之心残件 | J50: =VLOOKUP(RC[-2],IF({1,0},R6C2:R101C2,R6C1:R101C1),2,FALSE) -> 21402 | K50: ="集齐"&VLOOKUP(INT(MOD(RC[-1],1000)/100),R6C5:R11C6,2,FALSE)&"个可以合成一件"&VLOOKUP(INT(MOD(RC[-1],1000)/100),R13C5:R18C6,2,FALSE)&IF(VLOOKUP(RC[-1],'1.装备'!R6C1:R101C15,12,FALSE)="","","套装")&VLOOKUP(INT(MOD(RC[-1],10000)/1000),R20C5:R24C6,2,FALSE)&"："&VLOOKUP(RC[-1],'1.装备'!R6C1:R101C2,2,FALSE)&"。" -> 集齐60个可以合成一件橙品套装衣服：神圣之心。 | L50: =VLOOKUP(MOD(RC[-2],1000),R7C14:R30C15,2,FALSE) -> 550
A51: 22202 | B51: 11207 | C51: =VLOOKUP(INT(MOD(RC[-2],1000)/100),R7C5:R11C6,2,FALSE) -> 20 | H51: 11407 | I51: =VLOOKUP(VLOOKUP(RC[-1],IF({1,0},R6C2:R101C2,R6C1:R101C1),2,FALSE),'1.装备'!R6C1:R101C2,2,FALSE)&"残件" -> 雷霆战靴残件 | J51: =VLOOKUP(RC[-2],IF({1,0},R6C2:R101C2,R6C1:R101C1),2,FALSE) -> 22402 | K51: ="集齐"&VLOOKUP(INT(MOD(RC[-1],1000)/100),R6C5:R11C6,2,FALSE)&"个可以合成一件"&VLOOKUP(INT(MOD(RC[-1],1000)/100),R13C5:R18C6,2,FALSE)&IF(VLOOKUP(RC[-1],'1.装备'!R6C1:R101C15,12,FALSE)="","","套装")&VLOOKUP(INT(MOD(RC[-1],10000)/1000),R20C5:R24C6,2,FALSE)&"："&VLOOKUP(RC[-1],'1.装备'!R6C1:R101C2,2,FALSE)&"。" -> 集齐60个可以合成一件橙品套装鞋子：雷霆战靴。 | L51: =VLOOKUP(MOD(RC[-2],1000),R7C14:R30C15,2,FALSE) -> 550
A52: 22301 | B52: 11303 | C52: =VLOOKUP(INT(MOD(RC[-2],1000)/100),R7C5:R11C6,2,FALSE) -> 40 | H52: 11408 | I52: =VLOOKUP(VLOOKUP(RC[-1],IF({1,0},R6C2:R101C2,R6C1:R101C1),2,FALSE),'1.装备'!R6C1:R101C2,2,FALSE)&"残件" -> 燃烧之触残件 | J52: =VLOOKUP(RC[-2],IF({1,0},R6C2:R101C2,R6C1:R101C1),2,FALSE) -> 23402 | K52: ="集齐"&VLOOKUP(INT(MOD(RC[-1],1000)/100),R6C5:R11C6,2,FALSE)&"个可以合成一件"&VLOOKUP(INT(MOD(RC[-1],1000)/100),R13C5:R18C6,2,FALSE)&IF(VLOOKUP(RC[-1],'1.装备'!R6C1:R101C15,12,FALSE)="","","套装")&VLOOKUP(INT(MOD(RC[-1],10000)/1000),R20C5:R24C6,2,FALSE)&"："&VLOOKUP(RC[-1],'1.装备'!R6C1:R101C2,2,FALSE)&"。" -> 集齐60个可以合成一件橙品套装护腕：燃烧之触。 | L52: =VLOOKUP(MOD(RC[-2],1000),R7C14:R30C15,2,FALSE) -> 550
A53: 22302 | B53: 11307 | C53: =VLOOKUP(INT(MOD(RC[-2],1000)/100),R7C5:R11C6,2,FALSE) -> 40 | H53: 11409 | I53: =VLOOKUP(VLOOKUP(RC[-1],IF({1,0},R6C2:R101C2,R6C1:R101C1),2,FALSE),'1.装备'!R6C1:R101C2,2,FALSE)&"残件" -> 巨像重击残件 | J53: =VLOOKUP(RC[-2],IF({1,0},R6C2:R101C2,R6C1:R101C1),2,FALSE) -> 20403 | K53: ="集齐"&VLOOKUP(INT(MOD(RC[-1],1000)/100),R6C5:R11C6,2,FALSE)&"个可以合成一件"&VLOOKUP(INT(MOD(RC[-1],1000)/100),R13C5:R18C6,2,FALSE)&IF(VLOOKUP(RC[-1],'1.装备'!R6C1:R101C15,12,FALSE)="","","套装")&VLOOKUP(INT(MOD(RC[-1],10000)/1000),R20C5:R24C6,2,FALSE)&"："&VLOOKUP(RC[-1],'1.装备'!R6C1:R101C2,2,FALSE)&"。" -> 集齐60个可以合成一件橙品套装武器：巨像重击。 | L53: =VLOOKUP(MOD(RC[-2],1000),R7C14:R30C15,2,FALSE) -> 700
A54: 22303 | B54: 11311 | C54: =VLOOKUP(INT(MOD(RC[-2],1000)/100),R7C5:R11C6,2,FALSE) -> 40 | H54: 11410 | I54: =VLOOKUP(VLOOKUP(RC[-1],IF({1,0},R6C2:R101C2,R6C1:R101C1),2,FALSE),'1.装备'!R6C1:R101C2,2,FALSE)&"残件" -> 巨像恐惧残件 | J54: =VLOOKUP(RC[-2],IF({1,0},R6C2:R101C2,R6C1:R101C1),2,FALSE) -> 21403 | K54: ="集齐"&VLOOKUP(INT(MOD(RC[-1],1000)/100),R6C5:R11C6,2,FALSE)&"个可以合成一件"&VLOOKUP(INT(MOD(RC[-1],1000)/100),R13C5:R18C6,2,FALSE)&IF(VLOOKUP(RC[-1],'1.装备'!R6C1:R101C15,12,FALSE)="","","套装")&VLOOKUP(INT(MOD(RC[-1],10000)/1000),R20C5:R24C6,2,FALSE)&"："&VLOOKUP(RC[-1],'1.装备'!R6C1:R101C2,2,FALSE)&"。" -> 集齐60个可以合成一件橙品套装衣服：巨像恐惧。 | L54: =VLOOKUP(MOD(RC[-2],1000),R7C14:R30C15,2,FALSE) -> 700
A55: 22304 | B55: 11315 | C55: =VLOOKUP(INT(MOD(RC[-2],1000)/100),R7C5:R11C6,2,FALSE) -> 40 | H55: 11411 | I55: =VLOOKUP(VLOOKUP(RC[-1],IF({1,0},R6C2:R101C2,R6C1:R101C1),2,FALSE),'1.装备'!R6C1:R101C2,2,FALSE)&"残件" -> 巨像震撼残件 | J55: =VLOOKUP(RC[-2],IF({1,0},R6C2:R101C2,R6C1:R101C1),2,FALSE) -> 22403 | K55: ="集齐"&VLOOKUP(INT(MOD(RC[-1],1000)/100),R6C5:R11C6,2,FALSE)&"个可以合成一件"&VLOOKUP(INT(MOD(RC[-1],1000)/100),R13C5:R18C6,2,FALSE)&IF(VLOOKUP(RC[-1],'1.装备'!R6C1:R101C15,12,FALSE)="","","套装")&VLOOKUP(INT(MOD(RC[-1],10000)/1000),R20C5:R24C6,2,FALSE)&"："&VLOOKUP(RC[-1],'1.装备'!R6C1:R101C2,2,FALSE)&"。" -> 集齐60个可以合成一件橙品套装鞋子：巨像震撼。 | L55: =VLOOKUP(MOD(RC[-2],1000),R7C14:R30C15,2,FALSE) -> 700
A56: =R[-1]C+1 -> 22305 | B56: =R[-1]C+4 -> 11319 | C56: =R[-1]C -> 40 | H56: 11412 | I56: =VLOOKUP(VLOOKUP(RC[-1],IF({1,0},R6C2:R101C2,R6C1:R101C1),2,FALSE),'1.装备'!R6C1:R101C2,2,FALSE)&"残件" -> 巨像崩山残件 | J56: =VLOOKUP(RC[-2],IF({1,0},R6C2:R101C2,R6C1:R101C1),2,FALSE) -> 23403 | K56: ="集齐"&VLOOKUP(INT(MOD(RC[-1],1000)/100),R6C5:R11C6,2,FALSE)&"个可以合成一件"&VLOOKUP(INT(MOD(RC[-1],1000)/100),R13C5:R18C6,2,FALSE)&IF(VLOOKUP(RC[-1],'1.装备'!R6C1:R101C15,12,FALSE)="","","套装")&VLOOKUP(INT(MOD(RC[-1],10000)/1000),R20C5:R24C6,2,FALSE)&"："&VLOOKUP(RC[-1],'1.装备'!R6C1:R101C2,2,FALSE)&"。" -> 集齐60个可以合成一件橙品套装护腕：巨像崩山。 | L56: =VLOOKUP(MOD(RC[-2],1000),R7C14:R30C15,2,FALSE) -> 700
A57: 22401 | B57: 11403 | C57: =VLOOKUP(INT(MOD(RC[-2],1000)/100),R7C5:R11C6,2,FALSE) -> 60 | H57: 11413 | I57: =VLOOKUP(VLOOKUP(RC[-1],IF({1,0},R6C2:R101C2,R6C1:R101C1),2,FALSE),'1.装备'!R6C1:R101C2,2,FALSE)&"残件" -> 幽冥收割残件 | J57: =VLOOKUP(RC[-2],IF({1,0},R6C2:R101C2,R6C1:R101C1),2,FALSE) -> 20404 | K57: ="集齐"&VLOOKUP(INT(MOD(RC[-1],1000)/100),R6C5:R11C6,2,FALSE)&"个可以合成一件"&VLOOKUP(INT(MOD(RC[-1],1000)/100),R13C5:R18C6,2,FALSE)&IF(VLOOKUP(RC[-1],'1.装备'!R6C1:R101C15,12,FALSE)="","","套装")&VLOOKUP(INT(MOD(RC[-1],10000)/1000),R20C5:R24C6,2,FALSE)&"："&VLOOKUP(RC[-1],'1.装备'!R6C1:R101C2,2,FALSE)&"。" -> 集齐60个可以合成一件橙品套装武器：幽冥收割。 | L57: =VLOOKUP(MOD(RC[-2],1000),R7C14:R30C15,2,FALSE) -> 725
A58: 22402 | B58: 11407 | C58: =VLOOKUP(INT(MOD(RC[-2],1000)/100),R7C5:R11C6,2,FALSE) -> 60 | H58: 11414 | I58: =VLOOKUP(VLOOKUP(RC[-1],IF({1,0},R6C2:R101C2,R6C1:R101C1),2,FALSE),'1.装备'!R6C1:R101C2,2,FALSE)&"残件" -> 幽冥屠戮残件 | J58: =VLOOKUP(RC[-2],IF({1,0},R6C2:R101C2,R6C1:R101C1),2,FALSE) -> 21404 | K58: ="集齐"&VLOOKUP(INT(MOD(RC[-1],1000)/100),R6C5:R11C6,2,FALSE)&"个可以合成一件"&VLOOKUP(INT(MOD(RC[-1],1000)/100),R13C5:R18C6,2,FALSE)&IF(VLOOKUP(RC[-1],'1.装备'!R6C1:R101C15,12,FALSE)="","","套装")&VLOOKUP(INT(MOD(RC[-1],10000)/1000),R20C5:R24C6,2,FALSE)&"："&VLOOKUP(RC[-1],'1.装备'!R6C1:R101C2,2,FALSE)&"。" -> 集齐60个可以合成一件橙品套装衣服：幽冥屠戮。 | L58: =VLOOKUP(MOD(RC[-2],1000),R7C14:R30C15,2,FALSE) -> 725
A59: 22403 | B59: 11411 | C59: =VLOOKUP(INT(MOD(RC[-2],1000)/100),R7C5:R11C6,2,FALSE) -> 60 | H59: 11415 | I59: =VLOOKUP(VLOOKUP(RC[-1],IF({1,0},R6C2:R101C2,R6C1:R101C1),2,FALSE),'1.装备'!R6C1:R101C2,2,FALSE)&"残件" -> 幽冥掠夺残件 | J59: =VLOOKUP(RC[-2],IF({1,0},R6C2:R101C2,R6C1:R101C1),2,FALSE) -> 22404 | K59: ="集齐"&VLOOKUP(INT(MOD(RC[-1],1000)/100),R6C5:R11C6,2,FALSE)&"个可以合成一件"&VLOOKUP(INT(MOD(RC[-1],1000)/100),R13C5:R18C6,2,FALSE)&IF(VLOOKUP(RC[-1],'1.装备'!R6C1:R101C15,12,FALSE)="","","套装")&VLOOKUP(INT(MOD(RC[-1],10000)/1000),R20C5:R24C6,2,FALSE)&"："&VLOOKUP(RC[-1],'1.装备'!R6C1:R101C2,2,FALSE)&"。" -> 集齐60个可以合成一件橙品套装鞋子：幽冥掠夺。 | L59: =VLOOKUP(MOD(RC[-2],1000),R7C14:R30C15,2,FALSE) -> 725
A60: 22404 | B60: 11415 | C60: =VLOOKUP(INT(MOD(RC[-2],1000)/100),R7C5:R11C6,2,FALSE) -> 60 | H60: 11416 | I60: =VLOOKUP(VLOOKUP(RC[-1],IF({1,0},R6C2:R101C2,R6C1:R101C1),2,FALSE),'1.装备'!R6C1:R101C2,2,FALSE)&"残件" -> 幽冥掌控残件 | J60: =VLOOKUP(RC[-2],IF({1,0},R6C2:R101C2,R6C1:R101C1),2,FALSE) -> 23404 | K60: ="集齐"&VLOOKUP(INT(MOD(RC[-1],1000)/100),R6C5:R11C6,2,FALSE)&"个可以合成一件"&VLOOKUP(INT(MOD(RC[-1],1000)/100),R13C5:R18C6,2,FALSE)&IF(VLOOKUP(RC[-1],'1.装备'!R6C1:R101C15,12,FALSE)="","","套装")&VLOOKUP(INT(MOD(RC[-1],10000)/1000),R20C5:R24C6,2,FALSE)&"："&VLOOKUP(RC[-1],'1.装备'!R6C1:R101C2,2,FALSE)&"。" -> 集齐60个可以合成一件橙品套装护腕：幽冥掌控。 | L60: =VLOOKUP(MOD(RC[-2],1000),R7C14:R30C15,2,FALSE) -> 725
A61: =R[-1]C+1 -> 22405 | B61: =R[-1]C+4 -> 11419 | C61: =R[-1]C -> 60 | H61: 11417 | I61: =VLOOKUP(VLOOKUP(RC[-1],IF({1,0},R6C2:R101C2,R6C1:R101C1),2,FALSE),'1.装备'!R6C1:R101C2,2,FALSE)&"残件" -> 大地祝福残件 | J61: =VLOOKUP(RC[-2],IF({1,0},R6C2:R101C2,R6C1:R101C1),2,FALSE) -> 20405 | K61: ="集齐"&VLOOKUP(INT(MOD(RC[-1],1000)/100),R6C5:R11C6,2,FALSE)&"个可以合成一件"&VLOOKUP(INT(MOD(RC[-1],1000)/100),R13C5:R18C6,2,FALSE)&IF(VLOOKUP(RC[-1],'1.装备'!R6C1:R101C15,12,FALSE)="","","套装")&VLOOKUP(INT(MOD(RC[-1],10000)/1000),R20C5:R24C6,2,FALSE)&"："&VLOOKUP(RC[-1],'1.装备'!R6C1:R101C2,2,FALSE)&"。" -> 集齐60个可以合成一件橙品套装武器：大地祝福。 | L61: =VLOOKUP(MOD(RC[-2],1000),R7C14:R30C15,2,FALSE) -> 700
A62: 22501 | B62: 11503 | C62: =VLOOKUP(INT(MOD(RC[-2],1000)/100),R7C5:R11C6,2,FALSE) -> 80 | H62: 11418 | I62: =VLOOKUP(VLOOKUP(RC[-1],IF({1,0},R6C2:R101C2,R6C1:R101C1),2,FALSE),'1.装备'!R6C1:R101C2,2,FALSE)&"残件" -> 大地之拥残件 | J62: =VLOOKUP(RC[-2],IF({1,0},R6C2:R101C2,R6C1:R101C1),2,FALSE) -> 21405 | K62: ="集齐"&VLOOKUP(INT(MOD(RC[-1],1000)/100),R6C5:R11C6,2,FALSE)&"个可以合成一件"&VLOOKUP(INT(MOD(RC[-1],1000)/100),R13C5:R18C6,2,FALSE)&IF(VLOOKUP(RC[-1],'1.装备'!R6C1:R101C15,12,FALSE)="","","套装")&VLOOKUP(INT(MOD(RC[-1],10000)/1000),R20C5:R24C6,2,FALSE)&"："&VLOOKUP(RC[-1],'1.装备'!R6C1:R101C2,2,FALSE)&"。" -> 集齐60个可以合成一件橙品套装衣服：大地之拥。 | L62: =VLOOKUP(MOD(RC[-2],1000),R7C14:R30C15,2,FALSE) -> 700
A63: 22502 | B63: 11507 | C63: =VLOOKUP(INT(MOD(RC[-2],1000)/100),R7C5:R11C6,2,FALSE) -> 80 | H63: 11419 | I63: =VLOOKUP(VLOOKUP(RC[-1],IF({1,0},R6C2:R101C2,R6C1:R101C1),2,FALSE),'1.装备'!R6C1:R101C2,2,FALSE)&"残件" -> 大地行者残件 | J63: =VLOOKUP(RC[-2],IF({1,0},R6C2:R101C2,R6C1:R101C1),2,FALSE) -> 22405 | K63: ="集齐"&VLOOKUP(INT(MOD(RC[-1],1000)/100),R6C5:R11C6,2,FALSE)&"个可以合成一件"&VLOOKUP(INT(MOD(RC[-1],1000)/100),R13C5:R18C6,2,FALSE)&IF(VLOOKUP(RC[-1],'1.装备'!R6C1:R101C15,12,FALSE)="","","套装")&VLOOKUP(INT(MOD(RC[-1],10000)/1000),R20C5:R24C6,2,FALSE)&"："&VLOOKUP(RC[-1],'1.装备'!R6C1:R101C2,2,FALSE)&"。" -> 集齐60个可以合成一件橙品套装鞋子：大地行者。 | L63: =VLOOKUP(MOD(RC[-2],1000),R7C14:R30C15,2,FALSE) -> 700
A64: 22503 | B64: 11511 | C64: =VLOOKUP(INT(MOD(RC[-2],1000)/100),R7C5:R11C6,2,FALSE) -> 80 | H64: 11420 | I64: =VLOOKUP(VLOOKUP(RC[-1],IF({1,0},R6C2:R101C2,R6C1:R101C1),2,FALSE),'1.装备'!R6C1:R101C2,2,FALSE)&"残件" -> 大地庇护残件 | J64: =VLOOKUP(RC[-2],IF({1,0},R6C2:R101C2,R6C1:R101C1),2,FALSE) -> 23405 | K64: ="集齐"&VLOOKUP(INT(MOD(RC[-1],1000)/100),R6C5:R11C6,2,FALSE)&"个可以合成一件"&VLOOKUP(INT(MOD(RC[-1],1000)/100),R13C5:R18C6,2,FALSE)&IF(VLOOKUP(RC[-1],'1.装备'!R6C1:R101C15,12,FALSE)="","","套装")&VLOOKUP(INT(MOD(RC[-1],10000)/1000),R20C5:R24C6,2,FALSE)&"："&VLOOKUP(RC[-1],'1.装备'!R6C1:R101C2,2,FALSE)&"。" -> 集齐60个可以合成一件橙品套装护腕：大地庇护。 | L64: =VLOOKUP(MOD(RC[-2],1000),R7C14:R30C15,2,FALSE) -> 700
A65: 22504 | B65: 11515 | C65: =VLOOKUP(INT(MOD(RC[-2],1000)/100),R7C5:R11C6,2,FALSE) -> 80 | H65: 11421 | I65: =VLOOKUP(VLOOKUP(RC[-1],IF({1,0},R6C2:R101C2,R6C1:R101C1),2,FALSE),'1.装备'!R6C1:R101C2,2,FALSE)&"残件" -> 圣光权杖残件 | J65: =VLOOKUP(RC[-2],IF({1,0},R6C2:R101C2,R6C1:R101C1),2,FALSE) -> 20406 | K65: ="集齐"&VLOOKUP(INT(MOD(RC[-1],1000)/100),R6C5:R11C6,2,FALSE)&"个可以合成一件"&VLOOKUP(INT(MOD(RC[-1],1000)/100),R13C5:R18C6,2,FALSE)&IF(VLOOKUP(RC[-1],'1.装备'!R6C1:R101C15,12,FALSE)="","","套装")&VLOOKUP(INT(MOD(RC[-1],10000)/1000),R20C5:R24C6,2,FALSE)&"："&VLOOKUP(RC[-1],'1.装备'!R6C1:R101C2,2,FALSE)&"。" -> 集齐60个可以合成一件橙品套装武器：圣光权杖。 | L65: =VLOOKUP(MOD(RC[-2],1000),R7C14:R30C15,2,FALSE) -> 650
A66: 22505 | B66: 11519 | C66: =VLOOKUP(INT(MOD(RC[-2],1000)/100),R7C5:R11C6,2,FALSE) -> 80 | H66: 11422 | I66: =VLOOKUP(VLOOKUP(RC[-1],IF({1,0},R6C2:R101C2,R6C1:R101C1),2,FALSE),'1.装备'!R6C1:R101C2,2,FALSE)&"残件" -> 熔岩盔甲残件 | J66: =VLOOKUP(RC[-2],IF({1,0},R6C2:R101C2,R6C1:R101C1),2,FALSE) -> 21407 | K66: ="集齐"&VLOOKUP(INT(MOD(RC[-1],1000)/100),R6C5:R11C6,2,FALSE)&"个可以合成一件"&VLOOKUP(INT(MOD(RC[-1],1000)/100),R13C5:R18C6,2,FALSE)&IF(VLOOKUP(RC[-1],'1.装备'!R6C1:R101C15,12,FALSE)="","","套装")&VLOOKUP(INT(MOD(RC[-1],10000)/1000),R20C5:R24C6,2,FALSE)&"："&VLOOKUP(RC[-1],'1.装备'!R6C1:R101C2,2,FALSE)&"。" -> 集齐60个可以合成一件橙品套装衣服：熔岩盔甲。 | L66: =VLOOKUP(MOD(RC[-2],1000),R7C14:R30C15,2,FALSE) -> 675
A67: 23101 | B67: 11104 | C67: =VLOOKUP(INT(MOD(RC[-2],1000)/100),R7C5:R11C6,2,FALSE) -> 10 | H67: 11423 | I67: =VLOOKUP(VLOOKUP(RC[-1],IF({1,0},R6C2:R101C2,R6C1:R101C1),2,FALSE),'1.装备'!R6C1:R101C2,2,FALSE)&"残件" -> 苍鹰长靴残件 | J67: =VLOOKUP(RC[-2],IF({1,0},R6C2:R101C2,R6C1:R101C1),2,FALSE) -> 22408 | K67: ="集齐"&VLOOKUP(INT(MOD(RC[-1],1000)/100),R6C5:R11C6,2,FALSE)&"个可以合成一件"&VLOOKUP(INT(MOD(RC[-1],1000)/100),R13C5:R18C6,2,FALSE)&IF(VLOOKUP(RC[-1],'1.装备'!R6C1:R101C15,12,FALSE)="","","套装")&VLOOKUP(INT(MOD(RC[-1],10000)/1000),R20C5:R24C6,2,FALSE)&"："&VLOOKUP(RC[-1],'1.装备'!R6C1:R101C2,2,FALSE)&"。" -> 集齐60个可以合成一件橙品套装鞋子：苍鹰长靴。 | L67: =VLOOKUP(MOD(RC[-2],1000),R7C14:R30C15,2,FALSE) -> 650
A68: 23102 | B68: 11108 | C68: =VLOOKUP(INT(MOD(RC[-2],1000)/100),R7C5:R11C6,2,FALSE) -> 10 | H68: 11424 | I68: =VLOOKUP(VLOOKUP(RC[-1],IF({1,0},R6C2:R101C2,R6C1:R101C1),2,FALSE),'1.装备'!R6C1:R101C2,2,FALSE)&"残件" -> 熔岩法杖残件 | J68: =VLOOKUP(RC[-2],IF({1,0},R6C2:R101C2,R6C1:R101C1),2,FALSE) -> 20407 | K68: ="集齐"&VLOOKUP(INT(MOD(RC[-1],1000)/100),R6C5:R11C6,2,FALSE)&"个可以合成一件"&VLOOKUP(INT(MOD(RC[-1],1000)/100),R13C5:R18C6,2,FALSE)&IF(VLOOKUP(RC[-1],'1.装备'!R6C1:R101C15,12,FALSE)="","","套装")&VLOOKUP(INT(MOD(RC[-1],10000)/1000),R20C5:R24C6,2,FALSE)&"："&VLOOKUP(RC[-1],'1.装备'!R6C1:R101C2,2,FALSE)&"。" -> 集齐60个可以合成一件橙品套装武器：熔岩法杖。 | L68: =VLOOKUP(MOD(RC[-2],1000),R7C14:R30C15,2,FALSE) -> 675
A69: 23201 | B69: 11204 | C69: =VLOOKUP(INT(MOD(RC[-2],1000)/100),R7C5:R11C6,2,FALSE) -> 20 | H69: 11425 | I69: =VLOOKUP(VLOOKUP(RC[-1],IF({1,0},R6C2:R101C2,R6C1:R101C1),2,FALSE),'1.装备'!R6C1:R101C2,2,FALSE)&"残件" -> 苍鹰护甲残件 | J69: =VLOOKUP(RC[-2],IF({1,0},R6C2:R101C2,R6C1:R101C1),2,FALSE) -> 21408 | K69: ="集齐"&VLOOKUP(INT(MOD(RC[-1],1000)/100),R6C5:R11C6,2,FALSE)&"个可以合成一件"&VLOOKUP(INT(MOD(RC[-1],1000)/100),R13C5:R18C6,2,FALSE)&IF(VLOOKUP(RC[-1],'1.装备'!R6C1:R101C15,12,FALSE)="","","套装")&VLOOKUP(INT(MOD(RC[-1],10000)/1000),R20C5:R24C6,2,FALSE)&"："&VLOOKUP(RC[-1],'1.装备'!R6C1:R101C2,2,FALSE)&"。" -> 集齐60个可以合成一件橙品套装衣服：苍鹰护甲。 | L69: =VLOOKUP(MOD(RC[-2],1000),R7C14:R30C15,2,FALSE) -> 650
A70: 23202 | B70: 11208 | C70: =VLOOKUP(INT(MOD(RC[-2],1000)/100),R7C5:R11C6,2,FALSE) -> 20 | H70: 11426 | I70: =VLOOKUP(VLOOKUP(RC[-1],IF({1,0},R6C2:R101C2,R6C1:R101C1),2,FALSE),'1.装备'!R6C1:R101C2,2,FALSE)&"残件" -> 圣光护臂残件 | J70: =VLOOKUP(RC[-2],IF({1,0},R6C2:R101C2,R6C1:R101C1),2,FALSE) -> 23406 | K70: ="集齐"&VLOOKUP(INT(MOD(RC[-1],1000)/100),R6C5:R11C6,2,FALSE)&"个可以合成一件"&VLOOKUP(INT(MOD(RC[-1],1000)/100),R13C5:R18C6,2,FALSE)&IF(VLOOKUP(RC[-1],'1.装备'!R6C1:R101C15,12,FALSE)="","","套装")&VLOOKUP(INT(MOD(RC[-1],10000)/1000),R20C5:R24C6,2,FALSE)&"："&VLOOKUP(RC[-1],'1.装备'!R6C1:R101C2,2,FALSE)&"。" -> 集齐60个可以合成一件橙品套装护腕：圣光护臂。 | L70: =VLOOKUP(MOD(RC[-2],1000),R7C14:R30C15,2,FALSE) -> 650
A71: 23301 | B71: 11304 | C71: =VLOOKUP(INT(MOD(RC[-2],1000)/100),R7C5:R11C6,2,FALSE) -> 40 | H71: 11427 | I71: =VLOOKUP(VLOOKUP(RC[-1],IF({1,0},R6C2:R101C2,R6C1:R101C1),2,FALSE),'1.装备'!R6C1:R101C2,2,FALSE)&"残件" -> 苍鹰魔珠残件 | J71: =VLOOKUP(RC[-2],IF({1,0},R6C2:R101C2,R6C1:R101C1),2,FALSE) -> 20408 | K71: ="集齐"&VLOOKUP(INT(MOD(RC[-1],1000)/100),R6C5:R11C6,2,FALSE)&"个可以合成一件"&VLOOKUP(INT(MOD(RC[-1],1000)/100),R13C5:R18C6,2,FALSE)&IF(VLOOKUP(RC[-1],'1.装备'!R6C1:R101C15,12,FALSE)="","","套装")&VLOOKUP(INT(MOD(RC[-1],10000)/1000),R20C5:R24C6,2,FALSE)&"："&VLOOKUP(RC[-1],'1.装备'!R6C1:R101C2,2,FALSE)&"。" -> 集齐60个可以合成一件橙品套装武器：苍鹰魔珠。 | L71: =VLOOKUP(MOD(RC[-2],1000),R7C14:R30C15,2,FALSE) -> 650
A72: 23302 | B72: 11308 | C72: =VLOOKUP(INT(MOD(RC[-2],1000)/100),R7C5:R11C6,2,FALSE) -> 40 | H72: 11428 | I72: =VLOOKUP(VLOOKUP(RC[-1],IF({1,0},R6C2:R101C2,R6C1:R101C1),2,FALSE),'1.装备'!R6C1:R101C2,2,FALSE)&"残件" -> 圣光战靴残件 | J72: =VLOOKUP(RC[-2],IF({1,0},R6C2:R101C2,R6C1:R101C1),2,FALSE) -> 22406 | K72: ="集齐"&VLOOKUP(INT(MOD(RC[-1],1000)/100),R6C5:R11C6,2,FALSE)&"个可以合成一件"&VLOOKUP(INT(MOD(RC[-1],1000)/100),R13C5:R18C6,2,FALSE)&IF(VLOOKUP(RC[-1],'1.装备'!R6C1:R101C15,12,FALSE)="","","套装")&VLOOKUP(INT(MOD(RC[-1],10000)/1000),R20C5:R24C6,2,FALSE)&"："&VLOOKUP(RC[-1],'1.装备'!R6C1:R101C2,2,FALSE)&"。" -> 集齐60个可以合成一件橙品套装鞋子：圣光战靴。 | L72: =VLOOKUP(MOD(RC[-2],1000),R7C14:R30C15,2,FALSE) -> 650
A73: 23303 | B73: 11312 | C73: =VLOOKUP(INT(MOD(RC[-2],1000)/100),R7C5:R11C6,2,FALSE) -> 40 | H73: 11429 | I73: =VLOOKUP(VLOOKUP(RC[-1],IF({1,0},R6C2:R101C2,R6C1:R101C1),2,FALSE),'1.装备'!R6C1:R101C2,2,FALSE)&"残件" -> 熔岩护臂残件 | J73: =VLOOKUP(RC[-2],IF({1,0},R6C2:R101C2,R6C1:R101C1),2,FALSE) -> 23407 | K73: ="集齐"&VLOOKUP(INT(MOD(RC[-1],1000)/100),R6C5:R11C6,2,FALSE)&"个可以合成一件"&VLOOKUP(INT(MOD(RC[-1],1000)/100),R13C5:R18C6,2,FALSE)&IF(VLOOKUP(RC[-1],'1.装备'!R6C1:R101C15,12,FALSE)="","","套装")&VLOOKUP(INT(MOD(RC[-1],10000)/1000),R20C5:R24C6,2,FALSE)&"："&VLOOKUP(RC[-1],'1.装备'!R6C1:R101C2,2,FALSE)&"。" -> 集齐60个可以合成一件橙品套装护腕：熔岩护臂。 | L73: =VLOOKUP(MOD(RC[-2],1000),R7C14:R30C15,2,FALSE) -> 675
A74: 23304 | B74: 11316 | C74: =VLOOKUP(INT(MOD(RC[-2],1000)/100),R7C5:R11C6,2,FALSE) -> 40 | H74: 11430 | I74: =VLOOKUP(VLOOKUP(RC[-1],IF({1,0},R6C2:R101C2,R6C1:R101C1),2,FALSE),'1.装备'!R6C1:R101C2,2,FALSE)&"残件" -> 圣光战甲残件 | J74: =VLOOKUP(RC[-2],IF({1,0},R6C2:R101C2,R6C1:R101C1),2,FALSE) -> 21406 | K74: ="集齐"&VLOOKUP(INT(MOD(RC[-1],1000)/100),R6C5:R11C6,2,FALSE)&"个可以合成一件"&VLOOKUP(INT(MOD(RC[-1],1000)/100),R13C5:R18C6,2,FALSE)&IF(VLOOKUP(RC[-1],'1.装备'!R6C1:R101C15,12,FALSE)="","","套装")&VLOOKUP(INT(MOD(RC[-1],10000)/1000),R20C5:R24C6,2,FALSE)&"："&VLOOKUP(RC[-1],'1.装备'!R6C1:R101C2,2,FALSE)&"。" -> 集齐60个可以合成一件橙品套装衣服：圣光战甲。 | L74: =VLOOKUP(MOD(RC[-2],1000),R7C14:R30C15,2,FALSE) -> 650
A75: =R[-1]C+1 -> 23305 | B75: =R[-1]C+4 -> 11320 | C75: =R[-1]C -> 40 | H75: 11431 | I75: =VLOOKUP(VLOOKUP(RC[-1],IF({1,0},R6C2:R101C2,R6C1:R101C1),2,FALSE),'1.装备'!R6C1:R101C2,2,FALSE)&"残件" -> 熔岩布靴残件 | J75: =VLOOKUP(RC[-2],IF({1,0},R6C2:R101C2,R6C1:R101C1),2,FALSE) -> 22407 | K75: ="集齐"&VLOOKUP(INT(MOD(RC[-1],1000)/100),R6C5:R11C6,2,FALSE)&"个可以合成一件"&VLOOKUP(INT(MOD(RC[-1],1000)/100),R13C5:R18C6,2,FALSE)&IF(VLOOKUP(RC[-1],'1.装备'!R6C1:R101C15,12,FALSE)="","","套装")&VLOOKUP(INT(MOD(RC[-1],10000)/1000),R20C5:R24C6,2,FALSE)&"："&VLOOKUP(RC[-1],'1.装备'!R6C1:R101C2,2,FALSE)&"。" -> 集齐60个可以合成一件橙品套装鞋子：熔岩布靴。 | L75: =VLOOKUP(MOD(RC[-2],1000),R7C14:R30C15,2,FALSE) -> 675
A76: 23401 | B76: 11404 | C76: =VLOOKUP(INT(MOD(RC[-2],1000)/100),R7C5:R11C6,2,FALSE) -> 60 | H76: 11432 | I76: =VLOOKUP(VLOOKUP(RC[-1],IF({1,0},R6C2:R101C2,R6C1:R101C1),2,FALSE),'1.装备'!R6C1:R101C2,2,FALSE)&"残件" -> 苍鹰护臂残件 | J76: =VLOOKUP(RC[-2],IF({1,0},R6C2:R101C2,R6C1:R101C1),2,FALSE) -> 23408 | K76: ="集齐"&VLOOKUP(INT(MOD(RC[-1],1000)/100),R6C5:R11C6,2,FALSE)&"个可以合成一件"&VLOOKUP(INT(MOD(RC[-1],1000)/100),R13C5:R18C6,2,FALSE)&IF(VLOOKUP(RC[-1],'1.装备'!R6C1:R101C15,12,FALSE)="","","套装")&VLOOKUP(INT(MOD(RC[-1],10000)/1000),R20C5:R24C6,2,FALSE)&"："&VLOOKUP(RC[-1],'1.装备'!R6C1:R101C2,2,FALSE)&"。" -> 集齐60个可以合成一件橙品套装护腕：苍鹰护臂。 | L76: =VLOOKUP(MOD(RC[-2],1000),R7C14:R30C15,2,FALSE) -> 650
A77: 23402 | B77: 11408 | C77: =VLOOKUP(INT(MOD(RC[-2],1000)/100),R7C5:R11C6,2,FALSE) -> 60 | H77: 11499 | I77: =VLOOKUP(VLOOKUP(RC[-1],IF({1,0},R6C2:R101C2,R6C1:R101C1),2,FALSE),'1.装备'!R6C1:R101C2,2,FALSE)&"残件" -> 堕落魔甲残件 | J77: =VLOOKUP(RC[-2],IF({1,0},R6C2:R101C2,R6C1:R101C1),2,FALSE) -> 21400 | K77: ="集齐"&VLOOKUP(INT(MOD(RC[-1],1000)/100),R6C5:R11C6,2,FALSE)&"个可以合成一件"&VLOOKUP(INT(MOD(RC[-1],1000)/100),R13C5:R18C6,2,FALSE)&IF(VLOOKUP(RC[-1],'1.装备'!R6C1:R101C15,12,FALSE)="","","套装")&VLOOKUP(INT(MOD(RC[-1],10000)/1000),R20C5:R24C6,2,FALSE)&"："&VLOOKUP(RC[-1],'1.装备'!R6C1:R101C2,2,FALSE)&"。" -> 集齐60个可以合成一件橙品套装衣服：堕落魔甲。 | L77: =VLOOKUP(MOD(RC[-2],1000),R7C14:R30C15,2,FALSE) -> 375
A78: 23403 | B78: 11412 | C78: =VLOOKUP(INT(MOD(RC[-2],1000)/100),R7C5:R11C6,2,FALSE) -> 60 | H78: 11501 | I78: =VLOOKUP(VLOOKUP(RC[-1],IF({1,0},R6C2:R101C2,R6C1:R101C1),2,FALSE),'1.装备'!R6C1:R101C2,2,FALSE)&"残件" -> 神圣复仇残件 | J78: =VLOOKUP(RC[-2],IF({1,0},R6C2:R101C2,R6C1:R101C1),2,FALSE) -> 20501 | K78: ="集齐"&VLOOKUP(INT(MOD(RC[-1],1000)/100),R6C5:R11C6,2,FALSE)&"个可以合成一件"&VLOOKUP(INT(MOD(RC[-1],1000)/100),R13C5:R18C6,2,FALSE)&IF(VLOOKUP(RC[-1],'1.装备'!R6C1:R101C15,12,FALSE)="","","套装")&VLOOKUP(INT(MOD(RC[-1],10000)/1000),R20C5:R24C6,2,FALSE)&"："&VLOOKUP(RC[-1],'1.装备'!R6C1:R101C2,2,FALSE)&"。" -> 集齐80个可以合成一件红品套装武器：神圣复仇。 | L78: =VLOOKUP(MOD(RC[-2],1000),R7C14:R30C15,2,FALSE) -> 1000
A79: 23404 | B79: 11416 | C79: =VLOOKUP(INT(MOD(RC[-2],1000)/100),R7C5:R11C6,2,FALSE) -> 60 | H79: 11502 | I79: =VLOOKUP(VLOOKUP(RC[-1],IF({1,0},R6C2:R101C2,R6C1:R101C1),2,FALSE),'1.装备'!R6C1:R101C2,2,FALSE)&"残件" -> 地狱哀歌残件 | J79: =VLOOKUP(RC[-2],IF({1,0},R6C2:R101C2,R6C1:R101C1),2,FALSE) -> 21501 | K79: ="集齐"&VLOOKUP(INT(MOD(RC[-1],1000)/100),R6C5:R11C6,2,FALSE)&"个可以合成一件"&VLOOKUP(INT(MOD(RC[-1],1000)/100),R13C5:R18C6,2,FALSE)&IF(VLOOKUP(RC[-1],'1.装备'!R6C1:R101C15,12,FALSE)="","","套装")&VLOOKUP(INT(MOD(RC[-1],10000)/1000),R20C5:R24C6,2,FALSE)&"："&VLOOKUP(RC[-1],'1.装备'!R6C1:R101C2,2,FALSE)&"。" -> 集齐80个可以合成一件红品套装衣服：地狱哀歌。 | L79: =VLOOKUP(MOD(RC[-2],1000),R7C14:R30C15,2,FALSE) -> 1000
A80: =R[-1]C+1 -> 23405 | B80: =R[-1]C+4 -> 11420 | C80: =R[-1]C -> 60 | H80: 11503 | I80: =VLOOKUP(VLOOKUP(RC[-1],IF({1,0},R6C2:R101C2,R6C1:R101C1),2,FALSE),'1.装备'!R6C1:R101C2,2,FALSE)&"残件" -> 贯穿苍穹残件 | J80: =VLOOKUP(RC[-2],IF({1,0},R6C2:R101C2,R6C1:R101C1),2,FALSE) -> 22501 | K80: ="集齐"&VLOOKUP(INT(MOD(RC[-1],1000)/100),R6C5:R11C6,2,FALSE)&"个可以合成一件"&VLOOKUP(INT(MOD(RC[-1],1000)/100),R13C5:R18C6,2,FALSE)&IF(VLOOKUP(RC[-1],'1.装备'!R6C1:R101C15,12,FALSE)="","","套装")&VLOOKUP(INT(MOD(RC[-1],10000)/1000),R20C5:R24C6,2,FALSE)&"："&VLOOKUP(RC[-1],'1.装备'!R6C1:R101C2,2,FALSE)&"。" -> 集齐80个可以合成一件红品套装鞋子：贯穿苍穹。 | L80: =VLOOKUP(MOD(RC[-2],1000),R7C14:R30C15,2,FALSE) -> 1000
A81: 23501 | B81: 11504 | C81: =VLOOKUP(INT(MOD(RC[-2],1000)/100),R7C5:R11C6,2,FALSE) -> 80 | H81: 11504 | I81: =VLOOKUP(VLOOKUP(RC[-1],IF({1,0},R6C2:R101C2,R6C1:R101C1),2,FALSE),'1.装备'!R6C1:R101C2,2,FALSE)&"残件" -> 苍白正义残件 | J81: =VLOOKUP(RC[-2],IF({1,0},R6C2:R101C2,R6C1:R101C1),2,FALSE) -> 23501 | K81: ="集齐"&VLOOKUP(INT(MOD(RC[-1],1000)/100),R6C5:R11C6,2,FALSE)&"个可以合成一件"&VLOOKUP(INT(MOD(RC[-1],1000)/100),R13C5:R18C6,2,FALSE)&IF(VLOOKUP(RC[-1],'1.装备'!R6C1:R101C15,12,FALSE)="","","套装")&VLOOKUP(INT(MOD(RC[-1],10000)/1000),R20C5:R24C6,2,FALSE)&"："&VLOOKUP(RC[-1],'1.装备'!R6C1:R101C2,2,FALSE)&"。" -> 集齐80个可以合成一件红品套装护腕：苍白正义。 | L81: =VLOOKUP(MOD(RC[-2],1000),R7C14:R30C15,2,FALSE) -> 1000
A82: 23502 | B82: 11508 | C82: =VLOOKUP(INT(MOD(RC[-2],1000)/100),R7C5:R11C6,2,FALSE) -> 80 | H82: 11505 | I82: =VLOOKUP(VLOOKUP(RC[-1],IF({1,0},R6C2:R101C2,R6C1:R101C1),2,FALSE),'1.装备'!R6C1:R101C2,2,FALSE)&"残件" -> 永恒破碎残件 | J82: =VLOOKUP(RC[-2],IF({1,0},R6C2:R101C2,R6C1:R101C1),2,FALSE) -> 20502 | K82: ="集齐"&VLOOKUP(INT(MOD(RC[-1],1000)/100),R6C5:R11C6,2,FALSE)&"个可以合成一件"&VLOOKUP(INT(MOD(RC[-1],1000)/100),R13C5:R18C6,2,FALSE)&IF(VLOOKUP(RC[-1],'1.装备'!R6C1:R101C15,12,FALSE)="","","套装")&VLOOKUP(INT(MOD(RC[-1],10000)/1000),R20C5:R24C6,2,FALSE)&"："&VLOOKUP(RC[-1],'1.装备'!R6C1:R101C2,2,FALSE)&"。" -> 集齐80个可以合成一件红品套装武器：永恒破碎。 | L82: =VLOOKUP(MOD(RC[-2],1000),R7C14:R30C15,2,FALSE) -> 1250
A83: 23503 | B83: 11512 | C83: =VLOOKUP(INT(MOD(RC[-2],1000)/100),R7C5:R11C6,2,FALSE) -> 80 | H83: 11506 | I83: =VLOOKUP(VLOOKUP(RC[-1],IF({1,0},R6C2:R101C2,R6C1:R101C1),2,FALSE),'1.装备'!R6C1:R101C2,2,FALSE)&"残件" -> 永恒虚无残件 | J83: =VLOOKUP(RC[-2],IF({1,0},R6C2:R101C2,R6C1:R101C1),2,FALSE) -> 21502 | K83: ="集齐"&VLOOKUP(INT(MOD(RC[-1],1000)/100),R6C5:R11C6,2,FALSE)&"个可以合成一件"&VLOOKUP(INT(MOD(RC[-1],1000)/100),R13C5:R18C6,2,FALSE)&IF(VLOOKUP(RC[-1],'1.装备'!R6C1:R101C15,12,FALSE)="","","套装")&VLOOKUP(INT(MOD(RC[-1],10000)/1000),R20C5:R24C6,2,FALSE)&"："&VLOOKUP(RC[-1],'1.装备'!R6C1:R101C2,2,FALSE)&"。" -> 集齐80个可以合成一件红品套装衣服：永恒虚无。 | L83: =VLOOKUP(MOD(RC[-2],1000),R7C14:R30C15,2,FALSE) -> 1250
A84: 23504 | B84: 11516 | C84: =VLOOKUP(INT(MOD(RC[-2],1000)/100),R7C5:R11C6,2,FALSE) -> 80 | H84: 11507 | I84: =VLOOKUP(VLOOKUP(RC[-1],IF({1,0},R6C2:R101C2,R6C1:R101C1),2,FALSE),'1.装备'!R6C1:R101C2,2,FALSE)&"残件" -> 永恒时空残件 | J84: =VLOOKUP(RC[-2],IF({1,0},R6C2:R101C2,R6C1:R101C1),2,FALSE) -> 22502 | K84: ="集齐"&VLOOKUP(INT(MOD(RC[-1],1000)/100),R6C5:R11C6,2,FALSE)&"个可以合成一件"&VLOOKUP(INT(MOD(RC[-1],1000)/100),R13C5:R18C6,2,FALSE)&IF(VLOOKUP(RC[-1],'1.装备'!R6C1:R101C15,12,FALSE)="","","套装")&VLOOKUP(INT(MOD(RC[-1],10000)/1000),R20C5:R24C6,2,FALSE)&"："&VLOOKUP(RC[-1],'1.装备'!R6C1:R101C2,2,FALSE)&"。" -> 集齐80个可以合成一件红品套装鞋子：永恒时空。 | L84: =VLOOKUP(MOD(RC[-2],1000),R7C14:R30C15,2,FALSE) -> 1250
A85: 23505 | B85: 11520 | C85: =VLOOKUP(INT(MOD(RC[-2],1000)/100),R7C5:R11C6,2,FALSE) -> 80 | H85: 11508 | I85: =VLOOKUP(VLOOKUP(RC[-1],IF({1,0},R6C2:R101C2,R6C1:R101C1),2,FALSE),'1.装备'!R6C1:R101C2,2,FALSE)&"残件" -> 永恒光辉残件 | J85: =VLOOKUP(RC[-2],IF({1,0},R6C2:R101C2,R6C1:R101C1),2,FALSE) -> 23502 | K85: ="集齐"&VLOOKUP(INT(MOD(RC[-1],1000)/100),R6C5:R11C6,2,FALSE)&"个可以合成一件"&VLOOKUP(INT(MOD(RC[-1],1000)/100),R13C5:R18C6,2,FALSE)&IF(VLOOKUP(RC[-1],'1.装备'!R6C1:R101C15,12,FALSE)="","","套装")&VLOOKUP(INT(MOD(RC[-1],10000)/1000),R20C5:R24C6,2,FALSE)&"："&VLOOKUP(RC[-1],'1.装备'!R6C1:R101C2,2,FALSE)&"。" -> 集齐80个可以合成一件红品套装护腕：永恒光辉。 | L85: =VLOOKUP(MOD(RC[-2],1000),R7C14:R30C15,2,FALSE) -> 1250
A86: 20406 | B86: 11421 | C86: 60 | H86: 11509 | I86: =VLOOKUP(VLOOKUP(RC[-1],IF({1,0},R6C2:R101C2,R6C1:R101C1),2,FALSE),'1.装备'!R6C1:R101C2,2,FALSE)&"残件" -> 巨擘之握残件 | J86: =VLOOKUP(RC[-2],IF({1,0},R6C2:R101C2,R6C1:R101C1),2,FALSE) -> 20503 | K86: ="集齐"&VLOOKUP(INT(MOD(RC[-1],1000)/100),R6C5:R11C6,2,FALSE)&"个可以合成一件"&VLOOKUP(INT(MOD(RC[-1],1000)/100),R13C5:R18C6,2,FALSE)&IF(VLOOKUP(RC[-1],'1.装备'!R6C1:R101C15,12,FALSE)="","","套装")&VLOOKUP(INT(MOD(RC[-1],10000)/1000),R20C5:R24C6,2,FALSE)&"："&VLOOKUP(RC[-1],'1.装备'!R6C1:R101C2,2,FALSE)&"。" -> 集齐80个可以合成一件红品套装武器：巨擘之握。 | L86: =VLOOKUP(MOD(RC[-2],1000),R7C14:R30C15,2,FALSE) -> 1000
A87: 20407 | B87: 11424 | C87: 60 | H87: 11510 | I87: =VLOOKUP(VLOOKUP(RC[-1],IF({1,0},R6C2:R101C2,R6C1:R101C1),2,FALSE),'1.装备'!R6C1:R101C2,2,FALSE)&"残件" -> 巨擘怒吼残件 | J87: =VLOOKUP(RC[-2],IF({1,0},R6C2:R101C2,R6C1:R101C1),2,FALSE) -> 21503 | K87: ="集齐"&VLOOKUP(INT(MOD(RC[-1],1000)/100),R6C5:R11C6,2,FALSE)&"个可以合成一件"&VLOOKUP(INT(MOD(RC[-1],1000)/100),R13C5:R18C6,2,FALSE)&IF(VLOOKUP(RC[-1],'1.装备'!R6C1:R101C15,12,FALSE)="","","套装")&VLOOKUP(INT(MOD(RC[-1],10000)/1000),R20C5:R24C6,2,FALSE)&"："&VLOOKUP(RC[-1],'1.装备'!R6C1:R101C2,2,FALSE)&"。" -> 集齐80个可以合成一件红品套装衣服：巨擘怒吼。 | L87: =VLOOKUP(MOD(RC[-2],1000),R7C14:R30C15,2,FALSE) -> 1000
A88: 20408 | B88: 11427 | C88: 60 | H88: 11511 | I88: =VLOOKUP(VLOOKUP(RC[-1],IF({1,0},R6C2:R101C2,R6C1:R101C1),2,FALSE),'1.装备'!R6C1:R101C2,2,FALSE)&"残件" -> 巨擘践踏残件 | J88: =VLOOKUP(RC[-2],IF({1,0},R6C2:R101C2,R6C1:R101C1),2,FALSE) -> 22503 | K88: ="集齐"&VLOOKUP(INT(MOD(RC[-1],1000)/100),R6C5:R11C6,2,FALSE)&"个可以合成一件"&VLOOKUP(INT(MOD(RC[-1],1000)/100),R13C5:R18C6,2,FALSE)&IF(VLOOKUP(RC[-1],'1.装备'!R6C1:R101C15,12,FALSE)="","","套装")&VLOOKUP(INT(MOD(RC[-1],10000)/1000),R20C5:R24C6,2,FALSE)&"："&VLOOKUP(RC[-1],'1.装备'!R6C1:R101C2,2,FALSE)&"。" -> 集齐80个可以合成一件红品套装鞋子：巨擘践踏。 | L88: =VLOOKUP(MOD(RC[-2],1000),R7C14:R30C15,2,FALSE) -> 1000
A89: 21406 | B89: 11430 | C89: 60 | H89: 11512 | I89: =VLOOKUP(VLOOKUP(RC[-1],IF({1,0},R6C2:R101C2,R6C1:R101C1),2,FALSE),'1.装备'!R6C1:R101C2,2,FALSE)&"残件" -> 巨擘守护残件 | J89: =VLOOKUP(RC[-2],IF({1,0},R6C2:R101C2,R6C1:R101C1),2,FALSE) -> 23503 | K89: ="集齐"&VLOOKUP(INT(MOD(RC[-1],1000)/100),R6C5:R11C6,2,FALSE)&"个可以合成一件"&VLOOKUP(INT(MOD(RC[-1],1000)/100),R13C5:R18C6,2,FALSE)&IF(VLOOKUP(RC[-1],'1.装备'!R6C1:R101C15,12,FALSE)="","","套装")&VLOOKUP(INT(MOD(RC[-1],10000)/1000),R20C5:R24C6,2,FALSE)&"："&VLOOKUP(RC[-1],'1.装备'!R6C1:R101C2,2,FALSE)&"。" -> 集齐80个可以合成一件红品套装护腕：巨擘守护。 | L89: =VLOOKUP(MOD(RC[-2],1000),R7C14:R30C15,2,FALSE) -> 1000
A90: 21407 | B90: 11422 | C90: 60 | H90: 11513 | I90: =VLOOKUP(VLOOKUP(RC[-1],IF({1,0},R6C2:R101C2,R6C1:R101C1),2,FALSE),'1.装备'!R6C1:R101C2,2,FALSE)&"残件" -> 抹杀领域残件 | J90: =VLOOKUP(RC[-2],IF({1,0},R6C2:R101C2,R6C1:R101C1),2,FALSE) -> 20504 | K90: ="集齐"&VLOOKUP(INT(MOD(RC[-1],1000)/100),R6C5:R11C6,2,FALSE)&"个可以合成一件"&VLOOKUP(INT(MOD(RC[-1],1000)/100),R13C5:R18C6,2,FALSE)&IF(VLOOKUP(RC[-1],'1.装备'!R6C1:R101C15,12,FALSE)="","","套装")&VLOOKUP(INT(MOD(RC[-1],10000)/1000),R20C5:R24C6,2,FALSE)&"："&VLOOKUP(RC[-1],'1.装备'!R6C1:R101C2,2,FALSE)&"。" -> 集齐80个可以合成一件红品套装武器：抹杀领域。 | L90: =VLOOKUP(MOD(RC[-2],1000),R7C14:R30C15,2,FALSE) -> 1125
A91: 21408 | B91: 11425 | C91: 60 | H91: 11514 | I91: =VLOOKUP(VLOOKUP(RC[-1],IF({1,0},R6C2:R101C2,R6C1:R101C1),2,FALSE),'1.装备'!R6C1:R101C2,2,FALSE)&"残件" -> 噩梦领域残件 | J91: =VLOOKUP(RC[-2],IF({1,0},R6C2:R101C2,R6C1:R101C1),2,FALSE) -> 21504 | K91: ="集齐"&VLOOKUP(INT(MOD(RC[-1],1000)/100),R6C5:R11C6,2,FALSE)&"个可以合成一件"&VLOOKUP(INT(MOD(RC[-1],1000)/100),R13C5:R18C6,2,FALSE)&IF(VLOOKUP(RC[-1],'1.装备'!R6C1:R101C15,12,FALSE)="","","套装")&VLOOKUP(INT(MOD(RC[-1],10000)/1000),R20C5:R24C6,2,FALSE)&"："&VLOOKUP(RC[-1],'1.装备'!R6C1:R101C2,2,FALSE)&"。" -> 集齐80个可以合成一件红品套装衣服：噩梦领域。 | L91: =VLOOKUP(MOD(RC[-2],1000),R7C14:R30C15,2,FALSE) -> 1125
A92: 22406 | B92: 11428 | C92: 60 | H92: 11515 | I92: =VLOOKUP(VLOOKUP(RC[-1],IF({1,0},R6C2:R101C2,R6C1:R101C1),2,FALSE),'1.装备'!R6C1:R101C2,2,FALSE)&"残件" -> 禁锢领域残件 | J92: =VLOOKUP(RC[-2],IF({1,0},R6C2:R101C2,R6C1:R101C1),2,FALSE) -> 22504 | K92: ="集齐"&VLOOKUP(INT(MOD(RC[-1],1000)/100),R6C5:R11C6,2,FALSE)&"个可以合成一件"&VLOOKUP(INT(MOD(RC[-1],1000)/100),R13C5:R18C6,2,FALSE)&IF(VLOOKUP(RC[-1],'1.装备'!R6C1:R101C15,12,FALSE)="","","套装")&VLOOKUP(INT(MOD(RC[-1],10000)/1000),R20C5:R24C6,2,FALSE)&"："&VLOOKUP(RC[-1],'1.装备'!R6C1:R101C2,2,FALSE)&"。" -> 集齐80个可以合成一件红品套装鞋子：禁锢领域。 | L92: =VLOOKUP(MOD(RC[-2],1000),R7C14:R30C15,2,FALSE) -> 1125
A93: 22407 | B93: 11431 | C93: 60 | H93: 11516 | I93: =VLOOKUP(VLOOKUP(RC[-1],IF({1,0},R6C2:R101C2,R6C1:R101C1),2,FALSE),'1.装备'!R6C1:R101C2,2,FALSE)&"残件" -> 封魔领域残件 | J93: =VLOOKUP(RC[-2],IF({1,0},R6C2:R101C2,R6C1:R101C1),2,FALSE) -> 23504 | K93: ="集齐"&VLOOKUP(INT(MOD(RC[-1],1000)/100),R6C5:R11C6,2,FALSE)&"个可以合成一件"&VLOOKUP(INT(MOD(RC[-1],1000)/100),R13C5:R18C6,2,FALSE)&IF(VLOOKUP(RC[-1],'1.装备'!R6C1:R101C15,12,FALSE)="","","套装")&VLOOKUP(INT(MOD(RC[-1],10000)/1000),R20C5:R24C6,2,FALSE)&"："&VLOOKUP(RC[-1],'1.装备'!R6C1:R101C2,2,FALSE)&"。" -> 集齐80个可以合成一件红品套装护腕：封魔领域。 | L93: =VLOOKUP(MOD(RC[-2],1000),R7C14:R30C15,2,FALSE) -> 1125
A94: 22408 | B94: 11423 | C94: 60 | H94: 11517 | I94: =VLOOKUP(VLOOKUP(RC[-1],IF({1,0},R6C2:R101C2,R6C1:R101C1),2,FALSE),'1.装备'!R6C1:R101C2,2,FALSE)&"残件" -> 盖亚之力残件 | J94: =VLOOKUP(RC[-2],IF({1,0},R6C2:R101C2,R6C1:R101C1),2,FALSE) -> 20505 | K94: ="集齐"&VLOOKUP(INT(MOD(RC[-1],1000)/100),R6C5:R11C6,2,FALSE)&"个可以合成一件"&VLOOKUP(INT(MOD(RC[-1],1000)/100),R13C5:R18C6,2,FALSE)&IF(VLOOKUP(RC[-1],'1.装备'!R6C1:R101C15,12,FALSE)="","","套装")&VLOOKUP(INT(MOD(RC[-1],10000)/1000),R20C5:R24C6,2,FALSE)&"："&VLOOKUP(RC[-1],'1.装备'!R6C1:R101C2,2,FALSE)&"。" -> 集齐80个可以合成一件红品套装武器：盖亚之力。 | L94: =VLOOKUP(MOD(RC[-2],1000),R7C14:R30C15,2,FALSE) -> 1000
A95: 23406 | B95: 11426 | C95: 60 | H95: 11518 | I95: =VLOOKUP(VLOOKUP(RC[-1],IF({1,0},R6C2:R101C2,R6C1:R101C1),2,FALSE),'1.装备'!R6C1:R101C2,2,FALSE)&"残件" -> 盖亚守护残件 | J95: =VLOOKUP(RC[-2],IF({1,0},R6C2:R101C2,R6C1:R101C1),2,FALSE) -> 21505 | K95: ="集齐"&VLOOKUP(INT(MOD(RC[-1],1000)/100),R6C5:R11C6,2,FALSE)&"个可以合成一件"&VLOOKUP(INT(MOD(RC[-1],1000)/100),R13C5:R18C6,2,FALSE)&IF(VLOOKUP(RC[-1],'1.装备'!R6C1:R101C15,12,FALSE)="","","套装")&VLOOKUP(INT(MOD(RC[-1],10000)/1000),R20C5:R24C6,2,FALSE)&"："&VLOOKUP(RC[-1],'1.装备'!R6C1:R101C2,2,FALSE)&"。" -> 集齐80个可以合成一件红品套装衣服：盖亚守护。 | L95: =VLOOKUP(MOD(RC[-2],1000),R7C14:R30C15,2,FALSE) -> 1000
A96: 23407 | B96: 11429 | C96: 60 | H96: 11519 | I96: =VLOOKUP(VLOOKUP(RC[-1],IF({1,0},R6C2:R101C2,R6C1:R101C1),2,FALSE),'1.装备'!R6C1:R101C2,2,FALSE)&"残件" -> 盖亚能量残件 | J96: =VLOOKUP(RC[-2],IF({1,0},R6C2:R101C2,R6C1:R101C1),2,FALSE) -> 22505 | K96: ="集齐"&VLOOKUP(INT(MOD(RC[-1],1000)/100),R6C5:R11C6,2,FALSE)&"个可以合成一件"&VLOOKUP(INT(MOD(RC[-1],1000)/100),R13C5:R18C6,2,FALSE)&IF(VLOOKUP(RC[-1],'1.装备'!R6C1:R101C15,12,FALSE)="","","套装")&VLOOKUP(INT(MOD(RC[-1],10000)/1000),R20C5:R24C6,2,FALSE)&"："&VLOOKUP(RC[-1],'1.装备'!R6C1:R101C2,2,FALSE)&"。" -> 集齐80个可以合成一件红品套装鞋子：盖亚能量。 | L96: =VLOOKUP(MOD(RC[-2],1000),R7C14:R30C15,2,FALSE) -> 1000
A97: 23408 | B97: 11432 | C97: 60 | H97: 11520 | I97: =VLOOKUP(VLOOKUP(RC[-1],IF({1,0},R6C2:R101C2,R6C1:R101C1),2,FALSE),'1.装备'!R6C1:R101C2,2,FALSE)&"残件" -> 盖亚庇佑残件 | J97: =VLOOKUP(RC[-2],IF({1,0},R6C2:R101C2,R6C1:R101C1),2,FALSE) -> 23505 | K97: ="集齐"&VLOOKUP(INT(MOD(RC[-1],1000)/100),R6C5:R11C6,2,FALSE)&"个可以合成一件"&VLOOKUP(INT(MOD(RC[-1],1000)/100),R13C5:R18C6,2,FALSE)&IF(VLOOKUP(RC[-1],'1.装备'!R6C1:R101C15,12,FALSE)="","","套装")&VLOOKUP(INT(MOD(RC[-1],10000)/1000),R20C5:R24C6,2,FALSE)&"："&VLOOKUP(RC[-1],'1.装备'!R6C1:R101C2,2,FALSE)&"。" -> 集齐80个可以合成一件红品套装护腕：盖亚庇佑。 | L97: =VLOOKUP(MOD(RC[-2],1000),R7C14:R30C15,2,FALSE) -> 1000
A98: 20599 | B98: 11996 | C98: =VLOOKUP(INT(MOD(RC[-2],1000)/100),R7C5:R11C6,2,FALSE) -> 80
A99: 21599 | B99: 11997 | C99: =VLOOKUP(INT(MOD(RC[-2],1000)/100),R7C5:R11C6,2,FALSE) -> 80
A100: 22599 | B100: 11998 | C100: =VLOOKUP(INT(MOD(RC[-2],1000)/100),R7C5:R11C6,2,FALSE) -> 80
A101: 23599 | B101: 11999 | C101: =VLOOKUP(INT(MOD(RC[-2],1000)/100),R7C5:R11C6,2,FALSE) -> 80

Sheet: 5.强化锻造配置
A1: strengthen_level|strengthen_level | B1: pro_type_list|pro_type_list | C1: pro_value_list|pro_value_list | D1: lvname| | E1: showLv|
A2: 不可空 | B2: 不可空 | C2: 不可空 | D2: 不可空 | E2: 不可空
A3: 数字 | B3: 一维数组 | C3: 一维数组 | D3: 字符串 | E3: 字符串
B4: 不定长 | C4: 不定长 | D4: 不定长 | E4: 不定长
A6: 需要的强化等级 | B6: 影响的属性类型列表 | C6: 影响的属性值列表 | D6: 等级名称 | E6: 当前强化大师等级
A7: 0 | B7: 0 | C7: 0 | D7: 装备强化共鸣0级 | E7: 0
A8: 10 | B8: 1 | C8: 50 | D8: 装备强化共鸣1级 | E8: 1
A9: 20 | B9: 1|2|3 | C9: 100|50|50 | D9: 装备强化共鸣2级 | E9: 2
A10: 30 | B10: 1|2|3|4 | C10: 150|100|100|550 | D10: 装备强化共鸣3级 | E10: 3
A11: 40 | B11: 1|2|3|4|21 | C11: 200|150|150|1100|5 | D11: 装备强化共鸣4级 | E11: 4
A12: 50 | B12: 1|2|3|4|21 | C12: 250|200|200|1650|5 | D12: 装备强化共鸣5级 | E12: 5
A13: 60 | B13: 1|2|3|4|21 | C13: 300|250|250|2200|5 | D13: 装备强化共鸣6级 | E13: 6
A14: 70 | B14: 1|2|3|4|21 | C14: 350|300|300|2750|5 | D14: 装备强化共鸣7级 | E14: 7
A15: 80 | B15: 1|2|3|4|21 | C15: 400|350|350|3300|5 | D15: 装备强化共鸣8级 | E15: 8
A16: 90 | B16: 1|2|3|4|21 | C16: 450|400|400|3850|5 | D16: 装备强化共鸣9级 | E16: 9
A17: 100 | B17: 1|2|3|4|21 | C17: 500|450|450|4400|5 | D17: 装备强化共鸣10级 | E17: 10
A18: 110 | B18: 1|2|3|4|21 | C18: 550|500|500|4950|5 | D18: 装备强化共鸣11级 | E18: 11
A19: 120 | B19: 1|2|3|4|21 | C19: 600|550|550|5500|5 | D19: 装备强化共鸣12级 | E19: 12
A20: 130 | B20: 1|2|3|4|21 | C20: 650|600|600|6050|5 | D20: 装备强化共鸣13级 | E20: 13
A21: 140 | B21: 1|2|3|4|21 | C21: 700|650|650|6600|5 | D21: 装备强化共鸣14级 | E21: 14
A22: 150 | B22: 1|2|3|4|21 | C22: 750|700|700|7150|5 | D22: 装备强化共鸣15级 | E22: 15
A23: 160 | B23: 1|2|3|4|21 | C23: 800|750|750|7700|5 | D23: 装备强化共鸣16级 | E23: 16
A24: 170 | B24: 1|2|3|4|21 | C24: 850|800|800|8250|5 | D24: 装备强化共鸣17级 | E24: 17
A25: 180 | B25: 1|2|3|4|21 | C25: 900|850|850|8800|5 | D25: 装备强化共鸣18级 | E25: 18
A26: 190 | B26: 1|2|3|4|21 | C26: 950|900|900|9350|5 | D26: 装备强化共鸣19级 | E26: 19
A27: 200 | B27: 1|2|3|4|21 | C27: 1000|950|950|9900|5 | D27: 装备强化共鸣20级 | E27: 20

Sheet: 6.精炼锻造配置
A1: refine_level|refine_level | B1: pro_type_list|pro_type_list | C1: pro_value_list|pro_value_list | D1: lvname| | E1: showLv|
A2: 不可空 | B2: 不可空 | C2: 不可空 | D2: 不可空 | E2: 不可空
A3: 数字 | B3: 一维数组 | C3: 一维数组 | D3: 字符串 | E3: 字符串
B4: 不定长 | C4: 不定长 | D4: 不定长 | E4: 不定长
A6: 需要的精炼等级 | B6: 影响的属性类型列表 | C6: 影响的属性值列表 | D6: 等级名称 | E6: 当前强化大师等级
A7: 0 | B7: 0 | C7: 0 | D7: 装备精炼共鸣0级 | E7: 0
A8: 5 | B8: 7|5 | C8: 200|200 | D8: 装备精炼共鸣1级 | E8: 1
A9: 10 | B9: 7|5 | C9: 400|400 | D9: 装备精炼共鸣2级 | E9: 2
A10: 15 | B10: 7|5 | C10: 600|600 | D10: 装备精炼共鸣3级 | E10: 3
A11: 20 | B11: 7|5 | C11: 800|800 | D11: 装备精炼共鸣4级 | E11: 4
A12: 25 | B12: 7|5 | C12: 1000|1000 | D12: 装备精炼共鸣5级 | E12: 5
A13: 30 | B13: 7|5 | C13: 1200|1200 | D13: 装备精炼共鸣6级 | E13: 6
A14: 35 | B14: 7|5 | C14: 1400|1400 | D14: 装备精炼共鸣7级 | E14: 7
A15: 40 | B15: 7|5 | C15: 1600|1600 | D15: 装备精炼共鸣8级 | E15: 8
A16: 45 | B16: 7|5 | C16: 1800|1800 | D16: 装备精炼共鸣9级 | E16: 9
A17: 50 | B17: 7|5 | C17: 2000|2000 | D17: 装备精炼共鸣10级 | E17: 10

Sheet: 7.套装配置
A1: id|id | B1: suit_list|suit_list | C1: pro1_type_list|pro1_type_list | D1: pro1_value_list|pro1_value_list | E1: pro2_type_list|pro2_type_list | F1: pro2_value_list|pro2_value_list | G1: pro3_type_list|pro3_type_list | H1: pro3_value_list|pro3_value_list | I1: name|
A2: 不可空 | B2: 不可空 | C2: 不可空 | D2: 不可空 | E2: 不可空 | F2: 不可空 | G2: 不可空 | H2: 不可空 | I2: 不可空
A3: 数字 | B3: 一维数组 | C3: 一维数组 | D3: 一维数组 | E3: 一维数组 | F3: 一维数组 | G3: 一维数组 | H3: 一维数组 | I3: 字符串
B4: 不定长 | C4: 不定长 | D4: 不定长 | E4: 不定长 | F4: 不定长 | G4: 不定长 | H4: 不定长 | I4: 不定长
A6: 套装ID | B6: 套装列表 | C6: 两件激活的属性类型列表 | D6: 两件激活的属性值列表 | E6: 三件激活的属性类型列表 | F6: 三件激活的属性值列表 | G6: 四件激活的属性类型列表 | H6: 四件激活的属性值列表 | I6: 套装名 | K6: 品质 | L6: 2件套 | N6: 3件套 | P6: 4件套
A7: 101 | B7: 20102|21102|22102|23102 | C7: =RC[15]&"|"&RC[16] -> 4|1 | D7: =RC[20]&"|"&RC[21] -> 250|25 | E7: =RC[15]&"|"&RC[16] -> 4|1 | F7: =RC[20]&"|"&RC[21] -> 250|25 | G7: =RC[15]&"|"&RC[16] -> 4|1 | H7: =RC[20]&"|"&RC[21] -> 250|25 | I7: 精致套装 | K7: 绿品平衡套 | L7: 生命+250 | M7: 攻击+25 | N7: 生命+250 | O7: 攻击+25 | P7: 生命+250 | Q7: 攻击+25 | R7: =VLOOKUP(MID(RC[-6],1,FIND("+",RC[-6],1)-1),IF({1,0},Sheet1!R8C2:R38C2,Sheet1!R8C1:R38C1),2,FALSE) -> 4 | S7: =VLOOKUP(MID(RC[-6],1,FIND("+",RC[-6],1)-1),IF({1,0},Sheet1!R8C2:R38C2,Sheet1!R8C1:R38C1),2,FALSE) -> 1 | T7: =VLOOKUP(MID(RC[-6],1,FIND("+",RC[-6],1)-1),IF({1,0},Sheet1!R8C2:R38C2,Sheet1!R8C1:R38C1),2,FALSE) -> 4 | U7: =VLOOKUP(MID(RC[-6],1,FIND("+",RC[-6],1)-1),IF({1,0},Sheet1!R8C2:R38C2,Sheet1!R8C1:R38C1),2,FALSE) -> 1 | V7: =VLOOKUP(MID(RC[-6],1,FIND("+",RC[-6],1)-1),IF({1,0},Sheet1!R8C2:R38C2,Sheet1!R8C1:R38C1),2,FALSE) -> 4 | W7: =VLOOKUP(MID(RC[-6],1,FIND("+",RC[-6],1)-1),IF({1,0},Sheet1!R8C2:R38C2,Sheet1!R8C1:R38C1),2,FALSE) -> 1 | X7: =MID(RC[-12],FIND("+",RC[-12],1)+1,99)*IF(ISNUMBER(FIND("%",RC[-12],1)),10000,1) -> 250 | Y7: =MID(RC[-12],FIND("+",RC[-12],1)+1,99)*IF(ISNUMBER(FIND("%",RC[-12],1)),10000,1) -> 25 | Z7: =MID(RC[-12],FIND("+",RC[-12],1)+1,99)*IF(ISNUMBER(FIND("%",RC[-12],1)),10000,1) -> 250 | AA7: =MID(RC[-12],FIND("+",RC[-12],1)+1,99)*IF(ISNUMBER(FIND("%",RC[-12],1)),10000,1) -> 25 | AB7: =MID(RC[-12],FIND("+",RC[-12],1)+1,99)*IF(ISNUMBER(FIND("%",RC[-12],1)),10000,1) -> 250 | AC7: =MID(RC[-12],FIND("+",RC[-12],1)+1,99)*IF(ISNUMBER(FIND("%",RC[-12],1)),10000,1) -> 25
A8: 202 | B8: 20202|21202|22202|23202 | C8: =RC[15]&"|"&RC[16] -> 4|1 | D8: =RC[20]&"|"&RC[21] -> 800|80 | E8: =RC[15]&"|"&RC[16] -> 4|1 | F8: =RC[20]&"|"&RC[21] -> 800|80 | G8: =RC[15]&"|"&RC[16] -> 4|1 | H8: =RC[20]&"|"&RC[21] -> 800|80 | I8: 骑士契约 | K8: 蓝品平衡套 | L8: 生命+800 | M8: 攻击+80 | N8: 生命+800 | O8: 攻击+80 | P8: 生命+800 | Q8: 攻击+80 | R8: =VLOOKUP(MID(RC[-6],1,FIND("+",RC[-6],1)-1),IF({1,0},Sheet1!R8C2:R38C2,Sheet1!R8C1:R38C1),2,FALSE) -> 4 | S8: =VLOOKUP(MID(RC[-6],1,FIND("+",RC[-6],1)-1),IF({1,0},Sheet1!R8C2:R38C2,Sheet1!R8C1:R38C1),2,FALSE) -> 1 | T8: =VLOOKUP(MID(RC[-6],1,FIND("+",RC[-6],1)-1),IF({1,0},Sheet1!R8C2:R38C2,Sheet1!R8C1:R38C1),2,FALSE) -> 4 | U8: =VLOOKUP(MID(RC[-6],1,FIND("+",RC[-6],1)-1),IF({1,0},Sheet1!R8C2:R38C2,Sheet1!R8C1:R38C1),2,FALSE) -> 1 | V8: =VLOOKUP(MID(RC[-6],1,FIND("+",RC[-6],1)-1),IF({1,0},Sheet1!R8C2:R38C2,Sheet1!R8C1:R38C1),2,FALSE) -> 4 | W8: =VLOOKUP(MID(RC[-6],1,FIND("+",RC[-6],1)-1),IF({1,0},Sheet1!R8C2:R38C2,Sheet1!R8C1:R38C1),2,FALSE) -> 1 | X8: =MID(RC[-12],FIND("+",RC[-12],1)+1,99)*IF(ISNUMBER(FIND("%",RC[-12],1)),10000,1) -> 800 | Y8: =MID(RC[-12],FIND("+",RC[-12],1)+1,99)*IF(ISNUMBER(FIND("%",RC[-12],1)),10000,1) -> 80 | Z8: =MID(RC[-12],FIND("+",RC[-12],1)+1,99)*IF(ISNUMBER(FIND("%",RC[-12],1)),10000,1) -> 800 | AA8: =MID(RC[-12],FIND("+",RC[-12],1)+1,99)*IF(ISNUMBER(FIND("%",RC[-12],1)),10000,1) -> 80 | AB8: =MID(RC[-12],FIND("+",RC[-12],1)+1,99)*IF(ISNUMBER(FIND("%",RC[-12],1)),10000,1) -> 800 | AC8: =MID(RC[-12],FIND("+",RC[-12],1)+1,99)*IF(ISNUMBER(FIND("%",RC[-12],1)),10000,1) -> 80
A9: 303 | B9: 20303|21303|22303|23303 | C9: =RC[15]&"|"&RC[16] -> 4|12 | D9: =RC[20]&"|"&RC[21] -> 4100|500 | E9: =RC[15]&"|"&RC[16] -> 4|12 | F9: =RC[20]&"|"&RC[21] -> 6100|500 | G9: =RC[15]&"|"&RC[16] -> 14|6 | H9: =RC[20]&"|"&RC[21] -> 1000|1000 | I9: 荣耀之心 | K9: 紫品防御套 | L9: 生命+4100 | M9: 闪避+5% | N9: 生命+6100 | O9: 闪避+5% | P9: 抗暴+10% | Q9: 减伤+10% | R9: =VLOOKUP(MID(RC[-6],1,FIND("+",RC[-6],1)-1),IF({1,0},Sheet1!R8C2:R38C2,Sheet1!R8C1:R38C1),2,FALSE) -> 4 | S9: =VLOOKUP(MID(RC[-6],1,FIND("+",RC[-6],1)-1),IF({1,0},Sheet1!R8C2:R38C2,Sheet1!R8C1:R38C1),2,FALSE) -> 12 | T9: =VLOOKUP(MID(RC[-6],1,FIND("+",RC[-6],1)-1),IF({1,0},Sheet1!R8C2:R38C2,Sheet1!R8C1:R38C1),2,FALSE) -> 4 | U9: =VLOOKUP(MID(RC[-6],1,FIND("+",RC[-6],1)-1),IF({1,0},Sheet1!R8C2:R38C2,Sheet1!R8C1:R38C1),2,FALSE) -> 12 | V9: =VLOOKUP(MID(RC[-6],1,FIND("+",RC[-6],1)-1),IF({1,0},Sheet1!R8C2:R38C2,Sheet1!R8C1:R38C1),2,FALSE) -> 14 | W9: =VLOOKUP(MID(RC[-6],1,FIND("+",RC[-6],1)-1),IF({1,0},Sheet1!R8C2:R38C2,Sheet1!R8C1:R38C1),2,FALSE) -> 6 | X9: =MID(RC[-12],FIND("+",RC[-12],1)+1,99)*IF(ISNUMBER(FIND("%",RC[-12],1)),10000,1) -> 4100 | Y9: =MID(RC[-12],FIND("+",RC[-12],1)+1,99)*IF(ISNUMBER(FIND("%",RC[-12],1)),10000,1) -> 500 | Z9: =MID(RC[-12],FIND("+",RC[-12],1)+1,99)*IF(ISNUMBER(FIND("%",RC[-12],1)),10000,1) -> 6100 | AA9: =MID(RC[-12],FIND("+",RC[-12],1)+1,99)*IF(ISNUMBER(FIND("%",RC[-12],1)),10000,1) -> 500 | AB9: =MID(RC[-12],FIND("+",RC[-12],1)+1,99)*IF(ISNUMBER(FIND("%",RC[-12],1)),10000,1) -> 1000 | AC9: =MID(RC[-12],FIND("+",RC[-12],1)+1,99)*IF(ISNUMBER(FIND("%",RC[-12],1)),10000,1) -> 1000
A10: 304 | B10: 20304|21304|22304|23304 | C10: =RC[15]&"|"&RC[16] -> 1|11 | D10: =RC[20]&"|"&RC[21] -> 410|500 | E10: =RC[15]&"|"&RC[16] -> 1|11 | F10: =RC[20]&"|"&RC[21] -> 610|500 | G10: =RC[15]&"|"&RC[16] -> 13|7 | H10: =RC[20]&"|"&RC[21] -> 1000|1000 | I10: 烈焰掌控 | K10: 紫品攻击套 | L10: 攻击+410 | M10: 命中+5% | N10: 攻击+610 | O10: 命中+5% | P10: 暴击+10% | Q10: 伤害+10% | R10: =VLOOKUP(MID(RC[-6],1,FIND("+",RC[-6],1)-1),IF({1,0},Sheet1!R8C2:R38C2,Sheet1!R8C1:R38C1),2,FALSE) -> 1 | S10: =VLOOKUP(MID(RC[-6],1,FIND("+",RC[-6],1)-1),IF({1,0},Sheet1!R8C2:R38C2,Sheet1!R8C1:R38C1),2,FALSE) -> 11 | T10: =VLOOKUP(MID(RC[-6],1,FIND("+",RC[-6],1)-1),IF({1,0},Sheet1!R8C2:R38C2,Sheet1!R8C1:R38C1),2,FALSE) -> 1 | U10: =VLOOKUP(MID(RC[-6],1,FIND("+",RC[-6],1)-1),IF({1,0},Sheet1!R8C2:R38C2,Sheet1!R8C1:R38C1),2,FALSE) -> 11 | V10: =VLOOKUP(MID(RC[-6],1,FIND("+",RC[-6],1)-1),IF({1,0},Sheet1!R8C2:R38C2,Sheet1!R8C1:R38C1),2,FALSE) -> 13 | W10: =VLOOKUP(MID(RC[-6],1,FIND("+",RC[-6],1)-1),IF({1,0},Sheet1!R8C2:R38C2,Sheet1!R8C1:R38C1),2,FALSE) -> 7 | X10: =MID(RC[-12],FIND("+",RC[-12],1)+1,99)*IF(ISNUMBER(FIND("%",RC[-12],1)),10000,1) -> 410 | Y10: =MID(RC[-12],FIND("+",RC[-12],1)+1,99)*IF(ISNUMBER(FIND("%",RC[-12],1)),10000,1) -> 500 | Z10: =MID(RC[-12],FIND("+",RC[-12],1)+1,99)*IF(ISNUMBER(FIND("%",RC[-12],1)),10000,1) -> 610 | AA10: =MID(RC[-12],FIND("+",RC[-12],1)+1,99)*IF(ISNUMBER(FIND("%",RC[-12],1)),10000,1) -> 500 | AB10: =MID(RC[-12],FIND("+",RC[-12],1)+1,99)*IF(ISNUMBER(FIND("%",RC[-12],1)),10000,1) -> 1000 | AC10: =MID(RC[-12],FIND("+",RC[-12],1)+1,99)*IF(ISNUMBER(FIND("%",RC[-12],1)),10000,1) -> 1000
A11: 305 | B11: 20305|21305|22305|23305 | C11: =RC[15]&"|"&RC[16] -> 4|1 | D11: =RC[20]&"|"&RC[21] -> 2250|225 | E11: =RC[15]&"|"&RC[16] -> 4|1 | F11: =RC[20]&"|"&RC[21] -> 2250|225 | G11: =RC[15]&"|"&RC[16] -> 4|1 | H11: =RC[20]&"|"&RC[21] -> 2250|225 | I11: 青鸟暴风 | K11: 紫品平衡套 | L11: 生命+2250 | M11: 攻击+225 | N11: 生命+2250 | O11: 攻击+225 | P11: 生命+2250 | Q11: 攻击+225 | R11: =VLOOKUP(MID(RC[-6],1,FIND("+",RC[-6],1)-1),IF({1,0},Sheet1!R8C2:R38C2,Sheet1!R8C1:R38C1),2,FALSE) -> 4 | S11: =VLOOKUP(MID(RC[-6],1,FIND("+",RC[-6],1)-1),IF({1,0},Sheet1!R8C2:R38C2,Sheet1!R8C1:R38C1),2,FALSE) -> 1 | T11: =VLOOKUP(MID(RC[-6],1,FIND("+",RC[-6],1)-1),IF({1,0},Sheet1!R8C2:R38C2,Sheet1!R8C1:R38C1),2,FALSE) -> 4 | U11: =VLOOKUP(MID(RC[-6],1,FIND("+",RC[-6],1)-1),IF({1,0},Sheet1!R8C2:R38C2,Sheet1!R8C1:R38C1),2,FALSE) -> 1 | V11: =VLOOKUP(MID(RC[-6],1,FIND("+",RC[-6],1)-1),IF({1,0},Sheet1!R8C2:R38C2,Sheet1!R8C1:R38C1),2,FALSE) -> 4 | W11: =VLOOKUP(MID(RC[-6],1,FIND("+",RC[-6],1)-1),IF({1,0},Sheet1!R8C2:R38C2,Sheet1!R8C1:R38C1),2,FALSE) -> 1 | X11: =MID(RC[-12],FIND("+",RC[-12],1)+1,99)*IF(ISNUMBER(FIND("%",RC[-12],1)),10000,1) -> 2250 | Y11: =MID(RC[-12],FIND("+",RC[-12],1)+1,99)*IF(ISNUMBER(FIND("%",RC[-12],1)),10000,1) -> 225 | Z11: =MID(RC[-12],FIND("+",RC[-12],1)+1,99)*IF(ISNUMBER(FIND("%",RC[-12],1)),10000,1) -> 2250 | AA11: =MID(RC[-12],FIND("+",RC[-12],1)+1,99)*IF(ISNUMBER(FIND("%",RC[-12],1)),10000,1) -> 225 | AB11: =MID(RC[-12],FIND("+",RC[-12],1)+1,99)*IF(ISNUMBER(FIND("%",RC[-12],1)),10000,1) -> 2250 | AC11: =MID(RC[-12],FIND("+",RC[-12],1)+1,99)*IF(ISNUMBER(FIND("%",RC[-12],1)),10000,1) -> 225
A12: 403 | B12: 20403|21403|22403|23403 | C12: =RC[15]&"|"&RC[16] -> 4|12 | D12: =RC[20]&"|"&RC[21] -> 7200|1000 | E12: =RC[15]&"|"&RC[16] -> 4|12 | F12: =RC[20]&"|"&RC[21] -> 10850|1000 | G12: =RC[15]&"|"&RC[16] -> 14|6 | H12: =RC[20]&"|"&RC[21] -> 2000|2000 | I12: 巨像守护 | K12: 橙品防御套 | L12: 生命+7200 | M12: 闪避+10% | N12: 生命+10850 | O12: 闪避+10% | P12: 抗暴+20% | Q12: 减伤+20% | R12: =VLOOKUP(MID(RC[-6],1,FIND("+",RC[-6],1)-1),IF({1,0},Sheet1!R8C2:R38C2,Sheet1!R8C1:R38C1),2,FALSE) -> 4 | S12: =VLOOKUP(MID(RC[-6],1,FIND("+",RC[-6],1)-1),IF({1,0},Sheet1!R8C2:R38C2,Sheet1!R8C1:R38C1),2,FALSE) -> 12 | T12: =VLOOKUP(MID(RC[-6],1,FIND("+",RC[-6],1)-1),IF({1,0},Sheet1!R8C2:R38C2,Sheet1!R8C1:R38C1),2,FALSE) -> 4 | U12: =VLOOKUP(MID(RC[-6],1,FIND("+",RC[-6],1)-1),IF({1,0},Sheet1!R8C2:R38C2,Sheet1!R8C1:R38C1),2,FALSE) -> 12 | V12: =VLOOKUP(MID(RC[-6],1,FIND("+",RC[-6],1)-1),IF({1,0},Sheet1!R8C2:R38C2,Sheet1!R8C1:R38C1),2,FALSE) -> 14 | W12: =VLOOKUP(MID(RC[-6],1,FIND("+",RC[-6],1)-1),IF({1,0},Sheet1!R8C2:R38C2,Sheet1!R8C1:R38C1),2,FALSE) -> 6 | X12: =MID(RC[-12],FIND("+",RC[-12],1)+1,99)*IF(ISNUMBER(FIND("%",RC[-12],1)),10000,1) -> 7200 | Y12: =MID(RC[-12],FIND("+",RC[-12],1)+1,99)*IF(ISNUMBER(FIND("%",RC[-12],1)),10000,1) -> 1000 | Z12: =MID(RC[-12],FIND("+",RC[-12],1)+1,99)*IF(ISNUMBER(FIND("%",RC[-12],1)),10000,1) -> 10850 | AA12: =MID(RC[-12],FIND("+",RC[-12],1)+1,99)*IF(ISNUMBER(FIND("%",RC[-12],1)),10000,1) -> 1000 | AB12: =MID(RC[-12],FIND("+",RC[-12],1)+1,99)*IF(ISNUMBER(FIND("%",RC[-12],1)),10000,1) -> 2000 | AC12: =MID(RC[-12],FIND("+",RC[-12],1)+1,99)*IF(ISNUMBER(FIND("%",RC[-12],1)),10000,1) -> 2000
A13: 404 | B13: 20404|21404|22404|23404 | C13: =RC[15]&"|"&RC[16] -> 1|11 | D13: =RC[20]&"|"&RC[21] -> 720|1000 | E13: =RC[15]&"|"&RC[16] -> 1|11 | F13: =RC[20]&"|"&RC[21] -> 1085|1000 | G13: =RC[15]&"|"&RC[16] -> 13|7 | H13: =RC[20]&"|"&RC[21] -> 2000|2000 | I13: 幽冥主宰 | K13: 橙品攻击套 | L13: 攻击+720 | M13: 命中+10% | N13: 攻击+1085 | O13: 命中+10% | P13: 暴击+20% | Q13: 伤害+20% | R13: =VLOOKUP(MID(RC[-6],1,FIND("+",RC[-6],1)-1),IF({1,0},Sheet1!R8C2:R38C2,Sheet1!R8C1:R38C1),2,FALSE) -> 1 | S13: =VLOOKUP(MID(RC[-6],1,FIND("+",RC[-6],1)-1),IF({1,0},Sheet1!R8C2:R38C2,Sheet1!R8C1:R38C1),2,FALSE) -> 11 | T13: =VLOOKUP(MID(RC[-6],1,FIND("+",RC[-6],1)-1),IF({1,0},Sheet1!R8C2:R38C2,Sheet1!R8C1:R38C1),2,FALSE) -> 1 | U13: =VLOOKUP(MID(RC[-6],1,FIND("+",RC[-6],1)-1),IF({1,0},Sheet1!R8C2:R38C2,Sheet1!R8C1:R38C1),2,FALSE) -> 11 | V13: =VLOOKUP(MID(RC[-6],1,FIND("+",RC[-6],1)-1),IF({1,0},Sheet1!R8C2:R38C2,Sheet1!R8C1:R38C1),2,FALSE) -> 13 | W13: =VLOOKUP(MID(RC[-6],1,FIND("+",RC[-6],1)-1),IF({1,0},Sheet1!R8C2:R38C2,Sheet1!R8C1:R38C1),2,FALSE) -> 7 | X13: =MID(RC[-12],FIND("+",RC[-12],1)+1,99)*IF(ISNUMBER(FIND("%",RC[-12],1)),10000,1) -> 720 | Y13: =MID(RC[-12],FIND("+",RC[-12],1)+1,99)*IF(ISNUMBER(FIND("%",RC[-12],1)),10000,1) -> 1000 | Z13: =MID(RC[-12],FIND("+",RC[-12],1)+1,99)*IF(ISNUMBER(FIND("%",RC[-12],1)),10000,1) -> 1085 | AA13: =MID(RC[-12],FIND("+",RC[-12],1)+1,99)*IF(ISNUMBER(FIND("%",RC[-12],1)),10000,1) -> 1000 | AB13: =MID(RC[-12],FIND("+",RC[-12],1)+1,99)*IF(ISNUMBER(FIND("%",RC[-12],1)),10000,1) -> 2000 | AC13: =MID(RC[-12],FIND("+",RC[-12],1)+1,99)*IF(ISNUMBER(FIND("%",RC[-12],1)),10000,1) -> 2000
A14: 405 | B14: 20405|21405|22405|23405 | C14: =RC[15]&"|"&RC[16] -> 4|1 | D14: =RC[20]&"|"&RC[21] -> 4000|400 | E14: =RC[15]&"|"&RC[16] -> 4|1 | F14: =RC[20]&"|"&RC[21] -> 4000|400 | G14: =RC[15]&"|"&RC[16] -> 4|1 | H14: =RC[20]&"|"&RC[21] -> 4000|400 | I14: 大地之子 | K14: 橙品平衡套 | L14: 生命+4000 | M14: 攻击+400 | N14: 生命+4000 | O14: 攻击+400 | P14: 生命+4000 | Q14: 攻击+400 | R14: =VLOOKUP(MID(RC[-6],1,FIND("+",RC[-6],1)-1),IF({1,0},Sheet1!R8C2:R38C2,Sheet1!R8C1:R38C1),2,FALSE) -> 4 | S14: =VLOOKUP(MID(RC[-6],1,FIND("+",RC[-6],1)-1),IF({1,0},Sheet1!R8C2:R38C2,Sheet1!R8C1:R38C1),2,FALSE) -> 1 | T14: =VLOOKUP(MID(RC[-6],1,FIND("+",RC[-6],1)-1),IF({1,0},Sheet1!R8C2:R38C2,Sheet1!R8C1:R38C1),2,FALSE) -> 4 | U14: =VLOOKUP(MID(RC[-6],1,FIND("+",RC[-6],1)-1),IF({1,0},Sheet1!R8C2:R38C2,Sheet1!R8C1:R38C1),2,FALSE) -> 1 | V14: =VLOOKUP(MID(RC[-6],1,FIND("+",RC[-6],1)-1),IF({1,0},Sheet1!R8C2:R38C2,Sheet1!R8C1:R38C1),2,FALSE) -> 4 | W14: =VLOOKUP(MID(RC[-6],1,FIND("+",RC[-6],1)-1),IF({1,0},Sheet1!R8C2:R38C2,Sheet1!R8C1:R38C1),2,FALSE) -> 1 | X14: =MID(RC[-12],FIND("+",RC[-12],1)+1,99)*IF(ISNUMBER(FIND("%",RC[-12],1)),10000,1) -> 4000 | Y14: =MID(RC[-12],FIND("+",RC[-12],1)+1,99)*IF(ISNUMBER(FIND("%",RC[-12],1)),10000,1) -> 400 | Z14: =MID(RC[-12],FIND("+",RC[-12],1)+1,99)*IF(ISNUMBER(FIND("%",RC[-12],1)),10000,1) -> 4000 | AA14: =MID(RC[-12],FIND("+",RC[-12],1)+1,99)*IF(ISNUMBER(FIND("%",RC[-12],1)),10000,1) -> 400 | AB14: =MID(RC[-12],FIND("+",RC[-12],1)+1,99)*IF(ISNUMBER(FIND("%",RC[-12],1)),10000,1) -> 4000 | AC14: =MID(RC[-12],FIND("+",RC[-12],1)+1,99)*IF(ISNUMBER(FIND("%",RC[-12],1)),10000,1) -> 400
A15: 406 | B15: 20406|21406|22406|23406 | C15: =RC[15]&"|"&RC[16] -> 4|12 | D15: =RC[20]&"|"&RC[21] -> 7200|750 | E15: =RC[15]&"|"&RC[16] -> 4|12 | F15: =RC[20]&"|"&RC[21] -> 10850|750 | G15: =RC[15]&"|"&RC[16] -> 14|6 | H15: =RC[20]&"|"&RC[21] -> 1500|1500 | I15: 圣光守护 | K15: 紫品防御套升橙 | L15: 生命+7200 | M15: 闪避+7.5% | N15: 生命+10850 | O15: 闪避+7.5% | P15: 抗暴+15% | Q15: 减伤+15% | R15: =VLOOKUP(MID(RC[-6],1,FIND("+",RC[-6],1)-1),IF({1,0},Sheet1!R8C2:R38C2,Sheet1!R8C1:R38C1),2,FALSE) -> 4 | S15: =VLOOKUP(MID(RC[-6],1,FIND("+",RC[-6],1)-1),IF({1,0},Sheet1!R8C2:R38C2,Sheet1!R8C1:R38C1),2,FALSE) -> 12 | T15: =VLOOKUP(MID(RC[-6],1,FIND("+",RC[-6],1)-1),IF({1,0},Sheet1!R8C2:R38C2,Sheet1!R8C1:R38C1),2,FALSE) -> 4 | U15: =VLOOKUP(MID(RC[-6],1,FIND("+",RC[-6],1)-1),IF({1,0},Sheet1!R8C2:R38C2,Sheet1!R8C1:R38C1),2,FALSE) -> 12 | V15: =VLOOKUP(MID(RC[-6],1,FIND("+",RC[-6],1)-1),IF({1,0},Sheet1!R8C2:R38C2,Sheet1!R8C1:R38C1),2,FALSE) -> 14 | W15: =VLOOKUP(MID(RC[-6],1,FIND("+",RC[-6],1)-1),IF({1,0},Sheet1!R8C2:R38C2,Sheet1!R8C1:R38C1),2,FALSE) -> 6 | X15: =MID(RC[-12],FIND("+",RC[-12],1)+1,99)*IF(ISNUMBER(FIND("%",RC[-12],1)),10000,1) -> 7200 | Y15: =MID(RC[-12],FIND("+",RC[-12],1)+1,99)*IF(ISNUMBER(FIND("%",RC[-12],1)),10000,1) -> 750 | Z15: =MID(RC[-12],FIND("+",RC[-12],1)+1,99)*IF(ISNUMBER(FIND("%",RC[-12],1)),10000,1) -> 10850 | AA15: =MID(RC[-12],FIND("+",RC[-12],1)+1,99)*IF(ISNUMBER(FIND("%",RC[-12],1)),10000,1) -> 750 | AB15: =MID(RC[-12],FIND("+",RC[-12],1)+1,99)*IF(ISNUMBER(FIND("%",RC[-12],1)),10000,1) -> 1500 | AC15: =MID(RC[-12],FIND("+",RC[-12],1)+1,99)*IF(ISNUMBER(FIND("%",RC[-12],1)),10000,1) -> 1500
A16: 407 | B16: 20407|21407|22407|23407 | C16: =RC[15]&"|"&RC[16] -> 1|11 | D16: =RC[20]&"|"&RC[21] -> 720|750 | E16: =RC[15]&"|"&RC[16] -> 1|11 | F16: =RC[20]&"|"&RC[21] -> 1085|750 | G16: =RC[15]&"|"&RC[16] -> 13|7 | H16: =RC[20]&"|"&RC[21] -> 1500|1500 | I16: 熔岩爆发 | K16: 紫品攻击套升橙 | L16: 攻击+720 | M16: 命中+7.5% | N16: 攻击+1085 | O16: 命中+7.5% | P16: 暴击+15% | Q16: 伤害+15% | R16: =VLOOKUP(MID(RC[-6],1,FIND("+",RC[-6],1)-1),IF({1,0},Sheet1!R8C2:R38C2,Sheet1!R8C1:R38C1),2,FALSE) -> 1 | S16: =VLOOKUP(MID(RC[-6],1,FIND("+",RC[-6],1)-1),IF({1,0},Sheet1!R8C2:R38C2,Sheet1!R8C1:R38C1),2,FALSE) -> 11 | T16: =VLOOKUP(MID(RC[-6],1,FIND("+",RC[-6],1)-1),IF({1,0},Sheet1!R8C2:R38C2,Sheet1!R8C1:R38C1),2,FALSE) -> 1 | U16: =VLOOKUP(MID(RC[-6],1,FIND("+",RC[-6],1)-1),IF({1,0},Sheet1!R8C2:R38C2,Sheet1!R8C1:R38C1),2,FALSE) -> 11 | V16: =VLOOKUP(MID(RC[-6],1,FIND("+",RC[-6],1)-1),IF({1,0},Sheet1!R8C2:R38C2,Sheet1!R8C1:R38C1),2,FALSE) -> 13 | W16: =VLOOKUP(MID(RC[-6],1,FIND("+",RC[-6],1)-1),IF({1,0},Sheet1!R8C2:R38C2,Sheet1!R8C1:R38C1),2,FALSE) -> 7 | X16: =MID(RC[-12],FIND("+",RC[-12],1)+1,99)*IF(ISNUMBER(FIND("%",RC[-12],1)),10000,1) -> 720 | Y16: =MID(RC[-12],FIND("+",RC[-12],1)+1,99)*IF(ISNUMBER(FIND("%",RC[-12],1)),10000,1) -> 750 | Z16: =MID(RC[-12],FIND("+",RC[-12],1)+1,99)*IF(ISNUMBER(FIND("%",RC[-12],1)),10000,1) -> 1085 | AA16: =MID(RC[-12],FIND("+",RC[-12],1)+1,99)*IF(ISNUMBER(FIND("%",RC[-12],1)),10000,1) -> 750 | AB16: =MID(RC[-12],FIND("+",RC[-12],1)+1,99)*IF(ISNUMBER(FIND("%",RC[-12],1)),10000,1) -> 1500 | AC16: =MID(RC[-12],FIND("+",RC[-12],1)+1,99)*IF(ISNUMBER(FIND("%",RC[-12],1)),10000,1) -> 1500
A17: 408 | B17: 20408|21408|22408|23408 | C17: =RC[15]&"|"&RC[16] -> 4|1 | D17: =RC[20]&"|"&RC[21] -> 4000|400 | E17: =RC[15]&"|"&RC[16] -> 4|1 | F17: =RC[20]&"|"&RC[21] -> 4000|400 | G17: =RC[15]&"|"&RC[16] -> 4|1 | H17: =RC[20]&"|"&RC[21] -> 4000|400 | I17: 苍鹰逐日 | K17: 紫品平衡套升橙 | L17: 生命+4000 | M17: 攻击+400 | N17: 生命+4000 | O17: 攻击+400 | P17: 生命+4000 | Q17: 攻击+400 | R17: =VLOOKUP(MID(RC[-6],1,FIND("+",RC[-6],1)-1),IF({1,0},Sheet1!R8C2:R38C2,Sheet1!R8C1:R38C1),2,FALSE) -> 4 | S17: =VLOOKUP(MID(RC[-6],1,FIND("+",RC[-6],1)-1),IF({1,0},Sheet1!R8C2:R38C2,Sheet1!R8C1:R38C1),2,FALSE) -> 1 | T17: =VLOOKUP(MID(RC[-6],1,FIND("+",RC[-6],1)-1),IF({1,0},Sheet1!R8C2:R38C2,Sheet1!R8C1:R38C1),2,FALSE) -> 4 | U17: =VLOOKUP(MID(RC[-6],1,FIND("+",RC[-6],1)-1),IF({1,0},Sheet1!R8C2:R38C2,Sheet1!R8C1:R38C1),2,FALSE) -> 1 | V17: =VLOOKUP(MID(RC[-6],1,FIND("+",RC[-6],1)-1),IF({1,0},Sheet1!R8C2:R38C2,Sheet1!R8C1:R38C1),2,FALSE) -> 4 | W17: =VLOOKUP(MID(RC[-6],1,FIND("+",RC[-6],1)-1),IF({1,0},Sheet1!R8C2:R38C2,Sheet1!R8C1:R38C1),2,FALSE) -> 1 | X17: =MID(RC[-12],FIND("+",RC[-12],1)+1,99)*IF(ISNUMBER(FIND("%",RC[-12],1)),10000,1) -> 4000 | Y17: =MID(RC[-12],FIND("+",RC[-12],1)+1,99)*IF(ISNUMBER(FIND("%",RC[-12],1)),10000,1) -> 400 | Z17: =MID(RC[-12],FIND("+",RC[-12],1)+1,99)*IF(ISNUMBER(FIND("%",RC[-12],1)),10000,1) -> 4000 | AA17: =MID(RC[-12],FIND("+",RC[-12],1)+1,99)*IF(ISNUMBER(FIND("%",RC[-12],1)),10000,1) -> 400 | AB17: =MID(RC[-12],FIND("+",RC[-12],1)+1,99)*IF(ISNUMBER(FIND("%",RC[-12],1)),10000,1) -> 4000 | AC17: =MID(RC[-12],FIND("+",RC[-12],1)+1,99)*IF(ISNUMBER(FIND("%",RC[-12],1)),10000,1) -> 400
A18: 502 | B18: 20502|21502|22502|23502 | C18: =RC[15]&"|"&RC[16] -> 4|1 | D18: =RC[20]&"|"&RC[21] -> 8150|815 | E18: =RC[15]&"|"&RC[16] -> 4|1 | F18: =RC[20]&"|"&RC[21] -> 12250|1225 | G18: =RC[15]&"|"&RC[16] -> 6|7 | H18: =RC[20]&"|"&RC[21] -> 3000|3000 | I18: 永恒终末 | K18: 红品平衡套 | L18: 生命+8150 | M18: 攻击+815 | N18: 生命+12250 | O18: 攻击+1225 | P18: 减伤+30% | Q18: 伤害+30% | R18: =VLOOKUP(MID(RC[-6],1,FIND("+",RC[-6],1)-1),IF({1,0},Sheet1!R8C2:R38C2,Sheet1!R8C1:R38C1),2,FALSE) -> 4 | S18: =VLOOKUP(MID(RC[-6],1,FIND("+",RC[-6],1)-1),IF({1,0},Sheet1!R8C2:R38C2,Sheet1!R8C1:R38C1),2,FALSE) -> 1 | T18: =VLOOKUP(MID(RC[-6],1,FIND("+",RC[-6],1)-1),IF({1,0},Sheet1!R8C2:R38C2,Sheet1!R8C1:R38C1),2,FALSE) -> 4 | U18: =VLOOKUP(MID(RC[-6],1,FIND("+",RC[-6],1)-1),IF({1,0},Sheet1!R8C2:R38C2,Sheet1!R8C1:R38C1),2,FALSE) -> 1 | V18: =VLOOKUP(MID(RC[-6],1,FIND("+",RC[-6],1)-1),IF({1,0},Sheet1!R8C2:R38C2,Sheet1!R8C1:R38C1),2,FALSE) -> 6 | W18: =VLOOKUP(MID(RC[-6],1,FIND("+",RC[-6],1)-1),IF({1,0},Sheet1!R8C2:R38C2,Sheet1!R8C1:R38C1),2,FALSE) -> 7 | X18: =MID(RC[-12],FIND("+",RC[-12],1)+1,99)*IF(ISNUMBER(FIND("%",RC[-12],1)),10000,1) -> 8150 | Y18: =MID(RC[-12],FIND("+",RC[-12],1)+1,99)*IF(ISNUMBER(FIND("%",RC[-12],1)),10000,1) -> 815 | Z18: =MID(RC[-12],FIND("+",RC[-12],1)+1,99)*IF(ISNUMBER(FIND("%",RC[-12],1)),10000,1) -> 12250 | AA18: =MID(RC[-12],FIND("+",RC[-12],1)+1,99)*IF(ISNUMBER(FIND("%",RC[-12],1)),10000,1) -> 1225 | AB18: =MID(RC[-12],FIND("+",RC[-12],1)+1,99)*IF(ISNUMBER(FIND("%",RC[-12],1)),10000,1) -> 3000 | AC18: =MID(RC[-12],FIND("+",RC[-12],1)+1,99)*IF(ISNUMBER(FIND("%",RC[-12],1)),10000,1) -> 3000
A19: 503 | B19: 20503|21503|22503|23503 | C19: =RC[15]&"|"&RC[16] -> 4|12 | D19: =RC[20]&"|"&RC[21] -> 12250|1250 | E19: =RC[15]&"|"&RC[16] -> 4|12 | F19: =RC[20]&"|"&RC[21] -> 18350|1250 | G19: =RC[15]&"|"&RC[16] -> 14|6 | H19: =RC[20]&"|"&RC[21] -> 2500|2500 | I19: 巨擘之主 | K19: 橙品防御套升红 | L19: 生命+12250 | M19: 闪避+12.5% | N19: 生命+18350 | O19: 闪避+12.5% | P19: 抗暴+25% | Q19: 减伤+25% | R19: =VLOOKUP(MID(RC[-6],1,FIND("+",RC[-6],1)-1),IF({1,0},Sheet1!R8C2:R38C2,Sheet1!R8C1:R38C1),2,FALSE) -> 4 | S19: =VLOOKUP(MID(RC[-6],1,FIND("+",RC[-6],1)-1),IF({1,0},Sheet1!R8C2:R38C2,Sheet1!R8C1:R38C1),2,FALSE) -> 12 | T19: =VLOOKUP(MID(RC[-6],1,FIND("+",RC[-6],1)-1),IF({1,0},Sheet1!R8C2:R38C2,Sheet1!R8C1:R38C1),2,FALSE) -> 4 | U19: =VLOOKUP(MID(RC[-6],1,FIND("+",RC[-6],1)-1),IF({1,0},Sheet1!R8C2:R38C2,Sheet1!R8C1:R38C1),2,FALSE) -> 12 | V19: =VLOOKUP(MID(RC[-6],1,FIND("+",RC[-6],1)-1),IF({1,0},Sheet1!R8C2:R38C2,Sheet1!R8C1:R38C1),2,FALSE) -> 14 | W19: =VLOOKUP(MID(RC[-6],1,FIND("+",RC[-6],1)-1),IF({1,0},Sheet1!R8C2:R38C2,Sheet1!R8C1:R38C1),2,FALSE) -> 6 | X19: =MID(RC[-12],FIND("+",RC[-12],1)+1,99)*IF(ISNUMBER(FIND("%",RC[-12],1)),10000,1) -> 12250 | Y19: =MID(RC[-12],FIND("+",RC[-12],1)+1,99)*IF(ISNUMBER(FIND("%",RC[-12],1)),10000,1) -> 1250 | Z19: =MID(RC[-12],FIND("+",RC[-12],1)+1,99)*IF(ISNUMBER(FIND("%",RC[-12],1)),10000,1) -> 18350 | AA19: =MID(RC[-12],FIND("+",RC[-12],1)+1,99)*IF(ISNUMBER(FIND("%",RC[-12],1)),10000,1) -> 1250 | AB19: =MID(RC[-12],FIND("+",RC[-12],1)+1,99)*IF(ISNUMBER(FIND("%",RC[-12],1)),10000,1) -> 2500 | AC19: =MID(RC[-12],FIND("+",RC[-12],1)+1,99)*IF(ISNUMBER(FIND("%",RC[-12],1)),10000,1) -> 2500
A20: 504 | B20: 20504|21504|22504|23504 | C20: =RC[15]&"|"&RC[16] -> 1|11 | D20: =RC[20]&"|"&RC[21] -> 1225|1250 | E20: =RC[15]&"|"&RC[16] -> 1|11 | F20: =RC[20]&"|"&RC[21] -> 1835|1250 | G20: =RC[15]&"|"&RC[16] -> 13|7 | H20: =RC[20]&"|"&RC[21] -> 2500|2500 | I20: 绝对领域 | K20: 橙品攻击套升红 | L20: 攻击+1225 | M20: 命中+12.5% | N20: 攻击+1835 | O20: 命中+12.5% | P20: 暴击+25% | Q20: 伤害+25% | R20: =VLOOKUP(MID(RC[-6],1,FIND("+",RC[-6],1)-1),IF({1,0},Sheet1!R8C2:R38C2,Sheet1!R8C1:R38C1),2,FALSE) -> 1 | S20: =VLOOKUP(MID(RC[-6],1,FIND("+",RC[-6],1)-1),IF({1,0},Sheet1!R8C2:R38C2,Sheet1!R8C1:R38C1),2,FALSE) -> 11 | T20: =VLOOKUP(MID(RC[-6],1,FIND("+",RC[-6],1)-1),IF({1,0},Sheet1!R8C2:R38C2,Sheet1!R8C1:R38C1),2,FALSE) -> 1 | U20: =VLOOKUP(MID(RC[-6],1,FIND("+",RC[-6],1)-1),IF({1,0},Sheet1!R8C2:R38C2,Sheet1!R8C1:R38C1),2,FALSE) -> 11 | V20: =VLOOKUP(MID(RC[-6],1,FIND("+",RC[-6],1)-1),IF({1,0},Sheet1!R8C2:R38C2,Sheet1!R8C1:R38C1),2,FALSE) -> 13 | W20: =VLOOKUP(MID(RC[-6],1,FIND("+",RC[-6],1)-1),IF({1,0},Sheet1!R8C2:R38C2,Sheet1!R8C1:R38C1),2,FALSE) -> 7 | X20: =MID(RC[-12],FIND("+",RC[-12],1)+1,99)*IF(ISNUMBER(FIND("%",RC[-12],1)),10000,1) -> 1225 | Y20: =MID(RC[-12],FIND("+",RC[-12],1)+1,99)*IF(ISNUMBER(FIND("%",RC[-12],1)),10000,1) -> 1250 | Z20: =MID(RC[-12],FIND("+",RC[-12],1)+1,99)*IF(ISNUMBER(FIND("%",RC[-12],1)),10000,1) -> 1835 | AA20: =MID(RC[-12],FIND("+",RC[-12],1)+1,99)*IF(ISNUMBER(FIND("%",RC[-12],1)),10000,1) -> 1250 | AB20: =MID(RC[-12],FIND("+",RC[-12],1)+1,99)*IF(ISNUMBER(FIND("%",RC[-12],1)),10000,1) -> 2500 | AC20: =MID(RC[-12],FIND("+",RC[-12],1)+1,99)*IF(ISNUMBER(FIND("%",RC[-12],1)),10000,1) -> 2500
A21: 505 | B21: 20505|21505|22505|23505 | C21: =RC[15]&"|"&RC[16] -> 4|1 | D21: =RC[20]&"|"&RC[21] -> 6800|680 | E21: =RC[15]&"|"&RC[16] -> 4|1 | F21: =RC[20]&"|"&RC[21] -> 6800|680 | G21: =RC[15]&"|"&RC[16] -> 4|1 | H21: =RC[20]&"|"&RC[21] -> 6800|680 | I21: 盖亚之灵 | K21: 橙品平衡套升红 | L21: 生命+6800 | M21: 攻击+680 | N21: 生命+6800 | O21: 攻击+680 | P21: 生命+6800 | Q21: 攻击+680 | R21: =VLOOKUP(MID(RC[-6],1,FIND("+",RC[-6],1)-1),IF({1,0},Sheet1!R8C2:R38C2,Sheet1!R8C1:R38C1),2,FALSE) -> 4 | S21: =VLOOKUP(MID(RC[-6],1,FIND("+",RC[-6],1)-1),IF({1,0},Sheet1!R8C2:R38C2,Sheet1!R8C1:R38C1),2,FALSE) -> 1 | T21: =VLOOKUP(MID(RC[-6],1,FIND("+",RC[-6],1)-1),IF({1,0},Sheet1!R8C2:R38C2,Sheet1!R8C1:R38C1),2,FALSE) -> 4 | U21: =VLOOKUP(MID(RC[-6],1,FIND("+",RC[-6],1)-1),IF({1,0},Sheet1!R8C2:R38C2,Sheet1!R8C1:R38C1),2,FALSE) -> 1 | V21: =VLOOKUP(MID(RC[-6],1,FIND("+",RC[-6],1)-1),IF({1,0},Sheet1!R8C2:R38C2,Sheet1!R8C1:R38C1),2,FALSE) -> 4 | W21: =VLOOKUP(MID(RC[-6],1,FIND("+",RC[-6],1)-1),IF({1,0},Sheet1!R8C2:R38C2,Sheet1!R8C1:R38C1),2,FALSE) -> 1 | X21: =MID(RC[-12],FIND("+",RC[-12],1)+1,99)*IF(ISNUMBER(FIND("%",RC[-12],1)),10000,1) -> 6800 | Y21: =MID(RC[-12],FIND("+",RC[-12],1)+1,99)*IF(ISNUMBER(FIND("%",RC[-12],1)),10000,1) -> 680 | Z21: =MID(RC[-12],FIND("+",RC[-12],1)+1,99)*IF(ISNUMBER(FIND("%",RC[-12],1)),10000,1) -> 6800 | AA21: =MID(RC[-12],FIND("+",RC[-12],1)+1,99)*IF(ISNUMBER(FIND("%",RC[-12],1)),10000,1) -> 680 | AB21: =MID(RC[-12],FIND("+",RC[-12],1)+1,99)*IF(ISNUMBER(FIND("%",RC[-12],1)),10000,1) -> 6800 | AC21: =MID(RC[-12],FIND("+",RC[-12],1)+1,99)*IF(ISNUMBER(FIND("%",RC[-12],1)),10000,1) -> 680
A22: 999 | B22: 20599|21599|22599|23599 | C22: 21 | D22: 100 | E22: 1|4 | F22: 100000|1000000 | G22: 7|5 | H22: 10000|10000 | I22: 屠龙套装

Sheet: 8.装备天赋
A1: id|id | B1: talent_level| | C1: intensify_level|need_enhance_level | D1: nature_type|pro_type_list | E1: nature_lst|pro_value_list | F1: name| | G1: nature_describe|
A2: 不可空 | B2: 不可空 | C2: 不可空 | D2: 不可空 | E2: 不可空 | F2: 不可空 | G2: 不可空
A3: 数字 | B3: 数字 | C3: 数字 | D3: 一维数组 | E3: 一维数组 | F3: 字符串 | G3: 字符串
D4: 不定长 | E4: 不定长
A6: 天赋ID | B6: 天赋等级 | C6: 需要的强化等级 | D6: 属性类型列表 | E6: 属性值列表 | F6: 名字 | G6: 属性描述
A7: 302 | B7: 1 | C7: 20 | D7: =IF(RC2=1,RC[7],R[-1]C&"|"&RC[7]) -> 1 | E7: =IF(RC2=1,RC[7],R[-1]C&"|"&RC[7]) -> 100 | F7: 天赋 1 | G7: =VLOOKUP(RC[4],Sheet1!R8C1:R38C3,2,FALSE)&"+"&IF(VLOOKUP(RC[4],Sheet1!R8C1:R38C3,3,FALSE)="固定值",RC[5],RC[5]/100&"%") -> 攻击+100 | I7: 3 | J7: 1 | K7: 1 | L7: =VLOOKUP(INT(MOD(RC[-11],1000)/100),R7C9:R9C10,2,FALSE)*RC[-10]*100 -> 100
A8: 302 | B8: 2 | C8: 40 | D8: =IF(RC2=1,RC[7],R[-1]C&"|"&RC[7]) -> 1|8 | E8: =IF(RC2=1,RC[7],R[-1]C&"|"&RC[7]) -> 100|200 | F8: 天赋 2 | G8: =VLOOKUP(RC[4],Sheet1!R8C1:R38C3,2,FALSE)&"+"&IF(VLOOKUP(RC[4],Sheet1!R8C1:R38C3,3,FALSE)="固定值",RC[5],RC[5]/100&"%") -> 附伤+200 | I8: 4 | J8: 1.5 | K8: 8 | L8: =VLOOKUP(INT(MOD(RC[-11],1000)/100),R7C9:R9C10,2,FALSE)*RC[-10]*100 -> 200
A9: 302 | B9: 3 | C9: 60 | D9: =IF(RC2=1,RC[7],R[-1]C&"|"&RC[7]) -> 1|8|1 | E9: =IF(RC2=1,RC[7],R[-1]C&"|"&RC[7]) -> 100|200|300 | F9: 天赋 3 | G9: =VLOOKUP(RC[4],Sheet1!R8C1:R38C3,2,FALSE)&"+"&IF(VLOOKUP(RC[4],Sheet1!R8C1:R38C3,3,FALSE)="固定值",RC[5],RC[5]/100&"%") -> 攻击+300 | I9: 5 | J9: 2 | K9: 1 | L9: =VLOOKUP(INT(MOD(RC[-11],1000)/100),R7C9:R9C10,2,FALSE)*RC[-10]*100 -> 300
A10: 302 | B10: 4 | C10: 80 | D10: =IF(RC2=1,RC[7],R[-1]C&"|"&RC[7]) -> 1|8|1|7 | E10: =IF(RC2=1,RC[7],R[-1]C&"|"&RC[7]) -> 100|200|300|400 | F10: 天赋 4 | G10: =VLOOKUP(RC[4],Sheet1!R8C1:R38C3,2,FALSE)&"+"&IF(VLOOKUP(RC[4],Sheet1!R8C1:R38C3,3,FALSE)="固定值",RC[5],RC[5]/100&"%") -> 伤害+4% | K10: 7 | L10: =VLOOKUP(INT(MOD(RC[-11],1000)/100),R7C9:R9C10,2,FALSE)*RC[-10]*100 -> 400
A11: 302 | B11: 5 | C11: 100 | D11: =IF(RC2=1,RC[7],R[-1]C&"|"&RC[7]) -> 1|8|1|7|1 | E11: =IF(RC2=1,RC[7],R[-1]C&"|"&RC[7]) -> 100|200|300|400|500 | F11: 天赋 5 | G11: =VLOOKUP(RC[4],Sheet1!R8C1:R38C3,2,FALSE)&"+"&IF(VLOOKUP(RC[4],Sheet1!R8C1:R38C3,3,FALSE)="固定值",RC[5],RC[5]/100&"%") -> 攻击+500 | K11: 1 | L11: =VLOOKUP(INT(MOD(RC[-11],1000)/100),R7C9:R9C10,2,FALSE)*RC[-10]*100 -> 500
A12: 302 | B12: 6 | C12: 120 | D12: =IF(RC2=1,RC[7],R[-1]C&"|"&RC[7]) -> 1|8|1|7|1|22 | E12: =IF(RC2=1,RC[7],R[-1]C&"|"&RC[7]) -> 100|200|300|400|500|600 | F12: 天赋 6 | G12: =VLOOKUP(RC[4],Sheet1!R8C1:R38C3,2,FALSE)&"+"&IF(VLOOKUP(RC[4],Sheet1!R8C1:R38C3,3,FALSE)="固定值",RC[5],RC[5]/100&"%") -> 攻击+6% | K12: 22 | L12: =VLOOKUP(INT(MOD(RC[-11],1000)/100),R7C9:R9C10,2,FALSE)*RC[-10]*100 -> 600
A13: 302 | B13: 7 | C13: 140 | D13: =IF(RC2=1,RC[7],R[-1]C&"|"&RC[7]) -> 1|8|1|7|1|22|1 | E13: =IF(RC2=1,RC[7],R[-1]C&"|"&RC[7]) -> 100|200|300|400|500|600|700 | F13: 天赋 7 | G13: =VLOOKUP(RC[4],Sheet1!R8C1:R38C3,2,FALSE)&"+"&IF(VLOOKUP(RC[4],Sheet1!R8C1:R38C3,3,FALSE)="固定值",RC[5],RC[5]/100&"%") -> 攻击+700 | K13: 1 | L13: =VLOOKUP(INT(MOD(RC[-11],1000)/100),R7C9:R9C10,2,FALSE)*RC[-10]*100 -> 700
A14: 302 | B14: 8 | C14: 160 | D14: =IF(RC2=1,RC[7],R[-1]C&"|"&RC[7]) -> 1|8|1|7|1|22|1|13 | E14: =IF(RC2=1,RC[7],R[-1]C&"|"&RC[7]) -> 100|200|300|400|500|600|700|800 | F14: 天赋 8 | G14: =VLOOKUP(RC[4],Sheet1!R8C1:R38C3,2,FALSE)&"+"&IF(VLOOKUP(RC[4],Sheet1!R8C1:R38C3,3,FALSE)="固定值",RC[5],RC[5]/100&"%") -> 暴击+8% | K14: 13 | L14: =VLOOKUP(INT(MOD(RC[-11],1000)/100),R7C9:R9C10,2,FALSE)*RC[-10]*100 -> 800
A15: 302 | B15: 9 | C15: 180 | D15: =IF(RC2=1,RC[7],R[-1]C&"|"&RC[7]) -> 1|8|1|7|1|22|1|13|1 | E15: =IF(RC2=1,RC[7],R[-1]C&"|"&RC[7]) -> 100|200|300|400|500|600|700|800|900 | F15: 天赋 9 | G15: =VLOOKUP(RC[4],Sheet1!R8C1:R38C3,2,FALSE)&"+"&IF(VLOOKUP(RC[4],Sheet1!R8C1:R38C3,3,FALSE)="固定值",RC[5],RC[5]/100&"%") -> 攻击+900 | K15: 1 | L15: =VLOOKUP(INT(MOD(RC[-11],1000)/100),R7C9:R9C10,2,FALSE)*RC[-10]*100 -> 900
A16: 302 | B16: 10 | C16: 200 | D16: =IF(RC2=1,RC[7],R[-1]C&"|"&RC[7]) -> 1|8|1|7|1|22|1|13|1|22 | E16: =IF(RC2=1,RC[7],R[-1]C&"|"&RC[7]) -> 100|200|300|400|500|600|700|800|900|1000 | F16: 天赋 10 | G16: =VLOOKUP(RC[4],Sheet1!R8C1:R38C3,2,FALSE)&"+"&IF(VLOOKUP(RC[4],Sheet1!R8C1:R38C3,3,FALSE)="固定值",RC[5],RC[5]/100&"%") -> 攻击+10% | K16: 22 | L16: =VLOOKUP(INT(MOD(RC[-11],1000)/100),R7C9:R9C10,2,FALSE)*RC[-10]*100 -> 1000
A17: 303 | B17: 1 | C17: 20 | D17: =IF(RC2=1,RC[7],R[-1]C&"|"&RC[7]) -> 1 | E17: =IF(RC2=1,RC[7],R[-1]C&"|"&RC[7]) -> 100 | F17: 天赋 1 | G17: =VLOOKUP(RC[4],Sheet1!R8C1:R38C3,2,FALSE)&"+"&IF(VLOOKUP(RC[4],Sheet1!R8C1:R38C3,3,FALSE)="固定值",RC[5],RC[5]/100&"%") -> 攻击+100 | K17: 1 | L17: =VLOOKUP(INT(MOD(RC[-11],1000)/100),R7C9:R9C10,2,FALSE)*RC[-10]*100 -> 100
A18: 303 | B18: 2 | C18: 40 | D18: =IF(RC2=1,RC[7],R[-1]C&"|"&RC[7]) -> 1|8 | E18: =IF(RC2=1,RC[7],R[-1]C&"|"&RC[7]) -> 100|200 | F18: 天赋 2 | G18: =VLOOKUP(RC[4],Sheet1!R8C1:R38C3,2,FALSE)&"+"&IF(VLOOKUP(RC[4],Sheet1!R8C1:R38C3,3,FALSE)="固定值",RC[5],RC[5]/100&"%") -> 附伤+200 | K18: 8 | L18: =VLOOKUP(INT(MOD(RC[-11],1000)/100),R7C9:R9C10,2,FALSE)*RC[-10]*100 -> 200
A19: 303 | B19: 3 | C19: 60 | D19: =IF(RC2=1,RC[7],R[-1]C&"|"&RC[7]) -> 1|8|1 | E19: =IF(RC2=1,RC[7],R[-1]C&"|"&RC[7]) -> 100|200|300 | F19: 天赋 3 | G19: =VLOOKUP(RC[4],Sheet1!R8C1:R38C3,2,FALSE)&"+"&IF(VLOOKUP(RC[4],Sheet1!R8C1:R38C3,3,FALSE)="固定值",RC[5],RC[5]/100&"%") -> 攻击+300 | K19: 1 | L19: =VLOOKUP(INT(MOD(RC[-11],1000)/100),R7C9:R9C10,2,FALSE)*RC[-10]*100 -> 300
A20: 303 | B20: 4 | C20: 80 | D20: =IF(RC2=1,RC[7],R[-1]C&"|"&RC[7]) -> 1|8|1|7 | E20: =IF(RC2=1,RC[7],R[-1]C&"|"&RC[7]) -> 100|200|300|400 | F20: 天赋 4 | G20: =VLOOKUP(RC[4],Sheet1!R8C1:R38C3,2,FALSE)&"+"&IF(VLOOKUP(RC[4],Sheet1!R8C1:R38C3,3,FALSE)="固定值",RC[5],RC[5]/100&"%") -> 伤害+4% | K20: 7 | L20: =VLOOKUP(INT(MOD(RC[-11],1000)/100),R7C9:R9C10,2,FALSE)*RC[-10]*100 -> 400
A21: 303 | B21: 5 | C21: 100 | D21: =IF(RC2=1,RC[7],R[-1]C&"|"&RC[7]) -> 1|8|1|7|1 | E21: =IF(RC2=1,RC[7],R[-1]C&"|"&RC[7]) -> 100|200|300|400|500 | F21: 天赋 5 | G21: =VLOOKUP(RC[4],Sheet1!R8C1:R38C3,2,FALSE)&"+"&IF(VLOOKUP(RC[4],Sheet1!R8C1:R38C3,3,FALSE)="固定值",RC[5],RC[5]/100&"%") -> 攻击+500 | K21: 1 | L21: =VLOOKUP(INT(MOD(RC[-11],1000)/100),R7C9:R9C10,2,FALSE)*RC[-10]*100 -> 500
A22: 303 | B22: 6 | C22: 120 | D22: =IF(RC2=1,RC[7],R[-1]C&"|"&RC[7]) -> 1|8|1|7|1|22 | E22: =IF(RC2=1,RC[7],R[-1]C&"|"&RC[7]) -> 100|200|300|400|500|600 | F22: 天赋 6 | G22: =VLOOKUP(RC[4],Sheet1!R8C1:R38C3,2,FALSE)&"+"&IF(VLOOKUP(RC[4],Sheet1!R8C1:R38C3,3,FALSE)="固定值",RC[5],RC[5]/100&"%") -> 攻击+6% | K22: 22 | L22: =VLOOKUP(INT(MOD(RC[-11],1000)/100),R7C9:R9C10,2,FALSE)*RC[-10]*100 -> 600
A23: 303 | B23: 7 | C23: 140 | D23: =IF(RC2=1,RC[7],R[-1]C&"|"&RC[7]) -> 1|8|1|7|1|22|1 | E23: =IF(RC2=1,RC[7],R[-1]C&"|"&RC[7]) -> 100|200|300|400|500|600|700 | F23: 天赋 7 | G23: =VLOOKUP(RC[4],Sheet1!R8C1:R38C3,2,FALSE)&"+"&IF(VLOOKUP(RC[4],Sheet1!R8C1:R38C3,3,FALSE)="固定值",RC[5],RC[5]/100&"%") -> 攻击+700 | K23: 1 | L23: =VLOOKUP(INT(MOD(RC[-11],1000)/100),R7C9:R9C10,2,FALSE)*RC[-10]*100 -> 700
A24: 303 | B24: 8 | C24: 160 | D24: =IF(RC2=1,RC[7],R[-1]C&"|"&RC[7]) -> 1|8|1|7|1|22|1|13 | E24: =IF(RC2=1,RC[7],R[-1]C&"|"&RC[7]) -> 100|200|300|400|500|600|700|800 | F24: 天赋 8 | G24: =VLOOKUP(RC[4],Sheet1!R8C1:R38C3,2,FALSE)&"+"&IF(VLOOKUP(RC[4],Sheet1!R8C1:R38C3,3,FALSE)="固定值",RC[5],RC[5]/100&"%") -> 暴击+8% | K24: 13 | L24: =VLOOKUP(INT(MOD(RC[-11],1000)/100),R7C9:R9C10,2,FALSE)*RC[-10]*100 -> 800
A25: 303 | B25: 9 | C25: 180 | D25: =IF(RC2=1,RC[7],R[-1]C&"|"&RC[7]) -> 1|8|1|7|1|22|1|13|1 | E25: =IF(RC2=1,RC[7],R[-1]C&"|"&RC[7]) -> 100|200|300|400|500|600|700|800|900 | F25: 天赋 9 | G25: =VLOOKUP(RC[4],Sheet1!R8C1:R38C3,2,FALSE)&"+"&IF(VLOOKUP(RC[4],Sheet1!R8C1:R38C3,3,FALSE)="固定值",RC[5],RC[5]/100&"%") -> 攻击+900 | K25: 1 | L25: =VLOOKUP(INT(MOD(RC[-11],1000)/100),R7C9:R9C10,2,FALSE)*RC[-10]*100 -> 900
A26: 303 | B26: 10 | C26: 200 | D26: =IF(RC2=1,RC[7],R[-1]C&"|"&RC[7]) -> 1|8|1|7|1|22|1|13|1|22 | E26: =IF(RC2=1,RC[7],R[-1]C&"|"&RC[7]) -> 100|200|300|400|500|600|700|800|900|1000 | F26: 天赋 10 | G26: =VLOOKUP(RC[4],Sheet1!R8C1:R38C3,2,FALSE)&"+"&IF(VLOOKUP(RC[4],Sheet1!R8C1:R38C3,3,FALSE)="固定值",RC[5],RC[5]/100&"%") -> 攻击+10% | K26: 22 | L26: =VLOOKUP(INT(MOD(RC[-11],1000)/100),R7C9:R9C10,2,FALSE)*RC[-10]*100 -> 1000
A27: 304 | B27: 1 | C27: 20 | D27: =IF(RC2=1,RC[7],R[-1]C&"|"&RC[7]) -> 1 | E27: =IF(RC2=1,RC[7],R[-1]C&"|"&RC[7]) -> 100 | F27: 天赋 1 | G27: =VLOOKUP(RC[4],Sheet1!R8C1:R38C3,2,FALSE)&"+"&IF(VLOOKUP(RC[4],Sheet1!R8C1:R38C3,3,FALSE)="固定值",RC[5],RC[5]/100&"%") -> 攻击+100 | K27: 1 | L27: =VLOOKUP(INT(MOD(RC[-11],1000)/100),R7C9:R9C10,2,FALSE)*RC[-10]*100 -> 100
A28: 304 | B28: 2 | C28: 40 | D28: =IF(RC2=1,RC[7],R[-1]C&"|"&RC[7]) -> 1|8 | E28: =IF(RC2=1,RC[7],R[-1]C&"|"&RC[7]) -> 100|200 | F28: 天赋 2 | G28: =VLOOKUP(RC[4],Sheet1!R8C1:R38C3,2,FALSE)&"+"&IF(VLOOKUP(RC[4],Sheet1!R8C1:R38C3,3,FALSE)="固定值",RC[5],RC[5]/100&"%") -> 附伤+200 | K28: 8 | L28: =VLOOKUP(INT(MOD(RC[-11],1000)/100),R7C9:R9C10,2,FALSE)*RC[-10]*100 -> 200
A29: 304 | B29: 3 | C29: 60 | D29: =IF(RC2=1,RC[7],R[-1]C&"|"&RC[7]) -> 1|8|1 | E29: =IF(RC2=1,RC[7],R[-1]C&"|"&RC[7]) -> 100|200|300 | F29: 天赋 3 | G29: =VLOOKUP(RC[4],Sheet1!R8C1:R38C3,2,FALSE)&"+"&IF(VLOOKUP(RC[4],Sheet1!R8C1:R38C3,3,FALSE)="固定值",RC[5],RC[5]/100&"%") -> 攻击+300 | K29: 1 | L29: =VLOOKUP(INT(MOD(RC[-11],1000)/100),R7C9:R9C10,2,FALSE)*RC[-10]*100 -> 300
A30: 304 | B30: 4 | C30: 80 | D30: =IF(RC2=1,RC[7],R[-1]C&"|"&RC[7]) -> 1|8|1|7 | E30: =IF(RC2=1,RC[7],R[-1]C&"|"&RC[7]) -> 100|200|300|400 | F30: 天赋 4 | G30: =VLOOKUP(RC[4],Sheet1!R8C1:R38C3,2,FALSE)&"+"&IF(VLOOKUP(RC[4],Sheet1!R8C1:R38C3,3,FALSE)="固定值",RC[5],RC[5]/100&"%") -> 伤害+4% | K30: 7 | L30: =VLOOKUP(INT(MOD(RC[-11],1000)/100),R7C9:R9C10,2,FALSE)*RC[-10]*100 -> 400
A31: 304 | B31: 5 | C31: 100 | D31: =IF(RC2=1,RC[7],R[-1]C&"|"&RC[7]) -> 1|8|1|7|1 | E31: =IF(RC2=1,RC[7],R[-1]C&"|"&RC[7]) -> 100|200|300|400|500 | F31: 天赋 5 | G31: =VLOOKUP(RC[4],Sheet1!R8C1:R38C3,2,FALSE)&"+"&IF(VLOOKUP(RC[4],Sheet1!R8C1:R38C3,3,FALSE)="固定值",RC[5],RC[5]/100&"%") -> 攻击+500 | K31: 1 | L31: =VLOOKUP(INT(MOD(RC[-11],1000)/100),R7C9:R9C10,2,FALSE)*RC[-10]*100 -> 500
A32: 304 | B32: 6 | C32: 120 | D32: =IF(RC2=1,RC[7],R[-1]C&"|"&RC[7]) -> 1|8|1|7|1|22 | E32: =IF(RC2=1,RC[7],R[-1]C&"|"&RC[7]) -> 100|200|300|400|500|600 | F32: 天赋 6 | G32: =VLOOKUP(RC[4],Sheet1!R8C1:R38C3,2,FALSE)&"+"&IF(VLOOKUP(RC[4],Sheet1!R8C1:R38C3,3,FALSE)="固定值",RC[5],RC[5]/100&"%") -> 攻击+6% | K32: 22 | L32: =VLOOKUP(INT(MOD(RC[-11],1000)/100),R7C9:R9C10,2,FALSE)*RC[-10]*100 -> 600
A33: 304 | B33: 7 | C33: 140 | D33: =IF(RC2=1,RC[7],R[-1]C&"|"&RC[7]) -> 1|8|1|7|1|22|1 | E33: =IF(RC2=1,RC[7],R[-1]C&"|"&RC[7]) -> 100|200|300|400|500|600|700 | F33: 天赋 7 | G33: =VLOOKUP(RC[4],Sheet1!R8C1:R38C3,2,FALSE)&"+"&IF(VLOOKUP(RC[4],Sheet1!R8C1:R38C3,3,FALSE)="固定值",RC[5],RC[5]/100&"%") -> 攻击+700 | K33: 1 | L33: =VLOOKUP(INT(MOD(RC[-11],1000)/100),R7C9:R9C10,2,FALSE)*RC[-10]*100 -> 700
A34: 304 | B34: 8 | C34: 160 | D34: =IF(RC2=1,RC[7],R[-1]C&"|"&RC[7]) -> 1|8|1|7|1|22|1|13 | E34: =IF(RC2=1,RC[7],R[-1]C&"|"&RC[7]) -> 100|200|300|400|500|600|700|800 | F34: 天赋 8 | G34: =VLOOKUP(RC[4],Sheet1!R8C1:R38C3,2,FALSE)&"+"&IF(VLOOKUP(RC[4],Sheet1!R8C1:R38C3,3,FALSE)="固定值",RC[5],RC[5]/100&"%") -> 暴击+8% | K34: 13 | L34: =VLOOKUP(INT(MOD(RC[-11],1000)/100),R7C9:R9C10,2,FALSE)*RC[-10]*100 -> 800
A35: 304 | B35: 9 | C35: 180 | D35: =IF(RC2=1,RC[7],R[-1]C&"|"&RC[7]) -> 1|8|1|7|1|22|1|13|1 | E35: =IF(RC2=1,RC[7],R[-1]C&"|"&RC[7]) -> 100|200|300|400|500|600|700|800|900 | F35: 天赋 9 | G35: =VLOOKUP(RC[4],Sheet1!R8C1:R38C3,2,FALSE)&"+"&IF(VLOOKUP(RC[4],Sheet1!R8C1:R38C3,3,FALSE)="固定值",RC[5],RC[5]/100&"%") -> 攻击+900 | K35: 1 | L35: =VLOOKUP(INT(MOD(RC[-11],1000)/100),R7C9:R9C10,2,FALSE)*RC[-10]*100 -> 900
A36: 304 | B36: 10 | C36: 200 | D36: =IF(RC2=1,RC[7],R[-1]C&"|"&RC[7]) -> 1|8|1|7|1|22|1|13|1|22 | E36: =IF(RC2=1,RC[7],R[-1]C&"|"&RC[7]) -> 100|200|300|400|500|600|700|800|900|1000 | F36: 天赋 10 | G36: =VLOOKUP(RC[4],Sheet1!R8C1:R38C3,2,FALSE)&"+"&IF(VLOOKUP(RC[4],Sheet1!R8C1:R38C3,3,FALSE)="固定值",RC[5],RC[5]/100&"%") -> 攻击+10% | K36: 22 | L36: =VLOOKUP(INT(MOD(RC[-11],1000)/100),R7C9:R9C10,2,FALSE)*RC[-10]*100 -> 1000
A37: 305 | B37: 1 | C37: 20 | D37: =IF(RC2=1,RC[7],R[-1]C&"|"&RC[7]) -> 1 | E37: =IF(RC2=1,RC[7],R[-1]C&"|"&RC[7]) -> 100 | F37: 天赋 1 | G37: =VLOOKUP(RC[4],Sheet1!R8C1:R38C3,2,FALSE)&"+"&IF(VLOOKUP(RC[4],Sheet1!R8C1:R38C3,3,FALSE)="固定值",RC[5],RC[5]/100&"%") -> 攻击+100 | K37: 1 | L37: =VLOOKUP(INT(MOD(RC[-11],1000)/100),R7C9:R9C10,2,FALSE)*RC[-10]*100 -> 100
A38: 305 | B38: 2 | C38: 40 | D38: =IF(RC2=1,RC[7],R[-1]C&"|"&RC[7]) -> 1|8 | E38: =IF(RC2=1,RC[7],R[-1]C&"|"&RC[7]) -> 100|200 | F38: 天赋 2 | G38: =VLOOKUP(RC[4],Sheet1!R8C1:R38C3,2,FALSE)&"+"&IF(VLOOKUP(RC[4],Sheet1!R8C1:R38C3,3,FALSE)="固定值",RC[5],RC[5]/100&"%") -> 附伤+200 | K38: 8 | L38: =VLOOKUP(INT(MOD(RC[-11],1000)/100),R7C9:R9C10,2,FALSE)*RC[-10]*100 -> 200
A39: 305 | B39: 3 | C39: 60 | D39: =IF(RC2=1,RC[7],R[-1]C&"|"&RC[7]) -> 1|8|1 | E39: =IF(RC2=1,RC[7],R[-1]C&"|"&RC[7]) -> 100|200|300 | F39: 天赋 3 | G39: =VLOOKUP(RC[4],Sheet1!R8C1:R38C3,2,FALSE)&"+"&IF(VLOOKUP(RC[4],Sheet1!R8C1:R38C3,3,FALSE)="固定值",RC[5],RC[5]/100&"%") -> 攻击+300 | K39: 1 | L39: =VLOOKUP(INT(MOD(RC[-11],1000)/100),R7C9:R9C10,2,FALSE)*RC[-10]*100 -> 300
A40: 305 | B40: 4 | C40: 80 | D40: =IF(RC2=1,RC[7],R[-1]C&"|"&RC[7]) -> 1|8|1|7 | E40: =IF(RC2=1,RC[7],R[-1]C&"|"&RC[7]) -> 100|200|300|400 | F40: 天赋 4 | G40: =VLOOKUP(RC[4],Sheet1!R8C1:R38C3,2,FALSE)&"+"&IF(VLOOKUP(RC[4],Sheet1!R8C1:R38C3,3,FALSE)="固定值",RC[5],RC[5]/100&"%") -> 伤害+4% | K40: 7 | L40: =VLOOKUP(INT(MOD(RC[-11],1000)/100),R7C9:R9C10,2,FALSE)*RC[-10]*100 -> 400
A41: 305 | B41: 5 | C41: 100 | D41: =IF(RC2=1,RC[7],R[-1]C&"|"&RC[7]) -> 1|8|1|7|1 | E41: =IF(RC2=1,RC[7],R[-1]C&"|"&RC[7]) -> 100|200|300|400|500 | F41: 天赋 5 | G41: =VLOOKUP(RC[4],Sheet1!R8C1:R38C3,2,FALSE)&"+"&IF(VLOOKUP(RC[4],Sheet1!R8C1:R38C3,3,FALSE)="固定值",RC[5],RC[5]/100&"%") -> 攻击+500 | K41: 1 | L41: =VLOOKUP(INT(MOD(RC[-11],1000)/100),R7C9:R9C10,2,FALSE)*RC[-10]*100 -> 500
A42: 305 | B42: 6 | C42: 120 | D42: =IF(RC2=1,RC[7],R[-1]C&"|"&RC[7]) -> 1|8|1|7|1|22 | E42: =IF(RC2=1,RC[7],R[-1]C&"|"&RC[7]) -> 100|200|300|400|500|600 | F42: 天赋 6 | G42: =VLOOKUP(RC[4],Sheet1!R8C1:R38C3,2,FALSE)&"+"&IF(VLOOKUP(RC[4],Sheet1!R8C1:R38C3,3,FALSE)="固定值",RC[5],RC[5]/100&"%") -> 攻击+6% | K42: 22 | L42: =VLOOKUP(INT(MOD(RC[-11],1000)/100),R7C9:R9C10,2,FALSE)*RC[-10]*100 -> 600
A43: 305 | B43: 7 | C43: 140 | D43: =IF(RC2=1,RC[7],R[-1]C&"|"&RC[7]) -> 1|8|1|7|1|22|1 | E43: =IF(RC2=1,RC[7],R[-1]C&"|"&RC[7]) -> 100|200|300|400|500|600|700 | F43: 天赋 7 | G43: =VLOOKUP(RC[4],Sheet1!R8C1:R38C3,2,FALSE)&"+"&IF(VLOOKUP(RC[4],Sheet1!R8C1:R38C3,3,FALSE)="固定值",RC[5],RC[5]/100&"%") -> 攻击+700 | K43: 1 | L43: =VLOOKUP(INT(MOD(RC[-11],1000)/100),R7C9:R9C10,2,FALSE)*RC[-10]*100 -> 700
A44: 305 | B44: 8 | C44: 160 | D44: =IF(RC2=1,RC[7],R[-1]C&"|"&RC[7]) -> 1|8|1|7|1|22|1|13 | E44: =IF(RC2=1,RC[7],R[-1]C&"|"&RC[7]) -> 100|200|300|400|500|600|700|800 | F44: 天赋 8 | G44: =VLOOKUP(RC[4],Sheet1!R8C1:R38C3,2,FALSE)&"+"&IF(VLOOKUP(RC[4],Sheet1!R8C1:R38C3,3,FALSE)="固定值",RC[5],RC[5]/100&"%") -> 暴击+8% | K44: 13 | L44: =VLOOKUP(INT(MOD(RC[-11],1000)/100),R7C9:R9C10,2,FALSE)*RC[-10]*100 -> 800
A45: 305 | B45: 9 | C45: 180 | D45: =IF(RC2=1,RC[7],R[-1]C&"|"&RC[7]) -> 1|8|1|7|1|22|1|13|1 | E45: =IF(RC2=1,RC[7],R[-1]C&"|"&RC[7]) -> 100|200|300|400|500|600|700|800|900 | F45: 天赋 9 | G45: =VLOOKUP(RC[4],Sheet1!R8C1:R38C3,2,FALSE)&"+"&IF(VLOOKUP(RC[4],Sheet1!R8C1:R38C3,3,FALSE)="固定值",RC[5],RC[5]/100&"%") -> 攻击+900 | K45: 1 | L45: =VLOOKUP(INT(MOD(RC[-11],1000)/100),R7C9:R9C10,2,FALSE)*RC[-10]*100 -> 900
A46: 305 | B46: 10 | C46: 200 | D46: =IF(RC2=1,RC[7],R[-1]C&"|"&RC[7]) -> 1|8|1|7|1|22|1|13|1|22 | E46: =IF(RC2=1,RC[7],R[-1]C&"|"&RC[7]) -> 100|200|300|400|500|600|700|800|900|1000 | F46: 天赋 10 | G46: =VLOOKUP(RC[4],Sheet1!R8C1:R38C3,2,FALSE)&"+"&IF(VLOOKUP(RC[4],Sheet1!R8C1:R38C3,3,FALSE)="固定值",RC[5],RC[5]/100&"%") -> 攻击+10% | K46: 22 | L46: =VLOOKUP(INT(MOD(RC[-11],1000)/100),R7C9:R9C10,2,FALSE)*RC[-10]*100 -> 1000
A47: 401 | B47: 1 | C47: 20 | D47: =IF(RC2=1,RC[7],R[-11]C&"|"&RC[7]) -> 1 | E47: =IF(RC2=1,RC[7],R[-11]C&"|"&RC[7]) -> 150 | F47: 天赋 1 | G47: =VLOOKUP(RC[4],Sheet1!R8C1:R38C3,2,FALSE)&"+"&IF(VLOOKUP(RC[4],Sheet1!R8C1:R38C3,3,FALSE)="固定值",RC[5],RC[5]/100&"%") -> 攻击+150 | K47: 1 | L47: =VLOOKUP(INT(MOD(RC[-11],1000)/100),R7C9:R9C10,2,FALSE)*RC[-10]*100 -> 150
A48: 401 | B48: 2 | C48: 40 | D48: =IF(RC2=1,RC[7],R[-1]C&"|"&RC[7]) -> 1|8 | E48: =IF(RC2=1,RC[7],R[-1]C&"|"&RC[7]) -> 150|300 | F48: 天赋 2 | G48: =VLOOKUP(RC[4],Sheet1!R8C1:R38C3,2,FALSE)&"+"&IF(VLOOKUP(RC[4],Sheet1!R8C1:R38C3,3,FALSE)="固定值",RC[5],RC[5]/100&"%") -> 附伤+300 | K48: 8 | L48: =VLOOKUP(INT(MOD(RC[-11],1000)/100),R7C9:R9C10,2,FALSE)*RC[-10]*100 -> 300
A49: 401 | B49: 3 | C49: 60 | D49: =IF(RC2=1,RC[7],R[-1]C&"|"&RC[7]) -> 1|8|1 | E49: =IF(RC2=1,RC[7],R[-1]C&"|"&RC[7]) -> 150|300|450 | F49: 天赋 3 | G49: =VLOOKUP(RC[4],Sheet1!R8C1:R38C3,2,FALSE)&"+"&IF(VLOOKUP(RC[4],Sheet1!R8C1:R38C3,3,FALSE)="固定值",RC[5],RC[5]/100&"%") -> 攻击+450 | K49: 1 | L49: =VLOOKUP(INT(MOD(RC[-11],1000)/100),R7C9:R9C10,2,FALSE)*RC[-10]*100 -> 450
A50: 401 | B50: 4 | C50: 80 | D50: =IF(RC2=1,RC[7],R[-1]C&"|"&RC[7]) -> 1|8|1|7 | E50: =IF(RC2=1,RC[7],R[-1]C&"|"&RC[7]) -> 150|300|450|600 | F50: 天赋 4 | G50: =VLOOKUP(RC[4],Sheet1!R8C1:R38C3,2,FALSE)&"+"&IF(VLOOKUP(RC[4],Sheet1!R8C1:R38C3,3,FALSE)="固定值",RC[5],RC[5]/100&"%") -> 伤害+6% | K50: 7 | L50: =VLOOKUP(INT(MOD(RC[-11],1000)/100),R7C9:R9C10,2,FALSE)*RC[-10]*100 -> 600
A51: 401 | B51: 5 | C51: 100 | D51: =IF(RC2=1,RC[7],R[-1]C&"|"&RC[7]) -> 1|8|1|7|1 | E51: =IF(RC2=1,RC[7],R[-1]C&"|"&RC[7]) -> 150|300|450|600|750 | F51: 天赋 5 | G51: =VLOOKUP(RC[4],Sheet1!R8C1:R38C3,2,FALSE)&"+"&IF(VLOOKUP(RC[4],Sheet1!R8C1:R38C3,3,FALSE)="固定值",RC[5],RC[5]/100&"%") -> 攻击+750 | K51: 1 | L51: =VLOOKUP(INT(MOD(RC[-11],1000)/100),R7C9:R9C10,2,FALSE)*RC[-10]*100 -> 750
A52: 401 | B52: 6 | C52: 120 | D52: =IF(RC2=1,RC[7],R[-1]C&"|"&RC[7]) -> 1|8|1|7|1|22 | E52: =IF(RC2=1,RC[7],R[-1]C&"|"&RC[7]) -> 150|300|450|600|750|900 | F52: 天赋 6 | G52: =VLOOKUP(RC[4],Sheet1!R8C1:R38C3,2,FALSE)&"+"&IF(VLOOKUP(RC[4],Sheet1!R8C1:R38C3,3,FALSE)="固定值",RC[5],RC[5]/100&"%") -> 攻击+9% | K52: 22 | L52: =VLOOKUP(INT(MOD(RC[-11],1000)/100),R7C9:R9C10,2,FALSE)*RC[-10]*100 -> 900
A53: 401 | B53: 7 | C53: 140 | D53: =IF(RC2=1,RC[7],R[-1]C&"|"&RC[7]) -> 1|8|1|7|1|22|1 | E53: =IF(RC2=1,RC[7],R[-1]C&"|"&RC[7]) -> 150|300|450|600|750|900|1050 | F53: 天赋 7 | G53: =VLOOKUP(RC[4],Sheet1!R8C1:R38C3,2,FALSE)&"+"&IF(VLOOKUP(RC[4],Sheet1!R8C1:R38C3,3,FALSE)="固定值",RC[5],RC[5]/100&"%") -> 攻击+1050 | K53: 1 | L53: =VLOOKUP(INT(MOD(RC[-11],1000)/100),R7C9:R9C10,2,FALSE)*RC[-10]*100 -> 1050
A54: 401 | B54: 8 | C54: 160 | D54: =IF(RC2=1,RC[7],R[-1]C&"|"&RC[7]) -> 1|8|1|7|1|22|1|13 | E54: =IF(RC2=1,RC[7],R[-1]C&"|"&RC[7]) -> 150|300|450|600|750|900|1050|1200 | F54: 天赋 8 | G54: =VLOOKUP(RC[4],Sheet1!R8C1:R38C3,2,FALSE)&"+"&IF(VLOOKUP(RC[4],Sheet1!R8C1:R38C3,3,FALSE)="固定值",RC[5],RC[5]/100&"%") -> 暴击+12% | K54: 13 | L54: =VLOOKUP(INT(MOD(RC[-11],1000)/100),R7C9:R9C10,2,FALSE)*RC[-10]*100 -> 1200
A55: 401 | B55: 9 | C55: 180 | D55: =IF(RC2=1,RC[7],R[-1]C&"|"&RC[7]) -> 1|8|1|7|1|22|1|13|1 | E55: =IF(RC2=1,RC[7],R[-1]C&"|"&RC[7]) -> 150|300|450|600|750|900|1050|1200|1350 | F55: 天赋 9 | G55: =VLOOKUP(RC[4],Sheet1!R8C1:R38C3,2,FALSE)&"+"&IF(VLOOKUP(RC[4],Sheet1!R8C1:R38C3,3,FALSE)="固定值",RC[5],RC[5]/100&"%") -> 攻击+1350 | K55: 1 | L55: =VLOOKUP(INT(MOD(RC[-11],1000)/100),R7C9:R9C10,2,FALSE)*RC[-10]*100 -> 1350
A56: 401 | B56: 10 | C56: 200 | D56: =IF(RC2=1,RC[7],R[-1]C&"|"&RC[7]) -> 1|8|1|7|1|22|1|13|1|22 | E56: =IF(RC2=1,RC[7],R[-1]C&"|"&RC[7]) -> 150|300|450|600|750|900|1050|1200|1350|1500 | F56: 天赋 10 | G56: =VLOOKUP(RC[4],Sheet1!R8C1:R38C3,2,FALSE)&"+"&IF(VLOOKUP(RC[4],Sheet1!R8C1:R38C3,3,FALSE)="固定值",RC[5],RC[5]/100&"%") -> 攻击+15% | K56: 22 | L56: =VLOOKUP(INT(MOD(RC[-11],1000)/100),R7C9:R9C10,2,FALSE)*RC[-10]*100 -> 1500
A57: 402 | B57: 1 | C57: 20 | D57: =IF(RC2=1,RC[7],R[-1]C&"|"&RC[7]) -> 1 | E57: =IF(RC2=1,RC[7],R[-1]C&"|"&RC[7]) -> 150 | F57: 天赋 1 | G57: =VLOOKUP(RC[4],Sheet1!R8C1:R38C3,2,FALSE)&"+"&IF(VLOOKUP(RC[4],Sheet1!R8C1:R38C3,3,FALSE)="固定值",RC[5],RC[5]/100&"%") -> 攻击+150 | K57: 1 | L57: =VLOOKUP(INT(MOD(RC[-11],1000)/100),R7C9:R9C10,2,FALSE)*RC[-10]*100 -> 150
A58: 402 | B58: 2 | C58: 40 | D58: =IF(RC2=1,RC[7],R[-1]C&"|"&RC[7]) -> 1|8 | E58: =IF(RC2=1,RC[7],R[-1]C&"|"&RC[7]) -> 150|300 | F58: 天赋 2 | G58: =VLOOKUP(RC[4],Sheet1!R8C1:R38C3,2,FALSE)&"+"&IF(VLOOKUP(RC[4],Sheet1!R8C1:R38C3,3,FALSE)="固定值",RC[5],RC[5]/100&"%") -> 附伤+300 | K58: 8 | L58: =VLOOKUP(INT(MOD(RC[-11],1000)/100),R7C9:R9C10,2,FALSE)*RC[-10]*100 -> 300
A59: 402 | B59: 3 | C59: 60 | D59: =IF(RC2=1,RC[7],R[-1]C&"|"&RC[7]) -> 1|8|1 | E59: =IF(RC2=1,RC[7],R[-1]C&"|"&RC[7]) -> 150|300|450 | F59: 天赋 3 | G59: =VLOOKUP(RC[4],Sheet1!R8C1:R38C3,2,FALSE)&"+"&IF(VLOOKUP(RC[4],Sheet1!R8C1:R38C3,3,FALSE)="固定值",RC[5],RC[5]/100&"%") -> 攻击+450 | K59: 1 | L59: =VLOOKUP(INT(MOD(RC[-11],1000)/100),R7C9:R9C10,2,FALSE)*RC[-10]*100 -> 450
A60: 402 | B60: 4 | C60: 80 | D60: =IF(RC2=1,RC[7],R[-1]C&"|"&RC[7]) -> 1|8|1|7 | E60: =IF(RC2=1,RC[7],R[-1]C&"|"&RC[7]) -> 150|300|450|600 | F60: 天赋 4 | G60: =VLOOKUP(RC[4],Sheet1!R8C1:R38C3,2,FALSE)&"+"&IF(VLOOKUP(RC[4],Sheet1!R8C1:R38C3,3,FALSE)="固定值",RC[5],RC[5]/100&"%") -> 伤害+6% | K60: 7 | L60: =VLOOKUP(INT(MOD(RC[-11],1000)/100),R7C9:R9C10,2,FALSE)*RC[-10]*100 -> 600
A61: 402 | B61: 5 | C61: 100 | D61: =IF(RC2=1,RC[7],R[-1]C&"|"&RC[7]) -> 1|8|1|7|1 | E61: =IF(RC2=1,RC[7],R[-1]C&"|"&RC[7]) -> 150|300|450|600|750 | F61: 天赋 5 | G61: =VLOOKUP(RC[4],Sheet1!R8C1:R38C3,2,FALSE)&"+"&IF(VLOOKUP(RC[4],Sheet1!R8C1:R38C3,3,FALSE)="固定值",RC[5],RC[5]/100&"%") -> 攻击+750 | K61: 1 | L61: =VLOOKUP(INT(MOD(RC[-11],1000)/100),R7C9:R9C10,2,FALSE)*RC[-10]*100 -> 750
A62: 402 | B62: 6 | C62: 120 | D62: =IF(RC2=1,RC[7],R[-1]C&"|"&RC[7]) -> 1|8|1|7|1|22 | E62: =IF(RC2=1,RC[7],R[-1]C&"|"&RC[7]) -> 150|300|450|600|750|900 | F62: 天赋 6 | G62: =VLOOKUP(RC[4],Sheet1!R8C1:R38C3,2,FALSE)&"+"&IF(VLOOKUP(RC[4],Sheet1!R8C1:R38C3,3,FALSE)="固定值",RC[5],RC[5]/100&"%") -> 攻击+9% | K62: 22 | L62: =VLOOKUP(INT(MOD(RC[-11],1000)/100),R7C9:R9C10,2,FALSE)*RC[-10]*100 -> 900
A63: 402 | B63: 7 | C63: 140 | D63: =IF(RC2=1,RC[7],R[-1]C&"|"&RC[7]) -> 1|8|1|7|1|22|1 | E63: =IF(RC2=1,RC[7],R[-1]C&"|"&RC[7]) -> 150|300|450|600|750|900|1050 | F63: 天赋 7 | G63: =VLOOKUP(RC[4],Sheet1!R8C1:R38C3,2,FALSE)&"+"&IF(VLOOKUP(RC[4],Sheet1!R8C1:R38C3,3,FALSE)="固定值",RC[5],RC[5]/100&"%") -> 攻击+1050 | K63: 1 | L63: =VLOOKUP(INT(MOD(RC[-11],1000)/100),R7C9:R9C10,2,FALSE)*RC[-10]*100 -> 1050
A64: 402 | B64: 8 | C64: 160 | D64: =IF(RC2=1,RC[7],R[-1]C&"|"&RC[7]) -> 1|8|1|7|1|22|1|13 | E64: =IF(RC2=1,RC[7],R[-1]C&"|"&RC[7]) -> 150|300|450|600|750|900|1050|1200 | F64: 天赋 8 | G64: =VLOOKUP(RC[4],Sheet1!R8C1:R38C3,2,FALSE)&"+"&IF(VLOOKUP(RC[4],Sheet1!R8C1:R38C3,3,FALSE)="固定值",RC[5],RC[5]/100&"%") -> 暴击+12% | K64: 13 | L64: =VLOOKUP(INT(MOD(RC[-11],1000)/100),R7C9:R9C10,2,FALSE)*RC[-10]*100 -> 1200
A65: 402 | B65: 9 | C65: 180 | D65: =IF(RC2=1,RC[7],R[-1]C&"|"&RC[7]) -> 1|8|1|7|1|22|1|13|1 | E65: =IF(RC2=1,RC[7],R[-1]C&"|"&RC[7]) -> 150|300|450|600|750|900|1050|1200|1350 | F65: 天赋 9 | G65: =VLOOKUP(RC[4],Sheet1!R8C1:R38C3,2,FALSE)&"+"&IF(VLOOKUP(RC[4],Sheet1!R8C1:R38C3,3,FALSE)="固定值",RC[5],RC[5]/100&"%") -> 攻击+1350 | K65: 1 | L65: =VLOOKUP(INT(MOD(RC[-11],1000)/100),R7C9:R9C10,2,FALSE)*RC[-10]*100 -> 1350
A66: 402 | B66: 10 | C66: 200 | D66: =IF(RC2=1,RC[7],R[-1]C&"|"&RC[7]) -> 1|8|1|7|1|22|1|13|1|22 | E66: =IF(RC2=1,RC[7],R[-1]C&"|"&RC[7]) -> 150|300|450|600|750|900|1050|1200|1350|1500 | F66: 天赋 10 | G66: =VLOOKUP(RC[4],Sheet1!R8C1:R38C3,2,FALSE)&"+"&IF(VLOOKUP(RC[4],Sheet1!R8C1:R38C3,3,FALSE)="固定值",RC[5],RC[5]/100&"%") -> 攻击+15% | K66: 22 | L66: =VLOOKUP(INT(MOD(RC[-11],1000)/100),R7C9:R9C10,2,FALSE)*RC[-10]*100 -> 1500
A67: 403 | B67: 1 | C67: 20 | D67: =IF(RC2=1,RC[7],R[-1]C&"|"&RC[7]) -> 1 | E67: =IF(RC2=1,RC[7],R[-1]C&"|"&RC[7]) -> 150 | F67: 天赋 1 | G67: =VLOOKUP(RC[4],Sheet1!R8C1:R38C3,2,FALSE)&"+"&IF(VLOOKUP(RC[4],Sheet1!R8C1:R38C3,3,FALSE)="固定值",RC[5],RC[5]/100&"%") -> 攻击+150 | K67: 1 | L67: =VLOOKUP(INT(MOD(RC[-11],1000)/100),R7C9:R9C10,2,FALSE)*RC[-10]*100 -> 150
A68: 403 | B68: 2 | C68: 40 | D68: =IF(RC2=1,RC[7],R[-1]C&"|"&RC[7]) -> 1|8 | E68: =IF(RC2=1,RC[7],R[-1]C&"|"&RC[7]) -> 150|300 | F68: 天赋 2 | G68: =VLOOKUP(RC[4],Sheet1!R8C1:R38C3,2,FALSE)&"+"&IF(VLOOKUP(RC[4],Sheet1!R8C1:R38C3,3,FALSE)="固定值",RC[5],RC[5]/100&"%") -> 附伤+300 | K68: 8 | L68: =VLOOKUP(INT(MOD(RC[-11],1000)/100),R7C9:R9C10,2,FALSE)*RC[-10]*100 -> 300
A69: 403 | B69: 3 | C69: 60 | D69: =IF(RC2=1,RC[7],R[-1]C&"|"&RC[7]) -> 1|8|1 | E69: =IF(RC2=1,RC[7],R[-1]C&"|"&RC[7]) -> 150|300|450 | F69: 天赋 3 | G69: =VLOOKUP(RC[4],Sheet1!R8C1:R38C3,2,FALSE)&"+"&IF(VLOOKUP(RC[4],Sheet1!R8C1:R38C3,3,FALSE)="固定值",RC[5],RC[5]/100&"%") -> 攻击+450 | K69: 1 | L69: =VLOOKUP(INT(MOD(RC[-11],1000)/100),R7C9:R9C10,2,FALSE)*RC[-10]*100 -> 450
A70: 403 | B70: 4 | C70: 80 | D70: =IF(RC2=1,RC[7],R[-1]C&"|"&RC[7]) -> 1|8|1|7 | E70: =IF(RC2=1,RC[7],R[-1]C&"|"&RC[7]) -> 150|300|450|600 | F70: 天赋 4 | G70: =VLOOKUP(RC[4],Sheet1!R8C1:R38C3,2,FALSE)&"+"&IF(VLOOKUP(RC[4],Sheet1!R8C1:R38C3,3,FALSE)="固定值",RC[5],RC[5]/100&"%") -> 伤害+6% | K70: 7 | L70: =VLOOKUP(INT(MOD(RC[-11],1000)/100),R7C9:R9C10,2,FALSE)*RC[-10]*100 -> 600
A71: 403 | B71: 5 | C71: 100 | D71: =IF(RC2=1,RC[7],R[-1]C&"|"&RC[7]) -> 1|8|1|7|1 | E71: =IF(RC2=1,RC[7],R[-1]C&"|"&RC[7]) -> 150|300|450|600|750 | F71: 天赋 5 | G71: =VLOOKUP(RC[4],Sheet1!R8C1:R38C3,2,FALSE)&"+"&IF(VLOOKUP(RC[4],Sheet1!R8C1:R38C3,3,FALSE)="固定值",RC[5],RC[5]/100&"%") -> 攻击+750 | K71: 1 | L71: =VLOOKUP(INT(MOD(RC[-11],1000)/100),R7C9:R9C10,2,FALSE)*RC[-10]*100 -> 750
A72: 403 | B72: 6 | C72: 120 | D72: =IF(RC2=1,RC[7],R[-1]C&"|"&RC[7]) -> 1|8|1|7|1|22 | E72: =IF(RC2=1,RC[7],R[-1]C&"|"&RC[7]) -> 150|300|450|600|750|900 | F72: 天赋 6 | G72: =VLOOKUP(RC[4],Sheet1!R8C1:R38C3,2,FALSE)&"+"&IF(VLOOKUP(RC[4],Sheet1!R8C1:R38C3,3,FALSE)="固定值",RC[5],RC[5]/100&"%") -> 攻击+9% | K72: 22 | L72: =VLOOKUP(INT(MOD(RC[-11],1000)/100),R7C9:R9C10,2,FALSE)*RC[-10]*100 -> 900
A73: 403 | B73: 7 | C73: 140 | D73: =IF(RC2=1,RC[7],R[-1]C&"|"&RC[7]) -> 1|8|1|7|1|22|1 | E73: =IF(RC2=1,RC[7],R[-1]C&"|"&RC[7]) -> 150|300|450|600|750|900|1050 | F73: 天赋 7 | G73: =VLOOKUP(RC[4],Sheet1!R8C1:R38C3,2,FALSE)&"+"&IF(VLOOKUP(RC[4],Sheet1!R8C1:R38C3,3,FALSE)="固定值",RC[5],RC[5]/100&"%") -> 攻击+1050 | K73: 1 | L73: =VLOOKUP(INT(MOD(RC[-11],1000)/100),R7C9:R9C10,2,FALSE)*RC[-10]*100 -> 1050
A74: 403 | B74: 8 | C74: 160 | D74: =IF(RC2=1,RC[7],R[-1]C&"|"&RC[7]) -> 1|8|1|7|1|22|1|13 | E74: =IF(RC2=1,RC[7],R[-1]C&"|"&RC[7]) -> 150|300|450|600|750|900|1050|1200 | F74: 天赋 8 | G74: =VLOOKUP(RC[4],Sheet1!R8C1:R38C3,2,FALSE)&"+"&IF(VLOOKUP(RC[4],Sheet1!R8C1:R38C3,3,FALSE)="固定值",RC[5],RC[5]/100&"%") -> 暴击+12% | K74: 13 | L74: =VLOOKUP(INT(MOD(RC[-11],1000)/100),R7C9:R9C10,2,FALSE)*RC[-10]*100 -> 1200
A75: 403 | B75: 9 | C75: 180 | D75: =IF(RC2=1,RC[7],R[-1]C&"|"&RC[7]) -> 1|8|1|7|1|22|1|13|1 | E75: =IF(RC2=1,RC[7],R[-1]C&"|"&RC[7]) -> 150|300|450|600|750|900|1050|1200|1350 | F75: 天赋 9 | G75: =VLOOKUP(RC[4],Sheet1!R8C1:R38C3,2,FALSE)&"+"&IF(VLOOKUP(RC[4],Sheet1!R8C1:R38C3,3,FALSE)="固定值",RC[5],RC[5]/100&"%") -> 攻击+1350 | K75: 1 | L75: =VLOOKUP(INT(MOD(RC[-11],1000)/100),R7C9:R9C10,2,FALSE)*RC[-10]*100 -> 1350
A76: 403 | B76: 10 | C76: 200 | D76: =IF(RC2=1,RC[7],R[-1]C&"|"&RC[7]) -> 1|8|1|7|1|22|1|13|1|22 | E76: =IF(RC2=1,RC[7],R[-1]C&"|"&RC[7]) -> 150|300|450|600|750|900|1050|1200|1350|1500 | F76: 天赋 10 | G76: =VLOOKUP(RC[4],Sheet1!R8C1:R38C3,2,FALSE)&"+"&IF(VLOOKUP(RC[4],Sheet1!R8C1:R38C3,3,FALSE)="固定值",RC[5],RC[5]/100&"%") -> 攻击+15% | K76: 22 | L76: =VLOOKUP(INT(MOD(RC[-11],1000)/100),R7C9:R9C10,2,FALSE)*RC[-10]*100 -> 1500
A77: 404 | B77: 1 | C77: 20 | D77: =IF(RC2=1,RC[7],R[-1]C&"|"&RC[7]) -> 1 | E77: =IF(RC2=1,RC[7],R[-1]C&"|"&RC[7]) -> 150 | F77: 天赋 1 | G77: =VLOOKUP(RC[4],Sheet1!R8C1:R38C3,2,FALSE)&"+"&IF(VLOOKUP(RC[4],Sheet1!R8C1:R38C3,3,FALSE)="固定值",RC[5],RC[5]/100&"%") -> 攻击+150 | K77: 1 | L77: =VLOOKUP(INT(MOD(RC[-11],1000)/100),R7C9:R9C10,2,FALSE)*RC[-10]*100 -> 150
A78: 404 | B78: 2 | C78: 40 | D78: =IF(RC2=1,RC[7],R[-1]C&"|"&RC[7]) -> 1|8 | E78: =IF(RC2=1,RC[7],R[-1]C&"|"&RC[7]) -> 150|300 | F78: 天赋 2 | G78: =VLOOKUP(RC[4],Sheet1!R8C1:R38C3,2,FALSE)&"+"&IF(VLOOKUP(RC[4],Sheet1!R8C1:R38C3,3,FALSE)="固定值",RC[5],RC[5]/100&"%") -> 附伤+300 | K78: 8 | L78: =VLOOKUP(INT(MOD(RC[-11],1000)/100),R7C9:R9C10,2,FALSE)*RC[-10]*100 -> 300
A79: 404 | B79: 3 | C79: 60 | D79: =IF(RC2=1,RC[7],R[-1]C&"|"&RC[7]) -> 1|8|1 | E79: =IF(RC2=1,RC[7],R[-1]C&"|"&RC[7]) -> 150|300|450 | F79: 天赋 3 | G79: =VLOOKUP(RC[4],Sheet1!R8C1:R38C3,2,FALSE)&"+"&IF(VLOOKUP(RC[4],Sheet1!R8C1:R38C3,3,FALSE)="固定值",RC[5],RC[5]/100&"%") -> 攻击+450 | K79: 1 | L79: =VLOOKUP(INT(MOD(RC[-11],1000)/100),R7C9:R9C10,2,FALSE)*RC[-10]*100 -> 450
A80: 404 | B80: 4 | C80: 80 | D80: =IF(RC2=1,RC[7],R[-1]C&"|"&RC[7]) -> 1|8|1|7 | E80: =IF(RC2=1,RC[7],R[-1]C&"|"&RC[7]) -> 150|300|450|600 | F80: 天赋 4 | G80: =VLOOKUP(RC[4],Sheet1!R8C1:R38C3,2,FALSE)&"+"&IF(VLOOKUP(RC[4],Sheet1!R8C1:R38C3,3,FALSE)="固定值",RC[5],RC[5]/100&"%") -> 伤害+6% | K80: 7 | L80: =VLOOKUP(INT(MOD(RC[-11],1000)/100),R7C9:R9C10,2,FALSE)*RC[-10]*100 -> 600
A81: 404 | B81: 5 | C81: 100 | D81: =IF(RC2=1,RC[7],R[-1]C&"|"&RC[7]) -> 1|8|1|7|1 | E81: =IF(RC2=1,RC[7],R[-1]C&"|"&RC[7]) -> 150|300|450|600|750 | F81: 天赋 5 | G81: =VLOOKUP(RC[4],Sheet1!R8C1:R38C3,2,FALSE)&"+"&IF(VLOOKUP(RC[4],Sheet1!R8C1:R38C3,3,FALSE)="固定值",RC[5],RC[5]/100&"%") -> 攻击+750 | K81: 1 | L81: =VLOOKUP(INT(MOD(RC[-11],1000)/100),R7C9:R9C10,2,FALSE)*RC[-10]*100 -> 750
A82: 404 | B82: 6 | C82: 120 | D82: =IF(RC2=1,RC[7],R[-1]C&"|"&RC[7]) -> 1|8|1|7|1|22 | E82: =IF(RC2=1,RC[7],R[-1]C&"|"&RC[7]) -> 150|300|450|600|750|900 | F82: 天赋 6 | G82: =VLOOKUP(RC[4],Sheet1!R8C1:R38C3,2,FALSE)&"+"&IF(VLOOKUP(RC[4],Sheet1!R8C1:R38C3,3,FALSE)="固定值",RC[5],RC[5]/100&"%") -> 攻击+9% | K82: 22 | L82: =VLOOKUP(INT(MOD(RC[-11],1000)/100),R7C9:R9C10,2,FALSE)*RC[-10]*100 -> 900
A83: 404 | B83: 7 | C83: 140 | D83: =IF(RC2=1,RC[7],R[-1]C&"|"&RC[7]) -> 1|8|1|7|1|22|1 | E83: =IF(RC2=1,RC[7],R[-1]C&"|"&RC[7]) -> 150|300|450|600|750|900|1050 | F83: 天赋 7 | G83: =VLOOKUP(RC[4],Sheet1!R8C1:R38C3,2,FALSE)&"+"&IF(VLOOKUP(RC[4],Sheet1!R8C1:R38C3,3,FALSE)="固定值",RC[5],RC[5]/100&"%") -> 攻击+1050 | K83: 1 | L83: =VLOOKUP(INT(MOD(RC[-11],1000)/100),R7C9:R9C10,2,FALSE)*RC[-10]*100 -> 1050
A84: 404 | B84: 8 | C84: 160 | D84: =IF(RC2=1,RC[7],R[-1]C&"|"&RC[7]) -> 1|8|1|7|1|22|1|13 | E84: =IF(RC2=1,RC[7],R[-1]C&"|"&RC[7]) -> 150|300|450|600|750|900|1050|1200 | F84: 天赋 8 | G84: =VLOOKUP(RC[4],Sheet1!R8C1:R38C3,2,FALSE)&"+"&IF(VLOOKUP(RC[4],Sheet1!R8C1:R38C3,3,FALSE)="固定值",RC[5],RC[5]/100&"%") -> 暴击+12% | K84: 13 | L84: =VLOOKUP(INT(MOD(RC[-11],1000)/100),R7C9:R9C10,2,FALSE)*RC[-10]*100 -> 1200
A85: 404 | B85: 9 | C85: 180 | D85: =IF(RC2=1,RC[7],R[-1]C&"|"&RC[7]) -> 1|8|1|7|1|22|1|13|1 | E85: =IF(RC2=1,RC[7],R[-1]C&"|"&RC[7]) -> 150|300|450|600|750|900|1050|1200|1350 | F85: 天赋 9 | G85: =VLOOKUP(RC[4],Sheet1!R8C1:R38C3,2,FALSE)&"+"&IF(VLOOKUP(RC[4],Sheet1!R8C1:R38C3,3,FALSE)="固定值",RC[5],RC[5]/100&"%") -> 攻击+1350 | K85: 1 | L85: =VLOOKUP(INT(MOD(RC[-11],1000)/100),R7C9:R9C10,2,FALSE)*RC[-10]*100 -> 1350
A86: 404 | B86: 10 | C86: 200 | D86: =IF(RC2=1,RC[7],R[-1]C&"|"&RC[7]) -> 1|8|1|7|1|22|1|13|1|22 | E86: =IF(RC2=1,RC[7],R[-1]C&"|"&RC[7]) -> 150|300|450|600|750|900|1050|1200|1350|1500 | F86: 天赋 10 | G86: =VLOOKUP(RC[4],Sheet1!R8C1:R38C3,2,FALSE)&"+"&IF(VLOOKUP(RC[4],Sheet1!R8C1:R38C3,3,FALSE)="固定值",RC[5],RC[5]/100&"%") -> 攻击+15% | K86: 22 | L86: =VLOOKUP(INT(MOD(RC[-11],1000)/100),R7C9:R9C10,2,FALSE)*RC[-10]*100 -> 1500
A87: 405 | B87: 1 | C87: 20 | D87: =IF(RC2=1,RC[7],R[-1]C&"|"&RC[7]) -> 1 | E87: =IF(RC2=1,RC[7],R[-1]C&"|"&RC[7]) -> 150 | F87: 天赋 1 | G87: =VLOOKUP(RC[4],Sheet1!R8C1:R38C3,2,FALSE)&"+"&IF(VLOOKUP(RC[4],Sheet1!R8C1:R38C3,3,FALSE)="固定值",RC[5],RC[5]/100&"%") -> 攻击+150 | K87: 1 | L87: =VLOOKUP(INT(MOD(RC[-11],1000)/100),R7C9:R9C10,2,FALSE)*RC[-10]*100 -> 150
A88: 405 | B88: 2 | C88: 40 | D88: =IF(RC2=1,RC[7],R[-1]C&"|"&RC[7]) -> 1|8 | E88: =IF(RC2=1,RC[7],R[-1]C&"|"&RC[7]) -> 150|300 | F88: 天赋 2 | G88: =VLOOKUP(RC[4],Sheet1!R8C1:R38C3,2,FALSE)&"+"&IF(VLOOKUP(RC[4],Sheet1!R8C1:R38C3,3,FALSE)="固定值",RC[5],RC[5]/100&"%") -> 附伤+300 | K88: 8 | L88: =VLOOKUP(INT(MOD(RC[-11],1000)/100),R7C9:R9C10,2,FALSE)*RC[-10]*100 -> 300
A89: 405 | B89: 3 | C89: 60 | D89: =IF(RC2=1,RC[7],R[-1]C&"|"&RC[7]) -> 1|8|1 | E89: =IF(RC2=1,RC[7],R[-1]C&"|"&RC[7]) -> 150|300|450 | F89: 天赋 3 | G89: =VLOOKUP(RC[4],Sheet1!R8C1:R38C3,2,FALSE)&"+"&IF(VLOOKUP(RC[4],Sheet1!R8C1:R38C3,3,FALSE)="固定值",RC[5],RC[5]/100&"%") -> 攻击+450 | K89: 1 | L89: =VLOOKUP(INT(MOD(RC[-11],1000)/100),R7C9:R9C10,2,FALSE)*RC[-10]*100 -> 450
A90: 405 | B90: 4 | C90: 80 | D90: =IF(RC2=1,RC[7],R[-1]C&"|"&RC[7]) -> 1|8|1|7 | E90: =IF(RC2=1,RC[7],R[-1]C&"|"&RC[7]) -> 150|300|450|600 | F90: 天赋 4 | G90: =VLOOKUP(RC[4],Sheet1!R8C1:R38C3,2,FALSE)&"+"&IF(VLOOKUP(RC[4],Sheet1!R8C1:R38C3,3,FALSE)="固定值",RC[5],RC[5]/100&"%") -> 伤害+6% | K90: 7 | L90: =VLOOKUP(INT(MOD(RC[-11],1000)/100),R7C9:R9C10,2,FALSE)*RC[-10]*100 -> 600
A91: 405 | B91: 5 | C91: 100 | D91: =IF(RC2=1,RC[7],R[-1]C&"|"&RC[7]) -> 1|8|1|7|1 | E91: =IF(RC2=1,RC[7],R[-1]C&"|"&RC[7]) -> 150|300|450|600|750 | F91: 天赋 5 | G91: =VLOOKUP(RC[4],Sheet1!R8C1:R38C3,2,FALSE)&"+"&IF(VLOOKUP(RC[4],Sheet1!R8C1:R38C3,3,FALSE)="固定值",RC[5],RC[5]/100&"%") -> 攻击+750 | K91: 1 | L91: =VLOOKUP(INT(MOD(RC[-11],1000)/100),R7C9:R9C10,2,FALSE)*RC[-10]*100 -> 750
A92: 405 | B92: 6 | C92: 120 | D92: =IF(RC2=1,RC[7],R[-1]C&"|"&RC[7]) -> 1|8|1|7|1|22 | E92: =IF(RC2=1,RC[7],R[-1]C&"|"&RC[7]) -> 150|300|450|600|750|900 | F92: 天赋 6 | G92: =VLOOKUP(RC[4],Sheet1!R8C1:R38C3,2,FALSE)&"+"&IF(VLOOKUP(RC[4],Sheet1!R8C1:R38C3,3,FALSE)="固定值",RC[5],RC[5]/100&"%") -> 攻击+9% | K92: 22 | L92: =VLOOKUP(INT(MOD(RC[-11],1000)/100),R7C9:R9C10,2,FALSE)*RC[-10]*100 -> 900
A93: 405 | B93: 7 | C93: 140 | D93: =IF(RC2=1,RC[7],R[-1]C&"|"&RC[7]) -> 1|8|1|7|1|22|1 | E93: =IF(RC2=1,RC[7],R[-1]C&"|"&RC[7]) -> 150|300|450|600|750|900|1050 | F93: 天赋 7 | G93: =VLOOKUP(RC[4],Sheet1!R8C1:R38C3,2,FALSE)&"+"&IF(VLOOKUP(RC[4],Sheet1!R8C1:R38C3,3,FALSE)="固定值",RC[5],RC[5]/100&"%") -> 攻击+1050 | K93: 1 | L93: =VLOOKUP(INT(MOD(RC[-11],1000)/100),R7C9:R9C10,2,FALSE)*RC[-10]*100 -> 1050
A94: 405 | B94: 8 | C94: 160 | D94: =IF(RC2=1,RC[7],R[-1]C&"|"&RC[7]) -> 1|8|1|7|1|22|1|13 | E94: =IF(RC2=1,RC[7],R[-1]C&"|"&RC[7]) -> 150|300|450|600|750|900|1050|1200 | F94: 天赋 8 | G94: =VLOOKUP(RC[4],Sheet1!R8C1:R38C3,2,FALSE)&"+"&IF(VLOOKUP(RC[4],Sheet1!R8C1:R38C3,3,FALSE)="固定值",RC[5],RC[5]/100&"%") -> 暴击+12% | K94: 13 | L94: =VLOOKUP(INT(MOD(RC[-11],1000)/100),R7C9:R9C10,2,FALSE)*RC[-10]*100 -> 1200
A95: 405 | B95: 9 | C95: 180 | D95: =IF(RC2=1,RC[7],R[-1]C&"|"&RC[7]) -> 1|8|1|7|1|22|1|13|1 | E95: =IF(RC2=1,RC[7],R[-1]C&"|"&RC[7]) -> 150|300|450|600|750|900|1050|1200|1350 | F95: 天赋 9 | G95: =VLOOKUP(RC[4],Sheet1!R8C1:R38C3,2,FALSE)&"+"&IF(VLOOKUP(RC[4],Sheet1!R8C1:R38C3,3,FALSE)="固定值",RC[5],RC[5]/100&"%") -> 攻击+1350 | K95: 1 | L95: =VLOOKUP(INT(MOD(RC[-11],1000)/100),R7C9:R9C10,2,FALSE)*RC[-10]*100 -> 1350
A96: 405 | B96: 10 | C96: 200 | D96: =IF(RC2=1,RC[7],R[-1]C&"|"&RC[7]) -> 1|8|1|7|1|22|1|13|1|22 | E96: =IF(RC2=1,RC[7],R[-1]C&"|"&RC[7]) -> 150|300|450|600|750|900|1050|1200|1350|1500 | F96: 天赋 10 | G96: =VLOOKUP(RC[4],Sheet1!R8C1:R38C3,2,FALSE)&"+"&IF(VLOOKUP(RC[4],Sheet1!R8C1:R38C3,3,FALSE)="固定值",RC[5],RC[5]/100&"%") -> 攻击+15% | K96: 22 | L96: =VLOOKUP(INT(MOD(RC[-11],1000)/100),R7C9:R9C10,2,FALSE)*RC[-10]*100 -> 1500
A97: 406 | B97: 1 | C97: 20 | D97: =IF(RC2=1,RC[7],R[-1]C&"|"&RC[7]) -> 1 | E97: =IF(RC2=1,RC[7],R[-1]C&"|"&RC[7]) -> 150 | F97: 天赋 1 | G97: =VLOOKUP(RC[4],Sheet1!R8C1:R38C3,2,FALSE)&"+"&IF(VLOOKUP(RC[4],Sheet1!R8C1:R38C3,3,FALSE)="固定值",RC[5],RC[5]/100&"%") -> 攻击+150 | K97: 1 | L97: =VLOOKUP(INT(MOD(RC[-11],1000)/100),R7C9:R9C10,2,FALSE)*RC[-10]*100 -> 150
A98: 406 | B98: 2 | C98: 40 | D98: =IF(RC2=1,RC[7],R[-1]C&"|"&RC[7]) -> 1|8 | E98: =IF(RC2=1,RC[7],R[-1]C&"|"&RC[7]) -> 150|300 | F98: 天赋 2 | G98: =VLOOKUP(RC[4],Sheet1!R8C1:R38C3,2,FALSE)&"+"&IF(VLOOKUP(RC[4],Sheet1!R8C1:R38C3,3,FALSE)="固定值",RC[5],RC[5]/100&"%") -> 附伤+300 | K98: 8 | L98: =VLOOKUP(INT(MOD(RC[-11],1000)/100),R7C9:R9C10,2,FALSE)*RC[-10]*100 -> 300
A99: 406 | B99: 3 | C99: 60 | D99: =IF(RC2=1,RC[7],R[-1]C&"|"&RC[7]) -> 1|8|1 | E99: =IF(RC2=1,RC[7],R[-1]C&"|"&RC[7]) -> 150|300|450 | F99: 天赋 3 | G99: =VLOOKUP(RC[4],Sheet1!R8C1:R38C3,2,FALSE)&"+"&IF(VLOOKUP(RC[4],Sheet1!R8C1:R38C3,3,FALSE)="固定值",RC[5],RC[5]/100&"%") -> 攻击+450 | K99: 1 | L99: =VLOOKUP(INT(MOD(RC[-11],1000)/100),R7C9:R9C10,2,FALSE)*RC[-10]*100 -> 450
A100: 406 | B100: 4 | C100: 80 | D100: =IF(RC2=1,RC[7],R[-1]C&"|"&RC[7]) -> 1|8|1|7 | E100: =IF(RC2=1,RC[7],R[-1]C&"|"&RC[7]) -> 150|300|450|600 | F100: 天赋 4 | G100: =VLOOKUP(RC[4],Sheet1!R8C1:R38C3,2,FALSE)&"+"&IF(VLOOKUP(RC[4],Sheet1!R8C1:R38C3,3,FALSE)="固定值",RC[5],RC[5]/100&"%") -> 伤害+6% | K100: 7 | L100: =VLOOKUP(INT(MOD(RC[-11],1000)/100),R7C9:R9C10,2,FALSE)*RC[-10]*100 -> 600
A101: 406 | B101: 5 | C101: 100 | D101: =IF(RC2=1,RC[7],R[-1]C&"|"&RC[7]) -> 1|8|1|7|1 | E101: =IF(RC2=1,RC[7],R[-1]C&"|"&RC[7]) -> 150|300|450|600|750 | F101: 天赋 5 | G101: =VLOOKUP(RC[4],Sheet1!R8C1:R38C3,2,FALSE)&"+"&IF(VLOOKUP(RC[4],Sheet1!R8C1:R38C3,3,FALSE)="固定值",RC[5],RC[5]/100&"%") -> 攻击+750 | K101: 1 | L101: =VLOOKUP(INT(MOD(RC[-11],1000)/100),R7C9:R9C10,2,FALSE)*RC[-10]*100 -> 750
A102: 406 | B102: 6 | C102: 120 | D102: =IF(RC2=1,RC[7],R[-1]C&"|"&RC[7]) -> 1|8|1|7|1|22 | E102: =IF(RC2=1,RC[7],R[-1]C&"|"&RC[7]) -> 150|300|450|600|750|900 | F102: 天赋 6 | G102: =VLOOKUP(RC[4],Sheet1!R8C1:R38C3,2,FALSE)&"+"&IF(VLOOKUP(RC[4],Sheet1!R8C1:R38C3,3,FALSE)="固定值",RC[5],RC[5]/100&"%") -> 攻击+9% | K102: 22 | L102: =VLOOKUP(INT(MOD(RC[-11],1000)/100),R7C9:R9C10,2,FALSE)*RC[-10]*100 -> 900
A103: 406 | B103: 7 | C103: 140 | D103: =IF(RC2=1,RC[7],R[-1]C&"|"&RC[7]) -> 1|8|1|7|1|22|1 | E103: =IF(RC2=1,RC[7],R[-1]C&"|"&RC[7]) -> 150|300|450|600|750|900|1050 | F103: 天赋 7 | G103: =VLOOKUP(RC[4],Sheet1!R8C1:R38C3,2,FALSE)&"+"&IF(VLOOKUP(RC[4],Sheet1!R8C1:R38C3,3,FALSE)="固定值",RC[5],RC[5]/100&"%") -> 攻击+1050 | K103: 1 | L103: =VLOOKUP(INT(MOD(RC[-11],1000)/100),R7C9:R9C10,2,FALSE)*RC[-10]*100 -> 1050
A104: 406 | B104: 8 | C104: 160 | D104: =IF(RC2=1,RC[7],R[-1]C&"|"&RC[7]) -> 1|8|1|7|1|22|1|13 | E104: =IF(RC2=1,RC[7],R[-1]C&"|"&RC[7]) -> 150|300|450|600|750|900|1050|1200 | F104: 天赋 8 | G104: =VLOOKUP(RC[4],Sheet1!R8C1:R38C3,2,FALSE)&"+"&IF(VLOOKUP(RC[4],Sheet1!R8C1:R38C3,3,FALSE)="固定值",RC[5],RC[5]/100&"%") -> 暴击+12% | K104: 13 | L104: =VLOOKUP(INT(MOD(RC[-11],1000)/100),R7C9:R9C10,2,FALSE)*RC[-10]*100 -> 1200
A105: 406 | B105: 9 | C105: 180 | D105: =IF(RC2=1,RC[7],R[-1]C&"|"&RC[7]) -> 1|8|1|7|1|22|1|13|1 | E105: =IF(RC2=1,RC[7],R[-1]C&"|"&RC[7]) -> 150|300|450|600|750|900|1050|1200|1350 | F105: 天赋 9 | G105: =VLOOKUP(RC[4],Sheet1!R8C1:R38C3,2,FALSE)&"+"&IF(VLOOKUP(RC[4],Sheet1!R8C1:R38C3,3,FALSE)="固定值",RC[5],RC[5]/100&"%") -> 攻击+1350 | K105: 1 | L105: =VLOOKUP(INT(MOD(RC[-11],1000)/100),R7C9:R9C10,2,FALSE)*RC[-10]*100 -> 1350
A106: 406 | B106: 10 | C106: 200 | D106: =IF(RC2=1,RC[7],R[-1]C&"|"&RC[7]) -> 1|8|1|7|1|22|1|13|1|22 | E106: =IF(RC2=1,RC[7],R[-1]C&"|"&RC[7]) -> 150|300|450|600|750|900|1050|1200|1350|1500 | F106: 天赋 10 | G106: =VLOOKUP(RC[4],Sheet1!R8C1:R38C3,2,FALSE)&"+"&IF(VLOOKUP(RC[4],Sheet1!R8C1:R38C3,3,FALSE)="固定值",RC[5],RC[5]/100&"%") -> 攻击+15% | K106: 22 | L106: =VLOOKUP(INT(MOD(RC[-11],1000)/100),R7C9:R9C10,2,FALSE)*RC[-10]*100 -> 1500
A107: 407 | B107: 1 | C107: 20 | D107: =IF(RC2=1,RC[7],R[-1]C&"|"&RC[7]) -> 1 | E107: =IF(RC2=1,RC[7],R[-1]C&"|"&RC[7]) -> 150 | F107: 天赋 1 | G107: =VLOOKUP(RC[4],Sheet1!R8C1:R38C3,2,FALSE)&"+"&IF(VLOOKUP(RC[4],Sheet1!R8C1:R38C3,3,FALSE)="固定值",RC[5],RC[5]/100&"%") -> 攻击+150 | K107: 1 | L107: =VLOOKUP(INT(MOD(RC[-11],1000)/100),R7C9:R9C10,2,FALSE)*RC[-10]*100 -> 150
A108: 407 | B108: 2 | C108: 40 | D108: =IF(RC2=1,RC[7],R[-1]C&"|"&RC[7]) -> 1|8 | E108: =IF(RC2=1,RC[7],R[-1]C&"|"&RC[7]) -> 150|300 | F108: 天赋 2 | G108: =VLOOKUP(RC[4],Sheet1!R8C1:R38C3,2,FALSE)&"+"&IF(VLOOKUP(RC[4],Sheet1!R8C1:R38C3,3,FALSE)="固定值",RC[5],RC[5]/100&"%") -> 附伤+300 | K108: 8 | L108: =VLOOKUP(INT(MOD(RC[-11],1000)/100),R7C9:R9C10,2,FALSE)*RC[-10]*100 -> 300
A109: 407 | B109: 3 | C109: 60 | D109: =IF(RC2=1,RC[7],R[-1]C&"|"&RC[7]) -> 1|8|1 | E109: =IF(RC2=1,RC[7],R[-1]C&"|"&RC[7]) -> 150|300|450 | F109: 天赋 3 | G109: =VLOOKUP(RC[4],Sheet1!R8C1:R38C3,2,FALSE)&"+"&IF(VLOOKUP(RC[4],Sheet1!R8C1:R38C3,3,FALSE)="固定值",RC[5],RC[5]/100&"%") -> 攻击+450 | K109: 1 | L109: =VLOOKUP(INT(MOD(RC[-11],1000)/100),R7C9:R9C10,2,FALSE)*RC[-10]*100 -> 450
A110: 407 | B110: 4 | C110: 80 | D110: =IF(RC2=1,RC[7],R[-1]C&"|"&RC[7]) -> 1|8|1|7 | E110: =IF(RC2=1,RC[7],R[-1]C&"|"&RC[7]) -> 150|300|450|600 | F110: 天赋 4 | G110: =VLOOKUP(RC[4],Sheet1!R8C1:R38C3,2,FALSE)&"+"&IF(VLOOKUP(RC[4],Sheet1!R8C1:R38C3,3,FALSE)="固定值",RC[5],RC[5]/100&"%") -> 伤害+6% | K110: 7 | L110: =VLOOKUP(INT(MOD(RC[-11],1000)/100),R7C9:R9C10,2,FALSE)*RC[-10]*100 -> 600
A111: 407 | B111: 5 | C111: 100 | D111: =IF(RC2=1,RC[7],R[-1]C&"|"&RC[7]) -> 1|8|1|7|1 | E111: =IF(RC2=1,RC[7],R[-1]C&"|"&RC[7]) -> 150|300|450|600|750 | F111: 天赋 5 | G111: =VLOOKUP(RC[4],Sheet1!R8C1:R38C3,2,FALSE)&"+"&IF(VLOOKUP(RC[4],Sheet1!R8C1:R38C3,3,FALSE)="固定值",RC[5],RC[5]/100&"%") -> 攻击+750 | K111: 1 | L111: =VLOOKUP(INT(MOD(RC[-11],1000)/100),R7C9:R9C10,2,FALSE)*RC[-10]*100 -> 750
A112: 407 | B112: 6 | C112: 120 | D112: =IF(RC2=1,RC[7],R[-1]C&"|"&RC[7]) -> 1|8|1|7|1|22 | E112: =IF(RC2=1,RC[7],R[-1]C&"|"&RC[7]) -> 150|300|450|600|750|900 | F112: 天赋 6 | G112: =VLOOKUP(RC[4],Sheet1!R8C1:R38C3,2,FALSE)&"+"&IF(VLOOKUP(RC[4],Sheet1!R8C1:R38C3,3,FALSE)="固定值",RC[5],RC[5]/100&"%") -> 攻击+9% | K112: 22 | L112: =VLOOKUP(INT(MOD(RC[-11],1000)/100),R7C9:R9C10,2,FALSE)*RC[-10]*100 -> 900
A113: 407 | B113: 7 | C113: 140 | D113: =IF(RC2=1,RC[7],R[-1]C&"|"&RC[7]) -> 1|8|1|7|1|22|1 | E113: =IF(RC2=1,RC[7],R[-1]C&"|"&RC[7]) -> 150|300|450|600|750|900|1050 | F113: 天赋 7 | G113: =VLOOKUP(RC[4],Sheet1!R8C1:R38C3,2,FALSE)&"+"&IF(VLOOKUP(RC[4],Sheet1!R8C1:R38C3,3,FALSE)="固定值",RC[5],RC[5]/100&"%") -> 攻击+1050 | K113: 1 | L113: =VLOOKUP(INT(MOD(RC[-11],1000)/100),R7C9:R9C10,2,FALSE)*RC[-10]*100 -> 1050
A114: 407 | B114: 8 | C114: 160 | D114: =IF(RC2=1,RC[7],R[-1]C&"|"&RC[7]) -> 1|8|1|7|1|22|1|13 | E114: =IF(RC2=1,RC[7],R[-1]C&"|"&RC[7]) -> 150|300|450|600|750|900|1050|1200 | F114: 天赋 8 | G114: =VLOOKUP(RC[4],Sheet1!R8C1:R38C3,2,FALSE)&"+"&IF(VLOOKUP(RC[4],Sheet1!R8C1:R38C3,3,FALSE)="固定值",RC[5],RC[5]/100&"%") -> 暴击+12% | K114: 13 | L114: =VLOOKUP(INT(MOD(RC[-11],1000)/100),R7C9:R9C10,2,FALSE)*RC[-10]*100 -> 1200
A115: 407 | B115: 9 | C115: 180 | D115: =IF(RC2=1,RC[7],R[-1]C&"|"&RC[7]) -> 1|8|1|7|1|22|1|13|1 | E115: =IF(RC2=1,RC[7],R[-1]C&"|"&RC[7]) -> 150|300|450|600|750|900|1050|1200|1350 | F115: 天赋 9 | G115: =VLOOKUP(RC[4],Sheet1!R8C1:R38C3,2,FALSE)&"+"&IF(VLOOKUP(RC[4],Sheet1!R8C1:R38C3,3,FALSE)="固定值",RC[5],RC[5]/100&"%") -> 攻击+1350 | K115: 1 | L115: =VLOOKUP(INT(MOD(RC[-11],1000)/100),R7C9:R9C10,2,FALSE)*RC[-10]*100 -> 1350
A116: 407 | B116: 10 | C116: 200 | D116: =IF(RC2=1,RC[7],R[-1]C&"|"&RC[7]) -> 1|8|1|7|1|22|1|13|1|22 | E116: =IF(RC2=1,RC[7],R[-1]C&"|"&RC[7]) -> 150|300|450|600|750|900|1050|1200|1350|1500 | F116: 天赋 10 | G116: =VLOOKUP(RC[4],Sheet1!R8C1:R38C3,2,FALSE)&"+"&IF(VLOOKUP(RC[4],Sheet1!R8C1:R38C3,3,FALSE)="固定值",RC[5],RC[5]/100&"%") -> 攻击+15% | K116: 22 | L116: =VLOOKUP(INT(MOD(RC[-11],1000)/100),R7C9:R9C10,2,FALSE)*RC[-10]*100 -> 1500
A117: 408 | B117: 1 | C117: 20 | D117: =IF(RC2=1,RC[7],R[-1]C&"|"&RC[7]) -> 1 | E117: =IF(RC2=1,RC[7],R[-1]C&"|"&RC[7]) -> 150 | F117: 天赋 1 | G117: =VLOOKUP(RC[4],Sheet1!R8C1:R38C3,2,FALSE)&"+"&IF(VLOOKUP(RC[4],Sheet1!R8C1:R38C3,3,FALSE)="固定值",RC[5],RC[5]/100&"%") -> 攻击+150 | K117: 1 | L117: =VLOOKUP(INT(MOD(RC[-11],1000)/100),R7C9:R9C10,2,FALSE)*RC[-10]*100 -> 150
A118: 408 | B118: 2 | C118: 40 | D118: =IF(RC2=1,RC[7],R[-1]C&"|"&RC[7]) -> 1|8 | E118: =IF(RC2=1,RC[7],R[-1]C&"|"&RC[7]) -> 150|300 | F118: 天赋 2 | G118: =VLOOKUP(RC[4],Sheet1!R8C1:R38C3,2,FALSE)&"+"&IF(VLOOKUP(RC[4],Sheet1!R8C1:R38C3,3,FALSE)="固定值",RC[5],RC[5]/100&"%") -> 附伤+300 | K118: 8 | L118: =VLOOKUP(INT(MOD(RC[-11],1000)/100),R7C9:R9C10,2,FALSE)*RC[-10]*100 -> 300
A119: 408 | B119: 3 | C119: 60 | D119: =IF(RC2=1,RC[7],R[-1]C&"|"&RC[7]) -> 1|8|1 | E119: =IF(RC2=1,RC[7],R[-1]C&"|"&RC[7]) -> 150|300|450 | F119: 天赋 3 | G119: =VLOOKUP(RC[4],Sheet1!R8C1:R38C3,2,FALSE)&"+"&IF(VLOOKUP(RC[4],Sheet1!R8C1:R38C3,3,FALSE)="固定值",RC[5],RC[5]/100&"%") -> 攻击+450 | K119: 1 | L119: =VLOOKUP(INT(MOD(RC[-11],1000)/100),R7C9:R9C10,2,FALSE)*RC[-10]*100 -> 450
A120: 408 | B120: 4 | C120: 80 | D120: =IF(RC2=1,RC[7],R[-1]C&"|"&RC[7]) -> 1|8|1|7 | E120: =IF(RC2=1,RC[7],R[-1]C&"|"&RC[7]) -> 150|300|450|600 | F120: 天赋 4 | G120: =VLOOKUP(RC[4],Sheet1!R8C1:R38C3,2,FALSE)&"+"&IF(VLOOKUP(RC[4],Sheet1!R8C1:R38C3,3,FALSE)="固定值",RC[5],RC[5]/100&"%") -> 伤害+6% | K120: 7 | L120: =VLOOKUP(INT(MOD(RC[-11],1000)/100),R7C9:R9C10,2,FALSE)*RC[-10]*100 -> 600
A121: 408 | B121: 5 | C121: 100 | D121: =IF(RC2=1,RC[7],R[-1]C&"|"&RC[7]) -> 1|8|1|7|1 | E121: =IF(RC2=1,RC[7],R[-1]C&"|"&RC[7]) -> 150|300|450|600|750 | F121: 天赋 5 | G121: =VLOOKUP(RC[4],Sheet1!R8C1:R38C3,2,FALSE)&"+"&IF(VLOOKUP(RC[4],Sheet1!R8C1:R38C3,3,FALSE)="固定值",RC[5],RC[5]/100&"%") -> 攻击+750 | K121: 1 | L121: =VLOOKUP(INT(MOD(RC[-11],1000)/100),R7C9:R9C10,2,FALSE)*RC[-10]*100 -> 750
A122: 408 | B122: 6 | C122: 120 | D122: =IF(RC2=1,RC[7],R[-1]C&"|"&RC[7]) -> 1|8|1|7|1|22 | E122: =IF(RC2=1,RC[7],R[-1]C&"|"&RC[7]) -> 150|300|450|600|750|900 | F122: 天赋 6 | G122: =VLOOKUP(RC[4],Sheet1!R8C1:R38C3,2,FALSE)&"+"&IF(VLOOKUP(RC[4],Sheet1!R8C1:R38C3,3,FALSE)="固定值",RC[5],RC[5]/100&"%") -> 攻击+9% | K122: 22 | L122: =VLOOKUP(INT(MOD(RC[-11],1000)/100),R7C9:R9C10,2,FALSE)*RC[-10]*100 -> 900
A123: 408 | B123: 7 | C123: 140 | D123: =IF(RC2=1,RC[7],R[-1]C&"|"&RC[7]) -> 1|8|1|7|1|22|1 | E123: =IF(RC2=1,RC[7],R[-1]C&"|"&RC[7]) -> 150|300|450|600|750|900|1050 | F123: 天赋 7 | G123: =VLOOKUP(RC[4],Sheet1!R8C1:R38C3,2,FALSE)&"+"&IF(VLOOKUP(RC[4],Sheet1!R8C1:R38C3,3,FALSE)="固定值",RC[5],RC[5]/100&"%") -> 攻击+1050 | K123: 1 | L123: =VLOOKUP(INT(MOD(RC[-11],1000)/100),R7C9:R9C10,2,FALSE)*RC[-10]*100 -> 1050
A124: 408 | B124: 8 | C124: 160 | D124: =IF(RC2=1,RC[7],R[-1]C&"|"&RC[7]) -> 1|8|1|7|1|22|1|13 | E124: =IF(RC2=1,RC[7],R[-1]C&"|"&RC[7]) -> 150|300|450|600|750|900|1050|1200 | F124: 天赋 8 | G124: =VLOOKUP(RC[4],Sheet1!R8C1:R38C3,2,FALSE)&"+"&IF(VLOOKUP(RC[4],Sheet1!R8C1:R38C3,3,FALSE)="固定值",RC[5],RC[5]/100&"%") -> 暴击+12% | K124: 13 | L124: =VLOOKUP(INT(MOD(RC[-11],1000)/100),R7C9:R9C10,2,FALSE)*RC[-10]*100 -> 1200
A125: 408 | B125: 9 | C125: 180 | D125: =IF(RC2=1,RC[7],R[-1]C&"|"&RC[7]) -> 1|8|1|7|1|22|1|13|1 | E125: =IF(RC2=1,RC[7],R[-1]C&"|"&RC[7]) -> 150|300|450|600|750|900|1050|1200|1350 | F125: 天赋 9 | G125: =VLOOKUP(RC[4],Sheet1!R8C1:R38C3,2,FALSE)&"+"&IF(VLOOKUP(RC[4],Sheet1!R8C1:R38C3,3,FALSE)="固定值",RC[5],RC[5]/100&"%") -> 攻击+1350 | K125: 1 | L125: =VLOOKUP(INT(MOD(RC[-11],1000)/100),R7C9:R9C10,2,FALSE)*RC[-10]*100 -> 1350
A126: 408 | B126: 10 | C126: 200 | D126: =IF(RC2=1,RC[7],R[-1]C&"|"&RC[7]) -> 1|8|1|7|1|22|1|13|1|22 | E126: =IF(RC2=1,RC[7],R[-1]C&"|"&RC[7]) -> 150|300|450|600|750|900|1050|1200|1350|1500 | F126: 天赋 10 | G126: =VLOOKUP(RC[4],Sheet1!R8C1:R38C3,2,FALSE)&"+"&IF(VLOOKUP(RC[4],Sheet1!R8C1:R38C3,3,FALSE)="固定值",RC[5],RC[5]/100&"%") -> 攻击+15% | K126: 22 | L126: =VLOOKUP(INT(MOD(RC[-11],1000)/100),R7C9:R9C10,2,FALSE)*RC[-10]*100 -> 1500
A127: 501 | B127: 1 | C127: 20 | D127: =IF(RC2=1,RC[7],R[-41]C&"|"&RC[7]) -> 1 | E127: =IF(RC2=1,RC[7],R[-41]C&"|"&RC[7]) -> 200 | F127: 天赋 1 | G127: =VLOOKUP(RC[4],Sheet1!R8C1:R38C3,2,FALSE)&"+"&IF(VLOOKUP(RC[4],Sheet1!R8C1:R38C3,3,FALSE)="固定值",RC[5],RC[5]/100&"%") -> 攻击+200 | K127: 1 | L127: =VLOOKUP(INT(MOD(RC[-11],1000)/100),R7C9:R9C10,2,FALSE)*RC[-10]*100 -> 200
A128: 501 | B128: 2 | C128: 40 | D128: =IF(RC2=1,RC[7],R[-1]C&"|"&RC[7]) -> 1|8 | E128: =IF(RC2=1,RC[7],R[-1]C&"|"&RC[7]) -> 200|400 | F128: 天赋 2 | G128: =VLOOKUP(RC[4],Sheet1!R8C1:R38C3,2,FALSE)&"+"&IF(VLOOKUP(RC[4],Sheet1!R8C1:R38C3,3,FALSE)="固定值",RC[5],RC[5]/100&"%") -> 附伤+400 | K128: 8 | L128: =VLOOKUP(INT(MOD(RC[-11],1000)/100),R7C9:R9C10,2,FALSE)*RC[-10]*100 -> 400
A129: 501 | B129: 3 | C129: 60 | D129: =IF(RC2=1,RC[7],R[-1]C&"|"&RC[7]) -> 1|8|1 | E129: =IF(RC2=1,RC[7],R[-1]C&"|"&RC[7]) -> 200|400|600 | F129: 天赋 3 | G129: =VLOOKUP(RC[4],Sheet1!R8C1:R38C3,2,FALSE)&"+"&IF(VLOOKUP(RC[4],Sheet1!R8C1:R38C3,3,FALSE)="固定值",RC[5],RC[5]/100&"%") -> 攻击+600 | K129: 1 | L129: =VLOOKUP(INT(MOD(RC[-11],1000)/100),R7C9:R9C10,2,FALSE)*RC[-10]*100 -> 600
A130: 501 | B130: 4 | C130: 80 | D130: =IF(RC2=1,RC[7],R[-1]C&"|"&RC[7]) -> 1|8|1|7 | E130: =IF(RC2=1,RC[7],R[-1]C&"|"&RC[7]) -> 200|400|600|800 | F130: 天赋 4 | G130: =VLOOKUP(RC[4],Sheet1!R8C1:R38C3,2,FALSE)&"+"&IF(VLOOKUP(RC[4],Sheet1!R8C1:R38C3,3,FALSE)="固定值",RC[5],RC[5]/100&"%") -> 伤害+8% | K130: 7 | L130: =VLOOKUP(INT(MOD(RC[-11],1000)/100),R7C9:R9C10,2,FALSE)*RC[-10]*100 -> 800
A131: 501 | B131: 5 | C131: 100 | D131: =IF(RC2=1,RC[7],R[-1]C&"|"&RC[7]) -> 1|8|1|7|1 | E131: =IF(RC2=1,RC[7],R[-1]C&"|"&RC[7]) -> 200|400|600|800|1000 | F131: 天赋 5 | G131: =VLOOKUP(RC[4],Sheet1!R8C1:R38C3,2,FALSE)&"+"&IF(VLOOKUP(RC[4],Sheet1!R8C1:R38C3,3,FALSE)="固定值",RC[5],RC[5]/100&"%") -> 攻击+1000 | K131: 1 | L131: =VLOOKUP(INT(MOD(RC[-11],1000)/100),R7C9:R9C10,2,FALSE)*RC[-10]*100 -> 1000
A132: 501 | B132: 6 | C132: 120 | D132: =IF(RC2=1,RC[7],R[-1]C&"|"&RC[7]) -> 1|8|1|7|1|22 | E132: =IF(RC2=1,RC[7],R[-1]C&"|"&RC[7]) -> 200|400|600|800|1000|1200 | F132: 天赋 6 | G132: =VLOOKUP(RC[4],Sheet1!R8C1:R38C3,2,FALSE)&"+"&IF(VLOOKUP(RC[4],Sheet1!R8C1:R38C3,3,FALSE)="固定值",RC[5],RC[5]/100&"%") -> 攻击+12% | K132: 22 | L132: =VLOOKUP(INT(MOD(RC[-11],1000)/100),R7C9:R9C10,2,FALSE)*RC[-10]*100 -> 1200
A133: 501 | B133: 7 | C133: 140 | D133: =IF(RC2=1,RC[7],R[-1]C&"|"&RC[7]) -> 1|8|1|7|1|22|1 | E133: =IF(RC2=1,RC[7],R[-1]C&"|"&RC[7]) -> 200|400|600|800|1000|1200|1400 | F133: 天赋 7 | G133: =VLOOKUP(RC[4],Sheet1!R8C1:R38C3,2,FALSE)&"+"&IF(VLOOKUP(RC[4],Sheet1!R8C1:R38C3,3,FALSE)="固定值",RC[5],RC[5]/100&"%") -> 攻击+1400 | K133: 1 | L133: =VLOOKUP(INT(MOD(RC[-11],1000)/100),R7C9:R9C10,2,FALSE)*RC[-10]*100 -> 1400
A134: 501 | B134: 8 | C134: 160 | D134: =IF(RC2=1,RC[7],R[-1]C&"|"&RC[7]) -> 1|8|1|7|1|22|1|13 | E134: =IF(RC2=1,RC[7],R[-1]C&"|"&RC[7]) -> 200|400|600|800|1000|1200|1400|1600 | F134: 天赋 8 | G134: =VLOOKUP(RC[4],Sheet1!R8C1:R38C3,2,FALSE)&"+"&IF(VLOOKUP(RC[4],Sheet1!R8C1:R38C3,3,FALSE)="固定值",RC[5],RC[5]/100&"%") -> 暴击+16% | K134: 13 | L134: =VLOOKUP(INT(MOD(RC[-11],1000)/100),R7C9:R9C10,2,FALSE)*RC[-10]*100 -> 1600
A135: 501 | B135: 9 | C135: 180 | D135: =IF(RC2=1,RC[7],R[-1]C&"|"&RC[7]) -> 1|8|1|7|1|22|1|13|1 | E135: =IF(RC2=1,RC[7],R[-1]C&"|"&RC[7]) -> 200|400|600|800|1000|1200|1400|1600|1800 | F135: 天赋 9 | G135: =VLOOKUP(RC[4],Sheet1!R8C1:R38C3,2,FALSE)&"+"&IF(VLOOKUP(RC[4],Sheet1!R8C1:R38C3,3,FALSE)="固定值",RC[5],RC[5]/100&"%") -> 攻击+1800 | K135: 1 | L135: =VLOOKUP(INT(MOD(RC[-11],1000)/100),R7C9:R9C10,2,FALSE)*RC[-10]*100 -> 1800
A136: 501 | B136: 10 | C136: 200 | D136: =IF(RC2=1,RC[7],R[-1]C&"|"&RC[7]) -> 1|8|1|7|1|22|1|13|1|22 | E136: =IF(RC2=1,RC[7],R[-1]C&"|"&RC[7]) -> 200|400|600|800|1000|1200|1400|1600|1800|2000 | F136: 天赋 10 | G136: =VLOOKUP(RC[4],Sheet1!R8C1:R38C3,2,FALSE)&"+"&IF(VLOOKUP(RC[4],Sheet1!R8C1:R38C3,3,FALSE)="固定值",RC[5],RC[5]/100&"%") -> 攻击+20% | K136: 22 | L136: =VLOOKUP(INT(MOD(RC[-11],1000)/100),R7C9:R9C10,2,FALSE)*RC[-10]*100 -> 2000
A137: 502 | B137: 1 | C137: 20 | D137: =IF(RC2=1,RC[7],R[-1]C&"|"&RC[7]) -> 1 | E137: =IF(RC2=1,RC[7],R[-1]C&"|"&RC[7]) -> 200 | F137: 天赋 1 | G137: =VLOOKUP(RC[4],Sheet1!R8C1:R38C3,2,FALSE)&"+"&IF(VLOOKUP(RC[4],Sheet1!R8C1:R38C3,3,FALSE)="固定值",RC[5],RC[5]/100&"%") -> 攻击+200 | K137: 1 | L137: =VLOOKUP(INT(MOD(RC[-11],1000)/100),R7C9:R9C10,2,FALSE)*RC[-10]*100 -> 200
A138: 502 | B138: 2 | C138: 40 | D138: =IF(RC2=1,RC[7],R[-1]C&"|"&RC[7]) -> 1|8 | E138: =IF(RC2=1,RC[7],R[-1]C&"|"&RC[7]) -> 200|400 | F138: 天赋 2 | G138: =VLOOKUP(RC[4],Sheet1!R8C1:R38C3,2,FALSE)&"+"&IF(VLOOKUP(RC[4],Sheet1!R8C1:R38C3,3,FALSE)="固定值",RC[5],RC[5]/100&"%") -> 附伤+400 | K138: 8 | L138: =VLOOKUP(INT(MOD(RC[-11],1000)/100),R7C9:R9C10,2,FALSE)*RC[-10]*100 -> 400
A139: 502 | B139: 3 | C139: 60 | D139: =IF(RC2=1,RC[7],R[-1]C&"|"&RC[7]) -> 1|8|1 | E139: =IF(RC2=1,RC[7],R[-1]C&"|"&RC[7]) -> 200|400|600 | F139: 天赋 3 | G139: =VLOOKUP(RC[4],Sheet1!R8C1:R38C3,2,FALSE)&"+"&IF(VLOOKUP(RC[4],Sheet1!R8C1:R38C3,3,FALSE)="固定值",RC[5],RC[5]/100&"%") -> 攻击+600 | K139: 1 | L139: =VLOOKUP(INT(MOD(RC[-11],1000)/100),R7C9:R9C10,2,FALSE)*RC[-10]*100 -> 600
A140: 502 | B140: 4 | C140: 80 | D140: =IF(RC2=1,RC[7],R[-1]C&"|"&RC[7]) -> 1|8|1|7 | E140: =IF(RC2=1,RC[7],R[-1]C&"|"&RC[7]) -> 200|400|600|800 | F140: 天赋 4 | G140: =VLOOKUP(RC[4],Sheet1!R8C1:R38C3,2,FALSE)&"+"&IF(VLOOKUP(RC[4],Sheet1!R8C1:R38C3,3,FALSE)="固定值",RC[5],RC[5]/100&"%") -> 伤害+8% | K140: 7 | L140: =VLOOKUP(INT(MOD(RC[-11],1000)/100),R7C9:R9C10,2,FALSE)*RC[-10]*100 -> 800
A141: 502 | B141: 5 | C141: 100 | D141: =IF(RC2=1,RC[7],R[-1]C&"|"&RC[7]) -> 1|8|1|7|1 | E141: =IF(RC2=1,RC[7],R[-1]C&"|"&RC[7]) -> 200|400|600|800|1000 | F141: 天赋 5 | G141: =VLOOKUP(RC[4],Sheet1!R8C1:R38C3,2,FALSE)&"+"&IF(VLOOKUP(RC[4],Sheet1!R8C1:R38C3,3,FALSE)="固定值",RC[5],RC[5]/100&"%") -> 攻击+1000 | K141: 1 | L141: =VLOOKUP(INT(MOD(RC[-11],1000)/100),R7C9:R9C10,2,FALSE)*RC[-10]*100 -> 1000
A142: 502 | B142: 6 | C142: 120 | D142: =IF(RC2=1,RC[7],R[-1]C&"|"&RC[7]) -> 1|8|1|7|1|22 | E142: =IF(RC2=1,RC[7],R[-1]C&"|"&RC[7]) -> 200|400|600|800|1000|1200 | F142: 天赋 6 | G142: =VLOOKUP(RC[4],Sheet1!R8C1:R38C3,2,FALSE)&"+"&IF(VLOOKUP(RC[4],Sheet1!R8C1:R38C3,3,FALSE)="固定值",RC[5],RC[5]/100&"%") -> 攻击+12% | K142: 22 | L142: =VLOOKUP(INT(MOD(RC[-11],1000)/100),R7C9:R9C10,2,FALSE)*RC[-10]*100 -> 1200
A143: 502 | B143: 7 | C143: 140 | D143: =IF(RC2=1,RC[7],R[-1]C&"|"&RC[7]) -> 1|8|1|7|1|22|1 | E143: =IF(RC2=1,RC[7],R[-1]C&"|"&RC[7]) -> 200|400|600|800|1000|1200|1400 | F143: 天赋 7 | G143: =VLOOKUP(RC[4],Sheet1!R8C1:R38C3,2,FALSE)&"+"&IF(VLOOKUP(RC[4],Sheet1!R8C1:R38C3,3,FALSE)="固定值",RC[5],RC[5]/100&"%") -> 攻击+1400 | K143: 1 | L143: =VLOOKUP(INT(MOD(RC[-11],1000)/100),R7C9:R9C10,2,FALSE)*RC[-10]*100 -> 1400
A144: 502 | B144: 8 | C144: 160 | D144: =IF(RC2=1,RC[7],R[-1]C&"|"&RC[7]) -> 1|8|1|7|1|22|1|13 | E144: =IF(RC2=1,RC[7],R[-1]C&"|"&RC[7]) -> 200|400|600|800|1000|1200|1400|1600 | F144: 天赋 8 | G144: =VLOOKUP(RC[4],Sheet1!R8C1:R38C3,2,FALSE)&"+"&IF(VLOOKUP(RC[4],Sheet1!R8C1:R38C3,3,FALSE)="固定值",RC[5],RC[5]/100&"%") -> 暴击+16% | K144: 13 | L144: =VLOOKUP(INT(MOD(RC[-11],1000)/100),R7C9:R9C10,2,FALSE)*RC[-10]*100 -> 1600
A145: 502 | B145: 9 | C145: 180 | D145: =IF(RC2=1,RC[7],R[-1]C&"|"&RC[7]) -> 1|8|1|7|1|22|1|13|1 | E145: =IF(RC2=1,RC[7],R[-1]C&"|"&RC[7]) -> 200|400|600|800|1000|1200|1400|1600|1800 | F145: 天赋 9 | G145: =VLOOKUP(RC[4],Sheet1!R8C1:R38C3,2,FALSE)&"+"&IF(VLOOKUP(RC[4],Sheet1!R8C1:R38C3,3,FALSE)="固定值",RC[5],RC[5]/100&"%") -> 攻击+1800 | K145: 1 | L145: =VLOOKUP(INT(MOD(RC[-11],1000)/100),R7C9:R9C10,2,FALSE)*RC[-10]*100 -> 1800
A146: 502 | B146: 10 | C146: 200 | D146: =IF(RC2=1,RC[7],R[-1]C&"|"&RC[7]) -> 1|8|1|7|1|22|1|13|1|22 | E146: =IF(RC2=1,RC[7],R[-1]C&"|"&RC[7]) -> 200|400|600|800|1000|1200|1400|1600|1800|2000 | F146: 天赋 10 | G146: =VLOOKUP(RC[4],Sheet1!R8C1:R38C3,2,FALSE)&"+"&IF(VLOOKUP(RC[4],Sheet1!R8C1:R38C3,3,FALSE)="固定值",RC[5],RC[5]/100&"%") -> 攻击+20% | K146: 22 | L146: =VLOOKUP(INT(MOD(RC[-11],1000)/100),R7C9:R9C10,2,FALSE)*RC[-10]*100 -> 2000
A147: 503 | B147: 1 | C147: 20 | D147: =IF(RC2=1,RC[7],R[-1]C&"|"&RC[7]) -> 1 | E147: =IF(RC2=1,RC[7],R[-1]C&"|"&RC[7]) -> 200 | F147: 天赋 1 | G147: =VLOOKUP(RC[4],Sheet1!R8C1:R38C3,2,FALSE)&"+"&IF(VLOOKUP(RC[4],Sheet1!R8C1:R38C3,3,FALSE)="固定值",RC[5],RC[5]/100&"%") -> 攻击+200 | K147: 1 | L147: =VLOOKUP(INT(MOD(RC[-11],1000)/100),R7C9:R9C10,2,FALSE)*RC[-10]*100 -> 200
A148: 503 | B148: 2 | C148: 40 | D148: =IF(RC2=1,RC[7],R[-1]C&"|"&RC[7]) -> 1|8 | E148: =IF(RC2=1,RC[7],R[-1]C&"|"&RC[7]) -> 200|400 | F148: 天赋 2 | G148: =VLOOKUP(RC[4],Sheet1!R8C1:R38C3,2,FALSE)&"+"&IF(VLOOKUP(RC[4],Sheet1!R8C1:R38C3,3,FALSE)="固定值",RC[5],RC[5]/100&"%") -> 附伤+400 | K148: 8 | L148: =VLOOKUP(INT(MOD(RC[-11],1000)/100),R7C9:R9C10,2,FALSE)*RC[-10]*100 -> 400
A149: 503 | B149: 3 | C149: 60 | D149: =IF(RC2=1,RC[7],R[-1]C&"|"&RC[7]) -> 1|8|1 | E149: =IF(RC2=1,RC[7],R[-1]C&"|"&RC[7]) -> 200|400|600 | F149: 天赋 3 | G149: =VLOOKUP(RC[4],Sheet1!R8C1:R38C3,2,FALSE)&"+"&IF(VLOOKUP(RC[4],Sheet1!R8C1:R38C3,3,FALSE)="固定值",RC[5],RC[5]/100&"%") -> 攻击+600 | K149: 1 | L149: =VLOOKUP(INT(MOD(RC[-11],1000)/100),R7C9:R9C10,2,FALSE)*RC[-10]*100 -> 600
A150: 503 | B150: 4 | C150: 80 | D150: =IF(RC2=1,RC[7],R[-1]C&"|"&RC[7]) -> 1|8|1|7 | E150: =IF(RC2=1,RC[7],R[-1]C&"|"&RC[7]) -> 200|400|600|800 | F150: 天赋 4 | G150: =VLOOKUP(RC[4],Sheet1!R8C1:R38C3,2,FALSE)&"+"&IF(VLOOKUP(RC[4],Sheet1!R8C1:R38C3,3,FALSE)="固定值",RC[5],RC[5]/100&"%") -> 伤害+8% | K150: 7 | L150: =VLOOKUP(INT(MOD(RC[-11],1000)/100),R7C9:R9C10,2,FALSE)*RC[-10]*100 -> 800
A151: 503 | B151: 5 | C151: 100 | D151: =IF(RC2=1,RC[7],R[-1]C&"|"&RC[7]) -> 1|8|1|7|1 | E151: =IF(RC2=1,RC[7],R[-1]C&"|"&RC[7]) -> 200|400|600|800|1000 | F151: 天赋 5 | G151: =VLOOKUP(RC[4],Sheet1!R8C1:R38C3,2,FALSE)&"+"&IF(VLOOKUP(RC[4],Sheet1!R8C1:R38C3,3,FALSE)="固定值",RC[5],RC[5]/100&"%") -> 攻击+1000 | K151: 1 | L151: =VLOOKUP(INT(MOD(RC[-11],1000)/100),R7C9:R9C10,2,FALSE)*RC[-10]*100 -> 1000
A152: 503 | B152: 6 | C152: 120 | D152: =IF(RC2=1,RC[7],R[-1]C&"|"&RC[7]) -> 1|8|1|7|1|22 | E152: =IF(RC2=1,RC[7],R[-1]C&"|"&RC[7]) -> 200|400|600|800|1000|1200 | F152: 天赋 6 | G152: =VLOOKUP(RC[4],Sheet1!R8C1:R38C3,2,FALSE)&"+"&IF(VLOOKUP(RC[4],Sheet1!R8C1:R38C3,3,FALSE)="固定值",RC[5],RC[5]/100&"%") -> 攻击+12% | K152: 22 | L152: =VLOOKUP(INT(MOD(RC[-11],1000)/100),R7C9:R9C10,2,FALSE)*RC[-10]*100 -> 1200
A153: 503 | B153: 7 | C153: 140 | D153: =IF(RC2=1,RC[7],R[-1]C&"|"&RC[7]) -> 1|8|1|7|1|22|1 | E153: =IF(RC2=1,RC[7],R[-1]C&"|"&RC[7]) -> 200|400|600|800|1000|1200|1400 | F153: 天赋 7 | G153: =VLOOKUP(RC[4],Sheet1!R8C1:R38C3,2,FALSE)&"+"&IF(VLOOKUP(RC[4],Sheet1!R8C1:R38C3,3,FALSE)="固定值",RC[5],RC[5]/100&"%") -> 攻击+1400 | K153: 1 | L153: =VLOOKUP(INT(MOD(RC[-11],1000)/100),R7C9:R9C10,2,FALSE)*RC[-10]*100 -> 1400
A154: 503 | B154: 8 | C154: 160 | D154: =IF(RC2=1,RC[7],R[-1]C&"|"&RC[7]) -> 1|8|1|7|1|22|1|13 | E154: =IF(RC2=1,RC[7],R[-1]C&"|"&RC[7]) -> 200|400|600|800|1000|1200|1400|1600 | F154: 天赋 8 | G154: =VLOOKUP(RC[4],Sheet1!R8C1:R38C3,2,FALSE)&"+"&IF(VLOOKUP(RC[4],Sheet1!R8C1:R38C3,3,FALSE)="固定值",RC[5],RC[5]/100&"%") -> 暴击+16% | K154: 13 | L154: =VLOOKUP(INT(MOD(RC[-11],1000)/100),R7C9:R9C10,2,FALSE)*RC[-10]*100 -> 1600
A155: 503 | B155: 9 | C155: 180 | D155: =IF(RC2=1,RC[7],R[-1]C&"|"&RC[7]) -> 1|8|1|7|1|22|1|13|1 | E155: =IF(RC2=1,RC[7],R[-1]C&"|"&RC[7]) -> 200|400|600|800|1000|1200|1400|1600|1800 | F155: 天赋 9 | G155: =VLOOKUP(RC[4],Sheet1!R8C1:R38C3,2,FALSE)&"+"&IF(VLOOKUP(RC[4],Sheet1!R8C1:R38C3,3,FALSE)="固定值",RC[5],RC[5]/100&"%") -> 攻击+1800 | K155: 1 | L155: =VLOOKUP(INT(MOD(RC[-11],1000)/100),R7C9:R9C10,2,FALSE)*RC[-10]*100 -> 1800
A156: 503 | B156: 10 | C156: 200 | D156: =IF(RC2=1,RC[7],R[-1]C&"|"&RC[7]) -> 1|8|1|7|1|22|1|13|1|22 | E156: =IF(RC2=1,RC[7],R[-1]C&"|"&RC[7]) -> 200|400|600|800|1000|1200|1400|1600|1800|2000 | F156: 天赋 10 | G156: =VLOOKUP(RC[4],Sheet1!R8C1:R38C3,2,FALSE)&"+"&IF(VLOOKUP(RC[4],Sheet1!R8C1:R38C3,3,FALSE)="固定值",RC[5],RC[5]/100&"%") -> 攻击+20% | K156: 22 | L156: =VLOOKUP(INT(MOD(RC[-11],1000)/100),R7C9:R9C10,2,FALSE)*RC[-10]*100 -> 2000
A157: 504 | B157: 1 | C157: 20 | D157: =IF(RC2=1,RC[7],R[-1]C&"|"&RC[7]) -> 1 | E157: =IF(RC2=1,RC[7],R[-1]C&"|"&RC[7]) -> 200 | F157: 天赋 1 | G157: =VLOOKUP(RC[4],Sheet1!R8C1:R38C3,2,FALSE)&"+"&IF(VLOOKUP(RC[4],Sheet1!R8C1:R38C3,3,FALSE)="固定值",RC[5],RC[5]/100&"%") -> 攻击+200 | K157: 1 | L157: =VLOOKUP(INT(MOD(RC[-11],1000)/100),R7C9:R9C10,2,FALSE)*RC[-10]*100 -> 200
A158: 504 | B158: 2 | C158: 40 | D158: =IF(RC2=1,RC[7],R[-1]C&"|"&RC[7]) -> 1|8 | E158: =IF(RC2=1,RC[7],R[-1]C&"|"&RC[7]) -> 200|400 | F158: 天赋 2 | G158: =VLOOKUP(RC[4],Sheet1!R8C1:R38C3,2,FALSE)&"+"&IF(VLOOKUP(RC[4],Sheet1!R8C1:R38C3,3,FALSE)="固定值",RC[5],RC[5]/100&"%") -> 附伤+400 | K158: 8 | L158: =VLOOKUP(INT(MOD(RC[-11],1000)/100),R7C9:R9C10,2,FALSE)*RC[-10]*100 -> 400
A159: 504 | B159: 3 | C159: 60 | D159: =IF(RC2=1,RC[7],R[-1]C&"|"&RC[7]) -> 1|8|1 | E159: =IF(RC2=1,RC[7],R[-1]C&"|"&RC[7]) -> 200|400|600 | F159: 天赋 3 | G159: =VLOOKUP(RC[4],Sheet1!R8C1:R38C3,2,FALSE)&"+"&IF(VLOOKUP(RC[4],Sheet1!R8C1:R38C3,3,FALSE)="固定值",RC[5],RC[5]/100&"%") -> 攻击+600 | K159: 1 | L159: =VLOOKUP(INT(MOD(RC[-11],1000)/100),R7C9:R9C10,2,FALSE)*RC[-10]*100 -> 600
A160: 504 | B160: 4 | C160: 80 | D160: =IF(RC2=1,RC[7],R[-1]C&"|"&RC[7]) -> 1|8|1|7 | E160: =IF(RC2=1,RC[7],R[-1]C&"|"&RC[7]) -> 200|400|600|800 | F160: 天赋 4 | G160: =VLOOKUP(RC[4],Sheet1!R8C1:R38C3,2,FALSE)&"+"&IF(VLOOKUP(RC[4],Sheet1!R8C1:R38C3,3,FALSE)="固定值",RC[5],RC[5]/100&"%") -> 伤害+8% | K160: 7 | L160: =VLOOKUP(INT(MOD(RC[-11],1000)/100),R7C9:R9C10,2,FALSE)*RC[-10]*100 -> 800
A161: 504 | B161: 5 | C161: 100 | D161: =IF(RC2=1,RC[7],R[-1]C&"|"&RC[7]) -> 1|8|1|7|1 | E161: =IF(RC2=1,RC[7],R[-1]C&"|"&RC[7]) -> 200|400|600|800|1000 | F161: 天赋 5 | G161: =VLOOKUP(RC[4],Sheet1!R8C1:R38C3,2,FALSE)&"+"&IF(VLOOKUP(RC[4],Sheet1!R8C1:R38C3,3,FALSE)="固定值",RC[5],RC[5]/100&"%") -> 攻击+1000 | K161: 1 | L161: =VLOOKUP(INT(MOD(RC[-11],1000)/100),R7C9:R9C10,2,FALSE)*RC[-10]*100 -> 1000
A162: 504 | B162: 6 | C162: 120 | D162: =IF(RC2=1,RC[7],R[-1]C&"|"&RC[7]) -> 1|8|1|7|1|22 | E162: =IF(RC2=1,RC[7],R[-1]C&"|"&RC[7]) -> 200|400|600|800|1000|1200 | F162: 天赋 6 | G162: =VLOOKUP(RC[4],Sheet1!R8C1:R38C3,2,FALSE)&"+"&IF(VLOOKUP(RC[4],Sheet1!R8C1:R38C3,3,FALSE)="固定值",RC[5],RC[5]/100&"%") -> 攻击+12% | K162: 22 | L162: =VLOOKUP(INT(MOD(RC[-11],1000)/100),R7C9:R9C10,2,FALSE)*RC[-10]*100 -> 1200
A163: 504 | B163: 7 | C163: 140 | D163: =IF(RC2=1,RC[7],R[-1]C&"|"&RC[7]) -> 1|8|1|7|1|22|1 | E163: =IF(RC2=1,RC[7],R[-1]C&"|"&RC[7]) -> 200|400|600|800|1000|1200|1400 | F163: 天赋 7 | G163: =VLOOKUP(RC[4],Sheet1!R8C1:R38C3,2,FALSE)&"+"&IF(VLOOKUP(RC[4],Sheet1!R8C1:R38C3,3,FALSE)="固定值",RC[5],RC[5]/100&"%") -> 攻击+1400 | K163: 1 | L163: =VLOOKUP(INT(MOD(RC[-11],1000)/100),R7C9:R9C10,2,FALSE)*RC[-10]*100 -> 1400
A164: 504 | B164: 8 | C164: 160 | D164: =IF(RC2=1,RC[7],R[-1]C&"|"&RC[7]) -> 1|8|1|7|1|22|1|13 | E164: =IF(RC2=1,RC[7],R[-1]C&"|"&RC[7]) -> 200|400|600|800|1000|1200|1400|1600 | F164: 天赋 8 | G164: =VLOOKUP(RC[4],Sheet1!R8C1:R38C3,2,FALSE)&"+"&IF(VLOOKUP(RC[4],Sheet1!R8C1:R38C3,3,FALSE)="固定值",RC[5],RC[5]/100&"%") -> 暴击+16% | K164: 13 | L164: =VLOOKUP(INT(MOD(RC[-11],1000)/100),R7C9:R9C10,2,FALSE)*RC[-10]*100 -> 1600
A165: 504 | B165: 9 | C165: 180 | D165: =IF(RC2=1,RC[7],R[-1]C&"|"&RC[7]) -> 1|8|1|7|1|22|1|13|1 | E165: =IF(RC2=1,RC[7],R[-1]C&"|"&RC[7]) -> 200|400|600|800|1000|1200|1400|1600|1800 | F165: 天赋 9 | G165: =VLOOKUP(RC[4],Sheet1!R8C1:R38C3,2,FALSE)&"+"&IF(VLOOKUP(RC[4],Sheet1!R8C1:R38C3,3,FALSE)="固定值",RC[5],RC[5]/100&"%") -> 攻击+1800 | K165: 1 | L165: =VLOOKUP(INT(MOD(RC[-11],1000)/100),R7C9:R9C10,2,FALSE)*RC[-10]*100 -> 1800
A166: 504 | B166: 10 | C166: 200 | D166: =IF(RC2=1,RC[7],R[-1]C&"|"&RC[7]) -> 1|8|1|7|1|22|1|13|1|22 | E166: =IF(RC2=1,RC[7],R[-1]C&"|"&RC[7]) -> 200|400|600|800|1000|1200|1400|1600|1800|2000 | F166: 天赋 10 | G166: =VLOOKUP(RC[4],Sheet1!R8C1:R38C3,2,FALSE)&"+"&IF(VLOOKUP(RC[4],Sheet1!R8C1:R38C3,3,FALSE)="固定值",RC[5],RC[5]/100&"%") -> 攻击+20% | K166: 22 | L166: =VLOOKUP(INT(MOD(RC[-11],1000)/100),R7C9:R9C10,2,FALSE)*RC[-10]*100 -> 2000
A167: 505 | B167: 1 | C167: 20 | D167: =IF(RC2=1,RC[7],R[-1]C&"|"&RC[7]) -> 1 | E167: =IF(RC2=1,RC[7],R[-1]C&"|"&RC[7]) -> 200 | F167: 天赋 1 | G167: =VLOOKUP(RC[4],Sheet1!R8C1:R38C3,2,FALSE)&"+"&IF(VLOOKUP(RC[4],Sheet1!R8C1:R38C3,3,FALSE)="固定值",RC[5],RC[5]/100&"%") -> 攻击+200 | K167: 1 | L167: =VLOOKUP(INT(MOD(RC[-11],1000)/100),R7C9:R9C10,2,FALSE)*RC[-10]*100 -> 200
A168: 505 | B168: 2 | C168: 40 | D168: =IF(RC2=1,RC[7],R[-1]C&"|"&RC[7]) -> 1|8 | E168: =IF(RC2=1,RC[7],R[-1]C&"|"&RC[7]) -> 200|400 | F168: 天赋 2 | G168: =VLOOKUP(RC[4],Sheet1!R8C1:R38C3,2,FALSE)&"+"&IF(VLOOKUP(RC[4],Sheet1!R8C1:R38C3,3,FALSE)="固定值",RC[5],RC[5]/100&"%") -> 附伤+400 | K168: 8 | L168: =VLOOKUP(INT(MOD(RC[-11],1000)/100),R7C9:R9C10,2,FALSE)*RC[-10]*100 -> 400
A169: 505 | B169: 3 | C169: 60 | D169: =IF(RC2=1,RC[7],R[-1]C&"|"&RC[7]) -> 1|8|1 | E169: =IF(RC2=1,RC[7],R[-1]C&"|"&RC[7]) -> 200|400|600 | F169: 天赋 3 | G169: =VLOOKUP(RC[4],Sheet1!R8C1:R38C3,2,FALSE)&"+"&IF(VLOOKUP(RC[4],Sheet1!R8C1:R38C3,3,FALSE)="固定值",RC[5],RC[5]/100&"%") -> 攻击+600 | K169: 1 | L169: =VLOOKUP(INT(MOD(RC[-11],1000)/100),R7C9:R9C10,2,FALSE)*RC[-10]*100 -> 600
A170: 505 | B170: 4 | C170: 80 | D170: =IF(RC2=1,RC[7],R[-1]C&"|"&RC[7]) -> 1|8|1|7 | E170: =IF(RC2=1,RC[7],R[-1]C&"|"&RC[7]) -> 200|400|600|800 | F170: 天赋 4 | G170: =VLOOKUP(RC[4],Sheet1!R8C1:R38C3,2,FALSE)&"+"&IF(VLOOKUP(RC[4],Sheet1!R8C1:R38C3,3,FALSE)="固定值",RC[5],RC[5]/100&"%") -> 伤害+8% | K170: 7 | L170: =VLOOKUP(INT(MOD(RC[-11],1000)/100),R7C9:R9C10,2,FALSE)*RC[-10]*100 -> 800
A171: 505 | B171: 5 | C171: 100 | D171: =IF(RC2=1,RC[7],R[-1]C&"|"&RC[7]) -> 1|8|1|7|1 | E171: =IF(RC2=1,RC[7],R[-1]C&"|"&RC[7]) -> 200|400|600|800|1000 | F171: 天赋 5 | G171: =VLOOKUP(RC[4],Sheet1!R8C1:R38C3,2,FALSE)&"+"&IF(VLOOKUP(RC[4],Sheet1!R8C1:R38C3,3,FALSE)="固定值",RC[5],RC[5]/100&"%") -> 攻击+1000 | K171: 1 | L171: =VLOOKUP(INT(MOD(RC[-11],1000)/100),R7C9:R9C10,2,FALSE)*RC[-10]*100 -> 1000
A172: 505 | B172: 6 | C172: 120 | D172: =IF(RC2=1,RC[7],R[-1]C&"|"&RC[7]) -> 1|8|1|7|1|22 | E172: =IF(RC2=1,RC[7],R[-1]C&"|"&RC[7]) -> 200|400|600|800|1000|1200 | F172: 天赋 6 | G172: =VLOOKUP(RC[4],Sheet1!R8C1:R38C3,2,FALSE)&"+"&IF(VLOOKUP(RC[4],Sheet1!R8C1:R38C3,3,FALSE)="固定值",RC[5],RC[5]/100&"%") -> 攻击+12% | K172: 22 | L172: =VLOOKUP(INT(MOD(RC[-11],1000)/100),R7C9:R9C10,2,FALSE)*RC[-10]*100 -> 1200
A173: 505 | B173: 7 | C173: 140 | D173: =IF(RC2=1,RC[7],R[-1]C&"|"&RC[7]) -> 1|8|1|7|1|22|1 | E173: =IF(RC2=1,RC[7],R[-1]C&"|"&RC[7]) -> 200|400|600|800|1000|1200|1400 | F173: 天赋 7 | G173: =VLOOKUP(RC[4],Sheet1!R8C1:R38C3,2,FALSE)&"+"&IF(VLOOKUP(RC[4],Sheet1!R8C1:R38C3,3,FALSE)="固定值",RC[5],RC[5]/100&"%") -> 攻击+1400 | K173: 1 | L173: =VLOOKUP(INT(MOD(RC[-11],1000)/100),R7C9:R9C10,2,FALSE)*RC[-10]*100 -> 1400
A174: 505 | B174: 8 | C174: 160 | D174: =IF(RC2=1,RC[7],R[-1]C&"|"&RC[7]) -> 1|8|1|7|1|22|1|13 | E174: =IF(RC2=1,RC[7],R[-1]C&"|"&RC[7]) -> 200|400|600|800|1000|1200|1400|1600 | F174: 天赋 8 | G174: =VLOOKUP(RC[4],Sheet1!R8C1:R38C3,2,FALSE)&"+"&IF(VLOOKUP(RC[4],Sheet1!R8C1:R38C3,3,FALSE)="固定值",RC[5],RC[5]/100&"%") -> 暴击+16% | K174: 13 | L174: =VLOOKUP(INT(MOD(RC[-11],1000)/100),R7C9:R9C10,2,FALSE)*RC[-10]*100 -> 1600
A175: 505 | B175: 9 | C175: 180 | D175: =IF(RC2=1,RC[7],R[-1]C&"|"&RC[7]) -> 1|8|1|7|1|22|1|13|1 | E175: =IF(RC2=1,RC[7],R[-1]C&"|"&RC[7]) -> 200|400|600|800|1000|1200|1400|1600|1800 | F175: 天赋 9 | G175: =VLOOKUP(RC[4],Sheet1!R8C1:R38C3,2,FALSE)&"+"&IF(VLOOKUP(RC[4],Sheet1!R8C1:R38C3,3,FALSE)="固定值",RC[5],RC[5]/100&"%") -> 攻击+1800 | K175: 1 | L175: =VLOOKUP(INT(MOD(RC[-11],1000)/100),R7C9:R9C10,2,FALSE)*RC[-10]*100 -> 1800
A176: 505 | B176: 10 | C176: 200 | D176: =IF(RC2=1,RC[7],R[-1]C&"|"&RC[7]) -> 1|8|1|7|1|22|1|13|1|22 | E176: =IF(RC2=1,RC[7],R[-1]C&"|"&RC[7]) -> 200|400|600|800|1000|1200|1400|1600|1800|2000 | F176: 天赋 10 | G176: =VLOOKUP(RC[4],Sheet1!R8C1:R38C3,2,FALSE)&"+"&IF(VLOOKUP(RC[4],Sheet1!R8C1:R38C3,3,FALSE)="固定值",RC[5],RC[5]/100&"%") -> 攻击+20% | K176: 22 | L176: =VLOOKUP(INT(MOD(RC[-11],1000)/100),R7C9:R9C10,2,FALSE)*RC[-10]*100 -> 2000
A177: 1302 | B177: 1 | C177: 20 | D177: =IF(RC2=1,RC[7],R[-31]C&"|"&RC[7]) -> 2 | E177: =IF(RC2=1,RC[7],R[-31]C&"|"&RC[7]) -> 100 | F177: 天赋 1 | G177: =VLOOKUP(RC[4],Sheet1!R8C1:R38C3,2,FALSE)&"+"&IF(VLOOKUP(RC[4],Sheet1!R8C1:R38C3,3,FALSE)="固定值",RC[5],RC[5]/100&"%") -> 物防+100 | K177: 2 | L177: =VLOOKUP(INT(MOD(RC[-11],1000)/100),R7C9:R9C10,2,FALSE)*RC[-10]*100 -> 100
A178: 1302 | B178: 2 | C178: 40 | D178: =IF(RC2=1,RC[7],R[-1]C&"|"&RC[7]) -> 2|6 | E178: =IF(RC2=1,RC[7],R[-1]C&"|"&RC[7]) -> 100|200 | F178: 天赋 2 | G178: =VLOOKUP(RC[4],Sheet1!R8C1:R38C3,2,FALSE)&"+"&IF(VLOOKUP(RC[4],Sheet1!R8C1:R38C3,3,FALSE)="固定值",RC[5],RC[5]/100&"%") -> 减伤+200 | K178: 6 | L178: =VLOOKUP(INT(MOD(RC[-11],1000)/100),R7C9:R9C10,2,FALSE)*RC[-10]*100 -> 200
A179: 1302 | B179: 3 | C179: 60 | D179: =IF(RC2=1,RC[7],R[-1]C&"|"&RC[7]) -> 2|6|2 | E179: =IF(RC2=1,RC[7],R[-1]C&"|"&RC[7]) -> 100|200|300 | F179: 天赋 3 | G179: =VLOOKUP(RC[4],Sheet1!R8C1:R38C3,2,FALSE)&"+"&IF(VLOOKUP(RC[4],Sheet1!R8C1:R38C3,3,FALSE)="固定值",RC[5],RC[5]/100&"%") -> 物防+300 | K179: 2 | L179: =VLOOKUP(INT(MOD(RC[-11],1000)/100),R7C9:R9C10,2,FALSE)*RC[-10]*100 -> 300
A180: 1302 | B180: 4 | C180: 80 | D180: =IF(RC2=1,RC[7],R[-1]C&"|"&RC[7]) -> 2|6|2|5 | E180: =IF(RC2=1,RC[7],R[-1]C&"|"&RC[7]) -> 100|200|300|400 | F180: 天赋 4 | G180: =VLOOKUP(RC[4],Sheet1!R8C1:R38C3,2,FALSE)&"+"&IF(VLOOKUP(RC[4],Sheet1!R8C1:R38C3,3,FALSE)="固定值",RC[5],RC[5]/100&"%") -> 免伤+4% | K180: 5 | L180: =VLOOKUP(INT(MOD(RC[-11],1000)/100),R7C9:R9C10,2,FALSE)*RC[-10]*100 -> 400
A181: 1302 | B181: 5 | C181: 100 | D181: =IF(RC2=1,RC[7],R[-1]C&"|"&RC[7]) -> 2|6|2|5|2 | E181: =IF(RC2=1,RC[7],R[-1]C&"|"&RC[7]) -> 100|200|300|400|500 | F181: 天赋 5 | G181: =VLOOKUP(RC[4],Sheet1!R8C1:R38C3,2,FALSE)&"+"&IF(VLOOKUP(RC[4],Sheet1!R8C1:R38C3,3,FALSE)="固定值",RC[5],RC[5]/100&"%") -> 物防+500 | K181: 2 | L181: =VLOOKUP(INT(MOD(RC[-11],1000)/100),R7C9:R9C10,2,FALSE)*RC[-10]*100 -> 500
A182: 1302 | B182: 6 | C182: 120 | D182: =IF(RC2=1,RC[7],R[-1]C&"|"&RC[7]) -> 2|6|2|5|2|23 | E182: =IF(RC2=1,RC[7],R[-1]C&"|"&RC[7]) -> 100|200|300|400|500|600 | F182: 天赋 6 | G182: =VLOOKUP(RC[4],Sheet1!R8C1:R38C3,2,FALSE)&"+"&IF(VLOOKUP(RC[4],Sheet1!R8C1:R38C3,3,FALSE)="固定值",RC[5],RC[5]/100&"%") -> 物防+6% | K182: 23 | L182: =VLOOKUP(INT(MOD(RC[-11],1000)/100),R7C9:R9C10,2,FALSE)*RC[-10]*100 -> 600
A183: 1302 | B183: 7 | C183: 140 | D183: =IF(RC2=1,RC[7],R[-1]C&"|"&RC[7]) -> 2|6|2|5|2|23|2 | E183: =IF(RC2=1,RC[7],R[-1]C&"|"&RC[7]) -> 100|200|300|400|500|600|700 | F183: 天赋 7 | G183: =VLOOKUP(RC[4],Sheet1!R8C1:R38C3,2,FALSE)&"+"&IF(VLOOKUP(RC[4],Sheet1!R8C1:R38C3,3,FALSE)="固定值",RC[5],RC[5]/100&"%") -> 物防+700 | K183: 2 | L183: =VLOOKUP(INT(MOD(RC[-11],1000)/100),R7C9:R9C10,2,FALSE)*RC[-10]*100 -> 700
A184: 1302 | B184: 8 | C184: 160 | D184: =IF(RC2=1,RC[7],R[-1]C&"|"&RC[7]) -> 2|6|2|5|2|23|2|14 | E184: =IF(RC2=1,RC[7],R[-1]C&"|"&RC[7]) -> 100|200|300|400|500|600|700|800 | F184: 天赋 8 | G184: =VLOOKUP(RC[4],Sheet1!R8C1:R38C3,2,FALSE)&"+"&IF(VLOOKUP(RC[4],Sheet1!R8C1:R38C3,3,FALSE)="固定值",RC[5],RC[5]/100&"%") -> 抗暴+8% | K184: 14 | L184: =VLOOKUP(INT(MOD(RC[-11],1000)/100),R7C9:R9C10,2,FALSE)*RC[-10]*100 -> 800
A185: 1302 | B185: 9 | C185: 180 | D185: =IF(RC2=1,RC[7],R[-1]C&"|"&RC[7]) -> 2|6|2|5|2|23|2|14|2 | E185: =IF(RC2=1,RC[7],R[-1]C&"|"&RC[7]) -> 100|200|300|400|500|600|700|800|900 | F185: 天赋 9 | G185: =VLOOKUP(RC[4],Sheet1!R8C1:R38C3,2,FALSE)&"+"&IF(VLOOKUP(RC[4],Sheet1!R8C1:R38C3,3,FALSE)="固定值",RC[5],RC[5]/100&"%") -> 物防+900 | K185: 2 | L185: =VLOOKUP(INT(MOD(RC[-11],1000)/100),R7C9:R9C10,2,FALSE)*RC[-10]*100 -> 900
A186: 1302 | B186: 10 | C186: 200 | D186: =IF(RC2=1,RC[7],R[-1]C&"|"&RC[7]) -> 2|6|2|5|2|23|2|14|2|23 | E186: =IF(RC2=1,RC[7],R[-1]C&"|"&RC[7]) -> 100|200|300|400|500|600|700|800|900|1000 | F186: 天赋 10 | G186: =VLOOKUP(RC[4],Sheet1!R8C1:R38C3,2,FALSE)&"+"&IF(VLOOKUP(RC[4],Sheet1!R8C1:R38C3,3,FALSE)="固定值",RC[5],RC[5]/100&"%") -> 物防+10% | K186: 23 | L186: =VLOOKUP(INT(MOD(RC[-11],1000)/100),R7C9:R9C10,2,FALSE)*RC[-10]*100 -> 1000
A187: 1303 | B187: 1 | C187: 20 | D187: =IF(RC2=1,RC[7],R[-1]C&"|"&RC[7]) -> 2 | E187: =IF(RC2=1,RC[7],R[-1]C&"|"&RC[7]) -> 100 | F187: 天赋 1 | G187: =VLOOKUP(RC[4],Sheet1!R8C1:R38C3,2,FALSE)&"+"&IF(VLOOKUP(RC[4],Sheet1!R8C1:R38C3,3,FALSE)="固定值",RC[5],RC[5]/100&"%") -> 物防+100 | K187: 2 | L187: =VLOOKUP(INT(MOD(RC[-11],1000)/100),R7C9:R9C10,2,FALSE)*RC[-10]*100 -> 100
A188: 1303 | B188: 2 | C188: 40 | D188: =IF(RC2=1,RC[7],R[-1]C&"|"&RC[7]) -> 2|6 | E188: =IF(RC2=1,RC[7],R[-1]C&"|"&RC[7]) -> 100|200 | F188: 天赋 2 | G188: =VLOOKUP(RC[4],Sheet1!R8C1:R38C3,2,FALSE)&"+"&IF(VLOOKUP(RC[4],Sheet1!R8C1:R38C3,3,FALSE)="固定值",RC[5],RC[5]/100&"%") -> 减伤+200 | K188: 6 | L188: =VLOOKUP(INT(MOD(RC[-11],1000)/100),R7C9:R9C10,2,FALSE)*RC[-10]*100 -> 200
A189: 1303 | B189: 3 | C189: 60 | D189: =IF(RC2=1,RC[7],R[-1]C&"|"&RC[7]) -> 2|6|2 | E189: =IF(RC2=1,RC[7],R[-1]C&"|"&RC[7]) -> 100|200|300 | F189: 天赋 3 | G189: =VLOOKUP(RC[4],Sheet1!R8C1:R38C3,2,FALSE)&"+"&IF(VLOOKUP(RC[4],Sheet1!R8C1:R38C3,3,FALSE)="固定值",RC[5],RC[5]/100&"%") -> 物防+300 | K189: 2 | L189: =VLOOKUP(INT(MOD(RC[-11],1000)/100),R7C9:R9C10,2,FALSE)*RC[-10]*100 -> 300
A190: 1303 | B190: 4 | C190: 80 | D190: =IF(RC2=1,RC[7],R[-1]C&"|"&RC[7]) -> 2|6|2|5 | E190: =IF(RC2=1,RC[7],R[-1]C&"|"&RC[7]) -> 100|200|300|400 | F190: 天赋 4 | G190: =VLOOKUP(RC[4],Sheet1!R8C1:R38C3,2,FALSE)&"+"&IF(VLOOKUP(RC[4],Sheet1!R8C1:R38C3,3,FALSE)="固定值",RC[5],RC[5]/100&"%") -> 免伤+4% | K190: 5 | L190: =VLOOKUP(INT(MOD(RC[-11],1000)/100),R7C9:R9C10,2,FALSE)*RC[-10]*100 -> 400
A191: 1303 | B191: 5 | C191: 100 | D191: =IF(RC2=1,RC[7],R[-1]C&"|"&RC[7]) -> 2|6|2|5|2 | E191: =IF(RC2=1,RC[7],R[-1]C&"|"&RC[7]) -> 100|200|300|400|500 | F191: 天赋 5 | G191: =VLOOKUP(RC[4],Sheet1!R8C1:R38C3,2,FALSE)&"+"&IF(VLOOKUP(RC[4],Sheet1!R8C1:R38C3,3,FALSE)="固定值",RC[5],RC[5]/100&"%") -> 物防+500 | K191: 2 | L191: =VLOOKUP(INT(MOD(RC[-11],1000)/100),R7C9:R9C10,2,FALSE)*RC[-10]*100 -> 500
A192: 1303 | B192: 6 | C192: 120 | D192: =IF(RC2=1,RC[7],R[-1]C&"|"&RC[7]) -> 2|6|2|5|2|23 | E192: =IF(RC2=1,RC[7],R[-1]C&"|"&RC[7]) -> 100|200|300|400|500|600 | F192: 天赋 6 | G192: =VLOOKUP(RC[4],Sheet1!R8C1:R38C3,2,FALSE)&"+"&IF(VLOOKUP(RC[4],Sheet1!R8C1:R38C3,3,FALSE)="固定值",RC[5],RC[5]/100&"%") -> 物防+6% | K192: 23 | L192: =VLOOKUP(INT(MOD(RC[-11],1000)/100),R7C9:R9C10,2,FALSE)*RC[-10]*100 -> 600
A193: 1303 | B193: 7 | C193: 140 | D193: =IF(RC2=1,RC[7],R[-1]C&"|"&RC[7]) -> 2|6|2|5|2|23|2 | E193: =IF(RC2=1,RC[7],R[-1]C&"|"&RC[7]) -> 100|200|300|400|500|600|700 | F193: 天赋 7 | G193: =VLOOKUP(RC[4],Sheet1!R8C1:R38C3,2,FALSE)&"+"&IF(VLOOKUP(RC[4],Sheet1!R8C1:R38C3,3,FALSE)="固定值",RC[5],RC[5]/100&"%") -> 物防+700 | K193: 2 | L193: =VLOOKUP(INT(MOD(RC[-11],1000)/100),R7C9:R9C10,2,FALSE)*RC[-10]*100 -> 700
A194: 1303 | B194: 8 | C194: 160 | D194: =IF(RC2=1,RC[7],R[-1]C&"|"&RC[7]) -> 2|6|2|5|2|23|2|14 | E194: =IF(RC2=1,RC[7],R[-1]C&"|"&RC[7]) -> 100|200|300|400|500|600|700|800 | F194: 天赋 8 | G194: =VLOOKUP(RC[4],Sheet1!R8C1:R38C3,2,FALSE)&"+"&IF(VLOOKUP(RC[4],Sheet1!R8C1:R38C3,3,FALSE)="固定值",RC[5],RC[5]/100&"%") -> 抗暴+8% | K194: 14 | L194: =VLOOKUP(INT(MOD(RC[-11],1000)/100),R7C9:R9C10,2,FALSE)*RC[-10]*100 -> 800
A195: 1303 | B195: 9 | C195: 180 | D195: =IF(RC2=1,RC[7],R[-1]C&"|"&RC[7]) -> 2|6|2|5|2|23|2|14|2 | E195: =IF(RC2=1,RC[7],R[-1]C&"|"&RC[7]) -> 100|200|300|400|500|600|700|800|900 | F195: 天赋 9 | G195: =VLOOKUP(RC[4],Sheet1!R8C1:R38C3,2,FALSE)&"+"&IF(VLOOKUP(RC[4],Sheet1!R8C1:R38C3,3,FALSE)="固定值",RC[5],RC[5]/100&"%") -> 物防+900 | K195: 2 | L195: =VLOOKUP(INT(MOD(RC[-11],1000)/100),R7C9:R9C10,2,FALSE)*RC[-10]*100 -> 900
A196: 1303 | B196: 10 | C196: 200 | D196: =IF(RC2=1,RC[7],R[-1]C&"|"&RC[7]) -> 2|6|2|5|2|23|2|14|2|23 | E196: =IF(RC2=1,RC[7],R[-1]C&"|"&RC[7]) -> 100|200|300|400|500|600|700|800|900|1000 | F196: 天赋 10 | G196: =VLOOKUP(RC[4],Sheet1!R8C1:R38C3,2,FALSE)&"+"&IF(VLOOKUP(RC[4],Sheet1!R8C1:R38C3,3,FALSE)="固定值",RC[5],RC[5]/100&"%") -> 物防+10% | K196: 23 | L196: =VLOOKUP(INT(MOD(RC[-11],1000)/100),R7C9:R9C10,2,FALSE)*RC[-10]*100 -> 1000
A197: 1304 | B197: 1 | C197: 20 | D197: =IF(RC2=1,RC[7],R[-1]C&"|"&RC[7]) -> 2 | E197: =IF(RC2=1,RC[7],R[-1]C&"|"&RC[7]) -> 100 | F197: 天赋 1 | G197: =VLOOKUP(RC[4],Sheet1!R8C1:R38C3,2,FALSE)&"+"&IF(VLOOKUP(RC[4],Sheet1!R8C1:R38C3,3,FALSE)="固定值",RC[5],RC[5]/100&"%") -> 物防+100 | K197: 2 | L197: =VLOOKUP(INT(MOD(RC[-11],1000)/100),R7C9:R9C10,2,FALSE)*RC[-10]*100 -> 100
A198: 1304 | B198: 2 | C198: 40 | D198: =IF(RC2=1,RC[7],R[-1]C&"|"&RC[7]) -> 2|6 | E198: =IF(RC2=1,RC[7],R[-1]C&"|"&RC[7]) -> 100|200 | F198: 天赋 2 | G198: =VLOOKUP(RC[4],Sheet1!R8C1:R38C3,2,FALSE)&"+"&IF(VLOOKUP(RC[4],Sheet1!R8C1:R38C3,3,FALSE)="固定值",RC[5],RC[5]/100&"%") -> 减伤+200 | K198: 6 | L198: =VLOOKUP(INT(MOD(RC[-11],1000)/100),R7C9:R9C10,2,FALSE)*RC[-10]*100 -> 200
A199: 1304 | B199: 3 | C199: 60 | D199: =IF(RC2=1,RC[7],R[-1]C&"|"&RC[7]) -> 2|6|2 | E199: =IF(RC2=1,RC[7],R[-1]C&"|"&RC[7]) -> 100|200|300 | F199: 天赋 3 | G199: =VLOOKUP(RC[4],Sheet1!R8C1:R38C3,2,FALSE)&"+"&IF(VLOOKUP(RC[4],Sheet1!R8C1:R38C3,3,FALSE)="固定值",RC[5],RC[5]/100&"%") -> 物防+300 | K199: 2 | L199: =VLOOKUP(INT(MOD(RC[-11],1000)/100),R7C9:R9C10,2,FALSE)*RC[-10]*100 -> 300
A200: 1304 | B200: 4 | C200: 80 | D200: =IF(RC2=1,RC[7],R[-1]C&"|"&RC[7]) -> 2|6|2|5 | E200: =IF(RC2=1,RC[7],R[-1]C&"|"&RC[7]) -> 100|200|300|400 | F200: 天赋 4 | G200: =VLOOKUP(RC[4],Sheet1!R8C1:R38C3,2,FALSE)&"+"&IF(VLOOKUP(RC[4],Sheet1!R8C1:R38C3,3,FALSE)="固定值",RC[5],RC[5]/100&"%") -> 免伤+4% | K200: 5 | L200: =VLOOKUP(INT(MOD(RC[-11],1000)/100),R7C9:R9C10,2,FALSE)*RC[-10]*100 -> 400
A201: 1304 | B201: 5 | C201: 100 | D201: =IF(RC2=1,RC[7],R[-1]C&"|"&RC[7]) -> 2|6|2|5|2 | E201: =IF(RC2=1,RC[7],R[-1]C&"|"&RC[7]) -> 100|200|300|400|500 | F201: 天赋 5 | G201: =VLOOKUP(RC[4],Sheet1!R8C1:R38C3,2,FALSE)&"+"&IF(VLOOKUP(RC[4],Sheet1!R8C1:R38C3,3,FALSE)="固定值",RC[5],RC[5]/100&"%") -> 物防+500 | K201: 2 | L201: =VLOOKUP(INT(MOD(RC[-11],1000)/100),R7C9:R9C10,2,FALSE)*RC[-10]*100 -> 500
A202: 1304 | B202: 6 | C202: 120 | D202: =IF(RC2=1,RC[7],R[-1]C&"|"&RC[7]) -> 2|6|2|5|2|23 | E202: =IF(RC2=1,RC[7],R[-1]C&"|"&RC[7]) -> 100|200|300|400|500|600 | F202: 天赋 6 | G202: =VLOOKUP(RC[4],Sheet1!R8C1:R38C3,2,FALSE)&"+"&IF(VLOOKUP(RC[4],Sheet1!R8C1:R38C3,3,FALSE)="固定值",RC[5],RC[5]/100&"%") -> 物防+6% | K202: 23 | L202: =VLOOKUP(INT(MOD(RC[-11],1000)/100),R7C9:R9C10,2,FALSE)*RC[-10]*100 -> 600
A203: 1304 | B203: 7 | C203: 140 | D203: =IF(RC2=1,RC[7],R[-1]C&"|"&RC[7]) -> 2|6|2|5|2|23|2 | E203: =IF(RC2=1,RC[7],R[-1]C&"|"&RC[7]) -> 100|200|300|400|500|600|700 | F203: 天赋 7 | G203: =VLOOKUP(RC[4],Sheet1!R8C1:R38C3,2,FALSE)&"+"&IF(VLOOKUP(RC[4],Sheet1!R8C1:R38C3,3,FALSE)="固定值",RC[5],RC[5]/100&"%") -> 物防+700 | K203: 2 | L203: =VLOOKUP(INT(MOD(RC[-11],1000)/100),R7C9:R9C10,2,FALSE)*RC[-10]*100 -> 700
A204: 1304 | B204: 8 | C204: 160 | D204: =IF(RC2=1,RC[7],R[-1]C&"|"&RC[7]) -> 2|6|2|5|2|23|2|14 | E204: =IF(RC2=1,RC[7],R[-1]C&"|"&RC[7]) -> 100|200|300|400|500|600|700|800 | F204: 天赋 8 | G204: =VLOOKUP(RC[4],Sheet1!R8C1:R38C3,2,FALSE)&"+"&IF(VLOOKUP(RC[4],Sheet1!R8C1:R38C3,3,FALSE)="固定值",RC[5],RC[5]/100&"%") -> 抗暴+8% | K204: 14 | L204: =VLOOKUP(INT(MOD(RC[-11],1000)/100),R7C9:R9C10,2,FALSE)*RC[-10]*100 -> 800
A205: 1304 | B205: 9 | C205: 180 | D205: =IF(RC2=1,RC[7],R[-1]C&"|"&RC[7]) -> 2|6|2|5|2|23|2|14|2 | E205: =IF(RC2=1,RC[7],R[-1]C&"|"&RC[7]) -> 100|200|300|400|500|600|700|800|900 | F205: 天赋 9 | G205: =VLOOKUP(RC[4],Sheet1!R8C1:R38C3,2,FALSE)&"+"&IF(VLOOKUP(RC[4],Sheet1!R8C1:R38C3,3,FALSE)="固定值",RC[5],RC[5]/100&"%") -> 物防+900 | K205: 2 | L205: =VLOOKUP(INT(MOD(RC[-11],1000)/100),R7C9:R9C10,2,FALSE)*RC[-10]*100 -> 900
A206: 1304 | B206: 10 | C206: 200 | D206: =IF(RC2=1,RC[7],R[-1]C&"|"&RC[7]) -> 2|6|2|5|2|23|2|14|2|23 | E206: =IF(RC2=1,RC[7],R[-1]C&"|"&RC[7]) -> 100|200|300|400|500|600|700|800|900|1000 | F206: 天赋 10 | G206: =VLOOKUP(RC[4],Sheet1!R8C1:R38C3,2,FALSE)&"+"&IF(VLOOKUP(RC[4],Sheet1!R8C1:R38C3,3,FALSE)="固定值",RC[5],RC[5]/100&"%") -> 物防+10% | K206: 23 | L206: =VLOOKUP(INT(MOD(RC[-11],1000)/100),R7C9:R9C10,2,FALSE)*RC[-10]*100 -> 1000
A207: 1305 | B207: 1 | C207: 20 | D207: =IF(RC2=1,RC[7],R[-1]C&"|"&RC[7]) -> 2 | E207: =IF(RC2=1,RC[7],R[-1]C&"|"&RC[7]) -> 100 | F207: 天赋 1 | G207: =VLOOKUP(RC[4],Sheet1!R8C1:R38C3,2,FALSE)&"+"&IF(VLOOKUP(RC[4],Sheet1!R8C1:R38C3,3,FALSE)="固定值",RC[5],RC[5]/100&"%") -> 物防+100 | K207: 2 | L207: =VLOOKUP(INT(MOD(RC[-11],1000)/100),R7C9:R9C10,2,FALSE)*RC[-10]*100 -> 100
A208: 1305 | B208: 2 | C208: 40 | D208: =IF(RC2=1,RC[7],R[-1]C&"|"&RC[7]) -> 2|6 | E208: =IF(RC2=1,RC[7],R[-1]C&"|"&RC[7]) -> 100|200 | F208: 天赋 2 | G208: =VLOOKUP(RC[4],Sheet1!R8C1:R38C3,2,FALSE)&"+"&IF(VLOOKUP(RC[4],Sheet1!R8C1:R38C3,3,FALSE)="固定值",RC[5],RC[5]/100&"%") -> 减伤+200 | K208: 6 | L208: =VLOOKUP(INT(MOD(RC[-11],1000)/100),R7C9:R9C10,2,FALSE)*RC[-10]*100 -> 200
A209: 1305 | B209: 3 | C209: 60 | D209: =IF(RC2=1,RC[7],R[-1]C&"|"&RC[7]) -> 2|6|2 | E209: =IF(RC2=1,RC[7],R[-1]C&"|"&RC[7]) -> 100|200|300 | F209: 天赋 3 | G209: =VLOOKUP(RC[4],Sheet1!R8C1:R38C3,2,FALSE)&"+"&IF(VLOOKUP(RC[4],Sheet1!R8C1:R38C3,3,FALSE)="固定值",RC[5],RC[5]/100&"%") -> 物防+300 | K209: 2 | L209: =VLOOKUP(INT(MOD(RC[-11],1000)/100),R7C9:R9C10,2,FALSE)*RC[-10]*100 -> 300
A210: 1305 | B210: 4 | C210: 80 | D210: =IF(RC2=1,RC[7],R[-1]C&"|"&RC[7]) -> 2|6|2|5 | E210: =IF(RC2=1,RC[7],R[-1]C&"|"&RC[7]) -> 100|200|300|400 | F210: 天赋 4 | G210: =VLOOKUP(RC[4],Sheet1!R8C1:R38C3,2,FALSE)&"+"&IF(VLOOKUP(RC[4],Sheet1!R8C1:R38C3,3,FALSE)="固定值",RC[5],RC[5]/100&"%") -> 免伤+4% | K210: 5 | L210: =VLOOKUP(INT(MOD(RC[-11],1000)/100),R7C9:R9C10,2,FALSE)*RC[-10]*100 -> 400
A211: 1305 | B211: 5 | C211: 100 | D211: =IF(RC2=1,RC[7],R[-1]C&"|"&RC[7]) -> 2|6|2|5|2 | E211: =IF(RC2=1,RC[7],R[-1]C&"|"&RC[7]) -> 100|200|300|400|500 | F211: 天赋 5 | G211: =VLOOKUP(RC[4],Sheet1!R8C1:R38C3,2,FALSE)&"+"&IF(VLOOKUP(RC[4],Sheet1!R8C1:R38C3,3,FALSE)="固定值",RC[5],RC[5]/100&"%") -> 物防+500 | K211: 2 | L211: =VLOOKUP(INT(MOD(RC[-11],1000)/100),R7C9:R9C10,2,FALSE)*RC[-10]*100 -> 500
A212: 1305 | B212: 6 | C212: 120 | D212: =IF(RC2=1,RC[7],R[-1]C&"|"&RC[7]) -> 2|6|2|5|2|23 | E212: =IF(RC2=1,RC[7],R[-1]C&"|"&RC[7]) -> 100|200|300|400|500|600 | F212: 天赋 6 | G212: =VLOOKUP(RC[4],Sheet1!R8C1:R38C3,2,FALSE)&"+"&IF(VLOOKUP(RC[4],Sheet1!R8C1:R38C3,3,FALSE)="固定值",RC[5],RC[5]/100&"%") -> 物防+6% | K212: 23 | L212: =VLOOKUP(INT(MOD(RC[-11],1000)/100),R7C9:R9C10,2,FALSE)*RC[-10]*100 -> 600
A213: 1305 | B213: 7 | C213: 140 | D213: =IF(RC2=1,RC[7],R[-1]C&"|"&RC[7]) -> 2|6|2|5|2|23|2 | E213: =IF(RC2=1,RC[7],R[-1]C&"|"&RC[7]) -> 100|200|300|400|500|600|700 | F213: 天赋 7 | G213: =VLOOKUP(RC[4],Sheet1!R8C1:R38C3,2,FALSE)&"+"&IF(VLOOKUP(RC[4],Sheet1!R8C1:R38C3,3,FALSE)="固定值",RC[5],RC[5]/100&"%") -> 物防+700 | K213: 2 | L213: =VLOOKUP(INT(MOD(RC[-11],1000)/100),R7C9:R9C10,2,FALSE)*RC[-10]*100 -> 700
A214: 1305 | B214: 8 | C214: 160 | D214: =IF(RC2=1,RC[7],R[-1]C&"|"&RC[7]) -> 2|6|2|5|2|23|2|14 | E214: =IF(RC2=1,RC[7],R[-1]C&"|"&RC[7]) -> 100|200|300|400|500|600|700|800 | F214: 天赋 8 | G214: =VLOOKUP(RC[4],Sheet1!R8C1:R38C3,2,FALSE)&"+"&IF(VLOOKUP(RC[4],Sheet1!R8C1:R38C3,3,FALSE)="固定值",RC[5],RC[5]/100&"%") -> 抗暴+8% | K214: 14 | L214: =VLOOKUP(INT(MOD(RC[-11],1000)/100),R7C9:R9C10,2,FALSE)*RC[-10]*100 -> 800
A215: 1305 | B215: 9 | C215: 180 | D215: =IF(RC2=1,RC[7],R[-1]C&"|"&RC[7]) -> 2|6|2|5|2|23|2|14|2 | E215: =IF(RC2=1,RC[7],R[-1]C&"|"&RC[7]) -> 100|200|300|400|500|600|700|800|900 | F215: 天赋 9 | G215: =VLOOKUP(RC[4],Sheet1!R8C1:R38C3,2,FALSE)&"+"&IF(VLOOKUP(RC[4],Sheet1!R8C1:R38C3,3,FALSE)="固定值",RC[5],RC[5]/100&"%") -> 物防+900 | K215: 2 | L215: =VLOOKUP(INT(MOD(RC[-11],1000)/100),R7C9:R9C10,2,FALSE)*RC[-10]*100 -> 900
A216: 1305 | B216: 10 | C216: 200 | D216: =IF(RC2=1,RC[7],R[-1]C&"|"&RC[7]) -> 2|6|2|5|2|23|2|14|2|23 | E216: =IF(RC2=1,RC[7],R[-1]C&"|"&RC[7]) -> 100|200|300|400|500|600|700|800|900|1000 | F216: 天赋 10 | G216: =VLOOKUP(RC[4],Sheet1!R8C1:R38C3,2,FALSE)&"+"&IF(VLOOKUP(RC[4],Sheet1!R8C1:R38C3,3,FALSE)="固定值",RC[5],RC[5]/100&"%") -> 物防+10% | K216: 23 | L216: =VLOOKUP(INT(MOD(RC[-11],1000)/100),R7C9:R9C10,2,FALSE)*RC[-10]*100 -> 1000
A217: 1401 | B217: 1 | C217: 20 | D217: =IF(RC2=1,RC[7],R[-11]C&"|"&RC[7]) -> 2 | E217: =IF(RC2=1,RC[7],R[-11]C&"|"&RC[7]) -> 150 | F217: 天赋 1 | G217: =VLOOKUP(RC[4],Sheet1!R8C1:R38C3,2,FALSE)&"+"&IF(VLOOKUP(RC[4],Sheet1!R8C1:R38C3,3,FALSE)="固定值",RC[5],RC[5]/100&"%") -> 物防+150 | K217: 2 | L217: =VLOOKUP(INT(MOD(RC[-11],1000)/100),R7C9:R9C10,2,FALSE)*RC[-10]*100 -> 150
A218: 1401 | B218: 2 | C218: 40 | D218: =IF(RC2=1,RC[7],R[-1]C&"|"&RC[7]) -> 2|6 | E218: =IF(RC2=1,RC[7],R[-1]C&"|"&RC[7]) -> 150|300 | F218: 天赋 2 | G218: =VLOOKUP(RC[4],Sheet1!R8C1:R38C3,2,FALSE)&"+"&IF(VLOOKUP(RC[4],Sheet1!R8C1:R38C3,3,FALSE)="固定值",RC[5],RC[5]/100&"%") -> 减伤+300 | K218: 6 | L218: =VLOOKUP(INT(MOD(RC[-11],1000)/100),R7C9:R9C10,2,FALSE)*RC[-10]*100 -> 300
A219: 1401 | B219: 3 | C219: 60 | D219: =IF(RC2=1,RC[7],R[-1]C&"|"&RC[7]) -> 2|6|2 | E219: =IF(RC2=1,RC[7],R[-1]C&"|"&RC[7]) -> 150|300|450 | F219: 天赋 3 | G219: =VLOOKUP(RC[4],Sheet1!R8C1:R38C3,2,FALSE)&"+"&IF(VLOOKUP(RC[4],Sheet1!R8C1:R38C3,3,FALSE)="固定值",RC[5],RC[5]/100&"%") -> 物防+450 | K219: 2 | L219: =VLOOKUP(INT(MOD(RC[-11],1000)/100),R7C9:R9C10,2,FALSE)*RC[-10]*100 -> 450
A220: 1401 | B220: 4 | C220: 80 | D220: =IF(RC2=1,RC[7],R[-1]C&"|"&RC[7]) -> 2|6|2|5 | E220: =IF(RC2=1,RC[7],R[-1]C&"|"&RC[7]) -> 150|300|450|600 | F220: 天赋 4 | G220: =VLOOKUP(RC[4],Sheet1!R8C1:R38C3,2,FALSE)&"+"&IF(VLOOKUP(RC[4],Sheet1!R8C1:R38C3,3,FALSE)="固定值",RC[5],RC[5]/100&"%") -> 免伤+6% | K220: 5 | L220: =VLOOKUP(INT(MOD(RC[-11],1000)/100),R7C9:R9C10,2,FALSE)*RC[-10]*100 -> 600
A221: 1401 | B221: 5 | C221: 100 | D221: =IF(RC2=1,RC[7],R[-1]C&"|"&RC[7]) -> 2|6|2|5|2 | E221: =IF(RC2=1,RC[7],R[-1]C&"|"&RC[7]) -> 150|300|450|600|750 | F221: 天赋 5 | G221: =VLOOKUP(RC[4],Sheet1!R8C1:R38C3,2,FALSE)&"+"&IF(VLOOKUP(RC[4],Sheet1!R8C1:R38C3,3,FALSE)="固定值",RC[5],RC[5]/100&"%") -> 物防+750 | K221: 2 | L221: =VLOOKUP(INT(MOD(RC[-11],1000)/100),R7C9:R9C10,2,FALSE)*RC[-10]*100 -> 750
A222: 1401 | B222: 6 | C222: 120 | D222: =IF(RC2=1,RC[7],R[-1]C&"|"&RC[7]) -> 2|6|2|5|2|23 | E222: =IF(RC2=1,RC[7],R[-1]C&"|"&RC[7]) -> 150|300|450|600|750|900 | F222: 天赋 6 | G222: =VLOOKUP(RC[4],Sheet1!R8C1:R38C3,2,FALSE)&"+"&IF(VLOOKUP(RC[4],Sheet1!R8C1:R38C3,3,FALSE)="固定值",RC[5],RC[5]/100&"%") -> 物防+9% | K222: 23 | L222: =VLOOKUP(INT(MOD(RC[-11],1000)/100),R7C9:R9C10,2,FALSE)*RC[-10]*100 -> 900
A223: 1401 | B223: 7 | C223: 140 | D223: =IF(RC2=1,RC[7],R[-1]C&"|"&RC[7]) -> 2|6|2|5|2|23|2 | E223: =IF(RC2=1,RC[7],R[-1]C&"|"&RC[7]) -> 150|300|450|600|750|900|1050 | F223: 天赋 7 | G223: =VLOOKUP(RC[4],Sheet1!R8C1:R38C3,2,FALSE)&"+"&IF(VLOOKUP(RC[4],Sheet1!R8C1:R38C3,3,FALSE)="固定值",RC[5],RC[5]/100&"%") -> 物防+1050 | K223: 2 | L223: =VLOOKUP(INT(MOD(RC[-11],1000)/100),R7C9:R9C10,2,FALSE)*RC[-10]*100 -> 1050
A224: 1401 | B224: 8 | C224: 160 | D224: =IF(RC2=1,RC[7],R[-1]C&"|"&RC[7]) -> 2|6|2|5|2|23|2|14 | E224: =IF(RC2=1,RC[7],R[-1]C&"|"&RC[7]) -> 150|300|450|600|750|900|1050|1200 | F224: 天赋 8 | G224: =VLOOKUP(RC[4],Sheet1!R8C1:R38C3,2,FALSE)&"+"&IF(VLOOKUP(RC[4],Sheet1!R8C1:R38C3,3,FALSE)="固定值",RC[5],RC[5]/100&"%") -> 抗暴+12% | K224: 14 | L224: =VLOOKUP(INT(MOD(RC[-11],1000)/100),R7C9:R9C10,2,FALSE)*RC[-10]*100 -> 1200
A225: 1401 | B225: 9 | C225: 180 | D225: =IF(RC2=1,RC[7],R[-1]C&"|"&RC[7]) -> 2|6|2|5|2|23|2|14|2 | E225: =IF(RC2=1,RC[7],R[-1]C&"|"&RC[7]) -> 150|300|450|600|750|900|1050|1200|1350 | F225: 天赋 9 | G225: =VLOOKUP(RC[4],Sheet1!R8C1:R38C3,2,FALSE)&"+"&IF(VLOOKUP(RC[4],Sheet1!R8C1:R38C3,3,FALSE)="固定值",RC[5],RC[5]/100&"%") -> 物防+1350 | K225: 2 | L225: =VLOOKUP(INT(MOD(RC[-11],1000)/100),R7C9:R9C10,2,FALSE)*RC[-10]*100 -> 1350
A226: 1401 | B226: 10 | C226: 200 | D226: =IF(RC2=1,RC[7],R[-1]C&"|"&RC[7]) -> 2|6|2|5|2|23|2|14|2|23 | E226: =IF(RC2=1,RC[7],R[-1]C&"|"&RC[7]) -> 150|300|450|600|750|900|1050|1200|1350|1500 | F226: 天赋 10 | G226: =VLOOKUP(RC[4],Sheet1!R8C1:R38C3,2,FALSE)&"+"&IF(VLOOKUP(RC[4],Sheet1!R8C1:R38C3,3,FALSE)="固定值",RC[5],RC[5]/100&"%") -> 物防+15% | K226: 23 | L226: =VLOOKUP(INT(MOD(RC[-11],1000)/100),R7C9:R9C10,2,FALSE)*RC[-10]*100 -> 1500
A227: 1402 | B227: 1 | C227: 20 | D227: =IF(RC2=1,RC[7],R[-1]C&"|"&RC[7]) -> 2 | E227: =IF(RC2=1,RC[7],R[-1]C&"|"&RC[7]) -> 150 | F227: 天赋 1 | G227: =VLOOKUP(RC[4],Sheet1!R8C1:R38C3,2,FALSE)&"+"&IF(VLOOKUP(RC[4],Sheet1!R8C1:R38C3,3,FALSE)="固定值",RC[5],RC[5]/100&"%") -> 物防+150 | K227: 2 | L227: =VLOOKUP(INT(MOD(RC[-11],1000)/100),R7C9:R9C10,2,FALSE)*RC[-10]*100 -> 150
A228: 1402 | B228: 2 | C228: 40 | D228: =IF(RC2=1,RC[7],R[-1]C&"|"&RC[7]) -> 2|6 | E228: =IF(RC2=1,RC[7],R[-1]C&"|"&RC[7]) -> 150|300 | F228: 天赋 2 | G228: =VLOOKUP(RC[4],Sheet1!R8C1:R38C3,2,FALSE)&"+"&IF(VLOOKUP(RC[4],Sheet1!R8C1:R38C3,3,FALSE)="固定值",RC[5],RC[5]/100&"%") -> 减伤+300 | K228: 6 | L228: =VLOOKUP(INT(MOD(RC[-11],1000)/100),R7C9:R9C10,2,FALSE)*RC[-10]*100 -> 300
A229: 1402 | B229: 3 | C229: 60 | D229: =IF(RC2=1,RC[7],R[-1]C&"|"&RC[7]) -> 2|6|2 | E229: =IF(RC2=1,RC[7],R[-1]C&"|"&RC[7]) -> 150|300|450 | F229: 天赋 3 | G229: =VLOOKUP(RC[4],Sheet1!R8C1:R38C3,2,FALSE)&"+"&IF(VLOOKUP(RC[4],Sheet1!R8C1:R38C3,3,FALSE)="固定值",RC[5],RC[5]/100&"%") -> 物防+450 | K229: 2 | L229: =VLOOKUP(INT(MOD(RC[-11],1000)/100),R7C9:R9C10,2,FALSE)*RC[-10]*100 -> 450
A230: 1402 | B230: 4 | C230: 80 | D230: =IF(RC2=1,RC[7],R[-1]C&"|"&RC[7]) -> 2|6|2|5 | E230: =IF(RC2=1,RC[7],R[-1]C&"|"&RC[7]) -> 150|300|450|600 | F230: 天赋 4 | G230: =VLOOKUP(RC[4],Sheet1!R8C1:R38C3,2,FALSE)&"+"&IF(VLOOKUP(RC[4],Sheet1!R8C1:R38C3,3,FALSE)="固定值",RC[5],RC[5]/100&"%") -> 免伤+6% | K230: 5 | L230: =VLOOKUP(INT(MOD(RC[-11],1000)/100),R7C9:R9C10,2,FALSE)*RC[-10]*100 -> 600
A231: 1402 | B231: 5 | C231: 100 | D231: =IF(RC2=1,RC[7],R[-1]C&"|"&RC[7]) -> 2|6|2|5|2 | E231: =IF(RC2=1,RC[7],R[-1]C&"|"&RC[7]) -> 150|300|450|600|750 | F231: 天赋 5 | G231: =VLOOKUP(RC[4],Sheet1!R8C1:R38C3,2,FALSE)&"+"&IF(VLOOKUP(RC[4],Sheet1!R8C1:R38C3,3,FALSE)="固定值",RC[5],RC[5]/100&"%") -> 物防+750 | K231: 2 | L231: =VLOOKUP(INT(MOD(RC[-11],1000)/100),R7C9:R9C10,2,FALSE)*RC[-10]*100 -> 750
A232: 1402 | B232: 6 | C232: 120 | D232: =IF(RC2=1,RC[7],R[-1]C&"|"&RC[7]) -> 2|6|2|5|2|23 | E232: =IF(RC2=1,RC[7],R[-1]C&"|"&RC[7]) -> 150|300|450|600|750|900 | F232: 天赋 6 | G232: =VLOOKUP(RC[4],Sheet1!R8C1:R38C3,2,FALSE)&"+"&IF(VLOOKUP(RC[4],Sheet1!R8C1:R38C3,3,FALSE)="固定值",RC[5],RC[5]/100&"%") -> 物防+9% | K232: 23 | L232: =VLOOKUP(INT(MOD(RC[-11],1000)/100),R7C9:R9C10,2,FALSE)*RC[-10]*100 -> 900
A233: 1402 | B233: 7 | C233: 140 | D233: =IF(RC2=1,RC[7],R[-1]C&"|"&RC[7]) -> 2|6|2|5|2|23|2 | E233: =IF(RC2=1,RC[7],R[-1]C&"|"&RC[7]) -> 150|300|450|600|750|900|1050 | F233: 天赋 7 | G233: =VLOOKUP(RC[4],Sheet1!R8C1:R38C3,2,FALSE)&"+"&IF(VLOOKUP(RC[4],Sheet1!R8C1:R38C3,3,FALSE)="固定值",RC[5],RC[5]/100&"%") -> 物防+1050 | K233: 2 | L233: =VLOOKUP(INT(MOD(RC[-11],1000)/100),R7C9:R9C10,2,FALSE)*RC[-10]*100 -> 1050
A234: 1402 | B234: 8 | C234: 160 | D234: =IF(RC2=1,RC[7],R[-1]C&"|"&RC[7]) -> 2|6|2|5|2|23|2|14 | E234: =IF(RC2=1,RC[7],R[-1]C&"|"&RC[7]) -> 150|300|450|600|750|900|1050|1200 | F234: 天赋 8 | G234: =VLOOKUP(RC[4],Sheet1!R8C1:R38C3,2,FALSE)&"+"&IF(VLOOKUP(RC[4],Sheet1!R8C1:R38C3,3,FALSE)="固定值",RC[5],RC[5]/100&"%") -> 抗暴+12% | K234: 14 | L234: =VLOOKUP(INT(MOD(RC[-11],1000)/100),R7C9:R9C10,2,FALSE)*RC[-10]*100 -> 1200
A235: 1402 | B235: 9 | C235: 180 | D235: =IF(RC2=1,RC[7],R[-1]C&"|"&RC[7]) -> 2|6|2|5|2|23|2|14|2 | E235: =IF(RC2=1,RC[7],R[-1]C&"|"&RC[7]) -> 150|300|450|600|750|900|1050|1200|1350 | F235: 天赋 9 | G235: =VLOOKUP(RC[4],Sheet1!R8C1:R38C3,2,FALSE)&"+"&IF(VLOOKUP(RC[4],Sheet1!R8C1:R38C3,3,FALSE)="固定值",RC[5],RC[5]/100&"%") -> 物防+1350 | K235: 2 | L235: =VLOOKUP(INT(MOD(RC[-11],1000)/100),R7C9:R9C10,2,FALSE)*RC[-10]*100 -> 1350
A236: 1402 | B236: 10 | C236: 200 | D236: =IF(RC2=1,RC[7],R[-1]C&"|"&RC[7]) -> 2|6|2|5|2|23|2|14|2|23 | E236: =IF(RC2=1,RC[7],R[-1]C&"|"&RC[7]) -> 150|300|450|600|750|900|1050|1200|1350|1500 | F236: 天赋 10 | G236: =VLOOKUP(RC[4],Sheet1!R8C1:R38C3,2,FALSE)&"+"&IF(VLOOKUP(RC[4],Sheet1!R8C1:R38C3,3,FALSE)="固定值",RC[5],RC[5]/100&"%") -> 物防+15% | K236: 23 | L236: =VLOOKUP(INT(MOD(RC[-11],1000)/100),R7C9:R9C10,2,FALSE)*RC[-10]*100 -> 1500
A237: 1403 | B237: 1 | C237: 20 | D237: =IF(RC2=1,RC[7],R[-1]C&"|"&RC[7]) -> 2 | E237: =IF(RC2=1,RC[7],R[-1]C&"|"&RC[7]) -> 150 | F237: 天赋 1 | G237: =VLOOKUP(RC[4],Sheet1!R8C1:R38C3,2,FALSE)&"+"&IF(VLOOKUP(RC[4],Sheet1!R8C1:R38C3,3,FALSE)="固定值",RC[5],RC[5]/100&"%") -> 物防+150 | K237: 2 | L237: =VLOOKUP(INT(MOD(RC[-11],1000)/100),R7C9:R9C10,2,FALSE)*RC[-10]*100 -> 150
A238: 1403 | B238: 2 | C238: 40 | D238: =IF(RC2=1,RC[7],R[-1]C&"|"&RC[7]) -> 2|6 | E238: =IF(RC2=1,RC[7],R[-1]C&"|"&RC[7]) -> 150|300 | F238: 天赋 2 | G238: =VLOOKUP(RC[4],Sheet1!R8C1:R38C3,2,FALSE)&"+"&IF(VLOOKUP(RC[4],Sheet1!R8C1:R38C3,3,FALSE)="固定值",RC[5],RC[5]/100&"%") -> 减伤+300 | K238: 6 | L238: =VLOOKUP(INT(MOD(RC[-11],1000)/100),R7C9:R9C10,2,FALSE)*RC[-10]*100 -> 300
A239: 1403 | B239: 3 | C239: 60 | D239: =IF(RC2=1,RC[7],R[-1]C&"|"&RC[7]) -> 2|6|2 | E239: =IF(RC2=1,RC[7],R[-1]C&"|"&RC[7]) -> 150|300|450 | F239: 天赋 3 | G239: =VLOOKUP(RC[4],Sheet1!R8C1:R38C3,2,FALSE)&"+"&IF(VLOOKUP(RC[4],Sheet1!R8C1:R38C3,3,FALSE)="固定值",RC[5],RC[5]/100&"%") -> 物防+450 | K239: 2 | L239: =VLOOKUP(INT(MOD(RC[-11],1000)/100),R7C9:R9C10,2,FALSE)*RC[-10]*100 -> 450
A240: 1403 | B240: 4 | C240: 80 | D240: =IF(RC2=1,RC[7],R[-1]C&"|"&RC[7]) -> 2|6|2|5 | E240: =IF(RC2=1,RC[7],R[-1]C&"|"&RC[7]) -> 150|300|450|600 | F240: 天赋 4 | G240: =VLOOKUP(RC[4],Sheet1!R8C1:R38C3,2,FALSE)&"+"&IF(VLOOKUP(RC[4],Sheet1!R8C1:R38C3,3,FALSE)="固定值",RC[5],RC[5]/100&"%") -> 免伤+6% | K240: 5 | L240: =VLOOKUP(INT(MOD(RC[-11],1000)/100),R7C9:R9C10,2,FALSE)*RC[-10]*100 -> 600
A241: 1403 | B241: 5 | C241: 100 | D241: =IF(RC2=1,RC[7],R[-1]C&"|"&RC[7]) -> 2|6|2|5|2 | E241: =IF(RC2=1,RC[7],R[-1]C&"|"&RC[7]) -> 150|300|450|600|750 | F241: 天赋 5 | G241: =VLOOKUP(RC[4],Sheet1!R8C1:R38C3,2,FALSE)&"+"&IF(VLOOKUP(RC[4],Sheet1!R8C1:R38C3,3,FALSE)="固定值",RC[5],RC[5]/100&"%") -> 物防+750 | K241: 2 | L241: =VLOOKUP(INT(MOD(RC[-11],1000)/100),R7C9:R9C10,2,FALSE)*RC[-10]*100 -> 750
A242: 1403 | B242: 6 | C242: 120 | D242: =IF(RC2=1,RC[7],R[-1]C&"|"&RC[7]) -> 2|6|2|5|2|23 | E242: =IF(RC2=1,RC[7],R[-1]C&"|"&RC[7]) -> 150|300|450|600|750|900 | F242: 天赋 6 | G242: =VLOOKUP(RC[4],Sheet1!R8C1:R38C3,2,FALSE)&"+"&IF(VLOOKUP(RC[4],Sheet1!R8C1:R38C3,3,FALSE)="固定值",RC[5],RC[5]/100&"%") -> 物防+9% | K242: 23 | L242: =VLOOKUP(INT(MOD(RC[-11],1000)/100),R7C9:R9C10,2,FALSE)*RC[-10]*100 -> 900
A243: 1403 | B243: 7 | C243: 140 | D243: =IF(RC2=1,RC[7],R[-1]C&"|"&RC[7]) -> 2|6|2|5|2|23|2 | E243: =IF(RC2=1,RC[7],R[-1]C&"|"&RC[7]) -> 150|300|450|600|750|900|1050 | F243: 天赋 7 | G243: =VLOOKUP(RC[4],Sheet1!R8C1:R38C3,2,FALSE)&"+"&IF(VLOOKUP(RC[4],Sheet1!R8C1:R38C3,3,FALSE)="固定值",RC[5],RC[5]/100&"%") -> 物防+1050 | K243: 2 | L243: =VLOOKUP(INT(MOD(RC[-11],1000)/100),R7C9:R9C10,2,FALSE)*RC[-10]*100 -> 1050
A244: 1403 | B244: 8 | C244: 160 | D244: =IF(RC2=1,RC[7],R[-1]C&"|"&RC[7]) -> 2|6|2|5|2|23|2|14 | E244: =IF(RC2=1,RC[7],R[-1]C&"|"&RC[7]) -> 150|300|450|600|750|900|1050|1200 | F244: 天赋 8 | G244: =VLOOKUP(RC[4],Sheet1!R8C1:R38C3,2,FALSE)&"+"&IF(VLOOKUP(RC[4],Sheet1!R8C1:R38C3,3,FALSE)="固定值",RC[5],RC[5]/100&"%") -> 抗暴+12% | K244: 14 | L244: =VLOOKUP(INT(MOD(RC[-11],1000)/100),R7C9:R9C10,2,FALSE)*RC[-10]*100 -> 1200
A245: 1403 | B245: 9 | C245: 180 | D245: =IF(RC2=1,RC[7],R[-1]C&"|"&RC[7]) -> 2|6|2|5|2|23|2|14|2 | E245: =IF(RC2=1,RC[7],R[-1]C&"|"&RC[7]) -> 150|300|450|600|750|900|1050|1200|1350 | F245: 天赋 9 | G245: =VLOOKUP(RC[4],Sheet1!R8C1:R38C3,2,FALSE)&"+"&IF(VLOOKUP(RC[4],Sheet1!R8C1:R38C3,3,FALSE)="固定值",RC[5],RC[5]/100&"%") -> 物防+1350 | K245: 2 | L245: =VLOOKUP(INT(MOD(RC[-11],1000)/100),R7C9:R9C10,2,FALSE)*RC[-10]*100 -> 1350
A246: 1403 | B246: 10 | C246: 200 | D246: =IF(RC2=1,RC[7],R[-1]C&"|"&RC[7]) -> 2|6|2|5|2|23|2|14|2|23 | E246: =IF(RC2=1,RC[7],R[-1]C&"|"&RC[7]) -> 150|300|450|600|750|900|1050|1200|1350|1500 | F246: 天赋 10 | G246: =VLOOKUP(RC[4],Sheet1!R8C1:R38C3,2,FALSE)&"+"&IF(VLOOKUP(RC[4],Sheet1!R8C1:R38C3,3,FALSE)="固定值",RC[5],RC[5]/100&"%") -> 物防+15% | K246: 23 | L246: =VLOOKUP(INT(MOD(RC[-11],1000)/100),R7C9:R9C10,2,FALSE)*RC[-10]*100 -> 1500
A247: 1404 | B247: 1 | C247: 20 | D247: =IF(RC2=1,RC[7],R[-1]C&"|"&RC[7]) -> 2 | E247: =IF(RC2=1,RC[7],R[-1]C&"|"&RC[7]) -> 150 | F247: 天赋 1 | G247: =VLOOKUP(RC[4],Sheet1!R8C1:R38C3,2,FALSE)&"+"&IF(VLOOKUP(RC[4],Sheet1!R8C1:R38C3,3,FALSE)="固定值",RC[5],RC[5]/100&"%") -> 物防+150 | K247: 2 | L247: =VLOOKUP(INT(MOD(RC[-11],1000)/100),R7C9:R9C10,2,FALSE)*RC[-10]*100 -> 150
A248: 1404 | B248: 2 | C248: 40 | D248: =IF(RC2=1,RC[7],R[-1]C&"|"&RC[7]) -> 2|6 | E248: =IF(RC2=1,RC[7],R[-1]C&"|"&RC[7]) -> 150|300 | F248: 天赋 2 | G248: =VLOOKUP(RC[4],Sheet1!R8C1:R38C3,2,FALSE)&"+"&IF(VLOOKUP(RC[4],Sheet1!R8C1:R38C3,3,FALSE)="固定值",RC[5],RC[5]/100&"%") -> 减伤+300 | K248: 6 | L248: =VLOOKUP(INT(MOD(RC[-11],1000)/100),R7C9:R9C10,2,FALSE)*RC[-10]*100 -> 300
A249: 1404 | B249: 3 | C249: 60 | D249: =IF(RC2=1,RC[7],R[-1]C&"|"&RC[7]) -> 2|6|2 | E249: =IF(RC2=1,RC[7],R[-1]C&"|"&RC[7]) -> 150|300|450 | F249: 天赋 3 | G249: =VLOOKUP(RC[4],Sheet1!R8C1:R38C3,2,FALSE)&"+"&IF(VLOOKUP(RC[4],Sheet1!R8C1:R38C3,3,FALSE)="固定值",RC[5],RC[5]/100&"%") -> 物防+450 | K249: 2 | L249: =VLOOKUP(INT(MOD(RC[-11],1000)/100),R7C9:R9C10,2,FALSE)*RC[-10]*100 -> 450
A250: 1404 | B250: 4 | C250: 80 | D250: =IF(RC2=1,RC[7],R[-1]C&"|"&RC[7]) -> 2|6|2|5 | E250: =IF(RC2=1,RC[7],R[-1]C&"|"&RC[7]) -> 150|300|450|600 | F250: 天赋 4 | G250: =VLOOKUP(RC[4],Sheet1!R8C1:R38C3,2,FALSE)&"+"&IF(VLOOKUP(RC[4],Sheet1!R8C1:R38C3,3,FALSE)="固定值",RC[5],RC[5]/100&"%") -> 免伤+6% | K250: 5 | L250: =VLOOKUP(INT(MOD(RC[-11],1000)/100),R7C9:R9C10,2,FALSE)*RC[-10]*100 -> 600
A251: 1404 | B251: 5 | C251: 100 | D251: =IF(RC2=1,RC[7],R[-1]C&"|"&RC[7]) -> 2|6|2|5|2 | E251: =IF(RC2=1,RC[7],R[-1]C&"|"&RC[7]) -> 150|300|450|600|750 | F251: 天赋 5 | G251: =VLOOKUP(RC[4],Sheet1!R8C1:R38C3,2,FALSE)&"+"&IF(VLOOKUP(RC[4],Sheet1!R8C1:R38C3,3,FALSE)="固定值",RC[5],RC[5]/100&"%") -> 物防+750 | K251: 2 | L251: =VLOOKUP(INT(MOD(RC[-11],1000)/100),R7C9:R9C10,2,FALSE)*RC[-10]*100 -> 750
A252: 1404 | B252: 6 | C252: 120 | D252: =IF(RC2=1,RC[7],R[-1]C&"|"&RC[7]) -> 2|6|2|5|2|23 | E252: =IF(RC2=1,RC[7],R[-1]C&"|"&RC[7]) -> 150|300|450|600|750|900 | F252: 天赋 6 | G252: =VLOOKUP(RC[4],Sheet1!R8C1:R38C3,2,FALSE)&"+"&IF(VLOOKUP(RC[4],Sheet1!R8C1:R38C3,3,FALSE)="固定值",RC[5],RC[5]/100&"%") -> 物防+9% | K252: 23 | L252: =VLOOKUP(INT(MOD(RC[-11],1000)/100),R7C9:R9C10,2,FALSE)*RC[-10]*100 -> 900
A253: 1404 | B253: 7 | C253: 140 | D253: =IF(RC2=1,RC[7],R[-1]C&"|"&RC[7]) -> 2|6|2|5|2|23|2 | E253: =IF(RC2=1,RC[7],R[-1]C&"|"&RC[7]) -> 150|300|450|600|750|900|1050 | F253: 天赋 7 | G253: =VLOOKUP(RC[4],Sheet1!R8C1:R38C3,2,FALSE)&"+"&IF(VLOOKUP(RC[4],Sheet1!R8C1:R38C3,3,FALSE)="固定值",RC[5],RC[5]/100&"%") -> 物防+1050 | K253: 2 | L253: =VLOOKUP(INT(MOD(RC[-11],1000)/100),R7C9:R9C10,2,FALSE)*RC[-10]*100 -> 1050
A254: 1404 | B254: 8 | C254: 160 | D254: =IF(RC2=1,RC[7],R[-1]C&"|"&RC[7]) -> 2|6|2|5|2|23|2|14 | E254: =IF(RC2=1,RC[7],R[-1]C&"|"&RC[7]) -> 150|300|450|600|750|900|1050|1200 | F254: 天赋 8 | G254: =VLOOKUP(RC[4],Sheet1!R8C1:R38C3,2,FALSE)&"+"&IF(VLOOKUP(RC[4],Sheet1!R8C1:R38C3,3,FALSE)="固定值",RC[5],RC[5]/100&"%") -> 抗暴+12% | K254: 14 | L254: =VLOOKUP(INT(MOD(RC[-11],1000)/100),R7C9:R9C10,2,FALSE)*RC[-10]*100 -> 1200
A255: 1404 | B255: 9 | C255: 180 | D255: =IF(RC2=1,RC[7],R[-1]C&"|"&RC[7]) -> 2|6|2|5|2|23|2|14|2 | E255: =IF(RC2=1,RC[7],R[-1]C&"|"&RC[7]) -> 150|300|450|600|750|900|1050|1200|1350 | F255: 天赋 9 | G255: =VLOOKUP(RC[4],Sheet1!R8C1:R38C3,2,FALSE)&"+"&IF(VLOOKUP(RC[4],Sheet1!R8C1:R38C3,3,FALSE)="固定值",RC[5],RC[5]/100&"%") -> 物防+1350 | K255: 2 | L255: =VLOOKUP(INT(MOD(RC[-11],1000)/100),R7C9:R9C10,2,FALSE)*RC[-10]*100 -> 1350
A256: 1404 | B256: 10 | C256: 200 | D256: =IF(RC2=1,RC[7],R[-1]C&"|"&RC[7]) -> 2|6|2|5|2|23|2|14|2|23 | E256: =IF(RC2=1,RC[7],R[-1]C&"|"&RC[7]) -> 150|300|450|600|750|900|1050|1200|1350|1500 | F256: 天赋 10 | G256: =VLOOKUP(RC[4],Sheet1!R8C1:R38C3,2,FALSE)&"+"&IF(VLOOKUP(RC[4],Sheet1!R8C1:R38C3,3,FALSE)="固定值",RC[5],RC[5]/100&"%") -> 物防+15% | K256: 23 | L256: =VLOOKUP(INT(MOD(RC[-11],1000)/100),R7C9:R9C10,2,FALSE)*RC[-10]*100 -> 1500
A257: 1405 | B257: 1 | C257: 20 | D257: =IF(RC2=1,RC[7],R[-1]C&"|"&RC[7]) -> 2 | E257: =IF(RC2=1,RC[7],R[-1]C&"|"&RC[7]) -> 150 | F257: 天赋 1 | G257: =VLOOKUP(RC[4],Sheet1!R8C1:R38C3,2,FALSE)&"+"&IF(VLOOKUP(RC[4],Sheet1!R8C1:R38C3,3,FALSE)="固定值",RC[5],RC[5]/100&"%") -> 物防+150 | K257: 2 | L257: =VLOOKUP(INT(MOD(RC[-11],1000)/100),R7C9:R9C10,2,FALSE)*RC[-10]*100 -> 150
A258: 1405 | B258: 2 | C258: 40 | D258: =IF(RC2=1,RC[7],R[-1]C&"|"&RC[7]) -> 2|6 | E258: =IF(RC2=1,RC[7],R[-1]C&"|"&RC[7]) -> 150|300 | F258: 天赋 2 | G258: =VLOOKUP(RC[4],Sheet1!R8C1:R38C3,2,FALSE)&"+"&IF(VLOOKUP(RC[4],Sheet1!R8C1:R38C3,3,FALSE)="固定值",RC[5],RC[5]/100&"%") -> 减伤+300 | K258: 6 | L258: =VLOOKUP(INT(MOD(RC[-11],1000)/100),R7C9:R9C10,2,FALSE)*RC[-10]*100 -> 300
A259: 1405 | B259: 3 | C259: 60 | D259: =IF(RC2=1,RC[7],R[-1]C&"|"&RC[7]) -> 2|6|2 | E259: =IF(RC2=1,RC[7],R[-1]C&"|"&RC[7]) -> 150|300|450 | F259: 天赋 3 | G259: =VLOOKUP(RC[4],Sheet1!R8C1:R38C3,2,FALSE)&"+"&IF(VLOOKUP(RC[4],Sheet1!R8C1:R38C3,3,FALSE)="固定值",RC[5],RC[5]/100&"%") -> 物防+450 | K259: 2 | L259: =VLOOKUP(INT(MOD(RC[-11],1000)/100),R7C9:R9C10,2,FALSE)*RC[-10]*100 -> 450
A260: 1405 | B260: 4 | C260: 80 | D260: =IF(RC2=1,RC[7],R[-1]C&"|"&RC[7]) -> 2|6|2|5 | E260: =IF(RC2=1,RC[7],R[-1]C&"|"&RC[7]) -> 150|300|450|600 | F260: 天赋 4 | G260: =VLOOKUP(RC[4],Sheet1!R8C1:R38C3,2,FALSE)&"+"&IF(VLOOKUP(RC[4],Sheet1!R8C1:R38C3,3,FALSE)="固定值",RC[5],RC[5]/100&"%") -> 免伤+6% | K260: 5 | L260: =VLOOKUP(INT(MOD(RC[-11],1000)/100),R7C9:R9C10,2,FALSE)*RC[-10]*100 -> 600
A261: 1405 | B261: 5 | C261: 100 | D261: =IF(RC2=1,RC[7],R[-1]C&"|"&RC[7]) -> 2|6|2|5|2 | E261: =IF(RC2=1,RC[7],R[-1]C&"|"&RC[7]) -> 150|300|450|600|750 | F261: 天赋 5 | G261: =VLOOKUP(RC[4],Sheet1!R8C1:R38C3,2,FALSE)&"+"&IF(VLOOKUP(RC[4],Sheet1!R8C1:R38C3,3,FALSE)="固定值",RC[5],RC[5]/100&"%") -> 物防+750 | K261: 2 | L261: =VLOOKUP(INT(MOD(RC[-11],1000)/100),R7C9:R9C10,2,FALSE)*RC[-10]*100 -> 750
A262: 1405 | B262: 6 | C262: 120 | D262: =IF(RC2=1,RC[7],R[-1]C&"|"&RC[7]) -> 2|6|2|5|2|23 | E262: =IF(RC2=1,RC[7],R[-1]C&"|"&RC[7]) -> 150|300|450|600|750|900 | F262: 天赋 6 | G262: =VLOOKUP(RC[4],Sheet1!R8C1:R38C3,2,FALSE)&"+"&IF(VLOOKUP(RC[4],Sheet1!R8C1:R38C3,3,FALSE)="固定值",RC[5],RC[5]/100&"%") -> 物防+9% | K262: 23 | L262: =VLOOKUP(INT(MOD(RC[-11],1000)/100),R7C9:R9C10,2,FALSE)*RC[-10]*100 -> 900
A263: 1405 | B263: 7 | C263: 140 | D263: =IF(RC2=1,RC[7],R[-1]C&"|"&RC[7]) -> 2|6|2|5|2|23|2 | E263: =IF(RC2=1,RC[7],R[-1]C&"|"&RC[7]) -> 150|300|450|600|750|900|1050 | F263: 天赋 7 | G263: =VLOOKUP(RC[4],Sheet1!R8C1:R38C3,2,FALSE)&"+"&IF(VLOOKUP(RC[4],Sheet1!R8C1:R38C3,3,FALSE)="固定值",RC[5],RC[5]/100&"%") -> 物防+1050 | K263: 2 | L263: =VLOOKUP(INT(MOD(RC[-11],1000)/100),R7C9:R9C10,2,FALSE)*RC[-10]*100 -> 1050
A264: 1405 | B264: 8 | C264: 160 | D264: =IF(RC2=1,RC[7],R[-1]C&"|"&RC[7]) -> 2|6|2|5|2|23|2|14 | E264: =IF(RC2=1,RC[7],R[-1]C&"|"&RC[7]) -> 150|300|450|600|750|900|1050|1200 | F264: 天赋 8 | G264: =VLOOKUP(RC[4],Sheet1!R8C1:R38C3,2,FALSE)&"+"&IF(VLOOKUP(RC[4],Sheet1!R8C1:R38C3,3,FALSE)="固定值",RC[5],RC[5]/100&"%") -> 抗暴+12% | K264: 14 | L264: =VLOOKUP(INT(MOD(RC[-11],1000)/100),R7C9:R9C10,2,FALSE)*RC[-10]*100 -> 1200
A265: 1405 | B265: 9 | C265: 180 | D265: =IF(RC2=1,RC[7],R[-1]C&"|"&RC[7]) -> 2|6|2|5|2|23|2|14|2 | E265: =IF(RC2=1,RC[7],R[-1]C&"|"&RC[7]) -> 150|300|450|600|750|900|1050|1200|1350 | F265: 天赋 9 | G265: =VLOOKUP(RC[4],Sheet1!R8C1:R38C3,2,FALSE)&"+"&IF(VLOOKUP(RC[4],Sheet1!R8C1:R38C3,3,FALSE)="固定值",RC[5],RC[5]/100&"%") -> 物防+1350 | K265: 2 | L265: =VLOOKUP(INT(MOD(RC[-11],1000)/100),R7C9:R9C10,2,FALSE)*RC[-10]*100 -> 1350
A266: 1405 | B266: 10 | C266: 200 | D266: =IF(RC2=1,RC[7],R[-1]C&"|"&RC[7]) -> 2|6|2|5|2|23|2|14|2|23 | E266: =IF(RC2=1,RC[7],R[-1]C&"|"&RC[7]) -> 150|300|450|600|750|900|1050|1200|1350|1500 | F266: 天赋 10 | G266: =VLOOKUP(RC[4],Sheet1!R8C1:R38C3,2,FALSE)&"+"&IF(VLOOKUP(RC[4],Sheet1!R8C1:R38C3,3,FALSE)="固定值",RC[5],RC[5]/100&"%") -> 物防+15% | K266: 23 | L266: =VLOOKUP(INT(MOD(RC[-11],1000)/100),R7C9:R9C10,2,FALSE)*RC[-10]*100 -> 1500
A267: 1406 | B267: 1 | C267: 20 | D267: =IF(RC2=1,RC[7],R[-1]C&"|"&RC[7]) -> 2 | E267: =IF(RC2=1,RC[7],R[-1]C&"|"&RC[7]) -> 150 | F267: 天赋 1 | G267: =VLOOKUP(RC[4],Sheet1!R8C1:R38C3,2,FALSE)&"+"&IF(VLOOKUP(RC[4],Sheet1!R8C1:R38C3,3,FALSE)="固定值",RC[5],RC[5]/100&"%") -> 物防+150 | K267: 2 | L267: =VLOOKUP(INT(MOD(RC[-11],1000)/100),R7C9:R9C10,2,FALSE)*RC[-10]*100 -> 150
A268: 1406 | B268: 2 | C268: 40 | D268: =IF(RC2=1,RC[7],R[-1]C&"|"&RC[7]) -> 2|6 | E268: =IF(RC2=1,RC[7],R[-1]C&"|"&RC[7]) -> 150|300 | F268: 天赋 2 | G268: =VLOOKUP(RC[4],Sheet1!R8C1:R38C3,2,FALSE)&"+"&IF(VLOOKUP(RC[4],Sheet1!R8C1:R38C3,3,FALSE)="固定值",RC[5],RC[5]/100&"%") -> 减伤+300 | K268: 6 | L268: =VLOOKUP(INT(MOD(RC[-11],1000)/100),R7C9:R9C10,2,FALSE)*RC[-10]*100 -> 300
A269: 1406 | B269: 3 | C269: 60 | D269: =IF(RC2=1,RC[7],R[-1]C&"|"&RC[7]) -> 2|6|2 | E269: =IF(RC2=1,RC[7],R[-1]C&"|"&RC[7]) -> 150|300|450 | F269: 天赋 3 | G269: =VLOOKUP(RC[4],Sheet1!R8C1:R38C3,2,FALSE)&"+"&IF(VLOOKUP(RC[4],Sheet1!R8C1:R38C3,3,FALSE)="固定值",RC[5],RC[5]/100&"%") -> 物防+450 | K269: 2 | L269: =VLOOKUP(INT(MOD(RC[-11],1000)/100),R7C9:R9C10,2,FALSE)*RC[-10]*100 -> 450
A270: 1406 | B270: 4 | C270: 80 | D270: =IF(RC2=1,RC[7],R[-1]C&"|"&RC[7]) -> 2|6|2|5 | E270: =IF(RC2=1,RC[7],R[-1]C&"|"&RC[7]) -> 150|300|450|600 | F270: 天赋 4 | G270: =VLOOKUP(RC[4],Sheet1!R8C1:R38C3,2,FALSE)&"+"&IF(VLOOKUP(RC[4],Sheet1!R8C1:R38C3,3,FALSE)="固定值",RC[5],RC[5]/100&"%") -> 免伤+6% | K270: 5 | L270: =VLOOKUP(INT(MOD(RC[-11],1000)/100),R7C9:R9C10,2,FALSE)*RC[-10]*100 -> 600
A271: 1406 | B271: 5 | C271: 100 | D271: =IF(RC2=1,RC[7],R[-1]C&"|"&RC[7]) -> 2|6|2|5|2 | E271: =IF(RC2=1,RC[7],R[-1]C&"|"&RC[7]) -> 150|300|450|600|750 | F271: 天赋 5 | G271: =VLOOKUP(RC[4],Sheet1!R8C1:R38C3,2,FALSE)&"+"&IF(VLOOKUP(RC[4],Sheet1!R8C1:R38C3,3,FALSE)="固定值",RC[5],RC[5]/100&"%") -> 物防+750 | K271: 2 | L271: =VLOOKUP(INT(MOD(RC[-11],1000)/100),R7C9:R9C10,2,FALSE)*RC[-10]*100 -> 750
A272: 1406 | B272: 6 | C272: 120 | D272: =IF(RC2=1,RC[7],R[-1]C&"|"&RC[7]) -> 2|6|2|5|2|23 | E272: =IF(RC2=1,RC[7],R[-1]C&"|"&RC[7]) -> 150|300|450|600|750|900 | F272: 天赋 6 | G272: =VLOOKUP(RC[4],Sheet1!R8C1:R38C3,2,FALSE)&"+"&IF(VLOOKUP(RC[4],Sheet1!R8C1:R38C3,3,FALSE)="固定值",RC[5],RC[5]/100&"%") -> 物防+9% | K272: 23 | L272: =VLOOKUP(INT(MOD(RC[-11],1000)/100),R7C9:R9C10,2,FALSE)*RC[-10]*100 -> 900
A273: 1406 | B273: 7 | C273: 140 | D273: =IF(RC2=1,RC[7],R[-1]C&"|"&RC[7]) -> 2|6|2|5|2|23|2 | E273: =IF(RC2=1,RC[7],R[-1]C&"|"&RC[7]) -> 150|300|450|600|750|900|1050 | F273: 天赋 7 | G273: =VLOOKUP(RC[4],Sheet1!R8C1:R38C3,2,FALSE)&"+"&IF(VLOOKUP(RC[4],Sheet1!R8C1:R38C3,3,FALSE)="固定值",RC[5],RC[5]/100&"%") -> 物防+1050 | K273: 2 | L273: =VLOOKUP(INT(MOD(RC[-11],1000)/100),R7C9:R9C10,2,FALSE)*RC[-10]*100 -> 1050
A274: 1406 | B274: 8 | C274: 160 | D274: =IF(RC2=1,RC[7],R[-1]C&"|"&RC[7]) -> 2|6|2|5|2|23|2|14 | E274: =IF(RC2=1,RC[7],R[-1]C&"|"&RC[7]) -> 150|300|450|600|750|900|1050|1200 | F274: 天赋 8 | G274: =VLOOKUP(RC[4],Sheet1!R8C1:R38C3,2,FALSE)&"+"&IF(VLOOKUP(RC[4],Sheet1!R8C1:R38C3,3,FALSE)="固定值",RC[5],RC[5]/100&"%") -> 抗暴+12% | K274: 14 | L274: =VLOOKUP(INT(MOD(RC[-11],1000)/100),R7C9:R9C10,2,FALSE)*RC[-10]*100 -> 1200
A275: 1406 | B275: 9 | C275: 180 | D275: =IF(RC2=1,RC[7],R[-1]C&"|"&RC[7]) -> 2|6|2|5|2|23|2|14|2 | E275: =IF(RC2=1,RC[7],R[-1]C&"|"&RC[7]) -> 150|300|450|600|750|900|1050|1200|1350 | F275: 天赋 9 | G275: =VLOOKUP(RC[4],Sheet1!R8C1:R38C3,2,FALSE)&"+"&IF(VLOOKUP(RC[4],Sheet1!R8C1:R38C3,3,FALSE)="固定值",RC[5],RC[5]/100&"%") -> 物防+1350 | K275: 2 | L275: =VLOOKUP(INT(MOD(RC[-11],1000)/100),R7C9:R9C10,2,FALSE)*RC[-10]*100 -> 1350
A276: 1406 | B276: 10 | C276: 200 | D276: =IF(RC2=1,RC[7],R[-1]C&"|"&RC[7]) -> 2|6|2|5|2|23|2|14|2|23 | E276: =IF(RC2=1,RC[7],R[-1]C&"|"&RC[7]) -> 150|300|450|600|750|900|1050|1200|1350|1500 | F276: 天赋 10 | G276: =VLOOKUP(RC[4],Sheet1!R8C1:R38C3,2,FALSE)&"+"&IF(VLOOKUP(RC[4],Sheet1!R8C1:R38C3,3,FALSE)="固定值",RC[5],RC[5]/100&"%") -> 物防+15% | K276: 23 | L276: =VLOOKUP(INT(MOD(RC[-11],1000)/100),R7C9:R9C10,2,FALSE)*RC[-10]*100 -> 1500
A277: 1407 | B277: 1 | C277: 20 | D277: =IF(RC2=1,RC[7],R[-1]C&"|"&RC[7]) -> 2 | E277: =IF(RC2=1,RC[7],R[-1]C&"|"&RC[7]) -> 150 | F277: 天赋 1 | G277: =VLOOKUP(RC[4],Sheet1!R8C1:R38C3,2,FALSE)&"+"&IF(VLOOKUP(RC[4],Sheet1!R8C1:R38C3,3,FALSE)="固定值",RC[5],RC[5]/100&"%") -> 物防+150 | K277: 2 | L277: =VLOOKUP(INT(MOD(RC[-11],1000)/100),R7C9:R9C10,2,FALSE)*RC[-10]*100 -> 150
A278: 1407 | B278: 2 | C278: 40 | D278: =IF(RC2=1,RC[7],R[-1]C&"|"&RC[7]) -> 2|6 | E278: =IF(RC2=1,RC[7],R[-1]C&"|"&RC[7]) -> 150|300 | F278: 天赋 2 | G278: =VLOOKUP(RC[4],Sheet1!R8C1:R38C3,2,FALSE)&"+"&IF(VLOOKUP(RC[4],Sheet1!R8C1:R38C3,3,FALSE)="固定值",RC[5],RC[5]/100&"%") -> 减伤+300 | K278: 6 | L278: =VLOOKUP(INT(MOD(RC[-11],1000)/100),R7C9:R9C10,2,FALSE)*RC[-10]*100 -> 300
A279: 1407 | B279: 3 | C279: 60 | D279: =IF(RC2=1,RC[7],R[-1]C&"|"&RC[7]) -> 2|6|2 | E279: =IF(RC2=1,RC[7],R[-1]C&"|"&RC[7]) -> 150|300|450 | F279: 天赋 3 | G279: =VLOOKUP(RC[4],Sheet1!R8C1:R38C3,2,FALSE)&"+"&IF(VLOOKUP(RC[4],Sheet1!R8C1:R38C3,3,FALSE)="固定值",RC[5],RC[5]/100&"%") -> 物防+450 | K279: 2 | L279: =VLOOKUP(INT(MOD(RC[-11],1000)/100),R7C9:R9C10,2,FALSE)*RC[-10]*100 -> 450
A280: 1407 | B280: 4 | C280: 80 | D280: =IF(RC2=1,RC[7],R[-1]C&"|"&RC[7]) -> 2|6|2|5 | E280: =IF(RC2=1,RC[7],R[-1]C&"|"&RC[7]) -> 150|300|450|600 | F280: 天赋 4 | G280: =VLOOKUP(RC[4],Sheet1!R8C1:R38C3,2,FALSE)&"+"&IF(VLOOKUP(RC[4],Sheet1!R8C1:R38C3,3,FALSE)="固定值",RC[5],RC[5]/100&"%") -> 免伤+6% | K280: 5 | L280: =VLOOKUP(INT(MOD(RC[-11],1000)/100),R7C9:R9C10,2,FALSE)*RC[-10]*100 -> 600
A281: 1407 | B281: 5 | C281: 100 | D281: =IF(RC2=1,RC[7],R[-1]C&"|"&RC[7]) -> 2|6|2|5|2 | E281: =IF(RC2=1,RC[7],R[-1]C&"|"&RC[7]) -> 150|300|450|600|750 | F281: 天赋 5 | G281: =VLOOKUP(RC[4],Sheet1!R8C1:R38C3,2,FALSE)&"+"&IF(VLOOKUP(RC[4],Sheet1!R8C1:R38C3,3,FALSE)="固定值",RC[5],RC[5]/100&"%") -> 物防+750 | K281: 2 | L281: =VLOOKUP(INT(MOD(RC[-11],1000)/100),R7C9:R9C10,2,FALSE)*RC[-10]*100 -> 750
A282: 1407 | B282: 6 | C282: 120 | D282: =IF(RC2=1,RC[7],R[-1]C&"|"&RC[7]) -> 2|6|2|5|2|23 | E282: =IF(RC2=1,RC[7],R[-1]C&"|"&RC[7]) -> 150|300|450|600|750|900 | F282: 天赋 6 | G282: =VLOOKUP(RC[4],Sheet1!R8C1:R38C3,2,FALSE)&"+"&IF(VLOOKUP(RC[4],Sheet1!R8C1:R38C3,3,FALSE)="固定值",RC[5],RC[5]/100&"%") -> 物防+9% | K282: 23 | L282: =VLOOKUP(INT(MOD(RC[-11],1000)/100),R7C9:R9C10,2,FALSE)*RC[-10]*100 -> 900
A283: 1407 | B283: 7 | C283: 140 | D283: =IF(RC2=1,RC[7],R[-1]C&"|"&RC[7]) -> 2|6|2|5|2|23|2 | E283: =IF(RC2=1,RC[7],R[-1]C&"|"&RC[7]) -> 150|300|450|600|750|900|1050 | F283: 天赋 7 | G283: =VLOOKUP(RC[4],Sheet1!R8C1:R38C3,2,FALSE)&"+"&IF(VLOOKUP(RC[4],Sheet1!R8C1:R38C3,3,FALSE)="固定值",RC[5],RC[5]/100&"%") -> 物防+1050 | K283: 2 | L283: =VLOOKUP(INT(MOD(RC[-11],1000)/100),R7C9:R9C10,2,FALSE)*RC[-10]*100 -> 1050
A284: 1407 | B284: 8 | C284: 160 | D284: =IF(RC2=1,RC[7],R[-1]C&"|"&RC[7]) -> 2|6|2|5|2|23|2|14 | E284: =IF(RC2=1,RC[7],R[-1]C&"|"&RC[7]) -> 150|300|450|600|750|900|1050|1200 | F284: 天赋 8 | G284: =VLOOKUP(RC[4],Sheet1!R8C1:R38C3,2,FALSE)&"+"&IF(VLOOKUP(RC[4],Sheet1!R8C1:R38C3,3,FALSE)="固定值",RC[5],RC[5]/100&"%") -> 抗暴+12% | K284: 14 | L284: =VLOOKUP(INT(MOD(RC[-11],1000)/100),R7C9:R9C10,2,FALSE)*RC[-10]*100 -> 1200
A285: 1407 | B285: 9 | C285: 180 | D285: =IF(RC2=1,RC[7],R[-1]C&"|"&RC[7]) -> 2|6|2|5|2|23|2|14|2 | E285: =IF(RC2=1,RC[7],R[-1]C&"|"&RC[7]) -> 150|300|450|600|750|900|1050|1200|1350 | F285: 天赋 9 | G285: =VLOOKUP(RC[4],Sheet1!R8C1:R38C3,2,FALSE)&"+"&IF(VLOOKUP(RC[4],Sheet1!R8C1:R38C3,3,FALSE)="固定值",RC[5],RC[5]/100&"%") -> 物防+1350 | K285: 2 | L285: =VLOOKUP(INT(MOD(RC[-11],1000)/100),R7C9:R9C10,2,FALSE)*RC[-10]*100 -> 1350
A286: 1407 | B286: 10 | C286: 200 | D286: =IF(RC2=1,RC[7],R[-1]C&"|"&RC[7]) -> 2|6|2|5|2|23|2|14|2|23 | E286: =IF(RC2=1,RC[7],R[-1]C&"|"&RC[7]) -> 150|300|450|600|750|900|1050|1200|1350|1500 | F286: 天赋 10 | G286: =VLOOKUP(RC[4],Sheet1!R8C1:R38C3,2,FALSE)&"+"&IF(VLOOKUP(RC[4],Sheet1!R8C1:R38C3,3,FALSE)="固定值",RC[5],RC[5]/100&"%") -> 物防+15% | K286: 23 | L286: =VLOOKUP(INT(MOD(RC[-11],1000)/100),R7C9:R9C10,2,FALSE)*RC[-10]*100 -> 1500
A287: 1408 | B287: 1 | C287: 20 | D287: =IF(RC2=1,RC[7],R[-1]C&"|"&RC[7]) -> 2 | E287: =IF(RC2=1,RC[7],R[-1]C&"|"&RC[7]) -> 150 | F287: 天赋 1 | G287: =VLOOKUP(RC[4],Sheet1!R8C1:R38C3,2,FALSE)&"+"&IF(VLOOKUP(RC[4],Sheet1!R8C1:R38C3,3,FALSE)="固定值",RC[5],RC[5]/100&"%") -> 物防+150 | K287: 2 | L287: =VLOOKUP(INT(MOD(RC[-11],1000)/100),R7C9:R9C10,2,FALSE)*RC[-10]*100 -> 150
A288: 1408 | B288: 2 | C288: 40 | D288: =IF(RC2=1,RC[7],R[-1]C&"|"&RC[7]) -> 2|6 | E288: =IF(RC2=1,RC[7],R[-1]C&"|"&RC[7]) -> 150|300 | F288: 天赋 2 | G288: =VLOOKUP(RC[4],Sheet1!R8C1:R38C3,2,FALSE)&"+"&IF(VLOOKUP(RC[4],Sheet1!R8C1:R38C3,3,FALSE)="固定值",RC[5],RC[5]/100&"%") -> 减伤+300 | K288: 6 | L288: =VLOOKUP(INT(MOD(RC[-11],1000)/100),R7C9:R9C10,2,FALSE)*RC[-10]*100 -> 300
A289: 1408 | B289: 3 | C289: 60 | D289: =IF(RC2=1,RC[7],R[-1]C&"|"&RC[7]) -> 2|6|2 | E289: =IF(RC2=1,RC[7],R[-1]C&"|"&RC[7]) -> 150|300|450 | F289: 天赋 3 | G289: =VLOOKUP(RC[4],Sheet1!R8C1:R38C3,2,FALSE)&"+"&IF(VLOOKUP(RC[4],Sheet1!R8C1:R38C3,3,FALSE)="固定值",RC[5],RC[5]/100&"%") -> 物防+450 | K289: 2 | L289: =VLOOKUP(INT(MOD(RC[-11],1000)/100),R7C9:R9C10,2,FALSE)*RC[-10]*100 -> 450
A290: 1408 | B290: 4 | C290: 80 | D290: =IF(RC2=1,RC[7],R[-1]C&"|"&RC[7]) -> 2|6|2|5 | E290: =IF(RC2=1,RC[7],R[-1]C&"|"&RC[7]) -> 150|300|450|600 | F290: 天赋 4 | G290: =VLOOKUP(RC[4],Sheet1!R8C1:R38C3,2,FALSE)&"+"&IF(VLOOKUP(RC[4],Sheet1!R8C1:R38C3,3,FALSE)="固定值",RC[5],RC[5]/100&"%") -> 免伤+6% | K290: 5 | L290: =VLOOKUP(INT(MOD(RC[-11],1000)/100),R7C9:R9C10,2,FALSE)*RC[-10]*100 -> 600
A291: 1408 | B291: 5 | C291: 100 | D291: =IF(RC2=1,RC[7],R[-1]C&"|"&RC[7]) -> 2|6|2|5|2 | E291: =IF(RC2=1,RC[7],R[-1]C&"|"&RC[7]) -> 150|300|450|600|750 | F291: 天赋 5 | G291: =VLOOKUP(RC[4],Sheet1!R8C1:R38C3,2,FALSE)&"+"&IF(VLOOKUP(RC[4],Sheet1!R8C1:R38C3,3,FALSE)="固定值",RC[5],RC[5]/100&"%") -> 物防+750 | K291: 2 | L291: =VLOOKUP(INT(MOD(RC[-11],1000)/100),R7C9:R9C10,2,FALSE)*RC[-10]*100 -> 750
A292: 1408 | B292: 6 | C292: 120 | D292: =IF(RC2=1,RC[7],R[-1]C&"|"&RC[7]) -> 2|6|2|5|2|23 | E292: =IF(RC2=1,RC[7],R[-1]C&"|"&RC[7]) -> 150|300|450|600|750|900 | F292: 天赋 6 | G292: =VLOOKUP(RC[4],Sheet1!R8C1:R38C3,2,FALSE)&"+"&IF(VLOOKUP(RC[4],Sheet1!R8C1:R38C3,3,FALSE)="固定值",RC[5],RC[5]/100&"%") -> 物防+9% | K292: 23 | L292: =VLOOKUP(INT(MOD(RC[-11],1000)/100),R7C9:R9C10,2,FALSE)*RC[-10]*100 -> 900
A293: 1408 | B293: 7 | C293: 140 | D293: =IF(RC2=1,RC[7],R[-1]C&"|"&RC[7]) -> 2|6|2|5|2|23|2 | E293: =IF(RC2=1,RC[7],R[-1]C&"|"&RC[7]) -> 150|300|450|600|750|900|1050 | F293: 天赋 7 | G293: =VLOOKUP(RC[4],Sheet1!R8C1:R38C3,2,FALSE)&"+"&IF(VLOOKUP(RC[4],Sheet1!R8C1:R38C3,3,FALSE)="固定值",RC[5],RC[5]/100&"%") -> 物防+1050 | K293: 2 | L293: =VLOOKUP(INT(MOD(RC[-11],1000)/100),R7C9:R9C10,2,FALSE)*RC[-10]*100 -> 1050
A294: 1408 | B294: 8 | C294: 160 | D294: =IF(RC2=1,RC[7],R[-1]C&"|"&RC[7]) -> 2|6|2|5|2|23|2|14 | E294: =IF(RC2=1,RC[7],R[-1]C&"|"&RC[7]) -> 150|300|450|600|750|900|1050|1200 | F294: 天赋 8 | G294: =VLOOKUP(RC[4],Sheet1!R8C1:R38C3,2,FALSE)&"+"&IF(VLOOKUP(RC[4],Sheet1!R8C1:R38C3,3,FALSE)="固定值",RC[5],RC[5]/100&"%") -> 抗暴+12% | K294: 14 | L294: =VLOOKUP(INT(MOD(RC[-11],1000)/100),R7C9:R9C10,2,FALSE)*RC[-10]*100 -> 1200
A295: 1408 | B295: 9 | C295: 180 | D295: =IF(RC2=1,RC[7],R[-1]C&"|"&RC[7]) -> 2|6|2|5|2|23|2|14|2 | E295: =IF(RC2=1,RC[7],R[-1]C&"|"&RC[7]) -> 150|300|450|600|750|900|1050|1200|1350 | F295: 天赋 9 | G295: =VLOOKUP(RC[4],Sheet1!R8C1:R38C3,2,FALSE)&"+"&IF(VLOOKUP(RC[4],Sheet1!R8C1:R38C3,3,FALSE)="固定值",RC[5],RC[5]/100&"%") -> 物防+1350 | K295: 2 | L295: =VLOOKUP(INT(MOD(RC[-11],1000)/100),R7C9:R9C10,2,FALSE)*RC[-10]*100 -> 1350
A296: 1408 | B296: 10 | C296: 200 | D296: =IF(RC2=1,RC[7],R[-1]C&"|"&RC[7]) -> 2|6|2|5|2|23|2|14|2|23 | E296: =IF(RC2=1,RC[7],R[-1]C&"|"&RC[7]) -> 150|300|450|600|750|900|1050|1200|1350|1500 | F296: 天赋 10 | G296: =VLOOKUP(RC[4],Sheet1!R8C1:R38C3,2,FALSE)&"+"&IF(VLOOKUP(RC[4],Sheet1!R8C1:R38C3,3,FALSE)="固定值",RC[5],RC[5]/100&"%") -> 物防+15% | K296: 23 | L296: =VLOOKUP(INT(MOD(RC[-11],1000)/100),R7C9:R9C10,2,FALSE)*RC[-10]*100 -> 1500
A297: 1501 | B297: 1 | C297: 20 | D297: =IF(RC2=1,RC[7],R[-41]C&"|"&RC[7]) -> 2 | E297: =IF(RC2=1,RC[7],R[-41]C&"|"&RC[7]) -> 200 | F297: 天赋 1 | G297: =VLOOKUP(RC[4],Sheet1!R8C1:R38C3,2,FALSE)&"+"&IF(VLOOKUP(RC[4],Sheet1!R8C1:R38C3,3,FALSE)="固定值",RC[5],RC[5]/100&"%") -> 物防+200 | K297: 2 | L297: =VLOOKUP(INT(MOD(RC[-11],1000)/100),R7C9:R9C10,2,FALSE)*RC[-10]*100 -> 200
A298: 1501 | B298: 2 | C298: 40 | D298: =IF(RC2=1,RC[7],R[-1]C&"|"&RC[7]) -> 2|6 | E298: =IF(RC2=1,RC[7],R[-1]C&"|"&RC[7]) -> 200|400 | F298: 天赋 2 | G298: =VLOOKUP(RC[4],Sheet1!R8C1:R38C3,2,FALSE)&"+"&IF(VLOOKUP(RC[4],Sheet1!R8C1:R38C3,3,FALSE)="固定值",RC[5],RC[5]/100&"%") -> 减伤+400 | K298: 6 | L298: =VLOOKUP(INT(MOD(RC[-11],1000)/100),R7C9:R9C10,2,FALSE)*RC[-10]*100 -> 400
A299: 1501 | B299: 3 | C299: 60 | D299: =IF(RC2=1,RC[7],R[-1]C&"|"&RC[7]) -> 2|6|2 | E299: =IF(RC2=1,RC[7],R[-1]C&"|"&RC[7]) -> 200|400|600 | F299: 天赋 3 | G299: =VLOOKUP(RC[4],Sheet1!R8C1:R38C3,2,FALSE)&"+"&IF(VLOOKUP(RC[4],Sheet1!R8C1:R38C3,3,FALSE)="固定值",RC[5],RC[5]/100&"%") -> 物防+600 | K299: 2 | L299: =VLOOKUP(INT(MOD(RC[-11],1000)/100),R7C9:R9C10,2,FALSE)*RC[-10]*100 -> 600
A300: 1501 | B300: 4 | C300: 80 | D300: =IF(RC2=1,RC[7],R[-1]C&"|"&RC[7]) -> 2|6|2|5 | E300: =IF(RC2=1,RC[7],R[-1]C&"|"&RC[7]) -> 200|400|600|800 | F300: 天赋 4 | G300: =VLOOKUP(RC[4],Sheet1!R8C1:R38C3,2,FALSE)&"+"&IF(VLOOKUP(RC[4],Sheet1!R8C1:R38C3,3,FALSE)="固定值",RC[5],RC[5]/100&"%") -> 免伤+8% | K300: 5 | L300: =VLOOKUP(INT(MOD(RC[-11],1000)/100),R7C9:R9C10,2,FALSE)*RC[-10]*100 -> 800
A301: 1501 | B301: 5 | C301: 100 | D301: =IF(RC2=1,RC[7],R[-1]C&"|"&RC[7]) -> 2|6|2|5|2 | E301: =IF(RC2=1,RC[7],R[-1]C&"|"&RC[7]) -> 200|400|600|800|1000 | F301: 天赋 5 | G301: =VLOOKUP(RC[4],Sheet1!R8C1:R38C3,2,FALSE)&"+"&IF(VLOOKUP(RC[4],Sheet1!R8C1:R38C3,3,FALSE)="固定值",RC[5],RC[5]/100&"%") -> 物防+1000 | K301: 2 | L301: =VLOOKUP(INT(MOD(RC[-11],1000)/100),R7C9:R9C10,2,FALSE)*RC[-10]*100 -> 1000
A302: 1501 | B302: 6 | C302: 120 | D302: =IF(RC2=1,RC[7],R[-1]C&"|"&RC[7]) -> 2|6|2|5|2|23 | E302: =IF(RC2=1,RC[7],R[-1]C&"|"&RC[7]) -> 200|400|600|800|1000|1200 | F302: 天赋 6 | G302: =VLOOKUP(RC[4],Sheet1!R8C1:R38C3,2,FALSE)&"+"&IF(VLOOKUP(RC[4],Sheet1!R8C1:R38C3,3,FALSE)="固定值",RC[5],RC[5]/100&"%") -> 物防+12% | K302: 23 | L302: =VLOOKUP(INT(MOD(RC[-11],1000)/100),R7C9:R9C10,2,FALSE)*RC[-10]*100 -> 1200
A303: 1501 | B303: 7 | C303: 140 | D303: =IF(RC2=1,RC[7],R[-1]C&"|"&RC[7]) -> 2|6|2|5|2|23|2 | E303: =IF(RC2=1,RC[7],R[-1]C&"|"&RC[7]) -> 200|400|600|800|1000|1200|1400 | F303: 天赋 7 | G303: =VLOOKUP(RC[4],Sheet1!R8C1:R38C3,2,FALSE)&"+"&IF(VLOOKUP(RC[4],Sheet1!R8C1:R38C3,3,FALSE)="固定值",RC[5],RC[5]/100&"%") -> 物防+1400 | K303: 2 | L303: =VLOOKUP(INT(MOD(RC[-11],1000)/100),R7C9:R9C10,2,FALSE)*RC[-10]*100 -> 1400
A304: 1501 | B304: 8 | C304: 160 | D304: =IF(RC2=1,RC[7],R[-1]C&"|"&RC[7]) -> 2|6|2|5|2|23|2|14 | E304: =IF(RC2=1,RC[7],R[-1]C&"|"&RC[7]) -> 200|400|600|800|1000|1200|1400|1600 | F304: 天赋 8 | G304: =VLOOKUP(RC[4],Sheet1!R8C1:R38C3,2,FALSE)&"+"&IF(VLOOKUP(RC[4],Sheet1!R8C1:R38C3,3,FALSE)="固定值",RC[5],RC[5]/100&"%") -> 抗暴+16% | K304: 14 | L304: =VLOOKUP(INT(MOD(RC[-11],1000)/100),R7C9:R9C10,2,FALSE)*RC[-10]*100 -> 1600
A305: 1501 | B305: 9 | C305: 180 | D305: =IF(RC2=1,RC[7],R[-1]C&"|"&RC[7]) -> 2|6|2|5|2|23|2|14|2 | E305: =IF(RC2=1,RC[7],R[-1]C&"|"&RC[7]) -> 200|400|600|800|1000|1200|1400|1600|1800 | F305: 天赋 9 | G305: =VLOOKUP(RC[4],Sheet1!R8C1:R38C3,2,FALSE)&"+"&IF(VLOOKUP(RC[4],Sheet1!R8C1:R38C3,3,FALSE)="固定值",RC[5],RC[5]/100&"%") -> 物防+1800 | K305: 2 | L305: =VLOOKUP(INT(MOD(RC[-11],1000)/100),R7C9:R9C10,2,FALSE)*RC[-10]*100 -> 1800
A306: 1501 | B306: 10 | C306: 200 | D306: =IF(RC2=1,RC[7],R[-1]C&"|"&RC[7]) -> 2|6|2|5|2|23|2|14|2|23 | E306: =IF(RC2=1,RC[7],R[-1]C&"|"&RC[7]) -> 200|400|600|800|1000|1200|1400|1600|1800|2000 | F306: 天赋 10 | G306: =VLOOKUP(RC[4],Sheet1!R8C1:R38C3,2,FALSE)&"+"&IF(VLOOKUP(RC[4],Sheet1!R8C1:R38C3,3,FALSE)="固定值",RC[5],RC[5]/100&"%") -> 物防+20% | K306: 23 | L306: =VLOOKUP(INT(MOD(RC[-11],1000)/100),R7C9:R9C10,2,FALSE)*RC[-10]*100 -> 2000
A307: 1502 | B307: 1 | C307: 20 | D307: =IF(RC2=1,RC[7],R[-1]C&"|"&RC[7]) -> 2 | E307: =IF(RC2=1,RC[7],R[-1]C&"|"&RC[7]) -> 200 | F307: 天赋 1 | G307: =VLOOKUP(RC[4],Sheet1!R8C1:R38C3,2,FALSE)&"+"&IF(VLOOKUP(RC[4],Sheet1!R8C1:R38C3,3,FALSE)="固定值",RC[5],RC[5]/100&"%") -> 物防+200 | K307: 2 | L307: =VLOOKUP(INT(MOD(RC[-11],1000)/100),R7C9:R9C10,2,FALSE)*RC[-10]*100 -> 200
A308: 1502 | B308: 2 | C308: 40 | D308: =IF(RC2=1,RC[7],R[-1]C&"|"&RC[7]) -> 2|6 | E308: =IF(RC2=1,RC[7],R[-1]C&"|"&RC[7]) -> 200|400 | F308: 天赋 2 | G308: =VLOOKUP(RC[4],Sheet1!R8C1:R38C3,2,FALSE)&"+"&IF(VLOOKUP(RC[4],Sheet1!R8C1:R38C3,3,FALSE)="固定值",RC[5],RC[5]/100&"%") -> 减伤+400 | K308: 6 | L308: =VLOOKUP(INT(MOD(RC[-11],1000)/100),R7C9:R9C10,2,FALSE)*RC[-10]*100 -> 400
A309: 1502 | B309: 3 | C309: 60 | D309: =IF(RC2=1,RC[7],R[-1]C&"|"&RC[7]) -> 2|6|2 | E309: =IF(RC2=1,RC[7],R[-1]C&"|"&RC[7]) -> 200|400|600 | F309: 天赋 3 | G309: =VLOOKUP(RC[4],Sheet1!R8C1:R38C3,2,FALSE)&"+"&IF(VLOOKUP(RC[4],Sheet1!R8C1:R38C3,3,FALSE)="固定值",RC[5],RC[5]/100&"%") -> 物防+600 | K309: 2 | L309: =VLOOKUP(INT(MOD(RC[-11],1000)/100),R7C9:R9C10,2,FALSE)*RC[-10]*100 -> 600
A310: 1502 | B310: 4 | C310: 80 | D310: =IF(RC2=1,RC[7],R[-1]C&"|"&RC[7]) -> 2|6|2|5 | E310: =IF(RC2=1,RC[7],R[-1]C&"|"&RC[7]) -> 200|400|600|800 | F310: 天赋 4 | G310: =VLOOKUP(RC[4],Sheet1!R8C1:R38C3,2,FALSE)&"+"&IF(VLOOKUP(RC[4],Sheet1!R8C1:R38C3,3,FALSE)="固定值",RC[5],RC[5]/100&"%") -> 免伤+8% | K310: 5 | L310: =VLOOKUP(INT(MOD(RC[-11],1000)/100),R7C9:R9C10,2,FALSE)*RC[-10]*100 -> 800
A311: 1502 | B311: 5 | C311: 100 | D311: =IF(RC2=1,RC[7],R[-1]C&"|"&RC[7]) -> 2|6|2|5|2 | E311: =IF(RC2=1,RC[7],R[-1]C&"|"&RC[7]) -> 200|400|600|800|1000 | F311: 天赋 5 | G311: =VLOOKUP(RC[4],Sheet1!R8C1:R38C3,2,FALSE)&"+"&IF(VLOOKUP(RC[4],Sheet1!R8C1:R38C3,3,FALSE)="固定值",RC[5],RC[5]/100&"%") -> 物防+1000 | K311: 2 | L311: =VLOOKUP(INT(MOD(RC[-11],1000)/100),R7C9:R9C10,2,FALSE)*RC[-10]*100 -> 1000
A312: 1502 | B312: 6 | C312: 120 | D312: =IF(RC2=1,RC[7],R[-1]C&"|"&RC[7]) -> 2|6|2|5|2|23 | E312: =IF(RC2=1,RC[7],R[-1]C&"|"&RC[7]) -> 200|400|600|800|1000|1200 | F312: 天赋 6 | G312: =VLOOKUP(RC[4],Sheet1!R8C1:R38C3,2,FALSE)&"+"&IF(VLOOKUP(RC[4],Sheet1!R8C1:R38C3,3,FALSE)="固定值",RC[5],RC[5]/100&"%") -> 物防+12% | K312: 23 | L312: =VLOOKUP(INT(MOD(RC[-11],1000)/100),R7C9:R9C10,2,FALSE)*RC[-10]*100 -> 1200
A313: 1502 | B313: 7 | C313: 140 | D313: =IF(RC2=1,RC[7],R[-1]C&"|"&RC[7]) -> 2|6|2|5|2|23|2 | E313: =IF(RC2=1,RC[7],R[-1]C&"|"&RC[7]) -> 200|400|600|800|1000|1200|1400 | F313: 天赋 7 | G313: =VLOOKUP(RC[4],Sheet1!R8C1:R38C3,2,FALSE)&"+"&IF(VLOOKUP(RC[4],Sheet1!R8C1:R38C3,3,FALSE)="固定值",RC[5],RC[5]/100&"%") -> 物防+1400 | K313: 2 | L313: =VLOOKUP(INT(MOD(RC[-11],1000)/100),R7C9:R9C10,2,FALSE)*RC[-10]*100 -> 1400
A314: 1502 | B314: 8 | C314: 160 | D314: =IF(RC2=1,RC[7],R[-1]C&"|"&RC[7]) -> 2|6|2|5|2|23|2|14 | E314: =IF(RC2=1,RC[7],R[-1]C&"|"&RC[7]) -> 200|400|600|800|1000|1200|1400|1600 | F314: 天赋 8 | G314: =VLOOKUP(RC[4],Sheet1!R8C1:R38C3,2,FALSE)&"+"&IF(VLOOKUP(RC[4],Sheet1!R8C1:R38C3,3,FALSE)="固定值",RC[5],RC[5]/100&"%") -> 抗暴+16% | K314: 14 | L314: =VLOOKUP(INT(MOD(RC[-11],1000)/100),R7C9:R9C10,2,FALSE)*RC[-10]*100 -> 1600
A315: 1502 | B315: 9 | C315: 180 | D315: =IF(RC2=1,RC[7],R[-1]C&"|"&RC[7]) -> 2|6|2|5|2|23|2|14|2 | E315: =IF(RC2=1,RC[7],R[-1]C&"|"&RC[7]) -> 200|400|600|800|1000|1200|1400|1600|1800 | F315: 天赋 9 | G315: =VLOOKUP(RC[4],Sheet1!R8C1:R38C3,2,FALSE)&"+"&IF(VLOOKUP(RC[4],Sheet1!R8C1:R38C3,3,FALSE)="固定值",RC[5],RC[5]/100&"%") -> 物防+1800 | K315: 2 | L315: =VLOOKUP(INT(MOD(RC[-11],1000)/100),R7C9:R9C10,2,FALSE)*RC[-10]*100 -> 1800
A316: 1502 | B316: 10 | C316: 200 | D316: =IF(RC2=1,RC[7],R[-1]C&"|"&RC[7]) -> 2|6|2|5|2|23|2|14|2|23 | E316: =IF(RC2=1,RC[7],R[-1]C&"|"&RC[7]) -> 200|400|600|800|1000|1200|1400|1600|1800|2000 | F316: 天赋 10 | G316: =VLOOKUP(RC[4],Sheet1!R8C1:R38C3,2,FALSE)&"+"&IF(VLOOKUP(RC[4],Sheet1!R8C1:R38C3,3,FALSE)="固定值",RC[5],RC[5]/100&"%") -> 物防+20% | K316: 23 | L316: =VLOOKUP(INT(MOD(RC[-11],1000)/100),R7C9:R9C10,2,FALSE)*RC[-10]*100 -> 2000
A317: 1503 | B317: 1 | C317: 20 | D317: =IF(RC2=1,RC[7],R[-1]C&"|"&RC[7]) -> 2 | E317: =IF(RC2=1,RC[7],R[-1]C&"|"&RC[7]) -> 200 | F317: 天赋 1 | G317: =VLOOKUP(RC[4],Sheet1!R8C1:R38C3,2,FALSE)&"+"&IF(VLOOKUP(RC[4],Sheet1!R8C1:R38C3,3,FALSE)="固定值",RC[5],RC[5]/100&"%") -> 物防+200 | K317: 2 | L317: =VLOOKUP(INT(MOD(RC[-11],1000)/100),R7C9:R9C10,2,FALSE)*RC[-10]*100 -> 200
A318: 1503 | B318: 2 | C318: 40 | D318: =IF(RC2=1,RC[7],R[-1]C&"|"&RC[7]) -> 2|6 | E318: =IF(RC2=1,RC[7],R[-1]C&"|"&RC[7]) -> 200|400 | F318: 天赋 2 | G318: =VLOOKUP(RC[4],Sheet1!R8C1:R38C3,2,FALSE)&"+"&IF(VLOOKUP(RC[4],Sheet1!R8C1:R38C3,3,FALSE)="固定值",RC[5],RC[5]/100&"%") -> 减伤+400 | K318: 6 | L318: =VLOOKUP(INT(MOD(RC[-11],1000)/100),R7C9:R9C10,2,FALSE)*RC[-10]*100 -> 400
A319: 1503 | B319: 3 | C319: 60 | D319: =IF(RC2=1,RC[7],R[-1]C&"|"&RC[7]) -> 2|6|2 | E319: =IF(RC2=1,RC[7],R[-1]C&"|"&RC[7]) -> 200|400|600 | F319: 天赋 3 | G319: =VLOOKUP(RC[4],Sheet1!R8C1:R38C3,2,FALSE)&"+"&IF(VLOOKUP(RC[4],Sheet1!R8C1:R38C3,3,FALSE)="固定值",RC[5],RC[5]/100&"%") -> 物防+600 | K319: 2 | L319: =VLOOKUP(INT(MOD(RC[-11],1000)/100),R7C9:R9C10,2,FALSE)*RC[-10]*100 -> 600
A320: 1503 | B320: 4 | C320: 80 | D320: =IF(RC2=1,RC[7],R[-1]C&"|"&RC[7]) -> 2|6|2|5 | E320: =IF(RC2=1,RC[7],R[-1]C&"|"&RC[7]) -> 200|400|600|800 | F320: 天赋 4 | G320: =VLOOKUP(RC[4],Sheet1!R8C1:R38C3,2,FALSE)&"+"&IF(VLOOKUP(RC[4],Sheet1!R8C1:R38C3,3,FALSE)="固定值",RC[5],RC[5]/100&"%") -> 免伤+8% | K320: 5 | L320: =VLOOKUP(INT(MOD(RC[-11],1000)/100),R7C9:R9C10,2,FALSE)*RC[-10]*100 -> 800
A321: 1503 | B321: 5 | C321: 100 | D321: =IF(RC2=1,RC[7],R[-1]C&"|"&RC[7]) -> 2|6|2|5|2 | E321: =IF(RC2=1,RC[7],R[-1]C&"|"&RC[7]) -> 200|400|600|800|1000 | F321: 天赋 5 | G321: =VLOOKUP(RC[4],Sheet1!R8C1:R38C3,2,FALSE)&"+"&IF(VLOOKUP(RC[4],Sheet1!R8C1:R38C3,3,FALSE)="固定值",RC[5],RC[5]/100&"%") -> 物防+1000 | K321: 2 | L321: =VLOOKUP(INT(MOD(RC[-11],1000)/100),R7C9:R9C10,2,FALSE)*RC[-10]*100 -> 1000
A322: 1503 | B322: 6 | C322: 120 | D322: =IF(RC2=1,RC[7],R[-1]C&"|"&RC[7]) -> 2|6|2|5|2|23 | E322: =IF(RC2=1,RC[7],R[-1]C&"|"&RC[7]) -> 200|400|600|800|1000|1200 | F322: 天赋 6 | G322: =VLOOKUP(RC[4],Sheet1!R8C1:R38C3,2,FALSE)&"+"&IF(VLOOKUP(RC[4],Sheet1!R8C1:R38C3,3,FALSE)="固定值",RC[5],RC[5]/100&"%") -> 物防+12% | K322: 23 | L322: =VLOOKUP(INT(MOD(RC[-11],1000)/100),R7C9:R9C10,2,FALSE)*RC[-10]*100 -> 1200
A323: 1503 | B323: 7 | C323: 140 | D323: =IF(RC2=1,RC[7],R[-1]C&"|"&RC[7]) -> 2|6|2|5|2|23|2 | E323: =IF(RC2=1,RC[7],R[-1]C&"|"&RC[7]) -> 200|400|600|800|1000|1200|1400 | F323: 天赋 7 | G323: =VLOOKUP(RC[4],Sheet1!R8C1:R38C3,2,FALSE)&"+"&IF(VLOOKUP(RC[4],Sheet1!R8C1:R38C3,3,FALSE)="固定值",RC[5],RC[5]/100&"%") -> 物防+1400 | K323: 2 | L323: =VLOOKUP(INT(MOD(RC[-11],1000)/100),R7C9:R9C10,2,FALSE)*RC[-10]*100 -> 1400
A324: 1503 | B324: 8 | C324: 160 | D324: =IF(RC2=1,RC[7],R[-1]C&"|"&RC[7]) -> 2|6|2|5|2|23|2|14 | E324: =IF(RC2=1,RC[7],R[-1]C&"|"&RC[7]) -> 200|400|600|800|1000|1200|1400|1600 | F324: 天赋 8 | G324: =VLOOKUP(RC[4],Sheet1!R8C1:R38C3,2,FALSE)&"+"&IF(VLOOKUP(RC[4],Sheet1!R8C1:R38C3,3,FALSE)="固定值",RC[5],RC[5]/100&"%") -> 抗暴+16% | K324: 14 | L324: =VLOOKUP(INT(MOD(RC[-11],1000)/100),R7C9:R9C10,2,FALSE)*RC[-10]*100 -> 1600
A325: 1503 | B325: 9 | C325: 180 | D325: =IF(RC2=1,RC[7],R[-1]C&"|"&RC[7]) -> 2|6|2|5|2|23|2|14|2 | E325: =IF(RC2=1,RC[7],R[-1]C&"|"&RC[7]) -> 200|400|600|800|1000|1200|1400|1600|1800 | F325: 天赋 9 | G325: =VLOOKUP(RC[4],Sheet1!R8C1:R38C3,2,FALSE)&"+"&IF(VLOOKUP(RC[4],Sheet1!R8C1:R38C3,3,FALSE)="固定值",RC[5],RC[5]/100&"%") -> 物防+1800 | K325: 2 | L325: =VLOOKUP(INT(MOD(RC[-11],1000)/100),R7C9:R9C10,2,FALSE)*RC[-10]*100 -> 1800
A326: 1503 | B326: 10 | C326: 200 | D326: =IF(RC2=1,RC[7],R[-1]C&"|"&RC[7]) -> 2|6|2|5|2|23|2|14|2|23 | E326: =IF(RC2=1,RC[7],R[-1]C&"|"&RC[7]) -> 200|400|600|800|1000|1200|1400|1600|1800|2000 | F326: 天赋 10 | G326: =VLOOKUP(RC[4],Sheet1!R8C1:R38C3,2,FALSE)&"+"&IF(VLOOKUP(RC[4],Sheet1!R8C1:R38C3,3,FALSE)="固定值",RC[5],RC[5]/100&"%") -> 物防+20% | K326: 23 | L326: =VLOOKUP(INT(MOD(RC[-11],1000)/100),R7C9:R9C10,2,FALSE)*RC[-10]*100 -> 2000
A327: 1504 | B327: 1 | C327: 20 | D327: =IF(RC2=1,RC[7],R[-11]C&"|"&RC[7]) -> 2 | E327: =IF(RC2=1,RC[7],R[-11]C&"|"&RC[7]) -> 200 | F327: 天赋 1 | G327: =VLOOKUP(RC[4],Sheet1!R8C1:R38C3,2,FALSE)&"+"&IF(VLOOKUP(RC[4],Sheet1!R8C1:R38C3,3,FALSE)="固定值",RC[5],RC[5]/100&"%") -> 物防+200 | K327: 2 | L327: =VLOOKUP(INT(MOD(RC[-11],1000)/100),R7C9:R9C10,2,FALSE)*RC[-10]*100 -> 200
A328: 1504 | B328: 2 | C328: 40 | D328: =IF(RC2=1,RC[7],R[-1]C&"|"&RC[7]) -> 2|6 | E328: =IF(RC2=1,RC[7],R[-1]C&"|"&RC[7]) -> 200|400 | F328: 天赋 2 | G328: =VLOOKUP(RC[4],Sheet1!R8C1:R38C3,2,FALSE)&"+"&IF(VLOOKUP(RC[4],Sheet1!R8C1:R38C3,3,FALSE)="固定值",RC[5],RC[5]/100&"%") -> 减伤+400 | K328: 6 | L328: =VLOOKUP(INT(MOD(RC[-11],1000)/100),R7C9:R9C10,2,FALSE)*RC[-10]*100 -> 400
A329: 1504 | B329: 3 | C329: 60 | D329: =IF(RC2=1,RC[7],R[-1]C&"|"&RC[7]) -> 2|6|2 | E329: =IF(RC2=1,RC[7],R[-1]C&"|"&RC[7]) -> 200|400|600 | F329: 天赋 3 | G329: =VLOOKUP(RC[4],Sheet1!R8C1:R38C3,2,FALSE)&"+"&IF(VLOOKUP(RC[4],Sheet1!R8C1:R38C3,3,FALSE)="固定值",RC[5],RC[5]/100&"%") -> 物防+600 | K329: 2 | L329: =VLOOKUP(INT(MOD(RC[-11],1000)/100),R7C9:R9C10,2,FALSE)*RC[-10]*100 -> 600
A330: 1504 | B330: 4 | C330: 80 | D330: =IF(RC2=1,RC[7],R[-1]C&"|"&RC[7]) -> 2|6|2|5 | E330: =IF(RC2=1,RC[7],R[-1]C&"|"&RC[7]) -> 200|400|600|800 | F330: 天赋 4 | G330: =VLOOKUP(RC[4],Sheet1!R8C1:R38C3,2,FALSE)&"+"&IF(VLOOKUP(RC[4],Sheet1!R8C1:R38C3,3,FALSE)="固定值",RC[5],RC[5]/100&"%") -> 免伤+8% | K330: 5 | L330: =VLOOKUP(INT(MOD(RC[-11],1000)/100),R7C9:R9C10,2,FALSE)*RC[-10]*100 -> 800
A331: 1504 | B331: 5 | C331: 100 | D331: =IF(RC2=1,RC[7],R[-1]C&"|"&RC[7]) -> 2|6|2|5|2 | E331: =IF(RC2=1,RC[7],R[-1]C&"|"&RC[7]) -> 200|400|600|800|1000 | F331: 天赋 5 | G331: =VLOOKUP(RC[4],Sheet1!R8C1:R38C3,2,FALSE)&"+"&IF(VLOOKUP(RC[4],Sheet1!R8C1:R38C3,3,FALSE)="固定值",RC[5],RC[5]/100&"%") -> 物防+1000 | K331: 2 | L331: =VLOOKUP(INT(MOD(RC[-11],1000)/100),R7C9:R9C10,2,FALSE)*RC[-10]*100 -> 1000
A332: 1504 | B332: 6 | C332: 120 | D332: =IF(RC2=1,RC[7],R[-1]C&"|"&RC[7]) -> 2|6|2|5|2|23 | E332: =IF(RC2=1,RC[7],R[-1]C&"|"&RC[7]) -> 200|400|600|800|1000|1200 | F332: 天赋 6 | G332: =VLOOKUP(RC[4],Sheet1!R8C1:R38C3,2,FALSE)&"+"&IF(VLOOKUP(RC[4],Sheet1!R8C1:R38C3,3,FALSE)="固定值",RC[5],RC[5]/100&"%") -> 物防+12% | K332: 23 | L332: =VLOOKUP(INT(MOD(RC[-11],1000)/100),R7C9:R9C10,2,FALSE)*RC[-10]*100 -> 1200
A333: 1504 | B333: 7 | C333: 140 | D333: =IF(RC2=1,RC[7],R[-1]C&"|"&RC[7]) -> 2|6|2|5|2|23|2 | E333: =IF(RC2=1,RC[7],R[-1]C&"|"&RC[7]) -> 200|400|600|800|1000|1200|1400 | F333: 天赋 7 | G333: =VLOOKUP(RC[4],Sheet1!R8C1:R38C3,2,FALSE)&"+"&IF(VLOOKUP(RC[4],Sheet1!R8C1:R38C3,3,FALSE)="固定值",RC[5],RC[5]/100&"%") -> 物防+1400 | K333: 2 | L333: =VLOOKUP(INT(MOD(RC[-11],1000)/100),R7C9:R9C10,2,FALSE)*RC[-10]*100 -> 1400
A334: 1504 | B334: 8 | C334: 160 | D334: =IF(RC2=1,RC[7],R[-1]C&"|"&RC[7]) -> 2|6|2|5|2|23|2|14 | E334: =IF(RC2=1,RC[7],R[-1]C&"|"&RC[7]) -> 200|400|600|800|1000|1200|1400|1600 | F334: 天赋 8 | G334: =VLOOKUP(RC[4],Sheet1!R8C1:R38C3,2,FALSE)&"+"&IF(VLOOKUP(RC[4],Sheet1!R8C1:R38C3,3,FALSE)="固定值",RC[5],RC[5]/100&"%") -> 抗暴+16% | K334: 14 | L334: =VLOOKUP(INT(MOD(RC[-11],1000)/100),R7C9:R9C10,2,FALSE)*RC[-10]*100 -> 1600
A335: 1504 | B335: 9 | C335: 180 | D335: =IF(RC2=1,RC[7],R[-1]C&"|"&RC[7]) -> 2|6|2|5|2|23|2|14|2 | E335: =IF(RC2=1,RC[7],R[-1]C&"|"&RC[7]) -> 200|400|600|800|1000|1200|1400|1600|1800 | F335: 天赋 9 | G335: =VLOOKUP(RC[4],Sheet1!R8C1:R38C3,2,FALSE)&"+"&IF(VLOOKUP(RC[4],Sheet1!R8C1:R38C3,3,FALSE)="固定值",RC[5],RC[5]/100&"%") -> 物防+1800 | K335: 2 | L335: =VLOOKUP(INT(MOD(RC[-11],1000)/100),R7C9:R9C10,2,FALSE)*RC[-10]*100 -> 1800
A336: 1504 | B336: 10 | C336: 200 | D336: =IF(RC2=1,RC[7],R[-1]C&"|"&RC[7]) -> 2|6|2|5|2|23|2|14|2|23 | E336: =IF(RC2=1,RC[7],R[-1]C&"|"&RC[7]) -> 200|400|600|800|1000|1200|1400|1600|1800|2000 | F336: 天赋 10 | G336: =VLOOKUP(RC[4],Sheet1!R8C1:R38C3,2,FALSE)&"+"&IF(VLOOKUP(RC[4],Sheet1!R8C1:R38C3,3,FALSE)="固定值",RC[5],RC[5]/100&"%") -> 物防+20% | K336: 23 | L336: =VLOOKUP(INT(MOD(RC[-11],1000)/100),R7C9:R9C10,2,FALSE)*RC[-10]*100 -> 2000
A337: 1505 | B337: 1 | C337: 20 | D337: =IF(RC2=1,RC[7],R[-11]C&"|"&RC[7]) -> 2 | E337: =IF(RC2=1,RC[7],R[-11]C&"|"&RC[7]) -> 200 | F337: 天赋 1 | G337: =VLOOKUP(RC[4],Sheet1!R8C1:R38C3,2,FALSE)&"+"&IF(VLOOKUP(RC[4],Sheet1!R8C1:R38C3,3,FALSE)="固定值",RC[5],RC[5]/100&"%") -> 物防+200 | K337: 2 | L337: =VLOOKUP(INT(MOD(RC[-11],1000)/100),R7C9:R9C10,2,FALSE)*RC[-10]*100 -> 200
A338: 1505 | B338: 2 | C338: 40 | D338: =IF(RC2=1,RC[7],R[-1]C&"|"&RC[7]) -> 2|6 | E338: =IF(RC2=1,RC[7],R[-1]C&"|"&RC[7]) -> 200|400 | F338: 天赋 2 | G338: =VLOOKUP(RC[4],Sheet1!R8C1:R38C3,2,FALSE)&"+"&IF(VLOOKUP(RC[4],Sheet1!R8C1:R38C3,3,FALSE)="固定值",RC[5],RC[5]/100&"%") -> 减伤+400 | K338: 6 | L338: =VLOOKUP(INT(MOD(RC[-11],1000)/100),R7C9:R9C10,2,FALSE)*RC[-10]*100 -> 400
A339: 1505 | B339: 3 | C339: 60 | D339: =IF(RC2=1,RC[7],R[-1]C&"|"&RC[7]) -> 2|6|2 | E339: =IF(RC2=1,RC[7],R[-1]C&"|"&RC[7]) -> 200|400|600 | F339: 天赋 3 | G339: =VLOOKUP(RC[4],Sheet1!R8C1:R38C3,2,FALSE)&"+"&IF(VLOOKUP(RC[4],Sheet1!R8C1:R38C3,3,FALSE)="固定值",RC[5],RC[5]/100&"%") -> 物防+600 | K339: 2 | L339: =VLOOKUP(INT(MOD(RC[-11],1000)/100),R7C9:R9C10,2,FALSE)*RC[-10]*100 -> 600
A340: 1505 | B340: 4 | C340: 80 | D340: =IF(RC2=1,RC[7],R[-1]C&"|"&RC[7]) -> 2|6|2|5 | E340: =IF(RC2=1,RC[7],R[-1]C&"|"&RC[7]) -> 200|400|600|800 | F340: 天赋 4 | G340: =VLOOKUP(RC[4],Sheet1!R8C1:R38C3,2,FALSE)&"+"&IF(VLOOKUP(RC[4],Sheet1!R8C1:R38C3,3,FALSE)="固定值",RC[5],RC[5]/100&"%") -> 免伤+8% | K340: 5 | L340: =VLOOKUP(INT(MOD(RC[-11],1000)/100),R7C9:R9C10,2,FALSE)*RC[-10]*100 -> 800
A341: 1505 | B341: 5 | C341: 100 | D341: =IF(RC2=1,RC[7],R[-1]C&"|"&RC[7]) -> 2|6|2|5|2 | E341: =IF(RC2=1,RC[7],R[-1]C&"|"&RC[7]) -> 200|400|600|800|1000 | F341: 天赋 5 | G341: =VLOOKUP(RC[4],Sheet1!R8C1:R38C3,2,FALSE)&"+"&IF(VLOOKUP(RC[4],Sheet1!R8C1:R38C3,3,FALSE)="固定值",RC[5],RC[5]/100&"%") -> 物防+1000 | K341: 2 | L341: =VLOOKUP(INT(MOD(RC[-11],1000)/100),R7C9:R9C10,2,FALSE)*RC[-10]*100 -> 1000
A342: 1505 | B342: 6 | C342: 120 | D342: =IF(RC2=1,RC[7],R[-1]C&"|"&RC[7]) -> 2|6|2|5|2|23 | E342: =IF(RC2=1,RC[7],R[-1]C&"|"&RC[7]) -> 200|400|600|800|1000|1200 | F342: 天赋 6 | G342: =VLOOKUP(RC[4],Sheet1!R8C1:R38C3,2,FALSE)&"+"&IF(VLOOKUP(RC[4],Sheet1!R8C1:R38C3,3,FALSE)="固定值",RC[5],RC[5]/100&"%") -> 物防+12% | K342: 23 | L342: =VLOOKUP(INT(MOD(RC[-11],1000)/100),R7C9:R9C10,2,FALSE)*RC[-10]*100 -> 1200
A343: 1505 | B343: 7 | C343: 140 | D343: =IF(RC2=1,RC[7],R[-1]C&"|"&RC[7]) -> 2|6|2|5|2|23|2 | E343: =IF(RC2=1,RC[7],R[-1]C&"|"&RC[7]) -> 200|400|600|800|1000|1200|1400 | F343: 天赋 7 | G343: =VLOOKUP(RC[4],Sheet1!R8C1:R38C3,2,FALSE)&"+"&IF(VLOOKUP(RC[4],Sheet1!R8C1:R38C3,3,FALSE)="固定值",RC[5],RC[5]/100&"%") -> 物防+1400 | K343: 2 | L343: =VLOOKUP(INT(MOD(RC[-11],1000)/100),R7C9:R9C10,2,FALSE)*RC[-10]*100 -> 1400
A344: 1505 | B344: 8 | C344: 160 | D344: =IF(RC2=1,RC[7],R[-1]C&"|"&RC[7]) -> 2|6|2|5|2|23|2|14 | E344: =IF(RC2=1,RC[7],R[-1]C&"|"&RC[7]) -> 200|400|600|800|1000|1200|1400|1600 | F344: 天赋 8 | G344: =VLOOKUP(RC[4],Sheet1!R8C1:R38C3,2,FALSE)&"+"&IF(VLOOKUP(RC[4],Sheet1!R8C1:R38C3,3,FALSE)="固定值",RC[5],RC[5]/100&"%") -> 抗暴+16% | K344: 14 | L344: =VLOOKUP(INT(MOD(RC[-11],1000)/100),R7C9:R9C10,2,FALSE)*RC[-10]*100 -> 1600
A345: 1505 | B345: 9 | C345: 180 | D345: =IF(RC2=1,RC[7],R[-1]C&"|"&RC[7]) -> 2|6|2|5|2|23|2|14|2 | E345: =IF(RC2=1,RC[7],R[-1]C&"|"&RC[7]) -> 200|400|600|800|1000|1200|1400|1600|1800 | F345: 天赋 9 | G345: =VLOOKUP(RC[4],Sheet1!R8C1:R38C3,2,FALSE)&"+"&IF(VLOOKUP(RC[4],Sheet1!R8C1:R38C3,3,FALSE)="固定值",RC[5],RC[5]/100&"%") -> 物防+1800 | K345: 2 | L345: =VLOOKUP(INT(MOD(RC[-11],1000)/100),R7C9:R9C10,2,FALSE)*RC[-10]*100 -> 1800
A346: 1505 | B346: 10 | C346: 200 | D346: =IF(RC2=1,RC[7],R[-1]C&"|"&RC[7]) -> 2|6|2|5|2|23|2|14|2|23 | E346: =IF(RC2=1,RC[7],R[-1]C&"|"&RC[7]) -> 200|400|600|800|1000|1200|1400|1600|1800|2000 | F346: 天赋 10 | G346: =VLOOKUP(RC[4],Sheet1!R8C1:R38C3,2,FALSE)&"+"&IF(VLOOKUP(RC[4],Sheet1!R8C1:R38C3,3,FALSE)="固定值",RC[5],RC[5]/100&"%") -> 物防+20% | K346: 23 | L346: =VLOOKUP(INT(MOD(RC[-11],1000)/100),R7C9:R9C10,2,FALSE)*RC[-10]*100 -> 2000
A347: 2302 | B347: 1 | C347: 20 | D347: =IF(RC2=1,RC[7],R[-31]C&"|"&RC[7]) -> 3 | E347: =IF(RC2=1,RC[7],R[-31]C&"|"&RC[7]) -> 100 | F347: 天赋 1 | G347: =VLOOKUP(RC[4],Sheet1!R8C1:R38C3,2,FALSE)&"+"&IF(VLOOKUP(RC[4],Sheet1!R8C1:R38C3,3,FALSE)="固定值",RC[5],RC[5]/100&"%") -> 法防+100 | K347: 3 | L347: =VLOOKUP(INT(MOD(RC[-11],1000)/100),R7C9:R9C10,2,FALSE)*RC[-10]*100 -> 100
A348: 2302 | B348: 2 | C348: 40 | D348: =IF(RC2=1,RC[7],R[-1]C&"|"&RC[7]) -> 3|6 | E348: =IF(RC2=1,RC[7],R[-1]C&"|"&RC[7]) -> 100|200 | F348: 天赋 2 | G348: =VLOOKUP(RC[4],Sheet1!R8C1:R38C3,2,FALSE)&"+"&IF(VLOOKUP(RC[4],Sheet1!R8C1:R38C3,3,FALSE)="固定值",RC[5],RC[5]/100&"%") -> 减伤+200 | K348: 6 | L348: =VLOOKUP(INT(MOD(RC[-11],1000)/100),R7C9:R9C10,2,FALSE)*RC[-10]*100 -> 200
A349: 2302 | B349: 3 | C349: 60 | D349: =IF(RC2=1,RC[7],R[-1]C&"|"&RC[7]) -> 3|6|3 | E349: =IF(RC2=1,RC[7],R[-1]C&"|"&RC[7]) -> 100|200|300 | F349: 天赋 3 | G349: =VLOOKUP(RC[4],Sheet1!R8C1:R38C3,2,FALSE)&"+"&IF(VLOOKUP(RC[4],Sheet1!R8C1:R38C3,3,FALSE)="固定值",RC[5],RC[5]/100&"%") -> 法防+300 | K349: 3 | L349: =VLOOKUP(INT(MOD(RC[-11],1000)/100),R7C9:R9C10,2,FALSE)*RC[-10]*100 -> 300
A350: 2302 | B350: 4 | C350: 80 | D350: =IF(RC2=1,RC[7],R[-1]C&"|"&RC[7]) -> 3|6|3|5 | E350: =IF(RC2=1,RC[7],R[-1]C&"|"&RC[7]) -> 100|200|300|400 | F350: 天赋 4 | G350: =VLOOKUP(RC[4],Sheet1!R8C1:R38C3,2,FALSE)&"+"&IF(VLOOKUP(RC[4],Sheet1!R8C1:R38C3,3,FALSE)="固定值",RC[5],RC[5]/100&"%") -> 免伤+4% | K350: 5 | L350: =VLOOKUP(INT(MOD(RC[-11],1000)/100),R7C9:R9C10,2,FALSE)*RC[-10]*100 -> 400
A351: 2302 | B351: 5 | C351: 100 | D351: =IF(RC2=1,RC[7],R[-1]C&"|"&RC[7]) -> 3|6|3|5|3 | E351: =IF(RC2=1,RC[7],R[-1]C&"|"&RC[7]) -> 100|200|300|400|500 | F351: 天赋 5 | G351: =VLOOKUP(RC[4],Sheet1!R8C1:R38C3,2,FALSE)&"+"&IF(VLOOKUP(RC[4],Sheet1!R8C1:R38C3,3,FALSE)="固定值",RC[5],RC[5]/100&"%") -> 法防+500 | K351: 3 | L351: =VLOOKUP(INT(MOD(RC[-11],1000)/100),R7C9:R9C10,2,FALSE)*RC[-10]*100 -> 500
A352: 2302 | B352: 6 | C352: 120 | D352: =IF(RC2=1,RC[7],R[-1]C&"|"&RC[7]) -> 3|6|3|5|3|24 | E352: =IF(RC2=1,RC[7],R[-1]C&"|"&RC[7]) -> 100|200|300|400|500|600 | F352: 天赋 6 | G352: =VLOOKUP(RC[4],Sheet1!R8C1:R38C3,2,FALSE)&"+"&IF(VLOOKUP(RC[4],Sheet1!R8C1:R38C3,3,FALSE)="固定值",RC[5],RC[5]/100&"%") -> 法防+6% | K352: 24 | L352: =VLOOKUP(INT(MOD(RC[-11],1000)/100),R7C9:R9C10,2,FALSE)*RC[-10]*100 -> 600
A353: 2302 | B353: 7 | C353: 140 | D353: =IF(RC2=1,RC[7],R[-1]C&"|"&RC[7]) -> 3|6|3|5|3|24|3 | E353: =IF(RC2=1,RC[7],R[-1]C&"|"&RC[7]) -> 100|200|300|400|500|600|700 | F353: 天赋 7 | G353: =VLOOKUP(RC[4],Sheet1!R8C1:R38C3,2,FALSE)&"+"&IF(VLOOKUP(RC[4],Sheet1!R8C1:R38C3,3,FALSE)="固定值",RC[5],RC[5]/100&"%") -> 法防+700 | K353: 3 | L353: =VLOOKUP(INT(MOD(RC[-11],1000)/100),R7C9:R9C10,2,FALSE)*RC[-10]*100 -> 700
A354: 2302 | B354: 8 | C354: 160 | D354: =IF(RC2=1,RC[7],R[-1]C&"|"&RC[7]) -> 3|6|3|5|3|24|3|12 | E354: =IF(RC2=1,RC[7],R[-1]C&"|"&RC[7]) -> 100|200|300|400|500|600|700|800 | F354: 天赋 8 | G354: =VLOOKUP(RC[4],Sheet1!R8C1:R38C3,2,FALSE)&"+"&IF(VLOOKUP(RC[4],Sheet1!R8C1:R38C3,3,FALSE)="固定值",RC[5],RC[5]/100&"%") -> 闪避+8% | K354: 12 | L354: =VLOOKUP(INT(MOD(RC[-11],1000)/100),R7C9:R9C10,2,FALSE)*RC[-10]*100 -> 800
A355: 2302 | B355: 9 | C355: 180 | D355: =IF(RC2=1,RC[7],R[-1]C&"|"&RC[7]) -> 3|6|3|5|3|24|3|12|3 | E355: =IF(RC2=1,RC[7],R[-1]C&"|"&RC[7]) -> 100|200|300|400|500|600|700|800|900 | F355: 天赋 9 | G355: =VLOOKUP(RC[4],Sheet1!R8C1:R38C3,2,FALSE)&"+"&IF(VLOOKUP(RC[4],Sheet1!R8C1:R38C3,3,FALSE)="固定值",RC[5],RC[5]/100&"%") -> 法防+900 | K355: 3 | L355: =VLOOKUP(INT(MOD(RC[-11],1000)/100),R7C9:R9C10,2,FALSE)*RC[-10]*100 -> 900
A356: 2302 | B356: 10 | C356: 200 | D356: =IF(RC2=1,RC[7],R[-1]C&"|"&RC[7]) -> 3|6|3|5|3|24|3|12|3|24 | E356: =IF(RC2=1,RC[7],R[-1]C&"|"&RC[7]) -> 100|200|300|400|500|600|700|800|900|1000 | F356: 天赋 10 | G356: =VLOOKUP(RC[4],Sheet1!R8C1:R38C3,2,FALSE)&"+"&IF(VLOOKUP(RC[4],Sheet1!R8C1:R38C3,3,FALSE)="固定值",RC[5],RC[5]/100&"%") -> 法防+10% | K356: 24 | L356: =VLOOKUP(INT(MOD(RC[-11],1000)/100),R7C9:R9C10,2,FALSE)*RC[-10]*100 -> 1000
A357: 2303 | B357: 1 | C357: 20 | D357: =IF(RC2=1,RC[7],R[-1]C&"|"&RC[7]) -> 3 | E357: =IF(RC2=1,RC[7],R[-1]C&"|"&RC[7]) -> 100 | F357: 天赋 1 | G357: =VLOOKUP(RC[4],Sheet1!R8C1:R38C3,2,FALSE)&"+"&IF(VLOOKUP(RC[4],Sheet1!R8C1:R38C3,3,FALSE)="固定值",RC[5],RC[5]/100&"%") -> 法防+100 | K357: 3 | L357: =VLOOKUP(INT(MOD(RC[-11],1000)/100),R7C9:R9C10,2,FALSE)*RC[-10]*100 -> 100
A358: 2303 | B358: 2 | C358: 40 | D358: =IF(RC2=1,RC[7],R[-1]C&"|"&RC[7]) -> 3|6 | E358: =IF(RC2=1,RC[7],R[-1]C&"|"&RC[7]) -> 100|200 | F358: 天赋 2 | G358: =VLOOKUP(RC[4],Sheet1!R8C1:R38C3,2,FALSE)&"+"&IF(VLOOKUP(RC[4],Sheet1!R8C1:R38C3,3,FALSE)="固定值",RC[5],RC[5]/100&"%") -> 减伤+200 | K358: 6 | L358: =VLOOKUP(INT(MOD(RC[-11],1000)/100),R7C9:R9C10,2,FALSE)*RC[-10]*100 -> 200
A359: 2303 | B359: 3 | C359: 60 | D359: =IF(RC2=1,RC[7],R[-1]C&"|"&RC[7]) -> 3|6|3 | E359: =IF(RC2=1,RC[7],R[-1]C&"|"&RC[7]) -> 100|200|300 | F359: 天赋 3 | G359: =VLOOKUP(RC[4],Sheet1!R8C1:R38C3,2,FALSE)&"+"&IF(VLOOKUP(RC[4],Sheet1!R8C1:R38C3,3,FALSE)="固定值",RC[5],RC[5]/100&"%") -> 法防+300 | K359: 3 | L359: =VLOOKUP(INT(MOD(RC[-11],1000)/100),R7C9:R9C10,2,FALSE)*RC[-10]*100 -> 300
A360: 2303 | B360: 4 | C360: 80 | D360: =IF(RC2=1,RC[7],R[-1]C&"|"&RC[7]) -> 3|6|3|5 | E360: =IF(RC2=1,RC[7],R[-1]C&"|"&RC[7]) -> 100|200|300|400 | F360: 天赋 4 | G360: =VLOOKUP(RC[4],Sheet1!R8C1:R38C3,2,FALSE)&"+"&IF(VLOOKUP(RC[4],Sheet1!R8C1:R38C3,3,FALSE)="固定值",RC[5],RC[5]/100&"%") -> 免伤+4% | K360: 5 | L360: =VLOOKUP(INT(MOD(RC[-11],1000)/100),R7C9:R9C10,2,FALSE)*RC[-10]*100 -> 400
A361: 2303 | B361: 5 | C361: 100 | D361: =IF(RC2=1,RC[7],R[-1]C&"|"&RC[7]) -> 3|6|3|5|3 | E361: =IF(RC2=1,RC[7],R[-1]C&"|"&RC[7]) -> 100|200|300|400|500 | F361: 天赋 5 | G361: =VLOOKUP(RC[4],Sheet1!R8C1:R38C3,2,FALSE)&"+"&IF(VLOOKUP(RC[4],Sheet1!R8C1:R38C3,3,FALSE)="固定值",RC[5],RC[5]/100&"%") -> 法防+500 | K361: 3 | L361: =VLOOKUP(INT(MOD(RC[-11],1000)/100),R7C9:R9C10,2,FALSE)*RC[-10]*100 -> 500
A362: 2303 | B362: 6 | C362: 120 | D362: =IF(RC2=1,RC[7],R[-1]C&"|"&RC[7]) -> 3|6|3|5|3|24 | E362: =IF(RC2=1,RC[7],R[-1]C&"|"&RC[7]) -> 100|200|300|400|500|600 | F362: 天赋 6 | G362: =VLOOKUP(RC[4],Sheet1!R8C1:R38C3,2,FALSE)&"+"&IF(VLOOKUP(RC[4],Sheet1!R8C1:R38C3,3,FALSE)="固定值",RC[5],RC[5]/100&"%") -> 法防+6% | K362: 24 | L362: =VLOOKUP(INT(MOD(RC[-11],1000)/100),R7C9:R9C10,2,FALSE)*RC[-10]*100 -> 600
A363: 2303 | B363: 7 | C363: 140 | D363: =IF(RC2=1,RC[7],R[-1]C&"|"&RC[7]) -> 3|6|3|5|3|24|3 | E363: =IF(RC2=1,RC[7],R[-1]C&"|"&RC[7]) -> 100|200|300|400|500|600|700 | F363: 天赋 7 | G363: =VLOOKUP(RC[4],Sheet1!R8C1:R38C3,2,FALSE)&"+"&IF(VLOOKUP(RC[4],Sheet1!R8C1:R38C3,3,FALSE)="固定值",RC[5],RC[5]/100&"%") -> 法防+700 | K363: 3 | L363: =VLOOKUP(INT(MOD(RC[-11],1000)/100),R7C9:R9C10,2,FALSE)*RC[-10]*100 -> 700
A364: 2303 | B364: 8 | C364: 160 | D364: =IF(RC2=1,RC[7],R[-1]C&"|"&RC[7]) -> 3|6|3|5|3|24|3|12 | E364: =IF(RC2=1,RC[7],R[-1]C&"|"&RC[7]) -> 100|200|300|400|500|600|700|800 | F364: 天赋 8 | G364: =VLOOKUP(RC[4],Sheet1!R8C1:R38C3,2,FALSE)&"+"&IF(VLOOKUP(RC[4],Sheet1!R8C1:R38C3,3,FALSE)="固定值",RC[5],RC[5]/100&"%") -> 闪避+8% | K364: 12 | L364: =VLOOKUP(INT(MOD(RC[-11],1000)/100),R7C9:R9C10,2,FALSE)*RC[-10]*100 -> 800
A365: 2303 | B365: 9 | C365: 180 | D365: =IF(RC2=1,RC[7],R[-1]C&"|"&RC[7]) -> 3|6|3|5|3|24|3|12|3 | E365: =IF(RC2=1,RC[7],R[-1]C&"|"&RC[7]) -> 100|200|300|400|500|600|700|800|900 | F365: 天赋 9 | G365: =VLOOKUP(RC[4],Sheet1!R8C1:R38C3,2,FALSE)&"+"&IF(VLOOKUP(RC[4],Sheet1!R8C1:R38C3,3,FALSE)="固定值",RC[5],RC[5]/100&"%") -> 法防+900 | K365: 3 | L365: =VLOOKUP(INT(MOD(RC[-11],1000)/100),R7C9:R9C10,2,FALSE)*RC[-10]*100 -> 900
A366: 2303 | B366: 10 | C366: 200 | D366: =IF(RC2=1,RC[7],R[-1]C&"|"&RC[7]) -> 3|6|3|5|3|24|3|12|3|24 | E366: =IF(RC2=1,RC[7],R[-1]C&"|"&RC[7]) -> 100|200|300|400|500|600|700|800|900|1000 | F366: 天赋 10 | G366: =VLOOKUP(RC[4],Sheet1!R8C1:R38C3,2,FALSE)&"+"&IF(VLOOKUP(RC[4],Sheet1!R8C1:R38C3,3,FALSE)="固定值",RC[5],RC[5]/100&"%") -> 法防+10% | K366: 24 | L366: =VLOOKUP(INT(MOD(RC[-11],1000)/100),R7C9:R9C10,2,FALSE)*RC[-10]*100 -> 1000
A367: 2304 | B367: 1 | C367: 20 | D367: =IF(RC2=1,RC[7],R[-1]C&"|"&RC[7]) -> 3 | E367: =IF(RC2=1,RC[7],R[-1]C&"|"&RC[7]) -> 100 | F367: 天赋 1 | G367: =VLOOKUP(RC[4],Sheet1!R8C1:R38C3,2,FALSE)&"+"&IF(VLOOKUP(RC[4],Sheet1!R8C1:R38C3,3,FALSE)="固定值",RC[5],RC[5]/100&"%") -> 法防+100 | K367: 3 | L367: =VLOOKUP(INT(MOD(RC[-11],1000)/100),R7C9:R9C10,2,FALSE)*RC[-10]*100 -> 100
A368: 2304 | B368: 2 | C368: 40 | D368: =IF(RC2=1,RC[7],R[-1]C&"|"&RC[7]) -> 3|6 | E368: =IF(RC2=1,RC[7],R[-1]C&"|"&RC[7]) -> 100|200 | F368: 天赋 2 | G368: =VLOOKUP(RC[4],Sheet1!R8C1:R38C3,2,FALSE)&"+"&IF(VLOOKUP(RC[4],Sheet1!R8C1:R38C3,3,FALSE)="固定值",RC[5],RC[5]/100&"%") -> 减伤+200 | K368: 6 | L368: =VLOOKUP(INT(MOD(RC[-11],1000)/100),R7C9:R9C10,2,FALSE)*RC[-10]*100 -> 200
A369: 2304 | B369: 3 | C369: 60 | D369: =IF(RC2=1,RC[7],R[-1]C&"|"&RC[7]) -> 3|6|3 | E369: =IF(RC2=1,RC[7],R[-1]C&"|"&RC[7]) -> 100|200|300 | F369: 天赋 3 | G369: =VLOOKUP(RC[4],Sheet1!R8C1:R38C3,2,FALSE)&"+"&IF(VLOOKUP(RC[4],Sheet1!R8C1:R38C3,3,FALSE)="固定值",RC[5],RC[5]/100&"%") -> 法防+300 | K369: 3 | L369: =VLOOKUP(INT(MOD(RC[-11],1000)/100),R7C9:R9C10,2,FALSE)*RC[-10]*100 -> 300
A370: 2304 | B370: 4 | C370: 80 | D370: =IF(RC2=1,RC[7],R[-1]C&"|"&RC[7]) -> 3|6|3|5 | E370: =IF(RC2=1,RC[7],R[-1]C&"|"&RC[7]) -> 100|200|300|400 | F370: 天赋 4 | G370: =VLOOKUP(RC[4],Sheet1!R8C1:R38C3,2,FALSE)&"+"&IF(VLOOKUP(RC[4],Sheet1!R8C1:R38C3,3,FALSE)="固定值",RC[5],RC[5]/100&"%") -> 免伤+4% | K370: 5 | L370: =VLOOKUP(INT(MOD(RC[-11],1000)/100),R7C9:R9C10,2,FALSE)*RC[-10]*100 -> 400
A371: 2304 | B371: 5 | C371: 100 | D371: =IF(RC2=1,RC[7],R[-1]C&"|"&RC[7]) -> 3|6|3|5|3 | E371: =IF(RC2=1,RC[7],R[-1]C&"|"&RC[7]) -> 100|200|300|400|500 | F371: 天赋 5 | G371: =VLOOKUP(RC[4],Sheet1!R8C1:R38C3,2,FALSE)&"+"&IF(VLOOKUP(RC[4],Sheet1!R8C1:R38C3,3,FALSE)="固定值",RC[5],RC[5]/100&"%") -> 法防+500 | K371: 3 | L371: =VLOOKUP(INT(MOD(RC[-11],1000)/100),R7C9:R9C10,2,FALSE)*RC[-10]*100 -> 500
A372: 2304 | B372: 6 | C372: 120 | D372: =IF(RC2=1,RC[7],R[-1]C&"|"&RC[7]) -> 3|6|3|5|3|24 | E372: =IF(RC2=1,RC[7],R[-1]C&"|"&RC[7]) -> 100|200|300|400|500|600 | F372: 天赋 6 | G372: =VLOOKUP(RC[4],Sheet1!R8C1:R38C3,2,FALSE)&"+"&IF(VLOOKUP(RC[4],Sheet1!R8C1:R38C3,3,FALSE)="固定值",RC[5],RC[5]/100&"%") -> 法防+6% | K372: 24 | L372: =VLOOKUP(INT(MOD(RC[-11],1000)/100),R7C9:R9C10,2,FALSE)*RC[-10]*100 -> 600
A373: 2304 | B373: 7 | C373: 140 | D373: =IF(RC2=1,RC[7],R[-1]C&"|"&RC[7]) -> 3|6|3|5|3|24|3 | E373: =IF(RC2=1,RC[7],R[-1]C&"|"&RC[7]) -> 100|200|300|400|500|600|700 | F373: 天赋 7 | G373: =VLOOKUP(RC[4],Sheet1!R8C1:R38C3,2,FALSE)&"+"&IF(VLOOKUP(RC[4],Sheet1!R8C1:R38C3,3,FALSE)="固定值",RC[5],RC[5]/100&"%") -> 法防+700 | K373: 3 | L373: =VLOOKUP(INT(MOD(RC[-11],1000)/100),R7C9:R9C10,2,FALSE)*RC[-10]*100 -> 700
A374: 2304 | B374: 8 | C374: 160 | D374: =IF(RC2=1,RC[7],R[-1]C&"|"&RC[7]) -> 3|6|3|5|3|24|3|12 | E374: =IF(RC2=1,RC[7],R[-1]C&"|"&RC[7]) -> 100|200|300|400|500|600|700|800 | F374: 天赋 8 | G374: =VLOOKUP(RC[4],Sheet1!R8C1:R38C3,2,FALSE)&"+"&IF(VLOOKUP(RC[4],Sheet1!R8C1:R38C3,3,FALSE)="固定值",RC[5],RC[5]/100&"%") -> 闪避+8% | K374: 12 | L374: =VLOOKUP(INT(MOD(RC[-11],1000)/100),R7C9:R9C10,2,FALSE)*RC[-10]*100 -> 800
A375: 2304 | B375: 9 | C375: 180 | D375: =IF(RC2=1,RC[7],R[-1]C&"|"&RC[7]) -> 3|6|3|5|3|24|3|12|3 | E375: =IF(RC2=1,RC[7],R[-1]C&"|"&RC[7]) -> 100|200|300|400|500|600|700|800|900 | F375: 天赋 9 | G375: =VLOOKUP(RC[4],Sheet1!R8C1:R38C3,2,FALSE)&"+"&IF(VLOOKUP(RC[4],Sheet1!R8C1:R38C3,3,FALSE)="固定值",RC[5],RC[5]/100&"%") -> 法防+900 | K375: 3 | L375: =VLOOKUP(INT(MOD(RC[-11],1000)/100),R7C9:R9C10,2,FALSE)*RC[-10]*100 -> 900
A376: 2304 | B376: 10 | C376: 200 | D376: =IF(RC2=1,RC[7],R[-1]C&"|"&RC[7]) -> 3|6|3|5|3|24|3|12|3|24 | E376: =IF(RC2=1,RC[7],R[-1]C&"|"&RC[7]) -> 100|200|300|400|500|600|700|800|900|1000 | F376: 天赋 10 | G376: =VLOOKUP(RC[4],Sheet1!R8C1:R38C3,2,FALSE)&"+"&IF(VLOOKUP(RC[4],Sheet1!R8C1:R38C3,3,FALSE)="固定值",RC[5],RC[5]/100&"%") -> 法防+10% | K376: 24 | L376: =VLOOKUP(INT(MOD(RC[-11],1000)/100),R7C9:R9C10,2,FALSE)*RC[-10]*100 -> 1000
A377: 2305 | B377: 1 | C377: 20 | D377: =IF(RC2=1,RC[7],R[-1]C&"|"&RC[7]) -> 3 | E377: =IF(RC2=1,RC[7],R[-1]C&"|"&RC[7]) -> 100 | F377: 天赋 1 | G377: =VLOOKUP(RC[4],Sheet1!R8C1:R38C3,2,FALSE)&"+"&IF(VLOOKUP(RC[4],Sheet1!R8C1:R38C3,3,FALSE)="固定值",RC[5],RC[5]/100&"%") -> 法防+100 | K377: 3 | L377: =VLOOKUP(INT(MOD(RC[-11],1000)/100),R7C9:R9C10,2,FALSE)*RC[-10]*100 -> 100
A378: 2305 | B378: 2 | C378: 40 | D378: =IF(RC2=1,RC[7],R[-1]C&"|"&RC[7]) -> 3|6 | E378: =IF(RC2=1,RC[7],R[-1]C&"|"&RC[7]) -> 100|200 | F378: 天赋 2 | G378: =VLOOKUP(RC[4],Sheet1!R8C1:R38C3,2,FALSE)&"+"&IF(VLOOKUP(RC[4],Sheet1!R8C1:R38C3,3,FALSE)="固定值",RC[5],RC[5]/100&"%") -> 减伤+200 | K378: 6 | L378: =VLOOKUP(INT(MOD(RC[-11],1000)/100),R7C9:R9C10,2,FALSE)*RC[-10]*100 -> 200
A379: 2305 | B379: 3 | C379: 60 | D379: =IF(RC2=1,RC[7],R[-1]C&"|"&RC[7]) -> 3|6|3 | E379: =IF(RC2=1,RC[7],R[-1]C&"|"&RC[7]) -> 100|200|300 | F379: 天赋 3 | G379: =VLOOKUP(RC[4],Sheet1!R8C1:R38C3,2,FALSE)&"+"&IF(VLOOKUP(RC[4],Sheet1!R8C1:R38C3,3,FALSE)="固定值",RC[5],RC[5]/100&"%") -> 法防+300 | K379: 3 | L379: =VLOOKUP(INT(MOD(RC[-11],1000)/100),R7C9:R9C10,2,FALSE)*RC[-10]*100 -> 300
A380: 2305 | B380: 4 | C380: 80 | D380: =IF(RC2=1,RC[7],R[-1]C&"|"&RC[7]) -> 3|6|3|5 | E380: =IF(RC2=1,RC[7],R[-1]C&"|"&RC[7]) -> 100|200|300|400 | F380: 天赋 4 | G380: =VLOOKUP(RC[4],Sheet1!R8C1:R38C3,2,FALSE)&"+"&IF(VLOOKUP(RC[4],Sheet1!R8C1:R38C3,3,FALSE)="固定值",RC[5],RC[5]/100&"%") -> 免伤+4% | K380: 5 | L380: =VLOOKUP(INT(MOD(RC[-11],1000)/100),R7C9:R9C10,2,FALSE)*RC[-10]*100 -> 400
A381: 2305 | B381: 5 | C381: 100 | D381: =IF(RC2=1,RC[7],R[-1]C&"|"&RC[7]) -> 3|6|3|5|3 | E381: =IF(RC2=1,RC[7],R[-1]C&"|"&RC[7]) -> 100|200|300|400|500 | F381: 天赋 5 | G381: =VLOOKUP(RC[4],Sheet1!R8C1:R38C3,2,FALSE)&"+"&IF(VLOOKUP(RC[4],Sheet1!R8C1:R38C3,3,FALSE)="固定值",RC[5],RC[5]/100&"%") -> 法防+500 | K381: 3 | L381: =VLOOKUP(INT(MOD(RC[-11],1000)/100),R7C9:R9C10,2,FALSE)*RC[-10]*100 -> 500
A382: 2305 | B382: 6 | C382: 120 | D382: =IF(RC2=1,RC[7],R[-1]C&"|"&RC[7]) -> 3|6|3|5|3|24 | E382: =IF(RC2=1,RC[7],R[-1]C&"|"&RC[7]) -> 100|200|300|400|500|600 | F382: 天赋 6 | G382: =VLOOKUP(RC[4],Sheet1!R8C1:R38C3,2,FALSE)&"+"&IF(VLOOKUP(RC[4],Sheet1!R8C1:R38C3,3,FALSE)="固定值",RC[5],RC[5]/100&"%") -> 法防+6% | K382: 24 | L382: =VLOOKUP(INT(MOD(RC[-11],1000)/100),R7C9:R9C10,2,FALSE)*RC[-10]*100 -> 600
A383: 2305 | B383: 7 | C383: 140 | D383: =IF(RC2=1,RC[7],R[-1]C&"|"&RC[7]) -> 3|6|3|5|3|24|3 | E383: =IF(RC2=1,RC[7],R[-1]C&"|"&RC[7]) -> 100|200|300|400|500|600|700 | F383: 天赋 7 | G383: =VLOOKUP(RC[4],Sheet1!R8C1:R38C3,2,FALSE)&"+"&IF(VLOOKUP(RC[4],Sheet1!R8C1:R38C3,3,FALSE)="固定值",RC[5],RC[5]/100&"%") -> 法防+700 | K383: 3 | L383: =VLOOKUP(INT(MOD(RC[-11],1000)/100),R7C9:R9C10,2,FALSE)*RC[-10]*100 -> 700
A384: 2305 | B384: 8 | C384: 160 | D384: =IF(RC2=1,RC[7],R[-1]C&"|"&RC[7]) -> 3|6|3|5|3|24|3|12 | E384: =IF(RC2=1,RC[7],R[-1]C&"|"&RC[7]) -> 100|200|300|400|500|600|700|800 | F384: 天赋 8 | G384: =VLOOKUP(RC[4],Sheet1!R8C1:R38C3,2,FALSE)&"+"&IF(VLOOKUP(RC[4],Sheet1!R8C1:R38C3,3,FALSE)="固定值",RC[5],RC[5]/100&"%") -> 闪避+8% | K384: 12 | L384: =VLOOKUP(INT(MOD(RC[-11],1000)/100),R7C9:R9C10,2,FALSE)*RC[-10]*100 -> 800
A385: 2305 | B385: 9 | C385: 180 | D385: =IF(RC2=1,RC[7],R[-1]C&"|"&RC[7]) -> 3|6|3|5|3|24|3|12|3 | E385: =IF(RC2=1,RC[7],R[-1]C&"|"&RC[7]) -> 100|200|300|400|500|600|700|800|900 | F385: 天赋 9 | G385: =VLOOKUP(RC[4],Sheet1!R8C1:R38C3,2,FALSE)&"+"&IF(VLOOKUP(RC[4],Sheet1!R8C1:R38C3,3,FALSE)="固定值",RC[5],RC[5]/100&"%") -> 法防+900 | K385: 3 | L385: =VLOOKUP(INT(MOD(RC[-11],1000)/100),R7C9:R9C10,2,FALSE)*RC[-10]*100 -> 900
A386: 2305 | B386: 10 | C386: 200 | D386: =IF(RC2=1,RC[7],R[-1]C&"|"&RC[7]) -> 3|6|3|5|3|24|3|12|3|24 | E386: =IF(RC2=1,RC[7],R[-1]C&"|"&RC[7]) -> 100|200|300|400|500|600|700|800|900|1000 | F386: 天赋 10 | G386: =VLOOKUP(RC[4],Sheet1!R8C1:R38C3,2,FALSE)&"+"&IF(VLOOKUP(RC[4],Sheet1!R8C1:R38C3,3,FALSE)="固定值",RC[5],RC[5]/100&"%") -> 法防+10% | K386: 24 | L386: =VLOOKUP(INT(MOD(RC[-11],1000)/100),R7C9:R9C10,2,FALSE)*RC[-10]*100 -> 1000
A387: 2401 | B387: 1 | C387: 20 | D387: =IF(RC2=1,RC[7],R[-11]C&"|"&RC[7]) -> 3 | E387: =IF(RC2=1,RC[7],R[-11]C&"|"&RC[7]) -> 150 | F387: 天赋 1 | G387: =VLOOKUP(RC[4],Sheet1!R8C1:R38C3,2,FALSE)&"+"&IF(VLOOKUP(RC[4],Sheet1!R8C1:R38C3,3,FALSE)="固定值",RC[5],RC[5]/100&"%") -> 法防+150 | K387: 3 | L387: =VLOOKUP(INT(MOD(RC[-11],1000)/100),R7C9:R9C10,2,FALSE)*RC[-10]*100 -> 150
A388: 2401 | B388: 2 | C388: 40 | D388: =IF(RC2=1,RC[7],R[-1]C&"|"&RC[7]) -> 3|6 | E388: =IF(RC2=1,RC[7],R[-1]C&"|"&RC[7]) -> 150|300 | F388: 天赋 2 | G388: =VLOOKUP(RC[4],Sheet1!R8C1:R38C3,2,FALSE)&"+"&IF(VLOOKUP(RC[4],Sheet1!R8C1:R38C3,3,FALSE)="固定值",RC[5],RC[5]/100&"%") -> 减伤+300 | K388: 6 | L388: =VLOOKUP(INT(MOD(RC[-11],1000)/100),R7C9:R9C10,2,FALSE)*RC[-10]*100 -> 300
A389: 2401 | B389: 3 | C389: 60 | D389: =IF(RC2=1,RC[7],R[-1]C&"|"&RC[7]) -> 3|6|3 | E389: =IF(RC2=1,RC[7],R[-1]C&"|"&RC[7]) -> 150|300|450 | F389: 天赋 3 | G389: =VLOOKUP(RC[4],Sheet1!R8C1:R38C3,2,FALSE)&"+"&IF(VLOOKUP(RC[4],Sheet1!R8C1:R38C3,3,FALSE)="固定值",RC[5],RC[5]/100&"%") -> 法防+450 | K389: 3 | L389: =VLOOKUP(INT(MOD(RC[-11],1000)/100),R7C9:R9C10,2,FALSE)*RC[-10]*100 -> 450
A390: 2401 | B390: 4 | C390: 80 | D390: =IF(RC2=1,RC[7],R[-1]C&"|"&RC[7]) -> 3|6|3|5 | E390: =IF(RC2=1,RC[7],R[-1]C&"|"&RC[7]) -> 150|300|450|600 | F390: 天赋 4 | G390: =VLOOKUP(RC[4],Sheet1!R8C1:R38C3,2,FALSE)&"+"&IF(VLOOKUP(RC[4],Sheet1!R8C1:R38C3,3,FALSE)="固定值",RC[5],RC[5]/100&"%") -> 免伤+6% | K390: 5 | L390: =VLOOKUP(INT(MOD(RC[-11],1000)/100),R7C9:R9C10,2,FALSE)*RC[-10]*100 -> 600
A391: 2401 | B391: 5 | C391: 100 | D391: =IF(RC2=1,RC[7],R[-1]C&"|"&RC[7]) -> 3|6|3|5|3 | E391: =IF(RC2=1,RC[7],R[-1]C&"|"&RC[7]) -> 150|300|450|600|750 | F391: 天赋 5 | G391: =VLOOKUP(RC[4],Sheet1!R8C1:R38C3,2,FALSE)&"+"&IF(VLOOKUP(RC[4],Sheet1!R8C1:R38C3,3,FALSE)="固定值",RC[5],RC[5]/100&"%") -> 法防+750 | K391: 3 | L391: =VLOOKUP(INT(MOD(RC[-11],1000)/100),R7C9:R9C10,2,FALSE)*RC[-10]*100 -> 750
A392: 2401 | B392: 6 | C392: 120 | D392: =IF(RC2=1,RC[7],R[-1]C&"|"&RC[7]) -> 3|6|3|5|3|24 | E392: =IF(RC2=1,RC[7],R[-1]C&"|"&RC[7]) -> 150|300|450|600|750|900 | F392: 天赋 6 | G392: =VLOOKUP(RC[4],Sheet1!R8C1:R38C3,2,FALSE)&"+"&IF(VLOOKUP(RC[4],Sheet1!R8C1:R38C3,3,FALSE)="固定值",RC[5],RC[5]/100&"%") -> 法防+9% | K392: 24 | L392: =VLOOKUP(INT(MOD(RC[-11],1000)/100),R7C9:R9C10,2,FALSE)*RC[-10]*100 -> 900
A393: 2401 | B393: 7 | C393: 140 | D393: =IF(RC2=1,RC[7],R[-1]C&"|"&RC[7]) -> 3|6|3|5|3|24|3 | E393: =IF(RC2=1,RC[7],R[-1]C&"|"&RC[7]) -> 150|300|450|600|750|900|1050 | F393: 天赋 7 | G393: =VLOOKUP(RC[4],Sheet1!R8C1:R38C3,2,FALSE)&"+"&IF(VLOOKUP(RC[4],Sheet1!R8C1:R38C3,3,FALSE)="固定值",RC[5],RC[5]/100&"%") -> 法防+1050 | K393: 3 | L393: =VLOOKUP(INT(MOD(RC[-11],1000)/100),R7C9:R9C10,2,FALSE)*RC[-10]*100 -> 1050
A394: 2401 | B394: 8 | C394: 160 | D394: =IF(RC2=1,RC[7],R[-1]C&"|"&RC[7]) -> 3|6|3|5|3|24|3|12 | E394: =IF(RC2=1,RC[7],R[-1]C&"|"&RC[7]) -> 150|300|450|600|750|900|1050|1200 | F394: 天赋 8 | G394: =VLOOKUP(RC[4],Sheet1!R8C1:R38C3,2,FALSE)&"+"&IF(VLOOKUP(RC[4],Sheet1!R8C1:R38C3,3,FALSE)="固定值",RC[5],RC[5]/100&"%") -> 闪避+12% | K394: 12 | L394: =VLOOKUP(INT(MOD(RC[-11],1000)/100),R7C9:R9C10,2,FALSE)*RC[-10]*100 -> 1200
A395: 2401 | B395: 9 | C395: 180 | D395: =IF(RC2=1,RC[7],R[-1]C&"|"&RC[7]) -> 3|6|3|5|3|24|3|12|3 | E395: =IF(RC2=1,RC[7],R[-1]C&"|"&RC[7]) -> 150|300|450|600|750|900|1050|1200|1350 | F395: 天赋 9 | G395: =VLOOKUP(RC[4],Sheet1!R8C1:R38C3,2,FALSE)&"+"&IF(VLOOKUP(RC[4],Sheet1!R8C1:R38C3,3,FALSE)="固定值",RC[5],RC[5]/100&"%") -> 法防+1350 | K395: 3 | L395: =VLOOKUP(INT(MOD(RC[-11],1000)/100),R7C9:R9C10,2,FALSE)*RC[-10]*100 -> 1350
A396: 2401 | B396: 10 | C396: 200 | D396: =IF(RC2=1,RC[7],R[-1]C&"|"&RC[7]) -> 3|6|3|5|3|24|3|12|3|24 | E396: =IF(RC2=1,RC[7],R[-1]C&"|"&RC[7]) -> 150|300|450|600|750|900|1050|1200|1350|1500 | F396: 天赋 10 | G396: =VLOOKUP(RC[4],Sheet1!R8C1:R38C3,2,FALSE)&"+"&IF(VLOOKUP(RC[4],Sheet1!R8C1:R38C3,3,FALSE)="固定值",RC[5],RC[5]/100&"%") -> 法防+15% | K396: 24 | L396: =VLOOKUP(INT(MOD(RC[-11],1000)/100),R7C9:R9C10,2,FALSE)*RC[-10]*100 -> 1500
A397: 2402 | B397: 1 | C397: 20 | D397: =IF(RC2=1,RC[7],R[-1]C&"|"&RC[7]) -> 3 | E397: =IF(RC2=1,RC[7],R[-1]C&"|"&RC[7]) -> 150 | F397: 天赋 1 | G397: =VLOOKUP(RC[4],Sheet1!R8C1:R38C3,2,FALSE)&"+"&IF(VLOOKUP(RC[4],Sheet1!R8C1:R38C3,3,FALSE)="固定值",RC[5],RC[5]/100&"%") -> 法防+150 | K397: 3 | L397: =VLOOKUP(INT(MOD(RC[-11],1000)/100),R7C9:R9C10,2,FALSE)*RC[-10]*100 -> 150
A398: 2402 | B398: 2 | C398: 40 | D398: =IF(RC2=1,RC[7],R[-1]C&"|"&RC[7]) -> 3|6 | E398: =IF(RC2=1,RC[7],R[-1]C&"|"&RC[7]) -> 150|300 | F398: 天赋 2 | G398: =VLOOKUP(RC[4],Sheet1!R8C1:R38C3,2,FALSE)&"+"&IF(VLOOKUP(RC[4],Sheet1!R8C1:R38C3,3,FALSE)="固定值",RC[5],RC[5]/100&"%") -> 减伤+300 | K398: 6 | L398: =VLOOKUP(INT(MOD(RC[-11],1000)/100),R7C9:R9C10,2,FALSE)*RC[-10]*100 -> 300
A399: 2402 | B399: 3 | C399: 60 | D399: =IF(RC2=1,RC[7],R[-1]C&"|"&RC[7]) -> 3|6|3 | E399: =IF(RC2=1,RC[7],R[-1]C&"|"&RC[7]) -> 150|300|450 | F399: 天赋 3 | G399: =VLOOKUP(RC[4],Sheet1!R8C1:R38C3,2,FALSE)&"+"&IF(VLOOKUP(RC[4],Sheet1!R8C1:R38C3,3,FALSE)="固定值",RC[5],RC[5]/100&"%") -> 法防+450 | K399: 3 | L399: =VLOOKUP(INT(MOD(RC[-11],1000)/100),R7C9:R9C10,2,FALSE)*RC[-10]*100 -> 450
A400: 2402 | B400: 4 | C400: 80 | D400: =IF(RC2=1,RC[7],R[-1]C&"|"&RC[7]) -> 3|6|3|5 | E400: =IF(RC2=1,RC[7],R[-1]C&"|"&RC[7]) -> 150|300|450|600 | F400: 天赋 4 | G400: =VLOOKUP(RC[4],Sheet1!R8C1:R38C3,2,FALSE)&"+"&IF(VLOOKUP(RC[4],Sheet1!R8C1:R38C3,3,FALSE)="固定值",RC[5],RC[5]/100&"%") -> 免伤+6% | K400: 5 | L400: =VLOOKUP(INT(MOD(RC[-11],1000)/100),R7C9:R9C10,2,FALSE)*RC[-10]*100 -> 600
A401: 2402 | B401: 5 | C401: 100 | D401: =IF(RC2=1,RC[7],R[-1]C&"|"&RC[7]) -> 3|6|3|5|3 | E401: =IF(RC2=1,RC[7],R[-1]C&"|"&RC[7]) -> 150|300|450|600|750 | F401: 天赋 5 | G401: =VLOOKUP(RC[4],Sheet1!R8C1:R38C3,2,FALSE)&"+"&IF(VLOOKUP(RC[4],Sheet1!R8C1:R38C3,3,FALSE)="固定值",RC[5],RC[5]/100&"%") -> 法防+750 | K401: 3 | L401: =VLOOKUP(INT(MOD(RC[-11],1000)/100),R7C9:R9C10,2,FALSE)*RC[-10]*100 -> 750
A402: 2402 | B402: 6 | C402: 120 | D402: =IF(RC2=1,RC[7],R[-1]C&"|"&RC[7]) -> 3|6|3|5|3|24 | E402: =IF(RC2=1,RC[7],R[-1]C&"|"&RC[7]) -> 150|300|450|600|750|900 | F402: 天赋 6 | G402: =VLOOKUP(RC[4],Sheet1!R8C1:R38C3,2,FALSE)&"+"&IF(VLOOKUP(RC[4],Sheet1!R8C1:R38C3,3,FALSE)="固定值",RC[5],RC[5]/100&"%") -> 法防+9% | K402: 24 | L402: =VLOOKUP(INT(MOD(RC[-11],1000)/100),R7C9:R9C10,2,FALSE)*RC[-10]*100 -> 900
A403: 2402 | B403: 7 | C403: 140 | D403: =IF(RC2=1,RC[7],R[-1]C&"|"&RC[7]) -> 3|6|3|5|3|24|3 | E403: =IF(RC2=1,RC[7],R[-1]C&"|"&RC[7]) -> 150|300|450|600|750|900|1050 | F403: 天赋 7 | G403: =VLOOKUP(RC[4],Sheet1!R8C1:R38C3,2,FALSE)&"+"&IF(VLOOKUP(RC[4],Sheet1!R8C1:R38C3,3,FALSE)="固定值",RC[5],RC[5]/100&"%") -> 法防+1050 | K403: 3 | L403: =VLOOKUP(INT(MOD(RC[-11],1000)/100),R7C9:R9C10,2,FALSE)*RC[-10]*100 -> 1050
A404: 2402 | B404: 8 | C404: 160 | D404: =IF(RC2=1,RC[7],R[-1]C&"|"&RC[7]) -> 3|6|3|5|3|24|3|12 | E404: =IF(RC2=1,RC[7],R[-1]C&"|"&RC[7]) -> 150|300|450|600|750|900|1050|1200 | F404: 天赋 8 | G404: =VLOOKUP(RC[4],Sheet1!R8C1:R38C3,2,FALSE)&"+"&IF(VLOOKUP(RC[4],Sheet1!R8C1:R38C3,3,FALSE)="固定值",RC[5],RC[5]/100&"%") -> 闪避+12% | K404: 12 | L404: =VLOOKUP(INT(MOD(RC[-11],1000)/100),R7C9:R9C10,2,FALSE)*RC[-10]*100 -> 1200
A405: 2402 | B405: 9 | C405: 180 | D405: =IF(RC2=1,RC[7],R[-1]C&"|"&RC[7]) -> 3|6|3|5|3|24|3|12|3 | E405: =IF(RC2=1,RC[7],R[-1]C&"|"&RC[7]) -> 150|300|450|600|750|900|1050|1200|1350 | F405: 天赋 9 | G405: =VLOOKUP(RC[4],Sheet1!R8C1:R38C3,2,FALSE)&"+"&IF(VLOOKUP(RC[4],Sheet1!R8C1:R38C3,3,FALSE)="固定值",RC[5],RC[5]/100&"%") -> 法防+1350 | K405: 3 | L405: =VLOOKUP(INT(MOD(RC[-11],1000)/100),R7C9:R9C10,2,FALSE)*RC[-10]*100 -> 1350
A406: 2402 | B406: 10 | C406: 200 | D406: =IF(RC2=1,RC[7],R[-1]C&"|"&RC[7]) -> 3|6|3|5|3|24|3|12|3|24 | E406: =IF(RC2=1,RC[7],R[-1]C&"|"&RC[7]) -> 150|300|450|600|750|900|1050|1200|1350|1500 | F406: 天赋 10 | G406: =VLOOKUP(RC[4],Sheet1!R8C1:R38C3,2,FALSE)&"+"&IF(VLOOKUP(RC[4],Sheet1!R8C1:R38C3,3,FALSE)="固定值",RC[5],RC[5]/100&"%") -> 法防+15% | K406: 24 | L406: =VLOOKUP(INT(MOD(RC[-11],1000)/100),R7C9:R9C10,2,FALSE)*RC[-10]*100 -> 1500
A407: 2403 | B407: 1 | C407: 20 | D407: =IF(RC2=1,RC[7],R[-1]C&"|"&RC[7]) -> 3 | E407: =IF(RC2=1,RC[7],R[-1]C&"|"&RC[7]) -> 150 | F407: 天赋 1 | G407: =VLOOKUP(RC[4],Sheet1!R8C1:R38C3,2,FALSE)&"+"&IF(VLOOKUP(RC[4],Sheet1!R8C1:R38C3,3,FALSE)="固定值",RC[5],RC[5]/100&"%") -> 法防+150 | K407: 3 | L407: =VLOOKUP(INT(MOD(RC[-11],1000)/100),R7C9:R9C10,2,FALSE)*RC[-10]*100 -> 150
A408: 2403 | B408: 2 | C408: 40 | D408: =IF(RC2=1,RC[7],R[-1]C&"|"&RC[7]) -> 3|6 | E408: =IF(RC2=1,RC[7],R[-1]C&"|"&RC[7]) -> 150|300 | F408: 天赋 2 | G408: =VLOOKUP(RC[4],Sheet1!R8C1:R38C3,2,FALSE)&"+"&IF(VLOOKUP(RC[4],Sheet1!R8C1:R38C3,3,FALSE)="固定值",RC[5],RC[5]/100&"%") -> 减伤+300 | K408: 6 | L408: =VLOOKUP(INT(MOD(RC[-11],1000)/100),R7C9:R9C10,2,FALSE)*RC[-10]*100 -> 300
A409: 2403 | B409: 3 | C409: 60 | D409: =IF(RC2=1,RC[7],R[-1]C&"|"&RC[7]) -> 3|6|3 | E409: =IF(RC2=1,RC[7],R[-1]C&"|"&RC[7]) -> 150|300|450 | F409: 天赋 3 | G409: =VLOOKUP(RC[4],Sheet1!R8C1:R38C3,2,FALSE)&"+"&IF(VLOOKUP(RC[4],Sheet1!R8C1:R38C3,3,FALSE)="固定值",RC[5],RC[5]/100&"%") -> 法防+450 | K409: 3 | L409: =VLOOKUP(INT(MOD(RC[-11],1000)/100),R7C9:R9C10,2,FALSE)*RC[-10]*100 -> 450
A410: 2403 | B410: 4 | C410: 80 | D410: =IF(RC2=1,RC[7],R[-1]C&"|"&RC[7]) -> 3|6|3|5 | E410: =IF(RC2=1,RC[7],R[-1]C&"|"&RC[7]) -> 150|300|450|600 | F410: 天赋 4 | G410: =VLOOKUP(RC[4],Sheet1!R8C1:R38C3,2,FALSE)&"+"&IF(VLOOKUP(RC[4],Sheet1!R8C1:R38C3,3,FALSE)="固定值",RC[5],RC[5]/100&"%") -> 免伤+6% | K410: 5 | L410: =VLOOKUP(INT(MOD(RC[-11],1000)/100),R7C9:R9C10,2,FALSE)*RC[-10]*100 -> 600
A411: 2403 | B411: 5 | C411: 100 | D411: =IF(RC2=1,RC[7],R[-1]C&"|"&RC[7]) -> 3|6|3|5|3 | E411: =IF(RC2=1,RC[7],R[-1]C&"|"&RC[7]) -> 150|300|450|600|750 | F411: 天赋 5 | G411: =VLOOKUP(RC[4],Sheet1!R8C1:R38C3,2,FALSE)&"+"&IF(VLOOKUP(RC[4],Sheet1!R8C1:R38C3,3,FALSE)="固定值",RC[5],RC[5]/100&"%") -> 法防+750 | K411: 3 | L411: =VLOOKUP(INT(MOD(RC[-11],1000)/100),R7C9:R9C10,2,FALSE)*RC[-10]*100 -> 750
A412: 2403 | B412: 6 | C412: 120 | D412: =IF(RC2=1,RC[7],R[-1]C&"|"&RC[7]) -> 3|6|3|5|3|24 | E412: =IF(RC2=1,RC[7],R[-1]C&"|"&RC[7]) -> 150|300|450|600|750|900 | F412: 天赋 6 | G412: =VLOOKUP(RC[4],Sheet1!R8C1:R38C3,2,FALSE)&"+"&IF(VLOOKUP(RC[4],Sheet1!R8C1:R38C3,3,FALSE)="固定值",RC[5],RC[5]/100&"%") -> 法防+9% | K412: 24 | L412: =VLOOKUP(INT(MOD(RC[-11],1000)/100),R7C9:R9C10,2,FALSE)*RC[-10]*100 -> 900
A413: 2403 | B413: 7 | C413: 140 | D413: =IF(RC2=1,RC[7],R[-1]C&"|"&RC[7]) -> 3|6|3|5|3|24|3 | E413: =IF(RC2=1,RC[7],R[-1]C&"|"&RC[7]) -> 150|300|450|600|750|900|1050 | F413: 天赋 7 | G413: =VLOOKUP(RC[4],Sheet1!R8C1:R38C3,2,FALSE)&"+"&IF(VLOOKUP(RC[4],Sheet1!R8C1:R38C3,3,FALSE)="固定值",RC[5],RC[5]/100&"%") -> 法防+1050 | K413: 3 | L413: =VLOOKUP(INT(MOD(RC[-11],1000)/100),R7C9:R9C10,2,FALSE)*RC[-10]*100 -> 1050
A414: 2403 | B414: 8 | C414: 160 | D414: =IF(RC2=1,RC[7],R[-1]C&"|"&RC[7]) -> 3|6|3|5|3|24|3|12 | E414: =IF(RC2=1,RC[7],R[-1]C&"|"&RC[7]) -> 150|300|450|600|750|900|1050|1200 | F414: 天赋 8 | G414: =VLOOKUP(RC[4],Sheet1!R8C1:R38C3,2,FALSE)&"+"&IF(VLOOKUP(RC[4],Sheet1!R8C1:R38C3,3,FALSE)="固定值",RC[5],RC[5]/100&"%") -> 闪避+12% | K414: 12 | L414: =VLOOKUP(INT(MOD(RC[-11],1000)/100),R7C9:R9C10,2,FALSE)*RC[-10]*100 -> 1200
A415: 2403 | B415: 9 | C415: 180 | D415: =IF(RC2=1,RC[7],R[-1]C&"|"&RC[7]) -> 3|6|3|5|3|24|3|12|3 | E415: =IF(RC2=1,RC[7],R[-1]C&"|"&RC[7]) -> 150|300|450|600|750|900|1050|1200|1350 | F415: 天赋 9 | G415: =VLOOKUP(RC[4],Sheet1!R8C1:R38C3,2,FALSE)&"+"&IF(VLOOKUP(RC[4],Sheet1!R8C1:R38C3,3,FALSE)="固定值",RC[5],RC[5]/100&"%") -> 法防+1350 | K415: 3 | L415: =VLOOKUP(INT(MOD(RC[-11],1000)/100),R7C9:R9C10,2,FALSE)*RC[-10]*100 -> 1350
A416: 2403 | B416: 10 | C416: 200 | D416: =IF(RC2=1,RC[7],R[-1]C&"|"&RC[7]) -> 3|6|3|5|3|24|3|12|3|24 | E416: =IF(RC2=1,RC[7],R[-1]C&"|"&RC[7]) -> 150|300|450|600|750|900|1050|1200|1350|1500 | F416: 天赋 10 | G416: =VLOOKUP(RC[4],Sheet1!R8C1:R38C3,2,FALSE)&"+"&IF(VLOOKUP(RC[4],Sheet1!R8C1:R38C3,3,FALSE)="固定值",RC[5],RC[5]/100&"%") -> 法防+15% | K416: 24 | L416: =VLOOKUP(INT(MOD(RC[-11],1000)/100),R7C9:R9C10,2,FALSE)*RC[-10]*100 -> 1500
A417: 2404 | B417: 1 | C417: 20 | D417: =IF(RC2=1,RC[7],R[-1]C&"|"&RC[7]) -> 3 | E417: =IF(RC2=1,RC[7],R[-1]C&"|"&RC[7]) -> 150 | F417: 天赋 1 | G417: =VLOOKUP(RC[4],Sheet1!R8C1:R38C3,2,FALSE)&"+"&IF(VLOOKUP(RC[4],Sheet1!R8C1:R38C3,3,FALSE)="固定值",RC[5],RC[5]/100&"%") -> 法防+150 | K417: 3 | L417: =VLOOKUP(INT(MOD(RC[-11],1000)/100),R7C9:R9C10,2,FALSE)*RC[-10]*100 -> 150
A418: 2404 | B418: 2 | C418: 40 | D418: =IF(RC2=1,RC[7],R[-1]C&"|"&RC[7]) -> 3|6 | E418: =IF(RC2=1,RC[7],R[-1]C&"|"&RC[7]) -> 150|300 | F418: 天赋 2 | G418: =VLOOKUP(RC[4],Sheet1!R8C1:R38C3,2,FALSE)&"+"&IF(VLOOKUP(RC[4],Sheet1!R8C1:R38C3,3,FALSE)="固定值",RC[5],RC[5]/100&"%") -> 减伤+300 | K418: 6 | L418: =VLOOKUP(INT(MOD(RC[-11],1000)/100),R7C9:R9C10,2,FALSE)*RC[-10]*100 -> 300
A419: 2404 | B419: 3 | C419: 60 | D419: =IF(RC2=1,RC[7],R[-1]C&"|"&RC[7]) -> 3|6|3 | E419: =IF(RC2=1,RC[7],R[-1]C&"|"&RC[7]) -> 150|300|450 | F419: 天赋 3 | G419: =VLOOKUP(RC[4],Sheet1!R8C1:R38C3,2,FALSE)&"+"&IF(VLOOKUP(RC[4],Sheet1!R8C1:R38C3,3,FALSE)="固定值",RC[5],RC[5]/100&"%") -> 法防+450 | K419: 3 | L419: =VLOOKUP(INT(MOD(RC[-11],1000)/100),R7C9:R9C10,2,FALSE)*RC[-10]*100 -> 450
A420: 2404 | B420: 4 | C420: 80 | D420: =IF(RC2=1,RC[7],R[-1]C&"|"&RC[7]) -> 3|6|3|5 | E420: =IF(RC2=1,RC[7],R[-1]C&"|"&RC[7]) -> 150|300|450|600 | F420: 天赋 4 | G420: =VLOOKUP(RC[4],Sheet1!R8C1:R38C3,2,FALSE)&"+"&IF(VLOOKUP(RC[4],Sheet1!R8C1:R38C3,3,FALSE)="固定值",RC[5],RC[5]/100&"%") -> 免伤+6% | K420: 5 | L420: =VLOOKUP(INT(MOD(RC[-11],1000)/100),R7C9:R9C10,2,FALSE)*RC[-10]*100 -> 600
A421: 2404 | B421: 5 | C421: 100 | D421: =IF(RC2=1,RC[7],R[-1]C&"|"&RC[7]) -> 3|6|3|5|3 | E421: =IF(RC2=1,RC[7],R[-1]C&"|"&RC[7]) -> 150|300|450|600|750 | F421: 天赋 5 | G421: =VLOOKUP(RC[4],Sheet1!R8C1:R38C3,2,FALSE)&"+"&IF(VLOOKUP(RC[4],Sheet1!R8C1:R38C3,3,FALSE)="固定值",RC[5],RC[5]/100&"%") -> 法防+750 | K421: 3 | L421: =VLOOKUP(INT(MOD(RC[-11],1000)/100),R7C9:R9C10,2,FALSE)*RC[-10]*100 -> 750
A422: 2404 | B422: 6 | C422: 120 | D422: =IF(RC2=1,RC[7],R[-1]C&"|"&RC[7]) -> 3|6|3|5|3|24 | E422: =IF(RC2=1,RC[7],R[-1]C&"|"&RC[7]) -> 150|300|450|600|750|900 | F422: 天赋 6 | G422: =VLOOKUP(RC[4],Sheet1!R8C1:R38C3,2,FALSE)&"+"&IF(VLOOKUP(RC[4],Sheet1!R8C1:R38C3,3,FALSE)="固定值",RC[5],RC[5]/100&"%") -> 法防+9% | K422: 24 | L422: =VLOOKUP(INT(MOD(RC[-11],1000)/100),R7C9:R9C10,2,FALSE)*RC[-10]*100 -> 900
A423: 2404 | B423: 7 | C423: 140 | D423: =IF(RC2=1,RC[7],R[-1]C&"|"&RC[7]) -> 3|6|3|5|3|24|3 | E423: =IF(RC2=1,RC[7],R[-1]C&"|"&RC[7]) -> 150|300|450|600|750|900|1050 | F423: 天赋 7 | G423: =VLOOKUP(RC[4],Sheet1!R8C1:R38C3,2,FALSE)&"+"&IF(VLOOKUP(RC[4],Sheet1!R8C1:R38C3,3,FALSE)="固定值",RC[5],RC[5]/100&"%") -> 法防+1050 | K423: 3 | L423: =VLOOKUP(INT(MOD(RC[-11],1000)/100),R7C9:R9C10,2,FALSE)*RC[-10]*100 -> 1050
A424: 2404 | B424: 8 | C424: 160 | D424: =IF(RC2=1,RC[7],R[-1]C&"|"&RC[7]) -> 3|6|3|5|3|24|3|12 | E424: =IF(RC2=1,RC[7],R[-1]C&"|"&RC[7]) -> 150|300|450|600|750|900|1050|1200 | F424: 天赋 8 | G424: =VLOOKUP(RC[4],Sheet1!R8C1:R38C3,2,FALSE)&"+"&IF(VLOOKUP(RC[4],Sheet1!R8C1:R38C3,3,FALSE)="固定值",RC[5],RC[5]/100&"%") -> 闪避+12% | K424: 12 | L424: =VLOOKUP(INT(MOD(RC[-11],1000)/100),R7C9:R9C10,2,FALSE)*RC[-10]*100 -> 1200
A425: 2404 | B425: 9 | C425: 180 | D425: =IF(RC2=1,RC[7],R[-1]C&"|"&RC[7]) -> 3|6|3|5|3|24|3|12|3 | E425: =IF(RC2=1,RC[7],R[-1]C&"|"&RC[7]) -> 150|300|450|600|750|900|1050|1200|1350 | F425: 天赋 9 | G425: =VLOOKUP(RC[4],Sheet1!R8C1:R38C3,2,FALSE)&"+"&IF(VLOOKUP(RC[4],Sheet1!R8C1:R38C3,3,FALSE)="固定值",RC[5],RC[5]/100&"%") -> 法防+1350 | K425: 3 | L425: =VLOOKUP(INT(MOD(RC[-11],1000)/100),R7C9:R9C10,2,FALSE)*RC[-10]*100 -> 1350
A426: 2404 | B426: 10 | C426: 200 | D426: =IF(RC2=1,RC[7],R[-1]C&"|"&RC[7]) -> 3|6|3|5|3|24|3|12|3|24 | E426: =IF(RC2=1,RC[7],R[-1]C&"|"&RC[7]) -> 150|300|450|600|750|900|1050|1200|1350|1500 | F426: 天赋 10 | G426: =VLOOKUP(RC[4],Sheet1!R8C1:R38C3,2,FALSE)&"+"&IF(VLOOKUP(RC[4],Sheet1!R8C1:R38C3,3,FALSE)="固定值",RC[5],RC[5]/100&"%") -> 法防+15% | K426: 24 | L426: =VLOOKUP(INT(MOD(RC[-11],1000)/100),R7C9:R9C10,2,FALSE)*RC[-10]*100 -> 1500
A427: 2405 | B427: 1 | C427: 20 | D427: =IF(RC2=1,RC[7],R[-1]C&"|"&RC[7]) -> 3 | E427: =IF(RC2=1,RC[7],R[-1]C&"|"&RC[7]) -> 150 | F427: 天赋 1 | G427: =VLOOKUP(RC[4],Sheet1!R8C1:R38C3,2,FALSE)&"+"&IF(VLOOKUP(RC[4],Sheet1!R8C1:R38C3,3,FALSE)="固定值",RC[5],RC[5]/100&"%") -> 法防+150 | K427: 3 | L427: =VLOOKUP(INT(MOD(RC[-11],1000)/100),R7C9:R9C10,2,FALSE)*RC[-10]*100 -> 150
A428: 2405 | B428: 2 | C428: 40 | D428: =IF(RC2=1,RC[7],R[-1]C&"|"&RC[7]) -> 3|6 | E428: =IF(RC2=1,RC[7],R[-1]C&"|"&RC[7]) -> 150|300 | F428: 天赋 2 | G428: =VLOOKUP(RC[4],Sheet1!R8C1:R38C3,2,FALSE)&"+"&IF(VLOOKUP(RC[4],Sheet1!R8C1:R38C3,3,FALSE)="固定值",RC[5],RC[5]/100&"%") -> 减伤+300 | K428: 6 | L428: =VLOOKUP(INT(MOD(RC[-11],1000)/100),R7C9:R9C10,2,FALSE)*RC[-10]*100 -> 300
A429: 2405 | B429: 3 | C429: 60 | D429: =IF(RC2=1,RC[7],R[-1]C&"|"&RC[7]) -> 3|6|3 | E429: =IF(RC2=1,RC[7],R[-1]C&"|"&RC[7]) -> 150|300|450 | F429: 天赋 3 | G429: =VLOOKUP(RC[4],Sheet1!R8C1:R38C3,2,FALSE)&"+"&IF(VLOOKUP(RC[4],Sheet1!R8C1:R38C3,3,FALSE)="固定值",RC[5],RC[5]/100&"%") -> 法防+450 | K429: 3 | L429: =VLOOKUP(INT(MOD(RC[-11],1000)/100),R7C9:R9C10,2,FALSE)*RC[-10]*100 -> 450
A430: 2405 | B430: 4 | C430: 80 | D430: =IF(RC2=1,RC[7],R[-1]C&"|"&RC[7]) -> 3|6|3|5 | E430: =IF(RC2=1,RC[7],R[-1]C&"|"&RC[7]) -> 150|300|450|600 | F430: 天赋 4 | G430: =VLOOKUP(RC[4],Sheet1!R8C1:R38C3,2,FALSE)&"+"&IF(VLOOKUP(RC[4],Sheet1!R8C1:R38C3,3,FALSE)="固定值",RC[5],RC[5]/100&"%") -> 免伤+6% | K430: 5 | L430: =VLOOKUP(INT(MOD(RC[-11],1000)/100),R7C9:R9C10,2,FALSE)*RC[-10]*100 -> 600
A431: 2405 | B431: 5 | C431: 100 | D431: =IF(RC2=1,RC[7],R[-1]C&"|"&RC[7]) -> 3|6|3|5|3 | E431: =IF(RC2=1,RC[7],R[-1]C&"|"&RC[7]) -> 150|300|450|600|750 | F431: 天赋 5 | G431: =VLOOKUP(RC[4],Sheet1!R8C1:R38C3,2,FALSE)&"+"&IF(VLOOKUP(RC[4],Sheet1!R8C1:R38C3,3,FALSE)="固定值",RC[5],RC[5]/100&"%") -> 法防+750 | K431: 3 | L431: =VLOOKUP(INT(MOD(RC[-11],1000)/100),R7C9:R9C10,2,FALSE)*RC[-10]*100 -> 750
A432: 2405 | B432: 6 | C432: 120 | D432: =IF(RC2=1,RC[7],R[-1]C&"|"&RC[7]) -> 3|6|3|5|3|24 | E432: =IF(RC2=1,RC[7],R[-1]C&"|"&RC[7]) -> 150|300|450|600|750|900 | F432: 天赋 6 | G432: =VLOOKUP(RC[4],Sheet1!R8C1:R38C3,2,FALSE)&"+"&IF(VLOOKUP(RC[4],Sheet1!R8C1:R38C3,3,FALSE)="固定值",RC[5],RC[5]/100&"%") -> 法防+9% | K432: 24 | L432: =VLOOKUP(INT(MOD(RC[-11],1000)/100),R7C9:R9C10,2,FALSE)*RC[-10]*100 -> 900
A433: 2405 | B433: 7 | C433: 140 | D433: =IF(RC2=1,RC[7],R[-1]C&"|"&RC[7]) -> 3|6|3|5|3|24|3 | E433: =IF(RC2=1,RC[7],R[-1]C&"|"&RC[7]) -> 150|300|450|600|750|900|1050 | F433: 天赋 7 | G433: =VLOOKUP(RC[4],Sheet1!R8C1:R38C3,2,FALSE)&"+"&IF(VLOOKUP(RC[4],Sheet1!R8C1:R38C3,3,FALSE)="固定值",RC[5],RC[5]/100&"%") -> 法防+1050 | K433: 3 | L433: =VLOOKUP(INT(MOD(RC[-11],1000)/100),R7C9:R9C10,2,FALSE)*RC[-10]*100 -> 1050
A434: 2405 | B434: 8 | C434: 160 | D434: =IF(RC2=1,RC[7],R[-1]C&"|"&RC[7]) -> 3|6|3|5|3|24|3|12 | E434: =IF(RC2=1,RC[7],R[-1]C&"|"&RC[7]) -> 150|300|450|600|750|900|1050|1200 | F434: 天赋 8 | G434: =VLOOKUP(RC[4],Sheet1!R8C1:R38C3,2,FALSE)&"+"&IF(VLOOKUP(RC[4],Sheet1!R8C1:R38C3,3,FALSE)="固定值",RC[5],RC[5]/100&"%") -> 闪避+12% | K434: 12 | L434: =VLOOKUP(INT(MOD(RC[-11],1000)/100),R7C9:R9C10,2,FALSE)*RC[-10]*100 -> 1200
A435: 2405 | B435: 9 | C435: 180 | D435: =IF(RC2=1,RC[7],R[-1]C&"|"&RC[7]) -> 3|6|3|5|3|24|3|12|3 | E435: =IF(RC2=1,RC[7],R[-1]C&"|"&RC[7]) -> 150|300|450|600|750|900|1050|1200|1350 | F435: 天赋 9 | G435: =VLOOKUP(RC[4],Sheet1!R8C1:R38C3,2,FALSE)&"+"&IF(VLOOKUP(RC[4],Sheet1!R8C1:R38C3,3,FALSE)="固定值",RC[5],RC[5]/100&"%") -> 法防+1350 | K435: 3 | L435: =VLOOKUP(INT(MOD(RC[-11],1000)/100),R7C9:R9C10,2,FALSE)*RC[-10]*100 -> 1350
A436: 2405 | B436: 10 | C436: 200 | D436: =IF(RC2=1,RC[7],R[-1]C&"|"&RC[7]) -> 3|6|3|5|3|24|3|12|3|24 | E436: =IF(RC2=1,RC[7],R[-1]C&"|"&RC[7]) -> 150|300|450|600|750|900|1050|1200|1350|1500 | F436: 天赋 10 | G436: =VLOOKUP(RC[4],Sheet1!R8C1:R38C3,2,FALSE)&"+"&IF(VLOOKUP(RC[4],Sheet1!R8C1:R38C3,3,FALSE)="固定值",RC[5],RC[5]/100&"%") -> 法防+15% | K436: 24 | L436: =VLOOKUP(INT(MOD(RC[-11],1000)/100),R7C9:R9C10,2,FALSE)*RC[-10]*100 -> 1500
A437: 2406 | B437: 1 | C437: 20 | D437: =IF(RC2=1,RC[7],R[-1]C&"|"&RC[7]) -> 3 | E437: =IF(RC2=1,RC[7],R[-1]C&"|"&RC[7]) -> 150 | F437: 天赋 1 | G437: =VLOOKUP(RC[4],Sheet1!R8C1:R38C3,2,FALSE)&"+"&IF(VLOOKUP(RC[4],Sheet1!R8C1:R38C3,3,FALSE)="固定值",RC[5],RC[5]/100&"%") -> 法防+150 | K437: 3 | L437: =VLOOKUP(INT(MOD(RC[-11],1000)/100),R7C9:R9C10,2,FALSE)*RC[-10]*100 -> 150
A438: 2406 | B438: 2 | C438: 40 | D438: =IF(RC2=1,RC[7],R[-1]C&"|"&RC[7]) -> 3|6 | E438: =IF(RC2=1,RC[7],R[-1]C&"|"&RC[7]) -> 150|300 | F438: 天赋 2 | G438: =VLOOKUP(RC[4],Sheet1!R8C1:R38C3,2,FALSE)&"+"&IF(VLOOKUP(RC[4],Sheet1!R8C1:R38C3,3,FALSE)="固定值",RC[5],RC[5]/100&"%") -> 减伤+300 | K438: 6 | L438: =VLOOKUP(INT(MOD(RC[-11],1000)/100),R7C9:R9C10,2,FALSE)*RC[-10]*100 -> 300
A439: 2406 | B439: 3 | C439: 60 | D439: =IF(RC2=1,RC[7],R[-1]C&"|"&RC[7]) -> 3|6|3 | E439: =IF(RC2=1,RC[7],R[-1]C&"|"&RC[7]) -> 150|300|450 | F439: 天赋 3 | G439: =VLOOKUP(RC[4],Sheet1!R8C1:R38C3,2,FALSE)&"+"&IF(VLOOKUP(RC[4],Sheet1!R8C1:R38C3,3,FALSE)="固定值",RC[5],RC[5]/100&"%") -> 法防+450 | K439: 3 | L439: =VLOOKUP(INT(MOD(RC[-11],1000)/100),R7C9:R9C10,2,FALSE)*RC[-10]*100 -> 450
A440: 2406 | B440: 4 | C440: 80 | D440: =IF(RC2=1,RC[7],R[-1]C&"|"&RC[7]) -> 3|6|3|5 | E440: =IF(RC2=1,RC[7],R[-1]C&"|"&RC[7]) -> 150|300|450|600 | F440: 天赋 4 | G440: =VLOOKUP(RC[4],Sheet1!R8C1:R38C3,2,FALSE)&"+"&IF(VLOOKUP(RC[4],Sheet1!R8C1:R38C3,3,FALSE)="固定值",RC[5],RC[5]/100&"%") -> 免伤+6% | K440: 5 | L440: =VLOOKUP(INT(MOD(RC[-11],1000)/100),R7C9:R9C10,2,FALSE)*RC[-10]*100 -> 600
A441: 2406 | B441: 5 | C441: 100 | D441: =IF(RC2=1,RC[7],R[-1]C&"|"&RC[7]) -> 3|6|3|5|3 | E441: =IF(RC2=1,RC[7],R[-1]C&"|"&RC[7]) -> 150|300|450|600|750 | F441: 天赋 5 | G441: =VLOOKUP(RC[4],Sheet1!R8C1:R38C3,2,FALSE)&"+"&IF(VLOOKUP(RC[4],Sheet1!R8C1:R38C3,3,FALSE)="固定值",RC[5],RC[5]/100&"%") -> 法防+750 | K441: 3 | L441: =VLOOKUP(INT(MOD(RC[-11],1000)/100),R7C9:R9C10,2,FALSE)*RC[-10]*100 -> 750
A442: 2406 | B442: 6 | C442: 120 | D442: =IF(RC2=1,RC[7],R[-1]C&"|"&RC[7]) -> 3|6|3|5|3|24 | E442: =IF(RC2=1,RC[7],R[-1]C&"|"&RC[7]) -> 150|300|450|600|750|900 | F442: 天赋 6 | G442: =VLOOKUP(RC[4],Sheet1!R8C1:R38C3,2,FALSE)&"+"&IF(VLOOKUP(RC[4],Sheet1!R8C1:R38C3,3,FALSE)="固定值",RC[5],RC[5]/100&"%") -> 法防+9% | K442: 24 | L442: =VLOOKUP(INT(MOD(RC[-11],1000)/100),R7C9:R9C10,2,FALSE)*RC[-10]*100 -> 900
A443: 2406 | B443: 7 | C443: 140 | D443: =IF(RC2=1,RC[7],R[-1]C&"|"&RC[7]) -> 3|6|3|5|3|24|3 | E443: =IF(RC2=1,RC[7],R[-1]C&"|"&RC[7]) -> 150|300|450|600|750|900|1050 | F443: 天赋 7 | G443: =VLOOKUP(RC[4],Sheet1!R8C1:R38C3,2,FALSE)&"+"&IF(VLOOKUP(RC[4],Sheet1!R8C1:R38C3,3,FALSE)="固定值",RC[5],RC[5]/100&"%") -> 法防+1050 | K443: 3 | L443: =VLOOKUP(INT(MOD(RC[-11],1000)/100),R7C9:R9C10,2,FALSE)*RC[-10]*100 -> 1050
A444: 2406 | B444: 8 | C444: 160 | D444: =IF(RC2=1,RC[7],R[-1]C&"|"&RC[7]) -> 3|6|3|5|3|24|3|12 | E444: =IF(RC2=1,RC[7],R[-1]C&"|"&RC[7]) -> 150|300|450|600|750|900|1050|1200 | F444: 天赋 8 | G444: =VLOOKUP(RC[4],Sheet1!R8C1:R38C3,2,FALSE)&"+"&IF(VLOOKUP(RC[4],Sheet1!R8C1:R38C3,3,FALSE)="固定值",RC[5],RC[5]/100&"%") -> 闪避+12% | K444: 12 | L444: =VLOOKUP(INT(MOD(RC[-11],1000)/100),R7C9:R9C10,2,FALSE)*RC[-10]*100 -> 1200
A445: 2406 | B445: 9 | C445: 180 | D445: =IF(RC2=1,RC[7],R[-1]C&"|"&RC[7]) -> 3|6|3|5|3|24|3|12|3 | E445: =IF(RC2=1,RC[7],R[-1]C&"|"&RC[7]) -> 150|300|450|600|750|900|1050|1200|1350 | F445: 天赋 9 | G445: =VLOOKUP(RC[4],Sheet1!R8C1:R38C3,2,FALSE)&"+"&IF(VLOOKUP(RC[4],Sheet1!R8C1:R38C3,3,FALSE)="固定值",RC[5],RC[5]/100&"%") -> 法防+1350 | K445: 3 | L445: =VLOOKUP(INT(MOD(RC[-11],1000)/100),R7C9:R9C10,2,FALSE)*RC[-10]*100 -> 1350
A446: 2406 | B446: 10 | C446: 200 | D446: =IF(RC2=1,RC[7],R[-1]C&"|"&RC[7]) -> 3|6|3|5|3|24|3|12|3|24 | E446: =IF(RC2=1,RC[7],R[-1]C&"|"&RC[7]) -> 150|300|450|600|750|900|1050|1200|1350|1500 | F446: 天赋 10 | G446: =VLOOKUP(RC[4],Sheet1!R8C1:R38C3,2,FALSE)&"+"&IF(VLOOKUP(RC[4],Sheet1!R8C1:R38C3,3,FALSE)="固定值",RC[5],RC[5]/100&"%") -> 法防+15% | K446: 24 | L446: =VLOOKUP(INT(MOD(RC[-11],1000)/100),R7C9:R9C10,2,FALSE)*RC[-10]*100 -> 1500
A447: 2407 | B447: 1 | C447: 20 | D447: =IF(RC2=1,RC[7],R[-1]C&"|"&RC[7]) -> 3 | E447: =IF(RC2=1,RC[7],R[-1]C&"|"&RC[7]) -> 150 | F447: 天赋 1 | G447: =VLOOKUP(RC[4],Sheet1!R8C1:R38C3,2,FALSE)&"+"&IF(VLOOKUP(RC[4],Sheet1!R8C1:R38C3,3,FALSE)="固定值",RC[5],RC[5]/100&"%") -> 法防+150 | K447: 3 | L447: =VLOOKUP(INT(MOD(RC[-11],1000)/100),R7C9:R9C10,2,FALSE)*RC[-10]*100 -> 150
A448: 2407 | B448: 2 | C448: 40 | D448: =IF(RC2=1,RC[7],R[-1]C&"|"&RC[7]) -> 3|6 | E448: =IF(RC2=1,RC[7],R[-1]C&"|"&RC[7]) -> 150|300 | F448: 天赋 2 | G448: =VLOOKUP(RC[4],Sheet1!R8C1:R38C3,2,FALSE)&"+"&IF(VLOOKUP(RC[4],Sheet1!R8C1:R38C3,3,FALSE)="固定值",RC[5],RC[5]/100&"%") -> 减伤+300 | K448: 6 | L448: =VLOOKUP(INT(MOD(RC[-11],1000)/100),R7C9:R9C10,2,FALSE)*RC[-10]*100 -> 300
A449: 2407 | B449: 3 | C449: 60 | D449: =IF(RC2=1,RC[7],R[-1]C&"|"&RC[7]) -> 3|6|3 | E449: =IF(RC2=1,RC[7],R[-1]C&"|"&RC[7]) -> 150|300|450 | F449: 天赋 3 | G449: =VLOOKUP(RC[4],Sheet1!R8C1:R38C3,2,FALSE)&"+"&IF(VLOOKUP(RC[4],Sheet1!R8C1:R38C3,3,FALSE)="固定值",RC[5],RC[5]/100&"%") -> 法防+450 | K449: 3 | L449: =VLOOKUP(INT(MOD(RC[-11],1000)/100),R7C9:R9C10,2,FALSE)*RC[-10]*100 -> 450
A450: 2407 | B450: 4 | C450: 80 | D450: =IF(RC2=1,RC[7],R[-1]C&"|"&RC[7]) -> 3|6|3|5 | E450: =IF(RC2=1,RC[7],R[-1]C&"|"&RC[7]) -> 150|300|450|600 | F450: 天赋 4 | G450: =VLOOKUP(RC[4],Sheet1!R8C1:R38C3,2,FALSE)&"+"&IF(VLOOKUP(RC[4],Sheet1!R8C1:R38C3,3,FALSE)="固定值",RC[5],RC[5]/100&"%") -> 免伤+6% | K450: 5 | L450: =VLOOKUP(INT(MOD(RC[-11],1000)/100),R7C9:R9C10,2,FALSE)*RC[-10]*100 -> 600
A451: 2407 | B451: 5 | C451: 100 | D451: =IF(RC2=1,RC[7],R[-1]C&"|"&RC[7]) -> 3|6|3|5|3 | E451: =IF(RC2=1,RC[7],R[-1]C&"|"&RC[7]) -> 150|300|450|600|750 | F451: 天赋 5 | G451: =VLOOKUP(RC[4],Sheet1!R8C1:R38C3,2,FALSE)&"+"&IF(VLOOKUP(RC[4],Sheet1!R8C1:R38C3,3,FALSE)="固定值",RC[5],RC[5]/100&"%") -> 法防+750 | K451: 3 | L451: =VLOOKUP(INT(MOD(RC[-11],1000)/100),R7C9:R9C10,2,FALSE)*RC[-10]*100 -> 750
A452: 2407 | B452: 6 | C452: 120 | D452: =IF(RC2=1,RC[7],R[-1]C&"|"&RC[7]) -> 3|6|3|5|3|24 | E452: =IF(RC2=1,RC[7],R[-1]C&"|"&RC[7]) -> 150|300|450|600|750|900 | F452: 天赋 6 | G452: =VLOOKUP(RC[4],Sheet1!R8C1:R38C3,2,FALSE)&"+"&IF(VLOOKUP(RC[4],Sheet1!R8C1:R38C3,3,FALSE)="固定值",RC[5],RC[5]/100&"%") -> 法防+9% | K452: 24 | L452: =VLOOKUP(INT(MOD(RC[-11],1000)/100),R7C9:R9C10,2,FALSE)*RC[-10]*100 -> 900
A453: 2407 | B453: 7 | C453: 140 | D453: =IF(RC2=1,RC[7],R[-1]C&"|"&RC[7]) -> 3|6|3|5|3|24|3 | E453: =IF(RC2=1,RC[7],R[-1]C&"|"&RC[7]) -> 150|300|450|600|750|900|1050 | F453: 天赋 7 | G453: =VLOOKUP(RC[4],Sheet1!R8C1:R38C3,2,FALSE)&"+"&IF(VLOOKUP(RC[4],Sheet1!R8C1:R38C3,3,FALSE)="固定值",RC[5],RC[5]/100&"%") -> 法防+1050 | K453: 3 | L453: =VLOOKUP(INT(MOD(RC[-11],1000)/100),R7C9:R9C10,2,FALSE)*RC[-10]*100 -> 1050
A454: 2407 | B454: 8 | C454: 160 | D454: =IF(RC2=1,RC[7],R[-1]C&"|"&RC[7]) -> 3|6|3|5|3|24|3|12 | E454: =IF(RC2=1,RC[7],R[-1]C&"|"&RC[7]) -> 150|300|450|600|750|900|1050|1200 | F454: 天赋 8 | G454: =VLOOKUP(RC[4],Sheet1!R8C1:R38C3,2,FALSE)&"+"&IF(VLOOKUP(RC[4],Sheet1!R8C1:R38C3,3,FALSE)="固定值",RC[5],RC[5]/100&"%") -> 闪避+12% | K454: 12 | L454: =VLOOKUP(INT(MOD(RC[-11],1000)/100),R7C9:R9C10,2,FALSE)*RC[-10]*100 -> 1200
A455: 2407 | B455: 9 | C455: 180 | D455: =IF(RC2=1,RC[7],R[-1]C&"|"&RC[7]) -> 3|6|3|5|3|24|3|12|3 | E455: =IF(RC2=1,RC[7],R[-1]C&"|"&RC[7]) -> 150|300|450|600|750|900|1050|1200|1350 | F455: 天赋 9 | G455: =VLOOKUP(RC[4],Sheet1!R8C1:R38C3,2,FALSE)&"+"&IF(VLOOKUP(RC[4],Sheet1!R8C1:R38C3,3,FALSE)="固定值",RC[5],RC[5]/100&"%") -> 法防+1350 | K455: 3 | L455: =VLOOKUP(INT(MOD(RC[-11],1000)/100),R7C9:R9C10,2,FALSE)*RC[-10]*100 -> 1350
A456: 2407 | B456: 10 | C456: 200 | D456: =IF(RC2=1,RC[7],R[-1]C&"|"&RC[7]) -> 3|6|3|5|3|24|3|12|3|24 | E456: =IF(RC2=1,RC[7],R[-1]C&"|"&RC[7]) -> 150|300|450|600|750|900|1050|1200|1350|1500 | F456: 天赋 10 | G456: =VLOOKUP(RC[4],Sheet1!R8C1:R38C3,2,FALSE)&"+"&IF(VLOOKUP(RC[4],Sheet1!R8C1:R38C3,3,FALSE)="固定值",RC[5],RC[5]/100&"%") -> 法防+15% | K456: 24 | L456: =VLOOKUP(INT(MOD(RC[-11],1000)/100),R7C9:R9C10,2,FALSE)*RC[-10]*100 -> 1500
A457: 2408 | B457: 1 | C457: 20 | D457: =IF(RC2=1,RC[7],R[-1]C&"|"&RC[7]) -> 3 | E457: =IF(RC2=1,RC[7],R[-1]C&"|"&RC[7]) -> 150 | F457: 天赋 1 | G457: =VLOOKUP(RC[4],Sheet1!R8C1:R38C3,2,FALSE)&"+"&IF(VLOOKUP(RC[4],Sheet1!R8C1:R38C3,3,FALSE)="固定值",RC[5],RC[5]/100&"%") -> 法防+150 | K457: 3 | L457: =VLOOKUP(INT(MOD(RC[-11],1000)/100),R7C9:R9C10,2,FALSE)*RC[-10]*100 -> 150
A458: 2408 | B458: 2 | C458: 40 | D458: =IF(RC2=1,RC[7],R[-1]C&"|"&RC[7]) -> 3|6 | E458: =IF(RC2=1,RC[7],R[-1]C&"|"&RC[7]) -> 150|300 | F458: 天赋 2 | G458: =VLOOKUP(RC[4],Sheet1!R8C1:R38C3,2,FALSE)&"+"&IF(VLOOKUP(RC[4],Sheet1!R8C1:R38C3,3,FALSE)="固定值",RC[5],RC[5]/100&"%") -> 减伤+300 | K458: 6 | L458: =VLOOKUP(INT(MOD(RC[-11],1000)/100),R7C9:R9C10,2,FALSE)*RC[-10]*100 -> 300
A459: 2408 | B459: 3 | C459: 60 | D459: =IF(RC2=1,RC[7],R[-1]C&"|"&RC[7]) -> 3|6|3 | E459: =IF(RC2=1,RC[7],R[-1]C&"|"&RC[7]) -> 150|300|450 | F459: 天赋 3 | G459: =VLOOKUP(RC[4],Sheet1!R8C1:R38C3,2,FALSE)&"+"&IF(VLOOKUP(RC[4],Sheet1!R8C1:R38C3,3,FALSE)="固定值",RC[5],RC[5]/100&"%") -> 法防+450 | K459: 3 | L459: =VLOOKUP(INT(MOD(RC[-11],1000)/100),R7C9:R9C10,2,FALSE)*RC[-10]*100 -> 450
A460: 2408 | B460: 4 | C460: 80 | D460: =IF(RC2=1,RC[7],R[-1]C&"|"&RC[7]) -> 3|6|3|5 | E460: =IF(RC2=1,RC[7],R[-1]C&"|"&RC[7]) -> 150|300|450|600 | F460: 天赋 4 | G460: =VLOOKUP(RC[4],Sheet1!R8C1:R38C3,2,FALSE)&"+"&IF(VLOOKUP(RC[4],Sheet1!R8C1:R38C3,3,FALSE)="固定值",RC[5],RC[5]/100&"%") -> 免伤+6% | K460: 5 | L460: =VLOOKUP(INT(MOD(RC[-11],1000)/100),R7C9:R9C10,2,FALSE)*RC[-10]*100 -> 600
A461: 2408 | B461: 5 | C461: 100 | D461: =IF(RC2=1,RC[7],R[-1]C&"|"&RC[7]) -> 3|6|3|5|3 | E461: =IF(RC2=1,RC[7],R[-1]C&"|"&RC[7]) -> 150|300|450|600|750 | F461: 天赋 5 | G461: =VLOOKUP(RC[4],Sheet1!R8C1:R38C3,2,FALSE)&"+"&IF(VLOOKUP(RC[4],Sheet1!R8C1:R38C3,3,FALSE)="固定值",RC[5],RC[5]/100&"%") -> 法防+750 | K461: 3 | L461: =VLOOKUP(INT(MOD(RC[-11],1000)/100),R7C9:R9C10,2,FALSE)*RC[-10]*100 -> 750
A462: 2408 | B462: 6 | C462: 120 | D462: =IF(RC2=1,RC[7],R[-1]C&"|"&RC[7]) -> 3|6|3|5|3|24 | E462: =IF(RC2=1,RC[7],R[-1]C&"|"&RC[7]) -> 150|300|450|600|750|900 | F462: 天赋 6 | G462: =VLOOKUP(RC[4],Sheet1!R8C1:R38C3,2,FALSE)&"+"&IF(VLOOKUP(RC[4],Sheet1!R8C1:R38C3,3,FALSE)="固定值",RC[5],RC[5]/100&"%") -> 法防+9% | K462: 24 | L462: =VLOOKUP(INT(MOD(RC[-11],1000)/100),R7C9:R9C10,2,FALSE)*RC[-10]*100 -> 900
A463: 2408 | B463: 7 | C463: 140 | D463: =IF(RC2=1,RC[7],R[-1]C&"|"&RC[7]) -> 3|6|3|5|3|24|3 | E463: =IF(RC2=1,RC[7],R[-1]C&"|"&RC[7]) -> 150|300|450|600|750|900|1050 | F463: 天赋 7 | G463: =VLOOKUP(RC[4],Sheet1!R8C1:R38C3,2,FALSE)&"+"&IF(VLOOKUP(RC[4],Sheet1!R8C1:R38C3,3,FALSE)="固定值",RC[5],RC[5]/100&"%") -> 法防+1050 | K463: 3 | L463: =VLOOKUP(INT(MOD(RC[-11],1000)/100),R7C9:R9C10,2,FALSE)*RC[-10]*100 -> 1050
A464: 2408 | B464: 8 | C464: 160 | D464: =IF(RC2=1,RC[7],R[-1]C&"|"&RC[7]) -> 3|6|3|5|3|24|3|12 | E464: =IF(RC2=1,RC[7],R[-1]C&"|"&RC[7]) -> 150|300|450|600|750|900|1050|1200 | F464: 天赋 8 | G464: =VLOOKUP(RC[4],Sheet1!R8C1:R38C3,2,FALSE)&"+"&IF(VLOOKUP(RC[4],Sheet1!R8C1:R38C3,3,FALSE)="固定值",RC[5],RC[5]/100&"%") -> 闪避+12% | K464: 12 | L464: =VLOOKUP(INT(MOD(RC[-11],1000)/100),R7C9:R9C10,2,FALSE)*RC[-10]*100 -> 1200
A465: 2408 | B465: 9 | C465: 180 | D465: =IF(RC2=1,RC[7],R[-1]C&"|"&RC[7]) -> 3|6|3|5|3|24|3|12|3 | E465: =IF(RC2=1,RC[7],R[-1]C&"|"&RC[7]) -> 150|300|450|600|750|900|1050|1200|1350 | F465: 天赋 9 | G465: =VLOOKUP(RC[4],Sheet1!R8C1:R38C3,2,FALSE)&"+"&IF(VLOOKUP(RC[4],Sheet1!R8C1:R38C3,3,FALSE)="固定值",RC[5],RC[5]/100&"%") -> 法防+1350 | K465: 3 | L465: =VLOOKUP(INT(MOD(RC[-11],1000)/100),R7C9:R9C10,2,FALSE)*RC[-10]*100 -> 1350
A466: 2408 | B466: 10 | C466: 200 | D466: =IF(RC2=1,RC[7],R[-1]C&"|"&RC[7]) -> 3|6|3|5|3|24|3|12|3|24 | E466: =IF(RC2=1,RC[7],R[-1]C&"|"&RC[7]) -> 150|300|450|600|750|900|1050|1200|1350|1500 | F466: 天赋 10 | G466: =VLOOKUP(RC[4],Sheet1!R8C1:R38C3,2,FALSE)&"+"&IF(VLOOKUP(RC[4],Sheet1!R8C1:R38C3,3,FALSE)="固定值",RC[5],RC[5]/100&"%") -> 法防+15% | K466: 24 | L466: =VLOOKUP(INT(MOD(RC[-11],1000)/100),R7C9:R9C10,2,FALSE)*RC[-10]*100 -> 1500
A467: 2501 | B467: 1 | C467: 20 | D467: =IF(RC2=1,RC[7],R[-41]C&"|"&RC[7]) -> 3 | E467: =IF(RC2=1,RC[7],R[-41]C&"|"&RC[7]) -> 200 | F467: 天赋 1 | G467: =VLOOKUP(RC[4],Sheet1!R8C1:R38C3,2,FALSE)&"+"&IF(VLOOKUP(RC[4],Sheet1!R8C1:R38C3,3,FALSE)="固定值",RC[5],RC[5]/100&"%") -> 法防+200 | K467: 3 | L467: =VLOOKUP(INT(MOD(RC[-11],1000)/100),R7C9:R9C10,2,FALSE)*RC[-10]*100 -> 200
A468: 2501 | B468: 2 | C468: 40 | D468: =IF(RC2=1,RC[7],R[-1]C&"|"&RC[7]) -> 3|6 | E468: =IF(RC2=1,RC[7],R[-1]C&"|"&RC[7]) -> 200|400 | F468: 天赋 2 | G468: =VLOOKUP(RC[4],Sheet1!R8C1:R38C3,2,FALSE)&"+"&IF(VLOOKUP(RC[4],Sheet1!R8C1:R38C3,3,FALSE)="固定值",RC[5],RC[5]/100&"%") -> 减伤+400 | K468: 6 | L468: =VLOOKUP(INT(MOD(RC[-11],1000)/100),R7C9:R9C10,2,FALSE)*RC[-10]*100 -> 400
A469: 2501 | B469: 3 | C469: 60 | D469: =IF(RC2=1,RC[7],R[-1]C&"|"&RC[7]) -> 3|6|3 | E469: =IF(RC2=1,RC[7],R[-1]C&"|"&RC[7]) -> 200|400|600 | F469: 天赋 3 | G469: =VLOOKUP(RC[4],Sheet1!R8C1:R38C3,2,FALSE)&"+"&IF(VLOOKUP(RC[4],Sheet1!R8C1:R38C3,3,FALSE)="固定值",RC[5],RC[5]/100&"%") -> 法防+600 | K469: 3 | L469: =VLOOKUP(INT(MOD(RC[-11],1000)/100),R7C9:R9C10,2,FALSE)*RC[-10]*100 -> 600
A470: 2501 | B470: 4 | C470: 80 | D470: =IF(RC2=1,RC[7],R[-1]C&"|"&RC[7]) -> 3|6|3|5 | E470: =IF(RC2=1,RC[7],R[-1]C&"|"&RC[7]) -> 200|400|600|800 | F470: 天赋 4 | G470: =VLOOKUP(RC[4],Sheet1!R8C1:R38C3,2,FALSE)&"+"&IF(VLOOKUP(RC[4],Sheet1!R8C1:R38C3,3,FALSE)="固定值",RC[5],RC[5]/100&"%") -> 免伤+8% | K470: 5 | L470: =VLOOKUP(INT(MOD(RC[-11],1000)/100),R7C9:R9C10,2,FALSE)*RC[-10]*100 -> 800
A471: 2501 | B471: 5 | C471: 100 | D471: =IF(RC2=1,RC[7],R[-1]C&"|"&RC[7]) -> 3|6|3|5|3 | E471: =IF(RC2=1,RC[7],R[-1]C&"|"&RC[7]) -> 200|400|600|800|1000 | F471: 天赋 5 | G471: =VLOOKUP(RC[4],Sheet1!R8C1:R38C3,2,FALSE)&"+"&IF(VLOOKUP(RC[4],Sheet1!R8C1:R38C3,3,FALSE)="固定值",RC[5],RC[5]/100&"%") -> 法防+1000 | K471: 3 | L471: =VLOOKUP(INT(MOD(RC[-11],1000)/100),R7C9:R9C10,2,FALSE)*RC[-10]*100 -> 1000
A472: 2501 | B472: 6 | C472: 120 | D472: =IF(RC2=1,RC[7],R[-1]C&"|"&RC[7]) -> 3|6|3|5|3|24 | E472: =IF(RC2=1,RC[7],R[-1]C&"|"&RC[7]) -> 200|400|600|800|1000|1200 | F472: 天赋 6 | G472: =VLOOKUP(RC[4],Sheet1!R8C1:R38C3,2,FALSE)&"+"&IF(VLOOKUP(RC[4],Sheet1!R8C1:R38C3,3,FALSE)="固定值",RC[5],RC[5]/100&"%") -> 法防+12% | K472: 24 | L472: =VLOOKUP(INT(MOD(RC[-11],1000)/100),R7C9:R9C10,2,FALSE)*RC[-10]*100 -> 1200
A473: 2501 | B473: 7 | C473: 140 | D473: =IF(RC2=1,RC[7],R[-1]C&"|"&RC[7]) -> 3|6|3|5|3|24|3 | E473: =IF(RC2=1,RC[7],R[-1]C&"|"&RC[7]) -> 200|400|600|800|1000|1200|1400 | F473: 天赋 7 | G473: =VLOOKUP(RC[4],Sheet1!R8C1:R38C3,2,FALSE)&"+"&IF(VLOOKUP(RC[4],Sheet1!R8C1:R38C3,3,FALSE)="固定值",RC[5],RC[5]/100&"%") -> 法防+1400 | K473: 3 | L473: =VLOOKUP(INT(MOD(RC[-11],1000)/100),R7C9:R9C10,2,FALSE)*RC[-10]*100 -> 1400
A474: 2501 | B474: 8 | C474: 160 | D474: =IF(RC2=1,RC[7],R[-1]C&"|"&RC[7]) -> 3|6|3|5|3|24|3|12 | E474: =IF(RC2=1,RC[7],R[-1]C&"|"&RC[7]) -> 200|400|600|800|1000|1200|1400|1600 | F474: 天赋 8 | G474: =VLOOKUP(RC[4],Sheet1!R8C1:R38C3,2,FALSE)&"+"&IF(VLOOKUP(RC[4],Sheet1!R8C1:R38C3,3,FALSE)="固定值",RC[5],RC[5]/100&"%") -> 闪避+16% | K474: 12 | L474: =VLOOKUP(INT(MOD(RC[-11],1000)/100),R7C9:R9C10,2,FALSE)*RC[-10]*100 -> 1600
A475: 2501 | B475: 9 | C475: 180 | D475: =IF(RC2=1,RC[7],R[-1]C&"|"&RC[7]) -> 3|6|3|5|3|24|3|12|3 | E475: =IF(RC2=1,RC[7],R[-1]C&"|"&RC[7]) -> 200|400|600|800|1000|1200|1400|1600|1800 | F475: 天赋 9 | G475: =VLOOKUP(RC[4],Sheet1!R8C1:R38C3,2,FALSE)&"+"&IF(VLOOKUP(RC[4],Sheet1!R8C1:R38C3,3,FALSE)="固定值",RC[5],RC[5]/100&"%") -> 法防+1800 | K475: 3 | L475: =VLOOKUP(INT(MOD(RC[-11],1000)/100),R7C9:R9C10,2,FALSE)*RC[-10]*100 -> 1800
A476: 2501 | B476: 10 | C476: 200 | D476: =IF(RC2=1,RC[7],R[-1]C&"|"&RC[7]) -> 3|6|3|5|3|24|3|12|3|24 | E476: =IF(RC2=1,RC[7],R[-1]C&"|"&RC[7]) -> 200|400|600|800|1000|1200|1400|1600|1800|2000 | F476: 天赋 10 | G476: =VLOOKUP(RC[4],Sheet1!R8C1:R38C3,2,FALSE)&"+"&IF(VLOOKUP(RC[4],Sheet1!R8C1:R38C3,3,FALSE)="固定值",RC[5],RC[5]/100&"%") -> 法防+20% | K476: 24 | L476: =VLOOKUP(INT(MOD(RC[-11],1000)/100),R7C9:R9C10,2,FALSE)*RC[-10]*100 -> 2000
A477: 2502 | B477: 1 | C477: 20 | D477: =IF(RC2=1,RC[7],R[-61]C&"|"&RC[7]) -> 3 | E477: =IF(RC2=1,RC[7],R[-61]C&"|"&RC[7]) -> 200 | F477: 天赋 1 | G477: =VLOOKUP(RC[4],Sheet1!R8C1:R38C3,2,FALSE)&"+"&IF(VLOOKUP(RC[4],Sheet1!R8C1:R38C3,3,FALSE)="固定值",RC[5],RC[5]/100&"%") -> 法防+200 | K477: 3 | L477: =VLOOKUP(INT(MOD(RC[-11],1000)/100),R7C9:R9C10,2,FALSE)*RC[-10]*100 -> 200
A478: 2502 | B478: 2 | C478: 40 | D478: =IF(RC2=1,RC[7],R[-1]C&"|"&RC[7]) -> 3|6 | E478: =IF(RC2=1,RC[7],R[-1]C&"|"&RC[7]) -> 200|400 | F478: 天赋 2 | G478: =VLOOKUP(RC[4],Sheet1!R8C1:R38C3,2,FALSE)&"+"&IF(VLOOKUP(RC[4],Sheet1!R8C1:R38C3,3,FALSE)="固定值",RC[5],RC[5]/100&"%") -> 减伤+400 | K478: 6 | L478: =VLOOKUP(INT(MOD(RC[-11],1000)/100),R7C9:R9C10,2,FALSE)*RC[-10]*100 -> 400
A479: 2502 | B479: 3 | C479: 60 | D479: =IF(RC2=1,RC[7],R[-1]C&"|"&RC[7]) -> 3|6|3 | E479: =IF(RC2=1,RC[7],R[-1]C&"|"&RC[7]) -> 200|400|600 | F479: 天赋 3 | G479: =VLOOKUP(RC[4],Sheet1!R8C1:R38C3,2,FALSE)&"+"&IF(VLOOKUP(RC[4],Sheet1!R8C1:R38C3,3,FALSE)="固定值",RC[5],RC[5]/100&"%") -> 法防+600 | K479: 3 | L479: =VLOOKUP(INT(MOD(RC[-11],1000)/100),R7C9:R9C10,2,FALSE)*RC[-10]*100 -> 600
A480: 2502 | B480: 4 | C480: 80 | D480: =IF(RC2=1,RC[7],R[-1]C&"|"&RC[7]) -> 3|6|3|5 | E480: =IF(RC2=1,RC[7],R[-1]C&"|"&RC[7]) -> 200|400|600|800 | F480: 天赋 4 | G480: =VLOOKUP(RC[4],Sheet1!R8C1:R38C3,2,FALSE)&"+"&IF(VLOOKUP(RC[4],Sheet1!R8C1:R38C3,3,FALSE)="固定值",RC[5],RC[5]/100&"%") -> 免伤+8% | K480: 5 | L480: =VLOOKUP(INT(MOD(RC[-11],1000)/100),R7C9:R9C10,2,FALSE)*RC[-10]*100 -> 800
A481: 2502 | B481: 5 | C481: 100 | D481: =IF(RC2=1,RC[7],R[-1]C&"|"&RC[7]) -> 3|6|3|5|3 | E481: =IF(RC2=1,RC[7],R[-1]C&"|"&RC[7]) -> 200|400|600|800|1000 | F481: 天赋 5 | G481: =VLOOKUP(RC[4],Sheet1!R8C1:R38C3,2,FALSE)&"+"&IF(VLOOKUP(RC[4],Sheet1!R8C1:R38C3,3,FALSE)="固定值",RC[5],RC[5]/100&"%") -> 法防+1000 | K481: 3 | L481: =VLOOKUP(INT(MOD(RC[-11],1000)/100),R7C9:R9C10,2,FALSE)*RC[-10]*100 -> 1000
A482: 2502 | B482: 6 | C482: 120 | D482: =IF(RC2=1,RC[7],R[-1]C&"|"&RC[7]) -> 3|6|3|5|3|24 | E482: =IF(RC2=1,RC[7],R[-1]C&"|"&RC[7]) -> 200|400|600|800|1000|1200 | F482: 天赋 6 | G482: =VLOOKUP(RC[4],Sheet1!R8C1:R38C3,2,FALSE)&"+"&IF(VLOOKUP(RC[4],Sheet1!R8C1:R38C3,3,FALSE)="固定值",RC[5],RC[5]/100&"%") -> 法防+12% | K482: 24 | L482: =VLOOKUP(INT(MOD(RC[-11],1000)/100),R7C9:R9C10,2,FALSE)*RC[-10]*100 -> 1200
A483: 2502 | B483: 7 | C483: 140 | D483: =IF(RC2=1,RC[7],R[-1]C&"|"&RC[7]) -> 3|6|3|5|3|24|3 | E483: =IF(RC2=1,RC[7],R[-1]C&"|"&RC[7]) -> 200|400|600|800|1000|1200|1400 | F483: 天赋 7 | G483: =VLOOKUP(RC[4],Sheet1!R8C1:R38C3,2,FALSE)&"+"&IF(VLOOKUP(RC[4],Sheet1!R8C1:R38C3,3,FALSE)="固定值",RC[5],RC[5]/100&"%") -> 法防+1400 | K483: 3 | L483: =VLOOKUP(INT(MOD(RC[-11],1000)/100),R7C9:R9C10,2,FALSE)*RC[-10]*100 -> 1400
A484: 2502 | B484: 8 | C484: 160 | D484: =IF(RC2=1,RC[7],R[-1]C&"|"&RC[7]) -> 3|6|3|5|3|24|3|12 | E484: =IF(RC2=1,RC[7],R[-1]C&"|"&RC[7]) -> 200|400|600|800|1000|1200|1400|1600 | F484: 天赋 8 | G484: =VLOOKUP(RC[4],Sheet1!R8C1:R38C3,2,FALSE)&"+"&IF(VLOOKUP(RC[4],Sheet1!R8C1:R38C3,3,FALSE)="固定值",RC[5],RC[5]/100&"%") -> 闪避+16% | K484: 12 | L484: =VLOOKUP(INT(MOD(RC[-11],1000)/100),R7C9:R9C10,2,FALSE)*RC[-10]*100 -> 1600
A485: 2502 | B485: 9 | C485: 180 | D485: =IF(RC2=1,RC[7],R[-1]C&"|"&RC[7]) -> 3|6|3|5|3|24|3|12|3 | E485: =IF(RC2=1,RC[7],R[-1]C&"|"&RC[7]) -> 200|400|600|800|1000|1200|1400|1600|1800 | F485: 天赋 9 | G485: =VLOOKUP(RC[4],Sheet1!R8C1:R38C3,2,FALSE)&"+"&IF(VLOOKUP(RC[4],Sheet1!R8C1:R38C3,3,FALSE)="固定值",RC[5],RC[5]/100&"%") -> 法防+1800 | K485: 3 | L485: =VLOOKUP(INT(MOD(RC[-11],1000)/100),R7C9:R9C10,2,FALSE)*RC[-10]*100 -> 1800
A486: 2502 | B486: 10 | C486: 200 | D486: =IF(RC2=1,RC[7],R[-1]C&"|"&RC[7]) -> 3|6|3|5|3|24|3|12|3|24 | E486: =IF(RC2=1,RC[7],R[-1]C&"|"&RC[7]) -> 200|400|600|800|1000|1200|1400|1600|1800|2000 | F486: 天赋 10 | G486: =VLOOKUP(RC[4],Sheet1!R8C1:R38C3,2,FALSE)&"+"&IF(VLOOKUP(RC[4],Sheet1!R8C1:R38C3,3,FALSE)="固定值",RC[5],RC[5]/100&"%") -> 法防+20% | K486: 24 | L486: =VLOOKUP(INT(MOD(RC[-11],1000)/100),R7C9:R9C10,2,FALSE)*RC[-10]*100 -> 2000
A487: 2503 | B487: 1 | C487: 20 | D487: =IF(RC2=1,RC[7],R[-61]C&"|"&RC[7]) -> 3 | E487: =IF(RC2=1,RC[7],R[-61]C&"|"&RC[7]) -> 200 | F487: 天赋 1 | G487: =VLOOKUP(RC[4],Sheet1!R8C1:R38C3,2,FALSE)&"+"&IF(VLOOKUP(RC[4],Sheet1!R8C1:R38C3,3,FALSE)="固定值",RC[5],RC[5]/100&"%") -> 法防+200 | K487: 3 | L487: =VLOOKUP(INT(MOD(RC[-11],1000)/100),R7C9:R9C10,2,FALSE)*RC[-10]*100 -> 200
A488: 2503 | B488: 2 | C488: 40 | D488: =IF(RC2=1,RC[7],R[-1]C&"|"&RC[7]) -> 3|6 | E488: =IF(RC2=1,RC[7],R[-1]C&"|"&RC[7]) -> 200|400 | F488: 天赋 2 | G488: =VLOOKUP(RC[4],Sheet1!R8C1:R38C3,2,FALSE)&"+"&IF(VLOOKUP(RC[4],Sheet1!R8C1:R38C3,3,FALSE)="固定值",RC[5],RC[5]/100&"%") -> 减伤+400 | K488: 6 | L488: =VLOOKUP(INT(MOD(RC[-11],1000)/100),R7C9:R9C10,2,FALSE)*RC[-10]*100 -> 400
A489: 2503 | B489: 3 | C489: 60 | D489: =IF(RC2=1,RC[7],R[-1]C&"|"&RC[7]) -> 3|6|3 | E489: =IF(RC2=1,RC[7],R[-1]C&"|"&RC[7]) -> 200|400|600 | F489: 天赋 3 | G489: =VLOOKUP(RC[4],Sheet1!R8C1:R38C3,2,FALSE)&"+"&IF(VLOOKUP(RC[4],Sheet1!R8C1:R38C3,3,FALSE)="固定值",RC[5],RC[5]/100&"%") -> 法防+600 | K489: 3 | L489: =VLOOKUP(INT(MOD(RC[-11],1000)/100),R7C9:R9C10,2,FALSE)*RC[-10]*100 -> 600
A490: 2503 | B490: 4 | C490: 80 | D490: =IF(RC2=1,RC[7],R[-1]C&"|"&RC[7]) -> 3|6|3|5 | E490: =IF(RC2=1,RC[7],R[-1]C&"|"&RC[7]) -> 200|400|600|800 | F490: 天赋 4 | G490: =VLOOKUP(RC[4],Sheet1!R8C1:R38C3,2,FALSE)&"+"&IF(VLOOKUP(RC[4],Sheet1!R8C1:R38C3,3,FALSE)="固定值",RC[5],RC[5]/100&"%") -> 免伤+8% | K490: 5 | L490: =VLOOKUP(INT(MOD(RC[-11],1000)/100),R7C9:R9C10,2,FALSE)*RC[-10]*100 -> 800
A491: 2503 | B491: 5 | C491: 100 | D491: =IF(RC2=1,RC[7],R[-1]C&"|"&RC[7]) -> 3|6|3|5|3 | E491: =IF(RC2=1,RC[7],R[-1]C&"|"&RC[7]) -> 200|400|600|800|1000 | F491: 天赋 5 | G491: =VLOOKUP(RC[4],Sheet1!R8C1:R38C3,2,FALSE)&"+"&IF(VLOOKUP(RC[4],Sheet1!R8C1:R38C3,3,FALSE)="固定值",RC[5],RC[5]/100&"%") -> 法防+1000 | K491: 3 | L491: =VLOOKUP(INT(MOD(RC[-11],1000)/100),R7C9:R9C10,2,FALSE)*RC[-10]*100 -> 1000
A492: 2503 | B492: 6 | C492: 120 | D492: =IF(RC2=1,RC[7],R[-1]C&"|"&RC[7]) -> 3|6|3|5|3|24 | E492: =IF(RC2=1,RC[7],R[-1]C&"|"&RC[7]) -> 200|400|600|800|1000|1200 | F492: 天赋 6 | G492: =VLOOKUP(RC[4],Sheet1!R8C1:R38C3,2,FALSE)&"+"&IF(VLOOKUP(RC[4],Sheet1!R8C1:R38C3,3,FALSE)="固定值",RC[5],RC[5]/100&"%") -> 法防+12% | K492: 24 | L492: =VLOOKUP(INT(MOD(RC[-11],1000)/100),R7C9:R9C10,2,FALSE)*RC[-10]*100 -> 1200
A493: 2503 | B493: 7 | C493: 140 | D493: =IF(RC2=1,RC[7],R[-1]C&"|"&RC[7]) -> 3|6|3|5|3|24|3 | E493: =IF(RC2=1,RC[7],R[-1]C&"|"&RC[7]) -> 200|400|600|800|1000|1200|1400 | F493: 天赋 7 | G493: =VLOOKUP(RC[4],Sheet1!R8C1:R38C3,2,FALSE)&"+"&IF(VLOOKUP(RC[4],Sheet1!R8C1:R38C3,3,FALSE)="固定值",RC[5],RC[5]/100&"%") -> 法防+1400 | K493: 3 | L493: =VLOOKUP(INT(MOD(RC[-11],1000)/100),R7C9:R9C10,2,FALSE)*RC[-10]*100 -> 1400
A494: 2503 | B494: 8 | C494: 160 | D494: =IF(RC2=1,RC[7],R[-1]C&"|"&RC[7]) -> 3|6|3|5|3|24|3|12 | E494: =IF(RC2=1,RC[7],R[-1]C&"|"&RC[7]) -> 200|400|600|800|1000|1200|1400|1600 | F494: 天赋 8 | G494: =VLOOKUP(RC[4],Sheet1!R8C1:R38C3,2,FALSE)&"+"&IF(VLOOKUP(RC[4],Sheet1!R8C1:R38C3,3,FALSE)="固定值",RC[5],RC[5]/100&"%") -> 闪避+16% | K494: 12 | L494: =VLOOKUP(INT(MOD(RC[-11],1000)/100),R7C9:R9C10,2,FALSE)*RC[-10]*100 -> 1600
A495: 2503 | B495: 9 | C495: 180 | D495: =IF(RC2=1,RC[7],R[-1]C&"|"&RC[7]) -> 3|6|3|5|3|24|3|12|3 | E495: =IF(RC2=1,RC[7],R[-1]C&"|"&RC[7]) -> 200|400|600|800|1000|1200|1400|1600|1800 | F495: 天赋 9 | G495: =VLOOKUP(RC[4],Sheet1!R8C1:R38C3,2,FALSE)&"+"&IF(VLOOKUP(RC[4],Sheet1!R8C1:R38C3,3,FALSE)="固定值",RC[5],RC[5]/100&"%") -> 法防+1800 | K495: 3 | L495: =VLOOKUP(INT(MOD(RC[-11],1000)/100),R7C9:R9C10,2,FALSE)*RC[-10]*100 -> 1800
A496: 2503 | B496: 10 | C496: 200 | D496: =IF(RC2=1,RC[7],R[-1]C&"|"&RC[7]) -> 3|6|3|5|3|24|3|12|3|24 | E496: =IF(RC2=1,RC[7],R[-1]C&"|"&RC[7]) -> 200|400|600|800|1000|1200|1400|1600|1800|2000 | F496: 天赋 10 | G496: =VLOOKUP(RC[4],Sheet1!R8C1:R38C3,2,FALSE)&"+"&IF(VLOOKUP(RC[4],Sheet1!R8C1:R38C3,3,FALSE)="固定值",RC[5],RC[5]/100&"%") -> 法防+20% | K496: 24 | L496: =VLOOKUP(INT(MOD(RC[-11],1000)/100),R7C9:R9C10,2,FALSE)*RC[-10]*100 -> 2000
A497: 2504 | B497: 1 | C497: 20 | D497: =IF(RC2=1,RC[7],R[-61]C&"|"&RC[7]) -> 3 | E497: =IF(RC2=1,RC[7],R[-61]C&"|"&RC[7]) -> 200 | F497: 天赋 1 | G497: =VLOOKUP(RC[4],Sheet1!R8C1:R38C3,2,FALSE)&"+"&IF(VLOOKUP(RC[4],Sheet1!R8C1:R38C3,3,FALSE)="固定值",RC[5],RC[5]/100&"%") -> 法防+200 | K497: 3 | L497: =VLOOKUP(INT(MOD(RC[-11],1000)/100),R7C9:R9C10,2,FALSE)*RC[-10]*100 -> 200
A498: 2504 | B498: 2 | C498: 40 | D498: =IF(RC2=1,RC[7],R[-1]C&"|"&RC[7]) -> 3|6 | E498: =IF(RC2=1,RC[7],R[-1]C&"|"&RC[7]) -> 200|400 | F498: 天赋 2 | G498: =VLOOKUP(RC[4],Sheet1!R8C1:R38C3,2,FALSE)&"+"&IF(VLOOKUP(RC[4],Sheet1!R8C1:R38C3,3,FALSE)="固定值",RC[5],RC[5]/100&"%") -> 减伤+400 | K498: 6 | L498: =VLOOKUP(INT(MOD(RC[-11],1000)/100),R7C9:R9C10,2,FALSE)*RC[-10]*100 -> 400
A499: 2504 | B499: 3 | C499: 60 | D499: =IF(RC2=1,RC[7],R[-1]C&"|"&RC[7]) -> 3|6|3 | E499: =IF(RC2=1,RC[7],R[-1]C&"|"&RC[7]) -> 200|400|600 | F499: 天赋 3 | G499: =VLOOKUP(RC[4],Sheet1!R8C1:R38C3,2,FALSE)&"+"&IF(VLOOKUP(RC[4],Sheet1!R8C1:R38C3,3,FALSE)="固定值",RC[5],RC[5]/100&"%") -> 法防+600 | K499: 3 | L499: =VLOOKUP(INT(MOD(RC[-11],1000)/100),R7C9:R9C10,2,FALSE)*RC[-10]*100 -> 600
A500: 2504 | B500: 4 | C500: 80 | D500: =IF(RC2=1,RC[7],R[-1]C&"|"&RC[7]) -> 3|6|3|5 | E500: =IF(RC2=1,RC[7],R[-1]C&"|"&RC[7]) -> 200|400|600|800 | F500: 天赋 4 | G500: =VLOOKUP(RC[4],Sheet1!R8C1:R38C3,2,FALSE)&"+"&IF(VLOOKUP(RC[4],Sheet1!R8C1:R38C3,3,FALSE)="固定值",RC[5],RC[5]/100&"%") -> 免伤+8% | K500: 5 | L500: =VLOOKUP(INT(MOD(RC[-11],1000)/100),R7C9:R9C10,2,FALSE)*RC[-10]*100 -> 800
A501: 2504 | B501: 5 | C501: 100 | D501: =IF(RC2=1,RC[7],R[-1]C&"|"&RC[7]) -> 3|6|3|5|3 | E501: =IF(RC2=1,RC[7],R[-1]C&"|"&RC[7]) -> 200|400|600|800|1000 | F501: 天赋 5 | G501: =VLOOKUP(RC[4],Sheet1!R8C1:R38C3,2,FALSE)&"+"&IF(VLOOKUP(RC[4],Sheet1!R8C1:R38C3,3,FALSE)="固定值",RC[5],RC[5]/100&"%") -> 法防+1000 | K501: 3 | L501: =VLOOKUP(INT(MOD(RC[-11],1000)/100),R7C9:R9C10,2,FALSE)*RC[-10]*100 -> 1000
A502: 2504 | B502: 6 | C502: 120 | D502: =IF(RC2=1,RC[7],R[-1]C&"|"&RC[7]) -> 3|6|3|5|3|24 | E502: =IF(RC2=1,RC[7],R[-1]C&"|"&RC[7]) -> 200|400|600|800|1000|1200 | F502: 天赋 6 | G502: =VLOOKUP(RC[4],Sheet1!R8C1:R38C3,2,FALSE)&"+"&IF(VLOOKUP(RC[4],Sheet1!R8C1:R38C3,3,FALSE)="固定值",RC[5],RC[5]/100&"%") -> 法防+12% | K502: 24 | L502: =VLOOKUP(INT(MOD(RC[-11],1000)/100),R7C9:R9C10,2,FALSE)*RC[-10]*100 -> 1200
A503: 2504 | B503: 7 | C503: 140 | D503: =IF(RC2=1,RC[7],R[-1]C&"|"&RC[7]) -> 3|6|3|5|3|24|3 | E503: =IF(RC2=1,RC[7],R[-1]C&"|"&RC[7]) -> 200|400|600|800|1000|1200|1400 | F503: 天赋 7 | G503: =VLOOKUP(RC[4],Sheet1!R8C1:R38C3,2,FALSE)&"+"&IF(VLOOKUP(RC[4],Sheet1!R8C1:R38C3,3,FALSE)="固定值",RC[5],RC[5]/100&"%") -> 法防+1400 | K503: 3 | L503: =VLOOKUP(INT(MOD(RC[-11],1000)/100),R7C9:R9C10,2,FALSE)*RC[-10]*100 -> 1400
A504: 2504 | B504: 8 | C504: 160 | D504: =IF(RC2=1,RC[7],R[-1]C&"|"&RC[7]) -> 3|6|3|5|3|24|3|12 | E504: =IF(RC2=1,RC[7],R[-1]C&"|"&RC[7]) -> 200|400|600|800|1000|1200|1400|1600 | F504: 天赋 8 | G504: =VLOOKUP(RC[4],Sheet1!R8C1:R38C3,2,FALSE)&"+"&IF(VLOOKUP(RC[4],Sheet1!R8C1:R38C3,3,FALSE)="固定值",RC[5],RC[5]/100&"%") -> 闪避+16% | K504: 12 | L504: =VLOOKUP(INT(MOD(RC[-11],1000)/100),R7C9:R9C10,2,FALSE)*RC[-10]*100 -> 1600
A505: 2504 | B505: 9 | C505: 180 | D505: =IF(RC2=1,RC[7],R[-1]C&"|"&RC[7]) -> 3|6|3|5|3|24|3|12|3 | E505: =IF(RC2=1,RC[7],R[-1]C&"|"&RC[7]) -> 200|400|600|800|1000|1200|1400|1600|1800 | F505: 天赋 9 | G505: =VLOOKUP(RC[4],Sheet1!R8C1:R38C3,2,FALSE)&"+"&IF(VLOOKUP(RC[4],Sheet1!R8C1:R38C3,3,FALSE)="固定值",RC[5],RC[5]/100&"%") -> 法防+1800 | K505: 3 | L505: =VLOOKUP(INT(MOD(RC[-11],1000)/100),R7C9:R9C10,2,FALSE)*RC[-10]*100 -> 1800
A506: 2504 | B506: 10 | C506: 200 | D506: =IF(RC2=1,RC[7],R[-1]C&"|"&RC[7]) -> 3|6|3|5|3|24|3|12|3|24 | E506: =IF(RC2=1,RC[7],R[-1]C&"|"&RC[7]) -> 200|400|600|800|1000|1200|1400|1600|1800|2000 | F506: 天赋 10 | G506: =VLOOKUP(RC[4],Sheet1!R8C1:R38C3,2,FALSE)&"+"&IF(VLOOKUP(RC[4],Sheet1!R8C1:R38C3,3,FALSE)="固定值",RC[5],RC[5]/100&"%") -> 法防+20% | K506: 24 | L506: =VLOOKUP(INT(MOD(RC[-11],1000)/100),R7C9:R9C10,2,FALSE)*RC[-10]*100 -> 2000
A507: 2505 | B507: 1 | C507: 20 | D507: =IF(RC2=1,RC[7],R[-31]C&"|"&RC[7]) -> 3 | E507: =IF(RC2=1,RC[7],R[-31]C&"|"&RC[7]) -> 200 | F507: 天赋 1 | G507: =VLOOKUP(RC[4],Sheet1!R8C1:R38C3,2,FALSE)&"+"&IF(VLOOKUP(RC[4],Sheet1!R8C1:R38C3,3,FALSE)="固定值",RC[5],RC[5]/100&"%") -> 法防+200 | K507: 3 | L507: =VLOOKUP(INT(MOD(RC[-11],1000)/100),R7C9:R9C10,2,FALSE)*RC[-10]*100 -> 200
A508: 2505 | B508: 2 | C508: 40 | D508: =IF(RC2=1,RC[7],R[-1]C&"|"&RC[7]) -> 3|6 | E508: =IF(RC2=1,RC[7],R[-1]C&"|"&RC[7]) -> 200|400 | F508: 天赋 2 | G508: =VLOOKUP(RC[4],Sheet1!R8C1:R38C3,2,FALSE)&"+"&IF(VLOOKUP(RC[4],Sheet1!R8C1:R38C3,3,FALSE)="固定值",RC[5],RC[5]/100&"%") -> 减伤+400 | K508: 6 | L508: =VLOOKUP(INT(MOD(RC[-11],1000)/100),R7C9:R9C10,2,FALSE)*RC[-10]*100 -> 400
A509: 2505 | B509: 3 | C509: 60 | D509: =IF(RC2=1,RC[7],R[-1]C&"|"&RC[7]) -> 3|6|3 | E509: =IF(RC2=1,RC[7],R[-1]C&"|"&RC[7]) -> 200|400|600 | F509: 天赋 3 | G509: =VLOOKUP(RC[4],Sheet1!R8C1:R38C3,2,FALSE)&"+"&IF(VLOOKUP(RC[4],Sheet1!R8C1:R38C3,3,FALSE)="固定值",RC[5],RC[5]/100&"%") -> 法防+600 | K509: 3 | L509: =VLOOKUP(INT(MOD(RC[-11],1000)/100),R7C9:R9C10,2,FALSE)*RC[-10]*100 -> 600
A510: 2505 | B510: 4 | C510: 80 | D510: =IF(RC2=1,RC[7],R[-1]C&"|"&RC[7]) -> 3|6|3|5 | E510: =IF(RC2=1,RC[7],R[-1]C&"|"&RC[7]) -> 200|400|600|800 | F510: 天赋 4 | G510: =VLOOKUP(RC[4],Sheet1!R8C1:R38C3,2,FALSE)&"+"&IF(VLOOKUP(RC[4],Sheet1!R8C1:R38C3,3,FALSE)="固定值",RC[5],RC[5]/100&"%") -> 免伤+8% | K510: 5 | L510: =VLOOKUP(INT(MOD(RC[-11],1000)/100),R7C9:R9C10,2,FALSE)*RC[-10]*100 -> 800
A511: 2505 | B511: 5 | C511: 100 | D511: =IF(RC2=1,RC[7],R[-1]C&"|"&RC[7]) -> 3|6|3|5|3 | E511: =IF(RC2=1,RC[7],R[-1]C&"|"&RC[7]) -> 200|400|600|800|1000 | F511: 天赋 5 | G511: =VLOOKUP(RC[4],Sheet1!R8C1:R38C3,2,FALSE)&"+"&IF(VLOOKUP(RC[4],Sheet1!R8C1:R38C3,3,FALSE)="固定值",RC[5],RC[5]/100&"%") -> 法防+1000 | K511: 3 | L511: =VLOOKUP(INT(MOD(RC[-11],1000)/100),R7C9:R9C10,2,FALSE)*RC[-10]*100 -> 1000
A512: 2505 | B512: 6 | C512: 120 | D512: =IF(RC2=1,RC[7],R[-1]C&"|"&RC[7]) -> 3|6|3|5|3|24 | E512: =IF(RC2=1,RC[7],R[-1]C&"|"&RC[7]) -> 200|400|600|800|1000|1200 | F512: 天赋 6 | G512: =VLOOKUP(RC[4],Sheet1!R8C1:R38C3,2,FALSE)&"+"&IF(VLOOKUP(RC[4],Sheet1!R8C1:R38C3,3,FALSE)="固定值",RC[5],RC[5]/100&"%") -> 法防+12% | K512: 24 | L512: =VLOOKUP(INT(MOD(RC[-11],1000)/100),R7C9:R9C10,2,FALSE)*RC[-10]*100 -> 1200
A513: 2505 | B513: 7 | C513: 140 | D513: =IF(RC2=1,RC[7],R[-1]C&"|"&RC[7]) -> 3|6|3|5|3|24|3 | E513: =IF(RC2=1,RC[7],R[-1]C&"|"&RC[7]) -> 200|400|600|800|1000|1200|1400 | F513: 天赋 7 | G513: =VLOOKUP(RC[4],Sheet1!R8C1:R38C3,2,FALSE)&"+"&IF(VLOOKUP(RC[4],Sheet1!R8C1:R38C3,3,FALSE)="固定值",RC[5],RC[5]/100&"%") -> 法防+1400 | K513: 3 | L513: =VLOOKUP(INT(MOD(RC[-11],1000)/100),R7C9:R9C10,2,FALSE)*RC[-10]*100 -> 1400
A514: 2505 | B514: 8 | C514: 160 | D514: =IF(RC2=1,RC[7],R[-1]C&"|"&RC[7]) -> 3|6|3|5|3|24|3|12 | E514: =IF(RC2=1,RC[7],R[-1]C&"|"&RC[7]) -> 200|400|600|800|1000|1200|1400|1600 | F514: 天赋 8 | G514: =VLOOKUP(RC[4],Sheet1!R8C1:R38C3,2,FALSE)&"+"&IF(VLOOKUP(RC[4],Sheet1!R8C1:R38C3,3,FALSE)="固定值",RC[5],RC[5]/100&"%") -> 闪避+16% | K514: 12 | L514: =VLOOKUP(INT(MOD(RC[-11],1000)/100),R7C9:R9C10,2,FALSE)*RC[-10]*100 -> 1600
A515: 2505 | B515: 9 | C515: 180 | D515: =IF(RC2=1,RC[7],R[-1]C&"|"&RC[7]) -> 3|6|3|5|3|24|3|12|3 | E515: =IF(RC2=1,RC[7],R[-1]C&"|"&RC[7]) -> 200|400|600|800|1000|1200|1400|1600|1800 | F515: 天赋 9 | G515: =VLOOKUP(RC[4],Sheet1!R8C1:R38C3,2,FALSE)&"+"&IF(VLOOKUP(RC[4],Sheet1!R8C1:R38C3,3,FALSE)="固定值",RC[5],RC[5]/100&"%") -> 法防+1800 | K515: 3 | L515: =VLOOKUP(INT(MOD(RC[-11],1000)/100),R7C9:R9C10,2,FALSE)*RC[-10]*100 -> 1800
A516: 2505 | B516: 10 | C516: 200 | D516: =IF(RC2=1,RC[7],R[-1]C&"|"&RC[7]) -> 3|6|3|5|3|24|3|12|3|24 | E516: =IF(RC2=1,RC[7],R[-1]C&"|"&RC[7]) -> 200|400|600|800|1000|1200|1400|1600|1800|2000 | F516: 天赋 10 | G516: =VLOOKUP(RC[4],Sheet1!R8C1:R38C3,2,FALSE)&"+"&IF(VLOOKUP(RC[4],Sheet1!R8C1:R38C3,3,FALSE)="固定值",RC[5],RC[5]/100&"%") -> 法防+20% | K516: 24 | L516: =VLOOKUP(INT(MOD(RC[-11],1000)/100),R7C9:R9C10,2,FALSE)*RC[-10]*100 -> 2000
A517: 3302 | B517: 1 | C517: 20 | D517: =IF(RC2=1,RC[7],R[-1]C&"|"&RC[7]) -> 4 | E517: =IF(RC2=1,RC[7],R[-1]C&"|"&RC[7]) -> 1000 | F517: 天赋 1 | G517: =VLOOKUP(RC[4],Sheet1!R8C1:R38C3,2,FALSE)&"+"&IF(VLOOKUP(RC[4],Sheet1!R8C1:R38C3,3,FALSE)="固定值",RC[5],RC[5]/100&"%") -> 生命+1000 | K517: 4 | L517: =VLOOKUP(INT(MOD(RC[-11],1000)/100),R7C9:R9C10,2,FALSE)*RC[-10]*1000 -> 1000
A518: 3302 | B518: 2 | C518: 40 | D518: =IF(RC2=1,RC[7],R[-1]C&"|"&RC[7]) -> 4|8 | E518: =IF(RC2=1,RC[7],R[-1]C&"|"&RC[7]) -> 1000|200 | F518: 天赋 2 | G518: =VLOOKUP(RC[4],Sheet1!R8C1:R38C3,2,FALSE)&"+"&IF(VLOOKUP(RC[4],Sheet1!R8C1:R38C3,3,FALSE)="固定值",RC[5],RC[5]/100&"%") -> 附伤+200 | K518: 8 | L518: =VLOOKUP(INT(MOD(RC[-11],1000)/100),R7C9:R9C10,2,FALSE)*RC[-10]*100 -> 200
A519: 3302 | B519: 3 | C519: 60 | D519: =IF(RC2=1,RC[7],R[-1]C&"|"&RC[7]) -> 4|8|4 | E519: =IF(RC2=1,RC[7],R[-1]C&"|"&RC[7]) -> 1000|200|3000 | F519: 天赋 3 | G519: =VLOOKUP(RC[4],Sheet1!R8C1:R38C3,2,FALSE)&"+"&IF(VLOOKUP(RC[4],Sheet1!R8C1:R38C3,3,FALSE)="固定值",RC[5],RC[5]/100&"%") -> 生命+3000 | K519: 4 | L519: =VLOOKUP(INT(MOD(RC[-11],1000)/100),R7C9:R9C10,2,FALSE)*RC[-10]*1000 -> 3000
A520: 3302 | B520: 4 | C520: 80 | D520: =IF(RC2=1,RC[7],R[-1]C&"|"&RC[7]) -> 4|8|4|7 | E520: =IF(RC2=1,RC[7],R[-1]C&"|"&RC[7]) -> 1000|200|3000|400 | F520: 天赋 4 | G520: =VLOOKUP(RC[4],Sheet1!R8C1:R38C3,2,FALSE)&"+"&IF(VLOOKUP(RC[4],Sheet1!R8C1:R38C3,3,FALSE)="固定值",RC[5],RC[5]/100&"%") -> 伤害+4% | K520: 7 | L520: =VLOOKUP(INT(MOD(RC[-11],1000)/100),R7C9:R9C10,2,FALSE)*RC[-10]*100 -> 400
A521: 3302 | B521: 5 | C521: 100 | D521: =IF(RC2=1,RC[7],R[-1]C&"|"&RC[7]) -> 4|8|4|7|4 | E521: =IF(RC2=1,RC[7],R[-1]C&"|"&RC[7]) -> 1000|200|3000|400|5000 | F521: 天赋 5 | G521: =VLOOKUP(RC[4],Sheet1!R8C1:R38C3,2,FALSE)&"+"&IF(VLOOKUP(RC[4],Sheet1!R8C1:R38C3,3,FALSE)="固定值",RC[5],RC[5]/100&"%") -> 生命+5000 | K521: 4 | L521: =VLOOKUP(INT(MOD(RC[-11],1000)/100),R7C9:R9C10,2,FALSE)*RC[-10]*1000 -> 5000
A522: 3302 | B522: 6 | C522: 120 | D522: =IF(RC2=1,RC[7],R[-1]C&"|"&RC[7]) -> 4|8|4|7|4|25 | E522: =IF(RC2=1,RC[7],R[-1]C&"|"&RC[7]) -> 1000|200|3000|400|5000|600 | F522: 天赋 6 | G522: =VLOOKUP(RC[4],Sheet1!R8C1:R38C3,2,FALSE)&"+"&IF(VLOOKUP(RC[4],Sheet1!R8C1:R38C3,3,FALSE)="固定值",RC[5],RC[5]/100&"%") -> 生命+6% | K522: 25 | L522: =VLOOKUP(INT(MOD(RC[-11],1000)/100),R7C9:R9C10,2,FALSE)*RC[-10]*100 -> 600
A523: 3302 | B523: 7 | C523: 140 | D523: =IF(RC2=1,RC[7],R[-1]C&"|"&RC[7]) -> 4|8|4|7|4|25|4 | E523: =IF(RC2=1,RC[7],R[-1]C&"|"&RC[7]) -> 1000|200|3000|400|5000|600|7000 | F523: 天赋 7 | G523: =VLOOKUP(RC[4],Sheet1!R8C1:R38C3,2,FALSE)&"+"&IF(VLOOKUP(RC[4],Sheet1!R8C1:R38C3,3,FALSE)="固定值",RC[5],RC[5]/100&"%") -> 生命+7000 | K523: 4 | L523: =VLOOKUP(INT(MOD(RC[-11],1000)/100),R7C9:R9C10,2,FALSE)*RC[-10]*1000 -> 7000
A524: 3302 | B524: 8 | C524: 160 | D524: =IF(RC2=1,RC[7],R[-1]C&"|"&RC[7]) -> 4|8|4|7|4|25|4|11 | E524: =IF(RC2=1,RC[7],R[-1]C&"|"&RC[7]) -> 1000|200|3000|400|5000|600|7000|800 | F524: 天赋 8 | G524: =VLOOKUP(RC[4],Sheet1!R8C1:R38C3,2,FALSE)&"+"&IF(VLOOKUP(RC[4],Sheet1!R8C1:R38C3,3,FALSE)="固定值",RC[5],RC[5]/100&"%") -> 命中+8% | K524: 11 | L524: =VLOOKUP(INT(MOD(RC[-11],1000)/100),R7C9:R9C10,2,FALSE)*RC[-10]*100 -> 800
A525: 3302 | B525: 9 | C525: 180 | D525: =IF(RC2=1,RC[7],R[-1]C&"|"&RC[7]) -> 4|8|4|7|4|25|4|11|4 | E525: =IF(RC2=1,RC[7],R[-1]C&"|"&RC[7]) -> 1000|200|3000|400|5000|600|7000|800|9000 | F525: 天赋 9 | G525: =VLOOKUP(RC[4],Sheet1!R8C1:R38C3,2,FALSE)&"+"&IF(VLOOKUP(RC[4],Sheet1!R8C1:R38C3,3,FALSE)="固定值",RC[5],RC[5]/100&"%") -> 生命+9000 | K525: 4 | L525: =VLOOKUP(INT(MOD(RC[-11],1000)/100),R7C9:R9C10,2,FALSE)*RC[-10]*1000 -> 9000
A526: 3302 | B526: 10 | C526: 200 | D526: =IF(RC2=1,RC[7],R[-1]C&"|"&RC[7]) -> 4|8|4|7|4|25|4|11|4|25 | E526: =IF(RC2=1,RC[7],R[-1]C&"|"&RC[7]) -> 1000|200|3000|400|5000|600|7000|800|9000|1000 | F526: 天赋 10 | G526: =VLOOKUP(RC[4],Sheet1!R8C1:R38C3,2,FALSE)&"+"&IF(VLOOKUP(RC[4],Sheet1!R8C1:R38C3,3,FALSE)="固定值",RC[5],RC[5]/100&"%") -> 生命+10% | K526: 25 | L526: =VLOOKUP(INT(MOD(RC[-11],1000)/100),R7C9:R9C10,2,FALSE)*RC[-10]*100 -> 1000
A527: 3303 | B527: 1 | C527: 20 | D527: =IF(RC2=1,RC[7],R[-1]C&"|"&RC[7]) -> 4 | E527: =IF(RC2=1,RC[7],R[-1]C&"|"&RC[7]) -> 1000 | F527: 天赋 1 | G527: =VLOOKUP(RC[4],Sheet1!R8C1:R38C3,2,FALSE)&"+"&IF(VLOOKUP(RC[4],Sheet1!R8C1:R38C3,3,FALSE)="固定值",RC[5],RC[5]/100&"%") -> 生命+1000 | K527: 4 | L527: =VLOOKUP(INT(MOD(RC[-11],1000)/100),R7C9:R9C10,2,FALSE)*RC[-10]*1000 -> 1000
A528: 3303 | B528: 2 | C528: 40 | D528: =IF(RC2=1,RC[7],R[-1]C&"|"&RC[7]) -> 4|8 | E528: =IF(RC2=1,RC[7],R[-1]C&"|"&RC[7]) -> 1000|200 | F528: 天赋 2 | G528: =VLOOKUP(RC[4],Sheet1!R8C1:R38C3,2,FALSE)&"+"&IF(VLOOKUP(RC[4],Sheet1!R8C1:R38C3,3,FALSE)="固定值",RC[5],RC[5]/100&"%") -> 附伤+200 | K528: 8 | L528: =VLOOKUP(INT(MOD(RC[-11],1000)/100),R7C9:R9C10,2,FALSE)*RC[-10]*100 -> 200
A529: 3303 | B529: 3 | C529: 60 | D529: =IF(RC2=1,RC[7],R[-1]C&"|"&RC[7]) -> 4|8|4 | E529: =IF(RC2=1,RC[7],R[-1]C&"|"&RC[7]) -> 1000|200|3000 | F529: 天赋 3 | G529: =VLOOKUP(RC[4],Sheet1!R8C1:R38C3,2,FALSE)&"+"&IF(VLOOKUP(RC[4],Sheet1!R8C1:R38C3,3,FALSE)="固定值",RC[5],RC[5]/100&"%") -> 生命+3000 | K529: 4 | L529: =VLOOKUP(INT(MOD(RC[-11],1000)/100),R7C9:R9C10,2,FALSE)*RC[-10]*1000 -> 3000
A530: 3303 | B530: 4 | C530: 80 | D530: =IF(RC2=1,RC[7],R[-1]C&"|"&RC[7]) -> 4|8|4|7 | E530: =IF(RC2=1,RC[7],R[-1]C&"|"&RC[7]) -> 1000|200|3000|400 | F530: 天赋 4 | G530: =VLOOKUP(RC[4],Sheet1!R8C1:R38C3,2,FALSE)&"+"&IF(VLOOKUP(RC[4],Sheet1!R8C1:R38C3,3,FALSE)="固定值",RC[5],RC[5]/100&"%") -> 伤害+4% | K530: 7 | L530: =VLOOKUP(INT(MOD(RC[-11],1000)/100),R7C9:R9C10,2,FALSE)*RC[-10]*100 -> 400
A531: 3303 | B531: 5 | C531: 100 | D531: =IF(RC2=1,RC[7],R[-1]C&"|"&RC[7]) -> 4|8|4|7|4 | E531: =IF(RC2=1,RC[7],R[-1]C&"|"&RC[7]) -> 1000|200|3000|400|5000 | F531: 天赋 5 | G531: =VLOOKUP(RC[4],Sheet1!R8C1:R38C3,2,FALSE)&"+"&IF(VLOOKUP(RC[4],Sheet1!R8C1:R38C3,3,FALSE)="固定值",RC[5],RC[5]/100&"%") -> 生命+5000 | K531: 4 | L531: =VLOOKUP(INT(MOD(RC[-11],1000)/100),R7C9:R9C10,2,FALSE)*RC[-10]*1000 -> 5000
A532: 3303 | B532: 6 | C532: 120 | D532: =IF(RC2=1,RC[7],R[-1]C&"|"&RC[7]) -> 4|8|4|7|4|25 | E532: =IF(RC2=1,RC[7],R[-1]C&"|"&RC[7]) -> 1000|200|3000|400|5000|600 | F532: 天赋 6 | G532: =VLOOKUP(RC[4],Sheet1!R8C1:R38C3,2,FALSE)&"+"&IF(VLOOKUP(RC[4],Sheet1!R8C1:R38C3,3,FALSE)="固定值",RC[5],RC[5]/100&"%") -> 生命+6% | K532: 25 | L532: =VLOOKUP(INT(MOD(RC[-11],1000)/100),R7C9:R9C10,2,FALSE)*RC[-10]*100 -> 600
A533: 3303 | B533: 7 | C533: 140 | D533: =IF(RC2=1,RC[7],R[-1]C&"|"&RC[7]) -> 4|8|4|7|4|25|4 | E533: =IF(RC2=1,RC[7],R[-1]C&"|"&RC[7]) -> 1000|200|3000|400|5000|600|7000 | F533: 天赋 7 | G533: =VLOOKUP(RC[4],Sheet1!R8C1:R38C3,2,FALSE)&"+"&IF(VLOOKUP(RC[4],Sheet1!R8C1:R38C3,3,FALSE)="固定值",RC[5],RC[5]/100&"%") -> 生命+7000 | K533: 4 | L533: =VLOOKUP(INT(MOD(RC[-11],1000)/100),R7C9:R9C10,2,FALSE)*RC[-10]*1000 -> 7000
A534: 3303 | B534: 8 | C534: 160 | D534: =IF(RC2=1,RC[7],R[-1]C&"|"&RC[7]) -> 4|8|4|7|4|25|4|11 | E534: =IF(RC2=1,RC[7],R[-1]C&"|"&RC[7]) -> 1000|200|3000|400|5000|600|7000|800 | F534: 天赋 8 | G534: =VLOOKUP(RC[4],Sheet1!R8C1:R38C3,2,FALSE)&"+"&IF(VLOOKUP(RC[4],Sheet1!R8C1:R38C3,3,FALSE)="固定值",RC[5],RC[5]/100&"%") -> 命中+8% | K534: 11 | L534: =VLOOKUP(INT(MOD(RC[-11],1000)/100),R7C9:R9C10,2,FALSE)*RC[-10]*100 -> 800
A535: 3303 | B535: 9 | C535: 180 | D535: =IF(RC2=1,RC[7],R[-1]C&"|"&RC[7]) -> 4|8|4|7|4|25|4|11|4 | E535: =IF(RC2=1,RC[7],R[-1]C&"|"&RC[7]) -> 1000|200|3000|400|5000|600|7000|800|9000 | F535: 天赋 9 | G535: =VLOOKUP(RC[4],Sheet1!R8C1:R38C3,2,FALSE)&"+"&IF(VLOOKUP(RC[4],Sheet1!R8C1:R38C3,3,FALSE)="固定值",RC[5],RC[5]/100&"%") -> 生命+9000 | K535: 4 | L535: =VLOOKUP(INT(MOD(RC[-11],1000)/100),R7C9:R9C10,2,FALSE)*RC[-10]*1000 -> 9000
A536: 3303 | B536: 10 | C536: 200 | D536: =IF(RC2=1,RC[7],R[-1]C&"|"&RC[7]) -> 4|8|4|7|4|25|4|11|4|25 | E536: =IF(RC2=1,RC[7],R[-1]C&"|"&RC[7]) -> 1000|200|3000|400|5000|600|7000|800|9000|1000 | F536: 天赋 10 | G536: =VLOOKUP(RC[4],Sheet1!R8C1:R38C3,2,FALSE)&"+"&IF(VLOOKUP(RC[4],Sheet1!R8C1:R38C3,3,FALSE)="固定值",RC[5],RC[5]/100&"%") -> 生命+10% | K536: 25 | L536: =VLOOKUP(INT(MOD(RC[-11],1000)/100),R7C9:R9C10,2,FALSE)*RC[-10]*100 -> 1000
A537: 3304 | B537: 1 | C537: 20 | D537: =IF(RC2=1,RC[7],R[-1]C&"|"&RC[7]) -> 4 | E537: =IF(RC2=1,RC[7],R[-1]C&"|"&RC[7]) -> 1000 | F537: 天赋 1 | G537: =VLOOKUP(RC[4],Sheet1!R8C1:R38C3,2,FALSE)&"+"&IF(VLOOKUP(RC[4],Sheet1!R8C1:R38C3,3,FALSE)="固定值",RC[5],RC[5]/100&"%") -> 生命+1000 | K537: 4 | L537: =VLOOKUP(INT(MOD(RC[-11],1000)/100),R7C9:R9C10,2,FALSE)*RC[-10]*1000 -> 1000
A538: 3304 | B538: 2 | C538: 40 | D538: =IF(RC2=1,RC[7],R[-1]C&"|"&RC[7]) -> 4|8 | E538: =IF(RC2=1,RC[7],R[-1]C&"|"&RC[7]) -> 1000|200 | F538: 天赋 2 | G538: =VLOOKUP(RC[4],Sheet1!R8C1:R38C3,2,FALSE)&"+"&IF(VLOOKUP(RC[4],Sheet1!R8C1:R38C3,3,FALSE)="固定值",RC[5],RC[5]/100&"%") -> 附伤+200 | K538: 8 | L538: =VLOOKUP(INT(MOD(RC[-11],1000)/100),R7C9:R9C10,2,FALSE)*RC[-10]*100 -> 200
A539: 3304 | B539: 3 | C539: 60 | D539: =IF(RC2=1,RC[7],R[-1]C&"|"&RC[7]) -> 4|8|4 | E539: =IF(RC2=1,RC[7],R[-1]C&"|"&RC[7]) -> 1000|200|3000 | F539: 天赋 3 | G539: =VLOOKUP(RC[4],Sheet1!R8C1:R38C3,2,FALSE)&"+"&IF(VLOOKUP(RC[4],Sheet1!R8C1:R38C3,3,FALSE)="固定值",RC[5],RC[5]/100&"%") -> 生命+3000 | K539: 4 | L539: =VLOOKUP(INT(MOD(RC[-11],1000)/100),R7C9:R9C10,2,FALSE)*RC[-10]*1000 -> 3000
A540: 3304 | B540: 4 | C540: 80 | D540: =IF(RC2=1,RC[7],R[-1]C&"|"&RC[7]) -> 4|8|4|7 | E540: =IF(RC2=1,RC[7],R[-1]C&"|"&RC[7]) -> 1000|200|3000|400 | F540: 天赋 4 | G540: =VLOOKUP(RC[4],Sheet1!R8C1:R38C3,2,FALSE)&"+"&IF(VLOOKUP(RC[4],Sheet1!R8C1:R38C3,3,FALSE)="固定值",RC[5],RC[5]/100&"%") -> 伤害+4% | K540: 7 | L540: =VLOOKUP(INT(MOD(RC[-11],1000)/100),R7C9:R9C10,2,FALSE)*RC[-10]*100 -> 400
A541: 3304 | B541: 5 | C541: 100 | D541: =IF(RC2=1,RC[7],R[-1]C&"|"&RC[7]) -> 4|8|4|7|4 | E541: =IF(RC2=1,RC[7],R[-1]C&"|"&RC[7]) -> 1000|200|3000|400|5000 | F541: 天赋 5 | G541: =VLOOKUP(RC[4],Sheet1!R8C1:R38C3,2,FALSE)&"+"&IF(VLOOKUP(RC[4],Sheet1!R8C1:R38C3,3,FALSE)="固定值",RC[5],RC[5]/100&"%") -> 生命+5000 | K541: 4 | L541: =VLOOKUP(INT(MOD(RC[-11],1000)/100),R7C9:R9C10,2,FALSE)*RC[-10]*1000 -> 5000
A542: 3304 | B542: 6 | C542: 120 | D542: =IF(RC2=1,RC[7],R[-1]C&"|"&RC[7]) -> 4|8|4|7|4|25 | E542: =IF(RC2=1,RC[7],R[-1]C&"|"&RC[7]) -> 1000|200|3000|400|5000|600 | F542: 天赋 6 | G542: =VLOOKUP(RC[4],Sheet1!R8C1:R38C3,2,FALSE)&"+"&IF(VLOOKUP(RC[4],Sheet1!R8C1:R38C3,3,FALSE)="固定值",RC[5],RC[5]/100&"%") -> 生命+6% | K542: 25 | L542: =VLOOKUP(INT(MOD(RC[-11],1000)/100),R7C9:R9C10,2,FALSE)*RC[-10]*100 -> 600
A543: 3304 | B543: 7 | C543: 140 | D543: =IF(RC2=1,RC[7],R[-1]C&"|"&RC[7]) -> 4|8|4|7|4|25|4 | E543: =IF(RC2=1,RC[7],R[-1]C&"|"&RC[7]) -> 1000|200|3000|400|5000|600|7000 | F543: 天赋 7 | G543: =VLOOKUP(RC[4],Sheet1!R8C1:R38C3,2,FALSE)&"+"&IF(VLOOKUP(RC[4],Sheet1!R8C1:R38C3,3,FALSE)="固定值",RC[5],RC[5]/100&"%") -> 生命+7000 | K543: 4 | L543: =VLOOKUP(INT(MOD(RC[-11],1000)/100),R7C9:R9C10,2,FALSE)*RC[-10]*1000 -> 7000
A544: 3304 | B544: 8 | C544: 160 | D544: =IF(RC2=1,RC[7],R[-1]C&"|"&RC[7]) -> 4|8|4|7|4|25|4|11 | E544: =IF(RC2=1,RC[7],R[-1]C&"|"&RC[7]) -> 1000|200|3000|400|5000|600|7000|800 | F544: 天赋 8 | G544: =VLOOKUP(RC[4],Sheet1!R8C1:R38C3,2,FALSE)&"+"&IF(VLOOKUP(RC[4],Sheet1!R8C1:R38C3,3,FALSE)="固定值",RC[5],RC[5]/100&"%") -> 命中+8% | K544: 11 | L544: =VLOOKUP(INT(MOD(RC[-11],1000)/100),R7C9:R9C10,2,FALSE)*RC[-10]*100 -> 800
A545: 3304 | B545: 9 | C545: 180 | D545: =IF(RC2=1,RC[7],R[-1]C&"|"&RC[7]) -> 4|8|4|7|4|25|4|11|4 | E545: =IF(RC2=1,RC[7],R[-1]C&"|"&RC[7]) -> 1000|200|3000|400|5000|600|7000|800|9000 | F545: 天赋 9 | G545: =VLOOKUP(RC[4],Sheet1!R8C1:R38C3,2,FALSE)&"+"&IF(VLOOKUP(RC[4],Sheet1!R8C1:R38C3,3,FALSE)="固定值",RC[5],RC[5]/100&"%") -> 生命+9000 | K545: 4 | L545: =VLOOKUP(INT(MOD(RC[-11],1000)/100),R7C9:R9C10,2,FALSE)*RC[-10]*1000 -> 9000
A546: 3304 | B546: 10 | C546: 200 | D546: =IF(RC2=1,RC[7],R[-1]C&"|"&RC[7]) -> 4|8|4|7|4|25|4|11|4|25 | E546: =IF(RC2=1,RC[7],R[-1]C&"|"&RC[7]) -> 1000|200|3000|400|5000|600|7000|800|9000|1000 | F546: 天赋 10 | G546: =VLOOKUP(RC[4],Sheet1!R8C1:R38C3,2,FALSE)&"+"&IF(VLOOKUP(RC[4],Sheet1!R8C1:R38C3,3,FALSE)="固定值",RC[5],RC[5]/100&"%") -> 生命+10% | K546: 25 | L546: =VLOOKUP(INT(MOD(RC[-11],1000)/100),R7C9:R9C10,2,FALSE)*RC[-10]*100 -> 1000
A547: 3305 | B547: 1 | C547: 20 | D547: =IF(RC2=1,RC[7],R[-1]C&"|"&RC[7]) -> 4 | E547: =IF(RC2=1,RC[7],R[-1]C&"|"&RC[7]) -> 1000 | F547: 天赋 1 | G547: =VLOOKUP(RC[4],Sheet1!R8C1:R38C3,2,FALSE)&"+"&IF(VLOOKUP(RC[4],Sheet1!R8C1:R38C3,3,FALSE)="固定值",RC[5],RC[5]/100&"%") -> 生命+1000 | K547: 4 | L547: =VLOOKUP(INT(MOD(RC[-11],1000)/100),R7C9:R9C10,2,FALSE)*RC[-10]*1000 -> 1000
A548: 3305 | B548: 2 | C548: 40 | D548: =IF(RC2=1,RC[7],R[-1]C&"|"&RC[7]) -> 4|8 | E548: =IF(RC2=1,RC[7],R[-1]C&"|"&RC[7]) -> 1000|200 | F548: 天赋 2 | G548: =VLOOKUP(RC[4],Sheet1!R8C1:R38C3,2,FALSE)&"+"&IF(VLOOKUP(RC[4],Sheet1!R8C1:R38C3,3,FALSE)="固定值",RC[5],RC[5]/100&"%") -> 附伤+200 | K548: 8 | L548: =VLOOKUP(INT(MOD(RC[-11],1000)/100),R7C9:R9C10,2,FALSE)*RC[-10]*100 -> 200
A549: 3305 | B549: 3 | C549: 60 | D549: =IF(RC2=1,RC[7],R[-1]C&"|"&RC[7]) -> 4|8|4 | E549: =IF(RC2=1,RC[7],R[-1]C&"|"&RC[7]) -> 1000|200|3000 | F549: 天赋 3 | G549: =VLOOKUP(RC[4],Sheet1!R8C1:R38C3,2,FALSE)&"+"&IF(VLOOKUP(RC[4],Sheet1!R8C1:R38C3,3,FALSE)="固定值",RC[5],RC[5]/100&"%") -> 生命+3000 | K549: 4 | L549: =VLOOKUP(INT(MOD(RC[-11],1000)/100),R7C9:R9C10,2,FALSE)*RC[-10]*1000 -> 3000
A550: 3305 | B550: 4 | C550: 80 | D550: =IF(RC2=1,RC[7],R[-1]C&"|"&RC[7]) -> 4|8|4|7 | E550: =IF(RC2=1,RC[7],R[-1]C&"|"&RC[7]) -> 1000|200|3000|400 | F550: 天赋 4 | G550: =VLOOKUP(RC[4],Sheet1!R8C1:R38C3,2,FALSE)&"+"&IF(VLOOKUP(RC[4],Sheet1!R8C1:R38C3,3,FALSE)="固定值",RC[5],RC[5]/100&"%") -> 伤害+4% | K550: 7 | L550: =VLOOKUP(INT(MOD(RC[-11],1000)/100),R7C9:R9C10,2,FALSE)*RC[-10]*100 -> 400
A551: 3305 | B551: 5 | C551: 100 | D551: =IF(RC2=1,RC[7],R[-1]C&"|"&RC[7]) -> 4|8|4|7|4 | E551: =IF(RC2=1,RC[7],R[-1]C&"|"&RC[7]) -> 1000|200|3000|400|5000 | F551: 天赋 5 | G551: =VLOOKUP(RC[4],Sheet1!R8C1:R38C3,2,FALSE)&"+"&IF(VLOOKUP(RC[4],Sheet1!R8C1:R38C3,3,FALSE)="固定值",RC[5],RC[5]/100&"%") -> 生命+5000 | K551: 4 | L551: =VLOOKUP(INT(MOD(RC[-11],1000)/100),R7C9:R9C10,2,FALSE)*RC[-10]*1000 -> 5000
A552: 3305 | B552: 6 | C552: 120 | D552: =IF(RC2=1,RC[7],R[-1]C&"|"&RC[7]) -> 4|8|4|7|4|25 | E552: =IF(RC2=1,RC[7],R[-1]C&"|"&RC[7]) -> 1000|200|3000|400|5000|600 | F552: 天赋 6 | G552: =VLOOKUP(RC[4],Sheet1!R8C1:R38C3,2,FALSE)&"+"&IF(VLOOKUP(RC[4],Sheet1!R8C1:R38C3,3,FALSE)="固定值",RC[5],RC[5]/100&"%") -> 生命+6% | K552: 25 | L552: =VLOOKUP(INT(MOD(RC[-11],1000)/100),R7C9:R9C10,2,FALSE)*RC[-10]*100 -> 600
A553: 3305 | B553: 7 | C553: 140 | D553: =IF(RC2=1,RC[7],R[-1]C&"|"&RC[7]) -> 4|8|4|7|4|25|4 | E553: =IF(RC2=1,RC[7],R[-1]C&"|"&RC[7]) -> 1000|200|3000|400|5000|600|7000 | F553: 天赋 7 | G553: =VLOOKUP(RC[4],Sheet1!R8C1:R38C3,2,FALSE)&"+"&IF(VLOOKUP(RC[4],Sheet1!R8C1:R38C3,3,FALSE)="固定值",RC[5],RC[5]/100&"%") -> 生命+7000 | K553: 4 | L553: =VLOOKUP(INT(MOD(RC[-11],1000)/100),R7C9:R9C10,2,FALSE)*RC[-10]*1000 -> 7000
A554: 3305 | B554: 8 | C554: 160 | D554: =IF(RC2=1,RC[7],R[-1]C&"|"&RC[7]) -> 4|8|4|7|4|25|4|11 | E554: =IF(RC2=1,RC[7],R[-1]C&"|"&RC[7]) -> 1000|200|3000|400|5000|600|7000|800 | F554: 天赋 8 | G554: =VLOOKUP(RC[4],Sheet1!R8C1:R38C3,2,FALSE)&"+"&IF(VLOOKUP(RC[4],Sheet1!R8C1:R38C3,3,FALSE)="固定值",RC[5],RC[5]/100&"%") -> 命中+8% | K554: 11 | L554: =VLOOKUP(INT(MOD(RC[-11],1000)/100),R7C9:R9C10,2,FALSE)*RC[-10]*100 -> 800
A555: 3305 | B555: 9 | C555: 180 | D555: =IF(RC2=1,RC[7],R[-1]C&"|"&RC[7]) -> 4|8|4|7|4|25|4|11|4 | E555: =IF(RC2=1,RC[7],R[-1]C&"|"&RC[7]) -> 1000|200|3000|400|5000|600|7000|800|9000 | F555: 天赋 9 | G555: =VLOOKUP(RC[4],Sheet1!R8C1:R38C3,2,FALSE)&"+"&IF(VLOOKUP(RC[4],Sheet1!R8C1:R38C3,3,FALSE)="固定值",RC[5],RC[5]/100&"%") -> 生命+9000 | K555: 4 | L555: =VLOOKUP(INT(MOD(RC[-11],1000)/100),R7C9:R9C10,2,FALSE)*RC[-10]*1000 -> 9000
A556: 3305 | B556: 10 | C556: 200 | D556: =IF(RC2=1,RC[7],R[-1]C&"|"&RC[7]) -> 4|8|4|7|4|25|4|11|4|25 | E556: =IF(RC2=1,RC[7],R[-1]C&"|"&RC[7]) -> 1000|200|3000|400|5000|600|7000|800|9000|1000 | F556: 天赋 10 | G556: =VLOOKUP(RC[4],Sheet1!R8C1:R38C3,2,FALSE)&"+"&IF(VLOOKUP(RC[4],Sheet1!R8C1:R38C3,3,FALSE)="固定值",RC[5],RC[5]/100&"%") -> 生命+10% | K556: 25 | L556: =VLOOKUP(INT(MOD(RC[-11],1000)/100),R7C9:R9C10,2,FALSE)*RC[-10]*100 -> 1000
A557: 3401 | B557: 1 | C557: 20 | D557: =IF(RC2=1,RC[7],R[-11]C&"|"&RC[7]) -> 4 | E557: =IF(RC2=1,RC[7],R[-11]C&"|"&RC[7]) -> 1500 | F557: 天赋 1 | G557: =VLOOKUP(RC[4],Sheet1!R8C1:R38C3,2,FALSE)&"+"&IF(VLOOKUP(RC[4],Sheet1!R8C1:R38C3,3,FALSE)="固定值",RC[5],RC[5]/100&"%") -> 生命+1500 | K557: 4 | L557: =VLOOKUP(INT(MOD(RC[-11],1000)/100),R7C9:R9C10,2,FALSE)*RC[-10]*1000 -> 1500
A558: 3401 | B558: 2 | C558: 40 | D558: =IF(RC2=1,RC[7],R[-1]C&"|"&RC[7]) -> 4|8 | E558: =IF(RC2=1,RC[7],R[-1]C&"|"&RC[7]) -> 1500|300 | F558: 天赋 2 | G558: =VLOOKUP(RC[4],Sheet1!R8C1:R38C3,2,FALSE)&"+"&IF(VLOOKUP(RC[4],Sheet1!R8C1:R38C3,3,FALSE)="固定值",RC[5],RC[5]/100&"%") -> 附伤+300 | K558: 8 | L558: =VLOOKUP(INT(MOD(RC[-11],1000)/100),R7C9:R9C10,2,FALSE)*RC[-10]*100 -> 300
A559: 3401 | B559: 3 | C559: 60 | D559: =IF(RC2=1,RC[7],R[-1]C&"|"&RC[7]) -> 4|8|4 | E559: =IF(RC2=1,RC[7],R[-1]C&"|"&RC[7]) -> 1500|300|4500 | F559: 天赋 3 | G559: =VLOOKUP(RC[4],Sheet1!R8C1:R38C3,2,FALSE)&"+"&IF(VLOOKUP(RC[4],Sheet1!R8C1:R38C3,3,FALSE)="固定值",RC[5],RC[5]/100&"%") -> 生命+4500 | K559: 4 | L559: =VLOOKUP(INT(MOD(RC[-11],1000)/100),R7C9:R9C10,2,FALSE)*RC[-10]*1000 -> 4500
A560: 3401 | B560: 4 | C560: 80 | D560: =IF(RC2=1,RC[7],R[-1]C&"|"&RC[7]) -> 4|8|4|7 | E560: =IF(RC2=1,RC[7],R[-1]C&"|"&RC[7]) -> 1500|300|4500|600 | F560: 天赋 4 | G560: =VLOOKUP(RC[4],Sheet1!R8C1:R38C3,2,FALSE)&"+"&IF(VLOOKUP(RC[4],Sheet1!R8C1:R38C3,3,FALSE)="固定值",RC[5],RC[5]/100&"%") -> 伤害+6% | K560: 7 | L560: =VLOOKUP(INT(MOD(RC[-11],1000)/100),R7C9:R9C10,2,FALSE)*RC[-10]*100 -> 600
A561: 3401 | B561: 5 | C561: 100 | D561: =IF(RC2=1,RC[7],R[-1]C&"|"&RC[7]) -> 4|8|4|7|4 | E561: =IF(RC2=1,RC[7],R[-1]C&"|"&RC[7]) -> 1500|300|4500|600|7500 | F561: 天赋 5 | G561: =VLOOKUP(RC[4],Sheet1!R8C1:R38C3,2,FALSE)&"+"&IF(VLOOKUP(RC[4],Sheet1!R8C1:R38C3,3,FALSE)="固定值",RC[5],RC[5]/100&"%") -> 生命+7500 | K561: 4 | L561: =VLOOKUP(INT(MOD(RC[-11],1000)/100),R7C9:R9C10,2,FALSE)*RC[-10]*1000 -> 7500
A562: 3401 | B562: 6 | C562: 120 | D562: =IF(RC2=1,RC[7],R[-1]C&"|"&RC[7]) -> 4|8|4|7|4|25 | E562: =IF(RC2=1,RC[7],R[-1]C&"|"&RC[7]) -> 1500|300|4500|600|7500|900 | F562: 天赋 6 | G562: =VLOOKUP(RC[4],Sheet1!R8C1:R38C3,2,FALSE)&"+"&IF(VLOOKUP(RC[4],Sheet1!R8C1:R38C3,3,FALSE)="固定值",RC[5],RC[5]/100&"%") -> 生命+9% | K562: 25 | L562: =VLOOKUP(INT(MOD(RC[-11],1000)/100),R7C9:R9C10,2,FALSE)*RC[-10]*100 -> 900
A563: 3401 | B563: 7 | C563: 140 | D563: =IF(RC2=1,RC[7],R[-1]C&"|"&RC[7]) -> 4|8|4|7|4|25|4 | E563: =IF(RC2=1,RC[7],R[-1]C&"|"&RC[7]) -> 1500|300|4500|600|7500|900|10500 | F563: 天赋 7 | G563: =VLOOKUP(RC[4],Sheet1!R8C1:R38C3,2,FALSE)&"+"&IF(VLOOKUP(RC[4],Sheet1!R8C1:R38C3,3,FALSE)="固定值",RC[5],RC[5]/100&"%") -> 生命+10500 | K563: 4 | L563: =VLOOKUP(INT(MOD(RC[-11],1000)/100),R7C9:R9C10,2,FALSE)*RC[-10]*1000 -> 10500
A564: 3401 | B564: 8 | C564: 160 | D564: =IF(RC2=1,RC[7],R[-1]C&"|"&RC[7]) -> 4|8|4|7|4|25|4|11 | E564: =IF(RC2=1,RC[7],R[-1]C&"|"&RC[7]) -> 1500|300|4500|600|7500|900|10500|1200 | F564: 天赋 8 | G564: =VLOOKUP(RC[4],Sheet1!R8C1:R38C3,2,FALSE)&"+"&IF(VLOOKUP(RC[4],Sheet1!R8C1:R38C3,3,FALSE)="固定值",RC[5],RC[5]/100&"%") -> 命中+12% | K564: 11 | L564: =VLOOKUP(INT(MOD(RC[-11],1000)/100),R7C9:R9C10,2,FALSE)*RC[-10]*100 -> 1200
A565: 3401 | B565: 9 | C565: 180 | D565: =IF(RC2=1,RC[7],R[-1]C&"|"&RC[7]) -> 4|8|4|7|4|25|4|11|4 | E565: =IF(RC2=1,RC[7],R[-1]C&"|"&RC[7]) -> 1500|300|4500|600|7500|900|10500|1200|13500 | F565: 天赋 9 | G565: =VLOOKUP(RC[4],Sheet1!R8C1:R38C3,2,FALSE)&"+"&IF(VLOOKUP(RC[4],Sheet1!R8C1:R38C3,3,FALSE)="固定值",RC[5],RC[5]/100&"%") -> 生命+13500 | K565: 4 | L565: =VLOOKUP(INT(MOD(RC[-11],1000)/100),R7C9:R9C10,2,FALSE)*RC[-10]*1000 -> 13500
A566: 3401 | B566: 10 | C566: 200 | D566: =IF(RC2=1,RC[7],R[-1]C&"|"&RC[7]) -> 4|8|4|7|4|25|4|11|4|25 | E566: =IF(RC2=1,RC[7],R[-1]C&"|"&RC[7]) -> 1500|300|4500|600|7500|900|10500|1200|13500|1500 | F566: 天赋 10 | G566: =VLOOKUP(RC[4],Sheet1!R8C1:R38C3,2,FALSE)&"+"&IF(VLOOKUP(RC[4],Sheet1!R8C1:R38C3,3,FALSE)="固定值",RC[5],RC[5]/100&"%") -> 生命+15% | K566: 25 | L566: =VLOOKUP(INT(MOD(RC[-11],1000)/100),R7C9:R9C10,2,FALSE)*RC[-10]*100 -> 1500
A567: 3402 | B567: 1 | C567: 20 | D567: =IF(RC2=1,RC[7],R[-1]C&"|"&RC[7]) -> 4 | E567: =IF(RC2=1,RC[7],R[-1]C&"|"&RC[7]) -> 1500 | F567: 天赋 1 | G567: =VLOOKUP(RC[4],Sheet1!R8C1:R38C3,2,FALSE)&"+"&IF(VLOOKUP(RC[4],Sheet1!R8C1:R38C3,3,FALSE)="固定值",RC[5],RC[5]/100&"%") -> 生命+1500 | K567: 4 | L567: =VLOOKUP(INT(MOD(RC[-11],1000)/100),R7C9:R9C10,2,FALSE)*RC[-10]*1000 -> 1500
A568: 3402 | B568: 2 | C568: 40 | D568: =IF(RC2=1,RC[7],R[-1]C&"|"&RC[7]) -> 4|8 | E568: =IF(RC2=1,RC[7],R[-1]C&"|"&RC[7]) -> 1500|300 | F568: 天赋 2 | G568: =VLOOKUP(RC[4],Sheet1!R8C1:R38C3,2,FALSE)&"+"&IF(VLOOKUP(RC[4],Sheet1!R8C1:R38C3,3,FALSE)="固定值",RC[5],RC[5]/100&"%") -> 附伤+300 | K568: 8 | L568: =VLOOKUP(INT(MOD(RC[-11],1000)/100),R7C9:R9C10,2,FALSE)*RC[-10]*100 -> 300
A569: 3402 | B569: 3 | C569: 60 | D569: =IF(RC2=1,RC[7],R[-1]C&"|"&RC[7]) -> 4|8|4 | E569: =IF(RC2=1,RC[7],R[-1]C&"|"&RC[7]) -> 1500|300|4500 | F569: 天赋 3 | G569: =VLOOKUP(RC[4],Sheet1!R8C1:R38C3,2,FALSE)&"+"&IF(VLOOKUP(RC[4],Sheet1!R8C1:R38C3,3,FALSE)="固定值",RC[5],RC[5]/100&"%") -> 生命+4500 | K569: 4 | L569: =VLOOKUP(INT(MOD(RC[-11],1000)/100),R7C9:R9C10,2,FALSE)*RC[-10]*1000 -> 4500
A570: 3402 | B570: 4 | C570: 80 | D570: =IF(RC2=1,RC[7],R[-1]C&"|"&RC[7]) -> 4|8|4|7 | E570: =IF(RC2=1,RC[7],R[-1]C&"|"&RC[7]) -> 1500|300|4500|600 | F570: 天赋 4 | G570: =VLOOKUP(RC[4],Sheet1!R8C1:R38C3,2,FALSE)&"+"&IF(VLOOKUP(RC[4],Sheet1!R8C1:R38C3,3,FALSE)="固定值",RC[5],RC[5]/100&"%") -> 伤害+6% | K570: 7 | L570: =VLOOKUP(INT(MOD(RC[-11],1000)/100),R7C9:R9C10,2,FALSE)*RC[-10]*100 -> 600
A571: 3402 | B571: 5 | C571: 100 | D571: =IF(RC2=1,RC[7],R[-1]C&"|"&RC[7]) -> 4|8|4|7|4 | E571: =IF(RC2=1,RC[7],R[-1]C&"|"&RC[7]) -> 1500|300|4500|600|7500 | F571: 天赋 5 | G571: =VLOOKUP(RC[4],Sheet1!R8C1:R38C3,2,FALSE)&"+"&IF(VLOOKUP(RC[4],Sheet1!R8C1:R38C3,3,FALSE)="固定值",RC[5],RC[5]/100&"%") -> 生命+7500 | K571: 4 | L571: =VLOOKUP(INT(MOD(RC[-11],1000)/100),R7C9:R9C10,2,FALSE)*RC[-10]*1000 -> 7500
A572: 3402 | B572: 6 | C572: 120 | D572: =IF(RC2=1,RC[7],R[-1]C&"|"&RC[7]) -> 4|8|4|7|4|25 | E572: =IF(RC2=1,RC[7],R[-1]C&"|"&RC[7]) -> 1500|300|4500|600|7500|900 | F572: 天赋 6 | G572: =VLOOKUP(RC[4],Sheet1!R8C1:R38C3,2,FALSE)&"+"&IF(VLOOKUP(RC[4],Sheet1!R8C1:R38C3,3,FALSE)="固定值",RC[5],RC[5]/100&"%") -> 生命+9% | K572: 25 | L572: =VLOOKUP(INT(MOD(RC[-11],1000)/100),R7C9:R9C10,2,FALSE)*RC[-10]*100 -> 900
A573: 3402 | B573: 7 | C573: 140 | D573: =IF(RC2=1,RC[7],R[-1]C&"|"&RC[7]) -> 4|8|4|7|4|25|4 | E573: =IF(RC2=1,RC[7],R[-1]C&"|"&RC[7]) -> 1500|300|4500|600|7500|900|10500 | F573: 天赋 7 | G573: =VLOOKUP(RC[4],Sheet1!R8C1:R38C3,2,FALSE)&"+"&IF(VLOOKUP(RC[4],Sheet1!R8C1:R38C3,3,FALSE)="固定值",RC[5],RC[5]/100&"%") -> 生命+10500 | K573: 4 | L573: =VLOOKUP(INT(MOD(RC[-11],1000)/100),R7C9:R9C10,2,FALSE)*RC[-10]*1000 -> 10500
A574: 3402 | B574: 8 | C574: 160 | D574: =IF(RC2=1,RC[7],R[-1]C&"|"&RC[7]) -> 4|8|4|7|4|25|4|11 | E574: =IF(RC2=1,RC[7],R[-1]C&"|"&RC[7]) -> 1500|300|4500|600|7500|900|10500|1200 | F574: 天赋 8 | G574: =VLOOKUP(RC[4],Sheet1!R8C1:R38C3,2,FALSE)&"+"&IF(VLOOKUP(RC[4],Sheet1!R8C1:R38C3,3,FALSE)="固定值",RC[5],RC[5]/100&"%") -> 命中+12% | K574: 11 | L574: =VLOOKUP(INT(MOD(RC[-11],1000)/100),R7C9:R9C10,2,FALSE)*RC[-10]*100 -> 1200
A575: 3402 | B575: 9 | C575: 180 | D575: =IF(RC2=1,RC[7],R[-1]C&"|"&RC[7]) -> 4|8|4|7|4|25|4|11|4 | E575: =IF(RC2=1,RC[7],R[-1]C&"|"&RC[7]) -> 1500|300|4500|600|7500|900|10500|1200|13500 | F575: 天赋 9 | G575: =VLOOKUP(RC[4],Sheet1!R8C1:R38C3,2,FALSE)&"+"&IF(VLOOKUP(RC[4],Sheet1!R8C1:R38C3,3,FALSE)="固定值",RC[5],RC[5]/100&"%") -> 生命+13500 | K575: 4 | L575: =VLOOKUP(INT(MOD(RC[-11],1000)/100),R7C9:R9C10,2,FALSE)*RC[-10]*1000 -> 13500
A576: 3402 | B576: 10 | C576: 200 | D576: =IF(RC2=1,RC[7],R[-1]C&"|"&RC[7]) -> 4|8|4|7|4|25|4|11|4|25 | E576: =IF(RC2=1,RC[7],R[-1]C&"|"&RC[7]) -> 1500|300|4500|600|7500|900|10500|1200|13500|1500 | F576: 天赋 10 | G576: =VLOOKUP(RC[4],Sheet1!R8C1:R38C3,2,FALSE)&"+"&IF(VLOOKUP(RC[4],Sheet1!R8C1:R38C3,3,FALSE)="固定值",RC[5],RC[5]/100&"%") -> 生命+15% | K576: 25 | L576: =VLOOKUP(INT(MOD(RC[-11],1000)/100),R7C9:R9C10,2,FALSE)*RC[-10]*100 -> 1500
A577: 3403 | B577: 1 | C577: 20 | D577: =IF(RC2=1,RC[7],R[-1]C&"|"&RC[7]) -> 4 | E577: =IF(RC2=1,RC[7],R[-1]C&"|"&RC[7]) -> 1500 | F577: 天赋 1 | G577: =VLOOKUP(RC[4],Sheet1!R8C1:R38C3,2,FALSE)&"+"&IF(VLOOKUP(RC[4],Sheet1!R8C1:R38C3,3,FALSE)="固定值",RC[5],RC[5]/100&"%") -> 生命+1500 | K577: 4 | L577: =VLOOKUP(INT(MOD(RC[-11],1000)/100),R7C9:R9C10,2,FALSE)*RC[-10]*1000 -> 1500
A578: 3403 | B578: 2 | C578: 40 | D578: =IF(RC2=1,RC[7],R[-1]C&"|"&RC[7]) -> 4|8 | E578: =IF(RC2=1,RC[7],R[-1]C&"|"&RC[7]) -> 1500|300 | F578: 天赋 2 | G578: =VLOOKUP(RC[4],Sheet1!R8C1:R38C3,2,FALSE)&"+"&IF(VLOOKUP(RC[4],Sheet1!R8C1:R38C3,3,FALSE)="固定值",RC[5],RC[5]/100&"%") -> 附伤+300 | K578: 8 | L578: =VLOOKUP(INT(MOD(RC[-11],1000)/100),R7C9:R9C10,2,FALSE)*RC[-10]*100 -> 300
A579: 3403 | B579: 3 | C579: 60 | D579: =IF(RC2=1,RC[7],R[-1]C&"|"&RC[7]) -> 4|8|4 | E579: =IF(RC2=1,RC[7],R[-1]C&"|"&RC[7]) -> 1500|300|4500 | F579: 天赋 3 | G579: =VLOOKUP(RC[4],Sheet1!R8C1:R38C3,2,FALSE)&"+"&IF(VLOOKUP(RC[4],Sheet1!R8C1:R38C3,3,FALSE)="固定值",RC[5],RC[5]/100&"%") -> 生命+4500 | K579: 4 | L579: =VLOOKUP(INT(MOD(RC[-11],1000)/100),R7C9:R9C10,2,FALSE)*RC[-10]*1000 -> 4500
A580: 3403 | B580: 4 | C580: 80 | D580: =IF(RC2=1,RC[7],R[-1]C&"|"&RC[7]) -> 4|8|4|7 | E580: =IF(RC2=1,RC[7],R[-1]C&"|"&RC[7]) -> 1500|300|4500|600 | F580: 天赋 4 | G580: =VLOOKUP(RC[4],Sheet1!R8C1:R38C3,2,FALSE)&"+"&IF(VLOOKUP(RC[4],Sheet1!R8C1:R38C3,3,FALSE)="固定值",RC[5],RC[5]/100&"%") -> 伤害+6% | K580: 7 | L580: =VLOOKUP(INT(MOD(RC[-11],1000)/100),R7C9:R9C10,2,FALSE)*RC[-10]*100 -> 600
A581: 3403 | B581: 5 | C581: 100 | D581: =IF(RC2=1,RC[7],R[-1]C&"|"&RC[7]) -> 4|8|4|7|4 | E581: =IF(RC2=1,RC[7],R[-1]C&"|"&RC[7]) -> 1500|300|4500|600|7500 | F581: 天赋 5 | G581: =VLOOKUP(RC[4],Sheet1!R8C1:R38C3,2,FALSE)&"+"&IF(VLOOKUP(RC[4],Sheet1!R8C1:R38C3,3,FALSE)="固定值",RC[5],RC[5]/100&"%") -> 生命+7500 | K581: 4 | L581: =VLOOKUP(INT(MOD(RC[-11],1000)/100),R7C9:R9C10,2,FALSE)*RC[-10]*1000 -> 7500
A582: 3403 | B582: 6 | C582: 120 | D582: =IF(RC2=1,RC[7],R[-1]C&"|"&RC[7]) -> 4|8|4|7|4|25 | E582: =IF(RC2=1,RC[7],R[-1]C&"|"&RC[7]) -> 1500|300|4500|600|7500|900 | F582: 天赋 6 | G582: =VLOOKUP(RC[4],Sheet1!R8C1:R38C3,2,FALSE)&"+"&IF(VLOOKUP(RC[4],Sheet1!R8C1:R38C3,3,FALSE)="固定值",RC[5],RC[5]/100&"%") -> 生命+9% | K582: 25 | L582: =VLOOKUP(INT(MOD(RC[-11],1000)/100),R7C9:R9C10,2,FALSE)*RC[-10]*100 -> 900
A583: 3403 | B583: 7 | C583: 140 | D583: =IF(RC2=1,RC[7],R[-1]C&"|"&RC[7]) -> 4|8|4|7|4|25|4 | E583: =IF(RC2=1,RC[7],R[-1]C&"|"&RC[7]) -> 1500|300|4500|600|7500|900|10500 | F583: 天赋 7 | G583: =VLOOKUP(RC[4],Sheet1!R8C1:R38C3,2,FALSE)&"+"&IF(VLOOKUP(RC[4],Sheet1!R8C1:R38C3,3,FALSE)="固定值",RC[5],RC[5]/100&"%") -> 生命+10500 | K583: 4 | L583: =VLOOKUP(INT(MOD(RC[-11],1000)/100),R7C9:R9C10,2,FALSE)*RC[-10]*1000 -> 10500
A584: 3403 | B584: 8 | C584: 160 | D584: =IF(RC2=1,RC[7],R[-1]C&"|"&RC[7]) -> 4|8|4|7|4|25|4|11 | E584: =IF(RC2=1,RC[7],R[-1]C&"|"&RC[7]) -> 1500|300|4500|600|7500|900|10500|1200 | F584: 天赋 8 | G584: =VLOOKUP(RC[4],Sheet1!R8C1:R38C3,2,FALSE)&"+"&IF(VLOOKUP(RC[4],Sheet1!R8C1:R38C3,3,FALSE)="固定值",RC[5],RC[5]/100&"%") -> 命中+12% | K584: 11 | L584: =VLOOKUP(INT(MOD(RC[-11],1000)/100),R7C9:R9C10,2,FALSE)*RC[-10]*100 -> 1200
A585: 3403 | B585: 9 | C585: 180 | D585: =IF(RC2=1,RC[7],R[-1]C&"|"&RC[7]) -> 4|8|4|7|4|25|4|11|4 | E585: =IF(RC2=1,RC[7],R[-1]C&"|"&RC[7]) -> 1500|300|4500|600|7500|900|10500|1200|13500 | F585: 天赋 9 | G585: =VLOOKUP(RC[4],Sheet1!R8C1:R38C3,2,FALSE)&"+"&IF(VLOOKUP(RC[4],Sheet1!R8C1:R38C3,3,FALSE)="固定值",RC[5],RC[5]/100&"%") -> 生命+13500 | K585: 4 | L585: =VLOOKUP(INT(MOD(RC[-11],1000)/100),R7C9:R9C10,2,FALSE)*RC[-10]*1000 -> 13500
A586: 3403 | B586: 10 | C586: 200 | D586: =IF(RC2=1,RC[7],R[-1]C&"|"&RC[7]) -> 4|8|4|7|4|25|4|11|4|25 | E586: =IF(RC2=1,RC[7],R[-1]C&"|"&RC[7]) -> 1500|300|4500|600|7500|900|10500|1200|13500|1500 | F586: 天赋 10 | G586: =VLOOKUP(RC[4],Sheet1!R8C1:R38C3,2,FALSE)&"+"&IF(VLOOKUP(RC[4],Sheet1!R8C1:R38C3,3,FALSE)="固定值",RC[5],RC[5]/100&"%") -> 生命+15% | K586: 25 | L586: =VLOOKUP(INT(MOD(RC[-11],1000)/100),R7C9:R9C10,2,FALSE)*RC[-10]*100 -> 1500
A587: 3404 | B587: 1 | C587: 20 | D587: =IF(RC2=1,RC[7],R[-1]C&"|"&RC[7]) -> 4 | E587: =IF(RC2=1,RC[7],R[-1]C&"|"&RC[7]) -> 1500 | F587: 天赋 1 | G587: =VLOOKUP(RC[4],Sheet1!R8C1:R38C3,2,FALSE)&"+"&IF(VLOOKUP(RC[4],Sheet1!R8C1:R38C3,3,FALSE)="固定值",RC[5],RC[5]/100&"%") -> 生命+1500 | K587: 4 | L587: =VLOOKUP(INT(MOD(RC[-11],1000)/100),R7C9:R9C10,2,FALSE)*RC[-10]*1000 -> 1500
A588: 3404 | B588: 2 | C588: 40 | D588: =IF(RC2=1,RC[7],R[-1]C&"|"&RC[7]) -> 4|8 | E588: =IF(RC2=1,RC[7],R[-1]C&"|"&RC[7]) -> 1500|300 | F588: 天赋 2 | G588: =VLOOKUP(RC[4],Sheet1!R8C1:R38C3,2,FALSE)&"+"&IF(VLOOKUP(RC[4],Sheet1!R8C1:R38C3,3,FALSE)="固定值",RC[5],RC[5]/100&"%") -> 附伤+300 | K588: 8 | L588: =VLOOKUP(INT(MOD(RC[-11],1000)/100),R7C9:R9C10,2,FALSE)*RC[-10]*100 -> 300
A589: 3404 | B589: 3 | C589: 60 | D589: =IF(RC2=1,RC[7],R[-1]C&"|"&RC[7]) -> 4|8|4 | E589: =IF(RC2=1,RC[7],R[-1]C&"|"&RC[7]) -> 1500|300|4500 | F589: 天赋 3 | G589: =VLOOKUP(RC[4],Sheet1!R8C1:R38C3,2,FALSE)&"+"&IF(VLOOKUP(RC[4],Sheet1!R8C1:R38C3,3,FALSE)="固定值",RC[5],RC[5]/100&"%") -> 生命+4500 | K589: 4 | L589: =VLOOKUP(INT(MOD(RC[-11],1000)/100),R7C9:R9C10,2,FALSE)*RC[-10]*1000 -> 4500
A590: 3404 | B590: 4 | C590: 80 | D590: =IF(RC2=1,RC[7],R[-1]C&"|"&RC[7]) -> 4|8|4|7 | E590: =IF(RC2=1,RC[7],R[-1]C&"|"&RC[7]) -> 1500|300|4500|600 | F590: 天赋 4 | G590: =VLOOKUP(RC[4],Sheet1!R8C1:R38C3,2,FALSE)&"+"&IF(VLOOKUP(RC[4],Sheet1!R8C1:R38C3,3,FALSE)="固定值",RC[5],RC[5]/100&"%") -> 伤害+6% | K590: 7 | L590: =VLOOKUP(INT(MOD(RC[-11],1000)/100),R7C9:R9C10,2,FALSE)*RC[-10]*100 -> 600
A591: 3404 | B591: 5 | C591: 100 | D591: =IF(RC2=1,RC[7],R[-1]C&"|"&RC[7]) -> 4|8|4|7|4 | E591: =IF(RC2=1,RC[7],R[-1]C&"|"&RC[7]) -> 1500|300|4500|600|7500 | F591: 天赋 5 | G591: =VLOOKUP(RC[4],Sheet1!R8C1:R38C3,2,FALSE)&"+"&IF(VLOOKUP(RC[4],Sheet1!R8C1:R38C3,3,FALSE)="固定值",RC[5],RC[5]/100&"%") -> 生命+7500 | K591: 4 | L591: =VLOOKUP(INT(MOD(RC[-11],1000)/100),R7C9:R9C10,2,FALSE)*RC[-10]*1000 -> 7500
A592: 3404 | B592: 6 | C592: 120 | D592: =IF(RC2=1,RC[7],R[-1]C&"|"&RC[7]) -> 4|8|4|7|4|25 | E592: =IF(RC2=1,RC[7],R[-1]C&"|"&RC[7]) -> 1500|300|4500|600|7500|900 | F592: 天赋 6 | G592: =VLOOKUP(RC[4],Sheet1!R8C1:R38C3,2,FALSE)&"+"&IF(VLOOKUP(RC[4],Sheet1!R8C1:R38C3,3,FALSE)="固定值",RC[5],RC[5]/100&"%") -> 生命+9% | K592: 25 | L592: =VLOOKUP(INT(MOD(RC[-11],1000)/100),R7C9:R9C10,2,FALSE)*RC[-10]*100 -> 900
A593: 3404 | B593: 7 | C593: 140 | D593: =IF(RC2=1,RC[7],R[-1]C&"|"&RC[7]) -> 4|8|4|7|4|25|4 | E593: =IF(RC2=1,RC[7],R[-1]C&"|"&RC[7]) -> 1500|300|4500|600|7500|900|10500 | F593: 天赋 7 | G593: =VLOOKUP(RC[4],Sheet1!R8C1:R38C3,2,FALSE)&"+"&IF(VLOOKUP(RC[4],Sheet1!R8C1:R38C3,3,FALSE)="固定值",RC[5],RC[5]/100&"%") -> 生命+10500 | K593: 4 | L593: =VLOOKUP(INT(MOD(RC[-11],1000)/100),R7C9:R9C10,2,FALSE)*RC[-10]*1000 -> 10500
A594: 3404 | B594: 8 | C594: 160 | D594: =IF(RC2=1,RC[7],R[-1]C&"|"&RC[7]) -> 4|8|4|7|4|25|4|11 | E594: =IF(RC2=1,RC[7],R[-1]C&"|"&RC[7]) -> 1500|300|4500|600|7500|900|10500|1200 | F594: 天赋 8 | G594: =VLOOKUP(RC[4],Sheet1!R8C1:R38C3,2,FALSE)&"+"&IF(VLOOKUP(RC[4],Sheet1!R8C1:R38C3,3,FALSE)="固定值",RC[5],RC[5]/100&"%") -> 命中+12% | K594: 11 | L594: =VLOOKUP(INT(MOD(RC[-11],1000)/100),R7C9:R9C10,2,FALSE)*RC[-10]*100 -> 1200
A595: 3404 | B595: 9 | C595: 180 | D595: =IF(RC2=1,RC[7],R[-1]C&"|"&RC[7]) -> 4|8|4|7|4|25|4|11|4 | E595: =IF(RC2=1,RC[7],R[-1]C&"|"&RC[7]) -> 1500|300|4500|600|7500|900|10500|1200|13500 | F595: 天赋 9 | G595: =VLOOKUP(RC[4],Sheet1!R8C1:R38C3,2,FALSE)&"+"&IF(VLOOKUP(RC[4],Sheet1!R8C1:R38C3,3,FALSE)="固定值",RC[5],RC[5]/100&"%") -> 生命+13500 | K595: 4 | L595: =VLOOKUP(INT(MOD(RC[-11],1000)/100),R7C9:R9C10,2,FALSE)*RC[-10]*1000 -> 13500
A596: 3404 | B596: 10 | C596: 200 | D596: =IF(RC2=1,RC[7],R[-1]C&"|"&RC[7]) -> 4|8|4|7|4|25|4|11|4|25 | E596: =IF(RC2=1,RC[7],R[-1]C&"|"&RC[7]) -> 1500|300|4500|600|7500|900|10500|1200|13500|1500 | F596: 天赋 10 | G596: =VLOOKUP(RC[4],Sheet1!R8C1:R38C3,2,FALSE)&"+"&IF(VLOOKUP(RC[4],Sheet1!R8C1:R38C3,3,FALSE)="固定值",RC[5],RC[5]/100&"%") -> 生命+15% | K596: 25 | L596: =VLOOKUP(INT(MOD(RC[-11],1000)/100),R7C9:R9C10,2,FALSE)*RC[-10]*100 -> 1500
A597: 3405 | B597: 1 | C597: 20 | D597: =IF(RC2=1,RC[7],R[-1]C&"|"&RC[7]) -> 4 | E597: =IF(RC2=1,RC[7],R[-1]C&"|"&RC[7]) -> 1500 | F597: 天赋 1 | G597: =VLOOKUP(RC[4],Sheet1!R8C1:R38C3,2,FALSE)&"+"&IF(VLOOKUP(RC[4],Sheet1!R8C1:R38C3,3,FALSE)="固定值",RC[5],RC[5]/100&"%") -> 生命+1500 | K597: 4 | L597: =VLOOKUP(INT(MOD(RC[-11],1000)/100),R7C9:R9C10,2,FALSE)*RC[-10]*1000 -> 1500
A598: 3405 | B598: 2 | C598: 40 | D598: =IF(RC2=1,RC[7],R[-1]C&"|"&RC[7]) -> 4|8 | E598: =IF(RC2=1,RC[7],R[-1]C&"|"&RC[7]) -> 1500|300 | F598: 天赋 2 | G598: =VLOOKUP(RC[4],Sheet1!R8C1:R38C3,2,FALSE)&"+"&IF(VLOOKUP(RC[4],Sheet1!R8C1:R38C3,3,FALSE)="固定值",RC[5],RC[5]/100&"%") -> 附伤+300 | K598: 8 | L598: =VLOOKUP(INT(MOD(RC[-11],1000)/100),R7C9:R9C10,2,FALSE)*RC[-10]*100 -> 300
A599: 3405 | B599: 3 | C599: 60 | D599: =IF(RC2=1,RC[7],R[-1]C&"|"&RC[7]) -> 4|8|4 | E599: =IF(RC2=1,RC[7],R[-1]C&"|"&RC[7]) -> 1500|300|4500 | F599: 天赋 3 | G599: =VLOOKUP(RC[4],Sheet1!R8C1:R38C3,2,FALSE)&"+"&IF(VLOOKUP(RC[4],Sheet1!R8C1:R38C3,3,FALSE)="固定值",RC[5],RC[5]/100&"%") -> 生命+4500 | K599: 4 | L599: =VLOOKUP(INT(MOD(RC[-11],1000)/100),R7C9:R9C10,2,FALSE)*RC[-10]*1000 -> 4500
A600: 3405 | B600: 4 | C600: 80 | D600: =IF(RC2=1,RC[7],R[-1]C&"|"&RC[7]) -> 4|8|4|7 | E600: =IF(RC2=1,RC[7],R[-1]C&"|"&RC[7]) -> 1500|300|4500|600 | F600: 天赋 4 | G600: =VLOOKUP(RC[4],Sheet1!R8C1:R38C3,2,FALSE)&"+"&IF(VLOOKUP(RC[4],Sheet1!R8C1:R38C3,3,FALSE)="固定值",RC[5],RC[5]/100&"%") -> 伤害+6% | K600: 7 | L600: =VLOOKUP(INT(MOD(RC[-11],1000)/100),R7C9:R9C10,2,FALSE)*RC[-10]*100 -> 600
A601: 3405 | B601: 5 | C601: 100 | D601: =IF(RC2=1,RC[7],R[-1]C&"|"&RC[7]) -> 4|8|4|7|4 | E601: =IF(RC2=1,RC[7],R[-1]C&"|"&RC[7]) -> 1500|300|4500|600|7500 | F601: 天赋 5 | G601: =VLOOKUP(RC[4],Sheet1!R8C1:R38C3,2,FALSE)&"+"&IF(VLOOKUP(RC[4],Sheet1!R8C1:R38C3,3,FALSE)="固定值",RC[5],RC[5]/100&"%") -> 生命+7500 | K601: 4 | L601: =VLOOKUP(INT(MOD(RC[-11],1000)/100),R7C9:R9C10,2,FALSE)*RC[-10]*1000 -> 7500
A602: 3405 | B602: 6 | C602: 120 | D602: =IF(RC2=1,RC[7],R[-1]C&"|"&RC[7]) -> 4|8|4|7|4|25 | E602: =IF(RC2=1,RC[7],R[-1]C&"|"&RC[7]) -> 1500|300|4500|600|7500|900 | F602: 天赋 6 | G602: =VLOOKUP(RC[4],Sheet1!R8C1:R38C3,2,FALSE)&"+"&IF(VLOOKUP(RC[4],Sheet1!R8C1:R38C3,3,FALSE)="固定值",RC[5],RC[5]/100&"%") -> 生命+9% | K602: 25 | L602: =VLOOKUP(INT(MOD(RC[-11],1000)/100),R7C9:R9C10,2,FALSE)*RC[-10]*100 -> 900
A603: 3405 | B603: 7 | C603: 140 | D603: =IF(RC2=1,RC[7],R[-1]C&"|"&RC[7]) -> 4|8|4|7|4|25|4 | E603: =IF(RC2=1,RC[7],R[-1]C&"|"&RC[7]) -> 1500|300|4500|600|7500|900|10500 | F603: 天赋 7 | G603: =VLOOKUP(RC[4],Sheet1!R8C1:R38C3,2,FALSE)&"+"&IF(VLOOKUP(RC[4],Sheet1!R8C1:R38C3,3,FALSE)="固定值",RC[5],RC[5]/100&"%") -> 生命+10500 | K603: 4 | L603: =VLOOKUP(INT(MOD(RC[-11],1000)/100),R7C9:R9C10,2,FALSE)*RC[-10]*1000 -> 10500
A604: 3405 | B604: 8 | C604: 160 | D604: =IF(RC2=1,RC[7],R[-1]C&"|"&RC[7]) -> 4|8|4|7|4|25|4|11 | E604: =IF(RC2=1,RC[7],R[-1]C&"|"&RC[7]) -> 1500|300|4500|600|7500|900|10500|1200 | F604: 天赋 8 | G604: =VLOOKUP(RC[4],Sheet1!R8C1:R38C3,2,FALSE)&"+"&IF(VLOOKUP(RC[4],Sheet1!R8C1:R38C3,3,FALSE)="固定值",RC[5],RC[5]/100&"%") -> 命中+12% | K604: 11 | L604: =VLOOKUP(INT(MOD(RC[-11],1000)/100),R7C9:R9C10,2,FALSE)*RC[-10]*100 -> 1200
A605: 3405 | B605: 9 | C605: 180 | D605: =IF(RC2=1,RC[7],R[-1]C&"|"&RC[7]) -> 4|8|4|7|4|25|4|11|4 | E605: =IF(RC2=1,RC[7],R[-1]C&"|"&RC[7]) -> 1500|300|4500|600|7500|900|10500|1200|13500 | F605: 天赋 9 | G605: =VLOOKUP(RC[4],Sheet1!R8C1:R38C3,2,FALSE)&"+"&IF(VLOOKUP(RC[4],Sheet1!R8C1:R38C3,3,FALSE)="固定值",RC[5],RC[5]/100&"%") -> 生命+13500 | K605: 4 | L605: =VLOOKUP(INT(MOD(RC[-11],1000)/100),R7C9:R9C10,2,FALSE)*RC[-10]*1000 -> 13500
A606: 3405 | B606: 10 | C606: 200 | D606: =IF(RC2=1,RC[7],R[-1]C&"|"&RC[7]) -> 4|8|4|7|4|25|4|11|4|25 | E606: =IF(RC2=1,RC[7],R[-1]C&"|"&RC[7]) -> 1500|300|4500|600|7500|900|10500|1200|13500|1500 | F606: 天赋 10 | G606: =VLOOKUP(RC[4],Sheet1!R8C1:R38C3,2,FALSE)&"+"&IF(VLOOKUP(RC[4],Sheet1!R8C1:R38C3,3,FALSE)="固定值",RC[5],RC[5]/100&"%") -> 生命+15% | K606: 25 | L606: =VLOOKUP(INT(MOD(RC[-11],1000)/100),R7C9:R9C10,2,FALSE)*RC[-10]*100 -> 1500
A607: 3501 | B607: 1 | C607: 20 | D607: =IF(RC2=1,RC[7],R[-11]C&"|"&RC[7]) -> 4 | E607: =IF(RC2=1,RC[7],R[-11]C&"|"&RC[7]) -> 2000 | F607: 天赋 1 | G607: =VLOOKUP(RC[4],Sheet1!R8C1:R38C3,2,FALSE)&"+"&IF(VLOOKUP(RC[4],Sheet1!R8C1:R38C3,3,FALSE)="固定值",RC[5],RC[5]/100&"%") -> 生命+2000 | K607: 4 | L607: =VLOOKUP(INT(MOD(RC[-11],1000)/100),R7C9:R9C10,2,FALSE)*RC[-10]*1000 -> 2000
A608: 3501 | B608: 2 | C608: 40 | D608: =IF(RC2=1,RC[7],R[-1]C&"|"&RC[7]) -> 4|8 | E608: =IF(RC2=1,RC[7],R[-1]C&"|"&RC[7]) -> 2000|400 | F608: 天赋 2 | G608: =VLOOKUP(RC[4],Sheet1!R8C1:R38C3,2,FALSE)&"+"&IF(VLOOKUP(RC[4],Sheet1!R8C1:R38C3,3,FALSE)="固定值",RC[5],RC[5]/100&"%") -> 附伤+400 | K608: 8 | L608: =VLOOKUP(INT(MOD(RC[-11],1000)/100),R7C9:R9C10,2,FALSE)*RC[-10]*100 -> 400
A609: 3501 | B609: 3 | C609: 60 | D609: =IF(RC2=1,RC[7],R[-1]C&"|"&RC[7]) -> 4|8|4 | E609: =IF(RC2=1,RC[7],R[-1]C&"|"&RC[7]) -> 2000|400|6000 | F609: 天赋 3 | G609: =VLOOKUP(RC[4],Sheet1!R8C1:R38C3,2,FALSE)&"+"&IF(VLOOKUP(RC[4],Sheet1!R8C1:R38C3,3,FALSE)="固定值",RC[5],RC[5]/100&"%") -> 生命+6000 | K609: 4 | L609: =VLOOKUP(INT(MOD(RC[-11],1000)/100),R7C9:R9C10,2,FALSE)*RC[-10]*1000 -> 6000
A610: 3501 | B610: 4 | C610: 80 | D610: =IF(RC2=1,RC[7],R[-1]C&"|"&RC[7]) -> 4|8|4|7 | E610: =IF(RC2=1,RC[7],R[-1]C&"|"&RC[7]) -> 2000|400|6000|800 | F610: 天赋 4 | G610: =VLOOKUP(RC[4],Sheet1!R8C1:R38C3,2,FALSE)&"+"&IF(VLOOKUP(RC[4],Sheet1!R8C1:R38C3,3,FALSE)="固定值",RC[5],RC[5]/100&"%") -> 伤害+8% | K610: 7 | L610: =VLOOKUP(INT(MOD(RC[-11],1000)/100),R7C9:R9C10,2,FALSE)*RC[-10]*100 -> 800
A611: 3501 | B611: 5 | C611: 100 | D611: =IF(RC2=1,RC[7],R[-1]C&"|"&RC[7]) -> 4|8|4|7|4 | E611: =IF(RC2=1,RC[7],R[-1]C&"|"&RC[7]) -> 2000|400|6000|800|10000 | F611: 天赋 5 | G611: =VLOOKUP(RC[4],Sheet1!R8C1:R38C3,2,FALSE)&"+"&IF(VLOOKUP(RC[4],Sheet1!R8C1:R38C3,3,FALSE)="固定值",RC[5],RC[5]/100&"%") -> 生命+10000 | K611: 4 | L611: =VLOOKUP(INT(MOD(RC[-11],1000)/100),R7C9:R9C10,2,FALSE)*RC[-10]*1000 -> 10000
A612: 3501 | B612: 6 | C612: 120 | D612: =IF(RC2=1,RC[7],R[-1]C&"|"&RC[7]) -> 4|8|4|7|4|25 | E612: =IF(RC2=1,RC[7],R[-1]C&"|"&RC[7]) -> 2000|400|6000|800|10000|1200 | F612: 天赋 6 | G612: =VLOOKUP(RC[4],Sheet1!R8C1:R38C3,2,FALSE)&"+"&IF(VLOOKUP(RC[4],Sheet1!R8C1:R38C3,3,FALSE)="固定值",RC[5],RC[5]/100&"%") -> 生命+12% | K612: 25 | L612: =VLOOKUP(INT(MOD(RC[-11],1000)/100),R7C9:R9C10,2,FALSE)*RC[-10]*100 -> 1200
A613: 3501 | B613: 7 | C613: 140 | D613: =IF(RC2=1,RC[7],R[-1]C&"|"&RC[7]) -> 4|8|4|7|4|25|4 | E613: =IF(RC2=1,RC[7],R[-1]C&"|"&RC[7]) -> 2000|400|6000|800|10000|1200|14000 | F613: 天赋 7 | G613: =VLOOKUP(RC[4],Sheet1!R8C1:R38C3,2,FALSE)&"+"&IF(VLOOKUP(RC[4],Sheet1!R8C1:R38C3,3,FALSE)="固定值",RC[5],RC[5]/100&"%") -> 生命+14000 | K613: 4 | L613: =VLOOKUP(INT(MOD(RC[-11],1000)/100),R7C9:R9C10,2,FALSE)*RC[-10]*1000 -> 14000
A614: 3501 | B614: 8 | C614: 160 | D614: =IF(RC2=1,RC[7],R[-1]C&"|"&RC[7]) -> 4|8|4|7|4|25|4|11 | E614: =IF(RC2=1,RC[7],R[-1]C&"|"&RC[7]) -> 2000|400|6000|800|10000|1200|14000|1600 | F614: 天赋 8 | G614: =VLOOKUP(RC[4],Sheet1!R8C1:R38C3,2,FALSE)&"+"&IF(VLOOKUP(RC[4],Sheet1!R8C1:R38C3,3,FALSE)="固定值",RC[5],RC[5]/100&"%") -> 命中+16% | K614: 11 | L614: =VLOOKUP(INT(MOD(RC[-11],1000)/100),R7C9:R9C10,2,FALSE)*RC[-10]*100 -> 1600
A615: 3501 | B615: 9 | C615: 180 | D615: =IF(RC2=1,RC[7],R[-1]C&"|"&RC[7]) -> 4|8|4|7|4|25|4|11|4 | E615: =IF(RC2=1,RC[7],R[-1]C&"|"&RC[7]) -> 2000|400|6000|800|10000|1200|14000|1600|18000 | F615: 天赋 9 | G615: =VLOOKUP(RC[4],Sheet1!R8C1:R38C3,2,FALSE)&"+"&IF(VLOOKUP(RC[4],Sheet1!R8C1:R38C3,3,FALSE)="固定值",RC[5],RC[5]/100&"%") -> 生命+18000 | K615: 4 | L615: =VLOOKUP(INT(MOD(RC[-11],1000)/100),R7C9:R9C10,2,FALSE)*RC[-10]*1000 -> 18000
A616: 3501 | B616: 10 | C616: 200 | D616: =IF(RC2=1,RC[7],R[-1]C&"|"&RC[7]) -> 4|8|4|7|4|25|4|11|4|25 | E616: =IF(RC2=1,RC[7],R[-1]C&"|"&RC[7]) -> 2000|400|6000|800|10000|1200|14000|1600|18000|2000 | F616: 天赋 10 | G616: =VLOOKUP(RC[4],Sheet1!R8C1:R38C3,2,FALSE)&"+"&IF(VLOOKUP(RC[4],Sheet1!R8C1:R38C3,3,FALSE)="固定值",RC[5],RC[5]/100&"%") -> 生命+20% | K616: 25 | L616: =VLOOKUP(INT(MOD(RC[-11],1000)/100),R7C9:R9C10,2,FALSE)*RC[-10]*100 -> 2000
A617: 3502 | B617: 1 | C617: 20 | D617: =IF(RC2=1,RC[7],R[-1]C&"|"&RC[7]) -> 4 | E617: =IF(RC2=1,RC[7],R[-1]C&"|"&RC[7]) -> 2000 | F617: 天赋 1 | G617: =VLOOKUP(RC[4],Sheet1!R8C1:R38C3,2,FALSE)&"+"&IF(VLOOKUP(RC[4],Sheet1!R8C1:R38C3,3,FALSE)="固定值",RC[5],RC[5]/100&"%") -> 生命+2000 | K617: 4 | L617: =VLOOKUP(INT(MOD(RC[-11],1000)/100),R7C9:R9C10,2,FALSE)*RC[-10]*1000 -> 2000
A618: 3502 | B618: 2 | C618: 40 | D618: =IF(RC2=1,RC[7],R[-1]C&"|"&RC[7]) -> 4|8 | E618: =IF(RC2=1,RC[7],R[-1]C&"|"&RC[7]) -> 2000|400 | F618: 天赋 2 | G618: =VLOOKUP(RC[4],Sheet1!R8C1:R38C3,2,FALSE)&"+"&IF(VLOOKUP(RC[4],Sheet1!R8C1:R38C3,3,FALSE)="固定值",RC[5],RC[5]/100&"%") -> 附伤+400 | K618: 8 | L618: =VLOOKUP(INT(MOD(RC[-11],1000)/100),R7C9:R9C10,2,FALSE)*RC[-10]*100 -> 400
A619: 3502 | B619: 3 | C619: 60 | D619: =IF(RC2=1,RC[7],R[-1]C&"|"&RC[7]) -> 4|8|4 | E619: =IF(RC2=1,RC[7],R[-1]C&"|"&RC[7]) -> 2000|400|6000 | F619: 天赋 3 | G619: =VLOOKUP(RC[4],Sheet1!R8C1:R38C3,2,FALSE)&"+"&IF(VLOOKUP(RC[4],Sheet1!R8C1:R38C3,3,FALSE)="固定值",RC[5],RC[5]/100&"%") -> 生命+6000 | K619: 4 | L619: =VLOOKUP(INT(MOD(RC[-11],1000)/100),R7C9:R9C10,2,FALSE)*RC[-10]*1000 -> 6000
A620: 3502 | B620: 4 | C620: 80 | D620: =IF(RC2=1,RC[7],R[-1]C&"|"&RC[7]) -> 4|8|4|7 | E620: =IF(RC2=1,RC[7],R[-1]C&"|"&RC[7]) -> 2000|400|6000|800 | F620: 天赋 4 | G620: =VLOOKUP(RC[4],Sheet1!R8C1:R38C3,2,FALSE)&"+"&IF(VLOOKUP(RC[4],Sheet1!R8C1:R38C3,3,FALSE)="固定值",RC[5],RC[5]/100&"%") -> 伤害+8% | K620: 7 | L620: =VLOOKUP(INT(MOD(RC[-11],1000)/100),R7C9:R9C10,2,FALSE)*RC[-10]*100 -> 800
A621: 3502 | B621: 5 | C621: 100 | D621: =IF(RC2=1,RC[7],R[-1]C&"|"&RC[7]) -> 4|8|4|7|4 | E621: =IF(RC2=1,RC[7],R[-1]C&"|"&RC[7]) -> 2000|400|6000|800|10000 | F621: 天赋 5 | G621: =VLOOKUP(RC[4],Sheet1!R8C1:R38C3,2,FALSE)&"+"&IF(VLOOKUP(RC[4],Sheet1!R8C1:R38C3,3,FALSE)="固定值",RC[5],RC[5]/100&"%") -> 生命+10000 | K621: 4 | L621: =VLOOKUP(INT(MOD(RC[-11],1000)/100),R7C9:R9C10,2,FALSE)*RC[-10]*1000 -> 10000
A622: 3502 | B622: 6 | C622: 120 | D622: =IF(RC2=1,RC[7],R[-1]C&"|"&RC[7]) -> 4|8|4|7|4|25 | E622: =IF(RC2=1,RC[7],R[-1]C&"|"&RC[7]) -> 2000|400|6000|800|10000|1200 | F622: 天赋 6 | G622: =VLOOKUP(RC[4],Sheet1!R8C1:R38C3,2,FALSE)&"+"&IF(VLOOKUP(RC[4],Sheet1!R8C1:R38C3,3,FALSE)="固定值",RC[5],RC[5]/100&"%") -> 生命+12% | K622: 25 | L622: =VLOOKUP(INT(MOD(RC[-11],1000)/100),R7C9:R9C10,2,FALSE)*RC[-10]*100 -> 1200
A623: 3502 | B623: 7 | C623: 140 | D623: =IF(RC2=1,RC[7],R[-1]C&"|"&RC[7]) -> 4|8|4|7|4|25|4 | E623: =IF(RC2=1,RC[7],R[-1]C&"|"&RC[7]) -> 2000|400|6000|800|10000|1200|14000 | F623: 天赋 7 | G623: =VLOOKUP(RC[4],Sheet1!R8C1:R38C3,2,FALSE)&"+"&IF(VLOOKUP(RC[4],Sheet1!R8C1:R38C3,3,FALSE)="固定值",RC[5],RC[5]/100&"%") -> 生命+14000 | K623: 4 | L623: =VLOOKUP(INT(MOD(RC[-11],1000)/100),R7C9:R9C10,2,FALSE)*RC[-10]*1000 -> 14000
A624: 3502 | B624: 8 | C624: 160 | D624: =IF(RC2=1,RC[7],R[-1]C&"|"&RC[7]) -> 4|8|4|7|4|25|4|11 | E624: =IF(RC2=1,RC[7],R[-1]C&"|"&RC[7]) -> 2000|400|6000|800|10000|1200|14000|1600 | F624: 天赋 8 | G624: =VLOOKUP(RC[4],Sheet1!R8C1:R38C3,2,FALSE)&"+"&IF(VLOOKUP(RC[4],Sheet1!R8C1:R38C3,3,FALSE)="固定值",RC[5],RC[5]/100&"%") -> 命中+16% | K624: 11 | L624: =VLOOKUP(INT(MOD(RC[-11],1000)/100),R7C9:R9C10,2,FALSE)*RC[-10]*100 -> 1600
A625: 3502 | B625: 9 | C625: 180 | D625: =IF(RC2=1,RC[7],R[-1]C&"|"&RC[7]) -> 4|8|4|7|4|25|4|11|4 | E625: =IF(RC2=1,RC[7],R[-1]C&"|"&RC[7]) -> 2000|400|6000|800|10000|1200|14000|1600|18000 | F625: 天赋 9 | G625: =VLOOKUP(RC[4],Sheet1!R8C1:R38C3,2,FALSE)&"+"&IF(VLOOKUP(RC[4],Sheet1!R8C1:R38C3,3,FALSE)="固定值",RC[5],RC[5]/100&"%") -> 生命+18000 | K625: 4 | L625: =VLOOKUP(INT(MOD(RC[-11],1000)/100),R7C9:R9C10,2,FALSE)*RC[-10]*1000 -> 18000
A626: 3502 | B626: 10 | C626: 200 | D626: =IF(RC2=1,RC[7],R[-1]C&"|"&RC[7]) -> 4|8|4|7|4|25|4|11|4|25 | E626: =IF(RC2=1,RC[7],R[-1]C&"|"&RC[7]) -> 2000|400|6000|800|10000|1200|14000|1600|18000|2000 | F626: 天赋 10 | G626: =VLOOKUP(RC[4],Sheet1!R8C1:R38C3,2,FALSE)&"+"&IF(VLOOKUP(RC[4],Sheet1!R8C1:R38C3,3,FALSE)="固定值",RC[5],RC[5]/100&"%") -> 生命+20% | K626: 25 | L626: =VLOOKUP(INT(MOD(RC[-11],1000)/100),R7C9:R9C10,2,FALSE)*RC[-10]*100 -> 2000
A627: 3503 | B627: 1 | C627: 20 | D627: =IF(RC2=1,RC[7],R[-1]C&"|"&RC[7]) -> 4 | E627: =IF(RC2=1,RC[7],R[-1]C&"|"&RC[7]) -> 2000 | F627: 天赋 1 | G627: =VLOOKUP(RC[4],Sheet1!R8C1:R38C3,2,FALSE)&"+"&IF(VLOOKUP(RC[4],Sheet1!R8C1:R38C3,3,FALSE)="固定值",RC[5],RC[5]/100&"%") -> 生命+2000 | K627: 4 | L627: =VLOOKUP(INT(MOD(RC[-11],1000)/100),R7C9:R9C10,2,FALSE)*RC[-10]*1000 -> 2000
A628: 3503 | B628: 2 | C628: 40 | D628: =IF(RC2=1,RC[7],R[-1]C&"|"&RC[7]) -> 4|8 | E628: =IF(RC2=1,RC[7],R[-1]C&"|"&RC[7]) -> 2000|400 | F628: 天赋 2 | G628: =VLOOKUP(RC[4],Sheet1!R8C1:R38C3,2,FALSE)&"+"&IF(VLOOKUP(RC[4],Sheet1!R8C1:R38C3,3,FALSE)="固定值",RC[5],RC[5]/100&"%") -> 附伤+400 | K628: 8 | L628: =VLOOKUP(INT(MOD(RC[-11],1000)/100),R7C9:R9C10,2,FALSE)*RC[-10]*100 -> 400
A629: 3503 | B629: 3 | C629: 60 | D629: =IF(RC2=1,RC[7],R[-1]C&"|"&RC[7]) -> 4|8|4 | E629: =IF(RC2=1,RC[7],R[-1]C&"|"&RC[7]) -> 2000|400|6000 | F629: 天赋 3 | G629: =VLOOKUP(RC[4],Sheet1!R8C1:R38C3,2,FALSE)&"+"&IF(VLOOKUP(RC[4],Sheet1!R8C1:R38C3,3,FALSE)="固定值",RC[5],RC[5]/100&"%") -> 生命+6000 | K629: 4 | L629: =VLOOKUP(INT(MOD(RC[-11],1000)/100),R7C9:R9C10,2,FALSE)*RC[-10]*1000 -> 6000
A630: 3503 | B630: 4 | C630: 80 | D630: =IF(RC2=1,RC[7],R[-1]C&"|"&RC[7]) -> 4|8|4|7 | E630: =IF(RC2=1,RC[7],R[-1]C&"|"&RC[7]) -> 2000|400|6000|800 | F630: 天赋 4 | G630: =VLOOKUP(RC[4],Sheet1!R8C1:R38C3,2,FALSE)&"+"&IF(VLOOKUP(RC[4],Sheet1!R8C1:R38C3,3,FALSE)="固定值",RC[5],RC[5]/100&"%") -> 伤害+8% | K630: 7 | L630: =VLOOKUP(INT(MOD(RC[-11],1000)/100),R7C9:R9C10,2,FALSE)*RC[-10]*100 -> 800
A631: 3503 | B631: 5 | C631: 100 | D631: =IF(RC2=1,RC[7],R[-1]C&"|"&RC[7]) -> 4|8|4|7|4 | E631: =IF(RC2=1,RC[7],R[-1]C&"|"&RC[7]) -> 2000|400|6000|800|10000 | F631: 天赋 5 | G631: =VLOOKUP(RC[4],Sheet1!R8C1:R38C3,2,FALSE)&"+"&IF(VLOOKUP(RC[4],Sheet1!R8C1:R38C3,3,FALSE)="固定值",RC[5],RC[5]/100&"%") -> 生命+10000 | K631: 4 | L631: =VLOOKUP(INT(MOD(RC[-11],1000)/100),R7C9:R9C10,2,FALSE)*RC[-10]*1000 -> 10000
A632: 3503 | B632: 6 | C632: 120 | D632: =IF(RC2=1,RC[7],R[-1]C&"|"&RC[7]) -> 4|8|4|7|4|25 | E632: =IF(RC2=1,RC[7],R[-1]C&"|"&RC[7]) -> 2000|400|6000|800|10000|1200 | F632: 天赋 6 | G632: =VLOOKUP(RC[4],Sheet1!R8C1:R38C3,2,FALSE)&"+"&IF(VLOOKUP(RC[4],Sheet1!R8C1:R38C3,3,FALSE)="固定值",RC[5],RC[5]/100&"%") -> 生命+12% | K632: 25 | L632: =VLOOKUP(INT(MOD(RC[-11],1000)/100),R7C9:R9C10,2,FALSE)*RC[-10]*100 -> 1200
A633: 3503 | B633: 7 | C633: 140 | D633: =IF(RC2=1,RC[7],R[-1]C&"|"&RC[7]) -> 4|8|4|7|4|25|4 | E633: =IF(RC2=1,RC[7],R[-1]C&"|"&RC[7]) -> 2000|400|6000|800|10000|1200|14000 | F633: 天赋 7 | G633: =VLOOKUP(RC[4],Sheet1!R8C1:R38C3,2,FALSE)&"+"&IF(VLOOKUP(RC[4],Sheet1!R8C1:R38C3,3,FALSE)="固定值",RC[5],RC[5]/100&"%") -> 生命+14000 | K633: 4 | L633: =VLOOKUP(INT(MOD(RC[-11],1000)/100),R7C9:R9C10,2,FALSE)*RC[-10]*1000 -> 14000
A634: 3503 | B634: 8 | C634: 160 | D634: =IF(RC2=1,RC[7],R[-1]C&"|"&RC[7]) -> 4|8|4|7|4|25|4|11 | E634: =IF(RC2=1,RC[7],R[-1]C&"|"&RC[7]) -> 2000|400|6000|800|10000|1200|14000|1600 | F634: 天赋 8 | G634: =VLOOKUP(RC[4],Sheet1!R8C1:R38C3,2,FALSE)&"+"&IF(VLOOKUP(RC[4],Sheet1!R8C1:R38C3,3,FALSE)="固定值",RC[5],RC[5]/100&"%") -> 命中+16% | K634: 11 | L634: =VLOOKUP(INT(MOD(RC[-11],1000)/100),R7C9:R9C10,2,FALSE)*RC[-10]*100 -> 1600
A635: 3503 | B635: 9 | C635: 180 | D635: =IF(RC2=1,RC[7],R[-1]C&"|"&RC[7]) -> 4|8|4|7|4|25|4|11|4 | E635: =IF(RC2=1,RC[7],R[-1]C&"|"&RC[7]) -> 2000|400|6000|800|10000|1200|14000|1600|18000 | F635: 天赋 9 | G635: =VLOOKUP(RC[4],Sheet1!R8C1:R38C3,2,FALSE)&"+"&IF(VLOOKUP(RC[4],Sheet1!R8C1:R38C3,3,FALSE)="固定值",RC[5],RC[5]/100&"%") -> 生命+18000 | K635: 4 | L635: =VLOOKUP(INT(MOD(RC[-11],1000)/100),R7C9:R9C10,2,FALSE)*RC[-10]*1000 -> 18000
A636: 3503 | B636: 10 | C636: 200 | D636: =IF(RC2=1,RC[7],R[-1]C&"|"&RC[7]) -> 4|8|4|7|4|25|4|11|4|25 | E636: =IF(RC2=1,RC[7],R[-1]C&"|"&RC[7]) -> 2000|400|6000|800|10000|1200|14000|1600|18000|2000 | F636: 天赋 10 | G636: =VLOOKUP(RC[4],Sheet1!R8C1:R38C3,2,FALSE)&"+"&IF(VLOOKUP(RC[4],Sheet1!R8C1:R38C3,3,FALSE)="固定值",RC[5],RC[5]/100&"%") -> 生命+20% | K636: 25 | L636: =VLOOKUP(INT(MOD(RC[-11],1000)/100),R7C9:R9C10,2,FALSE)*RC[-10]*100 -> 2000
A637: 3504 | B637: 1 | C637: 20 | D637: =IF(RC2=1,RC[7],R[-1]C&"|"&RC[7]) -> 4 | E637: =IF(RC2=1,RC[7],R[-1]C&"|"&RC[7]) -> 2000 | F637: 天赋 1 | G637: =VLOOKUP(RC[4],Sheet1!R8C1:R38C3,2,FALSE)&"+"&IF(VLOOKUP(RC[4],Sheet1!R8C1:R38C3,3,FALSE)="固定值",RC[5],RC[5]/100&"%") -> 生命+2000 | K637: 4 | L637: =VLOOKUP(INT(MOD(RC[-11],1000)/100),R7C9:R9C10,2,FALSE)*RC[-10]*1000 -> 2000
A638: 3504 | B638: 2 | C638: 40 | D638: =IF(RC2=1,RC[7],R[-1]C&"|"&RC[7]) -> 4|8 | E638: =IF(RC2=1,RC[7],R[-1]C&"|"&RC[7]) -> 2000|400 | F638: 天赋 2 | G638: =VLOOKUP(RC[4],Sheet1!R8C1:R38C3,2,FALSE)&"+"&IF(VLOOKUP(RC[4],Sheet1!R8C1:R38C3,3,FALSE)="固定值",RC[5],RC[5]/100&"%") -> 附伤+400 | K638: 8 | L638: =VLOOKUP(INT(MOD(RC[-11],1000)/100),R7C9:R9C10,2,FALSE)*RC[-10]*100 -> 400
A639: 3504 | B639: 3 | C639: 60 | D639: =IF(RC2=1,RC[7],R[-1]C&"|"&RC[7]) -> 4|8|4 | E639: =IF(RC2=1,RC[7],R[-1]C&"|"&RC[7]) -> 2000|400|6000 | F639: 天赋 3 | G639: =VLOOKUP(RC[4],Sheet1!R8C1:R38C3,2,FALSE)&"+"&IF(VLOOKUP(RC[4],Sheet1!R8C1:R38C3,3,FALSE)="固定值",RC[5],RC[5]/100&"%") -> 生命+6000 | K639: 4 | L639: =VLOOKUP(INT(MOD(RC[-11],1000)/100),R7C9:R9C10,2,FALSE)*RC[-10]*1000 -> 6000
A640: 3504 | B640: 4 | C640: 80 | D640: =IF(RC2=1,RC[7],R[-1]C&"|"&RC[7]) -> 4|8|4|7 | E640: =IF(RC2=1,RC[7],R[-1]C&"|"&RC[7]) -> 2000|400|6000|800 | F640: 天赋 4 | G640: =VLOOKUP(RC[4],Sheet1!R8C1:R38C3,2,FALSE)&"+"&IF(VLOOKUP(RC[4],Sheet1!R8C1:R38C3,3,FALSE)="固定值",RC[5],RC[5]/100&"%") -> 伤害+8% | K640: 7 | L640: =VLOOKUP(INT(MOD(RC[-11],1000)/100),R7C9:R9C10,2,FALSE)*RC[-10]*100 -> 800
A641: 3504 | B641: 5 | C641: 100 | D641: =IF(RC2=1,RC[7],R[-1]C&"|"&RC[7]) -> 4|8|4|7|4 | E641: =IF(RC2=1,RC[7],R[-1]C&"|"&RC[7]) -> 2000|400|6000|800|10000 | F641: 天赋 5 | G641: =VLOOKUP(RC[4],Sheet1!R8C1:R38C3,2,FALSE)&"+"&IF(VLOOKUP(RC[4],Sheet1!R8C1:R38C3,3,FALSE)="固定值",RC[5],RC[5]/100&"%") -> 生命+10000 | K641: 4 | L641: =VLOOKUP(INT(MOD(RC[-11],1000)/100),R7C9:R9C10,2,FALSE)*RC[-10]*1000 -> 10000
A642: 3504 | B642: 6 | C642: 120 | D642: =IF(RC2=1,RC[7],R[-1]C&"|"&RC[7]) -> 4|8|4|7|4|25 | E642: =IF(RC2=1,RC[7],R[-1]C&"|"&RC[7]) -> 2000|400|6000|800|10000|1200 | F642: 天赋 6 | G642: =VLOOKUP(RC[4],Sheet1!R8C1:R38C3,2,FALSE)&"+"&IF(VLOOKUP(RC[4],Sheet1!R8C1:R38C3,3,FALSE)="固定值",RC[5],RC[5]/100&"%") -> 生命+12% | K642: 25 | L642: =VLOOKUP(INT(MOD(RC[-11],1000)/100),R7C9:R9C10,2,FALSE)*RC[-10]*100 -> 1200
A643: 3504 | B643: 7 | C643: 140 | D643: =IF(RC2=1,RC[7],R[-1]C&"|"&RC[7]) -> 4|8|4|7|4|25|4 | E643: =IF(RC2=1,RC[7],R[-1]C&"|"&RC[7]) -> 2000|400|6000|800|10000|1200|14000 | F643: 天赋 7 | G643: =VLOOKUP(RC[4],Sheet1!R8C1:R38C3,2,FALSE)&"+"&IF(VLOOKUP(RC[4],Sheet1!R8C1:R38C3,3,FALSE)="固定值",RC[5],RC[5]/100&"%") -> 生命+14000 | K643: 4 | L643: =VLOOKUP(INT(MOD(RC[-11],1000)/100),R7C9:R9C10,2,FALSE)*RC[-10]*1000 -> 14000
A644: 3504 | B644: 8 | C644: 160 | D644: =IF(RC2=1,RC[7],R[-1]C&"|"&RC[7]) -> 4|8|4|7|4|25|4|11 | E644: =IF(RC2=1,RC[7],R[-1]C&"|"&RC[7]) -> 2000|400|6000|800|10000|1200|14000|1600 | F644: 天赋 8 | G644: =VLOOKUP(RC[4],Sheet1!R8C1:R38C3,2,FALSE)&"+"&IF(VLOOKUP(RC[4],Sheet1!R8C1:R38C3,3,FALSE)="固定值",RC[5],RC[5]/100&"%") -> 命中+16% | K644: 11 | L644: =VLOOKUP(INT(MOD(RC[-11],1000)/100),R7C9:R9C10,2,FALSE)*RC[-10]*100 -> 1600
A645: 3504 | B645: 9 | C645: 180 | D645: =IF(RC2=1,RC[7],R[-1]C&"|"&RC[7]) -> 4|8|4|7|4|25|4|11|4 | E645: =IF(RC2=1,RC[7],R[-1]C&"|"&RC[7]) -> 2000|400|6000|800|10000|1200|14000|1600|18000 | F645: 天赋 9 | G645: =VLOOKUP(RC[4],Sheet1!R8C1:R38C3,2,FALSE)&"+"&IF(VLOOKUP(RC[4],Sheet1!R8C1:R38C3,3,FALSE)="固定值",RC[5],RC[5]/100&"%") -> 生命+18000 | K645: 4 | L645: =VLOOKUP(INT(MOD(RC[-11],1000)/100),R7C9:R9C10,2,FALSE)*RC[-10]*1000 -> 18000
A646: 3504 | B646: 10 | C646: 200 | D646: =IF(RC2=1,RC[7],R[-1]C&"|"&RC[7]) -> 4|8|4|7|4|25|4|11|4|25 | E646: =IF(RC2=1,RC[7],R[-1]C&"|"&RC[7]) -> 2000|400|6000|800|10000|1200|14000|1600|18000|2000 | F646: 天赋 10 | G646: =VLOOKUP(RC[4],Sheet1!R8C1:R38C3,2,FALSE)&"+"&IF(VLOOKUP(RC[4],Sheet1!R8C1:R38C3,3,FALSE)="固定值",RC[5],RC[5]/100&"%") -> 生命+20% | K646: 25 | L646: =VLOOKUP(INT(MOD(RC[-11],1000)/100),R7C9:R9C10,2,FALSE)*RC[-10]*100 -> 2000
A647: 3505 | B647: 1 | C647: 20 | D647: =IF(RC2=1,RC[7],R[-1]C&"|"&RC[7]) -> 4 | E647: =IF(RC2=1,RC[7],R[-1]C&"|"&RC[7]) -> 2000 | F647: 天赋 1 | G647: =VLOOKUP(RC[4],Sheet1!R8C1:R38C3,2,FALSE)&"+"&IF(VLOOKUP(RC[4],Sheet1!R8C1:R38C3,3,FALSE)="固定值",RC[5],RC[5]/100&"%") -> 生命+2000 | K647: 4 | L647: =VLOOKUP(INT(MOD(RC[-11],1000)/100),R7C9:R9C10,2,FALSE)*RC[-10]*1000 -> 2000
A648: 3505 | B648: 2 | C648: 40 | D648: =IF(RC2=1,RC[7],R[-1]C&"|"&RC[7]) -> 4|8 | E648: =IF(RC2=1,RC[7],R[-1]C&"|"&RC[7]) -> 2000|400 | F648: 天赋 2 | G648: =VLOOKUP(RC[4],Sheet1!R8C1:R38C3,2,FALSE)&"+"&IF(VLOOKUP(RC[4],Sheet1!R8C1:R38C3,3,FALSE)="固定值",RC[5],RC[5]/100&"%") -> 附伤+400 | K648: 8 | L648: =VLOOKUP(INT(MOD(RC[-11],1000)/100),R7C9:R9C10,2,FALSE)*RC[-10]*100 -> 400
A649: 3505 | B649: 3 | C649: 60 | D649: =IF(RC2=1,RC[7],R[-1]C&"|"&RC[7]) -> 4|8|4 | E649: =IF(RC2=1,RC[7],R[-1]C&"|"&RC[7]) -> 2000|400|6000 | F649: 天赋 3 | G649: =VLOOKUP(RC[4],Sheet1!R8C1:R38C3,2,FALSE)&"+"&IF(VLOOKUP(RC[4],Sheet1!R8C1:R38C3,3,FALSE)="固定值",RC[5],RC[5]/100&"%") -> 生命+6000 | K649: 4 | L649: =VLOOKUP(INT(MOD(RC[-11],1000)/100),R7C9:R9C10,2,FALSE)*RC[-10]*1000 -> 6000
A650: 3505 | B650: 4 | C650: 80 | D650: =IF(RC2=1,RC[7],R[-1]C&"|"&RC[7]) -> 4|8|4|7 | E650: =IF(RC2=1,RC[7],R[-1]C&"|"&RC[7]) -> 2000|400|6000|800 | F650: 天赋 4 | G650: =VLOOKUP(RC[4],Sheet1!R8C1:R38C3,2,FALSE)&"+"&IF(VLOOKUP(RC[4],Sheet1!R8C1:R38C3,3,FALSE)="固定值",RC[5],RC[5]/100&"%") -> 伤害+8% | K650: 7 | L650: =VLOOKUP(INT(MOD(RC[-11],1000)/100),R7C9:R9C10,2,FALSE)*RC[-10]*100 -> 800
A651: 3505 | B651: 5 | C651: 100 | D651: =IF(RC2=1,RC[7],R[-1]C&"|"&RC[7]) -> 4|8|4|7|4 | E651: =IF(RC2=1,RC[7],R[-1]C&"|"&RC[7]) -> 2000|400|6000|800|10000 | F651: 天赋 5 | G651: =VLOOKUP(RC[4],Sheet1!R8C1:R38C3,2,FALSE)&"+"&IF(VLOOKUP(RC[4],Sheet1!R8C1:R38C3,3,FALSE)="固定值",RC[5],RC[5]/100&"%") -> 生命+10000 | K651: 4 | L651: =VLOOKUP(INT(MOD(RC[-11],1000)/100),R7C9:R9C10,2,FALSE)*RC[-10]*1000 -> 10000
A652: 3505 | B652: 6 | C652: 120 | D652: =IF(RC2=1,RC[7],R[-1]C&"|"&RC[7]) -> 4|8|4|7|4|25 | E652: =IF(RC2=1,RC[7],R[-1]C&"|"&RC[7]) -> 2000|400|6000|800|10000|1200 | F652: 天赋 6 | G652: =VLOOKUP(RC[4],Sheet1!R8C1:R38C3,2,FALSE)&"+"&IF(VLOOKUP(RC[4],Sheet1!R8C1:R38C3,3,FALSE)="固定值",RC[5],RC[5]/100&"%") -> 生命+12% | K652: 25 | L652: =VLOOKUP(INT(MOD(RC[-11],1000)/100),R7C9:R9C10,2,FALSE)*RC[-10]*100 -> 1200
A653: 3505 | B653: 7 | C653: 140 | D653: =IF(RC2=1,RC[7],R[-1]C&"|"&RC[7]) -> 4|8|4|7|4|25|4 | E653: =IF(RC2=1,RC[7],R[-1]C&"|"&RC[7]) -> 2000|400|6000|800|10000|1200|14000 | F653: 天赋 7 | G653: =VLOOKUP(RC[4],Sheet1!R8C1:R38C3,2,FALSE)&"+"&IF(VLOOKUP(RC[4],Sheet1!R8C1:R38C3,3,FALSE)="固定值",RC[5],RC[5]/100&"%") -> 生命+14000 | K653: 4 | L653: =VLOOKUP(INT(MOD(RC[-11],1000)/100),R7C9:R9C10,2,FALSE)*RC[-10]*1000 -> 14000
A654: 3505 | B654: 8 | C654: 160 | D654: =IF(RC2=1,RC[7],R[-1]C&"|"&RC[7]) -> 4|8|4|7|4|25|4|11 | E654: =IF(RC2=1,RC[7],R[-1]C&"|"&RC[7]) -> 2000|400|6000|800|10000|1200|14000|1600 | F654: 天赋 8 | G654: =VLOOKUP(RC[4],Sheet1!R8C1:R38C3,2,FALSE)&"+"&IF(VLOOKUP(RC[4],Sheet1!R8C1:R38C3,3,FALSE)="固定值",RC[5],RC[5]/100&"%") -> 命中+16% | K654: 11 | L654: =VLOOKUP(INT(MOD(RC[-11],1000)/100),R7C9:R9C10,2,FALSE)*RC[-10]*100 -> 1600
A655: 3505 | B655: 9 | C655: 180 | D655: =IF(RC2=1,RC[7],R[-1]C&"|"&RC[7]) -> 4|8|4|7|4|25|4|11|4 | E655: =IF(RC2=1,RC[7],R[-1]C&"|"&RC[7]) -> 2000|400|6000|800|10000|1200|14000|1600|18000 | F655: 天赋 9 | G655: =VLOOKUP(RC[4],Sheet1!R8C1:R38C3,2,FALSE)&"+"&IF(VLOOKUP(RC[4],Sheet1!R8C1:R38C3,3,FALSE)="固定值",RC[5],RC[5]/100&"%") -> 生命+18000 | K655: 4 | L655: =VLOOKUP(INT(MOD(RC[-11],1000)/100),R7C9:R9C10,2,FALSE)*RC[-10]*1000 -> 18000
A656: 3505 | B656: 10 | C656: 200 | D656: =IF(RC2=1,RC[7],R[-1]C&"|"&RC[7]) -> 4|8|4|7|4|25|4|11|4|25 | E656: =IF(RC2=1,RC[7],R[-1]C&"|"&RC[7]) -> 2000|400|6000|800|10000|1200|14000|1600|18000|2000 | F656: 天赋 10 | G656: =VLOOKUP(RC[4],Sheet1!R8C1:R38C3,2,FALSE)&"+"&IF(VLOOKUP(RC[4],Sheet1!R8C1:R38C3,3,FALSE)="固定值",RC[5],RC[5]/100&"%") -> 生命+20% | K656: 25 | L656: =VLOOKUP(INT(MOD(RC[-11],1000)/100),R7C9:R9C10,2,FALSE)*RC[-10]*100 -> 2000
A657: 3406 | B657: 1 | C657: 20 | D657: =IF(RC2=1,RC[7],R[-1]C&"|"&RC[7]) -> 4 | E657: =IF(RC2=1,RC[7],R[-1]C&"|"&RC[7]) -> 1500 | F657: 天赋 1 | G657: =VLOOKUP(RC[4],Sheet1!R8C1:R38C3,2,FALSE)&"+"&IF(VLOOKUP(RC[4],Sheet1!R8C1:R38C3,3,FALSE)="固定值",RC[5],RC[5]/100&"%") -> 生命+1500 | K657: 4 | L657: =VLOOKUP(INT(MOD(RC[-11],1000)/100),R7C9:R9C10,2,FALSE)*RC[-10]*1000 -> 1500
A658: 3406 | B658: 2 | C658: 40 | D658: =IF(RC2=1,RC[7],R[-1]C&"|"&RC[7]) -> 4|8 | E658: =IF(RC2=1,RC[7],R[-1]C&"|"&RC[7]) -> 1500|300 | F658: 天赋 2 | G658: =VLOOKUP(RC[4],Sheet1!R8C1:R38C3,2,FALSE)&"+"&IF(VLOOKUP(RC[4],Sheet1!R8C1:R38C3,3,FALSE)="固定值",RC[5],RC[5]/100&"%") -> 附伤+300 | K658: 8 | L658: =VLOOKUP(INT(MOD(RC[-11],1000)/100),R7C9:R9C10,2,FALSE)*RC[-10]*100 -> 300
A659: 3406 | B659: 3 | C659: 60 | D659: =IF(RC2=1,RC[7],R[-1]C&"|"&RC[7]) -> 4|8|4 | E659: =IF(RC2=1,RC[7],R[-1]C&"|"&RC[7]) -> 1500|300|4500 | F659: 天赋 3 | G659: =VLOOKUP(RC[4],Sheet1!R8C1:R38C3,2,FALSE)&"+"&IF(VLOOKUP(RC[4],Sheet1!R8C1:R38C3,3,FALSE)="固定值",RC[5],RC[5]/100&"%") -> 生命+4500 | K659: 4 | L659: =VLOOKUP(INT(MOD(RC[-11],1000)/100),R7C9:R9C10,2,FALSE)*RC[-10]*1000 -> 4500
A660: 3406 | B660: 4 | C660: 80 | D660: =IF(RC2=1,RC[7],R[-1]C&"|"&RC[7]) -> 4|8|4|7 | E660: =IF(RC2=1,RC[7],R[-1]C&"|"&RC[7]) -> 1500|300|4500|600 | F660: 天赋 4 | G660: =VLOOKUP(RC[4],Sheet1!R8C1:R38C3,2,FALSE)&"+"&IF(VLOOKUP(RC[4],Sheet1!R8C1:R38C3,3,FALSE)="固定值",RC[5],RC[5]/100&"%") -> 伤害+6% | K660: 7 | L660: =VLOOKUP(INT(MOD(RC[-11],1000)/100),R7C9:R9C10,2,FALSE)*RC[-10]*100 -> 600
A661: 3406 | B661: 5 | C661: 100 | D661: =IF(RC2=1,RC[7],R[-1]C&"|"&RC[7]) -> 4|8|4|7|4 | E661: =IF(RC2=1,RC[7],R[-1]C&"|"&RC[7]) -> 1500|300|4500|600|7500 | F661: 天赋 5 | G661: =VLOOKUP(RC[4],Sheet1!R8C1:R38C3,2,FALSE)&"+"&IF(VLOOKUP(RC[4],Sheet1!R8C1:R38C3,3,FALSE)="固定值",RC[5],RC[5]/100&"%") -> 生命+7500 | K661: 4 | L661: =VLOOKUP(INT(MOD(RC[-11],1000)/100),R7C9:R9C10,2,FALSE)*RC[-10]*1000 -> 7500
A662: 3406 | B662: 6 | C662: 120 | D662: =IF(RC2=1,RC[7],R[-1]C&"|"&RC[7]) -> 4|8|4|7|4|25 | E662: =IF(RC2=1,RC[7],R[-1]C&"|"&RC[7]) -> 1500|300|4500|600|7500|900 | F662: 天赋 6 | G662: =VLOOKUP(RC[4],Sheet1!R8C1:R38C3,2,FALSE)&"+"&IF(VLOOKUP(RC[4],Sheet1!R8C1:R38C3,3,FALSE)="固定值",RC[5],RC[5]/100&"%") -> 生命+9% | K662: 25 | L662: =VLOOKUP(INT(MOD(RC[-11],1000)/100),R7C9:R9C10,2,FALSE)*RC[-10]*100 -> 900
A663: 3406 | B663: 7 | C663: 140 | D663: =IF(RC2=1,RC[7],R[-1]C&"|"&RC[7]) -> 4|8|4|7|4|25|4 | E663: =IF(RC2=1,RC[7],R[-1]C&"|"&RC[7]) -> 1500|300|4500|600|7500|900|10500 | F663: 天赋 7 | G663: =VLOOKUP(RC[4],Sheet1!R8C1:R38C3,2,FALSE)&"+"&IF(VLOOKUP(RC[4],Sheet1!R8C1:R38C3,3,FALSE)="固定值",RC[5],RC[5]/100&"%") -> 生命+10500 | K663: 4 | L663: =VLOOKUP(INT(MOD(RC[-11],1000)/100),R7C9:R9C10,2,FALSE)*RC[-10]*1000 -> 10500
A664: 3406 | B664: 8 | C664: 160 | D664: =IF(RC2=1,RC[7],R[-1]C&"|"&RC[7]) -> 4|8|4|7|4|25|4|11 | E664: =IF(RC2=1,RC[7],R[-1]C&"|"&RC[7]) -> 1500|300|4500|600|7500|900|10500|1200 | F664: 天赋 8 | G664: =VLOOKUP(RC[4],Sheet1!R8C1:R38C3,2,FALSE)&"+"&IF(VLOOKUP(RC[4],Sheet1!R8C1:R38C3,3,FALSE)="固定值",RC[5],RC[5]/100&"%") -> 命中+12% | K664: 11 | L664: =VLOOKUP(INT(MOD(RC[-11],1000)/100),R7C9:R9C10,2,FALSE)*RC[-10]*100 -> 1200
A665: 3406 | B665: 9 | C665: 180 | D665: =IF(RC2=1,RC[7],R[-1]C&"|"&RC[7]) -> 4|8|4|7|4|25|4|11|4 | E665: =IF(RC2=1,RC[7],R[-1]C&"|"&RC[7]) -> 1500|300|4500|600|7500|900|10500|1200|13500 | F665: 天赋 9 | G665: =VLOOKUP(RC[4],Sheet1!R8C1:R38C3,2,FALSE)&"+"&IF(VLOOKUP(RC[4],Sheet1!R8C1:R38C3,3,FALSE)="固定值",RC[5],RC[5]/100&"%") -> 生命+13500 | K665: 4 | L665: =VLOOKUP(INT(MOD(RC[-11],1000)/100),R7C9:R9C10,2,FALSE)*RC[-10]*1000 -> 13500
A666: 3406 | B666: 10 | C666: 200 | D666: =IF(RC2=1,RC[7],R[-1]C&"|"&RC[7]) -> 4|8|4|7|4|25|4|11|4|25 | E666: =IF(RC2=1,RC[7],R[-1]C&"|"&RC[7]) -> 1500|300|4500|600|7500|900|10500|1200|13500|1500 | F666: 天赋 10 | G666: =VLOOKUP(RC[4],Sheet1!R8C1:R38C3,2,FALSE)&"+"&IF(VLOOKUP(RC[4],Sheet1!R8C1:R38C3,3,FALSE)="固定值",RC[5],RC[5]/100&"%") -> 生命+15% | K666: 25 | L666: =VLOOKUP(INT(MOD(RC[-11],1000)/100),R7C9:R9C10,2,FALSE)*RC[-10]*100 -> 1500
A667: 3407 | B667: 1 | C667: 20 | D667: =IF(RC2=1,RC[7],R[-1]C&"|"&RC[7]) -> 4 | E667: =IF(RC2=1,RC[7],R[-1]C&"|"&RC[7]) -> 1500 | F667: 天赋 1 | G667: =VLOOKUP(RC[4],Sheet1!R8C1:R38C3,2,FALSE)&"+"&IF(VLOOKUP(RC[4],Sheet1!R8C1:R38C3,3,FALSE)="固定值",RC[5],RC[5]/100&"%") -> 生命+1500 | K667: 4 | L667: =VLOOKUP(INT(MOD(RC[-11],1000)/100),R7C9:R9C10,2,FALSE)*RC[-10]*1000 -> 1500
A668: 3407 | B668: 2 | C668: 40 | D668: =IF(RC2=1,RC[7],R[-1]C&"|"&RC[7]) -> 4|8 | E668: =IF(RC2=1,RC[7],R[-1]C&"|"&RC[7]) -> 1500|300 | F668: 天赋 2 | G668: =VLOOKUP(RC[4],Sheet1!R8C1:R38C3,2,FALSE)&"+"&IF(VLOOKUP(RC[4],Sheet1!R8C1:R38C3,3,FALSE)="固定值",RC[5],RC[5]/100&"%") -> 附伤+300 | K668: 8 | L668: =VLOOKUP(INT(MOD(RC[-11],1000)/100),R7C9:R9C10,2,FALSE)*RC[-10]*100 -> 300
A669: 3407 | B669: 3 | C669: 60 | D669: =IF(RC2=1,RC[7],R[-1]C&"|"&RC[7]) -> 4|8|4 | E669: =IF(RC2=1,RC[7],R[-1]C&"|"&RC[7]) -> 1500|300|4500 | F669: 天赋 3 | G669: =VLOOKUP(RC[4],Sheet1!R8C1:R38C3,2,FALSE)&"+"&IF(VLOOKUP(RC[4],Sheet1!R8C1:R38C3,3,FALSE)="固定值",RC[5],RC[5]/100&"%") -> 生命+4500 | K669: 4 | L669: =VLOOKUP(INT(MOD(RC[-11],1000)/100),R7C9:R9C10,2,FALSE)*RC[-10]*1000 -> 4500
A670: 3407 | B670: 4 | C670: 80 | D670: =IF(RC2=1,RC[7],R[-1]C&"|"&RC[7]) -> 4|8|4|7 | E670: =IF(RC2=1,RC[7],R[-1]C&"|"&RC[7]) -> 1500|300|4500|600 | F670: 天赋 4 | G670: =VLOOKUP(RC[4],Sheet1!R8C1:R38C3,2,FALSE)&"+"&IF(VLOOKUP(RC[4],Sheet1!R8C1:R38C3,3,FALSE)="固定值",RC[5],RC[5]/100&"%") -> 伤害+6% | K670: 7 | L670: =VLOOKUP(INT(MOD(RC[-11],1000)/100),R7C9:R9C10,2,FALSE)*RC[-10]*100 -> 600
A671: 3407 | B671: 5 | C671: 100 | D671: =IF(RC2=1,RC[7],R[-1]C&"|"&RC[7]) -> 4|8|4|7|4 | E671: =IF(RC2=1,RC[7],R[-1]C&"|"&RC[7]) -> 1500|300|4500|600|7500 | F671: 天赋 5 | G671: =VLOOKUP(RC[4],Sheet1!R8C1:R38C3,2,FALSE)&"+"&IF(VLOOKUP(RC[4],Sheet1!R8C1:R38C3,3,FALSE)="固定值",RC[5],RC[5]/100&"%") -> 生命+7500 | K671: 4 | L671: =VLOOKUP(INT(MOD(RC[-11],1000)/100),R7C9:R9C10,2,FALSE)*RC[-10]*1000 -> 7500
A672: 3407 | B672: 6 | C672: 120 | D672: =IF(RC2=1,RC[7],R[-1]C&"|"&RC[7]) -> 4|8|4|7|4|25 | E672: =IF(RC2=1,RC[7],R[-1]C&"|"&RC[7]) -> 1500|300|4500|600|7500|900 | F672: 天赋 6 | G672: =VLOOKUP(RC[4],Sheet1!R8C1:R38C3,2,FALSE)&"+"&IF(VLOOKUP(RC[4],Sheet1!R8C1:R38C3,3,FALSE)="固定值",RC[5],RC[5]/100&"%") -> 生命+9% | K672: 25 | L672: =VLOOKUP(INT(MOD(RC[-11],1000)/100),R7C9:R9C10,2,FALSE)*RC[-10]*100 -> 900
A673: 3407 | B673: 7 | C673: 140 | D673: =IF(RC2=1,RC[7],R[-1]C&"|"&RC[7]) -> 4|8|4|7|4|25|4 | E673: =IF(RC2=1,RC[7],R[-1]C&"|"&RC[7]) -> 1500|300|4500|600|7500|900|10500 | F673: 天赋 7 | G673: =VLOOKUP(RC[4],Sheet1!R8C1:R38C3,2,FALSE)&"+"&IF(VLOOKUP(RC[4],Sheet1!R8C1:R38C3,3,FALSE)="固定值",RC[5],RC[5]/100&"%") -> 生命+10500 | K673: 4 | L673: =VLOOKUP(INT(MOD(RC[-11],1000)/100),R7C9:R9C10,2,FALSE)*RC[-10]*1000 -> 10500
A674: 3407 | B674: 8 | C674: 160 | D674: =IF(RC2=1,RC[7],R[-1]C&"|"&RC[7]) -> 4|8|4|7|4|25|4|11 | E674: =IF(RC2=1,RC[7],R[-1]C&"|"&RC[7]) -> 1500|300|4500|600|7500|900|10500|1200 | F674: 天赋 8 | G674: =VLOOKUP(RC[4],Sheet1!R8C1:R38C3,2,FALSE)&"+"&IF(VLOOKUP(RC[4],Sheet1!R8C1:R38C3,3,FALSE)="固定值",RC[5],RC[5]/100&"%") -> 命中+12% | K674: 11 | L674: =VLOOKUP(INT(MOD(RC[-11],1000)/100),R7C9:R9C10,2,FALSE)*RC[-10]*100 -> 1200
A675: 3407 | B675: 9 | C675: 180 | D675: =IF(RC2=1,RC[7],R[-1]C&"|"&RC[7]) -> 4|8|4|7|4|25|4|11|4 | E675: =IF(RC2=1,RC[7],R[-1]C&"|"&RC[7]) -> 1500|300|4500|600|7500|900|10500|1200|13500 | F675: 天赋 9 | G675: =VLOOKUP(RC[4],Sheet1!R8C1:R38C3,2,FALSE)&"+"&IF(VLOOKUP(RC[4],Sheet1!R8C1:R38C3,3,FALSE)="固定值",RC[5],RC[5]/100&"%") -> 生命+13500 | K675: 4 | L675: =VLOOKUP(INT(MOD(RC[-11],1000)/100),R7C9:R9C10,2,FALSE)*RC[-10]*1000 -> 13500
A676: 3407 | B676: 10 | C676: 200 | D676: =IF(RC2=1,RC[7],R[-1]C&"|"&RC[7]) -> 4|8|4|7|4|25|4|11|4|25 | E676: =IF(RC2=1,RC[7],R[-1]C&"|"&RC[7]) -> 1500|300|4500|600|7500|900|10500|1200|13500|1500 | F676: 天赋 10 | G676: =VLOOKUP(RC[4],Sheet1!R8C1:R38C3,2,FALSE)&"+"&IF(VLOOKUP(RC[4],Sheet1!R8C1:R38C3,3,FALSE)="固定值",RC[5],RC[5]/100&"%") -> 生命+15% | K676: 25 | L676: =VLOOKUP(INT(MOD(RC[-11],1000)/100),R7C9:R9C10,2,FALSE)*RC[-10]*100 -> 1500
A677: 3408 | B677: 1 | C677: 20 | D677: =IF(RC2=1,RC[7],R[-1]C&"|"&RC[7]) -> 4 | E677: =IF(RC2=1,RC[7],R[-1]C&"|"&RC[7]) -> 1500 | F677: 天赋 1 | G677: =VLOOKUP(RC[4],Sheet1!R8C1:R38C3,2,FALSE)&"+"&IF(VLOOKUP(RC[4],Sheet1!R8C1:R38C3,3,FALSE)="固定值",RC[5],RC[5]/100&"%") -> 生命+1500 | K677: 4 | L677: =VLOOKUP(INT(MOD(RC[-11],1000)/100),R7C9:R9C10,2,FALSE)*RC[-10]*1000 -> 1500
A678: 3408 | B678: 2 | C678: 40 | D678: =IF(RC2=1,RC[7],R[-1]C&"|"&RC[7]) -> 4|8 | E678: =IF(RC2=1,RC[7],R[-1]C&"|"&RC[7]) -> 1500|300 | F678: 天赋 2 | G678: =VLOOKUP(RC[4],Sheet1!R8C1:R38C3,2,FALSE)&"+"&IF(VLOOKUP(RC[4],Sheet1!R8C1:R38C3,3,FALSE)="固定值",RC[5],RC[5]/100&"%") -> 附伤+300 | K678: 8 | L678: =VLOOKUP(INT(MOD(RC[-11],1000)/100),R7C9:R9C10,2,FALSE)*RC[-10]*100 -> 300
A679: 3408 | B679: 3 | C679: 60 | D679: =IF(RC2=1,RC[7],R[-1]C&"|"&RC[7]) -> 4|8|4 | E679: =IF(RC2=1,RC[7],R[-1]C&"|"&RC[7]) -> 1500|300|4500 | F679: 天赋 3 | G679: =VLOOKUP(RC[4],Sheet1!R8C1:R38C3,2,FALSE)&"+"&IF(VLOOKUP(RC[4],Sheet1!R8C1:R38C3,3,FALSE)="固定值",RC[5],RC[5]/100&"%") -> 生命+4500 | K679: 4 | L679: =VLOOKUP(INT(MOD(RC[-11],1000)/100),R7C9:R9C10,2,FALSE)*RC[-10]*1000 -> 4500
A680: 3408 | B680: 4 | C680: 80 | D680: =IF(RC2=1,RC[7],R[-1]C&"|"&RC[7]) -> 4|8|4|7 | E680: =IF(RC2=1,RC[7],R[-1]C&"|"&RC[7]) -> 1500|300|4500|600 | F680: 天赋 4 | G680: =VLOOKUP(RC[4],Sheet1!R8C1:R38C3,2,FALSE)&"+"&IF(VLOOKUP(RC[4],Sheet1!R8C1:R38C3,3,FALSE)="固定值",RC[5],RC[5]/100&"%") -> 伤害+6% | K680: 7 | L680: =VLOOKUP(INT(MOD(RC[-11],1000)/100),R7C9:R9C10,2,FALSE)*RC[-10]*100 -> 600
A681: 3408 | B681: 5 | C681: 100 | D681: =IF(RC2=1,RC[7],R[-1]C&"|"&RC[7]) -> 4|8|4|7|4 | E681: =IF(RC2=1,RC[7],R[-1]C&"|"&RC[7]) -> 1500|300|4500|600|7500 | F681: 天赋 5 | G681: =VLOOKUP(RC[4],Sheet1!R8C1:R38C3,2,FALSE)&"+"&IF(VLOOKUP(RC[4],Sheet1!R8C1:R38C3,3,FALSE)="固定值",RC[5],RC[5]/100&"%") -> 生命+7500 | K681: 4 | L681: =VLOOKUP(INT(MOD(RC[-11],1000)/100),R7C9:R9C10,2,FALSE)*RC[-10]*1000 -> 7500
A682: 3408 | B682: 6 | C682: 120 | D682: =IF(RC2=1,RC[7],R[-1]C&"|"&RC[7]) -> 4|8|4|7|4|25 | E682: =IF(RC2=1,RC[7],R[-1]C&"|"&RC[7]) -> 1500|300|4500|600|7500|900 | F682: 天赋 6 | G682: =VLOOKUP(RC[4],Sheet1!R8C1:R38C3,2,FALSE)&"+"&IF(VLOOKUP(RC[4],Sheet1!R8C1:R38C3,3,FALSE)="固定值",RC[5],RC[5]/100&"%") -> 生命+9% | K682: 25 | L682: =VLOOKUP(INT(MOD(RC[-11],1000)/100),R7C9:R9C10,2,FALSE)*RC[-10]*100 -> 900
A683: 3408 | B683: 7 | C683: 140 | D683: =IF(RC2=1,RC[7],R[-1]C&"|"&RC[7]) -> 4|8|4|7|4|25|4 | E683: =IF(RC2=1,RC[7],R[-1]C&"|"&RC[7]) -> 1500|300|4500|600|7500|900|10500 | F683: 天赋 7 | G683: =VLOOKUP(RC[4],Sheet1!R8C1:R38C3,2,FALSE)&"+"&IF(VLOOKUP(RC[4],Sheet1!R8C1:R38C3,3,FALSE)="固定值",RC[5],RC[5]/100&"%") -> 生命+10500 | K683: 4 | L683: =VLOOKUP(INT(MOD(RC[-11],1000)/100),R7C9:R9C10,2,FALSE)*RC[-10]*1000 -> 10500
A684: 3408 | B684: 8 | C684: 160 | D684: =IF(RC2=1,RC[7],R[-1]C&"|"&RC[7]) -> 4|8|4|7|4|25|4|11 | E684: =IF(RC2=1,RC[7],R[-1]C&"|"&RC[7]) -> 1500|300|4500|600|7500|900|10500|1200 | F684: 天赋 8 | G684: =VLOOKUP(RC[4],Sheet1!R8C1:R38C3,2,FALSE)&"+"&IF(VLOOKUP(RC[4],Sheet1!R8C1:R38C3,3,FALSE)="固定值",RC[5],RC[5]/100&"%") -> 命中+12% | K684: 11 | L684: =VLOOKUP(INT(MOD(RC[-11],1000)/100),R7C9:R9C10,2,FALSE)*RC[-10]*100 -> 1200
A685: 3408 | B685: 9 | C685: 180 | D685: =IF(RC2=1,RC[7],R[-1]C&"|"&RC[7]) -> 4|8|4|7|4|25|4|11|4 | E685: =IF(RC2=1,RC[7],R[-1]C&"|"&RC[7]) -> 1500|300|4500|600|7500|900|10500|1200|13500 | F685: 天赋 9 | G685: =VLOOKUP(RC[4],Sheet1!R8C1:R38C3,2,FALSE)&"+"&IF(VLOOKUP(RC[4],Sheet1!R8C1:R38C3,3,FALSE)="固定值",RC[5],RC[5]/100&"%") -> 生命+13500 | K685: 4 | L685: =VLOOKUP(INT(MOD(RC[-11],1000)/100),R7C9:R9C10,2,FALSE)*RC[-10]*1000 -> 13500
A686: 3408 | B686: 10 | C686: 200 | D686: =IF(RC2=1,RC[7],R[-1]C&"|"&RC[7]) -> 4|8|4|7|4|25|4|11|4|25 | E686: =IF(RC2=1,RC[7],R[-1]C&"|"&RC[7]) -> 1500|300|4500|600|7500|900|10500|1200|13500|1500 | F686: 天赋 10 | G686: =VLOOKUP(RC[4],Sheet1!R8C1:R38C3,2,FALSE)&"+"&IF(VLOOKUP(RC[4],Sheet1!R8C1:R38C3,3,FALSE)="固定值",RC[5],RC[5]/100&"%") -> 生命+15% | K686: 25 | L686: =VLOOKUP(INT(MOD(RC[-11],1000)/100),R7C9:R9C10,2,FALSE)*RC[-10]*100 -> 1500

Sheet: 9.装备升星
A1: type|type | B1: sort_lst| | C1: quality|quality | D1: star|star | E1: level|level | F1: is_star_up|is_star_up | G1: cost_item_id|cost_item_id | H1: cost_item_num|cost_item_num | I1: cost_self_num|cost_self_num | J1: cost_gold|cost_gold | K1: pro_type_list|pro_type_list | L1: pro_value_list|pro_value_list | M1: activate_pro_des|activate_pro_des
A2: 不可空 | B2: 不可空 | C2: 不可空 | D2: 不可空 | E2: 不可空 | F2: 不可空 | G2: 不可空 | H2: 不可空 | I2: 不可空 | J2: 不可空 | K2: 不可空 | L2: 不可空 | M2: 可空#不需字段
A3: 数字 | B3: 数字 | C3: 数字 | D3: 数字 | E3: 数字 | F3: 数字 | G3: 数字 | H3: 数字 | I3: 数字 | J3: 数字 | K3: 一维数组 | L3: 一维数组 | M3: 字符串
K4: 不定长 | L4: 不定长
A6: 装备类型 | B6: 索引 | C6: 装备品质 | D6: 星级 | E6: 等级 | F6: 是否升星 | G6: 消耗道具ID | H6: 消耗道具数量 | I6: 消耗对应碎片数量 | J6: 消耗金币数量 | K6: 属性类型列表 | L6: 属性值列表 | M6: 激活属性描述
A7: 0 | B7: 1 | C7: 5 | D7: 0 | E7: 0 | F7: 0 | G7: 10115 | H7: 5 | I7: 10 | J7: 50000 | K7: 1 | L7: 0
A8: 0 | B8: 2 | C8: 5 | D8: 0 | E8: 1 | F8: 0 | G8: 10115 | H8: 5 | I8: 12 | J8: 50000 | K8: 1 | L8: 155
A9: 0 | B9: 3 | C9: 5 | D9: 0 | E9: 2 | F9: 0 | G9: 10115 | H9: 5 | I9: 14 | J9: 50000 | K9: 1 | L9: 320
A10: 0 | B10: 4 | C10: 5 | D10: 0 | E10: 3 | F10: 0 | G10: 10115 | H10: 5 | I10: 16 | J10: 50000 | K10: 1 | L10: 485
A11: 0 | B11: 5 | C11: 5 | D11: 0 | E11: 4 | F11: 0 | G11: 10115 | H11: 5 | I11: 18 | J11: 50000 | K11: 1 | L11: 660
A12: 0 | B12: 6 | C12: 5 | D12: 0 | E12: 5 | F12: 0 | G12: 10115 | H12: 7 | I12: 20 | J12: 50000 | K12: 1 | L12: 840
A13: 0 | B13: 7 | C13: 5 | D13: 0 | E13: 6 | F13: 0 | G13: 10115 | H13: 7 | I13: 22 | J13: 50000 | K13: 1 | L13: 1025
A14: 0 | B14: 8 | C14: 5 | D14: 0 | E14: 7 | F14: 0 | G14: 10115 | H14: 7 | I14: 24 | J14: 50000 | K14: 1 | L14: 1220
A15: 0 | B15: 9 | C15: 5 | D15: 0 | E15: 8 | F15: 0 | G15: 10115 | H15: 7 | I15: 26 | J15: 50000 | K15: 1 | L15: 1420
A16: 0 | B16: 10 | C16: 5 | D16: 0 | E16: 9 | F16: 0 | G16: 10115 | H16: 7 | I16: 28 | J16: 50000 | K16: 1 | L16: 1625
A17: 0 | B17: 11 | C17: 5 | D17: 0 | E17: 10 | F17: 1 | G17: 10115 | H17: 20 | I17: 50 | J17: 250000 | K17: 1 | L17: 1835
A18: 0 | B18: 12 | C18: 5 | D18: 1 | E18: 0 | F18: 0 | G18: 10115 | H18: 10 | I18: 20 | J18: 100000 | K18: 1|27 | L18: 2060|200 | M18: 最终攻击+2%
A19: 0 | B19: 13 | C19: 5 | D19: 1 | E19: 1 | F19: 0 | G19: 10115 | H19: 10 | I19: 22 | J19: 100000 | K19: 1|27 | L19: 2285|200
A20: 0 | B20: 14 | C20: 5 | D20: 1 | E20: 2 | F20: 0 | G20: 10115 | H20: 10 | I20: 24 | J20: 100000 | K20: 1|27 | L20: 2520|200
A21: 0 | B21: 15 | C21: 5 | D21: 1 | E21: 3 | F21: 0 | G21: 10115 | H21: 10 | I21: 26 | J21: 100000 | K21: 1|27 | L21: 2760|200
A22: 0 | B22: 16 | C22: 5 | D22: 1 | E22: 4 | F22: 0 | G22: 10115 | H22: 10 | I22: 28 | J22: 100000 | K22: 1|27 | L22: 3010|200
A23: 0 | B23: 17 | C23: 5 | D23: 1 | E23: 5 | F23: 0 | G23: 10115 | H23: 15 | I23: 30 | J23: 100000 | K23: 1|27 | L23: 3270|200
A24: 0 | B24: 18 | C24: 5 | D24: 1 | E24: 6 | F24: 0 | G24: 10115 | H24: 15 | I24: 32 | J24: 100000 | K24: 1|27 | L24: 3535|200
A25: 0 | B25: 19 | C25: 5 | D25: 1 | E25: 7 | F25: 0 | G25: 10115 | H25: 15 | I25: 34 | J25: 100000 | K25: 1|27 | L25: 3810|200
A26: 0 | B26: 20 | C26: 5 | D26: 1 | E26: 8 | F26: 0 | G26: 10115 | H26: 15 | I26: 36 | J26: 100000 | K26: 1|27 | L26: 4090|200
A27: 0 | B27: 21 | C27: 5 | D27: 1 | E27: 9 | F27: 0 | G27: 10115 | H27: 15 | I27: 38 | J27: 100000 | K27: 1|27 | L27: 4385|200
A28: 0 | B28: 22 | C28: 5 | D28: 1 | E28: 10 | F28: 1 | G28: 10115 | H28: 50 | I28: 70 | J28: 500000 | K28: 1|27 | L28: 4685|200
A29: 0 | B29: 23 | C29: 5 | D29: 2 | E29: 0 | F29: 0 | G29: 10115 | H29: 25 | I29: 30 | J29: 150000 | K29: 1|27 | L29: 4995|400 | M29: 最终攻击+4%
A30: 0 | B30: 24 | C30: 5 | D30: 2 | E30: 1 | F30: 0 | G30: 10115 | H30: 25 | I30: 32 | J30: 150000 | K30: 1|27 | L30: 5315|400
A31: 0 | B31: 25 | C31: 5 | D31: 2 | E31: 2 | F31: 0 | G31: 10115 | H31: 25 | I31: 34 | J31: 150000 | K31: 1|27 | L31: 5640|400
A32: 0 | B32: 26 | C32: 5 | D32: 2 | E32: 3 | F32: 0 | G32: 10115 | H32: 25 | I32: 36 | J32: 150000 | K32: 1|27 | L32: 5980|400
A33: 0 | B33: 27 | C33: 5 | D33: 2 | E33: 4 | F33: 0 | G33: 10115 | H33: 25 | I33: 38 | J33: 150000 | K33: 1|27 | L33: 6330|400
A34: 0 | B34: 28 | C34: 5 | D34: 2 | E34: 5 | F34: 0 | G34: 10115 | H34: 40 | I34: 40 | J34: 150000 | K34: 1|27 | L34: 6690|400
A35: 0 | B35: 29 | C35: 5 | D35: 2 | E35: 6 | F35: 0 | G35: 10115 | H35: 40 | I35: 42 | J35: 150000 | K35: 1|27 | L35: 7060|400
A36: 0 | B36: 30 | C36: 5 | D36: 2 | E36: 7 | F36: 0 | G36: 10115 | H36: 40 | I36: 44 | J36: 150000 | K36: 1|27 | L36: 7440|400
A37: 0 | B37: 31 | C37: 5 | D37: 2 | E37: 8 | F37: 0 | G37: 10115 | H37: 40 | I37: 46 | J37: 150000 | K37: 1|27 | L37: 7830|400
A38: 0 | B38: 32 | C38: 5 | D38: 2 | E38: 9 | F38: 0 | G38: 10115 | H38: 40 | I38: 48 | J38: 150000 | K38: 1|27 | L38: 8235|400
A39: 0 | B39: 33 | C39: 5 | D39: 2 | E39: 10 | F39: 1 | G39: 10115 | H39: 125 | I39: 90 | J39: 750000 | K39: 1|27 | L39: 8650|400
A40: 0 | B40: 34 | C40: 5 | D40: 3 | E40: 0 | F40: 0 | G40: 10115 | H40: 60 | I40: 40 | J40: 200000 | K40: 1|27 | L40: 9075|600 | M40: 最终攻击+6%
A41: 0 | B41: 35 | C41: 5 | D41: 3 | E41: 1 | F41: 0 | G41: 10115 | H41: 60 | I41: 42 | J41: 200000 | K41: 1|27 | L41: 9515|600
A42: 0 | B42: 36 | C42: 5 | D42: 3 | E42: 2 | F42: 0 | G42: 10115 | H42: 60 | I42: 44 | J42: 200000 | K42: 1|27 | L42: 9970|600
A43: 0 | B43: 37 | C43: 5 | D43: 3 | E43: 3 | F43: 0 | G43: 10115 | H43: 60 | I43: 46 | J43: 200000 | K43: 1|27 | L43: 10430|600
A44: 0 | B44: 38 | C44: 5 | D44: 3 | E44: 4 | F44: 0 | G44: 10115 | H44: 60 | I44: 48 | J44: 200000 | K44: 1|27 | L44: 10910|600
A45: 0 | B45: 39 | C45: 5 | D45: 3 | E45: 5 | F45: 0 | G45: 10115 | H45: 85 | I45: 50 | J45: 200000 | K45: 1|27 | L45: 11400|600
A46: 0 | B46: 40 | C46: 5 | D46: 3 | E46: 6 | F46: 0 | G46: 10115 | H46: 85 | I46: 52 | J46: 200000 | K46: 1|27 | L46: 11905|600
A47: 0 | B47: 41 | C47: 5 | D47: 3 | E47: 7 | F47: 0 | G47: 10115 | H47: 85 | I47: 54 | J47: 200000 | K47: 1|27 | L47: 12425|600
A48: 0 | B48: 42 | C48: 5 | D48: 3 | E48: 8 | F48: 0 | G48: 10115 | H48: 85 | I48: 56 | J48: 200000 | K48: 1|27 | L48: 12960|600
A49: 0 | B49: 43 | C49: 5 | D49: 3 | E49: 9 | F49: 0 | G49: 10115 | H49: 85 | I49: 58 | J49: 200000 | K49: 1|27 | L49: 13510|600
A50: 0 | B50: 44 | C50: 5 | D50: 3 | E50: 10 | F50: 1 | G50: 10115 | H50: 300 | I50: 110 | J50: 1000000 | K50: 1|27 | L50: 14070|600
A51: 0 | B51: 45 | C51: 5 | D51: 4 | E51: 0 | F51: 0 | G51: 10115 | H51: 115 | I51: 50 | J51: 250000 | K51: 1|27 | L51: 14650|800 | M51: 最终攻击+8%
A52: 0 | B52: 46 | C52: 5 | D52: 4 | E52: 1 | F52: 0 | G52: 10115 | H52: 115 | I52: 52 | J52: 250000 | K52: 1|27 | L52: 15245|800
A53: 0 | B53: 47 | C53: 5 | D53: 4 | E53: 2 | F53: 0 | G53: 10115 | H53: 115 | I53: 54 | J53: 250000 | K53: 1|27 | L53: 15855|800
A54: 0 | B54: 48 | C54: 5 | D54: 4 | E54: 3 | F54: 0 | G54: 10115 | H54: 115 | I54: 56 | J54: 250000 | K54: 1|27 | L54: 16485|800
A55: 0 | B55: 49 | C55: 5 | D55: 4 | E55: 4 | F55: 0 | G55: 10115 | H55: 115 | I55: 58 | J55: 250000 | K55: 1|27 | L55: 17130|800
A56: 0 | B56: 50 | C56: 5 | D56: 4 | E56: 5 | F56: 0 | G56: 10115 | H56: 150 | I56: 60 | J56: 250000 | K56: 1|27 | L56: 17790|800
A57: 0 | B57: 51 | C57: 5 | D57: 4 | E57: 6 | F57: 0 | G57: 10115 | H57: 150 | I57: 62 | J57: 250000 | K57: 1|27 | L57: 18475|800
A58: 0 | B58: 52 | C58: 5 | D58: 4 | E58: 7 | F58: 0 | G58: 10115 | H58: 150 | I58: 64 | J58: 250000 | K58: 1|27 | L58: 19175|800
A59: 0 | B59: 53 | C59: 5 | D59: 4 | E59: 8 | F59: 0 | G59: 10115 | H59: 150 | I59: 66 | J59: 250000 | K59: 1|27 | L59: 19885|800
A60: 0 | B60: 54 | C60: 5 | D60: 4 | E60: 9 | F60: 0 | G60: 10115 | H60: 150 | I60: 68 | J60: 250000 | K60: 1|27 | L60: 20625|800
A61: 0 | B61: 55 | C61: 5 | D61: 4 | E61: 10 | F61: 1 | G61: 10115 | H61: 575 | I61: 130 | J61: 1250000 | K61: 1|27 | L61: 21385|800
A62: 0 | B62: 56 | C62: 5 | D62: 5 | E62: 0 | F62: 0 | G62: 10115 | H62: 190 | I62: 60 | J62: 300000 | K62: 1|27 | L62: 22155|1000 | M62: 最终攻击+10%
A63: 0 | B63: 57 | C63: 5 | D63: 5 | E63: 1 | F63: 0 | G63: 10115 | H63: 190 | I63: 62 | J63: 300000 | K63: 1|27 | L63: 23240|1000
A64: 0 | B64: 58 | C64: 5 | D64: 5 | E64: 2 | F64: 0 | G64: 10115 | H64: 190 | I64: 64 | J64: 300000 | K64: 1|27 | L64: 24360|1000
A65: 0 | B65: 59 | C65: 5 | D65: 5 | E65: 3 | F65: 0 | G65: 10115 | H65: 190 | I65: 66 | J65: 300000 | K65: 1|27 | L65: 25525|1000
A66: 0 | B66: 60 | C66: 5 | D66: 5 | E66: 4 | F66: 0 | G66: 10115 | H66: 190 | I66: 68 | J66: 300000 | K66: 1|27 | L66: 26725|1000
A67: 0 | B67: 61 | C67: 5 | D67: 5 | E67: 5 | F67: 0 | G67: 10115 | H67: 235 | I67: 70 | J67: 300000 | K67: 1|27 | L67: 27975|1000
A68: 0 | B68: 62 | C68: 5 | D68: 5 | E68: 6 | F68: 0 | G68: 10115 | H68: 235 | I68: 72 | J68: 300000 | K68: 1|27 | L68: 29265|1000
A69: 0 | B69: 63 | C69: 5 | D69: 5 | E69: 7 | F69: 0 | G69: 10115 | H69: 235 | I69: 74 | J69: 300000 | K69: 1|27 | L69: 30595|1000
A70: 0 | B70: 64 | C70: 5 | D70: 5 | E70: 8 | F70: 0 | G70: 10115 | H70: 235 | I70: 76 | J70: 300000 | K70: 1|27 | L70: 31980|1000
A71: 0 | B71: 65 | C71: 5 | D71: 5 | E71: 9 | F71: 0 | G71: 10115 | H71: 235 | I71: 78 | J71: 300000 | K71: 1|27 | L71: 33405|1000
A72: 0 | B72: 66 | C72: 5 | D72: 5 | E72: 10 | F72: 1 | G72: 10115 | H72: 950 | I72: 150 | J72: 1500000 | K72: 1|27 | L72: 34885|1000
A73: 0 | B73: 67 | C73: 5 | D73: 6 | E73: 0 | F73: 0 | G73: 10115 | H73: 1 | I73: 70 | J73: 350000 | K73: 1|27 | L73: 36415|1200 | M73: 最终攻击+12%
A74: 1 | B74: 1 | C74: 5 | D74: 0 | E74: 0 | F74: 0 | G74: 10115 | H74: 5 | I74: 10 | J74: 50000 | K74: 2 | L74: 0
A75: 1 | B75: 2 | C75: 5 | D75: 0 | E75: 1 | F75: 0 | G75: 10115 | H75: 5 | I75: 12 | J75: 50000 | K75: 2 | L75: 155
A76: 1 | B76: 3 | C76: 5 | D76: 0 | E76: 2 | F76: 0 | G76: 10115 | H76: 5 | I76: 14 | J76: 50000 | K76: 2 | L76: 320
A77: 1 | B77: 4 | C77: 5 | D77: 0 | E77: 3 | F77: 0 | G77: 10115 | H77: 5 | I77: 16 | J77: 50000 | K77: 2 | L77: 485
A78: 1 | B78: 5 | C78: 5 | D78: 0 | E78: 4 | F78: 0 | G78: 10115 | H78: 5 | I78: 18 | J78: 50000 | K78: 2 | L78: 660
A79: 1 | B79: 6 | C79: 5 | D79: 0 | E79: 5 | F79: 0 | G79: 10115 | H79: 7 | I79: 20 | J79: 50000 | K79: 2 | L79: 840
A80: 1 | B80: 7 | C80: 5 | D80: 0 | E80: 6 | F80: 0 | G80: 10115 | H80: 7 | I80: 22 | J80: 50000 | K80: 2 | L80: 1025
A81: 1 | B81: 8 | C81: 5 | D81: 0 | E81: 7 | F81: 0 | G81: 10115 | H81: 7 | I81: 24 | J81: 50000 | K81: 2 | L81: 1220
A82: 1 | B82: 9 | C82: 5 | D82: 0 | E82: 8 | F82: 0 | G82: 10115 | H82: 7 | I82: 26 | J82: 50000 | K82: 2 | L82: 1420
A83: 1 | B83: 10 | C83: 5 | D83: 0 | E83: 9 | F83: 0 | G83: 10115 | H83: 7 | I83: 28 | J83: 50000 | K83: 2 | L83: 1625
A84: 1 | B84: 11 | C84: 5 | D84: 0 | E84: 10 | F84: 1 | G84: 10115 | H84: 20 | I84: 50 | J84: 250000 | K84: 2 | L84: 1835
A85: 1 | B85: 12 | C85: 5 | D85: 1 | E85: 0 | F85: 0 | G85: 10115 | H85: 10 | I85: 20 | J85: 100000 | K85: 2|28 | L85: 2060|200 | M85: 最终物防+2%
A86: 1 | B86: 13 | C86: 5 | D86: 1 | E86: 1 | F86: 0 | G86: 10115 | H86: 10 | I86: 22 | J86: 100000 | K86: 2|28 | L86: 2285|200
A87: 1 | B87: 14 | C87: 5 | D87: 1 | E87: 2 | F87: 0 | G87: 10115 | H87: 10 | I87: 24 | J87: 100000 | K87: 2|28 | L87: 2520|200
A88: 1 | B88: 15 | C88: 5 | D88: 1 | E88: 3 | F88: 0 | G88: 10115 | H88: 10 | I88: 26 | J88: 100000 | K88: 2|28 | L88: 2760|200
A89: 1 | B89: 16 | C89: 5 | D89: 1 | E89: 4 | F89: 0 | G89: 10115 | H89: 10 | I89: 28 | J89: 100000 | K89: 2|28 | L89: 3010|200
A90: 1 | B90: 17 | C90: 5 | D90: 1 | E90: 5 | F90: 0 | G90: 10115 | H90: 15 | I90: 30 | J90: 100000 | K90: 2|28 | L90: 3270|200
A91: 1 | B91: 18 | C91: 5 | D91: 1 | E91: 6 | F91: 0 | G91: 10115 | H91: 15 | I91: 32 | J91: 100000 | K91: 2|28 | L91: 3535|200
A92: 1 | B92: 19 | C92: 5 | D92: 1 | E92: 7 | F92: 0 | G92: 10115 | H92: 15 | I92: 34 | J92: 100000 | K92: 2|28 | L92: 3810|200
A93: 1 | B93: 20 | C93: 5 | D93: 1 | E93: 8 | F93: 0 | G93: 10115 | H93: 15 | I93: 36 | J93: 100000 | K93: 2|28 | L93: 4090|200
A94: 1 | B94: 21 | C94: 5 | D94: 1 | E94: 9 | F94: 0 | G94: 10115 | H94: 15 | I94: 38 | J94: 100000 | K94: 2|28 | L94: 4385|200
A95: 1 | B95: 22 | C95: 5 | D95: 1 | E95: 10 | F95: 1 | G95: 10115 | H95: 50 | I95: 70 | J95: 500000 | K95: 2|28 | L95: 4685|200
A96: 1 | B96: 23 | C96: 5 | D96: 2 | E96: 0 | F96: 0 | G96: 10115 | H96: 25 | I96: 30 | J96: 150000 | K96: 2|28 | L96: 4995|400 | M96: 最终物防+4%
A97: 1 | B97: 24 | C97: 5 | D97: 2 | E97: 1 | F97: 0 | G97: 10115 | H97: 25 | I97: 32 | J97: 150000 | K97: 2|28 | L97: 5315|400
A98: 1 | B98: 25 | C98: 5 | D98: 2 | E98: 2 | F98: 0 | G98: 10115 | H98: 25 | I98: 34 | J98: 150000 | K98: 2|28 | L98: 5640|400
A99: 1 | B99: 26 | C99: 5 | D99: 2 | E99: 3 | F99: 0 | G99: 10115 | H99: 25 | I99: 36 | J99: 150000 | K99: 2|28 | L99: 5980|400
A100: 1 | B100: 27 | C100: 5 | D100: 2 | E100: 4 | F100: 0 | G100: 10115 | H100: 25 | I100: 38 | J100: 150000 | K100: 2|28 | L100: 6330|400
A101: 1 | B101: 28 | C101: 5 | D101: 2 | E101: 5 | F101: 0 | G101: 10115 | H101: 40 | I101: 40 | J101: 150000 | K101: 2|28 | L101: 6690|400
A102: 1 | B102: 29 | C102: 5 | D102: 2 | E102: 6 | F102: 0 | G102: 10115 | H102: 40 | I102: 42 | J102: 150000 | K102: 2|28 | L102: 7060|400
A103: 1 | B103: 30 | C103: 5 | D103: 2 | E103: 7 | F103: 0 | G103: 10115 | H103: 40 | I103: 44 | J103: 150000 | K103: 2|28 | L103: 7440|400
A104: 1 | B104: 31 | C104: 5 | D104: 2 | E104: 8 | F104: 0 | G104: 10115 | H104: 40 | I104: 46 | J104: 150000 | K104: 2|28 | L104: 7830|400
A105: 1 | B105: 32 | C105: 5 | D105: 2 | E105: 9 | F105: 0 | G105: 10115 | H105: 40 | I105: 48 | J105: 150000 | K105: 2|28 | L105: 8235|400
A106: 1 | B106: 33 | C106: 5 | D106: 2 | E106: 10 | F106: 1 | G106: 10115 | H106: 125 | I106: 90 | J106: 750000 | K106: 2|28 | L106: 8650|400
A107: 1 | B107: 34 | C107: 5 | D107: 3 | E107: 0 | F107: 0 | G107: 10115 | H107: 60 | I107: 40 | J107: 200000 | K107: 2|28 | L107: 9075|600 | M107: 最终物防+6%
A108: 1 | B108: 35 | C108: 5 | D108: 3 | E108: 1 | F108: 0 | G108: 10115 | H108: 60 | I108: 42 | J108: 200000 | K108: 2|28 | L108: 9515|600
A109: 1 | B109: 36 | C109: 5 | D109: 3 | E109: 2 | F109: 0 | G109: 10115 | H109: 60 | I109: 44 | J109: 200000 | K109: 2|28 | L109: 9970|600
A110: 1 | B110: 37 | C110: 5 | D110: 3 | E110: 3 | F110: 0 | G110: 10115 | H110: 60 | I110: 46 | J110: 200000 | K110: 2|28 | L110: 10430|600
A111: 1 | B111: 38 | C111: 5 | D111: 3 | E111: 4 | F111: 0 | G111: 10115 | H111: 60 | I111: 48 | J111: 200000 | K111: 2|28 | L111: 10910|600
A112: 1 | B112: 39 | C112: 5 | D112: 3 | E112: 5 | F112: 0 | G112: 10115 | H112: 85 | I112: 50 | J112: 200000 | K112: 2|28 | L112: 11400|600
A113: 1 | B113: 40 | C113: 5 | D113: 3 | E113: 6 | F113: 0 | G113: 10115 | H113: 85 | I113: 52 | J113: 200000 | K113: 2|28 | L113: 11905|600
A114: 1 | B114: 41 | C114: 5 | D114: 3 | E114: 7 | F114: 0 | G114: 10115 | H114: 85 | I114: 54 | J114: 200000 | K114: 2|28 | L114: 12425|600
A115: 1 | B115: 42 | C115: 5 | D115: 3 | E115: 8 | F115: 0 | G115: 10115 | H115: 85 | I115: 56 | J115: 200000 | K115: 2|28 | L115: 12960|600
A116: 1 | B116: 43 | C116: 5 | D116: 3 | E116: 9 | F116: 0 | G116: 10115 | H116: 85 | I116: 58 | J116: 200000 | K116: 2|28 | L116: 13510|600
A117: 1 | B117: 44 | C117: 5 | D117: 3 | E117: 10 | F117: 1 | G117: 10115 | H117: 300 | I117: 110 | J117: 1000000 | K117: 2|28 | L117: 14070|600
A118: 1 | B118: 45 | C118: 5 | D118: 4 | E118: 0 | F118: 0 | G118: 10115 | H118: 115 | I118: 50 | J118: 250000 | K118: 2|28 | L118: 14650|800 | M118: 最终物防+8%
A119: 1 | B119: 46 | C119: 5 | D119: 4 | E119: 1 | F119: 0 | G119: 10115 | H119: 115 | I119: 52 | J119: 250000 | K119: 2|28 | L119: 15245|800
A120: 1 | B120: 47 | C120: 5 | D120: 4 | E120: 2 | F120: 0 | G120: 10115 | H120: 115 | I120: 54 | J120: 250000 | K120: 2|28 | L120: 15855|800
A121: 1 | B121: 48 | C121: 5 | D121: 4 | E121: 3 | F121: 0 | G121: 10115 | H121: 115 | I121: 56 | J121: 250000 | K121: 2|28 | L121: 16485|800
A122: 1 | B122: 49 | C122: 5 | D122: 4 | E122: 4 | F122: 0 | G122: 10115 | H122: 115 | I122: 58 | J122: 250000 | K122: 2|28 | L122: 17130|800
A123: 1 | B123: 50 | C123: 5 | D123: 4 | E123: 5 | F123: 0 | G123: 10115 | H123: 150 | I123: 60 | J123: 250000 | K123: 2|28 | L123: 17790|800
A124: 1 | B124: 51 | C124: 5 | D124: 4 | E124: 6 | F124: 0 | G124: 10115 | H124: 150 | I124: 62 | J124: 250000 | K124: 2|28 | L124: 18475|800
A125: 1 | B125: 52 | C125: 5 | D125: 4 | E125: 7 | F125: 0 | G125: 10115 | H125: 150 | I125: 64 | J125: 250000 | K125: 2|28 | L125: 19175|800
A126: 1 | B126: 53 | C126: 5 | D126: 4 | E126: 8 | F126: 0 | G126: 10115 | H126: 150 | I126: 66 | J126: 250000 | K126: 2|28 | L126: 19885|800
A127: 1 | B127: 54 | C127: 5 | D127: 4 | E127: 9 | F127: 0 | G127: 10115 | H127: 150 | I127: 68 | J127: 250000 | K127: 2|28 | L127: 20625|800
A128: 1 | B128: 55 | C128: 5 | D128: 4 | E128: 10 | F128: 1 | G128: 10115 | H128: 575 | I128: 130 | J128: 1250000 | K128: 2|28 | L128: 21385|800
A129: 1 | B129: 56 | C129: 5 | D129: 5 | E129: 0 | F129: 0 | G129: 10115 | H129: 190 | I129: 60 | J129: 300000 | K129: 2|28 | L129: 22155|1000 | M129: 最终物防+10%
A130: 1 | B130: 57 | C130: 5 | D130: 5 | E130: 1 | F130: 0 | G130: 10115 | H130: 190 | I130: 62 | J130: 300000 | K130: 2|28 | L130: 23240|1000
A131: 1 | B131: 58 | C131: 5 | D131: 5 | E131: 2 | F131: 0 | G131: 10115 | H131: 190 | I131: 64 | J131: 300000 | K131: 2|28 | L131: 24360|1000
A132: 1 | B132: 59 | C132: 5 | D132: 5 | E132: 3 | F132: 0 | G132: 10115 | H132: 190 | I132: 66 | J132: 300000 | K132: 2|28 | L132: 25525|1000
A133: 1 | B133: 60 | C133: 5 | D133: 5 | E133: 4 | F133: 0 | G133: 10115 | H133: 190 | I133: 68 | J133: 300000 | K133: 2|28 | L133: 26725|1000
A134: 1 | B134: 61 | C134: 5 | D134: 5 | E134: 5 | F134: 0 | G134: 10115 | H134: 235 | I134: 70 | J134: 300000 | K134: 2|28 | L134: 27975|1000
A135: 1 | B135: 62 | C135: 5 | D135: 5 | E135: 6 | F135: 0 | G135: 10115 | H135: 235 | I135: 72 | J135: 300000 | K135: 2|28 | L135: 29265|1000
A136: 1 | B136: 63 | C136: 5 | D136: 5 | E136: 7 | F136: 0 | G136: 10115 | H136: 235 | I136: 74 | J136: 300000 | K136: 2|28 | L136: 30595|1000
A137: 1 | B137: 64 | C137: 5 | D137: 5 | E137: 8 | F137: 0 | G137: 10115 | H137: 235 | I137: 76 | J137: 300000 | K137: 2|28 | L137: 31980|1000
A138: 1 | B138: 65 | C138: 5 | D138: 5 | E138: 9 | F138: 0 | G138: 10115 | H138: 235 | I138: 78 | J138: 300000 | K138: 2|28 | L138: 33405|1000
A139: 1 | B139: 66 | C139: 5 | D139: 5 | E139: 10 | F139: 1 | G139: 10115 | H139: 950 | I139: 150 | J139: 1500000 | K139: 2|28 | L139: 34885|1000
A140: 1 | B140: 67 | C140: 5 | D140: 6 | E140: 0 | F140: 0 | G140: 10115 | H140: 1 | I140: 70 | J140: 350000 | K140: 2|28 | L140: 36415|1200 | M140: 最终物防+12%
A141: 2 | B141: 1 | C141: 5 | D141: 0 | E141: 0 | F141: 0 | G141: 10115 | H141: 5 | I141: 10 | J141: 50000 | K141: 3 | L141: 0
A142: 2 | B142: 2 | C142: 5 | D142: 0 | E142: 1 | F142: 0 | G142: 10115 | H142: 5 | I142: 12 | J142: 50000 | K142: 3 | L142: 155
A143: 2 | B143: 3 | C143: 5 | D143: 0 | E143: 2 | F143: 0 | G143: 10115 | H143: 5 | I143: 14 | J143: 50000 | K143: 3 | L143: 320
A144: 2 | B144: 4 | C144: 5 | D144: 0 | E144: 3 | F144: 0 | G144: 10115 | H144: 5 | I144: 16 | J144: 50000 | K144: 3 | L144: 485
A145: 2 | B145: 5 | C145: 5 | D145: 0 | E145: 4 | F145: 0 | G145: 10115 | H145: 5 | I145: 18 | J145: 50000 | K145: 3 | L145: 660
A146: 2 | B146: 6 | C146: 5 | D146: 0 | E146: 5 | F146: 0 | G146: 10115 | H146: 7 | I146: 20 | J146: 50000 | K146: 3 | L146: 840
A147: 2 | B147: 7 | C147: 5 | D147: 0 | E147: 6 | F147: 0 | G147: 10115 | H147: 7 | I147: 22 | J147: 50000 | K147: 3 | L147: 1025
A148: 2 | B148: 8 | C148: 5 | D148: 0 | E148: 7 | F148: 0 | G148: 10115 | H148: 7 | I148: 24 | J148: 50000 | K148: 3 | L148: 1220
A149: 2 | B149: 9 | C149: 5 | D149: 0 | E149: 8 | F149: 0 | G149: 10115 | H149: 7 | I149: 26 | J149: 50000 | K149: 3 | L149: 1420
A150: 2 | B150: 10 | C150: 5 | D150: 0 | E150: 9 | F150: 0 | G150: 10115 | H150: 7 | I150: 28 | J150: 50000 | K150: 3 | L150: 1625
A151: 2 | B151: 11 | C151: 5 | D151: 0 | E151: 10 | F151: 1 | G151: 10115 | H151: 20 | I151: 50 | J151: 250000 | K151: 3 | L151: 1835
A152: 2 | B152: 12 | C152: 5 | D152: 1 | E152: 0 | F152: 0 | G152: 10115 | H152: 10 | I152: 20 | J152: 100000 | K152: 3|29 | L152: 2060|200 | M152: 最终法防+2%
A153: 2 | B153: 13 | C153: 5 | D153: 1 | E153: 1 | F153: 0 | G153: 10115 | H153: 10 | I153: 22 | J153: 100000 | K153: 3|29 | L153: 2285|200
A154: 2 | B154: 14 | C154: 5 | D154: 1 | E154: 2 | F154: 0 | G154: 10115 | H154: 10 | I154: 24 | J154: 100000 | K154: 3|29 | L154: 2520|200
A155: 2 | B155: 15 | C155: 5 | D155: 1 | E155: 3 | F155: 0 | G155: 10115 | H155: 10 | I155: 26 | J155: 100000 | K155: 3|29 | L155: 2760|200
A156: 2 | B156: 16 | C156: 5 | D156: 1 | E156: 4 | F156: 0 | G156: 10115 | H156: 10 | I156: 28 | J156: 100000 | K156: 3|29 | L156: 3010|200
A157: 2 | B157: 17 | C157: 5 | D157: 1 | E157: 5 | F157: 0 | G157: 10115 | H157: 15 | I157: 30 | J157: 100000 | K157: 3|29 | L157: 3270|200
A158: 2 | B158: 18 | C158: 5 | D158: 1 | E158: 6 | F158: 0 | G158: 10115 | H158: 15 | I158: 32 | J158: 100000 | K158: 3|29 | L158: 3535|200
A159: 2 | B159: 19 | C159: 5 | D159: 1 | E159: 7 | F159: 0 | G159: 10115 | H159: 15 | I159: 34 | J159: 100000 | K159: 3|29 | L159: 3810|200
A160: 2 | B160: 20 | C160: 5 | D160: 1 | E160: 8 | F160: 0 | G160: 10115 | H160: 15 | I160: 36 | J160: 100000 | K160: 3|29 | L160: 4090|200
A161: 2 | B161: 21 | C161: 5 | D161: 1 | E161: 9 | F161: 0 | G161: 10115 | H161: 15 | I161: 38 | J161: 100000 | K161: 3|29 | L161: 4385|200
A162: 2 | B162: 22 | C162: 5 | D162: 1 | E162: 10 | F162: 1 | G162: 10115 | H162: 50 | I162: 70 | J162: 500000 | K162: 3|29 | L162: 4685|200
A163: 2 | B163: 23 | C163: 5 | D163: 2 | E163: 0 | F163: 0 | G163: 10115 | H163: 25 | I163: 30 | J163: 150000 | K163: 3|29 | L163: 4995|400 | M163: 最终法防+4%
A164: 2 | B164: 24 | C164: 5 | D164: 2 | E164: 1 | F164: 0 | G164: 10115 | H164: 25 | I164: 32 | J164: 150000 | K164: 3|29 | L164: 5315|400
A165: 2 | B165: 25 | C165: 5 | D165: 2 | E165: 2 | F165: 0 | G165: 10115 | H165: 25 | I165: 34 | J165: 150000 | K165: 3|29 | L165: 5640|400
A166: 2 | B166: 26 | C166: 5 | D166: 2 | E166: 3 | F166: 0 | G166: 10115 | H166: 25 | I166: 36 | J166: 150000 | K166: 3|29 | L166: 5980|400
A167: 2 | B167: 27 | C167: 5 | D167: 2 | E167: 4 | F167: 0 | G167: 10115 | H167: 25 | I167: 38 | J167: 150000 | K167: 3|29 | L167: 6330|400
A168: 2 | B168: 28 | C168: 5 | D168: 2 | E168: 5 | F168: 0 | G168: 10115 | H168: 40 | I168: 40 | J168: 150000 | K168: 3|29 | L168: 6690|400
A169: 2 | B169: 29 | C169: 5 | D169: 2 | E169: 6 | F169: 0 | G169: 10115 | H169: 40 | I169: 42 | J169: 150000 | K169: 3|29 | L169: 7060|400
A170: 2 | B170: 30 | C170: 5 | D170: 2 | E170: 7 | F170: 0 | G170: 10115 | H170: 40 | I170: 44 | J170: 150000 | K170: 3|29 | L170: 7440|400
A171: 2 | B171: 31 | C171: 5 | D171: 2 | E171: 8 | F171: 0 | G171: 10115 | H171: 40 | I171: 46 | J171: 150000 | K171: 3|29 | L171: 7830|400
A172: 2 | B172: 32 | C172: 5 | D172: 2 | E172: 9 | F172: 0 | G172: 10115 | H172: 40 | I172: 48 | J172: 150000 | K172: 3|29 | L172: 8235|400
A173: 2 | B173: 33 | C173: 5 | D173: 2 | E173: 10 | F173: 1 | G173: 10115 | H173: 125 | I173: 90 | J173: 750000 | K173: 3|29 | L173: 8650|400
A174: 2 | B174: 34 | C174: 5 | D174: 3 | E174: 0 | F174: 0 | G174: 10115 | H174: 60 | I174: 40 | J174: 200000 | K174: 3|29 | L174: 9075|600 | M174: 最终法防+6%
A175: 2 | B175: 35 | C175: 5 | D175: 3 | E175: 1 | F175: 0 | G175: 10115 | H175: 60 | I175: 42 | J175: 200000 | K175: 3|29 | L175: 9515|600
A176: 2 | B176: 36 | C176: 5 | D176: 3 | E176: 2 | F176: 0 | G176: 10115 | H176: 60 | I176: 44 | J176: 200000 | K176: 3|29 | L176: 9970|600
A177: 2 | B177: 37 | C177: 5 | D177: 3 | E177: 3 | F177: 0 | G177: 10115 | H177: 60 | I177: 46 | J177: 200000 | K177: 3|29 | L177: 10430|600
A178: 2 | B178: 38 | C178: 5 | D178: 3 | E178: 4 | F178: 0 | G178: 10115 | H178: 60 | I178: 48 | J178: 200000 | K178: 3|29 | L178: 10910|600
A179: 2 | B179: 39 | C179: 5 | D179: 3 | E179: 5 | F179: 0 | G179: 10115 | H179: 85 | I179: 50 | J179: 200000 | K179: 3|29 | L179: 11400|600
A180: 2 | B180: 40 | C180: 5 | D180: 3 | E180: 6 | F180: 0 | G180: 10115 | H180: 85 | I180: 52 | J180: 200000 | K180: 3|29 | L180: 11905|600
A181: 2 | B181: 41 | C181: 5 | D181: 3 | E181: 7 | F181: 0 | G181: 10115 | H181: 85 | I181: 54 | J181: 200000 | K181: 3|29 | L181: 12425|600
A182: 2 | B182: 42 | C182: 5 | D182: 3 | E182: 8 | F182: 0 | G182: 10115 | H182: 85 | I182: 56 | J182: 200000 | K182: 3|29 | L182: 12960|600
A183: 2 | B183: 43 | C183: 5 | D183: 3 | E183: 9 | F183: 0 | G183: 10115 | H183: 85 | I183: 58 | J183: 200000 | K183: 3|29 | L183: 13510|600
A184: 2 | B184: 44 | C184: 5 | D184: 3 | E184: 10 | F184: 1 | G184: 10115 | H184: 300 | I184: 110 | J184: 1000000 | K184: 3|29 | L184: 14070|600
A185: 2 | B185: 45 | C185: 5 | D185: 4 | E185: 0 | F185: 0 | G185: 10115 | H185: 115 | I185: 50 | J185: 250000 | K185: 3|29 | L185: 14650|800 | M185: 最终法防+8%
A186: 2 | B186: 46 | C186: 5 | D186: 4 | E186: 1 | F186: 0 | G186: 10115 | H186: 115 | I186: 52 | J186: 250000 | K186: 3|29 | L186: 15245|800
A187: 2 | B187: 47 | C187: 5 | D187: 4 | E187: 2 | F187: 0 | G187: 10115 | H187: 115 | I187: 54 | J187: 250000 | K187: 3|29 | L187: 15855|800
A188: 2 | B188: 48 | C188: 5 | D188: 4 | E188: 3 | F188: 0 | G188: 10115 | H188: 115 | I188: 56 | J188: 250000 | K188: 3|29 | L188: 16485|800
A189: 2 | B189: 49 | C189: 5 | D189: 4 | E189: 4 | F189: 0 | G189: 10115 | H189: 115 | I189: 58 | J189: 250000 | K189: 3|29 | L189: 17130|800
A190: 2 | B190: 50 | C190: 5 | D190: 4 | E190: 5 | F190: 0 | G190: 10115 | H190: 150 | I190: 60 | J190: 250000 | K190: 3|29 | L190: 17790|800
A191: 2 | B191: 51 | C191: 5 | D191: 4 | E191: 6 | F191: 0 | G191: 10115 | H191: 150 | I191: 62 | J191: 250000 | K191: 3|29 | L191: 18475|800
A192: 2 | B192: 52 | C192: 5 | D192: 4 | E192: 7 | F192: 0 | G192: 10115 | H192: 150 | I192: 64 | J192: 250000 | K192: 3|29 | L192: 19175|800
A193: 2 | B193: 53 | C193: 5 | D193: 4 | E193: 8 | F193: 0 | G193: 10115 | H193: 150 | I193: 66 | J193: 250000 | K193: 3|29 | L193: 19885|800
A194: 2 | B194: 54 | C194: 5 | D194: 4 | E194: 9 | F194: 0 | G194: 10115 | H194: 150 | I194: 68 | J194: 250000 | K194: 3|29 | L194: 20625|800
A195: 2 | B195: 55 | C195: 5 | D195: 4 | E195: 10 | F195: 1 | G195: 10115 | H195: 575 | I195: 130 | J195: 1250000 | K195: 3|29 | L195: 21385|800
A196: 2 | B196: 56 | C196: 5 | D196: 5 | E196: 0 | F196: 0 | G196: 10115 | H196: 190 | I196: 60 | J196: 300000 | K196: 3|29 | L196: 22155|1000 | M196: 最终法防+10%
A197: 2 | B197: 57 | C197: 5 | D197: 5 | E197: 1 | F197: 0 | G197: 10115 | H197: 190 | I197: 62 | J197: 300000 | K197: 3|29 | L197: 23240|1000
A198: 2 | B198: 58 | C198: 5 | D198: 5 | E198: 2 | F198: 0 | G198: 10115 | H198: 190 | I198: 64 | J198: 300000 | K198: 3|29 | L198: 24360|1000
A199: 2 | B199: 59 | C199: 5 | D199: 5 | E199: 3 | F199: 0 | G199: 10115 | H199: 190 | I199: 66 | J199: 300000 | K199: 3|29 | L199: 25525|1000
A200: 2 | B200: 60 | C200: 5 | D200: 5 | E200: 4 | F200: 0 | G200: 10115 | H200: 190 | I200: 68 | J200: 300000 | K200: 3|29 | L200: 26725|1000
A201: 2 | B201: 61 | C201: 5 | D201: 5 | E201: 5 | F201: 0 | G201: 10115 | H201: 235 | I201: 70 | J201: 300000 | K201: 3|29 | L201: 27975|1000
A202: 2 | B202: 62 | C202: 5 | D202: 5 | E202: 6 | F202: 0 | G202: 10115 | H202: 235 | I202: 72 | J202: 300000 | K202: 3|29 | L202: 29265|1000
A203: 2 | B203: 63 | C203: 5 | D203: 5 | E203: 7 | F203: 0 | G203: 10115 | H203: 235 | I203: 74 | J203: 300000 | K203: 3|29 | L203: 30595|1000
A204: 2 | B204: 64 | C204: 5 | D204: 5 | E204: 8 | F204: 0 | G204: 10115 | H204: 235 | I204: 76 | J204: 300000 | K204: 3|29 | L204: 31980|1000
A205: 2 | B205: 65 | C205: 5 | D205: 5 | E205: 9 | F205: 0 | G205: 10115 | H205: 235 | I205: 78 | J205: 300000 | K205: 3|29 | L205: 33405|1000
A206: 2 | B206: 66 | C206: 5 | D206: 5 | E206: 10 | F206: 1 | G206: 10115 | H206: 950 | I206: 150 | J206: 1500000 | K206: 3|29 | L206: 34885|1000
A207: 2 | B207: 67 | C207: 5 | D207: 6 | E207: 0 | F207: 0 | G207: 10115 | H207: 1 | I207: 70 | J207: 350000 | K207: 3|29 | L207: 36415|1200 | M207: 最终法防+12%
A208: 3 | B208: 1 | C208: 5 | D208: 0 | E208: 0 | F208: 0 | G208: 10115 | H208: 5 | I208: 10 | J208: 50000 | K208: 4 | L208: 0
A209: 3 | B209: 2 | C209: 5 | D209: 0 | E209: 1 | F209: 0 | G209: 10115 | H209: 5 | I209: 12 | J209: 50000 | K209: 4 | L209: 1600
A210: 3 | B210: 3 | C210: 5 | D210: 0 | E210: 2 | F210: 0 | G210: 10115 | H210: 5 | I210: 14 | J210: 50000 | K210: 4 | L210: 3200
A211: 3 | B211: 4 | C211: 5 | D211: 0 | E211: 3 | F211: 0 | G211: 10115 | H211: 5 | I211: 16 | J211: 50000 | K211: 4 | L211: 4850
A212: 3 | B212: 5 | C212: 5 | D212: 0 | E212: 4 | F212: 0 | G212: 10115 | H212: 5 | I212: 18 | J212: 50000 | K212: 4 | L212: 6600
A213: 3 | B213: 6 | C213: 5 | D213: 0 | E213: 5 | F213: 0 | G213: 10115 | H213: 7 | I213: 20 | J213: 50000 | K213: 4 | L213: 8400
A214: 3 | B214: 7 | C214: 5 | D214: 0 | E214: 6 | F214: 0 | G214: 10115 | H214: 7 | I214: 22 | J214: 50000 | K214: 4 | L214: 10250
A215: 3 | B215: 8 | C215: 5 | D215: 0 | E215: 7 | F215: 0 | G215: 10115 | H215: 7 | I215: 24 | J215: 50000 | K215: 4 | L215: 12200
A216: 3 | B216: 9 | C216: 5 | D216: 0 | E216: 8 | F216: 0 | G216: 10115 | H216: 7 | I216: 26 | J216: 50000 | K216: 4 | L216: 14200
A217: 3 | B217: 10 | C217: 5 | D217: 0 | E217: 9 | F217: 0 | G217: 10115 | H217: 7 | I217: 28 | J217: 50000 | K217: 4 | L217: 16250
A218: 3 | B218: 11 | C218: 5 | D218: 0 | E218: 10 | F218: 1 | G218: 10115 | H218: 20 | I218: 50 | J218: 250000 | K218: 4 | L218: 18350
A219: 3 | B219: 12 | C219: 5 | D219: 1 | E219: 0 | F219: 0 | G219: 10115 | H219: 10 | I219: 20 | J219: 100000 | K219: 4|30 | L219: 20550|200 | M219: 最终血量+2%
A220: 3 | B220: 13 | C220: 5 | D220: 1 | E220: 1 | F220: 0 | G220: 10115 | H220: 10 | I220: 22 | J220: 100000 | K220: 4|30 | L220: 22850|200
A221: 3 | B221: 14 | C221: 5 | D221: 1 | E221: 2 | F221: 0 | G221: 10115 | H221: 10 | I221: 24 | J221: 100000 | K221: 4|30 | L221: 25200|200
A222: 3 | B222: 15 | C222: 5 | D222: 1 | E222: 3 | F222: 0 | G222: 10115 | H222: 10 | I222: 26 | J222: 100000 | K222: 4|30 | L222: 27600|200
A223: 3 | B223: 16 | C223: 5 | D223: 1 | E223: 4 | F223: 0 | G223: 10115 | H223: 10 | I223: 28 | J223: 100000 | K223: 4|30 | L223: 30100|200
A224: 3 | B224: 17 | C224: 5 | D224: 1 | E224: 5 | F224: 0 | G224: 10115 | H224: 15 | I224: 30 | J224: 100000 | K224: 4|30 | L224: 32700|200
A225: 3 | B225: 18 | C225: 5 | D225: 1 | E225: 6 | F225: 0 | G225: 10115 | H225: 15 | I225: 32 | J225: 100000 | K225: 4|30 | L225: 35350|200
A226: 3 | B226: 19 | C226: 5 | D226: 1 | E226: 7 | F226: 0 | G226: 10115 | H226: 15 | I226: 34 | J226: 100000 | K226: 4|30 | L226: 38100|200
A227: 3 | B227: 20 | C227: 5 | D227: 1 | E227: 8 | F227: 0 | G227: 10115 | H227: 15 | I227: 36 | J227: 100000 | K227: 4|30 | L227: 40900|200
A228: 3 | B228: 21 | C228: 5 | D228: 1 | E228: 9 | F228: 0 | G228: 10115 | H228: 15 | I228: 38 | J228: 100000 | K228: 4|30 | L228: 43850|200
A229: 3 | B229: 22 | C229: 5 | D229: 1 | E229: 10 | F229: 1 | G229: 10115 | H229: 50 | I229: 70 | J229: 500000 | K229: 4|30 | L229: 46850|200
A230: 3 | B230: 23 | C230: 5 | D230: 2 | E230: 0 | F230: 0 | G230: 10115 | H230: 25 | I230: 30 | J230: 150000 | K230: 4|30 | L230: 49950|400 | M230: 最终血量+4%
A231: 3 | B231: 24 | C231: 5 | D231: 2 | E231: 1 | F231: 0 | G231: 10115 | H231: 25 | I231: 32 | J231: 150000 | K231: 4|30 | L231: 53150|400
A232: 3 | B232: 25 | C232: 5 | D232: 2 | E232: 2 | F232: 0 | G232: 10115 | H232: 25 | I232: 34 | J232: 150000 | K232: 4|30 | L232: 56400|400
A233: 3 | B233: 26 | C233: 5 | D233: 2 | E233: 3 | F233: 0 | G233: 10115 | H233: 25 | I233: 36 | J233: 150000 | K233: 4|30 | L233: 59800|400
A234: 3 | B234: 27 | C234: 5 | D234: 2 | E234: 4 | F234: 0 | G234: 10115 | H234: 25 | I234: 38 | J234: 150000 | K234: 4|30 | L234: 63300|400
A235: 3 | B235: 28 | C235: 5 | D235: 2 | E235: 5 | F235: 0 | G235: 10115 | H235: 40 | I235: 40 | J235: 150000 | K235: 4|30 | L235: 66900|400
A236: 3 | B236: 29 | C236: 5 | D236: 2 | E236: 6 | F236: 0 | G236: 10115 | H236: 40 | I236: 42 | J236: 150000 | K236: 4|30 | L236: 70600|400
A237: 3 | B237: 30 | C237: 5 | D237: 2 | E237: 7 | F237: 0 | G237: 10115 | H237: 40 | I237: 44 | J237: 150000 | K237: 4|30 | L237: 74400|400
A238: 3 | B238: 31 | C238: 5 | D238: 2 | E238: 8 | F238: 0 | G238: 10115 | H238: 40 | I238: 46 | J238: 150000 | K238: 4|30 | L238: 78300|400
A239: 3 | B239: 32 | C239: 5 | D239: 2 | E239: 9 | F239: 0 | G239: 10115 | H239: 40 | I239: 48 | J239: 150000 | K239: 4|30 | L239: 82350|400
A240: 3 | B240: 33 | C240: 5 | D240: 2 | E240: 10 | F240: 1 | G240: 10115 | H240: 125 | I240: 90 | J240: 750000 | K240: 4|30 | L240: 86500|400
A241: 3 | B241: 34 | C241: 5 | D241: 3 | E241: 0 | F241: 0 | G241: 10115 | H241: 60 | I241: 40 | J241: 200000 | K241: 4|30 | L241: 90750|600 | M241: 最终血量+6%
A242: 3 | B242: 35 | C242: 5 | D242: 3 | E242: 1 | F242: 0 | G242: 10115 | H242: 60 | I242: 42 | J242: 200000 | K242: 4|30 | L242: 95150|600
A243: 3 | B243: 36 | C243: 5 | D243: 3 | E243: 2 | F243: 0 | G243: 10115 | H243: 60 | I243: 44 | J243: 200000 | K243: 4|30 | L243: 99700|600
A244: 3 | B244: 37 | C244: 5 | D244: 3 | E244: 3 | F244: 0 | G244: 10115 | H244: 60 | I244: 46 | J244: 200000 | K244: 4|30 | L244: 104300|600
A245: 3 | B245: 38 | C245: 5 | D245: 3 | E245: 4 | F245: 0 | G245: 10115 | H245: 60 | I245: 48 | J245: 200000 | K245: 4|30 | L245: 109100|600
A246: 3 | B246: 39 | C246: 5 | D246: 3 | E246: 5 | F246: 0 | G246: 10115 | H246: 85 | I246: 50 | J246: 200000 | K246: 4|30 | L246: 114000|600
A247: 3 | B247: 40 | C247: 5 | D247: 3 | E247: 6 | F247: 0 | G247: 10115 | H247: 85 | I247: 52 | J247: 200000 | K247: 4|30 | L247: 119050|600
A248: 3 | B248: 41 | C248: 5 | D248: 3 | E248: 7 | F248: 0 | G248: 10115 | H248: 85 | I248: 54 | J248: 200000 | K248: 4|30 | L248: 124250|600
A249: 3 | B249: 42 | C249: 5 | D249: 3 | E249: 8 | F249: 0 | G249: 10115 | H249: 85 | I249: 56 | J249: 200000 | K249: 4|30 | L249: 129600|600
A250: 3 | B250: 43 | C250: 5 | D250: 3 | E250: 9 | F250: 0 | G250: 10115 | H250: 85 | I250: 58 | J250: 200000 | K250: 4|30 | L250: 135100|600
A251: 3 | B251: 44 | C251: 5 | D251: 3 | E251: 10 | F251: 1 | G251: 10115 | H251: 300 | I251: 110 | J251: 1000000 | K251: 4|30 | L251: 140700|600
A252: 3 | B252: 45 | C252: 5 | D252: 4 | E252: 0 | F252: 0 | G252: 10115 | H252: 115 | I252: 50 | J252: 250000 | K252: 4|30 | L252: 146500|800 | M252: 最终血量+8%
A253: 3 | B253: 46 | C253: 5 | D253: 4 | E253: 1 | F253: 0 | G253: 10115 | H253: 115 | I253: 52 | J253: 250000 | K253: 4|30 | L253: 152450|800
A254: 3 | B254: 47 | C254: 5 | D254: 4 | E254: 2 | F254: 0 | G254: 10115 | H254: 115 | I254: 54 | J254: 250000 | K254: 4|30 | L254: 158550|800
A255: 3 | B255: 48 | C255: 5 | D255: 4 | E255: 3 | F255: 0 | G255: 10115 | H255: 115 | I255: 56 | J255: 250000 | K255: 4|30 | L255: 164850|800
A256: 3 | B256: 49 | C256: 5 | D256: 4 | E256: 4 | F256: 0 | G256: 10115 | H256: 115 | I256: 58 | J256: 250000 | K256: 4|30 | L256: 171300|800
A257: 3 | B257: 50 | C257: 5 | D257: 4 | E257: 5 | F257: 0 | G257: 10115 | H257: 150 | I257: 60 | J257: 250000 | K257: 4|30 | L257: 177900|800
A258: 3 | B258: 51 | C258: 5 | D258: 4 | E258: 6 | F258: 0 | G258: 10115 | H258: 150 | I258: 62 | J258: 250000 | K258: 4|30 | L258: 184750|800
A259: 3 | B259: 52 | C259: 5 | D259: 4 | E259: 7 | F259: 0 | G259: 10115 | H259: 150 | I259: 64 | J259: 250000 | K259: 4|30 | L259: 191750|800
A260: 3 | B260: 53 | C260: 5 | D260: 4 | E260: 8 | F260: 0 | G260: 10115 | H260: 150 | I260: 66 | J260: 250000 | K260: 4|30 | L260: 198850|800
A261: 3 | B261: 54 | C261: 5 | D261: 4 | E261: 9 | F261: 0 | G261: 10115 | H261: 150 | I261: 68 | J261: 250000 | K261: 4|30 | L261: 206250|800
A262: 3 | B262: 55 | C262: 5 | D262: 4 | E262: 10 | F262: 1 | G262: 10115 | H262: 575 | I262: 130 | J262: 1250000 | K262: 4|30 | L262: 213850|800
A263: 3 | B263: 56 | C263: 5 | D263: 5 | E263: 0 | F263: 0 | G263: 10115 | H263: 190 | I263: 60 | J263: 300000 | K263: 4|30 | L263: 221550|1000 | M263: 最终血量+10%
A264: 3 | B264: 57 | C264: 5 | D264: 5 | E264: 1 | F264: 0 | G264: 10115 | H264: 190 | I264: 62 | J264: 300000 | K264: 4|30 | L264: 232400|1000
A265: 3 | B265: 58 | C265: 5 | D265: 5 | E265: 2 | F265: 0 | G265: 10115 | H265: 190 | I265: 64 | J265: 300000 | K265: 4|30 | L265: 243600|1000
A266: 3 | B266: 59 | C266: 5 | D266: 5 | E266: 3 | F266: 0 | G266: 10115 | H266: 190 | I266: 66 | J266: 300000 | K266: 4|30 | L266: 255250|1000
A267: 3 | B267: 60 | C267: 5 | D267: 5 | E267: 4 | F267: 0 | G267: 10115 | H267: 190 | I267: 68 | J267: 300000 | K267: 4|30 | L267: 267300|1000
A268: 3 | B268: 61 | C268: 5 | D268: 5 | E268: 5 | F268: 0 | G268: 10115 | H268: 235 | I268: 70 | J268: 300000 | K268: 4|30 | L268: 279750|1000
A269: 3 | B269: 62 | C269: 5 | D269: 5 | E269: 6 | F269: 0 | G269: 10115 | H269: 235 | I269: 72 | J269: 300000 | K269: 4|30 | L269: 292650|1000
A270: 3 | B270: 63 | C270: 5 | D270: 5 | E270: 7 | F270: 0 | G270: 10115 | H270: 235 | I270: 74 | J270: 300000 | K270: 4|30 | L270: 305950|1000
A271: 3 | B271: 64 | C271: 5 | D271: 5 | E271: 8 | F271: 0 | G271: 10115 | H271: 235 | I271: 76 | J271: 300000 | K271: 4|30 | L271: 319800|1000
A272: 3 | B272: 65 | C272: 5 | D272: 5 | E272: 9 | F272: 0 | G272: 10115 | H272: 235 | I272: 78 | J272: 300000 | K272: 4|30 | L272: 334050|1000
A273: 3 | B273: 66 | C273: 5 | D273: 5 | E273: 10 | F273: 1 | G273: 10115 | H273: 950 | I273: 150 | J273: 1500000 | K273: 4|30 | L273: 348850|1000
A274: 3 | B274: 67 | C274: 5 | D274: 6 | E274: 0 | F274: 0 | G274: 10115 | H274: 1 | I274: 70 | J274: 350000 | K274: 4|30 | L274: 364150|1200 | M274: 最终血量+12%

Sheet: 10.装备升品消耗
A1: quality|quality | B1: cost_item_id|cost_item_id | C1: cost_item_num|cost_item_num | D1: cost_currency_type|cost_currency_type | E1: cost_currency_value|cost_currency_value
A2: 不可空 | B2: 不可空 | C2: 不可空 | D2: 不可空 | E2: 不可空
A3: 数字 | B3: 数字 | C3: 数字 | D3: 数字 | E3: 数字
A6: 品质 | B6: 消耗道具id | C6: 消耗道具数量 | D6: 消耗货币类型 | E6: 消耗货币数量
A7: 3 | B7: 10116 | C7: 100 | D7: 3 | E7: 200000
A8: 4 | B8: 10117 | C8: 125 | D8: 3 | E8: 500000

Sheet: Sheet1
A2: 属性类型 | B2: 装备类型 | C2: 基础属性 | D2: 强化属性 | E2: 精炼属性1 | F2: 精炼属性2 | H2: 基础属性 | I2: 装备 | J2: 1 | K2: 2 | L2: 3 | M2: 4 | O2: 强化属性 | P2: 装备 | Q2: 1 | R2: 2 | S2: 3 | T2: 4 | V2: 精炼属性 | W2: 装备 | X2: 1 | Y2: 2 | Z2: 3 | AA2: 4 | AB2: 11 | AC2: 12 | AD2: 13 | AE2: 14
B3: 0 | C3: 1 | D3: =RC[-1] -> 1 | E3: =RC[-2] -> 1 | F3: 13 | H3: 绿品 | I3: 101 | J3: 70 | K3: =RC[-1] -> 70 | L3: =RC[-1] -> 70 | M3: =RC[-3]*10 -> 700 | P3: =RC[-7] -> 101 | Q3: 2 | R3: =RC[-1] -> 2 | S3: =RC[-1] -> 2 | T3: =RC[-3]*10 -> 20 | W3: =RC[-14] -> 101 | X3: 25 | Y3: =RC[-1] -> 25 | Z3: =RC[-1] -> 25 | AA3: =RC[-3]*10 -> 250 | AB3: 80 | AC3: 80 | AD3: 100 | AE3: 100
B4: 1 | C4: 2 | D4: =RC[-1] -> 2 | E4: =RC[-2] -> 2 | F4: 11 | H4: 绿品平衡套 | I4: 102 | J4: 70 | K4: =RC[-1] -> 70 | L4: =RC[-1] -> 70 | M4: =RC[-3]*10 -> 700 | P4: =RC[-7] -> 102 | Q4: 2 | R4: =RC[-1] -> 2 | S4: =RC[-1] -> 2 | T4: =RC[-3]*10 -> 20 | W4: =RC[-14] -> 102 | X4: 25 | Y4: =RC[-1] -> 25 | Z4: =RC[-1] -> 25 | AA4: =RC[-3]*10 -> 250 | AB4: 80 | AC4: 80 | AD4: 100 | AE4: 100
B5: 2 | C5: 3 | D5: =RC[-1] -> 3 | E5: =RC[-2] -> 3 | F5: 12 | H5: 蓝品 | I5: 201 | J5: 145 | K5: =RC[-1] -> 145 | L5: =RC[-1] -> 145 | M5: =RC[-3]*10 -> 1450 | P5: =RC[-7] -> 201 | Q5: 4 | R5: =RC[-1] -> 4 | S5: =RC[-1] -> 4 | T5: =RC[-3]*10 -> 40 | W5: =RC[-14] -> 201 | X5: 40 | Y5: =RC[-1] -> 40 | Z5: =RC[-1] -> 40 | AA5: =RC[-3]*10 -> 400 | AB5: 80 | AC5: 80 | AD5: 100 | AE5: 100
B6: 3 | C6: 4 | D6: =RC[-1] -> 4 | E6: =RC[-2] -> 4 | F6: 14 | H6: 蓝品平衡套 | I6: 202 | J6: 180 | K6: =RC[-1] -> 180 | L6: =RC[-1] -> 180 | M6: =RC[-3]*10 -> 1800 | P6: =RC[-7] -> 202 | Q6: 5 | R6: =RC[-1] -> 5 | S6: =RC[-1] -> 5 | T6: =RC[-3]*10 -> 50 | W6: =RC[-14] -> 202 | X6: 50 | Y6: =RC[-1] -> 50 | Z6: =RC[-1] -> 50 | AA6: =RC[-3]*10 -> 500 | AB6: 80 | AC6: 80 | AD6: 100 | AE6: 100
H7: 紫品 | I7: 300 | J7: 285 | K7: =RC[-1] -> 285 | L7: =RC[-1] -> 285 | M7: =RC[-3]*10 -> 2850 | P7: =RC[-7] -> 300 | Q7: 11 | R7: =RC[-1] -> 11 | S7: =RC[-1] -> 11 | T7: =RC[-3]*10 -> 110 | W7: =RC[-14] -> 300 | X7: 70 | Y7: =RC[-1] -> 70 | Z7: =RC[-1] -> 70 | AA7: =RC[-3]*10 -> 700 | AB7: 80 | AC7: 80 | AD7: 100 | AE7: 100
A8: 枚举 | B8: 属性类型 | C8: 备注 | H8: 紫品 | I8: 301 | J8: 285 | K8: =RC[-1] -> 285 | L8: =RC[-1] -> 285 | M8: =RC[-3]*10 -> 2850 | P8: =RC[-7] -> 301 | Q8: 11 | R8: =RC[-1] -> 11 | S8: =RC[-1] -> 11 | T8: =RC[-3]*10 -> 110 | W8: =RC[-14] -> 301 | X8: 70 | Y8: =RC[-1] -> 70 | Z8: =RC[-1] -> 70 | AA8: =RC[-3]*10 -> 700 | AB8: 80 | AC8: 80 | AD8: 100 | AE8: 100
A9: 1 | B9: 攻击 | C9: 固定值 | H9: 高级紫品 | I9: 302 | J9: 310 | K9: =RC[-1] -> 310 | L9: =RC[-1] -> 310 | M9: =RC[-3]*10 -> 3100 | P9: =RC[-7] -> 302 | Q9: 12 | R9: =RC[-1] -> 12 | S9: =RC[-1] -> 12 | T9: =RC[-3]*10 -> 120 | W9: =RC[-14] -> 302 | X9: 75 | Y9: =RC[-1] -> 75 | Z9: =RC[-1] -> 75 | AA9: =RC[-3]*10 -> 750 | AB9: 80 | AC9: 80 | AD9: 100 | AE9: 100
A10: 2 | B10: 物防 | C10: 固定值 | H10: 紫品防御套 | I10: 303 | J10: 340 | K10: =RC[-1] -> 340 | L10: =RC[-1] -> 340 | M10: =RC[-3]*10 -> 3400 | P10: =RC[-7] -> 303 | Q10: 13 | R10: =RC[-1] -> 13 | S10: =RC[-1] -> 13 | T10: =RC[-3]*10 -> 130 | W10: =RC[-14] -> 303 | X10: 85 | Y10: =RC[-1] -> 85 | Z10: =RC[-1] -> 85 | AA10: =RC[-3]*10 -> 850 | AB10: 80 | AC10: 80 | AD10: 100 | AE10: 100
A11: 3 | B11: 法防 | C11: 固定值 | H11: 紫品攻击套 | I11: 304 | J11: 370 | K11: =RC[-1] -> 370 | L11: =RC[-1] -> 370 | M11: =RC[-3]*10 -> 3700 | P11: =RC[-7] -> 304 | Q11: 14 | R11: =RC[-1] -> 14 | S11: =RC[-1] -> 14 | T11: =RC[-3]*10 -> 140 | W11: =RC[-14] -> 304 | X11: 90 | Y11: =RC[-1] -> 90 | Z11: =RC[-1] -> 90 | AA11: =RC[-3]*10 -> 900 | AB11: 80 | AC11: 80 | AD11: 100 | AE11: 100
A12: 4 | B12: 生命 | C12: 固定值 | H12: 紫品平衡套 | I12: 305 | J12: 340 | K12: =RC[-1] -> 340 | L12: =RC[-1] -> 340 | M12: =RC[-3]*10 -> 3400 | P12: =RC[-7] -> 305 | Q12: 13 | R12: =RC[-1] -> 13 | S12: =RC[-1] -> 13 | T12: =RC[-3]*10 -> 130 | W12: =RC[-14] -> 305 | X12: 85 | Y12: =RC[-1] -> 85 | Z12: =RC[-1] -> 85 | AA12: =RC[-3]*10 -> 850 | AB12: 80 | AC12: 80 | AD12: 100 | AE12: 100
A13: 5 | B13: 免伤 | C13: 百分比 | H13: 假橙 | I13: 400 | J13: 435 | K13: =RC[-1] -> 435 | L13: =RC[-1] -> 435 | M13: =RC[-3]*10 -> 4350 | P13: =RC[-7] -> 400 | Q13: 20 | R13: =RC[-1] -> 20 | S13: =RC[-1] -> 20 | T13: =RC[-3]*10 -> 200 | W13: =RC[-14] -> 400 | X13: 90 | Y13: =RC[-1] -> 90 | Z13: =RC[-1] -> 90 | AA13: =RC[-3]*10 -> 900 | AB13: 80 | AC13: 80 | AD13: 100 | AE13: 100
A14: 6 | B14: 减伤 | C14: 固定值 | H14: 橙品 | I14: 401 | J14: 490 | K14: =RC[-1] -> 490 | L14: =RC[-1] -> 490 | M14: =RC[-3]*10 -> 4900 | P14: =RC[-7] -> 401 | Q14: 22 | R14: =RC[-1] -> 22 | S14: =RC[-1] -> 22 | T14: =RC[-3]*10 -> 220 | W14: =RC[-14] -> 401 | X14: 100 | Y14: =RC[-1] -> 100 | Z14: =RC[-1] -> 100 | AA14: =RC[-3]*10 -> 1000 | AB14: 80 | AC14: 80 | AD14: 100 | AE14: 100
A15: 7 | B15: 伤害 | C15: 百分比 | H15: 高级橙品 | I15: 402 | J15: 545 | K15: =RC[-1] -> 545 | L15: =RC[-1] -> 545 | M15: =RC[-3]*10 -> 5450 | P15: =RC[-7] -> 402 | Q15: 24 | R15: =RC[-1] -> 24 | S15: =RC[-1] -> 24 | T15: =RC[-3]*10 -> 240 | W15: =RC[-14] -> 402 | X15: 110 | Y15: =RC[-1] -> 110 | Z15: =RC[-1] -> 110 | AA15: =RC[-3]*10 -> 1100 | AB15: 80 | AC15: 80 | AD15: 100 | AE15: 100
A16: 8 | B16: 附伤 | C16: 固定值 | H16: 橙品防御套 | I16: 403 | J16: 600 | K16: =RC[-1] -> 600 | L16: =RC[-1] -> 600 | M16: =RC[-3]*10 -> 6000 | P16: =RC[-7] -> 403 | Q16: 27 | R16: =RC[-1] -> 27 | S16: =RC[-1] -> 27 | T16: =RC[-3]*10 -> 270 | W16: =RC[-14] -> 403 | X16: 120 | Y16: =RC[-1] -> 120 | Z16: =RC[-1] -> 120 | AA16: =RC[-3]*10 -> 1200 | AB16: 80 | AC16: 80 | AD16: 100 | AE16: 100
A17: 9 | B17: 穿透 | C17: 百分比 | H17: 橙品攻击套 | I17: 404 | J17: 630 | K17: =RC[-1] -> 630 | L17: =RC[-1] -> 630 | M17: =RC[-3]*10 -> 6300 | P17: =RC[-7] -> 404 | Q17: 28 | R17: =RC[-1] -> 28 | S17: =RC[-1] -> 28 | T17: =RC[-3]*10 -> 280 | W17: =RC[-14] -> 404 | X17: 125 | Y17: =RC[-1] -> 125 | Z17: =RC[-1] -> 125 | AA17: =RC[-3]*10 -> 1250 | AB17: 80 | AC17: 80 | AD17: 100 | AE17: 100
A18: 10 | B18: 减防 | C18: 固定值 | H18: 橙品平衡套 | I18: 405 | J18: 600 | K18: =RC[-1] -> 600 | L18: =RC[-1] -> 600 | M18: =RC[-3]*10 -> 6000 | P18: =RC[-7] -> 405 | Q18: 27 | R18: =RC[-1] -> 27 | S18: =RC[-1] -> 27 | T18: =RC[-3]*10 -> 270 | W18: =RC[-14] -> 405 | X18: 120 | Y18: =RC[-1] -> 120 | Z18: =RC[-1] -> 120 | AA18: =RC[-3]*10 -> 1200 | AB18: 80 | AC18: 80 | AD18: 100 | AE18: 100
A19: 11 | B19: 命中 | C19: 百分比 | H19: 紫品防御套升橙 | I19: 406 | J19: 545 | K19: =RC[-1] -> 545 | L19: =RC[-1] -> 545 | M19: =RC[-3]*10 -> 5450 | P19: =RC[-7] -> 406 | Q19: 24 | R19: =RC[-1] -> 24 | S19: =RC[-1] -> 24 | T19: =RC[-3]*10 -> 240 | W19: =RC[-14] -> 406 | X19: 110 | Y19: =RC[-1] -> 110 | Z19: =RC[-1] -> 110 | AA19: =RC[-3]*10 -> 1100 | AB19: 80 | AC19: 80 | AD19: 100 | AE19: 100
A20: 12 | B20: 闪避 | C20: 百分比 | H20: 紫品攻击套升橙 | I20: 407 | J20: 575 | K20: =RC[-1] -> 575 | L20: =RC[-1] -> 575 | M20: =RC[-3]*10 -> 5750 | P20: =RC[-7] -> 407 | Q20: 26 | R20: =RC[-1] -> 26 | S20: =RC[-1] -> 26 | T20: =RC[-3]*10 -> 260 | W20: =RC[-14] -> 407 | X20: 115 | Y20: =RC[-1] -> 115 | Z20: =RC[-1] -> 115 | AA20: =RC[-3]*10 -> 1150 | AB20: 80 | AC20: 80 | AD20: 100 | AE20: 100
A21: 13 | B21: 暴击 | C21: 百分比 | H21: 紫品平衡套升橙 | I21: 408 | J21: 545 | K21: =RC[-1] -> 545 | L21: =RC[-1] -> 545 | M21: =RC[-3]*10 -> 5450 | P21: =RC[-7] -> 408 | Q21: 24 | R21: =RC[-1] -> 24 | S21: =RC[-1] -> 24 | T21: =RC[-3]*10 -> 240 | W21: =RC[-14] -> 408 | X21: 110 | Y21: =RC[-1] -> 110 | Z21: =RC[-1] -> 110 | AA21: =RC[-3]*10 -> 1100 | AB21: 80 | AC21: 80 | AD21: 100 | AE21: 100
A22: 14 | B22: 抗暴 | C22: 百分比 | H22: 红品 | I22: 501 | J22: 905 | K22: =RC[-1] -> 905 | L22: =RC[-1] -> 905 | M22: =RC[-3]*10 -> 9050 | P22: =RC[-7] -> 501 | Q22: 48 | R22: =RC[-1] -> 48 | S22: =RC[-1] -> 48 | T22: =RC[-3]*10 -> 480 | W22: =RC[-14] -> 501 | X22: 150 | Y22: =RC[-1] -> 150 | Z22: =RC[-1] -> 150 | AA22: =RC[-3]*10 -> 1500 | AB22: 80 | AC22: 80 | AD22: 100 | AE22: 100
A23: 15 | B23: 暴伤 | C23: 百分比 | H23: 红品平衡套 | I23: 502 | J23: 1020 | K23: =RC[-1] -> 1020 | L23: =RC[-1] -> 1020 | M23: =RC[-3]*10 -> 10200 | P23: =RC[-7] -> 502 | Q23: 54 | R23: =RC[-1] -> 54 | S23: =RC[-1] -> 54 | T23: =RC[-3]*10 -> 540 | W23: =RC[-14] -> 502 | X23: 170 | Y23: =RC[-1] -> 170 | Z23: =RC[-1] -> 170 | AA23: =RC[-3]*10 -> 1700 | AB23: 80 | AC23: 80 | AD23: 100 | AE23: 100
A24: 16 | B24: 暴防 | C24: 百分比 | H24: 橙品防御套升红 | I24: 503 | J24: 905 | K24: =RC[-1] -> 905 | L24: =RC[-1] -> 905 | M24: =RC[-3]*10 -> 9050 | P24: =RC[-7] -> 503 | Q24: 48 | R24: =RC[-1] -> 48 | S24: =RC[-1] -> 48 | T24: =RC[-3]*10 -> 480 | W24: =RC[-14] -> 503 | X24: 150 | Y24: =RC[-1] -> 150 | Z24: =RC[-1] -> 150 | AA24: =RC[-3]*10 -> 1500 | AB24: 80 | AC24: 80 | AD24: 100 | AE24: 100
A25: 17 | B25: 格挡 | C25: 百分比 | H25: 橙品攻击套升红 | I25: 504 | J25: 965 | K25: =RC[-1] -> 965 | L25: =RC[-1] -> 965 | M25: =RC[-3]*10 -> 9650 | P25: =RC[-7] -> 504 | Q25: 51 | R25: =RC[-1] -> 51 | S25: =RC[-1] -> 51 | T25: =RC[-3]*10 -> 510 | W25: =RC[-14] -> 504 | X25: 160 | Y25: =RC[-1] -> 160 | Z25: =RC[-1] -> 160 | AA25: =RC[-3]*10 -> 1600 | AB25: 80 | AC25: 80 | AD25: 100 | AE25: 100
A26: 18 | B26: 格防 | C26: 百分比 | H26: 橙品平衡套升红 | I26: 505 | J26: 905 | K26: =RC[-1] -> 905 | L26: =RC[-1] -> 905 | M26: =RC[-3]*10 -> 9050 | P26: =RC[-7] -> 505 | Q26: 48 | R26: =RC[-1] -> 48 | S26: =RC[-1] -> 48 | T26: =RC[-3]*10 -> 480 | W26: =RC[-14] -> 505 | X26: 150 | Y26: =RC[-1] -> 150 | Z26: =RC[-1] -> 150 | AA26: =RC[-3]*10 -> 1500 | AB26: 80 | AC26: 80 | AD26: 100 | AE26: 100
A27: 19 | B27: 击退 | C27: 百分比 | H27: GM套 | I27: 599 | J27: 1000000 | K27: =RC[-1] -> 1000000 | L27: =RC[-1] -> 1000000 | M27: =RC[-3]*10 -> 10000000 | P27: =RC[-7] -> 599 | Q27: 100000 | R27: =RC[-1] -> 100000 | S27: =RC[-1] -> 100000 | T27: =RC[-3]*10 -> 1000000 | W27: =RC[-14] -> 599 | X27: 100000 | Y27: =RC[-1] -> 100000 | Z27: =RC[-1] -> 100000 | AA27: =RC[-3]*10 -> 1000000 | AB27: 1000 | AC27: 1000 | AD27: 1000 | AE27: 1000
A28: 20 | B28: 抗击退 | C28: 百分比
A29: 21 | B29: 怒气 | C29: 固定值
A30: 22 | B30: 攻击 | C30: 百分比
A31: 23 | B31: 物防 | C31: 百分比
A32: 24 | B32: 法防 | C32: 百分比
A33: 25 | B33: 生命 | C33: 百分比
A34: 26 | B34: 速度 | C34: 固定值
A35: 27 | B35: 攻击最终加成 | C35: 百分比
A36: 28 | B36: 物防最终加成 | C36: 百分比
A37: 29 | B37: 法防最终加成 | C37: 百分比
A38: 30 | B38: 生命最终加成 | C38: 百分比