Sheet: 配置
A1: 服务端文件名 | B1: 服务端对应工作表号 | C1: 客户端文件名 | D1: 客户端对应工作表号 | E1: erl头部 | F1: erl内容格式 | G1: erl尾部 | H1: 客户端特殊处理
A2: config_activity.txt | B2: 1 | C2: config_activity.cnf|Activity | D2: 1 | F2: get(id) -> #$ | H2: 1=>id,sort|sort_list
A3: config_level_shop.txt | B3: 2 | C3: config_level_shop.cnf|LevelShop | D3: 2 | F3: get(id) -> #$ | H3: 2=>level
A4: config_level_shop_goods.txt | B4: 3 | C4: config_level_shop_goods.cnf|LevelShopGoods | D4: 3 | F4: get(id) -> #$ | H4: 2=>goods_id
A5: config_open_server_fund.txt | B5: 4 | C5: config_open_server_fund.cnf|OpenServerFund | D5: 4 | F5: get(id) -> #$ | H5: 2=>id
A6: config_all_the_people_welfare.txt | B6: 5 | C6: config_all_the_people_welfare.cnf|AllThePeopleWelfare | D6: 5 | F6: get(id) -> #$ | H6: 2=>id
A7: config_level_gift.txt | B7: 6 | C7: config_level_gift.cnf|LevelGift | D7: 6 | F7: get(level) -> #$ | H7: 2=>level
A8: config_limit_activity.txt | B8: 7 | C8: config_limit_activity.cnf|LimitActivity | D8: 7 | F8: get(id) -> #$ | H8: 2=>id
C9: config_activity_advance_notice.cnf|ActivityAdvanceNotice | D9: 8 | F9: get(system_id) -> #$ | H9: 2=>system_id
A10: festival_activity.txt | B10: 9 | C10: config_festival_activity.cnf|FestivalActivity | D10: 9 | F10: get(id) -> #$ | H10: 2=>id
A11: festival_activity_param.txt | B11: 10 | C11: config_festival_activity_param.cnf|FestivalActivityParam | D11: 10 | F11: get(id) -> #$ | H11: 2=>id
A12: limit_drop.txt | B12: 11 | C12: config_limit_drop.cnf|LimitDrop | D12: 10 | F12: get(id) -> #$ | H12: 2=>id

Sheet: 1.活动时间配置
A1: id|id | B1: data_id|data_id | C1: sort| | D1: name| | E1: time_type|time_type | F1: days|days | G1: need_role_level|need_role_level | H1: server_list|server_list | I1: star_date|star_date | J1: star_time|star_time | K1: over_date|over_date | L1: over_time|over_time | M1: reward_over_date|reward_over_date | N1: reward_over_time|reward_over_time
A2: 不可空 | B2: 不可空 | C2: 不可空 | D2: 不可空 | E2: 不可空 | F2: 不可空 | G2: 不可空 | H2: 可空#不需字段 | I2: 不可空 | J2: 不可空 | K2: 不可空 | L2: 不可空 | M2: 不可空 | N2: 不可空
A3: 数字 | B3: 数字 | C3: 数字 | D3: 字符串 | E3: 数字 | F3: 数字 | G3: 数字 | H3: 一维数组 | I3: 数字 | J3: 数字 | K3: 数字 | L3: 数字 | M3: 数字 | N3: 数字
H4: 不定长
A6: 系统模块ID | B6: 数据ID | C6: 排序 | D6: 活动名称 | E6: 时间类型 | F6: 开服多少天后有效,包括当天(天) | G6: 需要角色等级 | H6: 开放的服务器列表(填空表示所有服务器开放) | I6: 开始日期 | J6: 开始时间[小时:分钟] | K6: 结束日期 | L6: 结束时间[小时:分钟] | M6: 奖励结束日期 | N6: 奖励结束时间
A7: 1001 | B7: 1 | C7: 1 | D7: 指定时间 | E7: 1 | F7: 10 | G7: 1 | H7: 999 | I7: 20170104 | J7: 1510 | K7: 20171014 | L7: 2030 | M7: 20171014 | N7: 2030
A8: 1002 | B8: 2 | C8: 1 | D8: 每日事件 | E8: 2 | F8: 10 | G8: 1 | H8: 999 | I8: 0 | J8: 1510 | K8: 0 | L8: 2030 | M8: 0 | N8: 2030
A9: 1003 | B9: 3 | C9: 1 | D9: 每周事件 | E9: 3 | F9: 10 | G9: 1 | H9: 999 | I9: 1 | J9: 1510 | K9: 5 | L9: 2030 | M9: 5 | N9: 2030
A10: 1004 | B10: 4 | C10: 1 | D10: 月份事件 | E10: 4 | F10: 10 | G10: 1 | H10: 999 | I10: 5 | J10: 1510 | K10: 16 | L10: 2030 | M10: 16 | N10: 2030
A11: 52 | B11: 5 | C11: 1 | D11: 七日活动 | E11: 5 | F11: 1 | G11: 1 | I11: 1 | J11: 0 | K11: 7 | L11: 2359 | M11: 8 | N11: 2359
A12: 89 | B12: 6 | C12: 1 | D12: 七日活动2 | E12: 5 | F12: 8 | G12: 1 | I12: 8 | J12: 0 | K12: 14 | L12: 2359 | M12: 15 | N12: 2359
A13: 74 | B13: 7 | C13: 1 | D13: 单次充值（开服首周） | E13: 5 | F13: 1 | G13: 1 | I13: 1 | J13: 0 | K13: 7 | L13: 2359 | M13: 0 | N13: 2359
A14: 74 | B14: 8 | C14: 2 | D14: 单次充值（每周循环） | E14: 3 | F14: 8 | G14: 1 | I14: 1 | J14: 0 | K14: 0 | L14: 2359 | M14: 0 | N14: 2359
A15: 75 | B15: 9 | C15: 1 | D15: 累计充值（开服1~3） | E15: 5 | F15: 1 | G15: 1 | I15: 1 | J15: 0 | K15: 3 | L15: 2359 | M15: 3 | N15: 2359
A16: 75 | B16: 10 | C16: 2 | D16: 累计充值（开服4~6） | E16: 5 | F16: 1 | G16: 1 | I16: 4 | J16: 0 | K16: 6 | L16: 2359 | M16: 6 | N16: 2359
A17: 75 | B17: 11 | C17: 3 | D17: 累计充值（每周1~3） | E17: 3 | F17: 7 | G17: 1 | I17: 1 | J17: 0 | K17: 3 | L17: 2359 | M17: 3 | N17: 2359
A18: 75 | B18: 12 | C18: 4 | D18: 累计充值（每周4~0） | E18: 3 | F18: 7 | G18: 1 | I18: 4 | J18: 0 | K18: 0 | L18: 2359 | M18: 0 | N18: 2359
A19: 77 | B19: 13 | C19: 1 | D19: 招募活动 | E19: 5 | F19: 1 | G19: 1 | I19: 1 | J19: 0 | K19: 7 | L19: 2359 | M19: 7 | N19: 2359
A20: 95 | B20: 15 | C20: 1 | D20: 特惠季 | E20: 3 | F20: 1 | G20: 1 | I20: 1 | J20: 0 | K20: 0 | L20: 2359 | M20: 0 | N20: 2359
A21: 96 | B21: 16 | C21: 1 | D21: 特惠推送 | E21: 5 | F21: 4 | G21: 1 | I21: 4 | J21: 0 | K21: 5 | L21: 2359 | M21: 5 | N21: 2359
A22: 97 | B22: 17 | C22: 1 | D22: 开服冲榜 | E22: 5 | F22: 1 | G22: 1 | I22: 1 | J22: 0 | K22: 7 | L22: 2359 | M22: 7 | N22: 2359
A23: 97 | B23: 18 | C23: 2 | D23: 开服冲榜 | E23: 1 | F23: 1 | G23: 1 | I23: 20180627 | J23: 0 | K23: 20180701 | L23: 2359 | M23: =RC[-2] -> 20180701 | N23: 2359
A24: 94 | B24: 14 | C24: 1 | D24: 超值购1-8 | E24: 7 | F24: 1 | G24: 1 | I24: 1 | J24: 0 | K24: 8 | L24: 2359 | M24: 8 | N24: 2359
A25: 130 | B25: 23 | C25: 2 | D25: 新超值购7-12 | E25: 6 | F25: 7 | G25: 1 | I25: 7 | J25: 0 | K25: 12 | L25: 2359 | M25: =RC[-2] -> 12 | N25: 2359
A26: 130 | B26: 400 | C26: 3 | D26: 新超值购19-24 | E26: 6 | F26: 19 | G26: 1 | I26: 19 | J26: 0 | K26: 24 | L26: 2359 | M26: =RC[-2] -> 24 | N26: 2359
A27: 132 | B27: 28 | C27: 1 | D27: 活动热卖 | E27: 6 | F27: 1 | G27: 1 | H27: 999 | I27: 15 | J27: 0 | K27: 21 | L27: 2359 | M27: =RC[-2] -> 21 | N27: 2359
A28: 127 | B28: 19 | C28: 2 | D28: 充值回馈（6~10） | E28: 6 | F28: 6 | G28: 1 | I28: 6 | J28: 5 | K28: 10 | L28: 2359 | M28: 10 | N28: 2359
A29: 135 | B29: 29 | C29: 1 | D29: 开服转盘 | E29: 6 | F29: 1 | G29: 1 | I29: 1 | J29: 0 | K29: 5 | L29: 2359 | M29: 5 | N29: 2359
A30: 127 | B30: 30 | C30: 1 | D30: 充值回馈（开服） | E30: 6 | F30: 1 | G30: 1 | H30: 999 | I30: 1 | J30: 0 | K30: 5 | L30: 2359 | M30: 5 | N30: 2359
A31: 132 | B31: 27 | C31: 2 | D31: 活动热卖 | E31: 7 | F31: 1 | G31: 1 | I31: 1 | J31: 0 | K31: 5 | L31: 2359 | M31: 5 | N31: 2359
A32: 132 | B32: 31 | C32: 3 | D32: 活动热卖 | E32: 6 | F32: 6 | G32: 1 | I32: 1 | J32: 0 | K32: 7 | L32: 2359 | M32: 7 | N32: 2359
A33: 132 | B33: 32 | C33: 4 | D33: 活动热卖 | E33: 6 | F33: 11 | G33: 1 | I33: 11 | J33: 0 | K33: 15 | L33: 2359 | M33: 15 | N33: 2359
A34: 128 | B34: 22 | C34: 1 | D34: 深海女王 | E34: 1 | F34: 1 | G34: 1 | I34: 20190125 | J34: 0 | K34: =RC[-2] -> 20190125 | L34: 2359 | M34: =RC[-2] -> 20190125 | N34: 2359
A35: 128 | B35: 40 | C35: 2 | D35: 锄大地之子 | E35: 6 | F35: 8 | G35: 1 | I35: 8 | J35: 0 | K35: 10 | L35: 2359 | M35: =RC[-2] -> 10 | N35: 2359
A36: 135 | B36: 43 | C36: 3 | D36: 开服转盘 | E36: 1 | F36: 1 | G36: 1 | I36: 20181113 | J36: 0 | K36: 20181115 | L36: 2359 | M36: =RC[-2] -> 20181115 | N36: 2359
A37: 135 | B37: 44 | C37: 4 | D37: 开服转盘 | E37: 1 | F37: 1 | G37: 1 | I37: 20180615 | J37: 100 | K37: 20180616 | L37: 2359 | M37: =RC[-2] -> 20180616 | N37: 2359
A38: 157 | B38: 60 | C38: 1 | D38: 跨服榜 | E38: 1 | F38: 1 | G38: 1 | I38: 20181225 | J38: 0 | K38: 20181228 | L38: 2359 | M38: =RC[-2] -> 20181228 | N38: 2359
A39: 119 | B39: 1000 | C39: 1 | D39: 春节活动 | E39: 1 | F39: 1 | G39: 1 | I39: 20190123 | J39: 0 | K39: 20190130 | L39: 2359 | M39: =RC[-2] -> 20190130 | N39: 2359
A40: 131 | B40: 25 | C40: 1 | D40: 特殊扭蛋 | E40: 1 | F40: 1 | G40: 1 | I40: 20181025 | J40: 1000 | K40: 20181022 | L40: 1900 | M40: =RC[-2] -> 20181022 | N40: 2359
A41: 146 | B41: 48 | C41: 1 | D41: 限时招募 | E41: 3 | F41: 1 | G41: 1 | I41: 1 | J41: 1000 | K41: 5 | L41: 1900 | M41: =RC[-2] -> 5 | N41: 2359
A42: 146 | B42: 49 | C42: 2 | D42: 限时招募 | E42: 3 | F42: 1 | G42: 1 | I42: 4 | J42: 0 | K42: 5 | L42: 2359 | M42: =RC[-2] -> 5 | N42: 2359
A43: 159 | B43: 50 | C43: 1 | D43: 开服冲榜 | E43: 1 | F43: 1 | G43: 1 | I43: 20190124 | J43: 0 | K43: 20190125 | L43: 2359 | M43: =RC[-2] -> 20190125 | N43: 2359
A44: 159 | B44: 51 | C44: 2 | D44: 开服冲榜 | E44: 1 | F44: 1 | G44: 1 | I44: 20190127 | J44: 0 | K44: 20190128 | L44: 2359 | M44: =RC[-2] -> 20190128 | N44: 2359

Sheet: 2.等级商店
A1: level|level | B1: valid_time|valid_time | C1: goods_id_list|goods_id_list | D1: titlename| | E1: text| | F1: system_type| | G1: icon_zoom|
A2: 不可空 | B2: 不可空 | C2: 可空#不需字段 | D2: 不可空 | E2: 不可空 | F2: 不可空 | G2: 不可空
A3: 数字 | B3: 数字 | C3: 一维数组 | D3: 字符串 | E3: 字符串 | F3: 数字 | G3: 数字
C4: 不定长
A6: 等级 | B6: 有效时间(分钟) | C6: 商品ID列表 | D6: 系统名 | E6: 功能描述 | F6: 前往界面 | G6: 图标缩放比例
A7: 20 | B7: 2880 | C7: 201|202 | D7: 勇者试炼 | E7: 挑战勇者试炼，获取更强装备 | F7: 17 | G7: 0.8
A8: 22 | B8: 2880 | C8: 221|222|223 | D8: 第五阵位 | E8: 第五阵位开启，队伍成型 | F8: 8 | G8: 0.9
A9: 23 | B9: 2880 | C9: 231|232 | D9: 军团 | E9: 加入军团，强强联手 | F9: 22 | G9: 0.9
A10: 25 | B10: 2880 | C10: 251|252|253 | D10: 再次进阶 | E10: 英雄再次进阶，属性提升 | F10: 8 | G10: 0.9
A11: 29 | B11: 2880 | C11: 291|292|293 | D11: 装备精炼 | E11: 装备精炼开启，提升装备属性 | F11: 5 | G11: 0.9
A12: 35 | B12: 2880 | C12: 351|352 | D12: 英雄潜能 | E12: 升级潜能，强化技能效果 | F12: 44 | G12: 0.9
A13: 37 | B13: 2880 | C13: 371|372 | D13: 精灵升华 | E13: 精灵升华，大幅提升属性 | F13: 87 | G13: 0.9
A14: 39 | B14: 2880 | C14: 391|392|393 | D14: 圣器精炼 | E14: 圣器精炼开启，提升圣器属性 | F14: 6 | G14: 0.9
A15: 45 | B15: 2880 | C15: 451|452|453 | D15: 英雄觉醒 | E15: 开启英雄觉醒，增加大量属性 | F15: 8 | G15: 0.9 | H15: 50 | I15: 2880 | J15: 501|502 | K15: 占卜 | L15: 通晓占卜之术，掌握未来命运 | M15: 113 | N15: 0.9

Sheet: 3.等级商店商品
A1: goods_id|goods_id | B1: cost_type_list|cost_type_list | C1: cost_value_list|cost_value_list | D1: item_id|item_id | E1: item_num|item_num | F1: buy_num_max|buy_num_max | G1: sale|
A2: 不可空 | B2: 可空#不需字段 | C2: 可空#不需字段 | D2: 不可空 | E2: 不可空 | F2: 不可空 | G2: 不可空
A3: 数字 | B3: 一维数组 | C3: 一维数组 | D3: 数字 | E3: 数字 | F3: 数字 | G3: 数字
B4: 不定长 | C4: 不定长 | D4: 不定长 | E4: 不定长
A6: 商品ID | B6: 消耗类型列表 | C6: 消耗值列表 | D6: 物品ID | E6: 物品数量 | F6: 购买数量上限(0=表示无上限) | G6: 折扣标签 | H6: 备注 | I6: 单价 | J6: 原价
A7: 1 | B7: 5 | C7: =RC[7]*RC[4]/10 -> 90 | D7: 19012 | E7: 1000 | F7: 1 | G7: 9 | H7: 威名 | I7: 0.1 | J7: =RC[-1]*RC[-5] -> 100
A8: 2 | B8: 5 | C8: =RC[7]*RC[4]/10 -> 480 | D8: 13310 | E8: 20 | F8: 1 | G8: 8 | H8: 紫装碎片4选1 | I8: 30 | J8: =RC[-1]*RC[-5] -> 600
A9: 3 | B9: 5 | C9: =RC[7]*RC[4]/10 -> 100 | D9: 19103 | E9: 20 | F9: 1 | G9: 5 | H9: 金币 | I9: 10 | J9: =RC[-1]*RC[-5] -> 200
A10: 4 | B10: 5 | C10: =RC[7]*RC[4]/10 -> 2240 | D10: 13434 | E10: 1 | F10: 1 | G10: 7 | H10: 核心英雄6选1 | I10: 3200 | J10: =RC[-1]*RC[-5] -> 3200
A11: 5 | B11: 5 | C11: =RC[7]*RC[4]/10 -> 2100 | D11: 10019 | E11: 10 | F11: 1 | G11: 7 | H11: 次元核心 | I11: 300 | J11: =RC[-1]*RC[-5] -> 3000
A12: 6 | B12: 5 | C12: =RC[7]*RC[4]/10 -> 400 | D12: 33300 | E12: 10 | F12: 1 | G12: 4 | H12: 紫品传承核心 | I12: 100 | J12: =RC[-1]*RC[-5] -> 1000
A13: 7 | B13: 5 | C13: =RC[7]*RC[4]/10 -> 800 | D13: 19006 | E13: 1000 | F13: 1 | G13: 8 | H13: 魂晶 | I13: 1 | J13: =RC[-1]*RC[-5] -> 1000
A14: 8 | B14: 5 | C14: =RC[7]*RC[4]/10 -> 300 | D14: 10013 | E14: 50 | F14: 1 | G14: 6 | H14: 紫品精炼石 | I14: 10 | J14: =RC[-1]*RC[-5] -> 500
A15: 9 | B15: 5 | C15: =RC[7]*RC[4]/10 -> 180 | D15: 19012 | E15: 2000 | F15: 1 | G15: 9 | H15: 威名 | I15: 0.1 | J15: =RC[-1]*RC[-5] -> 200
A16: 10 | B16: 5 | C16: =RC[7]*RC[4]/10 -> 800 | D16: 13003 | E16: 20 | F16: 1 | G16: 4 | H16: 橙品装备碎片箱 | I16: 100 | J16: =RC[-1]*RC[-5] -> 2000
A17: 11 | B17: 5 | C17: =RC[7]*RC[4]/10 -> 500 | D17: 19103 | E17: 100 | F17: 1 | G17: 5 | H17: 金币 | I17: 10 | J17: =RC[-1]*RC[-5] -> 1000
A18: 12 | B18: 5 | C18: =RC[7]*RC[4]/10 -> 160 | D18: 19020 | E18: 2000 | F18: 1 | G18: 8 | H18: 军团贡献 | I18: 0.1 | J18: =RC[-1]*RC[-5] -> 200
A19: 13 | B19: 5 | C19: =RC[7]*RC[4]/10 -> 1120 | D19: 13329 | E19: 40 | F19: 1 | G19: 7 | H19: 核心英雄碎片 | I19: 40 | J19: =RC[-1]*RC[-5] -> 1600
A20: 14 | B20: 5 | C20: =RC[7]*RC[4]/10 -> 1080 | D20: 13436 | E20: 40 | F20: 1 | G20: 9 | H20: 核心配合英雄碎片 | I20: 30 | J20: =RC[-1]*RC[-5] -> 1200
A21: 15 | B21: 5 | C21: =RC[7]*RC[4]/10 -> 240 | D21: 10015 | E21: 20 | F21: 1 | G21: 6 | H21: 讨伐令 | I21: 20 | J21: =RC[-1]*RC[-5] -> 400
A22: 16 | B22: 5 | C22: =RC[7]*RC[4]/10 -> 600 | D22: 10004 | E22: 100 | F22: 1 | G22: 4 | H22: 潜能合剂 | I22: 15 | J22: =RC[-1]*RC[-5] -> 1500
A23: 17 | B23: 5 | C23: =RC[7]*RC[4]/10 -> 400 | D23: 19014 | E23: 5000 | F23: 1 | G23: 8 | H23: 战功 | I23: 0.1 | J23: =RC[-1]*RC[-5] -> 500
A24: 18 | B24: 5 | C24: =RC[7]*RC[4]/10 -> 200 | D24: 10010 | E24: 100 | F24: 1 | G24: 4 | H24: 圣器精炼石 | I24: 5 | J24: =RC[-1]*RC[-5] -> 500
A25: 19 | B25: 5 | C25: =RC[7]*RC[4]/10 -> 2000 | D25: 13008 | E25: 20 | F25: 1 | G25: 5 | H25: 圣器碎片箱 | I25: 200 | J25: =RC[-1]*RC[-5] -> 4000
A26: 20 | B26: 5 | C26: =RC[7]*RC[4]/10 -> 250 | D26: 10001 | E26: 20 | F26: 1 | G26: 5 | H26: 精力药剂 | I26: 25 | J26: =RC[-1]*RC[-5] -> 500
A27: 21 | B27: 5 | C27: =RC[7]*RC[4]/10 -> 320 | D27: 13646 | E27: 10 | F27: 1 | G27: 8 | H27: 精灵培养材料各十 | I27: 40 | J27: =RC[-1]*RC[-5] -> 400
A28: 22 | B28: 5 | C28: =RC[7]*RC[4]/10 -> 400 | D28: 19028 | E28: 500 | F28: 1 | G28: 8 | H28: 无尽石 | I28: 1 | J28: =RC[-1]*RC[-5] -> 500
A29: 23 | B29: 5 | C29: =RC[7]*RC[4]/10 -> 2000 | D29: 13324 | E29: 1 | F29: 1 | G29: 8 | H29: 任选精灵升华道具 | I29: 2500 | J29: =RC[-1]*RC[-5] -> 2500
A30: 24 | B30: 5 | C30: =RC[7]*RC[4]/10 -> 400 | D30: 19017 | E30: 500 | F30: 1 | G30: 8 | H30: 神魂 | I30: 1 | J30: =RC[-1]*RC[-5] -> 500
A31: 25 | B31: 5 | C31: =RC[7]*RC[4]/10 -> 600 | D31: 10008 | E31: 300 | F31: 1 | G31: 8 | H31: 觉醒水晶 | I31: 2.5 | J31: =RC[-1]*RC[-5] -> 750
A32: 26 | B32: 5 | C32: =RC[7]*RC[4]/10 -> 1400 | D32: 13017 | E32: 10 | F32: 1 | G32: 7 | H32: 觉醒材料箱 | I32: 200 | J32: =RC[-1]*RC[-5] -> 2000
A33: 27 | B33: 5 | C33: =RC[7]*RC[4]/10 -> 1050 | D33: 13016 | E33: 30 | F33: 1 | G33: 7 | H33: 觉醒材料箱 | I33: 50 | J33: =RC[-1]*RC[-5] -> 1500
A34: 28 | B34: 5 | C34: =RC[7]*RC[4]/10 -> 300 | D34: 10002 | E34: 500 | F34: 1 | G34: 6 | H34: 进阶石 | I34: 1 | J34: =RC[-1]*RC[-5] -> 500
A35: 29 | B35: 5 | C35: =RC[7]*RC[4]/10 -> 250 | D35: 19103 | E35: 50 | F35: 1 | G35: 5 | H35: 金币 | I35: 10 | J35: =RC[-1]*RC[-5] -> 500
A36: 30 | B36: 5 | C36: =RC[7]*RC[4]/10 -> 700 | D36: 10021 | E36: 50 | F36: 1 | G36: 7 | H36: 刷新令 | I36: 20 | J36: =RC[-1]*RC[-5] -> 1000
A37: 201 | B37: 5 | C37: 576 | D37: 13601 | E37: 1 | F37: 1 | G37: 6 | H37: 骑士套装*1 | I37: 960 | J37: 960 | K37: 骑士套装*1 原价960 6折，可购买1次
A38: 202 | B38: 5 | C38: 100 | D38: 19103 | E38: 20 | F38: 1 | G38: 5 | H38: 金币*10W | I38: 10 | J38: 200 | K38: 金币*10W 原价200 5折，可购买1次
A39: 221 | B39: 5 | C39: 2100 | D39: 10019 | E39: 10 | F39: 1 | G39: 7 | H39: 次元核心*10 | I39: 300 | J39: 3000 | K39: 次元核心*10 原价3000 7折，可购买1次
A40: 222 | B40: 5 | C40: 200 | D40: 33300 | E40: 5 | F40: 3 | G40: 4 | H40: 紫品传承核心*5 | I40: 100 | J40: 500 | K40: 紫品传承核心*5 原价500 4折，可购买3次
A41: 223 | B41: 5 | C41: 150 | D41: 19103 | E41: 30 | F41: 1 | G41: 5 | H41: 金币*10W | I41: 10 | J41: 300 | K41: 金币*10W 原价300 5折，可购买1次
A42: 231 | B42: 5 | C42: 280 | D42: 13329 | E42: 10 | F42: 4 | G42: 7 | H42: 橙品英雄碎片箱（顶级主）*10 | I42: 40 | J42: 400 | K42: 橙品英雄碎片箱（顶级主）*10 原价400 7折，可购买4次
A43: 232 | B43: 5 | C43: 270 | D43: 13436 | E43: 10 | F43: 4 | G43: 9 | H43: 橙品英雄碎片箱（顶级副）*10 | I43: 30 | J43: 300 | K43: 橙品英雄碎片箱（顶级副）*10 原价300 9折，可购买4次
A44: 251 | B44: 5 | C44: 40 | D44: 10002 | E44: 100 | F44: 5 | G44: 4 | H44: 进阶石*100 | I44: 1 | J44: 100 | K44: 进阶石*100 原价100 4折，可购买5次
A45: 252 | B45: 5 | C45: 280 | D45: 10021 | E45: 20 | F45: 3 | G45: 7 | H45: 刷新令*20 | I45: 20 | J45: 400 | K45: 刷新令*20 原价400 7折，可购买3次
A46: 253 | B46: 5 | C46: 250 | D46: 19103 | E46: 50 | F46: 1 | G46: 5 | H46: 金币*10W | I46: 10 | J46: 500 | K46: 金币*10W 原价500 5折，可购买1次
A47: 291 | B47: 5 | C47: 300 | D47: 10013 | E47: 50 | F47: 1 | G47: 6 | H47: 紫品精炼石*50 | I47: 10 | J47: 500 | K47: 紫品精炼石*50 原价500 6折，可购买1次
A48: 292 | B48: 5 | C48: 270 | D48: 13310 | E48: 10 | F48: 4 | G48: 9 | H48: 紫装碎片4选1*10 | I48: 30 | J48: 300 | K48: 紫装碎片4选1*10 原价300 9折，可购买4次
A49: 293 | B49: 5 | C49: 250 | D49: 19103 | E49: 50 | F49: 2 | G49: 5 | H49: 金币*20W | I49: 10 | J49: 500 | K49: 金币*20W 原价500 5折，可购买2次
A50: 351 | B50: 5 | C50: 320 | D50: 10015 | E50: 20 | F50: 1 | G50: 8 | H50: 讨伐令*20 | I50: 20 | J50: 400 | K50: 讨伐令*20 原价400 8折，可购买1次
A51: 352 | B51: 5 | C51: 450 | D51: 10004 | E51: 100 | F51: 10 | G51: 3 | H51: 潜能合剂*100 | I51: 15 | J51: 1500 | K51: 潜能合剂*100 原价1500 3折，可购买10次
A52: 371 | B52: 5 | C52: 160 | D52: 13646 | E52: 5 | F52: 3 | G52: 8 | H52: 精灵培养材料各十*5 | I52: 40 | J52: 200 | K52: 精灵培养材料各十*5 原价200 8折，可购买3次
A53: 372 | B53: 5 | C53: 2000 | D53: 13324 | E53: 1 | F53: 1 | G53: 8 | H53: 任选精灵升华道具*1 | I53: 2500 | J53: 2500 | K53: 任选精灵升华道具*1 原价2500 8折，可购买1次
A54: 391 | B54: 5 | C54: 1000 | D54: 10010 | E54: 500 | F54: 3 | G54: 4 | H54: 圣器精炼石*500 | I54: 5 | J54: 2500 | K54: 圣器精炼石*500 原价2500 4折，可购买3次
A55: 392 | B55: 5 | C55: 300 | D55: 13008 | E55: 5 | F55: 5 | G55: 3 | H55: 圣器碎片箱*5 | I55: 200 | J55: 1000 | K55: 圣器碎片箱*5 原价1000 3折，可购买5次
A56: 393 | B56: 5 | C56: 200 | D56: 10001 | E56: 10 | F56: 2 | G56: 8 | H56: 精力丹*10 | I56: 25 | J56: 250 | K56: 精力丹*10 原价250 8折，可购买2次
A57: 451 | B57: 5 | C57: 200 | D57: 10008 | E57: 100 | F57: 5 | G57: 8 | H57: 觉醒水晶*100 | I57: 2.5 | J57: 250 | K57: 觉醒水晶*100 原价250 8折，可购买5次
A58: 452 | B58: 5 | C58: 280 | D58: 13017 | E58: 2 | F58: 5 | G58: 7 | H58: 觉醒材料箱（紫）*2 | I58: 200 | J58: 400 | K58: 觉醒材料箱（紫）*2 原价400 7折，可购买5次
A59: 453 | B59: 5 | C59: 105 | D59: 13016 | E59: 3 | F59: 10 | G59: 7 | H59: 觉醒材料箱（蓝）*3 | I59: 50 | J59: 150 | K59: 觉醒材料箱（蓝）*3 原价150 7折，可购买10次
A60: 501 | B60: 5 | C60: 400 | D60: 10009 | E60: 10 | F60: 5 | G60: 8 | H60: 预言星徽*10 | I60: 50 | J60: 500 | K60: 预言星徽*10 原价500 8折，可购买5次
A61: 502 | B61: 5 | C61: 150 | D61: 19103 | E61: 30 | F61: 10 | G61: 5 | H61: 金币*30W | I61: 10 | J61: 300 | K61: 金币*30W 原价300 5折，可购买10次

Sheet: 4.开服基金
A1: id|id | B1: need_role_level|need_role_level | C1: diamond|diamond
A2: 不可空 | B2: 不可空 | C2: 不可空
A3: 数字 | B3: 数字 | C3: 数字
A6: 奖励ID | B6: 需要的角色等级 | C6: 奖励钻石
A7: 1 | B7: 10 | C7: 500
A8: 2 | B8: 25 | C8: 1000
A9: 3 | B9: 35 | C9: 1500
A10: 4 | B10: 45 | C10: 2000
A11: 5 | B11: 55 | C11: 2500
A12: 6 | B12: 60 | C12: 2500

Sheet: 5.全民福利
A1: id|id | B1: need_buy_num|need_buy_num | C1: item_id_list|item_id_list | D1: item_num_list|item_num_list
A2: 不可空 | B2: 不可空 | C2: 可空#不需字段 | D2: 可空#不需字段
A3: 数字 | B3: 数字 | C3: 一维数组 | D3: 一维数组
C4: 不定长 | D4: 不定长
A6: 福利ID | B6: 需要的购买人数 | C6: 获得的物品ID列表 | D6: 获得的物品数量列表
A7: 1 | B7: 20 | C7: 19005 | D7: 100
A8: 2 | B8: 40 | C8: 19005 | D8: 200
A9: 3 | B9: 80 | C9: 19006 | D9: 300
A10: 4 | B10: 120 | C10: 19005 | D10: 400
A11: 5 | B11: 160 | C11: 19005 | D11: 500
A12: 6 | B12: 200 | C12: 19028 | D12: 600
A13: 7 | B13: 240 | C13: 19005 | D13: 700
A14: 8 | B14: 280 | C14: 19005 | D14: 800
A15: 9 | B15: 320 | C15: 19005 | D15: 900
A16: 10 | B16: 360 | C16: 19005 | D16: 1000

Sheet: 6.等级礼包数据
A1: level|level | B1: item_id_list|item_id_list | C1: item_num_list|item_num_list
A2: 不可空 | B2: 可空#不需字段 | C2: 可空#不需字段
A3: 数字 | B3: 一维数组 | C3: 一维数组
B4: 不定长 | C4: 不定长
A6: 等级 | B6: 物品ID列表 | C6: 物品数量列表
A7: 7 | B7: 19005|19103|20101|33100 | C7: 20|10|1|3 | D7: 钻石*20、金币*100000、绿品武器*1、绿品传承核心*3 | I7: 51 | J7: 19005|19103|10096|10009 | K7: 100|40|2|10 | L7: 钻石*100、金币*400000、占星水晶*2、预言星徽*10
A8: 9 | B8: 19005|19103|10003|13014 | C8: 20|10|50|10 | D8: 钻石*20、金币*100000、培养丹*50、橙品英雄碎片宝箱*10 | I8: 54 | J8: 19005|19103|13015|10009 | K8: 120|40|10|10 | L8: 钻石*120、金币*400000、觉醒材料箱（绿）*10、预言星徽*10
A9: 11 | B9: 19005|19006|10021|13024 | C9: 30|200|10|5 | D9: 钻石*30、魂晶*200、刷新令*10、随机绿品英雄*5
A10: 13 | B10: 19005|19103|42201|13049 | C10: 30|15|10|5 | D10: 钻石*30、金币*150000、蓝水晶*10、圣器碎片箱*5
A11: 15 | B11: 19005|19103|33200|10002 | C11: 30|15|4|50 | D11: 钻石*30、金币*150000、蓝品传承核心*4、进阶石*50
A12: 17 | B12: 19005|19103|13010|10002 | C12: 40|15|1|50 | D12: 钻石*40、金币*150000、紫品圣器箱*1、进阶石*50
A13: 20 | B13: 19005|19103|19012|13007 | C13: 40|15|500|5 | D13: 钻石*40、金币*150000、威名*500、装备碎片箱*5
A14: 22 | B14: 19005|19103|21201|10019 | C14: 50|15|1|1 | D14: 钻石*50、金币*150000、蓝品衣服*1、次元核心*1
A15: 23 | B15: 19005|19103|13620|10022 | C15: 50|15|1|10 | D15: 钻石*50、金币*150000、灵性精粹*10、次元核心*1
A16: 25 | B16: 19005|19103|22201|13049 | C16: 50|15|1|8 | D16: 钻石*50、金币*150000、蓝品鞋子*1、圣器碎片箱*8
A17: 27 | B17: 19005|19103|23201|42301 | C17: 60|15|1|5 | D17: 钻石*60、金币*150000、蓝品护腕*1、紫水晶*5
A18: 29 | B18: 19005|19103|33300|10013 | C18: 60|15|5|10 | D18: 钻石*60、金币*150000、紫品传承核心*5、紫品精炼石*10
A19: 31 | B19: 19005|19103|13007|10022 | C19: 70|20|10|10 | D19: 钻石*70、金币*200000、装备碎片箱*10、灵性精粹*10
A20: 32 | B20: 19005|19103|13626|10022 | C20: 70|20|1|15 | D20: 钻石*70、金币*200000、花之妖精*1、灵性精粹*15
A21: 33 | B21: 19005|19103|19020|10004 | C21: 70|20|1000|100 | D21: 钻石*70、金币*200000、军团贡献*1000、潜能药剂*100
A22: 36 | B22: 19005|19103|10004|10015 | C22: 80|20|100|10 | D22: 钻石*80、金币*200000、潜能药剂*100、讨伐令*10
A23: 39 | B23: 19005|19103|10010|13049 | C23: 80|30|100|12 | D23: 钻石*80、金币*300000、圣器精炼石*100、圣器碎片箱*12
A24: 42 | B24: 19005|19103|33400|10101 | C24: 90|30|5|5 | D24: 钻石*90、金币*300000、橙品传承核心*5、扭蛋币*5
A25: 45 | B25: 19005|19103|19017|10008 | C25: 90|30|200|100 | D25: 钻石*90、金币*300000、神魂*200、觉醒水晶*100
A26: 48 | B26: 19005|19103|13015|13016 | C26: 100|40|5|2 | D26: 钻石*100、金币*400000、觉醒材料箱（绿）*5、觉醒材料箱（蓝）*2

Sheet: 7.限时活动
A1: id|id | B1: type|type | C1: context|context | D1: reward_times_max|reward_times_max | E1: reward_item_id_list|reward_item_id_list | F1: reward_item_num_list|reward_item_num_list
A2: 不可空 | B2: 不可空 | C2: 不可空 | D2: 不可空 | E2: 可空#不需字段 | F2: 可空#不需字段
A3: 数字 | B3: 数字 | C3: 数字 | D3: 数字 | E3: 一维数组 | F3: 一维数组
E4: 不定长 | F4: 不定长
A6: 数据逻辑id | B6: 限时活动类型 | C6: 上下文 | D6: 奖励次数上限 | E6: 奖励的物品ID | F6: 奖励的物品数量
A7: 100 | B7: 1 | C7: 2002 | D7: 2 | E7: 19006|19103 | F7: 688|68
A8: 101 | B8: 1 | C8: 2003 | D8: 2 | E8: 10014|19103 | F8: 128|88
A9: 102 | B9: 1 | C9: 2004 | D9: 2 | E9: 19017|19103 | F9: 3888|128
A10: 103 | B10: 1 | C10: 2005 | D10: 2 | E10: 10004|19103 | F10: 666|188
A11: 200 | B11: 2 | C11: 6 | D11: 1 | E11: 19005|10000|10001 | F11: 150|2|2
A12: 201 | B12: 2 | C12: 25 | D12: 1 | E12: 13329|10001|19103 | F12: 20|4|20
A13: 202 | B13: 2 | C13: 50 | D13: 1 | E13: 13329|10000|19103 | F13: 30|4|35
A14: 203 | B14: 2 | C14: 100 | D14: 1 | E14: 10014|19103 | F14: 50|100
A15: 204 | B15: 2 | C15: 200 | D15: 1 | E15: 13316|10010|19103 | F15: 1|200|100
A16: 205 | B16: 2 | C16: 300 | D16: 1 | E16: 13302|19103 | F16: 160|110
A17: 206 | B17: 2 | C17: 500 | D17: 1 | E17: 13302|19103 | F17: 240|140
A18: 207 | B18: 2 | C18: 700 | D18: 1 | E18: 13302|19103 | F18: 240|140
A19: 208 | B19: 2 | C19: 1000 | D19: 1 | E19: 13302|19103 | F19: 320|270
A20: 209 | B20: 2 | C20: 1500 | D20: 1 | E20: 13302|19103 | F20: 400|400
A21: 210 | B21: 2 | C21: 2000 | D21: 1 | E21: 13302|19103 | F21: 400|400
A22: 211 | B22: 2 | C22: 2500 | D22: 1 | E22: 13302|19103 | F22: 400|400
A23: 212 | B23: 2 | C23: 3000 | D23: 1 | E23: 13302|19103 | F23: 400|400
A24: 213 | B24: 2 | C24: 3500 | D24: 1 | E24: 13302|19103 | F24: 400|400
A25: 214 | B25: 2 | C25: 4000 | D25: 1 | E25: 13302|19103 | F25: 400|400
A26: 215 | B26: 2 | C26: 4500 | D26: 1 | E26: 13302|19103 | F26: 400|400
A27: 300 | B27: 3 | C27: 20 | D27: 1 | E27: 13408|13410 | F27: 10|10
A28: 301 | B28: 3 | C28: 40 | D28: 1 | E28: 13407|13409 | F28: 20|20
A29: 302 | B29: 3 | C29: 60 | D29: 1 | E29: 13329|13406 | F29: 20|20
A30: 303 | B30: 3 | C30: 90 | D30: 1 | E30: 13408|13410 | F30: 30|30
A31: 304 | B31: 3 | C31: 120 | D31: 1 | E31: 13407|13409 | F31: 30|30
A32: 305 | B32: 3 | C32: 150 | D32: 1 | E32: 13329|13406 | F32: 30|30
A33: 306 | B33: 3 | C33: 190 | D33: 1 | E33: 13408|13410 | F33: 40|40
A34: 307 | B34: 3 | C34: 230 | D34: 1 | E34: 13407|13409 | F34: 50|50
A35: 308 | B35: 3 | C35: 270 | D35: 1 | E35: 13329|13406 | F35: 50|50
A36: 401 | B36: 4 | C36: 6 | D36: 1 | E36: 13400|10000|19103 | F36: 1|2|5
A37: 402 | B37: 4 | C37: 98 | D37: 1 | E37: 20400|10001|19103 | F37: 1|10|20
A38: 403 | B38: 4 | C38: 298 | D38: 1 | E38: 13622|10021|19103 | F38: 1|20|50
A39: 404 | B39: 4 | C39: 30 | D39: 1 | E39: 13399|23301|19103 | F39: 1|1|10

Sheet: 8.活动预告时间
A1: system_id|system_id | B1: module_txt_list| | C1: week_day_list|week_day_list | D1: need_role_level|need_role_level | E1: start_begin_notice_time| | F1: start_end_notice_time| | G1: is_declare| | H1: advance_notice| | I1: start_time| | J1: start_notice| | K1: interval_time| | L1: over_time| | M1: over_begin_notice_time|| | N1: over_end_notice_time| | O1: over_advance_notice| | P1: over_notice|
A2: 不可空 | B2: 不可空 | C2: 不可空 | D2: 不可空 | E2: 不可空 | F2: 不可空 | G2: 不可空 | H2: 可空#不需字段 | I2: 不可空 | J2: 可空#不需字段 | K2: 不可空 | L2: 不可空 | M2: 可空#不需字段 | N2: 可空#不需字段 | O2: 可空#不需字段 | P2: 可空#不需字段
A3: 数字 | B3: 一维数组 | C3: 一维数组 | D3: 数字 | E3: 一维数组 | F3: 一维数组 | G3: 数字 | H3: 字符串 | I3: 一维数组 | J3: 字符串 | K3: 数字 | L3: 一维数组 | M3: 一维数组 | N3: 一维数组 | O3: 字符串 | P3: 字符串
B4: 不定长 | C4: 不定长 | E4: 不定长 | F4: 不定长 | H4: 不定长 | I4: 不定长 | J4: 不定长 | L4: 不定长 | M4: 不定长 | N4: 不定长 | O4: 不定长 | P4: 不定长
A6: 系统模块ID | C6: 星期几(0=星期天) | D6: 需要的角色等级 | E6: 公告开始时间[小时分钟] | F6: 公告结束时间[小时分钟] | G6: 是否需要预告 | H6: 预告内容 | I6: 活动开启时间 | J6: 活动开始公告内容 | K6: 公告间隔时间(秒) | L6: 活动结束时间[小时分钟] | M6: 公告开始时间[小时分钟] | N6: 公告结束时间[小时分钟] | O6: 结束预告内容 | P6: 活动结束公告内容
A7: 47 | B7: "世界BOSS" | C7: 1|3|5 | D7: 35 | E7: 1855 | F7: 1859 | G7: 1 | H7: 世界BOSS将在%s出现，请做好准备，赢取丰厚奖励！ | I7: 1900 | J7: 世界BOSS已刷新，请大家踊跃参与击杀! | K7: 30 | L7: 2000
A8: 72 | B8: "跨服对决"|"跨服对决" | C8: 0|1|2|3|4|5|6 | D8: 20 | E8: 1155|2025 | F8: 1159|2029 | G8: 1 | H8: 跨服对决将在%s打响，在战斗中狂欢吧！ | I8: 1200|2030 | J8: 跨服对决已经开放，这是一场肆虐的盛宴！欢呼并战斗吧！ | K8: 30 | L8: 1300|2130
A9: 84 | B9: "怪物攻城" | C9: 2|4|6 | D9: 20 | E9: 1855 | F9: 1859 | G9: 1 | H9: 怪物将在%s进攻，务必做好堤防！ | I9: 1900 | J9: 无数怪物离开了栖息地，对各城镇发起冲击，请火速前往阻止 | K9: 30 | L9: 1930
A10: 16 | B10: "消耗减半"|"双倍功勋" | C10: 0|1|2|3|4|5|6 | D10: 35 | E10: 1155|1755 | F10: 1159|1759 | G10: 0 | I10: 1200|1800 | K10: 30 | L10: 1400|2200
A11: 134 | B11: "限时组队" | C11: 0|1|2|3|4|5|6 | D11: 31 | E11: 1955 | F11: 1959 | G11: 1 | H11: 空间管理局将在%s打开空间通道，请大家把握时机！ | I11: 2000 | J11: 空间管理局通道已打开！大家赶紧去参加跨服组队副本吧！ | K11: 30 | L11: 2200 | M11: 2155 | N11: 2159 | O11: 空间管理局将在%s关闭空间通道。 | P11: 空间管理局已关闭空间通道，请大家明天同一时间再度参与跨服组队副本！

Sheet: 9.节日活动
A1: activity_type|activity_type | B1: name| | D1: icon| | E1: id|id | F1: sort| | G1: head| | H1: scale| | I1: excursion| | J1: decorate| | K1: decorate_x| | L1: decorate_y| | M1: test_res| | N1: test_res_x| | O1: test_res_y| | P1: effect| | Q1: desc| | R1: time_type|time_type | S1: days|days | T1: server_list|server_list | U1: star_date|star_date | V1: star_time|star_time | W1: over_date|over_date | X1: over_time|over_time | Y1: reward_over_date|reward_over_date | Z1: reward_over_time|reward_over_time | AA1: param_list|param_list
A2: 不可空 | B2: 不可空 | D2: 不可空 | E2: 不可空 | F2: 不可空 | G2: 不可空 | H2: 不可空 | I2: 不可空 | J2: 可空#不需字段 | K2: 可空#不需字段 | L2: 可空#不需字段 | M2: 可空#不需字段 | N2: 可空#不需字段 | O2: 可空#不需字段 | P2: 可空#不需字段 | Q2: 不可空 | R2: 不可空 | S2: 不可空 | T2: 可空#不需字段 | U2: 不可空 | V2: 不可空 | W2: 不可空 | X2: 不可空 | Y2: 不可空 | Z2: 不可空 | AA2: 可空#不需字段
A3: 数字 | B3: 字符串 | D3: 字符串 | E3: 数字 | F3: 数字 | G3: 数字 | H3: 数字 | I3: 一维数组 | J3: 一维数组 | K3: 一维数组 | L3: 一维数组 | M3: 一维数组 | N3: 一维数组 | O3: 一维数组 | P3: 一维数组 | Q3: 字符串 | R3: 数字 | S3: 数字 | T3: 一维数组 | U3: 数字 | V3: 数字 | W3: 数字 | X3: 数字 | Y3: 数字 | Z3: 数字 | AA3: 一维数组
I4: 不定长 | J4: 不定长 | K4: 不定长 | L4: 不定长 | M4: 不定长 | N4: 不定长 | O4: 不定长 | P4: 不定长 | T4: 不定长 | AA4: 不定长
A6: 活动类型 | B6: 活动名 | C6: 备注 | D6: 图标 | E6: 活动ID | F6: 排序权值 | G6: 半身像ID | H6: 半身像缩放 | I6: 半身像偏移 | J6: 装饰图片 | K6: 装饰偏移X | L6: 装饰偏移Y | M6: 美术字 | N6: 美术字 | O6: 美术字 | P6: 特效ID | Q6: 活动描述 | R6: 时间类型 | S6: 开服多少天后有效 | T6: 开放的服务器列表 | U6: 开始日期 | V6: 开始时间[小时:分钟] | W6: 结束日期 | X6: 结束时间[小时:分钟] | Y6: 奖励结束日期 | Z6: 奖励结束时间 | AA6: 活动参数ID列表
A7: 11 | B7: 累充豪礼 | C7: 开服1~7天 | D7: btn_cumulative_recharge | E7: =ROW()-6 -> 1 | F7: 90 | G7: 31440 | H7: 1 | I7: 200|390 | J7: "sp_activity_gold"|"sp_activity_candle" | K7: 57|415 | L7: 253|268 | M7: "sp_activity_test6" | N7: 50 | O7: 430 | P7: 200001|200002 | Q7: 活动期间，累计充值金额达到指定额度可以领取对应奖励 | R7: 5 | S7: 1 | U7: 1 | V7: 0000 | W7: 7 | X7: 2359 | Y7: =RC[-2] -> 7 | Z7: 2359 | AA7: 2001|2002|2003|2004|2005|2006|2007|2008|2009
A8: 3 | B8: 限时召唤 | C8: 开服1~7天 | D8: btn_recruit | E8: =ROW()-6 -> 2 | F8: 80 | G8: 30449 | H8: 1 | I8: 190|385 | J8: "sp_activity_gold"|"sp_activity_candle" | K8: 57|415 | L8: 253|268 | M8: "sp_activity_test8" | N8: 50 | O8: 430 | P8: 200001|200002 | Q8: 活动期间，在高级召唤中召唤次数达到指定目标可以领取对应奖励 | R8: 5 | S8: 1 | U8: 1 | V8: 0000 | W8: 7 | X8: 2359 | Y8: =RC[-2] -> 7 | Z8: =RC[-2] -> 2359 | AA8: 10001|10002|10003|10004|10005|10006
A9: 6 | B9: 折扣商铺 | C9: 开服1天 | D9: btn_store | E9: =ROW()-6 -> 3 | F9: 70 | G9: 30438 | H9: 1 | I9: 200|350 | J9: "sp_activity_gold"|"sp_activity_candle" | K9: 57|415 | L9: 253|268 | M9: "sp_activity_test9" | N9: 50 | O9: 430 | P9: 200001|200002 | Q9: 开服首日限时打折，欲购从速！ | R9: 5 | S9: 1 | U9: 1 | V9: 0000 | W9: 1 | X9: 2359 | Y9: =RC[-2] -> 1 | Z9: =RC[-2] -> 2359 | AA9: 3051|3052|3053|3054
A10: 7 | B10: 勇者试炼 | C10: 开服1~3天 | D10: btn_reward | E10: =ROW()-6 -> 4 | F10: 60 | G10: 32431 | H10: 1 | I10: 190|340 | J10: "sp_activity_gold"|"sp_activity_candle" | K10: 57|415 | L10: 253|268 | M10: "sp_activity_test3" | N10: 50 | O10: 430 | P10: 200001|200002 | Q10: 活动期间，挑战勇者试炼可以领取对应奖励 | R10: 5 | S10: 1 | U10: 1 | V10: 0000 | W10: 3 | X10: 2359 | Y10: =RC[-2] -> 3 | Z10: =RC[-2] -> 2359 | AA10: 15003|15004|15005|15006|15007
A11: 1 | B11: 单充豪礼 | C11: 开服2~4天 | D11: btn_diamond | E11: =ROW()-6 -> 5 | F11: 50 | G11: 31330 | H11: 1 | I11: 200|350 | J11: "sp_activity_gold"|"sp_activity_candle" | K11: 57|415 | L11: 253|268 | M11: "sp_activity_test1" | N11: 50 | O11: 430 | P11: 200001|200002 | Q11: 活动期间，单笔充值金额达到指定额度可以领取对应奖励 | R11: 5 | S11: 2 | U11: 2 | V11: 0000 | W11: 4 | X11: 2359 | Y11: =RC[-2] -> 4 | Z11: =RC[-2] -> 2359 | AA11: 1001|1002|1003|1004|1005
A12: 6 | B12: 折扣商铺 | C12: 开服2~4天 | D12: btn_store | E12: =ROW()-6 -> 6 | F12: 70 | G12: 30438 | H12: 1 | I12: 200|350 | J12: "sp_activity_gold"|"sp_activity_candle" | K12: 57|415 | L12: 253|268 | M12: "sp_activity_test9" | N12: 50 | O12: 430 | P12: 200001|200002 | Q12: 活动期间，各类商品折扣出售 | R12: 5 | S12: 2 | U12: 2 | V12: 0000 | W12: 4 | X12: 2359 | Y12: =RC[-2] -> 4 | Z12: =RC[-2] -> 2359 | AA12: 3001|3002|3003|3004|3005|3006|3007|3008|3009|3010|3011|3012|3013|3014|3015
A13: 8 | B13: 限时兑换 | C13: 开服5~7天 | D13: btn_store | E13: =ROW()-6 -> 7 | F13: 40 | G13: 30320 | H13: 1 | I13: 210|370 | J13: "sp_activity_gold"|"sp_activity_candle" | K13: 57|415 | L13: 253|268 | M13: "sp_activity_test4" | N13: 50 | O13: 430 | P13: 200001|200002 | Q13: 活动期间，可以使用指定物品兑换商品 | R13: 5 | S13: 5 | U13: 5 | V13: 0000 | W13: 7 | X13: 2359 | Y13: =RC[-2] -> 7 | Z13: =RC[-2] -> 2359 | AA13: 4001|4002|4003|4004|4005|4006|4007|4008|4009|4010|4011|4012|4013|4014|4015|4016|4017|4018|4019|4020|4021|4022
A14: 1 | B14: 充值大礼 | C14: 开服5~7天 | D14: btn_diamond | E14: =ROW()-6 -> 8 | F14: 50 | G14: 31330 | H14: 1 | I14: 200|350 | J14: "sp_activity_gold"|"sp_activity_candle" | K14: 57|415 | L14: 253|268 | M14: "sp_activity_test1" | N14: 50 | O14: 430 | P14: 200001|200002 | Q14: 活动期间，单笔充值金额达到指定额度可以领取对应奖励 | R14: 5 | S14: 5 | U14: 5 | V14: 0000 | W14: 7 | X14: 2359 | Y14: =RC[-2] -> 7 | Z14: =RC[-2] -> 2359 | AA14: 1006|1007|1008|1009|1010|1011|1012|1013
A15: 7 | B15: 活跃目标 | C15: 开服5~7天 | D15: btn_reward | E15: =ROW()-6 -> 9 | F15: 70 | G15: 32431 | H15: 1 | I15: 190|340 | J15: "sp_activity_gold"|"sp_activity_candle" | K15: 57|415 | L15: 253|268 | M15: "sp_activity_test3" | N15: 50 | O15: 430 | P15: 200001|200002 | Q15: 活动期间，达成活跃目标可以领取对应奖励 | R15: 5 | S15: 5 | U15: 5 | V15: 0000 | W15: 7 | X15: 2359 | Y15: =RC[-2] -> 7 | Z15: =RC[-2] -> 2359 | AA15: 6000|7000|8000|6001|6002|6003|6004|6005|6006|7001|7002|7003|7004|7005|7006|8001|8002|8003|8004|8005|8006
A16: 10 | B16: 活动登陆 | C16: 开服第8~12天 | D16: btn_daily | E16: =ROW()-6 -> 10 | F16: 100 | G16: 32412 | H16: 1 | I16: 180|370 | J16: "sp_activity_gold"|"sp_activity_candle" | K16: 57|415 | L16: 253|268 | M16: "sp_activity_test2" | N16: 50 | O16: 430 | P16: 200001|200002 | Q16: 活动期间，在指定日期登录即可以领取对应奖励 | R16: 5 | S16: 8 | U16: 8 | V16: 0000 | W16: 12 | X16: 2359 | Y16: =RC[-2] -> 12 | Z16: =RC[-2] -> 2359 | AA16: 11001|11002|11003|11004|11005
A17: 11 | B17: 累充壕礼 | C17: 开服第15~21天 | D17: btn_store | E17: =ROW()-6 -> 11 | F17: 90 | G17: 30438 | H17: 1 | I17: 200|350 | J17: "sp_activity_gold"|"sp_activity_candle" | K17: 57|415 | L17: 253|268 | M17: "sp_activity_test9" | N17: 50 | O17: 430 | P17: 200001|200002 | Q17: 活动期间，各类商品折扣出售 | R17: 5 | S17: 8 | U17: 8 | V17: 0000 | W17: 12 | X17: 2359 | Y17: =RC[-2] -> 12 | Z17: =RC[-2] -> 2359 | AA17: 2001|2002|2003|2004|2005|2006|2007|2008|2009
A18: 6 | B18: 打折兑换 | C18: 开服第8~12天 | D18: btn_store | E18: =ROW()-6 -> 12 | F18: 90 | G18: 30438 | H18: 1 | I18: 200|350 | J18: "sp_activity_gold"|"sp_activity_candle" | K18: 57|415 | L18: 253|268 | M18: "sp_activity_test9" | N18: 50 | O18: 430 | P18: 200001|200002 | Q18: 活动期间，各类商品折扣出售 | R18: 5 | S18: 8 | U18: 8 | V18: 0000 | W18: 12 | X18: 2359 | Y18: =RC[-2] -> 12 | Z18: =RC[-2] -> 2359 | AA18: 3021|3022|3023|3024|3025|3026|3027
A19: 7 | B19: 深渊活跃 | C19: 开服第8~14天 | D19: btn_daily | E19: =ROW()-6 -> 13 | F19: 80 | G19: 31403 | H19: 1 | I19: 270|400 | J19: "sp_activity_gold"|"sp_activity_candle" | K19: 57|415 | L19: 253|268 | M19: "sp_activity_test11" | N19: 50 | O19: 430 | P19: 200001|200002 | Q19: 活动期间，挑战无尽深渊可以领取对应奖励 | R19: 5 | S19: 8 | U19: 8 | V19: 0000 | W19: 14 | X19: 2359 | Y19: =RC[-2] -> 14 | Z19: =RC[-2] -> 2359 | AA19: 9001|9002|9003|9004|9005|9006|9007|9008
A20: 10 | B20: 登陆奖励 | C20: 开服第15~19天 | D20: btn_daily | E20: =ROW()-6 -> 14 | F20: 100 | G20: 32412 | H20: 1 | I20: 180|370 | J20: "sp_activity_gold"|"sp_activity_candle" | K20: 57|415 | L20: 253|268 | M20: "sp_activity_test2" | N20: 50 | O20: 430 | P20: 200001|200002 | Q20: 活动期间，在指定日期登录即可以领取对应奖励！ | R20: 5 | S20: 8 | U20: 15 | V20: 0000 | W20: 19 | X20: 2359 | Y20: =RC[-2] -> 19 | Z20: =RC[-2] -> 2359 | AA20: 11006|11007|11008|11009|11010
A21: 11 | B21: 累充壕礼 | C21: 开服第15~21天 | D21: btn_store | E21: =ROW()-6 -> 15 | F21: 90 | G21: 30438 | H21: 1 | I21: 200|350 | J21: "sp_activity_gold"|"sp_activity_candle" | K21: 57|415 | L21: 253|268 | M21: "sp_activity_test9" | N21: 50 | O21: 430 | P21: 200001|200002 | Q21: 活动期间，各类商品折扣出售 | R21: 5 | S21: 8 | U21: 15 | V21: 0000 | W21: 21 | X21: 2359 | Y21: =RC[-2] -> 21 | Z21: =RC[-2] -> 2359 | AA21: 2010|2011|2012|2013
A22: 7 | B22: 空间任务 | C22: 开服第15~21天 | D22: btn_daily | E22: =ROW()-6 -> 16 | F22: 80 | G22: 31403 | H22: 1 | I22: 270|400 | J22: "sp_activity_gold"|"sp_activity_candle" | K22: 57|415 | L22: 253|268 | M22: "sp_activity_test11" | N22: 50 | O22: 430 | P22: 200001|200002 | Q22: 活动期间，挑战时空管理局可以领取对应奖励 | R22: 6 | S22: 8 | U22: 15 | V22: 0000 | W22: 21 | X22: 2359 | Y22: =RC[-2] -> 21 | Z22: =RC[-2] -> 2359 | AA22: 12010|12011|12004|12005|12006|12007|12008|12009
A23: 9 | B23: 登录有礼 | C23: 循环活动04.17~04.20 | D23: btn_daily | E23: =ROW()-6 -> 17 | F23: 99 | G23: 32440 | H23: 1 | I23: 270|370 | J23: "sp_activity_gold"|"sp_activity_candle" | K23: 57|415 | L23: 253|268 | M23: "sp_activity_test11" | N23: 50 | O23: 430 | P23: 200001|200002 | Q23: 活动期间，在指定日期登录即可以领取对应奖励 | R23: 1 | S23: 21 | U23: 20180417 | V23: 0000 | W23: 20180420 | X23: 2359 | Y23: =RC[-2] -> 20180420 | Z23: =RC[-2] -> 2359 | AA23: 5024|5025|5026|5027
A24: 14 | B24: 福利活动 | C24: 循环活动04.17~04.20 | D24: btn_daily | E24: =ROW()-6 -> 18 | F24: 98 | G24: 31403 | H24: 1 | I24: 270|400 | J24: "sp_activity_gold"|"sp_activity_candle" | K24: 57|415 | L24: 253|268 | M24: "sp_activity_test11" | N24: 50 | O24: 430 | P24: 200001|200002 | Q24: 活动期间，达成活跃目标可以领取对应奖励 | R24: 1 | S24: 21 | U24: 20180417 | V24: 0000 | W24: 20180420 | X24: 2359 | Y24: =RC[-2] -> 20180420 | Z24: =RC[-2] -> 2359 | AA24: 6023|6024|6025|6026|6027|6028|6029|6030|6031|6032
A25: 4 | B25: 单充豪礼 | C25: 循环活动04.17~04.20 | D25: btn_diamond | E25: =ROW()-6 -> 19 | F25: 95 | G25: 31330 | H25: 1 | I25: 200|350 | J25: "sp_activity_gold"|"sp_activity_candle" | K25: 57|415 | L25: 253|268 | M25: "sp_activity_test12" | N25: 50 | O25: 430 | P25: 200001|200002 | Q25: 活动期间，单笔充值金额达到指定额度可以领取对应奖励 | R25: 1 | S25: 21 | U25: 20180417 | V25: 0000 | W25: 20180420 | X25: 2359 | Y25: =RC[-2] -> 20180420 | Z25: =RC[-2] -> 2359 | AA25: 1032|1033|1034|1035|1036
A26: 13 | B26: 折扣商铺 | C26: 循环活动04.17~04.20 | D26: btn_reward | E26: =ROW()-6 -> 20 | F26: 96 | G26: 32428 | H26: 1 | I26: 250|360 | J26: "sp_activity_gold"|"sp_activity_candle" | K26: 57|415 | L26: 253|268 | M26: "sp_activity_test12" | N26: 50 | O26: 430 | P26: 200001|200002 | Q26: 活动期间，各类商品折扣出售 | R26: 1 | S26: 21 | U26: 20180417 | V26: 0000 | W26: 20180420 | X26: 2359 | Y26: =RC[-2] -> 20180420 | Z26: =RC[-2] -> 2359 | AA26: 3055|3056|3057|3058|3059|3060|3061|3062|3063|3064|3065|3066|3067|3068
A27: 9 | B27: 登录有礼 | C27: 循环登录04.21~0423 | D27: btn_daily | E27: =ROW()-6 -> 21 | F27: 99 | G27: 32440 | H27: 1 | I27: 270|370 | J27: "sp_activity_gold"|"sp_activity_candle" | K27: 57|415 | L27: 253|268 | M27: "sp_activity_test11" | N27: 50 | O27: 430 | P27: 200001|200002 | Q27: 活动期间，在指定日期登录即可以领取对应奖励 | R27: 1 | S27: 21 | U27: 20180421 | V27: 0000 | W27: 20180423 | X27: 2359 | Y27: =RC[-2] -> 20180423 | Z27: =RC[-2] -> 2359 | AA27: 5028|5029|5030
A28: 14 | B28: 福利活动 | C28: 循环登录04.21~0423 | D28: btn_daily | E28: =ROW()-6 -> 22 | F28: 98 | G28: 31403 | H28: 1 | I28: 270|400 | J28: "sp_activity_gold"|"sp_activity_candle" | K28: 57|415 | L28: 253|268 | M28: "sp_activity_test11" | N28: 50 | O28: 430 | P28: 200001|200002 | Q28: 活动期间，达成活跃目标可以领取对应奖励 | R28: 1 | S28: 21 | U28: 20180421 | V28: 0000 | W28: 20180423 | X28: 2359 | Y28: =RC[-2] -> 20180423 | Z28: =RC[-2] -> 2359 | AA28: 8015|8016|8017|8018|8019|8020|8021|8022|8023|8024
A29: 4 | B29: 单充豪礼 | C29: 循环登录04.21~0423 | D29: btn_diamond | E29: =ROW()-6 -> 23 | F29: 95 | G29: 31330 | H29: 1 | I29: 200|350 | J29: "sp_activity_gold"|"sp_activity_candle" | K29: 57|415 | L29: 253|268 | M29: "sp_activity_test12" | N29: 50 | O29: 430 | P29: 200001|200002 | Q29: 活动期间，单笔充值金额达到指定额度可以领取对应奖励 | R29: 1 | S29: 21 | U29: 20180421 | V29: 0000 | W29: 20180423 | X29: 2359 | Y29: =RC[-2] -> 20180423 | Z29: =RC[-2] -> 2359 | AA29: 1037|1038|1039|1040|1041
A30: 13 | B30: 折扣商铺 | C30: 循环登录04.21~0423 | D30: btn_reward | E30: =ROW()-6 -> 24 | F30: 96 | G30: 32428 | H30: 1 | I30: 250|360 | J30: "sp_activity_gold"|"sp_activity_candle" | K30: 57|415 | L30: 253|268 | M30: "sp_activity_test12" | N30: 50 | O30: 430 | P30: 200001|200002 | Q30: 活动期间，各类商品折扣出售 | R30: 1 | S30: 21 | U30: 20180421 | V30: 0000 | W30: 20180423 | X30: 2359 | Y30: =RC[-2] -> 20180423 | Z30: =RC[-2] -> 2359 | AA30: 3055|3056|3057|3058|3059|3060|3061|3062|3063|3064|3065|3066|3067|3068
A31: 9 | B31: 登录有礼 | C31: 循环活动04.24~0427 | D31: btn_daily | E31: =ROW()-6 -> 25 | F31: 99 | G31: 32440 | H31: 1 | I31: 270|370 | J31: "sp_activity_gold"|"sp_activity_candle" | K31: 57|415 | L31: 253|268 | M31: "sp_activity_test11" | N31: 50 | O31: 430 | P31: 200001|200002 | Q31: 活动期间，在指定日期登录即可以领取对应奖励 | R31: 1 | S31: 21 | U31: 20180424 | V31: 0000 | W31: 20180427 | X31: 2359 | Y31: =RC[-2] -> 20180427 | Z31: =RC[-2] -> 2359 | AA31: 5031|5032|5033|5034
A32: 14 | B32: 福利活动 | C32: 循环活动04.24~0427 | D32: btn_daily | E32: =ROW()-6 -> 26 | F32: 98 | G32: 31403 | H32: 1 | I32: 270|400 | J32: "sp_activity_gold"|"sp_activity_candle" | K32: 57|415 | L32: 253|268 | M32: "sp_activity_test11" | N32: 50 | O32: 430 | P32: 200001|200002 | Q32: 活动期间，达成活跃目标可以领取对应奖励 | R32: 1 | S32: 21 | U32: 20180424 | V32: 0000 | W32: 20180427 | X32: 2359 | Y32: =RC[-2] -> 20180427 | Z32: =RC[-2] -> 2359 | AA32: 7030|7031|7032|7033|7034|7035
A33: 4 | B33: 单充豪礼 | C33: 循环活动04.24~0427 | D33: btn_diamond | E33: =ROW()-6 -> 27 | F33: 95 | G33: 31330 | H33: 1 | I33: 200|350 | J33: "sp_activity_gold"|"sp_activity_candle" | K33: 57|415 | L33: 253|268 | M33: "sp_activity_test12" | N33: 50 | O33: 430 | P33: 200001|200002 | Q33: 活动期间，单笔充值金额达到指定额度可以领取对应奖励 | R33: 1 | S33: 21 | U33: 20180424 | V33: 0000 | W33: 20180427 | X33: 2359 | Y33: =RC[-2] -> 20180427 | Z33: =RC[-2] -> 2359 | AA33: 1032|1033|1034|1035|1036
A34: 13 | B34: 折扣商铺 | C34: 循环活动04.24~0427 | D34: btn_reward | E34: =ROW()-6 -> 28 | F34: 96 | G34: 32428 | H34: 1 | I34: 250|360 | J34: "sp_activity_gold"|"sp_activity_candle" | K34: 57|415 | L34: 253|268 | M34: "sp_activity_test12" | N34: 50 | O34: 430 | P34: 200001|200002 | Q34: 活动期间，各类商品折扣出售 | R34: 1 | S34: 21 | U34: 20180424 | V34: 0000 | W34: 20180427 | X34: 2359 | Y34: =RC[-2] -> 20180427 | Z34: =RC[-2] -> 2359 | AA34: 3055|3056|3057|3058|3059|3060|3061|3062|3063|3064|3065|3066|3067|3068
A35: 6 | B35: 扭蛋商铺 | C35: 周3-周4 | D35: btn_store | E35: =ROW()-6 -> 29 | F35: 70 | G35: 30438 | H35: 1 | I35: 200|350 | J35: "sp_activity_gold"|"sp_activity_candle" | K35: 57|415 | L35: 253|268 | M35: "sp_activity_test9" | N35: 50 | O35: 430 | P35: 200001|200002 | Q35: 活动期间，各类商品折扣出售 | R35: 3 | S35: 13 | T35: 1|2|3|4|5|6 | U35: 3 | V35: 0000 | W35: 4 | X35: 2359 | Y35: =RC[-2] -> 4 | Z35: 2359 | AA35: 3051|3052|3053|3054
A36: 6 | B36: 扭蛋商铺 | C36: 周3-周4 | D36: btn_store | E36: =ROW()-6 -> 30 | F36: 70 | G36: 30438 | H36: 1 | I36: 200|350 | J36: "sp_activity_gold"|"sp_activity_candle" | K36: 57|415 | L36: 253|268 | M36: "sp_activity_test9" | N36: 50 | O36: 430 | P36: 200001|200002 | Q36: 活动期间，各类商品折扣出售 | R36: 3 | S36: 13 | T36: 7|8|9|10|11|12 | U36: 3 | V36: 0000 | W36: 4 | X36: 2359 | Y36: =RC[-2] -> 4 | Z36: 2359 | AA36: 3051|3052|3053|3054
A37: 6 | B37: 扭蛋商铺 | C37: 周3-周4 | D37: btn_store | E37: =ROW()-6 -> 31 | F37: 70 | G37: 30438 | H37: 1 | I37: 200|350 | J37: "sp_activity_gold"|"sp_activity_candle" | K37: 57|415 | L37: 253|268 | M37: "sp_activity_test9" | N37: 50 | O37: 430 | P37: 200001|200002 | Q37: 活动期间，各类商品折扣出售 | R37: 3 | S37: 13 | T37: 13|14|15 | U37: 3 | V37: 0000 | W37: 4 | X37: 2359 | Y37: =RC[-2] -> 4 | Z37: 2359 | AA37: 3051|3052|3053|3054
A38: 6 | B38: 扭蛋商铺 | C38: 周日 | D38: btn_store | E38: =ROW()-6 -> 32 | F38: 70 | G38: 30438 | H38: 1 | I38: 200|350 | J38: "sp_activity_gold"|"sp_activity_candle" | K38: 57|415 | L38: 253|268 | M38: "sp_activity_test9" | N38: 50 | O38: 430 | P38: 200001|200002 | Q38: 活动期间，各类商品折扣出售 | R38: 3 | S38: 13 | T38: 1|2|3|4|5|6 | U38: 0 | V38: 0000 | W38: 0 | X38: 2359 | Y38: =RC[-2] -> 0 | Z38: 2359 | AA38: 3051|3052|3053|3054
A39: 6 | B39: 扭蛋商铺 | C39: 周日 | D39: btn_store | E39: =ROW()-6 -> 33 | F39: 70 | G39: 30438 | H39: 1 | I39: 200|350 | J39: "sp_activity_gold"|"sp_activity_candle" | K39: 57|415 | L39: 253|268 | M39: "sp_activity_test9" | N39: 50 | O39: 430 | P39: 200001|200002 | Q39: 活动期间，各类商品折扣出售 | R39: 3 | S39: 13 | T39: 7|8|9|12 | U39: 0 | V39: 0000 | W39: 0 | X39: 2359 | Y39: =RC[-2] -> 0 | Z39: 2359 | AA39: 3051|3052|3053|3054
A40: 6 | B40: 扭蛋商铺 | C40: 周日 | D40: btn_store | E40: =ROW()-6 -> 34 | F40: 70 | G40: 30438 | H40: 1 | I40: 200|350 | J40: "sp_activity_gold"|"sp_activity_candle" | K40: 57|415 | L40: 253|268 | M40: "sp_activity_test9" | N40: 50 | O40: 430 | P40: 200001|200002 | Q40: 活动期间，各类商品折扣出售 | R40: 3 | S40: 13 | T40: 13|14|15 | U40: 0 | V40: 0000 | W40: 0 | X40: 2359 | Y40: =RC[-2] -> 0 | Z40: 2359 | AA40: 3051|3052|3053|3054
A41: 14 | B41: 福利活动 | C41: 循环活动04.24~0427 | D41: btn_daily | E41: =ROW()-6 -> 35 | F41: 98 | G41: 31403 | H41: 1 | I41: 270|400 | J41: "sp_activity_gold"|"sp_activity_candle" | K41: 57|415 | L41: 253|268 | M41: "sp_activity_test11" | N41: 50 | O41: 430 | P41: 200001|200002 | Q41: 活动期间，达成活跃目标可以领取对应奖励 | R41: 3 | S41: 1 | U41: 1 | V41: 0000 | W41: 5 | X41: 2359 | Y41: =RC[-2] -> 5 | Z41: =RC[-2] -> 2359 | AA41: 37000|37001|37002|37003
A42: 4 | B42: 单充豪礼 | C42: 测试活动 | D42: btn_diamond | E42: =ROW()-6 -> 36 | F42: 95 | G42: 31330 | H42: 1 | I42: 200|350 | J42: "sp_activity_gold"|"sp_activity_candle" | K42: 57|415 | L42: 253|268 | M42: "sp_activity_test12" | N42: 50 | O42: 430 | P42: 200001|200002 | Q42: 活动期间，单笔充值金额达到指定额度可以领取对应奖励 | R42: 1 | S42: 1 | T42: 999 | U42: 20180901 | V42: 1000 | W42: 20180920 | X42: 1900 | Y42: =RC[-2] -> 20180920 | Z42: =RC[-2] -> 1900 | AA42: 1032|1033|1034|1035|1036
A43: 5 | B43: 累充豪礼 | C43: 测试活动 | D43: btn_cumulative_recharge | E43: =ROW()-6 -> 37 | F43: 90 | G43: 31440 | H43: 1 | I43: 200|390 | J43: "sp_activity_gold"|"sp_activity_candle" | K43: 57|415 | L43: 253|268 | M43: "sp_activity_test6" | N43: 50 | O43: 430 | P43: 200001|200002 | Q43: 活动期间，累计充值金额达到指定额度可以领取对应奖励 | R43: 3 | S43: 1 | U43: 1 | V43: 0000 | W43: 0 | X43: 2359 | Y43: =RC[-2] -> 0 | Z43: =RC[-2] -> 2359 | AA43: 2001|2002|2003|2004|2005|2006|2007|2008|2009
A44: 7 | B44: 活跃目标 | C44: 测试活动 | D44: btn_reward | E44: =ROW()-6 -> 38 | F44: 70 | G44: 32431 | H44: 1 | I44: 190|340 | J44: "sp_activity_gold"|"sp_activity_candle" | K44: 57|415 | L44: 253|268 | M44: "sp_activity_test3" | N44: 50 | O44: 430 | P44: 200001|200002 | Q44: 活动期间，达成活跃目标可以领取对应奖励 | R44: 3 | S44: 1 | T44: 999 | U44: 1 | V44: 1000 | W44: 5 | X44: 1900 | Y44: =RC[-2] -> 5 | Z44: =RC[-2] -> 1900 | AA44: 6000|7000|8000|6001|6002|6003|6004|6005|6006|7001|7002|7003|7004|7005|7006|8001|8002|8003|8004|8005|8006

Sheet: 10.节日活动参数
A1: id|id | B1: logic_type|logic_type | C1: showplan|is_stage_target | D1: is_need_take|is_need_take | E1: desc| | F1: x|x | G1: y|y | H1: reward_times|reward_times | I1: showittem| | J1: is_daily_reset|is_daily_reset | K1: reward_item_id_list|reward_item_id_list | L1: reward_item_num_list|reward_item_num_list | M1: vip_precondition| | N1: discount|
A2: 不可空 | B2: 不可空 | C2: 不可空 | D2: 不可空 | E2: 可空#不需字段 | F2: 不可空 | G2: 可空#不需字段 | H2: 不可空 | I2: 不可空 | J2: 不可空 | K2: 可空#不需字段 | L2: 可空#不需字段 | M2: 可空#不需字段 | N2: 可空#不需字段 | P2: 充值id | Q2: 商品名
A3: 数字 | B3: 数字 | C3: 数字 | D3: 数字 | E3: 字符串 | F3: 数字 | G3: 数字 | H3: 数字 | I3: 数字 | J3: 数字 | K3: 一维数组 | L3: 一维数组 | M3: 数字 | N3: 数字 | P3: 2001 | Q3: 60钻
K4: 不定长 | L4: 不定长 | P4: 2002 | Q4: 300钻
P5: 2003 | Q5: 680钻
A6: 目标ID | B6: 逻辑类型 | C6: 是否显示进度(是否阶段目标) | D6: 是否需要领取的目标 | E6: 描述 | F6: 上下文值x | G6: 上下文值y | H6: 奖励次数 | I6: 是否显示次数 | J6: 是否每日重置 | K6: 奖励的物品ID列表 | L6: 奖励的物品数量列表 | M6: vip前置条件 | N6: 折扣标识 | P6: 2004 | Q6: 980钻
A7: 1001 | B7: =INT(RC[-1]/1000) -> 1 | C7: 0 | D7: 1 | E7: ="活动期间单笔充值"&VLOOKUP(RC[1],R2C16:R11C17,2,FALSE) -> 活动期间单笔充值300钻 | F7: 2002 | H7: 1 | I7: 1 | J7: 0 | K7: 10003|19103 | L7: 268|68 | O7: 单笔充值x=充值ID | P7: 2005 | Q7: 1680钻
A8: 1002 | B8: =INT(RC[-1]/1000) -> 1 | C8: 0 | D8: 1 | E8: ="活动期间单笔充值"&VLOOKUP(RC[1],R2C16:R11C17,2,FALSE) -> 活动期间单笔充值680钻 | F8: 2003 | H8: 1 | I8: 1 | J8: 0 | K8: 10014|19103 | L8: 128|88 | P8: 2006 | Q8: 2680钻
A9: 1003 | B9: =INT(RC[-1]/1000) -> 1 | C9: 0 | D9: 1 | E9: ="活动期间单笔充值"&VLOOKUP(RC[1],R2C16:R11C17,2,FALSE) -> 活动期间单笔充值980钻 | F9: 2004 | H9: 1 | I9: 1 | J9: 0 | K9: 10022|19103 | L9: 80|128 | P9: 2007 | Q9: 4180钻
A10: 1004 | B10: =INT(RC[-1]/1000) -> 1 | C10: 0 | D10: 1 | E10: ="活动期间单笔充值"&VLOOKUP(RC[1],R2C16:R11C17,2,FALSE) -> 活动期间单笔充值1680钻 | F10: 2005 | H10: 1 | I10: 1 | J10: 0 | K10: 10004|19103 | L10: 488|188 | P10: 2008 | Q10: 6480钻
A11: 1005 | B11: =INT(RC[-1]/1000) -> 1 | C11: 0 | D11: 1 | E11: ="活动期间单笔充值"&VLOOKUP(RC[1],R2C16:R11C17,2,FALSE) -> 活动期间单笔充值2680钻 | F11: 2006 | H11: 1 | I11: 1 | J11: 0 | K11: 13324|13646|19103 | L11: 2|50|298 | P11: 2009 | Q11: 20000钻
A12: 1006 | B12: =INT(RC[-1]/1000) -> 1 | C12: 0 | D12: 1 | E12: ="活动期间单笔充值"&VLOOKUP(RC[1],R2C16:R11C17,2,FALSE) -> 活动期间单笔充值60钻 | F12: 2001 | H12: 1 | I12: 1 | J12: 0 | K12: 10029|19005 | L12: 2|150
A13: 1007 | B13: =INT(RC[-1]/1000) -> 1 | C13: 0 | D13: 1 | E13: ="活动期间单笔充值"&VLOOKUP(RC[1],R2C16:R11C17,2,FALSE) -> 活动期间单笔充值300钻 | F13: 2002 | H13: 1 | I13: 1 | J13: 0 | K13: 10029|19006|19103 | L13: 6|666|66
A14: 1008 | B14: =INT(RC[-1]/1000) -> 1 | C14: 0 | D14: 1 | E14: ="活动期间单笔充值"&VLOOKUP(RC[1],R2C16:R11C17,2,FALSE) -> 活动期间单笔充值680钻 | F14: 2003 | H14: 2 | I14: 1 | J14: 0 | K14: 10029|13320|10000|10001 | L14: 12|30|5|5
A15: 1009 | B15: =INT(RC[-1]/1000) -> 1 | C15: 0 | D15: 1 | E15: ="活动期间单笔充值"&VLOOKUP(RC[1],R2C16:R11C17,2,FALSE) -> 活动期间单笔充值980钻 | F15: 2004 | H15: 2 | I15: 1 | J15: 0 | K15: 10029|13320|10000|10001 | L15: 20|30|10|10
A16: 1010 | B16: =INT(RC[-1]/1000) -> 1 | C16: 0 | D16: 1 | E16: ="活动期间单笔充值"&VLOOKUP(RC[1],R2C16:R11C17,2,FALSE) -> 活动期间单笔充值1680钻 | F16: 2005 | H16: 2 | I16: 1 | J16: 0 | K16: 10029|10004|10000|10001 | L16: 30|268|15|15
A17: 1011 | B17: =INT(RC[-1]/1000) -> 1 | C17: 0 | D17: 1 | E17: ="活动期间单笔充值"&VLOOKUP(RC[1],R2C16:R11C17,2,FALSE) -> 活动期间单笔充值2680钻 | F17: 2006 | H17: 2 | I17: 1 | J17: 0 | K17: 10029|10004 | L17: 50|488
A18: 1012 | B18: =INT(RC[-1]/1000) -> 1 | C18: 0 | D18: 1 | E18: ="活动期间单笔充值"&VLOOKUP(RC[1],R2C16:R11C17,2,FALSE) -> 活动期间单笔充值4180钻 | F18: 2007 | H18: 2 | I18: 1 | J18: 0 | K18: 10029|10004 | L18: 60|688
A19: 1013 | B19: =INT(RC[-1]/1000) -> 1 | C19: 0 | D19: 1 | E19: ="活动期间单笔充值"&VLOOKUP(RC[1],R2C16:R11C17,2,FALSE) -> 活动期间单笔充值6480钻 | F19: 2008 | H19: 2 | I19: 1 | J19: 0 | K19: 10029|10004 | L19: 100|888
A20: 1014 | B20: =INT(RC[-1]/1000) -> 1 | C20: 0 | D20: 1 | E20: ="活动期间单笔充值"&VLOOKUP(RC[1],R2C16:R11C17,2,FALSE) -> 活动期间单笔充值300钻 | F20: 2002 | H20: 2 | I20: 1 | J20: 0 | K20: 10003|19103 | L20: 268|68
A21: 1015 | B21: =INT(RC[-1]/1000) -> 1 | C21: 0 | D21: 1 | E21: ="活动期间单笔充值"&VLOOKUP(RC[1],R2C16:R11C17,2,FALSE) -> 活动期间单笔充值680钻 | F21: 2003 | H21: 2 | I21: 1 | J21: 0 | K21: 10014|19103 | L21: 128|88
A22: 1016 | B22: =INT(RC[-1]/1000) -> 1 | C22: 0 | D22: 1 | E22: ="活动期间单笔充值"&VLOOKUP(RC[1],R2C16:R11C17,2,FALSE) -> 活动期间单笔充值1680钻 | F22: 2005 | H22: 2 | I22: 1 | J22: 0 | K22: 10004|19103 | L22: 488|188
A23: 1017 | B23: =INT(RC[-1]/1000) -> 1 | C23: 0 | D23: 1 | E23: ="活动期间单笔充值"&VLOOKUP(RC[1],R2C16:R11C17,2,FALSE) -> 活动期间单笔充值2680钻 | F23: 2006 | H23: 2 | I23: 1 | J23: 0 | K23: 10008|19103 | L23: 2688|298
A24: 1018 | B24: =INT(RC[-1]/1000) -> 1 | C24: 0 | D24: 1 | E24: ="活动期间单笔充值"&VLOOKUP(RC[1],R2C16:R11C17,2,FALSE) -> 活动期间单笔充值4180钻 | F24: 2007 | H24: 2 | I24: 1 | J24: 0 | K24: 13302|19103 | L24: 388|388
A25: 1019 | B25: =INT(RC[-1]/1000) -> 1 | C25: 0 | D25: 1 | E25: ="活动期间单笔充值"&VLOOKUP(RC[1],R2C16:R11C17,2,FALSE) -> 活动期间单笔充值300钻 | F25: 2002 | H25: 2 | I25: 1 | J25: 0 | K25: 19005|10000|19103 | L25: 150|10|68
A26: 1020 | B26: =INT(RC[-1]/1000) -> 1 | C26: 0 | D26: 1 | E26: ="活动期间单笔充值"&VLOOKUP(RC[1],R2C16:R11C17,2,FALSE) -> 活动期间单笔充值680钻 | F26: 2003 | H26: 2 | I26: 1 | J26: 0 | K26: 19005|10001|19103 | L26: 340|20|128
A27: 1021 | B27: =INT(RC[-1]/1000) -> 1 | C27: 0 | D27: 1 | E27: ="活动期间单笔充值"&VLOOKUP(RC[1],R2C16:R11C17,2,FALSE) -> 活动期间单笔充值980钻 | F27: 2004 | H27: 2 | I27: 1 | J27: 0 | K27: 19005|10010|19103 | L27: 490|175|188
A28: 1022 | B28: =INT(RC[-1]/1000) -> 1 | C28: 0 | D28: 1 | E28: ="活动期间单笔充值"&VLOOKUP(RC[1],R2C16:R11C17,2,FALSE) -> 活动期间单笔充值1680钻 | F28: 2005 | H28: 2 | I28: 1 | J28: 0 | K28: 19005|10010|19103 | L28: 840|250|366
A29: 1023 | B29: =INT(RC[-1]/1000) -> 1 | C29: 0 | D29: 1 | E29: ="活动期间单笔充值"&VLOOKUP(RC[1],R2C16:R11C17,2,FALSE) -> 活动期间单笔充值2680钻 | F29: 2006 | H29: 2 | I29: 1 | J29: 0 | K29: 19005|10010|19103 | L29: 1340|350|666
A30: 1024 | B30: =INT(RC[-1]/1000) -> 1 | C30: 0 | D30: 1 | E30: ="活动期间单笔充值"&VLOOKUP(RC[1],R2C16:R11C17,2,FALSE) -> 活动期间单笔充值60钻 | F30: 2001 | H30: 1 | I30: 1 | J30: 0 | K30: 10086 | L30: 2
A31: 1025 | B31: =INT(RC[-1]/1000) -> 1 | C31: 0 | D31: 1 | E31: ="活动期间单笔充值"&VLOOKUP(RC[1],R2C16:R11C17,2,FALSE) -> 活动期间单笔充值300钻 | F31: 2002 | H31: 1 | I31: 1 | J31: 0 | K31: 10086 | L31: 9
A32: 1026 | B32: =INT(RC[-1]/1000) -> 1 | C32: 0 | D32: 1 | E32: ="活动期间单笔充值"&VLOOKUP(RC[1],R2C16:R11C17,2,FALSE) -> 活动期间单笔充值680钻 | F32: 2003 | H32: 1 | I32: 1 | J32: 0 | K32: 10086 | L32: 18
A33: 1027 | B33: =INT(RC[-1]/1000) -> 1 | C33: 0 | D33: 1 | E33: ="活动期间单笔充值"&VLOOKUP(RC[1],R2C16:R11C17,2,FALSE) -> 活动期间单笔充值980钻 | F33: 2004 | H33: 1 | I33: 1 | J33: 0 | K33: 10086 | L33: 22
A34: 1028 | B34: =INT(RC[-1]/1000) -> 1 | C34: 0 | D34: 1 | E34: ="活动期间单笔充值"&VLOOKUP(RC[1],R2C16:R11C17,2,FALSE) -> 活动期间单笔充值1680钻 | F34: 2005 | H34: 1 | I34: 1 | J34: 0 | K34: 10086 | L34: 32
A35: 1029 | B35: =INT(RC[-1]/1000) -> 1 | C35: 0 | D35: 1 | E35: ="活动期间单笔充值"&VLOOKUP(RC[1],R2C16:R11C17,2,FALSE) -> 活动期间单笔充值2680钻 | F35: 2006 | H35: 1 | I35: 1 | J35: 0 | K35: 10086 | L35: 48
A36: 1030 | B36: =INT(RC[-1]/1000) -> 1 | C36: 0 | D36: 1 | E36: ="活动期间单笔充值"&VLOOKUP(RC[1],R2C16:R11C17,2,FALSE) -> 活动期间单笔充值4180钻 | F36: 2007 | H36: 1 | I36: 1 | J36: 0 | K36: 10086 | L36: 68
A37: 1031 | B37: =INT(RC[-1]/1000) -> 1 | C37: 0 | D37: 1 | E37: ="活动期间单笔充值"&VLOOKUP(RC[1],R2C16:R11C17,2,FALSE) -> 活动期间单笔充值6480钻 | F37: 2008 | H37: 1 | I37: 1 | J37: 0 | K37: 10086 | L37: 98
A38: 1032 | B38: 1 | C38: 0 | D38: 1 | E38: ="活动期间单笔充值"&VLOOKUP(RC[1],R2C16:R11C17,2,FALSE) -> 活动期间单笔充值300钻 | F38: 2002 | H38: 5 | I38: 1 | J38: 0 | K38: 19005|10001|19103 | L38: 150|10|68 | M38: 500 | O38: 累计充值x=累计充值目标（单位：元）
A39: 1033 | B39: 1 | C39: 0 | D39: 1 | E39: ="活动期间单笔充值"&VLOOKUP(RC[1],R2C16:R11C17,2,FALSE) -> 活动期间单笔充值680钻 | F39: 2003 | H39: 5 | I39: 1 | J39: 0 | K39: 19005|10000|19103 | L39: 340|20|128 | M39: 1000
A40: 1034 | B40: 1 | C40: 0 | D40: 1 | E40: ="活动期间单笔充值"&VLOOKUP(RC[1],R6C16:R15C17,2,FALSE) -> 活动期间单笔充值980钻 | F40: 2004 | H40: 5 | I40: 1 | J40: 0 | K40: 19005|19012|19103 | L40: 490|8888|188 | M40: 1500
A41: 1035 | B41: 1 | C41: 0 | D41: 1 | E41: ="活动期间单笔充值"&VLOOKUP(RC[1],R6C16:R15C17,2,FALSE) -> 活动期间单笔充值1680钻 | F41: 2005 | H41: 5 | I41: 1 | J41: 0 | K41: 19005|19012|19103 | L41: 840|12888|366 | M41: 2000
A42: 1036 | B42: 1 | C42: 0 | D42: 1 | E42: ="活动期间单笔充值"&VLOOKUP(RC[1],R6C16:R15C17,2,FALSE) -> 活动期间单笔充值2680钻 | F42: 2006 | H42: 5 | I42: 1 | J42: 0 | K42: 19005|19012|19103 | L42: 1340|16888|666 | M42: 2500
A43: 1037 | B43: 1 | C43: 0 | D43: 1 | E43: ="活动期间单笔充值"&VLOOKUP(RC[1],R2C16:R11C17,2,FALSE) -> 活动期间单笔充值300钻 | F43: 2002 | H43: 5 | I43: 1 | J43: 0 | K43: 19005|10000|19103 | L43: 150|10|68 | M43: 500
A44: 1038 | B44: 1 | C44: 0 | D44: 1 | E44: ="活动期间单笔充值"&VLOOKUP(RC[1],R2C16:R11C17,2,FALSE) -> 活动期间单笔充值680钻 | F44: 2003 | H44: 5 | I44: 1 | J44: 0 | K44: 19005|10001|19103 | L44: 340|20|128 | M44: 1000
A45: 1039 | B45: 1 | C45: 0 | D45: 1 | E45: ="活动期间单笔充值"&VLOOKUP(RC[1],R6C16:R15C17,2,FALSE) -> 活动期间单笔充值980钻 | F45: 2004 | H45: 5 | I45: 1 | J45: 0 | K45: 19005|13329|19103 | L45: 490|20|666 | M45: 1500
A46: 1040 | B46: 1 | C46: 0 | D46: 1 | E46: ="活动期间单笔充值"&VLOOKUP(RC[1],R6C16:R15C17,2,FALSE) -> 活动期间单笔充值1680钻 | F46: 2005 | H46: 5 | I46: 1 | J46: 0 | K46: 19005|13329|19103 | L46: 840|30|666 | M46: 2000
A47: 1041 | B47: 1 | C47: 0 | D47: 1 | E47: ="活动期间单笔充值"&VLOOKUP(RC[1],R6C16:R15C17,2,FALSE) -> 活动期间单笔充值2680钻 | F47: 2006 | H47: 5 | I47: 1 | J47: 0 | K47: 19005|13329|19103 | L47: 1340|40|666 | M47: 2500
A48: 2001 | B48: =INT(RC[-1]/1000) -> 2 | C48: 1 | D48: 1 | E48: ="活动期间累计充值"&RC[1]*1&"元（%s/"&RC[1]*1&"）" -> 活动期间累计充值6元（%s/6） | F48: 6 | H48: 1 | I48: 0 | J48: 0 | K48: 19005 | L48: 300 | M48: 500 | O48: 累计充值x=累计充值目标（单位：元）
A49: 2002 | B49: =INT(RC[-1]/1000) -> 2 | C49: 1 | D49: 1 | E49: ="活动期间累计充值"&RC[1]*1&"元（%s/"&RC[1]*1&"）" -> 活动期间累计充值25元（%s/25） | F49: 25 | H49: 1 | I49: 0 | J49: 0 | K49: 13329|10001|19103 | L49: 20|4|20 | M49: 1000
A50: 2003 | B50: =INT(RC[-1]/1000) -> 2 | C50: 1 | D50: 1 | E50: ="活动期间累计充值"&RC[1]*1&"元（%s/"&RC[1]*1&"）" -> 活动期间累计充值50元（%s/50） | F50: 50 | H50: 1 | I50: 0 | J50: 0 | K50: 13329|10000|19103 | L50: 20|4|30 | M50: 1500
A51: 2004 | B51: =INT(RC[-1]/1000) -> 2 | C51: 1 | D51: 1 | E51: ="活动期间累计充值"&RC[1]*1&"元（%s/"&RC[1]*1&"）" -> 活动期间累计充值100元（%s/100） | F51: 100 | H51: 1 | I51: 0 | J51: 0 | K51: 10014|19103 | L51: 50|50 | M51: 2000
A52: 2005 | B52: =INT(RC[-1]/1000) -> 2 | C52: 1 | D52: 1 | E52: ="活动期间累计充值"&RC[1]*1&"元（%s/"&RC[1]*1&"）" -> 活动期间累计充值200元（%s/200） | F52: 200 | H52: 1 | I52: 0 | J52: 0 | K52: 13316|10010|19103 | L52: 1|100|80 | M52: 2500
A53: 2006 | B53: =INT(RC[-1]/1000) -> 2 | C53: 1 | D53: 1 | E53: ="活动期间累计充值"&RC[1]*1&"元（%s/"&RC[1]*1&"）" -> 活动期间累计充值500元（%s/500） | F53: 500 | H53: 1 | I53: 0 | J53: 0 | K53: 13337|10014|19103 | L53: 1|50|100 | M53: 3000
A54: 2007 | B54: =INT(RC[-1]/1000) -> 2 | C54: 1 | D54: 1 | E54: ="活动期间累计充值"&RC[1]*1&"元（%s/"&RC[1]*1&"）" -> 活动期间累计充值1000元（%s/1000） | F54: 1000 | H54: 1 | I54: 0 | J54: 0 | K54: 13434|10022|13646 | L54: 1|50|10 | M54: 3500
A55: 2008 | B55: =INT(RC[-1]/1000) -> 2 | C55: 1 | D55: 1 | E55: ="活动期间累计充值"&RC[1]*1&"元（%s/"&RC[1]*1&"）" -> 活动期间累计充值2000元（%s/2000） | F55: 2000 | H55: 1 | I55: 0 | J55: 0 | K55: 13333|10022|13646|13324 | L55: 1|50|20|1 | M55: 4000
A56: 2009 | B56: =INT(RC[-1]/1000) -> 2 | C56: 1 | D56: 1 | E56: ="活动期间累计充值"&RC[1]*1&"元（%s/"&RC[1]*1&"）" -> 活动期间累计充值3000元（%s/3000） | F56: 3000 | H56: 1 | I56: 0 | J56: 0 | K56: 13434|13435|21305|22305 | L56: 1|1|1|1 | M56: 4500
A57: 2011 | B57: =INT(RC[-1]/1000) -> 2 | C57: 0 | D57: 1 | E57: ="充值"&RC[1]*10&"钻以上（每日一次）（%s/"&RC[1]*10&"）" -> 充值10钻以上（每日一次）（%s/10） | F57: 1 | H57: 1 | I57: 0 | J57: 1 | K57: 10089|10000|10001 | L57: 5|2|2
A58: 2012 | B58: =INT(RC[-1]/1000) -> 2 | C58: 1 | D58: 1 | E58: ="活动期间累计充值"&RC[1]*10&"钻（%s/"&RC[1]*10&"）" -> 活动期间累计充值250钻（%s/250） | F58: 25 | H58: 1 | I58: 0 | J58: 0 | K58: 10089|10001 | L58: 20|10
A59: 2013 | B59: =INT(RC[-1]/1000) -> 2 | C59: 1 | D59: 1 | E59: ="活动期间累计充值"&RC[1]*10&"钻（%s/"&RC[1]*10&"）" -> 活动期间累计充值500钻（%s/500） | F59: 50 | H59: 1 | I59: 0 | J59: 0 | K59: 10089|10000 | L59: 30|10
A60: 2014 | B60: =INT(RC[-1]/1000) -> 2 | C60: 1 | D60: 1 | E60: ="活动期间累计充值"&RC[1]*10&"钻（%s/"&RC[1]*10&"）" -> 活动期间累计充值1000钻（%s/1000） | F60: 100 | H60: 1 | I60: 0 | J60: 0 | K60: 10089 | L60: 60
A61: 2015 | B61: =INT(RC[-1]/1000) -> 2 | C61: 1 | D61: 1 | E61: ="活动期间累计充值"&RC[1]*10&"钻（%s/"&RC[1]*10&"）" -> 活动期间累计充值2000钻（%s/2000） | F61: 200 | H61: 1 | I61: 0 | J61: 0 | K61: 10089 | L61: 100
A62: 2016 | B62: =INT(RC[-1]/1000) -> 2 | C62: 1 | D62: 1 | E62: ="活动期间累计充值"&RC[1]*10&"钻（%s/"&RC[1]*10&"）" -> 活动期间累计充值3000钻（%s/3000） | F62: 300 | H62: 1 | I62: 0 | J62: 0 | K62: 10089 | L62: 120
A63: 2017 | B63: =INT(RC[-1]/1000) -> 2 | C63: 1 | D63: 1 | E63: ="活动期间累计充值"&RC[1]*10&"钻（%s/"&RC[1]*10&"）" -> 活动期间累计充值5000钻（%s/5000） | F63: 500 | H63: 1 | I63: 0 | J63: 0 | K63: 10089 | L63: 180
A64: 2018 | B64: =INT(RC[-1]/1000) -> 2 | C64: 1 | D64: 1 | E64: ="活动期间累计充值"&RC[1]*10&"钻（%s/"&RC[1]*10&"）" -> 活动期间累计充值7000钻（%s/7000） | F64: 700 | H64: 1 | I64: 0 | J64: 0 | K64: 10089 | L64: 200
A65: 2019 | B65: =INT(RC[-1]/1000) -> 2 | C65: 1 | D65: 1 | E65: ="活动期间累计充值"&RC[1]*10&"钻（%s/"&RC[1]*10&"）" -> 活动期间累计充值10000钻（%s/10000） | F65: 1000 | H65: 1 | I65: 0 | J65: 0 | K65: 10089 | L65: 280
A66: 2020 | B66: =INT(RC[-1]/1000) -> 2 | C66: 1 | D66: 1 | E66: ="活动期间累计充值"&RC[1]*10&"钻（%s/"&RC[1]*10&"）" -> 活动期间累计充值15000钻（%s/15000） | F66: 1500 | H66: 1 | I66: 0 | J66: 0 | K66: 10089 | L66: 360
A67: 2021 | B67: =INT(RC[-1]/1000) -> 2 | C67: 1 | D67: 1 | E67: ="活动期间累计充值"&RC[1]*10&"钻（%s/"&RC[1]*10&"）" -> 活动期间累计充值20000钻（%s/20000） | F67: 2000 | H67: 1 | I67: 0 | J67: 0 | K67: 10089 | L67: 380
A68: 2022 | B68: =INT(RC[-1]/1000) -> 2 | C68: 1 | D68: 1 | E68: ="活动期间累计充值"&RC[1]*10&"钻（%s/"&RC[1]*10&"）" -> 活动期间累计充值25000钻（%s/25000） | F68: 2500 | H68: 1 | I68: 0 | J68: 0 | K68: 10089 | L68: 400
A69: 2023 | B69: =INT(RC[-1]/1000) -> 2 | C69: 1 | D69: 1 | E69: ="活动期间累计充值"&RC[1]*10&"钻（%s/"&RC[1]*10&"）" -> 活动期间累计充值30000钻（%s/30000） | F69: 3000 | H69: 1 | I69: 0 | J69: 0 | K69: 10089 | L69: 420
A70: 2024 | B70: =INT(RC[-1]/1000) -> 2 | C70: 1 | D70: 1 | E70: ="活动期间累计充值"&RC[1]*10&"钻（%s/"&RC[1]*10&"）" -> 活动期间累计充值60钻（%s/60） | F70: 6 | H70: 1 | I70: 0 | J70: 0 | K70: 10000|10001 | L70: 5|5
A71: 2025 | B71: =INT(RC[-1]/1000) -> 2 | C71: 1 | D71: 1 | E71: ="活动期间累计充值"&RC[1]*10&"钻（%s/"&RC[1]*10&"）" -> 活动期间累计充值250钻（%s/250） | F71: 25 | H71: 1 | I71: 0 | J71: 0 | K71: 42301|10001 | L71: 2|10
A72: 2026 | B72: =INT(RC[-1]/1000) -> 2 | C72: 1 | D72: 1 | E72: ="活动期间累计充值"&RC[1]*10&"钻（%s/"&RC[1]*10&"）" -> 活动期间累计充值500钻（%s/500） | F72: 50 | H72: 1 | I72: 0 | J72: 0 | K72: 33400|10000 | L72: 8|10
A73: 2027 | B73: =INT(RC[-1]/1000) -> 2 | C73: 1 | D73: 1 | E73: ="活动期间累计充值"&RC[1]*10&"钻（%s/"&RC[1]*10&"）" -> 活动期间累计充值1000钻（%s/1000） | F73: 100 | H73: 1 | I73: 0 | J73: 0 | K73: 10022|13358 | L73: 30|100
A74: 2028 | B74: =INT(RC[-1]/1000) -> 2 | C74: 1 | D74: 1 | E74: ="活动期间累计充值"&RC[1]*10&"钻（%s/"&RC[1]*10&"）" -> 活动期间累计充值2000钻（%s/2000） | F74: 200 | H74: 1 | I74: 0 | J74: 0 | K74: 13316|10010 | L74: 1|400
A75: 2029 | B75: =INT(RC[-1]/1000) -> 2 | C75: 1 | D75: 1 | E75: ="活动期间累计充值"&RC[1]*10&"钻（%s/"&RC[1]*10&"）" -> 活动期间累计充值3660钻（%s/3660） | F75: 366 | H75: 1 | I75: 0 | J75: 0 | K75: 10008|13361|13360 | L75: 600|10|50
A76: 2030 | B76: =INT(RC[-1]/1000) -> 2 | C76: 1 | D76: 1 | E76: ="活动期间累计充值"&RC[1]*10&"钻（%s/"&RC[1]*10&"）" -> 活动期间累计充值6660钻（%s/6660） | F76: 666 | H76: 1 | I76: 0 | J76: 0 | K76: 10008|13362|13361 | L76: 800|10|20
A77: 2031 | B77: =INT(RC[-1]/1000) -> 2 | C77: 1 | D77: 1 | E77: ="活动期间累计充值"&RC[1]*10&"钻（%s/"&RC[1]*10&"）" -> 活动期间累计充值10880钻（%s/10880） | F77: 1088 | H77: 1 | I77: 0 | J77: 0 | K77: 10008|13362|13361 | L77: 1088|10|25
A78: 2032 | B78: =INT(RC[-1]/1000) -> 2 | C78: 1 | D78: 1 | E78: ="活动期间累计充值"&RC[1]*10&"钻（%s/"&RC[1]*10&"）" -> 活动期间累计充值18880钻（%s/18880） | F78: 1888 | H78: 1 | I78: 0 | J78: 0 | K78: 10008|13362|13361 | L78: 1688|15|30
A79: 2033 | B79: =INT(RC[-1]/1000) -> 2 | C79: 1 | D79: 1 | E79: ="活动期间累计充值"&RC[1]*10&"钻（%s/"&RC[1]*10&"）" -> 活动期间累计充值60钻（%s/60） | F79: 6 | H79: 1 | I79: 0 | J79: 0 | K79: 10000|10001 | L79: 5|5
A80: 2034 | B80: =INT(RC[-1]/1000) -> 2 | C80: 1 | D80: 1 | E80: ="活动期间累计充值"&RC[1]*10&"钻（%s/"&RC[1]*10&"）" -> 活动期间累计充值250钻（%s/250） | F80: 25 | H80: 1 | I80: 0 | J80: 0 | K80: 10101|10001 | L80: 2|10
A81: 2035 | B81: =INT(RC[-1]/1000) -> 2 | C81: 1 | D81: 1 | E81: ="活动期间累计充值"&RC[1]*10&"钻（%s/"&RC[1]*10&"）" -> 活动期间累计充值500钻（%s/500） | F81: 50 | H81: 1 | I81: 0 | J81: 0 | K81: 10100|10000 | L81: 1|10
A82: 2036 | B82: =INT(RC[-1]/1000) -> 2 | C82: 1 | D82: 1 | E82: ="活动期间累计充值"&RC[1]*10&"钻（%s/"&RC[1]*10&"）" -> 活动期间累计充值1000钻（%s/1000） | F82: 100 | H82: 1 | I82: 0 | J82: 0 | K82: 80001|10014 | L82: 1|60
A83: 2037 | B83: =INT(RC[-1]/1000) -> 2 | C83: 1 | D83: 1 | E83: ="活动期间累计充值"&RC[1]*10&"钻（%s/"&RC[1]*10&"）" -> 活动期间累计充值2000钻（%s/2000） | F83: 200 | H83: 1 | I83: 0 | J83: 0 | K83: 80011|10010 | L83: 2|500
A84: 2038 | B84: =INT(RC[-1]/1000) -> 2 | C84: 1 | D84: 1 | E84: ="活动期间累计充值"&RC[1]*10&"钻（%s/"&RC[1]*10&"）" -> 活动期间累计充值3000钻（%s/3000） | F84: 300 | H84: 1 | I84: 0 | J84: 0 | K84: 19030|10014 | L84: 3688|128
A85: 2039 | B85: =INT(RC[-1]/1000) -> 2 | C85: 1 | D85: 1 | E85: ="活动期间累计充值"&RC[1]*10&"钻（%s/"&RC[1]*10&"）" -> 活动期间累计充值6000钻（%s/6000） | F85: 600 | H85: 1 | I85: 0 | J85: 0 | K85: 19030|10008 | L85: 4888|2000
A86: 2040 | B86: =INT(RC[-1]/1000) -> 2 | C86: 1 | D86: 1 | E86: ="活动期间累计充值"&RC[1]*10&"钻（%s/"&RC[1]*10&"）" -> 活动期间累计充值10000钻（%s/10000） | F86: 1000 | H86: 1 | I86: 0 | J86: 0 | K86: 80100|19017 | L86: 1|1888
A87: 3001 | B87: =INT(RC[-1]/1000) -> 3 | C87: 0 | D87: 0 | F87: 250 | H87: 2 | I87: 1 | J87: 0 | K87: 10000 | L87: 10 | O87: 打折兑换x=所需
A88: 3002 | B88: =INT(RC[-1]/1000) -> 3 | C88: 0 | D88: 0 | F88: 250 | H88: 2 | I88: 1 | J88: 0 | K88: 10001 | L88: 10
A89: 3003 | B89: =INT(RC[-1]/1000) -> 3 | C89: 0 | D89: 0 | F89: 2250 | H89: 5 | I89: 1 | J89: 0 | K89: 10034 | L89: 1 | N89: 9
A90: 3004 | B90: =INT(RC[-1]/1000) -> 3 | C90: 0 | D90: 0 | F90: 2250 | H90: 5 | I90: 1 | J90: 0 | K90: 10035 | L90: 1 | N90: 9
A91: 3005 | B91: =INT(RC[-1]/1000) -> 3 | C91: 0 | D91: 0 | F91: 400 | H91: 20 | I91: 1 | J91: 0 | K91: 10022 | L91: 10 | N91: 8
A92: 3006 | B92: =INT(RC[-1]/1000) -> 3 | C92: 0 | D92: 0 | F92: 350 | H92: 10 | I92: 1 | J92: 0 | K92: 19103 | L92: 50 | N92: 7
A93: 3007 | B93: =INT(RC[-1]/1000) -> 3 | C93: 0 | D93: 0 | F93: 80 | H93: 10 | I93: 1 | J93: 0 | K93: 10021 | L93: 5 | N93: 8
A94: 3008 | B94: =INT(RC[-1]/1000) -> 3 | C94: 0 | D94: 0 | F94: 100 | H94: 20 | I94: 1 | J94: 0 | K94: 33400 | L94: 1 | N94: 5
A95: 3009 | B95: =INT(RC[-1]/1000) -> 3 | C95: 0 | D95: 0 | F95: 225 | H95: 20 | I95: 1 | J95: 0 | K95: 42301 | L95: 1 | N95: 6
A96: 3010 | B96: =INT(RC[-1]/1000) -> 3 | C96: 0 | D96: 0 | F96: 180 | H96: 10 | I96: 1 | J96: 0 | K96: 19006 | L96: 200 | N96: 9
A97: 3011 | B97: =INT(RC[-1]/1000) -> 3 | C97: 0 | D97: 0 | F97: 160 | H97: 50 | I97: 1 | J97: 0 | K97: 10014 | L97: 10 | N97: 8
A98: 3012 | B98: =INT(RC[-1]/1000) -> 3 | C98: 0 | D98: 0 | F98: 210 | H98: 100 | I98: 1 | J98: 0 | K98: 10004 | L98: 20 | N98: 7
A99: 3013 | B99: =INT(RC[-1]/1000) -> 3 | C99: 0 | D99: 0 | F99: 160 | H99: 50 | I99: 1 | J99: 0 | K99: 10010 | L99: 40 | N99: 8
A100: 3014 | B100: =INT(RC[-1]/1000) -> 3 | C100: 0 | D100: 0 | F100: 40 | H100: 100 | I100: 1 | J100: 0 | K100: 10002 | L100: 50 | N100: 8
A101: 3015 | B101: =INT(RC[-1]/1000) -> 3 | C101: 0 | D101: 0 | F101: 800 | H101: 50 | I101: 1 | J101: 0 | K101: 19103 | L101: 100 | N101: 8
A102: 3021 | B102: =INT(RC[-1]/1000) -> 3 | C102: 0 | D102: 0 | F102: 250 | H102: 2 | I102: 1 | J102: 0 | K102: 10000 | L102: 10
A103: 3022 | B103: =INT(RC[-1]/1000) -> 3 | C103: 0 | D103: 0 | F103: 250 | H103: 2 | I103: 1 | J103: 0 | K103: 10001 | L103: 10
A104: 3023 | B104: =INT(RC[-1]/1000) -> 3 | C104: 0 | D104: 0 | F104: 225 | H104: 20 | I104: 1 | J104: 0 | K104: 42301 | L104: 1 | N104: 6
A105: 3024 | B105: =INT(RC[-1]/1000) -> 3 | C105: 0 | D105: 0 | F105: 160 | H105: 50 | I105: 1 | J105: 0 | K105: 10014 | L105: 10 | N105: 8
A106: 3025 | B106: =INT(RC[-1]/1000) -> 3 | C106: 0 | D106: 0 | F106: 160 | H106: 50 | I106: 1 | J106: 0 | K106: 10010 | L106: 40 | N106: 8
A107: 3026 | B107: =INT(RC[-1]/1000) -> 3 | C107: 0 | D107: 0 | F107: 350 | H107: 10 | I107: 1 | J107: 0 | K107: 19103 | L107: 50 | N107: 7
A108: 3027 | B108: =INT(RC[-1]/1000) -> 3 | C108: 0 | D108: 0 | F108: 800 | H108: 50 | I108: 1 | J108: 0 | K108: 19103 | L108: 100 | N108: 8
A109: 3031 | B109: =INT(RC[-1]/1000) -> 3 | C109: 0 | D109: 0 | F109: 250 | H109: 2 | I109: 1 | J109: 0 | K109: 10000 | L109: 10
A110: 3032 | B110: =INT(RC[-1]/1000) -> 3 | C110: 0 | D110: 0 | F110: 250 | H110: 2 | I110: 1 | J110: 0 | K110: 10001 | L110: 10
A111: 3033 | B111: =INT(RC[-1]/1000) -> 3 | C111: 0 | D111: 0 | F111: 100 | H111: 10 | I111: 1 | J111: 0 | K111: 13008 | L111: 1 | N111: 5
A112: 3034 | B112: =INT(RC[-1]/1000) -> 3 | C112: 0 | D112: 0 | F112: 228 | H112: 3 | I112: 1 | J112: 0 | K112: 13318 | L112: 1 | N112: 6
A113: 3035 | B113: =INT(RC[-1]/1000) -> 3 | C113: 0 | D113: 0 | F113: 228 | H113: 3 | I113: 1 | J113: 0 | K113: 13319 | L113: 1 | N113: 6
A114: 3036 | B114: =INT(RC[-1]/1000) -> 3 | C114: 0 | D114: 0 | F114: 160 | H114: 50 | I114: 1 | J114: 0 | K114: 10010 | L114: 40 | N114: 8
A115: 3037 | B115: =INT(RC[-1]/1000) -> 3 | C115: 0 | D115: 0 | F115: 160 | H115: 50 | I115: 1 | J115: 0 | K115: 10014 | L115: 10 | N115: 8
A116: 3038 | B116: =INT(RC[-1]/1000) -> 3 | C116: 0 | D116: 0 | F116: 200 | H116: 20 | I116: 1 | J116: 0 | K116: 10008 | L116: 100 | N116: 8
A117: 3039 | B117: =INT(RC[-1]/1000) -> 3 | C117: 0 | D117: 0 | F117: 40 | H117: 100 | I117: 1 | J117: 0 | K117: 10002 | L117: 50 | N117: 8
A118: 3040 | B118: =INT(RC[-1]/1000) -> 3 | C118: 0 | D118: 0 | F118: 80 | H118: 10 | I118: 1 | J118: 0 | K118: 10021 | L118: 5 | N118: 8
A119: 3041 | B119: =INT(RC[-1]/1000) -> 3 | C119: 0 | D119: 0 | F119: 400 | H119: 20 | I119: 1 | J119: 0 | K119: 10022 | L119: 10 | N119: 8
A120: 3042 | B120: =INT(RC[-1]/1000) -> 3 | C120: 0 | D120: 0 | F120: 300 | H120: 10 | I120: 1 | J120: 0 | K120: 19103 | L120: 50 | N120: 6
A121: 3043 | B121: =INT(RC[-1]/1000) -> 3 | C121: 0 | D121: 0 | F121: 100 | H121: 20 | I121: 1 | J121: 0 | K121: 33400 | L121: 1 | N121: 5
A122: 3044 | B122: =INT(RC[-1]/1000) -> 3 | C122: 0 | D122: 0 | F122: 225 | H122: 20 | I122: 1 | J122: 0 | K122: 42301 | L122: 1 | N122: 6
A123: 3045 | B123: =INT(RC[-1]/1000) -> 3 | C123: 0 | D123: 0 | F123: 450 | H123: 20 | I123: 1 | J123: 0 | K123: 19006 | L123: 500 | N123: 9
A124: 3046 | B124: =INT(RC[-1]/1000) -> 3 | C124: 0 | D124: 0 | F124: 210 | H124: 100 | I124: 1 | J124: 0 | K124: 10004 | L124: 20 | N124: 7
A125: 3047 | B125: =INT(RC[-1]/1000) -> 3 | C125: 0 | D125: 0 | F125: 240 | H125: 20 | I125: 1 | J125: 0 | K125: 19017 | L125: 300 | N125: 8
A126: 3051 | B126: =INT(RC[-1]/1000) -> 3 | C126: 0 | D126: 0 | F126: 240 | H126: 20 | I126: 1 | J126: 0 | K126: 10019 | L126: 1 | N126: 8
A127: 3052 | B127: =INT(RC[-1]/1000) -> 3 | C127: 0 | D127: 0 | F127: 40 | H127: 10 | I127: 1 | J127: 0 | K127: 10002 | L127: 50 | N127: 8
A128: 3053 | B128: =INT(RC[-1]/1000) -> 3 | C128: 0 | D128: 0 | F128: 72 | H128: 10 | I128: 1 | J128: 0 | K128: 10003 | L128: 30 | N128: 8
A129: 3054 | B129: =INT(RC[-1]/1000) -> 3 | C129: 0 | D129: 0 | F129: 60 | H129: 10 | I129: 1 | J129: 0 | K129: 19103 | L129: 10 | N129: 6
A130: 3055 | B130: =INT(RC[-1]/1000) -> 3 | C130: 0 | D130: 0 | F130: 250 | H130: 2 | I130: 1 | J130: 0 | K130: 10000 | L130: 10
A131: 3056 | B131: =INT(RC[-1]/1000) -> 3 | C131: 0 | D131: 0 | F131: 250 | H131: 2 | I131: 1 | J131: 0 | K131: 10001 | L131: 10
A132: 3057 | B132: =INT(RC[-1]/1000) -> 3 | C132: 0 | D132: 0 | F132: 160 | H132: 50 | I132: 1 | J132: 0 | K132: 10010 | L132: 40 | N132: 8
A133: 3058 | B133: =INT(RC[-1]/1000) -> 3 | C133: 0 | D133: 0 | F133: 160 | H133: 50 | I133: 1 | J133: 0 | K133: 10014 | L133: 10 | N133: 8
A134: 3059 | B134: =INT(RC[-1]/1000) -> 3 | C134: 0 | D134: 0 | F134: 200 | H134: 20 | I134: 1 | J134: 0 | K134: 10008 | L134: 100 | N134: 8
A135: 3060 | B135: =INT(RC[-1]/1000) -> 3 | C135: 0 | D135: 0 | F135: 40 | H135: 100 | I135: 1 | J135: 0 | K135: 10002 | L135: 50 | N135: 8
A136: 3061 | B136: =INT(RC[-1]/1000) -> 3 | C136: 0 | D136: 0 | F136: 80 | H136: 10 | I136: 1 | J136: 0 | K136: 10021 | L136: 5 | N136: 8
A137: 3062 | B137: =INT(RC[-1]/1000) -> 3 | C137: 0 | D137: 0 | F137: 400 | H137: 20 | I137: 1 | J137: 0 | K137: 10022 | L137: 10 | N137: 8
A138: 3063 | B138: =INT(RC[-1]/1000) -> 3 | C138: 0 | D138: 0 | F138: 300 | H138: 10 | I138: 1 | J138: 0 | K138: 19103 | L138: 50 | N138: 6
A139: 3064 | B139: =INT(RC[-1]/1000) -> 3 | C139: 0 | D139: 0 | F139: 100 | H139: 20 | I139: 1 | J139: 0 | K139: 33400 | L139: 1 | N139: 5
A140: 3065 | B140: =INT(RC[-1]/1000) -> 3 | C140: 0 | D140: 0 | F140: 225 | H140: 20 | I140: 1 | J140: 0 | K140: 42301 | L140: 1 | N140: 6
A141: 3066 | B141: =INT(RC[-1]/1000) -> 3 | C141: 0 | D141: 0 | F141: 450 | H141: 20 | I141: 1 | J141: 0 | K141: 19006 | L141: 500 | N141: 9
A142: 3067 | B142: =INT(RC[-1]/1000) -> 3 | C142: 0 | D142: 0 | F142: 210 | H142: 100 | I142: 1 | J142: 0 | K142: 10004 | L142: 20 | N142: 7
A143: 3068 | B143: =INT(RC[-1]/1000) -> 3 | C143: 0 | D143: 0 | F143: 240 | H143: 20 | I143: 1 | J143: 0 | K143: 19017 | L143: 300 | N143: 8
A144: 4001 | B144: =INT(RC[-1]/1000) -> 4 | C144: 0 | D144: 0 | F144: 10028 | G144: 5 | H144: 2 | I144: 1 | J144: 0 | K144: 10000 | L144: 2 | O144: 代币兑换x=物品ID
A145: 4002 | B145: =INT(RC[-1]/1000) -> 4 | C145: 0 | D145: 0 | F145: 10028 | G145: 5 | H145: 2 | I145: 1 | J145: 0 | K145: 10001 | L145: 2 | O145: 代币兑换y=所需数量
A146: 4003 | B146: =INT(RC[-1]/1000) -> 4 | C146: 0 | D146: 0 | F146: 10028 | G146: 10 | H146: 40 | I146: 1 | J146: 0 | K146: 19103 | L146: 10
A147: 4004 | B147: =INT(RC[-1]/1000) -> 4 | C147: 0 | D147: 0 | F147: 10028 | G147: 10 | H147: 30 | I147: 1 | J147: 0 | K147: 33300 | L147: 1
A148: 4005 | B148: 4 | C148: 0 | D148: 0 | F148: 10028 | G148: 30 | H148: 20 | I148: 1 | J148: 0 | K148: 42301 | L148: 1
A149: 4006 | B149: =INT(RC[-1]/1000) -> 4 | C149: 0 | D149: 0 | F149: 10028 | G149: 10 | H149: 30 | I149: 1 | J149: 0 | K149: 19006 | L149: 100
A150: 4007 | B150: =INT(RC[-1]/1000) -> 4 | C150: 0 | D150: 0 | F150: 10028 | G150: 10 | H150: 30 | I150: 1 | J150: 0 | K150: 19012 | L150: 1000
A151: 4008 | B151: =INT(RC[-1]/1000) -> 4 | C151: 0 | D151: 0 | F151: 10028 | G151: 4 | H151: 75 | I151: 1 | J151: 0 | K151: 13646 | L151: 1
A152: 4009 | B152: =INT(RC[-1]/1000) -> 4 | C152: 0 | D152: 0 | F152: 10029 | G152: 20 | H152: 5 | I152: 1 | J152: 0 | K152: 10034 | L152: 1
A153: 4010 | B153: =INT(RC[-1]/1000) -> 4 | C153: 0 | D153: 0 | F153: 10029 | G153: 20 | H153: 5 | I153: 1 | J153: 0 | K153: 10035 | L153: 1
A154: 4011 | B154: =INT(RC[-1]/1000) -> 4 | C154: 0 | D154: 0 | F154: 10029 | G154: 3 | H154: 8 | I154: 1 | J154: 0 | K154: 11301 | L154: 5
A155: 4012 | B155: =INT(RC[-1]/1000) -> 4 | C155: 0 | D155: 0 | F155: 10029 | G155: 3 | H155: 8 | I155: 1 | J155: 0 | K155: 11302 | L155: 5
A156: 4013 | B156: =INT(RC[-1]/1000) -> 4 | C156: 0 | D156: 0 | F156: 10029 | G156: 3 | H156: 8 | I156: 1 | J156: 0 | K156: 11303 | L156: 5
A157: 4014 | B157: =INT(RC[-1]/1000) -> 4 | C157: 0 | D157: 0 | F157: 10029 | G157: 3 | H157: 8 | I157: 1 | J157: 0 | K157: 11304 | L157: 5
A158: 4015 | B158: =INT(RC[-1]/1000) -> 4 | C158: 0 | D158: 0 | F158: 10029 | G158: 5 | H158: 8 | I158: 1 | J158: 0 | K158: 11305 | L158: 5
A159: 4016 | B159: =INT(RC[-1]/1000) -> 4 | C159: 0 | D159: 0 | F159: 10029 | G159: 5 | H159: 8 | I159: 1 | J159: 0 | K159: 11306 | L159: 5
A160: 4017 | B160: =INT(RC[-1]/1000) -> 4 | C160: 0 | D160: 0 | F160: 10029 | G160: 5 | H160: 8 | I160: 1 | J160: 0 | K160: 11307 | L160: 5
A161: 4018 | B161: =INT(RC[-1]/1000) -> 4 | C161: 0 | D161: 0 | F161: 10029 | G161: 5 | H161: 8 | I161: 1 | J161: 0 | K161: 11308 | L161: 5
A162: 4019 | B162: =INT(RC[-1]/1000) -> 4 | C162: 0 | D162: 0 | F162: 10029 | G162: 2 | H162: 30 | I162: 1 | J162: 0 | K162: 10014 | L162: 10
A163: 4020 | B163: =INT(RC[-1]/1000) -> 4 | C163: 0 | D163: 0 | F163: 10029 | G163: 1 | H163: 50 | I163: 1 | J163: 0 | K163: 10010 | L163: 20
A164: 4021 | B164: =INT(RC[-1]/1000) -> 4 | C164: 0 | D164: 0 | F164: 10029 | G164: 3 | H164: 100 | I164: 1 | J164: 0 | K164: 10004 | L164: 20
A165: 4022 | B165: =INT(RC[-1]/1000) -> 4 | C165: 0 | D165: 0 | F165: 10029 | G165: 1 | H165: 100 | I165: 1 | J165: 0 | K165: 10028 | L165: 10
A166: 4023 | B166: =INT(RC[-1]/1000) -> 4 | C166: 0 | D166: 0 | F166: 10086 | G166: 22 | H166: 5 | I166: 1 | J166: 0 | K166: 10034 | L166: 1 | O166: 代币兑换x=物品ID
A167: 4024 | B167: =INT(RC[-1]/1000) -> 4 | C167: 0 | D167: 0 | F167: 10086 | G167: 22 | H167: 5 | I167: 1 | J167: 0 | K167: 10035 | L167: 1 | O167: 代币兑换y=所需数量
A168: 4025 | B168: =INT(RC[-1]/1000) -> 4 | C168: 0 | D168: 0 | F168: 10086 | G168: 22 | H168: 5 | I168: 1 | J168: 0 | K168: 10036 | L168: 1
A169: 4026 | B169: =INT(RC[-1]/1000) -> 4 | C169: 0 | D169: 0 | F169: 10086 | G169: 30 | H169: 5 | I169: 1 | J169: 0 | K169: 13434 | L169: 1
A170: 4027 | B170: 4 | C170: 0 | D170: 0 | F170: 10086 | G170: 75 | H170: 1 | I170: 1 | J170: 0 | K170: 13334 | L170: 1
A171: 4028 | B171: =INT(RC[-1]/1000) -> 4 | C171: 0 | D171: 0 | F171: 10086 | G171: 22 | H171: 4 | I171: 1 | J171: 0 | K171: 13337 | L171: 1
A172: 4029 | B172: =INT(RC[-1]/1000) -> 4 | C172: 0 | D172: 0 | F172: 10086 | G172: 5 | H172: 10 | I172: 1 | J172: 0 | K172: 13316 | L172: 1
A173: 4030 | B173: =INT(RC[-1]/1000) -> 4 | C173: 0 | D173: 0 | F173: 10086 | G173: 13 | H173: 10 | I173: 1 | J173: 0 | K173: 13364 | L173: 1
A174: 4031 | B174: =INT(RC[-1]/1000) -> 4 | C174: 0 | D174: 0 | F174: 10086 | G174: 5 | H174: 20 | I174: 1 | J174: 0 | K174: 13363 | L174: 1
A175: 4032 | B175: =INT(RC[-1]/1000) -> 4 | C175: 0 | D175: 0 | F175: 10086 | G175: 1 | H175: 50 | I175: 1 | J175: 0 | K175: 13362 | L175: 1
A176: 4033 | B176: =INT(RC[-1]/1000) -> 4 | C176: 0 | D176: 0 | F176: 10086 | G176: 1 | H176: 99 | I176: 1 | J176: 0 | K176: 10085 | L176: 20
A177: 4034 | B177: =INT(RC[-1]/1000) -> 4 | C177: 0 | D177: 0 | F177: 10085 | G177: 500 | H177: 5 | I177: 1 | J177: 0 | K177: 10034 | L177: 1
A178: 4035 | B178: =INT(RC[-1]/1000) -> 4 | C178: 0 | D178: 0 | F178: 10085 | G178: 500 | H178: 5 | I178: 1 | J178: 0 | K178: 10035 | L178: 1
A179: 4036 | B179: =INT(RC[-1]/1000) -> 4 | C179: 0 | D179: 0 | F179: 10085 | G179: 500 | H179: 5 | I179: 1 | J179: 0 | K179: 10036 | L179: 1
A180: 4037 | B180: =INT(RC[-1]/1000) -> 4 | C180: 0 | D180: 0 | F180: 10085 | G180: 20 | H180: 60 | I180: 1 | J180: 0 | K180: 13314 | L180: 1
A181: 4038 | B181: =INT(RC[-1]/1000) -> 4 | C181: 0 | D181: 0 | F181: 10085 | G181: 7 | H181: 160 | I181: 1 | J181: 0 | K181: 13310 | L181: 1
A182: 4039 | B182: =INT(RC[-1]/1000) -> 4 | C182: 0 | D182: 0 | F182: 10085 | G182: 76 | H182: 10 | I182: 1 | J182: 0 | K182: 13318 | L182: 1
A183: 4040 | B183: =INT(RC[-1]/1000) -> 4 | C183: 0 | D183: 0 | F183: 10085 | G183: 76 | H183: 10 | I183: 1 | J183: 0 | K183: 13319 | L183: 1
A184: 4041 | B184: =INT(RC[-1]/1000) -> 4 | C184: 0 | D184: 0 | F184: 10085 | G184: 4 | H184: 100 | I184: 1 | J184: 0 | K184: 13361 | L184: 1
A185: 4042 | B185: =INT(RC[-1]/1000) -> 4 | C185: 0 | D185: 0 | F185: 10085 | G185: 1 | H185: 200 | I185: 1 | J185: 0 | K185: 13360 | L185: 1
A186: 4043 | B186: =INT(RC[-1]/1000) -> 4 | C186: 0 | D186: 0 | F186: 10085 | G186: 9 | H186: 200 | I186: 1 | J186: 0 | K186: 10022 | L186: 1
A187: 4044 | B187: =INT(RC[-1]/1000) -> 4 | C187: 0 | D187: 0 | F187: 10085 | G187: 5 | H187: 200 | I187: 1 | J187: 0 | K187: 10008 | L187: 10
A188: 4045 | B188: =INT(RC[-1]/1000) -> 4 | C188: 0 | D188: 0 | F188: 10085 | G188: 45 | H188: 100 | I188: 1 | J188: 0 | K188: 42301 | L188: 1
A189: 4046 | B189: =INT(RC[-1]/1000) -> 4 | C189: 0 | D189: 0 | F189: 10085 | G189: 25 | H189: 200 | I189: 1 | J189: 0 | K189: 10004 | L189: 10
A190: 4047 | B190: =INT(RC[-1]/1000) -> 4 | C190: 0 | D190: 0 | F190: 10085 | G190: 18 | H190: 100 | I190: 1 | J190: 0 | K190: 10014 | L190: 5
A191: 4048 | B191: =INT(RC[-1]/1000) -> 4 | C191: 0 | D191: 0 | F191: 10085 | G191: 9 | H191: 200 | I191: 1 | J191: 0 | K191: 10010 | L191: 10
A192: 4049 | B192: =INT(RC[-1]/1000) -> 4 | C192: 0 | D192: 0 | F192: 10085 | G192: 16 | H192: 100 | I192: 1 | J192: 0 | K192: 33300 | L192: 1
A193: 4050 | B193: =INT(RC[-1]/1000) -> 4 | C193: 0 | D193: 0 | F193: 10085 | G193: 15 | H193: 200 | I193: 1 | J193: 0 | K193: 19103 | L193: 10
A194: 5001 | B194: =INT(RC[-1]/1000) -> 5 | C194: 0 | D194: 1 | E194: =MID(RC[1],5,2)*1&"月"&MID(RC[1],7,2)*1&"日登陆即可领取" -> 2月22日登陆即可领取 | F194: 20180222 | H194: 1 | I194: 0 | J194: 0 | K194: 19005|10022 | L194: 50|5 | O194: 登陆x=年月日
A195: 5002 | B195: =INT(RC[-1]/1000) -> 5 | C195: 0 | D195: 1 | E195: =MID(RC[1],5,2)*1&"月"&MID(RC[1],7,2)*1&"日登陆即可领取" -> 2月23日登陆即可领取 | F195: 20180223 | H195: 1 | I195: 0 | J195: 0 | K195: 19005|10022 | L195: 100|10
A196: 5003 | B196: =INT(RC[-1]/1000) -> 5 | C196: 0 | D196: 1 | E196: =MID(RC[1],5,2)*1&"月"&MID(RC[1],7,2)*1&"日登陆即可领取" -> 2月24日登陆即可领取 | F196: 20180224 | H196: 1 | I196: 0 | J196: 0 | K196: 19005|10022 | L196: 150|15
A197: 5004 | B197: =INT(RC[-1]/1000) -> 5 | C197: 0 | D197: 1 | E197: =MID(RC[1],5,2)*1&"月"&MID(RC[1],7,2)*1&"日登陆即可领取" -> 2月25日登陆即可领取 | F197: 20180225 | H197: 1 | I197: 0 | J197: 0 | K197: 19005|10022 | L197: 200|20
A198: 5005 | B198: =INT(RC[-1]/1000) -> 5 | C198: 0 | D198: 1 | E198: =MID(RC[1],5,2)*1&"月"&MID(RC[1],7,2)*1&"日登陆即可领取" -> 2月26日登陆即可领取 | F198: 20180226 | H198: 1 | I198: 0 | J198: 0 | K198: 19005|10022 | L198: 250|25
A199: 5006 | B199: =INT(RC[-1]/1000) -> 5 | C199: 0 | D199: 1 | E199: =MID(RC[1],5,2)*1&"月"&MID(RC[1],7,2)*1&"日情人节登陆奖励" -> 2月14日情人节登陆奖励 | F199: 20180214 | H199: 1 | I199: 0 | J199: 0 | K199: 19005|19003 | L199: 520|1314
A200: 5007 | B200: =INT(RC[-1]/1000) -> 5 | C200: 0 | D200: 1 | E200: =MID(RC[1],5,2)*1&"月"&MID(RC[1],7,2)*1&"日登陆即可领取" -> 2月15日登陆即可领取 | F200: 20180215 | H200: 1 | I200: 0 | J200: 0 | K200: 13058|10089|10088 | L200: 1|5|10
A201: 5008 | B201: =INT(RC[-1]/1000) -> 5 | C201: 0 | D201: 1 | E201: =MID(RC[1],5,2)*1&"月"&MID(RC[1],7,2)*1&"日登陆即可领取" -> 2月16日登陆即可领取 | F201: 20180216 | H201: 1 | I201: 0 | J201: 0 | K201: 13058|10089|10088 | L201: 1|5|10
A202: 5009 | B202: =INT(RC[-1]/1000) -> 5 | C202: 0 | D202: 1 | E202: =MID(RC[1],5,2)*1&"月"&MID(RC[1],7,2)*1&"日登陆即可领取" -> 2月17日登陆即可领取 | F202: 20180217 | H202: 1 | I202: 0 | J202: 0 | K202: 13058|10089|10088 | L202: 2|5|10
A203: 5010 | B203: =INT(RC[-1]/1000) -> 5 | C203: 0 | D203: 1 | E203: =MID(RC[1],5,2)*1&"月"&MID(RC[1],7,2)*1&"日登陆即可领取" -> 2月18日登陆即可领取 | F203: 20180218 | H203: 1 | I203: 0 | J203: 0 | K203: 13058|10089|10088 | L203: 2|5|10
A204: 5011 | B204: =INT(RC[-1]/1000) -> 5 | C204: 0 | D204: 1 | E204: =MID(RC[1],5,2)*1&"月"&MID(RC[1],7,2)*1&"日登陆即可领取" -> 2月19日登陆即可领取 | F204: 20180219 | H204: 1 | I204: 0 | J204: 0 | K204: 13058|10089|10088 | L204: 3|5|10
A205: 5012 | B205: =INT(RC[-1]/1000) -> 5 | C205: 0 | D205: 1 | E205: =MID(RC[1],5,2)*1&"月"&MID(RC[1],7,2)*1&"日登陆即可领取" -> 2月20日登陆即可领取 | F205: 20180220 | H205: 1 | I205: 0 | J205: 0 | K205: 13058|10089|10088 | L205: 3|5|10
A206: 5013 | B206: =INT(RC[-1]/1000) -> 5 | C206: 0 | D206: 1 | E206: =MID(RC[1],5,2)*1&"月"&MID(RC[1],7,2)*1&"日登陆即可领取" -> 2月21日登陆即可领取 | F206: 20180221 | H206: 1 | I206: 0 | J206: 0 | K206: 13058|10089|10088 | L206: 4|5|10
A207: 5014 | B207: =INT(RC[-1]/1000) -> 5 | C207: 0 | D207: 1 | E207: =MID(RC[1],5,2)*1&"月"&MID(RC[1],7,2)*1&"日登陆即可领取" -> 3月2日登陆即可领取 | F207: 20180302 | H207: 1 | I207: 0 | J207: 0 | K207: 10085|19103 | L207: 20|10
A208: 5015 | B208: =INT(RC[-1]/1000) -> 5 | C208: 0 | D208: 1 | E208: =MID(RC[1],5,2)*1&"月"&MID(RC[1],7,2)*1&"日登陆即可领取" -> 3月3日登陆即可领取 | F208: 20180303 | H208: 1 | I208: 0 | J208: 0 | K208: 10085|10003 | L208: 25|60
A209: 5016 | B209: =INT(RC[-1]/1000) -> 5 | C209: 0 | D209: 1 | E209: =MID(RC[1],5,2)*1&"月"&MID(RC[1],7,2)*1&"日登陆即可领取" -> 3月4日登陆即可领取 | F209: 20180304 | H209: 1 | I209: 0 | J209: 0 | K209: 10085|10013 | L209: 30|25
A210: 5017 | B210: =INT(RC[-1]/1000) -> 5 | C210: 0 | D210: 1 | E210: =MID(RC[1],5,2)*1&"月"&MID(RC[1],7,2)*1&"日登陆即可领取" -> 3月5日登陆即可领取 | F210: 20180305 | H210: 1 | I210: 0 | J210: 0 | K210: 10085|10010 | L210: 35|70
A211: 5018 | B211: =INT(RC[-1]/1000) -> 5 | C211: 0 | D211: 1 | E211: =MID(RC[1],5,2)*1&"月"&MID(RC[1],7,2)*1&"日登陆即可领取" -> 3月6日登陆即可领取 | F211: 20180306 | H211: 1 | I211: 0 | J211: 0 | K211: 10085|10022 | L211: 40|10
A212: 5019 | B212: =INT(RC[-1]/1000) -> 5 | C212: 0 | D212: 1 | E212: =MID(RC[1],5,2)*1&"月"&MID(RC[1],7,2)*1&"日登陆即可领取" -> 3月7日登陆即可领取 | F212: 20180307 | H212: 1 | I212: 0 | J212: 0 | K212: 10102|10101|19030 | L212: 1|1|500
A213: 5020 | B213: =INT(RC[-1]/1000) -> 5 | C213: 0 | D213: 1 | E213: =MID(RC[1],5,2)*1&"月"&MID(RC[1],7,2)*1&"日登陆即可领取" -> 3月8日登陆即可领取 | F213: 20180308 | H213: 1 | I213: 0 | J213: 0 | K213: 10102|10101|19005 | L213: 1|1|100
A214: 5021 | B214: =INT(RC[-1]/1000) -> 5 | C214: 0 | D214: 1 | E214: =MID(RC[1],5,2)*1&"月"&MID(RC[1],7,2)*1&"日登陆即可领取" -> 3月9日登陆即可领取 | F214: 20180309 | H214: 1 | I214: 0 | J214: 0 | K214: 10102|10101|19006 | L214: 1|1|150
A215: 5022 | B215: =INT(RC[-1]/1000) -> 5 | C215: 0 | D215: 1 | E215: =MID(RC[1],5,2)*1&"月"&MID(RC[1],7,2)*1&"日登陆即可领取" -> 3月10日登陆即可领取 | F215: 20180310 | H215: 1 | I215: 0 | J215: 0 | K215: 10102|10101|19012 | L215: 1|1|2000
A216: 5023 | B216: =INT(RC[-1]/1000) -> 5 | C216: 0 | D216: 1 | E216: =MID(RC[1],5,2)*1&"月"&MID(RC[1],7,2)*1&"日登陆即可领取" -> 3月11日登陆即可领取 | F216: 20180311 | H216: 1 | I216: 0 | J216: 0 | K216: 10102|10101|19017 | L216: 1|1|250
A217: 5024 | B217: =INT(RC[-1]/1000) -> 5 | C217: 0 | D217: 1 | E217: =MID(RC[1],5,2)*1&"月"&MID(RC[1],7,2)*1&"日登陆即可领取" -> 4月17日登陆即可领取 | F217: 20180417 | H217: 1 | I217: 0 | J217: 0 | K217: 19005|19003 | L217: 188|20000
A218: 5025 | B218: =INT(RC[-1]/1000) -> 5 | C218: 0 | D218: 1 | E218: =MID(RC[1],5,2)*1&"月"&MID(RC[1],7,2)*1&"日登陆即可领取" -> 4月18日登陆即可领取 | F218: 20180418 | H218: 1 | I218: 0 | J218: 0 | K218: 19005|19003 | L218: 188|20000
A219: 5026 | B219: =INT(RC[-1]/1000) -> 5 | C219: 0 | D219: 1 | E219: =MID(RC[1],5,2)*1&"月"&MID(RC[1],7,2)*1&"日登陆即可领取" -> 4月19日登陆即可领取 | F219: 20180419 | H219: 1 | I219: 0 | J219: 0 | K219: 19005|19003 | L219: 188|20000
A220: 5027 | B220: =INT(RC[-1]/1000) -> 5 | C220: 0 | D220: 1 | E220: =MID(RC[1],5,2)*1&"月"&MID(RC[1],7,2)*1&"日登陆即可领取" -> 4月20日登陆即可领取 | F220: 20180420 | H220: 1 | I220: 0 | J220: 0 | K220: 19005|19003 | L220: 188|20000
A221: 5028 | B221: =INT(RC[-1]/1000) -> 5 | C221: 0 | D221: 1 | E221: =MID(RC[1],5,2)*1&"月"&MID(RC[1],7,2)*1&"日登陆即可领取" -> 4月21日登陆即可领取 | F221: 20180421 | H221: 1 | I221: 0 | J221: 0 | K221: 19005|19006 | L221: 123|200
A222: 5029 | B222: =INT(RC[-1]/1000) -> 5 | C222: 0 | D222: 1 | E222: =MID(RC[1],5,2)*1&"月"&MID(RC[1],7,2)*1&"日登陆即可领取" -> 4月22日登陆即可领取 | F222: 20180422 | H222: 1 | I222: 0 | J222: 0 | K222: 19005|19006 | L222: 123|200
A223: 5030 | B223: =INT(RC[-1]/1000) -> 5 | C223: 0 | D223: 1 | E223: =MID(RC[1],5,2)*1&"月"&MID(RC[1],7,2)*1&"日登陆即可领取" -> 4月23日登陆即可领取 | F223: 20180423 | H223: 1 | I223: 0 | J223: 0 | K223: 19005|19006 | L223: 123|200
A224: 5031 | B224: =INT(RC[-1]/1000) -> 5 | C224: 0 | D224: 1 | E224: =MID(RC[1],5,2)*1&"月"&MID(RC[1],7,2)*1&"日登陆即可领取" -> 4月24日登陆即可领取 | F224: 20180424 | H224: 1 | I224: 0 | J224: 0 | K224: 19005|19003 | L224: 188|20000
A225: 5032 | B225: =INT(RC[-1]/1000) -> 5 | C225: 0 | D225: 1 | E225: =MID(RC[1],5,2)*1&"月"&MID(RC[1],7,2)*1&"日登陆即可领取" -> 4月25日登陆即可领取 | F225: 20180425 | H225: 1 | I225: 0 | J225: 0 | K225: 19005|19003 | L225: 188|20000
A226: 5033 | B226: =INT(RC[-1]/1000) -> 5 | C226: 0 | D226: 1 | E226: =MID(RC[1],5,2)*1&"月"&MID(RC[1],7,2)*1&"日登陆即可领取" -> 4月26日登陆即可领取 | F226: 20180426 | H226: 1 | I226: 0 | J226: 0 | K226: 19005|19003 | L226: 188|20000
A227: 5034 | B227: =INT(RC[-1]/1000) -> 5 | C227: 0 | D227: 1 | E227: =MID(RC[1],5,2)*1&"月"&MID(RC[1],7,2)*1&"日登陆即可领取" -> 4月27日登陆即可领取 | F227: 20180427 | H227: 1 | I227: 0 | J227: 0 | K227: 19005|19003 | L227: 188|20000
A228: 6000 | B228: =INT(RC[-1]/1000) -> 6 | C228: 1 | D228: 1 | E228: ="每日任务：通关主线副本"&RC[1]&"次（%s/"&RC[1]&"）" -> 每日任务：通关主线副本10次（%s/10） | F228: 10 | H228: 1 | I228: 0 | J228: 1 | K228: 10028 | L228: 5 | M228: 500 | O228: 通关主线副本关卡（包括扫荡）x=所需次数
A229: 6001 | B229: =INT(RC[-1]/1000) -> 6 | C229: 1 | D229: 1 | E229: ="通关主线副本"&RC[1]&"次（%s/"&RC[1]&"）" -> 通关主线副本30次（%s/30） | F229: 30 | H229: 1 | I229: 0 | J229: 0 | K229: 10028|19006 | L229: 10|50 | M229: 1000
A230: 6002 | B230: =INT(RC[-1]/1000) -> 6 | C230: 1 | D230: 1 | E230: ="通关主线副本"&RC[1]&"次（%s/"&RC[1]&"）" -> 通关主线副本60次（%s/60） | F230: 60 | H230: 1 | I230: 0 | J230: 0 | K230: 10028|19006 | L230: 10|50 | M230: 1500
A231: 6003 | B231: =INT(RC[-1]/1000) -> 6 | C231: 1 | D231: 1 | E231: ="通关主线副本"&RC[1]&"次（%s/"&RC[1]&"）" -> 通关主线副本120次（%s/120） | F231: 120 | H231: 1 | I231: 0 | J231: 0 | K231: 10028|19006 | L231: 20|100 | M231: 2000
A232: 6004 | B232: =INT(RC[-1]/1000) -> 6 | C232: 1 | D232: 1 | E232: ="通关主线副本"&RC[1]&"次（%s/"&RC[1]&"）" -> 通关主线副本180次（%s/180） | F232: 180 | H232: 1 | I232: 0 | J232: 0 | K232: 10028|19006 | L232: 20|100 | M232: 2500
A233: 6005 | B233: =INT(RC[-1]/1000) -> 6 | C233: 1 | D233: 1 | E233: ="通关主线副本"&RC[1]&"次（%s/"&RC[1]&"）" -> 通关主线副本270次（%s/270） | F233: 270 | H233: 1 | I233: 0 | J233: 0 | K233: 10028|19006 | L233: 40|200 | M233: 3000
A234: 6006 | B234: =INT(RC[-1]/1000) -> 6 | C234: 1 | D234: 1 | E234: ="通关主线副本"&RC[1]&"次（%s/"&RC[1]&"）" -> 通关主线副本360次（%s/360） | F234: 360 | H234: 1 | I234: 0 | J234: 0 | K234: 10028|19006 | L234: 40|200 | M234: 3500
A235: 6007 | B235: =INT(RC[-1]/1000) -> 6 | C235: 1 | D235: 1 | E235: ="每日任务：通关主线副本"&RC[1]&"次（%s/"&RC[1]&"）" -> 每日任务：通关主线副本10次（%s/10） | F235: 10 | H235: 1 | I235: 0 | J235: 1 | K235: 10089|10088 | L235: 1|5
A236: 6008 | B236: =INT(RC[-1]/1000) -> 6 | C236: 1 | D236: 1 | E236: ="通关主线副本"&RC[1]&"次（%s/"&RC[1]&"）" -> 通关主线副本50次（%s/50） | F236: 50 | H236: 1 | I236: 0 | J236: 0 | K236: 10089|10088 | L236: 1|5
A237: 6009 | B237: =INT(RC[-1]/1000) -> 6 | C237: 1 | D237: 1 | E237: ="通关主线副本"&RC[1]&"次（%s/"&RC[1]&"）" -> 通关主线副本100次（%s/100） | F237: 100 | H237: 1 | I237: 0 | J237: 0 | K237: 10089|10088 | L237: 2|5
A238: 6010 | B238: =INT(RC[-1]/1000) -> 6 | C238: 1 | D238: 1 | E238: ="通关主线副本"&RC[1]&"次（%s/"&RC[1]&"）" -> 通关主线副本200次（%s/200） | F238: 200 | H238: 1 | I238: 0 | J238: 0 | K238: 10089|10088 | L238: 3|10
A239: 6011 | B239: =INT(RC[-1]/1000) -> 6 | C239: 1 | D239: 1 | E239: ="通关主线副本"&RC[1]&"次（%s/"&RC[1]&"）" -> 通关主线副本300次（%s/300） | F239: 300 | H239: 1 | I239: 0 | J239: 0 | K239: 10089|10088 | L239: 4|10
A240: 6012 | B240: =INT(RC[-1]/1000) -> 6 | C240: 1 | D240: 1 | E240: ="通关主线副本"&RC[1]&"次（%s/"&RC[1]&"）" -> 通关主线副本400次（%s/400） | F240: 400 | H240: 1 | I240: 0 | J240: 0 | K240: 10089|10088 | L240: 5|10
A241: 6013 | B241: =INT(RC[-1]/1000) -> 6 | C241: 1 | D241: 1 | E241: ="通关主线副本"&RC[1]&"次（%s/"&RC[1]&"）" -> 通关主线副本600次（%s/600） | F241: 600 | H241: 1 | I241: 0 | J241: 0 | K241: 10089|10088 | L241: 6|20
A242: 6014 | B242: =INT(RC[-1]/1000) -> 6 | C242: 1 | D242: 1 | E242: ="通关主线副本"&RC[1]&"次（%s/"&RC[1]&"）" -> 通关主线副本800次（%s/800） | F242: 800 | H242: 1 | I242: 0 | J242: 0 | K242: 10089|10088 | L242: 7|20
A243: 6015 | B243: =INT(RC[-1]/1000) -> 6 | C243: 1 | D243: 1 | E243: ="通关主线副本"&RC[1]&"次（%s/"&RC[1]&"）" -> 通关主线副本1000次（%s/1000） | F243: 1000 | H243: 1 | I243: 0 | J243: 0 | K243: 10089|10088 | L243: 8|20
A244: 6016 | B244: =INT(RC[-1]/1000) -> 6 | C244: 1 | D244: 1 | E244: ="每日任务：通关主线副本"&RC[1]&"次（%s/"&RC[1]&"）" -> 每日任务：通关主线副本10次（%s/10） | F244: 10 | H244: 1 | I244: 0 | J244: 1 | K244: 10085 | L244: 2
A245: 6017 | B245: =INT(RC[-1]/1000) -> 6 | C245: 1 | D245: 1 | E245: ="通关主线副本"&RC[1]&"次（%s/"&RC[1]&"）" -> 通关主线副本20次（%s/20） | F245: 20 | H245: 1 | I245: 0 | J245: 0 | K245: 10085|19006 | L245: 5|50
A246: 6018 | B246: =INT(RC[-1]/1000) -> 6 | C246: 1 | D246: 1 | E246: ="通关主线副本"&RC[1]&"次（%s/"&RC[1]&"）" -> 通关主线副本40次（%s/40） | F246: 40 | H246: 1 | I246: 0 | J246: 0 | K246: 10085|19006 | L246: 5|50
A247: 6019 | B247: =INT(RC[-1]/1000) -> 6 | C247: 1 | D247: 1 | E247: ="通关主线副本"&RC[1]&"次（%s/"&RC[1]&"）" -> 通关主线副本80次（%s/80） | F247: 80 | H247: 1 | I247: 0 | J247: 0 | K247: 10085|19006 | L247: 10|100
A248: 6020 | B248: =INT(RC[-1]/1000) -> 6 | C248: 1 | D248: 1 | E248: ="通关主线副本"&RC[1]&"次（%s/"&RC[1]&"）" -> 通关主线副本120次（%s/120） | F248: 120 | H248: 1 | I248: 0 | J248: 0 | K248: 10085|19006 | L248: 10|100
A249: 6021 | B249: =INT(RC[-1]/1000) -> 6 | C249: 1 | D249: 1 | E249: ="通关主线副本"&RC[1]&"次（%s/"&RC[1]&"）" -> 通关主线副本180次（%s/180） | F249: 180 | H249: 1 | I249: 0 | J249: 0 | K249: 10085|19006 | L249: 20|200
A250: 6022 | B250: =INT(RC[-1]/1000) -> 6 | C250: 1 | D250: 1 | E250: ="通关主线副本"&RC[1]&"次（%s/"&RC[1]&"）" -> 通关主线副本240次（%s/240） | F250: 240 | H250: 1 | I250: 0 | J250: 0 | K250: 10085|19006 | L250: 20|200
A251: 6023 | B251: =INT(RC[-1]/1000) -> 6 | C251: 1 | D251: 1 | E251: ="通关主线副本"&RC[1]&"次（%s/"&RC[1]&"）" -> 通关主线副本20次（%s/20） | F251: 20 | H251: 1 | I251: 0 | J251: 0 | K251: 19103|10001 | L251: 5|1
A252: 6024 | B252: =INT(RC[-1]/1000) -> 6 | C252: 1 | D252: 1 | E252: ="通关主线副本"&RC[1]&"次（%s/"&RC[1]&"）" -> 通关主线副本40次（%s/40） | F252: 40 | H252: 1 | I252: 0 | J252: 0 | K252: 19103|10000 | L252: 10|1
A253: 6025 | B253: =INT(RC[-1]/1000) -> 6 | C253: 1 | D253: 1 | E253: ="通关主线副本"&RC[1]&"次（%s/"&RC[1]&"）" -> 通关主线副本70次（%s/70） | F253: 70 | H253: 1 | I253: 0 | J253: 0 | K253: 19103|10001 | L253: 15|2
A254: 6026 | B254: =INT(RC[-1]/1000) -> 6 | C254: 1 | D254: 1 | E254: ="通关主线副本"&RC[1]&"次（%s/"&RC[1]&"）" -> 通关主线副本100次（%s/100） | F254: 100 | H254: 1 | I254: 0 | J254: 0 | K254: 19103|10000 | L254: 20|2
A255: 6027 | B255: =INT(RC[-1]/1000) -> 6 | C255: 1 | D255: 1 | E255: ="通关主线副本"&RC[1]&"次（%s/"&RC[1]&"）" -> 通关主线副本150次（%s/150） | F255: 150 | H255: 1 | I255: 0 | J255: 0 | K255: 19103|10001 | L255: 25|3
A256: 6028 | B256: =INT(RC[-1]/1000) -> 6 | C256: 1 | D256: 1 | E256: ="通关主线副本"&RC[1]&"次（%s/"&RC[1]&"）" -> 通关主线副本200次（%s/200） | F256: 200 | H256: 1 | I256: 0 | J256: 0 | K256: 19103|10000 | L256: 30|3
A257: 6029 | B257: =INT(RC[-1]/1000) -> 6 | C257: 1 | D257: 1 | E257: ="通关主线副本"&RC[1]&"次（%s/"&RC[1]&"）" -> 通关主线副本300次（%s/300） | F257: 300 | H257: 1 | I257: 0 | J257: 0 | K257: 19103|10001 | L257: 35|4
A258: 6030 | B258: =INT(RC[-1]/1000) -> 6 | C258: 1 | D258: 1 | E258: ="通关主线副本"&RC[1]&"次（%s/"&RC[1]&"）" -> 通关主线副本400次（%s/400） | F258: 400 | H258: 1 | I258: 0 | J258: 0 | K258: 19103|10000 | L258: 40|4
A259: 6031 | B259: =INT(RC[-1]/1000) -> 6 | C259: 1 | D259: 1 | E259: ="通关主线副本"&RC[1]&"次（%s/"&RC[1]&"）" -> 通关主线副本500次（%s/500） | F259: 500 | H259: 1 | I259: 0 | J259: 0 | K259: 19103|10001 | L259: 45|5
A260: 6032 | B260: =INT(RC[-1]/1000) -> 6 | C260: 1 | D260: 1 | E260: ="通关主线副本"&RC[1]&"次（%s/"&RC[1]&"）" -> 通关主线副本600次（%s/600） | F260: 600 | H260: 1 | I260: 0 | J260: 0 | K260: 19103|10000 | L260: 50|5
A261: 7000 | B261: =INT(RC[-1]/1000) -> 7 | C261: 1 | D261: 1 | E261: ="每日任务：争夺圣器"&RC[1]&"次（%s/"&RC[1]&"）" -> 每日任务：争夺圣器10次（%s/10） | F261: 10 | H261: 1 | I261: 0 | J261: 1 | K261: 10028 | L261: 5 | M261: 500 | O261: 圣器争夺（无论胜负）（包括战5次）x=所需次数
A262: 7001 | B262: =INT(RC[-1]/1000) -> 7 | C262: 1 | D262: 1 | E262: ="争夺圣器"&RC[1]&"次（%s/"&RC[1]&"）" -> 争夺圣器30次（%s/30） | F262: 30 | H262: 1 | I262: 0 | J262: 0 | K262: 10028|10010 | L262: 10|10 | M262: 1000
A263: 7002 | B263: =INT(RC[-1]/1000) -> 7 | C263: 1 | D263: 1 | E263: ="争夺圣器"&RC[1]&"次（%s/"&RC[1]&"）" -> 争夺圣器60次（%s/60） | F263: 60 | H263: 1 | I263: 0 | J263: 0 | K263: 10028|10010 | L263: 10|10 | M263: 1500
A264: 7003 | B264: =INT(RC[-1]/1000) -> 7 | C264: 1 | D264: 1 | E264: ="争夺圣器"&RC[1]&"次（%s/"&RC[1]&"）" -> 争夺圣器120次（%s/120） | F264: 120 | H264: 1 | I264: 0 | J264: 0 | K264: 10028|10010 | L264: 20|20 | M264: 2000
A265: 7004 | B265: =INT(RC[-1]/1000) -> 7 | C265: 1 | D265: 1 | E265: ="争夺圣器"&RC[1]&"次（%s/"&RC[1]&"）" -> 争夺圣器180次（%s/180） | F265: 180 | H265: 1 | I265: 0 | J265: 0 | K265: 10028|10010 | L265: 20|20 | M265: 2500
A266: 7005 | B266: =INT(RC[-1]/1000) -> 7 | C266: 1 | D266: 1 | E266: ="争夺圣器"&RC[1]&"次（%s/"&RC[1]&"）" -> 争夺圣器270次（%s/270） | F266: 270 | H266: 1 | I266: 0 | J266: 0 | K266: 10028|10010 | L266: 40|40 | M266: 3000
A267: 7006 | B267: =INT(RC[-1]/1000) -> 7 | C267: 1 | D267: 1 | E267: ="争夺圣器"&RC[1]&"次（%s/"&RC[1]&"）" -> 争夺圣器360次（%s/360） | F267: 360 | H267: 1 | I267: 0 | J267: 0 | K267: 10028|10010 | L267: 40|40 | M267: 3500
A268: 7007 | B268: =INT(RC[-1]/1000) -> 7 | C268: 1 | D268: 1 | E268: ="每日任务：争夺圣器"&RC[1]&"次（%s/"&RC[1]&"）" -> 每日任务：争夺圣器10次（%s/10） | F268: 10 | H268: 1 | I268: 0 | J268: 1 | K268: 10089|10088 | L268: 1|5
A269: 7008 | B269: =INT(RC[-1]/1000) -> 7 | C269: 1 | D269: 1 | E269: ="争夺圣器"&RC[1]&"次（%s/"&RC[1]&"）" -> 争夺圣器50次（%s/50） | F269: 50 | H269: 1 | I269: 0 | J269: 0 | K269: 10089|10088 | L269: 1|5
A270: 7009 | B270: =INT(RC[-1]/1000) -> 7 | C270: 1 | D270: 1 | E270: ="争夺圣器"&RC[1]&"次（%s/"&RC[1]&"）" -> 争夺圣器100次（%s/100） | F270: 100 | H270: 1 | I270: 0 | J270: 0 | K270: 10089|10088 | L270: 2|5
A271: 7010 | B271: =INT(RC[-1]/1000) -> 7 | C271: 1 | D271: 1 | E271: ="争夺圣器"&RC[1]&"次（%s/"&RC[1]&"）" -> 争夺圣器200次（%s/200） | F271: 200 | H271: 1 | I271: 0 | J271: 0 | K271: 10089|10088 | L271: 3|10
A272: 7011 | B272: =INT(RC[-1]/1000) -> 7 | C272: 1 | D272: 1 | E272: ="争夺圣器"&RC[1]&"次（%s/"&RC[1]&"）" -> 争夺圣器300次（%s/300） | F272: 300 | H272: 1 | I272: 0 | J272: 0 | K272: 10089|10088 | L272: 4|10
A273: 7012 | B273: =INT(RC[-1]/1000) -> 7 | C273: 1 | D273: 1 | E273: ="争夺圣器"&RC[1]&"次（%s/"&RC[1]&"）" -> 争夺圣器400次（%s/400） | F273: 400 | H273: 1 | I273: 0 | J273: 0 | K273: 10089|10088 | L273: 5|10
A274: 7013 | B274: =INT(RC[-1]/1000) -> 7 | C274: 1 | D274: 1 | E274: ="争夺圣器"&RC[1]&"次（%s/"&RC[1]&"）" -> 争夺圣器600次（%s/600） | F274: 600 | H274: 1 | I274: 0 | J274: 0 | K274: 10089|10088 | L274: 6|20
A275: 7014 | B275: =INT(RC[-1]/1000) -> 7 | C275: 1 | D275: 1 | E275: ="争夺圣器"&RC[1]&"次（%s/"&RC[1]&"）" -> 争夺圣器800次（%s/800） | F275: 800 | H275: 1 | I275: 0 | J275: 0 | K275: 10089|10088 | L275: 7|20
A276: 7015 | B276: =INT(RC[-1]/1000) -> 7 | C276: 1 | D276: 1 | E276: ="争夺圣器"&RC[1]&"次（%s/"&RC[1]&"）" -> 争夺圣器1000次（%s/1000） | F276: 1000 | H276: 1 | I276: 0 | J276: 0 | K276: 10089|10088 | L276: 8|20
A277: 7016 | B277: =INT(RC[-1]/1000) -> 7 | C277: 1 | D277: 1 | E277: ="争夺圣器"&RC[1]&"次（%s/"&RC[1]&"）" -> 争夺圣器100次（%s/100） | F277: 100 | H277: 1 | I277: 0 | J277: 1 | K277: 10089|10088 | L277: 2|5
A278: 7017 | B278: =INT(RC[-1]/1000) -> 7 | C278: 1 | D278: 1 | E278: ="争夺圣器"&RC[1]&"次（%s/"&RC[1]&"）" -> 争夺圣器200次（%s/200） | F278: 200 | H278: 1 | I278: 0 | J278: 0 | K278: 10089|10088 | L278: 3|10
A279: 7018 | B279: =INT(RC[-1]/1000) -> 7 | C279: 1 | D279: 1 | E279: ="争夺圣器"&RC[1]&"次（%s/"&RC[1]&"）" -> 争夺圣器300次（%s/300） | F279: 300 | H279: 1 | I279: 0 | J279: 0 | K279: 10089|10088 | L279: 4|10
A280: 7019 | B280: =INT(RC[-1]/1000) -> 7 | C280: 1 | D280: 1 | E280: ="争夺圣器"&RC[1]&"次（%s/"&RC[1]&"）" -> 争夺圣器400次（%s/400） | F280: 400 | H280: 1 | I280: 0 | J280: 0 | K280: 10089|10088 | L280: 5|10
A281: 7020 | B281: =INT(RC[-1]/1000) -> 7 | C281: 1 | D281: 1 | E281: ="争夺圣器"&RC[1]&"次（%s/"&RC[1]&"）" -> 争夺圣器600次（%s/600） | F281: 600 | H281: 1 | I281: 0 | J281: 0 | K281: 10089|10088 | L281: 6|20
A282: 7021 | B282: =INT(RC[-1]/1000) -> 7 | C282: 1 | D282: 1 | E282: ="争夺圣器"&RC[1]&"次（%s/"&RC[1]&"）" -> 争夺圣器800次（%s/800） | F282: 800 | H282: 1 | I282: 0 | J282: 0 | K282: 10089|10088 | L282: 7|20
A283: 7022 | B283: =INT(RC[-1]/1000) -> 7 | C283: 1 | D283: 1 | E283: ="争夺圣器"&RC[1]&"次（%s/"&RC[1]&"）" -> 争夺圣器1000次（%s/1000） | F283: 1000 | H283: 1 | I283: 0 | J283: 0 | K283: 10089|10088 | L283: 8|20
A284: 7023 | B284: =INT(RC[-1]/1000) -> 7 | C284: 1 | D284: 1 | E284: ="每日任务：争夺圣器"&RC[1]&"次（%s/"&RC[1]&"）" -> 每日任务：争夺圣器10次（%s/10） | F284: 10 | H284: 1 | I284: 0 | J284: 1 | K284: 10085 | L284: 2
A285: 7024 | B285: =INT(RC[-1]/1000) -> 7 | C285: 1 | D285: 1 | E285: ="争夺圣器"&RC[1]&"次（%s/"&RC[1]&"）" -> 争夺圣器20次（%s/20） | F285: 20 | H285: 1 | I285: 0 | J285: 0 | K285: 10085|13049 | L285: 5|1
A286: 7025 | B286: =INT(RC[-1]/1000) -> 7 | C286: 1 | D286: 1 | E286: ="争夺圣器"&RC[1]&"次（%s/"&RC[1]&"）" -> 争夺圣器40次（%s/40） | F286: 40 | H286: 1 | I286: 0 | J286: 0 | K286: 10085|13049 | L286: 5|1
A287: 7026 | B287: =INT(RC[-1]/1000) -> 7 | C287: 1 | D287: 1 | E287: ="争夺圣器"&RC[1]&"次（%s/"&RC[1]&"）" -> 争夺圣器80次（%s/80） | F287: 80 | H287: 1 | I287: 0 | J287: 0 | K287: 10085|13049 | L287: 10|2
A288: 7027 | B288: =INT(RC[-1]/1000) -> 7 | C288: 1 | D288: 1 | E288: ="争夺圣器"&RC[1]&"次（%s/"&RC[1]&"）" -> 争夺圣器120次（%s/120） | F288: 120 | H288: 1 | I288: 0 | J288: 0 | K288: 10085|13049 | L288: 10|2
A289: 7028 | B289: =INT(RC[-1]/1000) -> 7 | C289: 1 | D289: 1 | E289: ="争夺圣器"&RC[1]&"次（%s/"&RC[1]&"）" -> 争夺圣器180次（%s/180） | F289: 180 | H289: 1 | I289: 0 | J289: 0 | K289: 10085|13049 | L289: 20|3
A290: 7029 | B290: =INT(RC[-1]/1000) -> 7 | C290: 1 | D290: 1 | E290: ="争夺圣器"&RC[1]&"次（%s/"&RC[1]&"）" -> 争夺圣器240次（%s/240） | F290: 240 | H290: 1 | I290: 0 | J290: 0 | K290: 10085|13049 | L290: 20|3
A291: 7030 | B291: =INT(RC[-1]/1000) -> 7 | C291: 1 | D291: 1 | E291: ="争夺圣器"&RC[1]&"次（%s/"&RC[1]&"）" -> 争夺圣器20次（%s/20） | F291: 20 | H291: 1 | I291: 0 | J291: 0 | K291: 42201|10000 | L291: 2|1
A292: 7031 | B292: =INT(RC[-1]/1000) -> 7 | C292: 1 | D292: 1 | E292: ="争夺圣器"&RC[1]&"次（%s/"&RC[1]&"）" -> 争夺圣器40次（%s/40） | F292: 40 | H292: 1 | I292: 0 | J292: 0 | K292: 42201|10001 | L292: 5|1
A293: 7032 | B293: =INT(RC[-1]/1000) -> 7 | C293: 1 | D293: 1 | E293: ="争夺圣器"&RC[1]&"次（%s/"&RC[1]&"）" -> 争夺圣器70次（%s/70） | F293: 70 | H293: 1 | I293: 0 | J293: 0 | K293: 42201|10000 | L293: 8|2
A294: 7033 | B294: =INT(RC[-1]/1000) -> 7 | C294: 1 | D294: 1 | E294: ="争夺圣器"&RC[1]&"次（%s/"&RC[1]&"）" -> 争夺圣器100次（%s/100） | F294: 100 | H294: 1 | I294: 0 | J294: 0 | K294: 42201|10001 | L294: 10|2
A295: 7034 | B295: =INT(RC[-1]/1000) -> 7 | C295: 1 | D295: 1 | E295: ="争夺圣器"&RC[1]&"次（%s/"&RC[1]&"）" -> 争夺圣器150次（%s/150） | F295: 150 | H295: 1 | I295: 0 | J295: 0 | K295: 42301|10000 | L295: 2|3
A296: 7035 | B296: =INT(RC[-1]/1000) -> 7 | C296: 1 | D296: 1 | E296: ="争夺圣器"&RC[1]&"次（%s/"&RC[1]&"）" -> 争夺圣器200次（%s/200） | F296: 200 | H296: 1 | I296: 0 | J296: 0 | K296: 42301|10001 | L296: 3|3
A297: 8000 | B297: =INT(RC[-1]/1000) -> 8 | C297: 1 | D297: 1 | E297: ="每日任务：竞技场胜利"&RC[1]&"次（%s/"&RC[1]&"）" -> 每日任务：竞技场胜利5次（%s/5） | F297: 5 | H297: 1 | I297: 0 | J297: 1 | K297: 10028 | L297: 5 | M297: 500 | O297: 挑战竞技场（无论胜负）x=所需次数
A298: 8001 | B298: =INT(RC[-1]/1000) -> 8 | C298: 1 | D298: 1 | E298: ="竞技场胜利"&RC[1]&"次（%s/"&RC[1]&"）" -> 竞技场胜利20次（%s/20） | F298: 20 | H298: 1 | I298: 0 | J298: 0 | K298: 10028|19013 | L298: 10|500 | M298: 1000
A299: 8002 | B299: =INT(RC[-1]/1000) -> 8 | C299: 1 | D299: 1 | E299: ="竞技场胜利"&RC[1]&"次（%s/"&RC[1]&"）" -> 竞技场胜利40次（%s/40） | F299: 40 | H299: 1 | I299: 0 | J299: 0 | K299: 10028|19013 | L299: 10|500 | M299: 1500
A300: 8003 | B300: =INT(RC[-1]/1000) -> 8 | C300: 1 | D300: 1 | E300: ="竞技场胜利"&RC[1]&"次（%s/"&RC[1]&"）" -> 竞技场胜利80次（%s/80） | F300: 80 | H300: 1 | I300: 0 | J300: 0 | K300: 10028|19013 | L300: 20|1000 | M300: 2000
A301: 8004 | B301: =INT(RC[-1]/1000) -> 8 | C301: 1 | D301: 1 | E301: ="竞技场胜利"&RC[1]&"次（%s/"&RC[1]&"）" -> 竞技场胜利120次（%s/120） | F301: 120 | H301: 1 | I301: 0 | J301: 0 | K301: 10028|19013 | L301: 20|1000 | M301: 2500
A302: 8005 | B302: =INT(RC[-1]/1000) -> 8 | C302: 1 | D302: 1 | E302: ="竞技场胜利"&RC[1]&"次（%s/"&RC[1]&"）" -> 竞技场胜利180次（%s/180） | F302: 180 | H302: 1 | I302: 0 | J302: 0 | K302: 10028|19013 | L302: 40|2000 | M302: 3000
A303: 8006 | B303: =INT(RC[-1]/1000) -> 8 | C303: 1 | D303: 1 | E303: ="竞技场胜利"&RC[1]&"次（%s/"&RC[1]&"）" -> 竞技场胜利240次（%s/240） | F303: 240 | H303: 1 | I303: 0 | J303: 0 | K303: 10028|19013 | L303: 40|2000 | M303: 3500
A304: 8007 | B304: 8 | C304: 1 | D304: 1 | E304: 每日任务：竞技场胜利5次（%s/5） | F304: 5 | H304: 1 | I304: 0 | J304: 1 | K304: 10089|10088 | L304: 1|5
A305: 8008 | B305: =INT(RC[-1]/1000) -> 8 | C305: 1 | D305: 1 | E305: ="每日任务：竞技场胜利"&RC[1]&"次（%s/"&RC[1]&"）" -> 每日任务：竞技场胜利10次（%s/10） | F305: 10 | H305: 1 | I305: 0 | J305: 1 | K305: 10085 | L305: 2
A306: 8009 | B306: =INT(RC[-1]/1000) -> 8 | C306: 1 | D306: 1 | E306: ="竞技场胜利"&RC[1]&"次（%s/"&RC[1]&"）" -> 竞技场胜利20次（%s/20） | F306: 20 | H306: 1 | I306: 0 | J306: 0 | K306: 10085|19013 | L306: 5|500
A307: 8010 | B307: =INT(RC[-1]/1000) -> 8 | C307: 1 | D307: 1 | E307: ="竞技场胜利"&RC[1]&"次（%s/"&RC[1]&"）" -> 竞技场胜利40次（%s/40） | F307: 40 | H307: 1 | I307: 0 | J307: 0 | K307: 10085|19013 | L307: 5|500
A308: 8011 | B308: =INT(RC[-1]/1000) -> 8 | C308: 1 | D308: 1 | E308: ="竞技场胜利"&RC[1]&"次（%s/"&RC[1]&"）" -> 竞技场胜利80次（%s/80） | F308: 80 | H308: 1 | I308: 0 | J308: 0 | K308: 10085|19013 | L308: 10|1000
A309: 8012 | B309: =INT(RC[-1]/1000) -> 8 | C309: 1 | D309: 1 | E309: ="竞技场胜利"&RC[1]&"次（%s/"&RC[1]&"）" -> 竞技场胜利120次（%s/120） | F309: 120 | H309: 1 | I309: 0 | J309: 0 | K309: 10085|19013 | L309: 10|1000
A310: 8013 | B310: =INT(RC[-1]/1000) -> 8 | C310: 1 | D310: 1 | E310: ="竞技场胜利"&RC[1]&"次（%s/"&RC[1]&"）" -> 竞技场胜利180次（%s/180） | F310: 180 | H310: 1 | I310: 0 | J310: 0 | K310: 10085|19013 | L310: 20|2000
A311: 8014 | B311: =INT(RC[-1]/1000) -> 8 | C311: 1 | D311: 1 | E311: ="竞技场胜利"&RC[1]&"次（%s/"&RC[1]&"）" -> 竞技场胜利240次（%s/240） | F311: 240 | H311: 1 | I311: 0 | J311: 0 | K311: 10085|19013 | L311: 20|2000
A312: 8015 | B312: =INT(RC[-1]/1000) -> 8 | C312: 1 | D312: 1 | E312: ="竞技场胜利"&RC[1]&"次（%s/"&RC[1]&"）" -> 竞技场胜利15次（%s/15） | F312: 15 | H312: 1 | I312: 0 | J312: 0 | K312: 10013|10004 | L312: 5|10
A313: 8016 | B313: =INT(RC[-1]/1000) -> 8 | C313: 1 | D313: 1 | E313: ="竞技场胜利"&RC[1]&"次（%s/"&RC[1]&"）" -> 竞技场胜利30次（%s/30） | F313: 30 | H313: 1 | I313: 0 | J313: 0 | K313: 10013|10001 | L313: 10|1
A314: 8017 | B314: =INT(RC[-1]/1000) -> 8 | C314: 1 | D314: 1 | E314: ="竞技场胜利"&RC[1]&"次（%s/"&RC[1]&"）" -> 竞技场胜利50次（%s/50） | F314: 50 | H314: 1 | I314: 0 | J314: 0 | K314: 10013|10004 | L314: 15|20
A315: 8018 | B315: =INT(RC[-1]/1000) -> 8 | C315: 1 | D315: 1 | E315: ="竞技场胜利"&RC[1]&"次（%s/"&RC[1]&"）" -> 竞技场胜利75次（%s/75） | F315: 75 | H315: 1 | I315: 0 | J315: 0 | K315: 10014|10001 | L315: 10|2
A316: 8019 | B316: =INT(RC[-1]/1000) -> 8 | C316: 1 | D316: 1 | E316: ="竞技场胜利"&RC[1]&"次（%s/"&RC[1]&"）" -> 竞技场胜利110次（%s/110） | F316: 110 | H316: 1 | I316: 0 | J316: 0 | K316: 10014|10004 | L316: 12|30
A317: 8020 | B317: =INT(RC[-1]/1000) -> 8 | C317: 1 | D317: 1 | E317: ="竞技场胜利"&RC[1]&"次（%s/"&RC[1]&"）" -> 竞技场胜利150次（%s/150） | F317: 150 | H317: 1 | I317: 0 | J317: 0 | K317: 10014|10001 | L317: 15|3
A318: 8021 | B318: =INT(RC[-1]/1000) -> 8 | C318: 1 | D318: 1 | E318: ="竞技场胜利"&RC[1]&"次（%s/"&RC[1]&"）" -> 竞技场胜利225次（%s/225） | F318: 225 | H318: 1 | I318: 0 | J318: 0 | K318: 10014|10004 | L318: 17|40
A319: 8022 | B319: =INT(RC[-1]/1000) -> 8 | C319: 1 | D319: 1 | E319: ="竞技场胜利"&RC[1]&"次（%s/"&RC[1]&"）" -> 竞技场胜利300次（%s/300） | F319: 300 | H319: 1 | I319: 0 | J319: 0 | K319: 10014|10001 | L319: 20|4
A320: 8023 | B320: =INT(RC[-1]/1000) -> 8 | C320: 1 | D320: 1 | E320: ="竞技场胜利"&RC[1]&"次（%s/"&RC[1]&"）" -> 竞技场胜利375次（%s/375） | F320: 375 | H320: 1 | I320: 0 | J320: 0 | K320: 10014|10004 | L320: 22|50
A321: 8024 | B321: =INT(RC[-1]/1000) -> 8 | C321: 1 | D321: 1 | E321: ="竞技场胜利"&RC[1]&"次（%s/"&RC[1]&"）" -> 竞技场胜利450次（%s/450） | F321: 450 | H321: 1 | I321: 0 | J321: 0 | K321: 10014|10001 | L321: 25|5
A322: 9001 | B322: =INT(RC[-1]/1000) -> 9 | C322: 1 | D322: 1 | E322: ="累计击杀无尽深渊怪物"&RC[1]&"只（%s/"&RC[1]&"）" -> 累计击杀无尽深渊怪物500只（%s/500） | F322: 500 | H322: 1 | I322: 0 | J322: 0 | K322: 19028 | L322: 200 | O322: 无尽深渊击杀怪物数量x=所需数量
A323: 9002 | B323: =INT(RC[-1]/1000) -> 9 | C323: 1 | D323: 1 | E323: ="累计击杀无尽深渊怪物"&RC[1]&"只（%s/"&RC[1]&"）" -> 累计击杀无尽深渊怪物1000只（%s/1000） | F323: 1000 | H323: 1 | I323: 0 | J323: 0 | K323: 19028 | L323: 200
A324: 9003 | B324: =INT(RC[-1]/1000) -> 9 | C324: 1 | D324: 1 | E324: ="累计击杀无尽深渊怪物"&RC[1]&"只（%s/"&RC[1]&"）" -> 累计击杀无尽深渊怪物2000只（%s/2000） | F324: 2000 | H324: 1 | I324: 0 | J324: 0 | K324: 19028 | L324: 300
A325: 9004 | B325: =INT(RC[-1]/1000) -> 9 | C325: 1 | D325: 1 | E325: ="累计击杀无尽深渊怪物"&RC[1]&"只（%s/"&RC[1]&"）" -> 累计击杀无尽深渊怪物3000只（%s/3000） | F325: 3000 | H325: 1 | I325: 0 | J325: 0 | K325: 19028 | L325: 300
A326: 9005 | B326: =INT(RC[-1]/1000) -> 9 | C326: 1 | D326: 1 | E326: ="累计击杀无尽深渊怪物"&RC[1]&"只（%s/"&RC[1]&"）" -> 累计击杀无尽深渊怪物4500只（%s/4500） | F326: 4500 | H326: 1 | I326: 0 | J326: 0 | K326: 19028 | L326: 500
A327: 9006 | B327: =INT(RC[-1]/1000) -> 9 | C327: 1 | D327: 1 | E327: ="累计击杀无尽深渊怪物"&RC[1]&"只（%s/"&RC[1]&"）" -> 累计击杀无尽深渊怪物6000只（%s/6000） | F327: 6000 | H327: 1 | I327: 0 | J327: 0 | K327: 19028 | L327: 500
A328: 9007 | B328: =INT(RC[-1]/1000) -> 9 | C328: 1 | D328: 1 | E328: ="累计击杀无尽深渊怪物"&RC[1]&"只（%s/"&RC[1]&"）" -> 累计击杀无尽深渊怪物8000只（%s/8000） | F328: 8000 | H328: 1 | I328: 0 | J328: 0 | K328: 19028 | L328: 800
A329: 9008 | B329: =INT(RC[-1]/1000) -> 9 | C329: 1 | D329: 1 | E329: ="累计击杀无尽深渊怪物"&RC[1]&"只（%s/"&RC[1]&"）" -> 累计击杀无尽深渊怪物10000只（%s/10000） | F329: 10000 | H329: 1 | I329: 0 | J329: 0 | K329: 19028 | L329: 800
A330: 10001 | B330: =INT(RC[-1]/1000) -> 10 | C330: 1 | D330: 1 | E330: ="累计进行"&RC[1]&"次召唤（%s/"&RC[1]&"）" -> 累计进行20次召唤（%s/20） | F330: 20 | H330: 1 | I330: 0 | J330: 0 | K330: 33300|19103 | L330: 5|50 | O330: 高级召唤x=所需次数
A331: 10002 | B331: =INT(RC[-1]/1000) -> 10 | C331: 1 | D331: 1 | E331: ="累计进行"&RC[1]&"次召唤（%s/"&RC[1]&"）" -> 累计进行50次召唤（%s/50） | F331: 50 | H331: 1 | I331: 0 | J331: 0 | K331: 10014|19103 | L331: 50|100
A332: 10003 | B332: =INT(RC[-1]/1000) -> 10 | C332: 1 | D332: 1 | E332: ="累计进行"&RC[1]&"次召唤（%s/"&RC[1]&"）" -> 累计进行100次召唤（%s/100） | F332: 100 | H332: 1 | I332: 0 | J332: 0 | K332: 13435 | L332: 1
A333: 10004 | B333: =INT(RC[-1]/1000) -> 10 | C333: 1 | D333: 1 | E333: ="累计进行"&RC[1]&"次召唤（%s/"&RC[1]&"）" -> 累计进行150次召唤（%s/150） | F333: 150 | H333: 1 | I333: 0 | J333: 0 | K333: 13337|42301 | L333: 1|10
A334: 10005 | B334: =INT(RC[-1]/1000) -> 10 | C334: 1 | D334: 1 | E334: ="累计进行"&RC[1]&"次召唤（%s/"&RC[1]&"）" -> 累计进行200次召唤（%s/200） | F334: 200 | H334: 1 | I334: 0 | J334: 0 | K334: 13434|10022|13646|13324 | L334: 1|50|10|1
A335: 10006 | B335: =INT(RC[-1]/1000) -> 10 | C335: 1 | D335: 1 | E335: ="累计进行"&RC[1]&"次召唤（%s/"&RC[1]&"）" -> 累计进行300次召唤（%s/300） | F335: 300 | H335: 1 | I335: 0 | J335: 0 | K335: 13333|20305|23305 | L335: 2|1|1
A336: 11001 | B336: 11 | C336: 0 | D336: 1 | E336: %s登陆即可领取 | F336: 8 | H336: 1 | I336: 0 | J336: 0 | K336: 19005|10022 | L336: 50|5 | O336: 开服登陆x=开服第几天
A337: 11002 | B337: 11 | C337: 0 | D337: 1 | E337: %s登陆即可领取 | F337: 9 | H337: 1 | I337: 0 | J337: 0 | K337: 19005|10022 | L337: 100|10
A338: 11003 | B338: 11 | C338: 0 | D338: 1 | E338: %s登陆即可领取 | F338: 10 | H338: 1 | I338: 0 | J338: 0 | K338: 19005|10022 | L338: 150|15
A339: 11004 | B339: 11 | C339: 0 | D339: 1 | E339: %s登陆即可领取 | F339: 11 | H339: 1 | I339: 0 | J339: 0 | K339: 19005|10022 | L339: 200|20
A340: 11005 | B340: 11 | C340: 0 | D340: 1 | E340: %s登陆即可领取 | F340: 12 | H340: 1 | I340: 0 | J340: 0 | K340: 19005|10022 | L340: 250|25
A341: 11006 | B341: 11 | C341: 0 | D341: 1 | E341: %s登陆即可领取 | F341: 15 | H341: 1 | I341: 0 | J341: 0 | K341: 10103|10101|19030 | L341: 1|1|500
A342: 11007 | B342: 11 | C342: 0 | D342: 1 | E342: %s登陆即可领取 | F342: 16 | H342: 1 | I342: 0 | J342: 0 | K342: 10103|10101|19005 | L342: 1|1|100
A343: 11008 | B343: 11 | C343: 0 | D343: 1 | E343: %s登陆即可领取 | F343: 17 | H343: 1 | I343: 0 | J343: 0 | K343: 10103|10101|19006 | L343: 1|1|150
A344: 11009 | B344: 11 | C344: 0 | D344: 1 | E344: %s登陆即可领取 | F344: 18 | H344: 1 | I344: 0 | J344: 0 | K344: 10103|10101|19012 | L344: 1|1|2000
A345: 11010 | B345: 11 | C345: 0 | D345: 1 | E345: %s登陆即可领取 | F345: 19 | H345: 1 | I345: 0 | J345: 0 | K345: 10103|10101|19017 | L345: 1|1|250
A346: 12001 | B346: =INT(RC[-1]/1000) -> 12 | C346: 1 | D346: 1 | E346: ="累计通关"&RC[1]&"次跨服组队副本（%s/"&RC[1]&"）" -> 累计通关1次跨服组队副本（%s/1） | F346: 1 | H346: 1 | I346: 0 | J346: 0 | K346: 19003 | L346: 1 | O346: 组队副本x=通关次数
A347: 12002 | B347: =INT(RC[-1]/1000) -> 12 | C347: 1 | D347: 1 | E347: ="每日任务：通关"&RC[1]&"次跨服组队副本（%s/"&RC[1]&"）" -> 每日任务：通关3次跨服组队副本（%s/3） | F347: 3 | H347: 1 | I347: 0 | J347: 1 | K347: 10102 | L347: 1
A348: 12003 | B348: =INT(RC[-1]/1000) -> 12 | C348: 1 | D348: 1 | E348: ="每日任务：通关"&RC[1]&"次跨服组队副本（%s/"&RC[1]&"）" -> 每日任务：通关5次跨服组队副本（%s/5） | F348: 5 | H348: 1 | I348: 0 | J348: 1 | K348: 10102|19030 | L348: 1|100
A349: 12004 | B349: =INT(RC[-1]/1000) -> 12 | C349: 1 | D349: 1 | E349: ="累计通关"&RC[1]&"次跨服组队副本（%s/"&RC[1]&"）" -> 累计通关3次跨服组队副本（%s/3） | F349: 3 | H349: 1 | I349: 0 | J349: 0 | K349: 10101|19030 | L349: 1|100
A350: 12005 | B350: =INT(RC[-1]/1000) -> 12 | C350: 1 | D350: 1 | E350: ="累计通关"&RC[1]&"次跨服组队副本（%s/"&RC[1]&"）" -> 累计通关6次跨服组队副本（%s/6） | F350: 6 | H350: 1 | I350: 0 | J350: 0 | K350: 10101|19030 | L350: 1|200
A351: 12006 | B351: =INT(RC[-1]/1000) -> 12 | C351: 1 | D351: 1 | E351: ="累计通关"&RC[1]&"次跨服组队副本（%s/"&RC[1]&"）" -> 累计通关10次跨服组队副本（%s/10） | F351: 10 | H351: 1 | I351: 0 | J351: 0 | K351: 10101|19030 | L351: 1|300
A352: 12007 | B352: =INT(RC[-1]/1000) -> 12 | C352: 1 | D352: 1 | E352: ="累计通关"&RC[1]&"次跨服组队副本（%s/"&RC[1]&"）" -> 累计通关15次跨服组队副本（%s/15） | F352: 15 | H352: 1 | I352: 0 | J352: 0 | K352: 10101|19030 | L352: 1|400
A353: 12008 | B353: =INT(RC[-1]/1000) -> 12 | C353: 1 | D353: 1 | E353: ="累计通关"&RC[1]&"次跨服组队副本（%s/"&RC[1]&"）" -> 累计通关25次跨服组队副本（%s/25） | F353: 25 | H353: 1 | I353: 0 | J353: 0 | K353: 10101|19030 | L353: 1|600
A354: 12009 | B354: =INT(RC[-1]/1000) -> 12 | C354: 1 | D354: 1 | E354: ="累计通关"&RC[1]&"次跨服组队副本（%s/"&RC[1]&"）" -> 累计通关40次跨服组队副本（%s/40） | F354: 40 | H354: 1 | I354: 0 | J354: 0 | K354: 10101|19030 | L354: 1|1000
A355: 12010 | B355: =INT(RC[-1]/1000) -> 12 | C355: 1 | D355: 1 | E355: ="每日任务：通关"&RC[1]&"次跨服组队副本（%s/"&RC[1]&"）" -> 每日任务：通关3次跨服组队副本（%s/3） | F355: 3 | H355: 1 | I355: 0 | J355: 1 | K355: 10103 | L355: 1
A356: 12011 | B356: =INT(RC[-1]/1000) -> 12 | C356: 1 | D356: 1 | E356: ="每日任务：通关"&RC[1]&"次跨服组队副本（%s/"&RC[1]&"）" -> 每日任务：通关5次跨服组队副本（%s/5） | F356: 5 | H356: 1 | I356: 0 | J356: 1 | K356: 10103|19030 | L356: 1|100
A357: 13001 | B357: =INT(RC[-1]/1000) -> 13 | C357: 1 | D357: 1 | E357: ="累计通关精英副本"&RC[1]&"次（%s/"&RC[1]&"）" -> 累计通关精英副本1次（%s/1） | F357: 1 | H357: 1 | I357: 0 | J357: 0 | K357: 19003 | L357: 1 | O357: 通关精英副本
A358: 13002 | B358: =INT(RC[-1]/1000) -> 13 | C358: 1 | D358: 1 | E358: ="每日任务：通关精英副本"&RC[1]&"次（%s/"&RC[1]&"）" -> 每日任务：通关精英副本3次（%s/3） | F358: 3 | H358: 1 | I358: 0 | J358: 1 | K358: 10089|10088 | L358: 1|5
A359: 13003 | B359: =INT(RC[-1]/1000) -> 13 | C359: 1 | D359: 1 | E359: ="累计通关精英副本"&RC[1]&"次（%s/"&RC[1]&"）" -> 累计通关精英副本20次（%s/20） | F359: 20 | H359: 1 | I359: 0 | J359: 0 | K359: 10089|10088 | L359: 1|5
A360: 13004 | B360: =INT(RC[-1]/1000) -> 13 | C360: 1 | D360: 1 | E360: ="累计通关精英副本"&RC[1]&"次（%s/"&RC[1]&"）" -> 累计通关精英副本40次（%s/40） | F360: 40 | H360: 1 | I360: 0 | J360: 0 | K360: 10089|10088 | L360: 2|5
A361: 13005 | B361: =INT(RC[-1]/1000) -> 13 | C361: 1 | D361: 1 | E361: ="累计通关精英副本"&RC[1]&"次（%s/"&RC[1]&"）" -> 累计通关精英副本80次（%s/80） | F361: 80 | H361: 1 | I361: 0 | J361: 0 | K361: 10089|10088 | L361: 3|10
A362: 13006 | B362: =INT(RC[-1]/1000) -> 13 | C362: 1 | D362: 1 | E362: ="累计通关精英副本"&RC[1]&"次（%s/"&RC[1]&"）" -> 累计通关精英副本120次（%s/120） | F362: 120 | H362: 1 | I362: 0 | J362: 0 | K362: 10089|10088 | L362: 4|10
A363: 13007 | B363: =INT(RC[-1]/1000) -> 13 | C363: 1 | D363: 1 | E363: ="累计通关精英副本"&RC[1]&"次（%s/"&RC[1]&"）" -> 累计通关精英副本160次（%s/160） | F363: 160 | H363: 1 | I363: 0 | J363: 0 | K363: 10089|10088 | L363: 5|10
A364: 13008 | B364: =INT(RC[-1]/1000) -> 13 | C364: 1 | D364: 1 | E364: ="累计通关精英副本"&RC[1]&"次（%s/"&RC[1]&"）" -> 累计通关精英副本240次（%s/240） | F364: 240 | H364: 1 | I364: 0 | J364: 0 | K364: 10089|10088 | L364: 6|20
A365: 13009 | B365: =INT(RC[-1]/1000) -> 13 | C365: 1 | D365: 1 | E365: ="累计通关精英副本"&RC[1]&"次（%s/"&RC[1]&"）" -> 累计通关精英副本320次（%s/320） | F365: 320 | H365: 1 | I365: 0 | J365: 0 | K365: 10089|10088 | L365: 7|20
A366: 13010 | B366: =INT(RC[-1]/1000) -> 13 | C366: 1 | D366: 1 | E366: ="累计通关精英副本"&RC[1]&"次（%s/"&RC[1]&"）" -> 累计通关精英副本400次（%s/400） | F366: 400 | H366: 1 | I366: 0 | J366: 0 | K366: 10089|10088 | L366: 8|20
A367: 14001 | B367: =INT(RC[-1]/1000) -> 14 | C367: 1 | D367: 1 | E367: ="累计战胜勇者试炼精英关卡"&RC[1]&"次（%s/"&RC[1]&"）" -> 累计战胜勇者试炼精英关卡1次（%s/1） | F367: 1 | H367: 1 | I367: 0 | J367: 0 | K367: 19003 | L367: 1 | O367: 战胜勇者试炼精英关卡
A368: 14002 | B368: =INT(RC[-1]/1000) -> 14 | C368: 1 | D368: 1 | E368: ="每日任务：战胜勇者试炼精英关卡"&RC[1]&"次（%s/"&RC[1]&"）" -> 每日任务：战胜勇者试炼精英关卡3次（%s/3） | F368: 3 | H368: 1 | I368: 0 | J368: 1 | K368: 10089|10088 | L368: 1|5
A369: 15001 | B369: =INT(RC[-1]/1000) -> 15 | C369: 1 | D369: 1 | E369: ="累计勇者试炼重置"&RC[1]&"次（%s/"&RC[1]&"）" -> 累计勇者试炼重置1次（%s/1） | F369: 1 | H369: 1 | I369: 0 | J369: 0 | K369: 19003 | L369: 1 | O369: 累计勇者试炼重置
A370: 15002 | B370: =INT(RC[-1]/1000) -> 15 | C370: 1 | D370: 1 | E370: ="每日任务：勇者试炼重置"&RC[1]&"次（%s/"&RC[1]&"）" -> 每日任务：勇者试炼重置2次（%s/2） | F370: 2 | H370: 1 | I370: 0 | J370: 1 | K370: 10089|10088 | L370: 1|5
A371: 15003 | B371: =INT(RC[-1]/1000) -> 15 | C371: 1 | D371: 1 | E371: ="累计勇者试炼重置"&RC[1]&"次（%s/"&RC[1]&"）" -> 累计勇者试炼重置1次（%s/1） | F371: 1 | H371: 1 | I371: 0 | J371: 0 | K371: 10000|10001 | L371: 1|1
A372: 15004 | B372: =INT(RC[-1]/1000) -> 15 | C372: 1 | D372: 1 | E372: ="累计勇者试炼重置"&RC[1]&"次（%s/"&RC[1]&"）" -> 累计勇者试炼重置3次（%s/3） | F372: 3 | H372: 1 | I372: 0 | J372: 0 | K372: 19103 | L372: 10
A373: 15005 | B373: =INT(RC[-1]/1000) -> 15 | C373: 1 | D373: 1 | E373: ="累计勇者试炼重置"&RC[1]&"次（%s/"&RC[1]&"）" -> 累计勇者试炼重置5次（%s/5） | F373: 5 | H373: 1 | I373: 0 | J373: 0 | K373: 42201 | L373: 5
A374: 15006 | B374: =INT(RC[-1]/1000) -> 15 | C374: 1 | D374: 1 | E374: ="累计勇者试炼重置"&RC[1]&"次（%s/"&RC[1]&"）" -> 累计勇者试炼重置7次（%s/7） | F374: 7 | H374: 1 | I374: 0 | J374: 0 | K374: 10021 | L374: 15
A375: 15007 | B375: =INT(RC[-1]/1000) -> 15 | C375: 1 | D375: 1 | E375: ="累计勇者试炼重置"&RC[1]&"次（%s/"&RC[1]&"）" -> 累计勇者试炼重置9次（%s/9） | F375: 9 | H375: 1 | I375: 0 | J375: 0 | K375: 10013 | L375: 30
A376: 16001 | B376: =INT(RC[-1]/1000) -> 16 | C376: 1 | D376: 1 | E376: ="累计讨伐叛军"&RC[1]&"次（%s/"&RC[1]&"）" -> 累计讨伐叛军1次（%s/1） | F376: 1 | H376: 1 | I376: 0 | J376: 0 | K376: 19003 | L376: 1 | O376: 累计讨伐叛军x=战斗次数
A377: 16002 | B377: =INT(RC[-1]/1000) -> 16 | C377: 1 | D377: 1 | E377: ="每日任务：讨伐叛军"&RC[1]&"次（%s/"&RC[1]&"）" -> 每日任务：讨伐叛军5次（%s/5） | F377: 5 | H377: 1 | I377: 0 | J377: 1 | K377: 10089|10088 | L377: 1|5 | O377: 累计讨伐叛军x=战斗次数
A378: 17001 | B378: =INT(RC[-1]/1000) -> 17 | C378: 1 | D378: 1 | E378: ="累计挑战无尽深渊"&RC[1]&"次（%s/"&RC[1]&"）" -> 累计挑战无尽深渊1次（%s/1） | F378: 1 | H378: 1 | I378: 0 | J378: 0 | K378: 19003 | L378: 1 | O378: 累计挑战深渊次数
A379: 18001 | B379: =INT(RC[-1]/1000) -> 18 | C379: 1 | D379: 1 | E379: ="累计挑战王者赛"&RC[1]&"次（%s/"&RC[1]&"）" -> 累计挑战王者赛1次（%s/1） | F379: 1 | H379: 1 | I379: 0 | J379: 0 | K379: 19003 | L379: 1 | O379: 累计挑战王者赛次数
A380: 19001 | B380: =INT(RC[-1]/1000) -> 19 | C380: 1 | D380: 1 | E380: ="在占卜系统中累计翻牌"&RC[1]&"次（%s/"&RC[1]&"）" -> 在占卜系统中累计翻牌1次（%s/1） | F380: 1 | H380: 1 | I380: 0 | J380: 0 | K380: 19003 | L380: 1 | O380: 累计翻卡次数（包括低级和高级）
A381: 20001 | B381: =INT(RC[-1]/1000) -> 20 | C381: 1 | D381: 1 | E381: ="在高级占卜中累计翻牌"&RC[1]&"次.（%s/"&RC[1]&"）" -> 在高级占卜中累计翻牌1次.（%s/1） | F381: 1 | H381: 1 | I381: 0 | J381: 0 | K381: 19003 | L381: 1 | O381: 累计高级翻卡次数
A382: 37000 | B382: 37 | C382: 1 | D382: 1 | E382: ="累计进行"&RC[1]&"次限时扭蛋（%s/"&RC[1]&"）" -> 累计进行2次限时扭蛋（%s/2） | F382: 2 | H382: 1 | I382: 0 | J382: 0 | K382: 19003 | L382: 1 | O382: 限时扭蛋
A383: 37001 | B383: 37 | C383: 1 | D383: 1 | E383: ="累计进行"&RC[1]&"次限时扭蛋（%s/"&RC[1]&"）" -> 累计进行5次限时扭蛋（%s/5） | F383: 5 | H383: 1 | I383: 0 | J383: 0 | K383: 19003 | L383: 1
A384: 37002 | B384: 37 | C384: 1 | D384: 1 | E384: ="累计进行"&RC[1]&"次限时扭蛋（%s/"&RC[1]&"）" -> 累计进行10次限时扭蛋（%s/10） | F384: 10 | H384: 1 | I384: 0 | J384: 0 | K384: 19003 | L384: 1
A385: 37003 | B385: 37 | C385: 1 | D385: 1 | E385: ="累计进行"&RC[1]&"次限时扭蛋（%s/"&RC[1]&"）" -> 累计进行20次限时扭蛋（%s/20） | F385: 20 | H385: 1 | I385: 0 | J385: 0 | K385: 19003 | L385: 1

Sheet: 11.限时掉落
A1: id| | B1: type|type | C1: drop_item_id|drop_item_id | D1: star_date|star_date | E1: over_date|over_date | F1: |drop_rate | G1: drop_num_min|drop_num_min | H1: drop_num_max|drop_num_max
A2: 不可空 | B2: 不可空 | C2: 不可空 | D2: 不可空 | E2: 不可空 | F2: 不可空 | G2: 不可空 | H2: 不可空
A3: 数字 | B3: 数字 | C3: 数字 | D3: 数字 | E3: 数字 | F3: 数字 | G3: 数字 | H3: 数字
A6: ID | B6: 副本类型 | C6: 掉落道具ID | D6: 开始日期 | E6: 结束日期 | F6: 掉落几率 | G6: 掉落数量下限 | H6: 掉落数量上限
A7: 1 | B7: 1 | C7: 10088 | D7: 20180215 | E7: 20180221 | F7: 3333 | G7: 1 | H7: 2
A8: 2 | B8: 3 | C8: 10088 | D8: 20180215 | E8: 20180221 | F8: 5000 | G8: 1 | H8: 3
A9: 3 | B9: 4 | C9: 10088 | D9: 20180215 | E9: 20180221 | F9: 5000 | G9: 1 | H9: 5
A10: 4 | B10: 999 | C10: 10088 | D10: 20180215 | E10: 20180221 | F10: 2500 | G10: 1 | H10: 3
A11: 5 | B11: 9999 | C11: 10088 | D11: 20180215 | E11: 20180221 | F11: 2500 | G11: 1 | H11: 3
A12: 6 | B12: 1 | C12: 10089 | D12: 20180215 | E12: 20180221 | F12: 500 | G12: 1 | H12: 1
A13: 7 | B13: 3 | C13: 10089 | D13: 20180215 | E13: 20180221 | F13: 500 | G13: 1 | H13: 1
A14: 8 | B14: 4 | C14: 10089 | D14: 20180215 | E14: 20180221 | F14: 500 | G14: 1 | H14: 1
A15: 9 | B15: 999 | C15: 10089 | D15: 20180215 | E15: 20180221 | F15: 500 | G15: 1 | H15: 1
A16: 10 | B16: 9999 | C16: 10089 | D16: 20180215 | E16: 20180221 | F16: 500 | G16: 1 | H16: 1
A17: 11 | B17: 1 | C17: 10085 | D17: 20180302 | E17: 20180306 | F17: 3333 | G17: 1 | H17: 2
A18: 12 | B18: 3 | C18: 10085 | D18: 20180302 | E18: 20180306 | F18: 5000 | G18: 1 | H18: 3
A19: 13 | B19: 4 | C19: 10085 | D19: 20180302 | E19: 20180306 | F19: 3333 | G19: 1 | H19: 5
A20: 14 | B20: 999 | C20: 10085 | D20: 20180302 | E20: 20180306 | F20: 2500 | G20: 1 | H20: 3
A21: 15 | B21: 9999 | C21: 10085 | D21: 20180302 | E21: 20180306 | F21: 2500 | G21: 1 | H21: 3
A22: 16 | B22: 1 | C22: 10086 | D22: 20180302 | E22: 20180306 | F22: 250 | G22: 1 | H22: 1
A23: 17 | B23: 3 | C23: 10086 | D23: 20180302 | E23: 20180306 | F23: 500 | G23: 1 | H23: 1
A24: 18 | B24: 4 | C24: 10086 | D24: 20180302 | E24: 20180306 | F24: 500 | G24: 1 | H24: 1
A25: 19 | B25: 999 | C25: 10086 | D25: 20180302 | E25: 20180306 | F25: 250 | G25: 1 | H25: 1
A26: 20 | B26: 9999 | C26: 10086 | D26: 20180302 | E26: 20180306 | F26: 250 | G26: 1 | H26: 1
A27: 21 | B27: 1 | C27: 10084 | D27: 20180501 | E27: 20180507 | F27: 3333 | G27: 5 | H27: 10
A28: 22 | B28: 3 | C28: 10084 | D28: 20180501 | E28: 20180507 | F28: 5000 | G28: 5 | H28: 15
A29: 23 | B29: 4 | C29: 10084 | D29: 20180501 | E29: 20180507 | F29: 3333 | G29: 10 | H29: 20
A30: 24 | B30: 999 | C30: 10084 | D30: 20180501 | E30: 20180507 | F30: 2500 | G30: 10 | H30: 15
A31: 25 | B31: 9999 | C31: 10084 | D31: 20180501 | E31: 20180507 | F31: 2500 | G31: 10 | H31: 15
A32: 26 | B32: 1 | C32: 10077 | D32: 20180616 | E32: 20180620 | F32: 3333 | G32: 1 | H32: 2
A33: 27 | B33: 3 | C33: 10077 | D33: 20180616 | E33: 20180620 | F33: 5000 | G33: 1 | H33: 3
A34: 28 | B34: 4 | C34: 10077 | D34: 20180616 | E34: 20180620 | F34: 5000 | G34: 1 | H34: 5
A35: 29 | B35: 999 | C35: 10077 | D35: 20180616 | E35: 20180620 | F35: 2500 | G35: 1 | H35: 3
A36: 30 | B36: 9999 | C36: 10077 | D36: 20180616 | E36: 20180620 | F36: 2500 | G36: 1 | H36: 3
A37: 31 | B37: 1 | C37: 10078 | D37: 20180616 | E37: 20180620 | F37: 500 | G37: 1 | H37: 1
A38: 32 | B38: 3 | C38: 10078 | D38: 20180616 | E38: 20180620 | F38: 500 | G38: 1 | H38: 1
A39: 33 | B39: 4 | C39: 10078 | D39: 20180616 | E39: 20180620 | F39: 500 | G39: 1 | H39: 1
A40: 34 | B40: 999 | C40: 10078 | D40: 20180616 | E40: 20180620 | F40: 500 | G40: 1 | H40: 1
A41: 35 | B41: 9999 | C41: 10078 | D41: 20180616 | E41: 20180620 | F41: 500 | G41: 1 | H41: 1
A42: 36 | B42: 1 | C42: 10073 | D42: 20180816 | E42: 20180823 | F42: 3333 | G42: 1 | H42: 2
A43: 37 | B43: 3 | C43: 10073 | D43: 20180816 | E43: 20180823 | F43: 5000 | G43: 1 | H43: 3
A44: 38 | B44: 4 | C44: 10073 | D44: 20180816 | E44: 20180823 | F44: 5000 | G44: 1 | H44: 5
A45: 39 | B45: 999 | C45: 10073 | D45: 20180816 | E45: 20180823 | F45: 2500 | G45: 1 | H45: 3
A46: 40 | B46: 9999 | C46: 10073 | D46: 20180816 | E46: 20180823 | F46: 2500 | G46: 1 | H46: 3
A47: 41 | B47: 1 | C47: 10074 | D47: 20180816 | E47: 20180823 | F47: 500 | G47: 1 | H47: 1
A48: 42 | B48: 3 | C48: 10074 | D48: 20180816 | E48: 20180823 | F48: 500 | G48: 1 | H48: 1
A49: 43 | B49: 4 | C49: 10074 | D49: 20180816 | E49: 20180823 | F49: 500 | G49: 1 | H49: 1
A50: 44 | B50: 999 | C50: 10074 | D50: 20180816 | E50: 20180823 | F50: 500 | G50: 1 | H50: 1
A51: 45 | B51: 9999 | C51: 10074 | D51: 20180816 | E51: 20180823 | F51: 500 | G51: 1 | H51: 1