Sheet: 配置
A1: 服务端文件名 | B1: 服务端对应工作表号 | C1: 客户端文件名 | D1: 客户端对应工作表号 | E1: erl头部 | F1: erl内容格式 | G1: erl尾部 | H1: 客户端特殊处理
A2: guild_war_star.txt | B2: 1 | C2: config_guild_war_star.cnf|GuildWarStar | D2: 1 | F2: get(star_id) -> #$ | H2: 2=>star_id
A3: guild_war_tower.txt | B3: 2 | C3: config_guild_war_tower.cnf|GuildWarTower | D3: 2 | F3: get(tower_id) -> #$ | H3: 2=>tower_id
A4: guild_war_rank_reward.txt | B4: 3 | C4: config_guild_rank_reward.cnf|GuildWarRankReward | D4: 3 | F4: get(rank_min) -> #$ | H4: 1=>rank_min,rank_max|reward_list
A5: guild_war_vs_reward.txt | B5: 4 | C5: config_guild_vs_reward.cnf|GuildWarVSReward | D5: 4 | F5: get(vs_type) -> #$ | H5: 1=>vs_type,vs_result|reward_list
A6: guild_war_vs_activity_time.txt | B6: 5 | C6: config_guild_vs_activity_time.cnf|GuildWarVSActivityTime | D6: 5 | F6: get(id) -> #$ | H6: 2=>id
A7: guild_war_common.txt | B7: 6 | C7: config_guild_war_common.cnf|GuildWarCommon | D7: 6 | F7: get(key) -> #$ | H7: 2=>key
A8: guild_war_region.txt | B8: 7 | F8: get(region_id) -> #$
A9: guild_war_organize_defence.txt | B9: 8 | F9: get(tower_type) -> #$

Sheet: 1.星球
A1: star_id|star_id | B1: name| | C1: star_type|star_type | D1: tower_list|tower_list | E1: map_id|map_id | F1: local_product_id_list|local_product_id_list | G1: local_product_num_list|local_product_num_list | H1: daily_reward_id_list|daily_reward_id_list | I1: daily_reward_num_list|daily_reward_num_list | J1: loser_reward_id_list|loser_reward_id_list | K1: loser_reward_num_list|loser_reward_num_list | L1: winner_reward_id_list|winner_reward_id_list | M1: winner_reward_num_list|winner_reward_num_list | N1: sp| | O1: sp_pos| | P1: sp_zorder| | Q1: sp_rotat| | R1: sp_scale| | S1: name_scale| | T1: name_pos| | U1: effects| | V1: effects_pos| | W1: effects_zorder| | X1: effects_rotat|
A2: 不可空 | B2: 不可空 | C2: 不可空 | D2: 可空#不需字段 | E2: 可空#不需字段 | F2: 可空#不需字段 | G2: 可空#不需字段 | H2: 可空#不需字段 | I2: 可空#不需字段 | J2: 可空#不需字段 | K2: 可空#不需字段 | L2: 可空#不需字段 | M2: 可空#不需字段 | N2: 不可空 | O2: 不可空 | P2: 可空#不需字段 | Q2: 可空#不需字段 | R2: 可空#不需字段 | S2: 可空#不需字段 | T2: 不可空 | U2: 可空#不需字段 | V2: 可空#不需字段 | W2: 可空#不需字段 | X2: 可空#不需字段
A3: 数字 | B3: 字符串 | C3: 数字 | D3: 一维数组 | E3: 数字 | F3: 一维数组 | G3: 一维数组 | H3: 一维数组 | I3: 一维数组 | J3: 一维数组 | K3: 一维数组 | L3: 一维数组 | M3: 一维数组 | N3: 一维数组 | O3: 二维数组 | P3: 一维数组 | Q3: 一维数组 | R3: 一维数组 | S3: 数字 | T3: 一维数组 | U3: 一维数组 | V3: 二维数组 | W3: 一维数组 | X3: 一维数组
D4: 不定长 | F4: 不定长 | G4: 不定长 | H4: 不定长 | I4: 不定长 | J4: 不定长 | K4: 不定长 | L4: 不定长 | M4: 不定长 | N4: 不定长 | O4: 不定长 | P4: 不定长 | Q4: 不定长 | R4: 不定长 | T4: 不定长 | U4: 不定长 | V4: 不定长 | W4: 不定长 | X4: 不定长
A6: 星球 | B6: 星球名 | C6: 星球类型 | D6: 星球塔列表 | E6: 关卡地图ID(积分模式) | F6: 特产ID列表 | G6: 特产数量列表 | H6: 每日奖励ID列表(对战模式) | I6: 每日奖励数量列表(对战模式) | J6: 挑战失败奖励ID列表(积分模式) | K6: 挑战失败奖励数量列表(积分模式) | L6: 挑战胜利奖励ID列表(积分模式) | M6: 挑战胜利奖励数量列表(积分模式) | N6: 图片 | O6: 图片坐标 | P6: 图片层级 | Q6: 图片旋转 | R6: 图片缩放 | S6: 字号 | T6: 名字坐标 | U6: 特效 | V6: 特效坐标 | W6: 特效层级 | X6: 特效旋转
A7: 1 | B7: 艾欧 | C7: 1 | E7: 3010 | F7: 19103|19034|19020 | G7: 10|900|100 | J7: 19034 | K7: 50 | L7: 19034 | M7: 100 | N7: "union_star_1"|"sp_name_frame_1" | O7: -550|-200#0|-25 | P7: 1|2 | Q7: 0|0 | R7: 0.15|0.8 | S7: 12 | T7: 5|-20
A8: 2 | B8: 穆斯塔法 | C8: 1 | E8: 3020 | F8: 19006|19034|19020 | G8: 110|1000|100 | J8: 19034 | K8: 50 | L8: 19034 | M8: 100 | N8: "union_star_2"|"sp_name_frame_1" | O8: -350|-150#0|-25 | P8: 1|2 | Q8: 0|0 | R8: 0.15|0.8 | S8: 12 | T8: 5|-20
A9: 3 | B9: 泰坦 | C9: 1 | E9: 3030 | F9: 19013|19034|19020 | G9: 1200|1100|100 | J9: 19034 | K9: 50 | L9: 19034 | M9: 100 | N9: "union_star_3"|"sp_name_frame_1" | O9: -150|-200#0|-25 | P9: 1|2 | Q9: 0|0 | R9: 0.15|0.8 | S9: 12 | T9: 5|-20
A10: 4 | B10: 玛斯 | C10: 2 | E10: 3040 | F10: 19014|19034|19020 | G10: 1500|1500|100 | J10: 19034 | K10: 50 | L10: 19034 | M10: 100 | N10: "union_star_4"|"sp_name_frame_2" | O10: 50|-150#0|-25 | P10: 1|2 | Q10: 0|0 | R10: 0.16|0.85 | S10: 12 | T10: 5|-20
A11: 5 | B11: 艾尔 | C11: 2 | E11: 3050 | F11: 19028|19034|19020 | G11: 160|1600|100 | J11: 19034 | K11: 50 | L11: 19034 | M11: 100 | N11: "union_star_5"|"sp_name_frame_2" | O11: 250|-200#0|-25 | P11: 1|2 | Q11: 0|0 | R11: 0.16|0.85 | S11: 12 | T11: 5|-20
A12: 6 | B12: 克洛诺斯 | C12: 2 | E12: 3060 | F12: 19030|19034|19020 | G12: 1700|1700|100 | J12: 19034 | K12: 50 | L12: 19034 | M12: 100 | N12: "union_star_6"|"sp_name_frame_2" | O12: 450|-150#0|-25 | P12: 1|2 | Q12: 0|0 | R12: 0.16|0.85 | S12: 12 | T12: 5|-20
A13: 7 | B13: 希罗 | C13: 3 | D13: 71|72|73|74 | H13: 19017|19034|19020 | I13: 200|2500|200 | N13: "union_star_7"|"sp_name_frame_3" | O13: -400|100#0|-30 | P13: 1|2 | Q13: 0|0 | R13: 0.2|0.9 | S13: 14 | T13: 5|-25
A14: 8 | B14: 尼福尔海姆 | C14: 3 | D14: 81|82|83|84 | H14: 19031|19034|19020 | I14: 200|3000|200 | N14: "union_star_8"|"sp_name_frame_3" | O14: -100|200#0|-30 | P14: 1|2 | Q14: 0|0 | R14: 0.2|0.9 | S14: 14 | T14: 5|-25
A15: 9 | B15: 阿瓦隆 | C15: 4 | D15: 91|92|93|94 | H15: 19032|19034|19020 | I15: 250|4000|200 | N15: "union_star_9"|"sp_name_frame_4" | O15: 200|100#0|-35 | P15: 1|2 | Q15: 0|0 | R15: 0.22|0.95 | S15: 14 | T15: 5|-30
A16: 10 | B16: 克哈 | C16: 4 | D16: 101|102|103|104 | H16: 19005|19034|19020 | I16: 250|5000|200 | N16: "union_star_10"|"sp_name_frame_4" | O16: 500|200#0|-35 | P16: 1|2 | Q16: 0|0 | R16: 0.22|0.95 | S16: 14 | T16: 5|-30

Sheet: 2.星球塔
A1: tower_id|tower_id | B1: name| | C1: icon| | D1: pos| | E1: icon_scale| | F1: hp_scale| | G1: hp_pos| | H1: tower_type|tower_type | I1: map_id|map_id | J1: monster_defense_times|monster_defense_times | K1: defender_num_max|defender_num_max | L1: role_defense_times|role_defense_times | M1: druability|durability | N1: break_tower_reward_id_list|break_tower_reward_id_list | O1: break_tower_reward_num_list|break_tower_reward_num_list | P1: loser_reward_id_list|loser_reward_id_list | Q1: loser_reward_num_list|loser_reward_num_list | R1: winner_reward_id_list|winner_reward_id_list | S1: winner_reward_num_list|winner_reward_num_list
A2: 不可空 | B2: 不可空 | C2: 不可空 | D2: 不可空 | E2: 不可空 | F2: 不可空 | G2: 不可空 | H2: 不可空 | I2: 不可空 | J2: 不可空 | K2: 不可空 | L2: 不可空 | M2: 不可空 | N2: 可空#不需字段 | O2: 可空#不需字段 | P2: 可空#不需字段 | Q2: 可空#不需字段 | R2: 可空#不需字段 | S2: 可空#不需字段
A3: 数字 | B3: 字符串 | C3: 字符串 | D3: 一维数组 | E3: 数字 | F3: 数字 | G3: 一维数组 | H3: 数字 | I3: 数字 | J3: 数字 | K3: 数字 | L3: 数字 | M3: 数字 | N3: 一维数组 | O3: 一维数组 | P3: 一维数组 | Q3: 一维数组 | R3: 一维数组 | S3: 一维数组
D4: 不定长 | G4: 不定长 | N4: 不定长 | O4: 不定长 | P4: 不定长 | Q4: 不定长 | R4: 不定长 | S4: 不定长
A6: 塔ID | B6: 名称 | C6: 图标 | D6: 坐标 | E6: 图标大小 | F6: 血条大小 | G6: 坐标 | H6: 塔类型 | I6: 关卡地图ID | J6: 怪物防守次数 | K6: 驻守人数上限 | L6: 角色防守次数 | M6: 耐久度 | N6: 攻破塔奖励ID列表 | O6: 攻破塔奖励数量列表 | P6: 挑战失败奖励ID列表 | Q6: 挑战失败奖励数量列表 | R6: 挑战胜利奖励ID列表 | S6: 挑战胜利奖励数量列表
A7: 71 | B7: 希罗星球基地 | C7: sp_base | D7: 100|100 | E7: 0.5 | F7: 2 | G7: 0|0 | H7: 1 | I7: 3070 | J7: =RC[1]*RC[2]/2 -> 50 | K7: 10 | L7: 10 | M7: 20000 | N7: 19034 | O7: 1000 | P7: 19034 | Q7: 100 | R7: 19034 | S7: 200
A8: 72 | B8: 上路防御塔 | C8: sp_above | D8: "-300"|100 | E8: 0.5 | F8: 1 | G8: 0|0 | H8: 2 | I8: 3071 | J8: =RC[1]*RC[2]/2 -> 15 | K8: 3 | L8: 10 | M8: 5000 | N8: 19034 | O8: 500 | P8: 19034 | Q8: 100 | R8: 19034 | S8: 200
A9: 73 | B9: 中路防御塔 | C9: sp_middle | D9: "-300"|"-200" | E9: 0.5 | F9: 1 | G9: 0|0 | H9: 3 | I9: 3072 | J9: =RC[1]*RC[2]/2 -> 15 | K9: 3 | L9: 10 | M9: 5000 | N9: 19034 | O9: 500 | P9: 19034 | Q9: 100 | R9: 19034 | S9: 200
A10: 74 | B10: 下路防御塔 | C10: sp_below | D10: 100|"-200" | E10: 0.5 | F10: 1 | G10: 0|0 | H10: 4 | I10: 3073 | J10: =RC[1]*RC[2]/2 -> 15 | K10: 3 | L10: 10 | M10: 5000 | N10: 19034 | O10: 500 | P10: 19034 | Q10: 100 | R10: 19034 | S10: 200
A11: 81 | B11: 尼福尔海姆星球基地 | C11: sp_base | D11: 100|100 | E11: 0.5 | F11: 2 | G11: 0|0 | H11: 1 | I11: 3080 | J11: =RC[1]*RC[2]/2 -> 50 | K11: 10 | L11: 10 | M11: 20000 | N11: 19034 | O11: 1000 | P11: 19034 | Q11: 100 | R11: 19034 | S11: 200
A12: 82 | B12: 上路防御塔 | C12: sp_above | D12: "-300"|100 | E12: 0.5 | F12: 1 | G12: 0|0 | H12: 2 | I12: 3081 | J12: =RC[1]*RC[2]/2 -> 15 | K12: 3 | L12: 10 | M12: 5000 | N12: 19034 | O12: 500 | P12: 19034 | Q12: 100 | R12: 19034 | S12: 200
A13: 83 | B13: 中路防御塔 | C13: sp_middle | D13: "-300"|"-200" | E13: 0.5 | F13: 1 | G13: 0|0 | H13: 3 | I13: 3082 | J13: =RC[1]*RC[2]/2 -> 15 | K13: 3 | L13: 10 | M13: 5000 | N13: 19034 | O13: 500 | P13: 19034 | Q13: 100 | R13: 19034 | S13: 200
A14: 84 | B14: 下路防御塔 | C14: sp_below | D14: 100|"-200" | E14: 0.5 | F14: 1 | G14: 0|0 | H14: 4 | I14: 3083 | J14: =RC[1]*RC[2]/2 -> 15 | K14: 3 | L14: 10 | M14: 5000 | N14: 19034 | O14: 500 | P14: 19034 | Q14: 100 | R14: 19034 | S14: 200
A15: 91 | B15: 阿瓦隆星球基地 | C15: sp_base | D15: 100|100 | E15: 0.5 | F15: 2 | G15: 0|0 | H15: 1 | I15: 3090 | J15: =RC[1]*RC[2]/2 -> 50 | K15: 10 | L15: 10 | M15: 20000 | N15: 19034 | O15: 1000 | P15: 19034 | Q15: 100 | R15: 19034 | S15: 200
A16: 92 | B16: 上路防御塔 | C16: sp_above | D16: "-300"|100 | E16: 0.5 | F16: 1 | G16: 0|0 | H16: 2 | I16: 3091 | J16: =RC[1]*RC[2]/2 -> 15 | K16: 3 | L16: 10 | M16: 5000 | N16: 19034 | O16: 500 | P16: 19034 | Q16: 100 | R16: 19034 | S16: 200
A17: 93 | B17: 中路防御塔 | C17: sp_middle | D17: "-300"|"-200" | E17: 0.5 | F17: 1 | G17: 0|0 | H17: 3 | I17: 3092 | J17: =RC[1]*RC[2]/2 -> 15 | K17: 3 | L17: 10 | M17: 5000 | N17: 19034 | O17: 500 | P17: 19034 | Q17: 100 | R17: 19034 | S17: 200
A18: 94 | B18: 下路防御塔 | C18: sp_below | D18: 100|"-200" | E18: 0.5 | F18: 1 | G18: 0|0 | H18: 4 | I18: 3093 | J18: =RC[1]*RC[2]/2 -> 15 | K18: 3 | L18: 10 | M18: 5000 | N18: 19034 | O18: 500 | P18: 19034 | Q18: 100 | R18: 19034 | S18: 200
A19: 101 | B19: 克哈星球基地 | C19: sp_base | D19: 100|100 | E19: 0.5 | F19: 2 | G19: 0|0 | H19: 1 | I19: 3100 | J19: =RC[1]*RC[2]/2 -> 50 | K19: 10 | L19: 10 | M19: 20000 | N19: 19034 | O19: 1000 | P19: 19034 | Q19: 100 | R19: 19034 | S19: 200
A20: 102 | B20: 上路防御塔 | C20: sp_above | D20: "-300"|100 | E20: 0.5 | F20: 1 | G20: 0|0 | H20: 2 | I20: 3101 | J20: =RC[1]*RC[2]/2 -> 15 | K20: 3 | L20: 10 | M20: 5000 | N20: 19034 | O20: 500 | P20: 19034 | Q20: 100 | R20: 19034 | S20: 200
A21: 103 | B21: 中路防御塔 | C21: sp_middle | D21: "-300"|"-200" | E21: 0.5 | F21: 1 | G21: 0|0 | H21: 3 | I21: 3102 | J21: =RC[1]*RC[2]/2 -> 15 | K21: 3 | L21: 10 | M21: 5000 | N21: 19034 | O21: 500 | P21: 19034 | Q21: 100 | R21: 19034 | S21: 200
A22: 104 | B22: 下路防御塔 | C22: sp_below | D22: 100|"-200" | E22: 0.5 | F22: 1 | G22: 0|0 | H22: 4 | I22: 3103 | J22: =RC[1]*RC[2]/2 -> 15 | K22: 3 | L22: 10 | M22: 5000 | N22: 19034 | O22: 500 | P22: 19034 | Q22: 100 | R22: 19034 | S22: 200

Sheet: 3.排名奖励
A1: rank_min|rank_min | B1: rank_max|rank_max | C1: reward_id_list|reward_id_list | D1: reward_num_list|reward_num_list
A2: 不可空 | B2: 不可空 | C2: 可空#不需字段 | D2: 可空#不需字段
A3: 数字 | B3: 数字 | C3: 一维数组 | D3: 一维数组
C4: 不定长 | D4: 不定长
A6: 排名下限 | B6: 排行上限 | C6: 奖励ID列表 | D6: 奖励数量列表
A7: 1 | B7: 1 | C7: 19034 | D7: 10000
A8: 2 | B8: 3 | C8: 19034 | D8: 8000
A9: 4 | B9: 10 | C9: 19034 | D9: 6000
A10: 11 | B10: 20 | C10: 19034 | D10: 4000
A11: 21 | B11: 50 | C11: 19034 | D11: 3000
A12: 51 | B12: 100 | C12: 19034 | D12: 2000

Sheet: 4.对战奖励
A1: vs_type|vs_type | B1: vs_result|vs_result | C1: break_tower_num_list|break_tower_num_list | D1: reward_id_list|reward_id_list | E1: reward_num_list|reward_num_list
A2: 不可空 | B2: 不可空 | C2: 可空#不需字段 | D2: 可空#不需字段 | E2: 可空#不需字段
A3: 数字 | B3: 数字 | C3: 一维数组 | D3: 二维数组 | E3: 二维数组
C4: 不定长 | D4: 不定长 | E4: 不定长
A6: 对战类型 | B6: 对战结果 | C6: 攻破的塔数量 | D6: 奖励ID列表 | E6: 奖励数量列表
A7: 1 | B7: 1 | D7: 19034 | E7: 5000
A8: 1 | B8: 0 | C8: 0|1|2|3 | D8: 19034#19034#19034#19034 | E8: 100#1000#2000#3000
A9: 2 | B9: 1 | D9: 19034 | E9: 2000
A10: 2 | B10: 0 | D10: 19034 | E10: 500

Sheet: 5.对战活动时间
A1: id| | B1: time_type|time_type | C1: take_reward_time|take_reward_time_list | D1: decide_attacker_time|decide_attacker_time | E1: begin_time|begin_time | F1: end_time|end_time
A2: 不可空 | B2: 不可空 | C2: 可空#不需字段 | D2: 可空#不需字段 | E2: 可空#不需字段 | F2: 可空#不需字段
A3: 数字 | B3: 数字 | C3: 一维数组 | D3: 数字 | E3: 数字 | F3: 数字
C4: 不定长
A6: id | B6: 时间类型 | C6: 领取奖励时间 | D6: 决定攻击者时间 | E6: 开始时间 | F6: 结束时间
A7: 1 | B7: 1 | E7: 11000 | F7: 22000
A8: 2 | B8: 1 | E8: 41000 | F8: 52000
A9: 3 | B9: 2 | E9: 30900 | F9: 32100
A10: 4 | B10: 2 | E10: 60900 | F10: 62100
A11: 5 | B11: 3 | D11: 30000
A12: 6 | B12: 3 | D12: 60000
A13: 7 | B13: 4 | C13: 1|2|4|5|7

Sheet: 6.杂项配置
A1: key|key | B1: int_value|int_value | C1: list_value|list_value
A2: 不可空 | B2: 可空#不需字段 | C2: 可空#不需字段
A3: 数字 | B3: 数字 | C3: 字符串
A6: key | B6: 数字值 | C6: 列表值 | D6: 备注
A7: 1 | B7: 5 | D7: 玩家每天可攻打次数
A8: 2 | B8: 3 | D8: 一个军团可对多个星球同时进行宣战数量
A9: 3 | B9: 10 | D9: 一个星球同时可接受多个军团宣战数量
A10: 4 | B10: 1430 | D10: 积分模式每日结算归属时间点
A11: 5 | B11: 0 | D11: 积分模式每日挑战开始时间点
A12: 6 | B12: 1400 | D12: 积分模式每日挑战结束时间点
A13: 7 | B13: 1430 | D13: 积分模式每日领取奖励开始时间点
A14: 8 | B14: 2359 | D14: 积分模式每日领取奖励结束时间点
A15: 10 | B15: 50 | D15: 购买高级星球挑战次数消耗的钻石
A16: 11 | B16: 6 | D16: 一键领取星球奖励需要的vip等级
A17: 12 | B17: 3 | D17: 购买高级星球挑战次数上限
A18: 13 | B18: 2 | D18: 一个军团可占领的星球的数量
A19: 14 | B19: 10 | D19: 星空图倾斜角度
A20: 15 | B20: 600 | D20: 拖动范围右
A21: 16 | B21: -600 | D21: 拖动范围左
A22: 17 | B22: -390 | D22: 拖动范围下
A23: 18 | B23: 390 | D23: 拖动范围上
A24: 19 | B24: 2 | D24: 星空图缩放

Sheet: 7.工会战大区配置
A1: |region_id | B1: |server_id_list
A2: 不可空 | B2: 可空#不需字段
A3: 数字 | B3: 一维数组
B4: 不定长
A6: 大区ID | B6: 服务器列表
A7: 1 | B7: 1|2|3|4|5
A8: 2 | B8: 6|7|8|9|10
A9: 3 | B9: 11|12|13|14|15
A10: 4 | B10: 16|17|18|19|20|21

Sheet: 8.布防配置
A1: |tower_type | B1: |power_idx_list
A2: 不可空 | B2: 可空#不需字段
A3: 数字 | B3: 一维数组
B4: 不定长
A6: 塔类型 | B6: 战力索引列表
A7: 1 | B7: 1|5|6|7|8|9|10|11|12|13
A8: 2 | B8: 2|14|17
A9: 3 | B9: 3|15|18
A10: 4 | B10: 4|16|19