Sheet: 配置
A1: 服务端文件名 | B1: 服务端对应工作表号 | C1: 客户端文件名 | D1: 客户端对应工作表号 | E1: erl头部 | F1: erl内容格式 | G1: erl尾部 | H1: 客户端特殊处理
A2: config_tower_chapter.txt | B2: 1 | C2: config_tower_chapter.cnf|TowerChapter | D2: 1 | F2: get(chapter) -> #$ | H2: 2=>chapter
A3: config_tower_map.txt | B3: 2 | C3: config_tower_gamelevel.cnf|TowerGameLevel | D3: 2 | F3: get(map) -> #$ | H3: 2=>game_level
A4: config_tower_star_goods.txt | B4: 3 | C4: config_tower_star_goods.cnf|TowerStarGoods | D4: 3 | F4: get(star_min) -> #$ | H4: 2=>star_min
A5: config_tower_elite_map.txt | B5: 4 | C5: config_tower_elite_map.cnf|TowerEliteMap | D5: 4 | F5: get(level) -> #$ | H5: 2=>level
A6: config_tower_rand_pro.txt | B6: 5 | C6: config_tower_rand_pro.cnf|TowerRandPro | D6: 5 | F6: get(star) -> #$ | H6: 2=>star
A7: config_tower_shop.txt | B7: 6 | C7: config_tower_shop.cnf|TowerShop | D7: 6 | F7: get(id) -> #$ | H7: 2=>id

Sheet: 1.爬塔章节
A1: chapter|chapter | B1: name| | C1: map_list|map_list | D1: star_list|star_list | E1: star_award_id_list|star_award_id_list | F1: star_award_num_list|star_award_num_list | G1: win_describe|
A2: 不可空 | B2: 不可空 | C2: 不可空 | D2: 不可空 | E2: 不可空 | F2: 不可空 | G2: 不可空
A3: 数字 | B3: 字符串 | C3: 一维数组 | D3: 一维数组 | E3: 二维数组 | F3: 二维数组 | G3: 字符串
C4: 不定长 | D4: 不定长 | E4: 不定长 | F4: 不定长
A6: 章节 | B6: 名称 | C6: 章节包括的关卡 | D6: 星数列表 | E6: 星数对应奖励的对象Id | F6: 星数对应奖励的对象数量 | G6: 获胜条件描述
A7: 1 | B7: 无尽之塔1层 | C7: =RC[-2]*3-2&"|"&RC[-2]*3-1&"|"&RC[-2]*3 -> 1|2|3 | D7: 3|6|9 | E7: =RC[3]&IF(RC[8]=0,"","|"&RC[7])&"#"&RC[3]&IF(RC[9]=0,"","|"&RC[7])&"#"&RC[3]&"|"&RC[7] -> 19012#19012|13001#19012|13001 | F7: =RC[3]&IF(RC[7]=0,"","|"&RC[7])&"#"&RC[4]&IF(RC[8]=0,"","|"&RC[8])&"#"&RC[5]&"|"&RC[9] -> 60#100|1#200|1 | G7: 肥猪丹来爬塔表找配置 | H7: 19012 | I7: 60 | J7: 100 | K7: 200 | L7: 13001 | M7: 0 | N7: 1 | O7: 1
A8: 2 | B8: 无尽之塔2层 | C8: =RC[-2]*3-2&"|"&RC[-2]*3-1&"|"&RC[-2]*3 -> 4|5|6 | D8: 3|6|9 | E8: =RC[3]&IF(RC[8]=0,"","|"&RC[7])&"#"&RC[3]&IF(RC[9]=0,"","|"&RC[7])&"#"&RC[3]&"|"&RC[7] -> 19012#19012|13001#19012|13001 | F8: =RC[3]&IF(RC[7]=0,"","|"&RC[7])&"#"&RC[4]&IF(RC[8]=0,"","|"&RC[8])&"#"&RC[5]&"|"&RC[9] -> 60#100|1#200|1 | G8: 肥猪丹来爬塔表找配置 | H8: 19012 | I8: 60 | J8: 100 | K8: 200 | L8: 13001 | M8: 0 | N8: 1 | O8: 1
A9: 3 | B9: 无尽之塔3层 | C9: =RC[-2]*3-2&"|"&RC[-2]*3-1&"|"&RC[-2]*3 -> 7|8|9 | D9: 3|6|9 | E9: =RC[3]&IF(RC[8]=0,"","|"&RC[7])&"#"&RC[3]&IF(RC[9]=0,"","|"&RC[7])&"#"&RC[3]&"|"&RC[7] -> 19012#19012|13001#19012|13001 | F9: =RC[3]&IF(RC[7]=0,"","|"&RC[7])&"#"&RC[4]&IF(RC[8]=0,"","|"&RC[8])&"#"&RC[5]&"|"&RC[9] -> 60#100|1#200|1 | G9: 肥猪丹来爬塔表找配置 | H9: 19012 | I9: 60 | J9: 100 | K9: 200 | L9: 13001 | M9: 0 | N9: 1 | O9: 1
A10: 4 | B10: 无尽之塔4层 | C10: =RC[-2]*3-2&"|"&RC[-2]*3-1&"|"&RC[-2]*3 -> 10|11|12 | D10: 3|6|9 | E10: =RC[3]&IF(RC[8]=0,"","|"&RC[7])&"#"&RC[3]&IF(RC[9]=0,"","|"&RC[7])&"#"&RC[3]&"|"&RC[7] -> 10011|13001#10011|13001#10011|13001 | F10: =RC[3]&IF(RC[7]=0,"","|"&RC[7])&"#"&RC[4]&IF(RC[8]=0,"","|"&RC[8])&"#"&RC[5]&"|"&RC[9] -> 2|1#4|1#6|2 | G10: 肥猪丹来爬塔表找配置 | H10: 10011 | I10: 2 | J10: 4 | K10: 6 | L10: 13001 | M10: 1 | N10: 1 | O10: 2
A11: 5 | B11: 无尽之塔5层 | C11: =RC[-2]*3-2&"|"&RC[-2]*3-1&"|"&RC[-2]*3 -> 13|14|15 | D11: 3|6|9 | E11: =RC[3]&IF(RC[8]=0,"","|"&RC[7])&"#"&RC[3]&IF(RC[9]=0,"","|"&RC[7])&"#"&RC[3]&"|"&RC[7] -> 10011|13001#10011|13001#10011|13001 | F11: =RC[3]&IF(RC[7]=0,"","|"&RC[7])&"#"&RC[4]&IF(RC[8]=0,"","|"&RC[8])&"#"&RC[5]&"|"&RC[9] -> 2|1#4|1#6|2 | G11: 肥猪丹来爬塔表找配置 | H11: 10011 | I11: 2 | J11: 4 | K11: 6 | L11: 13001 | M11: 1 | N11: 1 | O11: 2
A12: 6 | B12: 无尽之塔6层 | C12: =RC[-2]*3-2&"|"&RC[-2]*3-1&"|"&RC[-2]*3 -> 16|17|18 | D12: 3|6|9 | E12: =RC[3]&IF(RC[8]=0,"","|"&RC[7])&"#"&RC[3]&IF(RC[9]=0,"","|"&RC[7])&"#"&RC[3]&"|"&RC[7] -> 10011|13002#10011|13002#10011|13002 | F12: =RC[3]&IF(RC[7]=0,"","|"&RC[7])&"#"&RC[4]&IF(RC[8]=0,"","|"&RC[8])&"#"&RC[5]&"|"&RC[9] -> 2|1#4|1#6|1 | G12: 肥猪丹来爬塔表找配置 | H12: 10011 | I12: 2 | J12: 4 | K12: 6 | L12: 13002 | M12: 1 | N12: 1 | O12: 1
A13: 7 | B13: 无尽之塔7层 | C13: =RC[-2]*3-2&"|"&RC[-2]*3-1&"|"&RC[-2]*3 -> 19|20|21 | D13: 3|6|9 | E13: =RC[3]&IF(RC[8]=0,"","|"&RC[7])&"#"&RC[3]&IF(RC[9]=0,"","|"&RC[7])&"#"&RC[3]&"|"&RC[7] -> 10011|10012#10011|10012#10011|10012 | F13: =RC[3]&IF(RC[7]=0,"","|"&RC[7])&"#"&RC[4]&IF(RC[8]=0,"","|"&RC[8])&"#"&RC[5]&"|"&RC[9] -> 3|3#5|5#8|8 | G13: 肥猪丹来爬塔表找配置 | H13: 10011 | I13: 3 | J13: 5 | K13: 8 | L13: 10012 | M13: 3 | N13: 5 | O13: 8
A14: 8 | B14: 无尽之塔8层 | C14: =RC[-2]*3-2&"|"&RC[-2]*3-1&"|"&RC[-2]*3 -> 22|23|24 | D14: 3|6|9 | E14: =RC[3]&IF(RC[8]=0,"","|"&RC[7])&"#"&RC[3]&IF(RC[9]=0,"","|"&RC[7])&"#"&RC[3]&"|"&RC[7] -> 10011|10012#10011|10012#10011|10012 | F14: =RC[3]&IF(RC[7]=0,"","|"&RC[7])&"#"&RC[4]&IF(RC[8]=0,"","|"&RC[8])&"#"&RC[5]&"|"&RC[9] -> 3|3#5|5#8|8 | G14: 肥猪丹来爬塔表找配置 | H14: 10011 | I14: 3 | J14: 5 | K14: 8 | L14: 10012 | M14: 3 | N14: 5 | O14: 8
A15: 9 | B15: 无尽之塔9层 | C15: =RC[-2]*3-2&"|"&RC[-2]*3-1&"|"&RC[-2]*3 -> 25|26|27 | D15: 3|6|9 | E15: =RC[3]&IF(RC[8]=0,"","|"&RC[7])&"#"&RC[3]&IF(RC[9]=0,"","|"&RC[7])&"#"&RC[3]&"|"&RC[7] -> 10011|13002#10011|13002#10011|13002 | F15: =RC[3]&IF(RC[7]=0,"","|"&RC[7])&"#"&RC[4]&IF(RC[8]=0,"","|"&RC[8])&"#"&RC[5]&"|"&RC[9] -> 3|1#5|1#8|1 | G15: 肥猪丹来爬塔表找配置 | H15: 10011 | I15: 3 | J15: 5 | K15: 8 | L15: 13002 | M15: 1 | N15: 1 | O15: 1
A16: 10 | B16: 无尽之塔10层 | C16: =RC[-2]*3-2&"|"&RC[-2]*3-1&"|"&RC[-2]*3 -> 28|29|30 | D16: 3|6|9 | E16: =RC[3]&IF(RC[8]=0,"","|"&RC[7])&"#"&RC[3]&IF(RC[9]=0,"","|"&RC[7])&"#"&RC[3]&"|"&RC[7] -> 10010|10013#10010|10013#10010|10013 | F16: =RC[3]&IF(RC[7]=0,"","|"&RC[7])&"#"&RC[4]&IF(RC[8]=0,"","|"&RC[8])&"#"&RC[5]&"|"&RC[9] -> 2|2#4|3#6|5 | G16: 肥猪丹来爬塔表找配置 | H16: 10010 | I16: 2 | J16: 4 | K16: 6 | L16: 10013 | M16: 2 | N16: 3 | O16: 5
A17: 11 | B17: 无尽之塔11层 | C17: =RC[-2]*3-2&"|"&RC[-2]*3-1&"|"&RC[-2]*3 -> 31|32|33 | D17: 3|6|9 | E17: =RC[3]&IF(RC[8]=0,"","|"&RC[7])&"#"&RC[3]&IF(RC[9]=0,"","|"&RC[7])&"#"&RC[3]&"|"&RC[7] -> 10010|10013#10010|10013#10010|10013 | F17: =RC[3]&IF(RC[7]=0,"","|"&RC[7])&"#"&RC[4]&IF(RC[8]=0,"","|"&RC[8])&"#"&RC[5]&"|"&RC[9] -> 2|2#4|3#6|5 | G17: 肥猪丹来爬塔表找配置 | H17: 10010 | I17: 2 | J17: 4 | K17: 6 | L17: 10013 | M17: 2 | N17: 3 | O17: 5
A18: 12 | B18: 无尽之塔12层 | C18: =RC[-2]*3-2&"|"&RC[-2]*3-1&"|"&RC[-2]*3 -> 34|35|36 | D18: 3|6|9 | E18: =RC[3]&IF(RC[8]=0,"","|"&RC[7])&"#"&RC[3]&IF(RC[9]=0,"","|"&RC[7])&"#"&RC[3]&"|"&RC[7] -> 10010|13007#10010|13007#10010|13007 | F18: =RC[3]&IF(RC[7]=0,"","|"&RC[7])&"#"&RC[4]&IF(RC[8]=0,"","|"&RC[8])&"#"&RC[5]&"|"&RC[9] -> 2|1#4|1#6|1 | G18: 肥猪丹来爬塔表找配置 | H18: 10010 | I18: 2 | J18: 4 | K18: 6 | L18: 13007 | M18: 1 | N18: 1 | O18: 1
A19: 13 | B19: 无尽之塔13层 | C19: =RC[-2]*3-2&"|"&RC[-2]*3-1&"|"&RC[-2]*3 -> 37|38|39 | D19: 3|6|9 | E19: =RC[3]&IF(RC[8]=0,"","|"&RC[7])&"#"&RC[3]&IF(RC[9]=0,"","|"&RC[7])&"#"&RC[3]&"|"&RC[7] -> 10010|10013#10010|10013#10010|10013 | F19: =RC[3]&IF(RC[7]=0,"","|"&RC[7])&"#"&RC[4]&IF(RC[8]=0,"","|"&RC[8])&"#"&RC[5]&"|"&RC[9] -> 4|2#7|4#10|6 | G19: 肥猪丹来爬塔表找配置 | H19: 10010 | I19: 4 | J19: 7 | K19: 10 | L19: 10013 | M19: 2 | N19: 4 | O19: 6
A20: 14 | B20: 无尽之塔14层 | C20: =RC[-2]*3-2&"|"&RC[-2]*3-1&"|"&RC[-2]*3 -> 40|41|42 | D20: 3|6|9 | E20: =RC[3]&IF(RC[8]=0,"","|"&RC[7])&"#"&RC[3]&IF(RC[9]=0,"","|"&RC[7])&"#"&RC[3]&"|"&RC[7] -> 10010|10013#10010|10013#10010|10013 | F20: =RC[3]&IF(RC[7]=0,"","|"&RC[7])&"#"&RC[4]&IF(RC[8]=0,"","|"&RC[8])&"#"&RC[5]&"|"&RC[9] -> 4|2#7|4#10|6 | G20: 肥猪丹来爬塔表找配置 | H20: 10010 | I20: 4 | J20: 7 | K20: 10 | L20: 10013 | M20: 2 | N20: 4 | O20: 6
A21: 15 | B21: 无尽之塔15层 | C21: =RC[-2]*3-2&"|"&RC[-2]*3-1&"|"&RC[-2]*3 -> 43|44|45 | D21: 3|6|9 | E21: =RC[3]&IF(RC[8]=0,"","|"&RC[7])&"#"&RC[3]&IF(RC[9]=0,"","|"&RC[7])&"#"&RC[3]&"|"&RC[7] -> 10010|13007#10010|13007#10010|13007 | F21: =RC[3]&IF(RC[7]=0,"","|"&RC[7])&"#"&RC[4]&IF(RC[8]=0,"","|"&RC[8])&"#"&RC[5]&"|"&RC[9] -> 4|1#7|1#10|2 | G21: 肥猪丹来爬塔表找配置 | H21: 10010 | I21: 4 | J21: 7 | K21: 10 | L21: 13007 | M21: 1 | N21: 1 | O21: 2
A22: 16 | B22: 无尽之塔16层 | C22: =RC[-2]*3-2&"|"&RC[-2]*3-1&"|"&RC[-2]*3 -> 46|47|48 | D22: 3|6|9 | E22: =RC[3]&IF(RC[8]=0,"","|"&RC[7])&"#"&RC[3]&IF(RC[9]=0,"","|"&RC[7])&"#"&RC[3]&"|"&RC[7] -> 10010|10014#10010|10014#10010|10014 | F22: =RC[3]&IF(RC[7]=0,"","|"&RC[7])&"#"&RC[4]&IF(RC[8]=0,"","|"&RC[8])&"#"&RC[5]&"|"&RC[9] -> 6|2#10|3#14|4 | G22: 肥猪丹来爬塔表找配置 | H22: 10010 | I22: 6 | J22: 10 | K22: 14 | L22: 10014 | M22: 2 | N22: 3 | O22: 4
A23: 17 | B23: 无尽之塔17层 | C23: =RC[-2]*3-2&"|"&RC[-2]*3-1&"|"&RC[-2]*3 -> 49|50|51 | D23: 3|6|9 | E23: =RC[3]&IF(RC[8]=0,"","|"&RC[7])&"#"&RC[3]&IF(RC[9]=0,"","|"&RC[7])&"#"&RC[3]&"|"&RC[7] -> 10010|10014#10010|10014#10010|10014 | F23: =RC[3]&IF(RC[7]=0,"","|"&RC[7])&"#"&RC[4]&IF(RC[8]=0,"","|"&RC[8])&"#"&RC[5]&"|"&RC[9] -> 6|3#10|4#14|5 | G23: 肥猪丹来爬塔表找配置 | H23: 10010 | I23: 6 | J23: 10 | K23: 14 | L23: 10014 | M23: 3 | N23: 4 | O23: 5
A24: 18 | B24: 无尽之塔18层 | C24: =RC[-2]*3-2&"|"&RC[-2]*3-1&"|"&RC[-2]*3 -> 52|53|54 | D24: 3|6|9 | E24: =RC[3]&IF(RC[8]=0,"","|"&RC[7])&"#"&RC[3]&IF(RC[9]=0,"","|"&RC[7])&"#"&RC[3]&"|"&RC[7] -> 10010|10014#10010|10014#10010|10014 | F24: =RC[3]&IF(RC[7]=0,"","|"&RC[7])&"#"&RC[4]&IF(RC[8]=0,"","|"&RC[8])&"#"&RC[5]&"|"&RC[9] -> 6|4#10|5#14|6 | G24: 肥猪丹来爬塔表找配置 | H24: 10010 | I24: 6 | J24: 10 | K24: 14 | L24: 10014 | M24: 4 | N24: 5 | O24: 6
A25: 19 | B25: 无尽之塔19层 | C25: =RC[-2]*3-2&"|"&RC[-2]*3-1&"|"&RC[-2]*3 -> 55|56|57 | D25: 3|6|9 | E25: =RC[3]&IF(RC[8]=0,"","|"&RC[7])&"#"&RC[3]&IF(RC[9]=0,"","|"&RC[7])&"#"&RC[3]&"|"&RC[7] -> 10010|10014#10010|10014#10010|10014 | F25: =RC[3]&IF(RC[7]=0,"","|"&RC[7])&"#"&RC[4]&IF(RC[8]=0,"","|"&RC[8])&"#"&RC[5]&"|"&RC[9] -> 8|5#13|6#18|7 | G25: 肥猪丹来爬塔表找配置 | H25: 10010 | I25: 8 | J25: 13 | K25: 18 | L25: 10014 | M25: 5 | N25: 6 | O25: 7
A26: 20 | B26: 无尽之塔20层 | C26: =RC[-2]*3-2&"|"&RC[-2]*3-1&"|"&RC[-2]*3 -> 58|59|60 | D26: 3|6|9 | E26: =RC[3]&IF(RC[8]=0,"","|"&RC[7])&"#"&RC[3]&IF(RC[9]=0,"","|"&RC[7])&"#"&RC[3]&"|"&RC[7] -> 10010|10014#10010|10014#10010|10014 | F26: =RC[3]&IF(RC[7]=0,"","|"&RC[7])&"#"&RC[4]&IF(RC[8]=0,"","|"&RC[8])&"#"&RC[5]&"|"&RC[9] -> 8|6#13|7#18|8 | G26: 肥猪丹来爬塔表找配置 | H26: 10010 | I26: 8 | J26: 13 | K26: 18 | L26: 10014 | M26: 6 | N26: 7 | O26: 8
A27: 21 | B27: 无尽之塔21层 | C27: =RC[-2]*3-2&"|"&RC[-2]*3-1&"|"&RC[-2]*3 -> 61|62|63 | D27: 3|6|9 | E27: =RC[3]&IF(RC[8]=0,"","|"&RC[7])&"#"&RC[3]&IF(RC[9]=0,"","|"&RC[7])&"#"&RC[3]&"|"&RC[7] -> 10010|13007#10010|13007#10010|13007 | F27: =RC[3]&IF(RC[7]=0,"","|"&RC[7])&"#"&RC[4]&IF(RC[8]=0,"","|"&RC[8])&"#"&RC[5]&"|"&RC[9] -> 8|1#13|2#18|3 | G27: 肥猪丹来爬塔表找配置 | H27: 10010 | I27: 8 | J27: 13 | K27: 18 | L27: 13007 | M27: 1 | N27: 2 | O27: 3
A28: 22 | B28: 无尽之塔22层 | C28: =RC[-2]*3-2&"|"&RC[-2]*3-1&"|"&RC[-2]*3 -> 64|65|66 | D28: 3|6|9 | E28: =RC[3]&IF(RC[8]=0,"","|"&RC[7])&"#"&RC[3]&IF(RC[9]=0,"","|"&RC[7])&"#"&RC[3]&"|"&RC[7] -> 10010|10014#10010|10014#10010|10014 | F28: =RC[3]&IF(RC[7]=0,"","|"&RC[7])&"#"&RC[4]&IF(RC[8]=0,"","|"&RC[8])&"#"&RC[5]&"|"&RC[9] -> 10|7#16|8#22|9 | G28: 肥猪丹来爬塔表找配置 | H28: 10010 | I28: 10 | J28: 16 | K28: 22 | L28: 10014 | M28: 7 | N28: 8 | O28: 9
A29: 23 | B29: 无尽之塔23层 | C29: =RC[-2]*3-2&"|"&RC[-2]*3-1&"|"&RC[-2]*3 -> 67|68|69 | D29: 3|6|9 | E29: =RC[3]&IF(RC[8]=0,"","|"&RC[7])&"#"&RC[3]&IF(RC[9]=0,"","|"&RC[7])&"#"&RC[3]&"|"&RC[7] -> 10010|10014#10010|10014#10010|10014 | F29: =RC[3]&IF(RC[7]=0,"","|"&RC[7])&"#"&RC[4]&IF(RC[8]=0,"","|"&RC[8])&"#"&RC[5]&"|"&RC[9] -> 10|8#16|9#22|10 | G29: 肥猪丹来爬塔表找配置 | H29: 10010 | I29: 10 | J29: 16 | K29: 22 | L29: 10014 | M29: 8 | N29: 9 | O29: 10
A30: 24 | B30: 无尽之塔24层 | C30: =RC[-2]*3-2&"|"&RC[-2]*3-1&"|"&RC[-2]*3 -> 70|71|72 | D30: 3|6|9 | E30: =RC[3]&IF(RC[8]=0,"","|"&RC[7])&"#"&RC[3]&IF(RC[9]=0,"","|"&RC[7])&"#"&RC[3]&"|"&RC[7] -> 10010|10014#10010|10014#10010|10014 | F30: =RC[3]&IF(RC[7]=0,"","|"&RC[7])&"#"&RC[4]&IF(RC[8]=0,"","|"&RC[8])&"#"&RC[5]&"|"&RC[9] -> 10|9#16|10#22|11 | G30: 肥猪丹来爬塔表找配置 | H30: 10010 | I30: 10 | J30: 16 | K30: 22 | L30: 10014 | M30: 9 | N30: 10 | O30: 11
A31: 25 | B31: 无尽之塔25层 | C31: =RC[-2]*3-2&"|"&RC[-2]*3-1&"|"&RC[-2]*3 -> 73|74|75 | D31: 3|6|9 | E31: =RC[3]&IF(RC[8]=0,"","|"&RC[7])&"#"&RC[3]&IF(RC[9]=0,"","|"&RC[7])&"#"&RC[3]&"|"&RC[7] -> 10010|10014#10010|10014#10010|10014 | F31: =RC[3]&IF(RC[7]=0,"","|"&RC[7])&"#"&RC[4]&IF(RC[8]=0,"","|"&RC[8])&"#"&RC[5]&"|"&RC[9] -> 12|10#19|11#26|12 | G31: 肥猪丹来爬塔表找配置 | H31: 10010 | I31: 12 | J31: 19 | K31: 26 | L31: 10014 | M31: 10 | N31: 11 | O31: 12
A32: 26 | B32: 无尽之塔26层 | C32: =RC[-2]*3-2&"|"&RC[-2]*3-1&"|"&RC[-2]*3 -> 76|77|78 | D32: 3|6|9 | E32: =RC[3]&IF(RC[8]=0,"","|"&RC[7])&"#"&RC[3]&IF(RC[9]=0,"","|"&RC[7])&"#"&RC[3]&"|"&RC[7] -> 10010|10014#10010|10014#10010|10014 | F32: =RC[3]&IF(RC[7]=0,"","|"&RC[7])&"#"&RC[4]&IF(RC[8]=0,"","|"&RC[8])&"#"&RC[5]&"|"&RC[9] -> 12|11#19|12#26|13 | G32: 肥猪丹来爬塔表找配置 | H32: 10010 | I32: 12 | J32: 19 | K32: 26 | L32: 10014 | M32: 11 | N32: 12 | O32: 13
A33: 27 | B33: 无尽之塔27层 | C33: =RC[-2]*3-2&"|"&RC[-2]*3-1&"|"&RC[-2]*3 -> 79|80|81 | D33: 3|6|9 | E33: =RC[3]&IF(RC[8]=0,"","|"&RC[7])&"#"&RC[3]&IF(RC[9]=0,"","|"&RC[7])&"#"&RC[3]&"|"&RC[7] -> 10010|13007#10010|13007#10010|13007 | F33: =RC[3]&IF(RC[7]=0,"","|"&RC[7])&"#"&RC[4]&IF(RC[8]=0,"","|"&RC[8])&"#"&RC[5]&"|"&RC[9] -> 12|1#19|2#26|3 | G33: 肥猪丹来爬塔表找配置 | H33: 10010 | I33: 12 | J33: 19 | K33: 26 | L33: 13007 | M33: 1 | N33: 2 | O33: 3
A34: 28 | B34: 无尽之塔28层 | C34: =RC[-2]*3-2&"|"&RC[-2]*3-1&"|"&RC[-2]*3 -> 82|83|84 | D34: 3|6|9 | E34: =RC[3]&IF(RC[8]=0,"","|"&RC[7])&"#"&RC[3]&IF(RC[9]=0,"","|"&RC[7])&"#"&RC[3]&"|"&RC[7] -> 10010|10014#10010|10014#10010|10014 | F34: =RC[3]&IF(RC[7]=0,"","|"&RC[7])&"#"&RC[4]&IF(RC[8]=0,"","|"&RC[8])&"#"&RC[5]&"|"&RC[9] -> 14|12#22|13#30|14 | G34: 肥猪丹来爬塔表找配置 | H34: 10010 | I34: 14 | J34: 22 | K34: 30 | L34: 10014 | M34: 12 | N34: 13 | O34: 14
A35: 29 | B35: 无尽之塔29层 | C35: =RC[-2]*3-2&"|"&RC[-2]*3-1&"|"&RC[-2]*3 -> 85|86|87 | D35: 3|6|9 | E35: =RC[3]&IF(RC[8]=0,"","|"&RC[7])&"#"&RC[3]&IF(RC[9]=0,"","|"&RC[7])&"#"&RC[3]&"|"&RC[7] -> 10010|10014#10010|10014#10010|10014 | F35: =RC[3]&IF(RC[7]=0,"","|"&RC[7])&"#"&RC[4]&IF(RC[8]=0,"","|"&RC[8])&"#"&RC[5]&"|"&RC[9] -> 14|13#22|14#30|15 | G35: 肥猪丹来爬塔表找配置 | H35: 10010 | I35: 14 | J35: 22 | K35: 30 | L35: 10014 | M35: 13 | N35: 14 | O35: 15
A36: 30 | B36: 无尽之塔30层 | C36: =RC[-2]*3-2&"|"&RC[-2]*3-1&"|"&RC[-2]*3 -> 88|89|90 | D36: 3|6|9 | E36: =RC[3]&IF(RC[8]=0,"","|"&RC[7])&"#"&RC[3]&IF(RC[9]=0,"","|"&RC[7])&"#"&RC[3]&"|"&RC[7] -> 10010|10014#10010|10014#10010|10014 | F36: =RC[3]&IF(RC[7]=0,"","|"&RC[7])&"#"&RC[4]&IF(RC[8]=0,"","|"&RC[8])&"#"&RC[5]&"|"&RC[9] -> 14|14#22|15#30|16 | G36: 肥猪丹来爬塔表找配置 | H36: 10010 | I36: 14 | J36: 22 | K36: 30 | L36: 10014 | M36: 14 | N36: 15 | O36: 16
A37: 31 | B37: 无尽之塔31层 | C37: =RC[-2]*3-2&"|"&RC[-2]*3-1&"|"&RC[-2]*3 -> 91|92|93 | D37: 3|6|9 | E37: =RC[3]&IF(RC[8]=0,"","|"&RC[7])&"#"&RC[3]&IF(RC[9]=0,"","|"&RC[7])&"#"&RC[3]&"|"&RC[7] -> 10010|10014#10010|10014#10010|10014 | F37: =RC[3]&IF(RC[7]=0,"","|"&RC[7])&"#"&RC[4]&IF(RC[8]=0,"","|"&RC[8])&"#"&RC[5]&"|"&RC[9] -> 16|15#25|16#34|17 | G37: 肥猪丹来爬塔表找配置 | H37: 10010 | I37: 16 | J37: 25 | K37: 34 | L37: 10014 | M37: 15 | N37: 16 | O37: 17
A38: 32 | B38: 无尽之塔32层 | C38: =RC[-2]*3-2&"|"&RC[-2]*3-1&"|"&RC[-2]*3 -> 94|95|96 | D38: 3|6|9 | E38: =RC[3]&IF(RC[8]=0,"","|"&RC[7])&"#"&RC[3]&IF(RC[9]=0,"","|"&RC[7])&"#"&RC[3]&"|"&RC[7] -> 10010|10014#10010|10014#10010|10014 | F38: =RC[3]&IF(RC[7]=0,"","|"&RC[7])&"#"&RC[4]&IF(RC[8]=0,"","|"&RC[8])&"#"&RC[5]&"|"&RC[9] -> 16|16#25|17#34|18 | G38: 肥猪丹来爬塔表找配置 | H38: 10010 | I38: 16 | J38: 25 | K38: 34 | L38: 10014 | M38: 16 | N38: 17 | O38: 18
A39: 33 | B39: 无尽之塔33层 | C39: =RC[-2]*3-2&"|"&RC[-2]*3-1&"|"&RC[-2]*3 -> 97|98|99 | D39: 3|6|9 | E39: =RC[3]&IF(RC[8]=0,"","|"&RC[7])&"#"&RC[3]&IF(RC[9]=0,"","|"&RC[7])&"#"&RC[3]&"|"&RC[7] -> 10010|10014#10010|10014#10010|10014 | F39: =RC[3]&IF(RC[7]=0,"","|"&RC[7])&"#"&RC[4]&IF(RC[8]=0,"","|"&RC[8])&"#"&RC[5]&"|"&RC[9] -> 16|17#25|18#34|19 | G39: 肥猪丹来爬塔表找配置 | H39: 10010 | I39: 16 | J39: 25 | K39: 34 | L39: 10014 | M39: 17 | N39: 18 | O39: 19
A40: 34 | B40: 无尽之塔34层 | C40: =RC[-2]*3-2&"|"&RC[-2]*3-1&"|"&RC[-2]*3 -> 100|101|102 | D40: 3|6|9 | E40: =RC[3]&IF(RC[8]=0,"","|"&RC[7])&"#"&RC[3]&IF(RC[9]=0,"","|"&RC[7])&"#"&RC[3]&"|"&RC[7] -> 10010|10014#10010|10014#10010|10014 | F40: =RC[3]&IF(RC[7]=0,"","|"&RC[7])&"#"&RC[4]&IF(RC[8]=0,"","|"&RC[8])&"#"&RC[5]&"|"&RC[9] -> 18|18#28|19#38|20 | G40: 肥猪丹来爬塔表找配置 | H40: 10010 | I40: 18 | J40: 28 | K40: 38 | L40: 10014 | M40: 18 | N40: 19 | O40: 20
A41: 35 | B41: 无尽之塔35层 | C41: =RC[-2]*3-2&"|"&RC[-2]*3-1&"|"&RC[-2]*3 -> 103|104|105 | D41: 3|6|9 | E41: =RC[3]&IF(RC[8]=0,"","|"&RC[7])&"#"&RC[3]&IF(RC[9]=0,"","|"&RC[7])&"#"&RC[3]&"|"&RC[7] -> 10010|10014#10010|10014#10010|10014 | F41: =RC[3]&IF(RC[7]=0,"","|"&RC[7])&"#"&RC[4]&IF(RC[8]=0,"","|"&RC[8])&"#"&RC[5]&"|"&RC[9] -> 18|19#28|20#38|21 | G41: 肥猪丹来爬塔表找配置 | H41: 10010 | I41: 18 | J41: 28 | K41: 38 | L41: 10014 | M41: 19 | N41: 20 | O41: 21
A42: 36 | B42: 无尽之塔36层 | C42: =RC[-2]*3-2&"|"&RC[-2]*3-1&"|"&RC[-2]*3 -> 106|107|108 | D42: 3|6|9 | E42: =RC[3]&IF(RC[8]=0,"","|"&RC[7])&"#"&RC[3]&IF(RC[9]=0,"","|"&RC[7])&"#"&RC[3]&"|"&RC[7] -> 10010|10014#10010|10014#10010|10014 | F42: =RC[3]&IF(RC[7]=0,"","|"&RC[7])&"#"&RC[4]&IF(RC[8]=0,"","|"&RC[8])&"#"&RC[5]&"|"&RC[9] -> 18|20#28|21#38|22 | G42: 肥猪丹来爬塔表找配置 | H42: 10010 | I42: 18 | J42: 28 | K42: 38 | L42: 10014 | M42: 20 | N42: 21 | O42: 22
A43: 37 | B43: 无尽之塔37层 | C43: =RC[-2]*3-2&"|"&RC[-2]*3-1&"|"&RC[-2]*3 -> 109|110|111 | D43: 3|6|9 | E43: =RC[3]&IF(RC[8]=0,"","|"&RC[7])&"#"&RC[3]&IF(RC[9]=0,"","|"&RC[7])&"#"&RC[3]&"|"&RC[7] -> 10010|10014#10010|10014#10010|10014 | F43: =RC[3]&IF(RC[7]=0,"","|"&RC[7])&"#"&RC[4]&IF(RC[8]=0,"","|"&RC[8])&"#"&RC[5]&"|"&RC[9] -> 20|20#31|21#42|22 | G43: 肥猪丹来爬塔表找配置 | H43: 10010 | I43: 20 | J43: 31 | K43: 42 | L43: 10014 | M43: 20 | N43: 21 | O43: 22
A44: 38 | B44: 无尽之塔38层 | C44: =RC[-2]*3-2&"|"&RC[-2]*3-1&"|"&RC[-2]*3 -> 112|113|114 | D44: 3|6|9 | E44: =RC[3]&IF(RC[8]=0,"","|"&RC[7])&"#"&RC[3]&IF(RC[9]=0,"","|"&RC[7])&"#"&RC[3]&"|"&RC[7] -> 10010|10014#10010|10014#10010|10014 | F44: =RC[3]&IF(RC[7]=0,"","|"&RC[7])&"#"&RC[4]&IF(RC[8]=0,"","|"&RC[8])&"#"&RC[5]&"|"&RC[9] -> 20|20#31|21#42|22 | G44: 肥猪丹来爬塔表找配置 | H44: 10010 | I44: 20 | J44: 31 | K44: 42 | L44: 10014 | M44: 20 | N44: 21 | O44: 22
A45: 39 | B45: 无尽之塔39层 | C45: =RC[-2]*3-2&"|"&RC[-2]*3-1&"|"&RC[-2]*3 -> 115|116|117 | D45: 3|6|9 | E45: =RC[3]&IF(RC[8]=0,"","|"&RC[7])&"#"&RC[3]&IF(RC[9]=0,"","|"&RC[7])&"#"&RC[3]&"|"&RC[7] -> 10010|10014#10010|10014#10010|10014 | F45: =RC[3]&IF(RC[7]=0,"","|"&RC[7])&"#"&RC[4]&IF(RC[8]=0,"","|"&RC[8])&"#"&RC[5]&"|"&RC[9] -> 20|20#31|21#42|22 | G45: 肥猪丹来爬塔表找配置 | H45: 10010 | I45: 20 | J45: 31 | K45: 42 | L45: 10014 | M45: 20 | N45: 21 | O45: 22
A46: 40 | B46: 无尽之塔40层 | C46: =RC[-2]*3-2&"|"&RC[-2]*3-1&"|"&RC[-2]*3 -> 118|119|120 | D46: 3|6|9 | E46: =RC[3]&IF(RC[8]=0,"","|"&RC[7])&"#"&RC[3]&IF(RC[9]=0,"","|"&RC[7])&"#"&RC[3]&"|"&RC[7] -> 10010|10014#10010|10014#10010|10014 | F46: =RC[3]&IF(RC[7]=0,"","|"&RC[7])&"#"&RC[4]&IF(RC[8]=0,"","|"&RC[8])&"#"&RC[5]&"|"&RC[9] -> 22|20#34|21#46|22 | G46: 肥猪丹来爬塔表找配置 | H46: 10010 | I46: 22 | J46: 34 | K46: 46 | L46: 10014 | M46: 20 | N46: 21 | O46: 22
A47: 41 | B47: 无尽之塔41层 | C47: =RC[-2]*3-2&"|"&RC[-2]*3-1&"|"&RC[-2]*3 -> 121|122|123 | D47: 3|6|9 | E47: =RC[3]&IF(RC[8]=0,"","|"&RC[7])&"#"&RC[3]&IF(RC[9]=0,"","|"&RC[7])&"#"&RC[3]&"|"&RC[7] -> 10010|10014#10010|10014#10010|10014 | F47: =RC[3]&IF(RC[7]=0,"","|"&RC[7])&"#"&RC[4]&IF(RC[8]=0,"","|"&RC[8])&"#"&RC[5]&"|"&RC[9] -> 22|22#34|24#46|26 | G47: 肥猪丹来爬塔表找配置 | H47: 10010 | I47: 22 | J47: 34 | K47: 46 | L47: 10014 | M47: =R[-5]C+2 -> 22 | N47: =R[-5]C+3 -> 24 | O47: =R[-5]C+4 -> 26
A48: 42 | B48: 无尽之塔42层 | C48: =RC[-2]*3-2&"|"&RC[-2]*3-1&"|"&RC[-2]*3 -> 124|125|126 | D48: 3|6|9 | E48: =RC[3]&IF(RC[8]=0,"","|"&RC[7])&"#"&RC[3]&IF(RC[9]=0,"","|"&RC[7])&"#"&RC[3]&"|"&RC[7] -> 10010|10014#10010|10014#10010|10014 | F48: =RC[3]&IF(RC[7]=0,"","|"&RC[7])&"#"&RC[4]&IF(RC[8]=0,"","|"&RC[8])&"#"&RC[5]&"|"&RC[9] -> 22|22#34|24#46|26 | G48: 肥猪丹来爬塔表找配置 | H48: 10010 | I48: 22 | J48: 34 | K48: 46 | L48: 10014 | M48: =R[-5]C+2 -> 22 | N48: =R[-5]C+3 -> 24 | O48: =R[-5]C+4 -> 26
A49: 43 | B49: 无尽之塔43层 | C49: =RC[-2]*3-2&"|"&RC[-2]*3-1&"|"&RC[-2]*3 -> 127|128|129 | D49: 3|6|9 | E49: =RC[3]&IF(RC[8]=0,"","|"&RC[7])&"#"&RC[3]&IF(RC[9]=0,"","|"&RC[7])&"#"&RC[3]&"|"&RC[7] -> 10010|10014#10010|10014#10010|10014 | F49: =RC[3]&IF(RC[7]=0,"","|"&RC[7])&"#"&RC[4]&IF(RC[8]=0,"","|"&RC[8])&"#"&RC[5]&"|"&RC[9] -> 24|22#37|24#50|26 | G49: 肥猪丹来爬塔表找配置 | H49: 10010 | I49: 24 | J49: 37 | K49: 50 | L49: 10014 | M49: =R[-5]C+2 -> 22 | N49: =R[-5]C+3 -> 24 | O49: =R[-5]C+4 -> 26
A50: 44 | B50: 无尽之塔44层 | C50: =RC[-2]*3-2&"|"&RC[-2]*3-1&"|"&RC[-2]*3 -> 130|131|132 | D50: 3|6|9 | E50: =RC[3]&IF(RC[8]=0,"","|"&RC[7])&"#"&RC[3]&IF(RC[9]=0,"","|"&RC[7])&"#"&RC[3]&"|"&RC[7] -> 10010|10014#10010|10014#10010|10014 | F50: =RC[3]&IF(RC[7]=0,"","|"&RC[7])&"#"&RC[4]&IF(RC[8]=0,"","|"&RC[8])&"#"&RC[5]&"|"&RC[9] -> 24|22#37|24#50|26 | G50: 肥猪丹来爬塔表找配置 | H50: 10010 | I50: 24 | J50: 37 | K50: 50 | L50: 10014 | M50: =R[-5]C+2 -> 22 | N50: =R[-5]C+3 -> 24 | O50: =R[-5]C+4 -> 26
A51: 45 | B51: 无尽之塔45层 | C51: =RC[-2]*3-2&"|"&RC[-2]*3-1&"|"&RC[-2]*3 -> 133|134|135 | D51: 3|6|9 | E51: =RC[3]&IF(RC[8]=0,"","|"&RC[7])&"#"&RC[3]&IF(RC[9]=0,"","|"&RC[7])&"#"&RC[3]&"|"&RC[7] -> 10010|10014#10010|10014#10010|10014 | F51: =RC[3]&IF(RC[7]=0,"","|"&RC[7])&"#"&RC[4]&IF(RC[8]=0,"","|"&RC[8])&"#"&RC[5]&"|"&RC[9] -> 24|22#37|24#50|26 | G51: 肥猪丹来爬塔表找配置 | H51: 10010 | I51: 24 | J51: 37 | K51: 50 | L51: 10014 | M51: =R[-5]C+2 -> 22 | N51: =R[-5]C+3 -> 24 | O51: =R[-5]C+4 -> 26
A52: 46 | B52: 无尽之塔46层 | C52: =RC[-2]*3-2&"|"&RC[-2]*3-1&"|"&RC[-2]*3 -> 136|137|138 | D52: 3|6|9 | E52: =RC[3]&IF(RC[8]=0,"","|"&RC[7])&"#"&RC[3]&IF(RC[9]=0,"","|"&RC[7])&"#"&RC[3]&"|"&RC[7] -> 10010|10014#10010|10014#10010|10014 | F52: =RC[3]&IF(RC[7]=0,"","|"&RC[7])&"#"&RC[4]&IF(RC[8]=0,"","|"&RC[8])&"#"&RC[5]&"|"&RC[9] -> 26|24#40|27#54|30 | G52: 肥猪丹来爬塔表找配置 | H52: 10010 | I52: 26 | J52: 40 | K52: 54 | L52: 10014 | M52: =R[-5]C+2 -> 24 | N52: =R[-5]C+3 -> 27 | O52: =R[-5]C+4 -> 30
A53: 47 | B53: 无尽之塔47层 | C53: =RC[-2]*3-2&"|"&RC[-2]*3-1&"|"&RC[-2]*3 -> 139|140|141 | D53: 3|6|9 | E53: =RC[3]&IF(RC[8]=0,"","|"&RC[7])&"#"&RC[3]&IF(RC[9]=0,"","|"&RC[7])&"#"&RC[3]&"|"&RC[7] -> 10010|10014#10010|10014#10010|10014 | F53: =RC[3]&IF(RC[7]=0,"","|"&RC[7])&"#"&RC[4]&IF(RC[8]=0,"","|"&RC[8])&"#"&RC[5]&"|"&RC[9] -> 26|24#40|27#54|30 | G53: 肥猪丹来爬塔表找配置 | H53: 10010 | I53: 26 | J53: 40 | K53: 54 | L53: 10014 | M53: =R[-5]C+2 -> 24 | N53: =R[-5]C+3 -> 27 | O53: =R[-5]C+4 -> 30
A54: 48 | B54: 无尽之塔48层 | C54: =RC[-2]*3-2&"|"&RC[-2]*3-1&"|"&RC[-2]*3 -> 142|143|144 | D54: 3|6|9 | E54: =RC[3]&IF(RC[8]=0,"","|"&RC[7])&"#"&RC[3]&IF(RC[9]=0,"","|"&RC[7])&"#"&RC[3]&"|"&RC[7] -> 10010|10014#10010|10014#10010|10014 | F54: =RC[3]&IF(RC[7]=0,"","|"&RC[7])&"#"&RC[4]&IF(RC[8]=0,"","|"&RC[8])&"#"&RC[5]&"|"&RC[9] -> 26|24#40|27#54|30 | G54: 肥猪丹来爬塔表找配置 | H54: 10010 | I54: 26 | J54: 40 | K54: 54 | L54: 10014 | M54: =R[-5]C+2 -> 24 | N54: =R[-5]C+3 -> 27 | O54: =R[-5]C+4 -> 30
A55: 49 | B55: 无尽之塔49层 | C55: =RC[-2]*3-2&"|"&RC[-2]*3-1&"|"&RC[-2]*3 -> 145|146|147 | D55: 3|6|9 | E55: =RC[3]&IF(RC[8]=0,"","|"&RC[7])&"#"&RC[3]&IF(RC[9]=0,"","|"&RC[7])&"#"&RC[3]&"|"&RC[7] -> 10010|10014#10010|10014#10010|10014 | F55: =RC[3]&IF(RC[7]=0,"","|"&RC[7])&"#"&RC[4]&IF(RC[8]=0,"","|"&RC[8])&"#"&RC[5]&"|"&RC[9] -> 28|24#43|27#58|30 | G55: 肥猪丹来爬塔表找配置 | H55: 10010 | I55: 28 | J55: 43 | K55: 58 | L55: 10014 | M55: =R[-5]C+2 -> 24 | N55: =R[-5]C+3 -> 27 | O55: =R[-5]C+4 -> 30
A56: 50 | B56: 无尽之塔50层 | C56: =RC[-2]*3-2&"|"&RC[-2]*3-1&"|"&RC[-2]*3 -> 148|149|150 | D56: 3|6|9 | E56: =RC[3]&IF(RC[8]=0,"","|"&RC[7])&"#"&RC[3]&IF(RC[9]=0,"","|"&RC[7])&"#"&RC[3]&"|"&RC[7] -> 10010|10014#10010|10014#10010|10014 | F56: =RC[3]&IF(RC[7]=0,"","|"&RC[7])&"#"&RC[4]&IF(RC[8]=0,"","|"&RC[8])&"#"&RC[5]&"|"&RC[9] -> 28|24#43|27#58|30 | G56: 肥猪丹来爬塔表找配置 | H56: 10010 | I56: 28 | J56: 43 | K56: 58 | L56: 10014 | M56: =R[-5]C+2 -> 24 | N56: =R[-5]C+3 -> 27 | O56: =R[-5]C+4 -> 30
A57: 51 | B57: 无尽之塔51层 | C57: =RC[-2]*3-2&"|"&RC[-2]*3-1&"|"&RC[-2]*3 -> 151|152|153 | D57: 3|6|9 | E57: =RC[3]&IF(RC[8]=0,"","|"&RC[7])&"#"&RC[3]&IF(RC[9]=0,"","|"&RC[7])&"#"&RC[3]&"|"&RC[7] -> 10010|10014#10010|10014#10010|10014 | F57: =RC[3]&IF(RC[7]=0,"","|"&RC[7])&"#"&RC[4]&IF(RC[8]=0,"","|"&RC[8])&"#"&RC[5]&"|"&RC[9] -> 28|26#43|30#58|34 | G57: 肥猪丹来爬塔表找配置 | H57: 10010 | I57: 28 | J57: 43 | K57: 58 | L57: 10014 | M57: =R[-5]C+2 -> 26 | N57: =R[-5]C+3 -> 30 | O57: =R[-5]C+4 -> 34
A58: 52 | B58: 无尽之塔52层 | C58: =RC[-2]*3-2&"|"&RC[-2]*3-1&"|"&RC[-2]*3 -> 154|155|156 | D58: 3|6|9 | E58: =RC[3]&IF(RC[8]=0,"","|"&RC[7])&"#"&RC[3]&IF(RC[9]=0,"","|"&RC[7])&"#"&RC[3]&"|"&RC[7] -> 10010|10014#10010|10014#10010|10014 | F58: =RC[3]&IF(RC[7]=0,"","|"&RC[7])&"#"&RC[4]&IF(RC[8]=0,"","|"&RC[8])&"#"&RC[5]&"|"&RC[9] -> 28|26#43|30#58|34 | G58: 肥猪丹来爬塔表找配置 | H58: 10010 | I58: 28 | J58: 43 | K58: 58 | L58: 10014 | M58: =R[-5]C+2 -> 26 | N58: =R[-5]C+3 -> 30 | O58: =R[-5]C+4 -> 34
A59: 53 | B59: 无尽之塔53层 | C59: =RC[-2]*3-2&"|"&RC[-2]*3-1&"|"&RC[-2]*3 -> 157|158|159 | D59: 3|6|9 | E59: =RC[3]&IF(RC[8]=0,"","|"&RC[7])&"#"&RC[3]&IF(RC[9]=0,"","|"&RC[7])&"#"&RC[3]&"|"&RC[7] -> 10010|10014#10010|10014#10010|10014 | F59: =RC[3]&IF(RC[7]=0,"","|"&RC[7])&"#"&RC[4]&IF(RC[8]=0,"","|"&RC[8])&"#"&RC[5]&"|"&RC[9] -> 28|26#43|30#58|34 | G59: 肥猪丹来爬塔表找配置 | H59: 10010 | I59: 28 | J59: 43 | K59: 58 | L59: 10014 | M59: =R[-5]C+2 -> 26 | N59: =R[-5]C+3 -> 30 | O59: =R[-5]C+4 -> 34
A60: 54 | B60: 无尽之塔54层 | C60: =RC[-2]*3-2&"|"&RC[-2]*3-1&"|"&RC[-2]*3 -> 160|161|162 | D60: 3|6|9 | E60: =RC[3]&IF(RC[8]=0,"","|"&RC[7])&"#"&RC[3]&IF(RC[9]=0,"","|"&RC[7])&"#"&RC[3]&"|"&RC[7] -> 10010|10014#10010|10014#10010|10014 | F60: =RC[3]&IF(RC[7]=0,"","|"&RC[7])&"#"&RC[4]&IF(RC[8]=0,"","|"&RC[8])&"#"&RC[5]&"|"&RC[9] -> 28|26#43|30#58|34 | G60: 肥猪丹来爬塔表找配置 | H60: 10010 | I60: 28 | J60: 43 | K60: 58 | L60: 10014 | M60: =R[-5]C+2 -> 26 | N60: =R[-5]C+3 -> 30 | O60: =R[-5]C+4 -> 34
A61: 55 | B61: 无尽之塔55层 | C61: =RC[-2]*3-2&"|"&RC[-2]*3-1&"|"&RC[-2]*3 -> 163|164|165 | D61: 3|6|9 | E61: =RC[3]&IF(RC[8]=0,"","|"&RC[7])&"#"&RC[3]&IF(RC[9]=0,"","|"&RC[7])&"#"&RC[3]&"|"&RC[7] -> 10010|10014#10010|10014#10010|10014 | F61: =RC[3]&IF(RC[7]=0,"","|"&RC[7])&"#"&RC[4]&IF(RC[8]=0,"","|"&RC[8])&"#"&RC[5]&"|"&RC[9] -> 28|26#43|30#58|34 | G61: 肥猪丹来爬塔表找配置 | H61: 10010 | I61: 28 | J61: 43 | K61: 58 | L61: 10014 | M61: =R[-5]C+2 -> 26 | N61: =R[-5]C+3 -> 30 | O61: =R[-5]C+4 -> 34
A62: 56 | B62: 无尽之塔56层 | C62: =RC[-2]*3-2&"|"&RC[-2]*3-1&"|"&RC[-2]*3 -> 166|167|168 | D62: 3|6|9 | E62: =RC[3]&IF(RC[8]=0,"","|"&RC[7])&"#"&RC[3]&IF(RC[9]=0,"","|"&RC[7])&"#"&RC[3]&"|"&RC[7] -> 10010|10014#10010|10014#10010|10014 | F62: =RC[3]&IF(RC[7]=0,"","|"&RC[7])&"#"&RC[4]&IF(RC[8]=0,"","|"&RC[8])&"#"&RC[5]&"|"&RC[9] -> 28|28#43|33#58|38 | G62: 肥猪丹来爬塔表找配置 | H62: 10010 | I62: 28 | J62: 43 | K62: 58 | L62: 10014 | M62: =R[-5]C+2 -> 28 | N62: =R[-5]C+3 -> 33 | O62: =R[-5]C+4 -> 38
A63: 57 | B63: 无尽之塔57层 | C63: =RC[-2]*3-2&"|"&RC[-2]*3-1&"|"&RC[-2]*3 -> 169|170|171 | D63: 3|6|9 | E63: =RC[3]&IF(RC[8]=0,"","|"&RC[7])&"#"&RC[3]&IF(RC[9]=0,"","|"&RC[7])&"#"&RC[3]&"|"&RC[7] -> 10010|10014#10010|10014#10010|10014 | F63: =RC[3]&IF(RC[7]=0,"","|"&RC[7])&"#"&RC[4]&IF(RC[8]=0,"","|"&RC[8])&"#"&RC[5]&"|"&RC[9] -> 28|28#43|33#58|38 | G63: 肥猪丹来爬塔表找配置 | H63: 10010 | I63: 28 | J63: 43 | K63: 58 | L63: 10014 | M63: =R[-5]C+2 -> 28 | N63: =R[-5]C+3 -> 33 | O63: =R[-5]C+4 -> 38
A64: 58 | B64: 无尽之塔58层 | C64: =RC[-2]*3-2&"|"&RC[-2]*3-1&"|"&RC[-2]*3 -> 172|173|174 | D64: 3|6|9 | E64: =RC[3]&IF(RC[8]=0,"","|"&RC[7])&"#"&RC[3]&IF(RC[9]=0,"","|"&RC[7])&"#"&RC[3]&"|"&RC[7] -> 10010|10014#10010|10014#10010|10014 | F64: =RC[3]&IF(RC[7]=0,"","|"&RC[7])&"#"&RC[4]&IF(RC[8]=0,"","|"&RC[8])&"#"&RC[5]&"|"&RC[9] -> 28|28#43|33#58|38 | G64: 肥猪丹来爬塔表找配置 | H64: 10010 | I64: 28 | J64: 43 | K64: 58 | L64: 10014 | M64: =R[-5]C+2 -> 28 | N64: =R[-5]C+3 -> 33 | O64: =R[-5]C+4 -> 38
A65: 59 | B65: 无尽之塔59层 | C65: =RC[-2]*3-2&"|"&RC[-2]*3-1&"|"&RC[-2]*3 -> 175|176|177 | D65: 3|6|9 | E65: =RC[3]&IF(RC[8]=0,"","|"&RC[7])&"#"&RC[3]&IF(RC[9]=0,"","|"&RC[7])&"#"&RC[3]&"|"&RC[7] -> 10010|10014#10010|10014#10010|10014 | F65: =RC[3]&IF(RC[7]=0,"","|"&RC[7])&"#"&RC[4]&IF(RC[8]=0,"","|"&RC[8])&"#"&RC[5]&"|"&RC[9] -> 28|28#43|33#58|38 | G65: 肥猪丹来爬塔表找配置 | H65: 10010 | I65: 28 | J65: 43 | K65: 58 | L65: 10014 | M65: =R[-5]C+2 -> 28 | N65: =R[-5]C+3 -> 33 | O65: =R[-5]C+4 -> 38
A66: 60 | B66: 无尽之塔60层 | C66: =RC[-2]*3-2&"|"&RC[-2]*3-1&"|"&RC[-2]*3 -> 178|179|180 | D66: 3|6|9 | E66: =RC[3]&IF(RC[8]=0,"","|"&RC[7])&"#"&RC[3]&IF(RC[9]=0,"","|"&RC[7])&"#"&RC[3]&"|"&RC[7] -> 10010|10014#10010|10014#10010|10014 | F66: =RC[3]&IF(RC[7]=0,"","|"&RC[7])&"#"&RC[4]&IF(RC[8]=0,"","|"&RC[8])&"#"&RC[5]&"|"&RC[9] -> 28|28#43|33#58|38 | G66: 肥猪丹来爬塔表找配置 | H66: 10010 | I66: 28 | J66: 43 | K66: 58 | L66: 10014 | M66: =R[-5]C+2 -> 28 | N66: =R[-5]C+3 -> 33 | O66: =R[-5]C+4 -> 38
A67: 61 | B67: 无尽之塔61层 | C67: =RC[-2]*3-2&"|"&RC[-2]*3-1&"|"&RC[-2]*3 -> 181|182|183 | D67: 3|6|9 | E67: =RC[3]&IF(RC[8]=0,"","|"&RC[7])&"#"&RC[3]&IF(RC[9]=0,"","|"&RC[7])&"#"&RC[3]&"|"&RC[7] -> 10010|10014#10010|10014#10010|10014 | F67: =RC[3]&IF(RC[7]=0,"","|"&RC[7])&"#"&RC[4]&IF(RC[8]=0,"","|"&RC[8])&"#"&RC[5]&"|"&RC[9] -> 28|30#43|36#58|42 | G67: 肥猪丹来爬塔表找配置 | H67: 10010 | I67: 28 | J67: 43 | K67: 58 | L67: 10014 | M67: =R[-5]C+2 -> 30 | N67: =R[-5]C+3 -> 36 | O67: =R[-5]C+4 -> 42
A68: 62 | B68: 无尽之塔62层 | C68: =RC[-2]*3-2&"|"&RC[-2]*3-1&"|"&RC[-2]*3 -> 184|185|186 | D68: 3|6|9 | E68: =RC[3]&IF(RC[8]=0,"","|"&RC[7])&"#"&RC[3]&IF(RC[9]=0,"","|"&RC[7])&"#"&RC[3]&"|"&RC[7] -> 10010|10014#10010|10014#10010|10014 | F68: =RC[3]&IF(RC[7]=0,"","|"&RC[7])&"#"&RC[4]&IF(RC[8]=0,"","|"&RC[8])&"#"&RC[5]&"|"&RC[9] -> 28|30#43|36#58|42 | G68: 肥猪丹来爬塔表找配置 | H68: 10010 | I68: 28 | J68: 43 | K68: 58 | L68: 10014 | M68: =R[-5]C+2 -> 30 | N68: =R[-5]C+3 -> 36 | O68: =R[-5]C+4 -> 42
A69: 63 | B69: 无尽之塔63层 | C69: =RC[-2]*3-2&"|"&RC[-2]*3-1&"|"&RC[-2]*3 -> 187|188|189 | D69: 3|6|9 | E69: =RC[3]&IF(RC[8]=0,"","|"&RC[7])&"#"&RC[3]&IF(RC[9]=0,"","|"&RC[7])&"#"&RC[3]&"|"&RC[7] -> 10010|10014#10010|10014#10010|10014 | F69: =RC[3]&IF(RC[7]=0,"","|"&RC[7])&"#"&RC[4]&IF(RC[8]=0,"","|"&RC[8])&"#"&RC[5]&"|"&RC[9] -> 28|30#43|36#58|42 | G69: 肥猪丹来爬塔表找配置 | H69: 10010 | I69: 28 | J69: 43 | K69: 58 | L69: 10014 | M69: =R[-5]C+2 -> 30 | N69: =R[-5]C+3 -> 36 | O69: =R[-5]C+4 -> 42
A70: 64 | B70: 无尽之塔64层 | C70: =RC[-2]*3-2&"|"&RC[-2]*3-1&"|"&RC[-2]*3 -> 190|191|192 | D70: 3|6|9 | E70: =RC[3]&IF(RC[8]=0,"","|"&RC[7])&"#"&RC[3]&IF(RC[9]=0,"","|"&RC[7])&"#"&RC[3]&"|"&RC[7] -> 10010|10014#10010|10014#10010|10014 | F70: =RC[3]&IF(RC[7]=0,"","|"&RC[7])&"#"&RC[4]&IF(RC[8]=0,"","|"&RC[8])&"#"&RC[5]&"|"&RC[9] -> 28|30#43|36#58|42 | G70: 肥猪丹来爬塔表找配置 | H70: 10010 | I70: 28 | J70: 43 | K70: 58 | L70: 10014 | M70: =R[-5]C+2 -> 30 | N70: =R[-5]C+3 -> 36 | O70: =R[-5]C+4 -> 42
A71: 65 | B71: 无尽之塔65层 | C71: =RC[-2]*3-2&"|"&RC[-2]*3-1&"|"&RC[-2]*3 -> 193|194|195 | D71: 3|6|9 | E71: =RC[3]&IF(RC[8]=0,"","|"&RC[7])&"#"&RC[3]&IF(RC[9]=0,"","|"&RC[7])&"#"&RC[3]&"|"&RC[7] -> 10010|10014#10010|10014#10010|10014 | F71: =RC[3]&IF(RC[7]=0,"","|"&RC[7])&"#"&RC[4]&IF(RC[8]=0,"","|"&RC[8])&"#"&RC[5]&"|"&RC[9] -> 28|30#43|36#58|42 | G71: 肥猪丹来爬塔表找配置 | H71: 10010 | I71: 28 | J71: 43 | K71: 58 | L71: 10014 | M71: =R[-5]C+2 -> 30 | N71: =R[-5]C+3 -> 36 | O71: =R[-5]C+4 -> 42
A72: 66 | B72: 无尽之塔66层 | C72: =RC[-2]*3-2&"|"&RC[-2]*3-1&"|"&RC[-2]*3 -> 196|197|198 | D72: 3|6|9 | E72: =RC[3]&IF(RC[8]=0,"","|"&RC[7])&"#"&RC[3]&IF(RC[9]=0,"","|"&RC[7])&"#"&RC[3]&"|"&RC[7] -> 10010|10014#10010|10014#10010|10014 | F72: =RC[3]&IF(RC[7]=0,"","|"&RC[7])&"#"&RC[4]&IF(RC[8]=0,"","|"&RC[8])&"#"&RC[5]&"|"&RC[9] -> 28|32#43|39#58|46 | G72: 肥猪丹来爬塔表找配置 | H72: 10010 | I72: 28 | J72: 43 | K72: 58 | L72: 10014 | M72: =R[-5]C+2 -> 32 | N72: =R[-5]C+3 -> 39 | O72: =R[-5]C+4 -> 46
A73: 67 | B73: 无尽之塔67层 | C73: =RC[-2]*3-2&"|"&RC[-2]*3-1&"|"&RC[-2]*3 -> 199|200|201 | D73: 3|6|9 | E73: =RC[3]&IF(RC[8]=0,"","|"&RC[7])&"#"&RC[3]&IF(RC[9]=0,"","|"&RC[7])&"#"&RC[3]&"|"&RC[7] -> 10010|10014#10010|10014#10010|10014 | F73: =RC[3]&IF(RC[7]=0,"","|"&RC[7])&"#"&RC[4]&IF(RC[8]=0,"","|"&RC[8])&"#"&RC[5]&"|"&RC[9] -> 28|32#43|39#58|46 | G73: 肥猪丹来爬塔表找配置 | H73: 10010 | I73: 28 | J73: 43 | K73: 58 | L73: 10014 | M73: =R[-5]C+2 -> 32 | N73: =R[-5]C+3 -> 39 | O73: =R[-5]C+4 -> 46
A74: 68 | B74: 无尽之塔68层 | C74: =RC[-2]*3-2&"|"&RC[-2]*3-1&"|"&RC[-2]*3 -> 202|203|204 | D74: 3|6|9 | E74: =RC[3]&IF(RC[8]=0,"","|"&RC[7])&"#"&RC[3]&IF(RC[9]=0,"","|"&RC[7])&"#"&RC[3]&"|"&RC[7] -> 10010|10014#10010|10014#10010|10014 | F74: =RC[3]&IF(RC[7]=0,"","|"&RC[7])&"#"&RC[4]&IF(RC[8]=0,"","|"&RC[8])&"#"&RC[5]&"|"&RC[9] -> 28|32#43|39#58|46 | G74: 肥猪丹来爬塔表找配置 | H74: 10010 | I74: 28 | J74: 43 | K74: 58 | L74: 10014 | M74: =R[-5]C+2 -> 32 | N74: =R[-5]C+3 -> 39 | O74: =R[-5]C+4 -> 46
A75: 69 | B75: 无尽之塔69层 | C75: =RC[-2]*3-2&"|"&RC[-2]*3-1&"|"&RC[-2]*3 -> 205|206|207 | D75: 3|6|9 | E75: =RC[3]&IF(RC[8]=0,"","|"&RC[7])&"#"&RC[3]&IF(RC[9]=0,"","|"&RC[7])&"#"&RC[3]&"|"&RC[7] -> 10010|10014#10010|10014#10010|10014 | F75: =RC[3]&IF(RC[7]=0,"","|"&RC[7])&"#"&RC[4]&IF(RC[8]=0,"","|"&RC[8])&"#"&RC[5]&"|"&RC[9] -> 28|32#43|39#58|46 | G75: 肥猪丹来爬塔表找配置 | H75: 10010 | I75: 28 | J75: 43 | K75: 58 | L75: 10014 | M75: =R[-5]C+2 -> 32 | N75: =R[-5]C+3 -> 39 | O75: =R[-5]C+4 -> 46
A76: 70 | B76: 无尽之塔70层 | C76: =RC[-2]*3-2&"|"&RC[-2]*3-1&"|"&RC[-2]*3 -> 208|209|210 | D76: 3|6|9 | E76: =RC[3]&IF(RC[8]=0,"","|"&RC[7])&"#"&RC[3]&IF(RC[9]=0,"","|"&RC[7])&"#"&RC[3]&"|"&RC[7] -> 10010|10014#10010|10014#10010|10014 | F76: =RC[3]&IF(RC[7]=0,"","|"&RC[7])&"#"&RC[4]&IF(RC[8]=0,"","|"&RC[8])&"#"&RC[5]&"|"&RC[9] -> 28|32#43|39#58|46 | G76: 肥猪丹来爬塔表找配置 | H76: 10010 | I76: 28 | J76: 43 | K76: 58 | L76: 10014 | M76: =R[-5]C+2 -> 32 | N76: =R[-5]C+3 -> 39 | O76: =R[-5]C+4 -> 46
A77: 71 | B77: 无尽之塔71层 | C77: =RC[-2]*3-2&"|"&RC[-2]*3-1&"|"&RC[-2]*3 -> 211|212|213 | D77: 3|6|9 | E77: =RC[3]&IF(RC[8]=0,"","|"&RC[7])&"#"&RC[3]&IF(RC[9]=0,"","|"&RC[7])&"#"&RC[3]&"|"&RC[7] -> 10010|10014#10010|10014#10010|10014 | F77: =RC[3]&IF(RC[7]=0,"","|"&RC[7])&"#"&RC[4]&IF(RC[8]=0,"","|"&RC[8])&"#"&RC[5]&"|"&RC[9] -> 28|34#43|42#58|50 | G77: 肥猪丹来爬塔表找配置 | H77: 10010 | I77: 28 | J77: 43 | K77: 58 | L77: 10014 | M77: =R[-5]C+2 -> 34 | N77: =R[-5]C+3 -> 42 | O77: =R[-5]C+4 -> 50
A78: 72 | B78: 无尽之塔72层 | C78: =RC[-2]*3-2&"|"&RC[-2]*3-1&"|"&RC[-2]*3 -> 214|215|216 | D78: 3|6|9 | E78: =RC[3]&IF(RC[8]=0,"","|"&RC[7])&"#"&RC[3]&IF(RC[9]=0,"","|"&RC[7])&"#"&RC[3]&"|"&RC[7] -> 10010|10014#10010|10014#10010|10014 | F78: =RC[3]&IF(RC[7]=0,"","|"&RC[7])&"#"&RC[4]&IF(RC[8]=0,"","|"&RC[8])&"#"&RC[5]&"|"&RC[9] -> 28|34#43|42#58|50 | G78: 肥猪丹来爬塔表找配置 | H78: 10010 | I78: 28 | J78: 43 | K78: 58 | L78: 10014 | M78: =R[-5]C+2 -> 34 | N78: =R[-5]C+3 -> 42 | O78: =R[-5]C+4 -> 50
A79: 73 | B79: 无尽之塔73层 | C79: =RC[-2]*3-2&"|"&RC[-2]*3-1&"|"&RC[-2]*3 -> 217|218|219 | D79: 3|6|9 | E79: =RC[3]&IF(RC[8]=0,"","|"&RC[7])&"#"&RC[3]&IF(RC[9]=0,"","|"&RC[7])&"#"&RC[3]&"|"&RC[7] -> 10010|10014#10010|10014#10010|10014 | F79: =RC[3]&IF(RC[7]=0,"","|"&RC[7])&"#"&RC[4]&IF(RC[8]=0,"","|"&RC[8])&"#"&RC[5]&"|"&RC[9] -> 28|34#43|42#58|50 | G79: 肥猪丹来爬塔表找配置 | H79: 10010 | I79: 28 | J79: 43 | K79: 58 | L79: 10014 | M79: =R[-5]C+2 -> 34 | N79: =R[-5]C+3 -> 42 | O79: =R[-5]C+4 -> 50
A80: 74 | B80: 无尽之塔74层 | C80: =RC[-2]*3-2&"|"&RC[-2]*3-1&"|"&RC[-2]*3 -> 220|221|222 | D80: 3|6|9 | E80: =RC[3]&IF(RC[8]=0,"","|"&RC[7])&"#"&RC[3]&IF(RC[9]=0,"","|"&RC[7])&"#"&RC[3]&"|"&RC[7] -> 10010|10014#10010|10014#10010|10014 | F80: =RC[3]&IF(RC[7]=0,"","|"&RC[7])&"#"&RC[4]&IF(RC[8]=0,"","|"&RC[8])&"#"&RC[5]&"|"&RC[9] -> 28|34#43|42#58|50 | G80: 肥猪丹来爬塔表找配置 | H80: 10010 | I80: 28 | J80: 43 | K80: 58 | L80: 10014 | M80: =R[-5]C+2 -> 34 | N80: =R[-5]C+3 -> 42 | O80: =R[-5]C+4 -> 50
A81: 75 | B81: 无尽之塔75层 | C81: =RC[-2]*3-2&"|"&RC[-2]*3-1&"|"&RC[-2]*3 -> 223|224|225 | D81: 3|6|9 | E81: =RC[3]&IF(RC[8]=0,"","|"&RC[7])&"#"&RC[3]&IF(RC[9]=0,"","|"&RC[7])&"#"&RC[3]&"|"&RC[7] -> 10010|10014#10010|10014#10010|10014 | F81: =RC[3]&IF(RC[7]=0,"","|"&RC[7])&"#"&RC[4]&IF(RC[8]=0,"","|"&RC[8])&"#"&RC[5]&"|"&RC[9] -> 28|34#43|42#58|50 | G81: 肥猪丹来爬塔表找配置 | H81: 10010 | I81: 28 | J81: 43 | K81: 58 | L81: 10014 | M81: =R[-5]C+2 -> 34 | N81: =R[-5]C+3 -> 42 | O81: =R[-5]C+4 -> 50
A82: 76 | B82: 无尽之塔76层 | C82: =RC[-2]*3-2&"|"&RC[-2]*3-1&"|"&RC[-2]*3 -> 226|227|228 | D82: 3|6|9 | E82: =RC[3]&IF(RC[8]=0,"","|"&RC[7])&"#"&RC[3]&IF(RC[9]=0,"","|"&RC[7])&"#"&RC[3]&"|"&RC[7] -> 10010|10014#10010|10014#10010|10014 | F82: =RC[3]&IF(RC[7]=0,"","|"&RC[7])&"#"&RC[4]&IF(RC[8]=0,"","|"&RC[8])&"#"&RC[5]&"|"&RC[9] -> 28|36#43|45#58|54 | G82: 肥猪丹来爬塔表找配置 | H82: 10010 | I82: 28 | J82: 43 | K82: 58 | L82: 10014 | M82: =R[-5]C+2 -> 36 | N82: =R[-5]C+3 -> 45 | O82: =R[-5]C+4 -> 54
A83: 77 | B83: 无尽之塔77层 | C83: =RC[-2]*3-2&"|"&RC[-2]*3-1&"|"&RC[-2]*3 -> 229|230|231 | D83: 3|6|9 | E83: =RC[3]&IF(RC[8]=0,"","|"&RC[7])&"#"&RC[3]&IF(RC[9]=0,"","|"&RC[7])&"#"&RC[3]&"|"&RC[7] -> 10010|10014#10010|10014#10010|10014 | F83: =RC[3]&IF(RC[7]=0,"","|"&RC[7])&"#"&RC[4]&IF(RC[8]=0,"","|"&RC[8])&"#"&RC[5]&"|"&RC[9] -> 28|36#43|45#58|54 | G83: 肥猪丹来爬塔表找配置 | H83: 10010 | I83: 28 | J83: 43 | K83: 58 | L83: 10014 | M83: =R[-5]C+2 -> 36 | N83: =R[-5]C+3 -> 45 | O83: =R[-5]C+4 -> 54
A84: 78 | B84: 无尽之塔78层 | C84: =RC[-2]*3-2&"|"&RC[-2]*3-1&"|"&RC[-2]*3 -> 232|233|234 | D84: 3|6|9 | E84: =RC[3]&IF(RC[8]=0,"","|"&RC[7])&"#"&RC[3]&IF(RC[9]=0,"","|"&RC[7])&"#"&RC[3]&"|"&RC[7] -> 10010|10014#10010|10014#10010|10014 | F84: =RC[3]&IF(RC[7]=0,"","|"&RC[7])&"#"&RC[4]&IF(RC[8]=0,"","|"&RC[8])&"#"&RC[5]&"|"&RC[9] -> 28|36#43|45#58|54 | G84: 肥猪丹来爬塔表找配置 | H84: 10010 | I84: 28 | J84: 43 | K84: 58 | L84: 10014 | M84: =R[-5]C+2 -> 36 | N84: =R[-5]C+3 -> 45 | O84: =R[-5]C+4 -> 54
A85: 79 | B85: 无尽之塔79层 | C85: =RC[-2]*3-2&"|"&RC[-2]*3-1&"|"&RC[-2]*3 -> 235|236|237 | D85: 3|6|9 | E85: =RC[3]&IF(RC[8]=0,"","|"&RC[7])&"#"&RC[3]&IF(RC[9]=0,"","|"&RC[7])&"#"&RC[3]&"|"&RC[7] -> 10010|10014#10010|10014#10010|10014 | F85: =RC[3]&IF(RC[7]=0,"","|"&RC[7])&"#"&RC[4]&IF(RC[8]=0,"","|"&RC[8])&"#"&RC[5]&"|"&RC[9] -> 28|36#43|45#58|54 | G85: 肥猪丹来爬塔表找配置 | H85: 10010 | I85: 28 | J85: 43 | K85: 58 | L85: 10014 | M85: =R[-5]C+2 -> 36 | N85: =R[-5]C+3 -> 45 | O85: =R[-5]C+4 -> 54
A86: 80 | B86: 无尽之塔80层 | C86: =RC[-2]*3-2&"|"&RC[-2]*3-1&"|"&RC[-2]*3 -> 238|239|240 | D86: 3|6|9 | E86: =RC[3]&IF(RC[8]=0,"","|"&RC[7])&"#"&RC[3]&IF(RC[9]=0,"","|"&RC[7])&"#"&RC[3]&"|"&RC[7] -> 10010|10014#10010|10014#10010|10014 | F86: =RC[3]&IF(RC[7]=0,"","|"&RC[7])&"#"&RC[4]&IF(RC[8]=0,"","|"&RC[8])&"#"&RC[5]&"|"&RC[9] -> 28|36#43|45#58|54 | G86: 肥猪丹来爬塔表找配置 | H86: 10010 | I86: 28 | J86: 43 | K86: 58 | L86: 10014 | M86: =R[-5]C+2 -> 36 | N86: =R[-5]C+3 -> 45 | O86: =R[-5]C+4 -> 54
A87: 81 | B87: 无尽之塔81层 | C87: =RC[-2]*3-2&"|"&RC[-2]*3-1&"|"&RC[-2]*3 -> 241|242|243 | D87: 3|6|9 | E87: =RC[3]&IF(RC[8]=0,"","|"&RC[7])&"#"&RC[3]&IF(RC[9]=0,"","|"&RC[7])&"#"&RC[3]&"|"&RC[7] -> 10010|10014#10010|10014#10010|10014 | F87: =RC[3]&IF(RC[7]=0,"","|"&RC[7])&"#"&RC[4]&IF(RC[8]=0,"","|"&RC[8])&"#"&RC[5]&"|"&RC[9] -> 28|38#43|48#58|58 | G87: 肥猪丹来爬塔表找配置 | H87: 10010 | I87: 28 | J87: 43 | K87: 58 | L87: 10014 | M87: =R[-5]C+2 -> 38 | N87: =R[-5]C+3 -> 48 | O87: =R[-5]C+4 -> 58
A88: 82 | B88: 无尽之塔82层 | C88: =RC[-2]*3-2&"|"&RC[-2]*3-1&"|"&RC[-2]*3 -> 244|245|246 | D88: 3|6|9 | E88: =RC[3]&IF(RC[8]=0,"","|"&RC[7])&"#"&RC[3]&IF(RC[9]=0,"","|"&RC[7])&"#"&RC[3]&"|"&RC[7] -> 10010|10014#10010|10014#10010|10014 | F88: =RC[3]&IF(RC[7]=0,"","|"&RC[7])&"#"&RC[4]&IF(RC[8]=0,"","|"&RC[8])&"#"&RC[5]&"|"&RC[9] -> 28|38#43|48#58|58 | G88: 肥猪丹来爬塔表找配置 | H88: 10010 | I88: 28 | J88: 43 | K88: 58 | L88: 10014 | M88: =R[-5]C+2 -> 38 | N88: =R[-5]C+3 -> 48 | O88: =R[-5]C+4 -> 58
A89: 83 | B89: 无尽之塔83层 | C89: =RC[-2]*3-2&"|"&RC[-2]*3-1&"|"&RC[-2]*3 -> 247|248|249 | D89: 3|6|9 | E89: =RC[3]&IF(RC[8]=0,"","|"&RC[7])&"#"&RC[3]&IF(RC[9]=0,"","|"&RC[7])&"#"&RC[3]&"|"&RC[7] -> 10010|10014#10010|10014#10010|10014 | F89: =RC[3]&IF(RC[7]=0,"","|"&RC[7])&"#"&RC[4]&IF(RC[8]=0,"","|"&RC[8])&"#"&RC[5]&"|"&RC[9] -> 28|38#43|48#58|58 | G89: 肥猪丹来爬塔表找配置 | H89: 10010 | I89: 28 | J89: 43 | K89: 58 | L89: 10014 | M89: =R[-5]C+2 -> 38 | N89: =R[-5]C+3 -> 48 | O89: =R[-5]C+4 -> 58
A90: 84 | B90: 无尽之塔84层 | C90: =RC[-2]*3-2&"|"&RC[-2]*3-1&"|"&RC[-2]*3 -> 250|251|252 | D90: 3|6|9 | E90: =RC[3]&IF(RC[8]=0,"","|"&RC[7])&"#"&RC[3]&IF(RC[9]=0,"","|"&RC[7])&"#"&RC[3]&"|"&RC[7] -> 10010|10014#10010|10014#10010|10014 | F90: =RC[3]&IF(RC[7]=0,"","|"&RC[7])&"#"&RC[4]&IF(RC[8]=0,"","|"&RC[8])&"#"&RC[5]&"|"&RC[9] -> 28|38#43|48#58|58 | G90: 肥猪丹来爬塔表找配置 | H90: 10010 | I90: 28 | J90: 43 | K90: 58 | L90: 10014 | M90: =R[-5]C+2 -> 38 | N90: =R[-5]C+3 -> 48 | O90: =R[-5]C+4 -> 58
A91: 85 | B91: 无尽之塔85层 | C91: =RC[-2]*3-2&"|"&RC[-2]*3-1&"|"&RC[-2]*3 -> 253|254|255 | D91: 3|6|9 | E91: =RC[3]&IF(RC[8]=0,"","|"&RC[7])&"#"&RC[3]&IF(RC[9]=0,"","|"&RC[7])&"#"&RC[3]&"|"&RC[7] -> 10010|10014#10010|10014#10010|10014 | F91: =RC[3]&IF(RC[7]=0,"","|"&RC[7])&"#"&RC[4]&IF(RC[8]=0,"","|"&RC[8])&"#"&RC[5]&"|"&RC[9] -> 28|38#43|48#58|58 | G91: 肥猪丹来爬塔表找配置 | H91: 10010 | I91: 28 | J91: 43 | K91: 58 | L91: 10014 | M91: =R[-5]C+2 -> 38 | N91: =R[-5]C+3 -> 48 | O91: =R[-5]C+4 -> 58
A92: 86 | B92: 无尽之塔86层 | C92: =RC[-2]*3-2&"|"&RC[-2]*3-1&"|"&RC[-2]*3 -> 256|257|258 | D92: 3|6|9 | E92: =RC[3]&IF(RC[8]=0,"","|"&RC[7])&"#"&RC[3]&IF(RC[9]=0,"","|"&RC[7])&"#"&RC[3]&"|"&RC[7] -> 10010|10014#10010|10014#10010|10014 | F92: =RC[3]&IF(RC[7]=0,"","|"&RC[7])&"#"&RC[4]&IF(RC[8]=0,"","|"&RC[8])&"#"&RC[5]&"|"&RC[9] -> 28|40#43|51#58|62 | G92: 肥猪丹来爬塔表找配置 | H92: 10010 | I92: 28 | J92: 43 | K92: 58 | L92: 10014 | M92: =R[-5]C+2 -> 40 | N92: =R[-5]C+3 -> 51 | O92: =R[-5]C+4 -> 62
A93: 87 | B93: 无尽之塔87层 | C93: =RC[-2]*3-2&"|"&RC[-2]*3-1&"|"&RC[-2]*3 -> 259|260|261 | D93: 3|6|9 | E93: =RC[3]&IF(RC[8]=0,"","|"&RC[7])&"#"&RC[3]&IF(RC[9]=0,"","|"&RC[7])&"#"&RC[3]&"|"&RC[7] -> 10010|10014#10010|10014#10010|10014 | F93: =RC[3]&IF(RC[7]=0,"","|"&RC[7])&"#"&RC[4]&IF(RC[8]=0,"","|"&RC[8])&"#"&RC[5]&"|"&RC[9] -> 28|40#43|51#58|62 | G93: 肥猪丹来爬塔表找配置 | H93: 10010 | I93: 28 | J93: 43 | K93: 58 | L93: 10014 | M93: =R[-5]C+2 -> 40 | N93: =R[-5]C+3 -> 51 | O93: =R[-5]C+4 -> 62
A94: 88 | B94: 无尽之塔88层 | C94: =RC[-2]*3-2&"|"&RC[-2]*3-1&"|"&RC[-2]*3 -> 262|263|264 | D94: 3|6|9 | E94: =RC[3]&IF(RC[8]=0,"","|"&RC[7])&"#"&RC[3]&IF(RC[9]=0,"","|"&RC[7])&"#"&RC[3]&"|"&RC[7] -> 10010|10014#10010|10014#10010|10014 | F94: =RC[3]&IF(RC[7]=0,"","|"&RC[7])&"#"&RC[4]&IF(RC[8]=0,"","|"&RC[8])&"#"&RC[5]&"|"&RC[9] -> 28|40#43|51#58|62 | G94: 肥猪丹来爬塔表找配置 | H94: 10010 | I94: 28 | J94: 43 | K94: 58 | L94: 10014 | M94: =R[-5]C+2 -> 40 | N94: =R[-5]C+3 -> 51 | O94: =R[-5]C+4 -> 62
A95: 89 | B95: 无尽之塔89层 | C95: =RC[-2]*3-2&"|"&RC[-2]*3-1&"|"&RC[-2]*3 -> 265|266|267 | D95: 3|6|9 | E95: =RC[3]&IF(RC[8]=0,"","|"&RC[7])&"#"&RC[3]&IF(RC[9]=0,"","|"&RC[7])&"#"&RC[3]&"|"&RC[7] -> 10010|10014#10010|10014#10010|10014 | F95: =RC[3]&IF(RC[7]=0,"","|"&RC[7])&"#"&RC[4]&IF(RC[8]=0,"","|"&RC[8])&"#"&RC[5]&"|"&RC[9] -> 28|40#43|51#58|62 | G95: 肥猪丹来爬塔表找配置 | H95: 10010 | I95: 28 | J95: 43 | K95: 58 | L95: 10014 | M95: =R[-5]C+2 -> 40 | N95: =R[-5]C+3 -> 51 | O95: =R[-5]C+4 -> 62
A96: 90 | B96: 无尽之塔90层 | C96: =RC[-2]*3-2&"|"&RC[-2]*3-1&"|"&RC[-2]*3 -> 268|269|270 | D96: 3|6|9 | E96: =RC[3]&IF(RC[8]=0,"","|"&RC[7])&"#"&RC[3]&IF(RC[9]=0,"","|"&RC[7])&"#"&RC[3]&"|"&RC[7] -> 10010|10014#10010|10014#10010|10014 | F96: =RC[3]&IF(RC[7]=0,"","|"&RC[7])&"#"&RC[4]&IF(RC[8]=0,"","|"&RC[8])&"#"&RC[5]&"|"&RC[9] -> 28|40#43|51#58|62 | G96: 肥猪丹来爬塔表找配置 | H96: 10010 | I96: 28 | J96: 43 | K96: 58 | L96: 10014 | M96: =R[-5]C+2 -> 40 | N96: =R[-5]C+3 -> 51 | O96: =R[-5]C+4 -> 62
A97: 91 | B97: 无尽之塔91层 | C97: =RC[-2]*3-2&"|"&RC[-2]*3-1&"|"&RC[-2]*3 -> 271|272|273 | D97: 3|6|9 | E97: =RC[3]&IF(RC[8]=0,"","|"&RC[7])&"#"&RC[3]&IF(RC[9]=0,"","|"&RC[7])&"#"&RC[3]&"|"&RC[7] -> 10010|10014#10010|10014#10010|10014 | F97: =RC[3]&IF(RC[7]=0,"","|"&RC[7])&"#"&RC[4]&IF(RC[8]=0,"","|"&RC[8])&"#"&RC[5]&"|"&RC[9] -> 28|42#43|54#58|66 | G97: 肥猪丹来爬塔表找配置 | H97: 10010 | I97: 28 | J97: 43 | K97: 58 | L97: 10014 | M97: =R[-5]C+2 -> 42 | N97: =R[-5]C+3 -> 54 | O97: =R[-5]C+4 -> 66
A98: 92 | B98: 无尽之塔92层 | C98: =RC[-2]*3-2&"|"&RC[-2]*3-1&"|"&RC[-2]*3 -> 274|275|276 | D98: 3|6|9 | E98: =RC[3]&IF(RC[8]=0,"","|"&RC[7])&"#"&RC[3]&IF(RC[9]=0,"","|"&RC[7])&"#"&RC[3]&"|"&RC[7] -> 10010|10014#10010|10014#10010|10014 | F98: =RC[3]&IF(RC[7]=0,"","|"&RC[7])&"#"&RC[4]&IF(RC[8]=0,"","|"&RC[8])&"#"&RC[5]&"|"&RC[9] -> 28|42#43|54#58|66 | G98: 肥猪丹来爬塔表找配置 | H98: 10010 | I98: 28 | J98: 43 | K98: 58 | L98: 10014 | M98: =R[-5]C+2 -> 42 | N98: =R[-5]C+3 -> 54 | O98: =R[-5]C+4 -> 66
A99: 93 | B99: 无尽之塔93层 | C99: =RC[-2]*3-2&"|"&RC[-2]*3-1&"|"&RC[-2]*3 -> 277|278|279 | D99: 3|6|9 | E99: =RC[3]&IF(RC[8]=0,"","|"&RC[7])&"#"&RC[3]&IF(RC[9]=0,"","|"&RC[7])&"#"&RC[3]&"|"&RC[7] -> 10010|10014#10010|10014#10010|10014 | F99: =RC[3]&IF(RC[7]=0,"","|"&RC[7])&"#"&RC[4]&IF(RC[8]=0,"","|"&RC[8])&"#"&RC[5]&"|"&RC[9] -> 28|42#43|54#58|66 | G99: 肥猪丹来爬塔表找配置 | H99: 10010 | I99: 28 | J99: 43 | K99: 58 | L99: 10014 | M99: =R[-5]C+2 -> 42 | N99: =R[-5]C+3 -> 54 | O99: =R[-5]C+4 -> 66
A100: 94 | B100: 无尽之塔94层 | C100: =RC[-2]*3-2&"|"&RC[-2]*3-1&"|"&RC[-2]*3 -> 280|281|282 | D100: 3|6|9 | E100: =RC[3]&IF(RC[8]=0,"","|"&RC[7])&"#"&RC[3]&IF(RC[9]=0,"","|"&RC[7])&"#"&RC[3]&"|"&RC[7] -> 10010|10014#10010|10014#10010|10014 | F100: =RC[3]&IF(RC[7]=0,"","|"&RC[7])&"#"&RC[4]&IF(RC[8]=0,"","|"&RC[8])&"#"&RC[5]&"|"&RC[9] -> 28|42#43|54#58|66 | G100: 肥猪丹来爬塔表找配置 | H100: 10010 | I100: 28 | J100: 43 | K100: 58 | L100: 10014 | M100: =R[-5]C+2 -> 42 | N100: =R[-5]C+3 -> 54 | O100: =R[-5]C+4 -> 66
A101: 95 | B101: 无尽之塔95层 | C101: =RC[-2]*3-2&"|"&RC[-2]*3-1&"|"&RC[-2]*3 -> 283|284|285 | D101: 3|6|9 | E101: =RC[3]&IF(RC[8]=0,"","|"&RC[7])&"#"&RC[3]&IF(RC[9]=0,"","|"&RC[7])&"#"&RC[3]&"|"&RC[7] -> 10010|10014#10010|10014#10010|10014 | F101: =RC[3]&IF(RC[7]=0,"","|"&RC[7])&"#"&RC[4]&IF(RC[8]=0,"","|"&RC[8])&"#"&RC[5]&"|"&RC[9] -> 28|42#43|54#58|66 | G101: 肥猪丹来爬塔表找配置 | H101: 10010 | I101: 28 | J101: 43 | K101: 58 | L101: 10014 | M101: =R[-5]C+2 -> 42 | N101: =R[-5]C+3 -> 54 | O101: =R[-5]C+4 -> 66
A102: 96 | B102: 无尽之塔96层 | C102: =RC[-2]*3-2&"|"&RC[-2]*3-1&"|"&RC[-2]*3 -> 286|287|288 | D102: 3|6|9 | E102: =RC[3]&IF(RC[8]=0,"","|"&RC[7])&"#"&RC[3]&IF(RC[9]=0,"","|"&RC[7])&"#"&RC[3]&"|"&RC[7] -> 10010|10014#10010|10014#10010|10014 | F102: =RC[3]&IF(RC[7]=0,"","|"&RC[7])&"#"&RC[4]&IF(RC[8]=0,"","|"&RC[8])&"#"&RC[5]&"|"&RC[9] -> 28|44#43|57#58|70 | G102: 肥猪丹来爬塔表找配置 | H102: 10010 | I102: 28 | J102: 43 | K102: 58 | L102: 10014 | M102: =R[-5]C+2 -> 44 | N102: =R[-5]C+3 -> 57 | O102: =R[-5]C+4 -> 70
A103: 97 | B103: 无尽之塔97层 | C103: =RC[-2]*3-2&"|"&RC[-2]*3-1&"|"&RC[-2]*3 -> 289|290|291 | D103: 3|6|9 | E103: =RC[3]&IF(RC[8]=0,"","|"&RC[7])&"#"&RC[3]&IF(RC[9]=0,"","|"&RC[7])&"#"&RC[3]&"|"&RC[7] -> 10010|10014#10010|10014#10010|10014 | F103: =RC[3]&IF(RC[7]=0,"","|"&RC[7])&"#"&RC[4]&IF(RC[8]=0,"","|"&RC[8])&"#"&RC[5]&"|"&RC[9] -> 28|44#43|57#58|70 | G103: 肥猪丹来爬塔表找配置 | H103: 10010 | I103: 28 | J103: 43 | K103: 58 | L103: 10014 | M103: =R[-5]C+2 -> 44 | N103: =R[-5]C+3 -> 57 | O103: =R[-5]C+4 -> 70
A104: 98 | B104: 无尽之塔98层 | C104: =RC[-2]*3-2&"|"&RC[-2]*3-1&"|"&RC[-2]*3 -> 292|293|294 | D104: 3|6|9 | E104: =RC[3]&IF(RC[8]=0,"","|"&RC[7])&"#"&RC[3]&IF(RC[9]=0,"","|"&RC[7])&"#"&RC[3]&"|"&RC[7] -> 10010|10014#10010|10014#10010|10014 | F104: =RC[3]&IF(RC[7]=0,"","|"&RC[7])&"#"&RC[4]&IF(RC[8]=0,"","|"&RC[8])&"#"&RC[5]&"|"&RC[9] -> 28|44#43|57#58|70 | G104: 肥猪丹来爬塔表找配置 | H104: 10010 | I104: 28 | J104: 43 | K104: 58 | L104: 10014 | M104: =R[-5]C+2 -> 44 | N104: =R[-5]C+3 -> 57 | O104: =R[-5]C+4 -> 70
A105: 99 | B105: 无尽之塔99层 | C105: =RC[-2]*3-2&"|"&RC[-2]*3-1&"|"&RC[-2]*3 -> 295|296|297 | D105: 3|6|9 | E105: =RC[3]&IF(RC[8]=0,"","|"&RC[7])&"#"&RC[3]&IF(RC[9]=0,"","|"&RC[7])&"#"&RC[3]&"|"&RC[7] -> 10010|10014#10010|10014#10010|10014 | F105: =RC[3]&IF(RC[7]=0,"","|"&RC[7])&"#"&RC[4]&IF(RC[8]=0,"","|"&RC[8])&"#"&RC[5]&"|"&RC[9] -> 28|44#43|57#58|70 | G105: 肥猪丹来爬塔表找配置 | H105: 10010 | I105: 28 | J105: 43 | K105: 58 | L105: 10014 | M105: =R[-5]C+2 -> 44 | N105: =R[-5]C+3 -> 57 | O105: =R[-5]C+4 -> 70
A106: 100 | B106: 无尽之塔100层 | C106: =RC[-2]*3-2&"|"&RC[-2]*3-1&"|"&RC[-2]*3 -> 298|299|300 | D106: 3|6|9 | E106: =RC[3]&IF(RC[8]=0,"","|"&RC[7])&"#"&RC[3]&IF(RC[9]=0,"","|"&RC[7])&"#"&RC[3]&"|"&RC[7] -> 10010|10014#10010|10014#10010|10014 | F106: =RC[3]&IF(RC[7]=0,"","|"&RC[7])&"#"&RC[4]&IF(RC[8]=0,"","|"&RC[8])&"#"&RC[5]&"|"&RC[9] -> 28|44#43|57#58|70 | G106: 肥猪丹来爬塔表找配置 | H106: 10010 | I106: 28 | J106: 43 | K106: 58 | L106: 10014 | M106: =R[-5]C+2 -> 44 | N106: =R[-5]C+3 -> 57 | O106: =R[-5]C+4 -> 70

Sheet: 2.爬塔关卡
A1: game_level|map_idx | B1: name| | C1: chapter|chapter | D1: is_last_map|is_last_map | E1: map_list|map_list | F1: award_star_list|award_star_list | G1: map_battle_value_list| | H1: win_condition| | I1: chat|
A2: 不可空 | B2: 不可空 | C2: 不可空 | D2: 不可空 | E2: 不可空 | F2: 不可空 | G2: 不可空 | H2: 可空#不需字段 | I2: 不可空
A3: 数字 | B3: 字符串 | C3: 数字 | D3: 数字 | E3: 一维数组 | F3: 一维数组 | G3: 一维数组 | H3: 一维数组 | I3: 字符串
E4: 不定长 | F4: 不定长 | G4: 不定长 | H4: 不定长
A6: 关卡索引 | B6: 名称 | C6: 所属章节 | D6: 是否章节最后一关 | E6: 关卡列表(简单|普通|困难) | F6: 奖励的星数列表 | G6: 关卡战力列表(简单|普通|困难) | H6: 胜利条件 | I6: 关卡怪物喊话
A7: 1 | B7: 超级队长 | C7: =INT(RC[-2]/3+0.9) -> 1 | D7: 0 | E7: 20000|20001|20002 | F7: 1|2|3 | G7: 1|1|1 | H7: 4 | I7: =VLOOKUP(RC[-7],R7C14:R60C15,2,FALSE) -> 击败我，你们才能继续前进 | J7: 20000 | K7: 20001 | L7: 20002 | N7: 致命特工 | O7: 只有击败我，你们才能通过这里
A8: 2 | B8: 死亡武士 | C8: =INT(RC[-2]/3+0.9) -> 1 | D8: 0 | E8: 20003|20004|20005 | F8: 1|2|3 | G8: 1|1|1 | H8: 4 | I8: =VLOOKUP(RC[-7],R7C14:R60C15,2,FALSE) -> 总要有人倒在死亡女神的裙摆下 | J8: 20003 | K8: 20004 | L8: 20005 | N8: 死亡武士 | O8: 总要有人倒在死亡女神的裙摆下
A9: 3 | B9: 红头魔 | C9: =INT(RC[-2]/3+0.9) -> 1 | D9: 1 | E9: 20006|20007|20008 | F9: 1|2|3 | G9: 1|1|1 | H9: 4 | I9: =VLOOKUP(RC[-7],R7C14:R60C15,2,FALSE) -> 你们将被焚烧殆尽 | J9: 20006 | K9: 20007 | L9: 20008 | N9: 超级队长 | O9: 击败我，你们才能继续前进
A10: 4 | B10: 终极队长 | C10: =INT(RC[-2]/3+0.9) -> 2 | D10: 0 | E10: 20009|20010|20011 | F10: 1|2|3 | G10: 1|1|1 | H10: 1|30 | I10: =VLOOKUP(RC[-7],R7C14:R60C15,2,FALSE) -> 这里没有你们可通过的路 | J10: 20009 | K10: 20010 | L10: 20011 | N10: 鹰眸 | O10: 保护好你的心脏，我将要击穿它
A11: 5 | B11: 雷神 | C11: =INT(RC[-2]/3+0.9) -> 2 | D11: 0 | E11: 20012|20013|20014 | F11: 1|2|3 | G11: 1|1|1 | H11: 1|30 | I11: =VLOOKUP(RC[-7],R7C14:R60C15,2,FALSE) -> 你们将倒在雷霆之下 | J11: 20012 | K11: 20013 | L11: 20014 | N11: 超凡博士 | O11: 淹没在魔法的洪流里吧
A12: 6 | B12: 野蛮巨人 | C12: =INT(RC[-2]/3+0.9) -> 2 | D12: 1 | E12: 20015|20016|20017 | F12: 1|2|3 | G12: 1|1|1 | H12: 1|30 | I12: =VLOOKUP(RC[-7],R7C14:R60C15,2,FALSE) -> 你们就这样覆灭在我的怒火下吧！ | J12: 20015 | K12: 20016 | L12: 20017 | N12: 白凤凰 | O12: 淹没在光辉里吧
A13: 7 | B13: 致命特工 | C13: =INT(RC[-2]/3+0.9) -> 3 | D13: 0 | E13: 20018|20019|20020 | F13: 1|2|3 | G13: 1|1|1 | H13: 2|3 | I13: =VLOOKUP(RC[-7],R7C14:R60C15,2,FALSE) -> 只有击败我，你们才能通过这里 | J13: 20018 | K13: 20019 | L13: 20020 | N13: 刀锋猎人 | O13: 胜利？那必然是属于我的
A14: 8 | B14: 鹰眸 | C14: =INT(RC[-2]/3+0.9) -> 3 | D14: 0 | E14: 20021|20022|20023 | F14: 1|2|3 | G14: 1|1|1 | H14: 2|3 | I14: =VLOOKUP(RC[-7],R7C14:R60C15,2,FALSE) -> 保护好你的心脏，我将要击穿它 | J14: 20021 | K14: 20022 | L14: 20023 | N14: 地狱骑士 | O14: 地狱的火焰带来审判和死亡
A15: 9 | B15: 刀锋猎人 | C15: =INT(RC[-2]/3+0.9) -> 3 | D15: 1 | E15: 20024|20025|20026 | F15: 1|2|3 | G15: 1|1|1 | H15: 2|3 | I15: =VLOOKUP(RC[-7],R7C14:R60C15,2,FALSE) -> 胜利？那必然是属于我的 | J15: 20024 | K15: 20025 | L15: 20026 | N15: 野蛮巨人 | O15: 你们就这样覆灭在我的怒火下吧！
A16: 10 | B16: 地狱骑士 | C16: =INT(RC[-2]/3+0.9) -> 4 | D16: 0 | E16: 20027|20028|20029 | F16: 1|2|3 | G16: 1|1|1 | H16: 3|90 | I16: =VLOOKUP(RC[-7],R7C14:R60C15,2,FALSE) -> 地狱的火焰带来审判和死亡 | J16: 20027 | K16: 20028 | L16: 20029 | N16: 树人 | O16: 迎接死亡吧……
A17: 11 | B17: 铁人 | C17: =INT(RC[-2]/3+0.9) -> 4 | D17: 0 | E17: 20030|20031|20032 | F17: 1|2|3 | G17: 1|1|1 | H17: 3|90 | I17: =VLOOKUP(RC[-7],R7C14:R60C15,2,FALSE) -> 你们毫无希望 | J17: 20030 | K17: 20031 | L17: 20032 | N17: 地狱铁拳 | O17: 你们将深陷地狱——我带来的
A18: 12 | B18: 树人 | C18: =INT(RC[-2]/3+0.9) -> 4 | D18: 1 | E18: 20033|20034|20035 | F18: 1|2|3 | G18: 1|1|1 | H18: 3|90 | I18: =VLOOKUP(RC[-7],R7C14:R60C15,2,FALSE) -> 迎接死亡吧…… | J18: 20033 | K18: 20034 | L18: 20035 | N18: 铁人 | O18: 你们毫无希望
A19: 13 | B19: 超凡博士 | C19: =INT(RC[-2]/3+0.9) -> 5 | D19: 0 | E19: 20036|20037|20038 | F19: 1|2|3 | G19: 1|1|1 | H19: 4 | I19: =VLOOKUP(RC[-7],R7C14:R60C15,2,FALSE) -> 淹没在魔法的洪流里吧 | J19: 20036 | K19: 20037 | L19: 20038 | N19: 雷神 | O19: 你们将倒在雷霆之下
A20: 14 | B20: 白凤凰 | C20: =INT(RC[-2]/3+0.9) -> 5 | D20: 0 | E20: 20039|20040|20041 | F20: 1|2|3 | G20: 1|1|1 | H20: 4 | I20: =VLOOKUP(RC[-7],R7C14:R60C15,2,FALSE) -> 淹没在光辉里吧 | J20: 20039 | K20: 20040 | L20: 20041 | N20: 混沌女巫 | O20: 你们或我，归于混沌
A21: 15 | B21: 地狱铁拳 | C21: =INT(RC[-2]/3+0.9) -> 5 | D21: 1 | E21: 20042|20043|20044 | F21: 1|2|3 | G21: 1|1|1 | H21: 4 | I21: =VLOOKUP(RC[-7],R7C14:R60C15,2,FALSE) -> 你们将深陷地狱——我带来的 | J21: 20042 | K21: 20043 | L21: 20044 | N21: 红头魔 | O21: 你们将被焚烧殆尽
A22: 16 | B22: 混沌女巫 | C22: =INT(RC[-2]/3+0.9) -> 6 | D22: 0 | E22: 20045|20046|20047 | F22: 1|2|3 | G22: 1|1|1 | H22: 1|40 | I22: =VLOOKUP(RC[-7],R7C14:R60C15,2,FALSE) -> 你们或我，归于混沌 | J22: 20045 | K22: 20046 | L22: 20047 | N22: 终极队长 | O22: 这里没有你们可通过的路
A23: 17 | B23: 杰克船长 | C23: =INT(RC[-2]/3+0.9) -> 6 | D23: 0 | E23: 20048|20049|20050 | F23: 1|2|3 | G23: 1|1|1 | H23: 1|40 | I23: =VLOOKUP(RC[-7],R7C14:R60C15,2,FALSE) -> 看好你的血条！小鬼，我可不会放水！ | J23: 20048 | K23: 20049 | L23: 20050 | N23: 狼叔 | O23: 你死我活，这是最佳结局
A24: 18 | B24: 天使长 | C24: =INT(RC[-2]/3+0.9) -> 6 | D24: 1 | E24: 20051|20052|20053 | F24: 1|2|3 | G24: 1|1|1 | H24: 1|40 | I24: =VLOOKUP(RC[-7],R7C14:R60C15,2,FALSE) -> 圣光笼罩于我，将再无所畏惧 | J24: 20051 | K24: 20052 | L24: 20053 | N24: 黑暗骑士 | O24: 我只要达成战略目标就够了
A25: 19 | B25: 独眼野蛮人 | C25: =INT(RC[-2]/3+0.9) -> 7 | D25: 0 | E25: 20054|20055|20056 | F25: 1|2|3 | G25: 1|1|1 | H25: 2|2 | I25: =VLOOKUP(RC[-7],R7C14:R60C15,2,FALSE) -> 毁灭——！！！！ | J25: 20054 | K25: 20055 | L25: 20056 | N25: 佐罗 | O25: 只要赢就行吗……不错的条件
A26: 20 | B26: 圣女贞德 | C26: =INT(RC[-2]/3+0.9) -> 7 | D26: 0 | E26: 20057|20058|20059 | F26: 1|2|3 | G26: 1|1|1 | H26: 2|2 | I26: =VLOOKUP(RC[-7],R7C14:R60C15,2,FALSE) -> 回归神的怀抱吧 | J26: 20057 | K26: 20058 | L26: 20059 | N26: 杰克船长 | O26: 看好你的血条！小鬼，我可不会放水！
A27: 21 | B27: 美杜莎 | C27: =INT(RC[-2]/3+0.9) -> 7 | D27: 1 | E27: 20060|20061|20062 | F27: 1|2|3 | G27: 1|1|1 | H27: 2|2 | I27: =VLOOKUP(RC[-7],R7C14:R60C15,2,FALSE) -> 你就这样化为石头，永恒地沉眠于此吧 | J27: 20060 | K27: 20061 | L27: 20062 | N27: 斯巴达 | O27: 你们无法越过我！
A28: 22 | B28: 德古拉伯爵 | C28: =INT(RC[-2]/3+0.9) -> 8 | D28: 0 | E28: 20063|20064|20065 | F28: 1|2|3 | G28: 1|1|1 | H28: 3|80 | I28: =VLOOKUP(RC[-7],R7C14:R60C15,2,FALSE) -> 鲜血全都归于我…… | J28: 20063 | K28: 20064 | L28: 20065 | N28: 亚马逊女王 | O28: 欢迎你们踏入狩猎的领域
A29: 23 | B29: 狩猎女神 | C29: =INT(RC[-2]/3+0.9) -> 8 | D29: 0 | E29: 20066|20067|20068 | F29: 1|2|3 | G29: 1|1|1 | H29: 3|80 | I29: =VLOOKUP(RC[-7],R7C14:R60C15,2,FALSE) -> 月光洒落之地，狩猎开启之时 | J29: 20066 | K29: 20067 | L29: 20068 | N29: 圣女贞德 | O29: 回归神的怀抱吧
A30: 24 | B30: 查理大帝 | C30: =INT(RC[-2]/3+0.9) -> 8 | D30: 1 | E30: 20069|20070|20071 | F30: 1|2|3 | G30: 1|1|1 | H30: 3|80 | I30: =VLOOKUP(RC[-7],R7C14:R60C15,2,FALSE) -> 我的前方是无尽的征途！ | J30: 20069 | K30: 20070 | L30: 20071 | N30: 天使长 | O30: 圣光笼罩于我，将再无所畏惧
A31: 25 | B31: 佐罗 | C31: =INT(RC[-2]/3+0.9) -> 9 | D31: 0 | E31: 20072|20073|20074 | F31: 1|2|3 | G31: 1|1|1 | H31: 4 | I31: =VLOOKUP(RC[-7],R7C14:R60C15,2,FALSE) -> 只要赢就行吗……不错的条件 | J31: 20072 | K31: 20073 | L31: 20074 | N31: 查理大帝 | O31: 我的前方是无尽的征途！
A32: 26 | B32: 亚马逊女王 | C32: =INT(RC[-2]/3+0.9) -> 9 | D32: 0 | E32: 20075|20076|20077 | F32: 1|2|3 | G32: 1|1|1 | H32: 4 | I32: =VLOOKUP(RC[-7],R7C14:R60C15,2,FALSE) -> 欢迎你们踏入狩猎的领域 | J32: 20075 | K32: 20076 | L32: 20077 | N32: 阿努比斯 | O32: 我引领着死亡的到来……
A33: 27 | B33: 宙斯 | C33: =INT(RC[-2]/3+0.9) -> 9 | D33: 1 | E33: 20078|20079|20080 | F33: 1|2|3 | G33: 1|1|1 | H33: 4 | I33: =VLOOKUP(RC[-7],R7C14:R60C15,2,FALSE) -> 雷霆的愤怒，你驾驭不住！ | J33: 20078 | K33: 20079 | L33: 20080 | N33: 德古拉伯爵 | O33: 鲜血全都归于我……
A34: 28 | B34: 斯巴达 | C34: =INT(RC[-2]/3+0.9) -> 10 | D34: 0 | E34: 20081|20082|20083 | F34: 1|2|3 | G34: 1|1|1 | H34: 1|50 | I34: =VLOOKUP(RC[-7],R7C14:R60C15,2,FALSE) -> 你们无法越过我！ | J34: 20081 | K34: 20082 | L34: 20083 | N34: 大力神 | O34: 我会失败？除非死亡！
A35: 29 | B35: 阿努比斯 | C35: =INT(RC[-2]/3+0.9) -> 10 | D35: 0 | E35: 20084|20085|20086 | F35: 1|2|3 | G35: 1|1|1 | H35: 1|50 | I35: =VLOOKUP(RC[-7],R7C14:R60C15,2,FALSE) -> 我引领着死亡的到来…… | J35: 20084 | K35: 20085 | L35: 20086 | N35: 美杜莎 | O35: 你就这样化为石头，永恒地沉眠于此吧
A36: 30 | B36: 雅典娜 | C36: =INT(RC[-2]/3+0.9) -> 10 | D36: 1 | E36: 20087|20088|20089 | F36: 1|2|3 | G36: 1|1|1 | H36: 1|50 | I36: =VLOOKUP(RC[-7],R7C14:R60C15,2,FALSE) -> 智慧的光辉不会被遮掩 | J36: 20087 | K36: 20088 | L36: 20089 | N36: 冥王哈迪斯 | O36: 你将沉入冥府之河
A37: 31 | B37: 大力神 | C37: =INT(RC[-2]/3+0.9) -> 11 | D37: 0 | E37: 20090|20091|20092 | F37: 1|2|3 | G37: 1|1|1 | H37: 2|2 | I37: =VLOOKUP(RC[-7],R7C14:R60C15,2,FALSE) -> 我会失败？除非死亡！ | J37: 20090 | K37: 20091 | L37: 20092 | N37: 狩猎女神 | O37: 月光洒落之地，狩猎开启之时
A38: 32 | B38: 冥王哈迪斯 | C38: =INT(RC[-2]/3+0.9) -> 11 | D38: 0 | E38: 20093|20094|20095 | F38: 1|2|3 | G38: 1|1|1 | H38: 2|2 | I38: =VLOOKUP(RC[-7],R7C14:R60C15,2,FALSE) -> 你将沉入冥府之河 | J38: 20093 | K38: 20094 | L38: 20095 | N38: 雅典娜 | O38: 智慧的光辉不会被遮掩
A39: 33 | B39: 石头人 | C39: =INT(RC[-2]/3+0.9) -> 11 | D39: 1 | E39: 20096|20097|20098 | F39: 1|2|3 | G39: 1|1|1 | H39: 2|2 | I39: =VLOOKUP(RC[-7],R7C14:R60C15,2,FALSE) -> 坚如磐石，不动如山 | J39: 20096 | K39: 20097 | L39: 20098 | N39: 独眼野蛮人 | O39: 毁灭——！！！！
A40: 34 | B40: 血源牧师 | C40: =INT(RC[-2]/3+0.9) -> 12 | D40: 0 | E40: 20099|20100|20101 | F40: 1|2|3 | G40: 1|1|1 | H40: 3|70 | I40: =VLOOKUP(RC[-7],R7C14:R60C15,2,FALSE) -> 你们不能通过这里 | J40: 20099 | K40: 20100 | L40: 20101 | N40: 宙斯 | O40: 雷霆的愤怒，你驾驭不住！
A41: 35 | B41: 屠夫 | C41: =INT(RC[-2]/3+0.9) -> 12 | D41: 0 | E41: 20102|20103|20104 | F41: 1|2|3 | G41: 1|1|1 | H41: 3|70 | I41: =VLOOKUP(RC[-7],R7C14:R60C15,2,FALSE) -> 死亡——！！！ | J41: 20102 | K41: 20103 | L41: 20104 | N41: 奎爷 | O41: 无战不胜，无往不利，谁能挡我？！
A42: 36 | B42: 树精 | C42: =INT(RC[-2]/3+0.9) -> 12 | D42: 1 | E42: 20105|20106|20107 | F42: 1|2|3 | G42: 1|1|1 | H42: 3|70 | I42: =VLOOKUP(RC[-7],R7C14:R60C15,2,FALSE) -> 这是自然之怒！ | J42: 20105 | K42: 20106 | L42: 20107 | N42: 潘多拉 | O42: 在灾厄中起舞，来吧，随我一起，奔赴死亡
A43: 37 | B43: 牛头人 | C43: =INT(RC[-2]/3+0.9) -> 13 | D43: 0 | E43: 20108|20109|20110 | F43: 1|2|3 | G43: 1|1|1 | H43: 4 | I43: =VLOOKUP(RC[-7],R7C14:R60C15,2,FALSE) -> 你当我的斧子是摆设吗？ | J43: 20108 | K43: 20109 | L43: 20110 | N43: 基伦 | O43: 正义不容动摇，而我既是正义
A44: 38 | B44: 火女 | C44: =INT(RC[-2]/3+0.9) -> 13 | D44: 0 | E44: 20111|20112|20113 | F44: 1|2|3 | G44: 1|1|1 | H44: 4 | I44: =VLOOKUP(RC[-7],R7C14:R60C15,2,FALSE) -> 你们可以在烈焰中坚持多久？ | J44: 20111 | K44: 20112 | L44: 20113 | N44: 半人马 | O44: 我的铁蹄无人可挡
A45: 39 | B45: 半人马 | C45: =INT(RC[-2]/3+0.9) -> 13 | D45: 1 | E45: 20114|20115|20116 | F45: 1|2|3 | G45: 1|1|1 | H45: 4 | I45: =VLOOKUP(RC[-7],R7C14:R60C15,2,FALSE) -> 我的铁蹄无人可挡 | J45: 20114 | K45: 20115 | L45: 20116 | N45: 石头人 | O45: 坚如磐石，不动如山
A46: 40 | B46: 食人魔 | C46: =INT(RC[-2]/3+0.9) -> 14 | D46: 0 | E46: 20117|20118|20119 | F46: 1|2|3 | G46: 1|1|1 | H46: 1|60 | I46: =VLOOKUP(RC[-7],R7C14:R60C15,2,FALSE) -> 区区食物而已！死吧！ | J46: 20117 | K46: 20118 | L46: 20119 | N46: 女警 | O46: 对付你们？只需要一枪！
A47: 41 | B47: 基伦 | C47: =INT(RC[-2]/3+0.9) -> 14 | D47: 0 | E47: 20120|20121|20122 | F47: 1|2|3 | G47: 1|1|1 | H47: 1|60 | I47: =VLOOKUP(RC[-7],R7C14:R60C15,2,FALSE) -> 正义不容动摇，而我既是正义 | J47: 20120 | K47: 20121 | L47: 20122 | N47: 食人魔 | O47: 区区食物而已！死吧！
A48: 42 | B48: 女警 | C48: =INT(RC[-2]/3+0.9) -> 14 | D48: 1 | E48: 20123|20124|20125 | F48: 1|2|3 | G48: 1|1|1 | H48: 1|60 | I48: =VLOOKUP(RC[-7],R7C14:R60C15,2,FALSE) -> 对付你们？只需要一枪！ | J48: 20123 | K48: 20124 | L48: 20125 | N48: 血源牧师 | O48: 你们不能通过这里
A49: 43 | B49: 小黑 | C49: =INT(RC[-2]/3+0.9) -> 15 | D49: 0 | E49: 20126|20127|20128 | F49: 1|2|3 | G49: 1|1|1 | H49: 2|2 | I49: =VLOOKUP(RC[-7],R7C14:R60C15,2,FALSE) -> 我的箭矢下不会有活人通过 | J49: 20126 | K49: 20127 | L49: 20128 | N49: 恶魔猎手 | O49: 除非死亡，不然我会阻止你们前进
A50: 44 | B50: 熊阿宝 | C50: =INT(RC[-2]/3+0.9) -> 15 | D50: 0 | E50: 20129|20130|20131 | F50: 1|2|3 | G50: 1|1|1 | H50: 2|2 | I50: =VLOOKUP(RC[-7],R7C14:R60C15,2,FALSE) -> 嗝！……谁……谁说我醉了？ | J50: 20129 | K50: 20130 | L50: 20131 | N50: 牛头人 | O50: 你当我的斧子是摆设吗？
A51: 45 | B51: 血色指挥官 | C51: =INT(RC[-2]/3+0.9) -> 15 | D51: 1 | E51: 20132|20133|20134 | F51: 1|2|3 | G51: 1|1|1 | H51: 2|2 | I51: =VLOOKUP(RC[-7],R7C14:R60C15,2,FALSE) -> 鲜血的辉光洒落，引领你们前往失败之途 | J51: 20132 | K51: 20133 | L51: 20134 | N51: 血色指挥官 | O51: 鲜血的辉光洒落，引领你们前往失败之途
A52: 46 | B52: 大检察官 | C52: =INT(RC[-2]/3+0.9) -> 16 | D52: 0 | E52: 20135|20136|20137 | F52: 1|2|3 | G52: 1|1|1 | H52: 3|60 | I52: =VLOOKUP(RC[-7],R7C14:R60C15,2,FALSE) -> 圣光会将你们驱逐 | J52: 20135 | K52: 20136 | L52: 20137 | N52: 熊阿宝 | O52: 嗝！……谁……谁说我醉了？
A53: 47 | B53: 恶魔猎手 | C53: =INT(RC[-2]/3+0.9) -> 16 | D53: 0 | E53: 20138|20139|20140 | F53: 1|2|3 | G53: 1|1|1 | H53: 3|60 | I53: =VLOOKUP(RC[-7],R7C14:R60C15,2,FALSE) -> 除非死亡，不然我会阻止你们前进 | J53: 20138 | K53: 20139 | L53: 20140 | N53: 小黑 | O53: 我的箭矢下不会有活人通过
A54: 48 | B54: 神圣牧师 | C54: =INT(RC[-2]/3+0.9) -> 16 | D54: 1 | E54: 20141|20142|20143 | F54: 1|2|3 | G54: 1|1|1 | H54: 3|60 | I54: =VLOOKUP(RC[-7],R7C14:R60C15,2,FALSE) -> 圣灵的名庇佑着我，前方无有失败 | J54: 20141 | K54: 20142 | L54: 20143 | N54: 火女 | O54: 你们可以在烈焰中坚持多久？
A55: 49 | B55: 超级队长 | C55: =INT(RC[-2]/3+0.9) -> 17 | D55: 0 | E55: 20144|20145|20146 | F55: 1|2|3 | G55: 1|1|1 | H55: 4 | I55: =VLOOKUP(RC[-7],R7C14:R60C15,2,FALSE) -> 击败我，你们才能继续前进 | J55: 20144 | K55: 20145 | L55: 20146 | N55: 大检察官 | O55: 圣光会将你们驱逐
A56: 50 | B56: 死亡武士 | C56: =INT(RC[-2]/3+0.9) -> 17 | D56: 0 | E56: 20147|20148|20149 | F56: 1|2|3 | G56: 1|1|1 | H56: 4 | I56: =VLOOKUP(RC[-7],R7C14:R60C15,2,FALSE) -> 总要有人倒在死亡女神的裙摆下 | J56: 20147 | K56: 20148 | L56: 20149 | N56: 神圣牧师 | O56: 圣灵的名庇佑着我，前方无有失败
A57: 51 | B57: 红头魔 | C57: =INT(RC[-2]/3+0.9) -> 17 | D57: 1 | E57: 20150|20151|20152 | F57: 1|2|3 | G57: 1|1|1 | H57: 4 | I57: =VLOOKUP(RC[-7],R7C14:R60C15,2,FALSE) -> 你们将被焚烧殆尽 | J57: 20150 | K57: 20151 | L57: 20152 | N57: 屠夫 | O57: 死亡——！！！
A58: 52 | B58: 终极队长 | C58: =INT(RC[-2]/3+0.9) -> 18 | D58: 0 | E58: 20153|20154|20155 | F58: 1|2|3 | G58: 1|1|1 | H58: 1|70 | I58: =VLOOKUP(RC[-7],R7C14:R60C15,2,FALSE) -> 这里没有你们可通过的路 | J58: 20153 | K58: 20154 | L58: 20155 | N58: 树精 | O58: 这是自然之怒！
A59: 53 | B59: 雷神 | C59: =INT(RC[-2]/3+0.9) -> 18 | D59: 0 | E59: 20156|20157|20158 | F59: 1|2|3 | G59: 1|1|1 | H59: 1|70 | I59: =VLOOKUP(RC[-7],R7C14:R60C15,2,FALSE) -> 你们将倒在雷霆之下 | J59: 20156 | K59: 20157 | L59: 20158 | N59: 巫妖之王 | O59: 你们将成为永恒，于冰封之中
A60: 54 | B60: 野蛮巨人 | C60: =INT(RC[-2]/3+0.9) -> 18 | D60: 1 | E60: 20159|20160|20161 | F60: 1|2|3 | G60: 1|1|1 | H60: 1|70 | I60: =VLOOKUP(RC[-7],R7C14:R60C15,2,FALSE) -> 你们就这样覆灭在我的怒火下吧！ | J60: 20159 | K60: 20160 | L60: 20161 | N60: 钢铁酋长 | O60: 就是你们妄图击败我？！
A61: 55 | B61: 致命特工 | C61: =INT(RC[-2]/3+0.9) -> 19 | D61: 0 | E61: 20162|20163|20164 | F61: 1|2|3 | G61: 1|1|1 | H61: 2|1 | I61: =VLOOKUP(RC[-7],R7C14:R60C15,2,FALSE) -> 只有击败我，你们才能通过这里 | J61: 20162 | K61: 20163 | L61: 20164
A62: 56 | B62: 鹰眸 | C62: =INT(RC[-2]/3+0.9) -> 19 | D62: 0 | E62: 20165|20166|20167 | F62: 1|2|3 | G62: 1|1|1 | H62: 2|1 | I62: =VLOOKUP(RC[-7],R7C14:R60C15,2,FALSE) -> 保护好你的心脏，我将要击穿它 | J62: 20165 | K62: 20166 | L62: 20167
A63: 57 | B63: 刀锋猎人 | C63: =INT(RC[-2]/3+0.9) -> 19 | D63: 1 | E63: 20168|20169|20170 | F63: 1|2|3 | G63: 1|1|1 | H63: 2|1 | I63: =VLOOKUP(RC[-7],R7C14:R60C15,2,FALSE) -> 胜利？那必然是属于我的 | J63: 20168 | K63: 20169 | L63: 20170
A64: 58 | B64: 地狱骑士 | C64: =INT(RC[-2]/3+0.9) -> 20 | D64: 0 | E64: 20171|20172|20173 | F64: 1|2|3 | G64: 1|1|1 | H64: 3|55 | I64: =VLOOKUP(RC[-7],R7C14:R60C15,2,FALSE) -> 地狱的火焰带来审判和死亡 | J64: 20171 | K64: 20172 | L64: 20173
A65: 59 | B65: 铁人 | C65: =INT(RC[-2]/3+0.9) -> 20 | D65: 0 | E65: 20174|20175|20176 | F65: 1|2|3 | G65: 1|1|1 | H65: 3|55 | I65: =VLOOKUP(RC[-7],R7C14:R60C15,2,FALSE) -> 你们毫无希望 | J65: 20174 | K65: 20175 | L65: 20176
A66: 60 | B66: 树人 | C66: =INT(RC[-2]/3+0.9) -> 20 | D66: 1 | E66: 20177|20178|20179 | F66: 1|2|3 | G66: 1|1|1 | H66: 3|55 | I66: =VLOOKUP(RC[-7],R7C14:R60C15,2,FALSE) -> 迎接死亡吧…… | J66: 20177 | K66: 20178 | L66: 20179
A67: 61 | B67: 超凡博士 | C67: =INT(RC[-2]/3+0.9) -> 21 | D67: 0 | E67: 20180|20181|20182 | F67: 1|2|3 | G67: 1|1|1 | H67: 4 | I67: =VLOOKUP(RC[-7],R7C14:R60C15,2,FALSE) -> 淹没在魔法的洪流里吧 | J67: 20180 | K67: 20181 | L67: 20182
A68: 62 | B68: 白凤凰 | C68: =INT(RC[-2]/3+0.9) -> 21 | D68: 0 | E68: 20183|20184|20185 | F68: 1|2|3 | G68: 1|1|1 | H68: 4 | I68: =VLOOKUP(RC[-7],R7C14:R60C15,2,FALSE) -> 淹没在光辉里吧 | J68: 20183 | K68: 20184 | L68: 20185
A69: 63 | B69: 地狱铁拳 | C69: =INT(RC[-2]/3+0.9) -> 21 | D69: 1 | E69: 20186|20187|20188 | F69: 1|2|3 | G69: 1|1|1 | H69: 4 | I69: =VLOOKUP(RC[-7],R7C14:R60C15,2,FALSE) -> 你们将深陷地狱——我带来的 | J69: 20186 | K69: 20187 | L69: 20188
A70: 64 | B70: 混沌女巫 | C70: =INT(RC[-2]/3+0.9) -> 22 | D70: 0 | E70: 20189|20190|20191 | F70: 1|2|3 | G70: 1|1|1 | H70: 1|70 | I70: =VLOOKUP(RC[-7],R7C14:R60C15,2,FALSE) -> 你们或我，归于混沌 | J70: 20189 | K70: 20190 | L70: 20191
A71: 65 | B71: 杰克船长 | C71: =INT(RC[-2]/3+0.9) -> 22 | D71: 0 | E71: 20192|20193|20194 | F71: 1|2|3 | G71: 1|1|1 | H71: 1|70 | I71: =VLOOKUP(RC[-7],R7C14:R60C15,2,FALSE) -> 看好你的血条！小鬼，我可不会放水！ | J71: 20192 | K71: 20193 | L71: 20194
A72: 66 | B72: 天使长 | C72: =INT(RC[-2]/3+0.9) -> 22 | D72: 1 | E72: 20195|20196|20197 | F72: 1|2|3 | G72: 1|1|1 | H72: 1|70 | I72: =VLOOKUP(RC[-7],R7C14:R60C15,2,FALSE) -> 圣光笼罩于我，将再无所畏惧 | J72: 20195 | K72: 20196 | L72: 20197
A73: 67 | B73: 独眼野蛮人 | C73: =INT(RC[-2]/3+0.9) -> 23 | D73: 0 | E73: 20198|20199|20200 | F73: 1|2|3 | G73: 1|1|1 | H73: 2|1 | I73: =VLOOKUP(RC[-7],R7C14:R60C15,2,FALSE) -> 毁灭——！！！！ | J73: 20198 | K73: 20199 | L73: 20200
A74: 68 | B74: 圣女贞德 | C74: =INT(RC[-2]/3+0.9) -> 23 | D74: 0 | E74: 20201|20202|20203 | F74: 1|2|3 | G74: 1|1|1 | H74: 2|1 | I74: =VLOOKUP(RC[-7],R7C14:R60C15,2,FALSE) -> 回归神的怀抱吧 | J74: 20201 | K74: 20202 | L74: 20203
A75: 69 | B75: 美杜莎 | C75: =INT(RC[-2]/3+0.9) -> 23 | D75: 1 | E75: 20204|20205|20206 | F75: 1|2|3 | G75: 1|1|1 | H75: 2|1 | I75: =VLOOKUP(RC[-7],R7C14:R60C15,2,FALSE) -> 你就这样化为石头，永恒地沉眠于此吧 | J75: 20204 | K75: 20205 | L75: 20206
A76: 70 | B76: 德古拉伯爵 | C76: =INT(RC[-2]/3+0.9) -> 24 | D76: 0 | E76: 20207|20208|20209 | F76: 1|2|3 | G76: 1|1|1 | H76: 3|50 | I76: =VLOOKUP(RC[-7],R7C14:R60C15,2,FALSE) -> 鲜血全都归于我…… | J76: 20207 | K76: 20208 | L76: 20209
A77: 71 | B77: 狩猎女神 | C77: =INT(RC[-2]/3+0.9) -> 24 | D77: 0 | E77: 20210|20211|20212 | F77: 1|2|3 | G77: 1|1|1 | H77: 3|50 | I77: =VLOOKUP(RC[-7],R7C14:R60C15,2,FALSE) -> 月光洒落之地，狩猎开启之时 | J77: 20210 | K77: 20211 | L77: 20212
A78: 72 | B78: 查理大帝 | C78: =INT(RC[-2]/3+0.9) -> 24 | D78: 1 | E78: 20213|20214|20215 | F78: 1|2|3 | G78: 1|1|1 | H78: 3|50 | I78: =VLOOKUP(RC[-7],R7C14:R60C15,2,FALSE) -> 我的前方是无尽的征途！ | J78: 20213 | K78: 20214 | L78: 20215
A79: 73 | B79: 佐罗 | C79: =INT(RC[-2]/3+0.9) -> 25 | D79: 0 | E79: 20216|20217|20218 | F79: 1|2|3 | G79: 1|1|1 | H79: 4 | I79: =VLOOKUP(RC[-7],R7C14:R60C15,2,FALSE) -> 只要赢就行吗……不错的条件 | J79: 20216 | K79: 20217 | L79: 20218
A80: 74 | B80: 亚马逊女王 | C80: =INT(RC[-2]/3+0.9) -> 25 | D80: 0 | E80: 20219|20220|20221 | F80: 1|2|3 | G80: 1|1|1 | H80: 4 | I80: =VLOOKUP(RC[-7],R7C14:R60C15,2,FALSE) -> 欢迎你们踏入狩猎的领域 | J80: 20219 | K80: 20220 | L80: 20221
A81: 75 | B81: 宙斯 | C81: =INT(RC[-2]/3+0.9) -> 25 | D81: 1 | E81: 20222|20223|20224 | F81: 1|2|3 | G81: 1|1|1 | H81: 4 | I81: =VLOOKUP(RC[-7],R7C14:R60C15,2,FALSE) -> 雷霆的愤怒，你驾驭不住！ | J81: 20222 | K81: 20223 | L81: 20224
A82: 76 | B82: 斯巴达 | C82: =INT(RC[-2]/3+0.9) -> 26 | D82: 0 | E82: 20225|20226|20227 | F82: 1|2|3 | G82: 1|1|1 | H82: 1|70 | I82: =VLOOKUP(RC[-7],R7C14:R60C15,2,FALSE) -> 你们无法越过我！ | J82: 20225 | K82: 20226 | L82: 20227
A83: 77 | B83: 阿努比斯 | C83: =INT(RC[-2]/3+0.9) -> 26 | D83: 0 | E83: 20228|20229|20230 | F83: 1|2|3 | G83: 1|1|1 | H83: 1|70 | I83: =VLOOKUP(RC[-7],R7C14:R60C15,2,FALSE) -> 我引领着死亡的到来…… | J83: 20228 | K83: 20229 | L83: 20230
A84: 78 | B84: 雅典娜 | C84: =INT(RC[-2]/3+0.9) -> 26 | D84: 1 | E84: 20231|20232|20233 | F84: 1|2|3 | G84: 1|1|1 | H84: 1|70 | I84: =VLOOKUP(RC[-7],R7C14:R60C15,2,FALSE) -> 智慧的光辉不会被遮掩 | J84: 20231 | K84: 20232 | L84: 20233
A85: 79 | B85: 大力神 | C85: =INT(RC[-2]/3+0.9) -> 27 | D85: 0 | E85: 20234|20235|20236 | F85: 1|2|3 | G85: 1|1|1 | H85: 2|1 | I85: =VLOOKUP(RC[-7],R7C14:R60C15,2,FALSE) -> 我会失败？除非死亡！ | J85: 20234 | K85: 20235 | L85: 20236
A86: 80 | B86: 冥王哈迪斯 | C86: =INT(RC[-2]/3+0.9) -> 27 | D86: 0 | E86: 20237|20238|20239 | F86: 1|2|3 | G86: 1|1|1 | H86: 2|1 | I86: =VLOOKUP(RC[-7],R7C14:R60C15,2,FALSE) -> 你将沉入冥府之河 | J86: 20237 | K86: 20238 | L86: 20239
A87: 81 | B87: 石头人 | C87: =INT(RC[-2]/3+0.9) -> 27 | D87: 1 | E87: 20240|20241|20242 | F87: 1|2|3 | G87: 1|1|1 | H87: 2|1 | I87: =VLOOKUP(RC[-7],R7C14:R60C15,2,FALSE) -> 坚如磐石，不动如山 | J87: 20240 | K87: 20241 | L87: 20242
A88: 82 | B88: 血源牧师 | C88: =INT(RC[-2]/3+0.9) -> 28 | D88: 0 | E88: 20243|20244|20245 | F88: 1|2|3 | G88: 1|1|1 | H88: 3|45 | I88: =VLOOKUP(RC[-7],R7C14:R60C15,2,FALSE) -> 你们不能通过这里 | J88: 20243 | K88: 20244 | L88: 20245
A89: 83 | B89: 屠夫 | C89: =INT(RC[-2]/3+0.9) -> 28 | D89: 0 | E89: 20246|20247|20248 | F89: 1|2|3 | G89: 1|1|1 | H89: 3|45 | I89: =VLOOKUP(RC[-7],R7C14:R60C15,2,FALSE) -> 死亡——！！！ | J89: 20246 | K89: 20247 | L89: 20248
A90: 84 | B90: 树精 | C90: =INT(RC[-2]/3+0.9) -> 28 | D90: 1 | E90: 20249|20250|20251 | F90: 1|2|3 | G90: 1|1|1 | H90: 3|45 | I90: =VLOOKUP(RC[-7],R7C14:R60C15,2,FALSE) -> 这是自然之怒！ | J90: 20249 | K90: 20250 | L90: 20251
A91: 85 | B91: 牛头人 | C91: =INT(RC[-2]/3+0.9) -> 29 | D91: 0 | E91: 20252|20253|20254 | F91: 1|2|3 | G91: 1|1|1 | H91: 4 | I91: =VLOOKUP(RC[-7],R7C14:R60C15,2,FALSE) -> 你当我的斧子是摆设吗？ | J91: 20252 | K91: 20253 | L91: 20254
A92: 86 | B92: 火女 | C92: =INT(RC[-2]/3+0.9) -> 29 | D92: 0 | E92: 20255|20256|20257 | F92: 1|2|3 | G92: 1|1|1 | H92: 4 | I92: =VLOOKUP(RC[-7],R7C14:R60C15,2,FALSE) -> 你们可以在烈焰中坚持多久？ | J92: 20255 | K92: 20256 | L92: 20257
A93: 87 | B93: 半人马 | C93: =INT(RC[-2]/3+0.9) -> 29 | D93: 1 | E93: 20258|20259|20260 | F93: 1|2|3 | G93: 1|1|1 | H93: 4 | I93: =VLOOKUP(RC[-7],R7C14:R60C15,2,FALSE) -> 我的铁蹄无人可挡 | J93: 20258 | K93: 20259 | L93: 20260
A94: 88 | B94: 食人魔 | C94: =INT(RC[-2]/3+0.9) -> 30 | D94: 0 | E94: 20261|20262|20263 | F94: 1|2|3 | G94: 1|1|1 | H94: 1|70 | I94: =VLOOKUP(RC[-7],R7C14:R60C15,2,FALSE) -> 区区食物而已！死吧！ | J94: 20261 | K94: 20262 | L94: 20263
A95: 89 | B95: 基伦 | C95: =INT(RC[-2]/3+0.9) -> 30 | D95: 0 | E95: 20264|20265|20266 | F95: 1|2|3 | G95: 1|1|1 | H95: 1|70 | I95: =VLOOKUP(RC[-7],R7C14:R60C15,2,FALSE) -> 正义不容动摇，而我既是正义 | J95: 20264 | K95: 20265 | L95: 20266
A96: 90 | B96: 女警 | C96: =INT(RC[-2]/3+0.9) -> 30 | D96: 1 | E96: 20267|20268|20269 | F96: 1|2|3 | G96: 1|1|1 | H96: 1|70 | I96: =VLOOKUP(RC[-7],R7C14:R60C15,2,FALSE) -> 对付你们？只需要一枪！ | J96: 20267 | K96: 20268 | L96: 20269
A97: 91 | B97: 小黑 | C97: =INT(RC[-2]/3+0.9) -> 31 | D97: 0 | E97: 20270|20271|20272 | F97: 1|2|3 | G97: 1|1|1 | H97: 2|1 | I97: =VLOOKUP(RC[-7],R7C14:R60C15,2,FALSE) -> 我的箭矢下不会有活人通过 | J97: 20270 | K97: 20271 | L97: 20272
A98: 92 | B98: 熊阿宝 | C98: =INT(RC[-2]/3+0.9) -> 31 | D98: 0 | E98: 20273|20274|20275 | F98: 1|2|3 | G98: 1|1|1 | H98: 2|1 | I98: =VLOOKUP(RC[-7],R7C14:R60C15,2,FALSE) -> 嗝！……谁……谁说我醉了？ | J98: 20273 | K98: 20274 | L98: 20275
A99: 93 | B99: 血色指挥官 | C99: =INT(RC[-2]/3+0.9) -> 31 | D99: 1 | E99: 20276|20277|20278 | F99: 1|2|3 | G99: 1|1|1 | H99: 2|1 | I99: =VLOOKUP(RC[-7],R7C14:R60C15,2,FALSE) -> 鲜血的辉光洒落，引领你们前往失败之途 | J99: 20276 | K99: 20277 | L99: 20278
A100: 94 | B100: 大检察官 | C100: =INT(RC[-2]/3+0.9) -> 32 | D100: 0 | E100: 20279|20280|20281 | F100: 1|2|3 | G100: 1|1|1 | H100: 3|45 | I100: =VLOOKUP(RC[-7],R7C14:R60C15,2,FALSE) -> 圣光会将你们驱逐 | J100: 20279 | K100: 20280 | L100: 20281
A101: 95 | B101: 恶魔猎手 | C101: =INT(RC[-2]/3+0.9) -> 32 | D101: 0 | E101: 20282|20283|20284 | F101: 1|2|3 | G101: 1|1|1 | H101: 3|45 | I101: =VLOOKUP(RC[-7],R7C14:R60C15,2,FALSE) -> 除非死亡，不然我会阻止你们前进 | J101: 20282 | K101: 20283 | L101: 20284
A102: 96 | B102: 神圣牧师 | C102: =INT(RC[-2]/3+0.9) -> 32 | D102: 1 | E102: 20285|20286|20287 | F102: 1|2|3 | G102: 1|1|1 | H102: 3|45 | I102: =VLOOKUP(RC[-7],R7C14:R60C15,2,FALSE) -> 圣灵的名庇佑着我，前方无有失败 | J102: 20285 | K102: 20286 | L102: 20287
A103: 97 | B103: 超级队长 | C103: =INT(RC[-2]/3+0.9) -> 33 | D103: 0 | E103: 20288|20289|20290 | F103: 1|2|3 | G103: 1|1|1 | H103: 4 | I103: =VLOOKUP(RC[-7],R7C14:R60C15,2,FALSE) -> 击败我，你们才能继续前进 | J103: 20288 | K103: 20289 | L103: 20290
A104: 98 | B104: 死亡武士 | C104: =INT(RC[-2]/3+0.9) -> 33 | D104: 0 | E104: 20291|20292|20293 | F104: 1|2|3 | G104: 1|1|1 | H104: 4 | I104: =VLOOKUP(RC[-7],R7C14:R60C15,2,FALSE) -> 总要有人倒在死亡女神的裙摆下 | J104: 20291 | K104: 20292 | L104: 20293
A105: 99 | B105: 红头魔 | C105: =INT(RC[-2]/3+0.9) -> 33 | D105: 1 | E105: 20294|20295|20296 | F105: 1|2|3 | G105: 1|1|1 | H105: 4 | I105: =VLOOKUP(RC[-7],R7C14:R60C15,2,FALSE) -> 你们将被焚烧殆尽 | J105: 20294 | K105: 20295 | L105: 20296
A106: 100 | B106: 终极队长 | C106: =INT(RC[-2]/3+0.9) -> 34 | D106: 0 | E106: =RC[5]&"|"&RC[6]&"|"&RC[7] -> 20297|20298|20299 | F106: 1|2|3 | G106: 1|1|1 | H106: 1|70 | I106: =VLOOKUP(RC[-7],R7C14:R60C15,2,FALSE) -> 这里没有你们可通过的路 | J106: 20297 | K106: 20298 | L106: 20299
A107: 101 | B107: 雷神 | C107: =INT(RC[-2]/3+0.9) -> 34 | D107: 0 | E107: =RC[5]&"|"&RC[6]&"|"&RC[7] -> 20300|20301|20302 | F107: 1|2|3 | G107: 1|1|1 | H107: 1|70 | I107: =VLOOKUP(RC[-7],R7C14:R60C15,2,FALSE) -> 你们将倒在雷霆之下 | J107: 20300 | K107: 20301 | L107: 20302
A108: 102 | B108: 野蛮巨人 | C108: =INT(RC[-2]/3+0.9) -> 34 | D108: 1 | E108: =RC[5]&"|"&RC[6]&"|"&RC[7] -> 20303|20304|20305 | F108: 1|2|3 | G108: 1|1|1 | H108: 1|70 | I108: =VLOOKUP(RC[-7],R7C14:R60C15,2,FALSE) -> 你们就这样覆灭在我的怒火下吧！ | J108: 20303 | K108: 20304 | L108: 20305
A109: 103 | B109: 致命特工 | C109: =INT(RC[-2]/3+0.9) -> 35 | D109: 0 | E109: =RC[5]&"|"&RC[6]&"|"&RC[7] -> 20306|20307|20308 | F109: 1|2|3 | G109: 1|1|1 | H109: 2|1 | I109: =VLOOKUP(RC[-7],R7C14:R60C15,2,FALSE) -> 只有击败我，你们才能通过这里 | J109: 20306 | K109: 20307 | L109: 20308
A110: 104 | B110: 鹰眸 | C110: =INT(RC[-2]/3+0.9) -> 35 | D110: 0 | E110: =RC[5]&"|"&RC[6]&"|"&RC[7] -> 20309|20310|20311 | F110: 1|2|3 | G110: 1|1|1 | H110: 2|1 | I110: =VLOOKUP(RC[-7],R7C14:R60C15,2,FALSE) -> 保护好你的心脏，我将要击穿它 | J110: 20309 | K110: 20310 | L110: 20311
A111: 105 | B111: 刀锋猎人 | C111: =INT(RC[-2]/3+0.9) -> 35 | D111: 1 | E111: =RC[5]&"|"&RC[6]&"|"&RC[7] -> 20312|20313|20314 | F111: 1|2|3 | G111: 1|1|1 | H111: 2|1 | I111: =VLOOKUP(RC[-7],R7C14:R60C15,2,FALSE) -> 胜利？那必然是属于我的 | J111: 20312 | K111: 20313 | L111: 20314
A112: 106 | B112: 地狱骑士 | C112: =INT(RC[-2]/3+0.9) -> 36 | D112: 0 | E112: =RC[5]&"|"&RC[6]&"|"&RC[7] -> 20315|20316|20317 | F112: 1|2|3 | G112: 1|1|1 | H112: 3|45 | I112: =VLOOKUP(RC[-7],R7C14:R60C15,2,FALSE) -> 地狱的火焰带来审判和死亡 | J112: 20315 | K112: 20316 | L112: 20317
A113: 107 | B113: 铁人 | C113: =INT(RC[-2]/3+0.9) -> 36 | D113: 0 | E113: =RC[5]&"|"&RC[6]&"|"&RC[7] -> 20318|20319|20320 | F113: 1|2|3 | G113: 1|1|1 | H113: 3|45 | I113: =VLOOKUP(RC[-7],R7C14:R60C15,2,FALSE) -> 你们毫无希望 | J113: 20318 | K113: 20319 | L113: 20320
A114: 108 | B114: 树人 | C114: =INT(RC[-2]/3+0.9) -> 36 | D114: 1 | E114: =RC[5]&"|"&RC[6]&"|"&RC[7] -> 20321|20322|20323 | F114: 1|2|3 | G114: 1|1|1 | H114: 3|45 | I114: =VLOOKUP(RC[-7],R7C14:R60C15,2,FALSE) -> 迎接死亡吧…… | J114: 20321 | K114: 20322 | L114: 20323
A115: 109 | B115: 超凡博士 | C115: =INT(RC[-2]/3+0.9) -> 37 | D115: 0 | E115: =RC[5]&"|"&RC[6]&"|"&RC[7] -> 20324|20325|20326 | F115: 1|2|3 | G115: 1|1|1 | H115: 4 | I115: =VLOOKUP(RC[-7],R7C14:R60C15,2,FALSE) -> 淹没在魔法的洪流里吧 | J115: 20324 | K115: 20325 | L115: 20326
A116: 110 | B116: 白凤凰 | C116: =INT(RC[-2]/3+0.9) -> 37 | D116: 0 | E116: =RC[5]&"|"&RC[6]&"|"&RC[7] -> 20327|20328|20329 | F116: 1|2|3 | G116: 1|1|1 | H116: 4 | I116: =VLOOKUP(RC[-7],R7C14:R60C15,2,FALSE) -> 淹没在光辉里吧 | J116: 20327 | K116: 20328 | L116: 20329
A117: 111 | B117: 地狱铁拳 | C117: =INT(RC[-2]/3+0.9) -> 37 | D117: 1 | E117: =RC[5]&"|"&RC[6]&"|"&RC[7] -> 20330|20331|20332 | F117: 1|2|3 | G117: 1|1|1 | H117: 4 | I117: =VLOOKUP(RC[-7],R7C14:R60C15,2,FALSE) -> 你们将深陷地狱——我带来的 | J117: 20330 | K117: 20331 | L117: 20332
A118: 112 | B118: 混沌女巫 | C118: =INT(RC[-2]/3+0.9) -> 38 | D118: 0 | E118: =RC[5]&"|"&RC[6]&"|"&RC[7] -> 20333|20334|20335 | F118: 1|2|3 | G118: 1|1|1 | H118: 1|70 | I118: =VLOOKUP(RC[-7],R7C14:R60C15,2,FALSE) -> 你们或我，归于混沌 | J118: 20333 | K118: 20334 | L118: 20335
A119: 113 | B119: 杰克船长 | C119: =INT(RC[-2]/3+0.9) -> 38 | D119: 0 | E119: =RC[5]&"|"&RC[6]&"|"&RC[7] -> 20336|20337|20338 | F119: 1|2|3 | G119: 1|1|1 | H119: 1|70 | I119: =VLOOKUP(RC[-7],R7C14:R60C15,2,FALSE) -> 看好你的血条！小鬼，我可不会放水！ | J119: 20336 | K119: 20337 | L119: 20338
A120: 114 | B120: 天使长 | C120: =INT(RC[-2]/3+0.9) -> 38 | D120: 1 | E120: =RC[5]&"|"&RC[6]&"|"&RC[7] -> 20339|20340|20341 | F120: 1|2|3 | G120: 1|1|1 | H120: 1|70 | I120: =VLOOKUP(RC[-7],R7C14:R60C15,2,FALSE) -> 圣光笼罩于我，将再无所畏惧 | J120: 20339 | K120: 20340 | L120: 20341
A121: 115 | B121: 独眼野蛮人 | C121: =INT(RC[-2]/3+0.9) -> 39 | D121: 0 | E121: =RC[5]&"|"&RC[6]&"|"&RC[7] -> 20342|20343|20344 | F121: 1|2|3 | G121: 1|1|1 | H121: 2|1 | I121: =VLOOKUP(RC[-7],R7C14:R60C15,2,FALSE) -> 毁灭——！！！！ | J121: 20342 | K121: 20343 | L121: 20344
A122: 116 | B122: 圣女贞德 | C122: =INT(RC[-2]/3+0.9) -> 39 | D122: 0 | E122: =RC[5]&"|"&RC[6]&"|"&RC[7] -> 20345|20346|20347 | F122: 1|2|3 | G122: 1|1|1 | H122: 2|1 | I122: =VLOOKUP(RC[-7],R7C14:R60C15,2,FALSE) -> 回归神的怀抱吧 | J122: 20345 | K122: 20346 | L122: 20347
A123: 117 | B123: 美杜莎 | C123: =INT(RC[-2]/3+0.9) -> 39 | D123: 1 | E123: =RC[5]&"|"&RC[6]&"|"&RC[7] -> 20348|20349|20350 | F123: 1|2|3 | G123: 1|1|1 | H123: 2|1 | I123: =VLOOKUP(RC[-7],R7C14:R60C15,2,FALSE) -> 你就这样化为石头，永恒地沉眠于此吧 | J123: 20348 | K123: 20349 | L123: 20350
A124: 118 | B124: 德古拉伯爵 | C124: =INT(RC[-2]/3+0.9) -> 40 | D124: 0 | E124: =RC[5]&"|"&RC[6]&"|"&RC[7] -> 20351|20352|20353 | F124: 1|2|3 | G124: 1|1|1 | H124: 3|45 | I124: =VLOOKUP(RC[-7],R7C14:R60C15,2,FALSE) -> 鲜血全都归于我…… | J124: 20351 | K124: 20352 | L124: 20353
A125: 119 | B125: 狩猎女神 | C125: =INT(RC[-2]/3+0.9) -> 40 | D125: 0 | E125: =RC[5]&"|"&RC[6]&"|"&RC[7] -> 20354|20355|20356 | F125: 1|2|3 | G125: 1|1|1 | H125: 3|45 | I125: =VLOOKUP(RC[-7],R7C14:R60C15,2,FALSE) -> 月光洒落之地，狩猎开启之时 | J125: 20354 | K125: 20355 | L125: 20356
A126: 120 | B126: 查理大帝 | C126: =INT(RC[-2]/3+0.9) -> 40 | D126: 1 | E126: =RC[5]&"|"&RC[6]&"|"&RC[7] -> 20357|20358|20359 | F126: 1|2|3 | G126: 1|1|1 | H126: 3|45 | I126: =VLOOKUP(RC[-7],R7C14:R60C15,2,FALSE) -> 我的前方是无尽的征途！ | J126: 20357 | K126: 20358 | L126: 20359
A127: 121 | B127: 佐罗 | C127: =INT(RC[-2]/3+0.9) -> 41 | D127: 0 | E127: =RC[5]&"|"&RC[6]&"|"&RC[7] -> 20360|20361|20362 | F127: 1|2|3 | G127: 1|1|1 | H127: 4 | I127: =VLOOKUP(RC[-7],R7C14:R60C15,2,FALSE) -> 只要赢就行吗……不错的条件 | J127: 20360 | K127: 20361 | L127: 20362
A128: 122 | B128: 亚马逊女王 | C128: =INT(RC[-2]/3+0.9) -> 41 | D128: 0 | E128: =RC[5]&"|"&RC[6]&"|"&RC[7] -> 20363|20364|20365 | F128: 1|2|3 | G128: 1|1|1 | H128: 4 | I128: =VLOOKUP(RC[-7],R7C14:R60C15,2,FALSE) -> 欢迎你们踏入狩猎的领域 | J128: 20363 | K128: 20364 | L128: 20365
A129: 123 | B129: 宙斯 | C129: =INT(RC[-2]/3+0.9) -> 41 | D129: 1 | E129: =RC[5]&"|"&RC[6]&"|"&RC[7] -> 20366|20367|20368 | F129: 1|2|3 | G129: 1|1|1 | H129: 4 | I129: =VLOOKUP(RC[-7],R7C14:R60C15,2,FALSE) -> 雷霆的愤怒，你驾驭不住！ | J129: 20366 | K129: 20367 | L129: 20368
A130: 124 | B130: 斯巴达 | C130: =INT(RC[-2]/3+0.9) -> 42 | D130: 0 | E130: =RC[5]&"|"&RC[6]&"|"&RC[7] -> 20369|20370|20371 | F130: 1|2|3 | G130: 1|1|1 | H130: 1|70 | I130: =VLOOKUP(RC[-7],R7C14:R60C15,2,FALSE) -> 你们无法越过我！ | J130: 20369 | K130: 20370 | L130: 20371
A131: 125 | B131: 阿努比斯 | C131: =INT(RC[-2]/3+0.9) -> 42 | D131: 0 | E131: =RC[5]&"|"&RC[6]&"|"&RC[7] -> 20372|20373|20374 | F131: 1|2|3 | G131: 1|1|1 | H131: 1|70 | I131: =VLOOKUP(RC[-7],R7C14:R60C15,2,FALSE) -> 我引领着死亡的到来…… | J131: 20372 | K131: 20373 | L131: 20374
A132: 126 | B132: 雅典娜 | C132: =INT(RC[-2]/3+0.9) -> 42 | D132: 1 | E132: =RC[5]&"|"&RC[6]&"|"&RC[7] -> 20375|20376|20377 | F132: 1|2|3 | G132: 1|1|1 | H132: 1|70 | I132: =VLOOKUP(RC[-7],R7C14:R60C15,2,FALSE) -> 智慧的光辉不会被遮掩 | J132: 20375 | K132: 20376 | L132: 20377
A133: 127 | B133: 大力神 | C133: =INT(RC[-2]/3+0.9) -> 43 | D133: 0 | E133: =RC[5]&"|"&RC[6]&"|"&RC[7] -> 20378|20379|20380 | F133: 1|2|3 | G133: 1|1|1 | H133: 2|1 | I133: =VLOOKUP(RC[-7],R7C14:R60C15,2,FALSE) -> 我会失败？除非死亡！ | J133: 20378 | K133: 20379 | L133: 20380
A134: 128 | B134: 冥王哈迪斯 | C134: =INT(RC[-2]/3+0.9) -> 43 | D134: 0 | E134: =RC[5]&"|"&RC[6]&"|"&RC[7] -> 20381|20382|20383 | F134: 1|2|3 | G134: 1|1|1 | H134: 2|1 | I134: =VLOOKUP(RC[-7],R7C14:R60C15,2,FALSE) -> 你将沉入冥府之河 | J134: 20381 | K134: 20382 | L134: 20383
A135: 129 | B135: 石头人 | C135: =INT(RC[-2]/3+0.9) -> 43 | D135: 1 | E135: =RC[5]&"|"&RC[6]&"|"&RC[7] -> 20384|20385|20386 | F135: 1|2|3 | G135: 1|1|1 | H135: 2|1 | I135: =VLOOKUP(RC[-7],R7C14:R60C15,2,FALSE) -> 坚如磐石，不动如山 | J135: 20384 | K135: 20385 | L135: 20386
A136: 130 | B136: 血源牧师 | C136: =INT(RC[-2]/3+0.9) -> 44 | D136: 0 | E136: =RC[5]&"|"&RC[6]&"|"&RC[7] -> 20387|20388|20389 | F136: 1|2|3 | G136: 1|1|1 | H136: 3|45 | I136: =VLOOKUP(RC[-7],R7C14:R60C15,2,FALSE) -> 你们不能通过这里 | J136: 20387 | K136: 20388 | L136: 20389
A137: 131 | B137: 屠夫 | C137: =INT(RC[-2]/3+0.9) -> 44 | D137: 0 | E137: =RC[5]&"|"&RC[6]&"|"&RC[7] -> 20390|20391|20392 | F137: 1|2|3 | G137: 1|1|1 | H137: 3|45 | I137: =VLOOKUP(RC[-7],R7C14:R60C15,2,FALSE) -> 死亡——！！！ | J137: 20390 | K137: 20391 | L137: 20392
A138: 132 | B138: 树精 | C138: =INT(RC[-2]/3+0.9) -> 44 | D138: 1 | E138: =RC[5]&"|"&RC[6]&"|"&RC[7] -> 20393|20394|20395 | F138: 1|2|3 | G138: 1|1|1 | H138: 3|45 | I138: =VLOOKUP(RC[-7],R7C14:R60C15,2,FALSE) -> 这是自然之怒！ | J138: 20393 | K138: 20394 | L138: 20395
A139: 133 | B139: 牛头人 | C139: =INT(RC[-2]/3+0.9) -> 45 | D139: 0 | E139: =RC[5]&"|"&RC[6]&"|"&RC[7] -> 20396|20397|20398 | F139: 1|2|3 | G139: 1|1|1 | H139: 4 | I139: =VLOOKUP(RC[-7],R7C14:R60C15,2,FALSE) -> 你当我的斧子是摆设吗？ | J139: 20396 | K139: 20397 | L139: 20398
A140: 134 | B140: 火女 | C140: =INT(RC[-2]/3+0.9) -> 45 | D140: 0 | E140: =RC[5]&"|"&RC[6]&"|"&RC[7] -> 20399|20400|20401 | F140: 1|2|3 | G140: 1|1|1 | H140: 4 | I140: =VLOOKUP(RC[-7],R7C14:R60C15,2,FALSE) -> 你们可以在烈焰中坚持多久？ | J140: 20399 | K140: 20400 | L140: 20401
A141: 135 | B141: 半人马 | C141: =INT(RC[-2]/3+0.9) -> 45 | D141: 1 | E141: =RC[5]&"|"&RC[6]&"|"&RC[7] -> 20402|20403|20404 | F141: 1|2|3 | G141: 1|1|1 | H141: 4 | I141: =VLOOKUP(RC[-7],R7C14:R60C15,2,FALSE) -> 我的铁蹄无人可挡 | J141: 20402 | K141: 20403 | L141: 20404
A142: 136 | B142: 食人魔 | C142: =INT(RC[-2]/3+0.9) -> 46 | D142: 0 | E142: =RC[5]&"|"&RC[6]&"|"&RC[7] -> 20405|20406|20407 | F142: 1|2|3 | G142: 1|1|1 | H142: 1|70 | I142: =VLOOKUP(RC[-7],R7C14:R60C15,2,FALSE) -> 区区食物而已！死吧！ | J142: 20405 | K142: 20406 | L142: 20407
A143: 137 | B143: 基伦 | C143: =INT(RC[-2]/3+0.9) -> 46 | D143: 0 | E143: =RC[5]&"|"&RC[6]&"|"&RC[7] -> 20408|20409|20410 | F143: 1|2|3 | G143: 1|1|1 | H143: 1|70 | I143: =VLOOKUP(RC[-7],R7C14:R60C15,2,FALSE) -> 正义不容动摇，而我既是正义 | J143: 20408 | K143: 20409 | L143: 20410
A144: 138 | B144: 女警 | C144: =INT(RC[-2]/3+0.9) -> 46 | D144: 1 | E144: =RC[5]&"|"&RC[6]&"|"&RC[7] -> 20411|20412|20413 | F144: 1|2|3 | G144: 1|1|1 | H144: 1|70 | I144: =VLOOKUP(RC[-7],R7C14:R60C15,2,FALSE) -> 对付你们？只需要一枪！ | J144: 20411 | K144: 20412 | L144: 20413
A145: 139 | B145: 小黑 | C145: =INT(RC[-2]/3+0.9) -> 47 | D145: 0 | E145: =RC[5]&"|"&RC[6]&"|"&RC[7] -> 20414|20415|20416 | F145: 1|2|3 | G145: 1|1|1 | H145: 2|1 | I145: =VLOOKUP(RC[-7],R7C14:R60C15,2,FALSE) -> 我的箭矢下不会有活人通过 | J145: 20414 | K145: 20415 | L145: 20416
A146: 140 | B146: 熊阿宝 | C146: =INT(RC[-2]/3+0.9) -> 47 | D146: 0 | E146: =RC[5]&"|"&RC[6]&"|"&RC[7] -> 20417|20418|20419 | F146: 1|2|3 | G146: 1|1|1 | H146: 2|1 | I146: =VLOOKUP(RC[-7],R7C14:R60C15,2,FALSE) -> 嗝！……谁……谁说我醉了？ | J146: 20417 | K146: 20418 | L146: 20419
A147: 141 | B147: 血色指挥官 | C147: =INT(RC[-2]/3+0.9) -> 47 | D147: 1 | E147: =RC[5]&"|"&RC[6]&"|"&RC[7] -> 20420|20421|20422 | F147: 1|2|3 | G147: 1|1|1 | H147: 2|1 | I147: =VLOOKUP(RC[-7],R7C14:R60C15,2,FALSE) -> 鲜血的辉光洒落，引领你们前往失败之途 | J147: 20420 | K147: 20421 | L147: 20422
A148: 142 | B148: 大检察官 | C148: =INT(RC[-2]/3+0.9) -> 48 | D148: 0 | E148: =RC[5]&"|"&RC[6]&"|"&RC[7] -> 20423|20424|20425 | F148: 1|2|3 | G148: 1|1|1 | H148: 3|45 | I148: =VLOOKUP(RC[-7],R7C14:R60C15,2,FALSE) -> 圣光会将你们驱逐 | J148: 20423 | K148: 20424 | L148: 20425
A149: 143 | B149: 恶魔猎手 | C149: =INT(RC[-2]/3+0.9) -> 48 | D149: 0 | E149: =RC[5]&"|"&RC[6]&"|"&RC[7] -> 20426|20427|20428 | F149: 1|2|3 | G149: 1|1|1 | H149: 3|45 | I149: =VLOOKUP(RC[-7],R7C14:R60C15,2,FALSE) -> 除非死亡，不然我会阻止你们前进 | J149: 20426 | K149: 20427 | L149: 20428
A150: 144 | B150: 神圣牧师 | C150: =INT(RC[-2]/3+0.9) -> 48 | D150: 1 | E150: =RC[5]&"|"&RC[6]&"|"&RC[7] -> 20429|20430|20431 | F150: 1|2|3 | G150: 1|1|1 | H150: 3|45 | I150: =VLOOKUP(RC[-7],R7C14:R60C15,2,FALSE) -> 圣灵的名庇佑着我，前方无有失败 | J150: 20429 | K150: 20430 | L150: 20431
A151: 145 | B151: 超级队长 | C151: =INT(RC[-2]/3+0.9) -> 49 | D151: 0 | E151: =RC[5]&"|"&RC[6]&"|"&RC[7] -> 20432|20433|20434 | F151: 1|2|3 | G151: 1|1|1 | H151: 4 | I151: =VLOOKUP(RC[-7],R7C14:R60C15,2,FALSE) -> 击败我，你们才能继续前进 | J151: 20432 | K151: 20433 | L151: 20434
A152: 146 | B152: 死亡武士 | C152: =INT(RC[-2]/3+0.9) -> 49 | D152: 0 | E152: =RC[5]&"|"&RC[6]&"|"&RC[7] -> 20435|20436|20437 | F152: 1|2|3 | G152: 1|1|1 | H152: 4 | I152: =VLOOKUP(RC[-7],R7C14:R60C15,2,FALSE) -> 总要有人倒在死亡女神的裙摆下 | J152: 20435 | K152: 20436 | L152: 20437
A153: 147 | B153: 红头魔 | C153: =INT(RC[-2]/3+0.9) -> 49 | D153: 1 | E153: =RC[5]&"|"&RC[6]&"|"&RC[7] -> 20438|20439|20440 | F153: 1|2|3 | G153: 1|1|1 | H153: 4 | I153: =VLOOKUP(RC[-7],R7C14:R60C15,2,FALSE) -> 你们将被焚烧殆尽 | J153: 20438 | K153: 20439 | L153: 20440
A154: 148 | B154: 终极队长 | C154: =INT(RC[-2]/3+0.9) -> 50 | D154: 0 | E154: =RC[5]&"|"&RC[6]&"|"&RC[7] -> 20441|20442|20443 | F154: 1|2|3 | G154: 1|1|1 | H154: 1|70 | I154: =VLOOKUP(RC[-7],R7C14:R60C15,2,FALSE) -> 这里没有你们可通过的路 | J154: 20441 | K154: 20442 | L154: 20443
A155: 149 | B155: 雷神 | C155: =INT(RC[-2]/3+0.9) -> 50 | D155: 0 | E155: =RC[5]&"|"&RC[6]&"|"&RC[7] -> 20444|20445|20446 | F155: 1|2|3 | G155: 1|1|1 | H155: 1|70 | I155: =VLOOKUP(RC[-7],R7C14:R60C15,2,FALSE) -> 你们将倒在雷霆之下 | J155: 20444 | K155: 20445 | L155: 20446
A156: 150 | B156: 野蛮巨人 | C156: =INT(RC[-2]/3+0.9) -> 50 | D156: 1 | E156: =RC[5]&"|"&RC[6]&"|"&RC[7] -> 20447|20448|20449 | F156: 1|2|3 | G156: 1|1|1 | H156: 1|70 | I156: =VLOOKUP(RC[-7],R7C14:R60C15,2,FALSE) -> 你们就这样覆灭在我的怒火下吧！ | J156: 20447 | K156: 20448 | L156: 20449
A157: 151 | B157: 致命特工 | C157: =INT(RC[-2]/3+0.9) -> 51 | D157: 0 | E157: =RC[5]&"|"&RC[6]&"|"&RC[7] -> 20450|20451|20452 | F157: 1|2|3 | G157: 1|1|1 | H157: 2|1 | I157: =VLOOKUP(RC[-7],R7C14:R60C15,2,FALSE) -> 只有击败我，你们才能通过这里 | J157: 20450 | K157: 20451 | L157: 20452
A158: 152 | B158: 鹰眸 | C158: =INT(RC[-2]/3+0.9) -> 51 | D158: 0 | E158: =RC[5]&"|"&RC[6]&"|"&RC[7] -> 20453|20454|20455 | F158: 1|2|3 | G158: 1|1|1 | H158: 2|1 | I158: =VLOOKUP(RC[-7],R7C14:R60C15,2,FALSE) -> 保护好你的心脏，我将要击穿它 | J158: 20453 | K158: 20454 | L158: 20455
A159: 153 | B159: 刀锋猎人 | C159: =INT(RC[-2]/3+0.9) -> 51 | D159: 1 | E159: =RC[5]&"|"&RC[6]&"|"&RC[7] -> 20456|20457|20458 | F159: 1|2|3 | G159: 1|1|1 | H159: 2|1 | I159: =VLOOKUP(RC[-7],R7C14:R60C15,2,FALSE) -> 胜利？那必然是属于我的 | J159: 20456 | K159: 20457 | L159: 20458
A160: 154 | B160: 地狱骑士 | C160: =INT(RC[-2]/3+0.9) -> 52 | D160: 0 | E160: =RC[5]&"|"&RC[6]&"|"&RC[7] -> 20459|20460|20461 | F160: 1|2|3 | G160: 1|1|1 | H160: 3|45 | I160: =VLOOKUP(RC[-7],R7C14:R60C15,2,FALSE) -> 地狱的火焰带来审判和死亡 | J160: 20459 | K160: 20460 | L160: 20461
A161: 155 | B161: 铁人 | C161: =INT(RC[-2]/3+0.9) -> 52 | D161: 0 | E161: =RC[5]&"|"&RC[6]&"|"&RC[7] -> 20462|20463|20464 | F161: 1|2|3 | G161: 1|1|1 | H161: 3|45 | I161: =VLOOKUP(RC[-7],R7C14:R60C15,2,FALSE) -> 你们毫无希望 | J161: 20462 | K161: 20463 | L161: 20464
A162: 156 | B162: 树人 | C162: =INT(RC[-2]/3+0.9) -> 52 | D162: 1 | E162: =RC[5]&"|"&RC[6]&"|"&RC[7] -> 20465|20466|20467 | F162: 1|2|3 | G162: 1|1|1 | H162: 3|45 | I162: =VLOOKUP(RC[-7],R7C14:R60C15,2,FALSE) -> 迎接死亡吧…… | J162: 20465 | K162: 20466 | L162: 20467
A163: 157 | B163: 超凡博士 | C163: =INT(RC[-2]/3+0.9) -> 53 | D163: 0 | E163: =RC[5]&"|"&RC[6]&"|"&RC[7] -> 20468|20469|20470 | F163: 1|2|3 | G163: 1|1|1 | H163: 4 | I163: =VLOOKUP(RC[-7],R7C14:R60C15,2,FALSE) -> 淹没在魔法的洪流里吧 | J163: 20468 | K163: 20469 | L163: 20470
A164: 158 | B164: 白凤凰 | C164: =INT(RC[-2]/3+0.9) -> 53 | D164: 0 | E164: =RC[5]&"|"&RC[6]&"|"&RC[7] -> 20471|20472|20473 | F164: 1|2|3 | G164: 1|1|1 | H164: 4 | I164: =VLOOKUP(RC[-7],R7C14:R60C15,2,FALSE) -> 淹没在光辉里吧 | J164: 20471 | K164: 20472 | L164: 20473
A165: 159 | B165: 地狱铁拳 | C165: =INT(RC[-2]/3+0.9) -> 53 | D165: 1 | E165: =RC[5]&"|"&RC[6]&"|"&RC[7] -> 20474|20475|20476 | F165: 1|2|3 | G165: 1|1|1 | H165: 4 | I165: =VLOOKUP(RC[-7],R7C14:R60C15,2,FALSE) -> 你们将深陷地狱——我带来的 | J165: 20474 | K165: 20475 | L165: 20476
A166: 160 | B166: 混沌女巫 | C166: =INT(RC[-2]/3+0.9) -> 54 | D166: 0 | E166: =RC[5]&"|"&RC[6]&"|"&RC[7] -> 20477|20478|20479 | F166: 1|2|3 | G166: 1|1|1 | H166: 1|70 | I166: =VLOOKUP(RC[-7],R7C14:R60C15,2,FALSE) -> 你们或我，归于混沌 | J166: 20477 | K166: 20478 | L166: 20479
A167: 161 | B167: 杰克船长 | C167: =INT(RC[-2]/3+0.9) -> 54 | D167: 0 | E167: =RC[5]&"|"&RC[6]&"|"&RC[7] -> 20480|20481|20482 | F167: 1|2|3 | G167: 1|1|1 | H167: 1|70 | I167: =VLOOKUP(RC[-7],R7C14:R60C15,2,FALSE) -> 看好你的血条！小鬼，我可不会放水！ | J167: 20480 | K167: 20481 | L167: 20482
A168: 162 | B168: 天使长 | C168: =INT(RC[-2]/3+0.9) -> 54 | D168: 1 | E168: =RC[5]&"|"&RC[6]&"|"&RC[7] -> 20483|20484|20485 | F168: 1|2|3 | G168: 1|1|1 | H168: 1|70 | I168: =VLOOKUP(RC[-7],R7C14:R60C15,2,FALSE) -> 圣光笼罩于我，将再无所畏惧 | J168: 20483 | K168: 20484 | L168: 20485
A169: 163 | B169: 独眼野蛮人 | C169: =INT(RC[-2]/3+0.9) -> 55 | D169: 0 | E169: =RC[5]&"|"&RC[6]&"|"&RC[7] -> 20486|20487|20488 | F169: 1|2|3 | G169: 1|1|1 | H169: 2|1 | I169: =VLOOKUP(RC[-7],R7C14:R60C15,2,FALSE) -> 毁灭——！！！！ | J169: 20486 | K169: 20487 | L169: 20488
A170: 164 | B170: 圣女贞德 | C170: =INT(RC[-2]/3+0.9) -> 55 | D170: 0 | E170: =RC[5]&"|"&RC[6]&"|"&RC[7] -> 20489|20490|20491 | F170: 1|2|3 | G170: 1|1|1 | H170: 2|1 | I170: =VLOOKUP(RC[-7],R7C14:R60C15,2,FALSE) -> 回归神的怀抱吧 | J170: 20489 | K170: 20490 | L170: 20491
A171: 165 | B171: 美杜莎 | C171: =INT(RC[-2]/3+0.9) -> 55 | D171: 1 | E171: =RC[5]&"|"&RC[6]&"|"&RC[7] -> 20492|20493|20494 | F171: 1|2|3 | G171: 1|1|1 | H171: 2|1 | I171: =VLOOKUP(RC[-7],R7C14:R60C15,2,FALSE) -> 你就这样化为石头，永恒地沉眠于此吧 | J171: 20492 | K171: 20493 | L171: 20494
A172: 166 | B172: 德古拉伯爵 | C172: =INT(RC[-2]/3+0.9) -> 56 | D172: 0 | E172: =RC[5]&"|"&RC[6]&"|"&RC[7] -> 20495|20496|20497 | F172: 1|2|3 | G172: 1|1|1 | H172: 3|45 | I172: =VLOOKUP(RC[-7],R7C14:R60C15,2,FALSE) -> 鲜血全都归于我…… | J172: 20495 | K172: 20496 | L172: 20497
A173: 167 | B173: 狩猎女神 | C173: =INT(RC[-2]/3+0.9) -> 56 | D173: 0 | E173: =RC[5]&"|"&RC[6]&"|"&RC[7] -> 20498|20499|20500 | F173: 1|2|3 | G173: 1|1|1 | H173: 3|45 | I173: =VLOOKUP(RC[-7],R7C14:R60C15,2,FALSE) -> 月光洒落之地，狩猎开启之时 | J173: 20498 | K173: 20499 | L173: 20500
A174: 168 | B174: 查理大帝 | C174: =INT(RC[-2]/3+0.9) -> 56 | D174: 1 | E174: =RC[5]&"|"&RC[6]&"|"&RC[7] -> 20501|20502|20503 | F174: 1|2|3 | G174: 1|1|1 | H174: 3|45 | I174: =VLOOKUP(RC[-7],R7C14:R60C15,2,FALSE) -> 我的前方是无尽的征途！ | J174: 20501 | K174: 20502 | L174: 20503
A175: 169 | B175: 佐罗 | C175: =INT(RC[-2]/3+0.9) -> 57 | D175: 0 | E175: =RC[5]&"|"&RC[6]&"|"&RC[7] -> 20504|20505|20506 | F175: 1|2|3 | G175: 1|1|1 | H175: 4 | I175: =VLOOKUP(RC[-7],R7C14:R60C15,2,FALSE) -> 只要赢就行吗……不错的条件 | J175: 20504 | K175: 20505 | L175: 20506
A176: 170 | B176: 亚马逊女王 | C176: =INT(RC[-2]/3+0.9) -> 57 | D176: 0 | E176: =RC[5]&"|"&RC[6]&"|"&RC[7] -> 20507|20508|20509 | F176: 1|2|3 | G176: 1|1|1 | H176: 4 | I176: =VLOOKUP(RC[-7],R7C14:R60C15,2,FALSE) -> 欢迎你们踏入狩猎的领域 | J176: 20507 | K176: 20508 | L176: 20509
A177: 171 | B177: 宙斯 | C177: =INT(RC[-2]/3+0.9) -> 57 | D177: 1 | E177: =RC[5]&"|"&RC[6]&"|"&RC[7] -> 20510|20511|20512 | F177: 1|2|3 | G177: 1|1|1 | H177: 4 | I177: =VLOOKUP(RC[-7],R7C14:R60C15,2,FALSE) -> 雷霆的愤怒，你驾驭不住！ | J177: 20510 | K177: 20511 | L177: 20512
A178: 172 | B178: 斯巴达 | C178: =INT(RC[-2]/3+0.9) -> 58 | D178: 0 | E178: =RC[5]&"|"&RC[6]&"|"&RC[7] -> 20513|20514|20515 | F178: 1|2|3 | G178: 1|1|1 | H178: 1|70 | I178: =VLOOKUP(RC[-7],R7C14:R60C15,2,FALSE) -> 你们无法越过我！ | J178: 20513 | K178: 20514 | L178: 20515
A179: 173 | B179: 阿努比斯 | C179: =INT(RC[-2]/3+0.9) -> 58 | D179: 0 | E179: =RC[5]&"|"&RC[6]&"|"&RC[7] -> 20516|20517|20518 | F179: 1|2|3 | G179: 1|1|1 | H179: 1|70 | I179: =VLOOKUP(RC[-7],R7C14:R60C15,2,FALSE) -> 我引领着死亡的到来…… | J179: 20516 | K179: 20517 | L179: 20518
A180: 174 | B180: 雅典娜 | C180: =INT(RC[-2]/3+0.9) -> 58 | D180: 1 | E180: =RC[5]&"|"&RC[6]&"|"&RC[7] -> 20519|20520|20521 | F180: 1|2|3 | G180: 1|1|1 | H180: 1|70 | I180: =VLOOKUP(RC[-7],R7C14:R60C15,2,FALSE) -> 智慧的光辉不会被遮掩 | J180: 20519 | K180: 20520 | L180: 20521
A181: 175 | B181: 大力神 | C181: =INT(RC[-2]/3+0.9) -> 59 | D181: 0 | E181: =RC[5]&"|"&RC[6]&"|"&RC[7] -> 20522|20523|20524 | F181: 1|2|3 | G181: 1|1|1 | H181: 2|1 | I181: =VLOOKUP(RC[-7],R7C14:R60C15,2,FALSE) -> 我会失败？除非死亡！ | J181: 20522 | K181: 20523 | L181: 20524
A182: 176 | B182: 冥王哈迪斯 | C182: =INT(RC[-2]/3+0.9) -> 59 | D182: 0 | E182: =RC[5]&"|"&RC[6]&"|"&RC[7] -> 20525|20526|20527 | F182: 1|2|3 | G182: 1|1|1 | H182: 2|1 | I182: =VLOOKUP(RC[-7],R7C14:R60C15,2,FALSE) -> 你将沉入冥府之河 | J182: 20525 | K182: 20526 | L182: 20527
A183: 177 | B183: 石头人 | C183: =INT(RC[-2]/3+0.9) -> 59 | D183: 1 | E183: =RC[5]&"|"&RC[6]&"|"&RC[7] -> 20528|20529|20530 | F183: 1|2|3 | G183: 1|1|1 | H183: 2|1 | I183: =VLOOKUP(RC[-7],R7C14:R60C15,2,FALSE) -> 坚如磐石，不动如山 | J183: 20528 | K183: 20529 | L183: 20530
A184: 178 | B184: 血源牧师 | C184: =INT(RC[-2]/3+0.9) -> 60 | D184: 0 | E184: =RC[5]&"|"&RC[6]&"|"&RC[7] -> 20531|20532|20533 | F184: 1|2|3 | G184: 1|1|1 | H184: 3|45 | I184: =VLOOKUP(RC[-7],R7C14:R60C15,2,FALSE) -> 你们不能通过这里 | J184: 20531 | K184: 20532 | L184: 20533
A185: 179 | B185: 屠夫 | C185: =INT(RC[-2]/3+0.9) -> 60 | D185: 0 | E185: =RC[5]&"|"&RC[6]&"|"&RC[7] -> 20534|20535|20536 | F185: 1|2|3 | G185: 1|1|1 | H185: 3|45 | I185: =VLOOKUP(RC[-7],R7C14:R60C15,2,FALSE) -> 死亡——！！！ | J185: 20534 | K185: 20535 | L185: 20536
A186: 180 | B186: 树精 | C186: =INT(RC[-2]/3+0.9) -> 60 | D186: 1 | E186: =RC[5]&"|"&RC[6]&"|"&RC[7] -> 20537|20538|20539 | F186: 1|2|3 | G186: 1|1|1 | H186: 3|45 | I186: =VLOOKUP(RC[-7],R7C14:R60C15,2,FALSE) -> 这是自然之怒！ | J186: 20537 | K186: 20538 | L186: 20539
A187: 181 | B187: 牛头人 | C187: =INT(RC[-2]/3+0.9) -> 61 | D187: 0 | E187: =RC[5]&"|"&RC[6]&"|"&RC[7] -> 20540|20541|20542 | F187: 1|2|3 | G187: 1|1|1 | H187: 4 | I187: =VLOOKUP(RC[-7],R7C14:R60C15,2,FALSE) -> 你当我的斧子是摆设吗？ | J187: 20540 | K187: 20541 | L187: 20542
A188: 182 | B188: 火女 | C188: =INT(RC[-2]/3+0.9) -> 61 | D188: 0 | E188: =RC[5]&"|"&RC[6]&"|"&RC[7] -> 20543|20544|20545 | F188: 1|2|3 | G188: 1|1|1 | H188: 4 | I188: =VLOOKUP(RC[-7],R7C14:R60C15,2,FALSE) -> 你们可以在烈焰中坚持多久？ | J188: 20543 | K188: 20544 | L188: 20545
A189: 183 | B189: 半人马 | C189: =INT(RC[-2]/3+0.9) -> 61 | D189: 1 | E189: =RC[5]&"|"&RC[6]&"|"&RC[7] -> 20546|20547|20548 | F189: 1|2|3 | G189: 1|1|1 | H189: 4 | I189: =VLOOKUP(RC[-7],R7C14:R60C15,2,FALSE) -> 我的铁蹄无人可挡 | J189: 20546 | K189: 20547 | L189: 20548
A190: 184 | B190: 食人魔 | C190: =INT(RC[-2]/3+0.9) -> 62 | D190: 0 | E190: =RC[5]&"|"&RC[6]&"|"&RC[7] -> 20549|20550|20551 | F190: 1|2|3 | G190: 1|1|1 | H190: 1|70 | I190: =VLOOKUP(RC[-7],R7C14:R60C15,2,FALSE) -> 区区食物而已！死吧！ | J190: 20549 | K190: 20550 | L190: 20551
A191: 185 | B191: 基伦 | C191: =INT(RC[-2]/3+0.9) -> 62 | D191: 0 | E191: =RC[5]&"|"&RC[6]&"|"&RC[7] -> 20552|20553|20554 | F191: 1|2|3 | G191: 1|1|1 | H191: 1|70 | I191: =VLOOKUP(RC[-7],R7C14:R60C15,2,FALSE) -> 正义不容动摇，而我既是正义 | J191: 20552 | K191: 20553 | L191: 20554
A192: 186 | B192: 女警 | C192: =INT(RC[-2]/3+0.9) -> 62 | D192: 1 | E192: =RC[5]&"|"&RC[6]&"|"&RC[7] -> 20555|20556|20557 | F192: 1|2|3 | G192: 1|1|1 | H192: 1|70 | I192: =VLOOKUP(RC[-7],R7C14:R60C15,2,FALSE) -> 对付你们？只需要一枪！ | J192: 20555 | K192: 20556 | L192: 20557
A193: 187 | B193: 小黑 | C193: =INT(RC[-2]/3+0.9) -> 63 | D193: 0 | E193: =RC[5]&"|"&RC[6]&"|"&RC[7] -> 20558|20559|20560 | F193: 1|2|3 | G193: 1|1|1 | H193: 2|1 | I193: =VLOOKUP(RC[-7],R7C14:R60C15,2,FALSE) -> 我的箭矢下不会有活人通过 | J193: 20558 | K193: 20559 | L193: 20560
A194: 188 | B194: 熊阿宝 | C194: =INT(RC[-2]/3+0.9) -> 63 | D194: 0 | E194: =RC[5]&"|"&RC[6]&"|"&RC[7] -> 20561|20562|20563 | F194: 1|2|3 | G194: 1|1|1 | H194: 2|1 | I194: =VLOOKUP(RC[-7],R7C14:R60C15,2,FALSE) -> 嗝！……谁……谁说我醉了？ | J194: 20561 | K194: 20562 | L194: 20563
A195: 189 | B195: 血色指挥官 | C195: =INT(RC[-2]/3+0.9) -> 63 | D195: 1 | E195: =RC[5]&"|"&RC[6]&"|"&RC[7] -> 20564|20565|20566 | F195: 1|2|3 | G195: 1|1|1 | H195: 2|1 | I195: =VLOOKUP(RC[-7],R7C14:R60C15,2,FALSE) -> 鲜血的辉光洒落，引领你们前往失败之途 | J195: 20564 | K195: 20565 | L195: 20566
A196: 190 | B196: 大检察官 | C196: =INT(RC[-2]/3+0.9) -> 64 | D196: 0 | E196: =RC[5]&"|"&RC[6]&"|"&RC[7] -> 20567|20568|20569 | F196: 1|2|3 | G196: 1|1|1 | H196: 3|45 | I196: =VLOOKUP(RC[-7],R7C14:R60C15,2,FALSE) -> 圣光会将你们驱逐 | J196: 20567 | K196: 20568 | L196: 20569
A197: 191 | B197: 恶魔猎手 | C197: =INT(RC[-2]/3+0.9) -> 64 | D197: 0 | E197: =RC[5]&"|"&RC[6]&"|"&RC[7] -> 20570|20571|20572 | F197: 1|2|3 | G197: 1|1|1 | H197: 3|45 | I197: =VLOOKUP(RC[-7],R7C14:R60C15,2,FALSE) -> 除非死亡，不然我会阻止你们前进 | J197: 20570 | K197: 20571 | L197: 20572
A198: 192 | B198: 神圣牧师 | C198: =INT(RC[-2]/3+0.9) -> 64 | D198: 1 | E198: =RC[5]&"|"&RC[6]&"|"&RC[7] -> 20573|20574|20575 | F198: 1|2|3 | G198: 1|1|1 | H198: 3|45 | I198: =VLOOKUP(RC[-7],R7C14:R60C15,2,FALSE) -> 圣灵的名庇佑着我，前方无有失败 | J198: 20573 | K198: 20574 | L198: 20575
A199: 193 | B199: 超级队长 | C199: =INT(RC[-2]/3+0.9) -> 65 | D199: 0 | E199: =RC[5]&"|"&RC[6]&"|"&RC[7] -> 20576|20577|20578 | F199: 1|2|3 | G199: 1|1|1 | H199: 4 | I199: =VLOOKUP(RC[-7],R7C14:R60C15,2,FALSE) -> 击败我，你们才能继续前进 | J199: 20576 | K199: 20577 | L199: 20578
A200: 194 | B200: 死亡武士 | C200: =INT(RC[-2]/3+0.9) -> 65 | D200: 0 | E200: =RC[5]&"|"&RC[6]&"|"&RC[7] -> 20579|20580|20581 | F200: 1|2|3 | G200: 1|1|1 | H200: 4 | I200: =VLOOKUP(RC[-7],R7C14:R60C15,2,FALSE) -> 总要有人倒在死亡女神的裙摆下 | J200: 20579 | K200: 20580 | L200: 20581
A201: 195 | B201: 红头魔 | C201: =INT(RC[-2]/3+0.9) -> 65 | D201: 1 | E201: =RC[5]&"|"&RC[6]&"|"&RC[7] -> 20582|20583|20584 | F201: 1|2|3 | G201: 1|1|1 | H201: 4 | I201: =VLOOKUP(RC[-7],R7C14:R60C15,2,FALSE) -> 你们将被焚烧殆尽 | J201: 20582 | K201: 20583 | L201: 20584
A202: 196 | B202: 终极队长 | C202: =INT(RC[-2]/3+0.9) -> 66 | D202: 0 | E202: =RC[5]&"|"&RC[6]&"|"&RC[7] -> 20585|20586|20587 | F202: 1|2|3 | G202: 1|1|1 | H202: 1|70 | I202: =VLOOKUP(RC[-7],R7C14:R60C15,2,FALSE) -> 这里没有你们可通过的路 | J202: 20585 | K202: 20586 | L202: 20587
A203: 197 | B203: 雷神 | C203: =INT(RC[-2]/3+0.9) -> 66 | D203: 0 | E203: =RC[5]&"|"&RC[6]&"|"&RC[7] -> 20588|20589|20590 | F203: 1|2|3 | G203: 1|1|1 | H203: 1|70 | I203: =VLOOKUP(RC[-7],R7C14:R60C15,2,FALSE) -> 你们将倒在雷霆之下 | J203: 20588 | K203: 20589 | L203: 20590
A204: 198 | B204: 野蛮巨人 | C204: =INT(RC[-2]/3+0.9) -> 66 | D204: 1 | E204: =RC[5]&"|"&RC[6]&"|"&RC[7] -> 20591|20592|20593 | F204: 1|2|3 | G204: 1|1|1 | H204: 1|70 | I204: =VLOOKUP(RC[-7],R7C14:R60C15,2,FALSE) -> 你们就这样覆灭在我的怒火下吧！ | J204: 20591 | K204: 20592 | L204: 20593
A205: 199 | B205: 致命特工 | C205: =INT(RC[-2]/3+0.9) -> 67 | D205: 0 | E205: =RC[5]&"|"&RC[6]&"|"&RC[7] -> 20594|20595|20596 | F205: 1|2|3 | G205: 1|1|1 | H205: 2|1 | I205: =VLOOKUP(RC[-7],R7C14:R60C15,2,FALSE) -> 只有击败我，你们才能通过这里 | J205: 20594 | K205: 20595 | L205: 20596
A206: 200 | B206: 鹰眸 | C206: =INT(RC[-2]/3+0.9) -> 67 | D206: 0 | E206: =RC[5]&"|"&RC[6]&"|"&RC[7] -> 20597|20598|20599 | F206: 1|2|3 | G206: 1|1|1 | H206: 2|1 | I206: =VLOOKUP(RC[-7],R7C14:R60C15,2,FALSE) -> 保护好你的心脏，我将要击穿它 | J206: 20597 | K206: 20598 | L206: 20599
A207: 201 | B207: 刀锋猎人 | C207: =INT(RC[-2]/3+0.9) -> 67 | D207: 1 | E207: =RC[5]&"|"&RC[6]&"|"&RC[7] -> 20600|20601|20602 | F207: 1|2|3 | G207: 1|1|1 | H207: 2|1 | I207: =VLOOKUP(RC[-7],R7C14:R60C15,2,FALSE) -> 胜利？那必然是属于我的 | J207: 20600 | K207: 20601 | L207: 20602
A208: 202 | B208: 地狱骑士 | C208: =INT(RC[-2]/3+0.9) -> 68 | D208: 0 | E208: =RC[5]&"|"&RC[6]&"|"&RC[7] -> 20603|20604|20605 | F208: 1|2|3 | G208: 1|1|1 | H208: 3|45 | I208: =VLOOKUP(RC[-7],R7C14:R60C15,2,FALSE) -> 地狱的火焰带来审判和死亡 | J208: 20603 | K208: 20604 | L208: 20605
A209: 203 | B209: 铁人 | C209: =INT(RC[-2]/3+0.9) -> 68 | D209: 0 | E209: =RC[5]&"|"&RC[6]&"|"&RC[7] -> 20606|20607|20608 | F209: 1|2|3 | G209: 1|1|1 | H209: 3|45 | I209: =VLOOKUP(RC[-7],R7C14:R60C15,2,FALSE) -> 你们毫无希望 | J209: 20606 | K209: 20607 | L209: 20608
A210: 204 | B210: 树人 | C210: =INT(RC[-2]/3+0.9) -> 68 | D210: 1 | E210: =RC[5]&"|"&RC[6]&"|"&RC[7] -> 20609|20610|20611 | F210: 1|2|3 | G210: 1|1|1 | H210: 3|45 | I210: =VLOOKUP(RC[-7],R7C14:R60C15,2,FALSE) -> 迎接死亡吧…… | J210: 20609 | K210: 20610 | L210: 20611
A211: 205 | B211: 超凡博士 | C211: =INT(RC[-2]/3+0.9) -> 69 | D211: 0 | E211: =RC[5]&"|"&RC[6]&"|"&RC[7] -> 20612|20613|20614 | F211: 1|2|3 | G211: 1|1|1 | H211: 4 | I211: =VLOOKUP(RC[-7],R7C14:R60C15,2,FALSE) -> 淹没在魔法的洪流里吧 | J211: 20612 | K211: 20613 | L211: 20614
A212: 206 | B212: 白凤凰 | C212: =INT(RC[-2]/3+0.9) -> 69 | D212: 0 | E212: =RC[5]&"|"&RC[6]&"|"&RC[7] -> 20615|20616|20617 | F212: 1|2|3 | G212: 1|1|1 | H212: 4 | I212: =VLOOKUP(RC[-7],R7C14:R60C15,2,FALSE) -> 淹没在光辉里吧 | J212: 20615 | K212: 20616 | L212: 20617
A213: 207 | B213: 地狱铁拳 | C213: =INT(RC[-2]/3+0.9) -> 69 | D213: 1 | E213: =RC[5]&"|"&RC[6]&"|"&RC[7] -> 20618|20619|20620 | F213: 1|2|3 | G213: 1|1|1 | H213: 4 | I213: =VLOOKUP(RC[-7],R7C14:R60C15,2,FALSE) -> 你们将深陷地狱——我带来的 | J213: 20618 | K213: 20619 | L213: 20620
A214: 208 | B214: 混沌女巫 | C214: =INT(RC[-2]/3+0.9) -> 70 | D214: 0 | E214: =RC[5]&"|"&RC[6]&"|"&RC[7] -> 20621|20622|20623 | F214: 1|2|3 | G214: 1|1|1 | H214: 1|70 | I214: =VLOOKUP(RC[-7],R7C14:R60C15,2,FALSE) -> 你们或我，归于混沌 | J214: 20621 | K214: 20622 | L214: 20623
A215: 209 | B215: 杰克船长 | C215: =INT(RC[-2]/3+0.9) -> 70 | D215: 0 | E215: =RC[5]&"|"&RC[6]&"|"&RC[7] -> 20624|20625|20626 | F215: 1|2|3 | G215: 1|1|1 | H215: 1|70 | I215: =VLOOKUP(RC[-7],R7C14:R60C15,2,FALSE) -> 看好你的血条！小鬼，我可不会放水！ | J215: 20624 | K215: 20625 | L215: 20626
A216: 210 | B216: 天使长 | C216: =INT(RC[-2]/3+0.9) -> 70 | D216: 1 | E216: =RC[5]&"|"&RC[6]&"|"&RC[7] -> 20627|20628|20629 | F216: 1|2|3 | G216: 1|1|1 | H216: 1|70 | I216: =VLOOKUP(RC[-7],R7C14:R60C15,2,FALSE) -> 圣光笼罩于我，将再无所畏惧 | J216: 20627 | K216: 20628 | L216: 20629
A217: 211 | B217: 独眼野蛮人 | C217: =INT(RC[-2]/3+0.9) -> 71 | D217: 0 | E217: =RC[5]&"|"&RC[6]&"|"&RC[7] -> 20630|20631|20632 | F217: 1|2|3 | G217: 1|1|1 | H217: 2|1 | I217: =VLOOKUP(RC[-7],R7C14:R60C15,2,FALSE) -> 毁灭——！！！！ | J217: 20630 | K217: 20631 | L217: 20632
A218: 212 | B218: 圣女贞德 | C218: =INT(RC[-2]/3+0.9) -> 71 | D218: 0 | E218: =RC[5]&"|"&RC[6]&"|"&RC[7] -> 20633|20634|20635 | F218: 1|2|3 | G218: 1|1|1 | H218: 2|1 | I218: =VLOOKUP(RC[-7],R7C14:R60C15,2,FALSE) -> 回归神的怀抱吧 | J218: 20633 | K218: 20634 | L218: 20635
A219: 213 | B219: 美杜莎 | C219: =INT(RC[-2]/3+0.9) -> 71 | D219: 1 | E219: =RC[5]&"|"&RC[6]&"|"&RC[7] -> 20636|20637|20638 | F219: 1|2|3 | G219: 1|1|1 | H219: 2|1 | I219: =VLOOKUP(RC[-7],R7C14:R60C15,2,FALSE) -> 你就这样化为石头，永恒地沉眠于此吧 | J219: 20636 | K219: 20637 | L219: 20638
A220: 214 | B220: 德古拉伯爵 | C220: =INT(RC[-2]/3+0.9) -> 72 | D220: 0 | E220: =RC[5]&"|"&RC[6]&"|"&RC[7] -> 20639|20640|20641 | F220: 1|2|3 | G220: 1|1|1 | H220: 3|45 | I220: =VLOOKUP(RC[-7],R7C14:R60C15,2,FALSE) -> 鲜血全都归于我…… | J220: 20639 | K220: 20640 | L220: 20641
A221: 215 | B221: 狩猎女神 | C221: =INT(RC[-2]/3+0.9) -> 72 | D221: 0 | E221: =RC[5]&"|"&RC[6]&"|"&RC[7] -> 20642|20643|20644 | F221: 1|2|3 | G221: 1|1|1 | H221: 3|45 | I221: =VLOOKUP(RC[-7],R7C14:R60C15,2,FALSE) -> 月光洒落之地，狩猎开启之时 | J221: 20642 | K221: 20643 | L221: 20644
A222: 216 | B222: 查理大帝 | C222: =INT(RC[-2]/3+0.9) -> 72 | D222: 1 | E222: =RC[5]&"|"&RC[6]&"|"&RC[7] -> 20645|20646|20647 | F222: 1|2|3 | G222: 1|1|1 | H222: 3|45 | I222: =VLOOKUP(RC[-7],R7C14:R60C15,2,FALSE) -> 我的前方是无尽的征途！ | J222: 20645 | K222: 20646 | L222: 20647
A223: 217 | B223: 佐罗 | C223: =INT(RC[-2]/3+0.9) -> 73 | D223: 0 | E223: =RC[5]&"|"&RC[6]&"|"&RC[7] -> 20648|20649|20650 | F223: 1|2|3 | G223: 1|1|1 | H223: 4 | I223: =VLOOKUP(RC[-7],R7C14:R60C15,2,FALSE) -> 只要赢就行吗……不错的条件 | J223: 20648 | K223: 20649 | L223: 20650
A224: 218 | B224: 亚马逊女王 | C224: =INT(RC[-2]/3+0.9) -> 73 | D224: 0 | E224: =RC[5]&"|"&RC[6]&"|"&RC[7] -> 20651|20652|20653 | F224: 1|2|3 | G224: 1|1|1 | H224: 4 | I224: =VLOOKUP(RC[-7],R7C14:R60C15,2,FALSE) -> 欢迎你们踏入狩猎的领域 | J224: 20651 | K224: 20652 | L224: 20653
A225: 219 | B225: 宙斯 | C225: =INT(RC[-2]/3+0.9) -> 73 | D225: 1 | E225: =RC[5]&"|"&RC[6]&"|"&RC[7] -> 20654|20655|20656 | F225: 1|2|3 | G225: 1|1|1 | H225: 4 | I225: =VLOOKUP(RC[-7],R7C14:R60C15,2,FALSE) -> 雷霆的愤怒，你驾驭不住！ | J225: 20654 | K225: 20655 | L225: 20656
A226: 220 | B226: 斯巴达 | C226: =INT(RC[-2]/3+0.9) -> 74 | D226: 0 | E226: =RC[5]&"|"&RC[6]&"|"&RC[7] -> 20657|20658|20659 | F226: 1|2|3 | G226: 1|1|1 | H226: 1|70 | I226: =VLOOKUP(RC[-7],R7C14:R60C15,2,FALSE) -> 你们无法越过我！ | J226: 20657 | K226: 20658 | L226: 20659
A227: 221 | B227: 阿努比斯 | C227: =INT(RC[-2]/3+0.9) -> 74 | D227: 0 | E227: =RC[5]&"|"&RC[6]&"|"&RC[7] -> 20660|20661|20662 | F227: 1|2|3 | G227: 1|1|1 | H227: 1|70 | I227: =VLOOKUP(RC[-7],R7C14:R60C15,2,FALSE) -> 我引领着死亡的到来…… | J227: 20660 | K227: 20661 | L227: 20662
A228: 222 | B228: 雅典娜 | C228: =INT(RC[-2]/3+0.9) -> 74 | D228: 1 | E228: =RC[5]&"|"&RC[6]&"|"&RC[7] -> 20663|20664|20665 | F228: 1|2|3 | G228: 1|1|1 | H228: 1|70 | I228: =VLOOKUP(RC[-7],R7C14:R60C15,2,FALSE) -> 智慧的光辉不会被遮掩 | J228: 20663 | K228: 20664 | L228: 20665
A229: 223 | B229: 大力神 | C229: =INT(RC[-2]/3+0.9) -> 75 | D229: 0 | E229: =RC[5]&"|"&RC[6]&"|"&RC[7] -> 20666|20667|20668 | F229: 1|2|3 | G229: 1|1|1 | H229: 2|1 | I229: =VLOOKUP(RC[-7],R7C14:R60C15,2,FALSE) -> 我会失败？除非死亡！ | J229: 20666 | K229: 20667 | L229: 20668
A230: 224 | B230: 冥王哈迪斯 | C230: =INT(RC[-2]/3+0.9) -> 75 | D230: 0 | E230: =RC[5]&"|"&RC[6]&"|"&RC[7] -> 20669|20670|20671 | F230: 1|2|3 | G230: 1|1|1 | H230: 2|1 | I230: =VLOOKUP(RC[-7],R7C14:R60C15,2,FALSE) -> 你将沉入冥府之河 | J230: 20669 | K230: 20670 | L230: 20671
A231: 225 | B231: 石头人 | C231: =INT(RC[-2]/3+0.9) -> 75 | D231: 1 | E231: =RC[5]&"|"&RC[6]&"|"&RC[7] -> 20672|20673|20674 | F231: 1|2|3 | G231: 1|1|1 | H231: 2|1 | I231: =VLOOKUP(RC[-7],R7C14:R60C15,2,FALSE) -> 坚如磐石，不动如山 | J231: 20672 | K231: 20673 | L231: 20674
A232: 226 | B232: 血源牧师 | C232: =INT(RC[-2]/3+0.9) -> 76 | D232: 0 | E232: =RC[5]&"|"&RC[6]&"|"&RC[7] -> 20675|20676|20677 | F232: 1|2|3 | G232: 1|1|1 | H232: 3|45 | I232: =VLOOKUP(RC[-7],R7C14:R60C15,2,FALSE) -> 你们不能通过这里 | J232: 20675 | K232: 20676 | L232: 20677
A233: 227 | B233: 屠夫 | C233: =INT(RC[-2]/3+0.9) -> 76 | D233: 0 | E233: =RC[5]&"|"&RC[6]&"|"&RC[7] -> 20678|20679|20680 | F233: 1|2|3 | G233: 1|1|1 | H233: 3|45 | I233: =VLOOKUP(RC[-7],R7C14:R60C15,2,FALSE) -> 死亡——！！！ | J233: 20678 | K233: 20679 | L233: 20680
A234: 228 | B234: 树精 | C234: =INT(RC[-2]/3+0.9) -> 76 | D234: 1 | E234: =RC[5]&"|"&RC[6]&"|"&RC[7] -> 20681|20682|20683 | F234: 1|2|3 | G234: 1|1|1 | H234: 3|45 | I234: =VLOOKUP(RC[-7],R7C14:R60C15,2,FALSE) -> 这是自然之怒！ | J234: 20681 | K234: 20682 | L234: 20683
A235: 229 | B235: 牛头人 | C235: =INT(RC[-2]/3+0.9) -> 77 | D235: 0 | E235: =RC[5]&"|"&RC[6]&"|"&RC[7] -> 20684|20685|20686 | F235: 1|2|3 | G235: 1|1|1 | H235: 4 | I235: =VLOOKUP(RC[-7],R7C14:R60C15,2,FALSE) -> 你当我的斧子是摆设吗？ | J235: 20684 | K235: 20685 | L235: 20686
A236: 230 | B236: 火女 | C236: =INT(RC[-2]/3+0.9) -> 77 | D236: 0 | E236: =RC[5]&"|"&RC[6]&"|"&RC[7] -> 20687|20688|20689 | F236: 1|2|3 | G236: 1|1|1 | H236: 4 | I236: =VLOOKUP(RC[-7],R7C14:R60C15,2,FALSE) -> 你们可以在烈焰中坚持多久？ | J236: 20687 | K236: 20688 | L236: 20689
A237: 231 | B237: 半人马 | C237: =INT(RC[-2]/3+0.9) -> 77 | D237: 1 | E237: =RC[5]&"|"&RC[6]&"|"&RC[7] -> 20690|20691|20692 | F237: 1|2|3 | G237: 1|1|1 | H237: 4 | I237: =VLOOKUP(RC[-7],R7C14:R60C15,2,FALSE) -> 我的铁蹄无人可挡 | J237: 20690 | K237: 20691 | L237: 20692
A238: 232 | B238: 食人魔 | C238: =INT(RC[-2]/3+0.9) -> 78 | D238: 0 | E238: =RC[5]&"|"&RC[6]&"|"&RC[7] -> 20693|20694|20695 | F238: 1|2|3 | G238: 1|1|1 | H238: 1|70 | I238: =VLOOKUP(RC[-7],R7C14:R60C15,2,FALSE) -> 区区食物而已！死吧！ | J238: 20693 | K238: 20694 | L238: 20695
A239: 233 | B239: 基伦 | C239: =INT(RC[-2]/3+0.9) -> 78 | D239: 0 | E239: =RC[5]&"|"&RC[6]&"|"&RC[7] -> 20696|20697|20698 | F239: 1|2|3 | G239: 1|1|1 | H239: 1|70 | I239: =VLOOKUP(RC[-7],R7C14:R60C15,2,FALSE) -> 正义不容动摇，而我既是正义 | J239: 20696 | K239: 20697 | L239: 20698
A240: 234 | B240: 女警 | C240: =INT(RC[-2]/3+0.9) -> 78 | D240: 1 | E240: =RC[5]&"|"&RC[6]&"|"&RC[7] -> 20699|20700|20701 | F240: 1|2|3 | G240: 1|1|1 | H240: 1|70 | I240: =VLOOKUP(RC[-7],R7C14:R60C15,2,FALSE) -> 对付你们？只需要一枪！ | J240: 20699 | K240: 20700 | L240: 20701
A241: 235 | B241: 小黑 | C241: =INT(RC[-2]/3+0.9) -> 79 | D241: 0 | E241: =RC[5]&"|"&RC[6]&"|"&RC[7] -> 20702|20703|20704 | F241: 1|2|3 | G241: 1|1|1 | H241: 2|1 | I241: =VLOOKUP(RC[-7],R7C14:R60C15,2,FALSE) -> 我的箭矢下不会有活人通过 | J241: 20702 | K241: 20703 | L241: 20704
A242: 236 | B242: 熊阿宝 | C242: =INT(RC[-2]/3+0.9) -> 79 | D242: 0 | E242: =RC[5]&"|"&RC[6]&"|"&RC[7] -> 20705|20706|20707 | F242: 1|2|3 | G242: 1|1|1 | H242: 2|1 | I242: =VLOOKUP(RC[-7],R7C14:R60C15,2,FALSE) -> 嗝！……谁……谁说我醉了？ | J242: 20705 | K242: 20706 | L242: 20707
A243: 237 | B243: 血色指挥官 | C243: =INT(RC[-2]/3+0.9) -> 79 | D243: 1 | E243: =RC[5]&"|"&RC[6]&"|"&RC[7] -> 20708|20709|20710 | F243: 1|2|3 | G243: 1|1|1 | H243: 2|1 | I243: =VLOOKUP(RC[-7],R7C14:R60C15,2,FALSE) -> 鲜血的辉光洒落，引领你们前往失败之途 | J243: 20708 | K243: 20709 | L243: 20710
A244: 238 | B244: 大检察官 | C244: =INT(RC[-2]/3+0.9) -> 80 | D244: 0 | E244: =RC[5]&"|"&RC[6]&"|"&RC[7] -> 20711|20712|20713 | F244: 1|2|3 | G244: 1|1|1 | H244: 3|45 | I244: =VLOOKUP(RC[-7],R7C14:R60C15,2,FALSE) -> 圣光会将你们驱逐 | J244: 20711 | K244: 20712 | L244: 20713
A245: 239 | B245: 恶魔猎手 | C245: =INT(RC[-2]/3+0.9) -> 80 | D245: 0 | E245: =RC[5]&"|"&RC[6]&"|"&RC[7] -> 20714|20715|20716 | F245: 1|2|3 | G245: 1|1|1 | H245: 3|45 | I245: =VLOOKUP(RC[-7],R7C14:R60C15,2,FALSE) -> 除非死亡，不然我会阻止你们前进 | J245: 20714 | K245: 20715 | L245: 20716
A246: 240 | B246: 神圣牧师 | C246: =INT(RC[-2]/3+0.9) -> 80 | D246: 1 | E246: =RC[5]&"|"&RC[6]&"|"&RC[7] -> 20717|20718|20719 | F246: 1|2|3 | G246: 1|1|1 | H246: 3|45 | I246: =VLOOKUP(RC[-7],R7C14:R60C15,2,FALSE) -> 圣灵的名庇佑着我，前方无有失败 | J246: 20717 | K246: 20718 | L246: 20719
A247: 241 | B247: 超级队长 | C247: =INT(RC[-2]/3+0.9) -> 81 | D247: 0 | E247: =RC[5]&"|"&RC[6]&"|"&RC[7] -> 20720|20721|20722 | F247: 1|2|3 | G247: 1|1|1 | H247: 4 | I247: =VLOOKUP(RC[-7],R7C14:R60C15,2,FALSE) -> 击败我，你们才能继续前进 | J247: 20720 | K247: 20721 | L247: 20722
A248: 242 | B248: 死亡武士 | C248: =INT(RC[-2]/3+0.9) -> 81 | D248: 0 | E248: =RC[5]&"|"&RC[6]&"|"&RC[7] -> 20723|20724|20725 | F248: 1|2|3 | G248: 1|1|1 | H248: 4 | I248: =VLOOKUP(RC[-7],R7C14:R60C15,2,FALSE) -> 总要有人倒在死亡女神的裙摆下 | J248: 20723 | K248: 20724 | L248: 20725
A249: 243 | B249: 红头魔 | C249: =INT(RC[-2]/3+0.9) -> 81 | D249: 1 | E249: =RC[5]&"|"&RC[6]&"|"&RC[7] -> 20726|20727|20728 | F249: 1|2|3 | G249: 1|1|1 | H249: 4 | I249: =VLOOKUP(RC[-7],R7C14:R60C15,2,FALSE) -> 你们将被焚烧殆尽 | J249: 20726 | K249: 20727 | L249: 20728
A250: 244 | B250: 终极队长 | C250: =INT(RC[-2]/3+0.9) -> 82 | D250: 0 | E250: =RC[5]&"|"&RC[6]&"|"&RC[7] -> 20729|20730|20731 | F250: 1|2|3 | G250: 1|1|1 | H250: 1|70 | I250: =VLOOKUP(RC[-7],R7C14:R60C15,2,FALSE) -> 这里没有你们可通过的路 | J250: 20729 | K250: 20730 | L250: 20731
A251: 245 | B251: 雷神 | C251: =INT(RC[-2]/3+0.9) -> 82 | D251: 0 | E251: =RC[5]&"|"&RC[6]&"|"&RC[7] -> 20732|20733|20734 | F251: 1|2|3 | G251: 1|1|1 | H251: 1|70 | I251: =VLOOKUP(RC[-7],R7C14:R60C15,2,FALSE) -> 你们将倒在雷霆之下 | J251: 20732 | K251: 20733 | L251: 20734
A252: 246 | B252: 野蛮巨人 | C252: =INT(RC[-2]/3+0.9) -> 82 | D252: 1 | E252: =RC[5]&"|"&RC[6]&"|"&RC[7] -> 20735|20736|20737 | F252: 1|2|3 | G252: 1|1|1 | H252: 1|70 | I252: =VLOOKUP(RC[-7],R7C14:R60C15,2,FALSE) -> 你们就这样覆灭在我的怒火下吧！ | J252: 20735 | K252: 20736 | L252: 20737
A253: 247 | B253: 致命特工 | C253: =INT(RC[-2]/3+0.9) -> 83 | D253: 0 | E253: =RC[5]&"|"&RC[6]&"|"&RC[7] -> 20738|20739|20740 | F253: 1|2|3 | G253: 1|1|1 | H253: 2|1 | I253: =VLOOKUP(RC[-7],R7C14:R60C15,2,FALSE) -> 只有击败我，你们才能通过这里 | J253: 20738 | K253: 20739 | L253: 20740
A254: 248 | B254: 鹰眸 | C254: =INT(RC[-2]/3+0.9) -> 83 | D254: 0 | E254: =RC[5]&"|"&RC[6]&"|"&RC[7] -> 20741|20742|20743 | F254: 1|2|3 | G254: 1|1|1 | H254: 2|1 | I254: =VLOOKUP(RC[-7],R7C14:R60C15,2,FALSE) -> 保护好你的心脏，我将要击穿它 | J254: 20741 | K254: 20742 | L254: 20743
A255: 249 | B255: 刀锋猎人 | C255: =INT(RC[-2]/3+0.9) -> 83 | D255: 1 | E255: =RC[5]&"|"&RC[6]&"|"&RC[7] -> 20744|20745|20746 | F255: 1|2|3 | G255: 1|1|1 | H255: 2|1 | I255: =VLOOKUP(RC[-7],R7C14:R60C15,2,FALSE) -> 胜利？那必然是属于我的 | J255: 20744 | K255: 20745 | L255: 20746
A256: 250 | B256: 地狱骑士 | C256: =INT(RC[-2]/3+0.9) -> 84 | D256: 0 | E256: =RC[5]&"|"&RC[6]&"|"&RC[7] -> 20747|20748|20749 | F256: 1|2|3 | G256: 1|1|1 | H256: 3|45 | I256: =VLOOKUP(RC[-7],R7C14:R60C15,2,FALSE) -> 地狱的火焰带来审判和死亡 | J256: 20747 | K256: 20748 | L256: 20749
A257: 251 | B257: 铁人 | C257: =INT(RC[-2]/3+0.9) -> 84 | D257: 0 | E257: =RC[5]&"|"&RC[6]&"|"&RC[7] -> 20750|20751|20752 | F257: 1|2|3 | G257: 1|1|1 | H257: 3|45 | I257: =VLOOKUP(RC[-7],R7C14:R60C15,2,FALSE) -> 你们毫无希望 | J257: 20750 | K257: 20751 | L257: 20752
A258: 252 | B258: 树人 | C258: =INT(RC[-2]/3+0.9) -> 84 | D258: 1 | E258: =RC[5]&"|"&RC[6]&"|"&RC[7] -> 20753|20754|20755 | F258: 1|2|3 | G258: 1|1|1 | H258: 3|45 | I258: =VLOOKUP(RC[-7],R7C14:R60C15,2,FALSE) -> 迎接死亡吧…… | J258: 20753 | K258: 20754 | L258: 20755
A259: 253 | B259: 超凡博士 | C259: =INT(RC[-2]/3+0.9) -> 85 | D259: 0 | E259: =RC[5]&"|"&RC[6]&"|"&RC[7] -> 20756|20757|20758 | F259: 1|2|3 | G259: 1|1|1 | H259: 4 | I259: =VLOOKUP(RC[-7],R7C14:R60C15,2,FALSE) -> 淹没在魔法的洪流里吧 | J259: 20756 | K259: 20757 | L259: 20758
A260: 254 | B260: 白凤凰 | C260: =INT(RC[-2]/3+0.9) -> 85 | D260: 0 | E260: =RC[5]&"|"&RC[6]&"|"&RC[7] -> 20759|20760|20761 | F260: 1|2|3 | G260: 1|1|1 | H260: 4 | I260: =VLOOKUP(RC[-7],R7C14:R60C15,2,FALSE) -> 淹没在光辉里吧 | J260: 20759 | K260: 20760 | L260: 20761
A261: 255 | B261: 地狱铁拳 | C261: =INT(RC[-2]/3+0.9) -> 85 | D261: 1 | E261: =RC[5]&"|"&RC[6]&"|"&RC[7] -> 20762|20763|20764 | F261: 1|2|3 | G261: 1|1|1 | H261: 4 | I261: =VLOOKUP(RC[-7],R7C14:R60C15,2,FALSE) -> 你们将深陷地狱——我带来的 | J261: 20762 | K261: 20763 | L261: 20764
A262: 256 | B262: 混沌女巫 | C262: =INT(RC[-2]/3+0.9) -> 86 | D262: 0 | E262: =RC[5]&"|"&RC[6]&"|"&RC[7] -> 20765|20766|20767 | F262: 1|2|3 | G262: 1|1|1 | H262: 1|70 | I262: =VLOOKUP(RC[-7],R7C14:R60C15,2,FALSE) -> 你们或我，归于混沌 | J262: 20765 | K262: 20766 | L262: 20767
A263: 257 | B263: 杰克船长 | C263: =INT(RC[-2]/3+0.9) -> 86 | D263: 0 | E263: =RC[5]&"|"&RC[6]&"|"&RC[7] -> 20768|20769|20770 | F263: 1|2|3 | G263: 1|1|1 | H263: 1|70 | I263: =VLOOKUP(RC[-7],R7C14:R60C15,2,FALSE) -> 看好你的血条！小鬼，我可不会放水！ | J263: 20768 | K263: 20769 | L263: 20770
A264: 258 | B264: 天使长 | C264: =INT(RC[-2]/3+0.9) -> 86 | D264: 1 | E264: =RC[5]&"|"&RC[6]&"|"&RC[7] -> 20771|20772|20773 | F264: 1|2|3 | G264: 1|1|1 | H264: 1|70 | I264: =VLOOKUP(RC[-7],R7C14:R60C15,2,FALSE) -> 圣光笼罩于我，将再无所畏惧 | J264: 20771 | K264: 20772 | L264: 20773
A265: 259 | B265: 独眼野蛮人 | C265: =INT(RC[-2]/3+0.9) -> 87 | D265: 0 | E265: =RC[5]&"|"&RC[6]&"|"&RC[7] -> 20774|20775|20776 | F265: 1|2|3 | G265: 1|1|1 | H265: 2|1 | I265: =VLOOKUP(RC[-7],R7C14:R60C15,2,FALSE) -> 毁灭——！！！！ | J265: 20774 | K265: 20775 | L265: 20776
A266: 260 | B266: 圣女贞德 | C266: =INT(RC[-2]/3+0.9) -> 87 | D266: 0 | E266: =RC[5]&"|"&RC[6]&"|"&RC[7] -> 20777|20778|20779 | F266: 1|2|3 | G266: 1|1|1 | H266: 2|1 | I266: =VLOOKUP(RC[-7],R7C14:R60C15,2,FALSE) -> 回归神的怀抱吧 | J266: 20777 | K266: 20778 | L266: 20779
A267: 261 | B267: 美杜莎 | C267: =INT(RC[-2]/3+0.9) -> 87 | D267: 1 | E267: =RC[5]&"|"&RC[6]&"|"&RC[7] -> 20780|20781|20782 | F267: 1|2|3 | G267: 1|1|1 | H267: 2|1 | I267: =VLOOKUP(RC[-7],R7C14:R60C15,2,FALSE) -> 你就这样化为石头，永恒地沉眠于此吧 | J267: 20780 | K267: 20781 | L267: 20782
A268: 262 | B268: 德古拉伯爵 | C268: =INT(RC[-2]/3+0.9) -> 88 | D268: 0 | E268: =RC[5]&"|"&RC[6]&"|"&RC[7] -> 20783|20784|20785 | F268: 1|2|3 | G268: 1|1|1 | H268: 3|45 | I268: =VLOOKUP(RC[-7],R7C14:R60C15,2,FALSE) -> 鲜血全都归于我…… | J268: 20783 | K268: 20784 | L268: 20785
A269: 263 | B269: 狩猎女神 | C269: =INT(RC[-2]/3+0.9) -> 88 | D269: 0 | E269: =RC[5]&"|"&RC[6]&"|"&RC[7] -> 20786|20787|20788 | F269: 1|2|3 | G269: 1|1|1 | H269: 3|45 | I269: =VLOOKUP(RC[-7],R7C14:R60C15,2,FALSE) -> 月光洒落之地，狩猎开启之时 | J269: 20786 | K269: 20787 | L269: 20788
A270: 264 | B270: 查理大帝 | C270: =INT(RC[-2]/3+0.9) -> 88 | D270: 1 | E270: =RC[5]&"|"&RC[6]&"|"&RC[7] -> 20789|20790|20791 | F270: 1|2|3 | G270: 1|1|1 | H270: 3|45 | I270: =VLOOKUP(RC[-7],R7C14:R60C15,2,FALSE) -> 我的前方是无尽的征途！ | J270: 20789 | K270: 20790 | L270: 20791
A271: 265 | B271: 佐罗 | C271: =INT(RC[-2]/3+0.9) -> 89 | D271: 0 | E271: =RC[5]&"|"&RC[6]&"|"&RC[7] -> 20792|20793|20794 | F271: 1|2|3 | G271: 1|1|1 | H271: 4 | I271: =VLOOKUP(RC[-7],R7C14:R60C15,2,FALSE) -> 只要赢就行吗……不错的条件 | J271: 20792 | K271: 20793 | L271: 20794
A272: 266 | B272: 亚马逊女王 | C272: =INT(RC[-2]/3+0.9) -> 89 | D272: 0 | E272: =RC[5]&"|"&RC[6]&"|"&RC[7] -> 20795|20796|20797 | F272: 1|2|3 | G272: 1|1|1 | H272: 4 | I272: =VLOOKUP(RC[-7],R7C14:R60C15,2,FALSE) -> 欢迎你们踏入狩猎的领域 | J272: 20795 | K272: 20796 | L272: 20797
A273: 267 | B273: 宙斯 | C273: =INT(RC[-2]/3+0.9) -> 89 | D273: 1 | E273: =RC[5]&"|"&RC[6]&"|"&RC[7] -> 20798|20799|20800 | F273: 1|2|3 | G273: 1|1|1 | H273: 4 | I273: =VLOOKUP(RC[-7],R7C14:R60C15,2,FALSE) -> 雷霆的愤怒，你驾驭不住！ | J273: 20798 | K273: 20799 | L273: 20800
A274: 268 | B274: 斯巴达 | C274: =INT(RC[-2]/3+0.9) -> 90 | D274: 0 | E274: =RC[5]&"|"&RC[6]&"|"&RC[7] -> 20801|20802|20803 | F274: 1|2|3 | G274: 1|1|1 | H274: 1|70 | I274: =VLOOKUP(RC[-7],R7C14:R60C15,2,FALSE) -> 你们无法越过我！ | J274: 20801 | K274: 20802 | L274: 20803
A275: 269 | B275: 阿努比斯 | C275: =INT(RC[-2]/3+0.9) -> 90 | D275: 0 | E275: =RC[5]&"|"&RC[6]&"|"&RC[7] -> 20804|20805|20806 | F275: 1|2|3 | G275: 1|1|1 | H275: 1|70 | I275: =VLOOKUP(RC[-7],R7C14:R60C15,2,FALSE) -> 我引领着死亡的到来…… | J275: 20804 | K275: 20805 | L275: 20806
A276: 270 | B276: 雅典娜 | C276: =INT(RC[-2]/3+0.9) -> 90 | D276: 1 | E276: =RC[5]&"|"&RC[6]&"|"&RC[7] -> 20807|20808|20809 | F276: 1|2|3 | G276: 1|1|1 | H276: 1|70 | I276: =VLOOKUP(RC[-7],R7C14:R60C15,2,FALSE) -> 智慧的光辉不会被遮掩 | J276: 20807 | K276: 20808 | L276: 20809
A277: 271 | B277: 大力神 | C277: =INT(RC[-2]/3+0.9) -> 91 | D277: 0 | E277: =RC[5]&"|"&RC[6]&"|"&RC[7] -> 20810|20811|20812 | F277: 1|2|3 | G277: 1|1|1 | H277: 2|1 | I277: =VLOOKUP(RC[-7],R7C14:R60C15,2,FALSE) -> 我会失败？除非死亡！ | J277: 20810 | K277: 20811 | L277: 20812
A278: 272 | B278: 冥王哈迪斯 | C278: =INT(RC[-2]/3+0.9) -> 91 | D278: 0 | E278: =RC[5]&"|"&RC[6]&"|"&RC[7] -> 20813|20814|20815 | F278: 1|2|3 | G278: 1|1|1 | H278: 2|1 | I278: =VLOOKUP(RC[-7],R7C14:R60C15,2,FALSE) -> 你将沉入冥府之河 | J278: 20813 | K278: 20814 | L278: 20815
A279: 273 | B279: 石头人 | C279: =INT(RC[-2]/3+0.9) -> 91 | D279: 1 | E279: =RC[5]&"|"&RC[6]&"|"&RC[7] -> 20816|20817|20818 | F279: 1|2|3 | G279: 1|1|1 | H279: 2|1 | I279: =VLOOKUP(RC[-7],R7C14:R60C15,2,FALSE) -> 坚如磐石，不动如山 | J279: 20816 | K279: 20817 | L279: 20818
A280: 274 | B280: 血源牧师 | C280: =INT(RC[-2]/3+0.9) -> 92 | D280: 0 | E280: =RC[5]&"|"&RC[6]&"|"&RC[7] -> 20819|20820|20821 | F280: 1|2|3 | G280: 1|1|1 | H280: 3|45 | I280: =VLOOKUP(RC[-7],R7C14:R60C15,2,FALSE) -> 你们不能通过这里 | J280: 20819 | K280: 20820 | L280: 20821
A281: 275 | B281: 屠夫 | C281: =INT(RC[-2]/3+0.9) -> 92 | D281: 0 | E281: =RC[5]&"|"&RC[6]&"|"&RC[7] -> 20822|20823|20824 | F281: 1|2|3 | G281: 1|1|1 | H281: 3|45 | I281: =VLOOKUP(RC[-7],R7C14:R60C15,2,FALSE) -> 死亡——！！！ | J281: 20822 | K281: 20823 | L281: 20824
A282: 276 | B282: 树精 | C282: =INT(RC[-2]/3+0.9) -> 92 | D282: 1 | E282: =RC[5]&"|"&RC[6]&"|"&RC[7] -> 20825|20826|20827 | F282: 1|2|3 | G282: 1|1|1 | H282: 3|45 | I282: =VLOOKUP(RC[-7],R7C14:R60C15,2,FALSE) -> 这是自然之怒！ | J282: 20825 | K282: 20826 | L282: 20827
A283: 277 | B283: 牛头人 | C283: =INT(RC[-2]/3+0.9) -> 93 | D283: 0 | E283: =RC[5]&"|"&RC[6]&"|"&RC[7] -> 20828|20829|20830 | F283: 1|2|3 | G283: 1|1|1 | H283: 4 | I283: =VLOOKUP(RC[-7],R7C14:R60C15,2,FALSE) -> 你当我的斧子是摆设吗？ | J283: 20828 | K283: 20829 | L283: 20830
A284: 278 | B284: 火女 | C284: =INT(RC[-2]/3+0.9) -> 93 | D284: 0 | E284: =RC[5]&"|"&RC[6]&"|"&RC[7] -> 20831|20832|20833 | F284: 1|2|3 | G284: 1|1|1 | H284: 4 | I284: =VLOOKUP(RC[-7],R7C14:R60C15,2,FALSE) -> 你们可以在烈焰中坚持多久？ | J284: 20831 | K284: 20832 | L284: 20833
A285: 279 | B285: 半人马 | C285: =INT(RC[-2]/3+0.9) -> 93 | D285: 1 | E285: =RC[5]&"|"&RC[6]&"|"&RC[7] -> 20834|20835|20836 | F285: 1|2|3 | G285: 1|1|1 | H285: 4 | I285: =VLOOKUP(RC[-7],R7C14:R60C15,2,FALSE) -> 我的铁蹄无人可挡 | J285: 20834 | K285: 20835 | L285: 20836
A286: 280 | B286: 食人魔 | C286: =INT(RC[-2]/3+0.9) -> 94 | D286: 0 | E286: =RC[5]&"|"&RC[6]&"|"&RC[7] -> 20837|20838|20839 | F286: 1|2|3 | G286: 1|1|1 | H286: 1|70 | I286: =VLOOKUP(RC[-7],R7C14:R60C15,2,FALSE) -> 区区食物而已！死吧！ | J286: 20837 | K286: 20838 | L286: 20839
A287: 281 | B287: 基伦 | C287: =INT(RC[-2]/3+0.9) -> 94 | D287: 0 | E287: =RC[5]&"|"&RC[6]&"|"&RC[7] -> 20840|20841|20842 | F287: 1|2|3 | G287: 1|1|1 | H287: 1|70 | I287: =VLOOKUP(RC[-7],R7C14:R60C15,2,FALSE) -> 正义不容动摇，而我既是正义 | J287: 20840 | K287: 20841 | L287: 20842
A288: 282 | B288: 女警 | C288: =INT(RC[-2]/3+0.9) -> 94 | D288: 1 | E288: =RC[5]&"|"&RC[6]&"|"&RC[7] -> 20843|20844|20845 | F288: 1|2|3 | G288: 1|1|1 | H288: 1|70 | I288: =VLOOKUP(RC[-7],R7C14:R60C15,2,FALSE) -> 对付你们？只需要一枪！ | J288: 20843 | K288: 20844 | L288: 20845
A289: 283 | B289: 小黑 | C289: =INT(RC[-2]/3+0.9) -> 95 | D289: 0 | E289: =RC[5]&"|"&RC[6]&"|"&RC[7] -> 20846|20847|20848 | F289: 1|2|3 | G289: 1|1|1 | H289: 2|1 | I289: =VLOOKUP(RC[-7],R7C14:R60C15,2,FALSE) -> 我的箭矢下不会有活人通过 | J289: 20846 | K289: 20847 | L289: 20848
A290: 284 | B290: 熊阿宝 | C290: =INT(RC[-2]/3+0.9) -> 95 | D290: 0 | E290: =RC[5]&"|"&RC[6]&"|"&RC[7] -> 20849|20850|20851 | F290: 1|2|3 | G290: 1|1|1 | H290: 2|1 | I290: =VLOOKUP(RC[-7],R7C14:R60C15,2,FALSE) -> 嗝！……谁……谁说我醉了？ | J290: 20849 | K290: 20850 | L290: 20851
A291: 285 | B291: 血色指挥官 | C291: =INT(RC[-2]/3+0.9) -> 95 | D291: 1 | E291: =RC[5]&"|"&RC[6]&"|"&RC[7] -> 20852|20853|20854 | F291: 1|2|3 | G291: 1|1|1 | H291: 2|1 | I291: =VLOOKUP(RC[-7],R7C14:R60C15,2,FALSE) -> 鲜血的辉光洒落，引领你们前往失败之途 | J291: 20852 | K291: 20853 | L291: 20854
A292: 286 | B292: 大检察官 | C292: =INT(RC[-2]/3+0.9) -> 96 | D292: 0 | E292: =RC[5]&"|"&RC[6]&"|"&RC[7] -> 20855|20856|20857 | F292: 1|2|3 | G292: 1|1|1 | H292: 3|45 | I292: =VLOOKUP(RC[-7],R7C14:R60C15,2,FALSE) -> 圣光会将你们驱逐 | J292: 20855 | K292: 20856 | L292: 20857
A293: 287 | B293: 恶魔猎手 | C293: =INT(RC[-2]/3+0.9) -> 96 | D293: 0 | E293: =RC[5]&"|"&RC[6]&"|"&RC[7] -> 20858|20859|20860 | F293: 1|2|3 | G293: 1|1|1 | H293: 3|45 | I293: =VLOOKUP(RC[-7],R7C14:R60C15,2,FALSE) -> 除非死亡，不然我会阻止你们前进 | J293: 20858 | K293: 20859 | L293: 20860
A294: 288 | B294: 神圣牧师 | C294: =INT(RC[-2]/3+0.9) -> 96 | D294: 1 | E294: =RC[5]&"|"&RC[6]&"|"&RC[7] -> 20861|20862|20863 | F294: 1|2|3 | G294: 1|1|1 | H294: 3|45 | I294: =VLOOKUP(RC[-7],R7C14:R60C15,2,FALSE) -> 圣灵的名庇佑着我，前方无有失败 | J294: 20861 | K294: 20862 | L294: 20863
A295: 289 | B295: 超级队长 | C295: =INT(RC[-2]/3+0.9) -> 97 | D295: 0 | E295: =RC[5]&"|"&RC[6]&"|"&RC[7] -> 20864|20865|20866 | F295: 1|2|3 | G295: 1|1|1 | H295: 4 | I295: =VLOOKUP(RC[-7],R7C14:R60C15,2,FALSE) -> 击败我，你们才能继续前进 | J295: 20864 | K295: 20865 | L295: 20866
A296: 290 | B296: 死亡武士 | C296: =INT(RC[-2]/3+0.9) -> 97 | D296: 0 | E296: =RC[5]&"|"&RC[6]&"|"&RC[7] -> 20867|20868|20869 | F296: 1|2|3 | G296: 1|1|1 | H296: 4 | I296: =VLOOKUP(RC[-7],R7C14:R60C15,2,FALSE) -> 总要有人倒在死亡女神的裙摆下 | J296: 20867 | K296: 20868 | L296: 20869
A297: 291 | B297: 红头魔 | C297: =INT(RC[-2]/3+0.9) -> 97 | D297: 1 | E297: =RC[5]&"|"&RC[6]&"|"&RC[7] -> 20870|20871|20872 | F297: 1|2|3 | G297: 1|1|1 | H297: 4 | I297: =VLOOKUP(RC[-7],R7C14:R60C15,2,FALSE) -> 你们将被焚烧殆尽 | J297: 20870 | K297: 20871 | L297: 20872
A298: 292 | B298: 终极队长 | C298: =INT(RC[-2]/3+0.9) -> 98 | D298: 0 | E298: =RC[5]&"|"&RC[6]&"|"&RC[7] -> 20873|20874|20875 | F298: 1|2|3 | G298: 1|1|1 | H298: 1|70 | I298: =VLOOKUP(RC[-7],R7C14:R60C15,2,FALSE) -> 这里没有你们可通过的路 | J298: 20873 | K298: 20874 | L298: 20875
A299: 293 | B299: 雷神 | C299: =INT(RC[-2]/3+0.9) -> 98 | D299: 0 | E299: =RC[5]&"|"&RC[6]&"|"&RC[7] -> 20876|20877|20878 | F299: 1|2|3 | G299: 1|1|1 | H299: 1|70 | I299: =VLOOKUP(RC[-7],R7C14:R60C15,2,FALSE) -> 你们将倒在雷霆之下 | J299: 20876 | K299: 20877 | L299: 20878
A300: 294 | B300: 野蛮巨人 | C300: =INT(RC[-2]/3+0.9) -> 98 | D300: 1 | E300: =RC[5]&"|"&RC[6]&"|"&RC[7] -> 20879|20880|20881 | F300: 1|2|3 | G300: 1|1|1 | H300: 1|70 | I300: =VLOOKUP(RC[-7],R7C14:R60C15,2,FALSE) -> 你们就这样覆灭在我的怒火下吧！ | J300: 20879 | K300: 20880 | L300: 20881
A301: 295 | B301: 致命特工 | C301: =INT(RC[-2]/3+0.9) -> 99 | D301: 0 | E301: =RC[5]&"|"&RC[6]&"|"&RC[7] -> 20882|20883|20884 | F301: 1|2|3 | G301: 1|1|1 | H301: 2|1 | I301: =VLOOKUP(RC[-7],R7C14:R60C15,2,FALSE) -> 只有击败我，你们才能通过这里 | J301: 20882 | K301: 20883 | L301: 20884
A302: 296 | B302: 鹰眸 | C302: =INT(RC[-2]/3+0.9) -> 99 | D302: 0 | E302: =RC[5]&"|"&RC[6]&"|"&RC[7] -> 20885|20886|20887 | F302: 1|2|3 | G302: 1|1|1 | H302: 2|1 | I302: =VLOOKUP(RC[-7],R7C14:R60C15,2,FALSE) -> 保护好你的心脏，我将要击穿它 | J302: 20885 | K302: 20886 | L302: 20887
A303: 297 | B303: 刀锋猎人 | C303: =INT(RC[-2]/3+0.9) -> 99 | D303: 1 | E303: =RC[5]&"|"&RC[6]&"|"&RC[7] -> 20888|20889|20890 | F303: 1|2|3 | G303: 1|1|1 | H303: 2|1 | I303: =VLOOKUP(RC[-7],R7C14:R60C15,2,FALSE) -> 胜利？那必然是属于我的 | J303: 20888 | K303: 20889 | L303: 20890
A304: 298 | B304: 地狱骑士 | C304: =INT(RC[-2]/3+0.9) -> 100 | D304: 0 | E304: =RC[5]&"|"&RC[6]&"|"&RC[7] -> 20891|20892|20893 | F304: 1|2|3 | G304: 1|1|1 | H304: 3|45 | I304: =VLOOKUP(RC[-7],R7C14:R60C15,2,FALSE) -> 地狱的火焰带来审判和死亡 | J304: 20891 | K304: 20892 | L304: 20893
A305: 299 | B305: 铁人 | C305: =INT(RC[-2]/3+0.9) -> 100 | D305: 0 | E305: =RC[5]&"|"&RC[6]&"|"&RC[7] -> 20894|20895|20896 | F305: 1|2|3 | G305: 1|1|1 | H305: 3|45 | I305: =VLOOKUP(RC[-7],R7C14:R60C15,2,FALSE) -> 你们毫无希望 | J305: 20894 | K305: 20895 | L305: 20896
A306: 300 | B306: 树人 | C306: =INT(RC[-2]/3+0.9) -> 100 | D306: 1 | E306: =RC[5]&"|"&RC[6]&"|"&RC[7] -> 20897|20898|20899 | F306: 1|2|3 | G306: 1|1|1 | H306: 3|45 | I306: =VLOOKUP(RC[-7],R7C14:R60C15,2,FALSE) -> 迎接死亡吧…… | J306: 20897 | K306: 20898 | L306: 20899

Sheet: 3.星数随机商品
A1: star_min|star_min | B1: star_max|star_max | C1: award_id_list|award_id_list | D1: award_num_list|award_num_list | E1: award_price_list|award_price_list | F1: original_price|
A2: 不可空 | B2: 不可空 | C2: 不可空 | D2: 不可空 | E2: 不可空 | F2: 不可空
A3: 数字 | B3: 数字 | C3: 一维数组 | D3: 一维数组 | E3: 一维数组 | F3: 一维数组
C4: 不定长 | D4: 不定长 | E4: 不定长 | F4: 不定长
A6: 星数下限 | B6: 星数上限 | C6: 随机推送的道具列表 | D6: 道具的数量列表 | E6: 道具的价格列表 | F6: 显示原价
A7: 0 | B7: 81 | C7: 19103|10002|19006|42301 | D7: 100|500|500|4 | E7: 700|400|400|900 | F7: 1000|500|500|1500
A8: =R[-1]C[1]+1 -> 82 | B8: 84 | C8: 19103|10002|19006|42301|10013 | D8: 100|500|500|4|20 | E8: 700|400|400|900|160 | F8: 1000|500|500|1500|200
A9: =R[-1]C[1]+1 -> 85 | B9: 91 | C9: 10002|19006|42301|10013|10022 | D9: 800|750|4|20|20 | E9: 480|600|900|160|800 | F9: 800|750|1500|200|1000
A10: =R[-1]C[1]+1 -> 92 | B10: 96 | C10: 10002|19006|42301|10013|10022|10004 | D10: 800|750|4|30|20|100 | E10: 480|600|900|240|800|1050 | F10: 800|750|1500|300|1000|1500
A11: =R[-1]C[1]+1 -> 97 | B11: 102 | C11: 19006|42301|10013|10022|10004|13646 | D11: 750|4|30|20|100|10 | E11: 600|900|240|800|1050|320 | F11: 750|1500|300|1000|1500|400
A12: =R[-1]C[1]+1 -> 103 | B12: 113 | C12: 19006|42301|10013|10022|10004|13646|10010 | D12: 750|8|40|20|100|10|50 | E12: 600|1200|320|800|1050|320|200 | F12: 750|3000|400|1000|1500|400|250
A13: =R[-1]C[1]+1 -> 114 | B13: 120 | C13: 19006|42301|10014|10022|10004|13646|10010|10101 | D13: 1000|8|20|20|200|10|50|5 | E13: 800|1200|320|800|1800|320|200|800 | F13: 1000|3000|400|1000|3000|400|250|1000
A14: =R[-1]C[1]+1 -> 121 | B14: 132 | C14: 19006|42301|10014|10022|10004|13646|10010|10101|10008 | D14: 1000|8|30|20|200|10|100|5|100 | E14: 800|1200|480|800|1800|320|400|800|200 | F14: 1000|3000|600|1000|3000|400|500|1000|250
A15: =R[-1]C[1]+1 -> 133 | B15: 999999 | C15: 19006|42301|10014|10022|10004|13646|10010|10101|10008|10009 | D15: 1000|10|30|20|200|10|100|5|200|20 | E15: 800|1500|480|800|1800|320|400|800|400|800 | F15: 1000|3750|600|1000|3000|400|500|1000|500|1000

Sheet: 4.精英爬塔关卡
A1: level|level | B1: name| | C1: map_id|map_id | D1: normal_map_level|need_nomal_map_level | E1: boss_chat| | F1: pos|
A2: 不可空 | B2: 不可空 | C2: 不可空 | D2: 不可空 | E2: 不可空 | F2: 可空#需字段
A3: 数字 | B3: 字符串 | C3: 数字 | D3: 数字 | E3: 字符串 | F3: 一维数组
F4: 不定长
A6: 等级 | B6: 名称 | C6: 关卡ID | D6: 需要普通副本的关卡等级 | E6: 关卡怪物喊话 | F6: x轴|y轴
A7: 1 | B7: =VLOOKUP(RC[5],R7C9:R54C11,2,FALSE) -> 烈焰风暴 | C7: 21001 | D7: 3 | E7: =VLOOKUP(RC[2],R7C9:R54C11,3,FALSE) -> 你们的愚蠢将与肉体一起化为灰烬 | G7: =VLOOKUP(RC[-6]*3,'2.爬塔关卡'!C[-6]:C[-5],2,FALSE) -> 红头魔 | I7: 致命特工 | J7: 致命杀戮 | K7: 精准而致命，诱惑并杀戮 | M7: 狼叔 | N7: 孤狼钢爪 | O7: 撕裂错误的一切
A8: 2 | B8: =VLOOKUP(RC[5],R7C9:R54C11,2,FALSE) -> 狂暴怒火 | C8: 21002 | D8: 6 | E8: =VLOOKUP(RC[2],R7C9:R54C11,3,FALSE) -> 我的怒火，天空也在沸腾着 | G8: =VLOOKUP(RC[-6]*3,'2.爬塔关卡'!C[-6]:C[-5],2,FALSE) -> 野蛮巨人 | I8: 死亡武士 | J8: 侍于死亡 | K8: 所有人都在奔赴往死亡的路上 | M8: 黑暗骑士 | N8: 暗夜侠影 | O8: 曙光终会到来
A9: 3 | B9: =VLOOKUP(RC[5],R7C9:R54C11,2,FALSE) -> 昼行者 | C9: 21003 | D9: 9 | E9: =VLOOKUP(RC[2],R7C9:R54C11,3,FALSE) -> 我是白昼的代行人，猎杀于暗夜的使者 | G9: =VLOOKUP(RC[-6]*3,'2.爬塔关卡'!C[-6]:C[-5],2,FALSE) -> 刀锋猎人 | I9: 超级队长 | J9: 胜利之名 | K9: 万众一心，终将胜利 | M9: 奎爷 | N9: 屠神之刃 | O9: 神灵也不是不死的，如果我想杀的话
A10: 4 | B10: =VLOOKUP(RC[5],R7C9:R54C11,2,FALSE) -> 初春新芽 | C10: 21004 | D10: 12 | E10: =VLOOKUP(RC[2],R7C9:R54C11,3,FALSE) -> ……生命………… | G10: =VLOOKUP(RC[-6]*3,'2.爬塔关卡'!C[-6]:C[-5],2,FALSE) -> 树人 | I10: 鹰眸 | J10: 精准箭矢 | K10: 我的箭看到你的心脏了 | M10: 潘多拉 | N10: 灾难降临 | O10: 灾难将把你覆灭
A11: 5 | B11: =VLOOKUP(RC[5],R7C9:R54C11,2,FALSE) -> 末日之拳 | C11: 21005 | D11: 15 | E11: =VLOOKUP(RC[2],R7C9:R54C11,3,FALSE) -> 你见过末日吗？我会把它砸在你脸上 | G11: =VLOOKUP(RC[-6]*3,'2.爬塔关卡'!C[-6]:C[-5],2,FALSE) -> 地狱铁拳 | I11: 超凡博士 | J11: 魔法奥秘 | K11: 魔法诠释着世界的奥秘 | M11: 巫妖之王 | N11: 霜之哀伤 | O11: 你将到此为止……
A12: 6 | B12: =VLOOKUP(RC[5],R7C9:R54C11,2,FALSE) -> 天之看守 | C12: 21006 | D12: 18 | E12: =VLOOKUP(RC[2],R7C9:R54C11,3,FALSE) -> 我是神之眼，神之剑，亦是神之怒火。 | G12: =VLOOKUP(RC[-6]*3,'2.爬塔关卡'!C[-6]:C[-5],2,FALSE) -> 天使长 | I12: 白凤凰 | J12: 拯救之心 | K12: 拯救也伴随着另一方的死亡…… | M12: 钢铁酋长 | N12: 地狱咆哮
A13: 7 | B13: =VLOOKUP(RC[5],R7C9:R54C11,2,FALSE) -> 诅咒之眼 | C13: 21007 | D13: 21 | E13: =VLOOKUP(RC[2],R7C9:R54C11,3,FALSE) -> 就这样，永远地作为石头活下去吧 | G13: =VLOOKUP(RC[-6]*3,'2.爬塔关卡'!C[-6]:C[-5],2,FALSE) -> 美杜莎 | I13: 刀锋猎人 | J13: 昼行者 | K13: 我是白昼的代行人，猎杀于暗夜的使者
A14: 8 | B14: =VLOOKUP(RC[5],R7C9:R54C11,2,FALSE) -> 无冕之王 | C14: 21008 | D14: 24 | E14: =VLOOKUP(RC[2],R7C9:R54C11,3,FALSE) -> 真正的王者，无需冠冕 | G14: =VLOOKUP(RC[-6]*3,'2.爬塔关卡'!C[-6]:C[-5],2,FALSE) -> 查理大帝 | I14: 地狱骑士 | J14: 审判之眼 | K14: 直视你的内心，接受审判吧
A15: 9 | B15: =VLOOKUP(RC[5],R7C9:R54C11,2,FALSE) -> 诸神之怒 | C15: 21009 | D15: 27 | E15: =VLOOKUP(RC[2],R7C9:R54C11,3,FALSE) -> 感受恐惧，并畏惧吧！ | G15: =VLOOKUP(RC[-6]*3,'2.爬塔关卡'!C[-6]:C[-5],2,FALSE) -> 宙斯 | I15: 野蛮巨人 | J15: 狂暴怒火 | K15: 我的怒火，天空也在沸腾着
A16: 10 | B16: =VLOOKUP(RC[5],R7C9:R54C11,2,FALSE) -> 智慧光辉 | C16: 21010 | D16: 30 | E16: =VLOOKUP(RC[2],R7C9:R54C11,3,FALSE) -> 愚蠢之人，必受苦难 | G16: =VLOOKUP(RC[-6]*3,'2.爬塔关卡'!C[-6]:C[-5],2,FALSE) -> 雅典娜 | I16: 树人 | J16: 初春新芽 | K16: ……生命…………
A17: 11 | B17: =VLOOKUP(RC[5],R7C9:R54C11,2,FALSE) -> 粉碎大地 | C17: 21011 | D17: 33 | E17: =VLOOKUP(RC[2],R7C9:R54C11,3,FALSE) -> 你们都将成为碎末 | G17: =VLOOKUP(RC[-6]*3,'2.爬塔关卡'!C[-6]:C[-5],2,FALSE) -> 石头人 | I17: 地狱铁拳 | J17: 末日之拳 | K17: 你见过末日吗？我会把它砸在你脸上
A18: 12 | B18: =VLOOKUP(RC[5],R7C9:R54C11,2,FALSE) -> 自然怒火 | C18: 21012 | D18: 36 | E18: =VLOOKUP(RC[2],R7C9:R54C11,3,FALSE) -> 自然之怒无人能挡—— | G18: =VLOOKUP(RC[-6]*3,'2.爬塔关卡'!C[-6]:C[-5],2,FALSE) -> 树精 | I18: 铁人 | J18: 轰鸣响彻 | K18: 这是科技的洗礼！
A19: 13 | B19: =VLOOKUP(RC[5],R7C9:R54C11,2,FALSE) -> 踏平山海 | C19: 21013 | D19: 39 | E19: =VLOOKUP(RC[2],R7C9:R54C11,3,FALSE) -> 踏平这个地方！ | G19: =VLOOKUP(RC[-6]*3,'2.爬塔关卡'!C[-6]:C[-5],2,FALSE) -> 半人马 | I19: 雷神 | J19: 神罚雷霆 | K19: 雷霆轰鸣，接受神罚吧！
A20: 14 | B20: =VLOOKUP(RC[5],R7C9:R54C11,2,FALSE) -> 精准一击 | C20: 21014 | D20: 42 | E20: =VLOOKUP(RC[2],R7C9:R54C11,3,FALSE) -> 只要一枪—— | G20: =VLOOKUP(RC[-6]*3,'2.爬塔关卡'!C[-6]:C[-5],2,FALSE) -> 女警 | I20: 混沌女巫 | J20: 混沌魔法 | K20: 我说，你们都将死去……
A21: 15 | B21: =VLOOKUP(RC[5],R7C9:R54C11,2,FALSE) -> 血色光辉 | C21: 21015 | D21: 45 | E21: =VLOOKUP(RC[2],R7C9:R54C11,3,FALSE) -> 血色的光辉笼罩你我 | G21: =VLOOKUP(RC[-6]*3,'2.爬塔关卡'!C[-6]:C[-5],2,FALSE) -> 血色指挥官 | I21: 红头魔 | J21: 烈焰风暴 | K21: 你们的愚蠢将与肉体一起化为灰烬
A22: 16 | B22: =VLOOKUP(RC[5],R7C9:R54C11,2,FALSE) -> 神之真言 | C22: 21016 | D22: 48 | E22: =VLOOKUP(RC[2],R7C9:R54C11,3,FALSE) -> 神指引着我们的道路 | G22: =VLOOKUP(RC[-6]*3,'2.爬塔关卡'!C[-6]:C[-5],2,FALSE) -> 神圣牧师 | I22: 终极队长 | J22: 终极一击 | K22: 你将在此终结！
A23: 17 | B23: =VLOOKUP(RC[5],R7C9:R54C11,2,FALSE) -> 烈焰风暴 | C23: 21017 | D23: 51 | E23: =VLOOKUP(RC[2],R7C9:R54C11,3,FALSE) -> 你们的愚蠢将与肉体一起化为灰烬 | G23: =VLOOKUP(RC[-6]*3,'2.爬塔关卡'!C[-6]:C[-5],2,FALSE) -> 红头魔 | I23: 佐罗 | J23: 自由义侠 | K23: 我的剑不会留情
A24: 18 | B24: =VLOOKUP(RC[5],R7C9:R54C11,2,FALSE) -> 狂暴怒火 | C24: 21018 | D24: 54 | E24: =VLOOKUP(RC[2],R7C9:R54C11,3,FALSE) -> 我的怒火，天空也在沸腾着 | G24: =VLOOKUP(RC[-6]*3,'2.爬塔关卡'!C[-6]:C[-5],2,FALSE) -> 野蛮巨人 | I24: 杰克船长 | J24: 海上霸主 | K24: 啤酒！炮火！海上的浪漫！
A25: 19 | B25: =VLOOKUP(RC[5],R7C9:R54C11,2,FALSE) -> 昼行者 | C25: 21019 | D25: 57 | E25: =VLOOKUP(RC[2],R7C9:R54C11,3,FALSE) -> 我是白昼的代行人，猎杀于暗夜的使者 | G25: =VLOOKUP(RC[-6]*3,'2.爬塔关卡'!C[-6]:C[-5],2,FALSE) -> 刀锋猎人 | I25: 斯巴达 | J25: 战争信仰 | K25: 此处，无可后退！此枪，将无人可挡！
A26: 20 | B26: =VLOOKUP(RC[5],R7C9:R54C11,2,FALSE) -> 初春新芽 | C26: 21020 | D26: 60 | E26: =VLOOKUP(RC[2],R7C9:R54C11,3,FALSE) -> ……生命………… | G26: =VLOOKUP(RC[-6]*3,'2.爬塔关卡'!C[-6]:C[-5],2,FALSE) -> 树人 | I26: 亚马逊女王 | J26: 丛林女王 | K26: 踏进丛林的那一刻，你就只能是猎物
A27: 21 | B27: =VLOOKUP(RC[5],R7C9:R54C11,2,FALSE) -> 末日之拳 | C27: 21021 | D27: 63 | E27: =VLOOKUP(RC[2],R7C9:R54C11,3,FALSE) -> 你见过末日吗？我会把它砸在你脸上 | G27: =VLOOKUP(RC[-6]*3,'2.爬塔关卡'!C[-6]:C[-5],2,FALSE) -> 地狱铁拳 | I27: 圣女贞德 | J27: 高举旗帜 | K27: 随我前进，胜利将至！
A28: 22 | B28: =VLOOKUP(RC[5],R7C9:R54C11,2,FALSE) -> 天之看守 | C28: 21022 | D28: 66 | E28: =VLOOKUP(RC[2],R7C9:R54C11,3,FALSE) -> 我是神之眼，神之剑，亦是神之怒火。 | G28: =VLOOKUP(RC[-6]*3,'2.爬塔关卡'!C[-6]:C[-5],2,FALSE) -> 天使长 | I28: 天使长 | J28: 天之看守 | K28: 我是神之眼，神之剑，亦是神之怒火。
A29: 23 | B29: =VLOOKUP(RC[5],R7C9:R54C11,2,FALSE) -> 诅咒之眼 | C29: 21023 | D29: 69 | E29: =VLOOKUP(RC[2],R7C9:R54C11,3,FALSE) -> 就这样，永远地作为石头活下去吧 | G29: =VLOOKUP(RC[-6]*3,'2.爬塔关卡'!C[-6]:C[-5],2,FALSE) -> 美杜莎 | I29: 查理大帝 | J29: 无冕之王 | K29: 真正的王者，无需冠冕
A30: 24 | B30: =VLOOKUP(RC[5],R7C9:R54C11,2,FALSE) -> 无冕之王 | C30: 21024 | D30: 72 | E30: =VLOOKUP(RC[2],R7C9:R54C11,3,FALSE) -> 真正的王者，无需冠冕 | G30: =VLOOKUP(RC[-6]*3,'2.爬塔关卡'!C[-6]:C[-5],2,FALSE) -> 查理大帝 | I30: 阿努比斯 | J30: 亡者引导 | K30: 我将引领死亡……
A31: 25 | B31: =VLOOKUP(RC[5],R7C9:R54C11,2,FALSE) -> 诸神之怒 | C31: 21025 | D31: 75 | E31: =VLOOKUP(RC[2],R7C9:R54C11,3,FALSE) -> 感受恐惧，并畏惧吧！ | G31: =VLOOKUP(RC[-6]*3,'2.爬塔关卡'!C[-6]:C[-5],2,FALSE) -> 宙斯 | I31: 德古拉伯爵 | J31: 鲜血之夜 | K31: 你们的血液将归我所有
A32: 26 | B32: =VLOOKUP(RC[5],R7C9:R54C11,2,FALSE) -> 智慧光辉 | C32: 21026 | D32: 78 | E32: =VLOOKUP(RC[2],R7C9:R54C11,3,FALSE) -> 愚蠢之人，必受苦难 | G32: =VLOOKUP(RC[-6]*3,'2.爬塔关卡'!C[-6]:C[-5],2,FALSE) -> 雅典娜 | I32: 大力神 | J32: 十二试炼 | K32: 人生总要经历无数的试练
A33: 27 | B33: =VLOOKUP(RC[5],R7C9:R54C11,2,FALSE) -> 粉碎大地 | C33: 21027 | D33: 81 | E33: =VLOOKUP(RC[2],R7C9:R54C11,3,FALSE) -> 你们都将成为碎末 | G33: =VLOOKUP(RC[-6]*3,'2.爬塔关卡'!C[-6]:C[-5],2,FALSE) -> 石头人 | I33: 美杜莎 | J33: 诅咒之眼 | K33: 就这样，永远地作为石头活下去吧
A34: 28 | B34: =VLOOKUP(RC[5],R7C9:R54C11,2,FALSE) -> 自然怒火 | C34: 21028 | D34: 84 | E34: =VLOOKUP(RC[2],R7C9:R54C11,3,FALSE) -> 自然之怒无人能挡—— | G34: =VLOOKUP(RC[-6]*3,'2.爬塔关卡'!C[-6]:C[-5],2,FALSE) -> 树精 | I34: 冥王哈迪斯 | J34: 冥域气息 | K34: 冥府的大门正向你打开……
A35: 29 | B35: =VLOOKUP(RC[5],R7C9:R54C11,2,FALSE) -> 踏平山海 | C35: 21029 | D35: 87 | E35: =VLOOKUP(RC[2],R7C9:R54C11,3,FALSE) -> 踏平这个地方！ | G35: =VLOOKUP(RC[-6]*3,'2.爬塔关卡'!C[-6]:C[-5],2,FALSE) -> 半人马 | I35: 狩猎女神 | J35: 弯月之弓 | K35: 我把月亮作为弓箭……
A36: 30 | B36: =VLOOKUP(RC[5],R7C9:R54C11,2,FALSE) -> 精准一击 | C36: 21030 | D36: 90 | E36: =VLOOKUP(RC[2],R7C9:R54C11,3,FALSE) -> 只要一枪—— | G36: =VLOOKUP(RC[-6]*3,'2.爬塔关卡'!C[-6]:C[-5],2,FALSE) -> 女警 | I36: 雅典娜 | J36: 智慧光辉 | K36: 愚蠢之人，必受苦难
A37: 31 | B37: =VLOOKUP(RC[5],R7C9:R54C11,2,FALSE) -> 血色光辉 | C37: 21031 | D37: 93 | E37: =VLOOKUP(RC[2],R7C9:R54C11,3,FALSE) -> 血色的光辉笼罩你我 | G37: =VLOOKUP(RC[-6]*3,'2.爬塔关卡'!C[-6]:C[-5],2,FALSE) -> 血色指挥官 | I37: 独眼野蛮人 | J37: 毁灭独眼 | K37: 毁灭——！！！
A38: 32 | B38: =VLOOKUP(RC[5],R7C9:R54C11,2,FALSE) -> 神之真言 | C38: 21032 | D38: 96 | E38: =VLOOKUP(RC[2],R7C9:R54C11,3,FALSE) -> 神指引着我们的道路 | G38: =VLOOKUP(RC[-6]*3,'2.爬塔关卡'!C[-6]:C[-5],2,FALSE) -> 神圣牧师 | I38: 宙斯 | J38: 诸神之怒 | K38: 感受恐惧，并畏惧吧！
A39: 33 | B39: =VLOOKUP(RC[5],R7C9:R54C11,2,FALSE) -> 烈焰风暴 | C39: 21033 | D39: 99 | E39: =VLOOKUP(RC[2],R7C9:R54C11,3,FALSE) -> 你们的愚蠢将与肉体一起化为灰烬 | G39: =VLOOKUP(RC[-6]*3,'2.爬塔关卡'!C[-6]:C[-5],2,FALSE) -> 红头魔 | I39: 基伦 | J39: 行使之义 | K39: 我将行使正义！
A40: 34 | B40: =VLOOKUP(RC[5],R7C9:R54C11,2,FALSE) -> 狂暴怒火 | C40: 21034 | D40: 102 | E40: =VLOOKUP(RC[2],R7C9:R54C11,3,FALSE) -> 我的怒火，天空也在沸腾着 | G40: =VLOOKUP(RC[-6]*3,'2.爬塔关卡'!C[-6]:C[-5],2,FALSE) -> 野蛮巨人 | I40: 半人马 | J40: 踏平山海 | K40: 踏平这个地方！
A41: 35 | B41: =VLOOKUP(RC[5],R7C9:R54C11,2,FALSE) -> 昼行者 | C41: 21035 | D41: 105 | E41: =VLOOKUP(RC[2],R7C9:R54C11,3,FALSE) -> 我是白昼的代行人，猎杀于暗夜的使者 | G41: =VLOOKUP(RC[-6]*3,'2.爬塔关卡'!C[-6]:C[-5],2,FALSE) -> 刀锋猎人 | I41: 石头人 | J41: 粉碎大地 | K41: 你们都将成为碎末
A42: 36 | B42: =VLOOKUP(RC[5],R7C9:R54C11,2,FALSE) -> 初春新芽 | C42: 21036 | D42: 108 | E42: =VLOOKUP(RC[2],R7C9:R54C11,3,FALSE) -> ……生命………… | G42: =VLOOKUP(RC[-6]*3,'2.爬塔关卡'!C[-6]:C[-5],2,FALSE) -> 树人 | I42: 女警 | J42: 精准一击 | K42: 只要一枪——
A43: 37 | B43: =VLOOKUP(RC[5],R7C9:R54C11,2,FALSE) -> 末日之拳 | C43: 21037 | D43: 111 | E43: =VLOOKUP(RC[2],R7C9:R54C11,3,FALSE) -> 你见过末日吗？我会把它砸在你脸上 | G43: =VLOOKUP(RC[-6]*3,'2.爬塔关卡'!C[-6]:C[-5],2,FALSE) -> 地狱铁拳 | I43: 食人魔 | J43: 贪婪暴食 | K43: 我需要更多食物——需要活下去！
A44: 38 | B44: =VLOOKUP(RC[5],R7C9:R54C11,2,FALSE) -> 天之看守 | C44: 21038 | D44: 114 | E44: =VLOOKUP(RC[2],R7C9:R54C11,3,FALSE) -> 我是神之眼，神之剑，亦是神之怒火。 | G44: =VLOOKUP(RC[-6]*3,'2.爬塔关卡'!C[-6]:C[-5],2,FALSE) -> 天使长 | I44: 血源牧师 | J44: 鲜血之源 | K44: 你的血液尽在我的掌握中
A45: 39 | B45: =VLOOKUP(RC[5],R7C9:R54C11,2,FALSE) -> 诅咒之眼 | C45: 21039 | D45: 117 | E45: =VLOOKUP(RC[2],R7C9:R54C11,3,FALSE) -> 就这样，永远地作为石头活下去吧 | G45: =VLOOKUP(RC[-6]*3,'2.爬塔关卡'!C[-6]:C[-5],2,FALSE) -> 美杜莎 | I45: 恶魔猎手 | J45: 暗夜猎手 | K45: 你逃不掉的
A46: 40 | B46: =VLOOKUP(RC[5],R7C9:R54C11,2,FALSE) -> 无冕之王 | C46: 21040 | D46: 120 | E46: =VLOOKUP(RC[2],R7C9:R54C11,3,FALSE) -> 真正的王者，无需冠冕 | G46: =VLOOKUP(RC[-6]*3,'2.爬塔关卡'!C[-6]:C[-5],2,FALSE) -> 查理大帝 | I46: 牛头人 | J46: 无人能挡 | K46: 无人可以阻挡我！
A47: 41 | B47: =VLOOKUP(RC[5],R7C9:R54C11,2,FALSE) -> 诸神之怒 | C47: 21041 | D47: 123 | E47: =VLOOKUP(RC[2],R7C9:R54C11,3,FALSE) -> 感受恐惧，并畏惧吧！ | G47: =VLOOKUP(RC[-6]*3,'2.爬塔关卡'!C[-6]:C[-5],2,FALSE) -> 宙斯 | I47: 血色指挥官 | J47: 血色光辉 | K47: 血色的光辉笼罩你我
A48: 42 | B48: =VLOOKUP(RC[5],R7C9:R54C11,2,FALSE) -> 智慧光辉 | C48: 21042 | D48: 126 | E48: =VLOOKUP(RC[2],R7C9:R54C11,3,FALSE) -> 愚蠢之人，必受苦难 | G48: =VLOOKUP(RC[-6]*3,'2.爬塔关卡'!C[-6]:C[-5],2,FALSE) -> 雅典娜 | I48: 熊阿宝 | J48: 碾压打砸 | K48: 只要碾压过去就对了——
A49: 43 | B49: =VLOOKUP(RC[5],R7C9:R54C11,2,FALSE) -> 粉碎大地 | C49: 21043 | D49: 129 | E49: =VLOOKUP(RC[2],R7C9:R54C11,3,FALSE) -> 你们都将成为碎末 | G49: =VLOOKUP(RC[-6]*3,'2.爬塔关卡'!C[-6]:C[-5],2,FALSE) -> 石头人 | I49: 小黑 | J49: 匿于黑暗 | K49: 你看不穿黑暗
A50: 44 | B50: =VLOOKUP(RC[5],R7C9:R54C11,2,FALSE) -> 自然怒火 | C50: 21044 | D50: 132 | E50: =VLOOKUP(RC[2],R7C9:R54C11,3,FALSE) -> 自然之怒无人能挡—— | G50: =VLOOKUP(RC[-6]*3,'2.爬塔关卡'!C[-6]:C[-5],2,FALSE) -> 树精 | I50: 火女 | J50: 燃烧之心 | K50: 燃烧殆尽吧
A51: 45 | B51: =VLOOKUP(RC[5],R7C9:R54C11,2,FALSE) -> 踏平山海 | C51: 21045 | D51: 135 | E51: =VLOOKUP(RC[2],R7C9:R54C11,3,FALSE) -> 踏平这个地方！ | G51: =VLOOKUP(RC[-6]*3,'2.爬塔关卡'!C[-6]:C[-5],2,FALSE) -> 半人马 | I51: 大检察官 | J51: 拯救之光 | K51: 我能拯救你吗？
A52: 46 | B52: =VLOOKUP(RC[5],R7C9:R54C11,2,FALSE) -> 精准一击 | C52: 21046 | D52: 138 | E52: =VLOOKUP(RC[2],R7C9:R54C11,3,FALSE) -> 只要一枪—— | G52: =VLOOKUP(RC[-6]*3,'2.爬塔关卡'!C[-6]:C[-5],2,FALSE) -> 女警 | I52: 神圣牧师 | J52: 神之真言 | K52: 神指引着我们的道路
A53: 47 | B53: =VLOOKUP(RC[5],R7C9:R54C11,2,FALSE) -> 血色光辉 | C53: 21047 | D53: 141 | E53: =VLOOKUP(RC[2],R7C9:R54C11,3,FALSE) -> 血色的光辉笼罩你我 | G53: =VLOOKUP(RC[-6]*3,'2.爬塔关卡'!C[-6]:C[-5],2,FALSE) -> 血色指挥官 | I53: 屠夫 | J53: 生者之恶 | K53: 活着的……死，死——！
A54: 48 | B54: =VLOOKUP(RC[5],R7C9:R54C11,2,FALSE) -> 神之真言 | C54: 21048 | D54: 144 | E54: =VLOOKUP(RC[2],R7C9:R54C11,3,FALSE) -> 神指引着我们的道路 | G54: =VLOOKUP(RC[-6]*3,'2.爬塔关卡'!C[-6]:C[-5],2,FALSE) -> 神圣牧师 | I54: 树精 | J54: 自然怒火 | K54: 自然之怒无人能挡——
A55: 49 | B55: =VLOOKUP(RC[5],R7C9:R54C11,2,FALSE) -> 烈焰风暴 | C55: 21049 | D55: 147 | E55: =VLOOKUP(RC[2],R7C9:R54C11,3,FALSE) -> 你们的愚蠢将与肉体一起化为灰烬 | G55: =VLOOKUP(RC[-6]*3,'2.爬塔关卡'!C[-6]:C[-5],2,FALSE) -> 红头魔
A56: 50 | B56: =VLOOKUP(RC[5],R7C9:R54C11,2,FALSE) -> 狂暴怒火 | C56: 21050 | D56: 150 | E56: =VLOOKUP(RC[2],R7C9:R54C11,3,FALSE) -> 我的怒火，天空也在沸腾着 | G56: =VLOOKUP(RC[-6]*3,'2.爬塔关卡'!C[-6]:C[-5],2,FALSE) -> 野蛮巨人

Sheet: 5.属性随机库
A1: star|star | B1: pro_type_list|pro_type_list | C1: pro_value_list|pro_value_list | D1: property_name|
A2: 不可空 | B2: 不可空 | C2: 不可空 | D2: 不可空
A3: 数字 | B3: 一维数组 | C3: 一维数组 | D3: 一维数组
B4: 不定长 | C4: 不定长 | D4: 不定长
A6: 星数 | B6: 属性类型列表 | C6: 属性值列表 | D6: 属性图标名
A7: 3 | B7: 5|7|11|12|13|14|25|22 | C7: 300|300|300|300|300|300|300|300 | D7: 1|2|4|5|6|7|8|9
A8: 6 | B8: 5|7|11|12|13|14|25|22 | C8: 600|600|600|600|600|600|600|600 | D8: 1|2|4|5|6|7|8|9
A9: 9 | B9: 5|7|11|12|13|14|25|22 | C9: 900|900|900|900|900|900|900|900 | D9: 1|2|4|5|6|7|8|9

Sheet: 6.威名商店
A1: id|id | B1: type|type | C1: object_id|object_id | D1: object_num|object_num | E1: need_level|need_level | F1: need_star|need_star | G1: buy_num_max|buy_num_max | H1: cost_type_list|cost_type_list | I1: cost_value_list|cost_value_list | J1: cost_item_id_list|cost_item_id_list | K1: cost_item_num_list|cost_item_num_list | L1: discount|
A2: 不可空 | B2: 不可空 | C2: 不可空 | D2: 不可空 | E2: 不可空 | F2: 不可空 | G2: 不可空 | H2: 可空#不需字段 | I2: 可空#不需字段 | J2: 可空#不需字段 | K2: 可空#不需字段 | L2: 可空#需字段
A3: 数字 | B3: 数字 | C3: 数字 | D3: 数字 | E3: 数字 | F3: 数字 | G3: 数字 | H3: 一维数组 | I3: 一维数组 | J3: 一维数组 | K3: 一维数组 | L3: 数字
H4: 不定长 | I4: 不定长 | J4: 不定长 | K4: 不定长
A6: 商品ID | B6: 类型 | C6: 商品对象ID | D6: 商品对象数量 | E6: 需要的角色等级 | F6: 需要的星数 | G6: 购买数量上限 | H6: 消耗类型列表 | I6: 消耗值列表 | J6: 消耗道具ID列表 | K6: 消耗道具数量列表 | L6: 折扣
A7: 1 | B7: 1 | C7: 11201 | D7: 1 | E7: 0 | F7: 0 | G7: 0 | H7: 12 | I7: 90 | M7: 蓝散武器残件
A8: 2 | B8: 1 | C8: 11202 | D8: 1 | E8: 0 | F8: 0 | G8: 0 | H8: 12 | I8: 90 | M8: 蓝散衣服残件
A9: 3 | B9: 1 | C9: 11203 | D9: 1 | E9: 0 | F9: 0 | G9: 0 | H9: 12 | I9: 90 | M9: 蓝散鞋子残件
A10: 4 | B10: 1 | C10: 11204 | D10: 1 | E10: 0 | F10: 0 | G10: 0 | H10: 12 | I10: 90 | M10: 蓝散护腕残件
A11: 5 | B11: 1 | C11: 10011 | D11: 1 | E11: 0 | F11: 0 | G11: 0 | H11: 12 | I11: 20 | M11: 绿品精炼石
A12: 6 | B12: 1 | C12: 10012 | D12: 1 | E12: 0 | F12: 0 | G12: 0 | H12: 12 | I12: 40 | M12: 蓝品精炼石
A13: 7 | B13: 1 | C13: 10013 | D13: 1 | E13: 0 | F13: 0 | G13: 0 | H13: 12 | I13: 100 | M13: 紫品精炼石
A14: 8 | B14: 1 | C14: 10014 | D14: 1 | E14: 0 | F14: 0 | G14: 0 | H14: 12 | I14: 200 | M14: 橙品精炼石
A15: 9 | B15: 1 | C15: 10010 | D15: 10 | E15: 0 | F15: 0 | G15: 0 | H15: 12 | I15: 500 | M15: 圣器精炼石
A16: 101 | B16: 2 | C16: 11301 | D16: 1 | E16: 0 | F16: 30 | G16: 0 | H16: 12 | I16: 300 | M16: 掠夺弯刀残件
A17: 102 | B17: 2 | C17: 11302 | D17: 1 | E17: 0 | F17: 30 | G17: 0 | H17: 12 | I17: 300 | M17: 不动盔甲残件
A18: 103 | B18: 2 | C18: 11303 | D18: 1 | E18: 0 | F18: 30 | G18: 0 | H18: 12 | I18: 300 | M18: 疾风长靴残件
A19: 104 | B19: 2 | C19: 11304 | D19: 1 | E19: 0 | F19: 30 | G19: 0 | H19: 12 | I19: 300 | M19: 正义护腕残件
A20: 105 | B20: 2 | C20: 11305 | D20: 1 | E20: 0 | F20: 70 | G20: 0 | H20: 12 | I20: 500 | M20: 绞首双剑残件
A21: 106 | B21: 2 | C21: 11306 | D21: 1 | E21: 0 | F21: 70 | G21: 0 | H21: 12 | I21: 500 | M21: 光明战甲残件
A22: 107 | B22: 2 | C22: 11307 | D22: 1 | E22: 0 | F22: 70 | G22: 0 | H22: 12 | I22: 500 | M22: 黑钢长靴残件
A23: 108 | B23: 2 | C23: 11308 | D23: 1 | E23: 0 | F23: 70 | G23: 0 | H23: 12 | I23: 500 | M23: 咆哮护腕残件
A24: 109 | B24: 2 | C24: 11317 | D24: 1 | E24: 48 | F24: 90 | G24: 0 | H24: 12 | I24: 600 | M24: 青鸟法球残件
A25: 110 | B25: 2 | C25: 11318 | D25: 1 | E25: 48 | F25: 90 | G25: 0 | H25: 12 | I25: 600 | M25: 青鸟盔甲残件
A26: 111 | B26: 2 | C26: 11319 | D26: 1 | E26: 48 | F26: 90 | G26: 0 | H26: 12 | I26: 600 | M26: 青鸟长靴残件
A27: 112 | B27: 2 | C27: 11320 | D27: 1 | E27: 48 | F27: 90 | G27: 0 | H27: 12 | I27: 600 | M27: 青鸟护腕残件
A28: 201 | B28: 3 | C28: 11401 | D28: 1 | E28: 0 | F28: 105 | G28: 0 | H28: 12 | I28: 820 | M28: 鲜血领主长杖残件
A29: 202 | B29: 3 | C29: 11402 | D29: 1 | E29: 0 | F29: 105 | G29: 0 | H29: 12 | I29: 820 | M29: 死者束缚重甲残件
A30: 203 | B30: 3 | C30: 11403 | D30: 1 | E30: 0 | F30: 105 | G30: 0 | H30: 12 | I30: 820 | M30: 踏浪疾走长靴残件
A31: 204 | B31: 3 | C31: 11404 | D31: 1 | E31: 0 | F31: 105 | G31: 0 | H31: 12 | I31: 820 | M31: 超凡睿智之手残件
A32: 205 | B32: 3 | C32: 11405 | D32: 1 | E32: 0 | F32: 210 | G32: 0 | H32: 12 | I32: 1100 | M32: 正义守护巨剑残件
A33: 206 | B33: 3 | C33: 11406 | D33: 1 | E33: 0 | F33: 210 | G33: 0 | H33: 12 | I33: 1100 | M33: 神圣天使之心残件
A34: 207 | B34: 3 | C34: 11407 | D34: 1 | E34: 0 | F34: 210 | G34: 0 | H34: 12 | I34: 1100 | M34: 雷霆奔腾战靴残件
A35: 208 | B35: 3 | C35: 11408 | D35: 1 | E35: 0 | F35: 210 | G35: 0 | H35: 12 | I35: 1100 | M35: 燃烧汲取之触残件 | O35: 新版奖励 | P35: 所需星数 | Q35: 物品ID | R35: 数量 | S35: 单价 | T35: 原价 | U35: 折扣 | V35: 现价
A36: 301 | B36: 4 | C36: 11201 | D36: 20 | E36: 0 | F36: 1 | G36: 1 | H36: 12 | I36: =RC[5]*RC[-5]*RC[3]/10 -> 18 | L36: 1 | M36: 战争权杖残件*20 | N36: =RC[5]*RC[7] -> 9 | O36: 战争权杖残件*20 | P36: 1 | Q36: 11201 | R36: 20 | S36: 90 | T36: =RC[-2]*RC[-1] -> 1800 | U36: 0.1 | V36: =RC[-2]*RC[-1]/10 -> 18
A37: 302 | B37: 4 | C37: 19103 | D37: 10 | E37: 0 | F37: 5 | G37: 1 | H37: 12 | I37: =RC[5]*RC[-5]*RC[3]/10 -> 100 | L37: 1 | M37: 金币*10W | N37: =RC[5]*RC[7] -> 100 | O37: 金币*10W | P37: 5 | Q37: 19103 | R37: 10 | S37: 100 | T37: =RC[-2]*RC[-1] -> 1000 | U37: 1 | V37: =RC[-2]*RC[-1]/10 -> 100
A38: 303 | B38: 4 | C38: 22201 | D38: 1 | E38: 0 | F38: 10 | G38: 1 | H38: 12 | I38: =RC[5]*RC[-5]*RC[3]/10 -> 180 | L38: 1 | M38: 镶甲短靴*1 | N38: =RC[5]*RC[7] -> 1800 | O38: 镶甲短靴*1 | P38: 10 | Q38: 22201 | R38: 1 | S38: 1800 | T38: =RC[-2]*RC[-1] -> 1800 | U38: 1 | V38: =RC[-2]*RC[-1]/10 -> 180
A39: 304 | B39: 4 | C39: 19005 | D39: 100 | E39: 0 | F39: 20 | G39: 1 | H39: 12 | I39: =RC[5]*RC[-5]*RC[3]/10 -> 100 | L39: 1 | M39: 钻石*100 | N39: =RC[5]*RC[7] -> 10 | O39: 钻石*100 | P39: 20 | Q39: 19005 | R39: 100 | S39: 10 | T39: =RC[-2]*RC[-1] -> 1000 | U39: 1 | V39: =RC[-2]*RC[-1]/10 -> 100
A40: 305 | B40: 4 | C40: 21201 | D40: 1 | E40: 0 | F40: 30 | G40: 1 | H40: 12 | I40: =RC[5]*RC[-5]*RC[3]/10 -> 180 | L40: 1 | M40: 坚韧盔甲*1 | N40: =RC[5]*RC[7] -> 1800 | O40: 坚韧盔甲*1 | P40: 30 | Q40: 21201 | R40: 1 | S40: 1800 | T40: =RC[-2]*RC[-1] -> 1800 | U40: 1 | V40: =RC[-2]*RC[-1]/10 -> 180
A41: 306 | B41: 4 | C41: 19103 | D41: 15 | E41: 0 | F41: 40 | G41: 1 | H41: 12 | I41: =RC[5]*RC[-5]*RC[3]/10 -> 150 | L41: 1 | M41: 金币*15W | N41: =RC[5]*RC[7] -> 100 | O41: 金币*15W | P41: 40 | Q41: 19103 | R41: 15 | S41: 100 | T41: =RC[-2]*RC[-1] -> 1500 | U41: 1 | V41: =RC[-2]*RC[-1]/10 -> 150
A42: 307 | B42: 4 | C42: 23201 | D42: 1 | E42: 0 | F42: 50 | G42: 1 | H42: 12 | I42: =RC[5]*RC[-5]*RC[3]/10 -> 180 | L42: 1 | M42: 铜纹护腕*1 | N42: =RC[5]*RC[7] -> 1800 | O42: 铜纹护腕*1 | P42: 50 | Q42: 23201 | R42: 1 | S42: 1800 | T42: =RC[-2]*RC[-1] -> 1800 | U42: 1 | V42: =RC[-2]*RC[-1]/10 -> 180
A43: 308 | B43: 4 | C43: 19005 | D43: 150 | E43: 0 | F43: 60 | G43: 1 | H43: 12 | I43: =RC[5]*RC[-5]*RC[3]/10 -> 150 | L43: 1 | M43: 钻石*150 | N43: =RC[5]*RC[7] -> 10 | O43: 钻石*150 | P43: 60 | Q43: 19005 | R43: 150 | S43: 10 | T43: =RC[-2]*RC[-1] -> 1500 | U43: 1 | V43: =RC[-2]*RC[-1]/10 -> 150
A44: 309 | B44: 4 | C44: 21303 | D44: 1 | E44: 0 | F44: 70 | G44: 1 | H44: 12 | I44: =RC[5]*RC[-5]*RC[3]/10 -> 2400 | L44: 1 | M44: 荣耀圣甲*1 | N44: =RC[5]*RC[7] -> 24000 | O44: 荣耀圣甲*1 | P44: 70 | Q44: 21303 | R44: 1 | S44: 24000 | T44: =RC[-2]*RC[-1] -> 24000 | U44: 1 | V44: =RC[-2]*RC[-1]/10 -> 2400
A45: 310 | B45: 4 | C45: 10012 | D45: 50 | E45: 0 | F45: 80 | G45: 1 | H45: 12 | I45: =RC[5]*RC[-5]*RC[3]/10 -> 200 | L45: 1 | M45: 蓝品精炼石*50 | N45: =RC[5]*RC[7] -> 40 | O45: 蓝品精炼石*50 | P45: 80 | Q45: 10012 | R45: 50 | S45: 40 | T45: =RC[-2]*RC[-1] -> 2000 | U45: 1 | V45: =RC[-2]*RC[-1]/10 -> 200
A46: 311 | B46: 4 | C46: 19005 | D46: 200 | E46: 0 | F46: 90 | G46: 1 | H46: 12 | I46: =RC[5]*RC[-5]*RC[3]/10 -> 200 | L46: 1 | M46: 钻石*200 | N46: =RC[5]*RC[7] -> 10 | O46: 钻石*200 | P46: 90 | Q46: 19005 | R46: 200 | S46: 10 | T46: =RC[-2]*RC[-1] -> 2000 | U46: 1 | V46: =RC[-2]*RC[-1]/10 -> 200
A47: 312 | B47: 4 | C47: 22303 | D47: 1 | E47: 0 | F47: 100 | G47: 1 | H47: 12 | I47: =RC[5]*RC[-5]*RC[3]/10 -> 2400 | L47: 1 | M47: 荣耀重靴*1 | N47: =RC[5]*RC[7] -> 24000 | O47: 荣耀重靴*1 | P47: 100 | Q47: 22303 | R47: 1 | S47: 24000 | T47: =RC[-2]*RC[-1] -> 24000 | U47: 1 | V47: =RC[-2]*RC[-1]/10 -> 2400
A48: 313 | B48: 4 | C48: 19103 | D48: 25 | E48: 0 | F48: 110 | G48: 1 | H48: 12 | I48: =RC[5]*RC[-5]*RC[3]/10 -> 250 | L48: 1 | M48: 金币*25W | N48: =RC[5]*RC[7] -> 100 | O48: 金币*25W | P48: 110 | Q48: 19103 | R48: 25 | S48: 100 | T48: =RC[-2]*RC[-1] -> 2500 | U48: 1 | V48: =RC[-2]*RC[-1]/10 -> 250
A49: 314 | B49: 4 | C49: 10010 | D49: 100 | E49: 0 | F49: 120 | G49: 1 | H49: 12 | I49: =RC[5]*RC[-5]*RC[3]/10 -> 500 | L49: 1 | M49: 圣器精炼石*100 | N49: =RC[5]*RC[7] -> 50 | O49: 圣器精炼石*100 | P49: 120 | Q49: 10010 | R49: 100 | S49: 50 | T49: =RC[-2]*RC[-1] -> 5000 | U49: 1 | V49: =RC[-2]*RC[-1]/10 -> 500
A50: 315 | B50: 4 | C50: 19005 | D50: 250 | E50: 0 | F50: 130 | G50: 1 | H50: 12 | I50: =RC[5]*RC[-5]*RC[3]/10 -> 250 | L50: 1 | M50: 钻石*250 | N50: =RC[5]*RC[7] -> 10 | O50: 钻石*250 | P50: 130 | Q50: 19005 | R50: 250 | S50: 10 | T50: =RC[-2]*RC[-1] -> 2500 | U50: 1 | V50: =RC[-2]*RC[-1]/10 -> 250
A51: 316 | B51: 4 | C51: 19103 | D51: 50 | E51: 0 | F51: 140 | G51: 1 | H51: 12 | I51: =RC[5]*RC[-5]*RC[3]/10 -> 500 | L51: 1 | M51: 金币*50W | N51: =RC[5]*RC[7] -> 100 | O51: 金币*50W | P51: 140 | Q51: 19103 | R51: 50 | S51: 100 | T51: =RC[-2]*RC[-1] -> 5000 | U51: 1 | V51: =RC[-2]*RC[-1]/10 -> 500
A52: 317 | B52: 4 | C52: 10013 | D52: 50 | E52: 0 | F52: 150 | G52: 1 | H52: 12 | I52: =RC[5]*RC[-5]*RC[3]/10 -> 500 | L52: 1 | M52: 紫品精炼石*50 | N52: =RC[5]*RC[7] -> 100 | O52: 紫品精炼石*50 | P52: 150 | Q52: 10013 | R52: 50 | S52: 100 | T52: =RC[-2]*RC[-1] -> 5000 | U52: 1 | V52: =RC[-2]*RC[-1]/10 -> 500
A53: 318 | B53: 4 | C53: 19005 | D53: 300 | E53: 0 | F53: 170 | G53: 1 | H53: 12 | I53: =RC[5]*RC[-5]*RC[3]/10 -> 300 | L53: 1 | M53: 钻石*300 | N53: =RC[5]*RC[7] -> 10 | O53: 钻石*300 | P53: 170 | Q53: 19005 | R53: 300 | S53: 10 | T53: =RC[-2]*RC[-1] -> 3000 | U53: 1 | V53: =RC[-2]*RC[-1]/10 -> 300
A54: 319 | B54: 4 | C54: 10010 | D54: 200 | E54: 0 | F54: 190 | G54: 1 | H54: 12 | I54: =RC[5]*RC[-5]*RC[3]/10 -> 1000 | L54: 1 | M54: 圣器精炼石*200 | N54: =RC[5]*RC[7] -> 50 | O54: 圣器精炼石*200 | P54: 190 | Q54: 10010 | R54: 200 | S54: 50 | T54: =RC[-2]*RC[-1] -> 10000 | U54: 1 | V54: =RC[-2]*RC[-1]/10 -> 1000
A55: 320 | B55: 4 | C55: 10014 | D55: 50 | E55: 0 | F55: 210 | G55: 1 | H55: 12 | I55: =RC[5]*RC[-5]*RC[3]/10 -> 1000 | L55: 1 | M55: 橙品精炼石*50 | N55: =RC[5]*RC[7] -> 200 | O55: 橙品精炼石*50 | P55: 210 | Q55: 10014 | R55: 50 | S55: 200 | T55: =RC[-2]*RC[-1] -> 10000 | U55: 1 | V55: =RC[-2]*RC[-1]/10 -> 1000
A56: 321 | B56: 4 | C56: 10010 | D56: 300 | E56: 0 | F56: 230 | G56: 1 | H56: 12 | I56: =RC[5]*RC[-5]*RC[3]/10 -> 1500 | L56: 1 | M56: 圣器精炼石*300 | N56: =RC[5]*RC[7] -> 50 | O56: 圣器精炼石*300 | P56: 230 | Q56: 10010 | R56: 300 | S56: 50 | T56: =RC[-2]*RC[-1] -> 15000 | U56: 1 | V56: =RC[-2]*RC[-1]/10 -> 1500
A57: 322 | B57: 4 | C57: 10014 | D57: 75 | E57: 0 | F57: 250 | G57: 1 | H57: 12 | I57: =RC[5]*RC[-5]*RC[3]/10 -> 1500 | L57: 1 | M57: 橙品精炼石*75 | N57: =RC[5]*RC[7] -> 200 | O57: 橙品精炼石*75 | P57: 250 | Q57: 10014 | R57: 75 | S57: 200 | T57: =RC[-2]*RC[-1] -> 15000 | U57: 1 | V57: =RC[-2]*RC[-1]/10 -> 1500
A58: 323 | B58: 4 | C58: 19005 | D58: 350 | E58: 0 | F58: 270 | G58: 1 | H58: 12 | I58: =RC[5]*RC[-5]*RC[3]/10 -> 350 | L58: 1 | M58: 钻石*350 | N58: =RC[5]*RC[7] -> 10 | O58: 钻石*350 | P58: 270 | Q58: 19005 | R58: 350 | S58: 10 | T58: =RC[-2]*RC[-1] -> 3500 | U58: 1 | V58: =RC[-2]*RC[-1]/10 -> 350
A59: 324 | B59: 4 | C59: 10010 | D59: 300 | E59: 0 | F59: 290 | G59: 1 | H59: 12 | I59: =RC[5]*RC[-5]*RC[3]/10 -> 1500 | L59: 1 | M59: 圣器精炼石*300 | N59: =RC[5]*RC[7] -> 50 | O59: 圣器精炼石*300 | P59: 290 | Q59: 10010 | R59: 300 | S59: 50 | T59: =RC[-2]*RC[-1] -> 15000 | U59: 1 | V59: =RC[-2]*RC[-1]/10 -> 1500
A60: 325 | B60: 4 | C60: 10014 | D60: 75 | E60: 0 | F60: 310 | G60: 1 | H60: 12 | I60: =RC[5]*RC[-5]*RC[3]/10 -> 1500 | L60: 1 | M60: 橙品精炼石*75 | N60: =RC[5]*RC[7] -> 200 | O60: 橙品精炼石*75 | P60: 310 | Q60: 10014 | R60: 75 | S60: 200 | T60: =RC[-2]*RC[-1] -> 15000 | U60: 1 | V60: =RC[-2]*RC[-1]/10 -> 1500
A61: 326 | B61: 4 | C61: 19005 | D61: 400 | E61: 0 | F61: 330 | G61: 1 | H61: 12 | I61: =RC[5]*RC[-5]*RC[3]/10 -> 400 | L61: 1 | M61: 钻石*400 | N61: =RC[5]*RC[7] -> 10 | O61: 钻石*400 | P61: 330 | Q61: 19005 | R61: 400 | S61: 10 | T61: =RC[-2]*RC[-1] -> 4000 | U61: 1 | V61: =RC[-2]*RC[-1]/10 -> 400
A62: 327 | B62: 4 | C62: 10010 | D62: 300 | E62: 0 | F62: 350 | G62: 1 | H62: 12 | I62: =RC[5]*RC[-5]*RC[3]/10 -> 1500 | L62: 1 | M62: 圣器精炼石*300 | N62: =RC[5]*RC[7] -> 50 | O62: 圣器精炼石*300 | P62: 350 | Q62: 10010 | R62: 300 | S62: 50 | T62: =RC[-2]*RC[-1] -> 15000 | U62: 1 | V62: =RC[-2]*RC[-1]/10 -> 1500
A63: 328 | B63: 4 | C63: 10014 | D63: 75 | E63: 0 | F63: 370 | G63: 1 | H63: 12 | I63: =RC[5]*RC[-5]*RC[3]/10 -> 1500 | L63: 1 | M63: 橙品精炼石*75 | N63: =RC[5]*RC[7] -> 200 | O63: 橙品精炼石*75 | P63: 370 | Q63: 10014 | R63: 75 | S63: 200 | T63: =RC[-2]*RC[-1] -> 15000 | U63: 1 | V63: =RC[-2]*RC[-1]/10 -> 1500
A64: 329 | B64: 4 | C64: 19005 | D64: 450 | E64: 0 | F64: 390 | G64: 1 | H64: 12 | I64: =RC[5]*RC[-5]*RC[3]/10 -> 450 | L64: 1 | M64: 钻石*450 | N64: =RC[5]*RC[7] -> 10 | O64: 钻石*450 | P64: 390 | Q64: 19005 | R64: 450 | S64: 10 | T64: =RC[-2]*RC[-1] -> 4500 | U64: 1 | V64: =RC[-2]*RC[-1]/10 -> 450
A65: 330 | B65: 4 | C65: 10010 | D65: 300 | E65: 0 | F65: 410 | G65: 1 | H65: 12 | I65: =RC[5]*RC[-5]*RC[3]/10 -> 1500 | L65: 1 | M65: 圣器精炼石*300 | N65: =RC[5]*RC[7] -> 50 | O65: 圣器精炼石*300 | P65: 410 | Q65: 10010 | R65: 300 | S65: 50 | T65: =RC[-2]*RC[-1] -> 15000 | U65: 1 | V65: =RC[-2]*RC[-1]/10 -> 1500
A66: 331 | B66: 4 | C66: 10014 | D66: 75 | E66: 0 | F66: 430 | G66: 1 | H66: 12 | I66: =RC[5]*RC[-5]*RC[3]/10 -> 1500 | L66: 1 | M66: 橙品精炼石*75 | N66: =RC[5]*RC[7] -> 200 | O66: 橙品精炼石*75 | P66: 430 | Q66: 10014 | R66: 75 | S66: 200 | T66: =RC[-2]*RC[-1] -> 15000 | U66: 1 | V66: =RC[-2]*RC[-1]/10 -> 1500
A67: 332 | B67: 4 | C67: 19005 | D67: 500 | E67: 0 | F67: 450 | G67: 1 | H67: 12 | I67: =RC[5]*RC[-5]*RC[3]/10 -> 500 | L67: 1 | M67: 钻石*500 | N67: =RC[5]*RC[7] -> 10 | O67: 钻石*500 | P67: 450 | Q67: 19005 | R67: 500 | S67: 10 | T67: =RC[-2]*RC[-1] -> 5000 | U67: 1 | V67: =RC[-2]*RC[-1]/10 -> 500
A68: 401 | B68: 5 | C68: 11501 | D68: 1 | E68: 64 | F68: 240 | G68: 0 | H68: 12 | I68: 1200 | J68: 10118 | K68: 1 | M68: 神圣复仇残件
A69: 402 | B69: 5 | C69: 11502 | D69: 1 | E69: 64 | F69: 240 | G69: 0 | H69: 12 | I69: 1200 | J69: 10118 | K69: 1 | M69: 地狱哀歌残件
A70: 403 | B70: 5 | C70: 11503 | D70: 1 | E70: 64 | F70: 240 | G70: 0 | H70: 12 | I70: 1200 | J70: 10118 | K70: 1 | M70: 贯穿苍穹残件
A71: 404 | B71: 5 | C71: 11504 | D71: 1 | E71: 64 | F71: 240 | G71: 0 | H71: 12 | I71: 1200 | J71: 10118 | K71: 1 | M71: 苍白正义残件
A72: 405 | B72: 5 | C72: 11509 | D72: 1 | E72: 64 | F72: 300 | G72: 0 | J72: 10118|11409 | K72: 1|1 | M72: 巨擘之握残件
A73: 406 | B73: 5 | C73: 11510 | D73: 1 | E73: 64 | F73: 300 | G73: 0 | J73: 10118|11410 | K73: 1|1 | M73: 巨擘怒吼残件
A74: 407 | B74: 5 | C74: 11511 | D74: 1 | E74: 64 | F74: 300 | G74: 0 | J74: 10118|11411 | K74: 1|1 | M74: 巨擘践踏残件
A75: 408 | B75: 5 | C75: 11512 | D75: 1 | E75: 64 | F75: 300 | G75: 0 | J75: 10118|11412 | K75: 1|1 | M75: 巨擘守护残件
A76: 409 | B76: 5 | C76: 11517 | D76: 1 | E76: 64 | F76: 300 | G76: 0 | J76: 10118|11417 | K76: 1|1 | M76: 盖亚之力残件
A77: 410 | B77: 5 | C77: 11518 | D77: 1 | E77: 64 | F77: 300 | G77: 0 | J77: 10118|11418 | K77: 1|1 | M77: 盖亚守护残件
A78: 411 | B78: 5 | C78: 11519 | D78: 1 | E78: 64 | F78: 300 | G78: 0 | J78: 10118|11419 | K78: 1|1 | M78: 盖亚能量残件
A79: 412 | B79: 5 | C79: 11520 | D79: 1 | E79: 64 | F79: 300 | G79: 0 | J79: 10118|11420 | K79: 1|1 | M79: 盖亚庇佑残件