Sheet: 配置
A1: 服务端文件名 | B1: 服务端对应工作表号 | C1: 客户端文件名 | D1: 客户端对应工作表号 | E1: erl头部 | F1: erl内容格式 | G1: erl尾部 | H1: 客户端特殊处理
A2: config_item.txt | B2: 1 | C2: config_item.cnf|Item | D2: 1 | F2: get(id) -> #$ | H2: 2=>id

Sheet: 物品
A1: id|id | B1: name| | C1: res_id| | D1: quality|quality | E1: type|type | F1: sub_type|sub_type | G1: is_can_use|is_can_use | H1: price|price | I1: sell_price|sell_price | J1: diamond|diamond | K1: gold|gold | L1: is_use_in_get|is_use_in_get | M1: expiry_date|expiry_date | N1: target_id| | O1: description| | P1: max_num|max_num | Q1: use_level|use_level | R1: param1|param1 | S1: param2|param2 | T1: item_id_list|item_id_list | U1: item_min_num_list|item_min_num_list | V1: item_max_num_list|item_max_num_list | W1: item_rate_list|item_rate_list | X1: systemid| | Y1: goforward| | Z1: goforwardbtnname| | AA1: small_icon| | AB1: need_hero_bag_num|need_hero_bag_num | AC1: need_equipment_bag_num|need_equipment_bag_num | AD1: need_treasure_bag_num|need_treasure_bag_num | AE1: need_card_bag_num|need_card_bag_num | AF1: equip_effect| | AG1: preview_gift| | AH1: new| | AI1: is_pop_maincity|
A2: 不可空 | B2: 不可空 | C2: 不可空 | D2: 不可空 | E2: 不可空 | F2: 不可空 | G2: 不可空 | H2: 不可空 | I2: 不可空 | J2: 可空#不需字段 | K2: 可空#不需字段 | L2: 不可空 | M2: 可空#不需字段 | N2: 不可空 | O2: 不可空 | P2: 不可空 | Q2: 不可空 | R2: 不可空 | S2: 不可空 | T2: 可空#不需字段 | U2: 可空#不需字段 | V2: 可空#不需字段 | W2: 可空#不需字段 | X2: 可空#不需字段 | Y2: 可空#不需字段 | Z2: 可空#不需字段 | AA2: 可空#不需字段 | AB2: 可空#不需字段 | AC2: 可空#不需字段 | AD2: 可空#不需字段 | AE2: 可空#不需字段 | AF2: 可空#不需字段 | AG2: 可空#不需字段 | AH2: 可空#不需字段 | AI2: 可空#不需字段
A3: 数字 | B3: 字符串 | C3: 数字 | D3: 数字 | E3: 数字 | F3: 数字 | G3: 数字 | H3: 数字 | I3: 数字 | J3: 数字 | K3: 数字 | L3: 数字 | M3: 数字 | N3: 数字 | O3: 字符串 | P3: 数字 | Q3: 数字 | R3: 数字 | S3: 数字 | T3: 一维数组 | U3: 一维数组 | V3: 一维数组 | W3: 一维数组 | X3: 一维数组 | Y3: 一维数组 | Z3: 字符串 | AA3: 数字 | AB3: 数字 | AC3: 数字 | AD3: 数字 | AE3: 数字 | AF3: 字符串 | AG3: 数字 | AH3: 数字 | AI3: 数字
T4: 不定长 | U4: 不定长 | V4: 不定长 | W4: 不定长 | X4: 不定长 | Y4: 不定长
A6: 物品ID | B6: 物品名称 | C6: 资源id | D6: 物品品质 | E6: 类型 | F6: 子类型 | G6: 能否在背包直接使用 | H6: 购买价钱(金币) | I6: 出售价格 | J6: 获得钻石 | K6: 获得金币 | L6: 是否在获得的时候使用 | M6: 有效期限 | N6: 合成目标ID | O6: 描述 | P6: 堆叠数量上限 | Q6: 使用等级 | R6: 参数1 | S6: 参数2 | T6: 物品ID列表 | U6: 物品数量随机最小列表 | V6: 物品数量随机最大列表 | W6: 物品几率列表 | X6: 获取途径系统ID | Y6: 背包跳转前往系统界面 | Z6: 背包跳转按钮名字 | AA6: 是否显示碎片标示 | AB6: 需要的英雄背包数量 | AC6: 需要的装备背包数量 | AD6: 需要的宝物背包数量 | AE6: 需要的卡牌背包数量 | AF6: 装备圣器碎片特效 | AG6: 礼包预览 | AH6: 是否显示new | AI6: 主城推送使用
A7: 10000 | B7: 体力药剂 | C7: 10000 | D7: 2 | E7: 1 | F7: 1 | G7: 1 | H7: 1 | I7: 10 | J7: 0 | K7: 0 | L7: 0 | N7: 0 | O7: 高度浓缩的a号营养物质，使用后恢复25点体力值。 | P7: 999999 | Q7: 1 | R7: 25 | S7: 0 | X7: 12
A8: 10001 | B8: 精力药剂 | C8: 10001 | D8: 2 | E8: 1 | F8: 2 | G8: 1 | H8: 1 | I8: 10 | J8: 0 | K8: 0 | L8: 0 | N8: 0 | O8: 高度浓缩的b号营养物质，使用后恢复10点精力值。 | P8: 999999 | Q8: 1 | R8: 10 | S8: 0 | X8: 12|15
A9: 10002 | B9: 进阶石 | C9: 10002 | D9: 3 | E9: 1 | F9: 4 | G9: 0 | H9: 1 | I9: 10 | J9: 0 | K9: 0 | L9: 0 | N9: 0 | O9: 含有高度契合英雄意志的力量，可用于英雄进阶。 | P9: 999999 | Q9: 1 | R9: 0 | S9: 0 | X9: 997|11|2|30|69 | Y9: 7 | Z9: 进阶英雄
A10: 10003 | B10: 培养石 | C10: 10003 | D10: 3 | E10: 1 | F10: 5 | G10: 0 | H10: 1 | I10: 10 | J10: 0 | K10: 0 | L10: 0 | N10: 0 | O10: 拥有大量能量的石头，可用于英雄培养。 | P10: 999999 | Q10: 9 | R10: 0 | S10: 0 | X10: 11|30 | Y10: 7 | Z10: 培养英雄
A11: 10004 | B11: 潜能合剂 | C11: 10004 | D11: 3 | E11: 1 | F11: 6 | G11: 0 | H11: 1 | I11: 10 | J11: 0 | K11: 0 | L11: 0 | N11: 0 | O11: 可以刺激人体潜力，用于提升英雄潜能。 | P11: 999999 | Q11: 35 | R11: 1 | S11: 0 | X11: 98|11|12|16|34 | Y11: 7 | Z11: 提升潜能
A12: 10005 | B12: 英雄精华 | C12: 10005 | D12: 5 | E12: 1 | F12: 12 | G12: 0 | H12: 1 | I12: 10 | J12: 0 | K12: 0 | L12: 0 | N12: 0 | O12: 51级以后可在声望商店兑换红品英雄碎片。 | P12: 999999 | Q12: 1 | R12: 0 | S12: 0
A13: 10006 | B13: 进化之书 | C13: 10006 | D13: 4 | E13: 1 | F13: 25 | G13: 0 | H13: 1 | I13: 10 | J13: 0 | K13: 0 | L13: 0 | N13: 0 | O13: 用于英雄进化。 | P13: 999999 | Q13: 1 | R13: 0 | S13: 0 | Y13: 150 | Z13: 英雄进化
A14: 10007 | B14: 契约石 | C14: 10007 | D14: 5 | E14: 1 | F14: 25 | G14: 0 | H14: 1 | I14: 10 | J14: 0 | K14: 0 | L14: 0 | N14: 0 | O14: 用于英雄进化。 | P14: 999999 | Q14: 1 | R14: 0 | S14: 0 | Y14: 150 | Z14: 英雄进化
A15: 10008 | B15: 觉醒水晶 | C15: 10008 | D15: 4 | E15: 1 | F15: 10 | G15: 0 | H15: 1 | I15: 10 | J15: 0 | K15: 0 | L15: 0 | N15: 0 | O15: 可以进一步活跃英雄灵魂的奇特水晶，用于英雄觉醒。 | P15: 999999 | Q15: 45 | R15: 0 | S15: 0 | X15: 46|999 | Y15: 7 | Z15: 英雄升星
A16: 10009 | B16: 预言星徽 | C16: 10009 | D16: 4 | E16: 1 | F16: 0 | G16: 0 | H16: 1 | I16: 10 | J16: 0 | K16: 0 | L16: 0 | N16: 0 | O16: 用于卡牌进阶。 | P16: 999999 | Q16: 1 | R16: 0 | S16: 0 | X16: 117 | Y16: 115 | Z16: 卡牌进阶
A17: 10010 | B17: 圣器精炼石 | C17: 10010 | D17: 4 | E17: 1 | F17: 9 | G17: 0 | H17: 1 | I17: 10 | J17: 0 | K17: 0 | L17: 0 | N17: 0 | O17: 比较罕见的变异精炼石，但可以用于圣器精炼。 | P17: 999999 | Q17: 39 | R17: 0 | S17: 0 | X17: 2|33 | Y17: 6 | Z17: 精炼圣器
A18: 10011 | B18: 绿品精炼石 | C18: 10011 | D18: 1 | E18: 1 | F18: 3 | G18: 0 | H18: 1 | I18: 10 | J18: 0 | K18: 0 | L18: 0 | N18: 0 | O18: 低级装备锻造师制造的精炼石，为装备提供5点精炼经验。 | P18: 999999 | Q18: 29 | R18: 5 | S18: 0 | X18: 33 | Y18: 5 | Z18: 精炼装备
A19: 10012 | B19: 蓝品精炼石 | C19: 10012 | D19: 2 | E19: 1 | F19: 3 | G19: 0 | H19: 1 | I19: 10 | J19: 0 | K19: 0 | L19: 0 | N19: 0 | O19: 中级装备锻造师制造的精炼石，为装备提供10点精炼经验。 | P19: 999999 | Q19: 29 | R19: 10 | S19: 0 | X19: 33 | Y19: 5 | Z19: 精炼装备
A20: 10013 | B20: 紫品精炼石 | C20: 10013 | D20: 3 | E20: 1 | F20: 3 | G20: 0 | H20: 1 | I20: 10 | J20: 0 | K20: 0 | L20: 0 | N20: 0 | O20: 高级装备锻造师制造的精炼石，为装备提供25点精炼经验。 | P20: 999999 | Q20: 29 | R20: 25 | S20: 0 | X20: 33 | Y20: 5 | Z20: 精炼装备
A21: 10014 | B21: 橙品精炼石 | C21: 10014 | D21: 4 | E21: 1 | F21: 3 | G21: 0 | H21: 1 | I21: 10 | J21: 0 | K21: 0 | L21: 0 | N21: 0 | O21: 装备锻造大师制造的精炼石，为装备提供50点精炼经验。 | P21: 999999 | Q21: 29 | R21: 50 | S21: 0 | X21: 98|33 | Y21: 5 | Z21: 精炼装备
A22: 10015 | B22: 讨伐令 | C22: 19015 | D22: 3 | E22: 1 | F22: 15 | G22: 1 | H22: 1 | I22: 10 | J22: 0 | K22: 0 | L22: 0 | N22: 0 | O22: 为抵抗异度入侵而颁发的讨伐令，使用后获得1次讨伐次数，用于攻打入侵者。 | P22: 999999 | Q22: 35 | R22: 1 | S22: 0 | X22: 12
A23: 10016 | B23: 初级保护令 | C23: 10016 | D23: 3 | E23: 1 | F23: 14 | G23: 1 | H23: 1 | I23: 10 | J23: 0 | K23: 0 | L23: 0 | N23: 0 | O23: 使用后1小时内不会被抢夺圣器碎片。 | P23: 999999 | Q23: 13 | R23: 1 | S23: 0 | X23: 12
A24: 10017 | B24: 高级保护令 | C24: 10017 | D24: 4 | E24: 1 | F24: 14 | G24: 1 | H24: 1 | I24: 10 | J24: 0 | K24: 0 | L24: 0 | N24: 0 | O24: 使用后8小时内不会被抢夺圣器碎片。 | P24: 999999 | Q24: 13 | R24: 8 | S24: 0 | X24: 12
A25: 10018 | B25: 次元碎片 | C25: 10018 | D25: 2 | E25: 1 | F25: 16 | G25: 0 | H25: 1 | I25: 10 | J25: 0 | K25: 0 | L25: 0 | N25: 0 | O25: 蕴含时空之力的晶石碎片，用于初级召唤。 | P25: 999999 | Q25: 1 | R25: 0 | S25: 0 | Y25: 9 | Z25: 招募英雄
A26: 10019 | B26: 次元核心 | C26: 10019 | D26: 4 | E26: 1 | F26: 17 | G26: 0 | H26: 1 | I26: 10 | J26: 0 | K26: 0 | L26: 0 | N26: 0 | O26: 蕴含时空之力的晶石核心，用于高级召唤。 | P26: 999999 | Q26: 1 | R26: 0 | S26: 0 | Y26: 9 | Z26: 招募英雄
A27: 10020 | B27: 世界之心碎片 | C27: 10020 | D27: 4 | E27: 1 | F27: 18 | G27: 0 | H27: 1 | I27: 10 | J27: 0 | K27: 0 | L27: 0 | N27: 0 | O27: 世界之心的碎片，可以修复世界之心，激活天赋属性。 | P27: 999999 | Q27: 1 | R27: 0 | S27: 0 | X27: 26|27 | Y27: 18 | Z27: 前往点亮
A28: 10021 | B28: 刷新令 | C28: 10021 | D28: 3 | E28: 1 | F28: 11 | G28: 0 | H28: 1 | I28: 10 | J28: 0 | K28: 0 | L28: 0 | N28: 0 | O28: 通行商店推出的消耗品，能令店家替换售柜上的商品，用于刷新商店。 | P28: 999999 | Q28: 1 | R28: 0 | S28: 0 | Y28: 11 | Z28: 魂晶商店
A29: 10022 | B29: 灵性精粹 | C29: 10022 | D29: 4 | E29: 1 | F29: 23 | G29: 0 | H29: 1 | I29: 10 | J29: 0 | K29: 0 | L29: 0 | N29: 0 | O29: 从“诞生了灵性但未成为灵魂”之物上抽取淬炼得到，可以用于强化精灵。 | P29: 999999 | Q29: 1 | R29: 0 | S29: 0 | X29: 69|72 | Y29: 63 | Z29: 前往强化
A30: 10023 | B30: 无尽深渊地图 | C30: 10023 | D30: 3 | E30: 1 | F30: 0 | G30: 0 | H30: 1 | I30: 10 | J30: 0 | K30: 0 | L30: 0 | N30: 0 | O30: 市场上到处都有得卖的“藏宝图”，据说可在无尽深渊找到传说中的宝藏。 | P30: 999999 | Q30: 1 | R30: 0 | S30: 0 | X30: 12
A31: 10024 | B31: 称号 | C31: 10024 | D31: 4 | E31: 1 | F31: 0 | G31: 0 | H31: 1 | I31: 10 | J31: 0 | K31: 0 | L31: 0 | N31: 0 | O31: 专属称号。 | P31: 999999 | Q31: 1 | R31: 0 | S31: 0
A32: 10025 | B32: 头衔 | C32: 10025 | D32: 4 | E32: 1 | F32: 0 | G32: 0 | H32: 1 | I32: 10 | J32: 0 | K32: 0 | L32: 0 | N32: 0 | O32: 专属头衔。 | P32: 999999 | Q32: 1 | R32: 0 | S32: 0
A33: 10026 | B33: 最初的开拓者 | C33: 10026 | D33: 5 | E33: 1 | F33: 0 | G33: 0 | H33: 1 | I33: 10 | J33: 0 | K33: 0 | L33: 0 | N33: 0 | O33: 最初的开拓者的荣耀。——“到来与见证。” | P33: 1 | Q33: 1 | R33: 0 | S33: 0
A34: 10027 | B34: 糖果 | C34: 10027 | D34: 4 | E34: 1 | F34: 12 | G34: 0 | H34: 1 | I34: 10 | J34: 0 | K34: 0 | L34: 0 | M34: 20171104 | N34: 0 | O34: 万圣节狂欢兑换材料（主线/英雄/精英关卡可掉落；竞技场/圣器争夺翻牌可获取） | P34: 999999 | Q34: 1 | R34: 0 | S34: 0 | X34: 19|21|997|998|999 | Y34: 98 | Z34: 去兑换
A35: 10028 | B35: 暴风紫晶 | C35: 10028 | D35: 3 | E35: 1 | F35: 12 | G35: 0 | H35: 1 | I35: 10 | J35: 0 | K35: 0 | L35: 0 | M35: 7 | N35: 0 | O35: 可用于限时活动兑换各种道具。 | P35: 999999 | Q35: 1 | R35: 0 | S35: 0 | Y35: 98 | Z35: 去兑换
A36: 10029 | B36: 暴风橙晶 | C36: 10029 | D36: 4 | E36: 1 | F36: 12 | G36: 0 | H36: 1 | I36: 10 | J36: 0 | K36: 0 | L36: 0 | M36: 7 | N36: 0 | O36: 可用于限时活动兑换各种珍贵道具。 | P36: 999999 | Q36: 1 | R36: 0 | S36: 0 | Y36: 98 | Z36: 去兑换
A37: 10030 | B37: 生命灵泉 | C37: 10030 | D37: 0 | E37: 1 | F37: 21 | G37: 0 | H37: 1 | I37: 10 | J37: 0 | K37: 0 | L37: 0 | N37: 0 | O37: 由生命之树上流淌下来的汁液滴落到泉水中形成，可用于精灵培养。 | P37: 999999 | Q37: 1 | R37: 0 | S37: 0 | X37: 88 | Y37: 87 | Z37: 精灵培养
A38: 10031 | B38: 烈焰灵泉 | C38: 10031 | D38: 0 | E38: 1 | F38: 21 | G38: 0 | H38: 1 | I38: 10 | J38: 0 | K38: 0 | L38: 0 | N38: 0 | O38: 凝聚了火元素的泉水，在烈焰中也不会蒸发，可用于精灵培养。 | P38: 999999 | Q38: 1 | R38: 0 | S38: 0 | X38: 88 | Y38: 87 | Z38: 精灵培养
A39: 10032 | B39: 大地灵泉 | C39: 10032 | D39: 0 | E39: 1 | F39: 21 | G39: 0 | H39: 1 | I39: 10 | J39: 0 | K39: 0 | L39: 0 | N39: 0 | O39: 大地孕育生命，而大地灵泉则是其精华所在，可用于精灵培养。 | P39: 999999 | Q39: 1 | R39: 0 | S39: 0 | X39: 88 | Y39: 87 | Z39: 精灵培养
A40: 10033 | B40: 寒冰灵泉 | C40: 10033 | D40: 0 | E40: 1 | F40: 21 | G40: 0 | H40: 1 | I40: 10 | J40: 0 | K40: 0 | L40: 0 | N40: 0 | O40: 极地冰封深处的一眼活泉，可用于精灵培养 | P40: 999999 | Q40: 1 | R40: 0 | S40: 0 | X40: 88 | Y40: 87 | Z40: 精灵培养
A41: 10034 | B41: 希望之心 | C41: 10034 | D41: 4 | E41: 1 | F41: 22 | G41: 0 | H41: 1 | I41: 10 | J41: 0 | K41: 0 | L41: 0 | N41: 0 | O41: “予人以希望，这是我所希望”——希望精灵的升华材料。 | P41: 999999 | Q41: 1 | R41: 0 | S41: 0 | X41: 88 | Y41: 87 | Z41: 精灵升华
A42: 10035 | B42: 烈焰结晶 | C42: 10035 | D42: 4 | E42: 1 | F42: 22 | G42: 0 | H42: 1 | I42: 10 | J42: 0 | K42: 0 | L42: 0 | N42: 0 | O42: “吞食烈焰，要有一颗燃烧着的心”——炼狱灵龙的升华材料。 | P42: 999999 | Q42: 1 | R42: 0 | S42: 0 | X42: 88 | Y42: 87 | Z42: 精灵升华
A43: 10036 | B43: 深海之泪 | C43: 10036 | D43: 4 | E43: 1 | F43: 22 | G43: 0 | H43: 1 | I43: 10 | J43: 0 | K43: 0 | L43: 0 | N43: 0 | O43: “海洋最是容忍，泪水也多是为此”——深海女王的升华材料。 | P43: 999999 | Q43: 1 | R43: 0 | S43: 0 | X43: 88 | Y43: 87 | Z43: 精灵升华
A44: 10037 | B44: 1 | C44: 10034 | D44: 4 | E44: 1 | F44: 22 | G44: 0 | H44: 1 | I44: 10 | J44: 0 | K44: 0 | L44: 0 | N44: 0 | O44: 绝境梦魇的升华材料。 | P44: 999999 | Q44: 1 | R44: 0 | S44: 0 | X44: 88 | Y44: 87 | Z44: 精灵升华
A45: 10038 | B45: 1 | C45: 10034 | D45: 4 | E45: 1 | F45: 22 | G45: 0 | H45: 1 | I45: 10 | J45: 0 | K45: 0 | L45: 0 | N45: 0 | O45: 暴风元灵的升华材料。 | P45: 999999 | Q45: 1 | R45: 0 | S45: 0 | X45: 88 | Y45: 87 | Z45: 精灵升华
A46: 10039 | B46: 大地核心 | C46: 10039 | D46: 4 | E46: 1 | F46: 22 | G46: 0 | H46: 1 | I46: 10 | J46: 0 | K46: 0 | L46: 0 | N46: 0 | O46: “坚韧且无可动摇，大地与无畏者皆如此。”——大地之子的升华材料。 | P46: 999999 | Q46: 1 | R46: 0 | S46: 0 | X46: 88 | Y46: 87 | Z46: 精灵升华
A47: 10040 | B47: 妖魅花种 | C47: 10040 | D47: 4 | E47: 1 | F47: 22 | G47: 0 | H47: 1 | I47: 10 | J47: 0 | K47: 0 | L47: 0 | N47: 0 | O47: “美妙之物总是危险的居多”——花之妖精的升华材料。 | P47: 999999 | Q47: 1 | R47: 0 | S47: 0 | X47: 88 | Y47: 87 | Z47: 精灵升华
A48: 10041 | B48: 1 | C48: 10034 | D48: 4 | E48: 1 | F48: 22 | G48: 0 | H48: 1 | I48: 10 | J48: 0 | K48: 0 | L48: 0 | N48: 0 | O48: 森之古树的升华材料。 | P48: 999999 | Q48: 1 | R48: 0 | S48: 0 | X48: 88 | Y48: 87 | Z48: 精灵升华
A49: 10072 | B49: 浓情巧克力 | C49: 10072 | D49: 5 | E49: 1 | F49: 12 | G49: 0 | H49: 1 | I49: 10 | J49: 0 | K49: 0 | L49: 0 | M49: 20180828 | N49: 0 | O49: 包含着浓浓情意的巧克力，可在商店兑换高级奖励。 | P49: 999999 | Q49: 1 | R49: 0 | S49: 0 | X49: 129 | Y49: 119 | Z49: 去兑换
A50: 10073 | B50: 1朵玫瑰 | C50: 10073 | D50: 0 | E50: 1 | F50: 12 | G50: 0 | H50: 1 | I50: 10 | J50: 0 | K50: 0 | L50: 0 | M50: 20180823 | N50: 0 | O50: 1朵玫瑰，象征着唯一。 | P50: 999999 | Q50: 1 | R50: 0 | S50: 0 | X50: 98|997|998|999|21|19 | Y50: 145 | Z50: 献给女神
A51: 10074 | B51: 9朵玫瑰 | C51: 10074 | D51: 2 | E51: 1 | F51: 12 | G51: 0 | H51: 1 | I51: 10 | J51: 0 | K51: 0 | L51: 0 | M51: 20180823 | N51: 0 | O51: 9朵玫瑰，象征着长相守。 | P51: 999999 | Q51: 1 | R51: 0 | S51: 0 | X51: 98|997|998|999|21|19 | Y51: 145 | Z51: 献给女神
A52: 10075 | B52: 99朵玫瑰 | C52: 10075 | D52: 4 | E52: 1 | F52: 12 | G52: 0 | H52: 1 | I52: 10 | J52: 0 | K52: 0 | L52: 0 | M52: 20180823 | N52: 0 | O52: 99朵玫瑰，象征着天长地久。 | P52: 999999 | Q52: 1 | R52: 0 | S52: 0 | Y52: 145 | Z52: 献给女神
A53: 10076 | B53: 艾叶 | C53: 10076 | D53: 4 | E53: 1 | F53: 12 | G53: 0 | H53: 1 | I53: 10 | J53: 0 | K53: 0 | L53: 0 | M53: 20180620 | N53: 0 | O53: 散发着淡淡清香的艾叶，可在商店兑换高级奖励。 | P53: 999999 | Q53: 1 | R53: 0 | S53: 0 | X53: 129 | Y53: 145 | Z53: 去兑换
A54: 10077 | B54: 斋粽 | C54: 10077 | D54: 0 | E54: 1 | F54: 12 | G54: 0 | H54: 1 | I54: 10 | J54: 0 | K54: 0 | L54: 0 | M54: 20180620 | N54: 0 | O54: 没有馅的粽子，用来投河祭龙性价比最高。 | P54: 999999 | Q54: 1 | R54: 0 | S54: 0 | X54: 98|997|998|999|21|19 | Y54: 145 | Z54: 祭龙
A55: 10078 | B55: 西米甜心粽 | C55: 10078 | D55: 2 | E55: 1 | F55: 12 | G55: 0 | H55: 1 | I55: 10 | J55: 0 | K55: 0 | L55: 0 | M55: 20180620 | N55: 0 | O55: 包裹着甜心馅的西米粽，好吃又不腻。 | P55: 999999 | Q55: 1 | R55: 0 | S55: 0 | X55: 98|997|998|999|21|19 | Y55: 145 | Z55: 祭龙
A56: 10079 | B56: 巧克力水晶粽 | C56: 10079 | D56: 4 | E56: 1 | F56: 12 | G56: 0 | H56: 1 | I56: 10 | J56: 0 | K56: 0 | L56: 0 | M56: 20180620 | N56: 0 | O56: 精致美味的巧克力馅水晶粽，简直舍不得丢出去。 | P56: 999999 | Q56: 1 | R56: 0 | S56: 0 | Y56: 145 | Z56: 祭龙
A57: 10080 | B57: 橙装 | C57: 20401 | D57: 4 | E57: 1 | F57: 0 | G57: 0 | H57: 1 | I57: 10 | J57: 0 | K57: 0 | L57: 0 | N57: 0 | O57: 随机橙品装备。 | P57: 999999 | Q57: 1 | R57: 0 | S57: 0
A58: 10081 | B58: 闪光橙装 | C58: 20402 | D58: 4 | E58: 1 | F58: 0 | G58: 0 | H58: 1 | I58: 10 | J58: 0 | K58: 0 | L58: 0 | N58: 0 | O58: 随机闪光橙品装备。 | P58: 999999 | Q58: 1 | R58: 0 | S58: 0 | AF58: UI_zhuangbei_xingxing
A59: 10082 | B59: 橙装碎片 | C59: 20401 | D59: 4 | E59: 1 | F59: 0 | G59: 0 | H59: 1 | I59: 10 | J59: 0 | K59: 0 | L59: 0 | N59: 0 | O59: 随机橙品装备碎片。 | P59: 999999 | Q59: 1 | R59: 0 | S59: 0 | AA59: 1
A60: 10083 | B60: 闪光橙装碎片 | C60: 20402 | D60: 4 | E60: 1 | F60: 0 | G60: 0 | H60: 1 | I60: 10 | J60: 0 | K60: 0 | L60: 0 | N60: 0 | O60: 随机闪光橙品装备碎片。 | P60: 999999 | Q60: 1 | R60: 0 | S60: 0 | AA60: 1 | AF60: UI_zhuangbei_xingxing
A61: 10084 | B61: 劳动节奖章 | C61: 10084 | D61: 2 | E61: 1 | F61: 12 | G61: 0 | H61: 1 | I61: 10 | J61: 0 | K61: 0 | L61: 0 | M61: 20180505 | N61: 0 | O61: 通向荣誉的道路是由劳动铺设的！ | P61: 999999 | Q61: 1 | R61: 0 | S61: 0 | X61: 19|21|997|998|999 | Y61: 98 | Z61: 去兑换
A62: 10085 | B62: 汤圆 | C62: 10085 | D62: 3 | E62: 1 | F62: 12 | G62: 0 | H62: 1 | I62: 10 | J62: 0 | K62: 0 | L62: 0 | M62: 20180306 | N62: 0 | O62: 流沙馅汤圆。 | P62: 999999 | Q62: 1 | R62: 0 | S62: 0 | X62: 19|21|997|998|999 | Y62: 98 | Z62: 去兑换
A63: 10086 | B63: 三彩汤圆 | C63: 10086 | D63: 4 | E63: 1 | F63: 12 | G63: 0 | H63: 1 | I63: 10 | J63: 0 | K63: 0 | L63: 0 | M63: 20180306 | N63: 0 | O63: 三种口味的汤圆。 | P63: 999999 | Q63: 1 | R63: 0 | S63: 0 | X63: 19|21|997|998|999 | Y63: 98 | Z63: 去兑换
A64: 10087 | B64: 新春灯笼 | C64: 10087 | D64: 4 | E64: 1 | F64: 12 | G64: 0 | H64: 1 | I64: 10 | J64: 0 | K64: 0 | L64: 0 | M64: 20180221 | N64: 0 | O64: 新春灯笼，新春活动兑换材料。 | P64: 999999 | Q64: 1 | R64: 0 | S64: 0 | X64: 129 | Y64: 129 | Z64: 去兑换
A65: 10088 | B65: 小爆竹 | C65: 10088 | D65: 0 | E65: 1 | F65: 12 | G65: 0 | H65: 1 | I65: 10 | J65: 0 | K65: 0 | L65: 0 | M65: 20190212 | N65: 0 | O65: 小爆竹，用于攻击低级boss。 | P65: 999999 | Q65: 1 | R65: 0 | S65: 0 | X65: 98|997|998|999|21|19 | Y65: 129 | Z65: 丢爆竹
A66: 10089 | B66: 大爆竹 | C66: 10089 | D66: 2 | E66: 1 | F66: 12 | G66: 0 | H66: 1 | I66: 10 | J66: 0 | K66: 0 | L66: 0 | M66: 20190212 | N66: 0 | O66: 大爆竹，用于攻击低级boss。 | P66: 999999 | Q66: 1 | R66: 0 | S66: 0 | X66: 98|997|998|999|21|19 | Y66: 129 | Z66: 丢爆竹
A67: 10090 | B67: 爆竹串 | C67: 10090 | D67: 4 | E67: 1 | F67: 12 | G67: 0 | H67: 1 | I67: 10 | J67: 0 | K67: 0 | L67: 0 | M67: 20190212 | N67: 0 | O67: 爆竹串，用于攻击高级boss。 | P67: 999999 | Q67: 1 | R67: 0 | S67: 0 | X67: 129 | Y67: 129 | Z67: 丢爆竹
A68: 10091 | B68: 改名卡 | C68: 10091 | D68: 4 | E68: 1 | F68: 12 | G68: 0 | H68: 1 | I68: 10 | J68: 0 | K68: 0 | L68: 0 | N68: 0 | O68: 提交该卡片可以在登记处重新修改队伍的注册名称，用于队伍改名。 | P68: 999999 | Q68: 1 | R68: 0 | S68: 0 | X68: 12 | Y68: 124 | Z68: 去改名
A69: 10092 | B69: 肥宅快乐水 | C69: 10092 | D69: 4 | E69: 1 | F69: 12 | G69: 0 | H69: 1 | I69: 10 | J69: 0 | K69: 0 | L69: 0 | M69: 20180828 | N69: 0 | O69: 夏日好伙伴，用于清凉一夏兑换材料 | P69: 999999 | Q69: 1 | R69: 0 | S69: 0 | Y69: 119 | Z69: 去占卜
A70: 10093 | B70: 雪球 | C70: 10093 | D70: 0 | E70: 1 | F70: 12 | G70: 0 | H70: 1 | I70: 10 | J70: 0 | K70: 0 | L70: 0 | M70: 20181201 | N70: 0 | O70: 普通的雪球，用于攻击低级boss。 | P70: 999999 | Q70: 1 | R70: 0 | S70: 0 | X70: 98|997|998|999|21|19 | Y70: 119 | Z70: 去占卜
A71: 10094 | B71: 蔚蓝雪球 | C71: 10094 | D71: 2 | E71: 1 | F71: 12 | G71: 0 | H71: 1 | I71: 10 | J71: 0 | K71: 0 | L71: 0 | M71: 20181201 | N71: 0 | O71: 坚硬的雪球，用于攻击低级boss。 | P71: 999999 | Q71: 1 | R71: 0 | S71: 0 | X71: 98|997|998|999|21|19 | Y71: 119 | Z71: 去占卜
A72: 10095 | B72: 黄金雪球 | C72: 10095 | D72: 4 | E72: 1 | F72: 12 | G72: 0 | H72: 1 | I72: 10 | J72: 0 | K72: 0 | L72: 0 | M72: 20181201 | N72: 0 | O72: 罕见的雪球，用于攻击高级boss。 | P72: 999999 | Q72: 1 | R72: 0 | S72: 0 | X72: 119 | Y72: 119 | Z72: 去占卜
A73: 10096 | B73: 占星水晶 | C73: 10096 | D73: 3 | E73: 1 | F73: 12 | G73: 0 | H73: 1 | I73: 10 | J73: 0 | K73: 0 | L73: 0 | N73: 0 | O73: 用于占星抽卡。 | P73: 999999 | Q73: 1 | R73: 0 | S73: 0 | Y73: 113 | Z73: 去占卜
A74: 10097 | B74: 橙品英雄碎片 | C74: 30000 | D74: 4 | E74: 1 | F74: 0 | G74: 0 | H74: 1 | I74: 10 | J74: 0 | K74: 0 | L74: 0 | N74: 0 | O74: 随机橙品英雄碎片。 | P74: 999999 | Q74: 1 | R74: 0 | S74: 0 | AA74: 1
A75: 10098 | B75: 白银购物卡 | C75: 10098 | D75: 3 | E75: 1 | F75: 12 | G75: 0 | H75: 1 | I75: 10 | J75: 0 | K75: 0 | L75: 0 | M75: 20171113 | N75: 0 | O75: 双十一狂欢兑换材料。 | P75: 999999 | Q75: 1 | R75: 0 | S75: 0 | Y75: 98 | Z75: 去兑换
A76: 10099 | B76: 黄金购物卡 | C76: 10099 | D76: 4 | E76: 1 | F76: 12 | G76: 0 | H76: 1 | I76: 10 | J76: 0 | K76: 0 | L76: 0 | M76: 20171113 | N76: 0 | O76: 双十一狂欢兑换材料，打开红包时小几率出现，可在双11活动中兑换极品道具。 | P76: 999999 | Q76: 1 | R76: 0 | S76: 0 | Y76: 98 | Z76: 去兑换
A77: 10100 | B77: 能源之钥 | C77: 10100 | D77: 4 | E77: 1 | F77: 0 | G77: 0 | H77: 1 | I77: 10 | J77: 0 | K77: 0 | L77: 0 | N77: 0 | O77: 用于开启原石孔位。 | P77: 999999 | Q77: 1 | R77: 0 | S77: 0
A78: 10101 | B78: 扭蛋币 | C78: 10101 | D78: 4 | E78: 1 | F78: 19 | G78: 0 | H78: 1 | I78: 10 | J78: 0 | K78: 0 | L78: 0 | N78: 0 | O78: 可在空间管理局的扭蛋机处进行一次扭蛋操作。 | P78: 999999 | Q78: 1 | R78: 0 | S78: 0 | Y78: 102 | Z78: 去扭蛋
A79: 10102 | B79: 特制扭蛋币 | C79: 10102 | D79: 4 | E79: 1 | F79: 19 | G79: 0 | H79: 1 | I79: 10 | J79: 0 | K79: 0 | L79: 0 | M79: 15 | N79: 0 | O79: 可在特制扭蛋机处进行一次扭蛋操作！ | P79: 999999 | Q79: 1 | R79: 0 | S79: 0 | Y79: 131 | Z79: 去扭蛋 | AF79: UI_zhuangbei_xingxing
A80: 10103 | B80: 特制扭蛋币 | C80: 10102 | D80: 4 | E80: 1 | F80: 19 | G80: 0 | H80: 1 | I80: 10 | J80: 0 | K80: 0 | L80: 0 | M80: 21 | N80: 0 | O80: 可在特制扭蛋机处进行一次扭蛋操作。 | P80: 999999 | Q80: 1 | R80: 0 | S80: 0 | Y80: 131 | Z80: 去扭蛋 | AF80: UI_zhuangbei_xingxing
A81: 10104 | B81: 抽奖券 | C81: 10102 | D81: 4 | E81: 1 | F81: 19 | G81: 0 | H81: 1 | I81: 10 | J81: 0 | K81: 0 | L81: 0 | M81: 20180327 | N81: 0 | O81: 可进行一次幸运转盘抽奖！ | P81: 999999 | Q81: 1 | R81: 0 | S81: 0 | Y81: 135 | Z81: 去抽奖 | AF81: UI_zhuangbei_xingxing
A82: 10105 | B82: 抽奖券 | C82: 10102 | D82: 4 | E82: 1 | F82: 19 | G82: 0 | H82: 1 | I82: 10 | J82: 0 | K82: 0 | L82: 0 | M82: 28 | N82: 0 | O82: 可进行一次幸运转盘抽奖。 | P82: 999999 | Q82: 1 | R82: 0 | S82: 0 | Y82: 135 | Z82: 去抽奖 | AF82: UI_zhuangbei_xingxing
A83: 10106 | B83: 特制扭蛋币 | C83: 10102 | D83: 4 | E83: 1 | F83: 19 | G83: 0 | H83: 1 | I83: 10 | J83: 0 | K83: 0 | L83: 0 | M83: 15 | N83: 0 | O83: 可在特制扭蛋机处进行一次扭蛋操作。 | P83: 999999 | Q83: 1 | R83: 0 | S83: 0 | Y83: 131 | Z83: 去扭蛋 | AF83: UI_zhuangbei_xingxing
A84: 10107 | B84: 开服抽奖券 | C84: 10107 | D84: 4 | E84: 1 | F84: 19 | G84: 0 | H84: 1 | I84: 10 | J84: 0 | K84: 0 | L84: 0 | M84: 5 | N84: 0 | O84: 转转转！下一个欧洲人就是你！可进行一次幸运转盘抽奖。 | P84: 999999 | Q84: 1 | R84: 0 | S84: 0 | Y84: 135 | Z84: 去抽奖 | AF84: UI_zhuangbei_xingxing
A85: 10108 | B85: 开服抽奖券 | C85: 10107 | D85: 4 | E85: 1 | F85: 19 | G85: 0 | H85: 1 | I85: 10 | J85: 0 | K85: 0 | L85: 0 | M85: 6 | N85: 0 | O85: 转转转！下一个欧洲人就是你！可进行一次幸运转盘抽奖！ | P85: 999999 | Q85: 1 | R85: 0 | S85: 0 | Y85: 135 | Z85: 去抽奖 | AF85: UI_zhuangbei_xingxing
A86: 10109 | B86: 抽奖券 | C86: 10107 | D86: 4 | E86: 1 | F86: 19 | G86: 0 | H86: 1 | I86: 10 | J86: 0 | K86: 0 | L86: 0 | M86: 20160615 | N86: 0 | O86: 转转转！下一个欧洲人就是你！可进行一次幸运转盘抽奖。 | P86: 999999 | Q86: 1 | R86: 0 | S86: 0 | Y86: 135 | Z86: 去抽奖 | AF86: UI_zhuangbei_xingxing
A87: 10110 | B87: 抽奖券 | C87: 10107 | D87: 4 | E87: 1 | F87: 19 | G87: 0 | H87: 1 | I87: 10 | J87: 0 | K87: 0 | L87: 0 | M87: 20160618 | N87: 0 | O87: 转转转！下一个欧洲人就是你！可进行一次幸运转盘抽奖！ | P87: 999999 | Q87: 1 | R87: 0 | S87: 0 | Y87: 135 | Z87: 去抽奖 | AF87: UI_zhuangbei_xingxing
A88: 10111 | B88: 特制扭蛋币 | C88: 10102 | D88: 4 | E88: 1 | F88: 19 | G88: 0 | H88: 1 | I88: 10 | J88: 0 | K88: 0 | L88: 0 | N88: 0 | O88: 可在特制扭蛋机处进行一次扭蛋操作。 | P88: 999999 | Q88: 1 | R88: 0 | S88: 0 | Y88: 131 | Z88: 去扭蛋 | AF88: UI_zhuangbei_xingxing
A89: 10112 | B89: 圣器精华 | C89: 10112 | D89: 5 | E89: 1 | F89: 0 | G89: 0 | H89: 1 | I89: 10 | J89: 0 | K89: 0 | L89: 0 | N89: 0 | O89: 尚未定型的圣器精华，可前往战功商店兑换成符文精华或徽章精华。 | P89: 999999 | Q89: 1 | R89: 0 | S89: 0 | Y89: 34 | Z89: 去兑换
A90: 10113 | B90: 符文精华 | C90: 10113 | D90: 5 | E90: 1 | F90: 0 | G90: 0 | H90: 1 | I90: 10 | J90: 0 | K90: 0 | L90: 0 | N90: 0 | O90: 可将橙品符文改造为红品符文。 | P90: 999999 | Q90: 1 | R90: 0 | S90: 0 | X90: 34
A91: 10114 | B91: 徽章精华 | C91: 10114 | D91: 5 | E91: 1 | F91: 0 | G91: 0 | H91: 1 | I91: 10 | J91: 0 | K91: 0 | L91: 0 | N91: 0 | O91: 可将橙品徽章改造为红品徽章。 | P91: 999999 | Q91: 1 | R91: 0 | S91: 0 | X91: 34
A92: 10115 | B92: 升星石 | C92: 10115 | D92: 4 | E92: 1 | F92: 12 | G92: 0 | H92: 1 | I92: 10 | J92: 0 | K92: 0 | L92: 0 | N92: 0 | O92: 装备升星。 | P92: 999999 | Q92: 1 | R92: 0 | S92: 0
A93: 10116 | B93: 装备改造石 | C93: 10116 | D93: 4 | E93: 1 | F93: 12 | G93: 0 | H93: 1 | I93: 10 | J93: 0 | K93: 0 | L93: 0 | N93: 0 | O93: 可将紫品套装【荣耀之心】、【青鸟暴风】、【烈焰掌控】套装改造为橙品套装。 | P93: 999999 | Q93: 1 | R93: 0 | S93: 0 | X93: 98 | Y93: 5 | Z93: 去改造
A94: 10117 | B94: 装备改造石 | C94: 10117 | D94: 5 | E94: 1 | F94: 12 | G94: 0 | H94: 1 | I94: 10 | J94: 0 | K94: 0 | L94: 0 | N94: 0 | O94: 可将橙品套装【巨像守护】、【大地之子】、【幽冥主宰】套装改造为红品套装。 | P94: 999999 | Q94: 1 | R94: 0 | S94: 0 | X94: 98 | Y94: 5 | Z94: 去改造
A95: 10118 | B95: 装备精华 | C95: 10118 | D95: 5 | E95: 1 | F95: 12 | G95: 0 | H95: 1 | I95: 10 | J95: 0 | K95: 0 | L95: 0 | N95: 0 | O95: 可在威名商店兑换红品装备。 | P95: 999999 | Q95: 1 | R95: 0 | S95: 0
A96: 10998 | B96: 体力 | C96: 19004 | D96: 2 | E96: 1 | F96: 1 | G96: 0 | H96: 1 | I96: 10 | J96: 0 | K96: 0 | L96: 1 | N96: 0 | O96: 没有体力怎么愉快玩耍呢。 | P96: 999999 | Q96: 1 | R96: 1 | S96: 0 | X96: 12
A97: 10999 | B97: 精力 | C97: 19008 | D97: 2 | E97: 1 | F97: 2 | G97: 0 | H97: 1 | I97: 10 | J97: 0 | K97: 0 | L97: 1 | N97: 0 | O97: 没有精力怎么愉快玩耍呢。 | P97: 999999 | Q97: 1 | R97: 1 | S97: 0 | X97: 12
A98: 11101 | B98: 长剑残件 | C98: 20101 | D98: =MID(RC[-3],3,1) -> 1 | E98: 1 | F98: 7 | G98: 0 | H98: 1 | I98: 5 | J98: 0 | K98: 0 | L98: 0 | N98: 20101 | O98: 集齐10个可以合成一件绿品武器：长剑。 | P98: 999999 | Q98: 1 | R98: 1 | S98: 0 | X98: 996 | AA98: 1
A99: 11102 | B99: 铁甲残件 | C99: 21101 | D99: =MID(RC[-3],3,1) -> 1 | E99: 1 | F99: 7 | G99: 0 | H99: 1 | I99: 5 | J99: 0 | K99: 0 | L99: 0 | N99: 21101 | O99: 集齐10个可以合成一件绿品衣服：铁甲。 | P99: 999999 | Q99: 1 | R99: 1 | S99: 0 | X99: 996 | AA99: 1
A100: 11103 | B100: 兽皮靴残件 | C100: 22101 | D100: =MID(RC[-3],3,1) -> 1 | E100: 1 | F100: 7 | G100: 0 | H100: 1 | I100: 5 | J100: 0 | K100: 0 | L100: 0 | N100: 22101 | O100: 集齐10个可以合成一件绿品鞋子：兽皮靴。 | P100: 999999 | Q100: 1 | R100: 1 | S100: 0 | X100: 996 | AA100: 1
A101: 11104 | B101: 铁护腕残件 | C101: 23101 | D101: =MID(RC[-3],3,1) -> 1 | E101: 1 | F101: 7 | G101: 0 | H101: 1 | I101: 5 | J101: 0 | K101: 0 | L101: 0 | N101: 23101 | O101: 集齐10个可以合成一件绿品护腕：铁护腕。 | P101: 999999 | Q101: 1 | R101: 1 | S101: 0 | X101: 996 | AA101: 1
A102: 11105 | B102: 精致战刃残件 | C102: 20102 | D102: =MID(RC[-3],3,1) -> 1 | E102: 1 | F102: 7 | G102: 0 | H102: 1 | I102: 6 | J102: 0 | K102: 0 | L102: 0 | N102: 20102 | O102: 集齐10个可以合成一件绿品套装武器：精致战刃。 | P102: 999999 | Q102: 1 | R102: 1 | S102: 0 | X102: 996 | AA102: 1 | AF102: UI_taozhuang_lvse
A103: 11106 | B103: 精致战甲残件 | C103: 21102 | D103: =MID(RC[-3],3,1) -> 1 | E103: 1 | F103: 7 | G103: 0 | H103: 1 | I103: 6 | J103: 0 | K103: 0 | L103: 0 | N103: 21102 | O103: 集齐10个可以合成一件绿品套装衣服：精致战甲。 | P103: 999999 | Q103: 1 | R103: 1 | S103: 0 | X103: 996 | AA103: 1 | AF103: UI_taozhuang_lvse
A104: 11107 | B104: 精致战靴残件 | C104: 22102 | D104: =MID(RC[-3],3,1) -> 1 | E104: 1 | F104: 7 | G104: 0 | H104: 1 | I104: 6 | J104: 0 | K104: 0 | L104: 0 | N104: 22102 | O104: 集齐10个可以合成一件绿品套装鞋子：精致战靴。 | P104: 999999 | Q104: 1 | R104: 1 | S104: 0 | X104: 996 | AA104: 1 | AF104: UI_taozhuang_lvse
A105: 11108 | B105: 精致护腕残件 | C105: 23102 | D105: =MID(RC[-3],3,1) -> 1 | E105: 1 | F105: 7 | G105: 0 | H105: 1 | I105: 6 | J105: 0 | K105: 0 | L105: 0 | N105: 23102 | O105: 集齐10个可以合成一件绿品套装护腕：精致护腕。 | P105: 999999 | Q105: 1 | R105: 1 | S105: 0 | X105: 996 | AA105: 1 | AF105: UI_taozhuang_lvse
A106: 11201 | B106: 战争权杖残件 | C106: 20201 | D106: =MID(RC[-3],3,1) -> 2 | E106: 1 | F106: 7 | G106: 0 | H106: 1 | I106: 45 | J106: 0 | K106: 0 | L106: 0 | N106: 20201 | O106: 集齐20个可以合成一件蓝品武器：战争权杖。 | P106: 999999 | Q106: 1 | R106: 1 | S106: 0 | X106: 26|33 | AA106: 1
A107: 11202 | B107: 坚韧盔甲残件 | C107: 21201 | D107: =MID(RC[-3],3,1) -> 2 | E107: 1 | F107: 7 | G107: 0 | H107: 1 | I107: 45 | J107: 0 | K107: 0 | L107: 0 | N107: 21201 | O107: 集齐20个可以合成一件蓝品衣服：坚韧盔甲。 | P107: 999999 | Q107: 1 | R107: 1 | S107: 0 | X107: 26|33 | AA107: 1
A108: 11203 | B108: 镶甲短靴残件 | C108: 22201 | D108: =MID(RC[-3],3,1) -> 2 | E108: 1 | F108: 7 | G108: 0 | H108: 1 | I108: 45 | J108: 0 | K108: 0 | L108: 0 | N108: 22201 | O108: 集齐20个可以合成一件蓝品鞋子：镶甲短靴。 | P108: 999999 | Q108: 1 | R108: 1 | S108: 0 | X108: 26|33 | AA108: 1
A109: 11204 | B109: 铜纹护腕残件 | C109: 23201 | D109: =MID(RC[-3],3,1) -> 2 | E109: 1 | F109: 7 | G109: 0 | H109: 1 | I109: 45 | J109: 0 | K109: 0 | L109: 0 | N109: 23201 | O109: 集齐20个可以合成一件蓝品护腕：铜纹护腕。 | P109: 999999 | Q109: 1 | R109: 1 | S109: 0 | X109: 26|33 | AA109: 1
A110: 11205 | B110: 骑士长剑残件 | C110: 20202 | D110: =MID(RC[-3],3,1) -> 2 | E110: 1 | F110: 7 | G110: 0 | H110: 1 | I110: 60 | J110: 0 | K110: 0 | L110: 0 | N110: 20202 | O110: 集齐20个可以合成一件蓝品套装武器：骑士长剑。 | P110: 999999 | Q110: 1 | R110: 1 | S110: 0 | X110: 26|995 | AA110: 1 | AF110: UI_taozhuang_lanse
A111: 11206 | B111: 骑士铁甲残件 | C111: 21202 | D111: =MID(RC[-3],3,1) -> 2 | E111: 1 | F111: 7 | G111: 0 | H111: 1 | I111: 60 | J111: 0 | K111: 0 | L111: 0 | N111: 21202 | O111: 集齐20个可以合成一件蓝品套装衣服：骑士铁甲。 | P111: 999999 | Q111: 1 | R111: 1 | S111: 0 | X111: 26|995 | AA111: 1 | AF111: UI_taozhuang_lanse
A112: 11207 | B112: 骑士铁靴残件 | C112: 22202 | D112: =MID(RC[-3],3,1) -> 2 | E112: 1 | F112: 7 | G112: 0 | H112: 1 | I112: 60 | J112: 0 | K112: 0 | L112: 0 | N112: 22202 | O112: 集齐20个可以合成一件蓝品套装鞋子：骑士铁靴。 | P112: 999999 | Q112: 1 | R112: 1 | S112: 0 | X112: 26|994 | AA112: 1 | AF112: UI_taozhuang_lanse
A113: 11208 | B113: 骑士护腕残件 | C113: 23202 | D113: =MID(RC[-3],3,1) -> 2 | E113: 1 | F113: 7 | G113: 0 | H113: 1 | I113: 60 | J113: 0 | K113: 0 | L113: 0 | N113: 23202 | O113: 集齐20个可以合成一件蓝品套装护腕：骑士护腕。 | P113: 999999 | Q113: 1 | R113: 1 | S113: 0 | X113: 26|994 | AA113: 1 | AF113: UI_taozhuang_lanse
A114: 11300 | B114: 审判者残件 | C114: 20300 | D114: =MID(RC[-3],3,1) -> 3 | E114: 1 | F114: 7 | G114: 0 | H114: 1 | I114: 150 | J114: 0 | K114: 0 | L114: 0 | N114: 20300 | O114: 集齐40个可以合成一件紫品武器：审判者。 | P114: 999999 | Q114: 1 | R114: 1 | S114: 0 | AA114: 1
A115: 11301 | B115: 掠夺弯刀残件 | C115: 20301 | D115: =MID(RC[-3],3,1) -> 3 | E115: 1 | F115: 7 | G115: 0 | H115: 1 | I115: 150 | J115: 0 | K115: 0 | L115: 0 | N115: 20301 | O115: 集齐40个可以合成一件紫品武器：掠夺弯刀。 | P115: 999999 | Q115: 1 | R115: 1 | S115: 0 | X115: 26|33 | AA115: 1
A116: 11302 | B116: 不动盔甲残件 | C116: 21301 | D116: =MID(RC[-3],3,1) -> 3 | E116: 1 | F116: 7 | G116: 0 | H116: 1 | I116: 150 | J116: 0 | K116: 0 | L116: 0 | N116: 21301 | O116: 集齐40个可以合成一件紫品衣服：不动盔甲。 | P116: 999999 | Q116: 1 | R116: 1 | S116: 0 | X116: 26|33 | AA116: 1
A117: 11303 | B117: 疾风长靴残件 | C117: 22301 | D117: =MID(RC[-3],3,1) -> 3 | E117: 1 | F117: 7 | G117: 0 | H117: 1 | I117: 150 | J117: 0 | K117: 0 | L117: 0 | N117: 22301 | O117: 集齐40个可以合成一件紫品鞋子：疾风长靴。 | P117: 999999 | Q117: 1 | R117: 1 | S117: 0 | X117: 26|33 | AA117: 1
A118: 11304 | B118: 正义护腕残件 | C118: 23301 | D118: =MID(RC[-3],3,1) -> 3 | E118: 1 | F118: 7 | G118: 0 | H118: 1 | I118: 150 | J118: 0 | K118: 0 | L118: 0 | N118: 23301 | O118: 集齐40个可以合成一件紫品护腕：正义护腕。 | P118: 999999 | Q118: 1 | R118: 1 | S118: 0 | X118: 26|33 | AA118: 1
A119: 11305 | B119: 绞首双剑残件 | C119: 20302 | D119: =MID(RC[-3],3,1) -> 3 | E119: 1 | F119: 7 | G119: 0 | H119: 1 | I119: 250 | J119: 0 | K119: 0 | L119: 0 | N119: 20302 | O119: 集齐40个可以合成一件紫品武器：绞首双剑。 | P119: 999999 | Q119: 1 | R119: 1 | S119: 0 | X119: 26|33 | AA119: 1 | AF119: UI_zhuangbei_xingxing
A120: 11306 | B120: 光明战甲残件 | C120: 21302 | D120: =MID(RC[-3],3,1) -> 3 | E120: 1 | F120: 7 | G120: 0 | H120: 1 | I120: 250 | J120: 0 | K120: 0 | L120: 0 | N120: 21302 | O120: 集齐40个可以合成一件紫品衣服：光明战甲。 | P120: 999999 | Q120: 1 | R120: 1 | S120: 0 | X120: 26|33 | AA120: 1 | AF120: UI_zhuangbei_xingxing
A121: 11307 | B121: 黑钢长靴残件 | C121: 22302 | D121: =MID(RC[-3],3,1) -> 3 | E121: 1 | F121: 7 | G121: 0 | H121: 1 | I121: 250 | J121: 0 | K121: 0 | L121: 0 | N121: 22302 | O121: 集齐40个可以合成一件紫品鞋子：黑钢长靴。 | P121: 999999 | Q121: 1 | R121: 1 | S121: 0 | X121: 26|33 | AA121: 1 | AF121: UI_zhuangbei_xingxing
A122: 11308 | B122: 咆哮护腕残件 | C122: 23302 | D122: =MID(RC[-3],3,1) -> 3 | E122: 1 | F122: 7 | G122: 0 | H122: 1 | I122: 250 | J122: 0 | K122: 0 | L122: 0 | N122: 23302 | O122: 集齐40个可以合成一件紫品护腕：咆哮护腕。 | P122: 999999 | Q122: 1 | R122: 1 | S122: 0 | X122: 26|33 | AA122: 1 | AF122: UI_zhuangbei_xingxing
A123: 11309 | B123: 荣耀权杖残件 | C123: 20303 | D123: =MID(RC[-3],3,1) -> 3 | E123: 1 | F123: 7 | G123: 0 | H123: 1 | I123: 300 | J123: 0 | K123: 0 | L123: 0 | N123: 20303 | O123: 集齐40个可以合成一件紫品套装武器：荣耀权杖。 | P123: 999999 | Q123: 1 | R123: 1 | S123: 0 | X123: 26|995 | AA123: 1 | AF123: UI_taozhuang_zise1
A124: 11310 | B124: 荣耀圣甲残件 | C124: 21303 | D124: =MID(RC[-3],3,1) -> 3 | E124: 1 | F124: 7 | G124: 0 | H124: 1 | I124: 300 | J124: 0 | K124: 0 | L124: 0 | N124: 21303 | O124: 集齐40个可以合成一件紫品套装衣服：荣耀圣甲。 | P124: 999999 | Q124: 1 | R124: 1 | S124: 0 | X124: 26|994 | AA124: 1 | AF124: UI_taozhuang_zise1
A125: 11311 | B125: 荣耀重靴残件 | C125: 22303 | D125: =MID(RC[-3],3,1) -> 3 | E125: 1 | F125: 7 | G125: 0 | H125: 1 | I125: 300 | J125: 0 | K125: 0 | L125: 0 | N125: 22303 | O125: 集齐40个可以合成一件紫品套装鞋子：荣耀重靴。 | P125: 999999 | Q125: 1 | R125: 1 | S125: 0 | X125: 26|994 | AA125: 1 | AF125: UI_taozhuang_zise1
A126: 11312 | B126: 荣耀护腕残件 | C126: 23303 | D126: =MID(RC[-3],3,1) -> 3 | E126: 1 | F126: 7 | G126: 0 | H126: 1 | I126: 300 | J126: 0 | K126: 0 | L126: 0 | N126: 23303 | O126: 集齐40个可以合成一件紫品套装护腕：荣耀护腕。 | P126: 999999 | Q126: 1 | R126: 1 | S126: 0 | X126: 26|69 | AA126: 1 | AF126: UI_taozhuang_zise1
A127: 11313 | B127: 烈焰晶杖残件 | C127: 20304 | D127: =MID(RC[-3],3,1) -> 3 | E127: 1 | F127: 7 | G127: 0 | H127: 1 | I127: 325 | J127: 0 | K127: 0 | L127: 0 | N127: 20304 | O127: 集齐40个可以合成一件紫品套装武器：烈焰晶杖。 | P127: 999999 | Q127: 1 | R127: 1 | S127: 0 | X127: 26|50 | AA127: 1 | AF127: UI_taozhuang_zise1
A128: 11314 | B128: 烈焰护甲残件 | C128: 21304 | D128: =MID(RC[-3],3,1) -> 3 | E128: 1 | F128: 7 | G128: 0 | H128: 1 | I128: 325 | J128: 0 | K128: 0 | L128: 0 | N128: 21304 | O128: 集齐40个可以合成一件紫品套装衣服：烈焰护甲。 | P128: 999999 | Q128: 1 | R128: 1 | S128: 0 | X128: 26|50 | AA128: 1 | AF128: UI_taozhuang_zise1
A129: 11315 | B129: 烈焰魔靴残件 | C129: 22304 | D129: =MID(RC[-3],3,1) -> 3 | E129: 1 | F129: 7 | G129: 0 | H129: 1 | I129: 325 | J129: 0 | K129: 0 | L129: 0 | N129: 22304 | O129: 集齐40个可以合成一件紫品套装鞋子：烈焰魔靴。 | P129: 999999 | Q129: 1 | R129: 1 | S129: 0 | X129: 26|50 | AA129: 1 | AF129: UI_taozhuang_zise1
A130: 11316 | B130: 烈焰护腕残件 | C130: 23304 | D130: =MID(RC[-3],3,1) -> 3 | E130: 1 | F130: 7 | G130: 0 | H130: 1 | I130: 325 | J130: 0 | K130: 0 | L130: 0 | N130: 23304 | O130: 集齐40个可以合成一件紫品套装护腕：烈焰护腕。 | P130: 999999 | Q130: 1 | R130: 1 | S130: 0 | X130: 26|50 | AA130: 1 | AF130: UI_taozhuang_zise1
A131: 11317 | B131: 青鸟法球残件 | C131: 20305 | D131: =MID(RC[-3],3,1) -> 3 | E131: 1 | F131: 7 | G131: 0 | H131: 1 | I131: 300 | J131: 0 | K131: 0 | L131: 0 | N131: 20305 | O131: 集齐40个可以合成一件紫品套装武器：青鸟法球。 | P131: 999999 | Q131: 1 | R131: 1 | S131: 0 | X131: 26|50 | AA131: 1 | AF131: UI_taozhuang_zise1
A132: 11318 | B132: 青鸟盔甲残件 | C132: 21305 | D132: =MID(RC[-3],3,1) -> 3 | E132: 1 | F132: 7 | G132: 0 | H132: 1 | I132: 300 | J132: 0 | K132: 0 | L132: 0 | N132: 21305 | O132: 集齐40个可以合成一件紫品套装衣服：青鸟盔甲。 | P132: 999999 | Q132: 1 | R132: 1 | S132: 0 | X132: 26|50 | AA132: 1 | AF132: UI_taozhuang_zise1
A133: 11319 | B133: 青鸟长靴残件 | C133: 22305 | D133: =MID(RC[-3],3,1) -> 3 | E133: 1 | F133: 7 | G133: 0 | H133: 1 | I133: 300 | J133: 0 | K133: 0 | L133: 0 | N133: 22305 | O133: 集齐40个可以合成一件紫品套装鞋子：青鸟长靴。 | P133: 999999 | Q133: 1 | R133: 1 | S133: 0 | X133: 26|50 | AA133: 1 | AF133: UI_taozhuang_zise1
A134: 11320 | B134: 青鸟护腕残件 | C134: 23305 | D134: =MID(RC[-3],3,1) -> 3 | E134: 1 | F134: 7 | G134: 0 | H134: 1 | I134: 300 | J134: 0 | K134: 0 | L134: 0 | N134: 23305 | O134: 集齐40个可以合成一件紫品套装护腕：青鸟护腕。 | P134: 999999 | Q134: 1 | R134: 1 | S134: 0 | X134: 26|50 | AA134: 1 | AF134: UI_taozhuang_zise1
A135: 11400 | B135: 裁决者残件 | C135: 20400 | D135: =MID(RC[-3],3,1) -> 4 | E135: 1 | F135: 7 | G135: 0 | H135: 1 | I135: 375 | J135: 0 | K135: 0 | L135: 0 | N135: 20400 | O135: 集齐60个可以合成一件橙品武器：裁决者。 | P135: 999999 | Q135: 1 | R135: 1 | S135: 0 | AA135: 1
A136: 11401 | B136: 正义巨剑残件 | C136: 20401 | D136: =MID(RC[-3],3,1) -> 4 | E136: 1 | F136: 7 | G136: 0 | H136: 1 | I136: 410 | J136: 0 | K136: 0 | L136: 0 | N136: 20401 | O136: 集齐60个可以合成一件橙品武器：正义巨剑。 | P136: 999999 | Q136: 1 | R136: 1 | S136: 0 | X136: 26|50|33|76 | AA136: 1
A137: 11402 | B137: 死者重甲残件 | C137: 21401 | D137: =MID(RC[-3],3,1) -> 4 | E137: 1 | F137: 7 | G137: 0 | H137: 1 | I137: 410 | J137: 0 | K137: 0 | L137: 0 | N137: 21401 | O137: 集齐60个可以合成一件橙品衣服：死者重甲。 | P137: 999999 | Q137: 1 | R137: 1 | S137: 0 | X137: 26|50|33 | AA137: 1
A138: 11403 | B138: 踏浪长靴残件 | C138: 22401 | D138: =MID(RC[-3],3,1) -> 4 | E138: 1 | F138: 7 | G138: 0 | H138: 1 | I138: 410 | J138: 0 | K138: 0 | L138: 0 | N138: 22401 | O138: 集齐60个可以合成一件橙品鞋子：踏浪长靴。 | P138: 999999 | Q138: 1 | R138: 1 | S138: 0 | X138: 26|50|33 | AA138: 1
A139: 11404 | B139: 超凡之手残件 | C139: 23401 | D139: =MID(RC[-3],3,1) -> 4 | E139: 1 | F139: 7 | G139: 0 | H139: 1 | I139: 410 | J139: 0 | K139: 0 | L139: 0 | N139: 23401 | O139: 集齐60个可以合成一件橙品护腕：超凡之手。 | P139: 999999 | Q139: 1 | R139: 1 | S139: 0 | X139: 26|50|33 | AA139: 1
A140: 11405 | B140: 金龙权杖残件 | C140: 20402 | D140: =MID(RC[-3],3,1) -> 4 | E140: 1 | F140: 7 | G140: 0 | H140: 1 | I140: 550 | J140: 0 | K140: 0 | L140: 0 | N140: 20402 | O140: 集齐60个可以合成一件橙品武器：金龙权杖。 | P140: 999999 | Q140: 1 | R140: 1 | S140: 0 | X140: 26|50|33 | AA140: 1 | AF140: UI_zhuangbei_xingxing
A141: 11406 | B141: 神圣之心残件 | C141: 21402 | D141: =MID(RC[-3],3,1) -> 4 | E141: 1 | F141: 7 | G141: 0 | H141: 1 | I141: 550 | J141: 0 | K141: 0 | L141: 0 | N141: 21402 | O141: 集齐60个可以合成一件橙品衣服：神圣之心。 | P141: 999999 | Q141: 1 | R141: 1 | S141: 0 | X141: 26|50|33 | AA141: 1 | AF141: UI_zhuangbei_xingxing
A142: 11407 | B142: 雷霆战靴残件 | C142: 22402 | D142: =MID(RC[-3],3,1) -> 4 | E142: 1 | F142: 7 | G142: 0 | H142: 1 | I142: 550 | J142: 0 | K142: 0 | L142: 0 | N142: 22402 | O142: 集齐60个可以合成一件橙品鞋子：雷霆战靴。 | P142: 999999 | Q142: 1 | R142: 1 | S142: 0 | X142: 26|50|33 | AA142: 1 | AF142: UI_zhuangbei_xingxing
A143: 11408 | B143: 燃烧之触残件 | C143: 23402 | D143: =MID(RC[-3],3,1) -> 4 | E143: 1 | F143: 7 | G143: 0 | H143: 1 | I143: 550 | J143: 0 | K143: 0 | L143: 0 | N143: 23402 | O143: 集齐60个可以合成一件橙品护腕：燃烧之触。 | P143: 999999 | Q143: 1 | R143: 1 | S143: 0 | X143: 26|50|33 | AA143: 1 | AF143: UI_zhuangbei_xingxing
A144: 11409 | B144: 巨像重击残件 | C144: 20403 | D144: =MID(RC[-3],3,1) -> 4 | E144: 1 | F144: 7 | G144: 0 | H144: 1 | I144: 700 | J144: 0 | K144: 0 | L144: 0 | N144: 20403 | O144: 集齐60个可以合成一件橙品套装武器：巨像重击。 | P144: 999999 | Q144: 1 | R144: 1 | S144: 0 | X144: 50 | AA144: 1 | AF144: UI_taozhuang_chengse1
A145: 11410 | B145: 巨像恐惧残件 | C145: 21403 | D145: =MID(RC[-3],3,1) -> 4 | E145: 1 | F145: 7 | G145: 0 | H145: 1 | I145: 700 | J145: 0 | K145: 0 | L145: 0 | N145: 21403 | O145: 集齐60个可以合成一件橙品套装衣服：巨像恐惧。 | P145: 999999 | Q145: 1 | R145: 1 | S145: 0 | X145: 50 | AA145: 1 | AF145: UI_taozhuang_chengse1
A146: 11411 | B146: 巨像震撼残件 | C146: 22403 | D146: =MID(RC[-3],3,1) -> 4 | E146: 1 | F146: 7 | G146: 0 | H146: 1 | I146: 700 | J146: 0 | K146: 0 | L146: 0 | N146: 22403 | O146: 集齐60个可以合成一件橙品套装鞋子：巨像震撼。 | P146: 999999 | Q146: 1 | R146: 1 | S146: 0 | X146: 50 | AA146: 1 | AF146: UI_taozhuang_chengse1
A147: 11412 | B147: 巨像崩山残件 | C147: 23403 | D147: =MID(RC[-3],3,1) -> 4 | E147: 1 | F147: 7 | G147: 0 | H147: 1 | I147: 700 | J147: 0 | K147: 0 | L147: 0 | N147: 23403 | O147: 集齐60个可以合成一件橙品套装护腕：巨像崩山。 | P147: 999999 | Q147: 1 | R147: 1 | S147: 0 | X147: 50 | AA147: 1 | AF147: UI_taozhuang_chengse1
A148: 11413 | B148: 幽冥收割残件 | C148: 20404 | D148: =MID(RC[-3],3,1) -> 4 | E148: 1 | F148: 7 | G148: 0 | H148: 1 | I148: 725 | J148: 0 | K148: 0 | L148: 0 | N148: 20404 | O148: 集齐60个可以合成一件橙品套装武器：幽冥收割。 | P148: 999999 | Q148: 1 | R148: 1 | S148: 0 | X148: 50 | AA148: 1 | AF148: UI_taozhuang_chengse1
A149: 11414 | B149: 幽冥屠戮残件 | C149: 21404 | D149: =MID(RC[-3],3,1) -> 4 | E149: 1 | F149: 7 | G149: 0 | H149: 1 | I149: 725 | J149: 0 | K149: 0 | L149: 0 | N149: 21404 | O149: 集齐60个可以合成一件橙品套装衣服：幽冥屠戮。 | P149: 999999 | Q149: 1 | R149: 1 | S149: 0 | X149: 50 | AA149: 1 | AF149: UI_taozhuang_chengse1
A150: 11415 | B150: 幽冥掠夺残件 | C150: 22404 | D150: =MID(RC[-3],3,1) -> 4 | E150: 1 | F150: 7 | G150: 0 | H150: 1 | I150: 725 | J150: 0 | K150: 0 | L150: 0 | N150: 22404 | O150: 集齐60个可以合成一件橙品套装鞋子：幽冥掠夺。 | P150: 999999 | Q150: 1 | R150: 1 | S150: 0 | X150: 50 | AA150: 1 | AF150: UI_taozhuang_chengse1
A151: 11416 | B151: 幽冥掌控残件 | C151: 23404 | D151: =MID(RC[-3],3,1) -> 4 | E151: 1 | F151: 7 | G151: 0 | H151: 1 | I151: 725 | J151: 0 | K151: 0 | L151: 0 | N151: 23404 | O151: 集齐60个可以合成一件橙品套装护腕：幽冥掌控。 | P151: 999999 | Q151: 1 | R151: 1 | S151: 0 | X151: 50 | AA151: 1 | AF151: UI_taozhuang_chengse1
A152: 11417 | B152: 大地祝福残件 | C152: 20405 | D152: =MID(RC[-3],3,1) -> 4 | E152: 1 | F152: 7 | G152: 0 | H152: 1 | I152: 700 | J152: 0 | K152: 0 | L152: 0 | N152: 20405 | O152: 集齐60个可以合成一件橙品套装武器：大地祝福。 | P152: 999999 | Q152: 1 | R152: 1 | S152: 0 | X152: 50 | AA152: 1 | AF152: UI_taozhuang_chengse1
A153: 11418 | B153: 大地之拥残件 | C153: 21405 | D153: =MID(RC[-3],3,1) -> 4 | E153: 1 | F153: 7 | G153: 0 | H153: 1 | I153: 700 | J153: 0 | K153: 0 | L153: 0 | N153: 21405 | O153: 集齐60个可以合成一件橙品套装衣服：大地之拥。 | P153: 999999 | Q153: 1 | R153: 1 | S153: 0 | X153: 50 | AA153: 1 | AF153: UI_taozhuang_chengse1
A154: 11419 | B154: 大地行者残件 | C154: 22405 | D154: =MID(RC[-3],3,1) -> 4 | E154: 1 | F154: 7 | G154: 0 | H154: 1 | I154: 700 | J154: 0 | K154: 0 | L154: 0 | N154: 22405 | O154: 集齐60个可以合成一件橙品套装鞋子：大地行者。 | P154: 999999 | Q154: 1 | R154: 1 | S154: 0 | X154: 50 | AA154: 1 | AF154: UI_taozhuang_chengse1
A155: 11420 | B155: 大地庇护残件 | C155: 23405 | D155: =MID(RC[-3],3,1) -> 4 | E155: 1 | F155: 7 | G155: 0 | H155: 1 | I155: 700 | J155: 0 | K155: 0 | L155: 0 | N155: 23405 | O155: 集齐60个可以合成一件橙品套装护腕：大地庇护。 | P155: 999999 | Q155: 1 | R155: 1 | S155: 0 | X155: 50 | AA155: 1 | AF155: UI_taozhuang_chengse1
A156: 11421 | B156: 圣光权杖残件 | C156: 20406 | D156: =MID(RC[-3],3,1) -> 4 | E156: 1 | F156: 7 | G156: 0 | H156: 1 | I156: 650 | J156: 0 | K156: 0 | L156: 0 | N156: 20406 | O156: 集齐60个可以合成一件橙品套装武器：圣光权杖。 | P156: 999999 | Q156: 1 | R156: 1 | S156: 0 | AA156: 1 | AF156: UI_taozhuang_chengse1
A157: 11422 | B157: 熔岩盔甲残件 | C157: 21407 | D157: =MID(RC[-3],3,1) -> 4 | E157: 1 | F157: 7 | G157: 0 | H157: 1 | I157: 675 | J157: 0 | K157: 0 | L157: 0 | N157: 21407 | O157: 集齐60个可以合成一件橙品套装衣服：熔岩盔甲。 | P157: 999999 | Q157: 1 | R157: 1 | S157: 0 | AA157: 1 | AF157: UI_taozhuang_chengse1
A158: 11423 | B158: 苍鹰长靴残件 | C158: 22408 | D158: =MID(RC[-3],3,1) -> 4 | E158: 1 | F158: 7 | G158: 0 | H158: 1 | I158: 650 | J158: 0 | K158: 0 | L158: 0 | N158: 22408 | O158: 集齐60个可以合成一件橙品套装鞋子：苍鹰长靴。 | P158: 999999 | Q158: 1 | R158: 1 | S158: 0 | AA158: 1 | AF158: UI_taozhuang_chengse1
A159: 11424 | B159: 熔岩法杖残件 | C159: 20407 | D159: =MID(RC[-3],3,1) -> 4 | E159: 1 | F159: 7 | G159: 0 | H159: 1 | I159: 675 | J159: 0 | K159: 0 | L159: 0 | N159: 20407 | O159: 集齐60个可以合成一件橙品套装武器：熔岩法杖。 | P159: 999999 | Q159: 1 | R159: 1 | S159: 0 | AA159: 1 | AF159: UI_taozhuang_chengse1
A160: 11425 | B160: 苍鹰护甲残件 | C160: 21408 | D160: =MID(RC[-3],3,1) -> 4 | E160: 1 | F160: 7 | G160: 0 | H160: 1 | I160: 650 | J160: 0 | K160: 0 | L160: 0 | N160: 21408 | O160: 集齐60个可以合成一件橙品套装衣服：苍鹰护甲。 | P160: 999999 | Q160: 1 | R160: 1 | S160: 0 | AA160: 1 | AF160: UI_taozhuang_chengse1
A161: 11426 | B161: 圣光护臂残件 | C161: 23406 | D161: =MID(RC[-3],3,1) -> 4 | E161: 1 | F161: 7 | G161: 0 | H161: 1 | I161: 650 | J161: 0 | K161: 0 | L161: 0 | N161: 23406 | O161: 集齐60个可以合成一件橙品套装护腕：圣光护臂。 | P161: 999999 | Q161: 1 | R161: 1 | S161: 0 | AA161: 1 | AF161: UI_taozhuang_chengse1
A162: 11427 | B162: 苍鹰魔珠残件 | C162: 20408 | D162: =MID(RC[-3],3,1) -> 4 | E162: 1 | F162: 7 | G162: 0 | H162: 1 | I162: 650 | J162: 0 | K162: 0 | L162: 0 | N162: 20408 | O162: 集齐60个可以合成一件橙品套装武器：苍鹰魔珠。 | P162: 999999 | Q162: 1 | R162: 1 | S162: 0 | AA162: 1 | AF162: UI_taozhuang_chengse1
A163: 11428 | B163: 圣光战靴残件 | C163: 22406 | D163: =MID(RC[-3],3,1) -> 4 | E163: 1 | F163: 7 | G163: 0 | H163: 1 | I163: 650 | J163: 0 | K163: 0 | L163: 0 | N163: 22406 | O163: 集齐60个可以合成一件橙品套装鞋子：圣光战靴。 | P163: 999999 | Q163: 1 | R163: 1 | S163: 0 | AA163: 1 | AF163: UI_taozhuang_chengse1
A164: 11429 | B164: 熔岩护臂残件 | C164: 23407 | D164: =MID(RC[-3],3,1) -> 4 | E164: 1 | F164: 7 | G164: 0 | H164: 1 | I164: 675 | J164: 0 | K164: 0 | L164: 0 | N164: 23407 | O164: 集齐60个可以合成一件橙品套装护腕：熔岩护臂。 | P164: 999999 | Q164: 1 | R164: 1 | S164: 0 | AA164: 1 | AF164: UI_taozhuang_chengse1
A165: 11430 | B165: 圣光战甲残件 | C165: 21406 | D165: =MID(RC[-3],3,1) -> 4 | E165: 1 | F165: 7 | G165: 0 | H165: 1 | I165: 650 | J165: 0 | K165: 0 | L165: 0 | N165: 21406 | O165: 集齐60个可以合成一件橙品套装衣服：圣光战甲。 | P165: 999999 | Q165: 1 | R165: 1 | S165: 0 | AA165: 1 | AF165: UI_taozhuang_chengse1
A166: 11431 | B166: 熔岩布靴残件 | C166: 22407 | D166: =MID(RC[-3],3,1) -> 4 | E166: 1 | F166: 7 | G166: 0 | H166: 1 | I166: 675 | J166: 0 | K166: 0 | L166: 0 | N166: 22407 | O166: 集齐60个可以合成一件橙品套装鞋子：熔岩布靴。 | P166: 999999 | Q166: 1 | R166: 1 | S166: 0 | AA166: 1 | AF166: UI_taozhuang_chengse1
A167: 11432 | B167: 苍鹰护臂残件 | C167: 23408 | D167: =MID(RC[-3],3,1) -> 4 | E167: 1 | F167: 7 | G167: 0 | H167: 1 | I167: 650 | J167: 0 | K167: 0 | L167: 0 | N167: 23408 | O167: 集齐60个可以合成一件橙品套装护腕：苍鹰护臂。 | P167: 999999 | Q167: 1 | R167: 1 | S167: 0 | AA167: 1 | AF167: UI_taozhuang_chengse1
A168: 11499 | B168: 堕落魔甲残件 | C168: 21400 | D168: =MID(RC[-3],3,1) -> 4 | E168: 1 | F168: 7 | G168: 0 | H168: 1 | I168: 375 | J168: 0 | K168: 0 | L168: 0 | N168: 21400 | O168: 集齐60个可以合成一件橙品套装衣服：堕落魔甲。 | P168: 999999 | Q168: 1 | R168: 1 | S168: 0 | AA168: 1
A169: 11501 | B169: 神圣复仇残件 | C169: 20501 | D169: =MID(RC[-3],3,1) -> 5 | E169: 1 | F169: 7 | G169: 0 | H169: 1 | I169: 1000 | J169: 0 | K169: 0 | L169: 0 | N169: 20501 | O169: 集齐80个可以合成一件红品武器：神圣复仇。 | P169: 999999 | Q169: 1 | R169: 1 | S169: 0 | AA169: 1
A170: 11502 | B170: 地狱哀歌残件 | C170: 21501 | D170: =MID(RC[-3],3,1) -> 5 | E170: 1 | F170: 7 | G170: 0 | H170: 1 | I170: 1000 | J170: 0 | K170: 0 | L170: 0 | N170: 21501 | O170: 集齐80个可以合成一件红品衣服：地狱哀歌。 | P170: 999999 | Q170: 1 | R170: 1 | S170: 0 | AA170: 1
A171: 11503 | B171: 贯穿苍穹残件 | C171: 22501 | D171: =MID(RC[-3],3,1) -> 5 | E171: 1 | F171: 7 | G171: 0 | H171: 1 | I171: 1000 | J171: 0 | K171: 0 | L171: 0 | N171: 22501 | O171: 集齐80个可以合成一件红品鞋子：贯穿苍穹。 | P171: 999999 | Q171: 1 | R171: 1 | S171: 0 | AA171: 1
A172: 11504 | B172: 苍白正义残件 | C172: 23501 | D172: =MID(RC[-3],3,1) -> 5 | E172: 1 | F172: 7 | G172: 0 | H172: 1 | I172: 1000 | J172: 0 | K172: 0 | L172: 0 | N172: 23501 | O172: 集齐80个可以合成一件红品护腕：苍白正义。 | P172: 999999 | Q172: 1 | R172: 1 | S172: 0 | AA172: 1
A173: 11505 | B173: 永恒破碎残件 | C173: 20502 | D173: =MID(RC[-3],3,1) -> 5 | E173: 1 | F173: 7 | G173: 0 | H173: 1 | I173: 1250 | J173: 0 | K173: 0 | L173: 0 | N173: 20502 | O173: 集齐80个可以合成一件红品套装武器：永恒破碎。 | P173: 999999 | Q173: 1 | R173: 1 | S173: 0 | AA173: 1 | AF173: UI_taozhuang_hongse1
A174: 11506 | B174: 永恒虚无残件 | C174: 21502 | D174: =MID(RC[-3],3,1) -> 5 | E174: 1 | F174: 7 | G174: 0 | H174: 1 | I174: 1250 | J174: 0 | K174: 0 | L174: 0 | N174: 21502 | O174: 集齐80个可以合成一件红品套装衣服：永恒虚无。 | P174: 999999 | Q174: 1 | R174: 1 | S174: 0 | AA174: 1 | AF174: UI_taozhuang_hongse1
A175: 11507 | B175: 永恒时空残件 | C175: 22502 | D175: =MID(RC[-3],3,1) -> 5 | E175: 1 | F175: 7 | G175: 0 | H175: 1 | I175: 1250 | J175: 0 | K175: 0 | L175: 0 | N175: 22502 | O175: 集齐80个可以合成一件红品套装鞋子：永恒时空。 | P175: 999999 | Q175: 1 | R175: 1 | S175: 0 | AA175: 1 | AF175: UI_taozhuang_hongse1
A176: 11508 | B176: 永恒光辉残件 | C176: 23502 | D176: =MID(RC[-3],3,1) -> 5 | E176: 1 | F176: 7 | G176: 0 | H176: 1 | I176: 1250 | J176: 0 | K176: 0 | L176: 0 | N176: 23502 | O176: 集齐80个可以合成一件红品套装护腕：永恒光辉。 | P176: 999999 | Q176: 1 | R176: 1 | S176: 0 | AA176: 1 | AF176: UI_taozhuang_hongse1
A177: 11509 | B177: 巨擘之握残件 | C177: 20503 | D177: =MID(RC[-3],3,1) -> 5 | E177: 1 | F177: 7 | G177: 0 | H177: 1 | I177: 1000 | J177: 0 | K177: 0 | L177: 0 | N177: 20503 | O177: 集齐80个可以合成一件红品套装武器：巨擘之握。 | P177: 999999 | Q177: 1 | R177: 1 | S177: 0 | AA177: 1 | AF177: UI_taozhuang_hongse1
A178: 11510 | B178: 巨擘怒吼残件 | C178: 21503 | D178: =MID(RC[-3],3,1) -> 5 | E178: 1 | F178: 7 | G178: 0 | H178: 1 | I178: 1000 | J178: 0 | K178: 0 | L178: 0 | N178: 21503 | O178: 集齐80个可以合成一件红品套装衣服：巨擘怒吼。 | P178: 999999 | Q178: 1 | R178: 1 | S178: 0 | AA178: 1 | AF178: UI_taozhuang_hongse1
A179: 11511 | B179: 巨擘践踏残件 | C179: 22503 | D179: =MID(RC[-3],3,1) -> 5 | E179: 1 | F179: 7 | G179: 0 | H179: 1 | I179: 1000 | J179: 0 | K179: 0 | L179: 0 | N179: 22503 | O179: 集齐80个可以合成一件红品套装鞋子：巨擘践踏。 | P179: 999999 | Q179: 1 | R179: 1 | S179: 0 | AA179: 1 | AF179: UI_taozhuang_hongse1
A180: 11512 | B180: 巨擘守护残件 | C180: 23503 | D180: =MID(RC[-3],3,1) -> 5 | E180: 1 | F180: 7 | G180: 0 | H180: 1 | I180: 1000 | J180: 0 | K180: 0 | L180: 0 | N180: 23503 | O180: 集齐80个可以合成一件红品套装护腕：巨擘守护。 | P180: 999999 | Q180: 1 | R180: 1 | S180: 0 | AA180: 1 | AF180: UI_taozhuang_hongse1
A181: 11513 | B181: 抹杀领域残件 | C181: 20504 | D181: =MID(RC[-3],3,1) -> 5 | E181: 1 | F181: 7 | G181: 0 | H181: 1 | I181: 1125 | J181: 0 | K181: 0 | L181: 0 | N181: 20504 | O181: 集齐80个可以合成一件红品套装武器：抹杀领域。 | P181: 999999 | Q181: 1 | R181: 1 | S181: 0 | AA181: 1 | AF181: UI_taozhuang_hongse1
A182: 11514 | B182: 噩梦领域残件 | C182: 21504 | D182: =MID(RC[-3],3,1) -> 5 | E182: 1 | F182: 7 | G182: 0 | H182: 1 | I182: 1125 | J182: 0 | K182: 0 | L182: 0 | N182: 21504 | O182: 集齐80个可以合成一件红品套装衣服：噩梦领域。 | P182: 999999 | Q182: 1 | R182: 1 | S182: 0 | AA182: 1 | AF182: UI_taozhuang_hongse1
A183: 11515 | B183: 禁锢领域残件 | C183: 22504 | D183: =MID(RC[-3],3,1) -> 5 | E183: 1 | F183: 7 | G183: 0 | H183: 1 | I183: 1125 | J183: 0 | K183: 0 | L183: 0 | N183: 22504 | O183: 集齐80个可以合成一件红品套装鞋子：禁锢领域。 | P183: 999999 | Q183: 1 | R183: 1 | S183: 0 | AA183: 1 | AF183: UI_taozhuang_hongse1
A184: 11516 | B184: 封魔领域残件 | C184: 23504 | D184: =MID(RC[-3],3,1) -> 5 | E184: 1 | F184: 7 | G184: 0 | H184: 1 | I184: 1125 | J184: 0 | K184: 0 | L184: 0 | N184: 23504 | O184: 集齐80个可以合成一件红品套装护腕：封魔领域。 | P184: 999999 | Q184: 1 | R184: 1 | S184: 0 | AA184: 1 | AF184: UI_taozhuang_hongse1
A185: 11517 | B185: 盖亚之力残件 | C185: 20505 | D185: =MID(RC[-3],3,1) -> 5 | E185: 1 | F185: 7 | G185: 0 | H185: 1 | I185: 1000 | J185: 0 | K185: 0 | L185: 0 | N185: 20505 | O185: 集齐80个可以合成一件红品套装武器：盖亚之力。 | P185: 999999 | Q185: 1 | R185: 1 | S185: 0 | AA185: 1 | AF185: UI_taozhuang_hongse1
A186: 11518 | B186: 盖亚守护残件 | C186: 21505 | D186: =MID(RC[-3],3,1) -> 5 | E186: 1 | F186: 7 | G186: 0 | H186: 1 | I186: 1000 | J186: 0 | K186: 0 | L186: 0 | N186: 21505 | O186: 集齐80个可以合成一件红品套装衣服：盖亚守护。 | P186: 999999 | Q186: 1 | R186: 1 | S186: 0 | AA186: 1 | AF186: UI_taozhuang_hongse1
A187: 11519 | B187: 盖亚能量残件 | C187: 22505 | D187: =MID(RC[-3],3,1) -> 5 | E187: 1 | F187: 7 | G187: 0 | H187: 1 | I187: 1000 | J187: 0 | K187: 0 | L187: 0 | N187: 22505 | O187: 集齐80个可以合成一件红品套装鞋子：盖亚能量。 | P187: 999999 | Q187: 1 | R187: 1 | S187: 0 | AA187: 1 | AF187: UI_taozhuang_hongse1
A188: 11520 | B188: 盖亚庇佑残件 | C188: 23505 | D188: =MID(RC[-3],3,1) -> 5 | E188: 1 | F188: 7 | G188: 0 | H188: 1 | I188: 1000 | J188: 0 | K188: 0 | L188: 0 | N188: 23505 | O188: 集齐80个可以合成一件红品套装护腕：盖亚庇佑。 | P188: 999999 | Q188: 1 | R188: 1 | S188: 0 | AA188: 1 | AF188: UI_taozhuang_hongse1
A189: 11996 | B189: 屠龙宝刀残件 | C189: 20599 | D189: 5 | E189: 1 | F189: 7 | G189: 0 | H189: 1 | I189: 9999 | J189: 0 | K189: 0 | L189: 0 | N189: 20599 | O189: 点击即送！ | P189: 999999 | Q189: 1 | R189: 1 | S189: 0 | AA189: 1
A190: 11997 | B190: 屠龙宝甲残件 | C190: 21599 | D190: 5 | E190: 1 | F190: 7 | G190: 0 | H190: 1 | I190: 9999 | J190: 0 | K190: 0 | L190: 0 | N190: 21599 | O190: 点击即送！ | P190: 999999 | Q190: 1 | R190: 1 | S190: 0 | AA190: 1
A191: 11998 | B191: 屠龙宝靴残件 | C191: 22599 | D191: 5 | E191: 1 | F191: 7 | G191: 0 | H191: 1 | I191: 9999 | J191: 0 | K191: 0 | L191: 0 | N191: 22599 | O191: 点击即送！ | P191: 999999 | Q191: 1 | R191: 1 | S191: 0 | AA191: 1
A192: 11999 | B192: 屠龙宝镯残件 | C192: 23599 | D192: 5 | E192: 1 | F192: 7 | G192: 0 | H192: 1 | I192: 9999 | J192: 0 | K192: 0 | L192: 0 | N192: 23599 | O192: 点击即送！ | P192: 999999 | Q192: 1 | R192: 1 | S192: 0 | AA192: 1
A193: 12986 | B193: 刀锋战士碎片 | C193: 30993 | D193: =MID(RC[-3],3,1) -> 9 | E193: 1 | F193: 8 | G193: 0 | H193: 1 | I193: 1 | J193: 0 | K193: 0 | L193: 0 | N193: 30993 | O193: 英雄的灵魂结晶碎片，集齐666个可以合成资质99的金品英雄：刀锋战士。 | P193: 999999 | Q193: 1 | R193: 1 | S193: 0 | AA193: 1
A194: 12987 | B194: 蜘蛛侠碎片 | C194: 30994 | D194: =MID(RC[-3],3,1) -> 9 | E194: 1 | F194: 8 | G194: 0 | H194: 1 | I194: 1 | J194: 0 | K194: 0 | L194: 0 | N194: 30994 | O194: 英雄的灵魂结晶碎片，集齐666个可以合成资质99的金品英雄：蜘蛛侠。 | P194: 999999 | Q194: 1 | R194: 1 | S194: 0 | AA194: 1
A195: 12988 | B195: 闪电侠碎片 | C195: 30995 | D195: =MID(RC[-3],3,1) -> 9 | E195: 1 | F195: 8 | G195: 0 | H195: 1 | I195: 1 | J195: 0 | K195: 0 | L195: 0 | N195: 30995 | O195: 英雄的灵魂结晶碎片，集齐666个可以合成资质99的金品英雄：闪电侠。 | P195: 999999 | Q195: 1 | R195: 1 | S195: 0 | AA195: 1
A196: 12989 | B196: 绿灯侠碎片 | C196: 30996 | D196: =MID(RC[-3],3,1) -> 9 | E196: 1 | F196: 8 | G196: 0 | H196: 1 | I196: 1 | J196: 0 | K196: 0 | L196: 0 | N196: 30996 | O196: 英雄的灵魂结晶碎片，集齐666个可以合成资质99的金品英雄：绿灯侠。 | P196: 999999 | Q196: 1 | R196: 1 | S196: 0 | AA196: 1
A197: 12990 | B197: 惩罚者碎片 | C197: 30997 | D197: =MID(RC[-3],3,1) -> 9 | E197: 1 | F197: 8 | G197: 0 | H197: 1 | I197: 1 | J197: 0 | K197: 0 | L197: 0 | N197: 30997 | O197: 英雄的灵魂结晶碎片，集齐666个可以合成资质99的金品英雄：惩罚者。 | P197: 999999 | Q197: 1 | R197: 1 | S197: 0 | AA197: 1
A198: 12991 | B198: 虫族之心碎片 | C198: 32997 | D198: =MID(RC[-3],3,1) -> 9 | E198: 1 | F198: 8 | G198: 0 | H198: 1 | I198: 1 | J198: 0 | K198: 0 | L198: 0 | N198: 32997 | O198: 英雄的灵魂结晶碎片，集齐666个可以合成资质99的金品英雄：虫族之心。 | P198: 999999 | Q198: 1 | R198: 1 | S198: 0 | AA198: 1
A199: 12992 | B199: 黑手碎片 | C199: 32998 | D199: =MID(RC[-3],3,1) -> 9 | E199: 1 | F199: 8 | G199: 0 | H199: 1 | I199: 1 | J199: 0 | K199: 0 | L199: 0 | N199: 32998 | O199: 英雄的灵魂结晶碎片，集齐666个可以合成资质99的金品英雄：黑手。 | P199: 999999 | Q199: 1 | R199: 1 | S199: 0 | AA199: 1
A200: 12993 | B200: 红骨碌碎片 | C200: 30998 | D200: =MID(RC[-3],3,1) -> 9 | E200: 1 | F200: 8 | G200: 0 | H200: 1 | I200: 1 | J200: 0 | K200: 0 | L200: 0 | N200: 30998 | O200: 英雄的灵魂结晶碎片，集齐666个可以合成资质99的金品英雄：红骨碌。 | P200: 999999 | Q200: 1 | R200: 1 | S200: 0 | AA200: 1
A201: 12994 | B201: 四屌碎片 | C201: 30999 | D201: =MID(RC[-3],3,1) -> 9 | E201: 1 | F201: 8 | G201: 0 | H201: 1 | I201: 1 | J201: 0 | K201: 0 | L201: 0 | N201: 30999 | O201: 英雄的灵魂结晶碎片，集齐666个可以合成资质99的金品英雄：四屌。 | P201: 999999 | Q201: 1 | R201: 1 | S201: 0 | AA201: 1
A202: 12995 | B202: 独屌碎片 | C202: 31999 | D202: =MID(RC[-3],3,1) -> 9 | E202: 1 | F202: 8 | G202: 0 | H202: 1 | I202: 1 | J202: 0 | K202: 0 | L202: 0 | N202: 31999 | O202: 英雄的灵魂结晶碎片，集齐666个可以合成资质99的金品英雄：独屌。 | P202: 999999 | Q202: 1 | R202: 1 | S202: 0 | AA202: 1
A203: 12996 | B203: 三屌碎片 | C203: 32999 | D203: =MID(RC[-3],3,1) -> 9 | E203: 1 | F203: 8 | G203: 0 | H203: 1 | I203: 1 | J203: 0 | K203: 0 | L203: 0 | N203: 32999 | O203: 英雄的灵魂结晶碎片，集齐666个可以合成资质99的金品英雄：三屌。 | P203: 999999 | Q203: 1 | R203: 1 | S203: 0 | AA203: 1
A204: 12997 | B204: 战争泰坦碎片 | C204: 33998 | D204: =MID(RC[-3],3,1) -> 9 | E204: 1 | F204: 8 | G204: 0 | H204: 1 | I204: 1 | J204: 0 | K204: 0 | L204: 0 | N204: 33998 | O204: 英雄的灵魂结晶碎片，集齐666个可以合成资质99的金品英雄：战争泰坦。 | P204: 999999 | Q204: 1 | R204: 1 | S204: 0 | AA204: 1
A205: 12998 | B205: 大地泰坦碎片 | C205: 33999 | D205: =MID(RC[-3],3,1) -> 9 | E205: 1 | F205: 8 | G205: 0 | H205: 1 | I205: 1 | J205: 0 | K205: 0 | L205: 0 | N205: 33999 | O205: 英雄的灵魂结晶碎片，集齐666个可以合成资质99的金品英雄：大地泰坦。 | P205: 999999 | Q205: 1 | R205: 1 | S205: 0 | AA205: 1
A206: 12999 | B206: 金鱼佬广广碎片 | C206: 39999 | D206: =MID(RC[-3],3,1) -> 9 | E206: 1 | F206: 8 | G206: 0 | H206: 1 | I206: 1 | J206: 0 | K206: 0 | L206: 0 | N206: 39999 | O206: 英雄的灵魂结晶碎片，集齐666个可以合成资质99的金品英雄：金鱼佬广广。 | P206: 999999 | Q206: 1 | R206: 1 | S206: 0 | AA206: 1
A207: 12200 | B207: 精英特警碎片 | C207: 30300 | D207: =MID(RC[-3],3,1) -> 2 | E207: 1 | F207: 8 | G207: 0 | H207: 1 | I207: 2 | J207: 0 | K207: 0 | L207: 0 | N207: 30200 | O207: 英雄的灵魂结晶碎片，集齐20个可以合成资质5的蓝品英雄：精英特警。 | P207: 999999 | Q207: 1 | R207: 1 | S207: 0 | AA207: 1
A208: 12201 | B208: 战争机甲碎片 | C208: 30310 | D208: =MID(RC[-3],3,1) -> 2 | E208: 1 | F208: 8 | G208: 0 | H208: 1 | I208: 2 | J208: 0 | K208: 0 | L208: 0 | N208: 30210 | O208: 英雄的灵魂结晶碎片，集齐20个可以合成资质5的蓝品英雄：战争机甲。 | P208: 999999 | Q208: 1 | R208: 1 | S208: 0 | AA208: 1
A209: 12202 | B209: 激光Ⅲ型机碎片 | C209: 30320 | D209: =MID(RC[-3],3,1) -> 2 | E209: 1 | F209: 8 | G209: 0 | H209: 1 | I209: 2 | J209: 0 | K209: 0 | L209: 0 | N209: 30220 | O209: 英雄的灵魂结晶碎片，集齐20个可以合成资质5的蓝品英雄：激光Ⅲ型机。 | P209: 999999 | Q209: 1 | R209: 1 | S209: 0 | AA209: 1
A210: 12203 | B210: 炮火Ⅲ型机碎片 | C210: 30330 | D210: =MID(RC[-3],3,1) -> 2 | E210: 1 | F210: 8 | G210: 0 | H210: 1 | I210: 2 | J210: 0 | K210: 0 | L210: 0 | N210: 30230 | O210: 英雄的灵魂结晶碎片，集齐20个可以合成资质5的蓝品英雄：炮火Ⅲ型机。 | P210: 999999 | Q210: 1 | R210: 1 | S210: 0 | AA210: 1
A211: 12204 | B211: 精英护士碎片 | C211: 30340 | D211: =MID(RC[-3],3,1) -> 2 | E211: 1 | F211: 8 | G211: 0 | H211: 1 | I211: 2 | J211: 0 | K211: 0 | L211: 0 | N211: 30240 | O211: 英雄的灵魂结晶碎片，集齐20个可以合成资质5的蓝品英雄：精英护士。 | P211: 999999 | Q211: 1 | R211: 1 | S211: 0 | AA211: 1
A212: 12300 | B212: 王牌特警碎片 | C212: 30300 | D212: =MID(RC[-3],3,1) -> 3 | E212: 1 | F212: 8 | G212: 0 | H212: 1 | I212: 10 | J212: 0 | K212: 0 | L212: 0 | N212: 30300 | O212: 英雄的灵魂结晶碎片，集齐40个可以合成资质10的紫品英雄：王牌特警。 | P212: 999999 | Q212: 1 | R212: 1 | S212: 0 | X212: 11|26 | AA212: 1
A213: 12301 | B213: 新星机甲碎片 | C213: 30310 | D213: =MID(RC[-3],3,1) -> 3 | E213: 1 | F213: 8 | G213: 0 | H213: 1 | I213: 10 | J213: 0 | K213: 0 | L213: 0 | N213: 30310 | O213: 英雄的灵魂结晶碎片，集齐40个可以合成资质10的紫品英雄：新星机甲。 | P213: 999999 | Q213: 1 | R213: 1 | S213: 0 | X213: 11|26 | AA213: 1
A214: 12302 | B214: 激光智能机碎片 | C214: 30320 | D214: =MID(RC[-3],3,1) -> 3 | E214: 1 | F214: 8 | G214: 0 | H214: 1 | I214: 10 | J214: 0 | K214: 0 | L214: 0 | N214: 30320 | O214: 英雄的灵魂结晶碎片，集齐40个可以合成资质10的紫品英雄：激光智能机。 | P214: 999999 | Q214: 1 | R214: 1 | S214: 0 | X214: 11|26 | AA214: 1
A215: 12303 | B215: 炮火智能机碎片 | C215: 30330 | D215: =MID(RC[-3],3,1) -> 3 | E215: 1 | F215: 8 | G215: 0 | H215: 1 | I215: 10 | J215: 0 | K215: 0 | L215: 0 | N215: 30330 | O215: 英雄的灵魂结晶碎片，集齐40个可以合成资质10的紫品英雄：炮火智能机。 | P215: 999999 | Q215: 1 | R215: 1 | S215: 0 | X215: 11|26 | AA215: 1
A216: 12304 | B216: 白衣天使碎片 | C216: 30340 | D216: =MID(RC[-3],3,1) -> 3 | E216: 1 | F216: 8 | G216: 0 | H216: 1 | I216: 10 | J216: 0 | K216: 0 | L216: 0 | N216: 30340 | O216: 英雄的灵魂结晶碎片，集齐40个可以合成资质10的紫品英雄：白衣天使。 | P216: 999999 | Q216: 1 | R216: 1 | S216: 0 | X216: 11|26 | AA216: 1
A217: 12305 | B217: 超级队长碎片 | C217: 30301 | D217: =MID(RC[-3],3,1) -> 3 | E217: 1 | F217: 8 | G217: 0 | H217: 1 | I217: 11 | J217: 0 | K217: 0 | L217: 0 | N217: 30301 | O217: 英雄的灵魂结晶碎片，集齐40个可以合成资质12的紫品英雄：超级队长。 | P217: 999999 | Q217: 1 | R217: 1 | S217: 0 | X217: 11|26 | AA217: 1
A218: 12306 | B218: 死亡武士碎片 | C218: 30302 | D218: =MID(RC[-3],3,1) -> 3 | E218: 1 | F218: 8 | G218: 0 | H218: 1 | I218: 11 | J218: 0 | K218: 0 | L218: 0 | N218: 30302 | O218: 英雄的灵魂结晶碎片，集齐40个可以合成资质12的紫品英雄：死亡武士。 | P218: 999999 | Q218: 1 | R218: 1 | S218: 0 | X218: 11|26 | AA218: 1
A219: 12400 | B219: 红颅鬼碎片 | C219: 30430 | D219: =MID(RC[-3],3,1) -> 4 | E219: 1 | F219: 8 | G219: 0 | H219: 1 | I219: 15 | J219: 0 | K219: 0 | L219: 0 | N219: 30430 | O219: 英雄的灵魂结晶碎片，集齐80个可以合成资质20的橙品英雄：红颅鬼。 | P219: 999999 | Q219: 1 | R219: 1 | S219: 0 | X219: 11 | AA219: 1
A220: 12401 | B220: 终极队长碎片 | C220: 30400 | D220: =MID(RC[-3],3,1) -> 4 | E220: 1 | F220: 8 | G220: 0 | H220: 1 | I220: 15 | J220: 0 | K220: 0 | L220: 0 | N220: 30400 | O220: 英雄的灵魂结晶碎片，集齐80个可以合成资质20的橙品英雄：终极队长。 | P220: 999999 | Q220: 1 | R220: 1 | S220: 0 | X220: 11 | AA220: 1
A221: 12402 | B221: 雷神碎片 | C221: 30431 | D221: =MID(RC[-3],3,1) -> 4 | E221: 1 | F221: 8 | G221: 0 | H221: 1 | I221: 15 | J221: 0 | K221: 0 | L221: 0 | N221: 30431 | O221: 英雄的灵魂结晶碎片，集齐80个可以合成资质20的橙品英雄：雷神。 | P221: 999999 | Q221: 1 | R221: 1 | S221: 0 | X221: 11|30 | AA221: 1
A222: 12403 | B222: 野蛮巨人碎片 | C222: 30410 | D222: =MID(RC[-3],3,1) -> 4 | E222: 1 | F222: 8 | G222: 0 | H222: 1 | I222: 15 | J222: 0 | K222: 0 | L222: 0 | N222: 30410 | O222: 英雄的灵魂结晶碎片，集齐80个可以合成资质20的橙品英雄：野蛮巨人。 | P222: 999999 | Q222: 1 | R222: 1 | S222: 0 | X222: 11|34 | AA222: 1
A223: 12404 | B223: 致命特工碎片 | C223: 30401 | D223: =MID(RC[-3],3,1) -> 4 | E223: 1 | F223: 8 | G223: 0 | H223: 1 | I223: 15 | J223: 0 | K223: 0 | L223: 0 | N223: 30401 | O223: 英雄的灵魂结晶碎片，集齐80个可以合成资质20的橙品英雄：致命特工。 | P223: 999999 | Q223: 1 | R223: 1 | S223: 0 | X223: 11|30 | AA223: 1
A224: 12405 | B224: 鹰眸碎片 | C224: 30420 | D224: =MID(RC[-3],3,1) -> 4 | E224: 1 | F224: 8 | G224: 0 | H224: 1 | I224: 15 | J224: 0 | K224: 0 | L224: 0 | N224: 30420 | O224: 英雄的灵魂结晶碎片，集齐80个可以合成资质20的橙品英雄：鹰眸。 | P224: 999999 | Q224: 1 | R224: 1 | S224: 0 | X224: 11|34 | AA224: 1
A225: 12406 | B225: 刀锋猎人碎片 | C225: 30402 | D225: =MID(RC[-3],3,1) -> 4 | E225: 1 | F225: 8 | G225: 0 | H225: 1 | I225: 15 | J225: 0 | K225: 0 | L225: 0 | N225: 30402 | O225: 英雄的灵魂结晶碎片，集齐80个可以合成资质20的橙品英雄：刀锋猎人。 | P225: 999999 | Q225: 1 | R225: 1 | S225: 0 | X225: 11|30 | AA225: 1
A226: 12407 | B226: 地狱骑士碎片 | C226: 30403 | D226: =MID(RC[-3],3,1) -> 4 | E226: 1 | F226: 8 | G226: 0 | H226: 1 | I226: 15 | J226: 0 | K226: 0 | L226: 0 | N226: 30403 | O226: 英雄的灵魂结晶碎片，集齐80个可以合成资质20的橙品英雄：地狱骑士。 | P226: 999999 | Q226: 1 | R226: 1 | S226: 0 | X226: 11|34 | AA226: 1
A227: 12408 | B227: 铁人碎片 | C227: 30428 | D227: =MID(RC[-3],3,1) -> 4 | E227: 1 | F227: 8 | G227: 0 | H227: 1 | I227: 20 | J227: 0 | K227: 0 | L227: 0 | N227: 30428 | O227: 英雄的灵魂结晶碎片，集齐80个可以合成资质25的橙品英雄：铁人。 | P227: 999999 | Q227: 1 | R227: 1 | S227: 0 | X227: 11|69 | AA227: 1
A228: 12409 | B228: 树人碎片 | C228: 30411 | D228: =MID(RC[-3],3,1) -> 4 | E228: 1 | F228: 8 | G228: 0 | H228: 1 | I228: 15 | J228: 0 | K228: 0 | L228: 0 | N228: 30411 | O228: 英雄的灵魂结晶碎片，集齐80个可以合成资质20的橙品英雄：树人。 | P228: 999999 | Q228: 1 | R228: 1 | S228: 0 | X228: 11|26 | AA228: 1
A229: 12410 | B229: 超凡博士碎片 | C229: 30438 | D229: =MID(RC[-3],3,1) -> 4 | E229: 1 | F229: 8 | G229: 0 | H229: 1 | I229: 20 | J229: 0 | K229: 0 | L229: 0 | N229: 30438 | O229: 英雄的灵魂结晶碎片，集齐80个可以合成资质25的橙品英雄：超凡博士。 | P229: 999999 | Q229: 1 | R229: 1 | S229: 0 | X229: 11|69 | AA229: 1
A230: 12411 | B230: 白凤凰碎片 | C230: 30440 | D230: =MID(RC[-3],3,1) -> 4 | E230: 1 | F230: 8 | G230: 0 | H230: 1 | I230: 15 | J230: 0 | K230: 0 | L230: 0 | N230: 30440 | O230: 英雄的灵魂结晶碎片，集齐80个可以合成资质20的橙品英雄：白凤凰。 | P230: 999999 | Q230: 1 | R230: 1 | S230: 0 | X230: 11|26 | AA230: 1
A231: 12412 | B231: 地狱铁拳碎片 | C231: 30429 | D231: =MID(RC[-3],3,1) -> 4 | E231: 1 | F231: 8 | G231: 0 | H231: 1 | I231: 20 | J231: 0 | K231: 0 | L231: 0 | N231: 30429 | O231: 英雄的灵魂结晶碎片，集齐80个可以合成资质25的橙品英雄：地狱铁拳。 | P231: 999999 | Q231: 1 | R231: 1 | S231: 0 | X231: 11|26 | AA231: 1
A232: 12413 | B232: 混沌女巫碎片 | C232: 30449 | D232: =MID(RC[-3],3,1) -> 4 | E232: 1 | F232: 8 | G232: 0 | H232: 1 | I232: 20 | J232: 0 | K232: 0 | L232: 0 | N232: 30449 | O232: 英雄的灵魂结晶碎片，集齐80个可以合成资质25的橙品英雄：混沌女巫。 | P232: 999999 | Q232: 1 | R232: 1 | S232: 0 | X232: 11|26 | AA232: 1
A233: 12500 | B233: 黑暗骑士碎片 | C233: 30520 | D233: =MID(RC[-3],3,1) -> 5 | E233: 1 | F233: 8 | G233: 0 | H233: 1 | I233: 25 | J233: 0 | K233: 0 | L233: 0 | N233: 30520 | O233: 英雄的灵魂结晶碎片，集齐160个可以合成资质35的红品英雄：黑暗骑士。 | P233: 999999 | Q233: 1 | R233: 1 | S233: 0 | AA233: 1
A234: 12501 | B234: 狼叔碎片 | C234: 30500 | D234: =MID(RC[-3],3,1) -> 5 | E234: 1 | F234: 8 | G234: 0 | H234: 1 | I234: 25 | J234: 0 | K234: 0 | L234: 0 | N234: 30500 | O234: 英雄的灵魂结晶碎片，集齐160个可以合成资质35的红品英雄：狼叔。 | P234: 999999 | Q234: 1 | R234: 1 | S234: 0 | AA234: 1
A235: 12502 | B235: 吸血鬼猎人碎片 | C235: 30501 | D235: =MID(RC[-3],3,1) -> 5 | E235: 1 | F235: 8 | G235: 0 | H235: 1 | I235: 25 | J235: 0 | K235: 0 | L235: 0 | N235: 30501 | O235: 英雄的灵魂结晶碎片，集齐160个可以合成资质35的红品英雄：吸血鬼猎人。 | P235: 999999 | Q235: 1 | R235: 1 | S235: 0 | AA235: 1
A236: 12503 | B236: 小蜘蛛碎片 | C236: 30521 | D236: =MID(RC[-3],3,1) -> 5 | E236: 1 | F236: 8 | G236: 0 | H236: 1 | I236: 30 | J236: 0 | K236: 0 | L236: 0 | N236: 30521 | O236: 英雄的灵魂结晶碎片，集齐160个可以合成资质40的红品英雄：小蜘蛛。 | P236: 999999 | Q236: 1 | R236: 1 | S236: 0 | AA236: 1
A237: 12230 | B237: 百胜者碎片 | C237: 31300 | D237: =MID(RC[-3],3,1) -> 2 | E237: 1 | F237: 8 | G237: 0 | H237: 1 | I237: 2 | J237: 0 | K237: 0 | L237: 0 | N237: 31200 | O237: 英雄的灵魂结晶碎片，集齐20个可以合成资质5的蓝品英雄：百胜者。 | P237: 999999 | Q237: 1 | R237: 1 | S237: 0 | AA237: 1
A238: 12231 | B238: 盔甲武士碎片 | C238: 31310 | D238: =MID(RC[-3],3,1) -> 2 | E238: 1 | F238: 8 | G238: 0 | H238: 1 | I238: 2 | J238: 0 | K238: 0 | L238: 0 | N238: 31210 | O238: 英雄的灵魂结晶碎片，集齐20个可以合成资质5的蓝品英雄：盔甲武士。 | P238: 999999 | Q238: 1 | R238: 1 | S238: 0 | AA238: 1
A239: 12232 | B239: 弓弩刺客碎片 | C239: 31320 | D239: =MID(RC[-3],3,1) -> 2 | E239: 1 | F239: 8 | G239: 0 | H239: 1 | I239: 2 | J239: 0 | K239: 0 | L239: 0 | N239: 31220 | O239: 英雄的灵魂结晶碎片，集齐20个可以合成资质5的蓝品英雄：弓弩刺客。 | P239: 999999 | Q239: 1 | R239: 1 | S239: 0 | AA239: 1
A240: 12233 | B240: 黑魔导师碎片 | C240: 31330 | D240: =MID(RC[-3],3,1) -> 2 | E240: 1 | F240: 8 | G240: 0 | H240: 1 | I240: 2 | J240: 0 | K240: 0 | L240: 0 | N240: 31230 | O240: 英雄的灵魂结晶碎片，集齐20个可以合成资质5的蓝品英雄：黑魔导师。 | P240: 999999 | Q240: 1 | R240: 1 | S240: 0 | AA240: 1
A241: 12234 | B241: 光明牧师碎片 | C241: 31340 | D241: =MID(RC[-3],3,1) -> 2 | E241: 1 | F241: 8 | G241: 0 | H241: 1 | I241: 2 | J241: 0 | K241: 0 | L241: 0 | N241: 31240 | O241: 英雄的灵魂结晶碎片，集齐20个可以合成资质5的蓝品英雄：光明牧师。 | P241: 999999 | Q241: 1 | R241: 1 | S241: 0 | AA241: 1
A242: 12330 | B242: 角斗之王碎片 | C242: 31300 | D242: =MID(RC[-3],3,1) -> 3 | E242: 1 | F242: 8 | G242: 0 | H242: 1 | I242: 10 | J242: 0 | K242: 0 | L242: 0 | N242: 31300 | O242: 英雄的灵魂结晶碎片，集齐40个可以合成资质10的紫品英雄：角斗之王。 | P242: 999999 | Q242: 1 | R242: 1 | S242: 0 | X242: 11|26 | AA242: 1
A243: 12331 | B243: 重甲武士碎片 | C243: 31310 | D243: =MID(RC[-3],3,1) -> 3 | E243: 1 | F243: 8 | G243: 0 | H243: 1 | I243: 10 | J243: 0 | K243: 0 | L243: 0 | N243: 31310 | O243: 英雄的灵魂结晶碎片，集齐40个可以合成资质10的紫品英雄：重甲武士。 | P243: 999999 | Q243: 1 | R243: 1 | S243: 0 | X243: 11|26 | AA243: 1
A244: 12332 | B244: 阴影行者碎片 | C244: 31320 | D244: =MID(RC[-3],3,1) -> 3 | E244: 1 | F244: 8 | G244: 0 | H244: 1 | I244: 10 | J244: 0 | K244: 0 | L244: 0 | N244: 31320 | O244: 英雄的灵魂结晶碎片，集齐40个可以合成资质10的紫品英雄：阴影行者。 | P244: 999999 | Q244: 1 | R244: 1 | S244: 0 | X244: 11|26 | AA244: 1
A245: 12333 | B245: 黑暗之手碎片 | C245: 31330 | D245: =MID(RC[-3],3,1) -> 3 | E245: 1 | F245: 8 | G245: 0 | H245: 1 | I245: 10 | J245: 0 | K245: 0 | L245: 0 | N245: 31330 | O245: 英雄的灵魂结晶碎片，集齐40个可以合成资质10的紫品英雄：黑暗之手。 | P245: 999999 | Q245: 1 | R245: 1 | S245: 0 | X245: 11|26 | AA245: 1
A246: 12334 | B246: 光明主教碎片 | C246: 31340 | D246: =MID(RC[-3],3,1) -> 3 | E246: 1 | F246: 8 | G246: 0 | H246: 1 | I246: 10 | J246: 0 | K246: 0 | L246: 0 | N246: 31340 | O246: 英雄的灵魂结晶碎片，集齐40个可以合成资质10的紫品英雄：光明主教。 | P246: 999999 | Q246: 1 | R246: 1 | S246: 0 | X246: 11|26 | AA246: 1
A247: 12335 | B247: 杰克船长碎片 | C247: 31301 | D247: =MID(RC[-3],3,1) -> 3 | E247: 1 | F247: 8 | G247: 0 | H247: 1 | I247: 11 | J247: 0 | K247: 0 | L247: 0 | N247: 31301 | O247: 英雄的灵魂结晶碎片，集齐40个可以合成资质12的紫品英雄：杰克船长。 | P247: 999999 | Q247: 1 | R247: 1 | S247: 0 | X247: 11|26 | AA247: 1
A248: 12336 | B248: 天使长碎片 | C248: 31341 | D248: =MID(RC[-3],3,1) -> 3 | E248: 1 | F248: 8 | G248: 0 | H248: 1 | I248: 11 | J248: 0 | K248: 0 | L248: 0 | N248: 31341 | O248: 英雄的灵魂结晶碎片，集齐40个可以合成资质12的紫品英雄：天使长。 | P248: 999999 | Q248: 1 | R248: 1 | S248: 0 | X248: 11|26 | AA248: 1
A249: 12337 | B249: 万圣节之影碎片 | C249: 31309 | D249: =MID(RC[-3],3,1) -> 3 | E249: 1 | F249: 8 | G249: 0 | H249: 1 | I249: 10 | J249: 0 | K249: 0 | L249: 0 | N249: 31309 | O249: 英雄的灵魂结晶碎片，集齐40个可以合成资质12的紫品英雄：南古瓜伯爵。 | P249: 999999 | Q249: 1 | R249: 1 | S249: 0 | AA249: 1
A250: 12430 | B250: 独眼巨人碎片 | C250: 31400 | D250: =MID(RC[-3],3,1) -> 4 | E250: 1 | F250: 8 | G250: 0 | H250: 1 | I250: 15 | J250: 0 | K250: 0 | L250: 0 | N250: 31400 | O250: 英雄的灵魂结晶碎片，集齐80个可以合成资质20的橙品英雄：独眼巨人。 | P250: 999999 | Q250: 1 | R250: 1 | S250: 0 | X250: 11 | AA250: 1
A251: 12431 | B251: 圣女贞德碎片 | C251: 31440 | D251: =MID(RC[-3],3,1) -> 4 | E251: 1 | F251: 8 | G251: 0 | H251: 1 | I251: 15 | J251: 0 | K251: 0 | L251: 0 | N251: 31440 | O251: 英雄的灵魂结晶碎片，集齐80个可以合成资质20的橙品英雄：圣女贞德。 | P251: 999999 | Q251: 1 | R251: 1 | S251: 0 | X251: 11 | AA251: 1
A252: 12432 | B252: 美杜莎碎片 | C252: 31430 | D252: =MID(RC[-3],3,1) -> 4 | E252: 1 | F252: 8 | G252: 0 | H252: 1 | I252: 15 | J252: 0 | K252: 0 | L252: 0 | N252: 31430 | O252: 英雄的灵魂结晶碎片，集齐80个可以合成资质20的橙品英雄：美杜莎。 | P252: 999999 | Q252: 1 | R252: 1 | S252: 0 | X252: 11|30 | AA252: 1
A253: 12433 | B253: 德古拉伯爵碎片 | C253: 31401 | D253: =MID(RC[-3],3,1) -> 4 | E253: 1 | F253: 8 | G253: 0 | H253: 1 | I253: 15 | J253: 0 | K253: 0 | L253: 0 | N253: 31401 | O253: 英雄的灵魂结晶碎片，集齐80个可以合成资质20的橙品英雄：德古拉伯爵。 | P253: 999999 | Q253: 1 | R253: 1 | S253: 0 | X253: 11|34 | AA253: 1
A254: 12434 | B254: 狩猎女神碎片 | C254: 31431 | D254: =MID(RC[-3],3,1) -> 4 | E254: 1 | F254: 8 | G254: 0 | H254: 1 | I254: 15 | J254: 0 | K254: 0 | L254: 0 | N254: 31431 | O254: 英雄的灵魂结晶碎片，集齐80个可以合成资质20的橙品英雄：狩猎女神。 | P254: 999999 | Q254: 1 | R254: 1 | S254: 0 | X254: 11|30 | AA254: 1
A255: 12435 | B255: 查理大帝碎片 | C255: 31402 | D255: =MID(RC[-3],3,1) -> 4 | E255: 1 | F255: 8 | G255: 0 | H255: 1 | I255: 15 | J255: 0 | K255: 0 | L255: 0 | N255: 31402 | O255: 英雄的灵魂结晶碎片，集齐80个可以合成资质20的橙品英雄：查理大帝。 | P255: 999999 | Q255: 1 | R255: 1 | S255: 0 | X255: 11|34 | AA255: 1
A256: 12436 | B256: 佐罗碎片 | C256: 31403 | D256: =MID(RC[-3],3,1) -> 4 | E256: 1 | F256: 8 | G256: 0 | H256: 1 | I256: 15 | J256: 0 | K256: 0 | L256: 0 | N256: 31403 | O256: 英雄的灵魂结晶碎片，集齐80个可以合成资质20的橙品英雄：佐罗。 | P256: 999999 | Q256: 1 | R256: 1 | S256: 0 | X256: 11|30 | AA256: 1
A257: 12437 | B257: 亚马逊女王碎片 | C257: 31420 | D257: =MID(RC[-3],3,1) -> 4 | E257: 1 | F257: 8 | G257: 0 | H257: 1 | I257: 15 | J257: 0 | K257: 0 | L257: 0 | N257: 31420 | O257: 英雄的灵魂结晶碎片，集齐80个可以合成资质20的橙品英雄：亚马逊女王。 | P257: 999999 | Q257: 1 | R257: 1 | S257: 0 | X257: 11|34 | AA257: 1
A258: 12438 | B258: 宙斯碎片 | C258: 31438 | D258: =MID(RC[-3],3,1) -> 4 | E258: 1 | F258: 8 | G258: 0 | H258: 1 | I258: 20 | J258: 0 | K258: 0 | L258: 0 | N258: 31438 | O258: 英雄的灵魂结晶碎片，集齐80个可以合成资质25的橙品英雄：宙斯。 | P258: 999999 | Q258: 1 | R258: 1 | S258: 0 | X258: 11|69 | AA258: 1
A259: 12439 | B259: 斯巴达碎片 | C259: 31410 | D259: =MID(RC[-3],3,1) -> 4 | E259: 1 | F259: 8 | G259: 0 | H259: 1 | I259: 15 | J259: 0 | K259: 0 | L259: 0 | N259: 31410 | O259: 英雄的灵魂结晶碎片，集齐80个可以合成资质20的橙品英雄：斯巴达。 | P259: 999999 | Q259: 1 | R259: 1 | S259: 0 | X259: 11|26 | AA259: 1
A260: 12440 | B260: 阿努比斯碎片 | C260: 31408 | D260: =MID(RC[-3],3,1) -> 4 | E260: 1 | F260: 8 | G260: 0 | H260: 1 | I260: 20 | J260: 0 | K260: 0 | L260: 0 | N260: 31408 | O260: 英雄的灵魂结晶碎片，集齐80个可以合成资质25的橙品英雄：阿努比斯。 | P260: 999999 | Q260: 1 | R260: 1 | S260: 0 | X260: 11|69 | AA260: 1
A261: 12441 | B261: 雅典娜碎片 | C261: 31441 | D261: =MID(RC[-3],3,1) -> 4 | E261: 1 | F261: 8 | G261: 0 | H261: 1 | I261: 15 | J261: 0 | K261: 0 | L261: 0 | N261: 31441 | O261: 英雄的灵魂结晶碎片，集齐80个可以合成资质20的橙品英雄：雅典娜。 | P261: 999999 | Q261: 1 | R261: 1 | S261: 0 | X261: 11|26 | AA261: 1
A262: 12442 | B262: 大力神碎片 | C262: 31419 | D262: =MID(RC[-3],3,1) -> 4 | E262: 1 | F262: 8 | G262: 0 | H262: 1 | I262: 20 | J262: 0 | K262: 0 | L262: 0 | N262: 31419 | O262: 英雄的灵魂结晶碎片，集齐80个可以合成资质25的橙品英雄：大力神。 | P262: 999999 | Q262: 1 | R262: 1 | S262: 0 | X262: 11|26 | AA262: 1
A263: 12443 | B263: 冥王哈迪斯碎片 | C263: 31439 | D263: =MID(RC[-3],3,1) -> 4 | E263: 1 | F263: 8 | G263: 0 | H263: 1 | I263: 20 | J263: 0 | K263: 0 | L263: 0 | N263: 31439 | O263: 英雄的灵魂结晶碎片，集齐80个可以合成资质25的橙品英雄：冥王哈迪斯。 | P263: 999999 | Q263: 1 | R263: 1 | S263: 0 | X263: 11|26 | AA263: 1
A264: 12530 | B264: 潘多拉碎片 | C264: 31530 | D264: =MID(RC[-3],3,1) -> 5 | E264: 1 | F264: 8 | G264: 0 | H264: 1 | I264: 25 | J264: 0 | K264: 0 | L264: 0 | N264: 31530 | O264: 英雄的灵魂结晶碎片，集齐160个可以合成资质35的红品英雄：潘多拉。 | P264: 999999 | Q264: 1 | R264: 1 | S264: 0 | AA264: 1
A265: 12531 | B265: 奎爷碎片 | C265: 31500 | D265: =MID(RC[-3],3,1) -> 5 | E265: 1 | F265: 8 | G265: 0 | H265: 1 | I265: 25 | J265: 0 | K265: 0 | L265: 0 | N265: 31500 | O265: 英雄的灵魂结晶碎片，集齐160个可以合成资质35的红品英雄：奎爷。 | P265: 999999 | Q265: 1 | R265: 1 | S265: 0 | AA265: 1
A266: 12532 | B266: 贞德碎片 | C266: 31540 | D266: =MID(RC[-3],3,1) -> 5 | E266: 1 | F266: 8 | G266: 0 | H266: 1 | I266: 22 | J266: 0 | K266: 0 | L266: 0 | N266: 31540 | O266: 英雄的灵魂结晶碎片，集齐160个可以合成资质30的红品英雄：贞德。 | P266: 999999 | Q266: 1 | R266: 1 | S266: 0 | AA266: 1
A267: 12260 | B267: 地精大盗碎片 | C267: 32300 | D267: =MID(RC[-3],3,1) -> 2 | E267: 1 | F267: 8 | G267: 0 | H267: 1 | I267: 2 | J267: 0 | K267: 0 | L267: 0 | N267: 32200 | O267: 英雄的灵魂结晶碎片，集齐20个可以合成资质5的蓝品英雄：地精大盗。 | P267: 999999 | Q267: 1 | R267: 1 | S267: 0 | AA267: 1
A268: 12261 | B268: 骷髅勇士碎片 | C268: 32310 | D268: =MID(RC[-3],3,1) -> 2 | E268: 1 | F268: 8 | G268: 0 | H268: 1 | I268: 2 | J268: 0 | K268: 0 | L268: 0 | N268: 32210 | O268: 英雄的灵魂结晶碎片，集齐20个可以合成资质5的蓝品英雄：骷髅勇士。 | P268: 999999 | Q268: 1 | R268: 1 | S268: 0 | AA268: 1
A269: 12262 | B269: 精英火枪手碎片 | C269: 32320 | D269: =MID(RC[-3],3,1) -> 2 | E269: 1 | F269: 8 | G269: 0 | H269: 1 | I269: 2 | J269: 0 | K269: 0 | L269: 0 | N269: 32220 | O269: 英雄的灵魂结晶碎片，集齐20个可以合成资质5的蓝品英雄：精英火枪手。 | P269: 999999 | Q269: 1 | R269: 1 | S269: 0 | AA269: 1
A270: 12263 | B270: 海元素长老碎片 | C270: 32330 | D270: =MID(RC[-3],3,1) -> 2 | E270: 1 | F270: 8 | G270: 0 | H270: 1 | I270: 2 | J270: 0 | K270: 0 | L270: 0 | N270: 32230 | O270: 英雄的灵魂结晶碎片，集齐20个可以合成资质5的蓝品英雄：海元素长老。 | P270: 999999 | Q270: 1 | R270: 1 | S270: 0 | AA270: 1
A271: 12264 | B271: 水元素长老碎片 | C271: 32340 | D271: =MID(RC[-3],3,1) -> 2 | E271: 1 | F271: 8 | G271: 0 | H271: 1 | I271: 2 | J271: 0 | K271: 0 | L271: 0 | N271: 32240 | O271: 英雄的灵魂结晶碎片，集齐20个可以合成资质5的蓝品英雄：水元素长老。 | P271: 999999 | Q271: 1 | R271: 1 | S271: 0 | AA271: 1
A272: 12360 | B272: 窃神者碎片 | C272: 32300 | D272: =MID(RC[-3],3,1) -> 3 | E272: 1 | F272: 8 | G272: 0 | H272: 1 | I272: 10 | J272: 0 | K272: 0 | L272: 0 | N272: 32300 | O272: 英雄的灵魂结晶碎片，集齐40个可以合成资质10的紫品英雄：窃神者。 | P272: 999999 | Q272: 1 | R272: 1 | S272: 0 | X272: 11|26 | AA272: 1
A273: 12361 | B273: 骷髅王碎片 | C273: 32310 | D273: =MID(RC[-3],3,1) -> 3 | E273: 1 | F273: 8 | G273: 0 | H273: 1 | I273: 10 | J273: 0 | K273: 0 | L273: 0 | N273: 32310 | O273: 英雄的灵魂结晶碎片，集齐40个可以合成资质10的紫品英雄：骷髅王。 | P273: 999999 | Q273: 1 | R273: 1 | S273: 0 | X273: 11|26 | AA273: 1
A274: 12362 | B274: 火枪之王碎片 | C274: 32320 | D274: =MID(RC[-3],3,1) -> 3 | E274: 1 | F274: 8 | G274: 0 | H274: 1 | I274: 10 | J274: 0 | K274: 0 | L274: 0 | N274: 32320 | O274: 英雄的灵魂结晶碎片，集齐40个可以合成资质10的紫品英雄：火枪之王。 | P274: 999999 | Q274: 1 | R274: 1 | S274: 0 | X274: 11|26 | AA274: 1
A275: 12363 | B275: 海元素领主碎片 | C275: 32330 | D275: =MID(RC[-3],3,1) -> 3 | E275: 1 | F275: 8 | G275: 0 | H275: 1 | I275: 10 | J275: 0 | K275: 0 | L275: 0 | N275: 32330 | O275: 英雄的灵魂结晶碎片，集齐40个可以合成资质10的紫品英雄：海元素领主。 | P275: 999999 | Q275: 1 | R275: 1 | S275: 0 | X275: 11|26 | AA275: 1
A276: 12364 | B276: 水元素领主碎片 | C276: 32340 | D276: =MID(RC[-3],3,1) -> 3 | E276: 1 | F276: 8 | G276: 0 | H276: 1 | I276: 10 | J276: 0 | K276: 0 | L276: 0 | N276: 32340 | O276: 英雄的灵魂结晶碎片，集齐40个可以合成资质10的紫品英雄：水元素领主。 | P276: 999999 | Q276: 1 | R276: 1 | S276: 0 | X276: 11|26 | AA276: 1
A277: 12365 | B277: 石头人碎片 | C277: 32311 | D277: =MID(RC[-3],3,1) -> 3 | E277: 1 | F277: 8 | G277: 0 | H277: 1 | I277: 11 | J277: 0 | K277: 0 | L277: 0 | N277: 32311 | O277: 英雄的灵魂结晶碎片，集齐40个可以合成资质12的紫品英雄：石头人。 | P277: 999999 | Q277: 1 | R277: 1 | S277: 0 | X277: 11|26 | AA277: 1
A278: 12366 | B278: 血源牧师碎片 | C278: 32341 | D278: =MID(RC[-3],3,1) -> 3 | E278: 1 | F278: 8 | G278: 0 | H278: 1 | I278: 11 | J278: 0 | K278: 0 | L278: 0 | N278: 32341 | O278: 英雄的灵魂结晶碎片，集齐40个可以合成资质12的紫品英雄：血源牧师。 | P278: 999999 | Q278: 1 | R278: 1 | S278: 0 | X278: 11|26 | AA278: 1
A279: 12460 | B279: 憎恶碎片 | C279: 32410 | D279: =MID(RC[-3],3,1) -> 4 | E279: 1 | F279: 8 | G279: 0 | H279: 1 | I279: 15 | J279: 0 | K279: 0 | L279: 0 | N279: 32410 | O279: 英雄的灵魂结晶碎片，集齐80个可以合成资质20的橙品英雄：憎恶。 | P279: 999999 | Q279: 1 | R279: 1 | S279: 0 | X279: 11 | AA279: 1
A280: 12461 | B280: 树精碎片 | C280: 32411 | D280: =MID(RC[-3],3,1) -> 4 | E280: 1 | F280: 8 | G280: 0 | H280: 1 | I280: 15 | J280: 0 | K280: 0 | L280: 0 | N280: 32411 | O280: 英雄的灵魂结晶碎片，集齐80个可以合成资质20的橙品英雄：树精。 | P280: 999999 | Q280: 1 | R280: 1 | S280: 0 | X280: 11 | AA280: 1
A281: 12462 | B281: 牛头人碎片 | C281: 32400 | D281: =MID(RC[-3],3,1) -> 4 | E281: 1 | F281: 8 | G281: 0 | H281: 1 | I281: 15 | J281: 0 | K281: 0 | L281: 0 | N281: 32400 | O281: 英雄的灵魂结晶碎片，集齐80个可以合成资质20的橙品英雄：牛头人。 | P281: 999999 | Q281: 1 | R281: 1 | S281: 0 | X281: 11|30 | AA281: 1
A282: 12463 | B282: 火女碎片 | C282: 32430 | D282: =MID(RC[-3],3,1) -> 4 | E282: 1 | F282: 8 | G282: 0 | H282: 1 | I282: 15 | J282: 0 | K282: 0 | L282: 0 | N282: 32430 | O282: 英雄的灵魂结晶碎片，集齐80个可以合成资质20的橙品英雄：火女。 | P282: 999999 | Q282: 1 | R282: 1 | S282: 0 | X282: 11|34 | AA282: 1
A283: 12464 | B283: 半人马碎片 | C283: 32401 | D283: =MID(RC[-3],3,1) -> 4 | E283: 1 | F283: 8 | G283: 0 | H283: 1 | I283: 15 | J283: 0 | K283: 0 | L283: 0 | N283: 32401 | O283: 英雄的灵魂结晶碎片，集齐80个可以合成资质20的橙品英雄：半人马。 | P283: 999999 | Q283: 1 | R283: 1 | S283: 0 | X283: 11|30 | AA283: 1
A284: 12465 | B284: 食人魔碎片 | C284: 32431 | D284: =MID(RC[-3],3,1) -> 4 | E284: 1 | F284: 8 | G284: 0 | H284: 1 | I284: 15 | J284: 0 | K284: 0 | L284: 0 | N284: 32431 | O284: 英雄的灵魂结晶碎片，集齐80个可以合成资质20的橙品英雄：食人魔。 | P284: 999999 | Q284: 1 | R284: 1 | S284: 0 | X284: 11|34 | AA284: 1
A285: 12466 | B285: 基伦碎片 | C285: 32402 | D285: =MID(RC[-3],3,1) -> 4 | E285: 1 | F285: 8 | G285: 0 | H285: 1 | I285: 15 | J285: 0 | K285: 0 | L285: 0 | N285: 32402 | O285: 英雄的灵魂结晶碎片，集齐80个可以合成资质20的橙品英雄：基伦。 | P285: 999999 | Q285: 1 | R285: 1 | S285: 0 | X285: 11|30 | AA285: 1
A286: 12467 | B286: 女警碎片 | C286: 32420 | D286: =MID(RC[-3],3,1) -> 4 | E286: 1 | F286: 8 | G286: 0 | H286: 1 | I286: 15 | J286: 0 | K286: 0 | L286: 0 | N286: 32420 | O286: 英雄的灵魂结晶碎片，集齐80个可以合成资质20的橙品英雄：女警。 | P286: 999999 | Q286: 1 | R286: 1 | S286: 0 | X286: 11|34 | AA286: 1
A287: 12468 | B287: 小黑碎片 | C287: 32428 | D287: =MID(RC[-3],3,1) -> 4 | E287: 1 | F287: 8 | G287: 0 | H287: 1 | I287: 20 | J287: 0 | K287: 0 | L287: 0 | N287: 32428 | O287: 英雄的灵魂结晶碎片，集齐80个可以合成资质25的橙品英雄：小黑。 | P287: 999999 | Q287: 1 | R287: 1 | S287: 0 | X287: 11|69 | AA287: 1
A288: 12469 | B288: 熊阿宝碎片 | C288: 32412 | D288: =MID(RC[-3],3,1) -> 4 | E288: 1 | F288: 8 | G288: 0 | H288: 1 | I288: 15 | J288: 0 | K288: 0 | L288: 0 | N288: 32412 | O288: 英雄的灵魂结晶碎片，集齐80个可以合成资质20的橙品英雄：熊阿宝。 | P288: 999999 | Q288: 1 | R288: 1 | S288: 0 | X288: 11|26 | AA288: 1
A289: 12470 | B289: 血色指挥官碎片 | C289: 32408 | D289: =MID(RC[-3],3,1) -> 4 | E289: 1 | F289: 8 | G289: 0 | H289: 1 | I289: 20 | J289: 0 | K289: 0 | L289: 0 | N289: 32408 | O289: 英雄的灵魂结晶碎片，集齐80个可以合成资质25的橙品英雄：血色指挥官。 | P289: 999999 | Q289: 1 | R289: 1 | S289: 0 | X289: 11|69 | AA289: 1
A290: 12471 | B290: 大检察官碎片 | C290: 32440 | D290: =MID(RC[-3],3,1) -> 4 | E290: 1 | F290: 8 | G290: 0 | H290: 1 | I290: 15 | J290: 0 | K290: 0 | L290: 0 | N290: 32440 | O290: 英雄的灵魂结晶碎片，集齐80个可以合成资质20的橙品英雄：大检察官。 | P290: 999999 | Q290: 1 | R290: 1 | S290: 0 | X290: 11|26 | AA290: 1
A291: 12472 | B291: 恶魔猎手碎片 | C291: 32409 | D291: =MID(RC[-3],3,1) -> 4 | E291: 1 | F291: 8 | G291: 0 | H291: 1 | I291: 20 | J291: 0 | K291: 0 | L291: 0 | N291: 32409 | O291: 英雄的灵魂结晶碎片，集齐80个可以合成资质25的橙品英雄：恶魔猎手。 | P291: 999999 | Q291: 1 | R291: 1 | S291: 0 | X291: 11|26 | AA291: 1
A292: 12473 | B292: 神圣牧师碎片 | C292: 32449 | D292: =MID(RC[-3],3,1) -> 4 | E292: 1 | F292: 8 | G292: 0 | H292: 1 | I292: 20 | J292: 0 | K292: 0 | L292: 0 | N292: 32449 | O292: 英雄的灵魂结晶碎片，集齐80个可以合成资质25的橙品英雄：神圣牧师。 | P292: 999999 | Q292: 1 | R292: 1 | S292: 0 | X292: 11|26 | AA292: 1
A293: 12560 | B293: 巫妖之王碎片 | C293: 32500 | D293: =MID(RC[-3],3,1) -> 5 | E293: 1 | F293: 8 | G293: 0 | H293: 1 | I293: 25 | J293: 0 | K293: 0 | L293: 0 | N293: 32500 | O293: 英雄的灵魂结晶碎片，集齐160个可以合成资质35的红品英雄：巫妖之王。 | P293: 999999 | Q293: 1 | R293: 1 | S293: 0 | AA293: 1
A294: 12561 | B294: 钢铁酋长碎片 | C294: 32510 | D294: =MID(RC[-3],3,1) -> 5 | E294: 1 | F294: 8 | G294: 0 | H294: 1 | I294: 25 | J294: 0 | K294: 0 | L294: 0 | N294: 32510 | O294: 英雄的灵魂结晶碎片，集齐160个可以合成资质35的红品英雄：钢铁酋长。 | P294: 999999 | Q294: 1 | R294: 1 | S294: 0 | AA294: 1
A295: 13001 | B295: 蓝品装备碎片箱 | C295: 13020 | D295: 2 | E295: 2 | F295: 1 | G295: 1 | H295: 1 | I295: 10 | J295: 0 | K295: 0 | L295: 0 | N295: 0 | O295: 充满惊喜的宝箱，使用后获得随机1~3个蓝品装备碎片。 | P295: 999999 | Q295: 7 | R295: 0 | S295: 0 | T295: 11201|11202|11203|11204 | U295: 1|1|1|1 | V295: 3|3|3|3 | W295: 1|1|1|1 | AH295: 1 | AI295: 1
A296: 13002 | B296: 紫品装备碎片箱 | C296: 13020 | D296: 3 | E296: 2 | F296: 1 | G296: 1 | H296: 1 | I296: 10 | J296: 0 | K296: 0 | L296: 0 | N296: 0 | O296: 充满惊喜的宝箱，使用后获得随机1~3个紫品装备碎片。 | P296: 999999 | Q296: 7 | R296: 0 | S296: 0 | T296: 11301|11302|11303|11304|11305|11306|11307|11308 | U296: 1|1|1|1|1|1|1|1 | V296: 3|3|3|3|3|3|3|3 | W296: 1|1|1|1|1|1|1|1 | AH296: 1 | AI296: 1
A297: 13003 | B297: 橙品装备碎片箱 | C297: 13020 | D297: 4 | E297: 2 | F297: 1 | G297: 1 | H297: 1 | I297: 10 | J297: 0 | K297: 0 | L297: 0 | N297: 0 | O297: 充满惊喜的宝箱，使用后获得随机1~3个橙品装备碎片。 | P297: 999999 | Q297: 7 | R297: 0 | S297: 0 | T297: 11401|11402|11403|11404|11405|11406|11407|11408 | U297: 1|1|1|1|1|1|1|1 | V297: 3|3|3|3|3|3|3|3 | W297: 1|1|1|1|1|1|1|1 | AH297: 1 | AI297: 1
A298: 13004 | B298: 超能英雄 | C298: 30 | D298: 3 | E298: 2 | F298: 1 | G298: 1 | H298: 1 | I298: 10 | J298: 0 | K298: 0 | L298: 1 | N298: 0 | O298: 获得一个超能阵营的紫品英雄。 | P298: 999999 | Q298: 1 | R298: 0 | S298: 0 | T298: 30300|30310|30320|30330|30340|30301|30302 | U298: 1|1|1|1|1|1|1 | V298: 1|1|1|1|1|1|1 | W298: 1|1|1|1|1|1|1 | AB298: 1 | AG298: 1
A299: 13005 | B299: 传说英雄 | C299: 31 | D299: 3 | E299: 2 | F299: 1 | G299: 1 | H299: 1 | I299: 10 | J299: 0 | K299: 0 | L299: 1 | N299: 0 | O299: 获得一个传说阵营的紫品英雄。 | P299: 999999 | Q299: 1 | R299: 0 | S299: 0 | T299: 31300|31310|31320|31330|31340|31301|31341 | U299: 1|1|1|1|1|1|1 | V299: 1|1|1|1|1|1|1 | W299: 1|1|1|1|1|1|1 | AB299: 1 | AG299: 1
A300: 13006 | B300: 幻想英雄 | C300: 32 | D300: 3 | E300: 2 | F300: 1 | G300: 1 | H300: 1 | I300: 10 | J300: 0 | K300: 0 | L300: 1 | N300: 0 | O300: 获得一个幻想阵营的紫品英雄。 | P300: 999999 | Q300: 1 | R300: 0 | S300: 0 | T300: 32300|32310|32320|32330|32340|32311|32341 | U300: 1|1|1|1|1|1|1 | V300: 1|1|1|1|1|1|1 | W300: 1|1|1|1|1|1|1 | AB300: 1 | AG300: 1
A301: 13007 | B301: 装备碎片箱 | C301: 13002 | D301: 4 | E301: 2 | F301: 1 | G301: 1 | H301: 1 | I301: 10 | J301: 0 | K301: 0 | L301: 0 | N301: 0 | O301: 充满惊喜的宝箱，使用获得1~3个装备碎片，最高可获得橙品装备碎片。 | P301: 999999 | Q301: 7 | R301: 0 | S301: 0 | T301: 11201|11202|11203|11204|11301|11302|11303|11304|11305|11306|11307|11308|11401|11402|11403|11404|11405|11406|11407|11408 | U301: 1|1|1|1|1|1|1|1|1|1|1|1|1|1|1|1|1|1|1|1|1|1|1|1|1|1|1|1|1|1|1|1|1|1|1|1|1|1|1|1 | V301: 3|3|3|3|3|3|3|3|3|3|3|3|3|3|3|3|3|3|3|3|3|3|3|3|3|3|3|3|3|3|3|3|3|3|3|3|3|3|3|3 | W301: 2|2|2|2|3|3|3|3|3|3|3|3|1|1|1|1|1|1|1|1 | AH301: 1 | AI301: 1
A302: 13008 | B302: 圣器碎片箱 | C302: 13002 | D302: 4 | E302: 2 | F302: 1 | G302: 1 | H302: 1 | I302: 10 | J302: 0 | K302: 0 | L302: 0 | N302: 0 | O302: 充满惊喜的宝箱，使用后获得随机圣器碎片，较大几率获得橙品圣器碎片。 | P302: 999999 | Q302: 13 | R302: 0 | S302: 0 | T302: 14201|14202|14203|14204|14205|14206|14207|14208|14209|14301|14302|14303|14304|14305|14306|14307|14308|14309|14310|14311|14312|14313|14314|14315|14316|14317|14318|14319|14320|14321|14322|14323|14324|14325|14326|14327|14328|14329|14330|14331|14332|14333|14334|14335|14336|14401|14402|14403|14404|14405|14406|14407|14408|14409|14410|14411|14412|14413|14414|14415|14416|14417|14418|14419|14420|14421|14422|14423|14424|14425|14426|14427|14428|14429|14430|14431|14432|14433|14434|14435|14436|14437|14438|14439|14440 | U302: 1|1|1|1|1|1|1|1|1|1|1|1|1|1|1|1|1|1|1|1|1|1|1|1|1|1|1|1|1|1|1|1|1|1|1|1|1|1|1|1|1|1|1|1|1|1|1|1|1|1|1|1|1|1|1|1|1|1|1|1|1|1|1|1|1|1|1|1|1|1|1|1|1|1|1|1|1|1|1|1|1|1|1|1|1 | V302: 1|1|1|1|1|1|1|1|1|1|1|1|1|1|1|1|1|1|1|1|1|1|1|1|1|1|1|1|1|1|1|1|1|1|1|1|1|1|1|1|1|1|1|1|1|1|1|1|1|1|1|1|1|1|1|1|1|1|1|1|1|1|1|1|1|1|1|1|1|1|1|1|1|1|1|1|1|1|1|1|1|1|1|1|1 | W302: 200|200|200|200|200|200|200|200|200|40|40|40|40|40|40|40|40|40|40|40|40|40|40|40|40|40|40|40|40|40|40|40|40|40|40|40|40|40|40|40|40|40|40|40|40|9|9|9|9|9|9|9|9|9|9|9|9|9|9|9|9|9|9|9|9|9|9|9|9|9|9|9|9|9|9|9|9|9|9|9|9|9|9|9|9 | AH302: 1 | AI302: 1
A303: 13009 | B303: 橙品圣器箱 | C303: 13002 | D303: 4 | E303: 2 | F303: 1 | G303: 1 | H303: 1 | I303: 10 | J303: 0 | K303: 0 | L303: 0 | N303: 0 | O303: 充满惊喜的宝箱，使用后获得一个随机橙品圣器。 | P303: 999999 | Q303: 13 | R303: 0 | S303: 0 | T303: 40401|40402|40403|40404|41401|41402|41403|41404 | U303: 1|1|1|1|1|1|1|1 | V303: 1|1|1|1|1|1|1|1 | W303: 1|1|1|1|1|1|1|1 | AD303: 1 | AG303: 1 | AH303: 1 | AI303: 1
A304: 13010 | B304: 紫品圣器箱 | C304: 13001 | D304: 3 | E304: 2 | F304: 1 | G304: 1 | H304: 1 | I304: 10 | J304: 0 | K304: 0 | L304: 0 | N304: 0 | O304: 充满惊喜的宝箱，使用后获得一个随机紫品圣器。 | P304: 999999 | Q304: 13 | R304: 0 | S304: 0 | T304: 40301|40302|40303|40304|41301|41302|41303|41304 | U304: 1|1|1|1|1|1|1|1 | V304: 1|1|1|1|1|1|1|1 | W304: 1|1|1|1|1|1|1|1 | AD304: 1 | AG304: 1 | AH304: 1 | AI304: 1
A305: 13011 | B305: 紫品随机英雄 | C305: 13030 | D305: 3 | E305: 2 | F305: 1 | G305: 1 | H305: 1 | I305: 10 | J305: 0 | K305: 0 | L305: 1 | N305: 0 | O305: 充满惊喜的宝箱，使用后获得一个随机紫品英雄。 | P305: 999999 | Q305: 1 | R305: 0 | S305: 0 | T305: 30300|30310|30320|30330|30340|30301|30302|31300|31310|31320|31330|31340|31301|31341|32300|32310|32320|32330|32340|32311|32341 | U305: 1|1|1|1|1|1|1|1|1|1|1|1|1|1|1|1|1|1|1|1|1 | V305: 1|1|1|1|1|1|1|1|1|1|1|1|1|1|1|1|1|1|1|1|1 | W305: 1|1|1|1|1|1|1|1|1|1|1|1|1|1|1|1|1|1 | AB305: 1 | AG305: 1
A306: 13012 | B306: 橙品随机英雄箱 | C306: 13030 | D306: 4 | E306: 2 | F306: 1 | G306: 1 | H306: 1 | I306: 10 | J306: 0 | K306: 0 | L306: 0 | N306: 0 | O306: 充满惊喜的宝箱，使用后获得一个20资质的橙品英雄。 | P306: 999999 | Q306: 1 | R306: 0 | S306: 0 | T306: 30430|30400|30431|30410|30401|30420|30402|30403|30411|30440|31400|31440|31430|31401|31431|31402|31403|31420|31410|31441|32410|32411|32400|32430|32401|32431|32402|32420|32412|32440 | U306: 1|1|1|1|1|1|1|1|1|1|1|1|1|1|1|1|1|1|1|1|1|1|1|1|1|1|1|1|1|1 | V306: 1|1|1|1|1|1|1|1|1|1|1|1|1|1|1|1|1|1|1|1|1|1|1|1|1|1|1|1|1|1 | W306: 1|1|1|1|1|1|1|1|1|1|1|1|1|1|1|1|1|1|1|1|1|1|1|1|1|1|1|1|1|1 | AB306: 1 | AG306: 1 | AH306: 1 | AI306: 1 | AK306: 30430 | AL306: =RC[-1] -> 30430
A307: 13013 | B307: 紫品随机英雄箱 | C307: 13030 | D307: 3 | E307: 2 | F307: 1 | G307: 1 | H307: 1 | I307: 10 | J307: 0 | K307: 0 | L307: 0 | N307: 0 | O307: 充满惊喜的宝箱，使用后获得一个随机紫品英雄。 | P307: 999999 | Q307: 1 | R307: 0 | S307: 0 | T307: 30300|30310|30320|30330|30340|30301|30302|31300|31310|31320|31330|31340|31301|31341|32300|32310|32320|32330|32340|32311|32341 | U307: 1|1|1|1|1|1|1|1|1|1|1|1|1|1|1|1|1|1|1|1|1 | V307: 1|1|1|1|1|1|1|1|1|1|1|1|1|1|1|1|1|1|1|1|1 | W307: 1|1|1|1|1|1|1|1|1|1|1|1|1|1|1|1|1|1 | AB307: 1 | AG307: 1 | AH307: 1 | AI307: 1 | AK307: 30400 | AL307: =R[-1]C&"|"&RC[-1] -> 30430|30400
A308: 13014 | B308: 橙品英雄碎片箱 | C308: 13030 | D308: 4 | E308: 2 | F308: 1 | G308: 1 | H308: 1 | I308: 10 | J308: 0 | K308: 0 | L308: 0 | N308: 0 | O308: 充满惊喜的宝箱，使用后获得随机一个橙品英雄碎片。 | P308: 999999 | Q308: 1 | R308: 0 | S308: 0 | T308: 12400|12401|12402|12403|12404|12405|12406|12407|12408|12409|12410|12411|12412|12413|12430|12431|12432|12433|12434|12435|12436|12437|12438|12439|12440|12441|12442|12443|12460|12461|12462|12463|12464|12465|12466|12467|12468|12469|12470|12471|12472|12473 | U308: 1|1|1|1|1|1|1|1|1|1|1|1|1|1|1|1|1|1|1|1|1|1|1|1|1|1|1|1|1|1|1|1|1|1|1|1|1|1|1|1|1|1 | V308: 1|1|1|1|1|1|1|1|1|1|1|1|1|1|1|1|1|1|1|1|1|1|1|1|1|1|1|1|1|1|1|1|1|1|1|1|1|1|1|1|1|1 | W308: 1|1|1|1|1|1|1|1|1|1|1|1|1|1|1|1|1|1|1|1|1|1|1|1|1|1|1|1|1|1|1|1|1|1|1|1|1|1|1|1|1|1 | AG308: 1 | AH308: 1 | AI308: 1 | AK308: 30431 | AL308: =R[-1]C&"|"&RC[-1] -> 30430|30400|30431
A309: 13015 | B309: 普通的觉醒箱 | C309: 13000 | D309: 1 | E309: 2 | F309: 1 | G309: 1 | H309: 1 | I309: 10 | J309: 0 | K309: 0 | L309: 0 | N309: 0 | O309: 充满惊喜的宝箱，使用后获得随机觉醒材料，最高可获得绿品材料。 | P309: 999999 | Q309: 45 | R309: 0 | S309: 0 | T309: 60001|60002|61001|61002|62001|62002|63001|63002|60101|60102|61101|61102|62101|62102|63101|63102 | U309: 1|1|1|1|1|1|1|1|1|1|1|1|1|1|1|1 | V309: =RC[-1] -> 1|1|1|1|1|1|1|1|1|1|1|1|1|1|1|1 | W309: 1|1|1|1|1|1|1|1|1|1|1|1|1|1|1|1 | AH309: 1 | AK309: 30410 | AL309: =R[-1]C&"|"&RC[-1] -> 30430|30400|30431|30410
A310: 13016 | B310: 精致的觉醒箱 | C310: 13000 | D310: 2 | E310: 2 | F310: 1 | G310: 1 | H310: 1 | I310: 10 | J310: 0 | K310: 0 | L310: 0 | N310: 0 | O310: 充满惊喜的宝箱，使用后获得随机觉醒材料，最高可获得蓝品材料。 | P310: 999999 | Q310: 45 | R310: 0 | S310: 0 | T310: 60001|60002|61001|61002|62001|62002|63001|63002|60101|60102|61101|61102|62101|62102|63101|63102|60201|60202|61201|61202|62201|62202|63201|63202 | U310: 1|1|1|1|1|1|1|1|1|1|1|1|1|1|1|1|1|1|1|1|1|1|1|1 | V310: =RC[-1] -> 1|1|1|1|1|1|1|1|1|1|1|1|1|1|1|1|1|1|1|1|1|1|1|1 | W310: 1|1|1|1|1|1|1|1|2|2|2|2|2|2|2|2|2|2|2|2|2|2|2|2 | AH310: 1 | AK310: 30401 | AL310: =R[-1]C&"|"&RC[-1] -> 30430|30400|30431|30410|30401
A311: 13017 | B311: 闪光的觉醒箱 | C311: 13001 | D311: 3 | E311: 2 | F311: 1 | G311: 1 | H311: 1 | I311: 10 | J311: 0 | K311: 0 | L311: 0 | N311: 0 | O311: 充满惊喜的宝箱，使用后获得随机觉醒材料，最高可获得紫品材料。 | P311: 999999 | Q311: 45 | R311: 0 | S311: 0 | T311: 60101|60102|61101|61102|62101|62102|63101|63102|60201|60202|61201|61202|62201|62202|63201|63202|60301|60302|61301|61302|62301|62302|63301|63302 | U311: 1|1|1|1|1|1|1|1|1|1|1|1|1|1|1|1|1|1|1|1|1|1|1|1 | V311: =RC[-1] -> 1|1|1|1|1|1|1|1|1|1|1|1|1|1|1|1|1|1|1|1|1|1|1|1 | W311: 3|3|3|3|3|3|3|3|4|4|4|4|4|4|4|4|3|3|3|3|3|3|3|3 | AH311: 1 | AK311: 30420 | AL311: =R[-1]C&"|"&RC[-1] -> 30430|30400|30431|30410|30401|30420
A312: 13018 | B312: 耀眼的觉醒箱 | C312: 13002 | D312: 4 | E312: 2 | F312: 1 | G312: 1 | H312: 1 | I312: 10 | J312: 0 | K312: 0 | L312: 0 | N312: 0 | O312: 充满惊喜的宝箱，使用后获得随机觉醒材料，最高可获得橙品材料。 | P312: 999999 | Q312: 45 | R312: 0 | S312: 0 | T312: 60101|60102|61101|61102|62101|62102|63101|63102|60201|60202|61201|61202|62201|62202|63201|63202|60301|60302|61301|61302|62301|62302|63301|63302|60401|60402|61401|61402|62401|62402|63401|63402 | U312: 1|1|1|1|1|1|1|1|1|1|1|1|1|1|1|1|1|1|1|1|1|1|1|1|1|1|1|1|1|1|1|1 | V312: =RC[-1] -> 1|1|1|1|1|1|1|1|1|1|1|1|1|1|1|1|1|1|1|1|1|1|1|1|1|1|1|1|1|1|1|1 | W312: 2|2|2|2|2|2|2|2|3|3|3|3|3|3|3|3|3|3|3|3|3|3|3|3|2|2|2|2|2|2|2|2 | AH312: 1 | AK312: 30402 | AL312: =R[-1]C&"|"&RC[-1] -> 30430|30400|30431|30410|30401|30420|30402
A313: 13019 | B313: 霸气的觉醒箱 | C313: 13003 | D313: 5 | E313: 2 | F313: 1 | G313: 1 | H313: 1 | I313: 10 | J313: 0 | K313: 0 | L313: 0 | N313: 0 | O313: 充满惊喜的宝箱，使用后获得随机觉醒材料，最高可获得红品材料。 | P313: 999999 | Q313: 45 | R313: 0 | S313: 0 | T313: 60201|60202|61201|61202|62201|62202|63201|63202|60301|60302|61301|61302|62301|62302|63301|63302|60401|60402|61401|61402|62401|62402|63401|63402|60501|60502|61501|61502|62501|62502|63501|63502 | U313: 1|1|1|1|1|1|1|1|1|1|1|1|1|1|1|1|1|1|1|1|1|1|1|1|1|1|1|1|1|1|1|1 | V313: =RC[-1] -> 1|1|1|1|1|1|1|1|1|1|1|1|1|1|1|1|1|1|1|1|1|1|1|1|1|1|1|1|1|1|1|1 | W313: 3|3|3|3|3|3|3|3|3|3|3|3|3|3|3|3|3|3|3|3|3|3|3|3|1|1|1|1|1|1|1|1 | AH313: 1 | AK313: 30403 | AL313: =R[-1]C&"|"&RC[-1] -> 30430|30400|30431|30410|30401|30420|30402|30403
A314: 13020 | B314: 橙品英雄箱 | C314: 13030 | D314: 4 | E314: 2 | F314: 1 | G314: 1 | H314: 1 | I314: 10 | J314: 0 | K314: 0 | L314: 1 | N314: 0 | O314: 充满惊喜的宝箱，使用后获得一个20资质的随机橙品英雄。 | P314: 999999 | Q314: 1 | R314: 0 | S314: 0 | T314: 30430|30400|30431|30410|30401|30420|30402|30403|30411|30440|31400|31440|31430|31401|31431|31402|31403|31420|31410|31441|32410|32411|32400|32430|32401|32431|32402|32420|32412|32440 | U314: 1|1|1|1|1|1|1|1|1|1|1|1|1|1|1|1|1|1|1|1|1|1|1|1|1|1|1|1|1|1 | V314: 1|1|1|1|1|1|1|1|1|1|1|1|1|1|1|1|1|1|1|1|1|1|1|1|1|1|1|1|1|1 | W314: 1|1|1|1|1|1|1|1|1|1|1|1|1|1|1|1|1|1|1|1|1|1|1|1|1|1|1|1|1|1 | AB314: 1 | AG314: 1 | AK314: 30411 | AL314: =R[-1]C&"|"&RC[-1] -> 30430|30400|30431|30410|30401|30420|30402|30403|30411
A315: 13021 | B315: 超能英雄 | C315: 30 | D315: 4 | E315: 2 | F315: 1 | G315: 1 | H315: 1 | I315: 10 | J315: 0 | K315: 0 | L315: 1 | N315: 0 | O315: 获得一个超能阵营的20资质橙品英雄。 | P315: 999999 | Q315: 1 | R315: 0 | S315: 0 | T315: 30430|30400|30431|30410|30401|30420|30402|30403|30411|30440 | U315: 1|1|1|1|1|1|1|1|1|1 | V315: 1|1|1|1|1|1|1|1|1|1 | W315: 1|1|1|1|1|1|1|1|1|1 | AB315: 1 | AG315: 1 | AK315: 30440 | AL315: =R[-1]C&"|"&RC[-1] -> 30430|30400|30431|30410|30401|30420|30402|30403|30411|30440
A316: 13022 | B316: 传说英雄 | C316: 31 | D316: 4 | E316: 2 | F316: 1 | G316: 1 | H316: 1 | I316: 10 | J316: 0 | K316: 0 | L316: 1 | N316: 0 | O316: 获得一个传说阵营的20资质橙品英雄。 | P316: 999999 | Q316: 1 | R316: 0 | S316: 0 | T316: 31400|31440|31430|31401|31431|31402|31403|31420|31410|31441 | U316: 1|1|1|1|1|1|1|1|1|1 | V316: 1|1|1|1|1|1|1|1|1|1 | W316: 1|1|1|1|1|1|1|1|1|1 | AB316: 1 | AG316: 1 | AK316: 31400 | AL316: =RC[-1] -> 31400
A317: 13023 | B317: 幻想英雄 | C317: 32 | D317: 4 | E317: 2 | F317: 1 | G317: 1 | H317: 1 | I317: 10 | J317: 0 | K317: 0 | L317: 1 | N317: 0 | O317: 获得一个幻想阵营的20资质橙品英雄。 | P317: 999999 | Q317: 1 | R317: 0 | S317: 0 | T317: 32410|32411|32400|32430|32401|32431|32402|32420|32412|32440 | U317: 1|1|1|1|1|1|1|1|1|1 | V317: 1|1|1|1|1|1|1|1|1|1 | W317: 1|1|1|1|1|1|1|1|1|1 | AB317: 1 | AG317: 1 | AK317: 31440 | AL317: =R[-1]C&"|"&RC[-1] -> 31400|31440
A318: 13024 | B318: 绿品随机英雄 | C318: 30000 | D318: 1 | E318: 2 | F318: 1 | G318: 1 | H318: 1 | I318: 10 | J318: 0 | K318: 0 | L318: 1 | N318: 0 | O318: 随机绿品英雄。 | P318: 999999 | Q318: 1 | R318: 0 | S318: 0 | T318: 30100|30110|30120|30130|30140|31100|31110|31120|31130|31140|32100|32110|32120|32130|32140 | U318: 1|1|1|1|1|1|1|1|1|1|1|1|1|1|1 | V318: =RC[-1] -> 1|1|1|1|1|1|1|1|1|1|1|1|1|1|1 | W318: 1|1|1|1|1|1|1|1|1|1|1|1|1|1|1 | AB318: 1 | AK318: 31430 | AL318: =R[-1]C&"|"&RC[-1] -> 31400|31440|31430
A319: 13025 | B319: 橙品装备 | C319: 13020 | D319: 4 | E319: 2 | F319: 1 | G319: 1 | H319: 1 | I319: 10 | J319: 0 | K319: 0 | L319: 1 | N319: 0 | O319: 充满惊喜的宝箱，使用后获得一件品级18的橙品装备。 | P319: 999999 | Q319: 7 | R319: 0 | S319: 0 | T319: 20401|21401|22401|23401 | U319: 1|1|1|1 | V319: 1|1|1|1 | W319: 1|1|1|1 | AC319: 1 | AG319: 1 | AK319: 31401 | AL319: =R[-1]C&"|"&RC[-1] -> 31400|31440|31430|31401
A320: 13026 | B320: 橙品装备箱 | C320: 13020 | D320: 4 | E320: 2 | F320: 1 | G320: 1 | H320: 1 | I320: 10 | J320: 0 | K320: 0 | L320: 0 | N320: 0 | O320: 充满惊喜的宝箱，使用后获得一件品级18的橙品装备。 | P320: 999999 | Q320: 7 | R320: 0 | S320: 0 | T320: 20401|21401|22401|23401 | U320: 1|1|1|1 | V320: 1|1|1|1 | W320: 1|1|1|1 | AC320: 1 | AG320: 1 | AH320: 1 | AI320: 1 | AK320: 31431 | AL320: =R[-1]C&"|"&RC[-1] -> 31400|31440|31430|31401|31431
A321: 13027 | B321: 橙品英雄 | C321: 13030 | D321: 4 | E321: 2 | F321: 1 | G321: 1 | H321: 1 | I321: 10 | J321: 0 | K321: 0 | L321: 1 | N321: 0 | O321: 充满惊喜的宝箱，使用后获得一个20资质的随机橙品英雄。 | P321: 999999 | Q321: 1 | R321: 0 | S321: 0 | T321: 30410|30401|30420|30402|30403|30411|31401|31431|31402|31403|31420|31410|32430|32401|32431|32402|32420|32412 | U321: 1|1|1|1|1|1|1|1|1|1|1|1|1|1|1|1|1|1 | V321: =RC[-1] -> 1|1|1|1|1|1|1|1|1|1|1|1|1|1|1|1|1|1 | W321: 1|1|1|1|1|1|1|1|1|1|1|1|1|1|1|1|1|1 | AB321: 1 | AG321: 1 | AK321: 31402 | AL321: =R[-1]C&"|"&RC[-1] -> 31400|31440|31430|31401|31431|31402
A322: 13028 | B322: 双十一红包 | C322: 13006 | D322: 4 | E322: 2 | F322: 1 | G322: 1 | H322: 1 | I322: 10 | J322: 0 | K322: 0 | L322: 0 | N322: 0 | O322: 打开可获得11~1111钻或其它珍稀道具，更有几率获得黄金购物卡。 | P322: 999999 | Q322: 1 | R322: 0 | S322: 0 | T322: 13028|19005|19005|19005|19005|19005|19005|19005|19005|19005|10004|10004|10004|10004|10004|10010|10010|10010|10010|10014|10014|10014|10022|10022|10098|10098|10098|10098|10098|10099 | U322: 2|11|22|66|88|111|222|666|888|1111|11|22|66|88|111|22|66|88|111|11|22|66|11|66|11|22|66|88|111|1 | V322: 2|11|22|66|88|111|222|666|888|1111|11|22|66|88|111|22|66|88|111|11|22|66|11|66|11|22|66|88|111|1 | W322: 500|500|1250|1000|800|500|100|30|10|5|300|150|50|40|30|250|75|55|44|111|55|20|50|1|500|1250|1000|800|500|10 | AG322: 1 | AK322: 31403 | AL322: =R[-2]C&"|"&RC[-1] -> 31400|31440|31430|31401|31431|31403
A323: 13029 | B323: 攻城BOSS宝箱 | C323: 13002 | D323: 3 | E323: 2 | F323: 1 | G323: 1 | H323: 1 | I323: 10 | J323: 0 | K323: 0 | L323: 1 | N323: 0 | O323: 攻城BOSS宝箱 | P323: 999999 | Q323: 1 | R323: 0 | S323: 0 | T323: 19005|19003|19006|10002|10003|10004|10010|10011|10012|10013|10014|10015|10018|10021|13007|13049 | U323: 5|5000|5|5|1|1|1|2|1|1|1|1|1|1|1|1 | V323: 10|10000|10|10|5|2|3|6|3|2|1|1|1|1|1|1 | W323: 10|10|10|10|10|10|10|10|10|10|10|10|10|10|1|1 | AK323: 31403 | AL323: =R[-2]C&"|"&RC[-1] -> 31400|31440|31430|31401|31431|31402|31403
A324: 13030 | B324: 攻城战利品 | C324: 13001 | D324: 3 | E324: 2 | F324: 1 | G324: 1 | H324: 1 | I324: 10 | J324: 0 | K324: 0 | L324: 0 | N324: 0 | O324: 打开可随机获得钻石、培养石、潜能合剂、魂晶、圣器精炼石、装备精炼石等物品。 | P324: 999999 | Q324: 1 | R324: 0 | S324: 0 | T324: 19005|19003|19006|10002|10003|10004|10010|10011|10012|10013|10014|10015|10018|10021|13007|13049 | U324: 5|5000|5|5|1|1|1|2|1|1|1|1|1|1|1|1 | V324: 10|10000|10|10|5|2|3|6|3|2|1|1|1|1|1|1 | W324: 10|10|10|10|10|10|10|10|10|10|10|10|10|10|1|1 | AH324: 1 | AK324: 31420 | AL324: =R[-1]C&"|"&RC[-1] -> 31400|31440|31430|31401|31431|31402|31403|31420
A325: 13031 | B325: 攻城宝箱1 | C325: 13000 | D325: 1 | E325: 2 | F325: 1 | G325: 1 | H325: 1 | I325: 10 | J325: 0 | K325: 0 | L325: 1 | N325: 0 | O325: 1~20波。 | P325: 999999 | Q325: 1 | R325: 0 | S325: 0 | T325: 19003|19005|10000|10001|10002|10018|12200|12201|12202|12203|12204|12230|12231|12232|12233|12234|12260|12261|12262|12263|12264|12300|12301|12302|12303|12304|12330|12331|12332|12333|12334|12360|12361|12362|12363|12364|12305|12306|12335|12336|12365|12366|12400|12401|12402|12403|12404|12405|12406|12407|12409|12411|12430|12431|12432|12433|12434|12435|12436|12437|12439|12441|12460|12461|12462|12463|12464|12465|12466|12467|12469|12471|12408|12410|12412|12413|12438|12440|12442|12443|12468|12470|12472|12473 | U325: 950|10|1|1|1|1|1|1|1|1|1|1|1|1|1|1|1|1|1|1|1|1|1|1|1|1|1|1|1|1|1|1|1|1|1|1|1|1|1|1|1|1|1|1|1|1|1|1|1|1|1|1|1|1|1|1|1|1|1|1|1|1|1|1|1|1|1|1|1|1|1|1|1|1|1|1|1|1|1|1|1|1|1|1 | V325: 1050|10|1|1|1|1|1|1|1|1|1|1|1|1|1|1|1|1|1|1|1|1|1|1|1|1|1|1|1|1|1|1|1|1|1|1|1|1|1|1|1|1|1|1|1|1|1|1|1|1|1|1|1|1|1|1|1|1|1|1|1|1|1|1|1|1|1|1|1|1|1|1|1|1|1|1|1|1|1|1|1|1|1|1 | W325: 62700|62700|5016|5016|62700|6270|31350|31350|31350|31350|31350|31350|31350|31350|31350|31350|31350|31350|31350|31350|31350|6270|6270|6270|6270|6270|6270|6270|6270|6270|6270|6270|6270|6270|6270|6270|5700|5700|5700|5700|5700|5700|4180|4180|4180|4180|4180|4180|4180|4180|4180|4180|4180|4180|4180|4180|4180|4180|4180|4180|4180|4180|4180|4180|4180|4180|4180|4180|4180|4180|4180|4180|627|627|627|627|627|627|627|627|627|627|627|627 | AK325: 31410 | AL325: =R[-1]C&"|"&RC[-1] -> 31400|31440|31430|31401|31431|31402|31403|31420|31410
A326: 13032 | B326: 攻城宝箱2 | C326: 13000 | D326: 1 | E326: 2 | F326: 1 | G326: 1 | H326: 1 | I326: 10 | J326: 0 | K326: 0 | L326: 1 | N326: 0 | O326: 21~40波。 | P326: 999999 | Q326: 1 | R326: 0 | S326: 0 | T326: 19003|19005|10000|10001|10002|10003|10018|12200|12201|12202|12203|12204|12230|12231|12232|12233|12234|12260|12261|12262|12263|12264|12300|12301|12302|12303|12304|12330|12331|12332|12333|12334|12360|12361|12362|12363|12364|12305|12306|12335|12336|12365|12366|12400|12401|12402|12403|12404|12405|12406|12407|12409|12411|12430|12431|12432|12433|12434|12435|12436|12437|12439|12441|12460|12461|12462|12463|12464|12465|12466|12467|12469|12471|12408|12410|12412|12413|12438|12440|12442|12443|12468|12470|12472|12473 | U326: 1050|10|1|1|1|1|1|1|1|1|1|1|1|1|1|1|1|1|1|1|1|1|1|1|1|1|1|1|1|1|1|1|1|1|1|1|1|1|1|1|1|1|1|1|1|1|1|1|1|1|1|1|1|1|1|1|1|1|1|1|1|1|1|1|1|1|1|1|1|1|1|1|1|1|1|1|1|1|1|1|1|1|1|1|1 | V326: 1150|10|1|1|1|1|1|1|1|1|1|1|1|1|1|1|1|1|1|1|1|1|1|1|1|1|1|1|1|1|1|1|1|1|1|1|1|1|1|1|1|1|1|1|1|1|1|1|1|1|1|1|1|1|1|1|1|1|1|1|1|1|1|1|1|1|1|1|1|1|1|1|1|1|1|1|1|1|1|1|1|1|1|1|1 | W326: 62700|62700|5016|5016|62700|41800|6270|31350|31350|31350|31350|31350|31350|31350|31350|31350|31350|31350|31350|31350|31350|31350|6270|6270|6270|6270|6270|6270|6270|6270|6270|6270|6270|6270|6270|6270|6270|5700|5700|5700|5700|5700|5700|4180|4180|4180|4180|4180|4180|4180|4180|4180|4180|4180|4180|4180|4180|4180|4180|4180|4180|4180|4180|4180|4180|4180|4180|4180|4180|4180|4180|4180|4180|627|627|627|627|627|627|627|627|627|627|627|627 | AK326: 31441 | AL326: =R[-1]C&"|"&RC[-1] -> 31400|31440|31430|31401|31431|31402|31403|31420|31410|31441
A327: 13033 | B327: 攻城宝箱3 | C327: 13000 | D327: 1 | E327: 2 | F327: 1 | G327: 1 | H327: 1 | I327: 10 | J327: 0 | K327: 0 | L327: 1 | N327: 0 | O327: 41~60波。 | P327: 999999 | Q327: 1 | R327: 0 | S327: 0 | T327: 19003|19005|10000|10001|10002|10003|10018|12200|12201|12202|12203|12204|12230|12231|12232|12233|12234|12260|12261|12262|12263|12264|12300|12301|12302|12303|12304|12330|12331|12332|12333|12334|12360|12361|12362|12363|12364|12305|12306|12335|12336|12365|12366|12400|12401|12402|12403|12404|12405|12406|12407|12409|12411|12430|12431|12432|12433|12434|12435|12436|12437|12439|12441|12460|12461|12462|12463|12464|12465|12466|12467|12469|12471|12408|12410|12412|12413|12438|12440|12442|12443|12468|12470|12472|12473|14201|14202|14203|14204|14205|14206|14207|14208|14209|14301|14302|14303|14304|14305|14306|14307|14308|14309|14310|14311|14312|14313|14314|14315|14316|14317|14318|14319|14320|14321|14322|14323|14324|14325|14326|14327|14328|14329|14330|14331|14332|14333|14334|14335|14336|14401|14402|14403|14404|14405|14406|14407|14408|14409|14410|14411|14412|14413|14414|14415|14416|14417|14418|14419|14420|14421|14422|14423|14424|14425|14426|14427|14428|14429|14430|14431|14432|14433|14434|14435|14436|14437|14438|14439|14440 | U327: 1150|10|1|1|1|1|1|1|1|1|1|1|1|1|1|1|1|1|1|1|1|1|1|1|1|1|1|1|1|1|1|1|1|1|1|1|1|1|1|1|1|1|1|1|1|1|1|1|1|1|1|1|1|1|1|1|1|1|1|1|1|1|1|1|1|1|1|1|1|1|1|1|1|1|1|1|1|1|1|1|1|1|1|1|1|1|1|1|1|1|1|1|1|1|1|1|1|1|1|1|1|1|1|1|1|1|1|1|1|1|1|1|1|1|1|1|1|1|1|1|1|1|1|1|1|1|1|1|1|1|1|1|1|1|1|1|1|1|1|1|1|1|1|1|1|1|1|1|1|1|1|1|1|1|1|1|1|1|1|1|1|1|1|1|1|1|1|1|1|1 | V327: 1250|10|1|1|1|1|1|1|1|1|1|1|1|1|1|1|1|1|1|1|1|1|1|1|1|1|1|1|1|1|1|1|1|1|1|1|1|1|1|1|1|1|1|1|1|1|1|1|1|1|1|1|1|1|1|1|1|1|1|1|1|1|1|1|1|1|1|1|1|1|1|1|1|1|1|1|1|1|1|1|1|1|1|1|1|1|1|1|1|1|1|1|1|1|1|1|1|1|1|1|1|1|1|1|1|1|1|1|1|1|1|1|1|1|1|1|1|1|1|1|1|1|1|1|1|1|1|1|1|1|1|1|1|1|1|1|1|1|1|1|1|1|1|1|1|1|1|1|1|1|1|1|1|1|1|1|1|1|1|1|1|1|1|1|1|1|1|1|1|1 | W327: 62700|62700|5016|5016|62700|41800|6270|31350|31350|31350|31350|31350|31350|31350|31350|31350|31350|31350|31350|31350|31350|31350|6270|6270|6270|6270|6270|6270|6270|6270|6270|6270|6270|6270|6270|6270|6270|5700|5700|5700|5700|5700|5700|4180|4180|4180|4180|4180|4180|4180|4180|4180|4180|4180|4180|4180|4180|4180|4180|4180|4180|4180|4180|4180|4180|4180|4180|4180|4180|4180|4180|4180|4180|627|627|627|627|627|627|627|627|627|627|627|627|62700|62700|62700|62700|62700|62700|62700|62700|62700|660|660|660|660|660|660|660|660|660|660|660|660|660|660|660|660|660|660|660|660|660|660|660|660|660|660|660|660|660|660|660|660|660|660|660|660|330|330|330|330|330|330|330|330|330|330|330|330|330|330|330|330|330|330|330|330|330|330|330|330|330|330|330|330|330|330|330|330|330|330|330|330|330|330|330|330 | AK327: 32410 | AL327: =RC[-1] -> 32410
A328: 13034 | B328: 攻城宝箱4 | C328: 13000 | D328: 1 | E328: 2 | F328: 1 | G328: 1 | H328: 1 | I328: 10 | J328: 0 | K328: 0 | L328: 1 | N328: 0 | O328: 61~80波。 | P328: 999999 | Q328: 1 | R328: 0 | S328: 0 | T328: 19003|19005|10000|10001|10002|10003|10011|10012|10013|10014|10018|12200|12201|12202|12203|12204|12230|12231|12232|12233|12234|12260|12261|12262|12263|12264|12300|12301|12302|12303|12304|12330|12331|12332|12333|12334|12360|12361|12362|12363|12364|12305|12306|12335|12336|12365|12366|12400|12401|12402|12403|12404|12405|12406|12407|12409|12411|12430|12431|12432|12433|12434|12435|12436|12437|12439|12441|12460|12461|12462|12463|12464|12465|12466|12467|12469|12471|12408|12410|12412|12413|12438|12440|12442|12443|12468|12470|12472|12473|14201|14202|14203|14204|14205|14206|14207|14208|14209|14301|14302|14303|14304|14305|14306|14307|14308|14309|14310|14311|14312|14313|14314|14315|14316|14317|14318|14319|14320|14321|14322|14323|14324|14325|14326|14327|14328|14329|14330|14331|14332|14333|14334|14335|14336|14401|14402|14403|14404|14405|14406|14407|14408|14409|14410|14411|14412|14413|14414|14415|14416|14417|14418|14419|14420|14421|14422|14423|14424|14425|14426|14427|14428|14429|14430|14431|14432|14433|14434|14435|14436|14437|14438|14439|14440 | U328: 1250|10|1|1|1|1|1|1|1|1|1|1|1|1|1|1|1|1|1|1|1|1|1|1|1|1|1|1|1|1|1|1|1|1|1|1|1|1|1|1|1|1|1|1|1|1|1|1|1|1|1|1|1|1|1|1|1|1|1|1|1|1|1|1|1|1|1|1|1|1|1|1|1|1|1|1|1|1|1|1|1|1|1|1|1|1|1|1|1|1|1|1|1|1|1|1|1|1|1|1|1|1|1|1|1|1|1|1|1|1|1|1|1|1|1|1|1|1|1|1|1|1|1|1|1|1|1|1|1|1|1|1|1|1|1|1|1|1|1|1|1|1|1|1|1|1|1|1|1|1|1|1|1|1|1|1|1|1|1|1|1|1|1|1|1|1|1|1|1|1|1|1|1|1 | V328: 1350|10|1|1|1|1|1|1|1|1|1|1|1|1|1|1|1|1|1|1|1|1|1|1|1|1|1|1|1|1|1|1|1|1|1|1|1|1|1|1|1|1|1|1|1|1|1|1|1|1|1|1|1|1|1|1|1|1|1|1|1|1|1|1|1|1|1|1|1|1|1|1|1|1|1|1|1|1|1|1|1|1|1|1|1|1|1|1|1|1|1|1|1|1|1|1|1|1|1|1|1|1|1|1|1|1|1|1|1|1|1|1|1|1|1|1|1|1|1|1|1|1|1|1|1|1|1|1|1|1|1|1|1|1|1|1|1|1|1|1|1|1|1|1|1|1|1|1|1|1|1|1|1|1|1|1|1|1|1|1|1|1|1|1|1|1|1|1|1|1|1|1|1|1 | W328: 62700|62700|5016|5016|62700|41800|62700|31350|12540|6270|6270|31350|31350|31350|31350|31350|31350|31350|31350|31350|31350|31350|31350|31350|31350|31350|6270|6270|6270|6270|6270|6270|6270|6270|6270|6270|6270|6270|6270|6270|6270|5700|5700|5700|5700|5700|5700|4180|4180|4180|4180|4180|4180|4180|4180|4180|4180|4180|4180|4180|4180|4180|4180|4180|4180|4180|4180|4180|4180|4180|4180|4180|4180|4180|4180|4180|4180|627|627|627|627|627|627|627|627|627|627|627|627|62700|62700|62700|62700|62700|62700|62700|62700|62700|660|660|660|660|660|660|660|660|660|660|660|660|660|660|660|660|660|660|660|660|660|660|660|660|660|660|660|660|660|660|660|660|660|660|660|660|330|330|330|330|330|330|330|330|330|330|330|330|330|330|330|330|330|330|330|330|330|330|330|330|330|330|330|330|330|330|330|330|330|330|330|330|330|330|330|330 | AK328: 32411 | AL328: =R[-1]C&"|"&RC[-1] -> 32410|32411
A329: 13035 | B329: 攻城宝箱5 | C329: 13000 | D329: 1 | E329: 2 | F329: 1 | G329: 1 | H329: 1 | I329: 10 | J329: 0 | K329: 0 | L329: 1 | N329: 0 | O329: 81~100波。 | P329: 999999 | Q329: 1 | R329: 0 | S329: 0 | T329: 19003|19005|10000|10001|10002|10003|10004|10010|10011|10012|10013|10014|10018|12200|12201|12202|12203|12204|12230|12231|12232|12233|12234|12260|12261|12262|12263|12264|12300|12301|12302|12303|12304|12330|12331|12332|12333|12334|12360|12361|12362|12363|12364|12305|12306|12335|12336|12365|12366|12400|12401|12402|12403|12404|12405|12406|12407|12409|12411|12430|12431|12432|12433|12434|12435|12436|12437|12439|12441|12460|12461|12462|12463|12464|12465|12466|12467|12469|12471|12408|12410|12412|12413|12438|12440|12442|12443|12468|12470|12472|12473|14201|14202|14203|14204|14205|14206|14207|14208|14209|14301|14302|14303|14304|14305|14306|14307|14308|14309|14310|14311|14312|14313|14314|14315|14316|14317|14318|14319|14320|14321|14322|14323|14324|14325|14326|14327|14328|14329|14330|14331|14332|14333|14334|14335|14336|14401|14402|14403|14404|14405|14406|14407|14408|14409|14410|14411|14412|14413|14414|14415|14416|14417|14418|14419|14420|14421|14422|14423|14424|14425|14426|14427|14428|14429|14430|14431|14432|14433|14434|14435|14436|14437|14438|14439|14440 | U329: 1350|10|1|1|1|1|1|1|1|1|1|1|1|1|1|1|1|1|1|1|1|1|1|1|1|1|1|1|1|1|1|1|1|1|1|1|1|1|1|1|1|1|1|1|1|1|1|1|1|1|1|1|1|1|1|1|1|1|1|1|1|1|1|1|1|1|1|1|1|1|1|1|1|1|1|1|1|1|1|1|1|1|1|1|1|1|1|1|1|1|1|1|1|1|1|1|1|1|1|1|1|1|1|1|1|1|1|1|1|1|1|1|1|1|1|1|1|1|1|1|1|1|1|1|1|1|1|1|1|1|1|1|1|1|1|1|1|1|1|1|1|1|1|1|1|1|1|1|1|1|1|1|1|1|1|1|1|1|1|1|1|1|1|1|1|1|1|1|1|1|1|1|1|1|1|1 | V329: 1450|10|1|1|1|1|1|1|1|1|1|1|1|1|1|1|1|1|1|1|1|1|1|1|1|1|1|1|1|1|1|1|1|1|1|1|1|1|1|1|1|1|1|1|1|1|1|1|1|1|1|1|1|1|1|1|1|1|1|1|1|1|1|1|1|1|1|1|1|1|1|1|1|1|1|1|1|1|1|1|1|1|1|1|1|1|1|1|1|1|1|1|1|1|1|1|1|1|1|1|1|1|1|1|1|1|1|1|1|1|1|1|1|1|1|1|1|1|1|1|1|1|1|1|1|1|1|1|1|1|1|1|1|1|1|1|1|1|1|1|1|1|1|1|1|1|1|1|1|1|1|1|1|1|1|1|1|1|1|1|1|1|1|1|1|1|1|1|1|1|1|1|1|1|1|1 | W329: 62700|62700|5016|5016|62700|41800|16720|25080|62700|31350|12540|6270|6270|31350|31350|31350|31350|31350|31350|31350|31350|31350|31350|31350|31350|31350|31350|31350|6270|6270|6270|6270|6270|6270|6270|6270|6270|6270|6270|6270|6270|6270|6270|5700|5700|5700|5700|5700|5700|4180|4180|4180|4180|4180|4180|4180|4180|4180|4180|4180|4180|4180|4180|4180|4180|4180|4180|4180|4180|4180|4180|4180|4180|4180|4180|4180|4180|4180|4180|627|627|627|627|627|627|627|627|627|627|627|627|62700|62700|62700|62700|62700|62700|62700|62700|62700|660|660|660|660|660|660|660|660|660|660|660|660|660|660|660|660|660|660|660|660|660|660|660|660|660|660|660|660|660|660|660|660|660|660|660|660|330|330|330|330|330|330|330|330|330|330|330|330|330|330|330|330|330|330|330|330|330|330|330|330|330|330|330|330|330|330|330|330|330|330|330|330|330|330|330|330 | AK329: 32400 | AL329: =R[-1]C&"|"&RC[-1] -> 32410|32411|32400
A330: 13036 | B330: 攻城宝箱6 | C330: 13000 | D330: 1 | E330: 2 | F330: 1 | G330: 1 | H330: 1 | I330: 10 | J330: 0 | K330: 0 | L330: 1 | N330: 0 | O330: 101~120波。 | P330: 999999 | Q330: 1 | R330: 0 | S330: 0 | T330: 19003|19005|10000|10001|10002|10003|10004|10010|10011|10012|10013|10014|10018|12200|12201|12202|12203|12204|12230|12231|12232|12233|12234|12260|12261|12262|12263|12264|12300|12301|12302|12303|12304|12330|12331|12332|12333|12334|12360|12361|12362|12363|12364|12305|12306|12335|12336|12365|12366|12400|12401|12402|12403|12404|12405|12406|12407|12409|12411|12430|12431|12432|12433|12434|12435|12436|12437|12439|12441|12460|12461|12462|12463|12464|12465|12466|12467|12469|12471|12408|12410|12412|12413|12438|12440|12442|12443|12468|12470|12472|12473|14201|14202|14203|14204|14205|14206|14207|14208|14209|14301|14302|14303|14304|14305|14306|14307|14308|14309|14310|14311|14312|14313|14314|14315|14316|14317|14318|14319|14320|14321|14322|14323|14324|14325|14326|14327|14328|14329|14330|14331|14332|14333|14334|14335|14336|14401|14402|14403|14404|14405|14406|14407|14408|14409|14410|14411|14412|14413|14414|14415|14416|14417|14418|14419|14420|14421|14422|14423|14424|14425|14426|14427|14428|14429|14430|14431|14432|14433|14434|14435|14436|14437|14438|14439|14440 | U330: 1450|10|1|1|1|1|1|1|1|1|1|1|1|1|1|1|1|1|1|1|1|1|1|1|1|1|1|1|1|1|1|1|1|1|1|1|1|1|1|1|1|1|1|1|1|1|1|1|1|1|1|1|1|1|1|1|1|1|1|1|1|1|1|1|1|1|1|1|1|1|1|1|1|1|1|1|1|1|1|1|1|1|1|1|1|1|1|1|1|1|1|1|1|1|1|1|1|1|1|1|1|1|1|1|1|1|1|1|1|1|1|1|1|1|1|1|1|1|1|1|1|1|1|1|1|1|1|1|1|1|1|1|1|1|1|1|1|1|1|1|1|1|1|1|1|1|1|1|1|1|1|1|1|1|1|1|1|1|1|1|1|1|1|1|1|1|1|1|1|1|1|1|1|1|1|1 | V330: 1550|10|1|1|1|1|1|1|1|1|1|1|1|1|1|1|1|1|1|1|1|1|1|1|1|1|1|1|1|1|1|1|1|1|1|1|1|1|1|1|1|1|1|1|1|1|1|1|1|1|1|1|1|1|1|1|1|1|1|1|1|1|1|1|1|1|1|1|1|1|1|1|1|1|1|1|1|1|1|1|1|1|1|1|1|1|1|1|1|1|1|1|1|1|1|1|1|1|1|1|1|1|1|1|1|1|1|1|1|1|1|1|1|1|1|1|1|1|1|1|1|1|1|1|1|1|1|1|1|1|1|1|1|1|1|1|1|1|1|1|1|1|1|1|1|1|1|1|1|1|1|1|1|1|1|1|1|1|1|1|1|1|1|1|1|1|1|1|1|1|1|1|1|1|1|1 | W330: 62700|62700|5016|5016|62700|41800|16720|25080|62700|31350|12540|6270|6270|31350|31350|31350|31350|31350|31350|31350|31350|31350|31350|31350|31350|31350|31350|31350|6270|6270|6270|6270|6270|6270|6270|6270|6270|6270|6270|6270|6270|6270|6270|5700|5700|5700|5700|5700|5700|4180|4180|4180|4180|4180|4180|4180|4180|4180|4180|4180|4180|4180|4180|4180|4180|4180|4180|4180|4180|4180|4180|4180|4180|4180|4180|4180|4180|4180|4180|627|627|627|627|627|627|627|627|627|627|627|627|62700|62700|62700|62700|62700|62700|62700|62700|62700|660|660|660|660|660|660|660|660|660|660|660|660|660|660|660|660|660|660|660|660|660|660|660|660|660|660|660|660|660|660|660|660|660|660|660|660|330|330|330|330|330|330|330|330|330|330|330|330|330|330|330|330|330|330|330|330|330|330|330|330|330|330|330|330|330|330|330|330|330|330|330|330|330|330|330|330 | AK330: 32430 | AL330: =R[-1]C&"|"&RC[-1] -> 32410|32411|32400|32430
A331: 13037 | B331: 攻城宝箱7 | C331: 13000 | D331: 1 | E331: 2 | F331: 1 | G331: 1 | H331: 1 | I331: 10 | J331: 0 | K331: 0 | L331: 1 | N331: 0 | O331: 121~140波。 | P331: 999999 | Q331: 1 | R331: 0 | S331: 0 | T331: 19003|19005|10000|10001|10002|10003|10004|10010|10011|10012|10013|10014|10018|12200|12201|12202|12203|12204|12230|12231|12232|12233|12234|12260|12261|12262|12263|12264|12300|12301|12302|12303|12304|12330|12331|12332|12333|12334|12360|12361|12362|12363|12364|12305|12306|12335|12336|12365|12366|12400|12401|12402|12403|12404|12405|12406|12407|12409|12411|12430|12431|12432|12433|12434|12435|12436|12437|12439|12441|12460|12461|12462|12463|12464|12465|12466|12467|12469|12471|12408|12410|12412|12413|12438|12440|12442|12443|12468|12470|12472|12473|14201|14202|14203|14204|14205|14206|14207|14208|14209|14301|14302|14303|14304|14305|14306|14307|14308|14309|14310|14311|14312|14313|14314|14315|14316|14317|14318|14319|14320|14321|14322|14323|14324|14325|14326|14327|14328|14329|14330|14331|14332|14333|14334|14335|14336|14401|14402|14403|14404|14405|14406|14407|14408|14409|14410|14411|14412|14413|14414|14415|14416|14417|14418|14419|14420|14421|14422|14423|14424|14425|14426|14427|14428|14429|14430|14431|14432|14433|14434|14435|14436|14437|14438|14439|14440 | U331: 1550|10|1|1|1|1|1|1|1|1|1|1|1|1|1|1|1|1|1|1|1|1|1|1|1|1|1|1|1|1|1|1|1|1|1|1|1|1|1|1|1|1|1|1|1|1|1|1|1|1|1|1|1|1|1|1|1|1|1|1|1|1|1|1|1|1|1|1|1|1|1|1|1|1|1|1|1|1|1|1|1|1|1|1|1|1|1|1|1|1|1|1|1|1|1|1|1|1|1|1|1|1|1|1|1|1|1|1|1|1|1|1|1|1|1|1|1|1|1|1|1|1|1|1|1|1|1|1|1|1|1|1|1|1|1|1|1|1|1|1|1|1|1|1|1|1|1|1|1|1|1|1|1|1|1|1|1|1|1|1|1|1|1|1|1|1|1|1|1|1|1|1|1|1|1|1 | V331: 1650|10|1|1|1|1|1|1|1|1|1|1|1|1|1|1|1|1|1|1|1|1|1|1|1|1|1|1|1|1|1|1|1|1|1|1|1|1|1|1|1|1|1|1|1|1|1|1|1|1|1|1|1|1|1|1|1|1|1|1|1|1|1|1|1|1|1|1|1|1|1|1|1|1|1|1|1|1|1|1|1|1|1|1|1|1|1|1|1|1|1|1|1|1|1|1|1|1|1|1|1|1|1|1|1|1|1|1|1|1|1|1|1|1|1|1|1|1|1|1|1|1|1|1|1|1|1|1|1|1|1|1|1|1|1|1|1|1|1|1|1|1|1|1|1|1|1|1|1|1|1|1|1|1|1|1|1|1|1|1|1|1|1|1|1|1|1|1|1|1|1|1|1|1|1|1 | W331: 62700|62700|5016|5016|62700|41800|16720|25080|62700|31350|12540|6270|6270|31350|31350|31350|31350|31350|31350|31350|31350|31350|31350|31350|31350|31350|31350|31350|6270|6270|6270|6270|6270|6270|6270|6270|6270|6270|6270|6270|6270|6270|6270|5700|5700|5700|5700|5700|5700|4180|4180|4180|4180|4180|4180|4180|4180|4180|4180|4180|4180|4180|4180|4180|4180|4180|4180|4180|4180|4180|4180|4180|4180|4180|4180|4180|4180|4180|4180|627|627|627|627|627|627|627|627|627|627|627|627|62700|62700|62700|62700|62700|62700|62700|62700|62700|660|660|660|660|660|660|660|660|660|660|660|660|660|660|660|660|660|660|660|660|660|660|660|660|660|660|660|660|660|660|660|660|660|660|660|660|330|330|330|330|330|330|330|330|330|330|330|330|330|330|330|330|330|330|330|330|330|330|330|330|330|330|330|330|330|330|330|330|330|330|330|330|330|330|330|330 | AK331: 32401 | AL331: =R[-1]C&"|"&RC[-1] -> 32410|32411|32400|32430|32401
A332: 13038 | B332: 攻城宝箱8 | C332: 13000 | D332: 1 | E332: 2 | F332: 1 | G332: 1 | H332: 1 | I332: 10 | J332: 0 | K332: 0 | L332: 1 | N332: 0 | O332: 141~160波。 | P332: 999999 | Q332: 1 | R332: 0 | S332: 0 | T332: 19003|19005|10000|10001|10002|10003|10004|10010|10011|10012|10013|10014|10018|12200|12201|12202|12203|12204|12230|12231|12232|12233|12234|12260|12261|12262|12263|12264|12300|12301|12302|12303|12304|12330|12331|12332|12333|12334|12360|12361|12362|12363|12364|12305|12306|12335|12336|12365|12366|12400|12401|12402|12403|12404|12405|12406|12407|12409|12411|12430|12431|12432|12433|12434|12435|12436|12437|12439|12441|12460|12461|12462|12463|12464|12465|12466|12467|12469|12471|12408|12410|12412|12413|12438|12440|12442|12443|12468|12470|12472|12473|14201|14202|14203|14204|14205|14206|14207|14208|14209|14301|14302|14303|14304|14305|14306|14307|14308|14309|14310|14311|14312|14313|14314|14315|14316|14317|14318|14319|14320|14321|14322|14323|14324|14325|14326|14327|14328|14329|14330|14331|14332|14333|14334|14335|14336|14401|14402|14403|14404|14405|14406|14407|14408|14409|14410|14411|14412|14413|14414|14415|14416|14417|14418|14419|14420|14421|14422|14423|14424|14425|14426|14427|14428|14429|14430|14431|14432|14433|14434|14435|14436|14437|14438|14439|14440 | U332: 1650|10|1|1|1|1|1|1|1|1|1|1|1|1|1|1|1|1|1|1|1|1|1|1|1|1|1|1|1|1|1|1|1|1|1|1|1|1|1|1|1|1|1|1|1|1|1|1|1|1|1|1|1|1|1|1|1|1|1|1|1|1|1|1|1|1|1|1|1|1|1|1|1|1|1|1|1|1|1|1|1|1|1|1|1|1|1|1|1|1|1|1|1|1|1|1|1|1|1|1|1|1|1|1|1|1|1|1|1|1|1|1|1|1|1|1|1|1|1|1|1|1|1|1|1|1|1|1|1|1|1|1|1|1|1|1|1|1|1|1|1|1|1|1|1|1|1|1|1|1|1|1|1|1|1|1|1|1|1|1|1|1|1|1|1|1|1|1|1|1|1|1|1|1|1|1 | V332: 1750|10|1|1|1|1|1|1|1|1|1|1|1|1|1|1|1|1|1|1|1|1|1|1|1|1|1|1|1|1|1|1|1|1|1|1|1|1|1|1|1|1|1|1|1|1|1|1|1|1|1|1|1|1|1|1|1|1|1|1|1|1|1|1|1|1|1|1|1|1|1|1|1|1|1|1|1|1|1|1|1|1|1|1|1|1|1|1|1|1|1|1|1|1|1|1|1|1|1|1|1|1|1|1|1|1|1|1|1|1|1|1|1|1|1|1|1|1|1|1|1|1|1|1|1|1|1|1|1|1|1|1|1|1|1|1|1|1|1|1|1|1|1|1|1|1|1|1|1|1|1|1|1|1|1|1|1|1|1|1|1|1|1|1|1|1|1|1|1|1|1|1|1|1|1|1 | W332: 62700|62700|5016|5016|62700|41800|16720|25080|62700|31350|12540|6270|6270|31350|31350|31350|31350|31350|31350|31350|31350|31350|31350|31350|31350|31350|31350|31350|6270|6270|6270|6270|6270|6270|6270|6270|6270|6270|6270|6270|6270|6270|6270|5700|5700|5700|5700|5700|5700|4180|4180|4180|4180|4180|4180|4180|4180|4180|4180|4180|4180|4180|4180|4180|4180|4180|4180|4180|4180|4180|4180|4180|4180|4180|4180|4180|4180|4180|4180|627|627|627|627|627|627|627|627|627|627|627|627|62700|62700|62700|62700|62700|62700|62700|62700|62700|660|660|660|660|660|660|660|660|660|660|660|660|660|660|660|660|660|660|660|660|660|660|660|660|660|660|660|660|660|660|660|660|660|660|660|660|330|330|330|330|330|330|330|330|330|330|330|330|330|330|330|330|330|330|330|330|330|330|330|330|330|330|330|330|330|330|330|330|330|330|330|330|330|330|330|330 | AK332: 32431 | AL332: =R[-1]C&"|"&RC[-1] -> 32410|32411|32400|32430|32401|32431
A333: 13039 | B333: 攻城宝箱9 | C333: 13000 | D333: 1 | E333: 2 | F333: 1 | G333: 1 | H333: 1 | I333: 10 | J333: 0 | K333: 0 | L333: 1 | N333: 0 | O333: 161~180波。 | P333: 999999 | Q333: 1 | R333: 0 | S333: 0 | T333: 19003|19005|10000|10001|10002|10003|10004|10010|10011|10012|10013|10014|10018|12200|12201|12202|12203|12204|12230|12231|12232|12233|12234|12260|12261|12262|12263|12264|12300|12301|12302|12303|12304|12330|12331|12332|12333|12334|12360|12361|12362|12363|12364|12305|12306|12335|12336|12365|12366|12400|12401|12402|12403|12404|12405|12406|12407|12409|12411|12430|12431|12432|12433|12434|12435|12436|12437|12439|12441|12460|12461|12462|12463|12464|12465|12466|12467|12469|12471|12408|12410|12412|12413|12438|12440|12442|12443|12468|12470|12472|12473|14201|14202|14203|14204|14205|14206|14207|14208|14209|14301|14302|14303|14304|14305|14306|14307|14308|14309|14310|14311|14312|14313|14314|14315|14316|14317|14318|14319|14320|14321|14322|14323|14324|14325|14326|14327|14328|14329|14330|14331|14332|14333|14334|14335|14336|14401|14402|14403|14404|14405|14406|14407|14408|14409|14410|14411|14412|14413|14414|14415|14416|14417|14418|14419|14420|14421|14422|14423|14424|14425|14426|14427|14428|14429|14430|14431|14432|14433|14434|14435|14436|14437|14438|14439|14440 | U333: 1750|10|1|1|1|1|1|1|1|1|1|1|1|1|1|1|1|1|1|1|1|1|1|1|1|1|1|1|1|1|1|1|1|1|1|1|1|1|1|1|1|1|1|1|1|1|1|1|1|1|1|1|1|1|1|1|1|1|1|1|1|1|1|1|1|1|1|1|1|1|1|1|1|1|1|1|1|1|1|1|1|1|1|1|1|1|1|1|1|1|1|1|1|1|1|1|1|1|1|1|1|1|1|1|1|1|1|1|1|1|1|1|1|1|1|1|1|1|1|1|1|1|1|1|1|1|1|1|1|1|1|1|1|1|1|1|1|1|1|1|1|1|1|1|1|1|1|1|1|1|1|1|1|1|1|1|1|1|1|1|1|1|1|1|1|1|1|1|1|1|1|1|1|1|1|1 | V333: 1850|10|1|1|1|1|1|1|1|1|1|1|1|1|1|1|1|1|1|1|1|1|1|1|1|1|1|1|1|1|1|1|1|1|1|1|1|1|1|1|1|1|1|1|1|1|1|1|1|1|1|1|1|1|1|1|1|1|1|1|1|1|1|1|1|1|1|1|1|1|1|1|1|1|1|1|1|1|1|1|1|1|1|1|1|1|1|1|1|1|1|1|1|1|1|1|1|1|1|1|1|1|1|1|1|1|1|1|1|1|1|1|1|1|1|1|1|1|1|1|1|1|1|1|1|1|1|1|1|1|1|1|1|1|1|1|1|1|1|1|1|1|1|1|1|1|1|1|1|1|1|1|1|1|1|1|1|1|1|1|1|1|1|1|1|1|1|1|1|1|1|1|1|1|1|1 | W333: 62700|62700|5016|5016|62700|41800|16720|25080|62700|31350|12540|6270|6270|31350|31350|31350|31350|31350|31350|31350|31350|31350|31350|31350|31350|31350|31350|31350|6270|6270|6270|6270|6270|6270|6270|6270|6270|6270|6270|6270|6270|6270|6270|5700|5700|5700|5700|5700|5700|4180|4180|4180|4180|4180|4180|4180|4180|4180|4180|4180|4180|4180|4180|4180|4180|4180|4180|4180|4180|4180|4180|4180|4180|4180|4180|4180|4180|4180|4180|627|627|627|627|627|627|627|627|627|627|627|627|62700|62700|62700|62700|62700|62700|62700|62700|62700|660|660|660|660|660|660|660|660|660|660|660|660|660|660|660|660|660|660|660|660|660|660|660|660|660|660|660|660|660|660|660|660|660|660|660|660|330|330|330|330|330|330|330|330|330|330|330|330|330|330|330|330|330|330|330|330|330|330|330|330|330|330|330|330|330|330|330|330|330|330|330|330|330|330|330|330 | AK333: 32402 | AL333: =R[-1]C&"|"&RC[-1] -> 32410|32411|32400|32430|32401|32431|32402
A334: 13040 | B334: 攻城宝箱10 | C334: 13000 | D334: 1 | E334: 2 | F334: 1 | G334: 1 | H334: 1 | I334: 10 | J334: 0 | K334: 0 | L334: 1 | N334: 0 | O334: 181~200波。 | P334: 999999 | Q334: 1 | R334: 0 | S334: 0 | T334: 19003|19005|10000|10001|10002|10003|10004|10010|10011|10012|10013|10014|10018|12200|12201|12202|12203|12204|12230|12231|12232|12233|12234|12260|12261|12262|12263|12264|12300|12301|12302|12303|12304|12330|12331|12332|12333|12334|12360|12361|12362|12363|12364|12305|12306|12335|12336|12365|12366|12400|12401|12402|12403|12404|12405|12406|12407|12409|12411|12430|12431|12432|12433|12434|12435|12436|12437|12439|12441|12460|12461|12462|12463|12464|12465|12466|12467|12469|12471|12408|12410|12412|12413|12438|12440|12442|12443|12468|12470|12472|12473|14201|14202|14203|14204|14205|14206|14207|14208|14209|14301|14302|14303|14304|14305|14306|14307|14308|14309|14310|14311|14312|14313|14314|14315|14316|14317|14318|14319|14320|14321|14322|14323|14324|14325|14326|14327|14328|14329|14330|14331|14332|14333|14334|14335|14336|14401|14402|14403|14404|14405|14406|14407|14408|14409|14410|14411|14412|14413|14414|14415|14416|14417|14418|14419|14420|14421|14422|14423|14424|14425|14426|14427|14428|14429|14430|14431|14432|14433|14434|14435|14436|14437|14438|14439|14440 | U334: 1850|10|1|1|1|1|1|1|1|1|1|1|1|1|1|1|1|1|1|1|1|1|1|1|1|1|1|1|1|1|1|1|1|1|1|1|1|1|1|1|1|1|1|1|1|1|1|1|1|1|1|1|1|1|1|1|1|1|1|1|1|1|1|1|1|1|1|1|1|1|1|1|1|1|1|1|1|1|1|1|1|1|1|1|1|1|1|1|1|1|1|1|1|1|1|1|1|1|1|1|1|1|1|1|1|1|1|1|1|1|1|1|1|1|1|1|1|1|1|1|1|1|1|1|1|1|1|1|1|1|1|1|1|1|1|1|1|1|1|1|1|1|1|1|1|1|1|1|1|1|1|1|1|1|1|1|1|1|1|1|1|1|1|1|1|1|1|1|1|1|1|1|1|1|1|1 | V334: 1950|10|1|1|1|1|1|1|1|1|1|1|1|1|1|1|1|1|1|1|1|1|1|1|1|1|1|1|1|1|1|1|1|1|1|1|1|1|1|1|1|1|1|1|1|1|1|1|1|1|1|1|1|1|1|1|1|1|1|1|1|1|1|1|1|1|1|1|1|1|1|1|1|1|1|1|1|1|1|1|1|1|1|1|1|1|1|1|1|1|1|1|1|1|1|1|1|1|1|1|1|1|1|1|1|1|1|1|1|1|1|1|1|1|1|1|1|1|1|1|1|1|1|1|1|1|1|1|1|1|1|1|1|1|1|1|1|1|1|1|1|1|1|1|1|1|1|1|1|1|1|1|1|1|1|1|1|1|1|1|1|1|1|1|1|1|1|1|1|1|1|1|1|1|1|1 | W334: 62700|62700|5016|5016|62700|41800|16720|25080|62700|31350|12540|6270|6270|31350|31350|31350|31350|31350|31350|31350|31350|31350|31350|31350|31350|31350|31350|31350|6270|6270|6270|6270|6270|6270|6270|6270|6270|6270|6270|6270|6270|6270|6270|5700|5700|5700|5700|5700|5700|4180|4180|4180|4180|4180|4180|4180|4180|4180|4180|4180|4180|4180|4180|4180|4180|4180|4180|4180|4180|4180|4180|4180|4180|4180|4180|4180|4180|4180|4180|627|627|627|627|627|627|627|627|627|627|627|627|62700|62700|62700|62700|62700|62700|62700|62700|62700|660|660|660|660|660|660|660|660|660|660|660|660|660|660|660|660|660|660|660|660|660|660|660|660|660|660|660|660|660|660|660|660|660|660|660|660|330|330|330|330|330|330|330|330|330|330|330|330|330|330|330|330|330|330|330|330|330|330|330|330|330|330|330|330|330|330|330|330|330|330|330|330|330|330|330|330 | AK334: 32420 | AL334: =R[-1]C&"|"&RC[-1] -> 32410|32411|32400|32430|32401|32431|32402|32420
A335: 13041 | B335: 统帅符文碎片 | C335: 40401 | D335: 4 | E335: 2 | F335: 1 | G335: 1 | H335: 1 | I335: 10 | J335: 0 | K335: 0 | L335: 1 | N335: 0 | O335: 统帅符文的随机一个碎片。 | P335: 999999 | Q335: 1 | R335: 0 | S335: 0 | T335: 14401|14402|14403|14404|14405 | U335: 1|1|1|1|1 | V335: 1|1|1|1|1 | W335: 1|1|1|1|1 | AA335: 1 | AG335: 1 | AK335: 32412 | AL335: =R[-1]C&"|"&RC[-1] -> 32410|32411|32400|32430|32401|32431|32402|32420|32412
A336: 13042 | B336: 屠戮符文碎片 | C336: 40402 | D336: 4 | E336: 2 | F336: 1 | G336: 1 | H336: 1 | I336: 10 | J336: 0 | K336: 0 | L336: 1 | N336: 0 | O336: 屠戮符文的随机一个碎片。 | P336: 999999 | Q336: 1 | R336: 0 | S336: 0 | T336: 14406|14407|14408|14409|14410 | U336: 1|1|1|1|1 | V336: 1|1|1|1|1 | W336: 1|1|1|1|1 | AA336: 1 | AG336: 1 | AK336: 32440 | AL336: =R[-1]C&"|"&RC[-1] -> 32410|32411|32400|32430|32401|32431|32402|32420|32412|32440
A337: 13043 | B337: 沉眠符文碎片 | C337: 40403 | D337: 4 | E337: 2 | F337: 1 | G337: 1 | H337: 1 | I337: 10 | J337: 0 | K337: 0 | L337: 1 | N337: 0 | O337: 沉眠符文的随机一个碎片。 | P337: 999999 | Q337: 1 | R337: 0 | S337: 0 | T337: 14411|14412|14413|14414|14415 | U337: 1|1|1|1|1 | V337: 1|1|1|1|1 | W337: 1|1|1|1|1 | AA337: 1 | AG337: 1 | AK337: 32412 | AL337: =R[-1]C&"|"&RC[-1] -> 32410|32411|32400|32430|32401|32431|32402|32420|32412|32440|32412
A338: 13044 | B338: 狂野符文碎片 | C338: 40404 | D338: 4 | E338: 2 | F338: 1 | G338: 1 | H338: 1 | I338: 10 | J338: 0 | K338: 0 | L338: 1 | N338: 0 | O338: 狂野符文的随机一个碎片。 | P338: 999999 | Q338: 1 | R338: 0 | S338: 0 | T338: 14416|14417|14418|14419|14420 | U338: 1|1|1|1|1 | V338: 1|1|1|1|1 | W338: 1|1|1|1|1 | AA338: 1 | AG338: 1 | AK338: 32440 | AL338: =R[-1]C&"|"&RC[-1] -> 32410|32411|32400|32430|32401|32431|32402|32420|32412|32440|32412|32440
A339: 13045 | B339: 高山徽章碎片 | C339: 41401 | D339: 4 | E339: 2 | F339: 1 | G339: 1 | H339: 1 | I339: 10 | J339: 0 | K339: 0 | L339: 1 | N339: 0 | O339: 高山徽章的随机一个碎片。 | P339: 999999 | Q339: 1 | R339: 0 | S339: 0 | T339: 14421|14422|14423|14424|14425 | U339: 1|1|1|1|1 | V339: 1|1|1|1|1 | W339: 1|1|1|1|1 | AA339: 1 | AG339: 1
A340: 13046 | B340: 狮王徽章碎片 | C340: 41402 | D340: 4 | E340: 2 | F340: 1 | G340: 1 | H340: 1 | I340: 10 | J340: 0 | K340: 0 | L340: 1 | N340: 0 | O340: 狮王徽章的随机一个碎片。 | P340: 999999 | Q340: 1 | R340: 0 | S340: 0 | T340: 14426|14427|14428|14429|14430 | U340: 1|1|1|1|1 | V340: 1|1|1|1|1 | W340: 1|1|1|1|1 | AA340: 1 | AG340: 1
A341: 13047 | B341: 孔雀徽章碎片 | C341: 41403 | D341: 4 | E341: 2 | F341: 1 | G341: 1 | H341: 1 | I341: 10 | J341: 0 | K341: 0 | L341: 1 | N341: 0 | O341: 孔雀徽章的随机一个碎片。 | P341: 999999 | Q341: 1 | R341: 0 | S341: 0 | T341: 14431|14432|14433|14434|14435 | U341: 1|1|1|1|1 | V341: 1|1|1|1|1 | W341: 1|1|1|1|1 | AA341: 1 | AG341: 1
A342: 13048 | B342: 巨木徽章碎片 | C342: 41404 | D342: 4 | E342: 2 | F342: 1 | G342: 1 | H342: 1 | I342: 10 | J342: 0 | K342: 0 | L342: 1 | N342: 0 | O342: 巨木徽章的随机一个碎片。 | P342: 999999 | Q342: 1 | R342: 0 | S342: 0 | T342: 14436|14437|14438|14439|14440 | U342: 1|1|1|1|1 | V342: 1|1|1|1|1 | W342: 1|1|1|1|1 | AA342: 1 | AG342: 1
A343: 13049 | B343: 圣器碎片箱 | C343: 13001 | D343: 3 | E343: 2 | F343: 1 | G343: 1 | H343: 1 | I343: 10 | J343: 0 | K343: 0 | L343: 0 | N343: 0 | O343: 充满惊喜的宝箱，使用后大概率获得随机紫品或蓝品圣器碎片，小概率获得橙品圣器碎片。 | P343: 999999 | Q343: 13 | R343: 0 | S343: 0 | T343: 14201|14202|14203|14204|14205|14206|14207|14208|14209|14301|14302|14303|14304|14305|14306|14307|14308|14309|14310|14311|14312|14313|14314|14315|14316|14317|14318|14319|14320|14321|14322|14323|14324|14325|14326|14327|14328|14329|14330|14331|14332|14333|14334|14335|14336|14401|14402|14403|14404|14405|14406|14407|14408|14409|14410|14411|14412|14413|14414|14415|14416|14417|14418|14419|14420|14421|14422|14423|14424|14425|14426|14427|14428|14429|14430|14431|14432|14433|14434|14435|14436|14437|14438|14439|14440 | U343: 1|1|1|1|1|1|1|1|1|1|1|1|1|1|1|1|1|1|1|1|1|1|1|1|1|1|1|1|1|1|1|1|1|1|1|1|1|1|1|1|1|1|1|1|1|1|1|1|1|1|1|1|1|1|1|1|1|1|1|1|1|1|1|1|1|1|1|1|1|1|1|1|1|1|1|1|1|1|1|1|1|1|1|1|1 | V343: 1|1|1|1|1|1|1|1|1|1|1|1|1|1|1|1|1|1|1|1|1|1|1|1|1|1|1|1|1|1|1|1|1|1|1|1|1|1|1|1|1|1|1|1|1|1|1|1|1|1|1|1|1|1|1|1|1|1|1|1|1|1|1|1|1|1|1|1|1|1|1|1|1|1|1|1|1|1|1|1|1|1|1|1|1 | W343: 920|920|920|920|920|920|920|920|920|100|100|100|100|100|100|100|100|100|100|100|100|100|100|100|100|100|100|100|100|100|100|100|100|100|100|100|100|100|100|100|100|100|100|100|100|3|3|3|3|3|3|3|3|3|3|3|3|3|3|3|3|3|3|3|3|3|3|3|3|3|3|3|3|3|3|3|3|3|3|3|3|3|3|3|3 | AH343: 1 | AI343: 1
A344: 13050 | B344: 超能英雄碎片 | C344: 30 | D344: 4 | E344: 2 | F344: 1 | G344: 1 | H344: 1 | I344: 10 | J344: 0 | K344: 0 | L344: 1 | N344: 0 | O344: 获得1~5个超能阵营的橙品英雄碎片。 | P344: 999999 | Q344: 1 | R344: 0 | S344: 0 | T344: 13053 | U344: 1 | V344: 5 | W344: 1 | AA344: 1 | AG344: 1
A345: 13051 | B345: 传说英雄碎片 | C345: 31 | D345: 4 | E345: 2 | F345: 1 | G345: 1 | H345: 1 | I345: 10 | J345: 0 | K345: 0 | L345: 1 | N345: 0 | O345: 获得1~5个传说阵营的橙品英雄碎片。 | P345: 999999 | Q345: 1 | R345: 0 | S345: 0 | T345: 13054 | U345: 1 | V345: 5 | W345: 1 | AA345: 1 | AG345: 1
A346: 13052 | B346: 幻想英雄碎片 | C346: 32 | D346: 4 | E346: 2 | F346: 1 | G346: 1 | H346: 1 | I346: 10 | J346: 0 | K346: 0 | L346: 1 | N346: 0 | O346: 获得1~5个幻想阵营的橙品英雄碎片。 | P346: 999999 | Q346: 1 | R346: 0 | S346: 0 | T346: 13055 | U346: 1 | V346: 5 | W346: 1 | AA346: 1 | AG346: 1
A347: 13053 | B347: 超能英雄碎片 | C347: 30 | D347: 4 | E347: 2 | F347: 1 | G347: 1 | H347: 1 | I347: 10 | J347: 0 | K347: 0 | L347: 1 | N347: 0 | O347: 获得一个超能阵营的橙品英雄碎片。 | P347: 999999 | Q347: 1 | R347: 0 | S347: 0 | T347: 12400|12401|12402|12403|12404|12405|12406|12407|12408|12409|12410|12411|12412|12413 | U347: 1|1|1|1|1|1|1|1|1|1|1|1|1|1 | V347: 1|1|1|1|1|1|1|1|1|1|1|1|1|1 | W347: 1|1|1|1|1|1|1|1|1|1|1|1|1|1 | AA347: 1 | AG347: 1
A348: 13054 | B348: 传说英雄碎片 | C348: 31 | D348: 4 | E348: 2 | F348: 1 | G348: 1 | H348: 1 | I348: 10 | J348: 0 | K348: 0 | L348: 1 | N348: 0 | O348: 获得一个传说阵营的橙品英雄碎片。 | P348: 999999 | Q348: 1 | R348: 0 | S348: 0 | T348: 12430|12431|12432|12433|12434|12435|12436|12437|12438|12439|12440|12441|12442|12443 | U348: 1|1|1|1|1|1|1|1|1|1|1|1|1|1 | V348: 1|1|1|1|1|1|1|1|1|1|1|1|1|1 | W348: 1|1|1|1|1|1|1|1|1|1|1|1|1|1 | AA348: 1 | AG348: 1
A349: 13055 | B349: 幻想英雄碎片 | C349: 32 | D349: 4 | E349: 2 | F349: 1 | G349: 1 | H349: 1 | I349: 10 | J349: 0 | K349: 0 | L349: 1 | N349: 0 | O349: 获得一个幻想阵营的橙品英雄碎片。 | P349: 999999 | Q349: 1 | R349: 0 | S349: 0 | T349: 12460|12461|12462|12463|12464|12465|12466|12467|12468|12469|12470|12471|12472|12473 | U349: 1|1|1|1|1|1|1|1|1|1|1|1|1|1 | V349: 1|1|1|1|1|1|1|1|1|1|1|1|1|1 | W349: 1|1|1|1|1|1|1|1|1|1|1|1|1|1 | AA349: 1 | AG349: 1
A350: 13056 | B350: 随机卡牌 | C350: 13070 | D350: 3 | E350: 2 | F350: 1 | G350: 1 | H350: 1 | I350: 10 | J350: 0 | K350: 0 | L350: 0 | N350: 0 | O350: 充满惊喜的宝箱，使用后获得随机紫品卡牌。 | P350: 999999 | Q350: 1 | R350: 0 | S350: 0 | T350: 70301|70302|70303|70304|70305|70306|70307|70308|70309|70310|70311|70312|70313|70314|70315|70316|70317|70318|70319|70320|70321|70322|70323|70324|70325 | U350: 1|1|1|1|1|1|1|1|1|1|1|1|1|1|1|1|1|1|1|1|1|1|1|1|1 | V350: =RC[-1] -> 1|1|1|1|1|1|1|1|1|1|1|1|1|1|1|1|1|1|1|1|1|1|1|1|1 | W350: 1|1|1|1|1|1|1|1|1|1|1|1|1|1|1|1|1|1|1|1|1|1|1|1|1 | AE350: 1 | AH350: 1 | AI350: 1
A351: 13057 | B351: 随机卡牌 | C351: 13071 | D351: 4 | E351: 2 | F351: 1 | G351: 1 | H351: 1 | I351: 10 | J351: 0 | K351: 0 | L351: 0 | N351: 0 | O351: 充满惊喜的宝箱，使用后获得随机橙品卡牌。 | P351: 999999 | Q351: 1 | R351: 0 | S351: 0 | T351: 70401|70402|70403|70404|70405|70406|70407|70408|70409|70410|70411|70412|70413|70414|70415|70416|70417|70418|70419|70420|70421|70422|70423|70424|70425 | U351: 1|1|1|1|1|1|1|1|1|1|1|1|1|1|1|1|1|1|1|1|1|1|1|1|1 | V351: =RC[-1] -> 1|1|1|1|1|1|1|1|1|1|1|1|1|1|1|1|1|1|1|1|1|1|1|1|1 | W351: 0|1|1|1|0|0|0|1|1|0|1|0|0|0|0|0|1|1|0|0|0|2|2|2|2 | AE351: 1 | AH351: 1 | AI351: 1
A352: 13058 | B352: 新年红包 | C352: 13006 | D352: 4 | E352: 2 | F352: 1 | G352: 1 | H352: 1 | I352: 10 | J352: 0 | K352: 0 | L352: 0 | M352: 20180221 | N352: 0 | O352: 打开可随机获得88~8888钻或其它珍稀道具，更有几率获得双份红包。 | P352: 999999 | Q352: 1 | R352: 0 | S352: 0 | T352: 13058|19005|19005|19005|19005|19005|19005|19005|19005|19005|10004|10004|10004|10004|10004|10010|10010|10010|10010|10014|10014|10014|10022|10022 | U352: 2|88|99|128|168|188|666|688|888|8888|8|18|28|68|88|18|28|68|88|8|18|88|8|18 | V352: =RC[-1] -> 2|88|99|128|168|188|666|688|888|8888|8|18|28|68|88|18|28|68|88|8|18|88|8|18 | W352: 500|3439|1000|400|300|200|100|50|10|1|300|400|200|80|20|400|400|100|100|800|190|10|900|100 | AG352: 1
A353: 13059 | B353: 特制扭蛋币礼盒 | C353: 13011 | D353: 4 | E353: 2 | F353: 1 | G353: 1 | H353: 1 | I353: 10 | J353: 0 | K353: 0 | L353: 0 | N353: 0 | O353: 打开可随机获得20~25个特制扭蛋币。 | P353: 999999 | Q353: 1 | R353: 0 | S353: 0 | T353: 10102 | U353: 20 | V353: 25 | W353: 1 | AG353: 1 | AH353: 1 | AI353: 1
A354: 13060 | B354: 特制扭蛋币礼盒 | C354: 13011 | D354: 4 | E354: 2 | F354: 1 | G354: 1 | H354: 1 | I354: 10 | J354: 0 | K354: 0 | L354: 0 | N354: 0 | O354: 打开可随机获得20~25个特制扭蛋币。 | P354: 999999 | Q354: 1 | R354: 0 | S354: 0 | T354: 10103 | U354: 20 | V354: 25 | W354: 1 | AG354: 1 | AH354: 1 | AI354: 1
A355: 13061 | B355: 橙品圣器碎片 | C355: 41401 | D355: 4 | E355: 2 | F355: 1 | G355: 1 | H355: 1 | I355: 10 | J355: 0 | K355: 0 | L355: 1 | N355: 0 | O355: 随机橙品圣器碎片。 | P355: 999999 | Q355: 13 | R355: 0 | S355: 0 | T355: 14401|14402|14403|14404|14405|14406|14407|14408|14409|14410|14411|14412|14413|14414|14415|14416|14417|14418|14419|14420|14421|14422|14423|14424|14425|14426|14427|14428|14429|14430|14431|14432|14433|14434|14435|14436|14437|14438|14439|14440 | U355: 1|1|1|1|1|1|1|1|1|1|1|1|1|1|1|1|1|1|1|1|1|1|1|1|1|1|1|1|1|1|1|1|1|1|1|1|1|1|1|1 | V355: =RC[-1] -> 1|1|1|1|1|1|1|1|1|1|1|1|1|1|1|1|1|1|1|1|1|1|1|1|1|1|1|1|1|1|1|1|1|1|1|1|1|1|1|1 | W355: 1|1|1|1|1|1|1|1|1|1|1|1|1|1|1|1|1|1|1|1|1|1|1|1|1|1|1|1|1|1|1|1|1|1|1|1|1|1|1|1 | AA355: 1
A356: 13062 | B356: 随机紫装碎片 | C356: 13020 | D356: 3 | E356: 2 | F356: 1 | G356: 1 | H356: 1 | I356: 10 | J356: 0 | K356: 0 | L356: 0 | N356: 0 | O356: 随机紫品装备碎片。 | P356: 999999 | Q356: 1 | R356: 0 | S356: 0 | T356: 11301|11302|11303|11304 | U356: 1|1|1|1 | V356: 1|1|1|1 | W356: 1|1|1|1 | AA356: 1 | AH356: 1 | AI356: 1
A357: 13063 | B357: 随机橙装碎片 | C357: 13020 | D357: 4 | E357: 2 | F357: 1 | G357: 1 | H357: 1 | I357: 10 | J357: 0 | K357: 0 | L357: 0 | N357: 0 | O357: 随机橙品装备碎片。 | P357: 999999 | Q357: 1 | R357: 0 | S357: 0 | T357: 11401|11402|11403|11404 | U357: 1|1|1|1 | V357: 1|1|1|1 | W357: 1|1|1|1 | AA357: 1 | AH357: 1 | AI357: 1
A358: 13064 | B358: 随机顶级圣器碎片 | C358: 13040 | D358: 5 | E358: 2 | F358: 1 | G358: 1 | H358: 1 | I358: 10 | J358: 0 | K358: 0 | L358: 0 | N358: 0 | O358: 打开随机获得一个顶级红品圣器碎片。 | P358: 999999 | Q358: 13 | R358: 0 | S358: 0 | T358: 14501|14502|14503|14504|14505|14506|14507|14508|14509|14510|14511|14512|14513|14514|14515|14516|14517|14518|14519|14520|14521|14522|14523|14524|14525|14526|14527|14528|14529|14530|14531|14532|14533|14534|14535|14536|14537|14538|14539|14540|14541|14542|14543|14544|14545|14546|14547|14548 | U358: 1|1|1|1|1|1|1|1|1|1|1|1|1|1|1|1|1|1|1|1|1|1|1|1|1|1|1|1|1|1|1|1|1|1|1|1|1|1|1|1|1|1|1|1|1|1|1|1 | V358: =RC[-1] -> 1|1|1|1|1|1|1|1|1|1|1|1|1|1|1|1|1|1|1|1|1|1|1|1|1|1|1|1|1|1|1|1|1|1|1|1|1|1|1|1|1|1|1|1|1|1|1|1 | W358: 1|1|1|1|1|1|1|1|1|1|1|1|1|1|1|1|1|1|1|1|1|1|1|1|1|1|1|1|1|1|1|1|1|1|1|1|1|1|1|1|1|1|1|1|1|1|1|1 | AA358: 1 | AH358: 1 | AI358: 1
A359: 13065 | B359: 随机卡牌 | C359: 13072 | D359: 2 | E359: 2 | F359: 1 | G359: 1 | H359: 1 | I359: 10 | J359: 0 | K359: 0 | L359: 0 | N359: 0 | O359: 充满惊喜的宝箱，使用后获得随机蓝品卡牌。 | P359: 999999 | Q359: 1 | R359: 0 | S359: 0 | T359: 70201|70202|70203|70204|70205|70206|70207|70208|70209|70210|70211|70212|70213|70214|70215|70216|70217|70218|70219|70220|70221|70222|70223|70224|70225 | U359: 1|1|1|1|1|1|1|1|1|1|1|1|1|1|1|1|1|1|1|1|1|1|1|1|1 | V359: =RC[-1] -> 1|1|1|1|1|1|1|1|1|1|1|1|1|1|1|1|1|1|1|1|1|1|1|1|1 | W359: 1|1|1|1|1|1|1|1|1|1|1|1|1|1|1|1|1|1|1|1|1|1|1|1|1 | AE359: 1 | AH359: 1 | AI359: 1
A360: 13090 | B360: 翻牌宝箱1 | C360: 13000 | D360: 1 | E360: 2 | F360: 1 | G360: 1 | H360: 1 | I360: 10 | J360: 0 | K360: 0 | L360: 1 | N360: 0 | O360: 1~10 | P360: 999999 | Q360: 1 | R360: 0 | S360: 0 | T360: 19003|19005|10000|10001|10002|10018|12200|12201|12202|12203|12204|12230|12231|12232|12233|12234|12260|12261|12262|12263|12264|12300|12301|12302|12303|12304|12330|12331|12332|12333|12334|12360|12361|12362|12363|12364|12305|12306|12335|12336|12365|12366|12400|12401|12402|12403|12404|12405|12406|12407|12409|12411|12430|12431|12432|12433|12434|12435|12436|12437|12439|12441|12460|12461|12462|12463|12464|12465|12466|12467|12469|12471|12408|12410|12412|12413|12438|12440|12442|12443|12468|12470|12472|12473 | U360: 950|10|1|1|1|1|1|1|1|1|1|1|1|1|1|1|1|1|1|1|1|1|1|1|1|1|1|1|1|1|1|1|1|1|1|1|1|1|1|1|1|1|1|1|1|1|1|1|1|1|1|1|1|1|1|1|1|1|1|1|1|1|1|1|1|1|1|1|1|1|1|1|1|1|1|1|1|1|1|1|1|1|1|1 | V360: 1050|10|1|1|1|1|1|1|1|1|1|1|1|1|1|1|1|1|1|1|1|1|1|1|1|1|1|1|1|1|1|1|1|1|1|1|1|1|1|1|1|1|1|1|1|1|1|1|1|1|1|1|1|1|1|1|1|1|1|1|1|1|1|1|1|1|1|1|1|1|1|1|1|1|1|1|1|1|1|1|1|1|1|1 | W360: 31350|31350|2508|2508|31350|3135|15675|15675|15675|15675|15675|15675|15675|15675|15675|15675|15675|15675|15675|15675|15675|3135|3135|3135|3135|3135|3135|3135|3135|3135|3135|3135|3135|3135|3135|3135|2850|2850|2850|2850|2850|2850|2090|2090|2090|2090|2090|2090|2090|2090|2090|2090|2090|2090|2090|2090|2090|2090|2090|2090|2090|2090|2090|2090|2090|2090|2090|2090|2090|2090|2090|2090|314|314|314|314|314|314|314|314|314|314|314|314
A361: 13091 | B361: 翻牌宝箱2 | C361: 13000 | D361: 1 | E361: 2 | F361: 1 | G361: 1 | H361: 1 | I361: 10 | J361: 0 | K361: 0 | L361: 1 | N361: 0 | O361: 11~20 | P361: 999999 | Q361: 1 | R361: 0 | S361: 0 | T361: 19003|19005|10000|10001|10002|10003|10018|12200|12201|12202|12203|12204|12230|12231|12232|12233|12234|12260|12261|12262|12263|12264|12300|12301|12302|12303|12304|12330|12331|12332|12333|12334|12360|12361|12362|12363|12364|12305|12306|12335|12336|12365|12366|12400|12401|12402|12403|12404|12405|12406|12407|12409|12411|12430|12431|12432|12433|12434|12435|12436|12437|12439|12441|12460|12461|12462|12463|12464|12465|12466|12467|12469|12471|12408|12410|12412|12413|12438|12440|12442|12443|12468|12470|12472|12473 | U361: 1050|10|1|1|1|1|1|1|1|1|1|1|1|1|1|1|1|1|1|1|1|1|1|1|1|1|1|1|1|1|1|1|1|1|1|1|1|1|1|1|1|1|1|1|1|1|1|1|1|1|1|1|1|1|1|1|1|1|1|1|1|1|1|1|1|1|1|1|1|1|1|1|1|1|1|1|1|1|1|1|1|1|1|1|1 | V361: 1150|10|1|1|1|1|1|1|1|1|1|1|1|1|1|1|1|1|1|1|1|1|1|1|1|1|1|1|1|1|1|1|1|1|1|1|1|1|1|1|1|1|1|1|1|1|1|1|1|1|1|1|1|1|1|1|1|1|1|1|1|1|1|1|1|1|1|1|1|1|1|1|1|1|1|1|1|1|1|1|1|1|1|1|1 | W361: 31350|31350|2508|2508|31350|20900|3135|15675|15675|15675|15675|15675|15675|15675|15675|15675|15675|15675|15675|15675|15675|15675|3135|3135|3135|3135|3135|3135|3135|3135|3135|3135|3135|3135|3135|3135|3135|2850|2850|2850|2850|2850|2850|2090|2090|2090|2090|2090|2090|2090|2090|2090|2090|2090|2090|2090|2090|2090|2090|2090|2090|2090|2090|2090|2090|2090|2090|2090|2090|2090|2090|2090|2090|314|314|314|314|314|314|314|314|314|314|314|314
A362: 13092 | B362: 翻牌宝箱3 | C362: 13000 | D362: 1 | E362: 2 | F362: 1 | G362: 1 | H362: 1 | I362: 10 | J362: 0 | K362: 0 | L362: 1 | N362: 0 | O362: 21~30 | P362: 999999 | Q362: 1 | R362: 0 | S362: 0 | T362: 19003|19005|10000|10001|10002|10003|10018|12200|12201|12202|12203|12204|12230|12231|12232|12233|12234|12260|12261|12262|12263|12264|12300|12301|12302|12303|12304|12330|12331|12332|12333|12334|12360|12361|12362|12363|12364|12305|12306|12335|12336|12365|12366|12400|12401|12402|12403|12404|12405|12406|12407|12409|12411|12430|12431|12432|12433|12434|12435|12436|12437|12439|12441|12460|12461|12462|12463|12464|12465|12466|12467|12469|12471|12408|12410|12412|12413|12438|12440|12442|12443|12468|12470|12472|12473|14201|14202|14203|14204|14205|14206|14207|14208|14209|14301|14302|14303|14304|14305|14306|14307|14308|14309|14310|14311|14312|14313|14314|14315|14316|14317|14318|14319|14320|14321|14322|14323|14324|14325|14326|14327|14328|14329|14330|14331|14332|14333|14334|14335|14336|14401|14402|14403|14404|14405|14406|14407|14408|14409|14410|14411|14412|14413|14414|14415|14416|14417|14418|14419|14420|14421|14422|14423|14424|14425|14426|14427|14428|14429|14430|14431|14432|14433|14434|14435|14436|14437|14438|14439|14440 | U362: 1150|10|1|1|1|1|1|1|1|1|1|1|1|1|1|1|1|1|1|1|1|1|1|1|1|1|1|1|1|1|1|1|1|1|1|1|1|1|1|1|1|1|1|1|1|1|1|1|1|1|1|1|1|1|1|1|1|1|1|1|1|1|1|1|1|1|1|1|1|1|1|1|1|1|1|1|1|1|1|1|1|1|1|1|1|1|1|1|1|1|1|1|1|1|1|1|1|1|1|1|1|1|1|1|1|1|1|1|1|1|1|1|1|1|1|1|1|1|1|1|1|1|1|1|1|1|1|1|1|1|1|1|1|1|1|1|1|1|1|1|1|1|1|1|1|1|1|1|1|1|1|1|1|1|1|1|1|1|1|1|1|1|1|1|1|1|1|1|1|1 | V362: 1250|10|1|1|1|1|1|1|1|1|1|1|1|1|1|1|1|1|1|1|1|1|1|1|1|1|1|1|1|1|1|1|1|1|1|1|1|1|1|1|1|1|1|1|1|1|1|1|1|1|1|1|1|1|1|1|1|1|1|1|1|1|1|1|1|1|1|1|1|1|1|1|1|1|1|1|1|1|1|1|1|1|1|1|1|1|1|1|1|1|1|1|1|1|1|1|1|1|1|1|1|1|1|1|1|1|1|1|1|1|1|1|1|1|1|1|1|1|1|1|1|1|1|1|1|1|1|1|1|1|1|1|1|1|1|1|1|1|1|1|1|1|1|1|1|1|1|1|1|1|1|1|1|1|1|1|1|1|1|1|1|1|1|1|1|1|1|1|1|1 | W362: 31350|31350|2508|2508|31350|20900|3135|15675|15675|15675|15675|15675|15675|15675|15675|15675|15675|15675|15675|15675|15675|15675|3135|3135|3135|3135|3135|3135|3135|3135|3135|3135|3135|3135|3135|3135|3135|2850|2850|2850|2850|2850|2850|2090|2090|2090|2090|2090|2090|2090|2090|2090|2090|2090|2090|2090|2090|2090|2090|2090|2090|2090|2090|2090|2090|2090|2090|2090|2090|2090|2090|2090|2090|314|314|314|314|314|314|314|314|314|314|314|314|31350|31350|31350|31350|31350|31350|31350|31350|31350|330|330|330|330|330|330|330|330|330|330|330|330|330|330|330|330|330|330|330|330|330|330|330|330|330|330|330|330|330|330|330|330|330|330|330|330|165|165|165|165|165|165|165|165|165|165|165|165|165|165|165|165|165|165|165|165|165|165|165|165|165|165|165|165|165|165|165|165|165|165|165|165|165|165|165|165
A363: 13093 | B363: 翻牌宝箱4 | C363: 13000 | D363: 1 | E363: 2 | F363: 1 | G363: 1 | H363: 1 | I363: 10 | J363: 0 | K363: 0 | L363: 1 | N363: 0 | O363: 31~40 | P363: 999999 | Q363: 1 | R363: 0 | S363: 0 | T363: 19003|19005|10000|10001|10002|10003|10011|10012|10013|10014|10018|12200|12201|12202|12203|12204|12230|12231|12232|12233|12234|12260|12261|12262|12263|12264|12300|12301|12302|12303|12304|12330|12331|12332|12333|12334|12360|12361|12362|12363|12364|12305|12306|12335|12336|12365|12366|12400|12401|12402|12403|12404|12405|12406|12407|12409|12411|12430|12431|12432|12433|12434|12435|12436|12437|12439|12441|12460|12461|12462|12463|12464|12465|12466|12467|12469|12471|12408|12410|12412|12413|12438|12440|12442|12443|12468|12470|12472|12473|14201|14202|14203|14204|14205|14206|14207|14208|14209|14301|14302|14303|14304|14305|14306|14307|14308|14309|14310|14311|14312|14313|14314|14315|14316|14317|14318|14319|14320|14321|14322|14323|14324|14325|14326|14327|14328|14329|14330|14331|14332|14333|14334|14335|14336|14401|14402|14403|14404|14405|14406|14407|14408|14409|14410|14411|14412|14413|14414|14415|14416|14417|14418|14419|14420|14421|14422|14423|14424|14425|14426|14427|14428|14429|14430|14431|14432|14433|14434|14435|14436|14437|14438|14439|14440 | U363: 1250|10|1|1|1|1|1|1|1|1|1|1|1|1|1|1|1|1|1|1|1|1|1|1|1|1|1|1|1|1|1|1|1|1|1|1|1|1|1|1|1|1|1|1|1|1|1|1|1|1|1|1|1|1|1|1|1|1|1|1|1|1|1|1|1|1|1|1|1|1|1|1|1|1|1|1|1|1|1|1|1|1|1|1|1|1|1|1|1|1|1|1|1|1|1|1|1|1|1|1|1|1|1|1|1|1|1|1|1|1|1|1|1|1|1|1|1|1|1|1|1|1|1|1|1|1|1|1|1|1|1|1|1|1|1|1|1|1|1|1|1|1|1|1|1|1|1|1|1|1|1|1|1|1|1|1|1|1|1|1|1|1|1|1|1|1|1|1|1|1|1|1|1|1 | V363: 1350|10|1|1|1|1|1|1|1|1|1|1|1|1|1|1|1|1|1|1|1|1|1|1|1|1|1|1|1|1|1|1|1|1|1|1|1|1|1|1|1|1|1|1|1|1|1|1|1|1|1|1|1|1|1|1|1|1|1|1|1|1|1|1|1|1|1|1|1|1|1|1|1|1|1|1|1|1|1|1|1|1|1|1|1|1|1|1|1|1|1|1|1|1|1|1|1|1|1|1|1|1|1|1|1|1|1|1|1|1|1|1|1|1|1|1|1|1|1|1|1|1|1|1|1|1|1|1|1|1|1|1|1|1|1|1|1|1|1|1|1|1|1|1|1|1|1|1|1|1|1|1|1|1|1|1|1|1|1|1|1|1|1|1|1|1|1|1|1|1|1|1|1|1 | W363: 31350|31350|2508|2508|31350|20900|31350|15675|6270|3135|3135|15675|15675|15675|15675|15675|15675|15675|15675|15675|15675|15675|15675|15675|15675|15675|3135|3135|3135|3135|3135|3135|3135|3135|3135|3135|3135|3135|3135|3135|3135|2850|2850|2850|2850|2850|2850|2090|2090|2090|2090|2090|2090|2090|2090|2090|2090|2090|2090|2090|2090|2090|2090|2090|2090|2090|2090|2090|2090|2090|2090|2090|2090|2090|2090|2090|2090|314|314|314|314|314|314|314|314|314|314|314|314|31350|31350|31350|31350|31350|31350|31350|31350|31350|330|330|330|330|330|330|330|330|330|330|330|330|330|330|330|330|330|330|330|330|330|330|330|330|330|330|330|330|330|330|330|330|330|330|330|330|165|165|165|165|165|165|165|165|165|165|165|165|165|165|165|165|165|165|165|165|165|165|165|165|165|165|165|165|165|165|165|165|165|165|165|165|165|165|165|165
A364: 13094 | B364: 翻牌宝箱5 | C364: 13000 | D364: 1 | E364: 2 | F364: 1 | G364: 1 | H364: 1 | I364: 10 | J364: 0 | K364: 0 | L364: 1 | N364: 0 | O364: 41~50 | P364: 999999 | Q364: 1 | R364: 0 | S364: 0 | T364: 19003|19005|10000|10001|10002|10003|10004|10010|10011|10012|10013|10014|10018|12200|12201|12202|12203|12204|12230|12231|12232|12233|12234|12260|12261|12262|12263|12264|12300|12301|12302|12303|12304|12330|12331|12332|12333|12334|12360|12361|12362|12363|12364|12305|12306|12335|12336|12365|12366|12400|12401|12402|12403|12404|12405|12406|12407|12409|12411|12430|12431|12432|12433|12434|12435|12436|12437|12439|12441|12460|12461|12462|12463|12464|12465|12466|12467|12469|12471|12408|12410|12412|12413|12438|12440|12442|12443|12468|12470|12472|12473|14201|14202|14203|14204|14205|14206|14207|14208|14209|14301|14302|14303|14304|14305|14306|14307|14308|14309|14310|14311|14312|14313|14314|14315|14316|14317|14318|14319|14320|14321|14322|14323|14324|14325|14326|14327|14328|14329|14330|14331|14332|14333|14334|14335|14336|14401|14402|14403|14404|14405|14406|14407|14408|14409|14410|14411|14412|14413|14414|14415|14416|14417|14418|14419|14420|14421|14422|14423|14424|14425|14426|14427|14428|14429|14430|14431|14432|14433|14434|14435|14436|14437|14438|14439|14440 | U364: 1350|10|1|1|1|1|1|1|1|1|1|1|1|1|1|1|1|1|1|1|1|1|1|1|1|1|1|1|1|1|1|1|1|1|1|1|1|1|1|1|1|1|1|1|1|1|1|1|1|1|1|1|1|1|1|1|1|1|1|1|1|1|1|1|1|1|1|1|1|1|1|1|1|1|1|1|1|1|1|1|1|1|1|1|1|1|1|1|1|1|1|1|1|1|1|1|1|1|1|1|1|1|1|1|1|1|1|1|1|1|1|1|1|1|1|1|1|1|1|1|1|1|1|1|1|1|1|1|1|1|1|1|1|1|1|1|1|1|1|1|1|1|1|1|1|1|1|1|1|1|1|1|1|1|1|1|1|1|1|1|1|1|1|1|1|1|1|1|1|1|1|1|1|1|1|1 | V364: 1450|10|1|1|1|1|1|1|1|1|1|1|1|1|1|1|1|1|1|1|1|1|1|1|1|1|1|1|1|1|1|1|1|1|1|1|1|1|1|1|1|1|1|1|1|1|1|1|1|1|1|1|1|1|1|1|1|1|1|1|1|1|1|1|1|1|1|1|1|1|1|1|1|1|1|1|1|1|1|1|1|1|1|1|1|1|1|1|1|1|1|1|1|1|1|1|1|1|1|1|1|1|1|1|1|1|1|1|1|1|1|1|1|1|1|1|1|1|1|1|1|1|1|1|1|1|1|1|1|1|1|1|1|1|1|1|1|1|1|1|1|1|1|1|1|1|1|1|1|1|1|1|1|1|1|1|1|1|1|1|1|1|1|1|1|1|1|1|1|1|1|1|1|1|1|1 | W364: 31350|31350|2508|2508|31350|20900|8360|12540|31350|15675|6270|3135|3135|15675|15675|15675|15675|15675|15675|15675|15675|15675|15675|15675|15675|15675|15675|15675|3135|3135|3135|3135|3135|3135|3135|3135|3135|3135|3135|3135|3135|3135|3135|2850|2850|2850|2850|2850|2850|2090|2090|2090|2090|2090|2090|2090|2090|2090|2090|2090|2090|2090|2090|2090|2090|2090|2090|2090|2090|2090|2090|2090|2090|2090|2090|2090|2090|2090|2090|314|314|314|314|314|314|314|314|314|314|314|314|31350|31350|31350|31350|31350|31350|31350|31350|31350|330|330|330|330|330|330|330|330|330|330|330|330|330|330|330|330|330|330|330|330|330|330|330|330|330|330|330|330|330|330|330|330|330|330|330|330|165|165|165|165|165|165|165|165|165|165|165|165|165|165|165|165|165|165|165|165|165|165|165|165|165|165|165|165|165|165|165|165|165|165|165|165|165|165|165|165
A365: 13095 | B365: 翻牌宝箱6 | C365: 13000 | D365: 1 | E365: 2 | F365: 1 | G365: 1 | H365: 1 | I365: 10 | J365: 0 | K365: 0 | L365: 1 | N365: 0 | O365: 51~60 | P365: 999999 | Q365: 1 | R365: 0 | S365: 0 | T365: 19003|19005|10000|10001|10002|10003|10004|10010|10011|10012|10013|10014|10018|12200|12201|12202|12203|12204|12230|12231|12232|12233|12234|12260|12261|12262|12263|12264|12300|12301|12302|12303|12304|12330|12331|12332|12333|12334|12360|12361|12362|12363|12364|12305|12306|12335|12336|12365|12366|12400|12401|12402|12403|12404|12405|12406|12407|12409|12411|12430|12431|12432|12433|12434|12435|12436|12437|12439|12441|12460|12461|12462|12463|12464|12465|12466|12467|12469|12471|12408|12410|12412|12413|12438|12440|12442|12443|12468|12470|12472|12473|14201|14202|14203|14204|14205|14206|14207|14208|14209|14301|14302|14303|14304|14305|14306|14307|14308|14309|14310|14311|14312|14313|14314|14315|14316|14317|14318|14319|14320|14321|14322|14323|14324|14325|14326|14327|14328|14329|14330|14331|14332|14333|14334|14335|14336|14401|14402|14403|14404|14405|14406|14407|14408|14409|14410|14411|14412|14413|14414|14415|14416|14417|14418|14419|14420|14421|14422|14423|14424|14425|14426|14427|14428|14429|14430|14431|14432|14433|14434|14435|14436|14437|14438|14439|14440 | U365: 1450|10|1|1|1|1|1|1|1|1|1|1|1|1|1|1|1|1|1|1|1|1|1|1|1|1|1|1|1|1|1|1|1|1|1|1|1|1|1|1|1|1|1|1|1|1|1|1|1|1|1|1|1|1|1|1|1|1|1|1|1|1|1|1|1|1|1|1|1|1|1|1|1|1|1|1|1|1|1|1|1|1|1|1|1|1|1|1|1|1|1|1|1|1|1|1|1|1|1|1|1|1|1|1|1|1|1|1|1|1|1|1|1|1|1|1|1|1|1|1|1|1|1|1|1|1|1|1|1|1|1|1|1|1|1|1|1|1|1|1|1|1|1|1|1|1|1|1|1|1|1|1|1|1|1|1|1|1|1|1|1|1|1|1|1|1|1|1|1|1|1|1|1|1|1|1 | V365: 1550|10|1|1|1|1|1|1|1|1|1|1|1|1|1|1|1|1|1|1|1|1|1|1|1|1|1|1|1|1|1|1|1|1|1|1|1|1|1|1|1|1|1|1|1|1|1|1|1|1|1|1|1|1|1|1|1|1|1|1|1|1|1|1|1|1|1|1|1|1|1|1|1|1|1|1|1|1|1|1|1|1|1|1|1|1|1|1|1|1|1|1|1|1|1|1|1|1|1|1|1|1|1|1|1|1|1|1|1|1|1|1|1|1|1|1|1|1|1|1|1|1|1|1|1|1|1|1|1|1|1|1|1|1|1|1|1|1|1|1|1|1|1|1|1|1|1|1|1|1|1|1|1|1|1|1|1|1|1|1|1|1|1|1|1|1|1|1|1|1|1|1|1|1|1|1 | W365: 31350|31350|2508|2508|31350|20900|8360|12540|31350|15675|6270|3135|3135|15675|15675|15675|15675|15675|15675|15675|15675|15675|15675|15675|15675|15675|15675|15675|3135|3135|3135|3135|3135|3135|3135|3135|3135|3135|3135|3135|3135|3135|3135|2850|2850|2850|2850|2850|2850|2090|2090|2090|2090|2090|2090|2090|2090|2090|2090|2090|2090|2090|2090|2090|2090|2090|2090|2090|2090|2090|2090|2090|2090|2090|2090|2090|2090|2090|2090|314|314|314|314|314|314|314|314|314|314|314|314|31350|31350|31350|31350|31350|31350|31350|31350|31350|330|330|330|330|330|330|330|330|330|330|330|330|330|330|330|330|330|330|330|330|330|330|330|330|330|330|330|330|330|330|330|330|330|330|330|330|165|165|165|165|165|165|165|165|165|165|165|165|165|165|165|165|165|165|165|165|165|165|165|165|165|165|165|165|165|165|165|165|165|165|165|165|165|165|165|165
A366: 13096 | B366: 翻牌宝箱7 | C366: 13000 | D366: 1 | E366: 2 | F366: 1 | G366: 1 | H366: 1 | I366: 10 | J366: 0 | K366: 0 | L366: 1 | N366: 0 | O366: 61~70 | P366: 999999 | Q366: 1 | R366: 0 | S366: 0 | T366: 19003|19005|10000|10001|10002|10003|10004|10010|10011|10012|10013|10014|10018|12200|12201|12202|12203|12204|12230|12231|12232|12233|12234|12260|12261|12262|12263|12264|12300|12301|12302|12303|12304|12330|12331|12332|12333|12334|12360|12361|12362|12363|12364|12305|12306|12335|12336|12365|12366|12400|12401|12402|12403|12404|12405|12406|12407|12409|12411|12430|12431|12432|12433|12434|12435|12436|12437|12439|12441|12460|12461|12462|12463|12464|12465|12466|12467|12469|12471|12408|12410|12412|12413|12438|12440|12442|12443|12468|12470|12472|12473|14201|14202|14203|14204|14205|14206|14207|14208|14209|14301|14302|14303|14304|14305|14306|14307|14308|14309|14310|14311|14312|14313|14314|14315|14316|14317|14318|14319|14320|14321|14322|14323|14324|14325|14326|14327|14328|14329|14330|14331|14332|14333|14334|14335|14336|14401|14402|14403|14404|14405|14406|14407|14408|14409|14410|14411|14412|14413|14414|14415|14416|14417|14418|14419|14420|14421|14422|14423|14424|14425|14426|14427|14428|14429|14430|14431|14432|14433|14434|14435|14436|14437|14438|14439|14440 | U366: 1550|10|1|1|1|1|1|1|1|1|1|1|1|1|1|1|1|1|1|1|1|1|1|1|1|1|1|1|1|1|1|1|1|1|1|1|1|1|1|1|1|1|1|1|1|1|1|1|1|1|1|1|1|1|1|1|1|1|1|1|1|1|1|1|1|1|1|1|1|1|1|1|1|1|1|1|1|1|1|1|1|1|1|1|1|1|1|1|1|1|1|1|1|1|1|1|1|1|1|1|1|1|1|1|1|1|1|1|1|1|1|1|1|1|1|1|1|1|1|1|1|1|1|1|1|1|1|1|1|1|1|1|1|1|1|1|1|1|1|1|1|1|1|1|1|1|1|1|1|1|1|1|1|1|1|1|1|1|1|1|1|1|1|1|1|1|1|1|1|1|1|1|1|1|1|1 | V366: 1650|10|1|1|1|1|1|1|1|1|1|1|1|1|1|1|1|1|1|1|1|1|1|1|1|1|1|1|1|1|1|1|1|1|1|1|1|1|1|1|1|1|1|1|1|1|1|1|1|1|1|1|1|1|1|1|1|1|1|1|1|1|1|1|1|1|1|1|1|1|1|1|1|1|1|1|1|1|1|1|1|1|1|1|1|1|1|1|1|1|1|1|1|1|1|1|1|1|1|1|1|1|1|1|1|1|1|1|1|1|1|1|1|1|1|1|1|1|1|1|1|1|1|1|1|1|1|1|1|1|1|1|1|1|1|1|1|1|1|1|1|1|1|1|1|1|1|1|1|1|1|1|1|1|1|1|1|1|1|1|1|1|1|1|1|1|1|1|1|1|1|1|1|1|1|1 | W366: 31350|31350|2508|2508|31350|20900|8360|12540|31350|15675|6270|3135|3135|15675|15675|15675|15675|15675|15675|15675|15675|15675|15675|15675|15675|15675|15675|15675|3135|3135|3135|3135|3135|3135|3135|3135|3135|3135|3135|3135|3135|3135|3135|2850|2850|2850|2850|2850|2850|2090|2090|2090|2090|2090|2090|2090|2090|2090|2090|2090|2090|2090|2090|2090|2090|2090|2090|2090|2090|2090|2090|2090|2090|2090|2090|2090|2090|2090|2090|314|314|314|314|314|314|314|314|314|314|314|314|31350|31350|31350|31350|31350|31350|31350|31350|31350|330|330|330|330|330|330|330|330|330|330|330|330|330|330|330|330|330|330|330|330|330|330|330|330|330|330|330|330|330|330|330|330|330|330|330|330|165|165|165|165|165|165|165|165|165|165|165|165|165|165|165|165|165|165|165|165|165|165|165|165|165|165|165|165|165|165|165|165|165|165|165|165|165|165|165|165
A367: 13097 | B367: 翻牌宝箱8 | C367: 13000 | D367: 1 | E367: 2 | F367: 1 | G367: 1 | H367: 1 | I367: 10 | J367: 0 | K367: 0 | L367: 1 | N367: 0 | O367: 71~80 | P367: 999999 | Q367: 1 | R367: 0 | S367: 0 | T367: 19003|19005|10000|10001|10002|10003|10004|10010|10011|10012|10013|10014|10018|12200|12201|12202|12203|12204|12230|12231|12232|12233|12234|12260|12261|12262|12263|12264|12300|12301|12302|12303|12304|12330|12331|12332|12333|12334|12360|12361|12362|12363|12364|12305|12306|12335|12336|12365|12366|12400|12401|12402|12403|12404|12405|12406|12407|12409|12411|12430|12431|12432|12433|12434|12435|12436|12437|12439|12441|12460|12461|12462|12463|12464|12465|12466|12467|12469|12471|12408|12410|12412|12413|12438|12440|12442|12443|12468|12470|12472|12473|14201|14202|14203|14204|14205|14206|14207|14208|14209|14301|14302|14303|14304|14305|14306|14307|14308|14309|14310|14311|14312|14313|14314|14315|14316|14317|14318|14319|14320|14321|14322|14323|14324|14325|14326|14327|14328|14329|14330|14331|14332|14333|14334|14335|14336|14401|14402|14403|14404|14405|14406|14407|14408|14409|14410|14411|14412|14413|14414|14415|14416|14417|14418|14419|14420|14421|14422|14423|14424|14425|14426|14427|14428|14429|14430|14431|14432|14433|14434|14435|14436|14437|14438|14439|14440 | U367: 1650|10|1|1|1|1|1|1|1|1|1|1|1|1|1|1|1|1|1|1|1|1|1|1|1|1|1|1|1|1|1|1|1|1|1|1|1|1|1|1|1|1|1|1|1|1|1|1|1|1|1|1|1|1|1|1|1|1|1|1|1|1|1|1|1|1|1|1|1|1|1|1|1|1|1|1|1|1|1|1|1|1|1|1|1|1|1|1|1|1|1|1|1|1|1|1|1|1|1|1|1|1|1|1|1|1|1|1|1|1|1|1|1|1|1|1|1|1|1|1|1|1|1|1|1|1|1|1|1|1|1|1|1|1|1|1|1|1|1|1|1|1|1|1|1|1|1|1|1|1|1|1|1|1|1|1|1|1|1|1|1|1|1|1|1|1|1|1|1|1|1|1|1|1|1|1 | V367: 1750|10|1|1|1|1|1|1|1|1|1|1|1|1|1|1|1|1|1|1|1|1|1|1|1|1|1|1|1|1|1|1|1|1|1|1|1|1|1|1|1|1|1|1|1|1|1|1|1|1|1|1|1|1|1|1|1|1|1|1|1|1|1|1|1|1|1|1|1|1|1|1|1|1|1|1|1|1|1|1|1|1|1|1|1|1|1|1|1|1|1|1|1|1|1|1|1|1|1|1|1|1|1|1|1|1|1|1|1|1|1|1|1|1|1|1|1|1|1|1|1|1|1|1|1|1|1|1|1|1|1|1|1|1|1|1|1|1|1|1|1|1|1|1|1|1|1|1|1|1|1|1|1|1|1|1|1|1|1|1|1|1|1|1|1|1|1|1|1|1|1|1|1|1|1|1 | W367: 31350|31350|2508|2508|31350|20900|8360|12540|31350|15675|6270|3135|3135|15675|15675|15675|15675|15675|15675|15675|15675|15675|15675|15675|15675|15675|15675|15675|3135|3135|3135|3135|3135|3135|3135|3135|3135|3135|3135|3135|3135|3135|3135|2850|2850|2850|2850|2850|2850|2090|2090|2090|2090|2090|2090|2090|2090|2090|2090|2090|2090|2090|2090|2090|2090|2090|2090|2090|2090|2090|2090|2090|2090|2090|2090|2090|2090|2090|2090|314|314|314|314|314|314|314|314|314|314|314|314|31350|31350|31350|31350|31350|31350|31350|31350|31350|330|330|330|330|330|330|330|330|330|330|330|330|330|330|330|330|330|330|330|330|330|330|330|330|330|330|330|330|330|330|330|330|330|330|330|330|165|165|165|165|165|165|165|165|165|165|165|165|165|165|165|165|165|165|165|165|165|165|165|165|165|165|165|165|165|165|165|165|165|165|165|165|165|165|165|165
A368: 13098 | B368: 翻牌宝箱9 | C368: 13000 | D368: 1 | E368: 2 | F368: 1 | G368: 1 | H368: 1 | I368: 10 | J368: 0 | K368: 0 | L368: 1 | N368: 0 | O368: 81~90 | P368: 999999 | Q368: 1 | R368: 0 | S368: 0 | T368: 19003|19005|10000|10001|10002|10003|10004|10010|10011|10012|10013|10014|10018|12200|12201|12202|12203|12204|12230|12231|12232|12233|12234|12260|12261|12262|12263|12264|12300|12301|12302|12303|12304|12330|12331|12332|12333|12334|12360|12361|12362|12363|12364|12305|12306|12335|12336|12365|12366|12400|12401|12402|12403|12404|12405|12406|12407|12409|12411|12430|12431|12432|12433|12434|12435|12436|12437|12439|12441|12460|12461|12462|12463|12464|12465|12466|12467|12469|12471|12408|12410|12412|12413|12438|12440|12442|12443|12468|12470|12472|12473|14201|14202|14203|14204|14205|14206|14207|14208|14209|14301|14302|14303|14304|14305|14306|14307|14308|14309|14310|14311|14312|14313|14314|14315|14316|14317|14318|14319|14320|14321|14322|14323|14324|14325|14326|14327|14328|14329|14330|14331|14332|14333|14334|14335|14336|14401|14402|14403|14404|14405|14406|14407|14408|14409|14410|14411|14412|14413|14414|14415|14416|14417|14418|14419|14420|14421|14422|14423|14424|14425|14426|14427|14428|14429|14430|14431|14432|14433|14434|14435|14436|14437|14438|14439|14440 | U368: 1750|10|1|1|1|1|1|1|1|1|1|1|1|1|1|1|1|1|1|1|1|1|1|1|1|1|1|1|1|1|1|1|1|1|1|1|1|1|1|1|1|1|1|1|1|1|1|1|1|1|1|1|1|1|1|1|1|1|1|1|1|1|1|1|1|1|1|1|1|1|1|1|1|1|1|1|1|1|1|1|1|1|1|1|1|1|1|1|1|1|1|1|1|1|1|1|1|1|1|1|1|1|1|1|1|1|1|1|1|1|1|1|1|1|1|1|1|1|1|1|1|1|1|1|1|1|1|1|1|1|1|1|1|1|1|1|1|1|1|1|1|1|1|1|1|1|1|1|1|1|1|1|1|1|1|1|1|1|1|1|1|1|1|1|1|1|1|1|1|1|1|1|1|1|1|1 | V368: 1850|10|1|1|1|1|1|1|1|1|1|1|1|1|1|1|1|1|1|1|1|1|1|1|1|1|1|1|1|1|1|1|1|1|1|1|1|1|1|1|1|1|1|1|1|1|1|1|1|1|1|1|1|1|1|1|1|1|1|1|1|1|1|1|1|1|1|1|1|1|1|1|1|1|1|1|1|1|1|1|1|1|1|1|1|1|1|1|1|1|1|1|1|1|1|1|1|1|1|1|1|1|1|1|1|1|1|1|1|1|1|1|1|1|1|1|1|1|1|1|1|1|1|1|1|1|1|1|1|1|1|1|1|1|1|1|1|1|1|1|1|1|1|1|1|1|1|1|1|1|1|1|1|1|1|1|1|1|1|1|1|1|1|1|1|1|1|1|1|1|1|1|1|1|1|1 | W368: 31350|31350|2508|2508|31350|20900|8360|12540|31350|15675|6270|3135|3135|15675|15675|15675|15675|15675|15675|15675|15675|15675|15675|15675|15675|15675|15675|15675|3135|3135|3135|3135|3135|3135|3135|3135|3135|3135|3135|3135|3135|3135|3135|2850|2850|2850|2850|2850|2850|2090|2090|2090|2090|2090|2090|2090|2090|2090|2090|2090|2090|2090|2090|2090|2090|2090|2090|2090|2090|2090|2090|2090|2090|2090|2090|2090|2090|2090|2090|314|314|314|314|314|314|314|314|314|314|314|314|31350|31350|31350|31350|31350|31350|31350|31350|31350|330|330|330|330|330|330|330|330|330|330|330|330|330|330|330|330|330|330|330|330|330|330|330|330|330|330|330|330|330|330|330|330|330|330|330|330|165|165|165|165|165|165|165|165|165|165|165|165|165|165|165|165|165|165|165|165|165|165|165|165|165|165|165|165|165|165|165|165|165|165|165|165|165|165|165|165
A369: 13099 | B369: 翻牌宝箱10 | C369: 13000 | D369: 1 | E369: 2 | F369: 1 | G369: 1 | H369: 1 | I369: 10 | J369: 0 | K369: 0 | L369: 1 | N369: 0 | O369: 91~100 | P369: 999999 | Q369: 1 | R369: 0 | S369: 0 | T369: 19003|19005|10000|10001|10002|10003|10004|10010|10011|10012|10013|10014|10018|12200|12201|12202|12203|12204|12230|12231|12232|12233|12234|12260|12261|12262|12263|12264|12300|12301|12302|12303|12304|12330|12331|12332|12333|12334|12360|12361|12362|12363|12364|12305|12306|12335|12336|12365|12366|12400|12401|12402|12403|12404|12405|12406|12407|12409|12411|12430|12431|12432|12433|12434|12435|12436|12437|12439|12441|12460|12461|12462|12463|12464|12465|12466|12467|12469|12471|12408|12410|12412|12413|12438|12440|12442|12443|12468|12470|12472|12473|14201|14202|14203|14204|14205|14206|14207|14208|14209|14301|14302|14303|14304|14305|14306|14307|14308|14309|14310|14311|14312|14313|14314|14315|14316|14317|14318|14319|14320|14321|14322|14323|14324|14325|14326|14327|14328|14329|14330|14331|14332|14333|14334|14335|14336|14401|14402|14403|14404|14405|14406|14407|14408|14409|14410|14411|14412|14413|14414|14415|14416|14417|14418|14419|14420|14421|14422|14423|14424|14425|14426|14427|14428|14429|14430|14431|14432|14433|14434|14435|14436|14437|14438|14439|14440 | U369: 1850|10|1|1|1|1|1|1|1|1|1|1|1|1|1|1|1|1|1|1|1|1|1|1|1|1|1|1|1|1|1|1|1|1|1|1|1|1|1|1|1|1|1|1|1|1|1|1|1|1|1|1|1|1|1|1|1|1|1|1|1|1|1|1|1|1|1|1|1|1|1|1|1|1|1|1|1|1|1|1|1|1|1|1|1|1|1|1|1|1|1|1|1|1|1|1|1|1|1|1|1|1|1|1|1|1|1|1|1|1|1|1|1|1|1|1|1|1|1|1|1|1|1|1|1|1|1|1|1|1|1|1|1|1|1|1|1|1|1|1|1|1|1|1|1|1|1|1|1|1|1|1|1|1|1|1|1|1|1|1|1|1|1|1|1|1|1|1|1|1|1|1|1|1|1|1 | V369: 1950|10|1|1|1|1|1|1|1|1|1|1|1|1|1|1|1|1|1|1|1|1|1|1|1|1|1|1|1|1|1|1|1|1|1|1|1|1|1|1|1|1|1|1|1|1|1|1|1|1|1|1|1|1|1|1|1|1|1|1|1|1|1|1|1|1|1|1|1|1|1|1|1|1|1|1|1|1|1|1|1|1|1|1|1|1|1|1|1|1|1|1|1|1|1|1|1|1|1|1|1|1|1|1|1|1|1|1|1|1|1|1|1|1|1|1|1|1|1|1|1|1|1|1|1|1|1|1|1|1|1|1|1|1|1|1|1|1|1|1|1|1|1|1|1|1|1|1|1|1|1|1|1|1|1|1|1|1|1|1|1|1|1|1|1|1|1|1|1|1|1|1|1|1|1|1 | W369: 31350|31350|2508|2508|31350|20900|8360|12540|31350|15675|6270|3135|3135|15675|15675|15675|15675|15675|15675|15675|15675|15675|15675|15675|15675|15675|15675|15675|3135|3135|3135|3135|3135|3135|3135|3135|3135|3135|3135|3135|3135|3135|3135|2850|2850|2850|2850|2850|2850|2090|2090|2090|2090|2090|2090|2090|2090|2090|2090|2090|2090|2090|2090|2090|2090|2090|2090|2090|2090|2090|2090|2090|2090|2090|2090|2090|2090|2090|2090|314|314|314|314|314|314|314|314|314|314|314|314|31350|31350|31350|31350|31350|31350|31350|31350|31350|330|330|330|330|330|330|330|330|330|330|330|330|330|330|330|330|330|330|330|330|330|330|330|330|330|330|330|330|330|330|330|330|330|330|330|330|165|165|165|165|165|165|165|165|165|165|165|165|165|165|165|165|165|165|165|165|165|165|165|165|165|165|165|165|165|165|165|165|165|165|165|165|165|165|165|165
A370: 13100 | B370: 翻牌宝箱11 | C370: 13000 | D370: 1 | E370: 2 | F370: 1 | G370: 1 | H370: 1 | I370: 10 | J370: 0 | K370: 0 | L370: 1 | N370: 0 | O370: 100~ | P370: 999999 | Q370: 1 | R370: 0 | S370: 0 | T370: 19003|19005|10000|10001|10002|10003|10004|10010|10011|10012|10013|10014|10018|12200|12201|12202|12203|12204|12230|12231|12232|12233|12234|12260|12261|12262|12263|12264|12300|12301|12302|12303|12304|12330|12331|12332|12333|12334|12360|12361|12362|12363|12364|12305|12306|12335|12336|12365|12366|12400|12401|12402|12403|12404|12405|12406|12407|12409|12411|12430|12431|12432|12433|12434|12435|12436|12437|12439|12441|12460|12461|12462|12463|12464|12465|12466|12467|12469|12471|12408|12410|12412|12413|12438|12440|12442|12443|12468|12470|12472|12473|14201|14202|14203|14204|14205|14206|14207|14208|14209|14301|14302|14303|14304|14305|14306|14307|14308|14309|14310|14311|14312|14313|14314|14315|14316|14317|14318|14319|14320|14321|14322|14323|14324|14325|14326|14327|14328|14329|14330|14331|14332|14333|14334|14335|14336|14401|14402|14403|14404|14405|14406|14407|14408|14409|14410|14411|14412|14413|14414|14415|14416|14417|14418|14419|14420|14421|14422|14423|14424|14425|14426|14427|14428|14429|14430|14431|14432|14433|14434|14435|14436|14437|14438|14439|14440 | U370: 1950|10|1|1|1|1|1|1|1|1|1|1|1|1|1|1|1|1|1|1|1|1|1|1|1|1|1|1|1|1|1|1|1|1|1|1|1|1|1|1|1|1|1|1|1|1|1|1|1|1|1|1|1|1|1|1|1|1|1|1|1|1|1|1|1|1|1|1|1|1|1|1|1|1|1|1|1|1|1|1|1|1|1|1|1|1|1|1|1|1|1|1|1|1|1|1|1|1|1|1|1|1|1|1|1|1|1|1|1|1|1|1|1|1|1|1|1|1|1|1|1|1|1|1|1|1|1|1|1|1|1|1|1|1|1|1|1|1|1|1|1|1|1|1|1|1|1|1|1|1|1|1|1|1|1|1|1|1|1|1|1|1|1|1|1|1|1|1|1|1|1|1|1|1|1|1 | V370: 2050|10|1|1|1|1|1|1|1|1|1|1|1|1|1|1|1|1|1|1|1|1|1|1|1|1|1|1|1|1|1|1|1|1|1|1|1|1|1|1|1|1|1|1|1|1|1|1|1|1|1|1|1|1|1|1|1|1|1|1|1|1|1|1|1|1|1|1|1|1|1|1|1|1|1|1|1|1|1|1|1|1|1|1|1|1|1|1|1|1|1|1|1|1|1|1|1|1|1|1|1|1|1|1|1|1|1|1|1|1|1|1|1|1|1|1|1|1|1|1|1|1|1|1|1|1|1|1|1|1|1|1|1|1|1|1|1|1|1|1|1|1|1|1|1|1|1|1|1|1|1|1|1|1|1|1|1|1|1|1|1|1|1|1|1|1|1|1|1|1|1|1|1|1|1|1 | W370: 31350|31350|2508|2508|31350|20900|8360|12540|31350|15675|6270|3135|3135|15675|15675|15675|15675|15675|15675|15675|15675|15675|15675|15675|15675|15675|15675|15675|3135|3135|3135|3135|3135|3135|3135|3135|3135|3135|3135|3135|3135|3135|3135|2850|2850|2850|2850|2850|2850|2090|2090|2090|2090|2090|2090|2090|2090|2090|2090|2090|2090|2090|2090|2090|2090|2090|2090|2090|2090|2090|2090|2090|2090|2090|2090|2090|2090|2090|2090|314|314|314|314|314|314|314|314|314|314|314|314|31350|31350|31350|31350|31350|31350|31350|31350|31350|330|330|330|330|330|330|330|330|330|330|330|330|330|330|330|330|330|330|330|330|330|330|330|330|330|330|330|330|330|330|330|330|330|330|330|330|165|165|165|165|165|165|165|165|165|165|165|165|165|165|165|165|165|165|165|165|165|165|165|165|165|165|165|165|165|165|165|165|165|165|165|165|165|165|165|165
A371: 13101 | B371: 组队BOSS宝箱 | C371: 13000 | D371: 1 | E371: 2 | F371: 1 | G371: 1 | H371: 1 | I371: 10 | J371: 0 | K371: 0 | L371: 1 | N371: 0 | O371: 组队2-BOSS宝箱1 | P371: 999999 | Q371: 1 | R371: 0 | S371: 0 | T371: 19103|19005|19030 | U371: 1|10|100 | V371: 5|50|500 | W371: 8|1|1
A372: 13102 | B372: 组队BOSS宝箱 | C372: 13000 | D372: 1 | E372: 2 | F372: 1 | G372: 1 | H372: 1 | I372: 10 | J372: 0 | K372: 0 | L372: 1 | N372: 0 | O372: 组队2-BOSS宝箱2 | P372: 999999 | Q372: 1 | R372: 0 | S372: 0 | T372: 19103|19005|19030|10101 | U372: 5|50|500|1 | V372: 10|100|1000|1 | W372: 7|1|1|1
A373: 13103 | B373: 组队BOSS宝箱 | C373: 13000 | D373: 1 | E373: 2 | F373: 1 | G373: 1 | H373: 1 | I373: 10 | J373: 0 | K373: 0 | L373: 1 | N373: 0 | O373: 组队2-BOSS宝箱3 | P373: 999999 | Q373: 1 | R373: 0 | S373: 0 | T373: 19103|19005|19030|10101|80000|80010 | U373: 10|100|1000|1|1|1 | V373: 15|150|1500|1|1|1 | W373: 2|2|2|2|1|1
A374: 13104 | B374: 组队BOSS宝箱 | C374: 13000 | D374: 1 | E374: 2 | F374: 1 | G374: 1 | H374: 1 | I374: 10 | J374: 0 | K374: 0 | L374: 1 | N374: 0 | O374: 组队2-BOSS宝箱4 | P374: 999999 | Q374: 1 | R374: 0 | S374: 0 | T374: 19103|19005|19030|10101|80000|80010 | U374: 15|150|1500|1|1|1 | V374: 20|200|2000|2|1|1 | W374: 1|1|1|3|2|2
A375: 13105 | B375: 组队任务宝箱 | C375: 13000 | D375: 1 | E375: 2 | F375: 1 | G375: 1 | H375: 1 | I375: 10 | J375: 0 | K375: 0 | L375: 1 | N375: 0 | O375: 组队2-任务奖励C | P375: 999999 | Q375: 1 | R375: 0 | S375: 0 | T375: 19003|19006|19005|19030 | U375: 3000|3|3|30 | V375: 5000|5|5|50 | W375: 7000|1000|1000|1000
A376: 13106 | B376: 组队任务宝箱 | C376: 13000 | D376: 1 | E376: 2 | F376: 1 | G376: 1 | H376: 1 | I376: 10 | J376: 0 | K376: 0 | L376: 1 | N376: 0 | O376: 组队2-任务奖励B | P376: 999999 | Q376: 1 | R376: 0 | S376: 0 | T376: 19003|10015|10021|19006|19005|19030 | U376: 5000|1|1|5|5|50 | V376: 10000|1|1|10|10|100 | W376: 6000|500|500|1000|1000|1000
A377: 13107 | B377: 组队任务宝箱 | C377: 13000 | D377: 1 | E377: 2 | F377: 1 | G377: 1 | H377: 1 | I377: 10 | J377: 0 | K377: 0 | L377: 1 | N377: 0 | O377: 组队2-任务奖励A | P377: 999999 | Q377: 1 | R377: 0 | S377: 0 | T377: 19003|13015|10015|10021|10000|10001|10022|19006|19005|19030|12400|12401|12402|12403|12404|12405|12406|12407|12409|12411|12430|12431|12432|12433|12434|12435|12436|12437|12439|12441|12460|12461|12462|12463|12464|12465|12466|12467|12469|12471 | U377: 10000|1|1|1|1|1|1|10|10|100|1|1|1|1|1|1|1|1|1|1|1|1|1|1|1|1|1|1|1|1|1|1|1|1|1|1|1|1|1|1 | V377: 15000|1|2|2|1|1|1|15|15|150|2|2|2|2|2|2|2|2|2|2|2|2|2|2|2|2|2|2|2|2|2|2|2|2|2|2|2|2|2|2 | W377: 3400|500|500|500|500|500|500|1000|1000|1000|20|20|20|20|20|20|20|20|20|20|20|20|20|20|20|20|20|20|20|20|20|20|20|20|20|20|20|20|20|20
A378: 13108 | B378: 组队任务宝箱 | C378: 13000 | D378: 1 | E378: 2 | F378: 1 | G378: 1 | H378: 1 | I378: 10 | J378: 0 | K378: 0 | L378: 1 | N378: 0 | O378: 组队2-任务奖励S | P378: 999999 | Q378: 1 | R378: 0 | S378: 0 | T378: 19003|13015|10015|10021|10000|10001|10022|13007|13008|19006|19005|19030|12400|12401|12402|12403|12404|12405|12406|12407|12408|12409|12410|12411|12412|12413|12430|12431|12432|12433|12434|12435|12436|12437|12438|12439|12440|12441|12442|12443|12460|12461|12462|12463|12464|12465|12466|12467|12468|12469|12470|12471|12472|12473 | U378: 15000|1|2|2|1|1|1|1|1|15|15|150|2|2|2|2|2|2|2|2|2|2|2|2|2|2|2|2|2|2|2|2|2|2|2|2|2|2|2|2|2|2|2|2|2|2|2|2|2|2|2|2|2|2 | V378: 20000|1|3|3|1|1|2|1|1|20|20|200|3|3|3|3|3|3|3|3|3|3|3|3|3|3|3|3|3|3|3|3|3|3|3|3|3|3|3|3|3|3|3|3|3|3|3|3|3|3|3|3|3|3 | W378: 1160|500|500|500|500|500|500|1000|1000|1000|1000|1000|20|20|20|20|20|20|20|20|20|20|20|20|20|20|20|20|20|20|20|20|20|20|20|20|20|20|20|20|20|20|20|20|20|20|20|20|20|20|20|20|20|20
A379: 13109 | B379: 组队MVP宝箱 | C379: 13000 | D379: 1 | E379: 2 | F379: 1 | G379: 1 | H379: 1 | I379: 10 | J379: 0 | K379: 0 | L379: 1 | N379: 0 | O379: 组队2-MVP宝箱1（前3次） | P379: 999999 | Q379: 1 | R379: 0 | S379: 0 | T379: 19103|19005|19030|10101 | U379: 15|150|1500|1 | V379: 20|200|2000|2 | W379: 2|2|2|3
A380: 13110 | B380: 组队MVP宝箱 | C380: 13000 | D380: 1 | E380: 2 | F380: 1 | G380: 1 | H380: 1 | I380: 10 | J380: 0 | K380: 0 | L380: 1 | N380: 0 | O380: 组队2-MVP宝箱2（4~6次） | P380: 999999 | Q380: 1 | R380: 0 | S380: 0 | T380: 19103|19005|19030|10101 | U380: 10|100|1000|1 | V380: 15|150|1500|1 | W380: 2|2|2|3
A381: 13111 | B381: 组队MVP宝箱 | C381: 13000 | D381: 1 | E381: 2 | F381: 1 | G381: 1 | H381: 1 | I381: 10 | J381: 0 | K381: 0 | L381: 1 | N381: 0 | O381: 组队2-MVP宝箱3（7~10次） | P381: 999999 | Q381: 1 | R381: 0 | S381: 0 | T381: 19103|19005|19030|10101 | U381: 5|50|500|1 | V381: 10|100|1000|1 | W381: 2|2|2|3
A382: 13112 | B382: 组队MVP宝箱 | C382: 13000 | D382: 1 | E382: 2 | F382: 1 | G382: 1 | H382: 1 | I382: 10 | J382: 0 | K382: 0 | L382: 1 | N382: 0 | O382: 组队2-MVP宝箱4（11次之后） | P382: 999999 | Q382: 1 | R382: 0 | S382: 0 | T382: 19003|19005|19030 | U382: 30000|30|300 | V382: 50000|50|500 | W382: 1|1|1
A383: 13113 | B383: 组队额外奖励宝箱 | C383: 13000 | D383: 1 | E383: 2 | F383: 1 | G383: 1 | H383: 1 | I383: 10 | J383: 0 | K383: 0 | L383: 1 | N383: 0 | O383: 组队2-额外奖励宝箱 | P383: 999999 | Q383: 1 | R383: 0 | S383: 0 | T383: 19003|19005|19030 | U383: 3000|3|30 | V383: 7000|7|70 | W383: 1|1|1
A384: 13121 | B384: 组队BOSS宝箱 | C384: 13000 | D384: 1 | E384: 2 | F384: 1 | G384: 1 | H384: 1 | I384: 10 | J384: 0 | K384: 0 | L384: 1 | N384: 0 | O384: 组队1-BOSS宝箱1 | P384: 999999 | Q384: 1 | R384: 0 | S384: 0 | T384: 19003|19005|19030 | U384: 5000|5|50 | V384: 25000|25|250 | W384: 8|1|1
A385: 13122 | B385: 组队BOSS宝箱 | C385: 13000 | D385: 1 | E385: 2 | F385: 1 | G385: 1 | H385: 1 | I385: 10 | J385: 0 | K385: 0 | L385: 1 | N385: 0 | O385: 组队1-BOSS宝箱2 | P385: 999999 | Q385: 1 | R385: 0 | S385: 0 | T385: 19003|19005|19030|10101 | U385: 25000|25|250|1 | V385: 50000|50|500|1 | W385: 7|1|1|1
A386: 13123 | B386: 组队BOSS宝箱 | C386: 13000 | D386: 1 | E386: 2 | F386: 1 | G386: 1 | H386: 1 | I386: 10 | J386: 0 | K386: 0 | L386: 1 | N386: 0 | O386: 组队1-BOSS宝箱3 | P386: 999999 | Q386: 1 | R386: 0 | S386: 0 | T386: 19103|19005|19030|10101|10011|10012 | U386: 5|50|500|1|2|1 | V386: 8|80|800|1|5|3 | W386: 2|2|2|2|1|1
A387: 13124 | B387: 组队BOSS宝箱 | C387: 13000 | D387: 1 | E387: 2 | F387: 1 | G387: 1 | H387: 1 | I387: 10 | J387: 0 | K387: 0 | L387: 1 | N387: 0 | O387: 组队1-BOSS宝箱4 | P387: 999999 | Q387: 1 | R387: 0 | S387: 0 | T387: 19103|19005|19030|10101|10011|10012 | U387: 8|80|800|1|5|3 | V387: 10|100|1000|2|10|6 | W387: 1|1|1|3|2|2
A388: 13125 | B388: 组队任务宝箱 | C388: 13000 | D388: 1 | E388: 2 | F388: 1 | G388: 1 | H388: 1 | I388: 10 | J388: 0 | K388: 0 | L388: 1 | N388: 0 | O388: 组队1-任务奖励C | P388: 999999 | Q388: 1 | R388: 0 | S388: 0 | T388: 19003|19006|19005|19030 | U388: 2000|2|2|20 | V388: 3000|3|3|30 | W388: 7000|1000|1000|1000
A389: 13126 | B389: 组队任务宝箱 | C389: 13000 | D389: 1 | E389: 2 | F389: 1 | G389: 1 | H389: 1 | I389: 10 | J389: 0 | K389: 0 | L389: 1 | N389: 0 | O389: 组队1-任务奖励B | P389: 999999 | Q389: 1 | R389: 0 | S389: 0 | T389: 19003|10015|10021|19006|19005|19030 | U389: 3000|1|1|3|3|30 | V389: 7000|1|1|7|7|70 | W389: 6000|500|500|1000|1000|1000
A390: 13127 | B390: 组队任务宝箱 | C390: 13000 | D390: 1 | E390: 2 | F390: 1 | G390: 1 | H390: 1 | I390: 10 | J390: 0 | K390: 0 | L390: 1 | N390: 0 | O390: 组队1-任务奖励A | P390: 999999 | Q390: 1 | R390: 0 | S390: 0 | T390: 19003|10015|10021|10000|10001|10022|19006|19005|19030|12400|12401|12402|12403|12404|12405|12406|12407|12409|12411|12430|12431|12432|12433|12434|12435|12436|12437|12439|12441|12460|12461|12462|12463|12464|12465|12466|12467|12469|12471 | U390: 7000|1|1|1|1|1|7|7|70|1|1|1|1|1|1|1|1|1|1|1|1|1|1|1|1|1|1|1|1|1|1|1|1|1|1|1|1|1|1 | V390: 10000|1|1|1|1|1|10|10|100|2|2|2|2|2|2|2|2|2|2|2|2|2|2|2|2|2|2|2|2|2|2|2|2|2|2|2|2|2|2 | W390: 3400|500|500|500|500|500|1000|1000|1000|20|20|20|20|20|20|20|20|20|20|20|20|20|20|20|20|20|20|20|20|20|20|20|20|20|20|20|20|20|20
A391: 13128 | B391: 组队任务宝箱 | C391: 13000 | D391: 1 | E391: 2 | F391: 1 | G391: 1 | H391: 1 | I391: 10 | J391: 0 | K391: 0 | L391: 1 | N391: 0 | O391: 组队1-任务奖励S | P391: 999999 | Q391: 1 | R391: 0 | S391: 0 | T391: 19003|10015|10021|10000|10001|10022|13007|13008|19006|19005|19030|12400|12401|12402|12403|12404|12405|12406|12407|12408|12409|12410|12411|12412|12413|12430|12431|12432|12433|12434|12435|12436|12437|12438|12439|12440|12441|12442|12443|12460|12461|12462|12463|12464|12465|12466|12467|12468|12469|12470|12471|12472|12473 | U391: 10000|1|1|1|1|1|1|1|10|10|100|2|2|2|2|2|2|2|2|2|2|2|2|2|2|2|2|2|2|2|2|2|2|2|2|2|2|2|2|2|2|2|2|2|2|2|2|2|2|2|2|2|2 | V391: 15000|2|2|1|1|2|1|1|15|15|150|3|3|3|3|3|3|3|3|3|3|3|3|3|3|3|3|3|3|3|3|3|3|3|3|3|3|3|3|3|3|3|3|3|3|3|3|3|3|3|3|3|3 | W391: 1160|500|500|500|500|500|1000|1000|1000|1000|1000|20|20|20|20|20|20|20|20|20|20|20|20|20|20|20|20|20|20|20|20|20|20|20|20|20|20|20|20|20|20|20|20|20|20|20|20|20|20|20|20|20|20
A392: 13129 | B392: 组队MVP宝箱 | C392: 13000 | D392: 1 | E392: 2 | F392: 1 | G392: 1 | H392: 1 | I392: 10 | J392: 0 | K392: 0 | L392: 1 | N392: 0 | O392: 组队1-MVP宝箱1（前3次） | P392: 999999 | Q392: 1 | R392: 0 | S392: 0 | T392: 19103|19005|19030|10101 | U392: 10|100|1000|1 | V392: 15|150|1500|2 | W392: 2|2|2|3
A393: 13130 | B393: 组队MVP宝箱 | C393: 13000 | D393: 1 | E393: 2 | F393: 1 | G393: 1 | H393: 1 | I393: 10 | J393: 0 | K393: 0 | L393: 1 | N393: 0 | O393: 组队1-MVP宝箱2（4~6次） | P393: 999999 | Q393: 1 | R393: 0 | S393: 0 | T393: 19103|19005|19030|10101 | U393: 5|50|500|1 | V393: 10|100|1000|1 | W393: 2|2|2|3
A394: 13131 | B394: 组队MVP宝箱 | C394: 13000 | D394: 1 | E394: 2 | F394: 1 | G394: 1 | H394: 1 | I394: 10 | J394: 0 | K394: 0 | L394: 1 | N394: 0 | O394: 组队1-MVP宝箱3（7~10次） | P394: 999999 | Q394: 1 | R394: 0 | S394: 0 | T394: 19003|19005|19030|10101 | U394: 30000|30|300|1 | V394: 5|50|500|1 | W394: 2|2|2|3
A395: 13132 | B395: 组队MVP宝箱 | C395: 13000 | D395: 1 | E395: 2 | F395: 1 | G395: 1 | H395: 1 | I395: 10 | J395: 0 | K395: 0 | L395: 1 | N395: 0 | O395: 组队1-MVP宝箱4（11次之后） | P395: 999999 | Q395: 1 | R395: 0 | S395: 0 | T395: 19003|19005|19030 | U395: 10000|10|100 | V395: 30000|30|300 | W395: 1|1|1
A396: 13133 | B396: 组队额外奖励宝箱 | C396: 13000 | D396: 1 | E396: 2 | F396: 1 | G396: 1 | H396: 1 | I396: 10 | J396: 0 | K396: 0 | L396: 1 | N396: 0 | O396: 组队1-额外奖励宝箱 | P396: 999999 | Q396: 1 | R396: 0 | S396: 0 | T396: 19003|19005|19030 | U396: 3000|3|30 | V396: 7000|7|70 | W396: 1|1|1
A397: 13299 | B397: 橙品英雄 | C397: 13030 | D397: 4 | E397: 2 | F397: 1 | G397: 1 | H397: 1 | I397: 10 | J397: 0 | K397: 0 | L397: 1 | N397: 0 | O397: 随机一个橙品英雄。 | P397: 999999 | Q397: 1 | R397: 0 | S397: 0 | T397: 30430|30400|31400|31440|32410|32411 | U397: 1|1|1|1|1|1 | V397: =RC[-1] -> 1|1|1|1|1|1 | AB397: 1
A398: 13300 | B398: 阵营3选1英雄箱 | C398: 13030 | D398: 4 | E398: 2 | F398: 2 | G398: 1 | H398: 1 | I398: 10 | J398: 0 | K398: 0 | L398: 0 | N398: 0 | O398: 可从超能、传说、幻想中选择一个阵营获得对应阵营的一个随机橙品英雄。 | P398: 999999 | Q398: 1 | R398: 0 | S398: 0 | T398: 13021|13022|13023 | U398: 1|1|1 | V398: 1|1|1 | AB398: 1 | AG398: 1 | AH398: 1 | AI398: 1
A399: 13301 | B399: 核心英雄碎片40个 | C399: 13030 | D399: 4 | E399: 2 | F399: 2 | G399: 1 | H399: 1 | I399: 10 | J399: 0 | K399: 0 | L399: 0 | N399: 0 | O399: 可从六个资质25的橙品核心英雄中选择一个获得其40个碎片。 | P399: 999999 | Q399: 1 | R399: 0 | S399: 0 | T399: 13321|13322|13323 | U399: 1|1|1 | V399: 1|1|1 | AG399: 1 | AH399: 1 | AI399: 1
A400: 13302 | B400: 培养材料4选1宝箱 | C400: 13002 | D400: 4 | E400: 2 | F400: 2 | G400: 1 | H400: 1 | I400: 10 | J400: 0 | K400: 0 | L400: 0 | N400: 0 | O400: 可从进阶石*20、培养石*5、潜能合剂*2、觉醒水晶*8中选择一个获得。 | P400: 999999 | Q400: 1 | R400: 0 | S400: 0 | T400: 10002|10003|10004|10008 | U400: 20|5|2|8 | V400: =RC[-1] -> 20|5|2|8 | AG400: 1 | AH400: 1 | AI400: 1
A401: 13303 | B401: 任选阵营随机英雄 | C401: 13030 | D401: 3 | E401: 2 | F401: 2 | G401: 1 | H401: 1 | I401: 10 | J401: 0 | K401: 0 | L401: 0 | N401: 0 | O401: 可从超能、传说、幻想中选择一个阵营获得对应阵营的一个随机紫品英雄。 | P401: 999999 | Q401: 1 | R401: 0 | S401: 0 | T401: 13004|13005|13006 | U401: 1|1|1 | V401: 1|1|1 | AB401: 1 | AG401: 1 | AH401: 1 | AI401: 1
A402: 13304 | B402: 橙品辅助碎片4选1箱 | C402: 13030 | D402: 4 | E402: 2 | F402: 2 | G402: 1 | H402: 1 | I402: 10 | J402: 0 | K402: 0 | L402: 0 | N402: 0 | O402: 可从白凤凰碎片、圣女贞德碎片、雅典娜碎片、大检查官碎片中选择一个获得。 | P402: 999999 | Q402: 1 | R402: 0 | S402: 0 | T402: 12411|12431|12441|12471 | U402: 1|1|1|1 | V402: =RC[-1] -> 1|1|1|1 | AG402: 1 | AH402: 1 | AI402: 1
A403: 13305 | B403: 橙品符文 | C403: 13002 | D403: 4 | E403: 2 | F403: 2 | G403: 1 | H403: 1 | I403: 10 | J403: 0 | K403: 0 | L403: 0 | N403: 0 | O403: 可从统帅符文、屠戮符文、沉眠符文、狂野符文中选择一个获得。 | P403: 999999 | Q403: 13 | R403: 0 | S403: 0 | T403: 40401|40402|40403|40404 | U403: 1|1|1|1 | V403: 1|1|1|1 | AD403: 1 | AG403: 1 | AH403: 1 | AI403: 1
A404: 13306 | B404: 橙品徽章 | C404: 13002 | D404: 4 | E404: 2 | F404: 2 | G404: 1 | H404: 1 | I404: 10 | J404: 0 | K404: 0 | L404: 0 | N404: 0 | O404: 可从高山徽章、狮王徽章、孔雀徽章、巨木徽章中选择一个获得。 | P404: 999999 | Q404: 13 | R404: 0 | S404: 0 | T404: 41401|41402|41403|41404 | U404: 1|1|1|1 | V404: 1|1|1|1 | AD404: 1 | AG404: 1 | AH404: 1 | AI404: 1
A405: 13307 | B405: 闪光橙装碎片 | C405: 13020 | D405: 4 | E405: 2 | F405: 2 | G405: 1 | H405: 1 | I405: 10 | J405: 0 | K405: 0 | L405: 0 | N405: 0 | O405: 可从金龙权杖碎片、神圣之心碎片、雷霆战靴碎片、燃烧之触碎片中选择一个获得。 | P405: 999999 | Q405: 7 | R405: 0 | S405: 0 | T405: 11405|11406|11407|11408 | U405: 1|1|1|1 | V405: 1|1|1|1 | AG405: 1 | AH405: 1 | AI405: 1
A406: 13308 | B406: 紫品符文 | C406: 13001 | D406: 3 | E406: 2 | F406: 2 | G406: 1 | H406: 1 | I406: 10 | J406: 0 | K406: 0 | L406: 0 | N406: 0 | O406: 可从英勇符文、愤怒符文、宁静符文、暴躁符文中选择一个获得。 | P406: 999999 | Q406: 13 | R406: 0 | S406: 0 | T406: 40301|40302|40303|40304 | U406: 1|1|1|1 | V406: 1|1|1|1 | AD406: 1 | AG406: 1 | AH406: 1 | AI406: 1
A407: 13309 | B407: 紫品徽章 | C407: 13001 | D407: 3 | E407: 2 | F407: 2 | G407: 1 | H407: 1 | I407: 10 | J407: 0 | K407: 0 | L407: 0 | N407: 0 | O407: 可从荆棘徽章、饿狼徽章、飞鸟徽章、绿叶徽章中选择一个获得。 | P407: 999999 | Q407: 13 | R407: 0 | S407: 0 | T407: 41301|41302|41303|41304 | U407: 1|1|1|1 | V407: 1|1|1|1 | AD407: 1 | AG407: 1 | AH407: 1 | AI407: 1
A408: 13310 | B408: 任选紫装碎片 | C408: 13020 | D408: 3 | E408: 2 | F408: 2 | G408: 1 | H408: 1 | I408: 10 | J408: 0 | K408: 0 | L408: 0 | N408: 0 | O408: 可从掠夺弯刀碎片、不动盔甲碎片、疾风长靴碎片、正义护腕碎片中选择一个获得。 | P408: 999999 | Q408: 7 | R408: 0 | S408: 0 | T408: 11301|11302|11303|11304 | U408: 1|1|1|1 | V408: 1|1|1|1 | AG408: 1 | AH408: 1 | AI408: 1
A409: 13311 | B409: 任选紫装 | C409: 13020 | D409: 3 | E409: 2 | F409: 2 | G409: 1 | H409: 1 | I409: 10 | J409: 0 | K409: 0 | L409: 0 | N409: 0 | O409: 可从掠夺弯刀、不动盔甲、疾风长靴、正义护腕中选择一个获得。 | P409: 999999 | Q409: 7 | R409: 0 | S409: 0 | T409: 20301|21301|22301|23301 | U409: 1|1|1|1 | V409: 1|1|1|1 | AC409: 1 | AG409: 1 | AH409: 1 | AI409: 1
A410: 13312 | B410: 核心配合碎片1 | C410: 13030 | D410: 4 | E410: 2 | F410: 2 | G410: 1 | H410: 1 | I410: 10 | J410: 0 | K410: 0 | L410: 0 | N410: 0 | O410: 可从树人碎片、斯巴达碎片、熊阿宝碎片中选择一个获得其40个碎片。 | P410: 999999 | Q410: 1 | R410: 0 | S410: 0 | T410: 12409|12439|12469 | U410: 40|40|40 | V410: 40|40|40 | AG410: 1 | AH410: 1 | AI410: 1
A411: 13313 | B411: 核心配合碎片2 | C411: 13030 | D411: 4 | E411: 2 | F411: 2 | G411: 1 | H411: 1 | I411: 10 | J411: 0 | K411: 0 | L411: 0 | N411: 0 | O411: 可从白凤凰碎片、雅典娜碎片、大检察官碎片中选择一个获得其40个碎片。 | P411: 999999 | Q411: 1 | R411: 0 | S411: 0 | T411: 12411|12441|12471 | U411: 40|40|40 | V411: 40|40|40 | AG411: 1 | AH411: 1 | AI411: 1
A412: 13314 | B412: 任选橙装碎片 | C412: 13020 | D412: 4 | E412: 2 | F412: 2 | G412: 1 | H412: 1 | I412: 10 | J412: 0 | K412: 0 | L412: 0 | N412: 0 | O412: 可从正义巨剑碎片、死者重甲碎片、踏浪长靴碎片、超凡之手碎片中选择一个获得。 | P412: 999999 | Q412: 7 | R412: 0 | S412: 0 | T412: 11401|11402|11403|11404 | U412: 1|1|1|1 | V412: 1|1|1|1 | AG412: 1 | AH412: 1 | AI412: 1
A413: 13315 | B413: 任选紫品圣器 | C413: 13001 | D413: 3 | E413: 2 | F413: 2 | G413: 1 | H413: 1 | I413: 10 | J413: 0 | K413: 0 | L413: 0 | N413: 0 | O413: 可从八个紫品符文及徽章中选择任意一个获得。 | P413: 999999 | Q413: 13 | R413: 0 | S413: 0 | T413: 13308|13309 | U413: 1|1 | V413: =RC[-1] -> 1|1 | AD413: 1 | AG413: 1 | AH413: 1 | AI413: 1
A414: 13316 | B414: 任选橙品圣器 | C414: 13002 | D414: 4 | E414: 2 | F414: 2 | G414: 1 | H414: 1 | I414: 10 | J414: 0 | K414: 0 | L414: 0 | N414: 0 | O414: 可从八个橙品符文及徽章中选择任意一个获得。 | P414: 999999 | Q414: 13 | R414: 0 | S414: 0 | T414: 13305|13306 | U414: 1|1 | V414: =RC[-1] -> 1|1 | AD414: 1 | AG414: 1 | AH414: 1 | AI414: 1
A415: 13317 | B415: 核心配合碎片40个 | C415: 13002 | D415: 4 | E415: 2 | F415: 2 | G415: 1 | H415: 1 | I415: 10 | J415: 0 | K415: 0 | L415: 0 | N415: 0 | O415: 可从六个橙品核心英雄的合击配合英雄中选择一个获得其40个碎片。 | P415: 999999 | Q415: 1 | R415: 0 | S415: 0 | T415: 13312|13313 | U415: 1|1 | V415: =RC[-1] -> 1|1 | AG415: 1 | AH415: 1 | AI415: 1
A416: 13318 | B416: 橙品符文碎片 | C416: 13002 | D416: 4 | E416: 2 | F416: 2 | G416: 1 | H416: 1 | I416: 10 | J416: 0 | K416: 0 | L416: 0 | N416: 0 | O416: 可从统帅符文碎片、屠戮符文碎片、沉眠符文碎片、狂野符文碎片中选择一个获得。 | P416: 999999 | Q416: 13 | R416: 0 | S416: 0 | T416: 13041|13042|13043|13044 | U416: 1|1|1|1 | V416: =RC[-1] -> 1|1|1|1 | AD416: 1 | AG416: 1 | AH416: 1 | AI416: 1
A417: 13319 | B417: 橙品徽章碎片 | C417: 13002 | D417: 4 | E417: 2 | F417: 2 | G417: 1 | H417: 1 | I417: 10 | J417: 0 | K417: 0 | L417: 0 | N417: 0 | O417: 可从高山徽章碎片、狮王徽章碎片、孔雀徽章碎片、巨木徽章碎片中选择一个获得。 | P417: 999999 | Q417: 13 | R417: 0 | S417: 0 | T417: 13045|13046|13047|13048 | U417: 1|1|1|1 | V417: =RC[-1] -> 1|1|1|1 | AG417: 1 | AH417: 1 | AI417: 1
A418: 13320 | B418: 阵营碎片箱 | C418: 13030 | D418: 4 | E418: 2 | F418: 2 | G418: 1 | H418: 1 | I418: 10 | J418: 0 | K418: 0 | L418: 0 | N418: 0 | O418: 可从超能、传说、幻想中选择一个阵营获得对应阵营的1~5个随机橙品英雄碎片。 | P418: 999999 | Q418: 1 | R418: 0 | S418: 0 | T418: 13050|13051|13052 | U418: 1|1|1 | V418: =RC[-1] -> 1|1|1 | AG418: 1 | AH418: 1
A419: 13321 | B419: 超能核心碎片40个 | C419: 13030 | D419: 4 | E419: 2 | F419: 2 | G419: 1 | H419: 1 | I419: 10 | J419: 0 | K419: 0 | L419: 0 | N419: 0 | O419: 可从铁人碎片*40、超凡博士碎片*40中选择获得其一。 | P419: 999999 | Q419: 1 | R419: 0 | S419: 0 | T419: 12408|12410 | U419: 40|40 | V419: =RC[-1] -> 40|40 | AA419: 1 | AG419: 1 | AH419: 1 | AI419: 1
A420: 13322 | B420: 传说核心碎片40个 | C420: 13030 | D420: 4 | E420: 2 | F420: 2 | G420: 1 | H420: 1 | I420: 10 | J420: 0 | K420: 0 | L420: 0 | N420: 0 | O420: 可从宙斯碎片*40、阿努比斯碎片*40中选择获得其一。 | P420: 999999 | Q420: 1 | R420: 0 | S420: 0 | T420: 12438|12440 | U420: 40|40 | V420: =RC[-1] -> 40|40 | AA420: 1 | AG420: 1 | AH420: 1 | AI420: 1
A421: 13323 | B421: 幻想核心碎片40个 | C421: 13030 | D421: 4 | E421: 2 | F421: 2 | G421: 1 | H421: 1 | I421: 10 | J421: 0 | K421: 0 | L421: 0 | N421: 0 | O421: 可从小黑碎片*40、血色指挥官碎片*40中选择获得其一。 | P421: 999999 | Q421: 1 | R421: 0 | S421: 0 | T421: 12468|12470 | U421: 40|40 | V421: =RC[-1] -> 40|40 | AA421: 1 | AG421: 1 | AH421: 1 | AI421: 1
A422: 13324 | B422: 任选精灵升华道具 | C422: 13008 | D422: 4 | E422: 2 | F422: 2 | G422: 1 | H422: 1 | I422: 10 | J422: 0 | K422: 0 | L422: 0 | N422: 0 | O422: 可从希望之心、烈焰结晶、深海之泪、妖魅花种中选择一个获得。 | P422: 999999 | Q422: 1 | R422: 0 | S422: 0 | T422: 10034|10035|10036|10040 | U422: 1|1|1|1 | V422: =RC[-1] -> 1|1|1|1 | AG422: 1 | AH422: 1
A423: 13325 | B423: 橙品英雄碎片箱 | C423: 13030 | D423: 4 | E423: 2 | F423: 2 | G423: 1 | H423: 1 | I423: 10 | J423: 0 | K423: 0 | L423: 0 | N423: 0 | O423: 可从红颅鬼、独眼巨人、憎恶、终极队长、圣女贞德、树精中选择一个碎片获得。 | P423: 999999 | Q423: 1 | R423: 0 | S423: 0 | T423: 13415|13416 | U423: 1|1 | V423: =RC[-1] -> 1|1 | AG423: 1 | AH423: 1
A424: 13326 | B424: 橙品副英雄碎片箱 | C424: 13030 | D424: 4 | E424: 2 | F424: 2 | G424: 1 | H424: 1 | I424: 10 | J424: 0 | K424: 0 | L424: 0 | N424: 0 | O424: 可从九个资质20的橙品副英雄中选择一个获得其碎片。 | P424: 999999 | Q424: 1 | R424: 0 | S424: 0 | T424: 13410|13412|13414 | U424: 1|1|1 | V424: =RC[-1] -> 1|1|1 | AG424: 1 | AH424: 1
A425: 13327 | B425: 橙品主英雄碎片箱 | C425: 13030 | D425: 4 | E425: 2 | F425: 2 | G425: 1 | H425: 1 | I425: 10 | J425: 0 | K425: 0 | L425: 0 | N425: 0 | O425: 可从九个资质20的橙品主英雄中选择一个获得其碎片。 | P425: 999999 | Q425: 1 | R425: 0 | S425: 0 | T425: 13409|13411|13413 | U425: 1|1|1 | V425: =RC[-1] -> 1|1|1 | AG425: 1 | AH425: 1
A426: 13328 | B426: 25资副英雄碎片 | C426: 13030 | D426: 4 | E426: 2 | F426: 2 | G426: 1 | H426: 1 | I426: 10 | J426: 0 | K426: 0 | L426: 0 | N426: 0 | O426: 可从地狱铁拳、大力神、恶魔猎手、混沌女巫、冥王哈迪斯、神圣牧师中选择一个碎片获得。 | P426: 999999 | Q426: 1 | R426: 0 | S426: 0 | T426: 13403|13404 | U426: 1|1 | V426: =RC[-1] -> 1|1 | AG426: 1 | AH426: 1
A427: 13329 | B427: 核心英雄碎片 | C427: 13030 | D427: 4 | E427: 2 | F427: 2 | G427: 1 | H427: 1 | I427: 10 | J427: 0 | K427: 0 | L427: 0 | N427: 0 | O427: 可从六个资质25的橙品核心英雄碎片中选择一个获得。 | P427: 999999 | Q427: 1 | R427: 0 | S427: 0 | T427: 13330|13331|13332 | U427: 1|1|1 | V427: =RC[-1] -> 1|1|1 | AG427: 1 | AH427: 1 | AI427: 1
A428: 13330 | B428: 超能核心英雄碎片 | C428: 13030 | D428: 4 | E428: 2 | F428: 2 | G428: 1 | H428: 1 | I428: 10 | J428: 0 | K428: 0 | L428: 0 | N428: 0 | O428: 可从铁人碎片、超凡博士碎片中选择一个获得。 | P428: 999999 | Q428: 1 | R428: 0 | S428: 0 | T428: 12408|12410 | U428: 1|1 | V428: =RC[-1] -> 1|1 | AA428: 1 | AG428: 1 | AH428: 1 | AI428: 1
A429: 13331 | B429: 传说核心英雄碎片 | C429: 13030 | D429: 4 | E429: 2 | F429: 2 | G429: 1 | H429: 1 | I429: 10 | J429: 0 | K429: 0 | L429: 0 | N429: 0 | O429: 可从宙斯碎片、阿努比斯碎片中选择一个获得。 | P429: 999999 | Q429: 1 | R429: 0 | S429: 0 | T429: 12438|12440 | U429: 1|1 | V429: =RC[-1] -> 1|1 | AA429: 1 | AG429: 1 | AH429: 1 | AI429: 1
A430: 13332 | B430: 幻想核心英雄碎片 | C430: 13030 | D430: 4 | E430: 2 | F430: 2 | G430: 1 | H430: 1 | I430: 10 | J430: 0 | K430: 0 | L430: 0 | N430: 0 | O430: 可从小黑碎片、血色指挥官碎片中选一个获得。 | P430: 999999 | Q430: 1 | R430: 0 | S430: 0 | T430: 12468|12470 | U430: 1|1 | V430: =RC[-1] -> 1|1 | AA430: 1 | AG430: 1 | AH430: 1 | AI430: 1
A431: 13333 | B431: 25资副英雄 | C431: 13030 | D431: 4 | E431: 2 | F431: 2 | G431: 1 | H431: 1 | I431: 10 | J431: 0 | K431: 0 | L431: 0 | N431: 0 | O431: 可从地狱铁拳、大力神、恶魔猎手、混沌女巫、冥王哈迪斯、神圣牧师中选择一个获得。 | P431: 999999 | Q431: 1 | R431: 0 | S431: 0 | T431: 13419|13420 | U431: 1|1 | V431: =RC[-1] -> 1|1 | AG431: 1 | AH431: 1 | AI431: 1
A432: 13334 | B432: 任选闪光橙装 | C432: 13020 | D432: 4 | E432: 2 | F432: 2 | G432: 1 | H432: 1 | I432: 10 | J432: 0 | K432: 0 | L432: 0 | N432: 0 | O432: 可从金龙权杖、神圣之心、雷霆战靴、燃烧之触中选择一个获得。 | P432: 999999 | Q432: 1 | R432: 0 | S432: 0 | T432: 20402|21402|22402|23402 | U432: 1|1|1|1 | V432: =RC[-1] -> 1|1|1|1 | AC432: 1 | AF432: UI_zhuangbei_xingxing | AG432: 1 | AH432: 1 | AI432: 1
A433: 13335 | B433: 巨像守护套装之一 | C433: 13020 | D433: 4 | E433: 2 | F433: 2 | G433: 1 | H433: 1 | I433: 10 | J433: 0 | K433: 0 | L433: 0 | N433: 0 | O433: 可从橙品套装巨像守护的4个部位中选择一个获得。 | P433: 999999 | Q433: 1 | R433: 0 | S433: 0 | T433: 20403|21403|22403|23403 | U433: 1|1|1|1 | V433: =RC[-1] -> 1|1|1|1 | AC433: 1 | AF433: UI_taozhuang_chengse1 | AG433: 1 | AH433: 1 | AI433: 1
A434: 13336 | B434: 任选橙装 | C434: 13020 | D434: 4 | E434: 2 | F434: 2 | G434: 1 | H434: 1 | I434: 10 | J434: 0 | K434: 0 | L434: 0 | N434: 0 | O434: 可从正义巨剑、死者重甲、踏浪长靴、超凡之手中选择一个获得。 | P434: 999999 | Q434: 7 | R434: 0 | S434: 0 | T434: 20401|21401|22401|23401 | U434: 1|1|1|1 | V434: =RC[-1] -> 1|1|1|1 | AC434: 1 | AG434: 1 | AH434: 1 | AI434: 1
A435: 13337 | B435: 任选闪光紫装 | C435: 13020 | D435: 3 | E435: 2 | F435: 2 | G435: 1 | H435: 1 | I435: 10 | J435: 0 | K435: 0 | L435: 0 | N435: 0 | O435: 可从绞首双剑、光明战甲、黑钢长靴、咆哮护腕中选择一个获得。 | P435: 999999 | Q435: 7 | R435: 0 | S435: 0 | T435: 20302|21302|22302|23302 | U435: 1|1|1|1 | V435: =RC[-1] -> 1|1|1|1 | AC435: 1 | AF435: UI_zhuangbei_xingxing | AG435: 1 | AH435: 1 | AI435: 1
A436: 13338 | B436: 任选闪光紫装碎片 | C436: 13020 | D436: 3 | E436: 2 | F436: 2 | G436: 1 | H436: 1 | I436: 10 | J436: 0 | K436: 0 | L436: 0 | N436: 0 | O436: 可从绞首双剑碎片、光明战甲碎片、黑钢长靴碎片、咆哮护腕碎片中选择一个获得。 | P436: 999999 | Q436: 7 | R436: 0 | S436: 0 | T436: 11305|11306|11307|11308 | U436: 1|1|1|1 | V436: =RC[-1] -> 1|1|1|1 | AF436: UI_zhuangbei_xingxing | AG436: 1 | AH436: 1 | AI436: 1
A437: 13339 | B437: 任选卡牌 | C437: 13002 | D437: 3 | E437: 2 | F437: 2 | G437: 1 | H437: 1 | I437: 10 | J437: 0 | K437: 0 | L437: 0 | N437: 0 | O437: 可从所有紫品卡牌中选择一张获得。 | P437: 999999 | Q437: 50 | R437: 0 | S437: 0 | T437: 13341|13342|13343|13344 | U437: 1|1|1|1 | V437: =RC[-1] -> 1|1|1|1 | AG437: 1 | AH437: 1 | AI437: 1
A438: 13340 | B438: 任选卡牌 | C438: 13003 | D438: 4 | E438: 2 | F438: 2 | G438: 1 | H438: 1 | I438: 10 | J438: 0 | K438: 0 | L438: 0 | N438: 0 | O438: 可从所有橙品卡牌中选择一张获得。 | P438: 999999 | Q438: 50 | R438: 0 | S438: 0 | T438: 13345|13346|13347|13348 | U438: 1|1|1|1 | V438: =RC[-1] -> 1|1|1|1 | AG438: 1 | AH438: 1 | AI438: 1
A439: 13341 | B439: 攻击型卡牌 | C439: 13002 | D439: 3 | E439: 2 | F439: 2 | G439: 1 | H439: 1 | I439: 10 | J439: 0 | K439: 0 | L439: 0 | N439: 0 | O439: 可从所有攻击型紫品卡牌中选择一张获得。 | P439: 999999 | Q439: 50 | R439: 0 | S439: 0 | T439: 70308|70311|70312|13349 | U439: 1|1|1|1 | V439: =RC[-1] -> 1|1|1|1 | AE439: 1 | AG439: 1 | AH439: 1
A440: 13342 | B440: 物防型卡牌 | C440: 13002 | D440: 3 | E440: 2 | F440: 2 | G440: 1 | H440: 1 | I440: 10 | J440: 0 | K440: 0 | L440: 0 | N440: 0 | O440: 可从所有物防型紫品卡牌中选择一张获得。 | P440: 999999 | Q440: 50 | R440: 0 | S440: 0 | T440: 70304|70306|70309|13350 | U440: 1|1|1|1 | V440: =RC[-1] -> 1|1|1|1 | AE440: 1 | AG440: 1 | AH440: 1
A441: 13343 | B441: 法防型卡牌 | C441: 13002 | D441: 3 | E441: 2 | F441: 2 | G441: 1 | H441: 1 | I441: 10 | J441: 0 | K441: 0 | L441: 0 | N441: 0 | O441: 可从所有法防型紫品卡牌中选择一张获得。 | P441: 999999 | Q441: 50 | R441: 0 | S441: 0 | T441: 70301|70303|70314|13351 | U441: 1|1|1|1 | V441: =RC[-1] -> 1|1|1|1 | AE441: 1 | AG441: 1 | AH441: 1
A442: 13344 | B442: 生命型卡牌 | C442: 13003 | D442: 3 | E442: 2 | F442: 2 | G442: 1 | H442: 1 | I442: 10 | J442: 0 | K442: 0 | L442: 0 | N442: 0 | O442: 可从所有生命型紫品卡牌中选择一张获得。 | P442: 999999 | Q442: 50 | R442: 0 | S442: 0 | T442: 70302|70305|70307|13352 | U442: 1|1|1|1 | V442: =RC[-1] -> 1|1|1|1 | AE442: 1 | AG442: 1 | AH442: 1
A443: 13345 | B443: 攻击型卡牌 | C443: 13003 | D443: 4 | E443: 2 | F443: 2 | G443: 1 | H443: 1 | I443: 10 | J443: 0 | K443: 0 | L443: 0 | N443: 0 | O443: 可从所有攻击型橙品卡牌中选择一张获得。 | P443: 999999 | Q443: 50 | R443: 0 | S443: 0 | T443: 70408|70411|70412|13353 | U443: 1|1|1|1 | V443: =RC[-1] -> 1|1|1|1 | AE443: 1 | AG443: 1 | AH443: 1
A444: 13346 | B444: 物防型卡牌 | C444: 13003 | D444: 4 | E444: 2 | F444: 2 | G444: 1 | H444: 1 | I444: 10 | J444: 0 | K444: 0 | L444: 0 | N444: 0 | O444: 可从所有物防型橙品卡牌中选择一张获得。 | P444: 999999 | Q444: 50 | R444: 0 | S444: 0 | T444: 70404|70406|70409|13354 | U444: 1|1|1|1 | V444: =RC[-1] -> 1|1|1|1 | AE444: 1 | AG444: 1 | AH444: 1
A445: 13347 | B445: 法防型卡牌 | C445: 13003 | D445: 4 | E445: 2 | F445: 2 | G445: 1 | H445: 1 | I445: 10 | J445: 0 | K445: 0 | L445: 0 | N445: 0 | O445: 可从所有法防型橙品卡牌中选择一张获得。 | P445: 999999 | Q445: 50 | R445: 0 | S445: 0 | T445: 70401|70403|70414|13355 | U445: 1|1|1|1 | V445: =RC[-1] -> 1|1|1|1 | AE445: 1 | AG445: 1 | AH445: 1
A446: 13348 | B446: 生命型卡牌 | C446: 13003 | D446: 4 | E446: 2 | F446: 2 | G446: 1 | H446: 1 | I446: 10 | J446: 0 | K446: 0 | L446: 0 | N446: 0 | O446: 可从所有生命型橙品卡牌中选择一张获得。 | P446: 999999 | Q446: 50 | R446: 0 | S446: 0 | T446: 70402|70405|70407|13356 | U446: 1|1|1|1 | V446: =RC[-1] -> 1|1|1|1 | AE446: 1 | AG446: 1 | AH446: 1
A447: 13349 | B447: 攻击型卡牌 | C447: 13002 | D447: 3 | E447: 2 | F447: 2 | G447: 1 | H447: 1 | I447: 10 | J447: 0 | K447: 0 | L447: 0 | N447: 0 | O447: 可从死神、星星、太阳、宝剑中选择一张获得。 | P447: 999999 | Q447: 50 | R447: 0 | S447: 0 | T447: 70313|70317|70319|70324 | U447: 1|1|1|1 | V447: =RC[-1] -> 1|1|1|1 | AE447: 1 | AG447: 1 | AH447: 1
A448: 13350 | B448: 物防型卡牌 | C448: 13002 | D448: 3 | E448: 2 | F448: 2 | G448: 1 | H448: 1 | I448: 10 | J448: 0 | K448: 0 | L448: 0 | N448: 0 | O448: 可从恶魔、审判、权杖中选择一张获得。 | P448: 999999 | Q448: 50 | R448: 0 | S448: 0 | T448: 70315|70320|70322 | U448: 1|1|1 | V448: =RC[-1] -> 1|1|1 | AE448: 1 | AG448: 1 | AH448: 1
A449: 13351 | B449: 法防型卡牌 | C449: 13002 | D449: 3 | E449: 2 | F449: 2 | G449: 1 | H449: 1 | I449: 10 | J449: 0 | K449: 0 | L449: 0 | N449: 0 | O449: 可从塔、世界、圣杯中选择一张获得。 | P449: 999999 | Q449: 50 | R449: 0 | S449: 0 | T449: 70316|70321|70323 | U449: 1|1|1 | V449: =RC[-1] -> 1|1|1 | AE449: 1 | AG449: 1 | AH449: 1
A450: 13352 | B450: 生命型卡牌 | C450: 13003 | D450: 3 | E450: 2 | F450: 2 | G450: 1 | H450: 1 | I450: 10 | J450: 0 | K450: 0 | L450: 0 | N450: 0 | O450: 可从命运之轮、月亮、星币中选择一张获得。 | P450: 999999 | Q450: 50 | R450: 0 | S450: 0 | T450: 70310|70318|70325 | U450: 1|1|1 | V450: =RC[-1] -> 1|1|1 | AE450: 1 | AG450: 1 | AH450: 1
A451: 13353 | B451: 攻击型卡牌 | C451: 13002 | D451: 4 | E451: 2 | F451: 2 | G451: 1 | H451: 1 | I451: 10 | J451: 0 | K451: 0 | L451: 0 | N451: 0 | O451: 可从死神、星星、太阳、宝剑中选择一张获得。 | P451: 999999 | Q451: 50 | R451: 0 | S451: 0 | T451: 70413|70417|70419|70424 | U451: 1|1|1|1 | V451: =RC[-1] -> 1|1|1|1 | AE451: 1 | AG451: 1 | AH451: 1
A452: 13354 | B452: 物防型卡牌 | C452: 13002 | D452: 4 | E452: 2 | F452: 2 | G452: 1 | H452: 1 | I452: 10 | J452: 0 | K452: 0 | L452: 0 | N452: 0 | O452: 可从恶魔、审判、权杖中选择一张获得。 | P452: 999999 | Q452: 50 | R452: 0 | S452: 0 | T452: 70415|70420|70422 | U452: 1|1|1 | V452: =RC[-1] -> 1|1|1 | AE452: 1 | AG452: 1 | AH452: 1
A453: 13355 | B453: 法防型卡牌 | C453: 13002 | D453: 4 | E453: 2 | F453: 2 | G453: 1 | H453: 1 | I453: 10 | J453: 0 | K453: 0 | L453: 0 | N453: 0 | O453: 可从塔、世界、圣杯中选择一张获得。 | P453: 999999 | Q453: 50 | R453: 0 | S453: 0 | T453: 70416|70421|70423 | U453: 1|1|1 | V453: =RC[-1] -> 1|1|1 | AE453: 1 | AG453: 1 | AH453: 1
A454: 13356 | B454: 生命型卡牌 | C454: 13003 | D454: 4 | E454: 2 | F454: 2 | G454: 1 | H454: 1 | I454: 10 | J454: 0 | K454: 0 | L454: 0 | N454: 0 | O454: 可从命运之轮、月亮、星币中选择一张获得。 | P454: 999999 | Q454: 50 | R454: 0 | S454: 0 | T454: 70410|70418|70425 | U454: 1|1|1 | V454: =RC[-1] -> 1|1|1 | AE454: 1 | AG454: 1 | AH454: 1
A455: 13357 | B455: 超值大礼包 | C455: 13005 | D455: 4 | E455: 2 | F455: 2 | G455: 1 | H455: 1 | I455: 10 | J455: 0 | K455: 0 | L455: 0 | N455: 0 | O455: 可从紫水晶*13、潜能合剂*268、圣器精炼石*400、橙品精炼石*100选择其中一种获得。 | P455: 999999 | Q455: 1 | R455: 0 | S455: 0 | T455: 42301|10004|10010|10014 | U455: 13|268|400|100 | V455: =RC[-1] -> 13|268|400|100 | AG455: 1 | AH455: 1 | AI455: 1
A456: 13358 | B456: 任选灵泉 | C456: 13012 | D456: 0 | E456: 2 | F456: 2 | G456: 1 | H456: 1 | I456: 10 | J456: 0 | K456: 0 | L456: 0 | N456: 0 | O456: 可从4种精灵培养灵泉中选择其中一个获得。 | P456: 999999 | Q456: 1 | R456: 0 | S456: 0 | T456: 10030|10031|10032|10033 | U456: 1|1|1|1 | V456: =RC[-1] -> 1|1|1|1 | AG456: 1 | AH456: 1 | AI456: 1
A457: 13359 | B457: 冰与火之歌碎片礼盒 | C457: 13005 | D457: 3 | E457: 2 | F457: 2 | G457: 1 | H457: 1 | I457: 10 | J457: 0 | K457: 0 | L457: 0 | N457: 0 | O457: 可从【炼狱灵龙】、【深海女王】2种精灵的碎片中选择其中一个获得。 | P457: 999999 | Q457: 1 | R457: 0 | S457: 0 | T457: 15011|15012 | U457: 1|1 | V457: =RC[-1] -> 1|1 | AG457: 1 | AH457: 1 | AI457: 1
A458: 13360 | B458: 任选白品觉醒材料 | C458: 13000 | D458: 0 | E458: 2 | F458: 2 | G458: 1 | H458: 1 | I458: 10 | J458: 0 | K458: 0 | L458: 0 | N458: 0 | O458: 可从8个白品觉醒材料中选择其中一种获得。 | P458: 999999 | Q458: 1 | R458: 0 | S458: 0 | T458: 13366|13367 | U458: 1|1 | V458: =RC[-1] -> 1|1 | AG458: 1 | AH458: 1 | AI458: 1
A459: 13361 | B459: 任选绿品觉醒材料 | C459: 13001 | D459: 1 | E459: 2 | F459: 2 | G459: 1 | H459: 1 | I459: 10 | J459: 0 | K459: 0 | L459: 0 | N459: 0 | O459: 可从8个绿品觉醒材料中选择其中一种获得。 | P459: 999999 | Q459: 1 | R459: 0 | S459: 0 | T459: 13368|13369 | U459: 1|1 | V459: =RC[-1] -> 1|1 | AG459: 1 | AH459: 1 | AI459: 1
A460: 13362 | B460: 任选蓝品觉醒材料 | C460: 13002 | D460: 2 | E460: 2 | F460: 2 | G460: 1 | H460: 1 | I460: 10 | J460: 0 | K460: 0 | L460: 0 | N460: 0 | O460: 可从8个蓝品觉醒材料中选择其中一种获得。 | P460: 999999 | Q460: 1 | R460: 0 | S460: 0 | T460: 13370|13371 | U460: 1|1 | V460: =RC[-1] -> 1|1 | AG460: 1 | AH460: 1 | AI460: 1
A461: 13363 | B461: 任选紫品觉醒材料 | C461: 13002 | D461: 3 | E461: 2 | F461: 2 | G461: 1 | H461: 1 | I461: 10 | J461: 0 | K461: 0 | L461: 0 | N461: 0 | O461: 可从8个紫品觉醒材料中选择其中一种获得。 | P461: 999999 | Q461: 1 | R461: 0 | S461: 0 | T461: 13372|13373 | U461: 1|1 | V461: =RC[-1] -> 1|1 | AG461: 1 | AH461: 1 | AI461: 1
A462: 13364 | B462: 任选橙品觉醒材料 | C462: 13003 | D462: 4 | E462: 2 | F462: 2 | G462: 1 | H462: 1 | I462: 10 | J462: 0 | K462: 0 | L462: 0 | N462: 0 | O462: 可从8个橙品觉醒材料中选择其中一种获得。 | P462: 999999 | Q462: 1 | R462: 0 | S462: 0 | T462: 13374|13375 | U462: 1|1 | V462: =RC[-1] -> 1|1 | AG462: 1 | AH462: 1 | AI462: 1
A463: 13365 | B463: 任选红品觉醒材料 | C463: 13003 | D463: 5 | E463: 2 | F463: 2 | G463: 1 | H463: 1 | I463: 10 | J463: 0 | K463: 0 | L463: 0 | N463: 0 | O463: 可从8个红品觉醒材料中选择其中一种获得。 | P463: 999999 | Q463: 1 | R463: 0 | S463: 0 | T463: 13376|13377 | U463: 1|1 | V463: =RC[-1] -> 1|1 | AG463: 1 | AH463: 1 | AI463: 1
A464: 13366 | B464: 任选白品页 | C464: 13000 | D464: 0 | E464: 2 | F464: 2 | G464: 1 | H464: 1 | I464: 10 | J464: 0 | K464: 0 | L464: 0 | N464: 0 | O464: 可从4个白品书页中选择其中一种获得。 | P464: 999999 | Q464: 1 | R464: 0 | S464: 0 | T464: 60001|61001|62001|63001 | U464: 1|1|1|1 | V464: =RC[-1] -> 1|1|1|1 | AG464: 1 | AH464: 1 | AI464: 1
A465: 13367 | B465: 任选白品石 | C465: 13000 | D465: 0 | E465: 2 | F465: 2 | G465: 1 | H465: 1 | I465: 10 | J465: 0 | K465: 0 | L465: 0 | N465: 0 | O465: 可从4个白品晶石中选择其中一种获得。 | P465: 999999 | Q465: 1 | R465: 0 | S465: 0 | T465: 60002|61002|62002|63002 | U465: 1|1|1|1 | V465: =RC[-1] -> 1|1|1|1 | AG465: 1 | AH465: 1 | AI465: 1
A466: 13368 | B466: 任选绿品页 | C466: 13001 | D466: 1 | E466: 2 | F466: 2 | G466: 1 | H466: 1 | I466: 10 | J466: 0 | K466: 0 | L466: 0 | N466: 0 | O466: 可从4个绿品树叶中选择其中一种获得。 | P466: 999999 | Q466: 1 | R466: 0 | S466: 0 | T466: 60101|61101|62101|63101 | U466: 1|1|1|1 | V466: =RC[-1] -> 1|1|1|1 | AG466: 1 | AH466: 1 | AI466: 1
A467: 13369 | B467: 任选绿品石 | C467: 13001 | D467: 1 | E467: 2 | F467: 2 | G467: 1 | H467: 1 | I467: 10 | J467: 0 | K467: 0 | L467: 0 | N467: 0 | O467: 可从4个绿品晶石中选择其中一种获得。 | P467: 999999 | Q467: 1 | R467: 0 | S467: 0 | T467: 60102|61102|62102|63102 | U467: 1|1|1|1 | V467: =RC[-1] -> 1|1|1|1 | AG467: 1 | AH467: 1 | AI467: 1
A468: 13370 | B468: 任选蓝品书 | C468: 13002 | D468: 2 | E468: 2 | F468: 2 | G468: 1 | H468: 1 | I468: 10 | J468: 0 | K468: 0 | L468: 0 | N468: 0 | O468: 可从4个蓝品树叶中选择其中一种获得。 | P468: 999999 | Q468: 1 | R468: 0 | S468: 0 | T468: 60201|61201|62201|63201 | U468: 1|1|1|1 | V468: =RC[-1] -> 1|1|1|1 | AG468: 1 | AH468: 1 | AI468: 1
A469: 13371 | B469: 任选蓝品晶 | C469: 13002 | D469: 2 | E469: 2 | F469: 2 | G469: 1 | H469: 1 | I469: 10 | J469: 0 | K469: 0 | L469: 0 | N469: 0 | O469: 可从4个蓝品晶石中选择其中一种获得。 | P469: 999999 | Q469: 1 | R469: 0 | S469: 0 | T469: 60202|61202|62202|63202 | U469: 1|1|1|1 | V469: =RC[-1] -> 1|1|1|1 | AG469: 1 | AH469: 1 | AI469: 1
A470: 13372 | B470: 任选紫品书 | C470: 13002 | D470: 3 | E470: 2 | F470: 2 | G470: 1 | H470: 1 | I470: 10 | J470: 0 | K470: 0 | L470: 0 | N470: 0 | O470: 可从4个紫品树叶中选择其中一种获得。 | P470: 999999 | Q470: 1 | R470: 0 | S470: 0 | T470: 60301|61301|62301|63301 | U470: 1|1|1|1 | V470: =RC[-1] -> 1|1|1|1 | AG470: 1 | AH470: 1 | AI470: 1
A471: 13373 | B471: 任选紫品晶 | C471: 13002 | D471: 3 | E471: 2 | F471: 2 | G471: 1 | H471: 1 | I471: 10 | J471: 0 | K471: 0 | L471: 0 | N471: 0 | O471: 可从4个紫品晶石中选择其中一种获得。 | P471: 999999 | Q471: 1 | R471: 0 | S471: 0 | T471: 60302|61302|62302|63302 | U471: 1|1|1|1 | V471: =RC[-1] -> 1|1|1|1 | AG471: 1 | AH471: 1 | AI471: 1
A472: 13374 | B472: 任选橙品经 | C472: 13003 | D472: 4 | E472: 2 | F472: 2 | G472: 1 | H472: 1 | I472: 10 | J472: 0 | K472: 0 | L472: 0 | N472: 0 | O472: 可从4个橙品树叶中选择其中一种获得。 | P472: 999999 | Q472: 1 | R472: 0 | S472: 0 | T472: 60401|61401|62401|63401 | U472: 1|1|1|1 | V472: =RC[-1] -> 1|1|1|1 | AG472: 1 | AH472: 1 | AI472: 1
A473: 13375 | B473: 任选橙品石 | C473: 13003 | D473: 4 | E473: 2 | F473: 2 | G473: 1 | H473: 1 | I473: 10 | J473: 0 | K473: 0 | L473: 0 | N473: 0 | O473: 可从4个橙品晶石中选择其中一种获得。 | P473: 999999 | Q473: 1 | R473: 0 | S473: 0 | T473: 60402|61402|62402|63402 | U473: 1|1|1|1 | V473: =RC[-1] -> 1|1|1|1 | AG473: 1 | AH473: 1 | AI473: 1
A474: 13376 | B474: 任选红品典 | C474: 13003 | D474: 5 | E474: 2 | F474: 2 | G474: 1 | H474: 1 | I474: 10 | J474: 0 | K474: 0 | L474: 0 | N474: 0 | O474: 可从4个红品树叶中选择其中一种获得。 | P474: 999999 | Q474: 1 | R474: 0 | S474: 0 | T474: 60501|61501|62501|63501 | U474: 1|1|1|1 | V474: =RC[-1] -> 1|1|1|1 | AG474: 1 | AH474: 1 | AI474: 1
A475: 13377 | B475: 任选红品石 | C475: 13003 | D475: 5 | E475: 2 | F475: 2 | G475: 1 | H475: 1 | I475: 10 | J475: 0 | K475: 0 | L475: 0 | N475: 0 | O475: 可从4个红品晶石中选择其中一种获得。 | P475: 999999 | Q475: 1 | R475: 0 | S475: 0 | T475: 60502|61502|62502|63502 | U475: 1|1|1|1 | V475: =RC[-1] -> 1|1|1|1 | AG475: 1 | AH475: 1 | AI475: 1
A476: 13378 | B476: 豪华礼盒 | C476: 13005 | D476: 4 | E476: 2 | F476: 2 | G476: 1 | H476: 1 | I476: 10 | J476: 0 | K476: 0 | L476: 0 | N476: 0 | O476: 可从次元核心*7、培养石*666、紫水晶*10、任选精灵升华材料*1中选择一种获得。 | P476: 999999 | Q476: 1 | R476: 0 | S476: 0 | T476: 10019|10003|42301|13324 | U476: 7|666|10|1 | V476: =RC[-1] -> 7|666|10|1 | AG476: 1 | AH476: 1 | AI476: 1
A477: 13379 | B477: 任选25资橙品英雄 | C477: 13030 | D477: 4 | E477: 2 | F477: 2 | G477: 1 | H477: 1 | I477: 10 | J477: 0 | K477: 0 | L477: 0 | N477: 0 | O477: 可从所有25资质的橙品英雄中任选其中一个获得。 | P477: 999999 | Q477: 1 | R477: 0 | S477: 0 | T477: 13419|13420|13421|13423 | U477: 1|1|1|1 | V477: =RC[-1] -> 1|1|1|1 | AG477: 1 | AH477: 1 | AI477: 1
A478: 13380 | B478: 任选20资橙品英雄 | C478: 13030 | D478: 4 | E478: 2 | F478: 2 | G478: 1 | H478: 1 | I478: 10 | J478: 0 | K478: 0 | L478: 0 | N478: 0 | O478: 可从所有20资质的橙品英雄中任选其中一个获得。 | P478: 999999 | Q478: 1 | R478: 0 | S478: 0 | T478: 13381|13382|13383 | U478: 1|1|1 | V478: =RC[-1] -> 1|1|1 | AG478: 1 | AH478: 1 | AI478: 1
A479: 13381 | B479: 20资推荐英雄 | C479: 13030 | D479: 4 | E479: 2 | F479: 2 | G479: 1 | H479: 1 | I479: 10 | J479: 0 | K479: 0 | L479: 0 | N479: 0 | O479: 可从最强橙品合击英雄、最强控场英雄、控场英雄合击搭档中任选其中一个获得。 | P479: 999999 | Q479: 1 | R479: 0 | S479: 0 | T479: 13422|13424|13425|13426 | U479: 1|1|1|1 | V479: =RC[-1] -> 1|1|1|1 | AG479: 1 | AH479: 1 | AI479: 1
A480: 13382 | B480: 20资推荐英雄 | C480: 13030 | D480: 4 | E480: 2 | F480: 2 | G480: 1 | H480: 1 | I480: 10 | J480: 0 | K480: 0 | L480: 0 | N480: 0 | O480: 可从其他有合击的橙品英雄中任选其中一个获得。 | P480: 999999 | Q480: 1 | R480: 0 | S480: 0 | T480: 13427|13428|13429|13430 | U480: 1|1|1|1 | V480: =RC[-1] -> 1|1|1|1 | AG480: 1 | AH480: 1 | AI480: 1
A481: 13383 | B481: 20资无合击英雄 | C481: 13030 | D481: 4 | E481: 2 | F481: 2 | G481: 1 | H481: 1 | I481: 10 | J481: 0 | K481: 0 | L481: 0 | N481: 0 | O481: 可从6个无合击的橙品英雄中任选其中一个获得。 | P481: 999999 | Q481: 1 | R481: 0 | S481: 0 | T481: 13431|13432 | U481: 1|1 | V481: =RC[-1] -> 1|1 | AG481: 1 | AH481: 1 | AI481: 1
A482: 13384 | B482: 顶级红品英雄 | C482: 13030 | D482: 5 | E482: 2 | F482: 2 | G482: 1 | H482: 1 | I482: 10 | J482: 0 | K482: 0 | L482: 0 | N482: 0 | O482: 可从6个顶级红品英雄中任选其中一个获得。 | P482: 999999 | Q482: 1 | R482: 0 | S482: 0 | T482: 13464|13465|13466 | U482: 1|1|1 | V482: =RC[-1] -> 1|1|1 | AG482: 1 | AH482: 1 | AI482: 1
A483: 13385 | B483: 顶级红品英雄碎片 | C483: 13030 | D483: 5 | E483: 2 | F483: 2 | G483: 1 | H483: 1 | I483: 10 | J483: 0 | K483: 0 | L483: 0 | N483: 0 | O483: 可从6个顶级红品英雄的碎片中任选其中一个获得。 | P483: 999999 | Q483: 1 | R483: 0 | S483: 0 | T483: 13467|13468|13469 | U483: 1|1|1 | V483: =RC[-1] -> 1|1|1 | AA483: 1 | AG483: 1 | AH483: 1 | AI483: 1
A484: 13386 | B484: 强力控场英雄碎片 | C484: 13030 | D484: 4 | E484: 2 | F484: 2 | G484: 1 | H484: 1 | I484: 10 | J484: 0 | K484: 0 | L484: 0 | N484: 0 | O484: 可从雷神碎片、美杜莎碎片、牛头人碎片中选择20个获得。 | P484: 999999 | Q484: 1 | R484: 0 | S484: 0 | T484: 12402|12432|12462 | U484: 20|20|20 | V484: =RC[-1] -> 20|20|20 | AA484: 1 | AG484: 1 | AH484: 1 | AI484: 1
A485: 13387 | B485: 控场英雄合击搭档碎片 | C485: 13030 | D485: 4 | E485: 2 | F485: 2 | G485: 1 | H485: 1 | I485: 10 | J485: 0 | K485: 0 | L485: 0 | N485: 0 | O485: 可从野蛮巨人碎片、德古拉伯爵碎片、火女碎片中选择20个获得。 | P485: 999999 | Q485: 1 | R485: 0 | S485: 0 | T485: 12403|12433|12463 | U485: 20|20|20 | V485: =RC[-1] -> 20|20|20 | AA485: 1 | AG485: 1 | AH485: 1 | AI485: 1
A486: 13388 | B486: 任选青鸟套装 | C486: 13020 | D486: 3 | E486: 2 | F486: 2 | G486: 1 | H486: 1 | I486: 10 | J486: 0 | K486: 0 | L486: 0 | N486: 0 | O486: 可从青鸟法球、青鸟盔甲、青鸟长靴、青鸟护腕中任选其中一个获得。 | P486: 999999 | Q486: 7 | R486: 0 | S486: 0 | T486: 20305|21305|22305|23305 | U486: 1|1|1|1 | V486: =RC[-1] -> 1|1|1|1 | AC486: 1 | AG486: 1 | AH486: 1 | AI486: 1
A487: 13389 | B487: 任选顶级套装装备 | C487: 13020 | D487: 5 | E487: 2 | F487: 2 | G487: 1 | H487: 1 | I487: 10 | J487: 0 | K487: 0 | L487: 0 | N487: 0 | O487: 可从品级36的红品套装装备【永恒破碎】【永恒虚无】【永恒时空】【永恒光辉】中选择一件获得。 | P487: 999999 | Q487: 7 | R487: 0 | S487: 0 | T487: 20502|21502|22502|23502 | U487: 1|1|1|1 | V487: =RC[-1] -> 1|1|1|1 | AC487: 1 | AF487: UI_taozhuang_hongse | AG487: 1 | AH487: 1 | AI487: 1
A488: 13390 | B488: 任选顶级符文 | C488: 13040 | D488: 5 | E488: 2 | F488: 2 | G488: 1 | H488: 1 | I488: 10 | J488: 0 | K488: 0 | L488: 0 | N488: 0 | O488: 可从【王者符文】【毁灭符文】【永寂符文】【疯狂符文】中选择一个获得。 | P488: 999999 | Q488: 13 | R488: 0 | S488: 0 | T488: 40501|40502|40503|40504 | U488: 1|1|1|1 | V488: =RC[-1] -> 1|1|1|1 | AD488: 1 | AG488: 1 | AH488: 1 | AI488: 1
A489: 13391 | B489: 任选顶级徽章 | C489: 13040 | D489: 5 | E489: 2 | F489: 2 | G489: 1 | H489: 1 | I489: 10 | J489: 0 | K489: 0 | L489: 0 | N489: 0 | O489: 可从【恒阳徽章】【巨龙徽章】【凤凰徽章】【神树徽章】中选择一个获得。 | P489: 999999 | Q489: 13 | R489: 0 | S489: 0 | T489: 41501|41502|41503|41504 | U489: 1|1|1|1 | V489: =RC[-1] -> 1|1|1|1 | AD489: 1 | AG489: 1 | AH489: 1 | AI489: 1
A490: 13392 | B490: 任选顶级圣器 | C490: 13040 | D490: 5 | E490: 2 | F490: 2 | G490: 1 | H490: 1 | I490: 10 | J490: 0 | K490: 0 | L490: 0 | N490: 0 | O490: 可从王者、毁灭、永寂、疯狂、衡阳、巨龙、凤凰、神树，8种圣器中选择一个获得。 | P490: 999999 | Q490: 13 | R490: 0 | S490: 0 | T490: 13390|13391 | U490: 1|1 | V490: =RC[-1] -> 1|1 | AD490: 1 | AG490: 1 | AH490: 1 | AI490: 1
A491: 13393 | B491: 任选顶级装备 | C491: 13020 | D491: 5 | E491: 2 | F491: 2 | G491: 1 | H491: 1 | I491: 10 | J491: 0 | K491: 0 | L491: 0 | N491: 0 | O491: 可从品级32的红品装备【神圣复仇】【地狱哀歌】【贯穿苍穹】【苍白正义】中选择一件获得。 | P491: 999999 | Q491: 7 | R491: 0 | S491: 0 | T491: 20501|21501|22501|23501 | U491: 1|1|1|1 | V491: =RC[-1] -> 1|1|1|1 | AC491: 1 | AG491: 1 | AH491: 1 | AI491: 1
A492: 13394 | B492: 黑暗骑士宿命圣器 | C492: 13041 | D492: 5 | E492: 2 | F492: 2 | G492: 1 | H492: 1 | I492: 10 | J492: 0 | K492: 0 | L492: 0 | N492: 0 | O492: 可从黑暗骑士宿命符文、黑暗骑士宿命徽章中选择一个获得。 | P492: 999999 | Q492: 1 | R492: 0 | S492: 0 | T492: 13691|13694 | U492: 1|1 | V492: =RC[-1] -> 1|1 | AD492: 1 | AG492: 1 | AH492: 1 | AI492: 1
A493: 13395 | B493: 奎爷宿命圣器 | C493: 13042 | D493: 5 | E493: 2 | F493: 2 | G493: 1 | H493: 1 | I493: 10 | J493: 0 | K493: 0 | L493: 0 | N493: 0 | O493: 可从奎爷宿命符文、奎爷宿命徽章中选择一个获得。 | P493: 999999 | Q493: 1 | R493: 0 | S493: 0 | T493: 13692|13695 | U493: 1|1 | V493: =RC[-1] -> 1|1 | AD493: 1 | AG493: 1 | AH493: 1 | AI493: 1
A494: 13396 | B494: 钢铁酋长宿命圣器 | C494: 13043 | D494: 5 | E494: 2 | F494: 2 | G494: 1 | H494: 1 | I494: 10 | J494: 0 | K494: 0 | L494: 0 | N494: 0 | O494: 可从钢铁酋长宿命符文、钢铁酋长宿命徽章中选择一个获得。 | P494: 999999 | Q494: 1 | R494: 0 | S494: 0 | T494: 13693|13696 | U494: 1|1 | V494: =RC[-1] -> 1|1 | AD494: 1 | AG494: 1 | AH494: 1 | AI494: 1
A495: 13397 | B495: 红品英雄宿命圣器 | C495: 13040 | D495: 5 | E495: 2 | F495: 2 | G495: 1 | H495: 1 | I495: 10 | J495: 0 | K495: 0 | L495: 0 | N495: 0 | O495: 可从黑暗骑士宿命装备、奎爷宿命装备、钢铁酋长宿命装备中选择一个获得。 | P495: 999999 | Q495: 1 | R495: 0 | S495: 0 | T495: 13394|13395|13396 | U495: 1|1|1 | V495: =RC[-1] -> 1|1|1 | AD495: 1 | AG495: 1 | AH495: 1 | AI495: 1
A496: 13398 | B496: 红品英雄宿命装备 | C496: 13020 | D496: 5 | E496: 2 | F496: 2 | G496: 1 | H496: 1 | I496: 10 | J496: 0 | K496: 0 | L496: 0 | N496: 0 | O496: 可从黑暗骑士宿命装备、奎爷宿命装备、钢铁酋长宿命装备中选择一个获得。 | P496: 999999 | Q496: 1 | R496: 0 | S496: 0 | T496: 13697|13698|13699 | U496: 1|1|1 | V496: =RC[-1] -> 1|1|1 | AC496: 1 | AG496: 1 | AH496: 1 | AI496: 1
A497: 13399 | B497: 最强橙品合击英雄 | C497: 13030 | D497: 4 | E497: 2 | F497: 2 | G497: 1 | H497: 1 | I497: 10 | J497: 0 | K497: 0 | L497: 0 | N497: 0 | O497: 可从树人、斯巴达、熊阿宝中选择一个获得。 | P497: 999999 | Q497: 1 | R497: 0 | S497: 0 | T497: 30411|31410|32412 | U497: 1|1|1 | V497: =RC[-1] -> 1|1|1 | AB497: 1 | AG497: 1 | AH497: 1 | AI497: 1
A498: 13400 | B498: 最强橙品英雄 | C498: 13031 | D498: 4 | E498: 2 | F498: 2 | G498: 1 | H498: 1 | I498: 10 | J498: 0 | K498: 0 | L498: 0 | N498: 0 | O498: 可从铁人、宙斯、小黑中选择一个获得。 | P498: 999999 | Q498: 1 | R498: 0 | S498: 0 | T498: 30428|31438|32428 | U498: 1|1|1 | V498: =RC[-1] -> 1|1|1 | AB498: 1 | AG498: 1 | AH498: 1 | AI498: 1
A499: 13401 | B499: 顶级英雄碎片A | C499: 13032 | D499: 5 | E499: 2 | F499: 2 | G499: 1 | H499: 1 | I499: 10 | J499: 0 | K499: 0 | L499: 0 | N499: 0 | O499: 可从黑暗骑士碎片、奎爷碎片、钢铁酋长碎片中选择一个获得。 | P499: 999999 | Q499: 1 | R499: 0 | S499: 0 | T499: 12500|12531|12561 | U499: 1|1|1 | V499: =RC[-1] -> 1|1|1 | AA499: 1 | AG499: 1 | AH499: 1 | AI499: 1 | AJ499: =RC[4]&"|"&RC[5]&"|"&RC[6] -> 12500|12530|12560 | AK499: 黑暗骑士 | AL499: 潘多拉 | AM499: 巫妖之王 | AN499: =VLOOKUP(RC[-3]&"碎片",IF({1,0},R200C2:R294C2,R200C1:R294C1),2,FALSE) -> 12500 | AO499: =VLOOKUP(RC[-3]&"碎片",IF({1,0},R200C2:R294C2,R200C1:R294C1),2,FALSE) -> 12530 | AP499: =VLOOKUP(RC[-3]&"碎片",IF({1,0},R200C2:R294C2,R200C1:R294C1),2,FALSE) -> 12560 | AQ499: ="可从"&RC[-6]&"碎片、"&RC[-5]&"碎片、"&RC[-4]&"碎片中选择一个获得。" -> 可从黑暗骑士碎片、潘多拉碎片、巫妖之王碎片中选择一个获得。
A500: 13402 | B500: 顶级英雄碎片B | C500: 13033 | D500: 5 | E500: 2 | F500: 2 | G500: 1 | H500: 1 | I500: 10 | J500: 0 | K500: 0 | L500: 0 | N500: 0 | O500: 可从狼叔碎片、潘多拉碎片、巫妖之王碎片中选择一个获得。 | P500: 999999 | Q500: 1 | R500: 0 | S500: 0 | T500: 12501|12530|12560 | U500: 1|1|1 | V500: =RC[-1] -> 1|1|1 | AA500: 1 | AG500: 1 | AH500: 1 | AI500: 1 | AJ500: =RC[4]&"|"&RC[5]&"|"&RC[6] -> 12501|12531|12561 | AK500: 狼叔 | AL500: 奎爷 | AM500: 钢铁酋长 | AN500: =VLOOKUP(RC[-3]&"碎片",IF({1,0},R200C2:R294C2,R200C1:R294C1),2,FALSE) -> 12501 | AO500: =VLOOKUP(RC[-3]&"碎片",IF({1,0},R200C2:R294C2,R200C1:R294C1),2,FALSE) -> 12531 | AP500: =VLOOKUP(RC[-3]&"碎片",IF({1,0},R200C2:R294C2,R200C1:R294C1),2,FALSE) -> 12561 | AQ500: ="可从"&RC[-6]&"碎片、"&RC[-5]&"碎片、"&RC[-4]&"碎片中选择一个获得。" -> 可从狼叔碎片、奎爷碎片、钢铁酋长碎片中选择一个获得。
A501: 13403 | B501: 顶级合击英雄碎片 | C501: 13030 | D501: 4 | E501: 2 | F501: 2 | G501: 1 | H501: 1 | I501: 10 | J501: 0 | K501: 0 | L501: 0 | N501: 0 | O501: 可从地狱铁拳碎片、冥王哈迪斯碎片、恶魔猎手碎片中选择一个获得。 | P501: 999999 | Q501: 1 | R501: 0 | S501: 0 | T501: 12412|12443|12472 | U501: 1|1|1 | V501: =RC[-1] -> 1|1|1 | AA501: 1 | AG501: 1 | AH501: 1 | AI501: 1 | AJ501: =RC[4]&"|"&RC[5]&"|"&RC[6] -> 12412|12442|12472 | AK501: 地狱铁拳 | AL501: 大力神 | AM501: 恶魔猎手 | AN501: =VLOOKUP(RC[-3]&"碎片",IF({1,0},R200C2:R294C2,R200C1:R294C1),2,FALSE) -> 12412 | AO501: =VLOOKUP(RC[-3]&"碎片",IF({1,0},R200C2:R294C2,R200C1:R294C1),2,FALSE) -> 12442 | AP501: =VLOOKUP(RC[-3]&"碎片",IF({1,0},R200C2:R294C2,R200C1:R294C1),2,FALSE) -> 12472 | AQ501: ="可从"&RC[-6]&"碎片、"&RC[-5]&"碎片、"&RC[-4]&"碎片中选择一个获得。" -> 可从地狱铁拳碎片、大力神碎片、恶魔猎手碎片中选择一个获得。
A502: 13404 | B502: 顶级合击英雄碎片 | C502: 13030 | D502: 4 | E502: 2 | F502: 2 | G502: 1 | H502: 1 | I502: 10 | J502: 0 | K502: 0 | L502: 0 | N502: 0 | O502: 可从混沌女巫碎片、大力神碎片、神圣牧师碎片中选择一个获得。 | P502: 999999 | Q502: 1 | R502: 0 | S502: 0 | T502: 12413|12442|12473 | U502: 1|1|1 | V502: =RC[-1] -> 1|1|1 | AA502: 1 | AG502: 1 | AH502: 1 | AI502: 1 | AJ502: =RC[4]&"|"&RC[5]&"|"&RC[6] -> 12413|12443|12473 | AK502: 混沌女巫 | AL502: 冥王哈迪斯 | AM502: 神圣牧师 | AN502: =VLOOKUP(RC[-3]&"碎片",IF({1,0},R200C2:R294C2,R200C1:R294C1),2,FALSE) -> 12413 | AO502: =VLOOKUP(RC[-3]&"碎片",IF({1,0},R200C2:R294C2,R200C1:R294C1),2,FALSE) -> 12443 | AP502: =VLOOKUP(RC[-3]&"碎片",IF({1,0},R200C2:R294C2,R200C1:R294C1),2,FALSE) -> 12473 | AQ502: ="可从"&RC[-6]&"碎片、"&RC[-5]&"碎片、"&RC[-4]&"碎片中选择一个获得。" -> 可从混沌女巫碎片、冥王哈迪斯碎片、神圣牧师碎片中选择一个获得。
A503: 13405 | B503: 最强橙品英雄碎片 | C503: 13030 | D503: 4 | E503: 2 | F503: 2 | G503: 1 | H503: 1 | I503: 10 | J503: 0 | K503: 0 | L503: 0 | N503: 0 | O503: 可从铁人碎片、宙斯碎片、小黑碎片中选择一个获得。 | P503: 999999 | Q503: 1 | R503: 0 | S503: 0 | T503: 12408|12438|12468 | U503: 1|1|1 | V503: =RC[-1] -> 1|1|1 | AA503: 1 | AG503: 1 | AH503: 1 | AI503: 1 | AJ503: =RC[4]&"|"&RC[5]&"|"&RC[6] -> 12408|12438|12468 | AK503: 铁人 | AL503: 宙斯 | AM503: 小黑 | AN503: =VLOOKUP(RC[-3]&"碎片",IF({1,0},R200C2:R294C2,R200C1:R294C1),2,FALSE) -> 12408 | AO503: =VLOOKUP(RC[-3]&"碎片",IF({1,0},R200C2:R294C2,R200C1:R294C1),2,FALSE) -> 12438 | AP503: =VLOOKUP(RC[-3]&"碎片",IF({1,0},R200C2:R294C2,R200C1:R294C1),2,FALSE) -> 12468 | AQ503: ="可从"&RC[-6]&"碎片、"&RC[-5]&"碎片、"&RC[-4]&"碎片中选择一个获得。" -> 可从铁人碎片、宙斯碎片、小黑碎片中选择一个获得。
A504: 13406 | B504: 最强橙品合击英雄碎片 | C504: 13030 | D504: 4 | E504: 2 | F504: 2 | G504: 1 | H504: 1 | I504: 10 | J504: 0 | K504: 0 | L504: 0 | N504: 0 | O504: 可从树人碎片、斯巴达碎片、熊阿宝碎片中选择一个获得。 | P504: 999999 | Q504: 1 | R504: 0 | S504: 0 | T504: 12409|12439|12469 | U504: 1|1|1 | V504: =RC[-1] -> 1|1|1 | AA504: 1 | AG504: 1 | AH504: 1 | AI504: 1 | AJ504: =RC[4]&"|"&RC[5]&"|"&RC[6] -> 12409|12439|12469 | AK504: 树人 | AL504: 斯巴达 | AM504: 熊阿宝 | AN504: =VLOOKUP(RC[-3]&"碎片",IF({1,0},R200C2:R294C2,R200C1:R294C1),2,FALSE) -> 12409 | AO504: =VLOOKUP(RC[-3]&"碎片",IF({1,0},R200C2:R294C2,R200C1:R294C1),2,FALSE) -> 12439 | AP504: =VLOOKUP(RC[-3]&"碎片",IF({1,0},R200C2:R294C2,R200C1:R294C1),2,FALSE) -> 12469 | AQ504: ="可从"&RC[-6]&"碎片、"&RC[-5]&"碎片、"&RC[-4]&"碎片中选择一个获得。" -> 可从树人碎片、斯巴达碎片、熊阿宝碎片中选择一个获得。
A505: 13407 | B505: 最强橙品英雄碎片 | C505: 13030 | D505: 4 | E505: 2 | F505: 2 | G505: 1 | H505: 1 | I505: 10 | J505: 0 | K505: 0 | L505: 0 | N505: 0 | O505: 可从超凡博士碎片、阿努比斯碎片、血色指挥官碎片中选择一个获得。 | P505: 999999 | Q505: 1 | R505: 0 | S505: 0 | T505: 12410|12440|12470 | U505: 1|1|1 | V505: =RC[-1] -> 1|1|1 | AA505: 1 | AG505: 1 | AH505: 1 | AI505: 1 | AJ505: =RC[4]&"|"&RC[5]&"|"&RC[6] -> 12410|12440|12470 | AK505: 超凡博士 | AL505: 阿努比斯 | AM505: 血色指挥官 | AN505: =VLOOKUP(RC[-3]&"碎片",IF({1,0},R200C2:R294C2,R200C1:R294C1),2,FALSE) -> 12410 | AO505: =VLOOKUP(RC[-3]&"碎片",IF({1,0},R200C2:R294C2,R200C1:R294C1),2,FALSE) -> 12440 | AP505: =VLOOKUP(RC[-3]&"碎片",IF({1,0},R200C2:R294C2,R200C1:R294C1),2,FALSE) -> 12470 | AQ505: ="可从"&RC[-6]&"碎片、"&RC[-5]&"碎片、"&RC[-4]&"碎片中选择一个获得。" -> 可从超凡博士碎片、阿努比斯碎片、血色指挥官碎片中选择一个获得。
A506: 13408 | B506: 最强橙品合击英雄碎片 | C506: 13030 | D506: 4 | E506: 2 | F506: 2 | G506: 1 | H506: 1 | I506: 10 | J506: 0 | K506: 0 | L506: 0 | N506: 0 | O506: 可从白凤凰碎片、雅典娜碎片、大检察官碎片中选择一个获得。 | P506: 999999 | Q506: 1 | R506: 0 | S506: 0 | T506: 12411|12441|12471 | U506: 1|1|1 | V506: =RC[-1] -> 1|1|1 | AA506: 1 | AG506: 1 | AH506: 1 | AI506: 1 | AJ506: =RC[4]&"|"&RC[5]&"|"&RC[6] -> 12411|12441|12471 | AK506: 白凤凰 | AL506: 雅典娜 | AM506: 大检察官 | AN506: =VLOOKUP(RC[-3]&"碎片",IF({1,0},R200C2:R294C2,R200C1:R294C1),2,FALSE) -> 12411 | AO506: =VLOOKUP(RC[-3]&"碎片",IF({1,0},R200C2:R294C2,R200C1:R294C1),2,FALSE) -> 12441 | AP506: =VLOOKUP(RC[-3]&"碎片",IF({1,0},R200C2:R294C2,R200C1:R294C1),2,FALSE) -> 12471 | AQ506: ="可从"&RC[-6]&"碎片、"&RC[-5]&"碎片、"&RC[-4]&"碎片中选择一个获得。" -> 可从白凤凰碎片、雅典娜碎片、大检察官碎片中选择一个获得。
A507: 13409 | B507: 强力控场英雄碎片 | C507: 13030 | D507: 4 | E507: 2 | F507: 2 | G507: 1 | H507: 1 | I507: 10 | J507: 0 | K507: 0 | L507: 0 | N507: 0 | O507: 可从雷神碎片、美杜莎碎片、牛头人碎片中选择一个获得。 | P507: 999999 | Q507: 1 | R507: 0 | S507: 0 | T507: 12402|12432|12462 | U507: 1|1|1 | V507: =RC[-1] -> 1|1|1 | AA507: 1 | AG507: 1 | AH507: 1 | AI507: 1 | AJ507: =RC[4]&"|"&RC[5]&"|"&RC[6] -> 12402|12432|12462 | AK507: 雷神 | AL507: 美杜莎 | AM507: 牛头人 | AN507: =VLOOKUP(RC[-3]&"碎片",IF({1,0},R200C2:R294C2,R200C1:R294C1),2,FALSE) -> 12402 | AO507: =VLOOKUP(RC[-3]&"碎片",IF({1,0},R200C2:R294C2,R200C1:R294C1),2,FALSE) -> 12432 | AP507: =VLOOKUP(RC[-3]&"碎片",IF({1,0},R200C2:R294C2,R200C1:R294C1),2,FALSE) -> 12462 | AQ507: ="可从"&RC[-6]&"碎片、"&RC[-5]&"碎片、"&RC[-4]&"碎片中选择一个获得。" -> 可从雷神碎片、美杜莎碎片、牛头人碎片中选择一个获得。
A508: 13410 | B508: 橙品副英雄碎片1 | C508: 13030 | D508: 4 | E508: 2 | F508: 2 | G508: 1 | H508: 1 | I508: 10 | J508: 0 | K508: 0 | L508: 0 | N508: 0 | O508: 可从野蛮巨人碎片、德古拉伯爵碎片、火女碎片中选择一个获得。 | P508: 999999 | Q508: 1 | R508: 0 | S508: 0 | T508: 12403|12433|12463 | U508: 1|1|1 | V508: =RC[-1] -> 1|1|1 | AA508: 1 | AG508: 1 | AH508: 1 | AI508: 1 | AJ508: =RC[4]&"|"&RC[5]&"|"&RC[6] -> 12403|12433|12463 | AK508: 野蛮巨人 | AL508: 德古拉伯爵 | AM508: 火女 | AN508: =VLOOKUP(RC[-3]&"碎片",IF({1,0},R200C2:R294C2,R200C1:R294C1),2,FALSE) -> 12403 | AO508: =VLOOKUP(RC[-3]&"碎片",IF({1,0},R200C2:R294C2,R200C1:R294C1),2,FALSE) -> 12433 | AP508: =VLOOKUP(RC[-3]&"碎片",IF({1,0},R200C2:R294C2,R200C1:R294C1),2,FALSE) -> 12463 | AQ508: ="可从"&RC[-6]&"碎片、"&RC[-5]&"碎片、"&RC[-4]&"碎片中选择一个获得。" -> 可从野蛮巨人碎片、德古拉伯爵碎片、火女碎片中选择一个获得。
A509: 13411 | B509: 橙品主英雄碎片2 | C509: 13030 | D509: 4 | E509: 2 | F509: 2 | G509: 1 | H509: 1 | I509: 10 | J509: 0 | K509: 0 | L509: 0 | N509: 0 | O509: 可从致命特工碎片、狩猎女神碎片、半人马碎片中选择一个获得。 | P509: 999999 | Q509: 1 | R509: 0 | S509: 0 | T509: 12404|12434|12464 | U509: 1|1|1 | V509: =RC[-1] -> 1|1|1 | AA509: 1 | AG509: 1 | AH509: 1 | AI509: 1 | AJ509: =RC[4]&"|"&RC[5]&"|"&RC[6] -> 12404|12434|12464 | AK509: 致命特工 | AL509: 狩猎女神 | AM509: 半人马 | AN509: =VLOOKUP(RC[-3]&"碎片",IF({1,0},R200C2:R294C2,R200C1:R294C1),2,FALSE) -> 12404 | AO509: =VLOOKUP(RC[-3]&"碎片",IF({1,0},R200C2:R294C2,R200C1:R294C1),2,FALSE) -> 12434 | AP509: =VLOOKUP(RC[-3]&"碎片",IF({1,0},R200C2:R294C2,R200C1:R294C1),2,FALSE) -> 12464 | AQ509: ="可从"&RC[-6]&"碎片、"&RC[-5]&"碎片、"&RC[-4]&"碎片中选择一个获得。" -> 可从致命特工碎片、狩猎女神碎片、半人马碎片中选择一个获得。
A510: 13412 | B510: 橙品副英雄碎片2 | C510: 13030 | D510: 4 | E510: 2 | F510: 2 | G510: 1 | H510: 1 | I510: 10 | J510: 0 | K510: 0 | L510: 0 | N510: 0 | O510: 可从鹰眸碎片、查理大帝碎片、食人魔碎片中选择一个获得。 | P510: 999999 | Q510: 1 | R510: 0 | S510: 0 | T510: 12405|12435|12465 | U510: 1|1|1 | V510: =RC[-1] -> 1|1|1 | AA510: 1 | AG510: 1 | AH510: 1 | AI510: 1 | AJ510: =RC[4]&"|"&RC[5]&"|"&RC[6] -> 12405|12435|12465 | AK510: 鹰眸 | AL510: 查理大帝 | AM510: 食人魔 | AN510: =VLOOKUP(RC[-3]&"碎片",IF({1,0},R200C2:R294C2,R200C1:R294C1),2,FALSE) -> 12405 | AO510: =VLOOKUP(RC[-3]&"碎片",IF({1,0},R200C2:R294C2,R200C1:R294C1),2,FALSE) -> 12435 | AP510: =VLOOKUP(RC[-3]&"碎片",IF({1,0},R200C2:R294C2,R200C1:R294C1),2,FALSE) -> 12465 | AQ510: ="可从"&RC[-6]&"碎片、"&RC[-5]&"碎片、"&RC[-4]&"碎片中选择一个获得。" -> 可从鹰眸碎片、查理大帝碎片、食人魔碎片中选择一个获得。
A511: 13413 | B511: 橙品主英雄碎片3 | C511: 13030 | D511: 4 | E511: 2 | F511: 2 | G511: 1 | H511: 1 | I511: 10 | J511: 0 | K511: 0 | L511: 0 | N511: 0 | O511: 可从刀锋猎人碎片、佐罗碎片、基伦碎片中选择一个获得。 | P511: 999999 | Q511: 1 | R511: 0 | S511: 0 | T511: 12406|12436|12466 | U511: 1|1|1 | V511: =RC[-1] -> 1|1|1 | AA511: 1 | AG511: 1 | AH511: 1 | AI511: 1 | AJ511: =RC[4]&"|"&RC[5]&"|"&RC[6] -> 12406|12436|12466 | AK511: 刀锋猎人 | AL511: 佐罗 | AM511: 基伦 | AN511: =VLOOKUP(RC[-3]&"碎片",IF({1,0},R200C2:R294C2,R200C1:R294C1),2,FALSE) -> 12406 | AO511: =VLOOKUP(RC[-3]&"碎片",IF({1,0},R200C2:R294C2,R200C1:R294C1),2,FALSE) -> 12436 | AP511: =VLOOKUP(RC[-3]&"碎片",IF({1,0},R200C2:R294C2,R200C1:R294C1),2,FALSE) -> 12466 | AQ511: ="可从"&RC[-6]&"碎片、"&RC[-5]&"碎片、"&RC[-4]&"碎片中选择一个获得。" -> 可从刀锋猎人碎片、佐罗碎片、基伦碎片中选择一个获得。
A512: 13414 | B512: 橙品副英雄碎片3 | C512: 13030 | D512: 4 | E512: 2 | F512: 2 | G512: 1 | H512: 1 | I512: 10 | J512: 0 | K512: 0 | L512: 0 | N512: 0 | O512: 可从地狱骑士碎片、亚马逊女王碎片、女警碎片中选择一个获得。 | P512: 999999 | Q512: 1 | R512: 0 | S512: 0 | T512: 12407|12437|12467 | U512: 1|1|1 | V512: =RC[-1] -> 1|1|1 | AA512: 1 | AG512: 1 | AH512: 1 | AI512: 1 | AJ512: =RC[4]&"|"&RC[5]&"|"&RC[6] -> 12407|12437|12467 | AK512: 地狱骑士 | AL512: 亚马逊女王 | AM512: 女警 | AN512: =VLOOKUP(RC[-3]&"碎片",IF({1,0},R200C2:R294C2,R200C1:R294C1),2,FALSE) -> 12407 | AO512: =VLOOKUP(RC[-3]&"碎片",IF({1,0},R200C2:R294C2,R200C1:R294C1),2,FALSE) -> 12437 | AP512: =VLOOKUP(RC[-3]&"碎片",IF({1,0},R200C2:R294C2,R200C1:R294C1),2,FALSE) -> 12467 | AQ512: ="可从"&RC[-6]&"碎片、"&RC[-5]&"碎片、"&RC[-4]&"碎片中选择一个获得。" -> 可从地狱骑士碎片、亚马逊女王碎片、女警碎片中选择一个获得。
A513: 13415 | B513: 橙品英雄碎片1 | C513: 13030 | D513: 4 | E513: 2 | F513: 2 | G513: 1 | H513: 1 | I513: 10 | J513: 0 | K513: 0 | L513: 0 | N513: 0 | O513: 可从红颅鬼碎片、独眼巨人碎片、憎恶碎片中选择一个获得。 | P513: 999999 | Q513: 1 | R513: 0 | S513: 0 | T513: 12400|12430|12460 | U513: 1|1|1 | V513: =RC[-1] -> 1|1|1 | AA513: 1 | AG513: 1 | AH513: 1 | AI513: 1 | AJ513: =RC[4]&"|"&RC[5]&"|"&RC[6] -> 12400|12430|12460 | AK513: 红颅鬼 | AL513: 独眼巨人 | AM513: 憎恶 | AN513: =VLOOKUP(RC[-3]&"碎片",IF({1,0},R200C2:R294C2,R200C1:R294C1),2,FALSE) -> 12400 | AO513: =VLOOKUP(RC[-3]&"碎片",IF({1,0},R200C2:R294C2,R200C1:R294C1),2,FALSE) -> 12430 | AP513: =VLOOKUP(RC[-3]&"碎片",IF({1,0},R200C2:R294C2,R200C1:R294C1),2,FALSE) -> 12460 | AQ513: ="可从"&RC[-6]&"碎片、"&RC[-5]&"碎片、"&RC[-4]&"碎片中选择一个获得。" -> 可从红颅鬼碎片、独眼巨人碎片、憎恶碎片中选择一个获得。
A514: 13416 | B514: 橙品英雄碎片2 | C514: 13030 | D514: 4 | E514: 2 | F514: 2 | G514: 1 | H514: 1 | I514: 10 | J514: 0 | K514: 0 | L514: 0 | N514: 0 | O514: 可从终极队长碎片、圣女贞德碎片、树精碎片中选择一个获得。 | P514: 999999 | Q514: 1 | R514: 0 | S514: 0 | T514: 12401|12431|12461 | U514: 1|1|1 | V514: =RC[-1] -> 1|1|1 | AA514: 1 | AG514: 1 | AH514: 1 | AI514: 1 | AJ514: =RC[4]&"|"&RC[5]&"|"&RC[6] -> 12401|12431|12461 | AK514: 终极队长 | AL514: 圣女贞德 | AM514: 树精 | AN514: =VLOOKUP(RC[-3]&"碎片",IF({1,0},R200C2:R294C2,R200C1:R294C1),2,FALSE) -> 12401 | AO514: =VLOOKUP(RC[-3]&"碎片",IF({1,0},R200C2:R294C2,R200C1:R294C1),2,FALSE) -> 12431 | AP514: =VLOOKUP(RC[-3]&"碎片",IF({1,0},R200C2:R294C2,R200C1:R294C1),2,FALSE) -> 12461 | AQ514: ="可从"&RC[-6]&"碎片、"&RC[-5]&"碎片、"&RC[-4]&"碎片中选择一个获得。" -> 可从终极队长碎片、圣女贞德碎片、树精碎片中选择一个获得。
A515: 13417 | B515: 顶级红品英雄A | C515: 13032 | D515: 5 | E515: 2 | F515: 2 | G515: 1 | H515: 1 | I515: 10 | J515: 0 | K515: 0 | L515: 0 | N515: 0 | O515: 可从黑暗骑士、奎爷、钢铁酋长中选择一个获得。 | P515: 999999 | Q515: 1 | R515: 0 | S515: 0 | T515: 30520|31500|32510 | U515: 1|1|1 | V515: =RC[-1] -> 1|1|1 | AB515: 1 | AG515: 1 | AH515: 1 | AI515: 1 | AJ515: =RC[4]&"|"&RC[5]&"|"&RC[6] -> 30520|31530|32500 | AK515: 黑暗骑士 | AL515: 潘多拉 | AM515: 巫妖之王 | AN515: 30520 | AO515: 31530 | AP515: 32500 | AQ515: ="可从"&RC[-6]&"、"&RC[-5]&"、"&RC[-4]&"中选择一个获得。" -> 可从黑暗骑士、潘多拉、巫妖之王中选择一个获得。
A516: 13418 | B516: 顶级红品英雄B | C516: 13033 | D516: 5 | E516: 2 | F516: 2 | G516: 1 | H516: 1 | I516: 10 | J516: 0 | K516: 0 | L516: 0 | N516: 0 | O516: 可从狼叔、潘多拉、巫妖之王中选择一个获得。 | P516: 999999 | Q516: 1 | R516: 0 | S516: 0 | T516: 30500|31530|32500 | U516: 1|1|1 | V516: =RC[-1] -> 1|1|1 | AB516: 1 | AG516: 1 | AH516: 1 | AI516: 1 | AJ516: =RC[4]&"|"&RC[5]&"|"&RC[6] -> 30500|31500|32510 | AK516: 狼叔 | AL516: 奎爷 | AM516: 钢铁酋长 | AN516: 30500 | AO516: 31500 | AP516: 32510 | AQ516: ="可从"&RC[-6]&"、"&RC[-5]&"、"&RC[-4]&"中选择一个获得。" -> 可从狼叔、奎爷、钢铁酋长中选择一个获得。
A517: 13419 | B517: 顶级英雄合击搭档 | C517: 13030 | D517: 4 | E517: 2 | F517: 2 | G517: 1 | H517: 1 | I517: 10 | J517: 0 | K517: 0 | L517: 0 | N517: 0 | O517: 可从地狱铁拳、冥王哈迪斯、神圣牧师中选择一个获得。 | P517: 999999 | Q517: 1 | R517: 0 | S517: 0 | T517: 30429|31439|32449 | U517: 1|1|1 | V517: =RC[-1] -> 1|1|1 | AB517: 1 | AG517: 1 | AH517: 1 | AI517: 1 | AJ517: =RC[4]&"|"&RC[5]&"|"&RC[6] -> 30429|31419|32409 | AK517: 地狱铁拳 | AL517: 大力神 | AM517: 恶魔猎手 | AN517: 30429 | AO517: 31419 | AP517: 32409 | AQ517: ="可从"&RC[-6]&"、"&RC[-5]&"、"&RC[-4]&"中选择一个获得。" -> 可从地狱铁拳、大力神、恶魔猎手中选择一个获得。
A518: 13420 | B518: 顶级英雄合击搭档 | C518: 13030 | D518: 4 | E518: 2 | F518: 2 | G518: 1 | H518: 1 | I518: 10 | J518: 0 | K518: 0 | L518: 0 | N518: 0 | O518: 可从混沌女巫、大力神、恶魔猎手中选择一个获得。 | P518: 999999 | Q518: 1 | R518: 0 | S518: 0 | T518: 30449|31419|32409 | U518: 1|1|1 | V518: =RC[-1] -> 1|1|1 | AB518: 1 | AG518: 1 | AH518: 1 | AI518: 1 | AJ518: =RC[4]&"|"&RC[5]&"|"&RC[6] -> 30449|31439|32449 | AK518: 混沌女巫 | AL518: 冥王哈迪斯 | AM518: 神圣牧师 | AN518: 30449 | AO518: 31439 | AP518: 32449 | AQ518: ="可从"&RC[-6]&"、"&RC[-5]&"、"&RC[-4]&"中选择一个获得。" -> 可从混沌女巫、冥王哈迪斯、神圣牧师中选择一个获得。
A519: 13421 | B519: 最强橙品英雄 | C519: 13030 | D519: 4 | E519: 2 | F519: 2 | G519: 1 | H519: 1 | I519: 10 | J519: 0 | K519: 0 | L519: 0 | N519: 0 | O519: 可从铁人、宙斯、小黑中选择一个获得。 | P519: 999999 | Q519: 1 | R519: 0 | S519: 0 | T519: 30428|31438|32428 | U519: 1|1|1 | V519: =RC[-1] -> 1|1|1 | AB519: 1 | AG519: 1 | AH519: 1 | AI519: 1 | AJ519: =RC[4]&"|"&RC[5]&"|"&RC[6] -> 30428|31438|32428 | AK519: 铁人 | AL519: 宙斯 | AM519: 小黑 | AN519: 30428 | AO519: 31438 | AP519: 32428 | AQ519: ="可从"&RC[-6]&"、"&RC[-5]&"、"&RC[-4]&"中选择一个获得。" -> 可从铁人、宙斯、小黑中选择一个获得。
A520: 13422 | B520: 最强橙品合击英雄 | C520: 13030 | D520: 4 | E520: 2 | F520: 2 | G520: 1 | H520: 1 | I520: 10 | J520: 0 | K520: 0 | L520: 0 | N520: 0 | O520: 可从树人、斯巴达、熊阿宝中选择一个获得。 | P520: 999999 | Q520: 1 | R520: 0 | S520: 0 | T520: 30411|31410|32412 | U520: 1|1|1 | V520: =RC[-1] -> 1|1|1 | AB520: 1 | AG520: 1 | AH520: 1 | AI520: 1 | AJ520: =RC[4]&"|"&RC[5]&"|"&RC[6] -> 30411|31410|32412 | AK520: 树人 | AL520: 斯巴达 | AM520: 熊阿宝 | AN520: 30411 | AO520: 31410 | AP520: 32412 | AQ520: ="可从"&RC[-6]&"、"&RC[-5]&"、"&RC[-4]&"中选择一个获得。" -> 可从树人、斯巴达、熊阿宝中选择一个获得。
A521: 13423 | B521: 最强橙品英雄 | C521: 13030 | D521: 4 | E521: 2 | F521: 2 | G521: 1 | H521: 1 | I521: 10 | J521: 0 | K521: 0 | L521: 0 | N521: 0 | O521: 可从超凡博士、阿努比斯、血色指挥官中选择一个获得。 | P521: 999999 | Q521: 1 | R521: 0 | S521: 0 | T521: 30438|31408|32408 | U521: 1|1|1 | V521: =RC[-1] -> 1|1|1 | AB521: 1 | AG521: 1 | AH521: 1 | AI521: 1 | AJ521: =RC[4]&"|"&RC[5]&"|"&RC[6] -> 30438|31408|32408 | AK521: 超凡博士 | AL521: 阿努比斯 | AM521: 血色指挥官 | AN521: 30438 | AO521: 31408 | AP521: 32408 | AQ521: ="可从"&RC[-6]&"、"&RC[-5]&"、"&RC[-4]&"中选择一个获得。" -> 可从超凡博士、阿努比斯、血色指挥官中选择一个获得。
A522: 13424 | B522: 最强橙品合击英雄 | C522: 13030 | D522: 4 | E522: 2 | F522: 2 | G522: 1 | H522: 1 | I522: 10 | J522: 0 | K522: 0 | L522: 0 | N522: 0 | O522: 可从白凤凰、雅典娜、大检察官中选择一个获得。 | P522: 999999 | Q522: 1 | R522: 0 | S522: 0 | T522: 30440|31441|32440 | U522: 1|1|1 | V522: =RC[-1] -> 1|1|1 | AB522: 1 | AG522: 1 | AH522: 1 | AI522: 1 | AJ522: =RC[4]&"|"&RC[5]&"|"&RC[6] -> 30440|31441|32440 | AK522: 白凤凰 | AL522: 雅典娜 | AM522: 大检察官 | AN522: 30440 | AO522: 31441 | AP522: 32440 | AQ522: ="可从"&RC[-6]&"、"&RC[-5]&"、"&RC[-4]&"中选择一个获得。" -> 可从白凤凰、雅典娜、大检察官中选择一个获得。
A523: 13425 | B523: 最强控场英雄 | C523: 13030 | D523: 4 | E523: 2 | F523: 2 | G523: 1 | H523: 1 | I523: 10 | J523: 0 | K523: 0 | L523: 0 | N523: 0 | O523: 可从雷神、美杜莎、牛头人中选择一个获得。 | P523: 999999 | Q523: 1 | R523: 0 | S523: 0 | T523: 30431|31430|32400 | U523: 1|1|1 | V523: =RC[-1] -> 1|1|1 | AB523: 1 | AG523: 1 | AH523: 1 | AI523: 1 | AJ523: =RC[4]&"|"&RC[5]&"|"&RC[6] -> 30431|31430|32400 | AK523: 雷神 | AL523: 美杜莎 | AM523: 牛头人 | AN523: 30431 | AO523: 31430 | AP523: 32400 | AQ523: ="可从"&RC[-6]&"、"&RC[-5]&"、"&RC[-4]&"中选择一个获得。" -> 可从雷神、美杜莎、牛头人中选择一个获得。
A524: 13426 | B524: 控场英雄合击搭档 | C524: 13030 | D524: 4 | E524: 2 | F524: 2 | G524: 1 | H524: 1 | I524: 10 | J524: 0 | K524: 0 | L524: 0 | N524: 0 | O524: 可从野蛮巨人、德古拉伯爵、火女中选择一个获得。 | P524: 999999 | Q524: 1 | R524: 0 | S524: 0 | T524: 30410|31401|32430 | U524: 1|1|1 | V524: =RC[-1] -> 1|1|1 | AB524: 1 | AG524: 1 | AH524: 1 | AI524: 1 | AJ524: =RC[4]&"|"&RC[5]&"|"&RC[6] -> 30410|31401|32430 | AK524: 野蛮巨人 | AL524: 德古拉伯爵 | AM524: 火女 | AN524: 30410 | AO524: 31401 | AP524: 32430 | AQ524: ="可从"&RC[-6]&"、"&RC[-5]&"、"&RC[-4]&"中选择一个获得。" -> 可从野蛮巨人、德古拉伯爵、火女中选择一个获得。
A525: 13427 | B525: 橙品主英雄2 | C525: 13030 | D525: 4 | E525: 2 | F525: 2 | G525: 1 | H525: 1 | I525: 10 | J525: 0 | K525: 0 | L525: 0 | N525: 0 | O525: 可从致命特工、狩猎女神、半人马中选择一个获得。 | P525: 999999 | Q525: 1 | R525: 0 | S525: 0 | T525: 30401|31431|32401 | U525: 1|1|1 | V525: =RC[-1] -> 1|1|1 | AB525: 1 | AG525: 1 | AH525: 1 | AI525: 1 | AJ525: =RC[4]&"|"&RC[5]&"|"&RC[6] -> 30401|31431|32401 | AK525: 致命特工 | AL525: 狩猎女神 | AM525: 半人马 | AN525: 30401 | AO525: 31431 | AP525: 32401 | AQ525: ="可从"&RC[-6]&"、"&RC[-5]&"、"&RC[-4]&"中选择一个获得。" -> 可从致命特工、狩猎女神、半人马中选择一个获得。
A526: 13428 | B526: 橙品副英雄2 | C526: 13030 | D526: 4 | E526: 2 | F526: 2 | G526: 1 | H526: 1 | I526: 10 | J526: 0 | K526: 0 | L526: 0 | N526: 0 | O526: 可从鹰眸、查理大帝、食人魔中选择一个获得。 | P526: 999999 | Q526: 1 | R526: 0 | S526: 0 | T526: 30420|31402|32431 | U526: 1|1|1 | V526: =RC[-1] -> 1|1|1 | AB526: 1 | AG526: 1 | AH526: 1 | AI526: 1 | AJ526: =RC[4]&"|"&RC[5]&"|"&RC[6] -> 30420|31402|32431 | AK526: 鹰眸 | AL526: 查理大帝 | AM526: 食人魔 | AN526: 30420 | AO526: 31402 | AP526: 32431 | AQ526: ="可从"&RC[-6]&"、"&RC[-5]&"、"&RC[-4]&"中选择一个获得。" -> 可从鹰眸、查理大帝、食人魔中选择一个获得。
A527: 13429 | B527: 橙品主英雄3 | C527: 13030 | D527: 4 | E527: 2 | F527: 2 | G527: 1 | H527: 1 | I527: 10 | J527: 0 | K527: 0 | L527: 0 | N527: 0 | O527: 可从刀锋猎人、佐罗、基伦中选择一个获得。 | P527: 999999 | Q527: 1 | R527: 0 | S527: 0 | T527: 30402|31403|32402 | U527: 1|1|1 | V527: =RC[-1] -> 1|1|1 | AB527: 1 | AG527: 1 | AH527: 1 | AI527: 1 | AJ527: =RC[4]&"|"&RC[5]&"|"&RC[6] -> 30402|31403|32402 | AK527: 刀锋猎人 | AL527: 佐罗 | AM527: 基伦 | AN527: 30402 | AO527: 31403 | AP527: 32402 | AQ527: ="可从"&RC[-6]&"、"&RC[-5]&"、"&RC[-4]&"中选择一个获得。" -> 可从刀锋猎人、佐罗、基伦中选择一个获得。
A528: 13430 | B528: 橙品副英雄3 | C528: 13030 | D528: 4 | E528: 2 | F528: 2 | G528: 1 | H528: 1 | I528: 10 | J528: 0 | K528: 0 | L528: 0 | N528: 0 | O528: 可从地狱骑士、亚马逊女王、女警中选择一个获得。 | P528: 999999 | Q528: 1 | R528: 0 | S528: 0 | T528: 30403|31420|32420 | U528: 1|1|1 | V528: =RC[-1] -> 1|1|1 | AB528: 1 | AG528: 1 | AH528: 1 | AI528: 1 | AJ528: =RC[4]&"|"&RC[5]&"|"&RC[6] -> 30403|31420|32420 | AK528: 地狱骑士 | AL528: 亚马逊女王 | AM528: 女警 | AN528: 30403 | AO528: 31420 | AP528: 32420 | AQ528: ="可从"&RC[-6]&"、"&RC[-5]&"、"&RC[-4]&"中选择一个获得。" -> 可从地狱骑士、亚马逊女王、女警中选择一个获得。
A529: 13431 | B529: 橙品英雄1 | C529: 13030 | D529: 4 | E529: 2 | F529: 2 | G529: 1 | H529: 1 | I529: 10 | J529: 0 | K529: 0 | L529: 0 | N529: 0 | O529: 可从红颅鬼、独眼巨人、憎恶中选择一个获得。 | P529: 999999 | Q529: 1 | R529: 0 | S529: 0 | T529: 30430|31400|32410 | U529: 1|1|1 | V529: =RC[-1] -> 1|1|1 | AB529: 1 | AG529: 1 | AH529: 1 | AI529: 1 | AJ529: =RC[4]&"|"&RC[5]&"|"&RC[6] -> 30430|31400|32410 | AK529: 红颅鬼 | AL529: 独眼巨人 | AM529: 憎恶 | AN529: 30430 | AO529: 31400 | AP529: 32410 | AQ529: ="可从"&RC[-6]&"、"&RC[-5]&"、"&RC[-4]&"中选择一个获得。" -> 可从红颅鬼、独眼巨人、憎恶中选择一个获得。
A530: 13432 | B530: 橙品英雄2 | C530: 13030 | D530: 4 | E530: 2 | F530: 2 | G530: 1 | H530: 1 | I530: 10 | J530: 0 | K530: 0 | L530: 0 | N530: 0 | O530: 可从终极队长、圣女贞德、树精中选择一个获得。 | P530: 999999 | Q530: 1 | R530: 0 | S530: 0 | T530: 30400|31440|32411 | U530: 1|1|1 | V530: =RC[-1] -> 1|1|1 | AB530: 1 | AG530: 1 | AH530: 1 | AI530: 1 | AJ530: =RC[4]&"|"&RC[5]&"|"&RC[6] -> 30400|31440|32411 | AK530: 终极队长 | AL530: 圣女贞德 | AM530: 树精 | AN530: 30400 | AO530: 31440 | AP530: 32411 | AQ530: ="可从"&RC[-6]&"、"&RC[-5]&"、"&RC[-4]&"中选择一个获得。" -> 可从终极队长、圣女贞德、树精中选择一个获得。
A531: 13433 | B531: 橙品辅助英雄 | C531: 13030 | D531: 4 | E531: 2 | F531: 2 | G531: 1 | H531: 1 | I531: 10 | J531: 0 | K531: 0 | L531: 0 | N531: 0 | O531: 可从白凤凰、圣女贞德、雅典娜、大检查官中选择一个获得。 | P531: 999999 | Q531: 1 | R531: 0 | S531: 0 | T531: 30440|31440|31441|32440 | U531: 1|1|1|1 | V531: =RC[-1] -> 1|1|1|1 | AB531: 1 | AG531: 1 | AH531: 1 | AI531: 1
A532: 13434 | B532: 核心英雄 | C532: 13030 | D532: 4 | E532: 2 | F532: 2 | G532: 1 | H532: 1 | I532: 10 | J532: 0 | K532: 0 | L532: 0 | N532: 0 | O532: 可从六个资质25的橙品核心英雄中选择一个获得。 | P532: 999999 | Q532: 1 | R532: 0 | S532: 0 | T532: 13421|13423 | U532: 1|1 | V532: =RC[-1] -> 1|1 | AB532: 1 | AG532: 1 | AH532: 1 | AI532: 1
A533: 13435 | B533: 核心配合英雄 | C533: 13030 | D533: 4 | E533: 2 | F533: 2 | G533: 1 | H533: 1 | I533: 10 | J533: 0 | K533: 0 | L533: 0 | N533: 0 | O533: 可从六个橙品核心英雄的合击配合英雄中选择一个获得。 | P533: 999999 | Q533: 1 | R533: 0 | S533: 0 | T533: 13422|13424 | U533: 1|1 | V533: =RC[-1] -> 1|1 | AB533: 1 | AG533: 1 | AH533: 1 | AI533: 1
A534: 13436 | B534: 核心配合英雄碎片 | C534: 13030 | D534: 4 | E534: 2 | F534: 2 | G534: 1 | H534: 1 | I534: 10 | J534: 0 | K534: 0 | L534: 0 | N534: 0 | O534: 可从六个橙品核心英雄的合击配合英雄中选择一个获得其碎片。 | P534: 999999 | Q534: 1 | R534: 0 | S534: 0 | T534: 13406|13408 | U534: 1|1 | V534: =RC[-1] -> 1|1 | AG534: 1 | AH534: 1 | AI534: 1
A535: 13437 | B535: 橙品英雄3选1 | C535: 13030 | D535: 4 | E535: 2 | F535: 2 | G535: 1 | H535: 1 | I535: 10 | J535: 0 | K535: 0 | L535: 0 | N535: 0 | O535: 可从终极队长、独眼巨人、树精中选择一个获得。 | P535: 999999 | Q535: 1 | R535: 0 | S535: 0 | T535: 30400|31400|32411 | U535: 1|1|1 | V535: =RC[-1] -> 1|1|1 | AB535: 1 | AG535: 1 | AH535: 1 | AI535: 1
A536: 13438 | B536: 控场英雄3选1 | C536: 13030 | D536: 4 | E536: 2 | F536: 2 | G536: 1 | H536: 1 | I536: 10 | J536: 0 | K536: 0 | L536: 0 | N536: 0 | O536: 可从雷神、美杜莎、牛头人中选择一个获得。 | P536: 999999 | Q536: 1 | R536: 0 | S536: 0 | T536: 30431|31430|32400 | U536: 1|1|1 | V536: =RC[-1] -> 1|1|1 | AB536: 1 | AG536: 1 | AH536: 1 | AI536: 1
A537: 13439 | B537: 配合英雄3选1 | C537: 13030 | D537: 4 | E537: 2 | F537: 2 | G537: 1 | H537: 1 | I537: 10 | J537: 0 | K537: 0 | L537: 0 | N537: 0 | O537: 可从野蛮巨人、德古拉伯爵、火女中选择一个获得。 | P537: 999999 | Q537: 1 | R537: 0 | S537: 0 | T537: 30410|31401|32430 | U537: 1|1|1 | V537: =RC[-1] -> 1|1|1 | AB537: 1 | AG537: 1 | AH537: 1 | AI537: 1
A538: 13440 | B538: 橙品主英雄6选1 | C538: 13030 | D538: 4 | E538: 2 | F538: 2 | G538: 1 | H538: 1 | I538: 10 | J538: 0 | K538: 0 | L538: 0 | N538: 0 | O538: 可从致命特工、狩猎女神、半人马、刀锋猎人、佐罗、基伦中选择一个获得。 | P538: 999999 | Q538: 1 | R538: 0 | S538: 0 | T538: 13427|13428 | U538: 1|1 | V538: =RC[-1] -> 1|1 | AB538: 1 | AG538: 1 | AH538: 1 | AI538: 1
A539: 13441 | B539: 任选橙品合击组合 | C539: 13030 | D539: 4 | E539: 2 | F539: 2 | G539: 1 | H539: 1 | I539: 10 | J539: 0 | K539: 0 | L539: 0 | N539: 0 | O539: 可从9组20资质的橙品合击组合中任选其中一组获得。 | P539: 999999 | Q539: 1 | R539: 0 | S539: 0 | T539: 13443|13444|13445 | U539: 1|1|1 | V539: =RC[-1] -> 1|1|1 | AG539: 1 | AH539: 1 | AI539: 1
A540: 13442 | B540: 最强合击组合 | C540: 13030 | D540: 4 | E540: 2 | F540: 2 | G540: 1 | H540: 1 | I540: 10 | J540: 0 | K540: 0 | L540: 0 | N540: 0 | O540: 可从6组橙品最强合击组合中任选其中一组获得。 | P540: 999999 | Q540: 1 | R540: 0 | S540: 0 | T540: 13446|13447|13448 | U540: 1|1|1 | V540: =RC[-1] -> 1|1|1 | AG540: 1 | AH540: 1 | AI540: 1
A541: 13443 | B541: 超能合击组合 | C541: 13030 | D541: 4 | E541: 2 | F541: 2 | G541: 1 | H541: 1 | I541: 10 | J541: 0 | K541: 0 | L541: 0 | N541: 0 | O541: 可从3组超能合击组合中任选其中一组获得。 | P541: 999999 | Q541: 1 | R541: 0 | S541: 0 | T541: 13866|13867|13868 | U541: 1|1|1 | V541: =RC[-1] -> 1|1|1 | AG541: 1 | AH541: 1 | AI541: 1
A542: 13444 | B542: 传说合击组合 | C542: 13030 | D542: 4 | E542: 2 | F542: 2 | G542: 1 | H542: 1 | I542: 10 | J542: 0 | K542: 0 | L542: 0 | N542: 0 | O542: 可从3组传说合击组合中任选其中一组获得。 | P542: 999999 | Q542: 1 | R542: 0 | S542: 0 | T542: 13869|13870|13871 | U542: 1|1|1 | V542: =RC[-1] -> 1|1|1 | AG542: 1 | AH542: 1 | AI542: 1
A543: 13445 | B543: 幻想合击组合 | C543: 13030 | D543: 4 | E543: 2 | F543: 2 | G543: 1 | H543: 1 | I543: 10 | J543: 0 | K543: 0 | L543: 0 | N543: 0 | O543: 可从3组幻想合击组合中任选其中一组获得。 | P543: 999999 | Q543: 1 | R543: 0 | S543: 0 | T543: 13872|13873|13874 | U543: 1|1|1 | V543: =RC[-1] -> 1|1|1 | AG543: 1 | AH543: 1 | AI543: 1
A544: 13446 | B544: 超能最强合击组合 | C544: 13030 | D544: 4 | E544: 2 | F544: 2 | G544: 1 | H544: 1 | I544: 10 | J544: 0 | K544: 0 | L544: 0 | N544: 0 | O544: 可从【铁人+树人】、【超凡博士+白凤凰】中任选其中一组获得。 | P544: 999999 | Q544: 1 | R544: 0 | S544: 0 | T544: 13875|13876 | U544: 1|1 | V544: =RC[-1] -> 1|1 | AG544: 1 | AH544: 1 | AI544: 1
A545: 13447 | B545: 传说最强合击组合 | C545: 13030 | D545: 4 | E545: 2 | F545: 2 | G545: 1 | H545: 1 | I545: 10 | J545: 0 | K545: 0 | L545: 0 | N545: 0 | O545: 可从【宙斯+斯巴达】、【阿努比斯+雅典娜】中任选其中一组获得。 | P545: 999999 | Q545: 1 | R545: 0 | S545: 0 | T545: 13877|13878 | U545: 1|1 | V545: =RC[-1] -> 1|1 | AG545: 1 | AH545: 1 | AI545: 1
A546: 13448 | B546: 幻想最强合击组合 | C546: 13030 | D546: 4 | E546: 2 | F546: 2 | G546: 1 | H546: 1 | I546: 10 | J546: 0 | K546: 0 | L546: 0 | N546: 0 | O546: 可从【小黑+熊阿宝】、【血色指挥官+大检察官】中任选其中一组获得。 | P546: 999999 | Q546: 1 | R546: 0 | S546: 0 | T546: 13879|13880 | U546: 1|1 | V546: =RC[-1] -> 1|1 | AG546: 1 | AH546: 1 | AI546: 1
A547: 13449 | B547: 任选卡牌 | C547: 13002 | D547: 2 | E547: 2 | F547: 2 | G547: 1 | H547: 1 | I547: 10 | J547: 0 | K547: 0 | L547: 0 | N547: 0 | O547: 可从所有蓝品卡牌中选择一张获得。 | P547: 999999 | Q547: 50 | R547: 0 | S547: 0 | T547: 13450|13451|13452|13453 | U547: 1|1|1|1 | V547: 1|1|1|1 | AG547: 1 | AH547: 1 | AI547: 1
A548: 13450 | B548: 攻击型卡牌 | C548: 13002 | D548: 2 | E548: 2 | F548: 2 | G548: 1 | H548: 1 | I548: 10 | J548: 0 | K548: 0 | L548: 0 | N548: 0 | O548: 可从所有攻击型蓝品卡牌中选择一张获得。 | P548: 999999 | Q548: 50 | R548: 0 | S548: 0 | T548: 70208|70211|70212|13454 | U548: 1|1|1|1 | V548: 1|1|1|1 | AE548: 1 | AG548: 1 | AH548: 1
A549: 13451 | B549: 物防型卡牌 | C549: 13002 | D549: 2 | E549: 2 | F549: 2 | G549: 1 | H549: 1 | I549: 10 | J549: 0 | K549: 0 | L549: 0 | N549: 0 | O549: 可从所有物防型蓝品卡牌中选择一张获得。 | P549: 999999 | Q549: 50 | R549: 0 | S549: 0 | T549: 70204|70206|70209|13455 | U549: 1|1|1|1 | V549: 1|1|1|1 | AE549: 1 | AG549: 1 | AH549: 1
A550: 13452 | B550: 法防型卡牌 | C550: 13002 | D550: 2 | E550: 2 | F550: 2 | G550: 1 | H550: 1 | I550: 10 | J550: 0 | K550: 0 | L550: 0 | N550: 0 | O550: 可从所有法防型蓝品卡牌中选择一张获得。 | P550: 999999 | Q550: 50 | R550: 0 | S550: 0 | T550: 70201|70203|70214|13456 | U550: 1|1|1|1 | V550: 1|1|1|1 | AE550: 1 | AG550: 1 | AH550: 1
A551: 13453 | B551: 生命型卡牌 | C551: 13003 | D551: 2 | E551: 2 | F551: 2 | G551: 1 | H551: 1 | I551: 10 | J551: 0 | K551: 0 | L551: 0 | N551: 0 | O551: 可从所有生命型蓝品卡牌中选择一张获得。 | P551: 999999 | Q551: 50 | R551: 0 | S551: 0 | T551: 70202|70205|70207|13457 | U551: 1|1|1|1 | V551: 1|1|1|1 | AE551: 1 | AG551: 1 | AH551: 1
A552: 13454 | B552: 攻击型卡牌 | C552: 13002 | D552: 2 | E552: 2 | F552: 2 | G552: 1 | H552: 1 | I552: 10 | J552: 0 | K552: 0 | L552: 0 | N552: 0 | O552: 可从死神、星星、太阳、宝剑中选择一张获得。 | P552: 999999 | Q552: 50 | R552: 0 | S552: 0 | T552: 70213|70217|70219|70224 | U552: 1|1|1|1 | V552: 1|1|1|1 | AE552: 1 | AG552: 1 | AH552: 1
A553: 13455 | B553: 物防型卡牌 | C553: 13002 | D553: 2 | E553: 2 | F553: 2 | G553: 1 | H553: 1 | I553: 10 | J553: 0 | K553: 0 | L553: 0 | N553: 0 | O553: 可从恶魔、审判、权杖中选择一张获得。 | P553: 999999 | Q553: 50 | R553: 0 | S553: 0 | T553: 70215|70220|70222 | U553: 1|1|1 | V553: 1|1|1 | AE553: 1 | AG553: 1 | AH553: 1
A554: 13456 | B554: 法防型卡牌 | C554: 13002 | D554: 2 | E554: 2 | F554: 2 | G554: 1 | H554: 1 | I554: 10 | J554: 0 | K554: 0 | L554: 0 | N554: 0 | O554: 可从塔、世界、圣杯中选择一张获得。 | P554: 999999 | Q554: 50 | R554: 0 | S554: 0 | T554: 70216|70221|70223 | U554: 1|1|1 | V554: 1|1|1 | AE554: 1 | AG554: 1 | AH554: 1
A555: 13457 | B555: 生命型卡牌 | C555: 13003 | D555: 2 | E555: 2 | F555: 2 | G555: 1 | H555: 1 | I555: 10 | J555: 0 | K555: 0 | L555: 0 | N555: 0 | O555: 可从命运之轮、月亮、星币中选择一张获得。 | P555: 999999 | Q555: 50 | R555: 0 | S555: 0 | T555: 70210|70218|70225 | U555: 1|1|1 | V555: 1|1|1 | AE555: 1 | AG555: 1 | AH555: 1
A556: 13458 | B556: 任选顶级装备碎片 | C556: 13020 | D556: 5 | E556: 2 | F556: 2 | G556: 1 | H556: 1 | I556: 10 | J556: 0 | K556: 0 | L556: 0 | N556: 0 | O556: 可从神圣复仇残件、地狱哀歌残件、贯穿苍穹残件、苍白正义残件中选择一件获得。 | P556: 999999 | Q556: 7 | R556: 0 | S556: 0 | T556: 11501|11502|11503|11504 | U556: 1|1|1|1 | V556: 1|1|1|1 | AA556: 1 | AG556: 1 | AH556: 1 | AI556: 1
A557: 13459 | B557: 任选25资英雄碎片 | C557: 13030 | D557: 4 | E557: 2 | F557: 2 | G557: 1 | H557: 1 | I557: 10 | J557: 0 | K557: 0 | L557: 0 | N557: 0 | O557: 可从所有25资质的橙品英雄中任选其中一个获得其碎片。 | P557: 999999 | Q557: 1 | R557: 0 | S557: 0 | T557: 13403|13404|13405|13407 | U557: 1|1|1|1 | V557: =RC[-1] -> 1|1|1|1 | AA557: 1 | AG557: 1 | AH557: 1 | AI557: 1
A558: 13460 | B558: 任选20资英雄碎片 | C558: 13030 | D558: 4 | E558: 2 | F558: 2 | G558: 1 | H558: 1 | I558: 10 | J558: 0 | K558: 0 | L558: 0 | N558: 0 | O558: 可从所有20资质的橙品英雄中任选其中一个获得其碎片。 | P558: 999999 | Q558: 1 | R558: 0 | S558: 0 | T558: 13461|13462|13463 | U558: 1|1|1 | V558: =RC[-1] -> 1|1|1 | AA558: 1 | AG558: 1 | AH558: 1 | AI558: 1
A559: 13461 | B559: 20资推荐英雄碎片 | C559: 13030 | D559: 4 | E559: 2 | F559: 2 | G559: 1 | H559: 1 | I559: 10 | J559: 0 | K559: 0 | L559: 0 | N559: 0 | O559: 可从最强橙品合击英雄、最强控场英雄、控场英雄合击搭档中任选其中一个获得其碎片。 | P559: 999999 | Q559: 1 | R559: 0 | S559: 0 | T559: 13406|13408|13409|13410 | U559: 1|1|1|1 | V559: =RC[-1] -> 1|1|1|1 | AA559: 1 | AG559: 1 | AH559: 1 | AI559: 1
A560: 13462 | B560: 20资推荐英雄碎片 | C560: 13030 | D560: 4 | E560: 2 | F560: 2 | G560: 1 | H560: 1 | I560: 10 | J560: 0 | K560: 0 | L560: 0 | N560: 0 | O560: 可从其他有合击的橙品英雄中任选其中一个获得其碎片。 | P560: 999999 | Q560: 1 | R560: 0 | S560: 0 | T560: 13411|13412|13413|13414 | U560: 1|1|1|1 | V560: =RC[-1] -> 1|1|1|1 | AA560: 1 | AG560: 1 | AH560: 1 | AI560: 1
A561: 13463 | B561: 20资无合击英雄碎片 | C561: 13030 | D561: 4 | E561: 2 | F561: 2 | G561: 1 | H561: 1 | I561: 10 | J561: 0 | K561: 0 | L561: 0 | N561: 0 | O561: 可从6个无合击的橙品英雄中任选其中一个获得其碎片。 | P561: 999999 | Q561: 1 | R561: 0 | S561: 0 | T561: 13415|13416 | U561: 1|1 | V561: =RC[-1] -> 1|1 | AA561: 1 | AG561: 1 | AH561: 1 | AI561: 1
A562: 13464 | B562: 顶级超能英雄 | C562: 30 | D562: 5 | E562: 2 | F562: 2 | G562: 1 | H562: 1 | I562: 10 | J562: 0 | K562: 0 | L562: 0 | N562: 0 | O562: 可从2个超能阵营的顶级红品英雄中任选其中一个获得。 | P562: 999999 | Q562: 1 | R562: 0 | S562: 0 | T562: 30500|30520 | U562: 1|1 | V562: =RC[-1] -> 1|1 | AB562: 1 | AG562: 1 | AH562: 1 | AI562: 1
A563: 13465 | B563: 顶级传说英雄 | C563: 31 | D563: 5 | E563: 2 | F563: 2 | G563: 1 | H563: 1 | I563: 10 | J563: 0 | K563: 0 | L563: 0 | N563: 0 | O563: 可从2个传说阵营的顶级红品英雄中任选其中一个获得。 | P563: 999999 | Q563: 1 | R563: 0 | S563: 0 | T563: 31500|31530 | U563: 1|1 | V563: =RC[-1] -> 1|1 | AB563: 1 | AG563: 1 | AH563: 1 | AI563: 1
A564: 13466 | B564: 顶级幻想英雄 | C564: 32 | D564: 5 | E564: 2 | F564: 2 | G564: 1 | H564: 1 | I564: 10 | J564: 0 | K564: 0 | L564: 0 | N564: 0 | O564: 可从2个幻想阵营的顶级红品英雄中任选其中一个获得。 | P564: 999999 | Q564: 1 | R564: 0 | S564: 0 | T564: 32500|32510 | U564: 1|1 | V564: =RC[-1] -> 1|1 | AB564: 1 | AG564: 1 | AH564: 1 | AI564: 1
A565: 13467 | B565: 顶级超能英雄碎片 | C565: 30 | D565: 5 | E565: 2 | F565: 2 | G565: 1 | H565: 1 | I565: 10 | J565: 0 | K565: 0 | L565: 0 | N565: 0 | O565: 可从2个超能阵营的顶级红品英雄碎片中任选其中一个获得。 | P565: 999999 | Q565: 1 | R565: 0 | S565: 0 | T565: 12500|12501 | U565: 1|1 | V565: =RC[-1] -> 1|1 | AA565: 1 | AG565: 1 | AH565: 1 | AI565: 1
A566: 13468 | B566: 顶级传说英雄碎片 | C566: 31 | D566: 5 | E566: 2 | F566: 2 | G566: 1 | H566: 1 | I566: 10 | J566: 0 | K566: 0 | L566: 0 | N566: 0 | O566: 可从2个传说阵营的顶级红品英雄碎片中任选其中一个获得。 | P566: 999999 | Q566: 1 | R566: 0 | S566: 0 | T566: 12530|12531 | U566: 1|1 | V566: =RC[-1] -> 1|1 | AA566: 1 | AG566: 1 | AH566: 1 | AI566: 1
A567: 13469 | B567: 顶级幻想英雄碎片 | C567: 32 | D567: 5 | E567: 2 | F567: 2 | G567: 1 | H567: 1 | I567: 10 | J567: 0 | K567: 0 | L567: 0 | N567: 0 | O567: 可从2个幻想阵营的顶级红品英雄碎片中任选其中一个获得。 | P567: 999999 | Q567: 1 | R567: 0 | S567: 0 | T567: 12560|12561 | U567: 1|1 | V567: =RC[-1] -> 1|1 | AA567: 1 | AG567: 1 | AH567: 1 | AI567: 1
A568: 13470 | B568: 大地之子套装之一 | C568: 13020 | D568: 4 | E568: 2 | F568: 2 | G568: 1 | H568: 1 | I568: 10 | J568: 0 | K568: 0 | L568: 0 | N568: 0 | O568: 可从橙品套装大地之子的4个部位中选择一个获得。 | P568: 999999 | Q568: 1 | R568: 0 | S568: 0 | T568: 20405|21405|22405|23405 | U568: 1|1|1|1 | V568: =RC[-1] -> 1|1|1|1 | AC568: 1 | AF568: UI_taozhuang_chengse1 | AG568: 1 | AH568: 1 | AI568: 1
A569: 13471 | B569: 红品英雄宿命卡牌 | C569: 13071 | D569: 4 | E569: 2 | F569: 2 | G569: 1 | H569: 1 | I569: 10 | J569: 0 | K569: 0 | L569: 0 | N569: 0 | O569: 可从任意一个红品英雄的宿命卡牌中选择一张橙品卡牌获得。 | P569: 999999 | Q569: 1 | R569: 0 | S569: 0 | T569: 13472|13473|13474 | U569: 1|1|1 | V569: =RC[-1] -> 1|1|1 | AE569: 1 | AG569: 1 | AH569: 1 | AI569: 1
A570: 13472 | B570: 超能红品英雄宿命卡牌 | C570: 13073 | D570: 4 | E570: 2 | F570: 2 | G570: 1 | H570: 1 | I570: 10 | J570: 0 | K570: 0 | L570: 0 | N570: 0 | O570: 可从超能阵营的红品英雄的宿命卡牌中选择一张橙品卡牌获得。 | P570: 999999 | Q570: 1 | R570: 0 | S570: 0 | T570: 13475|13476 | U570: 1|1 | V570: =RC[-1] -> 1|1 | AE570: 1 | AG570: 1 | AH570: 1 | AI570: 1
A571: 13473 | B571: 传说红品英雄宿命卡牌 | C571: 13074 | D571: 4 | E571: 2 | F571: 2 | G571: 1 | H571: 1 | I571: 10 | J571: 0 | K571: 0 | L571: 0 | N571: 0 | O571: 可从传说阵营的红品英雄的宿命卡牌中选择一张橙品卡牌获得。 | P571: 999999 | Q571: 1 | R571: 0 | S571: 0 | T571: 13477|13478 | U571: 1|1 | V571: =RC[-1] -> 1|1 | AE571: 1 | AG571: 1 | AH571: 1 | AI571: 1
A572: 13474 | B572: 幻想红品英雄宿命卡牌 | C572: 13075 | D572: 4 | E572: 2 | F572: 2 | G572: 1 | H572: 1 | I572: 10 | J572: 0 | K572: 0 | L572: 0 | N572: 0 | O572: 可从幻想阵营的红品英雄的宿命卡牌中选择一张橙品卡牌获得。 | P572: 999999 | Q572: 1 | R572: 0 | S572: 0 | T572: 13479|13480 | U572: 1|1 | V572: =RC[-1] -> 1|1 | AE572: 1 | AG572: 1 | AH572: 1 | AI572: 1
A573: 13475 | B573: 狼叔宿命卡牌 | C573: 13076 | D573: 4 | E573: 2 | F573: 2 | G573: 1 | H573: 1 | I573: 10 | J573: 0 | K573: 0 | L573: 0 | N573: 0 | O573: 可从狼叔的宿命卡牌中选择其中一张橙品卡牌获得。 | P573: 999999 | Q573: 1 | R573: 0 | S573: 0 | T573: 70408|70418|70424 | U573: 1|1|1 | V573: =RC[-1] -> 1|1|1 | AE573: 1 | AG573: 1 | AH573: 1 | AI573: 1
A574: 13476 | B574: 黑暗骑士宿命卡牌 | C574: 13077 | D574: 4 | E574: 2 | F574: 2 | G574: 1 | H574: 1 | I574: 10 | J574: 0 | K574: 0 | L574: 0 | N574: 0 | O574: 可从黑暗骑士的宿命卡牌中选择其中一张橙品卡牌获得。 | P574: 999999 | Q574: 1 | R574: 0 | S574: 0 | T574: 70405|70412|70425 | U574: 1|1|1 | V574: =RC[-1] -> 1|1|1 | AE574: 1 | AG574: 1 | AH574: 1 | AI574: 1
A575: 13477 | B575: 奎爷宿命卡牌 | C575: 13078 | D575: 4 | E575: 2 | F575: 2 | G575: 1 | H575: 1 | I575: 10 | J575: 0 | K575: 0 | L575: 0 | N575: 0 | O575: 可从奎爷的宿命卡牌中选择其中一张橙品卡牌获得。 | P575: 999999 | Q575: 1 | R575: 0 | S575: 0 | T575: 70410|70415|70424 | U575: 1|1|1 | V575: =RC[-1] -> 1|1|1 | AE575: 1 | AG575: 1 | AH575: 1 | AI575: 1
A576: 13478 | B576: 潘多拉宿命卡牌 | C576: 13079 | D576: 4 | E576: 2 | F576: 2 | G576: 1 | H576: 1 | I576: 10 | J576: 0 | K576: 0 | L576: 0 | N576: 0 | O576: 可从潘多拉的宿命卡牌中选择其中一张橙品卡牌获得。 | P576: 999999 | Q576: 1 | R576: 0 | S576: 0 | T576: 70401|70406|70417 | U576: 1|1|1 | V576: =RC[-1] -> 1|1|1 | AE576: 1 | AG576: 1 | AH576: 1 | AI576: 1
A577: 13479 | B577: 巫妖之王宿命卡牌 | C577: 13080 | D577: 4 | E577: 2 | F577: 2 | G577: 1 | H577: 1 | I577: 10 | J577: 0 | K577: 0 | L577: 0 | N577: 0 | O577: 可从巫妖之王的宿命卡牌中选择其中一张橙品卡牌获得。 | P577: 999999 | Q577: 1 | R577: 0 | S577: 0 | T577: 70404|70413|70424 | U577: 1|1|1 | V577: =RC[-1] -> 1|1|1 | AE577: 1 | AG577: 1 | AH577: 1 | AI577: 1
A578: 13480 | B578: 钢铁酋长宿命卡牌 | C578: 13081 | D578: 4 | E578: 2 | F578: 2 | G578: 1 | H578: 1 | I578: 10 | J578: 0 | K578: 0 | L578: 0 | N578: 0 | O578: 可从钢铁酋长的宿命卡牌中选择其中一张橙品卡牌获得。 | P578: 999999 | Q578: 1 | R578: 0 | S578: 0 | T578: 70415|70417|70421 | U578: 1|1|1 | V578: =RC[-1] -> 1|1|1 | AE578: 1 | AG578: 1 | AH578: 1 | AI578: 1
A579: 13481 | B579: 核心英雄宿命卡牌 | C579: 13071 | D579: 4 | E579: 2 | F579: 2 | G579: 1 | H579: 1 | I579: 10 | J579: 0 | K579: 0 | L579: 0 | N579: 0 | O579: 可从任意一个核心英雄的宿命卡牌中选择一张橙品卡牌获得。 | P579: 999999 | Q579: 1 | R579: 0 | S579: 0 | T579: 13482|13483|13484 | U579: 1|1|1 | V579: =RC[-1] -> 1|1|1 | AE579: 1 | AG579: 1 | AH579: 1 | AI579: 1
A580: 13482 | B580: 超能核心英雄宿命卡牌 | C580: 13073 | D580: 4 | E580: 2 | F580: 2 | G580: 1 | H580: 1 | I580: 10 | J580: 0 | K580: 0 | L580: 0 | N580: 0 | O580: 可从超能阵营的核心英雄的宿命卡牌中选择一张橙品卡牌获得。 | P580: 999999 | Q580: 1 | R580: 0 | S580: 0 | T580: 13485|13486 | U580: 1|1 | V580: =RC[-1] -> 1|1 | AE580: 1 | AG580: 1 | AH580: 1 | AI580: 1
A581: 13483 | B581: 传说核心英雄宿命卡牌 | C581: 13074 | D581: 4 | E581: 2 | F581: 2 | G581: 1 | H581: 1 | I581: 10 | J581: 0 | K581: 0 | L581: 0 | N581: 0 | O581: 可从传说阵营的核心英雄的宿命卡牌中选择一张橙品卡牌获得。 | P581: 999999 | Q581: 1 | R581: 0 | S581: 0 | T581: 13487|13488 | U581: 1|1 | V581: =RC[-1] -> 1|1 | AE581: 1 | AG581: 1 | AH581: 1 | AI581: 1
A582: 13484 | B582: 幻想核心英雄宿命卡牌 | C582: 13075 | D582: 4 | E582: 2 | F582: 2 | G582: 1 | H582: 1 | I582: 10 | J582: 0 | K582: 0 | L582: 0 | N582: 0 | O582: 可从幻想阵营的核心英雄的宿命卡牌中选择一张橙品卡牌获得。 | P582: 999999 | Q582: 1 | R582: 0 | S582: 0 | T582: 13489|13490 | U582: 1|1 | V582: =RC[-1] -> 1|1 | AE582: 1 | AG582: 1 | AH582: 1 | AI582: 1
A583: 13485 | B583: 铁人宿命卡牌 | C583: 13071 | D583: 4 | E583: 2 | F583: 2 | G583: 1 | H583: 1 | I583: 10 | J583: 0 | K583: 0 | L583: 0 | N583: 0 | O583: 可从铁人的宿命卡牌中选择其中一张橙品卡牌获得。 | P583: 999999 | Q583: 1 | R583: 0 | S583: 0 | T583: 70407|70416|70424 | U583: 1|1|1 | V583: =RC[-1] -> 1|1|1 | AE583: 1 | AG583: 1 | AH583: 1 | AI583: 1
A584: 13486 | B584: 超凡博士宿命卡牌 | C584: 13071 | D584: 4 | E584: 2 | F584: 2 | G584: 1 | H584: 1 | I584: 10 | J584: 0 | K584: 0 | L584: 0 | N584: 0 | O584: 可从超凡博士的宿命卡牌中选择其中一张橙品卡牌获得。 | P584: 999999 | Q584: 1 | R584: 0 | S584: 0 | T584: 70401|70410|70422 | U584: 1|1|1 | V584: =RC[-1] -> 1|1|1 | AE584: 1 | AG584: 1 | AH584: 1 | AI584: 1
A585: 13487 | B585: 宙斯宿命卡牌 | C585: 13071 | D585: 4 | E585: 2 | F585: 2 | G585: 1 | H585: 1 | I585: 10 | J585: 0 | K585: 0 | L585: 0 | N585: 0 | O585: 可从宙斯的宿命卡牌中选择其中一张橙品卡牌获得。 | P585: 999999 | Q585: 1 | R585: 0 | S585: 0 | T585: 70401|70408|70420 | U585: 1|1|1 | V585: =RC[-1] -> 1|1|1 | AE585: 1 | AG585: 1 | AH585: 1 | AI585: 1
A586: 13488 | B586: 阿努比斯宿命卡牌 | C586: 13071 | D586: 4 | E586: 2 | F586: 2 | G586: 1 | H586: 1 | I586: 10 | J586: 0 | K586: 0 | L586: 0 | N586: 0 | O586: 可从阿努比斯的宿命卡牌中选择其中一张橙品卡牌获得。 | P586: 999999 | Q586: 1 | R586: 0 | S586: 0 | T586: 70411|70413|70420 | U586: 1|1|1 | V586: =RC[-1] -> 1|1|1 | AE586: 1 | AG586: 1 | AH586: 1 | AI586: 1
A587: 13489 | B587: 小黑宿命卡牌 | C587: 13071 | D587: 4 | E587: 2 | F587: 2 | G587: 1 | H587: 1 | I587: 10 | J587: 0 | K587: 0 | L587: 0 | N587: 0 | O587: 可从小黑的宿命卡牌中选择其中一张橙品卡牌获得。 | P587: 999999 | Q587: 1 | R587: 0 | S587: 0 | T587: 70403|70417|70421 | U587: 1|1|1 | V587: =RC[-1] -> 1|1|1 | AE587: 1 | AG587: 1 | AH587: 1 | AI587: 1
A588: 13490 | B588: 血色指挥官宿命卡牌 | C588: 13071 | D588: 4 | E588: 2 | F588: 2 | G588: 1 | H588: 1 | I588: 10 | J588: 0 | K588: 0 | L588: 0 | N588: 0 | O588: 可从血色指挥官的宿命卡牌中选择其中一张橙品卡牌获得。 | P588: 999999 | Q588: 1 | R588: 0 | S588: 0 | T588: 70405|70406|70419 | U588: 1|1|1 | V588: =RC[-1] -> 1|1|1 | AE588: 1 | AG588: 1 | AH588: 1 | AI588: 1
A589: 13491 | B589: 25资合击英雄宿命卡牌 | C589: 13071 | D589: 4 | E589: 2 | F589: 2 | G589: 1 | H589: 1 | I589: 10 | J589: 0 | K589: 0 | L589: 0 | N589: 0 | O589: 可从任意一个25资合击英雄的宿命卡牌中选择一张橙品卡牌获得。 | P589: 999999 | Q589: 1 | R589: 0 | S589: 0 | T589: 13492|13493|13494 | U589: 1|1|1 | V589: =RC[-1] -> 1|1|1 | AE589: 1 | AG589: 1 | AH589: 1 | AI589: 1
A590: 13492 | B590: 超能25资英雄宿命卡牌 | C590: 13073 | D590: 4 | E590: 2 | F590: 2 | G590: 1 | H590: 1 | I590: 10 | J590: 0 | K590: 0 | L590: 0 | N590: 0 | O590: 可从超能阵营的25资合击英雄的宿命卡牌中选择一张橙品卡牌获得。 | P590: 999999 | Q590: 1 | R590: 0 | S590: 0 | T590: 13495|13496 | U590: 1|1 | V590: =RC[-1] -> 1|1 | AE590: 1 | AG590: 1 | AH590: 1 | AI590: 1
A591: 13493 | B591: 传说25资英雄宿命卡牌 | C591: 13074 | D591: 4 | E591: 2 | F591: 2 | G591: 1 | H591: 1 | I591: 10 | J591: 0 | K591: 0 | L591: 0 | N591: 0 | O591: 可从传说阵营的25资合击英雄的宿命卡牌中选择一张橙品卡牌获得。 | P591: 999999 | Q591: 1 | R591: 0 | S591: 0 | T591: 13497|13498 | U591: 1|1 | V591: =RC[-1] -> 1|1 | AE591: 1 | AG591: 1 | AH591: 1 | AI591: 1
A592: 13494 | B592: 幻想25资英雄宿命卡牌 | C592: 13075 | D592: 4 | E592: 2 | F592: 2 | G592: 1 | H592: 1 | I592: 10 | J592: 0 | K592: 0 | L592: 0 | N592: 0 | O592: 可从幻想阵营的25资合击英雄的宿命卡牌中选择一张橙品卡牌获得。 | P592: 999999 | Q592: 1 | R592: 0 | S592: 0 | T592: 13499|13500 | U592: 1|1 | V592: =RC[-1] -> 1|1 | AE592: 1 | AG592: 1 | AH592: 1 | AI592: 1
A593: 13495 | B593: 混沌女巫宿命卡牌 | C593: 13071 | D593: 4 | E593: 2 | F593: 2 | G593: 1 | H593: 1 | I593: 10 | J593: 0 | K593: 0 | L593: 0 | N593: 0 | O593: 可从混沌女巫的宿命卡牌中选择其中一张橙品卡牌获得。 | P593: 999999 | Q593: 1 | R593: 0 | S593: 0 | T593: 70403|70406|70412 | U593: 1|1|1 | V593: =RC[-1] -> 1|1|1 | AE593: 1 | AG593: 1 | AH593: 1 | AI593: 1
A594: 13496 | B594: 地狱铁拳宿命卡牌 | C594: 13071 | D594: 4 | E594: 2 | F594: 2 | G594: 1 | H594: 1 | I594: 10 | J594: 0 | K594: 0 | L594: 0 | N594: 0 | O594: 可从地狱铁拳的宿命卡牌中选择其中一张橙品卡牌获得。 | P594: 999999 | Q594: 1 | R594: 0 | S594: 0 | T594: 70412|70405|70417 | U594: 1|1|1 | V594: =RC[-1] -> 1|1|1 | AE594: 1 | AG594: 1 | AH594: 1 | AI594: 1
A595: 13497 | B595: 冥王哈迪斯宿命卡牌 | C595: 13071 | D595: 4 | E595: 2 | F595: 2 | G595: 1 | H595: 1 | I595: 10 | J595: 0 | K595: 0 | L595: 0 | N595: 0 | O595: 可从冥王哈迪斯的宿命卡牌中选择其中一张橙品卡牌获得。 | P595: 999999 | Q595: 1 | R595: 0 | S595: 0 | T595: 70405|70413|70421 | U595: 1|1|1 | V595: =RC[-1] -> 1|1|1 | AE595: 1 | AG595: 1 | AH595: 1 | AI595: 1
A596: 13498 | B596: 大力神宿命卡牌 | C596: 13071 | D596: 4 | E596: 2 | F596: 2 | G596: 1 | H596: 1 | I596: 10 | J596: 0 | K596: 0 | L596: 0 | N596: 0 | O596: 可从大力神的宿命卡牌中选择其中一张橙品卡牌获得。 | P596: 999999 | Q596: 1 | R596: 0 | S596: 0 | T596: 70406|70408|70425 | U596: 1|1|1 | V596: =RC[-1] -> 1|1|1 | AE596: 1 | AG596: 1 | AH596: 1 | AI596: 1
A597: 13499 | B597: 恶魔猎手宿命卡牌 | C597: 13071 | D597: 4 | E597: 2 | F597: 2 | G597: 1 | H597: 1 | I597: 10 | J597: 0 | K597: 0 | L597: 0 | N597: 0 | O597: 可从恶魔猎手的宿命卡牌中选择其中一张橙品卡牌获得。 | P597: 999999 | Q597: 1 | R597: 0 | S597: 0 | T597: 70412|70415|70422 | U597: 1|1|1 | V597: =RC[-1] -> 1|1|1 | AE597: 1 | AG597: 1 | AH597: 1 | AI597: 1
A598: 13500 | B598: 神圣牧师宿命卡牌 | C598: 13071 | D598: 4 | E598: 2 | F598: 2 | G598: 1 | H598: 1 | I598: 10 | J598: 0 | K598: 0 | L598: 0 | N598: 0 | O598: 可从神圣牧师的宿命卡牌中选择其中一张橙品卡牌获得。 | P598: 999999 | Q598: 1 | R598: 0 | S598: 0 | T598: 70402|70410|70423 | U598: 1|1|1 | V598: =RC[-1] -> 1|1|1 | AE598: 1 | AG598: 1 | AH598: 1 | AI598: 1
A599: 13501 | B599: 基础卡牌四选一 | C599: 13071 | D599: 4 | E599: 2 | F599: 2 | G599: 1 | H599: 1 | I599: 10 | J599: 0 | K599: 0 | L599: 0 | N599: 0 | O599: 可从权杖、圣杯、宝剑、星币四种橙品卡牌中选择其中一张获得。 | P599: 999999 | Q599: 1 | R599: 0 | S599: 0 | T599: 70422|70423|70424|70425 | U599: 1|1|1|1 | V599: =RC[-1] -> 1|1|1|1 | AE599: 1 | AG599: 1 | AH599: 1 | AI599: 1
A600: 13502 | B600: 加成卡牌四选一 | C600: 13071 | D600: 4 | E600: 2 | F600: 2 | G600: 1 | H600: 1 | I600: 10 | J600: 0 | K600: 0 | L600: 0 | N600: 0 | O600: 可从力量、女祭司、女皇、皇帝四种橙品卡牌中选择其中一张获得。 | P600: 999999 | Q600: 1 | R600: 0 | S600: 0 | T600: 70408|70402|70403|70404 | U600: 1|1|1|1 | V600: =RC[-1] -> 1|1|1|1 | AE600: 1 | AG600: 1 | AH600: 1 | AI600: 1
A601: 13503 | B601: 进阶卡牌四选一A | C601: 13071 | D601: 4 | E601: 2 | F601: 2 | G601: 1 | H601: 1 | I601: 10 | J601: 0 | K601: 0 | L601: 0 | N601: 0 | O601: 可从正义、勇者、星星、月亮四种橙品卡牌中选择其中一张获得。 | P601: 999999 | Q601: 1 | R601: 0 | S601: 0 | T601: 70411|70409|70417|70418 | U601: 1|1|1|1 | V601: =RC[-1] -> 1|1|1|1 | AE601: 1 | AG601: 1 | AH601: 1 | AI601: 1
A602: 13504 | B602: 进阶卡牌四选一B | C602: 13071 | D602: 4 | E602: 2 | F602: 2 | G602: 1 | H602: 1 | I602: 10 | J602: 0 | K602: 0 | L602: 0 | N602: 0 | O602: 可从太阳、世界、恋人、命运之轮四种橙品卡牌中选择其中一张获得。 | P602: 999999 | Q602: 1 | R602: 0 | S602: 0 | T602: 70419|70421|70406|70410 | U602: 1|1|1|1 | V602: =RC[-1] -> 1|1|1|1 | AE602: 1 | AG602: 1 | AH602: 1 | AI602: 1
A603: 13505 | B603: 高级卡牌二选一 | C603: 13071 | D603: 4 | E603: 2 | F603: 2 | G603: 1 | H603: 1 | I603: 10 | J603: 0 | K603: 0 | L603: 0 | N603: 0 | O603: 可从死神、塔两种橙品卡牌中选择其中一张获得。 | P603: 999999 | Q603: 1 | R603: 0 | S603: 0 | T603: 70413|70416 | U603: 1|1 | V603: =RC[-1] -> 1|1 | AE603: 1 | AG603: 1 | AH603: 1 | AI603: 1
A604: 13506 | B604: 高级卡牌三选一 | C604: 13071 | D604: 4 | E604: 2 | F604: 2 | G604: 1 | H604: 1 | I604: 10 | J604: 0 | K604: 0 | L604: 0 | N604: 0 | O604: 可从教皇、审判、魔术师三种橙品卡牌中选择其中一张获得。 | P604: 999999 | Q604: 1 | R604: 0 | S604: 0 | T604: 70401|70405|70420 | U604: 1|1|1 | V604: =RC[-1] -> 1|1|1 | AE604: 1 | AG604: 1 | AH604: 1 | AI604: 1
A605: 13507 | B605: 稀有卡牌四选一 | C605: 13071 | D605: 4 | E605: 2 | F605: 2 | G605: 1 | H605: 1 | I605: 10 | J605: 0 | K605: 0 | L605: 0 | N605: 0 | O605: 可从战车、倒吊人、节制、恶魔四种橙品卡牌中选择其中一张获得。 | P605: 999999 | Q605: 1 | R605: 0 | S605: 0 | T605: 70407|70412|70414|70415 | U605: 1|1|1|1 | V605: =RC[-1] -> 1|1|1|1 | AE605: 1 | AG605: 1 | AH605: 1 | AI605: 1
A606: 13593 | B606: 超值材料包 | C606: 13005 | D606: 5 | E606: 2 | F606: 2 | G606: 1 | H606: 1 | I606: 10 | J606: 0 | K606: 0 | L606: 0 | N606: 0 | O606: 可从灵性精粹*150、潜能合剂*500、紫水晶*20、任选精灵升华道具*3中选择一种获得。 | P606: 999999 | Q606: 1 | R606: 0 | S606: 0 | T606: 10022|10004|42301|13324 | U606: 150|500|20|3 | V606: =RC[-1] -> 150|500|20|3 | AA606: 1 | AF606: UI_taozhuang_chengse1 | AG606: 1 | AH606: 1 | AI606: 1
A607: 13594 | B607: 幽冥套装碎片 | C607: 13020 | D607: 4 | E607: 2 | F607: 2 | G607: 1 | H607: 1 | I607: 10 | J607: 0 | K607: 0 | L607: 0 | N607: 0 | O607: 可从橙品套装幽冥主宰的4个部位中选择其中一个碎片获得。 | P607: 999999 | Q607: 1 | R607: 0 | S607: 0 | T607: 11413|11414|11415|11416 | U607: 1|1|1|1 | V607: =RC[-1] -> 1|1|1|1 | AA607: 1 | AF607: UI_taozhuang_chengse1 | AG607: 1 | AH607: 1 | AI607: 1
A608: 13595 | B608: 幽冥主宰套装之一 | C608: 13020 | D608: 4 | E608: 2 | F608: 2 | G608: 1 | H608: 1 | I608: 10 | J608: 0 | K608: 0 | L608: 0 | N608: 0 | O608: 可从橙品套装幽冥主宰的4个部位中选择一个获得。 | P608: 999999 | Q608: 1 | R608: 0 | S608: 0 | T608: 20404|21404|22404|23404 | U608: 1|1|1|1 | V608: =RC[-1] -> 1|1|1|1 | AC608: 1 | AF608: UI_taozhuang_chengse1 | AG608: 1 | AH608: 1 | AI608: 1
A609: 13596 | B609: 任选顶级套装碎片 | C609: 13020 | D609: 5 | E609: 2 | F609: 2 | G609: 1 | H609: 1 | I609: 10 | J609: 0 | K609: 0 | L609: 0 | N609: 0 | O609: 可从顶级红品套装【永恒终末】中选择其中一个部位的碎片获得。 | P609: 999999 | Q609: 1 | R609: 0 | S609: 0 | T609: 11505|11506|11507|11508 | U609: 1|1|1|1 | V609: =RC[-1] -> 1|1|1|1 | AA609: 1 | AF609: UI_taozhuang_chengse1 | AG609: 1 | AH609: 1 | AI609: 1
A610: 13597 | B610: 大地套装碎片 | C610: 13020 | D610: 4 | E610: 2 | F610: 2 | G610: 1 | H610: 1 | I610: 10 | J610: 0 | K610: 0 | L610: 0 | N610: 0 | O610: 可从橙品套装大地之子的4个部位中选择其中一个碎片获得。 | P610: 999999 | Q610: 1 | R610: 0 | S610: 0 | T610: 11417|11418|11419|11420 | U610: 1|1|1|1 | V610: =RC[-1] -> 1|1|1|1 | AA610: 1 | AF610: UI_taozhuang_chengse1 | AG610: 1 | AH610: 1 | AI610: 1
A611: 13598 | B611: 巨像套装碎片 | C611: 13020 | D611: 4 | E611: 2 | F611: 2 | G611: 1 | H611: 1 | I611: 10 | J611: 0 | K611: 0 | L611: 0 | N611: 0 | O611: 可从橙品套装巨像守护的4个部位中选择其中一个碎片获得。 | P611: 999999 | Q611: 1 | R611: 0 | S611: 0 | T611: 11409|11410|11411|11412 | U611: 1|1|1|1 | V611: =RC[-1] -> 1|1|1|1 | AA611: 1 | AF611: UI_taozhuang_chengse1 | AG611: 1 | AH611: 1 | AI611: 1
A612: 13599 | B612: 任选22品装备碎片 | C612: 13020 | D612: 4 | E612: 2 | F612: 2 | G612: 1 | H612: 1 | I612: 10 | J612: 0 | K612: 0 | L612: 0 | N612: 0 | O612: 可从橙品套装巨像守护或大地之子的8个部位中选择其中一个碎片获得。 | P612: 999999 | Q612: 1 | R612: 0 | S612: 0 | T612: 13598|13597 | U612: 1|1|1|1 | V612: =RC[-1] -> 1|1|1|1 | AA612: 1 | AF612: UI_taozhuang_chengse1 | AG612: 1 | AH612: 1 | AI612: 1
A613: 13600 | B613: 紫品装备 | C613: 13020 | D613: 3 | E613: 2 | F613: 3 | G613: 1 | H613: 1 | I613: 10 | J613: 0 | K613: 0 | L613: 0 | N613: 0 | O613: 使用后获得四件紫品装备：掠夺弯刀、不动盔甲、疾风长靴、正义护腕。 | P613: 999999 | Q613: 7 | R613: 0 | S613: 0 | T613: 20301|21301|22301|23301 | U613: 1|1|1|1 | V613: 1|1|1|1 | AC613: 4 | AG613: 1 | AH613: 1 | AI613: 1
A614: 13601 | B614: 骑士契约套装 | C614: 13001 | D614: 2 | E614: 2 | F614: 3 | G614: 1 | H614: 1 | I614: 10 | J614: 0 | K614: 0 | L614: 0 | N614: 0 | O614: 使用后获得骑士长剑、骑士铁甲、骑士铁靴、骑士护腕，激活强力套装属性。 | P614: 999999 | Q614: 7 | R614: 0 | S614: 0 | T614: 20202|21202|22202|23202 | U614: 1|1|1|1 | V614: 1|1|1|1 | AC614: 4 | AG614: 1 | AH614: 1 | AI614: 1
A615: 13602 | B615: 日常礼包1 | C615: 13000 | D615: 1 | E615: 2 | F615: 3 | G615: 1 | H615: 1 | I615: 10 | J615: 0 | K615: 0 | L615: 1 | N615: 0 | O615: 日常礼包1。 | P615: 999999 | Q615: 1 | R615: 0 | S615: 0 | T615: 19005|19103 | U615: 30|1 | V615: =RC[-1] -> 30|1 | AG615: 1
A616: 13603 | B616: 日常礼包2 | C616: 13000 | D616: 2 | E616: 2 | F616: 3 | G616: 1 | H616: 1 | I616: 10 | J616: 0 | K616: 0 | L616: 1 | N616: 0 | O616: 日常礼包2。 | P616: 999999 | Q616: 1 | R616: 0 | S616: 0 | T616: 19005|10001 | U616: 50|1 | V616: =RC[-1] -> 50|1 | AG616: 1
A617: 13604 | B617: 日常礼包3 | C617: 13000 | D617: 3 | E617: 2 | F617: 3 | G617: 1 | H617: 1 | I617: 10 | J617: 0 | K617: 0 | L617: 1 | N617: 0 | O617: 日常礼包3。 | P617: 999999 | Q617: 1 | R617: 0 | S617: 0 | T617: 19005|10000 | U617: 80|1 | V617: =RC[-1] -> 80|1 | AG617: 1
A618: 13605 | B618: 日常礼包4 | C618: 13000 | D618: 4 | E618: 2 | F618: 3 | G618: 1 | H618: 1 | I618: 10 | J618: 0 | K618: 0 | L618: 1 | N618: 0 | O618: 日常礼包4。 | P618: 999999 | Q618: 1 | R618: 0 | S618: 0 | T618: 19005|10001|13014 | U618: 100|2|1 | V618: =RC[-1] -> 100|2|1 | AG618: 1
A619: 13606 | B619: 绝版形象-万圣节之影 | C619: 13007 | D619: 3 | E619: 2 | F619: 3 | G619: 1 | H619: 1 | I619: 10 | J619: 0 | K619: 0 | L619: 0 | N619: 0 | O619: 使用后激活绝版形象-万圣节之影。 | P619: 999999 | Q619: 1 | R619: 0 | S619: 0 | T619: 31309 | U619: 1 | V619: 1 | AB619: 1 | AG619: 1 | AH619: 1
A620: 13607 | B620: 维护补偿 | C620: 13003 | D620: 3 | E620: 2 | F620: 3 | G620: 1 | H620: 1 | I620: 10 | J620: 0 | K620: 0 | L620: 0 | N620: 0 | O620: 维护补偿，打开获得钻石*200、体力药剂*2、精力药剂*2。 | P620: 999999 | Q620: 1 | R620: 0 | S620: 0 | T620: 19005|10000|10001 | U620: 200|2|2 | V620: =RC[-1] -> 200|2|2 | AG620: 1 | AH620: 1 | AI620: 1
A621: 13608 | B621: 维护补偿 | C621: 13003 | D621: 4 | E621: 2 | F621: 3 | G621: 1 | H621: 1 | I621: 10 | J621: 0 | K621: 0 | L621: 0 | N621: 0 | O621: 重大维护补偿，打开获得钻石*500、体力药剂*5、精力药剂*5。 | P621: 999999 | Q621: 1 | R621: 0 | S621: 0 | T621: 19005|10000|10001 | U621: 500|5|5 | V621: =RC[-1] -> 500|5|5 | AG621: 1 | AH621: 1 | AI621: 1
A622: 13609 | B622: 战功补偿 | C622: 13003 | D622: 4 | E622: 2 | F622: 3 | G622: 1 | H622: 1 | I622: 10 | J622: 0 | K622: 0 | L622: 0 | N622: 0 | O622: 战功丢失补偿，打开获得钻石*500、战功70000。 | P622: 999999 | Q622: 1 | R622: 0 | S622: 0 | T622: 19005|19114 | U622: 500|7 | V622: =RC[-1] -> 500|7 | AG622: 1 | AH622: 1
A623: 13610 | B623: 情人节礼包 | C623: 13005 | D623: 4 | E623: 2 | F623: 3 | G623: 1 | H623: 1 | I623: 10 | J623: 0 | K623: 0 | L623: 0 | N623: 0 | O623: 礼包包含：圣器碎片箱*1、高级保护令*3、次元核心*1、刷新令*4。 | P623: 999999 | Q623: 1 | R623: 0 | S623: 0 | T623: 13008|10017|10019|10021 | U623: 1|3|1|4 | V623: =RC[-1] -> 1|3|1|4 | AG623: 1 | AH623: 1
A624: 13611 | B624: 春节礼包 | C624: 13005 | D624: 4 | E624: 2 | F624: 3 | G624: 1 | H624: 1 | I624: 10 | J624: 0 | K624: 0 | L624: 0 | N624: 0 | O624: 礼包包含：声望*2018、威名*2018、军团贡献*2018、紫品精炼石*20、蓝品精炼石*18。 | P624: 999999 | Q624: 1 | R624: 0 | S624: 0 | T624: 19013|19012|19020|10013|10012 | U624: 2018|2018|2018|20|18 | V624: =RC[-1] -> 2018|2018|2018|20|18 | AG624: 1 | AH624: 1
A625: 13612 | B625: 绿品套装 | C625: 13020 | D625: 1 | E625: 2 | F625: 3 | G625: 1 | H625: 1 | I625: 10 | J625: 0 | K625: 0 | L625: 1 | N625: 0 | O625: 包含绿品套装四个部件：精致战刃、精致战甲、精致战靴、精致护腕。 | P625: 999999 | Q625: 1 | R625: 0 | S625: 0 | T625: 20102|21102|22102|23102 | U625: 1|1|1|1 | V625: 1|1|1|1 | AC625: 4 | AG625: 1 | AH625: 1 | AI625: 1
A626: 13615 | B626: 初级传承箱 | C626: 13000 | D626: 1 | E626: 2 | F626: 3 | G626: 1 | H626: 1 | I626: 10 | J626: 0 | K626: 0 | L626: 0 | N626: 0 | O626: 使用后获得1个绿品传承核心。 | P626: 999999 | Q626: 1 | R626: 0 | S626: 0 | T626: 33100 | U626: 1 | V626: 1 | AB626: 1 | AG626: 1 | AH626: 1
A627: 13616 | B627: 中级传承箱 | C627: 13001 | D627: 3 | E627: 2 | F627: 3 | G627: 1 | H627: 1 | I627: 10 | J627: 0 | K627: 0 | L627: 0 | N627: 0 | O627: 使用后获得1个紫品传承核心。 | P627: 999999 | Q627: 1 | R627: 0 | S627: 0 | T627: 33300 | U627: 1 | V627: 1 | AB627: 1 | AG627: 1 | AH627: 1
A628: 13617 | B628: 传承箱 | C628: 13002 | D628: 4 | E628: 2 | F628: 3 | G628: 1 | H628: 1 | I628: 10 | J628: 0 | K628: 0 | L628: 0 | N628: 0 | O628: 使用后获得5个橙品传承核心。 | P628: 999999 | Q628: 1 | R628: 0 | S628: 0 | T628: 33400 | U628: 5 | V628: 5 | AB628: 5 | AG628: 1 | AH628: 1
A629: 13618 | B629: 初级水晶箱 | C629: 13000 | D629: 2 | E629: 2 | F629: 3 | G629: 1 | H629: 1 | I629: 10 | J629: 0 | K629: 0 | L629: 0 | N629: 0 | O629: 使用后获得1个蓝水晶。 | P629: 999999 | Q629: 1 | R629: 0 | S629: 0 | T629: 42201 | U629: 1 | V629: 1 | AD629: 1 | AG629: 1 | AH629: 1
A630: 13619 | B630: 水晶箱 | C630: 13001 | D630: 3 | E630: 2 | F630: 3 | G630: 1 | H630: 1 | I630: 10 | J630: 0 | K630: 0 | L630: 0 | N630: 0 | O630: 使用后获得20个紫水晶。 | P630: 999999 | Q630: 1 | R630: 0 | S630: 0 | T630: 42301 | U630: 20 | V630: 20 | AD630: 20 | AG630: 1 | AH630: 1
A631: 13620 | B631: 希望精灵 | C631: 50001 | D631: 1 | E631: 2 | F631: 3 | G631: 1 | H631: 1 | I631: 10 | J631: 0 | K631: 0 | L631: 1 | N631: 0 | O631: ="使用后激活新精灵："&RC[-13]&"。" -> 使用后激活新精灵：希望精灵。 | P631: 999999 | Q631: 1 | R631: 0 | S631: 0 | T631: 50001 | U631: 1 | V631: 1 | AG631: 1
A632: 13621 | B632: 毁灭精灵 | C632: 50001 | D632: 3 | E632: 2 | F632: 3 | G632: 1 | H632: 1 | I632: 10 | J632: 0 | K632: 0 | L632: 1 | N632: 0 | O632: ="使用后激活新精灵："&RC[-13]&"。" -> 使用后激活新精灵：毁灭精灵。 | P632: 999999 | Q632: 1 | R632: 0 | S632: 0 | T632: 50002 | U632: 1 | V632: 1 | AG632: 1
A633: 13622 | B633: 炼狱灵龙 | C633: 50011 | D633: 3 | E633: 2 | F633: 3 | G633: 1 | H633: 1 | I633: 10 | J633: 0 | K633: 0 | L633: 1 | N633: 0 | O633: ="使用后激活新精灵："&RC[-13]&"。" -> 使用后激活新精灵：炼狱灵龙。 | P633: 999999 | Q633: 1 | R633: 0 | S633: 0 | T633: 50011 | U633: 1 | V633: 1 | AG633: 1
A634: 13623 | B634: 深海女王 | C634: 50012 | D634: 3 | E634: 2 | F634: 3 | G634: 1 | H634: 1 | I634: 10 | J634: 0 | K634: 0 | L634: 0 | N634: 0 | O634: ="使用后激活新精灵："&RC[-13]&"。" -> 使用后激活新精灵：深海女王。 | P634: 999999 | Q634: 1 | R634: 0 | S634: 0 | T634: 50012 | U634: 1 | V634: 1 | AG634: 1 | AH634: 1
A635: 13624 | B635: 暴风元灵 | C635: 50001 | D635: 3 | E635: 2 | F635: 3 | G635: 1 | H635: 1 | I635: 10 | J635: 0 | K635: 0 | L635: 0 | N635: 0 | O635: ="使用后激活新精灵："&RC[-13]&"。" -> 使用后激活新精灵：暴风元灵。 | P635: 999999 | Q635: 1 | R635: 0 | S635: 0 | T635: 50021 | U635: 1 | V635: 1 | AG635: 1 | AH635: 1
A636: 13625 | B636: 大地之子 | C636: 50001 | D636: 3 | E636: 2 | F636: 3 | G636: 1 | H636: 1 | I636: 10 | J636: 0 | K636: 0 | L636: 0 | N636: 0 | O636: ="使用后激活新精灵："&RC[-13]&"。" -> 使用后激活新精灵：大地之子。 | P636: 999999 | Q636: 1 | R636: 0 | S636: 0 | T636: 50022 | U636: 1 | V636: 1 | AG636: 1 | AH636: 1
A637: 13626 | B637: 花之妖精 | C637: 50031 | D637: 3 | E637: 2 | F637: 3 | G637: 1 | H637: 1 | I637: 10 | J637: 0 | K637: 0 | L637: 1 | N637: 0 | O637: ="使用后激活新精灵："&RC[-13]&"。" -> 使用后激活新精灵：花之妖精。 | P637: 999999 | Q637: 1 | R637: 0 | S637: 0 | T637: 50031 | U637: 1 | V637: 1 | AG637: 1 | AH637: 1
A638: 13627 | B638: 森之古树 | C638: 50001 | D638: 3 | E638: 2 | F638: 3 | G638: 1 | H638: 1 | I638: 10 | J638: 0 | K638: 0 | L638: 0 | N638: 0 | O638: ="使用后激活新精灵："&RC[-13]&"。" -> 使用后激活新精灵：森之古树。 | P638: 999999 | Q638: 1 | R638: 0 | S638: 0 | T638: 50032 | U638: 1 | V638: 1 | AG638: 1 | AH638: 1
A639: 13630 | B639: 愚者卡包 | C639: 70000 | D639: 3 | E639: 2 | F639: 3 | G639: 1 | H639: 1 | I639: 10 | J639: 0 | K639: 0 | L639: 0 | N639: 0 | O639: 使用后获得1张紫品的【愚者的喜悦】卡牌。 | P639: 999999 | Q639: 50 | R639: 0 | S639: 0 | T639: 70300 | U639: 1 | V639: 1 | AE639: 1 | AG639: 1 | AH639: 1
A640: 13631 | B640: 圣女贞德 | C640: 31440 | D640: 4 | E640: 2 | F640: 3 | G640: 1 | H640: 1 | I640: 10 | J640: 0 | K640: 0 | L640: 0 | N640: 0 | O640: 使用后获得：橙品强力辅助英雄——圣女贞德。 | P640: 999999 | Q640: 1 | R640: 0 | S640: 0 | T640: 31440 | U640: 1 | V640: =RC[-1] -> 1 | AB640: 1 | AG640: 1 | AH640: 1 | AI640: 1
A641: 13632 | B641: 豪华超值大礼包 | C641: 13005 | D641: 5 | E641: 2 | F641: 3 | G641: 1 | H641: 1 | I641: 10 | J641: 0 | K641: 0 | L641: 0 | N641: 0 | O641: 使用后获得：潜能合剂*268、圣器精炼石*400、橙品精炼石*100、觉醒丹*800。 | P641: 999999 | Q641: 1 | R641: 0 | S641: 0 | T641: 10004|10010|10014|10008 | U641: 268|400|100|800 | V641: =RC[-1] -> 268|400|100|800 | AG641: 1 | AH641: 1 | AI641: 1
A642: 13633 | B642: 特惠礼包Ⅰ | C642: 13001 | D642: 3 | E642: 2 | F642: 3 | G642: 1 | H642: 1 | I642: 10 | J642: 0 | K642: 0 | L642: 0 | N642: 0 | O642: 包含：培养石*100、金币*30W | P642: 999999 | Q642: 1 | R642: 0 | S642: 0 | T642: 10003|19103 | U642: 100|30 | V642: =RC[-1] -> 100|30 | AG642: 1 | AH642: 1 | AI642: 1
A643: 13634 | B643: 特惠礼包Ⅱ | C643: 13002 | D643: 4 | E643: 2 | F643: 3 | G643: 1 | H643: 1 | I643: 10 | J643: 0 | K643: 0 | L643: 0 | N643: 0 | O643: 包含：橙品精炼石*100、金币*100W | P643: 999999 | Q643: 1 | R643: 0 | S643: 0 | T643: 10014|19103 | U643: 100|100 | V643: =RC[-1] -> 100|100 | AG643: 1 | AH643: 1 | AI643: 1
A644: 13635 | B644: 特惠礼包Ⅲ | C644: 13003 | D644: 4 | E644: 2 | F644: 3 | G644: 1 | H644: 1 | I644: 10 | J644: 0 | K644: 0 | L644: 0 | N644: 0 | O644: 包含：圣器精炼石*1900、精力药剂*12 | P644: 999999 | Q644: 1 | R644: 0 | S644: 0 | T644: 10010|10001 | U644: 1900|12 | V644: =RC[-1] -> 1900|12 | AG644: 1 | AH644: 1 | AI644: 1
A645: 13636 | B645: 特惠礼包Ⅳ | C645: 13003 | D645: 5 | E645: 2 | F645: 3 | G645: 1 | H645: 1 | I645: 10 | J645: 0 | K645: 0 | L645: 0 | N645: 0 | O645: 包含：觉醒丹*3000、橙品精炼石*200、潜能合剂*2020 | P645: 999999 | Q645: 1 | R645: 0 | S645: 0 | T645: 10008|10014|10004 | U645: 3000|200|2020 | V645: =RC[-1] -> 3000|200|2020 | AG645: 1 | AH645: 1 | AI645: 1
A646: 13637 | B646: 预约礼包 | C646: 13003 | D646: 4 | E646: 2 | F646: 3 | G646: 1 | H646: 1 | I646: 10 | J646: 0 | K646: 0 | L646: 0 | N646: 0 | O646: 包含：200钻石、10万金币 | P646: 999999 | Q646: 1 | R646: 0 | S646: 0 | T646: 19005|19103 | U646: 200|10 | V646: =RC[-1] -> 200|10 | AG646: 1 | AH646: 1 | AI646: 1
A647: 13638 | B647: mycard专享礼包 | C647: 13003 | D647: 4 | E647: 2 | F647: 3 | G647: 1 | H647: 1 | I647: 10 | J647: 0 | K647: 0 | L647: 0 | N647: 0 | O647: 包含：紫色传承核心5个、精力药5瓶 | P647: 999999 | Q647: 1 | R647: 0 | S647: 0 | T647: 33300|10001 | U647: 5|5 | V647: =RC[-1] -> 5|5 | AB647: 5 | AG647: 1 | AH647: 1 | AI647: 1
A648: 13639 | B648: 大哥大专享礼包 | C648: 13003 | D648: 4 | E648: 2 | F648: 3 | G648: 1 | H648: 1 | I648: 10 | J648: 0 | K648: 0 | L648: 0 | N648: 0 | O648: 包含：10万金币、进阶石30、培养石20 | P648: 999999 | Q648: 1 | R648: 0 | S648: 0 | T648: 19103|10002|10003 | U648: 10|30|20 | V648: =RC[-1] -> 10|30|20 | AG648: 1 | AH648: 1 | AI648: 1
A649: 13640 | B649: 游戏基地专享礼包 | C649: 13003 | D649: 4 | E649: 2 | F649: 3 | G649: 1 | H649: 1 | I649: 10 | J649: 0 | K649: 0 | L649: 0 | N649: 0 | O649: 包含：装备碎片箱2个、蓝水晶4个 | P649: 999999 | Q649: 1 | R649: 0 | S649: 0 | T649: 13007|42201 | U649: 2|4 | V649: =RC[-1] -> 2|4 | AD649: 4 | AG649: 1 | AH649: 1 | AI649: 1
A650: 13641 | B650: 媒体礼包 | C650: 13003 | D650: 4 | E650: 2 | F650: 3 | G650: 1 | H650: 1 | I650: 10 | J650: 0 | K650: 0 | L650: 0 | N650: 0 | O650: 包含：5万金币、体力药1瓶、精力药1瓶 | P650: 999999 | Q650: 1 | R650: 0 | S650: 0 | T650: 19103|10000|10001 | U650: 5|1|1 | V650: =RC[-1] -> 5|1|1 | AG650: 1 | AH650: 1 | AI650: 1
A651: 13642 | B651: 大哥大预约礼包 | C651: 13003 | D651: 4 | E651: 2 | F651: 3 | G651: 1 | H651: 1 | I651: 10 | J651: 0 | K651: 0 | L651: 0 | N651: 0 | O651: 包含：体力药剂5个、蓝色传承核心5个 | P651: 999999 | Q651: 1 | R651: 0 | S651: 0 | T651: 10000|33200 | U651: 5|5 | V651: =RC[-1] -> 5|5 | AB651: 5 | AG651: 1 | AH651: 1 | AI651: 1
A652: 13643 | B652: 大哥大助力礼包 | C652: 13003 | D652: 4 | E652: 2 | F652: 3 | G652: 1 | H652: 1 | I652: 10 | J652: 0 | K652: 0 | L652: 0 | N652: 0 | O652: 包含：6万金币、蓝水晶3个 | P652: 999999 | Q652: 1 | R652: 0 | S652: 0 | T652: 19103|42201 | U652: 6|3 | V652: =RC[-1] -> 6|3 | AD652: 3 | AG652: 1 | AH652: 1 | AI652: 1
A653: 13644 | B653: 英雄五连 | C653: 13009 | D653: 4 | E653: 2 | F653: 3 | G653: 1 | H653: 1 | I653: 10 | J653: 0 | K653: 0 | L653: 1 | N653: 0 | O653: 包含次元核心五个，可用于英雄高级召唤，有几率获得橙品英雄。 | P653: 999999 | Q653: 1 | R653: 0 | S653: 0 | T653: 10019 | U653: 5 | V653: 5 | AG653: 1
A654: 13645 | B654: 精灵培养材料各十 | C654: 13000 | D654: 1 | E654: 2 | F654: 3 | G654: 1 | H654: 1 | I654: 10 | J654: 0 | K654: 0 | L654: 1 | N654: 0 | O654: 包含生命灵泉、烈焰灵泉、大地灵泉、寒冰灵泉各十个。 | P654: 999999 | Q654: 1 | R654: 0 | S654: 0 | T654: 10030|10031|10032|10033 | U654: 10|10|10|10 | V654: 10|10|10|10 | AG654: 1
A655: 13646 | B655: 精灵培养材料各十 | C655: 13000 | D655: 1 | E655: 2 | F655: 3 | G655: 1 | H655: 1 | I655: 10 | J655: 0 | K655: 0 | L655: 0 | N655: 0 | O655: 使用后获得生命灵泉、烈焰灵泉、大地灵泉、寒冰灵泉各十个。 | P655: 999999 | Q655: 1 | R655: 0 | S655: 0 | T655: 10030|10031|10032|10033 | U655: 10|10|10|10 | V655: 10|10|10|10 | AG655: 1 | AH655: 1
A656: 13647 | B656: 新手礼包 | C656: 13001 | D656: 3 | E656: 2 | F656: 3 | G656: 1 | H656: 1 | I656: 10 | J656: 0 | K656: 0 | L656: 0 | N656: 0 | O656: 使用后获得：进阶石*88、钻石*66、金币*10W。 | P656: 999999 | Q656: 1 | R656: 0 | S656: 0 | T656: 10002|19005|19103 | U656: 88|66|10 | V656: =RC[-1] -> 88|66|10 | AG656: 1 | AH656: 1
A657: 13648 | B657: 特权礼包 | C657: 13002 | D657: 3 | E657: 2 | F657: 3 | G657: 1 | H657: 1 | I657: 10 | J657: 0 | K657: 0 | L657: 0 | N657: 0 | O657: 使用后获得：培养石*50、钻石*88、金币*20W。 | P657: 999999 | Q657: 1 | R657: 0 | S657: 0 | T657: 10003|19005|19103 | U657: 50|88|20 | V657: =RC[-1] -> 50|88|20 | AG657: 1 | AH657: 1
A658: 13649 | B658: 钻石礼包 | C658: 13003 | D658: 4 | E658: 2 | F658: 3 | G658: 1 | H658: 1 | I658: 10 | J658: 0 | K658: 0 | L658: 0 | N658: 0 | O658: 使用后获得：刷新令*15、钻石*128、金币*30W。 | P658: 999999 | Q658: 1 | R658: 0 | S658: 0 | T658: 10021|19005|19103 | U658: 15|128|30 | V658: =RC[-1] -> 15|128|30 | AG658: 1 | AH658: 1
A659: 13650 | B659: 测试礼包 | C659: 13000 | D659: 5 | E659: 2 | F659: 3 | G659: 1 | H659: 1 | I659: 10 | J659: 0 | K659: 0 | L659: 0 | N659: 0 | O659: 使用后获得：体力药剂*1。 | P659: 999999 | Q659: 1 | R659: 0 | S659: 0 | T659: 10000 | U659: 1 | V659: 1 | AG659: 1 | AH659: 1
A660: 13651 | B660: 加群礼包 | C660: 13001 | D660: 5 | E660: 2 | F660: 3 | G660: 1 | H660: 1 | I660: 10 | J660: 0 | K660: 0 | L660: 0 | N660: 0 | O660: 使用后获得：钻石*100，次元核心*1，金币5w，体力药剂*1。 | P660: 999999 | Q660: 1 | R660: 0 | S660: 0 | T660: 19005|10019|19103|10000 | U660: 100|1|5|1 | V660: =RC[-1] -> 100|1|5|1 | AG660: 1 | AH660: 1
A661: 13652 | B661: 第二天礼包 | C661: 13002 | D661: 5 | E661: 2 | F661: 3 | G661: 1 | H661: 1 | I661: 10 | J661: 0 | K661: 0 | L661: 0 | N661: 0 | O661: 使用后获得：钻石2000，橙色装备随机碎片箱*20，体力药剂*2。 | P661: 999999 | Q661: 1 | R661: 0 | S661: 0 | T661: 19005|13003|10000 | U661: 2000|20|2 | V661: =RC[-1] -> 2000|20|2 | AG661: 1 | AH661: 1
A662: 13653 | B662: 第四天礼包 | C662: 13002 | D662: 5 | E662: 2 | F662: 3 | G662: 1 | H662: 1 | I662: 10 | J662: 0 | K662: 0 | L662: 0 | N662: 0 | O662: 使用后获得：钻石2000，橙品传承核心*5，体力药剂*2。 | P662: 999999 | Q662: 1 | R662: 0 | S662: 0 | T662: 19005|33400|10000 | U662: 2000|5|2 | V662: =RC[-1] -> 2000|5|2 | AB662: 5 | AG662: 1 | AH662: 1
A663: 13654 | B663: 第六天礼包 | C663: 13002 | D663: 5 | E663: 2 | F663: 3 | G663: 1 | H663: 1 | I663: 10 | J663: 0 | K663: 0 | L663: 0 | N663: 0 | O663: 使用后获得：钻石2000，威名*20000，体力药剂*2。 | P663: 999999 | Q663: 1 | R663: 0 | S663: 0 | T663: 19005|19012|10000 | U663: 2000|20000|2 | V663: =RC[-1] -> 2000|20000|2 | AG663: 1 | AH663: 1
A664: 13655 | B664: 第八天礼包 | C664: 13002 | D664: 5 | E664: 2 | F664: 3 | G664: 1 | H664: 1 | I664: 10 | J664: 0 | K664: 0 | L664: 0 | N664: 0 | O664: 使用后获得：钻石2000，橙色装备箱*1，体力药剂*2。 | P664: 999999 | Q664: 1 | R664: 0 | S664: 0 | T664: 19005|13026|10000 | U664: 2000|1|2 | V664: =RC[-1] -> 2000|1|2 | AC664: 1 | AG664: 1 | AH664: 1
A665: 13656 | B665: 封测老司机礼包 | C665: 13003 | D665: 5 | E665: 2 | F665: 3 | G665: 1 | H665: 1 | I665: 10 | J665: 0 | K665: 0 | L665: 0 | N665: 0 | O665: 使用后获得：最初的开拓者，钻石168，橙品英雄碎片宝箱*10。 | P665: 999999 | Q665: 1 | R665: 0 | S665: 0 | T665: 10026|19005|13014 | U665: 1|168|10 | V665: =RC[-1] -> 1|168|10 | AC665: 1 | AG665: 1 | AH665: 1
A666: 13657 | B666: 封测老玩家礼包 | C666: 13003 | D666: 5 | E666: 2 | F666: 3 | G666: 1 | H666: 1 | I666: 10 | J666: 0 | K666: 0 | L666: 0 | N666: 0 | O666: 使用后获得：贵宾1级、钻石*88，金币*88888，次元核心*3、刷新令*10。 | P666: 999999 | Q666: 1 | R666: 0 | S666: 0 | T666: 19021|19005|19103|19003|10019|10021 | U666: 60|88|8|8888|3|10 | V666: =RC[-1] -> 60|88|8|8888|3|10 | AC666: 1 | AG666: 1 | AH666: 1
A667: 13658 | B667: 测试福利礼包 | C667: 13003 | D667: 4 | E667: 2 | F667: 3 | G667: 1 | H667: 1 | I667: 10 | J667: 0 | K667: 0 | L667: 0 | N667: 0 | O667: 使用后获得：钻石88，金币88888，体力药剂*1，精力药剂*1，橙品英雄碎片宝箱*10。 | P667: 999999 | Q667: 1 | R667: 0 | S667: 0 | T667: 19005|19103|19003|10000|10001|13014 | U667: 88|8|8888|1|1|10 | V667: =RC[-1] -> 88|8|8888|1|1|10 | AC667: 1 | AG667: 1 | AH667: 1
A668: 13659 | B668: 360独家预约礼包 | C668: 13003 | D668: 4 | E668: 2 | F668: 3 | G668: 1 | H668: 1 | I668: 10 | J668: 0 | K668: 0 | L668: 0 | N668: 0 | O668: 使用后获得：钻石50，进阶石*100，绿品传承核心*2。 | P668: 999999 | Q668: 1 | R668: 0 | S668: 0 | T668: 19005|10002|33100 | U668: 50|100|2 | V668: =RC[-1] -> 50|100|2 | AC668: 1 | AG668: 1 | AH668: 1
A669: 13660 | B669: 普通礼包 | C669: 13000 | D669: 3 | E669: 2 | F669: 3 | G669: 1 | H669: 1 | I669: 10 | J669: 0 | K669: 0 | L669: 0 | N669: 0 | O669: 使用后获得：钻石*168，金币*8万，进阶石*100，高级保护令*5。 | P669: 999999 | Q669: 1 | R669: 0 | S669: 0 | T669: 19005|19103|10002|10017 | U669: 168|8|100|5 | V669: =RC[-1] -> 168|8|100|5 | AG669: 1 | AH669: 1
A670: 13661 | B670: 高级礼包 | C670: 13001 | D670: 4 | E670: 2 | F670: 3 | G670: 1 | H670: 1 | I670: 10 | J670: 0 | K670: 0 | L670: 0 | N670: 0 | O670: 使用后获得：钻石*188，金币*10万，培养丹*50，蓝水晶*8。 | P670: 999999 | Q670: 1 | R670: 0 | S670: 0 | T670: 19005|19103|10003|42201 | U670: 188|10|50|8 | V670: =RC[-1] -> 188|10|50|8 | AD670: 8 | AG670: 1 | AH670: 1
A671: 13662 | B671: 独家礼包 | C671: 13002 | D671: 5 | E671: 2 | F671: 3 | G671: 1 | H671: 1 | I671: 10 | J671: 0 | K671: 0 | L671: 0 | N671: 0 | O671: 使用后获得：钻石*268，金币*18万，次元核心*2。 | P671: 999999 | Q671: 1 | R671: 0 | S671: 0 | T671: 19005|19103|10019 | U671: 268|18|2 | V671: =RC[-1] -> 268|18|2 | AG671: 1 | AH671: 1
A672: 13663 | B672: 小礼包 | C672: 13002 | D672: 3 | E672: 2 | F672: 3 | G672: 1 | H672: 1 | I672: 10 | J672: 0 | K672: 0 | L672: 0 | N672: 0 | O672: 使用后获得：钻石*100、培养石*50、金币*25W。 | P672: 999999 | Q672: 1 | R672: 0 | S672: 0 | T672: 19005|10003|19103 | U672: 100|50|25 | V672: =RC[-1] -> 100|50|25 | AG672: 1 | AH672: 1
A673: 13664 | B673: 中级礼包 | C673: 13002 | D673: 3 | E673: 2 | F673: 3 | G673: 1 | H673: 1 | I673: 10 | J673: 0 | K673: 0 | L673: 0 | N673: 0 | O673: 使用后获得：钻石*350、培养石*66、体力丹*3、精力丹*3、金币*30W。 | P673: 999999 | Q673: 1 | R673: 0 | S673: 0 | T673: 19005|10003|10000|10001|19103 | U673: 350|66|3|3|30 | V673: =RC[-1] -> 350|66|3|3|30 | AG673: 1 | AH673: 1
A674: 13665 | B674: 高级礼包 | C674: 13002 | D674: 4 | E674: 2 | F674: 3 | G674: 1 | H674: 1 | I674: 10 | J674: 0 | K674: 0 | L674: 0 | N674: 0 | O674: 使用后获得：钻石*520、培养石*88、体力丹*5、精力丹*5、橙品精炼石*25、金币*50W。 | P674: 999999 | Q674: 1 | R674: 0 | S674: 0 | T674: 19005|10003|10000|10001|10014|19103 | U674: 520|88|5|5|25|50 | V674: =RC[-1] -> 520|88|5|5|25|50 | AG674: 1 | AH674: 1
A675: 13666 | B675: 超级礼包 | C675: 13002 | D675: 5 | E675: 2 | F675: 3 | G675: 1 | H675: 1 | I675: 10 | J675: 0 | K675: 0 | L675: 0 | N675: 0 | O675: 使用后获得：钻石*998、培养石*168、体力丹*10、精力丹*10、橙品精炼石*100、金币*100W。 | P675: 999999 | Q675: 1 | R675: 0 | S675: 0 | T675: 19005|10003|10000|10001|10014|19103 | U675: 998|168|10|10|100|100 | V675: =RC[-1] -> 998|168|10|10|100|100 | AG675: 1 | AH675: 1
A676: 13667 | B676: 专属礼包 | C676: 13002 | D676: 4 | E676: 2 | F676: 3 | G676: 1 | H676: 1 | I676: 10 | J676: 0 | K676: 0 | L676: 0 | N676: 0 | O676: 使用后获得：次元核心*3、钻石*168、金币*50W。 | P676: 999999 | Q676: 1 | R676: 0 | S676: 0 | T676: 10019|19005|19103 | U676: 3|168|50 | V676: =RC[-1] -> 3|168|50 | AG676: 1 | AH676: 1
A677: 13668 | B677: 加群礼包 | C677: 13002 | D677: 4 | E677: 2 | F677: 3 | G677: 1 | H677: 1 | I677: 10 | J677: 0 | K677: 0 | L677: 0 | N677: 0 | O677: 使用后获得：培养石*66、体力丹*3、精力丹*3、钻石*288、金币*40W。 | P677: 999999 | Q677: 1 | R677: 0 | S677: 0 | T677: 10003|10000|10001|19005|19103 | U677: 66|3|3|288|40 | V677: =RC[-1] -> 66|3|3|288|40 | AG677: 1 | AH677: 1
A678: 13669 | B678: 豪华大礼盒 | C678: 13005 | D678: 4 | E678: 2 | F678: 3 | G678: 1 | H678: 1 | I678: 10 | J678: 0 | K678: 0 | L678: 0 | N678: 0 | O678: 使用后获得：培养石*666、潜能合剂*168、任选精灵升华材料*1、各种灵泉*500。 | P678: 999999 | Q678: 1 | R678: 0 | S678: 0 | T678: 10003|10004|13324|13646 | U678: 666|168|1|50 | V678: =RC[-1] -> 666|168|1|50 | AG678: 1 | AH678: 1
A679: 13670 | B679: 贵宾0超值礼包 | C679: 13003 | D679: 4 | E679: 2 | F679: 3 | G679: 1 | H679: 1 | I679: 10 | J679: 0 | K679: 0 | L679: 0 | N679: 0 | O679: 包含：次元碎片*5、金币*5W。 | P679: 999999 | Q679: 1 | R679: 0 | S679: 0 | T679: 10018|19103 | U679: 5|5 | V679: =RC[-1] -> 5|5 | AG679: 1 | AH679: 1 | AI679: 1
A680: 13671 | B680: 贵宾1超值礼包 | C680: 13003 | D680: 4 | E680: 2 | F680: 3 | G680: 1 | H680: 1 | I680: 10 | J680: 0 | K680: 0 | L680: 0 | N680: 0 | O680: 包含：次元核心*1、体力药剂*2、金币*10W。 | P680: 999999 | Q680: 1 | R680: 0 | S680: 0 | T680: 10019|10000|19103 | U680: 1|2|10 | V680: =RC[-1] -> 1|2|10 | AG680: 1 | AH680: 1 | AI680: 1
A681: 13672 | B681: 贵宾2超值礼包 | C681: 13003 | D681: 4 | E681: 2 | F681: 3 | G681: 1 | H681: 1 | I681: 10 | J681: 0 | K681: 0 | L681: 0 | N681: 0 | O681: 包含：橙品圣器8选1*1、精力药剂*2、刷新令*10、金币*15W。 | P681: 999999 | Q681: 1 | R681: 0 | S681: 0 | T681: 13316|10001|10021|19103 | U681: 1|2|10|15 | V681: =RC[-1] -> 1|2|10|15 | AG681: 1 | AH681: 1 | AI681: 1
A682: 13673 | B682: 贵宾3超值礼包 | C682: 13003 | D682: 4 | E682: 2 | F682: 3 | G682: 1 | H682: 1 | I682: 10 | J682: 0 | K682: 0 | L682: 0 | N682: 0 | O682: 包含：烈焰魔靴*1、体力药剂*2、精力药剂*2、圣器碎片箱*5、金币*20W。 | P682: 999999 | Q682: 1 | R682: 0 | S682: 0 | T682: 22304|10000|10001|13008|19103 | U682: 1|2|2|5|20 | V682: =RC[-1] -> 1|2|2|5|20 | AC682: 1 | AG682: 1 | AH682: 1 | AI682: 1
A683: 13674 | B683: 贵宾4超值礼包 | C683: 13003 | D683: 4 | E683: 2 | F683: 3 | G683: 1 | H683: 1 | I683: 10 | J683: 0 | K683: 0 | L683: 0 | N683: 0 | O683: 包含：烈焰护甲*1、体力药剂*3、精力药剂*3、圣器碎片箱*8、金币*30W。 | P683: 999999 | Q683: 1 | R683: 0 | S683: 0 | T683: 21304|10000|10001|13008|19103 | U683: 1|3|3|8|30 | V683: =RC[-1] -> 1|3|3|8|30 | AC683: 1 | AG683: 1 | AH683: 1 | AI683: 1
A684: 13675 | B684: 贵宾5超值礼包 | C684: 13003 | D684: 4 | E684: 2 | F684: 3 | G684: 1 | H684: 1 | I684: 10 | J684: 0 | K684: 0 | L684: 0 | N684: 0 | O684: 包含：烈焰护腕*1、体力药剂*5、精力药剂*5、圣器碎片箱*12、金币*40W。 | P684: 999999 | Q684: 1 | R684: 0 | S684: 0 | T684: 23304|10000|10001|13008|19103 | U684: 1|5|5|12|40 | V684: =RC[-1] -> 1|5|5|12|40 | AC684: 1 | AG684: 1 | AH684: 1 | AI684: 1
A685: 13676 | B685: 贵宾6超值礼包 | C685: 13003 | D685: 4 | E685: 2 | F685: 3 | G685: 1 | H685: 1 | I685: 10 | J685: 0 | K685: 0 | L685: 0 | N685: 0 | O685: 包含：烈焰晶杖*1、体力药剂*8、精力药剂*8、圣器碎片箱*16、金币*60W。 | P685: 999999 | Q685: 1 | R685: 0 | S685: 0 | T685: 20304|10000|10001|13008|19103 | U685: 1|8|8|16|60 | V685: =RC[-1] -> 1|8|8|16|60 | AC685: 1 | AG685: 1 | AH685: 1 | AI685: 1
A686: 13677 | B686: 贵宾7超值礼包 | C686: 13003 | D686: 4 | E686: 2 | F686: 3 | G686: 1 | H686: 1 | I686: 10 | J686: 0 | K686: 0 | L686: 0 | N686: 0 | O686: 包含：贞德*1、体力药剂*10、精力药剂*10、紫水晶*8、金币*80W。 | P686: 999999 | Q686: 1 | R686: 0 | S686: 0 | T686: 31540|10000|10001|42301|19103 | U686: 1|10|10|8|80 | V686: =RC[-1] -> 1|10|10|8|80 | AB686: 1 | AD686: 8 | AG686: 1 | AH686: 1 | AI686: 1
A687: 13678 | B687: 贵宾8超值礼包 | C687: 13003 | D687: 4 | E687: 2 | F687: 3 | G687: 1 | H687: 1 | I687: 10 | J687: 0 | K687: 0 | L687: 0 | N687: 0 | O687: 包含：幽冥掠夺*1、体力药剂*12、精力药剂*12、紫水晶*10、金币*100W。 | P687: 999999 | Q687: 1 | R687: 0 | S687: 0 | T687: 22404|10000|10001|42301|19103 | U687: 1|12|12|10|100 | V687: =RC[-1] -> 1|12|12|10|100 | AC687: 1 | AD687: 10 | AG687: 1 | AH687: 1 | AI687: 1
A688: 13679 | B688: 贵宾9超值礼包 | C688: 13003 | D688: 4 | E688: 2 | F688: 3 | G688: 1 | H688: 1 | I688: 10 | J688: 0 | K688: 0 | L688: 0 | N688: 0 | O688: 包含：幽冥屠戮*1、体力药剂*14、精力药剂*14、紫水晶*12、金币*150W。 | P688: 999999 | Q688: 1 | R688: 0 | S688: 0 | T688: 21404|10000|10001|42301|19103 | U688: 1|14|14|12|150 | V688: =RC[-1] -> 1|14|14|12|150 | AC688: 1 | AD688: 12 | AG688: 1 | AH688: 1 | AI688: 1
A689: 13680 | B689: 贵宾10超值礼包 | C689: 13003 | D689: 4 | E689: 2 | F689: 3 | G689: 1 | H689: 1 | I689: 10 | J689: 0 | K689: 0 | L689: 0 | N689: 0 | O689: 包含：幽冥掌控*1、精力药剂*20、紫水晶*14、金币*200W。 | P689: 999999 | Q689: 1 | R689: 0 | S689: 0 | T689: 23404|10001|42301|19103 | U689: 1|20|14|200 | V689: =RC[-1] -> 1|20|14|200 | AC689: 1 | AD689: 14 | AG689: 1 | AH689: 1 | AI689: 1
A690: 13681 | B690: 贵宾11超值礼包 | C690: 13003 | D690: 4 | E690: 2 | F690: 3 | G690: 1 | H690: 1 | I690: 10 | J690: 0 | K690: 0 | L690: 0 | N690: 0 | O690: 包含：幽冥收割*1、精力药剂*25、潜能合剂*468、金币*300W。 | P690: 999999 | Q690: 1 | R690: 0 | S690: 0 | T690: 20404|10001|10004|19103 | U690: 1|25|468|300 | V690: =RC[-1] -> 1|25|468|300 | AC690: 1 | AG690: 1 | AH690: 1 | AI690: 1
A691: 13682 | B691: 贵宾12超值礼包 | C691: 13003 | D691: 4 | E691: 2 | F691: 3 | G691: 1 | H691: 1 | I691: 10 | J691: 0 | K691: 0 | L691: 0 | N691: 0 | O691: 包含：顶级红品英雄（A）*1、顶级红品英雄（B）*1、圣器精炼石*200、紫水晶*16、金币*400W。 | P691: 999999 | Q691: 1 | R691: 0 | S691: 0 | T691: 13417|13418|10010|42301|19103 | U691: 1|1|200|16|400 | V691: =RC[-1] -> 1|1|200|16|400 | AD691: 16 | AG691: 1 | AH691: 1 | AI691: 1
A692: 13683 | B692: 贵宾13超值礼包 | C692: 13003 | D692: 4 | E692: 2 | F692: 3 | G692: 1 | H692: 1 | I692: 10 | J692: 0 | K692: 0 | L692: 0 | N692: 0 | O692: 包含：地狱哀歌*1、刷新令*60、潜能合剂*568、金币*500W。 | P692: 999999 | Q692: 1 | R692: 0 | S692: 0 | T692: 21501|10021|10004|19103 | U692: 1|60|568|500 | V692: =RC[-1] -> 1|60|568|500 | AC692: 1 | AG692: 1 | AH692: 1 | AI692: 1
A693: 13684 | B693: 贵宾14超值礼包 | C693: 13003 | D693: 4 | E693: 2 | F693: 3 | G693: 1 | H693: 1 | I693: 10 | J693: 0 | K693: 0 | L693: 0 | N693: 0 | O693: 包含：贯穿苍穹*1、圣器精炼石*400、紫水晶*18、金币*600W。 | P693: 999999 | Q693: 1 | R693: 0 | S693: 0 | T693: 22501|10010|42301|19103 | U693: 1|400|18|600 | V693: =RC[-1] -> 1|400|18|600 | AC693: 1 | AD693: 18 | AG693: 1 | AH693: 1 | AI693: 1
A694: 13685 | B694: 贵宾15超值礼包 | C694: 13003 | D694: 4 | E694: 2 | F694: 3 | G694: 1 | H694: 1 | I694: 10 | J694: 0 | K694: 0 | L694: 0 | N694: 0 | O694: 包含：苍白正义*1、刷新令*100、潜能合剂*688、金币*800W。 | P694: 999999 | Q694: 1 | R694: 0 | S694: 0 | T694: 23501|10021|10004|19103 | U694: 1|100|688|800 | V694: =RC[-1] -> 1|100|688|800 | AC694: 1 | AG694: 1 | AH694: 1 | AI694: 1
A695: 13686 | B695: 贵宾16超值礼包 | C695: 13003 | D695: 4 | E695: 2 | F695: 3 | G695: 1 | H695: 1 | I695: 10 | J695: 0 | K695: 0 | L695: 0 | N695: 0 | O695: 包含：神圣复仇*1、圣器精炼石*600、紫水晶*20、金币*1000W。 | P695: 999999 | Q695: 1 | R695: 0 | S695: 0 | T695: 20501|10010|42301|19103 | U695: 1|600|20|1000 | V695: =RC[-1] -> 1|600|20|1000 | AC695: 1 | AD695: 20 | AG695: 1 | AH695: 1 | AI695: 1
A696: 13691 | B696: 黑暗骑士宿命符文 | C696: 13041 | D696: 5 | E696: 2 | F696: 3 | G696: 1 | H696: 1 | I696: 10 | J696: 0 | K696: 0 | L696: 1 | N696: 0 | O696: 黑暗骑士的宿命符文——【永寂符文】（红品符文） | P696: 999999 | Q696: 1 | R696: 0 | S696: 0 | T696: 40503 | U696: 1 | V696: =RC[-1] -> 1 | AD696: 1 | AG696: 1 | AH696: 1 | AI696: 1
A697: 13692 | B697: 奎爷宿命符文 | C697: 13042 | D697: 5 | E697: 2 | F697: 3 | G697: 1 | H697: 1 | I697: 10 | J697: 0 | K697: 0 | L697: 1 | N697: 0 | O697: 奎爷的宿命符文——【毁灭符文】（红品符文） | P697: 999999 | Q697: 1 | R697: 0 | S697: 0 | T697: 40502 | U697: 1 | V697: =RC[-1] -> 1 | AD697: 1 | AG697: 1 | AH697: 1 | AI697: 1
A698: 13693 | B698: 钢铁酋长宿命符文 | C698: 13043 | D698: 5 | E698: 2 | F698: 3 | G698: 1 | H698: 1 | I698: 10 | J698: 0 | K698: 0 | L698: 1 | N698: 0 | O698: 钢铁酋长的宿命符文——【疯狂符文】（红品符文） | P698: 999999 | Q698: 1 | R698: 0 | S698: 0 | T698: 40504 | U698: 1 | V698: =RC[-1] -> 1 | AD698: 1 | AG698: 1 | AH698: 1 | AI698: 1
A699: 13694 | B699: 黑暗骑士宿命徽章 | C699: 13044 | D699: 5 | E699: 2 | F699: 3 | G699: 1 | H699: 1 | I699: 10 | J699: 0 | K699: 0 | L699: 1 | N699: 0 | O699: 黑暗骑士的宿命徽章——【凤凰徽章】（红品徽章） | P699: 999999 | Q699: 1 | R699: 0 | S699: 0 | T699: 41503 | U699: 1 | V699: =RC[-1] -> 1 | AD699: 1 | AG699: 1 | AH699: 1 | AI699: 1
A700: 13695 | B700: 奎爷宿命徽章 | C700: 13045 | D700: 5 | E700: 2 | F700: 3 | G700: 1 | H700: 1 | I700: 10 | J700: 0 | K700: 0 | L700: 1 | N700: 0 | O700: 奎爷的宿命徽章——【巨龙徽章】（红品徽章） | P700: 999999 | Q700: 1 | R700: 0 | S700: 0 | T700: 41502 | U700: 1 | V700: =RC[-1] -> 1 | AD700: 1 | AG700: 1 | AH700: 1 | AI700: 1
A701: 13696 | B701: 钢铁酋长宿命徽章 | C701: 13046 | D701: 5 | E701: 2 | F701: 3 | G701: 1 | H701: 1 | I701: 10 | J701: 0 | K701: 0 | L701: 1 | N701: 0 | O701: 钢铁酋长的宿命徽章——【神树徽章】（红品徽章） | P701: 999999 | Q701: 1 | R701: 0 | S701: 0 | T701: 41504 | U701: 1 | V701: =RC[-1] -> 1 | AD701: 1 | AG701: 1 | AH701: 1 | AI701: 1
A702: 13697 | B702: 黑暗骑士宿命装备 | C702: 13021 | D702: 5 | E702: 2 | F702: 3 | G702: 1 | H702: 1 | I702: 10 | J702: 0 | K702: 0 | L702: 1 | N702: 0 | O702: 黑暗骑士的宿命装备——【神圣复仇】（品级32的红品武器） | P702: 999999 | Q702: 1 | R702: 0 | S702: 0 | T702: 20501 | U702: 1 | V702: =RC[-1] -> 1 | AC702: 1 | AG702: 1 | AH702: 1 | AI702: 1
A703: 13698 | B703: 奎爷宿命装备 | C703: 13022 | D703: 5 | E703: 2 | F703: 3 | G703: 1 | H703: 1 | I703: 10 | J703: 0 | K703: 0 | L703: 1 | N703: 0 | O703: 奎爷的宿命装备——【贯穿苍穹】（品级32的红品鞋子） | P703: 999999 | Q703: 1 | R703: 0 | S703: 0 | T703: 22501 | U703: 1 | V703: =RC[-1] -> 1 | AC703: 1 | AG703: 1 | AH703: 1 | AI703: 1
A704: 13699 | B704: 钢铁酋长宿命装备 | C704: 13023 | D704: 5 | E704: 2 | F704: 3 | G704: 1 | H704: 1 | I704: 10 | J704: 0 | K704: 0 | L704: 1 | N704: 0 | O704: 钢铁酋长的宿命装备——【苍白正义】（品级32的红品护腕） | P704: 999999 | Q704: 1 | R704: 0 | S704: 0 | T704: 23501 | U704: 1 | V704: =RC[-1] -> 1 | AC704: 1 | AG704: 1 | AH704: 1 | AI704: 1
A705: 13700 | B705: 初级培养礼包 | C705: 13001 | D705: 4 | E705: 2 | F705: 3 | G705: 1 | H705: 1 | I705: 10 | J705: 0 | K705: 0 | L705: 1 | N705: 0 | O705: 包含：进阶石*100、培养石*50、金币*50000 | P705: 999999 | Q705: 1 | R705: 0 | S705: 0 | T705: 10002|10003|19103 | U705: 100|50|5 | V705: =RC[-1] -> 100|50|5 | AG705: 1
A706: 13701 | B706: 初级装备礼包 | C706: 13001 | D706: 4 | E706: 2 | F706: 3 | G706: 1 | H706: 1 | I706: 10 | J706: 0 | K706: 0 | L706: 1 | N706: 0 | O706: 包含：威名*1000、橙品精炼石*10 | P706: 999999 | Q706: 1 | R706: 0 | S706: 0 | T706: 19012|10014 | U706: 1000|10 | V706: =RC[-1] -> 1000|10 | AG706: 1
A707: 13702 | B707: 初级觉醒礼包 | C707: 13001 | D707: 4 | E707: 2 | F707: 3 | G707: 1 | H707: 1 | I707: 10 | J707: 0 | K707: 0 | L707: 1 | N707: 0 | O707: 包含：普通的觉醒箱*8、觉醒水晶*80 | P707: 999999 | Q707: 1 | R707: 0 | S707: 0 | T707: 13015|10008 | U707: 8|80 | V707: =RC[-1] -> 8|80 | AG707: 1
A708: 13703 | B708: 初级精灵礼包 | C708: 13001 | D708: 4 | E708: 2 | F708: 3 | G708: 1 | H708: 1 | I708: 10 | J708: 0 | K708: 0 | L708: 1 | N708: 0 | O708: 包含：生命灵泉*20、烈焰灵泉*20、大地灵泉*20、寒冰灵泉*20、无尽石*220 | P708: 999999 | Q708: 1 | R708: 0 | S708: 0 | T708: 10030|10031|10032|10033|19028 | U708: 20|20|20|20|220 | V708: =RC[-1] -> 20|20|20|20|220 | AG708: 1
A709: 13704 | B709: 初级碎片礼包 | C709: 13001 | D709: 4 | E709: 2 | F709: 3 | G709: 1 | H709: 1 | I709: 10 | J709: 0 | K709: 0 | L709: 1 | N709: 0 | O709: 包含：阵营碎片箱*2（指定阵营获得随机橙品英雄碎片1~5个）、魂晶*150 | P709: 999999 | Q709: 1 | R709: 0 | S709: 0 | T709: 13320|19006 | U709: 2|150 | V709: =RC[-1] -> 2|150 | AG709: 1
A710: 13705 | B710: 初级圣器礼包 | C710: 13001 | D710: 4 | E710: 2 | F710: 3 | G710: 1 | H710: 1 | I710: 10 | J710: 0 | K710: 0 | L710: 1 | N710: 0 | O710: 包含：圣器精炼石*60 | P710: 999999 | Q710: 1 | R710: 0 | S710: 0 | T710: 10010 | U710: 60 | V710: =RC[-1] -> 60 | AG710: 1
A711: 13706 | B711: 中级培养礼包 | C711: 13002 | D711: 4 | E711: 2 | F711: 3 | G711: 1 | H711: 1 | I711: 10 | J711: 0 | K711: 0 | L711: 1 | N711: 0 | O711: 包含：进阶石*200、培养石*200、金币*200000 | P711: 999999 | Q711: 1 | R711: 0 | S711: 0 | T711: 10002|10003|19103 | U711: 200|200|20 | V711: =RC[-1] -> 200|200|20 | AG711: 1
A712: 13707 | B712: 中级装备礼包 | C712: 13002 | D712: 4 | E712: 2 | F712: 3 | G712: 1 | H712: 1 | I712: 10 | J712: 0 | K712: 0 | L712: 1 | N712: 0 | O712: 包含：威名*1500、橙品精炼石*40、金币*50000 | P712: 999999 | Q712: 1 | R712: 0 | S712: 0 | T712: 19012|10014|19103 | U712: 1500|40|5 | V712: =RC[-1] -> 1500|40|5 | AG712: 1
A713: 13708 | B713: 中级觉醒礼包 | C713: 13002 | D713: 4 | E713: 2 | F713: 3 | G713: 1 | H713: 1 | I713: 10 | J713: 0 | K713: 0 | L713: 1 | N713: 0 | O713: 包含：普通的觉醒箱*12、觉醒水晶*200、神魂*350 | P713: 999999 | Q713: 1 | R713: 0 | S713: 0 | T713: 13015|10008|19017 | U713: 12|200|350 | V713: =RC[-1] -> 12|200|350 | AG713: 1
A714: 13709 | B714: 中级精灵礼包 | C714: 13002 | D714: 4 | E714: 2 | F714: 3 | G714: 1 | H714: 1 | I714: 10 | J714: 0 | K714: 0 | L714: 1 | N714: 0 | O714: 包含：灵性精粹*10、生命灵泉*40、烈焰灵泉*40、大地灵泉*40、寒冰灵泉*40、无尽石*340 | P714: 999999 | Q714: 1 | R714: 0 | S714: 0 | T714: 10022|10030|10031|10032|10033|19028 | U714: 10|40|40|40|40|340 | V714: =RC[-1] -> 10|40|40|40|40|340 | AG714: 1
A715: 13710 | B715: 中级碎片礼包 | C715: 13002 | D715: 4 | E715: 2 | F715: 3 | G715: 1 | H715: 1 | I715: 10 | J715: 0 | K715: 0 | L715: 1 | N715: 0 | O715: 包含：阵营碎片箱*8（指定阵营获得随机橙品英雄碎片1~5个）、魂晶*400 | P715: 999999 | Q715: 1 | R715: 0 | S715: 0 | T715: 13320|19006 | U715: 8|400 | V715: =RC[-1] -> 8|400 | AG715: 1
A716: 13711 | B716: 中级圣器礼包 | C716: 13002 | D716: 4 | E716: 2 | F716: 3 | G716: 1 | H716: 1 | I716: 10 | J716: 0 | K716: 0 | L716: 1 | N716: 0 | O716: 包含：橙品圣器碎片箱*1、圣器精炼石*124 | P716: 999999 | Q716: 1 | R716: 0 | S716: 0 | T716: 13319|10010 | U716: 1|124 | V716: =RC[-1] -> 1|124 | AG716: 1
A717: 13712 | B717: 高级培养礼包 | C717: 13002 | D717: 4 | E717: 2 | F717: 3 | G717: 1 | H717: 1 | I717: 10 | J717: 0 | K717: 0 | L717: 1 | N717: 0 | O717: 包含：进阶石*300、培养石*300、金币*500000 | P717: 999999 | Q717: 1 | R717: 0 | S717: 0 | T717: 10002|10003|19103 | U717: 300|300|50 | V717: =RC[-1] -> 300|300|50 | AG717: 1
A718: 13713 | B718: 高级装备礼包 | C718: 13002 | D718: 4 | E718: 2 | F718: 3 | G718: 1 | H718: 1 | I718: 10 | J718: 0 | K718: 0 | L718: 1 | N718: 0 | O718: 包含：威名*1500、橙品精炼石*70、金币*150000 | P718: 999999 | Q718: 1 | R718: 0 | S718: 0 | T718: 19012|10014|19103 | U718: 1500|70|15 | V718: =RC[-1] -> 1500|70|15 | AG718: 1
A719: 13714 | B719: 高级觉醒礼包 | C719: 13002 | D719: 4 | E719: 2 | F719: 3 | G719: 1 | H719: 1 | I719: 10 | J719: 0 | K719: 0 | L719: 1 | N719: 0 | O719: 包含：普通的觉醒箱*16、觉醒水晶*400、神魂*500 | P719: 999999 | Q719: 1 | R719: 0 | S719: 0 | T719: 13015|10008|19017 | U719: 16|400|500 | V719: =RC[-1] -> 16|400|500 | AG719: 1
A720: 13715 | B720: 高级精灵礼包 | C720: 13002 | D720: 4 | E720: 2 | F720: 3 | G720: 1 | H720: 1 | I720: 10 | J720: 0 | K720: 0 | L720: 1 | N720: 0 | O720: 包含：灵性精粹*20、生命灵泉*50、烈焰灵泉*50、大地灵泉*50、寒冰灵泉*50、无尽石*500 | P720: 999999 | Q720: 1 | R720: 0 | S720: 0 | T720: 10022|10030|10031|10032|10033|19028 | U720: 20|50|50|50|50|500 | V720: =RC[-1] -> 20|50|50|50|50|500 | AG720: 1
A721: 13716 | B721: 高级碎片礼包 | C721: 13002 | D721: 4 | E721: 2 | F721: 3 | G721: 1 | H721: 1 | I721: 10 | J721: 0 | K721: 0 | L721: 1 | N721: 0 | O721: 包含：阵营碎片箱*15（指定阵营获得随机橙品英雄碎片1~5个）、魂晶*575 | P721: 999999 | Q721: 1 | R721: 0 | S721: 0 | T721: 13320|19006 | U721: 15|575 | V721: =RC[-1] -> 15|575 | AG721: 1
A722: 13717 | B722: 高级圣器礼包 | C722: 13002 | D722: 4 | E722: 2 | F722: 3 | G722: 1 | H722: 1 | I722: 10 | J722: 0 | K722: 0 | L722: 1 | N722: 0 | O722: 包含：橙品圣器碎片箱*2、圣器精炼石*188 | P722: 999999 | Q722: 1 | R722: 0 | S722: 0 | T722: 13319|10010 | U722: 2|188 | V722: =RC[-1] -> 2|188 | AG722: 1
A723: 13718 | B723: 超级培养礼包 | C723: 13003 | D723: 4 | E723: 2 | F723: 3 | G723: 1 | H723: 1 | I723: 10 | J723: 0 | K723: 0 | L723: 1 | N723: 0 | O723: 包含：进阶石*500、培养石*600、金币*1060000 | P723: 999999 | Q723: 1 | R723: 0 | S723: 0 | T723: 10002|10003|19103 | U723: 500|600|106 | V723: =RC[-1] -> 500|600|106 | AG723: 1
A724: 13719 | B724: 超级装备礼包 | C724: 13003 | D724: 4 | E724: 2 | F724: 3 | G724: 1 | H724: 1 | I724: 10 | J724: 0 | K724: 0 | L724: 1 | N724: 0 | O724: 包含：威名*5000、橙品精炼石*100、金币*860000 | P724: 999999 | Q724: 1 | R724: 0 | S724: 0 | T724: 19012|10014|19103 | U724: 5000|100|86 | V724: =RC[-1] -> 5000|100|86 | AG724: 1
A725: 13720 | B725: 超级觉醒礼包 | C725: 13003 | D725: 4 | E725: 2 | F725: 3 | G725: 1 | H725: 1 | I725: 10 | J725: 0 | K725: 0 | L725: 1 | N725: 0 | O725: 包含：普通的觉醒箱*20、觉醒水晶*1000、神魂*610 | P725: 999999 | Q725: 1 | R725: 0 | S725: 0 | T725: 13015|10008|19017 | U725: 20|1000|610 | V725: =RC[-1] -> 20|1000|610 | AG725: 1
A726: 13721 | B726: 超级精灵礼包 | C726: 13003 | D726: 4 | E726: 2 | F726: 3 | G726: 1 | H726: 1 | I726: 10 | J726: 0 | K726: 0 | L726: 1 | N726: 0 | O726: 包含：灵性精粹*50、生命灵泉*60、烈焰灵泉*60、大地灵泉*60、寒冰灵泉*60、无尽石*620 | P726: 999999 | Q726: 1 | R726: 0 | S726: 0 | T726: 10022|10030|10031|10032|10033|19028 | U726: 50|60|60|60|60|620 | V726: =RC[-1] -> 50|60|60|60|60|620 | AG726: 1
A727: 13722 | B727: 超级碎片礼包 | C727: 13003 | D727: 4 | E727: 2 | F727: 3 | G727: 1 | H727: 1 | I727: 10 | J727: 0 | K727: 0 | L727: 1 | N727: 0 | O727: 包含：阵营碎片箱*30（指定阵营获得随机橙品英雄碎片1~5个）、魂晶*1110 | P727: 999999 | Q727: 1 | R727: 0 | S727: 0 | T727: 13320|19006 | U727: 30|1110 | V727: =RC[-1] -> 30|1110 | AG727: 1
A728: 13723 | B728: 超级圣器礼包 | C728: 13003 | D728: 4 | E728: 2 | F728: 3 | G728: 1 | H728: 1 | I728: 10 | J728: 0 | K728: 0 | L728: 1 | N728: 0 | O728: 包含：橙品圣器碎片箱*5（指定阵营获得随机橙品英雄碎片1~5个）、圣器精炼石*92 | P728: 999999 | Q728: 1 | R728: 0 | S728: 0 | T728: 13319|10010 | U728: 5|92 | V728: =RC[-1] -> 5|92 | AG728: 1
A729: 13724 | B729: 500充值礼包 | C729: 13005 | D729: 4 | E729: 2 | F729: 3 | G729: 1 | H729: 1 | I729: 10 | J729: 0 | K729: 0 | L729: 0 | N729: 0 | O729: 培养石*1000、觉醒药剂*1000、1级幽冥原石*1、任选橙色卡牌*1 | P729: 999999 | Q729: 1 | R729: 0 | S729: 0 | T729: 13014|42301|19006|10001|19103 | U729: 100|8|888|8|168 | V729: =RC[-1] -> 100|8|888|8|168 | AG729: 1 | AH729: 1 | AI729: 1
A730: 13725 | B730: 1000充值礼包 | C730: 13005 | D730: 4 | E730: 2 | F730: 3 | G730: 1 | H730: 1 | I730: 10 | J730: 0 | K730: 0 | L730: 0 | N730: 0 | O730: 培养石*2000、觉醒药剂*2000、1级幽冥原石*2、任选橙色卡牌*2 | P730: 999999 | Q730: 1 | R730: 0 | S730: 0 | T730: 13014|42301|19006|10001|19103 | U730: 180|18|1688|10|268 | V730: =RC[-1] -> 180|18|1688|10|268 | AG730: 1 | AH730: 1 | AI730: 1
A731: 13726 | B731: 3000充值礼包 | C731: 13005 | D731: 4 | E731: 2 | F731: 3 | G731: 1 | H731: 1 | I731: 10 | J731: 0 | K731: 0 | L731: 0 | N731: 0 | O731: 顶级红色装备*1、任选顶级圣器*1、任选顶级英雄*2、任选橙色卡牌*2 | P731: 999999 | Q731: 1 | R731: 0 | S731: 0 | T731: 13324|10022|13008|10001|19103 | U731: 3|88|6|12|368 | V731: =RC[-1] -> 3|88|6|12|368 | AG731: 1 | AH731: 1 | AI731: 1
A732: 13727 | B732: 5000充值礼包 | C732: 13005 | D732: 4 | E732: 2 | F732: 3 | G732: 1 | H732: 1 | I732: 10 | J732: 0 | K732: 0 | L732: 0 | N732: 0 | O732: 顶级红色装备*3、任选顶级圣器*3、任选顶级英雄*4、任选橙色卡牌*4 | P732: 999999 | Q732: 1 | R732: 0 | S732: 0 | T732: 13324|10022|13008|10001|19103 | U732: 8|188|8|28|688 | V732: =RC[-1] -> 8|188|8|28|688 | AG732: 1 | AH732: 1 | AI732: 1
A733: 13728 | B733: 8000充值礼包 | C733: 13005 | D733: 4 | E733: 2 | F733: 3 | G733: 1 | H733: 1 | I733: 10 | J733: 0 | K733: 0 | L733: 0 | N733: 0 | O733: 顶级红色套装装备*2、任选顶级圣器*5、任选顶级英雄*6、任选橙色卡牌*8 | P733: 999999 | Q733: 1 | R733: 0 | S733: 0 | T733: 42301|33400|10014|10004|19103 | U733: 48|66|168|1688|888 | V733: =RC[-1] -> 48|66|168|1688|888 | AG733: 1 | AH733: 1 | AI733: 1
A734: 13729 | B734: 10000充值礼包 | C734: 13005 | D734: 4 | E734: 2 | F734: 3 | G734: 1 | H734: 1 | I734: 10 | J734: 0 | K734: 0 | L734: 0 | N734: 0 | O734: 顶级红色套装装备*2、任选顶级圣器*10、任选顶级英雄*10、任选橙色卡牌*10 | P734: 999999 | Q734: 1 | R734: 0 | S734: 0 | T734: 13324|10022|13008|10001|19103 | U734: 8|188|8|28|688 | V734: =RC[-1] -> 8|188|8|28|688 | AG734: 1 | AH734: 1 | AI734: 1
A735: 13730 | B735: 内测充值礼包 | C735: 13005 | D735: 5 | E735: 2 | F735: 3 | G735: 1 | H735: 1 | I735: 10 | J735: 0 | K735: 0 | L735: 0 | N735: 0 | O735: 1级幽冥原石*1、1级冰霜原石*1、1级生命原石*1 | P735: 999999 | Q735: 1 | R735: 0 | S735: 0 | T735: 42301|33400|10014|10004|19103 | U735: 48|66|168|1688|888 | V735: =RC[-1] -> 48|66|168|1688|888 | AG735: 1 | AH735: 1 | AI735: 1
A736: 13740 | B736: 新手礼包 | C736: 13005 | D736: 4 | E736: 2 | F736: 3 | G736: 1 | H736: 1 | I736: 10 | J736: 0 | K736: 0 | L736: 0 | N736: 0 | O736: 使用后获得：进阶石*66、钻石*66、金币*6W | P736: 999999 | Q736: 1 | R736: 0 | S736: 0 | T736: 10002|19005|19103 | U736: 66|66|6 | V736: =RC[-1] -> 66|66|6 | AG736: 1 | AH736: 1 | AI736: 1
A737: 13741 | B737: 独家礼包 | C737: 13005 | D737: 4 | E737: 2 | F737: 3 | G737: 1 | H737: 1 | I737: 10 | J737: 0 | K737: 0 | L737: 0 | N737: 0 | O737: 使用后获得：培养石*50、进阶石*66、金币*8W | P737: 999999 | Q737: 1 | R737: 0 | S737: 0 | T737: 10003|10002|19103 | U737: 50|66|8 | V737: =RC[-1] -> 50|66|8 | AG737: 1 | AH737: 1 | AI737: 1
A738: 13742 | B738: 特权礼包 | C738: 13005 | D738: 4 | E738: 2 | F738: 3 | G738: 1 | H738: 1 | I738: 10 | J738: 0 | K738: 0 | L738: 0 | N738: 0 | O738: 使用后获得：刷新令*5、魂晶*188、金币*6W | P738: 999999 | Q738: 1 | R738: 0 | S738: 0 | T738: 10021|19006|19103 | U738: 5|188|6 | V738: =RC[-1] -> 5|188|6 | AG738: 1 | AH738: 1 | AI738: 1
A739: 13743 | B739: 白银礼包 | C739: 13005 | D739: 4 | E739: 2 | F739: 3 | G739: 1 | H739: 1 | I739: 10 | J739: 0 | K739: 0 | L739: 0 | N739: 0 | O739: 使用后获得：培养石*30、金币*10W | P739: 999999 | Q739: 1 | R739: 0 | S739: 0 | T739: 10003|19103 | U739: 30|10 | V739: =RC[-1] -> 30|10 | AG739: 1 | AH739: 1 | AI739: 1
A740: 13744 | B740: 黄金礼包 | C740: 13005 | D740: 4 | E740: 2 | F740: 3 | G740: 1 | H740: 1 | I740: 10 | J740: 0 | K740: 0 | L740: 0 | N740: 0 | O740: 使用后获得：次元核心*2、刷新令*5、金币*16W | P740: 999999 | Q740: 1 | R740: 0 | S740: 0 | T740: 10019|10021|19103 | U740: 2|5|16 | V740: =RC[-1] -> 2|5|16 | AG740: 1 | AH740: 1 | AI740: 1
A741: 13745 | B741: 钻石礼包 | C741: 13005 | D741: 4 | E741: 2 | F741: 3 | G741: 1 | H741: 1 | I741: 10 | J741: 0 | K741: 0 | L741: 0 | N741: 0 | O741: 使用后获得：次元核心*8、精力药剂*5、金币*28W | P741: 999999 | Q741: 1 | R741: 0 | S741: 0 | T741: 10019|10001|19103 | U741: 8|5|28 | V741: =RC[-1] -> 8|5|28 | AG741: 1 | AH741: 1 | AI741: 1
A742: 13746 | B742: 群众礼包 | C742: 13005 | D742: 4 | E742: 2 | F742: 3 | G742: 1 | H742: 1 | I742: 10 | J742: 0 | K742: 0 | L742: 0 | N742: 0 | O742: 使用后获得：进阶石*99、钻石*88、金币*12W | P742: 999999 | Q742: 1 | R742: 0 | S742: 0 | T742: 10002|19005|19103 | U742: 99|88|12 | V742: =RC[-1] -> 99|88|12 | AG742: 1 | AH742: 1 | AI742: 1
A743: 13747 | B743: 精英礼包 | C743: 13005 | D743: 4 | E743: 2 | F743: 3 | G743: 1 | H743: 1 | I743: 10 | J743: 0 | K743: 0 | L743: 0 | N743: 0 | O743: 使用后获得：刷新令*15、钻石*168、金币*30W | P743: 999999 | Q743: 1 | R743: 0 | S743: 0 | T743: 10021|19005|19103 | U743: 15|168|30 | V743: =RC[-1] -> 15|168|30 | AG743: 1 | AH743: 1 | AI743: 1
A744: 13748 | B744: 高级礼包 | C744: 13005 | D744: 4 | E744: 2 | F744: 3 | G744: 1 | H744: 1 | I744: 10 | J744: 0 | K744: 0 | L744: 0 | N744: 0 | O744: 使用后获得：培养石*60、钻石*98、金币*20W | P744: 999999 | Q744: 1 | R744: 0 | S744: 0 | T744: 10003|19005|19103 | U744: 60|98|20 | V744: =RC[-1] -> 60|98|20 | AG744: 1 | AH744: 1 | AI744: 1
A745: 13749 | B745: 豪华礼包 | C745: 13005 | D745: 4 | E745: 2 | F745: 3 | G745: 1 | H745: 1 | I745: 10 | J745: 0 | K745: 0 | L745: 0 | N745: 0 | O745: 使用后获得：橙品精炼石*20、培养石*60、金币*28W | P745: 999999 | Q745: 1 | R745: 0 | S745: 0 | T745: 100114|110003|19103 | U745: 20|60|28 | V745: =RC[-1] -> 20|60|28 | AG745: 1 | AH745: 1 | AI745: 1
A746: 13750 | B746: 至尊礼包 | C746: 13005 | D746: 4 | E746: 2 | F746: 3 | G746: 1 | H746: 1 | I746: 10 | J746: 0 | K746: 0 | L746: 0 | N746: 0 | O746: 使用后获得：培养石*66、体力丹*3、精力丹*3、钻石*288、金币*40W | P746: 999999 | Q746: 1 | R746: 0 | S746: 0 | T746: 10003|10000|10001|19005|19103 | U746: 66|3|3|288|40 | V746: =RC[-1] -> 66|3|3|288|40 | AG746: 1 | AH746: 1 | AI746: 1
A747: 13751 | B747: 培养大礼包 | C747: 13005 | D747: 4 | E747: 2 | F747: 3 | G747: 1 | H747: 1 | I747: 10 | J747: 0 | K747: 0 | L747: 0 | N747: 0 | O747: 打开可获得培养石*100、金币*30W | P747: 999999 | Q747: 1 | R747: 0 | S747: 0 | T747: 10003|19103 | U747: 100|30 | V747: 100|30 | AG747: 1 | AH747: 1 | AI747: 1
A748: 13752 | B748: 希望礼包 | C748: 13005 | D748: 4 | E748: 2 | F748: 3 | G748: 1 | H748: 1 | I748: 10 | J748: 0 | K748: 0 | L748: 0 | N748: 0 | O748: 打开可获得灵性精粹*50、希望精灵碎片*10 | P748: 999999 | Q748: 1 | R748: 0 | S748: 0 | T748: 10022|15001 | U748: 50|10 | V748: 50|10 | AG748: 1 | AH748: 1 | AI748: 1
A749: 13753 | B749: 紫水晶大礼包 | C749: 13005 | D749: 4 | E749: 2 | F749: 3 | G749: 1 | H749: 1 | I749: 10 | J749: 0 | K749: 0 | L749: 0 | N749: 0 | O749: 打开可获得紫水晶*50、精力药剂*10 | P749: 999999 | Q749: 1 | R749: 0 | S749: 0 | T749: 42301|10001 | U749: 50|10 | V749: 50|10 | AG749: 1 | AH749: 1 | AI749: 1
A750: 13754 | B750: 装备精炼大礼包 | C750: 13005 | D750: 5 | E750: 2 | F750: 3 | G750: 1 | H750: 1 | I750: 10 | J750: 0 | K750: 0 | L750: 0 | N750: 0 | O750: 打开可获得橙品精炼石*1300、金币*80W | P750: 999999 | Q750: 1 | R750: 0 | S750: 0 | T750: 10014|19103 | U750: 1300|80 | V750: 1300|80 | AG750: 1 | AH750: 1 | AI750: 1
A751: 13755 | B751: 紫水晶礼盒 | C751: 13005 | D751: 4 | E751: 2 | F751: 3 | G751: 1 | H751: 1 | I751: 10 | J751: 0 | K751: 0 | L751: 0 | N751: 0 | O751: 打开可获得紫水晶*60、精力药剂*10 | P751: 999999 | Q751: 1 | R751: 0 | S751: 0 | T751: 42301|10001 | U751: 60|10 | V751: 60|10 | AG751: 1 | AH751: 1 | AI751: 1
A752: 13756 | B752: 精灵升华礼盒 | C752: 13005 | D752: 4 | E752: 2 | F752: 3 | G752: 1 | H752: 1 | I752: 10 | J752: 0 | K752: 0 | L752: 0 | N752: 0 | O752: 打开可获得精灵升华道具*10、精灵培养灵泉各一千*1 | P752: 999999 | Q752: 1 | R752: 0 | S752: 0 | T752: 13324|13757 | U752: 10|1 | V752: 10|1 | AG752: 1 | AH752: 1 | AI752: 1
A753: 13757 | B753: 精灵培养材料各一千 | C753: 13012 | D753: 4 | E753: 2 | F753: 3 | G753: 1 | H753: 1 | I753: 10 | J753: 0 | K753: 0 | L753: 0 | N753: 0 | O753: 使用后获得生命灵泉、烈焰灵泉、大地灵泉、寒冰灵泉各一千个。 | P753: 999999 | Q753: 1 | R753: 0 | S753: 0 | T753: 10030|10031|10032|10033 | U753: 1000|1000|1000|1000 | V753: =RC[-1] -> 1000|1000|1000|1000 | AG753: 1 | AH753: 1
A754: 13758 | B754: 奖励礼包 | C754: 13005 | D754: 3 | E754: 2 | F754: 3 | G754: 1 | H754: 1 | I754: 10 | J754: 0 | K754: 0 | L754: 0 | N754: 0 | O754: 使用后获得：金币x1W，钻石x50，次元碎片x1。 | P754: 999999 | Q754: 1 | R754: 0 | S754: 0 | T754: 19103|19005|10018 | U754: 1|50|1 | V754: =RC[-1] -> 1|50|1 | AG754: 1 | AH754: 1 | AI754: 1
A755: 13759 | B755: 入群礼包 | C755: 13005 | D755: 4 | E755: 2 | F755: 3 | G755: 1 | H755: 1 | I755: 10 | J755: 0 | K755: 0 | L755: 0 | N755: 0 | O755: 使用后获得：金币*5W、钻石*300、次元核心*1。 | P755: 999999 | Q755: 1 | R755: 0 | S755: 0 | T755: 19103|19005|10019 | U755: 5|300|1 | V755: =RC[-1] -> 5|300|1 | AG755: 1 | AH755: 1 | AI755: 1
A756: 13760 | B756: 新手礼包 | C756: 13005 | D756: 4 | E756: 2 | F756: 3 | G756: 1 | H756: 1 | I756: 10 | J756: 0 | K756: 0 | L756: 0 | N756: 0 | O756: 使用后获得：进阶石*88、钻石*88、金币*12W。 | P756: 999999 | Q756: 1 | R756: 0 | S756: 0 | T756: 10002|19005|19103 | U756: 88|88|12 | V756: =RC[-1] -> 88|88|12 | AG756: 1 | AH756: 1 | AI756: 1
A757: 13761 | B757: 特权礼包 | C757: 13005 | D757: 4 | E757: 2 | F757: 3 | G757: 1 | H757: 1 | I757: 10 | J757: 0 | K757: 0 | L757: 0 | N757: 0 | O757: 使用后获得：刷新令*15、钻石*108、金币*18W。 | P757: 999999 | Q757: 1 | R757: 0 | S757: 0 | T757: 10021|19005|19103 | U757: 15|108|18 | V757: =RC[-1] -> 15|108|18 | AG757: 1 | AH757: 1 | AI757: 1
A758: 13762 | B758: 且愚且珍惜礼包 | C758: 13005 | D758: 4 | E758: 2 | F758: 3 | G758: 1 | H758: 1 | I758: 10 | J758: 0 | K758: 0 | L758: 0 | N758: 0 | O758: 使用后获得：刷新令*20、魂晶*500、金币*10W | P758: 999999 | Q758: 1 | R758: 0 | S758: 0 | T758: 10021|19006|19103 | U758: 20|500|10 | V758: =RC[-1] -> 20|500|10 | AG758: 1 | AH758: 1 | AI758: 1
A759: 13763 | B759: 无愚伦比礼包 | C759: 13005 | D759: 5 | E759: 2 | F759: 3 | G759: 1 | H759: 1 | I759: 10 | J759: 0 | K759: 0 | L759: 0 | N759: 0 | O759: 使用后获得：灵性精粹*60、体力药剂*6、精力药剂*8、金币*168W | P759: 999999 | Q759: 1 | R759: 0 | S759: 0 | T759: 10022|10000|10001|19103 | U759: 60|6|8|168 | V759: =RC[-1] -> 60|6|8|168 | AG759: 1 | AH759: 1 | AI759: 1
A760: 13764 | B760: 正统礼包 | C760: 13005 | D760: 4 | E760: 2 | F760: 3 | G760: 1 | H760: 1 | I760: 10 | J760: 0 | K760: 0 | L760: 0 | N760: 0 | O760: 使用后获得：灵性精粹*10、刷新令*10、精力药剂*2、金币*25W。 | P760: 999999 | Q760: 1 | R760: 0 | S760: 0 | T760: 10022|10021|10001|19103 | U760: 10|10|2|25 | V760: =RC[-1] -> 10|10|2|25 | AG760: 1 | AH760: 1 | AI760: 1
A761: 13765 | B761: 赐福礼包 | C761: 13005 | D761: 4 | E761: 2 | F761: 3 | G761: 1 | H761: 1 | I761: 10 | J761: 0 | K761: 0 | L761: 0 | N761: 0 | O761: 使用后获得：灵性精粹*15、刷新令*15、精力药剂*3、金币*37W。 | P761: 999999 | Q761: 1 | R761: 0 | S761: 0 | T761: 10022|10021|10001|19103 | U761: 15|15|3|37 | V761: =RC[-1] -> 15|15|3|37 | AG761: 1 | AH761: 1 | AI761: 1
A762: 13766 | B762: 欧皇礼包 | C762: 13005 | D762: 4 | E762: 2 | F762: 3 | G762: 1 | H762: 1 | I762: 10 | J762: 0 | K762: 0 | L762: 0 | N762: 0 | O762: 使用后获得：灵性精粹*30、刷新令*30、精力药剂*6、金币*75W。 | P762: 999999 | Q762: 1 | R762: 0 | S762: 0 | T762: 10022|10021|10001|19103 | U762: 30|30|6|75 | V762: =RC[-1] -> 30|30|6|75 | AG762: 1 | AH762: 1 | AI762: 1
A763: 13767 | B763: 纷纷时节雨 | C763: 13005 | D763: 4 | E763: 2 | F763: 3 | G763: 1 | H763: 1 | I763: 10 | J763: 0 | K763: 0 | L763: 0 | N763: 0 | O763: 使用后获得：体力药剂*2、精力药剂*2、金币*18W。 | P763: 999999 | Q763: 1 | R763: 0 | S763: 0 | T763: 10000|10001|19103 | U763: 2|2|18 | V763: =RC[-1] -> 2|2|18 | AG763: 1 | AH763: 1 | AI763: 1
A764: 13768 | B764: 遥指杏花村 | C764: 13005 | D764: 4 | E764: 2 | F764: 3 | G764: 1 | H764: 1 | I764: 10 | J764: 0 | K764: 0 | L764: 0 | N764: 0 | O764: 使用后获得：次元核心*3、刷新令*10、精力药剂*6、金币*50W。 | P764: 999999 | Q764: 1 | R764: 0 | S764: 0 | T764: 10019|10021|10001|19103 | U764: 3|10|6|50 | V764: =RC[-1] -> 3|10|6|50 | AG764: 1 | AH764: 1 | AI764: 1
A765: 13769 | B765: 梨花落清明 | C765: 13005 | D765: 4 | E765: 2 | F765: 3 | G765: 1 | H765: 1 | I765: 10 | J765: 0 | K765: 0 | L765: 0 | N765: 0 | O765: 使用后获得：灵性精粹*100、体力药剂*8、精力药剂*16、金币*108W。 | P765: 999999 | Q765: 1 | R765: 0 | S765: 0 | T765: 10022|10000|10001|19103 | U765: 100|8|16|108 | V765: =RC[-1] -> 100|8|16|108 | AG765: 1 | AH765: 1 | AI765: 1
A766: 13770 | B766: 新手礼包 | C766: 13002 | D766: 4 | E766: 2 | F766: 3 | G766: 1 | H766: 1 | I766: 10 | J766: 0 | K766: 0 | L766: 0 | N766: 0 | O766: 使用后获得：进阶石*88、钻石*88、金币*12W。 | P766: 999999 | Q766: 1 | R766: 0 | S766: 0 | T766: 10002|19005|19103 | U766: 88|88|12 | V766: =RC[-1] -> 88|88|12 | AG766: 1 | AH766: 1 | AI766: 1
A767: 13771 | B767: 精英礼包 | C767: 13003 | D767: 4 | E767: 2 | F767: 3 | G767: 1 | H767: 1 | I767: 10 | J767: 0 | K767: 0 | L767: 0 | N767: 0 | O767: 使用后获得：刷新令*15、钻石*128、金币*23W。 | P767: 999999 | Q767: 1 | R767: 0 | S767: 0 | T767: 10021|19005|19103 | U767: 15|128|23 | V767: =RC[-1] -> 15|128|23 | AG767: 1 | AH767: 1 | AI767: 1
A768: 13772 | B768: 好评礼包 | C768: 13002 | D768: 4 | E768: 2 | F768: 3 | G768: 1 | H768: 1 | I768: 10 | J768: 0 | K768: 0 | L768: 0 | N768: 0 | O768: 使用后获得：钻石*100，次元核心*1，金币5w，体力药剂*1。 | P768: 999999 | Q768: 1 | R768: 0 | S768: 0 | T768: 19005|10019|19103|10000 | U768: 100|1|5|1 | V768: =RC[-1] -> 100|1|5|1 | AG768: 1 | AH768: 1 | AI768: 1
A769: 13773 | B769: 1K单日累充礼包 | C769: 13005 | D769: 4 | E769: 2 | F769: 3 | G769: 1 | H769: 1 | I769: 10 | J769: 0 | K769: 0 | L769: 0 | N769: 0 | O769: 橙品英雄碎片箱*100、紫水晶*8、魂晶*888、精力药剂*8、金币*168W。 | P769: 999999 | Q769: 1 | R769: 0 | S769: 0 | T769: 13014|42301|19006|10001|19103 | U769: 100|8|888|8|168 | V769: =RC[-1] -> 100|8|888|8|168 | AG769: 1 | AH769: 1 | AI769: 1
A770: 13774 | B770: 3K单日累充礼包 | C770: 13005 | D770: 4 | E770: 2 | F770: 3 | G770: 1 | H770: 1 | I770: 10 | J770: 0 | K770: 0 | L770: 0 | N770: 0 | O770: 橙品英雄碎片箱*180、紫水晶*18、魂晶*1688、精力药剂*10、金币*268W。 | P770: 999999 | Q770: 1 | R770: 0 | S770: 0 | T770: 13014|42301|19006|10001|19103 | U770: 180|18|1688|10|268 | V770: =RC[-1] -> 180|18|1688|10|268 | AG770: 1 | AH770: 1 | AI770: 1
A771: 13775 | B771: 5K单日累充礼包 | C771: 13005 | D771: 4 | E771: 2 | F771: 3 | G771: 1 | H771: 1 | I771: 10 | J771: 0 | K771: 0 | L771: 0 | N771: 0 | O771: 任选精灵升华道具*3、灵性精粹*88、圣器碎片箱*6、精力药剂*12、金币*368W。 | P771: 999999 | Q771: 1 | R771: 0 | S771: 0 | T771: 13324|10022|13008|10001|19103 | U771: 3|88|6|12|368 | V771: =RC[-1] -> 3|88|6|12|368 | AG771: 1 | AH771: 1 | AI771: 1
A772: 13776 | B772: 10K单日累充礼包 | C772: 13005 | D772: 5 | E772: 2 | F772: 3 | G772: 1 | H772: 1 | I772: 10 | J772: 0 | K772: 0 | L772: 0 | N772: 0 | O772: 任选精灵升华道具*8、灵性精粹*188、圣器碎片箱*8、精力药剂*28、金币*688W。 | P772: 999999 | Q772: 1 | R772: 0 | S772: 0 | T772: 13324|10022|13008|10001|19103 | U772: 8|188|8|28|688 | V772: =RC[-1] -> 8|188|8|28|688 | AG772: 1 | AH772: 1 | AI772: 1
A773: 13777 | B773: 20K单日累充礼包 | C773: 13005 | D773: 5 | E773: 2 | F773: 3 | G773: 1 | H773: 1 | I773: 10 | J773: 0 | K773: 0 | L773: 0 | N773: 0 | O773: 紫水晶*48、橙品传承核心*66、橙品精炼石*168、潜能合剂*1688、金币*888W。 | P773: 999999 | Q773: 1 | R773: 0 | S773: 0 | T773: 42301|33400|10014|10004|19103 | U773: 48|66|168|1688|888 | V773: =RC[-1] -> 48|66|168|1688|888 | AG773: 1 | AH773: 1 | AI773: 1
A774: 13778 | B774: 幽冥礼包 | C774: 13005 | D774: 4 | E774: 2 | F774: 3 | G774: 1 | H774: 1 | I774: 10 | J774: 0 | K774: 0 | L774: 0 | N774: 0 | O774: 打开礼包可获得：幽冥原石lv1*1、圣器精炼石*680 | P774: 999999 | Q774: 1 | R774: 0 | S774: 0 | T774: 80100|10010 | U774: 1|680 | V774: =RC[-1] -> 1|680 | AG774: 1 | AH774: 1 | AI774: 1
A775: 13779 | B775: 高级幽冥礼包 | C775: 13005 | D775: 4 | E775: 2 | F775: 3 | G775: 1 | H775: 1 | I775: 10 | J775: 0 | K775: 0 | L775: 0 | N775: 0 | O775: 打开礼包可获得：幽冥原石lv2*1、潜能合剂*500 | P775: 999999 | Q775: 1 | R775: 0 | S775: 0 | T775: 80101|10004 | U775: 1|500 | V775: =RC[-1] -> 1|500 | AG775: 1 | AH775: 1 | AI775: 1
A776: 13780 | B776: 元宵节礼包 | C776: 13005 | D776: 4 | E776: 2 | F776: 3 | G776: 1 | H776: 1 | I776: 10 | J776: 0 | K776: 0 | L776: 0 | N776: 0 | O776: 打开礼包可获得：橙品精炼石*46、圣器精炼石*98、觉醒水晶*188。 | P776: 999999 | Q776: 1 | R776: 0 | S776: 0 | T776: 10014|10010|10008 | U776: 46|98|188 | V776: =RC[-1] -> 46|98|188 | AG776: 1 | AH776: 1 | AI776: 1
A777: 13781 | B777: 豪华返利礼包1 | C777: 13005 | D777: 4 | E777: 2 | F777: 3 | G777: 1 | H777: 1 | I777: 10 | J777: 0 | K777: 0 | L777: 0 | N777: 0 | O777: 礼包包含：次元核心*18、进阶石*688、培养石*188、金币*100W | P777: 999999 | Q777: 1 | R777: 0 | S777: 0 | T777: 10019|10002|10003|19103 | U777: 18|688|188|100 | V777: =RC[-1] -> 18|688|188|100 | AG777: 1 | AH777: 1 | AI777: 1
A778: 13782 | B778: 豪华返利礼包2 | C778: 13005 | D778: 4 | E778: 2 | F778: 3 | G778: 1 | H778: 1 | I778: 10 | J778: 0 | K778: 0 | L778: 0 | N778: 0 | O778: 礼包包含：次元核心*28、体力药剂*5、精力药剂*10、金币*200W | P778: 999999 | Q778: 1 | R778: 0 | S778: 0 | T778: 10019|10000|10001|19103 | U778: 28|5|10|200 | V778: =RC[-1] -> 28|5|10|200 | AG778: 1 | AH778: 1 | AI778: 1
A779: 13783 | B779: 豪华返利礼包3 | C779: 13005 | D779: 4 | E779: 2 | F779: 3 | G779: 1 | H779: 1 | I779: 10 | J779: 0 | K779: 0 | L779: 0 | N779: 0 | O779: 礼包包含：潜能合剂*998、体力药剂*8、精力药剂*16、金币*400W | P779: 999999 | Q779: 1 | R779: 0 | S779: 0 | T779: 10004|10000|10001|19103 | U779: 998|8|16|400 | V779: =RC[-1] -> 998|8|16|400 | AG779: 1 | AH779: 1 | AI779: 1
A780: 13784 | B780: 豪华返利礼包4 | C780: 13005 | D780: 4 | E780: 2 | F780: 3 | G780: 1 | H780: 1 | I780: 10 | J780: 0 | K780: 0 | L780: 0 | N780: 0 | O780: 礼包包含：潜能合剂*1666、橙品精炼石*188、灵性精粹*188、金币*800W | P780: 999999 | Q780: 1 | R780: 0 | S780: 0 | T780: 10004|10014|10022|19103 | U780: 1666|188|188|800 | V780: =RC[-1] -> 1666|188|188|800 | AG780: 1 | AH780: 1 | AI780: 1
A781: 13785 | B781: 返利礼包1 | C781: 13005 | D781: 4 | E781: 2 | F781: 3 | G781: 1 | H781: 1 | I781: 10 | J781: 0 | K781: 0 | L781: 0 | N781: 0 | O781: 礼包包含：次元核心*5、体力药剂*2、精力药剂*2、金币*30W | P781: 999999 | Q781: 1 | R781: 0 | S781: 0 | T781: 10019|10000|10001|19103 | U781: 5|2|2|30 | V781: =RC[-1] -> 5|2|2|30 | AG781: 1 | AH781: 1 | AI781: 1
A782: 13786 | B782: 返利礼包2 | C782: 13005 | D782: 4 | E782: 2 | F782: 3 | G782: 1 | H782: 1 | I782: 10 | J782: 0 | K782: 0 | L782: 0 | N782: 0 | O782: 礼包包含：核心英雄*1、体力药剂*4、精力药剂*6、金币*80W | P782: 999999 | Q782: 1 | R782: 0 | S782: 0 | T782: 13434|10000|10001|19103 | U782: 1|4|6|80 | V782: =RC[-1] -> 1|4|6|80 | AG782: 1 | AH782: 1 | AI782: 1
A783: 13787 | B783: 返利礼包3 | C783: 13005 | D783: 4 | E783: 2 | F783: 3 | G783: 1 | H783: 1 | I783: 10 | J783: 0 | K783: 0 | L783: 0 | N783: 0 | O783: 礼包包含：灵性精粹*120、体力药剂*6、精力药剂*10、金币*150W | P783: 999999 | Q783: 1 | R783: 0 | S783: 0 | T783: 10022|10000|10001|19103 | U783: 120|6|10|150 | V783: =RC[-1] -> 120|6|10|150 | AG783: 1 | AH783: 1 | AI783: 1
A784: 13788 | B784: 返利礼包4 | C784: 13005 | D784: 4 | E784: 2 | F784: 3 | G784: 1 | H784: 1 | I784: 10 | J784: 0 | K784: 0 | L784: 0 | N784: 0 | O784: 礼包包含：觉醒水晶*5688、体力药剂*9、精力药剂*16、金币*500W | P784: 999999 | Q784: 1 | R784: 0 | S784: 0 | T784: 10008|10000|10001|19103 | U784: 5688|9|16|500 | V784: =RC[-1] -> 5688|9|16|500 | AG784: 1 | AH784: 1 | AI784: 1
A785: 13789 | B785: 深海礼包 | C785: 13005 | D785: 4 | E785: 2 | F785: 3 | G785: 1 | H785: 1 | I785: 10 | J785: 0 | K785: 0 | L785: 0 | N785: 0 | O785: 打开礼包可获得：培养石*150、灵性精粹*30 | P785: 999999 | Q785: 1 | R785: 0 | S785: 0 | T785: 10003|10022 | U785: 150|30 | V785: =RC[-1] -> 150|30 | AG785: 1 | AH785: 1 | AI785: 1
A786: 13790 | B786: 深海豪华礼包 | C786: 13005 | D786: 4 | E786: 2 | F786: 3 | G786: 1 | H786: 1 | I786: 10 | J786: 0 | K786: 0 | L786: 0 | N786: 0 | O786: 打开礼包可获得：培养石*300、灵性精粹*50 | P786: 999999 | Q786: 1 | R786: 0 | S786: 0 | T786: 10003|10022 | U786: 300|50 | V786: =RC[-1] -> 300|50 | AG786: 1 | AH786: 1 | AI786: 1
A787: 13791 | B787: 深海女王礼包 | C787: 13005 | D787: 5 | E787: 2 | F787: 3 | G787: 1 | H787: 1 | I787: 10 | J787: 0 | K787: 0 | L787: 1 | N787: 0 | O787: 打开礼包可获得：深海女王*1、深海之泪*5、精灵培养材料四种*50、金币*100W | P787: 999999 | Q787: 1 | R787: 0 | S787: 0 | T787: 13623|10036|13646|19103 | U787: 1|5|5|100 | V787: =RC[-1] -> 1|5|5|100 | AG787: 1 | AH787: 1
A788: 13792 | B788: 累充返利礼包1 | C788: 13005 | D788: 4 | E788: 2 | F788: 3 | G788: 1 | H788: 1 | I788: 10 | J788: 0 | K788: 0 | L788: 0 | N788: 0 | O788: 礼包包含：次元核心*5、体力药剂*2、精力药剂*2、金币*30W | P788: 999999 | Q788: 1 | R788: 0 | S788: 0 | T788: 10019|10000|10001|19103 | U788: 5|2|2|30 | V788: =RC[-1] -> 5|2|2|30 | AG788: 1 | AH788: 1
A789: 13793 | B789: 累充返利礼包2 | C789: 13005 | D789: 4 | E789: 2 | F789: 3 | G789: 1 | H789: 1 | I789: 10 | J789: 0 | K789: 0 | L789: 0 | N789: 0 | O789: 礼包包含：魂晶*1688、体力药剂*3、精力药剂*4、金币*60W | P789: 999999 | Q789: 1 | R789: 0 | S789: 0 | T789: 19006|10000|10001|19103 | U789: 1688|3|4|60 | V789: =RC[-1] -> 1688|3|4|60 | AG789: 1 | AH789: 1
A790: 13794 | B790: 累充返利礼包3 | C790: 13005 | D790: 4 | E790: 2 | F790: 3 | G790: 1 | H790: 1 | I790: 10 | J790: 0 | K790: 0 | L790: 0 | N790: 0 | O790: 礼包包含：核心英雄*1、体力药剂*4、精力药剂*6、金币*80W | P790: 999999 | Q790: 1 | R790: 0 | S790: 0 | T790: 13434|10000|10001|19103 | U790: 1|4|6|80 | V790: =RC[-1] -> 1|4|6|80 | AG790: 1 | AH790: 1
A791: 13795 | B791: 累充返利礼包4 | C791: 13005 | D791: 4 | E791: 2 | F791: 3 | G791: 1 | H791: 1 | I791: 10 | J791: 0 | K791: 0 | L791: 0 | N791: 0 | O791: 礼包包含：橙品精炼石*180、体力药剂*5、精力药剂*8、金币*100W | P791: 999999 | Q791: 1 | R791: 0 | S791: 0 | T791: 10014|10000|10001|19103 | U791: 180|5|8|100 | V791: =RC[-1] -> 180|5|8|100 | AG791: 1 | AH791: 1
A792: 13796 | B792: 累充返利礼包5 | C792: 13005 | D792: 4 | E792: 2 | F792: 3 | G792: 1 | H792: 1 | I792: 10 | J792: 0 | K792: 0 | L792: 0 | N792: 0 | O792: 礼包包含：灵性精粹*120、体力药剂*6、精力药剂*10、金币*150W | P792: 999999 | Q792: 1 | R792: 0 | S792: 0 | T792: 10022|10000|10001|19103 | U792: 120|6|10|150 | V792: =RC[-1] -> 120|6|10|150 | AG792: 1 | AH792: 1
A793: 13797 | B793: 累充返利礼包6 | C793: 13005 | D793: 5 | E793: 2 | F793: 3 | G793: 1 | H793: 1 | I793: 10 | J793: 0 | K793: 0 | L793: 0 | N793: 0 | O793: 礼包包含：任选精灵升华道具*3、体力药剂*7、精力药剂*12、金币*200W | P793: 999999 | Q793: 1 | R793: 0 | S793: 0 | T793: 13324|10000|10001|19103 | U793: 3|7|12|200 | V793: =RC[-1] -> 3|7|12|200 | AG793: 1 | AH793: 1
A794: 13798 | B794: 累充返利礼包7 | C794: 13005 | D794: 5 | E794: 2 | F794: 3 | G794: 1 | H794: 1 | I794: 10 | J794: 0 | K794: 0 | L794: 0 | N794: 0 | O794: 礼包包含：潜能合剂*888、体力药剂*8、精力药剂*14、金币*300W | P794: 999999 | Q794: 1 | R794: 0 | S794: 0 | T794: 10004|10000|10001|19103 | U794: 888|8|14|300 | V794: =RC[-1] -> 888|8|14|300 | AG794: 1 | AH794: 1
A795: 13799 | B795: 累充返利礼包8 | C795: 13005 | D795: 5 | E795: 2 | F795: 3 | G795: 1 | H795: 1 | I795: 10 | J795: 0 | K795: 0 | L795: 0 | N795: 0 | O795: 礼包包含：觉醒水晶*5688、体力药剂*9、精力药剂*16、金币*500W | P795: 999999 | Q795: 1 | R795: 0 | S795: 0 | T795: 10008|10000|10001|19103 | U795: 5688|9|16|500 | V795: =RC[-1] -> 5688|9|16|500 | AG795: 1 | AH795: 1
A796: 13800 | B796: 英雄升级初级包 | C796: 13000 | D796: 4 | E796: 2 | F796: 3 | G796: 1 | H796: 1 | I796: 10 | J796: 0 | K796: 0 | L796: 0 | N796: 0 | O796: 包含：紫品传承核心*5、金币*10W | P796: 999999 | Q796: 1 | R796: 0 | S796: 0 | T796: 33300|19103 | U796: 5|10 | V796: =RC[-1] -> 5|10 | AB796: 5 | AG796: 1
A797: 13801 | B797: 英雄升级低级包 | C797: 13001 | D797: 4 | E797: 2 | F797: 3 | G797: 1 | H797: 1 | I797: 10 | J797: 0 | K797: 0 | L797: 0 | N797: 0 | O797: 包含：橙品传承核心*5 | P797: 999999 | Q797: 1 | R797: 0 | S797: 0 | T797: 33400 | U797: 5 | V797: =RC[-1] -> 5 | AB797: 5 | AG797: 1
A798: 13802 | B798: 英雄升级中级包 | C798: 13002 | D798: 4 | E798: 2 | F798: 3 | G798: 1 | H798: 1 | I798: 10 | J798: 0 | K798: 0 | L798: 0 | N798: 0 | O798: 包含：橙品传承核心*8、金币*10W | P798: 999999 | Q798: 1 | R798: 0 | S798: 0 | T798: 33400|19103 | U798: 8|10 | V798: =RC[-1] -> 8|10 | AB798: 8 | AG798: 1
A799: 13803 | B799: 英雄升级高级包 | C799: 13002 | D799: 4 | E799: 2 | F799: 3 | G799: 1 | H799: 1 | I799: 10 | J799: 0 | K799: 0 | L799: 0 | N799: 0 | O799: 包含：橙品传承核心*11、金币*25W | P799: 999999 | Q799: 1 | R799: 0 | S799: 0 | T799: 33400|19103 | U799: 11|25 | V799: =RC[-1] -> 11|25 | AB799: 11 | AG799: 1
A800: 13804 | B800: 英雄升级超级包 | C800: 13003 | D800: 4 | E800: 2 | F800: 3 | G800: 1 | H800: 1 | I800: 10 | J800: 0 | K800: 0 | L800: 0 | N800: 0 | O800: 包含：橙品传承核心*15、金币*36W | P800: 999999 | Q800: 1 | R800: 0 | S800: 0 | T800: 33400|19103 | U800: 15|36 | V800: =RC[-1] -> 15|36 | AB800: 15 | AG800: 1
A801: 13805 | B801: 英雄升级极限包 | C801: 13003 | D801: 4 | E801: 2 | F801: 3 | G801: 1 | H801: 1 | I801: 10 | J801: 0 | K801: 0 | L801: 0 | N801: 0 | O801: 包含：橙品传承核心*25、金币*36W | P801: 999999 | Q801: 1 | R801: 0 | S801: 0 | T801: 33400|19103 | U801: 25|36 | V801: =RC[-1] -> 25|36 | AB801: 25 | AG801: 1
A802: 13806 | B802: 英雄进阶初级包 | C802: 13000 | D802: 4 | E802: 2 | F802: 3 | G802: 1 | H802: 1 | I802: 10 | J802: 0 | K802: 0 | L802: 0 | N802: 0 | O802: 包含：阵营碎片箱*8（指定阵营获得随机橙品英雄碎片1~5个） | P802: 999999 | Q802: 1 | R802: 0 | S802: 0 | T802: 13320 | U802: 8 | V802: =RC[-1] -> 8 | AG802: 1
A803: 13807 | B803: 英雄进阶低级包 | C803: 13001 | D803: 4 | E803: 2 | F803: 3 | G803: 1 | H803: 1 | I803: 10 | J803: 0 | K803: 0 | L803: 0 | N803: 0 | O803: 包含：阵营碎片箱*12（指定阵营获得随机橙品英雄碎片1~5个）、进阶石*100 | P803: 999999 | Q803: 1 | R803: 0 | S803: 0 | T803: 13320|10002 | U803: 12|100 | V803: =RC[-1] -> 12|100 | AG803: 1
A804: 13808 | B804: 英雄进阶中级包 | C804: 13002 | D804: 4 | E804: 2 | F804: 3 | G804: 1 | H804: 1 | I804: 10 | J804: 0 | K804: 0 | L804: 0 | N804: 0 | O804: 包含：阵营碎片箱*20（指定阵营获得随机橙品英雄碎片1~5个）、进阶石*200 | P804: 999999 | Q804: 1 | R804: 0 | S804: 0 | T804: 13320|10002 | U804: 20|200 | V804: =RC[-1] -> 20|200 | AG804: 1
A805: 13809 | B805: 英雄进阶高级包 | C805: 13002 | D805: 4 | E805: 2 | F805: 3 | G805: 1 | H805: 1 | I805: 10 | J805: 0 | K805: 0 | L805: 0 | N805: 0 | O805: 包含：阵营碎片箱*30（指定阵营获得随机橙品英雄碎片1~5个）、进阶石*200 | P805: 999999 | Q805: 1 | R805: 0 | S805: 0 | T805: 13320|10002 | U805: 30|200 | V805: =RC[-1] -> 30|200 | AG805: 1
A806: 13810 | B806: 英雄进阶超级包 | C806: 13003 | D806: 4 | E806: 2 | F806: 3 | G806: 1 | H806: 1 | I806: 10 | J806: 0 | K806: 0 | L806: 0 | N806: 0 | O806: 包含：阵营碎片箱*40（指定阵营获得随机橙品英雄碎片1~5个）、魂晶*360 | P806: 999999 | Q806: 1 | R806: 0 | S806: 0 | T806: 13320|19006 | U806: 40|360 | V806: =RC[-1] -> 40|360 | AG806: 1
A807: 13811 | B807: 英雄进阶极限包 | C807: 13003 | D807: 4 | E807: 2 | F807: 3 | G807: 1 | H807: 1 | I807: 10 | J807: 0 | K807: 0 | L807: 0 | N807: 0 | O807: 包含：阵营碎片箱*65（指定阵营获得随机橙品英雄碎片1~5个）、魂晶*485 | P807: 999999 | Q807: 1 | R807: 0 | S807: 0 | T807: 13320|19006 | U807: 65|485 | V807: =RC[-1] -> 65|485 | AG807: 1
A808: 13812 | B808: 金币初级包 | C808: 13000 | D808: 4 | E808: 2 | F808: 3 | G808: 1 | H808: 1 | I808: 10 | J808: 0 | K808: 0 | L808: 0 | N808: 0 | O808: 包含：金币*60W | P808: 999999 | Q808: 1 | R808: 0 | S808: 0 | T808: 19103 | U808: 60 | V808: =RC[-1] -> 60 | AG808: 1
A809: 13813 | B809: 金币低级包 | C809: 13001 | D809: 4 | E809: 2 | F809: 3 | G809: 1 | H809: 1 | I809: 10 | J809: 0 | K809: 0 | L809: 0 | N809: 0 | O809: 包含：金币*100W | P809: 999999 | Q809: 1 | R809: 0 | S809: 0 | T809: 19103 | U809: 100 | V809: =RC[-1] -> 100 | AG809: 1
A810: 13814 | B810: 金币中级包 | C810: 13002 | D810: 4 | E810: 2 | F810: 3 | G810: 1 | H810: 1 | I810: 10 | J810: 0 | K810: 0 | L810: 0 | N810: 0 | O810: 包含：金币*170W | P810: 999999 | Q810: 1 | R810: 0 | S810: 0 | T810: 19103 | U810: 170 | V810: =RC[-1] -> 170 | AG810: 1
A811: 13815 | B811: 金币高级包 | C811: 13002 | D811: 4 | E811: 2 | F811: 3 | G811: 1 | H811: 1 | I811: 10 | J811: 0 | K811: 0 | L811: 0 | N811: 0 | O811: 包含：金币*245W | P811: 999999 | Q811: 1 | R811: 0 | S811: 0 | T811: 19103 | U811: 245 | V811: =RC[-1] -> 245 | AG811: 1
A812: 13816 | B812: 金币超级包 | C812: 13003 | D812: 4 | E812: 2 | F812: 3 | G812: 1 | H812: 1 | I812: 10 | J812: 0 | K812: 0 | L812: 0 | N812: 0 | O812: 包含：金币*336W | P812: 999999 | Q812: 1 | R812: 0 | S812: 0 | T812: 19103 | U812: 336 | V812: =RC[-1] -> 336 | AG812: 1
A813: 13817 | B813: 金币极限包 | C813: 13003 | D813: 4 | E813: 2 | F813: 3 | G813: 1 | H813: 1 | I813: 10 | J813: 0 | K813: 0 | L813: 0 | N813: 0 | O813: 包含：金币*536W | P813: 999999 | Q813: 1 | R813: 0 | S813: 0 | T813: 19103 | U813: 536 | V813: =RC[-1] -> 536 | AG813: 1
A814: 13818 | B814: 英雄培养初级包 | C814: 13000 | D814: 4 | E814: 2 | F814: 3 | G814: 1 | H814: 1 | I814: 10 | J814: 0 | K814: 0 | L814: 0 | N814: 0 | O814: 包含：培养丹*150、金币*15W | P814: 999999 | Q814: 1 | R814: 0 | S814: 0 | T814: 10003|19103 | U814: 150|15 | V814: =RC[-1] -> 150|15 | AG814: 1
A815: 13819 | B815: 英雄培养低级包 | C815: 13001 | D815: 4 | E815: 2 | F815: 3 | G815: 1 | H815: 1 | I815: 10 | J815: 0 | K815: 0 | L815: 0 | N815: 0 | O815: 包含：培养丹*250、金币*25W | P815: 999999 | Q815: 1 | R815: 0 | S815: 0 | T815: 10003|19103 | U815: 250|25 | V815: =RC[-1] -> 250|25 | AG815: 1
A816: 13820 | B816: 英雄培养中级包 | C816: 13002 | D816: 4 | E816: 2 | F816: 3 | G816: 1 | H816: 1 | I816: 10 | J816: 0 | K816: 0 | L816: 0 | N816: 0 | O816: 包含：培养丹*450、金币*35W | P816: 999999 | Q816: 1 | R816: 0 | S816: 0 | T816: 10003|19103 | U816: 450|35 | V816: =RC[-1] -> 450|35 | AG816: 1
A817: 13821 | B817: 英雄培养高级包 | C817: 13002 | D817: 4 | E817: 2 | F817: 3 | G817: 1 | H817: 1 | I817: 10 | J817: 0 | K817: 0 | L817: 0 | N817: 0 | O817: 包含：培养丹*600、金币*65W | P817: 999999 | Q817: 1 | R817: 0 | S817: 0 | T817: 10003|19103 | U817: 600|65 | V817: =RC[-1] -> 600|65 | AG817: 1
A818: 13822 | B818: 英雄培养超级包 | C818: 13003 | D818: 4 | E818: 2 | F818: 3 | G818: 1 | H818: 1 | I818: 10 | J818: 0 | K818: 0 | L818: 0 | N818: 0 | O818: 包含：培养丹*800、金币*96W | P818: 999999 | Q818: 1 | R818: 0 | S818: 0 | T818: 10003|19103 | U818: 800|96 | V818: =RC[-1] -> 800|96 | AG818: 1
A819: 13823 | B819: 英雄培养极限包 | C819: 13003 | D819: 4 | E819: 2 | F819: 3 | G819: 1 | H819: 1 | I819: 10 | J819: 0 | K819: 0 | L819: 0 | N819: 0 | O819: 包含：培养丹*1200、金币*176W | P819: 999999 | Q819: 1 | R819: 0 | S819: 0 | T819: 10003|19103 | U819: 1200|176 | V819: =RC[-1] -> 1200|176 | AG819: 1
A820: 13824 | B820: 圣器强化初级包 | C820: 13000 | D820: 4 | E820: 2 | F820: 3 | G820: 1 | H820: 1 | I820: 10 | J820: 0 | K820: 0 | L820: 0 | N820: 0 | O820: 包含：蓝水晶*12 | P820: 999999 | Q820: 1 | R820: 0 | S820: 0 | T820: 42201 | U820: 12 | V820: =RC[-1] -> 12 | AD820: 12 | AG820: 1
A821: 13825 | B821: 圣器强化低级包 | C821: 13001 | D821: 4 | E821: 2 | F821: 3 | G821: 1 | H821: 1 | I821: 10 | J821: 0 | K821: 0 | L821: 0 | N821: 0 | O821: 包含：紫水晶*2、金币*25W | P821: 999999 | Q821: 1 | R821: 0 | S821: 0 | T821: 42301|19103 | U821: 2|25 | V821: =RC[-1] -> 2|25 | AD821: 2 | AG821: 1
A822: 13826 | B822: 圣器强化中级包 | C822: 13002 | D822: 4 | E822: 2 | F822: 3 | G822: 1 | H822: 1 | I822: 10 | J822: 0 | K822: 0 | L822: 0 | N822: 0 | O822: 包含：紫水晶*4、金币*20W | P822: 999999 | Q822: 1 | R822: 0 | S822: 0 | T822: 42301|19103 | U822: 4|20 | V822: =RC[-1] -> 4|20 | AD822: 4 | AG822: 1
A823: 13827 | B823: 圣器强化高级包 | C823: 13002 | D823: 4 | E823: 2 | F823: 3 | G823: 1 | H823: 1 | I823: 10 | J823: 0 | K823: 0 | L823: 0 | N823: 0 | O823: 包含：紫水晶*6、金币*20W | P823: 999999 | Q823: 1 | R823: 0 | S823: 0 | T823: 42301|19103 | U823: 6|20 | V823: =RC[-1] -> 6|20 | AD823: 6 | AG823: 1
A824: 13828 | B824: 圣器强化超级包 | C824: 13003 | D824: 4 | E824: 2 | F824: 3 | G824: 1 | H824: 1 | I824: 10 | J824: 0 | K824: 0 | L824: 0 | N824: 0 | O824: 包含：紫水晶*8、金币*36W | P824: 999999 | Q824: 1 | R824: 0 | S824: 0 | T824: 42301|19103 | U824: 8|36 | V824: =RC[-1] -> 8|36 | AD824: 8 | AG824: 1
A825: 13829 | B825: 圣器强化极限包 | C825: 13003 | D825: 4 | E825: 2 | F825: 3 | G825: 1 | H825: 1 | I825: 10 | J825: 0 | K825: 0 | L825: 0 | N825: 0 | O825: 包含：紫水晶*12、金币*86W | P825: 999999 | Q825: 1 | R825: 0 | S825: 0 | T825: 42301|19103 | U825: 12|86 | V825: =RC[-1] -> 12|86 | AD825: 12 | AG825: 1
A826: 13830 | B826: 灵性精粹初级包 | C826: 13000 | D826: 4 | E826: 2 | F826: 3 | G826: 1 | H826: 1 | I826: 10 | J826: 0 | K826: 0 | L826: 0 | N826: 0 | O826: 包含：灵性精粹*12 | P826: 999999 | Q826: 1 | R826: 0 | S826: 0 | T826: 10022 | U826: 12 | V826: =RC[-1] -> 12 | AG826: 1
A827: 13831 | B827: 灵性精粹低级包 | C827: 13001 | D827: 4 | E827: 2 | F827: 3 | G827: 1 | H827: 1 | I827: 10 | J827: 0 | K827: 0 | L827: 0 | N827: 0 | O827: 包含：灵性精粹*20 | P827: 999999 | Q827: 1 | R827: 0 | S827: 0 | T827: 10022 | U827: 20 | V827: =RC[-1] -> 20 | AG827: 1
A828: 13832 | B828: 灵性精粹中级包 | C828: 13002 | D828: 4 | E828: 2 | F828: 3 | G828: 1 | H828: 1 | I828: 10 | J828: 0 | K828: 0 | L828: 0 | N828: 0 | O828: 包含：灵性精粹*34 | P828: 999999 | Q828: 1 | R828: 0 | S828: 0 | T828: 10022 | U828: 34 | V828: =RC[-1] -> 34 | AG828: 1
A829: 13833 | B829: 灵性精粹高级包 | C829: 13002 | D829: 4 | E829: 2 | F829: 3 | G829: 1 | H829: 1 | I829: 10 | J829: 0 | K829: 0 | L829: 0 | N829: 0 | O829: 包含：灵性精粹*49 | P829: 999999 | Q829: 1 | R829: 0 | S829: 0 | T829: 10022 | U829: 49 | V829: =RC[-1] -> 49 | AG829: 1
A830: 13834 | B830: 灵性精粹超级包 | C830: 13003 | D830: 4 | E830: 2 | F830: 3 | G830: 1 | H830: 1 | I830: 10 | J830: 0 | K830: 0 | L830: 0 | N830: 0 | O830: 包含：灵性精粹*67 | P830: 999999 | Q830: 1 | R830: 0 | S830: 0 | T830: 10022 | U830: 67 | V830: =RC[-1] -> 67 | AG830: 1
A831: 13835 | B831: 灵性精粹极限包 | C831: 13003 | D831: 4 | E831: 2 | F831: 3 | G831: 1 | H831: 1 | I831: 10 | J831: 0 | K831: 0 | L831: 0 | N831: 0 | O831: 包含：灵性精粹*107 | P831: 999999 | Q831: 1 | R831: 0 | S831: 0 | T831: 10022 | U831: 107 | V831: =RC[-1] -> 107 | AG831: 1
A832: 13836 | B832: 精灵升华初级包 | C832: 13000 | D832: 4 | E832: 2 | F832: 3 | G832: 1 | H832: 1 | I832: 10 | J832: 0 | K832: 0 | L832: 0 | N832: 0 | O832: 包含：精灵培养材料各50个、无尽石*400 | P832: 999999 | Q832: 1 | R832: 0 | S832: 0 | T832: 10030|10031|10032|10033|19028 | U832: 50|50|50|50|400 | V832: =RC[-1] -> 50|50|50|50|400 | AG832: 1
A833: 13837 | B833: 精灵升华低级包 | C833: 13001 | D833: 4 | E833: 2 | F833: 3 | G833: 1 | H833: 1 | I833: 10 | J833: 0 | K833: 0 | L833: 0 | N833: 0 | O833: 包含：精灵培养材料各100个、无尽石*600 | P833: 999999 | Q833: 1 | R833: 0 | S833: 0 | T833: 10030|10031|10032|10033|19028 | U833: 100|100|100|100|600 | V833: =RC[-1] -> 100|100|100|100|600 | AG833: 1
A834: 13838 | B834: 精灵升华中级包 | C834: 13002 | D834: 4 | E834: 2 | F834: 3 | G834: 1 | H834: 1 | I834: 10 | J834: 0 | K834: 0 | L834: 0 | N834: 0 | O834: 包含：精灵培养材料各100个、无尽石*1300 | P834: 999999 | Q834: 1 | R834: 0 | S834: 0 | T834: 10030|10031|10032|10033|19028 | U834: 100|100|100|100|1300 | V834: =RC[-1] -> 100|100|100|100|1300 | AG834: 1
A835: 13839 | B835: 精灵升华高级包 | C835: 13002 | D835: 4 | E835: 2 | F835: 3 | G835: 1 | H835: 1 | I835: 10 | J835: 0 | K835: 0 | L835: 0 | N835: 0 | O835: 包含：精灵培养材料各250个、无尽石*1450 | P835: 999999 | Q835: 1 | R835: 0 | S835: 0 | T835: 10030|10031|10032|10033|19028 | U835: 250|250|250|250|1450 | V835: =RC[-1] -> 250|250|250|250|1450 | AG835: 1
A836: 13840 | B836: 精灵升华超级包 | C836: 13003 | D836: 4 | E836: 2 | F836: 3 | G836: 1 | H836: 1 | I836: 10 | J836: 0 | K836: 0 | L836: 0 | N836: 0 | O836: 包含：任选精灵升华道具*1、无尽石*860 | P836: 999999 | Q836: 1 | R836: 0 | S836: 0 | T836: 13324|19028 | U836: 1|860 | V836: =RC[-1] -> 1|860 | AG836: 1
A837: 13841 | B837: 精灵升华极限包 | C837: 13003 | D837: 4 | E837: 2 | F837: 3 | G837: 1 | H837: 1 | I837: 10 | J837: 0 | K837: 0 | L837: 0 | N837: 0 | O837: 包含：任选精灵升华道具*2、无尽石*360 | P837: 999999 | Q837: 1 | R837: 0 | S837: 0 | T837: 13324|19028 | U837: 2|360 | V837: =RC[-1] -> 2|360 | AG837: 1
A838: 13842 | B838: 装备精炼初级包 | C838: 13000 | D838: 4 | E838: 2 | F838: 3 | G838: 1 | H838: 1 | I838: 10 | J838: 0 | K838: 0 | L838: 0 | N838: 0 | O838: 包含：橙品装备精炼石*30 | P838: 999999 | Q838: 1 | R838: 0 | S838: 0 | T838: 10014 | U838: 30 | V838: =RC[-1] -> 30 | AG838: 1
A839: 13843 | B839: 装备精炼低级包 | C839: 13001 | D839: 4 | E839: 2 | F839: 3 | G839: 1 | H839: 1 | I839: 10 | J839: 0 | K839: 0 | L839: 0 | N839: 0 | O839: 包含：橙品装备精炼石*50 | P839: 999999 | Q839: 1 | R839: 0 | S839: 0 | T839: 10014 | U839: 50 | V839: =RC[-1] -> 50 | AG839: 1
A840: 13844 | B840: 装备精炼中级包 | C840: 13002 | D840: 4 | E840: 2 | F840: 3 | G840: 1 | H840: 1 | I840: 10 | J840: 0 | K840: 0 | L840: 0 | N840: 0 | O840: 包含：橙品装备精炼石*85 | P840: 999999 | Q840: 1 | R840: 0 | S840: 0 | T840: 10014 | U840: 85 | V840: =RC[-1] -> 85 | AG840: 1
A841: 13845 | B841: 装备精炼高级包 | C841: 13002 | D841: 4 | E841: 2 | F841: 3 | G841: 1 | H841: 1 | I841: 10 | J841: 0 | K841: 0 | L841: 0 | N841: 0 | O841: 包含：橙品装备精炼石*123 | P841: 999999 | Q841: 1 | R841: 0 | S841: 0 | T841: 10014 | U841: 123 | V841: =RC[-1] -> 123 | AG841: 1
A842: 13846 | B842: 装备精炼超级包 | C842: 13003 | D842: 4 | E842: 2 | F842: 3 | G842: 1 | H842: 1 | I842: 10 | J842: 0 | K842: 0 | L842: 0 | N842: 0 | O842: 包含：橙品装备精炼石*168 | P842: 999999 | Q842: 1 | R842: 0 | S842: 0 | T842: 10014 | U842: 168 | V842: =RC[-1] -> 168 | AG842: 1
A843: 13847 | B843: 装备精炼极限包 | C843: 13003 | D843: 4 | E843: 2 | F843: 3 | G843: 1 | H843: 1 | I843: 10 | J843: 0 | K843: 0 | L843: 0 | N843: 0 | O843: 包含：橙品装备精炼石*268 | P843: 999999 | Q843: 1 | R843: 0 | S843: 0 | T843: 10014 | U843: 268 | V843: =RC[-1] -> 268 | AG843: 1
A844: 13848 | B844: 潜能药剂初级包 | C844: 13000 | D844: 4 | E844: 2 | F844: 3 | G844: 1 | H844: 1 | I844: 10 | J844: 0 | K844: 0 | L844: 0 | N844: 0 | O844: 包含：潜能药剂*40 | P844: 999999 | Q844: 1 | R844: 0 | S844: 0 | T844: 10004 | U844: 40 | V844: =RC[-1] -> 40 | AG844: 1
A845: 13849 | B845: 潜能药剂低级包 | C845: 13001 | D845: 4 | E845: 2 | F845: 3 | G845: 1 | H845: 1 | I845: 10 | J845: 0 | K845: 0 | L845: 0 | N845: 0 | O845: 包含：潜能药剂*67 | P845: 999999 | Q845: 1 | R845: 0 | S845: 0 | T845: 10004 | U845: 67 | V845: =RC[-1] -> 67 | AG845: 1
A846: 13850 | B846: 潜能药剂中级包 | C846: 13002 | D846: 4 | E846: 2 | F846: 3 | G846: 1 | H846: 1 | I846: 10 | J846: 0 | K846: 0 | L846: 0 | N846: 0 | O846: 包含：潜能药剂*114 | P846: 999999 | Q846: 1 | R846: 0 | S846: 0 | T846: 10004 | U846: 114 | V846: =RC[-1] -> 114 | AG846: 1
A847: 13851 | B847: 潜能药剂高级包 | C847: 13002 | D847: 4 | E847: 2 | F847: 3 | G847: 1 | H847: 1 | I847: 10 | J847: 0 | K847: 0 | L847: 0 | N847: 0 | O847: 包含：潜能药剂*164 | P847: 999999 | Q847: 1 | R847: 0 | S847: 0 | T847: 10004 | U847: 164 | V847: =RC[-1] -> 164 | AG847: 1
A848: 13852 | B848: 潜能药剂超级包 | C848: 13003 | D848: 4 | E848: 2 | F848: 3 | G848: 1 | H848: 1 | I848: 10 | J848: 0 | K848: 0 | L848: 0 | N848: 0 | O848: 包含：潜能药剂*224 | P848: 999999 | Q848: 1 | R848: 0 | S848: 0 | T848: 10004 | U848: 224 | V848: =RC[-1] -> 224 | AG848: 1
A849: 13853 | B849: 潜能药剂极限包 | C849: 13003 | D849: 4 | E849: 2 | F849: 3 | G849: 1 | H849: 1 | I849: 10 | J849: 0 | K849: 0 | L849: 0 | N849: 0 | O849: 包含：潜能药剂*358 | P849: 999999 | Q849: 1 | R849: 0 | S849: 0 | T849: 10004 | U849: 358 | V849: =RC[-1] -> 358 | AG849: 1
A850: 13854 | B850: 圣器精炼初级包 | C850: 13000 | D850: 4 | E850: 2 | F850: 3 | G850: 1 | H850: 1 | I850: 10 | J850: 0 | K850: 0 | L850: 0 | N850: 0 | O850: 包含：任选橙品圣器碎片*1、圣器精炼石*45 | P850: 999999 | Q850: 1 | R850: 0 | S850: 0 | T850: 13319|10010 | U850: 1|45 | V850: =RC[-1] -> 1|45 | AG850: 1
A851: 13855 | B851: 圣器精炼低级包 | C851: 13001 | D851: 4 | E851: 2 | F851: 3 | G851: 1 | H851: 1 | I851: 10 | J851: 0 | K851: 0 | L851: 0 | N851: 0 | O851: 包含：任选橙品圣器碎片*2、圣器精炼石*48 | P851: 999999 | Q851: 1 | R851: 0 | S851: 0 | T851: 13319|10010 | U851: 2|48 | V851: =RC[-1] -> 2|48 | AG851: 1
A852: 13856 | B852: 圣器精炼中级包 | C852: 13002 | D852: 4 | E852: 2 | F852: 3 | G852: 1 | H852: 1 | I852: 10 | J852: 0 | K852: 0 | L852: 0 | N852: 0 | O852: 包含：任选橙品圣器碎片*3、圣器精炼石*112 | P852: 999999 | Q852: 1 | R852: 0 | S852: 0 | T852: 13319|10010 | U852: 3|114 | V852: =RC[-1] -> 3|114 | AG852: 1
A853: 13857 | B853: 圣器精炼高级包 | C853: 13002 | D853: 4 | E853: 2 | F853: 3 | G853: 1 | H853: 1 | I853: 10 | J853: 0 | K853: 0 | L853: 0 | N853: 0 | O853: 包含：任选橙品圣器碎片*4、圣器精炼石*186 | P853: 999999 | Q853: 1 | R853: 0 | S853: 0 | T853: 13319|10010 | U853: 4|186 | V853: =RC[-1] -> 4|186 | AG853: 1
A854: 13858 | B854: 圣器精炼超级包 | C854: 13003 | D854: 4 | E854: 2 | F854: 3 | G854: 1 | H854: 1 | I854: 10 | J854: 0 | K854: 0 | L854: 0 | N854: 0 | O854: 包含：任选橙品圣器碎片*6、圣器精炼石*216 | P854: 999999 | Q854: 1 | R854: 0 | S854: 0 | T854: 13319|10010 | U854: 6|216 | V854: =RC[-1] -> 6|216 | AG854: 1
A855: 13859 | B855: 圣器精炼极限包 | C855: 13003 | D855: 4 | E855: 2 | F855: 3 | G855: 1 | H855: 1 | I855: 10 | J855: 0 | K855: 0 | L855: 0 | N855: 0 | O855: 包含：任选橙品圣器碎片*10、圣器精炼石*312 | P855: 999999 | Q855: 1 | R855: 0 | S855: 0 | T855: 13319|10010 | U855: 10|312 | V855: =RC[-1] -> 10|312 | AG855: 1
A856: 13860 | B856: 英雄觉醒初级包 | C856: 13000 | D856: 4 | E856: 2 | F856: 3 | G856: 1 | H856: 1 | I856: 10 | J856: 0 | K856: 0 | L856: 0 | N856: 0 | O856: 包含：普通的觉醒箱*30、觉醒水晶*90 | P856: 999999 | Q856: 1 | R856: 0 | S856: 0 | T856: 13015|10008 | U856: 30|90 | V856: =RC[-1] -> 30|90 | AG856: 1
A857: 13861 | B857: 英雄觉醒低级包 | C857: 13001 | D857: 4 | E857: 2 | F857: 3 | G857: 1 | H857: 1 | I857: 10 | J857: 0 | K857: 0 | L857: 0 | N857: 0 | O857: 包含：普通的觉醒箱*60、觉醒水晶*100 | P857: 999999 | Q857: 1 | R857: 0 | S857: 0 | T857: 13015|10008 | U857: 60|100 | V857: =RC[-1] -> 60|100 | AG857: 1
A858: 13862 | B858: 英雄觉醒中级包 | C858: 13002 | D858: 4 | E858: 2 | F858: 3 | G858: 1 | H858: 1 | I858: 10 | J858: 0 | K858: 0 | L858: 0 | N858: 0 | O858: 包含：精致的觉醒箱*20、觉醒水晶*180 | P858: 999999 | Q858: 1 | R858: 0 | S858: 0 | T858: 13016|10008 | U858: 20|180 | V858: =RC[-1] -> 20|180 | AG858: 1
A859: 13863 | B859: 英雄觉醒高级包 | C859: 13002 | D859: 4 | E859: 2 | F859: 3 | G859: 1 | H859: 1 | I859: 10 | J859: 0 | K859: 0 | L859: 0 | N859: 0 | O859: 包含：精致的觉醒箱*35、觉醒水晶*280 | P859: 999999 | Q859: 1 | R859: 0 | S859: 0 | T859: 13016|10008 | U859: 35|280 | V859: =RC[-1] -> 35|280 | AG859: 1
A860: 13864 | B860: 英雄觉醒超级包 | C860: 13003 | D860: 4 | E860: 2 | F860: 3 | G860: 1 | H860: 1 | I860: 10 | J860: 0 | K860: 0 | L860: 0 | N860: 0 | O860: 包含：精致的觉醒箱*50、觉醒水晶*344 | P860: 999999 | Q860: 1 | R860: 0 | S860: 0 | T860: 13016|10008 | U860: 50|344 | V860: =RC[-1] -> 50|344 | AG860: 1
A861: 13865 | B861: 英雄觉醒极限包 | C861: 13003 | D861: 4 | E861: 2 | F861: 3 | G861: 1 | H861: 1 | I861: 10 | J861: 0 | K861: 0 | L861: 0 | N861: 0 | O861: 包含：精致的觉醒箱*75、觉醒水晶*644 | P861: 999999 | Q861: 1 | R861: 0 | S861: 0 | T861: 13016|10008 | U861: 75|644 | V861: =RC[-1] -> 75|644 | AG861: 1
A862: 13866 | B862: 怒雷咆哮合击组合 | C862: 13030 | D862: 4 | E862: 2 | F862: 3 | G862: 1 | H862: 1 | I862: 10 | J862: 0 | K862: 0 | L862: 0 | N862: 0 | O862: 打开可获得橙品合击英雄：雷神+野蛮巨人 | P862: 999999 | Q862: 1 | R862: 0 | S862: 0 | T862: 30431|30410 | U862: 1|1 | V862: =RC[-1] -> 1|1 | AB862: 2 | AG862: 1 | AH862: 1 | AI862: 1
A863: 13867 | B863: 毁灭电击合击组合 | C863: 13030 | D863: 4 | E863: 2 | F863: 3 | G863: 1 | H863: 1 | I863: 10 | J863: 0 | K863: 0 | L863: 0 | N863: 0 | O863: 打开可获得橙品合击英雄：致命特工+鹰眸 | P863: 999999 | Q863: 1 | R863: 0 | S863: 0 | T863: 30401|30420 | U863: 1|1 | V863: =RC[-1] -> 1|1 | AB863: 2 | AG863: 1 | AH863: 1 | AI863: 1
A864: 13868 | B864: 审判之刃合击组合 | C864: 13030 | D864: 4 | E864: 2 | F864: 3 | G864: 1 | H864: 1 | I864: 10 | J864: 0 | K864: 0 | L864: 0 | N864: 0 | O864: 打开可获得橙品合击英雄：刀锋猎人+地狱骑士 | P864: 999999 | Q864: 1 | R864: 0 | S864: 0 | T864: 30402|30403 | U864: 1|1 | V864: =RC[-1] -> 1|1 | AB864: 2 | AG864: 1 | AH864: 1 | AI864: 1
A865: 13869 | B865: 暗夜杀戮合击组合 | C865: 13030 | D865: 4 | E865: 2 | F865: 3 | G865: 1 | H865: 1 | I865: 10 | J865: 0 | K865: 0 | L865: 0 | N865: 0 | O865: 打开可获得橙品合击英雄：美杜莎+德古拉伯爵 | P865: 999999 | Q865: 1 | R865: 0 | S865: 0 | T865: 31430|31401 | U865: 1|1 | V865: =RC[-1] -> 1|1 | AB865: 2 | AG865: 1 | AH865: 1 | AI865: 1
A866: 13870 | B866: 破碎之月合击组合 | C866: 13030 | D866: 4 | E866: 2 | F866: 3 | G866: 1 | H866: 1 | I866: 10 | J866: 0 | K866: 0 | L866: 0 | N866: 0 | O866: 打开可获得橙品合击英雄：狩猎女神+查理大帝 | P866: 999999 | Q866: 1 | R866: 0 | S866: 0 | T866: 31431|31402 | U866: 1|1 | V866: =RC[-1] -> 1|1 | AB866: 2 | AG866: 1 | AH866: 1 | AI866: 1
A867: 13871 | B867: 沙狐剑影合击组合 | C867: 13030 | D867: 4 | E867: 2 | F867: 3 | G867: 1 | H867: 1 | I867: 10 | J867: 0 | K867: 0 | L867: 0 | N867: 0 | O867: 打开可获得橙品合击英雄：佐罗+亚马逊女王 | P867: 999999 | Q867: 1 | R867: 0 | S867: 0 | T867: 31403|31420 | U867: 1|1 | V867: =RC[-1] -> 1|1 | AB867: 2 | AG867: 1 | AH867: 1 | AI867: 1
A868: 13872 | B868: 烈焰铁蹄合击组合 | C868: 13030 | D868: 4 | E868: 2 | F868: 3 | G868: 1 | H868: 1 | I868: 10 | J868: 0 | K868: 0 | L868: 0 | N868: 0 | O868: 打开可获得橙品合击英雄：牛头人+火女 | P868: 999999 | Q868: 1 | R868: 0 | S868: 0 | T868: 32400|32430 | U868: 1|1 | V868: =RC[-1] -> 1|1 | AB868: 2 | AG868: 1 | AH868: 1 | AI868: 1
A869: 13873 | B869: 战争统帅合击组合 | C869: 13030 | D869: 4 | E869: 2 | F869: 3 | G869: 1 | H869: 1 | I869: 10 | J869: 0 | K869: 0 | L869: 0 | N869: 0 | O869: 打开可获得橙品合击英雄：半人马+食人魔 | P869: 999999 | Q869: 1 | R869: 0 | S869: 0 | T869: 32401|32431 | U869: 1|1 | V869: =RC[-1] -> 1|1 | AB869: 2 | AG869: 1 | AH869: 1 | AI869: 1
A870: 13874 | B870: 绝对正义合击组合 | C870: 13030 | D870: 4 | E870: 2 | F870: 3 | G870: 1 | H870: 1 | I870: 10 | J870: 0 | K870: 0 | L870: 0 | N870: 0 | O870: 打开可获得橙品合击英雄：基伦+女警 | P870: 999999 | Q870: 1 | R870: 0 | S870: 0 | T870: 32402|32420 | U870: 1|1 | V870: =RC[-1] -> 1|1 | AB870: 2 | AG870: 1 | AH870: 1 | AI870: 1
A871: 13875 | B871: 超载光炮合击组合 | C871: 13030 | D871: 4 | E871: 2 | F871: 3 | G871: 1 | H871: 1 | I871: 10 | J871: 0 | K871: 0 | L871: 0 | N871: 0 | O871: 打开可获得橙品合击英雄：铁人+树人 | P871: 999999 | Q871: 1 | R871: 0 | S871: 0 | T871: 30428|30411 | U871: 1|1 | V871: =RC[-1] -> 1|1 | AB871: 2 | AG871: 1 | AH871: 1 | AI871: 1
A872: 13876 | B872: 毁灭能量合击组合 | C872: 13030 | D872: 4 | E872: 2 | F872: 3 | G872: 1 | H872: 1 | I872: 10 | J872: 0 | K872: 0 | L872: 0 | N872: 0 | O872: 打开可获得橙品合击英雄：超凡博士+白凤凰 | P872: 999999 | Q872: 1 | R872: 0 | S872: 0 | T872: 30438|30440 | U872: 1|1 | V872: =RC[-1] -> 1|1 | AB872: 2 | AG872: 1 | AH872: 1 | AI872: 1
A873: 13877 | B873: 神威如狱合击组合 | C873: 13030 | D873: 4 | E873: 2 | F873: 3 | G873: 1 | H873: 1 | I873: 10 | J873: 0 | K873: 0 | L873: 0 | N873: 0 | O873: 打开可获得橙品合击英雄：宙斯+斯巴达 | P873: 999999 | Q873: 1 | R873: 0 | S873: 0 | T873: 31438|31410 | U873: 1|1 | V873: =RC[-1] -> 1|1 | AB873: 2 | AG873: 1 | AH873: 1 | AI873: 1
A874: 13878 | B874: 光辉葬刀合击组合 | C874: 13030 | D874: 4 | E874: 2 | F874: 3 | G874: 1 | H874: 1 | I874: 10 | J874: 0 | K874: 0 | L874: 0 | N874: 0 | O874: 打开可获得橙品合击英雄：阿努比斯+雅典娜 | P874: 999999 | Q874: 1 | R874: 0 | S874: 0 | T874: 31408|31441 | U874: 1|1 | V874: =RC[-1] -> 1|1 | AB874: 2 | AG874: 1 | AH874: 1 | AI874: 1
A875: 13879 | B875: 竹林暗矢合击组合 | C875: 13030 | D875: 4 | E875: 2 | F875: 3 | G875: 1 | H875: 1 | I875: 10 | J875: 0 | K875: 0 | L875: 0 | N875: 0 | O875: 打开可获得橙品合击英雄：小黑+熊阿宝 | P875: 999999 | Q875: 1 | R875: 0 | S875: 0 | T875: 32428|32412 | U875: 1|1 | V875: =RC[-1] -> 1|1 | AB875: 2 | AG875: 1 | AH875: 1 | AI875: 1
A876: 13880 | B876: 血色光辉合击组合 | C876: 13030 | D876: 4 | E876: 2 | F876: 3 | G876: 1 | H876: 1 | I876: 10 | J876: 0 | K876: 0 | L876: 0 | N876: 0 | O876: 打开可获得橙品合击英雄：血色指挥官+大检察官 | P876: 999999 | Q876: 1 | R876: 0 | S876: 0 | T876: 32408|32440 | U876: 1|1 | V876: =RC[-1] -> 1|1 | AB876: 2 | AG876: 1 | AH876: 1 | AI876: 1
A877: 13881 | B877: 核心英雄特惠礼包 | C877: 13005 | D877: 4 | E877: 2 | F877: 3 | G877: 1 | H877: 1 | I877: 10 | J877: 0 | K877: 0 | L877: 0 | N877: 0 | O877: 包含：核心英雄6选1*1、橙品传承核心*3、进阶石*100 | P877: 999999 | Q877: 1 | R877: 0 | S877: 0 | T877: 13434|33400|10002 | U877: 1|3|100 | V877: =RC[-1] -> 1|3|100 | AB877: 3 | AG877: 1 | AH877: 1 | AI877: 1
A878: 13882 | B878: 控场英雄特惠礼包 | C878: 13005 | D878: 4 | E878: 2 | F878: 3 | G878: 1 | H878: 1 | I878: 10 | J878: 0 | K878: 0 | L878: 0 | N878: 0 | O878: 包含：最强控场英雄3选1*1、橙品传承核心*3、进阶石*100 | P878: 999999 | Q878: 1 | R878: 0 | S878: 0 | T878: 13425|33400|10002 | U878: 1|3|100 | V878: =RC[-1] -> 1|3|100 | AB878: 3 | AG878: 1 | AH878: 1 | AI878: 1
A879: 13883 | B879: 控场搭档特惠礼包 | C879: 13005 | D879: 4 | E879: 2 | F879: 3 | G879: 1 | H879: 1 | I879: 10 | J879: 0 | K879: 0 | L879: 0 | N879: 0 | O879: 包含：控场合击配合英雄3选1*1、橙品传承核心*3、进阶石*100 | P879: 999999 | Q879: 1 | R879: 0 | S879: 0 | T879: 13426|33400|10002 | U879: 1|3|100 | V879: =RC[-1] -> 1|3|100 | AB879: 3 | AG879: 1 | AH879: 1 | AI879: 1
A880: 13884 | B880: 最佳搭档特惠礼包 | C880: 13005 | D880: 4 | E880: 2 | F880: 3 | G880: 1 | H880: 1 | I880: 10 | J880: 0 | K880: 0 | L880: 0 | N880: 0 | O880: 包含：红品英雄合击配合3选1*1、橙品传承核心*3、进阶石*100 | P880: 999999 | Q880: 1 | R880: 0 | S880: 0 | T880: 13419|33400|10002 | U880: 1|3|100 | V880: =RC[-1] -> 1|3|100 | AB880: 3 | AG880: 1 | AH880: 1 | AI880: 1
A881: 13885 | B881: 青鸟特惠大礼包 | C881: 13005 | D881: 4 | E881: 2 | F881: 3 | G881: 1 | H881: 1 | I881: 10 | J881: 0 | K881: 0 | L881: 0 | N881: 0 | O881: 包含：任选青鸟套部件*1、橙品精炼石*188、金币*100W | P881: 999999 | Q881: 1 | R881: 0 | S881: 0 | T881: 13388|10014|19103 | U881: 1|188|100 | V881: =RC[-1] -> 1|188|100 | AG881: 1 | AH881: 1 | AI881: 1
A882: 13886 | B882: 圣器特惠礼包 | C882: 13040 | D882: 4 | E882: 2 | F882: 3 | G882: 1 | H882: 1 | I882: 10 | J882: 0 | K882: 0 | L882: 0 | N882: 0 | O882: 包含：任选橙品圣器*1、精力药剂*4 | P882: 999999 | Q882: 1 | R882: 0 | S882: 0 | T882: 13316|10001 | U882: 1|4 | V882: =RC[-1] -> 1|4 | AG882: 1 | AH882: 1 | AI882: 1
A883: 13887 | B883: 圣器升级特惠礼包 | C883: 42301 | D883: 3 | E883: 2 | F883: 3 | G883: 1 | H883: 1 | I883: 10 | J883: 0 | K883: 0 | L883: 0 | N883: 0 | O883: 包含：紫水晶*5 | P883: 999999 | Q883: 1 | R883: 0 | S883: 0 | T883: 42301 | U883: 5 | V883: =RC[-1] -> 5 | AD883: 5 | AG883: 1 | AH883: 1 | AI883: 1
A884: 13888 | B884: 灵性精粹特惠礼包 | C884: 10022 | D884: 4 | E884: 2 | F884: 3 | G884: 1 | H884: 1 | I884: 10 | J884: 0 | K884: 0 | L884: 0 | N884: 0 | O884: 包含：灵性精粹*100 | P884: 999999 | Q884: 1 | R884: 0 | S884: 0 | T884: 10022 | U884: 100 | V884: =RC[-1] -> 100 | AG884: 1 | AH884: 1 | AI884: 1
A885: 13889 | B885: 培养石特惠礼包 | C885: 10003 | D885: 4 | E885: 2 | F885: 3 | G885: 1 | H885: 1 | I885: 10 | J885: 0 | K885: 0 | L885: 0 | N885: 0 | O885: 包含：培养石*1000 | P885: 999999 | Q885: 1 | R885: 0 | S885: 0 | T885: 10003 | U885: 1000 | V885: =RC[-1] -> 1000 | AG885: 1 | AH885: 1 | AI885: 1
A886: 13890 | B886: 精灵升华特惠礼包 | C886: 13008 | D886: 4 | E886: 2 | F886: 3 | G886: 1 | H886: 1 | I886: 10 | J886: 0 | K886: 0 | L886: 0 | N886: 0 | O886: 包含：任选精灵升华道具*1、无尽石*688 | P886: 999999 | Q886: 1 | R886: 0 | S886: 0 | T886: 13324|19028 | U886: 1|688 | V886: =RC[-1] -> 1|688 | AG886: 1 | AH886: 1 | AI886: 1
A887: 13891 | B887: 精灵培养特惠礼包 | C887: 13012 | D887: 4 | E887: 2 | F887: 3 | G887: 1 | H887: 1 | I887: 10 | J887: 0 | K887: 0 | L887: 0 | N887: 0 | O887: 包含：生命灵泉、烈焰灵泉、大地灵泉、寒冰灵泉每种各888个 | P887: 999999 | Q887: 1 | R887: 0 | S887: 0 | T887: 10030|10031|10032|10033 | U887: 888|888|888|888 | V887: =RC[-1] -> 888|888|888|888 | AG887: 1 | AH887: 1 | AI887: 1
A888: 13892 | B888: 25资英雄特惠礼包 | C888: 13030 | D888: 4 | E888: 2 | F888: 3 | G888: 1 | H888: 1 | I888: 10 | J888: 0 | K888: 0 | L888: 0 | N888: 0 | O888: 包含：25资任选英雄*1、橙品传承核心*5 | P888: 999999 | Q888: 1 | R888: 0 | S888: 0 | T888: 13379|33400 | U888: 1|5 | V888: =RC[-1] -> 1|5 | AB888: 5 | AG888: 1 | AH888: 1 | AI888: 1
A889: 13893 | B889: 橙装特惠大礼包 | C889: 13020 | D889: 4 | E889: 2 | F889: 3 | G889: 1 | H889: 1 | I889: 10 | J889: 0 | K889: 0 | L889: 0 | N889: 0 | O889: 包含：任选橙装*1、橙品精炼石*268、金币*100W | P889: 999999 | Q889: 1 | R889: 0 | S889: 0 | T889: 13336|10014|19103 | U889: 1|268|100 | V889: =RC[-1] -> 1|268|100 | AG889: 1 | AH889: 1 | AI889: 1
A890: 13894 | B890: 深海礼包 | C890: 13005 | D890: 4 | E890: 2 | F890: 3 | G890: 1 | H890: 1 | I890: 10 | J890: 0 | K890: 0 | L890: 0 | N890: 0 | O890: 包含：灵性精粹*50、灵泉各500、培养石*200 | P890: 999999 | Q890: 1 | R890: 0 | S890: 0 | T890: 10022|13646|10003 | U890: 50|50|200 | V890: =RC[-1] -> 50|50|200 | AG890: 1 | AH890: 1 | AI890: 1
A891: 13895 | B891: 深海大礼包 | C891: 13005 | D891: 4 | E891: 2 | F891: 3 | G891: 1 | H891: 1 | I891: 10 | J891: 0 | K891: 0 | L891: 0 | N891: 0 | O891: 包含：灵性精粹*80、灵泉各500、紫水晶*8 | P891: 999999 | Q891: 1 | R891: 0 | S891: 0 | T891: 10022|13646|42301 | U891: 80|50|8 | V891: =RC[-1] -> 80|50|8 | AG891: 1 | AH891: 1 | AI891: 1
A892: 13896 | B892: 深海豪华礼包 | C892: 13005 | D892: 4 | E892: 2 | F892: 3 | G892: 1 | H892: 1 | I892: 10 | J892: 0 | K892: 0 | L892: 1 | N892: 0 | O892: 包含：灵性精粹*120、灵泉各500、橙品精炼石*100 | P892: 999999 | Q892: 1 | R892: 0 | S892: 0 | T892: 10022|13646|10014 | U892: 120|50|100 | V892: =RC[-1] -> 120|50|100 | AG892: 1 | AH892: 1 | AI892: 1
A893: 13897 | B893: 深海女王升星礼包 | C893: 13005 | D893: 4 | E893: 2 | F893: 3 | G893: 1 | H893: 1 | I893: 10 | J893: 0 | K893: 0 | L893: 1 | N893: 0 | O893: 包含：深海女王碎片*30（1星）、深海之泪*5、灵性精粹*150 | P893: 999999 | Q893: 1 | R893: 0 | S893: 0 | T893: 15012|10036|10022 | U893: 30|5|150 | V893: =RC[-1] -> 30|5|150 | AG893: 1 | AH893: 1 | AI893: 1
A894: 13898 | B894: 大地礼包 | C894: 13005 | D894: 4 | E894: 2 | F894: 3 | G894: 1 | H894: 1 | I894: 10 | J894: 0 | K894: 0 | L894: 0 | N894: 0 | O894: 包含：灵性精粹*60、灵泉各500、培养石*300 | P894: 999999 | Q894: 1 | R894: 0 | S894: 0 | T894: 10022|13646|10003 | U894: 60|50|300 | V894: =RC[-1] -> 60|50|300 | AG894: 1 | AH894: 1 | AI894: 1
A895: 13899 | B895: 大地大礼包 | C895: 13005 | D895: 4 | E895: 2 | F895: 3 | G895: 1 | H895: 1 | I895: 10 | J895: 0 | K895: 0 | L895: 0 | N895: 0 | O895: 包含：灵性精粹*90、灵泉各500、紫水晶*12 | P895: 999999 | Q895: 1 | R895: 0 | S895: 0 | T895: 10022|13646|42301 | U895: 90|50|12 | V895: =RC[-1] -> 90|50|12 | AG895: 1 | AH895: 1 | AI895: 1
A896: 13900 | B896: 大地豪华礼包 | C896: 13005 | D896: 4 | E896: 2 | F896: 3 | G896: 1 | H896: 1 | I896: 10 | J896: 0 | K896: 0 | L896: 1 | N896: 0 | O896: 包含：灵性精粹*150、灵泉各500、橙品精炼石*120 | P896: 999999 | Q896: 1 | R896: 0 | S896: 0 | T896: 10022|13646|10014 | U896: 150|50|120 | V896: =RC[-1] -> 150|50|120 | AG896: 1 | AH896: 1 | AI896: 1
A897: 13901 | B897: 大地之子升星礼包 | C897: 13005 | D897: 4 | E897: 2 | F897: 3 | G897: 1 | H897: 1 | I897: 10 | J897: 0 | K897: 0 | L897: 1 | N897: 0 | O897: 包含：大地之子碎片*30（1星）、大地核心*5、灵性精粹*200 | P897: 999999 | Q897: 1 | R897: 0 | S897: 0 | T897: 15022|10039|10022 | U897: 30|5|200 | V897: =RC[-1] -> 30|5|200 | AG897: 1 | AH897: 1 | AI897: 1
A898: 13902 | B898: 25资英雄觉醒礼包 | C898: 13030 | D898: 4 | E898: 2 | F898: 3 | G898: 1 | H898: 1 | I898: 10 | J898: 0 | K898: 0 | L898: 0 | N898: 0 | O898: 包含：25资任选英雄*1、精致的觉醒宝箱*50 | P898: 999999 | Q898: 1 | R898: 0 | S898: 0 | T898: 13379|13016 | U898: 1|50 | V898: =RC[-1] -> 1|50 | AG898: 1 | AH898: 1 | AI898: 1
A899: 13903 | B899: 精灵升华超值礼包 | C899: 13008 | D899: 4 | E899: 2 | F899: 3 | G899: 1 | H899: 1 | I899: 10 | J899: 0 | K899: 0 | L899: 0 | N899: 0 | O899: 包含：任选精灵升华道具*1、无尽石*1688 | P899: 999999 | Q899: 1 | R899: 0 | S899: 0 | T899: 13324|19028 | U899: 1|1688 | V899: =RC[-1] -> 1|1688 | AG899: 1 | AH899: 1 | AI899: 1
A900: 13904 | B900: 精灵培养超值礼包 | C900: 13012 | D900: 4 | E900: 2 | F900: 3 | G900: 1 | H900: 1 | I900: 10 | J900: 0 | K900: 0 | L900: 0 | N900: 0 | O900: 包含：生命灵泉、烈焰灵泉、大地灵泉、寒冰灵泉每种各1288个 | P900: 999999 | Q900: 1 | R900: 0 | S900: 0 | T900: 10030|10031|10032|10033 | U900: 1288|1288|1288|1288 | V900: =RC[-1] -> 1288|1288|1288|1288 | AG900: 1 | AH900: 1 | AI900: 1
A901: 13905 | B901: 冰与火之歌超值礼包 | C901: 13005 | D901: 4 | E901: 2 | F901: 3 | G901: 1 | H901: 1 | I901: 10 | J901: 0 | K901: 0 | L901: 0 | N901: 0 | O901: 包含：冰与火之歌碎片箱*30、闪光的觉醒箱*15 | P901: 999999 | Q901: 1 | R901: 0 | S901: 0 | T901: 13359|13017 | U901: 30|15 | V901: =RC[-1] -> 30|15 | AG901: 1 | AH901: 1 | AI901: 1
A902: 13906 | B902: 顶级圣器超值礼包 | C902: 13040 | D902: 5 | E902: 2 | F902: 3 | G902: 1 | H902: 1 | I902: 10 | J902: 0 | K902: 0 | L902: 0 | N902: 0 | O902: 包含：任选顶级圣器*1、紫水晶*50、圣器精炼石*1000 | P902: 999999 | Q902: 1 | R902: 0 | S902: 0 | T902: 13392|42301|10010 | U902: 1|50|1000 | V902: =RC[-1] -> 1|50|1000 | AD902: 50 | AG902: 1 | AH902: 1 | AI902: 1
A903: 13907 | B903: 宿命的占卜宝箱 | C903: 13003 | D903: 4 | E903: 2 | F903: 3 | G903: 1 | H903: 1 | I903: 10 | J903: 0 | K903: 0 | L903: 0 | N903: 0 | O903: 包含：红品英雄宿命卡牌*1、愚者的喜悦*5、星魂*100 | P903: 999999 | Q903: 50 | R903: 0 | S903: 0 | T903: 13471|70300|19032 | U903: 1|5|100 | V903: =RC[-1] -> 1|5|100 | AE903: 5 | AG903: 1 | AH903: 1 | AI903: 1
A904: 13908 | B904: 宿命的占卜礼盒 | C904: 13005 | D904: 4 | E904: 2 | F904: 3 | G904: 1 | H904: 1 | I904: 10 | J904: 0 | K904: 0 | L904: 0 | N904: 0 | O904: 包含：核心英雄宿命卡牌*1、占星水晶*2、星魂*100 | P904: 999999 | Q904: 50 | R904: 0 | S904: 0 | T904: 13481|10096|19032 | U904: 1|2|100 | V904: =RC[-1] -> 1|2|100 | AG904: 1 | AH904: 1 | AI904: 1
A905: 13909 | B905: 占星礼包 | C905: 13002 | D905: 4 | E905: 2 | F905: 3 | G905: 1 | H905: 1 | I905: 10 | J905: 0 | K905: 0 | L905: 0 | N905: 0 | O905: 包含：占星水晶*10、星魂*200 | P905: 999999 | Q905: 50 | R905: 0 | S905: 0 | T905: 10096|19032 | U905: 10|200 | V905: =RC[-1] -> 10|200 | AG905: 1 | AH905: 1 | AI905: 1
A906: 13910 | B906: 星徽礼包 | C906: 13002 | D906: 4 | E906: 2 | F906: 3 | G906: 1 | H906: 1 | I906: 10 | J906: 0 | K906: 0 | L906: 0 | N906: 0 | O906: 包含：预言星徽*20、星魂*200 | P906: 999999 | Q906: 50 | R906: 0 | S906: 0 | T906: 10009|19032 | U906: 20|200 | V906: =RC[-1] -> 20|200 | AG906: 1 | AH906: 1 | AI906: 1
A907: 13911 | B907: 升阶礼包 | C907: 13002 | D907: 4 | E907: 2 | F907: 3 | G907: 1 | H907: 1 | I907: 10 | J907: 0 | K907: 0 | L907: 0 | N907: 0 | O907: 包含：愚者的喜悦*5、预言星辉*3、星魂*200 | P907: 999999 | Q907: 50 | R907: 0 | S907: 0 | T907: 70300|10009|19032 | U907: 5|3|200 | V907: =RC[-1] -> 5|3|200 | AE907: 5 | AG907: 1 | AH907: 1 | AI907: 1
A908: 13912 | B908: 随机礼包 | C908: 13002 | D908: 4 | E908: 2 | F908: 3 | G908: 1 | H908: 1 | I908: 10 | J908: 0 | K908: 0 | L908: 0 | N908: 0 | O908: 包含：随机橙品卡牌*1、随机紫品卡牌*1 | P908: 999999 | Q908: 50 | R908: 0 | S908: 0 | T908: 13057|13056 | U908: 1|1 | V908: =RC[-1] -> 1|1 | AG908: 1 | AH908: 1 | AI908: 1
A909: 13913 | B909: 宿命的占卜福袋 | C909: 13004 | D909: 4 | E909: 2 | F909: 3 | G909: 1 | H909: 1 | I909: 10 | J909: 0 | K909: 0 | L909: 0 | N909: 0 | O909: 包含：25资合击英雄宿命卡牌*1、预言星徽*5、星魂*100 | P909: 999999 | Q909: 50 | R909: 0 | S909: 0 | T909: 13491|10009|19032 | U909: 1|5|100 | V909: =RC[-1] -> 1|5|100 | AG909: 1 | AH909: 1 | AI909: 1
A910: 13914 | B910: 豪华升阶礼包 | C910: 13003 | D910: 4 | E910: 2 | F910: 3 | G910: 1 | H910: 1 | I910: 10 | J910: 0 | K910: 0 | L910: 0 | N910: 0 | O910: 包含：愚者的喜悦*100、预言星辉*60、星魂*4000 | P910: 999999 | Q910: 50 | R910: 0 | S910: 0 | T910: 70300|10009|19032 | U910: 100|60|4000 | V910: =RC[-1] -> 100|60|4000 | AE910: 100 | AG910: 1 | AH910: 1 | AI910: 1
A911: 13993 | B911: GM卡牌礼包 | C911: 13003 | D911: 5 | E911: 2 | F911: 3 | G911: 1 | H911: 1 | I911: 10 | J911: 0 | K911: 0 | L911: 0 | N911: 0 | O911: 我一直在寻找，有你的世界~哔卟哔卟~ | P911: 999999 | Q911: 1 | R911: 0 | S911: 0 | T911: 70425|70424|70423|70422|70421|70420|70419|70418|70417|70416|70415|70414|70413|70412|70411|70410|70409|70408|70407|70406|70405|70404|70403|70402|70401|70400|70325|70324|70323|70322|70321|70320|70319|70318|70317|70316|70315|70314|70313|70312|70311|70310|70309|70308|70307|70306|70305|70304|70303|70302|70301|70300|70225|70224|70223|70222|70221|70220|70219|70218|70217|70216|70215|70214|70213|70212|70211|70210|70209|70208|70207|70206|70205|70204|70203|70202|70201|70200|70125|70124|70123|70122|70100|70025|70024|70023|70022|70000 | U911: 1|1|1|1|1|1|1|1|1|1|1|1|1|1|1|1|1|1|1|1|1|1|1|1|1|20|1|1|1|1|1|1|1|1|1|1|1|1|1|1|1|1|1|1|1|1|1|1|1|1|1|50|1|1|1|1|1|1|1|1|1|1|1|1|1|1|1|1|1|1|1|1|1|1|1|1|1|1|1|1|1|1|20|1|1|1|1|10 | V911: =RC[-1] -> 1|1|1|1|1|1|1|1|1|1|1|1|1|1|1|1|1|1|1|1|1|1|1|1|1|20|1|1|1|1|1|1|1|1|1|1|1|1|1|1|1|1|1|1|1|1|1|1|1|1|1|50|1|1|1|1|1|1|1|1|1|1|1|1|1|1|1|1|1|1|1|1|1|1|1|1|1|1|1|1|1|1|20|1|1|1|1|10
A912: 13994 | B912: GM装备礼包 | C912: 13003 | D912: 5 | E912: 2 | F912: 3 | G912: 1 | H912: 1 | I912: 10 | J912: 0 | K912: 0 | L912: 0 | N912: 0 | O912: 我一直在寻找，有你的世界~哔卟哔卟~ | P912: 999999 | Q912: 1 | R912: 0 | S912: 0 | T912: 20599|21599|22599|23599 | U912: 5|5|5|5 | V912: =RC[-1] -> 5|5|5|5
A913: 13995 | B913: 觉醒水晶礼包 | C913: 13000 | D913: 5 | E913: 2 | F913: 3 | G913: 1 | H913: 1 | I913: 10 | J913: 0 | K913: 0 | L913: 0 | N913: 0 | O913: 觉醒一个英雄满需要2个礼包。 | P913: 999999 | Q913: 1 | R913: 0 | S913: 0 | T913: 10008 | U913: 42300 | V913: =RC[-1] -> 42300
A914: 13996 | B914: GM觉醒礼包 | C914: 13000 | D914: 5 | E914: 2 | F914: 3 | G914: 1 | H914: 1 | I914: 10 | J914: 0 | K914: 0 | L914: 0 | N914: 0 | O914: 觉醒一个英雄满所需的所有材料。 | P914: 999999 | Q914: 1 | R914: 0 | S914: 0 | T914: 60001|60002|60101|60102|60201|60202|60301|60302|60401|60402|60501|60502|61001|61002|61101|61102|61201|61202|61301|61302|61401|61402|61501|61502|62001|62002|62101|62102|62201|62202|62301|62302|62401|62402|62501|62502|63001|63002|63101|63102|63201|63202|63301|63302|63401|63402|63501|63502 | U914: 3|3|5|5|5|5|5|5|2|2|3|3|5|5|5|5|5|5|2|2|3|3|5|5|5|5|5|5|2|2|3|3|5|5|5|5|5|5|2|2 | V914: =RC[-1] -> 3|3|5|5|5|5|5|5|2|2|3|3|5|5|5|5|5|5|2|2|3|3|5|5|5|5|5|5|2|2|3|3|5|5|5|5|5|5|2|2
A915: 13997 | B915: 装备架子 | C915: 13000 | D915: 5 | E915: 2 | F915: 3 | G915: 1 | H915: 1 | I915: 10 | J915: 0 | K915: 0 | L915: 0 | N915: 0 | O915: 你猜。 | P915: 999999 | Q915: 1 | R915: 0 | S915: 0 | T915: 20101|20102|20201|20202|20301|20302|20303|20304|20401|20402|20403|20404|20501|20502|21101|21102|21201|21202|21301|21302|21303|21304|21401|21402|21403|21404|21501|21502|22101|22102|22201|22202|22301|22302|22303|22304|22401|22402|22403|22404|22501|22502|23101|23102|23201|23202|23301|23302|23303|23304|23401|23402|23403|23404|23501|23502 | U915: 1|1|1|1|1|1|1|1|1|1|1|1|1|1|1|1|1|1|1|1|1|1|1|1|1|1|1|1|1|1|1|1|1|1|1|1|1|1|1|1|1|1|1|1|1|1|1|1|1|1|1|1|1|1|1|1 | V915: =RC[-1] -> 1|1|1|1|1|1|1|1|1|1|1|1|1|1|1|1|1|1|1|1|1|1|1|1|1|1|1|1|1|1|1|1|1|1|1|1|1|1|1|1|1|1|1|1|1|1|1|1|1|1|1|1|1|1|1|1
A916: 13998 | B916: 假的GM礼包 | C916: 13000 | D916: 5 | E916: 2 | F916: 3 | G916: 1 | H916: 1 | I916: 10 | J916: 0 | K916: 0 | L916: 0 | N916: 0 | O916: 你猜。 | P916: 999999 | Q916: 1 | R916: 0 | S916: 0 | T916: 30200|30210|30220|30230|30240|31200|31210|31220|31230|31240|32200|32210|32220|32230|32240 | U916: 1|1|1|1|1|1|1|1|1|1|1|1|1|1|1 | V916: =RC[-1] -> 1|1|1|1|1|1|1|1|1|1|1|1|1|1|1
A917: 13999 | B917: GM礼包 | C917: 13001 | D917: 5 | E917: 2 | F917: 3 | G917: 1 | H917: 1 | I917: 10 | J917: 0 | K917: 0 | L917: 0 | N917: 0 | O917: 你猜。 | P917: 999999 | Q917: 1 | R917: 0 | S917: 0 | T917: 30300|30310|30320|30330|30340|30301|30302|30430|30400|30431|30410|30401|30420|30402|30403|30428|30411|30438|30440|30429|30449|30520|30500|31300|31310|31320|31330|31340|31301|31341|31400|31440|31430|31401|31431|31402|31403|31420|31438|31410|31408|31441|31419|31439|31530|31500|32300|32310|32320|32330|32340|32311|32341|32410|32411|32400|32430|32401|32431|32402|32420|32428|32412|32408|32440|32409|32449|32500|32510|39999|20401|20402|20403|20404|21401|21402|21403|21404|22401|22402|22403|22404|23401|23402|23403|23404|40401|40402|40403|40404|41401|41402|41403|41404|10018|10019|10020|10021|10002|10003|10004|10000|10001 | U917: 1|1|1|1|1|1|1|1|1|1|1|1|1|1|1|1|1|1|1|1|1|1|1|1|1|1|1|1|1|1|1|1|1|1|1|1|1|1|1|1|1|1|1|1|1|1|1|1|1|1|1|1|1|1|1|1|1|1|1|1|1|1|1|1|1|1|1|1|1|1|2|2|2|2|2|2|2|2|2|2|2|2|2|2|2|2|3|3|3|3|3|3|3|3|100|100|1000|1000|10000|10000|10000|1000|1000 | V917: =RC[-1] -> 1|1|1|1|1|1|1|1|1|1|1|1|1|1|1|1|1|1|1|1|1|1|1|1|1|1|1|1|1|1|1|1|1|1|1|1|1|1|1|1|1|1|1|1|1|1|1|1|1|1|1|1|1|1|1|1|1|1|1|1|1|1|1|1|1|1|1|1|1|1|2|2|2|2|2|2|2|2|2|2|2|2|2|2|2|2|3|3|3|3|3|3|3|3|100|100|1000|1000|10000|10000|10000|1000|1000
A918: 14201 | B918: 激励符文碎片1 | C918: 40201 | D918: =MID(RC[-3],3,1) -> 2 | E918: 1 | F918: 13 | G918: 0 | H918: 1 | I918: 10 | J918: 0 | K918: 0 | L918: 0 | N918: 40201 | O918: 符文被击碎后遗留的碎片，集齐3种碎片可以合成符文：激励符文。 | P918: 999999 | Q918: 1 | R918: 0 | S918: 0 | X918: 19 | AA918: 1
A919: 14202 | B919: 激励符文碎片2 | C919: 40201 | D919: =MID(RC[-3],3,1) -> 2 | E919: 1 | F919: 13 | G919: 0 | H919: 1 | I919: 10 | J919: 0 | K919: 0 | L919: 0 | N919: 40201 | O919: 符文被击碎后遗留的碎片，集齐3种碎片可以合成符文：激励符文。 | P919: 999999 | Q919: 1 | R919: 0 | S919: 0 | X919: 19 | AA919: 1
A920: 14203 | B920: 激励符文碎片3 | C920: 40201 | D920: =MID(RC[-3],3,1) -> 2 | E920: 1 | F920: 13 | G920: 0 | H920: 1 | I920: 10 | J920: 0 | K920: 0 | L920: 0 | N920: 40201 | O920: 符文被击碎后遗留的碎片，集齐3种碎片可以合成符文：激励符文。 | P920: 999999 | Q920: 1 | R920: 0 | S920: 0 | X920: 19 | AA920: 1
A921: 14204 | B921: 沙尘徽章碎片1 | C921: 41201 | D921: =MID(RC[-3],3,1) -> 2 | E921: 1 | F921: 13 | G921: 0 | H921: 1 | I921: 10 | J921: 0 | K921: 0 | L921: 0 | N921: 41201 | O921: 徽章被击碎后遗留的碎片，集齐3种碎片可以合成徽章：沙尘徽章。 | P921: 999999 | Q921: 1 | R921: 0 | S921: 0 | X921: 19 | AA921: 1
A922: 14205 | B922: 沙尘徽章碎片2 | C922: 41201 | D922: =MID(RC[-3],3,1) -> 2 | E922: 1 | F922: 13 | G922: 0 | H922: 1 | I922: 10 | J922: 0 | K922: 0 | L922: 0 | N922: 41201 | O922: 徽章被击碎后遗留的碎片，集齐3种碎片可以合成徽章：沙尘徽章。 | P922: 999999 | Q922: 1 | R922: 0 | S922: 0 | X922: 19 | AA922: 1
A923: 14206 | B923: 沙尘徽章碎片3 | C923: 41201 | D923: =MID(RC[-3],3,1) -> 2 | E923: 1 | F923: 13 | G923: 0 | H923: 1 | I923: 10 | J923: 0 | K923: 0 | L923: 0 | N923: 41201 | O923: 徽章被击碎后遗留的碎片，集齐3种碎片可以合成徽章：沙尘徽章。 | P923: 999999 | Q923: 1 | R923: 0 | S923: 0 | X923: 19 | AA923: 1
A924: 14207 | B924: 蓝水晶碎片1 | C924: 42201 | D924: =MID(RC[-3],3,1) -> 2 | E924: 1 | F924: 13 | G924: 0 | H924: 1 | I924: 10 | J924: 0 | K924: 0 | L924: 0 | N924: 42201 | O924: 蓝水晶被击碎后遗留的碎片，集齐3种碎片可以合成圣器：蓝水晶。 | P924: 999999 | Q924: 1 | R924: 0 | S924: 0 | X924: 19 | AA924: 1
A925: 14208 | B925: 蓝水晶碎片2 | C925: 42201 | D925: =MID(RC[-3],3,1) -> 2 | E925: 1 | F925: 13 | G925: 0 | H925: 1 | I925: 10 | J925: 0 | K925: 0 | L925: 0 | N925: 42201 | O925: 蓝水晶被击碎后遗留的碎片，集齐3种碎片可以合成圣器：蓝水晶。 | P925: 999999 | Q925: 1 | R925: 0 | S925: 0 | X925: 19 | AA925: 1
A926: 14209 | B926: 蓝水晶碎片3 | C926: 42201 | D926: =MID(RC[-3],3,1) -> 2 | E926: 1 | F926: 13 | G926: 0 | H926: 1 | I926: 10 | J926: 0 | K926: 0 | L926: 0 | N926: 42201 | O926: 蓝水晶被击碎后遗留的碎片，集齐3种碎片可以合成圣器：蓝水晶。 | P926: 999999 | Q926: 1 | R926: 0 | S926: 0 | X926: 19 | AA926: 1
A927: 14301 | B927: 英勇符文碎片1 | C927: 40301 | D927: =MID(RC[-3],3,1) -> 3 | E927: 1 | F927: 13 | G927: 0 | H927: 1 | I927: 10 | J927: 0 | K927: 0 | L927: 0 | N927: 40301 | O927: 符文被击碎后遗留的碎片，集齐4种碎片可以合成符文：英勇符文。 | P927: 999999 | Q927: 1 | R927: 0 | S927: 0 | X927: 19 | AA927: 1
A928: 14302 | B928: 英勇符文碎片2 | C928: 40301 | D928: =MID(RC[-3],3,1) -> 3 | E928: 1 | F928: 13 | G928: 0 | H928: 1 | I928: 10 | J928: 0 | K928: 0 | L928: 0 | N928: 40301 | O928: 符文被击碎后遗留的碎片，集齐4种碎片可以合成符文：英勇符文。 | P928: 999999 | Q928: 1 | R928: 0 | S928: 0 | X928: 19 | AA928: 1
A929: 14303 | B929: 英勇符文碎片3 | C929: 40301 | D929: =MID(RC[-3],3,1) -> 3 | E929: 1 | F929: 13 | G929: 0 | H929: 1 | I929: 10 | J929: 0 | K929: 0 | L929: 0 | N929: 40301 | O929: 符文被击碎后遗留的碎片，集齐4种碎片可以合成符文：英勇符文。 | P929: 999999 | Q929: 1 | R929: 0 | S929: 0 | X929: 19 | AA929: 1
A930: 14304 | B930: 英勇符文碎片4 | C930: 40301 | D930: =MID(RC[-3],3,1) -> 3 | E930: 1 | F930: 13 | G930: 0 | H930: 1 | I930: 10 | J930: 0 | K930: 0 | L930: 0 | N930: 40301 | O930: 符文被击碎后遗留的碎片，集齐4种碎片可以合成符文：英勇符文。 | P930: 999999 | Q930: 1 | R930: 0 | S930: 0 | X930: 19 | AA930: 1
A931: 14305 | B931: 愤怒符文碎片1 | C931: 40302 | D931: =MID(RC[-3],3,1) -> 3 | E931: 1 | F931: 13 | G931: 0 | H931: 1 | I931: 10 | J931: 0 | K931: 0 | L931: 0 | N931: 40302 | O931: 符文被击碎后遗留的碎片，集齐4种碎片可以合成符文：愤怒符文。 | P931: 999999 | Q931: 1 | R931: 0 | S931: 0 | X931: 19 | AA931: 1
A932: 14306 | B932: 愤怒符文碎片2 | C932: 40302 | D932: =MID(RC[-3],3,1) -> 3 | E932: 1 | F932: 13 | G932: 0 | H932: 1 | I932: 10 | J932: 0 | K932: 0 | L932: 0 | N932: 40302 | O932: 符文被击碎后遗留的碎片，集齐4种碎片可以合成符文：愤怒符文。 | P932: 999999 | Q932: 1 | R932: 0 | S932: 0 | X932: 19 | AA932: 1
A933: 14307 | B933: 愤怒符文碎片3 | C933: 40302 | D933: =MID(RC[-3],3,1) -> 3 | E933: 1 | F933: 13 | G933: 0 | H933: 1 | I933: 10 | J933: 0 | K933: 0 | L933: 0 | N933: 40302 | O933: 符文被击碎后遗留的碎片，集齐4种碎片可以合成符文：愤怒符文。 | P933: 999999 | Q933: 1 | R933: 0 | S933: 0 | X933: 19 | AA933: 1
A934: 14308 | B934: 愤怒符文碎片4 | C934: 40302 | D934: =MID(RC[-3],3,1) -> 3 | E934: 1 | F934: 13 | G934: 0 | H934: 1 | I934: 10 | J934: 0 | K934: 0 | L934: 0 | N934: 40302 | O934: 符文被击碎后遗留的碎片，集齐4种碎片可以合成符文：愤怒符文。 | P934: 999999 | Q934: 1 | R934: 0 | S934: 0 | X934: 19 | AA934: 1
A935: 14309 | B935: 宁静符文碎片1 | C935: 40303 | D935: =MID(RC[-3],3,1) -> 3 | E935: 1 | F935: 13 | G935: 0 | H935: 1 | I935: 10 | J935: 0 | K935: 0 | L935: 0 | N935: 40303 | O935: 符文被击碎后遗留的碎片，集齐4种碎片可以合成符文：宁静符文。 | P935: 999999 | Q935: 1 | R935: 0 | S935: 0 | X935: 19 | AA935: 1
A936: 14310 | B936: 宁静符文碎片2 | C936: 40303 | D936: =MID(RC[-3],3,1) -> 3 | E936: 1 | F936: 13 | G936: 0 | H936: 1 | I936: 10 | J936: 0 | K936: 0 | L936: 0 | N936: 40303 | O936: 符文被击碎后遗留的碎片，集齐4种碎片可以合成符文：宁静符文。 | P936: 999999 | Q936: 1 | R936: 0 | S936: 0 | X936: 19 | AA936: 1
A937: 14311 | B937: 宁静符文碎片3 | C937: 40303 | D937: =MID(RC[-3],3,1) -> 3 | E937: 1 | F937: 13 | G937: 0 | H937: 1 | I937: 10 | J937: 0 | K937: 0 | L937: 0 | N937: 40303 | O937: 符文被击碎后遗留的碎片，集齐4种碎片可以合成符文：宁静符文。 | P937: 999999 | Q937: 1 | R937: 0 | S937: 0 | X937: 19 | AA937: 1
A938: 14312 | B938: 宁静符文碎片4 | C938: 40303 | D938: =MID(RC[-3],3,1) -> 3 | E938: 1 | F938: 13 | G938: 0 | H938: 1 | I938: 10 | J938: 0 | K938: 0 | L938: 0 | N938: 40303 | O938: 符文被击碎后遗留的碎片，集齐4种碎片可以合成符文：宁静符文。 | P938: 999999 | Q938: 1 | R938: 0 | S938: 0 | X938: 19 | AA938: 1
A939: 14313 | B939: 暴躁符文碎片1 | C939: 40304 | D939: =MID(RC[-3],3,1) -> 3 | E939: 1 | F939: 13 | G939: 0 | H939: 1 | I939: 10 | J939: 0 | K939: 0 | L939: 0 | N939: 40304 | O939: 符文被击碎后遗留的碎片，集齐4种碎片可以合成符文：暴躁符文。 | P939: 999999 | Q939: 1 | R939: 0 | S939: 0 | X939: 19 | AA939: 1
A940: 14314 | B940: 暴躁符文碎片2 | C940: 40304 | D940: =MID(RC[-3],3,1) -> 3 | E940: 1 | F940: 13 | G940: 0 | H940: 1 | I940: 10 | J940: 0 | K940: 0 | L940: 0 | N940: 40304 | O940: 符文被击碎后遗留的碎片，集齐4种碎片可以合成符文：暴躁符文。 | P940: 999999 | Q940: 1 | R940: 0 | S940: 0 | X940: 19 | AA940: 1
A941: 14315 | B941: 暴躁符文碎片3 | C941: 40304 | D941: =MID(RC[-3],3,1) -> 3 | E941: 1 | F941: 13 | G941: 0 | H941: 1 | I941: 10 | J941: 0 | K941: 0 | L941: 0 | N941: 40304 | O941: 符文被击碎后遗留的碎片，集齐4种碎片可以合成符文：暴躁符文。 | P941: 999999 | Q941: 1 | R941: 0 | S941: 0 | X941: 19 | AA941: 1
A942: 14316 | B942: 暴躁符文碎片4 | C942: 40304 | D942: =MID(RC[-3],3,1) -> 3 | E942: 1 | F942: 13 | G942: 0 | H942: 1 | I942: 10 | J942: 0 | K942: 0 | L942: 0 | N942: 40304 | O942: 符文被击碎后遗留的碎片，集齐4种碎片可以合成符文：暴躁符文。 | P942: 999999 | Q942: 1 | R942: 0 | S942: 0 | X942: 19 | AA942: 1
A943: 14317 | B943: 荆棘徽章碎片1 | C943: 41301 | D943: =MID(RC[-3],3,1) -> 3 | E943: 1 | F943: 13 | G943: 0 | H943: 1 | I943: 10 | J943: 0 | K943: 0 | L943: 0 | N943: 41301 | O943: 徽章被击碎后遗留的碎片，集齐4种碎片可以合成徽章：荆棘徽章。 | P943: 999999 | Q943: 1 | R943: 0 | S943: 0 | X943: 19 | AA943: 1
A944: 14318 | B944: 荆棘徽章碎片2 | C944: 41301 | D944: =MID(RC[-3],3,1) -> 3 | E944: 1 | F944: 13 | G944: 0 | H944: 1 | I944: 10 | J944: 0 | K944: 0 | L944: 0 | N944: 41301 | O944: 徽章被击碎后遗留的碎片，集齐4种碎片可以合成徽章：荆棘徽章。 | P944: 999999 | Q944: 1 | R944: 0 | S944: 0 | X944: 19 | AA944: 1
A945: 14319 | B945: 荆棘徽章碎片3 | C945: 41301 | D945: =MID(RC[-3],3,1) -> 3 | E945: 1 | F945: 13 | G945: 0 | H945: 1 | I945: 10 | J945: 0 | K945: 0 | L945: 0 | N945: 41301 | O945: 徽章被击碎后遗留的碎片，集齐4种碎片可以合成徽章：荆棘徽章。 | P945: 999999 | Q945: 1 | R945: 0 | S945: 0 | X945: 19 | AA945: 1
A946: 14320 | B946: 荆棘徽章碎片4 | C946: 41301 | D946: =MID(RC[-3],3,1) -> 3 | E946: 1 | F946: 13 | G946: 0 | H946: 1 | I946: 10 | J946: 0 | K946: 0 | L946: 0 | N946: 41301 | O946: 徽章被击碎后遗留的碎片，集齐4种碎片可以合成徽章：荆棘徽章。 | P946: 999999 | Q946: 1 | R946: 0 | S946: 0 | X946: 19 | AA946: 1
A947: 14321 | B947: 恶狼徽章碎片1 | C947: 41302 | D947: =MID(RC[-3],3,1) -> 3 | E947: 1 | F947: 13 | G947: 0 | H947: 1 | I947: 10 | J947: 0 | K947: 0 | L947: 0 | N947: 41302 | O947: 徽章被击碎后遗留的碎片，集齐4种碎片可以合成徽章：恶狼徽章。 | P947: 999999 | Q947: 1 | R947: 0 | S947: 0 | X947: 19 | AA947: 1
A948: 14322 | B948: 恶狼徽章碎片2 | C948: 41302 | D948: =MID(RC[-3],3,1) -> 3 | E948: 1 | F948: 13 | G948: 0 | H948: 1 | I948: 10 | J948: 0 | K948: 0 | L948: 0 | N948: 41302 | O948: 徽章被击碎后遗留的碎片，集齐4种碎片可以合成徽章：恶狼徽章。 | P948: 999999 | Q948: 1 | R948: 0 | S948: 0 | X948: 19 | AA948: 1
A949: 14323 | B949: 恶狼徽章碎片3 | C949: 41302 | D949: =MID(RC[-3],3,1) -> 3 | E949: 1 | F949: 13 | G949: 0 | H949: 1 | I949: 10 | J949: 0 | K949: 0 | L949: 0 | N949: 41302 | O949: 徽章被击碎后遗留的碎片，集齐4种碎片可以合成徽章：恶狼徽章。 | P949: 999999 | Q949: 1 | R949: 0 | S949: 0 | X949: 19 | AA949: 1
A950: 14324 | B950: 恶狼徽章碎片4 | C950: 41302 | D950: =MID(RC[-3],3,1) -> 3 | E950: 1 | F950: 13 | G950: 0 | H950: 1 | I950: 10 | J950: 0 | K950: 0 | L950: 0 | N950: 41302 | O950: 徽章被击碎后遗留的碎片，集齐4种碎片可以合成徽章：恶狼徽章。 | P950: 999999 | Q950: 1 | R950: 0 | S950: 0 | X950: 19 | AA950: 1
A951: 14325 | B951: 飞鸟徽章碎片1 | C951: 41303 | D951: =MID(RC[-3],3,1) -> 3 | E951: 1 | F951: 13 | G951: 0 | H951: 1 | I951: 10 | J951: 0 | K951: 0 | L951: 0 | N951: 41303 | O951: 徽章被击碎后遗留的碎片，集齐4种碎片可以合成徽章：飞鸟徽章。 | P951: 999999 | Q951: 1 | R951: 0 | S951: 0 | X951: 19 | AA951: 1
A952: 14326 | B952: 飞鸟徽章碎片2 | C952: 41303 | D952: =MID(RC[-3],3,1) -> 3 | E952: 1 | F952: 13 | G952: 0 | H952: 1 | I952: 10 | J952: 0 | K952: 0 | L952: 0 | N952: 41303 | O952: 徽章被击碎后遗留的碎片，集齐4种碎片可以合成徽章：飞鸟徽章。 | P952: 999999 | Q952: 1 | R952: 0 | S952: 0 | X952: 19 | AA952: 1
A953: 14327 | B953: 飞鸟徽章碎片3 | C953: 41303 | D953: =MID(RC[-3],3,1) -> 3 | E953: 1 | F953: 13 | G953: 0 | H953: 1 | I953: 10 | J953: 0 | K953: 0 | L953: 0 | N953: 41303 | O953: 徽章被击碎后遗留的碎片，集齐4种碎片可以合成徽章：飞鸟徽章。 | P953: 999999 | Q953: 1 | R953: 0 | S953: 0 | X953: 19 | AA953: 1
A954: 14328 | B954: 飞鸟徽章碎片4 | C954: 41303 | D954: =MID(RC[-3],3,1) -> 3 | E954: 1 | F954: 13 | G954: 0 | H954: 1 | I954: 10 | J954: 0 | K954: 0 | L954: 0 | N954: 41303 | O954: 徽章被击碎后遗留的碎片，集齐4种碎片可以合成徽章：飞鸟徽章。 | P954: 999999 | Q954: 1 | R954: 0 | S954: 0 | X954: 19 | AA954: 1
A955: 14329 | B955: 绿叶徽章碎片1 | C955: 41304 | D955: =MID(RC[-3],3,1) -> 3 | E955: 1 | F955: 13 | G955: 0 | H955: 1 | I955: 10 | J955: 0 | K955: 0 | L955: 0 | N955: 41304 | O955: 徽章被击碎后遗留的碎片，集齐4种碎片可以合成徽章：绿叶徽章。 | P955: 999999 | Q955: 1 | R955: 0 | S955: 0 | X955: 19 | AA955: 1
A956: 14330 | B956: 绿叶徽章碎片2 | C956: 41304 | D956: =MID(RC[-3],3,1) -> 3 | E956: 1 | F956: 13 | G956: 0 | H956: 1 | I956: 10 | J956: 0 | K956: 0 | L956: 0 | N956: 41304 | O956: 徽章被击碎后遗留的碎片，集齐4种碎片可以合成徽章：绿叶徽章。 | P956: 999999 | Q956: 1 | R956: 0 | S956: 0 | X956: 19 | AA956: 1
A957: 14331 | B957: 绿叶徽章碎片3 | C957: 41304 | D957: =MID(RC[-3],3,1) -> 3 | E957: 1 | F957: 13 | G957: 0 | H957: 1 | I957: 10 | J957: 0 | K957: 0 | L957: 0 | N957: 41304 | O957: 徽章被击碎后遗留的碎片，集齐4种碎片可以合成徽章：绿叶徽章。 | P957: 999999 | Q957: 1 | R957: 0 | S957: 0 | X957: 19 | AA957: 1
A958: 14332 | B958: 绿叶徽章碎片4 | C958: 41304 | D958: =MID(RC[-3],3,1) -> 3 | E958: 1 | F958: 13 | G958: 0 | H958: 1 | I958: 10 | J958: 0 | K958: 0 | L958: 0 | N958: 41304 | O958: 徽章被击碎后遗留的碎片，集齐4种碎片可以合成徽章：绿叶徽章。 | P958: 999999 | Q958: 1 | R958: 0 | S958: 0 | X958: 19 | AA958: 1
A959: 14333 | B959: 紫水晶碎片1 | C959: 42301 | D959: =MID(RC[-3],3,1) -> 3 | E959: 1 | F959: 13 | G959: 0 | H959: 1 | I959: 10 | J959: 0 | K959: 0 | L959: 0 | N959: 42301 | O959: 紫水晶被击碎后遗留的碎片，集齐4种碎片可以合成圣器：紫水晶。 | P959: 999999 | Q959: 1 | R959: 0 | S959: 0 | X959: 19 | AA959: 1
A960: 14334 | B960: 紫水晶碎片2 | C960: 42301 | D960: =MID(RC[-3],3,1) -> 3 | E960: 1 | F960: 13 | G960: 0 | H960: 1 | I960: 10 | J960: 0 | K960: 0 | L960: 0 | N960: 42301 | O960: 紫水晶被击碎后遗留的碎片，集齐4种碎片可以合成圣器：紫水晶。 | P960: 999999 | Q960: 1 | R960: 0 | S960: 0 | X960: 19 | AA960: 1
A961: 14335 | B961: 紫水晶碎片3 | C961: 42301 | D961: =MID(RC[-3],3,1) -> 3 | E961: 1 | F961: 13 | G961: 0 | H961: 1 | I961: 10 | J961: 0 | K961: 0 | L961: 0 | N961: 42301 | O961: 紫水晶被击碎后遗留的碎片，集齐4种碎片可以合成圣器：紫水晶。 | P961: 999999 | Q961: 1 | R961: 0 | S961: 0 | X961: 19 | AA961: 1
A962: 14336 | B962: 紫水晶碎片4 | C962: 42301 | D962: =MID(RC[-3],3,1) -> 3 | E962: 1 | F962: 13 | G962: 0 | H962: 1 | I962: 10 | J962: 0 | K962: 0 | L962: 0 | N962: 42301 | O962: 紫水晶被击碎后遗留的碎片，集齐4种碎片可以合成圣器：紫水晶。 | P962: 999999 | Q962: 1 | R962: 0 | S962: 0 | X962: 19 | AA962: 1
A963: 14401 | B963: 统帅符文碎片1 | C963: 40401 | D963: =MID(RC[-3],3,1) -> 4 | E963: 1 | F963: 13 | G963: 0 | H963: 1 | I963: 10 | J963: 0 | K963: 0 | L963: 0 | N963: 40401 | O963: 符文被击碎后遗留的碎片，集齐5种碎片可以合成符文：统帅符文。 | P963: 999999 | Q963: 1 | R963: 0 | S963: 0 | X963: 19 | AA963: 1
A964: 14402 | B964: 统帅符文碎片2 | C964: 40401 | D964: =MID(RC[-3],3,1) -> 4 | E964: 1 | F964: 13 | G964: 0 | H964: 1 | I964: 10 | J964: 0 | K964: 0 | L964: 0 | N964: 40401 | O964: 符文被击碎后遗留的碎片，集齐5种碎片可以合成符文：统帅符文。 | P964: 999999 | Q964: 1 | R964: 0 | S964: 0 | X964: 19 | AA964: 1
A965: 14403 | B965: 统帅符文碎片3 | C965: 40401 | D965: =MID(RC[-3],3,1) -> 4 | E965: 1 | F965: 13 | G965: 0 | H965: 1 | I965: 10 | J965: 0 | K965: 0 | L965: 0 | N965: 40401 | O965: 符文被击碎后遗留的碎片，集齐5种碎片可以合成符文：统帅符文。 | P965: 999999 | Q965: 1 | R965: 0 | S965: 0 | X965: 19 | AA965: 1
A966: 14404 | B966: 统帅符文碎片4 | C966: 40401 | D966: =MID(RC[-3],3,1) -> 4 | E966: 1 | F966: 13 | G966: 0 | H966: 1 | I966: 10 | J966: 0 | K966: 0 | L966: 0 | N966: 40401 | O966: 符文被击碎后遗留的碎片，集齐5种碎片可以合成符文：统帅符文。 | P966: 999999 | Q966: 1 | R966: 0 | S966: 0 | X966: 19 | AA966: 1
A967: 14405 | B967: 统帅符文碎片5 | C967: 40401 | D967: =MID(RC[-3],3,1) -> 4 | E967: 1 | F967: 13 | G967: 0 | H967: 1 | I967: 10 | J967: 0 | K967: 0 | L967: 0 | N967: 40401 | O967: 符文被击碎后遗留的碎片，集齐5种碎片可以合成符文：统帅符文。 | P967: 999999 | Q967: 1 | R967: 0 | S967: 0 | X967: 19 | AA967: 1
A968: 14406 | B968: 屠戮符文碎片1 | C968: 40402 | D968: =MID(RC[-3],3,1) -> 4 | E968: 1 | F968: 13 | G968: 0 | H968: 1 | I968: 10 | J968: 0 | K968: 0 | L968: 0 | N968: 40402 | O968: 符文被击碎后遗留的碎片，集齐5种碎片可以合成符文：屠戮符文。 | P968: 999999 | Q968: 1 | R968: 0 | S968: 0 | X968: 19 | AA968: 1
A969: 14407 | B969: 屠戮符文碎片2 | C969: 40402 | D969: =MID(RC[-3],3,1) -> 4 | E969: 1 | F969: 13 | G969: 0 | H969: 1 | I969: 10 | J969: 0 | K969: 0 | L969: 0 | N969: 40402 | O969: 符文被击碎后遗留的碎片，集齐5种碎片可以合成符文：屠戮符文。 | P969: 999999 | Q969: 1 | R969: 0 | S969: 0 | X969: 19 | AA969: 1
A970: 14408 | B970: 屠戮符文碎片3 | C970: 40402 | D970: =MID(RC[-3],3,1) -> 4 | E970: 1 | F970: 13 | G970: 0 | H970: 1 | I970: 10 | J970: 0 | K970: 0 | L970: 0 | N970: 40402 | O970: 符文被击碎后遗留的碎片，集齐5种碎片可以合成符文：屠戮符文。 | P970: 999999 | Q970: 1 | R970: 0 | S970: 0 | X970: 19 | AA970: 1
A971: 14409 | B971: 屠戮符文碎片4 | C971: 40402 | D971: =MID(RC[-3],3,1) -> 4 | E971: 1 | F971: 13 | G971: 0 | H971: 1 | I971: 10 | J971: 0 | K971: 0 | L971: 0 | N971: 40402 | O971: 符文被击碎后遗留的碎片，集齐5种碎片可以合成符文：屠戮符文。 | P971: 999999 | Q971: 1 | R971: 0 | S971: 0 | X971: 19 | AA971: 1
A972: 14410 | B972: 屠戮符文碎片5 | C972: 40402 | D972: =MID(RC[-3],3,1) -> 4 | E972: 1 | F972: 13 | G972: 0 | H972: 1 | I972: 10 | J972: 0 | K972: 0 | L972: 0 | N972: 40402 | O972: 符文被击碎后遗留的碎片，集齐5种碎片可以合成符文：屠戮符文。 | P972: 999999 | Q972: 1 | R972: 0 | S972: 0 | X972: 19 | AA972: 1
A973: 14411 | B973: 沉眠符文碎片1 | C973: 40403 | D973: =MID(RC[-3],3,1) -> 4 | E973: 1 | F973: 13 | G973: 0 | H973: 1 | I973: 10 | J973: 0 | K973: 0 | L973: 0 | N973: 40403 | O973: 符文被击碎后遗留的碎片，集齐5种碎片可以合成符文：沉眠符文。 | P973: 999999 | Q973: 1 | R973: 0 | S973: 0 | X973: 19 | AA973: 1
A974: 14412 | B974: 沉眠符文碎片2 | C974: 40403 | D974: =MID(RC[-3],3,1) -> 4 | E974: 1 | F974: 13 | G974: 0 | H974: 1 | I974: 10 | J974: 0 | K974: 0 | L974: 0 | N974: 40403 | O974: 符文被击碎后遗留的碎片，集齐5种碎片可以合成符文：沉眠符文。 | P974: 999999 | Q974: 1 | R974: 0 | S974: 0 | X974: 19 | AA974: 1
A975: 14413 | B975: 沉眠符文碎片3 | C975: 40403 | D975: =MID(RC[-3],3,1) -> 4 | E975: 1 | F975: 13 | G975: 0 | H975: 1 | I975: 10 | J975: 0 | K975: 0 | L975: 0 | N975: 40403 | O975: 符文被击碎后遗留的碎片，集齐5种碎片可以合成符文：沉眠符文。 | P975: 999999 | Q975: 1 | R975: 0 | S975: 0 | X975: 19 | AA975: 1
A976: 14414 | B976: 沉眠符文碎片4 | C976: 40403 | D976: =MID(RC[-3],3,1) -> 4 | E976: 1 | F976: 13 | G976: 0 | H976: 1 | I976: 10 | J976: 0 | K976: 0 | L976: 0 | N976: 40403 | O976: 符文被击碎后遗留的碎片，集齐5种碎片可以合成符文：沉眠符文。 | P976: 999999 | Q976: 1 | R976: 0 | S976: 0 | X976: 19 | AA976: 1
A977: 14415 | B977: 沉眠符文碎片5 | C977: 40403 | D977: =MID(RC[-3],3,1) -> 4 | E977: 1 | F977: 13 | G977: 0 | H977: 1 | I977: 10 | J977: 0 | K977: 0 | L977: 0 | N977: 40403 | O977: 符文被击碎后遗留的碎片，集齐5种碎片可以合成符文：沉眠符文。 | P977: 999999 | Q977: 1 | R977: 0 | S977: 0 | X977: 19 | AA977: 1
A978: 14416 | B978: 狂野符文碎片1 | C978: 40404 | D978: =MID(RC[-3],3,1) -> 4 | E978: 1 | F978: 13 | G978: 0 | H978: 1 | I978: 10 | J978: 0 | K978: 0 | L978: 0 | N978: 40404 | O978: 符文被击碎后遗留的碎片，集齐5种碎片可以合成符文：狂野符文。 | P978: 999999 | Q978: 1 | R978: 0 | S978: 0 | X978: 19 | AA978: 1
A979: 14417 | B979: 狂野符文碎片2 | C979: 40404 | D979: =MID(RC[-3],3,1) -> 4 | E979: 1 | F979: 13 | G979: 0 | H979: 1 | I979: 10 | J979: 0 | K979: 0 | L979: 0 | N979: 40404 | O979: 符文被击碎后遗留的碎片，集齐5种碎片可以合成符文：狂野符文。 | P979: 999999 | Q979: 1 | R979: 0 | S979: 0 | X979: 19 | AA979: 1
A980: 14418 | B980: 狂野符文碎片3 | C980: 40404 | D980: =MID(RC[-3],3,1) -> 4 | E980: 1 | F980: 13 | G980: 0 | H980: 1 | I980: 10 | J980: 0 | K980: 0 | L980: 0 | N980: 40404 | O980: 符文被击碎后遗留的碎片，集齐5种碎片可以合成符文：狂野符文。 | P980: 999999 | Q980: 1 | R980: 0 | S980: 0 | X980: 19 | AA980: 1
A981: 14419 | B981: 狂野符文碎片4 | C981: 40404 | D981: =MID(RC[-3],3,1) -> 4 | E981: 1 | F981: 13 | G981: 0 | H981: 1 | I981: 10 | J981: 0 | K981: 0 | L981: 0 | N981: 40404 | O981: 符文被击碎后遗留的碎片，集齐5种碎片可以合成符文：狂野符文。 | P981: 999999 | Q981: 1 | R981: 0 | S981: 0 | X981: 19 | AA981: 1
A982: 14420 | B982: 狂野符文碎片5 | C982: 40404 | D982: =MID(RC[-3],3,1) -> 4 | E982: 1 | F982: 13 | G982: 0 | H982: 1 | I982: 10 | J982: 0 | K982: 0 | L982: 0 | N982: 40404 | O982: 符文被击碎后遗留的碎片，集齐5种碎片可以合成符文：狂野符文。 | P982: 999999 | Q982: 1 | R982: 0 | S982: 0 | X982: 19 | AA982: 1
A983: 14421 | B983: 高山徽章碎片1 | C983: 41401 | D983: =MID(RC[-3],3,1) -> 4 | E983: 1 | F983: 13 | G983: 0 | H983: 1 | I983: 10 | J983: 0 | K983: 0 | L983: 0 | N983: 41401 | O983: 徽章被击碎后遗留的碎片，集齐5种碎片可以合成徽章：高山徽章。 | P983: 999999 | Q983: 1 | R983: 0 | S983: 0 | X983: 19 | AA983: 1
A984: 14422 | B984: 高山徽章碎片2 | C984: 41401 | D984: =MID(RC[-3],3,1) -> 4 | E984: 1 | F984: 13 | G984: 0 | H984: 1 | I984: 10 | J984: 0 | K984: 0 | L984: 0 | N984: 41401 | O984: 徽章被击碎后遗留的碎片，集齐5种碎片可以合成徽章：高山徽章。 | P984: 999999 | Q984: 1 | R984: 0 | S984: 0 | X984: 19 | AA984: 1
A985: 14423 | B985: 高山徽章碎片3 | C985: 41401 | D985: =MID(RC[-3],3,1) -> 4 | E985: 1 | F985: 13 | G985: 0 | H985: 1 | I985: 10 | J985: 0 | K985: 0 | L985: 0 | N985: 41401 | O985: 徽章被击碎后遗留的碎片，集齐5种碎片可以合成徽章：高山徽章。 | P985: 999999 | Q985: 1 | R985: 0 | S985: 0 | X985: 19 | AA985: 1
A986: 14424 | B986: 高山徽章碎片4 | C986: 41401 | D986: =MID(RC[-3],3,1) -> 4 | E986: 1 | F986: 13 | G986: 0 | H986: 1 | I986: 10 | J986: 0 | K986: 0 | L986: 0 | N986: 41401 | O986: 徽章被击碎后遗留的碎片，集齐5种碎片可以合成徽章：高山徽章。 | P986: 999999 | Q986: 1 | R986: 0 | S986: 0 | X986: 19 | AA986: 1
A987: 14425 | B987: 高山徽章碎片5 | C987: 41401 | D987: =MID(RC[-3],3,1) -> 4 | E987: 1 | F987: 13 | G987: 0 | H987: 1 | I987: 10 | J987: 0 | K987: 0 | L987: 0 | N987: 41401 | O987: 徽章被击碎后遗留的碎片，集齐5种碎片可以合成徽章：高山徽章。 | P987: 999999 | Q987: 1 | R987: 0 | S987: 0 | X987: 19 | AA987: 1
A988: 14426 | B988: 狮王徽章碎片1 | C988: 41402 | D988: =MID(RC[-3],3,1) -> 4 | E988: 1 | F988: 13 | G988: 0 | H988: 1 | I988: 10 | J988: 0 | K988: 0 | L988: 0 | N988: 41402 | O988: 徽章被击碎后遗留的碎片，集齐5种碎片可以合成徽章：狮王徽章。 | P988: 999999 | Q988: 1 | R988: 0 | S988: 0 | X988: 19 | AA988: 1
A989: 14427 | B989: 狮王徽章碎片2 | C989: 41402 | D989: =MID(RC[-3],3,1) -> 4 | E989: 1 | F989: 13 | G989: 0 | H989: 1 | I989: 10 | J989: 0 | K989: 0 | L989: 0 | N989: 41402 | O989: 徽章被击碎后遗留的碎片，集齐5种碎片可以合成徽章：狮王徽章。 | P989: 999999 | Q989: 1 | R989: 0 | S989: 0 | X989: 19 | AA989: 1
A990: 14428 | B990: 狮王徽章碎片3 | C990: 41402 | D990: =MID(RC[-3],3,1) -> 4 | E990: 1 | F990: 13 | G990: 0 | H990: 1 | I990: 10 | J990: 0 | K990: 0 | L990: 0 | N990: 41402 | O990: 徽章被击碎后遗留的碎片，集齐5种碎片可以合成徽章：狮王徽章。 | P990: 999999 | Q990: 1 | R990: 0 | S990: 0 | X990: 19 | AA990: 1
A991: 14429 | B991: 狮王徽章碎片4 | C991: 41402 | D991: =MID(RC[-3],3,1) -> 4 | E991: 1 | F991: 13 | G991: 0 | H991: 1 | I991: 10 | J991: 0 | K991: 0 | L991: 0 | N991: 41402 | O991: 徽章被击碎后遗留的碎片，集齐5种碎片可以合成徽章：狮王徽章。 | P991: 999999 | Q991: 1 | R991: 0 | S991: 0 | X991: 19 | AA991: 1
A992: 14430 | B992: 狮王徽章碎片5 | C992: 41402 | D992: =MID(RC[-3],3,1) -> 4 | E992: 1 | F992: 13 | G992: 0 | H992: 1 | I992: 10 | J992: 0 | K992: 0 | L992: 0 | N992: 41402 | O992: 徽章被击碎后遗留的碎片，集齐5种碎片可以合成徽章：狮王徽章。 | P992: 999999 | Q992: 1 | R992: 0 | S992: 0 | X992: 19 | AA992: 1
A993: 14431 | B993: 孔雀徽章碎片1 | C993: 41403 | D993: =MID(RC[-3],3,1) -> 4 | E993: 1 | F993: 13 | G993: 0 | H993: 1 | I993: 10 | J993: 0 | K993: 0 | L993: 0 | N993: 41403 | O993: 徽章被击碎后遗留的碎片，集齐5种碎片可以合成徽章：孔雀徽章。 | P993: 999999 | Q993: 1 | R993: 0 | S993: 0 | X993: 19 | AA993: 1
A994: 14432 | B994: 孔雀徽章碎片2 | C994: 41403 | D994: =MID(RC[-3],3,1) -> 4 | E994: 1 | F994: 13 | G994: 0 | H994: 1 | I994: 10 | J994: 0 | K994: 0 | L994: 0 | N994: 41403 | O994: 徽章被击碎后遗留的碎片，集齐5种碎片可以合成徽章：孔雀徽章。 | P994: 999999 | Q994: 1 | R994: 0 | S994: 0 | X994: 19 | AA994: 1
A995: 14433 | B995: 孔雀徽章碎片3 | C995: 41403 | D995: =MID(RC[-3],3,1) -> 4 | E995: 1 | F995: 13 | G995: 0 | H995: 1 | I995: 10 | J995: 0 | K995: 0 | L995: 0 | N995: 41403 | O995: 徽章被击碎后遗留的碎片，集齐5种碎片可以合成徽章：孔雀徽章。 | P995: 999999 | Q995: 1 | R995: 0 | S995: 0 | X995: 19 | AA995: 1
A996: 14434 | B996: 孔雀徽章碎片4 | C996: 41403 | D996: =MID(RC[-3],3,1) -> 4 | E996: 1 | F996: 13 | G996: 0 | H996: 1 | I996: 10 | J996: 0 | K996: 0 | L996: 0 | N996: 41403 | O996: 徽章被击碎后遗留的碎片，集齐5种碎片可以合成徽章：孔雀徽章。 | P996: 999999 | Q996: 1 | R996: 0 | S996: 0 | X996: 19 | AA996: 1
A997: 14435 | B997: 孔雀徽章碎片5 | C997: 41403 | D997: =MID(RC[-3],3,1) -> 4 | E997: 1 | F997: 13 | G997: 0 | H997: 1 | I997: 10 | J997: 0 | K997: 0 | L997: 0 | N997: 41403 | O997: 徽章被击碎后遗留的碎片，集齐5种碎片可以合成徽章：孔雀徽章。 | P997: 999999 | Q997: 1 | R997: 0 | S997: 0 | X997: 19 | AA997: 1
A998: 14436 | B998: 巨木徽章碎片1 | C998: 41404 | D998: =MID(RC[-3],3,1) -> 4 | E998: 1 | F998: 13 | G998: 0 | H998: 1 | I998: 10 | J998: 0 | K998: 0 | L998: 0 | N998: 41404 | O998: 徽章被击碎后遗留的碎片，集齐5种碎片可以合成徽章：巨木徽章。 | P998: 999999 | Q998: 1 | R998: 0 | S998: 0 | X998: 19 | AA998: 1
A999: 14437 | B999: 巨木徽章碎片2 | C999: 41404 | D999: =MID(RC[-3],3,1) -> 4 | E999: 1 | F999: 13 | G999: 0 | H999: 1 | I999: 10 | J999: 0 | K999: 0 | L999: 0 | N999: 41404 | O999: 徽章被击碎后遗留的碎片，集齐5种碎片可以合成徽章：巨木徽章。 | P999: 999999 | Q999: 1 | R999: 0 | S999: 0 | X999: 19 | AA999: 1
A1000: 14438 | B1000: 巨木徽章碎片3 | C1000: 41404 | D1000: =MID(RC[-3],3,1) -> 4 | E1000: 1 | F1000: 13 | G1000: 0 | H1000: 1 | I1000: 10 | J1000: 0 | K1000: 0 | L1000: 0 | N1000: 41404 | O1000: 徽章被击碎后遗留的碎片，集齐5种碎片可以合成徽章：巨木徽章。 | P1000: 999999 | Q1000: 1 | R1000: 0 | S1000: 0 | X1000: 19 | AA1000: 1
A1001: 14439 | B1001: 巨木徽章碎片4 | C1001: 41404 | D1001: =MID(RC[-3],3,1) -> 4 | E1001: 1 | F1001: 13 | G1001: 0 | H1001: 1 | I1001: 10 | J1001: 0 | K1001: 0 | L1001: 0 | N1001: 41404 | O1001: 徽章被击碎后遗留的碎片，集齐5种碎片可以合成徽章：巨木徽章。 | P1001: 999999 | Q1001: 1 | R1001: 0 | S1001: 0 | X1001: 19 | AA1001: 1
A1002: 14440 | B1002: 巨木徽章碎片5 | C1002: 41404 | D1002: =MID(RC[-3],3,1) -> 4 | E1002: 1 | F1002: 13 | G1002: 0 | H1002: 1 | I1002: 10 | J1002: 0 | K1002: 0 | L1002: 0 | N1002: 41404 | O1002: 徽章被击碎后遗留的碎片，集齐5种碎片可以合成徽章：巨木徽章。 | P1002: 999999 | Q1002: 1 | R1002: 0 | S1002: 0 | X1002: 19 | AA1002: 1
A1003: 14441 | B1003: 橙水晶碎片1 | C1003: 42301 | D1003: =MID(RC[-3],3,1) -> 4 | E1003: 1 | F1003: 13 | G1003: 0 | H1003: 1 | I1003: 10 | J1003: 0 | K1003: 0 | L1003: 0 | N1003: 42401 | O1003: 橙水晶被击碎后遗留的碎片，集齐5种碎片可以合成圣器：橙水晶。 | P1003: 999999 | Q1003: 1 | R1003: 0 | S1003: 0 | X1003: 19 | AA1003: 1
A1004: 14442 | B1004: 橙水晶碎片2 | C1004: 42301 | D1004: =MID(RC[-3],3,1) -> 4 | E1004: 1 | F1004: 13 | G1004: 0 | H1004: 1 | I1004: 10 | J1004: 0 | K1004: 0 | L1004: 0 | N1004: 42401 | O1004: 橙水晶被击碎后遗留的碎片，集齐5种碎片可以合成圣器：橙水晶。 | P1004: 999999 | Q1004: 1 | R1004: 0 | S1004: 0 | X1004: 19 | AA1004: 1
A1005: 14443 | B1005: 橙水晶碎片3 | C1005: 42301 | D1005: =MID(RC[-3],3,1) -> 4 | E1005: 1 | F1005: 13 | G1005: 0 | H1005: 1 | I1005: 10 | J1005: 0 | K1005: 0 | L1005: 0 | N1005: 42401 | O1005: 橙水晶被击碎后遗留的碎片，集齐5种碎片可以合成圣器：橙水晶。 | P1005: 999999 | Q1005: 1 | R1005: 0 | S1005: 0 | X1005: 19 | AA1005: 1
A1006: 14444 | B1006: 橙水晶碎片4 | C1006: 42301 | D1006: =MID(RC[-3],3,1) -> 4 | E1006: 1 | F1006: 13 | G1006: 0 | H1006: 1 | I1006: 10 | J1006: 0 | K1006: 0 | L1006: 0 | N1006: 42401 | O1006: 橙水晶被击碎后遗留的碎片，集齐5种碎片可以合成圣器：橙水晶。 | P1006: 999999 | Q1006: 1 | R1006: 0 | S1006: 0 | X1006: 19 | AA1006: 1
A1007: 14445 | B1007: 橙水晶碎片5 | C1007: 42301 | D1007: =MID(RC[-3],3,1) -> 4 | E1007: 1 | F1007: 13 | G1007: 0 | H1007: 1 | I1007: 10 | J1007: 0 | K1007: 0 | L1007: 0 | N1007: 42401 | O1007: 橙水晶被击碎后遗留的碎片，集齐5种碎片可以合成圣器：橙水晶。 | P1007: 999999 | Q1007: 1 | R1007: 0 | S1007: 0 | X1007: 19 | AA1007: 1
A1008: 14501 | B1008: 王者符文碎片1 | C1008: 40501 | D1008: =MID(RC[-3],3,1) -> 5 | E1008: 1 | F1008: 13 | G1008: 0 | H1008: 1 | I1008: 10 | J1008: 0 | K1008: 0 | L1008: 0 | N1008: 40501 | O1008: 符文被击碎后遗留的碎片，集齐6种碎片可以合成符文：王者符文。 | P1008: 999999 | Q1008: 1 | R1008: 0 | S1008: 0 | X1008: 19 | AA1008: 1
A1009: 14502 | B1009: 王者符文碎片2 | C1009: 40501 | D1009: =MID(RC[-3],3,1) -> 5 | E1009: 1 | F1009: 13 | G1009: 0 | H1009: 1 | I1009: 10 | J1009: 0 | K1009: 0 | L1009: 0 | N1009: 40501 | O1009: 符文被击碎后遗留的碎片，集齐6种碎片可以合成符文：王者符文。 | P1009: 999999 | Q1009: 1 | R1009: 0 | S1009: 0 | X1009: 19 | AA1009: 1
A1010: 14503 | B1010: 王者符文碎片3 | C1010: 40501 | D1010: =MID(RC[-3],3,1) -> 5 | E1010: 1 | F1010: 13 | G1010: 0 | H1010: 1 | I1010: 10 | J1010: 0 | K1010: 0 | L1010: 0 | N1010: 40501 | O1010: 符文被击碎后遗留的碎片，集齐6种碎片可以合成符文：王者符文。 | P1010: 999999 | Q1010: 1 | R1010: 0 | S1010: 0 | X1010: 19 | AA1010: 1
A1011: 14504 | B1011: 王者符文碎片4 | C1011: 40501 | D1011: =MID(RC[-3],3,1) -> 5 | E1011: 1 | F1011: 13 | G1011: 0 | H1011: 1 | I1011: 10 | J1011: 0 | K1011: 0 | L1011: 0 | N1011: 40501 | O1011: 符文被击碎后遗留的碎片，集齐6种碎片可以合成符文：王者符文。 | P1011: 999999 | Q1011: 1 | R1011: 0 | S1011: 0 | X1011: 19 | AA1011: 1
A1012: 14505 | B1012: 王者符文碎片5 | C1012: 40501 | D1012: =MID(RC[-3],3,1) -> 5 | E1012: 1 | F1012: 13 | G1012: 0 | H1012: 1 | I1012: 10 | J1012: 0 | K1012: 0 | L1012: 0 | N1012: 40501 | O1012: 符文被击碎后遗留的碎片，集齐6种碎片可以合成符文：王者符文。 | P1012: 999999 | Q1012: 1 | R1012: 0 | S1012: 0 | X1012: 19 | AA1012: 1
A1013: 14506 | B1013: 王者符文碎片6 | C1013: 40501 | D1013: =MID(RC[-3],3,1) -> 5 | E1013: 1 | F1013: 13 | G1013: 0 | H1013: 1 | I1013: 10 | J1013: 0 | K1013: 0 | L1013: 0 | N1013: 40501 | O1013: 符文被击碎后遗留的碎片，集齐6种碎片可以合成符文：王者符文。 | P1013: 999999 | Q1013: 1 | R1013: 0 | S1013: 0 | X1013: 19 | AA1013: 1
A1014: 14507 | B1014: 毁灭符文碎片1 | C1014: 40502 | D1014: =MID(RC[-3],3,1) -> 5 | E1014: 1 | F1014: 13 | G1014: 0 | H1014: 1 | I1014: 10 | J1014: 0 | K1014: 0 | L1014: 0 | N1014: 40502 | O1014: 符文被击碎后遗留的碎片，集齐6种碎片可以合成符文：毁灭符文。 | P1014: 999999 | Q1014: 1 | R1014: 0 | S1014: 0 | X1014: 19 | AA1014: 1
A1015: 14508 | B1015: 毁灭符文碎片2 | C1015: 40502 | D1015: =MID(RC[-3],3,1) -> 5 | E1015: 1 | F1015: 13 | G1015: 0 | H1015: 1 | I1015: 10 | J1015: 0 | K1015: 0 | L1015: 0 | N1015: 40502 | O1015: 符文被击碎后遗留的碎片，集齐6种碎片可以合成符文：毁灭符文。 | P1015: 999999 | Q1015: 1 | R1015: 0 | S1015: 0 | X1015: 19 | AA1015: 1
A1016: 14509 | B1016: 毁灭符文碎片3 | C1016: 40502 | D1016: =MID(RC[-3],3,1) -> 5 | E1016: 1 | F1016: 13 | G1016: 0 | H1016: 1 | I1016: 10 | J1016: 0 | K1016: 0 | L1016: 0 | N1016: 40502 | O1016: 符文被击碎后遗留的碎片，集齐6种碎片可以合成符文：毁灭符文。 | P1016: 999999 | Q1016: 1 | R1016: 0 | S1016: 0 | X1016: 19 | AA1016: 1
A1017: 14510 | B1017: 毁灭符文碎片4 | C1017: 40502 | D1017: =MID(RC[-3],3,1) -> 5 | E1017: 1 | F1017: 13 | G1017: 0 | H1017: 1 | I1017: 10 | J1017: 0 | K1017: 0 | L1017: 0 | N1017: 40502 | O1017: 符文被击碎后遗留的碎片，集齐6种碎片可以合成符文：毁灭符文。 | P1017: 999999 | Q1017: 1 | R1017: 0 | S1017: 0 | X1017: 19 | AA1017: 1
A1018: 14511 | B1018: 毁灭符文碎片5 | C1018: 40502 | D1018: =MID(RC[-3],3,1) -> 5 | E1018: 1 | F1018: 13 | G1018: 0 | H1018: 1 | I1018: 10 | J1018: 0 | K1018: 0 | L1018: 0 | N1018: 40502 | O1018: 符文被击碎后遗留的碎片，集齐6种碎片可以合成符文：毁灭符文。 | P1018: 999999 | Q1018: 1 | R1018: 0 | S1018: 0 | X1018: 19 | AA1018: 1
A1019: 14512 | B1019: 毁灭符文碎片6 | C1019: 40502 | D1019: =MID(RC[-3],3,1) -> 5 | E1019: 1 | F1019: 13 | G1019: 0 | H1019: 1 | I1019: 10 | J1019: 0 | K1019: 0 | L1019: 0 | N1019: 40502 | O1019: 符文被击碎后遗留的碎片，集齐6种碎片可以合成符文：毁灭符文。 | P1019: 999999 | Q1019: 1 | R1019: 0 | S1019: 0 | X1019: 19 | AA1019: 1
A1020: 14513 | B1020: 永寂符文碎片1 | C1020: 40503 | D1020: =MID(RC[-3],3,1) -> 5 | E1020: 1 | F1020: 13 | G1020: 0 | H1020: 1 | I1020: 10 | J1020: 0 | K1020: 0 | L1020: 0 | N1020: 40503 | O1020: 符文被击碎后遗留的碎片，集齐6种碎片可以合成符文：永寂符文。 | P1020: 999999 | Q1020: 1 | R1020: 0 | S1020: 0 | X1020: 19 | AA1020: 1
A1021: 14514 | B1021: 永寂符文碎片2 | C1021: 40503 | D1021: =MID(RC[-3],3,1) -> 5 | E1021: 1 | F1021: 13 | G1021: 0 | H1021: 1 | I1021: 10 | J1021: 0 | K1021: 0 | L1021: 0 | N1021: 40503 | O1021: 符文被击碎后遗留的碎片，集齐6种碎片可以合成符文：永寂符文。 | P1021: 999999 | Q1021: 1 | R1021: 0 | S1021: 0 | X1021: 19 | AA1021: 1
A1022: 14515 | B1022: 永寂符文碎片3 | C1022: 40503 | D1022: =MID(RC[-3],3,1) -> 5 | E1022: 1 | F1022: 13 | G1022: 0 | H1022: 1 | I1022: 10 | J1022: 0 | K1022: 0 | L1022: 0 | N1022: 40503 | O1022: 符文被击碎后遗留的碎片，集齐6种碎片可以合成符文：永寂符文。 | P1022: 999999 | Q1022: 1 | R1022: 0 | S1022: 0 | X1022: 19 | AA1022: 1
A1023: 14516 | B1023: 永寂符文碎片4 | C1023: 40503 | D1023: =MID(RC[-3],3,1) -> 5 | E1023: 1 | F1023: 13 | G1023: 0 | H1023: 1 | I1023: 10 | J1023: 0 | K1023: 0 | L1023: 0 | N1023: 40503 | O1023: 符文被击碎后遗留的碎片，集齐6种碎片可以合成符文：永寂符文。 | P1023: 999999 | Q1023: 1 | R1023: 0 | S1023: 0 | X1023: 19 | AA1023: 1
A1024: 14517 | B1024: 永寂符文碎片5 | C1024: 40503 | D1024: =MID(RC[-3],3,1) -> 5 | E1024: 1 | F1024: 13 | G1024: 0 | H1024: 1 | I1024: 10 | J1024: 0 | K1024: 0 | L1024: 0 | N1024: 40503 | O1024: 符文被击碎后遗留的碎片，集齐6种碎片可以合成符文：永寂符文。 | P1024: 999999 | Q1024: 1 | R1024: 0 | S1024: 0 | X1024: 19 | AA1024: 1
A1025: 14518 | B1025: 永寂符文碎片6 | C1025: 40503 | D1025: =MID(RC[-3],3,1) -> 5 | E1025: 1 | F1025: 13 | G1025: 0 | H1025: 1 | I1025: 10 | J1025: 0 | K1025: 0 | L1025: 0 | N1025: 40503 | O1025: 符文被击碎后遗留的碎片，集齐6种碎片可以合成符文：永寂符文。 | P1025: 999999 | Q1025: 1 | R1025: 0 | S1025: 0 | X1025: 19 | AA1025: 1
A1026: 14519 | B1026: 疯狂符文碎片1 | C1026: 40504 | D1026: =MID(RC[-3],3,1) -> 5 | E1026: 1 | F1026: 13 | G1026: 0 | H1026: 1 | I1026: 10 | J1026: 0 | K1026: 0 | L1026: 0 | N1026: 40504 | O1026: 符文被击碎后遗留的碎片，集齐6种碎片可以合成符文：疯狂符文。 | P1026: 999999 | Q1026: 1 | R1026: 0 | S1026: 0 | X1026: 19 | AA1026: 1
A1027: 14520 | B1027: 疯狂符文碎片2 | C1027: 40504 | D1027: =MID(RC[-3],3,1) -> 5 | E1027: 1 | F1027: 13 | G1027: 0 | H1027: 1 | I1027: 10 | J1027: 0 | K1027: 0 | L1027: 0 | N1027: 40504 | O1027: 符文被击碎后遗留的碎片，集齐6种碎片可以合成符文：疯狂符文。 | P1027: 999999 | Q1027: 1 | R1027: 0 | S1027: 0 | X1027: 19 | AA1027: 1
A1028: 14521 | B1028: 疯狂符文碎片3 | C1028: 40504 | D1028: =MID(RC[-3],3,1) -> 5 | E1028: 1 | F1028: 13 | G1028: 0 | H1028: 1 | I1028: 10 | J1028: 0 | K1028: 0 | L1028: 0 | N1028: 40504 | O1028: 符文被击碎后遗留的碎片，集齐6种碎片可以合成符文：疯狂符文。 | P1028: 999999 | Q1028: 1 | R1028: 0 | S1028: 0 | X1028: 19 | AA1028: 1
A1029: 14522 | B1029: 疯狂符文碎片4 | C1029: 40504 | D1029: =MID(RC[-3],3,1) -> 5 | E1029: 1 | F1029: 13 | G1029: 0 | H1029: 1 | I1029: 10 | J1029: 0 | K1029: 0 | L1029: 0 | N1029: 40504 | O1029: 符文被击碎后遗留的碎片，集齐6种碎片可以合成符文：疯狂符文。 | P1029: 999999 | Q1029: 1 | R1029: 0 | S1029: 0 | X1029: 19 | AA1029: 1
A1030: 14523 | B1030: 疯狂符文碎片5 | C1030: 40504 | D1030: =MID(RC[-3],3,1) -> 5 | E1030: 1 | F1030: 13 | G1030: 0 | H1030: 1 | I1030: 10 | J1030: 0 | K1030: 0 | L1030: 0 | N1030: 40504 | O1030: 符文被击碎后遗留的碎片，集齐6种碎片可以合成符文：疯狂符文。 | P1030: 999999 | Q1030: 1 | R1030: 0 | S1030: 0 | X1030: 19 | AA1030: 1
A1031: 14524 | B1031: 疯狂符文碎片6 | C1031: 40504 | D1031: =MID(RC[-3],3,1) -> 5 | E1031: 1 | F1031: 13 | G1031: 0 | H1031: 1 | I1031: 10 | J1031: 0 | K1031: 0 | L1031: 0 | N1031: 40504 | O1031: 符文被击碎后遗留的碎片，集齐6种碎片可以合成符文：疯狂符文。 | P1031: 999999 | Q1031: 1 | R1031: 0 | S1031: 0 | X1031: 19 | AA1031: 1
A1032: 14525 | B1032: 恒阳徽章碎片1 | C1032: 41501 | D1032: =MID(RC[-3],3,1) -> 5 | E1032: 1 | F1032: 13 | G1032: 0 | H1032: 1 | I1032: 10 | J1032: 0 | K1032: 0 | L1032: 0 | N1032: 41501 | O1032: 徽章被击碎后遗留的碎片，集齐6种碎片可以合成徽章：恒阳徽章。 | P1032: 999999 | Q1032: 1 | R1032: 0 | S1032: 0 | X1032: 19 | AA1032: 1
A1033: 14526 | B1033: 恒阳徽章碎片2 | C1033: 41501 | D1033: =MID(RC[-3],3,1) -> 5 | E1033: 1 | F1033: 13 | G1033: 0 | H1033: 1 | I1033: 10 | J1033: 0 | K1033: 0 | L1033: 0 | N1033: 41501 | O1033: 徽章被击碎后遗留的碎片，集齐6种碎片可以合成徽章：恒阳徽章。 | P1033: 999999 | Q1033: 1 | R1033: 0 | S1033: 0 | X1033: 19 | AA1033: 1
A1034: 14527 | B1034: 恒阳徽章碎片3 | C1034: 41501 | D1034: =MID(RC[-3],3,1) -> 5 | E1034: 1 | F1034: 13 | G1034: 0 | H1034: 1 | I1034: 10 | J1034: 0 | K1034: 0 | L1034: 0 | N1034: 41501 | O1034: 徽章被击碎后遗留的碎片，集齐6种碎片可以合成徽章：恒阳徽章。 | P1034: 999999 | Q1034: 1 | R1034: 0 | S1034: 0 | X1034: 19 | AA1034: 1
A1035: 14528 | B1035: 恒阳徽章碎片4 | C1035: 41501 | D1035: =MID(RC[-3],3,1) -> 5 | E1035: 1 | F1035: 13 | G1035: 0 | H1035: 1 | I1035: 10 | J1035: 0 | K1035: 0 | L1035: 0 | N1035: 41501 | O1035: 徽章被击碎后遗留的碎片，集齐6种碎片可以合成徽章：恒阳徽章。 | P1035: 999999 | Q1035: 1 | R1035: 0 | S1035: 0 | X1035: 19 | AA1035: 1
A1036: 14529 | B1036: 恒阳徽章碎片5 | C1036: 41501 | D1036: =MID(RC[-3],3,1) -> 5 | E1036: 1 | F1036: 13 | G1036: 0 | H1036: 1 | I1036: 10 | J1036: 0 | K1036: 0 | L1036: 0 | N1036: 41501 | O1036: 徽章被击碎后遗留的碎片，集齐6种碎片可以合成徽章：恒阳徽章。 | P1036: 999999 | Q1036: 1 | R1036: 0 | S1036: 0 | X1036: 19 | AA1036: 1
A1037: 14530 | B1037: 恒阳徽章碎片6 | C1037: 41501 | D1037: =MID(RC[-3],3,1) -> 5 | E1037: 1 | F1037: 13 | G1037: 0 | H1037: 1 | I1037: 10 | J1037: 0 | K1037: 0 | L1037: 0 | N1037: 41501 | O1037: 徽章被击碎后遗留的碎片，集齐6种碎片可以合成徽章：恒阳徽章。 | P1037: 999999 | Q1037: 1 | R1037: 0 | S1037: 0 | X1037: 19 | AA1037: 1
A1038: 14531 | B1038: 巨龙徽章碎片1 | C1038: 41502 | D1038: =MID(RC[-3],3,1) -> 5 | E1038: 1 | F1038: 13 | G1038: 0 | H1038: 1 | I1038: 10 | J1038: 0 | K1038: 0 | L1038: 0 | N1038: 41502 | O1038: 徽章被击碎后遗留的碎片，集齐6种碎片可以合成徽章：巨龙徽章。 | P1038: 999999 | Q1038: 1 | R1038: 0 | S1038: 0 | X1038: 19 | AA1038: 1
A1039: 14532 | B1039: 巨龙徽章碎片2 | C1039: 41502 | D1039: =MID(RC[-3],3,1) -> 5 | E1039: 1 | F1039: 13 | G1039: 0 | H1039: 1 | I1039: 10 | J1039: 0 | K1039: 0 | L1039: 0 | N1039: 41502 | O1039: 徽章被击碎后遗留的碎片，集齐6种碎片可以合成徽章：巨龙徽章。 | P1039: 999999 | Q1039: 1 | R1039: 0 | S1039: 0 | X1039: 19 | AA1039: 1
A1040: 14533 | B1040: 巨龙徽章碎片3 | C1040: 41502 | D1040: =MID(RC[-3],3,1) -> 5 | E1040: 1 | F1040: 13 | G1040: 0 | H1040: 1 | I1040: 10 | J1040: 0 | K1040: 0 | L1040: 0 | N1040: 41502 | O1040: 徽章被击碎后遗留的碎片，集齐6种碎片可以合成徽章：巨龙徽章。 | P1040: 999999 | Q1040: 1 | R1040: 0 | S1040: 0 | X1040: 19 | AA1040: 1
A1041: 14534 | B1041: 巨龙徽章碎片4 | C1041: 41502 | D1041: =MID(RC[-3],3,1) -> 5 | E1041: 1 | F1041: 13 | G1041: 0 | H1041: 1 | I1041: 10 | J1041: 0 | K1041: 0 | L1041: 0 | N1041: 41502 | O1041: 徽章被击碎后遗留的碎片，集齐6种碎片可以合成徽章：巨龙徽章。 | P1041: 999999 | Q1041: 1 | R1041: 0 | S1041: 0 | X1041: 19 | AA1041: 1
A1042: 14535 | B1042: 巨龙徽章碎片5 | C1042: 41502 | D1042: =MID(RC[-3],3,1) -> 5 | E1042: 1 | F1042: 13 | G1042: 0 | H1042: 1 | I1042: 10 | J1042: 0 | K1042: 0 | L1042: 0 | N1042: 41502 | O1042: 徽章被击碎后遗留的碎片，集齐6种碎片可以合成徽章：巨龙徽章。 | P1042: 999999 | Q1042: 1 | R1042: 0 | S1042: 0 | X1042: 19 | AA1042: 1
A1043: 14536 | B1043: 巨龙徽章碎片6 | C1043: 41502 | D1043: =MID(RC[-3],3,1) -> 5 | E1043: 1 | F1043: 13 | G1043: 0 | H1043: 1 | I1043: 10 | J1043: 0 | K1043: 0 | L1043: 0 | N1043: 41502 | O1043: 徽章被击碎后遗留的碎片，集齐6种碎片可以合成徽章：巨龙徽章。 | P1043: 999999 | Q1043: 1 | R1043: 0 | S1043: 0 | X1043: 19 | AA1043: 1
A1044: 14537 | B1044: 凤凰徽章碎片1 | C1044: 41503 | D1044: =MID(RC[-3],3,1) -> 5 | E1044: 1 | F1044: 13 | G1044: 0 | H1044: 1 | I1044: 10 | J1044: 0 | K1044: 0 | L1044: 0 | N1044: 41503 | O1044: 徽章被击碎后遗留的碎片，集齐6种碎片可以合成徽章：凤凰徽章。 | P1044: 999999 | Q1044: 1 | R1044: 0 | S1044: 0 | X1044: 19 | AA1044: 1
A1045: 14538 | B1045: 凤凰徽章碎片2 | C1045: 41503 | D1045: =MID(RC[-3],3,1) -> 5 | E1045: 1 | F1045: 13 | G1045: 0 | H1045: 1 | I1045: 10 | J1045: 0 | K1045: 0 | L1045: 0 | N1045: 41503 | O1045: 徽章被击碎后遗留的碎片，集齐6种碎片可以合成徽章：凤凰徽章。 | P1045: 999999 | Q1045: 1 | R1045: 0 | S1045: 0 | X1045: 19 | AA1045: 1
A1046: 14539 | B1046: 凤凰徽章碎片3 | C1046: 41503 | D1046: =MID(RC[-3],3,1) -> 5 | E1046: 1 | F1046: 13 | G1046: 0 | H1046: 1 | I1046: 10 | J1046: 0 | K1046: 0 | L1046: 0 | N1046: 41503 | O1046: 徽章被击碎后遗留的碎片，集齐6种碎片可以合成徽章：凤凰徽章。 | P1046: 999999 | Q1046: 1 | R1046: 0 | S1046: 0 | X1046: 19 | AA1046: 1
A1047: 14540 | B1047: 凤凰徽章碎片4 | C1047: 41503 | D1047: =MID(RC[-3],3,1) -> 5 | E1047: 1 | F1047: 13 | G1047: 0 | H1047: 1 | I1047: 10 | J1047: 0 | K1047: 0 | L1047: 0 | N1047: 41503 | O1047: 徽章被击碎后遗留的碎片，集齐6种碎片可以合成徽章：凤凰徽章。 | P1047: 999999 | Q1047: 1 | R1047: 0 | S1047: 0 | X1047: 19 | AA1047: 1
A1048: 14541 | B1048: 凤凰徽章碎片5 | C1048: 41503 | D1048: =MID(RC[-3],3,1) -> 5 | E1048: 1 | F1048: 13 | G1048: 0 | H1048: 1 | I1048: 10 | J1048: 0 | K1048: 0 | L1048: 0 | N1048: 41503 | O1048: 徽章被击碎后遗留的碎片，集齐6种碎片可以合成徽章：凤凰徽章。 | P1048: 999999 | Q1048: 1 | R1048: 0 | S1048: 0 | X1048: 19 | AA1048: 1
A1049: 14542 | B1049: 凤凰徽章碎片6 | C1049: 41503 | D1049: =MID(RC[-3],3,1) -> 5 | E1049: 1 | F1049: 13 | G1049: 0 | H1049: 1 | I1049: 10 | J1049: 0 | K1049: 0 | L1049: 0 | N1049: 41503 | O1049: 徽章被击碎后遗留的碎片，集齐6种碎片可以合成徽章：凤凰徽章。 | P1049: 999999 | Q1049: 1 | R1049: 0 | S1049: 0 | X1049: 19 | AA1049: 1
A1050: 14543 | B1050: 神树徽章碎片1 | C1050: 41504 | D1050: =MID(RC[-3],3,1) -> 5 | E1050: 1 | F1050: 13 | G1050: 0 | H1050: 1 | I1050: 10 | J1050: 0 | K1050: 0 | L1050: 0 | N1050: 41504 | O1050: 徽章被击碎后遗留的碎片，集齐6种碎片可以合成徽章：神树徽章。 | P1050: 999999 | Q1050: 1 | R1050: 0 | S1050: 0 | X1050: 19 | AA1050: 1
A1051: 14544 | B1051: 神树徽章碎片2 | C1051: 41504 | D1051: =MID(RC[-3],3,1) -> 5 | E1051: 1 | F1051: 13 | G1051: 0 | H1051: 1 | I1051: 10 | J1051: 0 | K1051: 0 | L1051: 0 | N1051: 41504 | O1051: 徽章被击碎后遗留的碎片，集齐6种碎片可以合成徽章：神树徽章。 | P1051: 999999 | Q1051: 1 | R1051: 0 | S1051: 0 | X1051: 19 | AA1051: 1
A1052: 14545 | B1052: 神树徽章碎片3 | C1052: 41504 | D1052: =MID(RC[-3],3,1) -> 5 | E1052: 1 | F1052: 13 | G1052: 0 | H1052: 1 | I1052: 10 | J1052: 0 | K1052: 0 | L1052: 0 | N1052: 41504 | O1052: 徽章被击碎后遗留的碎片，集齐6种碎片可以合成徽章：神树徽章。 | P1052: 999999 | Q1052: 1 | R1052: 0 | S1052: 0 | X1052: 19 | AA1052: 1
A1053: 14546 | B1053: 神树徽章碎片4 | C1053: 41504 | D1053: =MID(RC[-3],3,1) -> 5 | E1053: 1 | F1053: 13 | G1053: 0 | H1053: 1 | I1053: 10 | J1053: 0 | K1053: 0 | L1053: 0 | N1053: 41504 | O1053: 徽章被击碎后遗留的碎片，集齐6种碎片可以合成徽章：神树徽章。 | P1053: 999999 | Q1053: 1 | R1053: 0 | S1053: 0 | X1053: 19 | AA1053: 1
A1054: 14547 | B1054: 神树徽章碎片5 | C1054: 41504 | D1054: =MID(RC[-3],3,1) -> 5 | E1054: 1 | F1054: 13 | G1054: 0 | H1054: 1 | I1054: 10 | J1054: 0 | K1054: 0 | L1054: 0 | N1054: 41504 | O1054: 徽章被击碎后遗留的碎片，集齐6种碎片可以合成徽章：神树徽章。 | P1054: 999999 | Q1054: 1 | R1054: 0 | S1054: 0 | X1054: 19 | AA1054: 1
A1055: 14548 | B1055: 神树徽章碎片6 | C1055: 41504 | D1055: =MID(RC[-3],3,1) -> 5 | E1055: 1 | F1055: 13 | G1055: 0 | H1055: 1 | I1055: 10 | J1055: 0 | K1055: 0 | L1055: 0 | N1055: 41504 | O1055: 徽章被击碎后遗留的碎片，集齐6种碎片可以合成徽章：神树徽章。 | P1055: 999999 | Q1055: 1 | R1055: 0 | S1055: 0 | X1055: 19 | AA1055: 1
A1056: 14549 | B1056: 红水晶碎片1 | C1056: 42301 | D1056: =MID(RC[-3],3,1) -> 5 | E1056: 1 | F1056: 13 | G1056: 0 | H1056: 1 | I1056: 10 | J1056: 0 | K1056: 0 | L1056: 0 | N1056: 42501 | O1056: 红水晶被击碎后遗留的碎片，集齐6种碎片可以合成圣器：红水晶。 | P1056: 999999 | Q1056: 1 | R1056: 0 | S1056: 0 | X1056: 19 | AA1056: 1
A1057: 14550 | B1057: 红水晶碎片2 | C1057: 42301 | D1057: =MID(RC[-3],3,1) -> 5 | E1057: 1 | F1057: 13 | G1057: 0 | H1057: 1 | I1057: 10 | J1057: 0 | K1057: 0 | L1057: 0 | N1057: 42501 | O1057: 红水晶被击碎后遗留的碎片，集齐6种碎片可以合成圣器：红水晶。 | P1057: 999999 | Q1057: 1 | R1057: 0 | S1057: 0 | X1057: 19 | AA1057: 1
A1058: 14551 | B1058: 红水晶碎片3 | C1058: 42301 | D1058: =MID(RC[-3],3,1) -> 5 | E1058: 1 | F1058: 13 | G1058: 0 | H1058: 1 | I1058: 10 | J1058: 0 | K1058: 0 | L1058: 0 | N1058: 42501 | O1058: 红水晶被击碎后遗留的碎片，集齐6种碎片可以合成圣器：红水晶。 | P1058: 999999 | Q1058: 1 | R1058: 0 | S1058: 0 | X1058: 19 | AA1058: 1
A1059: 14552 | B1059: 红水晶碎片4 | C1059: 42301 | D1059: =MID(RC[-3],3,1) -> 5 | E1059: 1 | F1059: 13 | G1059: 0 | H1059: 1 | I1059: 10 | J1059: 0 | K1059: 0 | L1059: 0 | N1059: 42501 | O1059: 红水晶被击碎后遗留的碎片，集齐6种碎片可以合成圣器：红水晶。 | P1059: 999999 | Q1059: 1 | R1059: 0 | S1059: 0 | X1059: 19 | AA1059: 1
A1060: 14553 | B1060: 红水晶碎片5 | C1060: 42301 | D1060: =MID(RC[-3],3,1) -> 5 | E1060: 1 | F1060: 13 | G1060: 0 | H1060: 1 | I1060: 10 | J1060: 0 | K1060: 0 | L1060: 0 | N1060: 42501 | O1060: 红水晶被击碎后遗留的碎片，集齐6种碎片可以合成圣器：红水晶。 | P1060: 999999 | Q1060: 1 | R1060: 0 | S1060: 0 | X1060: 19 | AA1060: 1
A1061: 14554 | B1061: 红水晶碎片6 | C1061: 42301 | D1061: =MID(RC[-3],3,1) -> 5 | E1061: 1 | F1061: 13 | G1061: 0 | H1061: 1 | I1061: 10 | J1061: 0 | K1061: 0 | L1061: 0 | N1061: 42501 | O1061: 红水晶被击碎后遗留的碎片，集齐6种碎片可以合成圣器：红水晶。 | P1061: 999999 | Q1061: 1 | R1061: 0 | S1061: 0 | X1061: 19 | AA1061: 1
A1062: 15001 | B1062: 希望精灵碎片 | C1062: 50001 | D1062: 3 | E1062: 1 | F1062: 24 | G1062: 1 | H1062: 1 | I1062: 10 | J1062: 0 | K1062: 0 | L1062: 0 | N1062: 50001 | O1062: =MID(RC[-13],1,4)&"的灵魂碎片，是精灵【"&MID(RC[-13],1,4)&"】升星的材料。" -> 希望精灵的灵魂碎片，是精灵【希望精灵】升星的材料。 | P1062: 999999 | Q1062: 1 | R1062: 50001 | S1062: 90 | X1062: 26 | AA1062: 1
A1063: 15002 | B1063: 绝境梦魇碎片 | C1063: 50002 | D1063: 4 | E1063: 1 | F1063: 24 | G1063: 1 | H1063: 1 | I1063: 10 | J1063: 0 | K1063: 0 | L1063: 0 | N1063: 50002 | O1063: =MID(RC[-13],1,4)&"的灵魂碎片，是精灵【"&MID(RC[-13],1,4)&"】升星的材料，集齐"&RC[4]&"个可激活精灵【"&MID(RC[-13],1,4)&"】。" -> 绝境梦魇的灵魂碎片，是精灵【绝境梦魇】升星的材料，集齐90个可激活精灵【绝境梦魇】。 | P1063: 999999 | Q1063: 1 | R1063: 50002 | S1063: 90 | X1063: 88 | AA1063: 1
A1064: 15011 | B1064: 炼狱灵龙碎片 | C1064: 50011 | D1064: 4 | E1064: 1 | F1064: 24 | G1064: 1 | H1064: 1 | I1064: 10 | J1064: 0 | K1064: 0 | L1064: 0 | N1064: 50011 | O1064: =MID(RC[-13],1,4)&"的灵魂碎片，是精灵【"&MID(RC[-13],1,4)&"】升星的材料，集齐"&RC[4]&"个可激活精灵【"&MID(RC[-13],1,4)&"】。" -> 炼狱灵龙的灵魂碎片，是精灵【炼狱灵龙】升星的材料，集齐90个可激活精灵【炼狱灵龙】。 | P1064: 999999 | Q1064: 1 | R1064: 50011 | S1064: 90 | AA1064: 1
A1065: 15012 | B1065: 深海女王碎片 | C1065: 50012 | D1065: 4 | E1065: 1 | F1065: 24 | G1065: 1 | H1065: 1 | I1065: 10 | J1065: 0 | K1065: 0 | L1065: 0 | N1065: 50012 | O1065: =MID(RC[-13],1,4)&"的灵魂碎片，是精灵【"&MID(RC[-13],1,4)&"】升星的材料，集齐"&RC[4]&"个可激活精灵【"&MID(RC[-13],1,4)&"】。" -> 深海女王的灵魂碎片，是精灵【深海女王】升星的材料，集齐90个可激活精灵【深海女王】。 | P1065: 999999 | Q1065: 1 | R1065: 50012 | S1065: 90 | X1065: 98 | AA1065: 1
A1066: 15021 | B1066: 暴风元灵碎片 | C1066: 50021 | D1066: 4 | E1066: 1 | F1066: 24 | G1066: 1 | H1066: 1 | I1066: 10 | J1066: 0 | K1066: 0 | L1066: 0 | N1066: 50021 | O1066: =MID(RC[-13],1,4)&"的灵魂碎片，是精灵【"&MID(RC[-13],1,4)&"】升星的材料，集齐"&RC[4]&"个可激活精灵【"&MID(RC[-13],1,4)&"】。" -> 暴风元灵的灵魂碎片，是精灵【暴风元灵】升星的材料，集齐90个可激活精灵【暴风元灵】。 | P1066: 999999 | Q1066: 1 | R1066: 50021 | S1066: 90 | X1066: 98 | AA1066: 1
A1067: 15022 | B1067: 大地之子碎片 | C1067: 50022 | D1067: 4 | E1067: 1 | F1067: 24 | G1067: 1 | H1067: 1 | I1067: 10 | J1067: 0 | K1067: 0 | L1067: 0 | N1067: 50022 | O1067: =MID(RC[-13],1,4)&"的灵魂碎片，是精灵【"&MID(RC[-13],1,4)&"】升星的材料，集齐"&RC[4]&"个可激活精灵【"&MID(RC[-13],1,4)&"】。" -> 大地之子的灵魂碎片，是精灵【大地之子】升星的材料，集齐90个可激活精灵【大地之子】。 | P1067: 999999 | Q1067: 1 | R1067: 50022 | S1067: 90 | X1067: 69 | AA1067: 1
A1068: 15031 | B1068: 花之妖精碎片 | C1068: 50031 | D1068: 4 | E1068: 1 | F1068: 24 | G1068: 1 | H1068: 1 | I1068: 10 | J1068: 0 | K1068: 0 | L1068: 0 | N1068: 50031 | O1068: =MID(RC[-13],1,4)&"的灵魂碎片，是精灵【"&MID(RC[-13],1,4)&"】升星的材料，集齐"&RC[4]&"个可激活精灵【"&MID(RC[-13],1,4)&"】。" -> 花之妖精的灵魂碎片，是精灵【花之妖精】升星的材料，集齐90个可激活精灵【花之妖精】。 | P1068: 999999 | Q1068: 1 | R1068: 50031 | S1068: 90 | X1068: 59 | AA1068: 1
A1069: 15032 | B1069: 森之古树碎片 | C1069: 50032 | D1069: 4 | E1069: 1 | F1069: 24 | G1069: 1 | H1069: 1 | I1069: 10 | J1069: 0 | K1069: 0 | L1069: 0 | N1069: 50032 | O1069: =MID(RC[-13],1,4)&"的灵魂碎片，是精灵【"&MID(RC[-13],1,4)&"】升星的材料，集齐"&RC[4]&"个可激活精灵【"&MID(RC[-13],1,4)&"】。" -> 森之古树的灵魂碎片，是精灵【森之古树】升星的材料，集齐90个可激活精灵【森之古树】。 | P1069: 999999 | Q1069: 1 | R1069: 50032 | S1069: 90 | AA1069: 1
A1070: 16600 | B1070: 500元充值礼包 | C1070: 13005 | D1070: 4 | E1070: 2 | F1070: 3 | G1070: 1 | H1070: 1 | I1070: 10 | J1070: 0 | K1070: 0 | L1070: 0 | N1070: 0 | O1070: 培养石*1000、觉醒药剂*1000、1级幽冥原石*1、任选橙色卡牌*1 | P1070: 999999 | Q1070: 1 | R1070: 0 | S1070: 0 | T1070: 10003|10004|80100|13340 | U1070: 1000|1000|1|1 | V1070: =RC[-1] -> 1000|1000|1|1 | AG1070: 1 | AH1070: 1 | AI1070: 1
A1071: 16601 | B1071: 1000元充值礼包 | C1071: 13005 | D1071: 4 | E1071: 2 | F1071: 3 | G1071: 1 | H1071: 1 | I1071: 10 | J1071: 0 | K1071: 0 | L1071: 0 | N1071: 0 | O1071: 培养石*2000、觉醒药剂*2000、1级幽冥原石*2、任选橙色卡牌*2 | P1071: 999999 | Q1071: 1 | R1071: 0 | S1071: 0 | T1071: 10003|10004|80100|13340 | U1071: 2000|2000|2|2 | V1071: =RC[-1] -> 2000|2000|2|2 | AG1071: 1 | AH1071: 1 | AI1071: 1
A1072: 16602 | B1072: 3000元充值礼包 | C1072: 13005 | D1072: 4 | E1072: 2 | F1072: 3 | G1072: 1 | H1072: 1 | I1072: 10 | J1072: 0 | K1072: 0 | L1072: 0 | N1072: 0 | O1072: 顶级红色装备*1、任选顶级圣器*1、任选顶级英雄*2、任选橙色卡牌*2 | P1072: 999999 | Q1072: 1 | R1072: 0 | S1072: 0 | T1072: 13393|13392|13384|13340 | U1072: 1|1|2|2 | V1072: =RC[-1] -> 1|1|2|2 | AG1072: 1 | AH1072: 1 | AI1072: 1
A1073: 16603 | B1073: 5000元充值礼包 | C1073: 13005 | D1073: 4 | E1073: 2 | F1073: 3 | G1073: 1 | H1073: 1 | I1073: 10 | J1073: 0 | K1073: 0 | L1073: 0 | N1073: 0 | O1073: 顶级红色装备*3、任选顶级圣器*3、任选顶级英雄*4、任选橙色卡牌*4 | P1073: 999999 | Q1073: 1 | R1073: 0 | S1073: 0 | T1073: 13393|13392|13384|13340 | U1073: 3|3|4|4 | V1073: =RC[-1] -> 3|3|4|4 | AG1073: 1 | AH1073: 1 | AI1073: 1
A1074: 16604 | B1074: 8000元充值礼包 | C1074: 13005 | D1074: 4 | E1074: 2 | F1074: 3 | G1074: 1 | H1074: 1 | I1074: 10 | J1074: 0 | K1074: 0 | L1074: 0 | N1074: 0 | O1074: 顶级红色套装装备*2、任选顶级圣器*5、任选顶级英雄*6、任选橙色卡牌*8 | P1074: 999999 | Q1074: 1 | R1074: 0 | S1074: 0 | T1074: 13389|13392|13384|13340 | U1074: 2|5|6|8 | V1074: =RC[-1] -> 2|5|6|8 | AG1074: 1 | AH1074: 1 | AI1074: 1
A1075: 16605 | B1075: 10000元充值礼包 | C1075: 13005 | D1075: 4 | E1075: 2 | F1075: 3 | G1075: 1 | H1075: 1 | I1075: 10 | J1075: 0 | K1075: 0 | L1075: 0 | N1075: 0 | O1075: 顶级红色套装装备*2、任选顶级圣器*10、任选顶级英雄*10、任选橙色卡牌*10 | P1075: 999999 | Q1075: 1 | R1075: 0 | S1075: 0 | T1075: 13389|13392|13384|13340 | U1075: 2|10|10|10 | V1075: =RC[-1] -> 2|10|10|10 | AG1075: 1 | AH1075: 1 | AI1075: 1
A1076: 16606 | B1076: 内测充值礼包 | C1076: 13005 | D1076: 4 | E1076: 2 | F1076: 3 | G1076: 1 | H1076: 1 | I1076: 10 | J1076: 0 | K1076: 0 | L1076: 0 | N1076: 0 | O1076: 1级幽冥原石*1、1级冰霜原石*1、1级生命原石*1 | P1076: 999999 | Q1076: 1 | R1076: 0 | S1076: 0 | T1076: 80100|80010|80000 | U1076: 1|1|1 | V1076: =RC[-1] -> 1|1|1 | AG1076: 1 | AH1076: 1 | AI1076: 1
A1077: 16607 | B1077: 首冲任意金额补偿礼包 | C1077: 13005 | D1077: 4 | E1077: 2 | F1077: 3 | G1077: 1 | H1077: 1 | I1077: 10 | J1077: 0 | K1077: 0 | L1077: 0 | N1077: 0 | O1077: 任选顶级英雄A*1、正义巨剑*1 | P1077: 999999 | Q1077: 1 | R1077: 0 | S1077: 0 | T1077: 13417|20401 | U1077: 1|1 | V1077: =RC[-1] -> 1|1 | AG1077: 1 | AH1077: 1 | AI1077: 1
A1078: 16608 | B1078: 首冲30元补偿礼包 | C1078: 13005 | D1078: 4 | E1078: 2 | F1078: 3 | G1078: 1 | H1078: 1 | I1078: 10 | J1078: 0 | K1078: 0 | L1078: 0 | N1078: 0 | O1078: 任选顶级英雄A*1、任选25资英雄*1、正义巨剑*1、踏浪长靴*1 | P1078: 999999 | Q1078: 1 | R1078: 0 | S1078: 0 | T1078: 13417|13379|20401|22401 | U1078: 1|1|1|1 | V1078: =RC[-1] -> 1|1|1|1 | AG1078: 1 | AH1078: 1 | AI1078: 1
A1079: 16609 | B1079: 首冲98元补偿礼包 | C1079: 13005 | D1079: 4 | E1079: 2 | F1079: 3 | G1079: 1 | H1079: 1 | I1079: 10 | J1079: 0 | K1079: 0 | L1079: 0 | N1079: 0 | O1079: 任选顶级英雄A*1、任选25资英雄*1、神圣复仇*1、地狱哀歌*1、任选红色装备*2 | P1079: 999999 | Q1079: 1 | R1079: 0 | S1079: 0 | T1079: 13417|13379|20501|21501|13393 | U1079: 1|1|1|1|2 | V1079: =RC[-1] -> 1|1|1|1|2 | AG1079: 1 | AH1079: 1 | AI1079: 1
A1080: 16610 | B1080: 首冲298元补偿礼包 | C1080: 13005 | D1080: 4 | E1080: 2 | F1080: 3 | G1080: 1 | H1080: 1 | I1080: 10 | J1080: 0 | K1080: 0 | L1080: 0 | N1080: 0 | O1080: 任选顶级英雄A*1、任选25资英雄*1、神圣复仇*1、地狱哀歌*1、任选红色装备*2、炼狱灵龙碎片*100、精灵升华超值礼包*5 | P1080: 999999 | Q1080: 1 | R1080: 0 | S1080: 0 | T1080: 13417|13379|20501|21501|13393|15011|13903 | U1080: 1|1|1|1|2|100|5 | V1080: =RC[-1] -> 1|1|1|1|2|100|5 | AG1080: 1 | AH1080: 1 | AI1080: 1
A1081: 19002 | B1081: 经验 | C1081: 19002 | D1081: 2 | E1081: 1 | F1081: 20 | G1081: 0 | H1081: 1 | I1081: 10 | J1081: 0 | K1081: 0 | L1081: 1 | N1081: 0 | O1081: 经验。 | P1081: 999999 | Q1081: 1 | R1081: 2 | S1081: 1
A1082: 19003 | B1082: 金币 | C1082: 19003 | D1082: 2 | E1082: 1 | F1082: 20 | G1082: 0 | H1082: 1 | I1082: 10 | J1082: 0 | K1082: 0 | L1082: 1 | N1082: 0 | O1082: 贵金属锻造的货币，商品流通和交易的基础。 | P1082: 999999 | Q1082: 1 | R1082: 3 | S1082: 1 | X1082: 54|12|11|997|2
A1083: 19005 | B1083: 钻石 | C1083: 19005 | D1083: 2 | E1083: 1 | F1083: 20 | G1083: 0 | H1083: 1 | I1083: 10 | J1083: 0 | K1083: 0 | L1083: 1 | N1083: 0 | O1083: 实质是大量魔力汇聚成的高脆性高硬度物质，价值极高。 | P1083: 999999 | Q1083: 1 | R1083: 5 | S1083: 1
A1084: 19006 | B1084: 魂晶 | C1084: 19006 | D1084: 2 | E1084: 1 | F1084: 20 | G1084: 0 | H1084: 1 | I1084: 10 | J1084: 0 | K1084: 0 | L1084: 1 | N1084: 0 | O1084: 完全洗清了杂质的纯粹灵魂结晶，魂晶商店交易的专用货币。 | P1084: 999999 | Q1084: 1 | R1084: 6 | S1084: 1 | X1084: 23|998
A1085: 19012 | B1085: 威名 | C1085: 19012 | D1085: 2 | E1085: 1 | F1085: 20 | G1085: 0 | H1085: 1 | I1085: 10 | J1085: 0 | K1085: 0 | L1085: 1 | N1085: 0 | O1085: 进行勇者试练后由管理者记录获得的威名值，神装商店交易的专用货币。 | P1085: 999999 | Q1085: 1 | R1085: 12 | S1085: 1 | X1085: 17
A1086: 19013 | B1086: 声望 | C1086: 19013 | D1086: 2 | E1086: 1 | F1086: 20 | G1086: 0 | H1086: 1 | I1086: 10 | J1086: 0 | K1086: 0 | L1086: 1 | N1086: 0 | O1086: 进行竞技后由管理者记录获得的声望值，声望商店交易的专用货币。 | P1086: 999999 | Q1086: 1 | R1086: 13 | S1086: 1 | X1086: 21
A1087: 19014 | B1087: 战功 | C1087: 19014 | D1087: 2 | E1087: 1 | F1087: 20 | G1087: 0 | H1087: 1 | I1087: 10 | J1087: 0 | K1087: 0 | L1087: 1 | N1087: 0 | O1087: 击败异度入侵的怪物后获得的战功，战功商店兑换物品的专用货币。 | P1087: 999999 | Q1087: 1 | R1087: 14 | S1087: 1 | X1087: 16
A1088: 19015 | B1088: 讨伐令 | C1088: 19015 | D1088: 2 | E1088: 1 | F1088: 20 | G1088: 0 | H1088: 1 | I1088: 10 | J1088: 0 | K1088: 0 | L1088: 1 | N1088: 0 | O1088: 讨伐令 | P1088: 999999 | Q1088: 1 | R1088: 15 | S1088: 1
A1089: 19017 | B1089: 神魂 | C1089: 19017 | D1089: 2 | E1089: 1 | F1089: 20 | G1089: 0 | H1089: 1 | I1089: 10 | J1089: 0 | K1089: 0 | L1089: 1 | N1089: 0 | O1089: 通过战胜精英副本中的怪物，吸取获得的神魂，觉醒商店交易的专用货币。 | P1089: 999999 | Q1089: 1 | R1089: 17 | S1089: 1 | X1089: 123
A1090: 19020 | B1090: 军团贡献 | C1090: 19020 | D1090: 2 | E1090: 1 | F1090: 20 | G1090: 0 | H1090: 1 | I1090: 10 | J1090: 0 | K1090: 0 | L1090: 1 | N1090: 0 | O1090: 对军团作出贡献后由管理者记录获得的贡献值，军团商店交易的专用货币。 | P1090: 999999 | Q1090: 1 | R1090: 20 | S1090: 1
A1091: 19021 | B1091: 贵宾经验 | C1091: 19021 | D1091: 2 | E1091: 1 | F1091: 20 | G1091: 0 | H1091: 1 | I1091: 10 | J1091: 0 | K1091: 0 | L1091: 1 | N1091: 0 | O1091: 贵宾经验。 | P1091: 999999 | Q1091: 1 | R1091: 21 | S1091: 1
A1092: 19025 | B1092: 荣誉 | C1092: 19025 | D1092: 2 | E1092: 1 | F1092: 20 | G1092: 0 | H1092: 1 | I1092: 10 | J1092: 0 | K1092: 0 | L1092: 1 | N1092: 0 | O1092: 荣誉角斗场中获得的荣誉，可用于荣誉商店兑换。 | P1092: 999999 | Q1092: 1 | R1092: 25 | S1092: 1
A1093: 19026 | B1093: 友情点 | C1093: 19026 | D1093: 2 | E1093: 1 | F1093: 20 | G1093: 0 | H1093: 1 | I1093: 10 | J1093: 0 | K1093: 0 | L1093: 1 | N1093: 0 | O1093: 与好友一同战斗获得的友情的象征，可用于初级招募。 | P1093: 999999 | Q1093: 1 | R1093: 26 | S1093: 1
A1094: 19028 | B1094: 无尽石 | C1094: 19028 | D1094: 2 | E1094: 1 | F1094: 20 | G1094: 0 | H1094: 1 | I1094: 10 | J1094: 0 | K1094: 0 | L1094: 1 | N1094: 0 | O1094: 从无尽之地收集到的特殊石头，无尽商店交易的专用货币。 | P1094: 999999 | Q1094: 1 | R1094: 28 | S1094: 1
A1095: 19030 | B1095: 原石碎屑 | C1095: 19030 | D1095: 2 | E1095: 1 | F1095: 20 | G1095: 0 | H1095: 1 | I1095: 10 | J1095: 0 | K1095: 0 | L1095: 1 | N1095: 0 | O1095: 原石分解之后产生的碎屑，原石商店交易的专用货币。 | P1095: 999999 | Q1095: 1 | R1095: 30 | S1095: 1
A1096: 19031 | B1096: 命运硬币 | C1096: 19031 | D1096: 2 | E1096: 1 | F1096: 20 | G1096: 0 | H1096: 1 | I1096: 10 | J1096: 0 | K1096: 0 | L1096: 1 | N1096: 0 | O1096: 用于命运商店购买商品的货币。通过占卜翻牌获得 | P1096: 999999 | Q1096: 1 | R1096: 31 | S1096: 1 | X1096: 113
A1097: 19032 | B1097: 星魂 | C1097: 19032 | D1097: 2 | E1097: 1 | F1097: 20 | G1097: 0 | H1097: 1 | I1097: 10 | J1097: 0 | K1097: 0 | L1097: 1 | N1097: 0 | O1097: 用于星魂商店购买商品的货币。可以通过分解卡牌获得 | P1097: 999999 | Q1097: 1 | R1097: 32 | S1097: 1 | X1097: 23
A1098: 19033 | B1098: 彩晶 | C1098: 19033 | D1098: 2 | E1098: 1 | F1098: 20 | G1098: 0 | H1098: 1 | I1098: 10 | J1098: 0 | K1098: 0 | L1098: 1 | N1098: 0 | O1098: 用于彩晶商店购买稀有道具的货币。可以通过豪华签到获得 | P1098: 999999 | Q1098: 1 | R1098: 33 | S1098: 1 | X1098: 143
A1099: 19034 | B1099: 高能水晶 | C1099: 19035 | D1099: 2 | E1099: 1 | F1099: 20 | G1099: 0 | H1099: 1 | I1099: 10 | J1099: 0 | K1099: 0 | L1099: 1 | N1099: 0 | O1099: 用于跨服商店购买物品 | P1099: 999999 | Q1099: 1 | R1099: 34 | S1099: 1
A1100: 19102 | B1100: 经验 | C1100: 19002 | D1100: 2 | E1100: 1 | F1100: 20 | G1100: 0 | H1100: 1 | I1100: 10 | J1100: 0 | K1100: 0 | L1100: 1 | N1100: 0 | O1100: 经验。 | P1100: 999999 | Q1100: 1 | R1100: 2 | S1100: 10000
A1101: 19103 | B1101: 金币 | C1101: 19003 | D1101: 2 | E1101: 1 | F1101: 20 | G1101: 0 | H1101: 1 | I1101: 10 | J1101: 0 | K1101: 0 | L1101: 1 | N1101: 0 | O1101: 贵金属锻造的货币，商品流通和交易的基础。 | P1101: 999999 | Q1101: 1 | R1101: 3 | S1101: 10000
A1102: 19105 | B1102: 钻石 | C1102: 19005 | D1102: 2 | E1102: 1 | F1102: 20 | G1102: 0 | H1102: 1 | I1102: 10 | J1102: 0 | K1102: 0 | L1102: 1 | N1102: 0 | O1102: 实质是大量魔力汇聚成的高脆性高硬度物质，价值极高。 | P1102: 999999 | Q1102: 1 | R1102: 5 | S1102: 10000
A1103: 19106 | B1103: 魂晶 | C1103: 19006 | D1103: 2 | E1103: 1 | F1103: 20 | G1103: 0 | H1103: 1 | I1103: 10 | J1103: 0 | K1103: 0 | L1103: 1 | N1103: 0 | O1103: 完全洗清了杂质的纯粹灵魂结晶，魂晶商店交易的专用货币。 | P1103: 999999 | Q1103: 1 | R1103: 6 | S1103: 10000
A1104: 19112 | B1104: 威名 | C1104: 19012 | D1104: 2 | E1104: 1 | F1104: 20 | G1104: 0 | H1104: 1 | I1104: 10 | J1104: 0 | K1104: 0 | L1104: 1 | N1104: 0 | O1104: 进行勇者试练后由管理者记录获得的威名值，神装商店交易的专用货币。 | P1104: 999999 | Q1104: 1 | R1104: 12 | S1104: 10000
A1105: 19113 | B1105: 声望 | C1105: 19013 | D1105: 2 | E1105: 1 | F1105: 20 | G1105: 0 | H1105: 1 | I1105: 10 | J1105: 0 | K1105: 0 | L1105: 1 | N1105: 0 | O1105: 进行竞技后由管理者记录获得的声望值，声望商店交易的专用货币。 | P1105: 999999 | Q1105: 1 | R1105: 13 | S1105: 10000
A1106: 19114 | B1106: 战功 | C1106: 19014 | D1106: 2 | E1106: 1 | F1106: 20 | G1106: 0 | H1106: 1 | I1106: 10 | J1106: 0 | K1106: 0 | L1106: 1 | N1106: 0 | O1106: 击败异度入侵的怪物后获得的战功，战功商店兑换物品的专用货币。 | P1106: 999999 | Q1106: 1 | R1106: 14 | S1106: 10000
A1107: 19115 | B1107: 讨伐令 | C1107: 19015 | D1107: 2 | E1107: 1 | F1107: 20 | G1107: 0 | H1107: 1 | I1107: 10 | J1107: 0 | K1107: 0 | L1107: 1 | N1107: 0 | O1107: 讨伐令 | P1107: 999999 | Q1107: 1 | R1107: 15 | S1107: 10000
A1108: 19117 | B1108: 神魂 | C1108: 19017 | D1108: 2 | E1108: 1 | F1108: 20 | G1108: 0 | H1108: 1 | I1108: 10 | J1108: 0 | K1108: 0 | L1108: 1 | N1108: 0 | O1108: 通过战胜精英副本中的怪物，吸取获得的神魂，觉醒商店交易的专用货币。 | P1108: 999999 | Q1108: 1 | R1108: 17 | S1108: 10000
A1109: 19120 | B1109: 军团贡献 | C1109: 19020 | D1109: 2 | E1109: 1 | F1109: 20 | G1109: 0 | H1109: 1 | I1109: 10 | J1109: 0 | K1109: 0 | L1109: 1 | N1109: 0 | O1109: 对军团作出贡献后由管理者记录获得的贡献值，军团商店交易的专用货币。 | P1109: 999999 | Q1109: 1 | R1109: 20 | S1109: 10000
A1110: 19121 | B1110: 贵宾经验 | C1110: 19021 | D1110: 2 | E1110: 1 | F1110: 20 | G1110: 0 | H1110: 1 | I1110: 10 | J1110: 0 | K1110: 0 | L1110: 1 | N1110: 0 | O1110: 贵宾经验。 | P1110: 999999 | Q1110: 1 | R1110: 21 | S1110: 10000
A1111: 19125 | B1111: 荣誉 | C1111: 19025 | D1111: 2 | E1111: 1 | F1111: 20 | G1111: 0 | H1111: 1 | I1111: 10 | J1111: 0 | K1111: 0 | L1111: 1 | N1111: 0 | O1111: 荣誉角斗场中获得的荣誉，可用于荣誉商店兑换。 | P1111: 999999 | Q1111: 1 | R1111: 25 | S1111: 10000
A1112: 19126 | B1112: 友情点 | C1112: 19026 | D1112: 2 | E1112: 1 | F1112: 20 | G1112: 0 | H1112: 1 | I1112: 10 | J1112: 0 | K1112: 0 | L1112: 1 | N1112: 0 | O1112: 与好友一同战斗获得的友情的象征，可用于初级招募。 | P1112: 999999 | Q1112: 1 | R1112: 26 | S1112: 10000
A1113: 19128 | B1113: 无尽石 | C1113: 19028 | D1113: 2 | E1113: 1 | F1113: 20 | G1113: 0 | H1113: 1 | I1113: 10 | J1113: 0 | K1113: 0 | L1113: 1 | N1113: 0 | O1113: 从无尽之地收集到的特殊石头，无尽商店交易的专用货币。 | P1113: 999999 | Q1113: 1 | R1113: 28 | S1113: 10000
A1114: 19130 | B1114: 原石碎屑 | C1114: 19030 | D1114: 2 | E1114: 1 | F1114: 20 | G1114: 0 | H1114: 1 | I1114: 10 | J1114: 0 | K1114: 0 | L1114: 1 | N1114: 0 | O1114: 原石分解之后产生的碎屑，原石商店交易的专用货币。 | P1114: 999999 | Q1114: 1 | R1114: 30 | S1114: 10000
A1115: 19131 | B1115: 命运硬币 | C1115: 19031 | D1115: 2 | E1115: 1 | F1115: 20 | G1115: 0 | H1115: 1 | I1115: 10 | J1115: 0 | K1115: 0 | L1115: 1 | N1115: 0 | O1115: 用于命运商店购买商品的货币。通过占卜翻牌获得 | P1115: 999999 | Q1115: 1 | R1115: 31 | S1115: 10000
A1116: 19132 | B1116: 星魂 | C1116: 19032 | D1116: 2 | E1116: 1 | F1116: 20 | G1116: 0 | H1116: 1 | I1116: 10 | J1116: 0 | K1116: 0 | L1116: 1 | N1116: 0 | O1116: 用于星魂商店购买商品的货币。可以通过分解卡牌获得 | P1116: 999999 | Q1116: 1 | R1116: 32 | S1116: 10000
A1117: 19133 | B1117: 彩晶 | C1117: 19033 | D1117: 2 | E1117: 1 | F1117: 20 | G1117: 0 | H1117: 1 | I1117: 10 | J1117: 0 | K1117: 0 | L1117: 1 | N1117: 0 | O1117: 用于彩晶商店购买稀有道具的货币。可以通过豪华签到获得 | P1117: 999999 | Q1117: 1 | R1117: 33 | S1117: 10000
A1118: 19134 | B1118: 高能水晶 | C1118: 19035 | D1118: 2 | E1118: 1 | F1118: 20 | G1118: 0 | H1118: 1 | I1118: 10 | J1118: 0 | K1118: 0 | L1118: 1 | N1118: 0 | O1118: 用于跨服商店购买物品 | P1118: 999999 | Q1118: 1 | R1118: 34 | S1118: 10000
A1119: 19905 | B1119: 钻石 | C1119: 19905 | D1119: 2 | E1119: 1 | F1119: 20 | G1119: 0 | H1119: 1 | I1119: 10 | J1119: 0 | K1119: 0 | L1119: 1 | N1119: 0 | O1119: 实质是大量魔力汇聚成的高脆性高硬度物质，价值极高。 | P1119: 999999 | Q1119: 1 | R1119: 5 | S1119: 1